2026-05-19 19:25:19,826 - optuna.study.study - INFO - Trial 45 finished with value: 0.073995792886814 and parameters: {'n_layers': 1, 'embedding_dim': 256, 'lr': 0.0047708629854036014, 'lambda_val': 0.00030456596024977154, 'batch_size': 1436, 'optimizer': 'Adam'}. Best is trial 34 with value: 0.09103696294173279.
2026-05-19 19:25:28,329 - experiment_functions - INFO - Early stopping at epoch 1450. Best Recall: 0.0836
2026-05-19 19:25:28,430 - optuna.study.study - INFO - Trial 46 finished with value: 0.08364006224648547 and parameters: {'n_layers': 1, 'embedding_dim': 128, 'lr': 0.0023840303562994297, 'lambda_val': 5.1066806997798625e-05, 'batch_size': 1864, 'optimizer': 'Adam'}. Best is trial 34 with value: 0.09103696294173279.
2026-05-19 19:25:37,893 - optuna.study._optimize - INFO - Trial 47 pruned. 
2026-05-19 19:25:41,839 - experiment_functions - INFO - Early stopping at epoch 600. Best Recall: 0.0672
2026-05-19 19:25:41,975 - optuna.study.study - INFO - Trial 48 finished with value: 0.06716128030642025 and parameters: {'n_layers': 1, 'embedding_dim': 128, 'lr': 0.004365454141004191, 'lambda_val': 5.529636936498751e-05, 'batch_size': 1903, 'optimizer': 'Adam'}. Best is trial 34 with value: 0.09103696294173279.
2026-05-19 19:25:46,297 - experiment_functions - INFO - Early stopping at epoch 600. Best Recall: 0.0545
2026-05-19 19:25:46,387 - optuna.study.study - INFO - Trial 49 finished with value: 0.05448226565006075 and parameters: {'n_layers': 2, 'embedding_dim': 128, 'lr': 0.0019817987872442593, 'lambda_val': 0.0011961665882351574, 'batch_size': 2097, 'optimizer': 'Adam'}. Best is trial 34 with value: 0.09103696294173279.
2026-05-19 19:25:51,981 - experiment_functions - INFO - Early stopping at epoch 650. Best Recall: 0.0332
2026-05-19 19:25:52,082 - optuna.study.study - INFO - Trial 50 finished with value: 0.033230861651265986 and parameters: {'n_layers': 4, 'embedding_dim': 96, 'lr': 0.0009379357194650193, 'lambda_val': 0.00021382260113743395, 'batch_size': 1721, 'optimizer': 'Adam'}. Best is trial 34 with value: 0.09103696294173279.
2026-05-19 19:25:57,651 - experiment_functions - INFO - Early stopping at epoch 900. Best Recall: 0.0691
2026-05-19 19:25:57,751 - optuna.study.study - INFO - Trial 51 finished with value: 0.06914338447757842 and parameters: {'n_layers': 1, 'embedding_dim': 128, 'lr': 0.004456929348487263, 'lambda_val': 2.080247833234322e-05, 'batch_size': 1522, 'optimizer': 'Adam'}. Best is trial 34 with value: 0.09103696294173279.
2026-05-19 19:26:08,311 - experiment_functions - INFO - Early stopping at epoch 1650. Best Recall: 0.0824
2026-05-19 19:26:08,401 - optuna.study.study - INFO - Trial 52 finished with value: 0.08239665767118004 and parameters: {'n_layers': 1, 'embedding_dim': 256, 'lr': 0.001433636249131658, 'lambda_val': 0.000205194942162804, 'batch_size': 1643, 'optimizer': 'Adam'}. Best is trial 34 with value: 0.09103696294173279.
2026-05-19 19:26:16,900 - experiment_functions - INFO - Early stopping at epoch 1250. Best Recall: 0.0859
2026-05-19 19:26:17,035 - optuna.study.study - INFO - Trial 53 finished with value: 0.08586855513568346 and parameters: {'n_layers': 1, 'embedding_dim': 256, 'lr': 0.0013272751590503072, 'lambda_val': 5.7205232853694855e-05, 'batch_size': 1876, 'optimizer': 'Adam'}. Best is trial 34 with value: 0.09103696294173279.
2026-05-19 19:26:24,407 - optuna.study._optimize - INFO - Trial 54 pruned. 
2026-05-19 19:26:31,167 - optuna.study._optimize - INFO - Trial 55 pruned. 
2026-05-19 19:26:34,335 - experiment_functions - INFO - Early stopping at epoch 500. Best Recall: 0.0020
2026-05-19 19:26:34,425 - optuna.study.study - INFO - Trial 56 finished with value: 0.001969802141641795 and parameters: {'n_layers': 1, 'embedding_dim': 96, 'lr': 0.011248240030603297, 'lambda_val': 0.000575465743278332, 'batch_size': 2120, 'optimizer': 'SGD'}. Best is trial 34 with value: 0.09103696294173279.
2026-05-19 19:26:39,039 - experiment_functions - INFO - Early stopping at epoch 550. Best Recall: 0.0673
2026-05-19 19:26:39,175 - optuna.study.study - INFO - Trial 57 finished with value: 0.06729879194463304 and parameters: {'n_layers': 1, 'embedding_dim': 256, 'lr': 0.008232498510464866, 'lambda_val': 0.00016413196028310076, 'batch_size': 2369, 'optimizer': 'Adam'}. Best is trial 34 with value: 0.09103696294173279.
2026-05-19 19:26:44,898 - experiment_functions - INFO - Early stopping at epoch 900. Best Recall: 0.0668
2026-05-19 19:26:45,076 - optuna.study.study - INFO - Trial 58 finished with value: 0.06684619620116572 and parameters: {'n_layers': 1, 'embedding_dim': 64, 'lr': 0.0018024725382467098, 'lambda_val': 2.063887862086211e-05, 'batch_size': 1841, 'optimizer': 'Adam'}. Best is trial 34 with value: 0.09103696294173279.
2026-05-19 19:26:49,155 - experiment_functions - INFO - Early stopping at epoch 550. Best Recall: 0.0538
2026-05-19 19:26:49,247 - optuna.study.study - INFO - Trial 59 finished with value: 0.053767775025199416 and parameters: {'n_layers': 2, 'embedding_dim': 128, 'lr': 0.0032844254901138233, 'lambda_val': 3.807044333933165e-05, 'batch_size': 1696, 'optimizer': 'Adam'}. Best is trial 34 with value: 0.09103696294173279.
2026-05-19 19:27:01,338 - experiment_functions - INFO - Early stopping at epoch 1900. Best Recall: 0.0948
2026-05-19 19:27:01,440 - optuna.study.study - INFO - Trial 60 finished with value: 0.09483159564833794 and parameters: {'n_layers': 1, 'embedding_dim': 256, 'lr': 0.001223471072495269, 'lambda_val': 1.5667421332232928e-05, 'batch_size': 1493, 'optimizer': 'Adam'}. Best is trial 60 with value: 0.09483159564833794.
2026-05-19 19:27:26,205 - experiment_functions - INFO - Early stopping at epoch 2000. Best Recall: 0.0918
2026-05-19 19:27:26,325 - optuna.study.study - INFO - Trial 61 finished with value: 0.09183391703262389 and parameters: {'n_layers': 1, 'embedding_dim': 256, 'lr': 0.0010055116867436896, 'lambda_val': 1.6145124575654028e-05, 'batch_size': 1485, 'optimizer': 'Adam'}. Best is trial 60 with value: 0.09483159564833794.
2026-05-19 19:27:36,029 - optuna.study._optimize - INFO - Trial 62 pruned. 
2026-05-19 19:27:41,657 - experiment_functions - INFO - Early stopping at epoch 850. Best Recall: 0.0301
2026-05-19 19:27:41,748 - optuna.study.study - INFO - Trial 63 finished with value: 0.030124127119853246 and parameters: {'n_layers': 1, 'embedding_dim': 256, 'lr': 0.0006920295077770697, 'lambda_val': 0.08134931558248609, 'batch_size': 1526, 'optimizer': 'Adam'}. Best is trial 60 with value: 0.09483159564833794.
2026-05-19 19:27:49,583 - optuna.study._optimize - INFO - Trial 64 pruned. 
2026-05-19 19:27:56,702 - optuna.study._optimize - INFO - Trial 65 pruned. 
2026-05-19 19:28:05,433 - experiment_functions - INFO - Early stopping at epoch 1300. Best Recall: 0.0827
2026-05-19 19:28:05,525 - optuna.study.study - INFO - Trial 66 finished with value: 0.08266490516338877 and parameters: {'n_layers': 1, 'embedding_dim': 256, 'lr': 0.0017213508500536034, 'lambda_val': 1.66452964320268e-05, 'batch_size': 2007, 'optimizer': 'Adam'}. Best is trial 60 with value: 0.09483159564833794.
2026-05-19 19:28:18,743 - experiment_functions - INFO - Early stopping at epoch 2100. Best Recall: 0.0877
2026-05-19 19:28:18,833 - optuna.study.study - INFO - Trial 67 finished with value: 0.08769725463830655 and parameters: {'n_layers': 1, 'embedding_dim': 256, 'lr': 0.0008612383974400378, 'lambda_val': 2.89794601538521e-05, 'batch_size': 1642, 'optimizer': 'Adam'}. Best is trial 60 with value: 0.09483159564833794.
2026-05-19 19:28:25,394 - optuna.study._optimize - INFO - Trial 68 pruned. 
2026-05-19 19:28:29,494 - experiment_functions - INFO - Early stopping at epoch 500. Best Recall: 0.0020
2026-05-19 19:28:29,608 - optuna.study.study - INFO - Trial 69 finished with value: 0.0019823876078758668 and parameters: {'n_layers': 2, 'embedding_dim': 256, 'lr': 0.003479103168378674, 'lambda_val': 2.8339932536865695e-05, 'batch_size': 1470, 'optimizer': 'SGD'}. Best is trial 60 with value: 0.09483159564833794.
2026-05-19 19:28:36,891 - optuna.study._optimize - INFO - Trial 70 pruned. 
2026-05-19 19:28:43,887 - optuna.study._optimize - INFO - Trial 71 pruned. 
2026-05-19 19:28:58,542 - experiment_functions - INFO - Early stopping at epoch 2200. Best Recall: 0.0888
2026-05-19 19:28:58,685 - optuna.study.study - INFO - Trial 72 finished with value: 0.08877821666142108 and parameters: {'n_layers': 1, 'embedding_dim': 256, 'lr': 0.0011963571872665823, 'lambda_val': 1.7368861954214808e-05, 'batch_size': 1346, 'optimizer': 'Adam'}. Best is trial 60 with value: 0.09483159564833794.
2026-05-19 19:29:13,110 - experiment_functions - INFO - Early stopping at epoch 1750. Best Recall: 0.0926
2026-05-19 19:29:13,221 - optuna.study.study - INFO - Trial 73 finished with value: 0.09261249574639693 and parameters: {'n_layers': 1, 'embedding_dim': 256, 'lr': 0.0011266639050371888, 'lambda_val': 4.248382789423149e-05, 'batch_size': 1688, 'optimizer': 'Adam'}. Best is trial 60 with value: 0.09483159564833794.
2026-05-19 19:29:31,290 - experiment_functions - INFO - Early stopping at epoch 2450. Best Recall: 0.0941
2026-05-19 19:29:31,379 - optuna.study.study - INFO - Trial 74 finished with value: 0.0941089873432869 and parameters: {'n_layers': 1, 'embedding_dim': 256, 'lr': 0.001011774643883231, 'lambda_val': 3.642032484062406e-05, 'batch_size': 1133, 'optimizer': 'Adam'}. Best is trial 60 with value: 0.09483159564833794.
2026-05-19 19:29:43,836 - experiment_functions - INFO - Early stopping at epoch 2000. Best Recall: 0.0941
2026-05-19 19:29:44,192 - optuna.study.study - INFO - Trial 75 finished with value: 0.09407734468470445 and parameters: {'n_layers': 1, 'embedding_dim': 256, 'lr': 0.0009837326661410203, 'lambda_val': 1.626649478597967e-05, 'batch_size': 1161, 'optimizer': 'Adam'}. Best is trial 60 with value: 0.09483159564833794.
2026-05-19 19:29:51,311 - experiment_functions - INFO - Early stopping at epoch 900. Best Recall: 0.0378
2026-05-19 19:29:51,421 - optuna.study.study - INFO - Trial 76 finished with value: 0.03784513589381877 and parameters: {'n_layers': 4, 'embedding_dim': 96, 'lr': 0.0005777603375902942, 'lambda_val': 1.590650073454853e-05, 'batch_size': 1119, 'optimizer': 'Adam'}. Best is trial 60 with value: 0.09483159564833794.
2026-05-19 19:29:57,546 - experiment_functions - INFO - Early stopping at epoch 900. Best Recall: 0.0799
2026-05-19 19:29:57,637 - optuna.study.study - INFO - Trial 77 finished with value: 0.07986684669605851 and parameters: {'n_layers': 1, 'embedding_dim': 256, 'lr': 0.001085626991603085, 'lambda_val': 5.662978893406985e-06, 'batch_size': 968, 'optimizer': 'Adam'}. Best is trial 60 with value: 0.09483159564833794.
2026-05-19 19:30:04,574 - optuna.study._optimize - INFO - Trial 78 pruned. 
2026-05-19 19:30:14,735 - optuna.study._optimize - INFO - Trial 79 pruned. 
2026-05-19 19:30:21,324 - experiment_functions - INFO - Early stopping at epoch 850. Best Recall: 0.0523
2026-05-19 19:30:21,434 - optuna.study.study - INFO - Trial 80 finished with value: 0.05233696814892576 and parameters: {'n_layers': 2, 'embedding_dim': 64, 'lr': 0.0011874336410826062, 'lambda_val': 3.740629228876347e-06, 'batch_size': 699, 'optimizer': 'Adam'}. Best is trial 60 with value: 0.09483159564833794.
2026-05-19 19:30:28,523 - optuna.study._optimize - INFO - Trial 81 pruned. 
2026-05-19 19:30:35,584 - optuna.study._optimize - INFO - Trial 82 pruned. 
2026-05-19 19:30:42,424 - optuna.study._optimize - INFO - Trial 83 pruned. 
2026-05-19 19:30:49,362 - optuna.study._optimize - INFO - Trial 84 pruned. 
2026-05-19 19:30:57,237 - optuna.study._optimize - INFO - Trial 85 pruned. 
2026-05-19 19:31:05,854 - optuna.study._optimize - INFO - Trial 86 pruned. 
2026-05-19 19:31:09,576 - experiment_functions - INFO - Early stopping at epoch 500. Best Recall: 0.0028
2026-05-19 19:31:09,667 - optuna.study.study - INFO - Trial 87 finished with value: 0.0028207903325594245 and parameters: {'n_layers': 1, 'embedding_dim': 256, 'lr': 0.0005084021666252717, 'lambda_val': 3.169675230425645e-05, 'batch_size': 1643, 'optimizer': 'SGD'}. Best is trial 60 with value: 0.09483159564833794.
2026-05-19 19:31:15,714 - optuna.study._optimize - INFO - Trial 88 pruned. 
2026-05-19 19:31:29,259 - experiment_functions - INFO - Early stopping at epoch 2150. Best Recall: 0.0906
2026-05-19 19:31:29,348 - optuna.study.study - INFO - Trial 89 finished with value: 0.09057846854824879 and parameters: {'n_layers': 1, 'embedding_dim': 256, 'lr': 0.0013132506364540576, 'lambda_val': 1.7522364013019908e-05, 'batch_size': 1006, 'optimizer': 'Adam'}. Best is trial 60 with value: 0.09483159564833794.
2026-05-19 19:31:38,080 - optuna.study._optimize - INFO - Trial 90 pruned. 
2026-05-19 19:31:45,073 - optuna.study._optimize - INFO - Trial 91 pruned. 
2026-05-19 19:31:55,380 - optuna.study._optimize - INFO - Trial 92 pruned. 
2026-05-19 19:32:02,252 - experiment_functions - INFO - Early stopping at epoch 950. Best Recall: 0.0866
2026-05-19 19:32:02,388 - optuna.study.study - INFO - Trial 93 finished with value: 0.0865652316811177 and parameters: {'n_layers': 1, 'embedding_dim': 256, 'lr': 0.002709592779337698, 'lambda_val': 8.953228620636877e-06, 'batch_size': 776, 'optimizer': 'Adam'}. Best is trial 60 with value: 0.09483159564833794.
2026-05-19 19:32:09,048 - optuna.study._optimize - INFO - Trial 94 pruned. 
2026-05-19 19:32:14,181 - experiment_functions - INFO - Early stopping at epoch 500. Best Recall: 0.0024
2026-05-19 19:32:14,281 - optuna.study.study - INFO - Trial 95 finished with value: 0.002426841785921661 and parameters: {'n_layers': 1, 'embedding_dim': 256, 'lr': 1.2480662288134474e-05, 'lambda_val': 2.5235938106436172e-05, 'batch_size': 1400, 'optimizer': 'Adam'}. Best is trial 60 with value: 0.09483159564833794.
2026-05-19 19:32:19,379 - experiment_functions - INFO - Early stopping at epoch 650. Best Recall: 0.0426
2026-05-19 19:32:19,469 - optuna.study.study - INFO - Trial 96 finished with value: 0.042640014761601695 and parameters: {'n_layers': 3, 'embedding_dim': 96, 'lr': 0.0010188544542155556, 'lambda_val': 4.942497803913168e-05, 'batch_size': 1173, 'optimizer': 'Adam'}. Best is trial 60 with value: 0.09483159564833794.
2026-05-19 19:32:26,274 - optuna.study._optimize - INFO - Trial 97 pruned. 
2026-05-19 19:32:33,114 - optuna.study._optimize - INFO - Trial 98 pruned. 
2026-05-19 19:32:38,297 - experiment_functions - INFO - Early stopping at epoch 800. Best Recall: 0.0743
2026-05-19 19:32:38,445 - optuna.study.study - INFO - Trial 99 finished with value: 0.07430378299065217 and parameters: {'n_layers': 1, 'embedding_dim': 64, 'lr': 0.0013229936307070126, 'lambda_val': 6.87293177564176e-05, 'batch_size': 1773, 'optimizer': 'RMSprop'}. Best is trial 60 with value: 0.09483159564833794.
2026-05-19 19:32:47,705 - optuna.study._optimize - INFO - Trial 100 pruned. 
2026-05-19 19:32:51,925 - experiment_functions - INFO - Early stopping at epoch 550. Best Recall: 0.0633
2026-05-19 19:32:52,025 - optuna.study.study - INFO - Trial 101 finished with value: 0.06333751370218561 and parameters: {'n_layers': 1, 'embedding_dim': 256, 'lr': 0.005636250850645657, 'lambda_val': 0.0009796552133302032, 'batch_size': 1459, 'optimizer': 'Adam'}. Best is trial 60 with value: 0.09483159564833794.
2026-05-19 19:32:59,116 - optuna.study._optimize - INFO - Trial 102 pruned. 
2026-05-19 19:33:10,707 - optuna.study._optimize - INFO - Trial 103 pruned. 
2026-05-19 19:33:17,305 - optuna.study._optimize - INFO - Trial 104 pruned. 
2026-05-19 19:33:24,752 - optuna.study._optimize - INFO - Trial 105 pruned. 
2026-05-19 19:33:29,745 - experiment_functions - INFO - Early stopping at epoch 500. Best Recall: 0.0010
2026-05-19 19:33:29,845 - optuna.study.study - INFO - Trial 106 finished with value: 0.0009504249254276631 and parameters: {'n_layers': 1, 'embedding_dim': 32, 'lr': 0.001141648336417104, 'lambda_val': 0.00014185547231188015, 'batch_size': 895, 'optimizer': 'SGD'}. Best is trial 60 with value: 0.09483159564833794.
2026-05-19 19:33:37,907 - experiment_functions - INFO - Early stopping at epoch 1150. Best Recall: 0.0845
2026-05-19 19:33:38,016 - optuna.study.study - INFO - Trial 107 finished with value: 0.08454044813506734 and parameters: {'n_layers': 1, 'embedding_dim': 256, 'lr': 0.001800245782365331, 'lambda_val': 4.678149174176859e-05, 'batch_size': 1291, 'optimizer': 'Adam'}. Best is trial 60 with value: 0.09483159564833794.
2026-05-19 19:33:45,964 - optuna.study._optimize - INFO - Trial 108 pruned. 
2026-05-19 19:33:52,693 - optuna.study._optimize - INFO - Trial 109 pruned. 
2026-05-19 19:33:59,942 - optuna.study._optimize - INFO - Trial 110 pruned. 
2026-05-19 19:34:15,997 - optuna.study._optimize - INFO - Trial 111 pruned. 
2026-05-19 19:34:22,706 - optuna.study._optimize - INFO - Trial 112 pruned. 
2026-05-19 19:34:31,938 - optuna.study._optimize - INFO - Trial 113 pruned. 
2026-05-19 19:34:42,300 - optuna.study._optimize - INFO - Trial 114 pruned. 
2026-05-19 19:34:51,405 - experiment_functions - INFO - Early stopping at epoch 1300. Best Recall: 0.0874
2026-05-19 19:34:51,559 - optuna.study.study - INFO - Trial 115 finished with value: 0.0874268919718474 and parameters: {'n_layers': 1, 'embedding_dim': 256, 'lr': 0.001000457990745179, 'lambda_val': 1.0880868103908478e-05, 'batch_size': 2905, 'optimizer': 'Adam'}. Best is trial 60 with value: 0.09483159564833794.
2026-05-19 19:34:58,557 - optuna.study._optimize - INFO - Trial 116 pruned. 
2026-05-19 19:35:05,397 - optuna.study._optimize - INFO - Trial 117 pruned. 
2026-05-19 19:35:21,048 - optuna.study._optimize - INFO - Trial 118 pruned. 
2026-05-19 19:35:26,928 - experiment_functions - INFO - Early stopping at epoch 850. Best Recall: 0.0616
2026-05-19 19:35:27,029 - optuna.study.study - INFO - Trial 119 finished with value: 0.061559124213667736 and parameters: {'n_layers': 1, 'embedding_dim': 256, 'lr': 0.0006290487629582011, 'lambda_val': 0.00941456336359662, 'batch_size': 1257, 'optimizer': 'Adam'}. Best is trial 60 with value: 0.09483159564833794.
2026-05-19 19:35:33,902 - experiment_functions - INFO - Early stopping at epoch 950. Best Recall: 0.0600
2026-05-19 19:35:34,038 - optuna.study.study - INFO - Trial 120 finished with value: 0.06004570009949231 and parameters: {'n_layers': 1, 'embedding_dim': 64, 'lr': 0.0019102156145829959, 'lambda_val': 1.180435802079697e-05, 'batch_size': 1348, 'optimizer': 'Adam'}. Best is trial 60 with value: 0.09483159564833794.
2026-05-19 19:35:42,324 - optuna.study._optimize - INFO - Trial 121 pruned. 
2026-05-19 19:35:51,930 - optuna.study._optimize - INFO - Trial 122 pruned. 
2026-05-19 19:36:01,433 - experiment_functions - INFO - Early stopping at epoch 1450. Best Recall: 0.0906
2026-05-19 19:36:01,532 - optuna.study.study - INFO - Trial 123 finished with value: 0.09055702017802184 and parameters: {'n_layers': 1, 'embedding_dim': 256, 'lr': 0.0007824538860415164, 'lambda_val': 9.534066168690082e-06, 'batch_size': 3823, 'optimizer': 'Adam'}. Best is trial 60 with value: 0.09483159564833794.
2026-05-19 19:36:11,103 - optuna.study._optimize - INFO - Trial 124 pruned. 
2026-05-19 19:36:17,856 - optuna.study._optimize - INFO - Trial 125 pruned. 
2026-05-19 19:36:34,988 - experiment_functions - INFO - Early stopping at epoch 2650. Best Recall: 0.0931
2026-05-19 19:36:35,086 - optuna.study.study - INFO - Trial 126 finished with value: 0.09309189490125327 and parameters: {'n_layers': 1, 'embedding_dim': 256, 'lr': 0.0010338796944205366, 'lambda_val': 2.7079785738210972e-05, 'batch_size': 3430, 'optimizer': 'Adam'}. Best is trial 60 with value: 0.09483159564833794.
2026-05-19 19:36:45,522 - experiment_functions - INFO - Early stopping at epoch 1550. Best Recall: 0.0884
2026-05-19 19:36:45,656 - optuna.study.study - INFO - Trial 127 finished with value: 0.08843430411707076 and parameters: {'n_layers': 1, 'embedding_dim': 256, 'lr': 0.0010781128391296507, 'lambda_val': 2.885505338375526e-05, 'batch_size': 3722, 'optimizer': 'Adam'}. Best is trial 60 with value: 0.09483159564833794.
2026-05-19 19:36:50,169 - experiment_functions - INFO - Early stopping at epoch 500. Best Recall: 0.0014
2026-05-19 19:36:50,260 - optuna.study.study - INFO - Trial 128 finished with value: 0.0013965384400233963 and parameters: {'n_layers': 1, 'embedding_dim': 32, 'lr': 0.00117984384719209, 'lambda_val': 2.7370798091766655e-05, 'batch_size': 3769, 'optimizer': 'SGD'}. Best is trial 60 with value: 0.09483159564833794.
2026-05-19 19:36:59,368 - optuna.study._optimize - INFO - Trial 129 pruned. 
2026-05-19 19:37:06,908 - optuna.study._optimize - INFO - Trial 130 pruned. 
2026-05-19 19:37:16,432 - experiment_functions - INFO - Early stopping at epoch 1300. Best Recall: 0.0891
2026-05-19 19:37:16,521 - optuna.study.study - INFO - Trial 131 finished with value: 0.08909934452615963 and parameters: {'n_layers': 1, 'embedding_dim': 256, 'lr': 0.0011083000128697632, 'lambda_val': 1.633618986466206e-05, 'batch_size': 3351, 'optimizer': 'Adam'}. Best is trial 60 with value: 0.09483159564833794.
2026-05-19 19:37:26,084 - optuna.study._optimize - INFO - Trial 132 pruned. 
2026-05-19 19:37:39,777 - experiment_functions - INFO - Early stopping at epoch 1250. Best Recall: 0.0930
2026-05-19 19:37:39,876 - optuna.study.study - INFO - Trial 133 finished with value: 0.09299493527440798 and parameters: {'n_layers': 1, 'embedding_dim': 256, 'lr': 0.0010860970022481351, 'lambda_val': 2.3085184766288126e-05, 'batch_size': 3547, 'optimizer': 'Adam'}. Best is trial 60 with value: 0.09483159564833794.
2026-05-19 19:37:49,709 - optuna.study._optimize - INFO - Trial 134 pruned. 
2026-05-19 19:38:00,143 - optuna.study._optimize - INFO - Trial 135 pruned. 
2026-05-19 19:38:07,036 - experiment_functions - INFO - Early stopping at epoch 1000. Best Recall: 0.0870
