2026-05-19 19:16:35,632 - optuna.study.study - INFO - Trial 274 finished with value: 0.012073776464337632 and parameters: {'n_layers': 1, 'embedding_dim': 128, 'lr': 0.0004011909312386113, 'lambda_val': 0.00013092462158932586, 'batch_size': 3769, 'optimizer': 'RMSprop'}. Best is trial 266 with value: 0.02671564327479486.
2026-05-19 19:16:46,544 - optuna.study._optimize - INFO - Trial 275 pruned. 
2026-05-19 19:16:53,479 - experiment_functions - INFO - Early stopping at epoch 1250. Best Recall: 0.0232
2026-05-19 19:16:53,579 - optuna.study.study - INFO - Trial 276 finished with value: 0.023171298098818623 and parameters: {'n_layers': 1, 'embedding_dim': 128, 'lr': 0.0004301095393028301, 'lambda_val': 5.80536603463349e-05, 'batch_size': 767, 'optimizer': 'RMSprop'}. Best is trial 266 with value: 0.02671564327479486.
2026-05-19 19:17:01,225 - experiment_functions - INFO - Early stopping at epoch 950. Best Recall: 0.0054
2026-05-19 19:17:01,331 - optuna.study.study - INFO - Trial 277 finished with value: 0.0053587213904663115 and parameters: {'n_layers': 4, 'embedding_dim': 128, 'lr': 0.00037235856835928893, 'lambda_val': 4.0683000076177024e-05, 'batch_size': 861, 'optimizer': 'RMSprop'}. Best is trial 266 with value: 0.02671564327479486.
2026-05-19 19:17:09,138 - experiment_functions - INFO - Early stopping at epoch 1050. Best Recall: 0.0253
2026-05-19 19:17:09,207 - optuna.study.study - INFO - Trial 278 finished with value: 0.025290903084737713 and parameters: {'n_layers': 1, 'embedding_dim': 128, 'lr': 0.00045108474929103024, 'lambda_val': 5.966086423355712e-05, 'batch_size': 773, 'optimizer': 'RMSprop'}. Best is trial 266 with value: 0.02671564327479486.
2026-05-19 19:17:13,413 - experiment_functions - INFO - Early stopping at epoch 750. Best Recall: 0.0197
2026-05-19 19:17:13,484 - optuna.study.study - INFO - Trial 279 finished with value: 0.019729880050823167 and parameters: {'n_layers': 1, 'embedding_dim': 128, 'lr': 0.00044835603237159614, 'lambda_val': 5.825350853957373e-05, 'batch_size': 782, 'optimizer': 'RMSprop'}. Best is trial 266 with value: 0.02671564327479486.
2026-05-19 19:17:19,903 - optuna.study._optimize - INFO - Trial 280 pruned. 
2026-05-19 19:17:25,508 - optuna.study._optimize - INFO - Trial 281 pruned. 
2026-05-19 19:17:35,987 - optuna.study._optimize - INFO - Trial 282 pruned. 
2026-05-19 19:17:48,567 - optuna.study._optimize - INFO - Trial 283 pruned. 
2026-05-19 19:17:54,327 - optuna.study._optimize - INFO - Trial 284 pruned. 
2026-05-19 19:18:00,099 - optuna.study._optimize - INFO - Trial 285 pruned. 
2026-05-19 19:18:08,109 - optuna.study._optimize - INFO - Trial 286 pruned. 
2026-05-19 19:18:15,678 - optuna.study._optimize - INFO - Trial 287 pruned. 
2026-05-19 19:18:18,995 - experiment_functions - INFO - Early stopping at epoch 500. Best Recall: 0.0011
2026-05-19 19:18:19,130 - optuna.study.study - INFO - Trial 288 finished with value: 0.0011425829108765305 and parameters: {'n_layers': 1, 'embedding_dim': 128, 'lr': 0.00047788578166158577, 'lambda_val': 6.004337935905433e-05, 'batch_size': 585, 'optimizer': 'SGD'}. Best is trial 266 with value: 0.02671564327479486.
2026-05-19 19:18:30,176 - optuna.study._optimize - INFO - Trial 289 pruned. 
2026-05-19 19:18:37,806 - optuna.study._optimize - INFO - Trial 290 pruned. 
2026-05-19 19:18:43,094 - experiment_functions - INFO - Early stopping at epoch 950. Best Recall: 0.0168
2026-05-19 19:18:43,185 - optuna.study.study - INFO - Trial 291 finished with value: 0.016842777222967578 and parameters: {'n_layers': 1, 'embedding_dim': 128, 'lr': 0.0005234425033119178, 'lambda_val': 4.4459883539661304e-05, 'batch_size': 568, 'optimizer': 'RMSprop'}. Best is trial 266 with value: 0.02671564327479486.
2026-05-19 19:18:48,601 - experiment_functions - INFO - Early stopping at epoch 800. Best Recall: 0.0160
2026-05-19 19:18:48,706 - optuna.study.study - INFO - Trial 292 finished with value: 0.016048497094566832 and parameters: {'n_layers': 1, 'embedding_dim': 128, 'lr': 0.0006327128626842302, 'lambda_val': 3.482632941954455e-05, 'batch_size': 682, 'optimizer': 'RMSprop'}. Best is trial 266 with value: 0.02671564327479486.
2026-05-19 19:18:56,723 - experiment_functions - INFO - Early stopping at epoch 900. Best Recall: 0.0165
2026-05-19 19:18:56,813 - optuna.study.study - INFO - Trial 293 finished with value: 0.016450968952555527 and parameters: {'n_layers': 1, 'embedding_dim': 128, 'lr': 0.00036471804265158847, 'lambda_val': 7.217363646448352e-05, 'batch_size': 1944, 'optimizer': 'RMSprop'}. Best is trial 266 with value: 0.02671564327479486.
2026-05-19 19:19:03,176 - experiment_functions - INFO - Early stopping at epoch 1150. Best Recall: 0.0201
2026-05-19 19:19:03,266 - optuna.study.study - INFO - Trial 294 finished with value: 0.020077047948503398 and parameters: {'n_layers': 1, 'embedding_dim': 128, 'lr': 0.00045056337173822203, 'lambda_val': 5.949705421692781e-05, 'batch_size': 598, 'optimizer': 'RMSprop'}. Best is trial 266 with value: 0.02671564327479486.
2026-05-19 19:19:11,375 - optuna.study._optimize - INFO - Trial 295 pruned. 
2026-05-19 19:19:16,647 - experiment_functions - INFO - Early stopping at epoch 750. Best Recall: 0.0194
2026-05-19 19:19:16,748 - optuna.study.study - INFO - Trial 296 finished with value: 0.019389116195626232 and parameters: {'n_layers': 1, 'embedding_dim': 128, 'lr': 0.0006766922471500702, 'lambda_val': 0.00016378501662499238, 'batch_size': 567, 'optimizer': 'RMSprop'}. Best is trial 266 with value: 0.02671564327479486.
2026-05-19 19:19:25,295 - experiment_functions - INFO - Early stopping at epoch 950. Best Recall: 0.0201
2026-05-19 19:19:25,404 - optuna.study.study - INFO - Trial 297 finished with value: 0.020104344196326097 and parameters: {'n_layers': 1, 'embedding_dim': 128, 'lr': 0.0005405795261147136, 'lambda_val': 2.0021922943884313e-05, 'batch_size': 756, 'optimizer': 'RMSprop'}. Best is trial 266 with value: 0.02671564327479486.
2026-05-19 19:19:31,883 - optuna.study._optimize - INFO - Trial 298 pruned. 
2026-05-19 19:19:38,333 - optuna.study._optimize - INFO - Trial 299 pruned. 
2026-05-19 19:19:38,335 - experiment_functions - INFO - Training the best model ... for e_100K_1c2dcs_strict
2026-05-19 19:19:44,853 - experiment_functions - INFO - Early stopping at epoch 2500. Best Recall: 0.0271
2026-05-19 19:19:44,946 - root - INFO -   ** Getting the trainable edges:
2026-05-19 19:19:44,952 - helper_functions - INFO -      Number of nodes: 4003
2026-05-19 19:19:44,952 - helper_functions - INFO -      Ratio: 0.3873621056706019
2026-05-19 19:19:44,952 - helper_functions - INFO -      Number of unique users: 324
2026-05-19 19:19:44,952 - helper_functions - INFO -      Number of unique items: 3679
2026-05-19 19:19:44,952 - helper_functions - INFO -      Total dominant set edge: 84485
2026-05-19 19:19:44,952 - helper_functions - INFO -      Trainable edges: 67588.0
2026-05-19 19:19:44,961 - root - INFO -   **** Getting 84485 dominant set edges
2026-05-19 19:19:45,074 - optuna.storages._rdb.storage - INFO - A new study created in RDB with name: Study_e_100K_1c2dcs
2026-05-19 19:19:49,846 - experiment_functions - INFO - Early stopping at epoch 500. Best Recall: 0.0015
2026-05-19 19:19:49,938 - optuna.study.study - INFO - Trial 0 finished with value: 0.0014892067684308318 and parameters: {'n_layers': 1, 'embedding_dim': 256, 'lr': 0.033011174727546486, 'lambda_val': 0.059154172015163146, 'batch_size': 1039, 'optimizer': 'SGD'}. Best is trial 0 with value: 0.0014892067684308318.
2026-05-19 19:19:53,950 - experiment_functions - INFO - Early stopping at epoch 550. Best Recall: 0.0255
2026-05-19 19:19:54,054 - optuna.study.study - INFO - Trial 1 finished with value: 0.02550418791597337 and parameters: {'n_layers': 3, 'embedding_dim': 64, 'lr': 0.0069164845478568845, 'lambda_val': 0.0002491169213206413, 'batch_size': 1645, 'optimizer': 'Adam'}. Best is trial 1 with value: 0.02550418791597337.
2026-05-19 19:20:18,692 - experiment_functions - INFO - Early stopping at epoch 3550. Best Recall: 0.0731
2026-05-19 19:20:18,801 - optuna.study.study - INFO - Trial 2 finished with value: 0.07312652130347504 and parameters: {'n_layers': 2, 'embedding_dim': 256, 'lr': 0.00018883183615891466, 'lambda_val': 1.1749976253465849e-06, 'batch_size': 542, 'optimizer': 'RMSprop'}. Best is trial 2 with value: 0.07312652130347504.
2026-05-19 19:20:27,480 - experiment_functions - INFO - Early stopping at epoch 500. Best Recall: 0.0018
2026-05-19 19:20:27,569 - optuna.study.study - INFO - Trial 3 finished with value: 0.0017740443650486153 and parameters: {'n_layers': 4, 'embedding_dim': 64, 'lr': 0.00012797570534880728, 'lambda_val': 2.908216850497481e-05, 'batch_size': 2971, 'optimizer': 'SGD'}. Best is trial 2 with value: 0.07312652130347504.
2026-05-19 19:20:43,088 - experiment_functions - INFO - Early stopping at epoch 700. Best Recall: 0.0338
2026-05-19 19:20:43,245 - optuna.study.study - INFO - Trial 4 finished with value: 0.03377372780419321 and parameters: {'n_layers': 2, 'embedding_dim': 256, 'lr': 0.0062880988432532335, 'lambda_val': 1.3324074413312597e-05, 'batch_size': 2040, 'optimizer': 'Adam'}. Best is trial 2 with value: 0.07312652130347504.
2026-05-19 19:20:46,847 - experiment_functions - INFO - Early stopping at epoch 500. Best Recall: 0.0017
2026-05-19 19:20:46,939 - optuna.study.study - INFO - Trial 5 finished with value: 0.0017295357937696923 and parameters: {'n_layers': 2, 'embedding_dim': 32, 'lr': 7.789888560452819e-05, 'lambda_val': 0.013929362601205097, 'batch_size': 1583, 'optimizer': 'SGD'}. Best is trial 2 with value: 0.07312652130347504.
2026-05-19 19:20:51,653 - experiment_functions - INFO - Early stopping at epoch 500. Best Recall: 0.0011
2026-05-19 19:20:51,754 - optuna.study.study - INFO - Trial 6 finished with value: 0.001066395686828248 and parameters: {'n_layers': 3, 'embedding_dim': 96, 'lr': 0.0005795059141934115, 'lambda_val': 0.0008087247855600791, 'batch_size': 1949, 'optimizer': 'SGD'}. Best is trial 2 with value: 0.07312652130347504.
2026-05-19 19:20:56,301 - experiment_functions - INFO - Early stopping at epoch 600. Best Recall: 0.0470
2026-05-19 19:20:56,402 - optuna.study.study - INFO - Trial 7 finished with value: 0.04700666732996406 and parameters: {'n_layers': 2, 'embedding_dim': 32, 'lr': 0.00274854483813571, 'lambda_val': 0.003202680296579662, 'batch_size': 3810, 'optimizer': 'Adam'}. Best is trial 2 with value: 0.07312652130347504.
2026-05-19 19:21:00,761 - experiment_functions - INFO - Early stopping at epoch 500. Best Recall: 0.0025
2026-05-19 19:21:00,860 - optuna.study.study - INFO - Trial 8 finished with value: 0.002468223652553591 and parameters: {'n_layers': 4, 'embedding_dim': 128, 'lr': 0.0003265272974340857, 'lambda_val': 0.0004118404157765037, 'batch_size': 959, 'optimizer': 'SGD'}. Best is trial 2 with value: 0.07312652130347504.
2026-05-19 19:21:11,089 - optuna.study._optimize - INFO - Trial 9 pruned. 
2026-05-19 19:21:17,383 - experiment_functions - INFO - Early stopping at epoch 900. Best Recall: 0.0022
2026-05-19 19:21:17,504 - optuna.study.study - INFO - Trial 10 finished with value: 0.0021967681030067385 and parameters: {'n_layers': 1, 'embedding_dim': 128, 'lr': 1.5781018090172413e-05, 'lambda_val': 1.0948001687930558e-06, 'batch_size': 643, 'optimizer': 'RMSprop'}. Best is trial 2 with value: 0.07312652130347504.
2026-05-19 19:21:21,879 - experiment_functions - INFO - Early stopping at epoch 650. Best Recall: 0.0238
2026-05-19 19:21:21,969 - optuna.study.study - INFO - Trial 11 finished with value: 0.02378091550731921 and parameters: {'n_layers': 2, 'embedding_dim': 32, 'lr': 0.0026216183172445215, 'lambda_val': 0.003806720368798679, 'batch_size': 3933, 'optimizer': 'RMSprop'}. Best is trial 2 with value: 0.07312652130347504.
2026-05-19 19:21:26,136 - experiment_functions - INFO - Early stopping at epoch 600. Best Recall: 0.0390
2026-05-19 19:21:26,228 - optuna.study.study - INFO - Trial 12 finished with value: 0.038975133780926985 and parameters: {'n_layers': 2, 'embedding_dim': 32, 'lr': 0.001656393986713008, 'lambda_val': 8.636282253289112e-05, 'batch_size': 3968, 'optimizer': 'RMSprop'}. Best is trial 2 with value: 0.07312652130347504.
2026-05-19 19:21:29,794 - experiment_functions - INFO - Early stopping at epoch 500. Best Recall: 0.0035
2026-05-19 19:21:29,895 - optuna.study.study - INFO - Trial 13 finished with value: 0.003541854999020374 and parameters: {'n_layers': 1, 'embedding_dim': 96, 'lr': 2.1146862964358136e-05, 'lambda_val': 0.003109272206696456, 'batch_size': 2774, 'optimizer': 'RMSprop'}. Best is trial 2 with value: 0.07312652130347504.
2026-05-19 19:21:37,101 - experiment_functions - INFO - Early stopping at epoch 950. Best Recall: 0.0196
2026-05-19 19:21:37,201 - optuna.study.study - INFO - Trial 14 finished with value: 0.019570012329862444 and parameters: {'n_layers': 3, 'embedding_dim': 32, 'lr': 0.093498995672598, 'lambda_val': 0.001760538497417789, 'batch_size': 3391, 'optimizer': 'Adam'}. Best is trial 2 with value: 0.07312652130347504.
2026-05-19 19:21:45,099 - optuna.study._optimize - INFO - Trial 15 pruned. 
2026-05-19 19:21:54,781 - experiment_functions - INFO - Early stopping at epoch 750. Best Recall: 0.0391
2026-05-19 19:21:54,872 - optuna.study.study - INFO - Trial 16 finished with value: 0.0390565907453903 and parameters: {'n_layers': 3, 'embedding_dim': 256, 'lr': 0.0007673412387951713, 'lambda_val': 1.0774544681564932e-06, 'batch_size': 3501, 'optimizer': 'Adam'}. Best is trial 2 with value: 0.07312652130347504.
2026-05-19 19:21:58,348 - experiment_functions - INFO - Early stopping at epoch 550. Best Recall: 0.0623
2026-05-19 19:21:58,464 - optuna.study.study - INFO - Trial 17 finished with value: 0.062256834537434504 and parameters: {'n_layers': 1, 'embedding_dim': 32, 'lr': 0.007184160028062431, 'lambda_val': 0.0001133658150833582, 'batch_size': 2478, 'optimizer': 'Adam'}. Best is trial 2 with value: 0.07312652130347504.
2026-05-19 19:22:04,707 - optuna.study._optimize - INFO - Trial 18 pruned. 
2026-05-19 19:22:10,106 - experiment_functions - INFO - Early stopping at epoch 800. Best Recall: 0.0246
2026-05-19 19:22:10,207 - optuna.study.study - INFO - Trial 19 finished with value: 0.024555852907160145 and parameters: {'n_layers': 1, 'embedding_dim': 64, 'lr': 0.046570286459739145, 'lambda_val': 5.226470733692681e-06, 'batch_size': 1365, 'optimizer': 'Adam'}. Best is trial 2 with value: 0.07312652130347504.
2026-05-19 19:22:13,974 - experiment_functions - INFO - Early stopping at epoch 550. Best Recall: 0.0354
2026-05-19 19:22:14,094 - optuna.study.study - INFO - Trial 20 finished with value: 0.03537213211353195 and parameters: {'n_layers': 1, 'embedding_dim': 96, 'lr': 0.012055703861684895, 'lambda_val': 2.707588801187933e-05, 'batch_size': 2031, 'optimizer': 'RMSprop'}. Best is trial 2 with value: 0.07312652130347504.
2026-05-19 19:22:18,412 - experiment_functions - INFO - Early stopping at epoch 600. Best Recall: 0.0383
2026-05-19 19:22:18,502 - optuna.study.study - INFO - Trial 21 finished with value: 0.03825952228674889 and parameters: {'n_layers': 2, 'embedding_dim': 32, 'lr': 0.002728401005647019, 'lambda_val': 0.006933880383624564, 'batch_size': 3597, 'optimizer': 'Adam'}. Best is trial 2 with value: 0.07312652130347504.
2026-05-19 19:22:22,937 - experiment_functions - INFO - Early stopping at epoch 700. Best Recall: 0.0517
2026-05-19 19:22:23,295 - optuna.study.study - INFO - Trial 22 finished with value: 0.05171955789910025 and parameters: {'n_layers': 2, 'embedding_dim': 32, 'lr': 0.0013623145493134987, 'lambda_val': 0.0001193750365846285, 'batch_size': 599, 'optimizer': 'Adam'}. Best is trial 2 with value: 0.07312652130347504.
2026-05-19 19:22:29,782 - optuna.study._optimize - INFO - Trial 23 pruned. 
2026-05-19 19:22:34,641 - experiment_functions - INFO - Early stopping at epoch 800. Best Recall: 0.0674
2026-05-19 19:22:34,740 - optuna.study.study - INFO - Trial 24 finished with value: 0.0673823677202945 and parameters: {'n_layers': 1, 'embedding_dim': 32, 'lr': 0.001271671623834287, 'lambda_val': 7.229106512220326e-06, 'batch_size': 1052, 'optimizer': 'Adam'}. Best is trial 2 with value: 0.07312652130347504.
2026-05-19 19:22:47,011 - experiment_functions - INFO - Early stopping at epoch 1800. Best Recall: 0.0726
2026-05-19 19:22:47,112 - optuna.study.study - INFO - Trial 25 finished with value: 0.07264269167718197 and parameters: {'n_layers': 1, 'embedding_dim': 256, 'lr': 0.0004931548438794855, 'lambda_val': 4.22533460368984e-06, 'batch_size': 1156, 'optimizer': 'Adam'}. Best is trial 2 with value: 0.07312652130347504.
2026-05-19 19:22:51,592 - experiment_functions - INFO - Early stopping at epoch 700. Best Recall: 0.0012
2026-05-19 19:22:51,682 - optuna.study.study - INFO - Trial 26 finished with value: 0.0012244389253687157 and parameters: {'n_layers': 1, 'embedding_dim': 256, 'lr': 4.537509036900759e-05, 'lambda_val': 3.824065956404368e-06, 'batch_size': 1058, 'optimizer': 'RMSprop'}. Best is trial 2 with value: 0.07312652130347504.
2026-05-19 19:23:07,181 - experiment_functions - INFO - Early stopping at epoch 2600. Best Recall: 0.0840
2026-05-19 19:23:07,296 - optuna.study.study - INFO - Trial 27 finished with value: 0.08404332295653318 and parameters: {'n_layers': 1, 'embedding_dim': 256, 'lr': 0.00042457864017617374, 'lambda_val': 2.095736270732297e-06, 'batch_size': 1293, 'optimizer': 'Adam'}. Best is trial 27 with value: 0.08404332295653318.
2026-05-19 19:23:21,492 - experiment_functions - INFO - Early stopping at epoch 1850. Best Recall: 0.0783
2026-05-19 19:23:21,571 - optuna.study.study - INFO - Trial 28 finished with value: 0.07825023112377351 and parameters: {'n_layers': 1, 'embedding_dim': 256, 'lr': 0.0004238723358564064, 'lambda_val': 2.3982394795360117e-06, 'batch_size': 1404, 'optimizer': 'Adam'}. Best is trial 27 with value: 0.08404332295653318.
2026-05-19 19:23:27,845 - optuna.study._optimize - INFO - Trial 29 pruned. 
2026-05-19 19:23:31,574 - experiment_functions - INFO - Early stopping at epoch 500. Best Recall: 0.0021
2026-05-19 19:23:31,663 - optuna.study.study - INFO - Trial 30 finished with value: 0.0021445767121423633 and parameters: {'n_layers': 1, 'embedding_dim': 256, 'lr': 0.0003447597260592923, 'lambda_val': 1.300126977670607e-05, 'batch_size': 828, 'optimizer': 'SGD'}. Best is trial 27 with value: 0.08404332295653318.
2026-05-19 19:23:38,860 - optuna.study._optimize - INFO - Trial 31 pruned. 
2026-05-19 19:23:45,431 - optuna.study._optimize - INFO - Trial 32 pruned. 
2026-05-19 19:23:52,032 - optuna.study._optimize - INFO - Trial 33 pruned. 
2026-05-19 19:24:05,773 - experiment_functions - INFO - Early stopping at epoch 1650. Best Recall: 0.0910
2026-05-19 19:24:05,922 - optuna.study.study - INFO - Trial 34 finished with value: 0.09103696294173279 and parameters: {'n_layers': 1, 'embedding_dim': 256, 'lr': 0.000796291894087085, 'lambda_val': 3.166584147011937e-05, 'batch_size': 1638, 'optimizer': 'Adam'}. Best is trial 34 with value: 0.09103696294173279.
2026-05-19 19:24:14,949 - optuna.study._optimize - INFO - Trial 35 pruned. 
2026-05-19 19:24:18,465 - experiment_functions - INFO - Early stopping at epoch 500. Best Recall: 0.0025
2026-05-19 19:24:18,555 - optuna.study.study - INFO - Trial 36 finished with value: 0.002496863557077672 and parameters: {'n_layers': 2, 'embedding_dim': 64, 'lr': 0.0009398044915541443, 'lambda_val': 8.667443698311667e-06, 'batch_size': 1791, 'optimizer': 'SGD'}. Best is trial 34 with value: 0.09103696294173279.
2026-05-19 19:24:22,811 - experiment_functions - INFO - Early stopping at epoch 550. Best Recall: 0.0013
2026-05-19 19:24:22,912 - optuna.study.study - INFO - Trial 37 finished with value: 0.0013361094443369054 and parameters: {'n_layers': 1, 'embedding_dim': 256, 'lr': 3.1006657243115815e-05, 'lambda_val': 2.0140345871855048e-06, 'batch_size': 867, 'optimizer': 'Adam'}. Best is trial 34 with value: 0.09103696294173279.
2026-05-19 19:24:30,593 - optuna.study._optimize - INFO - Trial 38 pruned. 
2026-05-19 19:24:35,296 - experiment_functions - INFO - Early stopping at epoch 500. Best Recall: 0.0016
2026-05-19 19:24:35,439 - optuna.study.study - INFO - Trial 39 finished with value: 0.0015741462703736883 and parameters: {'n_layers': 3, 'embedding_dim': 256, 'lr': 0.0001433093709505938, 'lambda_val': 1.0087803431685053e-06, 'batch_size': 1535, 'optimizer': 'SGD'}. Best is trial 34 with value: 0.09103696294173279.
2026-05-19 19:24:42,167 - optuna.study._optimize - INFO - Trial 40 pruned. 
2026-05-19 19:24:49,048 - optuna.study._optimize - INFO - Trial 41 pruned. 
2026-05-19 19:24:55,626 - optuna.study._optimize - INFO - Trial 42 pruned. 
2026-05-19 19:25:05,555 - experiment_functions - INFO - Early stopping at epoch 1300. Best Recall: 0.0888
2026-05-19 19:25:05,659 - optuna.study.study - INFO - Trial 43 finished with value: 0.0887949308547949 and parameters: {'n_layers': 1, 'embedding_dim': 256, 'lr': 0.0018765729114886159, 'lambda_val': 1.702084769251042e-05, 'batch_size': 1496, 'optimizer': 'Adam'}. Best is trial 34 with value: 0.09103696294173279.
2026-05-19 19:25:12,799 - experiment_functions - INFO - Early stopping at epoch 1050. Best Recall: 0.0874
2026-05-19 19:25:12,953 - optuna.study.study - INFO - Trial 44 finished with value: 0.08738579113883348 and parameters: {'n_layers': 1, 'embedding_dim': 256, 'lr': 0.0021693623969909637, 'lambda_val': 0.00026669326840685786, 'batch_size': 1470, 'optimizer': 'Adam'}. Best is trial 34 with value: 0.09103696294173279.
2026-05-19 19:25:19,734 - experiment_functions - INFO - Early stopping at epoch 950. Best Recall: 0.0740
