2026-05-19 17:45:39,994 - optuna.study._optimize - INFO - Trial 258 pruned. 
2026-05-19 17:45:46,254 - optuna.study._optimize - INFO - Trial 259 pruned. 
2026-05-19 17:45:52,470 - optuna.study._optimize - INFO - Trial 260 pruned. 
2026-05-19 17:46:00,466 - optuna.study._optimize - INFO - Trial 261 pruned. 
2026-05-19 17:46:08,097 - optuna.study._optimize - INFO - Trial 262 pruned. 
2026-05-19 17:46:13,780 - experiment_functions - INFO - Early stopping at epoch 800. Best Recall: 0.0108
2026-05-19 17:46:13,872 - optuna.study.study - INFO - Trial 263 finished with value: 0.01083502234491493 and parameters: {'n_layers': 4, 'embedding_dim': 32, 'lr': 0.09677893039877157, 'lambda_val': 2.5935363988729275e-05, 'batch_size': 823, 'optimizer': 'Adam'}. Best is trial 229 with value: 0.028123093326230243.
2026-05-19 17:46:23,363 - optuna.study._optimize - INFO - Trial 264 pruned. 
2026-05-19 17:46:32,277 - optuna.study._optimize - INFO - Trial 265 pruned. 
2026-05-19 17:46:39,766 - optuna.study._optimize - INFO - Trial 266 pruned. 
2026-05-19 17:46:49,345 - optuna.study._optimize - INFO - Trial 267 pruned. 
2026-05-19 17:46:57,165 - optuna.study._optimize - INFO - Trial 268 pruned. 
2026-05-19 17:47:05,443 - experiment_functions - INFO - Early stopping at epoch 1100. Best Recall: 0.0178
2026-05-19 17:47:05,534 - optuna.study.study - INFO - Trial 269 finished with value: 0.017785847112416864 and parameters: {'n_layers': 4, 'embedding_dim': 96, 'lr': 0.0647184815221421, 'lambda_val': 5.542270284462767e-05, 'batch_size': 3701, 'optimizer': 'Adam'}. Best is trial 229 with value: 0.028123093326230243.
2026-05-19 17:47:19,179 - experiment_functions - INFO - Early stopping at epoch 1650. Best Recall: 0.0210
2026-05-19 17:47:19,323 - optuna.study.study - INFO - Trial 270 finished with value: 0.021007641382573612 and parameters: {'n_layers': 4, 'embedding_dim': 32, 'lr': 0.08126098804803801, 'lambda_val': 4.261928082036347e-05, 'batch_size': 3572, 'optimizer': 'Adam'}. Best is trial 229 with value: 0.028123093326230243.
2026-05-19 17:47:27,626 - optuna.study._optimize - INFO - Trial 271 pruned. 
2026-05-19 17:47:36,175 - optuna.study._optimize - INFO - Trial 272 pruned. 
2026-05-19 17:47:55,153 - experiment_functions - INFO - Early stopping at epoch 2550. Best Recall: 0.0227
2026-05-19 17:47:55,295 - optuna.study.study - INFO - Trial 273 finished with value: 0.022721954899406007 and parameters: {'n_layers': 4, 'embedding_dim': 32, 'lr': 0.05622387609053871, 'lambda_val': 5.144971679791887e-05, 'batch_size': 3652, 'optimizer': 'Adam'}. Best is trial 229 with value: 0.028123093326230243.
2026-05-19 17:48:04,003 - optuna.study._optimize - INFO - Trial 274 pruned. 
2026-05-19 17:48:21,423 - optuna.study._optimize - INFO - Trial 275 pruned. 
2026-05-19 17:48:28,424 - optuna.study._optimize - INFO - Trial 276 pruned. 
2026-05-19 17:48:35,308 - optuna.study._optimize - INFO - Trial 277 pruned. 
2026-05-19 17:48:41,705 - optuna.study._optimize - INFO - Trial 278 pruned. 
2026-05-19 17:48:53,352 - optuna.study._optimize - INFO - Trial 279 pruned. 
2026-05-19 17:48:56,709 - experiment_functions - INFO - Early stopping at epoch 500. Best Recall: 0.0029
2026-05-19 17:48:56,814 - optuna.study.study - INFO - Trial 280 finished with value: 0.0028738668146758035 and parameters: {'n_layers': 4, 'embedding_dim': 32, 'lr': 0.0006245084632989007, 'lambda_val': 4.807294902878143e-05, 'batch_size': 3704, 'optimizer': 'SGD'}. Best is trial 229 with value: 0.028123093326230243.
2026-05-19 17:49:05,606 - experiment_functions - INFO - Early stopping at epoch 1500. Best Recall: 0.0193
2026-05-19 17:49:05,705 - optuna.study.study - INFO - Trial 281 finished with value: 0.019324586840782046 and parameters: {'n_layers': 4, 'embedding_dim': 32, 'lr': 0.06742577909823029, 'lambda_val': 9.438031283773948e-05, 'batch_size': 3421, 'optimizer': 'Adam'}. Best is trial 229 with value: 0.028123093326230243.
2026-05-19 17:49:16,178 - optuna.study._optimize - INFO - Trial 282 pruned. 
2026-05-19 17:49:31,722 - optuna.study._optimize - INFO - Trial 283 pruned. 
2026-05-19 17:49:38,174 - optuna.study._optimize - INFO - Trial 284 pruned. 
2026-05-19 17:49:44,498 - optuna.study._optimize - INFO - Trial 285 pruned. 
2026-05-19 17:49:50,167 - experiment_functions - INFO - Early stopping at epoch 800. Best Recall: 0.0050
2026-05-19 17:49:50,267 - optuna.study.study - INFO - Trial 286 finished with value: 0.004988547329489408 and parameters: {'n_layers': 4, 'embedding_dim': 32, 'lr': 0.050575360513790205, 'lambda_val': 0.004056265901736925, 'batch_size': 3741, 'optimizer': 'Adam'}. Best is trial 229 with value: 0.028123093326230243.
2026-05-19 17:50:09,996 - experiment_functions - INFO - Early stopping at epoch 1200. Best Recall: 0.0230
2026-05-19 17:50:10,112 - optuna.study.study - INFO - Trial 287 finished with value: 0.02300130571142354 and parameters: {'n_layers': 4, 'embedding_dim': 32, 'lr': 0.06225025449910751, 'lambda_val': 0.00010725573671080802, 'batch_size': 3591, 'optimizer': 'RMSprop'}. Best is trial 229 with value: 0.028123093326230243.
2026-05-19 17:50:16,490 - optuna.study._optimize - INFO - Trial 288 pruned. 
2026-05-19 17:50:31,211 - experiment_functions - INFO - Early stopping at epoch 2050. Best Recall: 0.0217
2026-05-19 17:50:31,357 - optuna.study.study - INFO - Trial 289 finished with value: 0.02167146568914201 and parameters: {'n_layers': 4, 'embedding_dim': 32, 'lr': 0.06788964006995737, 'lambda_val': 0.00010258198425763029, 'batch_size': 3613, 'optimizer': 'RMSprop'}. Best is trial 229 with value: 0.028123093326230243.
2026-05-19 17:50:39,209 - optuna.study._optimize - INFO - Trial 290 pruned. 
2026-05-19 17:50:54,108 - experiment_functions - INFO - Early stopping at epoch 2050. Best Recall: 0.0217
2026-05-19 17:50:56,105 - optuna.study.study - INFO - Trial 291 finished with value: 0.021716791407542693 and parameters: {'n_layers': 4, 'embedding_dim': 32, 'lr': 0.06225248031208155, 'lambda_val': 0.00018384024553783966, 'batch_size': 3582, 'optimizer': 'RMSprop'}. Best is trial 229 with value: 0.028123093326230243.
2026-05-19 17:50:59,887 - experiment_functions - INFO - Early stopping at epoch 500. Best Recall: 0.0015
2026-05-19 17:50:59,978 - optuna.study.study - INFO - Trial 292 finished with value: 0.0015387594627789655 and parameters: {'n_layers': 4, 'embedding_dim': 32, 'lr': 0.07036699073228728, 'lambda_val': 0.00017863253290422814, 'batch_size': 3565, 'optimizer': 'SGD'}. Best is trial 229 with value: 0.028123093326230243.
2026-05-19 17:51:08,656 - optuna.study._optimize - INFO - Trial 293 pruned. 
2026-05-19 17:51:17,362 - optuna.study._optimize - INFO - Trial 294 pruned. 
2026-05-19 17:51:25,169 - optuna.study._optimize - INFO - Trial 295 pruned. 
2026-05-19 17:51:44,834 - experiment_functions - INFO - Early stopping at epoch 3000. Best Recall: 0.0227
2026-05-19 17:51:44,969 - optuna.study.study - INFO - Trial 296 finished with value: 0.022704528663428442 and parameters: {'n_layers': 4, 'embedding_dim': 32, 'lr': 0.06041857410339199, 'lambda_val': 0.0001741069321016224, 'batch_size': 4030, 'optimizer': 'RMSprop'}. Best is trial 229 with value: 0.028123093326230243.
2026-05-19 17:51:52,177 - optuna.study._optimize - INFO - Trial 297 pruned. 
2026-05-19 17:51:55,936 - experiment_functions - INFO - Early stopping at epoch 500. Best Recall: 0.0137
2026-05-19 17:51:56,028 - optuna.study.study - INFO - Trial 298 finished with value: 0.013708122451238808 and parameters: {'n_layers': 4, 'embedding_dim': 256, 'lr': 0.05567506913608772, 'lambda_val': 0.00028995936965022276, 'batch_size': 4038, 'optimizer': 'RMSprop'}. Best is trial 229 with value: 0.028123093326230243.
2026-05-19 17:52:02,822 - optuna.study._optimize - INFO - Trial 299 pruned. 
2026-05-19 17:52:02,825 - experiment_functions - INFO - Training the best model ... for e_100K_1c1dcs_strict
2026-05-19 17:52:06,277 - experiment_functions - INFO - Early stopping at epoch 1100. Best Recall: 0.0195
2026-05-19 17:52:06,366 - root - INFO -   ** Getting the trainable edges:
2026-05-19 17:52:06,371 - helper_functions - INFO -      Number of nodes: 535
2026-05-19 17:52:06,371 - helper_functions - INFO -      Ratio: 0.05177085349332301
2026-05-19 17:52:06,371 - helper_functions - INFO -      Number of unique users: 303
2026-05-19 17:52:06,371 - helper_functions - INFO -      Number of unique items: 232
2026-05-19 17:52:06,371 - helper_functions - INFO -      Total dominant set edge: 81241
2026-05-19 17:52:06,371 - helper_functions - INFO -      Trainable edges: 64992.8
2026-05-19 17:52:06,380 - root - INFO -   **** Getting 81241 dominant set edges
2026-05-19 17:52:06,534 - optuna.storages._rdb.storage - INFO - A new study created in RDB with name: Study_e_100K_1c1dcs
2026-05-19 17:52:10,752 - experiment_functions - INFO - Early stopping at epoch 500. Best Recall: 0.0020
2026-05-19 17:52:10,851 - optuna.study.study - INFO - Trial 0 finished with value: 0.0019911716733387623 and parameters: {'n_layers': 3, 'embedding_dim': 96, 'lr': 3.10618517920041e-05, 'lambda_val': 0.008111077001901857, 'batch_size': 3289, 'optimizer': 'Adam'}. Best is trial 0 with value: 0.0019911716733387623.
2026-05-19 17:52:36,586 - experiment_functions - INFO - Early stopping at epoch 800. Best Recall: 0.0030
2026-05-19 17:52:38,689 - optuna.study.study - INFO - Trial 1 finished with value: 0.002979066226707713 and parameters: {'n_layers': 2, 'embedding_dim': 96, 'lr': 1.696839283062993e-05, 'lambda_val': 2.5019075427482865e-05, 'batch_size': 3280, 'optimizer': 'Adam'}. Best is trial 1 with value: 0.002979066226707713.
2026-05-19 17:53:04,911 - optuna.study.study - INFO - Trial 2 finished with value: 0.024295686688466427 and parameters: {'n_layers': 4, 'embedding_dim': 32, 'lr': 0.0001510026432680459, 'lambda_val': 6.582491250422762e-06, 'batch_size': 1359, 'optimizer': 'Adam'}. Best is trial 2 with value: 0.024295686688466427.
2026-05-19 17:53:08,576 - experiment_functions - INFO - Early stopping at epoch 500. Best Recall: 0.0024
2026-05-19 17:53:08,676 - optuna.study.study - INFO - Trial 3 finished with value: 0.002378149593715909 and parameters: {'n_layers': 1, 'embedding_dim': 256, 'lr': 4.268563585663689e-05, 'lambda_val': 0.00010812520270589391, 'batch_size': 2131, 'optimizer': 'SGD'}. Best is trial 2 with value: 0.024295686688466427.
2026-05-19 17:53:12,817 - experiment_functions - INFO - Early stopping at epoch 500. Best Recall: 0.0017
2026-05-19 17:53:12,917 - optuna.study.study - INFO - Trial 4 finished with value: 0.0016536100029036762 and parameters: {'n_layers': 3, 'embedding_dim': 64, 'lr': 0.015117706456590727, 'lambda_val': 4.765703371447511e-06, 'batch_size': 2721, 'optimizer': 'SGD'}. Best is trial 2 with value: 0.024295686688466427.
2026-05-19 17:53:29,896 - experiment_functions - INFO - Early stopping at epoch 2950. Best Recall: 0.0626
2026-05-19 17:53:29,989 - optuna.study.study - INFO - Trial 5 finished with value: 0.06256097437830344 and parameters: {'n_layers': 2, 'embedding_dim': 64, 'lr': 0.00022660124361688228, 'lambda_val': 3.866018844442767e-05, 'batch_size': 1411, 'optimizer': 'RMSprop'}. Best is trial 5 with value: 0.06256097437830344.
2026-05-19 17:53:38,999 - experiment_functions - INFO - Early stopping at epoch 500. Best Recall: 0.0020
2026-05-19 17:53:39,100 - optuna.study.study - INFO - Trial 6 finished with value: 0.0019939696995645703 and parameters: {'n_layers': 3, 'embedding_dim': 64, 'lr': 0.01401754067099371, 'lambda_val': 0.004026458849668165, 'batch_size': 1210, 'optimizer': 'SGD'}. Best is trial 5 with value: 0.06256097437830344.
2026-05-19 17:53:44,687 - experiment_functions - INFO - Early stopping at epoch 650. Best Recall: 0.0351
2026-05-19 17:53:44,788 - optuna.study.study - INFO - Trial 7 finished with value: 0.035147866498215254 and parameters: {'n_layers': 2, 'embedding_dim': 96, 'lr': 0.0011596601689896644, 'lambda_val': 0.002387743607422764, 'batch_size': 3978, 'optimizer': 'RMSprop'}. Best is trial 5 with value: 0.06256097437830344.
2026-05-19 17:53:49,438 - experiment_functions - INFO - Early stopping at epoch 500. Best Recall: 0.0018
2026-05-19 17:53:49,582 - optuna.study.study - INFO - Trial 8 finished with value: 0.001787000825042879 and parameters: {'n_layers': 3, 'embedding_dim': 256, 'lr': 0.0019289890876708214, 'lambda_val': 0.06846521771059688, 'batch_size': 2769, 'optimizer': 'SGD'}. Best is trial 5 with value: 0.06256097437830344.
2026-05-19 17:54:03,217 - experiment_functions - INFO - Early stopping at epoch 1150. Best Recall: 0.0398
2026-05-19 17:54:03,983 - optuna.study.study - INFO - Trial 9 finished with value: 0.03978568525426008 and parameters: {'n_layers': 4, 'embedding_dim': 256, 'lr': 0.00027364077240100775, 'lambda_val': 2.3889160196972283e-05, 'batch_size': 1072, 'optimizer': 'Adam'}. Best is trial 5 with value: 0.06256097437830344.
2026-05-19 17:54:17,933 - experiment_functions - INFO - Early stopping at epoch 850. Best Recall: 0.0153
2026-05-19 17:54:18,022 - optuna.study.study - INFO - Trial 10 finished with value: 0.0153287748475331 and parameters: {'n_layers': 1, 'embedding_dim': 128, 'lr': 0.07114324723271359, 'lambda_val': 0.0002456465328313135, 'batch_size': 551, 'optimizer': 'RMSprop'}. Best is trial 5 with value: 0.06256097437830344.
2026-05-19 17:54:25,152 - optuna.study._optimize - INFO - Trial 11 pruned. 
2026-05-19 17:54:46,744 - experiment_functions - INFO - Early stopping at epoch 2900. Best Recall: 0.0578
2026-05-19 17:54:46,834 - optuna.study.study - INFO - Trial 12 finished with value: 0.05781873562546154 and parameters: {'n_layers': 2, 'embedding_dim': 256, 'lr': 0.0002623218325166679, 'lambda_val': 1.77851070374576e-06, 'batch_size': 706, 'optimizer': 'Adam'}. Best is trial 5 with value: 0.06256097437830344.
2026-05-19 17:54:53,748 - experiment_functions - INFO - Early stopping at epoch 1100. Best Recall: 0.0559
2026-05-19 17:54:54,010 - optuna.study.study - INFO - Trial 13 finished with value: 0.055916682266638394 and parameters: {'n_layers': 2, 'embedding_dim': 128, 'lr': 0.0004529738143545502, 'lambda_val': 1.6970904693295175e-06, 'batch_size': 555, 'optimizer': 'RMSprop'}. Best is trial 5 with value: 0.06256097437830344.
2026-05-19 17:55:00,223 - optuna.study._optimize - INFO - Trial 14 pruned. 
2026-05-19 17:55:05,816 - experiment_functions - INFO - Early stopping at epoch 800. Best Recall: 0.0262
2026-05-19 17:55:05,926 - optuna.study.study - INFO - Trial 15 finished with value: 0.026211892776243504 and parameters: {'n_layers': 2, 'embedding_dim': 64, 'lr': 0.0031139193986210044, 'lambda_val': 0.0007836846975305026, 'batch_size': 1027, 'optimizer': 'RMSprop'}. Best is trial 5 with value: 0.06256097437830344.
2026-05-19 17:55:17,750 - experiment_functions - INFO - Early stopping at epoch 850. Best Recall: 0.0536
2026-05-19 17:55:17,844 - optuna.study.study - INFO - Trial 16 finished with value: 0.053580802756252016 and parameters: {'n_layers': 2, 'embedding_dim': 256, 'lr': 0.0005828272734056806, 'lambda_val': 6.248639468265369e-06, 'batch_size': 1816, 'optimizer': 'Adam'}. Best is trial 5 with value: 0.06256097437830344.
2026-05-19 17:55:24,105 - optuna.study._optimize - INFO - Trial 17 pruned. 
2026-05-19 17:55:28,923 - experiment_functions - INFO - Early stopping at epoch 750. Best Recall: 0.0219
2026-05-19 17:55:29,013 - optuna.study.study - INFO - Trial 18 finished with value: 0.021863023854229502 and parameters: {'n_layers': 2, 'embedding_dim': 64, 'lr': 0.004089149986495563, 'lambda_val': 3.856826793302172e-06, 'batch_size': 1770, 'optimizer': 'RMSprop'}. Best is trial 5 with value: 0.06256097437830344.
2026-05-19 17:55:35,271 - experiment_functions - INFO - Early stopping at epoch 850. Best Recall: 0.0322
2026-05-19 17:55:35,406 - optuna.study.study - INFO - Trial 19 finished with value: 0.03219253683766168 and parameters: {'n_layers': 3, 'embedding_dim': 32, 'lr': 0.0006970676880126058, 'lambda_val': 1.3208983568198868e-05, 'batch_size': 2300, 'optimizer': 'Adam'}. Best is trial 5 with value: 0.06256097437830344.
2026-05-19 17:55:39,023 - experiment_functions - INFO - Early stopping at epoch 500. Best Recall: 0.0024
2026-05-19 17:55:39,123 - optuna.study.study - INFO - Trial 20 finished with value: 0.0023743124674806505 and parameters: {'n_layers': 1, 'embedding_dim': 128, 'lr': 1.247481379367048e-05, 'lambda_val': 0.00030358935952434123, 'batch_size': 918, 'optimizer': 'Adam'}. Best is trial 5 with value: 0.06256097437830344.
2026-05-19 17:55:48,309 - experiment_functions - INFO - Early stopping at epoch 1400. Best Recall: 0.0631
2026-05-19 17:55:48,458 - optuna.study.study - INFO - Trial 21 finished with value: 0.06312826758809428 and parameters: {'n_layers': 2, 'embedding_dim': 128, 'lr': 0.0003908590976830095, 'lambda_val': 1.3890337811226421e-06, 'batch_size': 523, 'optimizer': 'RMSprop'}. Best is trial 21 with value: 0.06312826758809428.
2026-05-19 17:56:00,715 - experiment_functions - INFO - Early stopping at epoch 1800. Best Recall: 0.0639
2026-05-19 17:56:00,811 - optuna.study.study - INFO - Trial 22 finished with value: 0.06386665981552922 and parameters: {'n_layers': 2, 'embedding_dim': 128, 'lr': 0.0002877058434573989, 'lambda_val': 2.165930739578323e-06, 'batch_size': 817, 'optimizer': 'RMSprop'}. Best is trial 22 with value: 0.06386665981552922.
2026-05-19 17:56:08,905 - optuna.study._optimize - INFO - Trial 23 pruned. 
2026-05-19 17:56:15,009 - experiment_functions - INFO - Early stopping at epoch 800. Best Recall: 0.0358
2026-05-19 17:56:15,109 - optuna.study.study - INFO - Trial 24 finished with value: 0.03575508275366311 and parameters: {'n_layers': 2, 'embedding_dim': 128, 'lr': 0.001247725972895867, 'lambda_val': 2.392063563584459e-06, 'batch_size': 909, 'optimizer': 'RMSprop'}. Best is trial 22 with value: 0.06386665981552922.
2026-05-19 17:56:22,900 - optuna.study._optimize - INFO - Trial 25 pruned. 
2026-05-19 17:56:29,511 - optuna.study._optimize - INFO - Trial 26 pruned. 
2026-05-19 17:56:36,172 - optuna.study._optimize - INFO - Trial 27 pruned. 
2026-05-19 17:56:43,143 - optuna.study._optimize - INFO - Trial 28 pruned. 
2026-05-19 17:56:47,982 - experiment_functions - INFO - Early stopping at epoch 650. Best Recall: 0.0171
2026-05-19 17:56:48,072 - optuna.study.study - INFO - Trial 29 finished with value: 0.0171311875902612 and parameters: {'n_layers': 3, 'embedding_dim': 96, 'lr': 0.0009539019635707974, 'lambda_val': 0.029439786532657244, 'batch_size': 1221, 'optimizer': 'RMSprop'}. Best is trial 22 with value: 0.06386665981552922.
2026-05-19 17:56:56,163 - optuna.study._optimize - INFO - Trial 30 pruned. 
2026-05-19 17:57:09,124 - experiment_functions - INFO - Early stopping at epoch 1350. Best Recall: 0.0615
2026-05-19 17:57:09,213 - optuna.study.study - INFO - Trial 31 finished with value: 0.06150078998727867 and parameters: {'n_layers': 2, 'embedding_dim': 256, 'lr': 0.0003326735890876521, 'lambda_val': 2.077532164413658e-06, 'batch_size': 803, 'optimizer': 'Adam'}. Best is trial 22 with value: 0.06386665981552922.
2026-05-19 17:57:15,997 - optuna.study._optimize - INFO - Trial 32 pruned. 
2026-05-19 17:57:24,884 - optuna.study._optimize - INFO - Trial 33 pruned. 
2026-05-19 17:57:28,534 - experiment_functions - INFO - Early stopping at epoch 500. Best Recall: 0.0022
2026-05-19 17:57:28,644 - optuna.study.study - INFO - Trial 34 finished with value: 0.0021870766091002625 and parameters: {'n_layers': 2, 'embedding_dim': 32, 'lr': 2.224871433657281e-05, 'lambda_val': 2.6399750419534857e-05, 'batch_size': 1339, 'optimizer': 'SGD'}. Best is trial 22 with value: 0.06386665981552922.
2026-05-19 17:57:35,923 - optuna.study._optimize - INFO - Trial 35 pruned. 
2026-05-19 17:57:39,513 - experiment_functions - INFO - Early stopping at epoch 500. Best Recall: 0.0015
2026-05-19 17:57:39,604 - optuna.study.study - INFO - Trial 36 finished with value: 0.001539704530814342 and parameters: {'n_layers': 2, 'embedding_dim': 64, 'lr': 0.0017642780938914556, 'lambda_val': 1.012565361379539e-06, 'batch_size': 2698, 'optimizer': 'SGD'}. Best is trial 22 with value: 0.06386665981552922.
2026-05-19 17:57:44,766 - experiment_functions - INFO - Early stopping at epoch 850. Best Recall: 0.0554
2026-05-19 17:57:44,859 - optuna.study.study - INFO - Trial 37 finished with value: 0.0554109424996712 and parameters: {'n_layers': 1, 'embedding_dim': 64, 'lr': 0.0007869312189238723, 'lambda_val': 2.515926201475755e-06, 'batch_size': 1385, 'optimizer': 'RMSprop'}. Best is trial 22 with value: 0.06386665981552922.
2026-05-19 17:57:53,095 - optuna.study._optimize - INFO - Trial 38 pruned. 
2026-05-19 17:57:57,694 - experiment_functions - INFO - Early stopping at epoch 500. Best Recall: 0.0017
2026-05-19 17:57:57,785 - optuna.study.study - INFO - Trial 39 finished with value: 0.0017162437196068555 and parameters: {'n_layers': 3, 'embedding_dim': 96, 'lr': 3.510802570185706e-05, 'lambda_val': 5.411236284098108e-06, 'batch_size': 3143, 'optimizer': 'SGD'}. Best is trial 22 with value: 0.06386665981552922.
2026-05-19 17:58:04,570 - experiment_functions - INFO - Early stopping at epoch 950. Best Recall: 0.0526
2026-05-19 17:58:04,670 - optuna.study.study - INFO - Trial 40 finished with value: 0.05262500257776619 and parameters: {'n_layers': 2, 'embedding_dim': 128, 'lr': 0.0003497783204766404, 'lambda_val': 7.764527411549996e-06, 'batch_size': 3781, 'optimizer': 'RMSprop'}. Best is trial 22 with value: 0.06386665981552922.
2026-05-19 17:58:17,607 - experiment_functions - INFO - Early stopping at epoch 1700. Best Recall: 0.0600
2026-05-19 17:58:17,749 - optuna.study.study - INFO - Trial 41 finished with value: 0.06001808790545003 and parameters: {'n_layers': 2, 'embedding_dim': 256, 'lr': 0.0002635503342039464, 'lambda_val': 2.563387242735851e-06, 'batch_size': 718, 'optimizer': 'Adam'}. Best is trial 22 with value: 0.06386665981552922.
2026-05-19 17:58:26,097 - experiment_functions - INFO - Early stopping at epoch 1100. Best Recall: 0.0569
