2026-05-19 19:08:08,849 - optuna.study._optimize - INFO - Trial 199 pruned. 
2026-05-19 19:08:14,252 - experiment_functions - INFO - Early stopping at epoch 950. Best Recall: 0.0020
2026-05-19 19:08:14,818 - optuna.study.study - INFO - Trial 200 finished with value: 0.001968297201304214 and parameters: {'n_layers': 1, 'embedding_dim': 128, 'lr': 1.023552193789572e-05, 'lambda_val': 4.2993900683640825e-06, 'batch_size': 516, 'optimizer': 'RMSprop'}. Best is trial 147 with value: 0.02664397369077561.
2026-05-19 19:08:22,788 - experiment_functions - INFO - Early stopping at epoch 1150. Best Recall: 0.0200
2026-05-19 19:08:22,890 - optuna.study.study - INFO - Trial 201 finished with value: 0.019967562760556636 and parameters: {'n_layers': 1, 'embedding_dim': 128, 'lr': 0.0004399194814902064, 'lambda_val': 5.5399620498458354e-06, 'batch_size': 626, 'optimizer': 'RMSprop'}. Best is trial 147 with value: 0.02664397369077561.
2026-05-19 19:08:28,036 - experiment_functions - INFO - Early stopping at epoch 900. Best Recall: 0.0183
2026-05-19 19:08:28,136 - optuna.study.study - INFO - Trial 202 finished with value: 0.018329857172670768 and parameters: {'n_layers': 1, 'embedding_dim': 128, 'lr': 0.0006042785813655083, 'lambda_val': 8.127419422629301e-06, 'batch_size': 662, 'optimizer': 'RMSprop'}. Best is trial 147 with value: 0.02664397369077561.
2026-05-19 19:08:35,647 - optuna.study._optimize - INFO - Trial 203 pruned. 
2026-05-19 19:08:40,686 - experiment_functions - INFO - Early stopping at epoch 850. Best Recall: 0.0192
2026-05-19 19:08:40,788 - optuna.study.study - INFO - Trial 204 finished with value: 0.019236763110659725 and parameters: {'n_layers': 1, 'embedding_dim': 128, 'lr': 0.000732235042262133, 'lambda_val': 1.4103080614248245e-05, 'batch_size': 762, 'optimizer': 'RMSprop'}. Best is trial 147 with value: 0.02664397369077561.
2026-05-19 19:08:48,414 - optuna.study._optimize - INFO - Trial 205 pruned. 
2026-05-19 19:09:04,946 - optuna.study._optimize - INFO - Trial 206 pruned. 
2026-05-19 19:09:08,028 - experiment_functions - INFO - Early stopping at epoch 500. Best Recall: 0.0008
2026-05-19 19:09:08,130 - optuna.study.study - INFO - Trial 207 finished with value: 0.0008069865820174865 and parameters: {'n_layers': 1, 'embedding_dim': 128, 'lr': 0.0004053592487811368, 'lambda_val': 4.814599597882334e-05, 'batch_size': 717, 'optimizer': 'SGD'}. Best is trial 147 with value: 0.02664397369077561.
2026-05-19 19:09:13,819 - optuna.study._optimize - INFO - Trial 208 pruned. 
2026-05-19 19:09:20,177 - optuna.study._optimize - INFO - Trial 209 pruned. 
2026-05-19 19:09:24,186 - experiment_functions - INFO - Early stopping at epoch 600. Best Recall: 0.0096
2026-05-19 19:09:24,278 - optuna.study.study - INFO - Trial 210 finished with value: 0.009569647061333272 and parameters: {'n_layers': 1, 'embedding_dim': 128, 'lr': 0.0007081087085485452, 'lambda_val': 0.0004115939279669843, 'batch_size': 3513, 'optimizer': 'RMSprop'}. Best is trial 147 with value: 0.02664397369077561.
2026-05-19 19:09:29,959 - experiment_functions - INFO - Early stopping at epoch 500. Best Recall: 0.0011
2026-05-19 19:09:30,050 - optuna.study.study - INFO - Trial 211 finished with value: 0.0010776513059737609 and parameters: {'n_layers': 1, 'embedding_dim': 128, 'lr': 1.5933990470203964e-05, 'lambda_val': 4.992025673015118e-06, 'batch_size': 585, 'optimizer': 'Adam'}. Best is trial 147 with value: 0.02664397369077561.
2026-05-19 19:09:34,560 - experiment_functions - INFO - Early stopping at epoch 750. Best Recall: 0.0134
2026-05-19 19:09:34,650 - optuna.study.study - INFO - Trial 212 finished with value: 0.013426798718445961 and parameters: {'n_layers': 1, 'embedding_dim': 128, 'lr': 0.0008978706845687503, 'lambda_val': 4.292025837498495e-06, 'batch_size': 2491, 'optimizer': 'Adam'}. Best is trial 147 with value: 0.02664397369077561.
2026-05-19 19:09:39,289 - experiment_functions - INFO - Early stopping at epoch 650. Best Recall: 0.0194
2026-05-19 19:09:39,391 - optuna.study.study - INFO - Trial 213 finished with value: 0.01944548156678549 and parameters: {'n_layers': 1, 'embedding_dim': 128, 'lr': 0.0014925780776070547, 'lambda_val': 7.416270807339332e-06, 'batch_size': 659, 'optimizer': 'Adam'}. Best is trial 147 with value: 0.02664397369077561.
2026-05-19 19:09:43,554 - experiment_functions - INFO - Early stopping at epoch 650. Best Recall: 0.0188
2026-05-19 19:09:43,667 - optuna.study.study - INFO - Trial 214 finished with value: 0.01882764229194566 and parameters: {'n_layers': 1, 'embedding_dim': 128, 'lr': 0.0011257307795835506, 'lambda_val': 5.687528532267241e-06, 'batch_size': 576, 'optimizer': 'Adam'}. Best is trial 147 with value: 0.02664397369077561.
2026-05-19 19:09:51,647 - experiment_functions - INFO - Early stopping at epoch 950. Best Recall: 0.0237
2026-05-19 19:09:51,756 - optuna.study.study - INFO - Trial 215 finished with value: 0.02371399261155901 and parameters: {'n_layers': 1, 'embedding_dim': 128, 'lr': 0.0006007752248043313, 'lambda_val': 2.1065276567576346e-06, 'batch_size': 512, 'optimizer': 'Adam'}. Best is trial 147 with value: 0.02664397369077561.
2026-05-19 19:09:58,223 - optuna.study._optimize - INFO - Trial 216 pruned. 
2026-05-19 19:10:03,187 - experiment_functions - INFO - Early stopping at epoch 850. Best Recall: 0.0166
2026-05-19 19:10:03,307 - optuna.study.study - INFO - Trial 217 finished with value: 0.016606911548561407 and parameters: {'n_layers': 1, 'embedding_dim': 128, 'lr': 0.00047349901238088777, 'lambda_val': 1.6375081055476045e-06, 'batch_size': 709, 'optimizer': 'Adam'}. Best is trial 147 with value: 0.02664397369077561.
2026-05-19 19:10:13,202 - experiment_functions - INFO - Early stopping at epoch 1150. Best Recall: 0.0206
2026-05-19 19:10:13,310 - optuna.study.study - INFO - Trial 218 finished with value: 0.02063870506987434 and parameters: {'n_layers': 1, 'embedding_dim': 128, 'lr': 0.00036677258192552314, 'lambda_val': 3.5058394693045184e-06, 'batch_size': 647, 'optimizer': 'Adam'}. Best is trial 147 with value: 0.02664397369077561.
2026-05-19 19:10:18,593 - experiment_functions - INFO - Early stopping at epoch 850. Best Recall: 0.0175
2026-05-19 19:10:18,704 - optuna.study.study - INFO - Trial 219 finished with value: 0.01751050876214733 and parameters: {'n_layers': 1, 'embedding_dim': 96, 'lr': 0.0006253067789196925, 'lambda_val': 2.3819768884682024e-06, 'batch_size': 513, 'optimizer': 'RMSprop'}. Best is trial 147 with value: 0.02664397369077561.
2026-05-19 19:10:25,461 - optuna.study._optimize - INFO - Trial 220 pruned. 
2026-05-19 19:10:35,276 - optuna.study._optimize - INFO - Trial 221 pruned. 
2026-05-19 19:10:43,436 - optuna.study._optimize - INFO - Trial 222 pruned. 
2026-05-19 19:10:48,969 - experiment_functions - INFO - Early stopping at epoch 800. Best Recall: 0.0160
2026-05-19 19:10:49,148 - optuna.study.study - INFO - Trial 223 finished with value: 0.01596343253238886 and parameters: {'n_layers': 1, 'embedding_dim': 128, 'lr': 0.0005097488819199748, 'lambda_val': 6.231204224371105e-06, 'batch_size': 3049, 'optimizer': 'Adam'}. Best is trial 147 with value: 0.02664397369077561.
2026-05-19 19:10:55,274 - optuna.study._optimize - INFO - Trial 224 pruned. 
2026-05-19 19:11:01,904 - experiment_functions - INFO - Early stopping at epoch 1100. Best Recall: 0.0203
2026-05-19 19:11:02,025 - optuna.study.study - INFO - Trial 225 finished with value: 0.02028465094263969 and parameters: {'n_layers': 1, 'embedding_dim': 32, 'lr': 0.0005168237821447661, 'lambda_val': 4.889435198370223e-06, 'batch_size': 585, 'optimizer': 'Adam'}. Best is trial 147 with value: 0.02664397369077561.
2026-05-19 19:11:09,781 - experiment_functions - INFO - Early stopping at epoch 750. Best Recall: 0.0172
2026-05-19 19:11:09,901 - optuna.study.study - INFO - Trial 226 finished with value: 0.01721208544115837 and parameters: {'n_layers': 1, 'embedding_dim': 128, 'lr': 0.0007857004362031953, 'lambda_val': 3.99312378266779e-06, 'batch_size': 729, 'optimizer': 'Adam'}. Best is trial 147 with value: 0.02664397369077561.
2026-05-19 19:11:16,178 - optuna.study._optimize - INFO - Trial 227 pruned. 
2026-05-19 19:11:27,687 - optuna.study._optimize - INFO - Trial 228 pruned. 
2026-05-19 19:11:41,472 - optuna.study._optimize - INFO - Trial 229 pruned. 
2026-05-19 19:11:50,633 - optuna.study._optimize - INFO - Trial 230 pruned. 
2026-05-19 19:11:55,009 - experiment_functions - INFO - Early stopping at epoch 750. Best Recall: 0.0202
2026-05-19 19:11:55,100 - optuna.study.study - INFO - Trial 231 finished with value: 0.02017903149682274 and parameters: {'n_layers': 1, 'embedding_dim': 128, 'lr': 0.0006739986642090679, 'lambda_val': 5.261952717245229e-06, 'batch_size': 517, 'optimizer': 'Adam'}. Best is trial 147 with value: 0.02664397369077561.
2026-05-19 19:11:59,695 - experiment_functions - INFO - Early stopping at epoch 800. Best Recall: 0.0215
2026-05-19 19:11:59,785 - optuna.study.study - INFO - Trial 232 finished with value: 0.02147916482308454 and parameters: {'n_layers': 1, 'embedding_dim': 128, 'lr': 0.0008513690120449411, 'lambda_val': 3.7442807340191413e-06, 'batch_size': 587, 'optimizer': 'Adam'}. Best is trial 147 with value: 0.02664397369077561.
2026-05-19 19:12:05,768 - experiment_functions - INFO - Early stopping at epoch 1000. Best Recall: 0.0210
2026-05-19 19:12:05,869 - optuna.study.study - INFO - Trial 233 finished with value: 0.0210482455769627 and parameters: {'n_layers': 1, 'embedding_dim': 128, 'lr': 0.0007804294681894432, 'lambda_val': 3.885951206671338e-06, 'batch_size': 583, 'optimizer': 'Adam'}. Best is trial 147 with value: 0.02664397369077561.
2026-05-19 19:12:10,660 - experiment_functions - INFO - Early stopping at epoch 750. Best Recall: 0.0170
2026-05-19 19:12:10,761 - optuna.study.study - INFO - Trial 234 finished with value: 0.016960506629428777 and parameters: {'n_layers': 1, 'embedding_dim': 128, 'lr': 0.0008206925484685862, 'lambda_val': 4.490327990043577e-06, 'batch_size': 578, 'optimizer': 'Adam'}. Best is trial 147 with value: 0.02664397369077561.
2026-05-19 19:12:15,743 - experiment_functions - INFO - Early stopping at epoch 800. Best Recall: 0.0209
2026-05-19 19:12:15,888 - optuna.study.study - INFO - Trial 235 finished with value: 0.020855103521571473 and parameters: {'n_layers': 1, 'embedding_dim': 128, 'lr': 0.0009378242741377793, 'lambda_val': 6.684514833922902e-06, 'batch_size': 513, 'optimizer': 'Adam'}. Best is trial 147 with value: 0.02664397369077561.
2026-05-19 19:12:22,735 - experiment_functions - INFO - Early stopping at epoch 800. Best Recall: 0.0201
2026-05-19 19:12:22,869 - optuna.study.study - INFO - Trial 236 finished with value: 0.020113993217779697 and parameters: {'n_layers': 1, 'embedding_dim': 128, 'lr': 0.0007139515275077015, 'lambda_val': 1.9031741651342805e-05, 'batch_size': 587, 'optimizer': 'RMSprop'}. Best is trial 147 with value: 0.02664397369077561.
2026-05-19 19:12:28,508 - experiment_functions - INFO - Early stopping at epoch 900. Best Recall: 0.0191
2026-05-19 19:12:28,587 - optuna.study.study - INFO - Trial 237 finished with value: 0.019117106489957132 and parameters: {'n_layers': 1, 'embedding_dim': 128, 'lr': 0.0005870730526165256, 'lambda_val': 3.799338160257966e-06, 'batch_size': 690, 'optimizer': 'Adam'}. Best is trial 147 with value: 0.02664397369077561.
2026-05-19 19:12:32,924 - experiment_functions - INFO - Early stopping at epoch 750. Best Recall: 0.0206
2026-05-19 19:12:33,052 - optuna.study.study - INFO - Trial 238 finished with value: 0.020597332053380813 and parameters: {'n_layers': 1, 'embedding_dim': 128, 'lr': 0.00109408456308063, 'lambda_val': 1.9855729036189276e-06, 'batch_size': 590, 'optimizer': 'Adam'}. Best is trial 147 with value: 0.02664397369077561.
2026-05-19 19:12:39,899 - experiment_functions - INFO - Early stopping at epoch 1100. Best Recall: 0.0206
2026-05-19 19:12:40,010 - optuna.study.study - INFO - Trial 239 finished with value: 0.020570869093840087 and parameters: {'n_layers': 1, 'embedding_dim': 128, 'lr': 0.0004502960685495356, 'lambda_val': 7.981886299685345e-06, 'batch_size': 654, 'optimizer': 'RMSprop'}. Best is trial 147 with value: 0.02664397369077561.
2026-05-19 19:12:44,260 - experiment_functions - INFO - Early stopping at epoch 650. Best Recall: 0.0154
2026-05-19 19:12:44,378 - optuna.study.study - INFO - Trial 240 finished with value: 0.015376651913703139 and parameters: {'n_layers': 1, 'embedding_dim': 128, 'lr': 0.000794575573034017, 'lambda_val': 0.022632266692404316, 'batch_size': 577, 'optimizer': 'Adam'}. Best is trial 147 with value: 0.02664397369077561.
2026-05-19 19:12:49,161 - experiment_functions - INFO - Early stopping at epoch 750. Best Recall: 0.0194
2026-05-19 19:12:49,262 - optuna.study.study - INFO - Trial 241 finished with value: 0.019439164238551642 and parameters: {'n_layers': 1, 'embedding_dim': 128, 'lr': 0.0009472288390789216, 'lambda_val': 6.334430309226176e-06, 'batch_size': 521, 'optimizer': 'Adam'}. Best is trial 147 with value: 0.02664397369077561.
2026-05-19 19:12:53,980 - experiment_functions - INFO - Early stopping at epoch 800. Best Recall: 0.0233
2026-05-19 19:12:54,058 - optuna.study.study - INFO - Trial 242 finished with value: 0.023308163975915393 and parameters: {'n_layers': 1, 'embedding_dim': 128, 'lr': 0.0009654867320799187, 'lambda_val': 6.049541810562741e-06, 'batch_size': 518, 'optimizer': 'Adam'}. Best is trial 147 with value: 0.02664397369077561.
2026-05-19 19:12:58,818 - experiment_functions - INFO - Early stopping at epoch 750. Best Recall: 0.0199
2026-05-19 19:12:58,920 - optuna.study.study - INFO - Trial 243 finished with value: 0.019912169104077112 and parameters: {'n_layers': 1, 'embedding_dim': 128, 'lr': 0.0012828066695587399, 'lambda_val': 4.836029040994759e-06, 'batch_size': 626, 'optimizer': 'Adam'}. Best is trial 147 with value: 0.02664397369077561.
2026-05-19 19:13:04,774 - experiment_functions - INFO - Early stopping at epoch 950. Best Recall: 0.0209
2026-05-19 19:13:04,919 - optuna.study.study - INFO - Trial 244 finished with value: 0.02086015886791108 and parameters: {'n_layers': 1, 'embedding_dim': 128, 'lr': 0.0005993392666830895, 'lambda_val': 0.0001030446299435245, 'batch_size': 702, 'optimizer': 'Adam'}. Best is trial 147 with value: 0.02664397369077561.
2026-05-19 19:13:10,420 - experiment_functions - INFO - Early stopping at epoch 900. Best Recall: 0.0182
2026-05-19 19:13:10,531 - optuna.study.study - INFO - Trial 245 finished with value: 0.018190239658794 and parameters: {'n_layers': 1, 'embedding_dim': 128, 'lr': 0.0007301096620324109, 'lambda_val': 3.0123810506517264e-06, 'batch_size': 569, 'optimizer': 'Adam'}. Best is trial 147 with value: 0.02664397369077561.
2026-05-19 19:13:18,450 - optuna.study._optimize - INFO - Trial 246 pruned. 
2026-05-19 19:13:22,793 - experiment_functions - INFO - Early stopping at epoch 750. Best Recall: 0.0212
2026-05-19 19:13:22,874 - optuna.study.study - INFO - Trial 247 finished with value: 0.021209832465051842 and parameters: {'n_layers': 1, 'embedding_dim': 128, 'lr': 0.0006465557563098611, 'lambda_val': 5.672737917460182e-06, 'batch_size': 630, 'optimizer': 'RMSprop'}. Best is trial 147 with value: 0.02664397369077561.
2026-05-19 19:13:32,753 - experiment_functions - INFO - Early stopping at epoch 950. Best Recall: 0.0180
2026-05-19 19:13:32,918 - optuna.study.study - INFO - Trial 248 finished with value: 0.017961439630334378 and parameters: {'n_layers': 1, 'embedding_dim': 128, 'lr': 0.0006755177523676666, 'lambda_val': 5.80081047710201e-06, 'batch_size': 623, 'optimizer': 'RMSprop'}. Best is trial 147 with value: 0.02664397369077561.
2026-05-19 19:13:37,382 - experiment_functions - INFO - Early stopping at epoch 700. Best Recall: 0.0166
2026-05-19 19:13:37,481 - optuna.study.study - INFO - Trial 249 finished with value: 0.016588612752816485 and parameters: {'n_layers': 1, 'embedding_dim': 128, 'lr': 0.0010082967969823758, 'lambda_val': 8.403571315837631e-06, 'batch_size': 704, 'optimizer': 'RMSprop'}. Best is trial 147 with value: 0.02664397369077561.
2026-05-19 19:13:42,304 - experiment_functions - INFO - Early stopping at epoch 750. Best Recall: 0.0183
2026-05-19 19:13:42,413 - optuna.study.study - INFO - Trial 250 finished with value: 0.018340149153332843 and parameters: {'n_layers': 1, 'embedding_dim': 64, 'lr': 0.0008791046673058069, 'lambda_val': 3.2061157614554598e-06, 'batch_size': 577, 'optimizer': 'RMSprop'}. Best is trial 147 with value: 0.02664397369077561.
2026-05-19 19:13:48,231 - experiment_functions - INFO - Early stopping at epoch 950. Best Recall: 0.0224
2026-05-19 19:13:48,320 - optuna.study.study - INFO - Trial 251 finished with value: 0.022408653493973012 and parameters: {'n_layers': 1, 'embedding_dim': 128, 'lr': 0.0006092686533103828, 'lambda_val': 7.679987995398215e-05, 'batch_size': 644, 'optimizer': 'RMSprop'}. Best is trial 147 with value: 0.02664397369077561.
2026-05-19 19:13:53,536 - experiment_functions - INFO - Early stopping at epoch 900. Best Recall: 0.0214
2026-05-19 19:13:53,635 - optuna.study.study - INFO - Trial 252 finished with value: 0.021368329837612155 and parameters: {'n_layers': 1, 'embedding_dim': 128, 'lr': 0.0005807010851703638, 'lambda_val': 1.1142396995327204e-05, 'batch_size': 816, 'optimizer': 'RMSprop'}. Best is trial 147 with value: 0.02664397369077561.
2026-05-19 19:13:58,439 - experiment_functions - INFO - Early stopping at epoch 800. Best Recall: 0.0159
2026-05-19 19:13:58,540 - optuna.study.study - INFO - Trial 253 finished with value: 0.01594395050608983 and parameters: {'n_layers': 1, 'embedding_dim': 128, 'lr': 0.0005277163993523133, 'lambda_val': 6.703948632009612e-05, 'batch_size': 763, 'optimizer': 'RMSprop'}. Best is trial 147 with value: 0.02664397369077561.
2026-05-19 19:14:03,948 - experiment_functions - INFO - Early stopping at epoch 750. Best Recall: 0.0137
2026-05-19 19:14:04,059 - optuna.study.study - INFO - Trial 254 finished with value: 0.013693709966814415 and parameters: {'n_layers': 2, 'embedding_dim': 128, 'lr': 0.00043669608544092867, 'lambda_val': 8.237479568399034e-05, 'batch_size': 785, 'optimizer': 'RMSprop'}. Best is trial 147 with value: 0.02664397369077561.
2026-05-19 19:14:09,913 - experiment_functions - INFO - Early stopping at epoch 900. Best Recall: 0.0194
2026-05-19 19:14:09,992 - optuna.study.study - INFO - Trial 255 finished with value: 0.01939356385612445 and parameters: {'n_layers': 1, 'embedding_dim': 128, 'lr': 0.000594104930808931, 'lambda_val': 1.3032968897422413e-05, 'batch_size': 512, 'optimizer': 'RMSprop'}. Best is trial 147 with value: 0.02664397369077561.
2026-05-19 19:14:14,559 - experiment_functions - INFO - Early stopping at epoch 750. Best Recall: 0.0188
2026-05-19 19:14:14,650 - optuna.study.study - INFO - Trial 256 finished with value: 0.018816110377385335 and parameters: {'n_layers': 1, 'embedding_dim': 128, 'lr': 0.0004867058355138504, 'lambda_val': 0.00015469053865189072, 'batch_size': 850, 'optimizer': 'RMSprop'}. Best is trial 147 with value: 0.02664397369077561.
2026-05-19 19:14:20,722 - optuna.study._optimize - INFO - Trial 257 pruned. 
2026-05-19 19:14:26,746 - optuna.study._optimize - INFO - Trial 258 pruned. 
2026-05-19 19:14:33,559 - experiment_functions - INFO - Early stopping at epoch 500. Best Recall: 0.0012
2026-05-19 19:14:33,694 - optuna.study.study - INFO - Trial 259 finished with value: 0.0011648399000072512 and parameters: {'n_layers': 1, 'embedding_dim': 32, 'lr': 0.0020642529334088926, 'lambda_val': 1.575713966709159e-05, 'batch_size': 712, 'optimizer': 'SGD'}. Best is trial 147 with value: 0.02664397369077561.
2026-05-19 19:14:40,393 - experiment_functions - INFO - Early stopping at epoch 1100. Best Recall: 0.0231
2026-05-19 19:14:40,483 - optuna.study.study - INFO - Trial 260 finished with value: 0.023070592977778998 and parameters: {'n_layers': 1, 'embedding_dim': 128, 'lr': 0.00041590243523045536, 'lambda_val': 0.00010154749623022589, 'batch_size': 573, 'optimizer': 'RMSprop'}. Best is trial 147 with value: 0.02664397369077561.
2026-05-19 19:14:50,476 - optuna.study._optimize - INFO - Trial 261 pruned. 
2026-05-19 19:14:57,738 - optuna.study._optimize - INFO - Trial 262 pruned. 
2026-05-19 19:15:05,618 - optuna.study._optimize - INFO - Trial 263 pruned. 
2026-05-19 19:15:16,401 - experiment_functions - INFO - Early stopping at epoch 2150. Best Recall: 0.0262
2026-05-19 19:15:16,502 - optuna.study.study - INFO - Trial 264 finished with value: 0.026198946079920335 and parameters: {'n_layers': 1, 'embedding_dim': 128, 'lr': 0.0002943694753799393, 'lambda_val': 8.083468131168778e-05, 'batch_size': 672, 'optimizer': 'RMSprop'}. Best is trial 147 with value: 0.02664397369077561.
2026-05-19 19:15:24,249 - optuna.study._optimize - INFO - Trial 265 pruned. 
2026-05-19 19:15:37,767 - experiment_functions - INFO - Early stopping at epoch 2600. Best Recall: 0.0267
2026-05-19 19:15:37,860 - optuna.study.study - INFO - Trial 266 finished with value: 0.02671564327479486 and parameters: {'n_layers': 1, 'embedding_dim': 128, 'lr': 0.00023799838691438945, 'lambda_val': 8.71767433105485e-05, 'batch_size': 596, 'optimizer': 'RMSprop'}. Best is trial 266 with value: 0.02671564327479486.
2026-05-19 19:15:46,057 - optuna.study._optimize - INFO - Trial 267 pruned. 
2026-05-19 19:15:54,404 - optuna.study._optimize - INFO - Trial 268 pruned. 
2026-05-19 19:15:59,855 - optuna.study._optimize - INFO - Trial 269 pruned. 
2026-05-19 19:16:08,206 - optuna.study._optimize - INFO - Trial 270 pruned. 
2026-05-19 19:16:18,547 - optuna.study._optimize - INFO - Trial 271 pruned. 
2026-05-19 19:16:24,985 - optuna.study._optimize - INFO - Trial 272 pruned. 
2026-05-19 19:16:31,101 - optuna.study._optimize - INFO - Trial 273 pruned. 
2026-05-19 19:16:35,481 - experiment_functions - INFO - Early stopping at epoch 600. Best Recall: 0.0121
