2026-05-19 16:28:29,729 - optuna.study.study - INFO - Trial 72 finished with value: 0.10650778671749059 and parameters: {'n_layers': 1, 'embedding_dim': 256, 'lr': 0.001092488616118906, 'lambda_val': 5.981956993968063e-05, 'batch_size': 2856, 'optimizer': 'RMSprop'}. Best is trial 23 with value: 0.1396108253323291.
2026-05-19 16:28:36,822 - optuna.study._optimize - INFO - Trial 73 pruned. 
2026-05-19 16:28:44,473 - optuna.study._optimize - INFO - Trial 74 pruned. 
2026-05-19 16:28:51,227 - optuna.study._optimize - INFO - Trial 75 pruned. 
2026-05-19 16:28:56,684 - experiment_functions - INFO - Early stopping at epoch 700. Best Recall: 0.0981
2026-05-19 16:28:56,831 - optuna.study.study - INFO - Trial 76 finished with value: 0.09809523450817478 and parameters: {'n_layers': 1, 'embedding_dim': 256, 'lr': 0.0016582863769667182, 'lambda_val': 3.4101341087263676e-05, 'batch_size': 2404, 'optimizer': 'RMSprop'}. Best is trial 23 with value: 0.1396108253323291.
2026-05-19 16:29:11,671 - experiment_functions - INFO - Early stopping at epoch 500. Best Recall: 0.0020
2026-05-19 16:29:12,031 - optuna.study.study - INFO - Trial 77 finished with value: 0.001962452708395494 and parameters: {'n_layers': 1, 'embedding_dim': 32, 'lr': 0.00019697412469534415, 'lambda_val': 0.0006193808583592164, 'batch_size': 2600, 'optimizer': 'SGD'}. Best is trial 23 with value: 0.1396108253323291.
2026-05-19 16:29:19,819 - experiment_functions - INFO - Early stopping at epoch 900. Best Recall: 0.0785
2026-05-19 16:29:19,920 - optuna.study.study - INFO - Trial 78 finished with value: 0.0784873532668554 and parameters: {'n_layers': 2, 'embedding_dim': 256, 'lr': 0.00033007555639563935, 'lambda_val': 8.96150286413804e-05, 'batch_size': 2798, 'optimizer': 'RMSprop'}. Best is trial 23 with value: 0.1396108253323291.
2026-05-19 16:29:26,706 - experiment_functions - INFO - Early stopping at epoch 950. Best Recall: 0.1158
2026-05-19 16:29:26,807 - optuna.study.study - INFO - Trial 79 finished with value: 0.1157889773411446 and parameters: {'n_layers': 1, 'embedding_dim': 96, 'lr': 0.0009373143487939028, 'lambda_val': 0.00025273507727265786, 'batch_size': 1683, 'optimizer': 'RMSprop'}. Best is trial 23 with value: 0.1396108253323291.
2026-05-19 16:29:37,498 - optuna.study._optimize - INFO - Trial 80 pruned. 
2026-05-19 16:29:41,810 - experiment_functions - INFO - Early stopping at epoch 550. Best Recall: 0.0741
2026-05-19 16:29:41,909 - optuna.study.study - INFO - Trial 81 finished with value: 0.0741481654604687 and parameters: {'n_layers': 1, 'embedding_dim': 96, 'lr': 0.0031828586426300887, 'lambda_val': 0.0002808409815430563, 'batch_size': 1710, 'optimizer': 'RMSprop'}. Best is trial 23 with value: 0.1396108253323291.
2026-05-19 16:29:47,245 - experiment_functions - INFO - Early stopping at epoch 750. Best Recall: 0.0974
2026-05-19 16:29:47,335 - optuna.study.study - INFO - Trial 82 finished with value: 0.09739870757401954 and parameters: {'n_layers': 1, 'embedding_dim': 96, 'lr': 0.001354875225986103, 'lambda_val': 0.00017478491367818697, 'batch_size': 1573, 'optimizer': 'RMSprop'}. Best is trial 23 with value: 0.1396108253323291.
2026-05-19 16:29:52,932 - experiment_functions - INFO - Early stopping at epoch 800. Best Recall: 0.1027
2026-05-19 16:29:53,031 - optuna.study.study - INFO - Trial 83 finished with value: 0.10267847041115265 and parameters: {'n_layers': 1, 'embedding_dim': 96, 'lr': 0.0008271844912037518, 'lambda_val': 5.929882693857938e-05, 'batch_size': 1862, 'optimizer': 'RMSprop'}. Best is trial 23 with value: 0.1396108253323291.
2026-05-19 16:30:00,813 - experiment_functions - INFO - Early stopping at epoch 950. Best Recall: 0.0594
2026-05-19 16:30:00,903 - optuna.study.study - INFO - Trial 84 finished with value: 0.05941925830956343 and parameters: {'n_layers': 3, 'embedding_dim': 96, 'lr': 0.0004347830358534681, 'lambda_val': 0.00012153480835664576, 'batch_size': 2001, 'optimizer': 'RMSprop'}. Best is trial 23 with value: 0.1396108253323291.
2026-05-19 16:30:10,025 - optuna.study._optimize - INFO - Trial 85 pruned. 
2026-05-19 16:30:17,591 - optuna.study._optimize - INFO - Trial 86 pruned. 
2026-05-19 16:30:23,542 - experiment_functions - INFO - Early stopping at epoch 850. Best Recall: 0.1158
2026-05-19 16:30:23,644 - optuna.study.study - INFO - Trial 87 finished with value: 0.11577615191404016 and parameters: {'n_layers': 1, 'embedding_dim': 96, 'lr': 0.0009765394058822025, 'lambda_val': 1.9924556609038724e-05, 'batch_size': 2177, 'optimizer': 'RMSprop'}. Best is trial 23 with value: 0.1396108253323291.
2026-05-19 16:30:30,914 - optuna.study._optimize - INFO - Trial 88 pruned. 
2026-05-19 16:30:42,559 - experiment_functions - INFO - Early stopping at epoch 750. Best Recall: 0.0831
2026-05-19 16:30:42,668 - optuna.study.study - INFO - Trial 89 finished with value: 0.08307522109061617 and parameters: {'n_layers': 1, 'embedding_dim': 256, 'lr': 0.0019783938166622207, 'lambda_val': 7.391727427466071e-05, 'batch_size': 1647, 'optimizer': 'RMSprop'}. Best is trial 23 with value: 0.1396108253323291.
2026-05-19 16:30:50,200 - optuna.study._optimize - INFO - Trial 90 pruned. 
2026-05-19 16:30:57,032 - optuna.study._optimize - INFO - Trial 91 pruned. 
2026-05-19 16:31:03,559 - experiment_functions - INFO - Early stopping at epoch 750. Best Recall: 0.0986
2026-05-19 16:31:04,321 - optuna.study.study - INFO - Trial 92 finished with value: 0.09857131645074124 and parameters: {'n_layers': 1, 'embedding_dim': 96, 'lr': 0.0012851553477558771, 'lambda_val': 1.9987808555156666e-05, 'batch_size': 1470, 'optimizer': 'RMSprop'}. Best is trial 23 with value: 0.1396108253323291.
2026-05-19 16:31:18,969 - experiment_functions - INFO - Early stopping at epoch 850. Best Recall: 0.1016
2026-05-19 16:31:19,068 - optuna.study.study - INFO - Trial 93 finished with value: 0.10159727149406031 and parameters: {'n_layers': 1, 'embedding_dim': 96, 'lr': 0.0009338896068192433, 'lambda_val': 9.533052624250725e-05, 'batch_size': 1846, 'optimizer': 'RMSprop'}. Best is trial 23 with value: 0.1396108253323291.
2026-05-19 16:31:25,301 - experiment_functions - INFO - Early stopping at epoch 850. Best Recall: 0.1047
2026-05-19 16:31:25,423 - optuna.study.study - INFO - Trial 94 finished with value: 0.10465640929239885 and parameters: {'n_layers': 1, 'embedding_dim': 96, 'lr': 0.000980851085659763, 'lambda_val': 4.197768438776451e-05, 'batch_size': 2125, 'optimizer': 'RMSprop'}. Best is trial 23 with value: 0.1396108253323291.
2026-05-19 16:31:35,617 - experiment_functions - INFO - Early stopping at epoch 1400. Best Recall: 0.1365
2026-05-19 16:31:35,706 - optuna.study.study - INFO - Trial 95 finished with value: 0.13652020306390206 and parameters: {'n_layers': 1, 'embedding_dim': 256, 'lr': 0.00045186508020664094, 'lambda_val': 5.798519659110902e-05, 'batch_size': 1786, 'optimizer': 'RMSprop'}. Best is trial 23 with value: 0.1396108253323291.
2026-05-19 16:31:39,583 - experiment_functions - INFO - Early stopping at epoch 500. Best Recall: 0.0023
2026-05-19 16:31:39,671 - optuna.study.study - INFO - Trial 96 finished with value: 0.0023361587859870676 and parameters: {'n_layers': 1, 'embedding_dim': 256, 'lr': 0.0004238887782076752, 'lambda_val': 0.00013449765816080707, 'batch_size': 1981, 'optimizer': 'SGD'}. Best is trial 23 with value: 0.1396108253323291.
2026-05-19 16:31:47,155 - optuna.study._optimize - INFO - Trial 97 pruned. 
2026-05-19 16:32:01,989 - optuna.study._optimize - INFO - Trial 98 pruned. 
2026-05-19 16:32:14,567 - experiment_functions - INFO - Early stopping at epoch 1900. Best Recall: 0.1317
2026-05-19 16:32:14,656 - optuna.study.study - INFO - Trial 99 finished with value: 0.13166614825493705 and parameters: {'n_layers': 1, 'embedding_dim': 256, 'lr': 0.0005015486074869536, 'lambda_val': 7.358773298679959e-05, 'batch_size': 1888, 'optimizer': 'Adam'}. Best is trial 23 with value: 0.1396108253323291.
2026-05-19 16:32:22,188 - optuna.study._optimize - INFO - Trial 100 pruned. 
2026-05-19 16:32:30,783 - experiment_functions - INFO - Early stopping at epoch 1150. Best Recall: 0.1220
2026-05-19 16:32:30,882 - optuna.study.study - INFO - Trial 101 finished with value: 0.1220144572033434 and parameters: {'n_layers': 1, 'embedding_dim': 256, 'lr': 0.0006571175000096707, 'lambda_val': 7.508533619417801e-05, 'batch_size': 1897, 'optimizer': 'Adam'}. Best is trial 23 with value: 0.1396108253323291.
2026-05-19 16:32:39,404 - optuna.study._optimize - INFO - Trial 102 pruned. 
2026-05-19 16:32:56,074 - experiment_functions - INFO - Early stopping at epoch 1100. Best Recall: 0.1210
2026-05-19 16:32:56,176 - optuna.study.study - INFO - Trial 103 finished with value: 0.12098657116756109 and parameters: {'n_layers': 1, 'embedding_dim': 256, 'lr': 0.0007016500537689256, 'lambda_val': 0.00011560531900312734, 'batch_size': 2272, 'optimizer': 'Adam'}. Best is trial 23 with value: 0.1396108253323291.
2026-05-19 16:33:06,909 - experiment_functions - INFO - Early stopping at epoch 1500. Best Recall: 0.1367
2026-05-19 16:33:07,010 - optuna.study.study - INFO - Trial 104 finished with value: 0.13665142122789567 and parameters: {'n_layers': 1, 'embedding_dim': 256, 'lr': 0.00046879430642204895, 'lambda_val': 5.616620015219913e-05, 'batch_size': 2356, 'optimizer': 'Adam'}. Best is trial 23 with value: 0.1396108253323291.
2026-05-19 16:33:22,943 - experiment_functions - INFO - Early stopping at epoch 2200. Best Recall: 0.1286
2026-05-19 16:33:23,052 - optuna.study.study - INFO - Trial 105 finished with value: 0.128593131559844 and parameters: {'n_layers': 1, 'embedding_dim': 256, 'lr': 0.0004910142997354682, 'lambda_val': 5.18644290116635e-05, 'batch_size': 1784, 'optimizer': 'Adam'}. Best is trial 23 with value: 0.1396108253323291.
2026-05-19 16:33:30,606 - optuna.study._optimize - INFO - Trial 106 pruned. 
2026-05-19 16:33:38,317 - optuna.study._optimize - INFO - Trial 107 pruned. 
2026-05-19 16:33:49,885 - experiment_functions - INFO - Early stopping at epoch 1750. Best Recall: 0.1294
2026-05-19 16:33:49,976 - optuna.study.study - INFO - Trial 108 finished with value: 0.12939777143018907 and parameters: {'n_layers': 1, 'embedding_dim': 256, 'lr': 0.0005432408405865477, 'lambda_val': 5.542636686702876e-05, 'batch_size': 1775, 'optimizer': 'Adam'}. Best is trial 23 with value: 0.1396108253323291.
2026-05-19 16:33:56,802 - optuna.study._optimize - INFO - Trial 109 pruned. 
2026-05-19 16:34:15,566 - experiment_functions - INFO - Early stopping at epoch 1600. Best Recall: 0.1289
2026-05-19 16:34:15,675 - optuna.study.study - INFO - Trial 110 finished with value: 0.12891848011804316 and parameters: {'n_layers': 1, 'embedding_dim': 256, 'lr': 0.0005468178460233133, 'lambda_val': 5.1550285600138536e-05, 'batch_size': 1585, 'optimizer': 'Adam'}. Best is trial 23 with value: 0.1396108253323291.
2026-05-19 16:34:29,548 - experiment_functions - INFO - Early stopping at epoch 2050. Best Recall: 0.1370
2026-05-19 16:34:29,650 - optuna.study.study - INFO - Trial 111 finished with value: 0.13702485431353612 and parameters: {'n_layers': 1, 'embedding_dim': 256, 'lr': 0.0005611910908184186, 'lambda_val': 5.538264758984692e-05, 'batch_size': 1475, 'optimizer': 'Adam'}. Best is trial 23 with value: 0.1396108253323291.
2026-05-19 16:34:40,548 - optuna.study._optimize - INFO - Trial 112 pruned. 
2026-05-19 16:34:49,721 - experiment_functions - INFO - Early stopping at epoch 1350. Best Recall: 0.1369
2026-05-19 16:34:49,832 - optuna.study.study - INFO - Trial 113 finished with value: 0.13690134396919773 and parameters: {'n_layers': 1, 'embedding_dim': 256, 'lr': 0.0007684561168123782, 'lambda_val': 5.113554759662719e-05, 'batch_size': 1463, 'optimizer': 'Adam'}. Best is trial 23 with value: 0.1396108253323291.
2026-05-19 16:34:57,991 - optuna.study._optimize - INFO - Trial 114 pruned. 
2026-05-19 16:35:04,768 - optuna.study._optimize - INFO - Trial 115 pruned. 
2026-05-19 16:35:10,933 - optuna.study._optimize - INFO - Trial 116 pruned. 
2026-05-19 16:35:17,591 - optuna.study._optimize - INFO - Trial 117 pruned. 
2026-05-19 16:35:24,129 - optuna.study._optimize - INFO - Trial 118 pruned. 
2026-05-19 16:35:31,096 - optuna.study._optimize - INFO - Trial 119 pruned. 
2026-05-19 16:35:37,977 - optuna.study._optimize - INFO - Trial 120 pruned. 
2026-05-19 16:35:57,737 - optuna.study._optimize - INFO - Trial 121 pruned. 
2026-05-19 16:36:08,928 - experiment_functions - INFO - Early stopping at epoch 1700. Best Recall: 0.1349
2026-05-19 16:36:09,018 - optuna.study.study - INFO - Trial 122 finished with value: 0.13490184721418272 and parameters: {'n_layers': 1, 'embedding_dim': 256, 'lr': 0.0005449567876482105, 'lambda_val': 5.65908976827406e-05, 'batch_size': 1816, 'optimizer': 'Adam'}. Best is trial 23 with value: 0.1396108253323291.
2026-05-19 16:36:17,763 - experiment_functions - INFO - Early stopping at epoch 1300. Best Recall: 0.1271
2026-05-19 16:36:17,860 - optuna.study.study - INFO - Trial 123 finished with value: 0.12710546197550582 and parameters: {'n_layers': 1, 'embedding_dim': 256, 'lr': 0.0007421102209522081, 'lambda_val': 0.00014746387737795582, 'batch_size': 1133, 'optimizer': 'Adam'}. Best is trial 23 with value: 0.1396108253323291.
2026-05-19 16:36:29,078 - experiment_functions - INFO - Early stopping at epoch 1750. Best Recall: 0.1344
2026-05-19 16:36:29,184 - optuna.study.study - INFO - Trial 124 finished with value: 0.134385246613362 and parameters: {'n_layers': 1, 'embedding_dim': 256, 'lr': 0.0007698610890855627, 'lambda_val': 0.00015242364516075224, 'batch_size': 1130, 'optimizer': 'Adam'}. Best is trial 23 with value: 0.1396108253323291.
2026-05-19 16:36:39,792 - optuna.study._optimize - INFO - Trial 125 pruned. 
2026-05-19 16:36:51,310 - optuna.study._optimize - INFO - Trial 126 pruned. 
2026-05-19 16:36:57,673 - experiment_functions - INFO - Early stopping at epoch 950. Best Recall: 0.1165
2026-05-19 16:36:57,764 - optuna.study.study - INFO - Trial 127 finished with value: 0.11652105259061483 and parameters: {'n_layers': 1, 'embedding_dim': 256, 'lr': 0.0011747545750581392, 'lambda_val': 0.00017024997992892338, 'batch_size': 1823, 'optimizer': 'Adam'}. Best is trial 23 with value: 0.1396108253323291.
2026-05-19 16:37:02,984 - experiment_functions - INFO - Early stopping at epoch 750. Best Recall: 0.1127
2026-05-19 16:37:03,085 - optuna.study.study - INFO - Trial 128 finished with value: 0.11265305264261136 and parameters: {'n_layers': 1, 'embedding_dim': 256, 'lr': 0.0013887264109623528, 'lambda_val': 1.096210031932402e-06, 'batch_size': 1402, 'optimizer': 'Adam'}. Best is trial 23 with value: 0.1396108253323291.
2026-05-19 16:37:10,850 - optuna.study._optimize - INFO - Trial 129 pruned. 
2026-05-19 16:37:18,078 - optuna.study._optimize - INFO - Trial 130 pruned. 
2026-05-19 16:37:25,744 - optuna.study._optimize - INFO - Trial 131 pruned. 
2026-05-19 16:37:36,637 - experiment_functions - INFO - Early stopping at epoch 1550. Best Recall: 0.1315
2026-05-19 16:37:36,728 - optuna.study.study - INFO - Trial 132 finished with value: 0.13153858160995321 and parameters: {'n_layers': 1, 'embedding_dim': 256, 'lr': 0.0007050213578469451, 'lambda_val': 0.00014937996656718005, 'batch_size': 1150, 'optimizer': 'Adam'}. Best is trial 23 with value: 0.1396108253323291.
2026-05-19 16:37:51,320 - optuna.study._optimize - INFO - Trial 133 pruned. 
2026-05-19 16:37:58,414 - optuna.study._optimize - INFO - Trial 134 pruned. 
2026-05-19 16:38:04,250 - optuna.study._optimize - INFO - Trial 135 pruned. 
2026-05-19 16:38:16,923 - experiment_functions - INFO - Early stopping at epoch 1900. Best Recall: 0.1390
2026-05-19 16:38:17,014 - optuna.study.study - INFO - Trial 136 finished with value: 0.13897653329340137 and parameters: {'n_layers': 1, 'embedding_dim': 256, 'lr': 0.0005591997622643595, 'lambda_val': 8.396705660957352e-05, 'batch_size': 1529, 'optimizer': 'Adam'}. Best is trial 23 with value: 0.1396108253323291.
2026-05-19 16:38:31,030 - optuna.study._optimize - INFO - Trial 137 pruned. 
2026-05-19 16:38:46,557 - experiment_functions - INFO - Early stopping at epoch 2250. Best Recall: 0.1432
2026-05-19 16:38:46,645 - optuna.study.study - INFO - Trial 138 finished with value: 0.14323902159755034 and parameters: {'n_layers': 1, 'embedding_dim': 256, 'lr': 0.00047266977776118927, 'lambda_val': 5.093571822885152e-05, 'batch_size': 1569, 'optimizer': 'Adam'}. Best is trial 138 with value: 0.14323902159755034.
2026-05-19 16:38:58,187 - optuna.study._optimize - INFO - Trial 139 pruned. 
2026-05-19 16:39:04,651 - optuna.study._optimize - INFO - Trial 140 pruned. 
2026-05-19 16:39:10,807 - optuna.study._optimize - INFO - Trial 141 pruned. 
2026-05-19 16:39:16,837 - optuna.study._optimize - INFO - Trial 142 pruned. 
2026-05-19 16:39:23,074 - optuna.study._optimize - INFO - Trial 143 pruned. 
2026-05-19 16:39:36,885 - experiment_functions - INFO - Early stopping at epoch 1550. Best Recall: 0.1350
2026-05-19 16:39:37,133 - optuna.study.study - INFO - Trial 144 finished with value: 0.13502432454977578 and parameters: {'n_layers': 1, 'embedding_dim': 256, 'lr': 0.0006234433945061468, 'lambda_val': 3.1852938882156915e-05, 'batch_size': 1537, 'optimizer': 'Adam'}. Best is trial 138 with value: 0.14323902159755034.
2026-05-19 16:39:45,186 - experiment_functions - INFO - Early stopping at epoch 1050. Best Recall: 0.1284
2026-05-19 16:39:45,267 - optuna.study.study - INFO - Trial 145 finished with value: 0.12839521656242145 and parameters: {'n_layers': 1, 'embedding_dim': 256, 'lr': 0.0010095534616472606, 'lambda_val': 3.064579751967963e-05, 'batch_size': 1300, 'optimizer': 'Adam'}. Best is trial 138 with value: 0.14323902159755034.
2026-05-19 16:39:51,880 - optuna.study._optimize - INFO - Trial 146 pruned. 
2026-05-19 16:39:58,831 - optuna.study._optimize - INFO - Trial 147 pruned. 
2026-05-19 16:40:06,202 - optuna.study._optimize - INFO - Trial 148 pruned. 
2026-05-19 16:40:13,146 - optuna.study._optimize - INFO - Trial 149 pruned. 
2026-05-19 16:40:18,913 - optuna.study._optimize - INFO - Trial 150 pruned. 
2026-05-19 16:40:34,162 - optuna.study._optimize - INFO - Trial 151 pruned. 
2026-05-19 16:40:40,759 - optuna.study._optimize - INFO - Trial 152 pruned. 
2026-05-19 16:40:47,740 - optuna.study._optimize - INFO - Trial 153 pruned. 
2026-05-19 16:40:55,775 - experiment_functions - INFO - Early stopping at epoch 1250. Best Recall: 0.1335
2026-05-19 16:40:55,866 - optuna.study.study - INFO - Trial 154 finished with value: 0.1334587369836709 and parameters: {'n_layers': 1, 'embedding_dim': 256, 'lr': 0.0007033860314302224, 'lambda_val': 4.998524442134611e-05, 'batch_size': 1760, 'optimizer': 'Adam'}. Best is trial 138 with value: 0.14323902159755034.
2026-05-19 16:41:02,372 - optuna.study._optimize - INFO - Trial 155 pruned. 
2026-05-19 16:41:08,967 - experiment_functions - INFO - Early stopping at epoch 950. Best Recall: 0.1305
2026-05-19 16:41:09,058 - optuna.study.study - INFO - Trial 156 finished with value: 0.13053209644178432 and parameters: {'n_layers': 1, 'embedding_dim': 256, 'lr': 0.0011160641400879863, 'lambda_val': 4.3406281222147536e-05, 'batch_size': 1589, 'optimizer': 'Adam'}. Best is trial 138 with value: 0.14323902159755034.
2026-05-19 16:41:15,688 - optuna.study._optimize - INFO - Trial 157 pruned. 
2026-05-19 16:41:19,093 - experiment_functions - INFO - Early stopping at epoch 500. Best Recall: 0.0032
2026-05-19 16:41:19,201 - optuna.study.study - INFO - Trial 158 finished with value: 0.0032054283159043424 and parameters: {'n_layers': 1, 'embedding_dim': 256, 'lr': 0.0008662558232623956, 'lambda_val': 0.010847231022985192, 'batch_size': 1239, 'optimizer': 'SGD'}. Best is trial 138 with value: 0.14323902159755034.
2026-05-19 16:41:28,861 - experiment_functions - INFO - Early stopping at epoch 1400. Best Recall: 0.1295
2026-05-19 16:41:28,972 - optuna.study.study - INFO - Trial 159 finished with value: 0.1295129107283955 and parameters: {'n_layers': 1, 'embedding_dim': 256, 'lr': 0.0006861864875943735, 'lambda_val': 3.6428870542635744e-05, 'batch_size': 1878, 'optimizer': 'Adam'}. Best is trial 138 with value: 0.14323902159755034.
2026-05-19 16:41:33,914 - experiment_functions - INFO - Early stopping at epoch 750. Best Recall: 0.1052
2026-05-19 16:41:34,115 - optuna.study.study - INFO - Trial 160 finished with value: 0.10522347631467147 and parameters: {'n_layers': 1, 'embedding_dim': 64, 'lr': 0.0022177133706685953, 'lambda_val': 2.23891895581271e-05, 'batch_size': 1895, 'optimizer': 'Adam'}. Best is trial 138 with value: 0.14323902159755034.
2026-05-19 16:41:41,198 - optuna.study._optimize - INFO - Trial 161 pruned. 
2026-05-19 16:41:53,489 - optuna.study._optimize - INFO - Trial 162 pruned. 
2026-05-19 16:42:04,342 - experiment_functions - INFO - Early stopping at epoch 1100. Best Recall: 0.1360
2026-05-19 16:42:04,443 - optuna.study.study - INFO - Trial 163 finished with value: 0.1360327062768169 and parameters: {'n_layers': 1, 'embedding_dim': 256, 'lr': 0.0009815171910964233, 'lambda_val': 3.041179331820216e-05, 'batch_size': 1748, 'optimizer': 'Adam'}. Best is trial 138 with value: 0.14323902159755034.
2026-05-19 16:42:11,144 - experiment_functions - INFO - Early stopping at epoch 950. Best Recall: 0.1200
2026-05-19 16:42:11,448 - optuna.study.study - INFO - Trial 164 finished with value: 0.11995523539276017 and parameters: {'n_layers': 1, 'embedding_dim': 256, 'lr': 0.0011013666791361671, 'lambda_val': 2.9210087076279797e-05, 'batch_size': 1736, 'optimizer': 'Adam'}. Best is trial 138 with value: 0.14323902159755034.
2026-05-19 16:42:17,288 - experiment_functions - INFO - Early stopping at epoch 800. Best Recall: 0.1215
2026-05-19 16:42:17,398 - optuna.study.study - INFO - Trial 165 finished with value: 0.12154278857065937 and parameters: {'n_layers': 1, 'embedding_dim': 256, 'lr': 0.001411223286116908, 'lambda_val': 1.6501145727328594e-05, 'batch_size': 1614, 'optimizer': 'Adam'}. Best is trial 138 with value: 0.14323902159755034.
