2026-05-19 16:42:23,976 - optuna.study._optimize - INFO - Trial 166 pruned. 
2026-05-19 16:42:48,466 - optuna.study.study - INFO - Trial 167 finished with value: 0.14723617654182158 and parameters: {'n_layers': 1, 'embedding_dim': 256, 'lr': 0.00041042856944714884, 'lambda_val': 4.5311452756338626e-05, 'batch_size': 1872, 'optimizer': 'Adam'}. Best is trial 167 with value: 0.14723617654182158.
2026-05-19 16:42:55,077 - optuna.study._optimize - INFO - Trial 168 pruned. 
2026-05-19 16:43:01,896 - optuna.study._optimize - INFO - Trial 169 pruned. 
2026-05-19 16:43:08,724 - optuna.study._optimize - INFO - Trial 170 pruned. 
2026-05-19 16:43:16,131 - optuna.study._optimize - INFO - Trial 171 pruned. 
2026-05-19 16:43:25,457 - experiment_functions - INFO - Early stopping at epoch 1450. Best Recall: 0.1330
2026-05-19 16:43:25,548 - optuna.study.study - INFO - Trial 172 finished with value: 0.1329939849183223 and parameters: {'n_layers': 1, 'embedding_dim': 256, 'lr': 0.0007101358339116191, 'lambda_val': 3.531692412554492e-05, 'batch_size': 1874, 'optimizer': 'Adam'}. Best is trial 167 with value: 0.14723617654182158.
2026-05-19 16:43:32,744 - optuna.study._optimize - INFO - Trial 173 pruned. 
2026-05-19 16:43:40,226 - experiment_functions - INFO - Early stopping at epoch 1100. Best Recall: 0.1285
2026-05-19 16:43:40,324 - optuna.study.study - INFO - Trial 174 finished with value: 0.12854916693274226 and parameters: {'n_layers': 1, 'embedding_dim': 256, 'lr': 0.000961360352983497, 'lambda_val': 2.1705269754554526e-05, 'batch_size': 1766, 'optimizer': 'Adam'}. Best is trial 167 with value: 0.14723617654182158.
2026-05-19 16:43:48,074 - experiment_functions - INFO - Early stopping at epoch 650. Best Recall: 0.0423
2026-05-19 16:43:48,834 - optuna.study.study - INFO - Trial 175 finished with value: 0.04228411056745094 and parameters: {'n_layers': 3, 'embedding_dim': 256, 'lr': 0.001239382683914529, 'lambda_val': 6.635557958173078e-05, 'batch_size': 1932, 'optimizer': 'Adam'}. Best is trial 167 with value: 0.14723617654182158.
2026-05-19 16:44:03,535 - optuna.study._optimize - INFO - Trial 176 pruned. 
2026-05-19 16:44:08,687 - experiment_functions - INFO - Early stopping at epoch 750. Best Recall: 0.1242
2026-05-19 16:44:08,778 - optuna.study.study - INFO - Trial 177 finished with value: 0.12417571318468068 and parameters: {'n_layers': 1, 'embedding_dim': 256, 'lr': 0.0016462498208351113, 'lambda_val': 3.106826693394637e-05, 'batch_size': 1844, 'optimizer': 'Adam'}. Best is trial 167 with value: 0.14723617654182158.
2026-05-19 16:44:15,471 - optuna.study._optimize - INFO - Trial 178 pruned. 
2026-05-19 16:44:19,276 - experiment_functions - INFO - Early stopping at epoch 500. Best Recall: 0.0033
2026-05-19 16:44:19,377 - optuna.study.study - INFO - Trial 179 finished with value: 0.003304093672253643 and parameters: {'n_layers': 1, 'embedding_dim': 256, 'lr': 0.0007836003724131431, 'lambda_val': 3.935188558827499e-05, 'batch_size': 2021, 'optimizer': 'SGD'}. Best is trial 167 with value: 0.14723617654182158.
2026-05-19 16:44:34,401 - optuna.study._optimize - INFO - Trial 180 pruned. 
2026-05-19 16:44:42,303 - experiment_functions - INFO - Early stopping at epoch 1200. Best Recall: 0.1287
2026-05-19 16:44:42,394 - optuna.study.study - INFO - Trial 181 finished with value: 0.12866991816308687 and parameters: {'n_layers': 1, 'embedding_dim': 256, 'lr': 0.0006687599292763661, 'lambda_val': 3.667548151869213e-05, 'batch_size': 1846, 'optimizer': 'Adam'}. Best is trial 167 with value: 0.14723617654182158.
2026-05-19 16:44:54,180 - experiment_functions - INFO - Early stopping at epoch 1800. Best Recall: 0.1338
2026-05-19 16:44:54,280 - optuna.study.study - INFO - Trial 182 finished with value: 0.1338118031335336 and parameters: {'n_layers': 1, 'embedding_dim': 256, 'lr': 0.0005018894897150036, 'lambda_val': 5.058694971648347e-05, 'batch_size': 1887, 'optimizer': 'Adam'}. Best is trial 167 with value: 0.14723617654182158.
2026-05-19 16:45:06,157 - experiment_functions - INFO - Early stopping at epoch 1800. Best Recall: 0.1397
2026-05-19 16:45:06,278 - optuna.study.study - INFO - Trial 183 finished with value: 0.13971004979565796 and parameters: {'n_layers': 1, 'embedding_dim': 256, 'lr': 0.00046039691631880026, 'lambda_val': 5.616489134738688e-05, 'batch_size': 1918, 'optimizer': 'Adam'}. Best is trial 167 with value: 0.14723617654182158.
2026-05-19 16:45:13,733 - optuna.study._optimize - INFO - Trial 184 pruned. 
2026-05-19 16:45:34,803 - experiment_functions - INFO - Early stopping at epoch 2050. Best Recall: 0.1388
2026-05-19 16:45:34,902 - optuna.study.study - INFO - Trial 185 finished with value: 0.1388375628618617 and parameters: {'n_layers': 1, 'embedding_dim': 256, 'lr': 0.0004815600784012116, 'lambda_val': 0.00010366590584813949, 'batch_size': 1916, 'optimizer': 'Adam'}. Best is trial 167 with value: 0.14723617654182158.
2026-05-19 16:45:42,114 - optuna.study._optimize - INFO - Trial 186 pruned. 
2026-05-19 16:45:46,401 - experiment_functions - INFO - Early stopping at epoch 550. Best Recall: 0.0260
2026-05-19 16:45:46,511 - optuna.study.study - INFO - Trial 187 finished with value: 0.026033945752200128 and parameters: {'n_layers': 1, 'embedding_dim': 256, 'lr': 0.051585053883613244, 'lambda_val': 5.305302055433608e-05, 'batch_size': 2006, 'optimizer': 'Adam'}. Best is trial 167 with value: 0.14723617654182158.
2026-05-19 16:45:53,342 - optuna.study._optimize - INFO - Trial 188 pruned. 
2026-05-19 16:45:59,976 - optuna.study._optimize - INFO - Trial 189 pruned. 
2026-05-19 16:46:06,772 - optuna.study._optimize - INFO - Trial 190 pruned. 
2026-05-19 16:46:16,580 - experiment_functions - INFO - Early stopping at epoch 1500. Best Recall: 0.1366
2026-05-19 16:46:16,679 - optuna.study.study - INFO - Trial 191 finished with value: 0.13655344222931506 and parameters: {'n_layers': 1, 'embedding_dim': 256, 'lr': 0.0005857376357747102, 'lambda_val': 5.4103556151080714e-05, 'batch_size': 1967, 'optimizer': 'Adam'}. Best is trial 167 with value: 0.14723617654182158.
2026-05-19 16:46:23,572 - optuna.study._optimize - INFO - Trial 192 pruned. 
2026-05-19 16:46:30,747 - optuna.study._optimize - INFO - Trial 193 pruned. 
2026-05-19 16:46:37,990 - optuna.study._optimize - INFO - Trial 194 pruned. 
2026-05-19 16:46:45,022 - optuna.study._optimize - INFO - Trial 195 pruned. 
2026-05-19 16:46:53,109 - experiment_functions - INFO - Early stopping at epoch 1150. Best Recall: 0.1355
2026-05-19 16:46:53,886 - optuna.study.study - INFO - Trial 196 finished with value: 0.13547173550146832 and parameters: {'n_layers': 1, 'embedding_dim': 256, 'lr': 0.0007615348004151846, 'lambda_val': 4.8759169434059155e-05, 'batch_size': 1848, 'optimizer': 'Adam'}. Best is trial 167 with value: 0.14723617654182158.
2026-05-19 16:47:08,451 - experiment_functions - INFO - Early stopping at epoch 950. Best Recall: 0.1267
2026-05-19 16:47:08,541 - optuna.study.study - INFO - Trial 197 finished with value: 0.12670381204085743 and parameters: {'n_layers': 1, 'embedding_dim': 256, 'lr': 0.0008836280041024441, 'lambda_val': 4.798779646866284e-05, 'batch_size': 1860, 'optimizer': 'Adam'}. Best is trial 167 with value: 0.14723617654182158.
2026-05-19 16:47:18,836 - experiment_functions - INFO - Early stopping at epoch 1650. Best Recall: 0.1324
2026-05-19 16:47:18,937 - optuna.study.study - INFO - Trial 198 finished with value: 0.132442015663639 and parameters: {'n_layers': 1, 'embedding_dim': 256, 'lr': 0.0005617556268767172, 'lambda_val': 3.2139023430627845e-05, 'batch_size': 1998, 'optimizer': 'Adam'}. Best is trial 167 with value: 0.14723617654182158.
2026-05-19 16:47:27,535 - experiment_functions - INFO - Early stopping at epoch 1250. Best Recall: 0.1315
2026-05-19 16:47:27,637 - optuna.study.study - INFO - Trial 199 finished with value: 0.13147135969547946 and parameters: {'n_layers': 1, 'embedding_dim': 256, 'lr': 0.000724542801892956, 'lambda_val': 3.270545051880719e-05, 'batch_size': 1991, 'optimizer': 'Adam'}. Best is trial 167 with value: 0.14723617654182158.
2026-05-19 16:47:33,921 - optuna.study._optimize - INFO - Trial 200 pruned. 
2026-05-19 16:47:42,950 - experiment_functions - INFO - Early stopping at epoch 1400. Best Recall: 0.1352
2026-05-19 16:47:43,050 - optuna.study.study - INFO - Trial 201 finished with value: 0.1352106648603587 and parameters: {'n_layers': 1, 'embedding_dim': 256, 'lr': 0.0005841535786652338, 'lambda_val': 5.645189796747952e-05, 'batch_size': 1943, 'optimizer': 'Adam'}. Best is trial 167 with value: 0.14723617654182158.
2026-05-19 16:47:50,152 - optuna.study._optimize - INFO - Trial 202 pruned. 
2026-05-19 16:47:58,025 - optuna.study._optimize - INFO - Trial 203 pruned. 
2026-05-19 16:48:05,703 - optuna.study._optimize - INFO - Trial 204 pruned. 
2026-05-19 16:48:12,878 - optuna.study._optimize - INFO - Trial 205 pruned. 
2026-05-19 16:48:19,759 - optuna.study._optimize - INFO - Trial 206 pruned. 
2026-05-19 16:48:30,574 - experiment_functions - INFO - Early stopping at epoch 1550. Best Recall: 0.1314
2026-05-19 16:48:30,682 - optuna.study.study - INFO - Trial 207 finished with value: 0.13136141384574085 and parameters: {'n_layers': 1, 'embedding_dim': 256, 'lr': 0.0007135551158792085, 'lambda_val': 5.5522943557022765e-05, 'batch_size': 1824, 'optimizer': 'Adam'}. Best is trial 167 with value: 0.14723617654182158.
2026-05-19 16:48:46,156 - optuna.study._optimize - INFO - Trial 208 pruned. 
2026-05-19 16:48:53,247 - optuna.study._optimize - INFO - Trial 209 pruned. 
2026-05-19 16:49:00,251 - optuna.study._optimize - INFO - Trial 210 pruned. 
2026-05-19 16:49:07,446 - optuna.study._optimize - INFO - Trial 211 pruned. 
2026-05-19 16:49:15,286 - optuna.study._optimize - INFO - Trial 212 pruned. 
2026-05-19 16:49:22,531 - optuna.study._optimize - INFO - Trial 213 pruned. 
2026-05-19 16:49:29,188 - experiment_functions - INFO - Early stopping at epoch 900. Best Recall: 0.1241
2026-05-19 16:49:29,289 - optuna.study.study - INFO - Trial 214 finished with value: 0.12409500680818156 and parameters: {'n_layers': 1, 'embedding_dim': 256, 'lr': 0.0008308462625468017, 'lambda_val': 4.5182994651399597e-05, 'batch_size': 1784, 'optimizer': 'Adam'}. Best is trial 167 with value: 0.14723617654182158.
2026-05-19 16:49:36,807 - optuna.study._optimize - INFO - Trial 215 pruned. 
2026-05-19 16:49:44,882 - optuna.study._optimize - INFO - Trial 216 pruned. 
2026-05-19 16:49:48,683 - experiment_functions - INFO - Early stopping at epoch 500. Best Recall: 0.0022
2026-05-19 16:49:48,774 - optuna.study.study - INFO - Trial 217 finished with value: 0.002150802315523757 and parameters: {'n_layers': 1, 'embedding_dim': 256, 'lr': 0.0004752483317834027, 'lambda_val': 7.52258289212219e-05, 'batch_size': 1691, 'optimizer': 'SGD'}. Best is trial 167 with value: 0.14723617654182158.
2026-05-19 16:49:59,529 - experiment_functions - INFO - Early stopping at epoch 1500. Best Recall: 0.1306
2026-05-19 16:49:59,619 - optuna.study.study - INFO - Trial 218 finished with value: 0.13057860639714308 and parameters: {'n_layers': 1, 'embedding_dim': 256, 'lr': 0.0006042788965182293, 'lambda_val': 0.00010066282070967212, 'batch_size': 2252, 'optimizer': 'Adam'}. Best is trial 167 with value: 0.14723617654182158.
2026-05-19 16:50:07,200 - experiment_functions - INFO - Early stopping at epoch 1050. Best Recall: 0.1314
2026-05-19 16:50:07,289 - optuna.study.study - INFO - Trial 219 finished with value: 0.13139044027438615 and parameters: {'n_layers': 1, 'embedding_dim': 256, 'lr': 0.0009661299112908294, 'lambda_val': 4.376706314542931e-05, 'batch_size': 1822, 'optimizer': 'Adam'}. Best is trial 167 with value: 0.14723617654182158.
2026-05-19 16:50:14,950 - optuna.study._optimize - INFO - Trial 220 pruned. 
2026-05-19 16:50:25,495 - experiment_functions - INFO - Early stopping at epoch 1500. Best Recall: 0.1388
2026-05-19 16:50:25,606 - optuna.study.study - INFO - Trial 221 finished with value: 0.13881920782108984 and parameters: {'n_layers': 1, 'embedding_dim': 256, 'lr': 0.0007327492574850685, 'lambda_val': 0.00012661887934062885, 'batch_size': 1348, 'optimizer': 'Adam'}. Best is trial 167 with value: 0.14723617654182158.
2026-05-19 16:50:35,693 - experiment_functions - INFO - Early stopping at epoch 1350. Best Recall: 0.1338
2026-05-19 16:50:35,814 - optuna.study.study - INFO - Trial 222 finished with value: 0.1337901149487354 and parameters: {'n_layers': 1, 'embedding_dim': 256, 'lr': 0.0007959270618246989, 'lambda_val': 9.38646112472866e-05, 'batch_size': 1575, 'optimizer': 'Adam'}. Best is trial 167 with value: 0.14723617654182158.
2026-05-19 16:50:51,591 - optuna.study._optimize - INFO - Trial 223 pruned. 
2026-05-19 16:50:58,712 - optuna.study._optimize - INFO - Trial 224 pruned. 
2026-05-19 16:51:07,275 - optuna.study._optimize - INFO - Trial 225 pruned. 
2026-05-19 16:51:14,877 - optuna.study._optimize - INFO - Trial 226 pruned. 
2026-05-19 16:51:22,231 - optuna.study._optimize - INFO - Trial 227 pruned. 
2026-05-19 16:51:28,603 - experiment_functions - INFO - Early stopping at epoch 700. Best Recall: 0.0823
2026-05-19 16:51:28,694 - optuna.study.study - INFO - Trial 228 finished with value: 0.08231862582470909 and parameters: {'n_layers': 2, 'embedding_dim': 256, 'lr': 0.0010565737440521813, 'lambda_val': 5.3319596417149746e-05, 'batch_size': 1483, 'optimizer': 'Adam'}. Best is trial 167 with value: 0.14723617654182158.
2026-05-19 16:51:33,403 - experiment_functions - INFO - Early stopping at epoch 650. Best Recall: 0.0027
2026-05-19 16:51:33,494 - optuna.study.study - INFO - Trial 229 finished with value: 0.0027265760257196426 and parameters: {'n_layers': 1, 'embedding_dim': 128, 'lr': 1.6713874480945783e-05, 'lambda_val': 2.460571505645331e-05, 'batch_size': 3650, 'optimizer': 'Adam'}. Best is trial 167 with value: 0.14723617654182158.
2026-05-19 16:51:48,140 - experiment_functions - INFO - Early stopping at epoch 2100. Best Recall: 0.1386
2026-05-19 16:51:48,249 - optuna.study.study - INFO - Trial 230 finished with value: 0.13861260926318555 and parameters: {'n_layers': 1, 'embedding_dim': 256, 'lr': 0.0005723898144329246, 'lambda_val': 9.474109960991348e-05, 'batch_size': 1404, 'optimizer': 'Adam'}. Best is trial 167 with value: 0.14723617654182158.
2026-05-19 16:51:54,423 - experiment_functions - INFO - Early stopping at epoch 850. Best Recall: 0.0420
2026-05-19 16:51:54,521 - optuna.study.study - INFO - Trial 231 finished with value: 0.04195721205455562 and parameters: {'n_layers': 1, 'embedding_dim': 256, 'lr': 0.0005622814116834781, 'lambda_val': 0.05603651307868435, 'batch_size': 1414, 'optimizer': 'Adam'}. Best is trial 167 with value: 0.14723617654182158.
2026-05-19 16:52:05,521 - experiment_functions - INFO - Early stopping at epoch 1500. Best Recall: 0.1339
2026-05-19 16:52:05,612 - optuna.study.study - INFO - Trial 232 finished with value: 0.13394803555039675 and parameters: {'n_layers': 1, 'embedding_dim': 256, 'lr': 0.0006603628242824106, 'lambda_val': 9.604921846115765e-05, 'batch_size': 1383, 'optimizer': 'Adam'}. Best is trial 167 with value: 0.14723617654182158.
2026-05-19 16:52:14,925 - experiment_functions - INFO - Early stopping at epoch 1300. Best Recall: 0.1294
2026-05-19 16:52:15,014 - optuna.study.study - INFO - Trial 233 finished with value: 0.129432815514409 and parameters: {'n_layers': 1, 'embedding_dim': 256, 'lr': 0.0008108746828264047, 'lambda_val': 0.00010089753987011205, 'batch_size': 1339, 'optimizer': 'Adam'}. Best is trial 167 with value: 0.14723617654182158.
2026-05-19 16:52:22,350 - optuna.study._optimize - INFO - Trial 234 pruned. 
2026-05-19 16:52:29,921 - optuna.study._optimize - INFO - Trial 235 pruned. 
2026-05-19 16:52:38,887 - experiment_functions - INFO - Early stopping at epoch 1300. Best Recall: 0.1296
2026-05-19 16:52:38,977 - optuna.study.study - INFO - Trial 236 finished with value: 0.12964029131678212 and parameters: {'n_layers': 1, 'embedding_dim': 256, 'lr': 0.0009354418310869887, 'lambda_val': 6.81934859675538e-05, 'batch_size': 1254, 'optimizer': 'Adam'}. Best is trial 167 with value: 0.14723617654182158.
2026-05-19 16:52:46,136 - optuna.study._optimize - INFO - Trial 237 pruned. 
2026-05-19 16:52:55,347 - experiment_functions - INFO - Early stopping at epoch 1300. Best Recall: 0.1294
2026-05-19 16:52:55,437 - optuna.study.study - INFO - Trial 238 finished with value: 0.12935815648977186 and parameters: {'n_layers': 1, 'embedding_dim': 256, 'lr': 0.0007541321645730536, 'lambda_val': 0.00012226753574672716, 'batch_size': 1456, 'optimizer': 'Adam'}. Best is trial 167 with value: 0.14723617654182158.
2026-05-19 16:53:07,321 - experiment_functions - INFO - Early stopping at epoch 1850. Best Recall: 0.1372
2026-05-19 16:53:07,433 - optuna.study.study - INFO - Trial 239 finished with value: 0.13721486206004285 and parameters: {'n_layers': 1, 'embedding_dim': 256, 'lr': 0.0005060939297086429, 'lambda_val': 5.9632974588865035e-05, 'batch_size': 1550, 'optimizer': 'Adam'}. Best is trial 167 with value: 0.14723617654182158.
2026-05-19 16:53:14,783 - optuna.study._optimize - INFO - Trial 240 pruned. 
2026-05-19 16:53:24,827 - experiment_functions - INFO - Early stopping at epoch 1550. Best Recall: 0.1374
2026-05-19 16:53:24,927 - optuna.study.study - INFO - Trial 241 finished with value: 0.13737498437853812 and parameters: {'n_layers': 1, 'embedding_dim': 256, 'lr': 0.0005369392093521667, 'lambda_val': 4.9422003603941224e-05, 'batch_size': 1505, 'optimizer': 'Adam'}. Best is trial 167 with value: 0.14723617654182158.
2026-05-19 16:53:31,998 - optuna.study._optimize - INFO - Trial 242 pruned. 
2026-05-19 16:53:39,143 - optuna.study._optimize - INFO - Trial 243 pruned. 
2026-05-19 16:53:45,977 - optuna.study._optimize - INFO - Trial 244 pruned. 
2026-05-19 16:53:56,419 - experiment_functions - INFO - Early stopping at epoch 1550. Best Recall: 0.1342
2026-05-19 16:53:56,509 - optuna.study.study - INFO - Trial 245 finished with value: 0.13421631195741832 and parameters: {'n_layers': 1, 'embedding_dim': 256, 'lr': 0.0005749448390359583, 'lambda_val': 4.4398423081004784e-05, 'batch_size': 1603, 'optimizer': 'Adam'}. Best is trial 167 with value: 0.14723617654182158.
2026-05-19 16:54:03,878 - optuna.study._optimize - INFO - Trial 246 pruned. 
2026-05-19 16:54:11,050 - optuna.study._optimize - INFO - Trial 247 pruned. 
2026-05-19 16:54:18,289 - optuna.study._optimize - INFO - Trial 248 pruned. 
2026-05-19 16:54:25,592 - optuna.study._optimize - INFO - Trial 249 pruned. 
2026-05-19 16:54:29,935 - experiment_functions - INFO - Early stopping at epoch 500. Best Recall: 0.0022
2026-05-19 16:54:30,014 - optuna.study.study - INFO - Trial 250 finished with value: 0.0022017391810161984 and parameters: {'n_layers': 1, 'embedding_dim': 256, 'lr': 0.000469269792042384, 'lambda_val': 0.00017489673578426697, 'batch_size': 1347, 'optimizer': 'SGD'}. Best is trial 167 with value: 0.14723617654182158.
2026-05-19 16:54:37,530 - optuna.study._optimize - INFO - Trial 251 pruned. 
2026-05-19 16:54:50,762 - experiment_functions - INFO - Early stopping at epoch 1850. Best Recall: 0.1336
2026-05-19 16:54:50,860 - optuna.study.study - INFO - Trial 252 finished with value: 0.13359567789495333 and parameters: {'n_layers': 1, 'embedding_dim': 256, 'lr': 0.0005730517504984613, 'lambda_val': 4.553370052187725e-05, 'batch_size': 1592, 'optimizer': 'Adam'}. Best is trial 167 with value: 0.14723617654182158.
2026-05-19 16:54:57,748 - optuna.study._optimize - INFO - Trial 253 pruned. 
2026-05-19 16:55:03,923 - optuna.study._optimize - INFO - Trial 254 pruned. 
2026-05-19 16:55:11,517 - optuna.study._optimize - INFO - Trial 255 pruned. 
2026-05-19 16:55:20,354 - optuna.study._optimize - INFO - Trial 256 pruned. 
2026-05-19 16:55:29,180 - optuna.study._optimize - INFO - Trial 257 pruned. 
2026-05-19 16:55:36,561 - optuna.study._optimize - INFO - Trial 258 pruned. 
2026-05-19 16:55:43,753 - optuna.study._optimize - INFO - Trial 259 pruned. 
2026-05-19 16:55:53,646 - optuna.study._optimize - INFO - Trial 260 pruned. 
2026-05-19 16:56:00,934 - optuna.study._optimize - INFO - Trial 261 pruned. 
2026-05-19 16:56:07,904 - optuna.study._optimize - INFO - Trial 262 pruned. 
2026-05-19 16:56:15,438 - optuna.study._optimize - INFO - Trial 263 pruned. 
2026-05-19 16:56:24,965 - optuna.study._optimize - INFO - Trial 264 pruned. 
2026-05-19 16:56:31,881 - optuna.study._optimize - INFO - Trial 265 pruned. 
2026-05-19 16:56:36,213 - experiment_functions - INFO - Early stopping at epoch 550. Best Recall: 0.0525
2026-05-19 16:56:36,303 - optuna.study.study - INFO - Trial 266 finished with value: 0.052548440607807216 and parameters: {'n_layers': 1, 'embedding_dim': 256, 'lr': 0.016351900954533472, 'lambda_val': 8.382253703054593e-05, 'batch_size': 1590, 'optimizer': 'Adam'}. Best is trial 167 with value: 0.14723617654182158.
2026-05-19 16:56:48,804 - optuna.study._optimize - INFO - Trial 267 pruned. 
2026-05-19 16:56:56,986 - optuna.study._optimize - INFO - Trial 268 pruned. 
2026-05-19 16:57:00,705 - experiment_functions - INFO - Early stopping at epoch 500. Best Recall: 0.0017
2026-05-19 16:57:00,795 - optuna.study.study - INFO - Trial 269 finished with value: 0.001655962734523614 and parameters: {'n_layers': 1, 'embedding_dim': 256, 'lr': 0.0007731649170802926, 'lambda_val': 0.000213336020898373, 'batch_size': 1519, 'optimizer': 'SGD'}. Best is trial 167 with value: 0.14723617654182158.
2026-05-19 16:57:07,927 - optuna.study._optimize - INFO - Trial 270 pruned. 
2026-05-19 16:57:14,411 - optuna.study._optimize - INFO - Trial 271 pruned. 
2026-05-19 16:57:21,241 - optuna.study._optimize - INFO - Trial 272 pruned. 
2026-05-19 16:57:28,953 - optuna.study._optimize - INFO - Trial 273 pruned. 
2026-05-19 16:57:36,791 - experiment_functions - INFO - Early stopping at epoch 850. Best Recall: 0.0560
