2026-05-19 20:45:33,715 - optuna.study.study - INFO - Trial 58 finished with value: 0.0439984153529417 and parameters: {'n_layers': 2, 'embedding_dim': 256, 'lr': 0.00048509598134213765, 'lambda_val': 9.44440782830497e-06, 'batch_size': 1636, 'optimizer': 'RMSprop'}. Best is trial 51 with value: 0.09805448644736418.
2026-05-19 20:45:42,245 - experiment_functions - INFO - Early stopping at epoch 500. Best Recall: 0.0022
2026-05-19 20:45:42,344 - optuna.study.study - INFO - Trial 59 finished with value: 0.0021907849380137135 and parameters: {'n_layers': 1, 'embedding_dim': 256, 'lr': 6.803188091956462e-05, 'lambda_val': 3.416984690102783e-06, 'batch_size': 1889, 'optimizer': 'SGD'}. Best is trial 51 with value: 0.09805448644736418.
2026-05-19 20:45:50,229 - optuna.study._optimize - INFO - Trial 60 pruned. 
2026-05-19 20:46:01,248 - optuna.study._optimize - INFO - Trial 61 pruned. 
2026-05-19 20:46:11,504 - optuna.study._optimize - INFO - Trial 62 pruned. 
2026-05-19 20:46:17,434 - experiment_functions - INFO - Early stopping at epoch 850. Best Recall: 0.0636
2026-05-19 20:46:17,592 - optuna.study.study - INFO - Trial 63 finished with value: 0.06364623390653361 and parameters: {'n_layers': 1, 'embedding_dim': 32, 'lr': 0.0009139713993819395, 'lambda_val': 5.284379120651395e-05, 'batch_size': 2237, 'optimizer': 'RMSprop'}. Best is trial 51 with value: 0.09805448644736418.
2026-05-19 20:46:22,081 - experiment_functions - INFO - Early stopping at epoch 500. Best Recall: 0.0009
2026-05-19 20:46:22,170 - optuna.study.study - INFO - Trial 64 finished with value: 0.0009324276052700381 and parameters: {'n_layers': 1, 'embedding_dim': 256, 'lr': 0.0003600094273532688, 'lambda_val': 4.493862753063356e-06, 'batch_size': 2764, 'optimizer': 'SGD'}. Best is trial 51 with value: 0.09805448644736418.
2026-05-19 20:46:27,593 - experiment_functions - INFO - Early stopping at epoch 800. Best Recall: 0.0449
2026-05-19 20:46:27,696 - optuna.study.study - INFO - Trial 65 finished with value: 0.044868238529728294 and parameters: {'n_layers': 1, 'embedding_dim': 64, 'lr': 0.00648203010297131, 'lambda_val': 0.0010637148054457636, 'batch_size': 1917, 'optimizer': 'RMSprop'}. Best is trial 51 with value: 0.09805448644736418.
2026-05-19 20:46:37,238 - optuna.study._optimize - INFO - Trial 66 pruned. 
2026-05-19 20:46:47,349 - optuna.study._optimize - INFO - Trial 67 pruned. 
2026-05-19 20:46:54,848 - experiment_functions - INFO - Early stopping at epoch 700. Best Recall: 0.0710
2026-05-19 20:46:54,938 - optuna.study.study - INFO - Trial 68 finished with value: 0.07097996594685296 and parameters: {'n_layers': 1, 'embedding_dim': 256, 'lr': 0.0022966129385363055, 'lambda_val': 0.0007367222079880167, 'batch_size': 2925, 'optimizer': 'RMSprop'}. Best is trial 51 with value: 0.09805448644736418.
2026-05-19 20:47:01,264 - experiment_functions - INFO - Early stopping at epoch 500. Best Recall: 0.0005
2026-05-19 20:47:01,342 - optuna.study.study - INFO - Trial 69 finished with value: 0.0004802777403684705 and parameters: {'n_layers': 1, 'embedding_dim': 32, 'lr': 0.0005149446402613365, 'lambda_val': 0.023299085381099576, 'batch_size': 2387, 'optimizer': 'SGD'}. Best is trial 51 with value: 0.09805448644736418.
2026-05-19 20:47:05,923 - experiment_functions - INFO - Early stopping at epoch 650. Best Recall: 0.0617
2026-05-19 20:47:06,002 - optuna.study.study - INFO - Trial 70 finished with value: 0.06171809535524179 and parameters: {'n_layers': 1, 'embedding_dim': 96, 'lr': 0.0014040085068548916, 'lambda_val': 1.902376546593964e-06, 'batch_size': 1077, 'optimizer': 'RMSprop'}. Best is trial 51 with value: 0.09805448644736418.
2026-05-19 20:47:10,827 - experiment_functions - INFO - Early stopping at epoch 750. Best Recall: 0.0674
2026-05-19 20:47:10,907 - optuna.study.study - INFO - Trial 71 finished with value: 0.06741332662916659 and parameters: {'n_layers': 1, 'embedding_dim': 128, 'lr': 0.0012586872974989917, 'lambda_val': 0.0024789762928119734, 'batch_size': 1472, 'optimizer': 'RMSprop'}. Best is trial 51 with value: 0.09805448644736418.
2026-05-19 20:47:16,871 - optuna.study._optimize - INFO - Trial 72 pruned. 
2026-05-19 20:47:25,545 - optuna.study._optimize - INFO - Trial 73 pruned. 
2026-05-19 20:47:34,248 - optuna.study._optimize - INFO - Trial 74 pruned. 
2026-05-19 20:47:42,543 - experiment_functions - INFO - Early stopping at epoch 900. Best Recall: 0.0801
2026-05-19 20:47:42,707 - optuna.study.study - INFO - Trial 75 finished with value: 0.08009974087654427 and parameters: {'n_layers': 1, 'embedding_dim': 128, 'lr': 0.0006336272061232565, 'lambda_val': 0.000972681847695473, 'batch_size': 1478, 'optimizer': 'Adam'}. Best is trial 51 with value: 0.09805448644736418.
2026-05-19 20:47:48,706 - optuna.study._optimize - INFO - Trial 76 pruned. 
2026-05-19 20:47:55,467 - optuna.study._optimize - INFO - Trial 77 pruned. 
2026-05-19 20:48:01,187 - experiment_functions - INFO - Early stopping at epoch 650. Best Recall: 0.0415
2026-05-19 20:48:01,296 - optuna.study.study - INFO - Trial 78 finished with value: 0.04147424992173644 and parameters: {'n_layers': 3, 'embedding_dim': 128, 'lr': 0.000761146865442909, 'lambda_val': 0.0034210218720390883, 'batch_size': 1813, 'optimizer': 'Adam'}. Best is trial 51 with value: 0.09805448644736418.
2026-05-19 20:48:11,529 - optuna.study._optimize - INFO - Trial 79 pruned. 
2026-05-19 20:48:16,003 - experiment_functions - INFO - Early stopping at epoch 550. Best Recall: 0.0188
2026-05-19 20:48:16,094 - optuna.study.study - INFO - Trial 80 finished with value: 0.018828286651830433 and parameters: {'n_layers': 4, 'embedding_dim': 96, 'lr': 0.001982005753800516, 'lambda_val': 0.007334661942690014, 'batch_size': 2857, 'optimizer': 'Adam'}. Best is trial 51 with value: 0.09805448644736418.
2026-05-19 20:48:27,100 - experiment_functions - INFO - Early stopping at epoch 1750. Best Recall: 0.0889
2026-05-19 20:48:27,190 - optuna.study.study - INFO - Trial 81 finished with value: 0.0888512693280172 and parameters: {'n_layers': 1, 'embedding_dim': 128, 'lr': 0.0010059287030294707, 'lambda_val': 0.00012257735539783872, 'batch_size': 1533, 'optimizer': 'Adam'}. Best is trial 51 with value: 0.09805448644736418.
2026-05-19 20:48:33,323 - experiment_functions - INFO - Early stopping at epoch 900. Best Recall: 0.0715
2026-05-19 20:48:33,423 - optuna.study.study - INFO - Trial 82 finished with value: 0.07145730457876193 and parameters: {'n_layers': 1, 'embedding_dim': 128, 'lr': 0.0009342604570666239, 'lambda_val': 0.0007209123640468866, 'batch_size': 1712, 'optimizer': 'Adam'}. Best is trial 51 with value: 0.09805448644736418.
2026-05-19 20:48:44,175 - optuna.study._optimize - INFO - Trial 83 pruned. 
2026-05-19 20:48:53,255 - optuna.study._optimize - INFO - Trial 84 pruned. 
2026-05-19 20:49:00,123 - optuna.study._optimize - INFO - Trial 85 pruned. 
2026-05-19 20:49:07,085 - optuna.study._optimize - INFO - Trial 86 pruned. 
2026-05-19 20:49:20,768 - experiment_functions - INFO - Early stopping at epoch 1900. Best Recall: 0.0948
2026-05-19 20:49:20,868 - optuna.study.study - INFO - Trial 87 finished with value: 0.09478531691371661 and parameters: {'n_layers': 1, 'embedding_dim': 256, 'lr': 0.0007415928837683958, 'lambda_val': 2.9674341884406145e-05, 'batch_size': 2473, 'optimizer': 'Adam'}. Best is trial 51 with value: 0.09805448644736418.
2026-05-19 20:49:29,005 - experiment_functions - INFO - Early stopping at epoch 1050. Best Recall: 0.0879
2026-05-19 20:49:29,096 - optuna.study.study - INFO - Trial 88 finished with value: 0.08786241077555175 and parameters: {'n_layers': 1, 'embedding_dim': 256, 'lr': 0.001873892403744593, 'lambda_val': 2.0607721571577687e-05, 'batch_size': 1965, 'optimizer': 'Adam'}. Best is trial 51 with value: 0.09805448644736418.
2026-05-19 20:49:37,578 - experiment_functions - INFO - Early stopping at epoch 1050. Best Recall: 0.0940
2026-05-19 20:49:37,680 - optuna.study.study - INFO - Trial 89 finished with value: 0.09399368754322664 and parameters: {'n_layers': 1, 'embedding_dim': 256, 'lr': 0.0018486358389558674, 'lambda_val': 2.372601134126314e-05, 'batch_size': 1997, 'optimizer': 'Adam'}. Best is trial 51 with value: 0.09805448644736418.
2026-05-19 20:49:44,950 - experiment_functions - INFO - Early stopping at epoch 1150. Best Recall: 0.0940
2026-05-19 20:49:45,052 - optuna.study.study - INFO - Trial 90 finished with value: 0.09400739794213396 and parameters: {'n_layers': 1, 'embedding_dim': 256, 'lr': 0.00216960906686675, 'lambda_val': 2.8445252249284885e-05, 'batch_size': 2006, 'optimizer': 'Adam'}. Best is trial 51 with value: 0.09805448644736418.
2026-05-19 20:49:50,656 - experiment_functions - INFO - Early stopping at epoch 850. Best Recall: 0.0858
2026-05-19 20:49:50,801 - optuna.study.study - INFO - Trial 91 finished with value: 0.08583536329025164 and parameters: {'n_layers': 1, 'embedding_dim': 256, 'lr': 0.002863859924332101, 'lambda_val': 2.0406319873296566e-05, 'batch_size': 2019, 'optimizer': 'Adam'}. Best is trial 51 with value: 0.09805448644736418.
2026-05-19 20:49:58,779 - experiment_functions - INFO - Early stopping at epoch 1150. Best Recall: 0.0863
2026-05-19 20:49:58,869 - optuna.study.study - INFO - Trial 92 finished with value: 0.08628388405361846 and parameters: {'n_layers': 1, 'embedding_dim': 256, 'lr': 0.0030992708330846116, 'lambda_val': 2.6798640605190276e-05, 'batch_size': 2032, 'optimizer': 'Adam'}. Best is trial 51 with value: 0.09805448644736418.
2026-05-19 20:50:03,714 - experiment_functions - INFO - Early stopping at epoch 700. Best Recall: 0.0626
2026-05-19 20:50:03,804 - optuna.study.study - INFO - Trial 93 finished with value: 0.06261212028262397 and parameters: {'n_layers': 1, 'embedding_dim': 256, 'lr': 0.007561978796367014, 'lambda_val': 2.8585328475538082e-05, 'batch_size': 2111, 'optimizer': 'Adam'}. Best is trial 51 with value: 0.09805448644736418.
2026-05-19 20:50:08,851 - experiment_functions - INFO - Early stopping at epoch 750. Best Recall: 0.0773
2026-05-19 20:50:08,942 - optuna.study.study - INFO - Trial 94 finished with value: 0.07729464095623217 and parameters: {'n_layers': 1, 'embedding_dim': 256, 'lr': 0.0046365459587062036, 'lambda_val': 1.766305342783968e-05, 'batch_size': 1980, 'optimizer': 'Adam'}. Best is trial 51 with value: 0.09805448644736418.
2026-05-19 20:50:15,572 - experiment_functions - INFO - Early stopping at epoch 950. Best Recall: 0.0868
2026-05-19 20:50:15,662 - optuna.study.study - INFO - Trial 95 finished with value: 0.08677155261788769 and parameters: {'n_layers': 1, 'embedding_dim': 256, 'lr': 0.0028114661643611283, 'lambda_val': 2.6149395482656687e-05, 'batch_size': 1918, 'optimizer': 'Adam'}. Best is trial 51 with value: 0.09805448644736418.
2026-05-19 20:50:24,505 - experiment_functions - INFO - Early stopping at epoch 1400. Best Recall: 0.0931
2026-05-19 20:50:24,597 - optuna.study.study - INFO - Trial 96 finished with value: 0.09313488826071778 and parameters: {'n_layers': 1, 'embedding_dim': 256, 'lr': 0.001962357939850163, 'lambda_val': 1.2474738683934885e-05, 'batch_size': 2198, 'optimizer': 'Adam'}. Best is trial 51 with value: 0.09805448644736418.
2026-05-19 20:50:32,510 - experiment_functions - INFO - Early stopping at epoch 1200. Best Recall: 0.0889
2026-05-19 20:50:32,611 - optuna.study.study - INFO - Trial 97 finished with value: 0.08890267197053359 and parameters: {'n_layers': 1, 'embedding_dim': 256, 'lr': 0.0020452898104817616, 'lambda_val': 1.0461493853934162e-05, 'batch_size': 2173, 'optimizer': 'Adam'}. Best is trial 51 with value: 0.09805448644736418.
2026-05-19 20:50:42,850 - experiment_functions - INFO - Early stopping at epoch 1350. Best Recall: 0.0930
2026-05-19 20:50:42,928 - optuna.study.study - INFO - Trial 98 finished with value: 0.09298647421719208 and parameters: {'n_layers': 1, 'embedding_dim': 256, 'lr': 0.0018399318548998865, 'lambda_val': 1.0793225073913535e-05, 'batch_size': 2296, 'optimizer': 'Adam'}. Best is trial 51 with value: 0.09805448644736418.
2026-05-19 20:50:50,269 - experiment_functions - INFO - Early stopping at epoch 1050. Best Recall: 0.0822
2026-05-19 20:50:50,365 - optuna.study.study - INFO - Trial 99 finished with value: 0.08218866693624723 and parameters: {'n_layers': 1, 'embedding_dim': 256, 'lr': 0.0038609671006689223, 'lambda_val': 1.1646175684679258e-05, 'batch_size': 2194, 'optimizer': 'Adam'}. Best is trial 51 with value: 0.09805448644736418.
2026-05-19 20:51:01,909 - experiment_functions - INFO - Early stopping at epoch 1350. Best Recall: 0.0940
2026-05-19 20:51:02,000 - optuna.study.study - INFO - Trial 100 finished with value: 0.09399324636997128 and parameters: {'n_layers': 1, 'embedding_dim': 256, 'lr': 0.0015887323225401932, 'lambda_val': 1.2007492341886805e-05, 'batch_size': 2312, 'optimizer': 'Adam'}. Best is trial 51 with value: 0.09805448644736418.
2026-05-19 20:51:09,806 - experiment_functions - INFO - Early stopping at epoch 1200. Best Recall: 0.1005
2026-05-19 20:51:09,911 - optuna.study.study - INFO - Trial 101 finished with value: 0.10047503340328864 and parameters: {'n_layers': 1, 'embedding_dim': 256, 'lr': 0.001465937903753266, 'lambda_val': 1.181021338187665e-05, 'batch_size': 2320, 'optimizer': 'Adam'}. Best is trial 101 with value: 0.10047503340328864.
2026-05-19 20:51:15,868 - experiment_functions - INFO - Early stopping at epoch 850. Best Recall: 0.0835
2026-05-19 20:51:15,971 - optuna.study.study - INFO - Trial 102 finished with value: 0.08354515006392048 and parameters: {'n_layers': 1, 'embedding_dim': 256, 'lr': 0.00227274471403738, 'lambda_val': 1.231956099187965e-05, 'batch_size': 2304, 'optimizer': 'Adam'}. Best is trial 101 with value: 0.10047503340328864.
2026-05-19 20:51:25,658 - experiment_functions - INFO - Early stopping at epoch 1400. Best Recall: 0.0897
2026-05-19 20:51:25,750 - optuna.study.study - INFO - Trial 103 finished with value: 0.08969178796211703 and parameters: {'n_layers': 1, 'embedding_dim': 256, 'lr': 0.0014894684583412793, 'lambda_val': 4.1100619069111e-05, 'batch_size': 2416, 'optimizer': 'Adam'}. Best is trial 101 with value: 0.10047503340328864.
2026-05-19 20:51:31,478 - experiment_functions - INFO - Early stopping at epoch 850. Best Recall: 0.0868
2026-05-19 20:51:31,614 - optuna.study.study - INFO - Trial 104 finished with value: 0.08679951554221262 and parameters: {'n_layers': 1, 'embedding_dim': 256, 'lr': 0.0013855054467391914, 'lambda_val': 3.937877690987324e-05, 'batch_size': 2471, 'optimizer': 'Adam'}. Best is trial 101 with value: 0.10047503340328864.
2026-05-19 20:51:39,982 - experiment_functions - INFO - Early stopping at epoch 1000. Best Recall: 0.0901
2026-05-19 20:51:40,073 - optuna.study.study - INFO - Trial 105 finished with value: 0.09005237913341316 and parameters: {'n_layers': 1, 'embedding_dim': 256, 'lr': 0.0016782804161523184, 'lambda_val': 6.274973547771637e-05, 'batch_size': 2361, 'optimizer': 'Adam'}. Best is trial 101 with value: 0.10047503340328864.
2026-05-19 20:51:47,385 - experiment_functions - INFO - Early stopping at epoch 1100. Best Recall: 0.0879
2026-05-19 20:51:47,463 - optuna.study.study - INFO - Trial 106 finished with value: 0.08794883355745879 and parameters: {'n_layers': 1, 'embedding_dim': 256, 'lr': 0.0015864052455352583, 'lambda_val': 3.43521587601208e-05, 'batch_size': 2322, 'optimizer': 'Adam'}. Best is trial 101 with value: 0.10047503340328864.
2026-05-19 20:51:54,881 - experiment_functions - INFO - Early stopping at epoch 1150. Best Recall: 0.0917
2026-05-19 20:51:54,971 - optuna.study.study - INFO - Trial 107 finished with value: 0.09173408845700284 and parameters: {'n_layers': 1, 'embedding_dim': 256, 'lr': 0.0019778025068832713, 'lambda_val': 1.3799526421365849e-05, 'batch_size': 2465, 'optimizer': 'Adam'}. Best is trial 101 with value: 0.10047503340328864.
2026-05-19 20:52:01,915 - experiment_functions - INFO - Early stopping at epoch 700. Best Recall: 0.0739
2026-05-19 20:52:02,027 - optuna.study.study - INFO - Trial 108 finished with value: 0.07390089042099257 and parameters: {'n_layers': 1, 'embedding_dim': 256, 'lr': 0.005532826358914046, 'lambda_val': 1.4301409544189093e-05, 'batch_size': 2514, 'optimizer': 'Adam'}. Best is trial 101 with value: 0.10047503340328864.
2026-05-19 20:52:07,451 - experiment_functions - INFO - Early stopping at epoch 800. Best Recall: 0.0794
2026-05-19 20:52:07,540 - optuna.study.study - INFO - Trial 109 finished with value: 0.0794071521148534 and parameters: {'n_layers': 1, 'embedding_dim': 256, 'lr': 0.003951790335123194, 'lambda_val': 5.981503477820211e-05, 'batch_size': 2415, 'optimizer': 'Adam'}. Best is trial 101 with value: 0.10047503340328864.
2026-05-19 20:52:15,610 - experiment_functions - INFO - Early stopping at epoch 1250. Best Recall: 0.0856
2026-05-19 20:52:15,711 - optuna.study.study - INFO - Trial 110 finished with value: 0.0855932323604166 and parameters: {'n_layers': 1, 'embedding_dim': 256, 'lr': 0.001727485649663894, 'lambda_val': 4.2540686854677094e-05, 'batch_size': 2756, 'optimizer': 'Adam'}. Best is trial 101 with value: 0.10047503340328864.
2026-05-19 20:52:23,316 - experiment_functions - INFO - Early stopping at epoch 1050. Best Recall: 0.1006
2026-05-19 20:52:23,406 - optuna.study.study - INFO - Trial 111 finished with value: 0.10059274689336388 and parameters: {'n_layers': 1, 'embedding_dim': 256, 'lr': 0.0020936015873974662, 'lambda_val': 4.11149366038064e-06, 'batch_size': 2133, 'optimizer': 'Adam'}. Best is trial 111 with value: 0.10059274689336388.
2026-05-19 20:52:29,910 - experiment_functions - INFO - Early stopping at epoch 950. Best Recall: 0.0889
2026-05-19 20:52:30,010 - optuna.study.study - INFO - Trial 112 finished with value: 0.088903122777006 and parameters: {'n_layers': 1, 'embedding_dim': 256, 'lr': 0.0023887895696331715, 'lambda_val': 3.3363108140403706e-06, 'batch_size': 2116, 'optimizer': 'Adam'}. Best is trial 111 with value: 0.10059274689336388.
2026-05-19 20:52:40,249 - experiment_functions - INFO - Early stopping at epoch 1150. Best Recall: 0.0888
2026-05-19 20:52:40,340 - optuna.study.study - INFO - Trial 113 finished with value: 0.08875757296335068 and parameters: {'n_layers': 1, 'embedding_dim': 256, 'lr': 0.001324849360477163, 'lambda_val': 4.264967005625518e-06, 'batch_size': 2398, 'optimizer': 'Adam'}. Best is trial 111 with value: 0.10059274689336388.
2026-05-19 20:52:47,024 - optuna.study._optimize - INFO - Trial 114 pruned. 
2026-05-19 20:53:01,363 - experiment_functions - INFO - Early stopping at epoch 1550. Best Recall: 0.0908
2026-05-19 20:53:01,453 - optuna.study.study - INFO - Trial 115 finished with value: 0.09079467042076458 and parameters: {'n_layers': 1, 'embedding_dim': 256, 'lr': 0.001687838087502005, 'lambda_val': 1.8423754473668002e-05, 'batch_size': 2313, 'optimizer': 'Adam'}. Best is trial 111 with value: 0.10059274689336388.
2026-05-19 20:53:07,950 - experiment_functions - INFO - Early stopping at epoch 950. Best Recall: 0.0853
2026-05-19 20:53:08,030 - optuna.study.study - INFO - Trial 116 finished with value: 0.08529435583925095 and parameters: {'n_layers': 1, 'embedding_dim': 256, 'lr': 0.003316628595160223, 'lambda_val': 8.27980803225694e-06, 'batch_size': 2351, 'optimizer': 'Adam'}. Best is trial 111 with value: 0.10059274689336388.
2026-05-19 20:53:14,110 - optuna.study._optimize - INFO - Trial 117 pruned. 
2026-05-19 20:53:23,470 - optuna.study._optimize - INFO - Trial 118 pruned. 
2026-05-19 20:53:27,665 - experiment_functions - INFO - Early stopping at epoch 500. Best Recall: 0.0026
2026-05-19 20:53:27,775 - optuna.study.study - INFO - Trial 119 finished with value: 0.0025579855589228494 and parameters: {'n_layers': 1, 'embedding_dim': 256, 'lr': 0.0012620325288707304, 'lambda_val': 8.044250542056702e-06, 'batch_size': 2599, 'optimizer': 'SGD'}. Best is trial 111 with value: 0.10059274689336388.
2026-05-19 20:53:39,513 - experiment_functions - INFO - Early stopping at epoch 1850. Best Recall: 0.0902
2026-05-19 20:53:39,649 - optuna.study.study - INFO - Trial 120 finished with value: 0.09015000726523204 and parameters: {'n_layers': 1, 'embedding_dim': 256, 'lr': 0.0008395643827393434, 'lambda_val': 3.930700807642033e-06, 'batch_size': 2518, 'optimizer': 'Adam'}. Best is trial 111 with value: 0.10059274689336388.
2026-05-19 20:54:03,275 - experiment_functions - INFO - Early stopping at epoch 3400. Best Recall: 0.0942
2026-05-19 20:54:03,387 - optuna.study.study - INFO - Trial 121 finished with value: 0.09416103552924537 and parameters: {'n_layers': 1, 'embedding_dim': 256, 'lr': 0.0008851478704831926, 'lambda_val': 4.551785209119716e-06, 'batch_size': 2515, 'optimizer': 'Adam'}. Best is trial 111 with value: 0.10059274689336388.
2026-05-19 20:54:14,190 - experiment_functions - INFO - Early stopping at epoch 1700. Best Recall: 0.0917
2026-05-19 20:54:14,290 - optuna.study.study - INFO - Trial 122 finished with value: 0.09169502255497054 and parameters: {'n_layers': 1, 'embedding_dim': 256, 'lr': 0.0008448145538326421, 'lambda_val': 2.2614074188743024e-06, 'batch_size': 2457, 'optimizer': 'Adam'}. Best is trial 111 with value: 0.10059274689336388.
2026-05-19 20:54:26,461 - optuna.study._optimize - INFO - Trial 123 pruned. 
2026-05-19 20:54:33,033 - experiment_functions - INFO - Early stopping at epoch 950. Best Recall: 0.0861
2026-05-19 20:54:33,156 - optuna.study.study - INFO - Trial 124 finished with value: 0.08607730320564363 and parameters: {'n_layers': 1, 'embedding_dim': 256, 'lr': 0.002685825142412847, 'lambda_val': 6.266409841588375e-06, 'batch_size': 2279, 'optimizer': 'Adam'}. Best is trial 111 with value: 0.10059274689336388.
2026-05-19 20:54:40,213 - experiment_functions - INFO - Early stopping at epoch 1000. Best Recall: 0.0861
