2026-05-19 17:29:08,546 - optuna.study.study - INFO - Trial 169 finished with value: 0.020545364099004582 and parameters: {'n_layers': 4, 'embedding_dim': 32, 'lr': 0.05100162951132955, 'lambda_val': 4.445956039340148e-05, 'batch_size': 3590, 'optimizer': 'Adam'}. Best is trial 138 with value: 0.023931469710893754.
2026-05-19 17:29:21,362 - experiment_functions - INFO - Early stopping at epoch 2050. Best Recall: 0.0227
2026-05-19 17:29:21,472 - optuna.study.study - INFO - Trial 170 finished with value: 0.022739880152524112 and parameters: {'n_layers': 4, 'embedding_dim': 32, 'lr': 0.05053402916513809, 'lambda_val': 3.341398004225584e-05, 'batch_size': 3429, 'optimizer': 'Adam'}. Best is trial 138 with value: 0.023931469710893754.
2026-05-19 17:29:35,833 - experiment_functions - INFO - Early stopping at epoch 1700. Best Recall: 0.0189
2026-05-19 17:29:35,976 - optuna.study.study - INFO - Trial 171 finished with value: 0.018922650527987972 and parameters: {'n_layers': 4, 'embedding_dim': 32, 'lr': 0.053175662345770806, 'lambda_val': 3.8385942934208795e-05, 'batch_size': 3439, 'optimizer': 'Adam'}. Best is trial 138 with value: 0.023931469710893754.
2026-05-19 17:29:52,816 - experiment_functions - INFO - Early stopping at epoch 2600. Best Recall: 0.0238
2026-05-19 17:29:52,919 - optuna.study.study - INFO - Trial 172 finished with value: 0.023799906584801866 and parameters: {'n_layers': 4, 'embedding_dim': 32, 'lr': 0.06442078038557349, 'lambda_val': 4.7145243394864915e-05, 'batch_size': 3534, 'optimizer': 'Adam'}. Best is trial 138 with value: 0.023931469710893754.
2026-05-19 17:30:01,091 - experiment_functions - INFO - Early stopping at epoch 1200. Best Recall: 0.0197
2026-05-19 17:30:01,215 - optuna.study.study - INFO - Trial 173 finished with value: 0.019652633535260703 and parameters: {'n_layers': 4, 'embedding_dim': 32, 'lr': 0.06658935606874541, 'lambda_val': 3.2011586891440654e-05, 'batch_size': 3529, 'optimizer': 'Adam'}. Best is trial 138 with value: 0.023931469710893754.
2026-05-19 17:30:10,770 - experiment_functions - INFO - Early stopping at epoch 1400. Best Recall: 0.0192
2026-05-19 17:30:10,851 - optuna.study.study - INFO - Trial 174 finished with value: 0.01918947264344257 and parameters: {'n_layers': 4, 'embedding_dim': 32, 'lr': 0.07916282314778196, 'lambda_val': 2.142074217477463e-05, 'batch_size': 3666, 'optimizer': 'Adam'}. Best is trial 138 with value: 0.023931469710893754.
2026-05-19 17:30:29,066 - optuna.study._optimize - INFO - Trial 175 pruned. 
2026-05-19 17:30:37,009 - optuna.study._optimize - INFO - Trial 176 pruned. 
2026-05-19 17:30:42,019 - experiment_functions - INFO - Early stopping at epoch 550. Best Recall: 0.0054
2026-05-19 17:30:42,120 - optuna.study.study - INFO - Trial 177 finished with value: 0.005433197642998864 and parameters: {'n_layers': 4, 'embedding_dim': 32, 'lr': 0.09608213616868427, 'lambda_val': 0.039997598378444056, 'batch_size': 3715, 'optimizer': 'Adam'}. Best is trial 138 with value: 0.023931469710893754.
2026-05-19 17:31:01,307 - optuna.study._optimize - INFO - Trial 178 pruned. 
2026-05-19 17:31:05,917 - experiment_functions - INFO - Early stopping at epoch 750. Best Recall: 0.0153
2026-05-19 17:31:06,018 - optuna.study.study - INFO - Trial 179 finished with value: 0.015332616429393858 and parameters: {'n_layers': 4, 'embedding_dim': 32, 'lr': 0.07188374231040222, 'lambda_val': 1.3180190129800766e-05, 'batch_size': 3741, 'optimizer': 'Adam'}. Best is trial 138 with value: 0.023931469710893754.
2026-05-19 17:31:16,298 - experiment_functions - INFO - Early stopping at epoch 550. Best Recall: 0.0078
2026-05-19 17:31:16,391 - optuna.study.study - INFO - Trial 180 finished with value: 0.007793484654345519 and parameters: {'n_layers': 4, 'embedding_dim': 96, 'lr': 0.0015896569749878776, 'lambda_val': 3.305311716546131e-05, 'batch_size': 3850, 'optimizer': 'Adam'}. Best is trial 138 with value: 0.023931469710893754.
2026-05-19 17:31:30,591 - experiment_functions - INFO - Early stopping at epoch 2150. Best Recall: 0.0218
2026-05-19 17:31:30,682 - optuna.study.study - INFO - Trial 181 finished with value: 0.021848251564980943 and parameters: {'n_layers': 4, 'embedding_dim': 32, 'lr': 0.05228620999706855, 'lambda_val': 4.317268834533108e-05, 'batch_size': 3597, 'optimizer': 'Adam'}. Best is trial 138 with value: 0.023931469710893754.
2026-05-19 17:31:48,019 - experiment_functions - INFO - Early stopping at epoch 2550. Best Recall: 0.0238
2026-05-19 17:31:48,131 - optuna.study.study - INFO - Trial 182 finished with value: 0.023819034579615633 and parameters: {'n_layers': 4, 'embedding_dim': 32, 'lr': 0.05801928112608021, 'lambda_val': 4.985076419232933e-05, 'batch_size': 3691, 'optimizer': 'Adam'}. Best is trial 138 with value: 0.023931469710893754.
2026-05-19 17:31:54,857 - optuna.study._optimize - INFO - Trial 183 pruned. 
2026-05-19 17:32:17,189 - experiment_functions - INFO - Early stopping at epoch 2450. Best Recall: 0.0221
2026-05-19 17:32:17,290 - optuna.study.study - INFO - Trial 184 finished with value: 0.022072437680594248 and parameters: {'n_layers': 4, 'embedding_dim': 32, 'lr': 0.054977655227011514, 'lambda_val': 8.213694341882536e-05, 'batch_size': 3451, 'optimizer': 'Adam'}. Best is trial 138 with value: 0.023931469710893754.
2026-05-19 17:32:25,501 - experiment_functions - INFO - Early stopping at epoch 1100. Best Recall: 0.0199
2026-05-19 17:32:25,606 - optuna.study.study - INFO - Trial 185 finished with value: 0.019913976029191715 and parameters: {'n_layers': 4, 'embedding_dim': 32, 'lr': 0.05591276512025003, 'lambda_val': 8.200324114558142e-05, 'batch_size': 3685, 'optimizer': 'Adam'}. Best is trial 138 with value: 0.023931469710893754.
2026-05-19 17:32:46,657 - optuna.study._optimize - INFO - Trial 186 pruned. 
2026-05-19 17:32:50,768 - experiment_functions - INFO - Early stopping at epoch 500. Best Recall: 0.0014
2026-05-19 17:32:50,849 - optuna.study.study - INFO - Trial 187 finished with value: 0.0013919844008017967 and parameters: {'n_layers': 4, 'embedding_dim': 32, 'lr': 0.00014470701082867004, 'lambda_val': 6.526120892819325e-05, 'batch_size': 3332, 'optimizer': 'SGD'}. Best is trial 138 with value: 0.023931469710893754.
2026-05-19 17:33:11,378 - experiment_functions - INFO - Early stopping at epoch 2550. Best Recall: 0.0219
2026-05-19 17:33:11,523 - optuna.study.study - INFO - Trial 188 finished with value: 0.02189617756954652 and parameters: {'n_layers': 4, 'embedding_dim': 32, 'lr': 0.05355492089100356, 'lambda_val': 4.699388149606703e-05, 'batch_size': 3778, 'optimizer': 'Adam'}. Best is trial 138 with value: 0.023931469710893754.
2026-05-19 17:33:20,551 - optuna.study._optimize - INFO - Trial 189 pruned. 
2026-05-19 17:33:29,195 - optuna.study._optimize - INFO - Trial 190 pruned. 
2026-05-19 17:33:37,162 - optuna.study._optimize - INFO - Trial 191 pruned. 
2026-05-19 17:33:49,797 - experiment_functions - INFO - Early stopping at epoch 1600. Best Recall: 0.0193
2026-05-19 17:33:49,890 - optuna.study.study - INFO - Trial 192 finished with value: 0.01932934264581223 and parameters: {'n_layers': 4, 'embedding_dim': 32, 'lr': 0.03583178310022963, 'lambda_val': 5.826678459367141e-05, 'batch_size': 3620, 'optimizer': 'Adam'}. Best is trial 138 with value: 0.023931469710893754.
2026-05-19 17:33:58,710 - optuna.study._optimize - INFO - Trial 193 pruned. 
2026-05-19 17:34:12,247 - experiment_functions - INFO - Early stopping at epoch 1550. Best Recall: 0.0191
2026-05-19 17:34:12,337 - optuna.study.study - INFO - Trial 194 finished with value: 0.019149337115454176 and parameters: {'n_layers': 4, 'embedding_dim': 32, 'lr': 0.046307318468971535, 'lambda_val': 7.481555333584467e-05, 'batch_size': 3719, 'optimizer': 'Adam'}. Best is trial 138 with value: 0.023931469710893754.
2026-05-19 17:34:31,603 - experiment_functions - INFO - Early stopping at epoch 2700. Best Recall: 0.0223
2026-05-19 17:34:31,715 - optuna.study.study - INFO - Trial 195 finished with value: 0.022258617508560695 and parameters: {'n_layers': 4, 'embedding_dim': 32, 'lr': 0.04085216026535143, 'lambda_val': 4.152328856212106e-05, 'batch_size': 3827, 'optimizer': 'Adam'}. Best is trial 138 with value: 0.023931469710893754.
2026-05-19 17:34:44,512 - experiment_functions - INFO - Early stopping at epoch 1150. Best Recall: 0.0176
2026-05-19 17:34:46,454 - optuna.study.study - INFO - Trial 196 finished with value: 0.017567876556798 and parameters: {'n_layers': 4, 'embedding_dim': 32, 'lr': 0.055255376758286553, 'lambda_val': 4.501658646006017e-05, 'batch_size': 3867, 'optimizer': 'Adam'}. Best is trial 138 with value: 0.023931469710893754.
2026-05-19 17:34:59,335 - optuna.study._optimize - INFO - Trial 197 pruned. 
2026-05-19 17:35:08,616 - optuna.study._optimize - INFO - Trial 198 pruned. 
2026-05-19 17:35:22,582 - experiment_functions - INFO - Early stopping at epoch 1550. Best Recall: 0.0199
2026-05-19 17:35:22,683 - optuna.study.study - INFO - Trial 199 finished with value: 0.01992794567655912 and parameters: {'n_layers': 4, 'embedding_dim': 32, 'lr': 0.06567212300224098, 'lambda_val': 5.9745008202634025e-05, 'batch_size': 3584, 'optimizer': 'Adam'}. Best is trial 138 with value: 0.023931469710893754.
2026-05-19 17:35:30,353 - optuna.study._optimize - INFO - Trial 200 pruned. 
2026-05-19 17:35:42,945 - experiment_functions - INFO - Early stopping at epoch 1150. Best Recall: 0.0177
2026-05-19 17:35:43,086 - optuna.study.study - INFO - Trial 201 finished with value: 0.017660540830547775 and parameters: {'n_layers': 4, 'embedding_dim': 32, 'lr': 0.05190085764068609, 'lambda_val': 8.497511881446039e-05, 'batch_size': 3682, 'optimizer': 'Adam'}. Best is trial 138 with value: 0.023931469710893754.
2026-05-19 17:35:55,897 - experiment_functions - INFO - Early stopping at epoch 1700. Best Recall: 0.0211
2026-05-19 17:35:56,009 - optuna.study.study - INFO - Trial 202 finished with value: 0.021071929114161007 and parameters: {'n_layers': 4, 'embedding_dim': 32, 'lr': 0.041778194299672944, 'lambda_val': 3.718460231814789e-05, 'batch_size': 3490, 'optimizer': 'Adam'}. Best is trial 138 with value: 0.023931469710893754.
2026-05-19 17:36:08,192 - optuna.study._optimize - INFO - Trial 203 pruned. 
2026-05-19 17:36:32,478 - optuna.study._optimize - INFO - Trial 204 pruned. 
2026-05-19 17:36:38,945 - experiment_functions - INFO - Early stopping at epoch 650. Best Recall: 0.0047
2026-05-19 17:36:39,103 - optuna.study.study - INFO - Trial 205 finished with value: 0.004655380844748837 and parameters: {'n_layers': 4, 'embedding_dim': 32, 'lr': 0.03377948576847807, 'lambda_val': 0.0019750813807602094, 'batch_size': 3761, 'optimizer': 'Adam'}. Best is trial 138 with value: 0.023931469710893754.
2026-05-19 17:36:53,506 - optuna.study._optimize - INFO - Trial 206 pruned. 
2026-05-19 17:37:01,651 - optuna.study._optimize - INFO - Trial 207 pruned. 
2026-05-19 17:37:10,863 - optuna.study._optimize - INFO - Trial 208 pruned. 
2026-05-19 17:37:25,105 - experiment_functions - INFO - Early stopping at epoch 1650. Best Recall: 0.0211
2026-05-19 17:37:25,241 - optuna.study.study - INFO - Trial 209 finished with value: 0.02111511195323789 and parameters: {'n_layers': 4, 'embedding_dim': 32, 'lr': 0.06227395724880796, 'lambda_val': 2.8027519084841284e-05, 'batch_size': 3815, 'optimizer': 'Adam'}. Best is trial 138 with value: 0.023931469710893754.
2026-05-19 17:37:30,018 - experiment_functions - INFO - Early stopping at epoch 700. Best Recall: 0.0144
2026-05-19 17:37:30,110 - optuna.study.study - INFO - Trial 210 finished with value: 0.014428877368104385 and parameters: {'n_layers': 4, 'embedding_dim': 32, 'lr': 0.08527565941302882, 'lambda_val': 2.5667027926047407e-05, 'batch_size': 4030, 'optimizer': 'Adam'}. Best is trial 138 with value: 0.023931469710893754.
2026-05-19 17:37:38,391 - optuna.study._optimize - INFO - Trial 211 pruned. 
2026-05-19 17:37:47,677 - experiment_functions - INFO - Early stopping at epoch 1550. Best Recall: 0.0197
2026-05-19 17:37:47,834 - optuna.study.study - INFO - Trial 212 finished with value: 0.01969862022475901 and parameters: {'n_layers': 4, 'embedding_dim': 32, 'lr': 0.06691215373868281, 'lambda_val': 5.026738591349808e-05, 'batch_size': 3658, 'optimizer': 'Adam'}. Best is trial 138 with value: 0.023931469710893754.
2026-05-19 17:37:58,204 - optuna.study._optimize - INFO - Trial 213 pruned. 
2026-05-19 17:38:02,145 - experiment_functions - INFO - Early stopping at epoch 550. Best Recall: 0.0072
2026-05-19 17:38:02,298 - optuna.study.study - INFO - Trial 214 finished with value: 0.007187095735351111 and parameters: {'n_layers': 4, 'embedding_dim': 32, 'lr': 0.003154498796671804, 'lambda_val': 0.0010252987435103752, 'batch_size': 3607, 'optimizer': 'Adam'}. Best is trial 138 with value: 0.023931469710893754.
2026-05-19 17:38:10,373 - experiment_functions - INFO - Early stopping at epoch 1400. Best Recall: 0.0189
2026-05-19 17:38:10,465 - optuna.study.study - INFO - Trial 215 finished with value: 0.01894567996683105 and parameters: {'n_layers': 4, 'embedding_dim': 64, 'lr': 0.04282602998175559, 'lambda_val': 6.210043408238847e-05, 'batch_size': 3791, 'optimizer': 'Adam'}. Best is trial 138 with value: 0.023931469710893754.
2026-05-19 17:38:18,763 - experiment_functions - INFO - Early stopping at epoch 1250. Best Recall: 0.0196
2026-05-19 17:38:18,853 - optuna.study.study - INFO - Trial 216 finished with value: 0.019597945472401176 and parameters: {'n_layers': 4, 'embedding_dim': 32, 'lr': 0.05593555970040727, 'lambda_val': 2.3257915691137408e-05, 'batch_size': 3960, 'optimizer': 'Adam'}. Best is trial 138 with value: 0.023931469710893754.
2026-05-19 17:38:23,874 - experiment_functions - INFO - Early stopping at epoch 700. Best Recall: 0.0161
2026-05-19 17:38:23,986 - optuna.study.study - INFO - Trial 217 finished with value: 0.016090113562870836 and parameters: {'n_layers': 4, 'embedding_dim': 32, 'lr': 0.07098766224831235, 'lambda_val': 3.761700490582921e-05, 'batch_size': 3908, 'optimizer': 'Adam'}. Best is trial 138 with value: 0.023931469710893754.
2026-05-19 17:38:40,878 - experiment_functions - INFO - Early stopping at epoch 2050. Best Recall: 0.0215
2026-05-19 17:38:41,011 - optuna.study.study - INFO - Trial 218 finished with value: 0.02149770958202321 and parameters: {'n_layers': 4, 'embedding_dim': 96, 'lr': 0.033599541323757684, 'lambda_val': 7.10250242546284e-05, 'batch_size': 3706, 'optimizer': 'Adam'}. Best is trial 138 with value: 0.023931469710893754.
2026-05-19 17:38:53,370 - experiment_functions - INFO - Early stopping at epoch 1200. Best Recall: 0.0182
2026-05-19 17:38:54,131 - optuna.study.study - INFO - Trial 219 finished with value: 0.01817917362355188 and parameters: {'n_layers': 4, 'embedding_dim': 96, 'lr': 0.03154381059933615, 'lambda_val': 2.9772669172622183e-05, 'batch_size': 3842, 'optimizer': 'Adam'}. Best is trial 138 with value: 0.023931469710893754.
2026-05-19 17:39:05,844 - experiment_functions - INFO - Early stopping at epoch 500. Best Recall: 0.0013
2026-05-19 17:39:05,943 - optuna.study.study - INFO - Trial 220 finished with value: 0.001282958470892222 and parameters: {'n_layers': 4, 'embedding_dim': 96, 'lr': 0.0003348852095591764, 'lambda_val': 5.1228925331407944e-05, 'batch_size': 3718, 'optimizer': 'SGD'}. Best is trial 138 with value: 0.023931469710893754.
2026-05-19 17:39:13,832 - optuna.study._optimize - INFO - Trial 221 pruned. 
2026-05-19 17:39:26,913 - optuna.study._optimize - INFO - Trial 222 pruned. 
2026-05-19 17:39:35,884 - optuna.study._optimize - INFO - Trial 223 pruned. 
2026-05-19 17:39:56,790 - experiment_functions - INFO - Early stopping at epoch 2850. Best Recall: 0.0230
2026-05-19 17:39:56,936 - optuna.study.study - INFO - Trial 224 finished with value: 0.023029446857038737 and parameters: {'n_layers': 4, 'embedding_dim': 32, 'lr': 0.045494665951030716, 'lambda_val': 9.276047147748874e-05, 'batch_size': 3758, 'optimizer': 'Adam'}. Best is trial 138 with value: 0.023931469710893754.
2026-05-19 17:40:06,677 - optuna.study._optimize - INFO - Trial 225 pruned. 
2026-05-19 17:40:17,839 - experiment_functions - INFO - Early stopping at epoch 1450. Best Recall: 0.0214
2026-05-19 17:40:17,946 - optuna.study.study - INFO - Trial 226 finished with value: 0.02136030622136305 and parameters: {'n_layers': 4, 'embedding_dim': 32, 'lr': 0.06248669169949804, 'lambda_val': 4.926382102336628e-05, 'batch_size': 3836, 'optimizer': 'Adam'}. Best is trial 138 with value: 0.023931469710893754.
2026-05-19 17:40:37,350 - optuna.study._optimize - INFO - Trial 227 pruned. 
2026-05-19 17:40:44,108 - optuna.study._optimize - INFO - Trial 228 pruned. 
2026-05-19 17:41:05,848 - experiment_functions - INFO - Early stopping at epoch 2900. Best Recall: 0.0281
2026-05-19 17:41:05,999 - optuna.study.study - INFO - Trial 229 finished with value: 0.028123093326230243 and parameters: {'n_layers': 4, 'embedding_dim': 32, 'lr': 0.08009533750633052, 'lambda_val': 8.850293322107583e-05, 'batch_size': 3514, 'optimizer': 'Adam'}. Best is trial 229 with value: 0.028123093326230243.
2026-05-19 17:41:17,095 - optuna.study._optimize - INFO - Trial 230 pruned. 
2026-05-19 17:41:23,057 - experiment_functions - INFO - Early stopping at epoch 800. Best Recall: 0.0168
2026-05-19 17:41:23,160 - optuna.study.study - INFO - Trial 231 finished with value: 0.016820158114752255 and parameters: {'n_layers': 4, 'embedding_dim': 32, 'lr': 0.09682212209194076, 'lambda_val': 0.00011789593924797952, 'batch_size': 3547, 'optimizer': 'Adam'}. Best is trial 229 with value: 0.028123093326230243.
2026-05-19 17:41:29,273 - optuna.study._optimize - INFO - Trial 232 pruned. 
2026-05-19 17:41:36,430 - experiment_functions - INFO - Early stopping at epoch 1150. Best Recall: 0.0234
2026-05-19 17:41:36,534 - optuna.study.study - INFO - Trial 233 finished with value: 0.023397710309661136 and parameters: {'n_layers': 4, 'embedding_dim': 32, 'lr': 0.05553603983677684, 'lambda_val': 4.2202028752933885e-05, 'batch_size': 3498, 'optimizer': 'Adam'}. Best is trial 229 with value: 0.028123093326230243.
2026-05-19 17:41:45,231 - optuna.study._optimize - INFO - Trial 234 pruned. 
2026-05-19 17:41:52,467 - optuna.study._optimize - INFO - Trial 235 pruned. 
2026-05-19 17:42:05,852 - experiment_functions - INFO - Early stopping at epoch 1900. Best Recall: 0.0231
2026-05-19 17:42:06,572 - optuna.study.study - INFO - Trial 236 finished with value: 0.023095653447830645 and parameters: {'n_layers': 4, 'embedding_dim': 32, 'lr': 0.05837919125637922, 'lambda_val': 5.189226020681523e-05, 'batch_size': 3502, 'optimizer': 'Adam'}. Best is trial 229 with value: 0.028123093326230243.
2026-05-19 17:42:14,260 - optuna.study._optimize - INFO - Trial 237 pruned. 
2026-05-19 17:42:26,800 - optuna.study._optimize - INFO - Trial 238 pruned. 
2026-05-19 17:42:33,265 - experiment_functions - INFO - Early stopping at epoch 1100. Best Recall: 0.0205
2026-05-19 17:42:33,368 - optuna.study.study - INFO - Trial 239 finished with value: 0.02054394108648853 and parameters: {'n_layers': 4, 'embedding_dim': 32, 'lr': 0.08078493435061382, 'lambda_val': 3.571852808492574e-05, 'batch_size': 3522, 'optimizer': 'Adam'}. Best is trial 229 with value: 0.028123093326230243.
2026-05-19 17:42:40,234 - experiment_functions - INFO - Early stopping at epoch 1050. Best Recall: 0.0186
2026-05-19 17:42:40,334 - optuna.study.study - INFO - Trial 240 finished with value: 0.018587271662331768 and parameters: {'n_layers': 4, 'embedding_dim': 32, 'lr': 0.06086111190203596, 'lambda_val': 5.237830389247177e-05, 'batch_size': 3425, 'optimizer': 'Adam'}. Best is trial 229 with value: 0.028123093326230243.
2026-05-19 17:42:52,313 - optuna.study._optimize - INFO - Trial 241 pruned. 
2026-05-19 17:43:11,985 - experiment_functions - INFO - Early stopping at epoch 3300. Best Recall: 0.0226
2026-05-19 17:43:12,063 - optuna.study.study - INFO - Trial 242 finished with value: 0.022622103160430278 and parameters: {'n_layers': 4, 'embedding_dim': 32, 'lr': 0.04726999629037611, 'lambda_val': 4.443074959747633e-05, 'batch_size': 3690, 'optimizer': 'Adam'}. Best is trial 229 with value: 0.028123093326230243.
2026-05-19 17:43:23,297 - optuna.study._optimize - INFO - Trial 243 pruned. 
2026-05-19 17:43:30,387 - optuna.study._optimize - INFO - Trial 244 pruned. 
2026-05-19 17:43:38,368 - optuna.study._optimize - INFO - Trial 245 pruned. 
2026-05-19 17:43:47,466 - optuna.study._optimize - INFO - Trial 246 pruned. 
2026-05-19 17:43:55,845 - experiment_functions - INFO - Early stopping at epoch 1350. Best Recall: 0.0191
2026-05-19 17:43:55,936 - optuna.study.study - INFO - Trial 247 finished with value: 0.019064116515396103 and parameters: {'n_layers': 4, 'embedding_dim': 32, 'lr': 0.069554986381124, 'lambda_val': 6.43559115109012e-05, 'batch_size': 3508, 'optimizer': 'Adam'}. Best is trial 229 with value: 0.028123093326230243.
2026-05-19 17:44:02,248 - optuna.study._optimize - INFO - Trial 248 pruned. 
2026-05-19 17:44:11,029 - optuna.study._optimize - INFO - Trial 249 pruned. 
2026-05-19 17:44:17,963 - optuna.study._optimize - INFO - Trial 250 pruned. 
2026-05-19 17:44:32,795 - optuna.study._optimize - INFO - Trial 251 pruned. 
2026-05-19 17:44:53,399 - optuna.study._optimize - INFO - Trial 252 pruned. 
2026-05-19 17:45:00,276 - optuna.study._optimize - INFO - Trial 253 pruned. 
2026-05-19 17:45:12,112 - optuna.study._optimize - INFO - Trial 254 pruned. 
2026-05-19 17:45:18,976 - optuna.study._optimize - INFO - Trial 255 pruned. 
2026-05-19 17:45:25,246 - optuna.study._optimize - INFO - Trial 256 pruned. 
2026-05-19 17:45:29,323 - experiment_functions - INFO - Early stopping at epoch 500. Best Recall: 0.0017
2026-05-19 17:45:29,424 - optuna.study.study - INFO - Trial 257 finished with value: 0.0016860856243001727 and parameters: {'n_layers': 4, 'embedding_dim': 96, 'lr': 0.032683635548675365, 'lambda_val': 7.865783839428686e-05, 'batch_size': 3393, 'optimizer': 'SGD'}. Best is trial 229 with value: 0.028123093326230243.
