2026-05-19 20:54:40,304 - optuna.study.study - INFO - Trial 125 finished with value: 0.08614798763823078 and parameters: {'n_layers': 1, 'embedding_dim': 256, 'lr': 0.0021415875381212536, 'lambda_val': 1.1469722439810306e-06, 'batch_size': 2141, 'optimizer': 'Adam'}. Best is trial 111 with value: 0.10059274689336388.
2026-05-19 20:54:53,895 - experiment_functions - INFO - Early stopping at epoch 2150. Best Recall: 0.1004
2026-05-19 20:54:54,073 - optuna.study.study - INFO - Trial 126 finished with value: 0.10043611608469878 and parameters: {'n_layers': 1, 'embedding_dim': 256, 'lr': 0.0008925583998443499, 'lambda_val': 1.3289653677319458e-05, 'batch_size': 2643, 'optimizer': 'Adam'}. Best is trial 111 with value: 0.10059274689336388.
2026-05-19 20:55:07,689 - experiment_functions - INFO - Early stopping at epoch 1700. Best Recall: 0.1000
2026-05-19 20:55:07,807 - optuna.study.study - INFO - Trial 127 finished with value: 0.10001470777240383 and parameters: {'n_layers': 1, 'embedding_dim': 256, 'lr': 0.0008983811467025492, 'lambda_val': 2.655780957040097e-06, 'batch_size': 2689, 'optimizer': 'Adam'}. Best is trial 111 with value: 0.10059274689336388.
2026-05-19 20:55:18,849 - experiment_functions - INFO - Early stopping at epoch 1750. Best Recall: 0.0907
2026-05-19 20:55:18,939 - optuna.study.study - INFO - Trial 128 finished with value: 0.0906883631227447 and parameters: {'n_layers': 1, 'embedding_dim': 256, 'lr': 0.0012500699393889266, 'lambda_val': 2.612564727818239e-06, 'batch_size': 2700, 'optimizer': 'Adam'}. Best is trial 111 with value: 0.10059274689336388.
2026-05-19 20:55:34,680 - experiment_functions - INFO - Early stopping at epoch 1950. Best Recall: 0.1000
2026-05-19 20:55:34,781 - optuna.study.study - INFO - Trial 129 finished with value: 0.09996086808320458 and parameters: {'n_layers': 1, 'embedding_dim': 256, 'lr': 0.0009491410412576642, 'lambda_val': 1.2360709837744953e-05, 'batch_size': 1828, 'optimizer': 'Adam'}. Best is trial 111 with value: 0.10059274689336388.
2026-05-19 20:55:43,785 - optuna.study._optimize - INFO - Trial 130 pruned. 
2026-05-19 20:55:56,101 - experiment_functions - INFO - Early stopping at epoch 1900. Best Recall: 0.1017
2026-05-19 20:55:56,205 - optuna.study.study - INFO - Trial 131 finished with value: 0.10171978570136395 and parameters: {'n_layers': 1, 'embedding_dim': 256, 'lr': 0.0009673092733152741, 'lambda_val': 1.2671096409990157e-05, 'batch_size': 2805, 'optimizer': 'Adam'}. Best is trial 131 with value: 0.10171978570136395.
2026-05-19 20:56:12,577 - experiment_functions - INFO - Early stopping at epoch 2550. Best Recall: 0.1004
2026-05-19 20:56:12,675 - optuna.study.study - INFO - Trial 132 finished with value: 0.10043871975743743 and parameters: {'n_layers': 1, 'embedding_dim': 256, 'lr': 0.0008828555562205123, 'lambda_val': 3.3789323803665612e-06, 'batch_size': 2816, 'optimizer': 'Adam'}. Best is trial 131 with value: 0.10171978570136395.
2026-05-19 20:56:27,751 - experiment_functions - INFO - Early stopping at epoch 2150. Best Recall: 0.0967
2026-05-19 20:56:27,851 - optuna.study.study - INFO - Trial 133 finished with value: 0.09666964355200161 and parameters: {'n_layers': 1, 'embedding_dim': 256, 'lr': 0.0009769930384684506, 'lambda_val': 3.3309873496664003e-06, 'batch_size': 2877, 'optimizer': 'Adam'}. Best is trial 131 with value: 0.10171978570136395.
2026-05-19 20:56:34,929 - optuna.study._optimize - INFO - Trial 134 pruned. 
2026-05-19 20:56:41,707 - optuna.study._optimize - INFO - Trial 135 pruned. 
2026-05-19 20:57:09,591 - experiment_functions - INFO - Early stopping at epoch 3650. Best Recall: 0.0997
2026-05-19 20:57:09,690 - optuna.study.study - INFO - Trial 136 finished with value: 0.09969698794872082 and parameters: {'n_layers': 1, 'embedding_dim': 256, 'lr': 0.0007854737311540009, 'lambda_val': 2.1599375527072015e-06, 'batch_size': 2876, 'optimizer': 'Adam'}. Best is trial 131 with value: 0.10171978570136395.
2026-05-19 20:57:13,489 - experiment_functions - INFO - Early stopping at epoch 500. Best Recall: 0.0036
2026-05-19 20:57:13,580 - optuna.study.study - INFO - Trial 137 finished with value: 0.0036319943107473475 and parameters: {'n_layers': 1, 'embedding_dim': 256, 'lr': 0.0007607813545798623, 'lambda_val': 2.0223217820105194e-06, 'batch_size': 2888, 'optimizer': 'SGD'}. Best is trial 131 with value: 0.10171978570136395.
2026-05-19 20:57:25,904 - experiment_functions - INFO - Early stopping at epoch 1900. Best Recall: 0.0952
2026-05-19 20:57:26,010 - optuna.study.study - INFO - Trial 138 finished with value: 0.09520066542518371 and parameters: {'n_layers': 1, 'embedding_dim': 256, 'lr': 0.0009704082655029117, 'lambda_val': 4.304961969684075e-06, 'batch_size': 2835, 'optimizer': 'Adam'}. Best is trial 131 with value: 0.10171978570136395.
2026-05-19 20:57:32,467 - optuna.study._optimize - INFO - Trial 139 pruned. 
2026-05-19 20:57:58,751 - experiment_functions - INFO - Early stopping at epoch 1900. Best Recall: 0.0974
2026-05-19 20:57:58,860 - optuna.study.study - INFO - Trial 140 finished with value: 0.09744123080796314 and parameters: {'n_layers': 1, 'embedding_dim': 256, 'lr': 0.0010474487543043823, 'lambda_val': 1.4709054192921254e-06, 'batch_size': 2829, 'optimizer': 'Adam'}. Best is trial 131 with value: 0.10171978570136395.
2026-05-19 20:58:13,018 - experiment_functions - INFO - Early stopping at epoch 1950. Best Recall: 0.1010
2026-05-19 20:58:13,109 - optuna.study.study - INFO - Trial 141 finished with value: 0.10098755245388777 and parameters: {'n_layers': 1, 'embedding_dim': 256, 'lr': 0.0010450952907296827, 'lambda_val': 2.23600344169962e-06, 'batch_size': 2834, 'optimizer': 'Adam'}. Best is trial 131 with value: 0.10171978570136395.
2026-05-19 20:58:22,103 - optuna.study._optimize - INFO - Trial 142 pruned. 
2026-05-19 20:58:35,115 - experiment_functions - INFO - Early stopping at epoch 1650. Best Recall: 0.0976
2026-05-19 20:58:35,240 - optuna.study.study - INFO - Trial 143 finished with value: 0.09760785996490368 and parameters: {'n_layers': 1, 'embedding_dim': 256, 'lr': 0.00108537879805141, 'lambda_val': 1.2539410887952152e-06, 'batch_size': 3051, 'optimizer': 'Adam'}. Best is trial 131 with value: 0.10171978570136395.
2026-05-19 20:58:48,546 - experiment_functions - INFO - Early stopping at epoch 1950. Best Recall: 0.0968
2026-05-19 20:58:48,657 - optuna.study.study - INFO - Trial 144 finished with value: 0.09682899353832401 and parameters: {'n_layers': 1, 'embedding_dim': 256, 'lr': 0.001073839323874585, 'lambda_val': 1.3706218933970553e-06, 'batch_size': 3251, 'optimizer': 'Adam'}. Best is trial 131 with value: 0.10171978570136395.
2026-05-19 20:58:56,221 - optuna.study._optimize - INFO - Trial 145 pruned. 
2026-05-19 20:59:05,895 - optuna.study._optimize - INFO - Trial 146 pruned. 
2026-05-19 20:59:13,824 - optuna.study._optimize - INFO - Trial 147 pruned. 
2026-05-19 20:59:23,945 - experiment_functions - INFO - Early stopping at epoch 1150. Best Recall: 0.0966
2026-05-19 20:59:24,044 - optuna.study.study - INFO - Trial 148 finished with value: 0.09655515322061062 and parameters: {'n_layers': 1, 'embedding_dim': 256, 'lr': 0.0013842279653524512, 'lambda_val': 2.0007457875809764e-06, 'batch_size': 3146, 'optimizer': 'Adam'}. Best is trial 131 with value: 0.10171978570136395.
2026-05-19 20:59:36,739 - optuna.study._optimize - INFO - Trial 149 pruned. 
2026-05-19 20:59:46,035 - experiment_functions - INFO - Early stopping at epoch 1400. Best Recall: 0.0995
2026-05-19 20:59:46,125 - optuna.study.study - INFO - Trial 150 finished with value: 0.09946746618935214 and parameters: {'n_layers': 1, 'embedding_dim': 256, 'lr': 0.0007390231116954907, 'lambda_val': 2.0386083373646434e-06, 'batch_size': 3216, 'optimizer': 'Adam'}. Best is trial 131 with value: 0.10171978570136395.
2026-05-19 20:59:57,771 - optuna.study._optimize - INFO - Trial 151 pruned. 
2026-05-19 21:00:04,962 - optuna.study._optimize - INFO - Trial 152 pruned. 
2026-05-19 21:00:14,812 - optuna.study._optimize - INFO - Trial 153 pruned. 
2026-05-19 21:00:33,533 - optuna.study._optimize - INFO - Trial 154 pruned. 
2026-05-19 21:00:46,327 - experiment_functions - INFO - Early stopping at epoch 1850. Best Recall: 0.0960
2026-05-19 21:00:46,416 - optuna.study.study - INFO - Trial 155 finished with value: 0.09599674024120743 and parameters: {'n_layers': 1, 'embedding_dim': 256, 'lr': 0.0013128760328720613, 'lambda_val': 3.24862824024475e-06, 'batch_size': 2780, 'optimizer': 'Adam'}. Best is trial 131 with value: 0.10171978570136395.
2026-05-19 21:00:53,697 - optuna.study._optimize - INFO - Trial 156 pruned. 
2026-05-19 21:01:03,786 - optuna.study._optimize - INFO - Trial 157 pruned. 
2026-05-19 21:01:26,648 - experiment_functions - INFO - Early stopping at epoch 2150. Best Recall: 0.1015
2026-05-19 21:01:26,786 - optuna.study.study - INFO - Trial 158 finished with value: 0.10145459672209475 and parameters: {'n_layers': 1, 'embedding_dim': 256, 'lr': 0.0009824914065785144, 'lambda_val': 2.3071274675017113e-06, 'batch_size': 2997, 'optimizer': 'Adam'}. Best is trial 131 with value: 0.10171978570136395.
2026-05-19 21:01:32,239 - experiment_functions - INFO - Early stopping at epoch 700. Best Recall: 0.0236
2026-05-19 21:01:32,317 - optuna.study.study - INFO - Trial 159 finished with value: 0.023599729152674612 and parameters: {'n_layers': 4, 'embedding_dim': 32, 'lr': 0.001000412649940007, 'lambda_val': 2.584782938932056e-06, 'batch_size': 3001, 'optimizer': 'Adam'}. Best is trial 131 with value: 0.10171978570136395.
2026-05-19 21:01:36,056 - experiment_functions - INFO - Early stopping at epoch 500. Best Recall: 0.0017
2026-05-19 21:01:36,190 - optuna.study.study - INFO - Trial 160 finished with value: 0.0016886887364529273 and parameters: {'n_layers': 1, 'embedding_dim': 256, 'lr': 0.0008131934873601298, 'lambda_val': 3.391763347556369e-06, 'batch_size': 2908, 'optimizer': 'SGD'}. Best is trial 131 with value: 0.10171978570136395.
2026-05-19 21:01:45,384 - optuna.study._optimize - INFO - Trial 161 pruned. 
2026-05-19 21:01:54,629 - optuna.study._optimize - INFO - Trial 162 pruned. 
2026-05-19 21:02:12,075 - optuna.study._optimize - INFO - Trial 163 pruned. 
2026-05-19 21:02:28,162 - experiment_functions - INFO - Early stopping at epoch 1900. Best Recall: 0.1049
2026-05-19 21:02:28,272 - optuna.study.study - INFO - Trial 164 finished with value: 0.10487131574525042 and parameters: {'n_layers': 1, 'embedding_dim': 256, 'lr': 0.0007170894564123548, 'lambda_val': 2.2590333481493642e-06, 'batch_size': 3290, 'optimizer': 'Adam'}. Best is trial 164 with value: 0.10487131574525042.
2026-05-19 21:02:35,681 - optuna.study._optimize - INFO - Trial 165 pruned. 
2026-05-19 21:02:42,666 - optuna.study._optimize - INFO - Trial 166 pruned. 
2026-05-19 21:02:49,607 - optuna.study._optimize - INFO - Trial 167 pruned. 
2026-05-19 21:03:10,735 - experiment_functions - INFO - Early stopping at epoch 1750. Best Recall: 0.0981
2026-05-19 21:03:10,836 - optuna.study.study - INFO - Trial 168 finished with value: 0.09808909217020657 and parameters: {'n_layers': 1, 'embedding_dim': 256, 'lr': 0.0008226281207403369, 'lambda_val': 1.4574447994709795e-06, 'batch_size': 2842, 'optimizer': 'Adam'}. Best is trial 164 with value: 0.10487131574525042.
2026-05-19 21:03:23,645 - optuna.study._optimize - INFO - Trial 169 pruned. 
2026-05-19 21:03:35,601 - experiment_functions - INFO - Early stopping at epoch 1750. Best Recall: 0.0952
2026-05-19 21:03:35,745 - optuna.study.study - INFO - Trial 170 finished with value: 0.09519621481816587 and parameters: {'n_layers': 1, 'embedding_dim': 256, 'lr': 0.0006246674639996194, 'lambda_val': 1.0640497321609766e-06, 'batch_size': 2770, 'optimizer': 'Adam'}. Best is trial 164 with value: 0.10487131574525042.
2026-05-19 21:03:46,258 - optuna.study._optimize - INFO - Trial 171 pruned. 
2026-05-19 21:03:54,311 - experiment_functions - INFO - Early stopping at epoch 1300. Best Recall: 0.0999
2026-05-19 21:03:54,424 - optuna.study.study - INFO - Trial 172 finished with value: 0.09989025124845059 and parameters: {'n_layers': 1, 'embedding_dim': 256, 'lr': 0.0010652608596082697, 'lambda_val': 1.4286116174164466e-06, 'batch_size': 3000, 'optimizer': 'Adam'}. Best is trial 164 with value: 0.10487131574525042.
2026-05-19 21:04:02,247 - optuna.study._optimize - INFO - Trial 173 pruned. 
2026-05-19 21:04:08,461 - optuna.study._optimize - INFO - Trial 174 pruned. 
2026-05-19 21:04:16,940 - optuna.study._optimize - INFO - Trial 175 pruned. 
2026-05-19 21:04:36,996 - optuna.study._optimize - INFO - Trial 176 pruned. 
2026-05-19 21:04:43,995 - optuna.study._optimize - INFO - Trial 177 pruned. 
2026-05-19 21:04:57,122 - experiment_functions - INFO - Early stopping at epoch 2000. Best Recall: 0.0999
2026-05-19 21:04:57,223 - optuna.study.study - INFO - Trial 178 finished with value: 0.09989576254603087 and parameters: {'n_layers': 1, 'embedding_dim': 256, 'lr': 0.0008517226260763091, 'lambda_val': 7.084536147613783e-06, 'batch_size': 3226, 'optimizer': 'Adam'}. Best is trial 164 with value: 0.10487131574525042.
2026-05-19 21:05:09,592 - optuna.study._optimize - INFO - Trial 179 pruned. 
2026-05-19 21:05:20,544 - experiment_functions - INFO - Early stopping at epoch 1100. Best Recall: 0.1039
2026-05-19 21:05:20,633 - optuna.study.study - INFO - Trial 180 finished with value: 0.10385787992182241 and parameters: {'n_layers': 1, 'embedding_dim': 256, 'lr': 0.0014977374407090331, 'lambda_val': 5.097253098464623e-06, 'batch_size': 3185, 'optimizer': 'Adam'}. Best is trial 164 with value: 0.10487131574525042.
2026-05-19 21:05:27,589 - optuna.study._optimize - INFO - Trial 181 pruned. 
2026-05-19 21:05:34,354 - optuna.study._optimize - INFO - Trial 182 pruned. 
2026-05-19 21:05:43,125 - optuna.study._optimize - INFO - Trial 183 pruned. 
2026-05-19 21:05:51,840 - optuna.study._optimize - INFO - Trial 184 pruned. 
2026-05-19 21:05:59,595 - optuna.study._optimize - INFO - Trial 185 pruned. 
2026-05-19 21:06:07,962 - optuna.study._optimize - INFO - Trial 186 pruned. 
2026-05-19 21:06:14,733 - optuna.study._optimize - INFO - Trial 187 pruned. 
2026-05-19 21:06:22,079 - optuna.study._optimize - INFO - Trial 188 pruned. 
2026-05-19 21:06:28,256 - experiment_functions - INFO - Early stopping at epoch 500. Best Recall: 0.0016
2026-05-19 21:06:28,354 - optuna.study.study - INFO - Trial 189 finished with value: 0.0015794679605141632 and parameters: {'n_layers': 1, 'embedding_dim': 256, 'lr': 0.0012460491220285866, 'lambda_val': 2.361992055252308e-06, 'batch_size': 3014, 'optimizer': 'SGD'}. Best is trial 164 with value: 0.10487131574525042.
2026-05-19 21:06:32,179 - experiment_functions - INFO - Early stopping at epoch 550. Best Recall: 0.0367
2026-05-19 21:06:32,270 - optuna.study.study - INFO - Trial 190 finished with value: 0.0367463228661873 and parameters: {'n_layers': 1, 'embedding_dim': 32, 'lr': 0.014577452080100452, 'lambda_val': 5.126987874490199e-06, 'batch_size': 2750, 'optimizer': 'Adam'}. Best is trial 164 with value: 0.10487131574525042.
2026-05-19 21:06:45,042 - experiment_functions - INFO - Early stopping at epoch 1950. Best Recall: 0.0999
2026-05-19 21:06:45,132 - optuna.study.study - INFO - Trial 191 finished with value: 0.09985700414233557 and parameters: {'n_layers': 1, 'embedding_dim': 256, 'lr': 0.0009891628134464877, 'lambda_val': 1.357700915130587e-06, 'batch_size': 3304, 'optimizer': 'Adam'}. Best is trial 164 with value: 0.10487131574525042.
2026-05-19 21:06:53,530 - optuna.study._optimize - INFO - Trial 192 pruned. 
2026-05-19 21:07:00,763 - experiment_functions - INFO - Early stopping at epoch 1000. Best Recall: 0.0950
2026-05-19 21:07:00,904 - optuna.study.study - INFO - Trial 193 finished with value: 0.09496692236920996 and parameters: {'n_layers': 1, 'embedding_dim': 256, 'lr': 0.0014503341651909835, 'lambda_val': 2.9209701532552217e-06, 'batch_size': 3285, 'optimizer': 'Adam'}. Best is trial 164 with value: 0.10487131574525042.
2026-05-19 21:07:08,298 - optuna.study._optimize - INFO - Trial 194 pruned. 
2026-05-19 21:07:16,532 - optuna.study._optimize - INFO - Trial 195 pruned. 
2026-05-19 21:07:23,861 - optuna.study._optimize - INFO - Trial 196 pruned. 
2026-05-19 21:07:34,096 - optuna.study._optimize - INFO - Trial 197 pruned. 
2026-05-19 21:07:44,741 - optuna.study._optimize - INFO - Trial 198 pruned. 
2026-05-19 21:07:53,301 - optuna.study._optimize - INFO - Trial 199 pruned. 
2026-05-19 21:07:59,325 - optuna.study._optimize - INFO - Trial 200 pruned. 
2026-05-19 21:08:07,946 - optuna.study._optimize - INFO - Trial 201 pruned. 
2026-05-19 21:08:28,496 - experiment_functions - INFO - Early stopping at epoch 1800. Best Recall: 0.0950
2026-05-19 21:08:28,586 - optuna.study.study - INFO - Trial 202 finished with value: 0.09502657994317676 and parameters: {'n_layers': 1, 'embedding_dim': 256, 'lr': 0.0008139212157166934, 'lambda_val': 1.393036353877167e-06, 'batch_size': 3256, 'optimizer': 'Adam'}. Best is trial 164 with value: 0.10487131574525042.
2026-05-19 21:08:37,036 - experiment_functions - INFO - Early stopping at epoch 1150. Best Recall: 0.0980
2026-05-19 21:08:37,135 - optuna.study.study - INFO - Trial 203 finished with value: 0.09796385009666457 and parameters: {'n_layers': 1, 'embedding_dim': 256, 'lr': 0.0010949778306405154, 'lambda_val': 1.0219689198162993e-06, 'batch_size': 3347, 'optimizer': 'Adam'}. Best is trial 164 with value: 0.10487131574525042.
2026-05-19 21:08:45,600 - optuna.study._optimize - INFO - Trial 204 pruned. 
2026-05-19 21:08:56,772 - optuna.study._optimize - INFO - Trial 205 pruned. 
2026-05-19 21:09:05,048 - experiment_functions - INFO - Early stopping at epoch 1250. Best Recall: 0.1015
2026-05-19 21:09:05,137 - optuna.study.study - INFO - Trial 206 finished with value: 0.10152984316704773 and parameters: {'n_layers': 1, 'embedding_dim': 256, 'lr': 0.0010550402900931966, 'lambda_val': 1.763008683963378e-06, 'batch_size': 3353, 'optimizer': 'Adam'}. Best is trial 164 with value: 0.10487131574525042.
2026-05-19 21:09:17,768 - optuna.study._optimize - INFO - Trial 207 pruned. 
2026-05-19 21:09:24,748 - optuna.study._optimize - INFO - Trial 208 pruned. 
2026-05-19 21:09:30,232 - experiment_functions - INFO - Early stopping at epoch 600. Best Recall: 0.0359
2026-05-19 21:09:30,333 - optuna.study.study - INFO - Trial 209 finished with value: 0.03590077876407644 and parameters: {'n_layers': 3, 'embedding_dim': 256, 'lr': 0.0007852287731266789, 'lambda_val': 2.904960185826443e-06, 'batch_size': 3326, 'optimizer': 'Adam'}. Best is trial 164 with value: 0.10487131574525042.
2026-05-19 21:09:35,368 - experiment_functions - INFO - Early stopping at epoch 600. Best Recall: 0.0518
2026-05-19 21:09:35,472 - optuna.study.study - INFO - Trial 210 finished with value: 0.05181321801649186 and parameters: {'n_layers': 2, 'embedding_dim': 256, 'lr': 0.001646188513135945, 'lambda_val': 8.797213776075386e-06, 'batch_size': 3589, 'optimizer': 'Adam'}. Best is trial 164 with value: 0.10487131574525042.
2026-05-19 21:09:43,162 - optuna.study._optimize - INFO - Trial 211 pruned. 
2026-05-19 21:09:49,991 - optuna.study._optimize - INFO - Trial 212 pruned. 
2026-05-19 21:09:59,009 - optuna.study._optimize - INFO - Trial 213 pruned. 
2026-05-19 21:10:07,636 - optuna.study._optimize - INFO - Trial 214 pruned. 
2026-05-19 21:10:22,838 - experiment_functions - INFO - Early stopping at epoch 2350. Best Recall: 0.0976
2026-05-19 21:10:22,943 - optuna.study.study - INFO - Trial 215 finished with value: 0.0975997577834401 and parameters: {'n_layers': 1, 'embedding_dim': 256, 'lr': 0.0009465651533719789, 'lambda_val': 1.26098102427332e-06, 'batch_size': 2580, 'optimizer': 'Adam'}. Best is trial 164 with value: 0.10487131574525042.
2026-05-19 21:10:41,467 - optuna.study._optimize - INFO - Trial 216 pruned. 
2026-05-19 21:10:53,357 - experiment_functions - INFO - Early stopping at epoch 1350. Best Recall: 0.0949
2026-05-19 21:10:53,484 - optuna.study.study - INFO - Trial 217 finished with value: 0.09485866413407444 and parameters: {'n_layers': 1, 'embedding_dim': 256, 'lr': 0.0012480432770909879, 'lambda_val': 1.1228456361681899e-05, 'batch_size': 2644, 'optimizer': 'Adam'}. Best is trial 164 with value: 0.10487131574525042.
2026-05-19 21:11:01,852 - optuna.study._optimize - INFO - Trial 218 pruned. 
2026-05-19 21:11:11,950 - optuna.study._optimize - INFO - Trial 219 pruned. 
2026-05-19 21:11:22,282 - experiment_functions - INFO - Early stopping at epoch 1450. Best Recall: 0.1000
2026-05-19 21:11:22,408 - optuna.study.study - INFO - Trial 220 finished with value: 0.10003509607435207 and parameters: {'n_layers': 1, 'embedding_dim': 256, 'lr': 0.0009543908263862745, 'lambda_val': 1.5328223331939452e-05, 'batch_size': 3162, 'optimizer': 'Adam'}. Best is trial 164 with value: 0.10487131574525042.
2026-05-19 21:11:30,811 - optuna.study._optimize - INFO - Trial 221 pruned. 
2026-05-19 21:11:38,411 - optuna.study._optimize - INFO - Trial 222 pruned. 
2026-05-19 21:11:46,945 - optuna.study._optimize - INFO - Trial 223 pruned. 
2026-05-19 21:11:54,325 - optuna.study._optimize - INFO - Trial 224 pruned. 
2026-05-19 21:12:04,999 - experiment_functions - INFO - Early stopping at epoch 1350. Best Recall: 0.0973
2026-05-19 21:12:05,104 - optuna.study.study - INFO - Trial 225 finished with value: 0.09728788765469515 and parameters: {'n_layers': 1, 'embedding_dim': 256, 'lr': 0.0012210449693667651, 'lambda_val': 4.528924866593028e-06, 'batch_size': 3296, 'optimizer': 'Adam'}. Best is trial 164 with value: 0.10487131574525042.
2026-05-19 21:12:09,567 - experiment_functions - INFO - Early stopping at epoch 500. Best Recall: 0.0044
2026-05-19 21:12:09,683 - optuna.study.study - INFO - Trial 226 finished with value: 0.004444226633161728 and parameters: {'n_layers': 1, 'embedding_dim': 256, 'lr': 0.0009524224523224238, 'lambda_val': 9.189943402629433e-06, 'batch_size': 3032, 'optimizer': 'SGD'}. Best is trial 164 with value: 0.10487131574525042.
