2026-05-19 19:54:03,887 - optuna.study.study - INFO - Trial 244 finished with value: 0.0017973946565880943 and parameters: {'n_layers': 1, 'embedding_dim': 256, 'lr': 2.5556581152360407e-05, 'lambda_val': 2.153910329530634e-05, 'batch_size': 1167, 'optimizer': 'Adam'}. Best is trial 237 with value: 0.09697381615822427.
2026-05-19 19:54:17,139 - optuna.study._optimize - INFO - Trial 245 pruned. 
2026-05-19 19:54:23,011 - optuna.study._optimize - INFO - Trial 246 pruned. 
2026-05-19 19:54:31,915 - experiment_functions - INFO - Early stopping at epoch 1250. Best Recall: 0.0883
2026-05-19 19:54:31,992 - optuna.study.study - INFO - Trial 247 finished with value: 0.08831368700478764 and parameters: {'n_layers': 1, 'embedding_dim': 256, 'lr': 0.0009499455382879603, 'lambda_val': 3.526168469868717e-05, 'batch_size': 3843, 'optimizer': 'Adam'}. Best is trial 237 with value: 0.09697381615822427.
2026-05-19 19:54:38,644 - optuna.study._optimize - INFO - Trial 248 pruned. 
2026-05-19 19:54:53,748 - experiment_functions - INFO - Early stopping at epoch 2450. Best Recall: 0.0924
2026-05-19 19:54:53,841 - optuna.study.study - INFO - Trial 249 finished with value: 0.0924161418700165 and parameters: {'n_layers': 1, 'embedding_dim': 256, 'lr': 0.0011235854753257942, 'lambda_val': 1.5064296000318369e-05, 'batch_size': 1212, 'optimizer': 'Adam'}. Best is trial 237 with value: 0.09697381615822427.
2026-05-19 19:55:00,324 - optuna.study._optimize - INFO - Trial 250 pruned. 
2026-05-19 19:55:11,440 - experiment_functions - INFO - Early stopping at epoch 1700. Best Recall: 0.0937
2026-05-19 19:55:11,543 - optuna.study.study - INFO - Trial 251 finished with value: 0.09370824232948623 and parameters: {'n_layers': 1, 'embedding_dim': 256, 'lr': 0.0011377404425040349, 'lambda_val': 9.3477992034644e-06, 'batch_size': 1197, 'optimizer': 'Adam'}. Best is trial 237 with value: 0.09697381615822427.
2026-05-19 19:55:18,237 - optuna.study._optimize - INFO - Trial 252 pruned. 
2026-05-19 19:55:23,942 - experiment_functions - INFO - Early stopping at epoch 850. Best Recall: 0.0831
2026-05-19 19:55:24,023 - optuna.study.study - INFO - Trial 253 finished with value: 0.08310897129129553 and parameters: {'n_layers': 1, 'embedding_dim': 256, 'lr': 0.001250915208624586, 'lambda_val': 9.64475119016957e-06, 'batch_size': 1243, 'optimizer': 'Adam'}. Best is trial 237 with value: 0.09697381615822427.
2026-05-19 19:55:34,313 - experiment_functions - INFO - Early stopping at epoch 1500. Best Recall: 0.0923
2026-05-19 19:55:34,418 - optuna.study.study - INFO - Trial 254 finished with value: 0.09233390438160721 and parameters: {'n_layers': 1, 'embedding_dim': 256, 'lr': 0.0015100153257714673, 'lambda_val': 2.1668634422896975e-05, 'batch_size': 1069, 'optimizer': 'Adam'}. Best is trial 237 with value: 0.09697381615822427.
2026-05-19 19:55:41,664 - optuna.study._optimize - INFO - Trial 255 pruned. 
2026-05-19 19:55:46,702 - experiment_functions - INFO - Early stopping at epoch 650. Best Recall: 0.0690
2026-05-19 19:55:46,795 - optuna.study.study - INFO - Trial 256 finished with value: 0.06903534417961167 and parameters: {'n_layers': 1, 'embedding_dim': 256, 'lr': 0.0018239755629104834, 'lambda_val': 3.0161828875220194e-05, 'batch_size': 1160, 'optimizer': 'Adam'}. Best is trial 237 with value: 0.09697381615822427.
2026-05-19 19:55:53,323 - optuna.study._optimize - INFO - Trial 257 pruned. 
2026-05-19 19:56:08,876 - optuna.study._optimize - INFO - Trial 258 pruned. 
2026-05-19 19:56:15,929 - optuna.study._optimize - INFO - Trial 259 pruned. 
2026-05-19 19:56:22,696 - experiment_functions - INFO - Early stopping at epoch 600. Best Recall: 0.0232
2026-05-19 19:56:22,809 - optuna.study.study - INFO - Trial 260 finished with value: 0.02323136272929423 and parameters: {'n_layers': 4, 'embedding_dim': 256, 'lr': 0.0014428043669459344, 'lambda_val': 2.583114314390417e-05, 'batch_size': 1203, 'optimizer': 'Adam'}. Best is trial 237 with value: 0.09697381615822427.
2026-05-19 19:56:30,339 - optuna.study._optimize - INFO - Trial 261 pruned. 
2026-05-19 19:56:36,190 - experiment_functions - INFO - Early stopping at epoch 500. Best Recall: 0.0017
2026-05-19 19:56:36,285 - optuna.study.study - INFO - Trial 262 finished with value: 0.0017182884203980982 and parameters: {'n_layers': 1, 'embedding_dim': 96, 'lr': 0.0017832199077780192, 'lambda_val': 1.4475515612392119e-05, 'batch_size': 943, 'optimizer': 'SGD'}. Best is trial 237 with value: 0.09697381615822427.
2026-05-19 19:56:43,095 - optuna.study._optimize - INFO - Trial 263 pruned. 
2026-05-19 19:56:49,790 - optuna.study._optimize - INFO - Trial 264 pruned. 
2026-05-19 19:57:07,343 - experiment_functions - INFO - Early stopping at epoch 950. Best Recall: 0.0568
2026-05-19 19:57:07,467 - optuna.study.study - INFO - Trial 265 finished with value: 0.05682310815671525 and parameters: {'n_layers': 1, 'embedding_dim': 256, 'lr': 0.0016078993847343512, 'lambda_val': 0.004311271440438912, 'batch_size': 3501, 'optimizer': 'Adam'}. Best is trial 237 with value: 0.09697381615822427.
2026-05-19 19:57:14,365 - optuna.study._optimize - INFO - Trial 266 pruned. 
2026-05-19 19:57:21,358 - optuna.study._optimize - INFO - Trial 267 pruned. 
2026-05-19 19:57:24,707 - experiment_functions - INFO - Early stopping at epoch 500. Best Recall: 0.0021
2026-05-19 19:57:24,799 - optuna.study.study - INFO - Trial 268 finished with value: 0.0021195296265249753 and parameters: {'n_layers': 1, 'embedding_dim': 64, 'lr': 5.029037164358051e-05, 'lambda_val': 4.3547224412029854e-05, 'batch_size': 1325, 'optimizer': 'Adam'}. Best is trial 237 with value: 0.09697381615822427.
2026-05-19 19:57:39,593 - experiment_functions - INFO - Early stopping at epoch 2100. Best Recall: 0.0975
2026-05-19 19:57:39,702 - optuna.study.study - INFO - Trial 269 finished with value: 0.09752418567081454 and parameters: {'n_layers': 1, 'embedding_dim': 256, 'lr': 0.0008698526161511226, 'lambda_val': 3.1245372325829466e-05, 'batch_size': 2933, 'optimizer': 'Adam'}. Best is trial 269 with value: 0.09752418567081454.
2026-05-19 19:57:50,223 - optuna.study._optimize - INFO - Trial 270 pruned. 
2026-05-19 19:57:57,314 - optuna.study._optimize - INFO - Trial 271 pruned. 
2026-05-19 19:58:04,948 - optuna.study._optimize - INFO - Trial 272 pruned. 
2026-05-19 19:58:23,258 - optuna.study._optimize - INFO - Trial 273 pruned. 
2026-05-19 19:58:30,247 - optuna.study._optimize - INFO - Trial 274 pruned. 
2026-05-19 19:58:38,271 - optuna.study._optimize - INFO - Trial 275 pruned. 
2026-05-19 19:58:48,054 - experiment_functions - INFO - Early stopping at epoch 1400. Best Recall: 0.0887
2026-05-19 19:58:48,169 - optuna.study.study - INFO - Trial 276 finished with value: 0.08871139519965317 and parameters: {'n_layers': 1, 'embedding_dim': 256, 'lr': 0.0008095560214964189, 'lambda_val': 2.295926663199389e-05, 'batch_size': 3000, 'optimizer': 'Adam'}. Best is trial 269 with value: 0.09752418567081454.
2026-05-19 19:58:57,571 - optuna.study._optimize - INFO - Trial 277 pruned. 
2026-05-19 19:59:03,496 - experiment_functions - INFO - Early stopping at epoch 950. Best Recall: 0.0459
2026-05-19 19:59:03,589 - optuna.study.study - INFO - Trial 278 finished with value: 0.045867737391442946 and parameters: {'n_layers': 2, 'embedding_dim': 32, 'lr': 0.001027679135079172, 'lambda_val': 4.291703458539574e-05, 'batch_size': 1193, 'optimizer': 'Adam'}. Best is trial 269 with value: 0.09752418567081454.
2026-05-19 19:59:10,156 - experiment_functions - INFO - Early stopping at epoch 900. Best Recall: 0.0857
2026-05-19 19:59:10,260 - optuna.study.study - INFO - Trial 279 finished with value: 0.0857230588673346 and parameters: {'n_layers': 1, 'embedding_dim': 256, 'lr': 0.002721653810288714, 'lambda_val': 1.8320364757231083e-05, 'batch_size': 2970, 'optimizer': 'Adam'}. Best is trial 269 with value: 0.09752418567081454.
2026-05-19 19:59:17,848 - optuna.study._optimize - INFO - Trial 280 pruned. 
2026-05-19 19:59:25,871 - optuna.study._optimize - INFO - Trial 281 pruned. 
2026-05-19 19:59:41,144 - optuna.study._optimize - INFO - Trial 282 pruned. 
2026-05-19 19:59:45,072 - experiment_functions - INFO - Early stopping at epoch 500. Best Recall: 0.0039
2026-05-19 19:59:45,177 - optuna.study.study - INFO - Trial 283 finished with value: 0.003851208219547777 and parameters: {'n_layers': 1, 'embedding_dim': 128, 'lr': 0.0009317734133327726, 'lambda_val': 2.395803474599522e-05, 'batch_size': 3432, 'optimizer': 'SGD'}. Best is trial 269 with value: 0.09752418567081454.
2026-05-19 19:59:52,978 - optuna.study._optimize - INFO - Trial 284 pruned. 
2026-05-19 20:00:01,739 - optuna.study._optimize - INFO - Trial 285 pruned. 
2026-05-19 20:00:12,474 - experiment_functions - INFO - Early stopping at epoch 700. Best Recall: 0.0544
2026-05-19 20:00:13,240 - optuna.study.study - INFO - Trial 286 finished with value: 0.05440489616809368 and parameters: {'n_layers': 1, 'embedding_dim': 256, 'lr': 0.0011129011129683082, 'lambda_val': 0.019865239876064665, 'batch_size': 2753, 'optimizer': 'Adam'}. Best is trial 269 with value: 0.09752418567081454.
2026-05-19 20:00:24,853 - optuna.study._optimize - INFO - Trial 287 pruned. 
2026-05-19 20:00:38,144 - experiment_functions - INFO - Early stopping at epoch 2000. Best Recall: 0.0956
2026-05-19 20:00:38,293 - optuna.study.study - INFO - Trial 288 finished with value: 0.09561785772056612 and parameters: {'n_layers': 1, 'embedding_dim': 256, 'lr': 0.0014134071640770748, 'lambda_val': 1.610629168630318e-05, 'batch_size': 3156, 'optimizer': 'Adam'}. Best is trial 269 with value: 0.09752418567081454.
2026-05-19 20:00:47,562 - optuna.study._optimize - INFO - Trial 289 pruned. 
2026-05-19 20:00:54,571 - optuna.study._optimize - INFO - Trial 290 pruned. 
2026-05-19 20:01:02,710 - optuna.study._optimize - INFO - Trial 291 pruned. 
2026-05-19 20:01:19,763 - optuna.study._optimize - INFO - Trial 292 pruned. 
2026-05-19 20:01:26,960 - optuna.study._optimize - INFO - Trial 293 pruned. 
2026-05-19 20:01:35,113 - experiment_functions - INFO - Early stopping at epoch 1050. Best Recall: 0.0877
2026-05-19 20:01:35,207 - optuna.study.study - INFO - Trial 294 finished with value: 0.08768619204126067 and parameters: {'n_layers': 1, 'embedding_dim': 256, 'lr': 0.0014038782460143175, 'lambda_val': 1.021125349828212e-05, 'batch_size': 3109, 'optimizer': 'Adam'}. Best is trial 269 with value: 0.09752418567081454.
2026-05-19 20:01:42,048 - optuna.study._optimize - INFO - Trial 295 pruned. 
2026-05-19 20:01:48,987 - optuna.study._optimize - INFO - Trial 296 pruned. 
2026-05-19 20:01:55,631 - optuna.study._optimize - INFO - Trial 297 pruned. 
2026-05-19 20:02:01,698 - experiment_functions - INFO - Early stopping at epoch 600. Best Recall: 0.0293
2026-05-19 20:02:01,800 - optuna.study.study - INFO - Trial 298 finished with value: 0.0293266020273841 and parameters: {'n_layers': 3, 'embedding_dim': 256, 'lr': 0.001112647081757767, 'lambda_val': 2.117047387126008e-05, 'batch_size': 3076, 'optimizer': 'Adam'}. Best is trial 269 with value: 0.09752418567081454.
2026-05-19 20:02:14,658 - experiment_functions - INFO - Early stopping at epoch 1850. Best Recall: 0.0921
2026-05-19 20:02:14,751 - optuna.study.study - INFO - Trial 299 finished with value: 0.09205859538085186 and parameters: {'n_layers': 1, 'embedding_dim': 256, 'lr': 0.00142268177165766, 'lambda_val': 6.012782068181427e-05, 'batch_size': 1442, 'optimizer': 'Adam'}. Best is trial 269 with value: 0.09752418567081454.
2026-05-19 20:02:14,753 - experiment_functions - INFO - Training the best model ... for e_100K_1c2dcs
2026-05-19 20:02:22,164 - experiment_functions - INFO - Early stopping at epoch 1900. Best Recall: 0.0934
2026-05-19 20:02:22,274 - root - INFO -   **** Training e_100K_1c2dcs_rand1
2026-05-19 20:02:22,288 - root - INFO -   **** Getting 67885/81200 random edges
2026-05-19 20:02:22,301 - experiment_functions - INFO - Training the best model ... for e_100K_1c2dcs_rand1
2026-05-19 20:02:26,411 - experiment_functions - INFO - Early stopping at epoch 1050. Best Recall: 0.1124
2026-05-19 20:02:26,518 - root - INFO -   **** Training e_100K_1c2dcs_rand2
2026-05-19 20:02:26,531 - root - INFO -   **** Getting 67885/81200 random edges
2026-05-19 20:02:26,545 - experiment_functions - INFO - Training the best model ... for e_100K_1c2dcs_rand2
2026-05-19 20:02:30,078 - experiment_functions - INFO - Early stopping at epoch 800. Best Recall: 0.1184
2026-05-19 20:02:30,185 - root - INFO -   **** Training e_100K_1c2dcs_rand3
2026-05-19 20:02:30,200 - root - INFO -   **** Getting 67885/81200 random edges
2026-05-19 20:02:30,214 - experiment_functions - INFO - Training the best model ... for e_100K_1c2dcs_rand3
2026-05-19 20:02:34,359 - experiment_functions - INFO - Early stopping at epoch 950. Best Recall: 0.1074
2026-05-19 20:02:34,465 - root - INFO -   **** Training e_100K_1c2dcs_rand4
2026-05-19 20:02:34,478 - root - INFO -   **** Getting 67885/81200 random edges
2026-05-19 20:02:34,491 - experiment_functions - INFO - Training the best model ... for e_100K_1c2dcs_rand4
2026-05-19 20:02:38,287 - experiment_functions - INFO - Early stopping at epoch 900. Best Recall: 0.1120
2026-05-19 20:02:38,394 - root - INFO -   **** Training e_100K_1c2dcs_rand5
2026-05-19 20:02:38,407 - root - INFO -   **** Getting 67885/81200 random edges
2026-05-19 20:02:38,421 - experiment_functions - INFO - Training the best model ... for e_100K_1c2dcs_rand5
2026-05-19 20:02:41,634 - experiment_functions - INFO - Early stopping at epoch 850. Best Recall: 0.1149
2026-05-19 20:02:41,741 - root - INFO - **** Training e_100K_1c3dcs
2026-05-19 20:02:41,741 - root - INFO -   ** 3-Dominant stats:
2026-05-19 20:02:41,741 - root - INFO -   ** Finding the dominant set:
2026-05-19 20:03:07,820 - root - INFO -   ** Getting the trainable edges:
2026-05-19 20:03:07,825 - helper_functions - INFO -      Number of nodes: 5324
2026-05-19 20:03:07,825 - helper_functions - INFO -      Ratio: 0.515192568221405
2026-05-19 20:03:07,826 - helper_functions - INFO -      Number of unique users: 333
2026-05-19 20:03:07,826 - helper_functions - INFO -      Number of unique items: 4991
2026-05-19 20:03:07,826 - helper_functions - INFO -      Total dominant set edge: 17514
2026-05-19 20:03:07,826 - helper_functions - INFO -      Trainable edges: 14011.2
2026-05-19 20:03:07,830 - root - INFO -   **** Getting 17514 dominant set edges
2026-05-19 20:03:07,941 - optuna.storages._rdb.storage - INFO - A new study created in RDB with name: Study_e_100K_1c3dcs_strict
2026-05-19 20:03:11,537 - experiment_functions - INFO - Early stopping at epoch 500. Best Recall: 0.0018
2026-05-19 20:03:11,636 - optuna.study.study - INFO - Trial 0 finished with value: 0.001811882238466525 and parameters: {'n_layers': 4, 'embedding_dim': 96, 'lr': 0.020333027074593005, 'lambda_val': 8.502635482986122e-05, 'batch_size': 2082, 'optimizer': 'SGD'}. Best is trial 0 with value: 0.001811882238466525.
2026-05-19 20:03:14,922 - experiment_functions - INFO - Early stopping at epoch 500. Best Recall: 0.0023
2026-05-19 20:03:15,018 - optuna.study.study - INFO - Trial 1 finished with value: 0.0022795521257584217 and parameters: {'n_layers': 2, 'embedding_dim': 128, 'lr': 0.019632514874796347, 'lambda_val': 4.533686544929234e-06, 'batch_size': 599, 'optimizer': 'SGD'}. Best is trial 1 with value: 0.0022795521257584217.
2026-05-19 20:03:20,637 - experiment_functions - INFO - Early stopping at epoch 750. Best Recall: 0.0009
2026-05-19 20:03:20,786 - optuna.study.study - INFO - Trial 2 finished with value: 0.0008840598448726495 and parameters: {'n_layers': 4, 'embedding_dim': 256, 'lr': 3.95351533031605e-05, 'lambda_val': 0.019908466182363863, 'batch_size': 3537, 'optimizer': 'RMSprop'}. Best is trial 1 with value: 0.0022795521257584217.
2026-05-19 20:03:24,793 - experiment_functions - INFO - Early stopping at epoch 500. Best Recall: 0.0014
2026-05-19 20:03:24,896 - optuna.study.study - INFO - Trial 3 finished with value: 0.0014391389116039301 and parameters: {'n_layers': 3, 'embedding_dim': 96, 'lr': 0.009663263155355517, 'lambda_val': 0.00035387871821936616, 'batch_size': 694, 'optimizer': 'SGD'}. Best is trial 1 with value: 0.0022795521257584217.
2026-05-19 20:03:44,323 - experiment_functions - INFO - Early stopping at epoch 2000. Best Recall: 0.0226
2026-05-19 20:03:44,445 - optuna.study.study - INFO - Trial 4 finished with value: 0.02259785550193659 and parameters: {'n_layers': 1, 'embedding_dim': 64, 'lr': 0.0002060239677183763, 'lambda_val': 6.781936623798029e-06, 'batch_size': 1957, 'optimizer': 'Adam'}. Best is trial 4 with value: 0.02259785550193659.
2026-05-19 20:03:47,815 - experiment_functions - INFO - Early stopping at epoch 500. Best Recall: 0.0009
2026-05-19 20:03:47,926 - optuna.study.study - INFO - Trial 5 finished with value: 0.000948690307533438 and parameters: {'n_layers': 2, 'embedding_dim': 128, 'lr': 3.856144624245326e-05, 'lambda_val': 0.0021466004709720793, 'batch_size': 1805, 'optimizer': 'Adam'}. Best is trial 4 with value: 0.02259785550193659.
2026-05-19 20:03:52,415 - experiment_functions - INFO - Early stopping at epoch 500. Best Recall: 0.0022
2026-05-19 20:03:52,507 - optuna.study.study - INFO - Trial 6 finished with value: 0.0022084881540678472 and parameters: {'n_layers': 4, 'embedding_dim': 256, 'lr': 3.2050441045440986e-05, 'lambda_val': 3.6545040210784114e-05, 'batch_size': 2234, 'optimizer': 'SGD'}. Best is trial 4 with value: 0.02259785550193659.
2026-05-19 20:04:03,860 - optuna.study._optimize - INFO - Trial 7 pruned. 
2026-05-19 20:04:12,479 - experiment_functions - INFO - Early stopping at epoch 600. Best Recall: 0.0076
2026-05-19 20:04:12,581 - optuna.study.study - INFO - Trial 8 finished with value: 0.0075553525732269975 and parameters: {'n_layers': 4, 'embedding_dim': 128, 'lr': 0.0011941963655081032, 'lambda_val': 1.678536585124475e-05, 'batch_size': 3067, 'optimizer': 'Adam'}. Best is trial 4 with value: 0.02259785550193659.
2026-05-19 20:04:16,306 - experiment_functions - INFO - Early stopping at epoch 500. Best Recall: 0.0010
2026-05-19 20:04:16,447 - optuna.study.study - INFO - Trial 9 finished with value: 0.0009866624087425668 and parameters: {'n_layers': 4, 'embedding_dim': 96, 'lr': 0.013449298962098018, 'lambda_val': 0.01128635248319124, 'batch_size': 856, 'optimizer': 'Adam'}. Best is trial 4 with value: 0.02259785550193659.
2026-05-19 20:04:23,926 - experiment_functions - INFO - Early stopping at epoch 800. Best Recall: 0.0242
2026-05-19 20:04:24,033 - optuna.study.study - INFO - Trial 10 finished with value: 0.024161182445316398 and parameters: {'n_layers': 1, 'embedding_dim': 64, 'lr': 0.0007362917191762137, 'lambda_val': 1.219691954463869e-06, 'batch_size': 1472, 'optimizer': 'Adam'}. Best is trial 10 with value: 0.024161182445316398.
2026-05-19 20:04:28,932 - experiment_functions - INFO - Early stopping at epoch 900. Best Recall: 0.0245
2026-05-19 20:04:29,037 - optuna.study.study - INFO - Trial 11 finished with value: 0.024483273706863127 and parameters: {'n_layers': 1, 'embedding_dim': 64, 'lr': 0.000626163429380789, 'lambda_val': 1.0707795216561783e-06, 'batch_size': 1458, 'optimizer': 'Adam'}. Best is trial 11 with value: 0.024483273706863127.
2026-05-19 20:04:33,062 - experiment_functions - INFO - Early stopping at epoch 650. Best Recall: 0.0199
2026-05-19 20:04:33,153 - optuna.study.study - INFO - Trial 12 finished with value: 0.019891246005201632 and parameters: {'n_layers': 1, 'embedding_dim': 64, 'lr': 0.001569528356528158, 'lambda_val': 1.0028534059084221e-06, 'batch_size': 1382, 'optimizer': 'Adam'}. Best is trial 11 with value: 0.024483273706863127.
2026-05-19 20:04:38,554 - optuna.study._optimize - INFO - Trial 13 pruned. 
2026-05-19 20:04:41,812 - experiment_functions - INFO - Early stopping at epoch 550. Best Recall: 0.0080
2026-05-19 20:04:41,924 - optuna.study.study - INFO - Trial 14 finished with value: 0.00795989348136002 and parameters: {'n_layers': 2, 'embedding_dim': 64, 'lr': 0.0035718360741651637, 'lambda_val': 3.9061948790676006e-06, 'batch_size': 2737, 'optimizer': 'Adam'}. Best is trial 11 with value: 0.024483273706863127.
2026-05-19 20:04:45,488 - experiment_functions - INFO - Early stopping at epoch 650. Best Recall: 0.0043
2026-05-19 20:04:45,569 - optuna.study.study - INFO - Trial 15 finished with value: 0.0042652654244377895 and parameters: {'n_layers': 1, 'embedding_dim': 64, 'lr': 0.000556882568655688, 'lambda_val': 0.08899870531042434, 'batch_size': 1421, 'optimizer': 'RMSprop'}. Best is trial 11 with value: 0.024483273706863127.
2026-05-19 20:04:52,100 - optuna.study._optimize - INFO - Trial 16 pruned. 
2026-05-19 20:04:55,966 - experiment_functions - INFO - Early stopping at epoch 600. Best Recall: 0.0237
2026-05-19 20:04:56,068 - optuna.study.study - INFO - Trial 17 finished with value: 0.02366622058090489 and parameters: {'n_layers': 1, 'embedding_dim': 32, 'lr': 0.003824299520998919, 'lambda_val': 2.2571773456930644e-06, 'batch_size': 1140, 'optimizer': 'Adam'}. Best is trial 11 with value: 0.024483273706863127.
2026-05-19 20:05:01,984 - optuna.study._optimize - INFO - Trial 18 pruned. 
2026-05-19 20:05:08,769 - optuna.study._optimize - INFO - Trial 19 pruned. 
2026-05-19 20:05:12,967 - experiment_functions - INFO - Early stopping at epoch 700. Best Recall: 0.0129
2026-05-19 20:05:13,059 - optuna.study.study - INFO - Trial 20 finished with value: 0.012891473791643054 and parameters: {'n_layers': 2, 'embedding_dim': 64, 'lr': 0.0006551937721715017, 'lambda_val': 0.0013770340795244897, 'batch_size': 996, 'optimizer': 'Adam'}. Best is trial 11 with value: 0.024483273706863127.
2026-05-19 20:05:16,958 - experiment_functions - INFO - Early stopping at epoch 600. Best Recall: 0.0246
