2026-05-19 18:47:24,753 - optuna.study.study - INFO - Trial 2 finished with value: 0.002830857254574474 and parameters: {'n_layers': 3, 'embedding_dim': 96, 'lr': 0.00039902200602861924, 'lambda_val': 0.006963711554688124, 'batch_size': 3711, 'optimizer': 'SGD'}. Best is trial 1 with value: 0.0036738509528393393.
2026-05-19 18:47:33,721 - experiment_functions - INFO - Early stopping at epoch 1150. Best Recall: 0.0052
2026-05-19 18:47:33,812 - optuna.study.study - INFO - Trial 3 finished with value: 0.0052332925660715434 and parameters: {'n_layers': 3, 'embedding_dim': 128, 'lr': 0.00019920605754450633, 'lambda_val': 3.411877804150651e-05, 'batch_size': 2595, 'optimizer': 'Adam'}. Best is trial 3 with value: 0.0052332925660715434.
2026-05-19 18:47:37,395 - experiment_functions - INFO - Early stopping at epoch 500. Best Recall: 0.0022
2026-05-19 18:47:37,486 - optuna.study.study - INFO - Trial 4 finished with value: 0.0022479649415474 and parameters: {'n_layers': 1, 'embedding_dim': 256, 'lr': 0.001151481838883637, 'lambda_val': 0.03254526817825237, 'batch_size': 3169, 'optimizer': 'SGD'}. Best is trial 3 with value: 0.0052332925660715434.
2026-05-19 18:47:41,302 - experiment_functions - INFO - Early stopping at epoch 500. Best Recall: 0.0062
2026-05-19 18:47:41,531 - optuna.study.study - INFO - Trial 5 finished with value: 0.006193508092851913 and parameters: {'n_layers': 2, 'embedding_dim': 128, 'lr': 0.02042182678259743, 'lambda_val': 0.00014231394434844404, 'batch_size': 897, 'optimizer': 'RMSprop'}. Best is trial 5 with value: 0.006193508092851913.
2026-05-19 18:47:46,048 - experiment_functions - INFO - Early stopping at epoch 600. Best Recall: 0.0059
2026-05-19 18:47:46,150 - optuna.study.study - INFO - Trial 6 finished with value: 0.00588832045861247 and parameters: {'n_layers': 2, 'embedding_dim': 64, 'lr': 0.002108742729850943, 'lambda_val': 1.2379189934859866e-06, 'batch_size': 2059, 'optimizer': 'Adam'}. Best is trial 5 with value: 0.006193508092851913.
2026-05-19 18:47:51,738 - experiment_functions - INFO - Early stopping at epoch 750. Best Recall: 0.0030
2026-05-19 18:47:51,828 - optuna.study.study - INFO - Trial 7 finished with value: 0.0029935829476430437 and parameters: {'n_layers': 1, 'embedding_dim': 256, 'lr': 0.02927729449422719, 'lambda_val': 0.016298337597267017, 'batch_size': 2077, 'optimizer': 'RMSprop'}. Best is trial 5 with value: 0.006193508092851913.
2026-05-19 18:47:55,500 - experiment_functions - INFO - Early stopping at epoch 500. Best Recall: 0.0014
2026-05-19 18:47:55,601 - optuna.study.study - INFO - Trial 8 finished with value: 0.0014165022465416279 and parameters: {'n_layers': 2, 'embedding_dim': 128, 'lr': 0.01885350225503505, 'lambda_val': 0.03766536975118571, 'batch_size': 1020, 'optimizer': 'SGD'}. Best is trial 5 with value: 0.006193508092851913.
2026-05-19 18:48:01,284 - experiment_functions - INFO - Early stopping at epoch 800. Best Recall: 0.0104
2026-05-19 18:48:01,927 - optuna.study.study - INFO - Trial 9 finished with value: 0.01036960173916723 and parameters: {'n_layers': 2, 'embedding_dim': 64, 'lr': 0.00044663341444260745, 'lambda_val': 0.02104066612697975, 'batch_size': 805, 'optimizer': 'Adam'}. Best is trial 9 with value: 0.01036960173916723.
2026-05-19 18:48:19,103 - experiment_functions - INFO - Early stopping at epoch 500. Best Recall: 0.0028
2026-05-19 18:48:19,183 - optuna.study.study - INFO - Trial 10 finished with value: 0.0028051550737430617 and parameters: {'n_layers': 4, 'embedding_dim': 32, 'lr': 1.0872935354031374e-05, 'lambda_val': 0.0007888062345875849, 'batch_size': 1489, 'optimizer': 'Adam'}. Best is trial 9 with value: 0.01036960173916723.
2026-05-19 18:48:23,445 - experiment_functions - INFO - Early stopping at epoch 550. Best Recall: 0.0043
2026-05-19 18:48:23,527 - optuna.study.study - INFO - Trial 11 finished with value: 0.004302891351051761 and parameters: {'n_layers': 2, 'embedding_dim': 64, 'lr': 0.004729722686583609, 'lambda_val': 7.220794805231404e-05, 'batch_size': 562, 'optimizer': 'RMSprop'}. Best is trial 9 with value: 0.01036960173916723.
2026-05-19 18:48:30,103 - optuna.study._optimize - INFO - Trial 12 pruned. 
2026-05-19 18:48:34,196 - experiment_functions - INFO - Early stopping at epoch 500. Best Recall: 0.0024
2026-05-19 18:48:34,300 - optuna.study.study - INFO - Trial 13 finished with value: 0.0023643633922677872 and parameters: {'n_layers': 4, 'embedding_dim': 96, 'lr': 0.006467305350639133, 'lambda_val': 5.675022729267758e-06, 'batch_size': 678, 'optimizer': 'RMSprop'}. Best is trial 9 with value: 0.01036960173916723.
2026-05-19 18:48:38,670 - experiment_functions - INFO - Early stopping at epoch 500. Best Recall: 0.0019
2026-05-19 18:48:38,816 - optuna.study.study - INFO - Trial 14 finished with value: 0.0018986859247489705 and parameters: {'n_layers': 2, 'embedding_dim': 64, 'lr': 5.691564864359158e-05, 'lambda_val': 0.00041975460703478815, 'batch_size': 1510, 'optimizer': 'RMSprop'}. Best is trial 9 with value: 0.01036960173916723.
2026-05-19 18:48:42,710 - experiment_functions - INFO - Early stopping at epoch 500. Best Recall: 0.0016
2026-05-19 18:48:42,853 - optuna.study.study - INFO - Trial 15 finished with value: 0.0016233276465662035 and parameters: {'n_layers': 3, 'embedding_dim': 128, 'lr': 0.008140967193338492, 'lambda_val': 9.069969440743819e-06, 'batch_size': 1106, 'optimizer': 'Adam'}. Best is trial 9 with value: 0.01036960173916723.
2026-05-19 18:48:48,168 - experiment_functions - INFO - Early stopping at epoch 800. Best Recall: 0.0127
2026-05-19 18:48:48,314 - optuna.study.study - INFO - Trial 16 finished with value: 0.012740817242083872 and parameters: {'n_layers': 1, 'embedding_dim': 64, 'lr': 0.00048479013153783745, 'lambda_val': 0.0020935867380306853, 'batch_size': 1733, 'optimizer': 'RMSprop'}. Best is trial 16 with value: 0.012740817242083872.
2026-05-19 18:48:54,694 - experiment_functions - INFO - Early stopping at epoch 850. Best Recall: 0.0122
2026-05-19 18:48:54,830 - optuna.study.study - INFO - Trial 17 finished with value: 0.01220011702385215 and parameters: {'n_layers': 1, 'embedding_dim': 64, 'lr': 0.0003606794954338121, 'lambda_val': 0.0020815473760400485, 'batch_size': 1877, 'optimizer': 'Adam'}. Best is trial 16 with value: 0.012740817242083872.
2026-05-19 18:48:57,952 - experiment_functions - INFO - Early stopping at epoch 500. Best Recall: 0.0031
2026-05-19 18:48:58,044 - optuna.study.study - INFO - Trial 18 finished with value: 0.003082845107530034 and parameters: {'n_layers': 1, 'embedding_dim': 64, 'lr': 7.089821417879628e-05, 'lambda_val': 0.00177314265705346, 'batch_size': 1668, 'optimizer': 'RMSprop'}. Best is trial 16 with value: 0.012740817242083872.
2026-05-19 18:49:01,245 - experiment_functions - INFO - Early stopping at epoch 500. Best Recall: 0.0018
2026-05-19 18:49:01,325 - optuna.study.study - INFO - Trial 19 finished with value: 0.001764518747320827 and parameters: {'n_layers': 1, 'embedding_dim': 64, 'lr': 1.4576500451845982e-05, 'lambda_val': 0.08079531450512278, 'batch_size': 1867, 'optimizer': 'SGD'}. Best is trial 16 with value: 0.012740817242083872.
2026-05-19 18:49:08,837 - experiment_functions - INFO - Early stopping at epoch 1400. Best Recall: 0.0098
2026-05-19 18:49:08,927 - optuna.study.study - INFO - Trial 20 finished with value: 0.009795893129514599 and parameters: {'n_layers': 1, 'embedding_dim': 64, 'lr': 0.00025516218640191454, 'lambda_val': 0.00225805952173378, 'batch_size': 2538, 'optimizer': 'RMSprop'}. Best is trial 16 with value: 0.012740817242083872.
2026-05-19 18:49:13,595 - experiment_functions - INFO - Early stopping at epoch 750. Best Recall: 0.0106
2026-05-19 18:49:13,686 - optuna.study.study - INFO - Trial 21 finished with value: 0.0105859906375043 and parameters: {'n_layers': 1, 'embedding_dim': 64, 'lr': 0.0005853999556992278, 'lambda_val': 0.007217047517780447, 'batch_size': 1226, 'optimizer': 'Adam'}. Best is trial 16 with value: 0.012740817242083872.
2026-05-19 18:49:17,563 - experiment_functions - INFO - Early stopping at epoch 650. Best Recall: 0.0142
2026-05-19 18:49:17,659 - optuna.study.study - INFO - Trial 22 finished with value: 0.014245098404605748 and parameters: {'n_layers': 1, 'embedding_dim': 64, 'lr': 0.0011443318660442053, 'lambda_val': 0.007148721344971578, 'batch_size': 1200, 'optimizer': 'Adam'}. Best is trial 22 with value: 0.014245098404605748.
2026-05-19 18:49:21,354 - experiment_functions - INFO - Early stopping at epoch 600. Best Recall: 0.0143
2026-05-19 18:49:21,448 - optuna.study.study - INFO - Trial 23 finished with value: 0.014344438944026351 and parameters: {'n_layers': 1, 'embedding_dim': 64, 'lr': 0.002018029263254486, 'lambda_val': 0.000690739507500719, 'batch_size': 1762, 'optimizer': 'Adam'}. Best is trial 23 with value: 0.014344438944026351.
2026-05-19 18:49:25,882 - experiment_functions - INFO - Early stopping at epoch 600. Best Recall: 0.0124
2026-05-19 18:49:25,984 - optuna.study.study - INFO - Trial 24 finished with value: 0.012428291888937546 and parameters: {'n_layers': 1, 'embedding_dim': 32, 'lr': 0.0018738031056712752, 'lambda_val': 0.0004993639106653345, 'batch_size': 1656, 'optimizer': 'Adam'}. Best is trial 23 with value: 0.014344438944026351.
2026-05-19 18:49:29,807 - experiment_functions - INFO - Early stopping at epoch 550. Best Recall: 0.0162
2026-05-19 18:49:29,924 - optuna.study.study - INFO - Trial 25 finished with value: 0.01621823415634189 and parameters: {'n_layers': 1, 'embedding_dim': 256, 'lr': 0.0024717013883558425, 'lambda_val': 0.0008517129367651841, 'batch_size': 1269, 'optimizer': 'Adam'}. Best is trial 25 with value: 0.01621823415634189.
2026-05-19 18:49:33,723 - experiment_functions - INFO - Early stopping at epoch 550. Best Recall: 0.0179
2026-05-19 18:49:33,873 - optuna.study.study - INFO - Trial 26 finished with value: 0.017895300893461717 and parameters: {'n_layers': 1, 'embedding_dim': 256, 'lr': 0.00260262560811441, 'lambda_val': 0.000826346990486225, 'batch_size': 1279, 'optimizer': 'Adam'}. Best is trial 26 with value: 0.017895300893461717.
2026-05-19 18:49:38,042 - experiment_functions - INFO - Early stopping at epoch 550. Best Recall: 0.0102
2026-05-19 18:49:38,133 - optuna.study.study - INFO - Trial 27 finished with value: 0.010224533665405109 and parameters: {'n_layers': 2, 'embedding_dim': 256, 'lr': 0.0030293471650100555, 'lambda_val': 0.0002020349908781431, 'batch_size': 2253, 'optimizer': 'Adam'}. Best is trial 26 with value: 0.017895300893461717.
2026-05-19 18:49:41,942 - experiment_functions - INFO - Early stopping at epoch 500. Best Recall: 0.0043
2026-05-19 18:49:42,090 - optuna.study.study - INFO - Trial 28 finished with value: 0.0042520247901795555 and parameters: {'n_layers': 1, 'embedding_dim': 256, 'lr': 0.09503609572239818, 'lambda_val': 0.0007929653691610736, 'batch_size': 1386, 'optimizer': 'Adam'}. Best is trial 26 with value: 0.017895300893461717.
2026-05-19 18:49:50,266 - experiment_functions - INFO - Early stopping at epoch 1400. Best Recall: 0.0098
2026-05-19 18:49:50,367 - optuna.study.study - INFO - Trial 29 finished with value: 0.009813309616523757 and parameters: {'n_layers': 1, 'embedding_dim': 256, 'lr': 0.011525304097680178, 'lambda_val': 2.9807403889209476e-05, 'batch_size': 3091, 'optimizer': 'Adam'}. Best is trial 26 with value: 0.017895300893461717.
2026-05-19 18:49:54,354 - experiment_functions - INFO - Early stopping at epoch 550. Best Recall: 0.0108
2026-05-19 18:49:54,444 - optuna.study.study - INFO - Trial 30 finished with value: 0.010834254775829538 and parameters: {'n_layers': 2, 'embedding_dim': 256, 'lr': 0.003619707453849515, 'lambda_val': 0.00034465750145451426, 'batch_size': 520, 'optimizer': 'Adam'}. Best is trial 26 with value: 0.017895300893461717.
2026-05-19 18:49:59,321 - experiment_functions - INFO - Early stopping at epoch 650. Best Recall: 0.0200
2026-05-19 18:49:59,457 - optuna.study.study - INFO - Trial 31 finished with value: 0.020010531998768788 and parameters: {'n_layers': 1, 'embedding_dim': 256, 'lr': 0.0008942178061101849, 'lambda_val': 0.001085828645578417, 'batch_size': 1163, 'optimizer': 'Adam'}. Best is trial 31 with value: 0.020010531998768788.
2026-05-19 18:50:03,999 - experiment_functions - INFO - Early stopping at epoch 650. Best Recall: 0.0147
2026-05-19 18:50:04,108 - optuna.study.study - INFO - Trial 32 finished with value: 0.01469569198158697 and parameters: {'n_layers': 1, 'embedding_dim': 256, 'lr': 0.0008826923877601968, 'lambda_val': 0.0010683617859524664, 'batch_size': 916, 'optimizer': 'Adam'}. Best is trial 31 with value: 0.020010531998768788.
2026-05-19 18:50:08,476 - experiment_functions - INFO - Early stopping at epoch 600. Best Recall: 0.0160
2026-05-19 18:50:08,644 - optuna.study.study - INFO - Trial 33 finished with value: 0.015972689707130474 and parameters: {'n_layers': 1, 'embedding_dim': 256, 'lr': 0.0011263791321823445, 'lambda_val': 0.0036454983122949027, 'batch_size': 956, 'optimizer': 'Adam'}. Best is trial 31 with value: 0.020010531998768788.
2026-05-19 18:50:16,456 - optuna.study._optimize - INFO - Trial 34 pruned. 
2026-05-19 18:50:21,814 - experiment_functions - INFO - Early stopping at epoch 650. Best Recall: 0.0164
2026-05-19 18:50:21,968 - optuna.study.study - INFO - Trial 35 finished with value: 0.016414212994462656 and parameters: {'n_layers': 1, 'embedding_dim': 256, 'lr': 0.0010099414348865763, 'lambda_val': 0.0046198120304271105, 'batch_size': 788, 'optimizer': 'Adam'}. Best is trial 31 with value: 0.020010531998768788.
2026-05-19 18:50:25,760 - experiment_functions - INFO - Early stopping at epoch 500. Best Recall: 0.0015
2026-05-19 18:50:25,896 - optuna.study.study - INFO - Trial 36 finished with value: 0.0014821036262848166 and parameters: {'n_layers': 2, 'embedding_dim': 256, 'lr': 0.0006668555050573506, 'lambda_val': 0.011470795422159636, 'batch_size': 702, 'optimizer': 'SGD'}. Best is trial 31 with value: 0.020010531998768788.
2026-05-19 18:50:29,902 - experiment_functions - INFO - Early stopping at epoch 600. Best Recall: 0.0138
2026-05-19 18:50:29,992 - optuna.study.study - INFO - Trial 37 finished with value: 0.01377841554298583 and parameters: {'n_layers': 1, 'embedding_dim': 96, 'lr': 0.0022525976130184115, 'lambda_val': 0.000327741441444439, 'batch_size': 1247, 'optimizer': 'Adam'}. Best is trial 31 with value: 0.020010531998768788.
2026-05-19 18:50:34,334 - experiment_functions - INFO - Early stopping at epoch 500. Best Recall: 0.0015
2026-05-19 18:50:34,638 - optuna.study.study - INFO - Trial 38 finished with value: 0.0015178281251637111 and parameters: {'n_layers': 3, 'embedding_dim': 256, 'lr': 0.005078815654409571, 'lambda_val': 0.0014220995519667085, 'batch_size': 2795, 'optimizer': 'Adam'}. Best is trial 31 with value: 0.020010531998768788.
2026-05-19 18:50:38,542 - experiment_functions - INFO - Early stopping at epoch 500. Best Recall: 0.0008
2026-05-19 18:50:39,317 - optuna.study.study - INFO - Trial 39 finished with value: 0.0008483729159719434 and parameters: {'n_layers': 1, 'embedding_dim': 256, 'lr': 0.012046906623041889, 'lambda_val': 5.877270850960983e-05, 'batch_size': 1048, 'optimizer': 'SGD'}. Best is trial 31 with value: 0.020010531998768788.
2026-05-19 18:50:54,787 - experiment_functions - INFO - Early stopping at epoch 950. Best Recall: 0.0130
2026-05-19 18:50:54,941 - optuna.study.study - INFO - Trial 40 finished with value: 0.012950688428978507 and parameters: {'n_layers': 2, 'embedding_dim': 256, 'lr': 0.00017591340290683984, 'lambda_val': 0.003970088528161867, 'batch_size': 775, 'optimizer': 'Adam'}. Best is trial 31 with value: 0.020010531998768788.
2026-05-19 18:50:59,821 - experiment_functions - INFO - Early stopping at epoch 650. Best Recall: 0.0145
2026-05-19 18:50:59,942 - optuna.study.study - INFO - Trial 41 finished with value: 0.014516907441430598 and parameters: {'n_layers': 1, 'embedding_dim': 256, 'lr': 0.0010800447383374687, 'lambda_val': 0.003798959976157284, 'batch_size': 967, 'optimizer': 'Adam'}. Best is trial 31 with value: 0.020010531998768788.
2026-05-19 18:51:04,767 - experiment_functions - INFO - Early stopping at epoch 600. Best Recall: 0.0122
2026-05-19 18:51:04,932 - optuna.study.study - INFO - Trial 42 finished with value: 0.012193183921388996 and parameters: {'n_layers': 1, 'embedding_dim': 256, 'lr': 0.0014797003002015034, 'lambda_val': 0.00020904382976857615, 'batch_size': 3348, 'optimizer': 'Adam'}. Best is trial 31 with value: 0.020010531998768788.
2026-05-19 18:51:10,064 - experiment_functions - INFO - Early stopping at epoch 650. Best Recall: 0.0133
2026-05-19 18:51:10,185 - optuna.study.study - INFO - Trial 43 finished with value: 0.013330860862166914 and parameters: {'n_layers': 1, 'embedding_dim': 256, 'lr': 0.0007805973946527641, 'lambda_val': 0.01426546062332888, 'batch_size': 883, 'optimizer': 'Adam'}. Best is trial 31 with value: 0.020010531998768788.
2026-05-19 18:51:14,723 - experiment_functions - INFO - Early stopping at epoch 550. Best Recall: 0.0198
2026-05-19 18:51:14,854 - optuna.study.study - INFO - Trial 44 finished with value: 0.019813921359728138 and parameters: {'n_layers': 1, 'embedding_dim': 256, 'lr': 0.0030594374540565735, 'lambda_val': 0.0037006210272480114, 'batch_size': 1520, 'optimizer': 'Adam'}. Best is trial 31 with value: 0.020010531998768788.
2026-05-19 18:51:19,520 - experiment_functions - INFO - Early stopping at epoch 550. Best Recall: 0.0166
2026-05-19 18:51:19,651 - optuna.study.study - INFO - Trial 45 finished with value: 0.016556839855401587 and parameters: {'n_layers': 1, 'embedding_dim': 256, 'lr': 0.0028657915677053106, 'lambda_val': 0.0011381041326246877, 'batch_size': 1511, 'optimizer': 'Adam'}. Best is trial 31 with value: 0.020010531998768788.
2026-05-19 18:51:24,493 - experiment_functions - INFO - Early stopping at epoch 500. Best Recall: 0.0029
2026-05-19 18:51:24,635 - optuna.study.study - INFO - Trial 46 finished with value: 0.002934120551694105 and parameters: {'n_layers': 2, 'embedding_dim': 96, 'lr': 0.003549954112409329, 'lambda_val': 0.03400024635759349, 'batch_size': 1506, 'optimizer': 'Adam'}. Best is trial 31 with value: 0.020010531998768788.
2026-05-19 18:51:30,090 - experiment_functions - INFO - Early stopping at epoch 700. Best Recall: 0.0050
2026-05-19 18:51:30,255 - optuna.study.study - INFO - Trial 47 finished with value: 0.005031447749429064 and parameters: {'n_layers': 1, 'embedding_dim': 128, 'lr': 0.008481554350524277, 'lambda_val': 0.0074383880836872045, 'batch_size': 2102, 'optimizer': 'Adam'}. Best is trial 31 with value: 0.020010531998768788.
2026-05-19 18:51:34,129 - experiment_functions - INFO - Early stopping at epoch 500. Best Recall: 0.0029
2026-05-19 18:51:34,219 - optuna.study.study - INFO - Trial 48 finished with value: 0.002920419188001324 and parameters: {'n_layers': 2, 'embedding_dim': 256, 'lr': 0.0015679265076981492, 'lambda_val': 0.001329956746715883, 'batch_size': 1386, 'optimizer': 'SGD'}. Best is trial 31 with value: 0.020010531998768788.
2026-05-19 18:51:37,753 - experiment_functions - INFO - Early stopping at epoch 500. Best Recall: 0.0020
2026-05-19 18:51:37,844 - optuna.study.study - INFO - Trial 49 finished with value: 0.0019577133461166937 and parameters: {'n_layers': 1, 'embedding_dim': 32, 'lr': 0.02847290019287035, 'lambda_val': 0.02299058233109149, 'batch_size': 1149, 'optimizer': 'Adam'}. Best is trial 31 with value: 0.020010531998768788.
2026-05-19 18:51:42,635 - experiment_functions - INFO - Early stopping at epoch 500. Best Recall: 0.0027
2026-05-19 18:51:42,747 - optuna.study.study - INFO - Trial 50 finished with value: 0.0026864243403566775 and parameters: {'n_layers': 4, 'embedding_dim': 256, 'lr': 0.0052130744475389615, 'lambda_val': 0.0006144649309257637, 'batch_size': 1964, 'optimizer': 'Adam'}. Best is trial 31 with value: 0.020010531998768788.
2026-05-19 18:51:46,820 - experiment_functions - INFO - Early stopping at epoch 550. Best Recall: 0.0158
2026-05-19 18:51:46,964 - optuna.study.study - INFO - Trial 51 finished with value: 0.015818803599532198 and parameters: {'n_layers': 1, 'embedding_dim': 256, 'lr': 0.0027504719237213806, 'lambda_val': 0.0025568548229979956, 'batch_size': 1573, 'optimizer': 'Adam'}. Best is trial 31 with value: 0.020010531998768788.
2026-05-19 18:51:54,091 - experiment_functions - INFO - Early stopping at epoch 1050. Best Recall: 0.0160
2026-05-19 18:51:54,223 - optuna.study.study - INFO - Trial 52 finished with value: 0.015961182262448095 and parameters: {'n_layers': 1, 'embedding_dim': 256, 'lr': 0.0003271068126088417, 'lambda_val': 0.0007405536053089804, 'batch_size': 1346, 'optimizer': 'Adam'}. Best is trial 31 with value: 0.020010531998768788.
2026-05-19 18:51:58,617 - experiment_functions - INFO - Early stopping at epoch 550. Best Recall: 0.0194
2026-05-19 18:51:58,707 - optuna.study.study - INFO - Trial 53 finished with value: 0.01938974380700394 and parameters: {'n_layers': 1, 'embedding_dim': 256, 'lr': 0.0027573150869567515, 'lambda_val': 0.0010958358389299104, 'batch_size': 1309, 'optimizer': 'Adam'}. Best is trial 31 with value: 0.020010531998768788.
2026-05-19 18:52:02,587 - experiment_functions - INFO - Early stopping at epoch 550. Best Recall: 0.0176
2026-05-19 18:52:02,688 - optuna.study.study - INFO - Trial 54 finished with value: 0.017569485227484954 and parameters: {'n_layers': 1, 'embedding_dim': 256, 'lr': 0.004355774672174442, 'lambda_val': 0.004918410757067036, 'batch_size': 1078, 'optimizer': 'Adam'}. Best is trial 31 with value: 0.020010531998768788.
2026-05-19 18:52:09,025 - optuna.study._optimize - INFO - Trial 55 pruned. 
2026-05-19 18:52:13,282 - experiment_functions - INFO - Early stopping at epoch 550. Best Recall: 0.0138
