2026-05-19 16:19:19,903 - root - INFO - **** Training e_100K_full
2026-05-19 16:19:19,926 - helper_functions - INFO - Users: 610, Items: 9742
2026-05-19 16:19:20,056 - helper_functions - INFO - Edge index: torch.Size([2, 100836])
2026-05-19 16:19:20,056 - root - INFO - **** Generating the graph:
2026-05-19 16:19:20,139 - helper_functions - INFO - Number of unique users: 610
2026-05-19 16:19:20,140 - helper_functions - INFO - Number of unique items: 9724
2026-05-19 16:19:20,140 - helper_functions - INFO - Number of nodes: 10334
2026-05-19 16:19:20,141 - helper_functions - INFO - Number of edges: 100836
2026-05-19 16:19:22,718 - optuna.storages._rdb.storage - INFO - A new study created in RDB with name: Study_e_100K_full
2026-05-19 16:19:51,012 - optuna.study.study - INFO - Trial 0 finished with value: 0.03435828168172815 and parameters: {'n_layers': 3, 'embedding_dim': 128, 'lr': 8.241613050242091e-05, 'lambda_val': 5.36262879275962e-05, 'batch_size': 611, 'optimizer': 'RMSprop'}. Best is trial 0 with value: 0.03435828168172815.
2026-05-19 16:19:55,874 - experiment_functions - INFO - Early stopping at epoch 600. Best Recall: 0.0140
2026-05-19 16:19:55,995 - optuna.study.study - INFO - Trial 1 finished with value: 0.01401254059347407 and parameters: {'n_layers': 4, 'embedding_dim': 64, 'lr': 0.0036668915075860893, 'lambda_val': 0.017184343666751287, 'batch_size': 1653, 'optimizer': 'Adam'}. Best is trial 0 with value: 0.03435828168172815.
2026-05-19 16:19:59,956 - experiment_functions - INFO - Early stopping at epoch 550. Best Recall: 0.0583
2026-05-19 16:20:00,107 - optuna.study.study - INFO - Trial 2 finished with value: 0.058288515018596165 and parameters: {'n_layers': 2, 'embedding_dim': 64, 'lr': 0.003740427448446405, 'lambda_val': 5.8558803707621804e-06, 'batch_size': 2424, 'optimizer': 'Adam'}. Best is trial 2 with value: 0.058288515018596165.
2026-05-19 16:20:30,103 - experiment_functions - INFO - Early stopping at epoch 2900. Best Recall: 0.0077
2026-05-19 16:20:30,214 - optuna.study.study - INFO - Trial 3 finished with value: 0.007687107359108471 and parameters: {'n_layers': 4, 'embedding_dim': 96, 'lr': 3.9650574337223046e-05, 'lambda_val': 0.002938315600343282, 'batch_size': 836, 'optimizer': 'Adam'}. Best is trial 2 with value: 0.058288515018596165.
2026-05-19 16:20:35,880 - experiment_functions - INFO - Early stopping at epoch 550. Best Recall: 0.0202
2026-05-19 16:20:35,990 - optuna.study.study - INFO - Trial 4 finished with value: 0.020245221459021148 and parameters: {'n_layers': 4, 'embedding_dim': 256, 'lr': 0.0321176789857424, 'lambda_val': 1.1401807976554831e-05, 'batch_size': 1461, 'optimizer': 'Adam'}. Best is trial 2 with value: 0.058288515018596165.
2026-05-19 16:20:39,992 - experiment_functions - INFO - Early stopping at epoch 500. Best Recall: 0.0009
2026-05-19 16:20:40,093 - optuna.study.study - INFO - Trial 5 finished with value: 0.0009135607877643918 and parameters: {'n_layers': 2, 'embedding_dim': 32, 'lr': 0.0002827064417960182, 'lambda_val': 0.007505059324212598, 'batch_size': 3709, 'optimizer': 'SGD'}. Best is trial 2 with value: 0.058288515018596165.
2026-05-19 16:20:43,644 - experiment_functions - INFO - Early stopping at epoch 500. Best Recall: 0.0016
2026-05-19 16:20:43,746 - optuna.study.study - INFO - Trial 6 finished with value: 0.0015884753250005098 and parameters: {'n_layers': 1, 'embedding_dim': 32, 'lr': 0.00012427173145045429, 'lambda_val': 1.3686771351153158e-06, 'batch_size': 1201, 'optimizer': 'SGD'}. Best is trial 2 with value: 0.058288515018596165.
2026-05-19 16:20:47,767 - experiment_functions - INFO - Early stopping at epoch 550. Best Recall: 0.0745
2026-05-19 16:20:47,860 - optuna.study.study - INFO - Trial 7 finished with value: 0.07448967238893771 and parameters: {'n_layers': 2, 'embedding_dim': 96, 'lr': 0.0042511628399122085, 'lambda_val': 0.002869362914004657, 'batch_size': 2742, 'optimizer': 'Adam'}. Best is trial 7 with value: 0.07448967238893771.
2026-05-19 16:20:56,575 - experiment_functions - INFO - Early stopping at epoch 1000. Best Recall: 0.0227
2026-05-19 16:20:56,674 - optuna.study.study - INFO - Trial 8 finished with value: 0.02269522697655493 and parameters: {'n_layers': 4, 'embedding_dim': 128, 'lr': 0.04763468772081833, 'lambda_val': 8.908350070437321e-06, 'batch_size': 3320, 'optimizer': 'Adam'}. Best is trial 7 with value: 0.07448967238893771.
2026-05-19 16:21:05,816 - experiment_functions - INFO - Early stopping at epoch 500. Best Recall: 0.0016
2026-05-19 16:21:06,578 - optuna.study.study - INFO - Trial 9 finished with value: 0.0015615805393975313 and parameters: {'n_layers': 4, 'embedding_dim': 128, 'lr': 0.0892028109145799, 'lambda_val': 0.008885585253444987, 'batch_size': 1015, 'optimizer': 'SGD'}. Best is trial 7 with value: 0.07448967238893771.
2026-05-19 16:21:15,142 - experiment_functions - INFO - Early stopping at epoch 500. Best Recall: 0.0026
2026-05-19 16:21:15,233 - optuna.study.study - INFO - Trial 10 finished with value: 0.0026390498223124005 and parameters: {'n_layers': 1, 'embedding_dim': 96, 'lr': 1.1018096716234204e-05, 'lambda_val': 0.0005162819789533272, 'batch_size': 2764, 'optimizer': 'RMSprop'}. Best is trial 7 with value: 0.07448967238893771.
2026-05-19 16:21:19,467 - experiment_functions - INFO - Early stopping at epoch 600. Best Recall: 0.0502
2026-05-19 16:21:19,547 - optuna.study.study - INFO - Trial 11 finished with value: 0.050181242695405893 and parameters: {'n_layers': 2, 'embedding_dim': 64, 'lr': 0.0028135627400813715, 'lambda_val': 0.0007935916191358426, 'batch_size': 2399, 'optimizer': 'Adam'}. Best is trial 7 with value: 0.07448967238893771.
2026-05-19 16:21:24,018 - experiment_functions - INFO - Early stopping at epoch 550. Best Recall: 0.0631
2026-05-19 16:21:24,119 - optuna.study.study - INFO - Trial 12 finished with value: 0.06308310791022374 and parameters: {'n_layers': 2, 'embedding_dim': 64, 'lr': 0.004876496373414537, 'lambda_val': 0.00015475159957689604, 'batch_size': 2113, 'optimizer': 'Adam'}. Best is trial 7 with value: 0.07448967238893771.
2026-05-19 16:21:31,449 - optuna.study._optimize - INFO - Trial 13 pruned. 
2026-05-19 16:21:37,167 - experiment_functions - INFO - Early stopping at epoch 700. Best Recall: 0.0785
2026-05-19 16:21:37,261 - optuna.study.study - INFO - Trial 14 finished with value: 0.0784526365472799 and parameters: {'n_layers': 2, 'embedding_dim': 256, 'lr': 0.0010680440998043046, 'lambda_val': 9.453065577635976e-05, 'batch_size': 1934, 'optimizer': 'Adam'}. Best is trial 14 with value: 0.0784526365472799.
2026-05-19 16:21:46,732 - experiment_functions - INFO - Early stopping at epoch 1400. Best Recall: 0.1274
2026-05-19 16:21:46,823 - optuna.study.study - INFO - Trial 15 finished with value: 0.12738581226110837 and parameters: {'n_layers': 1, 'embedding_dim': 256, 'lr': 0.0005480013777865859, 'lambda_val': 9.182606802632047e-05, 'batch_size': 1946, 'optimizer': 'RMSprop'}. Best is trial 15 with value: 0.12738581226110837.
2026-05-19 16:21:53,664 - experiment_functions - INFO - Early stopping at epoch 1000. Best Recall: 0.1308
2026-05-19 16:21:53,764 - optuna.study.study - INFO - Trial 16 finished with value: 0.13081326886613995 and parameters: {'n_layers': 1, 'embedding_dim': 256, 'lr': 0.0005429512585892654, 'lambda_val': 7.81428567345996e-05, 'batch_size': 1943, 'optimizer': 'RMSprop'}. Best is trial 16 with value: 0.13081326886613995.
2026-05-19 16:22:02,024 - experiment_functions - INFO - Early stopping at epoch 1300. Best Recall: 0.1267
2026-05-19 16:22:02,159 - optuna.study.study - INFO - Trial 17 finished with value: 0.1266573419737281 and parameters: {'n_layers': 1, 'embedding_dim': 256, 'lr': 0.0005380766749139543, 'lambda_val': 3.4609779221574384e-05, 'batch_size': 1784, 'optimizer': 'RMSprop'}. Best is trial 16 with value: 0.13081326886613995.
2026-05-19 16:22:07,727 - experiment_functions - INFO - Early stopping at epoch 750. Best Recall: 0.1148
2026-05-19 16:22:07,872 - optuna.study.study - INFO - Trial 18 finished with value: 0.11483683006703783 and parameters: {'n_layers': 1, 'embedding_dim': 256, 'lr': 0.001098710470877369, 'lambda_val': 0.0002621293222529465, 'batch_size': 1385, 'optimizer': 'RMSprop'}. Best is trial 16 with value: 0.13081326886613995.
2026-05-19 16:22:29,401 - experiment_functions - INFO - Early stopping at epoch 3500. Best Recall: 0.1271
2026-05-19 16:22:29,503 - optuna.study.study - INFO - Trial 19 finished with value: 0.12705224588945005 and parameters: {'n_layers': 1, 'embedding_dim': 256, 'lr': 0.000254340136351732, 'lambda_val': 2.5135556374961814e-05, 'batch_size': 2211, 'optimizer': 'RMSprop'}. Best is trial 16 with value: 0.13081326886613995.
2026-05-19 16:22:38,385 - optuna.study._optimize - INFO - Trial 20 pruned. 
2026-05-19 16:22:46,801 - optuna.study._optimize - INFO - Trial 21 pruned. 
2026-05-19 16:22:53,437 - optuna.study._optimize - INFO - Trial 22 pruned. 
2026-05-19 16:23:03,053 - experiment_functions - INFO - Early stopping at epoch 1450. Best Recall: 0.1396
2026-05-19 16:23:03,202 - optuna.study.study - INFO - Trial 23 finished with value: 0.1396108253323291 and parameters: {'n_layers': 1, 'embedding_dim': 256, 'lr': 0.0004955586305537418, 'lambda_val': 0.00012457643854952224, 'batch_size': 1964, 'optimizer': 'RMSprop'}. Best is trial 23 with value: 0.1396108253323291.
2026-05-19 16:23:10,812 - optuna.study._optimize - INFO - Trial 24 pruned. 
2026-05-19 16:23:15,069 - experiment_functions - INFO - Early stopping at epoch 600. Best Recall: 0.1067
2026-05-19 16:23:15,171 - optuna.study.study - INFO - Trial 25 finished with value: 0.10667314757763544 and parameters: {'n_layers': 1, 'embedding_dim': 256, 'lr': 0.0015648817897140315, 'lambda_val': 0.00011812077201125596, 'batch_size': 1536, 'optimizer': 'RMSprop'}. Best is trial 23 with value: 0.1396108253323291.
2026-05-19 16:23:21,803 - optuna.study._optimize - INFO - Trial 26 pruned. 
2026-05-19 16:23:27,096 - experiment_functions - INFO - Early stopping at epoch 750. Best Recall: 0.0301
2026-05-19 16:23:27,211 - optuna.study.study - INFO - Trial 27 finished with value: 0.03006418289921922 and parameters: {'n_layers': 2, 'embedding_dim': 32, 'lr': 0.010468386430049046, 'lambda_val': 0.0015699247519841391, 'batch_size': 1222, 'optimizer': 'RMSprop'}. Best is trial 23 with value: 0.1396108253323291.
2026-05-19 16:23:36,217 - experiment_functions - INFO - Early stopping at epoch 1400. Best Recall: 0.1187
2026-05-19 16:23:36,307 - optuna.study.study - INFO - Trial 28 finished with value: 0.11870924163998182 and parameters: {'n_layers': 1, 'embedding_dim': 256, 'lr': 0.0005181426228220932, 'lambda_val': 0.00010886044892917805, 'batch_size': 2710, 'optimizer': 'RMSprop'}. Best is trial 23 with value: 0.1396108253323291.
2026-05-19 16:23:44,452 - optuna.study._optimize - INFO - Trial 29 pruned. 
2026-05-19 16:23:48,771 - experiment_functions - INFO - Early stopping at epoch 500. Best Recall: 0.0027
2026-05-19 16:23:48,893 - optuna.study.study - INFO - Trial 30 finished with value: 0.002726840783641479 and parameters: {'n_layers': 2, 'embedding_dim': 256, 'lr': 0.00010198839567066205, 'lambda_val': 4.385888114427135e-06, 'batch_size': 2040, 'optimizer': 'SGD'}. Best is trial 23 with value: 0.1396108253323291.
2026-05-19 16:23:56,123 - optuna.study._optimize - INFO - Trial 31 pruned. 
2026-05-19 16:24:02,673 - optuna.study._optimize - INFO - Trial 32 pruned. 
2026-05-19 16:24:08,203 - experiment_functions - INFO - Early stopping at epoch 800. Best Recall: 0.1005
2026-05-19 16:24:08,274 - optuna.study.study - INFO - Trial 33 finished with value: 0.10048842976287826 and parameters: {'n_layers': 1, 'embedding_dim': 256, 'lr': 0.0006608503007517891, 'lambda_val': 0.00021213738012514625, 'batch_size': 3039, 'optimizer': 'RMSprop'}. Best is trial 23 with value: 0.1396108253323291.
2026-05-19 16:24:12,901 - experiment_functions - INFO - Early stopping at epoch 650. Best Recall: 0.0895
2026-05-19 16:24:12,984 - optuna.study.study - INFO - Trial 34 finished with value: 0.08951776333775405 and parameters: {'n_layers': 1, 'embedding_dim': 256, 'lr': 0.0017924847620330287, 'lambda_val': 6.695662479047847e-05, 'batch_size': 2479, 'optimizer': 'RMSprop'}. Best is trial 23 with value: 0.1396108253323291.
2026-05-19 16:24:19,822 - optuna.study._optimize - INFO - Trial 35 pruned. 
2026-05-19 16:24:25,958 - experiment_functions - INFO - Early stopping at epoch 750. Best Recall: 0.0458
2026-05-19 16:24:26,049 - optuna.study.study - INFO - Trial 36 finished with value: 0.0457725320378884 and parameters: {'n_layers': 2, 'embedding_dim': 256, 'lr': 0.0018956816871048133, 'lambda_val': 5.425855236313363e-06, 'batch_size': 2231, 'optimizer': 'RMSprop'}. Best is trial 23 with value: 0.1396108253323291.
2026-05-19 16:24:29,735 - experiment_functions - INFO - Early stopping at epoch 500. Best Recall: 0.0031
2026-05-19 16:24:29,815 - optuna.study.study - INFO - Trial 37 finished with value: 0.0030627705305016164 and parameters: {'n_layers': 1, 'embedding_dim': 32, 'lr': 0.00019623918231575387, 'lambda_val': 0.000536666393200035, 'batch_size': 1914, 'optimizer': 'SGD'}. Best is trial 23 with value: 0.1396108253323291.
2026-05-19 16:24:37,843 - optuna.study._optimize - INFO - Trial 38 pruned. 
2026-05-19 16:24:43,813 - optuna.study._optimize - INFO - Trial 39 pruned. 
2026-05-19 16:24:47,725 - experiment_functions - INFO - Early stopping at epoch 500. Best Recall: 0.0013
2026-05-19 16:24:47,827 - optuna.study.study - INFO - Trial 40 finished with value: 0.0013125193259104543 and parameters: {'n_layers': 3, 'embedding_dim': 96, 'lr': 0.0008307250023886, 'lambda_val': 2.0487136333105313e-05, 'batch_size': 2659, 'optimizer': 'SGD'}. Best is trial 23 with value: 0.1396108253323291.
2026-05-19 16:24:55,110 - optuna.study._optimize - INFO - Trial 41 pruned. 
2026-05-19 16:25:04,670 - experiment_functions - INFO - Early stopping at epoch 1450. Best Recall: 0.1232
2026-05-19 16:25:04,781 - optuna.study.study - INFO - Trial 42 finished with value: 0.12324053371665195 and parameters: {'n_layers': 1, 'embedding_dim': 256, 'lr': 0.00046964003258160664, 'lambda_val': 7.420665237459578e-05, 'batch_size': 2048, 'optimizer': 'RMSprop'}. Best is trial 23 with value: 0.1396108253323291.
2026-05-19 16:25:09,674 - experiment_functions - INFO - Early stopping at epoch 650. Best Recall: 0.1034
2026-05-19 16:25:09,766 - optuna.study.study - INFO - Trial 43 finished with value: 0.10335254301112848 and parameters: {'n_layers': 1, 'embedding_dim': 256, 'lr': 0.0012447698704449533, 'lambda_val': 0.0001737759139572988, 'batch_size': 1832, 'optimizer': 'RMSprop'}. Best is trial 23 with value: 0.1396108253323291.
2026-05-19 16:25:16,036 - optuna.study._optimize - INFO - Trial 44 pruned. 
2026-05-19 16:25:22,320 - optuna.study._optimize - INFO - Trial 45 pruned. 
2026-05-19 16:25:30,404 - optuna.study._optimize - INFO - Trial 46 pruned. 
2026-05-19 16:25:36,649 - experiment_functions - INFO - Early stopping at epoch 900. Best Recall: 0.1064
2026-05-19 16:25:36,751 - optuna.study.study - INFO - Trial 47 finished with value: 0.10637551389881358 and parameters: {'n_layers': 1, 'embedding_dim': 256, 'lr': 0.0008849534932982625, 'lambda_val': 4.223102919724977e-05, 'batch_size': 1021, 'optimizer': 'RMSprop'}. Best is trial 23 with value: 0.1396108253323291.
2026-05-19 16:25:40,304 - experiment_functions - INFO - Early stopping at epoch 500. Best Recall: 0.0010
2026-05-19 16:25:40,406 - optuna.study.study - INFO - Trial 48 finished with value: 0.0009678647715599228 and parameters: {'n_layers': 2, 'embedding_dim': 96, 'lr': 0.006143547626943352, 'lambda_val': 0.0011132819119169, 'batch_size': 1515, 'optimizer': 'SGD'}. Best is trial 23 with value: 0.1396108253323291.
2026-05-19 16:25:44,007 - experiment_functions - INFO - Early stopping at epoch 500. Best Recall: 0.0015
2026-05-19 16:25:44,097 - optuna.study.study - INFO - Trial 49 finished with value: 0.0014831799257532033 and parameters: {'n_layers': 1, 'embedding_dim': 128, 'lr': 2.3367426743287593e-05, 'lambda_val': 0.00011932621467580879, 'batch_size': 2937, 'optimizer': 'Adam'}. Best is trial 23 with value: 0.1396108253323291.
2026-05-19 16:25:51,247 - optuna.study._optimize - INFO - Trial 50 pruned. 
2026-05-19 16:25:57,638 - experiment_functions - INFO - Early stopping at epoch 900. Best Recall: 0.1089
2026-05-19 16:25:57,783 - optuna.study.study - INFO - Trial 51 finished with value: 0.10888184468001896 and parameters: {'n_layers': 1, 'embedding_dim': 256, 'lr': 0.0005231277771440972, 'lambda_val': 7.262960362149515e-05, 'batch_size': 4053, 'optimizer': 'RMSprop'}. Best is trial 23 with value: 0.1396108253323291.
2026-05-19 16:26:12,573 - optuna.study._optimize - INFO - Trial 52 pruned. 
2026-05-19 16:26:19,940 - optuna.study._optimize - INFO - Trial 53 pruned. 
2026-05-19 16:26:24,531 - experiment_functions - INFO - Early stopping at epoch 650. Best Recall: 0.1067
2026-05-19 16:26:24,622 - optuna.study.study - INFO - Trial 54 finished with value: 0.10674396435274011 and parameters: {'n_layers': 1, 'embedding_dim': 256, 'lr': 0.0013709371597361868, 'lambda_val': 0.00015834826834166936, 'batch_size': 1975, 'optimizer': 'RMSprop'}. Best is trial 23 with value: 0.1396108253323291.
2026-05-19 16:26:39,247 - experiment_functions - INFO - Early stopping at epoch 750. Best Recall: 0.1131
2026-05-19 16:26:39,359 - optuna.study.study - INFO - Trial 55 finished with value: 0.11312764694362024 and parameters: {'n_layers': 1, 'embedding_dim': 256, 'lr': 0.0008392980389343871, 'lambda_val': 1.271739892939793e-05, 'batch_size': 2567, 'optimizer': 'RMSprop'}. Best is trial 23 with value: 0.1396108253323291.
2026-05-19 16:26:45,920 - optuna.study._optimize - INFO - Trial 56 pruned. 
2026-05-19 16:26:52,583 - experiment_functions - INFO - Early stopping at epoch 650. Best Recall: 0.0344
2026-05-19 16:26:52,662 - optuna.study.study - INFO - Trial 57 finished with value: 0.03440262875734013 and parameters: {'n_layers': 4, 'embedding_dim': 256, 'lr': 0.0005304098991430872, 'lambda_val': 8.107667872573038e-05, 'batch_size': 2292, 'optimizer': 'RMSprop'}. Best is trial 23 with value: 0.1396108253323291.
2026-05-19 16:26:57,799 - experiment_functions - INFO - Early stopping at epoch 700. Best Recall: 0.0831
2026-05-19 16:26:57,889 - optuna.study.study - INFO - Trial 58 finished with value: 0.08309348122061866 and parameters: {'n_layers': 1, 'embedding_dim': 256, 'lr': 0.002335098429541637, 'lambda_val': 7.952576536326742e-06, 'batch_size': 2407, 'optimizer': 'RMSprop'}. Best is trial 23 with value: 0.1396108253323291.
2026-05-19 16:27:03,935 - optuna.study._optimize - INFO - Trial 59 pruned. 
2026-05-19 16:27:07,114 - experiment_functions - INFO - Early stopping at epoch 500. Best Recall: 0.0026
2026-05-19 16:27:07,251 - optuna.study.study - INFO - Trial 60 finished with value: 0.002576332483712737 and parameters: {'n_layers': 1, 'embedding_dim': 96, 'lr': 0.00016383189339552002, 'lambda_val': 0.04053286787517436, 'batch_size': 1402, 'optimizer': 'RMSprop'}. Best is trial 23 with value: 0.1396108253323291.
2026-05-19 16:27:13,882 - optuna.study._optimize - INFO - Trial 61 pruned. 
2026-05-19 16:27:20,759 - optuna.study._optimize - INFO - Trial 62 pruned. 
2026-05-19 16:27:27,270 - optuna.study._optimize - INFO - Trial 63 pruned. 
2026-05-19 16:27:32,111 - experiment_functions - INFO - Early stopping at epoch 750. Best Recall: 0.1123
2026-05-19 16:27:32,202 - optuna.study.study - INFO - Trial 64 finished with value: 0.11229555706156906 and parameters: {'n_layers': 1, 'embedding_dim': 256, 'lr': 0.001045917599521217, 'lambda_val': 0.0004214569895573693, 'batch_size': 1742, 'optimizer': 'RMSprop'}. Best is trial 23 with value: 0.1396108253323291.
2026-05-19 16:27:40,666 - experiment_functions - INFO - Early stopping at epoch 1300. Best Recall: 0.1261
2026-05-19 16:27:40,809 - optuna.study.study - INFO - Trial 65 finished with value: 0.12608614072329294 and parameters: {'n_layers': 1, 'embedding_dim': 256, 'lr': 0.00047979563544961706, 'lambda_val': 9.348955843535995e-05, 'batch_size': 2188, 'optimizer': 'RMSprop'}. Best is trial 23 with value: 0.1396108253323291.
2026-05-19 16:27:44,472 - experiment_functions - INFO - Early stopping at epoch 500. Best Recall: 0.0018
2026-05-19 16:27:44,573 - optuna.study.study - INFO - Trial 66 finished with value: 0.0018275767074691551 and parameters: {'n_layers': 1, 'embedding_dim': 256, 'lr': 0.0003320879733786358, 'lambda_val': 2.949764732514857e-05, 'batch_size': 2221, 'optimizer': 'SGD'}. Best is trial 23 with value: 0.1396108253323291.
2026-05-19 16:27:48,711 - experiment_functions - INFO - Early stopping at epoch 550. Best Recall: 0.0608
2026-05-19 16:27:48,813 - optuna.study.study - INFO - Trial 67 finished with value: 0.060813351588915494 and parameters: {'n_layers': 1, 'embedding_dim': 128, 'lr': 0.020879672116032106, 'lambda_val': 4.957427884162767e-05, 'batch_size': 1551, 'optimizer': 'Adam'}. Best is trial 23 with value: 0.1396108253323291.
2026-05-19 16:27:56,532 - optuna.study._optimize - INFO - Trial 68 pruned. 
2026-05-19 16:28:03,091 - optuna.study._optimize - INFO - Trial 69 pruned. 
2026-05-19 16:28:08,670 - experiment_functions - INFO - Early stopping at epoch 800. Best Recall: 0.1130
2026-05-19 16:28:08,806 - optuna.study.study - INFO - Trial 70 finished with value: 0.11296070035033229 and parameters: {'n_layers': 1, 'embedding_dim': 256, 'lr': 0.0007653159442418003, 'lambda_val': 1.617783939058076e-05, 'batch_size': 2324, 'optimizer': 'RMSprop'}. Best is trial 23 with value: 0.1396108253323291.
2026-05-19 16:28:17,990 - optuna.study._optimize - INFO - Trial 71 pruned. 
2026-05-19 16:28:29,627 - experiment_functions - INFO - Early stopping at epoch 650. Best Recall: 0.1065
