2026-05-19 20:34:54,351 - optuna.study._optimize - INFO - Trial 273 pruned. 
2026-05-19 20:34:58,334 - experiment_functions - INFO - Early stopping at epoch 500. Best Recall: 0.0024
2026-05-19 20:34:58,462 - optuna.study.study - INFO - Trial 274 finished with value: 0.0024020194948042068 and parameters: {'n_layers': 1, 'embedding_dim': 128, 'lr': 0.00046412864346387, 'lambda_val': 1.8622712978144862e-06, 'batch_size': 585, 'optimizer': 'SGD'}. Best is trial 250 with value: 0.039041770343629205.
2026-05-19 20:35:10,141 - optuna.study._optimize - INFO - Trial 275 pruned. 
2026-05-19 20:35:17,215 - optuna.study._optimize - INFO - Trial 276 pruned. 
2026-05-19 20:35:25,693 - experiment_functions - INFO - Early stopping at epoch 1200. Best Recall: 0.0334
2026-05-19 20:35:25,821 - optuna.study.study - INFO - Trial 277 finished with value: 0.03340899282320469 and parameters: {'n_layers': 1, 'embedding_dim': 64, 'lr': 0.0005596601944367105, 'lambda_val': 1.4588020649522096e-06, 'batch_size': 516, 'optimizer': 'RMSprop'}. Best is trial 250 with value: 0.039041770343629205.
2026-05-19 20:35:35,883 - optuna.study._optimize - INFO - Trial 278 pruned. 
2026-05-19 20:35:42,649 - optuna.study._optimize - INFO - Trial 279 pruned. 
2026-05-19 20:35:48,735 - optuna.study._optimize - INFO - Trial 280 pruned. 
2026-05-19 20:35:56,212 - optuna.study._optimize - INFO - Trial 281 pruned. 
2026-05-19 20:36:02,724 - optuna.study._optimize - INFO - Trial 282 pruned. 
2026-05-19 20:36:09,090 - optuna.study._optimize - INFO - Trial 283 pruned. 
2026-05-19 20:36:14,810 - optuna.study._optimize - INFO - Trial 284 pruned. 
2026-05-19 20:36:21,902 - optuna.study._optimize - INFO - Trial 285 pruned. 
2026-05-19 20:36:28,247 - optuna.study._optimize - INFO - Trial 286 pruned. 
2026-05-19 20:36:31,926 - experiment_functions - INFO - Early stopping at epoch 500. Best Recall: 0.0037
2026-05-19 20:36:32,046 - optuna.study.study - INFO - Trial 287 finished with value: 0.0036767797087725483 and parameters: {'n_layers': 1, 'embedding_dim': 64, 'lr': 0.048332092061631735, 'lambda_val': 3.0011408769273787e-06, 'batch_size': 522, 'optimizer': 'RMSprop'}. Best is trial 250 with value: 0.039041770343629205.
2026-05-19 20:36:39,579 - optuna.study._optimize - INFO - Trial 288 pruned. 
2026-05-19 20:36:45,565 - optuna.study._optimize - INFO - Trial 289 pruned. 
2026-05-19 20:36:51,176 - optuna.study._optimize - INFO - Trial 290 pruned. 
2026-05-19 20:37:00,729 - experiment_functions - INFO - Early stopping at epoch 1750. Best Recall: 0.0363
2026-05-19 20:37:00,858 - optuna.study.study - INFO - Trial 291 finished with value: 0.036290217443434594 and parameters: {'n_layers': 1, 'embedding_dim': 64, 'lr': 0.00034139739534508925, 'lambda_val': 2.1601922040512203e-06, 'batch_size': 699, 'optimizer': 'RMSprop'}. Best is trial 250 with value: 0.039041770343629205.
2026-05-19 20:37:10,595 - experiment_functions - INFO - Early stopping at epoch 1600. Best Recall: 0.0343
2026-05-19 20:37:10,685 - optuna.study.study - INFO - Trial 292 finished with value: 0.03430324383467523 and parameters: {'n_layers': 1, 'embedding_dim': 64, 'lr': 0.0003615422043868964, 'lambda_val': 1.7252680626862947e-06, 'batch_size': 748, 'optimizer': 'RMSprop'}. Best is trial 250 with value: 0.039041770343629205.
2026-05-19 20:37:16,557 - optuna.study._optimize - INFO - Trial 293 pruned. 
2026-05-19 20:37:22,935 - optuna.study._optimize - INFO - Trial 294 pruned. 
2026-05-19 20:37:29,045 - optuna.study._optimize - INFO - Trial 295 pruned. 
2026-05-19 20:37:35,944 - optuna.study._optimize - INFO - Trial 296 pruned. 
2026-05-19 20:37:41,878 - optuna.study._optimize - INFO - Trial 297 pruned. 
2026-05-19 20:37:45,334 - experiment_functions - INFO - Early stopping at epoch 500. Best Recall: 0.0018
2026-05-19 20:37:45,434 - optuna.study.study - INFO - Trial 298 finished with value: 0.0018051733193701679 and parameters: {'n_layers': 1, 'embedding_dim': 64, 'lr': 0.00058755031588257, 'lambda_val': 1.6666713502935722e-06, 'batch_size': 725, 'optimizer': 'SGD'}. Best is trial 250 with value: 0.039041770343629205.
2026-05-19 20:37:52,201 - optuna.study._optimize - INFO - Trial 299 pruned. 
2026-05-19 20:37:52,204 - experiment_functions - INFO - Training the best model ... for e_100K_1c3dcs_strict
2026-05-19 20:38:01,569 - experiment_functions - INFO - Early stopping at epoch 3600. Best Recall: 0.0279
2026-05-19 20:38:01,798 - root - INFO -   ** Getting the trainable edges:
2026-05-19 20:38:01,805 - helper_functions - INFO -      Number of nodes: 5324
2026-05-19 20:38:01,805 - helper_functions - INFO -      Ratio: 0.515192568221405
2026-05-19 20:38:01,805 - helper_functions - INFO -      Number of unique users: 333
2026-05-19 20:38:01,805 - helper_functions - INFO -      Number of unique items: 4991
2026-05-19 20:38:01,805 - helper_functions - INFO -      Total dominant set edge: 87527
2026-05-19 20:38:01,805 - helper_functions - INFO -      Trainable edges: 70021.6
2026-05-19 20:38:01,815 - root - INFO -   **** Getting 87527 dominant set edges
2026-05-19 20:38:01,976 - optuna.storages._rdb.storage - INFO - A new study created in RDB with name: Study_e_100K_1c3dcs
2026-05-19 20:38:07,906 - experiment_functions - INFO - Early stopping at epoch 800. Best Recall: 0.0393
2026-05-19 20:38:07,990 - optuna.study.study - INFO - Trial 0 finished with value: 0.03934623117721456 and parameters: {'n_layers': 3, 'embedding_dim': 96, 'lr': 0.0005947524881512651, 'lambda_val': 9.679225493271439e-05, 'batch_size': 2286, 'optimizer': 'RMSprop'}. Best is trial 0 with value: 0.03934623117721456.
2026-05-19 20:38:13,463 - experiment_functions - INFO - Early stopping at epoch 900. Best Recall: 0.0658
2026-05-19 20:38:13,576 - optuna.study.study - INFO - Trial 1 finished with value: 0.06578570689959133 and parameters: {'n_layers': 1, 'embedding_dim': 96, 'lr': 0.0036598650348853073, 'lambda_val': 0.0013569673154385025, 'batch_size': 3907, 'optimizer': 'Adam'}. Best is trial 1 with value: 0.06578570689959133.
2026-05-19 20:38:19,732 - experiment_functions - INFO - Early stopping at epoch 500. Best Recall: 0.0017
2026-05-19 20:38:19,832 - optuna.study.study - INFO - Trial 2 finished with value: 0.0017439260335906173 and parameters: {'n_layers': 3, 'embedding_dim': 256, 'lr': 1.076681916562066e-05, 'lambda_val': 2.7938674179426417e-06, 'batch_size': 1598, 'optimizer': 'SGD'}. Best is trial 1 with value: 0.06578570689959133.
2026-05-19 20:38:24,320 - experiment_functions - INFO - Early stopping at epoch 650. Best Recall: 0.0612
2026-05-19 20:38:24,400 - optuna.study.study - INFO - Trial 3 finished with value: 0.06117429942194595 and parameters: {'n_layers': 2, 'embedding_dim': 32, 'lr': 0.00109023894167158, 'lambda_val': 1.3747743280669092e-05, 'batch_size': 990, 'optimizer': 'RMSprop'}. Best is trial 1 with value: 0.06578570689959133.
2026-05-19 20:38:34,243 - experiment_functions - INFO - Early stopping at epoch 500. Best Recall: 0.0020
2026-05-19 20:38:34,415 - optuna.study.study - INFO - Trial 4 finished with value: 0.001992553351430955 and parameters: {'n_layers': 3, 'embedding_dim': 128, 'lr': 0.05139888329085106, 'lambda_val': 9.258465553764505e-05, 'batch_size': 1076, 'optimizer': 'SGD'}. Best is trial 1 with value: 0.06578570689959133.
2026-05-19 20:38:38,203 - experiment_functions - INFO - Early stopping at epoch 600. Best Recall: 0.0026
2026-05-19 20:38:38,295 - optuna.study.study - INFO - Trial 5 finished with value: 0.0026179385889399448 and parameters: {'n_layers': 1, 'embedding_dim': 96, 'lr': 3.5422161009490416e-05, 'lambda_val': 1.0152268043483658e-05, 'batch_size': 2359, 'optimizer': 'Adam'}. Best is trial 1 with value: 0.06578570689959133.
2026-05-19 20:38:43,406 - experiment_functions - INFO - Early stopping at epoch 500. Best Recall: 0.0016
2026-05-19 20:38:43,506 - optuna.study.study - INFO - Trial 6 finished with value: 0.0015603593667957313 and parameters: {'n_layers': 4, 'embedding_dim': 256, 'lr': 0.0017554499892948057, 'lambda_val': 0.013744366027763522, 'batch_size': 1889, 'optimizer': 'SGD'}. Best is trial 1 with value: 0.06578570689959133.
2026-05-19 20:38:53,010 - experiment_functions - INFO - Early stopping at epoch 1300. Best Recall: 0.0633
2026-05-19 20:38:53,110 - optuna.study.study - INFO - Trial 7 finished with value: 0.06325000381359264 and parameters: {'n_layers': 1, 'embedding_dim': 128, 'lr': 0.00104491335692232, 'lambda_val': 0.0008411946954572561, 'batch_size': 3224, 'optimizer': 'Adam'}. Best is trial 1 with value: 0.06578570689959133.
2026-05-19 20:39:09,986 - experiment_functions - INFO - Early stopping at epoch 800. Best Recall: 0.0328
2026-05-19 20:39:10,093 - optuna.study.study - INFO - Trial 8 finished with value: 0.03278778656131496 and parameters: {'n_layers': 2, 'embedding_dim': 128, 'lr': 0.00321447342475135, 'lambda_val': 0.00019826481141068124, 'batch_size': 3904, 'optimizer': 'RMSprop'}. Best is trial 1 with value: 0.06578570689959133.
2026-05-19 20:39:14,210 - experiment_functions - INFO - Early stopping at epoch 500. Best Recall: 0.0021
2026-05-19 20:39:14,289 - optuna.study.study - INFO - Trial 9 finished with value: 0.002055878795604931 and parameters: {'n_layers': 2, 'embedding_dim': 256, 'lr': 0.002929868640868729, 'lambda_val': 4.7449297023071626e-06, 'batch_size': 2784, 'optimizer': 'SGD'}. Best is trial 1 with value: 0.06578570689959133.
2026-05-19 20:39:20,848 - optuna.study._optimize - INFO - Trial 10 pruned. 
2026-05-19 20:39:29,427 - optuna.study._optimize - INFO - Trial 11 pruned. 
2026-05-19 20:39:33,399 - experiment_functions - INFO - Early stopping at epoch 550. Best Recall: 0.0583
2026-05-19 20:39:33,514 - optuna.study.study - INFO - Trial 12 finished with value: 0.058340485721738236 and parameters: {'n_layers': 1, 'embedding_dim': 96, 'lr': 0.009891194250610327, 'lambda_val': 0.0007921039945692035, 'batch_size': 3273, 'optimizer': 'Adam'}. Best is trial 1 with value: 0.06578570689959133.
2026-05-19 20:39:40,146 - optuna.study._optimize - INFO - Trial 13 pruned. 
2026-05-19 20:39:46,749 - optuna.study._optimize - INFO - Trial 14 pruned. 
2026-05-19 20:39:54,886 - optuna.study._optimize - INFO - Trial 15 pruned. 
2026-05-19 20:40:07,919 - experiment_functions - INFO - Early stopping at epoch 1950. Best Recall: 0.0753
2026-05-19 20:40:08,022 - optuna.study.study - INFO - Trial 16 finished with value: 0.0752674537891031 and parameters: {'n_layers': 1, 'embedding_dim': 96, 'lr': 0.00037770721598987466, 'lambda_val': 0.000394389103404189, 'batch_size': 2955, 'optimizer': 'Adam'}. Best is trial 16 with value: 0.0752674537891031.
2026-05-19 20:40:16,776 - optuna.study._optimize - INFO - Trial 17 pruned. 
2026-05-19 20:40:23,191 - optuna.study._optimize - INFO - Trial 18 pruned. 
2026-05-19 20:40:30,153 - optuna.study._optimize - INFO - Trial 19 pruned. 
2026-05-19 20:40:36,842 - optuna.study._optimize - INFO - Trial 20 pruned. 
2026-05-19 20:40:43,207 - experiment_functions - INFO - Early stopping at epoch 900. Best Recall: 0.0741
2026-05-19 20:40:43,330 - optuna.study.study - INFO - Trial 21 finished with value: 0.07407779677788054 and parameters: {'n_layers': 1, 'embedding_dim': 128, 'lr': 0.0038292261129922456, 'lambda_val': 0.0005884255912409718, 'batch_size': 3598, 'optimizer': 'Adam'}. Best is trial 16 with value: 0.0752674537891031.
2026-05-19 20:40:46,963 - experiment_functions - INFO - Early stopping at epoch 550. Best Recall: 0.0713
2026-05-19 20:40:47,054 - optuna.study.study - INFO - Trial 22 finished with value: 0.07131394846777521 and parameters: {'n_layers': 1, 'embedding_dim': 96, 'lr': 0.004450939524115464, 'lambda_val': 0.0003874555729800097, 'batch_size': 3612, 'optimizer': 'Adam'}. Best is trial 16 with value: 0.0752674537891031.
2026-05-19 20:40:50,673 - experiment_functions - INFO - Early stopping at epoch 550. Best Recall: 0.0566
2026-05-19 20:40:50,764 - optuna.study.study - INFO - Trial 23 finished with value: 0.056561870702664954 and parameters: {'n_layers': 1, 'embedding_dim': 32, 'lr': 0.004924965083041085, 'lambda_val': 0.0001446051572128603, 'batch_size': 3578, 'optimizer': 'Adam'}. Best is trial 16 with value: 0.0752674537891031.
2026-05-19 20:40:58,091 - experiment_functions - INFO - Early stopping at epoch 600. Best Recall: 0.0266
2026-05-19 20:40:58,201 - optuna.study.study - INFO - Trial 24 finished with value: 0.02662000927979995 and parameters: {'n_layers': 2, 'embedding_dim': 128, 'lr': 0.022127334729287376, 'lambda_val': 0.00032056014171730803, 'batch_size': 2973, 'optimizer': 'Adam'}. Best is trial 16 with value: 0.0752674537891031.
2026-05-19 20:41:11,956 - experiment_functions - INFO - Early stopping at epoch 650. Best Recall: 0.0601
2026-05-19 20:41:12,057 - optuna.study.study - INFO - Trial 25 finished with value: 0.06011431643973066 and parameters: {'n_layers': 1, 'embedding_dim': 64, 'lr': 0.001749667073127194, 'lambda_val': 4.508515100301959e-05, 'batch_size': 2544, 'optimizer': 'Adam'}. Best is trial 16 with value: 0.0752674537891031.
2026-05-19 20:41:18,541 - optuna.study._optimize - INFO - Trial 26 pruned. 
2026-05-19 20:41:24,769 - optuna.study._optimize - INFO - Trial 27 pruned. 
2026-05-19 20:41:28,903 - experiment_functions - INFO - Early stopping at epoch 500. Best Recall: 0.0028
2026-05-19 20:41:28,992 - optuna.study.study - INFO - Trial 28 finished with value: 0.0028101257953381874 and parameters: {'n_layers': 3, 'embedding_dim': 128, 'lr': 0.09966912753134356, 'lambda_val': 3.908155378372833e-05, 'batch_size': 658, 'optimizer': 'SGD'}. Best is trial 16 with value: 0.0752674537891031.
2026-05-19 20:41:33,447 - experiment_functions - INFO - Early stopping at epoch 600. Best Recall: 0.0290
2026-05-19 20:41:33,537 - optuna.study.study - INFO - Trial 29 finished with value: 0.028973877821072917 and parameters: {'n_layers': 3, 'embedding_dim': 96, 'lr': 0.005071684374962594, 'lambda_val': 7.377980409358066e-05, 'batch_size': 3744, 'optimizer': 'RMSprop'}. Best is trial 16 with value: 0.0752674537891031.
2026-05-19 20:41:40,130 - experiment_functions - INFO - Early stopping at epoch 700. Best Recall: 0.0574
2026-05-19 20:41:40,220 - optuna.study.study - INFO - Trial 30 finished with value: 0.05744991379706125 and parameters: {'n_layers': 1, 'embedding_dim': 64, 'lr': 0.0015269206097010856, 'lambda_val': 1.0959406585424726e-06, 'batch_size': 2029, 'optimizer': 'RMSprop'}. Best is trial 16 with value: 0.0752674537891031.
2026-05-19 20:41:44,121 - experiment_functions - INFO - Early stopping at epoch 550. Best Recall: 0.0606
2026-05-19 20:41:44,266 - optuna.study.study - INFO - Trial 31 finished with value: 0.06061858374806994 and parameters: {'n_layers': 1, 'embedding_dim': 96, 'lr': 0.0036732181640994344, 'lambda_val': 0.0014837672581710217, 'batch_size': 3718, 'optimizer': 'Adam'}. Best is trial 16 with value: 0.0752674537891031.
2026-05-19 20:41:54,460 - experiment_functions - INFO - Early stopping at epoch 1200. Best Recall: 0.0670
2026-05-19 20:41:54,569 - optuna.study.study - INFO - Trial 32 finished with value: 0.06698668975991388 and parameters: {'n_layers': 1, 'embedding_dim': 96, 'lr': 0.0005565704285540824, 'lambda_val': 0.0005507172755177474, 'batch_size': 4023, 'optimizer': 'Adam'}. Best is trial 16 with value: 0.0752674537891031.
2026-05-19 20:42:02,045 - optuna.study._optimize - INFO - Trial 33 pruned. 
2026-05-19 20:42:20,291 - experiment_functions - INFO - Early stopping at epoch 3350. Best Recall: 0.0827
2026-05-19 20:42:20,393 - optuna.study.study - INFO - Trial 34 finished with value: 0.08265883122751666 and parameters: {'n_layers': 1, 'embedding_dim': 96, 'lr': 0.0006810527532990559, 'lambda_val': 0.0002040363348525386, 'batch_size': 3906, 'optimizer': 'Adam'}. Best is trial 34 with value: 0.08265883122751666.
2026-05-19 20:42:28,543 - optuna.study._optimize - INFO - Trial 35 pruned. 
2026-05-19 20:42:32,347 - experiment_functions - INFO - Early stopping at epoch 500. Best Recall: 0.0022
2026-05-19 20:42:32,492 - optuna.study.study - INFO - Trial 36 finished with value: 0.0022189407870536653 and parameters: {'n_layers': 2, 'embedding_dim': 32, 'lr': 1.3658211543805124e-05, 'lambda_val': 1.6547285460491483e-05, 'batch_size': 3840, 'optimizer': 'SGD'}. Best is trial 34 with value: 0.08265883122751666.
2026-05-19 20:42:38,988 - optuna.study._optimize - INFO - Trial 37 pruned. 
2026-05-19 20:42:43,276 - experiment_functions - INFO - Early stopping at epoch 600. Best Recall: 0.0382
2026-05-19 20:42:43,423 - optuna.study.study - INFO - Trial 38 finished with value: 0.0381823973065884 and parameters: {'n_layers': 2, 'embedding_dim': 96, 'lr': 0.0019897011363908773, 'lambda_val': 0.0016182352177447666, 'batch_size': 3534, 'optimizer': 'Adam'}. Best is trial 34 with value: 0.08265883122751666.
2026-05-19 20:42:50,850 - experiment_functions - INFO - Early stopping at epoch 1200. Best Recall: 0.0741
2026-05-19 20:42:50,951 - optuna.study.study - INFO - Trial 39 finished with value: 0.07413215683994007 and parameters: {'n_layers': 1, 'embedding_dim': 128, 'lr': 0.0012614164156354495, 'lambda_val': 0.00012351455002845133, 'batch_size': 1474, 'optimizer': 'RMSprop'}. Best is trial 34 with value: 0.08265883122751666.
2026-05-19 20:42:55,903 - experiment_functions - INFO - Early stopping at epoch 550. Best Recall: 0.0235
2026-05-19 20:42:56,002 - optuna.study.study - INFO - Trial 40 finished with value: 0.023510508267227292 and parameters: {'n_layers': 4, 'embedding_dim': 128, 'lr': 0.0011360036520288662, 'lambda_val': 0.00017031961525485487, 'batch_size': 1133, 'optimizer': 'RMSprop'}. Best is trial 34 with value: 0.08265883122751666.
2026-05-19 20:43:05,729 - optuna.study._optimize - INFO - Trial 41 pruned. 
2026-05-19 20:43:10,814 - experiment_functions - INFO - Early stopping at epoch 800. Best Recall: 0.0696
2026-05-19 20:43:10,904 - optuna.study.study - INFO - Trial 42 finished with value: 0.06962505003560984 and parameters: {'n_layers': 1, 'embedding_dim': 128, 'lr': 0.0024608568117684107, 'lambda_val': 0.000125644099228665, 'batch_size': 1721, 'optimizer': 'RMSprop'}. Best is trial 34 with value: 0.08265883122751666.
2026-05-19 20:43:18,376 - experiment_functions - INFO - Early stopping at epoch 1150. Best Recall: 0.0800
2026-05-19 20:43:18,477 - optuna.study.study - INFO - Trial 43 finished with value: 0.08001683734159726 and parameters: {'n_layers': 1, 'embedding_dim': 256, 'lr': 0.00106484419144004, 'lambda_val': 0.0005039764976816969, 'batch_size': 2559, 'optimizer': 'RMSprop'}. Best is trial 34 with value: 0.08265883122751666.
2026-05-19 20:43:26,631 - optuna.study._optimize - INFO - Trial 44 pruned. 
2026-05-19 20:43:35,616 - experiment_functions - INFO - Early stopping at epoch 1350. Best Recall: 0.0816
2026-05-19 20:43:35,714 - optuna.study.study - INFO - Trial 45 finished with value: 0.08163074269002525 and parameters: {'n_layers': 1, 'embedding_dim': 256, 'lr': 0.0009998957879231742, 'lambda_val': 0.00101130766743568, 'batch_size': 2652, 'optimizer': 'RMSprop'}. Best is trial 34 with value: 0.08265883122751666.
2026-05-19 20:43:42,808 - optuna.study._optimize - INFO - Trial 46 pruned. 
2026-05-19 20:43:50,233 - experiment_functions - INFO - Early stopping at epoch 800. Best Recall: 0.0331
2026-05-19 20:43:50,323 - optuna.study.study - INFO - Trial 47 finished with value: 0.033093817911730876 and parameters: {'n_layers': 3, 'embedding_dim': 256, 'lr': 0.00034486078591931536, 'lambda_val': 0.0019793954749147188, 'batch_size': 2414, 'optimizer': 'RMSprop'}. Best is trial 34 with value: 0.08265883122751666.
2026-05-19 20:43:55,484 - experiment_functions - INFO - Early stopping at epoch 650. Best Recall: 0.0350
2026-05-19 20:43:55,575 - optuna.study.study - INFO - Trial 48 finished with value: 0.03504040433592564 and parameters: {'n_layers': 2, 'embedding_dim': 256, 'lr': 0.0012235241247459876, 'lambda_val': 0.0011101250662741873, 'batch_size': 2158, 'optimizer': 'RMSprop'}. Best is trial 34 with value: 0.08265883122751666.
2026-05-19 20:44:02,313 - optuna.study._optimize - INFO - Trial 49 pruned. 
2026-05-19 20:44:15,392 - experiment_functions - INFO - Early stopping at epoch 1950. Best Recall: 0.0887
2026-05-19 20:44:20,972 - optuna.study.study - INFO - Trial 50 finished with value: 0.08865237147395823 and parameters: {'n_layers': 1, 'embedding_dim': 256, 'lr': 0.0007274124781199109, 'lambda_val': 9.7966763408916e-06, 'batch_size': 1572, 'optimizer': 'RMSprop'}. Best is trial 50 with value: 0.08865237147395823.
2026-05-19 20:44:32,532 - experiment_functions - INFO - Early stopping at epoch 1850. Best Recall: 0.0981
2026-05-19 20:44:32,623 - optuna.study.study - INFO - Trial 51 finished with value: 0.09805448644736418 and parameters: {'n_layers': 1, 'embedding_dim': 256, 'lr': 0.0009189030258697711, 'lambda_val': 5.278738539225197e-06, 'batch_size': 1401, 'optimizer': 'RMSprop'}. Best is trial 51 with value: 0.09805448644736418.
2026-05-19 20:44:46,773 - experiment_functions - INFO - Early stopping at epoch 2200. Best Recall: 0.0881
2026-05-19 20:44:46,863 - optuna.study.study - INFO - Trial 52 finished with value: 0.08808871425137933 and parameters: {'n_layers': 1, 'embedding_dim': 256, 'lr': 0.0007097812299556377, 'lambda_val': 6.970968398403005e-06, 'batch_size': 1279, 'optimizer': 'RMSprop'}. Best is trial 51 with value: 0.09805448644736418.
2026-05-19 20:44:53,513 - optuna.study._optimize - INFO - Trial 53 pruned. 
2026-05-19 20:45:03,350 - optuna.study._optimize - INFO - Trial 54 pruned. 
2026-05-19 20:45:12,383 - optuna.study._optimize - INFO - Trial 55 pruned. 
2026-05-19 20:45:19,666 - optuna.study._optimize - INFO - Trial 56 pruned. 
2026-05-19 20:45:26,697 - optuna.study._optimize - INFO - Trial 57 pruned. 
2026-05-19 20:45:33,612 - experiment_functions - INFO - Early stopping at epoch 800. Best Recall: 0.0440
