2026-05-19 17:58:26,188 - optuna.study.study - INFO - Trial 42 finished with value: 0.056908314197319475 and parameters: {'n_layers': 2, 'embedding_dim': 256, 'lr': 0.0005499970986376921, 'lambda_val': 1.7967968662826703e-06, 'batch_size': 855, 'optimizer': 'Adam'}. Best is trial 22 with value: 0.06386665981552922.
2026-05-19 17:58:33,650 - optuna.study._optimize - INFO - Trial 43 pruned. 
2026-05-19 17:58:42,945 - optuna.study._optimize - INFO - Trial 44 pruned. 
2026-05-19 17:58:51,756 - optuna.study._optimize - INFO - Trial 45 pruned. 
2026-05-19 17:58:55,592 - experiment_functions - INFO - Early stopping at epoch 500. Best Recall: 0.0094
2026-05-19 17:58:55,694 - optuna.study.study - INFO - Trial 46 finished with value: 0.009434227638642162 and parameters: {'n_layers': 2, 'embedding_dim': 64, 'lr': 0.09894097235172612, 'lambda_val': 0.00015219029142447458, 'batch_size': 1017, 'optimizer': 'RMSprop'}. Best is trial 22 with value: 0.06386665981552922.
2026-05-19 17:59:02,208 - optuna.study._optimize - INFO - Trial 47 pruned. 
2026-05-19 17:59:10,604 - experiment_functions - INFO - Early stopping at epoch 500. Best Recall: 0.0020
2026-05-19 17:59:10,696 - optuna.study.study - INFO - Trial 48 finished with value: 0.0019811357297501012 and parameters: {'n_layers': 1, 'embedding_dim': 256, 'lr': 0.0002901742044590021, 'lambda_val': 1.3300383764884035e-06, 'batch_size': 1654, 'optimizer': 'SGD'}. Best is trial 22 with value: 0.06386665981552922.
2026-05-19 17:59:17,391 - optuna.study._optimize - INFO - Trial 49 pruned. 
2026-05-19 17:59:21,714 - experiment_functions - INFO - Early stopping at epoch 550. Best Recall: 0.0285
2026-05-19 17:59:21,855 - optuna.study.study - INFO - Trial 50 finished with value: 0.0285164046890153 and parameters: {'n_layers': 4, 'embedding_dim': 64, 'lr': 0.0026368107916476483, 'lambda_val': 0.000572666425842569, 'batch_size': 990, 'optimizer': 'Adam'}. Best is trial 22 with value: 0.06386665981552922.
2026-05-19 17:59:29,977 - optuna.study._optimize - INFO - Trial 51 pruned. 
2026-05-19 17:59:37,570 - optuna.study._optimize - INFO - Trial 52 pruned. 
2026-05-19 17:59:44,461 - experiment_functions - INFO - Early stopping at epoch 750. Best Recall: 0.0499
2026-05-19 17:59:45,306 - optuna.study.study - INFO - Trial 53 finished with value: 0.04991241312037382 and parameters: {'n_layers': 2, 'embedding_dim': 256, 'lr': 0.0008185058915767464, 'lambda_val': 1.534335994373362e-06, 'batch_size': 651, 'optimizer': 'Adam'}. Best is trial 22 with value: 0.06386665981552922.
2026-05-19 17:59:54,040 - optuna.study._optimize - INFO - Trial 54 pruned. 
2026-05-19 17:59:58,370 - experiment_functions - INFO - Early stopping at epoch 500. Best Recall: 0.0222
2026-05-19 17:59:58,505 - optuna.study.study - INFO - Trial 55 finished with value: 0.0221620030568378 and parameters: {'n_layers': 2, 'embedding_dim': 256, 'lr': 0.030677801263062774, 'lambda_val': 4.832580503333973e-05, 'batch_size': 829, 'optimizer': 'RMSprop'}. Best is trial 22 with value: 0.06386665981552922.
2026-05-19 18:00:06,645 - optuna.study._optimize - INFO - Trial 56 pruned. 
2026-05-19 18:00:15,785 - experiment_functions - INFO - Early stopping at epoch 1100. Best Recall: 0.0550
2026-05-19 18:00:15,905 - optuna.study.study - INFO - Trial 57 finished with value: 0.0550470371839816 and parameters: {'n_layers': 2, 'embedding_dim': 256, 'lr': 0.00046520578609232123, 'lambda_val': 2.1107287804215947e-06, 'batch_size': 515, 'optimizer': 'RMSprop'}. Best is trial 22 with value: 0.06386665981552922.
2026-05-19 18:00:22,453 - experiment_functions - INFO - Early stopping at epoch 1000. Best Recall: 0.0672
2026-05-19 18:00:22,538 - optuna.study.study - INFO - Trial 58 finished with value: 0.06721328699513246 and parameters: {'n_layers': 1, 'embedding_dim': 32, 'lr': 0.001142809609123742, 'lambda_val': 1.0149027932439084e-05, 'batch_size': 1342, 'optimizer': 'Adam'}. Best is trial 58 with value: 0.06721328699513246.
2026-05-19 18:00:29,075 - experiment_functions - INFO - Early stopping at epoch 1000. Best Recall: 0.0667
2026-05-19 18:00:29,176 - optuna.study.study - INFO - Trial 59 finished with value: 0.06671188897665613 and parameters: {'n_layers': 1, 'embedding_dim': 32, 'lr': 0.0010791254733402698, 'lambda_val': 1.7387371647437426e-05, 'batch_size': 1339, 'optimizer': 'RMSprop'}. Best is trial 58 with value: 0.06721328699513246.
2026-05-19 18:00:35,891 - experiment_functions - INFO - Early stopping at epoch 850. Best Recall: 0.0627
2026-05-19 18:00:36,001 - optuna.study.study - INFO - Trial 60 finished with value: 0.06269017876321674 and parameters: {'n_layers': 1, 'embedding_dim': 32, 'lr': 0.001412382398217453, 'lambda_val': 7.39669464997534e-05, 'batch_size': 1411, 'optimizer': 'RMSprop'}. Best is trial 58 with value: 0.06721328699513246.
2026-05-19 18:00:42,556 - experiment_functions - INFO - Early stopping at epoch 950. Best Recall: 0.0617
2026-05-19 18:00:42,666 - optuna.study.study - INFO - Trial 61 finished with value: 0.06171862951073383 and parameters: {'n_layers': 1, 'embedding_dim': 32, 'lr': 0.0012138163199819478, 'lambda_val': 5.539400868785865e-05, 'batch_size': 1687, 'optimizer': 'RMSprop'}. Best is trial 58 with value: 0.06721328699513246.
2026-05-19 18:00:47,741 - experiment_functions - INFO - Early stopping at epoch 700. Best Recall: 0.0444
2026-05-19 18:00:47,832 - optuna.study.study - INFO - Trial 62 finished with value: 0.04439515372333988 and parameters: {'n_layers': 1, 'embedding_dim': 32, 'lr': 0.005864692726187493, 'lambda_val': 9.960494193333178e-05, 'batch_size': 1472, 'optimizer': 'RMSprop'}. Best is trial 58 with value: 0.06721328699513246.
2026-05-19 18:00:53,064 - experiment_functions - INFO - Early stopping at epoch 700. Best Recall: 0.0623
2026-05-19 18:00:53,167 - optuna.study.study - INFO - Trial 63 finished with value: 0.06232003045302514 and parameters: {'n_layers': 1, 'embedding_dim': 32, 'lr': 0.0012191377962639065, 'lambda_val': 6.813357516578262e-05, 'batch_size': 1610, 'optimizer': 'RMSprop'}. Best is trial 58 with value: 0.06721328699513246.
2026-05-19 18:00:59,763 - experiment_functions - INFO - Early stopping at epoch 650. Best Recall: 0.0526
2026-05-19 18:00:59,900 - optuna.study.study - INFO - Trial 64 finished with value: 0.05264455142341516 and parameters: {'n_layers': 1, 'embedding_dim': 32, 'lr': 0.00214248537761482, 'lambda_val': 0.00018153888815586447, 'batch_size': 1331, 'optimizer': 'RMSprop'}. Best is trial 58 with value: 0.06721328699513246.
2026-05-19 18:01:04,634 - experiment_functions - INFO - Early stopping at epoch 700. Best Recall: 0.0470
2026-05-19 18:01:04,770 - optuna.study.study - INFO - Trial 65 finished with value: 0.04704788522580465 and parameters: {'n_layers': 1, 'embedding_dim': 32, 'lr': 0.004355516689067579, 'lambda_val': 1.8451656662984544e-05, 'batch_size': 1890, 'optimizer': 'RMSprop'}. Best is trial 58 with value: 0.06721328699513246.
2026-05-19 18:01:10,312 - experiment_functions - INFO - Early stopping at epoch 700. Best Recall: 0.0625
2026-05-19 18:01:10,403 - optuna.study.study - INFO - Trial 66 finished with value: 0.06253383857790713 and parameters: {'n_layers': 1, 'embedding_dim': 32, 'lr': 0.0013117662259451415, 'lambda_val': 3.696985220087094e-05, 'batch_size': 2340, 'optimizer': 'RMSprop'}. Best is trial 58 with value: 0.06721328699513246.
2026-05-19 18:01:14,901 - experiment_functions - INFO - Early stopping at epoch 600. Best Recall: 0.0480
2026-05-19 18:01:15,049 - optuna.study.study - INFO - Trial 67 finished with value: 0.047979620613411995 and parameters: {'n_layers': 1, 'embedding_dim': 32, 'lr': 0.003134872224005105, 'lambda_val': 3.539662737408875e-05, 'batch_size': 2391, 'optimizer': 'RMSprop'}. Best is trial 58 with value: 0.06721328699513246.
2026-05-19 18:01:20,596 - experiment_functions - INFO - Early stopping at epoch 700. Best Recall: 0.0641
2026-05-19 18:01:20,697 - optuna.study.study - INFO - Trial 68 finished with value: 0.06414591465190062 and parameters: {'n_layers': 1, 'embedding_dim': 32, 'lr': 0.0015354863477526376, 'lambda_val': 1.1003521618439446e-05, 'batch_size': 2416, 'optimizer': 'RMSprop'}. Best is trial 58 with value: 0.06721328699513246.
2026-05-19 18:01:33,984 - experiment_functions - INFO - Early stopping at epoch 1850. Best Recall: 0.0602
2026-05-19 18:01:34,094 - optuna.study.study - INFO - Trial 69 finished with value: 0.06019193457499003 and parameters: {'n_layers': 1, 'embedding_dim': 32, 'lr': 0.0006415998174297374, 'lambda_val': 1.8813949149422494e-05, 'batch_size': 2851, 'optimizer': 'RMSprop'}. Best is trial 58 with value: 0.06721328699513246.
2026-05-19 18:01:38,198 - experiment_functions - INFO - Early stopping at epoch 550. Best Recall: 0.0363
2026-05-19 18:01:38,298 - optuna.study.study - INFO - Trial 70 finished with value: 0.036265758959112056 and parameters: {'n_layers': 1, 'embedding_dim': 32, 'lr': 0.010520487824946615, 'lambda_val': 1.070850326170642e-05, 'batch_size': 2547, 'optimizer': 'RMSprop'}. Best is trial 58 with value: 0.06721328699513246.
2026-05-19 18:01:43,545 - experiment_functions - INFO - Early stopping at epoch 800. Best Recall: 0.0629
2026-05-19 18:01:43,637 - optuna.study.study - INFO - Trial 71 finished with value: 0.06286429318462423 and parameters: {'n_layers': 1, 'embedding_dim': 32, 'lr': 0.0015402427183433404, 'lambda_val': 9.22621625638696e-05, 'batch_size': 2139, 'optimizer': 'RMSprop'}. Best is trial 58 with value: 0.06721328699513246.
2026-05-19 18:01:49,921 - experiment_functions - INFO - Early stopping at epoch 700. Best Recall: 0.0615
2026-05-19 18:01:50,012 - optuna.study.study - INFO - Trial 72 finished with value: 0.06152775141840871 and parameters: {'n_layers': 1, 'embedding_dim': 32, 'lr': 0.0009018392555781236, 'lambda_val': 2.416163778136982e-05, 'batch_size': 1737, 'optimizer': 'RMSprop'}. Best is trial 58 with value: 0.06721328699513246.
2026-05-19 18:01:55,050 - experiment_functions - INFO - Early stopping at epoch 750. Best Recall: 0.0504
2026-05-19 18:01:55,140 - optuna.study.study - INFO - Trial 73 finished with value: 0.05044666231054469 and parameters: {'n_layers': 1, 'embedding_dim': 32, 'lr': 0.0016441423558267393, 'lambda_val': 9.395123755322862e-05, 'batch_size': 1480, 'optimizer': 'RMSprop'}. Best is trial 58 with value: 0.06721328699513246.
2026-05-19 18:01:59,751 - experiment_functions - INFO - Early stopping at epoch 650. Best Recall: 0.0599
2026-05-19 18:01:59,842 - optuna.study.study - INFO - Trial 74 finished with value: 0.05989551592357513 and parameters: {'n_layers': 1, 'embedding_dim': 32, 'lr': 0.0020593129485197647, 'lambda_val': 0.00023565897607381777, 'batch_size': 2199, 'optimizer': 'RMSprop'}. Best is trial 58 with value: 0.06721328699513246.
2026-05-19 18:02:06,571 - experiment_functions - INFO - Early stopping at epoch 1050. Best Recall: 0.0695
2026-05-19 18:02:06,890 - optuna.study.study - INFO - Trial 75 finished with value: 0.06946752647729358 and parameters: {'n_layers': 1, 'embedding_dim': 32, 'lr': 0.0006866663232066332, 'lambda_val': 1.027632407585487e-05, 'batch_size': 2039, 'optimizer': 'RMSprop'}. Best is trial 75 with value: 0.06946752647729358.
2026-05-19 18:02:16,642 - optuna.study._optimize - INFO - Trial 76 pruned. 
2026-05-19 18:02:22,717 - experiment_functions - INFO - Early stopping at epoch 950. Best Recall: 0.0591
2026-05-19 18:02:22,817 - optuna.study.study - INFO - Trial 77 finished with value: 0.0590826827564701 and parameters: {'n_layers': 1, 'embedding_dim': 32, 'lr': 0.0010261227247159665, 'lambda_val': 5.909590739910128e-06, 'batch_size': 2178, 'optimizer': 'RMSprop'}. Best is trial 75 with value: 0.06946752647729358.
2026-05-19 18:02:28,860 - experiment_functions - INFO - Early stopping at epoch 800. Best Recall: 0.0630
2026-05-19 18:02:28,959 - optuna.study.study - INFO - Trial 78 finished with value: 0.06304565243630131 and parameters: {'n_layers': 1, 'embedding_dim': 32, 'lr': 0.0027403785422327005, 'lambda_val': 1.4281234573649602e-05, 'batch_size': 2540, 'optimizer': 'RMSprop'}. Best is trial 75 with value: 0.06946752647729358.
2026-05-19 18:02:33,569 - experiment_functions - INFO - Early stopping at epoch 600. Best Recall: 0.0557
2026-05-19 18:02:33,656 - optuna.study.study - INFO - Trial 79 finished with value: 0.05567159470712276 and parameters: {'n_layers': 1, 'embedding_dim': 32, 'lr': 0.00323422588966829, 'lambda_val': 6.3848037215740415e-06, 'batch_size': 2493, 'optimizer': 'RMSprop'}. Best is trial 75 with value: 0.06946752647729358.
2026-05-19 18:02:41,378 - experiment_functions - INFO - Early stopping at epoch 950. Best Recall: 0.0511
2026-05-19 18:02:41,529 - optuna.study.study - INFO - Trial 80 finished with value: 0.05108400362987805 and parameters: {'n_layers': 1, 'embedding_dim': 96, 'lr': 0.0040305845678956075, 'lambda_val': 1.20069088756875e-05, 'batch_size': 2981, 'optimizer': 'RMSprop'}. Best is trial 75 with value: 0.06946752647729358.
2026-05-19 18:02:46,557 - experiment_functions - INFO - Early stopping at epoch 600. Best Recall: 0.0590
2026-05-19 18:02:46,636 - optuna.study.study - INFO - Trial 81 finished with value: 0.0590221302720773 and parameters: {'n_layers': 1, 'embedding_dim': 32, 'lr': 0.0024859271070792827, 'lambda_val': 1.3851995496481474e-05, 'batch_size': 2725, 'optimizer': 'RMSprop'}. Best is trial 75 with value: 0.06946752647729358.
2026-05-19 18:02:52,719 - experiment_functions - INFO - Early stopping at epoch 900. Best Recall: 0.0551
2026-05-19 18:02:52,810 - optuna.study.study - INFO - Trial 82 finished with value: 0.05508600380387492 and parameters: {'n_layers': 1, 'embedding_dim': 32, 'lr': 0.0015406025423118546, 'lambda_val': 2.0165576749001437e-05, 'batch_size': 2584, 'optimizer': 'RMSprop'}. Best is trial 75 with value: 0.06946752647729358.
2026-05-19 18:03:00,543 - experiment_functions - INFO - Early stopping at epoch 1200. Best Recall: 0.0636
2026-05-19 18:03:00,642 - optuna.study.study - INFO - Trial 83 finished with value: 0.06361053041088459 and parameters: {'n_layers': 1, 'embedding_dim': 32, 'lr': 0.0008712188101914535, 'lambda_val': 4.208920779337931e-06, 'batch_size': 2248, 'optimizer': 'RMSprop'}. Best is trial 75 with value: 0.06946752647729358.
2026-05-19 18:03:06,134 - experiment_functions - INFO - Early stopping at epoch 500. Best Recall: 0.0010
2026-05-19 18:03:06,279 - optuna.study.study - INFO - Trial 84 finished with value: 0.0009757277906113252 and parameters: {'n_layers': 1, 'embedding_dim': 128, 'lr': 0.0004435339390909038, 'lambda_val': 4.2353665424977285e-06, 'batch_size': 2295, 'optimizer': 'SGD'}. Best is trial 75 with value: 0.06946752647729358.
2026-05-19 18:03:13,135 - experiment_functions - INFO - Early stopping at epoch 900. Best Recall: 0.0549
2026-05-19 18:03:13,225 - optuna.study.study - INFO - Trial 85 finished with value: 0.05485651721456635 and parameters: {'n_layers': 1, 'embedding_dim': 32, 'lr': 0.0009515200622542905, 'lambda_val': 9.320078890913664e-06, 'batch_size': 2403, 'optimizer': 'RMSprop'}. Best is trial 75 with value: 0.06946752647729358.
2026-05-19 18:03:23,309 - experiment_functions - INFO - Early stopping at epoch 1550. Best Recall: 0.0684
2026-05-19 18:03:23,398 - optuna.study.study - INFO - Trial 86 finished with value: 0.06843759691099542 and parameters: {'n_layers': 1, 'embedding_dim': 32, 'lr': 0.000577625353325821, 'lambda_val': 3.32211027131702e-06, 'batch_size': 2125, 'optimizer': 'RMSprop'}. Best is trial 75 with value: 0.06946752647729358.
2026-05-19 18:03:32,202 - experiment_functions - INFO - Early stopping at epoch 1200. Best Recall: 0.0586
2026-05-19 18:03:32,346 - optuna.study.study - INFO - Trial 87 finished with value: 0.05857582731554297 and parameters: {'n_layers': 1, 'embedding_dim': 128, 'lr': 0.0006890833501050035, 'lambda_val': 3.3931394320541128e-06, 'batch_size': 1971, 'optimizer': 'RMSprop'}. Best is trial 75 with value: 0.06946752647729358.
2026-05-19 18:03:49,024 - optuna.study._optimize - INFO - Trial 88 pruned. 
2026-05-19 18:03:57,641 - experiment_functions - INFO - Early stopping at epoch 600. Best Recall: 0.0174
2026-05-19 18:03:57,732 - optuna.study.study - INFO - Trial 89 finished with value: 0.017394370016347502 and parameters: {'n_layers': 4, 'embedding_dim': 32, 'lr': 0.0010785037688540479, 'lambda_val': 1.3080529765550737e-06, 'batch_size': 2278, 'optimizer': 'RMSprop'}. Best is trial 75 with value: 0.06946752647729358.
2026-05-19 18:04:06,834 - experiment_functions - INFO - Early stopping at epoch 1600. Best Recall: 0.0763
2026-05-19 18:04:06,982 - optuna.study.study - INFO - Trial 90 finished with value: 0.07628928167476982 and parameters: {'n_layers': 1, 'embedding_dim': 128, 'lr': 0.00040474936807414433, 'lambda_val': 7.139982022790256e-06, 'batch_size': 2841, 'optimizer': 'RMSprop'}. Best is trial 90 with value: 0.07628928167476982.
2026-05-19 18:04:25,343 - experiment_functions - INFO - Early stopping at epoch 1500. Best Recall: 0.0680
2026-05-19 18:04:26,117 - optuna.study.study - INFO - Trial 91 finished with value: 0.06803958974832905 and parameters: {'n_layers': 1, 'embedding_dim': 128, 'lr': 0.0003937870308213225, 'lambda_val': 7.999433458143338e-06, 'batch_size': 2825, 'optimizer': 'RMSprop'}. Best is trial 90 with value: 0.07628928167476982.
2026-05-19 18:04:33,072 - experiment_functions - INFO - Early stopping at epoch 850. Best Recall: 0.0643
2026-05-19 18:04:33,176 - optuna.study.study - INFO - Trial 92 finished with value: 0.06426697572141514 and parameters: {'n_layers': 1, 'embedding_dim': 128, 'lr': 0.0007733824487393691, 'lambda_val': 7.682276462931324e-06, 'batch_size': 3331, 'optimizer': 'RMSprop'}. Best is trial 90 with value: 0.07628928167476982.
2026-05-19 18:04:40,790 - experiment_functions - INFO - Early stopping at epoch 1250. Best Recall: 0.0613
2026-05-19 18:04:40,890 - optuna.study.study - INFO - Trial 93 finished with value: 0.06127481961716222 and parameters: {'n_layers': 1, 'embedding_dim': 128, 'lr': 0.0007987746226655718, 'lambda_val': 7.847906326131928e-06, 'batch_size': 3437, 'optimizer': 'RMSprop'}. Best is trial 90 with value: 0.07628928167476982.
2026-05-19 18:04:49,613 - experiment_functions - INFO - Early stopping at epoch 1150. Best Recall: 0.0630
2026-05-19 18:04:49,713 - optuna.study.study - INFO - Trial 94 finished with value: 0.06303677565050075 and parameters: {'n_layers': 1, 'embedding_dim': 128, 'lr': 0.00040591460970392337, 'lambda_val': 4.6429906536770226e-06, 'batch_size': 3334, 'optimizer': 'RMSprop'}. Best is trial 90 with value: 0.07628928167476982.
2026-05-19 18:04:53,309 - experiment_functions - INFO - Early stopping at epoch 500. Best Recall: 0.0024
2026-05-19 18:04:53,408 - optuna.study.study - INFO - Trial 95 finished with value: 0.002355608625364274 and parameters: {'n_layers': 1, 'embedding_dim': 128, 'lr': 0.0005334425241692555, 'lambda_val': 6.8157559484126676e-06, 'batch_size': 2959, 'optimizer': 'SGD'}. Best is trial 90 with value: 0.07628928167476982.
2026-05-19 18:05:00,627 - experiment_functions - INFO - Early stopping at epoch 850. Best Recall: 0.0630
2026-05-19 18:05:00,737 - optuna.study.study - INFO - Trial 96 finished with value: 0.06297786048805322 and parameters: {'n_layers': 1, 'embedding_dim': 128, 'lr': 0.000768723835023496, 'lambda_val': 2.7782182849812082e-06, 'batch_size': 3098, 'optimizer': 'RMSprop'}. Best is trial 90 with value: 0.07628928167476982.
2026-05-19 18:05:13,447 - experiment_functions - INFO - Early stopping at epoch 1200. Best Recall: 0.0655
2026-05-19 18:05:13,594 - optuna.study.study - INFO - Trial 97 finished with value: 0.06554830905124828 and parameters: {'n_layers': 1, 'embedding_dim': 128, 'lr': 0.000371051351013218, 'lambda_val': 1.1290380075336935e-05, 'batch_size': 3563, 'optimizer': 'RMSprop'}. Best is trial 90 with value: 0.07628928167476982.
2026-05-19 18:05:19,750 - optuna.study._optimize - INFO - Trial 98 pruned. 
2026-05-19 18:05:34,055 - experiment_functions - INFO - Early stopping at epoch 1950. Best Recall: 0.0642
2026-05-19 18:05:34,156 - optuna.study.study - INFO - Trial 99 finished with value: 0.06421089849210693 and parameters: {'n_layers': 1, 'embedding_dim': 128, 'lr': 0.00021727720484912804, 'lambda_val': 2.845767646524717e-05, 'batch_size': 3806, 'optimizer': 'RMSprop'}. Best is trial 90 with value: 0.07628928167476982.
2026-05-19 18:05:56,176 - experiment_functions - INFO - Early stopping at epoch 1900. Best Recall: 0.0647
2026-05-19 18:05:56,286 - optuna.study.study - INFO - Trial 100 finished with value: 0.0647249178682504 and parameters: {'n_layers': 1, 'embedding_dim': 128, 'lr': 0.0002516253125071898, 'lambda_val': 3.1747318340249255e-05, 'batch_size': 3830, 'optimizer': 'RMSprop'}. Best is trial 90 with value: 0.07628928167476982.
2026-05-19 18:06:03,155 - optuna.study._optimize - INFO - Trial 101 pruned. 
2026-05-19 18:06:15,744 - experiment_functions - INFO - Early stopping at epoch 1350. Best Recall: 0.0769
2026-05-19 18:06:15,848 - optuna.study.study - INFO - Trial 102 finished with value: 0.07694132707582149 and parameters: {'n_layers': 1, 'embedding_dim': 128, 'lr': 0.00032371566608527675, 'lambda_val': 1.5604784367746445e-05, 'batch_size': 3538, 'optimizer': 'RMSprop'}. Best is trial 102 with value: 0.07694132707582149.
2026-05-19 18:06:22,270 - optuna.study._optimize - INFO - Trial 103 pruned. 
2026-05-19 18:06:32,836 - optuna.study._optimize - INFO - Trial 104 pruned. 
2026-05-19 18:06:42,173 - experiment_functions - INFO - Early stopping at epoch 1250. Best Recall: 0.0611
2026-05-19 18:06:42,264 - optuna.study.study - INFO - Trial 105 finished with value: 0.06113268266287825 and parameters: {'n_layers': 1, 'embedding_dim': 128, 'lr': 0.0003313434500086714, 'lambda_val': 4.58376370532098e-05, 'batch_size': 3966, 'optimizer': 'RMSprop'}. Best is trial 102 with value: 0.07694132707582149.
2026-05-19 18:06:56,501 - experiment_functions - INFO - Early stopping at epoch 2300. Best Recall: 0.0645
