2026-05-19 17:06:43,152 - optuna.study.study - INFO - Trial 39 finished with value: 0.013197267416227353 and parameters: {'n_layers': 2, 'embedding_dim': 256, 'lr': 0.0060568261581650995, 'lambda_val': 9.549472784774908e-06, 'batch_size': 2403, 'optimizer': 'Adam'}. Best is trial 36 with value: 0.014061646181365146.
2026-05-19 17:06:48,718 - experiment_functions - INFO - Early stopping at epoch 550. Best Recall: 0.0063
2026-05-19 17:06:48,801 - optuna.study.study - INFO - Trial 40 finished with value: 0.006254032911087187 and parameters: {'n_layers': 2, 'embedding_dim': 256, 'lr': 0.002619072560632311, 'lambda_val': 1.1458293160896193e-05, 'batch_size': 1957, 'optimizer': 'Adam'}. Best is trial 36 with value: 0.014061646181365146.
2026-05-19 17:06:56,266 - optuna.study._optimize - INFO - Trial 41 pruned. 
2026-05-19 17:07:04,361 - experiment_functions - INFO - Early stopping at epoch 1050. Best Recall: 0.0152
2026-05-19 17:07:04,462 - optuna.study.study - INFO - Trial 42 finished with value: 0.015227415452860923 and parameters: {'n_layers': 2, 'embedding_dim': 256, 'lr': 0.014453245562894188, 'lambda_val': 3.6255370771331498e-06, 'batch_size': 3109, 'optimizer': 'Adam'}. Best is trial 42 with value: 0.015227415452860923.
2026-05-19 17:07:16,450 - experiment_functions - INFO - Early stopping at epoch 950. Best Recall: 0.0140
2026-05-19 17:07:16,598 - optuna.study.study - INFO - Trial 43 finished with value: 0.01398748192738722 and parameters: {'n_layers': 2, 'embedding_dim': 256, 'lr': 0.017142295562326326, 'lambda_val': 2.941881689267634e-06, 'batch_size': 2464, 'optimizer': 'Adam'}. Best is trial 42 with value: 0.015227415452860923.
2026-05-19 17:07:23,458 - experiment_functions - INFO - Early stopping at epoch 950. Best Recall: 0.0132
2026-05-19 17:07:23,619 - optuna.study.study - INFO - Trial 44 finished with value: 0.013204530205907668 and parameters: {'n_layers': 2, 'embedding_dim': 256, 'lr': 0.018632339392104583, 'lambda_val': 3.109336190189207e-06, 'batch_size': 2338, 'optimizer': 'Adam'}. Best is trial 42 with value: 0.015227415452860923.
2026-05-19 17:07:32,101 - experiment_functions - INFO - Early stopping at epoch 1000. Best Recall: 0.0117
2026-05-19 17:07:33,091 - optuna.study.study - INFO - Trial 45 finished with value: 0.011724307161676864 and parameters: {'n_layers': 2, 'embedding_dim': 256, 'lr': 0.021597041045563193, 'lambda_val': 3.294631518453671e-06, 'batch_size': 1455, 'optimizer': 'Adam'}. Best is trial 42 with value: 0.015227415452860923.
2026-05-19 17:07:36,639 - experiment_functions - INFO - Early stopping at epoch 500. Best Recall: 0.0105
2026-05-19 17:07:37,097 - optuna.study.study - INFO - Trial 46 finished with value: 0.010482008367280521 and parameters: {'n_layers': 2, 'embedding_dim': 256, 'lr': 0.04862838017759966, 'lambda_val': 2.3103188815455247e-06, 'batch_size': 2312, 'optimizer': 'RMSprop'}. Best is trial 42 with value: 0.015227415452860923.
2026-05-19 17:07:44,522 - experiment_functions - INFO - Early stopping at epoch 900. Best Recall: 0.0144
2026-05-19 17:07:44,611 - optuna.study.study - INFO - Trial 47 finished with value: 0.014411481110649063 and parameters: {'n_layers': 3, 'embedding_dim': 256, 'lr': 0.017952443661728455, 'lambda_val': 4.8595599659483605e-06, 'batch_size': 2139, 'optimizer': 'Adam'}. Best is trial 42 with value: 0.015227415452860923.
2026-05-19 17:07:49,113 - experiment_functions - INFO - Early stopping at epoch 550. Best Recall: 0.0075
2026-05-19 17:07:49,217 - optuna.study.study - INFO - Trial 48 finished with value: 0.007485149627857126 and parameters: {'n_layers': 3, 'embedding_dim': 256, 'lr': 0.0030633388203755462, 'lambda_val': 5.209235740448927e-06, 'batch_size': 1928, 'optimizer': 'Adam'}. Best is trial 42 with value: 0.015227415452860923.
2026-05-19 17:07:58,610 - experiment_functions - INFO - Early stopping at epoch 950. Best Recall: 0.0023
2026-05-19 17:07:58,723 - optuna.study.study - INFO - Trial 49 finished with value: 0.00227209183248808 and parameters: {'n_layers': 4, 'embedding_dim': 128, 'lr': 0.06253961093766311, 'lambda_val': 1.827277918560884e-06, 'batch_size': 3114, 'optimizer': 'SGD'}. Best is trial 42 with value: 0.015227415452860923.
2026-05-19 17:08:04,464 - experiment_functions - INFO - Early stopping at epoch 850. Best Recall: 0.0139
2026-05-19 17:08:04,547 - optuna.study.study - INFO - Trial 50 finished with value: 0.01387560965147137 and parameters: {'n_layers': 3, 'embedding_dim': 256, 'lr': 0.03048512143929121, 'lambda_val': 6.368595586880609e-06, 'batch_size': 2074, 'optimizer': 'Adam'}. Best is trial 42 with value: 0.015227415452860923.
2026-05-19 17:08:12,504 - experiment_functions - INFO - Early stopping at epoch 750. Best Recall: 0.0128
2026-05-19 17:08:12,608 - optuna.study.study - INFO - Trial 51 finished with value: 0.012788202597330505 and parameters: {'n_layers': 3, 'embedding_dim': 256, 'lr': 0.03243950596416176, 'lambda_val': 5.582788319211907e-06, 'batch_size': 2058, 'optimizer': 'Adam'}. Best is trial 42 with value: 0.015227415452860923.
2026-05-19 17:08:24,990 - experiment_functions - INFO - Early stopping at epoch 1450. Best Recall: 0.0164
2026-05-19 17:08:25,088 - optuna.study.study - INFO - Trial 52 finished with value: 0.01638260754101202 and parameters: {'n_layers': 3, 'embedding_dim': 256, 'lr': 0.015744575122581275, 'lambda_val': 1.0770962842841354e-06, 'batch_size': 2604, 'optimizer': 'Adam'}. Best is trial 52 with value: 0.01638260754101202.
2026-05-19 17:08:36,129 - experiment_functions - INFO - Early stopping at epoch 1550. Best Recall: 0.0143
2026-05-19 17:08:36,231 - optuna.study.study - INFO - Trial 53 finished with value: 0.014348638617397724 and parameters: {'n_layers': 3, 'embedding_dim': 256, 'lr': 0.016132808732886736, 'lambda_val': 1.1588518851479295e-06, 'batch_size': 2594, 'optimizer': 'Adam'}. Best is trial 52 with value: 0.01638260754101202.
2026-05-19 17:08:45,307 - experiment_functions - INFO - Early stopping at epoch 1100. Best Recall: 0.0144
2026-05-19 17:08:45,522 - optuna.study.study - INFO - Trial 54 finished with value: 0.014420675431347622 and parameters: {'n_layers': 3, 'embedding_dim': 256, 'lr': 0.01578200361546334, 'lambda_val': 1.067552471840256e-06, 'batch_size': 2593, 'optimizer': 'Adam'}. Best is trial 52 with value: 0.01638260754101202.
2026-05-19 17:08:57,862 - experiment_functions - INFO - Early stopping at epoch 1650. Best Recall: 0.0160
2026-05-19 17:08:57,956 - optuna.study.study - INFO - Trial 55 finished with value: 0.01603899876920198 and parameters: {'n_layers': 3, 'embedding_dim': 256, 'lr': 0.015933088833044364, 'lambda_val': 1.2744984731779132e-06, 'batch_size': 2640, 'optimizer': 'Adam'}. Best is trial 52 with value: 0.01638260754101202.
2026-05-19 17:09:05,946 - experiment_functions - INFO - Early stopping at epoch 900. Best Recall: 0.0129
2026-05-19 17:09:06,095 - optuna.study.study - INFO - Trial 56 finished with value: 0.012881353044939127 and parameters: {'n_layers': 3, 'embedding_dim': 256, 'lr': 0.014415368159050446, 'lambda_val': 1.0763536578527446e-06, 'batch_size': 2587, 'optimizer': 'RMSprop'}. Best is trial 52 with value: 0.01638260754101202.
2026-05-19 17:09:11,517 - experiment_functions - INFO - Early stopping at epoch 550. Best Recall: 0.0129
2026-05-19 17:09:11,644 - optuna.study.study - INFO - Trial 57 finished with value: 0.012854470972593027 and parameters: {'n_layers': 3, 'embedding_dim': 256, 'lr': 0.0677179215537728, 'lambda_val': 1.5457503044046425e-06, 'batch_size': 2187, 'optimizer': 'Adam'}. Best is trial 52 with value: 0.01638260754101202.
2026-05-19 17:09:16,675 - experiment_functions - INFO - Early stopping at epoch 700. Best Recall: 0.0085
2026-05-19 17:09:16,791 - optuna.study.study - INFO - Trial 58 finished with value: 0.008523895975734561 and parameters: {'n_layers': 3, 'embedding_dim': 32, 'lr': 0.0007935177175468233, 'lambda_val': 1.9282943116468e-06, 'batch_size': 1697, 'optimizer': 'Adam'}. Best is trial 52 with value: 0.01638260754101202.
2026-05-19 17:09:25,943 - experiment_functions - INFO - Early stopping at epoch 1250. Best Recall: 0.0147
2026-05-19 17:09:26,034 - optuna.study.study - INFO - Trial 59 finished with value: 0.01468779017762319 and parameters: {'n_layers': 4, 'embedding_dim': 256, 'lr': 0.02265232641897334, 'lambda_val': 1.271514054788219e-06, 'batch_size': 2841, 'optimizer': 'Adam'}. Best is trial 52 with value: 0.01638260754101202.
2026-05-19 17:09:36,680 - experiment_functions - INFO - Early stopping at epoch 1300. Best Recall: 0.0158
2026-05-19 17:09:36,811 - optuna.study.study - INFO - Trial 60 finished with value: 0.01579118922526221 and parameters: {'n_layers': 4, 'embedding_dim': 128, 'lr': 0.023756083412305864, 'lambda_val': 2.2258101398616065e-06, 'batch_size': 2913, 'optimizer': 'Adam'}. Best is trial 52 with value: 0.01638260754101202.
2026-05-19 17:09:50,278 - experiment_functions - INFO - Early stopping at epoch 1950. Best Recall: 0.0173
2026-05-19 17:09:50,407 - optuna.study.study - INFO - Trial 61 finished with value: 0.01733066521827559 and parameters: {'n_layers': 4, 'embedding_dim': 128, 'lr': 0.0242114006150141, 'lambda_val': 2.2239012551358145e-06, 'batch_size': 2842, 'optimizer': 'Adam'}. Best is trial 61 with value: 0.01733066521827559.
2026-05-19 17:09:59,284 - experiment_functions - INFO - Early stopping at epoch 1150. Best Recall: 0.0137
2026-05-19 17:09:59,379 - optuna.study.study - INFO - Trial 62 finished with value: 0.013654480559897254 and parameters: {'n_layers': 4, 'embedding_dim': 128, 'lr': 0.023759827142914372, 'lambda_val': 1.0151127494606862e-06, 'batch_size': 2847, 'optimizer': 'Adam'}. Best is trial 61 with value: 0.01733066521827559.
2026-05-19 17:10:12,318 - experiment_functions - INFO - Early stopping at epoch 1800. Best Recall: 0.0150
2026-05-19 17:10:12,423 - optuna.study.study - INFO - Trial 63 finished with value: 0.015046545563919052 and parameters: {'n_layers': 4, 'embedding_dim': 128, 'lr': 0.03717478980682876, 'lambda_val': 2.310188883811511e-06, 'batch_size': 3082, 'optimizer': 'Adam'}. Best is trial 61 with value: 0.01733066521827559.
2026-05-19 17:10:20,414 - experiment_functions - INFO - Early stopping at epoch 1150. Best Recall: 0.0174
2026-05-19 17:10:20,943 - optuna.study.study - INFO - Trial 64 finished with value: 0.017444326223534482 and parameters: {'n_layers': 4, 'embedding_dim': 128, 'lr': 0.0388006699269189, 'lambda_val': 2.4416159035376506e-06, 'batch_size': 3104, 'optimizer': 'Adam'}. Best is trial 64 with value: 0.017444326223534482.
2026-05-19 17:10:27,110 - experiment_functions - INFO - Early stopping at epoch 550. Best Recall: 0.0134
2026-05-19 17:10:27,209 - optuna.study.study - INFO - Trial 65 finished with value: 0.01339315154178746 and parameters: {'n_layers': 4, 'embedding_dim': 128, 'lr': 0.06956238260197475, 'lambda_val': 2.2574989777482553e-06, 'batch_size': 3478, 'optimizer': 'Adam'}. Best is trial 64 with value: 0.017444326223534482.
2026-05-19 17:10:34,509 - experiment_functions - INFO - Early stopping at epoch 750. Best Recall: 0.0152
2026-05-19 17:10:34,644 - optuna.study.study - INFO - Trial 66 finished with value: 0.01519980768774995 and parameters: {'n_layers': 4, 'embedding_dim': 128, 'lr': 0.04582289450454929, 'lambda_val': 7.781510292054728e-06, 'batch_size': 3128, 'optimizer': 'Adam'}. Best is trial 64 with value: 0.017444326223534482.
2026-05-19 17:10:40,060 - experiment_functions - INFO - Early stopping at epoch 700. Best Recall: 0.0105
2026-05-19 17:10:40,154 - optuna.study.study - INFO - Trial 67 finished with value: 0.010524465390510935 and parameters: {'n_layers': 4, 'embedding_dim': 128, 'lr': 0.04303380190857873, 'lambda_val': 9.073129381216255e-06, 'batch_size': 3134, 'optimizer': 'RMSprop'}. Best is trial 64 with value: 0.017444326223534482.
2026-05-19 17:10:44,027 - experiment_functions - INFO - Early stopping at epoch 500. Best Recall: 0.0026
2026-05-19 17:10:44,900 - optuna.study.study - INFO - Trial 68 finished with value: 0.0025865494614006734 and parameters: {'n_layers': 4, 'embedding_dim': 128, 'lr': 0.05584871360877163, 'lambda_val': 3.859277167109786e-06, 'batch_size': 3388, 'optimizer': 'SGD'}. Best is trial 64 with value: 0.017444326223534482.
2026-05-19 17:11:09,076 - experiment_functions - INFO - Early stopping at epoch 3250. Best Recall: 0.0202
2026-05-19 17:11:09,172 - optuna.study.study - INFO - Trial 69 finished with value: 0.02017138300219011 and parameters: {'n_layers': 4, 'embedding_dim': 128, 'lr': 0.02686678234091423, 'lambda_val': 7.520234649522261e-06, 'batch_size': 3196, 'optimizer': 'Adam'}. Best is trial 69 with value: 0.02017138300219011.
2026-05-19 17:11:18,277 - experiment_functions - INFO - Early stopping at epoch 1350. Best Recall: 0.0154
2026-05-19 17:11:18,427 - optuna.study.study - INFO - Trial 70 finished with value: 0.015390445175660301 and parameters: {'n_layers': 4, 'embedding_dim': 128, 'lr': 0.02521758234924651, 'lambda_val': 1.746780603615777e-06, 'batch_size': 2915, 'optimizer': 'Adam'}. Best is trial 69 with value: 0.02017138300219011.
2026-05-19 17:11:32,029 - experiment_functions - INFO - Early stopping at epoch 1700. Best Recall: 0.0152
2026-05-19 17:11:32,792 - optuna.study.study - INFO - Trial 71 finished with value: 0.015212184294632987 and parameters: {'n_layers': 4, 'embedding_dim': 128, 'lr': 0.03158415625613398, 'lambda_val': 1.7992189057513215e-06, 'batch_size': 2889, 'optimizer': 'Adam'}. Best is trial 69 with value: 0.02017138300219011.
2026-05-19 17:11:50,084 - experiment_functions - INFO - Early stopping at epoch 2400. Best Recall: 0.0195
2026-05-19 17:11:50,407 - optuna.study.study - INFO - Trial 72 finished with value: 0.019486187431114157 and parameters: {'n_layers': 4, 'embedding_dim': 128, 'lr': 0.02724405641118529, 'lambda_val': 2.5976727466111293e-06, 'batch_size': 2747, 'optimizer': 'Adam'}. Best is trial 69 with value: 0.02017138300219011.
2026-05-19 17:12:03,929 - optuna.study._optimize - INFO - Trial 73 pruned. 
2026-05-19 17:12:09,253 - experiment_functions - INFO - Early stopping at epoch 650. Best Recall: 0.0130
2026-05-19 17:12:09,359 - optuna.study.study - INFO - Trial 74 finished with value: 0.012958304806047026 and parameters: {'n_layers': 4, 'embedding_dim': 128, 'lr': 0.07997170497850382, 'lambda_val': 1.770209004227488e-06, 'batch_size': 2709, 'optimizer': 'Adam'}. Best is trial 69 with value: 0.02017138300219011.
2026-05-19 17:12:15,929 - optuna.study._optimize - INFO - Trial 75 pruned. 
2026-05-19 17:12:21,015 - experiment_functions - INFO - Early stopping at epoch 550. Best Recall: 0.0058
2026-05-19 17:12:21,108 - optuna.study.study - INFO - Trial 76 finished with value: 0.005849611202795763 and parameters: {'n_layers': 4, 'embedding_dim': 128, 'lr': 0.007959683413663399, 'lambda_val': 1.4494089967976598e-05, 'batch_size': 3232, 'optimizer': 'Adam'}. Best is trial 69 with value: 0.02017138300219011.
2026-05-19 17:12:34,088 - experiment_functions - INFO - Early stopping at epoch 2000. Best Recall: 0.0168
2026-05-19 17:12:34,231 - optuna.study.study - INFO - Trial 77 finished with value: 0.016819958616655084 and parameters: {'n_layers': 4, 'embedding_dim': 128, 'lr': 0.026125905038006523, 'lambda_val': 1.54588553164184e-06, 'batch_size': 2818, 'optimizer': 'Adam'}. Best is trial 69 with value: 0.02017138300219011.
2026-05-19 17:12:42,903 - optuna.study._optimize - INFO - Trial 78 pruned. 
2026-05-19 17:12:50,900 - optuna.study._optimize - INFO - Trial 79 pruned. 
2026-05-19 17:12:54,523 - experiment_functions - INFO - Early stopping at epoch 500. Best Recall: 0.0010
2026-05-19 17:12:54,629 - optuna.study.study - INFO - Trial 80 finished with value: 0.0009655652361566175 and parameters: {'n_layers': 4, 'embedding_dim': 128, 'lr': 0.0003633070066381534, 'lambda_val': 0.011390383397144285, 'batch_size': 3545, 'optimizer': 'SGD'}. Best is trial 69 with value: 0.02017138300219011.
2026-05-19 17:13:08,272 - experiment_functions - INFO - Early stopping at epoch 1750. Best Recall: 0.0151
2026-05-19 17:13:08,366 - optuna.study.study - INFO - Trial 81 finished with value: 0.01505656281831607 and parameters: {'n_layers': 4, 'embedding_dim': 128, 'lr': 0.02819673061293269, 'lambda_val': 1.4268066020264351e-06, 'batch_size': 3009, 'optimizer': 'Adam'}. Best is trial 69 with value: 0.02017138300219011.
2026-05-19 17:13:20,756 - experiment_functions - INFO - Early stopping at epoch 1400. Best Recall: 0.0170
2026-05-19 17:13:20,851 - optuna.study.study - INFO - Trial 82 finished with value: 0.017025803398704988 and parameters: {'n_layers': 4, 'embedding_dim': 128, 'lr': 0.026088457924252174, 'lambda_val': 1.7971295310013295e-05, 'batch_size': 2650, 'optimizer': 'Adam'}. Best is trial 69 with value: 0.02017138300219011.
2026-05-19 17:13:27,867 - experiment_functions - INFO - Early stopping at epoch 950. Best Recall: 0.0167
2026-05-19 17:13:27,961 - optuna.study.study - INFO - Trial 83 finished with value: 0.016715136803857743 and parameters: {'n_layers': 4, 'embedding_dim': 128, 'lr': 0.053045887235902346, 'lambda_val': 7.606509927443841e-06, 'batch_size': 2642, 'optimizer': 'Adam'}. Best is trial 69 with value: 0.02017138300219011.
2026-05-19 17:13:37,199 - optuna.study._optimize - INFO - Trial 84 pruned. 
2026-05-19 17:13:45,319 - optuna.study._optimize - INFO - Trial 85 pruned. 
2026-05-19 17:13:56,807 - experiment_functions - INFO - Early stopping at epoch 1150. Best Recall: 0.0192
2026-05-19 17:13:56,953 - optuna.study.study - INFO - Trial 86 finished with value: 0.019155599721285676 and parameters: {'n_layers': 4, 'embedding_dim': 128, 'lr': 0.037494828534297094, 'lambda_val': 7.256378403073523e-06, 'batch_size': 2496, 'optimizer': 'Adam'}. Best is trial 69 with value: 0.02017138300219011.
2026-05-19 17:14:01,407 - experiment_functions - INFO - Early stopping at epoch 500. Best Recall: 0.0095
2026-05-19 17:14:01,502 - optuna.study.study - INFO - Trial 87 finished with value: 0.009471039471664139 and parameters: {'n_layers': 4, 'embedding_dim': 128, 'lr': 0.0393599248708992, 'lambda_val': 7.728873884739738e-06, 'batch_size': 2261, 'optimizer': 'RMSprop'}. Best is trial 69 with value: 0.02017138300219011.
2026-05-19 17:14:10,702 - optuna.study._optimize - INFO - Trial 88 pruned. 
2026-05-19 17:14:16,405 - experiment_functions - INFO - Early stopping at epoch 700. Best Recall: 0.0142
2026-05-19 17:14:16,510 - optuna.study.study - INFO - Trial 89 finished with value: 0.014159544516160288 and parameters: {'n_layers': 4, 'embedding_dim': 128, 'lr': 0.051826526696030606, 'lambda_val': 1.0842053273508667e-05, 'batch_size': 2404, 'optimizer': 'Adam'}. Best is trial 69 with value: 0.02017138300219011.
2026-05-19 17:14:26,937 - optuna.study._optimize - INFO - Trial 90 pruned. 
2026-05-19 17:14:35,082 - optuna.study._optimize - INFO - Trial 91 pruned. 
2026-05-19 17:14:44,219 - optuna.study._optimize - INFO - Trial 92 pruned. 
2026-05-19 17:14:52,879 - experiment_functions - INFO - Early stopping at epoch 1000. Best Recall: 0.0163
2026-05-19 17:14:52,983 - optuna.study.study - INFO - Trial 93 finished with value: 0.01628329356662269 and parameters: {'n_layers': 4, 'embedding_dim': 128, 'lr': 0.04521011993536257, 'lambda_val': 7.06747065639011e-06, 'batch_size': 2803, 'optimizer': 'Adam'}. Best is trial 69 with value: 0.02017138300219011.
2026-05-19 17:15:02,260 - experiment_functions - INFO - Early stopping at epoch 1100. Best Recall: 0.0162
2026-05-19 17:15:02,421 - optuna.study.study - INFO - Trial 94 finished with value: 0.016186889086226102 and parameters: {'n_layers': 4, 'embedding_dim': 128, 'lr': 0.04621634050469553, 'lambda_val': 5.265115705287247e-06, 'batch_size': 2825, 'optimizer': 'Adam'}. Best is trial 69 with value: 0.02017138300219011.
2026-05-19 17:15:10,477 - experiment_functions - INFO - Early stopping at epoch 750. Best Recall: 0.0164
2026-05-19 17:15:10,607 - optuna.study.study - INFO - Trial 95 finished with value: 0.016410998806651728 and parameters: {'n_layers': 4, 'embedding_dim': 128, 'lr': 0.0748078284428743, 'lambda_val': 7.773533270588457e-06, 'batch_size': 3192, 'optimizer': 'Adam'}. Best is trial 69 with value: 0.02017138300219011.
2026-05-19 17:15:18,473 - experiment_functions - INFO - Early stopping at epoch 950. Best Recall: 0.0138
2026-05-19 17:15:18,567 - optuna.study.study - INFO - Trial 96 finished with value: 0.01376647068180976 and parameters: {'n_layers': 4, 'embedding_dim': 128, 'lr': 0.06906928891140242, 'lambda_val': 2.3475456914670594e-05, 'batch_size': 3045, 'optimizer': 'Adam'}. Best is trial 69 with value: 0.02017138300219011.
2026-05-19 17:15:24,397 - experiment_functions - INFO - Early stopping at epoch 550. Best Recall: 0.0151
2026-05-19 17:15:24,503 - optuna.study.study - INFO - Trial 97 finished with value: 0.01514172538206524 and parameters: {'n_layers': 4, 'embedding_dim': 128, 'lr': 0.08396047419396786, 'lambda_val': 9.251917395321207e-06, 'batch_size': 3309, 'optimizer': 'Adam'}. Best is trial 69 with value: 0.02017138300219011.
2026-05-19 17:15:37,322 - experiment_functions - INFO - Early stopping at epoch 2050. Best Recall: 0.0211
2026-05-19 17:15:37,398 - optuna.study.study - INFO - Trial 98 finished with value: 0.021056788296889777 and parameters: {'n_layers': 4, 'embedding_dim': 128, 'lr': 0.027561618532807627, 'lambda_val': 1.8537850149960577e-05, 'batch_size': 3453, 'optimizer': 'Adam'}. Best is trial 98 with value: 0.021056788296889777.
2026-05-19 17:15:49,736 - optuna.study._optimize - INFO - Trial 99 pruned. 
2026-05-19 17:15:55,481 - experiment_functions - INFO - Early stopping at epoch 500. Best Recall: 0.0021
2026-05-19 17:15:55,575 - optuna.study.study - INFO - Trial 100 finished with value: 0.0020794591152395463 and parameters: {'n_layers': 4, 'embedding_dim': 128, 'lr': 0.09775226529465464, 'lambda_val': 0.00010442412291925141, 'batch_size': 3452, 'optimizer': 'SGD'}. Best is trial 98 with value: 0.021056788296889777.
