2026-05-19 18:35:32,062 - optuna.study.study - INFO - Trial 249 finished with value: 0.07222985646783756 and parameters: {'n_layers': 1, 'embedding_dim': 64, 'lr': 0.0008018293970254999, 'lambda_val': 1.0090605666229096e-06, 'batch_size': 1231, 'optimizer': 'Adam'}. Best is trial 195 with value: 0.0829019064050288.
2026-05-19 18:35:43,874 - experiment_functions - INFO - Early stopping at epoch 1500. Best Recall: 0.0707
2026-05-19 18:35:43,978 - optuna.study.study - INFO - Trial 250 finished with value: 0.07068916385889293 and parameters: {'n_layers': 1, 'embedding_dim': 128, 'lr': 0.0004100539829613307, 'lambda_val': 1.0017849835447683e-06, 'batch_size': 1205, 'optimizer': 'Adam'}. Best is trial 195 with value: 0.0829019064050288.
2026-05-19 18:35:50,987 - experiment_functions - INFO - Early stopping at epoch 900. Best Recall: 0.0277
2026-05-19 18:35:51,113 - optuna.study.study - INFO - Trial 251 finished with value: 0.027728641444093555 and parameters: {'n_layers': 1, 'embedding_dim': 128, 'lr': 0.0006429364786814033, 'lambda_val': 0.09825914338652582, 'batch_size': 1295, 'optimizer': 'Adam'}. Best is trial 195 with value: 0.0829019064050288.
2026-05-19 18:36:11,371 - experiment_functions - INFO - Early stopping at epoch 2950. Best Recall: 0.0807
2026-05-19 18:36:11,452 - optuna.study.study - INFO - Trial 252 finished with value: 0.08068441546702612 and parameters: {'n_layers': 1, 'embedding_dim': 256, 'lr': 0.000543118986896059, 'lambda_val': 2.0125492635876455e-06, 'batch_size': 1047, 'optimizer': 'Adam'}. Best is trial 195 with value: 0.0829019064050288.
2026-05-19 18:36:18,742 - optuna.study._optimize - INFO - Trial 253 pruned. 
2026-05-19 18:36:40,724 - experiment_functions - INFO - Early stopping at epoch 2100. Best Recall: 0.0787
2026-05-19 18:36:41,187 - optuna.study.study - INFO - Trial 254 finished with value: 0.07868054837121474 and parameters: {'n_layers': 1, 'embedding_dim': 256, 'lr': 0.00033607941076894667, 'lambda_val': 2.2540598687538088e-06, 'batch_size': 1027, 'optimizer': 'Adam'}. Best is trial 195 with value: 0.0829019064050288.
2026-05-19 18:36:53,349 - optuna.study._optimize - INFO - Trial 255 pruned. 
2026-05-19 18:37:00,651 - optuna.study._optimize - INFO - Trial 256 pruned. 
2026-05-19 18:37:07,876 - experiment_functions - INFO - Early stopping at epoch 950. Best Recall: 0.0748
2026-05-19 18:37:07,980 - optuna.study.study - INFO - Trial 257 finished with value: 0.0747520702182768 and parameters: {'n_layers': 1, 'embedding_dim': 256, 'lr': 0.001022839166250648, 'lambda_val': 2.319011327676804e-06, 'batch_size': 984, 'optimizer': 'Adam'}. Best is trial 195 with value: 0.0829019064050288.
2026-05-19 18:37:16,469 - optuna.study._optimize - INFO - Trial 258 pruned. 
2026-05-19 18:37:26,180 - experiment_functions - INFO - Early stopping at epoch 1450. Best Recall: 0.0797
2026-05-19 18:37:26,272 - optuna.study.study - INFO - Trial 259 finished with value: 0.07972003516080527 and parameters: {'n_layers': 1, 'embedding_dim': 256, 'lr': 0.0008547861452077307, 'lambda_val': 1.6885576567981875e-06, 'batch_size': 1102, 'optimizer': 'Adam'}. Best is trial 195 with value: 0.0829019064050288.
2026-05-19 18:37:32,505 - experiment_functions - INFO - Early stopping at epoch 950. Best Recall: 0.0779
2026-05-19 18:37:32,588 - optuna.study.study - INFO - Trial 260 finished with value: 0.07790852607978645 and parameters: {'n_layers': 1, 'embedding_dim': 256, 'lr': 0.0006429787614645586, 'lambda_val': 1.6200591200422194e-06, 'batch_size': 1098, 'optimizer': 'Adam'}. Best is trial 195 with value: 0.0829019064050288.
2026-05-19 18:37:43,003 - experiment_functions - INFO - Early stopping at epoch 1600. Best Recall: 0.0742
2026-05-19 18:37:43,107 - optuna.study.study - INFO - Trial 261 finished with value: 0.07420383580081276 and parameters: {'n_layers': 1, 'embedding_dim': 256, 'lr': 0.000538965602551451, 'lambda_val': 1.6517956993046608e-06, 'batch_size': 1119, 'optimizer': 'Adam'}. Best is trial 195 with value: 0.0829019064050288.
2026-05-19 18:37:51,374 - optuna.study._optimize - INFO - Trial 262 pruned. 
2026-05-19 18:37:55,397 - experiment_functions - INFO - Early stopping at epoch 500. Best Recall: 0.0041
2026-05-19 18:37:55,545 - optuna.study.study - INFO - Trial 263 finished with value: 0.004094905931898943 and parameters: {'n_layers': 1, 'embedding_dim': 256, 'lr': 0.00027999587425259675, 'lambda_val': 2.4870246301440713e-06, 'batch_size': 1100, 'optimizer': 'SGD'}. Best is trial 195 with value: 0.0829019064050288.
2026-05-19 18:38:03,394 - optuna.study._optimize - INFO - Trial 264 pruned. 
2026-05-19 18:38:13,144 - optuna.study._optimize - INFO - Trial 265 pruned. 
2026-05-19 18:38:20,711 - optuna.study._optimize - INFO - Trial 266 pruned. 
2026-05-19 18:38:43,263 - experiment_functions - INFO - Early stopping at epoch 3400. Best Recall: 0.0872
2026-05-19 18:38:43,362 - optuna.study.study - INFO - Trial 267 finished with value: 0.08722017428793943 and parameters: {'n_layers': 1, 'embedding_dim': 256, 'lr': 0.0006471612370182435, 'lambda_val': 1.2969004803070332e-06, 'batch_size': 1167, 'optimizer': 'Adam'}. Best is trial 267 with value: 0.08722017428793943.
2026-05-19 18:38:58,276 - experiment_functions - INFO - Early stopping at epoch 2050. Best Recall: 0.0767
2026-05-19 18:38:58,381 - optuna.study.study - INFO - Trial 268 finished with value: 0.07668156700901375 and parameters: {'n_layers': 1, 'embedding_dim': 256, 'lr': 0.0006795788069406017, 'lambda_val': 1.2978587715649118e-06, 'batch_size': 1389, 'optimizer': 'Adam'}. Best is trial 267 with value: 0.08722017428793943.
2026-05-19 18:39:07,148 - experiment_functions - INFO - Early stopping at epoch 850. Best Recall: 0.0714
2026-05-19 18:39:07,276 - optuna.study.study - INFO - Trial 269 finished with value: 0.07140120519652587 and parameters: {'n_layers': 1, 'embedding_dim': 256, 'lr': 0.000830820203576171, 'lambda_val': 1.3318223507700365e-06, 'batch_size': 1393, 'optimizer': 'Adam'}. Best is trial 267 with value: 0.08722017428793943.
2026-05-19 18:39:20,942 - experiment_functions - INFO - Early stopping at epoch 1850. Best Recall: 0.0779
2026-05-19 18:39:21,047 - optuna.study.study - INFO - Trial 270 finished with value: 0.07793173191924604 and parameters: {'n_layers': 1, 'embedding_dim': 256, 'lr': 0.0006876803037609464, 'lambda_val': 1.2281387613271796e-06, 'batch_size': 1315, 'optimizer': 'Adam'}. Best is trial 267 with value: 0.08722017428793943.
2026-05-19 18:39:29,402 - optuna.study._optimize - INFO - Trial 271 pruned. 
2026-05-19 18:39:36,245 - experiment_functions - INFO - Early stopping at epoch 800. Best Recall: 0.0686
2026-05-19 18:39:36,327 - optuna.study.study - INFO - Trial 272 finished with value: 0.06855250990042507 and parameters: {'n_layers': 1, 'embedding_dim': 256, 'lr': 0.0010135806049213056, 'lambda_val': 1.285699201816549e-06, 'batch_size': 1439, 'optimizer': 'Adam'}. Best is trial 267 with value: 0.08722017428793943.
2026-05-19 18:39:40,191 - experiment_functions - INFO - Early stopping at epoch 500. Best Recall: 0.0014
2026-05-19 18:39:40,716 - optuna.study.study - INFO - Trial 273 finished with value: 0.001421747580838988 and parameters: {'n_layers': 1, 'embedding_dim': 256, 'lr': 1.0076526441752841e-05, 'lambda_val': 1.2863563149631658e-06, 'batch_size': 1184, 'optimizer': 'Adam'}. Best is trial 267 with value: 0.08722017428793943.
2026-05-19 18:39:47,336 - experiment_functions - INFO - Early stopping at epoch 700. Best Recall: 0.0354
2026-05-19 18:39:47,440 - optuna.study.study - INFO - Trial 274 finished with value: 0.03540147975954106 and parameters: {'n_layers': 3, 'embedding_dim': 256, 'lr': 0.0006831923179924975, 'lambda_val': 1.8426788641182002e-06, 'batch_size': 1292, 'optimizer': 'Adam'}. Best is trial 267 with value: 0.08722017428793943.
2026-05-19 18:40:12,418 - experiment_functions - INFO - Early stopping at epoch 3400. Best Recall: 0.0865
2026-05-19 18:40:12,511 - optuna.study.study - INFO - Trial 275 finished with value: 0.08645713413667216 and parameters: {'n_layers': 1, 'embedding_dim': 256, 'lr': 0.0006326383979434212, 'lambda_val': 1.5698161790705874e-06, 'batch_size': 1156, 'optimizer': 'Adam'}. Best is trial 267 with value: 0.08722017428793943.
2026-05-19 18:40:32,232 - experiment_functions - INFO - Early stopping at epoch 3000. Best Recall: 0.0772
2026-05-19 18:40:32,381 - optuna.study.study - INFO - Trial 276 finished with value: 0.0772075676809327 and parameters: {'n_layers': 1, 'embedding_dim': 256, 'lr': 0.0005933895495565604, 'lambda_val': 1.5378735048163557e-06, 'batch_size': 1153, 'optimizer': 'Adam'}. Best is trial 267 with value: 0.08722017428793943.
2026-05-19 18:40:56,887 - experiment_functions - INFO - Early stopping at epoch 2150. Best Recall: 0.0734
2026-05-19 18:40:56,990 - optuna.study.study - INFO - Trial 277 finished with value: 0.07343389297289862 and parameters: {'n_layers': 1, 'embedding_dim': 256, 'lr': 0.0006223026245034956, 'lambda_val': 1.6363205439453654e-06, 'batch_size': 1179, 'optimizer': 'Adam'}. Best is trial 267 with value: 0.08722017428793943.
2026-05-19 18:41:15,768 - experiment_functions - INFO - Early stopping at epoch 2700. Best Recall: 0.0751
2026-05-19 18:41:15,872 - optuna.study.study - INFO - Trial 278 finished with value: 0.07508774692144166 and parameters: {'n_layers': 1, 'embedding_dim': 256, 'lr': 0.0005708014908195601, 'lambda_val': 1.2821239126593e-06, 'batch_size': 1115, 'optimizer': 'Adam'}. Best is trial 267 with value: 0.08722017428793943.
2026-05-19 18:41:28,711 - experiment_functions - INFO - Early stopping at epoch 2000. Best Recall: 0.0735
2026-05-19 18:41:28,805 - optuna.study.study - INFO - Trial 279 finished with value: 0.07353865060204705 and parameters: {'n_layers': 1, 'embedding_dim': 256, 'lr': 0.0006487824163201373, 'lambda_val': 1.5335324657188546e-06, 'batch_size': 1358, 'optimizer': 'Adam'}. Best is trial 267 with value: 0.08722017428793943.
2026-05-19 18:41:36,169 - experiment_functions - INFO - Early stopping at epoch 1000. Best Recall: 0.0697
2026-05-19 18:41:36,318 - optuna.study.study - INFO - Trial 280 finished with value: 0.06969577232690395 and parameters: {'n_layers': 1, 'embedding_dim': 256, 'lr': 0.0008495893649077637, 'lambda_val': 1.271827830648608e-06, 'batch_size': 1209, 'optimizer': 'Adam'}. Best is trial 267 with value: 0.08722017428793943.
2026-05-19 18:41:44,137 - optuna.study._optimize - INFO - Trial 281 pruned. 
2026-05-19 18:41:48,031 - experiment_functions - INFO - Early stopping at epoch 500. Best Recall: 0.0034
2026-05-19 18:41:48,136 - optuna.study.study - INFO - Trial 282 finished with value: 0.003386414372983562 and parameters: {'n_layers': 1, 'embedding_dim': 256, 'lr': 0.0007722745657694291, 'lambda_val': 1.8171183240881125e-06, 'batch_size': 1268, 'optimizer': 'SGD'}. Best is trial 267 with value: 0.08722017428793943.
2026-05-19 18:41:58,021 - experiment_functions - INFO - Early stopping at epoch 1150. Best Recall: 0.0751
2026-05-19 18:41:58,112 - optuna.study.study - INFO - Trial 283 finished with value: 0.07512508013904291 and parameters: {'n_layers': 1, 'embedding_dim': 256, 'lr': 0.0005558357358975605, 'lambda_val': 1.5833911922990109e-06, 'batch_size': 1177, 'optimizer': 'Adam'}. Best is trial 267 with value: 0.08722017428793943.
2026-05-19 18:42:10,352 - experiment_functions - INFO - Early stopping at epoch 2000. Best Recall: 0.0839
2026-05-19 18:42:10,457 - optuna.study.study - INFO - Trial 284 finished with value: 0.0839305073483432 and parameters: {'n_layers': 1, 'embedding_dim': 256, 'lr': 0.0006721921370918768, 'lambda_val': 1.2473238770547637e-06, 'batch_size': 1094, 'optimizer': 'Adam'}. Best is trial 267 with value: 0.08722017428793943.
2026-05-19 18:42:23,015 - experiment_functions - INFO - Early stopping at epoch 1850. Best Recall: 0.0848
2026-05-19 18:42:23,214 - optuna.study.study - INFO - Trial 285 finished with value: 0.08475736902309638 and parameters: {'n_layers': 1, 'embedding_dim': 256, 'lr': 0.0009004128195355318, 'lambda_val': 1.3081165040946072e-06, 'batch_size': 1096, 'optimizer': 'Adam'}. Best is trial 267 with value: 0.08722017428793943.
2026-05-19 18:42:38,969 - experiment_functions - INFO - Early stopping at epoch 2300. Best Recall: 0.0744
2026-05-19 18:42:39,074 - optuna.study.study - INFO - Trial 286 finished with value: 0.07440705469520173 and parameters: {'n_layers': 1, 'embedding_dim': 256, 'lr': 0.000982184303025556, 'lambda_val': 1.2719395786365066e-06, 'batch_size': 1078, 'optimizer': 'Adam'}. Best is trial 267 with value: 0.08722017428793943.
2026-05-19 18:42:48,767 - experiment_functions - INFO - Early stopping at epoch 1400. Best Recall: 0.0725
2026-05-19 18:42:48,937 - optuna.study.study - INFO - Trial 287 finished with value: 0.07253294305812429 and parameters: {'n_layers': 1, 'embedding_dim': 256, 'lr': 0.0011190906014971861, 'lambda_val': 1.0107530633155319e-06, 'batch_size': 1130, 'optimizer': 'Adam'}. Best is trial 267 with value: 0.08722017428793943.
2026-05-19 18:43:07,377 - experiment_functions - INFO - Early stopping at epoch 2550. Best Recall: 0.0797
2026-05-19 18:43:07,482 - optuna.study.study - INFO - Trial 288 finished with value: 0.0797126840622037 and parameters: {'n_layers': 1, 'embedding_dim': 256, 'lr': 0.0008843073792279113, 'lambda_val': 1.9155603343859186e-06, 'batch_size': 1057, 'optimizer': 'Adam'}. Best is trial 267 with value: 0.08722017428793943.
2026-05-19 18:43:31,622 - experiment_functions - INFO - Early stopping at epoch 2300. Best Recall: 0.0747
2026-05-19 18:43:31,739 - optuna.study.study - INFO - Trial 289 finished with value: 0.07469228813619105 and parameters: {'n_layers': 1, 'embedding_dim': 256, 'lr': 0.0010252396902314094, 'lambda_val': 1.9474734926747363e-06, 'batch_size': 1071, 'optimizer': 'Adam'}. Best is trial 267 with value: 0.08722017428793943.
2026-05-19 18:43:38,553 - experiment_functions - INFO - Early stopping at epoch 600. Best Recall: 0.0336
2026-05-19 18:43:38,702 - optuna.study.study - INFO - Trial 290 finished with value: 0.033573133319357 and parameters: {'n_layers': 4, 'embedding_dim': 256, 'lr': 0.0008798424232073812, 'lambda_val': 2.4860631612479184e-06, 'batch_size': 1038, 'optimizer': 'Adam'}. Best is trial 267 with value: 0.08722017428793943.
2026-05-19 18:43:49,399 - experiment_functions - INFO - Early stopping at epoch 1250. Best Recall: 0.0716
2026-05-19 18:43:50,827 - optuna.study.study - INFO - Trial 291 finished with value: 0.07157711797264171 and parameters: {'n_layers': 1, 'embedding_dim': 256, 'lr': 0.0008463606344457557, 'lambda_val': 1.6423819927307339e-06, 'batch_size': 1004, 'optimizer': 'Adam'}. Best is trial 267 with value: 0.08722017428793943.
2026-05-19 18:44:01,540 - experiment_functions - INFO - Early stopping at epoch 1600. Best Recall: 0.0739
2026-05-19 18:44:01,643 - optuna.study.study - INFO - Trial 292 finished with value: 0.07391451858052035 and parameters: {'n_layers': 1, 'embedding_dim': 256, 'lr': 0.0007213018043573089, 'lambda_val': 1.8991193379456756e-06, 'batch_size': 1086, 'optimizer': 'Adam'}. Best is trial 267 with value: 0.08722017428793943.
2026-05-19 18:44:22,633 - experiment_functions - INFO - Early stopping at epoch 1450. Best Recall: 0.0766
2026-05-19 18:44:22,724 - optuna.study.study - INFO - Trial 293 finished with value: 0.07655496806798799 and parameters: {'n_layers': 1, 'embedding_dim': 256, 'lr': 0.0011650827055950112, 'lambda_val': 1.4309348629183184e-06, 'batch_size': 1148, 'optimizer': 'Adam'}. Best is trial 267 with value: 0.08722017428793943.
2026-05-19 18:44:37,876 - experiment_functions - INFO - Early stopping at epoch 2200. Best Recall: 0.0787
2026-05-19 18:44:37,977 - optuna.study.study - INFO - Trial 294 finished with value: 0.07865283669178534 and parameters: {'n_layers': 1, 'embedding_dim': 256, 'lr': 0.0007345999288210423, 'lambda_val': 2.665912540315065e-06, 'batch_size': 912, 'optimizer': 'Adam'}. Best is trial 267 with value: 0.08722017428793943.
2026-05-19 18:44:46,570 - experiment_functions - INFO - Early stopping at epoch 1150. Best Recall: 0.0715
2026-05-19 18:44:46,663 - optuna.study.study - INFO - Trial 295 finished with value: 0.07150890190317742 and parameters: {'n_layers': 1, 'embedding_dim': 256, 'lr': 0.0013774475543406428, 'lambda_val': 2.634452484014156e-06, 'batch_size': 898, 'optimizer': 'Adam'}. Best is trial 267 with value: 0.08722017428793943.
2026-05-19 18:44:55,971 - experiment_functions - INFO - Early stopping at epoch 1350. Best Recall: 0.0722
2026-05-19 18:44:56,072 - optuna.study.study - INFO - Trial 296 finished with value: 0.07217695023349946 and parameters: {'n_layers': 1, 'embedding_dim': 256, 'lr': 0.0009283419410735473, 'lambda_val': 2.0583126502153554e-06, 'batch_size': 951, 'optimizer': 'Adam'}. Best is trial 267 with value: 0.08722017428793943.
2026-05-19 18:45:08,464 - experiment_functions - INFO - Early stopping at epoch 1350. Best Recall: 0.0719
2026-05-19 18:45:09,231 - optuna.study.study - INFO - Trial 297 finished with value: 0.07186508431334174 and parameters: {'n_layers': 1, 'embedding_dim': 256, 'lr': 0.0007484469443583295, 'lambda_val': 0.0003689962076390985, 'batch_size': 1014, 'optimizer': 'Adam'}. Best is trial 267 with value: 0.08722017428793943.
2026-05-19 18:45:44,837 - optuna.study.study - INFO - Trial 298 finished with value: 0.08199873562411138 and parameters: {'n_layers': 1, 'embedding_dim': 256, 'lr': 0.0006946214913650229, 'lambda_val': 3.463497694151803e-06, 'batch_size': 904, 'optimizer': 'Adam'}. Best is trial 267 with value: 0.08722017428793943.
2026-05-19 18:45:55,107 - experiment_functions - INFO - Early stopping at epoch 1500. Best Recall: 0.0752
2026-05-19 18:45:55,207 - optuna.study.study - INFO - Trial 299 finished with value: 0.07524164929569527 and parameters: {'n_layers': 1, 'embedding_dim': 256, 'lr': 0.0007879624198408707, 'lambda_val': 3.427187062345109e-06, 'batch_size': 850, 'optimizer': 'Adam'}. Best is trial 267 with value: 0.08722017428793943.
2026-05-19 18:45:55,208 - experiment_functions - INFO - Training the best model ... for e_100K_1c1dcs
2026-05-19 18:46:03,872 - experiment_functions - INFO - Early stopping at epoch 2100. Best Recall: 0.0717
2026-05-19 18:46:03,974 - root - INFO -   **** Training e_100K_1c1dcs_rand1
2026-05-19 18:46:03,988 - root - INFO -   **** Getting 65267/81200 random edges
2026-05-19 18:46:04,001 - experiment_functions - INFO - Training the best model ... for e_100K_1c1dcs_rand1
2026-05-19 18:46:11,613 - experiment_functions - INFO - Early stopping at epoch 1850. Best Recall: 0.1284
2026-05-19 18:46:11,718 - root - INFO -   **** Training e_100K_1c1dcs_rand2
2026-05-19 18:46:11,730 - root - INFO -   **** Getting 65267/81200 random edges
2026-05-19 18:46:11,743 - experiment_functions - INFO - Training the best model ... for e_100K_1c1dcs_rand2
2026-05-19 18:46:17,938 - experiment_functions - INFO - Early stopping at epoch 1500. Best Recall: 0.1265
2026-05-19 18:46:18,043 - root - INFO -   **** Training e_100K_1c1dcs_rand3
2026-05-19 18:46:18,056 - root - INFO -   **** Getting 65267/81200 random edges
2026-05-19 18:46:18,068 - experiment_functions - INFO - Training the best model ... for e_100K_1c1dcs_rand3
2026-05-19 18:46:25,367 - experiment_functions - INFO - Early stopping at epoch 1800. Best Recall: 0.1151
2026-05-19 18:46:25,473 - root - INFO -   **** Training e_100K_1c1dcs_rand4
2026-05-19 18:46:25,487 - root - INFO -   **** Getting 65267/81200 random edges
2026-05-19 18:46:25,499 - experiment_functions - INFO - Training the best model ... for e_100K_1c1dcs_rand4
2026-05-19 18:46:31,882 - experiment_functions - INFO - Early stopping at epoch 1550. Best Recall: 0.1274
2026-05-19 18:46:31,989 - root - INFO -   **** Training e_100K_1c1dcs_rand5
2026-05-19 18:46:32,002 - root - INFO -   **** Getting 65267/81200 random edges
2026-05-19 18:46:32,015 - experiment_functions - INFO - Training the best model ... for e_100K_1c1dcs_rand5
2026-05-19 18:46:38,520 - experiment_functions - INFO - Early stopping at epoch 1800. Best Recall: 0.1224
2026-05-19 18:46:38,627 - root - INFO - **** Training e_100K_1c2dcs
2026-05-19 18:46:38,627 - root - INFO -   ** 2-Dominant stats:
2026-05-19 18:46:38,627 - root - INFO -   ** Finding the dominant set:
2026-05-19 18:47:03,334 - root - INFO -   ** Getting the trainable edges:
2026-05-19 18:47:03,339 - helper_functions - INFO -      Number of nodes: 4003
2026-05-19 18:47:03,339 - helper_functions - INFO -      Ratio: 0.3873621056706019
2026-05-19 18:47:03,339 - helper_functions - INFO -      Number of unique users: 324
2026-05-19 18:47:03,339 - helper_functions - INFO -      Number of unique items: 3679
2026-05-19 18:47:03,339 - helper_functions - INFO -      Total dominant set edge: 13252
2026-05-19 18:47:03,339 - helper_functions - INFO -      Trainable edges: 10601.6
2026-05-19 18:47:03,342 - root - INFO -   **** Getting 13252 dominant set edges
2026-05-19 18:47:03,956 - optuna.storages._rdb.storage - INFO - A new study created in RDB with name: Study_e_100K_1c2dcs_strict
2026-05-19 18:47:08,577 - experiment_functions - INFO - Early stopping at epoch 750. Best Recall: 0.0010
2026-05-19 18:47:08,730 - optuna.study.study - INFO - Trial 0 finished with value: 0.0010486596465568208 and parameters: {'n_layers': 3, 'embedding_dim': 128, 'lr': 0.05565831258751771, 'lambda_val': 0.005941835495177337, 'batch_size': 2964, 'optimizer': 'Adam'}. Best is trial 0 with value: 0.0010486596465568208.
2026-05-19 18:47:12,146 - experiment_functions - INFO - Early stopping at epoch 500. Best Recall: 0.0037
2026-05-19 18:47:12,242 - optuna.study.study - INFO - Trial 1 finished with value: 0.0036738509528393393 and parameters: {'n_layers': 2, 'embedding_dim': 64, 'lr': 0.04135101425085399, 'lambda_val': 0.0018473214611751127, 'batch_size': 2308, 'optimizer': 'Adam'}. Best is trial 1 with value: 0.0036738509528393393.
2026-05-19 18:47:23,990 - experiment_functions - INFO - Early stopping at epoch 500. Best Recall: 0.0028
