2026-05-19 18:06:56,600 - optuna.study.study - INFO - Trial 106 finished with value: 0.06446368669984896 and parameters: {'n_layers': 1, 'embedding_dim': 128, 'lr': 0.00046442906038748547, 'lambda_val': 3.205773694162855e-05, 'batch_size': 3667, 'optimizer': 'RMSprop'}. Best is trial 102 with value: 0.07694132707582149.
2026-05-19 18:07:16,851 - optuna.study._optimize - INFO - Trial 107 pruned. 
2026-05-19 18:07:23,123 - optuna.study._optimize - INFO - Trial 108 pruned. 
2026-05-19 18:07:26,637 - experiment_functions - INFO - Early stopping at epoch 500. Best Recall: 0.0024
2026-05-19 18:07:26,728 - optuna.study.study - INFO - Trial 109 finished with value: 0.0023836388941454473 and parameters: {'n_layers': 1, 'embedding_dim': 128, 'lr': 0.0006368624385200168, 'lambda_val': 1.6111475219898282e-05, 'batch_size': 3509, 'optimizer': 'SGD'}. Best is trial 102 with value: 0.07694132707582149.
2026-05-19 18:07:39,434 - experiment_functions - INFO - Early stopping at epoch 1500. Best Recall: 0.0662
2026-05-19 18:07:39,533 - optuna.study.study - INFO - Trial 110 finished with value: 0.06615304957136382 and parameters: {'n_layers': 1, 'embedding_dim': 128, 'lr': 0.0003140922591101042, 'lambda_val': 6.515338701998884e-06, 'batch_size': 3303, 'optimizer': 'RMSprop'}. Best is trial 102 with value: 0.07694132707582149.
2026-05-19 18:07:50,882 - optuna.study._optimize - INFO - Trial 111 pruned. 
2026-05-19 18:08:06,054 - experiment_functions - INFO - Early stopping at epoch 1700. Best Recall: 0.0666
2026-05-19 18:08:06,143 - optuna.study.study - INFO - Trial 112 finished with value: 0.06658725270744761 and parameters: {'n_layers': 1, 'embedding_dim': 128, 'lr': 0.00040725341555168047, 'lambda_val': 1.2650053329973607e-05, 'batch_size': 3384, 'optimizer': 'RMSprop'}. Best is trial 102 with value: 0.07694132707582149.
2026-05-19 18:08:24,409 - optuna.study._optimize - INFO - Trial 113 pruned. 
2026-05-19 18:08:32,030 - optuna.study._optimize - INFO - Trial 114 pruned. 
2026-05-19 18:08:50,950 - experiment_functions - INFO - Early stopping at epoch 1350. Best Recall: 0.0636
2026-05-19 18:08:51,057 - optuna.study.study - INFO - Trial 115 finished with value: 0.06356360643009006 and parameters: {'n_layers': 1, 'embedding_dim': 96, 'lr': 0.0004038803607331899, 'lambda_val': 2.0680418217728764e-05, 'batch_size': 3569, 'optimizer': 'RMSprop'}. Best is trial 102 with value: 0.07694132707582149.
2026-05-19 18:09:02,676 - optuna.study._optimize - INFO - Trial 116 pruned. 
2026-05-19 18:09:16,678 - experiment_functions - INFO - Early stopping at epoch 1750. Best Recall: 0.0641
2026-05-19 18:09:16,794 - optuna.study.study - INFO - Trial 117 finished with value: 0.06414379018873874 and parameters: {'n_layers': 1, 'embedding_dim': 128, 'lr': 0.0003494330929653968, 'lambda_val': 1.0309564386302515e-05, 'batch_size': 4090, 'optimizer': 'RMSprop'}. Best is trial 102 with value: 0.07694132707582149.
2026-05-19 18:09:29,475 - optuna.study._optimize - INFO - Trial 118 pruned. 
2026-05-19 18:09:38,477 - optuna.study._optimize - INFO - Trial 119 pruned. 
2026-05-19 18:09:50,304 - experiment_functions - INFO - Early stopping at epoch 1350. Best Recall: 0.0641
2026-05-19 18:09:50,429 - optuna.study.study - INFO - Trial 120 finished with value: 0.06411578414239633 and parameters: {'n_layers': 1, 'embedding_dim': 128, 'lr': 0.0004885043995058404, 'lambda_val': 3.461225080725744e-06, 'batch_size': 3370, 'optimizer': 'RMSprop'}. Best is trial 102 with value: 0.07694132707582149.
2026-05-19 18:10:07,507 - experiment_functions - INFO - Early stopping at epoch 900. Best Recall: 0.0646
2026-05-19 18:10:07,668 - optuna.study.study - INFO - Trial 121 finished with value: 0.06455082215715607 and parameters: {'n_layers': 1, 'embedding_dim': 128, 'lr': 0.0006578749845206069, 'lambda_val': 8.027858570453019e-06, 'batch_size': 3377, 'optimizer': 'RMSprop'}. Best is trial 102 with value: 0.07694132707582149.
2026-05-19 18:10:25,070 - experiment_functions - INFO - Early stopping at epoch 1050. Best Recall: 0.0606
2026-05-19 18:10:25,209 - optuna.study.study - INFO - Trial 122 finished with value: 0.060591085497898226 and parameters: {'n_layers': 1, 'embedding_dim': 128, 'lr': 0.0006238022143657784, 'lambda_val': 1.1949586357859172e-05, 'batch_size': 3242, 'optimizer': 'RMSprop'}. Best is trial 102 with value: 0.07694132707582149.
2026-05-19 18:10:40,546 - experiment_functions - INFO - Early stopping at epoch 2150. Best Recall: 0.0678
2026-05-19 18:10:40,680 - optuna.study.study - INFO - Trial 123 finished with value: 0.06775510602194947 and parameters: {'n_layers': 1, 'embedding_dim': 128, 'lr': 0.0002432111208909579, 'lambda_val': 6.190792372944384e-06, 'batch_size': 3401, 'optimizer': 'RMSprop'}. Best is trial 102 with value: 0.07694132707582149.
2026-05-19 18:10:58,696 - experiment_functions - INFO - Early stopping at epoch 2050. Best Recall: 0.0690
2026-05-19 18:10:58,807 - optuna.study.study - INFO - Trial 124 finished with value: 0.06897194362586148 and parameters: {'n_layers': 1, 'embedding_dim': 128, 'lr': 0.00024037328674788604, 'lambda_val': 4.887087863531125e-06, 'batch_size': 3396, 'optimizer': 'RMSprop'}. Best is trial 102 with value: 0.07694132707582149.
2026-05-19 18:11:05,863 - optuna.study._optimize - INFO - Trial 125 pruned. 
2026-05-19 18:11:16,857 - optuna.study._optimize - INFO - Trial 126 pruned. 
2026-05-19 18:11:24,685 - optuna.study._optimize - INFO - Trial 127 pruned. 
2026-05-19 18:11:43,895 - experiment_functions - INFO - Early stopping at epoch 3100. Best Recall: 0.0684
2026-05-19 18:11:43,995 - optuna.study.study - INFO - Trial 128 finished with value: 0.06837241305660323 and parameters: {'n_layers': 1, 'embedding_dim': 96, 'lr': 0.00029239303844322837, 'lambda_val': 2.9356206953545207e-06, 'batch_size': 3534, 'optimizer': 'RMSprop'}. Best is trial 102 with value: 0.07694132707582149.
2026-05-19 18:12:02,516 - optuna.study._optimize - INFO - Trial 129 pruned. 
2026-05-19 18:12:09,169 - optuna.study._optimize - INFO - Trial 130 pruned. 
2026-05-19 18:12:18,981 - optuna.study._optimize - INFO - Trial 131 pruned. 
2026-05-19 18:12:25,124 - optuna.study._optimize - INFO - Trial 132 pruned. 
2026-05-19 18:12:34,552 - experiment_functions - INFO - Early stopping at epoch 1600. Best Recall: 0.0656
2026-05-19 18:12:34,854 - optuna.study.study - INFO - Trial 133 finished with value: 0.06564351837695892 and parameters: {'n_layers': 1, 'embedding_dim': 128, 'lr': 0.0003334128507763138, 'lambda_val': 1.3230408262551336e-05, 'batch_size': 3734, 'optimizer': 'RMSprop'}. Best is trial 102 with value: 0.07694132707582149.
2026-05-19 18:12:41,303 - experiment_functions - INFO - Early stopping at epoch 1050. Best Recall: 0.0661
2026-05-19 18:12:41,392 - optuna.study.study - INFO - Trial 134 finished with value: 0.06613580404622582 and parameters: {'n_layers': 1, 'embedding_dim': 128, 'lr': 0.00039972267750236127, 'lambda_val': 1.3680004656455358e-05, 'batch_size': 3730, 'optimizer': 'RMSprop'}. Best is trial 102 with value: 0.07694132707582149.
2026-05-19 18:12:47,750 - experiment_functions - INFO - Early stopping at epoch 800. Best Recall: 0.0689
2026-05-19 18:12:47,864 - optuna.study.study - INFO - Trial 135 finished with value: 0.06891120181230972 and parameters: {'n_layers': 1, 'embedding_dim': 128, 'lr': 0.0011048791962606315, 'lambda_val': 9.09585616026683e-06, 'batch_size': 3731, 'optimizer': 'RMSprop'}. Best is trial 102 with value: 0.07694132707582149.
2026-05-19 18:12:53,571 - experiment_functions - INFO - Early stopping at epoch 500. Best Recall: 0.0030
2026-05-19 18:12:53,706 - optuna.study.study - INFO - Trial 136 finished with value: 0.003035950959452496 and parameters: {'n_layers': 1, 'embedding_dim': 96, 'lr': 0.000990503469112662, 'lambda_val': 4.206839563933544e-06, 'batch_size': 3171, 'optimizer': 'SGD'}. Best is trial 102 with value: 0.07694132707582149.
2026-05-19 18:13:00,788 - experiment_functions - INFO - Early stopping at epoch 1050. Best Recall: 0.0692
2026-05-19 18:13:00,887 - optuna.study.study - INFO - Trial 137 finished with value: 0.06924087518573688 and parameters: {'n_layers': 1, 'embedding_dim': 128, 'lr': 0.000539874524692237, 'lambda_val': 1.8295828788314644e-06, 'batch_size': 3594, 'optimizer': 'RMSprop'}. Best is trial 102 with value: 0.07694132707582149.
2026-05-19 18:13:07,371 - experiment_functions - INFO - Early stopping at epoch 1000. Best Recall: 0.0613
2026-05-19 18:13:07,563 - optuna.study.study - INFO - Trial 138 finished with value: 0.06126659401324562 and parameters: {'n_layers': 1, 'embedding_dim': 128, 'lr': 0.0011996168735639646, 'lambda_val': 1.9229850629397613e-06, 'batch_size': 3408, 'optimizer': 'RMSprop'}. Best is trial 102 with value: 0.07694132707582149.
2026-05-19 18:13:14,140 - experiment_functions - INFO - Early stopping at epoch 1000. Best Recall: 0.0671
2026-05-19 18:13:14,298 - optuna.study.study - INFO - Trial 139 finished with value: 0.06706806200120377 and parameters: {'n_layers': 1, 'embedding_dim': 128, 'lr': 0.0006116594442904094, 'lambda_val': 2.8721759326429354e-06, 'batch_size': 3601, 'optimizer': 'RMSprop'}. Best is trial 102 with value: 0.07694132707582149.
2026-05-19 18:13:20,904 - optuna.study._optimize - INFO - Trial 140 pruned. 
2026-05-19 18:13:28,388 - experiment_functions - INFO - Early stopping at epoch 1000. Best Recall: 0.0740
2026-05-19 18:13:28,479 - optuna.study.study - INFO - Trial 141 finished with value: 0.07404343479354394 and parameters: {'n_layers': 1, 'embedding_dim': 128, 'lr': 0.0005347067374618694, 'lambda_val': 3.0138672269612795e-06, 'batch_size': 3615, 'optimizer': 'RMSprop'}. Best is trial 102 with value: 0.07694132707582149.
2026-05-19 18:13:40,100 - experiment_functions - INFO - Early stopping at epoch 800. Best Recall: 0.0642
2026-05-19 18:13:40,199 - optuna.study.study - INFO - Trial 142 finished with value: 0.06418507032855374 and parameters: {'n_layers': 1, 'embedding_dim': 128, 'lr': 0.0007708319426346107, 'lambda_val': 2.6542862843251937e-06, 'batch_size': 3626, 'optimizer': 'RMSprop'}. Best is trial 102 with value: 0.07694132707582149.
2026-05-19 18:13:44,994 - experiment_functions - INFO - Early stopping at epoch 700. Best Recall: 0.0664
2026-05-19 18:13:45,094 - optuna.study.study - INFO - Trial 143 finished with value: 0.06643611152531152 and parameters: {'n_layers': 1, 'embedding_dim': 128, 'lr': 0.0010231603651479947, 'lambda_val': 1.2086739145600052e-06, 'batch_size': 3478, 'optimizer': 'RMSprop'}. Best is trial 102 with value: 0.07694132707582149.
2026-05-19 18:13:51,905 - optuna.study._optimize - INFO - Trial 144 pruned. 
2026-05-19 18:13:59,497 - optuna.study._optimize - INFO - Trial 145 pruned. 
2026-05-19 18:14:14,584 - experiment_functions - INFO - Early stopping at epoch 950. Best Recall: 0.0728
2026-05-19 18:14:15,345 - optuna.study.study - INFO - Trial 146 finished with value: 0.07275401821169049 and parameters: {'n_layers': 1, 'embedding_dim': 128, 'lr': 0.0008978451829353394, 'lambda_val': 2.383387334469576e-06, 'batch_size': 1531, 'optimizer': 'Adam'}. Best is trial 102 with value: 0.07694132707582149.
2026-05-19 18:14:27,801 - optuna.study._optimize - INFO - Trial 147 pruned. 
2026-05-19 18:14:33,623 - experiment_functions - INFO - Early stopping at epoch 950. Best Recall: 0.0663
2026-05-19 18:14:33,754 - optuna.study.study - INFO - Trial 148 finished with value: 0.06629117158396243 and parameters: {'n_layers': 1, 'embedding_dim': 32, 'lr': 0.0010602674045599267, 'lambda_val': 2.296489038207849e-06, 'batch_size': 1540, 'optimizer': 'Adam'}. Best is trial 102 with value: 0.07694132707582149.
2026-05-19 18:14:45,783 - experiment_functions - INFO - Early stopping at epoch 1750. Best Recall: 0.0685
2026-05-19 18:14:45,875 - optuna.study.study - INFO - Trial 149 finished with value: 0.06846054997102775 and parameters: {'n_layers': 1, 'embedding_dim': 128, 'lr': 0.0019237568501174185, 'lambda_val': 2.8803121556054807e-06, 'batch_size': 1205, 'optimizer': 'Adam'}. Best is trial 102 with value: 0.07694132707582149.
2026-05-19 18:15:08,941 - experiment_functions - INFO - Early stopping at epoch 1800. Best Recall: 0.0676
2026-05-19 18:15:09,040 - optuna.study.study - INFO - Trial 150 finished with value: 0.06761297113905727 and parameters: {'n_layers': 1, 'embedding_dim': 128, 'lr': 0.0007594597563548, 'lambda_val': 2.8871281619794477e-06, 'batch_size': 1195, 'optimizer': 'Adam'}. Best is trial 102 with value: 0.07694132707582149.
2026-05-19 18:15:29,422 - experiment_functions - INFO - Early stopping at epoch 750. Best Recall: 0.0654
2026-05-19 18:15:29,520 - optuna.study.study - INFO - Trial 151 finished with value: 0.06535251631913964 and parameters: {'n_layers': 1, 'embedding_dim': 128, 'lr': 0.001872230684815887, 'lambda_val': 2.913602016069219e-06, 'batch_size': 1059, 'optimizer': 'Adam'}. Best is trial 102 with value: 0.07694132707582149.
2026-05-19 18:15:36,616 - experiment_functions - INFO - Early stopping at epoch 950. Best Recall: 0.0670
2026-05-19 18:15:36,706 - optuna.study.study - INFO - Trial 152 finished with value: 0.06697843269766679 and parameters: {'n_layers': 1, 'embedding_dim': 128, 'lr': 0.0013704351416403671, 'lambda_val': 3.857371274395251e-06, 'batch_size': 1171, 'optimizer': 'Adam'}. Best is trial 102 with value: 0.07694132707582149.
2026-05-19 18:15:42,991 - experiment_functions - INFO - Early stopping at epoch 1050. Best Recall: 0.0700
2026-05-19 18:15:43,247 - optuna.study.study - INFO - Trial 153 finished with value: 0.0700127126227418 and parameters: {'n_layers': 1, 'embedding_dim': 128, 'lr': 0.0007523425173224324, 'lambda_val': 1.8327320136326527e-06, 'batch_size': 1261, 'optimizer': 'Adam'}. Best is trial 102 with value: 0.07694132707582149.
2026-05-19 18:16:01,320 - experiment_functions - INFO - Early stopping at epoch 1300. Best Recall: 0.0785
2026-05-19 18:16:01,468 - optuna.study.study - INFO - Trial 154 finished with value: 0.07850153150208605 and parameters: {'n_layers': 1, 'embedding_dim': 128, 'lr': 0.0007580503579631821, 'lambda_val': 1.7700244056821765e-06, 'batch_size': 1230, 'optimizer': 'Adam'}. Best is trial 154 with value: 0.07850153150208605.
2026-05-19 18:16:12,215 - experiment_functions - INFO - Early stopping at epoch 1700. Best Recall: 0.0757
2026-05-19 18:16:12,317 - optuna.study.study - INFO - Trial 155 finished with value: 0.07574740940246205 and parameters: {'n_layers': 1, 'embedding_dim': 128, 'lr': 0.000727880602798981, 'lambda_val': 1.065526432028125e-06, 'batch_size': 1248, 'optimizer': 'Adam'}. Best is trial 154 with value: 0.07850153150208605.
2026-05-19 18:16:19,274 - experiment_functions - INFO - Early stopping at epoch 1250. Best Recall: 0.0644
2026-05-19 18:16:19,354 - optuna.study.study - INFO - Trial 156 finished with value: 0.06442886612587334 and parameters: {'n_layers': 1, 'embedding_dim': 128, 'lr': 0.0008135192651052964, 'lambda_val': 1.200622546040908e-06, 'batch_size': 1268, 'optimizer': 'Adam'}. Best is trial 154 with value: 0.07850153150208605.
2026-05-19 18:16:29,779 - experiment_functions - INFO - Early stopping at epoch 1850. Best Recall: 0.0695
2026-05-19 18:16:29,888 - optuna.study.study - INFO - Trial 157 finished with value: 0.06949845060074238 and parameters: {'n_layers': 1, 'embedding_dim': 128, 'lr': 0.0004975130969024918, 'lambda_val': 1.596750179407787e-06, 'batch_size': 976, 'optimizer': 'Adam'}. Best is trial 154 with value: 0.07850153150208605.
2026-05-19 18:16:42,978 - experiment_functions - INFO - Early stopping at epoch 2000. Best Recall: 0.0665
2026-05-19 18:16:43,079 - optuna.study.study - INFO - Trial 158 finished with value: 0.06653781687716857 and parameters: {'n_layers': 1, 'embedding_dim': 128, 'lr': 0.0005001893644739889, 'lambda_val': 1.7738034288575476e-06, 'batch_size': 1113, 'optimizer': 'Adam'}. Best is trial 154 with value: 0.07850153150208605.
2026-05-19 18:16:50,846 - optuna.study._optimize - INFO - Trial 159 pruned. 
2026-05-19 18:17:03,005 - experiment_functions - INFO - Early stopping at epoch 1400. Best Recall: 0.0724
2026-05-19 18:17:03,106 - optuna.study.study - INFO - Trial 160 finished with value: 0.07240112287047544 and parameters: {'n_layers': 1, 'embedding_dim': 128, 'lr': 0.0005480097813925128, 'lambda_val': 1.497729824313817e-06, 'batch_size': 966, 'optimizer': 'Adam'}. Best is trial 154 with value: 0.07850153150208605.
2026-05-19 18:17:18,178 - experiment_functions - INFO - Early stopping at epoch 2250. Best Recall: 0.0742
2026-05-19 18:17:18,267 - optuna.study.study - INFO - Trial 161 finished with value: 0.07420709163335618 and parameters: {'n_layers': 1, 'embedding_dim': 128, 'lr': 0.0005371123319974833, 'lambda_val': 1.495083711009373e-06, 'batch_size': 937, 'optimizer': 'Adam'}. Best is trial 154 with value: 0.07850153150208605.
2026-05-19 18:17:26,850 - experiment_functions - INFO - Early stopping at epoch 1500. Best Recall: 0.0777
2026-05-19 18:17:27,406 - optuna.study.study - INFO - Trial 162 finished with value: 0.07772354789023675 and parameters: {'n_layers': 1, 'embedding_dim': 128, 'lr': 0.0007270279963692045, 'lambda_val': 1.0506246898882752e-06, 'batch_size': 946, 'optimizer': 'Adam'}. Best is trial 154 with value: 0.07850153150208605.
2026-05-19 18:17:46,478 - experiment_functions - INFO - Early stopping at epoch 2150. Best Recall: 0.0705
2026-05-19 18:17:46,567 - optuna.study.study - INFO - Trial 163 finished with value: 0.07052447793248116 and parameters: {'n_layers': 1, 'embedding_dim': 128, 'lr': 0.0007449523695217748, 'lambda_val': 1.3942930510902901e-06, 'batch_size': 992, 'optimizer': 'Adam'}. Best is trial 154 with value: 0.07850153150208605.
2026-05-19 18:17:53,197 - experiment_functions - INFO - Early stopping at epoch 1050. Best Recall: 0.0673
2026-05-19 18:17:53,314 - optuna.study.study - INFO - Trial 164 finished with value: 0.06727834047220702 and parameters: {'n_layers': 1, 'embedding_dim': 128, 'lr': 0.0007208954843445728, 'lambda_val': 1.0331416333596267e-06, 'batch_size': 1016, 'optimizer': 'Adam'}. Best is trial 154 with value: 0.07850153150208605.
2026-05-19 18:18:05,775 - experiment_functions - INFO - Early stopping at epoch 2050. Best Recall: 0.0733
2026-05-19 18:18:06,535 - optuna.study.study - INFO - Trial 165 finished with value: 0.07329668270515005 and parameters: {'n_layers': 1, 'embedding_dim': 128, 'lr': 0.0007108712390264812, 'lambda_val': 1.6893713712266233e-06, 'batch_size': 937, 'optimizer': 'Adam'}. Best is trial 154 with value: 0.07850153150208605.
2026-05-19 18:18:24,401 - experiment_functions - INFO - Early stopping at epoch 1550. Best Recall: 0.0742
2026-05-19 18:18:24,539 - optuna.study.study - INFO - Trial 166 finished with value: 0.07423477002775164 and parameters: {'n_layers': 1, 'embedding_dim': 128, 'lr': 0.0006834203646717841, 'lambda_val': 1.3997470590023768e-06, 'batch_size': 934, 'optimizer': 'Adam'}. Best is trial 154 with value: 0.07850153150208605.
2026-05-19 18:18:41,021 - experiment_functions - INFO - Early stopping at epoch 2400. Best Recall: 0.0814
2026-05-19 18:18:41,125 - optuna.study.study - INFO - Trial 167 finished with value: 0.08140932730716424 and parameters: {'n_layers': 1, 'embedding_dim': 128, 'lr': 0.00066011661954575, 'lambda_val': 1.6286791343891086e-06, 'batch_size': 970, 'optimizer': 'Adam'}. Best is trial 167 with value: 0.08140932730716424.
2026-05-19 18:18:48,943 - experiment_functions - INFO - Early stopping at epoch 1300. Best Recall: 0.0691
2026-05-19 18:18:50,687 - optuna.study.study - INFO - Trial 168 finished with value: 0.06907229944347573 and parameters: {'n_layers': 1, 'embedding_dim': 128, 'lr': 0.0006576405523733233, 'lambda_val': 1.4443707343688628e-06, 'batch_size': 923, 'optimizer': 'Adam'}. Best is trial 167 with value: 0.08140932730716424.
2026-05-19 18:19:01,121 - experiment_functions - INFO - Early stopping at epoch 1750. Best Recall: 0.0795
2026-05-19 18:19:01,211 - optuna.study.study - INFO - Trial 169 finished with value: 0.07948506184882041 and parameters: {'n_layers': 1, 'embedding_dim': 128, 'lr': 0.0005193084190650665, 'lambda_val': 1.4972093528124601e-06, 'batch_size': 954, 'optimizer': 'Adam'}. Best is trial 167 with value: 0.08140932730716424.
2026-05-19 18:19:12,659 - experiment_functions - INFO - Early stopping at epoch 1350. Best Recall: 0.0729
2026-05-19 18:19:13,687 - optuna.study.study - INFO - Trial 170 finished with value: 0.07290436707123074 and parameters: {'n_layers': 1, 'embedding_dim': 128, 'lr': 0.0008932101892535546, 'lambda_val': 1.4651520270421421e-06, 'batch_size': 966, 'optimizer': 'Adam'}. Best is trial 167 with value: 0.08140932730716424.
2026-05-19 18:19:29,330 - experiment_functions - INFO - Early stopping at epoch 1850. Best Recall: 0.0730
2026-05-19 18:19:29,430 - optuna.study.study - INFO - Trial 171 finished with value: 0.07297563640989442 and parameters: {'n_layers': 1, 'embedding_dim': 128, 'lr': 0.0009071014958170826, 'lambda_val': 1.4466029374751118e-06, 'batch_size': 930, 'optimizer': 'Adam'}. Best is trial 167 with value: 0.08140932730716424.
2026-05-19 18:19:38,265 - experiment_functions - INFO - Early stopping at epoch 1300. Best Recall: 0.0677
2026-05-19 18:19:38,356 - optuna.study.study - INFO - Trial 172 finished with value: 0.06774932536891035 and parameters: {'n_layers': 1, 'embedding_dim': 128, 'lr': 0.0008562417700495368, 'lambda_val': 1.0414612565287766e-06, 'batch_size': 950, 'optimizer': 'Adam'}. Best is trial 167 with value: 0.08140932730716424.
2026-05-19 18:19:47,763 - optuna.study._optimize - INFO - Trial 173 pruned. 
2026-05-19 18:19:54,185 - optuna.study._optimize - INFO - Trial 174 pruned. 
2026-05-19 18:20:03,894 - experiment_functions - INFO - Early stopping at epoch 1550. Best Recall: 0.0749
