2026-05-19 18:59:04,370 - optuna.study.study - INFO - Trial 121 finished with value: 0.019585494284073288 and parameters: {'n_layers': 1, 'embedding_dim': 128, 'lr': 0.0006129292755275011, 'lambda_val': 1.8449014472788267e-06, 'batch_size': 576, 'optimizer': 'Adam'}. Best is trial 72 with value: 0.025524926419082328.
2026-05-19 18:59:10,338 - experiment_functions - INFO - Early stopping at epoch 900. Best Recall: 0.0175
2026-05-19 18:59:10,492 - optuna.study.study - INFO - Trial 122 finished with value: 0.017475841065442282 and parameters: {'n_layers': 1, 'embedding_dim': 128, 'lr': 0.0005346642827744184, 'lambda_val': 1.3292613395067798e-06, 'batch_size': 651, 'optimizer': 'Adam'}. Best is trial 72 with value: 0.025524926419082328.
2026-05-19 18:59:20,585 - experiment_functions - INFO - Early stopping at epoch 1350. Best Recall: 0.0202
2026-05-19 18:59:20,674 - optuna.study.study - INFO - Trial 123 finished with value: 0.020249248658215434 and parameters: {'n_layers': 1, 'embedding_dim': 128, 'lr': 0.00039024969419366074, 'lambda_val': 2.1841627349156925e-06, 'batch_size': 736, 'optimizer': 'Adam'}. Best is trial 72 with value: 0.025524926419082328.
2026-05-19 18:59:26,582 - optuna.study._optimize - INFO - Trial 124 pruned. 
2026-05-19 18:59:32,964 - optuna.study._optimize - INFO - Trial 125 pruned. 
2026-05-19 18:59:39,327 - optuna.study._optimize - INFO - Trial 126 pruned. 
2026-05-19 18:59:55,712 - experiment_functions - INFO - Early stopping at epoch 1250. Best Recall: 0.0256
2026-05-19 18:59:55,810 - optuna.study.study - INFO - Trial 127 finished with value: 0.02561284164136419 and parameters: {'n_layers': 1, 'embedding_dim': 96, 'lr': 0.0004020817221826375, 'lambda_val': 5.283944168220395e-06, 'batch_size': 618, 'optimizer': 'RMSprop'}. Best is trial 127 with value: 0.02561284164136419.
2026-05-19 18:59:59,257 - experiment_functions - INFO - Early stopping at epoch 550. Best Recall: 0.0157
2026-05-19 18:59:59,348 - optuna.study.study - INFO - Trial 128 finished with value: 0.01571934923606726 and parameters: {'n_layers': 1, 'embedding_dim': 96, 'lr': 0.0013978845092151673, 'lambda_val': 5.291112191364895e-06, 'batch_size': 633, 'optimizer': 'RMSprop'}. Best is trial 127 with value: 0.02561284164136419.
2026-05-19 19:00:03,813 - experiment_functions - INFO - Early stopping at epoch 700. Best Recall: 0.0196
2026-05-19 19:00:03,914 - optuna.study.study - INFO - Trial 129 finished with value: 0.01955318935192807 and parameters: {'n_layers': 1, 'embedding_dim': 96, 'lr': 0.0010475529993360653, 'lambda_val': 7.396804185926031e-06, 'batch_size': 592, 'optimizer': 'RMSprop'}. Best is trial 127 with value: 0.02561284164136419.
2026-05-19 19:00:18,526 - experiment_functions - INFO - Early stopping at epoch 1300. Best Recall: 0.0202
2026-05-19 19:00:18,672 - optuna.study.study - INFO - Trial 130 finished with value: 0.0202168547108569 and parameters: {'n_layers': 1, 'embedding_dim': 96, 'lr': 0.0004690960434270837, 'lambda_val': 2.9763899118520355e-06, 'batch_size': 1003, 'optimizer': 'RMSprop'}. Best is trial 127 with value: 0.02561284164136419.
2026-05-19 19:00:24,959 - optuna.study._optimize - INFO - Trial 131 pruned. 
2026-05-19 19:00:35,766 - optuna.study._optimize - INFO - Trial 132 pruned. 
2026-05-19 19:00:40,270 - experiment_functions - INFO - Early stopping at epoch 700. Best Recall: 0.0139
2026-05-19 19:00:40,372 - optuna.study.study - INFO - Trial 133 finished with value: 0.013930973683142257 and parameters: {'n_layers': 1, 'embedding_dim': 128, 'lr': 0.000840788935093995, 'lambda_val': 1.0760958175478138e-05, 'batch_size': 785, 'optimizer': 'Adam'}. Best is trial 127 with value: 0.02561284164136419.
2026-05-19 19:00:46,905 - experiment_functions - INFO - Early stopping at epoch 1100. Best Recall: 0.0195
2026-05-19 19:00:47,005 - optuna.study.study - INFO - Trial 134 finished with value: 0.01945808833787329 and parameters: {'n_layers': 1, 'embedding_dim': 128, 'lr': 0.0006337389375918809, 'lambda_val': 3.2105935521727517e-06, 'batch_size': 517, 'optimizer': 'Adam'}. Best is trial 127 with value: 0.02561284164136419.
2026-05-19 19:00:57,992 - experiment_functions - INFO - Early stopping at epoch 1000. Best Recall: 0.0187
2026-05-19 19:00:58,101 - optuna.study.study - INFO - Trial 135 finished with value: 0.01870309944590222 and parameters: {'n_layers': 1, 'embedding_dim': 128, 'lr': 0.00040832898135399276, 'lambda_val': 5.687496109449443e-06, 'batch_size': 690, 'optimizer': 'Adam'}. Best is trial 127 with value: 0.02561284164136419.
2026-05-19 19:01:14,694 - experiment_functions - INFO - Early stopping at epoch 3250. Best Recall: 0.0266
2026-05-19 19:01:14,800 - optuna.study.study - INFO - Trial 136 finished with value: 0.02656615530762403 and parameters: {'n_layers': 1, 'embedding_dim': 128, 'lr': 0.000266558395618606, 'lambda_val': 1.529584048733541e-05, 'batch_size': 616, 'optimizer': 'Adam'}. Best is trial 136 with value: 0.02656615530762403.
2026-05-19 19:01:23,257 - optuna.study._optimize - INFO - Trial 137 pruned. 
2026-05-19 19:01:30,020 - experiment_functions - INFO - Early stopping at epoch 900. Best Recall: 0.0158
2026-05-19 19:01:30,111 - optuna.study.study - INFO - Trial 138 finished with value: 0.015823599118617235 and parameters: {'n_layers': 1, 'embedding_dim': 64, 'lr': 0.0007262373485976372, 'lambda_val': 1.8819411765441524e-05, 'batch_size': 867, 'optimizer': 'Adam'}. Best is trial 136 with value: 0.02656615530762403.
2026-05-19 19:01:33,721 - experiment_functions - INFO - Early stopping at epoch 500. Best Recall: 0.0022
2026-05-19 19:01:33,824 - optuna.study.study - INFO - Trial 139 finished with value: 0.002220664861577364 and parameters: {'n_layers': 1, 'embedding_dim': 128, 'lr': 0.00020971753951992393, 'lambda_val': 3.990727106499648e-05, 'batch_size': 629, 'optimizer': 'SGD'}. Best is trial 136 with value: 0.02656615530762403.
2026-05-19 19:01:41,153 - optuna.study._optimize - INFO - Trial 140 pruned. 
2026-05-19 19:01:46,968 - optuna.study._optimize - INFO - Trial 141 pruned. 
2026-05-19 19:01:53,082 - experiment_functions - INFO - Early stopping at epoch 1100. Best Recall: 0.0189
2026-05-19 19:01:53,184 - optuna.study.study - INFO - Trial 142 finished with value: 0.018904128846432756 and parameters: {'n_layers': 1, 'embedding_dim': 128, 'lr': 0.0004927733158017202, 'lambda_val': 2.1261576236453864e-06, 'batch_size': 688, 'optimizer': 'Adam'}. Best is trial 136 with value: 0.02656615530762403.
2026-05-19 19:01:59,232 - experiment_functions - INFO - Early stopping at epoch 900. Best Recall: 0.0121
2026-05-19 19:01:59,336 - optuna.study.study - INFO - Trial 143 finished with value: 0.012071843007638026 and parameters: {'n_layers': 1, 'embedding_dim': 128, 'lr': 0.0003582036130227643, 'lambda_val': 2.6943608059132853e-05, 'batch_size': 2685, 'optimizer': 'Adam'}. Best is trial 136 with value: 0.02656615530762403.
2026-05-19 19:02:03,967 - experiment_functions - INFO - Early stopping at epoch 750. Best Recall: 0.0118
2026-05-19 19:02:04,058 - optuna.study.study - INFO - Trial 144 finished with value: 0.011849604182991877 and parameters: {'n_layers': 1, 'embedding_dim': 128, 'lr': 0.0005362396836536814, 'lambda_val': 4.403948348809293e-06, 'batch_size': 4027, 'optimizer': 'Adam'}. Best is trial 136 with value: 0.02656615530762403.
2026-05-19 19:02:09,774 - optuna.study._optimize - INFO - Trial 145 pruned. 
2026-05-19 19:02:15,367 - experiment_functions - INFO - Early stopping at epoch 900. Best Recall: 0.0162
2026-05-19 19:02:15,447 - optuna.study.study - INFO - Trial 146 finished with value: 0.016215646224638995 and parameters: {'n_layers': 1, 'embedding_dim': 128, 'lr': 0.0009240440159990352, 'lambda_val': 1.2786834426424108e-05, 'batch_size': 584, 'optimizer': 'Adam'}. Best is trial 136 with value: 0.02656615530762403.
2026-05-19 19:02:28,786 - experiment_functions - INFO - Early stopping at epoch 2500. Best Recall: 0.0266
2026-05-19 19:02:28,891 - optuna.study.study - INFO - Trial 147 finished with value: 0.02664397369077561 and parameters: {'n_layers': 1, 'embedding_dim': 128, 'lr': 0.00024447951196050294, 'lambda_val': 6.970097438675017e-05, 'batch_size': 661, 'optimizer': 'RMSprop'}. Best is trial 147 with value: 0.02664397369077561.
2026-05-19 19:02:42,506 - experiment_functions - INFO - Early stopping at epoch 2300. Best Recall: 0.0262
2026-05-19 19:02:42,639 - optuna.study.study - INFO - Trial 148 finished with value: 0.026152635039641058 and parameters: {'n_layers': 1, 'embedding_dim': 128, 'lr': 0.00023182569328891178, 'lambda_val': 9.204913651714957e-05, 'batch_size': 512, 'optimizer': 'RMSprop'}. Best is trial 147 with value: 0.02664397369077561.
2026-05-19 19:02:48,667 - optuna.study._optimize - INFO - Trial 149 pruned. 
2026-05-19 19:02:54,812 - optuna.study._optimize - INFO - Trial 150 pruned. 
2026-05-19 19:03:04,364 - optuna.study._optimize - INFO - Trial 151 pruned. 
2026-05-19 19:03:09,194 - experiment_functions - INFO - Early stopping at epoch 750. Best Recall: 0.0221
2026-05-19 19:03:09,274 - optuna.study.study - INFO - Trial 152 finished with value: 0.022116001143264417 and parameters: {'n_layers': 1, 'embedding_dim': 128, 'lr': 0.0007066629310250237, 'lambda_val': 6.270359131006875e-05, 'batch_size': 530, 'optimizer': 'RMSprop'}. Best is trial 147 with value: 0.02664397369077561.
2026-05-19 19:03:14,574 - optuna.study._optimize - INFO - Trial 153 pruned. 
2026-05-19 19:03:19,281 - experiment_functions - INFO - Early stopping at epoch 800. Best Recall: 0.0172
2026-05-19 19:03:19,371 - optuna.study.study - INFO - Trial 154 finished with value: 0.017208244938219704 and parameters: {'n_layers': 1, 'embedding_dim': 128, 'lr': 0.000659251182437469, 'lambda_val': 0.00016561367377342602, 'batch_size': 567, 'optimizer': 'RMSprop'}. Best is trial 147 with value: 0.02664397369077561.
2026-05-19 19:03:27,813 - optuna.study._optimize - INFO - Trial 155 pruned. 
2026-05-19 19:03:48,636 - optuna.study._optimize - INFO - Trial 156 pruned. 
2026-05-19 19:03:52,979 - experiment_functions - INFO - Early stopping at epoch 700. Best Recall: 0.0138
2026-05-19 19:03:53,058 - optuna.study.study - INFO - Trial 157 finished with value: 0.013844885710090848 and parameters: {'n_layers': 1, 'embedding_dim': 128, 'lr': 0.0005352228967424239, 'lambda_val': 6.923390110586127e-05, 'batch_size': 2443, 'optimizer': 'RMSprop'}. Best is trial 147 with value: 0.02664397369077561.
2026-05-19 19:03:57,113 - experiment_functions - INFO - Early stopping at epoch 650. Best Recall: 0.0183
2026-05-19 19:03:57,261 - optuna.study.study - INFO - Trial 158 finished with value: 0.01830839429074235 and parameters: {'n_layers': 1, 'embedding_dim': 128, 'lr': 0.0011094737510671405, 'lambda_val': 5.193894522270862e-05, 'batch_size': 616, 'optimizer': 'RMSprop'}. Best is trial 147 with value: 0.02664397369077561.
2026-05-19 19:04:03,234 - optuna.study._optimize - INFO - Trial 159 pruned. 
2026-05-19 19:04:09,892 - optuna.study._optimize - INFO - Trial 160 pruned. 
2026-05-19 19:04:14,155 - experiment_functions - INFO - Early stopping at epoch 700. Best Recall: 0.0169
2026-05-19 19:04:14,254 - optuna.study.study - INFO - Trial 161 finished with value: 0.016917247879941102 and parameters: {'n_layers': 1, 'embedding_dim': 128, 'lr': 0.0007895131094394507, 'lambda_val': 3.7391564997930282e-06, 'batch_size': 571, 'optimizer': 'RMSprop'}. Best is trial 147 with value: 0.02664397369077561.
2026-05-19 19:04:19,001 - experiment_functions - INFO - Early stopping at epoch 700. Best Recall: 0.0201
2026-05-19 19:04:19,100 - optuna.study.study - INFO - Trial 162 finished with value: 0.02013101084722858 and parameters: {'n_layers': 1, 'embedding_dim': 128, 'lr': 0.0006444455903925413, 'lambda_val': 8.045568027130305e-06, 'batch_size': 606, 'optimizer': 'RMSprop'}. Best is trial 147 with value: 0.02664397369077561.
2026-05-19 19:04:23,442 - experiment_functions - INFO - Early stopping at epoch 700. Best Recall: 0.0149
2026-05-19 19:04:23,543 - optuna.study.study - INFO - Trial 163 finished with value: 0.014924216807709802 and parameters: {'n_layers': 1, 'embedding_dim': 128, 'lr': 0.0007946871561995113, 'lambda_val': 3.910352996467368e-05, 'batch_size': 535, 'optimizer': 'RMSprop'}. Best is trial 147 with value: 0.02664397369077561.
2026-05-19 19:04:27,882 - experiment_functions - INFO - Early stopping at epoch 650. Best Recall: 0.0171
2026-05-19 19:04:27,982 - optuna.study.study - INFO - Trial 164 finished with value: 0.017089715419135943 and parameters: {'n_layers': 1, 'embedding_dim': 128, 'lr': 0.0012321918329293192, 'lambda_val': 2.3101178811200277e-05, 'batch_size': 766, 'optimizer': 'Adam'}. Best is trial 147 with value: 0.02664397369077561.
2026-05-19 19:04:33,974 - experiment_functions - INFO - Early stopping at epoch 750. Best Recall: 0.0081
2026-05-19 19:04:34,064 - optuna.study.study - INFO - Trial 165 finished with value: 0.008133185079614514 and parameters: {'n_layers': 4, 'embedding_dim': 96, 'lr': 0.0005569075106358474, 'lambda_val': 4.7273991013679976e-06, 'batch_size': 513, 'optimizer': 'Adam'}. Best is trial 147 with value: 0.02664397369077561.
2026-05-19 19:04:42,025 - experiment_functions - INFO - Early stopping at epoch 1500. Best Recall: 0.0261
2026-05-19 19:04:42,147 - optuna.study.study - INFO - Trial 166 finished with value: 0.026057981099711195 and parameters: {'n_layers': 1, 'embedding_dim': 128, 'lr': 0.00034942425425655795, 'lambda_val': 5.332615072248829e-06, 'batch_size': 658, 'optimizer': 'Adam'}. Best is trial 147 with value: 0.02664397369077561.
2026-05-19 19:04:47,776 - optuna.study._optimize - INFO - Trial 167 pruned. 
2026-05-19 19:04:53,705 - optuna.study._optimize - INFO - Trial 168 pruned. 
2026-05-19 19:04:58,994 - optuna.study._optimize - INFO - Trial 169 pruned. 
2026-05-19 19:05:01,800 - experiment_functions - INFO - Early stopping at epoch 500. Best Recall: 0.0018
2026-05-19 19:05:01,890 - optuna.study.study - INFO - Trial 170 finished with value: 0.0017915143579603876 and parameters: {'n_layers': 1, 'embedding_dim': 128, 'lr': 0.07541231138651659, 'lambda_val': 1.0468093538696654e-05, 'batch_size': 928, 'optimizer': 'SGD'}. Best is trial 147 with value: 0.02664397369077561.
2026-05-19 19:05:06,931 - experiment_functions - INFO - Early stopping at epoch 750. Best Recall: 0.0110
2026-05-19 19:05:07,033 - optuna.study.study - INFO - Trial 171 finished with value: 0.010952886403117026 and parameters: {'n_layers': 3, 'embedding_dim': 128, 'lr': 0.00044579659917991194, 'lambda_val': 2.959383729100591e-06, 'batch_size': 609, 'optimizer': 'Adam'}. Best is trial 147 with value: 0.02664397369077561.
2026-05-19 19:05:11,202 - experiment_functions - INFO - Early stopping at epoch 750. Best Recall: 0.0214
2026-05-19 19:05:11,292 - optuna.study.study - INFO - Trial 172 finished with value: 0.021432907016473775 and parameters: {'n_layers': 1, 'embedding_dim': 128, 'lr': 0.0009759472941009124, 'lambda_val': 5.853987390833341e-06, 'batch_size': 518, 'optimizer': 'Adam'}. Best is trial 147 with value: 0.02664397369077561.
2026-05-19 19:05:18,641 - experiment_functions - INFO - Early stopping at epoch 850. Best Recall: 0.0197
2026-05-19 19:05:18,731 - optuna.study.study - INFO - Trial 173 finished with value: 0.019680571911921546 and parameters: {'n_layers': 1, 'embedding_dim': 128, 'lr': 0.0006398564934964034, 'lambda_val': 6.663862548244504e-06, 'batch_size': 681, 'optimizer': 'Adam'}. Best is trial 147 with value: 0.02664397369077561.
2026-05-19 19:05:25,568 - optuna.study._optimize - INFO - Trial 174 pruned. 
2026-05-19 19:05:30,136 - experiment_functions - INFO - Early stopping at epoch 800. Best Recall: 0.0198
2026-05-19 19:05:30,230 - optuna.study.study - INFO - Trial 175 finished with value: 0.0197699673994017 and parameters: {'n_layers': 1, 'embedding_dim': 128, 'lr': 0.0009970221671527267, 'lambda_val': 3.941546002432868e-06, 'batch_size': 585, 'optimizer': 'Adam'}. Best is trial 147 with value: 0.02664397369077561.
2026-05-19 19:05:36,106 - optuna.study._optimize - INFO - Trial 176 pruned. 
2026-05-19 19:05:41,554 - experiment_functions - INFO - Early stopping at epoch 950. Best Recall: 0.0106
2026-05-19 19:05:41,636 - optuna.study.study - INFO - Trial 177 finished with value: 0.010621700372949398 and parameters: {'n_layers': 1, 'embedding_dim': 128, 'lr': 0.0005003895093699935, 'lambda_val': 9.013569076452928e-06, 'batch_size': 2148, 'optimizer': 'Adam'}. Best is trial 147 with value: 0.02664397369077561.
2026-05-19 19:05:46,370 - experiment_functions - INFO - Early stopping at epoch 800. Best Recall: 0.0185
2026-05-19 19:05:46,471 - optuna.study.study - INFO - Trial 178 finished with value: 0.0185343863657843 and parameters: {'n_layers': 1, 'embedding_dim': 128, 'lr': 0.0007284708759361779, 'lambda_val': 1.2190467968330028e-05, 'batch_size': 517, 'optimizer': 'Adam'}. Best is trial 147 with value: 0.02664397369077561.
2026-05-19 19:05:52,482 - optuna.study._optimize - INFO - Trial 179 pruned. 
2026-05-19 19:05:58,608 - experiment_functions - INFO - Early stopping at epoch 1150. Best Recall: 0.0256
2026-05-19 19:05:58,743 - optuna.study.study - INFO - Trial 180 finished with value: 0.02555563075079743 and parameters: {'n_layers': 1, 'embedding_dim': 128, 'lr': 0.0004012217858452036, 'lambda_val': 6.282857936212414e-06, 'batch_size': 645, 'optimizer': 'Adam'}. Best is trial 147 with value: 0.02664397369077561.
2026-05-19 19:06:04,308 - optuna.study._optimize - INFO - Trial 181 pruned. 
2026-05-19 19:06:10,076 - experiment_functions - INFO - Early stopping at epoch 900. Best Recall: 0.0189
2026-05-19 19:06:10,169 - optuna.study.study - INFO - Trial 182 finished with value: 0.01888039109636945 and parameters: {'n_layers': 1, 'embedding_dim': 128, 'lr': 0.0005961525473341126, 'lambda_val': 6.374856638654649e-06, 'batch_size': 690, 'optimizer': 'Adam'}. Best is trial 147 with value: 0.02664397369077561.
2026-05-19 19:06:17,403 - experiment_functions - INFO - Early stopping at epoch 950. Best Recall: 0.0201
2026-05-19 19:06:17,489 - optuna.study.study - INFO - Trial 183 finished with value: 0.02006226358973484 and parameters: {'n_layers': 1, 'embedding_dim': 128, 'lr': 0.00046704230278771757, 'lambda_val': 3.500463847359839e-06, 'batch_size': 614, 'optimizer': 'Adam'}. Best is trial 147 with value: 0.02664397369077561.
2026-05-19 19:06:25,565 - optuna.study._optimize - INFO - Trial 184 pruned. 
2026-05-19 19:06:33,261 - optuna.study._optimize - INFO - Trial 185 pruned. 
2026-05-19 19:06:38,120 - experiment_functions - INFO - Early stopping at epoch 750. Best Recall: 0.0173
2026-05-19 19:06:38,221 - optuna.study.study - INFO - Trial 186 finished with value: 0.017328469861716243 and parameters: {'n_layers': 1, 'embedding_dim': 128, 'lr': 0.0009083341836243972, 'lambda_val': 8.465502117630734e-06, 'batch_size': 649, 'optimizer': 'Adam'}. Best is trial 147 with value: 0.02664397369077561.
2026-05-19 19:06:44,605 - experiment_functions - INFO - Early stopping at epoch 1100. Best Recall: 0.0233
2026-05-19 19:06:44,753 - optuna.study.study - INFO - Trial 187 finished with value: 0.023293220102886043 and parameters: {'n_layers': 1, 'embedding_dim': 128, 'lr': 0.00040665448657892136, 'lambda_val': 4.221468882276535e-06, 'batch_size': 592, 'optimizer': 'RMSprop'}. Best is trial 147 with value: 0.02664397369077561.
2026-05-19 19:06:51,507 - experiment_functions - INFO - Early stopping at epoch 1200. Best Recall: 0.0221
2026-05-19 19:06:51,597 - optuna.study.study - INFO - Trial 188 finished with value: 0.022096250483633246 and parameters: {'n_layers': 1, 'embedding_dim': 128, 'lr': 0.0004336972700329272, 'lambda_val': 3.8769236517873125e-06, 'batch_size': 578, 'optimizer': 'RMSprop'}. Best is trial 147 with value: 0.02664397369077561.
2026-05-19 19:06:56,153 - experiment_functions - INFO - Early stopping at epoch 800. Best Recall: 0.0231
2026-05-19 19:06:56,247 - optuna.study.study - INFO - Trial 189 finished with value: 0.023091845594045306 and parameters: {'n_layers': 1, 'embedding_dim': 128, 'lr': 0.0005268186705112244, 'lambda_val': 2.9631127691884522e-06, 'batch_size': 577, 'optimizer': 'RMSprop'}. Best is trial 147 with value: 0.02664397369077561.
2026-05-19 19:07:02,538 - optuna.study._optimize - INFO - Trial 190 pruned. 
2026-05-19 19:07:07,916 - experiment_functions - INFO - Early stopping at epoch 900. Best Recall: 0.0174
2026-05-19 19:07:08,017 - optuna.study.study - INFO - Trial 191 finished with value: 0.0174341772458536 and parameters: {'n_layers': 1, 'embedding_dim': 128, 'lr': 0.0005565193846483853, 'lambda_val': 3.7487337159034185e-06, 'batch_size': 571, 'optimizer': 'RMSprop'}. Best is trial 147 with value: 0.02664397369077561.
2026-05-19 19:07:17,081 - optuna.study._optimize - INFO - Trial 192 pruned. 
2026-05-19 19:07:26,664 - optuna.study._optimize - INFO - Trial 193 pruned. 
2026-05-19 19:07:33,276 - optuna.study._optimize - INFO - Trial 194 pruned. 
2026-05-19 19:07:37,459 - experiment_functions - INFO - Early stopping at epoch 650. Best Recall: 0.0164
2026-05-19 19:07:37,549 - optuna.study.study - INFO - Trial 195 finished with value: 0.016395452265247298 and parameters: {'n_layers': 1, 'embedding_dim': 128, 'lr': 0.0006735462442906383, 'lambda_val': 1.9587954837455093e-06, 'batch_size': 689, 'optimizer': 'RMSprop'}. Best is trial 147 with value: 0.02664397369077561.
2026-05-19 19:07:47,071 - optuna.study._optimize - INFO - Trial 196 pruned. 
2026-05-19 19:07:53,281 - optuna.study._optimize - INFO - Trial 197 pruned. 
2026-05-19 19:08:00,652 - experiment_functions - INFO - Early stopping at epoch 900. Best Recall: 0.0156
2026-05-19 19:08:00,822 - optuna.study.study - INFO - Trial 198 finished with value: 0.015559880923435299 and parameters: {'n_layers': 1, 'embedding_dim': 128, 'lr': 0.0004771344151160713, 'lambda_val': 6.573146012601173e-06, 'batch_size': 719, 'optimizer': 'RMSprop'}. Best is trial 147 with value: 0.02664397369077561.
