2026-05-19 17:16:07,755 - optuna.study._optimize - INFO - Trial 101 pruned. 
2026-05-19 17:16:25,008 - experiment_functions - INFO - Early stopping at epoch 1900. Best Recall: 0.0194
2026-05-19 17:16:25,106 - optuna.study.study - INFO - Trial 102 finished with value: 0.019427385967394732 and parameters: {'n_layers': 4, 'embedding_dim': 128, 'lr': 0.03617589820709146, 'lambda_val': 5.478593516459116e-05, 'batch_size': 3582, 'optimizer': 'Adam'}. Best is trial 98 with value: 0.021056788296889777.
2026-05-19 17:16:36,455 - experiment_functions - INFO - Early stopping at epoch 1550. Best Recall: 0.0176
2026-05-19 17:16:37,186 - optuna.study.study - INFO - Trial 103 finished with value: 0.017577522173953704 and parameters: {'n_layers': 4, 'embedding_dim': 128, 'lr': 0.03686206047094128, 'lambda_val': 4.229477334803397e-05, 'batch_size': 3899, 'optimizer': 'Adam'}. Best is trial 98 with value: 0.021056788296889777.
2026-05-19 17:16:52,975 - optuna.study._optimize - INFO - Trial 104 pruned. 
2026-05-19 17:17:04,277 - experiment_functions - INFO - Early stopping at epoch 1600. Best Recall: 0.0227
2026-05-19 17:17:04,384 - optuna.study.study - INFO - Trial 105 finished with value: 0.022701688378119776 and parameters: {'n_layers': 4, 'embedding_dim': 128, 'lr': 0.034401368089859746, 'lambda_val': 5.4914078329925326e-05, 'batch_size': 3795, 'optimizer': 'Adam'}. Best is trial 105 with value: 0.022701688378119776.
2026-05-19 17:17:15,500 - experiment_functions - INFO - Early stopping at epoch 1050. Best Recall: 0.0176
2026-05-19 17:17:15,602 - optuna.study.study - INFO - Trial 106 finished with value: 0.017601644803252013 and parameters: {'n_layers': 4, 'embedding_dim': 128, 'lr': 0.03525047191804173, 'lambda_val': 5.377999428494863e-05, 'batch_size': 3931, 'optimizer': 'Adam'}. Best is trial 105 with value: 0.022701688378119776.
2026-05-19 17:17:21,153 - experiment_functions - INFO - Early stopping at epoch 700. Best Recall: 0.0134
2026-05-19 17:17:21,243 - optuna.study.study - INFO - Trial 107 finished with value: 0.013364742984981335 and parameters: {'n_layers': 4, 'embedding_dim': 128, 'lr': 0.03476523314863675, 'lambda_val': 3.071495908709335e-05, 'batch_size': 3967, 'optimizer': 'RMSprop'}. Best is trial 105 with value: 0.022701688378119776.
2026-05-19 17:17:29,306 - experiment_functions - INFO - Early stopping at epoch 800. Best Recall: 0.0175
2026-05-19 17:17:29,397 - optuna.study.study - INFO - Trial 108 finished with value: 0.01750767601626531 and parameters: {'n_layers': 4, 'embedding_dim': 128, 'lr': 0.037162178079087935, 'lambda_val': 5.280231769829317e-05, 'batch_size': 3931, 'optimizer': 'Adam'}. Best is trial 105 with value: 0.022701688378119776.
2026-05-19 17:17:45,296 - experiment_functions - INFO - Early stopping at epoch 2000. Best Recall: 0.0205
2026-05-19 17:17:45,400 - optuna.study.study - INFO - Trial 109 finished with value: 0.02047201725574813 and parameters: {'n_layers': 4, 'embedding_dim': 32, 'lr': 0.03731735306028386, 'lambda_val': 5.506464460940167e-05, 'batch_size': 3964, 'optimizer': 'Adam'}. Best is trial 105 with value: 0.022701688378119776.
2026-05-19 17:17:57,883 - experiment_functions - INFO - Early stopping at epoch 1500. Best Recall: 0.0232
2026-05-19 17:17:58,024 - optuna.study.study - INFO - Trial 110 finished with value: 0.023246594213241514 and parameters: {'n_layers': 4, 'embedding_dim': 32, 'lr': 0.05883441062475964, 'lambda_val': 5.4654915962103286e-05, 'batch_size': 3973, 'optimizer': 'Adam'}. Best is trial 110 with value: 0.023246594213241514.
2026-05-19 17:18:11,622 - experiment_functions - INFO - Early stopping at epoch 1750. Best Recall: 0.0172
2026-05-19 17:18:11,768 - optuna.study.study - INFO - Trial 111 finished with value: 0.017198107288712232 and parameters: {'n_layers': 4, 'embedding_dim': 32, 'lr': 0.0393621636156254, 'lambda_val': 6.31151593064562e-05, 'batch_size': 3953, 'optimizer': 'Adam'}. Best is trial 110 with value: 0.023246594213241514.
2026-05-19 17:18:23,610 - experiment_functions - INFO - Early stopping at epoch 1250. Best Recall: 0.0202
2026-05-19 17:18:23,767 - optuna.study.study - INFO - Trial 112 finished with value: 0.020217427326619974 and parameters: {'n_layers': 4, 'embedding_dim': 32, 'lr': 0.05825384311682611, 'lambda_val': 5.357226460158904e-05, 'batch_size': 3785, 'optimizer': 'Adam'}. Best is trial 110 with value: 0.023246594213241514.
2026-05-19 17:18:34,819 - experiment_functions - INFO - Early stopping at epoch 1300. Best Recall: 0.0219
2026-05-19 17:18:34,911 - optuna.study.study - INFO - Trial 113 finished with value: 0.02192778317510452 and parameters: {'n_layers': 4, 'embedding_dim': 32, 'lr': 0.05493430165357575, 'lambda_val': 9.261447492734163e-05, 'batch_size': 3800, 'optimizer': 'Adam'}. Best is trial 110 with value: 0.023246594213241514.
2026-05-19 17:18:44,402 - experiment_functions - INFO - Early stopping at epoch 1100. Best Recall: 0.0187
2026-05-19 17:18:44,953 - optuna.study.study - INFO - Trial 114 finished with value: 0.018737519018080417 and parameters: {'n_layers': 4, 'embedding_dim': 32, 'lr': 0.059656078811950106, 'lambda_val': 7.621354218641826e-05, 'batch_size': 3808, 'optimizer': 'Adam'}. Best is trial 110 with value: 0.023246594213241514.
2026-05-19 17:18:53,201 - experiment_functions - INFO - Early stopping at epoch 950. Best Recall: 0.0185
2026-05-19 17:18:53,314 - optuna.study.study - INFO - Trial 115 finished with value: 0.018494938733855736 and parameters: {'n_layers': 4, 'embedding_dim': 32, 'lr': 0.06032915552445018, 'lambda_val': 0.00010137532215541286, 'batch_size': 3785, 'optimizer': 'Adam'}. Best is trial 110 with value: 0.023246594213241514.
2026-05-19 17:19:06,099 - experiment_functions - INFO - Early stopping at epoch 1600. Best Recall: 0.0212
2026-05-19 17:19:06,201 - optuna.study.study - INFO - Trial 116 finished with value: 0.021172318299381234 and parameters: {'n_layers': 4, 'embedding_dim': 32, 'lr': 0.06476884490383344, 'lambda_val': 0.00011529830427561089, 'batch_size': 3791, 'optimizer': 'Adam'}. Best is trial 110 with value: 0.023246594213241514.
2026-05-19 17:19:16,926 - experiment_functions - INFO - Early stopping at epoch 1200. Best Recall: 0.0168
2026-05-19 17:19:17,081 - optuna.study.study - INFO - Trial 117 finished with value: 0.01684911034298289 and parameters: {'n_layers': 4, 'embedding_dim': 32, 'lr': 0.062015208624252235, 'lambda_val': 0.00024293685141617407, 'batch_size': 4039, 'optimizer': 'Adam'}. Best is trial 110 with value: 0.023246594213241514.
2026-05-19 17:19:32,913 - optuna.study._optimize - INFO - Trial 118 pruned. 
2026-05-19 17:19:59,772 - experiment_functions - INFO - Early stopping at epoch 3550. Best Recall: 0.0230
2026-05-19 17:19:59,864 - optuna.study.study - INFO - Trial 119 finished with value: 0.02295568271751412 and parameters: {'n_layers': 4, 'embedding_dim': 32, 'lr': 0.07633128609662952, 'lambda_val': 0.0001293486343870205, 'batch_size': 3729, 'optimizer': 'Adam'}. Best is trial 110 with value: 0.023246594213241514.
2026-05-19 17:20:16,351 - optuna.study._optimize - INFO - Trial 120 pruned. 
2026-05-19 17:20:28,185 - optuna.study._optimize - INFO - Trial 121 pruned. 
2026-05-19 17:20:45,624 - experiment_functions - INFO - Early stopping at epoch 2750. Best Recall: 0.0225
2026-05-19 17:20:45,716 - optuna.study.study - INFO - Trial 122 finished with value: 0.022498003729544448 and parameters: {'n_layers': 4, 'embedding_dim': 32, 'lr': 0.05413758991744747, 'lambda_val': 6.895446157185809e-05, 'batch_size': 3706, 'optimizer': 'Adam'}. Best is trial 110 with value: 0.023246594213241514.
2026-05-19 17:20:52,366 - experiment_functions - INFO - Early stopping at epoch 800. Best Recall: 0.0151
2026-05-19 17:20:52,514 - optuna.study.study - INFO - Trial 123 finished with value: 0.015061298033290888 and parameters: {'n_layers': 4, 'embedding_dim': 32, 'lr': 0.0979628770527831, 'lambda_val': 0.0001887306989902802, 'batch_size': 3855, 'optimizer': 'Adam'}. Best is trial 110 with value: 0.023246594213241514.
2026-05-19 17:20:58,994 - optuna.study._optimize - INFO - Trial 124 pruned. 
2026-05-19 17:21:05,906 - experiment_functions - INFO - Early stopping at epoch 800. Best Recall: 0.0107
2026-05-19 17:21:05,997 - optuna.study.study - INFO - Trial 125 finished with value: 0.010692781897836585 and parameters: {'n_layers': 4, 'embedding_dim': 32, 'lr': 0.07136024801723445, 'lambda_val': 0.0003558434828994742, 'batch_size': 4013, 'optimizer': 'Adam'}. Best is trial 110 with value: 0.023246594213241514.
2026-05-19 17:21:11,577 - experiment_functions - INFO - Early stopping at epoch 850. Best Recall: 0.0019
2026-05-19 17:21:11,656 - optuna.study.study - INFO - Trial 126 finished with value: 0.0019054920036579302 and parameters: {'n_layers': 4, 'embedding_dim': 32, 'lr': 0.04407270373325383, 'lambda_val': 7.00635976471796e-05, 'batch_size': 3613, 'optimizer': 'SGD'}. Best is trial 110 with value: 0.023246594213241514.
2026-05-19 17:21:17,328 - optuna.study._optimize - INFO - Trial 127 pruned. 
2026-05-19 17:21:23,278 - experiment_functions - INFO - Early stopping at epoch 850. Best Recall: 0.0118
2026-05-19 17:21:23,371 - optuna.study.study - INFO - Trial 128 finished with value: 0.011785709637031079 and parameters: {'n_layers': 4, 'embedding_dim': 32, 'lr': 0.053097239375438664, 'lambda_val': 0.0002424546218626023, 'batch_size': 3686, 'optimizer': 'Adam'}. Best is trial 110 with value: 0.023246594213241514.
2026-05-19 17:21:39,639 - optuna.study._optimize - INFO - Trial 129 pruned. 
2026-05-19 17:21:45,839 - optuna.study._optimize - INFO - Trial 130 pruned. 
2026-05-19 17:21:56,012 - experiment_functions - INFO - Early stopping at epoch 1250. Best Recall: 0.0151
2026-05-19 17:21:56,093 - optuna.study.study - INFO - Trial 131 finished with value: 0.015057544425551881 and parameters: {'n_layers': 4, 'embedding_dim': 32, 'lr': 0.05875902752163072, 'lambda_val': 8.117561788824958e-05, 'batch_size': 3791, 'optimizer': 'Adam'}. Best is trial 110 with value: 0.023246594213241514.
2026-05-19 17:22:07,595 - optuna.study._optimize - INFO - Trial 132 pruned. 
2026-05-19 17:22:23,212 - experiment_functions - INFO - Early stopping at epoch 2350. Best Recall: 0.0219
2026-05-19 17:22:23,292 - optuna.study.study - INFO - Trial 133 finished with value: 0.02192951670705826 and parameters: {'n_layers': 4, 'embedding_dim': 32, 'lr': 0.04629330717385679, 'lambda_val': 0.00011030121386592353, 'batch_size': 3841, 'optimizer': 'Adam'}. Best is trial 110 with value: 0.023246594213241514.
2026-05-19 17:22:35,349 - optuna.study._optimize - INFO - Trial 134 pruned. 
2026-05-19 17:22:48,507 - experiment_functions - INFO - Early stopping at epoch 1900. Best Recall: 0.0213
2026-05-19 17:22:48,610 - optuna.study.study - INFO - Trial 135 finished with value: 0.021290066503622973 and parameters: {'n_layers': 4, 'embedding_dim': 32, 'lr': 0.045271932053186706, 'lambda_val': 5.793422292998205e-05, 'batch_size': 3691, 'optimizer': 'Adam'}. Best is trial 110 with value: 0.023246594213241514.
2026-05-19 17:23:06,725 - experiment_functions - INFO - Early stopping at epoch 2400. Best Recall: 0.0214
2026-05-19 17:23:06,861 - optuna.study.study - INFO - Trial 136 finished with value: 0.021409845041003316 and parameters: {'n_layers': 4, 'embedding_dim': 32, 'lr': 0.05003850063864077, 'lambda_val': 3.9196894736726104e-05, 'batch_size': 3713, 'optimizer': 'Adam'}. Best is trial 110 with value: 0.023246594213241514.
2026-05-19 17:23:22,079 - experiment_functions - INFO - Early stopping at epoch 2150. Best Recall: 0.0222
2026-05-19 17:23:22,247 - optuna.study.study - INFO - Trial 137 finished with value: 0.022173272388307172 and parameters: {'n_layers': 4, 'embedding_dim': 32, 'lr': 0.051200601992340736, 'lambda_val': 3.440424286145309e-05, 'batch_size': 3739, 'optimizer': 'Adam'}. Best is trial 110 with value: 0.023246594213241514.
2026-05-19 17:23:33,285 - experiment_functions - INFO - Early stopping at epoch 1600. Best Recall: 0.0239
2026-05-19 17:23:33,393 - optuna.study.study - INFO - Trial 138 finished with value: 0.023931469710893754 and parameters: {'n_layers': 4, 'embedding_dim': 32, 'lr': 0.05220999285361847, 'lambda_val': 3.6161959688779144e-05, 'batch_size': 3716, 'optimizer': 'Adam'}. Best is trial 138 with value: 0.023931469710893754.
2026-05-19 17:23:43,633 - experiment_functions - INFO - Early stopping at epoch 1250. Best Recall: 0.0174
2026-05-19 17:23:43,725 - optuna.study.study - INFO - Trial 139 finished with value: 0.017390411497672006 and parameters: {'n_layers': 4, 'embedding_dim': 32, 'lr': 0.07781959083199387, 'lambda_val': 3.996317045337877e-05, 'batch_size': 3716, 'optimizer': 'Adam'}. Best is trial 138 with value: 0.023931469710893754.
2026-05-19 17:23:57,520 - optuna.study._optimize - INFO - Trial 140 pruned. 
2026-05-19 17:24:09,293 - experiment_functions - INFO - Early stopping at epoch 1400. Best Recall: 0.0197
2026-05-19 17:24:09,405 - optuna.study.study - INFO - Trial 141 finished with value: 0.019682905982169898 and parameters: {'n_layers': 4, 'embedding_dim': 32, 'lr': 0.050812653834884244, 'lambda_val': 6.301646108925985e-05, 'batch_size': 3990, 'optimizer': 'Adam'}. Best is trial 138 with value: 0.023931469710893754.
2026-05-19 17:24:22,324 - experiment_functions - INFO - Early stopping at epoch 1800. Best Recall: 0.0211
2026-05-19 17:24:23,071 - optuna.study.study - INFO - Trial 142 finished with value: 0.02110233600294242 and parameters: {'n_layers': 4, 'embedding_dim': 32, 'lr': 0.04502234577232075, 'lambda_val': 9.127521103513287e-05, 'batch_size': 3676, 'optimizer': 'Adam'}. Best is trial 138 with value: 0.023931469710893754.
2026-05-19 17:24:32,890 - experiment_functions - INFO - Early stopping at epoch 1350. Best Recall: 0.0180
2026-05-19 17:24:32,970 - optuna.study.study - INFO - Trial 143 finished with value: 0.018017428651932368 and parameters: {'n_layers': 4, 'embedding_dim': 32, 'lr': 0.05619519151178056, 'lambda_val': 7.663695070684264e-05, 'batch_size': 3745, 'optimizer': 'Adam'}. Best is trial 138 with value: 0.023931469710893754.
2026-05-19 17:24:41,978 - optuna.study._optimize - INFO - Trial 144 pruned. 
2026-05-19 17:24:51,097 - experiment_functions - INFO - Early stopping at epoch 1100. Best Recall: 0.0175
2026-05-19 17:24:51,187 - optuna.study.study - INFO - Trial 145 finished with value: 0.01751010870026144 and parameters: {'n_layers': 4, 'embedding_dim': 32, 'lr': 0.0696627290374637, 'lambda_val': 3.602998119796947e-05, 'batch_size': 3848, 'optimizer': 'Adam'}. Best is trial 138 with value: 0.023931469710893754.
2026-05-19 17:25:05,734 - experiment_functions - INFO - Early stopping at epoch 2150. Best Recall: 0.0223
2026-05-19 17:25:05,870 - optuna.study.study - INFO - Trial 146 finished with value: 0.022349796175775993 and parameters: {'n_layers': 4, 'embedding_dim': 32, 'lr': 0.048503510930452666, 'lambda_val': 4.902119336712589e-05, 'batch_size': 4095, 'optimizer': 'Adam'}. Best is trial 138 with value: 0.023931469710893754.
2026-05-19 17:25:18,378 - experiment_functions - INFO - Early stopping at epoch 1600. Best Recall: 0.0202
2026-05-19 17:25:19,378 - optuna.study.study - INFO - Trial 147 finished with value: 0.02023557765988042 and parameters: {'n_layers': 4, 'embedding_dim': 32, 'lr': 0.04652641785913062, 'lambda_val': 2.2017906703728276e-05, 'batch_size': 3671, 'optimizer': 'Adam'}. Best is trial 138 with value: 0.023931469710893754.
2026-05-19 17:25:30,895 - experiment_functions - INFO - Early stopping at epoch 1400. Best Recall: 0.0180
2026-05-19 17:25:30,984 - optuna.study.study - INFO - Trial 148 finished with value: 0.0179972382860707 and parameters: {'n_layers': 4, 'embedding_dim': 32, 'lr': 0.07497630978840959, 'lambda_val': 0.00016199127433411334, 'batch_size': 4064, 'optimizer': 'Adam'}. Best is trial 138 with value: 0.023931469710893754.
2026-05-19 17:25:40,579 - experiment_functions - INFO - Early stopping at epoch 1500. Best Recall: 0.0188
2026-05-19 17:25:40,683 - optuna.study.study - INFO - Trial 149 finished with value: 0.01878636997923714 and parameters: {'n_layers': 4, 'embedding_dim': 32, 'lr': 0.04608246224598833, 'lambda_val': 4.385848662038582e-05, 'batch_size': 4095, 'optimizer': 'Adam'}. Best is trial 138 with value: 0.023931469710893754.
2026-05-19 17:25:45,687 - experiment_functions - INFO - Early stopping at epoch 500. Best Recall: 0.0014
2026-05-19 17:25:45,778 - optuna.study.study - INFO - Trial 150 finished with value: 0.00143535839556092 and parameters: {'n_layers': 4, 'embedding_dim': 32, 'lr': 0.031061335864932357, 'lambda_val': 6.69735288745199e-05, 'batch_size': 3910, 'optimizer': 'SGD'}. Best is trial 138 with value: 0.023931469710893754.
2026-05-19 17:26:03,789 - experiment_functions - INFO - Early stopping at epoch 2700. Best Recall: 0.0216
2026-05-19 17:26:03,891 - optuna.study.study - INFO - Trial 151 finished with value: 0.02155492281827726 and parameters: {'n_layers': 4, 'embedding_dim': 32, 'lr': 0.04500145538757917, 'lambda_val': 2.1190831013994853e-05, 'batch_size': 3675, 'optimizer': 'Adam'}. Best is trial 138 with value: 0.023931469710893754.
2026-05-19 17:26:12,509 - optuna.study._optimize - INFO - Trial 152 pruned. 
2026-05-19 17:26:21,528 - experiment_functions - INFO - Early stopping at epoch 1050. Best Recall: 0.0173
2026-05-19 17:26:21,618 - optuna.study.study - INFO - Trial 153 finished with value: 0.017322246538569157 and parameters: {'n_layers': 4, 'embedding_dim': 32, 'lr': 0.06647612564010669, 'lambda_val': 3.3958572868512626e-05, 'batch_size': 3977, 'optimizer': 'Adam'}. Best is trial 138 with value: 0.023931469710893754.
2026-05-19 17:26:31,884 - optuna.study._optimize - INFO - Trial 154 pruned. 
2026-05-19 17:26:46,487 - optuna.study._optimize - INFO - Trial 155 pruned. 
2026-05-19 17:26:56,511 - optuna.study._optimize - INFO - Trial 156 pruned. 
2026-05-19 17:27:03,607 - experiment_functions - INFO - Early stopping at epoch 950. Best Recall: 0.0203
2026-05-19 17:27:03,710 - optuna.study.study - INFO - Trial 157 finished with value: 0.020293249721402465 and parameters: {'n_layers': 4, 'embedding_dim': 32, 'lr': 0.08580689576732607, 'lambda_val': 6.272487591142407e-05, 'batch_size': 3898, 'optimizer': 'Adam'}. Best is trial 138 with value: 0.023931469710893754.
2026-05-19 17:27:16,746 - experiment_functions - INFO - Early stopping at epoch 1550. Best Recall: 0.0191
2026-05-19 17:27:16,838 - optuna.study.study - INFO - Trial 158 finished with value: 0.019054042889208013 and parameters: {'n_layers': 4, 'embedding_dim': 96, 'lr': 0.043453450279238116, 'lambda_val': 2.0420327407847213e-05, 'batch_size': 3486, 'optimizer': 'Adam'}. Best is trial 138 with value: 0.023931469710893754.
2026-05-19 17:27:27,273 - experiment_functions - INFO - Early stopping at epoch 1500. Best Recall: 0.0203
2026-05-19 17:27:27,430 - optuna.study.study - INFO - Trial 159 finished with value: 0.02032837813822702 and parameters: {'n_layers': 4, 'embedding_dim': 32, 'lr': 0.06888342615552344, 'lambda_val': 0.00010348480385815821, 'batch_size': 3813, 'optimizer': 'Adam'}. Best is trial 138 with value: 0.023931469710893754.
2026-05-19 17:27:34,907 - experiment_functions - INFO - Early stopping at epoch 1100. Best Recall: 0.0197
2026-05-19 17:27:35,009 - optuna.study.study - INFO - Trial 160 finished with value: 0.01970696273739857 and parameters: {'n_layers': 4, 'embedding_dim': 32, 'lr': 0.05891665500127037, 'lambda_val': 3.913777679616547e-05, 'batch_size': 3650, 'optimizer': 'Adam'}. Best is trial 138 with value: 0.023931469710893754.
2026-05-19 17:27:44,353 - experiment_functions - INFO - Early stopping at epoch 1050. Best Recall: 0.0162
2026-05-19 17:27:44,477 - optuna.study.study - INFO - Trial 161 finished with value: 0.016182304176108223 and parameters: {'n_layers': 4, 'embedding_dim': 32, 'lr': 0.07996617597101628, 'lambda_val': 0.0001150136986209928, 'batch_size': 3828, 'optimizer': 'Adam'}. Best is trial 138 with value: 0.023931469710893754.
2026-05-19 17:28:00,762 - optuna.study._optimize - INFO - Trial 162 pruned. 
2026-05-19 17:28:08,216 - optuna.study._optimize - INFO - Trial 163 pruned. 
2026-05-19 17:28:13,217 - experiment_functions - INFO - Early stopping at epoch 550. Best Recall: 0.0094
2026-05-19 17:28:13,318 - optuna.study.study - INFO - Trial 164 finished with value: 0.009390694534168038 and parameters: {'n_layers': 4, 'embedding_dim': 32, 'lr': 0.0009551487432863481, 'lambda_val': 5.8227047124391313e-05, 'batch_size': 1160, 'optimizer': 'RMSprop'}. Best is trial 138 with value: 0.023931469710893754.
2026-05-19 17:28:25,584 - optuna.study._optimize - INFO - Trial 165 pruned. 
2026-05-19 17:28:37,796 - experiment_functions - INFO - Early stopping at epoch 1800. Best Recall: 0.0210
2026-05-19 17:28:37,941 - optuna.study.study - INFO - Trial 166 finished with value: 0.0210424541577556 and parameters: {'n_layers': 4, 'embedding_dim': 32, 'lr': 0.0732421217708074, 'lambda_val': 3.074187785900918e-05, 'batch_size': 3924, 'optimizer': 'Adam'}. Best is trial 138 with value: 0.023931469710893754.
2026-05-19 17:28:50,300 - optuna.study._optimize - INFO - Trial 167 pruned. 
2026-05-19 17:28:58,551 - experiment_functions - INFO - Early stopping at epoch 1200. Best Recall: 0.0170
2026-05-19 17:28:59,038 - optuna.study.study - INFO - Trial 168 finished with value: 0.016992079861779585 and parameters: {'n_layers': 4, 'embedding_dim': 32, 'lr': 0.08808410697679397, 'lambda_val': 1.665131110341363e-05, 'batch_size': 3901, 'optimizer': 'Adam'}. Best is trial 138 with value: 0.023931469710893754.
2026-05-19 17:29:08,445 - experiment_functions - INFO - Early stopping at epoch 1350. Best Recall: 0.0205
