2026-05-19 18:52:13,383 - optuna.study.study - INFO - Trial 56 finished with value: 0.013829695029418353 and parameters: {'n_layers': 1, 'embedding_dim': 256, 'lr': 0.007080752987666892, 'lambda_val': 0.00021137628767989398, 'batch_size': 1052, 'optimizer': 'Adam'}. Best is trial 31 with value: 0.020010531998768788.
2026-05-19 18:52:19,035 - experiment_functions - INFO - Early stopping at epoch 500. Best Recall: 0.0022
2026-05-19 18:52:19,135 - optuna.study.study - INFO - Trial 57 finished with value: 0.0022128092669528765 and parameters: {'n_layers': 1, 'embedding_dim': 96, 'lr': 0.0034628878956076913, 'lambda_val': 0.009615913123545863, 'batch_size': 1585, 'optimizer': 'SGD'}. Best is trial 31 with value: 0.020010531998768788.
2026-05-19 18:52:24,666 - experiment_functions - INFO - Early stopping at epoch 550. Best Recall: 0.0150
2026-05-19 18:52:24,770 - optuna.study.study - INFO - Trial 58 finished with value: 0.015015369955303113 and parameters: {'n_layers': 1, 'embedding_dim': 256, 'lr': 0.004643793556338499, 'lambda_val': 0.0024947111385828467, 'batch_size': 1743, 'optimizer': 'Adam'}. Best is trial 31 with value: 0.020010531998768788.
2026-05-19 18:52:28,765 - experiment_functions - INFO - Early stopping at epoch 550. Best Recall: 0.0095
2026-05-19 18:52:28,856 - optuna.study.study - INFO - Trial 59 finished with value: 0.009530615659305776 and parameters: {'n_layers': 2, 'embedding_dim': 32, 'lr': 0.0017526937782476484, 'lambda_val': 0.00012011353724727003, 'batch_size': 1114, 'optimizer': 'RMSprop'}. Best is trial 31 with value: 0.020010531998768788.
2026-05-19 18:52:33,191 - experiment_functions - INFO - Early stopping at epoch 650. Best Recall: 0.0038
2026-05-19 18:52:33,294 - optuna.study.study - INFO - Trial 60 finished with value: 0.003839446154532628 and parameters: {'n_layers': 1, 'embedding_dim': 256, 'lr': 0.0015419737231675786, 'lambda_val': 0.06149696869164474, 'batch_size': 1856, 'optimizer': 'Adam'}. Best is trial 31 with value: 0.020010531998768788.
2026-05-19 18:52:37,836 - experiment_functions - INFO - Early stopping at epoch 550. Best Recall: 0.0068
2026-05-19 18:52:37,928 - optuna.study.study - INFO - Trial 61 finished with value: 0.0067806385320766625 and parameters: {'n_layers': 1, 'embedding_dim': 256, 'lr': 0.010199585334774485, 'lambda_val': 0.00409106279995656, 'batch_size': 655, 'optimizer': 'Adam'}. Best is trial 31 with value: 0.020010531998768788.
2026-05-19 18:52:43,965 - experiment_functions - INFO - Early stopping at epoch 900. Best Recall: 0.0152
2026-05-19 18:52:44,067 - optuna.study.study - INFO - Trial 62 finished with value: 0.015210012617769861 and parameters: {'n_layers': 1, 'embedding_dim': 256, 'lr': 0.0004980653351868882, 'lambda_val': 0.0004833462183927458, 'batch_size': 858, 'optimizer': 'Adam'}. Best is trial 31 with value: 0.020010531998768788.
2026-05-19 18:52:48,988 - experiment_functions - INFO - Early stopping at epoch 550. Best Recall: 0.0105
2026-05-19 18:52:49,090 - optuna.study.study - INFO - Trial 63 finished with value: 0.0105340840609199 and parameters: {'n_layers': 1, 'embedding_dim': 256, 'lr': 0.004284054197000865, 'lambda_val': 0.005224444694028696, 'batch_size': 1253, 'optimizer': 'Adam'}. Best is trial 31 with value: 0.020010531998768788.
2026-05-19 18:52:53,410 - experiment_functions - INFO - Early stopping at epoch 550. Best Recall: 0.0177
2026-05-19 18:52:53,523 - optuna.study.study - INFO - Trial 64 finished with value: 0.017651672623088917 and parameters: {'n_layers': 1, 'embedding_dim': 256, 'lr': 0.0025568869920733006, 'lambda_val': 0.0018828229317543117, 'batch_size': 723, 'optimizer': 'Adam'}. Best is trial 31 with value: 0.020010531998768788.
2026-05-19 18:52:58,232 - experiment_functions - INFO - Early stopping at epoch 550. Best Recall: 0.0100
2026-05-19 18:52:58,324 - optuna.study.study - INFO - Trial 65 finished with value: 0.01000162757575272 and parameters: {'n_layers': 1, 'embedding_dim': 256, 'lr': 0.006376448367699022, 'lambda_val': 0.0010173829884975723, 'batch_size': 1307, 'optimizer': 'Adam'}. Best is trial 31 with value: 0.020010531998768788.
2026-05-19 18:53:02,500 - experiment_functions - INFO - Early stopping at epoch 600. Best Recall: 0.0217
2026-05-19 18:53:02,596 - optuna.study.study - INFO - Trial 66 finished with value: 0.021653919758284377 and parameters: {'n_layers': 1, 'embedding_dim': 128, 'lr': 0.0024704244639631254, 'lambda_val': 0.0016844310455029392, 'batch_size': 666, 'optimizer': 'Adam'}. Best is trial 66 with value: 0.021653919758284377.
2026-05-19 18:53:06,934 - experiment_functions - INFO - Early stopping at epoch 600. Best Recall: 0.0154
2026-05-19 18:53:07,071 - optuna.study.study - INFO - Trial 67 finished with value: 0.01537141181488504 and parameters: {'n_layers': 1, 'embedding_dim': 128, 'lr': 0.002085099745558857, 'lambda_val': 0.0017182585290773807, 'batch_size': 630, 'optimizer': 'Adam'}. Best is trial 66 with value: 0.021653919758284377.
2026-05-19 18:53:12,697 - experiment_functions - INFO - Early stopping at epoch 550. Best Recall: 0.0071
2026-05-19 18:53:12,787 - optuna.study.study - INFO - Trial 68 finished with value: 0.007068569674677503 and parameters: {'n_layers': 2, 'embedding_dim': 128, 'lr': 0.0013115161843261002, 'lambda_val': 0.002674705803425474, 'batch_size': 760, 'optimizer': 'RMSprop'}. Best is trial 66 with value: 0.021653919758284377.
2026-05-19 18:53:18,839 - experiment_functions - INFO - Early stopping at epoch 850. Best Recall: 0.0176
2026-05-19 18:53:18,942 - optuna.study.study - INFO - Trial 69 finished with value: 0.01759398645937563 and parameters: {'n_layers': 1, 'embedding_dim': 128, 'lr': 0.0007401128408342021, 'lambda_val': 0.0005041441183425924, 'batch_size': 520, 'optimizer': 'Adam'}. Best is trial 66 with value: 0.021653919758284377.
2026-05-19 18:53:28,082 - experiment_functions - INFO - Early stopping at epoch 1250. Best Recall: 0.0202
2026-05-19 18:53:28,175 - optuna.study.study - INFO - Trial 70 finished with value: 0.020164336916382395 and parameters: {'n_layers': 1, 'embedding_dim': 128, 'lr': 0.0005788665296310212, 'lambda_val': 1.6085820322158413e-06, 'batch_size': 517, 'optimizer': 'Adam'}. Best is trial 66 with value: 0.021653919758284377.
2026-05-19 18:53:33,547 - experiment_functions - INFO - Early stopping at epoch 800. Best Recall: 0.0218
2026-05-19 18:53:33,677 - optuna.study.study - INFO - Trial 71 finished with value: 0.02181861768286854 and parameters: {'n_layers': 1, 'embedding_dim': 128, 'lr': 0.0007429971454004787, 'lambda_val': 5.637556629649076e-06, 'batch_size': 538, 'optimizer': 'Adam'}. Best is trial 71 with value: 0.02181861768286854.
2026-05-19 18:53:41,985 - experiment_functions - INFO - Early stopping at epoch 1350. Best Recall: 0.0255
2026-05-19 18:53:42,146 - optuna.study.study - INFO - Trial 72 finished with value: 0.025524926419082328 and parameters: {'n_layers': 1, 'embedding_dim': 128, 'lr': 0.0005015986461078876, 'lambda_val': 1.3855552750488768e-06, 'batch_size': 587, 'optimizer': 'Adam'}. Best is trial 72 with value: 0.025524926419082328.
2026-05-19 18:53:56,285 - experiment_functions - INFO - Early stopping at epoch 1900. Best Recall: 0.0173
2026-05-19 18:53:56,396 - optuna.study.study - INFO - Trial 73 finished with value: 0.017258652015137925 and parameters: {'n_layers': 1, 'embedding_dim': 128, 'lr': 0.00029903552097594415, 'lambda_val': 2.561022615816048e-06, 'batch_size': 610, 'optimizer': 'Adam'}. Best is trial 72 with value: 0.025524926419082328.
2026-05-19 18:54:04,421 - experiment_functions - INFO - Early stopping at epoch 1200. Best Recall: 0.0213
2026-05-19 18:54:04,557 - optuna.study.study - INFO - Trial 74 finished with value: 0.021289211263808092 and parameters: {'n_layers': 1, 'embedding_dim': 128, 'lr': 0.0005219592816669374, 'lambda_val': 2.1742298508769505e-06, 'batch_size': 534, 'optimizer': 'Adam'}. Best is trial 72 with value: 0.025524926419082328.
2026-05-19 18:54:13,815 - experiment_functions - INFO - Early stopping at epoch 1450. Best Recall: 0.0181
2026-05-19 18:54:13,917 - optuna.study.study - INFO - Trial 75 finished with value: 0.018123583180948297 and parameters: {'n_layers': 1, 'embedding_dim': 128, 'lr': 0.0005494348819261087, 'lambda_val': 1.0959512388940262e-06, 'batch_size': 529, 'optimizer': 'Adam'}. Best is trial 72 with value: 0.025524926419082328.
2026-05-19 18:54:22,177 - experiment_functions - INFO - Early stopping at epoch 1200. Best Recall: 0.0195
2026-05-19 18:54:22,280 - optuna.study.study - INFO - Trial 76 finished with value: 0.01947287089599636 and parameters: {'n_layers': 1, 'embedding_dim': 128, 'lr': 0.0004077146720979991, 'lambda_val': 2.0755875593663303e-06, 'batch_size': 822, 'optimizer': 'Adam'}. Best is trial 72 with value: 0.025524926419082328.
2026-05-19 18:54:25,858 - experiment_functions - INFO - Early stopping at epoch 500. Best Recall: 0.0015
2026-05-19 18:54:25,949 - optuna.study.study - INFO - Trial 77 finished with value: 0.0014841485521964637 and parameters: {'n_layers': 1, 'embedding_dim': 128, 'lr': 0.00018636067852197702, 'lambda_val': 1.8691844931733447e-06, 'batch_size': 858, 'optimizer': 'SGD'}. Best is trial 72 with value: 0.025524926419082328.
2026-05-19 18:54:35,053 - experiment_functions - INFO - Early stopping at epoch 1250. Best Recall: 0.0210
2026-05-19 18:54:35,146 - optuna.study.study - INFO - Trial 78 finished with value: 0.021044664606111572 and parameters: {'n_layers': 1, 'embedding_dim': 128, 'lr': 0.00040125267181555935, 'lambda_val': 5.364128803403347e-06, 'batch_size': 640, 'optimizer': 'Adam'}. Best is trial 72 with value: 0.025524926419082328.
2026-05-19 18:54:41,984 - optuna.study._optimize - INFO - Trial 79 pruned. 
2026-05-19 18:54:46,577 - experiment_functions - INFO - Early stopping at epoch 600. Best Recall: 0.0122
2026-05-19 18:54:46,690 - optuna.study.study - INFO - Trial 80 finished with value: 0.012244308218224196 and parameters: {'n_layers': 1, 'embedding_dim': 128, 'lr': 0.0008694767154221017, 'lambda_val': 3.5546194146731563e-06, 'batch_size': 966, 'optimizer': 'RMSprop'}. Best is trial 72 with value: 0.025524926419082328.
2026-05-19 18:54:54,119 - experiment_functions - INFO - Early stopping at epoch 1150. Best Recall: 0.0201
2026-05-19 18:54:54,229 - optuna.study.study - INFO - Trial 81 finished with value: 0.02010019986912916 and parameters: {'n_layers': 1, 'embedding_dim': 128, 'lr': 0.0004160054272798838, 'lambda_val': 1.6767676792988474e-06, 'batch_size': 731, 'optimizer': 'Adam'}. Best is trial 72 with value: 0.025524926419082328.
2026-05-19 18:55:04,647 - experiment_functions - INFO - Early stopping at epoch 1550. Best Recall: 0.0245
2026-05-19 18:55:04,739 - optuna.study.study - INFO - Trial 82 finished with value: 0.024451216169806802 and parameters: {'n_layers': 1, 'embedding_dim': 128, 'lr': 0.00041546187167115604, 'lambda_val': 1.5665721550129904e-05, 'batch_size': 588, 'optimizer': 'Adam'}. Best is trial 72 with value: 0.025524926419082328.
2026-05-19 18:55:13,227 - optuna.study._optimize - INFO - Trial 83 pruned. 
2026-05-19 18:55:19,201 - optuna.study._optimize - INFO - Trial 84 pruned. 
2026-05-19 18:55:24,055 - experiment_functions - INFO - Early stopping at epoch 700. Best Recall: 0.0081
2026-05-19 18:55:24,179 - optuna.study.study - INFO - Trial 85 finished with value: 0.008144021462357433 and parameters: {'n_layers': 4, 'embedding_dim': 128, 'lr': 0.0006067731825476826, 'lambda_val': 1.4698543585660494e-06, 'batch_size': 517, 'optimizer': 'Adam'}. Best is trial 72 with value: 0.025524926419082328.
2026-05-19 18:55:37,295 - experiment_functions - INFO - Early stopping at epoch 2500. Best Recall: 0.0242
2026-05-19 18:55:37,395 - optuna.study.study - INFO - Trial 86 finished with value: 0.024243406525714113 and parameters: {'n_layers': 1, 'embedding_dim': 128, 'lr': 0.00027062530843884324, 'lambda_val': 3.149941057207761e-06, 'batch_size': 714, 'optimizer': 'Adam'}. Best is trial 72 with value: 0.025524926419082328.
2026-05-19 18:55:43,373 - optuna.study._optimize - INFO - Trial 87 pruned. 
2026-05-19 18:55:49,667 - optuna.study._optimize - INFO - Trial 88 pruned. 
2026-05-19 18:55:55,626 - optuna.study._optimize - INFO - Trial 89 pruned. 
2026-05-19 18:56:01,680 - optuna.study._optimize - INFO - Trial 90 pruned. 
2026-05-19 18:56:08,023 - experiment_functions - INFO - Early stopping at epoch 1050. Best Recall: 0.0219
2026-05-19 18:56:08,122 - optuna.study.study - INFO - Trial 91 finished with value: 0.02191598012329685 and parameters: {'n_layers': 1, 'embedding_dim': 128, 'lr': 0.0006496446235572846, 'lambda_val': 4.398725629162334e-06, 'batch_size': 582, 'optimizer': 'Adam'}. Best is trial 72 with value: 0.025524926419082328.
2026-05-19 18:56:14,288 - experiment_functions - INFO - Early stopping at epoch 1050. Best Recall: 0.0219
2026-05-19 18:56:14,391 - optuna.study.study - INFO - Trial 92 finished with value: 0.021851258382557918 and parameters: {'n_layers': 1, 'embedding_dim': 128, 'lr': 0.0006795782833959296, 'lambda_val': 4.360445107113883e-06, 'batch_size': 591, 'optimizer': 'Adam'}. Best is trial 72 with value: 0.025524926419082328.
2026-05-19 18:56:21,079 - experiment_functions - INFO - Early stopping at epoch 900. Best Recall: 0.0227
2026-05-19 18:56:21,169 - optuna.study.study - INFO - Trial 93 finished with value: 0.022705963690496826 and parameters: {'n_layers': 1, 'embedding_dim': 128, 'lr': 0.0006134478577133029, 'lambda_val': 1.004823780984463e-05, 'batch_size': 592, 'optimizer': 'Adam'}. Best is trial 72 with value: 0.025524926419082328.
2026-05-19 18:56:26,218 - experiment_functions - INFO - Early stopping at epoch 900. Best Recall: 0.0172
2026-05-19 18:56:26,310 - optuna.study.study - INFO - Trial 94 finished with value: 0.01717587211740391 and parameters: {'n_layers': 1, 'embedding_dim': 128, 'lr': 0.0007113734404395045, 'lambda_val': 1.050217142112015e-05, 'batch_size': 598, 'optimizer': 'Adam'}. Best is trial 72 with value: 0.025524926419082328.
2026-05-19 18:56:32,117 - optuna.study._optimize - INFO - Trial 95 pruned. 
2026-05-19 18:56:41,279 - optuna.study._optimize - INFO - Trial 96 pruned. 
2026-05-19 18:56:44,363 - experiment_functions - INFO - Early stopping at epoch 500. Best Recall: 0.0010
2026-05-19 18:56:44,454 - optuna.study.study - INFO - Trial 97 finished with value: 0.0009651214942183432 and parameters: {'n_layers': 1, 'embedding_dim': 128, 'lr': 0.0010071331561792164, 'lambda_val': 8.615041334651403e-06, 'batch_size': 586, 'optimizer': 'SGD'}. Best is trial 72 with value: 0.025524926419082328.
2026-05-19 18:56:52,775 - optuna.study._optimize - INFO - Trial 98 pruned. 
2026-05-19 18:56:58,651 - optuna.study._optimize - INFO - Trial 99 pruned. 
2026-05-19 18:57:02,817 - experiment_functions - INFO - Early stopping at epoch 650. Best Recall: 0.0185
2026-05-19 18:57:02,918 - optuna.study.study - INFO - Trial 100 finished with value: 0.018480025047865358 and parameters: {'n_layers': 1, 'embedding_dim': 128, 'lr': 0.001284624903247076, 'lambda_val': 3.8090979167598798e-06, 'batch_size': 689, 'optimizer': 'Adam'}. Best is trial 72 with value: 0.025524926419082328.
2026-05-19 18:57:09,667 - experiment_functions - INFO - Early stopping at epoch 950. Best Recall: 0.0195
2026-05-19 18:57:09,778 - optuna.study.study - INFO - Trial 101 finished with value: 0.019513619310610224 and parameters: {'n_layers': 1, 'embedding_dim': 128, 'lr': 0.000553824011660419, 'lambda_val': 1.3051212405522525e-06, 'batch_size': 530, 'optimizer': 'Adam'}. Best is trial 72 with value: 0.025524926419082328.
2026-05-19 18:57:15,637 - experiment_functions - INFO - Early stopping at epoch 1000. Best Recall: 0.0190
2026-05-19 18:57:15,738 - optuna.study.study - INFO - Trial 102 finished with value: 0.019038881853658436 and parameters: {'n_layers': 1, 'embedding_dim': 128, 'lr': 0.0006731319889857761, 'lambda_val': 1.0592338910617633e-06, 'batch_size': 583, 'optimizer': 'Adam'}. Best is trial 72 with value: 0.025524926419082328.
2026-05-19 18:57:21,278 - optuna.study._optimize - INFO - Trial 103 pruned. 
2026-05-19 18:57:26,714 - experiment_functions - INFO - Early stopping at epoch 850. Best Recall: 0.0204
2026-05-19 18:57:26,805 - optuna.study.study - INFO - Trial 104 finished with value: 0.020419421239063738 and parameters: {'n_layers': 1, 'embedding_dim': 128, 'lr': 0.000818871769020872, 'lambda_val': 4.885569564438266e-06, 'batch_size': 517, 'optimizer': 'Adam'}. Best is trial 72 with value: 0.025524926419082328.
2026-05-19 18:57:30,870 - experiment_functions - INFO - Early stopping at epoch 650. Best Recall: 0.0204
2026-05-19 18:57:30,968 - optuna.study.study - INFO - Trial 105 finished with value: 0.020427865517168825 and parameters: {'n_layers': 1, 'embedding_dim': 128, 'lr': 0.0009199003077175644, 'lambda_val': 4.685882022236281e-06, 'batch_size': 2472, 'optimizer': 'Adam'}. Best is trial 72 with value: 0.025524926419082328.
2026-05-19 18:57:38,831 - optuna.study._optimize - INFO - Trial 106 pruned. 
2026-05-19 18:57:43,148 - experiment_functions - INFO - Early stopping at epoch 650. Best Recall: 0.0138
2026-05-19 18:57:43,246 - optuna.study.study - INFO - Trial 107 finished with value: 0.013754697205609633 and parameters: {'n_layers': 1, 'embedding_dim': 96, 'lr': 0.0012379473329145428, 'lambda_val': 4.142139702063762e-05, 'batch_size': 3415, 'optimizer': 'Adam'}. Best is trial 72 with value: 0.025524926419082328.
2026-05-19 18:57:49,234 - optuna.study._optimize - INFO - Trial 108 pruned. 
2026-05-19 18:57:53,348 - experiment_functions - INFO - Early stopping at epoch 650. Best Recall: 0.0127
2026-05-19 18:57:53,440 - optuna.study.study - INFO - Trial 109 finished with value: 0.012741721698093079 and parameters: {'n_layers': 1, 'embedding_dim': 128, 'lr': 0.0009162641159152696, 'lambda_val': 2.2647454686255096e-06, 'batch_size': 2697, 'optimizer': 'Adam'}. Best is trial 72 with value: 0.025524926419082328.
2026-05-19 18:58:06,848 - experiment_functions - INFO - Early stopping at epoch 700. Best Recall: 0.0094
2026-05-19 18:58:06,984 - optuna.study.study - INFO - Trial 110 finished with value: 0.009441812444557088 and parameters: {'n_layers': 1, 'embedding_dim': 128, 'lr': 0.0006920436983588165, 'lambda_val': 2.239042501961242e-05, 'batch_size': 2885, 'optimizer': 'Adam'}. Best is trial 72 with value: 0.025524926419082328.
2026-05-19 18:58:11,224 - experiment_functions - INFO - Early stopping at epoch 700. Best Recall: 0.0173
2026-05-19 18:58:11,315 - optuna.study.study - INFO - Trial 111 finished with value: 0.017289500943964992 and parameters: {'n_layers': 1, 'embedding_dim': 128, 'lr': 0.0007529187271750789, 'lambda_val': 4.531697274891893e-06, 'batch_size': 2355, 'optimizer': 'Adam'}. Best is trial 72 with value: 0.025524926419082328.
2026-05-19 18:58:15,965 - experiment_functions - INFO - Early stopping at epoch 800. Best Recall: 0.0139
2026-05-19 18:58:16,067 - optuna.study.study - INFO - Trial 112 finished with value: 0.013893518054521032 and parameters: {'n_layers': 1, 'embedding_dim': 128, 'lr': 0.0004843827778030958, 'lambda_val': 4.862681217835694e-06, 'batch_size': 2227, 'optimizer': 'Adam'}. Best is trial 72 with value: 0.025524926419082328.
2026-05-19 18:58:22,062 - optuna.study._optimize - INFO - Trial 113 pruned. 
2026-05-19 18:58:26,608 - experiment_functions - INFO - Early stopping at epoch 750. Best Recall: 0.0185
2026-05-19 18:58:26,699 - optuna.study.study - INFO - Trial 114 finished with value: 0.01851645001529453 and parameters: {'n_layers': 1, 'embedding_dim': 128, 'lr': 0.0008033849529807046, 'lambda_val': 9.062372636324352e-06, 'batch_size': 835, 'optimizer': 'Adam'}. Best is trial 72 with value: 0.025524926419082328.
2026-05-19 18:58:32,783 - experiment_functions - INFO - Early stopping at epoch 950. Best Recall: 0.0068
2026-05-19 18:58:32,880 - optuna.study.study - INFO - Trial 115 finished with value: 0.0067976521355408055 and parameters: {'n_layers': 3, 'embedding_dim': 128, 'lr': 0.0003355997438948668, 'lambda_val': 6.039572724533137e-06, 'batch_size': 2463, 'optimizer': 'Adam'}. Best is trial 72 with value: 0.025524926419082328.
2026-05-19 18:58:37,939 - experiment_functions - INFO - Early stopping at epoch 750. Best Recall: 0.0161
2026-05-19 18:58:38,040 - optuna.study.study - INFO - Trial 116 finished with value: 0.01612105555675046 and parameters: {'n_layers': 1, 'embedding_dim': 128, 'lr': 0.0010667083907668806, 'lambda_val': 1.4224148069805999e-05, 'batch_size': 576, 'optimizer': 'Adam'}. Best is trial 72 with value: 0.025524926419082328.
2026-05-19 18:58:41,421 - experiment_functions - INFO - Early stopping at epoch 500. Best Recall: 0.0025
2026-05-19 18:58:41,503 - optuna.study.study - INFO - Trial 117 finished with value: 0.0024674445248219945 and parameters: {'n_layers': 1, 'embedding_dim': 64, 'lr': 0.0017182093632616532, 'lambda_val': 2.7576068245436455e-06, 'batch_size': 658, 'optimizer': 'SGD'}. Best is trial 72 with value: 0.025524926419082328.
2026-05-19 18:58:47,351 - optuna.study._optimize - INFO - Trial 118 pruned. 
2026-05-19 18:58:53,758 - experiment_functions - INFO - Early stopping at epoch 800. Best Recall: 0.0147
2026-05-19 18:58:53,860 - optuna.study.study - INFO - Trial 119 finished with value: 0.014739462917311692 and parameters: {'n_layers': 1, 'embedding_dim': 128, 'lr': 0.0008899862414338895, 'lambda_val': 3.9013109599251445e-06, 'batch_size': 923, 'optimizer': 'Adam'}. Best is trial 72 with value: 0.025524926419082328.
2026-05-19 18:58:58,709 - experiment_functions - INFO - Early stopping at epoch 750. Best Recall: 0.0145
2026-05-19 18:58:58,809 - optuna.study.study - INFO - Trial 120 finished with value: 0.01453957302069742 and parameters: {'n_layers': 2, 'embedding_dim': 128, 'lr': 0.0004623727126819346, 'lambda_val': 5.32497930946406e-06, 'batch_size': 512, 'optimizer': 'Adam'}. Best is trial 72 with value: 0.025524926419082328.
2026-05-19 18:59:04,271 - experiment_functions - INFO - Early stopping at epoch 900. Best Recall: 0.0196
