2026-05-19 20:19:42,926 - optuna.study.study - INFO - Trial 155 finished with value: 0.02805669241057799 and parameters: {'n_layers': 1, 'embedding_dim': 96, 'lr': 0.0006453265796315503, 'lambda_val': 1.2973513789301885e-05, 'batch_size': 679, 'optimizer': 'Adam'}. Best is trial 146 with value: 0.0349361693699917.
2026-05-19 20:19:50,077 - optuna.study._optimize - INFO - Trial 156 pruned. 
2026-05-19 20:19:55,808 - optuna.study._optimize - INFO - Trial 157 pruned. 
2026-05-19 20:20:01,781 - optuna.study._optimize - INFO - Trial 158 pruned. 
2026-05-19 20:20:07,153 - experiment_functions - INFO - Early stopping at epoch 900. Best Recall: 0.0292
2026-05-19 20:20:07,254 - optuna.study.study - INFO - Trial 159 finished with value: 0.02923782894585369 and parameters: {'n_layers': 1, 'embedding_dim': 96, 'lr': 0.0006790039329083019, 'lambda_val': 9.463716953861943e-06, 'batch_size': 768, 'optimizer': 'Adam'}. Best is trial 146 with value: 0.0349361693699917.
2026-05-19 20:20:13,555 - experiment_functions - INFO - Early stopping at epoch 800. Best Recall: 0.0260
2026-05-19 20:20:13,655 - optuna.study.study - INFO - Trial 160 finished with value: 0.025997793819754242 and parameters: {'n_layers': 1, 'embedding_dim': 96, 'lr': 0.0007298214863697251, 'lambda_val': 2.57418851464173e-05, 'batch_size': 821, 'optimizer': 'Adam'}. Best is trial 146 with value: 0.0349361693699917.
2026-05-19 20:20:19,973 - optuna.study._optimize - INFO - Trial 161 pruned. 
2026-05-19 20:20:25,244 - optuna.study._optimize - INFO - Trial 162 pruned. 
2026-05-19 20:20:30,508 - experiment_functions - INFO - Early stopping at epoch 850. Best Recall: 0.0215
2026-05-19 20:20:30,600 - optuna.study.study - INFO - Trial 163 finished with value: 0.02150992838143836 and parameters: {'n_layers': 1, 'embedding_dim': 96, 'lr': 0.0006528816112705056, 'lambda_val': 1.6386786891839647e-05, 'batch_size': 975, 'optimizer': 'Adam'}. Best is trial 146 with value: 0.0349361693699917.
2026-05-19 20:20:36,358 - experiment_functions - INFO - Early stopping at epoch 950. Best Recall: 0.0277
2026-05-19 20:20:36,458 - optuna.study.study - INFO - Trial 164 finished with value: 0.027671340819948043 and parameters: {'n_layers': 1, 'embedding_dim': 96, 'lr': 0.0008997477538906293, 'lambda_val': 2.2569605654522183e-06, 'batch_size': 732, 'optimizer': 'Adam'}. Best is trial 146 with value: 0.0349361693699917.
2026-05-19 20:20:43,085 - optuna.study._optimize - INFO - Trial 165 pruned. 
2026-05-19 20:20:51,099 - optuna.study._optimize - INFO - Trial 166 pruned. 
2026-05-19 20:20:56,122 - optuna.study._optimize - INFO - Trial 167 pruned. 
2026-05-19 20:20:58,911 - experiment_functions - INFO - Early stopping at epoch 500. Best Recall: 0.0013
2026-05-19 20:20:58,981 - optuna.study.study - INFO - Trial 168 finished with value: 0.0012706400094448385 and parameters: {'n_layers': 1, 'embedding_dim': 96, 'lr': 0.0012043199490434071, 'lambda_val': 0.004682556726717962, 'batch_size': 512, 'optimizer': 'SGD'}. Best is trial 146 with value: 0.0349361693699917.
2026-05-19 20:21:08,190 - experiment_functions - INFO - Early stopping at epoch 1950. Best Recall: 0.0351
2026-05-19 20:21:08,285 - optuna.study.study - INFO - Trial 169 finished with value: 0.03511561415870754 and parameters: {'n_layers': 1, 'embedding_dim': 96, 'lr': 0.0002938440471656105, 'lambda_val': 3.4242139877126145e-06, 'batch_size': 656, 'optimizer': 'Adam'}. Best is trial 169 with value: 0.03511561415870754.
2026-05-19 20:21:13,417 - experiment_functions - INFO - Early stopping at epoch 850. Best Recall: 0.0232
2026-05-19 20:21:13,534 - optuna.study.study - INFO - Trial 170 finished with value: 0.02319676964027374 and parameters: {'n_layers': 1, 'embedding_dim': 96, 'lr': 0.00044972302886466485, 'lambda_val': 3.7945963622058982e-06, 'batch_size': 2551, 'optimizer': 'Adam'}. Best is trial 169 with value: 0.03511561415870754.
2026-05-19 20:21:19,667 - optuna.study._optimize - INFO - Trial 171 pruned. 
2026-05-19 20:21:26,967 - experiment_functions - INFO - Early stopping at epoch 950. Best Recall: 0.0305
2026-05-19 20:21:27,057 - optuna.study.study - INFO - Trial 172 finished with value: 0.030453538957059642 and parameters: {'n_layers': 1, 'embedding_dim': 96, 'lr': 0.0006322346557670681, 'lambda_val': 4.7635594617730665e-06, 'batch_size': 755, 'optimizer': 'Adam'}. Best is trial 169 with value: 0.03511561415870754.
2026-05-19 20:21:30,925 - experiment_functions - INFO - Early stopping at epoch 650. Best Recall: 0.0176
2026-05-19 20:21:31,018 - optuna.study.study - INFO - Trial 173 finished with value: 0.017560305518687175 and parameters: {'n_layers': 1, 'embedding_dim': 96, 'lr': 0.0009181929018948582, 'lambda_val': 5.0376749625434086e-06, 'batch_size': 2837, 'optimizer': 'Adam'}. Best is trial 169 with value: 0.03511561415870754.
2026-05-19 20:21:36,963 - optuna.study._optimize - INFO - Trial 174 pruned. 
2026-05-19 20:21:43,514 - optuna.study._optimize - INFO - Trial 175 pruned. 
2026-05-19 20:21:48,211 - experiment_functions - INFO - Early stopping at epoch 700. Best Recall: 0.0298
2026-05-19 20:21:48,307 - optuna.study.study - INFO - Trial 176 finished with value: 0.029756683020725583 and parameters: {'n_layers': 1, 'embedding_dim': 96, 'lr': 0.0007215940037402316, 'lambda_val': 6.365999144736181e-06, 'batch_size': 735, 'optimizer': 'RMSprop'}. Best is trial 169 with value: 0.03511561415870754.
2026-05-19 20:21:54,884 - optuna.study._optimize - INFO - Trial 177 pruned. 
2026-05-19 20:22:03,238 - experiment_functions - INFO - Early stopping at epoch 1250. Best Recall: 0.0306
2026-05-19 20:22:03,329 - optuna.study.study - INFO - Trial 178 finished with value: 0.030618157750456027 and parameters: {'n_layers': 1, 'embedding_dim': 96, 'lr': 0.0003750609378605634, 'lambda_val': 6.98709948440116e-06, 'batch_size': 844, 'optimizer': 'RMSprop'}. Best is trial 169 with value: 0.03511561415870754.
2026-05-19 20:22:16,699 - experiment_functions - INFO - Early stopping at epoch 2550. Best Recall: 0.0372
2026-05-19 20:22:16,782 - optuna.study.study - INFO - Trial 179 finished with value: 0.037216764109935734 and parameters: {'n_layers': 1, 'embedding_dim': 96, 'lr': 0.0002602249818544327, 'lambda_val': 9.493596750245271e-06, 'batch_size': 868, 'optimizer': 'RMSprop'}. Best is trial 179 with value: 0.037216764109935734.
2026-05-19 20:22:22,911 - optuna.study._optimize - INFO - Trial 180 pruned. 
2026-05-19 20:22:31,184 - experiment_functions - INFO - Early stopping at epoch 1700. Best Recall: 0.0321
2026-05-19 20:22:31,329 - optuna.study.study - INFO - Trial 181 finished with value: 0.032104334478556235 and parameters: {'n_layers': 1, 'embedding_dim': 96, 'lr': 0.0003697823500760997, 'lambda_val': 9.189255001886809e-06, 'batch_size': 922, 'optimizer': 'RMSprop'}. Best is trial 179 with value: 0.037216764109935734.
2026-05-19 20:22:36,784 - optuna.study._optimize - INFO - Trial 182 pruned. 
2026-05-19 20:22:46,663 - experiment_functions - INFO - Early stopping at epoch 1700. Best Recall: 0.0313
2026-05-19 20:22:46,763 - optuna.study.study - INFO - Trial 183 finished with value: 0.03132548565358034 and parameters: {'n_layers': 1, 'embedding_dim': 96, 'lr': 0.00036243097657441786, 'lambda_val': 6.580359735608592e-06, 'batch_size': 924, 'optimizer': 'RMSprop'}. Best is trial 179 with value: 0.037216764109935734.
2026-05-19 20:22:52,957 - optuna.study._optimize - INFO - Trial 184 pruned. 
2026-05-19 20:23:00,255 - optuna.study._optimize - INFO - Trial 185 pruned. 
2026-05-19 20:23:05,945 - optuna.study._optimize - INFO - Trial 186 pruned. 
2026-05-19 20:23:11,844 - optuna.study._optimize - INFO - Trial 187 pruned. 
2026-05-19 20:23:17,705 - experiment_functions - INFO - Early stopping at epoch 800. Best Recall: 0.0134
2026-05-19 20:23:17,787 - optuna.study.study - INFO - Trial 188 finished with value: 0.013411573176299096 and parameters: {'n_layers': 1, 'embedding_dim': 96, 'lr': 0.000399788414211685, 'lambda_val': 0.045256045623803955, 'batch_size': 648, 'optimizer': 'RMSprop'}. Best is trial 179 with value: 0.037216764109935734.
2026-05-19 20:23:24,651 - optuna.study._optimize - INFO - Trial 189 pruned. 
2026-05-19 20:23:31,715 - optuna.study._optimize - INFO - Trial 190 pruned. 
2026-05-19 20:23:39,407 - experiment_functions - INFO - Early stopping at epoch 1100. Best Recall: 0.0329
2026-05-19 20:23:39,506 - optuna.study.study - INFO - Trial 191 finished with value: 0.03293526102737188 and parameters: {'n_layers': 1, 'embedding_dim': 96, 'lr': 0.0004163753680378885, 'lambda_val': 3.857438470824703e-06, 'batch_size': 848, 'optimizer': 'RMSprop'}. Best is trial 179 with value: 0.037216764109935734.
2026-05-19 20:23:46,493 - optuna.study._optimize - INFO - Trial 192 pruned. 
2026-05-19 20:23:55,587 - experiment_functions - INFO - Early stopping at epoch 1450. Best Recall: 0.0330
2026-05-19 20:23:55,678 - optuna.study.study - INFO - Trial 193 finished with value: 0.03296535644129841 and parameters: {'n_layers': 1, 'embedding_dim': 96, 'lr': 0.0004393188830873601, 'lambda_val': 8.81480666558847e-06, 'batch_size': 736, 'optimizer': 'RMSprop'}. Best is trial 179 with value: 0.037216764109935734.
2026-05-19 20:24:02,387 - optuna.study._optimize - INFO - Trial 194 pruned. 
2026-05-19 20:24:09,758 - experiment_functions - INFO - Early stopping at epoch 800. Best Recall: 0.0163
2026-05-19 20:24:09,857 - optuna.study.study - INFO - Trial 195 finished with value: 0.01630190376307012 and parameters: {'n_layers': 1, 'embedding_dim': 128, 'lr': 0.0004633244626750479, 'lambda_val': 1.1117931323636314e-05, 'batch_size': 1822, 'optimizer': 'RMSprop'}. Best is trial 179 with value: 0.037216764109935734.
2026-05-19 20:24:22,049 - experiment_functions - INFO - Early stopping at epoch 1750. Best Recall: 0.0348
2026-05-19 20:24:22,130 - optuna.study.study - INFO - Trial 196 finished with value: 0.03479358176906499 and parameters: {'n_layers': 1, 'embedding_dim': 96, 'lr': 0.00032866992646619073, 'lambda_val': 7.203811766765817e-06, 'batch_size': 944, 'optimizer': 'RMSprop'}. Best is trial 179 with value: 0.037216764109935734.
2026-05-19 20:24:28,855 - optuna.study._optimize - INFO - Trial 197 pruned. 
2026-05-19 20:24:36,451 - optuna.study._optimize - INFO - Trial 198 pruned. 
2026-05-19 20:24:44,161 - optuna.study._optimize - INFO - Trial 199 pruned. 
2026-05-19 20:24:51,177 - optuna.study._optimize - INFO - Trial 200 pruned. 
2026-05-19 20:24:57,558 - optuna.study._optimize - INFO - Trial 201 pruned. 
2026-05-19 20:25:06,792 - optuna.study._optimize - INFO - Trial 202 pruned. 
2026-05-19 20:25:14,396 - optuna.study._optimize - INFO - Trial 203 pruned. 
2026-05-19 20:25:21,733 - optuna.study._optimize - INFO - Trial 204 pruned. 
2026-05-19 20:25:34,528 - experiment_functions - INFO - Early stopping at epoch 1850. Best Recall: 0.0334
2026-05-19 20:25:34,617 - optuna.study.study - INFO - Trial 205 finished with value: 0.03339324413217821 and parameters: {'n_layers': 1, 'embedding_dim': 96, 'lr': 0.0003320768970151172, 'lambda_val': 5.989398572919372e-06, 'batch_size': 519, 'optimizer': 'RMSprop'}. Best is trial 179 with value: 0.037216764109935734.
2026-05-19 20:25:47,569 - experiment_functions - INFO - Early stopping at epoch 2100. Best Recall: 0.0357
2026-05-19 20:25:47,681 - optuna.study.study - INFO - Trial 206 finished with value: 0.03570921287019139 and parameters: {'n_layers': 1, 'embedding_dim': 64, 'lr': 0.00032727319751001344, 'lambda_val': 5.274683621039759e-06, 'batch_size': 522, 'optimizer': 'RMSprop'}. Best is trial 179 with value: 0.037216764109935734.
2026-05-19 20:26:00,152 - experiment_functions - INFO - Early stopping at epoch 2000. Best Recall: 0.0360
2026-05-19 20:26:00,232 - optuna.study.study - INFO - Trial 207 finished with value: 0.03597292435652695 and parameters: {'n_layers': 1, 'embedding_dim': 64, 'lr': 0.0003268714050074123, 'lambda_val': 4.890065804987868e-06, 'batch_size': 520, 'optimizer': 'RMSprop'}. Best is trial 179 with value: 0.037216764109935734.
2026-05-19 20:26:07,188 - optuna.study._optimize - INFO - Trial 208 pruned. 
2026-05-19 20:26:13,847 - optuna.study._optimize - INFO - Trial 209 pruned. 
2026-05-19 20:26:20,958 - optuna.study._optimize - INFO - Trial 210 pruned. 
2026-05-19 20:26:27,688 - optuna.study._optimize - INFO - Trial 211 pruned. 
2026-05-19 20:26:40,649 - experiment_functions - INFO - Early stopping at epoch 1800. Best Recall: 0.0354
2026-05-19 20:26:40,742 - optuna.study.study - INFO - Trial 212 finished with value: 0.035421413020366395 and parameters: {'n_layers': 1, 'embedding_dim': 64, 'lr': 0.00031623607168672113, 'lambda_val': 3.7923109170519593e-06, 'batch_size': 586, 'optimizer': 'RMSprop'}. Best is trial 179 with value: 0.037216764109935734.
2026-05-19 20:26:59,492 - experiment_functions - INFO - Early stopping at epoch 3200. Best Recall: 0.0383
2026-05-19 20:26:59,637 - optuna.study.study - INFO - Trial 213 finished with value: 0.03834148657629775 and parameters: {'n_layers': 1, 'embedding_dim': 64, 'lr': 0.0003022268724663227, 'lambda_val': 3.725524401254304e-06, 'batch_size': 577, 'optimizer': 'RMSprop'}. Best is trial 213 with value: 0.03834148657629775.
2026-05-19 20:27:09,507 - experiment_functions - INFO - Early stopping at epoch 1500. Best Recall: 0.0322
2026-05-19 20:27:09,607 - optuna.study.study - INFO - Trial 214 finished with value: 0.032221495375735605 and parameters: {'n_layers': 1, 'embedding_dim': 64, 'lr': 0.0004335123060665429, 'lambda_val': 3.6803520281426226e-06, 'batch_size': 563, 'optimizer': 'RMSprop'}. Best is trial 213 with value: 0.03834148657629775.
2026-05-19 20:27:20,117 - experiment_functions - INFO - Early stopping at epoch 1700. Best Recall: 0.0336
2026-05-19 20:27:20,218 - optuna.study.study - INFO - Trial 215 finished with value: 0.03357678057633457 and parameters: {'n_layers': 1, 'embedding_dim': 64, 'lr': 0.00042252305623491956, 'lambda_val': 3.727956984777054e-06, 'batch_size': 523, 'optimizer': 'RMSprop'}. Best is trial 213 with value: 0.03834148657629775.
2026-05-19 20:27:31,739 - optuna.study._optimize - INFO - Trial 216 pruned. 
2026-05-19 20:27:37,873 - optuna.study._optimize - INFO - Trial 217 pruned. 
2026-05-19 20:27:45,998 - experiment_functions - INFO - Early stopping at epoch 1350. Best Recall: 0.0356
2026-05-19 20:27:46,164 - optuna.study.study - INFO - Trial 218 finished with value: 0.03563539117938686 and parameters: {'n_layers': 1, 'embedding_dim': 64, 'lr': 0.00045521404229782335, 'lambda_val': 2.6661037426649624e-06, 'batch_size': 587, 'optimizer': 'RMSprop'}. Best is trial 213 with value: 0.03834148657629775.
2026-05-19 20:27:52,089 - optuna.study._optimize - INFO - Trial 219 pruned. 
2026-05-19 20:27:58,497 - optuna.study._optimize - INFO - Trial 220 pruned. 
2026-05-19 20:28:07,803 - experiment_functions - INFO - Early stopping at epoch 1650. Best Recall: 0.0354
2026-05-19 20:28:07,926 - optuna.study.study - INFO - Trial 221 finished with value: 0.03539654739235034 and parameters: {'n_layers': 1, 'embedding_dim': 64, 'lr': 0.00042170030634872894, 'lambda_val': 2.780980894537061e-06, 'batch_size': 652, 'optimizer': 'RMSprop'}. Best is trial 213 with value: 0.03834148657629775.
2026-05-19 20:28:18,866 - experiment_functions - INFO - Early stopping at epoch 1950. Best Recall: 0.0354
2026-05-19 20:28:18,955 - optuna.study.study - INFO - Trial 222 finished with value: 0.03540826490642349 and parameters: {'n_layers': 1, 'embedding_dim': 64, 'lr': 0.0004182079442959245, 'lambda_val': 2.4383048039669815e-06, 'batch_size': 639, 'optimizer': 'RMSprop'}. Best is trial 213 with value: 0.03834148657629775.
2026-05-19 20:28:25,238 - optuna.study._optimize - INFO - Trial 223 pruned. 
2026-05-19 20:28:31,403 - optuna.study._optimize - INFO - Trial 224 pruned. 
2026-05-19 20:28:37,403 - optuna.study._optimize - INFO - Trial 225 pruned. 
2026-05-19 20:28:52,373 - optuna.study._optimize - INFO - Trial 226 pruned. 
2026-05-19 20:29:02,435 - experiment_functions - INFO - Early stopping at epoch 1900. Best Recall: 0.0358
2026-05-19 20:29:02,527 - optuna.study.study - INFO - Trial 227 finished with value: 0.03577938850508018 and parameters: {'n_layers': 1, 'embedding_dim': 64, 'lr': 0.000334700592396402, 'lambda_val': 1.8776679917561036e-06, 'batch_size': 572, 'optimizer': 'RMSprop'}. Best is trial 213 with value: 0.03834148657629775.
2026-05-19 20:29:09,061 - optuna.study._optimize - INFO - Trial 228 pruned. 
2026-05-19 20:29:15,046 - optuna.study._optimize - INFO - Trial 229 pruned. 
2026-05-19 20:29:27,160 - experiment_functions - INFO - Early stopping at epoch 1850. Best Recall: 0.0352
2026-05-19 20:29:27,295 - optuna.study.study - INFO - Trial 230 finished with value: 0.03515657146777605 and parameters: {'n_layers': 1, 'embedding_dim': 64, 'lr': 0.00047632921706453925, 'lambda_val': 3.1388060363157974e-06, 'batch_size': 576, 'optimizer': 'RMSprop'}. Best is trial 213 with value: 0.03834148657629775.
2026-05-19 20:29:33,979 - experiment_functions - INFO - Early stopping at epoch 1100. Best Recall: 0.0344
2026-05-19 20:29:34,091 - optuna.study.study - INFO - Trial 231 finished with value: 0.03435018072809572 and parameters: {'n_layers': 1, 'embedding_dim': 64, 'lr': 0.0005028362926214431, 'lambda_val': 2.9261000816944273e-06, 'batch_size': 569, 'optimizer': 'RMSprop'}. Best is trial 213 with value: 0.03834148657629775.
2026-05-19 20:29:40,608 - optuna.study._optimize - INFO - Trial 232 pruned. 
2026-05-19 20:29:46,215 - optuna.study._optimize - INFO - Trial 233 pruned. 
2026-05-19 20:29:59,388 - optuna.study._optimize - INFO - Trial 234 pruned. 
2026-05-19 20:30:05,332 - optuna.study._optimize - INFO - Trial 235 pruned. 
2026-05-19 20:30:12,262 - experiment_functions - INFO - Early stopping at epoch 1200. Best Recall: 0.0342
2026-05-19 20:30:12,369 - optuna.study.study - INFO - Trial 236 finished with value: 0.0342490667635809 and parameters: {'n_layers': 1, 'embedding_dim': 64, 'lr': 0.00042672753556020324, 'lambda_val': 1.5870013987670245e-06, 'batch_size': 669, 'optimizer': 'RMSprop'}. Best is trial 213 with value: 0.03834148657629775.
2026-05-19 20:30:18,142 - optuna.study._optimize - INFO - Trial 237 pruned. 
2026-05-19 20:30:24,070 - optuna.study._optimize - INFO - Trial 238 pruned. 
2026-05-19 20:30:30,345 - optuna.study._optimize - INFO - Trial 239 pruned. 
2026-05-19 20:30:36,237 - optuna.study._optimize - INFO - Trial 240 pruned. 
2026-05-19 20:30:45,716 - experiment_functions - INFO - Early stopping at epoch 1500. Best Recall: 0.0365
2026-05-19 20:30:45,818 - optuna.study.study - INFO - Trial 241 finished with value: 0.03646251552275611 and parameters: {'n_layers': 1, 'embedding_dim': 64, 'lr': 0.0003641862148401593, 'lambda_val': 2.1447934435415076e-06, 'batch_size': 517, 'optimizer': 'RMSprop'}. Best is trial 213 with value: 0.03834148657629775.
2026-05-19 20:30:58,726 - experiment_functions - INFO - Early stopping at epoch 2450. Best Recall: 0.0378
2026-05-19 20:30:58,806 - optuna.study.study - INFO - Trial 242 finished with value: 0.03779392278781609 and parameters: {'n_layers': 1, 'embedding_dim': 64, 'lr': 0.00034573514349034245, 'lambda_val': 1.953035200096042e-06, 'batch_size': 522, 'optimizer': 'RMSprop'}. Best is trial 213 with value: 0.03834148657629775.
2026-05-19 20:31:04,252 - optuna.study._optimize - INFO - Trial 243 pruned. 
2026-05-19 20:31:10,035 - optuna.study._optimize - INFO - Trial 244 pruned. 
2026-05-19 20:31:16,588 - optuna.study._optimize - INFO - Trial 245 pruned. 
2026-05-19 20:31:22,644 - optuna.study._optimize - INFO - Trial 246 pruned. 
2026-05-19 20:31:31,285 - optuna.study._optimize - INFO - Trial 247 pruned. 
2026-05-19 20:31:46,290 - optuna.study._optimize - INFO - Trial 248 pruned. 
2026-05-19 20:31:55,669 - optuna.study._optimize - INFO - Trial 249 pruned. 
2026-05-19 20:32:11,141 - experiment_functions - INFO - Early stopping at epoch 2600. Best Recall: 0.0390
2026-05-19 20:32:11,281 - optuna.study.study - INFO - Trial 250 finished with value: 0.039041770343629205 and parameters: {'n_layers': 1, 'embedding_dim': 64, 'lr': 0.0002618998436421141, 'lambda_val': 3.6758064553013915e-06, 'batch_size': 655, 'optimizer': 'RMSprop'}. Best is trial 250 with value: 0.039041770343629205.
2026-05-19 20:32:17,544 - optuna.study._optimize - INFO - Trial 251 pruned. 
2026-05-19 20:32:23,626 - optuna.study._optimize - INFO - Trial 252 pruned. 
2026-05-19 20:32:29,890 - optuna.study._optimize - INFO - Trial 253 pruned. 
2026-05-19 20:32:35,994 - optuna.study._optimize - INFO - Trial 254 pruned. 
2026-05-19 20:32:41,655 - optuna.study._optimize - INFO - Trial 255 pruned. 
2026-05-19 20:32:47,624 - optuna.study._optimize - INFO - Trial 256 pruned. 
2026-05-19 20:32:56,057 - optuna.study._optimize - INFO - Trial 257 pruned. 
2026-05-19 20:33:01,606 - optuna.study._optimize - INFO - Trial 258 pruned. 
2026-05-19 20:33:07,267 - optuna.study._optimize - INFO - Trial 259 pruned. 
2026-05-19 20:33:15,303 - optuna.study._optimize - INFO - Trial 260 pruned. 
2026-05-19 20:33:21,934 - optuna.study._optimize - INFO - Trial 261 pruned. 
2026-05-19 20:33:27,836 - optuna.study._optimize - INFO - Trial 262 pruned. 
2026-05-19 20:33:34,162 - optuna.study._optimize - INFO - Trial 263 pruned. 
2026-05-19 20:33:41,743 - optuna.study._optimize - INFO - Trial 264 pruned. 
2026-05-19 20:33:47,657 - optuna.study._optimize - INFO - Trial 265 pruned. 
2026-05-19 20:33:54,591 - optuna.study._optimize - INFO - Trial 266 pruned. 
2026-05-19 20:34:00,242 - optuna.study._optimize - INFO - Trial 267 pruned. 
2026-05-19 20:34:06,801 - optuna.study._optimize - INFO - Trial 268 pruned. 
2026-05-19 20:34:12,992 - optuna.study._optimize - INFO - Trial 269 pruned. 
2026-05-19 20:34:23,194 - optuna.study._optimize - INFO - Trial 270 pruned. 
2026-05-19 20:34:30,016 - optuna.study._optimize - INFO - Trial 271 pruned. 
2026-05-19 20:34:38,484 - optuna.study._optimize - INFO - Trial 272 pruned. 
