2026-05-19 20:05:17,054 - optuna.study.study - INFO - Trial 21 finished with value: 0.024622685520336526 and parameters: {'n_layers': 1, 'embedding_dim': 32, 'lr': 0.0037484496919034252, 'lambda_val': 2.3599952069439467e-06, 'batch_size': 1110, 'optimizer': 'Adam'}. Best is trial 21 with value: 0.024622685520336526.
2026-05-19 20:05:23,063 - experiment_functions - INFO - Early stopping at epoch 650. Best Recall: 0.0255
2026-05-19 20:05:23,170 - optuna.study.study - INFO - Trial 22 finished with value: 0.02551312252937659 and parameters: {'n_layers': 1, 'embedding_dim': 32, 'lr': 0.002373336840252894, 'lambda_val': 2.1266499950926738e-06, 'batch_size': 1594, 'optimizer': 'Adam'}. Best is trial 22 with value: 0.02551312252937659.
2026-05-19 20:05:29,266 - experiment_functions - INFO - Early stopping at epoch 600. Best Recall: 0.0223
2026-05-19 20:05:29,347 - optuna.study.study - INFO - Trial 23 finished with value: 0.022268913759346275 and parameters: {'n_layers': 1, 'embedding_dim': 32, 'lr': 0.0026908909383401036, 'lambda_val': 1.9144033365581648e-05, 'batch_size': 1753, 'optimizer': 'Adam'}. Best is trial 22 with value: 0.02551312252937659.
2026-05-19 20:05:32,971 - experiment_functions - INFO - Early stopping at epoch 550. Best Recall: 0.0141
2026-05-19 20:05:33,063 - optuna.study.study - INFO - Trial 24 finished with value: 0.014083356029406083 and parameters: {'n_layers': 2, 'embedding_dim': 32, 'lr': 0.0061095597745907, 'lambda_val': 3.436470177128855e-06, 'batch_size': 2458, 'optimizer': 'Adam'}. Best is trial 22 with value: 0.02551312252937659.
2026-05-19 20:05:37,200 - experiment_functions - INFO - Early stopping at epoch 700. Best Recall: 0.0222
2026-05-19 20:05:37,309 - optuna.study.study - INFO - Trial 25 finished with value: 0.02217125642937974 and parameters: {'n_layers': 1, 'embedding_dim': 32, 'lr': 0.0017244791700712823, 'lambda_val': 7.567086470874618e-06, 'batch_size': 1056, 'optimizer': 'Adam'}. Best is trial 22 with value: 0.02551312252937659.
2026-05-19 20:05:40,866 - experiment_functions - INFO - Early stopping at epoch 500. Best Recall: 0.0023
2026-05-19 20:05:40,966 - optuna.study.study - INFO - Trial 26 finished with value: 0.002320981328657389 and parameters: {'n_layers': 1, 'embedding_dim': 32, 'lr': 1.2888455947428341e-05, 'lambda_val': 2.2584316515619246e-06, 'batch_size': 1575, 'optimizer': 'Adam'}. Best is trial 22 with value: 0.02551312252937659.
2026-05-19 20:05:44,869 - experiment_functions - INFO - Early stopping at epoch 550. Best Recall: 0.0203
2026-05-19 20:05:44,972 - optuna.study.study - INFO - Trial 27 finished with value: 0.02032223637912917 and parameters: {'n_layers': 2, 'embedding_dim': 32, 'lr': 0.006796273683052976, 'lambda_val': 2.8561060859293465e-05, 'batch_size': 1238, 'optimizer': 'Adam'}. Best is trial 22 with value: 0.02551312252937659.
2026-05-19 20:05:48,589 - experiment_functions - INFO - Early stopping at epoch 500. Best Recall: 0.0029
2026-05-19 20:05:48,692 - optuna.study.study - INFO - Trial 28 finished with value: 0.0029007916479837593 and parameters: {'n_layers': 1, 'embedding_dim': 32, 'lr': 0.05392296911789583, 'lambda_val': 0.00012321550436003128, 'batch_size': 865, 'optimizer': 'SGD'}. Best is trial 22 with value: 0.02551312252937659.
2026-05-19 20:05:52,705 - experiment_functions - INFO - Early stopping at epoch 500. Best Recall: 0.0132
2026-05-19 20:05:52,828 - optuna.study.study - INFO - Trial 29 finished with value: 0.013219607701899942 and parameters: {'n_layers': 3, 'embedding_dim': 256, 'lr': 0.09683897398333856, 'lambda_val': 9.539718481716835e-06, 'batch_size': 1909, 'optimizer': 'RMSprop'}. Best is trial 22 with value: 0.02551312252937659.
2026-05-19 20:05:56,196 - experiment_functions - INFO - Early stopping at epoch 500. Best Recall: 0.0023
2026-05-19 20:05:56,300 - optuna.study.study - INFO - Trial 30 finished with value: 0.0023457634215665454 and parameters: {'n_layers': 2, 'embedding_dim': 96, 'lr': 0.0019261699815158418, 'lambda_val': 1.8901167870879825e-06, 'batch_size': 2044, 'optimizer': 'SGD'}. Best is trial 22 with value: 0.02551312252937659.
2026-05-19 20:06:01,176 - experiment_functions - INFO - Early stopping at epoch 750. Best Recall: 0.0204
2026-05-19 20:06:01,278 - optuna.study.study - INFO - Trial 31 finished with value: 0.02044497962348032 and parameters: {'n_layers': 1, 'embedding_dim': 64, 'lr': 0.0006999782058418661, 'lambda_val': 1.5822698643408882e-06, 'batch_size': 2259, 'optimizer': 'Adam'}. Best is trial 22 with value: 0.02551312252937659.
2026-05-19 20:06:06,334 - experiment_functions - INFO - Early stopping at epoch 800. Best Recall: 0.0210
2026-05-19 20:06:06,436 - optuna.study.study - INFO - Trial 32 finished with value: 0.020990152482803674 and parameters: {'n_layers': 1, 'embedding_dim': 32, 'lr': 0.0008568213089393827, 'lambda_val': 3.717963458606925e-06, 'batch_size': 1570, 'optimizer': 'Adam'}. Best is trial 22 with value: 0.02551312252937659.
2026-05-19 20:06:21,298 - experiment_functions - INFO - Early stopping at epoch 2400. Best Recall: 0.0301
2026-05-19 20:06:21,406 - optuna.study.study - INFO - Trial 33 finished with value: 0.03014673632506587 and parameters: {'n_layers': 1, 'embedding_dim': 64, 'lr': 0.0003699580388509057, 'lambda_val': 1.0557317070264669e-06, 'batch_size': 618, 'optimizer': 'Adam'}. Best is trial 33 with value: 0.03014673632506587.
2026-05-19 20:06:29,372 - experiment_functions - INFO - Early stopping at epoch 1400. Best Recall: 0.0272
2026-05-19 20:06:29,472 - optuna.study.study - INFO - Trial 34 finished with value: 0.027231018122733788 and parameters: {'n_layers': 1, 'embedding_dim': 256, 'lr': 0.0003400035978605497, 'lambda_val': 5.551915895518683e-06, 'batch_size': 540, 'optimizer': 'Adam'}. Best is trial 33 with value: 0.03014673632506587.
2026-05-19 20:06:32,935 - experiment_functions - INFO - Early stopping at epoch 500. Best Recall: 0.0027
2026-05-19 20:06:33,037 - optuna.study.study - INFO - Trial 35 finished with value: 0.0027145601230892814 and parameters: {'n_layers': 1, 'embedding_dim': 256, 'lr': 0.00010547577768675289, 'lambda_val': 5.565265236273318e-06, 'batch_size': 603, 'optimizer': 'SGD'}. Best is trial 33 with value: 0.03014673632506587.
2026-05-19 20:06:40,566 - optuna.study._optimize - INFO - Trial 36 pruned. 
2026-05-19 20:06:44,093 - experiment_functions - INFO - Early stopping at epoch 550. Best Recall: 0.0075
2026-05-19 20:06:44,186 - optuna.study.study - INFO - Trial 37 finished with value: 0.00749234170543294 and parameters: {'n_layers': 1, 'embedding_dim': 256, 'lr': 0.025200809602364652, 'lambda_val': 6.736646233776719e-06, 'batch_size': 808, 'optimizer': 'Adam'}. Best is trial 33 with value: 0.03014673632506587.
2026-05-19 20:06:54,587 - experiment_functions - INFO - Early stopping at epoch 1500. Best Recall: 0.0349
2026-05-19 20:06:54,668 - optuna.study.study - INFO - Trial 38 finished with value: 0.03486654329558426 and parameters: {'n_layers': 1, 'embedding_dim': 96, 'lr': 0.0003856498098225333, 'lambda_val': 6.3162403530588e-05, 'batch_size': 689, 'optimizer': 'RMSprop'}. Best is trial 38 with value: 0.03486654329558426.
2026-05-19 20:07:01,658 - optuna.study._optimize - INFO - Trial 39 pruned. 
2026-05-19 20:07:05,969 - experiment_functions - INFO - Early stopping at epoch 550. Best Recall: 0.0011
2026-05-19 20:07:06,071 - optuna.study.study - INFO - Trial 40 finished with value: 0.0011397595264688353 and parameters: {'n_layers': 1, 'embedding_dim': 96, 'lr': 6.278499423270176e-05, 'lambda_val': 0.00017484089985019338, 'batch_size': 526, 'optimizer': 'RMSprop'}. Best is trial 38 with value: 0.03486654329558426.
2026-05-19 20:07:14,837 - optuna.study._optimize - INFO - Trial 41 pruned. 
2026-05-19 20:07:22,019 - optuna.study._optimize - INFO - Trial 42 pruned. 
2026-05-19 20:07:25,637 - experiment_functions - INFO - Early stopping at epoch 500. Best Recall: 0.0011
2026-05-19 20:07:25,741 - optuna.study.study - INFO - Trial 43 finished with value: 0.001110764024079324 and parameters: {'n_layers': 1, 'embedding_dim': 256, 'lr': 0.0012879959342549218, 'lambda_val': 1.4493115573735388e-05, 'batch_size': 966, 'optimizer': 'SGD'}. Best is trial 38 with value: 0.03486654329558426.
2026-05-19 20:07:32,972 - optuna.study._optimize - INFO - Trial 44 pruned. 
2026-05-19 20:07:37,558 - experiment_functions - INFO - Early stopping at epoch 600. Best Recall: 0.0256
2026-05-19 20:07:37,647 - optuna.study.study - INFO - Trial 45 finished with value: 0.025595214937356246 and parameters: {'n_layers': 1, 'embedding_dim': 128, 'lr': 0.00251277192428292, 'lambda_val': 5.820538907606703e-05, 'batch_size': 719, 'optimizer': 'Adam'}. Best is trial 38 with value: 0.03486654329558426.
2026-05-19 20:07:43,278 - experiment_functions - INFO - Early stopping at epoch 800. Best Recall: 0.0259
2026-05-19 20:07:43,378 - optuna.study.study - INFO - Trial 46 finished with value: 0.025932009182809884 and parameters: {'n_layers': 1, 'embedding_dim': 128, 'lr': 0.0010147871869905863, 'lambda_val': 6.015123072289372e-05, 'batch_size': 646, 'optimizer': 'Adam'}. Best is trial 38 with value: 0.03486654329558426.
2026-05-19 20:07:48,578 - experiment_functions - INFO - Early stopping at epoch 700. Best Recall: 0.0202
2026-05-19 20:07:48,671 - optuna.study.study - INFO - Trial 47 finished with value: 0.020172997430307597 and parameters: {'n_layers': 2, 'embedding_dim': 128, 'lr': 0.0010913057148014041, 'lambda_val': 7.62405899021473e-05, 'batch_size': 691, 'optimizer': 'Adam'}. Best is trial 38 with value: 0.03486654329558426.
2026-05-19 20:07:55,717 - optuna.study._optimize - INFO - Trial 48 pruned. 
2026-05-19 20:08:04,247 - optuna.study._optimize - INFO - Trial 49 pruned. 
2026-05-19 20:08:07,899 - experiment_functions - INFO - Early stopping at epoch 500. Best Recall: 0.0022
2026-05-19 20:08:08,008 - optuna.study.study - INFO - Trial 50 finished with value: 0.0021724258783206757 and parameters: {'n_layers': 1, 'embedding_dim': 128, 'lr': 6.407293250943154e-05, 'lambda_val': 2.2300304375844482e-05, 'batch_size': 513, 'optimizer': 'Adam'}. Best is trial 38 with value: 0.03486654329558426.
2026-05-19 20:08:14,019 - experiment_functions - INFO - Early stopping at epoch 600. Best Recall: 0.0235
2026-05-19 20:08:14,119 - optuna.study.study - INFO - Trial 51 finished with value: 0.023498216066603444 and parameters: {'n_layers': 1, 'embedding_dim': 128, 'lr': 0.002448125430647373, 'lambda_val': 0.00022043395466901568, 'batch_size': 794, 'optimizer': 'Adam'}. Best is trial 38 with value: 0.03486654329558426.
2026-05-19 20:08:20,689 - optuna.study._optimize - INFO - Trial 52 pruned. 
2026-05-19 20:08:25,509 - experiment_functions - INFO - Early stopping at epoch 700. Best Recall: 0.0188
2026-05-19 20:08:25,667 - optuna.study.study - INFO - Trial 53 finished with value: 0.018846009877301374 and parameters: {'n_layers': 1, 'embedding_dim': 128, 'lr': 0.0009434171136152763, 'lambda_val': 0.0006264353690141172, 'batch_size': 1271, 'optimizer': 'Adam'}. Best is trial 38 with value: 0.03486654329558426.
2026-05-19 20:08:30,110 - experiment_functions - INFO - Early stopping at epoch 550. Best Recall: 0.0175
2026-05-19 20:08:30,197 - optuna.study.study - INFO - Trial 54 finished with value: 0.01748148371506123 and parameters: {'n_layers': 1, 'embedding_dim': 256, 'lr': 0.0054754252756922, 'lambda_val': 0.0052245485134569435, 'batch_size': 917, 'optimizer': 'Adam'}. Best is trial 38 with value: 0.03486654329558426.
2026-05-19 20:08:34,771 - experiment_functions - INFO - Early stopping at epoch 550. Best Recall: 0.0167
2026-05-19 20:08:34,874 - optuna.study.study - INFO - Trial 55 finished with value: 0.016723227283856154 and parameters: {'n_layers': 1, 'embedding_dim': 96, 'lr': 0.011929557003225824, 'lambda_val': 4.8585553878515064e-05, 'batch_size': 660, 'optimizer': 'Adam'}. Best is trial 38 with value: 0.03486654329558426.
2026-05-19 20:08:40,162 - experiment_functions - INFO - Early stopping at epoch 600. Best Recall: 0.0058
2026-05-19 20:08:40,321 - optuna.study.study - INFO - Trial 56 finished with value: 0.0058029402126748356 and parameters: {'n_layers': 4, 'embedding_dim': 128, 'lr': 0.0013582352568228472, 'lambda_val': 0.0004333761819152256, 'batch_size': 3516, 'optimizer': 'Adam'}. Best is trial 38 with value: 0.03486654329558426.
2026-05-19 20:08:44,785 - experiment_functions - INFO - Early stopping at epoch 550. Best Recall: 0.0259
2026-05-19 20:08:46,829 - optuna.study.study - INFO - Trial 57 finished with value: 0.025944411011631155 and parameters: {'n_layers': 1, 'embedding_dim': 256, 'lr': 0.0023540675120120743, 'lambda_val': 0.00014711330167898728, 'batch_size': 1149, 'optimizer': 'Adam'}. Best is trial 38 with value: 0.03486654329558426.
2026-05-19 20:08:50,477 - experiment_functions - INFO - Early stopping at epoch 500. Best Recall: 0.0016
2026-05-19 20:08:50,569 - optuna.study.study - INFO - Trial 58 finished with value: 0.0015906395008054807 and parameters: {'n_layers': 1, 'embedding_dim': 256, 'lr': 0.0008516780605760286, 'lambda_val': 0.00014966564460847193, 'batch_size': 852, 'optimizer': 'SGD'}. Best is trial 38 with value: 0.03486654329558426.
2026-05-19 20:08:56,530 - optuna.study._optimize - INFO - Trial 59 pruned. 
2026-05-19 20:09:02,897 - optuna.study._optimize - INFO - Trial 60 pruned. 
2026-05-19 20:09:07,179 - experiment_functions - INFO - Early stopping at epoch 600. Best Recall: 0.0206
2026-05-19 20:09:07,272 - optuna.study.study - INFO - Trial 61 finished with value: 0.020583009485834795 and parameters: {'n_layers': 1, 'embedding_dim': 64, 'lr': 0.002827543889341885, 'lambda_val': 0.0012426255173081152, 'batch_size': 1229, 'optimizer': 'Adam'}. Best is trial 38 with value: 0.03486654329558426.
2026-05-19 20:09:15,362 - experiment_functions - INFO - Early stopping at epoch 600. Best Recall: 0.0311
2026-05-19 20:09:15,464 - optuna.study.study - INFO - Trial 62 finished with value: 0.031077889215910762 and parameters: {'n_layers': 1, 'embedding_dim': 256, 'lr': 0.0017464988625874693, 'lambda_val': 4.330715848019536e-05, 'batch_size': 970, 'optimizer': 'Adam'}. Best is trial 38 with value: 0.03486654329558426.
2026-05-19 20:09:20,441 - experiment_functions - INFO - Early stopping at epoch 800. Best Recall: 0.0277
2026-05-19 20:09:20,532 - optuna.study.study - INFO - Trial 63 finished with value: 0.02766092061760138 and parameters: {'n_layers': 1, 'embedding_dim': 256, 'lr': 0.0005583814601963482, 'lambda_val': 3.869130806674653e-05, 'batch_size': 958, 'optimizer': 'Adam'}. Best is trial 38 with value: 0.03486654329558426.
2026-05-19 20:09:26,706 - experiment_functions - INFO - Early stopping at epoch 800. Best Recall: 0.0226
2026-05-19 20:09:26,798 - optuna.study.study - INFO - Trial 64 finished with value: 0.022613705483727112 and parameters: {'n_layers': 1, 'embedding_dim': 256, 'lr': 0.0005449763877630237, 'lambda_val': 3.7766626397261965e-05, 'batch_size': 987, 'optimizer': 'Adam'}. Best is trial 38 with value: 0.03486654329558426.
2026-05-19 20:09:32,791 - experiment_functions - INFO - Early stopping at epoch 950. Best Recall: 0.0263
2026-05-19 20:09:32,881 - optuna.study.study - INFO - Trial 65 finished with value: 0.026303039497833323 and parameters: {'n_layers': 1, 'embedding_dim': 256, 'lr': 0.00040458284714791243, 'lambda_val': 9.756656726891014e-05, 'batch_size': 1363, 'optimizer': 'Adam'}. Best is trial 38 with value: 0.03486654329558426.
2026-05-19 20:09:38,820 - experiment_functions - INFO - Early stopping at epoch 950. Best Recall: 0.0247
2026-05-19 20:09:38,923 - optuna.study.study - INFO - Trial 66 finished with value: 0.024704209011951805 and parameters: {'n_layers': 1, 'embedding_dim': 256, 'lr': 0.00035601875498747477, 'lambda_val': 0.0001022298544487198, 'batch_size': 1406, 'optimizer': 'Adam'}. Best is trial 38 with value: 0.03486654329558426.
2026-05-19 20:09:43,157 - experiment_functions - INFO - Early stopping at epoch 600. Best Recall: 0.0211
2026-05-19 20:09:43,261 - optuna.study.study - INFO - Trial 67 finished with value: 0.02112231322977647 and parameters: {'n_layers': 1, 'embedding_dim': 256, 'lr': 0.0016222086212458117, 'lambda_val': 0.00021408814059633685, 'batch_size': 1088, 'optimizer': 'Adam'}. Best is trial 38 with value: 0.03486654329558426.
2026-05-19 20:09:48,755 - experiment_functions - INFO - Early stopping at epoch 800. Best Recall: 0.0239
2026-05-19 20:09:48,892 - optuna.study.study - INFO - Trial 68 finished with value: 0.02394413500827457 and parameters: {'n_layers': 1, 'embedding_dim': 256, 'lr': 0.0006329448055771707, 'lambda_val': 0.00013372215927920473, 'batch_size': 1200, 'optimizer': 'Adam'}. Best is trial 38 with value: 0.03486654329558426.
2026-05-19 20:09:54,563 - experiment_functions - INFO - Early stopping at epoch 950. Best Recall: 0.0202
2026-05-19 20:09:54,665 - optuna.study.study - INFO - Trial 69 finished with value: 0.020177549792803028 and parameters: {'n_layers': 1, 'embedding_dim': 256, 'lr': 0.00048340071587845286, 'lambda_val': 2.537031997069915e-05, 'batch_size': 1323, 'optimizer': 'Adam'}. Best is trial 38 with value: 0.03486654329558426.
2026-05-19 20:10:01,539 - optuna.study._optimize - INFO - Trial 70 pruned. 
2026-05-19 20:10:06,696 - experiment_functions - INFO - Early stopping at epoch 700. Best Recall: 0.0247
2026-05-19 20:10:06,808 - optuna.study.study - INFO - Trial 71 finished with value: 0.024672064815501583 and parameters: {'n_layers': 1, 'embedding_dim': 256, 'lr': 0.0010367893784588914, 'lambda_val': 0.0003103478902563628, 'batch_size': 873, 'optimizer': 'Adam'}. Best is trial 38 with value: 0.03486654329558426.
2026-05-19 20:10:12,471 - experiment_functions - INFO - Early stopping at epoch 650. Best Recall: 0.0198
2026-05-19 20:10:12,564 - optuna.study.study - INFO - Trial 72 finished with value: 0.019794172373723506 and parameters: {'n_layers': 1, 'embedding_dim': 256, 'lr': 0.0007278426317113472, 'lambda_val': 4.249872014046491e-05, 'batch_size': 4070, 'optimizer': 'Adam'}. Best is trial 38 with value: 0.03486654329558426.
2026-05-19 20:10:18,654 - optuna.study._optimize - INFO - Trial 73 pruned. 
2026-05-19 20:10:25,234 - optuna.study._optimize - INFO - Trial 74 pruned. 
2026-05-19 20:10:31,413 - optuna.study._optimize - INFO - Trial 75 pruned. 
2026-05-19 20:10:34,955 - experiment_functions - INFO - Early stopping at epoch 500. Best Recall: 0.0043
2026-05-19 20:10:35,047 - optuna.study.study - INFO - Trial 76 finished with value: 0.004280343997981421 and parameters: {'n_layers': 3, 'embedding_dim': 96, 'lr': 0.004634612694281784, 'lambda_val': 5.057990986025005e-06, 'batch_size': 1023, 'optimizer': 'SGD'}. Best is trial 38 with value: 0.03486654329558426.
2026-05-19 20:10:39,161 - experiment_functions - INFO - Early stopping at epoch 600. Best Recall: 0.0216
2026-05-19 20:10:39,251 - optuna.study.study - INFO - Trial 77 finished with value: 0.021574652314292196 and parameters: {'n_layers': 1, 'embedding_dim': 256, 'lr': 0.0018254103543106541, 'lambda_val': 1.4952162333073849e-06, 'batch_size': 3081, 'optimizer': 'Adam'}. Best is trial 38 with value: 0.03486654329558426.
2026-05-19 20:10:45,828 - optuna.study._optimize - INFO - Trial 78 pruned. 
2026-05-19 20:10:50,362 - experiment_functions - INFO - Early stopping at epoch 650. Best Recall: 0.0260
2026-05-19 20:10:50,462 - optuna.study.study - INFO - Trial 79 finished with value: 0.02598698873078131 and parameters: {'n_layers': 1, 'embedding_dim': 256, 'lr': 0.0013126903469483711, 'lambda_val': 1.1755828654941406e-05, 'batch_size': 614, 'optimizer': 'Adam'}. Best is trial 38 with value: 0.03486654329558426.
2026-05-19 20:10:58,376 - optuna.study._optimize - INFO - Trial 80 pruned. 
2026-05-19 20:11:02,691 - experiment_functions - INFO - Early stopping at epoch 650. Best Recall: 0.0271
2026-05-19 20:11:02,830 - optuna.study.study - INFO - Trial 81 finished with value: 0.027055079527128052 and parameters: {'n_layers': 1, 'embedding_dim': 256, 'lr': 0.001191869644001831, 'lambda_val': 7.902753974937307e-06, 'batch_size': 513, 'optimizer': 'Adam'}. Best is trial 38 with value: 0.03486654329558426.
2026-05-19 20:11:09,380 - experiment_functions - INFO - Early stopping at epoch 650. Best Recall: 0.0256
2026-05-19 20:11:09,493 - optuna.study.study - INFO - Trial 82 finished with value: 0.025610200001605122 and parameters: {'n_layers': 1, 'embedding_dim': 256, 'lr': 0.0013044339350593245, 'lambda_val': 9.177710909785655e-06, 'batch_size': 589, 'optimizer': 'Adam'}. Best is trial 38 with value: 0.03486654329558426.
2026-05-19 20:11:13,978 - experiment_functions - INFO - Early stopping at epoch 550. Best Recall: 0.0255
2026-05-19 20:11:14,069 - optuna.study.study - INFO - Trial 83 finished with value: 0.025512445473840694 and parameters: {'n_layers': 1, 'embedding_dim': 256, 'lr': 0.003045950097864111, 'lambda_val': 1.8012589694383333e-05, 'batch_size': 901, 'optimizer': 'Adam'}. Best is trial 38 with value: 0.03486654329558426.
2026-05-19 20:11:21,873 - experiment_functions - INFO - Early stopping at epoch 900. Best Recall: 0.0261
2026-05-19 20:11:21,985 - optuna.study.study - INFO - Trial 84 finished with value: 0.026085645173300476 and parameters: {'n_layers': 1, 'embedding_dim': 256, 'lr': 0.0005628426151773085, 'lambda_val': 6.130314493812119e-06, 'batch_size': 810, 'optimizer': 'Adam'}. Best is trial 38 with value: 0.03486654329558426.
2026-05-19 20:11:27,277 - experiment_functions - INFO - Early stopping at epoch 900. Best Recall: 0.0240
2026-05-19 20:11:27,358 - optuna.study.study - INFO - Trial 85 finished with value: 0.02400919810395022 and parameters: {'n_layers': 1, 'embedding_dim': 256, 'lr': 0.0005621715528054497, 'lambda_val': 7.222365004959599e-06, 'batch_size': 536, 'optimizer': 'Adam'}. Best is trial 38 with value: 0.03486654329558426.
2026-05-19 20:11:33,665 - optuna.study._optimize - INFO - Trial 86 pruned. 
2026-05-19 20:11:40,457 - experiment_functions - INFO - Early stopping at epoch 1300. Best Recall: 0.0283
