2026-05-19 18:20:04,004 - optuna.study.study - INFO - Trial 175 finished with value: 0.07485346541172473 and parameters: {'n_layers': 1, 'embedding_dim': 128, 'lr': 0.0008939039420531318, 'lambda_val': 2.0046026881137034e-06, 'batch_size': 774, 'optimizer': 'Adam'}. Best is trial 167 with value: 0.08140932730716424.
2026-05-19 18:20:11,438 - experiment_functions - INFO - Early stopping at epoch 1200. Best Recall: 0.0686
2026-05-19 18:20:11,600 - optuna.study.study - INFO - Trial 176 finished with value: 0.06857074969571951 and parameters: {'n_layers': 1, 'embedding_dim': 128, 'lr': 0.0009012819517313187, 'lambda_val': 2.163669907500746e-06, 'batch_size': 885, 'optimizer': 'Adam'}. Best is trial 167 with value: 0.08140932730716424.
2026-05-19 18:20:25,700 - experiment_functions - INFO - Early stopping at epoch 2450. Best Recall: 0.0694
2026-05-19 18:20:25,800 - optuna.study.study - INFO - Trial 177 finished with value: 0.06939809989134821 and parameters: {'n_layers': 1, 'embedding_dim': 128, 'lr': 0.0009872846971103269, 'lambda_val': 1.0392795968066441e-06, 'batch_size': 798, 'optimizer': 'Adam'}. Best is trial 167 with value: 0.08140932730716424.
2026-05-19 18:20:38,480 - experiment_functions - INFO - Early stopping at epoch 1450. Best Recall: 0.0670
2026-05-19 18:20:38,589 - optuna.study.study - INFO - Trial 178 finished with value: 0.06701494640171742 and parameters: {'n_layers': 1, 'embedding_dim': 128, 'lr': 0.0014378059629103672, 'lambda_val': 1.9351950549779366e-06, 'batch_size': 730, 'optimizer': 'Adam'}. Best is trial 167 with value: 0.08140932730716424.
2026-05-19 18:20:45,229 - optuna.study._optimize - INFO - Trial 179 pruned. 
2026-05-19 18:20:54,097 - experiment_functions - INFO - Early stopping at epoch 1300. Best Recall: 0.0731
2026-05-19 18:20:54,197 - optuna.study.study - INFO - Trial 180 finished with value: 0.07312922904845859 and parameters: {'n_layers': 1, 'embedding_dim': 128, 'lr': 0.0007296450343162527, 'lambda_val': 1.2290565952208715e-06, 'batch_size': 890, 'optimizer': 'Adam'}. Best is trial 167 with value: 0.08140932730716424.
2026-05-19 18:21:02,473 - experiment_functions - INFO - Early stopping at epoch 1450. Best Recall: 0.0708
2026-05-19 18:21:02,584 - optuna.study.study - INFO - Trial 181 finished with value: 0.07081383168430502 and parameters: {'n_layers': 1, 'embedding_dim': 128, 'lr': 0.0006849819348417596, 'lambda_val': 1.1953156062758067e-06, 'batch_size': 608, 'optimizer': 'Adam'}. Best is trial 167 with value: 0.08140932730716424.
2026-05-19 18:21:11,595 - experiment_functions - INFO - Early stopping at epoch 850. Best Recall: 0.0343
2026-05-19 18:21:11,716 - optuna.study.study - INFO - Trial 182 finished with value: 0.03426738963931469 and parameters: {'n_layers': 4, 'embedding_dim': 128, 'lr': 0.0005841189839049702, 'lambda_val': 1.0110726073142446e-06, 'batch_size': 881, 'optimizer': 'Adam'}. Best is trial 167 with value: 0.08140932730716424.
2026-05-19 18:21:20,310 - optuna.study._optimize - INFO - Trial 183 pruned. 
2026-05-19 18:21:29,217 - experiment_functions - INFO - Early stopping at epoch 1600. Best Recall: 0.0758
2026-05-19 18:21:29,317 - optuna.study.study - INFO - Trial 184 finished with value: 0.07582290710760145 and parameters: {'n_layers': 1, 'embedding_dim': 128, 'lr': 0.000795396113582841, 'lambda_val': 2.1121499533923523e-06, 'batch_size': 604, 'optimizer': 'Adam'}. Best is trial 167 with value: 0.08140932730716424.
2026-05-19 18:21:39,985 - experiment_functions - INFO - Early stopping at epoch 1500. Best Recall: 0.0693
2026-05-19 18:21:40,095 - optuna.study.study - INFO - Trial 185 finished with value: 0.06927803408535234 and parameters: {'n_layers': 1, 'embedding_dim': 128, 'lr': 0.0009501461821244894, 'lambda_val': 2.2144453058592046e-06, 'batch_size': 667, 'optimizer': 'Adam'}. Best is trial 167 with value: 0.08140932730716424.
2026-05-19 18:21:46,865 - optuna.study._optimize - INFO - Trial 186 pruned. 
2026-05-19 18:22:01,115 - experiment_functions - INFO - Early stopping at epoch 2550. Best Recall: 0.0737
2026-05-19 18:22:01,224 - optuna.study.study - INFO - Trial 187 finished with value: 0.07365638106624299 and parameters: {'n_layers': 1, 'embedding_dim': 128, 'lr': 0.0005902320666793123, 'lambda_val': 1.7366366025414112e-06, 'batch_size': 895, 'optimizer': 'Adam'}. Best is trial 167 with value: 0.08140932730716424.
2026-05-19 18:22:09,973 - experiment_functions - INFO - Early stopping at epoch 900. Best Recall: 0.0244
2026-05-19 18:22:10,072 - optuna.study.study - INFO - Trial 188 finished with value: 0.02439174838571557 and parameters: {'n_layers': 1, 'embedding_dim': 128, 'lr': 0.036836712512607034, 'lambda_val': 2.2149457903847546e-06, 'batch_size': 897, 'optimizer': 'Adam'}. Best is trial 167 with value: 0.08140932730716424.
2026-05-19 18:22:28,929 - optuna.study._optimize - INFO - Trial 189 pruned. 
2026-05-19 18:22:36,999 - experiment_functions - INFO - Early stopping at epoch 1350. Best Recall: 0.0721
2026-05-19 18:22:37,099 - optuna.study.study - INFO - Trial 190 finished with value: 0.07209916952884782 and parameters: {'n_layers': 1, 'embedding_dim': 128, 'lr': 0.001173727502074494, 'lambda_val': 1.845004265065796e-06, 'batch_size': 746, 'optimizer': 'Adam'}. Best is trial 167 with value: 0.08140932730716424.
2026-05-19 18:22:42,401 - experiment_functions - INFO - Early stopping at epoch 800. Best Recall: 0.0582
2026-05-19 18:22:42,491 - optuna.study.study - INFO - Trial 191 finished with value: 0.05822541761265642 and parameters: {'n_layers': 1, 'embedding_dim': 128, 'lr': 0.00121922640551909, 'lambda_val': 1.8082092110326042e-06, 'batch_size': 786, 'optimizer': 'Adam'}. Best is trial 167 with value: 0.08140932730716424.
2026-05-19 18:22:51,451 - experiment_functions - INFO - Early stopping at epoch 1600. Best Recall: 0.0669
2026-05-19 18:22:51,543 - optuna.study.study - INFO - Trial 192 finished with value: 0.0669223087001297 and parameters: {'n_layers': 1, 'embedding_dim': 128, 'lr': 0.0009246199254398347, 'lambda_val': 2.1695120343998093e-06, 'batch_size': 728, 'optimizer': 'Adam'}. Best is trial 167 with value: 0.08140932730716424.
2026-05-19 18:22:56,656 - experiment_functions - INFO - Early stopping at epoch 900. Best Recall: 0.0727
2026-05-19 18:22:56,734 - optuna.study.study - INFO - Trial 193 finished with value: 0.07272837290791687 and parameters: {'n_layers': 1, 'embedding_dim': 128, 'lr': 0.0008225996448435891, 'lambda_val': 1.6607862352720149e-06, 'batch_size': 874, 'optimizer': 'Adam'}. Best is trial 167 with value: 0.08140932730716424.
2026-05-19 18:23:05,995 - experiment_functions - INFO - Early stopping at epoch 1600. Best Recall: 0.0694
2026-05-19 18:23:06,096 - optuna.study.study - INFO - Trial 194 finished with value: 0.06940709263536728 and parameters: {'n_layers': 1, 'embedding_dim': 128, 'lr': 0.0007917893037594653, 'lambda_val': 1.418737163926668e-06, 'batch_size': 873, 'optimizer': 'Adam'}. Best is trial 167 with value: 0.08140932730716424.
2026-05-19 18:23:17,670 - experiment_functions - INFO - Early stopping at epoch 1850. Best Recall: 0.0829
2026-05-19 18:23:17,760 - optuna.study.study - INFO - Trial 195 finished with value: 0.0829019064050288 and parameters: {'n_layers': 1, 'embedding_dim': 128, 'lr': 0.0005822428571582622, 'lambda_val': 1.0010597494454117e-06, 'batch_size': 943, 'optimizer': 'Adam'}. Best is trial 195 with value: 0.0829019064050288.
2026-05-19 18:23:33,928 - experiment_functions - INFO - Early stopping at epoch 2850. Best Recall: 0.0772
2026-05-19 18:23:34,049 - optuna.study.study - INFO - Trial 196 finished with value: 0.0771532684827888 and parameters: {'n_layers': 1, 'embedding_dim': 128, 'lr': 0.0004503805781303696, 'lambda_val': 1.1148026654388797e-06, 'batch_size': 1023, 'optimizer': 'Adam'}. Best is trial 195 with value: 0.0829019064050288.
2026-05-19 18:23:42,951 - experiment_functions - INFO - Early stopping at epoch 1350. Best Recall: 0.0759
2026-05-19 18:23:43,037 - optuna.study.study - INFO - Trial 197 finished with value: 0.0758743855684113 and parameters: {'n_layers': 1, 'embedding_dim': 128, 'lr': 0.0004210143139845654, 'lambda_val': 1.0497135460223935e-06, 'batch_size': 1016, 'optimizer': 'Adam'}. Best is trial 195 with value: 0.0829019064050288.
2026-05-19 18:23:49,274 - optuna.study._optimize - INFO - Trial 198 pruned. 
2026-05-19 18:23:57,043 - optuna.study._optimize - INFO - Trial 199 pruned. 
2026-05-19 18:24:14,548 - optuna.study._optimize - INFO - Trial 200 pruned. 
2026-05-19 18:24:26,262 - experiment_functions - INFO - Early stopping at epoch 1850. Best Recall: 0.0754
2026-05-19 18:24:26,351 - optuna.study.study - INFO - Trial 201 finished with value: 0.07535009090563513 and parameters: {'n_layers': 1, 'embedding_dim': 128, 'lr': 0.0005243387746260669, 'lambda_val': 2.2338685768499246e-06, 'batch_size': 943, 'optimizer': 'Adam'}. Best is trial 195 with value: 0.0829019064050288.
2026-05-19 18:24:48,730 - experiment_functions - INFO - Early stopping at epoch 3100. Best Recall: 0.0798
2026-05-19 18:24:48,836 - optuna.study.study - INFO - Trial 202 finished with value: 0.07977444811277104 and parameters: {'n_layers': 1, 'embedding_dim': 128, 'lr': 0.00048496349668057713, 'lambda_val': 1.023278508306772e-06, 'batch_size': 917, 'optimizer': 'Adam'}. Best is trial 195 with value: 0.0829019064050288.
2026-05-19 18:25:20,144 - experiment_functions - INFO - Early stopping at epoch 3200. Best Recall: 0.0736
2026-05-19 18:25:20,261 - optuna.study.study - INFO - Trial 203 finished with value: 0.07357828801036939 and parameters: {'n_layers': 1, 'embedding_dim': 128, 'lr': 0.0004013000087047051, 'lambda_val': 1.0651352340858056e-06, 'batch_size': 841, 'optimizer': 'Adam'}. Best is trial 195 with value: 0.0829019064050288.
2026-05-19 18:25:28,157 - optuna.study._optimize - INFO - Trial 204 pruned. 
2026-05-19 18:26:13,401 - experiment_functions - INFO - Early stopping at epoch 2300. Best Recall: 0.0753
2026-05-19 18:26:13,510 - optuna.study.study - INFO - Trial 205 finished with value: 0.07526791398636352 and parameters: {'n_layers': 1, 'embedding_dim': 128, 'lr': 0.000489934632433148, 'lambda_val': 0.0013540049878812356, 'batch_size': 989, 'optimizer': 'Adam'}. Best is trial 195 with value: 0.0829019064050288.
2026-05-19 18:26:32,394 - optuna.study._optimize - INFO - Trial 206 pruned. 
2026-05-19 18:26:39,828 - optuna.study._optimize - INFO - Trial 207 pruned. 
2026-05-19 18:26:57,293 - experiment_functions - INFO - Early stopping at epoch 2850. Best Recall: 0.0740
2026-05-19 18:26:57,384 - optuna.study.study - INFO - Trial 208 finished with value: 0.07397523923337501 and parameters: {'n_layers': 1, 'embedding_dim': 128, 'lr': 0.0005243648609082035, 'lambda_val': 0.0010167060738309696, 'batch_size': 1081, 'optimizer': 'Adam'}. Best is trial 195 with value: 0.0829019064050288.
2026-05-19 18:27:13,362 - optuna.study._optimize - INFO - Trial 209 pruned. 
2026-05-19 18:27:26,395 - experiment_functions - INFO - Early stopping at epoch 2250. Best Recall: 0.0747
2026-05-19 18:27:26,495 - optuna.study.study - INFO - Trial 210 finished with value: 0.07472244971607929 and parameters: {'n_layers': 1, 'embedding_dim': 128, 'lr': 0.00036691469087580213, 'lambda_val': 0.002789811596059449, 'batch_size': 1045, 'optimizer': 'Adam'}. Best is trial 195 with value: 0.0829019064050288.
2026-05-19 18:27:45,606 - experiment_functions - INFO - Early stopping at epoch 3400. Best Recall: 0.0724
2026-05-19 18:27:45,741 - optuna.study.study - INFO - Trial 211 finished with value: 0.07236099404837314 and parameters: {'n_layers': 1, 'embedding_dim': 128, 'lr': 0.0003485417583805817, 'lambda_val': 0.0004891520297390729, 'batch_size': 1058, 'optimizer': 'Adam'}. Best is trial 195 with value: 0.0829019064050288.
2026-05-19 18:27:54,293 - optuna.study._optimize - INFO - Trial 212 pruned. 
2026-05-19 18:28:01,064 - optuna.study._optimize - INFO - Trial 213 pruned. 
2026-05-19 18:28:15,258 - experiment_functions - INFO - Early stopping at epoch 1200. Best Recall: 0.0690
2026-05-19 18:28:16,020 - optuna.study.study - INFO - Trial 214 finished with value: 0.06898057206949242 and parameters: {'n_layers': 1, 'embedding_dim': 128, 'lr': 0.00047397883430155065, 'lambda_val': 0.0015406666405543576, 'batch_size': 988, 'optimizer': 'Adam'}. Best is trial 195 with value: 0.0829019064050288.
2026-05-19 18:28:30,589 - experiment_functions - INFO - Early stopping at epoch 2200. Best Recall: 0.0710
2026-05-19 18:28:30,688 - optuna.study.study - INFO - Trial 215 finished with value: 0.07096067105209163 and parameters: {'n_layers': 1, 'embedding_dim': 128, 'lr': 0.00030499583387093776, 'lambda_val': 0.0028245843160282476, 'batch_size': 1070, 'optimizer': 'Adam'}. Best is trial 195 with value: 0.0829019064050288.
2026-05-19 18:28:37,211 - optuna.study._optimize - INFO - Trial 216 pruned. 
2026-05-19 18:28:44,078 - optuna.study._optimize - INFO - Trial 217 pruned. 
2026-05-19 18:28:50,915 - optuna.study._optimize - INFO - Trial 218 pruned. 
2026-05-19 18:28:59,921 - optuna.study._optimize - INFO - Trial 219 pruned. 
2026-05-19 18:29:20,316 - experiment_functions - INFO - Early stopping at epoch 2000. Best Recall: 0.0812
2026-05-19 18:29:20,414 - optuna.study.study - INFO - Trial 220 finished with value: 0.08122451898268493 and parameters: {'n_layers': 1, 'embedding_dim': 128, 'lr': 0.0004904938456611697, 'lambda_val': 0.0012033073637209817, 'batch_size': 1179, 'optimizer': 'Adam'}. Best is trial 195 with value: 0.0829019064050288.
2026-05-19 18:29:27,359 - optuna.study._optimize - INFO - Trial 221 pruned. 
2026-05-19 18:29:34,474 - optuna.study._optimize - INFO - Trial 222 pruned. 
2026-05-19 18:29:40,448 - optuna.study._optimize - INFO - Trial 223 pruned. 
2026-05-19 18:29:51,875 - optuna.study._optimize - INFO - Trial 224 pruned. 
2026-05-19 18:30:16,914 - experiment_functions - INFO - Early stopping at epoch 2350. Best Recall: 0.0774
2026-05-19 18:30:17,004 - optuna.study.study - INFO - Trial 225 finished with value: 0.07743674116014855 and parameters: {'n_layers': 1, 'embedding_dim': 128, 'lr': 0.0006337997381930758, 'lambda_val': 1.0114788746801941e-06, 'batch_size': 1020, 'optimizer': 'Adam'}. Best is trial 195 with value: 0.0829019064050288.
2026-05-19 18:30:25,136 - experiment_functions - INFO - Early stopping at epoch 1450. Best Recall: 0.0684
2026-05-19 18:30:25,228 - optuna.study.study - INFO - Trial 226 finished with value: 0.06836424831876588 and parameters: {'n_layers': 1, 'embedding_dim': 128, 'lr': 0.0006011240587579044, 'lambda_val': 1.3459101315023828e-06, 'batch_size': 1049, 'optimizer': 'Adam'}. Best is trial 195 with value: 0.0829019064050288.
2026-05-19 18:30:34,704 - experiment_functions - INFO - Early stopping at epoch 1600. Best Recall: 0.0713
2026-05-19 18:30:34,846 - optuna.study.study - INFO - Trial 227 finished with value: 0.07130020443356343 and parameters: {'n_layers': 1, 'embedding_dim': 128, 'lr': 0.0006560594231709867, 'lambda_val': 0.00029262849653215964, 'batch_size': 978, 'optimizer': 'Adam'}. Best is trial 195 with value: 0.0829019064050288.
2026-05-19 18:30:44,727 - experiment_functions - INFO - Early stopping at epoch 1350. Best Recall: 0.0777
2026-05-19 18:30:44,884 - optuna.study.study - INFO - Trial 228 finished with value: 0.07771419002226787 and parameters: {'n_layers': 1, 'embedding_dim': 128, 'lr': 0.000511432990857204, 'lambda_val': 0.0004461955942875948, 'batch_size': 1115, 'optimizer': 'Adam'}. Best is trial 195 with value: 0.0829019064050288.
2026-05-19 18:30:51,206 - optuna.study._optimize - INFO - Trial 229 pruned. 
2026-05-19 18:31:30,607 - optuna.study._optimize - INFO - Trial 230 pruned. 
2026-05-19 18:31:40,489 - experiment_functions - INFO - Early stopping at epoch 1650. Best Recall: 0.0797
2026-05-19 18:31:40,592 - optuna.study.study - INFO - Trial 231 finished with value: 0.07974088106586107 and parameters: {'n_layers': 1, 'embedding_dim': 128, 'lr': 0.0005368417131078202, 'lambda_val': 1.0727951144457074e-06, 'batch_size': 986, 'optimizer': 'Adam'}. Best is trial 195 with value: 0.0829019064050288.
2026-05-19 18:31:50,435 - optuna.study._optimize - INFO - Trial 232 pruned. 
2026-05-19 18:32:01,213 - experiment_functions - INFO - Early stopping at epoch 1950. Best Recall: 0.0701
2026-05-19 18:32:01,328 - optuna.study.study - INFO - Trial 233 finished with value: 0.07012106465436428 and parameters: {'n_layers': 1, 'embedding_dim': 128, 'lr': 0.0006755840005230439, 'lambda_val': 1.0551665721280696e-06, 'batch_size': 1056, 'optimizer': 'Adam'}. Best is trial 195 with value: 0.0829019064050288.
2026-05-19 18:32:22,832 - experiment_functions - INFO - Early stopping at epoch 2050. Best Recall: 0.0729
2026-05-19 18:32:22,948 - optuna.study.study - INFO - Trial 234 finished with value: 0.07291618528408736 and parameters: {'n_layers': 1, 'embedding_dim': 128, 'lr': 0.00046175242967010836, 'lambda_val': 0.001322254369899331, 'batch_size': 1265, 'optimizer': 'Adam'}. Best is trial 195 with value: 0.0829019064050288.
2026-05-19 18:32:33,838 - experiment_functions - INFO - Early stopping at epoch 1800. Best Recall: 0.0768
2026-05-19 18:32:33,981 - optuna.study.study - INFO - Trial 235 finished with value: 0.07684085251364074 and parameters: {'n_layers': 1, 'embedding_dim': 128, 'lr': 0.000531928101475041, 'lambda_val': 1.0050963049696571e-06, 'batch_size': 1157, 'optimizer': 'Adam'}. Best is trial 195 with value: 0.0829019064050288.
2026-05-19 18:32:37,861 - experiment_functions - INFO - Early stopping at epoch 500. Best Recall: 0.0017
2026-05-19 18:32:37,955 - optuna.study.study - INFO - Trial 236 finished with value: 0.001663848648386007 and parameters: {'n_layers': 1, 'embedding_dim': 128, 'lr': 0.0006865403171557, 'lambda_val': 1.017042874472917e-06, 'batch_size': 1176, 'optimizer': 'SGD'}. Best is trial 195 with value: 0.0829019064050288.
2026-05-19 18:33:01,841 - optuna.study._optimize - INFO - Trial 237 pruned. 
2026-05-19 18:33:05,525 - experiment_functions - INFO - Early stopping at epoch 500. Best Recall: 0.0033
2026-05-19 18:33:05,631 - optuna.study.study - INFO - Trial 238 finished with value: 0.0033219213562888164 and parameters: {'n_layers': 1, 'embedding_dim': 128, 'lr': 1.8013031337143155e-05, 'lambda_val': 1.0108786913088602e-06, 'batch_size': 991, 'optimizer': 'Adam'}. Best is trial 195 with value: 0.0829019064050288.
2026-05-19 18:33:16,447 - experiment_functions - INFO - Early stopping at epoch 1500. Best Recall: 0.0768
2026-05-19 18:33:16,563 - optuna.study.study - INFO - Trial 239 finished with value: 0.07684187815324134 and parameters: {'n_layers': 1, 'embedding_dim': 128, 'lr': 0.0005849561895383443, 'lambda_val': 1.2918626985456687e-06, 'batch_size': 1138, 'optimizer': 'Adam'}. Best is trial 195 with value: 0.0829019064050288.
2026-05-19 18:33:32,075 - optuna.study._optimize - INFO - Trial 240 pruned. 
2026-05-19 18:33:44,827 - experiment_functions - INFO - Early stopping at epoch 2150. Best Recall: 0.0743
2026-05-19 18:33:44,987 - optuna.study.study - INFO - Trial 241 finished with value: 0.07434569953041652 and parameters: {'n_layers': 1, 'embedding_dim': 128, 'lr': 0.000581693104775774, 'lambda_val': 1.2757379189090097e-06, 'batch_size': 1144, 'optimizer': 'Adam'}. Best is trial 195 with value: 0.0829019064050288.
2026-05-19 18:33:57,374 - experiment_functions - INFO - Early stopping at epoch 1650. Best Recall: 0.0729
2026-05-19 18:33:57,469 - optuna.study.study - INFO - Trial 242 finished with value: 0.07291420420147675 and parameters: {'n_layers': 1, 'embedding_dim': 128, 'lr': 0.0006098540836128081, 'lambda_val': 1.2895631455719081e-06, 'batch_size': 1143, 'optimizer': 'Adam'}. Best is trial 195 with value: 0.0829019064050288.
2026-05-19 18:34:07,765 - experiment_functions - INFO - Early stopping at epoch 1600. Best Recall: 0.0738
2026-05-19 18:34:07,857 - optuna.study.study - INFO - Trial 243 finished with value: 0.07375927925643645 and parameters: {'n_layers': 1, 'embedding_dim': 128, 'lr': 0.0007436338227296269, 'lambda_val': 1.3245417964464694e-06, 'batch_size': 1213, 'optimizer': 'Adam'}. Best is trial 195 with value: 0.0829019064050288.
2026-05-19 18:34:19,306 - optuna.study._optimize - INFO - Trial 244 pruned. 
2026-05-19 18:34:37,321 - experiment_functions - INFO - Early stopping at epoch 2000. Best Recall: 0.0717
2026-05-19 18:34:37,414 - optuna.study.study - INFO - Trial 245 finished with value: 0.07170640874306075 and parameters: {'n_layers': 1, 'embedding_dim': 128, 'lr': 0.0005991790323097918, 'lambda_val': 0.00013594911293992237, 'batch_size': 1025, 'optimizer': 'Adam'}. Best is trial 195 with value: 0.0829019064050288.
2026-05-19 18:34:45,641 - experiment_functions - INFO - Early stopping at epoch 1150. Best Recall: 0.0753
2026-05-19 18:34:45,734 - optuna.study.study - INFO - Trial 246 finished with value: 0.07525557062357707 and parameters: {'n_layers': 1, 'embedding_dim': 128, 'lr': 0.0007552621879434791, 'lambda_val': 1.0328855233665298e-06, 'batch_size': 944, 'optimizer': 'Adam'}. Best is trial 195 with value: 0.0829019064050288.
2026-05-19 18:34:57,215 - optuna.study._optimize - INFO - Trial 247 pruned. 
2026-05-19 18:35:17,864 - experiment_functions - INFO - Early stopping at epoch 1650. Best Recall: 0.0793
2026-05-19 18:35:17,968 - optuna.study.study - INFO - Trial 248 finished with value: 0.0792540480062083 and parameters: {'n_layers': 1, 'embedding_dim': 128, 'lr': 0.0007540163387306578, 'lambda_val': 1.2508803324877844e-06, 'batch_size': 1270, 'optimizer': 'Adam'}. Best is trial 195 with value: 0.0829019064050288.
2026-05-19 18:35:31,924 - experiment_functions - INFO - Early stopping at epoch 1850. Best Recall: 0.0722
