2026-05-19 19:38:07,125 - optuna.study.study - INFO - Trial 136 finished with value: 0.08702105055013028 and parameters: {'n_layers': 1, 'embedding_dim': 256, 'lr': 0.001420455947751073, 'lambda_val': 3.5797325749094165e-05, 'batch_size': 3853, 'optimizer': 'Adam'}. Best is trial 60 with value: 0.09483159564833794.
2026-05-19 19:38:12,880 - experiment_functions - INFO - Early stopping at epoch 550. Best Recall: 0.0229
2026-05-19 19:38:12,971 - optuna.study.study - INFO - Trial 137 finished with value: 0.022858429316096707 and parameters: {'n_layers': 4, 'embedding_dim': 256, 'lr': 0.0016947740282718768, 'lambda_val': 2.4601563802708645e-05, 'batch_size': 3662, 'optimizer': 'Adam'}. Best is trial 60 with value: 0.09483159564833794.
2026-05-19 19:38:21,022 - experiment_functions - INFO - Early stopping at epoch 1150. Best Recall: 0.0919
2026-05-19 19:38:21,112 - optuna.study.study - INFO - Trial 138 finished with value: 0.09185490728557201 and parameters: {'n_layers': 1, 'embedding_dim': 256, 'lr': 0.001142209911594303, 'lambda_val': 1.277011809415342e-05, 'batch_size': 3293, 'optimizer': 'Adam'}. Best is trial 60 with value: 0.09483159564833794.
2026-05-19 19:38:27,839 - optuna.study._optimize - INFO - Trial 139 pruned. 
2026-05-19 19:38:35,508 - optuna.study._optimize - INFO - Trial 140 pruned. 
2026-05-19 19:38:54,967 - experiment_functions - INFO - Early stopping at epoch 2250. Best Recall: 0.0916
2026-05-19 19:38:55,068 - optuna.study.study - INFO - Trial 141 finished with value: 0.09158035620225273 and parameters: {'n_layers': 1, 'embedding_dim': 256, 'lr': 0.0010229426616587105, 'lambda_val': 1.9068215029074703e-05, 'batch_size': 3758, 'optimizer': 'Adam'}. Best is trial 60 with value: 0.09483159564833794.
2026-05-19 19:39:02,010 - optuna.study._optimize - INFO - Trial 142 pruned. 
2026-05-19 19:39:11,522 - optuna.study._optimize - INFO - Trial 143 pruned. 
2026-05-19 19:39:18,461 - experiment_functions - INFO - Early stopping at epoch 1050. Best Recall: 0.0913
2026-05-19 19:39:18,542 - optuna.study.study - INFO - Trial 144 finished with value: 0.09128644109676899 and parameters: {'n_layers': 1, 'embedding_dim': 256, 'lr': 0.0019931782086390335, 'lambda_val': 6.6977022574282254e-06, 'batch_size': 3055, 'optimizer': 'Adam'}. Best is trial 60 with value: 0.09483159564833794.
2026-05-19 19:39:23,182 - experiment_functions - INFO - Early stopping at epoch 650. Best Recall: 0.0188
2026-05-19 19:39:23,274 - optuna.study.study - INFO - Trial 145 finished with value: 0.01877422654448875 and parameters: {'n_layers': 1, 'embedding_dim': 256, 'lr': 0.09653213431242251, 'lambda_val': 7.813186930893241e-06, 'batch_size': 3390, 'optimizer': 'Adam'}. Best is trial 60 with value: 0.09483159564833794.
2026-05-19 19:39:30,416 - optuna.study._optimize - INFO - Trial 146 pruned. 
2026-05-19 19:39:35,909 - experiment_functions - INFO - Early stopping at epoch 800. Best Recall: 0.0738
2026-05-19 19:39:36,000 - optuna.study.study - INFO - Trial 147 finished with value: 0.0737736769400376 and parameters: {'n_layers': 1, 'embedding_dim': 96, 'lr': 0.0015419922260828931, 'lambda_val': 1.2846959054793511e-05, 'batch_size': 3579, 'optimizer': 'Adam'}. Best is trial 60 with value: 0.09483159564833794.
2026-05-19 19:39:45,298 - optuna.study._optimize - INFO - Trial 148 pruned. 
2026-05-19 19:39:53,238 - optuna.study._optimize - INFO - Trial 149 pruned. 
2026-05-19 19:40:01,185 - optuna.study._optimize - INFO - Trial 150 pruned. 
2026-05-19 19:40:20,699 - experiment_functions - INFO - Early stopping at epoch 1450. Best Recall: 0.0879
2026-05-19 19:40:20,843 - optuna.study.study - INFO - Trial 151 finished with value: 0.08787460932565289 and parameters: {'n_layers': 1, 'embedding_dim': 256, 'lr': 0.0011735747565413158, 'lambda_val': 1.400734262916809e-05, 'batch_size': 3325, 'optimizer': 'Adam'}. Best is trial 60 with value: 0.09483159564833794.
2026-05-19 19:40:28,712 - experiment_functions - INFO - Early stopping at epoch 1150. Best Recall: 0.0886
2026-05-19 19:40:28,802 - optuna.study.study - INFO - Trial 152 finished with value: 0.08858107125288199 and parameters: {'n_layers': 1, 'embedding_dim': 256, 'lr': 0.0017452498173674937, 'lambda_val': 4.931113934009363e-06, 'batch_size': 3025, 'optimizer': 'Adam'}. Best is trial 60 with value: 0.09483159564833794.
2026-05-19 19:41:00,199 - optuna.study._optimize - INFO - Trial 153 pruned. 
2026-05-19 19:41:07,834 - optuna.study._optimize - INFO - Trial 154 pruned. 
2026-05-19 19:41:16,987 - experiment_functions - INFO - Early stopping at epoch 700. Best Recall: 0.0618
2026-05-19 19:41:17,750 - optuna.study.study - INFO - Trial 155 finished with value: 0.06177971122980702 and parameters: {'n_layers': 1, 'embedding_dim': 64, 'lr': 0.0020743254910224394, 'lambda_val': 3.621246333474619e-05, 'batch_size': 3535, 'optimizer': 'Adam'}. Best is trial 60 with value: 0.09483159564833794.
2026-05-19 19:41:33,862 - optuna.study._optimize - INFO - Trial 156 pruned. 
2026-05-19 19:41:37,677 - experiment_functions - INFO - Early stopping at epoch 500. Best Recall: 0.0014
2026-05-19 19:41:37,756 - optuna.study.study - INFO - Trial 157 finished with value: 0.0013555072835684178 and parameters: {'n_layers': 1, 'embedding_dim': 256, 'lr': 0.001233787131372519, 'lambda_val': 9.604347949425704e-06, 'batch_size': 3658, 'optimizer': 'SGD'}. Best is trial 60 with value: 0.09483159564833794.
2026-05-19 19:41:48,837 - optuna.study._optimize - INFO - Trial 158 pruned. 
2026-05-19 19:41:55,586 - optuna.study._optimize - INFO - Trial 159 pruned. 
2026-05-19 19:42:14,519 - optuna.study._optimize - INFO - Trial 160 pruned. 
2026-05-19 19:42:23,485 - experiment_functions - INFO - Early stopping at epoch 1250. Best Recall: 0.0874
2026-05-19 19:42:23,575 - optuna.study.study - INFO - Trial 161 finished with value: 0.08736934187532802 and parameters: {'n_layers': 1, 'embedding_dim': 256, 'lr': 0.0020425947302923496, 'lambda_val': 4.679005263609244e-06, 'batch_size': 3047, 'optimizer': 'Adam'}. Best is trial 60 with value: 0.09483159564833794.
2026-05-19 19:42:30,269 - experiment_functions - INFO - Early stopping at epoch 1000. Best Recall: 0.0837
2026-05-19 19:42:30,359 - optuna.study.study - INFO - Trial 162 finished with value: 0.08372847674813405 and parameters: {'n_layers': 1, 'embedding_dim': 256, 'lr': 0.0015341567424388453, 'lambda_val': 4.905345685480436e-06, 'batch_size': 3042, 'optimizer': 'Adam'}. Best is trial 60 with value: 0.09483159564833794.
2026-05-19 19:42:42,507 - experiment_functions - INFO - Early stopping at epoch 1550. Best Recall: 0.0898
2026-05-19 19:42:42,586 - optuna.study.study - INFO - Trial 163 finished with value: 0.089835786992735 and parameters: {'n_layers': 1, 'embedding_dim': 256, 'lr': 0.0009039317860117708, 'lambda_val': 3.0436412165255496e-06, 'batch_size': 2692, 'optimizer': 'Adam'}. Best is trial 60 with value: 0.09483159564833794.
2026-05-19 19:42:55,385 - experiment_functions - INFO - Early stopping at epoch 1950. Best Recall: 0.0947
2026-05-19 19:42:56,159 - optuna.study.study - INFO - Trial 164 finished with value: 0.09470388788656198 and parameters: {'n_layers': 1, 'embedding_dim': 256, 'lr': 0.0008523837637366417, 'lambda_val': 1.784483442267747e-05, 'batch_size': 2637, 'optimizer': 'Adam'}. Best is trial 60 with value: 0.09483159564833794.
2026-05-19 19:43:10,665 - optuna.study._optimize - INFO - Trial 165 pruned. 
2026-05-19 19:43:17,522 - optuna.study._optimize - INFO - Trial 166 pruned. 
2026-05-19 19:43:25,690 - optuna.study._optimize - INFO - Trial 167 pruned. 
2026-05-19 19:43:32,289 - optuna.study._optimize - INFO - Trial 168 pruned. 
2026-05-19 19:43:45,648 - experiment_functions - INFO - Early stopping at epoch 1950. Best Recall: 0.0954
2026-05-19 19:43:45,764 - optuna.study.study - INFO - Trial 169 finished with value: 0.09538125025078809 and parameters: {'n_layers': 1, 'embedding_dim': 256, 'lr': 0.0008445450283519463, 'lambda_val': 1.2413728239856125e-05, 'batch_size': 2814, 'optimizer': 'Adam'}. Best is trial 169 with value: 0.09538125025078809.
2026-05-19 19:43:52,622 - optuna.study._optimize - INFO - Trial 170 pruned. 
2026-05-19 19:44:01,780 - optuna.study._optimize - INFO - Trial 171 pruned. 
2026-05-19 19:44:09,073 - optuna.study._optimize - INFO - Trial 172 pruned. 
2026-05-19 19:44:18,763 - optuna.study._optimize - INFO - Trial 173 pruned. 
2026-05-19 19:44:26,935 - experiment_functions - INFO - Early stopping at epoch 1250. Best Recall: 0.0882
2026-05-19 19:44:27,024 - optuna.study.study - INFO - Trial 174 finished with value: 0.08820459318868158 and parameters: {'n_layers': 1, 'embedding_dim': 256, 'lr': 0.0012564431859818672, 'lambda_val': 9.30421091696198e-06, 'batch_size': 2792, 'optimizer': 'Adam'}. Best is trial 169 with value: 0.09538125025078809.
2026-05-19 19:44:33,593 - optuna.study._optimize - INFO - Trial 175 pruned. 
2026-05-19 19:44:41,004 - optuna.study._optimize - INFO - Trial 176 pruned. 
2026-05-19 19:44:47,719 - optuna.study._optimize - INFO - Trial 177 pruned. 
2026-05-19 19:44:54,789 - optuna.study._optimize - INFO - Trial 178 pruned. 
2026-05-19 19:45:04,015 - optuna.study._optimize - INFO - Trial 179 pruned. 
2026-05-19 19:45:10,238 - optuna.study._optimize - INFO - Trial 180 pruned. 
2026-05-19 19:45:17,622 - optuna.study._optimize - INFO - Trial 181 pruned. 
2026-05-19 19:45:28,299 - experiment_functions - INFO - Early stopping at epoch 1700. Best Recall: 0.0905
2026-05-19 19:45:28,401 - optuna.study.study - INFO - Trial 182 finished with value: 0.09048786236451196 and parameters: {'n_layers': 1, 'embedding_dim': 256, 'lr': 0.0011028416878181666, 'lambda_val': 1.5120569465933174e-05, 'batch_size': 1564, 'optimizer': 'Adam'}. Best is trial 169 with value: 0.09538125025078809.
2026-05-19 19:45:36,590 - optuna.study._optimize - INFO - Trial 183 pruned. 
2026-05-19 19:45:45,174 - optuna.study._optimize - INFO - Trial 184 pruned. 
2026-05-19 19:45:50,638 - experiment_functions - INFO - Early stopping at epoch 750. Best Recall: 0.0818
2026-05-19 19:45:50,736 - optuna.study.study - INFO - Trial 185 finished with value: 0.08178215432426152 and parameters: {'n_layers': 1, 'embedding_dim': 256, 'lr': 0.0016240231479313287, 'lambda_val': 2.3664102091806328e-05, 'batch_size': 964, 'optimizer': 'Adam'}. Best is trial 169 with value: 0.09538125025078809.
2026-05-19 19:45:58,529 - optuna.study._optimize - INFO - Trial 186 pruned. 
2026-05-19 19:46:05,171 - optuna.study._optimize - INFO - Trial 187 pruned. 
2026-05-19 19:46:08,767 - experiment_functions - INFO - Early stopping at epoch 500. Best Recall: 0.0020
2026-05-19 19:46:08,903 - optuna.study.study - INFO - Trial 188 finished with value: 0.0019652776413310487 and parameters: {'n_layers': 1, 'embedding_dim': 256, 'lr': 0.0008049361674297909, 'lambda_val': 1.9076919361729525e-05, 'batch_size': 1701, 'optimizer': 'SGD'}. Best is trial 169 with value: 0.09538125025078809.
2026-05-19 19:46:16,633 - optuna.study._optimize - INFO - Trial 189 pruned. 
2026-05-19 19:46:24,399 - optuna.study._optimize - INFO - Trial 190 pruned. 
2026-05-19 19:46:34,631 - optuna.study._optimize - INFO - Trial 191 pruned. 
2026-05-19 19:46:42,144 - optuna.study._optimize - INFO - Trial 192 pruned. 
2026-05-19 19:47:01,347 - experiment_functions - INFO - Early stopping at epoch 1450. Best Recall: 0.0893
2026-05-19 19:47:01,490 - optuna.study.study - INFO - Trial 193 finished with value: 0.08933982480834772 and parameters: {'n_layers': 1, 'embedding_dim': 256, 'lr': 0.001837675595003541, 'lambda_val': 1.186714972514757e-05, 'batch_size': 1383, 'optimizer': 'Adam'}. Best is trial 169 with value: 0.09538125025078809.
2026-05-19 19:47:05,777 - experiment_functions - INFO - Early stopping at epoch 600. Best Recall: 0.0702
2026-05-19 19:47:05,888 - optuna.study.study - INFO - Trial 194 finished with value: 0.07017336926320565 and parameters: {'n_layers': 1, 'embedding_dim': 64, 'lr': 0.0025706599973576386, 'lambda_val': 8.606823048401287e-06, 'batch_size': 1533, 'optimizer': 'Adam'}. Best is trial 169 with value: 0.09538125025078809.
2026-05-19 19:47:12,886 - optuna.study._optimize - INFO - Trial 195 pruned. 
2026-05-19 19:47:24,341 - optuna.study._optimize - INFO - Trial 196 pruned. 
2026-05-19 19:47:31,537 - optuna.study._optimize - INFO - Trial 197 pruned. 
2026-05-19 19:47:46,559 - experiment_functions - INFO - Early stopping at epoch 2300. Best Recall: 0.0953
2026-05-19 19:47:46,651 - optuna.study.study - INFO - Trial 198 finished with value: 0.09525320894179246 and parameters: {'n_layers': 1, 'embedding_dim': 256, 'lr': 0.000909640827786323, 'lambda_val': 2.9201023097104565e-05, 'batch_size': 2721, 'optimizer': 'Adam'}. Best is trial 169 with value: 0.09538125025078809.
2026-05-19 19:47:52,663 - optuna.study._optimize - INFO - Trial 199 pruned. 
2026-05-19 19:48:01,982 - optuna.study._optimize - INFO - Trial 200 pruned. 
2026-05-19 19:48:17,246 - experiment_functions - INFO - Early stopping at epoch 2150. Best Recall: 0.0911
2026-05-19 19:48:17,335 - optuna.study.study - INFO - Trial 201 finished with value: 0.0910677520446918 and parameters: {'n_layers': 1, 'embedding_dim': 256, 'lr': 0.0010217237153188228, 'lambda_val': 1.9890132393258182e-05, 'batch_size': 1617, 'optimizer': 'Adam'}. Best is trial 169 with value: 0.09538125025078809.
2026-05-19 19:48:25,161 - optuna.study._optimize - INFO - Trial 202 pruned. 
2026-05-19 19:48:33,176 - optuna.study._optimize - INFO - Trial 203 pruned. 
2026-05-19 19:48:40,395 - optuna.study._optimize - INFO - Trial 204 pruned. 
2026-05-19 19:48:47,247 - optuna.study._optimize - INFO - Trial 205 pruned. 
2026-05-19 19:48:55,349 - optuna.study._optimize - INFO - Trial 206 pruned. 
2026-05-19 19:49:02,737 - optuna.study._optimize - INFO - Trial 207 pruned. 
2026-05-19 19:49:12,371 - optuna.study._optimize - INFO - Trial 208 pruned. 
2026-05-19 19:49:21,079 - experiment_functions - INFO - Early stopping at epoch 1250. Best Recall: 0.0907
2026-05-19 19:49:21,190 - optuna.study.study - INFO - Trial 209 finished with value: 0.0906560868893089 and parameters: {'n_layers': 1, 'embedding_dim': 256, 'lr': 0.0015673572357902048, 'lambda_val': 2.531934131410788e-05, 'batch_size': 2852, 'optimizer': 'Adam'}. Best is trial 169 with value: 0.09538125025078809.
2026-05-19 19:49:27,644 - experiment_functions - INFO - Early stopping at epoch 900. Best Recall: 0.0809
2026-05-19 19:49:27,755 - optuna.study.study - INFO - Trial 210 finished with value: 0.08085147208424913 and parameters: {'n_layers': 1, 'embedding_dim': 256, 'lr': 0.0015996469472746929, 'lambda_val': 3.7787463509495904e-05, 'batch_size': 2865, 'optimizer': 'RMSprop'}. Best is trial 169 with value: 0.09538125025078809.
2026-05-19 19:49:35,055 - optuna.study._optimize - INFO - Trial 211 pruned. 
2026-05-19 19:49:42,753 - experiment_functions - INFO - Early stopping at epoch 800. Best Recall: 0.0422
2026-05-19 19:49:42,899 - optuna.study.study - INFO - Trial 212 finished with value: 0.04216760282672959 and parameters: {'n_layers': 3, 'embedding_dim': 256, 'lr': 0.00089402646012311, 'lambda_val': 2.370657778171781e-05, 'batch_size': 2806, 'optimizer': 'Adam'}. Best is trial 169 with value: 0.09538125025078809.
2026-05-19 19:49:54,736 - optuna.study._optimize - INFO - Trial 213 pruned. 
2026-05-19 19:50:02,091 - optuna.study._optimize - INFO - Trial 214 pruned. 
2026-05-19 19:50:11,411 - experiment_functions - INFO - Early stopping at epoch 1350. Best Recall: 0.0919
2026-05-19 19:50:11,578 - optuna.study.study - INFO - Trial 215 finished with value: 0.09187181751227737 and parameters: {'n_layers': 1, 'embedding_dim': 256, 'lr': 0.00130389573992903, 'lambda_val': 1.1503699119004802e-05, 'batch_size': 2641, 'optimizer': 'Adam'}. Best is trial 169 with value: 0.09538125025078809.
2026-05-19 19:50:15,965 - experiment_functions - INFO - Early stopping at epoch 600. Best Recall: 0.0545
2026-05-19 19:50:16,054 - optuna.study.study - INFO - Trial 216 finished with value: 0.05447745610527449 and parameters: {'n_layers': 2, 'embedding_dim': 128, 'lr': 0.001395875049924192, 'lambda_val': 1.1676885879484676e-05, 'batch_size': 2651, 'optimizer': 'Adam'}. Best is trial 169 with value: 0.09538125025078809.
2026-05-19 19:50:23,625 - optuna.study._optimize - INFO - Trial 217 pruned. 
2026-05-19 19:50:30,870 - optuna.study._optimize - INFO - Trial 218 pruned. 
2026-05-19 19:50:39,980 - experiment_functions - INFO - Early stopping at epoch 1250. Best Recall: 0.0878
2026-05-19 19:50:40,058 - optuna.study.study - INFO - Trial 219 finished with value: 0.08777690675240479 and parameters: {'n_layers': 1, 'embedding_dim': 256, 'lr': 0.0009644964062243434, 'lambda_val': 3.150258489136887e-05, 'batch_size': 2734, 'optimizer': 'Adam'}. Best is trial 169 with value: 0.09538125025078809.
2026-05-19 19:50:47,661 - optuna.study._optimize - INFO - Trial 220 pruned. 
2026-05-19 19:50:54,501 - optuna.study._optimize - INFO - Trial 221 pruned. 
2026-05-19 19:51:03,925 - experiment_functions - INFO - Early stopping at epoch 1350. Best Recall: 0.0917
2026-05-19 19:51:04,039 - optuna.study.study - INFO - Trial 222 finished with value: 0.09174112924972085 and parameters: {'n_layers': 1, 'embedding_dim': 256, 'lr': 0.0015122690878520714, 'lambda_val': 1.783732345904517e-05, 'batch_size': 1479, 'optimizer': 'Adam'}. Best is trial 169 with value: 0.09538125025078809.
2026-05-19 19:51:14,300 - optuna.study._optimize - INFO - Trial 223 pruned. 
2026-05-19 19:51:21,018 - optuna.study._optimize - INFO - Trial 224 pruned. 
2026-05-19 19:51:31,184 - optuna.study._optimize - INFO - Trial 225 pruned. 
2026-05-19 19:51:38,186 - optuna.study._optimize - INFO - Trial 226 pruned. 
2026-05-19 19:51:46,865 - experiment_functions - INFO - Early stopping at epoch 1200. Best Recall: 0.0910
2026-05-19 19:51:47,003 - optuna.study.study - INFO - Trial 227 finished with value: 0.09099408246820703 and parameters: {'n_layers': 1, 'embedding_dim': 256, 'lr': 0.00154952536141116, 'lambda_val': 2.6751976056313784e-05, 'batch_size': 1483, 'optimizer': 'Adam'}. Best is trial 169 with value: 0.09538125025078809.
2026-05-19 19:51:50,468 - experiment_functions - INFO - Early stopping at epoch 500. Best Recall: 0.0036
2026-05-19 19:51:50,617 - optuna.study.study - INFO - Trial 228 finished with value: 0.003632303669533129 and parameters: {'n_layers': 1, 'embedding_dim': 256, 'lr': 0.0012857570981119463, 'lambda_val': 3.037411655813749e-05, 'batch_size': 1481, 'optimizer': 'SGD'}. Best is trial 169 with value: 0.09538125025078809.
2026-05-19 19:51:59,059 - optuna.study._optimize - INFO - Trial 229 pruned. 
2026-05-19 19:52:15,631 - experiment_functions - INFO - Early stopping at epoch 950. Best Recall: 0.0716
2026-05-19 19:52:15,724 - optuna.study.study - INFO - Trial 230 finished with value: 0.07161496536459662 and parameters: {'n_layers': 1, 'embedding_dim': 96, 'lr': 0.0010292517685015882, 'lambda_val': 4.526916603873274e-05, 'batch_size': 2784, 'optimizer': 'Adam'}. Best is trial 169 with value: 0.09538125025078809.
2026-05-19 19:52:24,084 - optuna.study._optimize - INFO - Trial 231 pruned. 
2026-05-19 19:52:30,834 - optuna.study._optimize - INFO - Trial 232 pruned. 
2026-05-19 19:52:37,812 - optuna.study._optimize - INFO - Trial 233 pruned. 
2026-05-19 19:52:49,074 - experiment_functions - INFO - Early stopping at epoch 1850. Best Recall: 0.0910
2026-05-19 19:52:49,222 - optuna.study.study - INFO - Trial 234 finished with value: 0.09095268339604798 and parameters: {'n_layers': 1, 'embedding_dim': 256, 'lr': 0.0015463870976742064, 'lambda_val': 3.387883732776721e-05, 'batch_size': 1102, 'optimizer': 'Adam'}. Best is trial 169 with value: 0.09538125025078809.
2026-05-19 19:52:56,212 - optuna.study._optimize - INFO - Trial 235 pruned. 
2026-05-19 19:53:01,436 - experiment_functions - INFO - Early stopping at epoch 1000. Best Recall: 0.0860
2026-05-19 19:53:01,542 - optuna.study.study - INFO - Trial 236 finished with value: 0.08597815387442831 and parameters: {'n_layers': 1, 'embedding_dim': 64, 'lr': 0.0009815868547897902, 'lambda_val': 2.8098635016123128e-05, 'batch_size': 1130, 'optimizer': 'Adam'}. Best is trial 169 with value: 0.09538125025078809.
2026-05-19 19:53:12,168 - experiment_functions - INFO - Early stopping at epoch 1800. Best Recall: 0.0970
2026-05-19 19:53:12,277 - optuna.study.study - INFO - Trial 237 finished with value: 0.09697381615822427 and parameters: {'n_layers': 1, 'embedding_dim': 256, 'lr': 0.001259693579505263, 'lambda_val': 5.2505958993691735e-05, 'batch_size': 1215, 'optimizer': 'Adam'}. Best is trial 237 with value: 0.09697381615822427.
2026-05-19 19:53:18,885 - optuna.study._optimize - INFO - Trial 238 pruned. 
2026-05-19 19:53:25,990 - optuna.study._optimize - INFO - Trial 239 pruned. 
2026-05-19 19:53:36,536 - experiment_functions - INFO - Early stopping at epoch 1350. Best Recall: 0.0895
2026-05-19 19:53:36,650 - optuna.study.study - INFO - Trial 240 finished with value: 0.08948041419176041 and parameters: {'n_layers': 1, 'embedding_dim': 256, 'lr': 0.0012151355961107456, 'lambda_val': 5.581192198614355e-05, 'batch_size': 3988, 'optimizer': 'Adam'}. Best is trial 237 with value: 0.09697381615822427.
2026-05-19 19:53:43,302 - experiment_functions - INFO - Early stopping at epoch 950. Best Recall: 0.0768
2026-05-19 19:53:43,405 - optuna.study.study - INFO - Trial 241 finished with value: 0.0767724689591915 and parameters: {'n_layers': 1, 'embedding_dim': 256, 'lr': 0.0008211295418583939, 'lambda_val': 3.7114376903953384e-05, 'batch_size': 973, 'optimizer': 'Adam'}. Best is trial 237 with value: 0.09697381615822427.
2026-05-19 19:53:51,280 - optuna.study._optimize - INFO - Trial 242 pruned. 
2026-05-19 19:53:57,866 - optuna.study._optimize - INFO - Trial 243 pruned. 
2026-05-19 19:54:03,795 - experiment_functions - INFO - Early stopping at epoch 950. Best Recall: 0.0018
