2026-05-19 21:12:16,809 - optuna.study._optimize - INFO - Trial 227 pruned. 
2026-05-19 21:12:22,896 - optuna.study._optimize - INFO - Trial 228 pruned. 
2026-05-19 21:12:30,522 - optuna.study._optimize - INFO - Trial 229 pruned. 
2026-05-19 21:12:36,664 - optuna.study._optimize - INFO - Trial 230 pruned. 
2026-05-19 21:12:45,392 - optuna.study._optimize - INFO - Trial 231 pruned. 
2026-05-19 21:12:56,376 - experiment_functions - INFO - Early stopping at epoch 1600. Best Recall: 0.1026
2026-05-19 21:12:56,481 - optuna.study.study - INFO - Trial 232 finished with value: 0.10259418129368066 and parameters: {'n_layers': 1, 'embedding_dim': 256, 'lr': 0.0013257586949719144, 'lambda_val': 1.3332824378097643e-06, 'batch_size': 2695, 'optimizer': 'Adam'}. Best is trial 164 with value: 0.10487131574525042.
2026-05-19 21:13:07,684 - optuna.study._optimize - INFO - Trial 233 pruned. 
2026-05-19 21:13:17,715 - optuna.study._optimize - INFO - Trial 234 pruned. 
2026-05-19 21:13:27,805 - experiment_functions - INFO - Early stopping at epoch 1550. Best Recall: 0.0972
2026-05-19 21:13:27,962 - optuna.study.study - INFO - Trial 235 finished with value: 0.09715330308447816 and parameters: {'n_layers': 1, 'embedding_dim': 256, 'lr': 0.0014483866763456144, 'lambda_val': 1.7377416154314711e-06, 'batch_size': 3403, 'optimizer': 'Adam'}. Best is trial 164 with value: 0.10487131574525042.
2026-05-19 21:13:35,187 - optuna.study._optimize - INFO - Trial 236 pruned. 
2026-05-19 21:13:43,903 - optuna.study._optimize - INFO - Trial 237 pruned. 
2026-05-19 21:13:51,331 - optuna.study._optimize - INFO - Trial 238 pruned. 
2026-05-19 21:13:58,972 - optuna.study._optimize - INFO - Trial 239 pruned. 
2026-05-19 21:14:05,800 - optuna.study._optimize - INFO - Trial 240 pruned. 
2026-05-19 21:14:16,989 - experiment_functions - INFO - Early stopping at epoch 1500. Best Recall: 0.0961
2026-05-19 21:14:17,085 - optuna.study.study - INFO - Trial 241 finished with value: 0.09605961176156598 and parameters: {'n_layers': 1, 'embedding_dim': 256, 'lr': 0.0010771728337969876, 'lambda_val': 1.613857774919395e-06, 'batch_size': 2814, 'optimizer': 'Adam'}. Best is trial 164 with value: 0.10487131574525042.
2026-05-19 21:14:33,006 - experiment_functions - INFO - Early stopping at epoch 2100. Best Recall: 0.1020
2026-05-19 21:14:33,100 - optuna.study.study - INFO - Trial 242 finished with value: 0.10197571115790711 and parameters: {'n_layers': 1, 'embedding_dim': 256, 'lr': 0.0008379054106340115, 'lambda_val': 1.3708092191170836e-06, 'batch_size': 2881, 'optimizer': 'Adam'}. Best is trial 164 with value: 0.10487131574525042.
2026-05-19 21:14:56,981 - experiment_functions - INFO - Early stopping at epoch 3400. Best Recall: 0.1092
2026-05-19 21:14:57,080 - optuna.study.study - INFO - Trial 243 finished with value: 0.10917472634437861 and parameters: {'n_layers': 1, 'embedding_dim': 256, 'lr': 0.0008886894769139526, 'lambda_val': 1.2010599773504902e-06, 'batch_size': 1821, 'optimizer': 'Adam'}. Best is trial 243 with value: 0.10917472634437861.
2026-05-19 21:15:04,219 - optuna.study._optimize - INFO - Trial 244 pruned. 
2026-05-19 21:15:13,640 - optuna.study._optimize - INFO - Trial 245 pruned. 
2026-05-19 21:15:21,087 - optuna.study._optimize - INFO - Trial 246 pruned. 
2026-05-19 21:15:30,726 - optuna.study._optimize - INFO - Trial 247 pruned. 
2026-05-19 21:15:38,851 - optuna.study._optimize - INFO - Trial 248 pruned. 
2026-05-19 21:15:45,637 - optuna.study._optimize - INFO - Trial 249 pruned. 
2026-05-19 21:15:55,033 - experiment_functions - INFO - Early stopping at epoch 1300. Best Recall: 0.0969
2026-05-19 21:15:55,137 - optuna.study.study - INFO - Trial 250 finished with value: 0.09690330536446985 and parameters: {'n_layers': 1, 'embedding_dim': 256, 'lr': 0.0013643310606096708, 'lambda_val': 5.077373561774285e-06, 'batch_size': 3316, 'optimizer': 'Adam'}. Best is trial 243 with value: 0.10917472634437861.
2026-05-19 21:15:59,707 - experiment_functions - INFO - Early stopping at epoch 650. Best Recall: 0.0619
2026-05-19 21:15:59,823 - optuna.study.study - INFO - Trial 251 finished with value: 0.06187176711637666 and parameters: {'n_layers': 1, 'embedding_dim': 64, 'lr': 0.001121888219740116, 'lambda_val': 3.1136287904189486e-06, 'batch_size': 3206, 'optimizer': 'RMSprop'}. Best is trial 243 with value: 0.10917472634437861.
2026-05-19 21:16:07,160 - optuna.study._optimize - INFO - Trial 252 pruned. 
2026-05-19 21:16:14,392 - optuna.study._optimize - INFO - Trial 253 pruned. 
2026-05-19 21:16:25,158 - optuna.study._optimize - INFO - Trial 254 pruned. 
2026-05-19 21:16:32,919 - optuna.study._optimize - INFO - Trial 255 pruned. 
2026-05-19 21:16:39,933 - optuna.study._optimize - INFO - Trial 256 pruned. 
2026-05-19 21:16:46,882 - optuna.study._optimize - INFO - Trial 257 pruned. 
2026-05-19 21:16:58,194 - experiment_functions - INFO - Early stopping at epoch 1700. Best Recall: 0.0967
2026-05-19 21:16:58,287 - optuna.study.study - INFO - Trial 258 finished with value: 0.09665537979590583 and parameters: {'n_layers': 1, 'embedding_dim': 256, 'lr': 0.0009985740244268693, 'lambda_val': 1.2588682628519474e-06, 'batch_size': 3103, 'optimizer': 'Adam'}. Best is trial 243 with value: 0.10917472634437861.
2026-05-19 21:17:05,647 - optuna.study._optimize - INFO - Trial 259 pruned. 
2026-05-19 21:17:09,492 - experiment_functions - INFO - Early stopping at epoch 500. Best Recall: 0.0020
2026-05-19 21:17:09,597 - optuna.study.study - INFO - Trial 260 finished with value: 0.0019604519091542096 and parameters: {'n_layers': 1, 'embedding_dim': 256, 'lr': 0.0012961956030884982, 'lambda_val': 8.878579100978939e-06, 'batch_size': 1755, 'optimizer': 'SGD'}. Best is trial 243 with value: 0.10917472634437861.
2026-05-19 21:17:17,025 - optuna.study._optimize - INFO - Trial 261 pruned. 
2026-05-19 21:17:22,798 - experiment_functions - INFO - Early stopping at epoch 600. Best Recall: 0.0365
2026-05-19 21:17:22,891 - optuna.study.study - INFO - Trial 262 finished with value: 0.036451825183413285 and parameters: {'n_layers': 3, 'embedding_dim': 256, 'lr': 0.0008677034542829616, 'lambda_val': 2.315527911390201e-05, 'batch_size': 3372, 'optimizer': 'Adam'}. Best is trial 243 with value: 0.10917472634437861.
2026-05-19 21:17:36,726 - optuna.study._optimize - INFO - Trial 263 pruned. 
2026-05-19 21:17:46,555 - optuna.study._optimize - INFO - Trial 264 pruned. 
2026-05-19 21:17:53,317 - optuna.study._optimize - INFO - Trial 265 pruned. 
2026-05-19 21:18:00,524 - optuna.study._optimize - INFO - Trial 266 pruned. 
2026-05-19 21:18:09,464 - optuna.study._optimize - INFO - Trial 267 pruned. 
2026-05-19 21:18:16,358 - optuna.study._optimize - INFO - Trial 268 pruned. 
2026-05-19 21:18:25,137 - experiment_functions - INFO - Early stopping at epoch 1300. Best Recall: 0.0961
2026-05-19 21:18:25,241 - optuna.study.study - INFO - Trial 269 finished with value: 0.09609309436441964 and parameters: {'n_layers': 1, 'embedding_dim': 256, 'lr': 0.0011707893186548304, 'lambda_val': 2.552530740857207e-06, 'batch_size': 2991, 'optimizer': 'Adam'}. Best is trial 243 with value: 0.10917472634437861.
2026-05-19 21:18:34,892 - experiment_functions - INFO - Early stopping at epoch 1400. Best Recall: 0.0982
2026-05-19 21:18:35,059 - optuna.study.study - INFO - Trial 270 finished with value: 0.09822318979964852 and parameters: {'n_layers': 1, 'embedding_dim': 256, 'lr': 0.000947652852196376, 'lambda_val': 2.006236423854192e-06, 'batch_size': 2752, 'optimizer': 'Adam'}. Best is trial 243 with value: 0.10917472634437861.
2026-05-19 21:18:42,620 - optuna.study._optimize - INFO - Trial 271 pruned. 
2026-05-19 21:18:49,769 - optuna.study._optimize - INFO - Trial 272 pruned. 
2026-05-19 21:18:55,369 - experiment_functions - INFO - Early stopping at epoch 850. Best Recall: 0.0635
2026-05-19 21:18:55,472 - optuna.study.study - INFO - Trial 273 finished with value: 0.06351759899082167 and parameters: {'n_layers': 1, 'embedding_dim': 64, 'lr': 0.0008937526539370537, 'lambda_val': 2.5907149115009196e-06, 'batch_size': 2816, 'optimizer': 'Adam'}. Best is trial 243 with value: 0.10917472634437861.
2026-05-19 21:19:04,265 - optuna.study._optimize - INFO - Trial 274 pruned. 
2026-05-19 21:19:12,788 - experiment_functions - INFO - Early stopping at epoch 1000. Best Recall: 0.0968
2026-05-19 21:19:12,903 - optuna.study.study - INFO - Trial 275 finished with value: 0.09683058341771827 and parameters: {'n_layers': 1, 'embedding_dim': 256, 'lr': 0.0016548724706790274, 'lambda_val': 4.654022157305616e-06, 'batch_size': 2702, 'optimizer': 'Adam'}. Best is trial 243 with value: 0.10917472634437861.
2026-05-19 21:19:19,941 - optuna.study._optimize - INFO - Trial 276 pruned. 
2026-05-19 21:19:26,438 - experiment_functions - INFO - Early stopping at epoch 700. Best Recall: 0.0280
2026-05-19 21:19:26,532 - optuna.study.study - INFO - Trial 277 finished with value: 0.02796385400167355 and parameters: {'n_layers': 2, 'embedding_dim': 256, 'lr': 0.000983058733427566, 'lambda_val': 0.01577445470649161, 'batch_size': 3397, 'optimizer': 'Adam'}. Best is trial 243 with value: 0.10917472634437861.
2026-05-19 21:19:30,447 - experiment_functions - INFO - Early stopping at epoch 500. Best Recall: 0.0007
2026-05-19 21:19:30,552 - optuna.study.study - INFO - Trial 278 finished with value: 0.0006804680424078546 and parameters: {'n_layers': 1, 'embedding_dim': 256, 'lr': 1.0284188232610442e-05, 'lambda_val': 3.1212196507378387e-06, 'batch_size': 2624, 'optimizer': 'Adam'}. Best is trial 243 with value: 0.10917472634437861.
2026-05-19 21:19:40,027 - experiment_functions - INFO - Early stopping at epoch 500. Best Recall: 0.0018
2026-05-19 21:19:40,657 - optuna.study.study - INFO - Trial 279 finished with value: 0.0017598041613924571 and parameters: {'n_layers': 1, 'embedding_dim': 256, 'lr': 0.0013162724057128557, 'lambda_val': 1.6634484930387122e-06, 'batch_size': 2787, 'optimizer': 'SGD'}. Best is trial 243 with value: 0.10917472634437861.
2026-05-19 21:19:47,437 - optuna.study._optimize - INFO - Trial 280 pruned. 
2026-05-19 21:19:56,894 - experiment_functions - INFO - Early stopping at epoch 1450. Best Recall: 0.1025
2026-05-19 21:19:56,995 - optuna.study.study - INFO - Trial 281 finished with value: 0.10249083039659986 and parameters: {'n_layers': 1, 'embedding_dim': 256, 'lr': 0.0010353442943153016, 'lambda_val': 8.358018191691345e-06, 'batch_size': 3286, 'optimizer': 'Adam'}. Best is trial 243 with value: 0.10917472634437861.
2026-05-19 21:20:04,355 - optuna.study._optimize - INFO - Trial 282 pruned. 
2026-05-19 21:20:11,544 - optuna.study._optimize - INFO - Trial 283 pruned. 
2026-05-19 21:20:17,366 - experiment_functions - INFO - Early stopping at epoch 550. Best Recall: 0.0224
2026-05-19 21:20:17,457 - optuna.study.study - INFO - Trial 284 finished with value: 0.022431364604100876 and parameters: {'n_layers': 4, 'embedding_dim': 256, 'lr': 0.0012940897438423445, 'lambda_val': 9.763404727847115e-06, 'batch_size': 3174, 'optimizer': 'Adam'}. Best is trial 243 with value: 0.10917472634437861.
2026-05-19 21:20:24,616 - optuna.study._optimize - INFO - Trial 285 pruned. 
2026-05-19 21:20:31,612 - optuna.study._optimize - INFO - Trial 286 pruned. 
2026-05-19 21:20:38,122 - optuna.study._optimize - INFO - Trial 287 pruned. 
2026-05-19 21:20:47,465 - experiment_functions - INFO - Early stopping at epoch 1350. Best Recall: 0.1009
2026-05-19 21:20:47,556 - optuna.study.study - INFO - Trial 288 finished with value: 0.10089309172136504 and parameters: {'n_layers': 1, 'embedding_dim': 256, 'lr': 0.0015266455978391463, 'lambda_val': 3.814171836147029e-06, 'batch_size': 1317, 'optimizer': 'Adam'}. Best is trial 243 with value: 0.10917472634437861.
2026-05-19 21:20:55,573 - optuna.study._optimize - INFO - Trial 289 pruned. 
2026-05-19 21:21:02,909 - optuna.study._optimize - INFO - Trial 290 pruned. 
2026-05-19 21:21:08,708 - experiment_functions - INFO - Early stopping at epoch 850. Best Recall: 0.0681
2026-05-19 21:21:08,809 - optuna.study.study - INFO - Trial 291 finished with value: 0.06811334969386473 and parameters: {'n_layers': 1, 'embedding_dim': 96, 'lr': 0.0015204969636903429, 'lambda_val': 1.2971980425975159e-05, 'batch_size': 3110, 'optimizer': 'Adam'}. Best is trial 243 with value: 0.10917472634437861.
2026-05-19 21:21:15,938 - optuna.study._optimize - INFO - Trial 292 pruned. 
2026-05-19 21:21:22,855 - optuna.study._optimize - INFO - Trial 293 pruned. 
2026-05-19 21:21:28,661 - experiment_functions - INFO - Early stopping at epoch 950. Best Recall: 0.0581
2026-05-19 21:21:28,775 - optuna.study.study - INFO - Trial 294 finished with value: 0.058067712448700126 and parameters: {'n_layers': 1, 'embedding_dim': 32, 'lr': 0.0010706800912597264, 'lambda_val': 2.770885581310315e-06, 'batch_size': 2958, 'optimizer': 'Adam'}. Best is trial 243 with value: 0.10917472634437861.
2026-05-19 21:21:35,984 - optuna.study._optimize - INFO - Trial 295 pruned. 
2026-05-19 21:21:45,742 - experiment_functions - INFO - Early stopping at epoch 950. Best Recall: 0.0804
2026-05-19 21:21:45,833 - optuna.study.study - INFO - Trial 296 finished with value: 0.08040724624764695 and parameters: {'n_layers': 1, 'embedding_dim': 256, 'lr': 0.002438589412081454, 'lambda_val': 2.057859329108596e-05, 'batch_size': 2145, 'optimizer': 'Adam'}. Best is trial 243 with value: 0.10917472634437861.
2026-05-19 21:21:52,727 - optuna.study._optimize - INFO - Trial 297 pruned. 
2026-05-19 21:21:59,877 - optuna.study._optimize - INFO - Trial 298 pruned. 
2026-05-19 21:22:10,278 - experiment_functions - INFO - Early stopping at epoch 1500. Best Recall: 0.0974
2026-05-19 21:22:10,414 - optuna.study.study - INFO - Trial 299 finished with value: 0.09740673056842468 and parameters: {'n_layers': 1, 'embedding_dim': 256, 'lr': 0.001035716164361161, 'lambda_val': 3.6625340505076524e-06, 'batch_size': 3460, 'optimizer': 'Adam'}. Best is trial 243 with value: 0.10917472634437861.
2026-05-19 21:22:10,416 - experiment_functions - INFO - Training the best model ... for e_100K_1c3dcs
2026-05-19 21:22:20,306 - experiment_functions - INFO - Early stopping at epoch 2650. Best Recall: 0.0971
2026-05-19 21:22:20,418 - root - INFO -   **** Training e_100K_1c3dcs_rand1
2026-05-19 21:22:20,433 - root - INFO -   **** Getting 70319/81200 random edges
2026-05-19 21:22:20,446 - experiment_functions - INFO - Training the best model ... for e_100K_1c3dcs_rand1
2026-05-19 21:22:24,851 - experiment_functions - INFO - Early stopping at epoch 1200. Best Recall: 0.1137
2026-05-19 21:22:24,962 - root - INFO -   **** Training e_100K_1c3dcs_rand2
2026-05-19 21:22:24,976 - root - INFO -   **** Getting 70319/81200 random edges
2026-05-19 21:22:24,989 - experiment_functions - INFO - Training the best model ... for e_100K_1c3dcs_rand2
2026-05-19 21:22:29,210 - experiment_functions - INFO - Early stopping at epoch 1150. Best Recall: 0.1129
2026-05-19 21:22:29,322 - root - INFO -   **** Training e_100K_1c3dcs_rand3
2026-05-19 21:22:29,335 - root - INFO -   **** Getting 70319/81200 random edges
2026-05-19 21:22:29,349 - experiment_functions - INFO - Training the best model ... for e_100K_1c3dcs_rand3
2026-05-19 21:22:33,760 - experiment_functions - INFO - Early stopping at epoch 1200. Best Recall: 0.1265
2026-05-19 21:22:33,872 - root - INFO -   **** Training e_100K_1c3dcs_rand4
2026-05-19 21:22:33,885 - root - INFO -   **** Getting 70319/81200 random edges
2026-05-19 21:22:33,898 - experiment_functions - INFO - Training the best model ... for e_100K_1c3dcs_rand4
2026-05-19 21:22:37,936 - experiment_functions - INFO - Early stopping at epoch 1100. Best Recall: 0.1151
2026-05-19 21:22:38,049 - root - INFO -   **** Training e_100K_1c3dcs_rand5
2026-05-19 21:22:38,062 - root - INFO -   **** Getting 70319/81200 random edges
2026-05-19 21:22:38,076 - experiment_functions - INFO - Training the best model ... for e_100K_1c3dcs_rand5
2026-05-19 21:22:42,113 - experiment_functions - INFO - Early stopping at epoch 1100. Best Recall: 0.1097
