2026-05-19 16:57:36,881 - optuna.study.study - INFO - Trial 274 finished with value: 0.0560267618595498 and parameters: {'n_layers': 3, 'embedding_dim': 256, 'lr': 0.0009223081648679096, 'lambda_val': 6.0074853685942176e-05, 'batch_size': 1326, 'optimizer': 'Adam'}. Best is trial 167 with value: 0.14723617654182158.
2026-05-19 16:57:42,886 - optuna.study._optimize - INFO - Trial 275 pruned. 
2026-05-19 16:57:58,405 - optuna.study._optimize - INFO - Trial 276 pruned. 
2026-05-19 16:58:05,754 - optuna.study._optimize - INFO - Trial 277 pruned. 
2026-05-19 16:58:14,854 - experiment_functions - INFO - Early stopping at epoch 1300. Best Recall: 0.1299
2026-05-19 16:58:14,953 - optuna.study.study - INFO - Trial 278 finished with value: 0.12990746280811155 and parameters: {'n_layers': 1, 'embedding_dim': 256, 'lr': 0.0007565439575992678, 'lambda_val': 3.27892930739541e-05, 'batch_size': 1943, 'optimizer': 'Adam'}. Best is trial 167 with value: 0.14723617654182158.
2026-05-19 16:58:24,515 - experiment_functions - INFO - Early stopping at epoch 1300. Best Recall: 0.1354
2026-05-19 16:58:24,623 - optuna.study.study - INFO - Trial 279 finished with value: 0.13544057048847233 and parameters: {'n_layers': 1, 'embedding_dim': 256, 'lr': 0.000519026866505605, 'lambda_val': 0.00016435521180585235, 'batch_size': 2572, 'optimizer': 'Adam'}. Best is trial 167 with value: 0.14723617654182158.
2026-05-19 16:58:30,632 - optuna.study._optimize - INFO - Trial 280 pruned. 
2026-05-19 16:58:37,309 - optuna.study._optimize - INFO - Trial 281 pruned. 
2026-05-19 16:58:45,163 - optuna.study._optimize - INFO - Trial 282 pruned. 
2026-05-19 16:59:04,229 - experiment_functions - INFO - Early stopping at epoch 2300. Best Recall: 0.1442
2026-05-19 16:59:04,364 - optuna.study.study - INFO - Trial 283 finished with value: 0.1442324658713833 and parameters: {'n_layers': 1, 'embedding_dim': 256, 'lr': 0.0005940221186451506, 'lambda_val': 4.554628584011145e-05, 'batch_size': 1273, 'optimizer': 'Adam'}. Best is trial 167 with value: 0.14723617654182158.
2026-05-19 16:59:12,545 - optuna.study._optimize - INFO - Trial 284 pruned. 
2026-05-19 16:59:24,080 - experiment_functions - INFO - Early stopping at epoch 1700. Best Recall: 0.1330
2026-05-19 16:59:24,171 - optuna.study.study - INFO - Trial 285 finished with value: 0.1330438398862696 and parameters: {'n_layers': 1, 'embedding_dim': 256, 'lr': 0.000571249467847568, 'lambda_val': 5.6512203415629444e-05, 'batch_size': 2500, 'optimizer': 'Adam'}. Best is trial 167 with value: 0.14723617654182158.
2026-05-19 16:59:46,395 - experiment_functions - INFO - Early stopping at epoch 3200. Best Recall: 0.1468
2026-05-19 16:59:46,495 - optuna.study.study - INFO - Trial 286 finished with value: 0.14676610834850637 and parameters: {'n_layers': 1, 'embedding_dim': 256, 'lr': 0.0003139212810513367, 'lambda_val': 0.0001263881378842511, 'batch_size': 2679, 'optimizer': 'Adam'}. Best is trial 167 with value: 0.14723617654182158.
2026-05-19 16:59:53,795 - optuna.study._optimize - INFO - Trial 287 pruned. 
2026-05-19 17:00:00,912 - optuna.study._optimize - INFO - Trial 288 pruned. 
2026-05-19 17:00:05,372 - experiment_functions - INFO - Early stopping at epoch 500. Best Recall: 0.0017
2026-05-19 17:00:05,462 - optuna.study.study - INFO - Trial 289 finished with value: 0.0017287550181614888 and parameters: {'n_layers': 1, 'embedding_dim': 256, 'lr': 0.00031896093847018933, 'lambda_val': 2.46638479467418e-05, 'batch_size': 2644, 'optimizer': 'SGD'}. Best is trial 167 with value: 0.14723617654182158.
2026-05-19 17:00:13,820 - optuna.study._optimize - INFO - Trial 290 pruned. 
2026-05-19 17:00:21,653 - optuna.study._optimize - INFO - Trial 291 pruned. 
2026-05-19 17:00:28,235 - optuna.study._optimize - INFO - Trial 292 pruned. 
2026-05-19 17:00:36,912 - optuna.study._optimize - INFO - Trial 293 pruned. 
2026-05-19 17:00:45,083 - experiment_functions - INFO - Early stopping at epoch 1250. Best Recall: 0.1301
2026-05-19 17:00:45,173 - optuna.study.study - INFO - Trial 294 finished with value: 0.13005602501579402 and parameters: {'n_layers': 1, 'embedding_dim': 256, 'lr': 0.00047532547013085847, 'lambda_val': 7.070511149099967e-05, 'batch_size': 2745, 'optimizer': 'Adam'}. Best is trial 167 with value: 0.14723617654182158.
2026-05-19 17:00:53,842 - optuna.study._optimize - INFO - Trial 295 pruned. 
2026-05-19 17:01:01,181 - optuna.study._optimize - INFO - Trial 296 pruned. 
2026-05-19 17:01:06,557 - experiment_functions - INFO - Early stopping at epoch 650. Best Recall: 0.0999
2026-05-19 17:01:06,872 - optuna.study.study - INFO - Trial 297 finished with value: 0.09990755175098887 and parameters: {'n_layers': 1, 'embedding_dim': 256, 'lr': 0.004286335005019021, 'lambda_val': 3.291160881117286e-05, 'batch_size': 1301, 'optimizer': 'Adam'}. Best is trial 167 with value: 0.14723617654182158.
2026-05-19 17:01:12,523 - experiment_functions - INFO - Early stopping at epoch 700. Best Recall: 0.0371
2026-05-19 17:01:12,624 - optuna.study.study - INFO - Trial 298 finished with value: 0.03709038078930544 and parameters: {'n_layers': 4, 'embedding_dim': 64, 'lr': 0.0009128181892722242, 'lambda_val': 0.0003080691983920322, 'batch_size': 1442, 'optimizer': 'Adam'}. Best is trial 167 with value: 0.14723617654182158.
2026-05-19 17:01:21,324 - optuna.study._optimize - INFO - Trial 299 pruned. 
2026-05-19 17:01:21,327 - experiment_functions - INFO - Training the best model ... for e_100K_full
2026-05-19 17:01:36,245 - root - INFO - **** Training e_100K_1c1dcs
2026-05-19 17:01:36,245 - root - INFO -   ** 1-Dominant stats:
2026-05-19 17:01:36,246 - root - INFO -   ** Finding the dominant set:
2026-05-19 17:01:55,747 - root - INFO -   ** Getting the trainable edges:
2026-05-19 17:01:55,751 - helper_functions - INFO -      Number of nodes: 535
2026-05-19 17:01:55,751 - helper_functions - INFO -      Ratio: 0.05177085349332301
2026-05-19 17:01:55,751 - helper_functions - INFO -      Number of unique users: 303
2026-05-19 17:01:55,751 - helper_functions - INFO -      Number of unique items: 232
2026-05-19 17:01:55,751 - helper_functions - INFO -      Total dominant set edge: 8849
2026-05-19 17:01:55,751 - helper_functions - INFO -      Trainable edges: 7079.200000000001
2026-05-19 17:01:55,755 - root - INFO -   **** Getting 8849 dominant set edges
2026-05-19 17:01:57,844 - optuna.storages._rdb.storage - INFO - A new study created in RDB with name: Study_e_100K_1c1dcs_strict
2026-05-19 17:02:01,803 - experiment_functions - INFO - Early stopping at epoch 500. Best Recall: 0.0019
2026-05-19 17:02:01,901 - optuna.study.study - INFO - Trial 0 finished with value: 0.001871695167801279 and parameters: {'n_layers': 1, 'embedding_dim': 256, 'lr': 0.019412513450675715, 'lambda_val': 0.000595501176097746, 'batch_size': 3888, 'optimizer': 'SGD'}. Best is trial 0 with value: 0.001871695167801279.
2026-05-19 17:02:07,503 - experiment_functions - INFO - Early stopping at epoch 850. Best Recall: 0.0015
2026-05-19 17:02:07,647 - optuna.study.study - INFO - Trial 1 finished with value: 0.0015039547379583258 and parameters: {'n_layers': 4, 'embedding_dim': 256, 'lr': 1.4983212577536186e-05, 'lambda_val': 6.725612753115394e-06, 'batch_size': 2304, 'optimizer': 'Adam'}. Best is trial 0 with value: 0.001871695167801279.
2026-05-19 17:02:13,722 - experiment_functions - INFO - Early stopping at epoch 650. Best Recall: 0.0085
2026-05-19 17:02:13,827 - optuna.study.study - INFO - Trial 2 finished with value: 0.008478944651582186 and parameters: {'n_layers': 3, 'embedding_dim': 32, 'lr': 0.0011358207950284192, 'lambda_val': 0.00742257705697081, 'batch_size': 3503, 'optimizer': 'Adam'}. Best is trial 2 with value: 0.008478944651582186.
2026-05-19 17:02:18,871 - experiment_functions - INFO - Early stopping at epoch 500. Best Recall: 0.0010
2026-05-19 17:02:18,971 - optuna.study.study - INFO - Trial 3 finished with value: 0.00100154242971945 and parameters: {'n_layers': 3, 'embedding_dim': 32, 'lr': 0.0011006619473426234, 'lambda_val': 0.0004009435531900917, 'batch_size': 1144, 'optimizer': 'SGD'}. Best is trial 2 with value: 0.008478944651582186.
2026-05-19 17:02:24,451 - experiment_functions - INFO - Early stopping at epoch 500. Best Recall: 0.0023
2026-05-19 17:02:24,551 - optuna.study.study - INFO - Trial 4 finished with value: 0.002264456158725704 and parameters: {'n_layers': 4, 'embedding_dim': 256, 'lr': 0.047339680198561974, 'lambda_val': 0.0015831455815915434, 'batch_size': 3569, 'optimizer': 'SGD'}. Best is trial 2 with value: 0.008478944651582186.
2026-05-19 17:02:33,419 - experiment_functions - INFO - Early stopping at epoch 1400. Best Recall: 0.0019
2026-05-19 17:02:33,498 - optuna.study.study - INFO - Trial 5 finished with value: 0.0019297878747208353 and parameters: {'n_layers': 2, 'embedding_dim': 128, 'lr': 1.3352875921970278e-05, 'lambda_val': 0.0010244419892525192, 'batch_size': 3024, 'optimizer': 'Adam'}. Best is trial 2 with value: 0.008478944651582186.
2026-05-19 17:02:43,205 - experiment_functions - INFO - Early stopping at epoch 1400. Best Recall: 0.0083
2026-05-19 17:02:43,304 - optuna.study.study - INFO - Trial 6 finished with value: 0.008259455998375803 and parameters: {'n_layers': 2, 'embedding_dim': 96, 'lr': 0.00021357452468706982, 'lambda_val': 2.5522776725130818e-05, 'batch_size': 2133, 'optimizer': 'Adam'}. Best is trial 2 with value: 0.008478944651582186.
2026-05-19 17:02:47,191 - experiment_functions - INFO - Early stopping at epoch 550. Best Recall: 0.0071
2026-05-19 17:02:47,271 - optuna.study.study - INFO - Trial 7 finished with value: 0.007078185603845211 and parameters: {'n_layers': 3, 'embedding_dim': 96, 'lr': 0.004046680351953498, 'lambda_val': 1.2260130346601718e-05, 'batch_size': 1075, 'optimizer': 'RMSprop'}. Best is trial 2 with value: 0.008478944651582186.
2026-05-19 17:02:51,225 - experiment_functions - INFO - Early stopping at epoch 600. Best Recall: 0.0051
2026-05-19 17:02:51,372 - optuna.study.study - INFO - Trial 8 finished with value: 0.00509635857880614 and parameters: {'n_layers': 2, 'embedding_dim': 32, 'lr': 0.02101332106074868, 'lambda_val': 0.0009070692989183248, 'batch_size': 3001, 'optimizer': 'Adam'}. Best is trial 2 with value: 0.008478944651582186.
2026-05-19 17:02:59,085 - optuna.study._optimize - INFO - Trial 9 pruned. 
2026-05-19 17:03:03,434 - experiment_functions - INFO - Early stopping at epoch 700. Best Recall: 0.0048
2026-05-19 17:03:03,523 - optuna.study.study - INFO - Trial 10 finished with value: 0.0048251250295731464 and parameters: {'n_layers': 1, 'embedding_dim': 64, 'lr': 0.0002304786995282707, 'lambda_val': 0.04755839464473414, 'batch_size': 3156, 'optimizer': 'RMSprop'}. Best is trial 2 with value: 0.008478944651582186.
2026-05-19 17:03:08,494 - experiment_functions - INFO - Early stopping at epoch 800. Best Recall: 0.0051
2026-05-19 17:03:08,607 - optuna.study.study - INFO - Trial 11 finished with value: 0.005084425318268327 and parameters: {'n_layers': 2, 'embedding_dim': 96, 'lr': 0.0001825432187431751, 'lambda_val': 0.019747436575715715, 'batch_size': 2237, 'optimizer': 'Adam'}. Best is trial 2 with value: 0.008478944651582186.
2026-05-19 17:03:14,903 - experiment_functions - INFO - Early stopping at epoch 850. Best Recall: 0.0079
2026-05-19 17:03:14,994 - optuna.study.study - INFO - Trial 12 finished with value: 0.007924010144673154 and parameters: {'n_layers': 3, 'embedding_dim': 96, 'lr': 0.0001972044560910392, 'lambda_val': 4.7168565325867404e-05, 'batch_size': 2166, 'optimizer': 'Adam'}. Best is trial 2 with value: 0.008478944651582186.
2026-05-19 17:03:20,200 - experiment_functions - INFO - Early stopping at epoch 550. Best Recall: 0.0053
2026-05-19 17:03:20,280 - optuna.study.study - INFO - Trial 13 finished with value: 0.005290862778032272 and parameters: {'n_layers': 2, 'embedding_dim': 128, 'lr': 0.0016013978968299587, 'lambda_val': 0.008727731782347984, 'batch_size': 1695, 'optimizer': 'Adam'}. Best is trial 2 with value: 0.008478944651582186.
2026-05-19 17:03:31,297 - experiment_functions - INFO - Early stopping at epoch 1850. Best Recall: 0.0082
2026-05-19 17:03:31,441 - optuna.study.study - INFO - Trial 14 finished with value: 0.0082055127606967 and parameters: {'n_layers': 4, 'embedding_dim': 64, 'lr': 7.431891854206858e-05, 'lambda_val': 1.1171139933064433e-06, 'batch_size': 2495, 'optimizer': 'Adam'}. Best is trial 2 with value: 0.008478944651582186.
2026-05-19 17:03:35,421 - experiment_functions - INFO - Early stopping at epoch 600. Best Recall: 0.0079
2026-05-19 17:03:35,509 - optuna.study.study - INFO - Trial 15 finished with value: 0.00789968311333507 and parameters: {'n_layers': 1, 'embedding_dim': 32, 'lr': 0.00432757064873238, 'lambda_val': 8.292144638065321e-05, 'batch_size': 4085, 'optimizer': 'RMSprop'}. Best is trial 2 with value: 0.008478944651582186.
2026-05-19 17:03:39,721 - experiment_functions - INFO - Early stopping at epoch 600. Best Recall: 0.0051
2026-05-19 17:03:39,827 - optuna.study.study - INFO - Trial 16 finished with value: 0.005121033369844294 and parameters: {'n_layers': 2, 'embedding_dim': 96, 'lr': 0.0005828890874162158, 'lambda_val': 0.00509675892818016, 'batch_size': 725, 'optimizer': 'Adam'}. Best is trial 2 with value: 0.008478944651582186.
2026-05-19 17:03:44,751 - experiment_functions - INFO - Early stopping at epoch 550. Best Recall: 0.0013
2026-05-19 17:03:44,842 - optuna.study.study - INFO - Trial 17 finished with value: 0.001343973760194243 and parameters: {'n_layers': 3, 'embedding_dim': 96, 'lr': 5.531811205691423e-05, 'lambda_val': 0.08943715091343095, 'batch_size': 2694, 'optimizer': 'Adam'}. Best is trial 2 with value: 0.008478944651582186.
2026-05-19 17:03:50,176 - experiment_functions - INFO - Early stopping at epoch 600. Best Recall: 0.0043
2026-05-19 17:03:50,266 - optuna.study.study - INFO - Trial 18 finished with value: 0.004342310178335735 and parameters: {'n_layers': 2, 'embedding_dim': 32, 'lr': 0.0040749218508764305, 'lambda_val': 0.00012358175140807237, 'batch_size': 1832, 'optimizer': 'RMSprop'}. Best is trial 2 with value: 0.008478944651582186.
2026-05-19 17:03:53,459 - experiment_functions - INFO - Early stopping at epoch 500. Best Recall: 0.0013
2026-05-19 17:03:53,594 - optuna.study.study - INFO - Trial 19 finished with value: 0.001261707807755682 and parameters: {'n_layers': 3, 'embedding_dim': 128, 'lr': 0.0004585506895554217, 'lambda_val': 0.0037205539902590533, 'batch_size': 3417, 'optimizer': 'SGD'}. Best is trial 2 with value: 0.008478944651582186.
2026-05-19 17:03:57,557 - experiment_functions - INFO - Early stopping at epoch 550. Best Recall: 0.0102
2026-05-19 17:03:57,720 - optuna.study.study - INFO - Trial 20 finished with value: 0.010200510151351577 and parameters: {'n_layers': 1, 'embedding_dim': 64, 'lr': 0.0019986043203364594, 'lambda_val': 2.3554718093306394e-05, 'batch_size': 2766, 'optimizer': 'Adam'}. Best is trial 20 with value: 0.010200510151351577.
2026-05-19 17:04:02,487 - experiment_functions - INFO - Early stopping at epoch 600. Best Recall: 0.0107
2026-05-19 17:04:02,598 - optuna.study.study - INFO - Trial 21 finished with value: 0.010738633194800114 and parameters: {'n_layers': 1, 'embedding_dim': 64, 'lr': 0.0013499528842585598, 'lambda_val': 2.3585809539526264e-05, 'batch_size': 2721, 'optimizer': 'Adam'}. Best is trial 21 with value: 0.010738633194800114.
2026-05-19 17:04:06,586 - experiment_functions - INFO - Early stopping at epoch 550. Best Recall: 0.0076
2026-05-19 17:04:06,739 - optuna.study.study - INFO - Trial 22 finished with value: 0.0075874042329423744 and parameters: {'n_layers': 1, 'embedding_dim': 64, 'lr': 0.0020058954087802255, 'lambda_val': 1.440242324986496e-06, 'batch_size': 2790, 'optimizer': 'Adam'}. Best is trial 21 with value: 0.010738633194800114.
2026-05-19 17:04:16,299 - experiment_functions - INFO - Early stopping at epoch 1400. Best Recall: 0.0121
2026-05-19 17:04:16,393 - optuna.study.study - INFO - Trial 23 finished with value: 0.012078567593333174 and parameters: {'n_layers': 1, 'embedding_dim': 64, 'lr': 0.009459886263676689, 'lambda_val': 0.000142298714668052, 'batch_size': 3375, 'optimizer': 'Adam'}. Best is trial 23 with value: 0.012078567593333174.
2026-05-19 17:04:27,723 - experiment_functions - INFO - Early stopping at epoch 1700. Best Recall: 0.0125
2026-05-19 17:04:27,837 - optuna.study.study - INFO - Trial 24 finished with value: 0.012493734178332145 and parameters: {'n_layers': 1, 'embedding_dim': 64, 'lr': 0.010948784594469449, 'lambda_val': 0.0001800842118451562, 'batch_size': 2707, 'optimizer': 'Adam'}. Best is trial 24 with value: 0.012493734178332145.
2026-05-19 17:04:33,936 - experiment_functions - INFO - Early stopping at epoch 950. Best Recall: 0.0109
2026-05-19 17:04:34,041 - optuna.study.study - INFO - Trial 25 finished with value: 0.010884217642196499 and parameters: {'n_layers': 1, 'embedding_dim': 64, 'lr': 0.014046809297299019, 'lambda_val': 0.00015773488440059297, 'batch_size': 3266, 'optimizer': 'Adam'}. Best is trial 24 with value: 0.012493734178332145.
2026-05-19 17:05:00,399 - experiment_functions - INFO - Early stopping at epoch 2100. Best Recall: 0.0126
2026-05-19 17:05:00,553 - optuna.study.study - INFO - Trial 26 finished with value: 0.01258715600483905 and parameters: {'n_layers': 1, 'embedding_dim': 64, 'lr': 0.013045981269107517, 'lambda_val': 0.00024675730870444434, 'batch_size': 3257, 'optimizer': 'Adam'}. Best is trial 26 with value: 0.01258715600483905.
2026-05-19 17:05:08,216 - experiment_functions - INFO - Early stopping at epoch 850. Best Recall: 0.0106
2026-05-19 17:05:08,297 - optuna.study.study - INFO - Trial 27 finished with value: 0.01062424612609111 and parameters: {'n_layers': 1, 'embedding_dim': 64, 'lr': 0.05033993519934393, 'lambda_val': 0.00020137876478956677, 'batch_size': 3814, 'optimizer': 'Adam'}. Best is trial 26 with value: 0.01258715600483905.
2026-05-19 17:05:11,100 - experiment_functions - INFO - Early stopping at epoch 500. Best Recall: 0.0026
2026-05-19 17:05:11,171 - optuna.study.study - INFO - Trial 28 finished with value: 0.002594039877898605 and parameters: {'n_layers': 1, 'embedding_dim': 64, 'lr': 0.008471654271169592, 'lambda_val': 0.0003154508750524085, 'batch_size': 3699, 'optimizer': 'SGD'}. Best is trial 26 with value: 0.01258715600483905.
2026-05-19 17:05:15,166 - experiment_functions - INFO - Early stopping at epoch 550. Best Recall: 0.0063
2026-05-19 17:05:15,238 - optuna.study.study - INFO - Trial 29 finished with value: 0.006299844368141075 and parameters: {'n_layers': 1, 'embedding_dim': 64, 'lr': 0.023381238396620672, 'lambda_val': 0.0025319443478033616, 'batch_size': 4082, 'optimizer': 'RMSprop'}. Best is trial 26 with value: 0.01258715600483905.
2026-05-19 17:05:18,359 - experiment_functions - INFO - Early stopping at epoch 500. Best Recall: 0.0026
2026-05-19 17:05:18,475 - optuna.study.study - INFO - Trial 30 finished with value: 0.0026453722435115993 and parameters: {'n_layers': 1, 'embedding_dim': 64, 'lr': 0.09415383324693677, 'lambda_val': 0.0006307209850208679, 'batch_size': 3299, 'optimizer': 'SGD'}. Best is trial 26 with value: 0.01258715600483905.
2026-05-19 17:05:25,554 - optuna.study._optimize - INFO - Trial 31 pruned. 
2026-05-19 17:05:35,149 - experiment_functions - INFO - Early stopping at epoch 1600. Best Recall: 0.0134
2026-05-19 17:05:35,245 - optuna.study.study - INFO - Trial 32 finished with value: 0.013420062561885403 and parameters: {'n_layers': 1, 'embedding_dim': 64, 'lr': 0.010376265404468505, 'lambda_val': 6.958474843858037e-05, 'batch_size': 3008, 'optimizer': 'Adam'}. Best is trial 32 with value: 0.013420062561885403.
2026-05-19 17:05:41,825 - experiment_functions - INFO - Early stopping at epoch 900. Best Recall: 0.0126
2026-05-19 17:05:41,930 - optuna.study.study - INFO - Trial 33 finished with value: 0.012648778466746943 and parameters: {'n_layers': 1, 'embedding_dim': 256, 'lr': 0.009203558958548217, 'lambda_val': 8.074693568509187e-05, 'batch_size': 2946, 'optimizer': 'Adam'}. Best is trial 32 with value: 0.013420062561885403.
2026-05-19 17:05:48,867 - experiment_functions - INFO - Early stopping at epoch 650. Best Recall: 0.0083
2026-05-19 17:05:49,017 - optuna.study.study - INFO - Trial 34 finished with value: 0.008262744899287485 and parameters: {'n_layers': 1, 'embedding_dim': 256, 'lr': 0.038569491432315056, 'lambda_val': 6.08863108495652e-05, 'batch_size': 3001, 'optimizer': 'Adam'}. Best is trial 32 with value: 0.013420062561885403.
2026-05-19 17:05:55,723 - optuna.study._optimize - INFO - Trial 35 pruned. 
2026-05-19 17:06:19,572 - experiment_functions - INFO - Early stopping at epoch 2850. Best Recall: 0.0141
2026-05-19 17:06:19,669 - optuna.study.study - INFO - Trial 36 finished with value: 0.014061646181365146 and parameters: {'n_layers': 2, 'embedding_dim': 256, 'lr': 0.0067053308297187735, 'lambda_val': 4.2026611022474886e-05, 'batch_size': 2647, 'optimizer': 'Adam'}. Best is trial 36 with value: 0.014061646181365146.
2026-05-19 17:06:24,276 - experiment_functions - INFO - Early stopping at epoch 500. Best Recall: 0.0024
2026-05-19 17:06:24,420 - optuna.study.study - INFO - Trial 37 finished with value: 0.002438131979377115 and parameters: {'n_layers': 2, 'embedding_dim': 256, 'lr': 0.0050515130657369555, 'lambda_val': 3.684627153498158e-06, 'batch_size': 2468, 'optimizer': 'SGD'}. Best is trial 36 with value: 0.014061646181365146.
2026-05-19 17:06:30,982 - experiment_functions - INFO - Early stopping at epoch 750. Best Recall: 0.0121
2026-05-19 17:06:31,087 - optuna.study.study - INFO - Trial 38 finished with value: 0.012115629779991722 and parameters: {'n_layers': 2, 'embedding_dim': 256, 'lr': 0.030525544664883962, 'lambda_val': 3.429246083464503e-05, 'batch_size': 3638, 'optimizer': 'Adam'}. Best is trial 36 with value: 0.014061646181365146.
2026-05-19 17:06:43,059 - experiment_functions - INFO - Early stopping at epoch 1700. Best Recall: 0.0132
