2026-05-24 14:02:26,559 - optuna.study.study - INFO - Trial 88 finished with values: [0.0056339016136810515, 0.00435430463576159, 0.005541945407591772] and parameters: {'n_layers': 4, 'embedding_dim': 128, 'lr': 0.028193399906709604, 'lambda_val': 0.030360838038411074, 'batch_size': 2712, 'optimizer': 'SGD'}.
2026-05-24 14:02:45,522 - experiment_functions - INFO - Early stopping at epoch 1650. Best Metrics: (0.00560413030356412, 0.004304635761589404, 0.005451609179863861)
2026-05-24 14:02:45,624 - optuna.study.study - INFO - Trial 89 finished with values: [0.00560413030356412, 0.004304635761589404, 0.005451609179863861] and parameters: {'n_layers': 1, 'embedding_dim': 256, 'lr': 1.0095952585370536e-05, 'lambda_val': 0.0001625918875278769, 'batch_size': 1034, 'optimizer': 'Adam'}.
2026-05-24 14:02:53,116 - experiment_functions - INFO - Early stopping at epoch 600. Best Metrics: (0.039839350463251016, 0.02509933774834437, 0.03586874279672317)
2026-05-24 14:02:53,255 - optuna.study.study - INFO - Trial 90 finished with values: [0.039839350463251016, 0.02509933774834437, 0.03586874279672317] and parameters: {'n_layers': 2, 'embedding_dim': 32, 'lr': 0.0018843975064796988, 'lambda_val': 9.463812196591343e-06, 'batch_size': 3012, 'optimizer': 'Adam'}.
2026-05-24 14:03:36,063 - optuna.study.study - INFO - Trial 91 finished with values: [0.027789204194530962, 0.020140728476821194, 0.02640895304022727] and parameters: {'n_layers': 2, 'embedding_dim': 32, 'lr': 0.00012749160505002986, 'lambda_val': 0.0034713999695200454, 'batch_size': 3462, 'optimizer': 'RMSprop'}.
2026-05-24 14:03:44,583 - experiment_functions - INFO - Early stopping at epoch 650. Best Metrics: (0.013602954149146045, 0.009014900662251656, 0.012086928664635056)
2026-05-24 14:03:44,675 - optuna.study.study - INFO - Trial 92 finished with values: [0.013602954149146045, 0.009014900662251656, 0.012086928664635056] and parameters: {'n_layers': 3, 'embedding_dim': 32, 'lr': 0.05108952498278099, 'lambda_val': 5.022416292255642e-06, 'batch_size': 968, 'optimizer': 'Adam'}.
2026-05-24 14:03:50,874 - experiment_functions - INFO - Early stopping at epoch 500. Best Metrics: (0.00515860865769185, 0.004346026490066226, 0.005321838157040648)
2026-05-24 14:03:51,366 - optuna.study.study - INFO - Trial 93 finished with values: [0.00515860865769185, 0.004346026490066226, 0.005321838157040648] and parameters: {'n_layers': 1, 'embedding_dim': 96, 'lr': 0.00041248833725208626, 'lambda_val': 1.952351523331491e-05, 'batch_size': 3362, 'optimizer': 'SGD'}.
2026-05-24 14:03:58,820 - experiment_functions - INFO - Early stopping at epoch 500. Best Metrics: (0.005425116045524192, 0.004172185430463576, 0.005338050065797673)
2026-05-24 14:03:58,909 - optuna.study.study - INFO - Trial 94 finished with values: [0.005425116045524192, 0.004172185430463576, 0.005338050065797673] and parameters: {'n_layers': 4, 'embedding_dim': 128, 'lr': 4.8313324505395824e-05, 'lambda_val': 0.06849123069734135, 'batch_size': 2712, 'optimizer': 'Adam'}.
2026-05-24 14:04:05,089 - experiment_functions - INFO - Early stopping at epoch 500. Best Metrics: (0.005860743925241734, 0.004586092715231788, 0.005953800766121662)
2026-05-24 14:04:05,179 - optuna.study.study - INFO - Trial 95 finished with values: [0.005860743925241734, 0.004586092715231788, 0.005953800766121662] and parameters: {'n_layers': 3, 'embedding_dim': 64, 'lr': 0.07323519135760621, 'lambda_val': 7.592495659563551e-06, 'batch_size': 1315, 'optimizer': 'SGD'}.
2026-05-24 14:04:20,061 - experiment_functions - INFO - Early stopping at epoch 1150. Best Metrics: (0.01593876224626284, 0.011051324503311259, 0.015138878709794997)
2026-05-24 14:04:20,447 - optuna.study.study - INFO - Trial 96 finished with values: [0.01593876224626284, 0.011051324503311259, 0.015138878709794997] and parameters: {'n_layers': 3, 'embedding_dim': 128, 'lr': 0.03454164029314136, 'lambda_val': 0.000339235643209516, 'batch_size': 989, 'optimizer': 'Adam'}.
2026-05-24 14:04:29,055 - experiment_functions - INFO - Early stopping at epoch 500. Best Metrics: (0.005317991810154747, 0.004246688741721854, 0.005491506120212924)
2026-05-24 14:04:29,145 - optuna.study.study - INFO - Trial 97 finished with values: [0.005317991810154747, 0.004246688741721854, 0.005491506120212924] and parameters: {'n_layers': 4, 'embedding_dim': 256, 'lr': 0.058586717719790266, 'lambda_val': 7.985064351552862e-06, 'batch_size': 1644, 'optimizer': 'SGD'}.
2026-05-24 14:04:37,699 - experiment_functions - INFO - Early stopping at epoch 500. Best Metrics: (0.004596057589964993, 0.0040149006622516555, 0.004847088524878939)
2026-05-24 14:04:37,792 - optuna.study.study - INFO - Trial 98 finished with values: [0.004596057589964993, 0.0040149006622516555, 0.004847088524878939] and parameters: {'n_layers': 4, 'embedding_dim': 256, 'lr': 0.015073051319504148, 'lambda_val': 0.00039186744745002176, 'batch_size': 3269, 'optimizer': 'SGD'}.
2026-05-24 14:04:48,761 - experiment_functions - INFO - Early stopping at epoch 500. Best Metrics: (0.015539141302559373, 0.01240066225165563, 0.015709111873796904)
2026-05-24 14:04:48,855 - optuna.study.study - INFO - Trial 99 finished with values: [0.015539141302559373, 0.01240066225165563, 0.015709111873796904] and parameters: {'n_layers': 4, 'embedding_dim': 64, 'lr': 0.07323519135760621, 'lambda_val': 0.0005346251103432946, 'batch_size': 739, 'optimizer': 'RMSprop'}.
2026-05-24 14:04:57,654 - experiment_functions - INFO - Early stopping at epoch 500. Best Metrics: (0.005178316583601363, 0.004428807947019868, 0.005442301732113939)
2026-05-24 14:04:58,760 - optuna.study.study - INFO - Trial 100 finished with values: [0.005178316583601363, 0.004428807947019868, 0.005442301732113939] and parameters: {'n_layers': 4, 'embedding_dim': 256, 'lr': 0.00028626012255777994, 'lambda_val': 3.5459452003500364e-05, 'batch_size': 886, 'optimizer': 'SGD'}.
2026-05-24 14:05:10,345 - experiment_functions - INFO - Early stopping at epoch 850. Best Metrics: (0.03841239752465792, 0.024130794701986754, 0.03343537383491849)
2026-05-24 14:05:10,529 - optuna.study.study - INFO - Trial 101 finished with values: [0.03841239752465792, 0.024130794701986754, 0.03343537383491849] and parameters: {'n_layers': 4, 'embedding_dim': 96, 'lr': 0.0003859482391059796, 'lambda_val': 0.0030355138678104586, 'batch_size': 1042, 'optimizer': 'Adam'}.
2026-05-24 14:05:20,172 - experiment_functions - INFO - Early stopping at epoch 650. Best Metrics: (0.04777264407191921, 0.02964403973509934, 0.04217924273206313)
2026-05-24 14:05:20,405 - optuna.study.study - INFO - Trial 102 finished with values: [0.04777264407191921, 0.02964403973509934, 0.04217924273206313] and parameters: {'n_layers': 2, 'embedding_dim': 256, 'lr': 0.0007653011157039608, 'lambda_val': 7.011674546086162e-05, 'batch_size': 1055, 'optimizer': 'RMSprop'}.
2026-05-24 14:05:31,608 - experiment_functions - INFO - Early stopping at epoch 700. Best Metrics: (0.04432071153996249, 0.028360927152317878, 0.040162145266813574)
2026-05-24 14:05:32,054 - optuna.study.study - INFO - Trial 103 finished with values: [0.04432071153996249, 0.028360927152317878, 0.040162145266813574] and parameters: {'n_layers': 3, 'embedding_dim': 256, 'lr': 0.0007653011157039608, 'lambda_val': 7.011674546086162e-05, 'batch_size': 606, 'optimizer': 'Adam'}.
2026-05-24 14:05:41,316 - experiment_functions - INFO - Early stopping at epoch 700. Best Metrics: (0.0360023545171663, 0.025488410596026488, 0.033895705157393805)
2026-05-24 14:05:41,410 - optuna.study.study - INFO - Trial 104 finished with values: [0.0360023545171663, 0.025488410596026488, 0.033895705157393805] and parameters: {'n_layers': 4, 'embedding_dim': 64, 'lr': 0.0006563002976325864, 'lambda_val': 1.6606118736479167e-06, 'batch_size': 968, 'optimizer': 'RMSprop'}.
2026-05-24 14:05:48,899 - experiment_functions - INFO - Early stopping at epoch 600. Best Metrics: (0.03137895498683833, 0.022425496688741723, 0.029902866733905673)
2026-05-24 14:05:48,990 - optuna.study.study - INFO - Trial 105 finished with values: [0.03137895498683833, 0.022425496688741723, 0.029902866733905673] and parameters: {'n_layers': 3, 'embedding_dim': 32, 'lr': 0.0018843975064796988, 'lambda_val': 9.463812196591343e-06, 'batch_size': 3012, 'optimizer': 'Adam'}.
2026-05-24 14:06:44,745 - optuna.study.study - INFO - Trial 106 finished with values: [0.005507303709817782, 0.004917218543046358, 0.005975005596985297] and parameters: {'n_layers': 3, 'embedding_dim': 256, 'lr': 1.75175031305784e-05, 'lambda_val': 1.0152215023816412e-05, 'batch_size': 3618, 'optimizer': 'Adam'}.
2026-05-24 14:07:27,995 - optuna.study.study - INFO - Trial 107 finished with values: [0.04533505718481102, 0.029619205298013245, 0.042776361321637785] and parameters: {'n_layers': 1, 'embedding_dim': 96, 'lr': 0.00028626012255777994, 'lambda_val': 2.6431113659875313e-06, 'batch_size': 1236, 'optimizer': 'Adam'}.
2026-05-24 14:07:47,576 - experiment_functions - INFO - Early stopping at epoch 1200. Best Metrics: (0.024040464535026517, 0.013493377483443708, 0.020405305851399966)
2026-05-24 14:07:48,511 - optuna.study.study - INFO - Trial 108 finished with values: [0.024040464535026517, 0.013493377483443708, 0.020405305851399966] and parameters: {'n_layers': 4, 'embedding_dim': 256, 'lr': 0.015191238212059506, 'lambda_val': 0.0001625918875278769, 'batch_size': 3012, 'optimizer': 'Adam'}.
2026-05-24 14:07:58,797 - experiment_functions - INFO - Early stopping at epoch 700. Best Metrics: (0.028248537706567284, 0.017839403973509933, 0.025341763241750633)
2026-05-24 14:07:58,934 - optuna.study.study - INFO - Trial 109 finished with values: [0.028248537706567284, 0.017839403973509933, 0.025341763241750633] and parameters: {'n_layers': 2, 'embedding_dim': 256, 'lr': 0.00914986330156684, 'lambda_val': 5.836368620363864e-06, 'batch_size': 2328, 'optimizer': 'RMSprop'}.
2026-05-24 14:08:05,987 - experiment_functions - INFO - Early stopping at epoch 550. Best Metrics: (0.019448156245171908, 0.016018211920529803, 0.020301523189793808)
2026-05-24 14:08:06,071 - optuna.study.study - INFO - Trial 110 finished with values: [0.019448156245171908, 0.016018211920529803, 0.020301523189793808] and parameters: {'n_layers': 2, 'embedding_dim': 64, 'lr': 0.00914986330156684, 'lambda_val': 0.0034713999695200454, 'batch_size': 2548, 'optimizer': 'Adam'}.
2026-05-24 14:08:23,295 - experiment_functions - INFO - Early stopping at epoch 1350. Best Metrics: (0.033662782798141125, 0.0228476821192053, 0.030441991641907872)
2026-05-24 14:08:23,368 - optuna.study.study - INFO - Trial 111 finished with values: [0.033662782798141125, 0.0228476821192053, 0.030441991641907872] and parameters: {'n_layers': 4, 'embedding_dim': 64, 'lr': 0.0002249192915429732, 'lambda_val': 0.0034713999695200454, 'batch_size': 2532, 'optimizer': 'RMSprop'}.
2026-05-24 14:08:31,491 - experiment_functions - INFO - Early stopping at epoch 600. Best Metrics: (0.023432041639211244, 0.016597682119205297, 0.02271183507117091)
2026-05-24 14:08:31,592 - optuna.study.study - INFO - Trial 112 finished with values: [0.023432041639211244, 0.016597682119205297, 0.02271183507117091] and parameters: {'n_layers': 1, 'embedding_dim': 256, 'lr': 0.02064447429932105, 'lambda_val': 0.00016963078828623106, 'batch_size': 3618, 'optimizer': 'Adam'}.
2026-05-24 14:08:40,929 - experiment_functions - INFO - Early stopping at epoch 750. Best Metrics: (0.027777917359276923, 0.02070364238410596, 0.027513265402038464)
2026-05-24 14:08:41,013 - optuna.study.study - INFO - Trial 113 finished with values: [0.027777917359276923, 0.02070364238410596, 0.027513265402038464] and parameters: {'n_layers': 4, 'embedding_dim': 32, 'lr': 0.0006563002976325864, 'lambda_val': 0.035777695291467286, 'batch_size': 3328, 'optimizer': 'Adam'}.
2026-05-24 14:08:51,054 - experiment_functions - INFO - Early stopping at epoch 750. Best Metrics: (0.023588727848680456, 0.01846026490066225, 0.02375592582682747)
2026-05-24 14:08:51,433 - optuna.study.study - INFO - Trial 114 finished with values: [0.023588727848680456, 0.01846026490066225, 0.02375592582682747] and parameters: {'n_layers': 3, 'embedding_dim': 128, 'lr': 0.0006563002976325864, 'lambda_val': 0.03939417378241408, 'batch_size': 2103, 'optimizer': 'Adam'}.
2026-05-24 14:09:10,395 - experiment_functions - INFO - Early stopping at epoch 1650. Best Metrics: (0.041160478560355145, 0.026316225165562913, 0.039105535557540684)
2026-05-24 14:09:10,497 - optuna.study.study - INFO - Trial 115 finished with values: [0.041160478560355145, 0.026316225165562913, 0.039105535557540684] and parameters: {'n_layers': 3, 'embedding_dim': 32, 'lr': 0.00030176895436135383, 'lambda_val': 4.222993254207487e-06, 'batch_size': 2062, 'optimizer': 'Adam'}.
2026-05-24 14:09:24,919 - experiment_functions - INFO - Early stopping at epoch 1200. Best Metrics: (0.029336729732292285, 0.017889072847682118, 0.025758780473941745)
2026-05-24 14:09:25,163 - optuna.study.study - INFO - Trial 116 finished with values: [0.029336729732292285, 0.017889072847682118, 0.025758780473941745] and parameters: {'n_layers': 2, 'embedding_dim': 96, 'lr': 0.00914986330156684, 'lambda_val': 7.011674546086162e-05, 'batch_size': 1438, 'optimizer': 'RMSprop'}.
2026-05-24 14:09:59,836 - experiment_functions - INFO - Early stopping at epoch 3250. Best Metrics: (0.019667066754515343, 0.014279801324503311, 0.018898224040112325)
2026-05-24 14:09:59,913 - optuna.study.study - INFO - Trial 117 finished with values: [0.019667066754515343, 0.014279801324503311, 0.018898224040112325] and parameters: {'n_layers': 3, 'embedding_dim': 32, 'lr': 0.02064447429932105, 'lambda_val': 0.0034713999695200454, 'batch_size': 1494, 'optimizer': 'Adam'}.
2026-05-24 14:10:09,477 - experiment_functions - INFO - Early stopping at epoch 550. Best Metrics: (0.015848826388461336, 0.013725165562913907, 0.0173783259387685)
2026-05-24 14:10:09,925 - optuna.study.study - INFO - Trial 118 finished with values: [0.015848826388461336, 0.013725165562913907, 0.0173783259387685] and parameters: {'n_layers': 4, 'embedding_dim': 256, 'lr': 0.0011385009641030693, 'lambda_val': 7.187538783101437e-06, 'batch_size': 2145, 'optimizer': 'RMSprop'}.
2026-05-24 14:10:29,391 - experiment_functions - INFO - Early stopping at epoch 1200. Best Metrics: (0.027569206058744414, 0.015571192052980133, 0.023353045423551735)
2026-05-24 14:10:29,717 - optuna.study.study - INFO - Trial 119 finished with values: [0.027569206058744414, 0.015571192052980133, 0.023353045423551735] and parameters: {'n_layers': 4, 'embedding_dim': 256, 'lr': 0.010754146237506338, 'lambda_val': 0.0001888504583139906, 'batch_size': 2145, 'optimizer': 'RMSprop'}.
2026-05-24 14:10:38,249 - experiment_functions - INFO - Early stopping at epoch 600. Best Metrics: (0.03421743258489878, 0.022673841059602646, 0.03149623592063405)
2026-05-24 14:10:38,645 - optuna.study.study - INFO - Trial 120 finished with values: [0.03421743258489878, 0.022673841059602646, 0.03149623592063405] and parameters: {'n_layers': 4, 'embedding_dim': 96, 'lr': 0.0011385009641030693, 'lambda_val': 1.4446750706679519e-05, 'batch_size': 1236, 'optimizer': 'Adam'}.
2026-05-24 14:11:25,220 - optuna.study.study - INFO - Trial 121 finished with values: [0.027572630156240917, 0.019155629139072847, 0.02652941892429736] and parameters: {'n_layers': 4, 'embedding_dim': 64, 'lr': 9.10135019742224e-05, 'lambda_val': 2.0264232518073275e-05, 'batch_size': 1970, 'optimizer': 'RMSprop'}.
2026-05-24 14:11:38,275 - experiment_functions - INFO - Early stopping at epoch 1150. Best Metrics: (0.01832465710852458, 0.012185430463576157, 0.017014329317374934)
2026-05-24 14:11:38,364 - optuna.study.study - INFO - Trial 122 finished with values: [0.01832465710852458, 0.012185430463576157, 0.017014329317374934] and parameters: {'n_layers': 3, 'embedding_dim': 32, 'lr': 0.021341727099400024, 'lambda_val': 1.4247463760726523e-06, 'batch_size': 1042, 'optimizer': 'Adam'}.
2026-05-24 14:12:21,556 - optuna.study.study - INFO - Trial 123 finished with values: [0.032786898192282726, 0.02254139072847682, 0.03265132326794498] and parameters: {'n_layers': 3, 'embedding_dim': 32, 'lr': 0.00013047432521376867, 'lambda_val': 0.003474260724268179, 'batch_size': 1236, 'optimizer': 'Adam'}.
2026-05-24 14:13:06,534 - optuna.study.study - INFO - Trial 124 finished with values: [0.02847059662441791, 0.01913907284768212, 0.025485727376242613] and parameters: {'n_layers': 4, 'embedding_dim': 32, 'lr': 0.00012749160505002986, 'lambda_val': 8.836170253141606e-05, 'batch_size': 3049, 'optimizer': 'RMSprop'}.
2026-05-24 14:13:40,296 - experiment_functions - INFO - Early stopping at epoch 3200. Best Metrics: (0.023582266011713822, 0.017822847682119208, 0.02353010958604514)
2026-05-24 14:13:40,397 - optuna.study.study - INFO - Trial 125 finished with values: [0.023582266011713822, 0.017822847682119208, 0.02353010958604514] and parameters: {'n_layers': 1, 'embedding_dim': 32, 'lr': 0.05601914360731388, 'lambda_val': 0.0034713999695200454, 'batch_size': 3462, 'optimizer': 'RMSprop'}.
2026-05-24 14:13:48,205 - experiment_functions - INFO - Early stopping at epoch 550. Best Metrics: (0.032807007641221235, 0.023236754966887416, 0.03037134616245503)
2026-05-24 14:13:48,299 - optuna.study.study - INFO - Trial 126 finished with values: [0.032807007641221235, 0.023236754966887416, 0.03037134616245503] and parameters: {'n_layers': 3, 'embedding_dim': 128, 'lr': 0.0043505537918927415, 'lambda_val': 0.0005450686189662139, 'batch_size': 1393, 'optimizer': 'Adam'}.
2026-05-24 14:14:30,152 - optuna.study.study - INFO - Trial 127 finished with values: [0.025836971546874303, 0.018451986754966888, 0.025186469386913626] and parameters: {'n_layers': 2, 'embedding_dim': 32, 'lr': 0.00012749160505002986, 'lambda_val': 0.0001888504583139906, 'batch_size': 2145, 'optimizer': 'Adam'}.
2026-05-24 14:14:40,559 - experiment_functions - INFO - Early stopping at epoch 650. Best Metrics: (0.022961031995519302, 0.013890728476821193, 0.020229484432407147)
2026-05-24 14:14:40,856 - optuna.study.study - INFO - Trial 128 finished with values: [0.022961031995519302, 0.013890728476821193, 0.020229484432407147] and parameters: {'n_layers': 3, 'embedding_dim': 256, 'lr': 0.02064447429932105, 'lambda_val': 3.21933316848595e-05, 'batch_size': 3328, 'optimizer': 'Adam'}.
2026-05-24 14:14:54,393 - experiment_functions - INFO - Early stopping at epoch 950. Best Metrics: (0.04002801387591079, 0.026250000000000002, 0.0377134166343044)
2026-05-24 14:14:54,479 - optuna.study.study - INFO - Trial 129 finished with values: [0.04002801387591079, 0.026250000000000002, 0.0377134166343044] and parameters: {'n_layers': 4, 'embedding_dim': 128, 'lr': 0.0003540171758009511, 'lambda_val': 7.187538783101437e-06, 'batch_size': 1238, 'optimizer': 'Adam'}.
2026-05-24 14:15:21,355 - experiment_functions - INFO - Early stopping at epoch 2000. Best Metrics: (0.02424279711681302, 0.017425496688741722, 0.024188287411724112)
2026-05-24 14:15:22,073 - optuna.study.study - INFO - Trial 130 finished with values: [0.02424279711681302, 0.017425496688741722, 0.024188287411724112] and parameters: {'n_layers': 2, 'embedding_dim': 256, 'lr': 0.00914986330156684, 'lambda_val': 0.007331602665207304, 'batch_size': 2328, 'optimizer': 'RMSprop'}.
2026-05-24 14:16:08,313 - optuna.study.study - INFO - Trial 131 finished with values: [0.0485835763306329, 0.02955298013245033, 0.04432797803019086] and parameters: {'n_layers': 4, 'embedding_dim': 32, 'lr': 0.0002249192915429732, 'lambda_val': 0.008933254496519926, 'batch_size': 917, 'optimizer': 'RMSprop'}.
2026-05-24 14:16:18,783 - experiment_functions - INFO - Early stopping at epoch 800. Best Metrics: (0.020362546588161605, 0.015389072847682119, 0.02047749726923967)
2026-05-24 14:16:19,452 - optuna.study.study - INFO - Trial 132 finished with values: [0.020362546588161605, 0.015389072847682119, 0.02047749726923967] and parameters: {'n_layers': 1, 'embedding_dim': 96, 'lr': 0.01245800478955897, 'lambda_val': 0.0009801820764399163, 'batch_size': 2673, 'optimizer': 'RMSprop'}.
2026-05-24 14:16:28,960 - experiment_functions - INFO - Early stopping at epoch 700. Best Metrics: (0.05807419060348523, 0.03423013245033112, 0.050725529941902325)
2026-05-24 14:16:29,385 - optuna.study.study - INFO - Trial 133 finished with values: [0.05807419060348523, 0.03423013245033112, 0.050725529941902325] and parameters: {'n_layers': 1, 'embedding_dim': 256, 'lr': 0.0018843975064796988, 'lambda_val': 1.4446750706679519e-05, 'batch_size': 1236, 'optimizer': 'Adam'}.
2026-05-24 14:16:37,751 - experiment_functions - INFO - Early stopping at epoch 650. Best Metrics: (0.034018139742556956, 0.02308774834437086, 0.03104971610444672)
2026-05-24 14:16:37,840 - optuna.study.study - INFO - Trial 134 finished with values: [0.034018139742556956, 0.02308774834437086, 0.03104971610444672] and parameters: {'n_layers': 3, 'embedding_dim': 32, 'lr': 0.0007653011157039608, 'lambda_val': 0.0030678147239284856, 'batch_size': 1970, 'optimizer': 'RMSprop'}.
2026-05-24 14:16:55,466 - experiment_functions - INFO - Early stopping at epoch 1500. Best Metrics: (0.042174087089932324, 0.02704470198675497, 0.039752787986732416)
2026-05-24 14:16:55,559 - optuna.study.study - INFO - Trial 135 finished with values: [0.042174087089932324, 0.02704470198675497, 0.039752787986732416] and parameters: {'n_layers': 3, 'embedding_dim': 32, 'lr': 0.00030176895436135383, 'lambda_val': 0.000339235643209516, 'batch_size': 2318, 'optimizer': 'Adam'}.
2026-05-24 14:17:06,735 - experiment_functions - INFO - Early stopping at epoch 850. Best Metrics: (0.05260853274064624, 0.03298841059602649, 0.047995687370995)
