2026-05-24 16:08:22,448 - optuna.study.study - INFO - Trial 119 finished with values: [0.039424489566493054, 0.011854304635761589, 0.028213678500595047] and parameters: {'n_layers': 1, 'embedding_dim': 96, 'lr': 0.0012971109624756183, 'lambda_val': 3.357239469878402e-06, 'batch_size': 1638, 'optimizer': 'RMSprop'}.
2026-05-24 16:08:28,929 - experiment_functions - INFO - Early stopping at epoch 550. Best Metrics: (0.03614098387344662, 0.010637417218543046, 0.024696925265286097)
2026-05-24 16:08:29,017 - optuna.study.study - INFO - Trial 120 finished with values: [0.03614098387344662, 0.010637417218543046, 0.024696925265286097] and parameters: {'n_layers': 1, 'embedding_dim': 96, 'lr': 0.00532575854276696, 'lambda_val': 1.1594147319583239e-05, 'batch_size': 2725, 'optimizer': 'Adam'}.
2026-05-24 16:08:35,777 - experiment_functions - INFO - Early stopping at epoch 500. Best Metrics: (0.005143921551073054, 0.0037913907284768214, 0.005012517283759402)
2026-05-24 16:08:36,074 - optuna.study.study - INFO - Trial 121 finished with values: [0.005143921551073054, 0.0037913907284768214, 0.005012517283759402] and parameters: {'n_layers': 3, 'embedding_dim': 128, 'lr': 0.00532575854276696, 'lambda_val': 0.0003645005972590689, 'batch_size': 2725, 'optimizer': 'Adam'}.
2026-05-24 16:08:42,439 - experiment_functions - INFO - Early stopping at epoch 550. Best Metrics: (0.04272082749533284, 0.012466887417218542, 0.030663129701717157)
2026-05-24 16:08:42,667 - optuna.study.study - INFO - Trial 122 finished with values: [0.04272082749533284, 0.012466887417218542, 0.030663129701717157] and parameters: {'n_layers': 1, 'embedding_dim': 96, 'lr': 0.005676961555550774, 'lambda_val': 0.00017267652605927172, 'batch_size': 1178, 'optimizer': 'Adam'}.
2026-05-24 16:08:49,488 - experiment_functions - INFO - Early stopping at epoch 600. Best Metrics: (0.04089117251121746, 0.011986754966887418, 0.030700853044567745)
2026-05-24 16:08:49,756 - optuna.study.study - INFO - Trial 123 finished with values: [0.04089117251121746, 0.011986754966887418, 0.030700853044567745] and parameters: {'n_layers': 1, 'embedding_dim': 128, 'lr': 0.0013253216979926218, 'lambda_val': 0.0038402692954625658, 'batch_size': 1062, 'optimizer': 'Adam'}.
2026-05-24 16:09:01,137 - experiment_functions - INFO - Early stopping at epoch 1050. Best Metrics: (0.04450106210088652, 0.01320364238410596, 0.033344555262637)
2026-05-24 16:09:02,220 - optuna.study.study - INFO - Trial 124 finished with values: [0.04450106210088652, 0.01320364238410596, 0.033344555262637] and parameters: {'n_layers': 1, 'embedding_dim': 96, 'lr': 0.00034279930379767936, 'lambda_val': 4.9612924956814075e-05, 'batch_size': 1178, 'optimizer': 'RMSprop'}.
2026-05-24 16:09:09,644 - experiment_functions - INFO - Early stopping at epoch 600. Best Metrics: (0.04120347256565353, 0.011862582781456955, 0.032691999160303055)
2026-05-24 16:09:09,729 - optuna.study.study - INFO - Trial 125 finished with values: [0.04120347256565353, 0.011862582781456955, 0.032691999160303055] and parameters: {'n_layers': 1, 'embedding_dim': 256, 'lr': 0.0012971109624756183, 'lambda_val': 5.897592552004812e-06, 'batch_size': 2300, 'optimizer': 'Adam'}.
2026-05-24 16:09:16,130 - experiment_functions - INFO - Early stopping at epoch 550. Best Metrics: (0.03733607406477873, 0.010745033112582783, 0.025162978480161538)
2026-05-24 16:09:16,222 - optuna.study.study - INFO - Trial 126 finished with values: [0.03733607406477873, 0.010745033112582783, 0.025162978480161538] and parameters: {'n_layers': 1, 'embedding_dim': 96, 'lr': 0.00532575854276696, 'lambda_val': 1.1594147319583239e-05, 'batch_size': 2725, 'optimizer': 'Adam'}.
2026-05-24 16:09:22,277 - experiment_functions - INFO - Early stopping at epoch 550. Best Metrics: (0.013842372836637829, 0.004586092715231788, 0.007678222925314832)
2026-05-24 16:09:22,875 - optuna.study.study - INFO - Trial 127 finished with values: [0.013842372836637829, 0.004586092715231788, 0.007678222925314832] and parameters: {'n_layers': 1, 'embedding_dim': 128, 'lr': 0.0038122363815175056, 'lambda_val': 5.6824370373456375e-05, 'batch_size': 1062, 'optimizer': 'RMSprop'}.
2026-05-24 16:09:28,802 - experiment_functions - INFO - Early stopping at epoch 500. Best Metrics: (0.0043245824109879065, 0.0036258278145695363, 0.004436494788881493)
2026-05-24 16:09:29,655 - optuna.study.study - INFO - Trial 128 finished with values: [0.0043245824109879065, 0.0036258278145695363, 0.004436494788881493] and parameters: {'n_layers': 1, 'embedding_dim': 96, 'lr': 0.004870708358788357, 'lambda_val': 0.002963141911784072, 'batch_size': 996, 'optimizer': 'RMSprop'}.
2026-05-24 16:09:36,262 - experiment_functions - INFO - Early stopping at epoch 550. Best Metrics: (0.040141571455323204, 0.011382450331125827, 0.029554343947330166)
2026-05-24 16:09:36,367 - optuna.study.study - INFO - Trial 129 finished with values: [0.040141571455323204, 0.011382450331125827, 0.029554343947330166] and parameters: {'n_layers': 1, 'embedding_dim': 128, 'lr': 0.00532575854276696, 'lambda_val': 1.1594147319583239e-05, 'batch_size': 2725, 'optimizer': 'Adam'}.
2026-05-24 16:09:43,591 - experiment_functions - INFO - Early stopping at epoch 600. Best Metrics: (0.0365204134179509, 0.010993377483443709, 0.028414045333588808)
2026-05-24 16:09:43,834 - optuna.study.study - INFO - Trial 130 finished with values: [0.0365204134179509, 0.010993377483443709, 0.028414045333588808] and parameters: {'n_layers': 1, 'embedding_dim': 64, 'lr': 0.0006602503237283403, 'lambda_val': 7.010718534955492e-06, 'batch_size': 4077, 'optimizer': 'RMSprop'}.
2026-05-24 16:09:50,972 - experiment_functions - INFO - Early stopping at epoch 650. Best Metrics: (0.01763242016461984, 0.006564569536423841, 0.011250108354980005)
2026-05-24 16:09:52,250 - optuna.study.study - INFO - Trial 131 finished with values: [0.01763242016461984, 0.006564569536423841, 0.011250108354980005] and parameters: {'n_layers': 1, 'embedding_dim': 32, 'lr': 0.0010413911280538683, 'lambda_val': 0.026775716451982408, 'batch_size': 1097, 'optimizer': 'Adam'}.
2026-05-24 16:09:58,088 - experiment_functions - INFO - Early stopping at epoch 500. Best Metrics: (0.004612288091529528, 0.003857615894039735, 0.0050106628309408135)
2026-05-24 16:09:59,048 - optuna.study.study - INFO - Trial 132 finished with values: [0.004612288091529528, 0.003857615894039735, 0.0050106628309408135] and parameters: {'n_layers': 2, 'embedding_dim': 32, 'lr': 7.874444646364451e-05, 'lambda_val': 0.0006400664544035922, 'batch_size': 3703, 'optimizer': 'RMSprop'}.
2026-05-24 16:10:11,302 - experiment_functions - INFO - Early stopping at epoch 700. Best Metrics: (0.005431677526952757, 0.004213576158940397, 0.005300878656550067)
2026-05-24 16:10:11,759 - optuna.study.study - INFO - Trial 133 finished with values: [0.005431677526952757, 0.004213576158940397, 0.005300878656550067] and parameters: {'n_layers': 2, 'embedding_dim': 96, 'lr': 0.02431450470115027, 'lambda_val': 1.1594147319583239e-05, 'batch_size': 3431, 'optimizer': 'SGD'}.
2026-05-24 16:10:17,972 - experiment_functions - INFO - Early stopping at epoch 500. Best Metrics: (0.013268528833133574, 0.005422185430463576, 0.010686057266569971)
2026-05-24 16:10:19,119 - optuna.study.study - INFO - Trial 134 finished with values: [0.013268528833133574, 0.005422185430463576, 0.010686057266569971] and parameters: {'n_layers': 3, 'embedding_dim': 64, 'lr': 0.012446049552260335, 'lambda_val': 1.2584008258141712e-05, 'batch_size': 3282, 'optimizer': 'RMSprop'}.
2026-05-24 16:10:25,330 - experiment_functions - INFO - Early stopping at epoch 500. Best Metrics: (0.006383317997839633, 0.003932119205298013, 0.005869270229678854)
2026-05-24 16:10:25,767 - optuna.study.study - INFO - Trial 135 finished with values: [0.006383317997839633, 0.003932119205298013, 0.005869270229678854] and parameters: {'n_layers': 1, 'embedding_dim': 256, 'lr': 0.00532575854276696, 'lambda_val': 1.2584008258141712e-05, 'batch_size': 3282, 'optimizer': 'RMSprop'}.
2026-05-24 16:10:35,570 - experiment_functions - INFO - Early stopping at epoch 900. Best Metrics: (0.012591825709974202, 0.0052566225165562915, 0.01025836258085625)
2026-05-24 16:10:36,135 - optuna.study.study - INFO - Trial 136 finished with values: [0.012591825709974202, 0.0052566225165562915, 0.01025836258085625] and parameters: {'n_layers': 2, 'embedding_dim': 32, 'lr': 0.0003004464644199072, 'lambda_val': 0.005762069964517917, 'batch_size': 3703, 'optimizer': 'Adam'}.
2026-05-24 16:10:42,523 - experiment_functions - INFO - Early stopping at epoch 550. Best Metrics: (0.030069149852101355, 0.009619205298013246, 0.024157605773241313)
2026-05-24 16:10:43,059 - optuna.study.study - INFO - Trial 137 finished with values: [0.030069149852101355, 0.009619205298013246, 0.024157605773241313] and parameters: {'n_layers': 1, 'embedding_dim': 96, 'lr': 0.0018120231467246312, 'lambda_val': 0.001734239570594469, 'batch_size': 3302, 'optimizer': 'Adam'}.
2026-05-24 16:10:48,787 - experiment_functions - INFO - Early stopping at epoch 500. Best Metrics: (0.004684971086435723, 0.004163907284768212, 0.00524799793363296)
2026-05-24 16:10:49,955 - optuna.study.study - INFO - Trial 138 finished with values: [0.004684971086435723, 0.004163907284768212, 0.00524799793363296] and parameters: {'n_layers': 2, 'embedding_dim': 32, 'lr': 0.0025106536291826954, 'lambda_val': 0.00047342946782276255, 'batch_size': 3564, 'optimizer': 'RMSprop'}.
2026-05-24 16:11:12,149 - experiment_functions - INFO - Early stopping at epoch 2150. Best Metrics: (0.046469824938041554, 0.01418046357615894, 0.03361950333156545)
2026-05-24 16:11:12,302 - optuna.study.study - INFO - Trial 139 finished with values: [0.046469824938041554, 0.01418046357615894, 0.03361950333156545] and parameters: {'n_layers': 1, 'embedding_dim': 32, 'lr': 0.0003131370011043347, 'lambda_val': 3.357239469878402e-06, 'batch_size': 1463, 'optimizer': 'RMSprop'}.
2026-05-24 16:11:21,143 - experiment_functions - INFO - Early stopping at epoch 800. Best Metrics: (0.004978162809645927, 0.003915562913907285, 0.0047911673040738085)
2026-05-24 16:11:21,218 - optuna.study.study - INFO - Trial 140 finished with values: [0.004978162809645927, 0.003915562913907285, 0.0047911673040738085] and parameters: {'n_layers': 3, 'embedding_dim': 64, 'lr': 2.5465185570619985e-05, 'lambda_val': 1.5344885626478058e-05, 'batch_size': 1193, 'optimizer': 'RMSprop'}.
2026-05-24 16:11:27,547 - experiment_functions - INFO - Early stopping at epoch 550. Best Metrics: (0.03873424822269307, 0.011009933774834437, 0.026198260579574098)
2026-05-24 16:11:28,055 - optuna.study.study - INFO - Trial 141 finished with values: [0.03873424822269307, 0.011009933774834437, 0.026198260579574098] and parameters: {'n_layers': 1, 'embedding_dim': 128, 'lr': 0.00532575854276696, 'lambda_val': 5.0506619955656765e-05, 'batch_size': 2725, 'optimizer': 'Adam'}.
2026-05-24 16:12:09,822 - optuna.study.study - INFO - Trial 142 finished with values: [0.009799171731297643, 0.004801324503311258, 0.008366034364765048] and parameters: {'n_layers': 3, 'embedding_dim': 128, 'lr': 3.958955454091491e-05, 'lambda_val': 2.523449139198518e-05, 'batch_size': 706, 'optimizer': 'Adam'}.
2026-05-24 16:12:16,341 - experiment_functions - INFO - Early stopping at epoch 550. Best Metrics: (0.039239547354105585, 0.01083609271523179, 0.027869146713461676)
2026-05-24 16:12:16,416 - optuna.study.study - INFO - Trial 143 finished with values: [0.039239547354105585, 0.01083609271523179, 0.027869146713461676] and parameters: {'n_layers': 1, 'embedding_dim': 256, 'lr': 0.005676961555550774, 'lambda_val': 1.1594147319583239e-05, 'batch_size': 2725, 'optimizer': 'Adam'}.
2026-05-24 16:12:22,457 - experiment_functions - INFO - Early stopping at epoch 500. Best Metrics: (0.028218147071297876, 0.00906456953642384, 0.021799600445866815)
2026-05-24 16:12:23,031 - optuna.study.study - INFO - Trial 144 finished with values: [0.028218147071297876, 0.00906456953642384, 0.021799600445866815] and parameters: {'n_layers': 3, 'embedding_dim': 96, 'lr': 0.02431450470115027, 'lambda_val': 1.2482171681838817e-06, 'batch_size': 3431, 'optimizer': 'RMSprop'}.
2026-05-24 16:13:04,147 - optuna.study.study - INFO - Trial 145 finished with values: [0.04191690566294757, 0.012119205298013245, 0.03018617145712915] and parameters: {'n_layers': 1, 'embedding_dim': 128, 'lr': 0.00014827150350050635, 'lambda_val': 2.523449139198518e-05, 'batch_size': 2725, 'optimizer': 'Adam'}.
2026-05-24 16:13:10,554 - experiment_functions - INFO - Early stopping at epoch 550. Best Metrics: (0.03032562672695734, 0.009362582781456952, 0.021590629706347637)
2026-05-24 16:13:10,965 - optuna.study.study - INFO - Trial 146 finished with values: [0.03032562672695734, 0.009362582781456952, 0.021590629706347637] and parameters: {'n_layers': 1, 'embedding_dim': 128, 'lr': 0.0013118157271416449, 'lambda_val': 0.0016369859032536668, 'batch_size': 1638, 'optimizer': 'RMSprop'}.
2026-05-24 16:13:17,115 - experiment_functions - INFO - Early stopping at epoch 550. Best Metrics: (0.04372666471336756, 0.012864238410596028, 0.03300624151724076)
2026-05-24 16:13:17,198 - optuna.study.study - INFO - Trial 147 finished with values: [0.04372666471336756, 0.012864238410596028, 0.03300624151724076] and parameters: {'n_layers': 1, 'embedding_dim': 128, 'lr': 0.0038122363815175056, 'lambda_val': 0.0005068128991295962, 'batch_size': 1062, 'optimizer': 'Adam'}.
2026-05-24 16:13:59,471 - optuna.study.study - INFO - Trial 148 finished with values: [0.03302723459678613, 0.010645695364238412, 0.023264695100461755] and parameters: {'n_layers': 3, 'embedding_dim': 96, 'lr': 0.00014827150350050635, 'lambda_val': 4.072777256931323e-06, 'batch_size': 1204, 'optimizer': 'Adam'}.
2026-05-24 16:14:05,182 - experiment_functions - INFO - Early stopping at epoch 500. Best Metrics: (0.0050783901745450515, 0.0035596026490066226, 0.004607329701812122)
2026-05-24 16:14:05,311 - optuna.study.study - INFO - Trial 149 finished with values: [0.0050783901745450515, 0.0035596026490066226, 0.004607329701812122] and parameters: {'n_layers': 1, 'embedding_dim': 128, 'lr': 0.00532575854276696, 'lambda_val': 5.897592552004812e-06, 'batch_size': 2725, 'optimizer': 'RMSprop'}.
2026-05-24 16:14:12,691 - experiment_functions - INFO - Early stopping at epoch 550. Best Metrics: (0.04272082749533284, 0.012466887417218542, 0.030663129701717157)
2026-05-24 16:14:13,214 - optuna.study.study - INFO - Trial 150 finished with values: [0.04272082749533284, 0.012466887417218542, 0.030663129701717157] and parameters: {'n_layers': 1, 'embedding_dim': 96, 'lr': 0.005676961555550774, 'lambda_val': 0.00017267652605927172, 'batch_size': 1178, 'optimizer': 'Adam'}.
2026-05-24 16:14:20,932 - experiment_functions - INFO - Early stopping at epoch 650. Best Metrics: (0.041990348017853174, 0.012317880794701988, 0.031528521171070224)
2026-05-24 16:14:21,023 - optuna.study.study - INFO - Trial 151 finished with values: [0.041990348017853174, 0.012317880794701988, 0.031528521171070224] and parameters: {'n_layers': 1, 'embedding_dim': 128, 'lr': 0.0010413911280538683, 'lambda_val': 5.897592552004812e-06, 'batch_size': 1062, 'optimizer': 'Adam'}.
2026-05-24 16:14:33,793 - experiment_functions - INFO - Early stopping at epoch 1200. Best Metrics: (0.04365865795506407, 0.012723509933774833, 0.03247495074139024)
2026-05-24 16:14:33,889 - optuna.study.study - INFO - Trial 152 finished with values: [0.04365865795506407, 0.012723509933774833, 0.03247495074139024] and parameters: {'n_layers': 1, 'embedding_dim': 96, 'lr': 0.00034279930379767936, 'lambda_val': 3.1769341559608166e-05, 'batch_size': 1178, 'optimizer': 'Adam'}.
2026-05-24 16:15:14,358 - optuna.study.study - INFO - Trial 153 finished with values: [0.04469071976410261, 0.01320364238410596, 0.03410937152064101] and parameters: {'n_layers': 1, 'embedding_dim': 128, 'lr': 0.00014827150350050635, 'lambda_val': 1.6170124945691617e-05, 'batch_size': 1097, 'optimizer': 'RMSprop'}.
2026-05-24 16:15:20,622 - experiment_functions - INFO - Early stopping at epoch 550. Best Metrics: (0.04064318845088192, 0.012086092715231788, 0.03219524005453032)
2026-05-24 16:15:21,282 - optuna.study.study - INFO - Trial 154 finished with values: [0.04064318845088192, 0.012086092715231788, 0.03219524005453032] and parameters: {'n_layers': 1, 'embedding_dim': 96, 'lr': 0.002629136506264111, 'lambda_val': 4.072777256931323e-06, 'batch_size': 1204, 'optimizer': 'Adam'}.
2026-05-24 16:15:27,245 - experiment_functions - INFO - Early stopping at epoch 500. Best Metrics: (0.004899338916987851, 0.0038658940397350997, 0.004884381708525284)
2026-05-24 16:15:28,870 - optuna.study.study - INFO - Trial 155 finished with values: [0.004899338916987851, 0.0038658940397350997, 0.004884381708525284] and parameters: {'n_layers': 1, 'embedding_dim': 128, 'lr': 0.0010413911280538683, 'lambda_val': 0.003570378898647507, 'batch_size': 1062, 'optimizer': 'SGD'}.
2026-05-24 16:15:56,050 - experiment_functions - INFO - Early stopping at epoch 2700. Best Metrics: (0.04377778324426317, 0.012756622516556293, 0.031424273834109756)
2026-05-24 16:15:56,133 - optuna.study.study - INFO - Trial 156 finished with values: [0.04377778324426317, 0.012756622516556293, 0.031424273834109756] and parameters: {'n_layers': 1, 'embedding_dim': 64, 'lr': 0.00018076016503271015, 'lambda_val': 0.0038402692954625658, 'batch_size': 769, 'optimizer': 'Adam'}.
2026-05-24 16:16:36,271 - optuna.study.study - INFO - Trial 157 finished with values: [0.03964023198956735, 0.01216887417218543, 0.03164772795467482] and parameters: {'n_layers': 1, 'embedding_dim': 96, 'lr': 0.00010176160914982528, 'lambda_val': 2.291507926580009e-06, 'batch_size': 1638, 'optimizer': 'RMSprop'}.
2026-05-24 16:16:46,520 - experiment_functions - INFO - Early stopping at epoch 900. Best Metrics: (0.04028003395306368, 0.01181291390728477, 0.029025782877142057)
2026-05-24 16:16:47,690 - optuna.study.study - INFO - Trial 158 finished with values: [0.04028003395306368, 0.01181291390728477, 0.029025782877142057] and parameters: {'n_layers': 1, 'embedding_dim': 128, 'lr': 0.00034279930379767936, 'lambda_val': 1.1594147319583239e-05, 'batch_size': 2725, 'optimizer': 'Adam'}.
2026-05-24 16:17:28,203 - optuna.study.study - INFO - Trial 159 finished with values: [0.04482029810590355, 0.013460264900662253, 0.03249427997945408] and parameters: {'n_layers': 1, 'embedding_dim': 128, 'lr': 0.00014827150350050635, 'lambda_val': 8.174770053441025e-05, 'batch_size': 1097, 'optimizer': 'RMSprop'}.
2026-05-24 16:17:35,665 - experiment_functions - INFO - Early stopping at epoch 650. Best Metrics: (0.03530029641197203, 0.011432119205298016, 0.02704629463389347)
2026-05-24 16:17:35,747 - optuna.study.study - INFO - Trial 160 finished with values: [0.03530029641197203, 0.011432119205298016, 0.02704629463389347] and parameters: {'n_layers': 1, 'embedding_dim': 32, 'lr': 0.0012971109624756183, 'lambda_val': 5.897592552004812e-06, 'batch_size': 1455, 'optimizer': 'Adam'}.
2026-05-24 16:18:17,461 - optuna.study.study - INFO - Trial 161 finished with values: [0.04182725384580696, 0.01230132450331126, 0.03062776520935587] and parameters: {'n_layers': 1, 'embedding_dim': 128, 'lr': 0.00014827150350050635, 'lambda_val': 5.897592552004812e-06, 'batch_size': 2305, 'optimizer': 'Adam'}.
2026-05-24 16:18:23,999 - experiment_functions - INFO - Early stopping at epoch 550. Best Metrics: (0.03589723663038373, 0.010438741721854305, 0.02596787239365945)
2026-05-24 16:18:24,999 - optuna.study.study - INFO - Trial 162 finished with values: [0.03589723663038373, 0.010438741721854305, 0.02596787239365945] and parameters: {'n_layers': 1, 'embedding_dim': 96, 'lr': 0.00532575854276696, 'lambda_val': 1.1594147319583239e-05, 'batch_size': 2725, 'optimizer': 'Adam'}.
2026-05-24 16:18:35,084 - experiment_functions - INFO - Early stopping at epoch 950. Best Metrics: (0.005749888407410478, 0.004304635761589404, 0.005420184569924987)
2026-05-24 16:18:35,376 - optuna.study.study - INFO - Trial 163 finished with values: [0.005749888407410478, 0.004304635761589404, 0.005420184569924987] and parameters: {'n_layers': 1, 'embedding_dim': 96, 'lr': 1.5336767843500276e-05, 'lambda_val': 2.291507926580009e-06, 'batch_size': 1638, 'optimizer': 'Adam'}.
2026-05-24 16:18:41,778 - experiment_functions - INFO - Early stopping at epoch 550. Best Metrics: (0.03243855051788859, 0.010206953642384107, 0.02559157532170544)
2026-05-24 16:18:43,274 - optuna.study.study - INFO - Trial 164 finished with values: [0.03243855051788859, 0.010206953642384107, 0.02559157532170544] and parameters: {'n_layers': 2, 'embedding_dim': 96, 'lr': 0.0025355063262087123, 'lambda_val': 0.002332362722517884, 'batch_size': 1062, 'optimizer': 'Adam'}.
2026-05-24 16:18:49,047 - experiment_functions - INFO - Early stopping at epoch 500. Best Metrics: (0.004017588923676382, 0.003195364238410596, 0.004030682425515812)
2026-05-24 16:18:49,744 - optuna.study.study - INFO - Trial 165 finished with values: [0.004017588923676382, 0.003195364238410596, 0.004030682425515812] and parameters: {'n_layers': 1, 'embedding_dim': 32, 'lr': 0.007364321070673276, 'lambda_val': 4.9612924956814075e-05, 'batch_size': 1638, 'optimizer': 'RMSprop'}.
2026-05-24 16:18:55,943 - experiment_functions - INFO - Early stopping at epoch 550. Best Metrics: (0.03942123539300842, 0.01142384105960265, 0.0287437846071813)
2026-05-24 16:18:56,740 - optuna.study.study - INFO - Trial 166 finished with values: [0.03942123539300842, 0.01142384105960265, 0.0287437846071813] and parameters: {'n_layers': 1, 'embedding_dim': 128, 'lr': 0.005676961555550774, 'lambda_val': 0.00017267652605927172, 'batch_size': 1463, 'optimizer': 'Adam'}.
2026-05-24 16:19:03,309 - experiment_functions - INFO - Early stopping at epoch 550. Best Metrics: (0.037225907997015285, 0.010612582781456952, 0.027358693120285948)
