2026-05-24 16:19:03,785 - optuna.study.study - INFO - Trial 167 finished with values: [0.037225907997015285, 0.010612582781456952, 0.027358693120285948] and parameters: {'n_layers': 1, 'embedding_dim': 96, 'lr': 0.00532575854276696, 'lambda_val': 1.1594147319583239e-05, 'batch_size': 4048, 'optimizer': 'Adam'}.
2026-05-24 16:19:10,047 - experiment_functions - INFO - Early stopping at epoch 500. Best Metrics: (0.004905247711580476, 0.003758278145695364, 0.00489744593405022)
2026-05-24 16:19:10,274 - optuna.study.study - INFO - Trial 168 finished with values: [0.004905247711580476, 0.003758278145695364, 0.00489744593405022] and parameters: {'n_layers': 4, 'embedding_dim': 128, 'lr': 0.00532575854276696, 'lambda_val': 2.523449139198518e-05, 'batch_size': 1062, 'optimizer': 'Adam'}.
2026-05-24 16:19:49,746 - optuna.study.study - INFO - Trial 169 finished with values: [0.03906707876766565, 0.011978476821192052, 0.02953685576405258] and parameters: {'n_layers': 1, 'embedding_dim': 32, 'lr': 0.00014827150350050635, 'lambda_val': 2.291507926580009e-06, 'batch_size': 1638, 'optimizer': 'Adam'}.
2026-05-24 16:19:55,419 - experiment_functions - INFO - Early stopping at epoch 500. Best Metrics: (0.005130054689301106, 0.004039735099337749, 0.005037368919968119)
2026-05-24 16:19:55,688 - optuna.study.study - INFO - Trial 170 finished with values: [0.005130054689301106, 0.004039735099337749, 0.005037368919968119] and parameters: {'n_layers': 1, 'embedding_dim': 128, 'lr': 0.00014827150350050635, 'lambda_val': 5.897592552004812e-06, 'batch_size': 1909, 'optimizer': 'SGD'}.
2026-05-24 16:20:02,933 - experiment_functions - INFO - Early stopping at epoch 550. Best Metrics: (0.01966941868826953, 0.007201986754966887, 0.01520687448750454)
2026-05-24 16:20:03,005 - optuna.study.study - INFO - Trial 171 finished with values: [0.01966941868826953, 0.007201986754966887, 0.01520687448750454] and parameters: {'n_layers': 3, 'embedding_dim': 256, 'lr': 0.0012971109624756183, 'lambda_val': 5.897592552004812e-06, 'batch_size': 2725, 'optimizer': 'Adam'}.
2026-05-24 16:20:11,769 - experiment_functions - INFO - Early stopping at epoch 800. Best Metrics: (0.0412728716686779, 0.011945364238410597, 0.030471769183967063)
2026-05-24 16:20:12,524 - optuna.study.study - INFO - Trial 172 finished with values: [0.0412728716686779, 0.011945364238410597, 0.030471769183967063] and parameters: {'n_layers': 1, 'embedding_dim': 128, 'lr': 0.00034279930379767936, 'lambda_val': 1.1594147319583239e-05, 'batch_size': 1638, 'optimizer': 'RMSprop'}.
2026-05-24 16:20:19,297 - experiment_functions - INFO - Early stopping at epoch 550. Best Metrics: (0.01988386570311381, 0.006556291390728477, 0.012516423578921132)
2026-05-24 16:20:19,465 - optuna.study.study - INFO - Trial 173 finished with values: [0.01988386570311381, 0.006556291390728477, 0.012516423578921132] and parameters: {'n_layers': 2, 'embedding_dim': 256, 'lr': 0.00532575854276696, 'lambda_val': 5.897592552004812e-06, 'batch_size': 2300, 'optimizer': 'Adam'}.
2026-05-24 16:20:25,964 - experiment_functions - INFO - Early stopping at epoch 550. Best Metrics: (0.03752815331958263, 0.011258278145695364, 0.028032152948854992)
2026-05-24 16:20:26,195 - optuna.study.study - INFO - Trial 174 finished with values: [0.03752815331958263, 0.011258278145695364, 0.028032152948854992] and parameters: {'n_layers': 1, 'embedding_dim': 128, 'lr': 0.0013253216979926218, 'lambda_val': 1.0277310866187752e-05, 'batch_size': 1638, 'optimizer': 'RMSprop'}.
2026-05-24 16:20:32,517 - experiment_functions - INFO - Early stopping at epoch 550. Best Metrics: (0.036887774412070515, 0.010711920529801324, 0.026815794656485415)
2026-05-24 16:20:32,610 - optuna.study.study - INFO - Trial 175 finished with values: [0.036887774412070515, 0.010711920529801324, 0.026815794656485415] and parameters: {'n_layers': 1, 'embedding_dim': 96, 'lr': 0.00532575854276696, 'lambda_val': 4.9612924956814075e-05, 'batch_size': 3054, 'optimizer': 'Adam'}.
2026-05-24 16:20:38,337 - experiment_functions - INFO - Early stopping at epoch 500. Best Metrics: (0.003917779094762665, 0.0035596026490066226, 0.004416564411778971)
2026-05-24 16:20:39,291 - optuna.study.study - INFO - Trial 176 finished with values: [0.003917779094762665, 0.0035596026490066226, 0.004416564411778971] and parameters: {'n_layers': 1, 'embedding_dim': 128, 'lr': 0.00532575854276696, 'lambda_val': 0.00027153673862139176, 'batch_size': 962, 'optimizer': 'RMSprop'}.
2026-05-24 16:20:45,860 - experiment_functions - INFO - Early stopping at epoch 550. Best Metrics: (0.012473635809144148, 0.004180463576158941, 0.008022655309889408)
2026-05-24 16:20:46,850 - optuna.study.study - INFO - Trial 177 finished with values: [0.012473635809144148, 0.004180463576158941, 0.008022655309889408] and parameters: {'n_layers': 1, 'embedding_dim': 256, 'lr': 0.02591469533929025, 'lambda_val': 1.1594147319583239e-05, 'batch_size': 2725, 'optimizer': 'Adam'}.
2026-05-24 16:21:00,768 - experiment_functions - INFO - Early stopping at epoch 750. Best Metrics: (0.04083878074038785, 0.012177152317880795, 0.029314647700596178)
2026-05-24 16:21:00,856 - optuna.study.study - INFO - Trial 178 finished with values: [0.04083878074038785, 0.012177152317880795, 0.029314647700596178] and parameters: {'n_layers': 1, 'embedding_dim': 256, 'lr': 0.0003131370011043347, 'lambda_val': 0.0008304978509047221, 'batch_size': 1463, 'optimizer': 'RMSprop'}.
2026-05-24 16:21:07,705 - experiment_functions - INFO - Early stopping at epoch 600. Best Metrics: (0.03910686600193907, 0.01185430463576159, 0.02717957393166755)
2026-05-24 16:21:08,140 - optuna.study.study - INFO - Trial 179 finished with values: [0.03910686600193907, 0.01185430463576159, 0.02717957393166755] and parameters: {'n_layers': 1, 'embedding_dim': 32, 'lr': 0.0012971109624756183, 'lambda_val': 5.897592552004812e-06, 'batch_size': 1988, 'optimizer': 'RMSprop'}.
2026-05-24 16:21:49,726 - optuna.study.study - INFO - Trial 180 finished with values: [0.025360855184215016, 0.009014900662251656, 0.02115010142360684] and parameters: {'n_layers': 2, 'embedding_dim': 96, 'lr': 7.874444646364451e-05, 'lambda_val': 1.2482171681838817e-06, 'batch_size': 2851, 'optimizer': 'Adam'}.
2026-05-24 16:21:57,229 - experiment_functions - INFO - Early stopping at epoch 700. Best Metrics: (0.005089465666859961, 0.004437086092715232, 0.005496658389059014)
2026-05-24 16:21:57,304 - optuna.study.study - INFO - Trial 181 finished with values: [0.005089465666859961, 0.004437086092715232, 0.005496658389059014] and parameters: {'n_layers': 1, 'embedding_dim': 128, 'lr': 0.009155828363511007, 'lambda_val': 0.0005068128991295962, 'batch_size': 1062, 'optimizer': 'SGD'}.
2026-05-24 16:22:05,435 - experiment_functions - INFO - Early stopping at epoch 600. Best Metrics: (0.03728583787693049, 0.010877483443708612, 0.02676300789235832)
2026-05-24 16:22:06,147 - optuna.study.study - INFO - Trial 182 finished with values: [0.03728583787693049, 0.010877483443708612, 0.02676300789235832] and parameters: {'n_layers': 1, 'embedding_dim': 64, 'lr': 0.0010413911280538683, 'lambda_val': 5.897592552004812e-06, 'batch_size': 1463, 'optimizer': 'RMSprop'}.
2026-05-24 16:22:11,968 - experiment_functions - INFO - Early stopping at epoch 500. Best Metrics: (0.004642808306154507, 0.0037251655629139072, 0.004811961970955518)
2026-05-24 16:22:12,508 - optuna.study.study - INFO - Trial 183 finished with values: [0.004642808306154507, 0.0037251655629139072, 0.004811961970955518] and parameters: {'n_layers': 1, 'embedding_dim': 128, 'lr': 0.00532575854276696, 'lambda_val': 1.1594147319583239e-05, 'batch_size': 962, 'optimizer': 'RMSprop'}.
2026-05-24 16:22:51,368 - optuna.study.study - INFO - Trial 184 finished with values: [0.02664714546437645, 0.009081125827814571, 0.0221598379222149] and parameters: {'n_layers': 1, 'embedding_dim': 32, 'lr': 0.00010935838245649447, 'lambda_val': 0.0038402692954625658, 'batch_size': 1062, 'optimizer': 'RMSprop'}.
2026-05-24 16:22:57,809 - experiment_functions - INFO - Early stopping at epoch 550. Best Metrics: (0.0346356351575726, 0.010256622516556292, 0.023886999506929785)
2026-05-24 16:22:57,969 - optuna.study.study - INFO - Trial 185 finished with values: [0.0346356351575726, 0.010256622516556292, 0.023886999506929785] and parameters: {'n_layers': 1, 'embedding_dim': 96, 'lr': 0.00532575854276696, 'lambda_val': 1.1594147319583239e-05, 'batch_size': 2725, 'optimizer': 'Adam'}.
2026-05-24 16:23:04,443 - experiment_functions - INFO - Early stopping at epoch 550. Best Metrics: (0.034545693035819114, 0.01038907284768212, 0.025005014943839974)
2026-05-24 16:23:04,644 - optuna.study.study - INFO - Trial 186 finished with values: [0.034545693035819114, 0.01038907284768212, 0.025005014943839974] and parameters: {'n_layers': 1, 'embedding_dim': 96, 'lr': 0.00532575854276696, 'lambda_val': 1.1594147319583239e-05, 'batch_size': 2725, 'optimizer': 'Adam'}.
2026-05-24 16:23:11,920 - experiment_functions - INFO - Early stopping at epoch 650. Best Metrics: (0.005317373827369254, 0.0041307947019867544, 0.005216122794413559)
2026-05-24 16:23:11,982 - optuna.study.study - INFO - Trial 187 finished with values: [0.005317373827369254, 0.0041307947019867544, 0.005216122794413559] and parameters: {'n_layers': 1, 'embedding_dim': 32, 'lr': 4.1098607070197875e-05, 'lambda_val': 0.0005068128991295962, 'batch_size': 3497, 'optimizer': 'Adam'}.
2026-05-24 16:23:47,409 - experiment_functions - INFO - Early stopping at epoch 3550. Best Metrics: (0.04257304612818793, 0.012516556291390727, 0.03170919086582463)
2026-05-24 16:23:48,286 - optuna.study.study - INFO - Trial 188 finished with values: [0.04257304612818793, 0.012516556291390727, 0.03170919086582463] and parameters: {'n_layers': 1, 'embedding_dim': 128, 'lr': 0.00014827150350050635, 'lambda_val': 0.002332362722517884, 'batch_size': 1062, 'optimizer': 'Adam'}.
2026-05-24 16:24:04,331 - experiment_functions - INFO - Early stopping at epoch 1550. Best Metrics: (0.034441639969059336, 0.010571192052980133, 0.025548162016814854)
2026-05-24 16:24:05,085 - optuna.study.study - INFO - Trial 189 finished with values: [0.034441639969059336, 0.010571192052980133, 0.025548162016814854] and parameters: {'n_layers': 1, 'embedding_dim': 32, 'lr': 0.0003131370011043347, 'lambda_val': 3.357239469878402e-06, 'batch_size': 2725, 'optimizer': 'Adam'}.
2026-05-24 16:24:11,224 - experiment_functions - INFO - Early stopping at epoch 500. Best Metrics: (0.005186644496279003, 0.004188741721854306, 0.005362996719944035)
2026-05-24 16:24:11,306 - optuna.study.study - INFO - Trial 190 finished with values: [0.005186644496279003, 0.004188741721854306, 0.005362996719944035] and parameters: {'n_layers': 1, 'embedding_dim': 128, 'lr': 6.917491473788202e-05, 'lambda_val': 2.291507926580009e-06, 'batch_size': 3255, 'optimizer': 'SGD'}.
2026-05-24 16:24:18,934 - experiment_functions - INFO - Early stopping at epoch 650. Best Metrics: (0.03766468749987841, 0.011440397350993376, 0.02714841558689475)
2026-05-24 16:24:19,020 - optuna.study.study - INFO - Trial 191 finished with values: [0.03766468749987841, 0.011440397350993376, 0.02714841558689475] and parameters: {'n_layers': 1, 'embedding_dim': 64, 'lr': 0.0006602503237283403, 'lambda_val': 1.662783965279686e-05, 'batch_size': 2725, 'optimizer': 'RMSprop'}.
2026-05-24 16:24:33,587 - experiment_functions - INFO - Early stopping at epoch 1250. Best Metrics: (0.010718220599177961, 0.00527317880794702, 0.009036628710148596)
2026-05-24 16:24:33,739 - optuna.study.study - INFO - Trial 192 finished with values: [0.010718220599177961, 0.00527317880794702, 0.009036628710148596] and parameters: {'n_layers': 4, 'embedding_dim': 128, 'lr': 0.00014827150350050635, 'lambda_val': 0.0003968501300572962, 'batch_size': 2725, 'optimizer': 'Adam'}.
2026-05-24 16:24:40,651 - experiment_functions - INFO - Early stopping at epoch 500. Best Metrics: (0.00593943499262993, 0.004105960264900663, 0.005855178787800738)
2026-05-24 16:24:40,740 - optuna.study.study - INFO - Trial 193 finished with values: [0.00593943499262993, 0.004105960264900663, 0.005855178787800738] and parameters: {'n_layers': 3, 'embedding_dim': 256, 'lr': 0.02431450470115027, 'lambda_val': 1.2482171681838817e-06, 'batch_size': 3431, 'optimizer': 'Adam'}.
2026-05-24 16:24:47,359 - experiment_functions - INFO - Early stopping at epoch 550. Best Metrics: (0.04139251339726006, 0.011738410596026492, 0.03036686675326173)
2026-05-24 16:24:47,726 - optuna.study.study - INFO - Trial 194 finished with values: [0.04139251339726006, 0.011738410596026492, 0.03036686675326173] and parameters: {'n_layers': 1, 'embedding_dim': 256, 'lr': 0.005676961555550774, 'lambda_val': 0.00017267652605927172, 'batch_size': 1178, 'optimizer': 'Adam'}.
2026-05-24 16:24:54,688 - experiment_functions - INFO - Early stopping at epoch 600. Best Metrics: (0.03823448442721799, 0.011589403973509934, 0.028324924841946635)
2026-05-24 16:24:54,992 - optuna.study.study - INFO - Trial 195 finished with values: [0.03823448442721799, 0.011589403973509934, 0.028324924841946635] and parameters: {'n_layers': 1, 'embedding_dim': 96, 'lr': 0.0012971109624756183, 'lambda_val': 5.897592552004812e-06, 'batch_size': 2725, 'optimizer': 'Adam'}.
2026-05-24 16:25:06,296 - experiment_functions - INFO - Early stopping at epoch 600. Best Metrics: (0.040191531646419955, 0.012003311258278146, 0.030429608532847416)
2026-05-24 16:25:06,388 - optuna.study.study - INFO - Trial 196 finished with values: [0.040191531646419955, 0.012003311258278146, 0.030429608532847416] and parameters: {'n_layers': 1, 'embedding_dim': 96, 'lr': 0.0012971109624756183, 'lambda_val': 5.897592552004812e-06, 'batch_size': 1638, 'optimizer': 'Adam'}.
2026-05-24 16:25:13,256 - experiment_functions - INFO - Early stopping at epoch 550. Best Metrics: (0.011257476403055416, 0.005397350993377484, 0.009336758405196656)
2026-05-24 16:25:13,560 - optuna.study.study - INFO - Trial 197 finished with values: [0.011257476403055416, 0.005397350993377484, 0.009336758405196656] and parameters: {'n_layers': 4, 'embedding_dim': 128, 'lr': 0.0007065318271795035, 'lambda_val': 5.897592552004812e-06, 'batch_size': 2254, 'optimizer': 'RMSprop'}.
2026-05-24 16:25:55,723 - optuna.study.study - INFO - Trial 198 finished with values: [0.03845043569049333, 0.011341059602649006, 0.028719951951366073] and parameters: {'n_layers': 1, 'embedding_dim': 96, 'lr': 0.00014827150350050635, 'lambda_val': 2.0549669964750215e-06, 'batch_size': 3843, 'optimizer': 'Adam'}.
2026-05-24 16:26:01,938 - experiment_functions - INFO - Early stopping at epoch 500. Best Metrics: (0.004803000690852205, 0.003998344370860928, 0.004987079304416117)
2026-05-24 16:26:02,370 - optuna.study.study - INFO - Trial 199 finished with values: [0.004803000690852205, 0.003998344370860928, 0.004987079304416117] and parameters: {'n_layers': 1, 'embedding_dim': 128, 'lr': 1.8280986691994376e-05, 'lambda_val': 1.1594147319583239e-05, 'batch_size': 3431, 'optimizer': 'Adam'}.
2026-05-24 16:26:32,806 - experiment_functions - INFO - Early stopping at epoch 2650. Best Metrics: (0.044497330264698536, 0.013137417218543045, 0.03192025508241798)
2026-05-24 16:26:33,403 - optuna.study.study - INFO - Trial 200 finished with values: [0.044497330264698536, 0.013137417218543045, 0.03192025508241798] and parameters: {'n_layers': 2, 'embedding_dim': 128, 'lr': 0.00014827150350050635, 'lambda_val': 5.897592552004812e-06, 'batch_size': 1097, 'optimizer': 'RMSprop'}.
2026-05-24 16:26:40,637 - experiment_functions - INFO - Early stopping at epoch 600. Best Metrics: (0.04236696609771093, 0.012350993377483445, 0.032567429204016674)
2026-05-24 16:26:40,748 - optuna.study.study - INFO - Trial 201 finished with values: [0.04236696609771093, 0.012350993377483445, 0.032567429204016674] and parameters: {'n_layers': 1, 'embedding_dim': 128, 'lr': 0.0012971109624756183, 'lambda_val': 0.002332362722517884, 'batch_size': 1062, 'optimizer': 'Adam'}.
2026-05-24 16:26:48,463 - experiment_functions - INFO - Early stopping at epoch 600. Best Metrics: (0.03783403934811234, 0.0111341059602649, 0.02731472143280618)
2026-05-24 16:26:48,556 - optuna.study.study - INFO - Trial 202 finished with values: [0.03783403934811234, 0.0111341059602649, 0.02731472143280618] and parameters: {'n_layers': 1, 'embedding_dim': 128, 'lr': 0.0010413911280538683, 'lambda_val': 1.1594147319583239e-05, 'batch_size': 2725, 'optimizer': 'Adam'}.
2026-05-24 16:26:57,231 - experiment_functions - INFO - Early stopping at epoch 700. Best Metrics: (0.04206747078256292, 0.012177152317880796, 0.03186034589437293)
2026-05-24 16:26:57,327 - optuna.study.study - INFO - Trial 203 finished with values: [0.04206747078256292, 0.012177152317880796, 0.03186034589437293] and parameters: {'n_layers': 1, 'embedding_dim': 256, 'lr': 0.0007087341949757506, 'lambda_val': 0.00017267652605927172, 'batch_size': 1062, 'optimizer': 'Adam'}.
2026-05-24 16:27:09,147 - experiment_functions - INFO - Early stopping at epoch 1000. Best Metrics: (0.04256379111705544, 0.012706953642384106, 0.03155152659172284)
2026-05-24 16:27:09,215 - optuna.study.study - INFO - Trial 204 finished with values: [0.04256379111705544, 0.012706953642384106, 0.03155152659172284] and parameters: {'n_layers': 1, 'embedding_dim': 128, 'lr': 0.00034279930379767936, 'lambda_val': 1.8800744005146669e-06, 'batch_size': 1178, 'optimizer': 'Adam'}.
2026-05-24 16:27:16,233 - experiment_functions - INFO - Early stopping at epoch 550. Best Metrics: (0.04217720745743278, 0.011854304635761589, 0.031953762294323534)
2026-05-24 16:27:17,394 - optuna.study.study - INFO - Trial 205 finished with values: [0.04217720745743278, 0.011854304635761589, 0.031953762294323534] and parameters: {'n_layers': 1, 'embedding_dim': 256, 'lr': 0.005676961555550774, 'lambda_val': 0.00017267652605927172, 'batch_size': 1178, 'optimizer': 'Adam'}.
2026-05-24 16:27:54,750 - experiment_functions - INFO - Early stopping at epoch 3400. Best Metrics: (0.04430145364490688, 0.013087748344370863, 0.033762039453780854)
2026-05-24 16:27:54,834 - optuna.study.study - INFO - Trial 206 finished with values: [0.04430145364490688, 0.013087748344370863, 0.033762039453780854] and parameters: {'n_layers': 1, 'embedding_dim': 128, 'lr': 0.00014827150350050635, 'lambda_val': 5.897592552004812e-06, 'batch_size': 1062, 'optimizer': 'RMSprop'}.
2026-05-24 16:28:40,794 - optuna.study.study - INFO - Trial 207 finished with values: [0.04167830968034949, 0.012442052980132451, 0.0317522443936256] and parameters: {'n_layers': 2, 'embedding_dim': 128, 'lr': 0.00010950628203749842, 'lambda_val': 1.1594147319583239e-05, 'batch_size': 2725, 'optimizer': 'RMSprop'}.
2026-05-24 16:28:47,178 - experiment_functions - INFO - Early stopping at epoch 500. Best Metrics: (0.005162331301919406, 0.004023178807947021, 0.005244756372099698)
2026-05-24 16:28:47,275 - optuna.study.study - INFO - Trial 208 finished with values: [0.005162331301919406, 0.004023178807947021, 0.005244756372099698] and parameters: {'n_layers': 1, 'embedding_dim': 128, 'lr': 0.0010413911280538683, 'lambda_val': 0.0038402692954625658, 'batch_size': 1254, 'optimizer': 'SGD'}.
2026-05-24 16:28:53,613 - experiment_functions - INFO - Early stopping at epoch 500. Best Metrics: (0.005050301641354051, 0.004105960264900663, 0.00512032412712025)
2026-05-24 16:28:53,917 - optuna.study.study - INFO - Trial 209 finished with values: [0.005050301641354051, 0.004105960264900663, 0.00512032412712025] and parameters: {'n_layers': 3, 'embedding_dim': 96, 'lr': 0.0038122363815175056, 'lambda_val': 0.002332362722517884, 'batch_size': 1718, 'optimizer': 'Adam'}.
2026-05-24 16:29:00,998 - experiment_functions - INFO - Early stopping at epoch 550. Best Metrics: (0.03951800291926684, 0.011887417218543046, 0.028692448707934328)
2026-05-24 16:29:01,096 - optuna.study.study - INFO - Trial 210 finished with values: [0.03951800291926684, 0.011887417218543046, 0.028692448707934328] and parameters: {'n_layers': 1, 'embedding_dim': 96, 'lr': 0.0012971109624756183, 'lambda_val': 8.714894496858236e-05, 'batch_size': 962, 'optimizer': 'RMSprop'}.
2026-05-24 16:29:45,845 - optuna.study.study - INFO - Trial 211 finished with values: [0.04123357841565886, 0.011854304635761589, 0.029974630301971013] and parameters: {'n_layers': 1, 'embedding_dim': 128, 'lr': 0.00014827150350050635, 'lambda_val': 5.897592552004812e-06, 'batch_size': 2711, 'optimizer': 'Adam'}.
2026-05-24 16:29:58,801 - experiment_functions - INFO - Early stopping at epoch 1150. Best Metrics: (0.004817801244523239, 0.004048013245033113, 0.004911720763884582)
2026-05-24 16:29:58,888 - optuna.study.study - INFO - Trial 212 finished with values: [0.004817801244523239, 0.004048013245033113, 0.004911720763884582] and parameters: {'n_layers': 1, 'embedding_dim': 128, 'lr': 0.08447575441210439, 'lambda_val': 1.6170124945691617e-05, 'batch_size': 1097, 'optimizer': 'SGD'}.
2026-05-24 16:30:43,079 - optuna.study.study - INFO - Trial 213 finished with values: [0.045036194167197764, 0.013501655629139075, 0.03446953573291413] and parameters: {'n_layers': 1, 'embedding_dim': 96, 'lr': 0.00014827150350050635, 'lambda_val': 3.357239469878402e-06, 'batch_size': 1097, 'optimizer': 'RMSprop'}.
2026-05-24 16:30:49,478 - experiment_functions - INFO - Early stopping at epoch 500. Best Metrics: (0.005078173078471702, 0.003973509933774834, 0.005182541487084717)
2026-05-24 16:30:49,561 - optuna.study.study - INFO - Trial 214 finished with values: [0.005078173078471702, 0.003973509933774834, 0.005182541487084717] and parameters: {'n_layers': 3, 'embedding_dim': 128, 'lr': 0.012178972237800418, 'lambda_val': 0.0038402692954625658, 'batch_size': 1062, 'optimizer': 'Adam'}.
2026-05-24 16:31:00,816 - experiment_functions - INFO - Early stopping at epoch 900. Best Metrics: (0.030253288193901842, 0.009718543046357617, 0.020671735684349588)
