2026-05-24 01:42:26,296 - optuna.study.study - INFO - Trial 96 finished with values: [0.007731753422712462, 0.00615066225165563, 0.008072292628918887] and parameters: {'n_layers': 3, 'embedding_dim': 32, 'lr': 4.842135369182381e-05, 'lambda_val': 0.002720399768458268, 'batch_size': 1491, 'optimizer': 'RMSprop'}.
2026-05-24 01:43:05,727 - optuna.study.study - INFO - Trial 97 finished with values: [0.007276559085558687, 0.005960264900662252, 0.007798063989944325] and parameters: {'n_layers': 3, 'embedding_dim': 128, 'lr': 3.6928340184332895e-05, 'lambda_val': 1.4652981275810046e-05, 'batch_size': 3106, 'optimizer': 'RMSprop'}.
2026-05-24 01:43:45,822 - optuna.study.study - INFO - Trial 98 finished with values: [0.013277316811813765, 0.010538079470198676, 0.014125417235170105] and parameters: {'n_layers': 4, 'embedding_dim': 96, 'lr': 8.832720040270487e-05, 'lambda_val': 1.4801449770617434e-06, 'batch_size': 3812, 'optimizer': 'RMSprop'}.
2026-05-24 01:43:51,469 - experiment_functions - INFO - Early stopping at epoch 500. Best Metrics: (0.005016129839193161, 0.004130794701986755, 0.005041676535251029)
2026-05-24 01:43:51,750 - optuna.study.study - INFO - Trial 99 finished with values: [0.005016129839193161, 0.004130794701986755, 0.005041676535251029] and parameters: {'n_layers': 4, 'embedding_dim': 32, 'lr': 2.133457805309601e-05, 'lambda_val': 0.02861834109399891, 'batch_size': 1032, 'optimizer': 'SGD'}.
2026-05-24 01:43:59,860 - experiment_functions - INFO - Early stopping at epoch 700. Best Metrics: (0.016232578497505822, 0.012144039735099336, 0.016546108639184945)
2026-05-24 01:44:00,007 - optuna.study.study - INFO - Trial 100 finished with values: [0.016232578497505822, 0.012144039735099336, 0.016546108639184945] and parameters: {'n_layers': 1, 'embedding_dim': 96, 'lr': 0.0008147997918947485, 'lambda_val': 0.0001255786949388013, 'batch_size': 3274, 'optimizer': 'RMSprop'}.
2026-05-24 01:44:06,923 - experiment_functions - INFO - Early stopping at epoch 600. Best Metrics: (0.015378103743683352, 0.011589403973509934, 0.015378117427274799)
2026-05-24 01:44:07,025 - optuna.study.study - INFO - Trial 101 finished with values: [0.015378103743683352, 0.011589403973509934, 0.015378117427274799] and parameters: {'n_layers': 1, 'embedding_dim': 128, 'lr': 0.001268209095831261, 'lambda_val': 2.182273739992126e-05, 'batch_size': 3106, 'optimizer': 'RMSprop'}.
2026-05-24 01:44:15,032 - experiment_functions - INFO - Early stopping at epoch 650. Best Metrics: (0.020060047527006578, 0.013526490066225163, 0.019763667259571877)
2026-05-24 01:44:16,127 - optuna.study.study - INFO - Trial 102 finished with values: [0.020060047527006578, 0.013526490066225163, 0.019763667259571877] and parameters: {'n_layers': 1, 'embedding_dim': 64, 'lr': 0.003175767497275054, 'lambda_val': 1.1741946550104087e-06, 'batch_size': 664, 'optimizer': 'Adam'}.
2026-05-24 01:44:36,453 - experiment_functions - INFO - Early stopping at epoch 1900. Best Metrics: (0.019222944146300852, 0.014188741721854305, 0.019104975987005283)
2026-05-24 01:44:36,807 - optuna.study.study - INFO - Trial 103 finished with values: [0.019222944146300852, 0.014188741721854305, 0.019104975987005283] and parameters: {'n_layers': 1, 'embedding_dim': 96, 'lr': 0.0005233015481570266, 'lambda_val': 1.858625399381744e-05, 'batch_size': 1343, 'optimizer': 'RMSprop'}.
2026-05-24 01:44:43,278 - experiment_functions - INFO - Early stopping at epoch 500. Best Metrics: (0.004846131601095617, 0.004031456953642384, 0.004884292700435819)
2026-05-24 01:44:44,017 - optuna.study.study - INFO - Trial 104 finished with values: [0.004846131601095617, 0.004031456953642384, 0.004884292700435819] and parameters: {'n_layers': 3, 'embedding_dim': 96, 'lr': 0.004320951557015901, 'lambda_val': 1.1741946550104087e-06, 'batch_size': 3812, 'optimizer': 'SGD'}.
2026-05-24 01:44:51,483 - experiment_functions - INFO - Early stopping at epoch 650. Best Metrics: (0.015222947492110051, 0.01079470198675497, 0.014851800662546369)
2026-05-24 01:44:51,581 - optuna.study.study - INFO - Trial 105 finished with values: [0.015222947492110051, 0.01079470198675497, 0.014851800662546369] and parameters: {'n_layers': 1, 'embedding_dim': 128, 'lr': 0.001268209095831261, 'lambda_val': 0.0019859082657926997, 'batch_size': 4076, 'optimizer': 'Adam'}.
2026-05-24 01:44:58,080 - experiment_functions - INFO - Early stopping at epoch 550. Best Metrics: (0.014952016064014561, 0.011283112582781458, 0.015040844163515532)
2026-05-24 01:44:59,282 - optuna.study.study - INFO - Trial 106 finished with values: [0.014952016064014561, 0.011283112582781458, 0.015040844163515532] and parameters: {'n_layers': 2, 'embedding_dim': 96, 'lr': 0.005852380695113062, 'lambda_val': 0.012208803351137528, 'batch_size': 1362, 'optimizer': 'Adam'}.
2026-05-24 01:45:07,226 - experiment_functions - INFO - Early stopping at epoch 650. Best Metrics: (0.021035569066391042, 0.013658940397350994, 0.01975935275393973)
2026-05-24 01:45:07,307 - optuna.study.study - INFO - Trial 107 finished with values: [0.021035569066391042, 0.013658940397350994, 0.01975935275393973] and parameters: {'n_layers': 1, 'embedding_dim': 64, 'lr': 0.003175767497275054, 'lambda_val': 1.1741946550104087e-06, 'batch_size': 1080, 'optimizer': 'Adam'}.
2026-05-24 01:45:14,197 - experiment_functions - INFO - Early stopping at epoch 550. Best Metrics: (0.015402095377980452, 0.011523178807947022, 0.015429711482387106)
2026-05-24 01:45:15,150 - optuna.study.study - INFO - Trial 108 finished with values: [0.015402095377980452, 0.011523178807947022, 0.015429711482387106] and parameters: {'n_layers': 1, 'embedding_dim': 32, 'lr': 0.005624214788711465, 'lambda_val': 1.1540981830430722e-05, 'batch_size': 4005, 'optimizer': 'RMSprop'}.
2026-05-24 01:45:23,653 - experiment_functions - INFO - Early stopping at epoch 700. Best Metrics: (0.019373752924081538, 0.014933774834437084, 0.019993640638769045)
2026-05-24 01:45:23,754 - optuna.study.study - INFO - Trial 109 finished with values: [0.019373752924081538, 0.014933774834437084, 0.019993640638769045] and parameters: {'n_layers': 3, 'embedding_dim': 32, 'lr': 0.001254073391314583, 'lambda_val': 0.012208803351137528, 'batch_size': 4026, 'optimizer': 'Adam'}.
2026-05-24 01:45:30,451 - experiment_functions - INFO - Early stopping at epoch 550. Best Metrics: (0.01300610104805196, 0.011200331125827816, 0.013763733340376203)
2026-05-24 01:45:30,965 - optuna.study.study - INFO - Trial 110 finished with values: [0.01300610104805196, 0.011200331125827816, 0.013763733340376203] and parameters: {'n_layers': 4, 'embedding_dim': 32, 'lr': 0.003175767497275054, 'lambda_val': 0.004825444205218699, 'batch_size': 3812, 'optimizer': 'RMSprop'}.
2026-05-24 01:45:40,965 - experiment_functions - INFO - Early stopping at epoch 850. Best Metrics: (0.023168611688613668, 0.01695364238410596, 0.023219138922626583)
2026-05-24 01:45:41,456 - optuna.study.study - INFO - Trial 111 finished with values: [0.023168611688613668, 0.01695364238410596, 0.023219138922626583] and parameters: {'n_layers': 3, 'embedding_dim': 64, 'lr': 0.001254073391314583, 'lambda_val': 0.0009443756499535536, 'batch_size': 652, 'optimizer': 'Adam'}.
2026-05-24 01:46:22,245 - optuna.study.study - INFO - Trial 112 finished with values: [0.013505470808631561, 0.01028973509933775, 0.014063704366835406] and parameters: {'n_layers': 4, 'embedding_dim': 96, 'lr': 8.832720040270487e-05, 'lambda_val': 3.281017887674271e-05, 'batch_size': 3812, 'optimizer': 'RMSprop'}.
2026-05-24 01:47:01,684 - optuna.study.study - INFO - Trial 113 finished with values: [0.0068737760251350805, 0.00533112582781457, 0.006987047637866593] and parameters: {'n_layers': 1, 'embedding_dim': 96, 'lr': 2.9729294478529363e-05, 'lambda_val': 1.1443429579581734e-05, 'batch_size': 2256, 'optimizer': 'Adam'}.
2026-05-24 01:47:44,212 - optuna.study.study - INFO - Trial 114 finished with values: [0.016712599096560893, 0.011945364238410597, 0.01695749649415731] and parameters: {'n_layers': 1, 'embedding_dim': 96, 'lr': 0.0001752919102417181, 'lambda_val': 1.1540981830430722e-05, 'batch_size': 1777, 'optimizer': 'RMSprop'}.
2026-05-24 01:48:00,673 - experiment_functions - INFO - Early stopping at epoch 1450. Best Metrics: (0.02555576871279603, 0.017988410596026492, 0.025387337801052488)
2026-05-24 01:48:00,761 - optuna.study.study - INFO - Trial 115 finished with values: [0.02555576871279603, 0.017988410596026492, 0.025387337801052488] and parameters: {'n_layers': 3, 'embedding_dim': 32, 'lr': 0.0007459913147507348, 'lambda_val': 2.582067375745636e-06, 'batch_size': 652, 'optimizer': 'RMSprop'}.
2026-05-24 01:48:09,202 - experiment_functions - INFO - Early stopping at epoch 700. Best Metrics: (0.017077095530908613, 0.013799668874172185, 0.017981763582436104)
2026-05-24 01:48:10,270 - optuna.study.study - INFO - Trial 116 finished with values: [0.017077095530908613, 0.013799668874172185, 0.017981763582436104] and parameters: {'n_layers': 3, 'embedding_dim': 96, 'lr': 0.0008147997918947485, 'lambda_val': 0.0001255786949388013, 'batch_size': 3274, 'optimizer': 'RMSprop'}.
2026-05-24 01:48:16,462 - experiment_functions - INFO - Early stopping at epoch 500. Best Metrics: (0.005418675903804368, 0.004329470198675496, 0.005757528599518909)
2026-05-24 01:48:16,909 - optuna.study.study - INFO - Trial 117 finished with values: [0.005418675903804368, 0.004329470198675496, 0.005757528599518909] and parameters: {'n_layers': 4, 'embedding_dim': 96, 'lr': 0.0006216991594055474, 'lambda_val': 3.281017887674271e-05, 'batch_size': 3812, 'optimizer': 'SGD'}.
2026-05-24 01:48:48,588 - experiment_functions - INFO - Early stopping at epoch 3100. Best Metrics: (0.016014309469945975, 0.011208609271523179, 0.015388656153188565)
2026-05-24 01:48:48,837 - optuna.study.study - INFO - Trial 118 finished with values: [0.016014309469945975, 0.011208609271523179, 0.015388656153188565] and parameters: {'n_layers': 1, 'embedding_dim': 128, 'lr': 0.00019509942015877229, 'lambda_val': 3.515785851729092e-05, 'batch_size': 3893, 'optimizer': 'Adam'}.
2026-05-24 01:49:33,338 - optuna.study.study - INFO - Trial 119 finished with values: [0.016489535881008727, 0.013319536423841058, 0.017320392624901718] and parameters: {'n_layers': 4, 'embedding_dim': 96, 'lr': 0.0001329598595798264, 'lambda_val': 0.0031011395670577234, 'batch_size': 4005, 'optimizer': 'RMSprop'}.
2026-05-24 01:49:40,405 - experiment_functions - INFO - Early stopping at epoch 550. Best Metrics: (0.011545763677508989, 0.009048013245033114, 0.011422737913159996)
2026-05-24 01:49:40,576 - optuna.study.study - INFO - Trial 120 finished with values: [0.011545763677508989, 0.009048013245033114, 0.011422737913159996] and parameters: {'n_layers': 3, 'embedding_dim': 64, 'lr': 0.07976936156911353, 'lambda_val': 1.407610088867906e-05, 'batch_size': 2155, 'optimizer': 'Adam'}.
2026-05-24 01:49:57,008 - experiment_functions - INFO - Early stopping at epoch 1250. Best Metrics: (0.021452133454480715, 0.01714403973509934, 0.022058594548687933)
2026-05-24 01:49:57,224 - optuna.study.study - INFO - Trial 121 finished with values: [0.021452133454480715, 0.01714403973509934, 0.022058594548687933] and parameters: {'n_layers': 4, 'embedding_dim': 96, 'lr': 0.00035899557766397706, 'lambda_val': 0.0009443756499535536, 'batch_size': 1393, 'optimizer': 'RMSprop'}.
2026-05-24 01:50:39,050 - optuna.study.study - INFO - Trial 122 finished with values: [0.01411943679584082, 0.01028973509933775, 0.014046454825065145] and parameters: {'n_layers': 1, 'embedding_dim': 256, 'lr': 0.00013176103494263525, 'lambda_val': 6.932974781931377e-06, 'batch_size': 4026, 'optimizer': 'Adam'}.
2026-05-24 01:50:46,042 - experiment_functions - INFO - Early stopping at epoch 600. Best Metrics: (0.018710507757313914, 0.0131953642384106, 0.018570006990672277)
2026-05-24 01:50:46,642 - optuna.study.study - INFO - Trial 123 finished with values: [0.018710507757313914, 0.0131953642384106, 0.018570006990672277] and parameters: {'n_layers': 1, 'embedding_dim': 32, 'lr': 0.005852380695113062, 'lambda_val': 0.00010466579371271554, 'batch_size': 2147, 'optimizer': 'Adam'}.
2026-05-24 01:50:53,350 - experiment_functions - INFO - Early stopping at epoch 550. Best Metrics: (0.0174820689497476, 0.012102649006622515, 0.01719958171820878)
2026-05-24 01:50:54,210 - optuna.study.study - INFO - Trial 124 finished with values: [0.0174820689497476, 0.012102649006622515, 0.01719958171820878] and parameters: {'n_layers': 2, 'embedding_dim': 96, 'lr': 0.005852380695113062, 'lambda_val': 0.0009443756499535536, 'batch_size': 1362, 'optimizer': 'Adam'}.
2026-05-24 01:51:03,445 - experiment_functions - INFO - Early stopping at epoch 800. Best Metrics: (0.021000291058973417, 0.01626655629139073, 0.021900064681219498)
2026-05-24 01:51:04,332 - optuna.study.study - INFO - Trial 125 finished with values: [0.021000291058973417, 0.01626655629139073, 0.021900064681219498] and parameters: {'n_layers': 3, 'embedding_dim': 64, 'lr': 0.001254073391314583, 'lambda_val': 0.003592565815384345, 'batch_size': 925, 'optimizer': 'Adam'}.
2026-05-24 01:51:10,839 - experiment_functions - INFO - Early stopping at epoch 550. Best Metrics: (0.012075802195223426, 0.0102317880794702, 0.012377593968576192)
2026-05-24 01:51:10,928 - optuna.study.study - INFO - Trial 126 finished with values: [0.012075802195223426, 0.0102317880794702, 0.012377593968576192] and parameters: {'n_layers': 3, 'embedding_dim': 96, 'lr': 0.005852380695113062, 'lambda_val': 2.182273739992126e-05, 'batch_size': 2147, 'optimizer': 'RMSprop'}.
2026-05-24 01:51:22,260 - experiment_functions - INFO - Early stopping at epoch 1000. Best Metrics: (0.02450220266198884, 0.018774834437086094, 0.026116411699192116)
2026-05-24 01:51:23,160 - optuna.study.study - INFO - Trial 127 finished with values: [0.02450220266198884, 0.018774834437086094, 0.026116411699192116] and parameters: {'n_layers': 3, 'embedding_dim': 32, 'lr': 0.0007459913147507348, 'lambda_val': 0.00010466579371271554, 'batch_size': 795, 'optimizer': 'RMSprop'}.
2026-05-24 01:51:33,578 - experiment_functions - INFO - Early stopping at epoch 900. Best Metrics: (0.021591106294161642, 0.017698675496688743, 0.022479164375769935)
2026-05-24 01:51:34,354 - optuna.study.study - INFO - Trial 128 finished with values: [0.021591106294161642, 0.017698675496688743, 0.022479164375769935] and parameters: {'n_layers': 4, 'embedding_dim': 96, 'lr': 0.0005233015481570266, 'lambda_val': 0.005694292664597612, 'batch_size': 1343, 'optimizer': 'Adam'}.
2026-05-24 01:51:42,502 - experiment_functions - INFO - Early stopping at epoch 700. Best Metrics: (0.015689346910096838, 0.012268211920529801, 0.016365650752614286)
2026-05-24 01:51:42,587 - optuna.study.study - INFO - Trial 129 finished with values: [0.015689346910096838, 0.012268211920529801, 0.016365650752614286] and parameters: {'n_layers': 1, 'embedding_dim': 64, 'lr': 0.001254073391314583, 'lambda_val': 0.003592565815384345, 'batch_size': 4026, 'optimizer': 'Adam'}.
2026-05-24 01:51:54,163 - experiment_functions - INFO - Early stopping at epoch 1000. Best Metrics: (0.023585016518502817, 0.01831953642384106, 0.023745974281767116)
2026-05-24 01:51:55,515 - optuna.study.study - INFO - Trial 130 finished with values: [0.023585016518502817, 0.01831953642384106, 0.023745974281767116] and parameters: {'n_layers': 4, 'embedding_dim': 96, 'lr': 0.0005233015481570266, 'lambda_val': 0.0009443756499535536, 'batch_size': 652, 'optimizer': 'RMSprop'}.
2026-05-24 01:52:13,494 - experiment_functions - INFO - Early stopping at epoch 1700. Best Metrics: (0.015953554358330957, 0.012019867549668873, 0.016209768236621673)
2026-05-24 01:52:13,580 - optuna.study.study - INFO - Trial 131 finished with values: [0.015953554358330957, 0.012019867549668873, 0.016209768236621673] and parameters: {'n_layers': 1, 'embedding_dim': 96, 'lr': 0.0003847621589190308, 'lambda_val': 0.00034146769308132945, 'batch_size': 4005, 'optimizer': 'RMSprop'}.
2026-05-24 01:52:20,235 - experiment_functions - INFO - Early stopping at epoch 550. Best Metrics: (0.012291327373094761, 0.010033112582781459, 0.012735534475225952)
2026-05-24 01:52:20,314 - optuna.study.study - INFO - Trial 132 finished with values: [0.012291327373094761, 0.010033112582781459, 0.012735534475225952] and parameters: {'n_layers': 2, 'embedding_dim': 96, 'lr': 0.007215394766534314, 'lambda_val': 1.4801449770617434e-06, 'batch_size': 3150, 'optimizer': 'RMSprop'}.
2026-05-24 01:53:01,983 - optuna.study.study - INFO - Trial 133 finished with values: [0.02068998294031308, 0.015720198675496688, 0.0217282205837403] and parameters: {'n_layers': 4, 'embedding_dim': 64, 'lr': 0.0001986105443631555, 'lambda_val': 1.1741946550104087e-06, 'batch_size': 847, 'optimizer': 'Adam'}.
2026-05-24 01:53:12,865 - experiment_functions - INFO - Early stopping at epoch 950. Best Metrics: (0.020114461851412444, 0.01521523178807947, 0.020126917265243405)
2026-05-24 01:53:12,967 - optuna.study.study - INFO - Trial 134 finished with values: [0.020114461851412444, 0.01521523178807947, 0.020126917265243405] and parameters: {'n_layers': 3, 'embedding_dim': 64, 'lr': 0.0006783254829467676, 'lambda_val': 1.1741946550104087e-06, 'batch_size': 1661, 'optimizer': 'Adam'}.
2026-05-24 01:53:26,289 - experiment_functions - INFO - Early stopping at epoch 1100. Best Metrics: (0.018387095726572013, 0.01310430463576159, 0.018390543968305587)
2026-05-24 01:53:26,385 - optuna.study.study - INFO - Trial 135 finished with values: [0.018387095726572013, 0.01310430463576159, 0.018390543968305587] and parameters: {'n_layers': 1, 'embedding_dim': 32, 'lr': 0.0007459913147507348, 'lambda_val': 0.004825444205218699, 'batch_size': 2213, 'optimizer': 'Adam'}.
2026-05-24 01:53:36,067 - experiment_functions - INFO - Early stopping at epoch 850. Best Metrics: (0.014675390013399361, 0.013741721854304636, 0.01680510413876748)
2026-05-24 01:53:37,175 - optuna.study.study - INFO - Trial 136 finished with values: [0.014675390013399361, 0.013741721854304636, 0.01680510413876748] and parameters: {'n_layers': 3, 'embedding_dim': 96, 'lr': 0.0005233015481570266, 'lambda_val': 0.09676237598324428, 'batch_size': 3893, 'optimizer': 'RMSprop'}.
2026-05-24 01:53:43,727 - experiment_functions - INFO - Early stopping at epoch 550. Best Metrics: (0.01680633799033152, 0.011953642384105963, 0.01626375209264672)
2026-05-24 01:53:43,991 - optuna.study.study - INFO - Trial 137 finished with values: [0.01680633799033152, 0.011953642384105963, 0.01626375209264672] and parameters: {'n_layers': 2, 'embedding_dim': 32, 'lr': 0.028175320224959402, 'lambda_val': 1.1443429579581734e-05, 'batch_size': 1423, 'optimizer': 'Adam'}.
2026-05-24 01:53:50,564 - experiment_functions - INFO - Early stopping at epoch 550. Best Metrics: (0.016705297653278706, 0.012226821192052982, 0.01667158445798995)
2026-05-24 01:53:50,642 - optuna.study.study - INFO - Trial 138 finished with values: [0.016705297653278706, 0.012226821192052982, 0.01667158445798995] and parameters: {'n_layers': 1, 'embedding_dim': 32, 'lr': 0.003175767497275054, 'lambda_val': 0.004825444205218699, 'batch_size': 3812, 'optimizer': 'RMSprop'}.
2026-05-24 01:54:03,657 - experiment_functions - INFO - Early stopping at epoch 1100. Best Metrics: (0.02279588318273116, 0.017574503311258278, 0.023838383520335585)
2026-05-24 01:54:03,736 - optuna.study.study - INFO - Trial 139 finished with values: [0.02279588318273116, 0.017574503311258278, 0.023838383520335585] and parameters: {'n_layers': 3, 'embedding_dim': 96, 'lr': 0.0005233015481570266, 'lambda_val': 9.206863327207947e-05, 'batch_size': 911, 'optimizer': 'RMSprop'}.
2026-05-24 01:54:17,741 - experiment_functions - INFO - Early stopping at epoch 1250. Best Metrics: (0.01805914225600719, 0.01302980132450331, 0.01839368316674999)
2026-05-24 01:54:18,030 - optuna.study.study - INFO - Trial 140 finished with values: [0.01805914225600719, 0.01302980132450331, 0.01839368316674999] and parameters: {'n_layers': 1, 'embedding_dim': 96, 'lr': 0.0005233015481570266, 'lambda_val': 1.858625399381744e-05, 'batch_size': 1343, 'optimizer': 'Adam'}.
2026-05-24 01:54:47,561 - experiment_functions - INFO - Early stopping at epoch 2400. Best Metrics: (0.015022824161251625, 0.012276490066225167, 0.01589708150334103)
2026-05-24 01:54:47,691 - optuna.study.study - INFO - Trial 141 finished with values: [0.015022824161251625, 0.012276490066225167, 0.01589708150334103] and parameters: {'n_layers': 3, 'embedding_dim': 128, 'lr': 0.00019509942015877229, 'lambda_val': 3.515785851729092e-05, 'batch_size': 3893, 'optimizer': 'Adam'}.
2026-05-24 01:54:54,060 - experiment_functions - INFO - Early stopping at epoch 550. Best Metrics: (0.015081039081731003, 0.011688741721854305, 0.015400518509399528)
2026-05-24 01:54:54,151 - optuna.study.study - INFO - Trial 142 finished with values: [0.015081039081731003, 0.011688741721854305, 0.015400518509399528] and parameters: {'n_layers': 2, 'embedding_dim': 32, 'lr': 0.004320951557015901, 'lambda_val': 0.00369845158515346, 'batch_size': 2144, 'optimizer': 'RMSprop'}.
2026-05-24 01:55:18,288 - experiment_functions - INFO - Early stopping at epoch 2300. Best Metrics: (0.017381180405844545, 0.013369205298013245, 0.017913759575367002)
2026-05-24 01:55:19,358 - optuna.study.study - INFO - Trial 143 finished with values: [0.017381180405844545, 0.013369205298013245, 0.017913759575367002] and parameters: {'n_layers': 2, 'embedding_dim': 128, 'lr': 0.0002366530914941107, 'lambda_val': 8.047434957224598e-05, 'batch_size': 3238, 'optimizer': 'RMSprop'}.
2026-05-24 01:55:29,324 - experiment_functions - INFO - Early stopping at epoch 850. Best Metrics: (0.01868654722157709, 0.01540562913907285, 0.019701497844842094)
