2026-05-24 04:14:06,219 - optuna.study.study - INFO - Trial 107 finished with values: [0.01583636657479272, 0.01165562913907285, 0.01619294696126203] and parameters: {'n_layers': 1, 'embedding_dim': 128, 'lr': 0.0010345450541168627, 'lambda_val': 0.0007741161253289416, 'batch_size': 3180, 'optimizer': 'Adam'}.
2026-05-24 04:14:13,585 - experiment_functions - INFO - Early stopping at epoch 550. Best Metrics: (0.010488222008134932, 0.007864238410596027, 0.00994922661969659)
2026-05-24 04:14:13,708 - optuna.study.study - INFO - Trial 108 finished with values: [0.010488222008134932, 0.007864238410596027, 0.00994922661969659] and parameters: {'n_layers': 4, 'embedding_dim': 256, 'lr': 0.050283159783145355, 'lambda_val': 3.0470316001799963e-06, 'batch_size': 1199, 'optimizer': 'Adam'}.
2026-05-24 04:14:56,718 - optuna.study.study - INFO - Trial 109 finished with values: [0.014321194739967097, 0.012036423841059603, 0.015750081221568422] and parameters: {'n_layers': 4, 'embedding_dim': 128, 'lr': 9.989961915759321e-05, 'lambda_val': 2.2026053733354513e-05, 'batch_size': 3214, 'optimizer': 'RMSprop'}.
2026-05-24 04:15:39,883 - optuna.study.study - INFO - Trial 110 finished with values: [0.016803435040862465, 0.013294701986754968, 0.017625782363078674] and parameters: {'n_layers': 4, 'embedding_dim': 128, 'lr': 0.0001153085169750716, 'lambda_val': 0.0005557477534433548, 'batch_size': 3029, 'optimizer': 'Adam'}.
2026-05-24 04:15:47,108 - experiment_functions - INFO - Early stopping at epoch 550. Best Metrics: (0.012249341233864732, 0.010074503311258278, 0.012602009389072468)
2026-05-24 04:15:47,205 - optuna.study.study - INFO - Trial 111 finished with values: [0.012249341233864732, 0.010074503311258278, 0.012602009389072468] and parameters: {'n_layers': 4, 'embedding_dim': 128, 'lr': 0.003599405628543548, 'lambda_val': 0.0007150353686754638, 'batch_size': 1698, 'optimizer': 'RMSprop'}.
2026-05-24 04:15:54,412 - experiment_functions - INFO - Early stopping at epoch 600. Best Metrics: (0.018812640529474473, 0.014561258278145698, 0.019641217847890788)
2026-05-24 04:15:54,797 - optuna.study.study - INFO - Trial 112 finished with values: [0.018812640529474473, 0.014561258278145698, 0.019641217847890788] and parameters: {'n_layers': 3, 'embedding_dim': 96, 'lr': 0.002717396800836918, 'lambda_val': 3.898561124366437e-06, 'batch_size': 764, 'optimizer': 'Adam'}.
2026-05-24 04:16:03,304 - experiment_functions - INFO - Early stopping at epoch 700. Best Metrics: (0.018060388541292, 0.014966887417218544, 0.019171811597010084)
2026-05-24 04:16:03,976 - optuna.study.study - INFO - Trial 113 finished with values: [0.018060388541292, 0.014966887417218544, 0.019171811597010084] and parameters: {'n_layers': 4, 'embedding_dim': 128, 'lr': 0.0010412335380352404, 'lambda_val': 0.0013597259650046756, 'batch_size': 2232, 'optimizer': 'Adam'}.
2026-05-24 04:16:14,436 - experiment_functions - INFO - Early stopping at epoch 900. Best Metrics: (0.018040342961128185, 0.01580298013245033, 0.020262851221751647)
2026-05-24 04:16:14,986 - optuna.study.study - INFO - Trial 114 finished with values: [0.018040342961128185, 0.01580298013245033, 0.020262851221751647] and parameters: {'n_layers': 4, 'embedding_dim': 64, 'lr': 0.000460021398839349, 'lambda_val': 0.016113443657182445, 'batch_size': 3875, 'optimizer': 'Adam'}.
2026-05-24 04:16:55,323 - optuna.study.study - INFO - Trial 115 finished with values: [0.018829433177878933, 0.013493377483443708, 0.01962093153454663] and parameters: {'n_layers': 1, 'embedding_dim': 64, 'lr': 0.0002960115862018489, 'lambda_val': 1.6488811140589769e-06, 'batch_size': 1543, 'optimizer': 'Adam'}.
2026-05-24 04:17:37,025 - optuna.study.study - INFO - Trial 116 finished with values: [0.02031414857486407, 0.016564569536423844, 0.021172677822024984] and parameters: {'n_layers': 4, 'embedding_dim': 64, 'lr': 0.00021971244076229157, 'lambda_val': 2.2026053733354513e-05, 'batch_size': 1735, 'optimizer': 'Adam'}.
2026-05-24 04:18:19,282 - optuna.study.study - INFO - Trial 117 finished with values: [0.024640509053709358, 0.019809602649006622, 0.02649734478720869] and parameters: {'n_layers': 4, 'embedding_dim': 64, 'lr': 0.0002960115862018489, 'lambda_val': 0.0012311986942485985, 'batch_size': 764, 'optimizer': 'Adam'}.
2026-05-24 04:18:26,867 - experiment_functions - INFO - Early stopping at epoch 550. Best Metrics: (0.018015199333297618, 0.014172185430463575, 0.018731362839738416)
2026-05-24 04:18:26,964 - optuna.study.study - INFO - Trial 118 finished with values: [0.018015199333297618, 0.014172185430463575, 0.018731362839738416] and parameters: {'n_layers': 4, 'embedding_dim': 256, 'lr': 0.0054266566794856745, 'lambda_val': 3.898561124366437e-06, 'batch_size': 928, 'optimizer': 'Adam'}.
2026-05-24 04:18:34,544 - experiment_functions - INFO - Early stopping at epoch 650. Best Metrics: (0.020038492284021762, 0.016986754966887417, 0.021365624233886382)
2026-05-24 04:18:34,633 - optuna.study.study - INFO - Trial 119 finished with values: [0.020038492284021762, 0.016986754966887417, 0.021365624233886382] and parameters: {'n_layers': 4, 'embedding_dim': 64, 'lr': 0.0013524049945715497, 'lambda_val': 0.030528649183713095, 'batch_size': 1735, 'optimizer': 'Adam'}.
2026-05-24 04:18:41,438 - experiment_functions - INFO - Early stopping at epoch 550. Best Metrics: (0.005418304333710912, 0.005645695364238411, 0.006436721686873994)
2026-05-24 04:18:41,779 - optuna.study.study - INFO - Trial 120 finished with values: [0.005418304333710912, 0.005645695364238411, 0.006436721686873994] and parameters: {'n_layers': 4, 'embedding_dim': 128, 'lr': 0.013841799640926663, 'lambda_val': 0.016113443657182445, 'batch_size': 1829, 'optimizer': 'Adam'}.
2026-05-24 04:19:23,171 - optuna.study.study - INFO - Trial 121 finished with values: [0.017170064830393555, 0.013145695364238411, 0.01742756202289621] and parameters: {'n_layers': 4, 'embedding_dim': 64, 'lr': 0.00015155803146396787, 'lambda_val': 0.0026198298939258, 'batch_size': 2232, 'optimizer': 'RMSprop'}.
2026-05-24 04:20:01,791 - optuna.study.study - INFO - Trial 122 finished with values: [0.0067274284850649384, 0.0051407284768211926, 0.0068468290931868805] and parameters: {'n_layers': 3, 'embedding_dim': 32, 'lr': 2.8421481174128233e-05, 'lambda_val': 1.788497394454551e-05, 'batch_size': 1970, 'optimizer': 'RMSprop'}.
2026-05-24 04:20:43,102 - optuna.study.study - INFO - Trial 123 finished with values: [0.02316565550194389, 0.017980132450331126, 0.023751179607002626] and parameters: {'n_layers': 4, 'embedding_dim': 32, 'lr': 0.0002960115862018489, 'lambda_val': 6.677790881496428e-05, 'batch_size': 642, 'optimizer': 'Adam'}.
2026-05-24 04:21:26,510 - optuna.study.study - INFO - Trial 124 finished with values: [0.016463054349264285, 0.011862582781456955, 0.0161163677851162] and parameters: {'n_layers': 2, 'embedding_dim': 256, 'lr': 0.00015155803146396787, 'lambda_val': 0.0026198298939258, 'batch_size': 2661, 'optimizer': 'RMSprop'}.
2026-05-24 04:21:32,950 - experiment_functions - INFO - Early stopping at epoch 550. Best Metrics: (0.019455811986525438, 0.014213576158940396, 0.01972365477114613)
2026-05-24 04:21:33,782 - optuna.study.study - INFO - Trial 125 finished with values: [0.019455811986525438, 0.014213576158940396, 0.01972365477114613] and parameters: {'n_layers': 2, 'embedding_dim': 32, 'lr': 0.002717396800836918, 'lambda_val': 0.010157868861362357, 'batch_size': 796, 'optimizer': 'RMSprop'}.
2026-05-24 04:21:42,509 - experiment_functions - INFO - Early stopping at epoch 700. Best Metrics: (0.017499143921427526, 0.014321192052980132, 0.01865985943226118)
2026-05-24 04:21:42,602 - optuna.study.study - INFO - Trial 126 finished with values: [0.017499143921427526, 0.014321192052980132, 0.01865985943226118] and parameters: {'n_layers': 4, 'embedding_dim': 96, 'lr': 0.0007924927231928422, 'lambda_val': 1.788497394454551e-05, 'batch_size': 3180, 'optimizer': 'Adam'}.
2026-05-24 04:22:23,978 - optuna.study.study - INFO - Trial 127 finished with values: [0.012145063208165854, 0.008874172185430466, 0.011835353205316715] and parameters: {'n_layers': 1, 'embedding_dim': 128, 'lr': 9.989961915759321e-05, 'lambda_val': 2.2026053733354513e-05, 'batch_size': 3214, 'optimizer': 'RMSprop'}.
2026-05-24 04:22:30,024 - experiment_functions - INFO - Early stopping at epoch 500. Best Metrics: (0.005292907637685371, 0.004163907284768211, 0.005392837226729852)
2026-05-24 04:22:30,117 - optuna.study.study - INFO - Trial 128 finished with values: [0.005292907637685371, 0.004163907284768211, 0.005392837226729852] and parameters: {'n_layers': 2, 'embedding_dim': 128, 'lr': 0.000460021398839349, 'lambda_val': 0.05904110892608641, 'batch_size': 642, 'optimizer': 'Adam'}.
2026-05-24 04:22:37,933 - experiment_functions - INFO - Early stopping at epoch 650. Best Metrics: (0.01410021452881548, 0.010579470198675498, 0.014152986564100682)
2026-05-24 04:22:38,031 - optuna.study.study - INFO - Trial 129 finished with values: [0.01410021452881548, 0.010579470198675498, 0.014152986564100682] and parameters: {'n_layers': 1, 'embedding_dim': 256, 'lr': 0.0007924927231928422, 'lambda_val': 1.788497394454551e-05, 'batch_size': 3377, 'optimizer': 'RMSprop'}.
2026-05-24 04:23:19,723 - optuna.study.study - INFO - Trial 130 finished with values: [0.02178235729634512, 0.017549668874172187, 0.023517459793653443] and parameters: {'n_layers': 4, 'embedding_dim': 32, 'lr': 0.0002960115862018489, 'lambda_val': 0.0012311986942485985, 'batch_size': 1199, 'optimizer': 'Adam'}.
2026-05-24 04:23:28,287 - experiment_functions - INFO - Early stopping at epoch 700. Best Metrics: (0.01939656691000356, 0.015910596026490066, 0.0200760785093261)
2026-05-24 04:23:28,382 - optuna.study.study - INFO - Trial 131 finished with values: [0.01939656691000356, 0.015910596026490066, 0.0200760785093261] and parameters: {'n_layers': 4, 'embedding_dim': 128, 'lr': 0.0010412335380352404, 'lambda_val': 0.0005557477534433548, 'batch_size': 2232, 'optimizer': 'Adam'}.
2026-05-24 04:23:37,422 - experiment_functions - INFO - Early stopping at epoch 800. Best Metrics: (0.00924149050955916, 0.007756622516556292, 0.009301139219789228)
2026-05-24 04:23:37,633 - optuna.study.study - INFO - Trial 132 finished with values: [0.00924149050955916, 0.007756622516556292, 0.009301139219789228] and parameters: {'n_layers': 1, 'embedding_dim': 128, 'lr': 0.0010345450541168627, 'lambda_val': 0.05904110892608641, 'batch_size': 1735, 'optimizer': 'Adam'}.
2026-05-24 04:23:49,148 - experiment_functions - INFO - Early stopping at epoch 1050. Best Metrics: (0.02103790510876888, 0.014437086092715233, 0.021048243799741642)
2026-05-24 04:23:50,616 - optuna.study.study - INFO - Trial 133 finished with values: [0.02103790510876888, 0.014437086092715233, 0.021048243799741642] and parameters: {'n_layers': 1, 'embedding_dim': 32, 'lr': 0.0007924927231928422, 'lambda_val': 1.788497394454551e-05, 'batch_size': 2098, 'optimizer': 'Adam'}.
2026-05-24 04:24:23,722 - experiment_functions - INFO - Early stopping at epoch 3100. Best Metrics: (0.02076456334472017, 0.016605960264900663, 0.02174281026816514)
2026-05-24 04:24:23,799 - optuna.study.study - INFO - Trial 134 finished with values: [0.02076456334472017, 0.016605960264900663, 0.02174281026816514] and parameters: {'n_layers': 4, 'embedding_dim': 32, 'lr': 0.0002960115862018489, 'lambda_val': 2.2026053733354513e-05, 'batch_size': 3214, 'optimizer': 'RMSprop'}.
2026-05-24 04:24:30,002 - experiment_functions - INFO - Early stopping at epoch 500. Best Metrics: (0.006809498720261339, 0.005670529801324503, 0.007208212897557543)
2026-05-24 04:24:30,751 - optuna.study.study - INFO - Trial 135 finished with values: [0.006809498720261339, 0.005670529801324503, 0.007208212897557543] and parameters: {'n_layers': 1, 'embedding_dim': 256, 'lr': 0.07858250774247641, 'lambda_val': 0.020894713377970307, 'batch_size': 1842, 'optimizer': 'Adam'}.
2026-05-24 04:24:47,589 - experiment_functions - INFO - Early stopping at epoch 1650. Best Metrics: (0.0060651894552606386, 0.005844370860927152, 0.006789773775471158)
2026-05-24 04:24:47,803 - optuna.study.study - INFO - Trial 136 finished with values: [0.0060651894552606386, 0.005844370860927152, 0.006789773775471158] and parameters: {'n_layers': 1, 'embedding_dim': 128, 'lr': 0.016588995371564164, 'lambda_val': 0.05904110892608641, 'batch_size': 642, 'optimizer': 'Adam'}.
2026-05-24 04:24:54,329 - experiment_functions - INFO - Early stopping at epoch 550. Best Metrics: (0.005188099575353141, 0.004147350993377484, 0.0054294139803430135)
2026-05-24 04:24:55,423 - optuna.study.study - INFO - Trial 137 finished with values: [0.005188099575353141, 0.004147350993377484, 0.0054294139803430135] and parameters: {'n_layers': 4, 'embedding_dim': 32, 'lr': 0.002717396800836918, 'lambda_val': 2.571811162691067e-06, 'batch_size': 1829, 'optimizer': 'SGD'}.
2026-05-24 04:25:02,024 - experiment_functions - INFO - Early stopping at epoch 550. Best Metrics: (0.021430565812787804, 0.015844370860927152, 0.02190990856873909)
2026-05-24 04:25:02,132 - optuna.study.study - INFO - Trial 138 finished with values: [0.021430565812787804, 0.015844370860927152, 0.02190990856873909] and parameters: {'n_layers': 4, 'embedding_dim': 32, 'lr': 0.008902294588770277, 'lambda_val': 1.4613413642545354e-05, 'batch_size': 642, 'optimizer': 'Adam'}.
2026-05-24 04:25:43,896 - optuna.study.study - INFO - Trial 139 finished with values: [0.023365179760707202, 0.018211920529801324, 0.02416529963527354] and parameters: {'n_layers': 4, 'embedding_dim': 32, 'lr': 0.0002960115862018489, 'lambda_val': 3.898561124366437e-06, 'batch_size': 568, 'optimizer': 'Adam'}.
2026-05-24 04:25:52,467 - experiment_functions - INFO - Early stopping at epoch 700. Best Metrics: (0.01791147035407287, 0.014205298013245035, 0.018842342666634735)
2026-05-24 04:25:52,590 - optuna.study.study - INFO - Trial 140 finished with values: [0.01791147035407287, 0.014205298013245035, 0.018842342666634735] and parameters: {'n_layers': 4, 'embedding_dim': 96, 'lr': 0.0010345450541168627, 'lambda_val': 2.571811162691067e-06, 'batch_size': 3180, 'optimizer': 'Adam'}.
2026-05-24 04:26:02,831 - experiment_functions - INFO - Early stopping at epoch 550. Best Metrics: (0.018290744125951906, 0.01445364238410596, 0.018747199620190957)
2026-05-24 04:26:02,925 - optuna.study.study - INFO - Trial 141 finished with values: [0.018290744125951906, 0.01445364238410596, 0.018747199620190957] and parameters: {'n_layers': 3, 'embedding_dim': 96, 'lr': 0.002717396800836918, 'lambda_val': 0.0029344298742113367, 'batch_size': 796, 'optimizer': 'RMSprop'}.
2026-05-24 04:26:44,301 - optuna.study.study - INFO - Trial 142 finished with values: [0.021846982965218815, 0.016870860927152318, 0.02204034129977799] and parameters: {'n_layers': 4, 'embedding_dim': 32, 'lr': 0.0002960115862018489, 'lambda_val': 0.0012311986942485985, 'batch_size': 1248, 'optimizer': 'RMSprop'}.
2026-05-24 04:26:51,165 - experiment_functions - INFO - Early stopping at epoch 550. Best Metrics: (0.010424619956784028, 0.008774834437086093, 0.011123759261458357)
2026-05-24 04:26:51,932 - optuna.study.study - INFO - Trial 143 finished with values: [0.010424619956784028, 0.008774834437086093, 0.011123759261458357] and parameters: {'n_layers': 1, 'embedding_dim': 256, 'lr': 0.0010412335380352404, 'lambda_val': 0.017024035419790078, 'batch_size': 3903, 'optimizer': 'RMSprop'}.
2026-05-24 04:27:01,620 - experiment_functions - INFO - Early stopping at epoch 850. Best Metrics: (0.014069639208550366, 0.01331953642384106, 0.01571814077926135)
2026-05-24 04:27:02,029 - optuna.study.study - INFO - Trial 144 finished with values: [0.014069639208550366, 0.01331953642384106, 0.01571814077926135] and parameters: {'n_layers': 3, 'embedding_dim': 128, 'lr': 0.0006691559391119897, 'lambda_val': 0.04918021699603916, 'batch_size': 694, 'optimizer': 'RMSprop'}.
2026-05-24 04:27:10,004 - experiment_functions - INFO - Early stopping at epoch 650. Best Metrics: (0.011915840951574812, 0.009048013245033114, 0.011755015151192963)
2026-05-24 04:27:10,145 - optuna.study.study - INFO - Trial 145 finished with values: [0.011915840951574812, 0.009048013245033114, 0.011755015151192963] and parameters: {'n_layers': 2, 'embedding_dim': 256, 'lr': 0.0010412335380352404, 'lambda_val': 0.017024035419790078, 'batch_size': 2232, 'optimizer': 'Adam'}.
2026-05-24 04:27:16,991 - experiment_functions - INFO - Early stopping at epoch 550. Best Metrics: (0.017384445994873016, 0.013501655629139072, 0.017737831085176046)
2026-05-24 04:27:17,092 - optuna.study.study - INFO - Trial 146 finished with values: [0.017384445994873016, 0.013501655629139072, 0.017737831085176046] and parameters: {'n_layers': 4, 'embedding_dim': 64, 'lr': 0.007268367508546935, 'lambda_val': 3.4142578789482216e-06, 'batch_size': 3264, 'optimizer': 'Adam'}.
2026-05-24 04:27:27,643 - experiment_functions - INFO - Early stopping at epoch 950. Best Metrics: (0.019361945924976903, 0.015115894039735102, 0.020853226579124917)
2026-05-24 04:27:27,891 - optuna.study.study - INFO - Trial 147 finished with values: [0.019361945924976903, 0.015115894039735102, 0.020853226579124917] and parameters: {'n_layers': 3, 'embedding_dim': 32, 'lr': 0.0007924927231928422, 'lambda_val': 1.788497394454551e-05, 'batch_size': 1970, 'optimizer': 'Adam'}.
2026-05-24 04:27:36,098 - experiment_functions - INFO - Early stopping at epoch 700. Best Metrics: (0.017922265830639363, 0.014056291390728478, 0.018674133139762215)
2026-05-24 04:27:36,192 - optuna.study.study - INFO - Trial 148 finished with values: [0.017922265830639363, 0.014056291390728478, 0.018674133139762215] and parameters: {'n_layers': 2, 'embedding_dim': 32, 'lr': 0.0013524049945715497, 'lambda_val': 0.030528649183713095, 'batch_size': 3377, 'optimizer': 'Adam'}.
2026-05-24 04:27:43,839 - experiment_functions - INFO - Early stopping at epoch 600. Best Metrics: (0.014481293060575431, 0.011291390728476822, 0.014726227379791217)
2026-05-24 04:27:43,929 - optuna.study.study - INFO - Trial 149 finished with values: [0.014481293060575431, 0.011291390728476822, 0.014726227379791217] and parameters: {'n_layers': 2, 'embedding_dim': 128, 'lr': 0.0010412335380352404, 'lambda_val': 0.017024035419790078, 'batch_size': 2232, 'optimizer': 'RMSprop'}.
2026-05-24 04:27:51,936 - experiment_functions - INFO - Early stopping at epoch 550. Best Metrics: (0.018524054663585945, 0.01418046357615894, 0.01892934536362537)
2026-05-24 04:27:52,034 - optuna.study.study - INFO - Trial 150 finished with values: [0.018524054663585945, 0.01418046357615894, 0.01892934536362537] and parameters: {'n_layers': 4, 'embedding_dim': 256, 'lr': 0.0054266566794856745, 'lambda_val': 3.898561124366437e-06, 'batch_size': 796, 'optimizer': 'Adam'}.
2026-05-24 04:28:13,706 - experiment_functions - INFO - Early stopping at epoch 1550. Best Metrics: (0.022852015026908746, 0.015745033112582782, 0.022397158568621157)
2026-05-24 04:28:13,824 - optuna.study.study - INFO - Trial 151 finished with values: [0.022852015026908746, 0.015745033112582782, 0.022397158568621157] and parameters: {'n_layers': 2, 'embedding_dim': 32, 'lr': 0.0007366841828777069, 'lambda_val': 0.0029344298742113367, 'batch_size': 642, 'optimizer': 'Adam'}.
2026-05-24 04:28:56,599 - optuna.study.study - INFO - Trial 152 finished with values: [0.024973481843198347, 0.019279801324503312, 0.025754889065930167] and parameters: {'n_layers': 4, 'embedding_dim': 64, 'lr': 0.0002960115862018489, 'lambda_val': 0.0012311986942485985, 'batch_size': 764, 'optimizer': 'Adam'}.
2026-05-24 04:29:05,515 - experiment_functions - INFO - Early stopping at epoch 750. Best Metrics: (0.020406333304651338, 0.015637417218543045, 0.02075098185554338)
2026-05-24 04:29:05,757 - optuna.study.study - INFO - Trial 153 finished with values: [0.020406333304651338, 0.015637417218543045, 0.02075098185554338] and parameters: {'n_layers': 4, 'embedding_dim': 32, 'lr': 0.0013524049945715497, 'lambda_val': 1.4613413642545354e-05, 'batch_size': 1735, 'optimizer': 'Adam'}.
2026-05-24 04:29:12,072 - experiment_functions - INFO - Early stopping at epoch 500. Best Metrics: (0.00518983201766371, 0.003932119205298014, 0.005254399944136724)
2026-05-24 04:29:12,370 - optuna.study.study - INFO - Trial 154 finished with values: [0.00518983201766371, 0.003932119205298014, 0.005254399944136724] and parameters: {'n_layers': 3, 'embedding_dim': 128, 'lr': 0.0010345450541168627, 'lambda_val': 2.571811162691067e-06, 'batch_size': 1829, 'optimizer': 'SGD'}.
2026-05-24 04:29:23,915 - experiment_functions - INFO - Early stopping at epoch 1000. Best Metrics: (0.020398879633835024, 0.015927152317880795, 0.020967287089636577)
2026-05-24 04:29:24,015 - optuna.study.study - INFO - Trial 155 finished with values: [0.020398879633835024, 0.015927152317880795, 0.020967287089636577] and parameters: {'n_layers': 3, 'embedding_dim': 96, 'lr': 0.0006691559391119897, 'lambda_val': 8.890867390731183e-05, 'batch_size': 928, 'optimizer': 'RMSprop'}.
2026-05-24 04:29:41,371 - experiment_functions - INFO - Early stopping at epoch 1500. Best Metrics: (0.020890439830381077, 0.016374172185430465, 0.021935016007317662)
2026-05-24 04:29:41,714 - optuna.study.study - INFO - Trial 156 finished with values: [0.020890439830381077, 0.016374172185430465, 0.021935016007317662] and parameters: {'n_layers': 4, 'embedding_dim': 64, 'lr': 0.0002960115862018489, 'lambda_val': 6.677790881496428e-05, 'batch_size': 3112, 'optimizer': 'Adam'}.
2026-05-24 04:30:20,248 - optuna.study.study - INFO - Trial 157 finished with values: [0.020593507056882808, 0.013360927152317879, 0.01976266748305736] and parameters: {'n_layers': 1, 'embedding_dim': 32, 'lr': 0.0002960115862018489, 'lambda_val': 0.0012311986942485985, 'batch_size': 1248, 'optimizer': 'RMSprop'}.
2026-05-24 04:30:28,406 - experiment_functions - INFO - Early stopping at epoch 700. Best Metrics: (0.015365358656445772, 0.01413907284768212, 0.016991704906941393)
