2026-05-24 16:43:54,830 - optuna.study.study - INFO - Trial 263 finished with values: [0.043376747311383676, 0.013071192052980133, 0.03455037524777597] and parameters: {'n_layers': 1, 'embedding_dim': 128, 'lr': 0.00034279930379767936, 'lambda_val': 1.8800744005146669e-06, 'batch_size': 1178, 'optimizer': 'Adam'}.
2026-05-24 16:44:03,163 - experiment_functions - INFO - Early stopping at epoch 700. Best Metrics: (0.005463972805808645, 0.004230132450331127, 0.005489677435349494)
2026-05-24 16:44:03,268 - optuna.study.study - INFO - Trial 264 finished with values: [0.005463972805808645, 0.004230132450331127, 0.005489677435349494] and parameters: {'n_layers': 1, 'embedding_dim': 128, 'lr': 0.00018076016503271015, 'lambda_val': 0.09878114180045672, 'batch_size': 1453, 'optimizer': 'Adam'}.
2026-05-24 16:44:14,717 - experiment_functions - INFO - Early stopping at epoch 950. Best Metrics: (0.043848627877669896, 0.012740066225165566, 0.033693804911181714)
2026-05-24 16:44:15,958 - optuna.study.study - INFO - Trial 265 finished with values: [0.043848627877669896, 0.012740066225165566, 0.033693804911181714] and parameters: {'n_layers': 1, 'embedding_dim': 128, 'lr': 0.00034279930379767936, 'lambda_val': 5.897592552004812e-06, 'batch_size': 1062, 'optimizer': 'RMSprop'}.
2026-05-24 16:44:24,046 - experiment_functions - INFO - Early stopping at epoch 650. Best Metrics: (0.00477410206824691, 0.0040562913907284765, 0.0048898393124292006)
2026-05-24 16:44:24,147 - optuna.study.study - INFO - Trial 266 finished with values: [0.00477410206824691, 0.0040562913907284765, 0.0048898393124292006] and parameters: {'n_layers': 2, 'embedding_dim': 128, 'lr': 1.6366557775912465e-05, 'lambda_val': 1.1594147319583239e-05, 'batch_size': 1638, 'optimizer': 'RMSprop'}.
2026-05-24 16:44:31,834 - experiment_functions - INFO - Early stopping at epoch 600. Best Metrics: (0.0414604730186419, 0.011754966887417218, 0.03018853683159071)
2026-05-24 16:44:32,066 - optuna.study.study - INFO - Trial 267 finished with values: [0.0414604730186419, 0.011754966887417218, 0.03018853683159071] and parameters: {'n_layers': 1, 'embedding_dim': 256, 'lr': 0.0012971109624756183, 'lambda_val': 5.897592552004812e-06, 'batch_size': 2300, 'optimizer': 'Adam'}.
2026-05-24 16:45:04,608 - experiment_functions - INFO - Early stopping at epoch 2750. Best Metrics: (0.044275784871408305, 0.01264072847682119, 0.03199985316727138)
2026-05-24 16:45:04,719 - optuna.study.study - INFO - Trial 268 finished with values: [0.044275784871408305, 0.01264072847682119, 0.03199985316727138] and parameters: {'n_layers': 1, 'embedding_dim': 128, 'lr': 0.00014827150350050635, 'lambda_val': 5.897592552004812e-06, 'batch_size': 3486, 'optimizer': 'RMSprop'}.
2026-05-24 16:45:48,882 - optuna.study.study - INFO - Trial 269 finished with values: [0.04635823131259589, 0.014776490066225166, 0.03642377319234085] and parameters: {'n_layers': 1, 'embedding_dim': 32, 'lr': 0.0002702360041941105, 'lambda_val': 3.357239469878402e-06, 'batch_size': 534, 'optimizer': 'Adam'}.
2026-05-24 16:45:55,757 - experiment_functions - INFO - Early stopping at epoch 550. Best Metrics: (0.04298030297001788, 0.012276490066225167, 0.03156371627909009)
2026-05-24 16:45:55,839 - optuna.study.study - INFO - Trial 270 finished with values: [0.04298030297001788, 0.012276490066225167, 0.03156371627909009] and parameters: {'n_layers': 1, 'embedding_dim': 128, 'lr': 0.00532575854276696, 'lambda_val': 1.1594147319583239e-05, 'batch_size': 1062, 'optimizer': 'Adam'}.
2026-05-24 16:46:17,517 - experiment_functions - INFO - Early stopping at epoch 1900. Best Metrics: (0.04199324003888153, 0.012508278145695363, 0.03047763481187294)
2026-05-24 16:46:17,662 - optuna.study.study - INFO - Trial 271 finished with values: [0.04199324003888153, 0.012508278145695363, 0.03047763481187294] and parameters: {'n_layers': 1, 'embedding_dim': 128, 'lr': 0.00014827150350050635, 'lambda_val': 0.0045403496332551765, 'batch_size': 1097, 'optimizer': 'RMSprop'}.
2026-05-24 16:46:24,425 - experiment_functions - INFO - Early stopping at epoch 550. Best Metrics: (0.042441420188632575, 0.012408940397350994, 0.029977384039196437)
2026-05-24 16:46:24,514 - optuna.study.study - INFO - Trial 272 finished with values: [0.042441420188632575, 0.012408940397350994, 0.029977384039196437] and parameters: {'n_layers': 1, 'embedding_dim': 64, 'lr': 0.005676961555550774, 'lambda_val': 0.00017267652605927172, 'batch_size': 1178, 'optimizer': 'Adam'}.
2026-05-24 16:46:31,230 - experiment_functions - INFO - Early stopping at epoch 550. Best Metrics: (0.0381354967310499, 0.011216887417218543, 0.026081188538574586)
2026-05-24 16:46:31,404 - optuna.study.study - INFO - Trial 273 finished with values: [0.0381354967310499, 0.011216887417218543, 0.026081188538574586] and parameters: {'n_layers': 1, 'embedding_dim': 64, 'lr': 0.007170022048831986, 'lambda_val': 3.357239469878402e-06, 'batch_size': 1638, 'optimizer': 'Adam'}.
2026-05-24 16:46:43,482 - experiment_functions - INFO - Early stopping at epoch 1000. Best Metrics: (0.042687156336423976, 0.0126158940397351, 0.030228084428019008)
2026-05-24 16:46:43,569 - optuna.study.study - INFO - Trial 274 finished with values: [0.042687156336423976, 0.0126158940397351, 0.030228084428019008] and parameters: {'n_layers': 1, 'embedding_dim': 96, 'lr': 0.00034279930379767936, 'lambda_val': 4.9612924956814075e-05, 'batch_size': 2015, 'optimizer': 'RMSprop'}.
2026-05-24 16:46:51,019 - experiment_functions - INFO - Early stopping at epoch 600. Best Metrics: (0.04067878286387355, 0.012152317880794702, 0.029367115029858733)
2026-05-24 16:46:51,112 - optuna.study.study - INFO - Trial 275 finished with values: [0.04067878286387355, 0.012152317880794702, 0.029367115029858733] and parameters: {'n_layers': 1, 'embedding_dim': 128, 'lr': 0.0006530848553103159, 'lambda_val': 0.00037799797849855565, 'batch_size': 1638, 'optimizer': 'RMSprop'}.
2026-05-24 16:47:35,595 - optuna.study.study - INFO - Trial 276 finished with values: [0.04302983682355674, 0.012889072847682119, 0.03180167312080364] and parameters: {'n_layers': 1, 'embedding_dim': 96, 'lr': 0.00014827150350050635, 'lambda_val': 0.00017267652605927172, 'batch_size': 1909, 'optimizer': 'Adam'}.
2026-05-24 16:47:42,356 - experiment_functions - INFO - Early stopping at epoch 550. Best Metrics: (0.013869548037105094, 0.00544701986754967, 0.008465384226923839)
2026-05-24 16:47:42,441 - optuna.study.study - INFO - Trial 277 finished with values: [0.013869548037105094, 0.00544701986754967, 0.008465384226923839] and parameters: {'n_layers': 2, 'embedding_dim': 128, 'lr': 0.006558805495938878, 'lambda_val': 3.1769341559608166e-05, 'batch_size': 1178, 'optimizer': 'Adam'}.
2026-05-24 16:48:12,286 - experiment_functions - INFO - Early stopping at epoch 2450. Best Metrics: (0.04241822073852765, 0.012508278145695367, 0.030198083998125094)
2026-05-24 16:48:12,890 - optuna.study.study - INFO - Trial 278 finished with values: [0.04241822073852765, 0.012508278145695367, 0.030198083998125094] and parameters: {'n_layers': 4, 'embedding_dim': 128, 'lr': 0.00014827150350050635, 'lambda_val': 1.6170124945691617e-05, 'batch_size': 657, 'optimizer': 'RMSprop'}.
2026-05-24 16:48:19,492 - experiment_functions - INFO - Early stopping at epoch 500. Best Metrics: (0.005188743348251217, 0.004006622516556292, 0.005310796192033891)
2026-05-24 16:48:19,568 - optuna.study.study - INFO - Trial 279 finished with values: [0.005188743348251217, 0.004006622516556292, 0.005310796192033891] and parameters: {'n_layers': 3, 'embedding_dim': 96, 'lr': 0.008595184894980722, 'lambda_val': 1.1594147319583239e-05, 'batch_size': 1062, 'optimizer': 'Adam'}.
2026-05-24 16:48:25,956 - experiment_functions - INFO - Early stopping at epoch 500. Best Metrics: (0.004329831809656707, 0.003824503311258278, 0.0045088148827592215)
2026-05-24 16:48:26,614 - optuna.study.study - INFO - Trial 280 finished with values: [0.004329831809656707, 0.003824503311258278, 0.0045088148827592215] and parameters: {'n_layers': 1, 'embedding_dim': 128, 'lr': 0.0012971109624756183, 'lambda_val': 0.002332362722517884, 'batch_size': 1638, 'optimizer': 'SGD'}.
2026-05-24 16:48:33,479 - experiment_functions - INFO - Early stopping at epoch 500. Best Metrics: (0.005827478867055226, 0.004246688741721854, 0.00549156145961816)
2026-05-24 16:48:34,368 - optuna.study.study - INFO - Trial 281 finished with values: [0.005827478867055226, 0.004246688741721854, 0.00549156145961816] and parameters: {'n_layers': 4, 'embedding_dim': 128, 'lr': 0.0038122363815175056, 'lambda_val': 0.00024201062866228547, 'batch_size': 1097, 'optimizer': 'RMSprop'}.
2026-05-24 16:48:41,881 - experiment_functions - INFO - Early stopping at epoch 600. Best Metrics: (0.035006018327568375, 0.01077814569536424, 0.026040798788625582)
2026-05-24 16:48:41,983 - optuna.study.study - INFO - Trial 282 finished with values: [0.035006018327568375, 0.01077814569536424, 0.026040798788625582] and parameters: {'n_layers': 2, 'embedding_dim': 128, 'lr': 0.0012971109624756183, 'lambda_val': 1.1594147319583239e-05, 'batch_size': 1638, 'optimizer': 'Adam'}.
2026-05-24 16:49:25,471 - experiment_functions - INFO - Early stopping at epoch 3900. Best Metrics: (0.044527377971217016, 0.013336092715231788, 0.03471272177582163)
2026-05-24 16:49:25,565 - optuna.study.study - INFO - Trial 283 finished with values: [0.044527377971217016, 0.013336092715231788, 0.03471272177582163] and parameters: {'n_layers': 1, 'embedding_dim': 128, 'lr': 0.00014827150350050635, 'lambda_val': 1.6170124945691617e-05, 'batch_size': 1097, 'optimizer': 'RMSprop'}.
2026-05-24 16:49:32,565 - experiment_functions - INFO - Early stopping at epoch 550. Best Metrics: (0.018088366112558554, 0.006928807947019867, 0.012903891515297843)
2026-05-24 16:49:32,870 - optuna.study.study - INFO - Trial 284 finished with values: [0.018088366112558554, 0.006928807947019867, 0.012903891515297843] and parameters: {'n_layers': 2, 'embedding_dim': 96, 'lr': 0.0010413911280538683, 'lambda_val': 5.897592552004812e-06, 'batch_size': 1204, 'optimizer': 'RMSprop'}.
2026-05-24 16:49:48,278 - experiment_functions - INFO - Early stopping at epoch 1250. Best Metrics: (0.027004915303884526, 0.008824503311258279, 0.018984356091985448)
2026-05-24 16:49:49,004 - optuna.study.study - INFO - Trial 285 finished with values: [0.027004915303884526, 0.008824503311258279, 0.018984356091985448] and parameters: {'n_layers': 3, 'embedding_dim': 128, 'lr': 0.00034279930379767936, 'lambda_val': 1.1594147319583239e-05, 'batch_size': 2962, 'optimizer': 'RMSprop'}.
2026-05-24 16:50:20,979 - experiment_functions - INFO - Early stopping at epoch 3100. Best Metrics: (0.04330115313276755, 0.012715231788079472, 0.03134923530291546)
2026-05-24 16:50:21,292 - optuna.study.study - INFO - Trial 286 finished with values: [0.04330115313276755, 0.012715231788079472, 0.03134923530291546] and parameters: {'n_layers': 1, 'embedding_dim': 96, 'lr': 0.00014827150350050635, 'lambda_val': 0.002332362722517884, 'batch_size': 1062, 'optimizer': 'Adam'}.
2026-05-24 16:50:27,839 - experiment_functions - INFO - Early stopping at epoch 550. Best Metrics: (0.030457734654583048, 0.008460264900662252, 0.021079048128788774)
2026-05-24 16:50:28,132 - optuna.study.study - INFO - Trial 287 finished with values: [0.030457734654583048, 0.008460264900662252, 0.021079048128788774] and parameters: {'n_layers': 1, 'embedding_dim': 128, 'lr': 0.014430119922496201, 'lambda_val': 5.897592552004812e-06, 'batch_size': 2305, 'optimizer': 'Adam'}.
2026-05-24 16:50:59,144 - experiment_functions - INFO - Early stopping at epoch 3000. Best Metrics: (0.043008597268062186, 0.012764900662251655, 0.031343185238727374)
2026-05-24 16:50:59,567 - optuna.study.study - INFO - Trial 288 finished with values: [0.043008597268062186, 0.012764900662251655, 0.031343185238727374] and parameters: {'n_layers': 1, 'embedding_dim': 128, 'lr': 0.00014827150350050635, 'lambda_val': 5.897592552004812e-06, 'batch_size': 1062, 'optimizer': 'Adam'}.
2026-05-24 16:51:09,102 - experiment_functions - INFO - Early stopping at epoch 800. Best Metrics: (0.0393325322708501, 0.011672185430463576, 0.028211258231625114)
2026-05-24 16:51:09,321 - optuna.study.study - INFO - Trial 289 finished with values: [0.0393325322708501, 0.011672185430463576, 0.028211258231625114] and parameters: {'n_layers': 1, 'embedding_dim': 128, 'lr': 0.00034279930379767936, 'lambda_val': 1.1594147319583239e-05, 'batch_size': 2918, 'optimizer': 'RMSprop'}.
2026-05-24 16:51:15,641 - experiment_functions - INFO - Early stopping at epoch 550. Best Metrics: (0.04281657933083486, 0.012135761589403975, 0.031142735462652425)
2026-05-24 16:51:15,725 - optuna.study.study - INFO - Trial 290 finished with values: [0.04281657933083486, 0.012135761589403975, 0.031142735462652425] and parameters: {'n_layers': 1, 'embedding_dim': 128, 'lr': 0.00532575854276696, 'lambda_val': 1.1594147319583239e-05, 'batch_size': 1463, 'optimizer': 'Adam'}.
2026-05-24 16:51:56,250 - optuna.study.study - INFO - Trial 291 finished with values: [0.03466367957953317, 0.011018211920529802, 0.025314784002641626] and parameters: {'n_layers': 1, 'embedding_dim': 32, 'lr': 0.00014827150350050635, 'lambda_val': 5.897592552004812e-06, 'batch_size': 3031, 'optimizer': 'RMSprop'}.
2026-05-24 16:52:08,014 - experiment_functions - INFO - Early stopping at epoch 1050. Best Metrics: (0.04409473856410716, 0.012748344370860927, 0.033489903933431646)
2026-05-24 16:52:08,099 - optuna.study.study - INFO - Trial 292 finished with values: [0.04409473856410716, 0.012748344370860927, 0.033489903933431646] and parameters: {'n_layers': 1, 'embedding_dim': 96, 'lr': 0.0003131370011043347, 'lambda_val': 3.357239469878402e-06, 'batch_size': 1463, 'optimizer': 'RMSprop'}.
2026-05-24 16:52:50,261 - optuna.study.study - INFO - Trial 293 finished with values: [0.039838768470760094, 0.01185430463576159, 0.03001345253618851] and parameters: {'n_layers': 1, 'embedding_dim': 96, 'lr': 0.00014827150350050635, 'lambda_val': 4.9612924956814075e-05, 'batch_size': 2694, 'optimizer': 'Adam'}.
2026-05-24 16:52:58,541 - experiment_functions - INFO - Early stopping at epoch 750. Best Metrics: (0.0143404052040654, 0.005852649006622518, 0.01066292619417958)
2026-05-24 16:52:58,645 - optuna.study.study - INFO - Trial 294 finished with values: [0.0143404052040654, 0.005852649006622518, 0.01066292619417958] and parameters: {'n_layers': 1, 'embedding_dim': 128, 'lr': 0.00034279930379767936, 'lambda_val': 0.0272556559491938, 'batch_size': 1178, 'optimizer': 'Adam'}.
2026-05-24 16:53:05,082 - experiment_functions - INFO - Early stopping at epoch 550. Best Metrics: (0.0405788640132211, 0.011829470198675498, 0.029293412460592593)
2026-05-24 16:53:05,177 - optuna.study.study - INFO - Trial 295 finished with values: [0.0405788640132211, 0.011829470198675498, 0.029293412460592593] and parameters: {'n_layers': 1, 'embedding_dim': 128, 'lr': 0.00532575854276696, 'lambda_val': 2.291507926580009e-06, 'batch_size': 1235, 'optimizer': 'Adam'}.
2026-05-24 16:53:45,290 - experiment_functions - INFO - Early stopping at epoch 3900. Best Metrics: (0.044748926899179475, 0.013327814569536424, 0.03608653191618218)
2026-05-24 16:53:45,696 - optuna.study.study - INFO - Trial 296 finished with values: [0.044748926899179475, 0.013327814569536424, 0.03608653191618218] and parameters: {'n_layers': 1, 'embedding_dim': 128, 'lr': 0.00014827150350050635, 'lambda_val': 8.174770053441025e-05, 'batch_size': 1097, 'optimizer': 'RMSprop'}.
2026-05-24 16:53:55,876 - experiment_functions - INFO - Early stopping at epoch 900. Best Metrics: (0.04358285548034361, 0.013046357615894039, 0.03092127816522231)
2026-05-24 16:53:56,015 - optuna.study.study - INFO - Trial 297 finished with values: [0.04358285548034361, 0.013046357615894039, 0.03092127816522231] and parameters: {'n_layers': 1, 'embedding_dim': 128, 'lr': 0.00034279930379767936, 'lambda_val': 3.1769341559608166e-05, 'batch_size': 1062, 'optimizer': 'RMSprop'}.
2026-05-24 16:54:07,003 - experiment_functions - INFO - Early stopping at epoch 1000. Best Metrics: (0.04265802564464569, 0.012897350993377485, 0.030176506321788914)
2026-05-24 16:54:07,681 - optuna.study.study - INFO - Trial 298 finished with values: [0.04265802564464569, 0.012897350993377485, 0.030176506321788914] and parameters: {'n_layers': 1, 'embedding_dim': 96, 'lr': 0.00034279930379767936, 'lambda_val': 4.9612924956814075e-05, 'batch_size': 1178, 'optimizer': 'Adam'}.
2026-05-24 16:54:14,279 - experiment_functions - INFO - Early stopping at epoch 550. Best Metrics: (0.043200456393205924, 0.01222682119205298, 0.03418400542049049)
2026-05-24 16:54:15,103 - optuna.study.study - INFO - Trial 299 finished with values: [0.043200456393205924, 0.01222682119205298, 0.03418400542049049] and parameters: {'n_layers': 1, 'embedding_dim': 128, 'lr': 0.005389293845041463, 'lambda_val': 5.897592552004812e-06, 'batch_size': 1062, 'optimizer': 'Adam'}.
2026-05-24 16:54:15,137 - root - INFO - Selected Trial 269 based on Max ndcg: 0.0364
2026-05-24 16:54:15,137 - root - INFO - Associated Recall: 0.0464
2026-05-24 16:54:15,137 - experiment_functions - INFO - Training the best model ... for e_1M_1c2dcs_strict
2026-05-24 16:54:55,337 - root - INFO -   **** Training e_1M_1c2dcs_strict_rand1
2026-05-24 16:54:55,345 - root - INFO -   **** Getting 16700/805443 random edges
2026-05-24 16:54:55,735 - optuna.storages._rdb.storage - INFO - A new study created in RDB with name: Study_e_1M_1c2dcs_strict_rand1
2026-05-24 16:55:32,430 - experiment_functions - INFO - Early stopping at epoch 3600. Best Metrics: (0.008680699834305812, 0.00646523178807947, 0.008732961680177917)
2026-05-24 16:55:32,961 - optuna.study.study - INFO - Trial 0 finished with values: [0.008680699834305812, 0.00646523178807947, 0.008732961680177917] and parameters: {'n_layers': 4, 'embedding_dim': 96, 'lr': 4.682903434245313e-05, 'lambda_val': 0.0015978933099847826, 'batch_size': 1525, 'optimizer': 'RMSprop'}.
2026-05-24 16:56:14,785 - optuna.study.study - INFO - Trial 1 finished with values: [0.017901959458930226, 0.01392384105960265, 0.018528484042447318] and parameters: {'n_layers': 4, 'embedding_dim': 64, 'lr': 0.0001259140473367841, 'lambda_val': 0.0020230580830565862, 'batch_size': 720, 'optimizer': 'RMSprop'}.
2026-05-24 16:56:54,045 - optuna.study.study - INFO - Trial 2 finished with values: [0.005585760073177232, 0.004602649006622517, 0.005731772225919833] and parameters: {'n_layers': 4, 'embedding_dim': 32, 'lr': 1.150025240693646e-05, 'lambda_val': 8.330169033950404e-06, 'batch_size': 592, 'optimizer': 'RMSprop'}.
2026-05-24 16:57:36,478 - optuna.study.study - INFO - Trial 3 finished with values: [0.02610851982440834, 0.020273178807947018, 0.026556050776573057] and parameters: {'n_layers': 4, 'embedding_dim': 32, 'lr': 0.00028561429900097026, 'lambda_val': 1.6438287598570295e-05, 'batch_size': 1243, 'optimizer': 'RMSprop'}.
2026-05-24 16:57:43,630 - experiment_functions - INFO - Early stopping at epoch 600. Best Metrics: (0.01454495807991601, 0.010728476821192053, 0.014577933965855426)
2026-05-24 16:57:44,258 - optuna.study.study - INFO - Trial 4 finished with values: [0.01454495807991601, 0.010728476821192053, 0.014577933965855426] and parameters: {'n_layers': 1, 'embedding_dim': 128, 'lr': 0.0024421865435223515, 'lambda_val': 0.015164958999521902, 'batch_size': 2590, 'optimizer': 'Adam'}.
2026-05-24 16:57:50,429 - experiment_functions - INFO - Early stopping at epoch 500. Best Metrics: (0.0049729952545884476, 0.004097682119205298, 0.005156271813960034)
2026-05-24 16:57:50,845 - optuna.study.study - INFO - Trial 5 finished with values: [0.0049729952545884476, 0.004097682119205298, 0.005156271813960034] and parameters: {'n_layers': 3, 'embedding_dim': 64, 'lr': 0.00014230856733635054, 'lambda_val': 0.05359949273782985, 'batch_size': 2429, 'optimizer': 'SGD'}.
2026-05-24 16:57:58,913 - experiment_functions - INFO - Early stopping at epoch 700. Best Metrics: (0.005162327109447749, 0.003907284768211921, 0.004999201378591479)
2026-05-24 16:58:00,163 - optuna.study.study - INFO - Trial 6 finished with values: [0.005162327109447749, 0.003907284768211921, 0.004999201378591479] and parameters: {'n_layers': 3, 'embedding_dim': 64, 'lr': 0.006774363030849868, 'lambda_val': 0.0002399208822124137, 'batch_size': 2835, 'optimizer': 'SGD'}.
2026-05-24 16:58:08,409 - experiment_functions - INFO - Early stopping at epoch 700. Best Metrics: (0.024595415170559652, 0.020562913907284767, 0.025692403035737336)
2026-05-24 16:58:08,501 - optuna.study.study - INFO - Trial 7 finished with values: [0.024595415170559652, 0.020562913907284767, 0.025692403035737336] and parameters: {'n_layers': 2, 'embedding_dim': 96, 'lr': 0.0009577842166100019, 'lambda_val': 0.0712753228725955, 'batch_size': 1209, 'optimizer': 'RMSprop'}.
2026-05-24 16:58:49,971 - optuna.study.study - INFO - Trial 8 finished with values: [0.019222344574113804, 0.013791390728476823, 0.01896924533038919] and parameters: {'n_layers': 1, 'embedding_dim': 96, 'lr': 0.0002426099667536793, 'lambda_val': 3.425227104917456e-05, 'batch_size': 2857, 'optimizer': 'RMSprop'}.
2026-05-24 16:59:11,724 - experiment_functions - INFO - Early stopping at epoch 2050. Best Metrics: (0.023321334479327605, 0.016870860927152318, 0.02402350296974319)
2026-05-24 16:59:11,817 - optuna.study.study - INFO - Trial 9 finished with values: [0.023321334479327605, 0.016870860927152318, 0.02402350296974319] and parameters: {'n_layers': 1, 'embedding_dim': 96, 'lr': 0.000647639505305291, 'lambda_val': 0.00017211939323660374, 'batch_size': 682, 'optimizer': 'RMSprop'}.
2026-05-24 16:59:53,691 - optuna.study.study - INFO - Trial 10 finished with values: [0.017734864520757686, 0.012806291390728478, 0.017529822171278003] and parameters: {'n_layers': 2, 'embedding_dim': 32, 'lr': 0.0001715743810403738, 'lambda_val': 5.220739999212651e-06, 'batch_size': 3657, 'optimizer': 'RMSprop'}.
