2026-05-24 06:38:46,292 - optuna.study.study - INFO - Trial 28 finished with values: [0.00538783074017816, 0.004346026490066225, 0.005667667252871591] and parameters: {'n_layers': 1, 'embedding_dim': 128, 'lr': 2.1883968141449496e-05, 'lambda_val': 3.3538501213230604e-05, 'batch_size': 2807, 'optimizer': 'Adam'}.
2026-05-24 06:38:52,705 - experiment_functions - INFO - Early stopping at epoch 500. Best Metrics: (0.005381580543361835, 0.0043377483443708615, 0.005439910850140909)
2026-05-24 06:38:53,331 - optuna.study.study - INFO - Trial 29 finished with values: [0.005381580543361835, 0.0043377483443708615, 0.005439910850140909] and parameters: {'n_layers': 2, 'embedding_dim': 32, 'lr': 1.965793919904842e-05, 'lambda_val': 0.00892520119383133, 'batch_size': 1669, 'optimizer': 'RMSprop'}.
2026-05-24 06:39:02,404 - experiment_functions - INFO - Early stopping at epoch 500. Best Metrics: (0.004788788424301457, 0.004089403973509933, 0.0048952411889227575)
2026-05-24 06:39:02,509 - optuna.study.study - INFO - Trial 30 finished with values: [0.004788788424301457, 0.004089403973509933, 0.0048952411889227575] and parameters: {'n_layers': 4, 'embedding_dim': 256, 'lr': 0.00018818236779485583, 'lambda_val': 9.536283602649862e-06, 'batch_size': 840, 'optimizer': 'SGD'}.
2026-05-24 06:39:11,134 - experiment_functions - INFO - Early stopping at epoch 600. Best Metrics: (0.005197660687981467, 0.004221854304635762, 0.0053752294643940116)
2026-05-24 06:39:11,428 - optuna.study.study - INFO - Trial 31 finished with values: [0.005197660687981467, 0.004221854304635762, 0.0053752294643940116] and parameters: {'n_layers': 3, 'embedding_dim': 128, 'lr': 1.7291934055428185e-05, 'lambda_val': 0.00041834560577404495, 'batch_size': 570, 'optimizer': 'RMSprop'}.
2026-05-24 06:39:18,128 - experiment_functions - INFO - Early stopping at epoch 500. Best Metrics: (0.004981902472767186, 0.004114238410596027, 0.005136039660164739)
2026-05-24 06:39:18,225 - optuna.study.study - INFO - Trial 32 finished with values: [0.004981902472767186, 0.004114238410596027, 0.005136039660164739] and parameters: {'n_layers': 3, 'embedding_dim': 32, 'lr': 0.0009455333855384543, 'lambda_val': 0.00019054562184675196, 'batch_size': 3142, 'optimizer': 'SGD'}.
2026-05-24 06:39:29,012 - experiment_functions - INFO - Early stopping at epoch 700. Best Metrics: (0.023540772542427164, 0.008352649006622517, 0.016291131374574386)
2026-05-24 06:39:30,170 - optuna.study.study - INFO - Trial 33 finished with values: [0.023540772542427164, 0.008352649006622517, 0.016291131374574386] and parameters: {'n_layers': 4, 'embedding_dim': 128, 'lr': 0.08222284296930428, 'lambda_val': 3.2517859576994016e-06, 'batch_size': 3936, 'optimizer': 'Adam'}.
2026-05-24 06:40:07,423 - experiment_functions - INFO - Early stopping at epoch 3000. Best Metrics: (0.05277802927970777, 0.016788079470198676, 0.035648397858518234)
2026-05-24 06:40:07,518 - optuna.study.study - INFO - Trial 34 finished with values: [0.05277802927970777, 0.016788079470198676, 0.035648397858518234] and parameters: {'n_layers': 1, 'embedding_dim': 32, 'lr': 0.031181557217089314, 'lambda_val': 0.00828097881980844, 'batch_size': 3263, 'optimizer': 'RMSprop'}.
2026-05-24 06:40:29,328 - experiment_functions - INFO - Early stopping at epoch 1600. Best Metrics: (0.03939742972323541, 0.019718543046357614, 0.03609054704855125)
2026-05-24 06:40:29,428 - optuna.study.study - INFO - Trial 35 finished with values: [0.03939742972323541, 0.019718543046357614, 0.03609054704855125] and parameters: {'n_layers': 4, 'embedding_dim': 64, 'lr': 0.00022442725513326185, 'lambda_val': 0.0008118357014636037, 'batch_size': 2938, 'optimizer': 'RMSprop'}.
2026-05-24 06:40:36,905 - experiment_functions - INFO - Early stopping at epoch 500. Best Metrics: (0.0051237658125014626, 0.004362582781456954, 0.005269060415360714)
2026-05-24 06:40:37,412 - optuna.study.study - INFO - Trial 36 finished with values: [0.0051237658125014626, 0.004362582781456954, 0.005269060415360714] and parameters: {'n_layers': 4, 'embedding_dim': 96, 'lr': 0.0011036962062550273, 'lambda_val': 0.012785337873021345, 'batch_size': 2189, 'optimizer': 'SGD'}.
2026-05-24 06:40:44,407 - experiment_functions - INFO - Early stopping at epoch 550. Best Metrics: (0.06222750814244833, 0.028294701986754964, 0.05317160177460838)
2026-05-24 06:40:44,500 - optuna.study.study - INFO - Trial 37 finished with values: [0.06222750814244833, 0.028294701986754964, 0.05317160177460838] and parameters: {'n_layers': 1, 'embedding_dim': 64, 'lr': 0.0014509434531037974, 'lambda_val': 9.2363995018798e-06, 'batch_size': 3968, 'optimizer': 'RMSprop'}.
2026-05-24 06:40:54,882 - experiment_functions - INFO - Early stopping at epoch 750. Best Metrics: (0.02484726726067772, 0.011523178807947022, 0.018939902906968308)
2026-05-24 06:40:55,743 - optuna.study.study - INFO - Trial 38 finished with values: [0.02484726726067772, 0.011523178807947022, 0.018939902906968308] and parameters: {'n_layers': 3, 'embedding_dim': 128, 'lr': 0.00027332859633836593, 'lambda_val': 0.02518020325620793, 'batch_size': 4009, 'optimizer': 'RMSprop'}.
2026-05-24 06:41:13,419 - experiment_functions - INFO - Early stopping at epoch 1750. Best Metrics: (0.0050306360724251264, 0.004172185430463576, 0.005195768658528647)
2026-05-24 06:41:13,521 - optuna.study.study - INFO - Trial 39 finished with values: [0.0050306360724251264, 0.004172185430463576, 0.005195768658528647] and parameters: {'n_layers': 1, 'embedding_dim': 64, 'lr': 3.524893689657709e-05, 'lambda_val': 3.579778287288319e-05, 'batch_size': 1342, 'optimizer': 'Adam'}.
2026-05-24 06:41:25,099 - experiment_functions - INFO - Early stopping at epoch 1100. Best Metrics: (0.00508250376492449, 0.0038990066225165565, 0.004962867730869501)
2026-05-24 06:41:25,187 - optuna.study.study - INFO - Trial 40 finished with values: [0.00508250376492449, 0.0038990066225165565, 0.004962867730869501] and parameters: {'n_layers': 1, 'embedding_dim': 64, 'lr': 0.014238291215524557, 'lambda_val': 1.2120752071098407e-06, 'batch_size': 3527, 'optimizer': 'SGD'}.
2026-05-24 06:41:37,373 - experiment_functions - INFO - Early stopping at epoch 950. Best Metrics: (0.05269037294328389, 0.024263245033112585, 0.0477124706429668)
2026-05-24 06:41:37,683 - optuna.study.study - INFO - Trial 41 finished with values: [0.05269037294328389, 0.024263245033112585, 0.0477124706429668] and parameters: {'n_layers': 2, 'embedding_dim': 96, 'lr': 0.00034776281673029824, 'lambda_val': 1.738534368780138e-05, 'batch_size': 3042, 'optimizer': 'Adam'}.
2026-05-24 06:41:46,544 - experiment_functions - INFO - Early stopping at epoch 500. Best Metrics: (0.00549362167247468, 0.004412251655629139, 0.005601868476727703)
2026-05-24 06:41:47,696 - optuna.study.study - INFO - Trial 42 finished with values: [0.00549362167247468, 0.004412251655629139, 0.005601868476727703] and parameters: {'n_layers': 4, 'embedding_dim': 256, 'lr': 0.0004926615733824374, 'lambda_val': 1.585886420274199e-06, 'batch_size': 1045, 'optimizer': 'SGD'}.
2026-05-24 06:42:25,502 - experiment_functions - INFO - Early stopping at epoch 3400. Best Metrics: (0.03371749779768571, 0.010993377483443709, 0.02258188737174321)
2026-05-24 06:42:25,584 - optuna.study.study - INFO - Trial 43 finished with values: [0.03371749779768571, 0.010993377483443709, 0.02258188737174321] and parameters: {'n_layers': 2, 'embedding_dim': 96, 'lr': 0.06535633382408652, 'lambda_val': 0.013889992049358773, 'batch_size': 1506, 'optimizer': 'Adam'}.
2026-05-24 06:42:37,380 - experiment_functions - INFO - Early stopping at epoch 500. Best Metrics: (0.00473540034881691, 0.003998344370860928, 0.005136201807590479)
2026-05-24 06:42:37,485 - optuna.study.study - INFO - Trial 44 finished with values: [0.00473540034881691, 0.003998344370860928, 0.005136201807590479] and parameters: {'n_layers': 3, 'embedding_dim': 256, 'lr': 0.0005026101540246566, 'lambda_val': 1.007682448801416e-06, 'batch_size': 1837, 'optimizer': 'SGD'}.
2026-05-24 06:43:42,710 - optuna.study.study - INFO - Trial 45 finished with values: [0.04112437196786194, 0.01206953642384106, 0.027142019009149726] and parameters: {'n_layers': 4, 'embedding_dim': 256, 'lr': 0.0022852766065388956, 'lambda_val': 0.0005921100290130649, 'batch_size': 2153, 'optimizer': 'RMSprop'}.
2026-05-24 06:43:57,639 - experiment_functions - INFO - Early stopping at epoch 1250. Best Metrics: (0.06193297029097662, 0.02836092715231788, 0.05712332658922817)
2026-05-24 06:43:57,842 - optuna.study.study - INFO - Trial 46 finished with values: [0.06193297029097662, 0.02836092715231788, 0.05712332658922817] and parameters: {'n_layers': 1, 'embedding_dim': 96, 'lr': 0.0003154862248546408, 'lambda_val': 7.532370886356362e-05, 'batch_size': 4018, 'optimizer': 'Adam'}.
2026-05-24 06:44:24,652 - experiment_functions - INFO - Early stopping at epoch 2250. Best Metrics: (0.040965696046998235, 0.013576158940397352, 0.028087464734067705)
2026-05-24 06:44:24,739 - optuna.study.study - INFO - Trial 47 finished with values: [0.040965696046998235, 0.013576158940397352, 0.028087464734067705] and parameters: {'n_layers': 3, 'embedding_dim': 32, 'lr': 0.0981108711077032, 'lambda_val': 0.0014131754967656547, 'batch_size': 2331, 'optimizer': 'RMSprop'}.
2026-05-24 06:44:31,048 - experiment_functions - INFO - Early stopping at epoch 500. Best Metrics: (0.004914462203962237, 0.004130794701986755, 0.005225289433965877)
2026-05-24 06:44:31,146 - optuna.study.study - INFO - Trial 48 finished with values: [0.004914462203962237, 0.004130794701986755, 0.005225289433965877] and parameters: {'n_layers': 1, 'embedding_dim': 96, 'lr': 0.029199897524435366, 'lambda_val': 1.5905386217756802e-06, 'batch_size': 1099, 'optimizer': 'SGD'}.
2026-05-24 06:44:37,905 - experiment_functions - INFO - Early stopping at epoch 500. Best Metrics: (0.005543317338657729, 0.004279801324503311, 0.005747053694469705)
2026-05-24 06:44:38,068 - optuna.study.study - INFO - Trial 49 finished with values: [0.005543317338657729, 0.004279801324503311, 0.005747053694469705] and parameters: {'n_layers': 2, 'embedding_dim': 96, 'lr': 0.0013634972870945076, 'lambda_val': 0.07906693757025841, 'batch_size': 940, 'optimizer': 'SGD'}.
2026-05-24 06:44:49,389 - experiment_functions - INFO - Early stopping at epoch 850. Best Metrics: (0.024422726880469495, 0.008915562913907287, 0.01700658147405608)
2026-05-24 06:44:50,291 - optuna.study.study - INFO - Trial 50 finished with values: [0.024422726880469495, 0.008915562913907287, 0.01700658147405608] and parameters: {'n_layers': 4, 'embedding_dim': 32, 'lr': 0.06054915076740644, 'lambda_val': 8.94244552694136e-05, 'batch_size': 2219, 'optimizer': 'RMSprop'}.
2026-05-24 06:45:01,459 - experiment_functions - INFO - Early stopping at epoch 550. Best Metrics: (0.005779028395336986, 0.004130794701986755, 0.005263637131171527)
2026-05-24 06:45:02,223 - optuna.study.study - INFO - Trial 51 finished with values: [0.005779028395336986, 0.004130794701986755, 0.005263637131171527] and parameters: {'n_layers': 2, 'embedding_dim': 32, 'lr': 1.2019898160521425e-05, 'lambda_val': 0.007217309812430263, 'batch_size': 3606, 'optimizer': 'Adam'}.
2026-05-24 06:45:13,245 - experiment_functions - INFO - Early stopping at epoch 550. Best Metrics: (0.005072909431805775, 0.004031456953642384, 0.0051148684587253345)
2026-05-24 06:45:13,342 - optuna.study.study - INFO - Trial 52 finished with values: [0.005072909431805775, 0.004031456953642384, 0.0051148684587253345] and parameters: {'n_layers': 1, 'embedding_dim': 128, 'lr': 1.0912393535136732e-05, 'lambda_val': 4.362263684941159e-05, 'batch_size': 4018, 'optimizer': 'RMSprop'}.
2026-05-24 06:46:06,523 - optuna.study.study - INFO - Trial 53 finished with values: [0.04330675929841139, 0.021572847682119208, 0.03739033901369151] and parameters: {'n_layers': 4, 'embedding_dim': 96, 'lr': 0.0001150739949127664, 'lambda_val': 0.0007715536445878253, 'batch_size': 1506, 'optimizer': 'Adam'}.
2026-05-24 06:46:14,418 - experiment_functions - INFO - Early stopping at epoch 550. Best Metrics: (0.020003946954648504, 0.006986754966887418, 0.012495510336346683)
2026-05-24 06:46:14,518 - optuna.study.study - INFO - Trial 54 finished with values: [0.020003946954648504, 0.006986754966887418, 0.012495510336346683] and parameters: {'n_layers': 4, 'embedding_dim': 96, 'lr': 0.0007842326969660087, 'lambda_val': 0.013889992049358773, 'batch_size': 1506, 'optimizer': 'RMSprop'}.
2026-05-24 06:46:35,112 - experiment_functions - INFO - Early stopping at epoch 1650. Best Metrics: (0.03771518429843377, 0.019644039735099338, 0.03853671173869601)
2026-05-24 06:46:35,576 - optuna.study.study - INFO - Trial 55 finished with values: [0.03771518429843377, 0.019644039735099338, 0.03853671173869601] and parameters: {'n_layers': 3, 'embedding_dim': 64, 'lr': 0.0002382334927885136, 'lambda_val': 0.0002658688144855125, 'batch_size': 4089, 'optimizer': 'RMSprop'}.
2026-05-24 06:46:45,318 - experiment_functions - INFO - Early stopping at epoch 750. Best Metrics: (0.04492910192121163, 0.020471854304635762, 0.03997375901855974)
2026-05-24 06:46:46,242 - optuna.study.study - INFO - Trial 56 finished with values: [0.04492910192121163, 0.020471854304635762, 0.03997375901855974] and parameters: {'n_layers': 2, 'embedding_dim': 64, 'lr': 0.0004427403826510948, 'lambda_val': 0.0023999610459478756, 'batch_size': 3507, 'optimizer': 'RMSprop'}.
2026-05-24 06:46:57,397 - experiment_functions - INFO - Early stopping at epoch 650. Best Metrics: (0.005284963300551017, 0.004312913907284768, 0.00544895756170576)
2026-05-24 06:46:57,565 - optuna.study.study - INFO - Trial 57 finished with values: [0.005284963300551017, 0.004312913907284768, 0.00544895756170576] and parameters: {'n_layers': 4, 'embedding_dim': 256, 'lr': 0.019968999888651518, 'lambda_val': 1.585886420274199e-06, 'batch_size': 1045, 'optimizer': 'SGD'}.
2026-05-24 06:47:47,203 - optuna.study.study - INFO - Trial 58 finished with values: [0.03099160432115799, 0.01683774834437086, 0.027075562493148086] and parameters: {'n_layers': 4, 'embedding_dim': 64, 'lr': 9.311633605007365e-05, 'lambda_val': 1.738534368780138e-05, 'batch_size': 891, 'optimizer': 'RMSprop'}.
2026-05-24 06:48:31,345 - optuna.study.study - INFO - Trial 59 finished with values: [0.04365346008521661, 0.01447019867549669, 0.030210220050555455] and parameters: {'n_layers': 1, 'embedding_dim': 64, 'lr': 0.031181557217089314, 'lambda_val': 0.0008118357014636037, 'batch_size': 3263, 'optimizer': 'RMSprop'}.
2026-05-24 06:48:40,974 - experiment_functions - INFO - Early stopping at epoch 800. Best Metrics: (0.00532312821613472, 0.004263245033112583, 0.005508774525974238)
2026-05-24 06:48:41,961 - optuna.study.study - INFO - Trial 60 finished with values: [0.00532312821613472, 0.004263245033112583, 0.005508774525974238] and parameters: {'n_layers': 1, 'embedding_dim': 32, 'lr': 2.1883968141449496e-05, 'lambda_val': 3.3538501213230604e-05, 'batch_size': 2807, 'optimizer': 'RMSprop'}.
2026-05-24 06:49:53,461 - optuna.study.study - INFO - Trial 61 finished with values: [0.0362742860795924, 0.011167218543046361, 0.023774539269615473] and parameters: {'n_layers': 4, 'embedding_dim': 256, 'lr': 0.0022852766065388956, 'lambda_val': 0.0005921100290130649, 'batch_size': 891, 'optimizer': 'RMSprop'}.
2026-05-24 06:50:20,907 - experiment_functions - INFO - Early stopping at epoch 2150. Best Metrics: (0.005297654974821707, 0.004403973509933775, 0.005828446750118155)
2026-05-24 06:50:21,284 - optuna.study.study - INFO - Trial 62 finished with values: [0.005297654974821707, 0.004403973509933775, 0.005828446750118155] and parameters: {'n_layers': 4, 'embedding_dim': 32, 'lr': 1.7987747552500953e-05, 'lambda_val': 7.430828607206384e-06, 'batch_size': 3573, 'optimizer': 'Adam'}.
2026-05-24 06:50:28,140 - experiment_functions - INFO - Early stopping at epoch 550. Best Metrics: (0.005297299974249831, 0.004346026490066226, 0.005492511363167182)
2026-05-24 06:50:28,251 - optuna.study.study - INFO - Trial 63 finished with values: [0.005297299974249831, 0.004346026490066226, 0.005492511363167182] and parameters: {'n_layers': 1, 'embedding_dim': 128, 'lr': 0.0011036962062550273, 'lambda_val': 0.003036563361231438, 'batch_size': 2189, 'optimizer': 'SGD'}.
2026-05-24 06:50:37,278 - experiment_functions - INFO - Early stopping at epoch 500. Best Metrics: (0.005380506616965778, 0.00423841059602649, 0.005428233640174646)
2026-05-24 06:50:37,911 - optuna.study.study - INFO - Trial 64 finished with values: [0.005380506616965778, 0.00423841059602649, 0.005428233640174646] and parameters: {'n_layers': 4, 'embedding_dim': 256, 'lr': 0.00018818236779485583, 'lambda_val': 9.536283602649862e-06, 'batch_size': 840, 'optimizer': 'SGD'}.
2026-05-24 06:51:30,730 - optuna.study.study - INFO - Trial 65 finished with values: [0.01872798506252595, 0.010918874172185433, 0.016325065985895268] and parameters: {'n_layers': 4, 'embedding_dim': 96, 'lr': 5.469206106625236e-05, 'lambda_val': 7.307654368287155e-06, 'batch_size': 1536, 'optimizer': 'RMSprop'}.
2026-05-24 06:51:55,856 - experiment_functions - INFO - Early stopping at epoch 1850. Best Metrics: (0.042588562272652196, 0.021837748344370862, 0.04193168725788697)
2026-05-24 06:51:55,981 - optuna.study.study - INFO - Trial 66 finished with values: [0.042588562272652196, 0.021837748344370862, 0.04193168725788697] and parameters: {'n_layers': 4, 'embedding_dim': 64, 'lr': 0.00022442725513326185, 'lambda_val': 0.00013335196567720495, 'batch_size': 2492, 'optimizer': 'RMSprop'}.
2026-05-24 06:52:03,962 - experiment_functions - INFO - Early stopping at epoch 650. Best Metrics: (0.04099052944138861, 0.012417218543046357, 0.026507132998176284)
2026-05-24 06:52:04,045 - optuna.study.study - INFO - Trial 67 finished with values: [0.04099052944138861, 0.012417218543046357, 0.026507132998176284] and parameters: {'n_layers': 1, 'embedding_dim': 32, 'lr': 0.031181557217089314, 'lambda_val': 2.4948249425733372e-05, 'batch_size': 3025, 'optimizer': 'Adam'}.
2026-05-24 06:52:11,678 - experiment_functions - INFO - Early stopping at epoch 550. Best Metrics: (0.023649826001242328, 0.01356788079470199, 0.020649302892012427)
2026-05-24 06:52:11,766 - optuna.study.study - INFO - Trial 68 finished with values: [0.023649826001242328, 0.01356788079470199, 0.020649302892012427] and parameters: {'n_layers': 4, 'embedding_dim': 32, 'lr': 0.0014509434531037974, 'lambda_val': 3.426862940771237e-05, 'batch_size': 2219, 'optimizer': 'RMSprop'}.
2026-05-24 06:52:17,998 - experiment_functions - INFO - Early stopping at epoch 500. Best Metrics: (0.005170932309438315, 0.003832781456953642, 0.0047026263642947486)
2026-05-24 06:52:18,508 - optuna.study.study - INFO - Trial 69 finished with values: [0.005170932309438315, 0.003832781456953642, 0.0047026263642947486] and parameters: {'n_layers': 1, 'embedding_dim': 128, 'lr': 0.024050557851221715, 'lambda_val': 2.9822943996985876e-05, 'batch_size': 3643, 'optimizer': 'SGD'}.
2026-05-24 06:52:27,954 - experiment_functions - INFO - Early stopping at epoch 500. Best Metrics: (0.005642723019088497, 0.004437086092715232, 0.0057304907181680315)
2026-05-24 06:52:29,169 - optuna.study.study - INFO - Trial 70 finished with values: [0.005642723019088497, 0.004437086092715232, 0.0057304907181680315] and parameters: {'n_layers': 4, 'embedding_dim': 256, 'lr': 1.0912393535136732e-05, 'lambda_val': 0.007873945023858612, 'batch_size': 1950, 'optimizer': 'RMSprop'}.
2026-05-24 06:52:44,767 - experiment_functions - INFO - Early stopping at epoch 1150. Best Metrics: (0.039305703606290564, 0.020786423841059606, 0.03850056717822397)
2026-05-24 06:52:44,993 - optuna.study.study - INFO - Trial 71 finished with values: [0.039305703606290564, 0.020786423841059606, 0.03850056717822397] and parameters: {'n_layers': 4, 'embedding_dim': 32, 'lr': 0.000436971895785808, 'lambda_val': 1.1068932700778532e-05, 'batch_size': 2096, 'optimizer': 'RMSprop'}.
2026-05-24 06:53:21,668 - experiment_functions - INFO - Early stopping at epoch 2650. Best Metrics: (0.012989561903787772, 0.004842715231788079, 0.008939906639090757)
2026-05-24 06:53:21,880 - optuna.study.study - INFO - Trial 72 finished with values: [0.012989561903787772, 0.004842715231788079, 0.008939906639090757] and parameters: {'n_layers': 4, 'embedding_dim': 32, 'lr': 0.010845984915572808, 'lambda_val': 0.010351654779997563, 'batch_size': 2276, 'optimizer': 'Adam'}.
2026-05-24 06:53:52,962 - experiment_functions - INFO - Early stopping at epoch 2000. Best Metrics: (0.05015819560076463, 0.014817880794701987, 0.03421541249471805)
2026-05-24 06:53:53,308 - optuna.study.study - INFO - Trial 73 finished with values: [0.05015819560076463, 0.014817880794701987, 0.03421541249471805] and parameters: {'n_layers': 3, 'embedding_dim': 256, 'lr': 0.0022852766065388956, 'lambda_val': 2.4948249425733372e-05, 'batch_size': 3279, 'optimizer': 'RMSprop'}.
2026-05-24 06:54:06,667 - experiment_functions - INFO - Early stopping at epoch 1000. Best Metrics: (0.06971682547816878, 0.02730132450331126, 0.05735334605845711)
2026-05-24 06:54:06,764 - optuna.study.study - INFO - Trial 74 finished with values: [0.06971682547816878, 0.02730132450331126, 0.05735334605845711] and parameters: {'n_layers': 1, 'embedding_dim': 256, 'lr': 0.0004427403826510948, 'lambda_val': 0.0023999610459478756, 'batch_size': 3507, 'optimizer': 'Adam'}.
2026-05-24 06:54:13,875 - experiment_functions - INFO - Early stopping at epoch 500. Best Metrics: (0.004964833311105821, 0.0040149006622516555, 0.005085910037599471)
2026-05-24 06:54:14,527 - optuna.study.study - INFO - Trial 75 finished with values: [0.004964833311105821, 0.0040149006622516555, 0.005085910037599471] and parameters: {'n_layers': 3, 'embedding_dim': 96, 'lr': 0.0010207107379876185, 'lambda_val': 0.07906693757025841, 'batch_size': 940, 'optimizer': 'SGD'}.
2026-05-24 06:54:26,451 - experiment_functions - INFO - Early stopping at epoch 850. Best Metrics: (0.03877116255715073, 0.01939569536423841, 0.03663175645309563)
