2026-05-24 01:28:08,858 - optuna.study.study - INFO - Trial 47 finished with values: [0.008823424661042365, 0.006879139072847681, 0.009436322863533148] and parameters: {'n_layers': 4, 'embedding_dim': 128, 'lr': 0.0697119382170466, 'lambda_val': 1.8581035015877073e-05, 'batch_size': 1897, 'optimizer': 'Adam'}.
2026-05-24 01:28:17,198 - experiment_functions - INFO - Early stopping at epoch 700. Best Metrics: (0.005082094542361082, 0.004428807947019868, 0.005621365597846039)
2026-05-24 01:28:18,631 - optuna.study.study - INFO - Trial 48 finished with values: [0.005082094542361082, 0.004428807947019868, 0.005621365597846039] and parameters: {'n_layers': 2, 'embedding_dim': 256, 'lr': 0.002192435827460528, 'lambda_val': 4.9915516312075504e-05, 'batch_size': 3732, 'optimizer': 'SGD'}.
2026-05-24 01:28:26,995 - experiment_functions - INFO - Early stopping at epoch 700. Best Metrics: (0.01751430355386692, 0.012557947019867552, 0.01741527376858665)
2026-05-24 01:28:27,086 - optuna.study.study - INFO - Trial 49 finished with values: [0.01751430355386692, 0.012557947019867552, 0.01741527376858665] and parameters: {'n_layers': 2, 'embedding_dim': 96, 'lr': 0.0008147997918947485, 'lambda_val': 0.0001255786949388013, 'batch_size': 3274, 'optimizer': 'RMSprop'}.
2026-05-24 01:29:07,315 - optuna.study.study - INFO - Trial 50 finished with values: [0.018187528344746032, 0.01286423841059603, 0.017939485045975763] and parameters: {'n_layers': 2, 'embedding_dim': 64, 'lr': 0.00019509942015877229, 'lambda_val': 0.00046616387875468264, 'batch_size': 3274, 'optimizer': 'RMSprop'}.
2026-05-24 01:29:19,139 - experiment_functions - INFO - Early stopping at epoch 1100. Best Metrics: (0.006934684075558617, 0.007665562913907286, 0.008710489912373066)
2026-05-24 01:29:19,238 - optuna.study.study - INFO - Trial 51 finished with values: [0.006934684075558617, 0.007665562913907286, 0.008710489912373066] and parameters: {'n_layers': 4, 'embedding_dim': 32, 'lr': 0.0066909817110652366, 'lambda_val': 0.06530239771643709, 'batch_size': 1395, 'optimizer': 'RMSprop'}.
2026-05-24 01:29:25,488 - experiment_functions - INFO - Early stopping at epoch 500. Best Metrics: (0.007773272336728185, 0.0062582781456953646, 0.007908424615276629)
2026-05-24 01:29:25,639 - optuna.study.study - INFO - Trial 52 finished with values: [0.007773272336728185, 0.0062582781456953646, 0.007908424615276629] and parameters: {'n_layers': 1, 'embedding_dim': 128, 'lr': 0.07280438350821411, 'lambda_val': 0.004825444205218699, 'batch_size': 2493, 'optimizer': 'RMSprop'}.
2026-05-24 01:29:33,197 - experiment_functions - INFO - Early stopping at epoch 550. Best Metrics: (0.0147539298910067, 0.011498344370860928, 0.014561218532925165)
2026-05-24 01:29:33,285 - optuna.study.study - INFO - Trial 53 finished with values: [0.0147539298910067, 0.011498344370860928, 0.014561218532925165] and parameters: {'n_layers': 4, 'embedding_dim': 256, 'lr': 0.003175767497275054, 'lambda_val': 0.00046616387875468264, 'batch_size': 3893, 'optimizer': 'Adam'}.
2026-05-24 01:29:51,638 - experiment_functions - INFO - Early stopping at epoch 1800. Best Metrics: (0.0053130401424381435, 0.004163907284768212, 0.005320965667904295)
2026-05-24 01:29:51,723 - optuna.study.study - INFO - Trial 54 finished with values: [0.0053130401424381435, 0.004163907284768212, 0.005320965667904295] and parameters: {'n_layers': 3, 'embedding_dim': 96, 'lr': 0.011889395183389205, 'lambda_val': 9.865482927727533e-05, 'batch_size': 1284, 'optimizer': 'SGD'}.
2026-05-24 01:29:57,771 - experiment_functions - INFO - Early stopping at epoch 500. Best Metrics: (0.005406799945579871, 0.004312913907284768, 0.005471855735719727)
2026-05-24 01:29:59,184 - optuna.study.study - INFO - Trial 55 finished with values: [0.005406799945579871, 0.004312913907284768, 0.005471855735719727] and parameters: {'n_layers': 2, 'embedding_dim': 96, 'lr': 0.06318452305109733, 'lambda_val': 0.09102881555951325, 'batch_size': 1362, 'optimizer': 'SGD'}.
2026-05-24 01:30:24,127 - experiment_functions - INFO - Early stopping at epoch 2250. Best Metrics: (0.017286211033405528, 0.013394039735099339, 0.017562246108155585)
2026-05-24 01:30:24,235 - optuna.study.study - INFO - Trial 56 finished with values: [0.017286211033405528, 0.013394039735099339, 0.017562246108155585] and parameters: {'n_layers': 3, 'embedding_dim': 128, 'lr': 0.00019509942015877229, 'lambda_val': 3.515785851729092e-05, 'batch_size': 3893, 'optimizer': 'Adam'}.
2026-05-24 01:30:31,212 - experiment_functions - INFO - Early stopping at epoch 550. Best Metrics: (0.010177606641646785, 0.008708609271523178, 0.010633224530687923)
2026-05-24 01:30:31,333 - optuna.study.study - INFO - Trial 57 finished with values: [0.010177606641646785, 0.008708609271523178, 0.010633224530687923] and parameters: {'n_layers': 3, 'embedding_dim': 128, 'lr': 0.06441961089499218, 'lambda_val': 3.515785851729092e-05, 'batch_size': 2288, 'optimizer': 'Adam'}.
2026-05-24 01:31:01,121 - experiment_functions - INFO - Early stopping at epoch 2650. Best Metrics: (0.017140329589508462, 0.01205298013245033, 0.016906853133739488)
2026-05-24 01:31:02,494 - optuna.study.study - INFO - Trial 58 finished with values: [0.017140329589508462, 0.01205298013245033, 0.016906853133739488] and parameters: {'n_layers': 2, 'embedding_dim': 256, 'lr': 0.0002366530914941107, 'lambda_val': 1.0794692535121076e-05, 'batch_size': 2213, 'optimizer': 'Adam'}.
2026-05-24 01:31:08,406 - experiment_functions - INFO - Early stopping at epoch 500. Best Metrics: (0.007815635242322852, 0.006225165562913908, 0.008251528159945712)
2026-05-24 01:31:09,294 - optuna.study.study - INFO - Trial 59 finished with values: [0.007815635242322852, 0.006225165562913908, 0.008251528159945712] and parameters: {'n_layers': 1, 'embedding_dim': 64, 'lr': 0.07280438350821411, 'lambda_val': 0.004825444205218699, 'batch_size': 2493, 'optimizer': 'Adam'}.
2026-05-24 01:31:16,185 - experiment_functions - INFO - Early stopping at epoch 550. Best Metrics: (0.016025661297144295, 0.012384105960264902, 0.016149038655650202)
2026-05-24 01:31:16,264 - optuna.study.study - INFO - Trial 60 finished with values: [0.016025661297144295, 0.012384105960264902, 0.016149038655650202] and parameters: {'n_layers': 4, 'embedding_dim': 96, 'lr': 0.003175767497275054, 'lambda_val': 1.1741946550104087e-06, 'batch_size': 3812, 'optimizer': 'Adam'}.
2026-05-24 01:31:30,064 - experiment_functions - INFO - Early stopping at epoch 1300. Best Metrics: (0.02124547964058639, 0.015314569536423841, 0.02128970721371062)
2026-05-24 01:31:30,140 - optuna.study.study - INFO - Trial 61 finished with values: [0.02124547964058639, 0.015314569536423841, 0.02128970721371062] and parameters: {'n_layers': 2, 'embedding_dim': 96, 'lr': 0.0005233015481570266, 'lambda_val': 1.858625399381744e-05, 'batch_size': 1343, 'optimizer': 'RMSprop'}.
2026-05-24 01:31:36,303 - experiment_functions - INFO - Early stopping at epoch 550. Best Metrics: (0.01351892659214749, 0.010413907284768213, 0.013774497616376304)
2026-05-24 01:31:37,863 - optuna.study.study - INFO - Trial 62 finished with values: [0.01351892659214749, 0.010413907284768213, 0.013774497616376304] and parameters: {'n_layers': 2, 'embedding_dim': 32, 'lr': 0.028175320224959402, 'lambda_val': 1.1443429579581734e-05, 'batch_size': 3241, 'optimizer': 'Adam'}.
2026-05-24 01:31:53,055 - experiment_functions - INFO - Early stopping at epoch 1450. Best Metrics: (0.0219105420781033, 0.016895695364238413, 0.02253323165187913)
2026-05-24 01:31:54,237 - optuna.study.study - INFO - Trial 63 finished with values: [0.0219105420781033, 0.016895695364238413, 0.02253323165187913] and parameters: {'n_layers': 3, 'embedding_dim': 96, 'lr': 0.0005233015481570266, 'lambda_val': 2.582067375745636e-06, 'batch_size': 652, 'optimizer': 'RMSprop'}.
2026-05-24 01:32:00,704 - experiment_functions - INFO - Early stopping at epoch 550. Best Metrics: (0.016580702564979514, 0.012483443708609272, 0.017072558853944705)
2026-05-24 01:32:02,418 - optuna.study.study - INFO - Trial 64 finished with values: [0.016580702564979514, 0.012483443708609272, 0.017072558853944705] and parameters: {'n_layers': 3, 'embedding_dim': 96, 'lr': 0.005852380695113062, 'lambda_val': 0.00010466579371271554, 'batch_size': 2147, 'optimizer': 'Adam'}.
2026-05-24 01:32:10,618 - experiment_functions - INFO - Early stopping at epoch 750. Best Metrics: (0.01916421541349369, 0.014768211920529802, 0.020380055266092843)
2026-05-24 01:32:10,699 - optuna.study.study - INFO - Trial 65 finished with values: [0.01916421541349369, 0.014768211920529802, 0.020380055266092843] and parameters: {'n_layers': 3, 'embedding_dim': 64, 'lr': 0.001254073391314583, 'lambda_val': 0.012208803351137528, 'batch_size': 925, 'optimizer': 'Adam'}.
2026-05-24 01:32:17,524 - experiment_functions - INFO - Early stopping at epoch 550. Best Metrics: (0.011269641478531819, 0.008998344370860927, 0.011275820127753796)
2026-05-24 01:32:17,614 - optuna.study.study - INFO - Trial 66 finished with values: [0.011269641478531819, 0.008998344370860927, 0.011275820127753796] and parameters: {'n_layers': 2, 'embedding_dim': 256, 'lr': 0.009682712385462021, 'lambda_val': 2.460268686247144e-06, 'batch_size': 925, 'optimizer': 'RMSprop'}.
2026-05-24 01:32:23,666 - experiment_functions - INFO - Early stopping at epoch 500. Best Metrics: (0.005282287770991537, 0.003973509933774834, 0.005125764309543471)
2026-05-24 01:32:23,757 - optuna.study.study - INFO - Trial 67 finished with values: [0.005282287770991537, 0.003973509933774834, 0.005125764309543471] and parameters: {'n_layers': 1, 'embedding_dim': 32, 'lr': 0.0003847621589190308, 'lambda_val': 0.00034146769308132945, 'batch_size': 4005, 'optimizer': 'SGD'}.
2026-05-24 01:33:02,454 - optuna.study.study - INFO - Trial 68 finished with values: [0.007247654588841806, 0.005678807947019868, 0.0074467048653757365] and parameters: {'n_layers': 1, 'embedding_dim': 96, 'lr': 4.842135369182381e-05, 'lambda_val': 0.002720399768458268, 'batch_size': 795, 'optimizer': 'RMSprop'}.
2026-05-24 01:33:39,932 - experiment_functions - INFO - Early stopping at epoch 3650. Best Metrics: (0.01848651052062073, 0.012682119205298015, 0.01791303709157199)
2026-05-24 01:33:40,020 - optuna.study.study - INFO - Trial 69 finished with values: [0.01848651052062073, 0.012682119205298015, 0.01791303709157199] and parameters: {'n_layers': 2, 'embedding_dim': 96, 'lr': 0.0002366530914941107, 'lambda_val': 2.460268686247144e-06, 'batch_size': 2288, 'optimizer': 'RMSprop'}.
2026-05-24 01:34:13,243 - experiment_functions - INFO - Early stopping at epoch 3100. Best Metrics: (0.018668981144085998, 0.014817880794701987, 0.018948849778753437)
2026-05-24 01:34:13,337 - optuna.study.study - INFO - Trial 70 finished with values: [0.018668981144085998, 0.014817880794701987, 0.018948849778753437] and parameters: {'n_layers': 4, 'embedding_dim': 64, 'lr': 0.00020698621093568563, 'lambda_val': 0.0007474419200611069, 'batch_size': 3717, 'optimizer': 'Adam'}.
2026-05-24 01:34:21,426 - experiment_functions - INFO - Early stopping at epoch 700. Best Metrics: (0.01760743083522495, 0.01269039735099338, 0.01777992421681851)
2026-05-24 01:34:21,513 - optuna.study.study - INFO - Trial 71 finished with values: [0.01760743083522495, 0.01269039735099338, 0.01777992421681851] and parameters: {'n_layers': 1, 'embedding_dim': 32, 'lr': 0.001254073391314583, 'lambda_val': 0.003592565815384345, 'batch_size': 4026, 'optimizer': 'Adam'}.
2026-05-24 01:34:29,010 - experiment_functions - INFO - Early stopping at epoch 600. Best Metrics: (0.01645150628044912, 0.012475165562913906, 0.01661556547487227)
2026-05-24 01:34:29,723 - optuna.study.study - INFO - Trial 72 finished with values: [0.01645150628044912, 0.012475165562913906, 0.01661556547487227] and parameters: {'n_layers': 1, 'embedding_dim': 96, 'lr': 0.001577754411362842, 'lambda_val': 1.4801449770617434e-06, 'batch_size': 3150, 'optimizer': 'RMSprop'}.
2026-05-24 01:35:09,454 - optuna.study.study - INFO - Trial 73 finished with values: [0.007133474980691232, 0.005786423841059603, 0.007482337563904146] and parameters: {'n_layers': 1, 'embedding_dim': 32, 'lr': 5.2049218486215085e-05, 'lambda_val': 6.912944452437839e-06, 'batch_size': 795, 'optimizer': 'RMSprop'}.
2026-05-24 01:35:19,291 - experiment_functions - INFO - Early stopping at epoch 1000. Best Metrics: (0.005642065461937598, 0.00468543046357616, 0.005869985066000881)
2026-05-24 01:35:20,151 - optuna.study.study - INFO - Trial 74 finished with values: [0.005642065461937598, 0.00468543046357616, 0.005869985066000881] and parameters: {'n_layers': 2, 'embedding_dim': 32, 'lr': 0.001268209095831261, 'lambda_val': 0.005624521247515971, 'batch_size': 3586, 'optimizer': 'SGD'}.
2026-05-24 01:35:26,575 - experiment_functions - INFO - Early stopping at epoch 550. Best Metrics: (0.015836876462711477, 0.012740066225165563, 0.016363281410977662)
2026-05-24 01:35:27,288 - optuna.study.study - INFO - Trial 75 finished with values: [0.015836876462711477, 0.012740066225165563, 0.016363281410977662] and parameters: {'n_layers': 3, 'embedding_dim': 96, 'lr': 0.003175767497275054, 'lambda_val': 8.365479889081114e-06, 'batch_size': 1738, 'optimizer': 'RMSprop'}.
2026-05-24 01:35:36,069 - experiment_functions - INFO - Early stopping at epoch 850. Best Metrics: (0.005955383492589783, 0.006233443708609273, 0.007234546987439534)
2026-05-24 01:35:36,184 - optuna.study.study - INFO - Trial 76 finished with values: [0.005955383492589783, 0.006233443708609273, 0.007234546987439534] and parameters: {'n_layers': 1, 'embedding_dim': 32, 'lr': 0.0066909817110652366, 'lambda_val': 0.05582046710492708, 'batch_size': 3684, 'optimizer': 'RMSprop'}.
2026-05-24 01:36:13,096 - optuna.study.study - INFO - Trial 77 finished with values: [0.006461557816179602, 0.005, 0.0063914616110819795] and parameters: {'n_layers': 2, 'embedding_dim': 96, 'lr': 3.6928340184332895e-05, 'lambda_val': 1.4652981275810046e-05, 'batch_size': 834, 'optimizer': 'RMSprop'}.
2026-05-24 01:36:18,714 - experiment_functions - INFO - Early stopping at epoch 500. Best Metrics: (0.005080475992204324, 0.004188741721854305, 0.0051748538167255215)
2026-05-24 01:36:19,223 - optuna.study.study - INFO - Trial 78 finished with values: [0.005080475992204324, 0.004188741721854305, 0.0051748538167255215] and parameters: {'n_layers': 4, 'embedding_dim': 64, 'lr': 0.004138413370835968, 'lambda_val': 0.08511861936492485, 'batch_size': 681, 'optimizer': 'SGD'}.
2026-05-24 01:36:25,000 - experiment_functions - INFO - Early stopping at epoch 500. Best Metrics: (0.0069275852134333404, 0.005430463576158941, 0.00681917315220134)
2026-05-24 01:36:25,781 - optuna.study.study - INFO - Trial 79 finished with values: [0.0069275852134333404, 0.005430463576158941, 0.00681917315220134] and parameters: {'n_layers': 4, 'embedding_dim': 32, 'lr': 0.009682712385462021, 'lambda_val': 0.012208803351137528, 'batch_size': 847, 'optimizer': 'RMSprop'}.
2026-05-24 01:36:32,706 - experiment_functions - INFO - Early stopping at epoch 600. Best Metrics: (0.016905359287499283, 0.013576158940397352, 0.01771687046275311)
2026-05-24 01:36:32,806 - optuna.study.study - INFO - Trial 80 finished with values: [0.016905359287499283, 0.013576158940397352, 0.01771687046275311] and parameters: {'n_layers': 4, 'embedding_dim': 64, 'lr': 0.003175767497275054, 'lambda_val': 1.1741946550104087e-06, 'batch_size': 3458, 'optimizer': 'Adam'}.
2026-05-24 01:37:09,997 - experiment_functions - INFO - Early stopping at epoch 3900. Best Metrics: (0.017505698763686073, 0.012259933774834439, 0.017366990120258743)
2026-05-24 01:37:10,080 - optuna.study.study - INFO - Trial 81 finished with values: [0.017505698763686073, 0.012259933774834439, 0.017366990120258743] and parameters: {'n_layers': 1, 'embedding_dim': 64, 'lr': 0.0001986105443631555, 'lambda_val': 9.265458189902457e-05, 'batch_size': 3238, 'optimizer': 'RMSprop'}.
2026-05-24 01:37:19,242 - experiment_functions - INFO - Early stopping at epoch 850. Best Metrics: (0.017838012339288712, 0.0128476821192053, 0.01800469803386498)
2026-05-24 01:37:19,330 - optuna.study.study - INFO - Trial 82 finished with values: [0.017838012339288712, 0.0128476821192053, 0.01800469803386498] and parameters: {'n_layers': 1, 'embedding_dim': 96, 'lr': 0.0011689507386455319, 'lambda_val': 1.1540981830430722e-05, 'batch_size': 1777, 'optimizer': 'Adam'}.
2026-05-24 01:37:26,261 - experiment_functions - INFO - Early stopping at epoch 550. Best Metrics: (0.011008285174224051, 0.008832781456953643, 0.010984460959664141)
2026-05-24 01:37:26,351 - optuna.study.study - INFO - Trial 83 finished with values: [0.011008285174224051, 0.008832781456953643, 0.010984460959664141] and parameters: {'n_layers': 2, 'embedding_dim': 256, 'lr': 0.005852380695113062, 'lambda_val': 0.012208803351137528, 'batch_size': 1362, 'optimizer': 'Adam'}.
2026-05-24 01:37:32,781 - experiment_functions - INFO - Early stopping at epoch 500. Best Metrics: (0.005317300145107138, 0.004470198675496689, 0.005618617142375595)
2026-05-24 01:37:33,075 - optuna.study.study - INFO - Trial 84 finished with values: [0.005317300145107138, 0.004470198675496689, 0.005618617142375595] and parameters: {'n_layers': 2, 'embedding_dim': 256, 'lr': 1.1599018450439644e-05, 'lambda_val': 0.09110107909394201, 'batch_size': 2493, 'optimizer': 'SGD'}.
2026-05-24 01:37:39,450 - experiment_functions - INFO - Early stopping at epoch 550. Best Metrics: (0.009349594239087045, 0.007847682119205298, 0.009719470303871013)
2026-05-24 01:37:41,030 - optuna.study.study - INFO - Trial 85 finished with values: [0.009349594239087045, 0.007847682119205298, 0.009719470303871013] and parameters: {'n_layers': 3, 'embedding_dim': 64, 'lr': 0.05058814984200081, 'lambda_val': 0.0009443756499535536, 'batch_size': 652, 'optimizer': 'Adam'}.
2026-05-24 01:37:48,308 - experiment_functions - INFO - Early stopping at epoch 550. Best Metrics: (0.015030315216343376, 0.01365066225165563, 0.01683716768682007)
2026-05-24 01:37:50,029 - optuna.study.study - INFO - Trial 86 finished with values: [0.015030315216343376, 0.01365066225165563, 0.01683716768682007] and parameters: {'n_layers': 4, 'embedding_dim': 128, 'lr': 0.004599696596434292, 'lambda_val': 0.019669827939797803, 'batch_size': 681, 'optimizer': 'Adam'}.
2026-05-24 01:38:02,672 - experiment_functions - INFO - Early stopping at epoch 550. Best Metrics: (0.016684128958723208, 0.012549668874172184, 0.016686182847799283)
2026-05-24 01:38:02,768 - optuna.study.study - INFO - Trial 87 finished with values: [0.016684128958723208, 0.012549668874172184, 0.016686182847799283] and parameters: {'n_layers': 3, 'embedding_dim': 96, 'lr': 0.004320951557015901, 'lambda_val': 9.206863327207947e-05, 'batch_size': 933, 'optimizer': 'RMSprop'}.
2026-05-24 01:38:44,095 - optuna.study.study - INFO - Trial 88 finished with values: [0.012306775031924906, 0.00966887417218543, 0.01312552917248478] and parameters: {'n_layers': 1, 'embedding_dim': 96, 'lr': 0.00010377232449768757, 'lambda_val': 0.00043944063270848416, 'batch_size': 3737, 'optimizer': 'RMSprop'}.
2026-05-24 01:39:25,071 - optuna.study.study - INFO - Trial 89 finished with values: [0.008519191186324184, 0.006597682119205298, 0.008706615037645561] and parameters: {'n_layers': 3, 'embedding_dim': 96, 'lr': 4.842135369182381e-05, 'lambda_val': 0.002720399768458268, 'batch_size': 3150, 'optimizer': 'RMSprop'}.
2026-05-24 01:39:37,202 - experiment_functions - INFO - Early stopping at epoch 1100. Best Metrics: (0.015921070798824887, 0.011846026490066225, 0.01626431425417274)
2026-05-24 01:39:37,303 - optuna.study.study - INFO - Trial 90 finished with values: [0.015921070798824887, 0.011846026490066225, 0.01626431425417274] and parameters: {'n_layers': 1, 'embedding_dim': 96, 'lr': 0.0005175032260958534, 'lambda_val': 1.4801449770617434e-06, 'batch_size': 4005, 'optimizer': 'RMSprop'}.
2026-05-24 01:39:43,440 - experiment_functions - INFO - Early stopping at epoch 500. Best Metrics: (0.004945165640456183, 0.003890728476821192, 0.004953201934251366)
2026-05-24 01:39:43,920 - optuna.study.study - INFO - Trial 91 finished with values: [0.004945165640456183, 0.003890728476821192, 0.004953201934251366] and parameters: {'n_layers': 4, 'embedding_dim': 96, 'lr': 0.003577333342921058, 'lambda_val': 0.0007474419200611069, 'batch_size': 1328, 'optimizer': 'SGD'}.
2026-05-24 01:39:59,835 - experiment_functions - INFO - Early stopping at epoch 1500. Best Metrics: (0.006488634715704649, 0.006912251655629139, 0.007987378727870746)
2026-05-24 01:40:00,568 - optuna.study.study - INFO - Trial 92 finished with values: [0.006488634715704649, 0.006912251655629139, 0.007987378727870746] and parameters: {'n_layers': 4, 'embedding_dim': 128, 'lr': 0.0697119382170466, 'lambda_val': 0.06530239771643709, 'batch_size': 1897, 'optimizer': 'Adam'}.
2026-05-24 01:40:41,171 - optuna.study.study - INFO - Trial 93 finished with values: [0.01753265760254722, 0.01388245033112583, 0.01844055695889176] and parameters: {'n_layers': 4, 'embedding_dim': 96, 'lr': 0.0001329598595798264, 'lambda_val': 0.0031011395670577234, 'batch_size': 4005, 'optimizer': 'RMSprop'}.
2026-05-24 01:41:10,007 - experiment_functions - INFO - Early stopping at epoch 2950. Best Metrics: (0.015722450623772685, 0.011639072847682121, 0.01590388395982003)
2026-05-24 01:41:10,099 - optuna.study.study - INFO - Trial 94 finished with values: [0.015722450623772685, 0.011639072847682121, 0.01590388395982003] and parameters: {'n_layers': 1, 'embedding_dim': 128, 'lr': 0.00022989266518175493, 'lambda_val': 1.1540981830430722e-05, 'batch_size': 3238, 'optimizer': 'RMSprop'}.
2026-05-24 01:41:48,283 - optuna.study.study - INFO - Trial 95 finished with values: [0.00993418991041597, 0.008294701986754967, 0.010784395546596251] and parameters: {'n_layers': 3, 'embedding_dim': 96, 'lr': 8.467976866851139e-05, 'lambda_val': 0.0009443756499535536, 'batch_size': 1393, 'optimizer': 'RMSprop'}.
