2026-05-24 08:43:16,024 - optuna.study.study - INFO - Trial 108 finished with values: [0.022904189865306346, 0.016183774834437087, 0.021904073745860564] and parameters: {'n_layers': 1, 'embedding_dim': 128, 'lr': 0.011587678380610592, 'lambda_val': 1.415798354583243e-06, 'batch_size': 3275, 'optimizer': 'RMSprop'}.
2026-05-24 08:43:23,723 - experiment_functions - INFO - Early stopping at epoch 550. Best Metrics: (0.024871514746541035, 0.01724337748344371, 0.02298597716349468)
2026-05-24 08:43:23,815 - optuna.study.study - INFO - Trial 109 finished with values: [0.024871514746541035, 0.01724337748344371, 0.02298597716349468] and parameters: {'n_layers': 4, 'embedding_dim': 64, 'lr': 0.002221889493840201, 'lambda_val': 8.523357255734578e-06, 'batch_size': 3424, 'optimizer': 'Adam'}.
2026-05-24 08:43:30,808 - experiment_functions - INFO - Early stopping at epoch 500. Best Metrics: (0.005272299209014404, 0.00429635761589404, 0.005558350831136042)
2026-05-24 08:43:30,913 - optuna.study.study - INFO - Trial 110 finished with values: [0.005272299209014404, 0.00429635761589404, 0.005558350831136042] and parameters: {'n_layers': 4, 'embedding_dim': 64, 'lr': 0.00012197369968794222, 'lambda_val': 0.028260644150952398, 'batch_size': 3424, 'optimizer': 'Adam'}.
2026-05-24 08:43:39,533 - experiment_functions - INFO - Early stopping at epoch 650. Best Metrics: (0.054649989021449956, 0.03428807947019868, 0.047673012336356756)
2026-05-24 08:43:39,633 - optuna.study.study - INFO - Trial 111 finished with values: [0.054649989021449956, 0.03428807947019868, 0.047673012336356756] and parameters: {'n_layers': 1, 'embedding_dim': 64, 'lr': 0.0019498675283919575, 'lambda_val': 1.122316914307546e-06, 'batch_size': 862, 'optimizer': 'RMSprop'}.
2026-05-24 08:43:57,836 - experiment_functions - INFO - Early stopping at epoch 1550. Best Metrics: (0.012441518569033931, 0.013410596026490066, 0.016420345835231043)
2026-05-24 08:43:57,922 - optuna.study.study - INFO - Trial 112 finished with values: [0.012441518569033931, 0.013410596026490066, 0.016420345835231043] and parameters: {'n_layers': 1, 'embedding_dim': 64, 'lr': 0.004142601144800484, 'lambda_val': 0.0393518625138606, 'batch_size': 2675, 'optimizer': 'RMSprop'}.
2026-05-24 08:44:05,461 - experiment_functions - INFO - Early stopping at epoch 550. Best Metrics: (0.04826571228463573, 0.02935430463576159, 0.04293968459089215)
2026-05-24 08:44:05,552 - optuna.study.study - INFO - Trial 113 finished with values: [0.04826571228463573, 0.02935430463576159, 0.04293968459089215] and parameters: {'n_layers': 1, 'embedding_dim': 32, 'lr': 0.0019498675283919575, 'lambda_val': 0.0011457679520731478, 'batch_size': 3934, 'optimizer': 'RMSprop'}.
2026-05-24 08:44:13,139 - experiment_functions - INFO - Early stopping at epoch 550. Best Metrics: (0.04685912289793381, 0.03097682119205298, 0.04431039241953008)
2026-05-24 08:44:13,237 - optuna.study.study - INFO - Trial 114 finished with values: [0.04685912289793381, 0.03097682119205298, 0.04431039241953008] and parameters: {'n_layers': 1, 'embedding_dim': 128, 'lr': 0.002019850627421517, 'lambda_val': 0.000621169344675621, 'batch_size': 3974, 'optimizer': 'RMSprop'}.
2026-05-24 08:44:22,527 - experiment_functions - INFO - Early stopping at epoch 550. Best Metrics: (0.03479817966222718, 0.023476821192052983, 0.03294253772763008)
2026-05-24 08:44:22,643 - optuna.study.study - INFO - Trial 115 finished with values: [0.03479817966222718, 0.023476821192052983, 0.03294253772763008] and parameters: {'n_layers': 3, 'embedding_dim': 256, 'lr': 0.002019850627421517, 'lambda_val': 0.000347540583282814, 'batch_size': 3605, 'optimizer': 'Adam'}.
2026-05-24 08:44:35,294 - experiment_functions - INFO - Early stopping at epoch 1000. Best Metrics: (0.03131880550676271, 0.021506622516556294, 0.029904906301697873)
2026-05-24 08:44:35,399 - optuna.study.study - INFO - Trial 116 finished with values: [0.03131880550676271, 0.021506622516556294, 0.029904906301697873] and parameters: {'n_layers': 1, 'embedding_dim': 128, 'lr': 0.005444060961063268, 'lambda_val': 0.000621169344675621, 'batch_size': 3974, 'optimizer': 'RMSprop'}.
2026-05-24 08:44:49,469 - experiment_functions - INFO - Early stopping at epoch 1000. Best Metrics: (0.028476393638430096, 0.020852649006622516, 0.02803298833662072)
2026-05-24 08:44:49,564 - optuna.study.study - INFO - Trial 117 finished with values: [0.028476393638430096, 0.020852649006622516, 0.02803298833662072] and parameters: {'n_layers': 4, 'embedding_dim': 96, 'lr': 0.00027037181334258007, 'lambda_val': 0.0011457679520731478, 'batch_size': 3538, 'optimizer': 'RMSprop'}.
2026-05-24 08:44:57,051 - experiment_functions - INFO - Early stopping at epoch 550. Best Metrics: (0.021982926720001, 0.018799668874172185, 0.024265000445756777)
2026-05-24 08:44:57,227 - optuna.study.study - INFO - Trial 118 finished with values: [0.021982926720001, 0.018799668874172185, 0.024265000445756777] and parameters: {'n_layers': 1, 'embedding_dim': 128, 'lr': 0.002019850627421517, 'lambda_val': 0.02998001447563536, 'batch_size': 3974, 'optimizer': 'RMSprop'}.
2026-05-24 08:45:04,322 - experiment_functions - INFO - Early stopping at epoch 500. Best Metrics: (0.004920478982142892, 0.004064569536423841, 0.005098881902316045)
2026-05-24 08:45:04,426 - optuna.study.study - INFO - Trial 119 finished with values: [0.004920478982142892, 0.004064569536423841, 0.005098881902316045] and parameters: {'n_layers': 2, 'embedding_dim': 96, 'lr': 0.00010049142370938069, 'lambda_val': 0.0393518625138606, 'batch_size': 2781, 'optimizer': 'RMSprop'}.
2026-05-24 08:45:59,127 - optuna.study.study - INFO - Trial 120 finished with values: [0.03795017658405267, 0.024180463576158943, 0.03481330923839964] and parameters: {'n_layers': 4, 'embedding_dim': 128, 'lr': 0.00010049142370938069, 'lambda_val': 8.455049892667247e-06, 'batch_size': 1011, 'optimizer': 'RMSprop'}.
2026-05-24 08:46:52,003 - optuna.study.study - INFO - Trial 121 finished with values: [0.035912945817244774, 0.02389072847682119, 0.03345629326227872] and parameters: {'n_layers': 3, 'embedding_dim': 128, 'lr': 0.00012197369968794222, 'lambda_val': 0.0011457679520731478, 'batch_size': 1189, 'optimizer': 'RMSprop'}.
2026-05-24 08:46:59,891 - experiment_functions - INFO - Early stopping at epoch 550. Best Metrics: (0.030564465924673115, 0.021125827814569537, 0.027922386930582112)
2026-05-24 08:46:59,982 - optuna.study.study - INFO - Trial 122 finished with values: [0.030564465924673115, 0.021125827814569537, 0.027922386930582112] and parameters: {'n_layers': 2, 'embedding_dim': 128, 'lr': 0.0015435244296002795, 'lambda_val': 3.3533948625948345e-06, 'batch_size': 3332, 'optimizer': 'RMSprop'}.
2026-05-24 08:47:10,047 - experiment_functions - INFO - Early stopping at epoch 750. Best Metrics: (0.028936092015374223, 0.020024834437086095, 0.02728572883230024)
2026-05-24 08:47:10,476 - optuna.study.study - INFO - Trial 123 finished with values: [0.028936092015374223, 0.020024834437086095, 0.02728572883230024] and parameters: {'n_layers': 4, 'embedding_dim': 32, 'lr': 0.0007100702200577561, 'lambda_val': 2.346379884027025e-05, 'batch_size': 3601, 'optimizer': 'Adam'}.
2026-05-24 08:47:26,169 - experiment_functions - INFO - Early stopping at epoch 1150. Best Metrics: (0.04460464165098303, 0.028899006622516557, 0.040128785240144384)
2026-05-24 08:47:26,536 - optuna.study.study - INFO - Trial 124 finished with values: [0.04460464165098303, 0.028899006622516557, 0.040128785240144384] and parameters: {'n_layers': 2, 'embedding_dim': 128, 'lr': 0.00027037181334258007, 'lambda_val': 9.94682305058342e-05, 'batch_size': 3825, 'optimizer': 'RMSprop'}.
2026-05-24 08:48:15,954 - optuna.study.study - INFO - Trial 125 finished with values: [0.02819842560139601, 0.01883278145695364, 0.026458085420724958] and parameters: {'n_layers': 4, 'embedding_dim': 64, 'lr': 0.00010049142370938069, 'lambda_val': 8.455049892667247e-06, 'batch_size': 1011, 'optimizer': 'RMSprop'}.
2026-05-24 08:48:36,951 - experiment_functions - INFO - Early stopping at epoch 1700. Best Metrics: (0.05453083040743961, 0.03439569536423841, 0.04858648938592885)
2026-05-24 08:48:37,576 - optuna.study.study - INFO - Trial 126 finished with values: [0.05453083040743961, 0.03439569536423841, 0.04858648938592885] and parameters: {'n_layers': 1, 'embedding_dim': 128, 'lr': 0.0003755353524054084, 'lambda_val': 0.0004077151861442529, 'batch_size': 3076, 'optimizer': 'RMSprop'}.
2026-05-24 08:48:45,346 - experiment_functions - INFO - Early stopping at epoch 550. Best Metrics: (0.0443645720829246, 0.02945364238410596, 0.040244540192978566)
2026-05-24 08:48:45,433 - optuna.study.study - INFO - Trial 127 finished with values: [0.0443645720829246, 0.02945364238410596, 0.040244540192978566] and parameters: {'n_layers': 1, 'embedding_dim': 128, 'lr': 0.0019498675283919575, 'lambda_val': 0.000621169344675621, 'batch_size': 3974, 'optimizer': 'RMSprop'}.
2026-05-24 08:48:53,054 - experiment_functions - INFO - Early stopping at epoch 550. Best Metrics: (0.025685955555709697, 0.019246688741721855, 0.025627960828431662)
2026-05-24 08:48:53,147 - optuna.study.study - INFO - Trial 128 finished with values: [0.025685955555709697, 0.019246688741721855, 0.025627960828431662] and parameters: {'n_layers': 2, 'embedding_dim': 128, 'lr': 0.0019498675283919575, 'lambda_val': 0.0011457679520731478, 'batch_size': 1012, 'optimizer': 'RMSprop'}.
2026-05-24 08:49:09,004 - experiment_functions - INFO - Early stopping at epoch 1100. Best Metrics: (0.026185915216252513, 0.014511589403973511, 0.021632290043932807)
2026-05-24 08:49:09,335 - optuna.study.study - INFO - Trial 129 finished with values: [0.026185915216252513, 0.014511589403973511, 0.021632290043932807] and parameters: {'n_layers': 4, 'embedding_dim': 128, 'lr': 0.011587678380610592, 'lambda_val': 1.415798354583243e-06, 'batch_size': 3275, 'optimizer': 'RMSprop'}.
2026-05-24 08:49:20,270 - experiment_functions - INFO - Early stopping at epoch 850. Best Metrics: (0.02385189343298608, 0.014561258278145698, 0.02071619925212932)
2026-05-24 08:49:20,642 - optuna.study.study - INFO - Trial 130 finished with values: [0.02385189343298608, 0.014561258278145698, 0.02071619925212932] and parameters: {'n_layers': 2, 'embedding_dim': 64, 'lr': 0.016831383434644576, 'lambda_val': 1.4219577427815883e-06, 'batch_size': 3601, 'optimizer': 'Adam'}.
2026-05-24 08:49:28,522 - experiment_functions - INFO - Early stopping at epoch 550. Best Metrics: (0.017710763849169413, 0.015339403973509936, 0.019582670113678112)
2026-05-24 08:49:28,611 - optuna.study.study - INFO - Trial 131 finished with values: [0.017710763849169413, 0.015339403973509936, 0.019582670113678112] and parameters: {'n_layers': 2, 'embedding_dim': 128, 'lr': 0.002019850627421517, 'lambda_val': 0.0005144021469830869, 'batch_size': 3934, 'optimizer': 'RMSprop'}.
2026-05-24 08:49:57,085 - experiment_functions - INFO - Early stopping at epoch 2100. Best Metrics: (0.009272486064988116, 0.009213576158940398, 0.011133986495546944)
2026-05-24 08:49:57,171 - optuna.study.study - INFO - Trial 132 finished with values: [0.009272486064988116, 0.009213576158940398, 0.011133986495546944] and parameters: {'n_layers': 4, 'embedding_dim': 128, 'lr': 0.011587678380610592, 'lambda_val': 0.012192357251689472, 'batch_size': 3275, 'optimizer': 'RMSprop'}.
2026-05-24 08:50:05,047 - experiment_functions - INFO - Early stopping at epoch 550. Best Metrics: (0.020023575877227747, 0.016274834437086095, 0.020594801193190956)
2026-05-24 08:50:05,161 - optuna.study.study - INFO - Trial 133 finished with values: [0.020023575877227747, 0.016274834437086095, 0.020594801193190956] and parameters: {'n_layers': 2, 'embedding_dim': 128, 'lr': 0.0025526763964279944, 'lambda_val': 8.455049892667247e-06, 'batch_size': 1011, 'optimizer': 'RMSprop'}.
2026-05-24 08:50:56,333 - optuna.study.study - INFO - Trial 134 finished with values: [0.03661403468249986, 0.02449503311258278, 0.03382401035702704] and parameters: {'n_layers': 3, 'embedding_dim': 64, 'lr': 0.00015717441755135915, 'lambda_val': 0.000621169344675621, 'batch_size': 3363, 'optimizer': 'Adam'}.
2026-05-24 08:51:03,118 - experiment_functions - INFO - Early stopping at epoch 500. Best Metrics: (0.004946190481240141, 0.004023178807947021, 0.005401769957268136)
2026-05-24 08:51:03,211 - optuna.study.study - INFO - Trial 135 finished with values: [0.004946190481240141, 0.004023178807947021, 0.005401769957268136] and parameters: {'n_layers': 1, 'embedding_dim': 256, 'lr': 0.00027037181334258007, 'lambda_val': 0.07720465530276911, 'batch_size': 2363, 'optimizer': 'SGD'}.
2026-05-24 08:51:17,582 - experiment_functions - INFO - Early stopping at epoch 1050. Best Metrics: (0.052046578510075395, 0.033269867549668874, 0.04692549929060221)
2026-05-24 08:51:17,903 - optuna.study.study - INFO - Trial 136 finished with values: [0.052046578510075395, 0.033269867549668874, 0.04692549929060221] and parameters: {'n_layers': 1, 'embedding_dim': 256, 'lr': 0.0003755353524054084, 'lambda_val': 0.00800073098738819, 'batch_size': 3076, 'optimizer': 'RMSprop'}.
2026-05-24 08:51:25,522 - experiment_functions - INFO - Early stopping at epoch 550. Best Metrics: (0.03914227456056215, 0.027086092715231786, 0.03594339903020673)
2026-05-24 08:51:25,616 - optuna.study.study - INFO - Trial 137 finished with values: [0.03914227456056215, 0.027086092715231786, 0.03594339903020673] and parameters: {'n_layers': 1, 'embedding_dim': 128, 'lr': 0.002221889493840201, 'lambda_val': 0.000963421834632777, 'batch_size': 3974, 'optimizer': 'RMSprop'}.
2026-05-24 08:52:09,301 - optuna.study.study - INFO - Trial 138 finished with values: [0.005774757224757556, 0.004619205298013246, 0.0060639669580117815] and parameters: {'n_layers': 1, 'embedding_dim': 128, 'lr': 2.704451576309213e-05, 'lambda_val': 0.0007561839367868583, 'batch_size': 3076, 'optimizer': 'RMSprop'}.
2026-05-24 08:52:17,588 - experiment_functions - INFO - Early stopping at epoch 600. Best Metrics: (0.05162452642463875, 0.03262417218543046, 0.048103274451397074)
2026-05-24 08:52:17,729 - optuna.study.study - INFO - Trial 139 finished with values: [0.05162452642463875, 0.03262417218543046, 0.048103274451397074] and parameters: {'n_layers': 1, 'embedding_dim': 128, 'lr': 0.0019498675283919575, 'lambda_val': 8.523357255734578e-06, 'batch_size': 1091, 'optimizer': 'RMSprop'}.
2026-05-24 08:52:24,982 - experiment_functions - INFO - Early stopping at epoch 550. Best Metrics: (0.052406849892560746, 0.03302980132450331, 0.048404809178700166)
2026-05-24 08:52:25,076 - optuna.study.study - INFO - Trial 140 finished with values: [0.052406849892560746, 0.03302980132450331, 0.048404809178700166] and parameters: {'n_layers': 1, 'embedding_dim': 64, 'lr': 0.0019498675283919575, 'lambda_val': 8.523357255734578e-06, 'batch_size': 2226, 'optimizer': 'RMSprop'}.
2026-05-24 08:53:09,825 - experiment_functions - INFO - Early stopping at epoch 3700. Best Metrics: (0.02413056607641399, 0.016564569536423844, 0.022837225510970446)
2026-05-24 08:53:10,214 - optuna.study.study - INFO - Trial 141 finished with values: [0.02413056607641399, 0.016564569536423844, 0.022837225510970446] and parameters: {'n_layers': 2, 'embedding_dim': 128, 'lr': 0.017207922360898822, 'lambda_val': 0.0011457679520731478, 'batch_size': 914, 'optimizer': 'RMSprop'}.
2026-05-24 08:53:28,363 - experiment_functions - INFO - Early stopping at epoch 1550. Best Metrics: (0.014333029909683208, 0.013973509933774836, 0.017266142920329908)
2026-05-24 08:53:28,463 - optuna.study.study - INFO - Trial 142 finished with values: [0.014333029909683208, 0.013973509933774836, 0.017266142920329908] and parameters: {'n_layers': 1, 'embedding_dim': 64, 'lr': 0.011587678380610592, 'lambda_val': 0.0393518625138606, 'batch_size': 2675, 'optimizer': 'Adam'}.
2026-05-24 08:54:15,512 - optuna.study.study - INFO - Trial 143 finished with values: [0.04719288090848883, 0.029395695364238413, 0.04375852168720828] and parameters: {'n_layers': 2, 'embedding_dim': 32, 'lr': 0.000249352656785218, 'lambda_val': 1.4219577427815883e-06, 'batch_size': 1833, 'optimizer': 'RMSprop'}.
2026-05-24 08:54:24,361 - experiment_functions - INFO - Early stopping at epoch 500. Best Metrics: (0.005130473573631106, 0.004064569536423842, 0.0050826994603205035)
2026-05-24 08:54:25,636 - optuna.study.study - INFO - Trial 144 finished with values: [0.005130473573631106, 0.004064569536423842, 0.0050826994603205035] and parameters: {'n_layers': 4, 'embedding_dim': 256, 'lr': 0.0007100702200577561, 'lambda_val': 0.0011457679520731478, 'batch_size': 2417, 'optimizer': 'SGD'}.
2026-05-24 08:54:34,719 - experiment_functions - INFO - Early stopping at epoch 700. Best Metrics: (0.019724170084981514, 0.014925496688741723, 0.02007432392176762)
2026-05-24 08:54:34,792 - optuna.study.study - INFO - Trial 145 finished with values: [0.019724170084981514, 0.014925496688741723, 0.02007432392176762] and parameters: {'n_layers': 1, 'embedding_dim': 64, 'lr': 0.014769636375767437, 'lambda_val': 5.10420277675261e-05, 'batch_size': 3642, 'optimizer': 'RMSprop'}.
2026-05-24 08:54:42,066 - experiment_functions - INFO - Early stopping at epoch 550. Best Metrics: (0.015256171323560701, 0.012218543046357618, 0.016144359653026314)
2026-05-24 08:54:42,135 - optuna.study.study - INFO - Trial 146 finished with values: [0.015256171323560701, 0.012218543046357618, 0.016144359653026314] and parameters: {'n_layers': 1, 'embedding_dim': 128, 'lr': 0.022331348795827086, 'lambda_val': 4.601372605867572e-05, 'batch_size': 2620, 'optimizer': 'RMSprop'}.
2026-05-24 08:54:52,716 - experiment_functions - INFO - Early stopping at epoch 800. Best Metrics: (0.02404624157205442, 0.015488410596026491, 0.021167049144549078)
2026-05-24 08:54:52,797 - optuna.study.study - INFO - Trial 147 finished with values: [0.02404624157205442, 0.015488410596026491, 0.021167049144549078] and parameters: {'n_layers': 2, 'embedding_dim': 96, 'lr': 0.014769636375767437, 'lambda_val': 5.10420277675261e-05, 'batch_size': 2681, 'optimizer': 'Adam'}.
2026-05-24 08:54:59,688 - experiment_functions - INFO - Early stopping at epoch 500. Best Metrics: (0.0054356491836160415, 0.004561258278145696, 0.0054308085608220785)
2026-05-24 08:54:59,798 - optuna.study.study - INFO - Trial 148 finished with values: [0.0054356491836160415, 0.004561258278145696, 0.0054308085608220785] and parameters: {'n_layers': 4, 'embedding_dim': 64, 'lr': 0.011587678380610592, 'lambda_val': 1.415798354583243e-06, 'batch_size': 1445, 'optimizer': 'SGD'}.
2026-05-24 08:55:07,264 - experiment_functions - INFO - Early stopping at epoch 550. Best Metrics: (0.045687357569504504, 0.028741721854304635, 0.04118297166219533)
2026-05-24 08:55:07,354 - optuna.study.study - INFO - Trial 149 finished with values: [0.045687357569504504, 0.028741721854304635, 0.04118297166219533] and parameters: {'n_layers': 1, 'embedding_dim': 128, 'lr': 0.0025526763964279944, 'lambda_val': 0.0011457679520731478, 'batch_size': 1091, 'optimizer': 'RMSprop'}.
2026-05-24 08:55:14,932 - experiment_functions - INFO - Early stopping at epoch 550. Best Metrics: (0.052687118733630384, 0.030968543046357617, 0.04559587246557079)
2026-05-24 08:55:15,428 - optuna.study.study - INFO - Trial 150 finished with values: [0.052687118733630384, 0.030968543046357617, 0.04559587246557079] and parameters: {'n_layers': 1, 'embedding_dim': 128, 'lr': 0.002019850627421517, 'lambda_val': 9.94682305058342e-05, 'batch_size': 1456, 'optimizer': 'RMSprop'}.
2026-05-24 08:55:28,231 - experiment_functions - INFO - Early stopping at epoch 550. Best Metrics: (0.04705508733231354, 0.029834437086092715, 0.042584148219608875)
2026-05-24 08:55:28,317 - optuna.study.study - INFO - Trial 151 finished with values: [0.04705508733231354, 0.029834437086092715, 0.042584148219608875] and parameters: {'n_layers': 1, 'embedding_dim': 32, 'lr': 0.002019850627421517, 'lambda_val': 0.000621169344675621, 'batch_size': 3974, 'optimizer': 'RMSprop'}.
2026-05-24 08:56:11,770 - optuna.study.study - INFO - Trial 152 finished with values: [0.006514019415148856, 0.005240066225165563, 0.006964904248755979] and parameters: {'n_layers': 1, 'embedding_dim': 128, 'lr': 0.00013328446753577082, 'lambda_val': 0.0011457679520731478, 'batch_size': 862, 'optimizer': 'Adam'}.
2026-05-24 08:56:27,066 - experiment_functions - INFO - Early stopping at epoch 950. Best Metrics: (0.025923468790558967, 0.014693708609271524, 0.02197997093929797)
2026-05-24 08:56:27,158 - optuna.study.study - INFO - Trial 153 finished with values: [0.025923468790558967, 0.014693708609271524, 0.02197997093929797] and parameters: {'n_layers': 3, 'embedding_dim': 256, 'lr': 0.012649866343626089, 'lambda_val': 8.455049892667247e-06, 'batch_size': 2529, 'optimizer': 'Adam'}.
2026-05-24 08:56:35,117 - experiment_functions - INFO - Early stopping at epoch 600. Best Metrics: (0.05111068277296421, 0.0314817880794702, 0.04416711170894757)
2026-05-24 08:56:35,194 - optuna.study.study - INFO - Trial 154 finished with values: [0.05111068277296421, 0.0314817880794702, 0.04416711170894757] and parameters: {'n_layers': 1, 'embedding_dim': 64, 'lr': 0.0019498675283919575, 'lambda_val': 1.122316914307546e-06, 'batch_size': 2036, 'optimizer': 'RMSprop'}.
2026-05-24 08:57:24,441 - optuna.study.study - INFO - Trial 155 finished with values: [0.030090921583838293, 0.021009933774834438, 0.029050004086222964] and parameters: {'n_layers': 2, 'embedding_dim': 128, 'lr': 0.00010049142370938069, 'lambda_val': 1.303699392984654e-05, 'batch_size': 2708, 'optimizer': 'RMSprop'}.
2026-05-24 08:57:33,244 - experiment_functions - INFO - Early stopping at epoch 650. Best Metrics: (0.055189709484970303, 0.03313741721854304, 0.048999010167393206)
