2026-05-24 04:03:33,886 - optuna.study.study - INFO - Trial 60 finished with values: [0.01487174200016095, 0.011216887417218543, 0.01486589646054959] and parameters: {'n_layers': 1, 'embedding_dim': 128, 'lr': 0.006176597452576965, 'lambda_val': 0.00011847884966446926, 'batch_size': 3180, 'optimizer': 'Adam'}.
2026-05-24 04:03:39,964 - experiment_functions - INFO - Early stopping at epoch 500. Best Metrics: (0.004701688608344135, 0.003832781456953643, 0.0046497644006351715)
2026-05-24 04:03:40,239 - optuna.study.study - INFO - Trial 61 finished with values: [0.004701688608344135, 0.003832781456953643, 0.0046497644006351715] and parameters: {'n_layers': 3, 'embedding_dim': 64, 'lr': 0.013741793349809859, 'lambda_val': 0.08705972831998063, 'batch_size': 3975, 'optimizer': 'SGD'}.
2026-05-24 04:03:59,088 - experiment_functions - INFO - Early stopping at epoch 1750. Best Metrics: (0.02211790750727842, 0.016804635761589404, 0.022240754268354312)
2026-05-24 04:03:59,214 - optuna.study.study - INFO - Trial 62 finished with values: [0.02211790750727842, 0.016804635761589404, 0.022240754268354312] and parameters: {'n_layers': 4, 'embedding_dim': 64, 'lr': 0.0002960115862018489, 'lambda_val': 0.0012311986942485985, 'batch_size': 1199, 'optimizer': 'Adam'}.
2026-05-24 04:04:08,298 - experiment_functions - INFO - Early stopping at epoch 800. Best Metrics: (0.017834180143456883, 0.013029801324503312, 0.017623659362935893)
2026-05-24 04:04:08,405 - optuna.study.study - INFO - Trial 63 finished with values: [0.017834180143456883, 0.013029801324503312, 0.017623659362935893] and parameters: {'n_layers': 1, 'embedding_dim': 64, 'lr': 0.0010412335380352404, 'lambda_val': 1.688295648047332e-06, 'batch_size': 2286, 'optimizer': 'RMSprop'}.
2026-05-24 04:04:14,570 - experiment_functions - INFO - Early stopping at epoch 500. Best Metrics: (0.0051089580313321776, 0.004263245033112583, 0.005233610963860478)
2026-05-24 04:04:14,731 - optuna.study.study - INFO - Trial 64 finished with values: [0.0051089580313321776, 0.004263245033112583, 0.005233610963860478] and parameters: {'n_layers': 3, 'embedding_dim': 96, 'lr': 1.454675542952412e-05, 'lambda_val': 0.06322556156333786, 'batch_size': 1744, 'optimizer': 'Adam'}.
2026-05-24 04:04:24,510 - experiment_functions - INFO - Early stopping at epoch 850. Best Metrics: (0.012516415006131595, 0.009346026490066226, 0.012177493225690332)
2026-05-24 04:04:24,622 - optuna.study.study - INFO - Trial 65 finished with values: [0.012516415006131595, 0.009346026490066226, 0.012177493225690332] and parameters: {'n_layers': 1, 'embedding_dim': 256, 'lr': 0.07858250774247641, 'lambda_val': 1.434440959118923e-06, 'batch_size': 917, 'optimizer': 'Adam'}.
2026-05-24 04:04:34,831 - experiment_functions - INFO - Early stopping at epoch 850. Best Metrics: (0.01639239166693204, 0.014114238410596027, 0.018527680714677947)
2026-05-24 04:04:35,007 - optuna.study.study - INFO - Trial 66 finished with values: [0.01639239166693204, 0.014114238410596027, 0.018527680714677947] and parameters: {'n_layers': 4, 'embedding_dim': 128, 'lr': 0.000460021398839349, 'lambda_val': 0.0007150353686754638, 'batch_size': 3635, 'optimizer': 'Adam'}.
2026-05-24 04:04:41,186 - experiment_functions - INFO - Early stopping at epoch 500. Best Metrics: (0.005724563178567849, 0.0042963576158940395, 0.005625155375468547)
2026-05-24 04:04:41,737 - optuna.study.study - INFO - Trial 67 finished with values: [0.005724563178567849, 0.0042963576158940395, 0.005625155375468547] and parameters: {'n_layers': 4, 'embedding_dim': 128, 'lr': 9.989961915759321e-05, 'lambda_val': 0.05904110892608641, 'batch_size': 642, 'optimizer': 'RMSprop'}.
2026-05-24 04:05:17,318 - experiment_functions - INFO - Early stopping at epoch 3700. Best Metrics: (0.005664007269829755, 0.004437086092715233, 0.005744260454648372)
2026-05-24 04:05:18,578 - optuna.study.study - INFO - Trial 68 finished with values: [0.005664007269829755, 0.004437086092715233, 0.005744260454648372] and parameters: {'n_layers': 2, 'embedding_dim': 64, 'lr': 1.2437905473080944e-05, 'lambda_val': 2.571811162691067e-06, 'batch_size': 1829, 'optimizer': 'RMSprop'}.
2026-05-24 04:05:24,829 - experiment_functions - INFO - Early stopping at epoch 500. Best Metrics: (0.008905833783037673, 0.006548013245033112, 0.008676777690582423)
2026-05-24 04:05:25,452 - optuna.study.study - INFO - Trial 69 finished with values: [0.008905833783037673, 0.006548013245033112, 0.008676777690582423] and parameters: {'n_layers': 1, 'embedding_dim': 256, 'lr': 0.0756565446230281, 'lambda_val': 0.002796129202981768, 'batch_size': 916, 'optimizer': 'Adam'}.
2026-05-24 04:05:32,092 - experiment_functions - INFO - Early stopping at epoch 550. Best Metrics: (0.014331132218640177, 0.011076158940397351, 0.014186273178780667)
2026-05-24 04:05:32,260 - optuna.study.study - INFO - Trial 70 finished with values: [0.014331132218640177, 0.011076158940397351, 0.014186273178780667] and parameters: {'n_layers': 2, 'embedding_dim': 96, 'lr': 0.002717396800836918, 'lambda_val': 0.017024035419790078, 'batch_size': 796, 'optimizer': 'RMSprop'}.
2026-05-24 04:05:39,484 - experiment_functions - INFO - Early stopping at epoch 600. Best Metrics: (0.016446497612991898, 0.013311258278145697, 0.016898507435628894)
2026-05-24 04:05:39,581 - optuna.study.study - INFO - Trial 71 finished with values: [0.016446497612991898, 0.013311258278145697, 0.016898507435628894] and parameters: {'n_layers': 3, 'embedding_dim': 96, 'lr': 0.002717396800836918, 'lambda_val': 0.006420156392281269, 'batch_size': 2434, 'optimizer': 'Adam'}.
2026-05-24 04:05:46,919 - experiment_functions - INFO - Early stopping at epoch 550. Best Metrics: (0.015411322712571658, 0.012334437086092715, 0.015676407934584562)
2026-05-24 04:05:47,096 - optuna.study.study - INFO - Trial 72 finished with values: [0.015411322712571658, 0.012334437086092715, 0.015676407934584562] and parameters: {'n_layers': 3, 'embedding_dim': 32, 'lr': 0.006176597452576965, 'lambda_val': 0.00011847884966446926, 'batch_size': 1599, 'optimizer': 'RMSprop'}.
2026-05-24 04:06:27,006 - optuna.study.study - INFO - Trial 73 finished with values: [0.011119093310456274, 0.007731788079470199, 0.011108686996303546] and parameters: {'n_layers': 2, 'embedding_dim': 32, 'lr': 8.355080094834955e-05, 'lambda_val': 1.688295648047332e-06, 'batch_size': 2286, 'optimizer': 'Adam'}.
2026-05-24 04:06:37,343 - experiment_functions - INFO - Early stopping at epoch 900. Best Metrics: (0.01945082893194833, 0.015637417218543045, 0.020342680487443955)
2026-05-24 04:06:37,859 - optuna.study.study - INFO - Trial 74 finished with values: [0.01945082893194833, 0.015637417218543045, 0.020342680487443955] and parameters: {'n_layers': 3, 'embedding_dim': 96, 'lr': 0.0005361654985379109, 'lambda_val': 0.0029344298742113367, 'batch_size': 1744, 'optimizer': 'RMSprop'}.
2026-05-24 04:06:47,075 - experiment_functions - INFO - Early stopping at epoch 800. Best Metrics: (0.022286256254766195, 0.0163658940397351, 0.021926553234655324)
2026-05-24 04:06:47,188 - optuna.study.study - INFO - Trial 75 finished with values: [0.022286256254766195, 0.0163658940397351, 0.021926553234655324] and parameters: {'n_layers': 3, 'embedding_dim': 32, 'lr': 0.0007924927231928422, 'lambda_val': 1.788497394454551e-05, 'batch_size': 1970, 'optimizer': 'RMSprop'}.
2026-05-24 04:06:53,260 - experiment_functions - INFO - Early stopping at epoch 500. Best Metrics: (0.00674643288669747, 0.005629139072847682, 0.007161294649879394)
2026-05-24 04:06:53,664 - optuna.study.study - INFO - Trial 76 finished with values: [0.00674643288669747, 0.005629139072847682, 0.007161294649879394] and parameters: {'n_layers': 3, 'embedding_dim': 64, 'lr': 0.013741793349809859, 'lambda_val': 0.01288825884440106, 'batch_size': 2288, 'optimizer': 'RMSprop'}.
2026-05-24 04:07:01,455 - experiment_functions - INFO - Early stopping at epoch 650. Best Metrics: (0.014987988014331023, 0.013526490066225166, 0.016214203416271177)
2026-05-24 04:07:02,057 - optuna.study.study - INFO - Trial 77 finished with values: [0.014987988014331023, 0.013526490066225166, 0.016214203416271177] and parameters: {'n_layers': 4, 'embedding_dim': 96, 'lr': 0.0013524049945715497, 'lambda_val': 0.05904110892608641, 'batch_size': 1735, 'optimizer': 'Adam'}.
2026-05-24 04:07:08,120 - experiment_functions - INFO - Early stopping at epoch 500. Best Metrics: (0.005262048103378236, 0.0042632450331125836, 0.005173891991567064)
2026-05-24 04:07:08,222 - optuna.study.study - INFO - Trial 78 finished with values: [0.005262048103378236, 0.0042632450331125836, 0.005173891991567064] and parameters: {'n_layers': 3, 'embedding_dim': 96, 'lr': 0.00023437389049620985, 'lambda_val': 0.08705972831998063, 'batch_size': 3975, 'optimizer': 'SGD'}.
2026-05-24 04:07:14,458 - experiment_functions - INFO - Early stopping at epoch 500. Best Metrics: (0.0050831021295477735, 0.004064569536423841, 0.00497847407701118)
2026-05-24 04:07:15,030 - optuna.study.study - INFO - Trial 79 finished with values: [0.0050831021295477735, 0.004064569536423841, 0.00497847407701118] and parameters: {'n_layers': 3, 'embedding_dim': 128, 'lr': 0.003599405628543548, 'lambda_val': 0.0007150353686754638, 'batch_size': 3635, 'optimizer': 'SGD'}.
2026-05-24 04:07:23,182 - experiment_functions - INFO - Early stopping at epoch 700. Best Metrics: (0.013418733751830784, 0.010786423841059604, 0.013931909912168116)
2026-05-24 04:07:23,269 - optuna.study.study - INFO - Trial 80 finished with values: [0.013418733751830784, 0.010786423841059604, 0.013931909912168116] and parameters: {'n_layers': 2, 'embedding_dim': 128, 'lr': 0.0010412335380352404, 'lambda_val': 0.017024035419790078, 'batch_size': 2232, 'optimizer': 'Adam'}.
2026-05-24 04:07:34,619 - experiment_functions - INFO - Early stopping at epoch 950. Best Metrics: (0.020650404557284077, 0.017019867549668877, 0.022108800035808288)
2026-05-24 04:07:35,179 - optuna.study.study - INFO - Trial 81 finished with values: [0.020650404557284077, 0.017019867549668877, 0.022108800035808288] and parameters: {'n_layers': 3, 'embedding_dim': 32, 'lr': 0.0006691559391119897, 'lambda_val': 0.010157868861362357, 'batch_size': 1518, 'optimizer': 'RMSprop'}.
2026-05-24 04:07:41,400 - experiment_functions - INFO - Early stopping at epoch 500. Best Metrics: (0.0061611726552991105, 0.005298013245033113, 0.006472792888685703)
2026-05-24 04:07:41,606 - optuna.study.study - INFO - Trial 82 finished with values: [0.0061611726552991105, 0.005298013245033113, 0.006472792888685703] and parameters: {'n_layers': 2, 'embedding_dim': 256, 'lr': 0.044025814280472544, 'lambda_val': 0.014795226107322373, 'batch_size': 1746, 'optimizer': 'Adam'}.
2026-05-24 04:07:58,154 - experiment_functions - INFO - Early stopping at epoch 1500. Best Metrics: (0.01544582912800842, 0.011216887417218543, 0.015299415719082901)
2026-05-24 04:07:58,252 - optuna.study.study - INFO - Trial 83 finished with values: [0.01544582912800842, 0.011216887417218543, 0.015299415719082901] and parameters: {'n_layers': 1, 'embedding_dim': 256, 'lr': 0.0002960115862018489, 'lambda_val': 0.0012311986942485985, 'batch_size': 3377, 'optimizer': 'Adam'}.
2026-05-24 04:08:38,424 - optuna.study.study - INFO - Trial 84 finished with values: [0.007005312789187217, 0.005786423841059603, 0.007390415282888981] and parameters: {'n_layers': 4, 'embedding_dim': 96, 'lr': 4.080242094082236e-05, 'lambda_val': 0.0029344298742113367, 'batch_size': 1829, 'optimizer': 'RMSprop'}.
2026-05-24 04:09:21,134 - optuna.study.study - INFO - Trial 85 finished with values: [0.023417425360712958, 0.018849337748344373, 0.02525137874395302] and parameters: {'n_layers': 4, 'embedding_dim': 32, 'lr': 0.0002960115862018489, 'lambda_val': 6.677790881496428e-05, 'batch_size': 642, 'optimizer': 'Adam'}.
2026-05-24 04:09:27,599 - experiment_functions - INFO - Early stopping at epoch 550. Best Metrics: (0.013233506058030529, 0.010091059602649007, 0.013313201747499597)
2026-05-24 04:09:27,885 - optuna.study.study - INFO - Trial 86 finished with values: [0.013233506058030529, 0.010091059602649007, 0.013313201747499597] and parameters: {'n_layers': 3, 'embedding_dim': 128, 'lr': 0.02825804014446904, 'lambda_val': 0.00011847884966446926, 'batch_size': 917, 'optimizer': 'Adam'}.
2026-05-24 04:09:34,131 - experiment_functions - INFO - Early stopping at epoch 500. Best Metrics: (0.004863099597794092, 0.003890728476821192, 0.0048167919572945405)
2026-05-24 04:09:34,223 - optuna.study.study - INFO - Trial 87 finished with values: [0.004863099597794092, 0.003890728476821192, 0.0048167919572945405] and parameters: {'n_layers': 4, 'embedding_dim': 128, 'lr': 0.0010345450541168627, 'lambda_val': 0.0005557477534433548, 'batch_size': 1066, 'optimizer': 'SGD'}.
2026-05-24 04:10:16,301 - optuna.study.study - INFO - Trial 88 finished with values: [0.016629107287235052, 0.011961920529801325, 0.016583028082616226] and parameters: {'n_layers': 2, 'embedding_dim': 128, 'lr': 0.00015155803146396787, 'lambda_val': 0.0026198298939258, 'batch_size': 3635, 'optimizer': 'RMSprop'}.
2026-05-24 04:10:22,649 - experiment_functions - INFO - Early stopping at epoch 500. Best Metrics: (0.005302543873297756, 0.004163907284768212, 0.00532126643258821)
2026-05-24 04:10:23,057 - optuna.study.study - INFO - Trial 89 finished with values: [0.005302543873297756, 0.004163907284768212, 0.00532126643258821] and parameters: {'n_layers': 4, 'embedding_dim': 96, 'lr': 1.4186623019382506e-05, 'lambda_val': 5.0395897820074916e-06, 'batch_size': 3979, 'optimizer': 'SGD'}.
2026-05-24 04:10:29,927 - experiment_functions - INFO - Early stopping at epoch 550. Best Metrics: (0.011680139143617334, 0.009908940397350996, 0.012321534513458705)
2026-05-24 04:10:30,013 - optuna.study.study - INFO - Trial 90 finished with values: [0.011680139143617334, 0.009908940397350996, 0.012321534513458705] and parameters: {'n_layers': 3, 'embedding_dim': 128, 'lr': 0.003599405628543548, 'lambda_val': 0.0007150353686754638, 'batch_size': 3635, 'optimizer': 'RMSprop'}.
2026-05-24 04:10:36,165 - experiment_functions - INFO - Early stopping at epoch 500. Best Metrics: (0.007052080390056013, 0.0057781456953642394, 0.007219161501181995)
2026-05-24 04:10:36,831 - optuna.study.study - INFO - Trial 91 finished with values: [0.007052080390056013, 0.0057781456953642394, 0.007219161501181995] and parameters: {'n_layers': 3, 'embedding_dim': 96, 'lr': 0.013741793349809859, 'lambda_val': 0.01288825884440106, 'batch_size': 2419, 'optimizer': 'RMSprop'}.
2026-05-24 04:10:44,812 - experiment_functions - INFO - Early stopping at epoch 600. Best Metrics: (0.016888717294806704, 0.015149006622516557, 0.01881895360447831)
2026-05-24 04:10:44,910 - optuna.study.study - INFO - Trial 92 finished with values: [0.016888717294806704, 0.015149006622516557, 0.01881895360447831] and parameters: {'n_layers': 4, 'embedding_dim': 128, 'lr': 0.0016306259277922273, 'lambda_val': 0.016113443657182445, 'batch_size': 3264, 'optimizer': 'Adam'}.
2026-05-24 04:10:51,620 - experiment_functions - INFO - Early stopping at epoch 550. Best Metrics: (0.019420801527455914, 0.01627483443708609, 0.021262435781123534)
2026-05-24 04:10:52,387 - optuna.study.study - INFO - Trial 93 finished with values: [0.019420801527455914, 0.01627483443708609, 0.021262435781123534] and parameters: {'n_layers': 4, 'embedding_dim': 64, 'lr': 0.0010412335380352404, 'lambda_val': 0.017024035419790078, 'batch_size': 2232, 'optimizer': 'RMSprop'}.
2026-05-24 04:11:02,055 - experiment_functions - INFO - Early stopping at epoch 800. Best Metrics: (0.017803777539395813, 0.014403973509933774, 0.019258930323446825)
2026-05-24 04:11:04,031 - optuna.study.study - INFO - Trial 94 finished with values: [0.017803777539395813, 0.014403973509933774, 0.019258930323446825] and parameters: {'n_layers': 4, 'embedding_dim': 32, 'lr': 0.0007348069125149168, 'lambda_val': 1.1624629752310626e-05, 'batch_size': 3956, 'optimizer': 'RMSprop'}.
2026-05-24 04:11:11,215 - experiment_functions - INFO - Early stopping at epoch 550. Best Metrics: (0.014726852703332965, 0.01103476821192053, 0.0144277853192894)
2026-05-24 04:11:11,324 - optuna.study.study - INFO - Trial 95 finished with values: [0.014726852703332965, 0.01103476821192053, 0.0144277853192894] and parameters: {'n_layers': 2, 'embedding_dim': 96, 'lr': 0.006065924974024212, 'lambda_val': 8.192236806760838e-06, 'batch_size': 3422, 'optimizer': 'Adam'}.
2026-05-24 04:11:51,249 - optuna.study.study - INFO - Trial 96 finished with values: [0.01414164905513956, 0.009668874172185432, 0.014175643111400502] and parameters: {'n_layers': 1, 'embedding_dim': 64, 'lr': 0.00010936189711277886, 'lambda_val': 3.898561124366437e-06, 'batch_size': 3065, 'optimizer': 'Adam'}.
2026-05-24 04:11:59,161 - experiment_functions - INFO - Early stopping at epoch 650. Best Metrics: (0.016779185725924878, 0.013369205298013245, 0.017580262728090847)
2026-05-24 04:11:59,269 - optuna.study.study - INFO - Trial 97 finished with values: [0.016779185725924878, 0.013369205298013245, 0.017580262728090847] and parameters: {'n_layers': 3, 'embedding_dim': 128, 'lr': 0.0020206577109833958, 'lambda_val': 4.096597741696202e-06, 'batch_size': 2052, 'optimizer': 'Adam'}.
2026-05-24 04:12:06,829 - experiment_functions - INFO - Early stopping at epoch 550. Best Metrics: (0.010323608400451182, 0.008120860927152317, 0.010498884843706327)
2026-05-24 04:12:06,911 - optuna.study.study - INFO - Trial 98 finished with values: [0.010323608400451182, 0.008120860927152317, 0.010498884843706327] and parameters: {'n_layers': 4, 'embedding_dim': 256, 'lr': 0.013966211709492126, 'lambda_val': 1.688295648047332e-06, 'batch_size': 3857, 'optimizer': 'Adam'}.
2026-05-24 04:12:28,525 - experiment_functions - INFO - Early stopping at epoch 2200. Best Metrics: (0.0057741023790622474, 0.004221854304635762, 0.005301210240230414)
2026-05-24 04:12:28,655 - optuna.study.study - INFO - Trial 99 finished with values: [0.0057741023790622474, 0.004221854304635762, 0.005301210240230414] and parameters: {'n_layers': 3, 'embedding_dim': 32, 'lr': 0.0756565446230281, 'lambda_val': 2.536948582092468e-06, 'batch_size': 916, 'optimizer': 'SGD'}.
2026-05-24 04:12:56,982 - experiment_functions - INFO - Early stopping at epoch 2600. Best Metrics: (0.014920019468434256, 0.011473509933774833, 0.015476046069628532)
2026-05-24 04:12:57,076 - optuna.study.study - INFO - Trial 100 finished with values: [0.014920019468434256, 0.011473509933774833, 0.015476046069628532] and parameters: {'n_layers': 1, 'embedding_dim': 256, 'lr': 0.0002960115862018489, 'lambda_val': 0.00011847884966446926, 'batch_size': 3180, 'optimizer': 'Adam'}.
2026-05-24 04:13:09,142 - experiment_functions - INFO - Early stopping at epoch 1050. Best Metrics: (0.0185715892424886, 0.015711920529801325, 0.02001182733929761)
2026-05-24 04:13:09,494 - optuna.study.study - INFO - Trial 101 finished with values: [0.0185715892424886, 0.015711920529801325, 0.02001182733929761] and parameters: {'n_layers': 4, 'embedding_dim': 128, 'lr': 0.00039891463323300135, 'lambda_val': 0.00216360313455091, 'batch_size': 2184, 'optimizer': 'Adam'}.
2026-05-24 04:13:24,009 - experiment_functions - INFO - Early stopping at epoch 1350. Best Metrics: (0.013508026341816824, 0.010190397350993377, 0.013645525267562185)
2026-05-24 04:13:24,692 - optuna.study.study - INFO - Trial 102 finished with values: [0.013508026341816824, 0.010190397350993377, 0.013645525267562185] and parameters: {'n_layers': 1, 'embedding_dim': 128, 'lr': 0.0002960115862018489, 'lambda_val': 0.016113443657182445, 'batch_size': 3264, 'optimizer': 'Adam'}.
2026-05-24 04:13:34,463 - experiment_functions - INFO - Early stopping at epoch 850. Best Metrics: (0.01763632416717574, 0.014296357615894038, 0.018308156943481937)
2026-05-24 04:13:34,565 - optuna.study.study - INFO - Trial 103 finished with values: [0.01763632416717574, 0.014296357615894038, 0.018308156943481937] and parameters: {'n_layers': 4, 'embedding_dim': 32, 'lr': 0.0007348069125149168, 'lambda_val': 1.1624629752310626e-05, 'batch_size': 3939, 'optimizer': 'Adam'}.
2026-05-24 04:13:41,742 - experiment_functions - INFO - Early stopping at epoch 600. Best Metrics: (0.017130023531719423, 0.015471854304635765, 0.01913456184646023)
2026-05-24 04:13:41,839 - optuna.study.study - INFO - Trial 104 finished with values: [0.017130023531719423, 0.015471854304635765, 0.01913456184646023] and parameters: {'n_layers': 4, 'embedding_dim': 64, 'lr': 0.0010412335380352404, 'lambda_val': 0.017024035419790078, 'batch_size': 2232, 'optimizer': 'RMSprop'}.
2026-05-24 04:13:48,455 - experiment_functions - INFO - Early stopping at epoch 550. Best Metrics: (0.012355739916157885, 0.010471854304635762, 0.012794203486450944)
2026-05-24 04:13:48,941 - optuna.study.study - INFO - Trial 105 finished with values: [0.012355739916157885, 0.010471854304635762, 0.012794203486450944] and parameters: {'n_layers': 3, 'embedding_dim': 96, 'lr': 0.006176597452576965, 'lambda_val': 0.05904110892608641, 'batch_size': 1735, 'optimizer': 'Adam'}.
2026-05-24 04:13:56,685 - experiment_functions - INFO - Early stopping at epoch 650. Best Metrics: (0.018824680244476463, 0.014478476821192056, 0.01927990754880739)
2026-05-24 04:13:56,789 - optuna.study.study - INFO - Trial 106 finished with values: [0.018824680244476463, 0.014478476821192056, 0.01927990754880739] and parameters: {'n_layers': 3, 'embedding_dim': 96, 'lr': 0.0010345450541168627, 'lambda_val': 2.571811162691067e-06, 'batch_size': 1829, 'optimizer': 'RMSprop'}.
2026-05-24 04:14:05,396 - experiment_functions - INFO - Early stopping at epoch 750. Best Metrics: (0.01583636657479272, 0.01165562913907285, 0.01619294696126203)
