2026-05-23 21:13:39,239 - optuna.study.study - INFO - Trial 190 finished with values: [0.08379098205969877, 0.061374172185430474, 0.08448871923264945] and parameters: {'n_layers': 1, 'embedding_dim': 64, 'lr': 0.0017544079546559647, 'lambda_val': 0.00020136097974536503, 'batch_size': 886, 'optimizer': 'Adam'}.
2026-05-23 21:13:57,620 - experiment_functions - INFO - Early stopping at epoch 900. Best Metrics: (0.06767993149224293, 0.0503476821192053, 0.06926536148256675)
2026-05-23 21:13:57,716 - optuna.study.study - INFO - Trial 191 finished with values: [0.06767993149224293, 0.0503476821192053, 0.06926536148256675] and parameters: {'n_layers': 2, 'embedding_dim': 256, 'lr': 0.00041107674279017986, 'lambda_val': 2.2621228626504235e-06, 'batch_size': 886, 'optimizer': 'RMSprop'}.
2026-05-23 21:14:07,503 - experiment_functions - INFO - Early stopping at epoch 550. Best Metrics: (0.05859349699773645, 0.04367549668874172, 0.060790877270470514)
2026-05-23 21:14:07,611 - optuna.study.study - INFO - Trial 192 finished with values: [0.05859349699773645, 0.04367549668874172, 0.060790877270470514] and parameters: {'n_layers': 1, 'embedding_dim': 256, 'lr': 0.004031587731005074, 'lambda_val': 0.00020136097974536503, 'batch_size': 3201, 'optimizer': 'Adam'}.
2026-05-23 21:14:17,523 - experiment_functions - INFO - Early stopping at epoch 700. Best Metrics: (0.07321326547158773, 0.05613410596026489, 0.07773683280174397)
2026-05-23 21:14:18,203 - optuna.study.study - INFO - Trial 193 finished with values: [0.07321326547158773, 0.05613410596026489, 0.07773683280174397] and parameters: {'n_layers': 1, 'embedding_dim': 96, 'lr': 0.001325452189730596, 'lambda_val': 0.0053912262075664795, 'batch_size': 3742, 'optimizer': 'Adam'}.
2026-05-23 21:14:26,665 - experiment_functions - INFO - Early stopping at epoch 600. Best Metrics: (0.0705567304034704, 0.04905629139072847, 0.06962171415286376)
2026-05-23 21:14:26,762 - optuna.study.study - INFO - Trial 194 finished with values: [0.0705567304034704, 0.04905629139072847, 0.06962171415286376] and parameters: {'n_layers': 1, 'embedding_dim': 96, 'lr': 0.004184026134455368, 'lambda_val': 0.0007535837355673727, 'batch_size': 576, 'optimizer': 'Adam'}.
2026-05-23 21:14:35,467 - experiment_functions - INFO - Early stopping at epoch 600. Best Metrics: (0.05578735226853469, 0.04774834437086093, 0.06078917297783892)
2026-05-23 21:14:36,549 - optuna.study.study - INFO - Trial 195 finished with values: [0.05578735226853469, 0.04774834437086093, 0.06078917297783892] and parameters: {'n_layers': 1, 'embedding_dim': 96, 'lr': 0.004184026134455368, 'lambda_val': 0.0007535837355673727, 'batch_size': 2902, 'optimizer': 'Adam'}.
2026-05-23 21:14:43,650 - experiment_functions - INFO - Early stopping at epoch 500. Best Metrics: (0.006189431485314567, 0.004826158940397351, 0.005960212647461172)
2026-05-23 21:14:44,172 - optuna.study.study - INFO - Trial 196 finished with values: [0.006189431485314567, 0.004826158940397351, 0.005960212647461172] and parameters: {'n_layers': 1, 'embedding_dim': 64, 'lr': 8.897191988777178e-05, 'lambda_val': 0.0007535837355673727, 'batch_size': 1122, 'optimizer': 'Adam'}.
2026-05-23 21:15:48,067 - optuna.study.study - INFO - Trial 197 finished with values: [0.06183438940512887, 0.04067880794701986, 0.060127569039406935] and parameters: {'n_layers': 1, 'embedding_dim': 256, 'lr': 0.007131304194051908, 'lambda_val': 0.001076113642302791, 'batch_size': 3374, 'optimizer': 'RMSprop'}.
2026-05-23 21:16:03,967 - experiment_functions - INFO - Early stopping at epoch 950. Best Metrics: (0.07104080923718144, 0.05427152317880794, 0.07477761118173638)
2026-05-23 21:16:04,509 - optuna.study.study - INFO - Trial 198 finished with values: [0.07104080923718144, 0.05427152317880794, 0.07477761118173638] and parameters: {'n_layers': 1, 'embedding_dim': 256, 'lr': 0.0006825513923366329, 'lambda_val': 1.2948481747134374e-05, 'batch_size': 2875, 'optimizer': 'Adam'}.
2026-05-23 21:17:07,733 - optuna.study.study - INFO - Trial 199 finished with values: [0.08145304642974918, 0.05802980132450331, 0.08373709510576303] and parameters: {'n_layers': 1, 'embedding_dim': 256, 'lr': 0.00045141578622738895, 'lambda_val': 0.0007535837355673727, 'batch_size': 576, 'optimizer': 'Adam'}.
2026-05-23 21:17:18,481 - experiment_functions - INFO - Early stopping at epoch 750. Best Metrics: (0.07855422887299678, 0.058816225165562924, 0.08159196790006665)
2026-05-23 21:17:18,593 - optuna.study.study - INFO - Trial 200 finished with values: [0.07855422887299678, 0.058816225165562924, 0.08159196790006665] and parameters: {'n_layers': 1, 'embedding_dim': 96, 'lr': 0.001325452189730596, 'lambda_val': 0.0006933074309064735, 'batch_size': 2902, 'optimizer': 'Adam'}.
2026-05-23 21:17:38,034 - experiment_functions - INFO - Early stopping at epoch 1400. Best Metrics: (0.07884970330901693, 0.0575248344370861, 0.07998131612292889)
2026-05-23 21:17:38,506 - optuna.study.study - INFO - Trial 201 finished with values: [0.07884970330901693, 0.0575248344370861, 0.07998131612292889] and parameters: {'n_layers': 1, 'embedding_dim': 96, 'lr': 0.00045141578622738895, 'lambda_val': 0.0007535837355673727, 'batch_size': 2902, 'optimizer': 'Adam'}.
2026-05-23 21:17:56,901 - experiment_functions - INFO - Early stopping at epoch 900. Best Metrics: (0.05823452122532683, 0.04618377483443709, 0.06143400473608457)
2026-05-23 21:17:57,005 - optuna.study.study - INFO - Trial 202 finished with values: [0.05823452122532683, 0.04618377483443709, 0.06143400473608457] and parameters: {'n_layers': 2, 'embedding_dim': 256, 'lr': 0.00045141578622738895, 'lambda_val': 2.2621228626504235e-06, 'batch_size': 2302, 'optimizer': 'Adam'}.
2026-05-23 21:18:07,759 - experiment_functions - INFO - Early stopping at epoch 550. Best Metrics: (0.05627333490930705, 0.04513245033112583, 0.059524434436123666)
2026-05-23 21:18:08,206 - optuna.study.study - INFO - Trial 203 finished with values: [0.05627333490930705, 0.04513245033112583, 0.059524434436123666] and parameters: {'n_layers': 1, 'embedding_dim': 256, 'lr': 0.0017544079546559647, 'lambda_val': 0.00020136097974536503, 'batch_size': 2659, 'optimizer': 'RMSprop'}.
2026-05-23 21:19:24,341 - optuna.study.study - INFO - Trial 204 finished with values: [0.02198841966477949, 0.01960264900662252, 0.02427178135738034] and parameters: {'n_layers': 2, 'embedding_dim': 256, 'lr': 0.001957223775803203, 'lambda_val': 0.0007535837355673727, 'batch_size': 576, 'optimizer': 'RMSprop'}.
2026-05-23 21:19:32,842 - experiment_functions - INFO - Early stopping at epoch 550. Best Metrics: (0.07639504491575375, 0.057293046357615895, 0.07641943953003387)
2026-05-23 21:19:33,838 - optuna.study.study - INFO - Trial 205 finished with values: [0.07639504491575375, 0.057293046357615895, 0.07641943953003387] and parameters: {'n_layers': 1, 'embedding_dim': 128, 'lr': 0.007131304194051908, 'lambda_val': 0.0053912262075664795, 'batch_size': 2875, 'optimizer': 'Adam'}.
2026-05-23 21:19:43,194 - experiment_functions - INFO - Early stopping at epoch 550. Best Metrics: (0.06134579333356469, 0.04157284768211921, 0.05665964147466667)
2026-05-23 21:19:43,290 - optuna.study.study - INFO - Trial 206 finished with values: [0.06134579333356469, 0.04157284768211921, 0.05665964147466667] and parameters: {'n_layers': 1, 'embedding_dim': 256, 'lr': 0.007131304194051908, 'lambda_val': 0.001076113642302791, 'batch_size': 576, 'optimizer': 'Adam'}.
2026-05-23 21:19:54,363 - experiment_functions - INFO - Early stopping at epoch 650. Best Metrics: (0.07483015136831014, 0.05423013245033113, 0.07808221740384313)
2026-05-23 21:19:55,427 - optuna.study.study - INFO - Trial 207 finished with values: [0.07483015136831014, 0.05423013245033113, 0.07808221740384313] and parameters: {'n_layers': 1, 'embedding_dim': 256, 'lr': 0.0017544079546559647, 'lambda_val': 0.00020136097974536503, 'batch_size': 2561, 'optimizer': 'Adam'}.
2026-05-23 21:20:46,231 - optuna.study.study - INFO - Trial 208 finished with values: [0.06552235285856947, 0.04947847682119206, 0.06866042548153813] and parameters: {'n_layers': 1, 'embedding_dim': 64, 'lr': 0.00045141578622738895, 'lambda_val': 2.2621228626504235e-06, 'batch_size': 576, 'optimizer': 'Adam'}.
2026-05-23 21:20:54,493 - experiment_functions - INFO - Early stopping at epoch 500. Best Metrics: (0.005718348497711544, 0.0045778145695364245, 0.005422216076593315)
2026-05-23 21:20:54,589 - optuna.study.study - INFO - Trial 209 finished with values: [0.005718348497711544, 0.0045778145695364245, 0.005422216076593315] and parameters: {'n_layers': 1, 'embedding_dim': 256, 'lr': 0.0006825513923366329, 'lambda_val': 0.0007535837355673727, 'batch_size': 833, 'optimizer': 'SGD'}.
2026-05-23 21:21:23,784 - experiment_functions - INFO - Early stopping at epoch 1800. Best Metrics: (0.08297999687630307, 0.06047185430463576, 0.08559561504929705)
2026-05-23 21:21:24,055 - optuna.study.study - INFO - Trial 210 finished with values: [0.08297999687630307, 0.06047185430463576, 0.08559561504929705] and parameters: {'n_layers': 1, 'embedding_dim': 256, 'lr': 0.00045141578622738895, 'lambda_val': 0.0007535837355673727, 'batch_size': 886, 'optimizer': 'RMSprop'}.
2026-05-23 21:21:46,110 - experiment_functions - INFO - Early stopping at epoch 1350. Best Metrics: (0.07460708793531609, 0.05523178807947019, 0.07700461119072743)
2026-05-23 21:21:46,213 - optuna.study.study - INFO - Trial 211 finished with values: [0.07460708793531609, 0.05523178807947019, 0.07700461119072743] and parameters: {'n_layers': 1, 'embedding_dim': 256, 'lr': 0.00045141578622738895, 'lambda_val': 0.0007535837355673727, 'batch_size': 2307, 'optimizer': 'Adam'}.
2026-05-23 21:21:55,052 - experiment_functions - INFO - Early stopping at epoch 600. Best Metrics: (0.07377678743164871, 0.052955298013245035, 0.07265937135868446)
2026-05-23 21:21:55,821 - optuna.study.study - INFO - Trial 212 finished with values: [0.07377678743164871, 0.052955298013245035, 0.07265937135868446] and parameters: {'n_layers': 1, 'embedding_dim': 96, 'lr': 0.004184026134455368, 'lambda_val': 0.0053912262075664795, 'batch_size': 579, 'optimizer': 'Adam'}.
2026-05-23 21:22:02,547 - experiment_functions - INFO - Early stopping at epoch 500. Best Metrics: (0.005216137537202992, 0.004718543046357616, 0.0057915731034471115)
2026-05-23 21:22:02,661 - optuna.study.study - INFO - Trial 213 finished with values: [0.005216137537202992, 0.004718543046357616, 0.0057915731034471115] and parameters: {'n_layers': 1, 'embedding_dim': 32, 'lr': 0.0007928857958215832, 'lambda_val': 2.2621228626504235e-06, 'batch_size': 886, 'optimizer': 'SGD'}.
2026-05-23 21:22:26,269 - experiment_functions - INFO - Early stopping at epoch 1450. Best Metrics: (0.0784671985225562, 0.0585182119205298, 0.08087507258129943)
2026-05-23 21:22:26,463 - optuna.study.study - INFO - Trial 214 finished with values: [0.0784671985225562, 0.0585182119205298, 0.08087507258129943] and parameters: {'n_layers': 1, 'embedding_dim': 256, 'lr': 0.0006825513923366329, 'lambda_val': 1.207883913872658e-06, 'batch_size': 886, 'optimizer': 'Adam'}.
2026-05-23 21:22:40,675 - experiment_functions - INFO - Early stopping at epoch 950. Best Metrics: (0.07643945718392493, 0.05750827814569537, 0.0801321374488699)
2026-05-23 21:22:40,827 - optuna.study.study - INFO - Trial 215 finished with values: [0.07643945718392493, 0.05750827814569537, 0.0801321374488699] and parameters: {'n_layers': 1, 'embedding_dim': 128, 'lr': 0.0006723560641891114, 'lambda_val': 0.001076113642302791, 'batch_size': 3432, 'optimizer': 'Adam'}.
2026-05-23 21:22:58,406 - experiment_functions - INFO - Early stopping at epoch 850. Best Metrics: (0.07089621950236602, 0.05253311258278146, 0.07370258358754966)
2026-05-23 21:22:58,512 - optuna.study.study - INFO - Trial 216 finished with values: [0.07089621950236602, 0.05253311258278146, 0.07370258358754966] and parameters: {'n_layers': 2, 'embedding_dim': 256, 'lr': 0.0006825513923366329, 'lambda_val': 0.0007535837355673727, 'batch_size': 833, 'optimizer': 'Adam'}.
2026-05-23 21:23:49,592 - optuna.study.study - INFO - Trial 217 finished with values: [0.0060250000005296215, 0.005091059602649006, 0.006379830826656333] and parameters: {'n_layers': 1, 'embedding_dim': 128, 'lr': 6.934491591057096e-05, 'lambda_val': 1.207883913872658e-06, 'batch_size': 2728, 'optimizer': 'Adam'}.
2026-05-23 21:24:10,044 - experiment_functions - INFO - Early stopping at epoch 1250. Best Metrics: (0.07842081395083038, 0.058170529801324505, 0.08126792219052657)
2026-05-23 21:24:11,118 - optuna.study.study - INFO - Trial 218 finished with values: [0.07842081395083038, 0.058170529801324505, 0.08126792219052657] and parameters: {'n_layers': 1, 'embedding_dim': 256, 'lr': 0.00045141578622738895, 'lambda_val': 0.0007535837355673727, 'batch_size': 2875, 'optimizer': 'Adam'}.
2026-05-23 21:25:09,142 - optuna.study.study - INFO - Trial 219 finished with values: [0.005489042924206061, 0.004966887417218543, 0.0060310683828608816] and parameters: {'n_layers': 1, 'embedding_dim': 256, 'lr': 0.00010005152852172687, 'lambda_val': 8.44787232625417e-05, 'batch_size': 886, 'optimizer': 'Adam'}.
2026-05-23 21:25:28,582 - experiment_functions - INFO - Early stopping at epoch 1250. Best Metrics: (0.07799798505249364, 0.05732615894039735, 0.0791059166962102)
2026-05-23 21:25:28,687 - optuna.study.study - INFO - Trial 220 finished with values: [0.07799798505249364, 0.05732615894039735, 0.0791059166962102] and parameters: {'n_layers': 2, 'embedding_dim': 96, 'lr': 0.00045141578622738895, 'lambda_val': 0.0005099748742674305, 'batch_size': 886, 'optimizer': 'Adam'}.
2026-05-23 21:25:50,262 - experiment_functions - INFO - Early stopping at epoch 1300. Best Metrics: (0.07318344032268193, 0.05599337748344372, 0.07737861217196947)
2026-05-23 21:25:50,696 - optuna.study.study - INFO - Trial 221 finished with values: [0.07318344032268193, 0.05599337748344372, 0.07737861217196947] and parameters: {'n_layers': 1, 'embedding_dim': 256, 'lr': 0.00045141578622738895, 'lambda_val': 0.00020136097974536503, 'batch_size': 2902, 'optimizer': 'Adam'}.
2026-05-23 21:26:09,222 - experiment_functions - INFO - Early stopping at epoch 1150. Best Metrics: (0.07114887466341935, 0.05663079470198676, 0.07622354325426733)
2026-05-23 21:26:09,318 - optuna.study.study - INFO - Trial 222 finished with values: [0.07114887466341935, 0.05663079470198676, 0.07622354325426733] and parameters: {'n_layers': 1, 'embedding_dim': 256, 'lr': 0.0007928857958215832, 'lambda_val': 0.019070067285719836, 'batch_size': 576, 'optimizer': 'Adam'}.
2026-05-23 21:27:03,334 - experiment_functions - INFO - Early stopping at epoch 3400. Best Metrics: (0.08281217607235429, 0.0610430463576159, 0.08648821859653111)
2026-05-23 21:27:03,438 - optuna.study.study - INFO - Trial 223 finished with values: [0.08281217607235429, 0.0610430463576159, 0.08648821859653111] and parameters: {'n_layers': 1, 'embedding_dim': 256, 'lr': 0.00045141578622738895, 'lambda_val': 0.0007535837355673727, 'batch_size': 886, 'optimizer': 'Adam'}.
2026-05-23 21:27:20,087 - experiment_functions - INFO - Early stopping at epoch 800. Best Metrics: (0.05971689644385145, 0.04504139072847682, 0.06125455619528782)
2026-05-23 21:27:20,206 - optuna.study.study - INFO - Trial 224 finished with values: [0.05971689644385145, 0.04504139072847682, 0.06125455619528782] and parameters: {'n_layers': 2, 'embedding_dim': 256, 'lr': 0.00045141578622738895, 'lambda_val': 2.2621228626504235e-06, 'batch_size': 3595, 'optimizer': 'Adam'}.
2026-05-23 21:27:34,348 - experiment_functions - INFO - Early stopping at epoch 600. Best Metrics: (0.029181358574330074, 0.025753311258278146, 0.03198713726560669)
2026-05-23 21:27:34,492 - optuna.study.study - INFO - Trial 225 finished with values: [0.029181358574330074, 0.025753311258278146, 0.03198713726560669] and parameters: {'n_layers': 4, 'embedding_dim': 128, 'lr': 0.001325452189730596, 'lambda_val': 0.001076113642302791, 'batch_size': 3432, 'optimizer': 'Adam'}.
2026-05-23 21:28:37,767 - optuna.study.study - INFO - Trial 226 finished with values: [0.08112891456318781, 0.06070364238410596, 0.08526623358937123] and parameters: {'n_layers': 1, 'embedding_dim': 256, 'lr': 0.00045141578622738895, 'lambda_val': 0.00020136097974536503, 'batch_size': 576, 'optimizer': 'Adam'}.
2026-05-23 21:29:12,850 - experiment_functions - INFO - Early stopping at epoch 2600. Best Metrics: (0.04719532028053873, 0.031175496688741724, 0.04569677864180602)
2026-05-23 21:29:13,353 - optuna.study.study - INFO - Trial 227 finished with values: [0.04719532028053873, 0.031175496688741724, 0.04569677864180602] and parameters: {'n_layers': 1, 'embedding_dim': 96, 'lr': 0.013355909417042117, 'lambda_val': 0.00023963336591934138, 'batch_size': 2902, 'optimizer': 'RMSprop'}.
2026-05-23 21:29:22,325 - experiment_functions - INFO - Early stopping at epoch 550. Best Metrics: (0.005448496153233434, 0.004329470198675497, 0.00538860353277505)
2026-05-23 21:29:22,425 - optuna.study.study - INFO - Trial 228 finished with values: [0.005448496153233434, 0.004329470198675497, 0.00538860353277505] and parameters: {'n_layers': 1, 'embedding_dim': 256, 'lr': 0.013896142622329626, 'lambda_val': 1.207883913872658e-06, 'batch_size': 808, 'optimizer': 'SGD'}.
2026-05-23 21:29:35,877 - experiment_functions - INFO - Early stopping at epoch 800. Best Metrics: (0.0732042864645112, 0.055455298013245044, 0.07569979135586402)
2026-05-23 21:29:35,976 - optuna.study.study - INFO - Trial 229 finished with values: [0.0732042864645112, 0.055455298013245044, 0.07569979135586402] and parameters: {'n_layers': 1, 'embedding_dim': 256, 'lr': 0.001325452189730596, 'lambda_val': 0.010206876103860561, 'batch_size': 845, 'optimizer': 'Adam'}.
2026-05-23 21:30:03,143 - experiment_functions - INFO - Early stopping at epoch 2000. Best Metrics: (0.08723152078407102, 0.06234271523178808, 0.08929379136246385)
2026-05-23 21:30:03,241 - optuna.study.study - INFO - Trial 230 finished with values: [0.08723152078407102, 0.06234271523178808, 0.08929379136246385] and parameters: {'n_layers': 2, 'embedding_dim': 32, 'lr': 0.00045141578622738895, 'lambda_val': 0.0053912262075664795, 'batch_size': 576, 'optimizer': 'Adam'}.
2026-05-23 21:30:28,653 - experiment_functions - INFO - Early stopping at epoch 1550. Best Metrics: (0.08098112268224447, 0.05966059602649007, 0.08261901871512206)
2026-05-23 21:30:29,306 - optuna.study.study - INFO - Trial 231 finished with values: [0.08098112268224447, 0.05966059602649007, 0.08261901871512206] and parameters: {'n_layers': 1, 'embedding_dim': 256, 'lr': 0.0006825513923366329, 'lambda_val': 1.207883913872658e-06, 'batch_size': 808, 'optimizer': 'Adam'}.
2026-05-23 21:30:37,882 - experiment_functions - INFO - Early stopping at epoch 550. Best Metrics: (0.0729667204002913, 0.04918046357615894, 0.07206199965083927)
2026-05-23 21:30:37,982 - optuna.study.study - INFO - Trial 232 finished with values: [0.0729667204002913, 0.04918046357615894, 0.07206199965083927] and parameters: {'n_layers': 1, 'embedding_dim': 128, 'lr': 0.007131304194051908, 'lambda_val': 0.001076113642302791, 'batch_size': 886, 'optimizer': 'Adam'}.
2026-05-23 21:30:48,252 - experiment_functions - INFO - Early stopping at epoch 500. Best Metrics: (0.0053721003759129434, 0.004470198675496689, 0.00545031524099881)
2026-05-23 21:30:48,369 - optuna.study.study - INFO - Trial 233 finished with values: [0.0053721003759129434, 0.004470198675496689, 0.00545031524099881] and parameters: {'n_layers': 2, 'embedding_dim': 256, 'lr': 0.0009457607588552657, 'lambda_val': 1.377254821459226e-05, 'batch_size': 886, 'optimizer': 'SGD'}.
2026-05-23 21:31:41,086 - optuna.study.study - INFO - Trial 234 finished with values: [0.07015803473504126, 0.05221854304635761, 0.07349620110177182] and parameters: {'n_layers': 1, 'embedding_dim': 96, 'lr': 0.0003769546241102816, 'lambda_val': 0.001076113642302791, 'batch_size': 833, 'optimizer': 'Adam'}.
2026-05-23 21:31:49,592 - experiment_functions - INFO - Early stopping at epoch 550. Best Metrics: (0.05365734789315864, 0.044197019867549675, 0.05753057677670448)
2026-05-23 21:31:49,693 - optuna.study.study - INFO - Trial 235 finished with values: [0.05365734789315864, 0.044197019867549675, 0.05753057677670448] and parameters: {'n_layers': 1, 'embedding_dim': 96, 'lr': 0.009953141795285803, 'lambda_val': 0.0053912262075664795, 'batch_size': 1775, 'optimizer': 'Adam'}.
2026-05-23 21:32:05,897 - experiment_functions - INFO - Early stopping at epoch 1100. Best Metrics: (0.07943065383892212, 0.058302980132450326, 0.08284543102562239)
2026-05-23 21:32:06,112 - optuna.study.study - INFO - Trial 236 finished with values: [0.07943065383892212, 0.058302980132450326, 0.08284543102562239] and parameters: {'n_layers': 1, 'embedding_dim': 128, 'lr': 0.0007928857958215832, 'lambda_val': 1.207883913872658e-06, 'batch_size': 1491, 'optimizer': 'Adam'}.
2026-05-23 21:32:17,869 - experiment_functions - INFO - Early stopping at epoch 800. Best Metrics: (0.08039564357491559, 0.057466887417218546, 0.08219498618829052)
2026-05-23 21:32:19,102 - optuna.study.study - INFO - Trial 237 finished with values: [0.08039564357491559, 0.057466887417218546, 0.08219498618829052] and parameters: {'n_layers': 1, 'embedding_dim': 96, 'lr': 0.0017544079546559647, 'lambda_val': 0.0007535837355673727, 'batch_size': 886, 'optimizer': 'Adam'}.
2026-05-23 21:32:39,864 - experiment_functions - INFO - Early stopping at epoch 1600. Best Metrics: (0.08723999783204778, 0.063658940397351, 0.08813760027066951)
