2026-05-24 02:57:33,055 - optuna.study.study - INFO - Trial 80 finished with values: [0.025917035497265005, 0.020538079470198676, 0.027001966847646136] and parameters: {'n_layers': 4, 'embedding_dim': 32, 'lr': 0.0004568670531170521, 'lambda_val': 0.05810316365964571, 'batch_size': 2142, 'optimizer': 'RMSprop'}.
2026-05-24 02:58:16,363 - optuna.study.study - INFO - Trial 81 finished with values: [0.012608149096570908, 0.009735099337748345, 0.012838243657133175] and parameters: {'n_layers': 2, 'embedding_dim': 256, 'lr': 0.00010824064352803442, 'lambda_val': 0.008488287228418469, 'batch_size': 2557, 'optimizer': 'Adam'}.
2026-05-24 02:58:38,072 - experiment_functions - INFO - Early stopping at epoch 2050. Best Metrics: (0.015542226865876592, 0.011895695364238412, 0.016090884353184377)
2026-05-24 02:58:38,200 - optuna.study.study - INFO - Trial 82 finished with values: [0.015542226865876592, 0.011895695364238412, 0.016090884353184377] and parameters: {'n_layers': 1, 'embedding_dim': 256, 'lr': 0.0005700378100001039, 'lambda_val': 0.0007015993710695603, 'batch_size': 679, 'optimizer': 'Adam'}.
2026-05-24 02:59:17,965 - optuna.study.study - INFO - Trial 83 finished with values: [0.0063164066877697, 0.005024834437086093, 0.006659740802826227] and parameters: {'n_layers': 3, 'embedding_dim': 32, 'lr': 2.3480301409911985e-05, 'lambda_val': 2.2508477191000715e-06, 'batch_size': 2744, 'optimizer': 'Adam'}.
2026-05-24 02:59:25,915 - experiment_functions - INFO - Early stopping at epoch 650. Best Metrics: (0.018522842730699044, 0.01464403973509934, 0.019549355557208357)
2026-05-24 02:59:26,016 - optuna.study.study - INFO - Trial 84 finished with values: [0.018522842730699044, 0.01464403973509934, 0.019549355557208357] and parameters: {'n_layers': 3, 'embedding_dim': 64, 'lr': 0.001073497477166827, 'lambda_val': 5.1688078317297965e-06, 'batch_size': 2583, 'optimizer': 'RMSprop'}.
2026-05-24 02:59:55,741 - experiment_functions - INFO - Early stopping at epoch 2950. Best Metrics: (0.01584924766158564, 0.01267384105960265, 0.016524004584434347)
2026-05-24 02:59:55,846 - optuna.study.study - INFO - Trial 85 finished with values: [0.01584924766158564, 0.01267384105960265, 0.016524004584434347] and parameters: {'n_layers': 2, 'embedding_dim': 96, 'lr': 0.00021574524362862762, 'lambda_val': 0.015202750041742976, 'batch_size': 2143, 'optimizer': 'RMSprop'}.
2026-05-24 03:00:01,791 - experiment_functions - INFO - Early stopping at epoch 500. Best Metrics: (0.008438267432304766, 0.006870860927152318, 0.008849531351018633)
2026-05-24 03:00:01,900 - optuna.study.study - INFO - Trial 86 finished with values: [0.008438267432304766, 0.006870860927152318, 0.008849531351018633] and parameters: {'n_layers': 1, 'embedding_dim': 96, 'lr': 0.012689045127078847, 'lambda_val': 0.015202750041742976, 'batch_size': 713, 'optimizer': 'RMSprop'}.
2026-05-24 03:00:08,766 - experiment_functions - INFO - Early stopping at epoch 550. Best Metrics: (0.008933933795478532, 0.007549668874172186, 0.009281231605065034)
2026-05-24 03:00:08,865 - optuna.study.study - INFO - Trial 87 finished with values: [0.008933933795478532, 0.007549668874172186, 0.009281231605065034] and parameters: {'n_layers': 4, 'embedding_dim': 128, 'lr': 0.031379140137514784, 'lambda_val': 1.9756449106391153e-05, 'batch_size': 3853, 'optimizer': 'Adam'}.
2026-05-24 03:00:19,806 - experiment_functions - INFO - Early stopping at epoch 950. Best Metrics: (0.020050773840494574, 0.016548013245033112, 0.021713918067210746)
2026-05-24 03:00:20,764 - optuna.study.study - INFO - Trial 88 finished with values: [0.020050773840494574, 0.016548013245033112, 0.021713918067210746] and parameters: {'n_layers': 4, 'embedding_dim': 96, 'lr': 0.0005700378100001039, 'lambda_val': 1.113463354596578e-05, 'batch_size': 1628, 'optimizer': 'Adam'}.
2026-05-24 03:00:28,663 - experiment_functions - INFO - Early stopping at epoch 650. Best Metrics: (0.017478688557949124, 0.014205298013245035, 0.018529825547582195)
2026-05-24 03:00:29,588 - optuna.study.study - INFO - Trial 89 finished with values: [0.017478688557949124, 0.014205298013245035, 0.018529825547582195] and parameters: {'n_layers': 4, 'embedding_dim': 32, 'lr': 0.001073497477166827, 'lambda_val': 0.0002989351068597163, 'batch_size': 3324, 'optimizer': 'RMSprop'}.
2026-05-24 03:00:37,036 - experiment_functions - INFO - Early stopping at epoch 550. Best Metrics: (0.010718397801974066, 0.009122516556291392, 0.010958801144988716)
2026-05-24 03:00:37,133 - optuna.study.study - INFO - Trial 90 finished with values: [0.010718397801974066, 0.009122516556291392, 0.010958801144988716] and parameters: {'n_layers': 4, 'embedding_dim': 256, 'lr': 0.003052355703485208, 'lambda_val': 0.0005471501023581531, 'batch_size': 3283, 'optimizer': 'RMSprop'}.
2026-05-24 03:00:43,985 - experiment_functions - INFO - Early stopping at epoch 550. Best Metrics: (0.018349736807238868, 0.014039735099337751, 0.018702128170468638)
2026-05-24 03:00:44,642 - optuna.study.study - INFO - Trial 91 finished with values: [0.018349736807238868, 0.014039735099337751, 0.018702128170468638] and parameters: {'n_layers': 4, 'embedding_dim': 128, 'lr': 0.001073497477166827, 'lambda_val': 5.138211460433891e-05, 'batch_size': 2583, 'optimizer': 'RMSprop'}.
2026-05-24 03:00:57,295 - experiment_functions - INFO - Early stopping at epoch 1200. Best Metrics: (0.0055340376759091744, 0.004495033112582782, 0.005714240598468759)
2026-05-24 03:00:57,396 - optuna.study.study - INFO - Trial 92 finished with values: [0.0055340376759091744, 0.004495033112582782, 0.005714240598468759] and parameters: {'n_layers': 4, 'embedding_dim': 32, 'lr': 0.01814733966544771, 'lambda_val': 0.0001330030306186211, 'batch_size': 1186, 'optimizer': 'SGD'}.
2026-05-24 03:01:03,391 - experiment_functions - INFO - Early stopping at epoch 500. Best Metrics: (0.004454743336103998, 0.0037500000000000003, 0.0046165410103008245)
2026-05-24 03:01:03,821 - optuna.study.study - INFO - Trial 93 finished with values: [0.004454743336103998, 0.0037500000000000003, 0.0046165410103008245] and parameters: {'n_layers': 2, 'embedding_dim': 96, 'lr': 0.00022697340368721037, 'lambda_val': 0.009077560366260225, 'batch_size': 4003, 'optimizer': 'SGD'}.
2026-05-24 03:01:09,843 - experiment_functions - INFO - Early stopping at epoch 500. Best Metrics: (0.007605143880137098, 0.00603476821192053, 0.007493847820787192)
2026-05-24 03:01:09,929 - optuna.study.study - INFO - Trial 94 finished with values: [0.007605143880137098, 0.00603476821192053, 0.007493847820787192] and parameters: {'n_layers': 3, 'embedding_dim': 64, 'lr': 0.009944040101896572, 'lambda_val': 0.011587187073107777, 'batch_size': 3352, 'optimizer': 'RMSprop'}.
2026-05-24 03:01:17,464 - experiment_functions - INFO - Early stopping at epoch 600. Best Metrics: (0.013693509543456682, 0.012442052980132451, 0.014841204175934148)
2026-05-24 03:01:17,558 - optuna.study.study - INFO - Trial 95 finished with values: [0.013693509543456682, 0.012442052980132451, 0.014841204175934148] and parameters: {'n_layers': 4, 'embedding_dim': 128, 'lr': 0.0008654503808156264, 'lambda_val': 0.0820315059645863, 'batch_size': 3349, 'optimizer': 'RMSprop'}.
2026-05-24 03:01:25,830 - experiment_functions - INFO - Early stopping at epoch 550. Best Metrics: (0.009784982642073673, 0.007806291390728478, 0.009798030913667339)
2026-05-24 03:01:26,019 - optuna.study.study - INFO - Trial 96 finished with values: [0.009784982642073673, 0.007806291390728478, 0.009798030913667339] and parameters: {'n_layers': 4, 'embedding_dim': 256, 'lr': 0.01814733966544771, 'lambda_val': 0.0001330030306186211, 'batch_size': 3283, 'optimizer': 'Adam'}.
2026-05-24 03:01:42,943 - experiment_functions - INFO - Early stopping at epoch 1600. Best Metrics: (0.007562944392486113, 0.007549668874172186, 0.00915671670057808)
2026-05-24 03:01:43,124 - optuna.study.study - INFO - Trial 97 finished with values: [0.007562944392486113, 0.007549668874172186, 0.00915671670057808] and parameters: {'n_layers': 3, 'embedding_dim': 64, 'lr': 0.009944040101896572, 'lambda_val': 0.07377499750302594, 'batch_size': 3352, 'optimizer': 'RMSprop'}.
2026-05-24 03:01:51,211 - experiment_functions - INFO - Early stopping at epoch 550. Best Metrics: (0.018736142252849895, 0.013625827814569535, 0.01850676626393471)
2026-05-24 03:01:51,511 - optuna.study.study - INFO - Trial 98 finished with values: [0.018736142252849895, 0.013625827814569535, 0.01850676626393471] and parameters: {'n_layers': 2, 'embedding_dim': 32, 'lr': 0.003052355703485208, 'lambda_val': 0.015202750041742976, 'batch_size': 713, 'optimizer': 'RMSprop'}.
2026-05-24 03:01:57,492 - experiment_functions - INFO - Early stopping at epoch 500. Best Metrics: (0.004880696883123914, 0.0043377483443708615, 0.005275154240796131)
2026-05-24 03:01:57,647 - optuna.study.study - INFO - Trial 99 finished with values: [0.004880696883123914, 0.0043377483443708615, 0.005275154240796131] and parameters: {'n_layers': 3, 'embedding_dim': 96, 'lr': 0.00021574524362862762, 'lambda_val': 0.015202750041742976, 'batch_size': 698, 'optimizer': 'SGD'}.
2026-05-24 03:02:07,007 - experiment_functions - INFO - Early stopping at epoch 500. Best Metrics: (0.004982337339548707, 0.0039817880794701995, 0.00505811792467208)
2026-05-24 03:02:07,855 - optuna.study.study - INFO - Trial 100 finished with values: [0.004982337339548707, 0.0039817880794701995, 0.00505811792467208] and parameters: {'n_layers': 2, 'embedding_dim': 96, 'lr': 0.0006236035183558026, 'lambda_val': 9.751859507213105e-05, 'batch_size': 3997, 'optimizer': 'SGD'}.
2026-05-24 03:02:21,031 - experiment_functions - INFO - Early stopping at epoch 650. Best Metrics: (0.01472681917430176, 0.011200331125827816, 0.014944146607980041)
2026-05-24 03:02:22,011 - optuna.study.study - INFO - Trial 101 finished with values: [0.01472681917430176, 0.011200331125827816, 0.014944146607980041] and parameters: {'n_layers': 1, 'embedding_dim': 256, 'lr': 0.001073497477166827, 'lambda_val': 5.138211460433891e-05, 'batch_size': 2583, 'optimizer': 'RMSprop'}.
2026-05-24 03:02:31,215 - experiment_functions - INFO - Early stopping at epoch 700. Best Metrics: (0.017952451066650756, 0.014312913907284772, 0.018467010858308413)
2026-05-24 03:02:31,315 - optuna.study.study - INFO - Trial 102 finished with values: [0.017952451066650756, 0.014312913907284772, 0.018467010858308413] and parameters: {'n_layers': 4, 'embedding_dim': 64, 'lr': 0.001073497477166827, 'lambda_val': 5.138211460433891e-05, 'batch_size': 2365, 'optimizer': 'Adam'}.
2026-05-24 03:02:41,053 - experiment_functions - INFO - Early stopping at epoch 800. Best Metrics: (0.012323133498907889, 0.010248344370860928, 0.01330740685034862)
2026-05-24 03:02:41,323 - optuna.study.study - INFO - Trial 103 finished with values: [0.012323133498907889, 0.010248344370860928, 0.01330740685034862] and parameters: {'n_layers': 1, 'embedding_dim': 96, 'lr': 0.000648779798240634, 'lambda_val': 0.021588570189454596, 'batch_size': 1635, 'optimizer': 'RMSprop'}.
2026-05-24 03:02:48,526 - experiment_functions - INFO - Early stopping at epoch 550. Best Metrics: (0.01633997404829472, 0.012408940397350994, 0.01681571237074518)
2026-05-24 03:02:48,792 - optuna.study.study - INFO - Trial 104 finished with values: [0.01633997404829472, 0.012408940397350994, 0.01681571237074518] and parameters: {'n_layers': 2, 'embedding_dim': 96, 'lr': 0.0018521591652371555, 'lambda_val': 0.00137043373626878, 'batch_size': 2171, 'optimizer': 'RMSprop'}.
2026-05-24 03:02:56,682 - experiment_functions - INFO - Early stopping at epoch 600. Best Metrics: (0.018239752892705047, 0.01308774834437086, 0.018499379870668672)
2026-05-24 03:02:56,775 - optuna.study.study - INFO - Trial 105 finished with values: [0.018239752892705047, 0.01308774834437086, 0.018499379870668672] and parameters: {'n_layers': 2, 'embedding_dim': 32, 'lr': 0.003052355703485208, 'lambda_val': 1.002227016896905e-06, 'batch_size': 2365, 'optimizer': 'Adam'}.
2026-05-24 03:03:04,043 - experiment_functions - INFO - Early stopping at epoch 550. Best Metrics: (0.008416550506701386, 0.008153973509933774, 0.009309552943059119)
2026-05-24 03:03:04,140 - optuna.study.study - INFO - Trial 106 finished with values: [0.008416550506701386, 0.008153973509933774, 0.009309552943059119] and parameters: {'n_layers': 4, 'embedding_dim': 32, 'lr': 0.003052355703485208, 'lambda_val': 0.05810316365964571, 'batch_size': 1311, 'optimizer': 'RMSprop'}.
2026-05-24 03:03:21,763 - experiment_functions - INFO - Early stopping at epoch 1550. Best Metrics: (0.00505818642060547, 0.004519867549668874, 0.005463590897886574)
2026-05-24 03:03:22,199 - optuna.study.study - INFO - Trial 107 finished with values: [0.00505818642060547, 0.004519867549668874, 0.005463590897886574] and parameters: {'n_layers': 3, 'embedding_dim': 96, 'lr': 1.386916159748818e-05, 'lambda_val': 0.015202750041742976, 'batch_size': 713, 'optimizer': 'RMSprop'}.
2026-05-24 03:03:29,595 - experiment_functions - INFO - Early stopping at epoch 550. Best Metrics: (0.01151634699942799, 0.009776490066225167, 0.012078923596928583)
2026-05-24 03:03:29,700 - optuna.study.study - INFO - Trial 108 finished with values: [0.01151634699942799, 0.009776490066225167, 0.012078923596928583] and parameters: {'n_layers': 4, 'embedding_dim': 96, 'lr': 0.0039180600808985284, 'lambda_val': 5.138211460433891e-05, 'batch_size': 2583, 'optimizer': 'RMSprop'}.
2026-05-24 03:03:40,523 - experiment_functions - INFO - Early stopping at epoch 850. Best Metrics: (0.020211086183082146, 0.014478476821192054, 0.02059351117204921)
2026-05-24 03:03:42,016 - optuna.study.study - INFO - Trial 109 finished with values: [0.020211086183082146, 0.014478476821192054, 0.02059351117204921] and parameters: {'n_layers': 1, 'embedding_dim': 32, 'lr': 0.0008654503808156264, 'lambda_val': 2.7695935649997752e-05, 'batch_size': 2315, 'optimizer': 'RMSprop'}.
2026-05-24 03:04:00,821 - experiment_functions - INFO - Early stopping at epoch 1500. Best Metrics: (0.014056271216817594, 0.012201986754966887, 0.015525938508443507)
2026-05-24 03:04:00,904 - optuna.study.study - INFO - Trial 110 finished with values: [0.014056271216817594, 0.012201986754966887, 0.015525938508443507] and parameters: {'n_layers': 3, 'embedding_dim': 256, 'lr': 0.00021574524362862762, 'lambda_val': 0.015202750041742976, 'batch_size': 2143, 'optimizer': 'Adam'}.
2026-05-24 03:04:25,439 - experiment_functions - INFO - Early stopping at epoch 2150. Best Metrics: (0.01597519226324537, 0.01193708609271523, 0.01602720817575135)
2026-05-24 03:04:25,557 - optuna.study.study - INFO - Trial 111 finished with values: [0.01597519226324537, 0.01193708609271523, 0.01602720817575135] and parameters: {'n_layers': 2, 'embedding_dim': 96, 'lr': 0.00023575343785216322, 'lambda_val': 0.011587187073107777, 'batch_size': 3997, 'optimizer': 'RMSprop'}.
2026-05-24 03:04:36,953 - experiment_functions - INFO - Early stopping at epoch 850. Best Metrics: (0.01683101320324326, 0.013658940397350994, 0.01753362499510532)
2026-05-24 03:04:37,260 - optuna.study.study - INFO - Trial 112 finished with values: [0.01683101320324326, 0.013658940397350994, 0.01753362499510532] and parameters: {'n_layers': 3, 'embedding_dim': 256, 'lr': 0.0005881134405257853, 'lambda_val': 1.8203246882701353e-06, 'batch_size': 2171, 'optimizer': 'Adam'}.
2026-05-24 03:04:53,058 - experiment_functions - INFO - Early stopping at epoch 1300. Best Metrics: (0.019057567168377178, 0.015256622516556292, 0.019441986120278372)
2026-05-24 03:04:53,319 - optuna.study.study - INFO - Trial 113 finished with values: [0.019057567168377178, 0.015256622516556292, 0.019441986120278372] and parameters: {'n_layers': 4, 'embedding_dim': 32, 'lr': 0.0004568670531170521, 'lambda_val': 1.002227016896905e-06, 'batch_size': 2365, 'optimizer': 'RMSprop'}.
2026-05-24 03:05:06,235 - experiment_functions - INFO - Early stopping at epoch 800. Best Metrics: (0.018384882998410654, 0.013551324503311257, 0.01887710372418947)
2026-05-24 03:05:06,835 - optuna.study.study - INFO - Trial 114 finished with values: [0.018384882998410654, 0.013551324503311257, 0.01887710372418947] and parameters: {'n_layers': 2, 'embedding_dim': 64, 'lr': 0.000648779798240634, 'lambda_val': 0.011587187073107777, 'batch_size': 2171, 'optimizer': 'RMSprop'}.
2026-05-24 03:05:31,914 - experiment_functions - INFO - Early stopping at epoch 2150. Best Metrics: (0.020239949077575915, 0.013940397350993375, 0.02023834097109758)
2026-05-24 03:05:32,504 - optuna.study.study - INFO - Trial 115 finished with values: [0.020239949077575915, 0.013940397350993375, 0.02023834097109758] and parameters: {'n_layers': 2, 'embedding_dim': 32, 'lr': 0.00036006007162814904, 'lambda_val': 1.6246953393264848e-05, 'batch_size': 2393, 'optimizer': 'Adam'}.
2026-05-24 03:05:45,070 - experiment_functions - INFO - Early stopping at epoch 1000. Best Metrics: (0.02237198475701621, 0.017309602649006623, 0.023064403627783916)
2026-05-24 03:05:45,163 - optuna.study.study - INFO - Trial 116 finished with values: [0.02237198475701621, 0.017309602649006623, 0.023064403627783916] and parameters: {'n_layers': 4, 'embedding_dim': 64, 'lr': 0.0005700378100001039, 'lambda_val': 1.6592144824872775e-06, 'batch_size': 979, 'optimizer': 'Adam'}.
2026-05-24 03:05:52,906 - experiment_functions - INFO - Early stopping at epoch 600. Best Metrics: (0.019433200871344685, 0.015653973509933774, 0.02063606422874465)
2026-05-24 03:05:53,008 - optuna.study.study - INFO - Trial 117 finished with values: [0.019433200871344685, 0.015653973509933774, 0.02063606422874465] and parameters: {'n_layers': 4, 'embedding_dim': 128, 'lr': 0.0029546046142959006, 'lambda_val': 7.397534001840383e-06, 'batch_size': 679, 'optimizer': 'Adam'}.
2026-05-24 03:05:59,761 - experiment_functions - INFO - Early stopping at epoch 500. Best Metrics: (0.005127766239348033, 0.004263245033112583, 0.005086969580802474)
2026-05-24 03:05:59,846 - optuna.study.study - INFO - Trial 118 finished with values: [0.005127766239348033, 0.004263245033112583, 0.005086969580802474] and parameters: {'n_layers': 4, 'embedding_dim': 128, 'lr': 0.00036006007162814904, 'lambda_val': 0.05810316365964571, 'batch_size': 2393, 'optimizer': 'SGD'}.
2026-05-24 03:06:37,624 - experiment_functions - INFO - Early stopping at epoch 3400. Best Metrics: (0.016844218843795503, 0.012706953642384106, 0.017406205693899765)
2026-05-24 03:06:37,705 - optuna.study.study - INFO - Trial 119 finished with values: [0.016844218843795503, 0.012706953642384106, 0.017406205693899765] and parameters: {'n_layers': 2, 'embedding_dim': 96, 'lr': 0.00021574524362862762, 'lambda_val': 0.015202750041742976, 'batch_size': 2171, 'optimizer': 'RMSprop'}.
2026-05-24 03:06:48,332 - experiment_functions - INFO - Early stopping at epoch 850. Best Metrics: (0.016001597747127345, 0.011713576158940397, 0.0160746609497274)
2026-05-24 03:06:49,007 - optuna.study.study - INFO - Trial 120 finished with values: [0.016001597747127345, 0.011713576158940397, 0.0160746609497274] and parameters: {'n_layers': 2, 'embedding_dim': 96, 'lr': 0.0006236035183558026, 'lambda_val': 9.751859507213105e-05, 'batch_size': 3997, 'optimizer': 'Adam'}.
2026-05-24 03:06:55,361 - experiment_functions - INFO - Early stopping at epoch 500. Best Metrics: (0.009706780238923811, 0.007375827814569537, 0.0099337486203222)
2026-05-24 03:06:55,463 - optuna.study.study - INFO - Trial 121 finished with values: [0.009706780238923811, 0.007375827814569537, 0.0099337486203222] and parameters: {'n_layers': 3, 'embedding_dim': 32, 'lr': 0.05320594533988582, 'lambda_val': 0.0002989351068597163, 'batch_size': 659, 'optimizer': 'RMSprop'}.
2026-05-24 03:07:03,882 - experiment_functions - INFO - Early stopping at epoch 650. Best Metrics: (0.01841328758873372, 0.014221854304635762, 0.01931356423440269)
2026-05-24 03:07:04,018 - optuna.study.study - INFO - Trial 122 finished with values: [0.01841328758873372, 0.014221854304635762, 0.01931356423440269] and parameters: {'n_layers': 3, 'embedding_dim': 64, 'lr': 0.001073497477166827, 'lambda_val': 0.00034199571335759705, 'batch_size': 2473, 'optimizer': 'RMSprop'}.
2026-05-24 03:07:11,341 - experiment_functions - INFO - Early stopping at epoch 550. Best Metrics: (0.014473429295118452, 0.011407284768211921, 0.01507714632389061)
2026-05-24 03:07:11,432 - optuna.study.study - INFO - Trial 123 finished with values: [0.014473429295118452, 0.011407284768211921, 0.01507714632389061] and parameters: {'n_layers': 2, 'embedding_dim': 96, 'lr': 0.0039180600808985284, 'lambda_val': 5.138211460433891e-05, 'batch_size': 2583, 'optimizer': 'RMSprop'}.
2026-05-24 03:07:20,238 - experiment_functions - INFO - Early stopping at epoch 700. Best Metrics: (0.021422654396069708, 0.01472682119205298, 0.021363831308723383)
2026-05-24 03:07:20,400 - optuna.study.study - INFO - Trial 124 finished with values: [0.021422654396069708, 0.01472682119205298, 0.021363831308723383] and parameters: {'n_layers': 1, 'embedding_dim': 32, 'lr': 0.0018521591652371555, 'lambda_val': 7.397534001840383e-06, 'batch_size': 1841, 'optimizer': 'Adam'}.
2026-05-24 03:07:26,902 - experiment_functions - INFO - Early stopping at epoch 500. Best Metrics: (0.004836651372512738, 0.0041390728476821195, 0.005314903891491462)
2026-05-24 03:07:27,488 - optuna.study.study - INFO - Trial 125 finished with values: [0.004836651372512738, 0.0041390728476821195, 0.005314903891491462] and parameters: {'n_layers': 3, 'embedding_dim': 96, 'lr': 0.0004568670531170521, 'lambda_val': 1.113463354596578e-05, 'batch_size': 1628, 'optimizer': 'SGD'}.
2026-05-24 03:07:36,647 - experiment_functions - INFO - Early stopping at epoch 700. Best Metrics: (0.021057993435655453, 0.016771523178807948, 0.022056717846924364)
