2026-05-23 23:47:03,446 - optuna.study.study - INFO - Trial 271 finished with values: [0.026341492612541574, 0.008758278145695365, 0.025478813059118633] and parameters: {'n_layers': 1, 'embedding_dim': 256, 'lr': 9.17855523064707e-05, 'lambda_val': 2.430474765536691e-05, 'batch_size': 1894, 'optimizer': 'RMSprop'}.
2026-05-23 23:47:13,708 - experiment_functions - INFO - Early stopping at epoch 850. Best Metrics: (0.02632504069152979, 0.00876655629139073, 0.023577139645754062)
2026-05-23 23:47:13,890 - optuna.study.study - INFO - Trial 272 finished with values: [0.02632504069152979, 0.00876655629139073, 0.023577139645754062] and parameters: {'n_layers': 2, 'embedding_dim': 256, 'lr': 0.00028881949474372873, 'lambda_val': 0.00031335292673571056, 'batch_size': 627, 'optimizer': 'RMSprop'}.
2026-05-23 23:47:54,629 - optuna.study.study - INFO - Trial 273 finished with values: [0.014535082646673251, 0.005860927152317881, 0.010928185738303975] and parameters: {'n_layers': 2, 'embedding_dim': 32, 'lr': 0.0001575404982668674, 'lambda_val': 5.397773249037326e-06, 'batch_size': 3950, 'optimizer': 'Adam'}.
2026-05-23 23:48:03,807 - experiment_functions - INFO - Early stopping at epoch 800. Best Metrics: (0.02633567001512771, 0.008394039735099338, 0.02342277045071691)
2026-05-23 23:48:04,115 - optuna.study.study - INFO - Trial 274 finished with values: [0.02633567001512771, 0.008394039735099338, 0.02342277045071691] and parameters: {'n_layers': 1, 'embedding_dim': 128, 'lr': 0.00039700374197389405, 'lambda_val': 5.293319521753168e-06, 'batch_size': 1351, 'optimizer': 'RMSprop'}.
2026-05-23 23:48:15,268 - experiment_functions - INFO - Early stopping at epoch 950. Best Metrics: (0.016386002826686806, 0.006283112582781457, 0.014045615753054085)
2026-05-23 23:48:15,519 - optuna.study.study - INFO - Trial 275 finished with values: [0.016386002826686806, 0.006283112582781457, 0.014045615753054085] and parameters: {'n_layers': 3, 'embedding_dim': 64, 'lr': 0.0003113394990326061, 'lambda_val': 2.829964802645351e-06, 'batch_size': 1630, 'optimizer': 'Adam'}.
2026-05-23 23:48:22,701 - experiment_functions - INFO - Early stopping at epoch 600. Best Metrics: (0.026866814830354704, 0.008460264900662252, 0.024432301947818136)
2026-05-23 23:48:22,823 - optuna.study.study - INFO - Trial 276 finished with values: [0.026866814830354704, 0.008460264900662252, 0.024432301947818136] and parameters: {'n_layers': 1, 'embedding_dim': 128, 'lr': 0.0007742554383218026, 'lambda_val': 3.136622296234252e-05, 'batch_size': 1661, 'optimizer': 'RMSprop'}.
2026-05-23 23:49:05,155 - optuna.study.study - INFO - Trial 277 finished with values: [0.026796575809790814, 0.008377483443708611, 0.02519158226801703] and parameters: {'n_layers': 1, 'embedding_dim': 128, 'lr': 0.00011132803279953378, 'lambda_val': 3.136622296234252e-05, 'batch_size': 3705, 'optimizer': 'RMSprop'}.
2026-05-23 23:49:46,167 - optuna.study.study - INFO - Trial 278 finished with values: [0.028113868429484906, 0.009221854304635763, 0.025548956112410703] and parameters: {'n_layers': 2, 'embedding_dim': 64, 'lr': 0.00011132803279953378, 'lambda_val': 0.00031335292673571056, 'batch_size': 627, 'optimizer': 'RMSprop'}.
2026-05-23 23:49:53,008 - experiment_functions - INFO - Early stopping at epoch 550. Best Metrics: (0.023455985955333023, 0.007657284768211921, 0.0205455164381649)
2026-05-23 23:49:53,089 - optuna.study.study - INFO - Trial 279 finished with values: [0.023455985955333023, 0.007657284768211921, 0.0205455164381649] and parameters: {'n_layers': 1, 'embedding_dim': 256, 'lr': 0.0009299462051840892, 'lambda_val': 3.136622296234252e-05, 'batch_size': 1477, 'optimizer': 'RMSprop'}.
2026-05-23 23:50:25,353 - experiment_functions - INFO - Early stopping at epoch 2900. Best Metrics: (0.028644908719199818, 0.00951158940397351, 0.02541491315332624)
2026-05-23 23:50:25,431 - optuna.study.study - INFO - Trial 280 finished with values: [0.028644908719199818, 0.00951158940397351, 0.02541491315332624] and parameters: {'n_layers': 2, 'embedding_dim': 256, 'lr': 0.00011132803279953378, 'lambda_val': 4.360746018288999e-05, 'batch_size': 627, 'optimizer': 'RMSprop'}.
2026-05-23 23:50:34,356 - experiment_functions - INFO - Early stopping at epoch 800. Best Metrics: (0.0051138618575603334, 0.004221854304635762, 0.005542933697186461)
2026-05-23 23:50:34,570 - optuna.study.study - INFO - Trial 281 finished with values: [0.0051138618575603334, 0.004221854304635762, 0.005542933697186461] and parameters: {'n_layers': 1, 'embedding_dim': 256, 'lr': 0.020194420167896073, 'lambda_val': 0.00031335292673571056, 'batch_size': 627, 'optimizer': 'SGD'}.
2026-05-23 23:51:11,667 - experiment_functions - INFO - Early stopping at epoch 3500. Best Metrics: (0.023024713178967728, 0.007698675496688742, 0.01916066510991568)
2026-05-23 23:51:11,817 - optuna.study.study - INFO - Trial 282 finished with values: [0.023024713178967728, 0.007698675496688742, 0.01916066510991568] and parameters: {'n_layers': 2, 'embedding_dim': 64, 'lr': 0.00011705745989056773, 'lambda_val': 0.002482166316964702, 'batch_size': 3950, 'optimizer': 'RMSprop'}.
2026-05-23 23:51:18,364 - experiment_functions - INFO - Early stopping at epoch 550. Best Metrics: (0.01393696831029412, 0.005604304635761589, 0.012845831861841218)
2026-05-23 23:51:18,447 - optuna.study.study - INFO - Trial 283 finished with values: [0.01393696831029412, 0.005604304635761589, 0.012845831861841218] and parameters: {'n_layers': 2, 'embedding_dim': 128, 'lr': 0.0009299462051840892, 'lambda_val': 2.829964802645351e-06, 'batch_size': 1477, 'optimizer': 'RMSprop'}.
2026-05-23 23:51:25,092 - experiment_functions - INFO - Early stopping at epoch 550. Best Metrics: (0.025747418552802676, 0.007806291390728478, 0.02118771536540689)
2026-05-23 23:51:25,446 - optuna.study.study - INFO - Trial 284 finished with values: [0.025747418552802676, 0.007806291390728478, 0.02118771536540689] and parameters: {'n_layers': 1, 'embedding_dim': 256, 'lr': 0.005587479616145046, 'lambda_val': 0.00031335292673571056, 'batch_size': 627, 'optimizer': 'Adam'}.
2026-05-23 23:51:38,695 - experiment_functions - INFO - Early stopping at epoch 600. Best Metrics: (0.026533611681760206, 0.008700331125827816, 0.024424029127533244)
2026-05-23 23:51:38,776 - optuna.study.study - INFO - Trial 285 finished with values: [0.026533611681760206, 0.008700331125827816, 0.024424029127533244] and parameters: {'n_layers': 2, 'embedding_dim': 256, 'lr': 0.0009299462051840892, 'lambda_val': 2.430474765536691e-05, 'batch_size': 603, 'optimizer': 'Adam'}.
2026-05-23 23:52:21,293 - optuna.study.study - INFO - Trial 286 finished with values: [0.02753100675183928, 0.00869205298013245, 0.025057771185278237] and parameters: {'n_layers': 1, 'embedding_dim': 256, 'lr': 0.00011705745989056773, 'lambda_val': 2.9338354415205326e-06, 'batch_size': 2177, 'optimizer': 'RMSprop'}.
2026-05-23 23:52:30,431 - experiment_functions - INFO - Early stopping at epoch 700. Best Metrics: (0.01962290372500105, 0.007102649006622517, 0.01703383258450335)
2026-05-23 23:52:31,321 - optuna.study.study - INFO - Trial 287 finished with values: [0.01962290372500105, 0.007102649006622517, 0.01703383258450335] and parameters: {'n_layers': 2, 'embedding_dim': 256, 'lr': 0.00028881949474372873, 'lambda_val': 9.691061665067305e-06, 'batch_size': 3705, 'optimizer': 'RMSprop'}.
2026-05-23 23:53:13,179 - optuna.study.study - INFO - Trial 288 finished with values: [0.02921646383664121, 0.009387417218543047, 0.026686320196993248] and parameters: {'n_layers': 2, 'embedding_dim': 128, 'lr': 0.00011132803279953378, 'lambda_val': 3.136622296234252e-05, 'batch_size': 667, 'optimizer': 'RMSprop'}.
2026-05-23 23:53:38,134 - experiment_functions - INFO - Early stopping at epoch 2100. Best Metrics: (0.026979832789799544, 0.008741721854304638, 0.02307139399322307)
2026-05-23 23:53:39,106 - optuna.study.study - INFO - Trial 289 finished with values: [0.026979832789799544, 0.008741721854304638, 0.02307139399322307] and parameters: {'n_layers': 2, 'embedding_dim': 256, 'lr': 0.00011132803279953378, 'lambda_val': 1.8091030354942413e-05, 'batch_size': 3705, 'optimizer': 'RMSprop'}.
2026-05-23 23:53:46,047 - experiment_functions - INFO - Early stopping at epoch 550. Best Metrics: (0.007266033706289078, 0.004147350993377484, 0.006078305473722344)
2026-05-23 23:53:46,123 - optuna.study.study - INFO - Trial 290 finished with values: [0.007266033706289078, 0.004147350993377484, 0.006078305473722344] and parameters: {'n_layers': 2, 'embedding_dim': 256, 'lr': 0.0009299462051840892, 'lambda_val': 0.016821900640215364, 'batch_size': 627, 'optimizer': 'Adam'}.
2026-05-23 23:54:06,395 - experiment_functions - INFO - Early stopping at epoch 1650. Best Metrics: (0.02247170509057772, 0.007682119205298014, 0.019009100845587858)
2026-05-23 23:54:07,049 - optuna.study.study - INFO - Trial 291 finished with values: [0.02247170509057772, 0.007682119205298014, 0.019009100845587858] and parameters: {'n_layers': 2, 'embedding_dim': 256, 'lr': 0.00011132803279953378, 'lambda_val': 9.691061665067305e-06, 'batch_size': 3705, 'optimizer': 'Adam'}.
2026-05-23 23:54:14,094 - experiment_functions - INFO - Early stopping at epoch 550. Best Metrics: (0.025782897301375757, 0.008625827814569538, 0.024091376681248253)
2026-05-23 23:54:14,169 - optuna.study.study - INFO - Trial 292 finished with values: [0.025782897301375757, 0.008625827814569538, 0.024091376681248253] and parameters: {'n_layers': 2, 'embedding_dim': 256, 'lr': 0.0018608102835700141, 'lambda_val': 1.103702119969278e-06, 'batch_size': 627, 'optimizer': 'Adam'}.
2026-05-23 23:54:20,039 - experiment_functions - INFO - Early stopping at epoch 500. Best Metrics: (0.004666341178231099, 0.002839403973509934, 0.0039605966435095384)
2026-05-23 23:54:20,162 - optuna.study.study - INFO - Trial 293 finished with values: [0.004666341178231099, 0.002839403973509934, 0.0039605966435095384] and parameters: {'n_layers': 1, 'embedding_dim': 128, 'lr': 0.02472410377819143, 'lambda_val': 0.00031335292673571056, 'batch_size': 627, 'optimizer': 'RMSprop'}.
2026-05-23 23:54:30,480 - experiment_functions - INFO - Early stopping at epoch 550. Best Metrics: (0.022275721952819016, 0.007591059602649008, 0.01809414223798839)
2026-05-23 23:54:30,796 - optuna.study.study - INFO - Trial 294 finished with values: [0.022275721952819016, 0.007591059602649008, 0.01809414223798839] and parameters: {'n_layers': 2, 'embedding_dim': 256, 'lr': 0.0009299462051840892, 'lambda_val': 9.691061665067305e-06, 'batch_size': 603, 'optimizer': 'RMSprop'}.
2026-05-23 23:54:37,365 - experiment_functions - INFO - Early stopping at epoch 500. Best Metrics: (0.005348088211896418, 0.00402317880794702, 0.005192804676190429)
2026-05-23 23:54:37,443 - optuna.study.study - INFO - Trial 295 finished with values: [0.005348088211896418, 0.00402317880794702, 0.005192804676190429] and parameters: {'n_layers': 2, 'embedding_dim': 128, 'lr': 0.00011132803279953378, 'lambda_val': 9.691061665067305e-06, 'batch_size': 3705, 'optimizer': 'SGD'}.
2026-05-23 23:54:48,972 - experiment_functions - INFO - Early stopping at epoch 1050. Best Metrics: (0.027722343964506135, 0.008981788079470199, 0.02439665673506911)
2026-05-23 23:54:49,231 - optuna.study.study - INFO - Trial 296 finished with values: [0.027722343964506135, 0.008981788079470199, 0.02439665673506911] and parameters: {'n_layers': 1, 'embedding_dim': 128, 'lr': 0.0003568831204476262, 'lambda_val': 1.0525537797663283e-06, 'batch_size': 627, 'optimizer': 'RMSprop'}.
2026-05-23 23:55:30,283 - optuna.study.study - INFO - Trial 297 finished with values: [0.0272152988602479, 0.009213576158940398, 0.026505575152052464] and parameters: {'n_layers': 1, 'embedding_dim': 128, 'lr': 0.00011132803279953378, 'lambda_val': 2.9338354415205326e-06, 'batch_size': 1557, 'optimizer': 'RMSprop'}.
2026-05-23 23:55:36,213 - experiment_functions - INFO - Early stopping at epoch 500. Best Metrics: (0.0046999724084532315, 0.0029718543046357623, 0.004255782153031739)
2026-05-23 23:55:36,326 - optuna.study.study - INFO - Trial 298 finished with values: [0.0046999724084532315, 0.0029718543046357623, 0.004255782153031739] and parameters: {'n_layers': 1, 'embedding_dim': 256, 'lr': 0.043180448532499464, 'lambda_val': 1.0525537797663283e-06, 'batch_size': 627, 'optimizer': 'RMSprop'}.
2026-05-23 23:56:16,365 - optuna.study.study - INFO - Trial 299 finished with values: [0.021447037843356477, 0.007533112582781457, 0.019229189693359076] and parameters: {'n_layers': 1, 'embedding_dim': 32, 'lr': 0.00011705745989056773, 'lambda_val': 0.0005182678878995747, 'batch_size': 1837, 'optimizer': 'Adam'}.
2026-05-23 23:56:16,380 - root - INFO - Selected Trial 288 based on Max ndcg: 0.0267
2026-05-23 23:56:16,380 - root - INFO - Associated Recall: 0.0292
2026-05-23 23:56:16,380 - experiment_functions - INFO - Training the best model ... for e_1M_1c1dcs_strict
2026-05-23 23:56:58,061 - root - INFO -   **** Training e_1M_1c1dcs_strict_rand1
2026-05-23 23:56:58,066 - root - INFO -   **** Getting 11896/805443 random edges
2026-05-23 23:56:58,175 - optuna.storages._rdb.storage - INFO - A new study created in RDB with name: Study_e_1M_1c1dcs_strict_rand1
2026-05-23 23:57:40,510 - optuna.study.study - INFO - Trial 0 finished with values: [0.006125222097034703, 0.004875827814569537, 0.006370022272061395] and parameters: {'n_layers': 2, 'embedding_dim': 256, 'lr': 1.4183904471423567e-05, 'lambda_val': 0.00011283873783995808, 'batch_size': 2750, 'optimizer': 'Adam'}.
2026-05-23 23:57:50,095 - experiment_functions - INFO - Early stopping at epoch 800. Best Metrics: (0.01968221531388526, 0.01501655629139073, 0.02021048596421218)
2026-05-23 23:57:50,665 - optuna.study.study - INFO - Trial 1 finished with values: [0.01968221531388526, 0.01501655629139073, 0.02021048596421218] and parameters: {'n_layers': 3, 'embedding_dim': 128, 'lr': 0.0007988736084506005, 'lambda_val': 7.458121457299012e-06, 'batch_size': 1959, 'optimizer': 'Adam'}.
2026-05-23 23:57:59,752 - experiment_functions - INFO - Early stopping at epoch 800. Best Metrics: (0.017389878743626883, 0.014362582781456953, 0.0184063580398919)
2026-05-23 23:57:59,852 - optuna.study.study - INFO - Trial 2 finished with values: [0.017389878743626883, 0.014362582781456953, 0.0184063580398919] and parameters: {'n_layers': 3, 'embedding_dim': 64, 'lr': 0.0006541077805531833, 'lambda_val': 0.04529231618764749, 'batch_size': 3488, 'optimizer': 'Adam'}.
2026-05-23 23:58:13,262 - experiment_functions - INFO - Early stopping at epoch 1150. Best Metrics: (0.0156306723291512, 0.012450331125827815, 0.01635982331213564)
2026-05-23 23:58:13,334 - optuna.study.study - INFO - Trial 3 finished with values: [0.0156306723291512, 0.012450331125827815, 0.01635982331213564] and parameters: {'n_layers': 2, 'embedding_dim': 128, 'lr': 0.0005555935556782479, 'lambda_val': 0.012312281188503879, 'batch_size': 947, 'optimizer': 'Adam'}.
2026-05-23 23:58:53,784 - optuna.study.study - INFO - Trial 4 finished with values: [0.006914778105460731, 0.005198675496688741, 0.007006091153902931] and parameters: {'n_layers': 2, 'embedding_dim': 128, 'lr': 4.010854274531064e-05, 'lambda_val': 1.3783652164336386e-06, 'batch_size': 593, 'optimizer': 'RMSprop'}.
2026-05-23 23:58:59,829 - experiment_functions - INFO - Early stopping at epoch 500. Best Metrics: (0.005197202398977607, 0.004072847682119206, 0.00514770116524811)
2026-05-23 23:59:00,504 - optuna.study.study - INFO - Trial 5 finished with values: [0.005197202398977607, 0.004072847682119206, 0.00514770116524811] and parameters: {'n_layers': 3, 'embedding_dim': 128, 'lr': 0.0009775039908005618, 'lambda_val': 0.06291277360396225, 'batch_size': 2754, 'optimizer': 'SGD'}.
2026-05-23 23:59:07,106 - experiment_functions - INFO - Early stopping at epoch 550. Best Metrics: (0.01758144692593216, 0.012938741721854306, 0.017824531232550737)
2026-05-23 23:59:07,686 - optuna.study.study - INFO - Trial 6 finished with values: [0.01758144692593216, 0.012938741721854306, 0.017824531232550737] and parameters: {'n_layers': 1, 'embedding_dim': 64, 'lr': 0.0034624350757776097, 'lambda_val': 0.001970520642014681, 'batch_size': 1368, 'optimizer': 'RMSprop'}.
2026-05-23 23:59:13,893 - experiment_functions - INFO - Early stopping at epoch 500. Best Metrics: (0.005272384361317771, 0.004271523178807948, 0.005845585460449915)
2026-05-23 23:59:15,050 - optuna.study.study - INFO - Trial 7 finished with values: [0.005272384361317771, 0.004271523178807948, 0.005845585460449915] and parameters: {'n_layers': 3, 'embedding_dim': 256, 'lr': 0.00026443071767053033, 'lambda_val': 0.008137939881123964, 'batch_size': 703, 'optimizer': 'SGD'}.
2026-05-23 23:59:54,767 - optuna.study.study - INFO - Trial 8 finished with values: [0.006900484472061258, 0.005306291390728478, 0.006889865943891643] and parameters: {'n_layers': 2, 'embedding_dim': 128, 'lr': 2.662936711429196e-05, 'lambda_val': 1.0589541331279516e-06, 'batch_size': 3620, 'optimizer': 'RMSprop'}.
2026-05-24 00:00:34,412 - optuna.study.study - INFO - Trial 9 finished with values: [0.005387679116488678, 0.004660596026490067, 0.005790437453649385] and parameters: {'n_layers': 4, 'embedding_dim': 32, 'lr': 1.19039636399611e-05, 'lambda_val': 1.802318843482217e-05, 'batch_size': 813, 'optimizer': 'Adam'}.
2026-05-24 00:00:41,504 - experiment_functions - INFO - Early stopping at epoch 600. Best Metrics: (0.017662942290158058, 0.013327814569536424, 0.018075873743385353)
2026-05-24 00:00:41,576 - optuna.study.study - INFO - Trial 10 finished with values: [0.017662942290158058, 0.013327814569536424, 0.018075873743385353] and parameters: {'n_layers': 2, 'embedding_dim': 64, 'lr': 0.004151503242019667, 'lambda_val': 2.356034595653627e-06, 'batch_size': 2524, 'optimizer': 'Adam'}.
2026-05-24 00:01:20,270 - optuna.study.study - INFO - Trial 11 finished with values: [0.009908041461498226, 0.0071357615894039736, 0.010138251644537407] and parameters: {'n_layers': 1, 'embedding_dim': 128, 'lr': 8.44616289055697e-05, 'lambda_val': 0.00017589142357207576, 'batch_size': 1145, 'optimizer': 'Adam'}.
2026-05-24 00:01:29,023 - experiment_functions - INFO - Early stopping at epoch 800. Best Metrics: (0.005587109842561795, 0.00423841059602649, 0.005421924864204887)
2026-05-24 00:01:29,115 - optuna.study.study - INFO - Trial 12 finished with values: [0.005587109842561795, 0.00423841059602649, 0.005421924864204887] and parameters: {'n_layers': 3, 'embedding_dim': 64, 'lr': 0.07412567685347399, 'lambda_val': 1.3919997497375137e-05, 'batch_size': 3402, 'optimizer': 'SGD'}.
2026-05-24 00:01:36,229 - experiment_functions - INFO - Early stopping at epoch 500. Best Metrics: (0.007844918658587666, 0.005687086092715232, 0.0072211913765582395)
2026-05-24 00:01:36,502 - optuna.study.study - INFO - Trial 13 finished with values: [0.007844918658587666, 0.005687086092715232, 0.0072211913765582395] and parameters: {'n_layers': 4, 'embedding_dim': 256, 'lr': 0.05221129706172038, 'lambda_val': 0.02448589859937424, 'batch_size': 3798, 'optimizer': 'RMSprop'}.
2026-05-24 00:01:42,269 - experiment_functions - INFO - Early stopping at epoch 500. Best Metrics: (0.005010293590083546, 0.003923841059602649, 0.005090077279380892)
2026-05-24 00:01:42,662 - optuna.study.study - INFO - Trial 14 finished with values: [0.005010293590083546, 0.003923841059602649, 0.005090077279380892] and parameters: {'n_layers': 3, 'embedding_dim': 32, 'lr': 4.9794485788159866e-05, 'lambda_val': 2.3206621538792565e-05, 'batch_size': 2346, 'optimizer': 'SGD'}.
2026-05-24 00:01:49,710 - experiment_functions - INFO - Early stopping at epoch 650. Best Metrics: (0.010159367635960826, 0.007640728476821192, 0.00999816167654162)
2026-05-24 00:01:49,798 - optuna.study.study - INFO - Trial 15 finished with values: [0.010159367635960826, 0.007640728476821192, 0.00999816167654162] and parameters: {'n_layers': 1, 'embedding_dim': 96, 'lr': 0.0008129182482291749, 'lambda_val': 0.06649097652898797, 'batch_size': 3873, 'optimizer': 'RMSprop'}.
2026-05-24 00:01:55,737 - experiment_functions - INFO - Early stopping at epoch 500. Best Metrics: (0.005568163536571676, 0.004288079470198676, 0.005499176286688422)
2026-05-24 00:01:56,615 - optuna.study.study - INFO - Trial 16 finished with values: [0.005568163536571676, 0.004288079470198676, 0.005499176286688422] and parameters: {'n_layers': 2, 'embedding_dim': 96, 'lr': 8.01813375355317e-05, 'lambda_val': 3.8083999245059577e-06, 'batch_size': 2610, 'optimizer': 'SGD'}.
2026-05-24 00:02:12,970 - experiment_functions - INFO - Early stopping at epoch 1650. Best Metrics: (0.005133800162599602, 0.0040562913907284765, 0.005346921906930624)
2026-05-24 00:02:13,623 - optuna.study.study - INFO - Trial 17 finished with values: [0.005133800162599602, 0.0040562913907284765, 0.005346921906930624] and parameters: {'n_layers': 1, 'embedding_dim': 32, 'lr': 0.009933626734169506, 'lambda_val': 3.480874613059374e-06, 'batch_size': 2828, 'optimizer': 'SGD'}.
2026-05-24 00:02:20,415 - experiment_functions - INFO - Early stopping at epoch 550. Best Metrics: (0.009215530696475197, 0.007963576158940399, 0.009911427160231277)
2026-05-24 00:02:20,564 - optuna.study.study - INFO - Trial 18 finished with values: [0.009215530696475197, 0.007963576158940399, 0.009911427160231277] and parameters: {'n_layers': 3, 'embedding_dim': 64, 'lr': 0.09356004011031696, 'lambda_val': 4.9891487854019234e-05, 'batch_size': 3791, 'optimizer': 'Adam'}.
2026-05-24 00:02:29,569 - experiment_functions - INFO - Early stopping at epoch 500. Best Metrics: (0.00577853687053095, 0.004602649006622517, 0.005984320290364589)
