2026-05-24 10:02:19,787 - optuna.study.study - INFO - Trial 91 finished with values: [0.004547280480049097, 0.003973509933774834, 0.004843693713573206] and parameters: {'n_layers': 2, 'embedding_dim': 96, 'lr': 0.002181901065505303, 'lambda_val': 0.00018068191341241282, 'batch_size': 1579, 'optimizer': 'SGD'}.
2026-05-24 10:02:27,016 - experiment_functions - INFO - Early stopping at epoch 500. Best Metrics: (0.0049985236006345685, 0.0039817880794701995, 0.0051354403742065215)
2026-05-24 10:02:27,101 - optuna.study.study - INFO - Trial 92 finished with values: [0.0049985236006345685, 0.0039817880794701995, 0.0051354403742065215] and parameters: {'n_layers': 2, 'embedding_dim': 128, 'lr': 2.0414011816744765e-05, 'lambda_val': 0.004594615051756208, 'batch_size': 2844, 'optimizer': 'Adam'}.
2026-05-24 10:02:35,148 - experiment_functions - INFO - Early stopping at epoch 600. Best Metrics: (0.018047549770282976, 0.01399834437086093, 0.01818603395138201)
2026-05-24 10:02:35,245 - optuna.study.study - INFO - Trial 93 finished with values: [0.018047549770282976, 0.01399834437086093, 0.01818603395138201] and parameters: {'n_layers': 1, 'embedding_dim': 32, 'lr': 0.018571577973460266, 'lambda_val': 2.03783312901811e-06, 'batch_size': 3516, 'optimizer': 'RMSprop'}.
2026-05-24 10:03:21,119 - optuna.study.study - INFO - Trial 94 finished with values: [0.019928870647987852, 0.014552980132450332, 0.019381049449269962] and parameters: {'n_layers': 2, 'embedding_dim': 32, 'lr': 0.025074765444195745, 'lambda_val': 0.0009904374338936715, 'batch_size': 689, 'optimizer': 'RMSprop'}.
2026-05-24 10:03:34,131 - experiment_functions - INFO - Early stopping at epoch 800. Best Metrics: (0.02166327265626465, 0.012781456953642382, 0.01834031048045262)
2026-05-24 10:03:34,223 - optuna.study.study - INFO - Trial 95 finished with values: [0.02166327265626465, 0.012781456953642382, 0.01834031048045262] and parameters: {'n_layers': 3, 'embedding_dim': 256, 'lr': 0.024669538417958024, 'lambda_val': 2.03783312901811e-06, 'batch_size': 3139, 'optimizer': 'Adam'}.
2026-05-24 10:04:03,777 - experiment_functions - INFO - Early stopping at epoch 2450. Best Metrics: (0.021992395100561574, 0.01367549668874172, 0.019285110062899027)
2026-05-24 10:04:03,857 - optuna.study.study - INFO - Trial 96 finished with values: [0.021992395100561574, 0.01367549668874172, 0.019285110062899027] and parameters: {'n_layers': 3, 'embedding_dim': 64, 'lr': 0.020974389902177336, 'lambda_val': 0.00021172971583081288, 'batch_size': 716, 'optimizer': 'Adam'}.
2026-05-24 10:04:10,846 - experiment_functions - INFO - Early stopping at epoch 500. Best Metrics: (0.00559289568215985, 0.004246688741721854, 0.005125558251485618)
2026-05-24 10:04:10,978 - optuna.study.study - INFO - Trial 97 finished with values: [0.00559289568215985, 0.004246688741721854, 0.005125558251485618] and parameters: {'n_layers': 2, 'embedding_dim': 96, 'lr': 3.1218644041087305e-05, 'lambda_val': 1.0553612735799465e-05, 'batch_size': 2608, 'optimizer': 'SGD'}.
2026-05-24 10:04:19,918 - experiment_functions - INFO - Early stopping at epoch 500. Best Metrics: (0.004927686167607759, 0.004213576158940397, 0.005150031215417508)
2026-05-24 10:04:20,642 - optuna.study.study - INFO - Trial 98 finished with values: [0.004927686167607759, 0.004213576158940397, 0.005150031215417508] and parameters: {'n_layers': 4, 'embedding_dim': 256, 'lr': 0.00013975372040490994, 'lambda_val': 0.047722126000469066, 'batch_size': 2973, 'optimizer': 'SGD'}.
2026-05-24 10:04:27,597 - experiment_functions - INFO - Early stopping at epoch 500. Best Metrics: (0.004888698746997625, 0.004246688741721854, 0.0053451281895548815)
2026-05-24 10:04:28,419 - optuna.study.study - INFO - Trial 99 finished with values: [0.004888698746997625, 0.004246688741721854, 0.0053451281895548815] and parameters: {'n_layers': 3, 'embedding_dim': 32, 'lr': 0.000788831009251679, 'lambda_val': 6.9710499234218e-05, 'batch_size': 1999, 'optimizer': 'SGD'}.
2026-05-24 10:05:17,012 - optuna.study.study - INFO - Trial 100 finished with values: [0.02093881593190025, 0.013460264900662253, 0.018830407245210463] and parameters: {'n_layers': 4, 'embedding_dim': 32, 'lr': 0.010910037137016305, 'lambda_val': 0.0005149605398707555, 'batch_size': 2901, 'optimizer': 'RMSprop'}.
2026-05-24 10:05:24,808 - experiment_functions - INFO - Early stopping at epoch 550. Best Metrics: (0.04694083039155282, 0.02890728476821192, 0.042222347615485586)
2026-05-24 10:05:24,881 - optuna.study.study - INFO - Trial 101 finished with values: [0.04694083039155282, 0.02890728476821192, 0.042222347615485586] and parameters: {'n_layers': 1, 'embedding_dim': 128, 'lr': 0.005921142718785096, 'lambda_val': 1.6361223952928733e-05, 'batch_size': 1930, 'optimizer': 'Adam'}.
2026-05-24 10:05:32,701 - experiment_functions - INFO - Early stopping at epoch 550. Best Metrics: (0.01873904309708085, 0.015745033112582782, 0.019686384793302102)
2026-05-24 10:05:32,778 - optuna.study.study - INFO - Trial 102 finished with values: [0.01873904309708085, 0.015745033112582782, 0.019686384793302102] and parameters: {'n_layers': 4, 'embedding_dim': 32, 'lr': 0.00660067706198712, 'lambda_val': 0.00325865136231477, 'batch_size': 2257, 'optimizer': 'Adam'}.
2026-05-24 10:05:40,584 - experiment_functions - INFO - Early stopping at epoch 550. Best Metrics: (0.012537351145103823, 0.010413907284768213, 0.012826992067998876)
2026-05-24 10:05:40,652 - optuna.study.study - INFO - Trial 103 finished with values: [0.012537351145103823, 0.010413907284768213, 0.012826992067998876] and parameters: {'n_layers': 1, 'embedding_dim': 128, 'lr': 0.08346058292159722, 'lambda_val': 5.797866699774695e-06, 'batch_size': 3869, 'optimizer': 'Adam'}.
2026-05-24 10:05:48,063 - experiment_functions - INFO - Early stopping at epoch 550. Best Metrics: (0.03905032409819723, 0.027450331125827815, 0.03606067305833217)
2026-05-24 10:05:48,147 - optuna.study.study - INFO - Trial 104 finished with values: [0.03905032409819723, 0.027450331125827815, 0.03606067305833217] and parameters: {'n_layers': 1, 'embedding_dim': 64, 'lr': 0.0028931100527333827, 'lambda_val': 0.003154130669772898, 'batch_size': 2257, 'optimizer': 'RMSprop'}.
2026-05-24 10:06:12,404 - experiment_functions - INFO - Early stopping at epoch 1800. Best Metrics: (0.012017025622218428, 0.010248344370860928, 0.012483568920612668)
2026-05-24 10:06:13,006 - optuna.study.study - INFO - Trial 105 finished with values: [0.012017025622218428, 0.010248344370860928, 0.012483568920612668] and parameters: {'n_layers': 4, 'embedding_dim': 96, 'lr': 0.020974389902177336, 'lambda_val': 0.007220734716610771, 'batch_size': 3649, 'optimizer': 'Adam'}.
2026-05-24 10:06:20,043 - experiment_functions - INFO - Early stopping at epoch 500. Best Metrics: (0.004672348138372119, 0.004023178807947021, 0.005250538166933932)
2026-05-24 10:06:20,144 - optuna.study.study - INFO - Trial 106 finished with values: [0.004672348138372119, 0.004023178807947021, 0.005250538166933932] and parameters: {'n_layers': 2, 'embedding_dim': 96, 'lr': 0.012623755921898306, 'lambda_val': 0.0015545326916399916, 'batch_size': 3398, 'optimizer': 'SGD'}.
2026-05-24 10:06:33,281 - experiment_functions - INFO - Early stopping at epoch 800. Best Metrics: (0.019918941475716143, 0.012624172185430464, 0.018164507082353797)
2026-05-24 10:06:33,451 - optuna.study.study - INFO - Trial 107 finished with values: [0.019918941475716143, 0.012624172185430464, 0.018164507082353797] and parameters: {'n_layers': 3, 'embedding_dim': 256, 'lr': 0.024669538417958024, 'lambda_val': 2.03783312901811e-06, 'batch_size': 3386, 'optimizer': 'Adam'}.
2026-05-24 10:06:41,084 - experiment_functions - INFO - Early stopping at epoch 500. Best Metrics: (0.0049388617806114775, 0.003981788079470199, 0.005026576317919679)
2026-05-24 10:06:41,252 - optuna.study.study - INFO - Trial 108 finished with values: [0.0049388617806114775, 0.003981788079470199, 0.005026576317919679] and parameters: {'n_layers': 4, 'embedding_dim': 128, 'lr': 1.5258690613803712e-05, 'lambda_val': 0.00325865136231477, 'batch_size': 4057, 'optimizer': 'Adam'}.
2026-05-24 10:06:54,002 - experiment_functions - INFO - Early stopping at epoch 1050. Best Metrics: (0.0116664118014318, 0.012408940397350994, 0.013934398532857556)
2026-05-24 10:06:54,648 - optuna.study.study - INFO - Trial 109 finished with values: [0.0116664118014318, 0.012408940397350994, 0.013934398532857556] and parameters: {'n_layers': 2, 'embedding_dim': 96, 'lr': 0.004358483973342603, 'lambda_val': 0.06208789567241385, 'batch_size': 3398, 'optimizer': 'RMSprop'}.
2026-05-24 10:07:01,028 - experiment_functions - INFO - Early stopping at epoch 500. Best Metrics: (0.005195132891134045, 0.00408112582781457, 0.005342150438499545)
2026-05-24 10:07:01,940 - optuna.study.study - INFO - Trial 110 finished with values: [0.005195132891134045, 0.00408112582781457, 0.005342150438499545] and parameters: {'n_layers': 4, 'embedding_dim': 32, 'lr': 8.530575486069038e-05, 'lambda_val': 0.0004231980579073248, 'batch_size': 3462, 'optimizer': 'SGD'}.
2026-05-24 10:07:46,802 - optuna.study.study - INFO - Trial 111 finished with values: [0.03686084959786327, 0.024710264900662252, 0.03407091674625963] and parameters: {'n_layers': 3, 'embedding_dim': 32, 'lr': 0.0002008346621954922, 'lambda_val': 4.7374488373095054e-05, 'batch_size': 2742, 'optimizer': 'RMSprop'}.
2026-05-24 10:07:54,232 - experiment_functions - INFO - Early stopping at epoch 600. Best Metrics: (0.02934508922491165, 0.021663907284768216, 0.02845640116657095)
2026-05-24 10:07:54,349 - optuna.study.study - INFO - Trial 112 finished with values: [0.02934508922491165, 0.021663907284768216, 0.02845640116657095] and parameters: {'n_layers': 2, 'embedding_dim': 32, 'lr': 0.0011985229591796502, 'lambda_val': 0.08238400869901934, 'batch_size': 2742, 'optimizer': 'RMSprop'}.
2026-05-24 10:08:03,576 - experiment_functions - INFO - Early stopping at epoch 550. Best Metrics: (0.014365637887812931, 0.013344370860927152, 0.016268401713099078)
2026-05-24 10:08:03,679 - optuna.study.study - INFO - Trial 113 finished with values: [0.014365637887812931, 0.013344370860927152, 0.016268401713099078] and parameters: {'n_layers': 3, 'embedding_dim': 256, 'lr': 0.0013978493934357974, 'lambda_val': 4.452603967565531e-05, 'batch_size': 2901, 'optimizer': 'RMSprop'}.
2026-05-24 10:08:12,678 - experiment_functions - INFO - Early stopping at epoch 700. Best Metrics: (0.017315866581986118, 0.011026490066225168, 0.015081009462394412)
2026-05-24 10:08:13,101 - optuna.study.study - INFO - Trial 114 finished with values: [0.017315866581986118, 0.011026490066225168, 0.015081009462394412] and parameters: {'n_layers': 3, 'embedding_dim': 64, 'lr': 0.03965113881953134, 'lambda_val': 5.679943203718692e-06, 'batch_size': 3125, 'optimizer': 'Adam'}.
2026-05-24 10:09:01,328 - experiment_functions - INFO - Early stopping at epoch 3700. Best Metrics: (0.028612582026579337, 0.018783112582781456, 0.02654117510076306)
2026-05-24 10:09:01,440 - optuna.study.study - INFO - Trial 115 finished with values: [0.028612582026579337, 0.018783112582781456, 0.02654117510076306] and parameters: {'n_layers': 2, 'embedding_dim': 256, 'lr': 0.012623755921898306, 'lambda_val': 0.0015545326916399916, 'batch_size': 1797, 'optimizer': 'RMSprop'}.
2026-05-24 10:09:08,504 - experiment_functions - INFO - Early stopping at epoch 550. Best Metrics: (0.017764108357682253, 0.01423841059602649, 0.016750354956310075)
2026-05-24 10:09:09,004 - optuna.study.study - INFO - Trial 116 finished with values: [0.017764108357682253, 0.01423841059602649, 0.016750354956310075] and parameters: {'n_layers': 3, 'embedding_dim': 32, 'lr': 0.003043283191241845, 'lambda_val': 0.0005149605398707555, 'batch_size': 1064, 'optimizer': 'RMSprop'}.
2026-05-24 10:09:18,044 - experiment_functions - INFO - Early stopping at epoch 600. Best Metrics: (0.01859595732248559, 0.013774834437086093, 0.017986831588369324)
2026-05-24 10:09:18,497 - optuna.study.study - INFO - Trial 117 finished with values: [0.01859595732248559, 0.013774834437086093, 0.017986831588369324] and parameters: {'n_layers': 2, 'embedding_dim': 256, 'lr': 0.018571577973460266, 'lambda_val': 3.3065039662607355e-05, 'batch_size': 2546, 'optimizer': 'RMSprop'}.
2026-05-24 10:09:28,031 - experiment_functions - INFO - Early stopping at epoch 650. Best Metrics: (0.04805613838951057, 0.031208609271523177, 0.04416480880019364)
2026-05-24 10:09:28,161 - optuna.study.study - INFO - Trial 118 finished with values: [0.04805613838951057, 0.031208609271523177, 0.04416480880019364] and parameters: {'n_layers': 2, 'embedding_dim': 256, 'lr': 0.0013978493934357974, 'lambda_val': 5.797866699774695e-06, 'batch_size': 1780, 'optimizer': 'Adam'}.
2026-05-24 10:09:36,512 - experiment_functions - INFO - Early stopping at epoch 550. Best Metrics: (0.007262522168383078, 0.007541390728476821, 0.008612879129467798)
2026-05-24 10:09:36,614 - optuna.study.study - INFO - Trial 119 finished with values: [0.007262522168383078, 0.007541390728476821, 0.008612879129467798] and parameters: {'n_layers': 4, 'embedding_dim': 128, 'lr': 0.0028931100527333827, 'lambda_val': 0.00325865136231477, 'batch_size': 1556, 'optimizer': 'RMSprop'}.
2026-05-24 10:09:52,720 - experiment_functions - INFO - Early stopping at epoch 1100. Best Metrics: (0.028276635534561004, 0.017061258278145697, 0.024405213527128617)
2026-05-24 10:09:53,516 - optuna.study.study - INFO - Trial 120 finished with values: [0.028276635534561004, 0.017061258278145697, 0.024405213527128617] and parameters: {'n_layers': 2, 'embedding_dim': 256, 'lr': 0.011699032315035515, 'lambda_val': 1.6361223952928733e-05, 'batch_size': 1930, 'optimizer': 'Adam'}.
2026-05-24 10:10:39,200 - optuna.study.study - INFO - Trial 121 finished with values: [0.0064343530318723315, 0.005198675496688742, 0.00647918366298408] and parameters: {'n_layers': 4, 'embedding_dim': 32, 'lr': 2.6783401540841377e-05, 'lambda_val': 5.198475548557465e-05, 'batch_size': 3366, 'optimizer': 'Adam'}.
2026-05-24 10:10:47,350 - experiment_functions - INFO - Early stopping at epoch 550. Best Metrics: (0.017841842438468505, 0.014652317880794703, 0.01904146529596196)
2026-05-24 10:10:47,454 - optuna.study.study - INFO - Trial 122 finished with values: [0.017841842438468505, 0.014652317880794703, 0.01904146529596196] and parameters: {'n_layers': 3, 'embedding_dim': 128, 'lr': 0.001667262481946792, 'lambda_val': 0.00038449950728469576, 'batch_size': 689, 'optimizer': 'RMSprop'}.
2026-05-24 10:10:57,658 - experiment_functions - INFO - Early stopping at epoch 600. Best Metrics: (0.03630691557046871, 0.024544701986754968, 0.03391121873323582)
2026-05-24 10:10:57,887 - optuna.study.study - INFO - Trial 123 finished with values: [0.03630691557046871, 0.024544701986754968, 0.03391121873323582] and parameters: {'n_layers': 3, 'embedding_dim': 256, 'lr': 0.0013978493934357974, 'lambda_val': 1.9563512568026275e-06, 'batch_size': 2901, 'optimizer': 'Adam'}.
2026-05-24 10:11:05,633 - experiment_functions - INFO - Early stopping at epoch 550. Best Metrics: (0.032697292993978576, 0.023526490066225165, 0.03026632803783434)
2026-05-24 10:11:05,752 - optuna.study.study - INFO - Trial 124 finished with values: [0.032697292993978576, 0.023526490066225165, 0.03026632803783434] and parameters: {'n_layers': 1, 'embedding_dim': 96, 'lr': 0.0028931100527333827, 'lambda_val': 2.9784999212921082e-05, 'batch_size': 3771, 'optimizer': 'RMSprop'}.
2026-05-24 10:11:21,707 - experiment_functions - INFO - Early stopping at epoch 900. Best Metrics: (0.028783566124215686, 0.015852649006622515, 0.02353463237698931)
2026-05-24 10:11:22,459 - optuna.study.study - INFO - Trial 125 finished with values: [0.028783566124215686, 0.015852649006622515, 0.02353463237698931] and parameters: {'n_layers': 4, 'embedding_dim': 256, 'lr': 0.011566182279413873, 'lambda_val': 6.700238629685478e-06, 'batch_size': 3125, 'optimizer': 'RMSprop'}.
2026-05-24 10:11:30,116 - experiment_functions - INFO - Early stopping at epoch 550. Best Metrics: (0.034187008007180525, 0.023683774834437087, 0.030772065639849036)
2026-05-24 10:11:30,232 - optuna.study.study - INFO - Trial 126 finished with values: [0.034187008007180525, 0.023683774834437087, 0.030772065639849036] and parameters: {'n_layers': 3, 'embedding_dim': 64, 'lr': 0.00660067706198712, 'lambda_val': 0.00021172971583081288, 'batch_size': 716, 'optimizer': 'Adam'}.
2026-05-24 10:12:24,281 - optuna.study.study - INFO - Trial 127 finished with values: [0.023575960231213004, 0.0136341059602649, 0.019763865468989752] and parameters: {'n_layers': 4, 'embedding_dim': 128, 'lr': 0.004153944723024046, 'lambda_val': 7.340959421189842e-06, 'batch_size': 3366, 'optimizer': 'RMSprop'}.
2026-05-24 10:12:34,447 - experiment_functions - INFO - Early stopping at epoch 700. Best Metrics: (0.052990579951055536, 0.033170529801324504, 0.047151458252215624)
2026-05-24 10:12:34,568 - optuna.study.study - INFO - Trial 128 finished with values: [0.052990579951055536, 0.033170529801324504, 0.047151458252215624] and parameters: {'n_layers': 1, 'embedding_dim': 256, 'lr': 0.0013978493934357974, 'lambda_val': 4.452603967565531e-05, 'batch_size': 2844, 'optimizer': 'Adam'}.
2026-05-24 10:12:41,920 - experiment_functions - INFO - Early stopping at epoch 550. Best Metrics: (0.02371122637778865, 0.017955298013245035, 0.022344258169243444)
2026-05-24 10:12:42,026 - optuna.study.study - INFO - Trial 129 finished with values: [0.02371122637778865, 0.017955298013245035, 0.022344258169243444] and parameters: {'n_layers': 3, 'embedding_dim': 32, 'lr': 0.001667262481946792, 'lambda_val': 0.007220734716610771, 'batch_size': 2608, 'optimizer': 'RMSprop'}.
2026-05-24 10:12:50,961 - experiment_functions - INFO - Early stopping at epoch 650. Best Metrics: (0.060650561899404126, 0.036208609271523175, 0.05228494889785733)
2026-05-24 10:12:51,034 - optuna.study.study - INFO - Trial 130 finished with values: [0.060650561899404126, 0.036208609271523175, 0.05228494889785733] and parameters: {'n_layers': 1, 'embedding_dim': 96, 'lr': 0.002746129425384238, 'lambda_val': 2.5452815323641335e-06, 'batch_size': 1431, 'optimizer': 'Adam'}.
2026-05-24 10:12:58,397 - experiment_functions - INFO - Early stopping at epoch 550. Best Metrics: (0.05090391929686706, 0.031018211920529806, 0.046269443102512374)
2026-05-24 10:12:58,477 - optuna.study.study - INFO - Trial 131 finished with values: [0.05090391929686706, 0.031018211920529806, 0.046269443102512374] and parameters: {'n_layers': 1, 'embedding_dim': 32, 'lr': 0.01014667246794401, 'lambda_val': 5.797866699774695e-06, 'batch_size': 1467, 'optimizer': 'Adam'}.
2026-05-24 10:13:06,426 - experiment_functions - INFO - Early stopping at epoch 600. Best Metrics: (0.0504951997796272, 0.031589403973509934, 0.04427482394567952)
2026-05-24 10:13:06,582 - optuna.study.study - INFO - Trial 132 finished with values: [0.0504951997796272, 0.031589403973509934, 0.04427482394567952] and parameters: {'n_layers': 1, 'embedding_dim': 64, 'lr': 0.005921142718785096, 'lambda_val': 2.791930910853256e-06, 'batch_size': 1930, 'optimizer': 'Adam'}.
2026-05-24 10:13:51,438 - optuna.study.study - INFO - Trial 133 finished with values: [0.025507254531733855, 0.017557947019867553, 0.023817386848794676] and parameters: {'n_layers': 3, 'embedding_dim': 32, 'lr': 0.0001091174252436759, 'lambda_val': 0.002002127423623449, 'batch_size': 3771, 'optimizer': 'RMSprop'}.
2026-05-24 10:14:07,646 - experiment_functions - INFO - Early stopping at epoch 1450. Best Metrics: (0.021648442061794015, 0.01634105960264901, 0.021862064954076485)
2026-05-24 10:14:08,358 - optuna.study.study - INFO - Trial 134 finished with values: [0.021648442061794015, 0.01634105960264901, 0.021862064954076485] and parameters: {'n_layers': 1, 'embedding_dim': 64, 'lr': 0.010910037137016305, 'lambda_val': 0.0005149605398707555, 'batch_size': 1064, 'optimizer': 'RMSprop'}.
2026-05-24 10:14:39,814 - experiment_functions - INFO - Early stopping at epoch 2700. Best Metrics: (0.023401623821088128, 0.017582781456953644, 0.02264232703265535)
2026-05-24 10:14:40,312 - optuna.study.study - INFO - Trial 135 finished with values: [0.023401623821088128, 0.017582781456953644, 0.02264232703265535] and parameters: {'n_layers': 2, 'embedding_dim': 64, 'lr': 0.020974389902177336, 'lambda_val': 0.007220734716610771, 'batch_size': 1780, 'optimizer': 'Adam'}.
2026-05-24 10:14:48,170 - experiment_functions - INFO - Early stopping at epoch 550. Best Metrics: (0.04158784330298352, 0.026150662251655632, 0.03804809964940597)
2026-05-24 10:14:48,295 - optuna.study.study - INFO - Trial 136 finished with values: [0.04158784330298352, 0.026150662251655632, 0.03804809964940597] and parameters: {'n_layers': 3, 'embedding_dim': 96, 'lr': 0.004028743321822881, 'lambda_val': 1.9563512568026275e-06, 'batch_size': 2844, 'optimizer': 'Adam'}.
2026-05-24 10:14:56,206 - experiment_functions - INFO - Early stopping at epoch 550. Best Metrics: (0.029404448663573366, 0.02170529801324504, 0.02832509720862304)
2026-05-24 10:14:56,362 - optuna.study.study - INFO - Trial 137 finished with values: [0.029404448663573366, 0.02170529801324504, 0.02832509720862304] and parameters: {'n_layers': 3, 'embedding_dim': 64, 'lr': 0.003043283191241845, 'lambda_val': 0.02634963524283978, 'batch_size': 3125, 'optimizer': 'Adam'}.
2026-05-24 10:15:16,389 - experiment_functions - INFO - Early stopping at epoch 1450. Best Metrics: (0.038521634877965345, 0.025819536423841057, 0.03735542469078464)
2026-05-24 10:15:16,851 - optuna.study.study - INFO - Trial 138 finished with values: [0.038521634877965345, 0.025819536423841057, 0.03735542469078464] and parameters: {'n_layers': 4, 'embedding_dim': 96, 'lr': 0.0002008346621954922, 'lambda_val': 5.198475548557465e-05, 'batch_size': 1829, 'optimizer': 'RMSprop'}.
2026-05-24 10:15:25,827 - experiment_functions - INFO - Early stopping at epoch 650. Best Metrics: (0.05163133721008149, 0.031241721854304634, 0.04638609180608867)
