2026-05-24 09:23:46,930 - optuna.study.study - INFO - Trial 252 finished with values: [0.06103167189912615, 0.03683774834437086, 0.054439450082823616] and parameters: {'n_layers': 1, 'embedding_dim': 96, 'lr': 0.0006251382018314868, 'lambda_val': 0.000621169344675621, 'batch_size': 1133, 'optimizer': 'RMSprop'}.
2026-05-24 09:23:59,262 - experiment_functions - INFO - Early stopping at epoch 1050. Best Metrics: (0.05616005688244468, 0.03439569536423841, 0.049867423957840364)
2026-05-24 09:23:59,402 - optuna.study.study - INFO - Trial 253 finished with values: [0.05616005688244468, 0.03439569536423841, 0.049867423957840364] and parameters: {'n_layers': 1, 'embedding_dim': 128, 'lr': 0.0005611343469820637, 'lambda_val': 0.000621169344675621, 'batch_size': 2675, 'optimizer': 'RMSprop'}.
2026-05-24 09:24:07,979 - experiment_functions - INFO - Early stopping at epoch 700. Best Metrics: (0.060534953704439134, 0.03626655629139073, 0.05224174550406532)
2026-05-24 09:24:08,085 - optuna.study.study - INFO - Trial 254 finished with values: [0.060534953704439134, 0.03626655629139073, 0.05224174550406532] and parameters: {'n_layers': 1, 'embedding_dim': 128, 'lr': 0.0015435244296002795, 'lambda_val': 4.601372605867572e-05, 'batch_size': 2915, 'optimizer': 'Adam'}.
2026-05-24 09:24:15,775 - experiment_functions - INFO - Early stopping at epoch 650. Best Metrics: (0.030970818376743977, 0.023369205298013247, 0.028806544026991347)
2026-05-24 09:24:15,881 - optuna.study.study - INFO - Trial 255 finished with values: [0.030970818376743977, 0.023369205298013247, 0.028806544026991347] and parameters: {'n_layers': 1, 'embedding_dim': 128, 'lr': 0.0015435244296002795, 'lambda_val': 0.05039155240751989, 'batch_size': 626, 'optimizer': 'RMSprop'}.
2026-05-24 09:25:02,568 - optuna.study.study - INFO - Trial 256 finished with values: [0.04288568687136355, 0.028112582781456955, 0.040001028364464175] and parameters: {'n_layers': 1, 'embedding_dim': 128, 'lr': 0.0003755353524054084, 'lambda_val': 0.0011722082940115572, 'batch_size': 634, 'optimizer': 'Adam'}.
2026-05-24 09:25:12,171 - experiment_functions - INFO - Early stopping at epoch 700. Best Metrics: (0.05447257303339658, 0.033269867549668874, 0.048219331488975926)
2026-05-24 09:25:12,595 - optuna.study.study - INFO - Trial 257 finished with values: [0.05447257303339658, 0.033269867549668874, 0.048219331488975926] and parameters: {'n_layers': 1, 'embedding_dim': 128, 'lr': 0.0015435244296002795, 'lambda_val': 4.601372605867572e-05, 'batch_size': 1091, 'optimizer': 'RMSprop'}.
2026-05-24 09:25:24,609 - experiment_functions - INFO - Early stopping at epoch 950. Best Metrics: (0.052471503132325896, 0.03413907284768212, 0.04671400285498078)
2026-05-24 09:25:24,863 - optuna.study.study - INFO - Trial 258 finished with values: [0.052471503132325896, 0.03413907284768212, 0.04671400285498078] and parameters: {'n_layers': 1, 'embedding_dim': 128, 'lr': 0.0006190490451202456, 'lambda_val': 0.0393518625138606, 'batch_size': 1133, 'optimizer': 'RMSprop'}.
2026-05-24 09:25:43,227 - experiment_functions - INFO - Early stopping at epoch 1550. Best Metrics: (0.008511349546012183, 0.007367549668874172, 0.009382127565603329)
2026-05-24 09:25:43,306 - optuna.study.study - INFO - Trial 259 finished with values: [0.008511349546012183, 0.007367549668874172, 0.009382127565603329] and parameters: {'n_layers': 1, 'embedding_dim': 128, 'lr': 0.08475427338099226, 'lambda_val': 1.0557153129697665e-05, 'batch_size': 3825, 'optimizer': 'RMSprop'}.
2026-05-24 09:25:51,364 - experiment_functions - INFO - Early stopping at epoch 600. Best Metrics: (0.05048629834047815, 0.031945364238410594, 0.04569888640373957)
2026-05-24 09:25:51,454 - optuna.study.study - INFO - Trial 260 finished with values: [0.05048629834047815, 0.031945364238410594, 0.04569888640373957] and parameters: {'n_layers': 1, 'embedding_dim': 64, 'lr': 0.0019498675283919575, 'lambda_val': 4.4597266784600284e-05, 'batch_size': 1091, 'optimizer': 'RMSprop'}.
2026-05-24 09:25:59,001 - experiment_functions - INFO - Early stopping at epoch 550. Best Metrics: (0.05267360146227544, 0.03321192052980133, 0.04858042526305633)
2026-05-24 09:25:59,091 - optuna.study.study - INFO - Trial 261 finished with values: [0.05267360146227544, 0.03321192052980133, 0.04858042526305633] and parameters: {'n_layers': 1, 'embedding_dim': 64, 'lr': 0.0019498675283919575, 'lambda_val': 0.000621169344675621, 'batch_size': 2226, 'optimizer': 'RMSprop'}.
2026-05-24 09:26:10,305 - experiment_functions - INFO - Early stopping at epoch 800. Best Metrics: (0.05240894186273058, 0.0325, 0.04583071499417275)
2026-05-24 09:26:10,579 - optuna.study.study - INFO - Trial 262 finished with values: [0.05240894186273058, 0.0325, 0.04583071499417275] and parameters: {'n_layers': 2, 'embedding_dim': 128, 'lr': 0.0005611343469820637, 'lambda_val': 0.0017812353290128234, 'batch_size': 1091, 'optimizer': 'RMSprop'}.
2026-05-24 09:26:33,469 - experiment_functions - INFO - Early stopping at epoch 1800. Best Metrics: (0.05410244088483195, 0.033592715231788084, 0.04812720610356496)
2026-05-24 09:26:33,564 - optuna.study.study - INFO - Trial 263 finished with values: [0.05410244088483195, 0.033592715231788084, 0.04812720610356496] and parameters: {'n_layers': 1, 'embedding_dim': 128, 'lr': 0.0003755353524054084, 'lambda_val': 0.0007561839367868583, 'batch_size': 3076, 'optimizer': 'Adam'}.
2026-05-24 09:26:43,382 - experiment_functions - INFO - Early stopping at epoch 700. Best Metrics: (0.03621580729039193, 0.02497516556291391, 0.03323413117369111)
2026-05-24 09:26:43,565 - optuna.study.study - INFO - Trial 264 finished with values: [0.03621580729039193, 0.02497516556291391, 0.03323413117369111] and parameters: {'n_layers': 3, 'embedding_dim': 128, 'lr': 0.0006251382018314868, 'lambda_val': 0.00800073098738819, 'batch_size': 2187, 'optimizer': 'Adam'}.
2026-05-24 09:26:55,480 - experiment_functions - INFO - Early stopping at epoch 900. Best Metrics: (0.05458944972464518, 0.033675496688741716, 0.04859817943757208)
2026-05-24 09:26:55,558 - optuna.study.study - INFO - Trial 265 finished with values: [0.05458944972464518, 0.033675496688741716, 0.04859817943757208] and parameters: {'n_layers': 1, 'embedding_dim': 128, 'lr': 0.0006251382018314868, 'lambda_val': 0.000621169344675621, 'batch_size': 3076, 'optimizer': 'RMSprop'}.
2026-05-24 09:27:15,556 - experiment_functions - INFO - Early stopping at epoch 1600. Best Metrics: (0.05574796936072834, 0.03413079470198675, 0.04957283731511536)
2026-05-24 09:27:15,676 - optuna.study.study - INFO - Trial 266 finished with values: [0.05574796936072834, 0.03413079470198675, 0.04957283731511536] and parameters: {'n_layers': 1, 'embedding_dim': 128, 'lr': 0.0003755353524054084, 'lambda_val': 7.605238793496514e-05, 'batch_size': 3076, 'optimizer': 'RMSprop'}.
2026-05-24 09:28:00,525 - experiment_functions - INFO - Early stopping at epoch 3800. Best Metrics: (0.06501013154229288, 0.038360927152317884, 0.056494018130405325)
2026-05-24 09:28:01,002 - optuna.study.study - INFO - Trial 267 finished with values: [0.06501013154229288, 0.038360927152317884, 0.056494018130405325] and parameters: {'n_layers': 1, 'embedding_dim': 64, 'lr': 0.0003755353524054084, 'lambda_val': 0.00800073098738819, 'batch_size': 1634, 'optimizer': 'Adam'}.
2026-05-24 09:28:25,743 - experiment_functions - INFO - Early stopping at epoch 2000. Best Metrics: (0.06720280197440259, 0.03861754966887418, 0.05782378985005503)
2026-05-24 09:28:25,841 - optuna.study.study - INFO - Trial 268 finished with values: [0.06720280197440259, 0.03861754966887418, 0.05782378985005503] and parameters: {'n_layers': 1, 'embedding_dim': 128, 'lr': 0.0005611343469820637, 'lambda_val': 0.0017812353290128234, 'batch_size': 768, 'optimizer': 'RMSprop'}.
2026-05-24 09:29:11,544 - experiment_functions - INFO - Early stopping at epoch 3750. Best Metrics: (0.06534863895152218, 0.038509933774834436, 0.05654750866288052)
2026-05-24 09:29:12,323 - optuna.study.study - INFO - Trial 269 finished with values: [0.06534863895152218, 0.038509933774834436, 0.05654750866288052] and parameters: {'n_layers': 1, 'embedding_dim': 128, 'lr': 0.0003755353524054084, 'lambda_val': 0.0007561839367868583, 'batch_size': 1322, 'optimizer': 'RMSprop'}.
2026-05-24 09:29:21,701 - experiment_functions - INFO - Early stopping at epoch 700. Best Metrics: (0.027119104960967134, 0.018874172185430464, 0.025476881010652926)
2026-05-24 09:29:22,596 - optuna.study.study - INFO - Trial 270 finished with values: [0.027119104960967134, 0.018874172185430464, 0.025476881010652926] and parameters: {'n_layers': 1, 'embedding_dim': 128, 'lr': 0.008682470193684455, 'lambda_val': 8.523357255734578e-06, 'batch_size': 3076, 'optimizer': 'RMSprop'}.
2026-05-24 09:30:09,801 - optuna.study.study - INFO - Trial 271 finished with values: [0.0589960375141627, 0.03598509933774834, 0.05283655806846518] and parameters: {'n_layers': 1, 'embedding_dim': 32, 'lr': 0.0003755353524054084, 'lambda_val': 0.0006281528311151107, 'batch_size': 2187, 'optimizer': 'RMSprop'}.
2026-05-24 09:30:19,165 - experiment_functions - INFO - Early stopping at epoch 700. Best Metrics: (0.0551747183030882, 0.033543046357615895, 0.0490564381594533)
2026-05-24 09:30:20,523 - optuna.study.study - INFO - Trial 272 finished with values: [0.0551747183030882, 0.033543046357615895, 0.0490564381594533] and parameters: {'n_layers': 1, 'embedding_dim': 128, 'lr': 0.0019498675283919575, 'lambda_val': 1.3488339828806709e-06, 'batch_size': 2187, 'optimizer': 'Adam'}.
2026-05-24 09:30:39,324 - experiment_functions - INFO - Early stopping at epoch 1400. Best Metrics: (0.05701745580849534, 0.03507450331125828, 0.050533111096173165)
2026-05-24 09:30:39,425 - optuna.study.study - INFO - Trial 273 finished with values: [0.05701745580849534, 0.03507450331125828, 0.050533111096173165] and parameters: {'n_layers': 1, 'embedding_dim': 256, 'lr': 0.0003755353524054084, 'lambda_val': 0.00800073098738819, 'batch_size': 2675, 'optimizer': 'Adam'}.
2026-05-24 09:31:02,436 - experiment_functions - INFO - Early stopping at epoch 1850. Best Metrics: (0.05880315751139981, 0.03616721854304636, 0.05170780545087764)
2026-05-24 09:31:02,528 - optuna.study.study - INFO - Trial 274 finished with values: [0.05880315751139981, 0.03616721854304636, 0.05170780545087764] and parameters: {'n_layers': 1, 'embedding_dim': 128, 'lr': 0.0003755353524054084, 'lambda_val': 0.0011722082940115572, 'batch_size': 2226, 'optimizer': 'RMSprop'}.
2026-05-24 09:31:10,110 - experiment_functions - INFO - Early stopping at epoch 550. Best Metrics: (0.05113946612499284, 0.03198675496688742, 0.04641355696193355)
2026-05-24 09:31:10,219 - optuna.study.study - INFO - Trial 275 finished with values: [0.05113946612499284, 0.03198675496688742, 0.04641355696193355] and parameters: {'n_layers': 1, 'embedding_dim': 128, 'lr': 0.0019498675283919575, 'lambda_val': 4.601372605867572e-05, 'batch_size': 3076, 'optimizer': 'RMSprop'}.
2026-05-24 09:31:35,781 - experiment_functions - INFO - Early stopping at epoch 2200. Best Metrics: (0.015306309500823843, 0.014519867549668877, 0.018131575014811052)
2026-05-24 09:31:35,875 - optuna.study.study - INFO - Trial 276 finished with values: [0.015306309500823843, 0.014519867549668877, 0.018131575014811052] and parameters: {'n_layers': 1, 'embedding_dim': 128, 'lr': 0.0075837037750766025, 'lambda_val': 0.03503167400097262, 'batch_size': 2226, 'optimizer': 'RMSprop'}.
2026-05-24 09:31:43,326 - experiment_functions - INFO - Early stopping at epoch 550. Best Metrics: (0.06334960680132307, 0.03764900662251656, 0.056020168500532846)
2026-05-24 09:31:43,413 - optuna.study.study - INFO - Trial 277 finished with values: [0.06334960680132307, 0.03764900662251656, 0.056020168500532846] and parameters: {'n_layers': 1, 'embedding_dim': 128, 'lr': 0.007030173721873326, 'lambda_val': 0.011423062620405277, 'batch_size': 2187, 'optimizer': 'Adam'}.
2026-05-24 09:32:01,278 - experiment_functions - INFO - Early stopping at epoch 1400. Best Metrics: (0.06136587174080176, 0.03668874172185431, 0.05388878932906851)
2026-05-24 09:32:01,370 - optuna.study.study - INFO - Trial 278 finished with values: [0.06136587174080176, 0.03668874172185431, 0.05388878932906851] and parameters: {'n_layers': 1, 'embedding_dim': 128, 'lr': 0.000767834461150942, 'lambda_val': 8.523357255734578e-06, 'batch_size': 634, 'optimizer': 'RMSprop'}.
2026-05-24 09:32:46,547 - optuna.study.study - INFO - Trial 279 finished with values: [0.02246252593413383, 0.015736754966887416, 0.022127385182202728] and parameters: {'n_layers': 1, 'embedding_dim': 128, 'lr': 0.00027037181334258007, 'lambda_val': 9.94682305058342e-05, 'batch_size': 634, 'optimizer': 'RMSprop'}.
2026-05-24 09:33:07,125 - experiment_functions - INFO - Early stopping at epoch 1650. Best Metrics: (0.05418260156021802, 0.03422185430463576, 0.04902546430904963)
2026-05-24 09:33:08,095 - optuna.study.study - INFO - Trial 280 finished with values: [0.05418260156021802, 0.03422185430463576, 0.04902546430904963] and parameters: {'n_layers': 1, 'embedding_dim': 128, 'lr': 0.0003755353524054084, 'lambda_val': 0.0017812353290128234, 'batch_size': 3032, 'optimizer': 'RMSprop'}.
2026-05-24 09:33:25,930 - experiment_functions - INFO - Early stopping at epoch 1400. Best Metrics: (0.053135115510441526, 0.03370860927152318, 0.0475204556021142)
2026-05-24 09:33:26,035 - optuna.study.study - INFO - Trial 281 finished with values: [0.053135115510441526, 0.03370860927152318, 0.0475204556021142] and parameters: {'n_layers': 1, 'embedding_dim': 128, 'lr': 0.0003755353524054084, 'lambda_val': 0.0011457679520731478, 'batch_size': 3583, 'optimizer': 'RMSprop'}.
2026-05-24 09:33:32,583 - experiment_functions - INFO - Early stopping at epoch 500. Best Metrics: (0.00506952446847143, 0.004188741721854305, 0.005204194785725184)
2026-05-24 09:33:32,681 - optuna.study.study - INFO - Trial 282 finished with values: [0.00506952446847143, 0.004188741721854305, 0.005204194785725184] and parameters: {'n_layers': 1, 'embedding_dim': 96, 'lr': 0.00027037181334258007, 'lambda_val': 0.09028422322159063, 'batch_size': 3825, 'optimizer': 'RMSprop'}.
2026-05-24 09:33:41,974 - experiment_functions - INFO - Early stopping at epoch 600. Best Metrics: (0.03327832084568008, 0.02245860927152318, 0.03001522280146881)
2026-05-24 09:33:42,684 - optuna.study.study - INFO - Trial 283 finished with values: [0.03327832084568008, 0.02245860927152318, 0.03001522280146881] and parameters: {'n_layers': 4, 'embedding_dim': 128, 'lr': 0.0006262044618288463, 'lambda_val': 0.000621169344675621, 'batch_size': 1133, 'optimizer': 'RMSprop'}.
2026-05-24 09:34:06,722 - experiment_functions - INFO - Early stopping at epoch 1950. Best Metrics: (0.05904154570392452, 0.03596854304635762, 0.0525726561906373)
2026-05-24 09:34:06,971 - optuna.study.study - INFO - Trial 284 finished with values: [0.05904154570392452, 0.03596854304635762, 0.0525726561906373] and parameters: {'n_layers': 1, 'embedding_dim': 128, 'lr': 0.0003755353524054084, 'lambda_val': 8.523357255734578e-06, 'batch_size': 2226, 'optimizer': 'RMSprop'}.
2026-05-24 09:34:53,662 - optuna.study.study - INFO - Trial 285 finished with values: [0.05334047626035724, 0.033286423841059606, 0.04861623264036264] and parameters: {'n_layers': 1, 'embedding_dim': 32, 'lr': 0.0003755353524054084, 'lambda_val': 0.0004077151861442529, 'batch_size': 2226, 'optimizer': 'RMSprop'}.
2026-05-24 09:35:14,031 - experiment_functions - INFO - Early stopping at epoch 1650. Best Metrics: (0.06725831654200863, 0.03836092715231788, 0.057745173277073916)
2026-05-24 09:35:14,127 - optuna.study.study - INFO - Trial 286 finished with values: [0.06725831654200863, 0.03836092715231788, 0.057745173277073916] and parameters: {'n_layers': 1, 'embedding_dim': 64, 'lr': 0.0006251382018314868, 'lambda_val': 0.000621169344675621, 'batch_size': 1133, 'optimizer': 'RMSprop'}.
2026-05-24 09:36:07,141 - experiment_functions - INFO - Early stopping at epoch 3950. Best Metrics: (0.021869613394550694, 0.014072847682119206, 0.01929707334202323)
2026-05-24 09:36:08,106 - optuna.study.study - INFO - Trial 287 finished with values: [0.021869613394550694, 0.014072847682119206, 0.01929707334202323] and parameters: {'n_layers': 4, 'embedding_dim': 128, 'lr': 0.03750096865015225, 'lambda_val': 0.0011722082940115572, 'batch_size': 634, 'optimizer': 'Adam'}.
2026-05-24 09:36:16,243 - experiment_functions - INFO - Early stopping at epoch 550. Best Metrics: (0.028584056233291234, 0.019801324503311256, 0.02649185880379247)
2026-05-24 09:36:16,388 - optuna.study.study - INFO - Trial 288 finished with values: [0.028584056233291234, 0.019801324503311256, 0.02649185880379247] and parameters: {'n_layers': 3, 'embedding_dim': 128, 'lr': 0.0019498675283919575, 'lambda_val': 0.00800073098738819, 'batch_size': 2187, 'optimizer': 'Adam'}.
2026-05-24 09:36:28,244 - experiment_functions - INFO - Early stopping at epoch 800. Best Metrics: (0.02085009647974951, 0.01741721854304636, 0.021886111355138484)
2026-05-24 09:36:28,338 - optuna.study.study - INFO - Trial 289 finished with values: [0.02085009647974951, 0.01741721854304636, 0.021886111355138484] and parameters: {'n_layers': 4, 'embedding_dim': 128, 'lr': 0.0003755353524054084, 'lambda_val': 0.03503167400097262, 'batch_size': 1666, 'optimizer': 'RMSprop'}.
2026-05-24 09:36:48,095 - experiment_functions - INFO - Early stopping at epoch 1600. Best Metrics: (0.06689640406483227, 0.03887417218543047, 0.05828013504697111)
2026-05-24 09:36:49,019 - optuna.study.study - INFO - Trial 290 finished with values: [0.06689640406483227, 0.03887417218543047, 0.05828013504697111] and parameters: {'n_layers': 1, 'embedding_dim': 128, 'lr': 0.0005611343469820637, 'lambda_val': 0.0017812353290128234, 'batch_size': 1091, 'optimizer': 'RMSprop'}.
2026-05-24 09:37:36,245 - optuna.study.study - INFO - Trial 291 finished with values: [0.056613677565298205, 0.03458609271523179, 0.05080094004894002] and parameters: {'n_layers': 1, 'embedding_dim': 128, 'lr': 0.0003755353524054084, 'lambda_val': 4.601372605867572e-05, 'batch_size': 1091, 'optimizer': 'Adam'}.
2026-05-24 09:38:24,379 - optuna.study.study - INFO - Trial 292 finished with values: [0.0637087814433857, 0.03820364238410596, 0.05476968229107543] and parameters: {'n_layers': 1, 'embedding_dim': 128, 'lr': 0.0003755353524054084, 'lambda_val': 0.0007561839367868583, 'batch_size': 1091, 'optimizer': 'RMSprop'}.
2026-05-24 09:38:44,992 - experiment_functions - INFO - Early stopping at epoch 1850. Best Metrics: (0.005142431226076816, 0.004478476821192053, 0.005372054590828994)
2026-05-24 09:38:45,814 - optuna.study.study - INFO - Trial 293 finished with values: [0.005142431226076816, 0.004478476821192053, 0.005372054590828994] and parameters: {'n_layers': 1, 'embedding_dim': 96, 'lr': 4.158242436479283e-05, 'lambda_val': 8.523357255734578e-06, 'batch_size': 2036, 'optimizer': 'RMSprop'}.
2026-05-24 09:38:54,273 - experiment_functions - INFO - Early stopping at epoch 600. Best Metrics: (0.05025537976002059, 0.03142384105960265, 0.0449827559198613)
2026-05-24 09:38:54,366 - optuna.study.study - INFO - Trial 294 finished with values: [0.05025537976002059, 0.03142384105960265, 0.0449827559198613] and parameters: {'n_layers': 2, 'embedding_dim': 96, 'lr': 0.002019850627421517, 'lambda_val': 2.346379884027025e-05, 'batch_size': 2675, 'optimizer': 'Adam'}.
2026-05-24 09:39:14,525 - experiment_functions - INFO - Early stopping at epoch 1500. Best Metrics: (0.061780883394987045, 0.03792218543046358, 0.05444565771776291)
2026-05-24 09:39:14,599 - optuna.study.study - INFO - Trial 295 finished with values: [0.061780883394987045, 0.03792218543046358, 0.05444565771776291] and parameters: {'n_layers': 1, 'embedding_dim': 128, 'lr': 0.0006251382018314868, 'lambda_val': 0.000621169344675621, 'batch_size': 1133, 'optimizer': 'RMSprop'}.
2026-05-24 09:39:22,190 - experiment_functions - INFO - Early stopping at epoch 550. Best Metrics: (0.047865134980052, 0.03081953642384106, 0.043627238946179966)
2026-05-24 09:39:22,358 - optuna.study.study - INFO - Trial 296 finished with values: [0.047865134980052, 0.03081953642384106, 0.043627238946179966] and parameters: {'n_layers': 1, 'embedding_dim': 128, 'lr': 0.0019498675283919575, 'lambda_val': 8.523357255734578e-06, 'batch_size': 3641, 'optimizer': 'RMSprop'}.
2026-05-24 09:39:38,627 - experiment_functions - INFO - Early stopping at epoch 1200. Best Metrics: (0.052851969771233555, 0.03275662251655629, 0.04700034763933716)
2026-05-24 09:39:38,751 - optuna.study.study - INFO - Trial 297 finished with values: [0.052851969771233555, 0.03275662251655629, 0.04700034763933716] and parameters: {'n_layers': 2, 'embedding_dim': 128, 'lr': 0.0003755353524054084, 'lambda_val': 0.00024520298043778096, 'batch_size': 1035, 'optimizer': 'RMSprop'}.
2026-05-24 09:39:54,361 - experiment_functions - INFO - Early stopping at epoch 1250. Best Metrics: (0.05829508172717331, 0.03683774834437086, 0.05289002530627608)
2026-05-24 09:39:54,497 - optuna.study.study - INFO - Trial 298 finished with values: [0.05829508172717331, 0.03683774834437086, 0.05289002530627608] and parameters: {'n_layers': 1, 'embedding_dim': 128, 'lr': 0.0003755353524054084, 'lambda_val': 0.03503167400097262, 'batch_size': 2226, 'optimizer': 'RMSprop'}.
2026-05-24 09:40:05,334 - experiment_functions - INFO - Early stopping at epoch 600. Best Metrics: (0.029709372760291362, 0.020860927152317882, 0.0285868514637852)
