2026-05-24 09:40:06,229 - optuna.study.study - INFO - Trial 299 finished with values: [0.029709372760291362, 0.020860927152317882, 0.0285868514637852] and parameters: {'n_layers': 4, 'embedding_dim': 256, 'lr': 0.0003755353524054084, 'lambda_val': 0.0007561839367868583, 'batch_size': 3076, 'optimizer': 'RMSprop'}.
2026-05-24 09:40:06,416 - root - INFO - Selected Trial 290 based on Max ndcg: 0.0583
2026-05-24 09:40:06,417 - root - INFO - Associated Recall: 0.0669
2026-05-24 09:40:06,417 - experiment_functions - INFO - Training the best model ... for e_1M_1c1dcs_rand1
2026-05-24 09:40:25,480 - experiment_functions - INFO - Early stopping at epoch 1600. Best Metrics: (0.060226836018907465, 0.036705298013245034, 0.053951810931783396)
2026-05-24 09:40:26,374 - root - INFO -   **** Training e_1M_1c1dcs_rand2
2026-05-24 09:40:26,445 - root - INFO -   **** Getting 190231/805443 random edges
2026-05-24 09:40:27,353 - optuna.storages._rdb.storage - INFO - A new study created in RDB with name: Study_e_1M_1c1dcs_rand2
2026-05-24 09:40:36,669 - experiment_functions - INFO - Early stopping at epoch 550. Best Metrics: (0.04252472975411115, 0.02744205298013245, 0.038718570325269756)
2026-05-24 09:40:36,793 - optuna.study.study - INFO - Trial 0 finished with values: [0.04252472975411115, 0.02744205298013245, 0.038718570325269756] and parameters: {'n_layers': 3, 'embedding_dim': 256, 'lr': 0.003043283191241845, 'lambda_val': 1.2584915483536783e-06, 'batch_size': 961, 'optimizer': 'Adam'}.
2026-05-24 09:40:44,158 - experiment_functions - INFO - Early stopping at epoch 550. Best Metrics: (0.029875072160513317, 0.020430463576158943, 0.02729444815249535)
2026-05-24 09:40:44,246 - optuna.study.study - INFO - Trial 1 finished with values: [0.029875072160513317, 0.020430463576158943, 0.02729444815249535] and parameters: {'n_layers': 3, 'embedding_dim': 32, 'lr': 0.00660067706198712, 'lambda_val': 0.00325865136231477, 'batch_size': 2740, 'optimizer': 'Adam'}.
2026-05-24 09:40:50,924 - experiment_functions - INFO - Early stopping at epoch 500. Best Metrics: (0.005115563344268326, 0.004370860927152318, 0.005448601136185858)
2026-05-24 09:40:51,583 - optuna.study.study - INFO - Trial 2 finished with values: [0.005115563344268326, 0.004370860927152318, 0.005448601136185858] and parameters: {'n_layers': 1, 'embedding_dim': 128, 'lr': 0.00013975372040490994, 'lambda_val': 0.02634963524283978, 'batch_size': 1162, 'optimizer': 'SGD'}.
2026-05-24 09:40:58,435 - experiment_functions - INFO - Early stopping at epoch 500. Best Metrics: (0.005272551227637295, 0.004221854304635762, 0.0053690932611350104)
2026-05-24 09:40:59,198 - optuna.study.study - INFO - Trial 3 finished with values: [0.005272551227637295, 0.004221854304635762, 0.0053690932611350104] and parameters: {'n_layers': 2, 'embedding_dim': 64, 'lr': 0.0011432623051625486, 'lambda_val': 0.0005461247648424743, 'batch_size': 3250, 'optimizer': 'SGD'}.
2026-05-24 09:41:08,361 - experiment_functions - INFO - Early stopping at epoch 700. Best Metrics: (0.005034707149399205, 0.004205298013245033, 0.004931559838055518)
2026-05-24 09:41:09,381 - optuna.study.study - INFO - Trial 4 finished with values: [0.005034707149399205, 0.004205298013245033, 0.004931559838055518] and parameters: {'n_layers': 4, 'embedding_dim': 32, 'lr': 0.0969273945604793, 'lambda_val': 0.00016826647316742801, 'batch_size': 2680, 'optimizer': 'SGD'}.
2026-05-24 09:41:17,348 - experiment_functions - INFO - Early stopping at epoch 600. Best Metrics: (0.042557532349360064, 0.027516556291390725, 0.039536659338389034)
2026-05-24 09:41:17,442 - optuna.study.study - INFO - Trial 5 finished with values: [0.042557532349360064, 0.027516556291390725, 0.039536659338389034] and parameters: {'n_layers': 2, 'embedding_dim': 32, 'lr': 0.0011985229591796502, 'lambda_val': 0.0009904374338936715, 'batch_size': 1467, 'optimizer': 'RMSprop'}.
2026-05-24 09:41:25,136 - experiment_functions - INFO - Early stopping at epoch 500. Best Metrics: (0.005777983623338214, 0.004668874172185431, 0.005854646544004573)
2026-05-24 09:41:25,260 - optuna.study.study - INFO - Trial 6 finished with values: [0.005777983623338214, 0.004668874172185431, 0.005854646544004573] and parameters: {'n_layers': 4, 'embedding_dim': 128, 'lr': 0.01092982875833726, 'lambda_val': 0.0005343996675124817, 'batch_size': 2428, 'optimizer': 'SGD'}.
2026-05-24 09:41:32,471 - experiment_functions - INFO - Early stopping at epoch 500. Best Metrics: (0.0048959265706164014, 0.004279801324503311, 0.004975044363001174)
2026-05-24 09:41:32,561 - optuna.study.study - INFO - Trial 7 finished with values: [0.0048959265706164014, 0.004279801324503311, 0.004975044363001174] and parameters: {'n_layers': 3, 'embedding_dim': 128, 'lr': 0.0007591967802002333, 'lambda_val': 1.3752214642878569e-06, 'batch_size': 3540, 'optimizer': 'SGD'}.
2026-05-24 09:42:15,392 - optuna.study.study - INFO - Trial 8 finished with values: [0.021414779668162267, 0.01615066225165563, 0.021905665618541913] and parameters: {'n_layers': 3, 'embedding_dim': 32, 'lr': 0.0001091174252436759, 'lambda_val': 4.7374488373095054e-05, 'batch_size': 3771, 'optimizer': 'RMSprop'}.
2026-05-24 09:42:21,502 - experiment_functions - INFO - Early stopping at epoch 500. Best Metrics: (0.005453899772930832, 0.004321192052980133, 0.005438286910758923)
2026-05-24 09:42:22,564 - optuna.study.study - INFO - Trial 9 finished with values: [0.005453899772930832, 0.004321192052980133, 0.005438286910758923] and parameters: {'n_layers': 2, 'embedding_dim': 32, 'lr': 7.099389116280238e-05, 'lambda_val': 0.00015518625210321203, 'batch_size': 2308, 'optimizer': 'SGD'}.
2026-05-24 09:42:29,778 - experiment_functions - INFO - Early stopping at epoch 550. Best Metrics: (0.01771560453667127, 0.012177152317880795, 0.01621293433021228)
2026-05-24 09:42:30,311 - optuna.study.study - INFO - Trial 10 finished with values: [0.01771560453667127, 0.012177152317880795, 0.01621293433021228] and parameters: {'n_layers': 2, 'embedding_dim': 64, 'lr': 0.029449184667860652, 'lambda_val': 5.82487758268536e-06, 'batch_size': 3622, 'optimizer': 'RMSprop'}.
2026-05-24 09:42:36,627 - experiment_functions - INFO - Early stopping at epoch 500. Best Metrics: (0.004800852972374286, 0.004180463576158941, 0.0052378760357866755)
2026-05-24 09:42:36,731 - optuna.study.study - INFO - Trial 11 finished with values: [0.004800852972374286, 0.004180463576158941, 0.0052378760357866755] and parameters: {'n_layers': 3, 'embedding_dim': 64, 'lr': 0.000788831009251679, 'lambda_val': 0.00669784901957394, 'batch_size': 1999, 'optimizer': 'SGD'}.
2026-05-24 09:42:50,196 - experiment_functions - INFO - Early stopping at epoch 1250. Best Metrics: (0.021461236860258182, 0.015115894039735102, 0.020375178559134656)
2026-05-24 09:42:50,283 - optuna.study.study - INFO - Trial 12 finished with values: [0.021461236860258182, 0.015115894039735102, 0.020375178559134656] and parameters: {'n_layers': 2, 'embedding_dim': 32, 'lr': 0.010910037137016305, 'lambda_val': 0.0005149605398707555, 'batch_size': 1064, 'optimizer': 'RMSprop'}.
2026-05-24 09:43:22,466 - experiment_functions - INFO - Early stopping at epoch 2900. Best Metrics: (0.02248219158715815, 0.012094370860927154, 0.01832338378617811)
2026-05-24 09:43:22,550 - optuna.study.study - INFO - Trial 13 finished with values: [0.02248219158715815, 0.012094370860927154, 0.01832338378617811] and parameters: {'n_layers': 4, 'embedding_dim': 64, 'lr': 0.008711010704037053, 'lambda_val': 2.791930910853256e-06, 'batch_size': 3139, 'optimizer': 'Adam'}.
2026-05-24 09:44:07,361 - optuna.study.study - INFO - Trial 14 finished with values: [0.02475812718242852, 0.0173841059602649, 0.023818536924420857] and parameters: {'n_layers': 4, 'embedding_dim': 64, 'lr': 8.530575486069038e-05, 'lambda_val': 0.0004231980579073248, 'batch_size': 3462, 'optimizer': 'RMSprop'}.
2026-05-24 09:44:14,868 - experiment_functions - INFO - Early stopping at epoch 550. Best Metrics: (0.03893079053200253, 0.025480132450331126, 0.035948110466138085)
2026-05-24 09:44:14,953 - optuna.study.study - INFO - Trial 15 finished with values: [0.03893079053200253, 0.025480132450331126, 0.035948110466138085] and parameters: {'n_layers': 3, 'embedding_dim': 128, 'lr': 0.002746129425384238, 'lambda_val': 2.5452815323641335e-06, 'batch_size': 2844, 'optimizer': 'Adam'}.
2026-05-24 09:44:21,297 - experiment_functions - INFO - Early stopping at epoch 500. Best Metrics: (0.0056194524934868794, 0.0045033112582781466, 0.005710818163168575)
2026-05-24 09:44:22,325 - optuna.study.study - INFO - Trial 16 finished with values: [0.0056194524934868794, 0.0045033112582781466, 0.005710818163168575] and parameters: {'n_layers': 3, 'embedding_dim': 64, 'lr': 0.020974389902177336, 'lambda_val': 0.00021172971583081288, 'batch_size': 2608, 'optimizer': 'SGD'}.
2026-05-24 09:44:29,106 - experiment_functions - INFO - Early stopping at epoch 500. Best Metrics: (0.005303601172788993, 0.0043377483443708615, 0.00550089499469604)
2026-05-24 09:44:29,783 - optuna.study.study - INFO - Trial 17 finished with values: [0.005303601172788993, 0.0043377483443708615, 0.00550089499469604] and parameters: {'n_layers': 3, 'embedding_dim': 96, 'lr': 0.017904420189526468, 'lambda_val': 6.368788396977917e-06, 'batch_size': 3189, 'optimizer': 'SGD'}.
2026-05-24 09:44:36,231 - experiment_functions - INFO - Early stopping at epoch 500. Best Metrics: (0.005375220844677511, 0.004221854304635762, 0.005373880630532241)
2026-05-24 09:44:36,336 - optuna.study.study - INFO - Trial 18 finished with values: [0.005375220844677511, 0.004221854304635762, 0.005373880630532241] and parameters: {'n_layers': 2, 'embedding_dim': 96, 'lr': 0.002181901065505303, 'lambda_val': 8.09698663706325e-05, 'batch_size': 1579, 'optimizer': 'SGD'}.
2026-05-24 09:44:42,868 - experiment_functions - INFO - Early stopping at epoch 550. Best Metrics: (0.028309537007209496, 0.02170529801324504, 0.026341844514354205)
2026-05-24 09:44:42,955 - optuna.study.study - INFO - Trial 19 finished with values: [0.028309537007209496, 0.02170529801324504, 0.026341844514354205] and parameters: {'n_layers': 1, 'embedding_dim': 32, 'lr': 0.004028743321822881, 'lambda_val': 1.9563512568026275e-06, 'batch_size': 2901, 'optimizer': 'RMSprop'}.
2026-05-24 09:44:49,376 - experiment_functions - INFO - Early stopping at epoch 500. Best Metrics: (0.005020377311055786, 0.004321192052980133, 0.0054153836695895)
2026-05-24 09:44:50,537 - optuna.study.study - INFO - Trial 20 finished with values: [0.005020377311055786, 0.004321192052980133, 0.0054153836695895] and parameters: {'n_layers': 1, 'embedding_dim': 256, 'lr': 0.019572401550559917, 'lambda_val': 0.024491427585150067, 'batch_size': 2457, 'optimizer': 'SGD'}.
2026-05-24 09:45:03,264 - experiment_functions - INFO - Early stopping at epoch 800. Best Metrics: (0.008162475850687603, 0.00896523178807947, 0.009567142133798523)
2026-05-24 09:45:03,363 - optuna.study.study - INFO - Trial 21 finished with values: [0.008162475850687603, 0.00896523178807947, 0.009567142133798523] and parameters: {'n_layers': 4, 'embedding_dim': 256, 'lr': 0.003011889027190141, 'lambda_val': 0.047722126000469066, 'batch_size': 1623, 'optimizer': 'RMSprop'}.
2026-05-24 09:45:09,327 - experiment_functions - INFO - Early stopping at epoch 500. Best Metrics: (0.005125052531924867, 0.004064569536423841, 0.005150630710283647)
2026-05-24 09:45:09,760 - optuna.study.study - INFO - Trial 22 finished with values: [0.005125052531924867, 0.004064569536423841, 0.005150630710283647] and parameters: {'n_layers': 2, 'embedding_dim': 32, 'lr': 0.003994480071830669, 'lambda_val': 0.0002439341200981624, 'batch_size': 1942, 'optimizer': 'SGD'}.
2026-05-24 09:45:16,471 - experiment_functions - INFO - Early stopping at epoch 600. Best Metrics: (0.004776617986159665, 0.003923841059602649, 0.005061236006792531)
2026-05-24 09:45:17,029 - optuna.study.study - INFO - Trial 23 finished with values: [0.004776617986159665, 0.003923841059602649, 0.005061236006792531] and parameters: {'n_layers': 1, 'embedding_dim': 64, 'lr': 1.158291632335336e-05, 'lambda_val': 0.0024643710835461686, 'batch_size': 3932, 'optimizer': 'RMSprop'}.
2026-05-24 09:45:29,976 - experiment_functions - INFO - Early stopping at epoch 1250. Best Metrics: (0.013561303499847657, 0.01156456953642384, 0.01449083683768651)
2026-05-24 09:45:30,098 - optuna.study.study - INFO - Trial 24 finished with values: [0.013561303499847657, 0.01156456953642384, 0.01449083683768651] and parameters: {'n_layers': 1, 'embedding_dim': 64, 'lr': 0.025074765444195745, 'lambda_val': 0.00013311956403760163, 'batch_size': 689, 'optimizer': 'RMSprop'}.
2026-05-24 09:45:39,263 - experiment_functions - INFO - Early stopping at epoch 750. Best Metrics: (0.06052977480105548, 0.03610099337748344, 0.05337486322082446)
2026-05-24 09:45:40,086 - optuna.study.study - INFO - Trial 25 finished with values: [0.06052977480105548, 0.03610099337748344, 0.05337486322082446] and parameters: {'n_layers': 1, 'embedding_dim': 128, 'lr': 0.001667262481946792, 'lambda_val': 5.797866699774695e-06, 'batch_size': 1780, 'optimizer': 'Adam'}.
2026-05-24 09:45:49,799 - experiment_functions - INFO - Early stopping at epoch 600. Best Metrics: (0.01621942693101421, 0.012301324503311258, 0.01624742458060253)
2026-05-24 09:45:50,934 - optuna.study.study - INFO - Trial 26 finished with values: [0.01621942693101421, 0.012301324503311258, 0.01624742458060253] and parameters: {'n_layers': 3, 'embedding_dim': 256, 'lr': 0.024669538417958024, 'lambda_val': 2.03783312901811e-06, 'batch_size': 1177, 'optimizer': 'RMSprop'}.
2026-05-24 09:46:04,188 - experiment_functions - INFO - Early stopping at epoch 1250. Best Metrics: (0.005320985190643938, 0.004254966887417219, 0.005389855064809282)
2026-05-24 09:46:04,291 - optuna.study.study - INFO - Trial 27 finished with values: [0.005320985190643938, 0.004254966887417219, 0.005389855064809282] and parameters: {'n_layers': 1, 'embedding_dim': 64, 'lr': 0.07186867195342231, 'lambda_val': 2.096080873984275e-05, 'batch_size': 3302, 'optimizer': 'SGD'}.
2026-05-24 09:46:22,849 - experiment_functions - INFO - Early stopping at epoch 1400. Best Metrics: (0.03533500646497561, 0.02376655629139073, 0.0338838465446207)
2026-05-24 09:46:22,951 - optuna.study.study - INFO - Trial 28 finished with values: [0.03533500646497561, 0.02376655629139073, 0.0338838465446207] and parameters: {'n_layers': 4, 'embedding_dim': 96, 'lr': 0.0002008346621954922, 'lambda_val': 6.700238629685478e-06, 'batch_size': 2742, 'optimizer': 'RMSprop'}.
2026-05-24 09:46:40,442 - experiment_functions - INFO - Early stopping at epoch 1650. Best Metrics: (0.017102034084203677, 0.015157284768211923, 0.018995181717280294)
2026-05-24 09:46:41,068 - optuna.study.study - INFO - Trial 29 finished with values: [0.017102034084203677, 0.015157284768211923, 0.018995181717280294] and parameters: {'n_layers': 1, 'embedding_dim': 128, 'lr': 0.009194213632540334, 'lambda_val': 0.03135128054501935, 'batch_size': 2082, 'optimizer': 'RMSprop'}.
2026-05-24 09:46:48,652 - experiment_functions - INFO - Early stopping at epoch 650. Best Metrics: (0.006200510385535678, 0.004536423841059603, 0.005977652821176719)
2026-05-24 09:46:48,748 - optuna.study.study - INFO - Trial 30 finished with values: [0.006200510385535678, 0.004536423841059603, 0.005977652821176719] and parameters: {'n_layers': 2, 'embedding_dim': 32, 'lr': 0.0559417521693863, 'lambda_val': 4.8599912504671415e-06, 'batch_size': 2436, 'optimizer': 'SGD'}.
2026-05-24 09:47:34,848 - optuna.study.study - INFO - Trial 31 finished with values: [0.01472794235158056, 0.012135761589403975, 0.01522499842529726] and parameters: {'n_layers': 3, 'embedding_dim': 96, 'lr': 0.0037750810428813417, 'lambda_val': 0.0039527605576958405, 'batch_size': 1603, 'optimizer': 'RMSprop'}.
2026-05-24 09:48:00,341 - experiment_functions - INFO - Early stopping at epoch 2550. Best Metrics: (0.006142292399592635, 0.0047019867549668885, 0.005922010882823592)
2026-05-24 09:48:00,414 - optuna.study.study - INFO - Trial 32 finished with values: [0.006142292399592635, 0.0047019867549668885, 0.005922010882823592] and parameters: {'n_layers': 1, 'embedding_dim': 64, 'lr': 4.885523061005691e-05, 'lambda_val': 6.476822722794838e-06, 'batch_size': 2866, 'optimizer': 'RMSprop'}.
2026-05-24 09:48:07,521 - experiment_functions - INFO - Early stopping at epoch 600. Best Metrics: (0.016197309268799382, 0.013004966887417221, 0.016600085653587768)
2026-05-24 09:48:07,612 - optuna.study.study - INFO - Trial 33 finished with values: [0.016197309268799382, 0.013004966887417221, 0.016600085653587768] and parameters: {'n_layers': 1, 'embedding_dim': 64, 'lr': 0.03965113881953134, 'lambda_val': 4.336462830610492e-06, 'batch_size': 1264, 'optimizer': 'Adam'}.
2026-05-24 09:48:13,671 - experiment_functions - INFO - Early stopping at epoch 500. Best Metrics: (0.005257629067219436, 0.004536423841059603, 0.005659195185627923)
2026-05-24 09:48:13,739 - optuna.study.study - INFO - Trial 34 finished with values: [0.005257629067219436, 0.004536423841059603, 0.005659195185627923] and parameters: {'n_layers': 1, 'embedding_dim': 128, 'lr': 0.007811045968786406, 'lambda_val': 7.536869044168119e-05, 'batch_size': 3566, 'optimizer': 'SGD'}.
2026-05-24 09:48:20,691 - experiment_functions - INFO - Early stopping at epoch 550. Best Metrics: (0.024470437410533778, 0.017781456953642385, 0.02319522830778923)
2026-05-24 09:48:20,762 - optuna.study.study - INFO - Trial 35 finished with values: [0.024470437410533778, 0.017781456953642385, 0.02319522830778923] and parameters: {'n_layers': 4, 'embedding_dim': 32, 'lr': 0.0013978493934357974, 'lambda_val': 4.452603967565531e-05, 'batch_size': 3366, 'optimizer': 'RMSprop'}.
2026-05-24 09:48:26,842 - experiment_functions - INFO - Early stopping at epoch 500. Best Metrics: (0.004981701886296558, 0.004180463576158941, 0.005139948529182954)
2026-05-24 09:48:27,708 - optuna.study.study - INFO - Trial 36 finished with values: [0.004981701886296558, 0.004180463576158941, 0.005139948529182954] and parameters: {'n_layers': 2, 'embedding_dim': 32, 'lr': 2.0414011816744765e-05, 'lambda_val': 0.004594615051756208, 'batch_size': 2424, 'optimizer': 'Adam'}.
2026-05-24 09:48:34,804 - experiment_functions - INFO - Early stopping at epoch 500. Best Metrics: (0.0048595925416998675, 0.004263245033112583, 0.005270208248342495)
2026-05-24 09:48:34,899 - optuna.study.study - INFO - Trial 37 finished with values: [0.0048595925416998675, 0.004263245033112583, 0.005270208248342495] and parameters: {'n_layers': 4, 'embedding_dim': 96, 'lr': 0.0005938047872271148, 'lambda_val': 0.005013814858273418, 'batch_size': 2050, 'optimizer': 'SGD'}.
2026-05-24 09:48:41,496 - experiment_functions - INFO - Early stopping at epoch 500. Best Metrics: (0.004981487878081449, 0.004230132450331126, 0.005289491778278563)
2026-05-24 09:48:41,618 - optuna.study.study - INFO - Trial 38 finished with values: [0.004981487878081449, 0.004230132450331126, 0.005289491778278563] and parameters: {'n_layers': 3, 'embedding_dim': 32, 'lr': 0.028846200775262537, 'lambda_val': 0.07482329824227972, 'batch_size': 1567, 'optimizer': 'SGD'}.
2026-05-24 09:48:49,015 - experiment_functions - INFO - Early stopping at epoch 550. Best Metrics: (0.03587215859669559, 0.025951986754966887, 0.03333557883119407)
2026-05-24 09:48:49,119 - optuna.study.study - INFO - Trial 39 finished with values: [0.03587215859669559, 0.025951986754966887, 0.03333557883119407] and parameters: {'n_layers': 1, 'embedding_dim': 64, 'lr': 0.0028931100527333827, 'lambda_val': 0.003154130669772898, 'batch_size': 2257, 'optimizer': 'RMSprop'}.
2026-05-24 09:48:55,513 - experiment_functions - INFO - Early stopping at epoch 500. Best Metrics: (0.004578556784692088, 0.004155629139072848, 0.005051955885827652)
2026-05-24 09:48:56,701 - optuna.study.study - INFO - Trial 40 finished with values: [0.004578556784692088, 0.004155629139072848, 0.005051955885827652] and parameters: {'n_layers': 1, 'embedding_dim': 128, 'lr': 0.06367629027830135, 'lambda_val': 0.05044110993814492, 'batch_size': 1896, 'optimizer': 'SGD'}.
2026-05-24 09:49:21,821 - experiment_functions - INFO - Early stopping at epoch 2050. Best Metrics: (0.02248806718329829, 0.015918874172185432, 0.021899425273207488)
2026-05-24 09:49:21,914 - optuna.study.study - INFO - Trial 41 finished with values: [0.02248806718329829, 0.015918874172185432, 0.021899425273207488] and parameters: {'n_layers': 2, 'embedding_dim': 96, 'lr': 0.0356545050255104, 'lambda_val': 0.0015545326916399916, 'batch_size': 3398, 'optimizer': 'RMSprop'}.
2026-05-24 09:49:30,198 - experiment_functions - INFO - Early stopping at epoch 550. Best Metrics: (0.04374328421998527, 0.026879139072847683, 0.03909329532353926)
2026-05-24 09:49:30,291 - optuna.study.study - INFO - Trial 42 finished with values: [0.04374328421998527, 0.026879139072847683, 0.03909329532353926] and parameters: {'n_layers': 1, 'embedding_dim': 128, 'lr': 0.005921142718785096, 'lambda_val': 1.6361223952928733e-05, 'batch_size': 1930, 'optimizer': 'Adam'}.
2026-05-24 09:49:39,969 - experiment_functions - INFO - Early stopping at epoch 550. Best Metrics: (0.012470716247899359, 0.012375827814569536, 0.013987294406033182)
2026-05-24 09:49:40,062 - optuna.study.study - INFO - Trial 43 finished with values: [0.012470716247899359, 0.012375827814569536, 0.013987294406033182] and parameters: {'n_layers': 3, 'embedding_dim': 32, 'lr': 0.001899902997628999, 'lambda_val': 0.06666595456683828, 'batch_size': 2702, 'optimizer': 'RMSprop'}.
2026-05-24 09:50:00,844 - experiment_functions - INFO - Early stopping at epoch 1600. Best Metrics: (0.024844178211120796, 0.014908940397350995, 0.0215499893237867)
