2026-05-24 08:07:00,046 - optuna.study.study - INFO - Trial 270 finished with values: [0.05605302650348886, 0.025951986754966887, 0.05021001662104347] and parameters: {'n_layers': 1, 'embedding_dim': 32, 'lr': 0.0004427403826510948, 'lambda_val': 0.0006476604301141326, 'batch_size': 3507, 'optimizer': 'Adam'}.
2026-05-24 08:07:14,168 - experiment_functions - INFO - Early stopping at epoch 1100. Best Metrics: (0.057575224665894535, 0.025968543046357616, 0.048791479575732856)
2026-05-24 08:07:14,283 - optuna.study.study - INFO - Trial 271 finished with values: [0.057575224665894535, 0.025968543046357616, 0.048791479575732856] and parameters: {'n_layers': 1, 'embedding_dim': 128, 'lr': 0.0003154862248546408, 'lambda_val': 0.016181458652267704, 'batch_size': 4018, 'optimizer': 'Adam'}.
2026-05-24 08:08:01,871 - optuna.study.study - INFO - Trial 272 finished with values: [0.05517493696854054, 0.02552980132450331, 0.050442410072693344] and parameters: {'n_layers': 1, 'embedding_dim': 32, 'lr': 0.00022442725513326185, 'lambda_val': 0.00828097881980844, 'batch_size': 3263, 'optimizer': 'RMSprop'}.
2026-05-24 08:08:20,934 - experiment_functions - INFO - Early stopping at epoch 1550. Best Metrics: (0.06330482256152557, 0.02663907284768212, 0.054054396571404505)
2026-05-24 08:08:21,011 - optuna.study.study - INFO - Trial 273 finished with values: [0.06330482256152557, 0.02663907284768212, 0.054054396571404505] and parameters: {'n_layers': 1, 'embedding_dim': 32, 'lr': 0.00034776281673029824, 'lambda_val': 0.016181458652267704, 'batch_size': 2437, 'optimizer': 'Adam'}.
2026-05-24 08:08:31,944 - experiment_functions - INFO - Early stopping at epoch 800. Best Metrics: (0.05401496597252148, 0.02519867549668874, 0.04417606093815189)
2026-05-24 08:08:32,452 - optuna.study.study - INFO - Trial 274 finished with values: [0.05401496597252148, 0.02519867549668874, 0.04417606093815189] and parameters: {'n_layers': 2, 'embedding_dim': 96, 'lr': 0.0004427403826510948, 'lambda_val': 0.017148874768615503, 'batch_size': 803, 'optimizer': 'RMSprop'}.
2026-05-24 08:09:00,643 - experiment_functions - INFO - Early stopping at epoch 2450. Best Metrics: (0.06389932469795358, 0.027938741721854305, 0.057766234314044436)
2026-05-24 08:09:00,748 - optuna.study.study - INFO - Trial 275 finished with values: [0.06389932469795358, 0.027938741721854305, 0.057766234314044436] and parameters: {'n_layers': 1, 'embedding_dim': 32, 'lr': 0.00034776281673029824, 'lambda_val': 0.0003443593187809489, 'batch_size': 2437, 'optimizer': 'Adam'}.
2026-05-24 08:09:15,722 - experiment_functions - INFO - Early stopping at epoch 1150. Best Metrics: (0.06095189985896623, 0.030488410596026493, 0.05673069098107249)
2026-05-24 08:09:15,814 - optuna.study.study - INFO - Trial 276 finished with values: [0.06095189985896623, 0.030488410596026493, 0.05673069098107249] and parameters: {'n_layers': 2, 'embedding_dim': 96, 'lr': 0.0003154862248546408, 'lambda_val': 0.006128221667042127, 'batch_size': 1253, 'optimizer': 'Adam'}.
2026-05-24 08:09:32,702 - experiment_functions - INFO - Early stopping at epoch 1450. Best Metrics: (0.06824957640099545, 0.030198675496688736, 0.06247184213234307)
2026-05-24 08:09:33,223 - optuna.study.study - INFO - Trial 277 finished with values: [0.06824957640099545, 0.030198675496688736, 0.06247184213234307] and parameters: {'n_layers': 1, 'embedding_dim': 32, 'lr': 0.0004427403826510948, 'lambda_val': 0.0001819760529014093, 'batch_size': 1986, 'optimizer': 'Adam'}.
2026-05-24 08:10:17,567 - optuna.study.study - INFO - Trial 278 finished with values: [0.06631741236269229, 0.03088576158940397, 0.06045891951076049] and parameters: {'n_layers': 1, 'embedding_dim': 32, 'lr': 0.0003154862248546408, 'lambda_val': 0.0003842143805033632, 'batch_size': 1308, 'optimizer': 'Adam'}.
2026-05-24 08:10:24,767 - experiment_functions - INFO - Early stopping at epoch 550. Best Metrics: (0.06510009639192754, 0.027806291390728474, 0.056842482290918275)
2026-05-24 08:10:24,877 - optuna.study.study - INFO - Trial 279 finished with values: [0.06510009639192754, 0.027806291390728474, 0.056842482290918275] and parameters: {'n_layers': 1, 'embedding_dim': 64, 'lr': 0.00609632158630285, 'lambda_val': 2.4948249425733372e-05, 'batch_size': 2938, 'optimizer': 'Adam'}.
2026-05-24 08:10:30,947 - experiment_functions - INFO - Early stopping at epoch 500. Best Metrics: (0.004979542467118597, 0.004188741721854305, 0.005152229986668835)
2026-05-24 08:10:32,209 - optuna.study.study - INFO - Trial 280 finished with values: [0.004979542467118597, 0.004188741721854305, 0.005152229986668835] and parameters: {'n_layers': 1, 'embedding_dim': 64, 'lr': 0.0004427403826510948, 'lambda_val': 0.029294127561031207, 'batch_size': 685, 'optimizer': 'Adam'}.
2026-05-24 08:11:00,379 - experiment_functions - INFO - Early stopping at epoch 2450. Best Metrics: (0.07556226951902033, 0.03441225165562914, 0.06567566020672068)
2026-05-24 08:11:00,466 - optuna.study.study - INFO - Trial 281 finished with values: [0.07556226951902033, 0.03441225165562914, 0.06567566020672068] and parameters: {'n_layers': 1, 'embedding_dim': 32, 'lr': 0.0004427403826510948, 'lambda_val': 0.0001819760529014093, 'batch_size': 959, 'optimizer': 'RMSprop'}.
2026-05-24 08:11:16,779 - experiment_functions - INFO - Early stopping at epoch 1400. Best Metrics: (0.06878007369746655, 0.02866721854304636, 0.06098007596252679)
2026-05-24 08:11:17,240 - optuna.study.study - INFO - Trial 282 finished with values: [0.06878007369746655, 0.02866721854304636, 0.06098007596252679] and parameters: {'n_layers': 1, 'embedding_dim': 96, 'lr': 0.0004427403826510948, 'lambda_val': 0.005784834603301849, 'batch_size': 1257, 'optimizer': 'Adam'}.
2026-05-24 08:11:33,191 - experiment_functions - INFO - Early stopping at epoch 1200. Best Metrics: (0.0724719228605648, 0.03083609271523179, 0.06254886115741443)
2026-05-24 08:11:33,377 - optuna.study.study - INFO - Trial 283 finished with values: [0.0724719228605648, 0.03083609271523179, 0.06254886115741443] and parameters: {'n_layers': 1, 'embedding_dim': 256, 'lr': 0.0004427403826510948, 'lambda_val': 6.677683729220252e-06, 'batch_size': 1151, 'optimizer': 'RMSprop'}.
2026-05-24 08:11:40,370 - experiment_functions - INFO - Early stopping at epoch 550. Best Metrics: (0.04909115534080423, 0.018634105960264904, 0.03512317538474428)
2026-05-24 08:11:40,848 - optuna.study.study - INFO - Trial 284 finished with values: [0.04909115534080423, 0.018634105960264904, 0.03512317538474428] and parameters: {'n_layers': 1, 'embedding_dim': 64, 'lr': 0.0014509434531037974, 'lambda_val': 0.020026977030086712, 'batch_size': 3507, 'optimizer': 'RMSprop'}.
2026-05-24 08:11:48,438 - experiment_functions - INFO - Early stopping at epoch 600. Best Metrics: (0.06873947810517625, 0.03400662251655629, 0.06308011932974164)
2026-05-24 08:11:48,994 - optuna.study.study - INFO - Trial 285 finished with values: [0.06873947810517625, 0.03400662251655629, 0.06308011932974164] and parameters: {'n_layers': 1, 'embedding_dim': 32, 'lr': 0.0022852766065388956, 'lambda_val': 0.00828097881980844, 'batch_size': 3507, 'optimizer': 'Adam'}.
2026-05-24 08:12:03,144 - experiment_functions - INFO - Early stopping at epoch 1050. Best Metrics: (0.06799434907471114, 0.02860927152317881, 0.05994149283114452)
2026-05-24 08:12:03,270 - optuna.study.study - INFO - Trial 286 finished with values: [0.06799434907471114, 0.02860927152317881, 0.05994149283114452] and parameters: {'n_layers': 1, 'embedding_dim': 256, 'lr': 0.0004427403826510948, 'lambda_val': 2.4948249425733372e-05, 'batch_size': 3220, 'optimizer': 'Adam'}.
2026-05-24 08:12:11,204 - experiment_functions - INFO - Early stopping at epoch 550. Best Metrics: (0.056509518885504165, 0.019950331125827815, 0.04242262031868368)
2026-05-24 08:12:11,293 - optuna.study.study - INFO - Trial 287 finished with values: [0.056509518885504165, 0.019950331125827815, 0.04242262031868368] and parameters: {'n_layers': 1, 'embedding_dim': 256, 'lr': 0.0022852766065388956, 'lambda_val': 2.4948249425733372e-05, 'batch_size': 1151, 'optimizer': 'RMSprop'}.
2026-05-24 08:12:18,520 - experiment_functions - INFO - Early stopping at epoch 550. Best Metrics: (0.05810906866457435, 0.023824503311258273, 0.05001940626303696)
2026-05-24 08:12:18,620 - optuna.study.study - INFO - Trial 288 finished with values: [0.05810906866457435, 0.023824503311258273, 0.05001940626303696] and parameters: {'n_layers': 1, 'embedding_dim': 96, 'lr': 0.0014509434531037974, 'lambda_val': 0.0023999610459478756, 'batch_size': 3507, 'optimizer': 'RMSprop'}.
2026-05-24 08:12:36,714 - experiment_functions - INFO - Early stopping at epoch 1550. Best Metrics: (0.06740188647003242, 0.029412251655629135, 0.05989460692686935)
2026-05-24 08:12:36,815 - optuna.study.study - INFO - Trial 289 finished with values: [0.06740188647003242, 0.029412251655629135, 0.05989460692686935] and parameters: {'n_layers': 1, 'embedding_dim': 64, 'lr': 0.0004427403826510948, 'lambda_val': 0.00196395878381981, 'batch_size': 1257, 'optimizer': 'RMSprop'}.
2026-05-24 08:12:54,368 - experiment_functions - INFO - Early stopping at epoch 1500. Best Metrics: (0.06270893005488748, 0.027541390728476826, 0.05658134869318443)
2026-05-24 08:12:54,513 - optuna.study.study - INFO - Trial 290 finished with values: [0.06270893005488748, 0.027541390728476826, 0.05658134869318443] and parameters: {'n_layers': 1, 'embedding_dim': 32, 'lr': 0.0004427403826510948, 'lambda_val': 0.0003842143805033632, 'batch_size': 2437, 'optimizer': 'RMSprop'}.
2026-05-24 08:13:11,512 - experiment_functions - INFO - Early stopping at epoch 1300. Best Metrics: (0.07021085612317088, 0.030885761589403975, 0.062496562072986074)
2026-05-24 08:13:11,679 - optuna.study.study - INFO - Trial 291 finished with values: [0.07021085612317088, 0.030885761589403975, 0.062496562072986074] and parameters: {'n_layers': 1, 'embedding_dim': 256, 'lr': 0.0004427403826510948, 'lambda_val': 0.0003443593187809489, 'batch_size': 1308, 'optimizer': 'Adam'}.
2026-05-24 08:13:20,296 - experiment_functions - INFO - Early stopping at epoch 550. Best Metrics: (0.061108096656685595, 0.029221854304635763, 0.05612835808613124)
2026-05-24 08:13:20,610 - optuna.study.study - INFO - Trial 292 finished with values: [0.061108096656685595, 0.029221854304635763, 0.05612835808613124] and parameters: {'n_layers': 2, 'embedding_dim': 256, 'lr': 0.002893369128168616, 'lambda_val': 1.1363890041212263e-05, 'batch_size': 1257, 'optimizer': 'Adam'}.
2026-05-24 08:13:34,563 - experiment_functions - INFO - Early stopping at epoch 1100. Best Metrics: (0.05844739688365134, 0.02669701986754967, 0.051508448849784665)
2026-05-24 08:13:34,932 - optuna.study.study - INFO - Trial 293 finished with values: [0.05844739688365134, 0.02669701986754967, 0.051508448849784665] and parameters: {'n_layers': 2, 'embedding_dim': 64, 'lr': 0.0004427403826510948, 'lambda_val': 0.0001819760529014093, 'batch_size': 959, 'optimizer': 'Adam'}.
2026-05-24 08:14:04,744 - experiment_functions - INFO - Early stopping at epoch 2650. Best Metrics: (0.05653193928553071, 0.02451158940397351, 0.05218082951891487)
2026-05-24 08:14:04,847 - optuna.study.study - INFO - Trial 294 finished with values: [0.05653193928553071, 0.02451158940397351, 0.05218082951891487] and parameters: {'n_layers': 1, 'embedding_dim': 32, 'lr': 0.0003154862248546408, 'lambda_val': 7.532370886356362e-05, 'batch_size': 3507, 'optimizer': 'Adam'}.
2026-05-24 08:14:12,248 - experiment_functions - INFO - Early stopping at epoch 550. Best Metrics: (0.046851529183179225, 0.022144039735099336, 0.04396822280862584)
2026-05-24 08:14:12,355 - optuna.study.study - INFO - Trial 295 finished with values: [0.046851529183179225, 0.022144039735099336, 0.04396822280862584] and parameters: {'n_layers': 2, 'embedding_dim': 64, 'lr': 0.002893369128168616, 'lambda_val': 1.743597466559768e-05, 'batch_size': 3507, 'optimizer': 'Adam'}.
2026-05-24 08:14:35,547 - experiment_functions - INFO - Early stopping at epoch 2050. Best Metrics: (0.040871737945140214, 0.013501655629139072, 0.028509236048114152)
2026-05-24 08:14:35,631 - optuna.study.study - INFO - Trial 296 finished with values: [0.040871737945140214, 0.013501655629139072, 0.028509236048114152] and parameters: {'n_layers': 1, 'embedding_dim': 128, 'lr': 0.0025946253256807516, 'lambda_val': 0.016181458652267704, 'batch_size': 3507, 'optimizer': 'RMSprop'}.
2026-05-24 08:14:41,563 - experiment_functions - INFO - Early stopping at epoch 500. Best Metrics: (0.005854372330111958, 0.0044122516556291385, 0.0060623877218287485)
2026-05-24 08:14:42,079 - optuna.study.study - INFO - Trial 297 finished with values: [0.005854372330111958, 0.0044122516556291385, 0.0060623877218287485] and parameters: {'n_layers': 1, 'embedding_dim': 96, 'lr': 6.504799454825066e-05, 'lambda_val': 0.0001819760529014093, 'batch_size': 803, 'optimizer': 'SGD'}.
2026-05-24 08:14:59,168 - experiment_functions - INFO - Early stopping at epoch 1300. Best Metrics: (0.07281229687568938, 0.02687086092715232, 0.057459817000800655)
2026-05-24 08:14:59,479 - optuna.study.study - INFO - Trial 298 finished with values: [0.07281229687568938, 0.02687086092715232, 0.057459817000800655] and parameters: {'n_layers': 1, 'embedding_dim': 256, 'lr': 0.0004427403826510948, 'lambda_val': 2.4948249425733372e-05, 'batch_size': 2938, 'optimizer': 'RMSprop'}.
2026-05-24 08:15:05,789 - experiment_functions - INFO - Early stopping at epoch 500. Best Metrics: (0.005043348148734236, 0.004114238410596027, 0.004986453113113357)
2026-05-24 08:15:06,977 - optuna.study.study - INFO - Trial 299 finished with values: [0.005043348148734236, 0.004114238410596027, 0.004986453113113357] and parameters: {'n_layers': 1, 'embedding_dim': 64, 'lr': 0.0003154862248546408, 'lambda_val': 0.0023999610459478756, 'batch_size': 3507, 'optimizer': 'SGD'}.
2026-05-24 08:15:06,993 - root - INFO - Selected Trial 281 based on Max ndcg: 0.0657
2026-05-24 08:15:06,993 - root - INFO - Associated Recall: 0.0756
2026-05-24 08:15:06,993 - experiment_functions - INFO - Training the best model ... for e_1M_1c1dcs
2026-05-24 08:15:30,477 - experiment_functions - INFO - Early stopping at epoch 2050. Best Metrics: (0.06905077696642897, 0.030322847682119205, 0.06202914468701651)
2026-05-24 08:15:31,351 - root - INFO -   **** Training e_1M_1c1dcs_rand1
2026-05-24 08:15:31,404 - root - INFO -   **** Getting 190231/805443 random edges
2026-05-24 08:15:31,551 - optuna.storages._rdb.storage - INFO - A new study created in RDB with name: Study_e_1M_1c1dcs_rand1
2026-05-24 08:15:38,939 - experiment_functions - INFO - Early stopping at epoch 550. Best Metrics: (0.033267678557497196, 0.022682119205298012, 0.03157034373468236)
2026-05-24 08:15:39,046 - optuna.study.study - INFO - Trial 0 finished with values: [0.033267678557497196, 0.022682119205298012, 0.03157034373468236] and parameters: {'n_layers': 2, 'embedding_dim': 64, 'lr': 0.0019498675283919575, 'lambda_val': 0.0011457679520731478, 'batch_size': 1445, 'optimizer': 'RMSprop'}.
2026-05-24 08:15:46,224 - experiment_functions - INFO - Early stopping at epoch 550. Best Metrics: (0.0298962052248133, 0.02128311258278146, 0.028467179388932628)
2026-05-24 08:15:46,621 - optuna.study.study - INFO - Trial 1 finished with values: [0.0298962052248133, 0.02128311258278146, 0.028467179388932628] and parameters: {'n_layers': 2, 'embedding_dim': 32, 'lr': 0.0025526763964279944, 'lambda_val': 3.3465405456882283e-06, 'batch_size': 2456, 'optimizer': 'RMSprop'}.
2026-05-24 08:15:53,405 - experiment_functions - INFO - Early stopping at epoch 500. Best Metrics: (0.005249403514631091, 0.004197019867549669, 0.005354514742883097)
2026-05-24 08:15:53,539 - optuna.study.study - INFO - Trial 2 finished with values: [0.005249403514631091, 0.004197019867549669, 0.005354514742883097] and parameters: {'n_layers': 2, 'embedding_dim': 96, 'lr': 0.00013310165609367746, 'lambda_val': 0.07344023524435195, 'batch_size': 3332, 'optimizer': 'RMSprop'}.
2026-05-24 08:16:01,296 - experiment_functions - INFO - Early stopping at epoch 500. Best Metrics: (0.005422851269939715, 0.00451158940397351, 0.005643424195764658)
2026-05-24 08:16:01,457 - optuna.study.study - INFO - Trial 3 finished with values: [0.005422851269939715, 0.00451158940397351, 0.005643424195764658] and parameters: {'n_layers': 4, 'embedding_dim': 128, 'lr': 0.00043236314474042674, 'lambda_val': 0.001533420622832431, 'batch_size': 2639, 'optimizer': 'SGD'}.
2026-05-24 08:16:18,529 - experiment_functions - INFO - Early stopping at epoch 1300. Best Metrics: (0.044939158068280784, 0.029370860927152315, 0.04159330137894282)
2026-05-24 08:16:18,612 - optuna.study.study - INFO - Trial 4 finished with values: [0.044939158068280784, 0.029370860927152315, 0.04159330137894282] and parameters: {'n_layers': 2, 'embedding_dim': 128, 'lr': 0.000249352656785218, 'lambda_val': 1.4219577427815883e-06, 'batch_size': 3601, 'optimizer': 'Adam'}.
2026-05-24 08:16:26,821 - experiment_functions - INFO - Early stopping at epoch 500. Best Metrics: (0.005303992927036582, 0.004114238410596027, 0.005094868437535411)
2026-05-24 08:16:26,979 - optuna.study.study - INFO - Trial 5 finished with values: [0.005303992927036582, 0.004114238410596027, 0.005094868437535411] and parameters: {'n_layers': 3, 'embedding_dim': 256, 'lr': 0.04591126977955347, 'lambda_val': 6.716174821509156e-06, 'batch_size': 1916, 'optimizer': 'SGD'}.
2026-05-24 08:16:34,606 - experiment_functions - INFO - Early stopping at epoch 500. Best Metrics: (0.005625359312693068, 0.004677152317880795, 0.0057669600033000284)
2026-05-24 08:16:34,704 - optuna.study.study - INFO - Trial 6 finished with values: [0.005625359312693068, 0.004677152317880795, 0.0057669600033000284] and parameters: {'n_layers': 4, 'embedding_dim': 128, 'lr': 0.00016501530026827272, 'lambda_val': 1.0276520732261342e-05, 'batch_size': 2907, 'optimizer': 'SGD'}.
2026-05-24 08:16:42,112 - experiment_functions - INFO - Early stopping at epoch 500. Best Metrics: (0.008112977171375203, 0.006961920529801324, 0.009038168587471179)
2026-05-24 08:16:42,208 - optuna.study.study - INFO - Trial 7 finished with values: [0.008112977171375203, 0.006961920529801324, 0.009038168587471179] and parameters: {'n_layers': 3, 'embedding_dim': 128, 'lr': 0.052503702468359205, 'lambda_val': 0.02592868535856022, 'batch_size': 2651, 'optimizer': 'RMSprop'}.
2026-05-24 08:16:50,274 - experiment_functions - INFO - Early stopping at epoch 500. Best Metrics: (0.005370809480748443, 0.004346026490066225, 0.005647024050471763)
2026-05-24 08:16:50,366 - optuna.study.study - INFO - Trial 8 finished with values: [0.005370809480748443, 0.004346026490066225, 0.005647024050471763] and parameters: {'n_layers': 3, 'embedding_dim': 256, 'lr': 7.200305403645745e-05, 'lambda_val': 0.002490268631303316, 'batch_size': 3278, 'optimizer': 'SGD'}.
2026-05-24 08:16:57,888 - experiment_functions - INFO - Early stopping at epoch 550. Best Metrics: (0.04397686711628467, 0.029081125827814566, 0.03989218137009142)
2026-05-24 08:16:57,981 - optuna.study.study - INFO - Trial 9 finished with values: [0.04397686711628467, 0.029081125827814566, 0.03989218137009142] and parameters: {'n_layers': 1, 'embedding_dim': 128, 'lr': 0.002019850627421517, 'lambda_val': 0.000621169344675621, 'batch_size': 3974, 'optimizer': 'RMSprop'}.
2026-05-24 08:17:07,737 - experiment_functions - INFO - Early stopping at epoch 650. Best Metrics: (0.01939067505126883, 0.013261589403973512, 0.01876650751239187)
2026-05-24 08:17:07,832 - optuna.study.study - INFO - Trial 10 finished with values: [0.01939067505126883, 0.013261589403973512, 0.01876650751239187] and parameters: {'n_layers': 2, 'embedding_dim': 256, 'lr': 0.019411422856209563, 'lambda_val': 0.0006001451797642537, 'batch_size': 2340, 'optimizer': 'RMSprop'}.
2026-05-24 08:17:14,425 - experiment_functions - INFO - Early stopping at epoch 500. Best Metrics: (0.005487451242139656, 0.0042549668874172185, 0.005367889618479366)
2026-05-24 08:17:14,519 - optuna.study.study - INFO - Trial 11 finished with values: [0.005487451242139656, 0.0042549668874172185, 0.005367889618479366] and parameters: {'n_layers': 3, 'embedding_dim': 32, 'lr': 0.005444060961063268, 'lambda_val': 1.7106609462734953e-06, 'batch_size': 1906, 'optimizer': 'SGD'}.
2026-05-24 08:17:56,452 - experiment_functions - INFO - Early stopping at epoch 3300. Best Metrics: (0.02218367405602068, 0.015124172185430463, 0.020495653225387274)
2026-05-24 08:17:56,553 - optuna.study.study - INFO - Trial 12 finished with values: [0.02218367405602068, 0.015124172185430463, 0.020495653225387274] and parameters: {'n_layers': 3, 'embedding_dim': 64, 'lr': 0.055428429752156186, 'lambda_val': 0.0013176857905753939, 'batch_size': 3363, 'optimizer': 'Adam'}.
2026-05-24 08:18:03,874 - experiment_functions - INFO - Early stopping at epoch 550. Best Metrics: (0.012243993456850476, 0.00876655629139073, 0.011672446703846779)
2026-05-24 08:18:04,028 - optuna.study.study - INFO - Trial 13 finished with values: [0.012243993456850476, 0.00876655629139073, 0.011672446703846779] and parameters: {'n_layers': 2, 'embedding_dim': 96, 'lr': 0.06990133049179591, 'lambda_val': 3.074765064991815e-05, 'batch_size': 1218, 'optimizer': 'Adam'}.
2026-05-24 08:18:11,865 - experiment_functions - INFO - Early stopping at epoch 600. Best Metrics: (0.014640877902550736, 0.011399006622516555, 0.014730884211847421)
2026-05-24 08:18:12,035 - optuna.study.study - INFO - Trial 14 finished with values: [0.014640877902550736, 0.011399006622516555, 0.014730884211847421] and parameters: {'n_layers': 1, 'embedding_dim': 32, 'lr': 0.05161531426586809, 'lambda_val': 0.0005144021469830869, 'batch_size': 3934, 'optimizer': 'Adam'}.
2026-05-24 08:18:31,250 - experiment_functions - INFO - Early stopping at epoch 1750. Best Metrics: (0.004875545966130128, 0.004412251655629139, 0.005349091372548329)
