2026-05-23 20:11:55,683 - optuna.study.study - INFO - Trial 46 finished with values: [0.005258170919608747, 0.00412251655629139, 0.005345166993328257] and parameters: {'n_layers': 3, 'embedding_dim': 32, 'lr': 9.192800709042832e-05, 'lambda_val': 0.03299745983062834, 'batch_size': 1194, 'optimizer': 'SGD'}.
2026-05-23 20:12:05,388 - experiment_functions - INFO - Early stopping at epoch 650. Best Metrics: (0.042462188685136355, 0.03475993377483443, 0.045754418385843904)
2026-05-23 20:12:06,658 - optuna.study.study - INFO - Trial 47 finished with values: [0.042462188685136355, 0.03475993377483443, 0.045754418385843904] and parameters: {'n_layers': 3, 'embedding_dim': 32, 'lr': 0.0016520071153732355, 'lambda_val': 0.0010344020444058599, 'batch_size': 2170, 'optimizer': 'Adam'}.
2026-05-23 20:12:55,544 - optuna.study.study - INFO - Trial 48 finished with values: [0.047974881343920785, 0.03436258278145696, 0.04756045467541156] and parameters: {'n_layers': 1, 'embedding_dim': 32, 'lr': 0.04930290302923258, 'lambda_val': 0.0014024257513921316, 'batch_size': 3810, 'optimizer': 'Adam'}.
2026-05-23 20:13:07,312 - experiment_functions - INFO - Early stopping at epoch 700. Best Metrics: (0.05443924712655816, 0.045082781456953644, 0.05699498539533066)
2026-05-23 20:13:07,552 - optuna.study.study - INFO - Trial 49 finished with values: [0.05443924712655816, 0.045082781456953644, 0.05699498539533066] and parameters: {'n_layers': 2, 'embedding_dim': 128, 'lr': 0.0007928857958215832, 'lambda_val': 0.006308703493993002, 'batch_size': 3432, 'optimizer': 'Adam'}.
2026-05-23 20:13:17,211 - experiment_functions - INFO - Early stopping at epoch 550. Best Metrics: (0.01314279588878693, 0.013783112582781459, 0.016761251264803483)
2026-05-23 20:13:17,874 - optuna.study.study - INFO - Trial 50 finished with values: [0.01314279588878693, 0.013783112582781459, 0.016761251264803483] and parameters: {'n_layers': 4, 'embedding_dim': 64, 'lr': 0.0030136909191112956, 'lambda_val': 7.066366944388039e-06, 'batch_size': 1806, 'optimizer': 'RMSprop'}.
2026-05-23 20:14:13,432 - optuna.study.study - INFO - Trial 51 finished with values: [0.04129714074110055, 0.026415562913907287, 0.03781002735871312] and parameters: {'n_layers': 2, 'embedding_dim': 64, 'lr': 0.004957869024682947, 'lambda_val': 0.00033225177792127876, 'batch_size': 4056, 'optimizer': 'RMSprop'}.
2026-05-23 20:14:23,630 - experiment_functions - INFO - Early stopping at epoch 500. Best Metrics: (0.0047320542528223805, 0.004205298013245033, 0.0052896095779430405)
2026-05-23 20:14:23,728 - optuna.study.study - INFO - Trial 52 finished with values: [0.0047320542528223805, 0.004205298013245033, 0.0052896095779430405] and parameters: {'n_layers': 2, 'embedding_dim': 256, 'lr': 6.18131098302394e-05, 'lambda_val': 0.0031382087380616343, 'batch_size': 1717, 'optimizer': 'SGD'}.
2026-05-23 20:14:30,977 - experiment_functions - INFO - Early stopping at epoch 500. Best Metrics: (0.0055648480331413125, 0.004677152317880795, 0.00594277292800026)
2026-05-23 20:14:31,094 - optuna.study.study - INFO - Trial 53 finished with values: [0.0055648480331413125, 0.004677152317880795, 0.00594277292800026] and parameters: {'n_layers': 1, 'embedding_dim': 128, 'lr': 0.00015153608406178438, 'lambda_val': 2.902517287685474e-06, 'batch_size': 576, 'optimizer': 'SGD'}.
2026-05-23 20:14:37,997 - experiment_functions - INFO - Early stopping at epoch 500. Best Metrics: (0.004918224063038291, 0.004387417218543047, 0.005228325341405194)
2026-05-23 20:14:38,078 - optuna.study.study - INFO - Trial 54 finished with values: [0.004918224063038291, 0.004387417218543047, 0.005228325341405194] and parameters: {'n_layers': 1, 'embedding_dim': 96, 'lr': 0.0011474561920151382, 'lambda_val': 0.009665452999254663, 'batch_size': 1749, 'optimizer': 'SGD'}.
2026-05-23 20:16:26,886 - optuna.study.study - INFO - Trial 55 finished with values: [0.0366678920207388, 0.021274834437086092, 0.03257810343391219] and parameters: {'n_layers': 4, 'embedding_dim': 256, 'lr': 0.004031587731005074, 'lambda_val': 0.00020136097974536503, 'batch_size': 3871, 'optimizer': 'RMSprop'}.
2026-05-23 20:16:35,209 - experiment_functions - INFO - Early stopping at epoch 550. Best Metrics: (0.047543186918165524, 0.0330794701986755, 0.05126518260675953)
2026-05-23 20:16:35,328 - optuna.study.study - INFO - Trial 56 finished with values: [0.047543186918165524, 0.0330794701986755, 0.05126518260675953] and parameters: {'n_layers': 3, 'embedding_dim': 32, 'lr': 0.004031587731005074, 'lambda_val': 2.164593457002043e-06, 'batch_size': 535, 'optimizer': 'Adam'}.
2026-05-23 20:16:58,385 - experiment_functions - INFO - Early stopping at epoch 1700. Best Metrics: (0.05146204569271245, 0.04072847682119205, 0.05618652811742496)
2026-05-23 20:16:58,486 - optuna.study.study - INFO - Trial 57 finished with values: [0.05146204569271245, 0.04072847682119205, 0.05618652811742496] and parameters: {'n_layers': 2, 'embedding_dim': 32, 'lr': 0.0003263341791003019, 'lambda_val': 0.00020272782422991494, 'batch_size': 3855, 'optimizer': 'RMSprop'}.
2026-05-23 20:17:05,182 - experiment_functions - INFO - Early stopping at epoch 500. Best Metrics: (0.00601722726088375, 0.004743377483443709, 0.006015574084457218)
2026-05-23 20:17:06,078 - optuna.study.study - INFO - Trial 58 finished with values: [0.00601722726088375, 0.004743377483443709, 0.006015574084457218] and parameters: {'n_layers': 1, 'embedding_dim': 64, 'lr': 0.00014914845032790272, 'lambda_val': 1.8384501281542316e-06, 'batch_size': 535, 'optimizer': 'SGD'}.
2026-05-23 20:17:44,283 - experiment_functions - INFO - Early stopping at epoch 2500. Best Metrics: (0.041916535389597144, 0.02531456953642385, 0.03861386386664375)
2026-05-23 20:17:44,371 - optuna.study.study - INFO - Trial 59 finished with values: [0.041916535389597144, 0.02531456953642385, 0.03861386386664375] and parameters: {'n_layers': 3, 'embedding_dim': 64, 'lr': 0.015671226158777793, 'lambda_val': 2.389568370721752e-06, 'batch_size': 2307, 'optimizer': 'RMSprop'}.
2026-05-23 20:17:54,698 - experiment_functions - INFO - Early stopping at epoch 600. Best Metrics: (0.0693382693912844, 0.051721854304635766, 0.07086787327661509)
2026-05-23 20:17:54,883 - optuna.study.study - INFO - Trial 60 finished with values: [0.0693382693912844, 0.051721854304635766, 0.07086787327661509] and parameters: {'n_layers': 1, 'embedding_dim': 256, 'lr': 0.004031587731005074, 'lambda_val': 0.00020136097974536503, 'batch_size': 886, 'optimizer': 'Adam'}.
2026-05-23 20:18:06,079 - experiment_functions - INFO - Early stopping at epoch 700. Best Metrics: (0.0577983809077991, 0.044403973509933775, 0.05918317708042931)
2026-05-23 20:18:06,599 - optuna.study.study - INFO - Trial 61 finished with values: [0.0577983809077991, 0.044403973509933775, 0.05918317708042931] and parameters: {'n_layers': 2, 'embedding_dim': 96, 'lr': 0.0007928857958215832, 'lambda_val': 0.0007535837355673727, 'batch_size': 3432, 'optimizer': 'Adam'}.
2026-05-23 20:18:13,376 - experiment_functions - INFO - Early stopping at epoch 500. Best Metrics: (0.004915482695589079, 0.004470198675496689, 0.0054242077970408625)
2026-05-23 20:18:13,461 - optuna.study.study - INFO - Trial 62 finished with values: [0.004915482695589079, 0.004470198675496689, 0.0054242077970408625] and parameters: {'n_layers': 1, 'embedding_dim': 96, 'lr': 0.0017156725595772319, 'lambda_val': 7.959683440448575e-06, 'batch_size': 1136, 'optimizer': 'SGD'}.
2026-05-23 20:18:39,266 - experiment_functions - INFO - Early stopping at epoch 1550. Best Metrics: (0.0807235847967591, 0.06022350993377484, 0.08345630786695046)
2026-05-23 20:18:39,336 - optuna.study.study - INFO - Trial 63 finished with values: [0.0807235847967591, 0.06022350993377484, 0.08345630786695046] and parameters: {'n_layers': 1, 'embedding_dim': 256, 'lr': 0.0006825513923366329, 'lambda_val': 1.0132645475196796e-05, 'batch_size': 808, 'optimizer': 'Adam'}.
2026-05-23 20:18:54,982 - experiment_functions - INFO - Early stopping at epoch 550. Best Metrics: (0.0309903556373351, 0.025562913907284768, 0.032152794060418856)
2026-05-23 20:18:55,738 - optuna.study.study - INFO - Trial 64 finished with values: [0.0309903556373351, 0.025562913907284768, 0.032152794060418856] and parameters: {'n_layers': 4, 'embedding_dim': 256, 'lr': 0.0006364863581346661, 'lambda_val': 0.0011279556330319215, 'batch_size': 1883, 'optimizer': 'RMSprop'}.
2026-05-23 20:19:09,167 - experiment_functions - INFO - Early stopping at epoch 950. Best Metrics: (0.0697112879779713, 0.05436258278145695, 0.07390338020408375)
2026-05-23 20:19:09,257 - optuna.study.study - INFO - Trial 65 finished with values: [0.0697112879779713, 0.05436258278145695, 0.07390338020408375] and parameters: {'n_layers': 1, 'embedding_dim': 96, 'lr': 0.0006825513923366329, 'lambda_val': 0.0068325191706043835, 'batch_size': 2875, 'optimizer': 'Adam'}.
2026-05-23 20:19:20,014 - experiment_functions - INFO - Early stopping at epoch 750. Best Metrics: (0.08381694640528811, 0.06100165562913907, 0.08439011015262818)
2026-05-23 20:19:20,315 - optuna.study.study - INFO - Trial 66 finished with values: [0.08381694640528811, 0.06100165562913907, 0.08439011015262818] and parameters: {'n_layers': 1, 'embedding_dim': 96, 'lr': 0.001325452189730596, 'lambda_val': 0.0053912262075664795, 'batch_size': 2307, 'optimizer': 'Adam'}.
2026-05-23 20:19:56,271 - experiment_functions - INFO - Early stopping at epoch 2500. Best Metrics: (0.02256678368596336, 0.020355960264900667, 0.02541038704348661)
2026-05-23 20:19:56,558 - optuna.study.study - INFO - Trial 67 finished with values: [0.02256678368596336, 0.020355960264900667, 0.02541038704348661] and parameters: {'n_layers': 2, 'embedding_dim': 96, 'lr': 0.027675232645284698, 'lambda_val': 0.011324622699682792, 'batch_size': 1491, 'optimizer': 'Adam'}.
2026-05-23 20:20:21,303 - experiment_functions - INFO - Early stopping at epoch 2000. Best Metrics: (0.005207847591346525, 0.004528145695364238, 0.005373606555008276)
2026-05-23 20:20:21,386 - optuna.study.study - INFO - Trial 68 finished with values: [0.005207847591346525, 0.004528145695364238, 0.005373606555008276] and parameters: {'n_layers': 1, 'embedding_dim': 96, 'lr': 2.3779042565821365e-05, 'lambda_val': 1.475751878769183e-05, 'batch_size': 2383, 'optimizer': 'Adam'}.
2026-05-23 20:20:39,295 - experiment_functions - INFO - Early stopping at epoch 1300. Best Metrics: (0.05146041168334902, 0.03422185430463576, 0.04934112382912477)
2026-05-23 20:20:39,370 - optuna.study.study - INFO - Trial 69 finished with values: [0.05146041168334902, 0.03422185430463576, 0.04934112382912477] and parameters: {'n_layers': 1, 'embedding_dim': 96, 'lr': 0.0125220440110221, 'lambda_val': 2.902517287685474e-06, 'batch_size': 3583, 'optimizer': 'Adam'}.
2026-05-23 20:20:53,589 - experiment_functions - INFO - Early stopping at epoch 500. Best Metrics: (0.005380197042507738, 0.004586092715231789, 0.005721533944376814)
2026-05-23 20:20:53,899 - optuna.study.study - INFO - Trial 70 finished with values: [0.005380197042507738, 0.004586092715231789, 0.005721533944376814] and parameters: {'n_layers': 4, 'embedding_dim': 256, 'lr': 8.596213801669404e-05, 'lambda_val': 0.0578557862812087, 'batch_size': 886, 'optimizer': 'Adam'}.
2026-05-23 20:21:30,923 - experiment_functions - INFO - Early stopping at epoch 2700. Best Metrics: (0.0363288506930332, 0.02447847682119205, 0.034935894092041404)
2026-05-23 20:21:31,005 - optuna.study.study - INFO - Trial 71 finished with values: [0.0363288506930332, 0.02447847682119205, 0.034935894092041404] and parameters: {'n_layers': 3, 'embedding_dim': 32, 'lr': 0.0125220440110221, 'lambda_val': 1.1656929797027377e-06, 'batch_size': 2484, 'optimizer': 'RMSprop'}.
2026-05-23 20:21:38,334 - experiment_functions - INFO - Early stopping at epoch 550. Best Metrics: (0.004774796474276434, 0.004428807947019868, 0.005468495121107294)
2026-05-23 20:21:38,863 - optuna.study.study - INFO - Trial 72 finished with values: [0.004774796474276434, 0.004428807947019868, 0.005468495121107294] and parameters: {'n_layers': 1, 'embedding_dim': 64, 'lr': 6.500774244472847e-05, 'lambda_val': 0.0014024257513921316, 'batch_size': 2576, 'optimizer': 'Adam'}.
2026-05-23 20:21:55,248 - experiment_functions - INFO - Early stopping at epoch 1150. Best Metrics: (0.037930129794426636, 0.030579470198675494, 0.04013881719016917)
2026-05-23 20:21:55,416 - optuna.study.study - INFO - Trial 73 finished with values: [0.037930129794426636, 0.030579470198675494, 0.04013881719016917] and parameters: {'n_layers': 3, 'embedding_dim': 32, 'lr': 0.0003263341791003019, 'lambda_val': 9.967237674188096e-06, 'batch_size': 3551, 'optimizer': 'Adam'}.
2026-05-23 20:23:13,538 - optuna.study.study - INFO - Trial 74 finished with values: [0.04337639550422139, 0.02457781456953642, 0.039302867198996144] and parameters: {'n_layers': 2, 'embedding_dim': 256, 'lr': 0.04930290302923258, 'lambda_val': 0.00033225177792127876, 'batch_size': 3810, 'optimizer': 'Adam'}.
2026-05-23 20:24:24,231 - optuna.study.study - INFO - Trial 75 finished with values: [0.04811671297143697, 0.03624172185430464, 0.04898475532607114] and parameters: {'n_layers': 3, 'embedding_dim': 128, 'lr': 0.00011254798405562515, 'lambda_val': 7.066366944388039e-06, 'batch_size': 1806, 'optimizer': 'RMSprop'}.
2026-05-23 20:24:55,720 - experiment_functions - INFO - Early stopping at epoch 1900. Best Metrics: (0.03797018358377744, 0.031266556291390725, 0.03999723245138083)
2026-05-23 20:24:55,804 - optuna.study.study - INFO - Trial 76 finished with values: [0.03797018358377744, 0.031266556291390725, 0.03999723245138083] and parameters: {'n_layers': 3, 'embedding_dim': 96, 'lr': 0.0001722725114045167, 'lambda_val': 1.9749953262260743e-06, 'batch_size': 3552, 'optimizer': 'Adam'}.
2026-05-23 20:25:04,510 - experiment_functions - INFO - Early stopping at epoch 600. Best Metrics: (0.08023018317905752, 0.05680463576158941, 0.08263995761812688)
2026-05-23 20:25:04,601 - optuna.study.study - INFO - Trial 77 finished with values: [0.08023018317905752, 0.05680463576158941, 0.08263995761812688] and parameters: {'n_layers': 1, 'embedding_dim': 96, 'lr': 0.004184026134455368, 'lambda_val': 0.0007535837355673727, 'batch_size': 833, 'optimizer': 'Adam'}.
2026-05-23 20:25:24,762 - experiment_functions - INFO - Early stopping at epoch 1000. Best Metrics: (0.059111560862325795, 0.04513245033112583, 0.05958033301494167)
2026-05-23 20:25:25,090 - optuna.study.study - INFO - Trial 78 finished with values: [0.059111560862325795, 0.04513245033112583, 0.05958033301494167] and parameters: {'n_layers': 2, 'embedding_dim': 256, 'lr': 0.0003263341791003019, 'lambda_val': 0.00020272782422991494, 'batch_size': 2638, 'optimizer': 'Adam'}.
2026-05-23 20:25:33,954 - experiment_functions - INFO - Early stopping at epoch 550. Best Metrics: (0.037893726340753074, 0.032715231788079474, 0.03973689803087251)
2026-05-23 20:25:34,113 - optuna.study.study - INFO - Trial 79 finished with values: [0.037893726340753074, 0.032715231788079474, 0.03973689803087251] and parameters: {'n_layers': 2, 'embedding_dim': 96, 'lr': 0.0011822260534256749, 'lambda_val': 0.005788887427170339, 'batch_size': 3754, 'optimizer': 'RMSprop'}.
2026-05-23 20:26:22,816 - optuna.study.study - INFO - Trial 80 finished with values: [0.00794593312295353, 0.00728476821192053, 0.008917278289488177] and parameters: {'n_layers': 1, 'embedding_dim': 96, 'lr': 0.00012551344524157088, 'lambda_val': 0.0018306388815656402, 'batch_size': 1783, 'optimizer': 'RMSprop'}.
2026-05-23 20:26:34,738 - experiment_functions - INFO - Early stopping at epoch 550. Best Metrics: (0.06164438797204373, 0.046233443708609274, 0.06196968986587304)
2026-05-23 20:26:34,819 - optuna.study.study - INFO - Trial 81 finished with values: [0.06164438797204373, 0.046233443708609274, 0.06196968986587304] and parameters: {'n_layers': 2, 'embedding_dim': 256, 'lr': 0.00297054913770236, 'lambda_val': 0.0006933074309064735, 'batch_size': 3999, 'optimizer': 'Adam'}.
2026-05-23 20:26:47,953 - experiment_functions - INFO - Early stopping at epoch 750. Best Metrics: (0.06696598571008786, 0.050778145695364235, 0.0688958779839672)
2026-05-23 20:26:48,051 - optuna.study.study - INFO - Trial 82 finished with values: [0.06696598571008786, 0.050778145695364235, 0.0688958779839672] and parameters: {'n_layers': 1, 'embedding_dim': 256, 'lr': 0.0006825513923366329, 'lambda_val': 1.207883913872658e-06, 'batch_size': 2902, 'optimizer': 'RMSprop'}.
2026-05-23 20:26:58,046 - experiment_functions - INFO - Early stopping at epoch 550. Best Metrics: (0.016788766489924833, 0.01788907284768212, 0.02071522917413391)
2026-05-23 20:26:58,750 - optuna.study.study - INFO - Trial 83 finished with values: [0.016788766489924833, 0.01788907284768212, 0.02071522917413391] and parameters: {'n_layers': 3, 'embedding_dim': 96, 'lr': 0.0016520071153732355, 'lambda_val': 0.0010344020444058599, 'batch_size': 3400, 'optimizer': 'RMSprop'}.
2026-05-23 20:27:47,176 - experiment_functions - INFO - Early stopping at epoch 3600. Best Metrics: (0.004900403896050117, 0.0044950331125827815, 0.005633108182808041)
2026-05-23 20:27:47,260 - optuna.study.study - INFO - Trial 84 finished with values: [0.004900403896050117, 0.0044950331125827815, 0.005633108182808041] and parameters: {'n_layers': 2, 'embedding_dim': 64, 'lr': 1.723093560428365e-05, 'lambda_val': 1.826718502308613e-05, 'batch_size': 3803, 'optimizer': 'Adam'}.
2026-05-23 20:28:12,682 - experiment_functions - INFO - Early stopping at epoch 1700. Best Metrics: (0.08171386337292874, 0.057822847682119205, 0.08508290708603042)
2026-05-23 20:28:13,720 - optuna.study.study - INFO - Trial 85 finished with values: [0.08171386337292874, 0.057822847682119205, 0.08508290708603042] and parameters: {'n_layers': 2, 'embedding_dim': 64, 'lr': 0.00045141578622738895, 'lambda_val': 2.3420359615170988e-05, 'batch_size': 886, 'optimizer': 'Adam'}.
2026-05-23 20:28:28,716 - experiment_functions - INFO - Early stopping at epoch 800. Best Metrics: (0.0058908889596528445, 0.004892384105960265, 0.006380380632160243)
2026-05-23 20:28:28,808 - optuna.study.study - INFO - Trial 86 finished with values: [0.0058908889596528445, 0.004892384105960265, 0.006380380632160243] and parameters: {'n_layers': 4, 'embedding_dim': 96, 'lr': 0.023789682142433273, 'lambda_val': 0.0018306388815656402, 'batch_size': 1783, 'optimizer': 'SGD'}.
2026-05-23 20:29:24,178 - optuna.study.study - INFO - Trial 87 finished with values: [0.059789668479187125, 0.04721854304635762, 0.06007996729827197] and parameters: {'n_layers': 2, 'embedding_dim': 32, 'lr': 0.00021404168897179706, 'lambda_val': 0.0053912262075664795, 'batch_size': 2307, 'optimizer': 'RMSprop'}.
2026-05-23 20:30:25,884 - optuna.study.study - INFO - Trial 88 finished with values: [0.0513324077520846, 0.0289817880794702, 0.045176267414670464] and parameters: {'n_layers': 2, 'embedding_dim': 96, 'lr': 0.0125220440110221, 'lambda_val': 0.00017143103585193984, 'batch_size': 2484, 'optimizer': 'RMSprop'}.
2026-05-23 20:30:51,008 - experiment_functions - INFO - Early stopping at epoch 1450. Best Metrics: (0.04000482675096638, 0.030852649006622514, 0.04053868734483745)
2026-05-23 20:30:51,110 - optuna.study.study - INFO - Trial 89 finished with values: [0.04000482675096638, 0.030852649006622514, 0.04053868734483745] and parameters: {'n_layers': 4, 'embedding_dim': 64, 'lr': 0.00022905061620751807, 'lambda_val': 1.826718502308613e-05, 'batch_size': 2358, 'optimizer': 'Adam'}.
2026-05-23 20:31:55,528 - optuna.study.study - INFO - Trial 90 finished with values: [0.07913186320803269, 0.05822847682119206, 0.08145705159538072] and parameters: {'n_layers': 1, 'embedding_dim': 256, 'lr': 0.00045141578622738895, 'lambda_val': 0.0007535837355673727, 'batch_size': 576, 'optimizer': 'Adam'}.
2026-05-23 20:32:05,908 - experiment_functions - INFO - Early stopping at epoch 500. Best Metrics: (0.005718348497711544, 0.0045778145695364245, 0.005422216076593315)
2026-05-23 20:32:06,007 - optuna.study.study - INFO - Trial 91 finished with values: [0.005718348497711544, 0.0045778145695364245, 0.005422216076593315] and parameters: {'n_layers': 2, 'embedding_dim': 256, 'lr': 0.00025039915375273683, 'lambda_val': 0.00020136097974536503, 'batch_size': 535, 'optimizer': 'SGD'}.
2026-05-23 20:32:33,565 - experiment_functions - INFO - Early stopping at epoch 1750. Best Metrics: (0.024635198652759767, 0.02339403973509934, 0.02976039355403056)
2026-05-23 20:32:33,655 - optuna.study.study - INFO - Trial 92 finished with values: [0.024635198652759767, 0.02339403973509934, 0.02976039355403056] and parameters: {'n_layers': 1, 'embedding_dim': 256, 'lr': 0.023789682142433273, 'lambda_val': 0.021157307876022, 'batch_size': 1783, 'optimizer': 'RMSprop'}.
2026-05-23 20:33:45,471 - optuna.study.study - INFO - Trial 93 finished with values: [0.03850326923516901, 0.023087748344370863, 0.03418671025745761] and parameters: {'n_layers': 3, 'embedding_dim': 128, 'lr': 0.008795634295118489, 'lambda_val': 6.766531257910007e-05, 'batch_size': 1668, 'optimizer': 'Adam'}.
2026-05-23 20:35:18,374 - optuna.study.study - INFO - Trial 94 finished with values: [0.03727091683356918, 0.02521523178807947, 0.03567484979965964] and parameters: {'n_layers': 3, 'embedding_dim': 256, 'lr': 0.0030136909191112956, 'lambda_val': 2.3420359615170988e-05, 'batch_size': 1806, 'optimizer': 'RMSprop'}.
2026-05-23 20:35:46,028 - experiment_functions - INFO - Early stopping at epoch 1550. Best Metrics: (0.007305293710988889, 0.009991721854304638, 0.010731059716951907)
