2026-05-24 00:26:37,443 - optuna.study.study - INFO - Trial 115 finished with values: [0.020911537502942272, 0.016821192052980133, 0.022397244043860055] and parameters: {'n_layers': 3, 'embedding_dim': 32, 'lr': 0.00037394670395286464, 'lambda_val': 0.014393132529370842, 'batch_size': 2049, 'optimizer': 'Adam'}.
2026-05-24 00:26:44,547 - experiment_functions - INFO - Early stopping at epoch 550. Best Metrics: (0.017935151990588805, 0.015165562913907284, 0.019272070930230895)
2026-05-24 00:26:45,448 - optuna.study.study - INFO - Trial 116 finished with values: [0.017935151990588805, 0.015165562913907284, 0.019272070930230895] and parameters: {'n_layers': 4, 'embedding_dim': 128, 'lr': 0.0019645778545903164, 'lambda_val': 0.0019340508111572378, 'batch_size': 1047, 'optimizer': 'RMSprop'}.
2026-05-24 00:26:52,543 - experiment_functions - INFO - Early stopping at epoch 600. Best Metrics: (0.022573578082937657, 0.017259933774834438, 0.0232561326385841)
2026-05-24 00:26:52,638 - optuna.study.study - INFO - Trial 117 finished with values: [0.022573578082937657, 0.017259933774834438, 0.0232561326385841] and parameters: {'n_layers': 3, 'embedding_dim': 64, 'lr': 0.0014918556660024908, 'lambda_val': 0.0011861252157314979, 'batch_size': 1047, 'optimizer': 'RMSprop'}.
2026-05-24 00:27:10,928 - experiment_functions - INFO - Early stopping at epoch 1700. Best Metrics: (0.017343400030659532, 0.013046357615894039, 0.017397911022153833)
2026-05-24 00:27:11,061 - optuna.study.study - INFO - Trial 118 finished with values: [0.017343400030659532, 0.013046357615894039, 0.017397911022153833] and parameters: {'n_layers': 2, 'embedding_dim': 128, 'lr': 0.00037394670395286464, 'lambda_val': 2.356034595653627e-06, 'batch_size': 2304, 'optimizer': 'Adam'}.
2026-05-24 00:27:20,558 - experiment_functions - INFO - Early stopping at epoch 850. Best Metrics: (0.021334187527351653, 0.014395695364238409, 0.0205021173205942)
2026-05-24 00:27:21,431 - optuna.study.study - INFO - Trial 119 finished with values: [0.021334187527351653, 0.014395695364238409, 0.0205021173205942] and parameters: {'n_layers': 1, 'embedding_dim': 32, 'lr': 0.0011608542213191663, 'lambda_val': 0.001970520642014681, 'batch_size': 1672, 'optimizer': 'Adam'}.
2026-05-24 00:27:27,550 - experiment_functions - INFO - Early stopping at epoch 500. Best Metrics: (0.007532511883874107, 0.006117549668874173, 0.007640725433271286)
2026-05-24 00:27:27,842 - optuna.study.study - INFO - Trial 120 finished with values: [0.007532511883874107, 0.006117549668874173, 0.007640725433271286] and parameters: {'n_layers': 3, 'embedding_dim': 64, 'lr': 0.039933894234812056, 'lambda_val': 0.014393132529370842, 'batch_size': 3694, 'optimizer': 'RMSprop'}.
2026-05-24 00:27:34,424 - experiment_functions - INFO - Early stopping at epoch 550. Best Metrics: (0.019164270854235062, 0.014296357615894038, 0.019412968825506312)
2026-05-24 00:27:34,503 - optuna.study.study - INFO - Trial 121 finished with values: [0.019164270854235062, 0.014296357615894038, 0.019412968825506312] and parameters: {'n_layers': 3, 'embedding_dim': 64, 'lr': 0.0075495298955876545, 'lambda_val': 0.000258912702244631, 'batch_size': 1513, 'optimizer': 'Adam'}.
2026-05-24 00:27:41,693 - experiment_functions - INFO - Early stopping at epoch 600. Best Metrics: (0.01832757468061088, 0.012864238410596028, 0.01810992223351143)
2026-05-24 00:27:41,774 - optuna.study.study - INFO - Trial 122 finished with values: [0.01832757468061088, 0.012864238410596028, 0.01810992223351143] and parameters: {'n_layers': 2, 'embedding_dim': 64, 'lr': 0.0034624350757776097, 'lambda_val': 0.001970520642014681, 'batch_size': 1368, 'optimizer': 'Adam'}.
2026-05-24 00:27:48,921 - experiment_functions - INFO - Early stopping at epoch 600. Best Metrics: (0.01860191474281208, 0.014329470198675498, 0.019082596441447875)
2026-05-24 00:27:48,994 - optuna.study.study - INFO - Trial 123 finished with values: [0.01860191474281208, 0.014329470198675498, 0.019082596441447875] and parameters: {'n_layers': 3, 'embedding_dim': 64, 'lr': 0.0034624350757776097, 'lambda_val': 0.001970520642014681, 'batch_size': 1672, 'optimizer': 'Adam'}.
2026-05-24 00:27:58,180 - experiment_functions - INFO - Early stopping at epoch 800. Best Metrics: (0.02200656110712453, 0.016978476821192055, 0.022739409874215816)
2026-05-24 00:27:58,384 - optuna.study.study - INFO - Trial 124 finished with values: [0.02200656110712453, 0.016978476821192055, 0.022739409874215816] and parameters: {'n_layers': 3, 'embedding_dim': 32, 'lr': 0.0009603867550939608, 'lambda_val': 0.012312281188503879, 'batch_size': 1672, 'optimizer': 'Adam'}.
2026-05-24 00:28:05,446 - experiment_functions - INFO - Early stopping at epoch 600. Best Metrics: (0.016223889040487768, 0.012466887417218546, 0.016621596525889928)
2026-05-24 00:28:05,537 - optuna.study.study - INFO - Trial 125 finished with values: [0.016223889040487768, 0.012466887417218546, 0.016621596525889928] and parameters: {'n_layers': 3, 'embedding_dim': 32, 'lr': 0.002281616661023266, 'lambda_val': 0.014393132529370842, 'batch_size': 3816, 'optimizer': 'Adam'}.
2026-05-24 00:28:12,251 - experiment_functions - INFO - Early stopping at epoch 550. Best Metrics: (0.01794818508580605, 0.012607615894039735, 0.017746215436721943)
2026-05-24 00:28:12,358 - optuna.study.study - INFO - Trial 126 finished with values: [0.01794818508580605, 0.012607615894039735, 0.017746215436721943] and parameters: {'n_layers': 1, 'embedding_dim': 128, 'lr': 0.007418507936625942, 'lambda_val': 2.016080555024451e-06, 'batch_size': 648, 'optimizer': 'Adam'}.
2026-05-24 00:28:52,311 - optuna.study.study - INFO - Trial 127 finished with values: [0.010582183769707789, 0.00808774834437086, 0.010820637839997167] and parameters: {'n_layers': 2, 'embedding_dim': 128, 'lr': 8.44616289055697e-05, 'lambda_val': 2.1584212621107985e-06, 'batch_size': 1145, 'optimizer': 'Adam'}.
2026-05-24 00:29:08,322 - experiment_functions - INFO - Early stopping at epoch 1450. Best Metrics: (0.023209692869277713, 0.018228476821192052, 0.024579374484236517)
2026-05-24 00:29:08,630 - optuna.study.study - INFO - Trial 128 finished with values: [0.023209692869277713, 0.018228476821192052, 0.024579374484236517] and parameters: {'n_layers': 4, 'embedding_dim': 64, 'lr': 0.00036341523831303154, 'lambda_val': 0.0019340508111572378, 'batch_size': 1439, 'optimizer': 'RMSprop'}.
2026-05-24 00:29:48,966 - optuna.study.study - INFO - Trial 129 finished with values: [0.019721610120294903, 0.014072847682119206, 0.019588224176878465] and parameters: {'n_layers': 2, 'embedding_dim': 96, 'lr': 0.00036341523831303154, 'lambda_val': 0.0013089325113607559, 'batch_size': 648, 'optimizer': 'Adam'}.
2026-05-24 00:29:58,650 - experiment_functions - INFO - Early stopping at epoch 850. Best Metrics: (0.016095131224447775, 0.012086092715231788, 0.016729644656918296)
2026-05-24 00:29:58,931 - optuna.study.study - INFO - Trial 130 finished with values: [0.016095131224447775, 0.012086092715231788, 0.016729644656918296] and parameters: {'n_layers': 2, 'embedding_dim': 128, 'lr': 0.0007988736084506005, 'lambda_val': 7.458121457299012e-06, 'batch_size': 2478, 'optimizer': 'Adam'}.
2026-05-24 00:30:11,998 - experiment_functions - INFO - Early stopping at epoch 1100. Best Metrics: (0.021170983103063902, 0.016506622516556293, 0.021675487820105664)
2026-05-24 00:30:12,081 - optuna.study.study - INFO - Trial 131 finished with values: [0.021170983103063902, 0.016506622516556293, 0.021675487820105664] and parameters: {'n_layers': 4, 'embedding_dim': 96, 'lr': 0.00036341523831303154, 'lambda_val': 0.0019340508111572378, 'batch_size': 2078, 'optimizer': 'RMSprop'}.
2026-05-24 00:30:23,851 - experiment_functions - INFO - Early stopping at epoch 1100. Best Metrics: (0.011203851089739043, 0.00896523178807947, 0.011345170607984708)
2026-05-24 00:30:23,938 - optuna.study.study - INFO - Trial 132 finished with values: [0.011203851089739043, 0.00896523178807947, 0.011345170607984708] and parameters: {'n_layers': 1, 'embedding_dim': 64, 'lr': 0.0008129182482291749, 'lambda_val': 0.06649097652898797, 'batch_size': 947, 'optimizer': 'Adam'}.
2026-05-24 00:31:03,299 - experiment_functions - INFO - Early stopping at epoch 3950. Best Metrics: (0.020551397001370732, 0.015198675496688744, 0.021319840421049483)
2026-05-24 00:31:03,381 - optuna.study.study - INFO - Trial 133 finished with values: [0.020551397001370732, 0.015198675496688744, 0.021319840421049483] and parameters: {'n_layers': 2, 'embedding_dim': 32, 'lr': 0.00037394670395286464, 'lambda_val': 0.014393132529370842, 'batch_size': 1410, 'optimizer': 'Adam'}.
2026-05-24 00:31:11,151 - experiment_functions - INFO - Early stopping at epoch 700. Best Metrics: (0.020637790934109067, 0.01702814569536424, 0.021321823480764838)
2026-05-24 00:31:11,248 - optuna.study.study - INFO - Trial 134 finished with values: [0.020637790934109067, 0.01702814569536424, 0.021321823480764838] and parameters: {'n_layers': 4, 'embedding_dim': 32, 'lr': 0.0010358017727309806, 'lambda_val': 0.04990172064077824, 'batch_size': 2806, 'optimizer': 'Adam'}.
2026-05-24 00:31:19,945 - experiment_functions - INFO - Early stopping at epoch 750. Best Metrics: (0.019343629285093946, 0.014114238410596027, 0.01952374757698391)
2026-05-24 00:31:20,031 - optuna.study.study - INFO - Trial 135 finished with values: [0.019343629285093946, 0.014114238410596027, 0.01952374757698391] and parameters: {'n_layers': 2, 'embedding_dim': 128, 'lr': 0.0014918556660024908, 'lambda_val': 0.0001780893612713799, 'batch_size': 1047, 'optimizer': 'Adam'}.
2026-05-24 00:31:31,051 - experiment_functions - INFO - Early stopping at epoch 950. Best Metrics: (0.017704917207355852, 0.01472682119205298, 0.01865765009403238)
2026-05-24 00:31:31,666 - optuna.study.study - INFO - Trial 136 finished with values: [0.017704917207355852, 0.01472682119205298, 0.01865765009403238] and parameters: {'n_layers': 3, 'embedding_dim': 128, 'lr': 0.0006541077805531833, 'lambda_val': 0.014393132529370842, 'batch_size': 900, 'optimizer': 'Adam'}.
2026-05-24 00:31:48,744 - experiment_functions - INFO - Early stopping at epoch 1600. Best Metrics: (0.018557430647223608, 0.013211920529801326, 0.018556876985478303)
2026-05-24 00:31:49,272 - optuna.study.study - INFO - Trial 137 finished with values: [0.018557430647223608, 0.013211920529801326, 0.018556876985478303] and parameters: {'n_layers': 2, 'embedding_dim': 96, 'lr': 0.0003602499380989214, 'lambda_val': 4.0551073365180215e-06, 'batch_size': 2049, 'optimizer': 'Adam'}.
2026-05-24 00:32:30,437 - optuna.study.study - INFO - Trial 138 finished with values: [0.014331914463926539, 0.010794701986754964, 0.01427560350254919] and parameters: {'n_layers': 3, 'embedding_dim': 64, 'lr': 0.00010244033455774707, 'lambda_val': 2.356034595653627e-06, 'batch_size': 3488, 'optimizer': 'Adam'}.
2026-05-24 00:33:12,644 - optuna.study.study - INFO - Trial 139 finished with values: [0.022037489186402175, 0.01620860927152318, 0.022019459240440596] and parameters: {'n_layers': 3, 'embedding_dim': 32, 'lr': 0.00037394670395286464, 'lambda_val': 0.0019340508111572378, 'batch_size': 1672, 'optimizer': 'RMSprop'}.
2026-05-24 00:33:25,873 - experiment_functions - INFO - Early stopping at epoch 1200. Best Metrics: (0.02445714695659091, 0.019230132450331127, 0.02554434068282618)
2026-05-24 00:33:25,961 - optuna.study.study - INFO - Trial 140 finished with values: [0.02445714695659091, 0.019230132450331127, 0.02554434068282618] and parameters: {'n_layers': 3, 'embedding_dim': 32, 'lr': 0.0005555935556782479, 'lambda_val': 0.04990172064077824, 'batch_size': 947, 'optimizer': 'Adam'}.
2026-05-24 00:33:35,374 - experiment_functions - INFO - Early stopping at epoch 850. Best Metrics: (0.005669600708669455, 0.005769867549668874, 0.006611653552530413)
2026-05-24 00:33:35,536 - optuna.study.study - INFO - Trial 141 finished with values: [0.005669600708669455, 0.005769867549668874, 0.006611653552530413] and parameters: {'n_layers': 2, 'embedding_dim': 128, 'lr': 0.007270486947253559, 'lambda_val': 0.02308568194072322, 'batch_size': 1396, 'optimizer': 'RMSprop'}.
2026-05-24 00:33:44,710 - experiment_functions - INFO - Early stopping at epoch 600. Best Metrics: (0.015044459026743236, 0.013079470198675497, 0.015946210979769972)
2026-05-24 00:33:44,774 - optuna.study.study - INFO - Trial 142 finished with values: [0.015044459026743236, 0.013079470198675497, 0.015946210979769972] and parameters: {'n_layers': 3, 'embedding_dim': 64, 'lr': 0.002281616661023266, 'lambda_val': 0.04990172064077824, 'batch_size': 3475, 'optimizer': 'Adam'}.
2026-05-24 00:33:55,706 - experiment_functions - INFO - Early stopping at epoch 1000. Best Metrics: (0.016548102940971293, 0.014379139072847684, 0.017401252845504065)
2026-05-24 00:33:57,294 - optuna.study.study - INFO - Trial 143 finished with values: [0.016548102940971293, 0.014379139072847684, 0.017401252845504065] and parameters: {'n_layers': 3, 'embedding_dim': 96, 'lr': 0.0006541077805531833, 'lambda_val': 0.0363308237591565, 'batch_size': 841, 'optimizer': 'Adam'}.
2026-05-24 00:34:12,682 - experiment_functions - INFO - Early stopping at epoch 1450. Best Metrics: (0.020549004343994332, 0.01639072847682119, 0.021492730518406094)
2026-05-24 00:34:13,927 - optuna.study.study - INFO - Trial 144 finished with values: [0.020549004343994332, 0.01639072847682119, 0.021492730518406094] and parameters: {'n_layers': 3, 'embedding_dim': 32, 'lr': 0.00037394670395286464, 'lambda_val': 0.014393132529370842, 'batch_size': 2478, 'optimizer': 'Adam'}.
2026-05-24 00:34:27,311 - experiment_functions - INFO - Early stopping at epoch 1200. Best Metrics: (0.01697828621004685, 0.01396523178807947, 0.017954594794220895)
2026-05-24 00:34:27,386 - optuna.study.study - INFO - Trial 145 finished with values: [0.01697828621004685, 0.01396523178807947, 0.017954594794220895] and parameters: {'n_layers': 3, 'embedding_dim': 96, 'lr': 0.00037394670395286464, 'lambda_val': 0.014393132529370842, 'batch_size': 1938, 'optimizer': 'Adam'}.
2026-05-24 00:34:33,944 - experiment_functions - INFO - Early stopping at epoch 550. Best Metrics: (0.013609334214060152, 0.010140728476821192, 0.01352334071069401)
2026-05-24 00:34:34,030 - optuna.study.study - INFO - Trial 146 finished with values: [0.013609334214060152, 0.010140728476821192, 0.01352334071069401] and parameters: {'n_layers': 1, 'embedding_dim': 64, 'lr': 0.012010252901048768, 'lambda_val': 0.00025938518502632895, 'batch_size': 1368, 'optimizer': 'RMSprop'}.
2026-05-24 00:34:44,490 - experiment_functions - INFO - Early stopping at epoch 900. Best Metrics: (0.017811768562152972, 0.014619205298013244, 0.018948325651042864)
2026-05-24 00:34:45,153 - optuna.study.study - INFO - Trial 147 finished with values: [0.017811768562152972, 0.014619205298013244, 0.018948325651042864] and parameters: {'n_layers': 3, 'embedding_dim': 128, 'lr': 0.0006541077805531833, 'lambda_val': 0.012312281188503879, 'batch_size': 947, 'optimizer': 'Adam'}.
2026-05-24 00:34:52,124 - experiment_functions - INFO - Early stopping at epoch 550. Best Metrics: (0.017405637150868857, 0.014925496688741723, 0.019046690906554753)
2026-05-24 00:34:52,593 - optuna.study.study - INFO - Trial 148 finished with values: [0.017405637150868857, 0.014925496688741723, 0.019046690906554753] and parameters: {'n_layers': 4, 'embedding_dim': 96, 'lr': 0.001293588669347129, 'lambda_val': 0.0019340508111572378, 'batch_size': 3674, 'optimizer': 'RMSprop'}.
2026-05-24 00:34:59,176 - experiment_functions - INFO - Early stopping at epoch 550. Best Metrics: (0.011864692537224844, 0.009817880794701988, 0.011944849847915391)
2026-05-24 00:34:59,254 - optuna.study.study - INFO - Trial 149 finished with values: [0.011864692537224844, 0.009817880794701988, 0.011944849847915391] and parameters: {'n_layers': 2, 'embedding_dim': 128, 'lr': 0.007270486947253559, 'lambda_val': 0.012312281188503879, 'batch_size': 2171, 'optimizer': 'Adam'}.
2026-05-24 00:35:07,663 - experiment_functions - INFO - Early stopping at epoch 700. Best Metrics: (0.019232659851262393, 0.014917218543046357, 0.019901979299132396)
2026-05-24 00:35:07,765 - optuna.study.study - INFO - Trial 150 finished with values: [0.019232659851262393, 0.014917218543046357, 0.019901979299132396] and parameters: {'n_layers': 4, 'embedding_dim': 32, 'lr': 0.0014918556660024908, 'lambda_val': 0.0001780893612713799, 'batch_size': 1702, 'optimizer': 'Adam'}.
2026-05-24 00:35:20,680 - experiment_functions - INFO - Early stopping at epoch 1150. Best Metrics: (0.0183914415249895, 0.013716887417218545, 0.018944401366441797)
2026-05-24 00:35:20,800 - optuna.study.study - INFO - Trial 151 finished with values: [0.0183914415249895, 0.013716887417218545, 0.018944401366441797] and parameters: {'n_layers': 2, 'embedding_dim': 128, 'lr': 0.0006541077805531833, 'lambda_val': 2.1584212621107985e-06, 'batch_size': 947, 'optimizer': 'Adam'}.
2026-05-24 00:35:36,068 - experiment_functions - INFO - Early stopping at epoch 1350. Best Metrics: (0.021720979828395888, 0.016961920529801326, 0.022469553309660738)
2026-05-24 00:35:36,972 - optuna.study.study - INFO - Trial 152 finished with values: [0.021720979828395888, 0.016961920529801326, 0.022469553309660738] and parameters: {'n_layers': 4, 'embedding_dim': 32, 'lr': 0.00037394670395286464, 'lambda_val': 0.014393132529370842, 'batch_size': 2057, 'optimizer': 'Adam'}.
2026-05-24 00:35:43,897 - experiment_functions - INFO - Early stopping at epoch 550. Best Metrics: (0.016504047513401374, 0.013236754966887417, 0.01711638005876785)
2026-05-24 00:35:43,999 - optuna.study.study - INFO - Trial 153 finished with values: [0.016504047513401374, 0.013236754966887417, 0.01711638005876785] and parameters: {'n_layers': 3, 'embedding_dim': 128, 'lr': 0.0019645778545903164, 'lambda_val': 0.0019340508111572378, 'batch_size': 2478, 'optimizer': 'RMSprop'}.
2026-05-24 00:35:56,097 - experiment_functions - INFO - Early stopping at epoch 1100. Best Metrics: (0.022520254978894712, 0.015273178807947022, 0.02246470140959163)
2026-05-24 00:35:56,170 - optuna.study.study - INFO - Trial 154 finished with values: [0.022520254978894712, 0.015273178807947022, 0.02246470140959163] and parameters: {'n_layers': 1, 'embedding_dim': 32, 'lr': 0.0011608542213191663, 'lambda_val': 0.0013089325113607559, 'batch_size': 648, 'optimizer': 'Adam'}.
2026-05-24 00:36:37,701 - experiment_functions - INFO - Early stopping at epoch 3900. Best Metrics: (0.0250255801623093, 0.01902317880794702, 0.025396165748809416)
2026-05-24 00:36:37,843 - optuna.study.study - INFO - Trial 155 finished with values: [0.0250255801623093, 0.01902317880794702, 0.025396165748809416] and parameters: {'n_layers': 4, 'embedding_dim': 32, 'lr': 0.00037394670395286464, 'lambda_val': 0.0019340508111572378, 'batch_size': 648, 'optimizer': 'Adam'}.
2026-05-24 00:36:46,521 - experiment_functions - INFO - Early stopping at epoch 750. Best Metrics: (0.02034290960562229, 0.015355960264900662, 0.02096652323294791)
2026-05-24 00:36:46,596 - optuna.study.study - INFO - Trial 156 finished with values: [0.02034290960562229, 0.015355960264900662, 0.02096652323294791] and parameters: {'n_layers': 3, 'embedding_dim': 32, 'lr': 0.0014918556660024908, 'lambda_val': 0.0011861252157314979, 'batch_size': 1672, 'optimizer': 'Adam'}.
2026-05-24 00:36:58,382 - experiment_functions - INFO - Early stopping at epoch 1050. Best Metrics: (0.016258522895932912, 0.012773178807947021, 0.016786482262635113)
2026-05-24 00:36:58,514 - optuna.study.study - INFO - Trial 157 finished with values: [0.016258522895932912, 0.012773178807947021, 0.016786482262635113] and parameters: {'n_layers': 2, 'embedding_dim': 128, 'lr': 0.0006541077805531833, 'lambda_val': 0.012312281188503879, 'batch_size': 947, 'optimizer': 'Adam'}.
2026-05-24 00:37:12,780 - experiment_functions - INFO - Early stopping at epoch 1300. Best Metrics: (0.0174031615906271, 0.014594370860927153, 0.019259438061895524)
2026-05-24 00:37:13,151 - optuna.study.study - INFO - Trial 158 finished with values: [0.0174031615906271, 0.014594370860927153, 0.019259438061895524] and parameters: {'n_layers': 3, 'embedding_dim': 64, 'lr': 0.00036341523831303154, 'lambda_val': 0.014393132529370842, 'batch_size': 2478, 'optimizer': 'Adam'}.
2026-05-24 00:37:21,495 - experiment_functions - INFO - Early stopping at epoch 700. Best Metrics: (0.01741496859385925, 0.013079470198675497, 0.017636327990801667)
2026-05-24 00:37:21,574 - optuna.study.study - INFO - Trial 159 finished with values: [0.01741496859385925, 0.013079470198675497, 0.017636327990801667] and parameters: {'n_layers': 2, 'embedding_dim': 128, 'lr': 0.0019645778545903164, 'lambda_val': 5.532502579868939e-06, 'batch_size': 856, 'optimizer': 'Adam'}.
2026-05-24 00:37:28,926 - experiment_functions - INFO - Early stopping at epoch 600. Best Metrics: (0.01833164776139634, 0.01550496688741722, 0.02008346497187016)
2026-05-24 00:37:28,993 - optuna.study.study - INFO - Trial 160 finished with values: [0.01833164776139634, 0.01550496688741722, 0.02008346497187016] and parameters: {'n_layers': 4, 'embedding_dim': 64, 'lr': 0.0010358017727309806, 'lambda_val': 0.0036665131417867084, 'batch_size': 3007, 'optimizer': 'RMSprop'}.
2026-05-24 00:37:38,235 - experiment_functions - INFO - Early stopping at epoch 800. Best Metrics: (0.02022236675764753, 0.016514900662251655, 0.02152103450271631)
2026-05-24 00:37:38,335 - optuna.study.study - INFO - Trial 161 finished with values: [0.02022236675764753, 0.016514900662251655, 0.02152103450271631] and parameters: {'n_layers': 3, 'embedding_dim': 32, 'lr': 0.0009603867550939608, 'lambda_val': 0.012312281188503879, 'batch_size': 1672, 'optimizer': 'Adam'}.
2026-05-24 00:37:49,740 - experiment_functions - INFO - Early stopping at epoch 1000. Best Metrics: (0.020483340647401024, 0.01617549668874172, 0.021109168625314003)
