2026-05-24 06:11:49,489 - optuna.study.study - INFO - Trial 236 finished with values: [0.019155547272449044, 0.015314569536423841, 0.020278100813751945] and parameters: {'n_layers': 4, 'embedding_dim': 128, 'lr': 0.0002909391164072771, 'lambda_val': 8.35574162185364e-05, 'batch_size': 1612, 'optimizer': 'RMSprop'}.
2026-05-24 06:12:29,731 - optuna.study.study - INFO - Trial 237 finished with values: [0.010680643382825343, 0.007864238410596027, 0.010761339890755927] and parameters: {'n_layers': 4, 'embedding_dim': 32, 'lr': 7.945983744031628e-05, 'lambda_val': 0.0028168727253759383, 'batch_size': 1264, 'optimizer': 'Adam'}.
2026-05-24 06:12:36,545 - experiment_functions - INFO - Early stopping at epoch 550. Best Metrics: (0.014542940307140841, 0.011390728476821191, 0.014937648780681271)
2026-05-24 06:12:36,662 - optuna.study.study - INFO - Trial 238 finished with values: [0.014542940307140841, 0.011390728476821191, 0.014937648780681271] and parameters: {'n_layers': 2, 'embedding_dim': 128, 'lr': 0.004512010550703536, 'lambda_val': 5.78540826635863e-05, 'batch_size': 2716, 'optimizer': 'Adam'}.
2026-05-24 06:13:14,128 - experiment_functions - INFO - Early stopping at epoch 3700. Best Metrics: (0.021228449658337596, 0.014660596026490069, 0.02143668446781156)
2026-05-24 06:13:15,159 - optuna.study.study - INFO - Trial 239 finished with values: [0.021228449658337596, 0.014660596026490069, 0.02143668446781156] and parameters: {'n_layers': 1, 'embedding_dim': 32, 'lr': 0.0004890104603780292, 'lambda_val': 5.78540826635863e-05, 'batch_size': 2144, 'optimizer': 'RMSprop'}.
2026-05-24 06:13:21,311 - experiment_functions - INFO - Early stopping at epoch 500. Best Metrics: (0.00535766279379477, 0.004221854304635762, 0.005215726261794439)
2026-05-24 06:13:21,787 - optuna.study.study - INFO - Trial 240 finished with values: [0.00535766279379477, 0.004221854304635762, 0.005215726261794439] and parameters: {'n_layers': 2, 'embedding_dim': 32, 'lr': 0.0003788253863598979, 'lambda_val': 0.09383228839891232, 'batch_size': 2716, 'optimizer': 'Adam'}.
2026-05-24 06:13:29,080 - experiment_functions - INFO - Early stopping at epoch 600. Best Metrics: (0.017391354542456085, 0.012061258278145694, 0.01690852041835165)
2026-05-24 06:13:29,776 - optuna.study.study - INFO - Trial 241 finished with values: [0.017391354542456085, 0.012061258278145694, 0.01690852041835165] and parameters: {'n_layers': 1, 'embedding_dim': 128, 'lr': 0.0034008688244003345, 'lambda_val': 2.9428916086760435e-06, 'batch_size': 1501, 'optimizer': 'Adam'}.
2026-05-24 06:13:49,597 - experiment_functions - INFO - Early stopping at epoch 1850. Best Metrics: (0.0192227597795287, 0.014296357615894041, 0.01965493755016745)
2026-05-24 06:13:49,715 - optuna.study.study - INFO - Trial 242 finished with values: [0.0192227597795287, 0.014296357615894041, 0.01965493755016745] and parameters: {'n_layers': 2, 'embedding_dim': 32, 'lr': 0.0004890104603780292, 'lambda_val': 0.0028168727253759383, 'batch_size': 2716, 'optimizer': 'RMSprop'}.
2026-05-24 06:13:56,535 - experiment_functions - INFO - Early stopping at epoch 550. Best Metrics: (0.009806958263277264, 0.008501655629139073, 0.010607698145330014)
2026-05-24 06:13:57,004 - optuna.study.study - INFO - Trial 243 finished with values: [0.009806958263277264, 0.008501655629139073, 0.010607698145330014] and parameters: {'n_layers': 4, 'embedding_dim': 64, 'lr': 0.004512010550703536, 'lambda_val': 0.0028168727253759383, 'batch_size': 2716, 'optimizer': 'RMSprop'}.
2026-05-24 06:14:14,228 - experiment_functions - INFO - Early stopping at epoch 1600. Best Metrics: (0.0168948048683344, 0.011953642384105961, 0.016633419983706793)
2026-05-24 06:14:14,330 - optuna.study.study - INFO - Trial 244 finished with values: [0.0168948048683344, 0.011953642384105961, 0.016633419983706793] and parameters: {'n_layers': 1, 'embedding_dim': 128, 'lr': 0.0003788253863598979, 'lambda_val': 0.00013892846035396848, 'batch_size': 3218, 'optimizer': 'RMSprop'}.
2026-05-24 06:14:37,644 - experiment_functions - INFO - Early stopping at epoch 2200. Best Metrics: (0.018895189012393208, 0.013874172185430465, 0.019489833249091336)
2026-05-24 06:14:37,776 - optuna.study.study - INFO - Trial 245 finished with values: [0.018895189012393208, 0.013874172185430465, 0.019489833249091336] and parameters: {'n_layers': 2, 'embedding_dim': 32, 'lr': 0.0003788253863598979, 'lambda_val': 0.00013892846035396848, 'batch_size': 2716, 'optimizer': 'Adam'}.
2026-05-24 06:14:49,971 - experiment_functions - INFO - Early stopping at epoch 1050. Best Metrics: (0.014301608276487524, 0.013228476821192055, 0.015998594810245615)
2026-05-24 06:14:50,386 - optuna.study.study - INFO - Trial 246 finished with values: [0.014301608276487524, 0.013228476821192055, 0.015998594810245615] and parameters: {'n_layers': 4, 'embedding_dim': 128, 'lr': 0.0004890104603780292, 'lambda_val': 0.09383228839891232, 'batch_size': 1264, 'optimizer': 'RMSprop'}.
2026-05-24 06:14:56,899 - experiment_functions - INFO - Early stopping at epoch 550. Best Metrics: (0.01721253478448232, 0.013236754966887417, 0.018157851881861004)
2026-05-24 06:14:57,665 - optuna.study.study - INFO - Trial 247 finished with values: [0.01721253478448232, 0.013236754966887417, 0.018157851881861004] and parameters: {'n_layers': 1, 'embedding_dim': 64, 'lr': 0.0034008688244003345, 'lambda_val': 2.2166956469385638e-05, 'batch_size': 1501, 'optimizer': 'RMSprop'}.
2026-05-24 06:15:12,192 - experiment_functions - INFO - Early stopping at epoch 1250. Best Metrics: (0.01779130464206959, 0.01548841059602649, 0.019209360113648332)
2026-05-24 06:15:12,286 - optuna.study.study - INFO - Trial 248 finished with values: [0.01779130464206959, 0.01548841059602649, 0.019209360113648332] and parameters: {'n_layers': 4, 'embedding_dim': 96, 'lr': 0.0002909391164072771, 'lambda_val': 0.004830254272011785, 'batch_size': 3235, 'optimizer': 'RMSprop'}.
2026-05-24 06:15:25,501 - experiment_functions - INFO - Early stopping at epoch 1150. Best Metrics: (0.018655881201271412, 0.014983443708609271, 0.01999474387458198)
2026-05-24 06:15:25,602 - optuna.study.study - INFO - Trial 249 finished with values: [0.018655881201271412, 0.014983443708609271, 0.01999474387458198] and parameters: {'n_layers': 4, 'embedding_dim': 64, 'lr': 0.0003548891156684262, 'lambda_val': 0.0009477093360896171, 'batch_size': 3624, 'optimizer': 'Adam'}.
2026-05-24 06:15:37,768 - experiment_functions - INFO - Early stopping at epoch 1050. Best Metrics: (0.02017171699683667, 0.015985099337748346, 0.02098859614398762)
2026-05-24 06:15:37,871 - optuna.study.study - INFO - Trial 250 finished with values: [0.02017171699683667, 0.015985099337748346, 0.02098859614398762] and parameters: {'n_layers': 4, 'embedding_dim': 96, 'lr': 0.0004915796983483617, 'lambda_val': 0.00013892846035396848, 'batch_size': 1612, 'optimizer': 'Adam'}.
2026-05-24 06:15:49,088 - experiment_functions - INFO - Early stopping at epoch 600. Best Metrics: (0.01138913649146993, 0.00906456953642384, 0.011476366849183947)
2026-05-24 06:15:49,170 - optuna.study.study - INFO - Trial 251 finished with values: [0.01138913649146993, 0.00906456953642384, 0.011476366849183947] and parameters: {'n_layers': 1, 'embedding_dim': 96, 'lr': 0.07744925611157019, 'lambda_val': 5.78540826635863e-05, 'batch_size': 1401, 'optimizer': 'RMSprop'}.
2026-05-24 06:15:56,726 - experiment_functions - INFO - Early stopping at epoch 550. Best Metrics: (0.0060788107907251525, 0.006465231788079471, 0.007142522920522072)
2026-05-24 06:15:57,380 - optuna.study.study - INFO - Trial 252 finished with values: [0.0060788107907251525, 0.006465231788079471, 0.007142522920522072] and parameters: {'n_layers': 4, 'embedding_dim': 256, 'lr': 0.003111463454986353, 'lambda_val': 0.010248606541800688, 'batch_size': 2774, 'optimizer': 'RMSprop'}.
2026-05-24 06:16:03,273 - experiment_functions - INFO - Early stopping at epoch 500. Best Metrics: (0.0054055380337001396, 0.004304635761589404, 0.005525819191840354)
2026-05-24 06:16:03,421 - optuna.study.study - INFO - Trial 253 finished with values: [0.0054055380337001396, 0.004304635761589404, 0.005525819191840354] and parameters: {'n_layers': 3, 'embedding_dim': 32, 'lr': 0.0002909391164072771, 'lambda_val': 7.310819428506298e-05, 'batch_size': 1775, 'optimizer': 'SGD'}.
2026-05-24 06:16:38,012 - experiment_functions - INFO - Early stopping at epoch 3300. Best Metrics: (0.020221070939657998, 0.014925496688741723, 0.020591551900889602)
2026-05-24 06:16:38,108 - optuna.study.study - INFO - Trial 254 finished with values: [0.020221070939657998, 0.014925496688741723, 0.020591551900889602] and parameters: {'n_layers': 2, 'embedding_dim': 32, 'lr': 0.0004890104603780292, 'lambda_val': 1.5796352581469372e-06, 'batch_size': 2716, 'optimizer': 'RMSprop'}.
2026-05-24 06:16:44,795 - experiment_functions - INFO - Early stopping at epoch 500. Best Metrics: (0.008395133447510326, 0.006663907284768212, 0.008614089414944192)
2026-05-24 06:16:45,099 - optuna.study.study - INFO - Trial 255 finished with values: [0.008395133447510326, 0.006663907284768212, 0.008614089414944192] and parameters: {'n_layers': 4, 'embedding_dim': 256, 'lr': 0.07299397925302697, 'lambda_val': 0.0028168727253759383, 'batch_size': 1264, 'optimizer': 'RMSprop'}.
2026-05-24 06:17:01,127 - experiment_functions - INFO - Early stopping at epoch 1400. Best Metrics: (0.019967415957019636, 0.016415562913907285, 0.020911902322565613)
2026-05-24 06:17:01,218 - optuna.study.study - INFO - Trial 256 finished with values: [0.019967415957019636, 0.016415562913907285, 0.020911902322565613] and parameters: {'n_layers': 4, 'embedding_dim': 128, 'lr': 0.0002909391164072771, 'lambda_val': 5.78540826635863e-05, 'batch_size': 1612, 'optimizer': 'Adam'}.
2026-05-24 06:17:07,338 - experiment_functions - INFO - Early stopping at epoch 500. Best Metrics: (0.005157157247048833, 0.004230132450331126, 0.005608551482706215)
2026-05-24 06:17:07,475 - optuna.study.study - INFO - Trial 257 finished with values: [0.005157157247048833, 0.004230132450331126, 0.005608551482706215] and parameters: {'n_layers': 2, 'embedding_dim': 32, 'lr': 4.128638740862087e-05, 'lambda_val': 0.09934758799516241, 'batch_size': 2716, 'optimizer': 'RMSprop'}.
2026-05-24 06:17:48,035 - experiment_functions - INFO - Early stopping at epoch 3950. Best Metrics: (0.023730912246719037, 0.01652317880794702, 0.023703377773804223)
2026-05-24 06:17:48,685 - optuna.study.study - INFO - Trial 258 finished with values: [0.023730912246719037, 0.01652317880794702, 0.023703377773804223] and parameters: {'n_layers': 2, 'embedding_dim': 32, 'lr': 0.0004890104603780292, 'lambda_val': 0.007620237155778278, 'batch_size': 565, 'optimizer': 'RMSprop'}.
2026-05-24 06:18:00,689 - experiment_functions - INFO - Early stopping at epoch 1050. Best Metrics: (0.01631209776337806, 0.014014900662251657, 0.01733512401782594)
2026-05-24 06:18:00,784 - optuna.study.study - INFO - Trial 259 finished with values: [0.01631209776337806, 0.014014900662251657, 0.01733512401782594] and parameters: {'n_layers': 4, 'embedding_dim': 96, 'lr': 0.0004890104603780292, 'lambda_val': 0.09383228839891232, 'batch_size': 3682, 'optimizer': 'Adam'}.
2026-05-24 06:18:07,065 - experiment_functions - INFO - Early stopping at epoch 500. Best Metrics: (0.005303157733555182, 0.004180463576158941, 0.005392568564707327)
2026-05-24 06:18:08,103 - optuna.study.study - INFO - Trial 260 finished with values: [0.005303157733555182, 0.004180463576158941, 0.005392568564707327] and parameters: {'n_layers': 4, 'embedding_dim': 64, 'lr': 0.0007276922065688508, 'lambda_val': 0.010248606541800688, 'batch_size': 3377, 'optimizer': 'SGD'}.
2026-05-24 06:18:17,152 - experiment_functions - INFO - Early stopping at epoch 800. Best Metrics: (0.0052254248976709265, 0.004105960264900663, 0.005050559607500491)
2026-05-24 06:18:17,287 - optuna.study.study - INFO - Trial 261 finished with values: [0.0052254248976709265, 0.004105960264900663, 0.005050559607500491] and parameters: {'n_layers': 4, 'embedding_dim': 96, 'lr': 0.0037147017870386746, 'lambda_val': 0.00044783366785382153, 'batch_size': 542, 'optimizer': 'SGD'}.
2026-05-24 06:18:51,062 - experiment_functions - INFO - Early stopping at epoch 3050. Best Metrics: (0.02463133491680834, 0.019271523178807946, 0.025376349040543107)
2026-05-24 06:18:51,149 - optuna.study.study - INFO - Trial 262 finished with values: [0.02463133491680834, 0.019271523178807946, 0.025376349040543107] and parameters: {'n_layers': 4, 'embedding_dim': 128, 'lr': 0.0002909391164072771, 'lambda_val': 0.0007072058953550323, 'batch_size': 587, 'optimizer': 'Adam'}.
2026-05-24 06:19:17,843 - experiment_functions - INFO - Early stopping at epoch 2550. Best Metrics: (0.021465963861314195, 0.015066225165562913, 0.021092240723321318)
2026-05-24 06:19:18,556 - optuna.study.study - INFO - Trial 263 finished with values: [0.021465963861314195, 0.015066225165562913, 0.021092240723321318] and parameters: {'n_layers': 2, 'embedding_dim': 32, 'lr': 0.0004890104603780292, 'lambda_val': 0.001579241365297674, 'batch_size': 1264, 'optimizer': 'Adam'}.
2026-05-24 06:19:25,191 - experiment_functions - INFO - Early stopping at epoch 550. Best Metrics: (0.010895227447205976, 0.009048013245033112, 0.011397366084411437)
2026-05-24 06:19:25,362 - optuna.study.study - INFO - Trial 264 finished with values: [0.010895227447205976, 0.009048013245033112, 0.011397366084411437] and parameters: {'n_layers': 4, 'embedding_dim': 64, 'lr': 0.010617941756409179, 'lambda_val': 5.78540826635863e-05, 'batch_size': 684, 'optimizer': 'RMSprop'}.
2026-05-24 06:20:07,556 - optuna.study.study - INFO - Trial 265 finished with values: [0.018049713555471796, 0.01437086092715232, 0.018814946999509582] and parameters: {'n_layers': 2, 'embedding_dim': 128, 'lr': 0.0002909391164072771, 'lambda_val': 0.0002645781022917036, 'batch_size': 1637, 'optimizer': 'RMSprop'}.
2026-05-24 06:20:24,037 - experiment_functions - INFO - Early stopping at epoch 1450. Best Metrics: (0.021830340682182998, 0.018087748344370862, 0.023604627916145263)
2026-05-24 06:20:24,454 - optuna.study.study - INFO - Trial 266 finished with values: [0.021830340682182998, 0.018087748344370862, 0.023604627916145263] and parameters: {'n_layers': 4, 'embedding_dim': 128, 'lr': 0.0003788253863598979, 'lambda_val': 5.78540826635863e-05, 'batch_size': 684, 'optimizer': 'RMSprop'}.
2026-05-24 06:20:39,449 - experiment_functions - INFO - Early stopping at epoch 1350. Best Metrics: (0.024454683860772604, 0.019751655629139074, 0.026081141778104288)
2026-05-24 06:20:40,280 - optuna.study.study - INFO - Trial 267 finished with values: [0.024454683860772604, 0.019751655629139074, 0.026081141778104288] and parameters: {'n_layers': 4, 'embedding_dim': 32, 'lr': 0.0004890104603780292, 'lambda_val': 0.007620237155778278, 'batch_size': 725, 'optimizer': 'Adam'}.
2026-05-24 06:21:22,899 - optuna.study.study - INFO - Trial 268 finished with values: [0.019354268149288964, 0.015695364238410597, 0.020670476995159344] and parameters: {'n_layers': 4, 'embedding_dim': 96, 'lr': 0.00018164145276986003, 'lambda_val': 5.78540826635863e-05, 'batch_size': 2144, 'optimizer': 'Adam'}.
2026-05-24 06:21:29,383 - experiment_functions - INFO - Early stopping at epoch 550. Best Metrics: (0.018270849837297324, 0.01320364238410596, 0.018516528590320606)
2026-05-24 06:21:29,571 - optuna.study.study - INFO - Trial 269 finished with values: [0.018270849837297324, 0.01320364238410596, 0.018516528590320606] and parameters: {'n_layers': 1, 'embedding_dim': 32, 'lr': 0.0037147017870386746, 'lambda_val': 2.1355760438149747e-05, 'batch_size': 2176, 'optimizer': 'RMSprop'}.
2026-05-24 06:21:46,653 - experiment_functions - INFO - Early stopping at epoch 1500. Best Metrics: (0.02354772814984357, 0.018427152317880797, 0.024011079247498665)
2026-05-24 06:21:47,100 - optuna.study.study - INFO - Trial 270 finished with values: [0.02354772814984357, 0.018427152317880797, 0.024011079247498665] and parameters: {'n_layers': 4, 'embedding_dim': 128, 'lr': 0.0003788253863598979, 'lambda_val': 0.00013892846035396848, 'batch_size': 684, 'optimizer': 'Adam'}.
2026-05-24 06:21:59,156 - experiment_functions - INFO - Early stopping at epoch 1000. Best Metrics: (0.016682643326221127, 0.014279801324503311, 0.017876994604772795)
2026-05-24 06:21:59,261 - optuna.study.study - INFO - Trial 271 finished with values: [0.016682643326221127, 0.014279801324503311, 0.017876994604772795] and parameters: {'n_layers': 4, 'embedding_dim': 128, 'lr': 0.0003788253863598979, 'lambda_val': 1.7875231736914154e-05, 'batch_size': 3218, 'optimizer': 'RMSprop'}.
2026-05-24 06:22:05,935 - experiment_functions - INFO - Early stopping at epoch 550. Best Metrics: (0.02176115034403929, 0.017218543046357615, 0.02260367899637645)
2026-05-24 06:22:06,230 - optuna.study.study - INFO - Trial 272 finished with values: [0.02176115034403929, 0.017218543046357615, 0.02260367899637645] and parameters: {'n_layers': 4, 'embedding_dim': 32, 'lr': 0.0037147017870386746, 'lambda_val': 4.636230095533315e-05, 'batch_size': 542, 'optimizer': 'RMSprop'}.
2026-05-24 06:22:19,152 - experiment_functions - INFO - Early stopping at epoch 1150. Best Metrics: (0.01834488652863359, 0.014801324503311258, 0.019689916977464493)
2026-05-24 06:22:19,248 - optuna.study.study - INFO - Trial 273 finished with values: [0.01834488652863359, 0.014801324503311258, 0.019689916977464493] and parameters: {'n_layers': 3, 'embedding_dim': 32, 'lr': 0.0004890104603780292, 'lambda_val': 0.007620237155778278, 'batch_size': 2862, 'optimizer': 'Adam'}.
2026-05-24 06:22:25,239 - experiment_functions - INFO - Early stopping at epoch 500. Best Metrics: (0.004599873214925382, 0.003890728476821192, 0.004918219108237601)
2026-05-24 06:22:26,208 - optuna.study.study - INFO - Trial 274 finished with values: [0.004599873214925382, 0.003890728476821192, 0.004918219108237601] and parameters: {'n_layers': 2, 'embedding_dim': 32, 'lr': 0.0002909391164072771, 'lambda_val': 0.09383228839891232, 'batch_size': 1833, 'optimizer': 'SGD'}.
2026-05-24 06:22:32,922 - experiment_functions - INFO - Early stopping at epoch 550. Best Metrics: (0.017810246615632297, 0.01228476821192053, 0.017951094690348886)
2026-05-24 06:22:33,395 - optuna.study.study - INFO - Trial 275 finished with values: [0.017810246615632297, 0.01228476821192053, 0.017951094690348886] and parameters: {'n_layers': 1, 'embedding_dim': 32, 'lr': 0.005631870588732167, 'lambda_val': 0.007620237155778278, 'batch_size': 2492, 'optimizer': 'Adam'}.
2026-05-24 06:23:13,222 - optuna.study.study - INFO - Trial 276 finished with values: [0.013798982954889074, 0.010066225165562914, 0.014285889829109782] and parameters: {'n_layers': 1, 'embedding_dim': 96, 'lr': 0.0001472288279637344, 'lambda_val': 5.78540826635863e-05, 'batch_size': 1833, 'optimizer': 'Adam'}.
2026-05-24 06:23:33,908 - experiment_functions - INFO - Early stopping at epoch 2000. Best Metrics: (0.022533461159629658, 0.017897350993377484, 0.023178672179833017)
2026-05-24 06:23:34,007 - optuna.study.study - INFO - Trial 277 finished with values: [0.022533461159629658, 0.017897350993377484, 0.023178672179833017] and parameters: {'n_layers': 2, 'embedding_dim': 32, 'lr': 0.0004890104603780292, 'lambda_val': 0.09383228839891232, 'batch_size': 979, 'optimizer': 'RMSprop'}.
2026-05-24 06:23:44,386 - experiment_functions - INFO - Early stopping at epoch 800. Best Metrics: (0.016960161427736434, 0.01418046357615894, 0.018146548799212122)
2026-05-24 06:23:44,738 - optuna.study.study - INFO - Trial 278 finished with values: [0.016960161427736434, 0.01418046357615894, 0.018146548799212122] and parameters: {'n_layers': 4, 'embedding_dim': 256, 'lr': 0.0004890104603780292, 'lambda_val': 0.0028168727253759383, 'batch_size': 2144, 'optimizer': 'Adam'}.
2026-05-24 06:23:50,683 - experiment_functions - INFO - Early stopping at epoch 500. Best Metrics: (0.004921097184746271, 0.004048013245033113, 0.004979988037321671)
2026-05-24 06:23:51,094 - optuna.study.study - INFO - Trial 279 finished with values: [0.004921097184746271, 0.004048013245033113, 0.004979988037321671] and parameters: {'n_layers': 1, 'embedding_dim': 32, 'lr': 7.349822656104946e-05, 'lambda_val': 0.09383228839891232, 'batch_size': 1501, 'optimizer': 'Adam'}.
2026-05-24 06:24:04,373 - experiment_functions - INFO - Early stopping at epoch 1200. Best Metrics: (0.01834685362572483, 0.015596026490066223, 0.01958830189856334)
2026-05-24 06:24:04,472 - optuna.study.study - INFO - Trial 280 finished with values: [0.01834685362572483, 0.015596026490066223, 0.01958830189856334] and parameters: {'n_layers': 2, 'embedding_dim': 64, 'lr': 0.0004890104603780292, 'lambda_val': 0.09383228839891232, 'batch_size': 2716, 'optimizer': 'RMSprop'}.
2026-05-24 06:24:15,045 - experiment_functions - INFO - Early stopping at epoch 900. Best Metrics: (0.019390043533147272, 0.01634105960264901, 0.02067596755980998)
2026-05-24 06:24:15,305 - optuna.study.study - INFO - Trial 281 finished with values: [0.019390043533147272, 0.01634105960264901, 0.02067596755980998] and parameters: {'n_layers': 4, 'embedding_dim': 128, 'lr': 0.0004890104603780292, 'lambda_val': 0.006533679696091803, 'batch_size': 1612, 'optimizer': 'Adam'}.
2026-05-24 06:24:25,194 - experiment_functions - INFO - Early stopping at epoch 850. Best Metrics: (0.015998713305147703, 0.014735099337748341, 0.017825021927635954)
2026-05-24 06:24:25,384 - optuna.study.study - INFO - Trial 282 finished with values: [0.015998713305147703, 0.014735099337748341, 0.017825021927635954] and parameters: {'n_layers': 4, 'embedding_dim': 96, 'lr': 0.0004890104603780292, 'lambda_val': 0.09383228839891232, 'batch_size': 3235, 'optimizer': 'RMSprop'}.
2026-05-24 06:24:39,183 - experiment_functions - INFO - Early stopping at epoch 1250. Best Metrics: (0.019247478766064023, 0.014271523178807947, 0.019593096115735367)
