2026-05-24 00:37:49,821 - optuna.study.study - INFO - Trial 162 finished with values: [0.020483340647401024, 0.01617549668874172, 0.021109168625314003] and parameters: {'n_layers': 3, 'embedding_dim': 32, 'lr': 0.0005555935556782479, 'lambda_val': 0.014393132529370842, 'batch_size': 2049, 'optimizer': 'RMSprop'}.
2026-05-24 00:38:04,557 - experiment_functions - INFO - Early stopping at epoch 1350. Best Metrics: (0.022246982616844848, 0.01781456953642384, 0.02310404316822493)
2026-05-24 00:38:04,641 - optuna.study.study - INFO - Trial 163 finished with values: [0.022246982616844848, 0.01781456953642384, 0.02310404316822493] and parameters: {'n_layers': 3, 'embedding_dim': 32, 'lr': 0.0005555935556782479, 'lambda_val': 0.014393132529370842, 'batch_size': 900, 'optimizer': 'Adam'}.
2026-05-24 00:38:10,792 - experiment_functions - INFO - Early stopping at epoch 500. Best Metrics: (0.0059659565284942975, 0.004230132450331127, 0.005852973210536973)
2026-05-24 00:38:11,241 - optuna.study.study - INFO - Trial 164 finished with values: [0.0059659565284942975, 0.004230132450331127, 0.005852973210536973] and parameters: {'n_layers': 3, 'embedding_dim': 96, 'lr': 0.00037394670395286464, 'lambda_val': 0.014393132529370842, 'batch_size': 3006, 'optimizer': 'SGD'}.
2026-05-24 00:38:21,433 - experiment_functions - INFO - Early stopping at epoch 850. Best Metrics: (0.012168493170695252, 0.010339403973509935, 0.012870801624507612)
2026-05-24 00:38:21,507 - optuna.study.study - INFO - Trial 165 finished with values: [0.012168493170695252, 0.010339403973509935, 0.012870801624507612] and parameters: {'n_layers': 2, 'embedding_dim': 256, 'lr': 0.0005555935556782479, 'lambda_val': 0.014393132529370842, 'batch_size': 2999, 'optimizer': 'Adam'}.
2026-05-24 00:38:42,753 - experiment_functions - INFO - Early stopping at epoch 1950. Best Metrics: (0.021610941542173065, 0.01673841059602649, 0.022089755046439973)
2026-05-24 00:38:42,892 - optuna.study.study - INFO - Trial 166 finished with values: [0.021610941542173065, 0.01673841059602649, 0.022089755046439973] and parameters: {'n_layers': 3, 'embedding_dim': 96, 'lr': 0.00036341523831303154, 'lambda_val': 0.0042666561549426635, 'batch_size': 900, 'optimizer': 'Adam'}.
2026-05-24 00:39:05,940 - experiment_functions - INFO - Early stopping at epoch 2200. Best Metrics: (0.018574786321155126, 0.012789735099337748, 0.018428723234153753)
2026-05-24 00:39:06,007 - optuna.study.study - INFO - Trial 167 finished with values: [0.018574786321155126, 0.012789735099337748, 0.018428723234153753] and parameters: {'n_layers': 1, 'embedding_dim': 32, 'lr': 0.00037394670395286464, 'lambda_val': 0.014393132529370842, 'batch_size': 2049, 'optimizer': 'Adam'}.
2026-05-24 00:39:22,146 - experiment_functions - INFO - Early stopping at epoch 1550. Best Metrics: (0.015456954350036878, 0.011051324503311259, 0.015066160816531985)
2026-05-24 00:39:22,773 - optuna.study.study - INFO - Trial 168 finished with values: [0.015456954350036878, 0.011051324503311259, 0.015066160816531985] and parameters: {'n_layers': 1, 'embedding_dim': 96, 'lr': 0.00037394670395286464, 'lambda_val': 0.014393132529370842, 'batch_size': 1693, 'optimizer': 'Adam'}.
2026-05-24 00:39:32,491 - experiment_functions - INFO - Early stopping at epoch 850. Best Metrics: (0.020813087842175487, 0.015223509933774835, 0.021332365119410984)
2026-05-24 00:39:32,826 - optuna.study.study - INFO - Trial 169 finished with values: [0.020813087842175487, 0.015223509933774835, 0.021332365119410984] and parameters: {'n_layers': 3, 'embedding_dim': 32, 'lr': 0.0009603867550939608, 'lambda_val': 0.001970520642014681, 'batch_size': 1672, 'optimizer': 'Adam'}.
2026-05-24 00:39:49,052 - experiment_functions - INFO - Early stopping at epoch 1500. Best Metrics: (0.02037814369588873, 0.015198675496688744, 0.020629641409226417)
2026-05-24 00:39:49,676 - optuna.study.study - INFO - Trial 170 finished with values: [0.02037814369588873, 0.015198675496688744, 0.020629641409226417] and parameters: {'n_layers': 3, 'embedding_dim': 32, 'lr': 0.0004983873008546874, 'lambda_val': 0.0007825709071756792, 'batch_size': 1672, 'optimizer': 'Adam'}.
2026-05-24 00:40:00,365 - experiment_functions - INFO - Early stopping at epoch 900. Best Metrics: (0.017141780566564978, 0.013137417218543045, 0.01724215878386477)
2026-05-24 00:40:01,727 - optuna.study.study - INFO - Trial 171 finished with values: [0.017141780566564978, 0.013137417218543045, 0.01724215878386477] and parameters: {'n_layers': 3, 'embedding_dim': 128, 'lr': 0.0005555935556782479, 'lambda_val': 2.1584212621107985e-06, 'batch_size': 3114, 'optimizer': 'Adam'}.
2026-05-24 00:40:12,764 - experiment_functions - INFO - Early stopping at epoch 950. Best Metrics: (0.022830919988301134, 0.01814569536423841, 0.023077977228654463)
2026-05-24 00:40:13,762 - optuna.study.study - INFO - Trial 172 finished with values: [0.022830919988301134, 0.01814569536423841, 0.023077977228654463] and parameters: {'n_layers': 4, 'embedding_dim': 64, 'lr': 0.0005555935556782479, 'lambda_val': 0.0019340508111572378, 'batch_size': 947, 'optimizer': 'RMSprop'}.
2026-05-24 00:40:21,379 - experiment_functions - INFO - Early stopping at epoch 650. Best Metrics: (0.016198121292944304, 0.012814569536423842, 0.01714234809234673)
2026-05-24 00:40:21,461 - optuna.study.study - INFO - Trial 173 finished with values: [0.016198121292944304, 0.012814569536423842, 0.01714234809234673] and parameters: {'n_layers': 2, 'embedding_dim': 96, 'lr': 0.0010358017727309806, 'lambda_val': 0.0019340508111572378, 'batch_size': 1702, 'optimizer': 'RMSprop'}.
2026-05-24 00:40:38,815 - experiment_functions - INFO - Early stopping at epoch 1600. Best Metrics: (0.02248392827748053, 0.016415562913907285, 0.022361193658010592)
2026-05-24 00:40:38,902 - optuna.study.study - INFO - Trial 174 finished with values: [0.02248392827748053, 0.016415562913907285, 0.022361193658010592] and parameters: {'n_layers': 3, 'embedding_dim': 32, 'lr': 0.00037394670395286464, 'lambda_val': 0.014393132529370842, 'batch_size': 2049, 'optimizer': 'Adam'}.
2026-05-24 00:40:49,338 - experiment_functions - INFO - Early stopping at epoch 850. Best Metrics: (0.01937385322057323, 0.016100993377483445, 0.02060610279620559)
2026-05-24 00:40:49,815 - optuna.study.study - INFO - Trial 175 finished with values: [0.01937385322057323, 0.016100993377483445, 0.02060610279620559] and parameters: {'n_layers': 4, 'embedding_dim': 128, 'lr': 0.00036341523831303154, 'lambda_val': 0.014393132529370842, 'batch_size': 2478, 'optimizer': 'RMSprop'}.
2026-05-24 00:41:17,136 - experiment_functions - INFO - Early stopping at epoch 2600. Best Metrics: (0.019237657069831236, 0.014271523178807945, 0.01948242711645141)
2026-05-24 00:41:17,262 - optuna.study.study - INFO - Trial 176 finished with values: [0.019237657069831236, 0.014271523178807945, 0.01948242711645141] and parameters: {'n_layers': 2, 'embedding_dim': 64, 'lr': 0.00037394670395286464, 'lambda_val': 0.001970520642014681, 'batch_size': 1672, 'optimizer': 'Adam'}.
2026-05-24 00:41:23,908 - experiment_functions - INFO - Early stopping at epoch 550. Best Metrics: (0.012007037584725886, 0.009346026490066226, 0.012433718462971968)
2026-05-24 00:41:24,005 - optuna.study.study - INFO - Trial 177 finished with values: [0.012007037584725886, 0.009346026490066226, 0.012433718462971968] and parameters: {'n_layers': 3, 'embedding_dim': 64, 'lr': 0.032412480807464776, 'lambda_val': 0.000258912702244631, 'batch_size': 1513, 'optimizer': 'Adam'}.
2026-05-24 00:41:41,903 - experiment_functions - INFO - Early stopping at epoch 1450. Best Metrics: (0.019346126432701602, 0.015529801324503312, 0.01997417098091377)
2026-05-24 00:41:41,987 - optuna.study.study - INFO - Trial 178 finished with values: [0.019346126432701602, 0.015529801324503312, 0.01997417098091377] and parameters: {'n_layers': 3, 'embedding_dim': 32, 'lr': 0.00037394670395286464, 'lambda_val': 0.014393132529370842, 'batch_size': 2806, 'optimizer': 'Adam'}.
2026-05-24 00:41:49,244 - experiment_functions - INFO - Early stopping at epoch 550. Best Metrics: (0.010770408065265366, 0.009495033112582783, 0.011559157965060272)
2026-05-24 00:41:49,371 - optuna.study.study - INFO - Trial 179 finished with values: [0.010770408065265366, 0.009495033112582783, 0.011559157965060272] and parameters: {'n_layers': 3, 'embedding_dim': 128, 'lr': 0.006056161697818652, 'lambda_val': 0.0001780893612713799, 'batch_size': 2881, 'optimizer': 'RMSprop'}.
2026-05-24 00:41:57,350 - experiment_functions - INFO - Early stopping at epoch 750. Best Metrics: (0.019927289624971044, 0.01668046357615894, 0.021401088071639818)
2026-05-24 00:41:57,430 - optuna.study.study - INFO - Trial 180 finished with values: [0.019927289624971044, 0.01668046357615894, 0.021401088071639818] and parameters: {'n_layers': 3, 'embedding_dim': 32, 'lr': 0.0010358017727309806, 'lambda_val': 0.04990172064077824, 'batch_size': 2478, 'optimizer': 'Adam'}.
2026-05-24 00:42:35,986 - optuna.study.study - INFO - Trial 181 finished with values: [0.019487807916257413, 0.014933774834437086, 0.02044246800699387] and parameters: {'n_layers': 3, 'embedding_dim': 32, 'lr': 0.00037394670395286464, 'lambda_val': 0.0015802581456022529, 'batch_size': 2078, 'optimizer': 'RMSprop'}.
2026-05-24 00:42:44,002 - experiment_functions - INFO - Early stopping at epoch 550. Best Metrics: (0.017129392448653014, 0.013021523178807948, 0.01706961601164836)
2026-05-24 00:42:44,289 - optuna.study.study - INFO - Trial 182 finished with values: [0.017129392448653014, 0.013021523178807948, 0.01706961601164836] and parameters: {'n_layers': 3, 'embedding_dim': 64, 'lr': 0.0075495298955876545, 'lambda_val': 0.000258912702244631, 'batch_size': 2806, 'optimizer': 'Adam'}.
2026-05-24 00:42:51,165 - experiment_functions - INFO - Early stopping at epoch 600. Best Metrics: (0.020389604968921515, 0.01527317880794702, 0.02038584367557064)
2026-05-24 00:42:51,938 - optuna.study.study - INFO - Trial 183 finished with values: [0.020389604968921515, 0.01527317880794702, 0.02038584367557064] and parameters: {'n_layers': 3, 'embedding_dim': 128, 'lr': 0.0014918556660024908, 'lambda_val': 0.0001780893612713799, 'batch_size': 947, 'optimizer': 'RMSprop'}.
2026-05-24 00:43:19,555 - experiment_functions - INFO - Early stopping at epoch 2800. Best Metrics: (0.0163879743486067, 0.013253311258278147, 0.017745073374430417)
2026-05-24 00:43:19,759 - optuna.study.study - INFO - Trial 184 finished with values: [0.0163879743486067, 0.013253311258278147, 0.017745073374430417] and parameters: {'n_layers': 3, 'embedding_dim': 64, 'lr': 0.00022798255951858533, 'lambda_val': 0.000258912702244631, 'batch_size': 3816, 'optimizer': 'Adam'}.
2026-05-24 00:43:28,886 - experiment_functions - INFO - Early stopping at epoch 850. Best Metrics: (0.01612802740410044, 0.013493377483443708, 0.01710042121483198)
2026-05-24 00:43:28,968 - optuna.study.study - INFO - Trial 185 finished with values: [0.01612802740410044, 0.013493377483443708, 0.01710042121483198] and parameters: {'n_layers': 3, 'embedding_dim': 64, 'lr': 0.0005884644592942861, 'lambda_val': 0.014393132529370842, 'batch_size': 3873, 'optimizer': 'Adam'}.
2026-05-24 00:43:38,266 - experiment_functions - INFO - Early stopping at epoch 750. Best Metrics: (0.018811877687289362, 0.015521523178807946, 0.02020502036742569)
2026-05-24 00:43:38,637 - optuna.study.study - INFO - Trial 186 finished with values: [0.018811877687289362, 0.015521523178807946, 0.02020502036742569] and parameters: {'n_layers': 4, 'embedding_dim': 32, 'lr': 0.0010358017727309806, 'lambda_val': 0.000258912702244631, 'batch_size': 2806, 'optimizer': 'Adam'}.
2026-05-24 00:44:18,723 - optuna.study.study - INFO - Trial 187 finished with values: [0.01844896488540624, 0.013071192052980133, 0.018380121615212585] and parameters: {'n_layers': 1, 'embedding_dim': 64, 'lr': 0.0003602499380989214, 'lambda_val': 0.014393132529370842, 'batch_size': 648, 'optimizer': 'RMSprop'}.
2026-05-24 00:44:27,788 - experiment_functions - INFO - Early stopping at epoch 800. Best Metrics: (0.018038146654420665, 0.01419701986754967, 0.018364053883190453)
2026-05-24 00:44:28,153 - optuna.study.study - INFO - Trial 188 finished with values: [0.018038146654420665, 0.01419701986754967, 0.018364053883190453] and parameters: {'n_layers': 3, 'embedding_dim': 64, 'lr': 0.0009603867550939608, 'lambda_val': 0.012312281188503879, 'batch_size': 1513, 'optimizer': 'Adam'}.
2026-05-24 00:44:35,074 - experiment_functions - INFO - Early stopping at epoch 600. Best Metrics: (0.023360429482498706, 0.018948675496688744, 0.023887177575465223)
2026-05-24 00:44:35,162 - optuna.study.study - INFO - Trial 189 finished with values: [0.023360429482498706, 0.018948675496688744, 0.023887177575465223] and parameters: {'n_layers': 4, 'embedding_dim': 32, 'lr': 0.0010358017727309806, 'lambda_val': 0.04990172064077824, 'batch_size': 1433, 'optimizer': 'RMSprop'}.
2026-05-24 00:44:43,133 - experiment_functions - INFO - Early stopping at epoch 650. Best Metrics: (0.016205231007337402, 0.011779801324503313, 0.01622881484742074)
2026-05-24 00:44:43,216 - optuna.study.study - INFO - Trial 190 finished with values: [0.016205231007337402, 0.011779801324503313, 0.01622881484742074] and parameters: {'n_layers': 1, 'embedding_dim': 256, 'lr': 0.0019645778545903164, 'lambda_val': 4.0551073365180215e-06, 'batch_size': 2049, 'optimizer': 'Adam'}.
2026-05-24 00:44:50,827 - experiment_functions - INFO - Early stopping at epoch 650. Best Metrics: (0.018280889920141388, 0.014312913907284768, 0.019660119389246392)
2026-05-24 00:44:50,959 - optuna.study.study - INFO - Trial 191 finished with values: [0.018280889920141388, 0.014312913907284768, 0.019660119389246392] and parameters: {'n_layers': 3, 'embedding_dim': 32, 'lr': 0.002281616661023266, 'lambda_val': 7.458121457299012e-06, 'batch_size': 1959, 'optimizer': 'Adam'}.
2026-05-24 00:45:00,478 - experiment_functions - INFO - Early stopping at epoch 800. Best Metrics: (0.01904137817809446, 0.016100993377483445, 0.020127017525158223)
2026-05-24 00:45:00,566 - optuna.study.study - INFO - Trial 192 finished with values: [0.01904137817809446, 0.016100993377483445, 0.020127017525158223] and parameters: {'n_layers': 4, 'embedding_dim': 96, 'lr': 0.00037394670395286464, 'lambda_val': 0.014393132529370842, 'batch_size': 3757, 'optimizer': 'RMSprop'}.
2026-05-24 00:45:13,098 - experiment_functions - INFO - Early stopping at epoch 1050. Best Metrics: (0.015730835571360423, 0.012533112582781458, 0.016185723077847724)
2026-05-24 00:45:13,191 - optuna.study.study - INFO - Trial 193 finished with values: [0.015730835571360423, 0.012533112582781458, 0.016185723077847724] and parameters: {'n_layers': 3, 'embedding_dim': 128, 'lr': 0.00036341523831303154, 'lambda_val': 0.014393132529370842, 'batch_size': 3915, 'optimizer': 'Adam'}.
2026-05-24 00:45:23,370 - experiment_functions - INFO - Early stopping at epoch 800. Best Metrics: (0.016425320881188542, 0.014105960264900661, 0.017564125428769967)
2026-05-24 00:45:23,556 - optuna.study.study - INFO - Trial 194 finished with values: [0.016425320881188542, 0.014105960264900661, 0.017564125428769967] and parameters: {'n_layers': 3, 'embedding_dim': 96, 'lr': 0.0006541077805531833, 'lambda_val': 0.014393132529370842, 'batch_size': 3873, 'optimizer': 'Adam'}.
2026-05-24 00:45:31,882 - experiment_functions - INFO - Early stopping at epoch 650. Best Metrics: (0.016550140864003048, 0.01456953642384106, 0.0180342002706265)
2026-05-24 00:45:32,943 - optuna.study.study - INFO - Trial 195 finished with values: [0.016550140864003048, 0.01456953642384106, 0.0180342002706265] and parameters: {'n_layers': 3, 'embedding_dim': 32, 'lr': 0.001863522530188594, 'lambda_val': 0.04529231618764749, 'batch_size': 2806, 'optimizer': 'Adam'}.
2026-05-24 00:45:41,177 - experiment_functions - INFO - Early stopping at epoch 650. Best Metrics: (0.01733954121061613, 0.013509933774834436, 0.018039593745565848)
2026-05-24 00:45:41,262 - optuna.study.study - INFO - Trial 196 finished with values: [0.01733954121061613, 0.013509933774834436, 0.018039593745565848] and parameters: {'n_layers': 3, 'embedding_dim': 32, 'lr': 0.002281616661023266, 'lambda_val': 7.458121457299012e-06, 'batch_size': 3657, 'optimizer': 'Adam'}.
2026-05-24 00:45:47,817 - experiment_functions - INFO - Early stopping at epoch 550. Best Metrics: (0.016989225316824685, 0.012193708609271525, 0.01655687032446782)
2026-05-24 00:45:48,170 - optuna.study.study - INFO - Trial 197 finished with values: [0.016989225316824685, 0.012193708609271525, 0.01655687032446782] and parameters: {'n_layers': 1, 'embedding_dim': 128, 'lr': 0.007418507936625942, 'lambda_val': 2.016080555024451e-06, 'batch_size': 1461, 'optimizer': 'Adam'}.
2026-05-24 00:45:57,073 - experiment_functions - INFO - Early stopping at epoch 750. Best Metrics: (0.016573523545886905, 0.013451986754966887, 0.017394446949406436)
2026-05-24 00:45:57,266 - optuna.study.study - INFO - Trial 198 finished with values: [0.016573523545886905, 0.013451986754966887, 0.017394446949406436] and parameters: {'n_layers': 3, 'embedding_dim': 128, 'lr': 0.0007988736084506005, 'lambda_val': 0.014393132529370842, 'batch_size': 1959, 'optimizer': 'Adam'}.
2026-05-24 00:46:11,388 - experiment_functions - INFO - Early stopping at epoch 1250. Best Metrics: (0.016938324043590282, 0.014495033112582783, 0.018044826069284637)
2026-05-24 00:46:12,395 - optuna.study.study - INFO - Trial 199 finished with values: [0.016938324043590282, 0.014495033112582783, 0.018044826069284637] and parameters: {'n_layers': 3, 'embedding_dim': 128, 'lr': 0.00036341523831303154, 'lambda_val': 0.014393132529370842, 'batch_size': 1439, 'optimizer': 'Adam'}.
2026-05-24 00:46:21,815 - experiment_functions - INFO - Early stopping at epoch 800. Best Metrics: (0.01965595285665726, 0.015016556291390731, 0.02043257330443491)
2026-05-24 00:46:22,126 - optuna.study.study - INFO - Trial 200 finished with values: [0.01965595285665726, 0.015016556291390731, 0.02043257330443491] and parameters: {'n_layers': 3, 'embedding_dim': 32, 'lr': 0.0010358017727309806, 'lambda_val': 0.0019340508111572378, 'batch_size': 2478, 'optimizer': 'Adam'}.
2026-05-24 00:46:38,199 - experiment_functions - INFO - Early stopping at epoch 1450. Best Metrics: (0.02083604916641852, 0.01587748344370861, 0.021545509411418775)
2026-05-24 00:46:38,535 - optuna.study.study - INFO - Trial 201 finished with values: [0.02083604916641852, 0.01587748344370861, 0.021545509411418775] and parameters: {'n_layers': 3, 'embedding_dim': 64, 'lr': 0.00047964559588289365, 'lambda_val': 6.582654604886626e-06, 'batch_size': 1433, 'optimizer': 'RMSprop'}.
2026-05-24 00:46:47,097 - experiment_functions - INFO - Early stopping at epoch 750. Best Metrics: (0.019996801563580337, 0.014495033112582783, 0.019898919718647014)
2026-05-24 00:46:47,178 - optuna.study.study - INFO - Trial 202 finished with values: [0.019996801563580337, 0.014495033112582783, 0.019898919718647014] and parameters: {'n_layers': 2, 'embedding_dim': 32, 'lr': 0.0011608542213191663, 'lambda_val': 0.014393132529370842, 'batch_size': 2049, 'optimizer': 'Adam'}.
2026-05-24 00:46:53,268 - experiment_functions - INFO - Early stopping at epoch 500. Best Metrics: (0.005732941220877674, 0.004958609271523179, 0.006012451821921617)
2026-05-24 00:46:53,391 - optuna.study.study - INFO - Trial 203 finished with values: [0.005732941220877674, 0.004958609271523179, 0.006012451821921617] and parameters: {'n_layers': 3, 'embedding_dim': 32, 'lr': 0.03673090415497044, 'lambda_val': 0.012312281188503879, 'batch_size': 4059, 'optimizer': 'Adam'}.
2026-05-24 00:47:21,369 - experiment_functions - INFO - Early stopping at epoch 2700. Best Metrics: (0.019372567127454852, 0.014147350993377484, 0.019853610515608088)
2026-05-24 00:47:21,935 - optuna.study.study - INFO - Trial 204 finished with values: [0.019372567127454852, 0.014147350993377484, 0.019853610515608088] and parameters: {'n_layers': 1, 'embedding_dim': 64, 'lr': 0.00037394670395286464, 'lambda_val': 0.001970520642014681, 'batch_size': 1672, 'optimizer': 'RMSprop'}.
2026-05-24 00:47:32,596 - experiment_functions - INFO - Early stopping at epoch 850. Best Metrics: (0.026380209304967844, 0.02095198675496689, 0.026518551125970215)
2026-05-24 00:47:32,688 - optuna.study.study - INFO - Trial 205 finished with values: [0.026380209304967844, 0.02095198675496689, 0.026518551125970215] and parameters: {'n_layers': 4, 'embedding_dim': 32, 'lr': 0.0010358017727309806, 'lambda_val': 0.04990172064077824, 'batch_size': 648, 'optimizer': 'Adam'}.
2026-05-24 00:47:54,027 - experiment_functions - INFO - Early stopping at epoch 2000. Best Metrics: (0.016637668005488892, 0.013418874172185432, 0.01804249083026598)
2026-05-24 00:47:54,389 - optuna.study.study - INFO - Trial 206 finished with values: [0.016637668005488892, 0.013418874172185432, 0.01804249083026598] and parameters: {'n_layers': 3, 'embedding_dim': 32, 'lr': 0.00037394670395286464, 'lambda_val': 4.782162986357678e-05, 'batch_size': 2478, 'optimizer': 'Adam'}.
2026-05-24 00:48:04,839 - experiment_functions - INFO - Early stopping at epoch 950. Best Metrics: (0.016221581971382404, 0.011986754966887418, 0.016237787428729118)
2026-05-24 00:48:05,607 - optuna.study.study - INFO - Trial 207 finished with values: [0.016221581971382404, 0.011986754966887418, 0.016237787428729118] and parameters: {'n_layers': 1, 'embedding_dim': 32, 'lr': 0.0011608542213191663, 'lambda_val': 0.04990172064077824, 'batch_size': 947, 'optimizer': 'Adam'}.
2026-05-24 00:48:14,941 - experiment_functions - INFO - Early stopping at epoch 800. Best Metrics: (0.024592152428461217, 0.01941225165562914, 0.025537477949594586)
