2026-05-24 07:14:51,377 - optuna.study.study - INFO - Trial 125 finished with values: [0.0425621798882208, 0.012483443708609272, 0.028044756305863516] and parameters: {'n_layers': 4, 'embedding_dim': 256, 'lr': 0.0022852766065388956, 'lambda_val': 0.0005921100290130649, 'batch_size': 2153, 'optimizer': 'RMSprop'}.
2026-05-24 07:15:04,186 - experiment_functions - INFO - Early stopping at epoch 1000. Best Metrics: (0.03581901452311071, 0.011531456953642385, 0.024794013469599942)
2026-05-24 07:15:04,282 - optuna.study.study - INFO - Trial 126 finished with values: [0.03581901452311071, 0.011531456953642385, 0.024794013469599942] and parameters: {'n_layers': 2, 'embedding_dim': 128, 'lr': 0.007613283644844984, 'lambda_val': 0.00828097881980844, 'batch_size': 3263, 'optimizer': 'RMSprop'}.
2026-05-24 07:15:54,175 - optuna.study.study - INFO - Trial 127 finished with values: [0.041050946146058434, 0.012698675496688742, 0.02728450545541316] and parameters: {'n_layers': 3, 'embedding_dim': 96, 'lr': 0.0022852766065388956, 'lambda_val': 2.4948249425733372e-05, 'batch_size': 3042, 'optimizer': 'RMSprop'}.
2026-05-24 07:16:06,067 - experiment_functions - INFO - Early stopping at epoch 950. Best Metrics: (0.04402031247713932, 0.022947019867549667, 0.04131561381257252)
2026-05-24 07:16:06,167 - optuna.study.study - INFO - Trial 128 finished with values: [0.04402031247713932, 0.022947019867549667, 0.04131561381257252] and parameters: {'n_layers': 2, 'embedding_dim': 32, 'lr': 0.0004427403826510948, 'lambda_val': 0.0023999610459478756, 'batch_size': 3507, 'optimizer': 'RMSprop'}.
2026-05-24 07:16:18,263 - experiment_functions - INFO - Early stopping at epoch 900. Best Metrics: (0.04883164904408439, 0.023269867549668876, 0.04614445499128997)
2026-05-24 07:16:19,668 - optuna.study.study - INFO - Trial 129 finished with values: [0.04883164904408439, 0.023269867549668876, 0.04614445499128997] and parameters: {'n_layers': 2, 'embedding_dim': 96, 'lr': 0.00034776281673029824, 'lambda_val': 6.875947708093636e-05, 'batch_size': 3042, 'optimizer': 'Adam'}.
2026-05-24 07:16:56,292 - experiment_functions - INFO - Early stopping at epoch 3000. Best Metrics: (0.05353483918842512, 0.01697847682119205, 0.036617355994700916)
2026-05-24 07:16:56,384 - optuna.study.study - INFO - Trial 130 finished with values: [0.05353483918842512, 0.01697847682119205, 0.036617355994700916] and parameters: {'n_layers': 1, 'embedding_dim': 256, 'lr': 0.008825737855916319, 'lambda_val': 0.00828097881980844, 'batch_size': 3263, 'optimizer': 'RMSprop'}.
2026-05-24 07:17:40,034 - optuna.study.study - INFO - Trial 131 finished with values: [0.0396822026020522, 0.013427152317880796, 0.028496157902594715] and parameters: {'n_layers': 1, 'embedding_dim': 64, 'lr': 0.021664273766474708, 'lambda_val': 0.0006476604301141326, 'batch_size': 2437, 'optimizer': 'RMSprop'}.
2026-05-24 07:17:57,704 - experiment_functions - INFO - Early stopping at epoch 1350. Best Metrics: (0.0695606532412121, 0.029958609271523176, 0.06077405259105174)
2026-05-24 07:17:57,786 - optuna.study.study - INFO - Trial 132 finished with values: [0.0695606532412121, 0.029958609271523176, 0.06077405259105174] and parameters: {'n_layers': 1, 'embedding_dim': 256, 'lr': 0.0004427403826510948, 'lambda_val': 2.4948249425733372e-05, 'batch_size': 1257, 'optimizer': 'Adam'}.
2026-05-24 07:18:08,709 - experiment_functions - INFO - Early stopping at epoch 600. Best Metrics: (0.03545798504253606, 0.017408940397350994, 0.03004255224350873)
2026-05-24 07:18:09,379 - optuna.study.study - INFO - Trial 133 finished with values: [0.03545798504253606, 0.017408940397350994, 0.03004255224350873] and parameters: {'n_layers': 4, 'embedding_dim': 256, 'lr': 0.0004427403826510948, 'lambda_val': 0.0023999610459478756, 'batch_size': 803, 'optimizer': 'RMSprop'}.
2026-05-24 07:18:55,039 - optuna.study.study - INFO - Trial 134 finished with values: [0.009204652164858008, 0.005902317880794703, 0.008450261194172219] and parameters: {'n_layers': 2, 'embedding_dim': 96, 'lr': 5.469206106625236e-05, 'lambda_val': 6.875947708093636e-05, 'batch_size': 1536, 'optimizer': 'RMSprop'}.
2026-05-24 07:19:40,929 - optuna.study.study - INFO - Trial 135 finished with values: [0.008942743873730676, 0.00593543046357616, 0.00868678520957217] and parameters: {'n_layers': 2, 'embedding_dim': 96, 'lr': 4.9311645659208955e-05, 'lambda_val': 7.532370886356362e-05, 'batch_size': 2653, 'optimizer': 'Adam'}.
2026-05-24 07:19:49,691 - experiment_functions - INFO - Early stopping at epoch 600. Best Metrics: (0.024605048514374395, 0.01044701986754967, 0.018914666932632298)
2026-05-24 07:19:49,793 - optuna.study.study - INFO - Trial 136 finished with values: [0.024605048514374395, 0.01044701986754967, 0.018914666932632298] and parameters: {'n_layers': 4, 'embedding_dim': 64, 'lr': 0.0014509434531037974, 'lambda_val': 1.738534368780138e-05, 'batch_size': 3968, 'optimizer': 'Adam'}.
2026-05-24 07:20:01,621 - experiment_functions - INFO - Early stopping at epoch 1000. Best Metrics: (0.05009070666843834, 0.015074503311258277, 0.033880815963757964)
2026-05-24 07:20:01,940 - optuna.study.study - INFO - Trial 137 finished with values: [0.05009070666843834, 0.015074503311258277, 0.033880815963757964] and parameters: {'n_layers': 1, 'embedding_dim': 64, 'lr': 0.008825737855916319, 'lambda_val': 0.0008118357014636037, 'batch_size': 2938, 'optimizer': 'RMSprop'}.
2026-05-24 07:21:08,540 - optuna.study.study - INFO - Trial 138 finished with values: [0.03756009474295941, 0.011630794701986755, 0.02470493878793302] and parameters: {'n_layers': 4, 'embedding_dim': 256, 'lr': 0.0014509434531037974, 'lambda_val': 0.00013335196567720495, 'batch_size': 2219, 'optimizer': 'RMSprop'}.
2026-05-24 07:21:54,199 - experiment_functions - INFO - Early stopping at epoch 3450. Best Metrics: (0.030502278489716934, 0.009644039735099339, 0.02001411778051719)
2026-05-24 07:21:54,299 - optuna.study.study - INFO - Trial 139 finished with values: [0.030502278489716934, 0.009644039735099339, 0.02001411778051719] and parameters: {'n_layers': 4, 'embedding_dim': 96, 'lr': 0.0038879080432731965, 'lambda_val': 0.0005921100290130649, 'batch_size': 803, 'optimizer': 'RMSprop'}.
2026-05-24 07:22:07,003 - experiment_functions - INFO - Early stopping at epoch 850. Best Metrics: (0.05280172134518405, 0.022798013245033114, 0.045538723756088216)
2026-05-24 07:22:07,082 - optuna.study.study - INFO - Trial 140 finished with values: [0.05280172134518405, 0.022798013245033114, 0.045538723756088216] and parameters: {'n_layers': 2, 'embedding_dim': 256, 'lr': 0.00034776281673029824, 'lambda_val': 0.006128221667042127, 'batch_size': 3042, 'optimizer': 'Adam'}.
2026-05-24 07:22:58,226 - optuna.study.study - INFO - Trial 141 finished with values: [0.0256468883636148, 0.012591059602649007, 0.022385894427199335] and parameters: {'n_layers': 4, 'embedding_dim': 64, 'lr': 8.21225354130991e-05, 'lambda_val': 3.426862940771237e-05, 'batch_size': 2219, 'optimizer': 'Adam'}.
2026-05-24 07:23:50,224 - optuna.study.study - INFO - Trial 142 finished with values: [0.04559582105635059, 0.02769039735099338, 0.04492895321341373] and parameters: {'n_layers': 4, 'embedding_dim': 32, 'lr': 0.00022442725513326185, 'lambda_val': 6.417173701743343e-05, 'batch_size': 2492, 'optimizer': 'RMSprop'}.
2026-05-24 07:24:38,004 - optuna.study.study - INFO - Trial 143 finished with values: [0.03896166441280435, 0.017450331125827816, 0.03508446879161817] and parameters: {'n_layers': 3, 'embedding_dim': 32, 'lr': 0.0002382334927885136, 'lambda_val': 1.743597466559768e-05, 'batch_size': 2331, 'optimizer': 'RMSprop'}.
2026-05-24 07:24:45,170 - experiment_functions - INFO - Early stopping at epoch 550. Best Metrics: (0.022263011652296848, 0.01086092715231788, 0.019621866656146368)
2026-05-24 07:24:45,265 - optuna.study.study - INFO - Trial 144 finished with values: [0.022263011652296848, 0.01086092715231788, 0.019621866656146368] and parameters: {'n_layers': 3, 'embedding_dim': 32, 'lr': 0.0022852766065388956, 'lambda_val': 0.0006476604301141326, 'batch_size': 2437, 'optimizer': 'RMSprop'}.
2026-05-24 07:25:07,169 - experiment_functions - INFO - Early stopping at epoch 1600. Best Metrics: (0.04944985181122051, 0.024586092715231787, 0.0461625732883996)
2026-05-24 07:25:07,412 - optuna.study.study - INFO - Trial 145 finished with values: [0.04944985181122051, 0.024586092715231787, 0.0461625732883996] and parameters: {'n_layers': 4, 'embedding_dim': 64, 'lr': 0.0002713987874488627, 'lambda_val': 0.0005921100290130649, 'batch_size': 891, 'optimizer': 'RMSprop'}.
2026-05-24 07:25:20,815 - experiment_functions - INFO - Early stopping at epoch 1050. Best Metrics: (0.053196298831340805, 0.02283112582781457, 0.04183132040981119)
2026-05-24 07:25:20,902 - optuna.study.study - INFO - Trial 146 finished with values: [0.053196298831340805, 0.02283112582781457, 0.04183132040981119] and parameters: {'n_layers': 1, 'embedding_dim': 256, 'lr': 0.00034776281673029824, 'lambda_val': 0.02228654826917861, 'batch_size': 3042, 'optimizer': 'Adam'}.
2026-05-24 07:25:48,739 - experiment_functions - INFO - Early stopping at epoch 2050. Best Metrics: (0.04175597927120833, 0.021299668874172187, 0.042178770996500956)
2026-05-24 07:25:48,845 - optuna.study.study - INFO - Trial 147 finished with values: [0.04175597927120833, 0.021299668874172187, 0.042178770996500956] and parameters: {'n_layers': 4, 'embedding_dim': 64, 'lr': 0.00022442725513326185, 'lambda_val': 0.00013335196567720495, 'batch_size': 2492, 'optimizer': 'RMSprop'}.
2026-05-24 07:26:35,354 - optuna.study.study - INFO - Trial 148 finished with values: [0.028513911961838605, 0.011589403973509934, 0.020995118128053894] and parameters: {'n_layers': 3, 'embedding_dim': 32, 'lr': 0.0981108711077032, 'lambda_val': 0.0003225666467685565, 'batch_size': 4089, 'optimizer': 'RMSprop'}.
2026-05-24 07:26:42,553 - experiment_functions - INFO - Early stopping at epoch 550. Best Metrics: (0.05194806804213875, 0.024089403973509935, 0.04762219847337658)
2026-05-24 07:26:42,648 - optuna.study.study - INFO - Trial 149 finished with values: [0.05194806804213875, 0.024089403973509935, 0.04762219847337658] and parameters: {'n_layers': 1, 'embedding_dim': 32, 'lr': 0.0014509434531037974, 'lambda_val': 2.4948249425733372e-05, 'batch_size': 3968, 'optimizer': 'RMSprop'}.
2026-05-24 07:27:10,295 - experiment_functions - INFO - Early stopping at epoch 2050. Best Metrics: (0.04109014156653366, 0.021100993377483442, 0.0405862200827159)
2026-05-24 07:27:10,392 - optuna.study.study - INFO - Trial 150 finished with values: [0.04109014156653366, 0.021100993377483442, 0.0405862200827159] and parameters: {'n_layers': 4, 'embedding_dim': 64, 'lr': 0.00022442725513326185, 'lambda_val': 6.875947708093636e-05, 'batch_size': 2492, 'optimizer': 'RMSprop'}.
2026-05-24 07:27:18,152 - experiment_functions - INFO - Early stopping at epoch 550. Best Metrics: (0.03682660317277523, 0.018245033112582784, 0.034389104013497006)
2026-05-24 07:27:18,239 - optuna.study.study - INFO - Trial 151 finished with values: [0.03682660317277523, 0.018245033112582784, 0.034389104013497006] and parameters: {'n_layers': 3, 'embedding_dim': 96, 'lr': 0.0022852766065388956, 'lambda_val': 0.0023999610459478756, 'batch_size': 1670, 'optimizer': 'Adam'}.
2026-05-24 07:28:07,297 - optuna.study.study - INFO - Trial 152 finished with values: [0.03575747866474222, 0.01076158940397351, 0.023576211608374115] and parameters: {'n_layers': 4, 'embedding_dim': 32, 'lr': 0.00538504984502545, 'lambda_val': 6.417173701743343e-05, 'batch_size': 3449, 'optimizer': 'RMSprop'}.
2026-05-24 07:28:18,333 - experiment_functions - INFO - Early stopping at epoch 800. Best Metrics: (0.06130231178295155, 0.025256622516556294, 0.05221132207508064)
2026-05-24 07:28:18,648 - optuna.study.study - INFO - Trial 153 finished with values: [0.06130231178295155, 0.025256622516556294, 0.05221132207508064] and parameters: {'n_layers': 1, 'embedding_dim': 256, 'lr': 0.0004427403826510948, 'lambda_val': 0.0023999610459478756, 'batch_size': 3507, 'optimizer': 'RMSprop'}.
2026-05-24 07:28:30,346 - experiment_functions - INFO - Early stopping at epoch 700. Best Metrics: (0.03299039575769801, 0.015571192052980133, 0.027029171727004888)
2026-05-24 07:28:30,447 - optuna.study.study - INFO - Trial 154 finished with values: [0.03299039575769801, 0.015571192052980133, 0.027029171727004888] and parameters: {'n_layers': 3, 'embedding_dim': 256, 'lr': 0.00034776281673029824, 'lambda_val': 0.006128221667042127, 'batch_size': 4089, 'optimizer': 'Adam'}.
2026-05-24 07:29:24,013 - optuna.study.study - INFO - Trial 155 finished with values: [0.04276309383690416, 0.012938741721854306, 0.027899122360828168] and parameters: {'n_layers': 4, 'embedding_dim': 96, 'lr': 0.0038879080432731965, 'lambda_val': 1.1068932700778532e-05, 'batch_size': 803, 'optimizer': 'RMSprop'}.
2026-05-24 07:29:31,554 - experiment_functions - INFO - Early stopping at epoch 600. Best Metrics: (0.06051951831821397, 0.025827814569536423, 0.0499903432897896)
2026-05-24 07:29:31,656 - optuna.study.study - INFO - Trial 156 finished with values: [0.06051951831821397, 0.025827814569536423, 0.0499903432897896] and parameters: {'n_layers': 1, 'embedding_dim': 32, 'lr': 0.0014509434531037974, 'lambda_val': 0.0006476604301141326, 'batch_size': 2437, 'optimizer': 'RMSprop'}.
2026-05-24 07:29:41,678 - experiment_functions - INFO - Early stopping at epoch 700. Best Metrics: (0.033633646779565415, 0.01544701986754967, 0.028935226557793105)
2026-05-24 07:29:42,139 - optuna.study.study - INFO - Trial 157 finished with values: [0.033633646779565415, 0.01544701986754967, 0.028935226557793105] and parameters: {'n_layers': 3, 'embedding_dim': 96, 'lr': 0.0004427403826510948, 'lambda_val': 0.00018319870679849623, 'batch_size': 2891, 'optimizer': 'RMSprop'}.
2026-05-24 07:29:54,207 - experiment_functions - INFO - Early stopping at epoch 650. Best Metrics: (0.03220101503016286, 0.014991721854304637, 0.02748960092882337)
2026-05-24 07:29:54,398 - optuna.study.study - INFO - Trial 158 finished with values: [0.03220101503016286, 0.014991721854304637, 0.02748960092882337] and parameters: {'n_layers': 4, 'embedding_dim': 256, 'lr': 0.00034776281673029824, 'lambda_val': 6.417173701743343e-05, 'batch_size': 3042, 'optimizer': 'RMSprop'}.
2026-05-24 07:30:11,711 - experiment_functions - INFO - Early stopping at epoch 1400. Best Metrics: (0.00970916389039526, 0.004205298013245033, 0.006782033745196976)
2026-05-24 07:30:11,805 - optuna.study.study - INFO - Trial 159 finished with values: [0.00970916389039526, 0.004205298013245033, 0.006782033745196976] and parameters: {'n_layers': 4, 'embedding_dim': 32, 'lr': 0.0022852766065388956, 'lambda_val': 0.0470632200359335, 'batch_size': 2492, 'optimizer': 'RMSprop'}.
2026-05-24 07:30:19,799 - experiment_functions - INFO - Early stopping at epoch 600. Best Metrics: (0.023484483063628832, 0.011473509933774833, 0.0175072917627953)
2026-05-24 07:30:19,895 - optuna.study.study - INFO - Trial 160 finished with values: [0.023484483063628832, 0.011473509933774833, 0.0175072917627953] and parameters: {'n_layers': 2, 'embedding_dim': 96, 'lr': 0.0026219914609704057, 'lambda_val': 0.07934154629698217, 'batch_size': 3042, 'optimizer': 'Adam'}.
2026-05-24 07:31:00,004 - experiment_functions - INFO - Early stopping at epoch 2950. Best Metrics: (0.041844340048218104, 0.011804635761589405, 0.026648982352967046)
2026-05-24 07:31:00,104 - optuna.study.study - INFO - Trial 161 finished with values: [0.041844340048218104, 0.011804635761589405, 0.026648982352967046] and parameters: {'n_layers': 4, 'embedding_dim': 96, 'lr': 0.006280194246408557, 'lambda_val': 6.875947708093636e-05, 'batch_size': 3042, 'optimizer': 'Adam'}.
2026-05-24 07:31:10,807 - experiment_functions - INFO - Early stopping at epoch 950. Best Metrics: (0.01206054299690938, 0.005240066225165563, 0.009051963834006705)
2026-05-24 07:31:11,148 - optuna.study.study - INFO - Trial 162 finished with values: [0.01206054299690938, 0.005240066225165563, 0.009051963834006705] and parameters: {'n_layers': 1, 'embedding_dim': 64, 'lr': 0.07681131929868329, 'lambda_val': 0.00010833547050633565, 'batch_size': 2492, 'optimizer': 'RMSprop'}.
2026-05-24 07:31:40,613 - experiment_functions - INFO - Early stopping at epoch 2650. Best Metrics: (0.050918643297931165, 0.016175496688741724, 0.03501270831495503)
2026-05-24 07:31:41,019 - optuna.study.study - INFO - Trial 163 finished with values: [0.050918643297931165, 0.016175496688741724, 0.03501270831495503] and parameters: {'n_layers': 1, 'embedding_dim': 64, 'lr': 0.008825737855916319, 'lambda_val': 0.00828097881980844, 'batch_size': 3968, 'optimizer': 'RMSprop'}.
2026-05-24 07:31:48,704 - experiment_functions - INFO - Early stopping at epoch 550. Best Metrics: (0.02626383586237998, 0.012417218543046357, 0.02192208197485967)
2026-05-24 07:31:48,811 - optuna.study.study - INFO - Trial 164 finished with values: [0.02626383586237998, 0.012417218543046357, 0.02192208197485967] and parameters: {'n_layers': 3, 'embedding_dim': 64, 'lr': 0.0014509434531037974, 'lambda_val': 9.2363995018798e-06, 'batch_size': 1559, 'optimizer': 'RMSprop'}.
2026-05-24 07:31:55,143 - experiment_functions - INFO - Early stopping at epoch 500. Best Metrics: (0.0045927708470491465, 0.004271523178807947, 0.005153525119506112)
2026-05-24 07:31:55,819 - optuna.study.study - INFO - Trial 165 finished with values: [0.0045927708470491465, 0.004271523178807947, 0.005153525119506112] and parameters: {'n_layers': 2, 'embedding_dim': 32, 'lr': 0.00034776281673029824, 'lambda_val': 6.875947708093636e-05, 'batch_size': 3042, 'optimizer': 'SGD'}.
2026-05-24 07:32:35,129 - experiment_functions - INFO - Early stopping at epoch 3750. Best Metrics: (0.006039890085670877, 0.004652317880794702, 0.006022495982208026)
2026-05-24 07:32:35,219 - optuna.study.study - INFO - Trial 166 finished with values: [0.006039890085670877, 0.004652317880794702, 0.006022495982208026] and parameters: {'n_layers': 1, 'embedding_dim': 96, 'lr': 4.226394583604281e-05, 'lambda_val': 0.0008118357014636037, 'batch_size': 3263, 'optimizer': 'RMSprop'}.
2026-05-24 07:32:53,181 - experiment_functions - INFO - Early stopping at epoch 1500. Best Metrics: (0.05865574858842288, 0.02497516556291391, 0.052592406778094354)
2026-05-24 07:32:53,272 - optuna.study.study - INFO - Trial 167 finished with values: [0.05865574858842288, 0.02497516556291391, 0.052592406778094354] and parameters: {'n_layers': 1, 'embedding_dim': 96, 'lr': 0.0003154862248546408, 'lambda_val': 7.532370886356362e-05, 'batch_size': 4018, 'optimizer': 'Adam'}.
2026-05-24 07:33:01,659 - experiment_functions - INFO - Early stopping at epoch 550. Best Metrics: (0.027271843536999796, 0.012723509933774833, 0.02177413715122705)
2026-05-24 07:33:02,767 - optuna.study.study - INFO - Trial 168 finished with values: [0.027271843536999796, 0.012723509933774833, 0.02177413715122705] and parameters: {'n_layers': 4, 'embedding_dim': 96, 'lr': 0.0038879080432731965, 'lambda_val': 7.532370886356362e-05, 'batch_size': 4018, 'optimizer': 'Adam'}.
2026-05-24 07:33:11,502 - experiment_functions - INFO - Early stopping at epoch 550. Best Metrics: (0.05394540718867467, 0.02505794701986755, 0.049185573741692065)
2026-05-24 07:33:11,609 - optuna.study.study - INFO - Trial 169 finished with values: [0.05394540718867467, 0.02505794701986755, 0.049185573741692065] and parameters: {'n_layers': 2, 'embedding_dim': 256, 'lr': 0.002893369128168616, 'lambda_val': 1.743597466559768e-05, 'batch_size': 2331, 'optimizer': 'Adam'}.
2026-05-24 07:33:32,213 - experiment_functions - INFO - Early stopping at epoch 1150. Best Metrics: (0.04948350071605018, 0.024950331125827813, 0.047985787556965274)
2026-05-24 07:33:32,441 - optuna.study.study - INFO - Trial 170 finished with values: [0.04948350071605018, 0.024950331125827813, 0.047985787556965274] and parameters: {'n_layers': 4, 'embedding_dim': 256, 'lr': 0.00022442725513326185, 'lambda_val': 2.4948249425733372e-05, 'batch_size': 534, 'optimizer': 'Adam'}.
2026-05-24 07:33:43,403 - experiment_functions - INFO - Early stopping at epoch 850. Best Metrics: (0.04634749902766989, 0.0214817880794702, 0.042784505600479805)
2026-05-24 07:33:44,306 - optuna.study.study - INFO - Trial 171 finished with values: [0.04634749902766989, 0.0214817880794702, 0.042784505600479805] and parameters: {'n_layers': 2, 'embedding_dim': 64, 'lr': 0.0004427403826510948, 'lambda_val': 0.0023999610459478756, 'batch_size': 3507, 'optimizer': 'Adam'}.
2026-05-24 07:33:55,609 - experiment_functions - INFO - Early stopping at epoch 750. Best Metrics: (0.037153174556631315, 0.02072847682119205, 0.03562016952158865)
2026-05-24 07:33:57,003 - optuna.study.study - INFO - Trial 172 finished with values: [0.037153174556631315, 0.02072847682119205, 0.03562016952158865] and parameters: {'n_layers': 4, 'embedding_dim': 96, 'lr': 0.0004427403826510948, 'lambda_val': 2.4948249425733372e-05, 'batch_size': 1506, 'optimizer': 'Adam'}.
2026-05-24 07:34:18,683 - experiment_functions - INFO - Early stopping at epoch 1650. Best Metrics: (0.0493803398560908, 0.022715231788079472, 0.0453885042995169)
2026-05-24 07:34:18,793 - optuna.study.study - INFO - Trial 173 finished with values: [0.0493803398560908, 0.022715231788079472, 0.0453885042995169] and parameters: {'n_layers': 4, 'embedding_dim': 32, 'lr': 0.0004427403826510948, 'lambda_val': 1.1068932700778532e-05, 'batch_size': 803, 'optimizer': 'RMSprop'}.
2026-05-24 07:34:37,813 - experiment_functions - INFO - Early stopping at epoch 1450. Best Metrics: (0.06955236754973351, 0.028749999999999998, 0.058751919197675945)
