2026-05-24 02:45:39,475 - optuna.study.study - INFO - Trial 32 finished with values: [0.004958669962780764, 0.004197019867549669, 0.005134229050040353] and parameters: {'n_layers': 4, 'embedding_dim': 128, 'lr': 0.0018322739293328597, 'lambda_val': 4.264894974358096e-05, 'batch_size': 1308, 'optimizer': 'SGD'}.
2026-05-24 02:45:47,328 - experiment_functions - INFO - Early stopping at epoch 650. Best Metrics: (0.019376343819165587, 0.015670529801324506, 0.020614046845217764)
2026-05-24 02:45:47,436 - optuna.study.study - INFO - Trial 33 finished with values: [0.019376343819165587, 0.015670529801324506, 0.020614046845217764] and parameters: {'n_layers': 4, 'embedding_dim': 32, 'lr': 0.0008654503808156264, 'lambda_val': 0.003987651252810029, 'batch_size': 2315, 'optimizer': 'RMSprop'}.
2026-05-24 02:45:53,461 - experiment_functions - INFO - Early stopping at epoch 500. Best Metrics: (0.006819564576903459, 0.0058526490066225165, 0.007310594665745826)
2026-05-24 02:45:54,341 - optuna.study.study - INFO - Trial 34 finished with values: [0.006819564576903459, 0.0058526490066225165, 0.007310594665745826] and parameters: {'n_layers': 4, 'embedding_dim': 128, 'lr': 0.031379140137514784, 'lambda_val': 0.022459435511763805, 'batch_size': 1155, 'optimizer': 'RMSprop'}.
2026-05-24 02:46:01,066 - experiment_functions - INFO - Early stopping at epoch 550. Best Metrics: (0.014619893068001856, 0.011498344370860928, 0.015221244222581004)
2026-05-24 02:46:01,157 - optuna.study.study - INFO - Trial 35 finished with values: [0.014619893068001856, 0.011498344370860928, 0.015221244222581004] and parameters: {'n_layers': 2, 'embedding_dim': 96, 'lr': 0.0039180600808985284, 'lambda_val': 0.0002989351068597163, 'batch_size': 3324, 'optimizer': 'RMSprop'}.
2026-05-24 02:46:10,660 - experiment_functions - INFO - Early stopping at epoch 850. Best Metrics: (0.017815089829047406, 0.013841059602649006, 0.018325839999450703)
2026-05-24 02:46:11,124 - optuna.study.study - INFO - Trial 36 finished with values: [0.017815089829047406, 0.013841059602649006, 0.018325839999450703] and parameters: {'n_layers': 2, 'embedding_dim': 64, 'lr': 0.000648779798240634, 'lambda_val': 0.011587187073107777, 'batch_size': 2171, 'optimizer': 'RMSprop'}.
2026-05-24 02:46:17,126 - experiment_functions - INFO - Early stopping at epoch 500. Best Metrics: (0.003907864703619094, 0.0036341059602649013, 0.004489529681316159)
2026-05-24 02:46:17,539 - optuna.study.study - INFO - Trial 37 finished with values: [0.003907864703619094, 0.0036341059602649013, 0.004489529681316159] and parameters: {'n_layers': 2, 'embedding_dim': 32, 'lr': 8.041505352841457e-05, 'lambda_val': 0.08248824459940468, 'batch_size': 2953, 'optimizer': 'Adam'}.
2026-05-24 02:46:24,113 - experiment_functions - INFO - Early stopping at epoch 550. Best Metrics: (0.009165709832112397, 0.00804635761589404, 0.009937569672339655)
2026-05-24 02:46:24,707 - optuna.study.study - INFO - Trial 38 finished with values: [0.009165709832112397, 0.00804635761589404, 0.009937569672339655] and parameters: {'n_layers': 2, 'embedding_dim': 96, 'lr': 0.010180953913395322, 'lambda_val': 0.0009138779935514293, 'batch_size': 2473, 'optimizer': 'RMSprop'}.
2026-05-24 02:46:30,695 - experiment_functions - INFO - Early stopping at epoch 500. Best Metrics: (0.004574989976281768, 0.0037913907284768214, 0.004727011556519228)
2026-05-24 02:46:31,265 - optuna.study.study - INFO - Trial 39 finished with values: [0.004574989976281768, 0.0037913907284768214, 0.004727011556519228] and parameters: {'n_layers': 2, 'embedding_dim': 128, 'lr': 0.00010824064352803442, 'lambda_val': 0.00043211621732935186, 'batch_size': 2557, 'optimizer': 'SGD'}.
2026-05-24 02:46:37,885 - experiment_functions - INFO - Early stopping at epoch 550. Best Metrics: (0.01340678083787562, 0.011440397350993376, 0.014119887630735526)
2026-05-24 02:46:37,967 - optuna.study.study - INFO - Trial 40 finished with values: [0.01340678083787562, 0.011440397350993376, 0.014119887630735526] and parameters: {'n_layers': 4, 'embedding_dim': 128, 'lr': 0.0038780195363650994, 'lambda_val': 7.397534001840383e-06, 'batch_size': 1221, 'optimizer': 'RMSprop'}.
2026-05-24 02:47:00,256 - experiment_functions - INFO - Early stopping at epoch 1950. Best Metrics: (0.017262855633534236, 0.013791390728476821, 0.017963010224121348)
2026-05-24 02:47:00,338 - optuna.study.study - INFO - Trial 41 finished with values: [0.017262855633534236, 0.013791390728476821, 0.017963010224121348] and parameters: {'n_layers': 3, 'embedding_dim': 256, 'lr': 0.00022517253459576215, 'lambda_val': 0.0029913544657223035, 'batch_size': 1635, 'optimizer': 'RMSprop'}.
2026-05-24 02:47:41,189 - optuna.study.study - INFO - Trial 42 finished with values: [0.009253525416718195, 0.0073013245033112595, 0.00955669742646183] and parameters: {'n_layers': 4, 'embedding_dim': 96, 'lr': 5.509596373499777e-05, 'lambda_val': 0.005037732041758084, 'batch_size': 2308, 'optimizer': 'RMSprop'}.
2026-05-24 02:47:47,692 - experiment_functions - INFO - Early stopping at epoch 500. Best Metrics: (0.005674722576127309, 0.004279801324503311, 0.005421360892236394)
2026-05-24 02:47:47,780 - optuna.study.study - INFO - Trial 43 finished with values: [0.005674722576127309, 0.004279801324503311, 0.005421360892236394] and parameters: {'n_layers': 3, 'embedding_dim': 96, 'lr': 0.00195152605390384, 'lambda_val': 2.7696884336703e-05, 'batch_size': 3686, 'optimizer': 'SGD'}.
2026-05-24 02:48:04,336 - experiment_functions - INFO - Early stopping at epoch 1400. Best Metrics: (0.005262717515557886, 0.004197019867549669, 0.005174380835718862)
2026-05-24 02:48:04,982 - optuna.study.study - INFO - Trial 44 finished with values: [0.005262717515557886, 0.004197019867549669, 0.005174380835718862] and parameters: {'n_layers': 4, 'embedding_dim': 256, 'lr': 0.01814733966544771, 'lambda_val': 0.0001330030306186211, 'batch_size': 2333, 'optimizer': 'SGD'}.
2026-05-24 02:48:11,307 - experiment_functions - INFO - Early stopping at epoch 500. Best Metrics: (0.0044661579728562705, 0.004039735099337749, 0.004842943889749202)
2026-05-24 02:48:12,042 - optuna.study.study - INFO - Trial 45 finished with values: [0.0044661579728562705, 0.004039735099337749, 0.004842943889749202] and parameters: {'n_layers': 4, 'embedding_dim': 64, 'lr': 0.0017121388442921611, 'lambda_val': 0.012305114193378154, 'batch_size': 3908, 'optimizer': 'SGD'}.
2026-05-24 02:48:19,080 - experiment_functions - INFO - Early stopping at epoch 600. Best Metrics: (0.013761297482477682, 0.010703642384105962, 0.014901327025070275)
2026-05-24 02:48:19,168 - optuna.study.study - INFO - Trial 46 finished with values: [0.013761297482477682, 0.010703642384105962, 0.014901327025070275] and parameters: {'n_layers': 1, 'embedding_dim': 96, 'lr': 0.0030499723504765174, 'lambda_val': 0.008488287228418469, 'batch_size': 3293, 'optimizer': 'Adam'}.
2026-05-24 02:48:25,268 - experiment_functions - INFO - Early stopping at epoch 500. Best Metrics: (0.004734899808088805, 0.003998344370860927, 0.004891673673221096)
2026-05-24 02:48:25,703 - optuna.study.study - INFO - Trial 47 finished with values: [0.004734899808088805, 0.003998344370860927, 0.004891673673221096] and parameters: {'n_layers': 1, 'embedding_dim': 256, 'lr': 0.013504769284557515, 'lambda_val': 0.009637743291097666, 'batch_size': 1658, 'optimizer': 'SGD'}.
2026-05-24 02:49:05,498 - optuna.study.study - INFO - Trial 48 finished with values: [0.015011088335609827, 0.011043046357615894, 0.016245467239189612] and parameters: {'n_layers': 1, 'embedding_dim': 96, 'lr': 0.00018799820287048797, 'lambda_val': 1.6770272413234328e-06, 'batch_size': 851, 'optimizer': 'RMSprop'}.
2026-05-24 02:49:45,736 - optuna.study.study - INFO - Trial 49 finished with values: [0.015588155303736351, 0.011241721854304637, 0.01574062264808468] and parameters: {'n_layers': 2, 'embedding_dim': 96, 'lr': 0.00021574524362862762, 'lambda_val': 0.015202750041742976, 'batch_size': 713, 'optimizer': 'RMSprop'}.
2026-05-24 02:49:54,184 - experiment_functions - INFO - Early stopping at epoch 700. Best Metrics: (0.015544973526532028, 0.012466887417218546, 0.01645615817581709)
2026-05-24 02:49:54,275 - optuna.study.study - INFO - Trial 50 finished with values: [0.015544973526532028, 0.012466887417218546, 0.01645615817581709] and parameters: {'n_layers': 2, 'embedding_dim': 96, 'lr': 0.000648779798240634, 'lambda_val': 0.011587187073107777, 'batch_size': 3997, 'optimizer': 'RMSprop'}.
2026-05-24 02:50:01,159 - experiment_functions - INFO - Early stopping at epoch 550. Best Metrics: (0.011815247727894402, 0.009975165562913908, 0.01225186810408893)
2026-05-24 02:50:01,272 - optuna.study.study - INFO - Trial 51 finished with values: [0.011815247727894402, 0.009975165562913908, 0.01225186810408893] and parameters: {'n_layers': 4, 'embedding_dim': 96, 'lr': 0.0039180600808985284, 'lambda_val': 5.138211460433891e-05, 'batch_size': 2583, 'optimizer': 'RMSprop'}.
2026-05-24 02:50:13,999 - experiment_functions - INFO - Early stopping at epoch 1150. Best Metrics: (0.006526418620978647, 0.007110927152317881, 0.008801038510617946)
2026-05-24 02:50:14,580 - optuna.study.study - INFO - Trial 52 finished with values: [0.006526418620978647, 0.007110927152317881, 0.008801038510617946] and parameters: {'n_layers': 4, 'embedding_dim': 96, 'lr': 0.0038780195363650994, 'lambda_val': 0.05810316365964571, 'batch_size': 1221, 'optimizer': 'RMSprop'}.
2026-05-24 02:50:41,391 - experiment_functions - INFO - Early stopping at epoch 1950. Best Metrics: (0.021539555583788245, 0.017019867549668877, 0.0220967404307258)
2026-05-24 02:50:41,799 - optuna.study.study - INFO - Trial 53 finished with values: [0.021539555583788245, 0.017019867549668877, 0.0220967404307258] and parameters: {'n_layers': 3, 'embedding_dim': 96, 'lr': 0.0004649352000072556, 'lambda_val': 1.8203246882701353e-06, 'batch_size': 659, 'optimizer': 'Adam'}.
2026-05-24 02:50:47,890 - experiment_functions - INFO - Early stopping at epoch 500. Best Metrics: (0.010579585136837483, 0.0075745033112582785, 0.010613278399683245)
2026-05-24 02:50:48,977 - optuna.study.study - INFO - Trial 54 finished with values: [0.010579585136837483, 0.0075745033112582785, 0.010613278399683245] and parameters: {'n_layers': 2, 'embedding_dim': 96, 'lr': 0.010180953913395322, 'lambda_val': 0.0009138779935514293, 'batch_size': 2745, 'optimizer': 'RMSprop'}.
2026-05-24 02:51:29,989 - optuna.study.study - INFO - Trial 55 finished with values: [0.009627784904848495, 0.0070529801324503314, 0.009378445530323647] and parameters: {'n_layers': 3, 'embedding_dim': 96, 'lr': 5.509596373499777e-05, 'lambda_val': 1.8203246882701353e-06, 'batch_size': 2745, 'optimizer': 'RMSprop'}.
2026-05-24 02:51:36,637 - experiment_functions - INFO - Early stopping at epoch 550. Best Metrics: (0.01267411085971136, 0.010397350993377482, 0.01342631603513176)
2026-05-24 02:51:36,723 - optuna.study.study - INFO - Trial 56 finished with values: [0.01267411085971136, 0.010397350993377482, 0.01342631603513176] and parameters: {'n_layers': 2, 'embedding_dim': 96, 'lr': 0.009249552308725817, 'lambda_val': 5.1688078317297965e-06, 'batch_size': 1822, 'optimizer': 'RMSprop'}.
2026-05-24 02:51:47,914 - experiment_functions - INFO - Early stopping at epoch 900. Best Metrics: (0.016410735687825202, 0.013352649006622518, 0.017760771537094457)
2026-05-24 02:51:48,791 - optuna.study.study - INFO - Trial 57 finished with values: [0.016410735687825202, 0.013352649006622518, 0.017760771537094457] and parameters: {'n_layers': 3, 'embedding_dim': 256, 'lr': 0.0004649352000072556, 'lambda_val': 5.464200699430665e-05, 'batch_size': 2745, 'optimizer': 'Adam'}.
2026-05-24 02:51:55,327 - experiment_functions - INFO - Early stopping at epoch 550. Best Metrics: (0.016433946601766683, 0.01192880794701987, 0.016158437560428677)
2026-05-24 02:51:55,482 - optuna.study.study - INFO - Trial 58 finished with values: [0.016433946601766683, 0.01192880794701987, 0.016158437560428677] and parameters: {'n_layers': 1, 'embedding_dim': 128, 'lr': 0.009944040101896572, 'lambda_val': 0.00044595685832073573, 'batch_size': 1219, 'optimizer': 'Adam'}.
2026-05-24 02:52:01,342 - experiment_functions - INFO - Early stopping at epoch 500. Best Metrics: (0.009980878448668615, 0.0076158940397350995, 0.010043129913572845)
2026-05-24 02:52:02,614 - optuna.study.study - INFO - Trial 59 finished with values: [0.009980878448668615, 0.0076158940397350995, 0.010043129913572845] and parameters: {'n_layers': 4, 'embedding_dim': 64, 'lr': 0.019094942696727592, 'lambda_val': 0.00044595685832073573, 'batch_size': 3658, 'optimizer': 'RMSprop'}.
2026-05-24 02:52:08,827 - experiment_functions - INFO - Early stopping at epoch 550. Best Metrics: (0.011892297573183318, 0.00945364238410596, 0.01264149186503406)
2026-05-24 02:52:09,607 - optuna.study.study - INFO - Trial 60 finished with values: [0.011892297573183318, 0.00945364238410596, 0.01264149186503406] and parameters: {'n_layers': 3, 'embedding_dim': 32, 'lr': 0.047579164018428745, 'lambda_val': 2.8339303211396753e-05, 'batch_size': 2744, 'optimizer': 'Adam'}.
2026-05-24 02:52:20,657 - experiment_functions - INFO - Early stopping at epoch 950. Best Metrics: (0.017868378003658727, 0.013609271523178808, 0.018267933724171324)
2026-05-24 02:52:21,760 - optuna.study.study - INFO - Trial 61 finished with values: [0.017868378003658727, 0.013609271523178808, 0.018267933724171324] and parameters: {'n_layers': 3, 'embedding_dim': 96, 'lr': 0.0005881134405257853, 'lambda_val': 1.8203246882701353e-06, 'batch_size': 2745, 'optimizer': 'Adam'}.
2026-05-24 02:52:32,327 - experiment_functions - INFO - Early stopping at epoch 950. Best Metrics: (0.01810723975353257, 0.01337748344370861, 0.01803845295879212)
2026-05-24 02:52:32,707 - optuna.study.study - INFO - Trial 62 finished with values: [0.01810723975353257, 0.01337748344370861, 0.01803845295879212] and parameters: {'n_layers': 2, 'embedding_dim': 64, 'lr': 0.000648779798240634, 'lambda_val': 2.8339303211396753e-05, 'batch_size': 2171, 'optimizer': 'RMSprop'}.
2026-05-24 02:52:39,530 - experiment_functions - INFO - Early stopping at epoch 550. Best Metrics: (0.017420235424462152, 0.013750000000000002, 0.017887774697651522)
2026-05-24 02:52:39,981 - optuna.study.study - INFO - Trial 63 finished with values: [0.017420235424462152, 0.013750000000000002, 0.017887774697651522] and parameters: {'n_layers': 4, 'embedding_dim': 96, 'lr': 0.0018521591652371555, 'lambda_val': 0.00034199571335759705, 'batch_size': 2473, 'optimizer': 'RMSprop'}.
2026-05-24 02:52:47,882 - experiment_functions - INFO - Early stopping at epoch 650. Best Metrics: (0.018945358776564274, 0.015149006622516557, 0.020153750442386813)
2026-05-24 02:52:47,975 - optuna.study.study - INFO - Trial 64 finished with values: [0.018945358776564274, 0.015149006622516557, 0.020153750442386813] and parameters: {'n_layers': 4, 'embedding_dim': 96, 'lr': 0.0018521591652371555, 'lambda_val': 7.397534001840383e-06, 'batch_size': 1841, 'optimizer': 'Adam'}.
2026-05-24 02:52:53,820 - experiment_functions - INFO - Early stopping at epoch 500. Best Metrics: (0.005359306059501917, 0.004528145695364238, 0.005798749890347872)
2026-05-24 02:52:54,909 - optuna.study.study - INFO - Trial 65 finished with values: [0.005359306059501917, 0.004528145695364238, 0.005798749890347872] and parameters: {'n_layers': 3, 'embedding_dim': 64, 'lr': 0.00195152605390384, 'lambda_val': 2.7696884336703e-05, 'batch_size': 3686, 'optimizer': 'SGD'}.
2026-05-24 02:53:35,105 - optuna.study.study - INFO - Trial 66 finished with values: [0.008542434378557522, 0.006448675496688742, 0.008519686839379363] and parameters: {'n_layers': 4, 'embedding_dim': 64, 'lr': 5.509596373499777e-05, 'lambda_val': 0.005037732041758084, 'batch_size': 1254, 'optimizer': 'RMSprop'}.
2026-05-24 02:54:15,610 - optuna.study.study - INFO - Trial 67 finished with values: [0.014447128972060273, 0.010918874172185431, 0.014348039310167813] and parameters: {'n_layers': 2, 'embedding_dim': 96, 'lr': 0.00021574524362862762, 'lambda_val': 0.015202750041742976, 'batch_size': 713, 'optimizer': 'RMSprop'}.
2026-05-24 02:54:21,776 - experiment_functions - INFO - Early stopping at epoch 500. Best Metrics: (0.00491107766662535, 0.004039735099337749, 0.005103506859306813)
2026-05-24 02:54:22,263 - optuna.study.study - INFO - Trial 68 finished with values: [0.00491107766662535, 0.004039735099337749, 0.005103506859306813] and parameters: {'n_layers': 1, 'embedding_dim': 256, 'lr': 0.013504769284557515, 'lambda_val': 5.806220701306776e-05, 'batch_size': 1658, 'optimizer': 'SGD'}.
2026-05-24 02:55:02,931 - optuna.study.study - INFO - Trial 69 finished with values: [0.00889070172962774, 0.006961920529801325, 0.009695947034269516] and parameters: {'n_layers': 4, 'embedding_dim': 96, 'lr': 5.509596373499777e-05, 'lambda_val': 0.005037732041758084, 'batch_size': 1448, 'optimizer': 'RMSprop'}.
2026-05-24 02:55:09,573 - experiment_functions - INFO - Early stopping at epoch 550. Best Metrics: (0.010625124872596429, 0.009403973509933774, 0.011623596924527616)
2026-05-24 02:55:10,770 - optuna.study.study - INFO - Trial 70 finished with values: [0.010625124872596429, 0.009403973509933774, 0.011623596924527616] and parameters: {'n_layers': 2, 'embedding_dim': 64, 'lr': 0.0030499723504765174, 'lambda_val': 0.011587187073107777, 'batch_size': 3988, 'optimizer': 'RMSprop'}.
2026-05-24 02:55:17,746 - experiment_functions - INFO - Early stopping at epoch 550. Best Metrics: (0.005218077713158556, 0.0042963576158940395, 0.005842400944774258)
2026-05-24 02:55:17,889 - optuna.study.study - INFO - Trial 71 finished with values: [0.005218077713158556, 0.0042963576158940395, 0.005842400944774258] and parameters: {'n_layers': 3, 'embedding_dim': 256, 'lr': 0.009944040101896572, 'lambda_val': 0.0007015993710695603, 'batch_size': 3352, 'optimizer': 'SGD'}.
2026-05-24 02:55:36,086 - experiment_functions - INFO - Early stopping at epoch 1600. Best Metrics: (0.017571371770253724, 0.012748344370860927, 0.017308860243656098)
2026-05-24 02:55:36,398 - optuna.study.study - INFO - Trial 72 finished with values: [0.017571371770253724, 0.012748344370860927, 0.017308860243656098] and parameters: {'n_layers': 2, 'embedding_dim': 128, 'lr': 0.00036006007162814904, 'lambda_val': 0.0002989351068597163, 'batch_size': 3324, 'optimizer': 'RMSprop'}.
2026-05-24 02:56:18,475 - optuna.study.study - INFO - Trial 73 finished with values: [0.007110932366778905, 0.006018211920529801, 0.007921050597353289] and parameters: {'n_layers': 2, 'embedding_dim': 128, 'lr': 3.8179131253211894e-05, 'lambda_val': 0.0002604635685994012, 'batch_size': 2745, 'optimizer': 'Adam'}.
2026-05-24 02:56:40,117 - experiment_functions - INFO - Early stopping at epoch 1900. Best Metrics: (0.007086782403149449, 0.007971854304635763, 0.009098033915598552)
2026-05-24 02:56:40,742 - optuna.study.study - INFO - Trial 74 finished with values: [0.007086782403149449, 0.007971854304635763, 0.009098033915598552] and parameters: {'n_layers': 2, 'embedding_dim': 96, 'lr': 0.019094942696727592, 'lambda_val': 0.07574912686818955, 'batch_size': 2473, 'optimizer': 'RMSprop'}.
2026-05-24 02:56:48,525 - experiment_functions - INFO - Early stopping at epoch 550. Best Metrics: (0.011062225079559715, 0.009014900662251656, 0.011119216435312976)
2026-05-24 02:56:50,045 - optuna.study.study - INFO - Trial 75 finished with values: [0.011062225079559715, 0.009014900662251656, 0.011119216435312976] and parameters: {'n_layers': 3, 'embedding_dim': 256, 'lr': 0.00859032951831402, 'lambda_val': 5.188887701821566e-05, 'batch_size': 1635, 'optimizer': 'RMSprop'}.
2026-05-24 02:56:58,491 - experiment_functions - INFO - Early stopping at epoch 650. Best Metrics: (0.018969570037059617, 0.013733443708609272, 0.01932554302725843)
2026-05-24 02:56:59,995 - optuna.study.study - INFO - Trial 76 finished with values: [0.018969570037059617, 0.013733443708609272, 0.01932554302725843] and parameters: {'n_layers': 2, 'embedding_dim': 32, 'lr': 0.0025646859458602136, 'lambda_val': 1.002227016896905e-06, 'batch_size': 2028, 'optimizer': 'Adam'}.
2026-05-24 02:57:08,070 - experiment_functions - INFO - Early stopping at epoch 600. Best Metrics: (0.00692496598689716, 0.00668046357615894, 0.007867439322679894)
2026-05-24 02:57:08,193 - optuna.study.study - INFO - Trial 77 finished with values: [0.00692496598689716, 0.00668046357615894, 0.007867439322679894] and parameters: {'n_layers': 4, 'embedding_dim': 96, 'lr': 0.012279527964875192, 'lambda_val': 0.05810316365964571, 'batch_size': 2393, 'optimizer': 'RMSprop'}.
2026-05-24 02:57:14,720 - experiment_functions - INFO - Early stopping at epoch 500. Best Metrics: (0.0067340545166785, 0.00543046357615894, 0.007444023687315865)
2026-05-24 02:57:15,237 - optuna.study.study - INFO - Trial 78 finished with values: [0.0067340545166785, 0.00543046357615894, 0.007444023687315865] and parameters: {'n_layers': 2, 'embedding_dim': 256, 'lr': 0.059257864003029764, 'lambda_val': 0.015202750041742976, 'batch_size': 713, 'optimizer': 'Adam'}.
2026-05-24 02:57:22,067 - experiment_functions - INFO - Early stopping at epoch 550. Best Metrics: (0.009154485586765158, 0.007698675496688742, 0.00931079796775195)
2026-05-24 02:57:22,160 - optuna.study.study - INFO - Trial 79 finished with values: [0.009154485586765158, 0.007698675496688742, 0.00931079796775195] and parameters: {'n_layers': 4, 'embedding_dim': 128, 'lr': 0.036311147163271176, 'lambda_val': 0.000110210970102262, 'batch_size': 2393, 'optimizer': 'Adam'}.
2026-05-24 02:57:32,798 - experiment_functions - INFO - Early stopping at epoch 950. Best Metrics: (0.025917035497265005, 0.020538079470198676, 0.027001966847646136)
