2026-05-23 23:14:54,892 - optuna.study.study - INFO - Trial 173 finished with values: [0.00550116083935247, 0.004180463576158941, 0.005481261965995383] and parameters: {'n_layers': 2, 'embedding_dim': 256, 'lr': 0.0007742554383218026, 'lambda_val': 8.72359489644615e-05, 'batch_size': 2988, 'optimizer': 'SGD'}.
2026-05-23 23:15:05,849 - experiment_functions - INFO - Early stopping at epoch 550. Best Metrics: (0.019496739334577264, 0.0063327814569536425, 0.014619788894869151)
2026-05-23 23:15:05,948 - optuna.study.study - INFO - Trial 174 finished with values: [0.019496739334577264, 0.0063327814569536425, 0.014619788894869151] and parameters: {'n_layers': 1, 'embedding_dim': 128, 'lr': 0.001590270509010797, 'lambda_val': 1.0525537797663283e-06, 'batch_size': 4059, 'optimizer': 'RMSprop'}.
2026-05-23 23:15:48,661 - optuna.study.study - INFO - Trial 175 finished with values: [0.027334630437073466, 0.008849337748344371, 0.024105085356292057] and parameters: {'n_layers': 2, 'embedding_dim': 128, 'lr': 0.00011132803279953378, 'lambda_val': 1.2927583321370151e-05, 'batch_size': 3705, 'optimizer': 'RMSprop'}.
2026-05-23 23:15:56,245 - experiment_functions - INFO - Early stopping at epoch 650. Best Metrics: (0.016465959203967505, 0.0060099337748344365, 0.014711580389165285)
2026-05-23 23:15:56,339 - optuna.study.study - INFO - Trial 176 finished with values: [0.016465959203967505, 0.0060099337748344365, 0.014711580389165285] and parameters: {'n_layers': 2, 'embedding_dim': 64, 'lr': 0.0007742554383218026, 'lambda_val': 0.002482166316964702, 'batch_size': 3705, 'optimizer': 'Adam'}.
2026-05-23 23:16:03,707 - experiment_functions - INFO - Early stopping at epoch 600. Best Metrics: (0.018957887632022618, 0.0065728476821192055, 0.015326360654539418)
2026-05-23 23:16:03,802 - optuna.study.study - INFO - Trial 177 finished with values: [0.018957887632022618, 0.0065728476821192055, 0.015326360654539418] and parameters: {'n_layers': 2, 'embedding_dim': 96, 'lr': 0.0012665424339139031, 'lambda_val': 0.00031335292673571056, 'batch_size': 4059, 'optimizer': 'Adam'}.
2026-05-23 23:16:10,467 - experiment_functions - INFO - Early stopping at epoch 550. Best Metrics: (0.02634518331845659, 0.008956953642384108, 0.02388761694656131)
2026-05-23 23:16:10,896 - optuna.study.study - INFO - Trial 178 finished with values: [0.02634518331845659, 0.008956953642384108, 0.02388761694656131] and parameters: {'n_layers': 1, 'embedding_dim': 256, 'lr': 0.0027774184001281023, 'lambda_val': 0.00031335292673571056, 'batch_size': 627, 'optimizer': 'Adam'}.
2026-05-23 23:16:17,383 - experiment_functions - INFO - Early stopping at epoch 550. Best Metrics: (0.012503015267140979, 0.00515728476821192, 0.009630307075873541)
2026-05-23 23:16:17,497 - optuna.study.study - INFO - Trial 179 finished with values: [0.012503015267140979, 0.00515728476821192, 0.009630307075873541] and parameters: {'n_layers': 2, 'embedding_dim': 64, 'lr': 0.0012665424339139031, 'lambda_val': 5.293319521753168e-06, 'batch_size': 2028, 'optimizer': 'RMSprop'}.
2026-05-23 23:16:46,395 - experiment_functions - INFO - Early stopping at epoch 2250. Best Metrics: (0.02174667535213102, 0.007557947019867551, 0.019205071354908648)
2026-05-23 23:16:46,490 - optuna.study.study - INFO - Trial 180 finished with values: [0.02174667535213102, 0.007557947019867551, 0.019205071354908648] and parameters: {'n_layers': 4, 'embedding_dim': 256, 'lr': 0.00011132803279953378, 'lambda_val': 9.691061665067305e-06, 'batch_size': 3705, 'optimizer': 'RMSprop'}.
2026-05-23 23:16:53,543 - experiment_functions - INFO - Early stopping at epoch 550. Best Metrics: (0.009267037247861494, 0.003973509933774834, 0.006208899628744602)
2026-05-23 23:16:53,734 - optuna.study.study - INFO - Trial 181 finished with values: [0.009267037247861494, 0.003973509933774834, 0.006208899628744602] and parameters: {'n_layers': 2, 'embedding_dim': 256, 'lr': 0.0012665424339139031, 'lambda_val': 5.293319521753168e-06, 'batch_size': 2988, 'optimizer': 'RMSprop'}.
2026-05-23 23:17:00,931 - experiment_functions - INFO - Early stopping at epoch 550. Best Metrics: (0.01290671613182333, 0.005049668874172185, 0.009045080493439366)
2026-05-23 23:17:01,036 - optuna.study.study - INFO - Trial 182 finished with values: [0.01290671613182333, 0.005049668874172185, 0.009045080493439366] and parameters: {'n_layers': 2, 'embedding_dim': 256, 'lr': 0.0009299462051840892, 'lambda_val': 9.691061665067305e-06, 'batch_size': 3705, 'optimizer': 'RMSprop'}.
2026-05-23 23:17:24,798 - experiment_functions - INFO - Early stopping at epoch 2000. Best Metrics: (0.026945398228346695, 0.00859271523178808, 0.022374541811409156)
2026-05-23 23:17:25,672 - optuna.study.study - INFO - Trial 183 finished with values: [0.026945398228346695, 0.00859271523178808, 0.022374541811409156] and parameters: {'n_layers': 2, 'embedding_dim': 256, 'lr': 0.00011132803279953378, 'lambda_val': 9.691061665067305e-06, 'batch_size': 3705, 'optimizer': 'RMSprop'}.
2026-05-23 23:17:32,564 - experiment_functions - INFO - Early stopping at epoch 600. Best Metrics: (0.007008069979706361, 0.004039735099337749, 0.0057538330563299015)
2026-05-23 23:17:32,705 - optuna.study.study - INFO - Trial 184 finished with values: [0.007008069979706361, 0.004039735099337749, 0.0057538330563299015] and parameters: {'n_layers': 2, 'embedding_dim': 32, 'lr': 0.0009470868010327422, 'lambda_val': 0.014733197162368416, 'batch_size': 1956, 'optimizer': 'Adam'}.
2026-05-23 23:17:39,365 - experiment_functions - INFO - Early stopping at epoch 500. Best Metrics: (0.005708887253006065, 0.004478476821192054, 0.0055483473973414466)
2026-05-23 23:17:39,503 - optuna.study.study - INFO - Trial 185 finished with values: [0.005708887253006065, 0.004478476821192054, 0.0055483473973414466] and parameters: {'n_layers': 4, 'embedding_dim': 128, 'lr': 0.00030067783612531895, 'lambda_val': 0.016840884927433738, 'batch_size': 1061, 'optimizer': 'Adam'}.
2026-05-23 23:17:49,323 - experiment_functions - INFO - Early stopping at epoch 850. Best Metrics: (0.026075071894899604, 0.008667218543046357, 0.022730810833510535)
2026-05-23 23:17:50,107 - optuna.study.study - INFO - Trial 186 finished with values: [0.026075071894899604, 0.008667218543046357, 0.022730810833510535] and parameters: {'n_layers': 1, 'embedding_dim': 256, 'lr': 0.00028881949474372873, 'lambda_val': 0.002482166316964702, 'batch_size': 556, 'optimizer': 'RMSprop'}.
2026-05-23 23:18:30,016 - experiment_functions - INFO - Early stopping at epoch 3650. Best Metrics: (0.028337504789693237, 0.008882450331125828, 0.025338909406385366)
2026-05-23 23:18:30,162 - optuna.study.study - INFO - Trial 187 finished with values: [0.028337504789693237, 0.008882450331125828, 0.025338909406385366] and parameters: {'n_layers': 2, 'embedding_dim': 128, 'lr': 0.00011132803279953378, 'lambda_val': 9.691061665067305e-06, 'batch_size': 3705, 'optimizer': 'RMSprop'}.
2026-05-23 23:18:36,586 - experiment_functions - INFO - Early stopping at epoch 500. Best Metrics: (0.00693569824983332, 0.004023178807947021, 0.00512272081057946)
2026-05-23 23:18:36,681 - optuna.study.study - INFO - Trial 188 finished with values: [0.00693569824983332, 0.004023178807947021, 0.00512272081057946] and parameters: {'n_layers': 2, 'embedding_dim': 256, 'lr': 0.03605559302874926, 'lambda_val': 0.0035445266609307907, 'batch_size': 3938, 'optimizer': 'RMSprop'}.
2026-05-23 23:18:46,358 - experiment_functions - INFO - Early stopping at epoch 800. Best Metrics: (0.009541850519919258, 0.004850993377483444, 0.008410152399527599)
2026-05-23 23:18:46,451 - optuna.study.study - INFO - Trial 189 finished with values: [0.009541850519919258, 0.004850993377483444, 0.008410152399527599] and parameters: {'n_layers': 4, 'embedding_dim': 128, 'lr': 0.00030067783612531895, 'lambda_val': 0.00031335292673571056, 'batch_size': 1061, 'optimizer': 'Adam'}.
2026-05-23 23:19:15,908 - experiment_functions - INFO - Early stopping at epoch 2600. Best Metrics: (0.027432445239518887, 0.00873344370860927, 0.02436203469723894)
2026-05-23 23:19:16,771 - optuna.study.study - INFO - Trial 190 finished with values: [0.027432445239518887, 0.00873344370860927, 0.02436203469723894] and parameters: {'n_layers': 2, 'embedding_dim': 256, 'lr': 0.00011132803279953378, 'lambda_val': 2.9338354415205326e-06, 'batch_size': 2177, 'optimizer': 'RMSprop'}.
2026-05-23 23:19:23,030 - experiment_functions - INFO - Early stopping at epoch 500. Best Metrics: (0.004999116150446552, 0.004155629139072848, 0.005110317577833215)
2026-05-23 23:19:23,886 - optuna.study.study - INFO - Trial 191 finished with values: [0.004999116150446552, 0.004155629139072848, 0.005110317577833215] and parameters: {'n_layers': 2, 'embedding_dim': 128, 'lr': 0.0007742554383218026, 'lambda_val': 1.0541423477399953e-06, 'batch_size': 3715, 'optimizer': 'SGD'}.
2026-05-23 23:20:05,087 - optuna.study.study - INFO - Trial 192 finished with values: [0.021638532978586426, 0.007309602649006624, 0.01937570582987524] and parameters: {'n_layers': 1, 'embedding_dim': 64, 'lr': 0.00011132803279953378, 'lambda_val': 0.00031335292673571056, 'batch_size': 3705, 'optimizer': 'Adam'}.
2026-05-23 23:20:11,871 - experiment_functions - INFO - Early stopping at epoch 550. Best Metrics: (0.013641546843824043, 0.005355960264900662, 0.01191901640747151)
2026-05-23 23:20:11,943 - optuna.study.study - INFO - Trial 193 finished with values: [0.013641546843824043, 0.005355960264900662, 0.01191901640747151] and parameters: {'n_layers': 2, 'embedding_dim': 128, 'lr': 0.0009109302233397638, 'lambda_val': 1.6221161102260363e-05, 'batch_size': 3705, 'optimizer': 'RMSprop'}.
2026-05-23 23:20:53,038 - optuna.study.study - INFO - Trial 194 finished with values: [0.027423118998664172, 0.009246688741721855, 0.024898508570507138] and parameters: {'n_layers': 2, 'embedding_dim': 64, 'lr': 0.00011705745989056773, 'lambda_val': 0.002482166316964702, 'batch_size': 556, 'optimizer': 'RMSprop'}.
2026-05-23 23:21:00,935 - experiment_functions - INFO - Early stopping at epoch 600. Best Metrics: (0.01961437108846651, 0.006937086092715232, 0.016526241087058413)
2026-05-23 23:21:01,319 - optuna.study.study - INFO - Trial 195 finished with values: [0.01961437108846651, 0.006937086092715232, 0.016526241087058413] and parameters: {'n_layers': 2, 'embedding_dim': 256, 'lr': 0.00038723708173308733, 'lambda_val': 0.00044072476163491587, 'batch_size': 3226, 'optimizer': 'RMSprop'}.
2026-05-23 23:21:11,980 - experiment_functions - INFO - Early stopping at epoch 800. Best Metrics: (0.01770644865300513, 0.006829470198675497, 0.014103967760187538)
2026-05-23 23:21:12,724 - optuna.study.study - INFO - Trial 196 finished with values: [0.01770644865300513, 0.006829470198675497, 0.014103967760187538] and parameters: {'n_layers': 4, 'embedding_dim': 256, 'lr': 0.00030067783612531895, 'lambda_val': 3.136622296234252e-05, 'batch_size': 627, 'optimizer': 'Adam'}.
2026-05-23 23:21:20,271 - experiment_functions - INFO - Early stopping at epoch 650. Best Metrics: (0.023599637517032406, 0.00810430463576159, 0.019754384485437208)
2026-05-23 23:21:20,370 - optuna.study.study - INFO - Trial 197 finished with values: [0.023599637517032406, 0.00810430463576159, 0.019754384485437208] and parameters: {'n_layers': 2, 'embedding_dim': 64, 'lr': 0.0009299462051840892, 'lambda_val': 0.0013831840721484298, 'batch_size': 1085, 'optimizer': 'Adam'}.
2026-05-23 23:21:33,700 - experiment_functions - INFO - Early stopping at epoch 1100. Best Metrics: (0.019327788570728442, 0.007251655629139073, 0.015476650321421195)
2026-05-23 23:21:33,789 - optuna.study.study - INFO - Trial 198 finished with values: [0.019327788570728442, 0.007251655629139073, 0.015476650321421195] and parameters: {'n_layers': 2, 'embedding_dim': 256, 'lr': 0.0001575404982668674, 'lambda_val': 2.305336015266439e-06, 'batch_size': 2780, 'optimizer': 'Adam'}.
2026-05-23 23:21:42,447 - experiment_functions - INFO - Early stopping at epoch 700. Best Metrics: (0.015010793598166549, 0.005985099337748346, 0.01286082942878481)
2026-05-23 23:21:42,541 - optuna.study.study - INFO - Trial 199 finished with values: [0.015010793598166549, 0.005985099337748346, 0.01286082942878481] and parameters: {'n_layers': 2, 'embedding_dim': 128, 'lr': 0.00038723708173308733, 'lambda_val': 9.691061665067305e-06, 'batch_size': 3705, 'optimizer': 'Adam'}.
2026-05-23 23:21:50,477 - experiment_functions - INFO - Early stopping at epoch 600. Best Metrics: (0.025951111315549457, 0.008634105960264902, 0.02348171346101719)
2026-05-23 23:21:50,571 - optuna.study.study - INFO - Trial 200 finished with values: [0.025951111315549457, 0.008634105960264902, 0.02348171346101719] and parameters: {'n_layers': 2, 'embedding_dim': 256, 'lr': 0.0009299462051840892, 'lambda_val': 0.0017057338188658142, 'batch_size': 627, 'optimizer': 'Adam'}.
2026-05-23 23:22:01,029 - experiment_functions - INFO - Early stopping at epoch 900. Best Metrics: (0.028640820481216883, 0.009205298013245034, 0.025495603817460577)
2026-05-23 23:22:02,071 - optuna.study.study - INFO - Trial 201 finished with values: [0.028640820481216883, 0.009205298013245034, 0.025495603817460577] and parameters: {'n_layers': 1, 'embedding_dim': 32, 'lr': 0.0007742554383218026, 'lambda_val': 3.136622296234252e-05, 'batch_size': 667, 'optimizer': 'RMSprop'}.
2026-05-23 23:22:51,602 - optuna.study.study - INFO - Trial 202 finished with values: [0.0270173633676615, 0.008410596026490066, 0.024333987049147555] and parameters: {'n_layers': 2, 'embedding_dim': 128, 'lr': 0.00011132803279953378, 'lambda_val': 1.2927583321370151e-05, 'batch_size': 3705, 'optimizer': 'RMSprop'}.
2026-05-23 23:22:58,111 - experiment_functions - INFO - Early stopping at epoch 550. Best Metrics: (0.011881308417339718, 0.005, 0.00958175122690394)
2026-05-23 23:22:58,250 - optuna.study.study - INFO - Trial 203 finished with values: [0.011881308417339718, 0.005, 0.00958175122690394] and parameters: {'n_layers': 2, 'embedding_dim': 128, 'lr': 0.0012665424339139031, 'lambda_val': 1.6221161102260363e-05, 'batch_size': 867, 'optimizer': 'RMSprop'}.
2026-05-23 23:23:06,918 - experiment_functions - INFO - Early stopping at epoch 600. Best Metrics: (0.010460758162602364, 0.004892384105960265, 0.009724630613751683)
2026-05-23 23:23:07,015 - optuna.study.study - INFO - Trial 204 finished with values: [0.010460758162602364, 0.004892384105960265, 0.009724630613751683] and parameters: {'n_layers': 4, 'embedding_dim': 256, 'lr': 0.0007742554383218026, 'lambda_val': 1.4421107433833644e-05, 'batch_size': 2988, 'optimizer': 'Adam'}.
2026-05-23 23:23:14,614 - experiment_functions - INFO - Early stopping at epoch 600. Best Metrics: (0.025955173748479866, 0.008485099337748344, 0.023519558901822078)
2026-05-23 23:23:14,695 - optuna.study.study - INFO - Trial 205 finished with values: [0.025955173748479866, 0.008485099337748344, 0.023519558901822078] and parameters: {'n_layers': 2, 'embedding_dim': 256, 'lr': 0.0009299462051840892, 'lambda_val': 2.829964802645351e-06, 'batch_size': 1477, 'optimizer': 'Adam'}.
2026-05-23 23:23:24,451 - experiment_functions - INFO - Early stopping at epoch 900. Best Metrics: (0.027208066697240626, 0.008973509933774835, 0.02438708427205791)
2026-05-23 23:23:25,520 - optuna.study.study - INFO - Trial 206 finished with values: [0.027208066697240626, 0.008973509933774835, 0.02438708427205791] and parameters: {'n_layers': 1, 'embedding_dim': 128, 'lr': 0.0003568831204476262, 'lambda_val': 1.0525537797663283e-06, 'batch_size': 627, 'optimizer': 'RMSprop'}.
2026-05-23 23:23:32,606 - experiment_functions - INFO - Early stopping at epoch 550. Best Metrics: (0.008475587405343939, 0.004420529801324504, 0.006756745733676437)
2026-05-23 23:23:32,706 - optuna.study.study - INFO - Trial 207 finished with values: [0.008475587405343939, 0.004420529801324504, 0.006756745733676437] and parameters: {'n_layers': 3, 'embedding_dim': 256, 'lr': 0.0007742554383218026, 'lambda_val': 0.001916081086293794, 'batch_size': 667, 'optimizer': 'RMSprop'}.
2026-05-23 23:23:38,800 - experiment_functions - INFO - Early stopping at epoch 500. Best Metrics: (0.0049352822787081555, 0.0033692052980132453, 0.004449390019608863)
2026-05-23 23:23:39,893 - optuna.study.study - INFO - Trial 208 finished with values: [0.0049352822787081555, 0.0033692052980132453, 0.004449390019608863] and parameters: {'n_layers': 2, 'embedding_dim': 96, 'lr': 0.06698698465785166, 'lambda_val': 5.293319521753168e-06, 'batch_size': 1890, 'optimizer': 'Adam'}.
2026-05-23 23:24:21,189 - optuna.study.study - INFO - Trial 209 finished with values: [0.02580905353763503, 0.008882450331125828, 0.022971658107188955] and parameters: {'n_layers': 2, 'embedding_dim': 64, 'lr': 0.00011705745989056773, 'lambda_val': 0.002482166316964702, 'batch_size': 556, 'optimizer': 'Adam'}.
2026-05-23 23:24:28,976 - experiment_functions - INFO - Early stopping at epoch 600. Best Metrics: (0.023822413250252802, 0.008054635761589405, 0.021358182074697044)
2026-05-23 23:24:29,123 - optuna.study.study - INFO - Trial 210 finished with values: [0.023822413250252802, 0.008054635761589405, 0.021358182074697044] and parameters: {'n_layers': 2, 'embedding_dim': 256, 'lr': 0.0009299462051840892, 'lambda_val': 2.829964802645351e-06, 'batch_size': 1477, 'optimizer': 'Adam'}.
2026-05-23 23:24:39,873 - experiment_functions - INFO - Early stopping at epoch 850. Best Metrics: (0.02596659546923354, 0.008758278145695365, 0.022877740847916692)
2026-05-23 23:24:40,219 - optuna.study.study - INFO - Trial 211 finished with values: [0.02596659546923354, 0.008758278145695365, 0.022877740847916692] and parameters: {'n_layers': 1, 'embedding_dim': 256, 'lr': 0.00028881949474372873, 'lambda_val': 0.002482166316964702, 'batch_size': 556, 'optimizer': 'RMSprop'}.
2026-05-23 23:24:46,302 - experiment_functions - INFO - Early stopping at epoch 500. Best Metrics: (0.004912472642975926, 0.004172185430463576, 0.005094473074995914)
2026-05-23 23:24:46,787 - optuna.study.study - INFO - Trial 212 finished with values: [0.004912472642975926, 0.004172185430463576, 0.005094473074995914] and parameters: {'n_layers': 1, 'embedding_dim': 64, 'lr': 3.210029673196068e-05, 'lambda_val': 2.9338354415205326e-06, 'batch_size': 3192, 'optimizer': 'Adam'}.
2026-05-23 23:24:53,844 - experiment_functions - INFO - Early stopping at epoch 600. Best Metrics: (0.022772953606300765, 0.00775662251655629, 0.01976509496043935)
2026-05-23 23:24:53,934 - optuna.study.study - INFO - Trial 213 finished with values: [0.022772953606300765, 0.00775662251655629, 0.01976509496043935] and parameters: {'n_layers': 2, 'embedding_dim': 128, 'lr': 0.0009299462051840892, 'lambda_val': 2.430474765536691e-05, 'batch_size': 1890, 'optimizer': 'Adam'}.
2026-05-23 23:24:59,946 - experiment_functions - INFO - Early stopping at epoch 500. Best Metrics: (0.005064042865659319, 0.0038741721854304635, 0.004759611704236203)
2026-05-23 23:25:00,021 - optuna.study.study - INFO - Trial 214 finished with values: [0.005064042865659319, 0.0038741721854304635, 0.004759611704236203] and parameters: {'n_layers': 1, 'embedding_dim': 96, 'lr': 0.03778914208493978, 'lambda_val': 3.136622296234252e-05, 'batch_size': 3826, 'optimizer': 'Adam'}.
2026-05-23 23:25:07,919 - experiment_functions - INFO - Early stopping at epoch 550. Best Metrics: (0.006822934869540006, 0.004130794701986755, 0.0061180204057936435)
2026-05-23 23:25:08,015 - optuna.study.study - INFO - Trial 215 finished with values: [0.006822934869540006, 0.004130794701986755, 0.0061180204057936435] and parameters: {'n_layers': 4, 'embedding_dim': 256, 'lr': 0.00028881949474372873, 'lambda_val': 0.002482166316964702, 'batch_size': 3705, 'optimizer': 'RMSprop'}.
2026-05-23 23:25:15,406 - experiment_functions - INFO - Early stopping at epoch 650. Best Metrics: (0.016483844718002495, 0.006266556291390729, 0.013838335203797448)
2026-05-23 23:25:15,482 - optuna.study.study - INFO - Trial 216 finished with values: [0.016483844718002495, 0.006266556291390729, 0.013838335203797448] and parameters: {'n_layers': 2, 'embedding_dim': 32, 'lr': 0.0009470868010327422, 'lambda_val': 3.136622296234252e-05, 'batch_size': 1956, 'optimizer': 'Adam'}.
2026-05-23 23:25:59,849 - optuna.study.study - INFO - Trial 217 finished with values: [0.02702853416047715, 0.008658940397350995, 0.023918345677083827] and parameters: {'n_layers': 2, 'embedding_dim': 128, 'lr': 0.00011132803279953378, 'lambda_val': 2.0138746640402316e-05, 'batch_size': 3950, 'optimizer': 'RMSprop'}.
2026-05-23 23:26:42,071 - optuna.study.study - INFO - Trial 218 finished with values: [0.023635185019909005, 0.008021523178807947, 0.021764994834959393] and parameters: {'n_layers': 2, 'embedding_dim': 64, 'lr': 0.00011132803279953378, 'lambda_val': 1.2927583321370151e-05, 'batch_size': 3705, 'optimizer': 'RMSprop'}.
2026-05-23 23:27:22,952 - optuna.study.study - INFO - Trial 219 finished with values: [0.024942812996347062, 0.008302980132450332, 0.022212507648349974] and parameters: {'n_layers': 2, 'embedding_dim': 64, 'lr': 0.00011705745989056773, 'lambda_val': 5.293319521753168e-06, 'batch_size': 1477, 'optimizer': 'Adam'}.
2026-05-23 23:27:28,805 - experiment_functions - INFO - Early stopping at epoch 500. Best Metrics: (0.005850385276527151, 0.004329470198675496, 0.005534847752673886)
2026-05-23 23:27:29,470 - optuna.study.study - INFO - Trial 220 finished with values: [0.005850385276527151, 0.004329470198675496, 0.005534847752673886] and parameters: {'n_layers': 1, 'embedding_dim': 32, 'lr': 0.00011705745989056773, 'lambda_val': 0.002482166316964702, 'batch_size': 2988, 'optimizer': 'SGD'}.
2026-05-23 23:27:41,562 - experiment_functions - INFO - Early stopping at epoch 1000. Best Metrics: (0.028444567895426976, 0.00908112582781457, 0.025041032602485403)
