2026-05-24 09:12:58,232 - optuna.study.study - INFO - Trial 205 finished with values: [0.06396539964947269, 0.03792218543046358, 0.05508963512889742] and parameters: {'n_layers': 1, 'embedding_dim': 128, 'lr': 0.0005611343469820637, 'lambda_val': 0.0017812353290128234, 'batch_size': 1091, 'optimizer': 'RMSprop'}.
2026-05-24 09:13:43,265 - optuna.study.study - INFO - Trial 206 finished with values: [0.05371051961638024, 0.03382450331125828, 0.04901029150451991] and parameters: {'n_layers': 1, 'embedding_dim': 128, 'lr': 0.00027037181334258007, 'lambda_val': 8.523357255734578e-06, 'batch_size': 2675, 'optimizer': 'Adam'}.
2026-05-24 09:13:51,000 - experiment_functions - INFO - Early stopping at epoch 600. Best Metrics: (0.0463768218471883, 0.029817880794701986, 0.04082526282551228)
2026-05-24 09:13:51,101 - optuna.study.study - INFO - Trial 207 finished with values: [0.0463768218471883, 0.029817880794701986, 0.04082526282551228] and parameters: {'n_layers': 1, 'embedding_dim': 128, 'lr': 0.0019498675283919575, 'lambda_val': 4.601372605867572e-05, 'batch_size': 1091, 'optimizer': 'RMSprop'}.
2026-05-24 09:13:58,720 - experiment_functions - INFO - Early stopping at epoch 600. Best Metrics: (0.04947994832638927, 0.03145695364238411, 0.044698471626119105)
2026-05-24 09:13:58,830 - optuna.study.study - INFO - Trial 208 finished with values: [0.04947994832638927, 0.03145695364238411, 0.044698471626119105] and parameters: {'n_layers': 2, 'embedding_dim': 64, 'lr': 0.0019498675283919575, 'lambda_val': 2.346379884027025e-05, 'batch_size': 2036, 'optimizer': 'Adam'}.
2026-05-24 09:14:16,923 - experiment_functions - INFO - Early stopping at epoch 1550. Best Metrics: (0.06207722770230042, 0.03734271523178808, 0.0545700172058941)
2026-05-24 09:14:17,013 - optuna.study.study - INFO - Trial 209 finished with values: [0.06207722770230042, 0.03734271523178808, 0.0545700172058941] and parameters: {'n_layers': 1, 'embedding_dim': 128, 'lr': 0.0006251382018314868, 'lambda_val': 0.000621169344675621, 'batch_size': 1133, 'optimizer': 'Adam'}.
2026-05-24 09:14:28,892 - experiment_functions - INFO - Early stopping at epoch 850. Best Metrics: (0.04996175651670325, 0.03132450331125828, 0.04552325722957884)
2026-05-24 09:14:29,062 - optuna.study.study - INFO - Trial 210 finished with values: [0.04996175651670325, 0.03132450331125828, 0.04552325722957884] and parameters: {'n_layers': 2, 'embedding_dim': 96, 'lr': 0.0005881424192141288, 'lambda_val': 4.601372605867572e-05, 'batch_size': 2675, 'optimizer': 'Adam'}.
2026-05-24 09:14:35,192 - experiment_functions - INFO - Early stopping at epoch 500. Best Metrics: (0.005124096001138646, 0.004470198675496689, 0.0054897807439020395)
2026-05-24 09:14:35,603 - optuna.study.study - INFO - Trial 211 finished with values: [0.005124096001138646, 0.004470198675496689, 0.0054897807439020395] and parameters: {'n_layers': 1, 'embedding_dim': 64, 'lr': 2.8769855581716693e-05, 'lambda_val': 2.0557948655122447e-05, 'batch_size': 2915, 'optimizer': 'RMSprop'}.
2026-05-24 09:15:19,701 - optuna.study.study - INFO - Trial 212 finished with values: [0.05065323886966948, 0.030620860927152316, 0.0455377369572469] and parameters: {'n_layers': 1, 'embedding_dim': 128, 'lr': 0.00027037181334258007, 'lambda_val': 9.94682305058342e-05, 'batch_size': 1456, 'optimizer': 'RMSprop'}.
2026-05-24 09:15:35,369 - experiment_functions - INFO - Early stopping at epoch 1250. Best Metrics: (0.054163045201562884, 0.0339817880794702, 0.04739072865178108)
2026-05-24 09:15:35,469 - optuna.study.study - INFO - Trial 213 finished with values: [0.054163045201562884, 0.0339817880794702, 0.04739072865178108] and parameters: {'n_layers': 1, 'embedding_dim': 256, 'lr': 0.0003755353524054084, 'lambda_val': 0.00800073098738819, 'batch_size': 2187, 'optimizer': 'RMSprop'}.
2026-05-24 09:15:45,976 - experiment_functions - INFO - Early stopping at epoch 850. Best Metrics: (0.05514659691265529, 0.033799668874172184, 0.04913414265307475)
2026-05-24 09:15:46,102 - optuna.study.study - INFO - Trial 214 finished with values: [0.05514659691265529, 0.033799668874172184, 0.04913414265307475] and parameters: {'n_layers': 1, 'embedding_dim': 128, 'lr': 0.000767834461150942, 'lambda_val': 8.523357255734578e-06, 'batch_size': 2675, 'optimizer': 'RMSprop'}.
2026-05-24 09:15:53,188 - experiment_functions - INFO - Early stopping at epoch 500. Best Metrics: (0.005363805222278175, 0.004180463576158941, 0.0052740709473022)
2026-05-24 09:15:53,284 - optuna.study.study - INFO - Trial 215 finished with values: [0.005363805222278175, 0.004180463576158941, 0.0052740709473022] and parameters: {'n_layers': 4, 'embedding_dim': 128, 'lr': 0.004791062202694734, 'lambda_val': 0.0393518625138606, 'batch_size': 794, 'optimizer': 'SGD'}.
2026-05-24 09:16:00,637 - experiment_functions - INFO - Early stopping at epoch 550. Best Metrics: (0.024206638925569735, 0.019279801324503312, 0.02507603598676605)
2026-05-24 09:16:00,733 - optuna.study.study - INFO - Trial 216 finished with values: [0.024206638925569735, 0.019279801324503312, 0.02507603598676605] and parameters: {'n_layers': 2, 'embedding_dim': 128, 'lr': 0.0019498675283919575, 'lambda_val': 0.000621169344675621, 'batch_size': 706, 'optimizer': 'RMSprop'}.
2026-05-24 09:16:07,961 - experiment_functions - INFO - Early stopping at epoch 550. Best Metrics: (0.04903986351757105, 0.031100993377483448, 0.04426448741121755)
2026-05-24 09:16:08,054 - optuna.study.study - INFO - Trial 217 finished with values: [0.04903986351757105, 0.031100993377483448, 0.04426448741121755] and parameters: {'n_layers': 1, 'embedding_dim': 128, 'lr': 0.0019498675283919575, 'lambda_val': 8.523357255734578e-06, 'batch_size': 3303, 'optimizer': 'RMSprop'}.
2026-05-24 09:16:18,598 - experiment_functions - INFO - Early stopping at epoch 850. Best Metrics: (0.05139139643792594, 0.03320364238410596, 0.04728253121537751)
2026-05-24 09:16:18,786 - optuna.study.study - INFO - Trial 218 finished with values: [0.05139139643792594, 0.03320364238410596, 0.04728253121537751] and parameters: {'n_layers': 1, 'embedding_dim': 128, 'lr': 0.0006251382018314868, 'lambda_val': 0.0011457679520731478, 'batch_size': 3076, 'optimizer': 'RMSprop'}.
2026-05-24 09:16:33,499 - experiment_functions - INFO - Early stopping at epoch 1250. Best Metrics: (0.05916072412335479, 0.03504139072847682, 0.05197717166957071)
2026-05-24 09:16:34,196 - optuna.study.study - INFO - Trial 219 finished with values: [0.05916072412335479, 0.03504139072847682, 0.05197717166957071] and parameters: {'n_layers': 1, 'embedding_dim': 96, 'lr': 0.0005881424192141288, 'lambda_val': 4.601372605867572e-05, 'batch_size': 2675, 'optimizer': 'Adam'}.
2026-05-24 09:16:41,974 - experiment_functions - INFO - Early stopping at epoch 600. Best Metrics: (0.04856317705819613, 0.03105132450331126, 0.044277647572118724)
2026-05-24 09:16:42,057 - optuna.study.study - INFO - Trial 220 finished with values: [0.04856317705819613, 0.03105132450331126, 0.044277647572118724] and parameters: {'n_layers': 1, 'embedding_dim': 128, 'lr': 0.0019498675283919575, 'lambda_val': 0.0011457679520731478, 'batch_size': 1091, 'optimizer': 'RMSprop'}.
2026-05-24 09:16:52,344 - experiment_functions - INFO - Early stopping at epoch 600. Best Metrics: (0.028254022233246582, 0.020670529801324503, 0.027166939004734544)
2026-05-24 09:16:52,562 - optuna.study.study - INFO - Trial 221 finished with values: [0.028254022233246582, 0.020670529801324503, 0.027166939004734544] and parameters: {'n_layers': 4, 'embedding_dim': 256, 'lr': 0.0003755353524054084, 'lambda_val': 8.523357255734578e-06, 'batch_size': 3076, 'optimizer': 'RMSprop'}.
2026-05-24 09:17:38,257 - optuna.study.study - INFO - Trial 222 finished with values: [0.060378027284418344, 0.03630794701986755, 0.05358531496757627] and parameters: {'n_layers': 1, 'embedding_dim': 128, 'lr': 0.0003755353524054084, 'lambda_val': 0.0004077151861442529, 'batch_size': 1091, 'optimizer': 'RMSprop'}.
2026-05-24 09:17:46,036 - experiment_functions - INFO - Early stopping at epoch 600. Best Metrics: (0.050145391276971825, 0.03208609271523179, 0.045896267907763244)
2026-05-24 09:17:46,131 - optuna.study.study - INFO - Trial 223 finished with values: [0.050145391276971825, 0.03208609271523179, 0.045896267907763244] and parameters: {'n_layers': 1, 'embedding_dim': 128, 'lr': 0.0019498675283919575, 'lambda_val': 1.122316914307546e-06, 'batch_size': 1091, 'optimizer': 'RMSprop'}.
2026-05-24 09:18:01,971 - experiment_functions - INFO - Early stopping at epoch 1400. Best Metrics: (0.06292298465039912, 0.037400662251655635, 0.05481795371864948)
2026-05-24 09:18:02,634 - optuna.study.study - INFO - Trial 224 finished with values: [0.06292298465039912, 0.037400662251655635, 0.05481795371864948] and parameters: {'n_layers': 1, 'embedding_dim': 128, 'lr': 0.0007411627719104753, 'lambda_val': 0.0011722082940115572, 'batch_size': 634, 'optimizer': 'RMSprop'}.
2026-05-24 09:18:44,521 - optuna.study.study - INFO - Trial 225 finished with values: [0.060789058590701786, 0.0361341059602649, 0.051685355075014094] and parameters: {'n_layers': 1, 'embedding_dim': 64, 'lr': 0.0003755353524054084, 'lambda_val': 1.122316914307546e-06, 'batch_size': 1634, 'optimizer': 'RMSprop'}.
2026-05-24 09:18:52,374 - experiment_functions - INFO - Early stopping at epoch 650. Best Metrics: (0.061262582161634584, 0.03666390728476821, 0.054044095160999304)
2026-05-24 09:18:52,569 - optuna.study.study - INFO - Trial 226 finished with values: [0.061262582161634584, 0.03666390728476821, 0.054044095160999304] and parameters: {'n_layers': 1, 'embedding_dim': 128, 'lr': 0.0019498675283919575, 'lambda_val': 0.00800073098738819, 'batch_size': 2187, 'optimizer': 'Adam'}.
2026-05-24 09:18:59,829 - experiment_functions - INFO - Early stopping at epoch 600. Best Metrics: (0.05052162723955779, 0.031837748344370864, 0.04475876506421298)
2026-05-24 09:19:00,073 - optuna.study.study - INFO - Trial 227 finished with values: [0.05052162723955779, 0.031837748344370864, 0.04475876506421298] and parameters: {'n_layers': 2, 'embedding_dim': 96, 'lr': 0.0015435244296002795, 'lambda_val': 0.009092942179286375, 'batch_size': 3974, 'optimizer': 'Adam'}.
2026-05-24 09:19:07,572 - experiment_functions - INFO - Early stopping at epoch 550. Best Metrics: (0.009422427689446091, 0.009660596026490068, 0.011383491236239685)
2026-05-24 09:19:07,670 - optuna.study.study - INFO - Trial 228 finished with values: [0.009422427689446091, 0.009660596026490068, 0.011383491236239685] and parameters: {'n_layers': 3, 'embedding_dim': 128, 'lr': 0.0019498675283919575, 'lambda_val': 0.06920937124287362, 'batch_size': 2036, 'optimizer': 'RMSprop'}.
2026-05-24 09:19:14,396 - experiment_functions - INFO - Early stopping at epoch 550. Best Metrics: (0.04905401268755514, 0.03091059602649007, 0.04412923989575551)
2026-05-24 09:19:15,251 - optuna.study.study - INFO - Trial 229 finished with values: [0.04905401268755514, 0.03091059602649007, 0.04412923989575551] and parameters: {'n_layers': 1, 'embedding_dim': 64, 'lr': 0.0019498675283919575, 'lambda_val': 1.122316914307546e-06, 'batch_size': 3825, 'optimizer': 'RMSprop'}.
2026-05-24 09:19:22,306 - experiment_functions - INFO - Early stopping at epoch 550. Best Metrics: (0.05379785538817992, 0.03318708609271523, 0.048090298958554586)
2026-05-24 09:19:22,390 - optuna.study.study - INFO - Trial 230 finished with values: [0.05379785538817992, 0.03318708609271523, 0.048090298958554586] and parameters: {'n_layers': 1, 'embedding_dim': 128, 'lr': 0.0019498675283919575, 'lambda_val': 4.4597266784600284e-05, 'batch_size': 3076, 'optimizer': 'RMSprop'}.
2026-05-24 09:19:29,577 - experiment_functions - INFO - Early stopping at epoch 550. Best Metrics: (0.013402239234135775, 0.011639072847682121, 0.014095234189461937)
2026-05-24 09:19:29,683 - optuna.study.study - INFO - Trial 231 finished with values: [0.013402239234135775, 0.011639072847682121, 0.014095234189461937] and parameters: {'n_layers': 3, 'embedding_dim': 128, 'lr': 0.0019498675283919575, 'lambda_val': 0.0004077151861442529, 'batch_size': 3076, 'optimizer': 'RMSprop'}.
2026-05-24 09:19:37,672 - experiment_functions - INFO - Early stopping at epoch 650. Best Metrics: (0.05844757089825084, 0.034908940397351, 0.05128933713863669)
2026-05-24 09:19:37,773 - optuna.study.study - INFO - Trial 232 finished with values: [0.05844757089825084, 0.034908940397351, 0.05128933713863669] and parameters: {'n_layers': 1, 'embedding_dim': 128, 'lr': 0.002019850627421517, 'lambda_val': 0.000621169344675621, 'batch_size': 2915, 'optimizer': 'Adam'}.
2026-05-24 09:19:48,110 - experiment_functions - INFO - Early stopping at epoch 850. Best Metrics: (0.049111299036455995, 0.030935430463576163, 0.04480912567154263)
2026-05-24 09:19:48,223 - optuna.study.study - INFO - Trial 233 finished with values: [0.049111299036455995, 0.030935430463576163, 0.04480912567154263] and parameters: {'n_layers': 2, 'embedding_dim': 96, 'lr': 0.0005881424192141288, 'lambda_val': 2.346379884027025e-05, 'batch_size': 2675, 'optimizer': 'Adam'}.
2026-05-24 09:19:59,940 - experiment_functions - INFO - Early stopping at epoch 600. Best Metrics: (0.049250465010813156, 0.03145695364238411, 0.04410093298026245)
2026-05-24 09:20:00,028 - optuna.study.study - INFO - Trial 234 finished with values: [0.049250465010813156, 0.03145695364238411, 0.04410093298026245] and parameters: {'n_layers': 1, 'embedding_dim': 64, 'lr': 0.0019498675283919575, 'lambda_val': 1.122316914307546e-06, 'batch_size': 2226, 'optimizer': 'RMSprop'}.
2026-05-24 09:20:07,665 - experiment_functions - INFO - Early stopping at epoch 600. Best Metrics: (0.048546729352545635, 0.031084437086092716, 0.04234308418270117)
2026-05-24 09:20:07,773 - optuna.study.study - INFO - Trial 235 finished with values: [0.048546729352545635, 0.031084437086092716, 0.04234308418270117] and parameters: {'n_layers': 2, 'embedding_dim': 96, 'lr': 0.002019850627421517, 'lambda_val': 0.00028409774899038444, 'batch_size': 2675, 'optimizer': 'Adam'}.
2026-05-24 09:20:14,491 - experiment_functions - INFO - Early stopping at epoch 550. Best Metrics: (0.05100393004840155, 0.030571192052980135, 0.04504776465237611)
2026-05-24 09:20:15,431 - optuna.study.study - INFO - Trial 236 finished with values: [0.05100393004840155, 0.030571192052980135, 0.04504776465237611] and parameters: {'n_layers': 1, 'embedding_dim': 64, 'lr': 0.0019498675283919575, 'lambda_val': 1.122316914307546e-06, 'batch_size': 2226, 'optimizer': 'RMSprop'}.
2026-05-24 09:20:22,177 - experiment_functions - INFO - Early stopping at epoch 550. Best Metrics: (0.05247954987506035, 0.031490066225165564, 0.0456081781417064)
2026-05-24 09:20:22,266 - optuna.study.study - INFO - Trial 237 finished with values: [0.05247954987506035, 0.031490066225165564, 0.0456081781417064] and parameters: {'n_layers': 1, 'embedding_dim': 64, 'lr': 0.0019498675283919575, 'lambda_val': 0.0007561839367868583, 'batch_size': 2226, 'optimizer': 'RMSprop'}.
2026-05-24 09:20:29,546 - experiment_functions - INFO - Early stopping at epoch 600. Best Metrics: (0.04845418102941155, 0.031018211920529802, 0.04391530983371771)
2026-05-24 09:20:29,638 - optuna.study.study - INFO - Trial 238 finished with values: [0.04845418102941155, 0.031018211920529802, 0.04391530983371771] and parameters: {'n_layers': 1, 'embedding_dim': 128, 'lr': 0.0019498675283919575, 'lambda_val': 4.601372605867572e-05, 'batch_size': 1091, 'optimizer': 'RMSprop'}.
2026-05-24 09:20:46,589 - experiment_functions - INFO - Early stopping at epoch 1450. Best Metrics: (0.016968602626680644, 0.011995033112582782, 0.01631867134907487)
2026-05-24 09:20:46,902 - optuna.study.study - INFO - Trial 239 finished with values: [0.016968602626680644, 0.011995033112582782, 0.01631867134907487] and parameters: {'n_layers': 3, 'embedding_dim': 96, 'lr': 0.04039912897679377, 'lambda_val': 0.000621169344675621, 'batch_size': 2919, 'optimizer': 'Adam'}.
2026-05-24 09:20:56,885 - experiment_functions - INFO - Early stopping at epoch 650. Best Metrics: (0.03138192371497413, 0.02232615894039735, 0.03016020234681794)
2026-05-24 09:20:57,095 - optuna.study.study - INFO - Trial 240 finished with values: [0.03138192371497413, 0.02232615894039735, 0.03016020234681794] and parameters: {'n_layers': 3, 'embedding_dim': 256, 'lr': 0.0003755353524054084, 'lambda_val': 0.00800073098738819, 'batch_size': 2187, 'optimizer': 'RMSprop'}.
2026-05-24 09:21:15,451 - experiment_functions - INFO - Early stopping at epoch 1600. Best Metrics: (0.05778819957747691, 0.035331125827814565, 0.051876980174957045)
2026-05-24 09:21:15,532 - optuna.study.study - INFO - Trial 241 finished with values: [0.05778819957747691, 0.035331125827814565, 0.051876980174957045] and parameters: {'n_layers': 1, 'embedding_dim': 128, 'lr': 0.0003755353524054084, 'lambda_val': 0.0007561839367868583, 'batch_size': 3076, 'optimizer': 'RMSprop'}.
2026-05-24 09:21:22,775 - experiment_functions - INFO - Early stopping at epoch 550. Best Metrics: (0.044161351191917296, 0.02713576158940398, 0.03998497443556605)
2026-05-24 09:21:22,870 - optuna.study.study - INFO - Trial 242 finished with values: [0.044161351191917296, 0.02713576158940398, 0.03998497443556605] and parameters: {'n_layers': 1, 'embedding_dim': 256, 'lr': 0.0019498675283919575, 'lambda_val': 8.523357255734578e-06, 'batch_size': 1091, 'optimizer': 'RMSprop'}.
2026-05-24 09:22:05,067 - optuna.study.study - INFO - Trial 243 finished with values: [0.0363178373517572, 0.023774834437086098, 0.033876989341588615] and parameters: {'n_layers': 1, 'embedding_dim': 128, 'lr': 0.00027037181334258007, 'lambda_val': 4.601372605867572e-05, 'batch_size': 1091, 'optimizer': 'Adam'}.
2026-05-24 09:22:10,926 - experiment_functions - INFO - Early stopping at epoch 500. Best Metrics: (0.0052025683568125555, 0.0041390728476821195, 0.0053252100292196505)
2026-05-24 09:22:11,315 - optuna.study.study - INFO - Trial 244 finished with values: [0.0052025683568125555, 0.0041390728476821195, 0.0053252100292196505] and parameters: {'n_layers': 1, 'embedding_dim': 32, 'lr': 0.0013042877116063536, 'lambda_val': 0.000621169344675621, 'batch_size': 1878, 'optimizer': 'SGD'}.
2026-05-24 09:22:17,738 - experiment_functions - INFO - Early stopping at epoch 500. Best Metrics: (0.0050415945717243536, 0.003998344370860927, 0.004953942399889757)
2026-05-24 09:22:17,891 - optuna.study.study - INFO - Trial 245 finished with values: [0.0050415945717243536, 0.003998344370860927, 0.004953942399889757] and parameters: {'n_layers': 2, 'embedding_dim': 96, 'lr': 5.905433101490451e-05, 'lambda_val': 0.0007561839367868583, 'batch_size': 3825, 'optimizer': 'SGD'}.
2026-05-24 09:22:26,396 - experiment_functions - INFO - Early stopping at epoch 600. Best Metrics: (0.04725504694049733, 0.03031456953642384, 0.04300542174270262)
2026-05-24 09:22:26,484 - optuna.study.study - INFO - Trial 246 finished with values: [0.04725504694049733, 0.03031456953642384, 0.04300542174270262] and parameters: {'n_layers': 2, 'embedding_dim': 64, 'lr': 0.0019498675283919575, 'lambda_val': 8.523357255734578e-06, 'batch_size': 2036, 'optimizer': 'Adam'}.
2026-05-24 09:22:35,263 - experiment_functions - INFO - Early stopping at epoch 600. Best Metrics: (0.018599335112658443, 0.015596026490066226, 0.018812200616096328)
2026-05-24 09:22:35,392 - optuna.study.study - INFO - Trial 247 finished with values: [0.018599335112658443, 0.015596026490066226, 0.018812200616096328] and parameters: {'n_layers': 4, 'embedding_dim': 128, 'lr': 0.0006190490451202456, 'lambda_val': 0.0393518625138606, 'batch_size': 1091, 'optimizer': 'RMSprop'}.
2026-05-24 09:22:57,187 - experiment_functions - INFO - Early stopping at epoch 1900. Best Metrics: (0.025909420038507904, 0.019346026490066226, 0.025052020337560203)
2026-05-24 09:22:57,279 - optuna.study.study - INFO - Trial 248 finished with values: [0.025909420038507904, 0.019346026490066226, 0.025052020337560203] and parameters: {'n_layers': 4, 'embedding_dim': 32, 'lr': 0.00027037181334258007, 'lambda_val': 0.0007561839367868583, 'batch_size': 3825, 'optimizer': 'RMSprop'}.
2026-05-24 09:23:11,850 - experiment_functions - INFO - Early stopping at epoch 1250. Best Metrics: (0.05588910674332773, 0.03572019867549669, 0.05080241217696551)
2026-05-24 09:23:12,388 - optuna.study.study - INFO - Trial 249 finished with values: [0.05588910674332773, 0.03572019867549669, 0.05080241217696551] and parameters: {'n_layers': 1, 'embedding_dim': 128, 'lr': 0.0003755353524054084, 'lambda_val': 0.03503167400097262, 'batch_size': 2226, 'optimizer': 'RMSprop'}.
2026-05-24 09:23:20,282 - experiment_functions - INFO - Early stopping at epoch 600. Best Metrics: (0.04735120160607471, 0.03070364238410596, 0.04241807462449195)
2026-05-24 09:23:20,402 - optuna.study.study - INFO - Trial 250 finished with values: [0.04735120160607471, 0.03070364238410596, 0.04241807462449195] and parameters: {'n_layers': 1, 'embedding_dim': 128, 'lr': 0.002019850627421517, 'lambda_val': 4.601372605867572e-05, 'batch_size': 1091, 'optimizer': 'RMSprop'}.
2026-05-24 09:23:28,392 - experiment_functions - INFO - Early stopping at epoch 550. Best Metrics: (0.028961094333737534, 0.02056291390728477, 0.02822151528036832)
2026-05-24 09:23:28,491 - optuna.study.study - INFO - Trial 251 finished with values: [0.028961094333737534, 0.02056291390728477, 0.02822151528036832] and parameters: {'n_layers': 4, 'embedding_dim': 128, 'lr': 0.000767834461150942, 'lambda_val': 8.523357255734578e-06, 'batch_size': 2675, 'optimizer': 'RMSprop'}.
2026-05-24 09:23:46,785 - experiment_functions - INFO - Early stopping at epoch 1600. Best Metrics: (0.06103167189912615, 0.03683774834437086, 0.054439450082823616)
