2026-05-24 08:30:48,569 - optuna.study.study - INFO - Trial 62 finished with values: [0.005391031694900142, 0.00462748344370861, 0.005673221446660529] and parameters: {'n_layers': 3, 'embedding_dim': 128, 'lr': 0.00016501530026827272, 'lambda_val': 1.0276520732261342e-05, 'batch_size': 2097, 'optimizer': 'SGD'}.
2026-05-24 08:31:13,558 - experiment_functions - INFO - Early stopping at epoch 2200. Best Metrics: (0.016830881702834664, 0.014817880794701987, 0.018600789452002147)
2026-05-24 08:31:13,747 - optuna.study.study - INFO - Trial 63 finished with values: [0.016830881702834664, 0.014817880794701987, 0.018600789452002147] and parameters: {'n_layers': 1, 'embedding_dim': 128, 'lr': 0.038976708230670724, 'lambda_val': 0.02998001447563536, 'batch_size': 1635, 'optimizer': 'RMSprop'}.
2026-05-24 08:31:21,043 - experiment_functions - INFO - Early stopping at epoch 550. Best Metrics: (0.014957553519562723, 0.012905629139072849, 0.016476041600639566)
2026-05-24 08:31:21,136 - optuna.study.study - INFO - Trial 64 finished with values: [0.014957553519562723, 0.012905629139072849, 0.016476041600639566] and parameters: {'n_layers': 2, 'embedding_dim': 96, 'lr': 0.00794018645605878, 'lambda_val': 0.07344023524435195, 'batch_size': 1892, 'optimizer': 'Adam'}.
2026-05-24 08:31:29,625 - experiment_functions - INFO - Early stopping at epoch 550. Best Metrics: (0.01740246204664002, 0.014958609271523178, 0.01802417678756955)
2026-05-24 08:31:29,723 - optuna.study.study - INFO - Trial 65 finished with values: [0.01740246204664002, 0.014958609271523178, 0.01802417678756955] and parameters: {'n_layers': 2, 'embedding_dim': 256, 'lr': 0.0019498675283919575, 'lambda_val': 0.0011457679520731478, 'batch_size': 1445, 'optimizer': 'RMSprop'}.
2026-05-24 08:31:37,792 - experiment_functions - INFO - Early stopping at epoch 550. Best Metrics: (0.033132387520441536, 0.022392384105960266, 0.031734278015899266)
2026-05-24 08:31:37,889 - optuna.study.study - INFO - Trial 66 finished with values: [0.033132387520441536, 0.022392384105960266, 0.031734278015899266] and parameters: {'n_layers': 3, 'embedding_dim': 128, 'lr': 0.002019850627421517, 'lambda_val': 0.000621169344675621, 'batch_size': 3974, 'optimizer': 'Adam'}.
2026-05-24 08:31:49,940 - experiment_functions - INFO - Early stopping at epoch 850. Best Metrics: (0.025291020765843924, 0.01639072847682119, 0.023430913843718985)
2026-05-24 08:31:50,092 - optuna.study.study - INFO - Trial 67 finished with values: [0.025291020765843924, 0.01639072847682119, 0.023430913843718985] and parameters: {'n_layers': 3, 'embedding_dim': 128, 'lr': 0.011587678380610592, 'lambda_val': 1.415798354583243e-06, 'batch_size': 3275, 'optimizer': 'RMSprop'}.
2026-05-24 08:31:58,194 - experiment_functions - INFO - Early stopping at epoch 550. Best Metrics: (0.018566486430238307, 0.015720198675496688, 0.020090908885456664)
2026-05-24 08:31:58,291 - optuna.study.study - INFO - Trial 68 finished with values: [0.018566486430238307, 0.015720198675496688, 0.020090908885456664] and parameters: {'n_layers': 3, 'embedding_dim': 128, 'lr': 0.0015435244296002795, 'lambda_val': 4.601372605867572e-05, 'batch_size': 2651, 'optimizer': 'RMSprop'}.
2026-05-24 08:32:06,386 - experiment_functions - INFO - Early stopping at epoch 600. Best Metrics: (0.051005179182519525, 0.03264900662251655, 0.04586035734944095)
2026-05-24 08:32:06,563 - optuna.study.study - INFO - Trial 69 finished with values: [0.051005179182519525, 0.03264900662251655, 0.04586035734944095] and parameters: {'n_layers': 1, 'embedding_dim': 128, 'lr': 0.0019498675283919575, 'lambda_val': 0.0011457679520731478, 'batch_size': 1091, 'optimizer': 'RMSprop'}.
2026-05-24 08:32:17,114 - experiment_functions - INFO - Early stopping at epoch 800. Best Metrics: (0.01899004266282657, 0.013468543046357617, 0.01785457341319277)
2026-05-24 08:32:18,052 - optuna.study.study - INFO - Trial 70 finished with values: [0.01899004266282657, 0.013468543046357617, 0.01785457341319277] and parameters: {'n_layers': 2, 'embedding_dim': 128, 'lr': 0.02161237752390787, 'lambda_val': 0.0002288537777344949, 'batch_size': 990, 'optimizer': 'RMSprop'}.
2026-05-24 08:32:25,684 - experiment_functions - INFO - Early stopping at epoch 550. Best Metrics: (0.039902208900818255, 0.02543046357615894, 0.03416544484067944)
2026-05-24 08:32:25,843 - optuna.study.study - INFO - Trial 71 finished with values: [0.039902208900818255, 0.02543046357615894, 0.03416544484067944] and parameters: {'n_layers': 2, 'embedding_dim': 128, 'lr': 0.0015435244296002795, 'lambda_val': 4.601372605867572e-05, 'batch_size': 914, 'optimizer': 'RMSprop'}.
2026-05-24 08:32:50,610 - experiment_functions - INFO - Early stopping at epoch 2000. Best Metrics: (0.005875547120985361, 0.004221854304635762, 0.005428323925607756)
2026-05-24 08:32:50,715 - optuna.study.study - INFO - Trial 72 finished with values: [0.005875547120985361, 0.004221854304635762, 0.005428323925607756] and parameters: {'n_layers': 3, 'embedding_dim': 128, 'lr': 1.1918045057122416e-05, 'lambda_val': 1.7528942361098337e-05, 'batch_size': 902, 'optimizer': 'RMSprop'}.
2026-05-24 08:32:57,303 - experiment_functions - INFO - Early stopping at epoch 500. Best Metrics: (0.004939683957945071, 0.004213576158940397, 0.00527447330995084)
2026-05-24 08:32:57,411 - optuna.study.study - INFO - Trial 73 finished with values: [0.004939683957945071, 0.004213576158940397, 0.00527447330995084] and parameters: {'n_layers': 1, 'embedding_dim': 128, 'lr': 0.01200443354454643, 'lambda_val': 1.157908306146744e-06, 'batch_size': 2812, 'optimizer': 'SGD'}.
2026-05-24 08:33:07,237 - experiment_functions - INFO - Early stopping at epoch 550. Best Metrics: (0.0261245863764864, 0.018667218543046357, 0.025109060327079158)
2026-05-24 08:33:07,341 - optuna.study.study - INFO - Trial 74 finished with values: [0.0261245863764864, 0.018667218543046357, 0.025109060327079158] and parameters: {'n_layers': 4, 'embedding_dim': 256, 'lr': 0.0007100702200577561, 'lambda_val': 1.4219577427815883e-06, 'batch_size': 3601, 'optimizer': 'RMSprop'}.
2026-05-24 08:33:19,501 - experiment_functions - INFO - Early stopping at epoch 900. Best Metrics: (0.007096318409742015, 0.00783112582781457, 0.009302104347893345)
2026-05-24 08:33:19,588 - optuna.study.study - INFO - Trial 75 finished with values: [0.007096318409742015, 0.00783112582781457, 0.009302104347893345] and parameters: {'n_layers': 3, 'embedding_dim': 128, 'lr': 0.017832494932834512, 'lambda_val': 0.07720465530276911, 'batch_size': 3605, 'optimizer': 'RMSprop'}.
2026-05-24 08:33:29,384 - experiment_functions - INFO - Early stopping at epoch 650. Best Metrics: (0.022374534635209224, 0.014652317880794703, 0.020749842011579502)
2026-05-24 08:33:29,746 - optuna.study.study - INFO - Trial 76 finished with values: [0.022374534635209224, 0.014652317880794703, 0.020749842011579502] and parameters: {'n_layers': 2, 'embedding_dim': 256, 'lr': 0.014769636375767437, 'lambda_val': 0.0006001451797642537, 'batch_size': 2340, 'optimizer': 'RMSprop'}.
2026-05-24 08:33:36,767 - experiment_functions - INFO - Early stopping at epoch 500. Best Metrics: (0.012990380017156255, 0.010885761589403974, 0.013979508653011398)
2026-05-24 08:33:37,283 - optuna.study.study - INFO - Trial 77 finished with values: [0.012990380017156255, 0.010885761589403974, 0.013979508653011398] and parameters: {'n_layers': 3, 'embedding_dim': 128, 'lr': 0.052503702468359205, 'lambda_val': 0.02592868535856022, 'batch_size': 1342, 'optimizer': 'RMSprop'}.
2026-05-24 08:33:46,159 - experiment_functions - INFO - Early stopping at epoch 500. Best Metrics: (0.005421881284061229, 0.004006622516556292, 0.005541013559586384)
2026-05-24 08:33:46,255 - optuna.study.study - INFO - Trial 78 finished with values: [0.005421881284061229, 0.004006622516556292, 0.005541013559586384] and parameters: {'n_layers': 4, 'embedding_dim': 256, 'lr': 0.043797018940235494, 'lambda_val': 0.000621169344675621, 'batch_size': 3974, 'optimizer': 'SGD'}.
2026-05-24 08:33:57,621 - experiment_functions - INFO - Early stopping at epoch 650. Best Metrics: (0.015091067084903313, 0.008874172185430466, 0.01323735740193993)
2026-05-24 08:33:58,790 - optuna.study.study - INFO - Trial 79 finished with values: [0.015091067084903313, 0.008874172185430466, 0.01323735740193993] and parameters: {'n_layers': 4, 'embedding_dim': 256, 'lr': 0.05161531426586809, 'lambda_val': 2.980991039721705e-06, 'batch_size': 2051, 'optimizer': 'Adam'}.
2026-05-24 08:34:11,160 - experiment_functions - INFO - Early stopping at epoch 500. Best Metrics: (0.005235337389019283, 0.004263245033112583, 0.005370703344203882)
2026-05-24 08:34:11,253 - optuna.study.study - INFO - Trial 80 finished with values: [0.005235337389019283, 0.004263245033112583, 0.005370703344203882] and parameters: {'n_layers': 2, 'embedding_dim': 128, 'lr': 0.000992884943353568, 'lambda_val': 8.455049892667247e-06, 'batch_size': 1011, 'optimizer': 'SGD'}.
2026-05-24 08:34:53,281 - experiment_functions - INFO - Early stopping at epoch 3450. Best Metrics: (0.0203918448884151, 0.01611754966887417, 0.02072167984387012)
2026-05-24 08:34:53,368 - optuna.study.study - INFO - Trial 81 finished with values: [0.0203918448884151, 0.01611754966887417, 0.02072167984387012] and parameters: {'n_layers': 2, 'embedding_dim': 128, 'lr': 0.005444060961063268, 'lambda_val': 0.007566098648304109, 'batch_size': 2482, 'optimizer': 'RMSprop'}.
2026-05-24 08:35:11,940 - experiment_functions - INFO - Early stopping at epoch 1300. Best Metrics: (0.02807777639569369, 0.015000000000000001, 0.02271294828070608)
2026-05-24 08:35:12,082 - optuna.study.study - INFO - Trial 82 finished with values: [0.02807777639569369, 0.015000000000000001, 0.02271294828070608] and parameters: {'n_layers': 4, 'embedding_dim': 128, 'lr': 0.011587678380610592, 'lambda_val': 1.415798354583243e-06, 'batch_size': 3275, 'optimizer': 'RMSprop'}.
2026-05-24 08:35:55,511 - optuna.study.study - INFO - Trial 83 finished with values: [0.009639675827246548, 0.007177152317880795, 0.00974097305458525] and parameters: {'n_layers': 1, 'embedding_dim': 128, 'lr': 0.00016501530026827272, 'lambda_val': 1.0276520732261342e-05, 'batch_size': 914, 'optimizer': 'RMSprop'}.
2026-05-24 08:36:21,067 - experiment_functions - INFO - Early stopping at epoch 1550. Best Metrics: (0.021090130006045715, 0.01679635761589404, 0.021910494111118263)
2026-05-24 08:36:21,499 - optuna.study.study - INFO - Trial 84 finished with values: [0.021090130006045715, 0.01679635761589404, 0.021910494111118263] and parameters: {'n_layers': 4, 'embedding_dim': 256, 'lr': 0.00012197369968794222, 'lambda_val': 0.028260644150952398, 'batch_size': 3424, 'optimizer': 'RMSprop'}.
2026-05-24 08:36:28,552 - experiment_functions - INFO - Early stopping at epoch 500. Best Metrics: (0.004970106197689026, 0.003940397350993378, 0.005165738844754645)
2026-05-24 08:36:28,659 - optuna.study.study - INFO - Trial 85 finished with values: [0.004970106197689026, 0.003940397350993378, 0.005165738844754645] and parameters: {'n_layers': 4, 'embedding_dim': 64, 'lr': 0.000438414345650639, 'lambda_val': 0.0003484860640497251, 'batch_size': 2343, 'optimizer': 'SGD'}.
2026-05-24 08:36:47,642 - experiment_functions - INFO - Early stopping at epoch 1650. Best Metrics: (0.012015825343169405, 0.0118294701986755, 0.014560566827725151)
2026-05-24 08:36:47,739 - optuna.study.study - INFO - Trial 86 finished with values: [0.012015825343169405, 0.0118294701986755, 0.014560566827725151] and parameters: {'n_layers': 1, 'embedding_dim': 96, 'lr': 0.016831383434644576, 'lambda_val': 0.07720465530276911, 'batch_size': 2363, 'optimizer': 'Adam'}.
2026-05-24 08:36:54,299 - experiment_functions - INFO - Early stopping at epoch 500. Best Metrics: (0.004770508846356536, 0.004039735099337748, 0.005135983766429966)
2026-05-24 08:36:54,391 - optuna.study.study - INFO - Trial 87 finished with values: [0.004770508846356536, 0.004039735099337748, 0.005135983766429966] and parameters: {'n_layers': 2, 'embedding_dim': 96, 'lr': 0.0032608429322007904, 'lambda_val': 0.05735150016039925, 'batch_size': 1445, 'optimizer': 'SGD'}.
2026-05-24 08:37:16,077 - experiment_functions - INFO - Early stopping at epoch 1750. Best Metrics: (0.05426582241673495, 0.0339569536423841, 0.04921603245666497)
2026-05-24 08:37:16,713 - optuna.study.study - INFO - Trial 88 finished with values: [0.05426582241673495, 0.0339569536423841, 0.04921603245666497] and parameters: {'n_layers': 1, 'embedding_dim': 128, 'lr': 0.0003755353524054084, 'lambda_val': 0.0007561839367868583, 'batch_size': 3076, 'optimizer': 'RMSprop'}.
2026-05-24 08:37:23,570 - experiment_functions - INFO - Early stopping at epoch 500. Best Metrics: (0.005442798068462125, 0.004461920529801325, 0.0054980303489699815)
2026-05-24 08:37:24,040 - optuna.study.study - INFO - Trial 89 finished with values: [0.005442798068462125, 0.004461920529801325, 0.0054980303489699815] and parameters: {'n_layers': 2, 'embedding_dim': 128, 'lr': 2.1363278466221736e-05, 'lambda_val': 0.0002288537777344949, 'batch_size': 990, 'optimizer': 'SGD'}.
2026-05-24 08:38:20,648 - optuna.study.study - INFO - Trial 90 finished with values: [0.00518804981183518, 0.004428807947019868, 0.0055681851033201005] and parameters: {'n_layers': 3, 'embedding_dim': 256, 'lr': 3.917271636331136e-05, 'lambda_val': 1.0487619387576183e-05, 'batch_size': 744, 'optimizer': 'Adam'}.
2026-05-24 08:38:27,150 - experiment_functions - INFO - Early stopping at epoch 500. Best Metrics: (0.005400169332930582, 0.004246688741721854, 0.005493367654457134)
2026-05-24 08:38:27,778 - optuna.study.study - INFO - Trial 91 finished with values: [0.005400169332930582, 0.004246688741721854, 0.005493367654457134] and parameters: {'n_layers': 1, 'embedding_dim': 128, 'lr': 0.00015717441755135915, 'lambda_val': 0.08233878044568804, 'batch_size': 3538, 'optimizer': 'RMSprop'}.
2026-05-24 08:38:36,178 - experiment_functions - INFO - Early stopping at epoch 500. Best Metrics: (0.005278734067847729, 0.0042632450331125836, 0.005380530082695104)
2026-05-24 08:38:36,277 - optuna.study.study - INFO - Trial 92 finished with values: [0.005278734067847729, 0.0042632450331125836, 0.005380530082695104] and parameters: {'n_layers': 3, 'embedding_dim': 256, 'lr': 0.00012197369968794222, 'lambda_val': 0.07344023524435195, 'batch_size': 3332, 'optimizer': 'RMSprop'}.
2026-05-24 08:39:15,757 - experiment_functions - INFO - Early stopping at epoch 2850. Best Metrics: (0.031055122194243678, 0.02222682119205298, 0.02950380246593572)
2026-05-24 08:39:15,848 - optuna.study.study - INFO - Trial 93 finished with values: [0.031055122194243678, 0.02222682119205298, 0.02950380246593572] and parameters: {'n_layers': 4, 'embedding_dim': 128, 'lr': 0.00011023814328223557, 'lambda_val': 0.000963421834632777, 'batch_size': 3601, 'optimizer': 'Adam'}.
2026-05-24 08:39:29,038 - experiment_functions - INFO - Early stopping at epoch 800. Best Metrics: (0.00534150844406329, 0.004428807947019868, 0.005761693406565102)
2026-05-24 08:39:29,128 - optuna.study.study - INFO - Trial 94 finished with values: [0.00534150844406329, 0.004428807947019868, 0.005761693406565102] and parameters: {'n_layers': 4, 'embedding_dim': 256, 'lr': 0.07658891258151727, 'lambda_val': 0.00029167129961628466, 'batch_size': 2051, 'optimizer': 'SGD'}.
2026-05-24 08:39:36,743 - experiment_functions - INFO - Early stopping at epoch 550. Best Metrics: (0.045886694358349626, 0.030397350993377488, 0.04248891954677257)
2026-05-24 08:39:36,920 - optuna.study.study - INFO - Trial 95 finished with values: [0.045886694358349626, 0.030397350993377488, 0.04248891954677257] and parameters: {'n_layers': 1, 'embedding_dim': 128, 'lr': 0.002019850627421517, 'lambda_val': 5.10420277675261e-05, 'batch_size': 3974, 'optimizer': 'RMSprop'}.
2026-05-24 08:39:46,932 - experiment_functions - INFO - Early stopping at epoch 750. Best Metrics: (0.02113264408581869, 0.013973509933774836, 0.019107382590930616)
2026-05-24 08:39:47,044 - optuna.study.study - INFO - Trial 96 finished with values: [0.02113264408581869, 0.013973509933774836, 0.019107382590930616] and parameters: {'n_layers': 2, 'embedding_dim': 96, 'lr': 0.019411422856209563, 'lambda_val': 0.0006001451797642537, 'batch_size': 3332, 'optimizer': 'RMSprop'}.
2026-05-24 08:39:55,071 - experiment_functions - INFO - Early stopping at epoch 600. Best Metrics: (0.05145375218796818, 0.03307119205298013, 0.04577134386406592)
2026-05-24 08:39:55,167 - optuna.study.study - INFO - Trial 97 finished with values: [0.05145375218796818, 0.03307119205298013, 0.04577134386406592] and parameters: {'n_layers': 1, 'embedding_dim': 64, 'lr': 0.0019498675283919575, 'lambda_val': 8.523357255734578e-06, 'batch_size': 2036, 'optimizer': 'RMSprop'}.
2026-05-24 08:40:08,469 - experiment_functions - INFO - Early stopping at epoch 900. Best Metrics: (0.04220219735385123, 0.028642384105960265, 0.039192363801598545)
2026-05-24 08:40:08,562 - optuna.study.study - INFO - Trial 98 finished with values: [0.04220219735385123, 0.028642384105960265, 0.039192363801598545] and parameters: {'n_layers': 2, 'embedding_dim': 256, 'lr': 0.00027037181334258007, 'lambda_val': 0.007566098648304109, 'batch_size': 3538, 'optimizer': 'RMSprop'}.
2026-05-24 08:40:46,681 - experiment_functions - INFO - Early stopping at epoch 3100. Best Metrics: (0.02239626111126298, 0.011630794701986755, 0.017849151135179365)
2026-05-24 08:40:46,769 - optuna.study.study - INFO - Trial 99 finished with values: [0.02239626111126298, 0.011630794701986755, 0.017849151135179365] and parameters: {'n_layers': 4, 'embedding_dim': 64, 'lr': 0.011587678380610592, 'lambda_val': 1.415798354583243e-06, 'batch_size': 3275, 'optimizer': 'Adam'}.
2026-05-24 08:40:58,269 - experiment_functions - INFO - Early stopping at epoch 850. Best Metrics: (0.05238416306227609, 0.03210264900662252, 0.04748235488052387)
2026-05-24 08:40:58,371 - optuna.study.study - INFO - Trial 100 finished with values: [0.05238416306227609, 0.03210264900662252, 0.04748235488052387] and parameters: {'n_layers': 2, 'embedding_dim': 96, 'lr': 0.0005881424192141288, 'lambda_val': 2.346379884027025e-05, 'batch_size': 2675, 'optimizer': 'Adam'}.
2026-05-24 08:41:24,284 - experiment_functions - INFO - Early stopping at epoch 1600. Best Metrics: (0.006223810257877313, 0.007806291390728476, 0.009090297601900442)
2026-05-24 08:41:24,930 - optuna.study.study - INFO - Trial 101 finished with values: [0.006223810257877313, 0.007806291390728476, 0.009090297601900442] and parameters: {'n_layers': 4, 'embedding_dim': 256, 'lr': 0.0019498675283919575, 'lambda_val': 0.028260644150952398, 'batch_size': 3424, 'optimizer': 'RMSprop'}.
2026-05-24 08:41:33,181 - experiment_functions - INFO - Early stopping at epoch 600. Best Metrics: (0.05055574313594866, 0.03174668874172185, 0.04464616263841778)
2026-05-24 08:41:33,285 - optuna.study.study - INFO - Trial 102 finished with values: [0.05055574313594866, 0.03174668874172185, 0.04464616263841778] and parameters: {'n_layers': 1, 'embedding_dim': 128, 'lr': 0.0019498675283919575, 'lambda_val': 0.000621169344675621, 'batch_size': 1091, 'optimizer': 'RMSprop'}.
2026-05-24 08:42:19,884 - optuna.study.study - INFO - Trial 103 finished with values: [0.012036923877860156, 0.00906456953642384, 0.012290264253723463] and parameters: {'n_layers': 1, 'embedding_dim': 256, 'lr': 0.00012197369968794222, 'lambda_val': 8.523357255734578e-06, 'batch_size': 2036, 'optimizer': 'RMSprop'}.
2026-05-24 08:42:27,953 - experiment_functions - INFO - Early stopping at epoch 550. Best Metrics: (0.01119102985569505, 0.011274834437086092, 0.013216032781496597)
2026-05-24 08:42:28,051 - optuna.study.study - INFO - Trial 104 finished with values: [0.01119102985569505, 0.011274834437086092, 0.013216032781496597] and parameters: {'n_layers': 3, 'embedding_dim': 128, 'lr': 0.0019498675283919575, 'lambda_val': 0.0011457679520731478, 'batch_size': 3384, 'optimizer': 'RMSprop'}.
2026-05-24 08:42:47,562 - experiment_functions - INFO - Early stopping at epoch 1500. Best Metrics: (0.00721629788515779, 0.007971854304635763, 0.009226596089969561)
2026-05-24 08:42:48,119 - optuna.study.study - INFO - Trial 105 finished with values: [0.00721629788515779, 0.007971854304635763, 0.009226596089969561] and parameters: {'n_layers': 4, 'embedding_dim': 96, 'lr': 0.011587678380610592, 'lambda_val': 0.028260644150952398, 'batch_size': 3424, 'optimizer': 'RMSprop'}.
2026-05-24 08:42:56,893 - experiment_functions - INFO - Early stopping at epoch 650. Best Metrics: (0.05598312636176506, 0.03394039735099338, 0.04970389528533836)
2026-05-24 08:42:57,064 - optuna.study.study - INFO - Trial 106 finished with values: [0.05598312636176506, 0.03394039735099338, 0.04970389528533836] and parameters: {'n_layers': 1, 'embedding_dim': 128, 'lr': 0.0015435244296002795, 'lambda_val': 0.0011457679520731478, 'batch_size': 1091, 'optimizer': 'RMSprop'}.
2026-05-24 08:43:07,045 - experiment_functions - INFO - Early stopping at epoch 600. Best Metrics: (0.021859339636986126, 0.014610927152317882, 0.019979695609258264)
2026-05-24 08:43:07,292 - optuna.study.study - INFO - Trial 107 finished with values: [0.021859339636986126, 0.014610927152317882, 0.019979695609258264] and parameters: {'n_layers': 3, 'embedding_dim': 256, 'lr': 0.017832494932834512, 'lambda_val': 2.2313501632644777e-06, 'batch_size': 3642, 'optimizer': 'RMSprop'}.
2026-05-24 08:43:15,932 - experiment_functions - INFO - Early stopping at epoch 650. Best Metrics: (0.022904189865306346, 0.016183774834437087, 0.021904073745860564)
