2026-05-23 21:52:16,991 - optuna.study.study - INFO - Trial 287 finished with values: [0.06643432263304304, 0.04937913907284768, 0.06873895408520729] and parameters: {'n_layers': 2, 'embedding_dim': 128, 'lr': 0.0017544079546559647, 'lambda_val': 0.00021573250238994323, 'batch_size': 576, 'optimizer': 'Adam'}.
2026-05-23 21:53:10,763 - experiment_functions - INFO - Early stopping at epoch 3400. Best Metrics: (0.08217519143780218, 0.06024834437086092, 0.0849992629480121)
2026-05-23 21:53:10,852 - optuna.study.study - INFO - Trial 288 finished with values: [0.08217519143780218, 0.06024834437086092, 0.0849992629480121] and parameters: {'n_layers': 1, 'embedding_dim': 256, 'lr': 0.00045141578622738895, 'lambda_val': 0.0007535837355673727, 'batch_size': 886, 'optimizer': 'Adam'}.
2026-05-23 21:53:26,324 - experiment_functions - INFO - Early stopping at epoch 1100. Best Metrics: (0.07700474633285599, 0.05550496688741722, 0.07595559773152687)
2026-05-23 21:53:26,734 - optuna.study.study - INFO - Trial 289 finished with values: [0.07700474633285599, 0.05550496688741722, 0.07595559773152687] and parameters: {'n_layers': 2, 'embedding_dim': 32, 'lr': 0.0006825513923366329, 'lambda_val': 1.207883913872658e-06, 'batch_size': 886, 'optimizer': 'Adam'}.
2026-05-23 21:53:40,345 - experiment_functions - INFO - Early stopping at epoch 550. Best Metrics: (0.020603717583152974, 0.021009933774834438, 0.024244764474360303)
2026-05-23 21:53:40,993 - optuna.study.study - INFO - Trial 290 finished with values: [0.020603717583152974, 0.021009933774834438, 0.024244764474360303] and parameters: {'n_layers': 3, 'embedding_dim': 256, 'lr': 0.004031587731005074, 'lambda_val': 0.0007535837355673727, 'batch_size': 2170, 'optimizer': 'Adam'}.
2026-05-23 21:53:49,045 - experiment_functions - INFO - Early stopping at epoch 550. Best Metrics: (0.06348793187030435, 0.048890728476821195, 0.06677962345524285)
2026-05-23 21:53:49,148 - optuna.study.study - INFO - Trial 291 finished with values: [0.06348793187030435, 0.048890728476821195, 0.06677962345524285] and parameters: {'n_layers': 1, 'embedding_dim': 64, 'lr': 0.011872608529082057, 'lambda_val': 0.00020136097974536503, 'batch_size': 1491, 'optimizer': 'Adam'}.
2026-05-23 21:54:58,461 - optuna.study.study - INFO - Trial 292 finished with values: [0.013683609489445832, 0.01081953642384106, 0.014013102046876925] and parameters: {'n_layers': 4, 'embedding_dim': 96, 'lr': 5.3326933555144306e-05, 'lambda_val': 2.2621228626504235e-06, 'batch_size': 886, 'optimizer': 'Adam'}.
2026-05-23 21:55:17,116 - experiment_functions - INFO - Early stopping at epoch 900. Best Metrics: (0.06842623925776108, 0.052491721854304625, 0.07012295687589692)
2026-05-23 21:55:18,143 - optuna.study.study - INFO - Trial 293 finished with values: [0.06842623925776108, 0.052491721854304625, 0.07012295687589692] and parameters: {'n_layers': 2, 'embedding_dim': 256, 'lr': 0.0006825513923366329, 'lambda_val': 1.207883913872658e-06, 'batch_size': 576, 'optimizer': 'Adam'}.
2026-05-23 21:56:21,882 - optuna.study.study - INFO - Trial 294 finished with values: [0.08429714351267122, 0.06109271523178808, 0.08842004909291107] and parameters: {'n_layers': 1, 'embedding_dim': 256, 'lr': 0.00045141578622738895, 'lambda_val': 1.114522882326784e-05, 'batch_size': 886, 'optimizer': 'Adam'}.
2026-05-23 21:56:38,951 - experiment_functions - INFO - Early stopping at epoch 600. Best Metrics: (0.03760015267460844, 0.032193708609271524, 0.039922931752399374)
2026-05-23 21:56:39,033 - optuna.study.study - INFO - Trial 295 finished with values: [0.03760015267460844, 0.032193708609271524, 0.039922931752399374] and parameters: {'n_layers': 4, 'embedding_dim': 256, 'lr': 0.001325452189730596, 'lambda_val': 0.0007535837355673727, 'batch_size': 886, 'optimizer': 'Adam'}.
2026-05-23 21:57:42,477 - optuna.study.study - INFO - Trial 296 finished with values: [0.07765881811802007, 0.05849337748344371, 0.08269429559836397] and parameters: {'n_layers': 1, 'embedding_dim': 256, 'lr': 0.00045141578622738895, 'lambda_val': 1.2948481747134374e-05, 'batch_size': 576, 'optimizer': 'Adam'}.
2026-05-23 21:57:50,580 - experiment_functions - INFO - Early stopping at epoch 500. Best Metrics: (0.005686838232430933, 0.004544701986754968, 0.005386528072631325)
2026-05-23 21:57:50,670 - optuna.study.study - INFO - Trial 297 finished with values: [0.005686838232430933, 0.004544701986754968, 0.005386528072631325] and parameters: {'n_layers': 1, 'embedding_dim': 256, 'lr': 0.00045141578622738895, 'lambda_val': 0.008651368439452143, 'batch_size': 576, 'optimizer': 'Adam'}.
2026-05-23 21:58:04,555 - experiment_functions - INFO - Early stopping at epoch 950. Best Metrics: (0.07324831197916985, 0.058178807947019864, 0.07847901671154743)
2026-05-23 21:58:04,669 - optuna.study.study - INFO - Trial 298 finished with values: [0.07324831197916985, 0.058178807947019864, 0.07847901671154743] and parameters: {'n_layers': 1, 'embedding_dim': 64, 'lr': 0.0006825513923366329, 'lambda_val': 0.038730634254663075, 'batch_size': 2902, 'optimizer': 'Adam'}.
2026-05-23 21:58:11,275 - experiment_functions - INFO - Early stopping at epoch 500. Best Metrics: (0.004832739113570331, 0.004528145695364238, 0.005506219520349635)
2026-05-23 21:58:11,995 - optuna.study.study - INFO - Trial 299 finished with values: [0.004832739113570331, 0.004528145695364238, 0.005506219520349635] and parameters: {'n_layers': 1, 'embedding_dim': 32, 'lr': 3.8900190401778434e-05, 'lambda_val': 0.0007535837355673727, 'batch_size': 833, 'optimizer': 'Adam'}.
2026-05-23 21:58:12,010 - root - INFO - Selected Trial 251 based on Max ndcg: 0.0920
2026-05-23 21:58:12,010 - root - INFO - Associated Recall: 0.0925
2026-05-23 21:58:12,010 - experiment_functions - INFO - Training the best model ... for e_1M_full
2026-05-23 21:59:01,560 - root - INFO - **** Training e_1M_1c1dcs
2026-05-23 21:59:01,560 - root - INFO -   ** 1-Dominant stats:
2026-05-23 21:59:01,560 - root - INFO -   ** Finding the dominant set:
2026-05-23 22:38:25,439 - root - INFO -   ** Getting the trainable edges:
2026-05-23 22:38:25,453 - helper_functions - INFO -      Number of nodes: 4740
2026-05-23 22:38:25,453 - helper_functions - INFO -      Ratio: 0.4863533757438949
2026-05-23 22:38:25,453 - helper_functions - INFO -      Number of unique users: 3156
2026-05-23 22:38:25,453 - helper_functions - INFO -      Number of unique items: 1584
2026-05-23 22:38:25,453 - helper_functions - INFO -      Total dominant set edge: 14614
2026-05-23 22:38:25,453 - helper_functions - INFO -      Trainable edges: 11691.2
2026-05-23 22:38:25,492 - root - INFO -   **** Getting 14614 dominant set edges
2026-05-23 22:38:25,756 - optuna.storages._rdb.storage - INFO - A new study created in RDB with name: Study_e_1M_1c1dcs_strict
2026-05-23 22:38:36,057 - experiment_functions - INFO - Early stopping at epoch 800. Best Metrics: (0.005319849422604294, 0.0041390728476821195, 0.005301376299655548)
2026-05-23 22:38:36,188 - optuna.study.study - INFO - Trial 0 finished with values: [0.005319849422604294, 0.0041390728476821195, 0.005301376299655548] and parameters: {'n_layers': 4, 'embedding_dim': 128, 'lr': 1.7785379096918133e-05, 'lambda_val': 3.4048438452983103e-06, 'batch_size': 3613, 'optimizer': 'RMSprop'}.
2026-05-23 22:38:43,056 - experiment_functions - INFO - Early stopping at epoch 600. Best Metrics: (0.005389445717571292, 0.004188741721854306, 0.005250712396197101)
2026-05-23 22:38:43,155 - optuna.study.study - INFO - Trial 1 finished with values: [0.005389445717571292, 0.004188741721854306, 0.005250712396197101] and parameters: {'n_layers': 1, 'embedding_dim': 32, 'lr': 1.1872249776988844e-05, 'lambda_val': 1.7628989293111625e-05, 'batch_size': 1310, 'optimizer': 'RMSprop'}.
2026-05-23 22:38:49,562 - experiment_functions - INFO - Early stopping at epoch 500. Best Metrics: (0.004373633587997193, 0.003518211920529802, 0.004366786940221375)
2026-05-23 22:38:50,244 - optuna.study.study - INFO - Trial 2 finished with values: [0.004373633587997193, 0.003518211920529802, 0.004366786940221375] and parameters: {'n_layers': 4, 'embedding_dim': 96, 'lr': 0.03771288802518231, 'lambda_val': 0.0014768694195308571, 'batch_size': 2847, 'optimizer': 'Adam'}.
2026-05-23 22:38:56,586 - experiment_functions - INFO - Early stopping at epoch 500. Best Metrics: (0.007251875595276541, 0.0038741721854304635, 0.005839745959031966)
2026-05-23 22:38:56,778 - optuna.study.study - INFO - Trial 3 finished with values: [0.007251875595276541, 0.0038741721854304635, 0.005839745959031966] and parameters: {'n_layers': 4, 'embedding_dim': 96, 'lr': 0.05747482424274449, 'lambda_val': 0.0018464106432939337, 'batch_size': 1061, 'optimizer': 'RMSprop'}.
2026-05-23 22:39:02,951 - experiment_functions - INFO - Early stopping at epoch 500. Best Metrics: (0.005232788315223121, 0.004155629139072848, 0.005269287438014403)
2026-05-23 22:39:03,450 - optuna.study.study - INFO - Trial 4 finished with values: [0.005232788315223121, 0.004155629139072848, 0.005269287438014403] and parameters: {'n_layers': 4, 'embedding_dim': 32, 'lr': 0.0011907588713183355, 'lambda_val': 0.05571593658045694, 'batch_size': 755, 'optimizer': 'Adam'}.
2026-05-23 22:39:09,860 - experiment_functions - INFO - Early stopping at epoch 500. Best Metrics: (0.004664791864842035, 0.0038741721854304635, 0.004831573362926737)
2026-05-23 22:39:10,130 - optuna.study.study - INFO - Trial 5 finished with values: [0.004664791864842035, 0.0038741721854304635, 0.004831573362926737] and parameters: {'n_layers': 3, 'embedding_dim': 32, 'lr': 2.821448205891303e-05, 'lambda_val': 0.0014060987487639572, 'batch_size': 2608, 'optimizer': 'Adam'}.
2026-05-23 22:39:16,104 - experiment_functions - INFO - Early stopping at epoch 500. Best Metrics: (0.0054059210204671325, 0.004089403973509934, 0.005356848332893059)
2026-05-23 22:39:16,523 - optuna.study.study - INFO - Trial 6 finished with values: [0.0054059210204671325, 0.004089403973509934, 0.005356848332893059] and parameters: {'n_layers': 3, 'embedding_dim': 32, 'lr': 0.0004831960385751889, 'lambda_val': 0.02056194581360825, 'batch_size': 3586, 'optimizer': 'Adam'}.
2026-05-23 22:39:23,229 - experiment_functions - INFO - Early stopping at epoch 550. Best Metrics: (0.009557099257385154, 0.004958609271523179, 0.007118076536026625)
2026-05-23 22:39:23,529 - optuna.study.study - INFO - Trial 7 finished with values: [0.009557099257385154, 0.004958609271523179, 0.007118076536026625] and parameters: {'n_layers': 4, 'embedding_dim': 32, 'lr': 0.0047404185338547926, 'lambda_val': 0.00031335292673571056, 'batch_size': 627, 'optimizer': 'Adam'}.
2026-05-23 22:39:31,356 - experiment_functions - INFO - Early stopping at epoch 500. Best Metrics: (0.01301811588388316, 0.00554635761589404, 0.011956739262467828)
2026-05-23 22:39:31,608 - optuna.study.study - INFO - Trial 8 finished with values: [0.01301811588388316, 0.00554635761589404, 0.011956739262467828] and parameters: {'n_layers': 2, 'embedding_dim': 64, 'lr': 0.0640007632858696, 'lambda_val': 0.0001637829710580644, 'batch_size': 2947, 'optimizer': 'RMSprop'}.
2026-05-23 22:39:38,760 - experiment_functions - INFO - Early stopping at epoch 550. Best Metrics: (0.004797448690504497, 0.00408112582781457, 0.0050712046783066905)
2026-05-23 22:39:38,907 - optuna.study.study - INFO - Trial 9 finished with values: [0.004797448690504497, 0.00408112582781457, 0.0050712046783066905] and parameters: {'n_layers': 2, 'embedding_dim': 256, 'lr': 5.1423395324241745e-05, 'lambda_val': 0.006048759623601238, 'batch_size': 1435, 'optimizer': 'Adam'}.
2026-05-23 22:39:45,291 - experiment_functions - INFO - Early stopping at epoch 500. Best Metrics: (0.004998436992813464, 0.003890728476821192, 0.004800966427611889)
2026-05-23 22:39:45,389 - optuna.study.study - INFO - Trial 10 finished with values: [0.004998436992813464, 0.003890728476821192, 0.004800966427611889] and parameters: {'n_layers': 3, 'embedding_dim': 128, 'lr': 0.0021799634044870845, 'lambda_val': 0.010437278032758074, 'batch_size': 3235, 'optimizer': 'RMSprop'}.
2026-05-23 22:39:52,412 - experiment_functions - INFO - Early stopping at epoch 500. Best Metrics: (0.005441416076412821, 0.004064569536423842, 0.0051684206405354155)
2026-05-23 22:39:52,513 - optuna.study.study - INFO - Trial 11 finished with values: [0.005441416076412821, 0.004064569536423842, 0.0051684206405354155] and parameters: {'n_layers': 3, 'embedding_dim': 256, 'lr': 0.0033773996468941005, 'lambda_val': 0.0021234943595744207, 'batch_size': 3472, 'optimizer': 'Adam'}.
2026-05-23 22:39:58,635 - experiment_functions - INFO - Early stopping at epoch 500. Best Metrics: (0.004875489926178972, 0.004097682119205298, 0.004845868500282331)
2026-05-23 22:39:59,137 - optuna.study.study - INFO - Trial 12 finished with values: [0.004875489926178972, 0.004097682119205298, 0.004845868500282331] and parameters: {'n_layers': 3, 'embedding_dim': 32, 'lr': 0.00015581909929389577, 'lambda_val': 0.01063388113293111, 'batch_size': 710, 'optimizer': 'SGD'}.
2026-05-23 22:40:08,101 - experiment_functions - INFO - Early stopping at epoch 750. Best Metrics: (0.021356528631339806, 0.007119205298013245, 0.019113610942655016)
2026-05-23 22:40:08,193 - optuna.study.study - INFO - Trial 13 finished with values: [0.021356528631339806, 0.007119205298013245, 0.019113610942655016] and parameters: {'n_layers': 1, 'embedding_dim': 128, 'lr': 0.0003568831204476262, 'lambda_val': 1.0525537797663283e-06, 'batch_size': 4059, 'optimizer': 'RMSprop'}.
2026-05-23 22:40:15,510 - experiment_functions - INFO - Early stopping at epoch 550. Best Metrics: (0.008901359640904754, 0.004991721854304636, 0.007683901645256661)
2026-05-23 22:40:15,614 - optuna.study.study - INFO - Trial 14 finished with values: [0.008901359640904754, 0.004991721854304636, 0.007683901645256661] and parameters: {'n_layers': 4, 'embedding_dim': 128, 'lr': 0.003241752579826309, 'lambda_val': 2.430474765536691e-05, 'batch_size': 4052, 'optimizer': 'Adam'}.
2026-05-23 22:40:33,486 - experiment_functions - INFO - Early stopping at epoch 1550. Best Metrics: (0.005193382668068796, 0.004163907284768212, 0.005506370872822157)
2026-05-23 22:40:33,582 - optuna.study.study - INFO - Trial 15 finished with values: [0.005193382668068796, 0.004163907284768212, 0.005506370872822157] and parameters: {'n_layers': 3, 'embedding_dim': 128, 'lr': 0.06770148808940041, 'lambda_val': 7.5682386146402835e-06, 'batch_size': 3247, 'optimizer': 'SGD'}.
2026-05-23 22:40:44,354 - experiment_functions - INFO - Early stopping at epoch 950. Best Metrics: (0.008686968141676018, 0.004668874172185431, 0.007385004574179112)
2026-05-23 22:40:44,924 - optuna.study.study - INFO - Trial 16 finished with values: [0.008686968141676018, 0.004668874172185431, 0.007385004574179112] and parameters: {'n_layers': 1, 'embedding_dim': 256, 'lr': 0.0001575404982668674, 'lambda_val': 0.019425586100194146, 'batch_size': 1550, 'optimizer': 'Adam'}.
2026-05-23 22:41:24,976 - experiment_functions - INFO - Early stopping at epoch 3250. Best Metrics: (0.02843235520658564, 0.009056291390728477, 0.025329916352488224)
2026-05-23 22:41:25,143 - optuna.study.study - INFO - Trial 17 finished with values: [0.02843235520658564, 0.009056291390728477, 0.025329916352488224] and parameters: {'n_layers': 2, 'embedding_dim': 128, 'lr': 0.00011132803279953378, 'lambda_val': 9.691061665067305e-06, 'batch_size': 3705, 'optimizer': 'RMSprop'}.
2026-05-23 22:41:32,191 - experiment_functions - INFO - Early stopping at epoch 550. Best Metrics: (0.022620358715549852, 0.0074503311258278145, 0.019517241100343915)
2026-05-23 22:41:32,303 - optuna.study.study - INFO - Trial 18 finished with values: [0.022620358715549852, 0.0074503311258278145, 0.019517241100343915] and parameters: {'n_layers': 2, 'embedding_dim': 256, 'lr': 0.0019170109114511021, 'lambda_val': 1.3393164785794325e-06, 'batch_size': 2206, 'optimizer': 'Adam'}.
2026-05-23 22:41:39,703 - experiment_functions - INFO - Early stopping at epoch 500. Best Metrics: (0.0033087024561272976, 0.0029966887417218545, 0.003486845906219298)
2026-05-23 22:41:40,659 - optuna.study.study - INFO - Trial 19 finished with values: [0.0033087024561272976, 0.0029966887417218545, 0.003486845906219298] and parameters: {'n_layers': 3, 'embedding_dim': 96, 'lr': 0.05429523235317306, 'lambda_val': 0.004296073447935354, 'batch_size': 546, 'optimizer': 'Adam'}.
2026-05-23 22:41:53,389 - experiment_functions - INFO - Early stopping at epoch 1100. Best Metrics: (0.005242917128938827, 0.004188741721854306, 0.005432187901421695)
2026-05-23 22:41:53,486 - optuna.study.study - INFO - Trial 20 finished with values: [0.005242917128938827, 0.004188741721854306, 0.005432187901421695] and parameters: {'n_layers': 3, 'embedding_dim': 96, 'lr': 0.01581982345441151, 'lambda_val': 0.0001334774692676944, 'batch_size': 3614, 'optimizer': 'SGD'}.
2026-05-23 22:41:59,534 - experiment_functions - INFO - Early stopping at epoch 500. Best Metrics: (0.004947687131556337, 0.004155629139072848, 0.005213449890283248)
2026-05-23 22:42:00,487 - optuna.study.study - INFO - Trial 21 finished with values: [0.004947687131556337, 0.004155629139072848, 0.005213449890283248] and parameters: {'n_layers': 2, 'embedding_dim': 32, 'lr': 0.0005362782660361518, 'lambda_val': 4.360746018288999e-05, 'batch_size': 2780, 'optimizer': 'SGD'}.
2026-05-23 22:42:08,150 - experiment_functions - INFO - Early stopping at epoch 550. Best Metrics: (0.018990415199803563, 0.00716887417218543, 0.01605881487610806)
2026-05-23 22:42:08,250 - optuna.study.study - INFO - Trial 22 finished with values: [0.018990415199803563, 0.00716887417218543, 0.01605881487610806] and parameters: {'n_layers': 4, 'embedding_dim': 256, 'lr': 0.001590270509010797, 'lambda_val': 4.246058277909158e-05, 'batch_size': 892, 'optimizer': 'Adam'}.
2026-05-23 22:42:14,280 - experiment_functions - INFO - Early stopping at epoch 500. Best Metrics: (0.00502830911103467, 0.004213576158940397, 0.005217980730801302)
2026-05-23 22:42:15,079 - optuna.study.study - INFO - Trial 23 finished with values: [0.00502830911103467, 0.004213576158940397, 0.005217980730801302] and parameters: {'n_layers': 2, 'embedding_dim': 64, 'lr': 1.217474007786209e-05, 'lambda_val': 0.0026752935915736586, 'batch_size': 1512, 'optimizer': 'Adam'}.
2026-05-23 22:42:21,319 - experiment_functions - INFO - Early stopping at epoch 500. Best Metrics: (0.005766742744547538, 0.004478476821192053, 0.005770055920557341)
2026-05-23 22:42:21,548 - optuna.study.study - INFO - Trial 24 finished with values: [0.005766742744547538, 0.004478476821192053, 0.005770055920557341] and parameters: {'n_layers': 3, 'embedding_dim': 32, 'lr': 0.008354753231709864, 'lambda_val': 2.9338354415205326e-06, 'batch_size': 2967, 'optimizer': 'SGD'}.
2026-05-23 22:42:37,436 - experiment_functions - INFO - Early stopping at epoch 1200. Best Metrics: (0.00554246781299557, 0.004246688741721854, 0.005455643088066044)
2026-05-23 22:42:38,171 - optuna.study.study - INFO - Trial 25 finished with values: [0.00554246781299557, 0.004246688741721854, 0.005455643088066044] and parameters: {'n_layers': 4, 'embedding_dim': 256, 'lr': 0.008789854846090673, 'lambda_val': 3.7036535224143254e-05, 'batch_size': 3639, 'optimizer': 'SGD'}.
2026-05-23 22:42:44,961 - experiment_functions - INFO - Early stopping at epoch 550. Best Metrics: (0.005556067899754763, 0.004362582781456954, 0.0056325662400458325)
2026-05-23 22:42:45,066 - optuna.study.study - INFO - Trial 26 finished with values: [0.005556067899754763, 0.004362582781456954, 0.0056325662400458325] and parameters: {'n_layers': 4, 'embedding_dim': 64, 'lr': 0.031263547598557595, 'lambda_val': 0.002609393831973727, 'batch_size': 1588, 'optimizer': 'SGD'}.
2026-05-23 22:42:51,510 - experiment_functions - INFO - Early stopping at epoch 500. Best Metrics: (0.005561765448101764, 0.004304635761589404, 0.005401821010114634)
2026-05-23 22:42:51,683 - optuna.study.study - INFO - Trial 27 finished with values: [0.005561765448101764, 0.004304635761589404, 0.005401821010114634] and parameters: {'n_layers': 4, 'embedding_dim': 96, 'lr': 2.898730974585673e-05, 'lambda_val': 0.02353570435123328, 'batch_size': 2112, 'optimizer': 'Adam'}.
2026-05-23 22:42:57,667 - experiment_functions - INFO - Early stopping at epoch 500. Best Metrics: (0.005777764100038307, 0.004544701986754967, 0.00589340328959697)
2026-05-23 22:42:58,667 - optuna.study.study - INFO - Trial 28 finished with values: [0.005777764100038307, 0.004544701986754967, 0.00589340328959697] and parameters: {'n_layers': 1, 'embedding_dim': 32, 'lr': 2.0206487716403182e-05, 'lambda_val': 0.0005555158504685463, 'batch_size': 1679, 'optimizer': 'SGD'}.
2026-05-23 22:43:05,183 - experiment_functions - INFO - Early stopping at epoch 500. Best Metrics: (0.005363972545933666, 0.00423841059602649, 0.005524823140885187)
2026-05-23 22:43:05,660 - optuna.study.study - INFO - Trial 29 finished with values: [0.005363972545933666, 0.00423841059602649, 0.005524823140885187] and parameters: {'n_layers': 2, 'embedding_dim': 128, 'lr': 0.013517578055493836, 'lambda_val': 1.0541423477399953e-06, 'batch_size': 3715, 'optimizer': 'Adam'}.
2026-05-23 22:43:11,542 - experiment_functions - INFO - Early stopping at epoch 500. Best Metrics: (0.005037747206238032, 0.004221854304635762, 0.005350636266969226)
2026-05-23 22:43:12,102 - optuna.study.study - INFO - Trial 30 finished with values: [0.005037747206238032, 0.004221854304635762, 0.005350636266969226] and parameters: {'n_layers': 1, 'embedding_dim': 64, 'lr': 6.370763283366987e-05, 'lambda_val': 0.0002455422693087012, 'batch_size': 2389, 'optimizer': 'SGD'}.
2026-05-23 22:43:21,100 - experiment_functions - INFO - Early stopping at epoch 750. Best Metrics: (0.01678950968087164, 0.006216887417218543, 0.014818543774865115)
