2026-05-23 22:43:21,220 - optuna.study.study - INFO - Trial 31 finished with values: [0.01678950968087164, 0.006216887417218543, 0.014818543774865115] and parameters: {'n_layers': 2, 'embedding_dim': 96, 'lr': 0.00038723708173308733, 'lambda_val': 0.00044072476163491587, 'batch_size': 3226, 'optimizer': 'Adam'}.
2026-05-23 22:43:27,496 - experiment_functions - INFO - Early stopping at epoch 500. Best Metrics: (0.00885196239554106, 0.004288079470198676, 0.007765812176930871)
2026-05-23 22:43:28,132 - optuna.study.study - INFO - Trial 32 finished with values: [0.00885196239554106, 0.004288079470198676, 0.007765812176930871] and parameters: {'n_layers': 4, 'embedding_dim': 64, 'lr': 0.08811140126222361, 'lambda_val': 1.1001198490233584e-06, 'batch_size': 1063, 'optimizer': 'RMSprop'}.
2026-05-23 22:43:35,185 - experiment_functions - INFO - Early stopping at epoch 600. Best Metrics: (0.011686032597643317, 0.005024834437086093, 0.008255086493671786)
2026-05-23 22:43:35,281 - optuna.study.study - INFO - Trial 33 finished with values: [0.011686032597643317, 0.005024834437086093, 0.008255086493671786] and parameters: {'n_layers': 2, 'embedding_dim': 32, 'lr': 0.0009470868010327422, 'lambda_val': 0.014733197162368416, 'batch_size': 1956, 'optimizer': 'Adam'}.
2026-05-23 22:43:41,324 - experiment_functions - INFO - Early stopping at epoch 500. Best Metrics: (0.0050297031259542825, 0.004428807947019868, 0.005478983687094565)
2026-05-23 22:43:42,883 - optuna.study.study - INFO - Trial 34 finished with values: [0.0050297031259542825, 0.004428807947019868, 0.005478983687094565] and parameters: {'n_layers': 1, 'embedding_dim': 96, 'lr': 1.0548028831938686e-05, 'lambda_val': 0.006936393547945635, 'batch_size': 1272, 'optimizer': 'RMSprop'}.
2026-05-23 22:43:51,961 - experiment_functions - INFO - Early stopping at epoch 600. Best Metrics: (0.007899356334680223, 0.004677152317880795, 0.006682221014408714)
2026-05-23 22:43:52,557 - optuna.study.study - INFO - Trial 35 finished with values: [0.007899356334680223, 0.004677152317880795, 0.006682221014408714] and parameters: {'n_layers': 4, 'embedding_dim': 96, 'lr': 0.0008027493612510268, 'lambda_val': 1.285583991555478e-05, 'batch_size': 2617, 'optimizer': 'Adam'}.
2026-05-23 22:43:58,838 - experiment_functions - INFO - Early stopping at epoch 500. Best Metrics: (0.005045405963271488, 0.004130794701986755, 0.005231315766614775)
2026-05-23 22:43:59,430 - optuna.study.study - INFO - Trial 36 finished with values: [0.005045405963271488, 0.004130794701986755, 0.005231315766614775] and parameters: {'n_layers': 2, 'embedding_dim': 64, 'lr': 4.30539597682301e-05, 'lambda_val': 0.05048466549164941, 'batch_size': 2960, 'optimizer': 'Adam'}.
2026-05-23 22:44:06,722 - experiment_functions - INFO - Early stopping at epoch 500. Best Metrics: (0.004792226819992892, 0.004039735099337748, 0.004904025431202203)
2026-05-23 22:44:06,866 - optuna.study.study - INFO - Trial 37 finished with values: [0.004792226819992892, 0.004039735099337748, 0.004904025431202203] and parameters: {'n_layers': 4, 'embedding_dim': 256, 'lr': 1.1936420848564821e-05, 'lambda_val': 1.1124735762207802e-06, 'batch_size': 2775, 'optimizer': 'SGD'}.
2026-05-23 22:44:13,576 - experiment_functions - INFO - Early stopping at epoch 500. Best Metrics: (0.005246105931860683, 0.003791390728476821, 0.004985081385082855)
2026-05-23 22:44:13,678 - optuna.study.study - INFO - Trial 38 finished with values: [0.005246105931860683, 0.003791390728476821, 0.004985081385082855] and parameters: {'n_layers': 4, 'embedding_dim': 96, 'lr': 0.003251693936645563, 'lambda_val': 0.0001484816386935872, 'batch_size': 3933, 'optimizer': 'RMSprop'}.
2026-05-23 22:44:21,147 - experiment_functions - INFO - Early stopping at epoch 600. Best Metrics: (0.02300892211877986, 0.008137417218543046, 0.020578401542511105)
2026-05-23 22:44:21,243 - optuna.study.study - INFO - Trial 39 finished with values: [0.02300892211877986, 0.008137417218543046, 0.020578401542511105] and parameters: {'n_layers': 2, 'embedding_dim': 256, 'lr': 0.0009299462051840892, 'lambda_val': 2.829964802645351e-06, 'batch_size': 1477, 'optimizer': 'Adam'}.
2026-05-23 22:44:27,924 - experiment_functions - INFO - Early stopping at epoch 500. Best Metrics: (0.0046133264865524095, 0.004097682119205298, 0.004929516846671127)
2026-05-23 22:44:28,404 - optuna.study.study - INFO - Trial 40 finished with values: [0.0046133264865524095, 0.004097682119205298, 0.004929516846671127] and parameters: {'n_layers': 2, 'embedding_dim': 32, 'lr': 0.018712705706642373, 'lambda_val': 8.524276360668784e-06, 'batch_size': 879, 'optimizer': 'Adam'}.
2026-05-23 22:44:36,024 - experiment_functions - INFO - Early stopping at epoch 600. Best Metrics: (0.0061919721738361135, 0.004105960264900663, 0.00594397432419007)
2026-05-23 22:44:36,122 - optuna.study.study - INFO - Trial 41 finished with values: [0.0061919721738361135, 0.004105960264900663, 0.00594397432419007] and parameters: {'n_layers': 4, 'embedding_dim': 64, 'lr': 0.0008320593312347377, 'lambda_val': 0.002482166316964702, 'batch_size': 2926, 'optimizer': 'Adam'}.
2026-05-23 22:44:43,291 - experiment_functions - INFO - Early stopping at epoch 600. Best Metrics: (0.014651033908956902, 0.005612582781456954, 0.013103267454183758)
2026-05-23 22:44:43,405 - optuna.study.study - INFO - Trial 42 finished with values: [0.014651033908956902, 0.005612582781456954, 0.013103267454183758] and parameters: {'n_layers': 2, 'embedding_dim': 64, 'lr': 0.0012665424339139031, 'lambda_val': 1.6221161102260363e-05, 'batch_size': 2840, 'optimizer': 'Adam'}.
2026-05-23 22:44:49,431 - experiment_functions - INFO - Early stopping at epoch 500. Best Metrics: (0.005557667648064167, 0.004428807947019868, 0.0054822044843265754)
2026-05-23 22:44:49,614 - optuna.study.study - INFO - Trial 43 finished with values: [0.005557667648064167, 0.004428807947019868, 0.0054822044843265754] and parameters: {'n_layers': 1, 'embedding_dim': 128, 'lr': 0.02669007517170644, 'lambda_val': 0.09877223556381347, 'batch_size': 2725, 'optimizer': 'Adam'}.
2026-05-23 22:44:56,248 - experiment_functions - INFO - Early stopping at epoch 500. Best Metrics: (0.005241282468074927, 0.004172185430463576, 0.0054127818144270685)
2026-05-23 22:44:56,464 - optuna.study.study - INFO - Trial 44 finished with values: [0.005241282468074927, 0.004172185430463576, 0.0054127818144270685] and parameters: {'n_layers': 4, 'embedding_dim': 128, 'lr': 1.0285526776008262e-05, 'lambda_val': 5.118760260631495e-06, 'batch_size': 3125, 'optimizer': 'RMSprop'}.
2026-05-23 22:45:38,644 - optuna.study.study - INFO - Trial 45 finished with values: [0.012689616275748545, 0.005347682119205298, 0.009961753432632774] and parameters: {'n_layers': 2, 'embedding_dim': 32, 'lr': 0.00011705745989056773, 'lambda_val': 5.293319521753168e-06, 'batch_size': 2988, 'optimizer': 'RMSprop'}.
2026-05-23 22:45:46,906 - experiment_functions - INFO - Early stopping at epoch 650. Best Metrics: (0.005114661727595767, 0.00423841059602649, 0.005344583884963598)
2026-05-23 22:45:47,009 - optuna.study.study - INFO - Trial 46 finished with values: [0.005114661727595767, 0.00423841059602649, 0.005344583884963598] and parameters: {'n_layers': 4, 'embedding_dim': 96, 'lr': 1.073317556116755e-05, 'lambda_val': 0.017194844806607924, 'batch_size': 3120, 'optimizer': 'RMSprop'}.
2026-05-23 22:45:53,981 - experiment_functions - INFO - Early stopping at epoch 550. Best Metrics: (0.021374704894781046, 0.007475165562913908, 0.018316846661249907)
2026-05-23 22:45:54,136 - optuna.study.study - INFO - Trial 47 finished with values: [0.021374704894781046, 0.007475165562913908, 0.018316846661249907] and parameters: {'n_layers': 2, 'embedding_dim': 256, 'lr': 0.0007742554383218026, 'lambda_val': 3.136622296234252e-05, 'batch_size': 1661, 'optimizer': 'RMSprop'}.
2026-05-23 22:46:04,610 - experiment_functions - INFO - Early stopping at epoch 750. Best Metrics: (0.008232320577927893, 0.004478476821192054, 0.0073002345055200105)
2026-05-23 22:46:04,835 - optuna.study.study - INFO - Trial 48 finished with values: [0.008232320577927893, 0.004478476821192054, 0.0073002345055200105] and parameters: {'n_layers': 4, 'embedding_dim': 256, 'lr': 0.00021389999053293392, 'lambda_val': 0.0002398720988447927, 'batch_size': 3892, 'optimizer': 'Adam'}.
2026-05-23 22:46:11,512 - experiment_functions - INFO - Early stopping at epoch 500. Best Metrics: (0.0034199345789834527, 0.0032119205298013244, 0.003707877511199769)
2026-05-23 22:46:12,381 - optuna.study.study - INFO - Trial 49 finished with values: [0.0034199345789834527, 0.0032119205298013244, 0.003707877511199769] and parameters: {'n_layers': 3, 'embedding_dim': 128, 'lr': 0.004695188770808373, 'lambda_val': 0.0028639996941338948, 'batch_size': 2117, 'optimizer': 'RMSprop'}.
2026-05-23 22:46:18,427 - experiment_functions - INFO - Early stopping at epoch 500. Best Metrics: (0.004816426485606775, 0.004221854304635762, 0.00514274387467474)
2026-05-23 22:46:19,297 - optuna.study.study - INFO - Trial 50 finished with values: [0.004816426485606775, 0.004221854304635762, 0.00514274387467474] and parameters: {'n_layers': 1, 'embedding_dim': 32, 'lr': 1.0285526776008262e-05, 'lambda_val': 0.05571593658045694, 'batch_size': 755, 'optimizer': 'SGD'}.
2026-05-23 22:46:25,415 - experiment_functions - INFO - Early stopping at epoch 500. Best Metrics: (0.0053675847761088065, 0.003990066225165563, 0.005102604718809801)
2026-05-23 22:46:25,977 - optuna.study.study - INFO - Trial 51 finished with values: [0.0053675847761088065, 0.003990066225165563, 0.005102604718809801] and parameters: {'n_layers': 1, 'embedding_dim': 256, 'lr': 0.005734546203876695, 'lambda_val': 0.019425586100194146, 'batch_size': 1550, 'optimizer': 'Adam'}.
2026-05-23 22:46:33,116 - experiment_functions - INFO - Early stopping at epoch 550. Best Metrics: (0.00480316817731165, 0.003973509933774834, 0.00503015768466891)
2026-05-23 22:46:33,214 - optuna.study.study - INFO - Trial 52 finished with values: [0.00480316817731165, 0.003973509933774834, 0.00503015768466891] and parameters: {'n_layers': 3, 'embedding_dim': 128, 'lr': 2.898730974585673e-05, 'lambda_val': 0.02353570435123328, 'batch_size': 2112, 'optimizer': 'Adam'}.
2026-05-23 22:46:39,323 - experiment_functions - INFO - Early stopping at epoch 500. Best Metrics: (0.0050257626257251935, 0.004089403973509934, 0.0049020864977532075)
2026-05-23 22:46:39,706 - optuna.study.study - INFO - Trial 53 finished with values: [0.0050257626257251935, 0.004089403973509934, 0.0049020864977532075] and parameters: {'n_layers': 3, 'embedding_dim': 32, 'lr': 0.00015581909929389577, 'lambda_val': 0.0009823832479733342, 'batch_size': 1477, 'optimizer': 'SGD'}.
2026-05-23 22:46:46,207 - experiment_functions - INFO - Early stopping at epoch 500. Best Metrics: (0.0037285792338056967, 0.0029304635761589408, 0.003594824406361085)
2026-05-23 22:46:46,863 - optuna.study.study - INFO - Trial 54 finished with values: [0.0037285792338056967, 0.0029304635761589408, 0.003594824406361085] and parameters: {'n_layers': 4, 'embedding_dim': 96, 'lr': 0.05747482424274449, 'lambda_val': 0.001123689218572125, 'batch_size': 1061, 'optimizer': 'Adam'}.
2026-05-23 22:46:55,682 - experiment_functions - INFO - Early stopping at epoch 700. Best Metrics: (0.013872330984753708, 0.005976821192052981, 0.012786918406316551)
2026-05-23 22:46:56,363 - optuna.study.study - INFO - Trial 55 finished with values: [0.013872330984753708, 0.005976821192052981, 0.012786918406316551] and parameters: {'n_layers': 4, 'embedding_dim': 128, 'lr': 0.0004485392810298456, 'lambda_val': 1.7439980348390471e-06, 'batch_size': 1061, 'optimizer': 'Adam'}.
2026-05-23 22:47:18,216 - experiment_functions - INFO - Early stopping at epoch 2050. Best Metrics: (0.014405154556648496, 0.005836092715231788, 0.014177489473592758)
2026-05-23 22:47:18,663 - optuna.study.study - INFO - Trial 56 finished with values: [0.014405154556648496, 0.005836092715231788, 0.014177489473592758] and parameters: {'n_layers': 4, 'embedding_dim': 32, 'lr': 0.00030067783612531895, 'lambda_val': 0.00031335292673571056, 'batch_size': 627, 'optimizer': 'Adam'}.
2026-05-23 22:47:24,810 - experiment_functions - INFO - Early stopping at epoch 500. Best Metrics: (0.004366262161791944, 0.0029966887417218545, 0.004019230866995789)
2026-05-23 22:47:25,442 - optuna.study.study - INFO - Trial 57 finished with values: [0.004366262161791944, 0.0029966887417218545, 0.004019230866995789] and parameters: {'n_layers': 3, 'embedding_dim': 64, 'lr': 0.031263547598557595, 'lambda_val': 0.002609393831973727, 'batch_size': 1588, 'optimizer': 'RMSprop'}.
2026-05-23 22:47:31,971 - experiment_functions - INFO - Early stopping at epoch 500. Best Metrics: (0.005380521405120492, 0.004197019867549669, 0.00552297734495976)
2026-05-23 22:47:32,344 - optuna.study.study - INFO - Trial 58 finished with values: [0.005380521405120492, 0.004197019867549669, 0.00552297734495976] and parameters: {'n_layers': 4, 'embedding_dim': 64, 'lr': 0.0008320593312347377, 'lambda_val': 3.7036535224143254e-05, 'batch_size': 2926, 'optimizer': 'SGD'}.
2026-05-23 22:47:40,040 - experiment_functions - INFO - Early stopping at epoch 600. Best Metrics: (0.025969109691308275, 0.008716887417218542, 0.023219897552790844)
2026-05-23 22:47:40,229 - optuna.study.study - INFO - Trial 59 finished with values: [0.025969109691308275, 0.008716887417218542, 0.023219897552790844] and parameters: {'n_layers': 2, 'embedding_dim': 256, 'lr': 0.0009299462051840892, 'lambda_val': 2.430474765536691e-05, 'batch_size': 603, 'optimizer': 'Adam'}.
2026-05-23 22:47:47,245 - experiment_functions - INFO - Early stopping at epoch 500. Best Metrics: (0.004930703973982947, 0.0036672185430463573, 0.004730084580045905)
2026-05-23 22:47:47,338 - optuna.study.study - INFO - Trial 60 finished with values: [0.004930703973982947, 0.0036672185430463573, 0.004730084580045905] and parameters: {'n_layers': 4, 'embedding_dim': 256, 'lr': 0.034931521611405704, 'lambda_val': 0.0024437548491881645, 'batch_size': 4052, 'optimizer': 'Adam'}.
2026-05-23 22:47:56,376 - experiment_functions - INFO - Early stopping at epoch 800. Best Metrics: (0.0047953127012322575, 0.004346026490066225, 0.0053212820907179775)
2026-05-23 22:47:57,178 - optuna.study.study - INFO - Trial 61 finished with values: [0.0047953127012322575, 0.004346026490066225, 0.0053212820907179775] and parameters: {'n_layers': 2, 'embedding_dim': 128, 'lr': 0.013517578055493836, 'lambda_val': 0.00021421331428694737, 'batch_size': 710, 'optimizer': 'SGD'}.
2026-05-23 22:48:44,058 - optuna.study.study - INFO - Trial 62 finished with values: [0.011042852314745225, 0.005405629139072847, 0.00997567962463492] and parameters: {'n_layers': 4, 'embedding_dim': 128, 'lr': 0.00011132803279953378, 'lambda_val': 3.4048438452983103e-06, 'batch_size': 3705, 'optimizer': 'Adam'}.
2026-05-23 22:48:50,387 - experiment_functions - INFO - Early stopping at epoch 500. Best Metrics: (0.005095086076539061, 0.00429635761589404, 0.0053563248745253835)
2026-05-23 22:48:50,486 - optuna.study.study - INFO - Trial 63 finished with values: [0.005095086076539061, 0.00429635761589404, 0.0053563248745253835] and parameters: {'n_layers': 4, 'embedding_dim': 96, 'lr': 0.05747482424274449, 'lambda_val': 0.0018464106432939337, 'batch_size': 1061, 'optimizer': 'SGD'}.
2026-05-23 22:48:58,056 - experiment_functions - INFO - Early stopping at epoch 550. Best Metrics: (0.012568192528184629, 0.005480132450331126, 0.009558799526734921)
2026-05-23 22:48:58,160 - optuna.study.study - INFO - Trial 64 finished with values: [0.012568192528184629, 0.005480132450331126, 0.009558799526734921] and parameters: {'n_layers': 4, 'embedding_dim': 256, 'lr': 0.001590270509010797, 'lambda_val': 0.0028639996941338948, 'batch_size': 892, 'optimizer': 'Adam'}.
2026-05-23 22:49:05,625 - experiment_functions - INFO - Early stopping at epoch 600. Best Metrics: (0.020079451808712855, 0.007218543046357617, 0.016755472614839586)
2026-05-23 22:49:05,951 - optuna.study.study - INFO - Trial 65 finished with values: [0.020079451808712855, 0.007218543046357617, 0.016755472614839586] and parameters: {'n_layers': 2, 'embedding_dim': 128, 'lr': 0.0007742554383218026, 'lambda_val': 1.0541423477399953e-06, 'batch_size': 3715, 'optimizer': 'Adam'}.
2026-05-23 22:49:12,161 - experiment_functions - INFO - Early stopping at epoch 500. Best Metrics: (0.004964483683272786, 0.004072847682119206, 0.005056581847301123)
2026-05-23 22:49:12,555 - optuna.study.study - INFO - Trial 66 finished with values: [0.004964483683272786, 0.004072847682119206, 0.005056581847301123] and parameters: {'n_layers': 2, 'embedding_dim': 32, 'lr': 0.0009470868010327422, 'lambda_val': 0.014733197162368416, 'batch_size': 1956, 'optimizer': 'SGD'}.
2026-05-23 22:49:18,875 - experiment_functions - INFO - Early stopping at epoch 550. Best Metrics: (0.005478857275269971, 0.004006622516556292, 0.004938153959664215)
2026-05-23 22:49:18,980 - optuna.study.study - INFO - Trial 67 finished with values: [0.005478857275269971, 0.004006622516556292, 0.004938153959664215] and parameters: {'n_layers': 1, 'embedding_dim': 32, 'lr': 1.1872249776988844e-05, 'lambda_val': 1.7628989293111625e-05, 'batch_size': 1310, 'optimizer': 'RMSprop'}.
2026-05-23 22:49:38,966 - experiment_functions - INFO - Early stopping at epoch 1650. Best Metrics: (0.009528469791551095, 0.00462748344370861, 0.008006416611623945)
2026-05-23 22:49:39,253 - optuna.study.study - INFO - Trial 68 finished with values: [0.009528469791551095, 0.00462748344370861, 0.008006416611623945] and parameters: {'n_layers': 4, 'embedding_dim': 128, 'lr': 0.00011132803279953378, 'lambda_val': 9.691061665067305e-06, 'batch_size': 3705, 'optimizer': 'Adam'}.
2026-05-23 22:49:45,407 - experiment_functions - INFO - Early stopping at epoch 500. Best Metrics: (0.004756576139811107, 0.0038907284768211928, 0.004873472757226633)
2026-05-23 22:49:45,802 - optuna.study.study - INFO - Trial 69 finished with values: [0.004756576139811107, 0.0038907284768211928, 0.004873472757226633] and parameters: {'n_layers': 1, 'embedding_dim': 256, 'lr': 0.019851455685217588, 'lambda_val': 0.019425586100194146, 'batch_size': 2988, 'optimizer': 'Adam'}.
2026-05-23 22:49:53,895 - experiment_functions - INFO - Early stopping at epoch 650. Best Metrics: (0.004760871313849791, 0.004048013245033113, 0.004966881433207425)
2026-05-23 22:49:53,994 - optuna.study.study - INFO - Trial 70 finished with values: [0.004760871313849791, 0.004048013245033113, 0.004966881433207425] and parameters: {'n_layers': 2, 'embedding_dim': 256, 'lr': 0.0640007632858696, 'lambda_val': 5.21961059186824e-05, 'batch_size': 1679, 'optimizer': 'SGD'}.
2026-05-23 22:50:33,967 - optuna.study.study - INFO - Trial 71 finished with values: [0.0100407408427323, 0.005339403973509934, 0.009398886517142794] and parameters: {'n_layers': 1, 'embedding_dim': 64, 'lr': 6.370763283366987e-05, 'lambda_val': 0.00031335292673571056, 'batch_size': 627, 'optimizer': 'Adam'}.
2026-05-23 22:50:39,876 - experiment_functions - INFO - Early stopping at epoch 500. Best Metrics: (0.005102582666487681, 0.004205298013245033, 0.0053202991242076395)
2026-05-23 22:50:40,518 - optuna.study.study - INFO - Trial 72 finished with values: [0.005102582666487681, 0.004205298013245033, 0.0053202991242076395] and parameters: {'n_layers': 1, 'embedding_dim': 96, 'lr': 0.0001575404982668674, 'lambda_val': 0.017194844806607924, 'batch_size': 1550, 'optimizer': 'SGD'}.
2026-05-23 22:51:21,460 - optuna.study.study - INFO - Trial 73 finished with values: [0.02675381294911813, 0.008650662251655629, 0.023089658933555326] and parameters: {'n_layers': 1, 'embedding_dim': 32, 'lr': 0.0001575404982668674, 'lambda_val': 5.293319521753168e-06, 'batch_size': 2988, 'optimizer': 'RMSprop'}.
2026-05-23 22:51:31,372 - experiment_functions - INFO - Early stopping at epoch 850. Best Metrics: (0.0028324478290564694, 0.0033526490066225164, 0.0038647386210145566)
2026-05-23 22:51:31,683 - optuna.study.study - INFO - Trial 74 finished with values: [0.0028324478290564694, 0.0033526490066225164, 0.0038647386210145566] and parameters: {'n_layers': 2, 'embedding_dim': 96, 'lr': 0.0640007632858696, 'lambda_val': 0.07368395535086049, 'batch_size': 2947, 'optimizer': 'RMSprop'}.
2026-05-23 22:51:38,010 - experiment_functions - INFO - Early stopping at epoch 550. Best Metrics: (0.01490963725173063, 0.005993377483443709, 0.011586695648582303)
2026-05-23 22:51:38,597 - optuna.study.study - INFO - Trial 75 finished with values: [0.01490963725173063, 0.005993377483443709, 0.011586695648582303] and parameters: {'n_layers': 2, 'embedding_dim': 32, 'lr': 0.003241752579826309, 'lambda_val': 2.430474765536691e-05, 'batch_size': 4052, 'optimizer': 'Adam'}.
2026-05-23 22:51:44,909 - experiment_functions - INFO - Early stopping at epoch 500. Best Metrics: (0.005082198487720467, 0.004064569536423841, 0.004783742000903031)
2026-05-23 22:51:46,231 - optuna.study.study - INFO - Trial 76 finished with values: [0.005082198487720467, 0.004064569536423841, 0.004783742000903031] and parameters: {'n_layers': 1, 'embedding_dim': 32, 'lr': 9.502880593229394e-05, 'lambda_val': 0.005073968734879946, 'batch_size': 2840, 'optimizer': 'Adam'}.
2026-05-23 22:51:55,138 - experiment_functions - INFO - Early stopping at epoch 750. Best Metrics: (0.00785435076406892, 0.004586092715231789, 0.007575218679091744)
2026-05-23 22:51:55,230 - optuna.study.study - INFO - Trial 77 finished with values: [0.00785435076406892, 0.004586092715231789, 0.007575218679091744] and parameters: {'n_layers': 4, 'embedding_dim': 32, 'lr': 0.0005362782660361518, 'lambda_val': 4.360746018288999e-05, 'batch_size': 2926, 'optimizer': 'Adam'}.
2026-05-23 22:52:01,455 - experiment_functions - INFO - Early stopping at epoch 500. Best Metrics: (0.007822628642625805, 0.004155629139072848, 0.0066227204302797184)
