2026-05-24 11:43:23,233 - optuna.study.study - INFO - Trial 169 finished with values: [0.024043322482864993, 0.01593543046357616, 0.022136205352861784] and parameters: {'n_layers': 2, 'embedding_dim': 32, 'lr': 0.010447806471040641, 'lambda_val': 6.229045175154034e-06, 'batch_size': 1246, 'optimizer': 'RMSprop'}.
2026-05-24 11:44:04,613 - experiment_functions - INFO - Early stopping at epoch 3850. Best Metrics: (0.026198921475603123, 0.017276490066225166, 0.02368722034854508)
2026-05-24 11:44:05,606 - optuna.study.study - INFO - Trial 170 finished with values: [0.026198921475603123, 0.017276490066225166, 0.02368722034854508] and parameters: {'n_layers': 2, 'embedding_dim': 64, 'lr': 0.004627149516425897, 'lambda_val': 0.00013181376661387483, 'batch_size': 2105, 'optimizer': 'RMSprop'}.
2026-05-24 11:44:16,105 - experiment_functions - INFO - Early stopping at epoch 750. Best Metrics: (0.03997477271340703, 0.025951986754966887, 0.036010129489313945)
2026-05-24 11:44:16,810 - optuna.study.study - INFO - Trial 171 finished with values: [0.03997477271340703, 0.025951986754966887, 0.036010129489313945] and parameters: {'n_layers': 3, 'embedding_dim': 128, 'lr': 0.0005493990269458161, 'lambda_val': 2.6144777923546295e-05, 'batch_size': 775, 'optimizer': 'RMSprop'}.
2026-05-24 11:44:24,429 - experiment_functions - INFO - Early stopping at epoch 600. Best Metrics: (0.041730176998169534, 0.028211920529801326, 0.03822435276763865)
2026-05-24 11:44:24,973 - optuna.study.study - INFO - Trial 172 finished with values: [0.041730176998169534, 0.028211920529801326, 0.03822435276763865] and parameters: {'n_layers': 1, 'embedding_dim': 128, 'lr': 0.002147597357064978, 'lambda_val': 0.0001303671050452136, 'batch_size': 775, 'optimizer': 'RMSprop'}.
2026-05-24 11:44:35,255 - experiment_functions - INFO - Early stopping at epoch 850. Best Metrics: (0.04741059519670777, 0.029610927152317876, 0.04395419311784319)
2026-05-24 11:44:35,373 - optuna.study.study - INFO - Trial 173 finished with values: [0.04741059519670777, 0.029610927152317876, 0.04395419311784319] and parameters: {'n_layers': 2, 'embedding_dim': 64, 'lr': 0.0005910069120800205, 'lambda_val': 0.00024416758921277655, 'batch_size': 1427, 'optimizer': 'RMSprop'}.
2026-05-24 11:45:40,465 - optuna.study.study - INFO - Trial 174 finished with values: [0.04077420284261642, 0.026473509933774834, 0.03779350683541365] and parameters: {'n_layers': 4, 'embedding_dim': 256, 'lr': 9.72729409185319e-05, 'lambda_val': 4.598956818766828e-05, 'batch_size': 944, 'optimizer': 'Adam'}.
2026-05-24 11:45:51,050 - experiment_functions - INFO - Early stopping at epoch 700. Best Metrics: (0.04212669323266387, 0.027980132450331124, 0.03917199156549898)
2026-05-24 11:45:51,877 - optuna.study.study - INFO - Trial 175 finished with values: [0.04212669323266387, 0.027980132450331124, 0.03917199156549898] and parameters: {'n_layers': 2, 'embedding_dim': 256, 'lr': 0.0004379727673244972, 'lambda_val': 2.666704909740151e-06, 'batch_size': 3482, 'optimizer': 'RMSprop'}.
2026-05-24 11:45:59,311 - experiment_functions - INFO - Early stopping at epoch 550. Best Metrics: (0.044690368695946316, 0.029246688741721854, 0.03981175896652551)
2026-05-24 11:46:01,037 - optuna.study.study - INFO - Trial 176 finished with values: [0.044690368695946316, 0.029246688741721854, 0.03981175896652551] and parameters: {'n_layers': 2, 'embedding_dim': 64, 'lr': 0.004627149516425897, 'lambda_val': 0.01723991176853604, 'batch_size': 3483, 'optimizer': 'Adam'}.
2026-05-24 11:46:08,159 - experiment_functions - INFO - Early stopping at epoch 550. Best Metrics: (0.04887059585621297, 0.030165562913907283, 0.042834047929470584)
2026-05-24 11:46:08,259 - optuna.study.study - INFO - Trial 177 finished with values: [0.04887059585621297, 0.030165562913907283, 0.042834047929470584] and parameters: {'n_layers': 1, 'embedding_dim': 64, 'lr': 0.007734430860530913, 'lambda_val': 0.01723991176853604, 'batch_size': 1036, 'optimizer': 'Adam'}.
2026-05-24 11:46:17,919 - experiment_functions - INFO - Early stopping at epoch 650. Best Metrics: (0.05096384849958579, 0.03190397350993378, 0.04578862392097252)
2026-05-24 11:46:19,458 - optuna.study.study - INFO - Trial 178 finished with values: [0.05096384849958579, 0.03190397350993378, 0.04578862392097252] and parameters: {'n_layers': 2, 'embedding_dim': 256, 'lr': 0.0012566980437762067, 'lambda_val': 6.178887787950895e-06, 'batch_size': 2294, 'optimizer': 'Adam'}.
2026-05-24 11:46:25,836 - experiment_functions - INFO - Early stopping at epoch 550. Best Metrics: (0.04421477900073862, 0.02913079470198675, 0.040118226152420354)
2026-05-24 11:46:25,936 - optuna.study.study - INFO - Trial 179 finished with values: [0.04421477900073862, 0.02913079470198675, 0.040118226152420354] and parameters: {'n_layers': 1, 'embedding_dim': 32, 'lr': 0.002147597357064978, 'lambda_val': 0.036128186387526025, 'batch_size': 2447, 'optimizer': 'RMSprop'}.
2026-05-24 11:46:32,047 - experiment_functions - INFO - Early stopping at epoch 500. Best Metrics: (0.004723739015740817, 0.004122516556291391, 0.005159120735350869)
2026-05-24 11:46:33,295 - optuna.study.study - INFO - Trial 180 finished with values: [0.004723739015740817, 0.004122516556291391, 0.005159120735350869] and parameters: {'n_layers': 2, 'embedding_dim': 64, 'lr': 0.00018773198932182955, 'lambda_val': 6.229045175154034e-06, 'batch_size': 2105, 'optimizer': 'SGD'}.
2026-05-24 11:47:27,287 - optuna.study.study - INFO - Trial 181 finished with values: [0.031992603597823834, 0.0228476821192053, 0.031368796348112384] and parameters: {'n_layers': 4, 'embedding_dim': 128, 'lr': 9.72729409185319e-05, 'lambda_val': 4.598956818766828e-05, 'batch_size': 3332, 'optimizer': 'RMSprop'}.
2026-05-24 11:48:18,215 - optuna.study.study - INFO - Trial 182 finished with values: [0.022254630370791794, 0.013087748344370863, 0.01926733111934906] and parameters: {'n_layers': 4, 'embedding_dim': 96, 'lr': 0.007734430860530913, 'lambda_val': 8.876623948407677e-06, 'batch_size': 2105, 'optimizer': 'Adam'}.
2026-05-24 11:48:25,973 - experiment_functions - INFO - Early stopping at epoch 550. Best Metrics: (0.04585669383694312, 0.029776490066225163, 0.04166200677337672)
2026-05-24 11:48:26,064 - optuna.study.study - INFO - Trial 183 finished with values: [0.04585669383694312, 0.029776490066225163, 0.04166200677337672] and parameters: {'n_layers': 1, 'embedding_dim': 256, 'lr': 0.002147597357064978, 'lambda_val': 0.0001303671050452136, 'batch_size': 1926, 'optimizer': 'RMSprop'}.
2026-05-24 11:48:35,202 - experiment_functions - INFO - Early stopping at epoch 600. Best Metrics: (0.03979018158685516, 0.025074503311258278, 0.034763777957562164)
2026-05-24 11:48:35,789 - optuna.study.study - INFO - Trial 184 finished with values: [0.03979018158685516, 0.025074503311258278, 0.034763777957562164] and parameters: {'n_layers': 4, 'embedding_dim': 128, 'lr': 0.0005910069120800205, 'lambda_val': 0.00021158087063845118, 'batch_size': 775, 'optimizer': 'RMSprop'}.
2026-05-24 11:48:45,784 - experiment_functions - INFO - Early stopping at epoch 700. Best Metrics: (0.0417512889901193, 0.0270612582781457, 0.03804270689271998)
2026-05-24 11:48:45,921 - optuna.study.study - INFO - Trial 185 finished with values: [0.0417512889901193, 0.0270612582781457, 0.03804270689271998] and parameters: {'n_layers': 3, 'embedding_dim': 128, 'lr': 0.0005493990269458161, 'lambda_val': 3.075785895847098e-05, 'batch_size': 775, 'optimizer': 'RMSprop'}.
2026-05-24 11:48:59,641 - experiment_functions - INFO - Early stopping at epoch 1150. Best Metrics: (0.056712973032516836, 0.033816225165562916, 0.04877795542618564)
2026-05-24 11:48:59,787 - optuna.study.study - INFO - Trial 186 finished with values: [0.056712973032516836, 0.033816225165562916, 0.04877795542618564] and parameters: {'n_layers': 2, 'embedding_dim': 64, 'lr': 0.0005910069120800205, 'lambda_val': 8.876623948407677e-06, 'batch_size': 775, 'optimizer': 'Adam'}.
2026-05-24 11:49:40,439 - optuna.study.study - INFO - Trial 187 finished with values: [0.032865047438105956, 0.022682119205298012, 0.031110967628434988] and parameters: {'n_layers': 2, 'embedding_dim': 32, 'lr': 0.00018773198932182955, 'lambda_val': 0.0018912353521433405, 'batch_size': 944, 'optimizer': 'RMSprop'}.
2026-05-24 11:49:55,831 - experiment_functions - INFO - Early stopping at epoch 1450. Best Metrics: (0.023072962657882713, 0.014826158940397353, 0.021025157099247394)
2026-05-24 11:49:56,075 - optuna.study.study - INFO - Trial 188 finished with values: [0.023072962657882713, 0.014826158940397353, 0.021025157099247394] and parameters: {'n_layers': 2, 'embedding_dim': 32, 'lr': 0.012865757390895844, 'lambda_val': 8.876623948407677e-06, 'batch_size': 2105, 'optimizer': 'RMSprop'}.
2026-05-24 11:50:08,679 - experiment_functions - INFO - Early stopping at epoch 1150. Best Metrics: (0.027016155856057236, 0.019519867549668876, 0.02595962883232107)
2026-05-24 11:50:08,777 - optuna.study.study - INFO - Trial 189 finished with values: [0.027016155856057236, 0.019519867549668876, 0.02595962883232107] and parameters: {'n_layers': 1, 'embedding_dim': 96, 'lr': 0.0063358656325518715, 'lambda_val': 0.00024416758921277655, 'batch_size': 2188, 'optimizer': 'RMSprop'}.
2026-05-24 11:50:16,530 - experiment_functions - INFO - Early stopping at epoch 650. Best Metrics: (0.054502218614375916, 0.032442052980132446, 0.04962713194193482)
2026-05-24 11:50:16,640 - optuna.study.study - INFO - Trial 190 finished with values: [0.054502218614375916, 0.032442052980132446, 0.04962713194193482] and parameters: {'n_layers': 2, 'embedding_dim': 32, 'lr': 0.002147597357064978, 'lambda_val': 6.229045175154034e-06, 'batch_size': 908, 'optimizer': 'Adam'}.
2026-05-24 11:50:43,033 - experiment_functions - INFO - Early stopping at epoch 2550. Best Metrics: (0.02223811973190553, 0.01824503311258278, 0.02394849898447635)
2026-05-24 11:50:43,779 - optuna.study.study - INFO - Trial 191 finished with values: [0.02223811973190553, 0.01824503311258278, 0.02394849898447635] and parameters: {'n_layers': 1, 'embedding_dim': 64, 'lr': 0.007734430860530913, 'lambda_val': 0.01723991176853604, 'batch_size': 2188, 'optimizer': 'RMSprop'}.
2026-05-24 11:50:51,464 - experiment_functions - INFO - Early stopping at epoch 550. Best Metrics: (0.050599920401352035, 0.031018211920529802, 0.04413549983977371)
2026-05-24 11:50:51,556 - optuna.study.study - INFO - Trial 192 finished with values: [0.050599920401352035, 0.031018211920529802, 0.04413549983977371] and parameters: {'n_layers': 1, 'embedding_dim': 256, 'lr': 0.0020262506885158522, 'lambda_val': 0.00024416758921277655, 'batch_size': 2188, 'optimizer': 'RMSprop'}.
2026-05-24 11:50:59,621 - experiment_functions - INFO - Early stopping at epoch 550. Best Metrics: (0.024819634490401754, 0.018998344370860926, 0.024445564486042466)
2026-05-24 11:50:59,904 - optuna.study.study - INFO - Trial 193 finished with values: [0.024819634490401754, 0.018998344370860926, 0.024445564486042466] and parameters: {'n_layers': 4, 'embedding_dim': 128, 'lr': 0.00097329403915542, 'lambda_val': 0.0001303671050452136, 'batch_size': 2361, 'optimizer': 'RMSprop'}.
2026-05-24 11:51:52,125 - optuna.study.study - INFO - Trial 194 finished with values: [0.034286334361965015, 0.023758278145695363, 0.033506870836881995] and parameters: {'n_layers': 2, 'embedding_dim': 256, 'lr': 9.72729409185319e-05, 'lambda_val': 0.00013181376661387483, 'batch_size': 3332, 'optimizer': 'RMSprop'}.
2026-05-24 11:51:59,695 - experiment_functions - INFO - Early stopping at epoch 600. Best Metrics: (0.053074300062773076, 0.032591059602649006, 0.048093099548280664)
2026-05-24 11:52:00,123 - optuna.study.study - INFO - Trial 195 finished with values: [0.053074300062773076, 0.032591059602649006, 0.048093099548280664] and parameters: {'n_layers': 1, 'embedding_dim': 128, 'lr': 0.0012566980437762067, 'lambda_val': 0.0018912353521433405, 'batch_size': 2294, 'optimizer': 'RMSprop'}.
2026-05-24 11:52:11,217 - experiment_functions - INFO - Early stopping at epoch 800. Best Metrics: (0.040628936541924225, 0.02667218543046358, 0.03630292927993983)
2026-05-24 11:52:11,304 - optuna.study.study - INFO - Trial 196 finished with values: [0.040628936541924225, 0.02667218543046358, 0.03630292927993983] and parameters: {'n_layers': 4, 'embedding_dim': 64, 'lr': 0.0005910069120800205, 'lambda_val': 7.481780308257389e-06, 'batch_size': 775, 'optimizer': 'Adam'}.
2026-05-24 11:52:23,534 - experiment_functions - INFO - Early stopping at epoch 1050. Best Metrics: (0.05337524078060942, 0.0330794701986755, 0.04636229603948313)
2026-05-24 11:52:23,625 - optuna.study.study - INFO - Trial 197 finished with values: [0.05337524078060942, 0.0330794701986755, 0.04636229603948313] and parameters: {'n_layers': 2, 'embedding_dim': 64, 'lr': 0.0005910069120800205, 'lambda_val': 0.00021158087063845118, 'batch_size': 1486, 'optimizer': 'Adam'}.
2026-05-24 11:52:30,783 - experiment_functions - INFO - Early stopping at epoch 550. Best Metrics: (0.018094263633086607, 0.014768211920529802, 0.01710810377359749)
2026-05-24 11:52:30,899 - optuna.study.study - INFO - Trial 198 finished with values: [0.018094263633086607, 0.014768211920529802, 0.01710810377359749] and parameters: {'n_layers': 4, 'embedding_dim': 64, 'lr': 0.002147597357064978, 'lambda_val': 3.075785895847098e-05, 'batch_size': 1220, 'optimizer': 'RMSprop'}.
2026-05-24 11:52:41,080 - experiment_functions - INFO - Early stopping at epoch 750. Best Metrics: (0.03416288796314559, 0.022657284768211924, 0.03200777765953992)
2026-05-24 11:52:41,153 - optuna.study.study - INFO - Trial 199 finished with values: [0.03416288796314559, 0.022657284768211924, 0.03200777765953992] and parameters: {'n_layers': 1, 'embedding_dim': 256, 'lr': 0.004627149516425897, 'lambda_val': 6.229045175154034e-06, 'batch_size': 3482, 'optimizer': 'RMSprop'}.
2026-05-24 11:53:19,733 - optuna.study.study - INFO - Trial 200 finished with values: [0.010604566831524448, 0.008178807947019867, 0.011088713343400928] and parameters: {'n_layers': 2, 'embedding_dim': 32, 'lr': 0.00010951448425890375, 'lambda_val': 6.355050868627202e-05, 'batch_size': 908, 'optimizer': 'RMSprop'}.
2026-05-24 11:53:50,682 - experiment_functions - INFO - Early stopping at epoch 2550. Best Metrics: (0.045671366289507256, 0.029428807947019867, 0.03964035812642133)
2026-05-24 11:53:51,439 - optuna.study.study - INFO - Trial 201 finished with values: [0.045671366289507256, 0.029428807947019867, 0.03964035812642133] and parameters: {'n_layers': 3, 'embedding_dim': 96, 'lr': 0.00022526957918178337, 'lambda_val': 0.0005047903565224782, 'batch_size': 775, 'optimizer': 'RMSprop'}.
2026-05-24 11:53:59,574 - experiment_functions - INFO - Early stopping at epoch 650. Best Metrics: (0.020117254934431155, 0.015298013245033113, 0.01995121940414372)
2026-05-24 11:53:59,726 - optuna.study.study - INFO - Trial 202 finished with values: [0.020117254934431155, 0.015298013245033113, 0.01995121940414372] and parameters: {'n_layers': 1, 'embedding_dim': 128, 'lr': 0.014583702484207184, 'lambda_val': 0.0001303671050452136, 'batch_size': 2294, 'optimizer': 'RMSprop'}.
2026-05-24 11:54:10,057 - experiment_functions - INFO - Early stopping at epoch 750. Best Metrics: (0.041006558746908464, 0.027185430463576157, 0.03769014647772006)
2026-05-24 11:54:10,982 - optuna.study.study - INFO - Trial 203 finished with values: [0.041006558746908464, 0.027185430463576157, 0.03769014647772006] and parameters: {'n_layers': 3, 'embedding_dim': 128, 'lr': 0.0005493990269458161, 'lambda_val': 7.481780308257389e-06, 'batch_size': 553, 'optimizer': 'RMSprop'}.
2026-05-24 11:54:20,842 - experiment_functions - INFO - Early stopping at epoch 750. Best Metrics: (0.053605581597678795, 0.03283112582781457, 0.04754094633825515)
2026-05-24 11:54:22,048 - optuna.study.study - INFO - Trial 204 finished with values: [0.053605581597678795, 0.03283112582781457, 0.04754094633825515] and parameters: {'n_layers': 2, 'embedding_dim': 96, 'lr': 0.0012566980437762067, 'lambda_val': 0.0018912353521433405, 'batch_size': 944, 'optimizer': 'Adam'}.
2026-05-24 11:54:28,882 - experiment_functions - INFO - Early stopping at epoch 550. Best Metrics: (0.03144129939238726, 0.021506622516556294, 0.028689930343322515)
2026-05-24 11:54:29,858 - optuna.study.study - INFO - Trial 205 finished with values: [0.03144129939238726, 0.021506622516556294, 0.028689930343322515] and parameters: {'n_layers': 2, 'embedding_dim': 32, 'lr': 0.002147597357064978, 'lambda_val': 6.229045175154034e-06, 'batch_size': 908, 'optimizer': 'RMSprop'}.
2026-05-24 11:54:38,712 - experiment_functions - INFO - Early stopping at epoch 750. Best Metrics: (0.06090024596803883, 0.037524834437086096, 0.0533545615536532)
2026-05-24 11:54:39,460 - optuna.study.study - INFO - Trial 206 finished with values: [0.06090024596803883, 0.037524834437086096, 0.0533545615536532] and parameters: {'n_layers': 1, 'embedding_dim': 64, 'lr': 0.002147597357064978, 'lambda_val': 0.025850365843782332, 'batch_size': 694, 'optimizer': 'Adam'}.
2026-05-24 11:54:47,825 - experiment_functions - INFO - Early stopping at epoch 650. Best Metrics: (0.06008560484976581, 0.03546357615894039, 0.0509096524088016)
2026-05-24 11:54:47,896 - optuna.study.study - INFO - Trial 207 finished with values: [0.06008560484976581, 0.03546357615894039, 0.0509096524088016] and parameters: {'n_layers': 1, 'embedding_dim': 128, 'lr': 0.002147597357064978, 'lambda_val': 8.876623948407677e-06, 'batch_size': 1961, 'optimizer': 'Adam'}.
2026-05-24 11:55:03,435 - experiment_functions - INFO - Early stopping at epoch 1450. Best Metrics: (0.0055332905985529006, 0.004263245033112583, 0.005507956395205811)
2026-05-24 11:55:03,957 - optuna.study.study - INFO - Trial 208 finished with values: [0.0055332905985529006, 0.004263245033112583, 0.005507956395205811] and parameters: {'n_layers': 2, 'embedding_dim': 64, 'lr': 1.828105608203197e-05, 'lambda_val': 8.876623948407677e-06, 'batch_size': 775, 'optimizer': 'Adam'}.
2026-05-24 11:55:15,498 - experiment_functions - INFO - Early stopping at epoch 800. Best Metrics: (0.04900979955150634, 0.030215231788079472, 0.04378804371011376)
2026-05-24 11:55:15,585 - optuna.study.study - INFO - Trial 209 finished with values: [0.04900979955150634, 0.030215231788079472, 0.04378804371011376] and parameters: {'n_layers': 2, 'embedding_dim': 256, 'lr': 0.0005910069120800205, 'lambda_val': 8.876623948407677e-06, 'batch_size': 2551, 'optimizer': 'Adam'}.
2026-05-24 11:55:31,917 - experiment_functions - INFO - Early stopping at epoch 1150. Best Metrics: (0.05382325512629903, 0.033269867549668874, 0.04627621157846678)
2026-05-24 11:55:33,258 - optuna.study.study - INFO - Trial 210 finished with values: [0.05382325512629903, 0.033269867549668874, 0.04627621157846678] and parameters: {'n_layers': 2, 'embedding_dim': 256, 'lr': 0.0004379727673244972, 'lambda_val': 7.708365059245802e-06, 'batch_size': 553, 'optimizer': 'RMSprop'}.
2026-05-24 11:55:40,371 - experiment_functions - INFO - Early stopping at epoch 600. Best Metrics: (0.004878986428808415, 0.004312913907284768, 0.005264158278778496)
2026-05-24 11:55:40,476 - optuna.study.study - INFO - Trial 211 finished with values: [0.004878986428808415, 0.004312913907284768, 0.005264158278778496] and parameters: {'n_layers': 1, 'embedding_dim': 128, 'lr': 2.062135302502299e-05, 'lambda_val': 0.0031215683833034215, 'batch_size': 3247, 'optimizer': 'RMSprop'}.
2026-05-24 11:55:50,156 - experiment_functions - INFO - Early stopping at epoch 700. Best Metrics: (0.042040658598959044, 0.027259933774834433, 0.038387238823034374)
2026-05-24 11:55:50,618 - optuna.study.study - INFO - Trial 212 finished with values: [0.042040658598959044, 0.027259933774834433, 0.038387238823034374] and parameters: {'n_layers': 3, 'embedding_dim': 128, 'lr': 0.0005493990269458161, 'lambda_val': 2.6144777923546295e-05, 'batch_size': 775, 'optimizer': 'RMSprop'}.
2026-05-24 11:55:57,605 - experiment_functions - INFO - Early stopping at epoch 550. Best Metrics: (0.01143119586927996, 0.011291390728476822, 0.013619296244524199)
2026-05-24 11:55:57,708 - optuna.study.study - INFO - Trial 213 finished with values: [0.01143119586927996, 0.011291390728476822, 0.013619296244524199] and parameters: {'n_layers': 3, 'embedding_dim': 64, 'lr': 0.007734430860530913, 'lambda_val': 0.01723991176853604, 'batch_size': 1036, 'optimizer': 'Adam'}.
2026-05-24 11:56:13,675 - experiment_functions - INFO - Early stopping at epoch 1350. Best Metrics: (0.03456511938411869, 0.023203642384105962, 0.032401569908918515)
2026-05-24 11:56:14,479 - optuna.study.study - INFO - Trial 214 finished with values: [0.03456511938411869, 0.023203642384105962, 0.032401569908918515] and parameters: {'n_layers': 1, 'embedding_dim': 128, 'lr': 0.003279639996149738, 'lambda_val': 0.00034642554292560826, 'batch_size': 3482, 'optimizer': 'RMSprop'}.
2026-05-24 11:56:22,392 - experiment_functions - INFO - Early stopping at epoch 550. Best Metrics: (0.04272564712762688, 0.028841059602649006, 0.040029055319639135)
2026-05-24 11:56:22,490 - optuna.study.study - INFO - Trial 215 finished with values: [0.04272564712762688, 0.028841059602649006, 0.040029055319639135] and parameters: {'n_layers': 1, 'embedding_dim': 256, 'lr': 0.002147597357064978, 'lambda_val': 0.0001303671050452136, 'batch_size': 1926, 'optimizer': 'RMSprop'}.
2026-05-24 11:56:34,319 - experiment_functions - INFO - Early stopping at epoch 950. Best Metrics: (0.057519026514174315, 0.034163907284768216, 0.05053442580996666)
