2026-05-24 12:17:24,850 - optuna.study.study - INFO - Trial 8 finished with values: [0.004850985846680073, 0.0040562913907284765, 0.005094644366155815] and parameters: {'n_layers': 4, 'embedding_dim': 96, 'lr': 1.7055316138715705e-05, 'lambda_val': 3.921187974678955e-06, 'batch_size': 3997, 'optimizer': 'SGD'}.
2026-05-24 12:17:38,954 - experiment_functions - INFO - Early stopping at epoch 1200. Best Metrics: (0.031122099333960877, 0.021134105960264903, 0.029127458797195593)
2026-05-24 12:17:39,194 - optuna.study.study - INFO - Trial 9 finished with values: [0.031122099333960877, 0.021134105960264903, 0.029127458797195593] and parameters: {'n_layers': 1, 'embedding_dim': 128, 'lr': 0.004601744611421326, 'lambda_val': 0.00012607227916368514, 'batch_size': 2734, 'optimizer': 'RMSprop'}.
2026-05-24 12:17:45,787 - experiment_functions - INFO - Early stopping at epoch 550. Best Metrics: (0.009469646400955566, 0.010554635761589406, 0.011861226407858536)
2026-05-24 12:17:46,199 - optuna.study.study - INFO - Trial 10 finished with values: [0.009469646400955566, 0.010554635761589406, 0.011861226407858536] and parameters: {'n_layers': 3, 'embedding_dim': 32, 'lr': 0.0026821032299617197, 'lambda_val': 0.02179212605475038, 'batch_size': 3174, 'optimizer': 'RMSprop'}.
2026-05-24 12:17:52,574 - experiment_functions - INFO - Early stopping at epoch 500. Best Metrics: (0.005776661699972376, 0.004644039735099337, 0.005880057356891868)
2026-05-24 12:17:53,025 - optuna.study.study - INFO - Trial 11 finished with values: [0.005776661699972376, 0.004644039735099337, 0.005880057356891868] and parameters: {'n_layers': 3, 'embedding_dim': 64, 'lr': 0.009059752461132777, 'lambda_val': 0.02843248434954034, 'batch_size': 2016, 'optimizer': 'SGD'}.
2026-05-24 12:18:03,354 - experiment_functions - INFO - Early stopping at epoch 750. Best Metrics: (0.04592316629858777, 0.02793046357615894, 0.040668645164399865)
2026-05-24 12:18:04,495 - optuna.study.study - INFO - Trial 12 finished with values: [0.04592316629858777, 0.02793046357615894, 0.040668645164399865] and parameters: {'n_layers': 4, 'embedding_dim': 96, 'lr': 0.0007313058414573923, 'lambda_val': 4.517297969442362e-05, 'batch_size': 807, 'optimizer': 'Adam'}.
2026-05-24 12:18:15,279 - experiment_functions - INFO - Early stopping at epoch 500. Best Metrics: (0.004636822085769075, 0.0040562913907284765, 0.004858254804721325)
2026-05-24 12:18:15,721 - optuna.study.study - INFO - Trial 13 finished with values: [0.004636822085769075, 0.0040562913907284765, 0.004858254804721325] and parameters: {'n_layers': 2, 'embedding_dim': 32, 'lr': 5.901985419433128e-05, 'lambda_val': 0.01590646806038595, 'batch_size': 3143, 'optimizer': 'RMSprop'}.
2026-05-24 12:18:57,364 - optuna.study.study - INFO - Trial 14 finished with values: [0.030037408206540692, 0.022061258278145694, 0.029035023890794764] and parameters: {'n_layers': 1, 'embedding_dim': 32, 'lr': 0.023222702118018915, 'lambda_val': 0.0074710321383451754, 'batch_size': 1352, 'optimizer': 'RMSprop'}.
2026-05-24 12:19:04,610 - experiment_functions - INFO - Early stopping at epoch 550. Best Metrics: (0.011427870605266456, 0.010753311258278147, 0.01373593817125282)
2026-05-24 12:19:04,911 - optuna.study.study - INFO - Trial 15 finished with values: [0.011427870605266456, 0.010753311258278147, 0.01373593817125282] and parameters: {'n_layers': 3, 'embedding_dim': 32, 'lr': 0.0050557762652770595, 'lambda_val': 4.568039710181546e-05, 'batch_size': 2890, 'optimizer': 'RMSprop'}.
2026-05-24 12:19:57,202 - optuna.study.study - INFO - Trial 16 finished with values: [0.006938925309612626, 0.005885761589403973, 0.007402833556276037] and parameters: {'n_layers': 2, 'embedding_dim': 256, 'lr': 4.0898292142156475e-05, 'lambda_val': 0.00020611934466349238, 'batch_size': 3073, 'optimizer': 'RMSprop'}.
2026-05-24 12:20:46,659 - optuna.study.study - INFO - Trial 17 finished with values: [0.024638188305532337, 0.018559602649006624, 0.023835196664005073] and parameters: {'n_layers': 4, 'embedding_dim': 32, 'lr': 0.00015025434045445616, 'lambda_val': 4.511533338088929e-06, 'batch_size': 3917, 'optimizer': 'Adam'}.
2026-05-24 12:20:53,751 - experiment_functions - INFO - Early stopping at epoch 500. Best Metrics: (0.005532242814878397, 0.004511589403973511, 0.005477427345552122)
2026-05-24 12:20:54,360 - optuna.study.study - INFO - Trial 18 finished with values: [0.005532242814878397, 0.004511589403973511, 0.005477427345552122] and parameters: {'n_layers': 4, 'embedding_dim': 64, 'lr': 1.871452748052404e-05, 'lambda_val': 0.015911144624430017, 'batch_size': 3714, 'optimizer': 'RMSprop'}.
2026-05-24 12:21:02,070 - experiment_functions - INFO - Early stopping at epoch 550. Best Metrics: (0.04357341701867786, 0.02798841059602649, 0.039536425690630816)
2026-05-24 12:21:02,160 - optuna.study.study - INFO - Trial 19 finished with values: [0.04357341701867786, 0.02798841059602649, 0.039536425690630816] and parameters: {'n_layers': 2, 'embedding_dim': 96, 'lr': 0.0013252046344015903, 'lambda_val': 0.00047319112187695436, 'batch_size': 2030, 'optimizer': 'RMSprop'}.
2026-05-24 12:21:09,493 - experiment_functions - INFO - Early stopping at epoch 500. Best Metrics: (0.005589703203969802, 0.004445364238410596, 0.005616604903368309)
2026-05-24 12:21:09,987 - optuna.study.study - INFO - Trial 20 finished with values: [0.005589703203969802, 0.004445364238410596, 0.005616604903368309] and parameters: {'n_layers': 3, 'embedding_dim': 128, 'lr': 0.043911762048410935, 'lambda_val': 0.010412011323837839, 'batch_size': 2230, 'optimizer': 'SGD'}.
2026-05-24 12:21:59,093 - optuna.study.study - INFO - Trial 21 finished with values: [0.03568691310825576, 0.023758278145695363, 0.03361108087609869] and parameters: {'n_layers': 2, 'embedding_dim': 96, 'lr': 0.00010985512440869878, 'lambda_val': 4.872635963398448e-05, 'batch_size': 4088, 'optimizer': 'Adam'}.
2026-05-24 12:22:44,533 - optuna.study.study - INFO - Trial 22 finished with values: [0.0240938332708051, 0.017764900662251656, 0.02357498365614562] and parameters: {'n_layers': 2, 'embedding_dim': 32, 'lr': 0.00018489948154424467, 'lambda_val': 0.0001853110481968361, 'batch_size': 563, 'optimizer': 'RMSprop'}.
2026-05-24 12:23:03,063 - experiment_functions - INFO - Early stopping at epoch 1500. Best Metrics: (0.02400325248151841, 0.014826158940397353, 0.021145375717383546)
2026-05-24 12:23:03,161 - optuna.study.study - INFO - Trial 23 finished with values: [0.02400325248151841, 0.014826158940397353, 0.021145375717383546] and parameters: {'n_layers': 2, 'embedding_dim': 64, 'lr': 0.010153523961601577, 'lambda_val': 1.219279944372493e-05, 'batch_size': 3193, 'optimizer': 'Adam'}.
2026-05-24 12:23:16,115 - experiment_functions - INFO - Early stopping at epoch 1000. Best Metrics: (0.050995494969525094, 0.030927152317880797, 0.04729541748592908)
2026-05-24 12:23:16,202 - optuna.study.study - INFO - Trial 24 finished with values: [0.050995494969525094, 0.030927152317880797, 0.04729541748592908] and parameters: {'n_layers': 3, 'embedding_dim': 32, 'lr': 0.0005846659139515835, 'lambda_val': 8.471062459286831e-06, 'batch_size': 1221, 'optimizer': 'Adam'}.
2026-05-24 12:23:46,416 - experiment_functions - INFO - Early stopping at epoch 2400. Best Metrics: (0.021679888390910174, 0.014503311258278145, 0.020490836124797077)
2026-05-24 12:23:46,868 - optuna.study.study - INFO - Trial 25 finished with values: [0.021679888390910174, 0.014503311258278145, 0.020490836124797077] and parameters: {'n_layers': 4, 'embedding_dim': 64, 'lr': 0.016762510970554485, 'lambda_val': 0.0011830463992159451, 'batch_size': 1525, 'optimizer': 'RMSprop'}.
2026-05-24 12:24:18,063 - experiment_functions - INFO - Early stopping at epoch 2350. Best Metrics: (0.005929680545778264, 0.0045033112582781466, 0.00594636940024273)
2026-05-24 12:24:18,794 - optuna.study.study - INFO - Trial 26 finished with values: [0.005929680545778264, 0.0045033112582781466, 0.00594636940024273] and parameters: {'n_layers': 4, 'embedding_dim': 128, 'lr': 1.4523523653234223e-05, 'lambda_val': 0.0003698300441251501, 'batch_size': 1239, 'optimizer': 'Adam'}.
2026-05-24 12:24:26,363 - experiment_functions - INFO - Early stopping at epoch 550. Best Metrics: (0.005632249578342085, 0.004221854304635762, 0.005394479412014204)
2026-05-24 12:24:26,455 - optuna.study.study - INFO - Trial 27 finished with values: [0.005632249578342085, 0.004221854304635762, 0.005394479412014204] and parameters: {'n_layers': 4, 'embedding_dim': 64, 'lr': 0.014781919899767581, 'lambda_val': 7.482710648766772e-05, 'batch_size': 3049, 'optimizer': 'SGD'}.
2026-05-24 12:25:22,246 - optuna.study.study - INFO - Trial 28 finished with values: [0.03568260191305637, 0.024735099337748347, 0.033477103401382435] and parameters: {'n_layers': 4, 'embedding_dim': 128, 'lr': 0.00012817614150118707, 'lambda_val': 0.007383021531734565, 'batch_size': 989, 'optimizer': 'Adam'}.
2026-05-24 12:26:09,410 - optuna.study.study - INFO - Trial 29 finished with values: [0.005126966847138674, 0.004470198675496689, 0.005494987805463081] and parameters: {'n_layers': 3, 'embedding_dim': 64, 'lr': 2.398409948473366e-05, 'lambda_val': 2.3988755552061655e-05, 'batch_size': 3155, 'optimizer': 'Adam'}.
2026-05-24 12:26:18,278 - experiment_functions - INFO - Early stopping at epoch 600. Best Metrics: (0.03688764335950872, 0.024950331125827813, 0.032969147922480666)
2026-05-24 12:26:19,124 - optuna.study.study - INFO - Trial 30 finished with values: [0.03688764335950872, 0.024950331125827813, 0.032969147922480666] and parameters: {'n_layers': 4, 'embedding_dim': 96, 'lr': 0.0017164560979354832, 'lambda_val': 1.4260009028076442e-05, 'batch_size': 554, 'optimizer': 'Adam'}.
2026-05-24 12:26:27,188 - experiment_functions - INFO - Early stopping at epoch 550. Best Metrics: (0.04481222613931092, 0.027971854304635765, 0.04014980926156057)
2026-05-24 12:26:27,278 - optuna.study.study - INFO - Trial 31 finished with values: [0.04481222613931092, 0.027971854304635765, 0.04014980926156057] and parameters: {'n_layers': 1, 'embedding_dim': 256, 'lr': 0.005103877753824678, 'lambda_val': 0.0006796337932014016, 'batch_size': 2381, 'optimizer': 'Adam'}.
2026-05-24 12:26:38,773 - experiment_functions - INFO - Early stopping at epoch 850. Best Metrics: (0.027177037818374907, 0.01995033112582782, 0.02622720079483228)
2026-05-24 12:26:38,986 - optuna.study.study - INFO - Trial 32 finished with values: [0.027177037818374907, 0.01995033112582782, 0.02622720079483228] and parameters: {'n_layers': 3, 'embedding_dim': 64, 'lr': 0.00042481052629863496, 'lambda_val': 0.03371764664294414, 'batch_size': 3663, 'optimizer': 'Adam'}.
2026-05-24 12:26:45,689 - experiment_functions - INFO - Early stopping at epoch 500. Best Metrics: (0.004586634555590821, 0.004097682119205298, 0.005175522305856751)
2026-05-24 12:26:45,791 - optuna.study.study - INFO - Trial 33 finished with values: [0.004586634555590821, 0.004097682119205298, 0.005175522305856751] and parameters: {'n_layers': 2, 'embedding_dim': 64, 'lr': 0.0004096611245594092, 'lambda_val': 2.064180655376052e-05, 'batch_size': 3886, 'optimizer': 'SGD'}.
2026-05-24 12:26:53,893 - experiment_functions - INFO - Early stopping at epoch 600. Best Metrics: (0.05733998676860995, 0.03508278145695364, 0.05164060112263218)
2026-05-24 12:26:54,021 - optuna.study.study - INFO - Trial 34 finished with values: [0.05733998676860995, 0.03508278145695364, 0.05164060112263218] and parameters: {'n_layers': 1, 'embedding_dim': 96, 'lr': 0.004235289187226827, 'lambda_val': 0.0003409068265064018, 'batch_size': 1315, 'optimizer': 'Adam'}.
2026-05-24 12:27:41,545 - optuna.study.study - INFO - Trial 35 finished with values: [0.006035988320691007, 0.004644039735099338, 0.005960885374601775] and parameters: {'n_layers': 3, 'embedding_dim': 96, 'lr': 2.3228644173842884e-05, 'lambda_val': 1.930629760861541e-06, 'batch_size': 1304, 'optimizer': 'Adam'}.
2026-05-24 12:27:53,957 - experiment_functions - INFO - Early stopping at epoch 950. Best Metrics: (0.060028728995735414, 0.03543046357615894, 0.05218407282107315)
2026-05-24 12:27:54,109 - optuna.study.study - INFO - Trial 36 finished with values: [0.060028728995735414, 0.03543046357615894, 0.05218407282107315] and parameters: {'n_layers': 1, 'embedding_dim': 96, 'lr': 0.000684293575282855, 'lambda_val': 0.0018241216708581335, 'batch_size': 3564, 'optimizer': 'Adam'}.
2026-05-24 12:28:00,719 - experiment_functions - INFO - Early stopping at epoch 500. Best Metrics: (0.0052145086821248805, 0.004072847682119206, 0.005331916566442895)
2026-05-24 12:28:00,826 - optuna.study.study - INFO - Trial 37 finished with values: [0.0052145086821248805, 0.004072847682119206, 0.005331916566442895] and parameters: {'n_layers': 3, 'embedding_dim': 32, 'lr': 3.060575551259864e-05, 'lambda_val': 0.004370095403019912, 'batch_size': 2161, 'optimizer': 'RMSprop'}.
2026-05-24 12:28:08,263 - experiment_functions - INFO - Early stopping at epoch 550. Best Metrics: (0.018243249163582925, 0.01433774834437086, 0.018703884318672124)
2026-05-24 12:28:08,655 - optuna.study.study - INFO - Trial 38 finished with values: [0.018243249163582925, 0.01433774834437086, 0.018703884318672124] and parameters: {'n_layers': 1, 'embedding_dim': 32, 'lr': 0.0380985856828136, 'lambda_val': 5.443609040966183e-05, 'batch_size': 2481, 'optimizer': 'Adam'}.
2026-05-24 12:28:27,873 - experiment_functions - INFO - Early stopping at epoch 1450. Best Metrics: (0.037494560690505836, 0.02552152317880795, 0.0356400071042548)
2026-05-24 12:28:28,298 - optuna.study.study - INFO - Trial 39 finished with values: [0.037494560690505836, 0.02552152317880795, 0.0356400071042548] and parameters: {'n_layers': 3, 'embedding_dim': 96, 'lr': 0.0002462077417891578, 'lambda_val': 2.662938714668246e-05, 'batch_size': 1844, 'optimizer': 'RMSprop'}.
2026-05-24 12:28:35,353 - experiment_functions - INFO - Early stopping at epoch 500. Best Metrics: (0.01295712397749657, 0.010728476821192054, 0.013977441273528884)
2026-05-24 12:28:35,473 - optuna.study.study - INFO - Trial 40 finished with values: [0.01295712397749657, 0.010728476821192054, 0.013977441273528884] and parameters: {'n_layers': 4, 'embedding_dim': 64, 'lr': 0.03244369482190977, 'lambda_val': 0.09726133739941059, 'batch_size': 1199, 'optimizer': 'RMSprop'}.
2026-05-24 12:28:46,560 - experiment_functions - INFO - Early stopping at epoch 950. Best Metrics: (0.0053733920311257, 0.004246688741721854, 0.0054158482641861365)
2026-05-24 12:28:46,849 - optuna.study.study - INFO - Trial 41 finished with values: [0.0053733920311257, 0.004246688741721854, 0.0054158482641861365] and parameters: {'n_layers': 1, 'embedding_dim': 32, 'lr': 0.011793654753007992, 'lambda_val': 7.023187222892337e-06, 'batch_size': 1821, 'optimizer': 'SGD'}.
2026-05-24 12:29:32,586 - experiment_functions - INFO - Early stopping at epoch 3850. Best Metrics: (0.025669755089880723, 0.01681291390728477, 0.02308238033827601)
2026-05-24 12:29:33,860 - optuna.study.study - INFO - Trial 42 finished with values: [0.025669755089880723, 0.01681291390728477, 0.02308238033827601] and parameters: {'n_layers': 3, 'embedding_dim': 64, 'lr': 0.007947853266904198, 'lambda_val': 1.990977814130034e-05, 'batch_size': 973, 'optimizer': 'RMSprop'}.
2026-05-24 12:29:40,748 - experiment_functions - INFO - Early stopping at epoch 500. Best Metrics: (0.005444862674529344, 0.004172185430463576, 0.005419909908732471)
2026-05-24 12:29:41,002 - optuna.study.study - INFO - Trial 43 finished with values: [0.005444862674529344, 0.004172185430463576, 0.005419909908732471] and parameters: {'n_layers': 2, 'embedding_dim': 96, 'lr': 0.0088148898513942, 'lambda_val': 0.014303810156569017, 'batch_size': 3595, 'optimizer': 'SGD'}.
2026-05-24 12:29:47,424 - experiment_functions - INFO - Early stopping at epoch 500. Best Metrics: (0.0046558935760860655, 0.004081125827814569, 0.005004974495928135)
2026-05-24 12:29:47,934 - optuna.study.study - INFO - Trial 44 finished with values: [0.0046558935760860655, 0.004081125827814569, 0.005004974495928135] and parameters: {'n_layers': 1, 'embedding_dim': 64, 'lr': 2.0753028410031864e-05, 'lambda_val': 0.0001233422793765275, 'batch_size': 2861, 'optimizer': 'SGD'}.
2026-05-24 12:29:56,268 - experiment_functions - INFO - Early stopping at epoch 500. Best Metrics: (0.005565122604442832, 0.004279801324503311, 0.005390687496639345)
2026-05-24 12:29:56,359 - optuna.study.study - INFO - Trial 45 finished with values: [0.005565122604442832, 0.004279801324503311, 0.005390687496639345] and parameters: {'n_layers': 3, 'embedding_dim': 256, 'lr': 0.0008856034883538041, 'lambda_val': 0.004339715845565237, 'batch_size': 3280, 'optimizer': 'SGD'}.
2026-05-24 12:30:56,330 - optuna.study.study - INFO - Trial 46 finished with values: [0.027746470044161718, 0.019130794701986756, 0.026277002645278203] and parameters: {'n_layers': 3, 'embedding_dim': 256, 'lr': 7.880914296234578e-05, 'lambda_val': 0.0003172844221989213, 'batch_size': 1533, 'optimizer': 'Adam'}.
2026-05-24 12:31:25,423 - experiment_functions - INFO - Early stopping at epoch 2400. Best Metrics: (0.01629527778380755, 0.013890728476821193, 0.01724055469446495)
2026-05-24 12:31:25,815 - optuna.study.study - INFO - Trial 47 finished with values: [0.01629527778380755, 0.013890728476821193, 0.01724055469446495] and parameters: {'n_layers': 2, 'embedding_dim': 96, 'lr': 0.05687696119744688, 'lambda_val': 0.014499624791208778, 'batch_size': 3665, 'optimizer': 'Adam'}.
2026-05-24 12:32:11,599 - optuna.study.study - INFO - Trial 48 finished with values: [0.021416189782833064, 0.015695364238410597, 0.020914407665473665] and parameters: {'n_layers': 2, 'embedding_dim': 64, 'lr': 0.00011675811604072238, 'lambda_val': 2.2201284414336642e-06, 'batch_size': 1730, 'optimizer': 'RMSprop'}.
2026-05-24 12:32:17,767 - experiment_functions - INFO - Early stopping at epoch 500. Best Metrics: (0.00825123267465804, 0.006514900662251657, 0.00879621770836406)
2026-05-24 12:32:18,298 - optuna.study.study - INFO - Trial 49 finished with values: [0.00825123267465804, 0.006514900662251657, 0.00879621770836406] and parameters: {'n_layers': 2, 'embedding_dim': 32, 'lr': 0.09884407033531244, 'lambda_val': 0.000325456155928982, 'batch_size': 3847, 'optimizer': 'RMSprop'}.
2026-05-24 12:32:24,971 - experiment_functions - INFO - Early stopping at epoch 500. Best Metrics: (0.004922508689271078, 0.004288079470198676, 0.0053205217582686145)
2026-05-24 12:32:25,072 - optuna.study.study - INFO - Trial 50 finished with values: [0.004922508689271078, 0.004288079470198676, 0.0053205217582686145] and parameters: {'n_layers': 4, 'embedding_dim': 32, 'lr': 0.014887103358763155, 'lambda_val': 1.990977814130034e-05, 'batch_size': 3049, 'optimizer': 'SGD'}.
2026-05-24 12:32:32,912 - experiment_functions - INFO - Early stopping at epoch 600. Best Metrics: (0.06333592926980075, 0.037185430463576155, 0.055111688414755916)
2026-05-24 12:32:33,003 - optuna.study.study - INFO - Trial 51 finished with values: [0.06333592926980075, 0.037185430463576155, 0.055111688414755916] and parameters: {'n_layers': 1, 'embedding_dim': 96, 'lr': 0.0050557762652770595, 'lambda_val': 0.0003409068265064018, 'batch_size': 1315, 'optimizer': 'Adam'}.
2026-05-24 12:32:40,859 - experiment_functions - INFO - Early stopping at epoch 600. Best Metrics: (0.05245919039356383, 0.03301324503311258, 0.04641599900582273)
2026-05-24 12:32:40,962 - optuna.study.study - INFO - Trial 52 finished with values: [0.05245919039356383, 0.03301324503311258, 0.04641599900582273] and parameters: {'n_layers': 2, 'embedding_dim': 96, 'lr': 0.0017164560979354832, 'lambda_val': 0.014499624791208778, 'batch_size': 3665, 'optimizer': 'Adam'}.
2026-05-24 12:32:49,756 - experiment_functions - INFO - Early stopping at epoch 700. Best Metrics: (0.03498280396474212, 0.023609271523178803, 0.0338499063324095)
2026-05-24 12:32:50,215 - optuna.study.study - INFO - Trial 53 finished with values: [0.03498280396474212, 0.023609271523178803, 0.0338499063324095] and parameters: {'n_layers': 3, 'embedding_dim': 32, 'lr': 0.0008856034883538041, 'lambda_val': 1.2132604105041649e-06, 'batch_size': 3280, 'optimizer': 'Adam'}.
2026-05-24 12:32:58,365 - experiment_functions - INFO - Early stopping at epoch 500. Best Metrics: (0.014006872487805527, 0.011432119205298016, 0.015066677821162913)
2026-05-24 12:32:58,814 - optuna.study.study - INFO - Trial 54 finished with values: [0.014006872487805527, 0.011432119205298016, 0.015066677821162913] and parameters: {'n_layers': 4, 'embedding_dim': 64, 'lr': 0.03244369482190977, 'lambda_val': 0.09726133739941059, 'batch_size': 1199, 'optimizer': 'RMSprop'}.
2026-05-24 12:33:32,253 - experiment_functions - INFO - Early stopping at epoch 3350. Best Metrics: (0.005672217730841807, 0.004420529801324504, 0.0056201489693584305)
2026-05-24 12:33:32,334 - optuna.study.study - INFO - Trial 55 finished with values: [0.005672217730841807, 0.004420529801324504, 0.0056201489693584305] and parameters: {'n_layers': 1, 'embedding_dim': 32, 'lr': 2.613333654868152e-05, 'lambda_val': 3.4355332572174856e-05, 'batch_size': 1022, 'optimizer': 'RMSprop'}.
2026-05-24 12:34:20,287 - optuna.study.study - INFO - Trial 56 finished with values: [0.03176689422389722, 0.02302152317880795, 0.030641977040464088] and parameters: {'n_layers': 4, 'embedding_dim': 64, 'lr': 0.00015112824887092085, 'lambda_val': 3.4355332572174856e-05, 'batch_size': 1730, 'optimizer': 'Adam'}.
2026-05-24 12:35:04,967 - optuna.study.study - INFO - Trial 57 finished with values: [0.006298710816186952, 0.0052566225165562915, 0.006787207933899381] and parameters: {'n_layers': 2, 'embedding_dim': 128, 'lr': 4.0898292142156475e-05, 'lambda_val': 2.3988755552061655e-05, 'batch_size': 3155, 'optimizer': 'RMSprop'}.
2026-05-24 12:35:13,423 - experiment_functions - INFO - Early stopping at epoch 650. Best Metrics: (0.01635443826942964, 0.010471854304635762, 0.014379896516086095)
