2026-05-24 07:52:04,710 - optuna.study.study - INFO - Trial 222 finished with values: [0.053984016463319455, 0.02491721854304636, 0.049128531253666285] and parameters: {'n_layers': 2, 'embedding_dim': 96, 'lr': 0.0003154862248546408, 'lambda_val': 0.006128221667042127, 'batch_size': 1253, 'optimizer': 'Adam'}.
2026-05-24 07:52:24,392 - experiment_functions - INFO - Early stopping at epoch 1450. Best Metrics: (0.07299695759732781, 0.031506622516556296, 0.0650050133937897)
2026-05-24 07:52:24,491 - optuna.study.study - INFO - Trial 223 finished with values: [0.07299695759732781, 0.031506622516556296, 0.0650050133937897] and parameters: {'n_layers': 1, 'embedding_dim': 256, 'lr': 0.0004427403826510948, 'lambda_val': 0.0001819760529014093, 'batch_size': 959, 'optimizer': 'Adam'}.
2026-05-24 07:52:41,676 - experiment_functions - INFO - Early stopping at epoch 1250. Best Metrics: (0.026521876878635754, 0.013774834437086096, 0.023143074227336462)
2026-05-24 07:52:41,764 - optuna.study.study - INFO - Trial 224 finished with values: [0.026521876878635754, 0.013774834437086096, 0.023143074227336462] and parameters: {'n_layers': 4, 'embedding_dim': 32, 'lr': 0.0004427403826510948, 'lambda_val': 6.417173701743343e-05, 'batch_size': 3411, 'optimizer': 'RMSprop'}.
2026-05-24 07:52:48,152 - experiment_functions - INFO - Early stopping at epoch 500. Best Metrics: (0.004961909510827406, 0.004180463576158941, 0.0050874702948505305)
2026-05-24 07:52:48,926 - optuna.study.study - INFO - Trial 225 finished with values: [0.004961909510827406, 0.004180463576158941, 0.0050874702948505305] and parameters: {'n_layers': 1, 'embedding_dim': 64, 'lr': 4.7484056100176325e-05, 'lambda_val': 0.0003842143805033632, 'batch_size': 527, 'optimizer': 'SGD'}.
2026-05-24 07:53:07,836 - experiment_functions - INFO - Early stopping at epoch 1500. Best Metrics: (0.06849986928284321, 0.02951158940397351, 0.0609398470686112)
2026-05-24 07:53:08,009 - optuna.study.study - INFO - Trial 226 finished with values: [0.06849986928284321, 0.02951158940397351, 0.0609398470686112] and parameters: {'n_layers': 1, 'embedding_dim': 96, 'lr': 0.0004427403826510948, 'lambda_val': 2.4948249425733372e-05, 'batch_size': 1151, 'optimizer': 'RMSprop'}.
2026-05-24 07:53:15,778 - experiment_functions - INFO - Early stopping at epoch 500. Best Metrics: (0.005099868907593424, 0.004213576158940397, 0.005410775093882762)
2026-05-24 07:53:15,882 - optuna.study.study - INFO - Trial 227 finished with values: [0.005099868907593424, 0.004213576158940397, 0.005410775093882762] and parameters: {'n_layers': 4, 'embedding_dim': 96, 'lr': 0.0004427403826510948, 'lambda_val': 0.00013335196567720495, 'batch_size': 803, 'optimizer': 'SGD'}.
2026-05-24 07:53:41,368 - experiment_functions - INFO - Early stopping at epoch 1900. Best Metrics: (0.07467370378827, 0.028435430463576158, 0.062068266836139786)
2026-05-24 07:53:41,907 - optuna.study.study - INFO - Trial 228 finished with values: [0.07467370378827, 0.028435430463576158, 0.062068266836139786] and parameters: {'n_layers': 1, 'embedding_dim': 256, 'lr': 0.0004427403826510948, 'lambda_val': 2.4948249425733372e-05, 'batch_size': 1257, 'optimizer': 'RMSprop'}.
2026-05-24 07:53:53,529 - experiment_functions - INFO - Early stopping at epoch 950. Best Metrics: (0.05884675288624457, 0.025678807947019867, 0.05293721693935635)
2026-05-24 07:53:53,636 - optuna.study.study - INFO - Trial 229 finished with values: [0.05884675288624457, 0.025678807947019867, 0.05293721693935635] and parameters: {'n_layers': 1, 'embedding_dim': 64, 'lr': 0.0004427403826510948, 'lambda_val': 0.0023999610459478756, 'batch_size': 3507, 'optimizer': 'RMSprop'}.
2026-05-24 07:54:09,579 - experiment_functions - INFO - Early stopping at epoch 1300. Best Metrics: (0.06875592660366171, 0.030405629139072847, 0.06135615743014943)
2026-05-24 07:54:09,905 - optuna.study.study - INFO - Trial 230 finished with values: [0.06875592660366171, 0.030405629139072847, 0.06135615743014943] and parameters: {'n_layers': 1, 'embedding_dim': 128, 'lr': 0.0004427403826510948, 'lambda_val': 2.4948249425733372e-05, 'batch_size': 1308, 'optimizer': 'RMSprop'}.
2026-05-24 07:54:20,752 - experiment_functions - INFO - Early stopping at epoch 850. Best Metrics: (0.04699563020993357, 0.021663907284768216, 0.042263221824403556)
2026-05-24 07:54:21,849 - optuna.study.study - INFO - Trial 231 finished with values: [0.04699563020993357, 0.021663907284768216, 0.042263221824403556] and parameters: {'n_layers': 2, 'embedding_dim': 64, 'lr': 0.0004427403826510948, 'lambda_val': 0.0073212623979535246, 'batch_size': 3507, 'optimizer': 'Adam'}.
2026-05-24 07:54:29,268 - experiment_functions - INFO - Early stopping at epoch 550. Best Metrics: (0.0333951567411861, 0.01995860927152318, 0.03104070445341906)
2026-05-24 07:54:29,375 - optuna.study.study - INFO - Trial 232 finished with values: [0.0333951567411861, 0.01995860927152318, 0.03104070445341906] and parameters: {'n_layers': 3, 'embedding_dim': 32, 'lr': 0.0014509434531037974, 'lambda_val': 9.2363995018798e-06, 'batch_size': 1744, 'optimizer': 'RMSprop'}.
2026-05-24 07:54:42,084 - experiment_functions - INFO - Early stopping at epoch 950. Best Metrics: (0.03141954366752753, 0.0157864238410596, 0.027679888939124476)
2026-05-24 07:54:42,168 - optuna.study.study - INFO - Trial 233 finished with values: [0.03141954366752753, 0.0157864238410596, 0.027679888939124476] and parameters: {'n_layers': 4, 'embedding_dim': 32, 'lr': 0.0004427403826510948, 'lambda_val': 0.0023999610459478756, 'batch_size': 2766, 'optimizer': 'RMSprop'}.
2026-05-24 07:54:49,280 - experiment_functions - INFO - Early stopping at epoch 550. Best Metrics: (0.05465359136004465, 0.02383278145695364, 0.04703164987196511)
2026-05-24 07:54:49,377 - optuna.study.study - INFO - Trial 234 finished with values: [0.05465359136004465, 0.02383278145695364, 0.04703164987196511] and parameters: {'n_layers': 1, 'embedding_dim': 96, 'lr': 0.0014509434531037974, 'lambda_val': 0.0023999610459478756, 'batch_size': 3507, 'optimizer': 'RMSprop'}.
2026-05-24 07:55:13,127 - experiment_functions - INFO - Early stopping at epoch 2150. Best Metrics: (0.05965001128840941, 0.025778145695364237, 0.052131347531236424)
2026-05-24 07:55:13,216 - optuna.study.study - INFO - Trial 235 finished with values: [0.05965001128840941, 0.025778145695364237, 0.052131347531236424] and parameters: {'n_layers': 1, 'embedding_dim': 64, 'lr': 0.0002382334927885136, 'lambda_val': 0.02228654826917861, 'batch_size': 1889, 'optimizer': 'RMSprop'}.
2026-05-24 07:55:40,256 - experiment_functions - INFO - Early stopping at epoch 2450. Best Metrics: (0.04903202542690982, 0.015902317880794704, 0.03379742227176923)
2026-05-24 07:55:40,384 - optuna.study.study - INFO - Trial 236 finished with values: [0.04903202542690982, 0.015902317880794704, 0.03379742227176923] and parameters: {'n_layers': 1, 'embedding_dim': 64, 'lr': 0.008825737855916319, 'lambda_val': 0.00828097881980844, 'batch_size': 3507, 'optimizer': 'RMSprop'}.
2026-05-24 07:55:53,346 - experiment_functions - INFO - Early stopping at epoch 1050. Best Metrics: (0.06406291559325525, 0.02733443708609272, 0.057209733916145894)
2026-05-24 07:55:53,432 - optuna.study.study - INFO - Trial 237 finished with values: [0.06406291559325525, 0.02733443708609272, 0.057209733916145894] and parameters: {'n_layers': 1, 'embedding_dim': 96, 'lr': 0.0004427403826510948, 'lambda_val': 1.1068932700778532e-05, 'batch_size': 3507, 'optimizer': 'Adam'}.
2026-05-24 07:56:11,063 - experiment_functions - INFO - Early stopping at epoch 1500. Best Metrics: (0.06985915228972893, 0.030728476821192053, 0.06281781956260307)
2026-05-24 07:56:11,156 - optuna.study.study - INFO - Trial 238 finished with values: [0.06985915228972893, 0.030728476821192053, 0.06281781956260307] and parameters: {'n_layers': 1, 'embedding_dim': 96, 'lr': 0.0004427403826510948, 'lambda_val': 2.4948249425733372e-05, 'batch_size': 1308, 'optimizer': 'Adam'}.
2026-05-24 07:56:37,799 - experiment_functions - INFO - Early stopping at epoch 2350. Best Metrics: (0.06448959016193181, 0.026009933774834435, 0.0550068728502414)
2026-05-24 07:56:37,886 - optuna.study.study - INFO - Trial 239 finished with values: [0.06448959016193181, 0.026009933774834435, 0.0550068728502414] and parameters: {'n_layers': 1, 'embedding_dim': 32, 'lr': 0.0004427403826510948, 'lambda_val': 0.0006476604301141326, 'batch_size': 2437, 'optimizer': 'RMSprop'}.
2026-05-24 07:56:45,552 - experiment_functions - INFO - Early stopping at epoch 600. Best Metrics: (0.03750631790082562, 0.011614238410596027, 0.02489178611865502)
2026-05-24 07:56:45,655 - optuna.study.study - INFO - Trial 240 finished with values: [0.03750631790082562, 0.011614238410596027, 0.02489178611865502] and parameters: {'n_layers': 1, 'embedding_dim': 96, 'lr': 0.031106026868578125, 'lambda_val': 7.532370886356362e-05, 'batch_size': 2348, 'optimizer': 'Adam'}.
2026-05-24 07:56:54,601 - experiment_functions - INFO - Early stopping at epoch 650. Best Metrics: (0.06601659847068932, 0.027541390728476826, 0.05868163773375749)
2026-05-24 07:56:54,746 - optuna.study.study - INFO - Trial 241 finished with values: [0.06601659847068932, 0.027541390728476826, 0.05868163773375749] and parameters: {'n_layers': 1, 'embedding_dim': 128, 'lr': 0.0014509434531037974, 'lambda_val': 9.2363995018798e-06, 'batch_size': 3507, 'optimizer': 'Adam'}.
2026-05-24 07:57:01,889 - experiment_functions - INFO - Early stopping at epoch 550. Best Metrics: (0.03898746787418667, 0.01809602649006623, 0.031340876759387154)
2026-05-24 07:57:01,989 - optuna.study.study - INFO - Trial 242 finished with values: [0.03898746787418667, 0.01809602649006623, 0.031340876759387154] and parameters: {'n_layers': 2, 'embedding_dim': 32, 'lr': 0.0022669727389603937, 'lambda_val': 0.0023999610459478756, 'batch_size': 1308, 'optimizer': 'RMSprop'}.
2026-05-24 07:57:18,882 - experiment_functions - INFO - Early stopping at epoch 1300. Best Metrics: (0.06458901590647023, 0.027309602649006625, 0.05700389273689674)
2026-05-24 07:57:18,973 - optuna.study.study - INFO - Trial 243 finished with values: [0.06458901590647023, 0.027309602649006625, 0.05700389273689674] and parameters: {'n_layers': 1, 'embedding_dim': 256, 'lr': 0.0003154862248546408, 'lambda_val': 7.532370886356362e-05, 'batch_size': 3507, 'optimizer': 'Adam'}.
2026-05-24 07:57:31,757 - experiment_functions - INFO - Early stopping at epoch 950. Best Metrics: (0.06257710771289429, 0.02800496688741722, 0.05369186728591495)
2026-05-24 07:57:31,845 - optuna.study.study - INFO - Trial 244 finished with values: [0.06257710771289429, 0.02800496688741722, 0.05369186728591495] and parameters: {'n_layers': 1, 'embedding_dim': 256, 'lr': 0.0004427403826510948, 'lambda_val': 0.005784834603301849, 'batch_size': 1257, 'optimizer': 'RMSprop'}.
2026-05-24 07:58:23,112 - optuna.study.study - INFO - Trial 245 finished with values: [0.04251763907698305, 0.023600993377483444, 0.04348016184079649] and parameters: {'n_layers': 4, 'embedding_dim': 32, 'lr': 0.00022442725513326185, 'lambda_val': 6.417173701743343e-05, 'batch_size': 2492, 'optimizer': 'RMSprop'}.
2026-05-24 07:58:36,868 - experiment_functions - INFO - Early stopping at epoch 1100. Best Metrics: (0.053455324869760554, 0.023402317880794707, 0.04856327623093456)
2026-05-24 07:58:36,957 - optuna.study.study - INFO - Trial 246 finished with values: [0.053455324869760554, 0.023402317880794707, 0.04856327623093456] and parameters: {'n_layers': 2, 'embedding_dim': 64, 'lr': 0.00034776281673029824, 'lambda_val': 0.0023999610459478756, 'batch_size': 1629, 'optimizer': 'RMSprop'}.
2026-05-24 07:59:21,958 - optuna.study.study - INFO - Trial 247 finished with values: [0.06890497052485432, 0.03327814569536424, 0.06376631774633958] and parameters: {'n_layers': 1, 'embedding_dim': 32, 'lr': 0.00022442725513326185, 'lambda_val': 0.00828097881980844, 'batch_size': 3263, 'optimizer': 'RMSprop'}.
2026-05-24 08:00:06,954 - optuna.study.study - INFO - Trial 248 finished with values: [0.05931288271929982, 0.018170529801324505, 0.040237418741007815] and parameters: {'n_layers': 1, 'embedding_dim': 96, 'lr': 0.031181557217089314, 'lambda_val': 0.0016996536426811964, 'batch_size': 3968, 'optimizer': 'RMSprop'}.
2026-05-24 08:00:20,304 - experiment_functions - INFO - Early stopping at epoch 950. Best Metrics: (0.03829668193323862, 0.02107615894039735, 0.035195879068361774)
2026-05-24 08:00:20,395 - optuna.study.study - INFO - Trial 249 finished with values: [0.03829668193323862, 0.02107615894039735, 0.035195879068361774] and parameters: {'n_layers': 4, 'embedding_dim': 32, 'lr': 0.0004427403826510948, 'lambda_val': 0.006128221667042127, 'batch_size': 891, 'optimizer': 'RMSprop'}.
2026-05-24 08:01:08,317 - optuna.study.study - INFO - Trial 250 finished with values: [0.061405863119781884, 0.02526490066225166, 0.052893424470527375] and parameters: {'n_layers': 1, 'embedding_dim': 64, 'lr': 0.0002382334927885136, 'lambda_val': 0.0002658688144855125, 'batch_size': 4089, 'optimizer': 'RMSprop'}.
2026-05-24 08:01:25,767 - experiment_functions - INFO - Early stopping at epoch 1400. Best Metrics: (0.06972205185377134, 0.030728476821192056, 0.06154587496664262)
2026-05-24 08:01:25,867 - optuna.study.study - INFO - Trial 251 finished with values: [0.06972205185377134, 0.030728476821192056, 0.06154587496664262] and parameters: {'n_layers': 1, 'embedding_dim': 96, 'lr': 0.0004427403826510948, 'lambda_val': 0.0023999610459478756, 'batch_size': 1308, 'optimizer': 'Adam'}.
2026-05-24 08:01:54,189 - experiment_functions - INFO - Early stopping at epoch 2350. Best Metrics: (0.07145316809131669, 0.03060430463576159, 0.06323907269014262)
2026-05-24 08:01:54,280 - optuna.study.study - INFO - Trial 252 finished with values: [0.07145316809131669, 0.03060430463576159, 0.06323907269014262] and parameters: {'n_layers': 1, 'embedding_dim': 64, 'lr': 0.0004427403826510948, 'lambda_val': 2.0994584641442947e-06, 'batch_size': 803, 'optimizer': 'Adam'}.
2026-05-24 08:02:05,571 - experiment_functions - INFO - Early stopping at epoch 950. Best Metrics: (0.005163046317094109, 0.004437086092715233, 0.005577523307405523)
2026-05-24 08:02:06,422 - optuna.study.study - INFO - Trial 253 finished with values: [0.005163046317094109, 0.004437086092715233, 0.005577523307405523] and parameters: {'n_layers': 1, 'embedding_dim': 96, 'lr': 0.06835345119722092, 'lambda_val': 2.4948249425733372e-05, 'batch_size': 3042, 'optimizer': 'SGD'}.
2026-05-24 08:02:54,481 - optuna.study.study - INFO - Trial 254 finished with values: [0.07082258425976079, 0.032011589403973514, 0.06397473771361141] and parameters: {'n_layers': 1, 'embedding_dim': 96, 'lr': 0.0003154862248546408, 'lambda_val': 1.1068932700778532e-05, 'batch_size': 803, 'optimizer': 'Adam'}.
2026-05-24 08:03:00,716 - experiment_functions - INFO - Early stopping at epoch 500. Best Metrics: (0.005554677143258815, 0.004544701986754968, 0.005853328777420779)
2026-05-24 08:03:00,818 - optuna.study.study - INFO - Trial 255 finished with values: [0.005554677143258815, 0.004544701986754968, 0.005853328777420779] and parameters: {'n_layers': 1, 'embedding_dim': 32, 'lr': 0.0014509434531037974, 'lambda_val': 2.4948249425733372e-05, 'batch_size': 959, 'optimizer': 'SGD'}.
2026-05-24 08:03:14,065 - experiment_functions - INFO - Early stopping at epoch 850. Best Metrics: (0.05194725537858147, 0.024983443708609273, 0.04832357499239916)
2026-05-24 08:03:14,154 - optuna.study.study - INFO - Trial 256 finished with values: [0.05194725537858147, 0.024983443708609273, 0.04832357499239916] and parameters: {'n_layers': 2, 'embedding_dim': 256, 'lr': 0.0003011218964378633, 'lambda_val': 1.743597466559768e-05, 'batch_size': 3507, 'optimizer': 'Adam'}.
2026-05-24 08:03:28,244 - experiment_functions - INFO - Early stopping at epoch 1000. Best Metrics: (0.07028130158671093, 0.030579470198675494, 0.06022556189003951)
2026-05-24 08:03:28,982 - optuna.study.study - INFO - Trial 257 finished with values: [0.07028130158671093, 0.030579470198675494, 0.06022556189003951] and parameters: {'n_layers': 1, 'embedding_dim': 256, 'lr': 0.0004427403826510948, 'lambda_val': 2.4948249425733372e-05, 'batch_size': 3042, 'optimizer': 'Adam'}.
2026-05-24 08:03:37,197 - experiment_functions - INFO - Early stopping at epoch 550. Best Metrics: (0.0641784160275854, 0.023940397350993382, 0.05084883104594067)
2026-05-24 08:03:37,291 - optuna.study.study - INFO - Trial 258 finished with values: [0.0641784160275854, 0.023940397350993382, 0.05084883104594067] and parameters: {'n_layers': 1, 'embedding_dim': 256, 'lr': 0.0014509434531037974, 'lambda_val': 0.0023999610459478756, 'batch_size': 3507, 'optimizer': 'RMSprop'}.
2026-05-24 08:03:57,914 - experiment_functions - INFO - Early stopping at epoch 1700. Best Metrics: (0.06707346875961212, 0.027955298013245037, 0.05737679838954253)
2026-05-24 08:03:58,410 - optuna.study.study - INFO - Trial 259 finished with values: [0.06707346875961212, 0.027955298013245037, 0.05737679838954253] and parameters: {'n_layers': 1, 'embedding_dim': 96, 'lr': 0.0004427403826510948, 'lambda_val': 0.011765877703493879, 'batch_size': 808, 'optimizer': 'Adam'}.
2026-05-24 08:04:06,105 - experiment_functions - INFO - Early stopping at epoch 550. Best Metrics: (0.05963301038708595, 0.026688741721854304, 0.05323292830947962)
2026-05-24 08:04:06,212 - optuna.study.study - INFO - Trial 260 finished with values: [0.05963301038708595, 0.026688741721854304, 0.05323292830947962] and parameters: {'n_layers': 1, 'embedding_dim': 96, 'lr': 0.0014509434531037974, 'lambda_val': 2.4948249425733372e-05, 'batch_size': 2437, 'optimizer': 'RMSprop'}.
2026-05-24 08:04:21,247 - experiment_functions - INFO - Early stopping at epoch 1200. Best Metrics: (0.06472889196223895, 0.031175496688741724, 0.0580095400216318)
2026-05-24 08:04:21,976 - optuna.study.study - INFO - Trial 261 finished with values: [0.06472889196223895, 0.031175496688741724, 0.0580095400216318] and parameters: {'n_layers': 1, 'embedding_dim': 32, 'lr': 0.0004427403826510948, 'lambda_val': 0.0023999610459478756, 'batch_size': 3042, 'optimizer': 'Adam'}.
2026-05-24 08:04:31,957 - experiment_functions - INFO - Early stopping at epoch 800. Best Metrics: (0.005659761068027222, 0.004627483443708609, 0.0059279870379395725)
2026-05-24 08:04:32,061 - optuna.study.study - INFO - Trial 262 finished with values: [0.005659761068027222, 0.004627483443708609, 0.0059279870379395725] and parameters: {'n_layers': 1, 'embedding_dim': 96, 'lr': 2.1398716251163463e-05, 'lambda_val': 0.0003443593187809489, 'batch_size': 2201, 'optimizer': 'Adam'}.
2026-05-24 08:04:45,949 - experiment_functions - INFO - Early stopping at epoch 1000. Best Metrics: (0.06571289620147862, 0.027218543046357617, 0.05809647646045636)
2026-05-24 08:04:46,040 - optuna.study.study - INFO - Trial 263 finished with values: [0.06571289620147862, 0.027218543046357617, 0.05809647646045636] and parameters: {'n_layers': 1, 'embedding_dim': 256, 'lr': 0.0004427403826510948, 'lambda_val': 0.0001819760529014093, 'batch_size': 3507, 'optimizer': 'Adam'}.
2026-05-24 08:04:54,107 - experiment_functions - INFO - Early stopping at epoch 600. Best Metrics: (0.05458014908853261, 0.022806291390728477, 0.04732559638143592)
2026-05-24 08:04:54,212 - optuna.study.study - INFO - Trial 264 finished with values: [0.05458014908853261, 0.022806291390728477, 0.04732559638143592] and parameters: {'n_layers': 1, 'embedding_dim': 32, 'lr': 0.0014509434531037974, 'lambda_val': 0.0023999610459478756, 'batch_size': 2437, 'optimizer': 'RMSprop'}.
2026-05-24 08:05:10,349 - experiment_functions - INFO - Early stopping at epoch 1300. Best Metrics: (0.067151934733193, 0.029619205298013245, 0.0598502012947206)
2026-05-24 08:05:10,559 - optuna.study.study - INFO - Trial 265 finished with values: [0.067151934733193, 0.029619205298013245, 0.0598502012947206] and parameters: {'n_layers': 1, 'embedding_dim': 64, 'lr': 0.00034776281673029824, 'lambda_val': 1.738534368780138e-05, 'batch_size': 4089, 'optimizer': 'Adam'}.
2026-05-24 08:05:19,964 - experiment_functions - INFO - Early stopping at epoch 700. Best Metrics: (0.04132461131460237, 0.012632450331125828, 0.027346978345376263)
2026-05-24 08:05:20,457 - optuna.study.study - INFO - Trial 266 finished with values: [0.04132461131460237, 0.012632450331125828, 0.027346978345376263] and parameters: {'n_layers': 1, 'embedding_dim': 32, 'lr': 0.031181557217089314, 'lambda_val': 2.148149531657836e-05, 'batch_size': 3968, 'optimizer': 'Adam'}.
2026-05-24 08:05:48,142 - experiment_functions - INFO - Early stopping at epoch 2300. Best Metrics: (0.06605867018751331, 0.02860927152317881, 0.056769991101271726)
2026-05-24 08:05:48,228 - optuna.study.study - INFO - Trial 267 finished with values: [0.06605867018751331, 0.02860927152317881, 0.056769991101271726] and parameters: {'n_layers': 1, 'embedding_dim': 32, 'lr': 0.0004427403826510948, 'lambda_val': 0.005784834603301849, 'batch_size': 1257, 'optimizer': 'RMSprop'}.
2026-05-24 08:06:34,672 - optuna.study.study - INFO - Trial 268 finished with values: [0.04425034506725911, 0.02392384105960265, 0.044192293586776565] and parameters: {'n_layers': 1, 'embedding_dim': 96, 'lr': 0.00022442725513326185, 'lambda_val': 6.417173701743343e-05, 'batch_size': 803, 'optimizer': 'Adam'}.
2026-05-24 08:06:44,210 - experiment_functions - INFO - Early stopping at epoch 650. Best Metrics: (0.04785217079737429, 0.023112582781456958, 0.04396240053561932)
2026-05-24 08:06:44,690 - optuna.study.study - INFO - Trial 269 finished with values: [0.04785217079737429, 0.023112582781456958, 0.04396240053561932] and parameters: {'n_layers': 2, 'embedding_dim': 128, 'lr': 0.0004427403826510948, 'lambda_val': 0.0023999610459478756, 'batch_size': 3507, 'optimizer': 'RMSprop'}.
2026-05-24 08:06:59,947 - experiment_functions - INFO - Early stopping at epoch 1200. Best Metrics: (0.05605302650348886, 0.025951986754966887, 0.05021001662104347)
