2026-05-24 16:31:01,316 - optuna.study.study - INFO - Trial 215 finished with values: [0.030253288193901842, 0.009718543046357617, 0.020671735684349588] and parameters: {'n_layers': 2, 'embedding_dim': 96, 'lr': 0.00034279930379767936, 'lambda_val': 4.9612924956814075e-05, 'batch_size': 2616, 'optimizer': 'RMSprop'}.
2026-05-24 16:31:09,318 - experiment_functions - INFO - Early stopping at epoch 650. Best Metrics: (0.04205099891510524, 0.012549668874172188, 0.03178433507080461)
2026-05-24 16:31:09,451 - optuna.study.study - INFO - Trial 216 finished with values: [0.04205099891510524, 0.012549668874172188, 0.03178433507080461] and parameters: {'n_layers': 1, 'embedding_dim': 96, 'lr': 0.0010413911280538683, 'lambda_val': 0.0005068128991295962, 'batch_size': 1204, 'optimizer': 'Adam'}.
2026-05-24 16:31:15,841 - experiment_functions - INFO - Early stopping at epoch 500. Best Metrics: (0.004854688917298554, 0.0040149006622516555, 0.005234772622560687)
2026-05-24 16:31:15,927 - optuna.study.study - INFO - Trial 217 finished with values: [0.004854688917298554, 0.0040149006622516555, 0.005234772622560687] and parameters: {'n_layers': 1, 'embedding_dim': 64, 'lr': 0.00014827150350050635, 'lambda_val': 5.897592552004812e-06, 'batch_size': 1909, 'optimizer': 'SGD'}.
2026-05-24 16:31:24,386 - experiment_functions - INFO - Early stopping at epoch 700. Best Metrics: (0.005462235160445826, 0.00412251655629139, 0.005332519764777114)
2026-05-24 16:31:24,471 - optuna.study.study - INFO - Trial 218 finished with values: [0.005462235160445826, 0.00412251655629139, 0.005332519764777114] and parameters: {'n_layers': 1, 'embedding_dim': 96, 'lr': 0.002629136506264111, 'lambda_val': 1.1519026320311991e-06, 'batch_size': 1204, 'optimizer': 'SGD'}.
2026-05-24 16:32:09,081 - optuna.study.study - INFO - Trial 219 finished with values: [0.043293878685123174, 0.012764900662251655, 0.03338161093897856] and parameters: {'n_layers': 1, 'embedding_dim': 128, 'lr': 0.00014827150350050635, 'lambda_val': 5.897592552004812e-06, 'batch_size': 1062, 'optimizer': 'Adam'}.
2026-05-24 16:32:17,434 - experiment_functions - INFO - Early stopping at epoch 650. Best Metrics: (0.03736484062197019, 0.011564569536423843, 0.027573407568609588)
2026-05-24 16:32:17,519 - optuna.study.study - INFO - Trial 220 finished with values: [0.03736484062197019, 0.011564569536423843, 0.027573407568609588] and parameters: {'n_layers': 1, 'embedding_dim': 64, 'lr': 0.0006602503237283403, 'lambda_val': 1.662783965279686e-05, 'batch_size': 2454, 'optimizer': 'RMSprop'}.
2026-05-24 16:32:30,566 - experiment_functions - INFO - Early stopping at epoch 1100. Best Metrics: (0.04281250704002766, 0.0125, 0.03028505896064376)
2026-05-24 16:32:30,663 - optuna.study.study - INFO - Trial 221 finished with values: [0.04281250704002766, 0.0125, 0.03028505896064376] and parameters: {'n_layers': 1, 'embedding_dim': 96, 'lr': 0.00034279930379767936, 'lambda_val': 1.8863646450868505e-06, 'batch_size': 1638, 'optimizer': 'RMSprop'}.
2026-05-24 16:32:37,355 - experiment_functions - INFO - Early stopping at epoch 550. Best Metrics: (0.043067286431229514, 0.012706953642384106, 0.033588931815548916)
2026-05-24 16:32:37,448 - optuna.study.study - INFO - Trial 222 finished with values: [0.043067286431229514, 0.012706953642384106, 0.033588931815548916] and parameters: {'n_layers': 1, 'embedding_dim': 96, 'lr': 0.0038122363815175056, 'lambda_val': 1.1594147319583239e-05, 'batch_size': 1062, 'optimizer': 'Adam'}.
2026-05-24 16:32:45,176 - experiment_functions - INFO - Early stopping at epoch 600. Best Metrics: (0.03993790466472941, 0.011705298013245036, 0.030796972570101076)
2026-05-24 16:32:45,273 - optuna.study.study - INFO - Trial 223 finished with values: [0.03993790466472941, 0.011705298013245036, 0.030796972570101076] and parameters: {'n_layers': 1, 'embedding_dim': 256, 'lr': 0.0011065357159264775, 'lambda_val': 2.291507926580009e-06, 'batch_size': 1638, 'optimizer': 'Adam'}.
2026-05-24 16:32:58,535 - experiment_functions - INFO - Early stopping at epoch 1000. Best Metrics: (0.04356237826379238, 0.012748344370860927, 0.0327666622539599)
2026-05-24 16:32:58,627 - optuna.study.study - INFO - Trial 224 finished with values: [0.04356237826379238, 0.012748344370860927, 0.0327666622539599] and parameters: {'n_layers': 1, 'embedding_dim': 128, 'lr': 0.00034279930379767936, 'lambda_val': 1.1594147319583239e-05, 'batch_size': 1638, 'optimizer': 'RMSprop'}.
2026-05-24 16:33:41,690 - optuna.study.study - INFO - Trial 225 finished with values: [0.02519847154516866, 0.008832781456953641, 0.02209352134617937] and parameters: {'n_layers': 1, 'embedding_dim': 96, 'lr': 6.947279267971317e-05, 'lambda_val': 0.00017267652605927172, 'batch_size': 1909, 'optimizer': 'Adam'}.
2026-05-24 16:33:47,839 - experiment_functions - INFO - Early stopping at epoch 500. Best Metrics: (0.004617318070694919, 0.00396523178807947, 0.005059935672956701)
2026-05-24 16:33:48,314 - optuna.study.study - INFO - Trial 226 finished with values: [0.004617318070694919, 0.00396523178807947, 0.005059935672956701] and parameters: {'n_layers': 1, 'embedding_dim': 256, 'lr': 0.0012971109624756183, 'lambda_val': 0.03831150929166771, 'batch_size': 2300, 'optimizer': 'RMSprop'}.
2026-05-24 16:33:55,349 - experiment_functions - INFO - Early stopping at epoch 550. Best Metrics: (0.04036262337581389, 0.012110927152317881, 0.030624244225121586)
2026-05-24 16:33:55,437 - optuna.study.study - INFO - Trial 227 finished with values: [0.04036262337581389, 0.012110927152317881, 0.030624244225121586] and parameters: {'n_layers': 1, 'embedding_dim': 32, 'lr': 0.0038122363815175056, 'lambda_val': 3.357239469878402e-06, 'batch_size': 1062, 'optimizer': 'Adam'}.
2026-05-24 16:34:08,619 - experiment_functions - INFO - Early stopping at epoch 1100. Best Metrics: (0.04352760501020425, 0.013079470198675497, 0.03160932432865841)
2026-05-24 16:34:08,707 - optuna.study.study - INFO - Trial 228 finished with values: [0.04352760501020425, 0.013079470198675497, 0.03160932432865841] and parameters: {'n_layers': 1, 'embedding_dim': 64, 'lr': 0.0003131370011043347, 'lambda_val': 0.0008304978509047221, 'batch_size': 1463, 'optimizer': 'RMSprop'}.
2026-05-24 16:34:17,517 - experiment_functions - INFO - Early stopping at epoch 700. Best Metrics: (0.03878428744297501, 0.011680463576158942, 0.029143406785230464)
2026-05-24 16:34:17,964 - optuna.study.study - INFO - Trial 229 finished with values: [0.03878428744297501, 0.011680463576158942, 0.029143406785230464] and parameters: {'n_layers': 1, 'embedding_dim': 128, 'lr': 0.0006733149088229659, 'lambda_val': 1.6170124945691617e-05, 'batch_size': 2725, 'optimizer': 'Adam'}.
2026-05-24 16:34:24,993 - experiment_functions - INFO - Early stopping at epoch 550. Best Metrics: (0.00993226915648422, 0.004619205298013246, 0.009233205985253543)
2026-05-24 16:34:25,260 - optuna.study.study - INFO - Trial 230 finished with values: [0.00993226915648422, 0.004619205298013246, 0.009233205985253543] and parameters: {'n_layers': 4, 'embedding_dim': 32, 'lr': 0.002388717973338382, 'lambda_val': 2.0549669964750215e-06, 'batch_size': 3685, 'optimizer': 'Adam'}.
2026-05-24 16:34:32,199 - experiment_functions - INFO - Early stopping at epoch 550. Best Metrics: (0.04251090170491801, 0.012201986754966887, 0.031209176631465874)
2026-05-24 16:34:32,294 - optuna.study.study - INFO - Trial 231 finished with values: [0.04251090170491801, 0.012201986754966887, 0.031209176631465874] and parameters: {'n_layers': 1, 'embedding_dim': 128, 'lr': 0.005389293845041463, 'lambda_val': 8.546073443967033e-06, 'batch_size': 1062, 'optimizer': 'Adam'}.
2026-05-24 16:35:15,417 - optuna.study.study - INFO - Trial 232 finished with values: [0.03950057703314884, 0.012218543046357618, 0.030053138363690647] and parameters: {'n_layers': 1, 'embedding_dim': 96, 'lr': 0.00010176160914982528, 'lambda_val': 2.291507926580009e-06, 'batch_size': 1638, 'optimizer': 'RMSprop'}.
2026-05-24 16:35:23,254 - experiment_functions - INFO - Early stopping at epoch 650. Best Metrics: (0.04276139374775074, 0.012442052980132451, 0.03115878972688077)
2026-05-24 16:35:23,349 - optuna.study.study - INFO - Trial 233 finished with values: [0.04276139374775074, 0.012442052980132451, 0.03115878972688077] and parameters: {'n_layers': 1, 'embedding_dim': 128, 'lr': 0.0010413911280538683, 'lambda_val': 0.0005068128991295962, 'batch_size': 1463, 'optimizer': 'Adam'}.
2026-05-24 16:35:34,217 - experiment_functions - INFO - Early stopping at epoch 900. Best Metrics: (0.04405837981478199, 0.012814569536423842, 0.03281027050123828)
2026-05-24 16:35:34,319 - optuna.study.study - INFO - Trial 234 finished with values: [0.04405837981478199, 0.012814569536423842, 0.03281027050123828] and parameters: {'n_layers': 1, 'embedding_dim': 128, 'lr': 0.00034279930379767936, 'lambda_val': 1.1594147319583239e-05, 'batch_size': 1638, 'optimizer': 'RMSprop'}.
2026-05-24 16:35:42,197 - experiment_functions - INFO - Early stopping at epoch 600. Best Metrics: (0.010438482111986312, 0.005, 0.008667135746376538)
2026-05-24 16:35:42,278 - optuna.study.study - INFO - Trial 235 finished with values: [0.010438482111986312, 0.005, 0.008667135746376538] and parameters: {'n_layers': 4, 'embedding_dim': 64, 'lr': 0.0010413911280538683, 'lambda_val': 5.897592552004812e-06, 'batch_size': 2725, 'optimizer': 'Adam'}.
2026-05-24 16:35:49,055 - experiment_functions - INFO - Early stopping at epoch 550. Best Metrics: (0.0411277706799219, 0.011870860927152319, 0.02843843705892322)
2026-05-24 16:35:49,152 - optuna.study.study - INFO - Trial 236 finished with values: [0.0411277706799219, 0.011870860927152319, 0.02843843705892322] and parameters: {'n_layers': 1, 'embedding_dim': 96, 'lr': 0.0038122363815175056, 'lambda_val': 0.006110399049230392, 'batch_size': 1062, 'optimizer': 'Adam'}.
2026-05-24 16:35:55,075 - experiment_functions - INFO - Early stopping at epoch 500. Best Metrics: (0.005121604670705308, 0.0039817880794701995, 0.0051059107325321035)
2026-05-24 16:35:56,175 - optuna.study.study - INFO - Trial 237 finished with values: [0.005121604670705308, 0.0039817880794701995, 0.0051059107325321035] and parameters: {'n_layers': 1, 'embedding_dim': 128, 'lr': 0.00014827150350050635, 'lambda_val': 5.897592552004812e-06, 'batch_size': 2305, 'optimizer': 'SGD'}.
2026-05-24 16:36:02,196 - experiment_functions - INFO - Early stopping at epoch 500. Best Metrics: (0.0050882651701180505, 0.004188741721854306, 0.005334573359857799)
2026-05-24 16:36:03,344 - optuna.study.study - INFO - Trial 238 finished with values: [0.0050882651701180505, 0.004188741721854306, 0.005334573359857799] and parameters: {'n_layers': 1, 'embedding_dim': 96, 'lr': 0.005676961555550774, 'lambda_val': 4.9612924956814075e-05, 'batch_size': 1097, 'optimizer': 'SGD'}.
2026-05-24 16:36:26,547 - experiment_functions - INFO - Early stopping at epoch 2050. Best Metrics: (0.04533025949842888, 0.013153973509933775, 0.030814831024993966)
2026-05-24 16:36:26,632 - optuna.study.study - INFO - Trial 239 finished with values: [0.04533025949842888, 0.013153973509933775, 0.030814831024993966] and parameters: {'n_layers': 1, 'embedding_dim': 32, 'lr': 0.0003131370011043347, 'lambda_val': 0.00017267652605927172, 'batch_size': 2918, 'optimizer': 'RMSprop'}.
2026-05-24 16:36:34,612 - experiment_functions - INFO - Early stopping at epoch 550. Best Metrics: (0.04140017773481052, 0.011862582781456955, 0.03203689907448401)
2026-05-24 16:36:34,711 - optuna.study.study - INFO - Trial 240 finished with values: [0.04140017773481052, 0.011862582781456955, 0.03203689907448401] and parameters: {'n_layers': 1, 'embedding_dim': 96, 'lr': 0.00532575854276696, 'lambda_val': 2.291507926580009e-06, 'batch_size': 1638, 'optimizer': 'Adam'}.
2026-05-24 16:36:41,595 - experiment_functions - INFO - Early stopping at epoch 550. Best Metrics: (0.027339535866044526, 0.008096026490066226, 0.016211788104095078)
2026-05-24 16:36:42,244 - optuna.study.study - INFO - Trial 241 finished with values: [0.027339535866044526, 0.008096026490066226, 0.016211788104095078] and parameters: {'n_layers': 1, 'embedding_dim': 96, 'lr': 0.005676961555550774, 'lambda_val': 0.002332362722517884, 'batch_size': 2677, 'optimizer': 'Adam'}.
2026-05-24 16:36:53,385 - experiment_functions - INFO - Early stopping at epoch 950. Best Metrics: (0.042909897891953284, 0.012541390728476822, 0.03249818886578946)
2026-05-24 16:36:53,734 - optuna.study.study - INFO - Trial 242 finished with values: [0.042909897891953284, 0.012541390728476822, 0.03249818886578946] and parameters: {'n_layers': 1, 'embedding_dim': 128, 'lr': 0.00034279930379767936, 'lambda_val': 5.897592552004812e-06, 'batch_size': 1638, 'optimizer': 'RMSprop'}.
2026-05-24 16:37:01,388 - experiment_functions - INFO - Early stopping at epoch 600. Best Metrics: (0.03817279425952312, 0.011746688741721854, 0.02913486540345258)
2026-05-24 16:37:01,466 - optuna.study.study - INFO - Trial 243 finished with values: [0.03817279425952312, 0.011746688741721854, 0.02913486540345258] and parameters: {'n_layers': 2, 'embedding_dim': 128, 'lr': 0.0010413911280538683, 'lambda_val': 5.897592552004812e-06, 'batch_size': 1062, 'optimizer': 'Adam'}.
2026-05-24 16:37:11,517 - experiment_functions - INFO - Early stopping at epoch 750. Best Metrics: (0.034015883735895994, 0.010463576158940398, 0.02391298419746182)
2026-05-24 16:37:12,095 - optuna.study.study - INFO - Trial 244 finished with values: [0.034015883735895994, 0.010463576158940398, 0.02391298419746182] and parameters: {'n_layers': 2, 'embedding_dim': 128, 'lr': 0.00034279930379767936, 'lambda_val': 0.0005068128991295962, 'batch_size': 1062, 'optimizer': 'RMSprop'}.
2026-05-24 16:37:18,922 - experiment_functions - INFO - Early stopping at epoch 550. Best Metrics: (0.0363623758997472, 0.010695364238410597, 0.029582810024419332)
2026-05-24 16:37:19,744 - optuna.study.study - INFO - Trial 245 finished with values: [0.0363623758997472, 0.010695364238410597, 0.029582810024419332] and parameters: {'n_layers': 1, 'embedding_dim': 64, 'lr': 0.002629136506264111, 'lambda_val': 4.072777256931323e-06, 'batch_size': 2916, 'optimizer': 'Adam'}.
2026-05-24 16:37:32,345 - experiment_functions - INFO - Early stopping at epoch 1100. Best Metrics: (0.043898931891116245, 0.013129139072847684, 0.031968769140501174)
2026-05-24 16:37:32,442 - optuna.study.study - INFO - Trial 246 finished with values: [0.043898931891116245, 0.013129139072847684, 0.031968769140501174] and parameters: {'n_layers': 1, 'embedding_dim': 128, 'lr': 0.00034279930379767936, 'lambda_val': 3.1769341559608166e-05, 'batch_size': 1178, 'optimizer': 'Adam'}.
2026-05-24 16:38:02,940 - experiment_functions - INFO - Early stopping at epoch 2750. Best Metrics: (0.0434193734974395, 0.013178807947019866, 0.0329245329844799)
2026-05-24 16:38:03,293 - optuna.study.study - INFO - Trial 247 finished with values: [0.0434193734974395, 0.013178807947019866, 0.0329245329844799] and parameters: {'n_layers': 1, 'embedding_dim': 128, 'lr': 0.00014827150350050635, 'lambda_val': 0.002332362722517884, 'batch_size': 1062, 'optimizer': 'Adam'}.
2026-05-24 16:38:10,050 - experiment_functions - INFO - Early stopping at epoch 550. Best Metrics: (0.04272429989438276, 0.012665562913907285, 0.031101039393838445)
2026-05-24 16:38:10,478 - optuna.study.study - INFO - Trial 248 finished with values: [0.04272429989438276, 0.012665562913907285, 0.031101039393838445] and parameters: {'n_layers': 1, 'embedding_dim': 128, 'lr': 0.00532575854276696, 'lambda_val': 1.1594147319583239e-05, 'batch_size': 1235, 'optimizer': 'Adam'}.
2026-05-24 16:38:55,149 - optuna.study.study - INFO - Trial 249 finished with values: [0.031758651437265854, 0.01009933774834437, 0.02259624278777928] and parameters: {'n_layers': 3, 'embedding_dim': 96, 'lr': 0.00014827150350050635, 'lambda_val': 4.9612924956814075e-05, 'batch_size': 1178, 'optimizer': 'Adam'}.
2026-05-24 16:39:02,203 - experiment_functions - INFO - Early stopping at epoch 550. Best Metrics: (0.009458968831139385, 0.004271523178807947, 0.0060500933208100256)
2026-05-24 16:39:02,703 - optuna.study.study - INFO - Trial 250 finished with values: [0.009458968831139385, 0.004271523178807947, 0.0060500933208100256] and parameters: {'n_layers': 2, 'embedding_dim': 128, 'lr': 0.0017428061762574927, 'lambda_val': 5.897592552004812e-06, 'batch_size': 1178, 'optimizer': 'RMSprop'}.
2026-05-24 16:39:27,365 - experiment_functions - INFO - Early stopping at epoch 2100. Best Metrics: (0.016045583312019426, 0.006158940397350994, 0.011510953747081)
2026-05-24 16:39:27,455 - optuna.study.study - INFO - Trial 251 finished with values: [0.016045583312019426, 0.006158940397350994, 0.011510953747081] and parameters: {'n_layers': 3, 'embedding_dim': 128, 'lr': 0.00014827150350050635, 'lambda_val': 0.0008056399052222321, 'batch_size': 2853, 'optimizer': 'Adam'}.
2026-05-24 16:39:40,275 - experiment_functions - INFO - Early stopping at epoch 1100. Best Metrics: (0.04248206647104727, 0.012607615894039735, 0.03230389786854411)
2026-05-24 16:39:40,433 - optuna.study.study - INFO - Trial 252 finished with values: [0.04248206647104727, 0.012607615894039735, 0.03230389786854411] and parameters: {'n_layers': 1, 'embedding_dim': 128, 'lr': 0.0003131370011043347, 'lambda_val': 5.17889815615002e-06, 'batch_size': 1463, 'optimizer': 'Adam'}.
2026-05-24 16:39:52,252 - experiment_functions - INFO - Early stopping at epoch 1000. Best Metrics: (0.042625226118861874, 0.012649006622516556, 0.031837428633749054)
2026-05-24 16:39:52,332 - optuna.study.study - INFO - Trial 253 finished with values: [0.042625226118861874, 0.012649006622516556, 0.031837428633749054] and parameters: {'n_layers': 1, 'embedding_dim': 96, 'lr': 0.00034279930379767936, 'lambda_val': 4.9612924956814075e-05, 'batch_size': 1178, 'optimizer': 'Adam'}.
2026-05-24 16:40:21,008 - experiment_functions - INFO - Early stopping at epoch 2650. Best Metrics: (0.04662436327054797, 0.014644039735099338, 0.03393262858162574)
2026-05-24 16:40:21,336 - optuna.study.study - INFO - Trial 254 finished with values: [0.04662436327054797, 0.014644039735099338, 0.03393262858162574] and parameters: {'n_layers': 1, 'embedding_dim': 32, 'lr': 0.0003131370011043347, 'lambda_val': 5.897592552004812e-06, 'batch_size': 1062, 'optimizer': 'RMSprop'}.
2026-05-24 16:40:56,855 - experiment_functions - INFO - Early stopping at epoch 3250. Best Metrics: (0.04492431131108994, 0.013385761589403975, 0.03340340729719895)
2026-05-24 16:40:57,655 - optuna.study.study - INFO - Trial 255 finished with values: [0.04492431131108994, 0.013385761589403975, 0.03340340729719895] and parameters: {'n_layers': 1, 'embedding_dim': 128, 'lr': 0.00014827150350050635, 'lambda_val': 1.6170124945691617e-05, 'batch_size': 1097, 'optimizer': 'RMSprop'}.
2026-05-24 16:41:20,694 - experiment_functions - INFO - Early stopping at epoch 2050. Best Metrics: (0.043372041376996275, 0.012814569536423842, 0.03232801206350867)
2026-05-24 16:41:20,789 - optuna.study.study - INFO - Trial 256 finished with values: [0.043372041376996275, 0.012814569536423842, 0.03232801206350867] and parameters: {'n_layers': 1, 'embedding_dim': 128, 'lr': 0.00014827150350050635, 'lambda_val': 0.002332362722517884, 'batch_size': 1062, 'optimizer': 'RMSprop'}.
2026-05-24 16:41:27,760 - experiment_functions - INFO - Early stopping at epoch 550. Best Metrics: (0.01981449126101727, 0.007317880794701987, 0.015164261229870834)
2026-05-24 16:41:28,049 - optuna.study.study - INFO - Trial 257 finished with values: [0.01981449126101727, 0.007317880794701987, 0.015164261229870834] and parameters: {'n_layers': 3, 'embedding_dim': 96, 'lr': 0.0023172852480584285, 'lambda_val': 0.0038402692954625658, 'batch_size': 769, 'optimizer': 'Adam'}.
2026-05-24 16:42:12,212 - optuna.study.study - INFO - Trial 258 finished with values: [0.04473339931683266, 0.013269867549668876, 0.03298960255221732] and parameters: {'n_layers': 1, 'embedding_dim': 96, 'lr': 0.00014827150350050635, 'lambda_val': 3.357239469878402e-06, 'batch_size': 1669, 'optimizer': 'RMSprop'}.
2026-05-24 16:42:55,773 - optuna.study.study - INFO - Trial 259 finished with values: [0.04117351711999053, 0.012524834437086093, 0.029407001155145537] and parameters: {'n_layers': 1, 'embedding_dim': 32, 'lr': 0.00018076016503271015, 'lambda_val': 0.0038402692954625658, 'batch_size': 1638, 'optimizer': 'Adam'}.
2026-05-24 16:43:02,590 - experiment_functions - INFO - Early stopping at epoch 550. Best Metrics: (0.01431665886065226, 0.0047764900662251655, 0.008745007364111)
2026-05-24 16:43:02,807 - optuna.study.study - INFO - Trial 260 finished with values: [0.01431665886065226, 0.0047764900662251655, 0.008745007364111] and parameters: {'n_layers': 1, 'embedding_dim': 128, 'lr': 0.0038122363815175056, 'lambda_val': 1.6170124945691617e-05, 'batch_size': 1062, 'optimizer': 'RMSprop'}.
2026-05-24 16:43:30,703 - experiment_functions - INFO - Early stopping at epoch 2450. Best Metrics: (0.04526734219770392, 0.013278145695364238, 0.02769218139815982)
2026-05-24 16:43:30,788 - optuna.study.study - INFO - Trial 261 finished with values: [0.04526734219770392, 0.013278145695364238, 0.02769218139815982] and parameters: {'n_layers': 1, 'embedding_dim': 32, 'lr': 0.00034279930379767936, 'lambda_val': 3.357239469878402e-06, 'batch_size': 3709, 'optimizer': 'RMSprop'}.
2026-05-24 16:43:41,576 - experiment_functions - INFO - Early stopping at epoch 900. Best Metrics: (0.042857414976241674, 0.013013245033112584, 0.032311058877036655)
2026-05-24 16:43:42,195 - optuna.study.study - INFO - Trial 262 finished with values: [0.042857414976241674, 0.013013245033112584, 0.032311058877036655] and parameters: {'n_layers': 1, 'embedding_dim': 96, 'lr': 0.00034279930379767936, 'lambda_val': 0.002332362722517884, 'batch_size': 1062, 'optimizer': 'RMSprop'}.
2026-05-24 16:43:54,744 - experiment_functions - INFO - Early stopping at epoch 1050. Best Metrics: (0.043376747311383676, 0.013071192052980133, 0.03455037524777597)
