2026-05-24 05:48:21,428 - optuna.study.study - INFO - Trial 144 finished with values: [0.011953826261405615, 0.008245033112582782, 0.011686040732258839] and parameters: {'n_layers': 2, 'embedding_dim': 128, 'lr': 7.368781109705397e-05, 'lambda_val': 0.002110272822989257, 'batch_size': 3131, 'optimizer': 'RMSprop'}.
2026-05-24 05:48:28,659 - experiment_functions - INFO - Early stopping at epoch 550. Best Metrics: (0.015372532733599582, 0.012566225165562914, 0.01592756764668111)
2026-05-24 05:48:28,764 - optuna.study.study - INFO - Trial 145 finished with values: [0.015372532733599582, 0.012566225165562914, 0.01592756764668111] and parameters: {'n_layers': 4, 'embedding_dim': 128, 'lr': 0.009667197874531769, 'lambda_val': 0.00039316400466458875, 'batch_size': 1612, 'optimizer': 'Adam'}.
2026-05-24 05:48:40,950 - experiment_functions - INFO - Early stopping at epoch 1000. Best Metrics: (0.016825228598556584, 0.013112582781456956, 0.01746774888186263)
2026-05-24 05:48:41,052 - optuna.study.study - INFO - Trial 146 finished with values: [0.016825228598556584, 0.013112582781456956, 0.01746774888186263] and parameters: {'n_layers': 2, 'embedding_dim': 64, 'lr': 0.0004890104603780292, 'lambda_val': 0.007620237155778278, 'batch_size': 2878, 'optimizer': 'RMSprop'}.
2026-05-24 05:48:48,804 - experiment_functions - INFO - Early stopping at epoch 600. Best Metrics: (0.01741949360697455, 0.012417218543046357, 0.01718637838791068)
2026-05-24 05:48:48,912 - optuna.study.study - INFO - Trial 147 finished with values: [0.01741949360697455, 0.012417218543046357, 0.01718637838791068] and parameters: {'n_layers': 1, 'embedding_dim': 96, 'lr': 0.001136165578538667, 'lambda_val': 3.1472646005870695e-06, 'batch_size': 2578, 'optimizer': 'RMSprop'}.
2026-05-24 05:49:00,057 - experiment_functions - INFO - Early stopping at epoch 950. Best Metrics: (0.006101384329129788, 0.004031456953642384, 0.005533306043063215)
2026-05-24 05:49:00,172 - optuna.study.study - INFO - Trial 148 finished with values: [0.006101384329129788, 0.004031456953642384, 0.005533306043063215] and parameters: {'n_layers': 3, 'embedding_dim': 64, 'lr': 0.004512010550703536, 'lambda_val': 0.0028168727253759383, 'batch_size': 3666, 'optimizer': 'SGD'}.
2026-05-24 05:49:15,214 - experiment_functions - INFO - Early stopping at epoch 1250. Best Metrics: (0.018263339010849068, 0.012913907284768211, 0.017964041401566835)
2026-05-24 05:49:16,241 - optuna.study.study - INFO - Trial 149 finished with values: [0.018263339010849068, 0.012913907284768211, 0.017964041401566835] and parameters: {'n_layers': 2, 'embedding_dim': 96, 'lr': 0.0004890104603780292, 'lambda_val': 5.78540826635863e-05, 'batch_size': 2716, 'optimizer': 'RMSprop'}.
2026-05-24 05:49:26,540 - experiment_functions - INFO - Early stopping at epoch 500. Best Metrics: (0.005025818136633808, 0.004337748344370861, 0.005183658248092138)
2026-05-24 05:49:26,642 - optuna.study.study - INFO - Trial 150 finished with values: [0.005025818136633808, 0.004337748344370861, 0.005183658248092138] and parameters: {'n_layers': 2, 'embedding_dim': 64, 'lr': 0.0002909391164072771, 'lambda_val': 0.004830254272011785, 'batch_size': 3218, 'optimizer': 'SGD'}.
2026-05-24 05:49:39,632 - experiment_functions - INFO - Early stopping at epoch 1100. Best Metrics: (0.019892325867677703, 0.013990066225165562, 0.01982325422820502)
2026-05-24 05:49:39,743 - optuna.study.study - INFO - Trial 151 finished with values: [0.019892325867677703, 0.013990066225165562, 0.01982325422820502] and parameters: {'n_layers': 1, 'embedding_dim': 32, 'lr': 0.0007276922065688508, 'lambda_val': 0.00013892846035396848, 'batch_size': 2492, 'optimizer': 'Adam'}.
2026-05-24 05:49:55,038 - experiment_functions - INFO - Early stopping at epoch 1250. Best Metrics: (0.014948218520647592, 0.011523178807947022, 0.015055114765533428)
2026-05-24 05:49:55,874 - optuna.study.study - INFO - Trial 152 finished with values: [0.014948218520647592, 0.011523178807947022, 0.015055114765533428] and parameters: {'n_layers': 2, 'embedding_dim': 256, 'lr': 0.000312176782836151, 'lambda_val': 7.112074068161609e-06, 'batch_size': 3889, 'optimizer': 'RMSprop'}.
2026-05-24 05:50:02,323 - experiment_functions - INFO - Early stopping at epoch 500. Best Metrics: (0.005566112379642507, 0.004329470198675497, 0.005410892164022076)
2026-05-24 05:50:02,423 - optuna.study.study - INFO - Trial 153 finished with values: [0.005566112379642507, 0.004329470198675497, 0.005410892164022076] and parameters: {'n_layers': 1, 'embedding_dim': 32, 'lr': 0.0003788253863598979, 'lambda_val': 0.000940022364689935, 'batch_size': 2144, 'optimizer': 'SGD'}.
2026-05-24 05:50:19,868 - experiment_functions - INFO - Early stopping at epoch 1500. Best Metrics: (0.020078198625326005, 0.013899006622516558, 0.019169819466556014)
2026-05-24 05:50:19,964 - optuna.study.study - INFO - Trial 154 finished with values: [0.020078198625326005, 0.013899006622516558, 0.019169819466556014] and parameters: {'n_layers': 1, 'embedding_dim': 32, 'lr': 0.0004890104603780292, 'lambda_val': 0.007620237155778278, 'batch_size': 2492, 'optimizer': 'Adam'}.
2026-05-24 05:50:27,096 - experiment_functions - INFO - Early stopping at epoch 550. Best Metrics: (0.018717393517632373, 0.014817880794701987, 0.019697989575373352)
2026-05-24 05:50:27,199 - optuna.study.study - INFO - Trial 155 finished with values: [0.018717393517632373, 0.014817880794701987, 0.019697989575373352] and parameters: {'n_layers': 4, 'embedding_dim': 64, 'lr': 0.004512010550703536, 'lambda_val': 0.0028168727253759383, 'batch_size': 1264, 'optimizer': 'Adam'}.
2026-05-24 05:50:42,483 - experiment_functions - INFO - Early stopping at epoch 1300. Best Metrics: (0.01908689470739076, 0.014213576158940396, 0.01971488975155803)
2026-05-24 05:50:42,645 - optuna.study.study - INFO - Trial 156 finished with values: [0.01908689470739076, 0.014213576158940396, 0.01971488975155803] and parameters: {'n_layers': 2, 'embedding_dim': 128, 'lr': 0.0004890104603780292, 'lambda_val': 5.78540826635863e-05, 'batch_size': 1612, 'optimizer': 'RMSprop'}.
2026-05-24 05:51:16,441 - experiment_functions - INFO - Early stopping at epoch 2850. Best Metrics: (0.0209489089412513, 0.015736754966887416, 0.022181704569851444)
2026-05-24 05:51:16,529 - optuna.study.study - INFO - Trial 157 finished with values: [0.0209489089412513, 0.015736754966887416, 0.022181704569851444] and parameters: {'n_layers': 2, 'embedding_dim': 32, 'lr': 0.0004890104603780292, 'lambda_val': 0.0028168727253759383, 'batch_size': 1264, 'optimizer': 'Adam'}.
2026-05-24 05:51:23,616 - experiment_functions - INFO - Early stopping at epoch 550. Best Metrics: (0.019128991683311676, 0.014966887417218544, 0.020007647903654918)
2026-05-24 05:51:23,726 - optuna.study.study - INFO - Trial 158 finished with values: [0.019128991683311676, 0.014966887417218544, 0.020007647903654918] and parameters: {'n_layers': 4, 'embedding_dim': 64, 'lr': 0.007122747338051435, 'lambda_val': 0.0028168727253759383, 'batch_size': 1264, 'optimizer': 'Adam'}.
2026-05-24 05:52:09,452 - optuna.study.study - INFO - Trial 159 finished with values: [0.018138081061803476, 0.013576158940397352, 0.01846585830769761] and parameters: {'n_layers': 2, 'embedding_dim': 32, 'lr': 0.0002909391164072771, 'lambda_val': 5.78540826635863e-05, 'batch_size': 2716, 'optimizer': 'Adam'}.
2026-05-24 05:52:15,882 - experiment_functions - INFO - Early stopping at epoch 500. Best Metrics: (0.005609601002356641, 0.004089403973509934, 0.005506312139417864)
2026-05-24 05:52:16,323 - optuna.study.study - INFO - Trial 160 finished with values: [0.005609601002356641, 0.004089403973509934, 0.005506312139417864] and parameters: {'n_layers': 4, 'embedding_dim': 32, 'lr': 0.0004890104603780292, 'lambda_val': 3.818491544875538e-05, 'batch_size': 2716, 'optimizer': 'SGD'}.
2026-05-24 05:52:27,325 - experiment_functions - INFO - Early stopping at epoch 800. Best Metrics: (0.015616818914211161, 0.013716887417218541, 0.016757568808849946)
2026-05-24 05:52:28,595 - optuna.study.study - INFO - Trial 161 finished with values: [0.015616818914211161, 0.013716887417218541, 0.016757568808849946] and parameters: {'n_layers': 4, 'embedding_dim': 256, 'lr': 0.0004890104603780292, 'lambda_val': 0.010248606541800688, 'batch_size': 2492, 'optimizer': 'Adam'}.
2026-05-24 05:52:35,769 - experiment_functions - INFO - Early stopping at epoch 550. Best Metrics: (0.011151483081707833, 0.009130794701986756, 0.011378617150118087)
2026-05-24 05:52:36,207 - optuna.study.study - INFO - Trial 162 finished with values: [0.011151483081707833, 0.009130794701986756, 0.011378617150118087] and parameters: {'n_layers': 4, 'embedding_dim': 128, 'lr': 0.00567629368896096, 'lambda_val': 5.78540826635863e-05, 'batch_size': 1575, 'optimizer': 'RMSprop'}.
2026-05-24 05:52:50,170 - experiment_functions - INFO - Early stopping at epoch 1150. Best Metrics: (0.01870470831050536, 0.014991721854304637, 0.01984326705866002)
2026-05-24 05:52:50,270 - optuna.study.study - INFO - Trial 163 finished with values: [0.01870470831050536, 0.014991721854304637, 0.01984326705866002] and parameters: {'n_layers': 3, 'embedding_dim': 96, 'lr': 0.0004890104603780292, 'lambda_val': 5.78540826635863e-05, 'batch_size': 2144, 'optimizer': 'Adam'}.
2026-05-24 05:52:58,443 - experiment_functions - INFO - Early stopping at epoch 650. Best Metrics: (0.018804328388689433, 0.01396523178807947, 0.01931513762330193)
2026-05-24 05:52:58,577 - optuna.study.study - INFO - Trial 164 finished with values: [0.018804328388689433, 0.01396523178807947, 0.01931513762330193] and parameters: {'n_layers': 1, 'embedding_dim': 32, 'lr': 0.0034008688244003345, 'lambda_val': 0.0028168727253759383, 'batch_size': 1501, 'optimizer': 'Adam'}.
2026-05-24 05:53:06,259 - experiment_functions - INFO - Early stopping at epoch 600. Best Metrics: (0.018067584669242676, 0.013269867549668876, 0.01870360459301713)
2026-05-24 05:53:06,371 - optuna.study.study - INFO - Trial 165 finished with values: [0.018067584669242676, 0.013269867549668876, 0.01870360459301713] and parameters: {'n_layers': 1, 'embedding_dim': 32, 'lr': 0.00567629368896096, 'lambda_val': 7.112074068161609e-06, 'batch_size': 1833, 'optimizer': 'Adam'}.
2026-05-24 05:53:23,820 - experiment_functions - INFO - Early stopping at epoch 1450. Best Metrics: (0.020499944544229702, 0.01649006622516556, 0.02129584231016134)
2026-05-24 05:53:24,337 - optuna.study.study - INFO - Trial 166 finished with values: [0.020499944544229702, 0.01649006622516556, 0.02129584231016134] and parameters: {'n_layers': 4, 'embedding_dim': 96, 'lr': 0.0002909391164072771, 'lambda_val': 0.004830254272011785, 'batch_size': 1833, 'optimizer': 'Adam'}.
2026-05-24 05:53:39,720 - experiment_functions - INFO - Early stopping at epoch 1250. Best Metrics: (0.018926187251331064, 0.015455298013245035, 0.020303351699994563)
2026-05-24 05:53:39,936 - optuna.study.study - INFO - Trial 167 finished with values: [0.018926187251331064, 0.015455298013245035, 0.020303351699994563] and parameters: {'n_layers': 4, 'embedding_dim': 64, 'lr': 0.0003788253863598979, 'lambda_val': 0.00013892846035396848, 'batch_size': 3218, 'optimizer': 'RMSprop'}.
2026-05-24 05:54:23,823 - optuna.study.study - INFO - Trial 168 finished with values: [0.01706691244095382, 0.01287251655629139, 0.017538245107642673] and parameters: {'n_layers': 1, 'embedding_dim': 64, 'lr': 0.0002909391164072771, 'lambda_val': 5.78540826635863e-05, 'batch_size': 2716, 'optimizer': 'Adam'}.
2026-05-24 05:54:30,230 - experiment_functions - INFO - Early stopping at epoch 500. Best Metrics: (0.005609601002356641, 0.004089403973509934, 0.005506312139417864)
2026-05-24 05:54:31,229 - optuna.study.study - INFO - Trial 169 finished with values: [0.005609601002356641, 0.004089403973509934, 0.005506312139417864] and parameters: {'n_layers': 2, 'embedding_dim': 32, 'lr': 0.0003744374423353498, 'lambda_val': 0.022070818004058867, 'batch_size': 3745, 'optimizer': 'SGD'}.
2026-05-24 05:54:38,389 - experiment_functions - INFO - Early stopping at epoch 550. Best Metrics: (0.015245977203929771, 0.012135761589403974, 0.015830586151018317)
2026-05-24 05:54:38,491 - optuna.study.study - INFO - Trial 170 finished with values: [0.015245977203929771, 0.012135761589403974, 0.015830586151018317] and parameters: {'n_layers': 2, 'embedding_dim': 96, 'lr': 0.00567629368896096, 'lambda_val': 9.854265988535646e-05, 'batch_size': 542, 'optimizer': 'RMSprop'}.
2026-05-24 05:54:46,147 - experiment_functions - INFO - Early stopping at epoch 600. Best Metrics: (0.009718415487506142, 0.007822847682119206, 0.010007556689053855)
2026-05-24 05:54:47,044 - optuna.study.study - INFO - Trial 171 finished with values: [0.009718415487506142, 0.007822847682119206, 0.010007556689053855] and parameters: {'n_layers': 2, 'embedding_dim': 32, 'lr': 0.050800521880299945, 'lambda_val': 2.9809066173301263e-06, 'batch_size': 3385, 'optimizer': 'RMSprop'}.
2026-05-24 05:54:57,311 - experiment_functions - INFO - Early stopping at epoch 800. Best Metrics: (0.018184795149803624, 0.014718543046357616, 0.019087751378978883)
2026-05-24 05:54:57,414 - optuna.study.study - INFO - Trial 172 finished with values: [0.018184795149803624, 0.014718543046357616, 0.019087751378978883] and parameters: {'n_layers': 4, 'embedding_dim': 128, 'lr': 0.0004864719972301081, 'lambda_val': 0.0002702283536384827, 'batch_size': 3218, 'optimizer': 'RMSprop'}.
2026-05-24 05:55:06,686 - experiment_functions - INFO - Early stopping at epoch 700. Best Metrics: (0.016219701016769516, 0.014031456953642383, 0.016682219315970713)
2026-05-24 05:55:06,788 - optuna.study.study - INFO - Trial 173 finished with values: [0.016219701016769516, 0.014031456953642383, 0.016682219315970713] and parameters: {'n_layers': 2, 'embedding_dim': 64, 'lr': 0.001417171231479309, 'lambda_val': 0.09383228839891232, 'batch_size': 1264, 'optimizer': 'RMSprop'}.
2026-05-24 05:55:19,078 - experiment_functions - INFO - Early stopping at epoch 1000. Best Metrics: (0.020040524498507975, 0.015471854304635761, 0.020781917348525684)
2026-05-24 05:55:19,269 - optuna.study.study - INFO - Trial 174 finished with values: [0.020040524498507975, 0.015471854304635761, 0.020781917348525684] and parameters: {'n_layers': 4, 'embedding_dim': 96, 'lr': 0.0004915796983483617, 'lambda_val': 5.78540826635863e-05, 'batch_size': 1612, 'optimizer': 'Adam'}.
2026-05-24 05:55:27,116 - experiment_functions - INFO - Early stopping at epoch 600. Best Metrics: (0.016634869893011314, 0.013600993377483444, 0.0176526770048629)
2026-05-24 05:55:27,207 - optuna.study.study - INFO - Trial 175 finished with values: [0.016634869893011314, 0.013600993377483444, 0.0176526770048629] and parameters: {'n_layers': 4, 'embedding_dim': 128, 'lr': 0.0030927336567706204, 'lambda_val': 7.112074068161609e-06, 'batch_size': 1833, 'optimizer': 'Adam'}.
2026-05-24 05:55:34,351 - experiment_functions - INFO - Early stopping at epoch 550. Best Metrics: (0.015499627444942385, 0.011953642384105961, 0.0161600612339788)
2026-05-24 05:55:34,597 - optuna.study.study - INFO - Trial 176 finished with values: [0.015499627444942385, 0.011953642384105961, 0.0161600612339788] and parameters: {'n_layers': 2, 'embedding_dim': 128, 'lr': 0.00567629368896096, 'lambda_val': 5.78540826635863e-05, 'batch_size': 1875, 'optimizer': 'Adam'}.
2026-05-24 05:55:42,001 - experiment_functions - INFO - Early stopping at epoch 550. Best Metrics: (0.010052486062055308, 0.008567880794701986, 0.010623578466814991)
2026-05-24 05:55:42,092 - optuna.study.study - INFO - Trial 177 finished with values: [0.010052486062055308, 0.008567880794701986, 0.010623578466814991] and parameters: {'n_layers': 4, 'embedding_dim': 64, 'lr': 0.007122747338051435, 'lambda_val': 0.00012012014373753211, 'batch_size': 2810, 'optimizer': 'RMSprop'}.
2026-05-24 05:56:08,366 - experiment_functions - INFO - Early stopping at epoch 2300. Best Metrics: (0.01832105397388561, 0.01353476821192053, 0.01853350634656166)
2026-05-24 05:56:08,669 - optuna.study.study - INFO - Trial 178 finished with values: [0.01832105397388561, 0.01353476821192053, 0.01853350634656166] and parameters: {'n_layers': 2, 'embedding_dim': 32, 'lr': 0.0003548891156684262, 'lambda_val': 8.777843260145042e-05, 'batch_size': 3624, 'optimizer': 'Adam'}.
2026-05-24 05:56:21,987 - experiment_functions - INFO - Early stopping at epoch 1100. Best Metrics: (0.018749904932954066, 0.014097682119205299, 0.019026345921972106)
2026-05-24 05:56:22,295 - optuna.study.study - INFO - Trial 179 finished with values: [0.018749904932954066, 0.014097682119205299, 0.019026345921972106] and parameters: {'n_layers': 2, 'embedding_dim': 32, 'lr': 0.0007714507483516837, 'lambda_val': 0.00013892846035396848, 'batch_size': 2716, 'optimizer': 'RMSprop'}.
2026-05-24 05:56:29,731 - experiment_functions - INFO - Early stopping at epoch 500. Best Metrics: (0.007898600378816241, 0.0062996688741721865, 0.008124817315553428)
2026-05-24 05:56:30,095 - optuna.study.study - INFO - Trial 180 finished with values: [0.007898600378816241, 0.0062996688741721865, 0.008124817315553428] and parameters: {'n_layers': 4, 'embedding_dim': 32, 'lr': 0.07573067894803087, 'lambda_val': 0.007620237155778278, 'batch_size': 3377, 'optimizer': 'RMSprop'}.
2026-05-24 05:57:15,194 - experiment_functions - INFO - Early stopping at epoch 3450. Best Metrics: (0.017711092390705133, 0.014850993377483444, 0.01909056426156191)
2026-05-24 05:57:15,557 - optuna.study.study - INFO - Trial 181 finished with values: [0.017711092390705133, 0.014850993377483444, 0.01909056426156191] and parameters: {'n_layers': 4, 'embedding_dim': 64, 'lr': 0.00018164145276986003, 'lambda_val': 2.9428916086760435e-06, 'batch_size': 3377, 'optimizer': 'Adam'}.
2026-05-24 05:57:24,897 - experiment_functions - INFO - Early stopping at epoch 750. Best Metrics: (0.008052524500728185, 0.008956953642384104, 0.010546135233360097)
2026-05-24 05:57:25,301 - optuna.study.study - INFO - Trial 182 finished with values: [0.008052524500728185, 0.008956953642384104, 0.010546135233360097] and parameters: {'n_layers': 2, 'embedding_dim': 128, 'lr': 0.014389477816698247, 'lambda_val': 0.09383228839891232, 'batch_size': 3889, 'optimizer': 'Adam'}.
2026-05-24 05:57:43,370 - experiment_functions - INFO - Early stopping at epoch 1500. Best Metrics: (0.02027243714297945, 0.016125827814569536, 0.021408859091317727)
2026-05-24 05:57:43,470 - optuna.study.study - INFO - Trial 183 finished with values: [0.02027243714297945, 0.016125827814569536, 0.021408859091317727] and parameters: {'n_layers': 4, 'embedding_dim': 128, 'lr': 0.0002909391164072771, 'lambda_val': 7.112074068161609e-06, 'batch_size': 1612, 'optimizer': 'Adam'}.
2026-05-24 05:57:51,354 - experiment_functions - INFO - Early stopping at epoch 600. Best Metrics: (0.017547617336234677, 0.01388245033112583, 0.01773912852833442)
2026-05-24 05:57:51,458 - optuna.study.study - INFO - Trial 184 finished with values: [0.017547617336234677, 0.01388245033112583, 0.01773912852833442] and parameters: {'n_layers': 4, 'embedding_dim': 128, 'lr': 0.0030927336567706204, 'lambda_val': 7.112074068161609e-06, 'batch_size': 1833, 'optimizer': 'Adam'}.
2026-05-24 05:58:10,897 - experiment_functions - INFO - Early stopping at epoch 1700. Best Metrics: (0.019159442777382133, 0.013468543046357615, 0.019275301270238875)
2026-05-24 05:58:10,997 - optuna.study.study - INFO - Trial 185 finished with values: [0.019159442777382133, 0.013468543046357615, 0.019275301270238875] and parameters: {'n_layers': 1, 'embedding_dim': 64, 'lr': 0.0004890104603780292, 'lambda_val': 5.78540826635863e-05, 'batch_size': 2144, 'optimizer': 'RMSprop'}.
2026-05-24 05:58:18,256 - experiment_functions - INFO - Early stopping at epoch 550. Best Metrics: (0.014716441094310898, 0.011970198675496691, 0.015657978508646038)
2026-05-24 05:58:18,348 - optuna.study.study - INFO - Trial 186 finished with values: [0.014716441094310898, 0.011970198675496691, 0.015657978508646038] and parameters: {'n_layers': 4, 'embedding_dim': 128, 'lr': 0.0034008688244003345, 'lambda_val': 2.9428916086760435e-06, 'batch_size': 3218, 'optimizer': 'Adam'}.
2026-05-24 05:58:25,447 - experiment_functions - INFO - Early stopping at epoch 550. Best Metrics: (0.012723524198507958, 0.009329470198675497, 0.012297257544974457)
2026-05-24 05:58:25,916 - optuna.study.study - INFO - Trial 187 finished with values: [0.012723524198507958, 0.009329470198675497, 0.012297257544974457] and parameters: {'n_layers': 1, 'embedding_dim': 96, 'lr': 0.08438938408345281, 'lambda_val': 3.1472646005870695e-06, 'batch_size': 1575, 'optimizer': 'Adam'}.
2026-05-24 05:58:33,526 - experiment_functions - INFO - Early stopping at epoch 550. Best Metrics: (0.018019544829668662, 0.013261589403973512, 0.018200240683192204)
2026-05-24 05:58:33,804 - optuna.study.study - INFO - Trial 188 finished with values: [0.018019544829668662, 0.013261589403973512, 0.018200240683192204] and parameters: {'n_layers': 1, 'embedding_dim': 64, 'lr': 0.0034008688244003345, 'lambda_val': 2.2166956469385638e-05, 'batch_size': 1501, 'optimizer': 'RMSprop'}.
2026-05-24 05:58:49,272 - experiment_functions - INFO - Early stopping at epoch 850. Best Metrics: (0.015258316274630512, 0.011995033112582784, 0.015457653037779106)
2026-05-24 05:58:50,129 - optuna.study.study - INFO - Trial 189 finished with values: [0.015258316274630512, 0.011995033112582784, 0.015457653037779106] and parameters: {'n_layers': 2, 'embedding_dim': 128, 'lr': 0.0004890104603780292, 'lambda_val': 0.007620237155778278, 'batch_size': 3745, 'optimizer': 'RMSprop'}.
2026-05-24 05:58:57,323 - experiment_functions - INFO - Early stopping at epoch 550. Best Metrics: (0.019898213695101127, 0.014279801324503311, 0.019960923389431555)
