2026-05-24 03:07:36,737 - optuna.study.study - INFO - Trial 126 finished with values: [0.021057993435655453, 0.016771523178807948, 0.022056717846924364] and parameters: {'n_layers': 4, 'embedding_dim': 32, 'lr': 0.0008654503808156264, 'lambda_val': 0.003987651252810029, 'batch_size': 1950, 'optimizer': 'RMSprop'}.
2026-05-24 03:07:48,090 - experiment_functions - INFO - Early stopping at epoch 950. Best Metrics: (0.01800830132920178, 0.013352649006622518, 0.01817088288533697)
2026-05-24 03:07:48,378 - optuna.study.study - INFO - Trial 127 finished with values: [0.01800830132920178, 0.013352649006622518, 0.01817088288533697] and parameters: {'n_layers': 2, 'embedding_dim': 64, 'lr': 0.000648779798240634, 'lambda_val': 0.011587187073107777, 'batch_size': 1831, 'optimizer': 'Adam'}.
2026-05-24 03:08:02,995 - experiment_functions - INFO - Early stopping at epoch 1200. Best Metrics: (0.019460961661658553, 0.01527317880794702, 0.020253428233271278)
2026-05-24 03:08:03,488 - optuna.study.study - INFO - Trial 128 finished with values: [0.019460961661658553, 0.01527317880794702, 0.020253428233271278] and parameters: {'n_layers': 3, 'embedding_dim': 96, 'lr': 0.0004649352000072556, 'lambda_val': 1.8203246882701353e-06, 'batch_size': 1628, 'optimizer': 'Adam'}.
2026-05-24 03:08:09,977 - experiment_functions - INFO - Early stopping at epoch 500. Best Metrics: (0.00499393154074505, 0.004155629139072848, 0.0051997247217088005)
2026-05-24 03:08:10,575 - optuna.study.study - INFO - Trial 129 finished with values: [0.00499393154074505, 0.004155629139072848, 0.0051997247217088005] and parameters: {'n_layers': 3, 'embedding_dim': 32, 'lr': 0.0004649352000072556, 'lambda_val': 1.8203246882701353e-06, 'batch_size': 2028, 'optimizer': 'SGD'}.
2026-05-24 03:08:17,679 - experiment_functions - INFO - Early stopping at epoch 550. Best Metrics: (0.010883643583118732, 0.009114238410596026, 0.011517348269234442)
2026-05-24 03:08:17,763 - optuna.study.study - INFO - Trial 130 finished with values: [0.010883643583118732, 0.009114238410596026, 0.011517348269234442] and parameters: {'n_layers': 3, 'embedding_dim': 32, 'lr': 0.047579164018428745, 'lambda_val': 2.8339303211396753e-05, 'batch_size': 2744, 'optimizer': 'Adam'}.
2026-05-24 03:08:24,259 - experiment_functions - INFO - Early stopping at epoch 500. Best Metrics: (0.0046847780959265, 0.003998344370860927, 0.004886592006908817)
2026-05-24 03:08:25,176 - optuna.study.study - INFO - Trial 131 finished with values: [0.0046847780959265, 0.003998344370860927, 0.004886592006908817] and parameters: {'n_layers': 2, 'embedding_dim': 64, 'lr': 0.0005881134405257853, 'lambda_val': 1.8203246882701353e-06, 'batch_size': 2745, 'optimizer': 'SGD'}.
2026-05-24 03:08:33,632 - experiment_functions - INFO - Early stopping at epoch 650. Best Metrics: (0.020609220250587652, 0.014577814569536426, 0.02059674361323879)
2026-05-24 03:08:33,728 - optuna.study.study - INFO - Trial 132 finished with values: [0.020609220250587652, 0.014577814569536426, 0.02059674361323879] and parameters: {'n_layers': 1, 'embedding_dim': 64, 'lr': 0.002491402332377118, 'lambda_val': 5.138211460433891e-05, 'batch_size': 679, 'optimizer': 'RMSprop'}.
2026-05-24 03:08:45,061 - experiment_functions - INFO - Early stopping at epoch 900. Best Metrics: (0.02507988960268559, 0.01919701986754967, 0.026048769877265777)
2026-05-24 03:08:45,471 - optuna.study.study - INFO - Trial 133 finished with values: [0.02507988960268559, 0.01919701986754967, 0.026048769877265777] and parameters: {'n_layers': 4, 'embedding_dim': 32, 'lr': 0.001073497477166827, 'lambda_val': 0.0012679169415010568, 'batch_size': 659, 'optimizer': 'Adam'}.
2026-05-24 03:08:57,114 - experiment_functions - INFO - Early stopping at epoch 1050. Best Metrics: (0.01851034341877711, 0.01515728476821192, 0.019544729125598768)
2026-05-24 03:08:57,401 - optuna.study.study - INFO - Trial 134 finished with values: [0.01851034341877711, 0.01515728476821192, 0.019544729125598768] and parameters: {'n_layers': 3, 'embedding_dim': 96, 'lr': 0.0005700378100001039, 'lambda_val': 1.113463354596578e-05, 'batch_size': 1628, 'optimizer': 'Adam'}.
2026-05-24 03:09:03,462 - experiment_functions - INFO - Early stopping at epoch 550. Best Metrics: (0.015264205101315863, 0.012839403973509935, 0.016072961516551774)
2026-05-24 03:09:03,851 - optuna.study.study - INFO - Trial 135 finished with values: [0.015264205101315863, 0.012839403973509935, 0.016072961516551774] and parameters: {'n_layers': 2, 'embedding_dim': 32, 'lr': 0.003052355703485208, 'lambda_val': 0.015202750041742976, 'batch_size': 2566, 'optimizer': 'RMSprop'}.
2026-05-24 03:09:09,662 - experiment_functions - INFO - Early stopping at epoch 500. Best Metrics: (0.0061612958171510385, 0.00456953642384106, 0.0060161410388491115)
2026-05-24 03:09:10,635 - optuna.study.study - INFO - Trial 136 finished with values: [0.0061612958171510385, 0.00456953642384106, 0.0060161410388491115] and parameters: {'n_layers': 4, 'embedding_dim': 32, 'lr': 0.019094942696727592, 'lambda_val': 0.07574912686818955, 'batch_size': 2028, 'optimizer': 'SGD'}.
2026-05-24 03:09:26,870 - experiment_functions - INFO - Early stopping at epoch 1600. Best Metrics: (0.019043952560190154, 0.014279801324503311, 0.019722896256867368)
2026-05-24 03:09:27,495 - optuna.study.study - INFO - Trial 137 finished with values: [0.019043952560190154, 0.014279801324503311, 0.019722896256867368] and parameters: {'n_layers': 2, 'embedding_dim': 32, 'lr': 0.0004568670531170521, 'lambda_val': 2.8339303211396753e-05, 'batch_size': 2744, 'optimizer': 'Adam'}.
2026-05-24 03:09:34,990 - experiment_functions - INFO - Early stopping at epoch 600. Best Metrics: (0.01760065743976903, 0.014213576158940396, 0.018484029197264388)
2026-05-24 03:09:35,096 - optuna.study.study - INFO - Trial 138 finished with values: [0.01760065743976903, 0.014213576158940396, 0.018484029197264388] and parameters: {'n_layers': 4, 'embedding_dim': 32, 'lr': 0.001073497477166827, 'lambda_val': 0.0002989351068597163, 'batch_size': 3324, 'optimizer': 'RMSprop'}.
2026-05-24 03:09:42,651 - experiment_functions - INFO - Early stopping at epoch 550. Best Metrics: (0.0144364626692916, 0.011589403973509934, 0.014787269957195063)
2026-05-24 03:09:42,726 - optuna.study.study - INFO - Trial 139 finished with values: [0.0144364626692916, 0.011589403973509934, 0.014787269957195063] and parameters: {'n_layers': 2, 'embedding_dim': 96, 'lr': 0.0017117899009234075, 'lambda_val': 0.0002989351068597163, 'batch_size': 3324, 'optimizer': 'RMSprop'}.
2026-05-24 03:09:59,941 - experiment_functions - INFO - Early stopping at epoch 1650. Best Metrics: (0.015200875487252912, 0.011481788079470198, 0.015238920407843142)
2026-05-24 03:10:00,028 - optuna.study.study - INFO - Trial 140 finished with values: [0.015200875487252912, 0.011481788079470198, 0.015238920407843142] and parameters: {'n_layers': 1, 'embedding_dim': 128, 'lr': 0.0004649352000072556, 'lambda_val': 0.01145898173020739, 'batch_size': 659, 'optimizer': 'Adam'}.
2026-05-24 03:10:06,757 - experiment_functions - INFO - Early stopping at epoch 550. Best Metrics: (0.017388787284661755, 0.014602649006622517, 0.01878801597865587)
2026-05-24 03:10:07,391 - optuna.study.study - INFO - Trial 141 finished with values: [0.017388787284661755, 0.014602649006622517, 0.01878801597865587] and parameters: {'n_layers': 4, 'embedding_dim': 32, 'lr': 0.003052355703485208, 'lambda_val': 1.002227016896905e-06, 'batch_size': 2365, 'optimizer': 'RMSprop'}.
2026-05-24 03:10:14,437 - experiment_functions - INFO - Early stopping at epoch 600. Best Metrics: (0.017104316912247074, 0.012541390728476822, 0.017223328134588597)
2026-05-24 03:10:14,523 - optuna.study.study - INFO - Trial 142 finished with values: [0.017104316912247074, 0.012541390728476822, 0.017223328134588597] and parameters: {'n_layers': 1, 'embedding_dim': 96, 'lr': 0.0030499723504765174, 'lambda_val': 0.0026252806899644348, 'batch_size': 2143, 'optimizer': 'Adam'}.
2026-05-24 03:10:22,475 - experiment_functions - INFO - Early stopping at epoch 600. Best Metrics: (0.01125536829572388, 0.011100993377483446, 0.012697853930651194)
2026-05-24 03:10:22,562 - optuna.study.study - INFO - Trial 143 finished with values: [0.01125536829572388, 0.011100993377483446, 0.012697853930651194] and parameters: {'n_layers': 4, 'embedding_dim': 256, 'lr': 0.0008654503808156264, 'lambda_val': 0.0820315059645863, 'batch_size': 3349, 'optimizer': 'RMSprop'}.
2026-05-24 03:10:34,834 - experiment_functions - INFO - Early stopping at epoch 1050. Best Metrics: (0.017861931140669706, 0.014031456953642383, 0.01809449188696417)
2026-05-24 03:10:34,969 - optuna.study.study - INFO - Trial 144 finished with values: [0.017861931140669706, 0.014031456953642383, 0.01809449188696417] and parameters: {'n_layers': 3, 'embedding_dim': 128, 'lr': 0.0004649352000072556, 'lambda_val': 5.464200699430665e-05, 'batch_size': 2745, 'optimizer': 'RMSprop'}.
2026-05-24 03:10:45,528 - experiment_functions - INFO - Early stopping at epoch 900. Best Metrics: (0.01779905742527188, 0.014387417218543048, 0.01835911997170612)
2026-05-24 03:10:45,730 - optuna.study.study - INFO - Trial 145 finished with values: [0.01779905742527188, 0.014387417218543048, 0.01835911997170612] and parameters: {'n_layers': 3, 'embedding_dim': 128, 'lr': 0.0004649352000072556, 'lambda_val': 2.8339303211396753e-05, 'batch_size': 2745, 'optimizer': 'RMSprop'}.
2026-05-24 03:11:01,579 - experiment_functions - INFO - Early stopping at epoch 1450. Best Metrics: (0.01854698265341705, 0.013402317880794703, 0.018220343519741944)
2026-05-24 03:11:02,367 - optuna.study.study - INFO - Trial 146 finished with values: [0.01854698265341705, 0.013402317880794703, 0.018220343519741944] and parameters: {'n_layers': 2, 'embedding_dim': 96, 'lr': 0.0004568670531170521, 'lambda_val': 7.397534001840383e-06, 'batch_size': 2611, 'optimizer': 'RMSprop'}.
2026-05-24 03:11:09,345 - experiment_functions - INFO - Early stopping at epoch 550. Best Metrics: (0.012666878088712002, 0.012086092715231788, 0.014200607457333647)
2026-05-24 03:11:09,691 - optuna.study.study - INFO - Trial 147 finished with values: [0.012666878088712002, 0.012086092715231788, 0.014200607457333647] and parameters: {'n_layers': 4, 'embedding_dim': 128, 'lr': 0.0018521591652371555, 'lambda_val': 0.007615234672834856, 'batch_size': 2473, 'optimizer': 'RMSprop'}.
2026-05-24 03:11:22,883 - experiment_functions - INFO - Early stopping at epoch 1100. Best Metrics: (0.02050047585728748, 0.016498344370860927, 0.02158860670121744)
2026-05-24 03:11:23,641 - optuna.study.study - INFO - Trial 148 finished with values: [0.02050047585728748, 0.016498344370860927, 0.02158860670121744] and parameters: {'n_layers': 4, 'embedding_dim': 32, 'lr': 0.0005881134405257853, 'lambda_val': 1.8203246882701353e-06, 'batch_size': 2028, 'optimizer': 'Adam'}.
2026-05-24 03:11:53,005 - experiment_functions - INFO - Early stopping at epoch 3050. Best Metrics: (0.016937758668510005, 0.012102649006622515, 0.017035649403405757)
2026-05-24 03:11:53,619 - optuna.study.study - INFO - Trial 149 finished with values: [0.016937758668510005, 0.012102649006622515, 0.017035649403405757] and parameters: {'n_layers': 1, 'embedding_dim': 96, 'lr': 0.00021574524362862762, 'lambda_val': 0.0066348802411987035, 'batch_size': 2143, 'optimizer': 'RMSprop'}.
2026-05-24 03:12:06,367 - experiment_functions - INFO - Early stopping at epoch 1150. Best Metrics: (0.01970818905396983, 0.015397350993377483, 0.020501101774886767)
2026-05-24 03:12:06,457 - optuna.study.study - INFO - Trial 150 finished with values: [0.01970818905396983, 0.015397350993377483, 0.020501101774886767] and parameters: {'n_layers': 3, 'embedding_dim': 96, 'lr': 0.0004649352000072556, 'lambda_val': 1.113463354596578e-05, 'batch_size': 1628, 'optimizer': 'Adam'}.
2026-05-24 03:12:16,960 - experiment_functions - INFO - Early stopping at epoch 1000. Best Metrics: (0.018896132861814043, 0.012988410596026491, 0.018350622095836544)
2026-05-24 03:12:17,083 - optuna.study.study - INFO - Trial 151 finished with values: [0.018896132861814043, 0.012988410596026491, 0.018350622095836544] and parameters: {'n_layers': 1, 'embedding_dim': 64, 'lr': 0.000648779798240634, 'lambda_val': 2.7695935649997752e-05, 'batch_size': 2171, 'optimizer': 'RMSprop'}.
2026-05-24 03:12:58,080 - experiment_functions - INFO - Early stopping at epoch 3950. Best Metrics: (0.024304673166288666, 0.016423841059602647, 0.023954371893423566)
2026-05-24 03:12:59,430 - optuna.study.study - INFO - Trial 152 finished with values: [0.024304673166288666, 0.016423841059602647, 0.023954371893423566] and parameters: {'n_layers': 1, 'embedding_dim': 32, 'lr': 0.000629058738902094, 'lambda_val': 7.397534001840383e-06, 'batch_size': 679, 'optimizer': 'Adam'}.
2026-05-24 03:13:19,991 - experiment_functions - INFO - Early stopping at epoch 1700. Best Metrics: (0.020880255267068704, 0.01583609271523179, 0.021478581697336116)
2026-05-24 03:13:20,093 - optuna.study.study - INFO - Trial 153 finished with values: [0.020880255267068704, 0.01583609271523179, 0.021478581697336116] and parameters: {'n_layers': 3, 'embedding_dim': 32, 'lr': 0.0004568670531170521, 'lambda_val': 0.0010063349675964721, 'batch_size': 2473, 'optimizer': 'RMSprop'}.
2026-05-24 03:13:27,838 - experiment_functions - INFO - Early stopping at epoch 550. Best Metrics: (0.017842307351781057, 0.01464403973509934, 0.018503829118111742)
2026-05-24 03:13:27,933 - optuna.study.study - INFO - Trial 154 finished with values: [0.017842307351781057, 0.01464403973509934, 0.018503829118111742] and parameters: {'n_layers': 4, 'embedding_dim': 256, 'lr': 0.0008654503808156264, 'lambda_val': 0.003987651252810029, 'batch_size': 2365, 'optimizer': 'RMSprop'}.
2026-05-24 03:13:49,096 - experiment_functions - INFO - Early stopping at epoch 1650. Best Metrics: (0.01907596525740071, 0.015571192052980133, 0.020575519825747873)
2026-05-24 03:13:50,068 - optuna.study.study - INFO - Trial 155 finished with values: [0.01907596525740071, 0.015571192052980133, 0.020575519825747873] and parameters: {'n_layers': 4, 'embedding_dim': 256, 'lr': 0.00022517253459576215, 'lambda_val': 4.4508072112502196e-05, 'batch_size': 1635, 'optimizer': 'RMSprop'}.
2026-05-24 03:13:56,251 - experiment_functions - INFO - Early stopping at epoch 500. Best Metrics: (0.004966381144496728, 0.004172185430463576, 0.005239382791250542)
2026-05-24 03:13:56,718 - optuna.study.study - INFO - Trial 156 finished with values: [0.004966381144496728, 0.004172185430463576, 0.005239382791250542] and parameters: {'n_layers': 3, 'embedding_dim': 32, 'lr': 0.0004649352000072556, 'lambda_val': 0.0002604635685994012, 'batch_size': 1628, 'optimizer': 'SGD'}.
2026-05-24 03:14:40,502 - optuna.study.study - INFO - Trial 157 finished with values: [0.006500678315919696, 0.005, 0.00646040444044842] and parameters: {'n_layers': 3, 'embedding_dim': 96, 'lr': 1.220593982661941e-05, 'lambda_val': 1.8203246882701353e-06, 'batch_size': 3964, 'optimizer': 'Adam'}.
2026-05-24 03:14:47,352 - experiment_functions - INFO - Early stopping at epoch 550. Best Metrics: (0.016035020366484323, 0.011970198675496691, 0.016352067138158455)
2026-05-24 03:14:47,910 - optuna.study.study - INFO - Trial 158 finished with values: [0.016035020366484323, 0.011970198675496691, 0.016352067138158455] and parameters: {'n_layers': 1, 'embedding_dim': 96, 'lr': 0.0018521591652371555, 'lambda_val': 0.000415108125585187, 'batch_size': 2142, 'optimizer': 'RMSprop'}.
2026-05-24 03:14:59,403 - experiment_functions - INFO - Early stopping at epoch 950. Best Metrics: (0.01862590535848831, 0.01343543046357616, 0.019178710543599622)
2026-05-24 03:14:59,485 - optuna.study.study - INFO - Trial 159 finished with values: [0.01862590535848831, 0.01343543046357616, 0.019178710543599622] and parameters: {'n_layers': 2, 'embedding_dim': 64, 'lr': 0.000648779798240634, 'lambda_val': 5.1688078317297965e-06, 'batch_size': 2171, 'optimizer': 'RMSprop'}.
2026-05-24 03:15:16,199 - experiment_functions - INFO - Early stopping at epoch 1100. Best Metrics: (0.019114815269000742, 0.014917218543046357, 0.01952064611109891)
2026-05-24 03:15:16,291 - optuna.study.study - INFO - Trial 160 finished with values: [0.019114815269000742, 0.014917218543046357, 0.01952064611109891] and parameters: {'n_layers': 4, 'embedding_dim': 96, 'lr': 0.00036006007162814904, 'lambda_val': 0.00034199571335759705, 'batch_size': 2393, 'optimizer': 'RMSprop'}.
2026-05-24 03:15:58,058 - optuna.study.study - INFO - Trial 161 finished with values: [0.005738493313844386, 0.00462748344370861, 0.00600597862438172] and parameters: {'n_layers': 1, 'embedding_dim': 32, 'lr': 1.427380345839007e-05, 'lambda_val': 1.002227016896905e-06, 'batch_size': 895, 'optimizer': 'Adam'}.
2026-05-24 03:16:06,216 - experiment_functions - INFO - Early stopping at epoch 650. Best Metrics: (0.017166843184984727, 0.01181291390728477, 0.01657748751332175)
2026-05-24 03:16:06,404 - optuna.study.study - INFO - Trial 162 finished with values: [0.017166843184984727, 0.01181291390728477, 0.01657748751332175] and parameters: {'n_layers': 1, 'embedding_dim': 96, 'lr': 0.0018521591652371555, 'lambda_val': 7.397534001840383e-06, 'batch_size': 1841, 'optimizer': 'Adam'}.
2026-05-24 03:16:49,493 - optuna.study.study - INFO - Trial 163 finished with values: [0.011312230487239849, 0.008890728476821192, 0.011561131588464628] and parameters: {'n_layers': 3, 'embedding_dim': 32, 'lr': 8.096546296002917e-05, 'lambda_val': 5.464200699430665e-05, 'batch_size': 1841, 'optimizer': 'RMSprop'}.
2026-05-24 03:17:02,808 - experiment_functions - INFO - Early stopping at epoch 1100. Best Metrics: (0.017504604477926154, 0.013758278145695363, 0.018235615614833046)
2026-05-24 03:17:02,892 - optuna.study.study - INFO - Trial 164 finished with values: [0.017504604477926154, 0.013758278145695363, 0.018235615614833046] and parameters: {'n_layers': 3, 'embedding_dim': 96, 'lr': 0.0004649352000072556, 'lambda_val': 1.8203246882701353e-06, 'batch_size': 2470, 'optimizer': 'Adam'}.
2026-05-24 03:17:13,147 - experiment_functions - INFO - Early stopping at epoch 850. Best Metrics: (0.017845843612518897, 0.012822847682119203, 0.017902882106586752)
2026-05-24 03:17:13,501 - optuna.study.study - INFO - Trial 165 finished with values: [0.017845843612518897, 0.012822847682119203, 0.017902882106586752] and parameters: {'n_layers': 1, 'embedding_dim': 64, 'lr': 0.001073497477166827, 'lambda_val': 7.765958765183013e-06, 'batch_size': 2315, 'optimizer': 'RMSprop'}.
2026-05-24 03:17:23,468 - experiment_functions - INFO - Early stopping at epoch 800. Best Metrics: (0.02492621136244476, 0.018526490066225167, 0.025482163132556718)
2026-05-24 03:17:24,154 - optuna.study.study - INFO - Trial 166 finished with values: [0.02492621136244476, 0.018526490066225167, 0.025482163132556718] and parameters: {'n_layers': 4, 'embedding_dim': 32, 'lr': 0.001073497477166827, 'lambda_val': 0.0009527201315311902, 'batch_size': 979, 'optimizer': 'Adam'}.
2026-05-24 03:18:07,671 - optuna.study.study - INFO - Trial 167 finished with values: [0.02171402233457708, 0.014809602649006626, 0.021786533347547328] and parameters: {'n_layers': 1, 'embedding_dim': 32, 'lr': 0.0004568670531170521, 'lambda_val': 5.138211460433891e-05, 'batch_size': 679, 'optimizer': 'RMSprop'}.
2026-05-24 03:18:16,724 - experiment_functions - INFO - Early stopping at epoch 650. Best Metrics: (0.01740575386854399, 0.012367549668874173, 0.017096709898987223)
2026-05-24 03:18:16,970 - optuna.study.study - INFO - Trial 168 finished with values: [0.01740575386854399, 0.012367549668874173, 0.017096709898987223] and parameters: {'n_layers': 1, 'embedding_dim': 128, 'lr': 0.001073497477166827, 'lambda_val': 5.138211460433891e-05, 'batch_size': 2583, 'optimizer': 'RMSprop'}.
2026-05-24 03:18:32,395 - experiment_functions - INFO - Early stopping at epoch 800. Best Metrics: (0.017596772811471203, 0.0128476821192053, 0.017801091209826567)
2026-05-24 03:18:33,007 - optuna.study.study - INFO - Trial 169 finished with values: [0.017596772811471203, 0.0128476821192053, 0.017801091209826567] and parameters: {'n_layers': 1, 'embedding_dim': 64, 'lr': 0.001073497477166827, 'lambda_val': 7.397534001840383e-06, 'batch_size': 2583, 'optimizer': 'Adam'}.
2026-05-24 03:18:44,347 - experiment_functions - INFO - Early stopping at epoch 900. Best Metrics: (0.020436923630141206, 0.01691225165562914, 0.02157397046116974)
2026-05-24 03:18:45,451 - optuna.study.study - INFO - Trial 170 finished with values: [0.020436923630141206, 0.01691225165562914, 0.02157397046116974] and parameters: {'n_layers': 4, 'embedding_dim': 96, 'lr': 0.0005700378100001039, 'lambda_val': 1.113463354596578e-05, 'batch_size': 2057, 'optimizer': 'Adam'}.
2026-05-24 03:18:52,458 - experiment_functions - INFO - Early stopping at epoch 550. Best Metrics: (0.01955590445641006, 0.01356788079470199, 0.01900584727841519)
2026-05-24 03:18:52,552 - optuna.study.study - INFO - Trial 171 finished with values: [0.01955590445641006, 0.01356788079470199, 0.01900584727841519] and parameters: {'n_layers': 2, 'embedding_dim': 64, 'lr': 0.0025646859458602136, 'lambda_val': 5.138211460433891e-05, 'batch_size': 2028, 'optimizer': 'RMSprop'}.
2026-05-24 03:18:59,370 - experiment_functions - INFO - Early stopping at epoch 550. Best Metrics: (0.019108123192875366, 0.015, 0.020052178506128428)
2026-05-24 03:18:59,462 - optuna.study.study - INFO - Trial 172 finished with values: [0.019108123192875366, 0.015, 0.020052178506128428] and parameters: {'n_layers': 4, 'embedding_dim': 32, 'lr': 0.0025646859458602136, 'lambda_val': 1.002227016896905e-06, 'batch_size': 2142, 'optimizer': 'RMSprop'}.
2026-05-24 03:19:16,904 - experiment_functions - INFO - Early stopping at epoch 1650. Best Metrics: (0.017617975152911556, 0.013269867549668876, 0.01795575924771901)
