2026-05-24 11:56:34,468 - optuna.study.study - INFO - Trial 216 finished with values: [0.057519026514174315, 0.034163907284768216, 0.05053442580996666] and parameters: {'n_layers': 2, 'embedding_dim': 96, 'lr': 0.0005910069120800205, 'lambda_val': 8.876623948407677e-06, 'batch_size': 1569, 'optimizer': 'Adam'}.
2026-05-24 11:56:40,566 - experiment_functions - INFO - Early stopping at epoch 500. Best Metrics: (0.005306264609950647, 0.00435430463576159, 0.005559576545041665)
2026-05-24 11:56:41,450 - optuna.study.study - INFO - Trial 217 finished with values: [0.005306264609950647, 0.00435430463576159, 0.005559576545041665] and parameters: {'n_layers': 1, 'embedding_dim': 64, 'lr': 0.0005910069120800205, 'lambda_val': 0.01723991176853604, 'batch_size': 775, 'optimizer': 'SGD'}.
2026-05-24 11:56:48,705 - experiment_functions - INFO - Early stopping at epoch 550. Best Metrics: (0.05391419065878329, 0.032847682119205295, 0.04697195441448439)
2026-05-24 11:56:48,808 - optuna.study.study - INFO - Trial 218 finished with values: [0.05391419065878329, 0.032847682119205295, 0.04697195441448439] and parameters: {'n_layers': 1, 'embedding_dim': 128, 'lr': 0.007734430860530913, 'lambda_val': 0.01723991176853604, 'batch_size': 1036, 'optimizer': 'Adam'}.
2026-05-24 11:57:02,130 - experiment_functions - INFO - Early stopping at epoch 1150. Best Metrics: (0.05134339689885527, 0.03199503311258278, 0.04691820228399376)
2026-05-24 11:57:02,224 - optuna.study.study - INFO - Trial 219 finished with values: [0.05134339689885527, 0.03199503311258278, 0.04691820228399376] and parameters: {'n_layers': 2, 'embedding_dim': 32, 'lr': 0.0005910069120800205, 'lambda_val': 0.004059133939758747, 'batch_size': 1299, 'optimizer': 'Adam'}.
2026-05-24 11:57:27,149 - experiment_functions - INFO - Early stopping at epoch 2150. Best Metrics: (0.06718960356802874, 0.03889900662251656, 0.058391702672027056)
2026-05-24 11:57:27,712 - optuna.study.study - INFO - Trial 220 finished with values: [0.06718960356802874, 0.03889900662251656, 0.058391702672027056] and parameters: {'n_layers': 1, 'embedding_dim': 128, 'lr': 0.0005910069120800205, 'lambda_val': 0.0009872055834063286, 'batch_size': 831, 'optimizer': 'RMSprop'}.
2026-05-24 11:57:36,315 - experiment_functions - INFO - Early stopping at epoch 650. Best Metrics: (0.05580035599030709, 0.03272350993377483, 0.048544927446705244)
2026-05-24 11:57:36,413 - optuna.study.study - INFO - Trial 221 finished with values: [0.05580035599030709, 0.03272350993377483, 0.048544927446705244] and parameters: {'n_layers': 2, 'embedding_dim': 32, 'lr': 0.002147597357064978, 'lambda_val': 0.0001303671050452136, 'batch_size': 775, 'optimizer': 'Adam'}.
2026-05-24 11:57:46,960 - experiment_functions - INFO - Early stopping at epoch 550. Best Metrics: (0.009829011581115285, 0.00961092715231788, 0.01110477141454887)
2026-05-24 11:57:47,049 - optuna.study.study - INFO - Trial 222 finished with values: [0.009829011581115285, 0.00961092715231788, 0.01110477141454887] and parameters: {'n_layers': 4, 'embedding_dim': 256, 'lr': 0.002147597357064978, 'lambda_val': 4.598956818766828e-05, 'batch_size': 1926, 'optimizer': 'RMSprop'}.
2026-05-24 11:57:52,875 - experiment_functions - INFO - Early stopping at epoch 500. Best Metrics: (0.005400283246308174, 0.004263245033112583, 0.005253068929929623)
2026-05-24 11:57:53,237 - optuna.study.study - INFO - Trial 223 finished with values: [0.005400283246308174, 0.004263245033112583, 0.005253068929929623] and parameters: {'n_layers': 1, 'embedding_dim': 96, 'lr': 0.002147597357064978, 'lambda_val': 6.229045175154034e-06, 'batch_size': 908, 'optimizer': 'SGD'}.
2026-05-24 11:58:00,671 - experiment_functions - INFO - Early stopping at epoch 550. Best Metrics: (0.0516981653087201, 0.03145695364238411, 0.045766559995453794)
2026-05-24 11:58:00,745 - optuna.study.study - INFO - Trial 224 finished with values: [0.0516981653087201, 0.03145695364238411, 0.045766559995453794] and parameters: {'n_layers': 1, 'embedding_dim': 64, 'lr': 0.007734430860530913, 'lambda_val': 0.01723991176853604, 'batch_size': 1036, 'optimizer': 'Adam'}.
2026-05-24 11:58:08,547 - experiment_functions - INFO - Early stopping at epoch 550. Best Metrics: (0.05824822277496338, 0.033658940397351, 0.05066193019762404)
2026-05-24 11:58:09,269 - optuna.study.study - INFO - Trial 225 finished with values: [0.05824822277496338, 0.033658940397351, 0.05066193019762404] and parameters: {'n_layers': 2, 'embedding_dim': 96, 'lr': 0.004627149516425897, 'lambda_val': 0.00010548700389340546, 'batch_size': 944, 'optimizer': 'Adam'}.
2026-05-24 11:58:24,580 - experiment_functions - INFO - Early stopping at epoch 1250. Best Metrics: (0.05156394880310726, 0.031100993377483444, 0.04411497314512263)
2026-05-24 11:58:26,389 - optuna.study.study - INFO - Trial 226 finished with values: [0.05156394880310726, 0.031100993377483444, 0.04411497314512263] and parameters: {'n_layers': 3, 'embedding_dim': 32, 'lr': 0.0004379727673244972, 'lambda_val': 3.075785895847098e-05, 'batch_size': 1297, 'optimizer': 'Adam'}.
2026-05-24 11:58:34,648 - experiment_functions - INFO - Early stopping at epoch 550. Best Metrics: (0.014863267998989895, 0.010397350993377482, 0.013750418786353425)
2026-05-24 11:58:34,730 - optuna.study.study - INFO - Trial 227 finished with values: [0.014863267998989895, 0.010397350993377482, 0.013750418786353425] and parameters: {'n_layers': 2, 'embedding_dim': 128, 'lr': 0.066822008340025, 'lambda_val': 2.666704909740151e-06, 'batch_size': 2361, 'optimizer': 'Adam'}.
2026-05-24 11:58:44,970 - experiment_functions - INFO - Early stopping at epoch 800. Best Metrics: (0.048867175594627804, 0.029817880794701986, 0.0442355922919889)
2026-05-24 11:58:45,061 - optuna.study.study - INFO - Trial 228 finished with values: [0.048867175594627804, 0.029817880794701986, 0.0442355922919889] and parameters: {'n_layers': 3, 'embedding_dim': 64, 'lr': 0.0005910069120800205, 'lambda_val': 8.876623948407677e-06, 'batch_size': 1221, 'optimizer': 'Adam'}.
2026-05-24 11:58:53,108 - experiment_functions - INFO - Early stopping at epoch 550. Best Metrics: (0.031235381066137047, 0.022831125827814564, 0.030867176195044515)
2026-05-24 11:58:53,795 - optuna.study.study - INFO - Trial 229 finished with values: [0.031235381066137047, 0.022831125827814564, 0.030867176195044515] and parameters: {'n_layers': 2, 'embedding_dim': 256, 'lr': 0.004627149516425897, 'lambda_val': 0.01130665088103249, 'batch_size': 2105, 'optimizer': 'Adam'}.
2026-05-24 11:59:01,189 - experiment_functions - INFO - Early stopping at epoch 550. Best Metrics: (0.021694933010066034, 0.01818708609271523, 0.022107568622236697)
2026-05-24 11:59:01,269 - optuna.study.study - INFO - Trial 230 finished with values: [0.021694933010066034, 0.01818708609271523, 0.022107568622236697] and parameters: {'n_layers': 2, 'embedding_dim': 64, 'lr': 0.002147597357064978, 'lambda_val': 0.005696225579131193, 'batch_size': 1961, 'optimizer': 'RMSprop'}.
2026-05-24 11:59:15,682 - experiment_functions - INFO - Early stopping at epoch 1200. Best Metrics: (0.05916498626097936, 0.03628311258278146, 0.053445180813025864)
2026-05-24 11:59:15,789 - optuna.study.study - INFO - Trial 231 finished with values: [0.05916498626097936, 0.03628311258278146, 0.053445180813025864] and parameters: {'n_layers': 1, 'embedding_dim': 64, 'lr': 0.0005910069120800205, 'lambda_val': 0.00024416758921277655, 'batch_size': 2356, 'optimizer': 'RMSprop'}.
2026-05-24 11:59:24,650 - experiment_functions - INFO - Early stopping at epoch 600. Best Metrics: (0.04616561365122916, 0.029809602649006624, 0.04109055106567307)
2026-05-24 11:59:24,742 - optuna.study.study - INFO - Trial 232 finished with values: [0.04616561365122916, 0.029809602649006624, 0.04109055106567307] and parameters: {'n_layers': 1, 'embedding_dim': 96, 'lr': 0.00666600922301573, 'lambda_val': 0.0018912353521433405, 'batch_size': 944, 'optimizer': 'Adam'}.
2026-05-24 11:59:35,900 - experiment_functions - INFO - Early stopping at epoch 900. Best Metrics: (0.05070135249334115, 0.03125, 0.045445616320730665)
2026-05-24 11:59:36,158 - optuna.study.study - INFO - Trial 233 finished with values: [0.05070135249334115, 0.03125, 0.045445616320730665] and parameters: {'n_layers': 2, 'embedding_dim': 96, 'lr': 0.0005910069120800205, 'lambda_val': 0.00021158087063845118, 'batch_size': 2105, 'optimizer': 'Adam'}.
2026-05-24 11:59:49,762 - experiment_functions - INFO - Early stopping at epoch 1100. Best Metrics: (0.04943262659216643, 0.03041390728476821, 0.04375009065171172)
2026-05-24 11:59:49,850 - optuna.study.study - INFO - Trial 234 finished with values: [0.04943262659216643, 0.03041390728476821, 0.04375009065171172] and parameters: {'n_layers': 2, 'embedding_dim': 96, 'lr': 0.0003610125166010939, 'lambda_val': 8.876623948407677e-06, 'batch_size': 3271, 'optimizer': 'Adam'}.
2026-05-24 11:59:57,533 - experiment_functions - INFO - Early stopping at epoch 550. Best Metrics: (0.04102386795883396, 0.027359271523178807, 0.03737552219570643)
2026-05-24 11:59:57,652 - optuna.study.study - INFO - Trial 235 finished with values: [0.04102386795883396, 0.027359271523178807, 0.03737552219570643] and parameters: {'n_layers': 1, 'embedding_dim': 256, 'lr': 0.002147597357064978, 'lambda_val': 3.075785895847098e-05, 'batch_size': 3482, 'optimizer': 'RMSprop'}.
2026-05-24 12:00:06,723 - experiment_functions - INFO - Early stopping at epoch 600. Best Metrics: (0.04119806646256939, 0.02728476821192053, 0.03754732600389443)
2026-05-24 12:00:07,357 - optuna.study.study - INFO - Trial 236 finished with values: [0.04119806646256939, 0.02728476821192053, 0.03754732600389443] and parameters: {'n_layers': 2, 'embedding_dim': 128, 'lr': 0.002147597357064978, 'lambda_val': 2.666704909740151e-06, 'batch_size': 3807, 'optimizer': 'Adam'}.
2026-05-24 12:00:51,082 - optuna.study.study - INFO - Trial 237 finished with values: [0.06310948414112569, 0.037615894039735094, 0.05585189808532017] and parameters: {'n_layers': 1, 'embedding_dim': 64, 'lr': 0.0004379727673244972, 'lambda_val': 3.075785895847098e-05, 'batch_size': 1116, 'optimizer': 'Adam'}.
2026-05-24 12:00:57,989 - experiment_functions - INFO - Early stopping at epoch 550. Best Metrics: (0.04762513416263434, 0.02948675496688742, 0.042522469628234014)
2026-05-24 12:00:58,346 - optuna.study.study - INFO - Trial 238 finished with values: [0.04762513416263434, 0.02948675496688742, 0.042522469628234014] and parameters: {'n_layers': 1, 'embedding_dim': 32, 'lr': 0.002147597357064978, 'lambda_val': 0.0035441273991472224, 'batch_size': 3482, 'optimizer': 'RMSprop'}.
2026-05-24 12:01:05,089 - experiment_functions - INFO - Early stopping at epoch 550. Best Metrics: (0.045096026567941254, 0.029975165562913908, 0.04333549824377622)
2026-05-24 12:01:05,185 - optuna.study.study - INFO - Trial 239 finished with values: [0.045096026567941254, 0.029975165562913908, 0.04333549824377622] and parameters: {'n_layers': 2, 'embedding_dim': 64, 'lr': 0.004627149516425897, 'lambda_val': 0.01723991176853604, 'batch_size': 3483, 'optimizer': 'Adam'}.
2026-05-24 12:01:44,364 - optuna.study.study - INFO - Trial 240 finished with values: [0.008505760123124694, 0.006241721854304636, 0.007964749907866846] and parameters: {'n_layers': 1, 'embedding_dim': 32, 'lr': 0.00018773198932182955, 'lambda_val': 0.0001303671050452136, 'batch_size': 775, 'optimizer': 'RMSprop'}.
2026-05-24 12:01:54,933 - experiment_functions - INFO - Early stopping at epoch 850. Best Metrics: (0.05182256036014375, 0.03185430463576158, 0.04689570361821224)
2026-05-24 12:01:55,246 - optuna.study.study - INFO - Trial 241 finished with values: [0.05182256036014375, 0.03185430463576158, 0.04689570361821224] and parameters: {'n_layers': 2, 'embedding_dim': 96, 'lr': 0.0005910069120800205, 'lambda_val': 0.004059133939758747, 'batch_size': 1961, 'optimizer': 'Adam'}.
2026-05-24 12:02:16,762 - experiment_functions - INFO - Early stopping at epoch 2050. Best Metrics: (0.005728505947236263, 0.0045033112582781466, 0.005850499574836524)
2026-05-24 12:02:16,881 - optuna.study.study - INFO - Trial 242 finished with values: [0.005728505947236263, 0.0045033112582781466, 0.005850499574836524] and parameters: {'n_layers': 1, 'embedding_dim': 128, 'lr': 3.335468569644294e-05, 'lambda_val': 8.876623948407677e-06, 'batch_size': 775, 'optimizer': 'Adam'}.
2026-05-24 12:02:25,020 - experiment_functions - INFO - Early stopping at epoch 650. Best Metrics: (0.048775355069290455, 0.03048013245033113, 0.04270544721398486)
2026-05-24 12:02:25,117 - optuna.study.study - INFO - Trial 243 finished with values: [0.048775355069290455, 0.03048013245033113, 0.04270544721398486] and parameters: {'n_layers': 2, 'embedding_dim': 96, 'lr': 0.0012566980437762067, 'lambda_val': 0.0018912353521433405, 'batch_size': 3162, 'optimizer': 'Adam'}.
2026-05-24 12:02:32,113 - experiment_functions - INFO - Early stopping at epoch 550. Best Metrics: (0.0161461806485219, 0.014850993377483447, 0.017479744109588306)
2026-05-24 12:02:32,310 - optuna.study.study - INFO - Trial 244 finished with values: [0.0161461806485219, 0.014850993377483447, 0.017479744109588306] and parameters: {'n_layers': 2, 'embedding_dim': 96, 'lr': 0.002147597357064978, 'lambda_val': 0.005696225579131193, 'batch_size': 1961, 'optimizer': 'RMSprop'}.
2026-05-24 12:02:39,865 - experiment_functions - INFO - Early stopping at epoch 600. Best Metrics: (0.048946989485011895, 0.03120033112582781, 0.04477843667691247)
2026-05-24 12:02:39,949 - optuna.study.study - INFO - Trial 245 finished with values: [0.048946989485011895, 0.03120033112582781, 0.04477843667691247] and parameters: {'n_layers': 1, 'embedding_dim': 96, 'lr': 0.002147597357064978, 'lambda_val': 4.175559758749336e-06, 'batch_size': 775, 'optimizer': 'RMSprop'}.
2026-05-24 12:02:47,465 - experiment_functions - INFO - Early stopping at epoch 600. Best Metrics: (0.04424054400369621, 0.027491721854304638, 0.040144549843380894)
2026-05-24 12:02:47,557 - optuna.study.study - INFO - Trial 246 finished with values: [0.04424054400369621, 0.027491721854304638, 0.040144549843380894] and parameters: {'n_layers': 2, 'embedding_dim': 32, 'lr': 0.002147597357064978, 'lambda_val': 1.225599997233873e-05, 'batch_size': 3482, 'optimizer': 'Adam'}.
2026-05-24 12:02:56,195 - experiment_functions - INFO - Early stopping at epoch 650. Best Metrics: (0.05179608417218261, 0.032408940397350997, 0.047082326705199774)
2026-05-24 12:02:56,280 - optuna.study.study - INFO - Trial 247 finished with values: [0.05179608417218261, 0.032408940397350997, 0.047082326705199774] and parameters: {'n_layers': 2, 'embedding_dim': 128, 'lr': 0.0012566980437762067, 'lambda_val': 0.0018912353521433405, 'batch_size': 2294, 'optimizer': 'Adam'}.
2026-05-24 12:03:03,745 - experiment_functions - INFO - Early stopping at epoch 600. Best Metrics: (0.05154392513682325, 0.03298013245033112, 0.04646917733873896)
2026-05-24 12:03:03,836 - optuna.study.study - INFO - Trial 248 finished with values: [0.05154392513682325, 0.03298013245033112, 0.04646917733873896] and parameters: {'n_layers': 1, 'embedding_dim': 64, 'lr': 0.007734430860530913, 'lambda_val': 2.5630917629586025e-06, 'batch_size': 1113, 'optimizer': 'Adam'}.
2026-05-24 12:03:18,330 - experiment_functions - INFO - Early stopping at epoch 850. Best Metrics: (0.03105182196262459, 0.020852649006622516, 0.02914725938839668)
2026-05-24 12:03:18,516 - optuna.study.study - INFO - Trial 249 finished with values: [0.03105182196262459, 0.020852649006622516, 0.02914725938839668] and parameters: {'n_layers': 4, 'embedding_dim': 256, 'lr': 0.00022526957918178337, 'lambda_val': 0.0007106562264740107, 'batch_size': 3441, 'optimizer': 'Adam'}.
2026-05-24 12:03:26,820 - experiment_functions - INFO - Early stopping at epoch 600. Best Metrics: (0.04683218142442732, 0.02929635761589404, 0.04352566459446588)
2026-05-24 12:03:26,961 - optuna.study.study - INFO - Trial 250 finished with values: [0.04683218142442732, 0.02929635761589404, 0.04352566459446588] and parameters: {'n_layers': 2, 'embedding_dim': 128, 'lr': 0.002147597357064978, 'lambda_val': 0.0001303671050452136, 'batch_size': 4016, 'optimizer': 'Adam'}.
2026-05-24 12:03:37,599 - experiment_functions - INFO - Early stopping at epoch 850. Best Metrics: (0.05274512537967965, 0.03235099337748344, 0.04714054859057093)
2026-05-24 12:03:38,168 - optuna.study.study - INFO - Trial 251 finished with values: [0.05274512537967965, 0.03235099337748344, 0.04714054859057093] and parameters: {'n_layers': 2, 'embedding_dim': 96, 'lr': 0.0005910069120800205, 'lambda_val': 0.004059133939758747, 'batch_size': 1961, 'optimizer': 'Adam'}.
2026-05-24 12:03:45,369 - experiment_functions - INFO - Early stopping at epoch 600. Best Metrics: (0.047190055418214576, 0.030844370860927155, 0.042488684977100837)
2026-05-24 12:03:45,433 - optuna.study.study - INFO - Trial 252 finished with values: [0.047190055418214576, 0.030844370860927155, 0.042488684977100837] and parameters: {'n_layers': 1, 'embedding_dim': 32, 'lr': 0.002147597357064978, 'lambda_val': 0.025850365843782332, 'batch_size': 694, 'optimizer': 'RMSprop'}.
2026-05-24 12:04:08,284 - experiment_functions - INFO - Early stopping at epoch 2050. Best Metrics: (0.06396897283798514, 0.03741721854304636, 0.05738951041492876)
2026-05-24 12:04:08,358 - optuna.study.study - INFO - Trial 253 finished with values: [0.06396897283798514, 0.03741721854304636, 0.05738951041492876] and parameters: {'n_layers': 1, 'embedding_dim': 64, 'lr': 0.0005910069120800205, 'lambda_val': 8.876623948407677e-06, 'batch_size': 1221, 'optimizer': 'Adam'}.
2026-05-24 12:04:23,890 - experiment_functions - INFO - Early stopping at epoch 1350. Best Metrics: (0.06524288244871702, 0.03835264900662252, 0.055524050682684796)
2026-05-24 12:04:24,629 - optuna.study.study - INFO - Trial 254 finished with values: [0.06524288244871702, 0.03835264900662252, 0.055524050682684796] and parameters: {'n_layers': 1, 'embedding_dim': 96, 'lr': 0.0005910069120800205, 'lambda_val': 0.0018912353521433405, 'batch_size': 1299, 'optimizer': 'RMSprop'}.
2026-05-24 12:04:41,379 - experiment_functions - INFO - Early stopping at epoch 1500. Best Metrics: (0.005624288190618208, 0.004064569536423841, 0.005234590159271377)
2026-05-24 12:04:41,551 - optuna.study.study - INFO - Trial 255 finished with values: [0.005624288190618208, 0.004064569536423841, 0.005234590159271377] and parameters: {'n_layers': 2, 'embedding_dim': 96, 'lr': 2.6866728465055662e-05, 'lambda_val': 0.0018912353521433405, 'batch_size': 2361, 'optimizer': 'Adam'}.
2026-05-24 12:04:49,936 - experiment_functions - INFO - Early stopping at epoch 650. Best Metrics: (0.06078368205124724, 0.036349337748344375, 0.05337305837175102)
2026-05-24 12:04:50,026 - optuna.study.study - INFO - Trial 256 finished with values: [0.06078368205124724, 0.036349337748344375, 0.05337305837175102] and parameters: {'n_layers': 1, 'embedding_dim': 128, 'lr': 0.002147597357064978, 'lambda_val': 6.229045175154034e-06, 'batch_size': 2356, 'optimizer': 'Adam'}.
2026-05-24 12:05:09,815 - experiment_functions - INFO - Early stopping at epoch 1700. Best Metrics: (0.05895905908955486, 0.036100993377483445, 0.05345076267546567)
2026-05-24 12:05:10,117 - optuna.study.study - INFO - Trial 257 finished with values: [0.05895905908955486, 0.036100993377483445, 0.05345076267546567] and parameters: {'n_layers': 2, 'embedding_dim': 64, 'lr': 0.0004379727673244972, 'lambda_val': 3.075785895847098e-05, 'batch_size': 1116, 'optimizer': 'Adam'}.
2026-05-24 12:05:16,422 - experiment_functions - INFO - Early stopping at epoch 500. Best Metrics: (0.005475844465593958, 0.004395695364238411, 0.005326484343088942)
2026-05-24 12:05:16,801 - optuna.study.study - INFO - Trial 258 finished with values: [0.005475844465593958, 0.004395695364238411, 0.005326484343088942] and parameters: {'n_layers': 2, 'embedding_dim': 96, 'lr': 0.0005910069120800205, 'lambda_val': 0.004059133939758747, 'batch_size': 1961, 'optimizer': 'SGD'}.
2026-05-24 12:05:25,039 - experiment_functions - INFO - Early stopping at epoch 650. Best Metrics: (0.04319575992017374, 0.028220198675496688, 0.038956120741992055)
2026-05-24 12:05:25,132 - optuna.study.study - INFO - Trial 259 finished with values: [0.04319575992017374, 0.028220198675496688, 0.038956120741992055] and parameters: {'n_layers': 2, 'embedding_dim': 96, 'lr': 0.0005910069120800205, 'lambda_val': 0.025850365843782332, 'batch_size': 1961, 'optimizer': 'RMSprop'}.
2026-05-24 12:05:34,102 - experiment_functions - INFO - Early stopping at epoch 700. Best Metrics: (0.0618202330388573, 0.03714403973509934, 0.05480301042182609)
2026-05-24 12:05:34,187 - optuna.study.study - INFO - Trial 260 finished with values: [0.0618202330388573, 0.03714403973509934, 0.05480301042182609] and parameters: {'n_layers': 1, 'embedding_dim': 128, 'lr': 0.002147597357064978, 'lambda_val': 0.0001303671050452136, 'batch_size': 1569, 'optimizer': 'Adam'}.
2026-05-24 12:05:41,640 - experiment_functions - INFO - Early stopping at epoch 600. Best Metrics: (0.060570601266445256, 0.036250000000000004, 0.05311489912981504)
2026-05-24 12:05:41,788 - optuna.study.study - INFO - Trial 261 finished with values: [0.060570601266445256, 0.036250000000000004, 0.05311489912981504] and parameters: {'n_layers': 1, 'embedding_dim': 64, 'lr': 0.0038929694861516654, 'lambda_val': 8.876623948407677e-06, 'batch_size': 2273, 'optimizer': 'Adam'}.
2026-05-24 12:05:56,293 - experiment_functions - INFO - Early stopping at epoch 1250. Best Metrics: (0.042595670321355555, 0.0279635761589404, 0.04006228159898528)
