2026-05-24 00:48:15,612 - optuna.study.study - INFO - Trial 208 finished with values: [0.024592152428461217, 0.01941225165562914, 0.025537477949594586] and parameters: {'n_layers': 4, 'embedding_dim': 32, 'lr': 0.0010358017727309806, 'lambda_val': 0.04990172064077824, 'batch_size': 947, 'optimizer': 'Adam'}.
2026-05-24 00:48:31,282 - experiment_functions - INFO - Early stopping at epoch 1400. Best Metrics: (0.025185350315036423, 0.01952814569536424, 0.025747947496155006)
2026-05-24 00:48:32,112 - optuna.study.study - INFO - Trial 209 finished with values: [0.025185350315036423, 0.01952814569536424, 0.025747947496155006] and parameters: {'n_layers': 4, 'embedding_dim': 32, 'lr': 0.0005555935556782479, 'lambda_val': 0.0013089325113607559, 'batch_size': 648, 'optimizer': 'RMSprop'}.
2026-05-24 00:48:45,119 - experiment_functions - INFO - Early stopping at epoch 1150. Best Metrics: (0.021155236146867783, 0.01611754966887417, 0.02142548079293287)
2026-05-24 00:48:45,196 - optuna.study.study - INFO - Trial 210 finished with values: [0.021155236146867783, 0.01611754966887417, 0.02142548079293287] and parameters: {'n_layers': 4, 'embedding_dim': 96, 'lr': 0.00036341523831303154, 'lambda_val': 0.0019340508111572378, 'batch_size': 2078, 'optimizer': 'Adam'}.
2026-05-24 00:48:58,543 - experiment_functions - INFO - Early stopping at epoch 1200. Best Metrics: (0.018125806399832155, 0.01447019867549669, 0.018636218250529475)
2026-05-24 00:48:58,703 - optuna.study.study - INFO - Trial 211 finished with values: [0.018125806399832155, 0.01447019867549669, 0.018636218250529475] and parameters: {'n_layers': 2, 'embedding_dim': 64, 'lr': 0.00036341523831303154, 'lambda_val': 0.06649097652898797, 'batch_size': 3873, 'optimizer': 'RMSprop'}.
2026-05-24 00:49:12,382 - experiment_functions - INFO - Early stopping at epoch 1250. Best Metrics: (0.02030459932409711, 0.0161341059602649, 0.02174914252247193)
2026-05-24 00:49:12,473 - optuna.study.study - INFO - Trial 212 finished with values: [0.02030459932409711, 0.0161341059602649, 0.02174914252247193] and parameters: {'n_layers': 3, 'embedding_dim': 32, 'lr': 0.0004983873008546874, 'lambda_val': 0.012312281188503879, 'batch_size': 1672, 'optimizer': 'Adam'}.
2026-05-24 00:49:54,912 - optuna.study.study - INFO - Trial 213 finished with values: [0.008641847951273538, 0.006307947019867549, 0.00867047994510173] and parameters: {'n_layers': 3, 'embedding_dim': 64, 'lr': 4.587776399778839e-05, 'lambda_val': 0.001970520642014681, 'batch_size': 1672, 'optimizer': 'RMSprop'}.
2026-05-24 00:50:08,332 - experiment_functions - INFO - Early stopping at epoch 1250. Best Metrics: (0.02306357990130285, 0.01841059602649007, 0.023820204512890773)
2026-05-24 00:50:08,418 - optuna.study.study - INFO - Trial 214 finished with values: [0.02306357990130285, 0.01841059602649007, 0.023820204512890773] and parameters: {'n_layers': 4, 'embedding_dim': 32, 'lr': 0.00036341523831303154, 'lambda_val': 0.014393132529370842, 'batch_size': 2057, 'optimizer': 'Adam'}.
2026-05-24 00:50:19,630 - experiment_functions - INFO - Early stopping at epoch 1000. Best Metrics: (0.021799038219779392, 0.017706953642384105, 0.022703412170183478)
2026-05-24 00:50:19,718 - optuna.study.study - INFO - Trial 215 finished with values: [0.021799038219779392, 0.017706953642384105, 0.022703412170183478] and parameters: {'n_layers': 4, 'embedding_dim': 96, 'lr': 0.0005555935556782479, 'lambda_val': 0.0016814880990479964, 'batch_size': 947, 'optimizer': 'Adam'}.
2026-05-24 00:51:01,754 - optuna.study.study - INFO - Trial 216 finished with values: [0.026530082487251958, 0.020132450331125828, 0.027531902510660535] and parameters: {'n_layers': 4, 'embedding_dim': 32, 'lr': 0.00037394670395286464, 'lambda_val': 0.0019340508111572378, 'batch_size': 648, 'optimizer': 'Adam'}.
2026-05-24 00:51:09,511 - experiment_functions - INFO - Early stopping at epoch 650. Best Metrics: (0.019559773644068783, 0.014594370860927153, 0.020404916549522107)
2026-05-24 00:51:09,598 - optuna.study.study - INFO - Trial 217 finished with values: [0.019559773644068783, 0.014594370860927153, 0.020404916549522107] and parameters: {'n_layers': 3, 'embedding_dim': 32, 'lr': 0.002281616661023266, 'lambda_val': 7.458121457299012e-06, 'batch_size': 1959, 'optimizer': 'Adam'}.
2026-05-24 00:51:50,577 - optuna.study.study - INFO - Trial 218 finished with values: [0.022470565181938143, 0.014991721854304635, 0.021417650269950586] and parameters: {'n_layers': 2, 'embedding_dim': 32, 'lr': 0.00037394670395286464, 'lambda_val': 0.014393132529370842, 'batch_size': 648, 'optimizer': 'Adam'}.
2026-05-24 00:52:08,189 - experiment_functions - INFO - Early stopping at epoch 1650. Best Metrics: (0.02081733313906443, 0.01673013245033113, 0.022339375369940583)
2026-05-24 00:52:08,290 - optuna.study.study - INFO - Trial 219 finished with values: [0.02081733313906443, 0.01673013245033113, 0.022339375369940583] and parameters: {'n_layers': 3, 'embedding_dim': 32, 'lr': 0.00037394670395286464, 'lambda_val': 0.014393132529370842, 'batch_size': 1672, 'optimizer': 'Adam'}.
2026-05-24 00:52:31,035 - experiment_functions - INFO - Early stopping at epoch 1950. Best Metrics: (0.01658676417408495, 0.014304635761589406, 0.017875976005994144)
2026-05-24 00:52:31,129 - optuna.study.study - INFO - Trial 220 finished with values: [0.01658676417408495, 0.014304635761589406, 0.017875976005994144] and parameters: {'n_layers': 3, 'embedding_dim': 96, 'lr': 0.00022798255951858533, 'lambda_val': 0.014393132529370842, 'batch_size': 3873, 'optimizer': 'RMSprop'}.
2026-05-24 00:52:41,047 - experiment_functions - INFO - Early stopping at epoch 850. Best Metrics: (0.018792514534020845, 0.014188741721854305, 0.018686279516208416)
2026-05-24 00:52:41,865 - optuna.study.study - INFO - Trial 221 finished with values: [0.018792514534020845, 0.014188741721854305, 0.018686279516208416] and parameters: {'n_layers': 3, 'embedding_dim': 96, 'lr': 0.0005555935556782479, 'lambda_val': 0.0019340508111572378, 'batch_size': 2049, 'optimizer': 'RMSprop'}.
2026-05-24 00:52:48,133 - experiment_functions - INFO - Early stopping at epoch 500. Best Metrics: (0.006237442629765047, 0.005033112582781457, 0.006328403028925591)
2026-05-24 00:52:48,216 - optuna.study.study - INFO - Trial 222 finished with values: [0.006237442629765047, 0.005033112582781457, 0.006328403028925591] and parameters: {'n_layers': 3, 'embedding_dim': 32, 'lr': 0.08999777933387534, 'lambda_val': 0.014393132529370842, 'batch_size': 2032, 'optimizer': 'Adam'}.
2026-05-24 00:53:04,121 - experiment_functions - INFO - Early stopping at epoch 1450. Best Metrics: (0.025706986616152425, 0.021374172185430466, 0.02745766378534228)
2026-05-24 00:53:04,822 - optuna.study.study - INFO - Trial 223 finished with values: [0.025706986616152425, 0.021374172185430466, 0.02745766378534228] and parameters: {'n_layers': 4, 'embedding_dim': 32, 'lr': 0.00036341523831303154, 'lambda_val': 0.04990172064077824, 'batch_size': 1304, 'optimizer': 'Adam'}.
2026-05-24 00:53:12,079 - experiment_functions - INFO - Early stopping at epoch 600. Best Metrics: (0.022200021078267164, 0.018038079470198674, 0.023234746415476997)
2026-05-24 00:53:12,189 - optuna.study.study - INFO - Trial 224 finished with values: [0.022200021078267164, 0.018038079470198674, 0.023234746415476997] and parameters: {'n_layers': 3, 'embedding_dim': 32, 'lr': 0.0010358017727309806, 'lambda_val': 0.04990172064077824, 'batch_size': 2478, 'optimizer': 'RMSprop'}.
2026-05-24 00:53:32,379 - experiment_functions - INFO - Early stopping at epoch 1850. Best Metrics: (0.021242501855068048, 0.01734271523178808, 0.022176677424355702)
2026-05-24 00:53:32,542 - optuna.study.study - INFO - Trial 225 finished with values: [0.021242501855068048, 0.01734271523178808, 0.022176677424355702] and parameters: {'n_layers': 4, 'embedding_dim': 32, 'lr': 0.00036341523831303154, 'lambda_val': 0.0019340508111572378, 'batch_size': 2078, 'optimizer': 'RMSprop'}.
2026-05-24 00:54:13,923 - optuna.study.study - INFO - Trial 226 finished with values: [0.01643027229630092, 0.012243377483443707, 0.01677516400107162] and parameters: {'n_layers': 3, 'embedding_dim': 32, 'lr': 0.00016066111690824192, 'lambda_val': 0.0015802581456022529, 'batch_size': 1672, 'optimizer': 'Adam'}.
2026-05-24 00:54:29,449 - experiment_functions - INFO - Early stopping at epoch 1250. Best Metrics: (0.02243259886207469, 0.016788079470198676, 0.022640852436949504)
2026-05-24 00:54:29,532 - optuna.study.study - INFO - Trial 227 finished with values: [0.02243259886207469, 0.016788079470198676, 0.022640852436949504] and parameters: {'n_layers': 3, 'embedding_dim': 32, 'lr': 0.0005555935556782479, 'lambda_val': 0.004088900478079308, 'batch_size': 1672, 'optimizer': 'Adam'}.
2026-05-24 00:55:11,430 - optuna.study.study - INFO - Trial 228 finished with values: [0.024269010493365717, 0.01705298013245033, 0.023945884287035125] and parameters: {'n_layers': 3, 'embedding_dim': 32, 'lr': 0.0003602499380989214, 'lambda_val': 0.0021289404794494937, 'batch_size': 648, 'optimizer': 'Adam'}.
2026-05-24 00:55:52,790 - optuna.study.study - INFO - Trial 229 finished with values: [0.017274891671865297, 0.012367549668874173, 0.017664745009358166] and parameters: {'n_layers': 2, 'embedding_dim': 32, 'lr': 0.00019683864261697896, 'lambda_val': 0.014393132529370842, 'batch_size': 2057, 'optimizer': 'Adam'}.
2026-05-24 00:56:00,161 - experiment_functions - INFO - Early stopping at epoch 600. Best Metrics: (0.02278495869320317, 0.01849337748344371, 0.023923732639161394)
2026-05-24 00:56:00,328 - optuna.study.study - INFO - Trial 230 finished with values: [0.02278495869320317, 0.01849337748344371, 0.023923732639161394] and parameters: {'n_layers': 4, 'embedding_dim': 32, 'lr': 0.0010358017727309806, 'lambda_val': 0.04990172064077824, 'batch_size': 1433, 'optimizer': 'RMSprop'}.
2026-05-24 00:56:18,779 - experiment_functions - INFO - Early stopping at epoch 1700. Best Metrics: (0.020350290444527727, 0.015339403973509936, 0.020730218739534095)
2026-05-24 00:56:18,872 - optuna.study.study - INFO - Trial 231 finished with values: [0.020350290444527727, 0.015339403973509936, 0.020730218739534095] and parameters: {'n_layers': 3, 'embedding_dim': 32, 'lr': 0.00046855590060388054, 'lambda_val': 7.458121457299012e-06, 'batch_size': 1672, 'optimizer': 'Adam'}.
2026-05-24 00:56:50,234 - experiment_functions - INFO - Early stopping at epoch 3000. Best Metrics: (0.022641744167076042, 0.01711092715231788, 0.023098944690168717)
2026-05-24 00:56:50,799 - optuna.study.study - INFO - Trial 232 finished with values: [0.022641744167076042, 0.01711092715231788, 0.023098944690168717] and parameters: {'n_layers': 3, 'embedding_dim': 32, 'lr': 0.00037394670395286464, 'lambda_val': 9.493825970205553e-06, 'batch_size': 1672, 'optimizer': 'RMSprop'}.
2026-05-24 00:57:10,907 - experiment_functions - INFO - Early stopping at epoch 1850. Best Metrics: (0.02431084219440813, 0.017135761589403973, 0.02408227650013774)
2026-05-24 00:57:11,227 - optuna.study.study - INFO - Trial 233 finished with values: [0.02431084219440813, 0.017135761589403973, 0.02408227650013774] and parameters: {'n_layers': 3, 'embedding_dim': 32, 'lr': 0.0005555935556782479, 'lambda_val': 0.0019340508111572378, 'batch_size': 900, 'optimizer': 'Adam'}.
2026-05-24 00:57:37,333 - experiment_functions - INFO - Early stopping at epoch 2500. Best Metrics: (0.018999427891075324, 0.01369205298013245, 0.01931960450411587)
2026-05-24 00:57:37,427 - optuna.study.study - INFO - Trial 234 finished with values: [0.018999427891075324, 0.01369205298013245, 0.01931960450411587] and parameters: {'n_layers': 1, 'embedding_dim': 32, 'lr': 0.00036341523831303154, 'lambda_val': 0.014393132529370842, 'batch_size': 2478, 'optimizer': 'Adam'}.
2026-05-24 00:57:44,872 - experiment_functions - INFO - Early stopping at epoch 600. Best Metrics: (0.02100942670303931, 0.01593543046357616, 0.021579012320015252)
2026-05-24 00:57:45,149 - optuna.study.study - INFO - Trial 235 finished with values: [0.02100942670303931, 0.01593543046357616, 0.021579012320015252] and parameters: {'n_layers': 3, 'embedding_dim': 64, 'lr': 0.0014918556660024908, 'lambda_val': 0.000623307143836203, 'batch_size': 1047, 'optimizer': 'RMSprop'}.
2026-05-24 00:58:13,579 - experiment_functions - INFO - Early stopping at epoch 2700. Best Metrics: (0.023159811988438424, 0.01734271523178808, 0.023358579883741307)
2026-05-24 00:58:13,665 - optuna.study.study - INFO - Trial 236 finished with values: [0.023159811988438424, 0.01734271523178808, 0.023358579883741307] and parameters: {'n_layers': 3, 'embedding_dim': 64, 'lr': 0.00036341523831303154, 'lambda_val': 0.0016255890654076662, 'batch_size': 900, 'optimizer': 'Adam'}.
2026-05-24 00:58:41,590 - experiment_functions - INFO - Early stopping at epoch 2550. Best Metrics: (0.020939584172943178, 0.017574503311258278, 0.022705533302945582)
2026-05-24 00:58:41,674 - optuna.study.study - INFO - Trial 237 finished with values: [0.020939584172943178, 0.017574503311258278, 0.022705533302945582] and parameters: {'n_layers': 4, 'embedding_dim': 32, 'lr': 0.00037394670395286464, 'lambda_val': 0.00012602204578325484, 'batch_size': 1672, 'optimizer': 'RMSprop'}.
2026-05-24 00:58:56,010 - experiment_functions - INFO - Early stopping at epoch 1250. Best Metrics: (0.021808899900290987, 0.017963576158940397, 0.023108708721380263)
2026-05-24 00:58:56,099 - optuna.study.study - INFO - Trial 238 finished with values: [0.021808899900290987, 0.017963576158940397, 0.023108708721380263] and parameters: {'n_layers': 4, 'embedding_dim': 32, 'lr': 0.00037394670395286464, 'lambda_val': 0.014393132529370842, 'batch_size': 2478, 'optimizer': 'Adam'}.
2026-05-24 00:59:06,589 - experiment_functions - INFO - Early stopping at epoch 900. Best Metrics: (0.0196072408949783, 0.014710264900662254, 0.020014306987710707)
2026-05-24 00:59:07,120 - optuna.study.study - INFO - Trial 239 finished with values: [0.0196072408949783, 0.014710264900662254, 0.020014306987710707] and parameters: {'n_layers': 3, 'embedding_dim': 32, 'lr': 0.0009603867550939608, 'lambda_val': 3.5897523365133767e-06, 'batch_size': 1672, 'optimizer': 'Adam'}.
2026-05-24 00:59:20,512 - experiment_functions - INFO - Early stopping at epoch 1250. Best Metrics: (0.021254934183336287, 0.015488410596026491, 0.02162332897671393)
2026-05-24 00:59:20,604 - optuna.study.study - INFO - Trial 240 finished with values: [0.021254934183336287, 0.015488410596026491, 0.02162332897671393] and parameters: {'n_layers': 3, 'embedding_dim': 32, 'lr': 0.0005555935556782479, 'lambda_val': 0.0015802581456022529, 'batch_size': 2078, 'optimizer': 'Adam'}.
2026-05-24 00:59:26,283 - experiment_functions - INFO - Early stopping at epoch 500. Best Metrics: (0.0054897038728861335, 0.00412251655629139, 0.0052244660984316965)
2026-05-24 00:59:26,367 - optuna.study.study - INFO - Trial 241 finished with values: [0.0054897038728861335, 0.00412251655629139, 0.0052244660984316965] and parameters: {'n_layers': 1, 'embedding_dim': 64, 'lr': 0.02747539628500044, 'lambda_val': 0.0011861252157314979, 'batch_size': 2104, 'optimizer': 'SGD'}.
2026-05-24 00:59:43,730 - experiment_functions - INFO - Early stopping at epoch 1700. Best Metrics: (0.0228695191854529, 0.017450331125827816, 0.02376422174556369)
2026-05-24 00:59:43,823 - optuna.study.study - INFO - Trial 242 finished with values: [0.0228695191854529, 0.017450331125827816, 0.02376422174556369] and parameters: {'n_layers': 4, 'embedding_dim': 32, 'lr': 0.00036341523831303154, 'lambda_val': 2.800896377517058e-05, 'batch_size': 1410, 'optimizer': 'Adam'}.
2026-05-24 01:00:01,446 - experiment_functions - INFO - Early stopping at epoch 1750. Best Metrics: (0.020197002897056192, 0.014288079470198676, 0.01997218567146042)
2026-05-24 01:00:01,541 - optuna.study.study - INFO - Trial 243 finished with values: [0.020197002897056192, 0.014288079470198676, 0.01997218567146042] and parameters: {'n_layers': 2, 'embedding_dim': 32, 'lr': 0.00037394670395286464, 'lambda_val': 0.014393132529370842, 'batch_size': 2057, 'optimizer': 'Adam'}.
2026-05-24 01:00:08,979 - experiment_functions - INFO - Early stopping at epoch 650. Best Metrics: (0.01871822140876817, 0.01501655629139073, 0.020016293953607742)
2026-05-24 01:00:09,063 - optuna.study.study - INFO - Trial 244 finished with values: [0.01871822140876817, 0.01501655629139073, 0.020016293953607742] and parameters: {'n_layers': 3, 'embedding_dim': 64, 'lr': 0.0009603867550939608, 'lambda_val': 0.007968655583934245, 'batch_size': 1672, 'optimizer': 'RMSprop'}.
2026-05-24 01:00:15,969 - experiment_functions - INFO - Early stopping at epoch 600. Best Metrics: (0.019295098801693996, 0.01507450331125828, 0.020098856810381743)
2026-05-24 01:00:17,097 - optuna.study.study - INFO - Trial 245 finished with values: [0.019295098801693996, 0.01507450331125828, 0.020098856810381743] and parameters: {'n_layers': 3, 'embedding_dim': 96, 'lr': 0.0014918556660024908, 'lambda_val': 0.0011861252157314979, 'batch_size': 1047, 'optimizer': 'RMSprop'}.
2026-05-24 01:00:38,820 - experiment_functions - INFO - Early stopping at epoch 2050. Best Metrics: (0.019734092769402942, 0.015380794701986757, 0.020725503843657796)
2026-05-24 01:00:39,118 - optuna.study.study - INFO - Trial 246 finished with values: [0.019734092769402942, 0.015380794701986757, 0.020725503843657796] and parameters: {'n_layers': 3, 'embedding_dim': 32, 'lr': 0.00036341523831303154, 'lambda_val': 0.0019340508111572378, 'batch_size': 2478, 'optimizer': 'Adam'}.
2026-05-24 01:01:07,436 - experiment_functions - INFO - Early stopping at epoch 2800. Best Metrics: (0.01993290976969904, 0.01524834437086093, 0.0200394454723864)
2026-05-24 01:01:07,530 - optuna.study.study - INFO - Trial 247 finished with values: [0.01993290976969904, 0.01524834437086093, 0.0200394454723864] and parameters: {'n_layers': 3, 'embedding_dim': 32, 'lr': 0.00037394670395286464, 'lambda_val': 7.3301173643444555e-06, 'batch_size': 1959, 'optimizer': 'Adam'}.
2026-05-24 01:01:17,735 - experiment_functions - INFO - Early stopping at epoch 900. Best Metrics: (0.019071359986478926, 0.014884105960264902, 0.01895832299002264)
2026-05-24 01:01:18,924 - optuna.study.study - INFO - Trial 248 finished with values: [0.019071359986478926, 0.014884105960264902, 0.01895832299002264] and parameters: {'n_layers': 3, 'embedding_dim': 96, 'lr': 0.0005555935556782479, 'lambda_val': 0.014393132529370842, 'batch_size': 1672, 'optimizer': 'Adam'}.
2026-05-24 01:01:35,837 - experiment_functions - INFO - Early stopping at epoch 1400. Best Metrics: (0.0194917837108664, 0.015115894039735102, 0.02010752665091644)
2026-05-24 01:01:36,169 - optuna.study.study - INFO - Trial 249 finished with values: [0.0194917837108664, 0.015115894039735102, 0.02010752665091644] and parameters: {'n_layers': 3, 'embedding_dim': 32, 'lr': 0.00037394670395286464, 'lambda_val': 0.014393132529370842, 'batch_size': 3658, 'optimizer': 'Adam'}.
2026-05-24 01:01:45,891 - experiment_functions - INFO - Early stopping at epoch 800. Best Metrics: (0.019016253141242327, 0.015298013245033111, 0.020102686498325657)
2026-05-24 01:01:45,979 - optuna.study.study - INFO - Trial 250 finished with values: [0.019016253141242327, 0.015298013245033111, 0.020102686498325657] and parameters: {'n_layers': 4, 'embedding_dim': 32, 'lr': 0.0010358017727309806, 'lambda_val': 1.3665306039849964e-05, 'batch_size': 3288, 'optimizer': 'Adam'}.
2026-05-24 01:01:58,704 - experiment_functions - INFO - Early stopping at epoch 1150. Best Metrics: (0.019567011231437847, 0.015298013245033111, 0.020470505128063705)
2026-05-24 01:01:58,823 - optuna.study.study - INFO - Trial 251 finished with values: [0.019567011231437847, 0.015298013245033111, 0.020470505128063705] and parameters: {'n_layers': 3, 'embedding_dim': 32, 'lr': 0.0005555935556782479, 'lambda_val': 2.1584212621107985e-06, 'batch_size': 2049, 'optimizer': 'Adam'}.
2026-05-24 01:02:32,696 - experiment_functions - INFO - Early stopping at epoch 3300. Best Metrics: (0.024300584281981678, 0.015827814569536424, 0.023498775297069886)
2026-05-24 01:02:33,588 - optuna.study.study - INFO - Trial 252 finished with values: [0.024300584281981678, 0.015827814569536424, 0.023498775297069886] and parameters: {'n_layers': 1, 'embedding_dim': 32, 'lr': 0.0005555935556782479, 'lambda_val': 3.7192195203912093e-06, 'batch_size': 648, 'optimizer': 'Adam'}.
2026-05-24 01:02:57,782 - experiment_functions - INFO - Early stopping at epoch 2300. Best Metrics: (0.02016802847532526, 0.015355960264900662, 0.020707005214499724)
2026-05-24 01:02:57,882 - optuna.study.study - INFO - Trial 253 finished with values: [0.02016802847532526, 0.015355960264900662, 0.020707005214499724] and parameters: {'n_layers': 2, 'embedding_dim': 32, 'lr': 0.00037394670395286464, 'lambda_val': 0.014393132529370842, 'batch_size': 1672, 'optimizer': 'RMSprop'}.
2026-05-24 01:03:14,034 - experiment_functions - INFO - Early stopping at epoch 1500. Best Metrics: (0.019828584422917454, 0.013932119205298014, 0.019608060975836884)
2026-05-24 01:03:14,593 - optuna.study.study - INFO - Trial 254 finished with values: [0.019828584422917454, 0.013932119205298014, 0.019608060975836884] and parameters: {'n_layers': 2, 'embedding_dim': 32, 'lr': 0.0005555935556782479, 'lambda_val': 0.0019340508111572378, 'batch_size': 2238, 'optimizer': 'Adam'}.
2026-05-24 01:03:31,845 - experiment_functions - INFO - Early stopping at epoch 1600. Best Metrics: (0.02312265357982474, 0.018725165562913905, 0.024517835798097392)
