2026-05-24 03:28:46,918 - optuna.study.study - INFO - Trial 219 finished with values: [0.012254466267025064, 0.009461920529801325, 0.01275930398241642] and parameters: {'n_layers': 3, 'embedding_dim': 32, 'lr': 9.143129612583693e-05, 'lambda_val': 0.0010063349675964721, 'batch_size': 2473, 'optimizer': 'Adam'}.
2026-05-24 03:28:53,710 - experiment_functions - INFO - Early stopping at epoch 600. Best Metrics: (0.021460772847406107, 0.014064569536423842, 0.020618210520003025)
2026-05-24 03:28:53,835 - optuna.study.study - INFO - Trial 220 finished with values: [0.021460772847406107, 0.014064569536423842, 0.020618210520003025] and parameters: {'n_layers': 1, 'embedding_dim': 32, 'lr': 0.004988191232611552, 'lambda_val': 6.003769581175366e-05, 'batch_size': 1282, 'optimizer': 'Adam'}.
2026-05-24 03:29:05,740 - experiment_functions - INFO - Early stopping at epoch 1050. Best Metrics: (0.020530640413627944, 0.015306291390728477, 0.020329946517536446)
2026-05-24 03:29:05,823 - optuna.study.study - INFO - Trial 221 finished with values: [0.020530640413627944, 0.015306291390728477, 0.020329946517536446] and parameters: {'n_layers': 4, 'embedding_dim': 32, 'lr': 0.0004568670531170521, 'lambda_val': 5.394142374521182e-06, 'batch_size': 3068, 'optimizer': 'Adam'}.
2026-05-24 03:29:39,595 - experiment_functions - INFO - Early stopping at epoch 3400. Best Metrics: (0.018855894023472857, 0.013774834437086091, 0.0192042947367752)
2026-05-24 03:29:39,681 - optuna.study.study - INFO - Trial 222 finished with values: [0.018855894023472857, 0.013774834437086091, 0.0192042947367752] and parameters: {'n_layers': 1, 'embedding_dim': 32, 'lr': 0.00036006007162814904, 'lambda_val': 2.7695935649997752e-05, 'batch_size': 2064, 'optimizer': 'RMSprop'}.
2026-05-24 03:29:52,789 - experiment_functions - INFO - Early stopping at epoch 1200. Best Metrics: (0.022384602707974523, 0.018501655629139073, 0.023757216024933952)
2026-05-24 03:29:52,865 - optuna.study.study - INFO - Trial 223 finished with values: [0.022384602707974523, 0.018501655629139073, 0.023757216024933952] and parameters: {'n_layers': 4, 'embedding_dim': 32, 'lr': 0.0004568670531170521, 'lambda_val': 0.05810316365964571, 'batch_size': 1628, 'optimizer': 'Adam'}.
2026-05-24 03:30:32,917 - optuna.study.study - INFO - Trial 224 finished with values: [0.006022028294961293, 0.004942052980132451, 0.006232710855294216] and parameters: {'n_layers': 4, 'embedding_dim': 32, 'lr': 1.6935199479097733e-05, 'lambda_val': 5.394142374521182e-06, 'batch_size': 2473, 'optimizer': 'Adam'}.
2026-05-24 03:30:40,225 - experiment_functions - INFO - Early stopping at epoch 600. Best Metrics: (0.021409327275106017, 0.01644039735099338, 0.022335986948139774)
2026-05-24 03:30:40,331 - optuna.study.study - INFO - Trial 225 finished with values: [0.021409327275106017, 0.01644039735099338, 0.022335986948139774] and parameters: {'n_layers': 3, 'embedding_dim': 128, 'lr': 0.0015125765536328827, 'lambda_val': 7.397534001840383e-06, 'batch_size': 659, 'optimizer': 'RMSprop'}.
2026-05-24 03:30:55,943 - experiment_functions - INFO - Early stopping at epoch 1400. Best Metrics: (0.01961494871618911, 0.016407284768211922, 0.021135792885542355)
2026-05-24 03:30:56,062 - optuna.study.study - INFO - Trial 226 finished with values: [0.01961494871618911, 0.016407284768211922, 0.021135792885542355] and parameters: {'n_layers': 4, 'embedding_dim': 96, 'lr': 0.00036006007162814904, 'lambda_val': 1.6246953393264848e-05, 'batch_size': 1628, 'optimizer': 'RMSprop'}.
2026-05-24 03:31:02,050 - experiment_functions - INFO - Early stopping at epoch 500. Best Metrics: (0.005127825130552459, 0.003956953642384106, 0.005021792162098188)
2026-05-24 03:31:02,952 - optuna.study.study - INFO - Trial 227 finished with values: [0.005127825130552459, 0.003956953642384106, 0.005021792162098188] and parameters: {'n_layers': 4, 'embedding_dim': 32, 'lr': 0.0004568670531170521, 'lambda_val': 0.05810316365964571, 'batch_size': 659, 'optimizer': 'Adam'}.
2026-05-24 03:31:09,395 - experiment_functions - INFO - Early stopping at epoch 550. Best Metrics: (0.017991798514232583, 0.01369205298013245, 0.018403394458974796)
2026-05-24 03:31:09,929 - optuna.study.study - INFO - Trial 228 finished with values: [0.017991798514232583, 0.01369205298013245, 0.018403394458974796] and parameters: {'n_layers': 2, 'embedding_dim': 32, 'lr': 0.0025646859458602136, 'lambda_val': 1.002227016896905e-06, 'batch_size': 2142, 'optimizer': 'RMSprop'}.
2026-05-24 03:31:26,645 - experiment_functions - INFO - Early stopping at epoch 1600. Best Metrics: (0.020371550475054272, 0.014379139072847682, 0.020473316203830815)
2026-05-24 03:31:26,767 - optuna.study.study - INFO - Trial 229 finished with values: [0.020371550475054272, 0.014379139072847682, 0.020473316203830815] and parameters: {'n_layers': 1, 'embedding_dim': 32, 'lr': 0.000629058738902094, 'lambda_val': 7.397534001840383e-06, 'batch_size': 1256, 'optimizer': 'Adam'}.
2026-05-24 03:31:33,284 - experiment_functions - INFO - Early stopping at epoch 550. Best Metrics: (0.0216347767352983, 0.01746688741721854, 0.023163914004072646)
2026-05-24 03:31:34,307 - optuna.study.study - INFO - Trial 230 finished with values: [0.0216347767352983, 0.01746688741721854, 0.023163914004072646] and parameters: {'n_layers': 4, 'embedding_dim': 32, 'lr': 0.0020411641802137886, 'lambda_val': 4.4508072112502196e-05, 'batch_size': 659, 'optimizer': 'RMSprop'}.
2026-05-24 03:31:40,957 - experiment_functions - INFO - Early stopping at epoch 550. Best Metrics: (0.018095633351733358, 0.013493377483443708, 0.0182142823535611)
2026-05-24 03:31:41,051 - optuna.study.study - INFO - Trial 231 finished with values: [0.018095633351733358, 0.013493377483443708, 0.0182142823535611] and parameters: {'n_layers': 2, 'embedding_dim': 64, 'lr': 0.0025646859458602136, 'lambda_val': 5.138211460433891e-05, 'batch_size': 2028, 'optimizer': 'RMSprop'}.
2026-05-24 03:31:50,229 - experiment_functions - INFO - Early stopping at epoch 800. Best Metrics: (0.017950018976979648, 0.014445364238410596, 0.018584647771843377)
2026-05-24 03:31:50,387 - optuna.study.study - INFO - Trial 232 finished with values: [0.017950018976979648, 0.014445364238410596, 0.018584647771843377] and parameters: {'n_layers': 3, 'embedding_dim': 64, 'lr': 0.001073497477166827, 'lambda_val': 5.394142374521182e-06, 'batch_size': 2583, 'optimizer': 'Adam'}.
2026-05-24 03:32:08,493 - experiment_functions - INFO - Early stopping at epoch 1200. Best Metrics: (0.01827407883361799, 0.013874172185430463, 0.018757450248276856)
2026-05-24 03:32:08,578 - optuna.study.study - INFO - Trial 233 finished with values: [0.01827407883361799, 0.013874172185430463, 0.018757450248276856] and parameters: {'n_layers': 2, 'embedding_dim': 96, 'lr': 0.0005700378100001039, 'lambda_val': 1.002227016896905e-06, 'batch_size': 2365, 'optimizer': 'Adam'}.
2026-05-24 03:32:27,882 - experiment_functions - INFO - Early stopping at epoch 1800. Best Metrics: (0.02159308289578064, 0.016548013245033112, 0.022361288716657428)
2026-05-24 03:32:28,938 - optuna.study.study - INFO - Trial 234 finished with values: [0.02159308289578064, 0.016548013245033112, 0.022361288716657428] and parameters: {'n_layers': 3, 'embedding_dim': 96, 'lr': 0.0004568670531170521, 'lambda_val': 7.397534001840383e-06, 'batch_size': 659, 'optimizer': 'RMSprop'}.
2026-05-24 03:33:00,898 - experiment_functions - INFO - Early stopping at epoch 3150. Best Metrics: (0.023415739667129804, 0.01602649006622517, 0.02329432843040956)
2026-05-24 03:33:00,978 - optuna.study.study - INFO - Trial 235 finished with values: [0.023415739667129804, 0.01602649006622517, 0.02329432843040956] and parameters: {'n_layers': 2, 'embedding_dim': 32, 'lr': 0.0004568670531170521, 'lambda_val': 1.002227016896905e-06, 'batch_size': 659, 'optimizer': 'Adam'}.
2026-05-24 03:33:10,080 - experiment_functions - INFO - Early stopping at epoch 800. Best Metrics: (0.017434527297834273, 0.01353476821192053, 0.017647163988923464)
2026-05-24 03:33:10,316 - optuna.study.study - INFO - Trial 236 finished with values: [0.017434527297834273, 0.01353476821192053, 0.017647163988923464] and parameters: {'n_layers': 3, 'embedding_dim': 32, 'lr': 0.001073497477166827, 'lambda_val': 0.0009527201315311902, 'batch_size': 2752, 'optimizer': 'Adam'}.
2026-05-24 03:33:20,155 - experiment_functions - INFO - Early stopping at epoch 850. Best Metrics: (0.021281468397796644, 0.01718543046357616, 0.02200965857506214)
2026-05-24 03:33:20,243 - optuna.study.study - INFO - Trial 237 finished with values: [0.021281468397796644, 0.01718543046357616, 0.02200965857506214] and parameters: {'n_layers': 4, 'embedding_dim': 32, 'lr': 0.0008654503808156264, 'lambda_val': 4.7598894564927634e-05, 'batch_size': 1036, 'optimizer': 'RMSprop'}.
2026-05-24 03:33:28,187 - experiment_functions - INFO - Early stopping at epoch 700. Best Metrics: (0.016727735609670013, 0.01216887417218543, 0.01668158510499308)
2026-05-24 03:33:28,275 - optuna.study.study - INFO - Trial 238 finished with values: [0.016727735609670013, 0.01216887417218543, 0.01668158510499308] and parameters: {'n_layers': 1, 'embedding_dim': 128, 'lr': 0.0018521591652371555, 'lambda_val': 7.397534001840383e-06, 'batch_size': 1676, 'optimizer': 'Adam'}.
2026-05-24 03:33:36,335 - experiment_functions - INFO - Early stopping at epoch 700. Best Metrics: (0.025789953656531323, 0.019801324503311256, 0.026775189973804313)
2026-05-24 03:33:37,630 - optuna.study.study - INFO - Trial 239 finished with values: [0.025789953656531323, 0.019801324503311256, 0.026775189973804313] and parameters: {'n_layers': 4, 'embedding_dim': 32, 'lr': 0.0016659872807635835, 'lambda_val': 0.0012679169415010568, 'batch_size': 659, 'optimizer': 'Adam'}.
2026-05-24 03:33:52,402 - experiment_functions - INFO - Early stopping at epoch 1200. Best Metrics: (0.01669650393887099, 0.014089403973509934, 0.018177845987893543)
2026-05-24 03:33:53,683 - optuna.study.study - INFO - Trial 240 finished with values: [0.01669650393887099, 0.014089403973509934, 0.018177845987893543] and parameters: {'n_layers': 3, 'embedding_dim': 96, 'lr': 0.0004568670531170521, 'lambda_val': 1.113463354596578e-05, 'batch_size': 2473, 'optimizer': 'Adam'}.
2026-05-24 03:34:07,488 - experiment_functions - INFO - Early stopping at epoch 1250. Best Metrics: (0.018881498059102966, 0.015596026490066226, 0.020434561371407204)
2026-05-24 03:34:07,574 - optuna.study.study - INFO - Trial 241 finished with values: [0.018881498059102966, 0.015596026490066226, 0.020434561371407204] and parameters: {'n_layers': 3, 'embedding_dim': 96, 'lr': 0.0005700378100001039, 'lambda_val': 1.113463354596578e-05, 'batch_size': 979, 'optimizer': 'Adam'}.
2026-05-24 03:34:14,171 - experiment_functions - INFO - Early stopping at epoch 550. Best Metrics: (0.020194993955150543, 0.013899006622516558, 0.01996739731195768)
2026-05-24 03:34:14,463 - optuna.study.study - INFO - Trial 242 finished with values: [0.020194993955150543, 0.013899006622516558, 0.01996739731195768] and parameters: {'n_layers': 1, 'embedding_dim': 32, 'lr': 0.0024308495485956642, 'lambda_val': 0.0012679169415010568, 'batch_size': 2365, 'optimizer': 'RMSprop'}.
2026-05-24 03:34:21,015 - experiment_functions - INFO - Early stopping at epoch 600. Best Metrics: (0.005043383198344582, 0.004114238410596027, 0.005257999104245521)
2026-05-24 03:34:21,479 - optuna.study.study - INFO - Trial 243 finished with values: [0.005043383198344582, 0.004114238410596027, 0.005257999104245521] and parameters: {'n_layers': 2, 'embedding_dim': 32, 'lr': 0.003052355703485208, 'lambda_val': 0.0012679169415010568, 'batch_size': 659, 'optimizer': 'SGD'}.
2026-05-24 03:34:28,039 - experiment_functions - INFO - Early stopping at epoch 550. Best Metrics: (0.012976578942392307, 0.010745033112582783, 0.013777870300909541)
2026-05-24 03:34:29,367 - optuna.study.study - INFO - Trial 244 finished with values: [0.012976578942392307, 0.010745033112582783, 0.013777870300909541] and parameters: {'n_layers': 4, 'embedding_dim': 32, 'lr': 0.01921673053653918, 'lambda_val': 7.397534001840383e-06, 'batch_size': 2142, 'optimizer': 'Adam'}.
2026-05-24 03:34:35,587 - experiment_functions - INFO - Early stopping at epoch 500. Best Metrics: (0.005208493386927385, 0.004346026490066225, 0.0053885426938569654)
2026-05-24 03:34:36,149 - optuna.study.study - INFO - Trial 245 finished with values: [0.005208493386927385, 0.004346026490066225, 0.0053885426938569654] and parameters: {'n_layers': 4, 'embedding_dim': 128, 'lr': 1.1550724949920035e-05, 'lambda_val': 1.6592144824872775e-06, 'batch_size': 1941, 'optimizer': 'SGD'}.
2026-05-24 03:34:43,464 - experiment_functions - INFO - Early stopping at epoch 600. Best Metrics: (0.01860694886033729, 0.01568708609271523, 0.02029215575082067)
2026-05-24 03:34:43,559 - optuna.study.study - INFO - Trial 246 finished with values: [0.01860694886033729, 0.01568708609271523, 0.02029215575082067] and parameters: {'n_layers': 4, 'embedding_dim': 64, 'lr': 0.001073497477166827, 'lambda_val': 0.00034199571335759705, 'batch_size': 2473, 'optimizer': 'RMSprop'}.
2026-05-24 03:34:51,210 - experiment_functions - INFO - Early stopping at epoch 650. Best Metrics: (0.019604429283772196, 0.016067880794701988, 0.02131176428507619)
2026-05-24 03:34:51,550 - optuna.study.study - INFO - Trial 247 finished with values: [0.019604429283772196, 0.016067880794701988, 0.02131176428507619] and parameters: {'n_layers': 4, 'embedding_dim': 32, 'lr': 0.0008654503808156264, 'lambda_val': 0.003987651252810029, 'batch_size': 2142, 'optimizer': 'RMSprop'}.
2026-05-24 03:35:11,672 - experiment_functions - INFO - Early stopping at epoch 1400. Best Metrics: (0.017822958597559287, 0.012864238410596024, 0.018092077274420373)
2026-05-24 03:35:11,886 - optuna.study.study - INFO - Trial 248 finished with values: [0.017822958597559287, 0.012864238410596024, 0.018092077274420373] and parameters: {'n_layers': 1, 'embedding_dim': 96, 'lr': 0.000629058738902094, 'lambda_val': 5.138211460433891e-05, 'batch_size': 1628, 'optimizer': 'Adam'}.
2026-05-24 03:35:24,817 - experiment_functions - INFO - Early stopping at epoch 1150. Best Metrics: (0.023939527854004976, 0.01855960264900662, 0.024937838724292713)
2026-05-24 03:35:24,909 - optuna.study.study - INFO - Trial 249 finished with values: [0.023939527854004976, 0.01855960264900662, 0.024937838724292713] and parameters: {'n_layers': 4, 'embedding_dim': 96, 'lr': 0.0004649352000072556, 'lambda_val': 1.8203246882701353e-06, 'batch_size': 679, 'optimizer': 'RMSprop'}.
2026-05-24 03:35:35,696 - experiment_functions - INFO - Early stopping at epoch 950. Best Metrics: (0.022937839634564913, 0.01824503311258278, 0.024066656987441908)
2026-05-24 03:35:35,803 - optuna.study.study - INFO - Trial 250 finished with values: [0.022937839634564913, 0.01824503311258278, 0.024066656987441908] and parameters: {'n_layers': 4, 'embedding_dim': 64, 'lr': 0.0005700378100001039, 'lambda_val': 1.113463354596578e-05, 'batch_size': 979, 'optimizer': 'RMSprop'}.
2026-05-24 03:35:45,980 - experiment_functions - INFO - Early stopping at epoch 800. Best Metrics: (0.018045210518224577, 0.01294701986754967, 0.017808635412045182)
2026-05-24 03:35:46,084 - optuna.study.study - INFO - Trial 251 finished with values: [0.018045210518224577, 0.01294701986754967, 0.017808635412045182] and parameters: {'n_layers': 2, 'embedding_dim': 32, 'lr': 0.001073497477166827, 'lambda_val': 1.002227016896905e-06, 'batch_size': 3810, 'optimizer': 'Adam'}.
2026-05-24 03:35:52,611 - experiment_functions - INFO - Early stopping at epoch 550. Best Metrics: (0.011463164965826958, 0.010670529801324503, 0.01262655254714057)
2026-05-24 03:35:52,706 - optuna.study.study - INFO - Trial 252 finished with values: [0.011463164965826958, 0.010670529801324503, 0.01262655254714057] and parameters: {'n_layers': 4, 'embedding_dim': 32, 'lr': 0.004145362223766302, 'lambda_val': 0.003987651252810029, 'batch_size': 2365, 'optimizer': 'RMSprop'}.
2026-05-24 03:36:01,205 - experiment_functions - INFO - Early stopping at epoch 750. Best Metrics: (0.023076332186785592, 0.018096026490066225, 0.02322123349413831)
2026-05-24 03:36:02,087 - optuna.study.study - INFO - Trial 253 finished with values: [0.023076332186785592, 0.018096026490066225, 0.02322123349413831] and parameters: {'n_layers': 4, 'embedding_dim': 32, 'lr': 0.001073497477166827, 'lambda_val': 0.05810316365964571, 'batch_size': 2142, 'optimizer': 'Adam'}.
2026-05-24 03:36:11,198 - experiment_functions - INFO - Early stopping at epoch 800. Best Metrics: (0.018569856947790016, 0.014536423841059602, 0.019547064904924305)
2026-05-24 03:36:11,439 - optuna.study.study - INFO - Trial 254 finished with values: [0.018569856947790016, 0.014536423841059602, 0.019547064904924305] and parameters: {'n_layers': 4, 'embedding_dim': 32, 'lr': 0.001073497477166827, 'lambda_val': 1.0158189629564152e-06, 'batch_size': 1628, 'optimizer': 'Adam'}.
2026-05-24 03:36:19,096 - experiment_functions - INFO - Early stopping at epoch 650. Best Metrics: (0.0197947263899334, 0.015397350993377483, 0.020894631471629156)
2026-05-24 03:36:19,174 - optuna.study.study - INFO - Trial 255 finished with values: [0.0197947263899334, 0.015397350993377483, 0.020894631471629156] and parameters: {'n_layers': 4, 'embedding_dim': 32, 'lr': 0.0016659872807635835, 'lambda_val': 0.0012679169415010568, 'batch_size': 2028, 'optimizer': 'Adam'}.
2026-05-24 03:36:32,174 - experiment_functions - INFO - Early stopping at epoch 1200. Best Metrics: (0.024425017083222044, 0.020281456953642384, 0.02652009803522647)
2026-05-24 03:36:32,246 - optuna.study.study - INFO - Trial 256 finished with values: [0.024425017083222044, 0.020281456953642384, 0.02652009803522647] and parameters: {'n_layers': 4, 'embedding_dim': 32, 'lr': 0.0004568670531170521, 'lambda_val': 0.05810316365964571, 'batch_size': 1628, 'optimizer': 'Adam'}.
2026-05-24 03:36:45,828 - experiment_functions - INFO - Early stopping at epoch 1200. Best Metrics: (0.019304991372956607, 0.014544701986754966, 0.019770376563103195)
2026-05-24 03:36:45,917 - optuna.study.study - INFO - Trial 257 finished with values: [0.019304991372956607, 0.014544701986754966, 0.019770376563103195] and parameters: {'n_layers': 3, 'embedding_dim': 128, 'lr': 0.0004649352000072556, 'lambda_val': 1.8203246882701353e-06, 'batch_size': 1235, 'optimizer': 'Adam'}.
2026-05-24 03:37:27,468 - optuna.study.study - INFO - Trial 258 finished with values: [0.02655678516951634, 0.018965231788079472, 0.026202905740909204] and parameters: {'n_layers': 3, 'embedding_dim': 32, 'lr': 0.0004649352000072556, 'lambda_val': 1.8203246882701353e-06, 'batch_size': 659, 'optimizer': 'RMSprop'}.
2026-05-24 03:37:40,855 - experiment_functions - INFO - Early stopping at epoch 1200. Best Metrics: (0.02148177196794671, 0.017706953642384105, 0.023141015818369352)
2026-05-24 03:37:40,941 - optuna.study.study - INFO - Trial 259 finished with values: [0.02148177196794671, 0.017706953642384105, 0.023141015818369352] and parameters: {'n_layers': 4, 'embedding_dim': 96, 'lr': 0.0004568670531170521, 'lambda_val': 5.138211460433891e-05, 'batch_size': 679, 'optimizer': 'RMSprop'}.
2026-05-24 03:37:52,465 - experiment_functions - INFO - Early stopping at epoch 1050. Best Metrics: (0.022157884466566184, 0.01822019867549669, 0.023357424237712397)
2026-05-24 03:37:52,633 - optuna.study.study - INFO - Trial 260 finished with values: [0.022157884466566184, 0.01822019867549669, 0.023357424237712397] and parameters: {'n_layers': 4, 'embedding_dim': 32, 'lr': 0.0004568670531170521, 'lambda_val': 0.05810316365964571, 'batch_size': 2142, 'optimizer': 'Adam'}.
2026-05-24 03:38:01,936 - experiment_functions - INFO - Early stopping at epoch 850. Best Metrics: (0.011132875455081922, 0.008634105960264902, 0.01086576051560393)
2026-05-24 03:38:02,034 - optuna.study.study - INFO - Trial 261 finished with values: [0.011132875455081922, 0.008634105960264902, 0.01086576051560393] and parameters: {'n_layers': 2, 'embedding_dim': 96, 'lr': 0.0814134716384712, 'lambda_val': 1.8203246882701353e-06, 'batch_size': 659, 'optimizer': 'RMSprop'}.
2026-05-24 03:38:33,255 - experiment_functions - INFO - Early stopping at epoch 3000. Best Metrics: (0.005371981842992051, 0.004387417218543047, 0.005431076861360877)
2026-05-24 03:38:33,442 - optuna.study.study - INFO - Trial 262 finished with values: [0.005371981842992051, 0.004387417218543047, 0.005431076861360877] and parameters: {'n_layers': 4, 'embedding_dim': 128, 'lr': 1.1374854881034751e-05, 'lambda_val': 1.8203246882701353e-06, 'batch_size': 3068, 'optimizer': 'Adam'}.
2026-05-24 03:38:39,504 - experiment_functions - INFO - Early stopping at epoch 500. Best Metrics: (0.009035686817343494, 0.00718543046357616, 0.009399550673311656)
2026-05-24 03:38:40,141 - optuna.study.study - INFO - Trial 263 finished with values: [0.009035686817343494, 0.00718543046357616, 0.009399550673311656] and parameters: {'n_layers': 4, 'embedding_dim': 32, 'lr': 0.07918213999058528, 'lambda_val': 1.8203246882701353e-06, 'batch_size': 3380, 'optimizer': 'RMSprop'}.
2026-05-24 03:38:50,442 - experiment_functions - INFO - Early stopping at epoch 900. Best Metrics: (0.023875140035028115, 0.018443708609271525, 0.024827309765205637)
2026-05-24 03:38:50,687 - optuna.study.study - INFO - Trial 264 finished with values: [0.023875140035028115, 0.018443708609271525, 0.024827309765205637] and parameters: {'n_layers': 4, 'embedding_dim': 32, 'lr': 0.001073497477166827, 'lambda_val': 6.340163651964425e-06, 'batch_size': 659, 'optimizer': 'Adam'}.
2026-05-24 03:39:00,417 - experiment_functions - INFO - Early stopping at epoch 850. Best Metrics: (0.0203012308199235, 0.01583609271523179, 0.020694427240979998)
