2026-05-24 15:02:37,923 - optuna.study.study - INFO - Trial 282 finished with values: [0.055250305484188474, 0.033725165562913904, 0.048810267236103294] and parameters: {'n_layers': 2, 'embedding_dim': 64, 'lr': 0.0007653011157039608, 'lambda_val': 1.6606118736479167e-06, 'batch_size': 968, 'optimizer': 'Adam'}.
2026-05-24 15:03:22,441 - optuna.study.study - INFO - Trial 283 finished with values: [0.05910686654192657, 0.03561258278145696, 0.05197824414428466] and parameters: {'n_layers': 2, 'embedding_dim': 32, 'lr': 0.0003540171758009511, 'lambda_val': 9.772502453834702e-06, 'batch_size': 1236, 'optimizer': 'RMSprop'}.
2026-05-24 15:04:07,291 - optuna.study.study - INFO - Trial 284 finished with values: [0.05911839376476888, 0.034329470198675494, 0.051627949007404715] and parameters: {'n_layers': 2, 'embedding_dim': 32, 'lr': 0.00027128245814660824, 'lambda_val': 0.0009801820764399163, 'batch_size': 968, 'optimizer': 'RMSprop'}.
2026-05-24 15:04:15,364 - experiment_functions - INFO - Early stopping at epoch 600. Best Metrics: (0.05190150199175646, 0.031862582781456955, 0.046932088471657626)
2026-05-24 15:04:15,445 - optuna.study.study - INFO - Trial 285 finished with values: [0.05190150199175646, 0.031862582781456955, 0.046932088471657626] and parameters: {'n_layers': 2, 'embedding_dim': 128, 'lr': 0.0018843975064796988, 'lambda_val': 2.711242994631108e-05, 'batch_size': 1970, 'optimizer': 'Adam'}.
2026-05-24 15:04:27,313 - experiment_functions - INFO - Early stopping at epoch 950. Best Metrics: (0.03876671951916875, 0.025720198675496693, 0.03627812353453248)
2026-05-24 15:04:27,404 - optuna.study.study - INFO - Trial 286 finished with values: [0.03876671951916875, 0.025720198675496693, 0.03627812353453248] and parameters: {'n_layers': 3, 'embedding_dim': 64, 'lr': 0.0003859482391059796, 'lambda_val': 0.000339235643209516, 'batch_size': 2074, 'optimizer': 'Adam'}.
2026-05-24 15:04:50,029 - experiment_functions - INFO - Early stopping at epoch 1850. Best Metrics: (0.055288141848456346, 0.03410596026490066, 0.04968543463805714)
2026-05-24 15:04:50,119 - optuna.study.study - INFO - Trial 287 finished with values: [0.055288141848456346, 0.03410596026490066, 0.04968543463805714] and parameters: {'n_layers': 1, 'embedding_dim': 256, 'lr': 0.0003859482391059796, 'lambda_val': 2.6431113659875313e-06, 'batch_size': 2074, 'optimizer': 'Adam'}.
2026-05-24 15:05:04,923 - experiment_functions - INFO - Early stopping at epoch 1050. Best Metrics: (0.05313907918899554, 0.03304635761589404, 0.04776947955759673)
2026-05-24 15:05:05,892 - optuna.study.study - INFO - Trial 288 finished with values: [0.05313907918899554, 0.03304635761589404, 0.04776947955759673] and parameters: {'n_layers': 2, 'embedding_dim': 256, 'lr': 0.0003540171758009511, 'lambda_val': 0.0009801820764399163, 'batch_size': 1236, 'optimizer': 'RMSprop'}.
2026-05-24 15:05:49,836 - optuna.study.study - INFO - Trial 289 finished with values: [0.048774928733486864, 0.030695364238410596, 0.04288694054506874] and parameters: {'n_layers': 2, 'embedding_dim': 32, 'lr': 0.00027128245814660824, 'lambda_val': 0.00036270380631651185, 'batch_size': 1970, 'optimizer': 'Adam'}.
2026-05-24 15:06:00,248 - experiment_functions - INFO - Early stopping at epoch 800. Best Metrics: (0.04991437216013317, 0.03217715231788079, 0.04505887018657131)
2026-05-24 15:06:00,904 - optuna.study.study - INFO - Trial 290 finished with values: [0.04991437216013317, 0.03217715231788079, 0.04505887018657131] and parameters: {'n_layers': 1, 'embedding_dim': 256, 'lr': 0.0005264581247601549, 'lambda_val': 0.008798057325106988, 'batch_size': 3012, 'optimizer': 'RMSprop'}.
2026-05-24 15:06:35,884 - experiment_functions - INFO - Early stopping at epoch 3200. Best Metrics: (0.0056556049932904974, 0.0043708609271523174, 0.005354642304528905)
2026-05-24 15:06:35,973 - optuna.study.study - INFO - Trial 291 finished with values: [0.0056556049932904974, 0.0043708609271523174, 0.005354642304528905] and parameters: {'n_layers': 2, 'embedding_dim': 128, 'lr': 3.1264358878157915e-05, 'lambda_val': 0.000339235643209516, 'batch_size': 1042, 'optimizer': 'Adam'}.
2026-05-24 15:06:56,201 - experiment_functions - INFO - Early stopping at epoch 1450. Best Metrics: (0.053465129389565144, 0.03287251655629139, 0.048076710992972504)
2026-05-24 15:06:56,451 - optuna.study.study - INFO - Trial 292 finished with values: [0.053465129389565144, 0.03287251655629139, 0.048076710992972504] and parameters: {'n_layers': 2, 'embedding_dim': 256, 'lr': 0.0002249192915429732, 'lambda_val': 1.1512007318883176e-05, 'batch_size': 2449, 'optimizer': 'RMSprop'}.
2026-05-24 15:07:07,369 - experiment_functions - INFO - Early stopping at epoch 900. Best Metrics: (0.05067010276904978, 0.031332781456953646, 0.04507945701500964)
2026-05-24 15:07:08,055 - optuna.study.study - INFO - Trial 293 finished with values: [0.05067010276904978, 0.031332781456953646, 0.04507945701500964] and parameters: {'n_layers': 2, 'embedding_dim': 64, 'lr': 0.0006563002976325864, 'lambda_val': 1.4247463760726523e-06, 'batch_size': 1970, 'optimizer': 'Adam'}.
2026-05-24 15:07:21,524 - experiment_functions - INFO - Early stopping at epoch 1100. Best Metrics: (0.04743297477427737, 0.030504966887417218, 0.042436369526371386)
2026-05-24 15:07:21,622 - optuna.study.study - INFO - Trial 294 finished with values: [0.04743297477427737, 0.030504966887417218, 0.042436369526371386] and parameters: {'n_layers': 2, 'embedding_dim': 96, 'lr': 0.0003540171758009511, 'lambda_val': 0.0034713999695200454, 'batch_size': 2532, 'optimizer': 'Adam'}.
2026-05-24 15:07:30,923 - experiment_functions - INFO - Early stopping at epoch 650. Best Metrics: (0.019716317288152332, 0.014023178807947023, 0.019309516448475374)
2026-05-24 15:07:31,364 - optuna.study.study - INFO - Trial 295 finished with values: [0.019716317288152332, 0.014023178807947023, 0.019309516448475374] and parameters: {'n_layers': 2, 'embedding_dim': 256, 'lr': 0.0173475481872741, 'lambda_val': 1.4446750706679519e-05, 'batch_size': 1970, 'optimizer': 'RMSprop'}.
2026-05-24 15:07:50,623 - experiment_functions - INFO - Early stopping at epoch 1700. Best Metrics: (0.06777944906498412, 0.0390728476821192, 0.057671824105081884)
2026-05-24 15:07:51,271 - optuna.study.study - INFO - Trial 296 finished with values: [0.06777944906498412, 0.0390728476821192, 0.057671824105081884] and parameters: {'n_layers': 1, 'embedding_dim': 64, 'lr': 0.0006563002976325864, 'lambda_val': 0.0036919839021989573, 'batch_size': 968, 'optimizer': 'RMSprop'}.
2026-05-24 15:08:03,711 - experiment_functions - INFO - Early stopping at epoch 850. Best Metrics: (0.04816829180353458, 0.030794701986754967, 0.043382669467006446)
2026-05-24 15:08:03,799 - optuna.study.study - INFO - Trial 297 finished with values: [0.04816829180353458, 0.030794701986754967, 0.043382669467006446] and parameters: {'n_layers': 2, 'embedding_dim': 256, 'lr': 0.0003540171758009511, 'lambda_val': 1.4446750706679519e-05, 'batch_size': 2986, 'optimizer': 'RMSprop'}.
2026-05-24 15:08:36,904 - experiment_functions - INFO - Early stopping at epoch 2700. Best Metrics: (0.05684544423725624, 0.035149006622516556, 0.05112131646168916)
2026-05-24 15:08:36,988 - optuna.study.study - INFO - Trial 298 finished with values: [0.05684544423725624, 0.035149006622516556, 0.05112131646168916] and parameters: {'n_layers': 1, 'embedding_dim': 256, 'lr': 0.00027128245814660824, 'lambda_val': 0.000339235643209516, 'batch_size': 2661, 'optimizer': 'RMSprop'}.
2026-05-24 15:08:51,359 - experiment_functions - INFO - Early stopping at epoch 1250. Best Metrics: (0.01191990245112415, 0.011771523178807948, 0.01410765976348239)
2026-05-24 15:08:51,584 - optuna.study.study - INFO - Trial 299 finished with values: [0.01191990245112415, 0.011771523178807948, 0.01410765976348239] and parameters: {'n_layers': 2, 'embedding_dim': 96, 'lr': 0.01245800478955897, 'lambda_val': 0.017089995446702748, 'batch_size': 1149, 'optimizer': 'Adam'}.
2026-05-24 15:08:51,599 - root - INFO - Selected Trial 296 based on Max ndcg: 0.0577
2026-05-24 15:08:51,599 - root - INFO - Associated Recall: 0.0678
2026-05-24 15:08:51,599 - experiment_functions - INFO - Training the best model ... for e_1M_1c1dcs_rand5
2026-05-24 15:09:08,466 - experiment_functions - INFO - Early stopping at epoch 1550. Best Metrics: (0.06655485221799869, 0.039718543046357614, 0.05869989816999397)
2026-05-24 15:09:09,356 - root - INFO - **** Training e_1M_1c2dcs
2026-05-24 15:09:09,357 - root - INFO -   ** 2-Dominant stats:
2026-05-24 15:09:09,357 - root - INFO -   ** Finding the dominant set:
2026-05-24 15:48:37,936 - root - INFO -   ** Getting the trainable edges:
2026-05-24 15:48:37,954 - helper_functions - INFO -      Number of nodes: 4753
2026-05-24 15:48:37,954 - helper_functions - INFO -      Ratio: 0.48768725631028115
2026-05-24 15:48:37,954 - helper_functions - INFO -      Number of unique users: 3162
2026-05-24 15:48:37,954 - helper_functions - INFO -      Number of unique items: 1591
2026-05-24 15:48:37,954 - helper_functions - INFO -      Total dominant set edge: 20467
2026-05-24 15:48:37,954 - helper_functions - INFO -      Trainable edges: 16373.6
2026-05-24 15:48:37,996 - root - INFO -   **** Getting 20467 dominant set edges
2026-05-24 15:48:38,182 - optuna.storages._rdb.storage - INFO - A new study created in RDB with name: Study_e_1M_1c2dcs_strict
2026-05-24 15:48:44,439 - experiment_functions - INFO - Early stopping at epoch 500. Best Metrics: (0.005572843645867567, 0.004147350993377484, 0.005348061452753728)
2026-05-24 15:48:44,891 - optuna.study.study - INFO - Trial 0 finished with values: [0.005572843645867567, 0.004147350993377484, 0.005348061452753728] and parameters: {'n_layers': 4, 'embedding_dim': 96, 'lr': 0.0029758764816546083, 'lambda_val': 1.815092705155277e-06, 'batch_size': 996, 'optimizer': 'RMSprop'}.
2026-05-24 15:48:51,327 - experiment_functions - INFO - Early stopping at epoch 550. Best Metrics: (0.014434856965754826, 0.0060182119205298016, 0.011276049789818318)
2026-05-24 15:48:51,410 - optuna.study.study - INFO - Trial 1 finished with values: [0.014434856965754826, 0.0060182119205298016, 0.011276049789818318] and parameters: {'n_layers': 3, 'embedding_dim': 32, 'lr': 0.004670639334296862, 'lambda_val': 0.00036429979790847324, 'batch_size': 3627, 'optimizer': 'Adam'}.
2026-05-24 15:48:58,124 - experiment_functions - INFO - Early stopping at epoch 500. Best Metrics: (0.0025309463630679273, 0.0029884105960264903, 0.003270834032375172)
2026-05-24 15:48:58,211 - optuna.study.study - INFO - Trial 2 finished with values: [0.0025309463630679273, 0.0029884105960264903, 0.003270834032375172] and parameters: {'n_layers': 4, 'embedding_dim': 256, 'lr': 0.054139768164434214, 'lambda_val': 0.02558526248161966, 'batch_size': 1637, 'optimizer': 'Adam'}.
2026-05-24 15:49:42,911 - optuna.study.study - INFO - Trial 3 finished with values: [0.008695645002621048, 0.004917218543046358, 0.008053482154786093] and parameters: {'n_layers': 4, 'embedding_dim': 128, 'lr': 4.893882546497812e-05, 'lambda_val': 0.0002812677361610648, 'batch_size': 3431, 'optimizer': 'RMSprop'}.
2026-05-24 15:49:50,162 - experiment_functions - INFO - Early stopping at epoch 600. Best Metrics: (0.022847394213168948, 0.008079470198675498, 0.01749312979948408)
2026-05-24 15:49:50,248 - optuna.study.study - INFO - Trial 4 finished with values: [0.022847394213168948, 0.008079470198675498, 0.01749312979948408] and parameters: {'n_layers': 3, 'embedding_dim': 128, 'lr': 0.0010413911280538683, 'lambda_val': 0.0005068128991295962, 'batch_size': 1204, 'optimizer': 'Adam'}.
2026-05-24 15:50:07,347 - experiment_functions - INFO - Early stopping at epoch 1650. Best Metrics: (0.04535417364819494, 0.013849337748344372, 0.03231533212072802)
2026-05-24 15:50:07,452 - optuna.study.study - INFO - Trial 5 finished with values: [0.04535417364819494, 0.013849337748344372, 0.03231533212072802] and parameters: {'n_layers': 1, 'embedding_dim': 32, 'lr': 0.00034279930379767936, 'lambda_val': 3.357239469878402e-06, 'batch_size': 1638, 'optimizer': 'RMSprop'}.
2026-05-24 15:50:20,220 - experiment_functions - INFO - Early stopping at epoch 1200. Best Metrics: (0.005260296800223693, 0.004097682119205298, 0.005133182997426767)
2026-05-24 15:50:20,287 - optuna.study.study - INFO - Trial 6 finished with values: [0.005260296800223693, 0.004097682119205298, 0.005133182997426767] and parameters: {'n_layers': 2, 'embedding_dim': 96, 'lr': 1.6453780936680438e-05, 'lambda_val': 5.7906398074089765e-06, 'batch_size': 736, 'optimizer': 'Adam'}.
2026-05-24 15:50:26,108 - experiment_functions - INFO - Early stopping at epoch 500. Best Metrics: (0.005105832208451488, 0.00435430463576159, 0.005375241264020668)
2026-05-24 15:50:26,663 - optuna.study.study - INFO - Trial 7 finished with values: [0.005105832208451488, 0.00435430463576159, 0.005375241264020668] and parameters: {'n_layers': 3, 'embedding_dim': 64, 'lr': 0.01346247069157871, 'lambda_val': 0.0021738629334005282, 'batch_size': 568, 'optimizer': 'Adam'}.
2026-05-24 15:50:33,587 - experiment_functions - INFO - Early stopping at epoch 500. Best Metrics: (0.005403604120024238, 0.004586092715231789, 0.0057766483428881655)
2026-05-24 15:50:33,674 - optuna.study.study - INFO - Trial 8 finished with values: [0.005403604120024238, 0.004586092715231789, 0.0057766483428881655] and parameters: {'n_layers': 4, 'embedding_dim': 256, 'lr': 0.0018120231467246312, 'lambda_val': 0.03747743535967019, 'batch_size': 3302, 'optimizer': 'Adam'}.
2026-05-24 15:50:40,345 - experiment_functions - INFO - Early stopping at epoch 500. Best Metrics: (0.005286438527190917, 0.004172185430463576, 0.005405340797950683)
2026-05-24 15:50:40,437 - optuna.study.study - INFO - Trial 9 finished with values: [0.005286438527190917, 0.004172185430463576, 0.005405340797950683] and parameters: {'n_layers': 4, 'embedding_dim': 128, 'lr': 2.174032936399889e-05, 'lambda_val': 0.00639120433965554, 'batch_size': 3153, 'optimizer': 'Adam'}.
2026-05-24 15:50:46,597 - experiment_functions - INFO - Early stopping at epoch 500. Best Metrics: (0.005330992930229706, 0.004048013245033112, 0.005096481842819389)
2026-05-24 15:50:47,161 - optuna.study.study - INFO - Trial 10 finished with values: [0.005330992930229706, 0.004048013245033112, 0.005096481842819389] and parameters: {'n_layers': 1, 'embedding_dim': 256, 'lr': 2.5465185570619985e-05, 'lambda_val': 1.8068970237856796e-05, 'batch_size': 1193, 'optimizer': 'Adam'}.
2026-05-24 15:50:53,127 - experiment_functions - INFO - Early stopping at epoch 500. Best Metrics: (0.0048135899212743355, 0.004089403973509933, 0.004906774443402149)
2026-05-24 15:50:53,254 - optuna.study.study - INFO - Trial 11 finished with values: [0.0048135899212743355, 0.004089403973509933, 0.004906774443402149] and parameters: {'n_layers': 3, 'embedding_dim': 64, 'lr': 0.026423056259768086, 'lambda_val': 0.0051198804126285635, 'batch_size': 2528, 'optimizer': 'SGD'}.
2026-05-24 15:50:59,268 - experiment_functions - INFO - Early stopping at epoch 500. Best Metrics: (0.004928206574209485, 0.003956953642384106, 0.005029434327958471)
2026-05-24 15:50:59,712 - optuna.study.study - INFO - Trial 12 finished with values: [0.004928206574209485, 0.003956953642384106, 0.005029434327958471] and parameters: {'n_layers': 2, 'embedding_dim': 128, 'lr': 6.38885644665086e-05, 'lambda_val': 0.00021677754040804928, 'batch_size': 996, 'optimizer': 'SGD'}.
2026-05-24 15:51:05,623 - experiment_functions - INFO - Early stopping at epoch 500. Best Metrics: (0.0051878559086677946, 0.00435430463576159, 0.005468914664622992)
2026-05-24 15:51:07,022 - optuna.study.study - INFO - Trial 13 finished with values: [0.0051878559086677946, 0.00435430463576159, 0.005468914664622992] and parameters: {'n_layers': 1, 'embedding_dim': 96, 'lr': 1.5666145089259186e-05, 'lambda_val': 0.0002528532913560777, 'batch_size': 2147, 'optimizer': 'SGD'}.
2026-05-24 15:51:14,269 - experiment_functions - INFO - Early stopping at epoch 650. Best Metrics: (0.005593158956757649, 0.004288079470198675, 0.005772173628366857)
2026-05-24 15:51:15,004 - optuna.study.study - INFO - Trial 14 finished with values: [0.005593158956757649, 0.004288079470198675, 0.005772173628366857] and parameters: {'n_layers': 1, 'embedding_dim': 64, 'lr': 2.371459349153391e-05, 'lambda_val': 0.002332362722517884, 'batch_size': 1943, 'optimizer': 'Adam'}.
2026-05-24 15:51:22,462 - experiment_functions - INFO - Early stopping at epoch 600. Best Metrics: (0.009666866292010341, 0.004718543046357616, 0.007540839375164716)
2026-05-24 15:51:22,546 - optuna.study.study - INFO - Trial 15 finished with values: [0.009666866292010341, 0.004718543046357616, 0.007540839375164716] and parameters: {'n_layers': 4, 'embedding_dim': 64, 'lr': 0.0006602503237283403, 'lambda_val': 7.010718534955492e-06, 'batch_size': 4077, 'optimizer': 'RMSprop'}.
2026-05-24 15:51:29,144 - experiment_functions - INFO - Early stopping at epoch 550. Best Metrics: (0.006904531068568478, 0.003940397350993378, 0.0055983845856316244)
2026-05-24 15:51:29,237 - optuna.study.study - INFO - Trial 16 finished with values: [0.006904531068568478, 0.003940397350993378, 0.0055983845856316244] and parameters: {'n_layers': 3, 'embedding_dim': 96, 'lr': 0.0008808558593337642, 'lambda_val': 0.0036449183117441544, 'batch_size': 3583, 'optimizer': 'RMSprop'}.
2026-05-24 15:51:35,113 - experiment_functions - INFO - Early stopping at epoch 500. Best Metrics: (0.0059095394651858795, 0.004445364238410596, 0.005707148252675372)
2026-05-24 15:51:35,591 - optuna.study.study - INFO - Trial 17 finished with values: [0.0059095394651858795, 0.004445364238410596, 0.005707148252675372] and parameters: {'n_layers': 2, 'embedding_dim': 32, 'lr': 0.0025106536291826954, 'lambda_val': 0.00047342946782276255, 'batch_size': 3564, 'optimizer': 'RMSprop'}.
2026-05-24 15:51:42,008 - experiment_functions - INFO - Early stopping at epoch 550. Best Metrics: (0.03873660519169324, 0.01085264900662252, 0.025574282287742268)
2026-05-24 15:51:43,138 - optuna.study.study - INFO - Trial 18 finished with values: [0.03873660519169324, 0.01085264900662252, 0.025574282287742268] and parameters: {'n_layers': 1, 'embedding_dim': 96, 'lr': 0.00532575854276696, 'lambda_val': 1.1594147319583239e-05, 'batch_size': 2725, 'optimizer': 'Adam'}.
2026-05-24 15:51:49,411 - experiment_functions - INFO - Early stopping at epoch 500. Best Metrics: (0.005359508466077968, 0.003849337748344371, 0.005097764832131724)
2026-05-24 15:51:49,492 - optuna.study.study - INFO - Trial 19 finished with values: [0.005359508466077968, 0.003849337748344371, 0.005097764832131724] and parameters: {'n_layers': 3, 'embedding_dim': 128, 'lr': 3.001055234889082e-05, 'lambda_val': 0.004831825487876278, 'batch_size': 4058, 'optimizer': 'SGD'}.
2026-05-24 15:51:57,048 - experiment_functions - INFO - Early stopping at epoch 650. Best Metrics: (0.004804630520522314, 0.003990066225165563, 0.005112381030324693)
2026-05-24 15:51:57,160 - optuna.study.study - INFO - Trial 20 finished with values: [0.004804630520522314, 0.003990066225165563, 0.005112381030324693] and parameters: {'n_layers': 3, 'embedding_dim': 32, 'lr': 2.990728059142169e-05, 'lambda_val': 6.293597766075889e-05, 'batch_size': 3282, 'optimizer': 'Adam'}.
2026-05-24 15:52:03,637 - experiment_functions - INFO - Early stopping at epoch 500. Best Metrics: (0.00437140392188146, 0.003990066225165563, 0.004721752015184973)
2026-05-24 15:52:04,602 - optuna.study.study - INFO - Trial 21 finished with values: [0.00437140392188146, 0.003990066225165563, 0.004721752015184973] and parameters: {'n_layers': 4, 'embedding_dim': 96, 'lr': 0.000250472043897201, 'lambda_val': 0.08627624600880424, 'batch_size': 2744, 'optimizer': 'RMSprop'}.
2026-05-24 15:52:13,063 - experiment_functions - INFO - Early stopping at epoch 750. Best Metrics: (0.009908992507969595, 0.0047764900662251655, 0.007893951841920042)
2026-05-24 15:52:13,168 - optuna.study.study - INFO - Trial 22 finished with values: [0.009908992507969595, 0.0047764900662251655, 0.007893951841920042] and parameters: {'n_layers': 3, 'embedding_dim': 64, 'lr': 0.0003004464644199072, 'lambda_val': 0.005762069964517917, 'batch_size': 2092, 'optimizer': 'RMSprop'}.
2026-05-24 15:52:19,288 - experiment_functions - INFO - Early stopping at epoch 500. Best Metrics: (0.005708500551370405, 0.0047350993377483445, 0.0059811268751963345)
2026-05-24 15:52:20,021 - optuna.study.study - INFO - Trial 23 finished with values: [0.005708500551370405, 0.0047350993377483445, 0.0059811268751963345] and parameters: {'n_layers': 2, 'embedding_dim': 128, 'lr': 0.0248881240937421, 'lambda_val': 0.0014638288852949724, 'batch_size': 2449, 'optimizer': 'SGD'}.
2026-05-24 15:52:27,056 - experiment_functions - INFO - Early stopping at epoch 550. Best Metrics: (0.0049687660135024235, 0.004420529801324504, 0.005367873827354201)
2026-05-24 15:52:27,169 - optuna.study.study - INFO - Trial 24 finished with values: [0.0049687660135024235, 0.004420529801324504, 0.005367873827354201] and parameters: {'n_layers': 3, 'embedding_dim': 128, 'lr': 1.3136067849539785e-05, 'lambda_val': 0.0017682506679294963, 'batch_size': 3286, 'optimizer': 'RMSprop'}.
2026-05-24 15:53:06,889 - optuna.study.study - INFO - Trial 25 finished with values: [0.009657528170856217, 0.004768211920529802, 0.007660424115378728] and parameters: {'n_layers': 2, 'embedding_dim': 32, 'lr': 7.874444646364451e-05, 'lambda_val': 1.2482171681838817e-06, 'batch_size': 3703, 'optimizer': 'RMSprop'}.
2026-05-24 15:53:13,263 - experiment_functions - INFO - Early stopping at epoch 550. Best Metrics: (0.026083327701865583, 0.008509933774834439, 0.020421740349499975)
2026-05-24 15:53:13,347 - optuna.study.study - INFO - Trial 26 finished with values: [0.026083327701865583, 0.008509933774834439, 0.020421740349499975] and parameters: {'n_layers': 1, 'embedding_dim': 256, 'lr': 0.0013253216979926218, 'lambda_val': 0.00646533282132623, 'batch_size': 2300, 'optimizer': 'Adam'}.
