2026-05-24 12:52:15,584 - optuna.study.study - INFO - Trial 107 finished with values: [0.0406761225946672, 0.02683774834437086, 0.03697326094371765] and parameters: {'n_layers': 3, 'embedding_dim': 96, 'lr': 0.0002462077417891578, 'lambda_val': 1.1245806289583937e-05, 'batch_size': 1844, 'optimizer': 'RMSprop'}.
2026-05-24 12:52:25,171 - experiment_functions - INFO - Early stopping at epoch 650. Best Metrics: (0.029512241979819366, 0.020695364238410598, 0.027168783204415858)
2026-05-24 12:52:26,160 - optuna.study.study - INFO - Trial 108 finished with values: [0.029512241979819366, 0.020695364238410598, 0.027168783204415858] and parameters: {'n_layers': 4, 'embedding_dim': 128, 'lr': 0.000684293575282855, 'lambda_val': 0.007383021531734565, 'batch_size': 2016, 'optimizer': 'Adam'}.
2026-05-24 12:52:33,833 - experiment_functions - INFO - Early stopping at epoch 550. Best Metrics: (0.02158727963432837, 0.016663907284768215, 0.021315667175085724)
2026-05-24 12:52:33,927 - optuna.study.study - INFO - Trial 109 finished with values: [0.02158727963432837, 0.016663907284768215, 0.021315667175085724] and parameters: {'n_layers': 4, 'embedding_dim': 64, 'lr': 0.0064837360922671665, 'lambda_val': 3.4355332572174856e-05, 'batch_size': 1022, 'optimizer': 'Adam'}.
2026-05-24 12:52:44,245 - experiment_functions - INFO - Early stopping at epoch 750. Best Metrics: (0.037067186709242556, 0.024519867549668877, 0.03475190135969251)
2026-05-24 12:52:44,338 - optuna.study.study - INFO - Trial 110 finished with values: [0.037067186709242556, 0.024519867549668877, 0.03475190135969251] and parameters: {'n_layers': 4, 'embedding_dim': 64, 'lr': 0.0005687756458158265, 'lambda_val': 1.6384022903021963e-06, 'batch_size': 1587, 'optimizer': 'Adam'}.
2026-05-24 12:53:05,934 - experiment_functions - INFO - Early stopping at epoch 1700. Best Metrics: (0.008630173606618342, 0.007764900662251656, 0.009463829591454809)
2026-05-24 12:53:06,030 - optuna.study.study - INFO - Trial 111 finished with values: [0.008630173606618342, 0.007764900662251656, 0.009463829591454809] and parameters: {'n_layers': 4, 'embedding_dim': 96, 'lr': 0.004601744611421326, 'lambda_val': 0.004034287067649094, 'batch_size': 1630, 'optimizer': 'RMSprop'}.
2026-05-24 12:53:13,962 - experiment_functions - INFO - Early stopping at epoch 600. Best Metrics: (0.06284170881653942, 0.036274834437086095, 0.0547201797751781)
2026-05-24 12:53:14,062 - optuna.study.study - INFO - Trial 112 finished with values: [0.06284170881653942, 0.036274834437086095, 0.0547201797751781] and parameters: {'n_layers': 1, 'embedding_dim': 96, 'lr': 0.0050557762652770595, 'lambda_val': 0.0003409068265064018, 'batch_size': 1315, 'optimizer': 'Adam'}.
2026-05-24 12:54:06,683 - optuna.study.study - INFO - Trial 113 finished with values: [0.04372143086846602, 0.028112582781456955, 0.04077478483767625] and parameters: {'n_layers': 4, 'embedding_dim': 96, 'lr': 0.00015112824887092085, 'lambda_val': 3.4355332572174856e-05, 'batch_size': 989, 'optimizer': 'Adam'}.
2026-05-24 12:54:14,408 - experiment_functions - INFO - Early stopping at epoch 600. Best Metrics: (0.050303856164704175, 0.031812913907284766, 0.04482772571286372)
2026-05-24 12:54:14,504 - optuna.study.study - INFO - Trial 114 finished with values: [0.050303856164704175, 0.031812913907284766, 0.04482772571286372] and parameters: {'n_layers': 1, 'embedding_dim': 96, 'lr': 0.003407247220990805, 'lambda_val': 0.02843248434954034, 'batch_size': 1081, 'optimizer': 'Adam'}.
2026-05-24 12:54:22,424 - experiment_functions - INFO - Early stopping at epoch 600. Best Metrics: (0.06035979209982194, 0.035298013245033115, 0.05230393487045845)
2026-05-24 12:54:22,514 - optuna.study.study - INFO - Trial 115 finished with values: [0.06035979209982194, 0.035298013245033115, 0.05230393487045845] and parameters: {'n_layers': 1, 'embedding_dim': 96, 'lr': 0.004235289187226827, 'lambda_val': 0.0003409068265064018, 'batch_size': 1315, 'optimizer': 'Adam'}.
2026-05-24 12:54:29,518 - experiment_functions - INFO - Early stopping at epoch 550. Best Metrics: (0.026521920203124053, 0.0190976821192053, 0.02442911641642444)
2026-05-24 12:54:29,607 - optuna.study.study - INFO - Trial 116 finished with values: [0.026521920203124053, 0.0190976821192053, 0.02442911641642444] and parameters: {'n_layers': 4, 'embedding_dim': 32, 'lr': 0.007947853266904198, 'lambda_val': 4.511533338088929e-06, 'batch_size': 973, 'optimizer': 'Adam'}.
2026-05-24 12:55:05,390 - experiment_functions - INFO - Early stopping at epoch 2200. Best Metrics: (0.02318402949423583, 0.015, 0.021422426885912397)
2026-05-24 12:55:06,423 - optuna.study.study - INFO - Trial 117 finished with values: [0.02318402949423583, 0.015, 0.021422426885912397] and parameters: {'n_layers': 4, 'embedding_dim': 256, 'lr': 0.016762510970554485, 'lambda_val': 0.0014886407026304354, 'batch_size': 1927, 'optimizer': 'RMSprop'}.
2026-05-24 12:55:27,227 - experiment_functions - INFO - Early stopping at epoch 1700. Best Metrics: (0.06017209203614819, 0.036523178807947025, 0.052303323821890006)
2026-05-24 12:55:27,549 - optuna.study.study - INFO - Trial 118 finished with values: [0.06017209203614819, 0.036523178807947025, 0.052303323821890006] and parameters: {'n_layers': 1, 'embedding_dim': 128, 'lr': 0.0005846659139515835, 'lambda_val': 3.1090320134873986e-06, 'batch_size': 1315, 'optimizer': 'Adam'}.
2026-05-24 12:56:16,416 - optuna.study.study - INFO - Trial 119 finished with values: [0.020813756504227888, 0.015066225165562913, 0.020189225085470237] and parameters: {'n_layers': 3, 'embedding_dim': 96, 'lr': 0.004235289187226827, 'lambda_val': 0.0003409068265064018, 'batch_size': 1315, 'optimizer': 'RMSprop'}.
2026-05-24 12:57:08,849 - optuna.study.study - INFO - Trial 120 finished with values: [0.04178440574895731, 0.026705298013245036, 0.03851764875298854] and parameters: {'n_layers': 4, 'embedding_dim': 96, 'lr': 0.00012817614150118707, 'lambda_val': 0.0003409068265064018, 'batch_size': 1315, 'optimizer': 'Adam'}.
2026-05-24 12:57:16,481 - experiment_functions - INFO - Early stopping at epoch 550. Best Metrics: (0.04498657919246169, 0.027764900662251655, 0.040885838308634494)
2026-05-24 12:57:16,562 - optuna.study.study - INFO - Trial 121 finished with values: [0.04498657919246169, 0.027764900662251655, 0.040885838308634494] and parameters: {'n_layers': 1, 'embedding_dim': 96, 'lr': 0.0050557762652770595, 'lambda_val': 0.0003409068265064018, 'batch_size': 3564, 'optimizer': 'Adam'}.
2026-05-24 12:57:23,036 - experiment_functions - INFO - Early stopping at epoch 500. Best Metrics: (0.0056456876108612235, 0.004304635761589404, 0.0057195723745221225)
2026-05-24 12:57:23,119 - optuna.study.study - INFO - Trial 122 finished with values: [0.0056456876108612235, 0.004304635761589404, 0.0057195723745221225] and parameters: {'n_layers': 2, 'embedding_dim': 96, 'lr': 0.0002175259383984872, 'lambda_val': 0.00047319112187695436, 'batch_size': 2030, 'optimizer': 'SGD'}.
2026-05-24 12:57:34,106 - experiment_functions - INFO - Early stopping at epoch 800. Best Metrics: (0.034742088947977375, 0.02327814569536424, 0.032757965315921005)
2026-05-24 12:57:34,989 - optuna.study.study - INFO - Trial 123 finished with values: [0.034742088947977375, 0.02327814569536424, 0.032757965315921005] and parameters: {'n_layers': 3, 'embedding_dim': 96, 'lr': 0.00042481052629863496, 'lambda_val': 1.6384022903021963e-06, 'batch_size': 3663, 'optimizer': 'Adam'}.
2026-05-24 12:57:42,933 - experiment_functions - INFO - Early stopping at epoch 600. Best Metrics: (0.05142450245318425, 0.032442052980132446, 0.045646280459830026)
2026-05-24 12:57:43,015 - optuna.study.study - INFO - Trial 124 finished with values: [0.05142450245318425, 0.032442052980132446, 0.045646280459830026] and parameters: {'n_layers': 1, 'embedding_dim': 96, 'lr': 0.0050557762652770595, 'lambda_val': 0.007383021531734565, 'batch_size': 1315, 'optimizer': 'Adam'}.
2026-05-24 12:57:49,568 - experiment_functions - INFO - Early stopping at epoch 500. Best Metrics: (0.0055377554289813575, 0.004387417218543047, 0.005568712854352097)
2026-05-24 12:57:50,695 - optuna.study.study - INFO - Trial 125 finished with values: [0.0055377554289813575, 0.004387417218543047, 0.005568712854352097] and parameters: {'n_layers': 1, 'embedding_dim': 96, 'lr': 0.00010706384462767264, 'lambda_val': 0.007383021531734565, 'batch_size': 989, 'optimizer': 'Adam'}.
2026-05-24 12:58:11,305 - experiment_functions - INFO - Early stopping at epoch 1200. Best Metrics: (0.03031072141432433, 0.021142384105960265, 0.029065022077514)
2026-05-24 12:58:11,639 - optuna.study.study - INFO - Trial 126 finished with values: [0.03031072141432433, 0.021142384105960265, 0.029065022077514] and parameters: {'n_layers': 4, 'embedding_dim': 256, 'lr': 0.00015112824887092085, 'lambda_val': 3.4355332572174856e-05, 'batch_size': 3943, 'optimizer': 'Adam'}.
2026-05-24 12:58:19,384 - experiment_functions - INFO - Early stopping at epoch 600. Best Metrics: (0.06023368114538985, 0.036150662251655634, 0.05282273878498847)
2026-05-24 12:58:19,457 - optuna.study.study - INFO - Trial 127 finished with values: [0.06023368114538985, 0.036150662251655634, 0.05282273878498847] and parameters: {'n_layers': 1, 'embedding_dim': 96, 'lr': 0.005103877753824678, 'lambda_val': 0.0009378059674706164, 'batch_size': 1304, 'optimizer': 'Adam'}.
2026-05-24 12:59:00,313 - experiment_functions - INFO - Early stopping at epoch 3600. Best Metrics: (0.005314499387085444, 0.004519867549668874, 0.005450117756566309)
2026-05-24 12:59:01,805 - optuna.study.study - INFO - Trial 128 finished with values: [0.005314499387085444, 0.004519867549668874, 0.005450117756566309] and parameters: {'n_layers': 4, 'embedding_dim': 32, 'lr': 1.3178461128198434e-05, 'lambda_val': 4.511533338088929e-06, 'batch_size': 3066, 'optimizer': 'RMSprop'}.
2026-05-24 12:59:09,302 - experiment_functions - INFO - Early stopping at epoch 550. Best Metrics: (0.04409822535890832, 0.02701158940397351, 0.03950841616444621)
2026-05-24 12:59:09,378 - optuna.study.study - INFO - Trial 129 finished with values: [0.04409822535890832, 0.02701158940397351, 0.03950841616444621] and parameters: {'n_layers': 3, 'embedding_dim': 64, 'lr': 0.004235289187226827, 'lambda_val': 0.0003409068265064018, 'batch_size': 1221, 'optimizer': 'Adam'}.
2026-05-24 12:59:51,415 - optuna.study.study - INFO - Trial 130 finished with values: [0.006351057066646457, 0.004991721854304637, 0.006754780206593471] and parameters: {'n_layers': 1, 'embedding_dim': 32, 'lr': 7.880914296234578e-05, 'lambda_val': 3.0221087150130615e-06, 'batch_size': 1304, 'optimizer': 'Adam'}.
2026-05-24 13:00:17,967 - experiment_functions - INFO - Early stopping at epoch 1900. Best Metrics: (0.03165141193314421, 0.02119205298013245, 0.029306642919949406)
2026-05-24 13:00:18,304 - optuna.study.study - INFO - Trial 131 finished with values: [0.03165141193314421, 0.02119205298013245, 0.029306642919949406] and parameters: {'n_layers': 4, 'embedding_dim': 128, 'lr': 0.00012817614150118707, 'lambda_val': 0.0003172844221989213, 'batch_size': 3917, 'optimizer': 'Adam'}.
2026-05-24 13:00:32,669 - experiment_functions - INFO - Early stopping at epoch 1150. Best Metrics: (0.061641227076552695, 0.03690397350993378, 0.05386617675746195)
2026-05-24 13:00:32,750 - optuna.study.study - INFO - Trial 132 finished with values: [0.061641227076552695, 0.03690397350993378, 0.05386617675746195] and parameters: {'n_layers': 1, 'embedding_dim': 96, 'lr': 0.000684293575282855, 'lambda_val': 2.662938714668246e-05, 'batch_size': 1844, 'optimizer': 'Adam'}.
2026-05-24 13:00:52,488 - experiment_functions - INFO - Early stopping at epoch 1650. Best Metrics: (0.07503535762569073, 0.04223509933774835, 0.06290685597414487)
2026-05-24 13:00:52,933 - optuna.study.study - INFO - Trial 133 finished with values: [0.07503535762569073, 0.04223509933774835, 0.06290685597414487] and parameters: {'n_layers': 1, 'embedding_dim': 32, 'lr': 0.000684293575282855, 'lambda_val': 0.02843248434954034, 'batch_size': 571, 'optimizer': 'RMSprop'}.
2026-05-24 13:01:42,607 - optuna.study.study - INFO - Trial 134 finished with values: [0.03690450155214626, 0.025289735099337747, 0.03496306554183441] and parameters: {'n_layers': 3, 'embedding_dim': 96, 'lr': 0.00012817614150118707, 'lambda_val': 8.471062459286831e-06, 'batch_size': 989, 'optimizer': 'Adam'}.
2026-05-24 13:02:25,977 - optuna.study.study - INFO - Trial 135 finished with values: [0.0065066923306815105, 0.005173841059602649, 0.006857449402705007] and parameters: {'n_layers': 1, 'embedding_dim': 128, 'lr': 0.00012817614150118707, 'lambda_val': 0.0006796337932014016, 'batch_size': 989, 'optimizer': 'Adam'}.
2026-05-24 13:03:08,731 - optuna.study.study - INFO - Trial 136 finished with values: [0.01255605751335339, 0.009470198675496689, 0.012954983297044446] and parameters: {'n_layers': 1, 'embedding_dim': 32, 'lr': 0.0002110634499611687, 'lambda_val': 2.17916823596635e-06, 'batch_size': 1352, 'optimizer': 'Adam'}.
2026-05-24 13:03:59,176 - optuna.study.study - INFO - Trial 137 finished with values: [0.04039278365767023, 0.02579470198675497, 0.03790430528167036] and parameters: {'n_layers': 4, 'embedding_dim': 64, 'lr': 0.00015112824887092085, 'lambda_val': 3.4355332572174856e-05, 'batch_size': 1850, 'optimizer': 'Adam'}.
2026-05-24 13:04:09,716 - experiment_functions - INFO - Early stopping at epoch 750. Best Metrics: (0.03756218919673101, 0.024759933774834438, 0.03466739750374033)
2026-05-24 13:04:10,059 - optuna.study.study - INFO - Trial 138 finished with values: [0.03756218919673101, 0.024759933774834438, 0.03466739750374033] and parameters: {'n_layers': 4, 'embedding_dim': 96, 'lr': 0.000684293575282855, 'lambda_val': 0.00047319112187695436, 'batch_size': 989, 'optimizer': 'Adam'}.
2026-05-24 13:04:17,719 - experiment_functions - INFO - Early stopping at epoch 550. Best Metrics: (0.04438948655628724, 0.028071192052980136, 0.040067905216057166)
2026-05-24 13:04:17,815 - optuna.study.study - INFO - Trial 139 finished with values: [0.04438948655628724, 0.028071192052980136, 0.040067905216057166] and parameters: {'n_layers': 1, 'embedding_dim': 96, 'lr': 0.004601744611421326, 'lambda_val': 1.6384022903021963e-06, 'batch_size': 4088, 'optimizer': 'Adam'}.
2026-05-24 13:04:25,623 - experiment_functions - INFO - Early stopping at epoch 550. Best Metrics: (0.04533069127727549, 0.02876655629139073, 0.04116107769750433)
2026-05-24 13:04:25,715 - optuna.study.study - INFO - Trial 140 finished with values: [0.04533069127727549, 0.02876655629139073, 0.04116107769750433] and parameters: {'n_layers': 2, 'embedding_dim': 128, 'lr': 0.0050557762652770595, 'lambda_val': 0.0003409068265064018, 'batch_size': 3341, 'optimizer': 'Adam'}.
2026-05-24 13:04:34,909 - experiment_functions - INFO - Early stopping at epoch 600. Best Metrics: (0.03818334563194825, 0.026192052980132448, 0.03495344450503993)
2026-05-24 13:04:35,445 - optuna.study.study - INFO - Trial 141 finished with values: [0.03818334563194825, 0.026192052980132448, 0.03495344450503993] and parameters: {'n_layers': 2, 'embedding_dim': 256, 'lr': 0.0007313058414573923, 'lambda_val': 0.014499624791208778, 'batch_size': 807, 'optimizer': 'RMSprop'}.
2026-05-24 13:04:41,606 - experiment_functions - INFO - Early stopping at epoch 500. Best Metrics: (0.0059462284027641844, 0.004528145695364238, 0.005956254463360606)
2026-05-24 13:04:42,066 - optuna.study.study - INFO - Trial 142 finished with values: [0.0059462284027641844, 0.004528145695364238, 0.005956254463360606] and parameters: {'n_layers': 1, 'embedding_dim': 64, 'lr': 0.00012817614150118707, 'lambda_val': 0.007383021531734565, 'batch_size': 2016, 'optimizer': 'Adam'}.
2026-05-24 13:04:56,449 - experiment_functions - INFO - Early stopping at epoch 1150. Best Metrics: (0.05992986345533311, 0.03549668874172185, 0.05271933178556369)
2026-05-24 13:04:56,992 - optuna.study.study - INFO - Trial 143 finished with values: [0.05992986345533311, 0.03549668874172185, 0.05271933178556369] and parameters: {'n_layers': 1, 'embedding_dim': 96, 'lr': 0.000684293575282855, 'lambda_val': 0.0018241216708581335, 'batch_size': 2016, 'optimizer': 'Adam'}.
2026-05-24 13:05:04,206 - experiment_functions - INFO - Early stopping at epoch 550. Best Metrics: (0.024878640898981907, 0.01926324503311258, 0.024147003814228366)
2026-05-24 13:05:04,311 - optuna.study.study - INFO - Trial 144 finished with values: [0.024878640898981907, 0.01926324503311258, 0.024147003814228366] and parameters: {'n_layers': 1, 'embedding_dim': 32, 'lr': 0.005103877753824678, 'lambda_val': 0.0006796337932014016, 'batch_size': 724, 'optimizer': 'RMSprop'}.
2026-05-24 13:05:47,249 - optuna.study.study - INFO - Trial 145 finished with values: [0.008971031887834505, 0.007317880794701987, 0.009161625260933516] and parameters: {'n_layers': 1, 'embedding_dim': 96, 'lr': 0.00015112824887092085, 'lambda_val': 0.0011967128449345778, 'batch_size': 1315, 'optimizer': 'RMSprop'}.
2026-05-24 13:05:57,710 - experiment_functions - INFO - Early stopping at epoch 800. Best Metrics: (0.046846878265561345, 0.02918046357615894, 0.042159263616379526)
2026-05-24 13:05:57,813 - optuna.study.study - INFO - Trial 146 finished with values: [0.046846878265561345, 0.02918046357615894, 0.042159263616379526] and parameters: {'n_layers': 3, 'embedding_dim': 32, 'lr': 0.0005846659139515835, 'lambda_val': 0.004061323094641349, 'batch_size': 1221, 'optimizer': 'RMSprop'}.
2026-05-24 13:06:05,659 - experiment_functions - INFO - Early stopping at epoch 600. Best Metrics: (0.03695567525188359, 0.02587748344370861, 0.03433570386699454)
2026-05-24 13:06:05,761 - optuna.study.study - INFO - Trial 147 finished with values: [0.03695567525188359, 0.02587748344370861, 0.03433570386699454] and parameters: {'n_layers': 2, 'embedding_dim': 32, 'lr': 0.003407247220990805, 'lambda_val': 1.6384022903021963e-06, 'batch_size': 3266, 'optimizer': 'Adam'}.
2026-05-24 13:06:16,578 - experiment_functions - INFO - Early stopping at epoch 850. Best Metrics: (0.004950713909481355, 0.003932119205298013, 0.0051987112539918605)
2026-05-24 13:06:16,696 - optuna.study.study - INFO - Trial 148 finished with values: [0.004950713909481355, 0.003932119205298013, 0.0051987112539918605] and parameters: {'n_layers': 1, 'embedding_dim': 256, 'lr': 0.023222702118018915, 'lambda_val': 0.000832701218813787, 'batch_size': 3473, 'optimizer': 'SGD'}.
2026-05-24 13:06:24,761 - experiment_functions - INFO - Early stopping at epoch 600. Best Metrics: (0.050283512834289334, 0.031713576158940396, 0.0438833440324816)
2026-05-24 13:06:24,873 - optuna.study.study - INFO - Trial 149 finished with values: [0.050283512834289334, 0.031713576158940396, 0.0438833440324816] and parameters: {'n_layers': 2, 'embedding_dim': 96, 'lr': 0.0017164560979354832, 'lambda_val': 0.014499624791208778, 'batch_size': 3665, 'optimizer': 'Adam'}.
2026-05-24 13:06:42,594 - experiment_functions - INFO - Early stopping at epoch 1450. Best Metrics: (0.058195678268624096, 0.035728476821192054, 0.0522758145700162)
2026-05-24 13:06:42,687 - optuna.study.study - INFO - Trial 150 finished with values: [0.058195678268624096, 0.035728476821192054, 0.0522758145700162] and parameters: {'n_layers': 1, 'embedding_dim': 96, 'lr': 0.000684293575282855, 'lambda_val': 2.662938714668246e-05, 'batch_size': 1276, 'optimizer': 'Adam'}.
2026-05-24 13:06:51,253 - experiment_functions - INFO - Early stopping at epoch 600. Best Metrics: (0.04685320079361048, 0.029801324503311258, 0.04239743727287099)
2026-05-24 13:06:51,361 - optuna.study.study - INFO - Trial 151 finished with values: [0.04685320079361048, 0.029801324503311258, 0.04239743727287099] and parameters: {'n_layers': 1, 'embedding_dim': 256, 'lr': 0.004235289187226827, 'lambda_val': 0.0003409068265064018, 'batch_size': 2704, 'optimizer': 'Adam'}.
2026-05-24 13:06:57,736 - experiment_functions - INFO - Early stopping at epoch 500. Best Metrics: (0.00494311618674358, 0.00408112582781457, 0.0048987066418271375)
2026-05-24 13:06:58,558 - optuna.study.study - INFO - Trial 152 finished with values: [0.00494311618674358, 0.00408112582781457, 0.0048987066418271375] and parameters: {'n_layers': 1, 'embedding_dim': 96, 'lr': 0.000684293575282855, 'lambda_val': 0.08466945456954897, 'batch_size': 1315, 'optimizer': 'Adam'}.
2026-05-24 13:07:19,085 - experiment_functions - INFO - Early stopping at epoch 1700. Best Metrics: (0.06020047260440966, 0.03637417218543046, 0.05240624208270264)
2026-05-24 13:07:20,111 - optuna.study.study - INFO - Trial 153 finished with values: [0.06020047260440966, 0.03637417218543046, 0.05240624208270264] and parameters: {'n_layers': 1, 'embedding_dim': 96, 'lr': 0.0005846659139515835, 'lambda_val': 1.069785669533184e-06, 'batch_size': 1315, 'optimizer': 'Adam'}.
2026-05-24 13:07:26,628 - experiment_functions - INFO - Early stopping at epoch 500. Best Metrics: (0.005431203216149966, 0.004163907284768211, 0.005539399427257358)
2026-05-24 13:07:27,447 - optuna.study.study - INFO - Trial 154 finished with values: [0.005431203216149966, 0.004163907284768211, 0.005539399427257358] and parameters: {'n_layers': 1, 'embedding_dim': 96, 'lr': 0.00015112824887092085, 'lambda_val': 0.02843248434954034, 'batch_size': 1022, 'optimizer': 'Adam'}.
2026-05-24 13:07:35,953 - experiment_functions - INFO - Early stopping at epoch 600. Best Metrics: (0.05429456137512924, 0.03263245033112583, 0.04768182580753707)
2026-05-24 13:07:36,055 - optuna.study.study - INFO - Trial 155 finished with values: [0.05429456137512924, 0.03263245033112583, 0.04768182580753707] and parameters: {'n_layers': 1, 'embedding_dim': 256, 'lr': 0.004235289187226827, 'lambda_val': 3.4355332572174856e-05, 'batch_size': 1081, 'optimizer': 'Adam'}.
