2026-05-24 13:16:54,181 - optuna.study.study - INFO - Trial 202 finished with values: [0.005057104306539845, 0.004221854304635762, 0.005364791953176585] and parameters: {'n_layers': 1, 'embedding_dim': 96, 'lr': 0.004235289187226827, 'lambda_val': 0.06522788697931871, 'batch_size': 1081, 'optimizer': 'SGD'}.
2026-05-24 13:17:03,134 - experiment_functions - INFO - Early stopping at epoch 600. Best Metrics: (0.06012416081039306, 0.03480960264900662, 0.05325162702925268)
2026-05-24 13:17:03,231 - optuna.study.study - INFO - Trial 203 finished with values: [0.06012416081039306, 0.03480960264900662, 0.05325162702925268] and parameters: {'n_layers': 1, 'embedding_dim': 96, 'lr': 0.004235289187226827, 'lambda_val': 0.0003409068265064018, 'batch_size': 1315, 'optimizer': 'Adam'}.
2026-05-24 13:17:13,452 - experiment_functions - INFO - Early stopping at epoch 750. Best Metrics: (0.03953128488876463, 0.02564569536423841, 0.03592096557020419)
2026-05-24 13:17:13,544 - optuna.study.study - INFO - Trial 204 finished with values: [0.03953128488876463, 0.02564569536423841, 0.03592096557020419] and parameters: {'n_layers': 4, 'embedding_dim': 96, 'lr': 0.0005846659139515835, 'lambda_val': 8.471062459286831e-06, 'batch_size': 1315, 'optimizer': 'Adam'}.
2026-05-24 13:17:22,737 - experiment_functions - INFO - Early stopping at epoch 750. Best Metrics: (0.03505509540409983, 0.02443708609271523, 0.032787337163703946)
2026-05-24 13:17:23,346 - optuna.study.study - INFO - Trial 205 finished with values: [0.03505509540409983, 0.02443708609271523, 0.032787337163703946] and parameters: {'n_layers': 3, 'embedding_dim': 32, 'lr': 0.000684293575282855, 'lambda_val': 0.02843248434954034, 'batch_size': 571, 'optimizer': 'RMSprop'}.
2026-05-24 13:17:37,302 - experiment_functions - INFO - Early stopping at epoch 1200. Best Metrics: (0.061544163968607665, 0.036978476821192055, 0.05464790320413526)
2026-05-24 13:17:37,400 - optuna.study.study - INFO - Trial 206 finished with values: [0.061544163968607665, 0.036978476821192055, 0.05464790320413526] and parameters: {'n_layers': 1, 'embedding_dim': 96, 'lr': 0.000684293575282855, 'lambda_val': 0.014499624791208778, 'batch_size': 1081, 'optimizer': 'Adam'}.
2026-05-24 13:17:43,861 - experiment_functions - INFO - Early stopping at epoch 500. Best Metrics: (0.004664561376612273, 0.004246688741721854, 0.005095794747327367)
2026-05-24 13:17:44,312 - optuna.study.study - INFO - Trial 207 finished with values: [0.004664561376612273, 0.004246688741721854, 0.005095794747327367] and parameters: {'n_layers': 3, 'embedding_dim': 96, 'lr': 0.000684293575282855, 'lambda_val': 0.02843248434954034, 'batch_size': 571, 'optimizer': 'SGD'}.
2026-05-24 13:17:54,807 - experiment_functions - INFO - Early stopping at epoch 800. Best Metrics: (0.04047004682589528, 0.026158940397350994, 0.03654481227503968)
2026-05-24 13:17:55,201 - optuna.study.study - INFO - Trial 208 finished with values: [0.04047004682589528, 0.026158940397350994, 0.03654481227503968] and parameters: {'n_layers': 3, 'embedding_dim': 96, 'lr': 0.0005846659139515835, 'lambda_val': 0.0003409068265064018, 'batch_size': 1315, 'optimizer': 'Adam'}.
2026-05-24 13:18:02,640 - experiment_functions - INFO - Early stopping at epoch 600. Best Metrics: (0.05864576416000676, 0.03495860927152318, 0.05259174805111089)
2026-05-24 13:18:02,741 - optuna.study.study - INFO - Trial 209 finished with values: [0.05864576416000676, 0.03495860927152318, 0.05259174805111089] and parameters: {'n_layers': 1, 'embedding_dim': 32, 'lr': 0.005103877753824678, 'lambda_val': 0.0006796337932014016, 'batch_size': 1304, 'optimizer': 'Adam'}.
2026-05-24 13:18:10,692 - experiment_functions - INFO - Early stopping at epoch 650. Best Metrics: (0.06131764301760597, 0.03663907284768212, 0.05471673348349769)
2026-05-24 13:18:10,801 - optuna.study.study - INFO - Trial 210 finished with values: [0.06131764301760597, 0.03663907284768212, 0.05471673348349769] and parameters: {'n_layers': 1, 'embedding_dim': 96, 'lr': 0.0023845238536273896, 'lambda_val': 0.01668282228117847, 'batch_size': 1304, 'optimizer': 'Adam'}.
2026-05-24 13:18:30,750 - experiment_functions - INFO - Early stopping at epoch 1750. Best Metrics: (0.06334237544697398, 0.036928807947019866, 0.05527861771852578)
2026-05-24 13:18:30,839 - optuna.study.study - INFO - Trial 211 finished with values: [0.06334237544697398, 0.036928807947019866, 0.05527861771852578] and parameters: {'n_layers': 1, 'embedding_dim': 96, 'lr': 0.0005846659139515835, 'lambda_val': 0.00018703403293765332, 'batch_size': 1315, 'optimizer': 'Adam'}.
2026-05-24 13:18:48,004 - experiment_functions - INFO - Early stopping at epoch 1500. Best Metrics: (0.05890854661326596, 0.03610927152317881, 0.052031932601771594)
2026-05-24 13:18:48,093 - optuna.study.study - INFO - Trial 212 finished with values: [0.05890854661326596, 0.03610927152317881, 0.052031932601771594] and parameters: {'n_layers': 1, 'embedding_dim': 96, 'lr': 0.0006263184373746895, 'lambda_val': 0.0018241216708581335, 'batch_size': 1315, 'optimizer': 'Adam'}.
2026-05-24 13:18:55,781 - experiment_functions - INFO - Early stopping at epoch 600. Best Metrics: (0.06308267940165906, 0.03646523178807947, 0.05460543786645441)
2026-05-24 13:18:55,882 - optuna.study.study - INFO - Trial 213 finished with values: [0.06308267940165906, 0.03646523178807947, 0.05460543786645441] and parameters: {'n_layers': 1, 'embedding_dim': 96, 'lr': 0.0050557762652770595, 'lambda_val': 0.0003409068265064018, 'batch_size': 1315, 'optimizer': 'Adam'}.
2026-05-24 13:19:03,617 - experiment_functions - INFO - Early stopping at epoch 600. Best Metrics: (0.05119337048558894, 0.03268211920529802, 0.04640415420172029)
2026-05-24 13:19:03,723 - optuna.study.study - INFO - Trial 214 finished with values: [0.05119337048558894, 0.03268211920529802, 0.04640415420172029] and parameters: {'n_layers': 1, 'embedding_dim': 96, 'lr': 0.004235289187226827, 'lambda_val': 0.0003409068265064018, 'batch_size': 3410, 'optimizer': 'Adam'}.
2026-05-24 13:19:12,815 - experiment_functions - INFO - Early stopping at epoch 700. Best Metrics: (0.02999768430829687, 0.021249999999999998, 0.028157208553753848)
2026-05-24 13:19:13,849 - optuna.study.study - INFO - Trial 215 finished with values: [0.02999768430829687, 0.021249999999999998, 0.028157208553753848] and parameters: {'n_layers': 3, 'embedding_dim': 64, 'lr': 0.000684293575282855, 'lambda_val': 0.00019669533154319103, 'batch_size': 3665, 'optimizer': 'Adam'}.
2026-05-24 13:19:20,857 - experiment_functions - INFO - Early stopping at epoch 550. Best Metrics: (0.041643124500161444, 0.025951986754966887, 0.03801555820007573)
2026-05-24 13:19:20,942 - optuna.study.study - INFO - Trial 216 finished with values: [0.041643124500161444, 0.025951986754966887, 0.03801555820007573] and parameters: {'n_layers': 2, 'embedding_dim': 32, 'lr': 0.004235289187226827, 'lambda_val': 0.0006796337932014016, 'batch_size': 1315, 'optimizer': 'Adam'}.
2026-05-24 13:19:28,618 - experiment_functions - INFO - Early stopping at epoch 600. Best Metrics: (0.061885080120889786, 0.036299668874172186, 0.05308867913683813)
2026-05-24 13:19:28,716 - optuna.study.study - INFO - Trial 217 finished with values: [0.061885080120889786, 0.036299668874172186, 0.05308867913683813] and parameters: {'n_layers': 1, 'embedding_dim': 96, 'lr': 0.004235289187226827, 'lambda_val': 0.0003409068265064018, 'batch_size': 2016, 'optimizer': 'Adam'}.
2026-05-24 13:19:35,036 - experiment_functions - INFO - Early stopping at epoch 500. Best Metrics: (0.005050876317478179, 0.004180463576158941, 0.005250517463905067)
2026-05-24 13:19:35,273 - optuna.study.study - INFO - Trial 218 finished with values: [0.005050876317478179, 0.004180463576158941, 0.005250517463905067] and parameters: {'n_layers': 3, 'embedding_dim': 64, 'lr': 0.00019615088117517216, 'lambda_val': 0.0002568604024260093, 'batch_size': 1081, 'optimizer': 'SGD'}.
2026-05-24 13:19:42,298 - experiment_functions - INFO - Early stopping at epoch 550. Best Metrics: (0.04844713926992613, 0.030364238410596028, 0.045092412071992126)
2026-05-24 13:19:42,462 - optuna.study.study - INFO - Trial 219 finished with values: [0.04844713926992613, 0.030364238410596028, 0.045092412071992126] and parameters: {'n_layers': 1, 'embedding_dim': 96, 'lr': 0.005902365559010261, 'lambda_val': 0.014499624791208778, 'batch_size': 1823, 'optimizer': 'Adam'}.
2026-05-24 13:19:49,807 - experiment_functions - INFO - Early stopping at epoch 600. Best Metrics: (0.06042757527689422, 0.03678807947019867, 0.05137184882801299)
2026-05-24 13:19:49,908 - optuna.study.study - INFO - Trial 220 finished with values: [0.06042757527689422, 0.03678807947019867, 0.05137184882801299] and parameters: {'n_layers': 1, 'embedding_dim': 96, 'lr': 0.003407247220990805, 'lambda_val': 0.033607690460835456, 'batch_size': 2016, 'optimizer': 'Adam'}.
2026-05-24 13:19:55,957 - experiment_functions - INFO - Early stopping at epoch 500. Best Metrics: (0.0051806275978758184, 0.004271523178807947, 0.0052606124580331926)
2026-05-24 13:19:56,681 - optuna.study.study - INFO - Trial 221 finished with values: [0.0051806275978758184, 0.004271523178807947, 0.0052606124580331926] and parameters: {'n_layers': 1, 'embedding_dim': 96, 'lr': 0.003407247220990805, 'lambda_val': 4.350080177435062e-06, 'batch_size': 1304, 'optimizer': 'SGD'}.
2026-05-24 13:20:42,762 - optuna.study.study - INFO - Trial 222 finished with values: [0.007427276135638969, 0.005728476821192053, 0.007384835555553345] and parameters: {'n_layers': 1, 'embedding_dim': 128, 'lr': 0.00013294280074597817, 'lambda_val': 0.0003409068265064018, 'batch_size': 1315, 'optimizer': 'Adam'}.
2026-05-24 13:20:49,645 - experiment_functions - INFO - Early stopping at epoch 550. Best Metrics: (0.04380193372167444, 0.027193708609271523, 0.039788275272747496)
2026-05-24 13:20:49,740 - optuna.study.study - INFO - Trial 223 finished with values: [0.04380193372167444, 0.027193708609271523, 0.039788275272747496] and parameters: {'n_layers': 4, 'embedding_dim': 32, 'lr': 0.004235289187226827, 'lambda_val': 0.0003409068265064018, 'batch_size': 2525, 'optimizer': 'Adam'}.
2026-05-24 13:21:07,077 - experiment_functions - INFO - Early stopping at epoch 1500. Best Metrics: (0.062131592636232844, 0.036721854304635766, 0.0538161084259512)
2026-05-24 13:21:07,158 - optuna.study.study - INFO - Trial 224 finished with values: [0.062131592636232844, 0.036721854304635766, 0.0538161084259512] and parameters: {'n_layers': 1, 'embedding_dim': 96, 'lr': 0.000684293575282855, 'lambda_val': 3.1090320134873986e-06, 'batch_size': 1315, 'optimizer': 'Adam'}.
2026-05-24 13:21:15,978 - experiment_functions - INFO - Early stopping at epoch 550. Best Metrics: (0.04100194340560765, 0.027185430463576157, 0.03820309722101048)
2026-05-24 13:21:17,068 - optuna.study.study - INFO - Trial 225 finished with values: [0.04100194340560765, 0.027185430463576157, 0.03820309722101048] and parameters: {'n_layers': 3, 'embedding_dim': 256, 'lr': 0.003191872667042025, 'lambda_val': 0.0003409068265064018, 'batch_size': 2016, 'optimizer': 'Adam'}.
2026-05-24 13:21:59,570 - optuna.study.study - INFO - Trial 226 finished with values: [0.01912173023629715, 0.015240066225165563, 0.01968117427849051] and parameters: {'n_layers': 1, 'embedding_dim': 128, 'lr': 0.0646105525424927, 'lambda_val': 0.001670938885019414, 'batch_size': 1276, 'optimizer': 'Adam'}.
2026-05-24 13:22:07,461 - experiment_functions - INFO - Early stopping at epoch 550. Best Metrics: (0.0053048442565474425, 0.00423841059602649, 0.005408985061410232)
2026-05-24 13:22:07,547 - optuna.study.study - INFO - Trial 227 finished with values: [0.0053048442565474425, 0.00423841059602649, 0.005408985061410232] and parameters: {'n_layers': 4, 'embedding_dim': 128, 'lr': 1.3247813929774422e-05, 'lambda_val': 0.0009378059674706164, 'batch_size': 1180, 'optimizer': 'Adam'}.
2026-05-24 13:22:23,214 - experiment_functions - INFO - Early stopping at epoch 1350. Best Metrics: (0.05967114560849569, 0.03608443708609271, 0.053190097435183915)
2026-05-24 13:22:23,619 - optuna.study.study - INFO - Trial 228 finished with values: [0.05967114560849569, 0.03608443708609271, 0.053190097435183915] and parameters: {'n_layers': 1, 'embedding_dim': 96, 'lr': 0.0007414662359934248, 'lambda_val': 2.662938714668246e-05, 'batch_size': 1315, 'optimizer': 'Adam'}.
2026-05-24 13:23:07,461 - optuna.study.study - INFO - Trial 229 finished with values: [0.06587360296707631, 0.03845198675496689, 0.057923467896017176] and parameters: {'n_layers': 1, 'embedding_dim': 32, 'lr': 0.0004988299375625479, 'lambda_val': 0.00018703403293765332, 'batch_size': 1304, 'optimizer': 'Adam'}.
2026-05-24 13:23:38,647 - experiment_functions - INFO - Early stopping at epoch 2850. Best Metrics: (0.06405686204756543, 0.03779801324503312, 0.05560499573184344)
2026-05-24 13:23:39,059 - optuna.study.study - INFO - Trial 230 finished with values: [0.06405686204756543, 0.03779801324503312, 0.05560499573184344] and parameters: {'n_layers': 1, 'embedding_dim': 32, 'lr': 0.0005846659139515835, 'lambda_val': 1.069785669533184e-06, 'batch_size': 1440, 'optimizer': 'Adam'}.
2026-05-24 13:23:45,746 - experiment_functions - INFO - Early stopping at epoch 500. Best Metrics: (0.005126820664014587, 0.004205298013245033, 0.0052540770760773165)
2026-05-24 13:23:46,645 - optuna.study.study - INFO - Trial 231 finished with values: [0.005126820664014587, 0.004205298013245033, 0.0052540770760773165] and parameters: {'n_layers': 4, 'embedding_dim': 96, 'lr': 8.795022455450396e-05, 'lambda_val': 0.014499624791208778, 'batch_size': 1315, 'optimizer': 'Adam'}.
2026-05-24 13:23:56,110 - experiment_functions - INFO - Early stopping at epoch 750. Best Metrics: (0.039369083391725714, 0.02653973509933775, 0.03641636659404571)
2026-05-24 13:23:56,276 - optuna.study.study - INFO - Trial 232 finished with values: [0.039369083391725714, 0.02653973509933775, 0.03641636659404571] and parameters: {'n_layers': 3, 'embedding_dim': 96, 'lr': 0.0006846975882003806, 'lambda_val': 0.007383021531734565, 'batch_size': 1315, 'optimizer': 'Adam'}.
2026-05-24 13:24:03,104 - experiment_functions - INFO - Early stopping at epoch 600. Best Metrics: (0.0368199797887803, 0.026316225165562913, 0.03276785487858556)
2026-05-24 13:24:03,240 - optuna.study.study - INFO - Trial 233 finished with values: [0.0368199797887803, 0.026316225165562913, 0.03276785487858556] and parameters: {'n_layers': 1, 'embedding_dim': 96, 'lr': 0.004235289187226827, 'lambda_val': 0.03479118987303148, 'batch_size': 1315, 'optimizer': 'Adam'}.
2026-05-24 13:24:10,707 - experiment_functions - INFO - Early stopping at epoch 600. Best Metrics: (0.0640866514732565, 0.0375, 0.05490759938706109)
2026-05-24 13:24:10,803 - optuna.study.study - INFO - Trial 234 finished with values: [0.0640866514732565, 0.0375, 0.05490759938706109] and parameters: {'n_layers': 1, 'embedding_dim': 96, 'lr': 0.004235289187226827, 'lambda_val': 0.004190156106722824, 'batch_size': 2016, 'optimizer': 'Adam'}.
2026-05-24 13:24:16,647 - experiment_functions - INFO - Early stopping at epoch 500. Best Metrics: (0.0051806275978758184, 0.004271523178807947, 0.005261020521950185)
2026-05-24 13:24:18,201 - optuna.study.study - INFO - Trial 235 finished with values: [0.0051806275978758184, 0.004271523178807947, 0.005261020521950185] and parameters: {'n_layers': 1, 'embedding_dim': 96, 'lr': 1.3941234669414805e-05, 'lambda_val': 0.01678093332041272, 'batch_size': 2016, 'optimizer': 'Adam'}.
2026-05-24 13:24:26,054 - experiment_functions - INFO - Early stopping at epoch 650. Best Metrics: (0.0613227955365, 0.03568708609271523, 0.05326812826096509)
2026-05-24 13:24:26,190 - optuna.study.study - INFO - Trial 236 finished with values: [0.0613227955365, 0.03568708609271523, 0.05326812826096509] and parameters: {'n_layers': 1, 'embedding_dim': 64, 'lr': 0.003407247220990805, 'lambda_val': 3.4355332572174856e-05, 'batch_size': 1081, 'optimizer': 'Adam'}.
2026-05-24 13:24:33,960 - experiment_functions - INFO - Early stopping at epoch 600. Best Metrics: (0.059707645834478115, 0.035504966887417215, 0.05276477551564833)
2026-05-24 13:24:34,062 - optuna.study.study - INFO - Trial 237 finished with values: [0.059707645834478115, 0.035504966887417215, 0.05276477551564833] and parameters: {'n_layers': 1, 'embedding_dim': 96, 'lr': 0.004235289187226827, 'lambda_val': 0.0003409068265064018, 'batch_size': 1315, 'optimizer': 'Adam'}.
2026-05-24 13:24:42,655 - experiment_functions - INFO - Early stopping at epoch 550. Best Metrics: (0.024459558684077277, 0.019908940397350992, 0.023863354092845374)
2026-05-24 13:24:42,741 - optuna.study.study - INFO - Trial 238 finished with values: [0.024459558684077277, 0.019908940397350992, 0.023863354092845374] and parameters: {'n_layers': 4, 'embedding_dim': 64, 'lr': 0.003407247220990805, 'lambda_val': 0.02843248434954034, 'batch_size': 1081, 'optimizer': 'Adam'}.
2026-05-24 13:24:50,764 - experiment_functions - INFO - Early stopping at epoch 650. Best Metrics: (0.0543750667732038, 0.03401490066225166, 0.048410632573815615)
2026-05-24 13:24:50,851 - optuna.study.study - INFO - Trial 239 finished with values: [0.0543750667732038, 0.03401490066225166, 0.048410632573815615] and parameters: {'n_layers': 1, 'embedding_dim': 32, 'lr': 0.004235289187226827, 'lambda_val': 0.0006796337932014016, 'batch_size': 1315, 'optimizer': 'Adam'}.
2026-05-24 13:25:08,162 - experiment_functions - INFO - Early stopping at epoch 1600. Best Metrics: (0.06347538161622593, 0.03757450331125828, 0.05494072238418478)
2026-05-24 13:25:08,258 - optuna.study.study - INFO - Trial 240 finished with values: [0.06347538161622593, 0.03757450331125828, 0.05494072238418478] and parameters: {'n_layers': 1, 'embedding_dim': 32, 'lr': 0.000684293575282855, 'lambda_val': 0.0006796337932014016, 'batch_size': 1365, 'optimizer': 'Adam'}.
2026-05-24 13:25:16,159 - experiment_functions - INFO - Early stopping at epoch 550. Best Metrics: (0.016421771587950718, 0.01471026490066225, 0.017771754502363922)
2026-05-24 13:25:16,252 - optuna.study.study - INFO - Trial 241 finished with values: [0.016421771587950718, 0.01471026490066225, 0.017771754502363922] and parameters: {'n_layers': 4, 'embedding_dim': 128, 'lr': 0.004235289187226827, 'lambda_val': 0.007383021531734565, 'batch_size': 1081, 'optimizer': 'Adam'}.
2026-05-24 13:25:32,116 - experiment_functions - INFO - Early stopping at epoch 1400. Best Metrics: (0.06202781898911884, 0.036928807947019866, 0.05427410726240194)
2026-05-24 13:25:32,732 - optuna.study.study - INFO - Trial 242 finished with values: [0.06202781898911884, 0.036928807947019866, 0.05427410726240194] and parameters: {'n_layers': 1, 'embedding_dim': 96, 'lr': 0.000684293575282855, 'lambda_val': 2.662938714668246e-05, 'batch_size': 1315, 'optimizer': 'Adam'}.
2026-05-24 13:25:40,294 - experiment_functions - INFO - Early stopping at epoch 600. Best Metrics: (0.056218367626654005, 0.03418046357615894, 0.051727125471644826)
2026-05-24 13:25:40,389 - optuna.study.study - INFO - Trial 243 finished with values: [0.056218367626654005, 0.03418046357615894, 0.051727125471644826] and parameters: {'n_layers': 1, 'embedding_dim': 32, 'lr': 0.005103877753824678, 'lambda_val': 0.0006796337932014016, 'batch_size': 1304, 'optimizer': 'Adam'}.
2026-05-24 13:25:48,594 - experiment_functions - INFO - Early stopping at epoch 650. Best Metrics: (0.058341005992506585, 0.03482615894039735, 0.051650326575621616)
2026-05-24 13:25:48,816 - optuna.study.study - INFO - Trial 244 finished with values: [0.058341005992506585, 0.03482615894039735, 0.051650326575621616] and parameters: {'n_layers': 1, 'embedding_dim': 96, 'lr': 0.003407247220990805, 'lambda_val': 2.662938714668246e-05, 'batch_size': 791, 'optimizer': 'Adam'}.
2026-05-24 13:26:06,723 - experiment_functions - INFO - Early stopping at epoch 1450. Best Metrics: (0.004466990926475878, 0.0038907284768211928, 0.004851917098001831)
2026-05-24 13:26:06,821 - optuna.study.study - INFO - Trial 245 finished with values: [0.004466990926475878, 0.0038907284768211928, 0.004851917098001831] and parameters: {'n_layers': 3, 'embedding_dim': 96, 'lr': 1.0761163086135961e-05, 'lambda_val': 0.0003409068265064018, 'batch_size': 2525, 'optimizer': 'Adam'}.
2026-05-24 13:26:14,539 - experiment_functions - INFO - Early stopping at epoch 600. Best Metrics: (0.05649817545549898, 0.0343046357615894, 0.049231207568380904)
2026-05-24 13:26:14,699 - optuna.study.study - INFO - Trial 246 finished with values: [0.05649817545549898, 0.0343046357615894, 0.049231207568380904] and parameters: {'n_layers': 1, 'embedding_dim': 96, 'lr': 0.004235289187226827, 'lambda_val': 0.0003409068265064018, 'batch_size': 2509, 'optimizer': 'Adam'}.
2026-05-24 13:26:54,578 - optuna.study.study - INFO - Trial 247 finished with values: [0.00832426876301326, 0.00630794701986755, 0.008433603563398567] and parameters: {'n_layers': 1, 'embedding_dim': 32, 'lr': 0.0001072676377479871, 'lambda_val': 0.0018241216708581335, 'batch_size': 3957, 'optimizer': 'Adam'}.
2026-05-24 13:27:06,047 - experiment_functions - INFO - Early stopping at epoch 1000. Best Metrics: (0.06363368941764334, 0.0368294701986755, 0.05424259771003933)
2026-05-24 13:27:06,153 - optuna.study.study - INFO - Trial 248 finished with values: [0.06363368941764334, 0.0368294701986755, 0.05424259771003933] and parameters: {'n_layers': 1, 'embedding_dim': 32, 'lr': 0.000684293575282855, 'lambda_val': 0.02843248434954034, 'batch_size': 2525, 'optimizer': 'Adam'}.
2026-05-24 13:27:23,821 - experiment_functions - INFO - Early stopping at epoch 1650. Best Metrics: (0.012518338749152454, 0.012789735099337748, 0.014973851070152516)
