2026-05-24 05:58:57,415 - optuna.study.study - INFO - Trial 190 finished with values: [0.019898213695101127, 0.014279801324503311, 0.019960923389431555] and parameters: {'n_layers': 2, 'embedding_dim': 32, 'lr': 0.0034008688244003345, 'lambda_val': 5.78540826635863e-05, 'batch_size': 1501, 'optimizer': 'RMSprop'}.
2026-05-24 05:59:06,447 - experiment_functions - INFO - Early stopping at epoch 600. Best Metrics: (0.01785332619654327, 0.012847682119205298, 0.01785790761040877)
2026-05-24 05:59:06,552 - optuna.study.study - INFO - Trial 191 finished with values: [0.01785332619654327, 0.012847682119205298, 0.01785790761040877] and parameters: {'n_layers': 2, 'embedding_dim': 32, 'lr': 0.0033498782435460272, 'lambda_val': 2.9809066173301263e-06, 'batch_size': 3385, 'optimizer': 'Adam'}.
2026-05-24 05:59:18,875 - experiment_functions - INFO - Early stopping at epoch 1000. Best Metrics: (0.014639515440105041, 0.011498344370860928, 0.015100891793433692)
2026-05-24 05:59:18,967 - optuna.study.study - INFO - Trial 192 finished with values: [0.014639515440105041, 0.011498344370860928, 0.015100891793433692] and parameters: {'n_layers': 2, 'embedding_dim': 256, 'lr': 0.0004890104603780292, 'lambda_val': 0.00011858053419512538, 'batch_size': 3745, 'optimizer': 'Adam'}.
2026-05-24 05:59:42,647 - experiment_functions - INFO - Early stopping at epoch 2100. Best Metrics: (0.017768550069801665, 0.0131953642384106, 0.01807982646946517)
2026-05-24 05:59:42,780 - optuna.study.study - INFO - Trial 193 finished with values: [0.017768550069801665, 0.0131953642384106, 0.01807982646946517] and parameters: {'n_layers': 1, 'embedding_dim': 64, 'lr': 0.0003788253863598979, 'lambda_val': 2.9428916086760435e-06, 'batch_size': 3218, 'optimizer': 'Adam'}.
2026-05-24 05:59:50,705 - experiment_functions - INFO - Early stopping at epoch 600. Best Metrics: (0.018866946848931122, 0.01353476821192053, 0.0189906760502432)
2026-05-24 05:59:50,806 - optuna.study.study - INFO - Trial 194 finished with values: [0.018866946848931122, 0.01353476821192053, 0.0189906760502432] and parameters: {'n_layers': 2, 'embedding_dim': 32, 'lr': 0.004512010550703536, 'lambda_val': 5.78540826635863e-05, 'batch_size': 2716, 'optimizer': 'Adam'}.
2026-05-24 06:00:05,146 - experiment_functions - INFO - Early stopping at epoch 1300. Best Metrics: (0.024222613898183767, 0.018112582781456953, 0.02429109781050989)
2026-05-24 06:00:05,251 - optuna.study.study - INFO - Trial 195 finished with values: [0.024222613898183767, 0.018112582781456953, 0.02429109781050989] and parameters: {'n_layers': 2, 'embedding_dim': 32, 'lr': 0.0004890104603780292, 'lambda_val': 0.09383228839891232, 'batch_size': 2716, 'optimizer': 'RMSprop'}.
2026-05-24 06:00:16,219 - experiment_functions - INFO - Early stopping at epoch 950. Best Metrics: (0.016485256124729935, 0.012773178807947021, 0.01696444648180827)
2026-05-24 06:00:16,793 - optuna.study.study - INFO - Trial 196 finished with values: [0.016485256124729935, 0.012773178807947021, 0.01696444648180827] and parameters: {'n_layers': 2, 'embedding_dim': 96, 'lr': 0.0004890104603780292, 'lambda_val': 4.209947014533456e-05, 'batch_size': 3875, 'optimizer': 'RMSprop'}.
2026-05-24 06:00:31,848 - experiment_functions - INFO - Early stopping at epoch 1400. Best Metrics: (0.02241747716163131, 0.018013245033112586, 0.02338261274103086)
2026-05-24 06:00:32,758 - optuna.study.study - INFO - Trial 197 finished with values: [0.02241747716163131, 0.018013245033112586, 0.02338261274103086] and parameters: {'n_layers': 2, 'embedding_dim': 32, 'lr': 0.0004890104603780292, 'lambda_val': 0.09383228839891232, 'batch_size': 3682, 'optimizer': 'Adam'}.
2026-05-24 06:00:39,351 - experiment_functions - INFO - Early stopping at epoch 550. Best Metrics: (0.01768086423797911, 0.012110927152317881, 0.01776144195470546)
2026-05-24 06:00:39,833 - optuna.study.study - INFO - Trial 198 finished with values: [0.01768086423797911, 0.012110927152317881, 0.01776144195470546] and parameters: {'n_layers': 1, 'embedding_dim': 64, 'lr': 0.00567629368896096, 'lambda_val': 0.0028168727253759383, 'batch_size': 1575, 'optimizer': 'Adam'}.
2026-05-24 06:00:54,989 - experiment_functions - INFO - Early stopping at epoch 1400. Best Metrics: (0.015127744655981807, 0.013460264900662253, 0.0163171992036781)
2026-05-24 06:00:55,686 - optuna.study.study - INFO - Trial 199 finished with values: [0.015127744655981807, 0.013460264900662253, 0.0163171992036781] and parameters: {'n_layers': 2, 'embedding_dim': 128, 'lr': 0.0004890104603780292, 'lambda_val': 0.09383228839891232, 'batch_size': 2716, 'optimizer': 'Adam'}.
2026-05-24 06:01:02,879 - experiment_functions - INFO - Early stopping at epoch 550. Best Metrics: (0.01436442852107463, 0.011291390728476822, 0.014567857954373145)
2026-05-24 06:01:02,975 - optuna.study.study - INFO - Trial 200 finished with values: [0.01436442852107463, 0.011291390728476822, 0.014567857954373145] and parameters: {'n_layers': 2, 'embedding_dim': 256, 'lr': 0.0034008688244003345, 'lambda_val': 5.78540826635863e-05, 'batch_size': 1501, 'optimizer': 'RMSprop'}.
2026-05-24 06:01:19,879 - experiment_functions - INFO - Early stopping at epoch 1500. Best Metrics: (0.02010108456201572, 0.016456953642384108, 0.021045533238854167)
2026-05-24 06:01:20,233 - optuna.study.study - INFO - Trial 201 finished with values: [0.02010108456201572, 0.016456953642384108, 0.021045533238854167] and parameters: {'n_layers': 4, 'embedding_dim': 128, 'lr': 0.0002909391164072771, 'lambda_val': 0.0007072058953550323, 'batch_size': 1612, 'optimizer': 'Adam'}.
2026-05-24 06:01:45,071 - experiment_functions - INFO - Early stopping at epoch 2400. Best Metrics: (0.019818811005698718, 0.014859271523178808, 0.02040550916927098)
2026-05-24 06:01:45,225 - optuna.study.study - INFO - Trial 202 finished with values: [0.019818811005698718, 0.014859271523178808, 0.02040550916927098] and parameters: {'n_layers': 2, 'embedding_dim': 32, 'lr': 0.0004890104603780292, 'lambda_val': 7.310819428506298e-05, 'batch_size': 1501, 'optimizer': 'Adam'}.
2026-05-24 06:02:28,408 - optuna.study.study - INFO - Trial 203 finished with values: [0.01915178348053833, 0.01370860927152318, 0.018699832124128138] and parameters: {'n_layers': 2, 'embedding_dim': 128, 'lr': 0.0002909391164072771, 'lambda_val': 2.1355760438149747e-05, 'batch_size': 1612, 'optimizer': 'RMSprop'}.
2026-05-24 06:02:37,023 - experiment_functions - INFO - Early stopping at epoch 800. Best Metrics: (0.006004679454729142, 0.0044122516556291385, 0.005635523322760026)
2026-05-24 06:02:37,435 - optuna.study.study - INFO - Trial 204 finished with values: [0.006004679454729142, 0.0044122516556291385, 0.005635523322760026] and parameters: {'n_layers': 1, 'embedding_dim': 32, 'lr': 0.0034008688244003345, 'lambda_val': 2.9428916086760435e-06, 'batch_size': 1956, 'optimizer': 'SGD'}.
2026-05-24 06:02:53,781 - experiment_functions - INFO - Early stopping at epoch 1600. Best Metrics: (0.007146740166088316, 0.006829470198675498, 0.008061996290439861)
2026-05-24 06:02:55,247 - optuna.study.study - INFO - Trial 205 finished with values: [0.007146740166088316, 0.006829470198675498, 0.008061996290439861] and parameters: {'n_layers': 1, 'embedding_dim': 32, 'lr': 0.02523510680111781, 'lambda_val': 0.09383228839891232, 'batch_size': 1501, 'optimizer': 'Adam'}.
2026-05-24 06:03:36,136 - optuna.study.study - INFO - Trial 206 finished with values: [0.02419789093518143, 0.016481788079470202, 0.02348092253701495] and parameters: {'n_layers': 2, 'embedding_dim': 32, 'lr': 0.0004890104603780292, 'lambda_val': 0.007620237155778278, 'batch_size': 565, 'optimizer': 'RMSprop'}.
2026-05-24 06:03:54,615 - experiment_functions - INFO - Early stopping at epoch 1750. Best Metrics: (0.0158757360902446, 0.011374172185430464, 0.01579651382858186)
2026-05-24 06:03:54,704 - optuna.study.study - INFO - Trial 207 finished with values: [0.0158757360902446, 0.011374172185430464, 0.01579651382858186] and parameters: {'n_layers': 1, 'embedding_dim': 128, 'lr': 0.0003788253863598979, 'lambda_val': 0.00013892846035396848, 'batch_size': 2716, 'optimizer': 'Adam'}.
2026-05-24 06:04:05,973 - experiment_functions - INFO - Early stopping at epoch 1000. Best Metrics: (0.019740400693871063, 0.014329470198675498, 0.019891602722745608)
2026-05-24 06:04:06,080 - optuna.study.study - INFO - Trial 208 finished with values: [0.019740400693871063, 0.014329470198675498, 0.019891602722745608] and parameters: {'n_layers': 2, 'embedding_dim': 32, 'lr': 0.0007714507483516837, 'lambda_val': 0.00013892846035396848, 'batch_size': 2716, 'optimizer': 'Adam'}.
2026-05-24 06:04:12,588 - experiment_functions - INFO - Early stopping at epoch 550. Best Metrics: (0.01733130051096152, 0.012408940397350994, 0.017495337129456306)
2026-05-24 06:04:12,877 - optuna.study.study - INFO - Trial 209 finished with values: [0.01733130051096152, 0.012408940397350994, 0.017495337129456306] and parameters: {'n_layers': 2, 'embedding_dim': 64, 'lr': 0.00567629368896096, 'lambda_val': 0.0028168727253759383, 'batch_size': 2716, 'optimizer': 'Adam'}.
2026-05-24 06:04:19,199 - experiment_functions - INFO - Early stopping at epoch 500. Best Metrics: (0.00951211530689067, 0.007475165562913907, 0.009938198445896808)
2026-05-24 06:04:19,924 - optuna.study.study - INFO - Trial 210 finished with values: [0.00951211530689067, 0.007475165562913907, 0.009938198445896808] and parameters: {'n_layers': 4, 'embedding_dim': 32, 'lr': 0.011838049228562226, 'lambda_val': 0.0002702283536384827, 'batch_size': 2716, 'optimizer': 'RMSprop'}.
2026-05-24 06:04:57,537 - experiment_functions - INFO - Early stopping at epoch 3700. Best Metrics: (0.02318872613974001, 0.015413907284768213, 0.02196731526252652)
2026-05-24 06:04:57,626 - optuna.study.study - INFO - Trial 211 finished with values: [0.02318872613974001, 0.015413907284768213, 0.02196731526252652] and parameters: {'n_layers': 1, 'embedding_dim': 32, 'lr': 0.0003788253863598979, 'lambda_val': 8.285816698420654e-05, 'batch_size': 1501, 'optimizer': 'Adam'}.
2026-05-24 06:05:04,289 - experiment_functions - INFO - Early stopping at epoch 550. Best Metrics: (0.010519360763869768, 0.008543046357615894, 0.010401913165951956)
2026-05-24 06:05:04,430 - optuna.study.study - INFO - Trial 212 finished with values: [0.010519360763869768, 0.008543046357615894, 0.010401913165951956] and parameters: {'n_layers': 3, 'embedding_dim': 64, 'lr': 0.07760568640217994, 'lambda_val': 5.78540826635863e-05, 'batch_size': 2144, 'optimizer': 'Adam'}.
2026-05-24 06:05:19,336 - experiment_functions - INFO - Early stopping at epoch 1350. Best Metrics: (0.021533659511159414, 0.017698675496688743, 0.02262379332945162)
2026-05-24 06:05:19,630 - optuna.study.study - INFO - Trial 213 finished with values: [0.021533659511159414, 0.017698675496688743, 0.02262379332945162] and parameters: {'n_layers': 4, 'embedding_dim': 32, 'lr': 0.0004915796983483617, 'lambda_val': 5.78540826635863e-05, 'batch_size': 1264, 'optimizer': 'Adam'}.
2026-05-24 06:05:58,082 - experiment_functions - INFO - Early stopping at epoch 3900. Best Metrics: (0.007086532277393616, 0.005082781456953643, 0.007119416655608416)
2026-05-24 06:05:58,165 - optuna.study.study - INFO - Trial 214 finished with values: [0.007086532277393616, 0.005082781456953643, 0.007119416655608416] and parameters: {'n_layers': 2, 'embedding_dim': 128, 'lr': 3.0634859325199315e-05, 'lambda_val': 1.3841539243221809e-05, 'batch_size': 1612, 'optimizer': 'RMSprop'}.
2026-05-24 06:06:24,801 - experiment_functions - INFO - Early stopping at epoch 2500. Best Metrics: (0.020773197922619994, 0.01597682119205298, 0.02198377226772483)
2026-05-24 06:06:24,897 - optuna.study.study - INFO - Trial 215 finished with values: [0.020773197922619994, 0.01597682119205298, 0.02198377226772483] and parameters: {'n_layers': 4, 'embedding_dim': 32, 'lr': 0.0002909391164072771, 'lambda_val': 2.1355760438149747e-05, 'batch_size': 2097, 'optimizer': 'Adam'}.
2026-05-24 06:06:39,192 - experiment_functions - INFO - Early stopping at epoch 1300. Best Metrics: (0.01845181207193611, 0.013750000000000002, 0.018700682561049887)
2026-05-24 06:06:39,281 - optuna.study.study - INFO - Trial 216 finished with values: [0.01845181207193611, 0.013750000000000002, 0.018700682561049887] and parameters: {'n_layers': 2, 'embedding_dim': 64, 'lr': 0.0004890104603780292, 'lambda_val': 0.0006243912001987849, 'batch_size': 2716, 'optimizer': 'RMSprop'}.
2026-05-24 06:06:58,718 - experiment_functions - INFO - Early stopping at epoch 1900. Best Metrics: (0.020860901477711528, 0.01396523178807947, 0.020428860348745474)
2026-05-24 06:06:58,888 - optuna.study.study - INFO - Trial 217 finished with values: [0.020860901477711528, 0.01396523178807947, 0.020428860348745474] and parameters: {'n_layers': 1, 'embedding_dim': 32, 'lr': 0.0004890104603780292, 'lambda_val': 0.007620237155778278, 'batch_size': 1091, 'optimizer': 'Adam'}.
2026-05-24 06:07:08,297 - experiment_functions - INFO - Early stopping at epoch 700. Best Metrics: (0.016885760728661884, 0.014089403973509933, 0.017971293679329568)
2026-05-24 06:07:08,667 - optuna.study.study - INFO - Trial 218 finished with values: [0.016885760728661884, 0.014089403973509933, 0.017971293679329568] and parameters: {'n_layers': 4, 'embedding_dim': 256, 'lr': 0.0004890104603780292, 'lambda_val': 0.0006557593423551091, 'batch_size': 2492, 'optimizer': 'RMSprop'}.
2026-05-24 06:07:25,521 - experiment_functions - INFO - Early stopping at epoch 1600. Best Metrics: (0.01941805993615493, 0.013311258278145697, 0.01904280103566855)
2026-05-24 06:07:26,422 - optuna.study.study - INFO - Trial 219 finished with values: [0.01941805993615493, 0.013311258278145697, 0.01904280103566855] and parameters: {'n_layers': 1, 'embedding_dim': 32, 'lr': 0.0003788253863598979, 'lambda_val': 0.007620237155778278, 'batch_size': 2716, 'optimizer': 'Adam'}.
2026-05-24 06:07:42,656 - experiment_functions - INFO - Early stopping at epoch 1450. Best Metrics: (0.021547554300760465, 0.017723509933774837, 0.023148199447222392)
2026-05-24 06:07:43,658 - optuna.study.study - INFO - Trial 220 finished with values: [0.021547554300760465, 0.017723509933774837, 0.023148199447222392] and parameters: {'n_layers': 4, 'embedding_dim': 96, 'lr': 0.0002909391164072771, 'lambda_val': 0.004830254272011785, 'batch_size': 1833, 'optimizer': 'Adam'}.
2026-05-24 06:07:49,905 - experiment_functions - INFO - Early stopping at epoch 500. Best Metrics: (0.005101176619661212, 0.0040562913907284765, 0.005163245391910414)
2026-05-24 06:07:50,696 - optuna.study.study - INFO - Trial 221 finished with values: [0.005101176619661212, 0.0040562913907284765, 0.005163245391910414] and parameters: {'n_layers': 4, 'embedding_dim': 64, 'lr': 0.00018164145276986003, 'lambda_val': 0.010248606541800688, 'batch_size': 2492, 'optimizer': 'SGD'}.
2026-05-24 06:08:00,261 - experiment_functions - INFO - Early stopping at epoch 850. Best Metrics: (0.009677865579719438, 0.009710264900662253, 0.011434784623242482)
2026-05-24 06:08:00,364 - optuna.study.study - INFO - Trial 222 finished with values: [0.009677865579719438, 0.009710264900662253, 0.011434784623242482] and parameters: {'n_layers': 2, 'embedding_dim': 96, 'lr': 0.0034008688244003345, 'lambda_val': 0.09383228839891232, 'batch_size': 1501, 'optimizer': 'RMSprop'}.
2026-05-24 06:08:08,247 - experiment_functions - INFO - Early stopping at epoch 550. Best Metrics: (0.011286059080947666, 0.009205298013245034, 0.011740021063584577)
2026-05-24 06:08:08,523 - optuna.study.study - INFO - Trial 223 finished with values: [0.011286059080947666, 0.009205298013245034, 0.011740021063584577] and parameters: {'n_layers': 4, 'embedding_dim': 96, 'lr': 0.004968165351286781, 'lambda_val': 0.00013892846035396848, 'batch_size': 3218, 'optimizer': 'RMSprop'}.
2026-05-24 06:08:37,753 - experiment_functions - INFO - Early stopping at epoch 2800. Best Metrics: (0.018832665020971053, 0.013832781456953644, 0.018986968254302156)
2026-05-24 06:08:37,843 - optuna.study.study - INFO - Trial 224 finished with values: [0.018832665020971053, 0.013832781456953644, 0.018986968254302156] and parameters: {'n_layers': 2, 'embedding_dim': 32, 'lr': 0.0003788253863598979, 'lambda_val': 0.00013892846035396848, 'batch_size': 2716, 'optimizer': 'RMSprop'}.
2026-05-24 06:09:09,697 - experiment_functions - INFO - Early stopping at epoch 3000. Best Metrics: (0.019799772285012496, 0.015082781456953642, 0.02012087834314512)
2026-05-24 06:09:10,689 - optuna.study.study - INFO - Trial 225 finished with values: [0.019799772285012496, 0.015082781456953642, 0.02012087834314512] and parameters: {'n_layers': 3, 'embedding_dim': 96, 'lr': 0.0002909391164072771, 'lambda_val': 5.78540826635863e-05, 'batch_size': 2144, 'optimizer': 'RMSprop'}.
2026-05-24 06:09:17,529 - experiment_functions - INFO - Early stopping at epoch 550. Best Metrics: (0.017391401224059033, 0.012508278145695367, 0.017499595368858457)
2026-05-24 06:09:17,633 - optuna.study.study - INFO - Trial 226 finished with values: [0.017391401224059033, 0.012508278145695367, 0.017499595368858457] and parameters: {'n_layers': 2, 'embedding_dim': 32, 'lr': 0.0055495137602704, 'lambda_val': 5.78540826635863e-05, 'batch_size': 2716, 'optimizer': 'Adam'}.
2026-05-24 06:09:41,981 - experiment_functions - INFO - Early stopping at epoch 2300. Best Metrics: (0.01877974066662345, 0.013584437086092718, 0.018941209266197963)
2026-05-24 06:09:42,683 - optuna.study.study - INFO - Trial 227 finished with values: [0.01877974066662345, 0.013584437086092718, 0.018941209266197963] and parameters: {'n_layers': 2, 'embedding_dim': 128, 'lr': 0.0002909391164072771, 'lambda_val': 5.78540826635863e-05, 'batch_size': 1612, 'optimizer': 'RMSprop'}.
2026-05-24 06:09:48,886 - experiment_functions - INFO - Early stopping at epoch 500. Best Metrics: (0.004273275919780844, 0.004006622516556292, 0.004661154721380138)
2026-05-24 06:09:49,039 - optuna.study.study - INFO - Trial 228 finished with values: [0.004273275919780844, 0.004006622516556292, 0.004661154721380138] and parameters: {'n_layers': 3, 'embedding_dim': 32, 'lr': 4.389087021846879e-05, 'lambda_val': 0.09383228839891232, 'batch_size': 2716, 'optimizer': 'Adam'}.
2026-05-24 06:10:01,081 - experiment_functions - INFO - Early stopping at epoch 1100. Best Metrics: (0.017976061861653986, 0.013369205298013245, 0.0183935402509754)
2026-05-24 06:10:01,973 - optuna.study.study - INFO - Trial 229 finished with values: [0.017976061861653986, 0.013369205298013245, 0.0183935402509754] and parameters: {'n_layers': 2, 'embedding_dim': 64, 'lr': 0.0004890104603780292, 'lambda_val': 0.004830254272011785, 'batch_size': 3218, 'optimizer': 'RMSprop'}.
2026-05-24 06:10:08,681 - experiment_functions - INFO - Early stopping at epoch 550. Best Metrics: (0.015174320949286314, 0.012326158940397352, 0.015827072566300702)
2026-05-24 06:10:09,595 - optuna.study.study - INFO - Trial 230 finished with values: [0.015174320949286314, 0.012326158940397352, 0.015827072566300702] and parameters: {'n_layers': 3, 'embedding_dim': 128, 'lr': 0.008884261053669282, 'lambda_val': 7.112074068161609e-06, 'batch_size': 1612, 'optimizer': 'Adam'}.
2026-05-24 06:10:25,151 - experiment_functions - INFO - Early stopping at epoch 1450. Best Metrics: (0.020247995498429767, 0.01439569536423841, 0.02010189973970152)
2026-05-24 06:10:26,338 - optuna.study.study - INFO - Trial 231 finished with values: [0.020247995498429767, 0.01439569536423841, 0.02010189973970152] and parameters: {'n_layers': 2, 'embedding_dim': 32, 'lr': 0.0004890104603780292, 'lambda_val': 2.9809066173301263e-06, 'batch_size': 2716, 'optimizer': 'Adam'}.
2026-05-24 06:10:33,057 - experiment_functions - INFO - Early stopping at epoch 550. Best Metrics: (0.01993005586842078, 0.01517384105960265, 0.01952551829559235)
2026-05-24 06:10:33,120 - optuna.study.study - INFO - Trial 232 finished with values: [0.01993005586842078, 0.01517384105960265, 0.01952551829559235] and parameters: {'n_layers': 4, 'embedding_dim': 32, 'lr': 0.0037147017870386746, 'lambda_val': 0.00013892846035396848, 'batch_size': 542, 'optimizer': 'RMSprop'}.
2026-05-24 06:10:54,287 - experiment_functions - INFO - Early stopping at epoch 1950. Best Metrics: (0.023134480577482585, 0.018667218543046357, 0.024405796614347074)
2026-05-24 06:10:55,115 - optuna.study.study - INFO - Trial 233 finished with values: [0.023134480577482585, 0.018667218543046357, 0.024405796614347074] and parameters: {'n_layers': 4, 'embedding_dim': 64, 'lr': 0.0003788253863598979, 'lambda_val': 0.00013892846035396848, 'batch_size': 684, 'optimizer': 'RMSprop'}.
2026-05-24 06:11:19,371 - experiment_functions - INFO - Early stopping at epoch 2100. Best Metrics: (0.019584335799885003, 0.014321192052980132, 0.020107882644829673)
2026-05-24 06:11:19,491 - optuna.study.study - INFO - Trial 234 finished with values: [0.019584335799885003, 0.014321192052980132, 0.020107882644829673] and parameters: {'n_layers': 2, 'embedding_dim': 32, 'lr': 0.0004890104603780292, 'lambda_val': 0.00013892846035396848, 'batch_size': 2716, 'optimizer': 'RMSprop'}.
2026-05-24 06:11:33,650 - experiment_functions - INFO - Early stopping at epoch 1200. Best Metrics: (0.017779401313601634, 0.014834437086092717, 0.019327331513287655)
2026-05-24 06:11:33,807 - optuna.study.study - INFO - Trial 235 finished with values: [0.017779401313601634, 0.014834437086092717, 0.019327331513287655] and parameters: {'n_layers': 4, 'embedding_dim': 128, 'lr': 0.0002909391164072771, 'lambda_val': 0.0002702283536384827, 'batch_size': 3218, 'optimizer': 'RMSprop'}.
2026-05-24 06:11:48,909 - experiment_functions - INFO - Early stopping at epoch 1300. Best Metrics: (0.019155547272449044, 0.015314569536423841, 0.020278100813751945)
