2026-05-24 13:39:02,700 - optuna.study.study - INFO - Trial 296 finished with values: [0.05798054445116908, 0.034801324503311255, 0.05190640525948876] and parameters: {'n_layers': 1, 'embedding_dim': 64, 'lr': 0.0005846659139515835, 'lambda_val': 1.2220766254172884e-06, 'batch_size': 1315, 'optimizer': 'Adam'}.
2026-05-24 13:39:09,516 - experiment_functions - INFO - Early stopping at epoch 550. Best Metrics: (0.052422865189134304, 0.031100993377483444, 0.046296894625752316)
2026-05-24 13:39:09,616 - optuna.study.study - INFO - Trial 297 finished with values: [0.052422865189134304, 0.031100993377483444, 0.046296894625752316] and parameters: {'n_layers': 1, 'embedding_dim': 32, 'lr': 0.016064672265292658, 'lambda_val': 3.1090320134873986e-06, 'batch_size': 563, 'optimizer': 'Adam'}.
2026-05-24 13:39:17,244 - experiment_functions - INFO - Early stopping at epoch 600. Best Metrics: (0.06061714988324085, 0.03565397350993378, 0.05397922567205211)
2026-05-24 13:39:17,339 - optuna.study.study - INFO - Trial 298 finished with values: [0.06061714988324085, 0.03565397350993378, 0.05397922567205211] and parameters: {'n_layers': 1, 'embedding_dim': 96, 'lr': 0.004235289187226827, 'lambda_val': 1.069785669533184e-06, 'batch_size': 1646, 'optimizer': 'Adam'}.
2026-05-24 13:39:33,494 - experiment_functions - INFO - Early stopping at epoch 1400. Best Metrics: (0.06003873036555077, 0.03668046357615894, 0.05338378361807613)
2026-05-24 13:39:34,421 - optuna.study.study - INFO - Trial 299 finished with values: [0.06003873036555077, 0.03668046357615894, 0.05338378361807613] and parameters: {'n_layers': 1, 'embedding_dim': 96, 'lr': 0.000684293575282855, 'lambda_val': 0.0003409068265064018, 'batch_size': 1315, 'optimizer': 'Adam'}.
2026-05-24 13:39:34,454 - root - INFO - Selected Trial 133 based on Max ndcg: 0.0629
2026-05-24 13:39:34,454 - root - INFO - Associated Recall: 0.0750
2026-05-24 13:39:34,454 - experiment_functions - INFO - Training the best model ... for e_1M_1c1dcs_rand4
2026-05-24 13:39:51,938 - experiment_functions - INFO - Early stopping at epoch 1650. Best Metrics: (0.07087156913336025, 0.04064569536423841, 0.05989319457969061)
2026-05-24 13:39:52,828 - root - INFO -   **** Training e_1M_1c1dcs_rand5
2026-05-24 13:39:52,882 - root - INFO -   **** Getting 190231/805443 random edges
2026-05-24 13:39:53,803 - optuna.storages._rdb.storage - INFO - A new study created in RDB with name: Study_e_1M_1c1dcs_rand5
2026-05-24 13:40:00,538 - experiment_functions - INFO - Early stopping at epoch 500. Best Metrics: (0.00511242183579928, 0.004172185430463576, 0.005410117145510099)
2026-05-24 13:40:00,632 - optuna.study.study - INFO - Trial 0 finished with values: [0.00511242183579928, 0.004172185430463576, 0.005410117145510099] and parameters: {'n_layers': 1, 'embedding_dim': 256, 'lr': 7.175260580271771e-05, 'lambda_val': 0.018306309050312594, 'batch_size': 1339, 'optimizer': 'Adam'}.
2026-05-24 13:40:07,335 - experiment_functions - INFO - Early stopping at epoch 500. Best Metrics: (0.005282144977262433, 0.004370860927152318, 0.005382435732086421)
2026-05-24 13:40:07,646 - optuna.study.study - INFO - Trial 1 finished with values: [0.005282144977262433, 0.004370860927152318, 0.005382435732086421] and parameters: {'n_layers': 3, 'embedding_dim': 96, 'lr': 0.0003859482391059796, 'lambda_val': 0.000336532941170015, 'batch_size': 2635, 'optimizer': 'SGD'}.
2026-05-24 13:40:18,000 - experiment_functions - INFO - Early stopping at epoch 550. Best Metrics: (0.005569831589879198, 0.0043791390728476825, 0.005395186482782605)
2026-05-24 13:40:18,096 - optuna.study.study - INFO - Trial 2 finished with values: [0.005569831589879198, 0.0043791390728476825, 0.005395186482782605] and parameters: {'n_layers': 1, 'embedding_dim': 96, 'lr': 1.223705051515268e-05, 'lambda_val': 0.0005450686189662139, 'batch_size': 1393, 'optimizer': 'RMSprop'}.
2026-05-24 13:40:25,120 - experiment_functions - INFO - Early stopping at epoch 500. Best Metrics: (0.017338660708111832, 0.013658940397350994, 0.01774324250404553)
2026-05-24 13:40:25,288 - optuna.study.study - INFO - Trial 3 finished with values: [0.017338660708111832, 0.013658940397350994, 0.01774324250404553] and parameters: {'n_layers': 4, 'embedding_dim': 96, 'lr': 0.03478995397882625, 'lambda_val': 8.836170253141606e-05, 'batch_size': 886, 'optimizer': 'RMSprop'}.
2026-05-24 13:40:34,925 - experiment_functions - INFO - Early stopping at epoch 550. Best Metrics: (0.020958675497323453, 0.016821192052980133, 0.020812124896087913)
2026-05-24 13:40:35,024 - optuna.study.study - INFO - Trial 4 finished with values: [0.020958675497323453, 0.016821192052980133, 0.020812124896087913] and parameters: {'n_layers': 4, 'embedding_dim': 256, 'lr': 0.0005618032422556454, 'lambda_val': 0.008933254496519926, 'batch_size': 2328, 'optimizer': 'RMSprop'}.
2026-05-24 13:41:15,397 - experiment_functions - INFO - Early stopping at epoch 2900. Best Metrics: (0.007035313180035312, 0.008716887417218544, 0.009732727031337074)
2026-05-24 13:41:15,516 - optuna.study.study - INFO - Trial 5 finished with values: [0.007035313180035312, 0.008716887417218544, 0.009732727031337074] and parameters: {'n_layers': 3, 'embedding_dim': 256, 'lr': 0.05279473690592034, 'lambda_val': 0.029288820281810176, 'batch_size': 2141, 'optimizer': 'Adam'}.
2026-05-24 13:41:35,964 - experiment_functions - INFO - Early stopping at epoch 1700. Best Metrics: (0.0059946844996494105, 0.004346026490066225, 0.005739808270893931)
2026-05-24 13:41:36,097 - optuna.study.study - INFO - Trial 6 finished with values: [0.0059946844996494105, 0.004346026490066225, 0.005739808270893931] and parameters: {'n_layers': 4, 'embedding_dim': 96, 'lr': 1.087367817332438e-05, 'lambda_val': 2.648093092469685e-06, 'batch_size': 863, 'optimizer': 'Adam'}.
2026-05-24 13:41:44,773 - experiment_functions - INFO - Early stopping at epoch 700. Best Metrics: (0.023499781967200217, 0.018071192052980134, 0.024030613992150084)
2026-05-24 13:41:45,468 - optuna.study.study - INFO - Trial 7 finished with values: [0.023499781967200217, 0.018071192052980134, 0.024030613992150084] and parameters: {'n_layers': 4, 'embedding_dim': 32, 'lr': 0.0006563002976325864, 'lambda_val': 1.4247463760726523e-06, 'batch_size': 3328, 'optimizer': 'RMSprop'}.
2026-05-24 13:41:51,483 - experiment_functions - INFO - Early stopping at epoch 500. Best Metrics: (0.005279622851298525, 0.004312913907284768, 0.005480848534051156)
2026-05-24 13:41:51,931 - optuna.study.study - INFO - Trial 8 finished with values: [0.005279622851298525, 0.004312913907284768, 0.005480848534051156] and parameters: {'n_layers': 3, 'embedding_dim': 32, 'lr': 1.587575147102601e-05, 'lambda_val': 0.0017563097116744671, 'batch_size': 2204, 'optimizer': 'RMSprop'}.
2026-05-24 13:41:59,708 - experiment_functions - INFO - Early stopping at epoch 550. Best Metrics: (0.004982546473495031, 0.004213576158940397, 0.0051602677344688335)
2026-05-24 13:41:59,793 - optuna.study.study - INFO - Trial 9 finished with values: [0.004982546473495031, 0.004213576158940397, 0.0051602677344688335] and parameters: {'n_layers': 2, 'embedding_dim': 256, 'lr': 4.0505597828378984e-05, 'lambda_val': 0.00019642917096569077, 'batch_size': 907, 'optimizer': 'Adam'}.
2026-05-24 13:42:07,322 - experiment_functions - INFO - Early stopping at epoch 550. Best Metrics: (0.005394305876395741, 0.004163907284768212, 0.005448720593772797)
2026-05-24 13:42:07,405 - optuna.study.study - INFO - Trial 10 finished with values: [0.005394305876395741, 0.004163907284768212, 0.005448720593772797] and parameters: {'n_layers': 2, 'embedding_dim': 256, 'lr': 0.015073051319504148, 'lambda_val': 0.00039186744745002176, 'batch_size': 3269, 'optimizer': 'SGD'}.
2026-05-24 13:42:33,305 - experiment_functions - INFO - Early stopping at epoch 2150. Best Metrics: (0.05153429992244434, 0.03280629139072848, 0.04597832532191378)
2026-05-24 13:42:33,393 - optuna.study.study - INFO - Trial 11 finished with values: [0.05153429992244434, 0.03280629139072848, 0.04597832532191378] and parameters: {'n_layers': 1, 'embedding_dim': 256, 'lr': 0.00028626012255777994, 'lambda_val': 1.0152215023816412e-05, 'batch_size': 3618, 'optimizer': 'Adam'}.
2026-05-24 13:42:39,407 - experiment_functions - INFO - Early stopping at epoch 500. Best Metrics: (0.006161297122729678, 0.004420529801324504, 0.00558141511354506)
2026-05-24 13:42:39,863 - optuna.study.study - INFO - Trial 12 finished with values: [0.006161297122729678, 0.004420529801324504, 0.00558141511354506] and parameters: {'n_layers': 2, 'embedding_dim': 64, 'lr': 4.83467802640101e-05, 'lambda_val': 0.000850057036094434, 'batch_size': 1481, 'optimizer': 'SGD'}.
2026-05-24 13:42:47,746 - experiment_functions - INFO - Early stopping at epoch 700. Best Metrics: (0.004842755797983773, 0.004197019867549669, 0.005198008608827213)
2026-05-24 13:42:48,801 - optuna.study.study - INFO - Trial 13 finished with values: [0.004842755797983773, 0.004197019867549669, 0.005198008608827213] and parameters: {'n_layers': 1, 'embedding_dim': 128, 'lr': 0.05820167366526777, 'lambda_val': 6.31323189685429e-06, 'batch_size': 4096, 'optimizer': 'SGD'}.
2026-05-24 13:43:01,883 - experiment_functions - INFO - Early stopping at epoch 1100. Best Metrics: (0.04479299188165883, 0.029428807947019867, 0.03992831854127912)
2026-05-24 13:43:01,982 - optuna.study.study - INFO - Trial 14 finished with values: [0.04479299188165883, 0.029428807947019867, 0.03992831854127912] and parameters: {'n_layers': 2, 'embedding_dim': 96, 'lr': 0.0003540171758009511, 'lambda_val': 9.463812196591343e-06, 'batch_size': 3012, 'optimizer': 'Adam'}.
2026-05-24 13:43:11,333 - experiment_functions - INFO - Early stopping at epoch 650. Best Metrics: (0.04940147491847799, 0.030364238410596024, 0.044212226729501765)
2026-05-24 13:43:11,429 - optuna.study.study - INFO - Trial 15 finished with values: [0.04940147491847799, 0.030364238410596024, 0.044212226729501765] and parameters: {'n_layers': 2, 'embedding_dim': 256, 'lr': 0.0007653011157039608, 'lambda_val': 7.011674546086162e-05, 'batch_size': 1055, 'optimizer': 'RMSprop'}.
2026-05-24 13:43:59,269 - optuna.study.study - INFO - Trial 16 finished with values: [0.02428679503848979, 0.017508278145695364, 0.023593091512654492] and parameters: {'n_layers': 2, 'embedding_dim': 64, 'lr': 0.00914986330156684, 'lambda_val': 0.0034713999695200454, 'batch_size': 592, 'optimizer': 'RMSprop'}.
2026-05-24 13:44:18,460 - experiment_functions - INFO - Early stopping at epoch 1750. Best Metrics: (0.006143885380641662, 0.004478476821192054, 0.005882844617272158)
2026-05-24 13:44:18,722 - optuna.study.study - INFO - Trial 17 finished with values: [0.006143885380641662, 0.004478476821192054, 0.005882844617272158] and parameters: {'n_layers': 3, 'embedding_dim': 64, 'lr': 0.07323519135760621, 'lambda_val': 0.0005346251103432946, 'batch_size': 1315, 'optimizer': 'SGD'}.
2026-05-24 13:44:25,930 - experiment_functions - INFO - Early stopping at epoch 500. Best Metrics: (0.005368891132112691, 0.0040976821192052985, 0.005185383350484053)
2026-05-24 13:44:26,020 - optuna.study.study - INFO - Trial 18 finished with values: [0.005368891132112691, 0.0040976821192052985, 0.005185383350484053] and parameters: {'n_layers': 4, 'embedding_dim': 128, 'lr': 6.076426370088834e-05, 'lambda_val': 1.972376365335546e-06, 'batch_size': 3924, 'optimizer': 'SGD'}.
2026-05-24 13:44:41,912 - experiment_functions - INFO - Early stopping at epoch 1300. Best Metrics: (0.005589286014814302, 0.004486754966887417, 0.005676209134481402)
2026-05-24 13:44:42,940 - optuna.study.study - INFO - Trial 19 finished with values: [0.005589286014814302, 0.004486754966887417, 0.005676209134481402] and parameters: {'n_layers': 4, 'embedding_dim': 96, 'lr': 0.09610834792663928, 'lambda_val': 3.9334692597631495e-05, 'batch_size': 1238, 'optimizer': 'SGD'}.
2026-05-24 13:44:51,381 - experiment_functions - INFO - Early stopping at epoch 600. Best Metrics: (0.036363917887299015, 0.023708609271523177, 0.03303147388424021)
2026-05-24 13:44:51,481 - optuna.study.study - INFO - Trial 20 finished with values: [0.036363917887299015, 0.023708609271523177, 0.03303147388424021] and parameters: {'n_layers': 3, 'embedding_dim': 128, 'lr': 0.0011385009641030693, 'lambda_val': 0.000339235643209516, 'batch_size': 2645, 'optimizer': 'Adam'}.
2026-05-24 13:44:57,945 - experiment_functions - INFO - Early stopping at epoch 500. Best Metrics: (0.0051427274448034134, 0.00445364238410596, 0.005592553724374409)
2026-05-24 13:44:58,768 - optuna.study.study - INFO - Trial 21 finished with values: [0.0051427274448034134, 0.00445364238410596, 0.005592553724374409] and parameters: {'n_layers': 2, 'embedding_dim': 96, 'lr': 0.0018843975064796988, 'lambda_val': 0.00012088782415035242, 'batch_size': 3184, 'optimizer': 'SGD'}.
2026-05-24 13:45:15,174 - experiment_functions - INFO - Early stopping at epoch 1400. Best Metrics: (0.033733993492474953, 0.023476821192052983, 0.03224644470998305)
2026-05-24 13:45:16,049 - optuna.study.study - INFO - Trial 22 finished with values: [0.033733993492474953, 0.023476821192052983, 0.03224644470998305] and parameters: {'n_layers': 3, 'embedding_dim': 32, 'lr': 0.00030176895436135383, 'lambda_val': 0.00036119255164558764, 'batch_size': 2548, 'optimizer': 'Adam'}.
2026-05-24 13:45:23,828 - experiment_functions - INFO - Early stopping at epoch 700. Best Metrics: (0.00716573772762911, 0.006225165562913909, 0.007753404148091349)
2026-05-24 13:45:23,933 - optuna.study.study - INFO - Trial 23 finished with values: [0.00716573772762911, 0.006225165562913909, 0.007753404148091349] and parameters: {'n_layers': 1, 'embedding_dim': 32, 'lr': 0.08799283980714859, 'lambda_val': 1.2614038989583808e-06, 'batch_size': 939, 'optimizer': 'RMSprop'}.
2026-05-24 13:46:05,168 - optuna.study.study - INFO - Trial 24 finished with values: [0.02826477016838544, 0.019933774834437087, 0.02662296878587697] and parameters: {'n_layers': 2, 'embedding_dim': 32, 'lr': 0.00012749160505002986, 'lambda_val': 1.4446750706679519e-05, 'batch_size': 3049, 'optimizer': 'Adam'}.
2026-05-24 13:46:17,118 - experiment_functions - INFO - Early stopping at epoch 950. Best Metrics: (0.02012804086745429, 0.01308774834437086, 0.01798525707274919)
2026-05-24 13:46:17,830 - optuna.study.study - INFO - Trial 25 finished with values: [0.02012804086745429, 0.01308774834437086, 0.01798525707274919] and parameters: {'n_layers': 3, 'embedding_dim': 128, 'lr': 0.02064447429932105, 'lambda_val': 1.2997567115427894e-05, 'batch_size': 1494, 'optimizer': 'Adam'}.
2026-05-24 13:46:41,300 - experiment_functions - INFO - Early stopping at epoch 2250. Best Metrics: (0.004911232958123519, 0.004089403973509934, 0.005068367927736819)
2026-05-24 13:46:41,419 - optuna.study.study - INFO - Trial 26 finished with values: [0.004911232958123519, 0.004089403973509934, 0.005068367927736819] and parameters: {'n_layers': 2, 'embedding_dim': 96, 'lr': 1.2456129649408753e-05, 'lambda_val': 0.0008714898235313185, 'batch_size': 2876, 'optimizer': 'RMSprop'}.
2026-05-24 13:46:48,200 - experiment_functions - INFO - Early stopping at epoch 500. Best Metrics: (0.005379443532117265, 0.004205298013245033, 0.0055869132785020805)
2026-05-24 13:46:48,923 - optuna.study.study - INFO - Trial 27 finished with values: [0.005379443532117265, 0.004205298013245033, 0.0055869132785020805] and parameters: {'n_layers': 1, 'embedding_dim': 256, 'lr': 4.813905720764143e-05, 'lambda_val': 0.042115769741649274, 'batch_size': 2975, 'optimizer': 'RMSprop'}.
2026-05-24 13:47:12,895 - experiment_functions - INFO - Early stopping at epoch 1850. Best Metrics: (0.006838731754329005, 0.008096026490066226, 0.008934136028004618)
2026-05-24 13:47:13,009 - optuna.study.study - INFO - Trial 28 finished with values: [0.006838731754329005, 0.008096026490066226, 0.008934136028004618] and parameters: {'n_layers': 4, 'embedding_dim': 128, 'lr': 0.016540209207169757, 'lambda_val': 0.0297587632074598, 'batch_size': 2712, 'optimizer': 'Adam'}.
2026-05-24 13:47:20,019 - experiment_functions - INFO - Early stopping at epoch 500. Best Metrics: (0.005627940887986078, 0.004246688741721854, 0.005435748532592629)
2026-05-24 13:47:20,128 - optuna.study.study - INFO - Trial 29 finished with values: [0.005627940887986078, 0.004246688741721854, 0.005435748532592629] and parameters: {'n_layers': 4, 'embedding_dim': 96, 'lr': 0.028193399906709604, 'lambda_val': 0.030360838038411074, 'batch_size': 1652, 'optimizer': 'SGD'}.
2026-05-24 13:47:27,916 - experiment_functions - INFO - Early stopping at epoch 500. Best Metrics: (0.0052180810252832445, 0.004793046357615895, 0.005788587471435404)
2026-05-24 13:47:28,001 - optuna.study.study - INFO - Trial 30 finished with values: [0.0052180810252832445, 0.004793046357615895, 0.005788587471435404] and parameters: {'n_layers': 3, 'embedding_dim': 256, 'lr': 2.645288433852413e-05, 'lambda_val': 7.985064351552862e-06, 'batch_size': 1168, 'optimizer': 'SGD'}.
2026-05-24 13:47:35,317 - experiment_functions - INFO - Early stopping at epoch 500. Best Metrics: (0.005103293057528288, 0.0043708609271523174, 0.0053125724525972)
2026-05-24 13:47:35,410 - optuna.study.study - INFO - Trial 31 finished with values: [0.005103293057528288, 0.0043708609271523174, 0.0053125724525972] and parameters: {'n_layers': 2, 'embedding_dim': 256, 'lr': 0.004728717753730231, 'lambda_val': 2.014778788004412e-05, 'batch_size': 3362, 'optimizer': 'SGD'}.
2026-05-24 13:47:41,527 - experiment_functions - INFO - Early stopping at epoch 500. Best Metrics: (0.005508406770244305, 0.004089403973509934, 0.005105506248213214)
2026-05-24 13:47:41,972 - optuna.study.study - INFO - Trial 32 finished with values: [0.005508406770244305, 0.004089403973509934, 0.005105506248213214] and parameters: {'n_layers': 1, 'embedding_dim': 64, 'lr': 0.0004854991873619605, 'lambda_val': 0.006400989642056249, 'batch_size': 1302, 'optimizer': 'SGD'}.
2026-05-24 13:47:47,888 - experiment_functions - INFO - Early stopping at epoch 500. Best Metrics: (0.004989837233873335, 0.003998344370860928, 0.005184928738749909)
2026-05-24 13:47:48,280 - optuna.study.study - INFO - Trial 33 finished with values: [0.004989837233873335, 0.003998344370860928, 0.005184928738749909] and parameters: {'n_layers': 1, 'embedding_dim': 64, 'lr': 5.3024898919725195e-05, 'lambda_val': 0.005743756874727113, 'batch_size': 3266, 'optimizer': 'Adam'}.
2026-05-24 13:47:57,084 - experiment_functions - INFO - Early stopping at epoch 500. Best Metrics: (0.018909457034669286, 0.013658940397350994, 0.019697297018952856)
2026-05-24 13:47:57,286 - optuna.study.study - INFO - Trial 34 finished with values: [0.018909457034669286, 0.013658940397350994, 0.019697297018952856] and parameters: {'n_layers': 4, 'embedding_dim': 256, 'lr': 0.06715639056660243, 'lambda_val': 0.0001888504583139906, 'batch_size': 2145, 'optimizer': 'RMSprop'}.
2026-05-24 13:48:08,817 - experiment_functions - INFO - Early stopping at epoch 500. Best Metrics: (0.004508846482467326, 0.004155629139072848, 0.005132251635017535)
2026-05-24 13:48:09,074 - optuna.study.study - INFO - Trial 35 finished with values: [0.004508846482467326, 0.004155629139072848, 0.005132251635017535] and parameters: {'n_layers': 4, 'embedding_dim': 32, 'lr': 1.5253581088282011e-05, 'lambda_val': 0.008545597759073598, 'batch_size': 2042, 'optimizer': 'SGD'}.
2026-05-24 13:48:17,617 - experiment_functions - INFO - Early stopping at epoch 700. Best Metrics: (0.02653340492989668, 0.020637417218543046, 0.025958779290150828)
2026-05-24 13:48:17,710 - optuna.study.study - INFO - Trial 36 finished with values: [0.02653340492989668, 0.020637417218543046, 0.025958779290150828] and parameters: {'n_layers': 3, 'embedding_dim': 32, 'lr': 0.0009826899643508387, 'lambda_val': 0.03939417378241408, 'batch_size': 2103, 'optimizer': 'Adam'}.
2026-05-24 13:48:37,060 - experiment_functions - INFO - Early stopping at epoch 1500. Best Metrics: (0.005913203287190481, 0.004387417218543047, 0.005400858757723195)
2026-05-24 13:48:37,162 - optuna.study.study - INFO - Trial 37 finished with values: [0.005913203287190481, 0.004387417218543047, 0.005400858757723195] and parameters: {'n_layers': 2, 'embedding_dim': 256, 'lr': 1.0095952585370536e-05, 'lambda_val': 0.0001625918875278769, 'batch_size': 1034, 'optimizer': 'Adam'}.
2026-05-24 13:48:54,680 - experiment_functions - INFO - Early stopping at epoch 1400. Best Metrics: (0.012716363090956613, 0.008559602649006622, 0.011322659100318338)
2026-05-24 13:48:54,810 - optuna.study.study - INFO - Trial 38 finished with values: [0.012716363090956613, 0.008559602649006622, 0.011322659100318338] and parameters: {'n_layers': 4, 'embedding_dim': 96, 'lr': 0.058586717719790266, 'lambda_val': 6.938379219467281e-05, 'batch_size': 530, 'optimizer': 'Adam'}.
2026-05-24 13:49:17,704 - experiment_functions - INFO - Early stopping at epoch 1850. Best Metrics: (0.05224512904853025, 0.030182119205298015, 0.048358577011552745)
2026-05-24 13:49:17,796 - optuna.study.study - INFO - Trial 39 finished with values: [0.05224512904853025, 0.030182119205298015, 0.048358577011552745] and parameters: {'n_layers': 4, 'embedding_dim': 64, 'lr': 0.0002249192915429732, 'lambda_val': 0.0009801820764399163, 'batch_size': 968, 'optimizer': 'RMSprop'}.
2026-05-24 13:49:24,884 - experiment_functions - INFO - Early stopping at epoch 550. Best Metrics: (0.05248216812670972, 0.032259933774834444, 0.04616332362652657)
2026-05-24 13:49:25,010 - optuna.study.study - INFO - Trial 40 finished with values: [0.05248216812670972, 0.032259933774834444, 0.04616332362652657] and parameters: {'n_layers': 1, 'embedding_dim': 96, 'lr': 0.01245800478955897, 'lambda_val': 2.6431113659875313e-06, 'batch_size': 1236, 'optimizer': 'Adam'}.
2026-05-24 13:49:32,369 - experiment_functions - INFO - Early stopping at epoch 600. Best Metrics: (0.0055018108350278596, 0.004271523178807948, 0.00534259312930614)
