2026-05-23 20:58:03,122 - optuna.study.study - INFO - Trial 144 finished with values: [0.04477010879119818, 0.024842715231788076, 0.03974010998219338] and parameters: {'n_layers': 2, 'embedding_dim': 256, 'lr': 0.04930290302923258, 'lambda_val': 0.00033225177792127876, 'batch_size': 3855, 'optimizer': 'Adam'}.
2026-05-23 20:58:32,680 - experiment_functions - INFO - Early stopping at epoch 2350. Best Metrics: (0.030245025489142388, 0.01644039735099338, 0.024602916772842556)
2026-05-23 20:58:33,766 - optuna.study.study - INFO - Trial 145 finished with values: [0.030245025489142388, 0.01644039735099338, 0.024602916772842556] and parameters: {'n_layers': 2, 'embedding_dim': 32, 'lr': 0.04123658475452258, 'lambda_val': 2.164593457002043e-06, 'batch_size': 1635, 'optimizer': 'Adam'}.
2026-05-23 20:58:56,177 - experiment_functions - INFO - Early stopping at epoch 1100. Best Metrics: (0.067387679792441, 0.05216887417218544, 0.06874092446950048)
2026-05-23 20:58:56,256 - optuna.study.study - INFO - Trial 146 finished with values: [0.067387679792441, 0.05216887417218544, 0.06874092446950048] and parameters: {'n_layers': 2, 'embedding_dim': 256, 'lr': 0.00045141578622738895, 'lambda_val': 0.0007535837355673727, 'batch_size': 886, 'optimizer': 'Adam'}.
2026-05-23 20:59:04,131 - experiment_functions - INFO - Early stopping at epoch 550. Best Metrics: (0.06561015489928333, 0.0483112582781457, 0.06738251440177484)
2026-05-23 20:59:04,269 - optuna.study.study - INFO - Trial 147 finished with values: [0.06561015489928333, 0.0483112582781457, 0.06738251440177484] and parameters: {'n_layers': 1, 'embedding_dim': 64, 'lr': 0.010318055219137296, 'lambda_val': 1.475751878769183e-05, 'batch_size': 886, 'optimizer': 'Adam'}.
2026-05-23 20:59:27,778 - experiment_functions - INFO - Early stopping at epoch 1800. Best Metrics: (0.03949196125823006, 0.022880794701986753, 0.03381920332681104)
2026-05-23 20:59:27,943 - optuna.study.study - INFO - Trial 148 finished with values: [0.03949196125823006, 0.022880794701986753, 0.03381920332681104] and parameters: {'n_layers': 2, 'embedding_dim': 32, 'lr': 0.015671226158777793, 'lambda_val': 2.389568370721752e-06, 'batch_size': 3855, 'optimizer': 'Adam'}.
2026-05-23 20:59:47,487 - experiment_functions - INFO - Early stopping at epoch 1000. Best Metrics: (0.011829413640289407, 0.014528145695364238, 0.016159257216279744)
2026-05-23 20:59:47,632 - optuna.study.study - INFO - Trial 149 finished with values: [0.011829413640289407, 0.014528145695364238, 0.016159257216279744] and parameters: {'n_layers': 2, 'embedding_dim': 256, 'lr': 0.004957869024682947, 'lambda_val': 0.05906281318798507, 'batch_size': 4056, 'optimizer': 'RMSprop'}.
2026-05-23 20:59:57,914 - experiment_functions - INFO - Early stopping at epoch 600. Best Metrics: (0.07196072319985515, 0.051953642384105964, 0.0721190047776619)
2026-05-23 20:59:58,127 - optuna.study.study - INFO - Trial 150 finished with values: [0.07196072319985515, 0.051953642384105964, 0.0721190047776619] and parameters: {'n_layers': 1, 'embedding_dim': 256, 'lr': 0.004031587731005074, 'lambda_val': 0.0007535837355673727, 'batch_size': 886, 'optimizer': 'Adam'}.
2026-05-23 21:00:05,148 - experiment_functions - INFO - Early stopping at epoch 500. Best Metrics: (0.005357139464782798, 0.004445364238410596, 0.0056152838874623905)
2026-05-23 21:00:05,260 - optuna.study.study - INFO - Trial 151 finished with values: [0.005357139464782798, 0.004445364238410596, 0.0056152838874623905] and parameters: {'n_layers': 1, 'embedding_dim': 96, 'lr': 0.0006825513923366329, 'lambda_val': 0.0068325191706043835, 'batch_size': 2875, 'optimizer': 'SGD'}.
2026-05-23 21:01:15,154 - experiment_functions - INFO - Early stopping at epoch 3550. Best Metrics: (0.08017778268002586, 0.05756622516556292, 0.08171358136656069)
2026-05-23 21:01:15,252 - optuna.study.study - INFO - Trial 152 finished with values: [0.08017778268002586, 0.05756622516556292, 0.08171358136656069] and parameters: {'n_layers': 2, 'embedding_dim': 256, 'lr': 0.00024071591856709453, 'lambda_val': 2.2621228626504235e-06, 'batch_size': 886, 'optimizer': 'Adam'}.
2026-05-23 21:01:36,784 - experiment_functions - INFO - Early stopping at epoch 1050. Best Metrics: (0.058305856993891195, 0.045629139072847685, 0.061556372978661525)
2026-05-23 21:01:36,885 - optuna.study.study - INFO - Trial 153 finished with values: [0.058305856993891195, 0.045629139072847685, 0.061556372978661525] and parameters: {'n_layers': 2, 'embedding_dim': 256, 'lr': 0.0003263341791003019, 'lambda_val': 0.00020272782422991494, 'batch_size': 2638, 'optimizer': 'Adam'}.
2026-05-23 21:01:44,571 - experiment_functions - INFO - Early stopping at epoch 550. Best Metrics: (0.06913462403637964, 0.051076158940397354, 0.06950135779424584)
2026-05-23 21:01:44,687 - optuna.study.study - INFO - Trial 154 finished with values: [0.06913462403637964, 0.051076158940397354, 0.06950135779424584] and parameters: {'n_layers': 1, 'embedding_dim': 32, 'lr': 0.008795634295118489, 'lambda_val': 0.00020136097974536503, 'batch_size': 1668, 'optimizer': 'Adam'}.
2026-05-23 21:02:05,299 - experiment_functions - INFO - Early stopping at epoch 1250. Best Metrics: (0.024268331418812215, 0.025612582781456956, 0.030680635782289856)
2026-05-23 21:02:06,260 - optuna.study.study - INFO - Trial 155 finished with values: [0.024268331418812215, 0.025612582781456956, 0.030680635782289856] and parameters: {'n_layers': 4, 'embedding_dim': 64, 'lr': 0.00045141578622738895, 'lambda_val': 0.054032803908008006, 'batch_size': 886, 'optimizer': 'Adam'}.
2026-05-23 21:02:16,305 - experiment_functions - INFO - Early stopping at epoch 700. Best Metrics: (0.06971590083296017, 0.05514900662251656, 0.07222441980683351)
2026-05-23 21:02:16,416 - optuna.study.study - INFO - Trial 156 finished with values: [0.06971590083296017, 0.05514900662251656, 0.07222441980683351] and parameters: {'n_layers': 1, 'embedding_dim': 96, 'lr': 0.0013428865841300548, 'lambda_val': 0.009665452999254663, 'batch_size': 3999, 'optimizer': 'Adam'}.
2026-05-23 21:03:10,958 - optuna.study.study - INFO - Trial 157 finished with values: [0.035737616541103766, 0.020728476821192054, 0.029548735926192254] and parameters: {'n_layers': 2, 'embedding_dim': 64, 'lr': 0.030208268234162106, 'lambda_val': 7.680348485344837e-05, 'batch_size': 564, 'optimizer': 'Adam'}.
2026-05-23 21:03:23,746 - experiment_functions - INFO - Early stopping at epoch 750. Best Metrics: (0.07392797163960894, 0.05519867549668875, 0.07669969118460276)
2026-05-23 21:03:23,840 - optuna.study.study - INFO - Trial 158 finished with values: [0.07392797163960894, 0.05519867549668875, 0.07669969118460276] and parameters: {'n_layers': 1, 'embedding_dim': 256, 'lr': 0.0017544079546559647, 'lambda_val': 0.0006933074309064735, 'batch_size': 667, 'optimizer': 'Adam'}.
2026-05-23 21:04:02,188 - experiment_functions - INFO - Early stopping at epoch 2400. Best Metrics: (0.04301464724159187, 0.02750827814569536, 0.03988349756735875)
2026-05-23 21:04:02,283 - optuna.study.study - INFO - Trial 159 finished with values: [0.04301464724159187, 0.02750827814569536, 0.03988349756735875] and parameters: {'n_layers': 2, 'embedding_dim': 128, 'lr': 0.007131304194051908, 'lambda_val': 0.001076113642302791, 'batch_size': 3432, 'optimizer': 'Adam'}.
2026-05-23 21:04:12,417 - experiment_functions - INFO - Early stopping at epoch 700. Best Metrics: (0.07803253379037649, 0.05798841059602649, 0.07892996691779744)
2026-05-23 21:04:12,562 - optuna.study.study - INFO - Trial 160 finished with values: [0.07803253379037649, 0.05798841059602649, 0.07892996691779744] and parameters: {'n_layers': 1, 'embedding_dim': 96, 'lr': 0.001325452189730596, 'lambda_val': 0.0053912262075664795, 'batch_size': 2875, 'optimizer': 'Adam'}.
2026-05-23 21:04:20,921 - experiment_functions - INFO - Early stopping at epoch 500. Best Metrics: (0.0055734588295721504, 0.004627483443708609, 0.00588103051154491)
2026-05-23 21:04:21,017 - optuna.study.study - INFO - Trial 161 finished with values: [0.0055734588295721504, 0.004627483443708609, 0.00588103051154491] and parameters: {'n_layers': 1, 'embedding_dim': 256, 'lr': 1.2020023798871341e-05, 'lambda_val': 0.0007535837355673727, 'batch_size': 2902, 'optimizer': 'SGD'}.
2026-05-23 21:04:32,190 - experiment_functions - INFO - Early stopping at epoch 700. Best Metrics: (0.04643875252484731, 0.03998344370860927, 0.04945663551407794)
2026-05-23 21:04:32,287 - optuna.study.study - INFO - Trial 162 finished with values: [0.04643875252484731, 0.03998344370860927, 0.04945663551407794] and parameters: {'n_layers': 2, 'embedding_dim': 96, 'lr': 0.0007928857958215832, 'lambda_val': 0.03042050846515162, 'batch_size': 3894, 'optimizer': 'Adam'}.
2026-05-23 21:04:40,133 - experiment_functions - INFO - Early stopping at epoch 500. Best Metrics: (0.004350221550687362, 0.003948675496688742, 0.004722585524365581)
2026-05-23 21:04:40,227 - optuna.study.study - INFO - Trial 163 finished with values: [0.004350221550687362, 0.003948675496688742, 0.004722585524365581] and parameters: {'n_layers': 2, 'embedding_dim': 96, 'lr': 0.0001722725114045167, 'lambda_val': 0.0068325191706043835, 'batch_size': 1353, 'optimizer': 'SGD'}.
2026-05-23 21:05:44,876 - optuna.study.study - INFO - Trial 164 finished with values: [0.0650193129396202, 0.04242549668874172, 0.06352453323051145] and parameters: {'n_layers': 1, 'embedding_dim': 256, 'lr': 0.004031587731005074, 'lambda_val': 0.00020136097974536503, 'batch_size': 2902, 'optimizer': 'RMSprop'}.
2026-05-23 21:05:52,766 - experiment_functions - INFO - Early stopping at epoch 550. Best Metrics: (0.04258545819647896, 0.037682119205298015, 0.0493676632966029)
2026-05-23 21:05:52,860 - optuna.study.study - INFO - Trial 165 finished with values: [0.04258545819647896, 0.037682119205298015, 0.0493676632966029] and parameters: {'n_layers': 1, 'embedding_dim': 64, 'lr': 0.010318055219137296, 'lambda_val': 0.006308703493993002, 'batch_size': 2383, 'optimizer': 'Adam'}.
2026-05-23 21:06:01,627 - experiment_functions - INFO - Early stopping at epoch 600. Best Metrics: (0.046523120000270625, 0.036829470198675496, 0.04865194023838615)
2026-05-23 21:06:01,729 - optuna.study.study - INFO - Trial 166 finished with values: [0.046523120000270625, 0.036829470198675496, 0.04865194023838615] and parameters: {'n_layers': 2, 'embedding_dim': 32, 'lr': 0.0010894266724873914, 'lambda_val': 0.00020272782422991494, 'batch_size': 3780, 'optimizer': 'RMSprop'}.
2026-05-23 21:06:31,539 - experiment_functions - INFO - Early stopping at epoch 1850. Best Metrics: (0.07586408091486206, 0.05729304635761589, 0.0800590119680624)
2026-05-23 21:06:32,176 - optuna.study.study - INFO - Trial 167 finished with values: [0.07586408091486206, 0.05729304635761589, 0.0800590119680624] and parameters: {'n_layers': 1, 'embedding_dim': 256, 'lr': 0.00045141578622738895, 'lambda_val': 2.2621228626504235e-06, 'batch_size': 1499, 'optimizer': 'Adam'}.
2026-05-23 21:06:41,943 - experiment_functions - INFO - Early stopping at epoch 550. Best Metrics: (0.057437796673078016, 0.04595198675496689, 0.05936467799687155)
2026-05-23 21:06:42,048 - optuna.study.study - INFO - Trial 168 finished with values: [0.057437796673078016, 0.04595198675496689, 0.05936467799687155] and parameters: {'n_layers': 1, 'embedding_dim': 256, 'lr': 0.001574943077623047, 'lambda_val': 0.0007535837355673727, 'batch_size': 3432, 'optimizer': 'RMSprop'}.
2026-05-23 21:06:54,724 - experiment_functions - INFO - Early stopping at epoch 750. Best Metrics: (0.07218297975833524, 0.05216887417218544, 0.07284539342985367)
2026-05-23 21:06:54,869 - optuna.study.study - INFO - Trial 169 finished with values: [0.07218297975833524, 0.05216887417218544, 0.07284539342985367] and parameters: {'n_layers': 1, 'embedding_dim': 256, 'lr': 0.0017544079546559647, 'lambda_val': 2.2306594222778702e-05, 'batch_size': 576, 'optimizer': 'Adam'}.
2026-05-23 21:07:10,999 - experiment_functions - INFO - Early stopping at epoch 950. Best Metrics: (0.07898599678639286, 0.057756622516556284, 0.08201779990324126)
2026-05-23 21:07:11,618 - optuna.study.study - INFO - Trial 170 finished with values: [0.07898599678639286, 0.057756622516556284, 0.08201779990324126] and parameters: {'n_layers': 1, 'embedding_dim': 256, 'lr': 0.0006825513923366329, 'lambda_val': 1.207883913872658e-06, 'batch_size': 2902, 'optimizer': 'Adam'}.
2026-05-23 21:07:24,203 - experiment_functions - INFO - Early stopping at epoch 950. Best Metrics: (0.0671531320100716, 0.0529387417218543, 0.072509828298696)
2026-05-23 21:07:24,346 - optuna.study.study - INFO - Trial 171 finished with values: [0.0671531320100716, 0.0529387417218543, 0.072509828298696] and parameters: {'n_layers': 1, 'embedding_dim': 32, 'lr': 0.0007928857958215832, 'lambda_val': 0.0006933074309064735, 'batch_size': 3999, 'optimizer': 'Adam'}.
2026-05-23 21:07:32,880 - experiment_functions - INFO - Early stopping at epoch 500. Best Metrics: (0.004955677789428624, 0.00445364238410596, 0.0052618966003901944)
2026-05-23 21:07:32,998 - optuna.study.study - INFO - Trial 172 finished with values: [0.004955677789428624, 0.00445364238410596, 0.0052618966003901944] and parameters: {'n_layers': 1, 'embedding_dim': 256, 'lr': 1.6966124543813962e-05, 'lambda_val': 0.0014579384886447386, 'batch_size': 2902, 'optimizer': 'SGD'}.
2026-05-23 21:07:41,409 - experiment_functions - INFO - Early stopping at epoch 500. Best Metrics: (0.004766186498177428, 0.004552980132450331, 0.005414381202612339)
2026-05-23 21:07:41,513 - optuna.study.study - INFO - Trial 173 finished with values: [0.004766186498177428, 0.004552980132450331, 0.005414381202612339] and parameters: {'n_layers': 1, 'embedding_dim': 256, 'lr': 0.004031587731005074, 'lambda_val': 0.00020136097974536503, 'batch_size': 886, 'optimizer': 'SGD'}.
2026-05-23 21:07:56,677 - experiment_functions - INFO - Early stopping at epoch 900. Best Metrics: (0.07078246090470783, 0.05478476821192053, 0.07417087618427108)
2026-05-23 21:07:57,235 - optuna.study.study - INFO - Trial 174 finished with values: [0.07078246090470783, 0.05478476821192053, 0.07417087618427108] and parameters: {'n_layers': 1, 'embedding_dim': 256, 'lr': 0.0006825513923366329, 'lambda_val': 0.002166338135936516, 'batch_size': 2902, 'optimizer': 'Adam'}.
2026-05-23 21:08:46,079 - experiment_functions - INFO - Early stopping at epoch 3600. Best Metrics: (0.08414500540064787, 0.06154801324503311, 0.08741463321647404)
2026-05-23 21:08:46,183 - optuna.study.study - INFO - Trial 175 finished with values: [0.08414500540064787, 0.06154801324503311, 0.08741463321647404] and parameters: {'n_layers': 1, 'embedding_dim': 96, 'lr': 0.00045141578622738895, 'lambda_val': 0.0007535837355673727, 'batch_size': 1491, 'optimizer': 'Adam'}.
2026-05-23 21:09:53,041 - experiment_functions - INFO - Early stopping at epoch 2900. Best Metrics: (0.036150844997895386, 0.025538079470198677, 0.03622755606176196)
2026-05-23 21:09:53,139 - optuna.study.study - INFO - Trial 176 finished with values: [0.036150844997895386, 0.025538079470198677, 0.03622755606176196] and parameters: {'n_layers': 3, 'embedding_dim': 256, 'lr': 0.007474732556550881, 'lambda_val': 0.0011279556330319215, 'batch_size': 1883, 'optimizer': 'RMSprop'}.
2026-05-23 21:10:16,952 - experiment_functions - INFO - Early stopping at epoch 1900. Best Metrics: (0.08197051613471772, 0.060264900662251666, 0.08389897901639141)
2026-05-23 21:10:17,335 - optuna.study.study - INFO - Trial 177 finished with values: [0.08197051613471772, 0.060264900662251666, 0.08389897901639141] and parameters: {'n_layers': 1, 'embedding_dim': 32, 'lr': 0.0008759611298328556, 'lambda_val': 0.0007535837355673727, 'batch_size': 833, 'optimizer': 'Adam'}.
2026-05-23 21:10:25,478 - experiment_functions - INFO - Early stopping at epoch 600. Best Metrics: (0.005075708542092653, 0.004271523178807948, 0.00498443204011032)
2026-05-23 21:10:25,573 - optuna.study.study - INFO - Trial 178 finished with values: [0.005075708542092653, 0.004271523178807948, 0.00498443204011032] and parameters: {'n_layers': 1, 'embedding_dim': 96, 'lr': 0.002862485482221214, 'lambda_val': 0.0003736819194527878, 'batch_size': 576, 'optimizer': 'SGD'}.
2026-05-23 21:10:34,763 - experiment_functions - INFO - Early stopping at epoch 600. Best Metrics: (0.07263564672143161, 0.055, 0.0747672803250112)
2026-05-23 21:10:34,861 - optuna.study.study - INFO - Trial 179 finished with values: [0.07263564672143161, 0.055, 0.0747672803250112] and parameters: {'n_layers': 1, 'embedding_dim': 128, 'lr': 0.003587231355069314, 'lambda_val': 0.00020136097974536503, 'batch_size': 3432, 'optimizer': 'Adam'}.
2026-05-23 21:11:35,934 - experiment_functions - INFO - Early stopping at epoch 3900. Best Metrics: (0.0842993803702772, 0.06278145695364239, 0.08705742789104631)
2026-05-23 21:11:36,137 - optuna.study.study - INFO - Trial 180 finished with values: [0.0842993803702772, 0.06278145695364239, 0.08705742789104631] and parameters: {'n_layers': 1, 'embedding_dim': 256, 'lr': 0.00045141578622738895, 'lambda_val': 0.0007535837355673727, 'batch_size': 886, 'optimizer': 'Adam'}.
2026-05-23 21:11:46,252 - experiment_functions - INFO - Early stopping at epoch 750. Best Metrics: (0.08368151941378704, 0.05999172185430464, 0.08445459221038909)
2026-05-23 21:11:46,682 - optuna.study.study - INFO - Trial 181 finished with values: [0.08368151941378704, 0.05999172185430464, 0.08445459221038909] and parameters: {'n_layers': 1, 'embedding_dim': 32, 'lr': 0.001325452189730596, 'lambda_val': 0.0053912262075664795, 'batch_size': 2875, 'optimizer': 'Adam'}.
2026-05-23 21:12:06,612 - experiment_functions - INFO - Early stopping at epoch 1000. Best Metrics: (0.05687870897174722, 0.04674668874172186, 0.061057722231579584)
2026-05-23 21:12:06,732 - optuna.study.study - INFO - Trial 182 finished with values: [0.05687870897174722, 0.04674668874172186, 0.061057722231579584] and parameters: {'n_layers': 2, 'embedding_dim': 256, 'lr': 0.00045141578622738895, 'lambda_val': 0.021280702149204887, 'batch_size': 886, 'optimizer': 'Adam'}.
2026-05-23 21:12:15,252 - experiment_functions - INFO - Early stopping at epoch 550. Best Metrics: (0.08257739262875097, 0.059652317880794704, 0.08322573724758395)
2026-05-23 21:12:15,756 - optuna.study.study - INFO - Trial 183 finished with values: [0.08257739262875097, 0.059652317880794704, 0.08322573724758395] and parameters: {'n_layers': 1, 'embedding_dim': 128, 'lr': 0.007131304194051908, 'lambda_val': 0.001076113642302791, 'batch_size': 3432, 'optimizer': 'Adam'}.
2026-05-23 21:12:23,728 - experiment_functions - INFO - Early stopping at epoch 550. Best Metrics: (0.0801293034517166, 0.0551158940397351, 0.08044325866012685)
2026-05-23 21:12:23,868 - optuna.study.study - INFO - Trial 184 finished with values: [0.0801293034517166, 0.0551158940397351, 0.08044325866012685] and parameters: {'n_layers': 1, 'embedding_dim': 64, 'lr': 0.007131304194051908, 'lambda_val': 0.001076113642302791, 'batch_size': 2754, 'optimizer': 'Adam'}.
2026-05-23 21:12:46,900 - experiment_functions - INFO - Early stopping at epoch 1650. Best Metrics: (0.08361279308925909, 0.06182119205298014, 0.08669224879544708)
2026-05-23 21:12:46,994 - optuna.study.study - INFO - Trial 185 finished with values: [0.08361279308925909, 0.06182119205298014, 0.08669224879544708] and parameters: {'n_layers': 1, 'embedding_dim': 128, 'lr': 0.0007928857958215832, 'lambda_val': 1.207883913872658e-06, 'batch_size': 576, 'optimizer': 'Adam'}.
2026-05-23 21:12:55,522 - experiment_functions - INFO - Early stopping at epoch 550. Best Metrics: (0.049296361319522065, 0.037864238410596024, 0.052319615420556666)
2026-05-23 21:12:55,619 - optuna.study.study - INFO - Trial 186 finished with values: [0.049296361319522065, 0.037864238410596024, 0.052319615420556666] and parameters: {'n_layers': 2, 'embedding_dim': 64, 'lr': 0.00297054913770236, 'lambda_val': 0.00023118686222677935, 'batch_size': 3148, 'optimizer': 'Adam'}.
2026-05-23 21:13:04,235 - experiment_functions - INFO - Early stopping at epoch 600. Best Metrics: (0.06310989512314578, 0.048352649006622526, 0.06310410790629395)
2026-05-23 21:13:05,487 - optuna.study.study - INFO - Trial 187 finished with values: [0.06310989512314578, 0.048352649006622526, 0.06310410790629395] and parameters: {'n_layers': 2, 'embedding_dim': 32, 'lr': 0.004031587731005074, 'lambda_val': 0.00020136097974536503, 'batch_size': 833, 'optimizer': 'Adam'}.
2026-05-23 21:13:17,911 - experiment_functions - INFO - Early stopping at epoch 600. Best Metrics: (0.046535472960716695, 0.03950331125827815, 0.04988906770094472)
2026-05-23 21:13:18,025 - optuna.study.study - INFO - Trial 188 finished with values: [0.046535472960716695, 0.03950331125827815, 0.04988906770094472] and parameters: {'n_layers': 2, 'embedding_dim': 256, 'lr': 0.0017544079546559647, 'lambda_val': 0.001076113642302791, 'batch_size': 3374, 'optimizer': 'Adam'}.
2026-05-23 21:13:27,571 - experiment_functions - INFO - Early stopping at epoch 550. Best Metrics: (0.03963218678241554, 0.0334023178807947, 0.04179456248919838)
2026-05-23 21:13:27,679 - optuna.study.study - INFO - Trial 189 finished with values: [0.03963218678241554, 0.0334023178807947, 0.04179456248919838] and parameters: {'n_layers': 1, 'embedding_dim': 256, 'lr': 0.010318055219137296, 'lambda_val': 3.542433455090824e-06, 'batch_size': 886, 'optimizer': 'Adam'}.
2026-05-23 21:13:38,605 - experiment_functions - INFO - Early stopping at epoch 800. Best Metrics: (0.08379098205969877, 0.061374172185430474, 0.08448871923264945)
