2026-05-24 01:03:31,924 - optuna.study.study - INFO - Trial 255 finished with values: [0.02312265357982474, 0.018725165562913905, 0.024517835798097392] and parameters: {'n_layers': 3, 'embedding_dim': 32, 'lr': 0.00037394670395286464, 'lambda_val': 0.04990172064077824, 'batch_size': 1672, 'optimizer': 'Adam'}.
2026-05-24 01:03:44,107 - experiment_functions - INFO - Early stopping at epoch 1100. Best Metrics: (0.024250931608120814, 0.019751655629139074, 0.025047527579549072)
2026-05-24 01:03:44,202 - optuna.study.study - INFO - Trial 256 finished with values: [0.024250931608120814, 0.019751655629139074, 0.025047527579549072] and parameters: {'n_layers': 3, 'embedding_dim': 32, 'lr': 0.0005555935556782479, 'lambda_val': 0.04990172064077824, 'batch_size': 947, 'optimizer': 'RMSprop'}.
2026-05-24 01:03:52,037 - experiment_functions - INFO - Early stopping at epoch 650. Best Metrics: (0.023384123298501813, 0.018286423841059603, 0.023704767623800443)
2026-05-24 01:03:52,186 - optuna.study.study - INFO - Trial 257 finished with values: [0.023384123298501813, 0.018286423841059603, 0.023704767623800443] and parameters: {'n_layers': 4, 'embedding_dim': 32, 'lr': 0.0010358017727309806, 'lambda_val': 0.014393132529370842, 'batch_size': 1433, 'optimizer': 'RMSprop'}.
2026-05-24 01:04:04,507 - experiment_functions - INFO - Early stopping at epoch 1050. Best Metrics: (0.019049555590077635, 0.016134105960264905, 0.020710813500333977)
2026-05-24 01:04:04,650 - optuna.study.study - INFO - Trial 258 finished with values: [0.019049555590077635, 0.016134105960264905, 0.020710813500333977] and parameters: {'n_layers': 4, 'embedding_dim': 96, 'lr': 0.00036341523831303154, 'lambda_val': 0.0019340508111572378, 'batch_size': 2304, 'optimizer': 'RMSprop'}.
2026-05-24 01:04:19,685 - experiment_functions - INFO - Early stopping at epoch 1350. Best Metrics: (0.02548969177192918, 0.01970198675496689, 0.027111057980132344)
2026-05-24 01:04:19,885 - optuna.study.study - INFO - Trial 259 finished with values: [0.02548969177192918, 0.01970198675496689, 0.027111057980132344] and parameters: {'n_layers': 3, 'embedding_dim': 32, 'lr': 0.0005555935556782479, 'lambda_val': 0.014393132529370842, 'batch_size': 648, 'optimizer': 'RMSprop'}.
2026-05-24 01:04:43,482 - experiment_functions - INFO - Early stopping at epoch 2150. Best Metrics: (0.02454170787465846, 0.019370860927152317, 0.026372859834574647)
2026-05-24 01:04:43,578 - optuna.study.study - INFO - Trial 260 finished with values: [0.02454170787465846, 0.019370860927152317, 0.026372859834574647] and parameters: {'n_layers': 4, 'embedding_dim': 64, 'lr': 0.00036341523831303154, 'lambda_val': 0.0013089325113607559, 'batch_size': 648, 'optimizer': 'RMSprop'}.
2026-05-24 01:04:52,971 - experiment_functions - INFO - Early stopping at epoch 750. Best Metrics: (0.01889401275505144, 0.015190397350993378, 0.019967832336381216)
2026-05-24 01:04:53,678 - optuna.study.study - INFO - Trial 261 finished with values: [0.01889401275505144, 0.015190397350993378, 0.019967832336381216] and parameters: {'n_layers': 4, 'embedding_dim': 32, 'lr': 0.0010358017727309806, 'lambda_val': 1.6167654416918465e-05, 'batch_size': 2478, 'optimizer': 'Adam'}.
2026-05-24 01:05:05,347 - experiment_functions - INFO - Early stopping at epoch 900. Best Metrics: (0.016536367994235412, 0.014552980132450332, 0.01715265955561926)
2026-05-24 01:05:05,701 - optuna.study.study - INFO - Trial 262 finished with values: [0.016536367994235412, 0.014552980132450332, 0.01715265955561926] and parameters: {'n_layers': 4, 'embedding_dim': 256, 'lr': 0.00037394670395286464, 'lambda_val': 0.014393132529370842, 'batch_size': 2478, 'optimizer': 'Adam'}.
2026-05-24 01:05:19,745 - experiment_functions - INFO - Early stopping at epoch 1300. Best Metrics: (0.019687245527772533, 0.016258278145695363, 0.02119697100449723)
2026-05-24 01:05:19,816 - optuna.study.study - INFO - Trial 263 finished with values: [0.019687245527772533, 0.016258278145695363, 0.02119697100449723] and parameters: {'n_layers': 3, 'embedding_dim': 32, 'lr': 0.0005555935556782479, 'lambda_val': 0.04990172064077824, 'batch_size': 947, 'optimizer': 'Adam'}.
2026-05-24 01:05:39,667 - experiment_functions - INFO - Early stopping at epoch 1800. Best Metrics: (0.01998924097404802, 0.015852649006622515, 0.021318048442890383)
2026-05-24 01:05:40,151 - optuna.study.study - INFO - Trial 264 finished with values: [0.01998924097404802, 0.015852649006622515, 0.021318048442890383] and parameters: {'n_layers': 3, 'embedding_dim': 96, 'lr': 0.00036341523831303154, 'lambda_val': 0.0042666561549426635, 'batch_size': 900, 'optimizer': 'Adam'}.
2026-05-24 01:05:47,383 - experiment_functions - INFO - Early stopping at epoch 600. Best Metrics: (0.019677373506205464, 0.01581953642384106, 0.02002245434080098)
2026-05-24 01:05:47,547 - optuna.study.study - INFO - Trial 265 finished with values: [0.019677373506205464, 0.01581953642384106, 0.02002245434080098] and parameters: {'n_layers': 3, 'embedding_dim': 32, 'lr': 0.0010358017727309806, 'lambda_val': 0.04990172064077824, 'batch_size': 3656, 'optimizer': 'RMSprop'}.
2026-05-24 01:06:01,242 - experiment_functions - INFO - Early stopping at epoch 1200. Best Metrics: (0.019387485054588094, 0.01620860927152318, 0.021325526799995415)
2026-05-24 01:06:01,651 - optuna.study.study - INFO - Trial 266 finished with values: [0.019387485054588094, 0.01620860927152318, 0.021325526799995415] and parameters: {'n_layers': 4, 'embedding_dim': 96, 'lr': 0.00036341523831303154, 'lambda_val': 0.0019340508111572378, 'batch_size': 2078, 'optimizer': 'Adam'}.
2026-05-24 01:06:26,484 - experiment_functions - INFO - Early stopping at epoch 2300. Best Metrics: (0.021691617298593945, 0.014296357615894041, 0.021203770733542286)
2026-05-24 01:06:26,948 - optuna.study.study - INFO - Trial 267 finished with values: [0.021691617298593945, 0.014296357615894041, 0.021203770733542286] and parameters: {'n_layers': 1, 'embedding_dim': 32, 'lr': 0.00037394670395286464, 'lambda_val': 0.014393132529370842, 'batch_size': 2057, 'optimizer': 'RMSprop'}.
2026-05-24 01:06:46,315 - experiment_functions - INFO - Early stopping at epoch 1600. Best Metrics: (0.018428743337805063, 0.014519867549668875, 0.01923953853499484)
2026-05-24 01:06:47,941 - optuna.study.study - INFO - Trial 268 finished with values: [0.018428743337805063, 0.014519867549668875, 0.01923953853499484] and parameters: {'n_layers': 3, 'embedding_dim': 256, 'lr': 0.0003602499380989214, 'lambda_val': 0.0021289404794494937, 'batch_size': 648, 'optimizer': 'Adam'}.
2026-05-24 01:06:54,206 - experiment_functions - INFO - Early stopping at epoch 500. Best Metrics: (0.005098805014731862, 0.004246688741721854, 0.005100109233676998)
2026-05-24 01:06:55,503 - optuna.study.study - INFO - Trial 269 finished with values: [0.005098805014731862, 0.004246688741721854, 0.005100109233676998] and parameters: {'n_layers': 2, 'embedding_dim': 32, 'lr': 0.0003602499380989214, 'lambda_val': 0.07888475942657529, 'batch_size': 947, 'optimizer': 'Adam'}.
2026-05-24 01:07:04,484 - experiment_functions - INFO - Early stopping at epoch 750. Best Metrics: (0.023656115299130864, 0.019279801324503316, 0.02497373957922511)
2026-05-24 01:07:04,623 - optuna.study.study - INFO - Trial 270 finished with values: [0.023656115299130864, 0.019279801324503316, 0.02497373957922511] and parameters: {'n_layers': 4, 'embedding_dim': 32, 'lr': 0.0010358017727309806, 'lambda_val': 0.04990172064077824, 'batch_size': 1304, 'optimizer': 'Adam'}.
2026-05-24 01:07:14,988 - experiment_functions - INFO - Early stopping at epoch 850. Best Metrics: (0.02127397715183718, 0.016564569536423844, 0.0221198739958959)
2026-05-24 01:07:15,605 - optuna.study.study - INFO - Trial 271 finished with values: [0.02127397715183718, 0.016564569536423844, 0.0221198739958959] and parameters: {'n_layers': 4, 'embedding_dim': 64, 'lr': 0.0005555935556782479, 'lambda_val': 0.0019340508111572378, 'batch_size': 1672, 'optimizer': 'RMSprop'}.
2026-05-24 01:07:28,783 - experiment_functions - INFO - Early stopping at epoch 1150. Best Metrics: (0.015543238401311969, 0.011506622516556292, 0.01588667096910924)
2026-05-24 01:07:29,459 - optuna.study.study - INFO - Trial 272 finished with values: [0.015543238401311969, 0.011506622516556292, 0.01588667096910924] and parameters: {'n_layers': 1, 'embedding_dim': 256, 'lr': 0.00037394670395286464, 'lambda_val': 0.0019340508111572378, 'batch_size': 1803, 'optimizer': 'RMSprop'}.
2026-05-24 01:07:45,737 - experiment_functions - INFO - Early stopping at epoch 1500. Best Metrics: (0.021258769808589827, 0.017566225165562915, 0.02275646563592165)
2026-05-24 01:07:47,039 - optuna.study.study - INFO - Trial 273 finished with values: [0.021258769808589827, 0.017566225165562915, 0.02275646563592165] and parameters: {'n_layers': 3, 'embedding_dim': 32, 'lr': 0.00036341523831303154, 'lambda_val': 0.04990172064077824, 'batch_size': 2057, 'optimizer': 'Adam'}.
2026-05-24 01:07:53,102 - experiment_functions - INFO - Early stopping at epoch 500. Best Metrics: (0.004486121962135912, 0.003998344370860927, 0.004899866145325907)
2026-05-24 01:07:54,545 - optuna.study.study - INFO - Trial 274 finished with values: [0.004486121962135912, 0.003998344370860927, 0.004899866145325907] and parameters: {'n_layers': 3, 'embedding_dim': 32, 'lr': 0.0003602499380989214, 'lambda_val': 0.014393132529370842, 'batch_size': 900, 'optimizer': 'SGD'}.
2026-05-24 01:08:01,355 - experiment_functions - INFO - Early stopping at epoch 550. Best Metrics: (0.0062730980498003, 0.005951986754966888, 0.007079981505838836)
2026-05-24 01:08:01,477 - optuna.study.study - INFO - Trial 275 finished with values: [0.0062730980498003, 0.005951986754966888, 0.007079981505838836] and parameters: {'n_layers': 3, 'embedding_dim': 96, 'lr': 0.030006071600470183, 'lambda_val': 0.0042666561549426635, 'batch_size': 900, 'optimizer': 'Adam'}.
2026-05-24 01:08:25,964 - experiment_functions - INFO - Early stopping at epoch 2250. Best Metrics: (0.020937836693665834, 0.017392384105960265, 0.021858730364314898)
2026-05-24 01:08:26,106 - optuna.study.study - INFO - Trial 276 finished with values: [0.020937836693665834, 0.017392384105960265, 0.021858730364314898] and parameters: {'n_layers': 4, 'embedding_dim': 32, 'lr': 0.00036341523831303154, 'lambda_val': 0.0019340508111572378, 'batch_size': 2078, 'optimizer': 'RMSprop'}.
2026-05-24 01:08:32,111 - experiment_functions - INFO - Early stopping at epoch 500. Best Metrics: (0.005059799987373623, 0.003923841059602649, 0.005090727431947069)
2026-05-24 01:08:33,170 - optuna.study.study - INFO - Trial 277 finished with values: [0.005059799987373623, 0.003923841059602649, 0.005090727431947069] and parameters: {'n_layers': 2, 'embedding_dim': 64, 'lr': 0.0005555935556782479, 'lambda_val': 0.00017939045722306605, 'batch_size': 648, 'optimizer': 'SGD'}.
2026-05-24 01:08:50,942 - experiment_functions - INFO - Early stopping at epoch 1600. Best Metrics: (0.02082017132616631, 0.016572847682119203, 0.022385028700308)
2026-05-24 01:08:51,032 - optuna.study.study - INFO - Trial 278 finished with values: [0.02082017132616631, 0.016572847682119203, 0.022385028700308] and parameters: {'n_layers': 3, 'embedding_dim': 32, 'lr': 0.00037394670395286464, 'lambda_val': 0.014393132529370842, 'batch_size': 2049, 'optimizer': 'Adam'}.
2026-05-24 01:09:08,420 - experiment_functions - INFO - Early stopping at epoch 1550. Best Metrics: (0.019280446850658505, 0.01501655629139073, 0.019681784316051908)
2026-05-24 01:09:08,827 - optuna.study.study - INFO - Trial 279 finished with values: [0.019280446850658505, 0.01501655629139073, 0.019681784316051908] and parameters: {'n_layers': 3, 'embedding_dim': 32, 'lr': 0.00037394670395286464, 'lambda_val': 0.0019340508111572378, 'batch_size': 3242, 'optimizer': 'Adam'}.
2026-05-24 01:09:14,937 - experiment_functions - INFO - Early stopping at epoch 500. Best Metrics: (0.005336554462832772, 0.00439569536423841, 0.005721435636497147)
2026-05-24 01:09:15,071 - optuna.study.study - INFO - Trial 280 finished with values: [0.005336554462832772, 0.00439569536423841, 0.005721435636497147] and parameters: {'n_layers': 4, 'embedding_dim': 32, 'lr': 0.00037394670395286464, 'lambda_val': 0.04990172064077824, 'batch_size': 648, 'optimizer': 'Adam'}.
2026-05-24 01:09:33,918 - experiment_functions - INFO - Early stopping at epoch 1700. Best Metrics: (0.021284817325545605, 0.017276490066225166, 0.022788657735785013)
2026-05-24 01:09:34,016 - optuna.study.study - INFO - Trial 281 finished with values: [0.021284817325545605, 0.017276490066225166, 0.022788657735785013] and parameters: {'n_layers': 4, 'embedding_dim': 64, 'lr': 0.00036341523831303154, 'lambda_val': 0.0009167395824715172, 'batch_size': 1113, 'optimizer': 'Adam'}.
2026-05-24 01:09:41,535 - experiment_functions - INFO - Early stopping at epoch 600. Best Metrics: (0.021731142065155296, 0.016233443708609272, 0.022260504940534165)
2026-05-24 01:09:41,630 - optuna.study.study - INFO - Trial 282 finished with values: [0.021731142065155296, 0.016233443708609272, 0.022260504940534165] and parameters: {'n_layers': 3, 'embedding_dim': 64, 'lr': 0.0014918556660024908, 'lambda_val': 0.000167373597770826, 'batch_size': 1047, 'optimizer': 'RMSprop'}.
2026-05-24 01:09:58,599 - experiment_functions - INFO - Early stopping at epoch 1400. Best Metrics: (0.016769652912215705, 0.013741721854304636, 0.017954972089786914)
2026-05-24 01:09:58,868 - optuna.study.study - INFO - Trial 283 finished with values: [0.016769652912215705, 0.013741721854304636, 0.017954972089786914] and parameters: {'n_layers': 3, 'embedding_dim': 256, 'lr': 0.00037394670395286464, 'lambda_val': 2.2612691318392443e-06, 'batch_size': 1672, 'optimizer': 'Adam'}.
2026-05-24 01:10:05,170 - experiment_functions - INFO - Early stopping at epoch 500. Best Metrics: (0.005409134157283275, 0.004743377483443709, 0.006050193572760393)
2026-05-24 01:10:05,258 - optuna.study.study - INFO - Trial 284 finished with values: [0.005409134157283275, 0.004743377483443709, 0.006050193572760393] and parameters: {'n_layers': 4, 'embedding_dim': 64, 'lr': 0.09775999237623348, 'lambda_val': 0.03897735323693457, 'batch_size': 1047, 'optimizer': 'Adam'}.
2026-05-24 01:10:19,011 - experiment_functions - INFO - Early stopping at epoch 1200. Best Metrics: (0.020651246162155603, 0.016473509933774836, 0.021030827069256883)
2026-05-24 01:10:19,127 - optuna.study.study - INFO - Trial 285 finished with values: [0.020651246162155603, 0.016473509933774836, 0.021030827069256883] and parameters: {'n_layers': 4, 'embedding_dim': 96, 'lr': 0.00036341523831303154, 'lambda_val': 1.3802629861356459e-05, 'batch_size': 2078, 'optimizer': 'RMSprop'}.
2026-05-24 01:10:27,538 - experiment_functions - INFO - Early stopping at epoch 700. Best Metrics: (0.022711456771025255, 0.016705298013245034, 0.0227228171427562)
2026-05-24 01:10:28,159 - optuna.study.study - INFO - Trial 286 finished with values: [0.022711456771025255, 0.016705298013245034, 0.0227228171427562] and parameters: {'n_layers': 3, 'embedding_dim': 32, 'lr': 0.0010358017727309806, 'lambda_val': 0.014393132529370842, 'batch_size': 1433, 'optimizer': 'RMSprop'}.
2026-05-24 01:10:35,493 - experiment_functions - INFO - Early stopping at epoch 600. Best Metrics: (0.021887183481593662, 0.01745860927152318, 0.02218701264058458)
2026-05-24 01:10:35,593 - optuna.study.study - INFO - Trial 287 finished with values: [0.021887183481593662, 0.01745860927152318, 0.02218701264058458] and parameters: {'n_layers': 4, 'embedding_dim': 32, 'lr': 0.0010358017727309806, 'lambda_val': 0.04990172064077824, 'batch_size': 1433, 'optimizer': 'RMSprop'}.
2026-05-24 01:10:49,174 - experiment_functions - INFO - Early stopping at epoch 1150. Best Metrics: (0.02328372629801539, 0.01908112582781457, 0.02412583722932103)
2026-05-24 01:10:49,642 - optuna.study.study - INFO - Trial 288 finished with values: [0.02328372629801539, 0.01908112582781457, 0.02412583722932103] and parameters: {'n_layers': 4, 'embedding_dim': 32, 'lr': 0.00037394670395286464, 'lambda_val': 0.04091562081676114, 'batch_size': 2478, 'optimizer': 'RMSprop'}.
2026-05-24 01:10:57,070 - experiment_functions - INFO - Early stopping at epoch 600. Best Metrics: (0.021029401912900283, 0.01701158940397351, 0.021175589789369686)
2026-05-24 01:10:57,226 - optuna.study.study - INFO - Trial 289 finished with values: [0.021029401912900283, 0.01701158940397351, 0.021175589789369686] and parameters: {'n_layers': 4, 'embedding_dim': 32, 'lr': 0.0010358017727309806, 'lambda_val': 0.04990172064077824, 'batch_size': 2806, 'optimizer': 'RMSprop'}.
2026-05-24 01:11:09,528 - experiment_functions - INFO - Early stopping at epoch 1050. Best Metrics: (0.02043544129978704, 0.016862582781456952, 0.021562166712985477)
2026-05-24 01:11:09,779 - optuna.study.study - INFO - Trial 290 finished with values: [0.02043544129978704, 0.016862582781456952, 0.021562166712985477] and parameters: {'n_layers': 3, 'embedding_dim': 64, 'lr': 0.0005555935556782479, 'lambda_val': 0.014393132529370842, 'batch_size': 947, 'optimizer': 'Adam'}.
2026-05-24 01:11:27,443 - experiment_functions - INFO - Early stopping at epoch 1550. Best Metrics: (0.022070221061231205, 0.01763245033112583, 0.02297149436837582)
2026-05-24 01:11:27,525 - optuna.study.study - INFO - Trial 291 finished with values: [0.022070221061231205, 0.01763245033112583, 0.02297149436837582] and parameters: {'n_layers': 4, 'embedding_dim': 64, 'lr': 0.00036341523831303154, 'lambda_val': 0.0009157525843262341, 'batch_size': 1439, 'optimizer': 'RMSprop'}.
2026-05-24 01:11:35,921 - experiment_functions - INFO - Early stopping at epoch 650. Best Metrics: (0.015740986737390397, 0.015115894039735102, 0.017868921302017258)
2026-05-24 01:11:36,727 - optuna.study.study - INFO - Trial 292 finished with values: [0.015740986737390397, 0.015115894039735102, 0.017868921302017258] and parameters: {'n_layers': 4, 'embedding_dim': 96, 'lr': 0.0010358017727309806, 'lambda_val': 0.04990172064077824, 'batch_size': 537, 'optimizer': 'RMSprop'}.
2026-05-24 01:12:02,678 - experiment_functions - INFO - Early stopping at epoch 2400. Best Metrics: (0.019419556522822033, 0.014577814569536426, 0.019636003241285404)
2026-05-24 01:12:03,185 - optuna.study.study - INFO - Trial 293 finished with values: [0.019419556522822033, 0.014577814569536426, 0.019636003241285404] and parameters: {'n_layers': 2, 'embedding_dim': 64, 'lr': 0.00036341523831303154, 'lambda_val': 0.0019340508111572378, 'batch_size': 1672, 'optimizer': 'Adam'}.
2026-05-24 01:12:37,193 - experiment_functions - INFO - Early stopping at epoch 3250. Best Metrics: (0.01693265590462146, 0.013758278145695363, 0.01745072984362432)
2026-05-24 01:12:37,477 - optuna.study.study - INFO - Trial 294 finished with values: [0.01693265590462146, 0.013758278145695363, 0.01745072984362432] and parameters: {'n_layers': 2, 'embedding_dim': 96, 'lr': 0.00037394670395286464, 'lambda_val': 0.014393132529370842, 'batch_size': 648, 'optimizer': 'Adam'}.
2026-05-24 01:12:46,508 - experiment_functions - INFO - Early stopping at epoch 750. Best Metrics: (0.024233050206395542, 0.018700331125827814, 0.02459908652232572)
2026-05-24 01:12:47,958 - optuna.study.study - INFO - Trial 295 finished with values: [0.024233050206395542, 0.018700331125827814, 0.02459908652232572] and parameters: {'n_layers': 4, 'embedding_dim': 32, 'lr': 0.0010012567369090046, 'lambda_val': 0.04990172064077824, 'batch_size': 1433, 'optimizer': 'Adam'}.
2026-05-24 01:12:58,179 - experiment_functions - INFO - Early stopping at epoch 850. Best Metrics: (0.02243231652890425, 0.017218543046357615, 0.022660064681425857)
2026-05-24 01:12:58,928 - optuna.study.study - INFO - Trial 296 finished with values: [0.02243231652890425, 0.017218543046357615, 0.022660064681425857] and parameters: {'n_layers': 4, 'embedding_dim': 64, 'lr': 0.0005537560378743981, 'lambda_val': 9.493825970205553e-06, 'batch_size': 1672, 'optimizer': 'RMSprop'}.
2026-05-24 01:13:12,230 - experiment_functions - INFO - Early stopping at epoch 1100. Best Metrics: (0.019647159597116735, 0.015579470198675496, 0.020448566313899408)
2026-05-24 01:13:12,313 - optuna.study.study - INFO - Trial 297 finished with values: [0.019647159597116735, 0.015579470198675496, 0.020448566313899408] and parameters: {'n_layers': 4, 'embedding_dim': 128, 'lr': 0.00037394670395286464, 'lambda_val': 0.00043848329846184707, 'batch_size': 2078, 'optimizer': 'Adam'}.
2026-05-24 01:13:19,724 - experiment_functions - INFO - Early stopping at epoch 500. Best Metrics: (0.004720783748982194, 0.003956953642384106, 0.004782717915494841)
2026-05-24 01:13:20,882 - optuna.study.study - INFO - Trial 298 finished with values: [0.004720783748982194, 0.003956953642384106, 0.004782717915494841] and parameters: {'n_layers': 1, 'embedding_dim': 32, 'lr': 0.0021406453710400555, 'lambda_val': 0.04990172064077824, 'batch_size': 648, 'optimizer': 'SGD'}.
2026-05-24 01:13:31,679 - experiment_functions - INFO - Early stopping at epoch 900. Best Metrics: (0.019970249103808027, 0.016622516556291392, 0.021667353790849518)
