2026-05-24 05:02:00,792 - optuna.study.study - INFO - Trial 257 finished with values: [0.022428158662939717, 0.016986754966887417, 0.0223668148354773] and parameters: {'n_layers': 4, 'embedding_dim': 32, 'lr': 0.0010345450541168627, 'lambda_val': 2.571811162691067e-06, 'batch_size': 953, 'optimizer': 'Adam'}.
2026-05-24 05:02:44,762 - optuna.study.study - INFO - Trial 258 finished with values: [0.024511598866386843, 0.018625827814569538, 0.024917756636061945] and parameters: {'n_layers': 4, 'embedding_dim': 64, 'lr': 0.0002960115862018489, 'lambda_val': 4.522194307522716e-05, 'batch_size': 764, 'optimizer': 'RMSprop'}.
2026-05-24 05:03:26,259 - optuna.study.study - INFO - Trial 259 finished with values: [0.020900937655670186, 0.01544701986754967, 0.021334564973038938] and parameters: {'n_layers': 3, 'embedding_dim': 32, 'lr': 0.0002960115862018489, 'lambda_val': 0.0012311986942485985, 'batch_size': 1248, 'optimizer': 'RMSprop'}.
2026-05-24 05:04:07,477 - optuna.study.study - INFO - Trial 260 finished with values: [0.01995105385449531, 0.013634105960264903, 0.020571041296575936] and parameters: {'n_layers': 2, 'embedding_dim': 32, 'lr': 0.0002960115862018489, 'lambda_val': 0.0009156994238225034, 'batch_size': 642, 'optimizer': 'RMSprop'}.
2026-05-24 05:04:13,550 - experiment_functions - INFO - Early stopping at epoch 500. Best Metrics: (0.0047298050428720316, 0.0040149006622516555, 0.005081504316895453)
2026-05-24 05:04:13,792 - optuna.study.study - INFO - Trial 261 finished with values: [0.0047298050428720316, 0.0040149006622516555, 0.005081504316895453] and parameters: {'n_layers': 3, 'embedding_dim': 64, 'lr': 7.289149734316272e-05, 'lambda_val': 0.000587220247472759, 'batch_size': 796, 'optimizer': 'SGD'}.
2026-05-24 05:04:24,309 - experiment_functions - INFO - Early stopping at epoch 900. Best Metrics: (0.023473228846881567, 0.017971854304635763, 0.02374338335488896)
2026-05-24 05:04:25,271 - optuna.study.study - INFO - Trial 262 finished with values: [0.023473228846881567, 0.017971854304635763, 0.02374338335488896] and parameters: {'n_layers': 4, 'embedding_dim': 32, 'lr': 0.0007924927231928422, 'lambda_val': 0.000587220247472759, 'batch_size': 796, 'optimizer': 'RMSprop'}.
2026-05-24 05:04:32,752 - experiment_functions - INFO - Early stopping at epoch 600. Best Metrics: (0.023033270646851668, 0.017781456953642385, 0.02349726522501396)
2026-05-24 05:04:32,858 - optuna.study.study - INFO - Trial 263 finished with values: [0.023033270646851668, 0.017781456953642385, 0.02349726522501396] and parameters: {'n_layers': 4, 'embedding_dim': 64, 'lr': 0.0013298986974489618, 'lambda_val': 6.677790881496428e-05, 'batch_size': 907, 'optimizer': 'RMSprop'}.
2026-05-24 05:04:41,513 - experiment_functions - INFO - Early stopping at epoch 750. Best Metrics: (0.009397694524175028, 0.007740066225165563, 0.009680153293219772)
2026-05-24 05:04:41,646 - optuna.study.study - INFO - Trial 264 finished with values: [0.009397694524175028, 0.007740066225165563, 0.009680153293219772] and parameters: {'n_layers': 4, 'embedding_dim': 64, 'lr': 0.04340364150676329, 'lambda_val': 3.383831904586725e-06, 'batch_size': 568, 'optimizer': 'RMSprop'}.
2026-05-24 05:05:23,408 - optuna.study.study - INFO - Trial 265 finished with values: [0.02579665952689996, 0.019503311258278148, 0.025811514617891235] and parameters: {'n_layers': 4, 'embedding_dim': 32, 'lr': 0.0002960115862018489, 'lambda_val': 0.0012311986942485985, 'batch_size': 764, 'optimizer': 'Adam'}.
2026-05-24 05:05:38,738 - experiment_functions - INFO - Early stopping at epoch 1400. Best Metrics: (0.020316810697778045, 0.017061258278145693, 0.021598874637208425)
2026-05-24 05:05:39,139 - optuna.study.study - INFO - Trial 266 finished with values: [0.020316810697778045, 0.017061258278145693, 0.021598874637208425] and parameters: {'n_layers': 4, 'embedding_dim': 64, 'lr': 0.0002960115862018489, 'lambda_val': 0.017024035419790078, 'batch_size': 1970, 'optimizer': 'Adam'}.
2026-05-24 05:06:20,730 - optuna.study.study - INFO - Trial 267 finished with values: [0.02304500410160983, 0.017955298013245035, 0.023965576638861178] and parameters: {'n_layers': 4, 'embedding_dim': 32, 'lr': 0.0002960115862018489, 'lambda_val': 0.0012311986942485985, 'batch_size': 642, 'optimizer': 'RMSprop'}.
2026-05-24 05:06:32,236 - experiment_functions - INFO - Early stopping at epoch 1000. Best Metrics: (0.023468178288335, 0.018071192052980134, 0.02456163336057685)
2026-05-24 05:06:32,386 - optuna.study.study - INFO - Trial 268 finished with values: [0.023468178288335, 0.018071192052980134, 0.02456163336057685] and parameters: {'n_layers': 4, 'embedding_dim': 64, 'lr': 0.0007924927231928422, 'lambda_val': 6.677790881496428e-05, 'batch_size': 642, 'optimizer': 'Adam'}.
2026-05-24 05:06:47,231 - experiment_functions - INFO - Early stopping at epoch 1350. Best Metrics: (0.025164443711749314, 0.018427152317880797, 0.025851211669567754)
2026-05-24 05:06:47,729 - optuna.study.study - INFO - Trial 269 finished with values: [0.025164443711749314, 0.018427152317880797, 0.025851211669567754] and parameters: {'n_layers': 3, 'embedding_dim': 32, 'lr': 0.0007366841828777069, 'lambda_val': 6.125414969219457e-05, 'batch_size': 568, 'optimizer': 'Adam'}.
2026-05-24 05:07:04,400 - experiment_functions - INFO - Early stopping at epoch 1500. Best Metrics: (0.01877889728330024, 0.015405629139072848, 0.01972043654645155)
2026-05-24 05:07:04,811 - optuna.study.study - INFO - Trial 270 finished with values: [0.01877889728330024, 0.015405629139072848, 0.01972043654645155] and parameters: {'n_layers': 4, 'embedding_dim': 64, 'lr': 0.0002960115862018489, 'lambda_val': 6.677790881496428e-05, 'batch_size': 2734, 'optimizer': 'Adam'}.
2026-05-24 05:07:14,181 - experiment_functions - INFO - Early stopping at epoch 800. Best Metrics: (0.024659038579198097, 0.019884105960264898, 0.025577918894171416)
2026-05-24 05:07:14,344 - optuna.study.study - INFO - Trial 271 finished with values: [0.024659038579198097, 0.019884105960264898, 0.025577918894171416] and parameters: {'n_layers': 4, 'embedding_dim': 64, 'lr': 0.0006691559391119897, 'lambda_val': 0.017024035419790078, 'batch_size': 568, 'optimizer': 'RMSprop'}.
2026-05-24 05:07:22,480 - experiment_functions - INFO - Early stopping at epoch 700. Best Metrics: (0.020553844457993804, 0.017218543046357615, 0.021717165422773424)
2026-05-24 05:07:22,568 - optuna.study.study - INFO - Trial 272 finished with values: [0.020553844457993804, 0.017218543046357615, 0.021717165422773424] and parameters: {'n_layers': 4, 'embedding_dim': 64, 'lr': 0.0013524049945715497, 'lambda_val': 0.030528649183713095, 'batch_size': 869, 'optimizer': 'Adam'}.
2026-05-24 05:08:01,543 - experiment_functions - INFO - Early stopping at epoch 3700. Best Metrics: (0.02380589991449091, 0.018526490066225167, 0.0246602572881691)
2026-05-24 05:08:01,633 - optuna.study.study - INFO - Trial 273 finished with values: [0.02380589991449091, 0.018526490066225167, 0.0246602572881691] and parameters: {'n_layers': 4, 'embedding_dim': 64, 'lr': 0.0002960115862018489, 'lambda_val': 1.4613413642545354e-05, 'batch_size': 764, 'optimizer': 'RMSprop'}.
2026-05-24 05:08:20,876 - experiment_functions - INFO - Early stopping at epoch 1800. Best Metrics: (0.020272033102211408, 0.016622516556291392, 0.02179114461324273)
2026-05-24 05:08:20,973 - optuna.study.study - INFO - Trial 274 finished with values: [0.020272033102211408, 0.016622516556291392, 0.02179114461324273] and parameters: {'n_layers': 4, 'embedding_dim': 32, 'lr': 0.00039891463323300135, 'lambda_val': 0.00216360313455091, 'batch_size': 1735, 'optimizer': 'Adam'}.
2026-05-24 05:09:02,582 - optuna.study.study - INFO - Trial 275 finished with values: [0.023363632214504323, 0.018228476821192052, 0.024342286797878084] and parameters: {'n_layers': 4, 'embedding_dim': 32, 'lr': 0.0002960115862018489, 'lambda_val': 1.4613413642545354e-05, 'batch_size': 642, 'optimizer': 'Adam'}.
2026-05-24 05:09:12,620 - experiment_functions - INFO - Early stopping at epoch 850. Best Metrics: (0.024220462920581925, 0.01889900662251656, 0.02539983618849005)
2026-05-24 05:09:12,927 - optuna.study.study - INFO - Trial 276 finished with values: [0.024220462920581925, 0.01889900662251656, 0.02539983618849005] and parameters: {'n_layers': 4, 'embedding_dim': 96, 'lr': 0.0006691559391119897, 'lambda_val': 0.0029344298742113367, 'batch_size': 568, 'optimizer': 'RMSprop'}.
2026-05-24 05:09:54,774 - optuna.study.study - INFO - Trial 277 finished with values: [0.026074518237371475, 0.019503311258278144, 0.02665911830900149] and parameters: {'n_layers': 4, 'embedding_dim': 32, 'lr': 0.0002960115862018489, 'lambda_val': 0.0029344298742113367, 'batch_size': 568, 'optimizer': 'RMSprop'}.
2026-05-24 05:10:36,167 - optuna.study.study - INFO - Trial 278 finished with values: [0.01964731766332973, 0.01367549668874172, 0.019840473239524353] and parameters: {'n_layers': 2, 'embedding_dim': 96, 'lr': 0.0002960115862018489, 'lambda_val': 0.0012311986942485985, 'batch_size': 764, 'optimizer': 'Adam'}.
2026-05-24 05:11:06,121 - experiment_functions - INFO - Early stopping at epoch 2750. Best Metrics: (0.02237820787643205, 0.018004966887417217, 0.02415409807685965)
2026-05-24 05:11:06,228 - optuna.study.study - INFO - Trial 279 finished with values: [0.02237820787643205, 0.018004966887417217, 0.02415409807685965] and parameters: {'n_layers': 4, 'embedding_dim': 96, 'lr': 0.0002960115862018489, 'lambda_val': 2.0016950105040354e-05, 'batch_size': 642, 'optimizer': 'Adam'}.
2026-05-24 05:11:14,769 - experiment_functions - INFO - Early stopping at epoch 750. Best Metrics: (0.019025109070309132, 0.014528145695364238, 0.0190439149644968)
2026-05-24 05:11:15,717 - optuna.study.study - INFO - Trial 280 finished with values: [0.019025109070309132, 0.014528145695364238, 0.0190439149644968] and parameters: {'n_layers': 2, 'embedding_dim': 32, 'lr': 0.0013524049945715497, 'lambda_val': 0.030528649183713095, 'batch_size': 1735, 'optimizer': 'Adam'}.
2026-05-24 05:11:59,453 - optuna.study.study - INFO - Trial 281 finished with values: [0.021456140415261372, 0.01735927152317881, 0.02248490193052573] and parameters: {'n_layers': 4, 'embedding_dim': 128, 'lr': 0.00021971244076229157, 'lambda_val': 0.008492029435485363, 'batch_size': 642, 'optimizer': 'Adam'}.
2026-05-24 05:12:14,014 - experiment_functions - INFO - Early stopping at epoch 1300. Best Metrics: (0.024562650499919302, 0.01857615894039735, 0.02530901361200852)
2026-05-24 05:12:14,819 - optuna.study.study - INFO - Trial 282 finished with values: [0.024562650499919302, 0.01857615894039735, 0.02530901361200852] and parameters: {'n_layers': 3, 'embedding_dim': 32, 'lr': 0.0006691559391119897, 'lambda_val': 0.010157868861362357, 'batch_size': 568, 'optimizer': 'RMSprop'}.
2026-05-24 05:12:21,311 - experiment_functions - INFO - Early stopping at epoch 550. Best Metrics: (0.01289636878563563, 0.00984271523178808, 0.012746565858593639)
2026-05-24 05:12:21,914 - optuna.study.study - INFO - Trial 283 finished with values: [0.01289636878563563, 0.00984271523178808, 0.012746565858593639] and parameters: {'n_layers': 3, 'embedding_dim': 32, 'lr': 0.06760207461121065, 'lambda_val': 1.788497394454551e-05, 'batch_size': 1199, 'optimizer': 'Adam'}.
2026-05-24 05:13:04,219 - optuna.study.study - INFO - Trial 284 finished with values: [0.02474642396864745, 0.01826986754966887, 0.025474639239972306] and parameters: {'n_layers': 4, 'embedding_dim': 32, 'lr': 0.0002960115862018489, 'lambda_val': 0.0012311986942485985, 'batch_size': 568, 'optimizer': 'Adam'}.
2026-05-24 05:13:46,458 - optuna.study.study - INFO - Trial 285 finished with values: [0.024446994918501663, 0.018327814569536423, 0.02415866023264261] and parameters: {'n_layers': 4, 'embedding_dim': 32, 'lr': 0.0002960115862018489, 'lambda_val': 6.677790881496428e-05, 'batch_size': 642, 'optimizer': 'RMSprop'}.
2026-05-24 05:13:55,172 - experiment_functions - INFO - Early stopping at epoch 750. Best Metrics: (0.02435908607982355, 0.01929635761589404, 0.02472227842578971)
2026-05-24 05:13:55,266 - optuna.study.study - INFO - Trial 286 finished with values: [0.02435908607982355, 0.01929635761589404, 0.02472227842578971] and parameters: {'n_layers': 4, 'embedding_dim': 32, 'lr': 0.0013524049945715497, 'lambda_val': 0.030528649183713095, 'batch_size': 796, 'optimizer': 'Adam'}.
2026-05-24 05:14:05,513 - experiment_functions - INFO - Early stopping at epoch 900. Best Metrics: (0.023263242514501254, 0.017251655629139072, 0.023515786578361075)
2026-05-24 05:14:05,734 - optuna.study.study - INFO - Trial 287 finished with values: [0.023263242514501254, 0.017251655629139072, 0.023515786578361075] and parameters: {'n_layers': 3, 'embedding_dim': 32, 'lr': 0.001248319543611659, 'lambda_val': 4.753901208340745e-06, 'batch_size': 764, 'optimizer': 'Adam'}.
2026-05-24 05:14:28,245 - experiment_functions - INFO - Early stopping at epoch 2050. Best Metrics: (0.02377679458160575, 0.018824503311258282, 0.02514954514545967)
2026-05-24 05:14:28,353 - optuna.study.study - INFO - Trial 288 finished with values: [0.02377679458160575, 0.018824503311258282, 0.02514954514545967] and parameters: {'n_layers': 4, 'embedding_dim': 96, 'lr': 0.0002960115862018489, 'lambda_val': 0.0007150353686754638, 'batch_size': 907, 'optimizer': 'RMSprop'}.
2026-05-24 05:14:34,331 - experiment_functions - INFO - Early stopping at epoch 500. Best Metrics: (0.005133085334431468, 0.004246688741721854, 0.005367646125450237)
2026-05-24 05:14:34,945 - optuna.study.study - INFO - Trial 289 finished with values: [0.005133085334431468, 0.004246688741721854, 0.005367646125450237] and parameters: {'n_layers': 3, 'embedding_dim': 32, 'lr': 0.0007924927231928422, 'lambda_val': 0.010157868861362357, 'batch_size': 796, 'optimizer': 'SGD'}.
2026-05-24 05:14:42,642 - experiment_functions - INFO - Early stopping at epoch 650. Best Metrics: (0.02031316313275262, 0.016697019867549668, 0.021054608090770966)
2026-05-24 05:14:42,730 - optuna.study.study - INFO - Trial 290 finished with values: [0.02031316313275262, 0.016697019867549668, 0.021054608090770966] and parameters: {'n_layers': 4, 'embedding_dim': 64, 'lr': 0.0013524049945715497, 'lambda_val': 0.030528649183713095, 'batch_size': 1735, 'optimizer': 'Adam'}.
2026-05-24 05:14:52,632 - experiment_functions - INFO - Early stopping at epoch 850. Best Metrics: (0.022145760951447102, 0.017706953642384105, 0.02330292559792251)
2026-05-24 05:14:53,375 - optuna.study.study - INFO - Trial 291 finished with values: [0.022145760951447102, 0.017706953642384105, 0.02330292559792251] and parameters: {'n_layers': 4, 'embedding_dim': 96, 'lr': 0.0007924927231928422, 'lambda_val': 0.006420156392281269, 'batch_size': 796, 'optimizer': 'Adam'}.
2026-05-24 05:15:21,905 - experiment_functions - INFO - Early stopping at epoch 2650. Best Metrics: (0.022896613154979, 0.01834437086092715, 0.024648143728631642)
2026-05-24 05:15:21,997 - optuna.study.study - INFO - Trial 292 finished with values: [0.022896613154979, 0.01834437086092715, 0.024648143728631642] and parameters: {'n_layers': 4, 'embedding_dim': 96, 'lr': 0.0002960115862018489, 'lambda_val': 0.0007150353686754638, 'batch_size': 642, 'optimizer': 'Adam'}.
2026-05-24 05:15:29,613 - experiment_functions - INFO - Early stopping at epoch 650. Best Metrics: (0.02239087566765955, 0.018874172185430464, 0.023898185064098357)
2026-05-24 05:15:29,728 - optuna.study.study - INFO - Trial 293 finished with values: [0.02239087566765955, 0.018874172185430464, 0.023898185064098357] and parameters: {'n_layers': 4, 'embedding_dim': 32, 'lr': 0.0007924927231928422, 'lambda_val': 0.030528649183713095, 'batch_size': 1735, 'optimizer': 'RMSprop'}.
2026-05-24 05:15:44,052 - experiment_functions - INFO - Early stopping at epoch 1300. Best Metrics: (0.02350856608338414, 0.018791390728476822, 0.02425923415569939)
2026-05-24 05:15:44,191 - optuna.study.study - INFO - Trial 294 finished with values: [0.02350856608338414, 0.018791390728476822, 0.02425923415569939] and parameters: {'n_layers': 4, 'embedding_dim': 64, 'lr': 0.0002960115862018489, 'lambda_val': 0.017024035419790078, 'batch_size': 1735, 'optimizer': 'RMSprop'}.
2026-05-24 05:16:08,953 - experiment_functions - INFO - Early stopping at epoch 2150. Best Metrics: (0.0248661544299507, 0.019677152317880794, 0.02640803616458989)
2026-05-24 05:16:09,045 - optuna.study.study - INFO - Trial 295 finished with values: [0.0248661544299507, 0.019677152317880794, 0.02640803616458989] and parameters: {'n_layers': 4, 'embedding_dim': 64, 'lr': 0.0002997005853240781, 'lambda_val': 0.010157868861362357, 'batch_size': 764, 'optimizer': 'RMSprop'}.
2026-05-24 05:16:19,142 - experiment_functions - INFO - Early stopping at epoch 700. Best Metrics: (0.022827112634532864, 0.018261589403973513, 0.023971413990326068)
2026-05-24 05:16:19,566 - optuna.study.study - INFO - Trial 296 finished with values: [0.022827112634532864, 0.018261589403973513, 0.023971413990326068] and parameters: {'n_layers': 4, 'embedding_dim': 32, 'lr': 0.0013524049945715497, 'lambda_val': 0.030528649183713095, 'batch_size': 1735, 'optimizer': 'Adam'}.
2026-05-24 05:16:30,560 - experiment_functions - INFO - Early stopping at epoch 500. Best Metrics: (0.008804264412800519, 0.006821192052980133, 0.00899698294974733)
2026-05-24 05:16:31,314 - optuna.study.study - INFO - Trial 297 finished with values: [0.008804264412800519, 0.006821192052980133, 0.00899698294974733] and parameters: {'n_layers': 4, 'embedding_dim': 64, 'lr': 0.04381167798185457, 'lambda_val': 0.017024035419790078, 'batch_size': 568, 'optimizer': 'RMSprop'}.
2026-05-24 05:16:57,245 - experiment_functions - INFO - Early stopping at epoch 2450. Best Metrics: (0.022306885771374834, 0.017839403973509933, 0.023246942130466568)
2026-05-24 05:16:57,356 - optuna.study.study - INFO - Trial 298 finished with values: [0.022306885771374834, 0.017839403973509933, 0.023246942130466568] and parameters: {'n_layers': 4, 'embedding_dim': 128, 'lr': 0.0002960115862018489, 'lambda_val': 6.677790881496428e-05, 'batch_size': 764, 'optimizer': 'Adam'}.
2026-05-24 05:17:34,563 - experiment_functions - INFO - Early stopping at epoch 3750. Best Metrics: (0.023121711004475184, 0.018468543046357616, 0.024003970646924676)
2026-05-24 05:17:34,661 - optuna.study.study - INFO - Trial 299 finished with values: [0.023121711004475184, 0.018468543046357616, 0.024003970646924676] and parameters: {'n_layers': 4, 'embedding_dim': 64, 'lr': 0.0002960115862018489, 'lambda_val': 0.0012311986942485985, 'batch_size': 764, 'optimizer': 'Adam'}.
2026-05-24 05:17:34,676 - root - INFO - Selected Trial 254 based on Max ndcg: 0.0274
2026-05-24 05:17:34,676 - root - INFO - Associated Recall: 0.0259
2026-05-24 05:17:34,676 - experiment_functions - INFO - Training the best model ... for e_1M_1c1dcs_strict_rand4
2026-05-24 05:17:42,335 - experiment_functions - INFO - Early stopping at epoch 750. Best Metrics: (0.026068177369544716, 0.02071192052980133, 0.027225162021082234)
2026-05-24 05:17:43,111 - root - INFO -   **** Training e_1M_1c1dcs_strict_rand5
2026-05-24 05:17:43,115 - root - INFO -   **** Getting 11896/805443 random edges
2026-05-24 05:17:43,910 - optuna.storages._rdb.storage - INFO - A new study created in RDB with name: Study_e_1M_1c1dcs_strict_rand5
2026-05-24 05:17:52,130 - experiment_functions - INFO - Early stopping at epoch 700. Best Metrics: (0.015415275882151335, 0.011076158940397351, 0.015326598619808954)
2026-05-24 05:17:52,233 - optuna.study.study - INFO - Trial 0 finished with values: [0.015415275882151335, 0.011076158940397351, 0.015326598619808954] and parameters: {'n_layers': 1, 'embedding_dim': 128, 'lr': 0.0006449308881031636, 'lambda_val': 0.007161127108464835, 'batch_size': 2878, 'optimizer': 'RMSprop'}.
2026-05-24 05:18:18,426 - experiment_functions - INFO - Early stopping at epoch 2900. Best Metrics: (0.005291942130883809, 0.004180463576158941, 0.00543908838273532)
2026-05-24 05:18:19,526 - optuna.study.study - INFO - Trial 1 finished with values: [0.005291942130883809, 0.004180463576158941, 0.00543908838273532] and parameters: {'n_layers': 1, 'embedding_dim': 64, 'lr': 0.03350477847874541, 'lambda_val': 8.405742636547137e-06, 'batch_size': 1893, 'optimizer': 'SGD'}.
2026-05-24 05:18:37,617 - experiment_functions - INFO - Early stopping at epoch 1700. Best Metrics: (0.02004980981154355, 0.01602649006622517, 0.02084803944249507)
2026-05-24 05:18:37,717 - optuna.study.study - INFO - Trial 2 finished with values: [0.02004980981154355, 0.01602649006622517, 0.02084803944249507] and parameters: {'n_layers': 4, 'embedding_dim': 96, 'lr': 0.0002909391164072771, 'lambda_val': 5.78540826635863e-05, 'batch_size': 2144, 'optimizer': 'RMSprop'}.
2026-05-24 05:18:43,903 - experiment_functions - INFO - Early stopping at epoch 500. Best Metrics: (0.005065004732141727, 0.00435430463576159, 0.005151572108205474)
2026-05-24 05:18:44,162 - optuna.study.study - INFO - Trial 3 finished with values: [0.005065004732141727, 0.00435430463576159, 0.005151572108205474] and parameters: {'n_layers': 4, 'embedding_dim': 128, 'lr': 0.04130937305024682, 'lambda_val': 0.013830451865145674, 'batch_size': 1942, 'optimizer': 'SGD'}.
2026-05-24 05:18:51,896 - experiment_functions - INFO - Early stopping at epoch 650. Best Metrics: (0.012205393949000535, 0.009453642384105962, 0.012090465779400457)
2026-05-24 05:18:51,984 - optuna.study.study - INFO - Trial 4 finished with values: [0.012205393949000535, 0.009453642384105962, 0.012090465779400457] and parameters: {'n_layers': 1, 'embedding_dim': 256, 'lr': 0.0013101443254887758, 'lambda_val': 0.010248606541800688, 'batch_size': 580, 'optimizer': 'RMSprop'}.
2026-05-24 05:18:57,894 - experiment_functions - INFO - Early stopping at epoch 500. Best Metrics: (0.005364488060350711, 0.004213576158940397, 0.005398825073484777)
