2026-05-24 07:34:37,912 - optuna.study.study - INFO - Trial 174 finished with values: [0.06955236754973351, 0.028749999999999998, 0.058751919197675945] and parameters: {'n_layers': 1, 'embedding_dim': 256, 'lr': 0.0004427403826510948, 'lambda_val': 2.4948249425733372e-05, 'batch_size': 1257, 'optimizer': 'RMSprop'}.
2026-05-24 07:34:45,319 - experiment_functions - INFO - Early stopping at epoch 600. Best Metrics: (0.0341417956743768, 0.010645695364238412, 0.022465499150389374)
2026-05-24 07:34:45,428 - optuna.study.study - INFO - Trial 175 finished with values: [0.0341417956743768, 0.010645695364238412, 0.022465499150389374] and parameters: {'n_layers': 1, 'embedding_dim': 32, 'lr': 0.04663881281088452, 'lambda_val': 1.743597466559768e-05, 'batch_size': 4018, 'optimizer': 'Adam'}.
2026-05-24 07:35:19,184 - experiment_functions - INFO - Early stopping at epoch 3200. Best Metrics: (0.02943212051428093, 0.010471854304635762, 0.0208152222453023)
2026-05-24 07:35:19,269 - optuna.study.study - INFO - Trial 176 finished with values: [0.02943212051428093, 0.010471854304635762, 0.0208152222453023] and parameters: {'n_layers': 1, 'embedding_dim': 64, 'lr': 0.031181557217089314, 'lambda_val': 0.00032325768897857425, 'batch_size': 1489, 'optimizer': 'RMSprop'}.
2026-05-24 07:35:25,626 - experiment_functions - INFO - Early stopping at epoch 500. Best Metrics: (0.005300000954197112, 0.004031456953642384, 0.005126811435711622)
2026-05-24 07:35:26,055 - optuna.study.study - INFO - Trial 177 finished with values: [0.005300000954197112, 0.004031456953642384, 0.005126811435711622] and parameters: {'n_layers': 1, 'embedding_dim': 64, 'lr': 9.311633605007365e-05, 'lambda_val': 0.0023548501277058376, 'batch_size': 1346, 'optimizer': 'Adam'}.
2026-05-24 07:36:11,851 - experiment_functions - INFO - Early stopping at epoch 3800. Best Metrics: (0.05459464102071931, 0.016697019867549668, 0.037719438200859316)
2026-05-24 07:36:11,988 - optuna.study.study - INFO - Trial 178 finished with values: [0.05459464102071931, 0.016697019867549668, 0.037719438200859316] and parameters: {'n_layers': 2, 'embedding_dim': 128, 'lr': 0.00609632158630285, 'lambda_val': 2.4948249425733372e-05, 'batch_size': 803, 'optimizer': 'RMSprop'}.
2026-05-24 07:36:19,015 - experiment_functions - INFO - Early stopping at epoch 550. Best Metrics: (0.005166619723520392, 0.004461920529801325, 0.005470640099457079)
2026-05-24 07:36:19,106 - optuna.study.study - INFO - Trial 179 finished with values: [0.005166619723520392, 0.004461920529801325, 0.005470640099457079] and parameters: {'n_layers': 1, 'embedding_dim': 128, 'lr': 5.77456921297193e-05, 'lambda_val': 0.0008118357014636037, 'batch_size': 2492, 'optimizer': 'RMSprop'}.
2026-05-24 07:36:32,510 - experiment_functions - INFO - Early stopping at epoch 1050. Best Metrics: (0.0525848819114693, 0.02009933774834437, 0.039854861033171166)
2026-05-24 07:36:32,608 - optuna.study.study - INFO - Trial 180 finished with values: [0.0525848819114693, 0.02009933774834437, 0.039854861033171166] and parameters: {'n_layers': 1, 'embedding_dim': 256, 'lr': 0.00034776281673029824, 'lambda_val': 0.02228654826917861, 'batch_size': 3042, 'optimizer': 'Adam'}.
2026-05-24 07:37:05,107 - experiment_functions - INFO - Early stopping at epoch 3150. Best Metrics: (0.013246763775398773, 0.00533112582781457, 0.009480464945991652)
2026-05-24 07:37:05,224 - optuna.study.study - INFO - Trial 181 finished with values: [0.013246763775398773, 0.00533112582781457, 0.009480464945991652] and parameters: {'n_layers': 1, 'embedding_dim': 32, 'lr': 0.08310558935015931, 'lambda_val': 7.532370886356362e-05, 'batch_size': 3968, 'optimizer': 'RMSprop'}.
2026-05-24 07:37:38,647 - experiment_functions - INFO - Early stopping at epoch 2450. Best Metrics: (0.03758575881517236, 0.011059602649006624, 0.024927080787603254)
2026-05-24 07:37:38,734 - optuna.study.study - INFO - Trial 182 finished with values: [0.03758575881517236, 0.011059602649006624, 0.024927080787603254] and parameters: {'n_layers': 4, 'embedding_dim': 96, 'lr': 0.0038879080432731965, 'lambda_val': 0.0007715536445878253, 'batch_size': 3838, 'optimizer': 'RMSprop'}.
2026-05-24 07:37:50,860 - experiment_functions - INFO - Early stopping at epoch 900. Best Metrics: (0.06215176441664148, 0.027500000000000004, 0.05609643602920972)
2026-05-24 07:37:50,948 - optuna.study.study - INFO - Trial 183 finished with values: [0.06215176441664148, 0.027500000000000004, 0.05609643602920972] and parameters: {'n_layers': 1, 'embedding_dim': 256, 'lr': 0.0004427403826510948, 'lambda_val': 0.0023999610459478756, 'batch_size': 3759, 'optimizer': 'Adam'}.
2026-05-24 07:38:35,068 - optuna.study.study - INFO - Trial 184 finished with values: [0.049774854867145314, 0.016183774834437087, 0.03458628631981504] and parameters: {'n_layers': 1, 'embedding_dim': 96, 'lr': 0.031181557217089314, 'lambda_val': 0.0008118357014636037, 'batch_size': 3042, 'optimizer': 'RMSprop'}.
2026-05-24 07:39:25,974 - optuna.study.study - INFO - Trial 185 finished with values: [0.03833336704367935, 0.022591059602649004, 0.04051745504770537] and parameters: {'n_layers': 4, 'embedding_dim': 32, 'lr': 0.00022442725513326185, 'lambda_val': 6.417173701743343e-05, 'batch_size': 3968, 'optimizer': 'RMSprop'}.
2026-05-24 07:39:35,593 - experiment_functions - INFO - Early stopping at epoch 650. Best Metrics: (0.02441774599666565, 0.012417218543046357, 0.01911915825075439)
2026-05-24 07:39:35,678 - optuna.study.study - INFO - Trial 186 finished with values: [0.02441774599666565, 0.012417218543046357, 0.01911915825075439] and parameters: {'n_layers': 4, 'embedding_dim': 96, 'lr': 0.0003154862248546408, 'lambda_val': 0.00828097881980844, 'batch_size': 3263, 'optimizer': 'RMSprop'}.
2026-05-24 07:39:49,178 - experiment_functions - INFO - Early stopping at epoch 1150. Best Metrics: (0.06074711592975631, 0.026928807947019868, 0.05542288416018225)
2026-05-24 07:39:49,269 - optuna.study.study - INFO - Trial 187 finished with values: [0.06074711592975631, 0.026928807947019868, 0.05542288416018225] and parameters: {'n_layers': 1, 'embedding_dim': 32, 'lr': 0.0004427403826510948, 'lambda_val': 0.0023999610459478756, 'batch_size': 3042, 'optimizer': 'Adam'}.
2026-05-24 07:40:00,146 - experiment_functions - INFO - Early stopping at epoch 600. Best Metrics: (0.03346288024204929, 0.016937086092715235, 0.03144659995913256)
2026-05-24 07:40:01,327 - optuna.study.study - INFO - Trial 188 finished with values: [0.03346288024204929, 0.016937086092715235, 0.03144659995913256] and parameters: {'n_layers': 4, 'embedding_dim': 256, 'lr': 0.000436971895785808, 'lambda_val': 2.4948249425733372e-05, 'batch_size': 2096, 'optimizer': 'RMSprop'}.
2026-05-24 07:40:12,554 - experiment_functions - INFO - Early stopping at epoch 800. Best Metrics: (0.04436456938375904, 0.02242549668874172, 0.04123447416433207)
2026-05-24 07:40:12,817 - optuna.study.study - INFO - Trial 189 finished with values: [0.04436456938375904, 0.02242549668874172, 0.04123447416433207] and parameters: {'n_layers': 3, 'embedding_dim': 96, 'lr': 0.0004427403826510948, 'lambda_val': 7.532370886356362e-05, 'batch_size': 1308, 'optimizer': 'Adam'}.
2026-05-24 07:40:35,501 - experiment_functions - INFO - Early stopping at epoch 1700. Best Metrics: (0.043885763821520436, 0.020240066225165564, 0.04092829588378269)
2026-05-24 07:40:35,602 - optuna.study.study - INFO - Trial 190 finished with values: [0.043885763821520436, 0.020240066225165564, 0.04092829588378269] and parameters: {'n_layers': 3, 'embedding_dim': 96, 'lr': 0.0002382334927885136, 'lambda_val': 1.3706619129375266e-05, 'batch_size': 2053, 'optimizer': 'RMSprop'}.
2026-05-24 07:40:43,353 - experiment_functions - INFO - Early stopping at epoch 600. Best Metrics: (0.06521793477404027, 0.02764072847682119, 0.058079535207517304)
2026-05-24 07:40:43,727 - optuna.study.study - INFO - Trial 191 finished with values: [0.06521793477404027, 0.02764072847682119, 0.058079535207517304] and parameters: {'n_layers': 1, 'embedding_dim': 96, 'lr': 0.0022852766065388956, 'lambda_val': 0.0003443593187809489, 'batch_size': 3042, 'optimizer': 'Adam'}.
2026-05-24 07:40:54,181 - experiment_functions - INFO - Early stopping at epoch 600. Best Metrics: (0.03362326904770552, 0.016225165562913906, 0.030836544634797475)
2026-05-24 07:40:54,790 - optuna.study.study - INFO - Trial 192 finished with values: [0.03362326904770552, 0.016225165562913906, 0.030836544634797475] and parameters: {'n_layers': 3, 'embedding_dim': 256, 'lr': 0.0004427403826510948, 'lambda_val': 2.4948249425733372e-05, 'batch_size': 3279, 'optimizer': 'RMSprop'}.
2026-05-24 07:41:07,948 - experiment_functions - INFO - Early stopping at epoch 850. Best Metrics: (0.04578837546211141, 0.023915562913907288, 0.04441112880023568)
2026-05-24 07:41:08,037 - optuna.study.study - INFO - Trial 193 finished with values: [0.04578837546211141, 0.023915562913907288, 0.04441112880023568] and parameters: {'n_layers': 4, 'embedding_dim': 96, 'lr': 0.0004427403826510948, 'lambda_val': 0.00013335196567720495, 'batch_size': 803, 'optimizer': 'Adam'}.
2026-05-24 07:41:23,563 - experiment_functions - INFO - Early stopping at epoch 1250. Best Metrics: (0.07029785019679625, 0.031266556291390725, 0.06177504819940511)
2026-05-24 07:41:24,170 - optuna.study.study - INFO - Trial 194 finished with values: [0.07029785019679625, 0.031266556291390725, 0.06177504819940511] and parameters: {'n_layers': 1, 'embedding_dim': 96, 'lr': 0.0004427403826510948, 'lambda_val': 0.0003842143805033632, 'batch_size': 1308, 'optimizer': 'RMSprop'}.
2026-05-24 07:41:37,558 - experiment_functions - INFO - Early stopping at epoch 1000. Best Metrics: (0.04817278917506563, 0.024743377483443706, 0.04502672834302885)
2026-05-24 07:41:37,656 - optuna.study.study - INFO - Trial 195 finished with values: [0.04817278917506563, 0.024743377483443706, 0.04502672834302885] and parameters: {'n_layers': 2, 'embedding_dim': 32, 'lr': 0.0004427403826510948, 'lambda_val': 0.0023999610459478756, 'batch_size': 3507, 'optimizer': 'RMSprop'}.
2026-05-24 07:41:44,576 - experiment_functions - INFO - Early stopping at epoch 500. Best Metrics: (0.004964833311105821, 0.0040149006622516555, 0.005085910037599471)
2026-05-24 07:41:44,972 - optuna.study.study - INFO - Trial 196 finished with values: [0.004964833311105821, 0.0040149006622516555, 0.005085910037599471] and parameters: {'n_layers': 2, 'embedding_dim': 96, 'lr': 0.008825737855916319, 'lambda_val': 6.875947708093636e-05, 'batch_size': 3042, 'optimizer': 'SGD'}.
2026-05-24 07:41:54,422 - experiment_functions - INFO - Early stopping at epoch 550. Best Metrics: (0.03424389981718583, 0.015612582781456956, 0.02702196023144456)
2026-05-24 07:41:54,588 - optuna.study.study - INFO - Trial 197 finished with values: [0.03424389981718583, 0.015612582781456956, 0.02702196023144456] and parameters: {'n_layers': 3, 'embedding_dim': 256, 'lr': 0.0019256562713315603, 'lambda_val': 0.00828097881980844, 'batch_size': 1257, 'optimizer': 'Adam'}.
2026-05-24 07:42:46,443 - optuna.study.study - INFO - Trial 198 finished with values: [0.06093610998985238, 0.024950331125827813, 0.05171240026775986] and parameters: {'n_layers': 1, 'embedding_dim': 64, 'lr': 0.0002382334927885136, 'lambda_val': 0.0002658688144855125, 'batch_size': 4089, 'optimizer': 'RMSprop'}.
2026-05-24 07:42:56,418 - experiment_functions - INFO - Early stopping at epoch 700. Best Metrics: (0.04887298291666028, 0.022466887417218542, 0.043527994730736846)
2026-05-24 07:42:56,511 - optuna.study.study - INFO - Trial 199 finished with values: [0.04887298291666028, 0.022466887417218542, 0.043527994730736846] and parameters: {'n_layers': 2, 'embedding_dim': 96, 'lr': 0.0004427403826510948, 'lambda_val': 0.0023999610459478756, 'batch_size': 3507, 'optimizer': 'RMSprop'}.
2026-05-24 07:43:13,125 - experiment_functions - INFO - Early stopping at epoch 1300. Best Metrics: (0.06122838831845018, 0.02744205298013245, 0.05646780548978463)
2026-05-24 07:43:13,213 - optuna.study.study - INFO - Trial 200 finished with values: [0.06122838831845018, 0.02744205298013245, 0.05646780548978463] and parameters: {'n_layers': 1, 'embedding_dim': 96, 'lr': 0.0003154862248546408, 'lambda_val': 7.532370886356362e-05, 'batch_size': 4018, 'optimizer': 'Adam'}.
2026-05-24 07:43:26,090 - experiment_functions - INFO - Early stopping at epoch 1000. Best Metrics: (0.060329110875342526, 0.026349337748344373, 0.05221400767347164)
2026-05-24 07:43:26,183 - optuna.study.study - INFO - Trial 201 finished with values: [0.060329110875342526, 0.026349337748344373, 0.05221400767347164] and parameters: {'n_layers': 1, 'embedding_dim': 96, 'lr': 0.0004427403826510948, 'lambda_val': 0.0023999610459478756, 'batch_size': 4018, 'optimizer': 'Adam'}.
2026-05-24 07:43:34,514 - experiment_functions - INFO - Early stopping at epoch 550. Best Metrics: (0.02493800825098678, 0.01343543046357616, 0.02194660380888607)
2026-05-24 07:43:34,606 - optuna.study.study - INFO - Trial 202 finished with values: [0.02493800825098678, 0.01343543046357616, 0.02194660380888607] and parameters: {'n_layers': 4, 'embedding_dim': 64, 'lr': 0.0014509434531037974, 'lambda_val': 1.5883883963792365e-05, 'batch_size': 1335, 'optimizer': 'RMSprop'}.
2026-05-24 07:44:29,540 - optuna.study.study - INFO - Trial 203 finished with values: [0.02338933357078693, 0.01206953642384106, 0.019729892308970525] and parameters: {'n_layers': 4, 'embedding_dim': 96, 'lr': 5.6397672057117384e-05, 'lambda_val': 0.0008118357014636037, 'batch_size': 2053, 'optimizer': 'Adam'}.
2026-05-24 07:44:51,939 - experiment_functions - INFO - Early stopping at epoch 1850. Best Metrics: (0.06867582977369692, 0.03220198675496689, 0.062374451334832486)
2026-05-24 07:44:52,071 - optuna.study.study - INFO - Trial 204 finished with values: [0.06867582977369692, 0.03220198675496689, 0.062374451334832486] and parameters: {'n_layers': 1, 'embedding_dim': 32, 'lr': 0.0004427403826510948, 'lambda_val': 0.0003842143805033632, 'batch_size': 1308, 'optimizer': 'Adam'}.
2026-05-24 07:45:37,897 - optuna.study.study - INFO - Trial 205 finished with values: [0.043367944489617005, 0.014503311258278147, 0.029678222892002615] and parameters: {'n_layers': 1, 'embedding_dim': 96, 'lr': 0.031181557217089314, 'lambda_val': 0.0008118357014636037, 'batch_size': 1308, 'optimizer': 'RMSprop'}.
2026-05-24 07:45:46,790 - experiment_functions - INFO - Early stopping at epoch 600. Best Metrics: (0.07612342864582013, 0.03001655629139073, 0.06336462805402264)
2026-05-24 07:45:47,800 - optuna.study.study - INFO - Trial 206 finished with values: [0.07612342864582013, 0.03001655629139073, 0.06336462805402264] and parameters: {'n_layers': 1, 'embedding_dim': 256, 'lr': 0.0022852766065388956, 'lambda_val': 0.0003443593187809489, 'batch_size': 3507, 'optimizer': 'Adam'}.
2026-05-24 07:46:05,569 - experiment_functions - INFO - Early stopping at epoch 1450. Best Metrics: (0.06403170819496964, 0.030339403973509933, 0.057162860810759226)
2026-05-24 07:46:06,314 - optuna.study.study - INFO - Trial 207 finished with values: [0.06403170819496964, 0.030339403973509933, 0.057162860810759226] and parameters: {'n_layers': 1, 'embedding_dim': 32, 'lr': 0.00034776281673029824, 'lambda_val': 0.016181458652267704, 'batch_size': 2437, 'optimizer': 'Adam'}.
2026-05-24 07:46:53,257 - optuna.study.study - INFO - Trial 208 finished with values: [0.04970869978445809, 0.02259933774834437, 0.04663231512689583] and parameters: {'n_layers': 1, 'embedding_dim': 32, 'lr': 0.00022442725513326185, 'lambda_val': 6.417173701743343e-05, 'batch_size': 2492, 'optimizer': 'RMSprop'}.
2026-05-24 07:47:13,282 - experiment_functions - INFO - Early stopping at epoch 1600. Best Metrics: (0.005305337126347829, 0.004478476821192054, 0.005532149944564443)
2026-05-24 07:47:13,468 - optuna.study.study - INFO - Trial 209 finished with values: [0.005305337126347829, 0.004478476821192054, 0.005532149944564443] and parameters: {'n_layers': 1, 'embedding_dim': 256, 'lr': 1.1729879320105198e-05, 'lambda_val': 7.532370886356362e-05, 'batch_size': 3507, 'optimizer': 'Adam'}.
2026-05-24 07:48:09,898 - optuna.study.study - INFO - Trial 210 finished with values: [0.04171701018947849, 0.02262417218543046, 0.03688678666014635] and parameters: {'n_layers': 4, 'embedding_dim': 96, 'lr': 9.311633605007365e-05, 'lambda_val': 0.0003443593187809489, 'batch_size': 891, 'optimizer': 'Adam'}.
2026-05-24 07:48:30,276 - experiment_functions - INFO - Early stopping at epoch 1100. Best Metrics: (0.049038965695551356, 0.02560430463576159, 0.04673614549685895)
2026-05-24 07:48:30,372 - optuna.study.study - INFO - Trial 211 finished with values: [0.049038965695551356, 0.02560430463576159, 0.04673614549685895] and parameters: {'n_layers': 4, 'embedding_dim': 256, 'lr': 0.00022442725513326185, 'lambda_val': 0.001968847412717117, 'batch_size': 534, 'optimizer': 'Adam'}.
2026-05-24 07:48:40,948 - experiment_functions - INFO - Early stopping at epoch 650. Best Metrics: (0.04988951941605038, 0.022980132450331123, 0.044411198326683554)
2026-05-24 07:48:41,524 - optuna.study.study - INFO - Trial 212 finished with values: [0.04988951941605038, 0.022980132450331123, 0.044411198326683554] and parameters: {'n_layers': 2, 'embedding_dim': 256, 'lr': 0.0004427403826510948, 'lambda_val': 0.0023999610459478756, 'batch_size': 2331, 'optimizer': 'RMSprop'}.
2026-05-24 07:49:38,597 - optuna.study.study - INFO - Trial 213 finished with values: [0.05668269709498322, 0.01716887417218543, 0.038601287368563504] and parameters: {'n_layers': 2, 'embedding_dim': 256, 'lr': 0.00609632158630285, 'lambda_val': 2.4948249425733372e-05, 'batch_size': 803, 'optimizer': 'RMSprop'}.
2026-05-24 07:49:54,174 - experiment_functions - INFO - Early stopping at epoch 1250. Best Metrics: (0.061847567946379585, 0.02774834437086093, 0.05382704307683159)
2026-05-24 07:49:54,272 - optuna.study.study - INFO - Trial 214 finished with values: [0.061847567946379585, 0.02774834437086093, 0.05382704307683159] and parameters: {'n_layers': 1, 'embedding_dim': 32, 'lr': 0.0004427403826510948, 'lambda_val': 0.0023999610459478756, 'batch_size': 3042, 'optimizer': 'Adam'}.
2026-05-24 07:50:02,410 - experiment_functions - INFO - Early stopping at epoch 550. Best Metrics: (0.04935672728325426, 0.02343543046357616, 0.04630417188674146)
2026-05-24 07:50:02,522 - optuna.study.study - INFO - Trial 215 finished with values: [0.04935672728325426, 0.02343543046357616, 0.04630417188674146] and parameters: {'n_layers': 2, 'embedding_dim': 128, 'lr': 0.0022852766065388956, 'lambda_val': 0.006128221667042127, 'batch_size': 3042, 'optimizer': 'Adam'}.
2026-05-24 07:50:18,883 - experiment_functions - INFO - Early stopping at epoch 1300. Best Metrics: (0.06038792898592082, 0.026349337748344373, 0.055206438485750096)
2026-05-24 07:50:19,572 - optuna.study.study - INFO - Trial 216 finished with values: [0.06038792898592082, 0.026349337748344373, 0.055206438485750096] and parameters: {'n_layers': 1, 'embedding_dim': 64, 'lr': 0.00034776281673029824, 'lambda_val': 1.738534368780138e-05, 'batch_size': 4089, 'optimizer': 'Adam'}.
2026-05-24 07:50:26,255 - experiment_functions - INFO - Early stopping at epoch 500. Best Metrics: (0.005130602936333298, 0.004023178807947021, 0.005112496318920355)
2026-05-24 07:50:26,922 - optuna.study.study - INFO - Trial 217 finished with values: [0.005130602936333298, 0.004023178807947021, 0.005112496318920355] and parameters: {'n_layers': 1, 'embedding_dim': 96, 'lr': 0.0022852766065388956, 'lambda_val': 0.0003443593187809489, 'batch_size': 1308, 'optimizer': 'SGD'}.
2026-05-24 07:50:39,396 - experiment_functions - INFO - Early stopping at epoch 950. Best Metrics: (0.0053076406910921485, 0.004271523178807948, 0.005248198832518405)
2026-05-24 07:50:39,490 - optuna.study.study - INFO - Trial 218 finished with values: [0.0053076406910921485, 0.004271523178807948, 0.005248198832518405] and parameters: {'n_layers': 1, 'embedding_dim': 256, 'lr': 1.7998289070853893e-05, 'lambda_val': 0.0023999610459478756, 'batch_size': 3263, 'optimizer': 'Adam'}.
2026-05-24 07:50:59,529 - experiment_functions - INFO - Early stopping at epoch 1650. Best Metrics: (0.05591750796842035, 0.02416390728476821, 0.04921402027235886)
2026-05-24 07:50:59,841 - optuna.study.study - INFO - Trial 219 finished with values: [0.05591750796842035, 0.02416390728476821, 0.04921402027235886] and parameters: {'n_layers': 1, 'embedding_dim': 32, 'lr': 0.00034776281673029824, 'lambda_val': 0.0023999610459478756, 'batch_size': 3042, 'optimizer': 'Adam'}.
2026-05-24 07:51:30,867 - experiment_functions - INFO - Early stopping at epoch 2650. Best Metrics: (0.05029502620623293, 0.016026490066225165, 0.0349483995792831)
2026-05-24 07:51:30,962 - optuna.study.study - INFO - Trial 220 finished with values: [0.05029502620623293, 0.016026490066225165, 0.0349483995792831] and parameters: {'n_layers': 1, 'embedding_dim': 64, 'lr': 0.008825737855916319, 'lambda_val': 0.00828097881980844, 'batch_size': 3968, 'optimizer': 'RMSprop'}.
2026-05-24 07:51:48,530 - experiment_functions - INFO - Early stopping at epoch 1450. Best Metrics: (0.05887376906056515, 0.017624172185430463, 0.039101437755764544)
2026-05-24 07:51:48,638 - optuna.study.study - INFO - Trial 221 finished with values: [0.05887376906056515, 0.017624172185430463, 0.039101437755764544] and parameters: {'n_layers': 1, 'embedding_dim': 64, 'lr': 0.00609632158630285, 'lambda_val': 2.4948249425733372e-05, 'batch_size': 2938, 'optimizer': 'RMSprop'}.
2026-05-24 07:52:04,614 - experiment_functions - INFO - Early stopping at epoch 1200. Best Metrics: (0.053984016463319455, 0.02491721854304636, 0.049128531253666285)
