2026-05-24 03:39:01,036 - optuna.study.study - INFO - Trial 265 finished with values: [0.0203012308199235, 0.01583609271523179, 0.020694427240979998] and parameters: {'n_layers': 3, 'embedding_dim': 96, 'lr': 0.001073497477166827, 'lambda_val': 1.777291066184071e-05, 'batch_size': 979, 'optimizer': 'Adam'}.
2026-05-24 03:39:07,695 - experiment_functions - INFO - Early stopping at epoch 550. Best Metrics: (0.019428745108449337, 0.015653973509933777, 0.020508810276757723)
2026-05-24 03:39:08,571 - optuna.study.study - INFO - Trial 266 finished with values: [0.019428745108449337, 0.015653973509933777, 0.020508810276757723] and parameters: {'n_layers': 4, 'embedding_dim': 32, 'lr': 0.0020411641802137886, 'lambda_val': 0.0012954629752387654, 'batch_size': 2142, 'optimizer': 'RMSprop'}.
2026-05-24 03:39:14,272 - experiment_functions - INFO - Early stopping at epoch 500. Best Metrics: (0.00511787775119169, 0.004147350993377484, 0.005042270893373949)
2026-05-24 03:39:14,878 - optuna.study.study - INFO - Trial 267 finished with values: [0.00511787775119169, 0.004147350993377484, 0.005042270893373949] and parameters: {'n_layers': 4, 'embedding_dim': 32, 'lr': 0.0005881134405257853, 'lambda_val': 1.8203246882701353e-06, 'batch_size': 2028, 'optimizer': 'SGD'}.
2026-05-24 03:39:51,577 - experiment_functions - INFO - Early stopping at epoch 3750. Best Metrics: (0.006033030181825841, 0.0047764900662251655, 0.006080473057480539)
2026-05-24 03:39:52,723 - optuna.study.study - INFO - Trial 268 finished with values: [0.006033030181825841, 0.0047764900662251655, 0.006080473057480539] and parameters: {'n_layers': 4, 'embedding_dim': 32, 'lr': 1.6578729753375417e-05, 'lambda_val': 7.397534001840383e-06, 'batch_size': 1359, 'optimizer': 'Adam'}.
2026-05-24 03:40:32,861 - optuna.study.study - INFO - Trial 269 finished with values: [0.008683620764624223, 0.006821192052980133, 0.00888115466419396] and parameters: {'n_layers': 4, 'embedding_dim': 32, 'lr': 7.31978662832108e-05, 'lambda_val': 0.0002834760188215498, 'batch_size': 979, 'optimizer': 'Adam'}.
2026-05-24 03:40:43,252 - experiment_functions - INFO - Early stopping at epoch 900. Best Metrics: (0.01922322089824705, 0.015347682119205298, 0.020475678914183004)
2026-05-24 03:40:43,408 - optuna.study.study - INFO - Trial 270 finished with values: [0.01922322089824705, 0.015347682119205298, 0.020475678914183004] and parameters: {'n_layers': 4, 'embedding_dim': 96, 'lr': 0.0005700378100001039, 'lambda_val': 7.397534001840383e-06, 'batch_size': 1628, 'optimizer': 'Adam'}.
2026-05-24 03:40:49,792 - experiment_functions - INFO - Early stopping at epoch 550. Best Metrics: (0.015976938244663487, 0.01283112582781457, 0.01679431136061782)
2026-05-24 03:40:49,876 - optuna.study.study - INFO - Trial 271 finished with values: [0.015976938244663487, 0.01283112582781457, 0.01679431136061782] and parameters: {'n_layers': 3, 'embedding_dim': 32, 'lr': 0.006496357950304462, 'lambda_val': 5.394142374521182e-06, 'batch_size': 3068, 'optimizer': 'Adam'}.
2026-05-24 03:41:00,852 - experiment_functions - INFO - Early stopping at epoch 950. Best Metrics: (0.017312927671131528, 0.014114238410596027, 0.0183338214495649)
2026-05-24 03:41:01,218 - optuna.study.study - INFO - Trial 272 finished with values: [0.017312927671131528, 0.014114238410596027, 0.0183338214495649] and parameters: {'n_layers': 4, 'embedding_dim': 96, 'lr': 0.0004568670531170521, 'lambda_val': 1.113463354596578e-05, 'batch_size': 2908, 'optimizer': 'Adam'}.
2026-05-24 03:41:10,671 - experiment_functions - INFO - Early stopping at epoch 800. Best Metrics: (0.019085535704003183, 0.015620860927152317, 0.02012372872128909)
2026-05-24 03:41:10,760 - optuna.study.study - INFO - Trial 273 finished with values: [0.019085535704003183, 0.015620860927152317, 0.02012372872128909] and parameters: {'n_layers': 4, 'embedding_dim': 64, 'lr': 0.0005700378100001039, 'lambda_val': 0.0012679169415010568, 'batch_size': 2365, 'optimizer': 'RMSprop'}.
2026-05-24 03:41:19,211 - experiment_functions - INFO - Early stopping at epoch 750. Best Metrics: (0.022249783817809038, 0.017367549668874174, 0.022944963860385907)
2026-05-24 03:41:19,296 - optuna.study.study - INFO - Trial 274 finished with values: [0.022249783817809038, 0.017367549668874174, 0.022944963860385907] and parameters: {'n_layers': 4, 'embedding_dim': 32, 'lr': 0.001073497477166827, 'lambda_val': 0.05810316365964571, 'batch_size': 1628, 'optimizer': 'Adam'}.
2026-05-24 03:42:00,632 - optuna.study.study - INFO - Trial 275 finished with values: [0.016484145114131966, 0.012110927152317881, 0.01602056881226714] and parameters: {'n_layers': 4, 'embedding_dim': 32, 'lr': 0.0001296342715163371, 'lambda_val': 0.003987651252810029, 'batch_size': 1950, 'optimizer': 'RMSprop'}.
2026-05-24 03:42:09,952 - experiment_functions - INFO - Early stopping at epoch 800. Best Metrics: (0.01589278804686976, 0.014602649006622517, 0.017589762418439576)
2026-05-24 03:42:11,260 - optuna.study.study - INFO - Trial 276 finished with values: [0.01589278804686976, 0.014602649006622517, 0.017589762418439576] and parameters: {'n_layers': 4, 'embedding_dim': 128, 'lr': 0.0004568670531170521, 'lambda_val': 0.05810316365964571, 'batch_size': 1676, 'optimizer': 'RMSprop'}.
2026-05-24 03:42:33,863 - experiment_functions - INFO - Early stopping at epoch 2200. Best Metrics: (0.020489160657758205, 0.015124172185430463, 0.021028027722013825)
2026-05-24 03:42:33,966 - optuna.study.study - INFO - Trial 277 finished with values: [0.020489160657758205, 0.015124172185430463, 0.021028027722013825] and parameters: {'n_layers': 2, 'embedding_dim': 32, 'lr': 0.0004649352000072556, 'lambda_val': 1.8203246882701353e-06, 'batch_size': 1256, 'optimizer': 'Adam'}.
2026-05-24 03:42:48,029 - experiment_functions - INFO - Early stopping at epoch 1250. Best Metrics: (0.02551310450790115, 0.019594370860927152, 0.026559428782372826)
2026-05-24 03:42:48,425 - optuna.study.study - INFO - Trial 278 finished with values: [0.02551310450790115, 0.019594370860927152, 0.026559428782372826] and parameters: {'n_layers': 4, 'embedding_dim': 96, 'lr': 0.0004649352000072556, 'lambda_val': 1.8203246882701353e-06, 'batch_size': 659, 'optimizer': 'RMSprop'}.
2026-05-24 03:42:56,068 - experiment_functions - INFO - Early stopping at epoch 650. Best Metrics: (0.019146315025705966, 0.01599337748344371, 0.020958691348159284)
2026-05-24 03:42:56,164 - optuna.study.study - INFO - Trial 279 finished with values: [0.019146315025705966, 0.01599337748344371, 0.020958691348159284] and parameters: {'n_layers': 4, 'embedding_dim': 32, 'lr': 0.001073497477166827, 'lambda_val': 0.0009527201315311902, 'batch_size': 1950, 'optimizer': 'RMSprop'}.
2026-05-24 03:43:02,758 - experiment_functions - INFO - Early stopping at epoch 550. Best Metrics: (0.019516866638328502, 0.015455298013245035, 0.02018637353076938)
2026-05-24 03:43:02,842 - optuna.study.study - INFO - Trial 280 finished with values: [0.019516866638328502, 0.015455298013245035, 0.02018637353076938] and parameters: {'n_layers': 3, 'embedding_dim': 128, 'lr': 0.0020411641802137886, 'lambda_val': 4.4508072112502196e-05, 'batch_size': 659, 'optimizer': 'RMSprop'}.
2026-05-24 03:43:08,595 - experiment_functions - INFO - Early stopping at epoch 500. Best Metrics: (0.005817228104820381, 0.004403973509933775, 0.0056296996156361655)
2026-05-24 03:43:08,725 - optuna.study.study - INFO - Trial 281 finished with values: [0.005817228104820381, 0.004403973509933775, 0.0056296996156361655] and parameters: {'n_layers': 1, 'embedding_dim': 32, 'lr': 0.0004568670531170521, 'lambda_val': 0.0014110759966605812, 'batch_size': 679, 'optimizer': 'SGD'}.
2026-05-24 03:43:49,003 - optuna.study.study - INFO - Trial 282 finished with values: [0.008335584040680402, 0.006349337748344371, 0.008741532519177827] and parameters: {'n_layers': 3, 'embedding_dim': 96, 'lr': 5.930040050421557e-05, 'lambda_val': 1.8203246882701353e-06, 'batch_size': 659, 'optimizer': 'RMSprop'}.
2026-05-24 03:44:03,854 - experiment_functions - INFO - Early stopping at epoch 1250. Best Metrics: (0.0186890604001144, 0.015066225165562913, 0.019649855175680103)
2026-05-24 03:44:04,383 - optuna.study.study - INFO - Trial 283 finished with values: [0.0186890604001144, 0.015066225165562913, 0.019649855175680103] and parameters: {'n_layers': 3, 'embedding_dim': 96, 'lr': 0.0005700378100001039, 'lambda_val': 1.113463354596578e-05, 'batch_size': 979, 'optimizer': 'Adam'}.
2026-05-24 03:44:21,432 - experiment_functions - INFO - Early stopping at epoch 1450. Best Metrics: (0.021095642587455367, 0.016705298013245034, 0.02231697467676912)
2026-05-24 03:44:23,094 - optuna.study.study - INFO - Trial 284 finished with values: [0.021095642587455367, 0.016705298013245034, 0.02231697467676912] and parameters: {'n_layers': 3, 'embedding_dim': 64, 'lr': 0.0005700378100001039, 'lambda_val': 7.397534001840383e-06, 'batch_size': 979, 'optimizer': 'Adam'}.
2026-05-24 03:44:34,544 - experiment_functions - INFO - Early stopping at epoch 950. Best Metrics: (0.01933744908504937, 0.0157864238410596, 0.020343121872367576)
2026-05-24 03:44:34,641 - optuna.study.study - INFO - Trial 285 finished with values: [0.01933744908504937, 0.0157864238410596, 0.020343121872367576] and parameters: {'n_layers': 4, 'embedding_dim': 96, 'lr': 0.0004568670531170521, 'lambda_val': 5.394142374521182e-06, 'batch_size': 2315, 'optimizer': 'Adam'}.
2026-05-24 03:44:46,247 - experiment_functions - INFO - Early stopping at epoch 1000. Best Metrics: (0.01874608964040976, 0.015753311258278148, 0.020341981567291324)
2026-05-24 03:44:46,501 - optuna.study.study - INFO - Trial 286 finished with values: [0.01874608964040976, 0.015753311258278148, 0.020341981567291324] and parameters: {'n_layers': 4, 'embedding_dim': 32, 'lr': 0.0005700378100001039, 'lambda_val': 0.0012679169415010568, 'batch_size': 2931, 'optimizer': 'RMSprop'}.
2026-05-24 03:44:55,617 - experiment_functions - INFO - Early stopping at epoch 750. Best Metrics: (0.019247778078342447, 0.015811258278145696, 0.020599293697991555)
2026-05-24 03:44:56,159 - optuna.study.study - INFO - Trial 287 finished with values: [0.019247778078342447, 0.015811258278145696, 0.020599293697991555] and parameters: {'n_layers': 4, 'embedding_dim': 128, 'lr': 0.0005700378100001039, 'lambda_val': 7.397534001840383e-06, 'batch_size': 1607, 'optimizer': 'RMSprop'}.
2026-05-24 03:45:02,549 - experiment_functions - INFO - Early stopping at epoch 550. Best Metrics: (0.019019235026971993, 0.013799668874172185, 0.01894626370136137)
2026-05-24 03:45:03,171 - optuna.study.study - INFO - Trial 288 finished with values: [0.019019235026971993, 0.013799668874172185, 0.01894626370136137] and parameters: {'n_layers': 1, 'embedding_dim': 32, 'lr': 0.004988191232611552, 'lambda_val': 6.003769581175366e-05, 'batch_size': 1282, 'optimizer': 'RMSprop'}.
2026-05-24 03:45:14,759 - experiment_functions - INFO - Early stopping at epoch 1000. Best Metrics: (0.018062033518808283, 0.014793046357615896, 0.019036989616565643)
2026-05-24 03:45:14,890 - optuna.study.study - INFO - Trial 289 finished with values: [0.018062033518808283, 0.014793046357615896, 0.019036989616565643] and parameters: {'n_layers': 3, 'embedding_dim': 96, 'lr': 0.0004568670531170521, 'lambda_val': 0.005786237060214494, 'batch_size': 2473, 'optimizer': 'RMSprop'}.
2026-05-24 03:45:24,372 - experiment_functions - INFO - Early stopping at epoch 700. Best Metrics: (0.024174682781136343, 0.018816225165562913, 0.02460725927363744)
2026-05-24 03:45:24,464 - optuna.study.study - INFO - Trial 290 finished with values: [0.024174682781136343, 0.018816225165562913, 0.02460725927363744] and parameters: {'n_layers': 4, 'embedding_dim': 96, 'lr': 0.0008654503808156264, 'lambda_val': 0.00034199571335759705, 'batch_size': 682, 'optimizer': 'RMSprop'}.
2026-05-24 03:45:39,572 - experiment_functions - INFO - Early stopping at epoch 1350. Best Metrics: (0.022346069213076296, 0.017367549668874174, 0.023227353699633264)
2026-05-24 03:45:39,848 - optuna.study.study - INFO - Trial 291 finished with values: [0.022346069213076296, 0.017367549668874174, 0.023227353699633264] and parameters: {'n_layers': 4, 'embedding_dim': 96, 'lr': 0.0004568670531170521, 'lambda_val': 0.0004919538394841542, 'batch_size': 659, 'optimizer': 'Adam'}.
2026-05-24 03:45:54,097 - experiment_functions - INFO - Early stopping at epoch 1350. Best Metrics: (0.020070181696257787, 0.014776490066225166, 0.020747337378486705)
2026-05-24 03:45:54,927 - optuna.study.study - INFO - Trial 292 finished with values: [0.020070181696257787, 0.014776490066225166, 0.020747337378486705] and parameters: {'n_layers': 1, 'embedding_dim': 32, 'lr': 0.0005881134405257853, 'lambda_val': 7.397534001840383e-06, 'batch_size': 1841, 'optimizer': 'Adam'}.
2026-05-24 03:46:02,079 - experiment_functions - INFO - Early stopping at epoch 600. Best Metrics: (0.02057336966879169, 0.015985099337748346, 0.02199576117423727)
2026-05-24 03:46:02,153 - optuna.study.study - INFO - Trial 293 finished with values: [0.02057336966879169, 0.015985099337748346, 0.02199576117423727] and parameters: {'n_layers': 4, 'embedding_dim': 32, 'lr': 0.00315150210736734, 'lambda_val': 0.0012679169415010568, 'batch_size': 979, 'optimizer': 'Adam'}.
2026-05-24 03:46:11,585 - experiment_functions - INFO - Early stopping at epoch 750. Best Metrics: (0.018178105366507515, 0.014528145695364238, 0.01884069469992145)
2026-05-24 03:46:12,597 - optuna.study.study - INFO - Trial 294 finished with values: [0.018178105366507515, 0.014528145695364238, 0.01884069469992145] and parameters: {'n_layers': 3, 'embedding_dim': 256, 'lr': 0.0005881134405257853, 'lambda_val': 1.113463354596578e-05, 'batch_size': 1235, 'optimizer': 'RMSprop'}.
2026-05-24 03:46:23,614 - experiment_functions - INFO - Early stopping at epoch 950. Best Metrics: (0.02252806628073049, 0.017061258278145697, 0.02251425431570746)
2026-05-24 03:46:24,288 - optuna.study.study - INFO - Trial 295 finished with values: [0.02252806628073049, 0.017061258278145697, 0.02251425431570746] and parameters: {'n_layers': 4, 'embedding_dim': 64, 'lr': 0.0005700378100001039, 'lambda_val': 2.456752842498507e-05, 'batch_size': 979, 'optimizer': 'RMSprop'}.
2026-05-24 03:46:40,529 - experiment_functions - INFO - Early stopping at epoch 1500. Best Metrics: (0.019375756352451718, 0.014892384105960265, 0.019947464637222394)
2026-05-24 03:46:40,772 - optuna.study.study - INFO - Trial 296 finished with values: [0.019375756352451718, 0.014892384105960265, 0.019947464637222394] and parameters: {'n_layers': 3, 'embedding_dim': 32, 'lr': 0.0004649352000072556, 'lambda_val': 1.8203246882701353e-06, 'batch_size': 2028, 'optimizer': 'Adam'}.
2026-05-24 03:46:55,515 - experiment_functions - INFO - Early stopping at epoch 1350. Best Metrics: (0.02403526741977227, 0.018385761589403974, 0.024551716880109903)
2026-05-24 03:46:56,386 - optuna.study.study - INFO - Trial 297 finished with values: [0.02403526741977227, 0.018385761589403974, 0.024551716880109903] and parameters: {'n_layers': 4, 'embedding_dim': 32, 'lr': 0.000629058738902094, 'lambda_val': 5.394142374521182e-06, 'batch_size': 679, 'optimizer': 'Adam'}.
2026-05-24 03:47:04,657 - experiment_functions - INFO - Early stopping at epoch 700. Best Metrics: (0.020187068244131443, 0.016134105960264905, 0.02084422170282944)
2026-05-24 03:47:04,761 - optuna.study.study - INFO - Trial 298 finished with values: [0.020187068244131443, 0.016134105960264905, 0.02084422170282944] and parameters: {'n_layers': 3, 'embedding_dim': 96, 'lr': 0.001073497477166827, 'lambda_val': 0.0012679169415010568, 'batch_size': 659, 'optimizer': 'RMSprop'}.
2026-05-24 03:47:14,176 - experiment_functions - INFO - Early stopping at epoch 850. Best Metrics: (0.021053157920942894, 0.016995033112582783, 0.021831323379770243)
2026-05-24 03:47:14,251 - optuna.study.study - INFO - Trial 299 finished with values: [0.021053157920942894, 0.016995033112582783, 0.021831323379770243] and parameters: {'n_layers': 3, 'embedding_dim': 32, 'lr': 0.001073497477166827, 'lambda_val': 0.05810316365964571, 'batch_size': 979, 'optimizer': 'Adam'}.
2026-05-24 03:47:14,266 - root - INFO - Selected Trial 80 based on Max ndcg: 0.0270
2026-05-24 03:47:14,266 - root - INFO - Associated Recall: 0.0259
2026-05-24 03:47:14,267 - experiment_functions - INFO - Training the best model ... for e_1M_1c1dcs_strict_rand3
2026-05-24 03:47:24,204 - experiment_functions - INFO - Early stopping at epoch 950. Best Metrics: (0.023634791294131437, 0.019105960264900662, 0.024269240844698458)
2026-05-24 03:47:25,735 - root - INFO -   **** Training e_1M_1c1dcs_strict_rand4
2026-05-24 03:47:25,739 - root - INFO -   **** Getting 11896/805443 random edges
2026-05-24 03:47:26,202 - optuna.storages._rdb.storage - INFO - A new study created in RDB with name: Study_e_1M_1c1dcs_strict_rand4
2026-05-24 03:47:36,812 - experiment_functions - INFO - Early stopping at epoch 900. Best Metrics: (0.0183781047635501, 0.013741721854304636, 0.018701563931105163)
2026-05-24 03:47:38,145 - optuna.study.study - INFO - Trial 0 finished with values: [0.0183781047635501, 0.013741721854304636, 0.018701563931105163] and parameters: {'n_layers': 2, 'embedding_dim': 96, 'lr': 0.0005361654985379109, 'lambda_val': 0.0029344298742113367, 'batch_size': 2419, 'optimizer': 'RMSprop'}.
2026-05-24 03:48:18,959 - optuna.study.study - INFO - Trial 1 finished with values: [0.012601874625638134, 0.009230132450331125, 0.013029839808902734] and parameters: {'n_layers': 3, 'embedding_dim': 32, 'lr': 0.00010036046105812974, 'lambda_val': 1.0492493236079029e-05, 'batch_size': 3459, 'optimizer': 'RMSprop'}.
2026-05-24 03:48:29,075 - experiment_functions - INFO - Early stopping at epoch 850. Best Metrics: (0.015837662347249787, 0.014867549668874172, 0.017830833911270133)
2026-05-24 03:48:29,186 - optuna.study.study - INFO - Trial 2 finished with values: [0.015837662347249787, 0.014867549668874172, 0.017830833911270133] and parameters: {'n_layers': 4, 'embedding_dim': 128, 'lr': 0.000460021398839349, 'lambda_val': 0.016113443657182445, 'batch_size': 3264, 'optimizer': 'Adam'}.
2026-05-24 03:48:36,005 - experiment_functions - INFO - Early stopping at epoch 550. Best Metrics: (0.012082386039944723, 0.00980132450331126, 0.01214716588043834)
2026-05-24 03:48:36,110 - optuna.study.study - INFO - Trial 3 finished with values: [0.012082386039944723, 0.00980132450331126, 0.01214716588043834] and parameters: {'n_layers': 2, 'embedding_dim': 256, 'lr': 0.0010412335380352404, 'lambda_val': 0.017024035419790078, 'batch_size': 2232, 'optimizer': 'RMSprop'}.
2026-05-24 03:48:42,879 - experiment_functions - INFO - Early stopping at epoch 550. Best Metrics: (0.011338579281194888, 0.009776490066225165, 0.011775737173239995)
2026-05-24 03:48:43,271 - optuna.study.study - INFO - Trial 4 finished with values: [0.011338579281194888, 0.009776490066225165, 0.011775737173239995] and parameters: {'n_layers': 4, 'embedding_dim': 128, 'lr': 0.013966211709492126, 'lambda_val': 1.5291847345304396e-05, 'batch_size': 2184, 'optimizer': 'Adam'}.
2026-05-24 03:48:50,565 - experiment_functions - INFO - Early stopping at epoch 550. Best Metrics: (0.008703998818502073, 0.007119205298013246, 0.008834346047617953)
2026-05-24 03:48:51,140 - optuna.study.study - INFO - Trial 5 finished with values: [0.008703998818502073, 0.007119205298013246, 0.008834346047617953] and parameters: {'n_layers': 1, 'embedding_dim': 96, 'lr': 0.006065924974024212, 'lambda_val': 0.07806682701300796, 'batch_size': 3422, 'optimizer': 'Adam'}.
2026-05-24 03:49:01,032 - experiment_functions - INFO - Early stopping at epoch 850. Best Metrics: (0.01656165774671884, 0.013890728476821193, 0.018154294407333176)
2026-05-24 03:49:01,114 - optuna.study.study - INFO - Trial 6 finished with values: [0.01656165774671884, 0.013890728476821193, 0.018154294407333176] and parameters: {'n_layers': 4, 'embedding_dim': 32, 'lr': 0.0007348069125149168, 'lambda_val': 1.1624629752310626e-05, 'batch_size': 3939, 'optimizer': 'Adam'}.
2026-05-24 03:49:40,791 - optuna.study.study - INFO - Trial 7 finished with values: [0.008040469041411109, 0.0062582781456953646, 0.008215908084004107] and parameters: {'n_layers': 4, 'embedding_dim': 64, 'lr': 4.080242094082236e-05, 'lambda_val': 2.571811162691067e-06, 'batch_size': 1829, 'optimizer': 'RMSprop'}.
2026-05-24 03:50:06,231 - experiment_functions - INFO - Early stopping at epoch 2500. Best Metrics: (0.004740097362809869, 0.003998344370860927, 0.004729439594320844)
2026-05-24 03:50:06,593 - optuna.study.study - INFO - Trial 8 finished with values: [0.004740097362809869, 0.003998344370860927, 0.004729439594320844] and parameters: {'n_layers': 3, 'embedding_dim': 128, 'lr': 0.08240384018449669, 'lambda_val': 0.003595639170538745, 'batch_size': 3151, 'optimizer': 'SGD'}.
2026-05-24 03:50:12,625 - experiment_functions - INFO - Early stopping at epoch 500. Best Metrics: (0.00584911373458071, 0.004395695364238411, 0.005531346273862858)
2026-05-24 03:50:12,738 - optuna.study.study - INFO - Trial 9 finished with values: [0.00584911373458071, 0.004395695364238411, 0.005531346273862858] and parameters: {'n_layers': 3, 'embedding_dim': 96, 'lr': 7.261974075439808e-05, 'lambda_val': 5.0395897820074916e-06, 'batch_size': 3979, 'optimizer': 'SGD'}.
2026-05-24 03:50:20,811 - experiment_functions - INFO - Early stopping at epoch 750. Best Metrics: (0.005038549078835817, 0.004056291390728477, 0.005233953454708803)
2026-05-24 03:50:20,900 - optuna.study.study - INFO - Trial 10 finished with values: [0.005038549078835817, 0.004056291390728477, 0.005233953454708803] and parameters: {'n_layers': 1, 'embedding_dim': 96, 'lr': 7.126033973768294e-05, 'lambda_val': 2.326083233079973e-06, 'batch_size': 595, 'optimizer': 'SGD'}.
2026-05-24 03:50:26,993 - experiment_functions - INFO - Early stopping at epoch 500. Best Metrics: (0.0048974646921945844, 0.003915562913907285, 0.005047251898898683)
