2026-05-24 05:37:08,819 - optuna.study.study - INFO - Trial 97 finished with values: [0.014665175402185529, 0.011639072847682121, 0.015116107131060876] and parameters: {'n_layers': 2, 'embedding_dim': 256, 'lr': 0.0013101443254887758, 'lambda_val': 3.999264894332394e-05, 'batch_size': 1671, 'optimizer': 'Adam'}.
2026-05-24 05:37:17,116 - experiment_functions - INFO - Early stopping at epoch 650. Best Metrics: (0.012472462455711373, 0.009908940397350996, 0.012526939935812465)
2026-05-24 05:37:17,228 - optuna.study.study - INFO - Trial 98 finished with values: [0.012472462455711373, 0.009908940397350996, 0.012526939935812465] and parameters: {'n_layers': 1, 'embedding_dim': 256, 'lr': 0.0013101443254887758, 'lambda_val': 0.010248606541800688, 'batch_size': 580, 'optimizer': 'RMSprop'}.
2026-05-24 05:37:24,707 - experiment_functions - INFO - Early stopping at epoch 550. Best Metrics: (0.013123269638613422, 0.01103476821192053, 0.013765288039778856)
2026-05-24 05:37:24,829 - optuna.study.study - INFO - Trial 99 finished with values: [0.013123269638613422, 0.01103476821192053, 0.013765288039778856] and parameters: {'n_layers': 4, 'embedding_dim': 128, 'lr': 0.009667197874531769, 'lambda_val': 0.00039316400466458875, 'batch_size': 2492, 'optimizer': 'Adam'}.
2026-05-24 05:37:32,842 - experiment_functions - INFO - Early stopping at epoch 600. Best Metrics: (0.01834170874635196, 0.01353476821192053, 0.01827447699258464)
2026-05-24 05:37:32,931 - optuna.study.study - INFO - Trial 100 finished with values: [0.01834170874635196, 0.01353476821192053, 0.01827447699258464] and parameters: {'n_layers': 2, 'embedding_dim': 32, 'lr': 0.0033498782435460272, 'lambda_val': 2.9809066173301263e-06, 'batch_size': 3385, 'optimizer': 'Adam'}.
2026-05-24 05:37:42,309 - experiment_functions - INFO - Early stopping at epoch 700. Best Metrics: (0.010314352751126648, 0.00820364238410596, 0.010358733025308941)
2026-05-24 05:37:42,399 - optuna.study.study - INFO - Trial 101 finished with values: [0.010314352751126648, 0.00820364238410596, 0.010358733025308941] and parameters: {'n_layers': 3, 'embedding_dim': 256, 'lr': 0.04816311555290602, 'lambda_val': 7.112074068161609e-06, 'batch_size': 2492, 'optimizer': 'RMSprop'}.
2026-05-24 05:37:56,544 - experiment_functions - INFO - Early stopping at epoch 1250. Best Metrics: (0.004995918946998731, 0.004163907284768212, 0.005138945465128699)
2026-05-24 05:37:56,642 - optuna.study.study - INFO - Trial 102 finished with values: [0.004995918946998731, 0.004163907284768212, 0.005138945465128699] and parameters: {'n_layers': 3, 'embedding_dim': 96, 'lr': 0.007172665906737051, 'lambda_val': 1.2569597282205344e-05, 'batch_size': 687, 'optimizer': 'SGD'}.
2026-05-24 05:38:03,950 - experiment_functions - INFO - Early stopping at epoch 550. Best Metrics: (0.015752267656331427, 0.01160596026490066, 0.015597727564368348)
2026-05-24 05:38:04,053 - optuna.study.study - INFO - Trial 103 finished with values: [0.015752267656331427, 0.01160596026490066, 0.015597727564368348] and parameters: {'n_layers': 1, 'embedding_dim': 64, 'lr': 0.004413263724852242, 'lambda_val': 2.0444537978084473e-06, 'batch_size': 2878, 'optimizer': 'RMSprop'}.
2026-05-24 05:38:10,554 - experiment_functions - INFO - Early stopping at epoch 500. Best Metrics: (0.004775805577499773, 0.004072847682119206, 0.004811603713075327)
2026-05-24 05:38:10,786 - optuna.study.study - INFO - Trial 104 finished with values: [0.004775805577499773, 0.004072847682119206, 0.004811603713075327] and parameters: {'n_layers': 1, 'embedding_dim': 128, 'lr': 0.0004890104603780292, 'lambda_val': 0.09383228839891232, 'batch_size': 1002, 'optimizer': 'Adam'}.
2026-05-24 05:38:23,418 - experiment_functions - INFO - Early stopping at epoch 550. Best Metrics: (0.016527973535454835, 0.013269867549668876, 0.016907523245570943)
2026-05-24 05:38:23,500 - optuna.study.study - INFO - Trial 105 finished with values: [0.016527973535454835, 0.013269867549668876, 0.016907523245570943] and parameters: {'n_layers': 4, 'embedding_dim': 96, 'lr': 0.0075729967336307024, 'lambda_val': 7.112074068161609e-06, 'batch_size': 1833, 'optimizer': 'Adam'}.
2026-05-24 05:38:31,039 - experiment_functions - INFO - Early stopping at epoch 600. Best Metrics: (0.02151116628951005, 0.015124172185430463, 0.021633739833671728)
2026-05-24 05:38:31,134 - optuna.study.study - INFO - Trial 106 finished with values: [0.02151116628951005, 0.015124172185430463, 0.021633739833671728] and parameters: {'n_layers': 2, 'embedding_dim': 32, 'lr': 0.00567629368896096, 'lambda_val': 2.1355760438149747e-05, 'batch_size': 542, 'optimizer': 'Adam'}.
2026-05-24 05:38:39,660 - experiment_functions - INFO - Early stopping at epoch 600. Best Metrics: (0.016533107363532817, 0.014271523178807947, 0.01834010046289374)
2026-05-24 05:38:39,756 - optuna.study.study - INFO - Trial 107 finished with values: [0.016533107363532817, 0.014271523178807947, 0.01834010046289374] and parameters: {'n_layers': 4, 'embedding_dim': 256, 'lr': 0.0007714507483516837, 'lambda_val': 0.0006557593423551091, 'batch_size': 2492, 'optimizer': 'RMSprop'}.
2026-05-24 05:38:54,640 - experiment_functions - INFO - Early stopping at epoch 1150. Best Metrics: (0.015844413641652712, 0.012442052980132451, 0.01581137909911143)
2026-05-24 05:38:55,118 - optuna.study.study - INFO - Trial 108 finished with values: [0.015844413641652712, 0.012442052980132451, 0.01581137909911143] and parameters: {'n_layers': 3, 'embedding_dim': 256, 'lr': 0.0002909391164072771, 'lambda_val': 0.00013892846035396848, 'batch_size': 3642, 'optimizer': 'RMSprop'}.
2026-05-24 05:39:01,439 - experiment_functions - INFO - Early stopping at epoch 500. Best Metrics: (0.004668418640868865, 0.003940397350993378, 0.00472489711936235)
2026-05-24 05:39:01,530 - optuna.study.study - INFO - Trial 109 finished with values: [0.004668418640868865, 0.003940397350993378, 0.00472489711936235] and parameters: {'n_layers': 1, 'embedding_dim': 96, 'lr': 0.012120345238348993, 'lambda_val': 0.0009364954703062878, 'batch_size': 3637, 'optimizer': 'SGD'}.
2026-05-24 05:39:17,869 - experiment_functions - INFO - Early stopping at epoch 1350. Best Metrics: (0.018926265411771784, 0.014097682119205299, 0.019339424911542637)
2026-05-24 05:39:18,356 - optuna.study.study - INFO - Trial 110 finished with values: [0.018926265411771784, 0.014097682119205299, 0.019339424911542637] and parameters: {'n_layers': 2, 'embedding_dim': 32, 'lr': 0.0004890104603780292, 'lambda_val': 0.007620237155778278, 'batch_size': 3745, 'optimizer': 'Adam'}.
2026-05-24 05:39:25,598 - experiment_functions - INFO - Early stopping at epoch 550. Best Metrics: (0.01446488797735668, 0.011150662251655629, 0.01465571024388077)
2026-05-24 05:39:25,701 - optuna.study.study - INFO - Trial 111 finished with values: [0.01446488797735668, 0.011150662251655629, 0.01465571024388077] and parameters: {'n_layers': 1, 'embedding_dim': 128, 'lr': 0.004584173047040943, 'lambda_val': 5.786389915206107e-05, 'batch_size': 3218, 'optimizer': 'RMSprop'}.
2026-05-24 05:39:32,874 - experiment_functions - INFO - Early stopping at epoch 550. Best Metrics: (0.01662433978636418, 0.012152317880794702, 0.016476354953453152)
2026-05-24 05:39:33,362 - optuna.study.study - INFO - Trial 112 finished with values: [0.01662433978636418, 0.012152317880794702, 0.016476354953453152] and parameters: {'n_layers': 1, 'embedding_dim': 32, 'lr': 0.0037147017870386746, 'lambda_val': 2.9428916086760435e-06, 'batch_size': 3671, 'optimizer': 'RMSprop'}.
2026-05-24 05:39:41,360 - experiment_functions - INFO - Early stopping at epoch 600. Best Metrics: (0.017014071468987434, 0.013518211920529802, 0.017285823729570285)
2026-05-24 05:39:41,914 - optuna.study.study - INFO - Trial 113 finished with values: [0.017014071468987434, 0.013518211920529802, 0.017285823729570285] and parameters: {'n_layers': 4, 'embedding_dim': 128, 'lr': 0.0030927336567706204, 'lambda_val': 7.112074068161609e-06, 'batch_size': 1833, 'optimizer': 'Adam'}.
2026-05-24 05:40:00,717 - experiment_functions - INFO - Early stopping at epoch 1550. Best Metrics: (0.020403372375742856, 0.01634933774834437, 0.021566762738414125)
2026-05-24 05:40:00,802 - optuna.study.study - INFO - Trial 114 finished with values: [0.020403372375742856, 0.01634933774834437, 0.021566762738414125] and parameters: {'n_layers': 4, 'embedding_dim': 128, 'lr': 0.0002909391164072771, 'lambda_val': 5.78540826635863e-05, 'batch_size': 1612, 'optimizer': 'RMSprop'}.
2026-05-24 05:40:41,560 - optuna.study.study - INFO - Trial 115 finished with values: [0.01533485803664989, 0.011407284768211921, 0.01501988293905076] and parameters: {'n_layers': 1, 'embedding_dim': 256, 'lr': 0.00018164145276986003, 'lambda_val': 5.786389915206107e-05, 'batch_size': 2144, 'optimizer': 'RMSprop'}.
2026-05-24 05:40:53,152 - experiment_functions - INFO - Early stopping at epoch 550. Best Metrics: (0.010884739644979533, 0.00961092715231788, 0.011686886245598894)
2026-05-24 05:40:53,259 - optuna.study.study - INFO - Trial 116 finished with values: [0.010884739644979533, 0.00961092715231788, 0.011686886245598894] and parameters: {'n_layers': 3, 'embedding_dim': 64, 'lr': 0.0075729967336307024, 'lambda_val': 0.00013892846035396848, 'batch_size': 2716, 'optimizer': 'RMSprop'}.
2026-05-24 05:41:00,229 - experiment_functions - INFO - Early stopping at epoch 550. Best Metrics: (0.012744183080039146, 0.0102317880794702, 0.012855456269058985)
2026-05-24 05:41:00,322 - optuna.study.study - INFO - Trial 117 finished with values: [0.012744183080039146, 0.0102317880794702, 0.012855456269058985] and parameters: {'n_layers': 2, 'embedding_dim': 256, 'lr': 0.0035600467319135505, 'lambda_val': 5.78540826635863e-05, 'batch_size': 2535, 'optimizer': 'RMSprop'}.
2026-05-24 05:41:06,998 - experiment_functions - INFO - Early stopping at epoch 550. Best Metrics: (0.010878239162192644, 0.009271523178807948, 0.011508822860205705)
2026-05-24 05:41:07,093 - optuna.study.study - INFO - Trial 118 finished with values: [0.010878239162192644, 0.009271523178807948, 0.011508822860205705] and parameters: {'n_layers': 4, 'embedding_dim': 96, 'lr': 0.00567629368896096, 'lambda_val': 9.854265988535646e-05, 'batch_size': 1575, 'optimizer': 'RMSprop'}.
2026-05-24 05:41:13,702 - experiment_functions - INFO - Early stopping at epoch 550. Best Metrics: (0.01802191148402344, 0.013245033112582781, 0.018145831374003312)
2026-05-24 05:41:14,367 - optuna.study.study - INFO - Trial 119 finished with values: [0.01802191148402344, 0.013245033112582781, 0.018145831374003312] and parameters: {'n_layers': 1, 'embedding_dim': 64, 'lr': 0.0034008688244003345, 'lambda_val': 0.00012012014373753211, 'batch_size': 1501, 'optimizer': 'RMSprop'}.
2026-05-24 05:41:21,397 - experiment_functions - INFO - Early stopping at epoch 550. Best Metrics: (0.01327202852662028, 0.010182119205298013, 0.013626659167016705)
2026-05-24 05:41:21,492 - optuna.study.study - INFO - Trial 120 finished with values: [0.01327202852662028, 0.010182119205298013, 0.013626659167016705] and parameters: {'n_layers': 2, 'embedding_dim': 256, 'lr': 0.0033498782435460272, 'lambda_val': 0.007620237155778278, 'batch_size': 2492, 'optimizer': 'Adam'}.
2026-05-24 05:41:28,195 - experiment_functions - INFO - Early stopping at epoch 550. Best Metrics: (0.014660369648676974, 0.010645695364238412, 0.014555604714300835)
2026-05-24 05:41:29,115 - optuna.study.study - INFO - Trial 121 finished with values: [0.014660369648676974, 0.010645695364238412, 0.014555604714300835] and parameters: {'n_layers': 1, 'embedding_dim': 256, 'lr': 0.002071693342392997, 'lambda_val': 3.1472646005870695e-06, 'batch_size': 2651, 'optimizer': 'RMSprop'}.
2026-05-24 05:41:36,438 - experiment_functions - INFO - Early stopping at epoch 600. Best Metrics: (0.00931139481780268, 0.007433774834437087, 0.009458917092686299)
2026-05-24 05:41:36,533 - optuna.study.study - INFO - Trial 122 finished with values: [0.00931139481780268, 0.007433774834437087, 0.009458917092686299] and parameters: {'n_layers': 1, 'embedding_dim': 256, 'lr': 0.08476338803180998, 'lambda_val': 0.00012823292249037775, 'batch_size': 3377, 'optimizer': 'Adam'}.
2026-05-24 05:41:44,780 - experiment_functions - INFO - Early stopping at epoch 650. Best Metrics: (0.015206287736358268, 0.01158112582781457, 0.01497842101234458)
2026-05-24 05:41:44,868 - optuna.study.study - INFO - Trial 123 finished with values: [0.015206287736358268, 0.01158112582781457, 0.01497842101234458] and parameters: {'n_layers': 2, 'embedding_dim': 256, 'lr': 0.0006336737470984971, 'lambda_val': 0.007580660282564002, 'batch_size': 2878, 'optimizer': 'RMSprop'}.
2026-05-24 05:42:00,032 - experiment_functions - INFO - Early stopping at epoch 1400. Best Metrics: (0.01739970213412376, 0.012996688741721855, 0.017663024904277607)
2026-05-24 05:42:00,119 - optuna.study.study - INFO - Trial 124 finished with values: [0.01739970213412376, 0.012996688741721855, 0.017663024904277607] and parameters: {'n_layers': 2, 'embedding_dim': 32, 'lr': 0.0004890104603780292, 'lambda_val': 2.1355760438149747e-05, 'batch_size': 3889, 'optimizer': 'Adam'}.
2026-05-24 05:42:09,212 - experiment_functions - INFO - Early stopping at epoch 500. Best Metrics: (0.005688867565816499, 0.004163907284768212, 0.005349083888160584)
2026-05-24 05:42:10,136 - optuna.study.study - INFO - Trial 125 finished with values: [0.005688867565816499, 0.004163907284768212, 0.005349083888160584] and parameters: {'n_layers': 2, 'embedding_dim': 64, 'lr': 0.0007714507483516837, 'lambda_val': 0.0028168727253759383, 'batch_size': 2716, 'optimizer': 'SGD'}.
2026-05-24 05:42:44,477 - experiment_functions - INFO - Early stopping at epoch 3400. Best Metrics: (0.01751204621803656, 0.012226821192052982, 0.017549346677548663)
2026-05-24 05:42:44,564 - optuna.study.study - INFO - Trial 126 finished with values: [0.01751204621803656, 0.012226821192052982, 0.017549346677548663] and parameters: {'n_layers': 1, 'embedding_dim': 128, 'lr': 0.0002909391164072771, 'lambda_val': 5.78540826635863e-05, 'batch_size': 2144, 'optimizer': 'RMSprop'}.
2026-05-24 05:42:55,895 - experiment_functions - INFO - Early stopping at epoch 900. Best Metrics: (0.01864841182255987, 0.01474337748344371, 0.018791546472482993)
2026-05-24 05:42:56,029 - optuna.study.study - INFO - Trial 127 finished with values: [0.01864841182255987, 0.01474337748344371, 0.018791546472482993] and parameters: {'n_layers': 4, 'embedding_dim': 128, 'lr': 0.0003788253863598979, 'lambda_val': 0.00013892846035396848, 'batch_size': 3218, 'optimizer': 'RMSprop'}.
2026-05-24 05:43:03,456 - experiment_functions - INFO - Early stopping at epoch 550. Best Metrics: (0.016681338386069125, 0.013178807947019866, 0.017399980441198098)
2026-05-24 05:43:03,540 - optuna.study.study - INFO - Trial 128 finished with values: [0.016681338386069125, 0.013178807947019866, 0.017399980441198098] and parameters: {'n_layers': 4, 'embedding_dim': 64, 'lr': 0.007122747338051435, 'lambda_val': 0.00012012014373753211, 'batch_size': 2810, 'optimizer': 'Adam'}.
2026-05-24 05:43:10,681 - experiment_functions - INFO - Early stopping at epoch 550. Best Metrics: (0.01506226484332184, 0.011018211920529803, 0.014753235051661998)
2026-05-24 05:43:10,781 - optuna.study.study - INFO - Trial 129 finished with values: [0.01506226484332184, 0.011018211920529803, 0.014753235051661998] and parameters: {'n_layers': 1, 'embedding_dim': 256, 'lr': 0.0075729967336307024, 'lambda_val': 7.112074068161609e-06, 'batch_size': 1833, 'optimizer': 'Adam'}.
2026-05-24 05:43:28,661 - experiment_functions - INFO - Early stopping at epoch 1400. Best Metrics: (0.018831375047361272, 0.013600993377483443, 0.01870968675136736)
2026-05-24 05:43:28,903 - optuna.study.study - INFO - Trial 130 finished with values: [0.018831375047361272, 0.013600993377483443, 0.01870968675136736] and parameters: {'n_layers': 1, 'embedding_dim': 32, 'lr': 0.0004890104603780292, 'lambda_val': 0.007620237155778278, 'batch_size': 2492, 'optimizer': 'Adam'}.
2026-05-24 05:43:35,552 - experiment_functions - INFO - Early stopping at epoch 500. Best Metrics: (0.004906017231536829, 0.004172185430463576, 0.005229594644543939)
2026-05-24 05:43:35,825 - optuna.study.study - INFO - Trial 131 finished with values: [0.004906017231536829, 0.004172185430463576, 0.005229594644543939] and parameters: {'n_layers': 2, 'embedding_dim': 256, 'lr': 0.0002909391164072771, 'lambda_val': 0.0002702283536384827, 'batch_size': 2144, 'optimizer': 'SGD'}.
2026-05-24 05:43:43,989 - experiment_functions - INFO - Early stopping at epoch 650. Best Metrics: (0.021041435642229666, 0.014586092715231787, 0.02058751384460202)
2026-05-24 05:43:44,215 - optuna.study.study - INFO - Trial 132 finished with values: [0.021041435642229666, 0.014586092715231787, 0.02058751384460202] and parameters: {'n_layers': 1, 'embedding_dim': 32, 'lr': 0.0034008688244003345, 'lambda_val': 2.9428916086760435e-06, 'batch_size': 1501, 'optimizer': 'Adam'}.
2026-05-24 05:44:00,329 - experiment_functions - INFO - Early stopping at epoch 1300. Best Metrics: (0.015193474297338442, 0.011721854304635761, 0.015876808822523333)
2026-05-24 05:44:00,433 - optuna.study.study - INFO - Trial 133 finished with values: [0.015193474297338442, 0.011721854304635761, 0.015876808822523333] and parameters: {'n_layers': 2, 'embedding_dim': 128, 'lr': 0.0003788253863598979, 'lambda_val': 0.002110272822989257, 'batch_size': 3671, 'optimizer': 'RMSprop'}.
2026-05-24 05:44:24,882 - experiment_functions - INFO - Early stopping at epoch 2150. Best Metrics: (0.012045390532531338, 0.009793046357615895, 0.012672940827263446)
2026-05-24 05:44:25,038 - optuna.study.study - INFO - Trial 134 finished with values: [0.012045390532531338, 0.009793046357615895, 0.012672940827263446] and parameters: {'n_layers': 1, 'embedding_dim': 256, 'lr': 0.00017696117021219715, 'lambda_val': 0.010248606541800688, 'batch_size': 3114, 'optimizer': 'Adam'}.
2026-05-24 05:44:49,616 - experiment_functions - INFO - Early stopping at epoch 2200. Best Metrics: (0.007580236548436911, 0.007905629139072848, 0.009138645604686265)
2026-05-24 05:44:49,715 - optuna.study.study - INFO - Trial 135 finished with values: [0.007580236548436911, 0.007905629139072848, 0.009138645604686265] and parameters: {'n_layers': 3, 'embedding_dim': 64, 'lr': 0.022281725794051167, 'lambda_val': 0.09383228839891232, 'batch_size': 1264, 'optimizer': 'Adam'}.
2026-05-24 05:45:36,679 - optuna.study.study - INFO - Trial 136 finished with values: [0.019619229989623184, 0.01644039735099338, 0.0199818788572586] and parameters: {'n_layers': 4, 'embedding_dim': 64, 'lr': 0.00018164145276986003, 'lambda_val': 0.010248606541800688, 'batch_size': 3377, 'optimizer': 'RMSprop'}.
2026-05-24 05:45:44,496 - experiment_functions - INFO - Early stopping at epoch 600. Best Metrics: (0.018041374349085048, 0.013079470198675497, 0.017861268464460893)
2026-05-24 05:45:44,606 - optuna.study.study - INFO - Trial 137 finished with values: [0.018041374349085048, 0.013079470198675497, 0.017861268464460893] and parameters: {'n_layers': 1, 'embedding_dim': 32, 'lr': 0.00567629368896096, 'lambda_val': 9.854265988535646e-05, 'batch_size': 2492, 'optimizer': 'Adam'}.
2026-05-24 05:45:51,205 - experiment_functions - INFO - Early stopping at epoch 500. Best Metrics: (0.004383069294558891, 0.003799668874172186, 0.004894060426014277)
2026-05-24 05:45:51,820 - optuna.study.study - INFO - Trial 138 finished with values: [0.004383069294558891, 0.003799668874172186, 0.004894060426014277] and parameters: {'n_layers': 2, 'embedding_dim': 256, 'lr': 0.00018164145276986003, 'lambda_val': 0.09383228839891232, 'batch_size': 2144, 'optimizer': 'RMSprop'}.
2026-05-24 05:45:59,340 - experiment_functions - INFO - Early stopping at epoch 600. Best Metrics: (0.017850998168474505, 0.01367549668874172, 0.018274642395009966)
2026-05-24 05:45:59,441 - optuna.study.study - INFO - Trial 139 finished with values: [0.017850998168474505, 0.01367549668874172, 0.018274642395009966] and parameters: {'n_layers': 2, 'embedding_dim': 64, 'lr': 0.00567629368896096, 'lambda_val': 0.0028168727253759383, 'batch_size': 1264, 'optimizer': 'Adam'}.
2026-05-24 05:46:41,978 - optuna.study.study - INFO - Trial 140 finished with values: [0.005994959950789679, 0.004213576158940397, 0.005381004357179999] and parameters: {'n_layers': 2, 'embedding_dim': 32, 'lr': 1.3077019577546424e-05, 'lambda_val': 0.007620237155778278, 'batch_size': 1202, 'optimizer': 'Adam'}.
2026-05-24 05:47:21,942 - experiment_functions - INFO - Early stopping at epoch 3550. Best Metrics: (0.02129156787463227, 0.014511589403973511, 0.020997109730802217)
2026-05-24 05:47:22,337 - optuna.study.study - INFO - Trial 141 finished with values: [0.02129156787463227, 0.014511589403973511, 0.020997109730802217] and parameters: {'n_layers': 1, 'embedding_dim': 32, 'lr': 0.0004890104603780292, 'lambda_val': 0.007620237155778278, 'batch_size': 725, 'optimizer': 'Adam'}.
2026-05-24 05:47:30,245 - experiment_functions - INFO - Early stopping at epoch 600. Best Metrics: (0.01792522471547723, 0.013137417218543045, 0.018014385373787946)
2026-05-24 05:47:30,351 - optuna.study.study - INFO - Trial 142 finished with values: [0.01792522471547723, 0.013137417218543045, 0.018014385373787946] and parameters: {'n_layers': 2, 'embedding_dim': 32, 'lr': 0.004512010550703536, 'lambda_val': 0.0028168727253759383, 'batch_size': 3745, 'optimizer': 'Adam'}.
2026-05-24 05:47:36,909 - experiment_functions - INFO - Early stopping at epoch 500. Best Metrics: (0.008636678235779065, 0.00668046357615894, 0.0086600328106461)
2026-05-24 05:47:37,132 - optuna.study.study - INFO - Trial 143 finished with values: [0.008636678235779065, 0.00668046357615894, 0.0086600328106461] and parameters: {'n_layers': 3, 'embedding_dim': 64, 'lr': 0.007293622224659535, 'lambda_val': 0.0028168727253759383, 'batch_size': 3637, 'optimizer': 'RMSprop'}.
