2026-05-24 03:19:16,992 - optuna.study.study - INFO - Trial 173 finished with values: [0.017617975152911556, 0.013269867549668876, 0.01795575924771901] and parameters: {'n_layers': 2, 'embedding_dim': 96, 'lr': 0.0004568670531170521, 'lambda_val': 1.8203246882701353e-06, 'batch_size': 2611, 'optimizer': 'RMSprop'}.
2026-05-24 03:19:35,634 - experiment_functions - INFO - Early stopping at epoch 1800. Best Metrics: (0.019803354833141013, 0.014288079470198677, 0.020212495562771913)
2026-05-24 03:19:35,744 - optuna.study.study - INFO - Trial 174 finished with values: [0.019803354833141013, 0.014288079470198677, 0.020212495562771913] and parameters: {'n_layers': 1, 'embedding_dim': 32, 'lr': 0.0004568670531170521, 'lambda_val': 3.906765509871913e-06, 'batch_size': 1841, 'optimizer': 'Adam'}.
2026-05-24 03:19:46,376 - experiment_functions - INFO - Early stopping at epoch 950. Best Metrics: (0.017911911034613037, 0.01320364238410596, 0.018025908099786058)
2026-05-24 03:19:46,801 - optuna.study.study - INFO - Trial 175 finished with values: [0.017911911034613037, 0.01320364238410596, 0.018025908099786058] and parameters: {'n_layers': 2, 'embedding_dim': 96, 'lr': 0.000648779798240634, 'lambda_val': 5.1688078317297965e-06, 'batch_size': 2583, 'optimizer': 'RMSprop'}.
2026-05-24 03:20:25,598 - optuna.study.study - INFO - Trial 176 finished with values: [0.007414823619324278, 0.005538079470198676, 0.007816176971645716] and parameters: {'n_layers': 4, 'embedding_dim': 32, 'lr': 3.631544866888594e-05, 'lambda_val': 0.003987651252810029, 'batch_size': 1542, 'optimizer': 'RMSprop'}.
2026-05-24 03:20:35,433 - experiment_functions - INFO - Early stopping at epoch 850. Best Metrics: (0.019797503407902126, 0.015587748344370862, 0.020920413995528183)
2026-05-24 03:20:35,528 - optuna.study.study - INFO - Trial 177 finished with values: [0.019797503407902126, 0.015587748344370862, 0.020920413995528183] and parameters: {'n_layers': 4, 'embedding_dim': 96, 'lr': 0.0004568670531170521, 'lambda_val': 7.397534001840383e-06, 'batch_size': 2142, 'optimizer': 'RMSprop'}.
2026-05-24 03:20:48,953 - experiment_functions - INFO - Early stopping at epoch 1250. Best Metrics: (0.019687476368121792, 0.014519867549668875, 0.020103293126662165)
2026-05-24 03:20:49,292 - optuna.study.study - INFO - Trial 178 finished with values: [0.019687476368121792, 0.014519867549668875, 0.020103293126662165] and parameters: {'n_layers': 1, 'embedding_dim': 32, 'lr': 0.0008654503808156264, 'lambda_val': 2.7695935649997752e-05, 'batch_size': 2064, 'optimizer': 'RMSprop'}.
2026-05-24 03:20:55,973 - experiment_functions - INFO - Early stopping at epoch 550. Best Metrics: (0.01854890569188766, 0.015082781456953642, 0.019794626477038894)
2026-05-24 03:20:56,075 - optuna.study.study - INFO - Trial 179 finished with values: [0.01854890569188766, 0.015082781456953642, 0.019794626477038894] and parameters: {'n_layers': 4, 'embedding_dim': 32, 'lr': 0.002491402332377118, 'lambda_val': 1.8203246882701353e-06, 'batch_size': 2028, 'optimizer': 'RMSprop'}.
2026-05-24 03:21:06,316 - experiment_functions - INFO - Early stopping at epoch 900. Best Metrics: (0.02019457695390484, 0.015885761589403975, 0.021016732704974086)
2026-05-24 03:21:06,415 - optuna.study.study - INFO - Trial 180 finished with values: [0.02019457695390484, 0.015885761589403975, 0.021016732704974086] and parameters: {'n_layers': 4, 'embedding_dim': 96, 'lr': 0.0005700378100001039, 'lambda_val': 5.138211460433891e-05, 'batch_size': 1628, 'optimizer': 'Adam'}.
2026-05-24 03:21:14,254 - experiment_functions - INFO - Early stopping at epoch 600. Best Metrics: (0.015648408839629216, 0.01230132450331126, 0.01641180756985237)
2026-05-24 03:21:14,347 - optuna.study.study - INFO - Trial 181 finished with values: [0.015648408839629216, 0.01230132450331126, 0.01641180756985237] and parameters: {'n_layers': 3, 'embedding_dim': 256, 'lr': 0.001073497477166827, 'lambda_val': 2.8339303211396753e-05, 'batch_size': 2473, 'optimizer': 'RMSprop'}.
2026-05-24 03:21:22,878 - experiment_functions - INFO - Early stopping at epoch 700. Best Metrics: (0.021312963280714067, 0.016672185430463577, 0.022150181582558274)
2026-05-24 03:21:22,977 - optuna.study.study - INFO - Trial 182 finished with values: [0.021312963280714067, 0.016672185430463577, 0.022150181582558274] and parameters: {'n_layers': 4, 'embedding_dim': 128, 'lr': 0.0005700378100001039, 'lambda_val': 7.397534001840383e-06, 'batch_size': 1676, 'optimizer': 'RMSprop'}.
2026-05-24 03:21:30,340 - experiment_functions - INFO - Early stopping at epoch 600. Best Metrics: (0.01935586455124049, 0.015670529801324506, 0.020361157125785425)
2026-05-24 03:21:30,441 - optuna.study.study - INFO - Trial 183 finished with values: [0.01935586455124049, 0.015670529801324506, 0.020361157125785425] and parameters: {'n_layers': 4, 'embedding_dim': 64, 'lr': 0.001073497477166827, 'lambda_val': 0.00034199571335759705, 'batch_size': 2473, 'optimizer': 'RMSprop'}.
2026-05-24 03:21:50,494 - experiment_functions - INFO - Early stopping at epoch 1650. Best Metrics: (0.022431145508970417, 0.017392384105960265, 0.02378127384692893)
2026-05-24 03:21:51,008 - optuna.study.study - INFO - Trial 184 finished with values: [0.022431145508970417, 0.017392384105960265, 0.02378127384692893] and parameters: {'n_layers': 3, 'embedding_dim': 96, 'lr': 0.0004649352000072556, 'lambda_val': 1.8203246882701353e-06, 'batch_size': 659, 'optimizer': 'RMSprop'}.
2026-05-24 03:21:57,681 - experiment_functions - INFO - Early stopping at epoch 550. Best Metrics: (0.01677124532065454, 0.014254966887417217, 0.018123172123069457)
2026-05-24 03:21:57,965 - optuna.study.study - INFO - Trial 185 finished with values: [0.01677124532065454, 0.014254966887417217, 0.018123172123069457] and parameters: {'n_layers': 4, 'embedding_dim': 32, 'lr': 0.003052355703485208, 'lambda_val': 0.0002604635685994012, 'batch_size': 2439, 'optimizer': 'RMSprop'}.
2026-05-24 03:22:03,821 - experiment_functions - INFO - Early stopping at epoch 500. Best Metrics: (0.00488063542726176, 0.004246688741721854, 0.005392983820384193)
2026-05-24 03:22:03,910 - optuna.study.study - INFO - Trial 186 finished with values: [0.00488063542726176, 0.004246688741721854, 0.005392983820384193] and parameters: {'n_layers': 4, 'embedding_dim': 96, 'lr': 0.0004649352000072556, 'lambda_val': 1.8203246882701353e-06, 'batch_size': 1950, 'optimizer': 'SGD'}.
2026-05-24 03:22:10,084 - experiment_functions - INFO - Early stopping at epoch 500. Best Metrics: (0.009145629246006332, 0.007052980132450332, 0.008937396527878864)
2026-05-24 03:22:10,810 - optuna.study.study - INFO - Trial 187 finished with values: [0.009145629246006332, 0.007052980132450332, 0.008937396527878864] and parameters: {'n_layers': 3, 'embedding_dim': 128, 'lr': 0.08654014539383868, 'lambda_val': 0.00034199571335759705, 'batch_size': 2745, 'optimizer': 'Adam'}.
2026-05-24 03:22:49,426 - optuna.study.study - INFO - Trial 188 finished with values: [0.005729788114476069, 0.004710264900662252, 0.006016404510443014] and parameters: {'n_layers': 2, 'embedding_dim': 32, 'lr': 1.088905227482636e-05, 'lambda_val': 5.138211460433891e-05, 'batch_size': 2583, 'optimizer': 'RMSprop'}.
2026-05-24 03:22:55,402 - experiment_functions - INFO - Early stopping at epoch 500. Best Metrics: (0.005500008168953076, 0.004172185430463576, 0.0050725798603551515)
2026-05-24 03:22:55,592 - optuna.study.study - INFO - Trial 189 finished with values: [0.005500008168953076, 0.004172185430463576, 0.0050725798603551515] and parameters: {'n_layers': 2, 'embedding_dim': 96, 'lr': 0.00021574524362862762, 'lambda_val': 0.015202750041742976, 'batch_size': 2171, 'optimizer': 'SGD'}.
2026-05-24 03:23:07,395 - experiment_functions - INFO - Early stopping at epoch 1100. Best Metrics: (0.017170511220325608, 0.012160596026490066, 0.01662483431466406)
2026-05-24 03:23:07,476 - optuna.study.study - INFO - Trial 190 finished with values: [0.017170511220325608, 0.012160596026490066, 0.01662483431466406] and parameters: {'n_layers': 1, 'embedding_dim': 96, 'lr': 0.0005700378100001039, 'lambda_val': 1.113463354596578e-05, 'batch_size': 3313, 'optimizer': 'RMSprop'}.
2026-05-24 03:23:21,968 - experiment_functions - INFO - Early stopping at epoch 1300. Best Metrics: (0.02079933018824989, 0.01625, 0.021470370445052976)
2026-05-24 03:23:22,961 - optuna.study.study - INFO - Trial 191 finished with values: [0.02079933018824989, 0.01625, 0.021470370445052976] and parameters: {'n_layers': 4, 'embedding_dim': 32, 'lr': 0.0004568670531170521, 'lambda_val': 5.394142374521182e-06, 'batch_size': 2315, 'optimizer': 'Adam'}.
2026-05-24 03:23:33,632 - experiment_functions - INFO - Early stopping at epoch 950. Best Metrics: (0.01907617195375885, 0.014230132450331126, 0.01937308348416076)
2026-05-24 03:23:34,425 - optuna.study.study - INFO - Trial 192 finished with values: [0.01907617195375885, 0.014230132450331126, 0.01937308348416076] and parameters: {'n_layers': 3, 'embedding_dim': 96, 'lr': 0.0005700378100001039, 'lambda_val': 1.113463354596578e-05, 'batch_size': 2057, 'optimizer': 'Adam'}.
2026-05-24 03:23:50,206 - experiment_functions - INFO - Early stopping at epoch 1200. Best Metrics: (0.019196561239830115, 0.015894039735099338, 0.020486995545198106)
2026-05-24 03:23:50,884 - optuna.study.study - INFO - Trial 193 finished with values: [0.019196561239830115, 0.015894039735099338, 0.020486995545198106] and parameters: {'n_layers': 4, 'embedding_dim': 96, 'lr': 0.00036006007162814904, 'lambda_val': 1.6246953393264848e-05, 'batch_size': 2745, 'optimizer': 'RMSprop'}.
2026-05-24 03:23:59,165 - experiment_functions - INFO - Early stopping at epoch 700. Best Metrics: (0.021515970327669817, 0.01669701986754967, 0.022598144383024005)
2026-05-24 03:23:59,255 - optuna.study.study - INFO - Trial 194 finished with values: [0.021515970327669817, 0.01669701986754967, 0.022598144383024005] and parameters: {'n_layers': 4, 'embedding_dim': 32, 'lr': 0.0008654503808156264, 'lambda_val': 1.6592144824872775e-06, 'batch_size': 1950, 'optimizer': 'RMSprop'}.
2026-05-24 03:24:08,726 - experiment_functions - INFO - Early stopping at epoch 850. Best Metrics: (0.018454902508962437, 0.01337748344370861, 0.018817321442196205)
2026-05-24 03:24:08,834 - optuna.study.study - INFO - Trial 195 finished with values: [0.018454902508962437, 0.01337748344370861, 0.018817321442196205] and parameters: {'n_layers': 1, 'embedding_dim': 128, 'lr': 0.0008654503808156264, 'lambda_val': 2.8339303211396753e-05, 'batch_size': 1737, 'optimizer': 'RMSprop'}.
2026-05-24 03:24:19,324 - experiment_functions - INFO - Early stopping at epoch 950. Best Metrics: (0.019274246018895477, 0.013841059602649006, 0.019343304284138597)
2026-05-24 03:24:19,528 - optuna.study.study - INFO - Trial 196 finished with values: [0.019274246018895477, 0.013841059602649006, 0.019343304284138597] and parameters: {'n_layers': 2, 'embedding_dim': 32, 'lr': 0.0008654503808156264, 'lambda_val': 2.2986922536937877e-05, 'batch_size': 2744, 'optimizer': 'Adam'}.
2026-05-24 03:24:27,658 - experiment_functions - INFO - Early stopping at epoch 700. Best Metrics: (0.020611241820608785, 0.016200331125827815, 0.022011737832887443)
2026-05-24 03:24:27,782 - optuna.study.study - INFO - Trial 197 finished with values: [0.020611241820608785, 0.016200331125827815, 0.022011737832887443] and parameters: {'n_layers': 3, 'embedding_dim': 96, 'lr': 0.0016659872807635835, 'lambda_val': 0.0012679169415010568, 'batch_size': 659, 'optimizer': 'Adam'}.
2026-05-24 03:24:35,195 - experiment_functions - INFO - Early stopping at epoch 600. Best Metrics: (0.01688914813465132, 0.01419701986754967, 0.018196904526416657)
2026-05-24 03:24:35,278 - optuna.study.study - INFO - Trial 198 finished with values: [0.01688914813465132, 0.01419701986754967, 0.018196904526416657] and parameters: {'n_layers': 4, 'embedding_dim': 96, 'lr': 0.0018521591652371555, 'lambda_val': 3.354916602460863e-05, 'batch_size': 2552, 'optimizer': 'Adam'}.
2026-05-24 03:24:44,029 - experiment_functions - INFO - Early stopping at epoch 750. Best Metrics: (0.018169634143014816, 0.014039735099337751, 0.01849542835778617)
2026-05-24 03:24:44,892 - optuna.study.study - INFO - Trial 199 finished with values: [0.018169634143014816, 0.014039735099337751, 0.01849542835778617] and parameters: {'n_layers': 3, 'embedding_dim': 96, 'lr': 0.001073497477166827, 'lambda_val': 5.1688078317297965e-06, 'batch_size': 2583, 'optimizer': 'Adam'}.
2026-05-24 03:24:52,108 - experiment_functions - INFO - Early stopping at epoch 600. Best Metrics: (0.01915021747763473, 0.013932119205298014, 0.01979660953362734)
2026-05-24 03:24:52,203 - optuna.study.study - INFO - Trial 200 finished with values: [0.01915021747763473, 0.013932119205298014, 0.01979660953362734] and parameters: {'n_layers': 1, 'embedding_dim': 64, 'lr': 0.002491402332377118, 'lambda_val': 2.5106257198426734e-05, 'batch_size': 679, 'optimizer': 'RMSprop'}.
2026-05-24 03:24:58,248 - experiment_functions - INFO - Early stopping at epoch 500. Best Metrics: (0.005575293654388814, 0.004304635761589404, 0.005652398443227024)
2026-05-24 03:24:59,308 - optuna.study.study - INFO - Trial 201 finished with values: [0.005575293654388814, 0.004304635761589404, 0.005652398443227024] and parameters: {'n_layers': 4, 'embedding_dim': 96, 'lr': 0.0005700378100001039, 'lambda_val': 5.138211460433891e-05, 'batch_size': 1628, 'optimizer': 'SGD'}.
2026-05-24 03:25:11,019 - experiment_functions - INFO - Early stopping at epoch 1050. Best Metrics: (0.020723667075150595, 0.015281456953642386, 0.020510123580407942)
2026-05-24 03:25:11,594 - optuna.study.study - INFO - Trial 202 finished with values: [0.020723667075150595, 0.015281456953642386, 0.020510123580407942] and parameters: {'n_layers': 3, 'embedding_dim': 96, 'lr': 0.0005700378100001039, 'lambda_val': 1.113463354596578e-05, 'batch_size': 1235, 'optimizer': 'RMSprop'}.
2026-05-24 03:25:21,463 - experiment_functions - INFO - Early stopping at epoch 850. Best Metrics: (0.01769531755061423, 0.014461920529801326, 0.019058314283831528)
2026-05-24 03:25:21,551 - optuna.study.study - INFO - Trial 203 finished with values: [0.01769531755061423, 0.014461920529801326, 0.019058314283831528] and parameters: {'n_layers': 3, 'embedding_dim': 128, 'lr': 0.0005700378100001039, 'lambda_val': 1.8203246882701353e-06, 'batch_size': 1628, 'optimizer': 'RMSprop'}.
2026-05-24 03:25:28,486 - experiment_functions - INFO - Early stopping at epoch 600. Best Metrics: (0.011826875490658594, 0.009114238410596026, 0.011866159622394375)
2026-05-24 03:25:28,576 - optuna.study.study - INFO - Trial 204 finished with values: [0.011826875490658594, 0.009114238410596026, 0.011866159622394375] and parameters: {'n_layers': 1, 'embedding_dim': 96, 'lr': 0.038740976677297395, 'lambda_val': 7.397534001840383e-06, 'batch_size': 2142, 'optimizer': 'RMSprop'}.
2026-05-24 03:25:45,414 - experiment_functions - INFO - Early stopping at epoch 1550. Best Metrics: (0.024346307557091357, 0.017433774834437088, 0.02443746002253838)
2026-05-24 03:25:45,503 - optuna.study.study - INFO - Trial 205 finished with values: [0.024346307557091357, 0.017433774834437088, 0.02443746002253838] and parameters: {'n_layers': 3, 'embedding_dim': 96, 'lr': 0.0004649352000072556, 'lambda_val': 1.8203246882701353e-06, 'batch_size': 659, 'optimizer': 'Adam'}.
2026-05-24 03:25:55,817 - experiment_functions - INFO - Early stopping at epoch 900. Best Metrics: (0.019988554975188248, 0.015894039735099338, 0.021019203915718748)
2026-05-24 03:25:57,063 - optuna.study.study - INFO - Trial 206 finished with values: [0.019988554975188248, 0.015894039735099338, 0.021019203915718748] and parameters: {'n_layers': 4, 'embedding_dim': 96, 'lr': 0.0005700378100001039, 'lambda_val': 1.113463354596578e-05, 'batch_size': 2057, 'optimizer': 'Adam'}.
2026-05-24 03:26:06,277 - experiment_functions - INFO - Early stopping at epoch 800. Best Metrics: (0.024287547995793402, 0.01843543046357616, 0.024977529834257994)
2026-05-24 03:26:06,376 - optuna.study.study - INFO - Trial 207 finished with values: [0.024287547995793402, 0.01843543046357616, 0.024977529834257994] and parameters: {'n_layers': 4, 'embedding_dim': 32, 'lr': 0.001073497477166827, 'lambda_val': 0.0012679169415010568, 'batch_size': 979, 'optimizer': 'Adam'}.
2026-05-24 03:26:26,988 - experiment_functions - INFO - Early stopping at epoch 1950. Best Metrics: (0.018886655213407447, 0.014677152317880795, 0.01976395223347848)
2026-05-24 03:26:27,205 - optuna.study.study - INFO - Trial 208 finished with values: [0.018886655213407447, 0.014677152317880795, 0.01976395223347848] and parameters: {'n_layers': 3, 'embedding_dim': 32, 'lr': 0.0004649352000072556, 'lambda_val': 1.8203246882701353e-06, 'batch_size': 2439, 'optimizer': 'RMSprop'}.
2026-05-24 03:26:37,958 - experiment_functions - INFO - Early stopping at epoch 950. Best Metrics: (0.01990010407457233, 0.01564569536423841, 0.020985117735676462)
2026-05-24 03:26:38,421 - optuna.study.study - INFO - Trial 209 finished with values: [0.01990010407457233, 0.01564569536423841, 0.020985117735676462] and parameters: {'n_layers': 4, 'embedding_dim': 96, 'lr': 0.0005700378100001039, 'lambda_val': 1.113463354596578e-05, 'batch_size': 1628, 'optimizer': 'Adam'}.
2026-05-24 03:26:52,194 - experiment_functions - INFO - Early stopping at epoch 1250. Best Metrics: (0.020102694799551256, 0.015405629139072848, 0.020698629766832215)
2026-05-24 03:26:52,285 - optuna.study.study - INFO - Trial 210 finished with values: [0.020102694799551256, 0.015405629139072848, 0.020698629766832215] and parameters: {'n_layers': 3, 'embedding_dim': 96, 'lr': 0.0004649352000072556, 'lambda_val': 1.8203246882701353e-06, 'batch_size': 1628, 'optimizer': 'Adam'}.
2026-05-24 03:27:00,208 - experiment_functions - INFO - Early stopping at epoch 650. Best Metrics: (0.01861363884896981, 0.014081125827814572, 0.018671687671083778)
2026-05-24 03:27:00,300 - optuna.study.study - INFO - Trial 211 finished with values: [0.01861363884896981, 0.014081125827814572, 0.018671687671083778] and parameters: {'n_layers': 3, 'embedding_dim': 96, 'lr': 0.001073497477166827, 'lambda_val': 1.8203246882701353e-06, 'batch_size': 2343, 'optimizer': 'RMSprop'}.
2026-05-24 03:27:06,886 - experiment_functions - INFO - Early stopping at epoch 550. Best Metrics: (0.018976751348643548, 0.015149006622516557, 0.019649139273708458)
2026-05-24 03:27:07,742 - optuna.study.study - INFO - Trial 212 finished with values: [0.018976751348643548, 0.015149006622516557, 0.019649139273708458] and parameters: {'n_layers': 4, 'embedding_dim': 32, 'lr': 0.002491402332377118, 'lambda_val': 1.8203246882701353e-06, 'batch_size': 2473, 'optimizer': 'RMSprop'}.
2026-05-24 03:27:18,784 - experiment_functions - INFO - Early stopping at epoch 1000. Best Metrics: (0.020329515180878565, 0.016440397350993376, 0.02147182348727691)
2026-05-24 03:27:19,180 - optuna.study.study - INFO - Trial 213 finished with values: [0.020329515180878565, 0.016440397350993376, 0.02147182348727691] and parameters: {'n_layers': 4, 'embedding_dim': 32, 'lr': 0.000629058738902094, 'lambda_val': 1.8203246882701353e-06, 'batch_size': 2028, 'optimizer': 'Adam'}.
2026-05-24 03:27:30,943 - experiment_functions - INFO - Early stopping at epoch 1050. Best Metrics: (0.019461844175658192, 0.014735099337748345, 0.0198910999317873)
2026-05-24 03:27:31,098 - optuna.study.study - INFO - Trial 214 finished with values: [0.019461844175658192, 0.014735099337748345, 0.0198910999317873] and parameters: {'n_layers': 3, 'embedding_dim': 96, 'lr': 0.0004649352000072556, 'lambda_val': 1.113463354596578e-05, 'batch_size': 2057, 'optimizer': 'Adam'}.
2026-05-24 03:27:38,275 - experiment_functions - INFO - Early stopping at epoch 600. Best Metrics: (0.018204238828329947, 0.015596026490066226, 0.020060888427374232)
2026-05-24 03:27:38,376 - optuna.study.study - INFO - Trial 215 finished with values: [0.018204238828329947, 0.015596026490066226, 0.020060888427374232] and parameters: {'n_layers': 4, 'embedding_dim': 96, 'lr': 0.001073497477166827, 'lambda_val': 1.7953564574856594e-05, 'batch_size': 2142, 'optimizer': 'RMSprop'}.
2026-05-24 03:27:52,339 - experiment_functions - INFO - Early stopping at epoch 1300. Best Metrics: (0.019037960443746036, 0.013286423841059603, 0.019042715626764222)
2026-05-24 03:27:52,436 - optuna.study.study - INFO - Trial 216 finished with values: [0.019037960443746036, 0.013286423841059603, 0.019042715626764222] and parameters: {'n_layers': 1, 'embedding_dim': 96, 'lr': 0.0004649352000072556, 'lambda_val': 1.113463354596578e-05, 'batch_size': 2142, 'optimizer': 'RMSprop'}.
2026-05-24 03:28:00,044 - experiment_functions - INFO - Early stopping at epoch 500. Best Metrics: (0.009141067232911027, 0.007367549668874172, 0.009130213430464757)
2026-05-24 03:28:00,151 - optuna.study.study - INFO - Trial 217 finished with values: [0.009141067232911027, 0.007367549668874172, 0.009130213430464757] and parameters: {'n_layers': 4, 'embedding_dim': 256, 'lr': 0.04794097080154047, 'lambda_val': 0.0009527201315311902, 'batch_size': 979, 'optimizer': 'RMSprop'}.
2026-05-24 03:28:05,738 - experiment_functions - INFO - Early stopping at epoch 500. Best Metrics: (0.005324874960321752, 0.003973509933774834, 0.005160404827983684)
2026-05-24 03:28:06,786 - optuna.study.study - INFO - Trial 218 finished with values: [0.005324874960321752, 0.003973509933774834, 0.005160404827983684] and parameters: {'n_layers': 1, 'embedding_dim': 32, 'lr': 0.000629058738902094, 'lambda_val': 0.0778864262243213, 'batch_size': 679, 'optimizer': 'Adam'}.
