2026-05-24 01:55:29,467 - optuna.study.study - INFO - Trial 144 finished with values: [0.01868654722157709, 0.01540562913907285, 0.019701497844842094] and parameters: {'n_layers': 4, 'embedding_dim': 96, 'lr': 0.0005233015481570266, 'lambda_val': 0.0009443756499535536, 'batch_size': 3458, 'optimizer': 'Adam'}.
2026-05-24 01:55:36,134 - experiment_functions - INFO - Early stopping at epoch 550. Best Metrics: (0.009600580218875651, 0.008402317880794702, 0.009819381386557616)
2026-05-24 01:55:36,803 - optuna.study.study - INFO - Trial 145 finished with values: [0.009600580218875651, 0.008402317880794702, 0.009819381386557616] and parameters: {'n_layers': 2, 'embedding_dim': 96, 'lr': 0.029429678457203484, 'lambda_val': 2.182273739992126e-05, 'batch_size': 3106, 'optimizer': 'RMSprop'}.
2026-05-24 01:55:43,906 - experiment_functions - INFO - Early stopping at epoch 600. Best Metrics: (0.016483807009097188, 0.012889072847682119, 0.01729270680981627)
2026-05-24 01:55:44,000 - optuna.study.study - INFO - Trial 146 finished with values: [0.016483807009097188, 0.012889072847682119, 0.01729270680981627] and parameters: {'n_layers': 2, 'embedding_dim': 64, 'lr': 0.003175767497275054, 'lambda_val': 3.968354235124371e-06, 'batch_size': 3458, 'optimizer': 'Adam'}.
2026-05-24 01:56:10,889 - experiment_functions - INFO - Early stopping at epoch 2750. Best Metrics: (0.01662975628757753, 0.012475165562913906, 0.01724336976991301)
2026-05-24 01:56:10,970 - optuna.study.study - INFO - Trial 147 finished with values: [0.01662975628757753, 0.012475165562913906, 0.01724336976991301] and parameters: {'n_layers': 2, 'embedding_dim': 64, 'lr': 0.00019509942015877229, 'lambda_val': 1.858625399381744e-05, 'batch_size': 3893, 'optimizer': 'Adam'}.
2026-05-24 01:56:18,499 - experiment_functions - INFO - Early stopping at epoch 550. Best Metrics: (0.020642918091229114, 0.01732615894039735, 0.022280402087239286)
2026-05-24 01:56:18,583 - optuna.study.study - INFO - Trial 148 finished with values: [0.020642918091229114, 0.01732615894039735, 0.022280402087239286] and parameters: {'n_layers': 4, 'embedding_dim': 96, 'lr': 0.0019780306615905445, 'lambda_val': 1.1741946550104087e-06, 'batch_size': 652, 'optimizer': 'RMSprop'}.
2026-05-24 01:56:28,771 - experiment_functions - INFO - Early stopping at epoch 800. Best Metrics: (0.020617293905418582, 0.016456953642384108, 0.021845707420161935)
2026-05-24 01:56:29,004 - optuna.study.study - INFO - Trial 149 finished with values: [0.020617293905418582, 0.016456953642384108, 0.021845707420161935] and parameters: {'n_layers': 4, 'embedding_dim': 96, 'lr': 0.0005233015481570266, 'lambda_val': 1.858625399381744e-05, 'batch_size': 2154, 'optimizer': 'RMSprop'}.
2026-05-24 01:57:12,761 - optuna.study.study - INFO - Trial 150 finished with values: [0.024303156950190388, 0.017450331125827816, 0.024578162909578757] and parameters: {'n_layers': 3, 'embedding_dim': 32, 'lr': 0.0003847621589190308, 'lambda_val': 0.0008187140617702526, 'batch_size': 925, 'optimizer': 'RMSprop'}.
2026-05-24 01:57:20,976 - experiment_functions - INFO - Early stopping at epoch 700. Best Metrics: (0.016923951620027605, 0.013973509933774836, 0.017621346571321823)
2026-05-24 01:57:21,065 - optuna.study.study - INFO - Trial 151 finished with values: [0.016923951620027605, 0.013973509933774836, 0.017621346571321823] and parameters: {'n_layers': 3, 'embedding_dim': 32, 'lr': 0.001254073391314583, 'lambda_val': 0.012208803351137528, 'batch_size': 3843, 'optimizer': 'Adam'}.
2026-05-24 01:57:44,147 - experiment_functions - INFO - Early stopping at epoch 2250. Best Metrics: (0.020950402515857655, 0.014048013245033112, 0.020511379481128196)
2026-05-24 01:57:44,230 - optuna.study.study - INFO - Trial 152 finished with values: [0.020950402515857655, 0.014048013245033112, 0.020511379481128196] and parameters: {'n_layers': 1, 'embedding_dim': 64, 'lr': 0.0005233015481570266, 'lambda_val': 0.0009443756499535536, 'batch_size': 664, 'optimizer': 'Adam'}.
2026-05-24 01:57:52,117 - experiment_functions - INFO - Early stopping at epoch 650. Best Metrics: (0.017586031172978106, 0.01376655629139073, 0.018412826840466762)
2026-05-24 01:57:52,251 - optuna.study.study - INFO - Trial 153 finished with values: [0.017586031172978106, 0.01376655629139073, 0.018412826840466762] and parameters: {'n_layers': 3, 'embedding_dim': 128, 'lr': 0.0007459913147507348, 'lambda_val': 0.00010466579371271554, 'batch_size': 2170, 'optimizer': 'RMSprop'}.
2026-05-24 01:57:58,816 - experiment_functions - INFO - Early stopping at epoch 550. Best Metrics: (0.01539930006505514, 0.011589403973509934, 0.015607221965418515)
2026-05-24 01:57:59,361 - optuna.study.study - INFO - Trial 154 finished with values: [0.01539930006505514, 0.011589403973509934, 0.015607221965418515] and parameters: {'n_layers': 1, 'embedding_dim': 96, 'lr': 0.005852380695113062, 'lambda_val': 0.00010466579371271554, 'batch_size': 4005, 'optimizer': 'Adam'}.
2026-05-24 01:58:18,686 - experiment_functions - INFO - Early stopping at epoch 1750. Best Metrics: (0.01794739387853764, 0.012806291390728478, 0.017419258478125012)
2026-05-24 01:58:19,335 - optuna.study.study - INFO - Trial 155 finished with values: [0.01794739387853764, 0.012806291390728478, 0.017419258478125012] and parameters: {'n_layers': 1, 'embedding_dim': 96, 'lr': 0.0003847621589190308, 'lambda_val': 1.1540981830430722e-05, 'batch_size': 3238, 'optimizer': 'RMSprop'}.
2026-05-24 01:58:26,005 - experiment_functions - INFO - Early stopping at epoch 500. Best Metrics: (0.008401449031337115, 0.007350993377483445, 0.009471385791387697)
2026-05-24 01:58:26,638 - optuna.study.study - INFO - Trial 156 finished with values: [0.008401449031337115, 0.007350993377483445, 0.009471385791387697] and parameters: {'n_layers': 4, 'embedding_dim': 96, 'lr': 0.029425386653355437, 'lambda_val': 0.0009443756499535536, 'batch_size': 3458, 'optimizer': 'RMSprop'}.
2026-05-24 01:58:34,618 - experiment_functions - INFO - Early stopping at epoch 600. Best Metrics: (0.022214978065760654, 0.016663907284768215, 0.022841772930153235)
2026-05-24 01:58:34,692 - optuna.study.study - INFO - Trial 157 finished with values: [0.022214978065760654, 0.016663907284768215, 0.022841772930153235] and parameters: {'n_layers': 4, 'embedding_dim': 64, 'lr': 0.003175767497275054, 'lambda_val': 1.1741946550104087e-06, 'batch_size': 567, 'optimizer': 'Adam'}.
2026-05-24 01:58:42,250 - experiment_functions - INFO - Early stopping at epoch 600. Best Metrics: (0.023873212440815906, 0.017988410596026492, 0.024931537416818438)
2026-05-24 01:58:42,333 - optuna.study.study - INFO - Trial 158 finished with values: [0.023873212440815906, 0.017988410596026492, 0.024931537416818438] and parameters: {'n_layers': 4, 'embedding_dim': 64, 'lr': 0.003175767497275054, 'lambda_val': 0.0009443756499535536, 'batch_size': 664, 'optimizer': 'Adam'}.
2026-05-24 01:58:49,602 - experiment_functions - INFO - Early stopping at epoch 600. Best Metrics: (0.01655989736263329, 0.01265728476821192, 0.01684265268664612)
2026-05-24 01:58:49,687 - optuna.study.study - INFO - Trial 159 finished with values: [0.01655989736263329, 0.01265728476821192, 0.01684265268664612] and parameters: {'n_layers': 2, 'embedding_dim': 96, 'lr': 0.0022746540627564204, 'lambda_val': 0.003473050661329218, 'batch_size': 3503, 'optimizer': 'Adam'}.
2026-05-24 01:59:01,454 - experiment_functions - INFO - Early stopping at epoch 1050. Best Metrics: (0.02062868868832186, 0.01600993377483444, 0.02105977153967725)
2026-05-24 01:59:01,544 - optuna.study.study - INFO - Trial 160 finished with values: [0.02062868868832186, 0.01600993377483444, 0.02105977153967725] and parameters: {'n_layers': 3, 'embedding_dim': 96, 'lr': 0.0005233015481570266, 'lambda_val': 2.582067375745636e-06, 'batch_size': 1385, 'optimizer': 'RMSprop'}.
2026-05-24 01:59:44,336 - optuna.study.study - INFO - Trial 161 finished with values: [0.018957523883069906, 0.015463576158940399, 0.019897471858732852] and parameters: {'n_layers': 4, 'embedding_dim': 64, 'lr': 0.00020698621093568563, 'lambda_val': 0.0007474419200611069, 'batch_size': 3717, 'optimizer': 'RMSprop'}.
2026-05-24 02:00:19,614 - experiment_functions - INFO - Early stopping at epoch 3350. Best Metrics: (0.017771497822843454, 0.012938741721854306, 0.018279008440724737)
2026-05-24 02:00:19,836 - optuna.study.study - INFO - Trial 162 finished with values: [0.017771497822843454, 0.012938741721854306, 0.018279008440724737] and parameters: {'n_layers': 1, 'embedding_dim': 32, 'lr': 0.0003847621589190308, 'lambda_val': 0.00034146769308132945, 'batch_size': 4005, 'optimizer': 'RMSprop'}.
2026-05-24 02:00:34,920 - experiment_functions - INFO - Early stopping at epoch 1350. Best Metrics: (0.021571775239015503, 0.017425496688741722, 0.02307907910779685)
2026-05-24 02:00:35,623 - optuna.study.study - INFO - Trial 163 finished with values: [0.021571775239015503, 0.017425496688741722, 0.02307907910779685] and parameters: {'n_layers': 4, 'embedding_dim': 96, 'lr': 0.00035899557766397706, 'lambda_val': 0.0009443756499535536, 'batch_size': 1393, 'optimizer': 'RMSprop'}.
2026-05-24 02:00:42,366 - experiment_functions - INFO - Early stopping at epoch 550. Best Metrics: (0.021729951585065785, 0.017491721854304636, 0.02284744281495411)
2026-05-24 02:00:42,447 - optuna.study.study - INFO - Trial 164 finished with values: [0.021729951585065785, 0.017491721854304636, 0.02284744281495411] and parameters: {'n_layers': 4, 'embedding_dim': 32, 'lr': 0.003175767497275054, 'lambda_val': 0.0009443756499535536, 'batch_size': 652, 'optimizer': 'RMSprop'}.
2026-05-24 02:00:52,042 - experiment_functions - INFO - Early stopping at epoch 850. Best Metrics: (0.017857689819503635, 0.013236754966887415, 0.018496978300290165)
2026-05-24 02:00:52,131 - optuna.study.study - INFO - Trial 165 finished with values: [0.017857689819503635, 0.013236754966887415, 0.018496978300290165] and parameters: {'n_layers': 1, 'embedding_dim': 96, 'lr': 0.0011689507386455319, 'lambda_val': 1.1540981830430722e-05, 'batch_size': 1777, 'optimizer': 'Adam'}.
2026-05-24 02:01:08,617 - experiment_functions - INFO - Early stopping at epoch 1500. Best Metrics: (0.02191166077698781, 0.01695364238410596, 0.02312671096570923)
2026-05-24 02:01:08,709 - optuna.study.study - INFO - Trial 166 finished with values: [0.02191166077698781, 0.01695364238410596, 0.02312671096570923] and parameters: {'n_layers': 3, 'embedding_dim': 96, 'lr': 0.0005233015481570266, 'lambda_val': 9.206863327207947e-05, 'batch_size': 652, 'optimizer': 'RMSprop'}.
2026-05-24 02:01:21,663 - experiment_functions - INFO - Early stopping at epoch 1150. Best Metrics: (0.021637768485470634, 0.016125827814569536, 0.02139119352907825)
2026-05-24 02:01:21,749 - optuna.study.study - INFO - Trial 167 finished with values: [0.021637768485470634, 0.016125827814569536, 0.02139119352907825] and parameters: {'n_layers': 3, 'embedding_dim': 64, 'lr': 0.0005233015481570266, 'lambda_val': 9.206863327207947e-05, 'batch_size': 1343, 'optimizer': 'RMSprop'}.
2026-05-24 02:01:30,942 - experiment_functions - INFO - Early stopping at epoch 800. Best Metrics: (0.01804804731164385, 0.013716887417218541, 0.01902788260982036)
2026-05-24 02:01:31,048 - optuna.study.study - INFO - Trial 168 finished with values: [0.01804804731164385, 0.013716887417218541, 0.01902788260982036] and parameters: {'n_layers': 2, 'embedding_dim': 64, 'lr': 0.001254073391314583, 'lambda_val': 0.012208803351137528, 'batch_size': 925, 'optimizer': 'Adam'}.
2026-05-24 02:01:40,499 - experiment_functions - INFO - Early stopping at epoch 800. Best Metrics: (0.0194203514715622, 0.015927152317880795, 0.02040215208099811)
2026-05-24 02:01:40,816 - optuna.study.study - INFO - Trial 169 finished with values: [0.0194203514715622, 0.015927152317880795, 0.02040215208099811] and parameters: {'n_layers': 4, 'embedding_dim': 96, 'lr': 0.0006783254829467676, 'lambda_val': 1.1741946550104087e-06, 'batch_size': 1661, 'optimizer': 'Adam'}.
2026-05-24 02:01:55,984 - experiment_functions - INFO - Early stopping at epoch 1350. Best Metrics: (0.02218648802967572, 0.01596026490066225, 0.021983219927828195)
2026-05-24 02:01:56,352 - optuna.study.study - INFO - Trial 170 finished with values: [0.02218648802967572, 0.01596026490066225, 0.021983219927828195] and parameters: {'n_layers': 3, 'embedding_dim': 96, 'lr': 0.0005233015481570266, 'lambda_val': 1.858625399381744e-05, 'batch_size': 652, 'optimizer': 'Adam'}.
2026-05-24 02:02:02,213 - experiment_functions - INFO - Early stopping at epoch 500. Best Metrics: (0.005415710722484231, 0.004155629139072848, 0.005368236846131831)
2026-05-24 02:02:02,671 - optuna.study.study - INFO - Trial 171 finished with values: [0.005415710722484231, 0.004155629139072848, 0.005368236846131831] and parameters: {'n_layers': 1, 'embedding_dim': 64, 'lr': 0.0007234729201278436, 'lambda_val': 0.008184547612188117, 'batch_size': 1146, 'optimizer': 'SGD'}.
2026-05-24 02:02:09,829 - experiment_functions - INFO - Early stopping at epoch 550. Best Metrics: (0.017050451188721352, 0.013758278145695363, 0.01768277945619206)
2026-05-24 02:02:10,200 - optuna.study.study - INFO - Trial 172 finished with values: [0.017050451188721352, 0.013758278145695363, 0.01768277945619206] and parameters: {'n_layers': 3, 'embedding_dim': 96, 'lr': 0.001254073391314583, 'lambda_val': 0.003592565815384345, 'batch_size': 3893, 'optimizer': 'RMSprop'}.
2026-05-24 02:02:47,976 - experiment_functions - INFO - Early stopping at epoch 3700. Best Metrics: (0.006525744214619194, 0.005240066225165563, 0.006592432989991771)
2026-05-24 02:02:48,065 - optuna.study.study - INFO - Trial 173 finished with values: [0.006525744214619194, 0.005240066225165563, 0.006592432989991771] and parameters: {'n_layers': 4, 'embedding_dim': 32, 'lr': 2.108257244004289e-05, 'lambda_val': 0.0009443756499535536, 'batch_size': 3592, 'optimizer': 'RMSprop'}.
2026-05-24 02:03:33,807 - optuna.study.study - INFO - Trial 174 finished with values: [0.006524786003611749, 0.005115894039735099, 0.006602705692351259] and parameters: {'n_layers': 4, 'embedding_dim': 256, 'lr': 1.4203003893447775e-05, 'lambda_val': 0.004825444205218699, 'batch_size': 2213, 'optimizer': 'Adam'}.
2026-05-24 02:03:43,971 - experiment_functions - INFO - Early stopping at epoch 950. Best Metrics: (0.004990166482670499, 0.004089403973509934, 0.005244617845003957)
2026-05-24 02:03:44,398 - optuna.study.study - INFO - Trial 175 finished with values: [0.004990166482670499, 0.004089403973509934, 0.005244617845003957] and parameters: {'n_layers': 1, 'embedding_dim': 96, 'lr': 0.003175767497275054, 'lambda_val': 1.1741946550104087e-06, 'batch_size': 2154, 'optimizer': 'SGD'}.
2026-05-24 02:04:26,796 - optuna.study.study - INFO - Trial 176 finished with values: [0.011784750956781267, 0.009776490066225165, 0.012509274485128234] and parameters: {'n_layers': 4, 'embedding_dim': 96, 'lr': 8.020158008431165e-05, 'lambda_val': 0.0007387756187328045, 'batch_size': 4005, 'optimizer': 'RMSprop'}.
2026-05-24 02:04:34,500 - experiment_functions - INFO - Early stopping at epoch 650. Best Metrics: (0.018729995215385452, 0.013178807947019866, 0.018317524013351464)
2026-05-24 02:04:34,591 - optuna.study.study - INFO - Trial 177 finished with values: [0.018729995215385452, 0.013178807947019866, 0.018317524013351464] and parameters: {'n_layers': 1, 'embedding_dim': 96, 'lr': 0.001254073391314583, 'lambda_val': 1.858625399381744e-05, 'batch_size': 1343, 'optimizer': 'RMSprop'}.
2026-05-24 02:04:46,682 - experiment_functions - INFO - Early stopping at epoch 1050. Best Metrics: (0.022324164073369696, 0.01812086092715232, 0.023537286552148522)
2026-05-24 02:04:46,963 - optuna.study.study - INFO - Trial 178 finished with values: [0.022324164073369696, 0.01812086092715232, 0.023537286552148522] and parameters: {'n_layers': 4, 'embedding_dim': 96, 'lr': 0.0003847621589190308, 'lambda_val': 0.005694292664597612, 'batch_size': 1343, 'optimizer': 'RMSprop'}.
2026-05-24 02:05:28,171 - optuna.study.study - INFO - Trial 179 finished with values: [0.009786748599191987, 0.007533112582781457, 0.009878735558496433] and parameters: {'n_layers': 4, 'embedding_dim': 96, 'lr': 6.244069885355123e-05, 'lambda_val': 1.1741946550104087e-06, 'batch_size': 1393, 'optimizer': 'RMSprop'}.
2026-05-24 02:05:38,616 - experiment_functions - INFO - Early stopping at epoch 900. Best Metrics: (0.022980684068293285, 0.017880794701986755, 0.02421839426607925)
2026-05-24 02:05:38,707 - optuna.study.study - INFO - Trial 180 finished with values: [0.022980684068293285, 0.017880794701986755, 0.02421839426607925] and parameters: {'n_layers': 3, 'embedding_dim': 32, 'lr': 0.001254073391314583, 'lambda_val': 0.0009443756499535536, 'batch_size': 652, 'optimizer': 'Adam'}.
2026-05-24 02:05:50,101 - experiment_functions - INFO - Early stopping at epoch 1000. Best Metrics: (0.021723996372379026, 0.017607615894039738, 0.023325862033169407)
2026-05-24 02:05:50,194 - optuna.study.study - INFO - Trial 181 finished with values: [0.021723996372379026, 0.017607615894039738, 0.023325862033169407] and parameters: {'n_layers': 4, 'embedding_dim': 96, 'lr': 0.0005233015481570266, 'lambda_val': 1.738144592818896e-06, 'batch_size': 1343, 'optimizer': 'Adam'}.
2026-05-24 02:06:30,905 - optuna.study.study - INFO - Trial 182 finished with values: [0.021317981756113137, 0.01456953642384106, 0.021523225547119804] and parameters: {'n_layers': 1, 'embedding_dim': 32, 'lr': 0.00035899557766397706, 'lambda_val': 0.0009443756499535536, 'batch_size': 1393, 'optimizer': 'Adam'}.
2026-05-24 02:06:45,174 - experiment_functions - INFO - Early stopping at epoch 1250. Best Metrics: (0.023161268608117673, 0.018228476821192052, 0.02430913470599084)
2026-05-24 02:06:45,880 - optuna.study.study - INFO - Trial 183 finished with values: [0.023161268608117673, 0.018228476821192052, 0.02430913470599084] and parameters: {'n_layers': 4, 'embedding_dim': 64, 'lr': 0.0005233015481570266, 'lambda_val': 0.0009443756499535536, 'batch_size': 652, 'optimizer': 'Adam'}.
2026-05-24 02:06:52,767 - experiment_functions - INFO - Early stopping at epoch 550. Best Metrics: (0.015550655529901434, 0.013153973509933775, 0.017034027134118633)
2026-05-24 02:06:52,851 - optuna.study.study - INFO - Trial 184 finished with values: [0.015550655529901434, 0.013153973509933775, 0.017034027134118633] and parameters: {'n_layers': 3, 'embedding_dim': 64, 'lr': 0.001254073391314583, 'lambda_val': 0.012208803351137528, 'batch_size': 3274, 'optimizer': 'RMSprop'}.
2026-05-24 02:06:59,662 - experiment_functions - INFO - Early stopping at epoch 550. Best Metrics: (0.019031117923275435, 0.014254966887417217, 0.0197065757640355)
2026-05-24 02:06:59,856 - optuna.study.study - INFO - Trial 185 finished with values: [0.019031117923275435, 0.014254966887417217, 0.0197065757640355] and parameters: {'n_layers': 2, 'embedding_dim': 64, 'lr': 0.003175767497275054, 'lambda_val': 1.1741946550104087e-06, 'batch_size': 847, 'optimizer': 'RMSprop'}.
2026-05-24 02:07:07,265 - experiment_functions - INFO - Early stopping at epoch 500. Best Metrics: (0.006769827143745555, 0.005745033112582782, 0.007104818324795454)
2026-05-24 02:07:07,727 - optuna.study.study - INFO - Trial 186 finished with values: [0.006769827143745555, 0.005745033112582782, 0.007104818324795454] and parameters: {'n_layers': 4, 'embedding_dim': 64, 'lr': 0.051206308255198674, 'lambda_val': 0.003592565815384345, 'batch_size': 925, 'optimizer': 'Adam'}.
2026-05-24 02:07:56,418 - optuna.study.study - INFO - Trial 187 finished with values: [0.013640486731748065, 0.010927152317880795, 0.014476278559195243] and parameters: {'n_layers': 2, 'embedding_dim': 256, 'lr': 0.0001329598595798264, 'lambda_val': 0.0031011395670577234, 'batch_size': 4005, 'optimizer': 'RMSprop'}.
2026-05-24 02:08:06,303 - experiment_functions - INFO - Early stopping at epoch 800. Best Metrics: (0.021779683114198558, 0.016572847682119207, 0.021554611217105446)
2026-05-24 02:08:06,401 - optuna.study.study - INFO - Trial 188 finished with values: [0.021779683114198558, 0.016572847682119207, 0.021554611217105446] and parameters: {'n_layers': 3, 'embedding_dim': 96, 'lr': 0.001254073391314583, 'lambda_val': 2.582067375745636e-06, 'batch_size': 652, 'optimizer': 'Adam'}.
2026-05-24 02:08:15,494 - experiment_functions - INFO - Early stopping at epoch 700. Best Metrics: (0.016922987436653946, 0.012723509933774833, 0.01779195489120702)
2026-05-24 02:08:15,683 - optuna.study.study - INFO - Trial 189 finished with values: [0.016922987436653946, 0.012723509933774833, 0.01779195489120702] and parameters: {'n_layers': 3, 'embedding_dim': 32, 'lr': 0.001254073391314583, 'lambda_val': 0.00010466579371271554, 'batch_size': 4026, 'optimizer': 'Adam'}.
2026-05-24 02:08:26,698 - experiment_functions - INFO - Early stopping at epoch 900. Best Metrics: (0.013785207347076276, 0.013228476821192055, 0.015571397093372212)
2026-05-24 02:08:26,894 - optuna.study.study - INFO - Trial 190 finished with values: [0.013785207347076276, 0.013228476821192055, 0.015571397093372212] and parameters: {'n_layers': 3, 'embedding_dim': 96, 'lr': 0.0007459913147507348, 'lambda_val': 0.09676237598324428, 'batch_size': 795, 'optimizer': 'RMSprop'}.
2026-05-24 02:08:37,087 - experiment_functions - INFO - Early stopping at epoch 850. Best Metrics: (0.017011571113306284, 0.013923841059602649, 0.01781953284680021)
2026-05-24 02:08:37,403 - optuna.study.study - INFO - Trial 191 finished with values: [0.017011571113306284, 0.013923841059602649, 0.01781953284680021] and parameters: {'n_layers': 3, 'embedding_dim': 96, 'lr': 0.0005233015481570266, 'lambda_val': 0.012208803351137528, 'batch_size': 4026, 'optimizer': 'Adam'}.
2026-05-24 02:08:43,765 - experiment_functions - INFO - Early stopping at epoch 500. Best Metrics: (0.008538575335230223, 0.006812913907284768, 0.008663374736768042)
