2026-05-24 00:14:29,672 - optuna.study.study - INFO - Trial 67 finished with values: [0.005506840877888897, 0.004254966887417219, 0.0054802150919001915] and parameters: {'n_layers': 4, 'embedding_dim': 64, 'lr': 0.0034624350757776097, 'lambda_val': 0.03613152482240985, 'batch_size': 2407, 'optimizer': 'SGD'}.
2026-05-24 00:14:36,015 - experiment_functions - INFO - Early stopping at epoch 500. Best Metrics: (0.004781965860158898, 0.0037168874172185434, 0.004758930278320394)
2026-05-24 00:14:36,111 - optuna.study.study - INFO - Trial 68 finished with values: [0.004781965860158898, 0.0037168874172185434, 0.004758930278320394] and parameters: {'n_layers': 3, 'embedding_dim': 32, 'lr': 0.00026443071767053033, 'lambda_val': 1.0204781504315092e-06, 'batch_size': 3873, 'optimizer': 'SGD'}.
2026-05-24 00:14:46,474 - experiment_functions - INFO - Early stopping at epoch 900. Best Metrics: (0.017972277410258315, 0.014511589403973511, 0.018464495808731027)
2026-05-24 00:14:46,990 - optuna.study.study - INFO - Trial 69 finished with values: [0.017972277410258315, 0.014511589403973511, 0.018464495808731027] and parameters: {'n_layers': 3, 'embedding_dim': 64, 'lr': 0.0006541077805531833, 'lambda_val': 0.0001712246865715635, 'batch_size': 3195, 'optimizer': 'RMSprop'}.
2026-05-24 00:14:59,128 - experiment_functions - INFO - Early stopping at epoch 1150. Best Metrics: (0.005840708271255912, 0.0061341059602649005, 0.007103997844644126)
2026-05-24 00:14:59,812 - optuna.study.study - INFO - Trial 70 finished with values: [0.005840708271255912, 0.0061341059602649005, 0.007103997844644126] and parameters: {'n_layers': 1, 'embedding_dim': 128, 'lr': 0.044206138096225325, 'lambda_val': 0.06649097652898797, 'batch_size': 3873, 'optimizer': 'RMSprop'}.
2026-05-24 00:15:05,924 - experiment_functions - INFO - Early stopping at epoch 500. Best Metrics: (0.009388184446888026, 0.007044701986754966, 0.009197818953018294)
2026-05-24 00:15:07,352 - optuna.study.study - INFO - Trial 71 finished with values: [0.009388184446888026, 0.007044701986754966, 0.009197818953018294] and parameters: {'n_layers': 4, 'embedding_dim': 96, 'lr': 0.022575574800972775, 'lambda_val': 0.0013678993343911928, 'batch_size': 2305, 'optimizer': 'RMSprop'}.
2026-05-24 00:15:47,546 - optuna.study.study - INFO - Trial 72 finished with values: [0.010592606684188354, 0.007657284768211921, 0.010860943923070727] and parameters: {'n_layers': 2, 'embedding_dim': 64, 'lr': 6.834661950878257e-05, 'lambda_val': 2.356034595653627e-06, 'batch_size': 2304, 'optimizer': 'Adam'}.
2026-05-24 00:15:57,324 - experiment_functions - INFO - Early stopping at epoch 550. Best Metrics: (0.01644085438919791, 0.012996688741721855, 0.017184543779979012)
2026-05-24 00:15:58,077 - optuna.study.study - INFO - Trial 73 finished with values: [0.01644085438919791, 0.012996688741721855, 0.017184543779979012] and parameters: {'n_layers': 3, 'embedding_dim': 32, 'lr': 0.009933626734169506, 'lambda_val': 3.480874613059374e-06, 'batch_size': 2828, 'optimizer': 'Adam'}.
2026-05-24 00:16:04,420 - experiment_functions - INFO - Early stopping at epoch 500. Best Metrics: (0.008044408388139013, 0.006067880794701988, 0.008287799669366349)
2026-05-24 00:16:05,727 - optuna.study.study - INFO - Trial 74 finished with values: [0.008044408388139013, 0.006067880794701988, 0.008287799669366349] and parameters: {'n_layers': 3, 'embedding_dim': 128, 'lr': 0.044206138096225325, 'lambda_val': 0.0006288901315672865, 'batch_size': 2357, 'optimizer': 'Adam'}.
2026-05-24 00:16:23,998 - experiment_functions - INFO - Early stopping at epoch 1650. Best Metrics: (0.0256183893189819, 0.019478476821192053, 0.02705786550732174)
2026-05-24 00:16:24,081 - optuna.study.study - INFO - Trial 75 finished with values: [0.0256183893189819, 0.019478476821192053, 0.02705786550732174] and parameters: {'n_layers': 4, 'embedding_dim': 96, 'lr': 0.00036341523831303154, 'lambda_val': 0.0019340508111572378, 'batch_size': 648, 'optimizer': 'RMSprop'}.
2026-05-24 00:16:31,903 - experiment_functions - INFO - Early stopping at epoch 700. Best Metrics: (0.004909025280148163, 0.004048013245033113, 0.005246992688207421)
2026-05-24 00:16:31,990 - optuna.study.study - INFO - Trial 76 finished with values: [0.004909025280148163, 0.004048013245033113, 0.005246992688207421] and parameters: {'n_layers': 2, 'embedding_dim': 64, 'lr': 0.004151503242019667, 'lambda_val': 2.356034595653627e-06, 'batch_size': 2347, 'optimizer': 'SGD'}.
2026-05-24 00:16:39,779 - experiment_functions - INFO - Early stopping at epoch 650. Best Metrics: (0.01863793352347589, 0.013816225165562914, 0.018360487063419903)
2026-05-24 00:16:39,869 - optuna.study.study - INFO - Trial 77 finished with values: [0.01863793352347589, 0.013816225165562914, 0.018360487063419903] and parameters: {'n_layers': 3, 'embedding_dim': 64, 'lr': 0.0011098194468142184, 'lambda_val': 0.00025938518502632895, 'batch_size': 3488, 'optimizer': 'RMSprop'}.
2026-05-24 00:16:47,595 - experiment_functions - INFO - Early stopping at epoch 650. Best Metrics: (0.017773140994301436, 0.012814569536423842, 0.0176892702647416)
2026-05-24 00:16:47,678 - optuna.study.study - INFO - Trial 78 finished with values: [0.017773140994301436, 0.012814569536423842, 0.0176892702647416] and parameters: {'n_layers': 1, 'embedding_dim': 128, 'lr': 0.0011608542213191663, 'lambda_val': 0.001970520642014681, 'batch_size': 1368, 'optimizer': 'RMSprop'}.
2026-05-24 00:16:58,086 - experiment_functions - INFO - Early stopping at epoch 1000. Best Metrics: (0.005602623980791512, 0.004263245033112583, 0.005516215921044855)
2026-05-24 00:16:58,266 - optuna.study.study - INFO - Trial 79 finished with values: [0.005602623980791512, 0.004263245033112583, 0.005516215921044855] and parameters: {'n_layers': 1, 'embedding_dim': 128, 'lr': 0.022561518980448614, 'lambda_val': 0.00022136029585900945, 'batch_size': 1697, 'optimizer': 'SGD'}.
2026-05-24 00:17:07,060 - experiment_functions - INFO - Early stopping at epoch 700. Best Metrics: (0.015481409773446883, 0.013476821192052981, 0.01694724729812285)
2026-05-24 00:17:07,140 - optuna.study.study - INFO - Trial 80 finished with values: [0.015481409773446883, 0.013476821192052981, 0.01694724729812285] and parameters: {'n_layers': 4, 'embedding_dim': 128, 'lr': 0.0005555935556782479, 'lambda_val': 2.082608826974409e-05, 'batch_size': 4045, 'optimizer': 'RMSprop'}.
2026-05-24 00:17:20,284 - experiment_functions - INFO - Early stopping at epoch 1150. Best Metrics: (0.01669007882773353, 0.014048013245033112, 0.018347412424614715)
2026-05-24 00:17:20,368 - optuna.study.study - INFO - Trial 81 finished with values: [0.01669007882773353, 0.014048013245033112, 0.018347412424614715] and parameters: {'n_layers': 3, 'embedding_dim': 128, 'lr': 0.00037394670395286464, 'lambda_val': 0.014393132529370842, 'batch_size': 1672, 'optimizer': 'Adam'}.
2026-05-24 00:17:27,237 - experiment_functions - INFO - Early stopping at epoch 550. Best Metrics: (0.01333958798781998, 0.010405629139072848, 0.01316261766886713)
2026-05-24 00:17:27,328 - optuna.study.study - INFO - Trial 82 finished with values: [0.01333958798781998, 0.010405629139072848, 0.01316261766886713] and parameters: {'n_layers': 2, 'embedding_dim': 256, 'lr': 0.011282769118477217, 'lambda_val': 9.589938618813186e-06, 'batch_size': 1220, 'optimizer': 'Adam'}.
2026-05-24 00:17:39,955 - experiment_functions - INFO - Early stopping at epoch 1100. Best Metrics: (0.019072909363722062, 0.016332781456953643, 0.021059714825350906)
2026-05-24 00:17:40,041 - optuna.study.study - INFO - Trial 83 finished with values: [0.019072909363722062, 0.016332781456953643, 0.021059714825350906] and parameters: {'n_layers': 4, 'embedding_dim': 96, 'lr': 0.00036341523831303154, 'lambda_val': 0.0019340508111572378, 'batch_size': 2078, 'optimizer': 'RMSprop'}.
2026-05-24 00:18:00,461 - experiment_functions - INFO - Early stopping at epoch 2050. Best Metrics: (0.005379464492049346, 0.004346026490066225, 0.005342946158963975)
2026-05-24 00:18:00,902 - optuna.study.study - INFO - Trial 84 finished with values: [0.005379464492049346, 0.004346026490066225, 0.005342946158963975] and parameters: {'n_layers': 1, 'embedding_dim': 64, 'lr': 0.07412567685347399, 'lambda_val': 5.7755449853545614e-05, 'batch_size': 2478, 'optimizer': 'SGD'}.
2026-05-24 00:18:08,456 - experiment_functions - INFO - Early stopping at epoch 650. Best Metrics: (0.01702703820777841, 0.012334437086092715, 0.017349710568282755)
2026-05-24 00:18:08,536 - optuna.study.study - INFO - Trial 85 finished with values: [0.01702703820777841, 0.012334437086092715, 0.017349710568282755] and parameters: {'n_layers': 1, 'embedding_dim': 128, 'lr': 0.0014918556660024908, 'lambda_val': 0.000258912702244631, 'batch_size': 1513, 'optimizer': 'RMSprop'}.
2026-05-24 00:18:15,849 - experiment_functions - INFO - Early stopping at epoch 600. Best Metrics: (0.0177495783652828, 0.013882450331125827, 0.01829969696176964)
2026-05-24 00:18:15,927 - optuna.study.study - INFO - Trial 86 finished with values: [0.0177495783652828, 0.013882450331125827, 0.01829969696176964] and parameters: {'n_layers': 2, 'embedding_dim': 128, 'lr': 0.0014918556660024908, 'lambda_val': 0.0001780893612713799, 'batch_size': 1047, 'optimizer': 'RMSprop'}.
2026-05-24 00:18:57,883 - optuna.study.study - INFO - Trial 87 finished with values: [0.006238705892658006, 0.005082781456953641, 0.006259729569443023] and parameters: {'n_layers': 4, 'embedding_dim': 128, 'lr': 1.6810189469506768e-05, 'lambda_val': 0.00019791296993912417, 'batch_size': 3450, 'optimizer': 'RMSprop'}.
2026-05-24 00:19:36,865 - optuna.study.study - INFO - Trial 88 finished with values: [0.00886245540264446, 0.006995033112582781, 0.009482706436122043] and parameters: {'n_layers': 1, 'embedding_dim': 64, 'lr': 8.44616289055697e-05, 'lambda_val': 2.837707861077738e-05, 'batch_size': 905, 'optimizer': 'Adam'}.
2026-05-24 00:19:42,871 - experiment_functions - INFO - Early stopping at epoch 500. Best Metrics: (0.005779150160655403, 0.004271523178807947, 0.005304418071981596)
2026-05-24 00:19:43,149 - optuna.study.study - INFO - Trial 89 finished with values: [0.005779150160655403, 0.004271523178807947, 0.005304418071981596] and parameters: {'n_layers': 1, 'embedding_dim': 256, 'lr': 0.001331662925963099, 'lambda_val': 1.3372687885744846e-06, 'batch_size': 1232, 'optimizer': 'SGD'}.
2026-05-24 00:19:49,788 - experiment_functions - INFO - Early stopping at epoch 550. Best Metrics: (0.013672394349791334, 0.010587748344370861, 0.013960393779185242)
2026-05-24 00:19:50,198 - optuna.study.study - INFO - Trial 90 finished with values: [0.013672394349791334, 0.010587748344370861, 0.013960393779185242] and parameters: {'n_layers': 1, 'embedding_dim': 256, 'lr': 0.001331662925963099, 'lambda_val': 1.3372687885744846e-06, 'batch_size': 3885, 'optimizer': 'RMSprop'}.
2026-05-24 00:20:29,110 - optuna.study.study - INFO - Trial 91 finished with values: [0.00752543953263041, 0.005761589403973509, 0.0075382416547962365] and parameters: {'n_layers': 1, 'embedding_dim': 32, 'lr': 4.010854274531064e-05, 'lambda_val': 0.00017589142357207576, 'batch_size': 1145, 'optimizer': 'RMSprop'}.
2026-05-24 00:20:39,660 - experiment_functions - INFO - Early stopping at epoch 950. Best Metrics: (0.018787734555487583, 0.015165562913907284, 0.019349156252203865)
2026-05-24 00:20:40,005 - optuna.study.study - INFO - Trial 92 finished with values: [0.018787734555487583, 0.015165562913907284, 0.019349156252203865] and parameters: {'n_layers': 3, 'embedding_dim': 32, 'lr': 0.0006541077805531833, 'lambda_val': 0.04529231618764749, 'batch_size': 2478, 'optimizer': 'Adam'}.
2026-05-24 00:20:53,773 - experiment_functions - INFO - Early stopping at epoch 1250. Best Metrics: (0.0192685630446744, 0.01525662251655629, 0.020154518189248887)
2026-05-24 00:20:53,860 - optuna.study.study - INFO - Trial 93 finished with values: [0.0192685630446744, 0.01525662251655629, 0.020154518189248887] and parameters: {'n_layers': 3, 'embedding_dim': 64, 'lr': 0.00037394670395286464, 'lambda_val': 0.014393132529370842, 'batch_size': 2049, 'optimizer': 'Adam'}.
2026-05-24 00:21:35,135 - optuna.study.study - INFO - Trial 94 finished with values: [0.006376536677152402, 0.005248344370860927, 0.006851006879719813] and parameters: {'n_layers': 4, 'embedding_dim': 96, 'lr': 2.662936711429196e-05, 'lambda_val': 0.005030349310374773, 'batch_size': 3620, 'optimizer': 'RMSprop'}.
2026-05-24 00:21:41,569 - experiment_functions - INFO - Early stopping at epoch 550. Best Metrics: (0.008094643105339375, 0.006804635761589404, 0.008543179636126321)
2026-05-24 00:21:42,427 - optuna.study.study - INFO - Trial 95 finished with values: [0.008094643105339375, 0.006804635761589404, 0.008543179636126321] and parameters: {'n_layers': 4, 'embedding_dim': 96, 'lr': 0.022575574800972775, 'lambda_val': 0.0013678993343911928, 'batch_size': 2284, 'optimizer': 'Adam'}.
2026-05-24 00:21:48,583 - experiment_functions - INFO - Early stopping at epoch 500. Best Metrics: (0.0054629715115049994, 0.004478476821192053, 0.005727685613705391)
2026-05-24 00:21:49,137 - optuna.study.study - INFO - Trial 96 finished with values: [0.0054629715115049994, 0.004478476821192053, 0.005727685613705391] and parameters: {'n_layers': 2, 'embedding_dim': 96, 'lr': 0.00027721075559978116, 'lambda_val': 3.8083999245059577e-06, 'batch_size': 2610, 'optimizer': 'SGD'}.
2026-05-24 00:21:55,762 - experiment_functions - INFO - Early stopping at epoch 550. Best Metrics: (0.010333615682540733, 0.008882450331125828, 0.0108214732753522)
2026-05-24 00:21:55,880 - optuna.study.study - INFO - Trial 97 finished with values: [0.010333615682540733, 0.008882450331125828, 0.0108214732753522] and parameters: {'n_layers': 2, 'embedding_dim': 128, 'lr': 0.007270486947253559, 'lambda_val': 0.02308568194072322, 'batch_size': 1396, 'optimizer': 'Adam'}.
2026-05-24 00:22:35,364 - optuna.study.study - INFO - Trial 98 finished with values: [0.012521434151963868, 0.009263245033112584, 0.012856708075042755] and parameters: {'n_layers': 1, 'embedding_dim': 32, 'lr': 0.00016981437705208634, 'lambda_val': 0.014893265033685234, 'batch_size': 905, 'optimizer': 'Adam'}.
2026-05-24 00:22:41,739 - experiment_functions - INFO - Early stopping at epoch 500. Best Metrics: (0.005779150160655403, 0.004271523178807947, 0.005304418071981596)
2026-05-24 00:22:42,922 - optuna.study.study - INFO - Trial 99 finished with values: [0.005779150160655403, 0.004271523178807947, 0.005304418071981596] and parameters: {'n_layers': 3, 'embedding_dim': 256, 'lr': 0.00026443071767053033, 'lambda_val': 0.008137939881123964, 'batch_size': 703, 'optimizer': 'SGD'}.
2026-05-24 00:22:57,255 - experiment_functions - INFO - Early stopping at epoch 1300. Best Metrics: (0.013776021680780145, 0.010645695364238412, 0.014159847657109667)
2026-05-24 00:22:57,334 - optuna.study.study - INFO - Trial 100 finished with values: [0.013776021680780145, 0.010645695364238412, 0.014159847657109667] and parameters: {'n_layers': 1, 'embedding_dim': 256, 'lr': 0.00037394670395286464, 'lambda_val': 0.007307127484225099, 'batch_size': 1938, 'optimizer': 'Adam'}.
2026-05-24 00:23:04,206 - experiment_functions - INFO - Early stopping at epoch 550. Best Metrics: (0.01634231358068395, 0.01317880794701987, 0.01708378396272934)
2026-05-24 00:23:04,284 - optuna.study.study - INFO - Trial 101 finished with values: [0.01634231358068395, 0.01317880794701987, 0.01708378396272934] and parameters: {'n_layers': 4, 'embedding_dim': 32, 'lr': 0.009933626734169506, 'lambda_val': 3.480874613059374e-06, 'batch_size': 2828, 'optimizer': 'Adam'}.
2026-05-24 00:23:12,109 - experiment_functions - INFO - Early stopping at epoch 650. Best Metrics: (0.019348191605112447, 0.014329470198675497, 0.019485931205719856)
2026-05-24 00:23:12,238 - optuna.study.study - INFO - Trial 102 finished with values: [0.019348191605112447, 0.014329470198675497, 0.019485931205719856] and parameters: {'n_layers': 3, 'embedding_dim': 128, 'lr': 0.0014918556660024908, 'lambda_val': 0.0001780893612713799, 'batch_size': 1702, 'optimizer': 'Adam'}.
2026-05-24 00:23:25,576 - experiment_functions - INFO - Early stopping at epoch 1300. Best Metrics: (0.005340534602821601, 0.004180463576158941, 0.0051444388018558156)
2026-05-24 00:23:25,662 - optuna.study.study - INFO - Trial 103 finished with values: [0.005340534602821601, 0.004180463576158941, 0.0051444388018558156] and parameters: {'n_layers': 1, 'embedding_dim': 96, 'lr': 0.06876339217839887, 'lambda_val': 0.00031880013656043093, 'batch_size': 565, 'optimizer': 'SGD'}.
2026-05-24 00:23:43,377 - experiment_functions - INFO - Early stopping at epoch 1700. Best Metrics: (0.007249716845895929, 0.0059768211920529805, 0.006948123592615375)
2026-05-24 00:23:43,840 - optuna.study.study - INFO - Trial 104 finished with values: [0.007249716845895929, 0.0059768211920529805, 0.006948123592615375] and parameters: {'n_layers': 1, 'embedding_dim': 256, 'lr': 0.0004234477311884154, 'lambda_val': 0.06649097652898797, 'batch_size': 2049, 'optimizer': 'Adam'}.
2026-05-24 00:23:53,974 - experiment_functions - INFO - Early stopping at epoch 800. Best Metrics: (0.01821334172922032, 0.013187086092715232, 0.01831227586197493)
2026-05-24 00:23:54,071 - optuna.study.study - INFO - Trial 105 finished with values: [0.01821334172922032, 0.013187086092715232, 0.01831227586197493] and parameters: {'n_layers': 2, 'embedding_dim': 64, 'lr': 0.0009899400191023119, 'lambda_val': 4.0551073365180215e-06, 'batch_size': 2049, 'optimizer': 'Adam'}.
2026-05-24 00:24:04,267 - experiment_functions - INFO - Early stopping at epoch 900. Best Metrics: (0.01897484558689831, 0.014478476821192054, 0.018844348589734664)
2026-05-24 00:24:04,353 - optuna.study.study - INFO - Trial 106 finished with values: [0.01897484558689831, 0.014478476821192054, 0.018844348589734664] and parameters: {'n_layers': 3, 'embedding_dim': 64, 'lr': 0.0006541077805531833, 'lambda_val': 0.014393132529370842, 'batch_size': 1672, 'optimizer': 'Adam'}.
2026-05-24 00:24:12,462 - experiment_functions - INFO - Early stopping at epoch 650. Best Metrics: (0.020983179720462364, 0.014875827814569538, 0.021130836707352798)
2026-05-24 00:24:12,556 - optuna.study.study - INFO - Trial 107 finished with values: [0.020983179720462364, 0.014875827814569538, 0.021130836707352798] and parameters: {'n_layers': 3, 'embedding_dim': 32, 'lr': 0.002281616661023266, 'lambda_val': 7.458121457299012e-06, 'batch_size': 1959, 'optimizer': 'Adam'}.
2026-05-24 00:24:29,043 - experiment_functions - INFO - Early stopping at epoch 1500. Best Metrics: (0.01949383441623438, 0.01568708609271523, 0.02067384537754938)
2026-05-24 00:24:29,171 - optuna.study.study - INFO - Trial 108 finished with values: [0.01949383441623438, 0.01568708609271523, 0.02067384537754938] and parameters: {'n_layers': 3, 'embedding_dim': 96, 'lr': 0.00036341523831303154, 'lambda_val': 0.0019340508111572378, 'batch_size': 1702, 'optimizer': 'RMSprop'}.
2026-05-24 00:25:10,267 - optuna.study.study - INFO - Trial 109 finished with values: [0.011109653486015177, 0.00810430463576159, 0.011673378210482966] and parameters: {'n_layers': 2, 'embedding_dim': 128, 'lr': 8.44616289055697e-05, 'lambda_val': 9.589938618813186e-06, 'batch_size': 2359, 'optimizer': 'Adam'}.
2026-05-24 00:25:16,721 - experiment_functions - INFO - Early stopping at epoch 550. Best Metrics: (0.01252583763422564, 0.010447019867549668, 0.013621001816761244)
2026-05-24 00:25:17,839 - optuna.study.study - INFO - Trial 110 finished with values: [0.01252583763422564, 0.010447019867549668, 0.013621001816761244] and parameters: {'n_layers': 2, 'embedding_dim': 128, 'lr': 0.0067266520126960895, 'lambda_val': 7.458121457299012e-06, 'batch_size': 1540, 'optimizer': 'RMSprop'}.
2026-05-24 00:25:53,358 - experiment_functions - INFO - Early stopping at epoch 3500. Best Metrics: (0.02000293155370996, 0.014031456953642383, 0.020345035727266897)
2026-05-24 00:25:53,439 - optuna.study.study - INFO - Trial 111 finished with values: [0.02000293155370996, 0.014031456953642383, 0.020345035727266897] and parameters: {'n_layers': 1, 'embedding_dim': 96, 'lr': 0.0003602499380989214, 'lambda_val': 4.0551073365180215e-06, 'batch_size': 648, 'optimizer': 'Adam'}.
2026-05-24 00:26:00,022 - experiment_functions - INFO - Early stopping at epoch 550. Best Metrics: (0.01059587614098443, 0.009172185430463577, 0.011329050516861814)
2026-05-24 00:26:00,647 - optuna.study.study - INFO - Trial 112 finished with values: [0.01059587614098443, 0.009172185430463577, 0.011329050516861814] and parameters: {'n_layers': 2, 'embedding_dim': 128, 'lr': 0.007270486947253559, 'lambda_val': 0.02308568194072322, 'batch_size': 1396, 'optimizer': 'Adam'}.
2026-05-24 00:26:09,206 - experiment_functions - INFO - Early stopping at epoch 750. Best Metrics: (0.016071372109242744, 0.011970198675496688, 0.016427352146942614)
2026-05-24 00:26:10,144 - optuna.study.study - INFO - Trial 113 finished with values: [0.016071372109242744, 0.011970198675496688, 0.016427352146942614] and parameters: {'n_layers': 1, 'embedding_dim': 128, 'lr': 0.0011608542213191663, 'lambda_val': 0.001970520642014681, 'batch_size': 2127, 'optimizer': 'Adam'}.
2026-05-24 00:26:20,422 - experiment_functions - INFO - Early stopping at epoch 900. Best Metrics: (0.016979484118459686, 0.01271523178807947, 0.016990512753192716)
2026-05-24 00:26:21,171 - optuna.study.study - INFO - Trial 114 finished with values: [0.016979484118459686, 0.01271523178807947, 0.016990512753192716] and parameters: {'n_layers': 2, 'embedding_dim': 64, 'lr': 0.0007132643500643846, 'lambda_val': 0.0010611752569816412, 'batch_size': 3488, 'optimizer': 'Adam'}.
2026-05-24 00:26:37,348 - experiment_functions - INFO - Early stopping at epoch 1500. Best Metrics: (0.020911537502942272, 0.016821192052980133, 0.022397244043860055)
