2026-05-24 16:01:15,087 - optuna.study.study - INFO - Trial 73 finished with values: [0.038950859342165176, 0.011390728476821191, 0.02922000850363701] and parameters: {'n_layers': 1, 'embedding_dim': 96, 'lr': 0.0012971109624756183, 'lambda_val': 5.897592552004812e-06, 'batch_size': 957, 'optimizer': 'RMSprop'}.
2026-05-24 16:01:23,874 - experiment_functions - INFO - Early stopping at epoch 650. Best Metrics: (0.0137082223191878, 0.005811258278145695, 0.010648564717466504)
2026-05-24 16:01:23,961 - optuna.study.study - INFO - Trial 74 finished with values: [0.0137082223191878, 0.005811258278145695, 0.010648564717466504] and parameters: {'n_layers': 4, 'embedding_dim': 256, 'lr': 0.00034279930379767936, 'lambda_val': 3.357239469878402e-06, 'batch_size': 3302, 'optimizer': 'RMSprop'}.
2026-05-24 16:01:41,912 - experiment_functions - INFO - Early stopping at epoch 1650. Best Metrics: (0.00513634320107404, 0.004105960264900663, 0.005040881931464838)
2026-05-24 16:01:41,999 - optuna.study.study - INFO - Trial 75 finished with values: [0.00513634320107404, 0.004105960264900663, 0.005040881931464838] and parameters: {'n_layers': 2, 'embedding_dim': 256, 'lr': 0.01346247069157871, 'lambda_val': 3.1140649076620497e-06, 'batch_size': 568, 'optimizer': 'SGD'}.
2026-05-24 16:01:47,891 - experiment_functions - INFO - Early stopping at epoch 500. Best Metrics: (0.004820849977868516, 0.003923841059602649, 0.005181097519125449)
2026-05-24 16:01:48,576 - optuna.study.study - INFO - Trial 76 finished with values: [0.004820849977868516, 0.003923841059602649, 0.005181097519125449] and parameters: {'n_layers': 3, 'embedding_dim': 96, 'lr': 0.0021417456859094968, 'lambda_val': 5.1867210986923296e-05, 'batch_size': 1102, 'optimizer': 'RMSprop'}.
2026-05-24 16:01:54,796 - experiment_functions - INFO - Early stopping at epoch 500. Best Metrics: (0.005771820312307638, 0.004420529801324504, 0.005999408753502465)
2026-05-24 16:01:54,952 - optuna.study.study - INFO - Trial 77 finished with values: [0.005771820312307638, 0.004420529801324504, 0.005999408753502465] and parameters: {'n_layers': 1, 'embedding_dim': 256, 'lr': 0.000250472043897201, 'lambda_val': 0.0001320099474533975, 'batch_size': 957, 'optimizer': 'SGD'}.
2026-05-24 16:02:02,063 - experiment_functions - INFO - Early stopping at epoch 500. Best Metrics: (0.004502323361716088, 0.004329470198675497, 0.005077700217350902)
2026-05-24 16:02:02,146 - optuna.study.study - INFO - Trial 78 finished with values: [0.004502323361716088, 0.004329470198675497, 0.005077700217350902] and parameters: {'n_layers': 4, 'embedding_dim': 256, 'lr': 0.0018120231467246312, 'lambda_val': 0.03747743535967019, 'batch_size': 3286, 'optimizer': 'RMSprop'}.
2026-05-24 16:02:07,960 - experiment_functions - INFO - Early stopping at epoch 500. Best Metrics: (0.005024566434036562, 0.003402317880794702, 0.004638480728991424)
2026-05-24 16:02:08,855 - optuna.study.study - INFO - Trial 79 finished with values: [0.005024566434036562, 0.003402317880794702, 0.004638480728991424] and parameters: {'n_layers': 1, 'embedding_dim': 96, 'lr': 0.005676961555550774, 'lambda_val': 0.0002812677361610648, 'batch_size': 3431, 'optimizer': 'RMSprop'}.
2026-05-24 16:02:15,324 - experiment_functions - INFO - Early stopping at epoch 550. Best Metrics: (0.03273512147536319, 0.010455298013245034, 0.02673295584494714)
2026-05-24 16:02:15,455 - optuna.study.study - INFO - Trial 80 finished with values: [0.03273512147536319, 0.010455298013245034, 0.02673295584494714] and parameters: {'n_layers': 1, 'embedding_dim': 32, 'lr': 0.0013118157271416449, 'lambda_val': 0.0016369859032536668, 'batch_size': 1638, 'optimizer': 'RMSprop'}.
2026-05-24 16:02:21,744 - experiment_functions - INFO - Early stopping at epoch 550. Best Metrics: (0.03328625352157981, 0.010322847682119206, 0.022169943941721573)
2026-05-24 16:02:21,835 - optuna.study.study - INFO - Trial 81 finished with values: [0.03328625352157981, 0.010322847682119206, 0.022169943941721573] and parameters: {'n_layers': 1, 'embedding_dim': 96, 'lr': 0.0012971109624756183, 'lambda_val': 0.002963141911784072, 'batch_size': 957, 'optimizer': 'RMSprop'}.
2026-05-24 16:02:37,029 - experiment_functions - INFO - Early stopping at epoch 1400. Best Metrics: (0.005902169273477815, 0.004544701986754968, 0.005863338269665332)
2026-05-24 16:02:37,277 - optuna.study.study - INFO - Trial 82 finished with values: [0.005902169273477815, 0.004544701986754968, 0.005863338269665332] and parameters: {'n_layers': 3, 'embedding_dim': 128, 'lr': 0.018430034786717567, 'lambda_val': 3.816471389387647e-06, 'batch_size': 1441, 'optimizer': 'SGD'}.
2026-05-24 16:02:45,341 - experiment_functions - INFO - Early stopping at epoch 700. Best Metrics: (0.004757935391221673, 0.004205298013245033, 0.005172981706593745)
2026-05-24 16:02:45,439 - optuna.study.study - INFO - Trial 83 finished with values: [0.004757935391221673, 0.004205298013245033, 0.005172981706593745] and parameters: {'n_layers': 1, 'embedding_dim': 256, 'lr': 2.5465185570619985e-05, 'lambda_val': 1.8068970237856796e-05, 'batch_size': 1193, 'optimizer': 'Adam'}.
2026-05-24 16:02:55,207 - experiment_functions - INFO - Early stopping at epoch 500. Best Metrics: (0.00383477490937174, 0.0035182119205298015, 0.004092459652048588)
2026-05-24 16:02:55,648 - optuna.study.study - INFO - Trial 84 finished with values: [0.00383477490937174, 0.0035182119205298015, 0.004092459652048588] and parameters: {'n_layers': 1, 'embedding_dim': 96, 'lr': 0.0025236562505997384, 'lambda_val': 0.012915602029765836, 'batch_size': 1178, 'optimizer': 'RMSprop'}.
2026-05-24 16:03:02,828 - experiment_functions - INFO - Early stopping at epoch 600. Best Metrics: (0.015274858310257678, 0.006407284768211921, 0.012390154034739751)
2026-05-24 16:03:02,969 - optuna.study.study - INFO - Trial 85 finished with values: [0.015274858310257678, 0.006407284768211921, 0.012390154034739751] and parameters: {'n_layers': 3, 'embedding_dim': 96, 'lr': 0.0008808558593337642, 'lambda_val': 0.0036449183117441544, 'batch_size': 1204, 'optimizer': 'Adam'}.
2026-05-24 16:03:08,956 - experiment_functions - INFO - Early stopping at epoch 500. Best Metrics: (0.0028243284215394683, 0.0028559602649006624, 0.0030654882215367394)
2026-05-24 16:03:09,069 - optuna.study.study - INFO - Trial 86 finished with values: [0.0028243284215394683, 0.0028559602649006624, 0.0030654882215367394] and parameters: {'n_layers': 3, 'embedding_dim': 32, 'lr': 0.026423056259768086, 'lambda_val': 0.0051198804126285635, 'batch_size': 2621, 'optimizer': 'RMSprop'}.
2026-05-24 16:03:15,106 - experiment_functions - INFO - Early stopping at epoch 500. Best Metrics: (0.005385595228021671, 0.004437086092715233, 0.00547396375585053)
2026-05-24 16:03:15,335 - optuna.study.study - INFO - Trial 87 finished with values: [0.005385595228021671, 0.004437086092715233, 0.00547396375585053] and parameters: {'n_layers': 3, 'embedding_dim': 64, 'lr': 2.5465185570619985e-05, 'lambda_val': 0.005762069964517917, 'batch_size': 1193, 'optimizer': 'RMSprop'}.
2026-05-24 16:03:24,982 - experiment_functions - INFO - Early stopping at epoch 850. Best Metrics: (0.008073044486665666, 0.0043708609271523174, 0.006738648286209091)
2026-05-24 16:03:25,730 - optuna.study.study - INFO - Trial 88 finished with values: [0.008073044486665666, 0.0043708609271523174, 0.006738648286209091] and parameters: {'n_layers': 3, 'embedding_dim': 64, 'lr': 0.0003004464644199072, 'lambda_val': 0.005762069964517917, 'batch_size': 2725, 'optimizer': 'Adam'}.
2026-05-24 16:03:31,769 - experiment_functions - INFO - Early stopping at epoch 500. Best Metrics: (0.0051700432104017655, 0.004370860927152318, 0.005533415979487605)
2026-05-24 16:03:32,312 - optuna.study.study - INFO - Trial 89 finished with values: [0.0051700432104017655, 0.004370860927152318, 0.005533415979487605] and parameters: {'n_layers': 2, 'embedding_dim': 32, 'lr': 7.874444646364451e-05, 'lambda_val': 1.2482171681838817e-06, 'batch_size': 3703, 'optimizer': 'RMSprop'}.
2026-05-24 16:03:39,940 - experiment_functions - INFO - Early stopping at epoch 550. Best Metrics: (0.013467520591035332, 0.005769867549668874, 0.010762093254106275)
2026-05-24 16:03:40,104 - optuna.study.study - INFO - Trial 90 finished with values: [0.013467520591035332, 0.005769867549668874, 0.010762093254106275] and parameters: {'n_layers': 4, 'embedding_dim': 256, 'lr': 0.0018120231467246312, 'lambda_val': 0.00031091903696978807, 'batch_size': 3302, 'optimizer': 'Adam'}.
2026-05-24 16:03:46,131 - experiment_functions - INFO - Early stopping at epoch 500. Best Metrics: (0.00513960622696281, 0.004213576158940397, 0.005357135099680766)
2026-05-24 16:03:47,221 - optuna.study.study - INFO - Trial 91 finished with values: [0.00513960622696281, 0.004213576158940397, 0.005357135099680766] and parameters: {'n_layers': 1, 'embedding_dim': 96, 'lr': 0.0025236562505997384, 'lambda_val': 0.03837915591350549, 'batch_size': 3968, 'optimizer': 'Adam'}.
2026-05-24 16:03:53,515 - experiment_functions - INFO - Early stopping at epoch 500. Best Metrics: (0.005684694517853599, 0.004263245033112583, 0.005483711215768477)
2026-05-24 16:03:53,757 - optuna.study.study - INFO - Trial 92 finished with values: [0.005684694517853599, 0.004263245033112583, 0.005483711215768477] and parameters: {'n_layers': 3, 'embedding_dim': 128, 'lr': 0.0012813711303675188, 'lambda_val': 1.0507083238458336e-05, 'batch_size': 2092, 'optimizer': 'SGD'}.
2026-05-24 16:04:00,293 - experiment_functions - INFO - Early stopping at epoch 500. Best Metrics: (0.005076485518898226, 0.004329470198675496, 0.005239189771193644)
2026-05-24 16:04:00,372 - optuna.study.study - INFO - Trial 93 finished with values: [0.005076485518898226, 0.004329470198675496, 0.005239189771193644] and parameters: {'n_layers': 4, 'embedding_dim': 128, 'lr': 1.21765111694503e-05, 'lambda_val': 5.977823492104949e-06, 'batch_size': 2928, 'optimizer': 'RMSprop'}.
2026-05-24 16:04:06,375 - experiment_functions - INFO - Early stopping at epoch 500. Best Metrics: (0.005445096514398896, 0.004197019867549669, 0.005293025811257463)
2026-05-24 16:04:07,346 - optuna.study.study - INFO - Trial 94 finished with values: [0.005445096514398896, 0.004197019867549669, 0.005293025811257463] and parameters: {'n_layers': 1, 'embedding_dim': 64, 'lr': 0.003049970906331462, 'lambda_val': 0.00646533282132623, 'batch_size': 3968, 'optimizer': 'SGD'}.
2026-05-24 16:04:13,338 - experiment_functions - INFO - Early stopping at epoch 500. Best Metrics: (0.0051066607426148705, 0.0041390728476821195, 0.0053561706486148115)
2026-05-24 16:04:13,655 - optuna.study.study - INFO - Trial 95 finished with values: [0.0051066607426148705, 0.0041390728476821195, 0.0053561706486148115] and parameters: {'n_layers': 1, 'embedding_dim': 32, 'lr': 0.00034279930379767936, 'lambda_val': 2.0549669964750215e-06, 'batch_size': 1638, 'optimizer': 'SGD'}.
2026-05-24 16:04:20,010 - experiment_functions - INFO - Early stopping at epoch 550. Best Metrics: (0.03788149255715326, 0.010918874172185433, 0.027248805641685737)
2026-05-24 16:04:20,109 - optuna.study.study - INFO - Trial 96 finished with values: [0.03788149255715326, 0.010918874172185433, 0.027248805641685737] and parameters: {'n_layers': 1, 'embedding_dim': 128, 'lr': 0.00532575854276696, 'lambda_val': 2.523449139198518e-05, 'batch_size': 2725, 'optimizer': 'Adam'}.
2026-05-24 16:04:26,075 - experiment_functions - INFO - Early stopping at epoch 500. Best Metrics: (0.008910922503109677, 0.004428807947019868, 0.007253510008285066)
2026-05-24 16:04:27,156 - optuna.study.study - INFO - Trial 97 finished with values: [0.008910922503109677, 0.004428807947019868, 0.007253510008285066] and parameters: {'n_layers': 3, 'embedding_dim': 32, 'lr': 0.0158370886721598, 'lambda_val': 1.2584008258141712e-05, 'batch_size': 3282, 'optimizer': 'RMSprop'}.
2026-05-24 16:04:33,136 - experiment_functions - INFO - Early stopping at epoch 500. Best Metrics: (0.009928849705834379, 0.004437086092715232, 0.008451280124817624)
2026-05-24 16:04:33,686 - optuna.study.study - INFO - Trial 98 finished with values: [0.009928849705834379, 0.004437086092715232, 0.008451280124817624] and parameters: {'n_layers': 2, 'embedding_dim': 128, 'lr': 0.012446049552260335, 'lambda_val': 3.574372440847579e-05, 'batch_size': 1349, 'optimizer': 'RMSprop'}.
2026-05-24 16:04:40,182 - experiment_functions - INFO - Early stopping at epoch 550. Best Metrics: (0.038399187041528414, 0.011183774834437088, 0.029602808276997693)
2026-05-24 16:04:40,682 - optuna.study.study - INFO - Trial 99 finished with values: [0.038399187041528414, 0.011183774834437088, 0.029602808276997693] and parameters: {'n_layers': 1, 'embedding_dim': 96, 'lr': 0.004670639334296862, 'lambda_val': 1.1594147319583239e-05, 'batch_size': 2725, 'optimizer': 'Adam'}.
2026-05-24 16:04:46,718 - experiment_functions - INFO - Early stopping at epoch 500. Best Metrics: (0.005576999684078434, 0.004254966887417219, 0.005384645965822618)
2026-05-24 16:04:46,820 - optuna.study.study - INFO - Trial 100 finished with values: [0.005576999684078434, 0.004254966887417219, 0.005384645965822618] and parameters: {'n_layers': 1, 'embedding_dim': 96, 'lr': 0.0012971109624756183, 'lambda_val': 5.897592552004812e-06, 'batch_size': 2702, 'optimizer': 'SGD'}.
2026-05-24 16:04:58,140 - experiment_functions - INFO - Early stopping at epoch 700. Best Metrics: (0.009092624699515047, 0.004726821192052981, 0.00782679186089391)
2026-05-24 16:04:58,227 - optuna.study.study - INFO - Trial 101 finished with values: [0.009092624699515047, 0.004726821192052981, 0.00782679186089391] and parameters: {'n_layers': 3, 'embedding_dim': 32, 'lr': 0.0008808558593337642, 'lambda_val': 1.1594147319583239e-05, 'batch_size': 1204, 'optimizer': 'Adam'}.
2026-05-24 16:05:04,691 - experiment_functions - INFO - Early stopping at epoch 550. Best Metrics: (0.039632303724212385, 0.011415562913907286, 0.028981000233972258)
2026-05-24 16:05:05,179 - optuna.study.study - INFO - Trial 102 finished with values: [0.039632303724212385, 0.011415562913907286, 0.028981000233972258] and parameters: {'n_layers': 1, 'embedding_dim': 96, 'lr': 0.00532575854276696, 'lambda_val': 1.1594147319583239e-05, 'batch_size': 2725, 'optimizer': 'Adam'}.
2026-05-24 16:05:12,658 - experiment_functions - INFO - Early stopping at epoch 650. Best Metrics: (0.04208894830700862, 0.012723509933774836, 0.030549181122384136)
2026-05-24 16:05:12,749 - optuna.study.study - INFO - Trial 103 finished with values: [0.04208894830700862, 0.012723509933774836, 0.030549181122384136] and parameters: {'n_layers': 1, 'embedding_dim': 96, 'lr': 0.0010413911280538683, 'lambda_val': 0.0005068128991295962, 'batch_size': 1204, 'optimizer': 'Adam'}.
2026-05-24 16:05:19,859 - experiment_functions - INFO - Early stopping at epoch 500. Best Metrics: (0.005379484458550015, 0.004064569536423841, 0.005417109393911526)
2026-05-24 16:05:19,933 - optuna.study.study - INFO - Trial 104 finished with values: [0.005379484458550015, 0.004064569536423841, 0.005417109393911526] and parameters: {'n_layers': 4, 'embedding_dim': 256, 'lr': 0.0003004464644199072, 'lambda_val': 0.0013195704923554623, 'batch_size': 2725, 'optimizer': 'SGD'}.
2026-05-24 16:05:27,639 - experiment_functions - INFO - Early stopping at epoch 650. Best Metrics: (0.03813868856893291, 0.011283112582781458, 0.029345743681325635)
2026-05-24 16:05:27,719 - optuna.study.study - INFO - Trial 105 finished with values: [0.03813868856893291, 0.011283112582781458, 0.029345743681325635] and parameters: {'n_layers': 1, 'embedding_dim': 128, 'lr': 0.0007065318271795035, 'lambda_val': 5.897592552004812e-06, 'batch_size': 3431, 'optimizer': 'Adam'}.
2026-05-24 16:05:33,554 - experiment_functions - INFO - Early stopping at epoch 500. Best Metrics: (0.0033626587842978785, 0.0028476821192052987, 0.0032732863080694387)
2026-05-24 16:05:34,095 - optuna.study.study - INFO - Trial 106 finished with values: [0.0033626587842978785, 0.0028476821192052987, 0.0032732863080694387] and parameters: {'n_layers': 2, 'embedding_dim': 64, 'lr': 0.0248881240937421, 'lambda_val': 0.005762069964517917, 'batch_size': 2740, 'optimizer': 'RMSprop'}.
2026-05-24 16:05:40,063 - experiment_functions - INFO - Early stopping at epoch 500. Best Metrics: (0.006448264850388584, 0.004346026490066225, 0.005819273335078791)
2026-05-24 16:05:40,909 - optuna.study.study - INFO - Trial 107 finished with values: [0.006448264850388584, 0.004346026490066225, 0.005819273335078791] and parameters: {'n_layers': 1, 'embedding_dim': 32, 'lr': 0.0003004464644199072, 'lambda_val': 3.357239469878402e-06, 'batch_size': 2725, 'optimizer': 'SGD'}.
2026-05-24 16:06:21,589 - optuna.study.study - INFO - Trial 108 finished with values: [0.02911171494941499, 0.00978476821192053, 0.02333322441227864] and parameters: {'n_layers': 2, 'embedding_dim': 96, 'lr': 7.874444646364451e-05, 'lambda_val': 1.2482171681838817e-06, 'batch_size': 736, 'optimizer': 'Adam'}.
2026-05-24 16:06:39,752 - experiment_functions - INFO - Early stopping at epoch 1750. Best Metrics: (0.041525112334976855, 0.01269867549668874, 0.030412374840883882)
2026-05-24 16:06:39,840 - optuna.study.study - INFO - Trial 109 finished with values: [0.041525112334976855, 0.01269867549668874, 0.030412374840883882] and parameters: {'n_layers': 1, 'embedding_dim': 32, 'lr': 0.00034279930379767936, 'lambda_val': 2.291507926580009e-06, 'batch_size': 1638, 'optimizer': 'Adam'}.
2026-05-24 16:06:46,223 - experiment_functions - INFO - Early stopping at epoch 500. Best Metrics: (0.004859200419597582, 0.003998344370860928, 0.004811802131779028)
2026-05-24 16:06:46,526 - optuna.study.study - INFO - Trial 110 finished with values: [0.004859200419597582, 0.003998344370860928, 0.004811802131779028] and parameters: {'n_layers': 2, 'embedding_dim': 256, 'lr': 0.00034279930379767936, 'lambda_val': 3.357239469878402e-06, 'batch_size': 3302, 'optimizer': 'SGD'}.
2026-05-24 16:06:52,650 - experiment_functions - INFO - Early stopping at epoch 500. Best Metrics: (0.01797296725299539, 0.006663907284768212, 0.015619488314915502)
2026-05-24 16:06:53,174 - optuna.study.study - INFO - Trial 111 finished with values: [0.01797296725299539, 0.006663907284768212, 0.015619488314915502] and parameters: {'n_layers': 2, 'embedding_dim': 96, 'lr': 0.02431450470115027, 'lambda_val': 1.2482171681838817e-06, 'batch_size': 3431, 'optimizer': 'RMSprop'}.
2026-05-24 16:07:28,015 - experiment_functions - INFO - Early stopping at epoch 3400. Best Metrics: (0.0446082785570907, 0.013087748344370863, 0.03267002186906508)
2026-05-24 16:07:28,896 - optuna.study.study - INFO - Trial 112 finished with values: [0.0446082785570907, 0.013087748344370863, 0.03267002186906508] and parameters: {'n_layers': 1, 'embedding_dim': 128, 'lr': 0.00014827150350050635, 'lambda_val': 5.897592552004812e-06, 'batch_size': 1909, 'optimizer': 'RMSprop'}.
2026-05-24 16:07:35,118 - experiment_functions - INFO - Early stopping at epoch 500. Best Metrics: (0.005087632612577838, 0.004254966887417219, 0.005536936104192456)
2026-05-24 16:07:36,400 - optuna.study.study - INFO - Trial 113 finished with values: [0.005087632612577838, 0.004254966887417219, 0.005536936104192456] and parameters: {'n_layers': 1, 'embedding_dim': 32, 'lr': 0.00532575854276696, 'lambda_val': 0.06022702626961316, 'batch_size': 1204, 'optimizer': 'Adam'}.
2026-05-24 16:07:43,167 - experiment_functions - INFO - Early stopping at epoch 500. Best Metrics: (0.005132247996192388, 0.003965231788079471, 0.00531828341310286)
2026-05-24 16:07:43,550 - optuna.study.study - INFO - Trial 114 finished with values: [0.005132247996192388, 0.003965231788079471, 0.00531828341310286] and parameters: {'n_layers': 4, 'embedding_dim': 64, 'lr': 0.0006602503237283403, 'lambda_val': 0.059508761930091914, 'batch_size': 4077, 'optimizer': 'RMSprop'}.
2026-05-24 16:07:50,484 - experiment_functions - INFO - Early stopping at epoch 500. Best Metrics: (0.010514290789746455, 0.0044950331125827815, 0.008407968724720336)
2026-05-24 16:07:52,315 - optuna.study.study - INFO - Trial 115 finished with values: [0.010514290789746455, 0.0044950331125827815, 0.008407968724720336] and parameters: {'n_layers': 2, 'embedding_dim': 128, 'lr': 0.012446049552260335, 'lambda_val': 3.574372440847579e-05, 'batch_size': 1349, 'optimizer': 'RMSprop'}.
2026-05-24 16:08:02,488 - experiment_functions - INFO - Early stopping at epoch 600. Best Metrics: (0.005756906390523104, 0.0040149006622516555, 0.005238920109119276)
2026-05-24 16:08:02,798 - optuna.study.study - INFO - Trial 116 finished with values: [0.005756906390523104, 0.0040149006622516555, 0.005238920109119276] and parameters: {'n_layers': 3, 'embedding_dim': 64, 'lr': 3.8865217538872076e-05, 'lambda_val': 0.008431393831705438, 'batch_size': 2725, 'optimizer': 'Adam'}.
2026-05-24 16:08:09,302 - experiment_functions - INFO - Early stopping at epoch 550. Best Metrics: (0.039552021066866595, 0.01179635761589404, 0.027759842200930168)
2026-05-24 16:08:09,397 - optuna.study.study - INFO - Trial 117 finished with values: [0.039552021066866595, 0.01179635761589404, 0.027759842200930168] and parameters: {'n_layers': 1, 'embedding_dim': 96, 'lr': 0.0012971109624756183, 'lambda_val': 5.897592552004812e-06, 'batch_size': 962, 'optimizer': 'RMSprop'}.
2026-05-24 16:08:15,778 - experiment_functions - INFO - Early stopping at epoch 550. Best Metrics: (0.043510209599955045, 0.012855960264900664, 0.03015972213562116)
2026-05-24 16:08:15,855 - optuna.study.study - INFO - Trial 118 finished with values: [0.043510209599955045, 0.012855960264900664, 0.03015972213562116] and parameters: {'n_layers': 1, 'embedding_dim': 96, 'lr': 0.0038122363815175056, 'lambda_val': 0.002332362722517884, 'batch_size': 1062, 'optimizer': 'Adam'}.
2026-05-24 16:08:22,215 - experiment_functions - INFO - Early stopping at epoch 550. Best Metrics: (0.039424489566493054, 0.011854304635761589, 0.028213678500595047)
