2026-05-24 04:46:40,564 - optuna.study.study - INFO - Trial 208 finished with values: [0.022731849797716874, 0.01802980132450331, 0.023697047809230307] and parameters: {'n_layers': 4, 'embedding_dim': 32, 'lr': 0.0002960115862018489, 'lambda_val': 6.677790881496428e-05, 'batch_size': 1248, 'optimizer': 'RMSprop'}.
2026-05-24 04:46:48,523 - experiment_functions - INFO - Early stopping at epoch 700. Best Metrics: (0.0193345145417978, 0.015571192052980133, 0.020584439330336567)
2026-05-24 04:46:48,622 - optuna.study.study - INFO - Trial 209 finished with values: [0.0193345145417978, 0.015571192052980133, 0.020584439330336567] and parameters: {'n_layers': 4, 'embedding_dim': 64, 'lr': 0.0010345450541168627, 'lambda_val': 0.006602781665907601, 'batch_size': 2271, 'optimizer': 'Adam'}.
2026-05-24 04:47:27,598 - optuna.study.study - INFO - Trial 210 finished with values: [0.02023938851028487, 0.014188741721854307, 0.020372851254891928] and parameters: {'n_layers': 2, 'embedding_dim': 32, 'lr': 0.0002960115862018489, 'lambda_val': 0.0029344298742113367, 'batch_size': 642, 'optimizer': 'Adam'}.
2026-05-24 04:47:41,171 - experiment_functions - INFO - Early stopping at epoch 1200. Best Metrics: (0.023970082881091124, 0.017235099337748343, 0.024241502308350045)
2026-05-24 04:47:41,255 - optuna.study.study - INFO - Trial 211 finished with values: [0.023970082881091124, 0.017235099337748343, 0.024241502308350045] and parameters: {'n_layers': 3, 'embedding_dim': 32, 'lr': 0.0007924927231928422, 'lambda_val': 1.788497394454551e-05, 'batch_size': 764, 'optimizer': 'Adam'}.
2026-05-24 04:48:22,234 - optuna.study.study - INFO - Trial 212 finished with values: [0.018249259524361267, 0.013137417218543045, 0.01844918848793283] and parameters: {'n_layers': 2, 'embedding_dim': 128, 'lr': 0.0002960115862018489, 'lambda_val': 0.0001107972598738893, 'batch_size': 764, 'optimizer': 'Adam'}.
2026-05-24 04:48:49,408 - experiment_functions - INFO - Early stopping at epoch 2500. Best Metrics: (0.01873619047676665, 0.01495860927152318, 0.019476814477406845)
2026-05-24 04:48:49,618 - optuna.study.study - INFO - Trial 213 finished with values: [0.01873619047676665, 0.01495860927152318, 0.019476814477406845] and parameters: {'n_layers': 4, 'embedding_dim': 32, 'lr': 0.0002960115862018489, 'lambda_val': 6.677790881496428e-05, 'batch_size': 3659, 'optimizer': 'Adam'}.
2026-05-24 04:48:59,065 - experiment_functions - INFO - Early stopping at epoch 800. Best Metrics: (0.02269052067731546, 0.01691225165562914, 0.023181532020667903)
2026-05-24 04:48:59,183 - optuna.study.study - INFO - Trial 214 finished with values: [0.02269052067731546, 0.01691225165562914, 0.023181532020667903] and parameters: {'n_layers': 4, 'embedding_dim': 32, 'lr': 0.0010345450541168627, 'lambda_val': 2.571811162691067e-06, 'batch_size': 1735, 'optimizer': 'Adam'}.
2026-05-24 04:49:05,988 - experiment_functions - INFO - Early stopping at epoch 550. Best Metrics: (0.020439761338503008, 0.01663907284768212, 0.02172128107710231)
2026-05-24 04:49:06,096 - optuna.study.study - INFO - Trial 215 finished with values: [0.020439761338503008, 0.01663907284768212, 0.02172128107710231] and parameters: {'n_layers': 4, 'embedding_dim': 32, 'lr': 0.01077799789721169, 'lambda_val': 0.0012311986942485985, 'batch_size': 764, 'optimizer': 'Adam'}.
2026-05-24 04:49:13,902 - experiment_functions - INFO - Early stopping at epoch 650. Best Metrics: (0.019647301417108454, 0.0163658940397351, 0.02081071591324382)
2026-05-24 04:49:13,993 - optuna.study.study - INFO - Trial 216 finished with values: [0.019647301417108454, 0.0163658940397351, 0.02081071591324382] and parameters: {'n_layers': 4, 'embedding_dim': 64, 'lr': 0.0013524049945715497, 'lambda_val': 0.030528649183713095, 'batch_size': 1829, 'optimizer': 'Adam'}.
2026-05-24 04:49:20,834 - experiment_functions - INFO - Early stopping at epoch 550. Best Metrics: (0.012833860220966971, 0.011026490066225164, 0.013745666147346434)
2026-05-24 04:49:20,927 - optuna.study.study - INFO - Trial 217 finished with values: [0.012833860220966971, 0.011026490066225164, 0.013745666147346434] and parameters: {'n_layers': 4, 'embedding_dim': 64, 'lr': 0.004252739291874352, 'lambda_val': 6.677790881496428e-05, 'batch_size': 2077, 'optimizer': 'RMSprop'}.
2026-05-24 04:49:29,698 - experiment_functions - INFO - Early stopping at epoch 800. Best Metrics: (0.005107542199819252, 0.004188741721854305, 0.00529207584876807)
2026-05-24 04:49:29,819 - optuna.study.study - INFO - Trial 218 finished with values: [0.005107542199819252, 0.004188741721854305, 0.00529207584876807] and parameters: {'n_layers': 2, 'embedding_dim': 32, 'lr': 0.0007366841828777069, 'lambda_val': 0.0029344298742113367, 'batch_size': 642, 'optimizer': 'SGD'}.
2026-05-24 04:49:59,738 - experiment_functions - INFO - Early stopping at epoch 2700. Best Metrics: (0.02247713759088702, 0.017922185430463575, 0.02351769111082753)
2026-05-24 04:50:00,676 - optuna.study.study - INFO - Trial 219 finished with values: [0.02247713759088702, 0.017922185430463575, 0.02351769111082753] and parameters: {'n_layers': 4, 'embedding_dim': 64, 'lr': 0.0002960115862018489, 'lambda_val': 0.0012311986942485985, 'batch_size': 1199, 'optimizer': 'Adam'}.
2026-05-24 04:50:09,871 - experiment_functions - INFO - Early stopping at epoch 750. Best Metrics: (0.013996357122009107, 0.011432119205298016, 0.014729712181843522)
2026-05-24 04:50:10,070 - optuna.study.study - INFO - Trial 220 finished with values: [0.013996357122009107, 0.011432119205298016, 0.014729712181843522] and parameters: {'n_layers': 2, 'embedding_dim': 256, 'lr': 0.0005361654985379109, 'lambda_val': 0.010157868861362357, 'batch_size': 1744, 'optimizer': 'RMSprop'}.
2026-05-24 04:50:16,699 - experiment_functions - INFO - Early stopping at epoch 550. Best Metrics: (0.014045093402164173, 0.012110927152317881, 0.015518579253056747)
2026-05-24 04:50:16,939 - optuna.study.study - INFO - Trial 221 finished with values: [0.014045093402164173, 0.012110927152317881, 0.015518579253056747] and parameters: {'n_layers': 4, 'embedding_dim': 32, 'lr': 0.01885228744931732, 'lambda_val': 0.0012311986942485985, 'batch_size': 1248, 'optimizer': 'Adam'}.
2026-05-24 04:50:35,699 - experiment_functions - INFO - Early stopping at epoch 1500. Best Metrics: (0.020965954446565228, 0.01644867549668874, 0.021719241157422357)
2026-05-24 04:50:35,805 - optuna.study.study - INFO - Trial 222 finished with values: [0.020965954446565228, 0.01644867549668874, 0.021719241157422357] and parameters: {'n_layers': 4, 'embedding_dim': 256, 'lr': 0.0002960115862018489, 'lambda_val': 0.0001107972598738893, 'batch_size': 796, 'optimizer': 'Adam'}.
2026-05-24 04:51:16,423 - optuna.study.study - INFO - Trial 223 finished with values: [0.00848100722965445, 0.00718543046357616, 0.009088941834118708] and parameters: {'n_layers': 4, 'embedding_dim': 64, 'lr': 6.621780131160365e-05, 'lambda_val': 0.00018345094471298125, 'batch_size': 642, 'optimizer': 'RMSprop'}.
2026-05-24 04:51:38,618 - experiment_functions - INFO - Early stopping at epoch 2050. Best Metrics: (0.022406358826707863, 0.018294701986754966, 0.0238197294259359)
2026-05-24 04:51:38,937 - optuna.study.study - INFO - Trial 224 finished with values: [0.022406358826707863, 0.018294701986754966, 0.0238197294259359] and parameters: {'n_layers': 4, 'embedding_dim': 32, 'lr': 0.0002960115862018489, 'lambda_val': 0.017024035419790078, 'batch_size': 1970, 'optimizer': 'RMSprop'}.
2026-05-24 04:51:46,284 - experiment_functions - INFO - Early stopping at epoch 600. Best Metrics: (0.016083798194553602, 0.012582781456953643, 0.01608585724849064)
2026-05-24 04:51:46,392 - optuna.study.study - INFO - Trial 225 finished with values: [0.016083798194553602, 0.012582781456953643, 0.01608585724849064] and parameters: {'n_layers': 2, 'embedding_dim': 64, 'lr': 0.0013524049945715497, 'lambda_val': 0.030528649183713095, 'batch_size': 1735, 'optimizer': 'RMSprop'}.
2026-05-24 04:52:28,066 - optuna.study.study - INFO - Trial 226 finished with values: [0.005140219817209253, 0.004205298013245033, 0.00526239785168953] and parameters: {'n_layers': 4, 'embedding_dim': 128, 'lr': 1.0519078042714147e-05, 'lambda_val': 1.788497394454551e-05, 'batch_size': 642, 'optimizer': 'Adam'}.
2026-05-24 04:52:37,973 - experiment_functions - INFO - Early stopping at epoch 850. Best Metrics: (0.01879349221838528, 0.01419701986754967, 0.019258093827123055)
2026-05-24 04:52:38,087 - optuna.study.study - INFO - Trial 227 finished with values: [0.01879349221838528, 0.01419701986754967, 0.019258093827123055] and parameters: {'n_layers': 3, 'embedding_dim': 32, 'lr': 0.0009922360437194923, 'lambda_val': 1.788497394454551e-05, 'batch_size': 2574, 'optimizer': 'Adam'}.
2026-05-24 04:52:47,594 - experiment_functions - INFO - Early stopping at epoch 800. Best Metrics: (0.01549493239883248, 0.013211920529801325, 0.016703072083598162)
2026-05-24 04:52:48,587 - optuna.study.study - INFO - Trial 228 finished with values: [0.01549493239883248, 0.013211920529801325, 0.016703072083598162] and parameters: {'n_layers': 3, 'embedding_dim': 96, 'lr': 0.0007924927231928422, 'lambda_val': 0.030528649183713095, 'batch_size': 1735, 'optimizer': 'Adam'}.
2026-05-24 04:52:56,997 - experiment_functions - INFO - Early stopping at epoch 700. Best Metrics: (0.021809969905539375, 0.017822847682119208, 0.02290285002033058)
2026-05-24 04:52:57,097 - optuna.study.study - INFO - Trial 229 finished with values: [0.021809969905539375, 0.017822847682119208, 0.02290285002033058] and parameters: {'n_layers': 4, 'embedding_dim': 96, 'lr': 0.0007924927231928422, 'lambda_val': 0.006420156392281269, 'batch_size': 796, 'optimizer': 'RMSprop'}.
2026-05-24 04:53:04,047 - experiment_functions - INFO - Early stopping at epoch 550. Best Metrics: (0.018506281960133132, 0.01602649006622517, 0.02014072622661273)
2026-05-24 04:53:04,640 - optuna.study.study - INFO - Trial 230 finished with values: [0.018506281960133132, 0.01602649006622517, 0.02014072622661273] and parameters: {'n_layers': 4, 'embedding_dim': 96, 'lr': 0.0010412335380352404, 'lambda_val': 0.017024035419790078, 'batch_size': 1499, 'optimizer': 'RMSprop'}.
2026-05-24 04:53:23,254 - experiment_functions - INFO - Early stopping at epoch 1700. Best Metrics: (0.024803811296640752, 0.018998344370860926, 0.02546620435251152)
2026-05-24 04:53:23,394 - optuna.study.study - INFO - Trial 231 finished with values: [0.024803811296640752, 0.018998344370860926, 0.02546620435251152] and parameters: {'n_layers': 4, 'embedding_dim': 32, 'lr': 0.00039891463323300135, 'lambda_val': 0.00216360313455091, 'batch_size': 1199, 'optimizer': 'Adam'}.
2026-05-24 04:53:39,308 - experiment_functions - INFO - Early stopping at epoch 1450. Best Metrics: (0.022227336705323113, 0.01564569536423841, 0.02268583625847547)
2026-05-24 04:53:40,368 - optuna.study.study - INFO - Trial 232 finished with values: [0.022227336705323113, 0.01564569536423841, 0.02268583625847547] and parameters: {'n_layers': 2, 'embedding_dim': 32, 'lr': 0.0007924927231928422, 'lambda_val': 0.0012311986942485985, 'batch_size': 827, 'optimizer': 'RMSprop'}.
2026-05-24 04:53:52,929 - experiment_functions - INFO - Early stopping at epoch 1100. Best Metrics: (0.025195083674272405, 0.01818708609271523, 0.025361468550561397)
2026-05-24 04:53:53,030 - optuna.study.study - INFO - Trial 233 finished with values: [0.025195083674272405, 0.01818708609271523, 0.025361468550561397] and parameters: {'n_layers': 3, 'embedding_dim': 32, 'lr': 0.0007924927231928422, 'lambda_val': 0.000587220247472759, 'batch_size': 796, 'optimizer': 'RMSprop'}.
2026-05-24 04:54:34,751 - optuna.study.study - INFO - Trial 234 finished with values: [0.021518408334856257, 0.016473509933774836, 0.0228965395111901] and parameters: {'n_layers': 4, 'embedding_dim': 32, 'lr': 0.00021971244076229157, 'lambda_val': 1.788497394454551e-05, 'batch_size': 1735, 'optimizer': 'Adam'}.
2026-05-24 04:54:40,779 - experiment_functions - INFO - Early stopping at epoch 500. Best Metrics: (0.008915272273056603, 0.0068956953642384106, 0.00907392216225342)
2026-05-24 04:54:41,005 - optuna.study.study - INFO - Trial 235 finished with values: [0.008915272273056603, 0.0068956953642384106, 0.00907392216225342] and parameters: {'n_layers': 4, 'embedding_dim': 32, 'lr': 0.08494075309537209, 'lambda_val': 0.0012311986942485985, 'batch_size': 1199, 'optimizer': 'Adam'}.
2026-05-24 04:54:59,156 - experiment_functions - INFO - Early stopping at epoch 1600. Best Metrics: (0.019724179882643335, 0.016407284768211922, 0.020978730361687375)
2026-05-24 04:54:59,240 - optuna.study.study - INFO - Trial 236 finished with values: [0.019724179882643335, 0.016407284768211922, 0.020978730361687375] and parameters: {'n_layers': 4, 'embedding_dim': 64, 'lr': 0.0002960115862018489, 'lambda_val': 6.677790881496428e-05, 'batch_size': 2162, 'optimizer': 'Adam'}.
2026-05-24 04:55:07,838 - experiment_functions - INFO - Early stopping at epoch 700. Best Metrics: (0.02189528954763585, 0.017086092715231788, 0.02262997919537641)
2026-05-24 04:55:07,955 - optuna.study.study - INFO - Trial 237 finished with values: [0.02189528954763585, 0.017086092715231788, 0.02262997919537641] and parameters: {'n_layers': 4, 'embedding_dim': 96, 'lr': 0.0013524049945715497, 'lambda_val': 7.062321615538293e-06, 'batch_size': 869, 'optimizer': 'Adam'}.
2026-05-24 04:55:17,696 - experiment_functions - INFO - Early stopping at epoch 800. Best Metrics: (0.02113029507607279, 0.016821192052980133, 0.022369967652106915)
2026-05-24 04:55:17,986 - optuna.study.study - INFO - Trial 238 finished with values: [0.02113029507607279, 0.016821192052980133, 0.022369967652106915] and parameters: {'n_layers': 4, 'embedding_dim': 128, 'lr': 0.0010412335380352404, 'lambda_val': 0.0005557477534433548, 'batch_size': 642, 'optimizer': 'Adam'}.
2026-05-24 04:55:30,193 - experiment_functions - INFO - Early stopping at epoch 1100. Best Metrics: (0.022183596458406545, 0.014875827814569536, 0.02114943734238363)
2026-05-24 04:55:30,283 - optuna.study.study - INFO - Trial 239 finished with values: [0.022183596458406545, 0.014875827814569536, 0.02114943734238363] and parameters: {'n_layers': 2, 'embedding_dim': 32, 'lr': 0.0007924927231928422, 'lambda_val': 1.788497394454551e-05, 'batch_size': 1970, 'optimizer': 'Adam'}.
2026-05-24 04:55:47,449 - experiment_functions - INFO - Early stopping at epoch 1250. Best Metrics: (0.014188912834293826, 0.0111341059602649, 0.014165844348796568)
2026-05-24 04:55:47,545 - optuna.study.study - INFO - Trial 240 finished with values: [0.014188912834293826, 0.0111341059602649, 0.014165844348796568] and parameters: {'n_layers': 2, 'embedding_dim': 256, 'lr': 0.0002960115862018489, 'lambda_val': 0.010157868861362357, 'batch_size': 1518, 'optimizer': 'RMSprop'}.
2026-05-24 04:56:30,159 - optuna.study.study - INFO - Trial 241 finished with values: [0.02406781753296985, 0.01839403973509934, 0.02549224019956671] and parameters: {'n_layers': 4, 'embedding_dim': 32, 'lr': 0.0002960115862018489, 'lambda_val': 0.0012311986942485985, 'batch_size': 764, 'optimizer': 'RMSprop'}.
2026-05-24 04:56:47,934 - experiment_functions - INFO - Early stopping at epoch 1650. Best Metrics: (0.022510938547567007, 0.01634933774834437, 0.02305638291076367)
2026-05-24 04:56:48,023 - optuna.study.study - INFO - Trial 242 finished with values: [0.022510938547567007, 0.01634933774834437, 0.02305638291076367] and parameters: {'n_layers': 2, 'embedding_dim': 32, 'lr': 0.0007366841828777069, 'lambda_val': 6.677790881496428e-05, 'batch_size': 907, 'optimizer': 'RMSprop'}.
2026-05-24 04:57:10,565 - experiment_functions - INFO - Early stopping at epoch 2150. Best Metrics: (0.018889051040669562, 0.01592715231788079, 0.020422220841473507)
2026-05-24 04:57:10,669 - optuna.study.study - INFO - Trial 243 finished with values: [0.018889051040669562, 0.01592715231788079, 0.020422220841473507] and parameters: {'n_layers': 3, 'embedding_dim': 32, 'lr': 0.0002960115862018489, 'lambda_val': 0.010157868861362357, 'batch_size': 3008, 'optimizer': 'Adam'}.
2026-05-24 04:57:17,510 - experiment_functions - INFO - Early stopping at epoch 550. Best Metrics: (0.020594287965271487, 0.016705298013245034, 0.022231803882317144)
2026-05-24 04:57:17,614 - optuna.study.study - INFO - Trial 244 finished with values: [0.020594287965271487, 0.016705298013245034, 0.022231803882317144] and parameters: {'n_layers': 4, 'embedding_dim': 128, 'lr': 0.0013524049945715497, 'lambda_val': 7.062321615538293e-06, 'batch_size': 869, 'optimizer': 'RMSprop'}.
2026-05-24 04:57:33,467 - experiment_functions - INFO - Early stopping at epoch 1550. Best Metrics: (0.02362301949980552, 0.01649006622516556, 0.023706389177844577)
2026-05-24 04:57:33,596 - optuna.study.study - INFO - Trial 245 finished with values: [0.02362301949980552, 0.01649006622516556, 0.023706389177844577] and parameters: {'n_layers': 2, 'embedding_dim': 32, 'lr': 0.0007924927231928422, 'lambda_val': 1.788497394454551e-05, 'batch_size': 796, 'optimizer': 'RMSprop'}.
2026-05-24 04:58:16,816 - optuna.study.study - INFO - Trial 246 finished with values: [0.025345800524230612, 0.01908112582781457, 0.025772257947421558] and parameters: {'n_layers': 4, 'embedding_dim': 64, 'lr': 0.0002960115862018489, 'lambda_val': 6.677790881496428e-05, 'batch_size': 642, 'optimizer': 'Adam'}.
2026-05-24 04:58:59,012 - optuna.study.study - INFO - Trial 247 finished with values: [0.023646777532519123, 0.01802980132450331, 0.02468529862368855] and parameters: {'n_layers': 4, 'embedding_dim': 64, 'lr': 0.0002960115862018489, 'lambda_val': 6.677790881496428e-05, 'batch_size': 796, 'optimizer': 'Adam'}.
2026-05-24 04:59:04,836 - experiment_functions - INFO - Early stopping at epoch 500. Best Metrics: (0.004796096214792379, 0.003816225165562914, 0.004880700207094594)
2026-05-24 04:59:05,912 - optuna.study.study - INFO - Trial 248 finished with values: [0.004796096214792379, 0.003816225165562914, 0.004880700207094594] and parameters: {'n_layers': 1, 'embedding_dim': 32, 'lr': 0.0007924927231928422, 'lambda_val': 0.03012618106851853, 'batch_size': 796, 'optimizer': 'SGD'}.
2026-05-24 04:59:12,084 - experiment_functions - INFO - Early stopping at epoch 500. Best Metrics: (0.005118822799150073, 0.004072847682119206, 0.005234613097064308)
2026-05-24 04:59:12,233 - optuna.study.study - INFO - Trial 249 finished with values: [0.005118822799150073, 0.004072847682119206, 0.005234613097064308] and parameters: {'n_layers': 4, 'embedding_dim': 96, 'lr': 0.0002960115862018489, 'lambda_val': 0.030528649183713095, 'batch_size': 1735, 'optimizer': 'SGD'}.
2026-05-24 04:59:53,046 - optuna.study.study - INFO - Trial 250 finished with values: [0.01974061626678773, 0.014437086092715235, 0.02039193353018532] and parameters: {'n_layers': 2, 'embedding_dim': 32, 'lr': 0.0002960115862018489, 'lambda_val': 1.788497394454551e-05, 'batch_size': 1248, 'optimizer': 'RMSprop'}.
2026-05-24 05:00:13,137 - experiment_functions - INFO - Early stopping at epoch 1850. Best Metrics: (0.024946413261210693, 0.016986754966887417, 0.0245702805750511)
2026-05-24 05:00:13,828 - optuna.study.study - INFO - Trial 251 finished with values: [0.024946413261210693, 0.016986754966887417, 0.0245702805750511] and parameters: {'n_layers': 2, 'embedding_dim': 32, 'lr': 0.0007924927231928422, 'lambda_val': 6.677790881496428e-05, 'batch_size': 642, 'optimizer': 'RMSprop'}.
2026-05-24 05:00:32,431 - experiment_functions - INFO - Early stopping at epoch 1500. Best Metrics: (0.022292466803295337, 0.01790562913907285, 0.023005569914980428)
2026-05-24 05:00:33,146 - optuna.study.study - INFO - Trial 252 finished with values: [0.022292466803295337, 0.01790562913907285, 0.023005569914980428] and parameters: {'n_layers': 4, 'embedding_dim': 64, 'lr': 0.0002960115862018489, 'lambda_val': 0.011237419265633751, 'batch_size': 1546, 'optimizer': 'Adam'}.
2026-05-24 05:00:46,168 - experiment_functions - INFO - Early stopping at epoch 600. Best Metrics: (0.017682019557234818, 0.01439569536423841, 0.018261591414893995)
2026-05-24 05:00:46,257 - optuna.study.study - INFO - Trial 253 finished with values: [0.017682019557234818, 0.01439569536423841, 0.018261591414893995] and parameters: {'n_layers': 4, 'embedding_dim': 256, 'lr': 0.0007924927231928422, 'lambda_val': 0.000587220247472759, 'batch_size': 2481, 'optimizer': 'RMSprop'}.
2026-05-24 05:00:54,689 - experiment_functions - INFO - Early stopping at epoch 700. Best Metrics: (0.02587419986561175, 0.020844370860927153, 0.027406581372373232)
2026-05-24 05:00:54,784 - optuna.study.study - INFO - Trial 254 finished with values: [0.02587419986561175, 0.020844370860927153, 0.027406581372373232] and parameters: {'n_layers': 4, 'embedding_dim': 32, 'lr': 0.0007924927231928422, 'lambda_val': 0.030528649183713095, 'batch_size': 796, 'optimizer': 'RMSprop'}.
2026-05-24 05:01:08,432 - experiment_functions - INFO - Early stopping at epoch 1200. Best Metrics: (0.02568544862665079, 0.018915562913907284, 0.026278475257522194)
2026-05-24 05:01:08,534 - optuna.study.study - INFO - Trial 255 finished with values: [0.02568544862665079, 0.018915562913907284, 0.026278475257522194] and parameters: {'n_layers': 4, 'embedding_dim': 32, 'lr': 0.0006691559391119897, 'lambda_val': 0.0007150353686754638, 'batch_size': 568, 'optimizer': 'Adam'}.
2026-05-24 05:01:50,828 - optuna.study.study - INFO - Trial 256 finished with values: [0.024842297323738223, 0.018990066225165563, 0.025824138178654015] and parameters: {'n_layers': 4, 'embedding_dim': 32, 'lr': 0.0002960115862018489, 'lambda_val': 0.00038717605082218693, 'batch_size': 568, 'optimizer': 'Adam'}.
2026-05-24 05:02:00,698 - experiment_functions - INFO - Early stopping at epoch 850. Best Metrics: (0.022428158662939717, 0.016986754966887417, 0.0223668148354773)
