2026-05-24 04:30:28,504 - optuna.study.study - INFO - Trial 158 finished with values: [0.015365358656445772, 0.01413907284768212, 0.016991704906941393] and parameters: {'n_layers': 4, 'embedding_dim': 128, 'lr': 0.0010412335380352404, 'lambda_val': 0.05904110892608641, 'batch_size': 2232, 'optimizer': 'Adam'}.
2026-05-24 04:30:35,348 - experiment_functions - INFO - Early stopping at epoch 600. Best Metrics: (0.019126004332317852, 0.01650662251655629, 0.02100534904839378)
2026-05-24 04:30:35,627 - optuna.study.study - INFO - Trial 159 finished with values: [0.019126004332317852, 0.01650662251655629, 0.02100534904839378] and parameters: {'n_layers': 4, 'embedding_dim': 64, 'lr': 0.0007924927231928422, 'lambda_val': 0.017024035419790078, 'batch_size': 1970, 'optimizer': 'RMSprop'}.
2026-05-24 04:31:13,075 - experiment_functions - INFO - Early stopping at epoch 3800. Best Metrics: (0.020438003289418655, 0.016432119205298013, 0.02148524036078254)
2026-05-24 04:31:13,167 - optuna.study.study - INFO - Trial 160 finished with values: [0.020438003289418655, 0.016432119205298013, 0.02148524036078254] and parameters: {'n_layers': 4, 'embedding_dim': 32, 'lr': 0.00021971244076229157, 'lambda_val': 1.788497394454551e-05, 'batch_size': 1735, 'optimizer': 'Adam'}.
2026-05-24 04:31:53,074 - optuna.study.study - INFO - Trial 161 finished with values: [0.01936244569687828, 0.015438741721854304, 0.019819041704457988] and parameters: {'n_layers': 4, 'embedding_dim': 32, 'lr': 0.0002960115862018489, 'lambda_val': 1.788497394454551e-05, 'batch_size': 3214, 'optimizer': 'RMSprop'}.
2026-05-24 04:32:19,937 - experiment_functions - INFO - Early stopping at epoch 2650. Best Metrics: (0.023380719618156548, 0.0190976821192053, 0.024962198430859273)
2026-05-24 04:32:20,026 - optuna.study.study - INFO - Trial 162 finished with values: [0.023380719618156548, 0.0190976821192053, 0.024962198430859273] and parameters: {'n_layers': 4, 'embedding_dim': 64, 'lr': 0.0002960115862018489, 'lambda_val': 0.010157868861362357, 'batch_size': 796, 'optimizer': 'RMSprop'}.
2026-05-24 04:32:29,260 - experiment_functions - INFO - Early stopping at epoch 850. Best Metrics: (0.018722836414198765, 0.012798013245033114, 0.01799624835500529)
2026-05-24 04:32:29,366 - optuna.study.study - INFO - Trial 163 finished with values: [0.018722836414198765, 0.012798013245033114, 0.01799624835500529] and parameters: {'n_layers': 1, 'embedding_dim': 128, 'lr': 0.0010412335380352404, 'lambda_val': 1.6488811140589769e-06, 'batch_size': 1384, 'optimizer': 'Adam'}.
2026-05-24 04:33:08,443 - optuna.study.study - INFO - Trial 164 finished with values: [0.01890239297882988, 0.013543046357615897, 0.019454340560340413] and parameters: {'n_layers': 1, 'embedding_dim': 64, 'lr': 0.0002960115862018489, 'lambda_val': 1.6488811140589769e-06, 'batch_size': 1543, 'optimizer': 'Adam'}.
2026-05-24 04:33:15,193 - experiment_functions - INFO - Early stopping at epoch 600. Best Metrics: (0.01622144983611446, 0.014155629139072848, 0.01734192463588519)
2026-05-24 04:33:15,283 - optuna.study.study - INFO - Trial 165 finished with values: [0.01622144983611446, 0.014155629139072848, 0.01734192463588519] and parameters: {'n_layers': 4, 'embedding_dim': 64, 'lr': 0.0020309881245989514, 'lambda_val': 0.058192820728962175, 'batch_size': 1829, 'optimizer': 'Adam'}.
2026-05-24 04:33:27,918 - experiment_functions - INFO - Early stopping at epoch 1200. Best Metrics: (0.023139220257473524, 0.016067880794701988, 0.022565032392964778)
2026-05-24 04:33:28,017 - optuna.study.study - INFO - Trial 166 finished with values: [0.023139220257473524, 0.016067880794701988, 0.022565032392964778] and parameters: {'n_layers': 2, 'embedding_dim': 32, 'lr': 0.0007924927231928422, 'lambda_val': 0.010157868861362357, 'batch_size': 796, 'optimizer': 'RMSprop'}.
2026-05-24 04:33:35,371 - experiment_functions - INFO - Early stopping at epoch 550. Best Metrics: (0.008497724934525462, 0.008220198675496688, 0.009454088447534417)
2026-05-24 04:33:35,543 - optuna.study.study - INFO - Trial 167 finished with values: [0.008497724934525462, 0.008220198675496688, 0.009454088447534417] and parameters: {'n_layers': 4, 'embedding_dim': 256, 'lr': 0.0054266566794856745, 'lambda_val': 0.016113443657182445, 'batch_size': 3264, 'optimizer': 'Adam'}.
2026-05-24 04:34:16,643 - experiment_functions - INFO - Early stopping at epoch 3950. Best Metrics: (0.02509049027838786, 0.019379139072847683, 0.02540193246446775)
2026-05-24 04:34:17,335 - optuna.study.study - INFO - Trial 168 finished with values: [0.02509049027838786, 0.019379139072847683, 0.02540193246446775] and parameters: {'n_layers': 4, 'embedding_dim': 64, 'lr': 0.0002960115862018489, 'lambda_val': 0.0012311986942485985, 'batch_size': 764, 'optimizer': 'Adam'}.
2026-05-24 04:34:47,264 - experiment_functions - INFO - Early stopping at epoch 2800. Best Metrics: (0.022287956629066876, 0.017508278145695364, 0.023379067500464024)
2026-05-24 04:34:47,648 - optuna.study.study - INFO - Trial 169 finished with values: [0.022287956629066876, 0.017508278145695364, 0.023379067500464024] and parameters: {'n_layers': 4, 'embedding_dim': 128, 'lr': 0.0002960115862018489, 'lambda_val': 0.0001107972598738893, 'batch_size': 764, 'optimizer': 'Adam'}.
2026-05-24 04:34:53,997 - experiment_functions - INFO - Early stopping at epoch 550. Best Metrics: (0.016615830830184926, 0.013145695364238411, 0.017306703638789958)
2026-05-24 04:34:54,340 - optuna.study.study - INFO - Trial 170 finished with values: [0.016615830830184926, 0.013145695364238411, 0.017306703638789958] and parameters: {'n_layers': 4, 'embedding_dim': 64, 'lr': 0.007268367508546935, 'lambda_val': 0.0005557477534433548, 'batch_size': 3264, 'optimizer': 'Adam'}.
2026-05-24 04:35:03,585 - experiment_functions - INFO - Early stopping at epoch 800. Best Metrics: (0.02000325453542612, 0.016299668874172186, 0.021538791563647592)
2026-05-24 04:35:04,160 - optuna.study.study - INFO - Trial 171 finished with values: [0.02000325453542612, 0.016299668874172186, 0.021538791563647592] and parameters: {'n_layers': 4, 'embedding_dim': 32, 'lr': 0.0010345450541168627, 'lambda_val': 2.571811162691067e-06, 'batch_size': 1735, 'optimizer': 'Adam'}.
2026-05-24 04:35:14,278 - experiment_functions - INFO - Early stopping at epoch 850. Best Metrics: (0.017364829851613493, 0.01423841059602649, 0.018546565765642044)
2026-05-24 04:35:14,374 - optuna.study.study - INFO - Trial 172 finished with values: [0.017364829851613493, 0.01423841059602649, 0.018546565765642044] and parameters: {'n_layers': 4, 'embedding_dim': 128, 'lr': 0.000460021398839349, 'lambda_val': 0.0007150353686754638, 'batch_size': 3635, 'optimizer': 'Adam'}.
2026-05-24 04:35:20,686 - experiment_functions - INFO - Early stopping at epoch 550. Best Metrics: (0.012062340125253179, 0.010372516556291391, 0.012671774503140259)
2026-05-24 04:35:21,121 - optuna.study.study - INFO - Trial 173 finished with values: [0.012062340125253179, 0.010372516556291391, 0.012671774503140259] and parameters: {'n_layers': 3, 'embedding_dim': 96, 'lr': 0.002554895151146701, 'lambda_val': 0.006420156392281269, 'batch_size': 3956, 'optimizer': 'RMSprop'}.
2026-05-24 04:35:32,551 - experiment_functions - INFO - Early stopping at epoch 1050. Best Metrics: (0.018747252273409683, 0.015115894039735102, 0.019758976658811562)
2026-05-24 04:35:33,158 - optuna.study.study - INFO - Trial 174 finished with values: [0.018747252273409683, 0.015115894039735102, 0.019758976658811562] and parameters: {'n_layers': 3, 'embedding_dim': 32, 'lr': 0.0006691559391119897, 'lambda_val': 0.0001442942988983153, 'batch_size': 2485, 'optimizer': 'RMSprop'}.
2026-05-24 04:35:39,712 - experiment_functions - INFO - Early stopping at epoch 550. Best Metrics: (0.013731365056074968, 0.011738410596026492, 0.01485319368633392)
2026-05-24 04:35:40,032 - optuna.study.study - INFO - Trial 175 finished with values: [0.013731365056074968, 0.011738410596026492, 0.01485319368633392] and parameters: {'n_layers': 4, 'embedding_dim': 64, 'lr': 0.0054266566794856745, 'lambda_val': 3.898561124366437e-06, 'batch_size': 571, 'optimizer': 'RMSprop'}.
2026-05-24 04:36:18,522 - optuna.study.study - INFO - Trial 176 finished with values: [0.01949292407244949, 0.013567880794701987, 0.019981524379930365] and parameters: {'n_layers': 1, 'embedding_dim': 64, 'lr': 0.0002960115862018489, 'lambda_val': 0.0012311986942485985, 'batch_size': 764, 'optimizer': 'Adam'}.
2026-05-24 04:36:28,342 - experiment_functions - INFO - Early stopping at epoch 900. Best Metrics: (0.0166267613788174, 0.011796357615894043, 0.0163787727313763)
2026-05-24 04:36:29,204 - optuna.study.study - INFO - Trial 177 finished with values: [0.0166267613788174, 0.011796357615894043, 0.0163787727313763] and parameters: {'n_layers': 1, 'embedding_dim': 128, 'lr': 0.0007924927231928422, 'lambda_val': 1.788497394454551e-05, 'batch_size': 2098, 'optimizer': 'Adam'}.
2026-05-24 04:37:07,374 - optuna.study.study - INFO - Trial 178 finished with values: [0.008820737373666393, 0.0067384105960264905, 0.008854689485477478] and parameters: {'n_layers': 4, 'embedding_dim': 64, 'lr': 6.630787003578021e-05, 'lambda_val': 1.3591214646805096e-06, 'batch_size': 642, 'optimizer': 'Adam'}.
2026-05-24 04:37:15,976 - experiment_functions - INFO - Early stopping at epoch 750. Best Metrics: (0.018778583832999803, 0.013932119205298014, 0.01935863951966493)
2026-05-24 04:37:17,188 - optuna.study.study - INFO - Trial 179 finished with values: [0.018778583832999803, 0.013932119205298014, 0.01935863951966493] and parameters: {'n_layers': 3, 'embedding_dim': 64, 'lr': 0.0010412335380352404, 'lambda_val': 0.0002486923604509324, 'batch_size': 2232, 'optimizer': 'Adam'}.
2026-05-24 04:37:24,112 - experiment_functions - INFO - Early stopping at epoch 600. Best Metrics: (0.013006363566453521, 0.010347682119205299, 0.013300984516586884)
2026-05-24 04:37:24,220 - optuna.study.study - INFO - Trial 180 finished with values: [0.013006363566453521, 0.010347682119205299, 0.013300984516586884] and parameters: {'n_layers': 1, 'embedding_dim': 96, 'lr': 0.0010412335380352404, 'lambda_val': 0.017024035419790078, 'batch_size': 2232, 'optimizer': 'RMSprop'}.
2026-05-24 04:37:33,157 - experiment_functions - INFO - Early stopping at epoch 750. Best Metrics: (0.01798187512878296, 0.01501655629139073, 0.01944722854904868)
2026-05-24 04:37:33,499 - optuna.study.study - INFO - Trial 181 finished with values: [0.01798187512878296, 0.01501655629139073, 0.01944722854904868] and parameters: {'n_layers': 4, 'embedding_dim': 32, 'lr': 0.0010345450541168627, 'lambda_val': 6.677790881496428e-05, 'batch_size': 3180, 'optimizer': 'Adam'}.
2026-05-24 04:37:40,755 - experiment_functions - INFO - Early stopping at epoch 550. Best Metrics: (0.012639820758987732, 0.010190397350993377, 0.013008557596528757)
2026-05-24 04:37:40,886 - optuna.study.study - INFO - Trial 182 finished with values: [0.012639820758987732, 0.010190397350993377, 0.013008557596528757] and parameters: {'n_layers': 4, 'embedding_dim': 32, 'lr': 0.008902294588770277, 'lambda_val': 1.788497394454551e-05, 'batch_size': 642, 'optimizer': 'RMSprop'}.
2026-05-24 04:37:49,911 - experiment_functions - INFO - Early stopping at epoch 750. Best Metrics: (0.024092431073587026, 0.018493377483443707, 0.024036896876814994)
2026-05-24 04:37:50,021 - optuna.study.study - INFO - Trial 183 finished with values: [0.024092431073587026, 0.018493377483443707, 0.024036896876814994] and parameters: {'n_layers': 4, 'embedding_dim': 96, 'lr': 0.001248319543611659, 'lambda_val': 4.203888077045282e-06, 'batch_size': 642, 'optimizer': 'Adam'}.
2026-05-24 04:37:56,163 - experiment_functions - INFO - Early stopping at epoch 500. Best Metrics: (0.005108144242972104, 0.004097682119205298, 0.0049847534035462595)
2026-05-24 04:37:57,133 - optuna.study.study - INFO - Trial 184 finished with values: [0.005108144242972104, 0.004097682119205298, 0.0049847534035462595] and parameters: {'n_layers': 4, 'embedding_dim': 96, 'lr': 1.56732573536399e-05, 'lambda_val': 0.04918021699603916, 'batch_size': 1199, 'optimizer': 'Adam'}.
2026-05-24 04:38:03,143 - experiment_functions - INFO - Early stopping at epoch 500. Best Metrics: (0.005369385286258698, 0.004180463576158941, 0.005335082151249751)
2026-05-24 04:38:04,594 - optuna.study.study - INFO - Trial 185 finished with values: [0.005369385286258698, 0.004180463576158941, 0.005335082151249751] and parameters: {'n_layers': 4, 'embedding_dim': 32, 'lr': 3.447665203061428e-05, 'lambda_val': 0.017024035419790078, 'batch_size': 2232, 'optimizer': 'RMSprop'}.
2026-05-24 04:38:11,317 - experiment_functions - INFO - Early stopping at epoch 550. Best Metrics: (0.010820634321082209, 0.01076158940397351, 0.013053679526962852)
2026-05-24 04:38:11,435 - optuna.study.study - INFO - Trial 186 finished with values: [0.010820634321082209, 0.01076158940397351, 0.013053679526962852] and parameters: {'n_layers': 4, 'embedding_dim': 128, 'lr': 0.0016306259277922273, 'lambda_val': 0.017024035419790078, 'batch_size': 3264, 'optimizer': 'RMSprop'}.
2026-05-24 04:38:21,504 - experiment_functions - INFO - Early stopping at epoch 850. Best Metrics: (0.022197773526824133, 0.017649006622516554, 0.02302069657329486)
2026-05-24 04:38:21,786 - optuna.study.study - INFO - Trial 187 finished with values: [0.022197773526824133, 0.017649006622516554, 0.02302069657329486] and parameters: {'n_layers': 4, 'embedding_dim': 96, 'lr': 0.0007924927231928422, 'lambda_val': 0.005848253947736995, 'batch_size': 642, 'optimizer': 'Adam'}.
2026-05-24 04:39:03,477 - optuna.study.study - INFO - Trial 188 finished with values: [0.024543025279852346, 0.018799668874172188, 0.024775527213527597] and parameters: {'n_layers': 4, 'embedding_dim': 32, 'lr': 0.0002960115862018489, 'lambda_val': 0.0009156994238225034, 'batch_size': 642, 'optimizer': 'Adam'}.
2026-05-24 04:39:29,085 - experiment_functions - INFO - Early stopping at epoch 2400. Best Metrics: (0.024970938778358515, 0.020041390728476823, 0.026140528712527516)
2026-05-24 04:39:29,395 - optuna.study.study - INFO - Trial 189 finished with values: [0.024970938778358515, 0.020041390728476823, 0.026140528712527516] and parameters: {'n_layers': 4, 'embedding_dim': 64, 'lr': 0.0002960115862018489, 'lambda_val': 0.017024035419790078, 'batch_size': 568, 'optimizer': 'RMSprop'}.
2026-05-24 04:39:37,708 - experiment_functions - INFO - Early stopping at epoch 700. Best Metrics: (0.022282739234049415, 0.01748344370860927, 0.023707780719468687)
2026-05-24 04:39:37,917 - optuna.study.study - INFO - Trial 190 finished with values: [0.022282739234049415, 0.01748344370860927, 0.023707780719468687] and parameters: {'n_layers': 4, 'embedding_dim': 32, 'lr': 0.0013524049945715497, 'lambda_val': 7.062321615538293e-06, 'batch_size': 869, 'optimizer': 'RMSprop'}.
2026-05-24 04:40:24,353 - optuna.study.study - INFO - Trial 191 finished with values: [0.022220298209932855, 0.016076158940397354, 0.022856357770006722] and parameters: {'n_layers': 3, 'embedding_dim': 32, 'lr': 0.0002960115862018489, 'lambda_val': 0.0012311986942485985, 'batch_size': 1518, 'optimizer': 'RMSprop'}.
2026-05-24 04:40:33,652 - experiment_functions - INFO - Early stopping at epoch 800. Best Metrics: (0.0189318698988011, 0.014056291390728478, 0.019186017620604196)
2026-05-24 04:40:33,826 - optuna.study.study - INFO - Trial 192 finished with values: [0.0189318698988011, 0.014056291390728478, 0.019186017620604196] and parameters: {'n_layers': 2, 'embedding_dim': 128, 'lr': 0.0013524049945715497, 'lambda_val': 6.677790881496428e-05, 'batch_size': 642, 'optimizer': 'Adam'}.
2026-05-24 04:40:40,563 - experiment_functions - INFO - Early stopping at epoch 550. Best Metrics: (0.016927272015103995, 0.01287251655629139, 0.017319387548369716)
2026-05-24 04:40:40,654 - optuna.study.study - INFO - Trial 193 finished with values: [0.016927272015103995, 0.01287251655629139, 0.017319387548369716] and parameters: {'n_layers': 3, 'embedding_dim': 64, 'lr': 0.0054266566794856745, 'lambda_val': 3.898561124366437e-06, 'batch_size': 2577, 'optimizer': 'Adam'}.
2026-05-24 04:40:50,262 - experiment_functions - INFO - Early stopping at epoch 800. Best Metrics: (0.023994994997800993, 0.01809602649006623, 0.02504373464073761)
2026-05-24 04:40:50,370 - optuna.study.study - INFO - Trial 194 finished with values: [0.023994994997800993, 0.01809602649006623, 0.02504373464073761] and parameters: {'n_layers': 4, 'embedding_dim': 96, 'lr': 0.0006691559391119897, 'lambda_val': 0.0007150353686754638, 'batch_size': 694, 'optimizer': 'RMSprop'}.
2026-05-24 04:41:32,085 - optuna.study.study - INFO - Trial 195 finished with values: [0.02376335451604342, 0.018451986754966888, 0.02491053494417764] and parameters: {'n_layers': 4, 'embedding_dim': 32, 'lr': 0.0002960115862018489, 'lambda_val': 6.677790881496428e-05, 'batch_size': 907, 'optimizer': 'RMSprop'}.
2026-05-24 04:41:39,590 - experiment_functions - INFO - Early stopping at epoch 650. Best Metrics: (0.0054585818173016705, 0.0040562913907284765, 0.005298992468175241)
2026-05-24 04:41:39,692 - optuna.study.study - INFO - Trial 196 finished with values: [0.0054585818173016705, 0.0040562913907284765, 0.005298992468175241] and parameters: {'n_layers': 4, 'embedding_dim': 96, 'lr': 0.0054266566794856745, 'lambda_val': 3.898561124366437e-06, 'batch_size': 764, 'optimizer': 'SGD'}.
2026-05-24 04:42:20,770 - optuna.study.study - INFO - Trial 197 finished with values: [0.020435303912730813, 0.0159023178807947, 0.020669844045731845] and parameters: {'n_layers': 3, 'embedding_dim': 32, 'lr': 0.0002960115862018489, 'lambda_val': 0.007048356889257099, 'batch_size': 1970, 'optimizer': 'Adam'}.
2026-05-24 04:42:28,049 - experiment_functions - INFO - Early stopping at epoch 600. Best Metrics: (0.018841330128388453, 0.014958609271523178, 0.019500528121920373)
2026-05-24 04:42:28,158 - optuna.study.study - INFO - Trial 198 finished with values: [0.018841330128388453, 0.014958609271523178, 0.019500528121920373] and parameters: {'n_layers': 3, 'embedding_dim': 96, 'lr': 0.002717396800836918, 'lambda_val': 0.006420156392281269, 'batch_size': 796, 'optimizer': 'Adam'}.
2026-05-24 04:42:34,826 - experiment_functions - INFO - Early stopping at epoch 550. Best Metrics: (0.009645294340125515, 0.00798841059602649, 0.009840738212020294)
2026-05-24 04:42:34,932 - optuna.study.study - INFO - Trial 199 finished with values: [0.009645294340125515, 0.00798841059602649, 0.009840738212020294] and parameters: {'n_layers': 4, 'embedding_dim': 32, 'lr': 0.024293371425809642, 'lambda_val': 3.5889433213599496e-05, 'batch_size': 1248, 'optimizer': 'RMSprop'}.
2026-05-24 04:43:13,832 - optuna.study.study - INFO - Trial 200 finished with values: [0.0064057030147948064, 0.0049834437086092725, 0.006543842436438421] and parameters: {'n_layers': 3, 'embedding_dim': 32, 'lr': 3.031138082072484e-05, 'lambda_val': 0.007048356889257099, 'batch_size': 1970, 'optimizer': 'Adam'}.
2026-05-24 04:43:22,944 - experiment_functions - INFO - Early stopping at epoch 800. Best Metrics: (0.019846613848083925, 0.016192052980132453, 0.021018154434734967)
2026-05-24 04:43:23,945 - optuna.study.study - INFO - Trial 201 finished with values: [0.019846613848083925, 0.016192052980132453, 0.021018154434734967] and parameters: {'n_layers': 3, 'embedding_dim': 32, 'lr': 0.0006691559391119897, 'lambda_val': 0.030528649183713095, 'batch_size': 1817, 'optimizer': 'RMSprop'}.
2026-05-24 04:44:05,045 - optuna.study.study - INFO - Trial 202 finished with values: [0.010362752847027477, 0.008336092715231789, 0.01091762024059947] and parameters: {'n_layers': 4, 'embedding_dim': 64, 'lr': 6.400133337109512e-05, 'lambda_val': 0.00023693317620624614, 'batch_size': 3699, 'optimizer': 'Adam'}.
2026-05-24 04:44:11,593 - experiment_functions - INFO - Early stopping at epoch 550. Best Metrics: (0.019187884751136502, 0.015082781456953642, 0.019929324314503637)
2026-05-24 04:44:11,692 - optuna.study.study - INFO - Trial 203 finished with values: [0.019187884751136502, 0.015082781456953642, 0.019929324314503637] and parameters: {'n_layers': 4, 'embedding_dim': 96, 'lr': 0.0054266566794856745, 'lambda_val': 4.203888077045282e-06, 'batch_size': 1658, 'optimizer': 'Adam'}.
2026-05-24 04:44:28,688 - experiment_functions - INFO - Early stopping at epoch 1600. Best Metrics: (0.024420321831582194, 0.01676324503311258, 0.024015964110219376)
2026-05-24 04:44:28,788 - optuna.study.study - INFO - Trial 204 finished with values: [0.024420321831582194, 0.01676324503311258, 0.024015964110219376] and parameters: {'n_layers': 2, 'embedding_dim': 32, 'lr': 0.0007366841828777069, 'lambda_val': 0.0029344298742113367, 'batch_size': 568, 'optimizer': 'RMSprop'}.
2026-05-24 04:45:10,446 - optuna.study.study - INFO - Trial 205 finished with values: [0.026793742386427167, 0.019072847682119205, 0.026896204480472016] and parameters: {'n_layers': 4, 'embedding_dim': 32, 'lr': 0.0002960115862018489, 'lambda_val': 1.4613413642545354e-05, 'batch_size': 642, 'optimizer': 'Adam'}.
2026-05-24 04:45:48,580 - experiment_functions - INFO - Early stopping at epoch 3750. Best Metrics: (0.020829977065824776, 0.015413907284768212, 0.021158461524258855)
2026-05-24 04:45:48,666 - optuna.study.study - INFO - Trial 206 finished with values: [0.020829977065824776, 0.015413907284768212, 0.021158461524258855] and parameters: {'n_layers': 3, 'embedding_dim': 32, 'lr': 0.0002960115862018489, 'lambda_val': 1.788497394454551e-05, 'batch_size': 1735, 'optimizer': 'Adam'}.
2026-05-24 04:45:58,787 - experiment_functions - INFO - Early stopping at epoch 850. Best Metrics: (0.026560428319860944, 0.01941225165562914, 0.02672658379307216)
2026-05-24 04:45:58,900 - optuna.study.study - INFO - Trial 207 finished with values: [0.026560428319860944, 0.01941225165562914, 0.02672658379307216] and parameters: {'n_layers': 4, 'embedding_dim': 64, 'lr': 0.0007924927231928422, 'lambda_val': 7.157812031084988e-05, 'batch_size': 642, 'optimizer': 'Adam'}.
