2026-05-24 10:53:19,582 - optuna.study.study - INFO - Trial 281 finished with values: [0.05570518554182287, 0.03500827814569537, 0.05185828297466367] and parameters: {'n_layers': 1, 'embedding_dim': 128, 'lr': 0.001667262481946792, 'lambda_val': 2.5452815323641335e-06, 'batch_size': 2503, 'optimizer': 'Adam'}.
2026-05-24 10:54:03,875 - optuna.study.study - INFO - Trial 282 finished with values: [0.058703445254441766, 0.034900662251655626, 0.05201727349251281] and parameters: {'n_layers': 1, 'embedding_dim': 64, 'lr': 0.00033909998390093353, 'lambda_val': 1.9563512568026275e-06, 'batch_size': 2833, 'optimizer': 'Adam'}.
2026-05-24 10:54:47,424 - optuna.study.study - INFO - Trial 283 finished with values: [0.05844364577284591, 0.03505794701986755, 0.050571652787446957] and parameters: {'n_layers': 1, 'embedding_dim': 64, 'lr': 0.00033909998390093353, 'lambda_val': 5.797866699774695e-06, 'batch_size': 1874, 'optimizer': 'RMSprop'}.
2026-05-24 10:54:57,009 - experiment_functions - INFO - Early stopping at epoch 800. Best Metrics: (0.059889166011760905, 0.03577814569536424, 0.05317128526875332)
2026-05-24 10:54:57,105 - optuna.study.study - INFO - Trial 284 finished with values: [0.059889166011760905, 0.03577814569536424, 0.05317128526875332] and parameters: {'n_layers': 1, 'embedding_dim': 64, 'lr': 0.001667262481946792, 'lambda_val': 5.797866699774695e-06, 'batch_size': 1467, 'optimizer': 'Adam'}.
2026-05-24 10:55:05,014 - experiment_functions - INFO - Early stopping at epoch 600. Best Metrics: (0.03909746970318268, 0.025960264900662253, 0.036133496492831665)
2026-05-24 10:55:05,347 - optuna.study.study - INFO - Trial 285 finished with values: [0.03909746970318268, 0.025960264900662253, 0.036133496492831665] and parameters: {'n_layers': 3, 'embedding_dim': 96, 'lr': 0.0020121410580096243, 'lambda_val': 5.797866699774695e-06, 'batch_size': 1789, 'optimizer': 'Adam'}.
2026-05-24 10:55:18,604 - experiment_functions - INFO - Early stopping at epoch 1150. Best Metrics: (0.06193600282077587, 0.03661423841059603, 0.055757926353350806)
2026-05-24 10:55:19,091 - optuna.study.study - INFO - Trial 286 finished with values: [0.06193600282077587, 0.03661423841059603, 0.055757926353350806] and parameters: {'n_layers': 1, 'embedding_dim': 32, 'lr': 0.0008645147173682575, 'lambda_val': 0.0021523136041270213, 'batch_size': 1780, 'optimizer': 'Adam'}.
2026-05-24 10:55:43,101 - experiment_functions - INFO - Early stopping at epoch 2150. Best Metrics: (0.0669587901448356, 0.038708609271523184, 0.057507791186509505)
2026-05-24 10:55:43,432 - optuna.study.study - INFO - Trial 287 finished with values: [0.0669587901448356, 0.038708609271523184, 0.057507791186509505] and parameters: {'n_layers': 1, 'embedding_dim': 32, 'lr': 0.0007684186089934005, 'lambda_val': 5.797866699774695e-06, 'batch_size': 961, 'optimizer': 'Adam'}.
2026-05-24 10:56:27,098 - optuna.study.study - INFO - Trial 288 finished with values: [0.06577576717981287, 0.03845198675496689, 0.05855309713588928] and parameters: {'n_layers': 1, 'embedding_dim': 64, 'lr': 0.00033909998390093353, 'lambda_val': 0.009699831503990761, 'batch_size': 1780, 'optimizer': 'RMSprop'}.
2026-05-24 10:56:38,879 - experiment_functions - INFO - Early stopping at epoch 1000. Best Metrics: (0.055185857153445615, 0.034544701986754967, 0.04871338469825995)
2026-05-24 10:56:39,699 - optuna.study.study - INFO - Trial 289 finished with values: [0.055185857153445615, 0.034544701986754967, 0.04871338469825995] and parameters: {'n_layers': 1, 'embedding_dim': 64, 'lr': 0.0008645147173682575, 'lambda_val': 2.5452815323641335e-06, 'batch_size': 2129, 'optimizer': 'Adam'}.
2026-05-24 10:57:04,679 - experiment_functions - INFO - Early stopping at epoch 2150. Best Metrics: (0.05912155449057389, 0.035802980132450334, 0.05313585243622633)
2026-05-24 10:57:05,746 - optuna.study.study - INFO - Trial 290 finished with values: [0.05912155449057389, 0.035802980132450334, 0.05313585243622633] and parameters: {'n_layers': 1, 'embedding_dim': 128, 'lr': 0.00033909998390093353, 'lambda_val': 2.5452815323641335e-06, 'batch_size': 2844, 'optimizer': 'RMSprop'}.
2026-05-24 10:57:19,313 - experiment_functions - INFO - Early stopping at epoch 1150. Best Metrics: (0.06293870631010899, 0.037309602649006623, 0.05384675208743793)
2026-05-24 10:57:19,403 - optuna.study.study - INFO - Trial 291 finished with values: [0.06293870631010899, 0.037309602649006623, 0.05384675208743793] and parameters: {'n_layers': 1, 'embedding_dim': 32, 'lr': 0.0008645147173682575, 'lambda_val': 0.0009904374338936715, 'batch_size': 1467, 'optimizer': 'RMSprop'}.
2026-05-24 10:57:50,786 - experiment_functions - INFO - Early stopping at epoch 2850. Best Metrics: (0.06117475958440526, 0.0373841059602649, 0.054958976363315246)
2026-05-24 10:57:50,875 - optuna.study.study - INFO - Trial 292 finished with values: [0.06117475958440526, 0.0373841059602649, 0.054958976363315246] and parameters: {'n_layers': 1, 'embedding_dim': 64, 'lr': 0.00033909998390093353, 'lambda_val': 0.010525784141258723, 'batch_size': 2129, 'optimizer': 'RMSprop'}.
2026-05-24 10:57:59,442 - experiment_functions - INFO - Early stopping at epoch 700. Best Metrics: (0.06612271070417518, 0.03721026490066225, 0.05590937209797371)
2026-05-24 10:57:59,528 - optuna.study.study - INFO - Trial 293 finished with values: [0.06612271070417518, 0.03721026490066225, 0.05590937209797371] and parameters: {'n_layers': 1, 'embedding_dim': 64, 'lr': 0.002746129425384238, 'lambda_val': 5.797866699774695e-06, 'batch_size': 1431, 'optimizer': 'Adam'}.
2026-05-24 10:58:38,167 - experiment_functions - INFO - Early stopping at epoch 3450. Best Metrics: (0.06091358615241955, 0.03524006622516556, 0.052212437121876586)
2026-05-24 10:58:38,263 - optuna.study.study - INFO - Trial 294 finished with values: [0.06091358615241955, 0.03524006622516556, 0.052212437121876586] and parameters: {'n_layers': 1, 'embedding_dim': 96, 'lr': 0.00033909998390093353, 'lambda_val': 5.232993813311945e-06, 'batch_size': 2844, 'optimizer': 'Adam'}.
2026-05-24 10:58:55,636 - experiment_functions - INFO - Early stopping at epoch 1500. Best Metrics: (0.04632096255992706, 0.030198675496688736, 0.041493887609865714)
2026-05-24 10:58:55,721 - optuna.study.study - INFO - Trial 295 finished with values: [0.04632096255992706, 0.030198675496688736, 0.041493887609865714] and parameters: {'n_layers': 2, 'embedding_dim': 64, 'lr': 0.00033909998390093353, 'lambda_val': 1.9563512568026275e-06, 'batch_size': 2129, 'optimizer': 'Adam'}.
2026-05-24 10:59:03,923 - experiment_functions - INFO - Early stopping at epoch 600. Best Metrics: (0.05135608261347086, 0.03201158940397351, 0.045812419114793626)
2026-05-24 10:59:04,319 - optuna.study.study - INFO - Trial 296 finished with values: [0.05135608261347086, 0.03201158940397351, 0.045812419114793626] and parameters: {'n_layers': 1, 'embedding_dim': 256, 'lr': 0.0013978493934357974, 'lambda_val': 4.452603967565531e-05, 'batch_size': 2129, 'optimizer': 'RMSprop'}.
2026-05-24 10:59:12,474 - experiment_functions - INFO - Early stopping at epoch 650. Best Metrics: (0.05937680828243614, 0.035322847682119206, 0.05231187866426444)
2026-05-24 10:59:12,559 - optuna.study.study - INFO - Trial 297 finished with values: [0.05937680828243614, 0.035322847682119206, 0.05231187866426444] and parameters: {'n_layers': 1, 'embedding_dim': 96, 'lr': 0.002746129425384238, 'lambda_val': 2.5452815323641335e-06, 'batch_size': 1431, 'optimizer': 'Adam'}.
2026-05-24 10:59:20,262 - experiment_functions - INFO - Early stopping at epoch 550. Best Metrics: (0.0482748493712451, 0.030264900662251657, 0.044019591042923696)
2026-05-24 10:59:20,868 - optuna.study.study - INFO - Trial 298 finished with values: [0.0482748493712451, 0.030264900662251657, 0.044019591042923696] and parameters: {'n_layers': 1, 'embedding_dim': 256, 'lr': 0.001667262481946792, 'lambda_val': 5.797866699774695e-06, 'batch_size': 2740, 'optimizer': 'RMSprop'}.
2026-05-24 10:59:32,108 - experiment_functions - INFO - Early stopping at epoch 950. Best Metrics: (0.056566844269346474, 0.03446192052980133, 0.049678279618681605)
2026-05-24 10:59:32,406 - optuna.study.study - INFO - Trial 299 finished with values: [0.056566844269346474, 0.03446192052980133, 0.049678279618681605] and parameters: {'n_layers': 1, 'embedding_dim': 64, 'lr': 0.0008645147173682575, 'lambda_val': 5.797866699774695e-06, 'batch_size': 2901, 'optimizer': 'Adam'}.
2026-05-24 10:59:32,421 - root - INFO - Selected Trial 288 based on Max ndcg: 0.0586
2026-05-24 10:59:32,422 - root - INFO - Associated Recall: 0.0658
2026-05-24 10:59:32,422 - experiment_functions - INFO - Training the best model ... for e_1M_1c1dcs_rand2
2026-05-24 11:00:09,376 - experiment_functions - INFO - Early stopping at epoch 3450. Best Metrics: (0.06475982860674913, 0.03839403973509934, 0.05629408223254266)
2026-05-24 11:00:10,449 - root - INFO -   **** Training e_1M_1c1dcs_rand3
2026-05-24 11:00:10,505 - root - INFO -   **** Getting 190231/805443 random edges
2026-05-24 11:00:10,924 - optuna.storages._rdb.storage - INFO - A new study created in RDB with name: Study_e_1M_1c1dcs_rand3
2026-05-24 11:00:16,846 - experiment_functions - INFO - Early stopping at epoch 500. Best Metrics: (0.004819061572682231, 0.003998344370860927, 0.00502440024981596)
2026-05-24 11:00:17,770 - optuna.study.study - INFO - Trial 0 finished with values: [0.004819061572682231, 0.003998344370860927, 0.00502440024981596] and parameters: {'n_layers': 2, 'embedding_dim': 32, 'lr': 0.00018773198932182955, 'lambda_val': 0.001023536186227154, 'batch_size': 2356, 'optimizer': 'SGD'}.
2026-05-24 11:00:23,790 - experiment_functions - INFO - Early stopping at epoch 500. Best Metrics: (0.005153632715885561, 0.004263245033112583, 0.005285358232874575)
2026-05-24 11:00:24,178 - optuna.study.study - INFO - Trial 1 finished with values: [0.005153632715885561, 0.004263245033112583, 0.005285358232874575] and parameters: {'n_layers': 1, 'embedding_dim': 32, 'lr': 2.5994299694258643e-05, 'lambda_val': 0.007484189754343186, 'batch_size': 3460, 'optimizer': 'SGD'}.
2026-05-24 11:00:31,347 - experiment_functions - INFO - Early stopping at epoch 550. Best Metrics: (0.048975326084046936, 0.030852649006622514, 0.043530262695765556)
2026-05-24 11:00:31,448 - optuna.study.study - INFO - Trial 2 finished with values: [0.048975326084046936, 0.030852649006622514, 0.043530262695765556] and parameters: {'n_layers': 2, 'embedding_dim': 96, 'lr': 0.00666600922301573, 'lambda_val': 0.0018912353521433405, 'batch_size': 944, 'optimizer': 'Adam'}.
2026-05-24 11:01:23,157 - optuna.study.study - INFO - Trial 3 finished with values: [0.022992730472335975, 0.01353476821192053, 0.01952158424099684] and parameters: {'n_layers': 4, 'embedding_dim': 128, 'lr': 0.0047730096360144355, 'lambda_val': 6.086586423630953e-05, 'batch_size': 2294, 'optimizer': 'RMSprop'}.
2026-05-24 11:01:29,641 - experiment_functions - INFO - Early stopping at epoch 500. Best Metrics: (0.009680030895854189, 0.008344370860927153, 0.010802854379054283)
2026-05-24 11:01:30,174 - optuna.study.study - INFO - Trial 4 finished with values: [0.009680030895854189, 0.008344370860927153, 0.010802854379054283] and parameters: {'n_layers': 3, 'embedding_dim': 64, 'lr': 0.09649987489792845, 'lambda_val': 0.0199181156306536, 'batch_size': 1238, 'optimizer': 'RMSprop'}.
2026-05-24 11:01:37,897 - experiment_functions - INFO - Early stopping at epoch 550. Best Metrics: (0.044179225352938854, 0.02861754966887417, 0.03981363755023083)
2026-05-24 11:01:37,996 - optuna.study.study - INFO - Trial 5 finished with values: [0.044179225352938854, 0.02861754966887417, 0.03981363755023083] and parameters: {'n_layers': 1, 'embedding_dim': 128, 'lr': 0.002147597357064978, 'lambda_val': 0.0001303671050452136, 'batch_size': 3482, 'optimizer': 'RMSprop'}.
2026-05-24 11:01:44,974 - experiment_functions - INFO - Early stopping at epoch 500. Best Metrics: (0.004474654624701436, 0.003824503311258278, 0.004473878961581215)
2026-05-24 11:01:45,068 - optuna.study.study - INFO - Trial 6 finished with values: [0.004474654624701436, 0.003824503311258278, 0.004473878961581215] and parameters: {'n_layers': 4, 'embedding_dim': 128, 'lr': 5.9850256179740695e-05, 'lambda_val': 0.025242442012984926, 'batch_size': 2035, 'optimizer': 'SGD'}.
2026-05-24 11:01:51,144 - experiment_functions - INFO - Early stopping at epoch 500. Best Metrics: (0.004601734048761864, 0.0041390728476821195, 0.005072202407270601)
2026-05-24 11:01:51,956 - optuna.study.study - INFO - Trial 7 finished with values: [0.004601734048761864, 0.0041390728476821195, 0.005072202407270601] and parameters: {'n_layers': 1, 'embedding_dim': 96, 'lr': 0.03181118776859795, 'lambda_val': 1.9349256762198913e-06, 'batch_size': 2383, 'optimizer': 'SGD'}.
2026-05-24 11:01:58,595 - experiment_functions - INFO - Early stopping at epoch 500. Best Metrics: (0.0044129476011816144, 0.003981788079470199, 0.005082779909580649)
2026-05-24 11:01:59,637 - optuna.study.study - INFO - Trial 8 finished with values: [0.0044129476011816144, 0.003981788079470199, 0.005082779909580649] and parameters: {'n_layers': 3, 'embedding_dim': 96, 'lr': 0.00028091997165370923, 'lambda_val': 0.00016104830178885682, 'batch_size': 2224, 'optimizer': 'SGD'}.
2026-05-24 11:02:09,040 - experiment_functions - INFO - Early stopping at epoch 550. Best Metrics: (0.014056934006216795, 0.01192880794701987, 0.013689040820039754)
2026-05-24 11:02:09,814 - optuna.study.study - INFO - Trial 9 finished with values: [0.014056934006216795, 0.01192880794701987, 0.013689040820039754] and parameters: {'n_layers': 4, 'embedding_dim': 256, 'lr': 0.0050448109347620345, 'lambda_val': 8.876623948407677e-06, 'batch_size': 746, 'optimizer': 'Adam'}.
2026-05-24 11:02:18,726 - experiment_functions - INFO - Early stopping at epoch 500. Best Metrics: (0.006256115858592801, 0.004602649006622517, 0.006114195725864716)
2026-05-24 11:02:18,890 - optuna.study.study - INFO - Trial 10 finished with values: [0.006256115858592801, 0.004602649006622517, 0.006114195725864716] and parameters: {'n_layers': 4, 'embedding_dim': 256, 'lr': 0.0005493990269458161, 'lambda_val': 4.409124825621956e-05, 'batch_size': 3906, 'optimizer': 'SGD'}.
2026-05-24 11:03:24,624 - optuna.study.study - INFO - Trial 11 finished with values: [0.03666881211778607, 0.024776490066225162, 0.03472474792592081] and parameters: {'n_layers': 4, 'embedding_dim': 256, 'lr': 9.72729409185319e-05, 'lambda_val': 4.598956818766828e-05, 'batch_size': 1297, 'optimizer': 'Adam'}.
2026-05-24 11:03:33,664 - experiment_functions - INFO - Early stopping at epoch 500. Best Metrics: (0.005131647994606441, 0.004155629139072848, 0.0052037060770905395)
2026-05-24 11:03:33,758 - optuna.study.study - INFO - Trial 12 finished with values: [0.005131647994606441, 0.004155629139072848, 0.0052037060770905395] and parameters: {'n_layers': 4, 'embedding_dim': 256, 'lr': 0.010117298608084998, 'lambda_val': 0.009458917183185866, 'batch_size': 2504, 'optimizer': 'SGD'}.
2026-05-24 11:03:41,184 - experiment_functions - INFO - Early stopping at epoch 550. Best Metrics: (0.005442362488845127, 0.004403973509933775, 0.005407756035700522)
2026-05-24 11:03:41,277 - optuna.study.study - INFO - Trial 13 finished with values: [0.005442362488845127, 0.004403973509933775, 0.005407756035700522] and parameters: {'n_layers': 3, 'embedding_dim': 96, 'lr': 0.011633146306519645, 'lambda_val': 0.0007876603285208243, 'batch_size': 1385, 'optimizer': 'SGD'}.
2026-05-24 11:03:49,008 - experiment_functions - INFO - Early stopping at epoch 550. Best Metrics: (0.03171466461513337, 0.02278973509933775, 0.030717914576457457)
2026-05-24 11:03:49,123 - optuna.study.study - INFO - Trial 14 finished with values: [0.03171466461513337, 0.02278973509933775, 0.030717914576457457] and parameters: {'n_layers': 2, 'embedding_dim': 96, 'lr': 0.006049776403747943, 'lambda_val': 8.911285735615227e-05, 'batch_size': 3219, 'optimizer': 'Adam'}.
2026-05-24 11:03:57,082 - experiment_functions - INFO - Early stopping at epoch 500. Best Metrics: (0.004795265239725773, 0.004172185430463576, 0.005097820501921015)
2026-05-24 11:03:57,183 - optuna.study.study - INFO - Trial 15 finished with values: [0.004795265239725773, 0.004172185430463576, 0.005097820501921015] and parameters: {'n_layers': 3, 'embedding_dim': 128, 'lr': 1.4606571916513919e-05, 'lambda_val': 0.028198731653279307, 'batch_size': 1327, 'optimizer': 'SGD'}.
2026-05-24 11:04:06,778 - experiment_functions - INFO - Early stopping at epoch 700. Best Metrics: (0.034845318127924706, 0.023882450331125828, 0.03172303789738857)
2026-05-24 11:04:06,868 - optuna.study.study - INFO - Trial 16 finished with values: [0.034845318127924706, 0.023882450331125828, 0.03172303789738857] and parameters: {'n_layers': 4, 'embedding_dim': 64, 'lr': 0.0005910069120800205, 'lambda_val': 7.481780308257389e-06, 'batch_size': 775, 'optimizer': 'RMSprop'}.
2026-05-24 11:04:29,040 - experiment_functions - INFO - Early stopping at epoch 1600. Best Metrics: (0.03169292291583128, 0.01991721854304636, 0.028904742459020208)
2026-05-24 11:04:29,119 - optuna.study.study - INFO - Trial 17 finished with values: [0.03169292291583128, 0.01991721854304636, 0.028904742459020208] and parameters: {'n_layers': 2, 'embedding_dim': 256, 'lr': 0.004578716191415064, 'lambda_val': 0.00024416758921277655, 'batch_size': 1668, 'optimizer': 'RMSprop'}.
2026-05-24 11:04:42,917 - experiment_functions - INFO - Early stopping at epoch 1100. Best Metrics: (0.008040786299987, 0.008245033112582782, 0.009697590880330705)
2026-05-24 11:04:43,006 - optuna.study.study - INFO - Trial 18 finished with values: [0.008040786299987, 0.008245033112582782, 0.009697590880330705] and parameters: {'n_layers': 1, 'embedding_dim': 256, 'lr': 0.059285986893342094, 'lambda_val': 1.504268404735613e-05, 'batch_size': 1246, 'optimizer': 'RMSprop'}.
2026-05-24 11:04:50,151 - experiment_functions - INFO - Early stopping at epoch 550. Best Metrics: (0.0523488253983939, 0.03129139072847682, 0.04482054958554978)
2026-05-24 11:04:50,841 - optuna.study.study - INFO - Trial 19 finished with values: [0.0523488253983939, 0.03129139072847682, 0.04482054958554978] and parameters: {'n_layers': 1, 'embedding_dim': 64, 'lr': 0.007734430860530913, 'lambda_val': 0.01723991176853604, 'batch_size': 1036, 'optimizer': 'Adam'}.
2026-05-24 11:04:58,080 - experiment_functions - INFO - Early stopping at epoch 500. Best Metrics: (0.004763968770342622, 0.004031456953642384, 0.004835220754583965)
2026-05-24 11:04:58,444 - optuna.study.study - INFO - Trial 20 finished with values: [0.004763968770342622, 0.004031456953642384, 0.004835220754583965] and parameters: {'n_layers': 3, 'embedding_dim': 128, 'lr': 1.1055384105413037e-05, 'lambda_val': 0.018879263201751168, 'batch_size': 3716, 'optimizer': 'Adam'}.
2026-05-24 11:05:04,500 - experiment_functions - INFO - Early stopping at epoch 500. Best Metrics: (0.0047475047487491135, 0.0038079470198675498, 0.004677823634052782)
2026-05-24 11:05:05,570 - optuna.study.study - INFO - Trial 21 finished with values: [0.0047475047487491135, 0.0038079470198675498, 0.004677823634052782] and parameters: {'n_layers': 2, 'embedding_dim': 32, 'lr': 0.006102242748295772, 'lambda_val': 1.4345161555541182e-06, 'batch_size': 704, 'optimizer': 'SGD'}.
2026-05-24 11:05:11,535 - experiment_functions - INFO - Early stopping at epoch 500. Best Metrics: (0.004502674244440807, 0.0038658940397350997, 0.004913478876299425)
2026-05-24 11:05:12,397 - optuna.study.study - INFO - Trial 22 finished with values: [0.004502674244440807, 0.0038658940397350997, 0.004913478876299425] and parameters: {'n_layers': 1, 'embedding_dim': 64, 'lr': 0.009521363220679336, 'lambda_val': 0.0023274365938951666, 'batch_size': 2294, 'optimizer': 'SGD'}.
2026-05-24 11:05:18,571 - experiment_functions - INFO - Early stopping at epoch 500. Best Metrics: (0.004683974133332835, 0.00402317880794702, 0.005062480538163924)
2026-05-24 11:05:19,356 - optuna.study.study - INFO - Trial 23 finished with values: [0.004683974133332835, 0.00402317880794702, 0.005062480538163924] and parameters: {'n_layers': 2, 'embedding_dim': 64, 'lr': 0.0012057944927737361, 'lambda_val': 0.0034451532245627563, 'batch_size': 3332, 'optimizer': 'SGD'}.
2026-05-24 11:05:38,546 - experiment_functions - INFO - Early stopping at epoch 1600. Best Metrics: (0.02723899941051707, 0.017524834437086093, 0.025038097691262633)
2026-05-24 11:05:39,357 - optuna.study.study - INFO - Trial 24 finished with values: [0.02723899941051707, 0.017524834437086093, 0.025038097691262633] and parameters: {'n_layers': 2, 'embedding_dim': 128, 'lr': 0.008845891118614167, 'lambda_val': 0.0015005255271309918, 'batch_size': 2188, 'optimizer': 'Adam'}.
2026-05-24 11:06:18,403 - experiment_functions - INFO - Early stopping at epoch 2600. Best Metrics: (0.004982885835807733, 0.004420529801324504, 0.005299343723216633)
2026-05-24 11:06:18,486 - optuna.study.study - INFO - Trial 25 finished with values: [0.004982885835807733, 0.004420529801324504, 0.005299343723216633] and parameters: {'n_layers': 4, 'embedding_dim': 256, 'lr': 1.0826096017652389e-05, 'lambda_val': 3.0861181727080215e-06, 'batch_size': 596, 'optimizer': 'Adam'}.
2026-05-24 11:06:25,363 - experiment_functions - INFO - Early stopping at epoch 500. Best Metrics: (0.00549348378572248, 0.004346026490066225, 0.005529179379229934)
2026-05-24 11:06:25,457 - optuna.study.study - INFO - Trial 26 finished with values: [0.00549348378572248, 0.004346026490066225, 0.005529179379229934] and parameters: {'n_layers': 4, 'embedding_dim': 96, 'lr': 0.0004558328623991489, 'lambda_val': 0.0004852358905432713, 'batch_size': 2557, 'optimizer': 'SGD'}.
2026-05-24 11:06:31,613 - experiment_functions - INFO - Early stopping at epoch 500. Best Metrics: (0.005257503396164507, 0.004329470198675497, 0.005719923882440901)
