2026-05-24 10:15:25,936 - optuna.study.study - INFO - Trial 139 finished with values: [0.05163133721008149, 0.031241721854304634, 0.04638609180608867] and parameters: {'n_layers': 2, 'embedding_dim': 32, 'lr': 0.0011985229591796502, 'lambda_val': 0.0009904374338936715, 'batch_size': 1467, 'optimizer': 'RMSprop'}.
2026-05-24 10:15:34,312 - experiment_functions - INFO - Early stopping at epoch 650. Best Metrics: (0.015540971791164648, 0.012177152317880795, 0.01616929308458314)
2026-05-24 10:15:34,421 - optuna.study.study - INFO - Trial 140 finished with values: [0.015540971791164648, 0.012177152317880795, 0.01616929308458314] and parameters: {'n_layers': 1, 'embedding_dim': 64, 'lr': 0.03965113881953134, 'lambda_val': 4.336462830610492e-06, 'batch_size': 1264, 'optimizer': 'Adam'}.
2026-05-24 10:16:17,752 - experiment_functions - INFO - Early stopping at epoch 3550. Best Metrics: (0.0268638337506368, 0.01968543046357616, 0.026117323964128573)
2026-05-24 10:16:17,861 - optuna.study.study - INFO - Trial 141 finished with values: [0.0268638337506368, 0.01968543046357616, 0.026117323964128573] and parameters: {'n_layers': 4, 'embedding_dim': 32, 'lr': 0.0002008346621954922, 'lambda_val': 6.700238629685478e-06, 'batch_size': 2740, 'optimizer': 'Adam'}.
2026-05-24 10:16:25,478 - experiment_functions - INFO - Early stopping at epoch 550. Best Metrics: (0.02392171563499801, 0.017624172185430463, 0.023451747190489456)
2026-05-24 10:16:25,585 - optuna.study.study - INFO - Trial 142 finished with values: [0.02392171563499801, 0.017624172185430463, 0.023451747190489456] and parameters: {'n_layers': 4, 'embedding_dim': 32, 'lr': 0.0013978493934357974, 'lambda_val': 0.0005149605398707555, 'batch_size': 3366, 'optimizer': 'RMSprop'}.
2026-05-24 10:16:37,209 - experiment_functions - INFO - Early stopping at epoch 700. Best Metrics: (0.022476116771111374, 0.013940397350993379, 0.020261588602315507)
2026-05-24 10:16:37,384 - optuna.study.study - INFO - Trial 143 finished with values: [0.022476116771111374, 0.013940397350993379, 0.020261588602315507] and parameters: {'n_layers': 3, 'embedding_dim': 256, 'lr': 0.018571577973460266, 'lambda_val': 6.005415185221812e-05, 'batch_size': 3281, 'optimizer': 'Adam'}.
2026-05-24 10:16:45,595 - experiment_functions - INFO - Early stopping at epoch 550. Best Metrics: (0.03593353157818917, 0.02475165562913907, 0.034443287571545786)
2026-05-24 10:16:45,710 - optuna.study.study - INFO - Trial 144 finished with values: [0.03593353157818917, 0.02475165562913907, 0.034443287571545786] and parameters: {'n_layers': 3, 'embedding_dim': 128, 'lr': 0.0028931100527333827, 'lambda_val': 0.00325865136231477, 'batch_size': 2257, 'optimizer': 'Adam'}.
2026-05-24 10:17:27,975 - optuna.study.study - INFO - Trial 145 finished with values: [0.006601970311015605, 0.005033112582781457, 0.006497231523128243] and parameters: {'n_layers': 1, 'embedding_dim': 64, 'lr': 8.530575486069038e-05, 'lambda_val': 0.0004231980579073248, 'batch_size': 1835, 'optimizer': 'RMSprop'}.
2026-05-24 10:17:41,313 - experiment_functions - INFO - Early stopping at epoch 900. Best Metrics: (0.02679895714937255, 0.01639072847682119, 0.023672493767422628)
2026-05-24 10:17:42,352 - optuna.study.study - INFO - Trial 146 finished with values: [0.02679895714937255, 0.01639072847682119, 0.023672493767422628] and parameters: {'n_layers': 2, 'embedding_dim': 256, 'lr': 0.01123660950428263, 'lambda_val': 0.0002459174676883048, 'batch_size': 3462, 'optimizer': 'Adam'}.
2026-05-24 10:17:49,383 - experiment_functions - INFO - Early stopping at epoch 500. Best Metrics: (0.005605938173681403, 0.004271523178807947, 0.0056662511155797304)
2026-05-24 10:17:49,487 - optuna.study.study - INFO - Trial 147 finished with values: [0.005605938173681403, 0.004271523178807947, 0.0056662511155797304] and parameters: {'n_layers': 1, 'embedding_dim': 256, 'lr': 0.009194213632540334, 'lambda_val': 1.2584915483536783e-06, 'batch_size': 2082, 'optimizer': 'SGD'}.
2026-05-24 10:18:07,271 - experiment_functions - INFO - Early stopping at epoch 1400. Best Metrics: (0.05511914701751157, 0.03388245033112583, 0.04883023771614164)
2026-05-24 10:18:07,377 - optuna.study.study - INFO - Trial 148 finished with values: [0.05511914701751157, 0.03388245033112583, 0.04883023771614164] and parameters: {'n_layers': 2, 'embedding_dim': 64, 'lr': 0.00033909998390093353, 'lambda_val': 1.9563512568026275e-06, 'batch_size': 2129, 'optimizer': 'RMSprop'}.
2026-05-24 10:18:15,127 - experiment_functions - INFO - Early stopping at epoch 550. Best Metrics: (0.009475741353083687, 0.010124172185430463, 0.011269858647233242)
2026-05-24 10:18:15,238 - optuna.study.study - INFO - Trial 149 finished with values: [0.009475741353083687, 0.010124172185430463, 0.011269858647233242] and parameters: {'n_layers': 4, 'embedding_dim': 32, 'lr': 0.001899902997628999, 'lambda_val': 0.06666595456683828, 'batch_size': 3139, 'optimizer': 'RMSprop'}.
2026-05-24 10:18:23,572 - experiment_functions - INFO - Early stopping at epoch 550. Best Metrics: (0.03858034362525688, 0.02509933774834437, 0.034652968841258104)
2026-05-24 10:18:23,672 - optuna.study.study - INFO - Trial 150 finished with values: [0.03858034362525688, 0.02509933774834437, 0.034652968841258104] and parameters: {'n_layers': 3, 'embedding_dim': 128, 'lr': 0.0028931100527333827, 'lambda_val': 0.00325865136231477, 'batch_size': 1780, 'optimizer': 'Adam'}.
2026-05-24 10:19:10,568 - optuna.study.study - INFO - Trial 151 finished with values: [0.05888560921556811, 0.03568708609271523, 0.05142041977408716] and parameters: {'n_layers': 1, 'embedding_dim': 64, 'lr': 0.00033909998390093353, 'lambda_val': 5.797866699774695e-06, 'batch_size': 2129, 'optimizer': 'RMSprop'}.
2026-05-24 10:19:18,375 - experiment_functions - INFO - Early stopping at epoch 550. Best Metrics: (0.03800244074382752, 0.02486754966887417, 0.03496748480086171)
2026-05-24 10:19:18,491 - optuna.study.study - INFO - Trial 152 finished with values: [0.03800244074382752, 0.02486754966887417, 0.03496748480086171] and parameters: {'n_layers': 3, 'embedding_dim': 96, 'lr': 0.002746129425384238, 'lambda_val': 0.00325865136231477, 'batch_size': 2844, 'optimizer': 'Adam'}.
2026-05-24 10:19:26,791 - experiment_functions - INFO - Early stopping at epoch 550. Best Metrics: (0.03939655574631658, 0.026374172185430464, 0.03518194655034735)
2026-05-24 10:19:27,032 - optuna.study.study - INFO - Trial 153 finished with values: [0.03939655574631658, 0.026374172185430464, 0.03518194655034735] and parameters: {'n_layers': 3, 'embedding_dim': 128, 'lr': 0.004028743321822881, 'lambda_val': 0.00021172971583081288, 'batch_size': 716, 'optimizer': 'Adam'}.
2026-05-24 10:19:35,156 - experiment_functions - INFO - Early stopping at epoch 550. Best Metrics: (0.009633254171509566, 0.00945364238410596, 0.011015628806868915)
2026-05-24 10:19:35,265 - optuna.study.study - INFO - Trial 154 finished with values: [0.009633254171509566, 0.00945364238410596, 0.011015628806868915] and parameters: {'n_layers': 4, 'embedding_dim': 96, 'lr': 0.0028931100527333827, 'lambda_val': 0.003154130669772898, 'batch_size': 1829, 'optimizer': 'RMSprop'}.
2026-05-24 10:20:15,282 - experiment_functions - INFO - Early stopping at epoch 3400. Best Metrics: (0.03066316943751005, 0.02196192052980132, 0.0293358822738789)
2026-05-24 10:20:15,879 - optuna.study.study - INFO - Trial 155 finished with values: [0.03066316943751005, 0.02196192052980132, 0.0293358822738789] and parameters: {'n_layers': 1, 'embedding_dim': 96, 'lr': 0.0028931100527333827, 'lambda_val': 0.003154130669772898, 'batch_size': 3945, 'optimizer': 'RMSprop'}.
2026-05-24 10:20:23,247 - experiment_functions - INFO - Early stopping at epoch 550. Best Metrics: (0.028587110764572887, 0.02096854304635762, 0.0273337057176267)
2026-05-24 10:20:23,364 - optuna.study.study - INFO - Trial 156 finished with values: [0.028587110764572887, 0.02096854304635762, 0.0273337057176267] and parameters: {'n_layers': 3, 'embedding_dim': 32, 'lr': 0.00660067706198712, 'lambda_val': 1.9563512568026275e-06, 'batch_size': 2836, 'optimizer': 'Adam'}.
2026-05-24 10:20:31,296 - experiment_functions - INFO - Early stopping at epoch 500. Best Metrics: (0.004708296337330164, 0.003857615894039736, 0.00484777400369867)
2026-05-24 10:20:32,294 - optuna.study.study - INFO - Trial 157 finished with values: [0.004708296337330164, 0.003857615894039736, 0.00484777400369867] and parameters: {'n_layers': 4, 'embedding_dim': 128, 'lr': 3.413483805082746e-05, 'lambda_val': 0.00325865136231477, 'batch_size': 2257, 'optimizer': 'Adam'}.
2026-05-24 10:20:41,088 - experiment_functions - INFO - Early stopping at epoch 650. Best Metrics: (0.04583991576661254, 0.02986754966887418, 0.042876128819075945)
2026-05-24 10:20:41,205 - optuna.study.study - INFO - Trial 158 finished with values: [0.04583991576661254, 0.02986754966887418, 0.042876128819075945] and parameters: {'n_layers': 2, 'embedding_dim': 32, 'lr': 0.0011985229591796502, 'lambda_val': 0.0009904374338936715, 'batch_size': 1467, 'optimizer': 'RMSprop'}.
2026-05-24 10:20:49,938 - experiment_functions - INFO - Early stopping at epoch 600. Best Metrics: (0.031202477460463753, 0.021506622516556294, 0.02807755207708597)
2026-05-24 10:20:50,046 - optuna.study.study - INFO - Trial 159 finished with values: [0.031202477460463753, 0.021506622516556294, 0.02807755207708597] and parameters: {'n_layers': 3, 'embedding_dim': 96, 'lr': 0.0013978493934357974, 'lambda_val': 2.5452815323641335e-06, 'batch_size': 3366, 'optimizer': 'Adam'}.
2026-05-24 10:20:59,730 - experiment_functions - INFO - Early stopping at epoch 750. Best Metrics: (0.05822682307109795, 0.035306291390728474, 0.05074223310377778)
2026-05-24 10:21:00,070 - optuna.study.study - INFO - Trial 160 finished with values: [0.05822682307109795, 0.035306291390728474, 0.05074223310377778] and parameters: {'n_layers': 1, 'embedding_dim': 64, 'lr': 0.001667262481946792, 'lambda_val': 0.003154130669772898, 'batch_size': 1780, 'optimizer': 'Adam'}.
2026-05-24 10:21:46,290 - optuna.study.study - INFO - Trial 161 finished with values: [0.059897486438251844, 0.03563741721854305, 0.05258353179885255] and parameters: {'n_layers': 1, 'embedding_dim': 64, 'lr': 0.00033909998390093353, 'lambda_val': 2.5452815323641335e-06, 'batch_size': 2129, 'optimizer': 'Adam'}.
2026-05-24 10:21:52,749 - experiment_functions - INFO - Early stopping at epoch 500. Best Metrics: (0.005261461124619061, 0.004362582781456954, 0.005497138269458645)
2026-05-24 10:21:53,893 - optuna.study.study - INFO - Trial 162 finished with values: [0.005261461124619061, 0.004362582781456954, 0.005497138269458645] and parameters: {'n_layers': 1, 'embedding_dim': 32, 'lr': 0.001667262481946792, 'lambda_val': 9.53537074710909e-06, 'batch_size': 1467, 'optimizer': 'SGD'}.
2026-05-24 10:22:35,622 - experiment_functions - INFO - Early stopping at epoch 2800. Best Metrics: (0.02719118871553267, 0.01630794701986755, 0.023629997273585557)
2026-05-24 10:22:35,724 - optuna.study.study - INFO - Trial 163 finished with values: [0.02719118871553267, 0.01630794701986755, 0.023629997273585557] and parameters: {'n_layers': 3, 'embedding_dim': 256, 'lr': 0.00660067706198712, 'lambda_val': 1.2584915483536783e-06, 'batch_size': 1431, 'optimizer': 'Adam'}.
2026-05-24 10:23:26,773 - optuna.study.study - INFO - Trial 164 finished with values: [0.026065331864578715, 0.016746688741721857, 0.023217992911705676] and parameters: {'n_layers': 3, 'embedding_dim': 128, 'lr': 0.004028743321822881, 'lambda_val': 1.9563512568026275e-06, 'batch_size': 1930, 'optimizer': 'RMSprop'}.
2026-05-24 10:23:36,828 - experiment_functions - INFO - Early stopping at epoch 550. Best Metrics: (0.029358352884784143, 0.019768211920529802, 0.02767347913745804)
2026-05-24 10:23:37,132 - optuna.study.study - INFO - Trial 165 finished with values: [0.029358352884784143, 0.019768211920529802, 0.02767347913745804] and parameters: {'n_layers': 4, 'embedding_dim': 256, 'lr': 0.0013978493934357974, 'lambda_val': 6.700238629685478e-06, 'batch_size': 2844, 'optimizer': 'Adam'}.
2026-05-24 10:23:45,506 - experiment_functions - INFO - Early stopping at epoch 600. Best Metrics: (0.05687492583452412, 0.03446192052980132, 0.05007413086836227)
2026-05-24 10:23:45,620 - optuna.study.study - INFO - Trial 166 finished with values: [0.05687492583452412, 0.03446192052980132, 0.05007413086836227] and parameters: {'n_layers': 1, 'embedding_dim': 64, 'lr': 0.004028743321822881, 'lambda_val': 1.9563512568026275e-06, 'batch_size': 2844, 'optimizer': 'Adam'}.
2026-05-24 10:23:52,506 - experiment_functions - INFO - Early stopping at epoch 500. Best Metrics: (0.004656833058241925, 0.004097682119205298, 0.004802863132260002)
2026-05-24 10:23:53,641 - optuna.study.study - INFO - Trial 167 finished with values: [0.004656833058241925, 0.004097682119205298, 0.004802863132260002] and parameters: {'n_layers': 1, 'embedding_dim': 128, 'lr': 0.0001336559158336372, 'lambda_val': 1.6361223952928733e-05, 'batch_size': 1930, 'optimizer': 'SGD'}.
2026-05-24 10:24:01,943 - experiment_functions - INFO - Early stopping at epoch 600. Best Metrics: (0.050549809222991675, 0.03132450331125828, 0.04617087252214729)
2026-05-24 10:24:02,140 - optuna.study.study - INFO - Trial 168 finished with values: [0.050549809222991675, 0.03132450331125828, 0.04617087252214729] and parameters: {'n_layers': 1, 'embedding_dim': 96, 'lr': 0.002746129425384238, 'lambda_val': 2.5452815323641335e-06, 'batch_size': 2844, 'optimizer': 'Adam'}.
2026-05-24 10:24:10,997 - experiment_functions - INFO - Early stopping at epoch 550. Best Metrics: (0.011457842655733163, 0.010670529801324503, 0.012506582374891186)
2026-05-24 10:24:11,102 - optuna.study.study - INFO - Trial 169 finished with values: [0.011457842655733163, 0.010670529801324503, 0.012506582374891186] and parameters: {'n_layers': 3, 'embedding_dim': 256, 'lr': 0.0011985229591796502, 'lambda_val': 0.02379533453548611, 'batch_size': 1467, 'optimizer': 'RMSprop'}.
2026-05-24 10:24:18,512 - experiment_functions - INFO - Early stopping at epoch 550. Best Metrics: (0.04094227114694894, 0.02802980132450331, 0.03776642749699197)
2026-05-24 10:24:18,620 - optuna.study.study - INFO - Trial 170 finished with values: [0.04094227114694894, 0.02802980132450331, 0.03776642749699197] and parameters: {'n_layers': 1, 'embedding_dim': 64, 'lr': 0.0028931100527333827, 'lambda_val': 0.003154130669772898, 'batch_size': 2257, 'optimizer': 'RMSprop'}.
2026-05-24 10:24:26,167 - experiment_functions - INFO - Early stopping at epoch 550. Best Metrics: (0.02392833169356947, 0.019668874172185432, 0.025544556618231958)
2026-05-24 10:24:26,278 - optuna.study.study - INFO - Trial 171 finished with values: [0.02392833169356947, 0.019668874172185432, 0.025544556618231958] and parameters: {'n_layers': 1, 'embedding_dim': 32, 'lr': 0.005921142718785096, 'lambda_val': 5.797866699774695e-06, 'batch_size': 1467, 'optimizer': 'RMSprop'}.
2026-05-24 10:24:34,075 - experiment_functions - INFO - Early stopping at epoch 550. Best Metrics: (0.054047204788587225, 0.032922185430463574, 0.0464595479005466)
2026-05-24 10:24:34,185 - optuna.study.study - INFO - Trial 172 finished with values: [0.054047204788587225, 0.032922185430463574, 0.0464595479005466] and parameters: {'n_layers': 2, 'embedding_dim': 32, 'lr': 0.00660067706198712, 'lambda_val': 0.00325865136231477, 'batch_size': 2129, 'optimizer': 'Adam'}.
2026-05-24 10:24:43,948 - experiment_functions - INFO - Early stopping at epoch 550. Best Metrics: (0.02668717791709339, 0.020918874172185433, 0.02731583587027112)
2026-05-24 10:24:44,157 - optuna.study.study - INFO - Trial 173 finished with values: [0.02668717791709339, 0.020918874172185433, 0.02731583587027112] and parameters: {'n_layers': 1, 'embedding_dim': 64, 'lr': 0.004028743321822881, 'lambda_val': 0.00021172971583081288, 'batch_size': 2901, 'optimizer': 'RMSprop'}.
2026-05-24 10:24:53,336 - experiment_functions - INFO - Early stopping at epoch 650. Best Metrics: (0.05600813162959538, 0.0345612582781457, 0.050613911474917755)
2026-05-24 10:24:53,441 - optuna.study.study - INFO - Trial 174 finished with values: [0.05600813162959538, 0.0345612582781457, 0.050613911474917755] and parameters: {'n_layers': 1, 'embedding_dim': 256, 'lr': 0.001667262481946792, 'lambda_val': 0.00038449950728469576, 'batch_size': 2740, 'optimizer': 'Adam'}.
2026-05-24 10:25:00,908 - experiment_functions - INFO - Early stopping at epoch 550. Best Metrics: (0.02864336639341446, 0.020041390728476823, 0.02801373665079321)
2026-05-24 10:25:01,010 - optuna.study.study - INFO - Trial 175 finished with values: [0.02864336639341446, 0.020041390728476823, 0.02801373665079321] and parameters: {'n_layers': 3, 'embedding_dim': 32, 'lr': 0.00660067706198712, 'lambda_val': 0.00325865136231477, 'batch_size': 2484, 'optimizer': 'Adam'}.
2026-05-24 10:25:09,821 - experiment_functions - INFO - Early stopping at epoch 650. Best Metrics: (0.05434374096110397, 0.03408940397350994, 0.049299275374699934)
2026-05-24 10:25:09,921 - optuna.study.study - INFO - Trial 176 finished with values: [0.05434374096110397, 0.03408940397350994, 0.049299275374699934] and parameters: {'n_layers': 1, 'embedding_dim': 96, 'lr': 0.003043283191241845, 'lambda_val': 1.2584915483536783e-06, 'batch_size': 961, 'optimizer': 'Adam'}.
2026-05-24 10:25:49,900 - experiment_functions - INFO - Early stopping at epoch 3250. Best Metrics: (0.04665645544582338, 0.029718543046357616, 0.041157582171393765)
2026-05-24 10:25:50,167 - optuna.study.study - INFO - Trial 177 finished with values: [0.04665645544582338, 0.029718543046357616, 0.041157582171393765] and parameters: {'n_layers': 3, 'embedding_dim': 64, 'lr': 0.0002008346621954922, 'lambda_val': 5.198475548557465e-05, 'batch_size': 1829, 'optimizer': 'Adam'}.
2026-05-24 10:26:45,289 - optuna.study.study - INFO - Trial 178 finished with values: [0.0298234165705481, 0.020306291390728478, 0.02789307209508467] and parameters: {'n_layers': 4, 'embedding_dim': 128, 'lr': 8.530575486069038e-05, 'lambda_val': 2.0601952025948555e-06, 'batch_size': 2082, 'optimizer': 'Adam'}.
2026-05-24 10:26:55,476 - experiment_functions - INFO - Early stopping at epoch 750. Best Metrics: (0.058690876261055826, 0.0356953642384106, 0.052605009058068496)
2026-05-24 10:26:56,074 - optuna.study.study - INFO - Trial 179 finished with values: [0.058690876261055826, 0.0356953642384106, 0.052605009058068496] and parameters: {'n_layers': 1, 'embedding_dim': 128, 'lr': 0.001667262481946792, 'lambda_val': 2.5452815323641335e-06, 'batch_size': 1431, 'optimizer': 'Adam'}.
2026-05-24 10:27:09,721 - experiment_functions - INFO - Early stopping at epoch 1050. Best Metrics: (0.06011467914138646, 0.03593543046357616, 0.05520186638195153)
2026-05-24 10:27:09,833 - optuna.study.study - INFO - Trial 180 finished with values: [0.06011467914138646, 0.03593543046357616, 0.05520186638195153] and parameters: {'n_layers': 1, 'embedding_dim': 32, 'lr': 0.0008645147173682575, 'lambda_val': 1.9563512568026275e-06, 'batch_size': 2901, 'optimizer': 'Adam'}.
2026-05-24 10:27:44,736 - experiment_functions - INFO - Early stopping at epoch 3000. Best Metrics: (0.017018802990395005, 0.012475165562913906, 0.016569997120260218)
2026-05-24 10:27:44,843 - optuna.study.study - INFO - Trial 181 finished with values: [0.017018802990395005, 0.012475165562913906, 0.016569997120260218] and parameters: {'n_layers': 3, 'embedding_dim': 32, 'lr': 0.049418549104460134, 'lambda_val': 0.0009904374338936715, 'batch_size': 3160, 'optimizer': 'RMSprop'}.
2026-05-24 10:28:04,409 - experiment_functions - INFO - Early stopping at epoch 1650. Best Metrics: (0.048970479558956156, 0.03276490066225165, 0.042790149494959705)
2026-05-24 10:28:04,583 - optuna.study.study - INFO - Trial 182 finished with values: [0.048970479558956156, 0.03276490066225165, 0.042790149494959705] and parameters: {'n_layers': 2, 'embedding_dim': 32, 'lr': 0.00033909998390093353, 'lambda_val': 0.08238400869901934, 'batch_size': 2129, 'optimizer': 'RMSprop'}.
2026-05-24 10:28:13,388 - experiment_functions - INFO - Early stopping at epoch 650. Best Metrics: (0.005027522829948627, 0.004064569536423841, 0.005121385408402581)
2026-05-24 10:28:13,506 - optuna.study.study - INFO - Trial 183 finished with values: [0.005027522829948627, 0.004064569536423841, 0.005121385408402581] and parameters: {'n_layers': 1, 'embedding_dim': 256, 'lr': 0.009194213632540334, 'lambda_val': 2.0601952025948555e-06, 'batch_size': 2844, 'optimizer': 'SGD'}.
2026-05-24 10:28:38,995 - experiment_functions - INFO - Early stopping at epoch 1650. Best Metrics: (0.028337441177647686, 0.01646523178807947, 0.024670062212714183)
2026-05-24 10:28:39,213 - optuna.study.study - INFO - Trial 184 finished with values: [0.028337441177647686, 0.01646523178807947, 0.024670062212714183] and parameters: {'n_layers': 3, 'embedding_dim': 256, 'lr': 0.005921142718785096, 'lambda_val': 1.9563512568026275e-06, 'batch_size': 2901, 'optimizer': 'Adam'}.
2026-05-24 10:29:03,991 - experiment_functions - INFO - Early stopping at epoch 1850. Best Metrics: (0.040697169446837184, 0.026680463576158938, 0.03924719353487366)
2026-05-24 10:29:04,101 - optuna.study.study - INFO - Trial 185 finished with values: [0.040697169446837184, 0.026680463576158938, 0.03924719353487366] and parameters: {'n_layers': 3, 'embedding_dim': 96, 'lr': 0.0002008346621954922, 'lambda_val': 0.00038449950728469576, 'batch_size': 2742, 'optimizer': 'RMSprop'}.
2026-05-24 10:29:46,483 - experiment_functions - INFO - Early stopping at epoch 3850. Best Metrics: (0.006428200801916725, 0.004958609271523179, 0.006653175616026013)
