2026-05-24 02:33:11,084 - optuna.study.study - INFO - Trial 286 finished with values: [0.023296202645919157, 0.017450331125827816, 0.023989214183706222] and parameters: {'n_layers': 3, 'embedding_dim': 96, 'lr': 0.0005233015481570266, 'lambda_val': 1.858625399381744e-05, 'batch_size': 664, 'optimizer': 'Adam'}.
2026-05-24 02:33:19,044 - experiment_functions - INFO - Early stopping at epoch 650. Best Metrics: (0.022756123204946684, 0.01673013245033113, 0.02295342578029507)
2026-05-24 02:33:20,769 - optuna.study.study - INFO - Trial 287 finished with values: [0.022756123204946684, 0.01673013245033113, 0.02295342578029507] and parameters: {'n_layers': 3, 'embedding_dim': 64, 'lr': 0.002945501004772304, 'lambda_val': 1.1950211288353388e-06, 'batch_size': 652, 'optimizer': 'Adam'}.
2026-05-24 02:33:34,981 - experiment_functions - INFO - Early stopping at epoch 1300. Best Metrics: (0.021849020746891573, 0.016961920529801323, 0.022842758929703322)
2026-05-24 02:33:35,069 - optuna.study.study - INFO - Trial 288 finished with values: [0.021849020746891573, 0.016961920529801323, 0.022842758929703322] and parameters: {'n_layers': 4, 'embedding_dim': 32, 'lr': 0.0005233015481570266, 'lambda_val': 2.582067375745636e-06, 'batch_size': 1398, 'optimizer': 'Adam'}.
2026-05-24 02:33:49,066 - experiment_functions - INFO - Early stopping at epoch 1000. Best Metrics: (0.025481931271571293, 0.019966887417218544, 0.02687009095441663)
2026-05-24 02:33:49,862 - optuna.study.study - INFO - Trial 289 finished with values: [0.025481931271571293, 0.019966887417218544, 0.02687009095441663] and parameters: {'n_layers': 4, 'embedding_dim': 32, 'lr': 0.0007459913147507348, 'lambda_val': 0.004825444205218699, 'batch_size': 652, 'optimizer': 'RMSprop'}.
2026-05-24 02:34:30,664 - optuna.study.study - INFO - Trial 290 finished with values: [0.008412711543879237, 0.006043046357615894, 0.008282966426653379] and parameters: {'n_layers': 4, 'embedding_dim': 64, 'lr': 4.42833278786793e-05, 'lambda_val': 1.1741946550104087e-06, 'batch_size': 847, 'optimizer': 'Adam'}.
2026-05-24 02:35:00,019 - experiment_functions - INFO - Early stopping at epoch 2750. Best Metrics: (0.026054496206971395, 0.01849337748344371, 0.02626452422627085)
2026-05-24 02:35:01,218 - optuna.study.study - INFO - Trial 291 finished with values: [0.026054496206971395, 0.01849337748344371, 0.02626452422627085] and parameters: {'n_layers': 3, 'embedding_dim': 32, 'lr': 0.0005233015481570266, 'lambda_val': 0.0008116276544744529, 'batch_size': 652, 'optimizer': 'Adam'}.
2026-05-24 02:35:10,096 - experiment_functions - INFO - Early stopping at epoch 750. Best Metrics: (0.020226358662842173, 0.016382450331125824, 0.020737235772886282)
2026-05-24 02:35:10,917 - optuna.study.study - INFO - Trial 292 finished with values: [0.020226358662842173, 0.016382450331125824, 0.020737235772886282] and parameters: {'n_layers': 4, 'embedding_dim': 32, 'lr': 0.001254073391314583, 'lambda_val': 0.0009443756499535536, 'batch_size': 1218, 'optimizer': 'Adam'}.
2026-05-24 02:35:23,538 - experiment_functions - INFO - Early stopping at epoch 1050. Best Metrics: (0.0197790233340171, 0.016721854304635762, 0.021062125046813433)
2026-05-24 02:35:24,118 - optuna.study.study - INFO - Trial 293 finished with values: [0.0197790233340171, 0.016721854304635762, 0.021062125046813433] and parameters: {'n_layers': 4, 'embedding_dim': 96, 'lr': 0.0003847621589190308, 'lambda_val': 0.003592565815384345, 'batch_size': 1732, 'optimizer': 'RMSprop'}.
2026-05-24 02:36:06,770 - optuna.study.study - INFO - Trial 294 finished with values: [0.022846463867805037, 0.017102649006622516, 0.02333066435068752] and parameters: {'n_layers': 3, 'embedding_dim': 32, 'lr': 0.0003847621589190308, 'lambda_val': 2.7676802281891984e-06, 'batch_size': 925, 'optimizer': 'RMSprop'}.
2026-05-24 02:36:15,811 - experiment_functions - INFO - Early stopping at epoch 750. Best Metrics: (0.021987277691432734, 0.017086092715231788, 0.022811568225807315)
2026-05-24 02:36:16,117 - optuna.study.study - INFO - Trial 295 finished with values: [0.021987277691432734, 0.017086092715231788, 0.022811568225807315] and parameters: {'n_layers': 3, 'embedding_dim': 64, 'lr': 0.0017999750470736491, 'lambda_val': 0.0009443756499535536, 'batch_size': 664, 'optimizer': 'Adam'}.
2026-05-24 02:36:29,405 - experiment_functions - INFO - Early stopping at epoch 950. Best Metrics: (0.020413854361577652, 0.017119205298013244, 0.021832084260168895)
2026-05-24 02:36:29,542 - optuna.study.study - INFO - Trial 296 finished with values: [0.020413854361577652, 0.017119205298013244, 0.021832084260168895] and parameters: {'n_layers': 4, 'embedding_dim': 96, 'lr': 0.0005233015481570266, 'lambda_val': 0.005694292664597612, 'batch_size': 1343, 'optimizer': 'Adam'}.
2026-05-24 02:36:37,411 - experiment_functions - INFO - Early stopping at epoch 550. Best Metrics: (0.015054126649644593, 0.01205298013245033, 0.01557736506034215)
2026-05-24 02:36:37,513 - optuna.study.study - INFO - Trial 297 finished with values: [0.015054126649644593, 0.01205298013245033, 0.01557736506034215] and parameters: {'n_layers': 4, 'embedding_dim': 256, 'lr': 0.003175767497275054, 'lambda_val': 2.582067375745636e-06, 'batch_size': 3379, 'optimizer': 'Adam'}.
2026-05-24 02:37:19,217 - optuna.study.study - INFO - Trial 298 finished with values: [0.02206537235584998, 0.015115894039735102, 0.02196575531375094] and parameters: {'n_layers': 1, 'embedding_dim': 32, 'lr': 0.00035899557766397706, 'lambda_val': 0.0009443756499535536, 'batch_size': 1393, 'optimizer': 'Adam'}.
2026-05-24 02:37:32,279 - experiment_functions - INFO - Early stopping at epoch 1100. Best Metrics: (0.02325878824153034, 0.01883278145695364, 0.024847527880172554)
2026-05-24 02:37:32,435 - optuna.study.study - INFO - Trial 299 finished with values: [0.02325878824153034, 0.01883278145695364, 0.024847527880172554] and parameters: {'n_layers': 4, 'embedding_dim': 96, 'lr': 0.0005233015481570266, 'lambda_val': 0.0009443756499535536, 'batch_size': 652, 'optimizer': 'RMSprop'}.
2026-05-24 02:37:32,450 - root - INFO - Selected Trial 276 based on Max ndcg: 0.0271
2026-05-24 02:37:32,450 - root - INFO - Associated Recall: 0.0261
2026-05-24 02:37:32,450 - experiment_functions - INFO - Training the best model ... for e_1M_1c1dcs_strict_rand2
2026-05-24 02:37:48,188 - experiment_functions - INFO - Early stopping at epoch 1500. Best Metrics: (0.02484058570684345, 0.017731788079470196, 0.02462281435709185)
2026-05-24 02:37:49,013 - root - INFO -   **** Training e_1M_1c1dcs_strict_rand3
2026-05-24 02:37:49,017 - root - INFO -   **** Getting 11896/805443 random edges
2026-05-24 02:37:49,125 - optuna.storages._rdb.storage - INFO - A new study created in RDB with name: Study_e_1M_1c1dcs_strict_rand3
2026-05-24 02:37:55,774 - experiment_functions - INFO - Early stopping at epoch 500. Best Metrics: (0.005018374757854223, 0.004163907284768212, 0.005047485557056197)
2026-05-24 02:37:56,578 - optuna.study.study - INFO - Trial 0 finished with values: [0.005018374757854223, 0.004163907284768212, 0.005047485557056197] and parameters: {'n_layers': 2, 'embedding_dim': 256, 'lr': 0.003847615206150621, 'lambda_val': 0.09855119983484721, 'batch_size': 3763, 'optimizer': 'SGD'}.
2026-05-24 02:38:08,327 - experiment_functions - INFO - Early stopping at epoch 1100. Best Metrics: (0.0074133766897840035, 0.007649006622516556, 0.009016424065606684)
2026-05-24 02:38:08,705 - optuna.study.study - INFO - Trial 1 finished with values: [0.0074133766897840035, 0.007649006622516556, 0.009016424065606684] and parameters: {'n_layers': 2, 'embedding_dim': 64, 'lr': 0.023459352191016185, 'lambda_val': 0.07322682525225188, 'batch_size': 1254, 'optimizer': 'RMSprop'}.
2026-05-24 02:38:15,496 - experiment_functions - INFO - Early stopping at epoch 550. Best Metrics: (0.019798052966786002, 0.01437086092715232, 0.01986171711993955)
2026-05-24 02:38:15,714 - optuna.study.study - INFO - Trial 2 finished with values: [0.019798052966786002, 0.01437086092715232, 0.01986171711993955] and parameters: {'n_layers': 2, 'embedding_dim': 32, 'lr': 0.003052355703485208, 'lambda_val': 0.0002604635685994012, 'batch_size': 1950, 'optimizer': 'RMSprop'}.
2026-05-24 02:38:23,292 - experiment_functions - INFO - Early stopping at epoch 500. Best Metrics: (0.009711723561813062, 0.00734271523178808, 0.009862940601086155)
2026-05-24 02:38:24,762 - optuna.study.study - INFO - Trial 3 finished with values: [0.009711723561813062, 0.00734271523178808, 0.009862940601086155] and parameters: {'n_layers': 3, 'embedding_dim': 256, 'lr': 0.036311147163271176, 'lambda_val': 0.000110210970102262, 'batch_size': 2270, 'optimizer': 'RMSprop'}.
2026-05-24 02:38:30,919 - experiment_functions - INFO - Early stopping at epoch 500. Best Metrics: (0.004846499750253306, 0.003956953642384106, 0.005099604769192599)
2026-05-24 02:38:32,231 - optuna.study.study - INFO - Trial 4 finished with values: [0.004846499750253306, 0.003956953642384106, 0.005099604769192599] and parameters: {'n_layers': 3, 'embedding_dim': 96, 'lr': 0.00015755418721819441, 'lambda_val': 1.519944890844069e-05, 'batch_size': 1173, 'optimizer': 'SGD'}.
2026-05-24 02:38:45,159 - experiment_functions - INFO - Early stopping at epoch 1050. Best Metrics: (0.01809407149931177, 0.014975165562913909, 0.019674847169159168)
2026-05-24 02:38:45,560 - optuna.study.study - INFO - Trial 5 finished with values: [0.01809407149931177, 0.014975165562913909, 0.019674847169159168] and parameters: {'n_layers': 3, 'embedding_dim': 96, 'lr': 0.0005700378100001039, 'lambda_val': 1.113463354596578e-05, 'batch_size': 2057, 'optimizer': 'Adam'}.
2026-05-24 02:38:51,672 - experiment_functions - INFO - Early stopping at epoch 500. Best Metrics: (0.005466267432782074, 0.004163907284768211, 0.005339324558262909)
2026-05-24 02:38:52,288 - optuna.study.study - INFO - Trial 6 finished with values: [0.005466267432782074, 0.004163907284768211, 0.005339324558262909] and parameters: {'n_layers': 2, 'embedding_dim': 128, 'lr': 0.00046626888572739577, 'lambda_val': 5.1688078317297965e-06, 'batch_size': 1822, 'optimizer': 'SGD'}.
2026-05-24 02:39:00,409 - experiment_functions - INFO - Early stopping at epoch 600. Best Metrics: (0.017772980141190532, 0.015124172185430463, 0.0188274935371359)
2026-05-24 02:39:00,518 - optuna.study.study - INFO - Trial 7 finished with values: [0.017772980141190532, 0.015124172185430463, 0.0188274935371359] and parameters: {'n_layers': 4, 'embedding_dim': 64, 'lr': 0.001073497477166827, 'lambda_val': 5.138211460433891e-05, 'batch_size': 2583, 'optimizer': 'RMSprop'}.
2026-05-24 02:39:07,121 - experiment_functions - INFO - Early stopping at epoch 500. Best Metrics: (0.00469946087604239, 0.004031456953642384, 0.004928042563357157)
2026-05-24 02:39:07,860 - optuna.study.study - INFO - Trial 8 finished with values: [0.00469946087604239, 0.004031456953642384, 0.004928042563357157] and parameters: {'n_layers': 3, 'embedding_dim': 64, 'lr': 2.595390561923531e-05, 'lambda_val': 0.07567130108841892, 'batch_size': 3814, 'optimizer': 'SGD'}.
2026-05-24 02:39:14,312 - experiment_functions - INFO - Early stopping at epoch 500. Best Metrics: (0.004725316925828648, 0.004064569536423841, 0.004724262790495475)
2026-05-24 02:39:14,544 - optuna.study.study - INFO - Trial 9 finished with values: [0.004725316925828648, 0.004064569536423841, 0.004724262790495475] and parameters: {'n_layers': 2, 'embedding_dim': 32, 'lr': 0.0004066575177213423, 'lambda_val': 0.01879391759436874, 'batch_size': 3689, 'optimizer': 'SGD'}.
2026-05-24 02:39:54,372 - optuna.study.study - INFO - Trial 10 finished with values: [0.007636208041096547, 0.005860927152317881, 0.007989051237115675] and parameters: {'n_layers': 1, 'embedding_dim': 128, 'lr': 4.1366046719154055e-05, 'lambda_val': 2.911424938912976e-05, 'batch_size': 1219, 'optimizer': 'Adam'}.
2026-05-24 02:40:34,858 - optuna.study.study - INFO - Trial 11 finished with values: [0.009378305073065106, 0.007326158940397351, 0.009911133504401468] and parameters: {'n_layers': 2, 'embedding_dim': 128, 'lr': 6.681592785701049e-05, 'lambda_val': 1.2059386332894028e-06, 'batch_size': 3349, 'optimizer': 'Adam'}.
2026-05-24 02:40:42,310 - experiment_functions - INFO - Early stopping at epoch 550. Best Metrics: (0.010182650968839468, 0.007947019867549669, 0.009530217294561195)
2026-05-24 02:40:42,403 - optuna.study.study - INFO - Trial 12 finished with values: [0.010182650968839468, 0.007947019867549669, 0.009530217294561195] and parameters: {'n_layers': 4, 'embedding_dim': 256, 'lr': 0.047579164018428745, 'lambda_val': 2.8339303211396753e-05, 'batch_size': 3283, 'optimizer': 'Adam'}.
2026-05-24 02:41:02,218 - experiment_functions - INFO - Early stopping at epoch 1850. Best Metrics: (0.018968900922926815, 0.014279801324503311, 0.019310537157745427)
2026-05-24 02:41:02,310 - optuna.study.study - INFO - Trial 13 finished with values: [0.018968900922926815, 0.014279801324503311, 0.019310537157745427] and parameters: {'n_layers': 2, 'embedding_dim': 32, 'lr': 0.0004568670531170521, 'lambda_val': 1.002227016896905e-06, 'batch_size': 2365, 'optimizer': 'Adam'}.
2026-05-24 02:41:13,441 - experiment_functions - INFO - Early stopping at epoch 1050. Best Metrics: (0.005211634912203213, 0.004370860927152318, 0.005242360515023324)
2026-05-24 02:41:14,389 - optuna.study.study - INFO - Trial 14 finished with values: [0.005211634912203213, 0.004370860927152318, 0.005242360515023324] and parameters: {'n_layers': 2, 'embedding_dim': 128, 'lr': 0.0037882970539944855, 'lambda_val': 0.001445310081927886, 'batch_size': 2335, 'optimizer': 'SGD'}.
2026-05-24 02:41:20,931 - experiment_functions - INFO - Early stopping at epoch 500. Best Metrics: (0.008826257670096068, 0.007152317880794703, 0.00923076371802573)
2026-05-24 02:41:21,731 - optuna.study.study - INFO - Trial 15 finished with values: [0.008826257670096068, 0.007152317880794703, 0.00923076371802573] and parameters: {'n_layers': 3, 'embedding_dim': 256, 'lr': 0.024909831299572582, 'lambda_val': 0.0002498892153688339, 'batch_size': 1205, 'optimizer': 'RMSprop'}.
2026-05-24 02:41:47,530 - experiment_functions - INFO - Early stopping at epoch 2500. Best Metrics: (0.008378387688995487, 0.008253311258278146, 0.01005098602590555)
2026-05-24 02:41:47,613 - optuna.study.study - INFO - Trial 16 finished with values: [0.008378387688995487, 0.008253311258278146, 0.01005098602590555] and parameters: {'n_layers': 4, 'embedding_dim': 64, 'lr': 0.019094942696727592, 'lambda_val': 0.07574912686818955, 'batch_size': 3658, 'optimizer': 'RMSprop'}.
2026-05-24 02:42:09,188 - experiment_functions - INFO - Early stopping at epoch 2150. Best Metrics: (0.0054850882608329776, 0.004213576158940397, 0.00549153966931896)
2026-05-24 02:42:09,366 - optuna.study.study - INFO - Trial 17 finished with values: [0.0054850882608329776, 0.004213576158940397, 0.00549153966931896] and parameters: {'n_layers': 1, 'embedding_dim': 256, 'lr': 0.012689045127078847, 'lambda_val': 5.81643413244635e-05, 'batch_size': 4096, 'optimizer': 'SGD'}.
2026-05-24 02:42:21,289 - experiment_functions - INFO - Early stopping at epoch 1050. Best Metrics: (0.018332901423951713, 0.01419701986754967, 0.018744045705754397)
2026-05-24 02:42:21,394 - optuna.study.study - INFO - Trial 18 finished with values: [0.018332901423951713, 0.01419701986754967, 0.018744045705754397] and parameters: {'n_layers': 3, 'embedding_dim': 128, 'lr': 0.0004649352000072556, 'lambda_val': 1.8203246882701353e-06, 'batch_size': 2745, 'optimizer': 'Adam'}.
2026-05-24 02:42:27,362 - experiment_functions - INFO - Early stopping at epoch 500. Best Metrics: (0.005159841306012229, 0.004271523178807947, 0.00550014815444044)
2026-05-24 02:42:27,935 - optuna.study.study - INFO - Trial 19 finished with values: [0.005159841306012229, 0.004271523178807947, 0.00550014815444044] and parameters: {'n_layers': 2, 'embedding_dim': 96, 'lr': 0.00022697340368721037, 'lambda_val': 4.365904064347516e-06, 'batch_size': 4003, 'optimizer': 'SGD'}.
2026-05-24 02:42:34,592 - experiment_functions - INFO - Early stopping at epoch 500. Best Metrics: (0.004162742207686312, 0.0037500000000000003, 0.00461083957253291)
2026-05-24 02:42:35,112 - optuna.study.study - INFO - Trial 20 finished with values: [0.004162742207686312, 0.0037500000000000003, 0.00461083957253291] and parameters: {'n_layers': 4, 'embedding_dim': 256, 'lr': 2.0674989829881033e-05, 'lambda_val': 3.3480517735287427e-05, 'batch_size': 3296, 'optimizer': 'SGD'}.
2026-05-24 02:42:41,534 - experiment_functions - INFO - Early stopping at epoch 550. Best Metrics: (0.015193079230786909, 0.012160596026490066, 0.015761036412669682)
2026-05-24 02:42:41,833 - optuna.study.study - INFO - Trial 21 finished with values: [0.015193079230786909, 0.012160596026490066, 0.015761036412669682] and parameters: {'n_layers': 3, 'embedding_dim': 64, 'lr': 0.009944040101896572, 'lambda_val': 0.00044595685832073573, 'batch_size': 3352, 'optimizer': 'Adam'}.
2026-05-24 02:43:08,856 - experiment_functions - INFO - Early stopping at epoch 2550. Best Metrics: (0.01603765755224859, 0.01193708609271523, 0.016147078947748594)
2026-05-24 02:43:08,990 - optuna.study.study - INFO - Trial 22 finished with values: [0.01603765755224859, 0.01193708609271523, 0.016147078947748594] and parameters: {'n_layers': 1, 'embedding_dim': 256, 'lr': 0.0002523150485397923, 'lambda_val': 0.0007015993710695603, 'batch_size': 2509, 'optimizer': 'Adam'}.
2026-05-24 02:43:42,198 - experiment_functions - INFO - Early stopping at epoch 3400. Best Metrics: (0.006610477632014751, 0.005198675496688742, 0.0068269860290929435)
2026-05-24 02:43:43,250 - optuna.study.study - INFO - Trial 23 finished with values: [0.006610477632014751, 0.005198675496688742, 0.0068269860290929435] and parameters: {'n_layers': 3, 'embedding_dim': 32, 'lr': 2.3480301409911985e-05, 'lambda_val': 2.2508477191000715e-06, 'batch_size': 2744, 'optimizer': 'RMSprop'}.
2026-05-24 02:43:49,123 - experiment_functions - INFO - Early stopping at epoch 500. Best Metrics: (0.004945201087240665, 0.003915562913907285, 0.005094913351033923)
2026-05-24 02:43:49,868 - optuna.study.study - INFO - Trial 24 finished with values: [0.004945201087240665, 0.003915562913907285, 0.005094913351033923] and parameters: {'n_layers': 1, 'embedding_dim': 96, 'lr': 1.7785075567063003e-05, 'lambda_val': 0.06891851083726878, 'batch_size': 3832, 'optimizer': 'SGD'}.
2026-05-24 02:44:28,533 - optuna.study.study - INFO - Trial 25 finished with values: [0.010239109411842608, 0.007632450331125828, 0.01051806819965992] and parameters: {'n_layers': 1, 'embedding_dim': 96, 'lr': 7.541081097415618e-05, 'lambda_val': 5.806220701306776e-05, 'batch_size': 2141, 'optimizer': 'RMSprop'}.
2026-05-24 02:44:38,608 - experiment_functions - INFO - Early stopping at epoch 900. Best Metrics: (0.015420470920960048, 0.012210264900662252, 0.016284336955095353)
2026-05-24 02:44:40,443 - optuna.study.study - INFO - Trial 26 finished with values: [0.015420470920960048, 0.012210264900662252, 0.016284336955095353] and parameters: {'n_layers': 2, 'embedding_dim': 96, 'lr': 0.0006236035183558026, 'lambda_val': 9.751859507213105e-05, 'batch_size': 3997, 'optimizer': 'RMSprop'}.
2026-05-24 02:44:46,837 - experiment_functions - INFO - Early stopping at epoch 500. Best Metrics: (0.004465607088038443, 0.004048013245033112, 0.0048737363789870015)
2026-05-24 02:44:46,937 - optuna.study.study - INFO - Trial 27 finished with values: [0.004465607088038443, 0.004048013245033112, 0.0048737363789870015] and parameters: {'n_layers': 3, 'embedding_dim': 256, 'lr': 0.010148603726392402, 'lambda_val': 0.018690045561994783, 'batch_size': 922, 'optimizer': 'SGD'}.
2026-05-24 02:44:56,654 - experiment_functions - INFO - Early stopping at epoch 500. Best Metrics: (0.0055695939439018415, 0.004321192052980133, 0.005493760515128472)
2026-05-24 02:44:57,463 - optuna.study.study - INFO - Trial 28 finished with values: [0.0055695939439018415, 0.004321192052980133, 0.005493760515128472] and parameters: {'n_layers': 3, 'embedding_dim': 128, 'lr': 0.00859032951831402, 'lambda_val': 0.07094452853478846, 'batch_size': 3934, 'optimizer': 'SGD'}.
2026-05-24 02:45:09,870 - experiment_functions - INFO - Early stopping at epoch 600. Best Metrics: (0.018775023922066154, 0.014461920529801324, 0.019113087922096844)
2026-05-24 02:45:09,955 - optuna.study.study - INFO - Trial 29 finished with values: [0.018775023922066154, 0.014461920529801324, 0.019113087922096844] and parameters: {'n_layers': 4, 'embedding_dim': 96, 'lr': 0.0018521591652371555, 'lambda_val': 0.00034199571335759705, 'batch_size': 1841, 'optimizer': 'Adam'}.
2026-05-24 02:45:20,468 - experiment_functions - INFO - Early stopping at epoch 900. Best Metrics: (0.016331914140361177, 0.014958609271523178, 0.017762982464342773)
2026-05-24 02:45:21,226 - optuna.study.study - INFO - Trial 30 finished with values: [0.016331914140361177, 0.014958609271523178, 0.017762982464342773] and parameters: {'n_layers': 4, 'embedding_dim': 128, 'lr': 0.00036006007162814904, 'lambda_val': 0.05810316365964571, 'batch_size': 2393, 'optimizer': 'RMSprop'}.
2026-05-24 02:45:27,852 - experiment_functions - INFO - Early stopping at epoch 550. Best Metrics: (0.009126840751538015, 0.00822019867549669, 0.009756682942804086)
2026-05-24 02:45:28,252 - optuna.study.study - INFO - Trial 31 finished with values: [0.009126840751538015, 0.00822019867549669, 0.009756682942804086] and parameters: {'n_layers': 4, 'embedding_dim': 64, 'lr': 0.012279527964875192, 'lambda_val': 4.0170753455320145e-05, 'batch_size': 1628, 'optimizer': 'RMSprop'}.
2026-05-24 02:45:38,178 - experiment_functions - INFO - Early stopping at epoch 900. Best Metrics: (0.004958669962780764, 0.004197019867549669, 0.005134229050040353)
