2026-05-24 13:08:26,332 - optuna.study.study - INFO - Trial 156 finished with values: [0.03880228652936385, 0.02433774834437086, 0.03359906791209817] and parameters: {'n_layers': 4, 'embedding_dim': 64, 'lr': 0.00015112824887092085, 'lambda_val': 8.471062459286831e-06, 'batch_size': 1221, 'optimizer': 'Adam'}.
2026-05-24 13:08:41,076 - experiment_functions - INFO - Early stopping at epoch 1200. Best Metrics: (0.058995870387475134, 0.03579470198675497, 0.05145299596130848)
2026-05-24 13:08:41,168 - optuna.study.study - INFO - Trial 157 finished with values: [0.058995870387475134, 0.03579470198675497, 0.05145299596130848] and parameters: {'n_layers': 1, 'embedding_dim': 96, 'lr': 0.000684293575282855, 'lambda_val': 0.007383021531734565, 'batch_size': 1315, 'optimizer': 'Adam'}.
2026-05-24 13:08:48,756 - experiment_functions - INFO - Early stopping at epoch 550. Best Metrics: (0.03624697910089029, 0.024105960264900667, 0.03216687776980664)
2026-05-24 13:08:48,858 - optuna.study.study - INFO - Trial 158 finished with values: [0.03624697910089029, 0.024105960264900667, 0.03216687776980664] and parameters: {'n_layers': 3, 'embedding_dim': 96, 'lr': 0.004601744611421326, 'lambda_val': 1.6384022903021963e-06, 'batch_size': 2329, 'optimizer': 'Adam'}.
2026-05-24 13:08:57,359 - experiment_functions - INFO - Early stopping at epoch 650. Best Metrics: (0.058710890748013764, 0.03554635761589404, 0.051997178727359365)
2026-05-24 13:08:57,456 - optuna.study.study - INFO - Trial 159 finished with values: [0.058710890748013764, 0.03554635761589404, 0.051997178727359365] and parameters: {'n_layers': 1, 'embedding_dim': 96, 'lr': 0.003407247220990805, 'lambda_val': 3.1090320134873986e-06, 'batch_size': 1081, 'optimizer': 'Adam'}.
2026-05-24 13:09:03,957 - experiment_functions - INFO - Early stopping at epoch 500. Best Metrics: (0.005574844727870391, 0.004288079470198676, 0.00567052578360866)
2026-05-24 13:09:04,051 - optuna.study.study - INFO - Trial 160 finished with values: [0.005574844727870391, 0.004288079470198676, 0.00567052578360866] and parameters: {'n_layers': 1, 'embedding_dim': 96, 'lr': 1.7556774858090607e-05, 'lambda_val': 0.0026104850377910416, 'batch_size': 1315, 'optimizer': 'Adam'}.
2026-05-24 13:09:10,432 - experiment_functions - INFO - Early stopping at epoch 500. Best Metrics: (0.005540793023098156, 0.004610927152317881, 0.005741317309472782)
2026-05-24 13:09:10,901 - optuna.study.study - INFO - Trial 161 finished with values: [0.005540793023098156, 0.004610927152317881, 0.005741317309472782] and parameters: {'n_layers': 3, 'embedding_dim': 32, 'lr': 0.0005846659139515835, 'lambda_val': 8.471062459286831e-06, 'batch_size': 1221, 'optimizer': 'SGD'}.
2026-05-24 13:09:18,775 - experiment_functions - INFO - Early stopping at epoch 600. Best Metrics: (0.06313807461118036, 0.03666390728476821, 0.052728596236334385)
2026-05-24 13:09:18,839 - optuna.study.study - INFO - Trial 162 finished with values: [0.06313807461118036, 0.03666390728476821, 0.052728596236334385] and parameters: {'n_layers': 1, 'embedding_dim': 96, 'lr': 0.004235289187226827, 'lambda_val': 0.007383021531734565, 'batch_size': 2016, 'optimizer': 'Adam'}.
2026-05-24 13:09:26,522 - experiment_functions - INFO - Early stopping at epoch 550. Best Metrics: (0.02435109052748245, 0.01903973509933775, 0.024456330978973477)
2026-05-24 13:09:27,502 - optuna.study.study - INFO - Trial 163 finished with values: [0.02435109052748245, 0.01903973509933775, 0.024456330978973477] and parameters: {'n_layers': 4, 'embedding_dim': 96, 'lr': 0.0050557762652770595, 'lambda_val': 0.00047319112187695436, 'batch_size': 1315, 'optimizer': 'Adam'}.
2026-05-24 13:09:42,899 - experiment_functions - INFO - Early stopping at epoch 1250. Best Metrics: (0.018494696854131555, 0.01689569536423841, 0.02073431642975281)
2026-05-24 13:09:43,006 - optuna.study.study - INFO - Trial 164 finished with values: [0.018494696854131555, 0.01689569536423841, 0.02073431642975281] and parameters: {'n_layers': 3, 'embedding_dim': 96, 'lr': 0.000684293575282855, 'lambda_val': 0.09901932664108393, 'batch_size': 1381, 'optimizer': 'Adam'}.
2026-05-24 13:10:26,743 - optuna.study.study - INFO - Trial 165 finished with values: [0.02565783369556201, 0.01847682119205298, 0.024724235148575] and parameters: {'n_layers': 4, 'embedding_dim': 32, 'lr': 0.00012817614150118707, 'lambda_val': 0.0003409068265064018, 'batch_size': 1315, 'optimizer': 'RMSprop'}.
2026-05-24 13:10:35,370 - experiment_functions - INFO - Early stopping at epoch 600. Best Metrics: (0.06318503527469725, 0.036630794701986755, 0.05425737420139183)
2026-05-24 13:10:35,810 - optuna.study.study - INFO - Trial 166 finished with values: [0.06318503527469725, 0.036630794701986755, 0.05425737420139183] and parameters: {'n_layers': 1, 'embedding_dim': 96, 'lr': 0.004235289187226827, 'lambda_val': 0.0003409068265064018, 'batch_size': 2016, 'optimizer': 'Adam'}.
2026-05-24 13:10:44,746 - experiment_functions - INFO - Early stopping at epoch 600. Best Metrics: (0.06062325262788031, 0.036076158940397354, 0.05336466135969122)
2026-05-24 13:10:44,823 - optuna.study.study - INFO - Trial 167 finished with values: [0.06062325262788031, 0.036076158940397354, 0.05336466135969122] and parameters: {'n_layers': 1, 'embedding_dim': 96, 'lr': 0.0050557762652770595, 'lambda_val': 0.0003409068265064018, 'batch_size': 1315, 'optimizer': 'Adam'}.
2026-05-24 13:10:51,520 - experiment_functions - INFO - Early stopping at epoch 550. Best Metrics: (0.04245189936554005, 0.027052980132450333, 0.0394625887718744)
2026-05-24 13:10:51,917 - optuna.study.study - INFO - Trial 168 finished with values: [0.04245189936554005, 0.027052980132450333, 0.0394625887718744] and parameters: {'n_layers': 3, 'embedding_dim': 32, 'lr': 0.0050557762652770595, 'lambda_val': 0.004061323094641349, 'batch_size': 1221, 'optimizer': 'Adam'}.
2026-05-24 13:11:30,092 - experiment_functions - INFO - Early stopping at epoch 3500. Best Metrics: (0.016642977357461737, 0.012930463576158941, 0.016262937345150327)
2026-05-24 13:11:30,170 - optuna.study.study - INFO - Trial 169 finished with values: [0.016642977357461737, 0.012930463576158941, 0.016262937345150327] and parameters: {'n_layers': 3, 'embedding_dim': 64, 'lr': 0.003407247220990805, 'lambda_val': 3.4355332572174856e-05, 'batch_size': 2016, 'optimizer': 'RMSprop'}.
2026-05-24 13:11:39,971 - experiment_functions - INFO - Early stopping at epoch 750. Best Metrics: (0.04907866864672114, 0.030885761589403975, 0.043575018978025626)
2026-05-24 13:11:40,262 - optuna.study.study - INFO - Trial 170 finished with values: [0.04907866864672114, 0.030885761589403975, 0.043575018978025626] and parameters: {'n_layers': 2, 'embedding_dim': 128, 'lr': 0.000684293575282855, 'lambda_val': 3.1090320134873986e-06, 'batch_size': 3028, 'optimizer': 'Adam'}.
2026-05-24 13:11:47,818 - experiment_functions - INFO - Early stopping at epoch 550. Best Metrics: (0.02983922143938004, 0.02080298013245033, 0.028384430412446038)
2026-05-24 13:11:47,908 - optuna.study.study - INFO - Trial 171 finished with values: [0.02983922143938004, 0.02080298013245033, 0.028384430412446038] and parameters: {'n_layers': 3, 'embedding_dim': 96, 'lr': 0.004831314407757825, 'lambda_val': 0.0003409068265064018, 'batch_size': 2525, 'optimizer': 'Adam'}.
2026-05-24 13:11:56,012 - experiment_functions - INFO - Early stopping at epoch 550. Best Metrics: (0.03771746994811626, 0.025256622516556294, 0.03506271710081432)
2026-05-24 13:11:56,432 - optuna.study.study - INFO - Trial 172 finished with values: [0.03771746994811626, 0.025256622516556294, 0.03506271710081432] and parameters: {'n_layers': 4, 'embedding_dim': 128, 'lr': 0.003407247220990805, 'lambda_val': 0.0003409068265064018, 'batch_size': 1081, 'optimizer': 'Adam'}.
2026-05-24 13:12:05,015 - experiment_functions - INFO - Early stopping at epoch 600. Best Metrics: (0.05522439980284236, 0.03431291390728477, 0.04913961257023315)
2026-05-24 13:12:05,132 - optuna.study.study - INFO - Trial 173 finished with values: [0.05522439980284236, 0.03431291390728477, 0.04913961257023315] and parameters: {'n_layers': 1, 'embedding_dim': 96, 'lr': 0.003407247220990805, 'lambda_val': 0.0018241216708581335, 'batch_size': 3957, 'optimizer': 'Adam'}.
2026-05-24 13:12:12,014 - experiment_functions - INFO - Early stopping at epoch 550. Best Metrics: (0.05182611257431992, 0.031440397350993375, 0.047281807054238574)
2026-05-24 13:12:12,148 - optuna.study.study - INFO - Trial 174 finished with values: [0.05182611257431992, 0.031440397350993375, 0.047281807054238574] and parameters: {'n_layers': 2, 'embedding_dim': 64, 'lr': 0.004235289187226827, 'lambda_val': 0.0003409068265064018, 'batch_size': 2525, 'optimizer': 'Adam'}.
2026-05-24 13:12:19,748 - experiment_functions - INFO - Early stopping at epoch 600. Best Metrics: (0.037202352097891425, 0.0259271523178808, 0.034437511683365576)
2026-05-24 13:12:19,838 - optuna.study.study - INFO - Trial 175 finished with values: [0.037202352097891425, 0.0259271523178808, 0.034437511683365576] and parameters: {'n_layers': 1, 'embedding_dim': 96, 'lr': 0.004235289187226827, 'lambda_val': 0.007383021531734565, 'batch_size': 3564, 'optimizer': 'Adam'}.
2026-05-24 13:12:29,539 - experiment_functions - INFO - Early stopping at epoch 800. Best Metrics: (0.06230024426572421, 0.03669701986754967, 0.053840098931612165)
2026-05-24 13:12:29,661 - optuna.study.study - INFO - Trial 176 finished with values: [0.06230024426572421, 0.03669701986754967, 0.053840098931612165] and parameters: {'n_layers': 1, 'embedding_dim': 96, 'lr': 0.0017164560979354832, 'lambda_val': 0.0003409068265064018, 'batch_size': 1081, 'optimizer': 'Adam'}.
2026-05-24 13:12:36,661 - experiment_functions - INFO - Early stopping at epoch 500. Best Metrics: (0.005047696952599168, 0.004188741721854306, 0.005183107430305582)
2026-05-24 13:12:36,777 - optuna.study.study - INFO - Trial 177 finished with values: [0.005047696952599168, 0.004188741721854306, 0.005183107430305582] and parameters: {'n_layers': 4, 'embedding_dim': 96, 'lr': 0.00012817614150118707, 'lambda_val': 0.06680763738857091, 'batch_size': 1315, 'optimizer': 'Adam'}.
2026-05-24 13:12:46,919 - experiment_functions - INFO - Early stopping at epoch 800. Best Metrics: (0.047669994029564254, 0.030885761589403975, 0.04365701285330198)
2026-05-24 13:12:47,032 - optuna.study.study - INFO - Trial 178 finished with values: [0.047669994029564254, 0.030885761589403975, 0.04365701285330198] and parameters: {'n_layers': 2, 'embedding_dim': 96, 'lr': 0.000684293575282855, 'lambda_val': 0.0003409068265064018, 'batch_size': 2483, 'optimizer': 'Adam'}.
2026-05-24 13:12:54,490 - experiment_functions - INFO - Early stopping at epoch 550. Best Metrics: (0.031106126287747917, 0.02146523178807947, 0.028790368897038492)
2026-05-24 13:12:54,578 - optuna.study.study - INFO - Trial 179 finished with values: [0.031106126287747917, 0.02146523178807947, 0.028790368897038492] and parameters: {'n_layers': 4, 'embedding_dim': 64, 'lr': 0.0050557762652770595, 'lambda_val': 8.471062459286831e-06, 'batch_size': 1315, 'optimizer': 'Adam'}.
2026-05-24 13:13:02,182 - experiment_functions - INFO - Early stopping at epoch 600. Best Metrics: (0.05918077164820207, 0.03584437086092715, 0.0520265597780483)
2026-05-24 13:13:02,283 - optuna.study.study - INFO - Trial 180 finished with values: [0.05918077164820207, 0.03584437086092715, 0.0520265597780483] and parameters: {'n_layers': 1, 'embedding_dim': 128, 'lr': 0.004235289187226827, 'lambda_val': 0.007383021531734565, 'batch_size': 1180, 'optimizer': 'Adam'}.
2026-05-24 13:13:12,052 - experiment_functions - INFO - Early stopping at epoch 550. Best Metrics: (0.05534052981033016, 0.03271523178807947, 0.050370641074231566)
2026-05-24 13:13:12,340 - optuna.study.study - INFO - Trial 181 finished with values: [0.05534052981033016, 0.03271523178807947, 0.050370641074231566] and parameters: {'n_layers': 2, 'embedding_dim': 96, 'lr': 0.0050557762652770595, 'lambda_val': 0.0003409068265064018, 'batch_size': 1315, 'optimizer': 'Adam'}.
2026-05-24 13:13:31,908 - experiment_functions - INFO - Early stopping at epoch 1700. Best Metrics: (0.061875412542557184, 0.03708609271523179, 0.053799070708162755)
2026-05-24 13:13:32,010 - optuna.study.study - INFO - Trial 182 finished with values: [0.061875412542557184, 0.03708609271523179, 0.053799070708162755] and parameters: {'n_layers': 1, 'embedding_dim': 96, 'lr': 0.0005846659139515835, 'lambda_val': 0.00018703403293765332, 'batch_size': 1315, 'optimizer': 'Adam'}.
2026-05-24 13:13:42,637 - experiment_functions - INFO - Early stopping at epoch 900. Best Metrics: (0.05862290737649411, 0.03640728476821192, 0.05238258191786045)
2026-05-24 13:13:43,517 - optuna.study.study - INFO - Trial 183 finished with values: [0.05862290737649411, 0.03640728476821192, 0.05238258191786045] and parameters: {'n_layers': 1, 'embedding_dim': 96, 'lr': 0.000684293575282855, 'lambda_val': 0.014499624791208778, 'batch_size': 3665, 'optimizer': 'Adam'}.
2026-05-24 13:14:06,752 - experiment_functions - INFO - Early stopping at epoch 2050. Best Metrics: (0.06295411704127678, 0.03749172185430463, 0.0542849900759811)
2026-05-24 13:14:06,852 - optuna.study.study - INFO - Trial 184 finished with values: [0.06295411704127678, 0.03749172185430463, 0.0542849900759811] and parameters: {'n_layers': 1, 'embedding_dim': 96, 'lr': 0.0005846659139515835, 'lambda_val': 3.1090320134873986e-06, 'batch_size': 1081, 'optimizer': 'Adam'}.
2026-05-24 13:14:18,431 - experiment_functions - INFO - Early stopping at epoch 1000. Best Metrics: (0.05886834305349746, 0.03696192052980132, 0.052926503327603736)
2026-05-24 13:14:19,206 - optuna.study.study - INFO - Trial 185 finished with values: [0.05886834305349746, 0.03696192052980132, 0.052926503327603736] and parameters: {'n_layers': 1, 'embedding_dim': 96, 'lr': 0.000684293575282855, 'lambda_val': 0.02843248434954034, 'batch_size': 2016, 'optimizer': 'Adam'}.
2026-05-24 13:14:26,164 - experiment_functions - INFO - Early stopping at epoch 550. Best Metrics: (0.05033824220361063, 0.03185430463576159, 0.04538695547668488)
2026-05-24 13:14:26,266 - optuna.study.study - INFO - Trial 186 finished with values: [0.05033824220361063, 0.03185430463576159, 0.04538695547668488] and parameters: {'n_layers': 1, 'embedding_dim': 96, 'lr': 0.0050557762652770595, 'lambda_val': 0.04484114435833929, 'batch_size': 3038, 'optimizer': 'Adam'}.
2026-05-24 13:14:33,600 - experiment_functions - INFO - Early stopping at epoch 550. Best Metrics: (0.03520935974964365, 0.02441225165562914, 0.03255362399958532)
2026-05-24 13:14:33,695 - optuna.study.study - INFO - Trial 187 finished with values: [0.03520935974964365, 0.02441225165562914, 0.03255362399958532] and parameters: {'n_layers': 2, 'embedding_dim': 128, 'lr': 0.005103877753824678, 'lambda_val': 0.0006796337932014016, 'batch_size': 3341, 'optimizer': 'Adam'}.
2026-05-24 13:14:39,738 - experiment_functions - INFO - Early stopping at epoch 500. Best Metrics: (0.00565867073439775, 0.0043377483443708615, 0.005505631786284292)
2026-05-24 13:14:39,903 - optuna.study.study - INFO - Trial 188 finished with values: [0.00565867073439775, 0.0043377483443708615, 0.005505631786284292] and parameters: {'n_layers': 1, 'embedding_dim': 32, 'lr': 0.00015112824887092085, 'lambda_val': 0.02843248434954034, 'batch_size': 989, 'optimizer': 'Adam'}.
2026-05-24 13:14:47,096 - experiment_functions - INFO - Early stopping at epoch 550. Best Metrics: (0.04184478656942915, 0.0273841059602649, 0.038104444331340526)
2026-05-24 13:14:47,228 - optuna.study.study - INFO - Trial 189 finished with values: [0.04184478656942915, 0.0273841059602649, 0.038104444331340526] and parameters: {'n_layers': 2, 'embedding_dim': 64, 'lr': 0.004235289187226827, 'lambda_val': 0.0003409068265064018, 'batch_size': 2525, 'optimizer': 'Adam'}.
2026-05-24 13:14:57,962 - experiment_functions - INFO - Early stopping at epoch 800. Best Metrics: (0.06083601748011492, 0.03632450331125828, 0.05324872129193947)
2026-05-24 13:14:58,051 - optuna.study.study - INFO - Trial 190 finished with values: [0.06083601748011492, 0.03632450331125828, 0.05324872129193947] and parameters: {'n_layers': 1, 'embedding_dim': 96, 'lr': 0.0017164560979354832, 'lambda_val': 2.662938714668246e-05, 'batch_size': 1315, 'optimizer': 'Adam'}.
2026-05-24 13:15:05,846 - experiment_functions - INFO - Early stopping at epoch 650. Best Metrics: (0.056983172087257915, 0.0343046357615894, 0.05228064905768037)
2026-05-24 13:15:05,945 - optuna.study.study - INFO - Trial 191 finished with values: [0.056983172087257915, 0.0343046357615894, 0.05228064905768037] and parameters: {'n_layers': 1, 'embedding_dim': 32, 'lr': 0.004235289187226827, 'lambda_val': 0.007383021531734565, 'batch_size': 563, 'optimizer': 'Adam'}.
2026-05-24 13:15:19,366 - experiment_functions - INFO - Early stopping at epoch 1150. Best Metrics: (0.0609877327201926, 0.03701986754966888, 0.05480491270025596)
2026-05-24 13:15:19,515 - optuna.study.study - INFO - Trial 192 finished with values: [0.0609877327201926, 0.03701986754966888, 0.05480491270025596] and parameters: {'n_layers': 1, 'embedding_dim': 96, 'lr': 0.000684293575282855, 'lambda_val': 0.0018241216708581335, 'batch_size': 2016, 'optimizer': 'Adam'}.
2026-05-24 13:15:27,472 - experiment_functions - INFO - Early stopping at epoch 600. Best Metrics: (0.034830779922521274, 0.024536423841059606, 0.032544974881073045)
2026-05-24 13:15:27,554 - optuna.study.study - INFO - Trial 193 finished with values: [0.034830779922521274, 0.024536423841059606, 0.032544974881073045] and parameters: {'n_layers': 3, 'embedding_dim': 96, 'lr': 0.0017164560979354832, 'lambda_val': 0.014499624791208778, 'batch_size': 715, 'optimizer': 'Adam'}.
2026-05-24 13:15:34,505 - experiment_functions - INFO - Early stopping at epoch 550. Best Metrics: (0.03967861296009547, 0.02711092715231788, 0.03737041007207165)
2026-05-24 13:15:34,588 - optuna.study.study - INFO - Trial 194 finished with values: [0.03967861296009547, 0.02711092715231788, 0.03737041007207165] and parameters: {'n_layers': 1, 'embedding_dim': 128, 'lr': 0.005103877753824678, 'lambda_val': 0.02843248434954034, 'batch_size': 2016, 'optimizer': 'Adam'}.
2026-05-24 13:16:02,738 - experiment_functions - INFO - Early stopping at epoch 2500. Best Metrics: (0.05637367797222433, 0.034544701986754967, 0.050448019386091246)
2026-05-24 13:16:02,808 - optuna.study.study - INFO - Trial 195 finished with values: [0.05637367797222433, 0.034544701986754967, 0.050448019386091246] and parameters: {'n_layers': 1, 'embedding_dim': 96, 'lr': 0.0003160558377899661, 'lambda_val': 0.0009378059674706164, 'batch_size': 3564, 'optimizer': 'Adam'}.
2026-05-24 13:16:10,374 - experiment_functions - INFO - Early stopping at epoch 600. Best Metrics: (0.05727049957798314, 0.034801324503311255, 0.05033835395637794)
2026-05-24 13:16:10,464 - optuna.study.study - INFO - Trial 196 finished with values: [0.05727049957798314, 0.034801324503311255, 0.05033835395637794] and parameters: {'n_layers': 1, 'embedding_dim': 128, 'lr': 0.004235289187226827, 'lambda_val': 1.02723345022378e-06, 'batch_size': 1315, 'optimizer': 'Adam'}.
2026-05-24 13:16:18,014 - experiment_functions - INFO - Early stopping at epoch 600. Best Metrics: (0.0625428410914585, 0.03708609271523179, 0.055327284581834335)
2026-05-24 13:16:18,103 - optuna.study.study - INFO - Trial 197 finished with values: [0.0625428410914585, 0.03708609271523179, 0.055327284581834335] and parameters: {'n_layers': 1, 'embedding_dim': 32, 'lr': 0.004235289187226827, 'lambda_val': 0.0006796337932014016, 'batch_size': 2525, 'optimizer': 'Adam'}.
2026-05-24 13:16:26,082 - experiment_functions - INFO - Early stopping at epoch 700. Best Metrics: (0.00528207996343568, 0.004288079470198675, 0.0053218080920329845)
2026-05-24 13:16:26,190 - optuna.study.study - INFO - Trial 198 finished with values: [0.00528207996343568, 0.004288079470198675, 0.0053218080920329845] and parameters: {'n_layers': 1, 'embedding_dim': 96, 'lr': 1.3305532718838796e-05, 'lambda_val': 0.0003409068265064018, 'batch_size': 1315, 'optimizer': 'Adam'}.
2026-05-24 13:16:32,390 - experiment_functions - INFO - Early stopping at epoch 500. Best Metrics: (0.004813944635562773, 0.00423841059602649, 0.005244263646864916)
2026-05-24 13:16:32,852 - optuna.study.study - INFO - Trial 199 finished with values: [0.004813944635562773, 0.00423841059602649, 0.005244263646864916] and parameters: {'n_layers': 1, 'embedding_dim': 64, 'lr': 1.1869925386252184e-05, 'lambda_val': 0.014499624791208778, 'batch_size': 3665, 'optimizer': 'Adam'}.
2026-05-24 13:16:40,687 - experiment_functions - INFO - Early stopping at epoch 600. Best Metrics: (0.05907161492766709, 0.03565397350993378, 0.05231715744380106)
2026-05-24 13:16:40,814 - optuna.study.study - INFO - Trial 200 finished with values: [0.05907161492766709, 0.03565397350993378, 0.05231715744380106] and parameters: {'n_layers': 1, 'embedding_dim': 128, 'lr': 0.004235289187226827, 'lambda_val': 0.00707067081753529, 'batch_size': 1392, 'optimizer': 'Adam'}.
2026-05-24 13:16:46,895 - experiment_functions - INFO - Early stopping at epoch 500. Best Metrics: (0.005586901661925879, 0.004346026490066225, 0.005583231425080328)
2026-05-24 13:16:47,674 - optuna.study.study - INFO - Trial 201 finished with values: [0.005586901661925879, 0.004346026490066225, 0.005583231425080328] and parameters: {'n_layers': 1, 'embedding_dim': 96, 'lr': 1.1421973700167773e-05, 'lambda_val': 0.0009378059674706164, 'batch_size': 1304, 'optimizer': 'Adam'}.
2026-05-24 13:16:53,787 - experiment_functions - INFO - Early stopping at epoch 500. Best Metrics: (0.005057104306539845, 0.004221854304635762, 0.005364791953176585)
