2026-05-24 17:26:43,964 - optuna.study.study - INFO - Trial 108 finished with values: [0.005494782540676405, 0.0043708609271523174, 0.005679502210146086] and parameters: {'n_layers': 4, 'embedding_dim': 96, 'lr': 0.0003156053277132074, 'lambda_val': 2.3974044149892758e-05, 'batch_size': 2384, 'optimizer': 'SGD'}.
2026-05-24 17:26:50,533 - experiment_functions - INFO - Early stopping at epoch 550. Best Metrics: (0.016383350470047384, 0.014644039735099338, 0.017890499893748437)
2026-05-24 17:26:50,827 - optuna.study.study - INFO - Trial 109 finished with values: [0.016383350470047384, 0.014644039735099338, 0.017890499893748437] and parameters: {'n_layers': 2, 'embedding_dim': 64, 'lr': 0.007987696896301055, 'lambda_val': 0.03958976761123264, 'batch_size': 3049, 'optimizer': 'Adam'}.
2026-05-24 17:27:31,004 - optuna.study.study - INFO - Trial 110 finished with values: [0.005404067273572526, 0.004370860927152318, 0.005640083503002833] and parameters: {'n_layers': 4, 'embedding_dim': 96, 'lr': 1.3197328932299939e-05, 'lambda_val': 0.00011364672917450008, 'batch_size': 682, 'optimizer': 'Adam'}.
2026-05-24 17:28:12,159 - optuna.study.study - INFO - Trial 111 finished with values: [0.015895847242620054, 0.01265728476821192, 0.017293438717795574] and parameters: {'n_layers': 2, 'embedding_dim': 96, 'lr': 0.00013926266172177774, 'lambda_val': 0.003726003646008324, 'batch_size': 3052, 'optimizer': 'Adam'}.
2026-05-24 17:28:20,424 - experiment_functions - INFO - Early stopping at epoch 700. Best Metrics: (0.024649783702067406, 0.019188741721854304, 0.025735518334153263)
2026-05-24 17:28:20,509 - optuna.study.study - INFO - Trial 112 finished with values: [0.024649783702067406, 0.019188741721854304, 0.025735518334153263] and parameters: {'n_layers': 4, 'embedding_dim': 64, 'lr': 0.0011476975681739769, 'lambda_val': 2.4942580088361872e-06, 'batch_size': 1627, 'optimizer': 'Adam'}.
2026-05-24 17:28:28,957 - experiment_functions - INFO - Early stopping at epoch 750. Best Metrics: (0.008033927240652052, 0.008071192052980132, 0.01020694946132104)
2026-05-24 17:28:29,042 - optuna.study.study - INFO - Trial 113 finished with values: [0.008033927240652052, 0.008071192052980132, 0.01020694946132104] and parameters: {'n_layers': 3, 'embedding_dim': 96, 'lr': 0.005499362853243718, 'lambda_val': 0.0712753228725955, 'batch_size': 1209, 'optimizer': 'RMSprop'}.
2026-05-24 17:28:36,063 - experiment_functions - INFO - Early stopping at epoch 600. Best Metrics: (0.0216005531508082, 0.018501655629139073, 0.023235212370353794)
2026-05-24 17:28:37,395 - optuna.study.study - INFO - Trial 114 finished with values: [0.0216005531508082, 0.018501655629139073, 0.023235212370353794] and parameters: {'n_layers': 2, 'embedding_dim': 128, 'lr': 0.0013380689464122827, 'lambda_val': 0.08406885312084555, 'batch_size': 2196, 'optimizer': 'RMSprop'}.
2026-05-24 17:28:44,013 - experiment_functions - INFO - Early stopping at epoch 550. Best Metrics: (0.014963383002411212, 0.012342715231788079, 0.015351152611521287)
2026-05-24 17:28:44,953 - optuna.study.study - INFO - Trial 115 finished with values: [0.014963383002411212, 0.012342715231788079, 0.015351152611521287] and parameters: {'n_layers': 2, 'embedding_dim': 128, 'lr': 0.0065618298710489005, 'lambda_val': 7.153193690682514e-05, 'batch_size': 859, 'optimizer': 'RMSprop'}.
2026-05-24 17:28:57,503 - experiment_functions - INFO - Early stopping at epoch 1100. Best Metrics: (0.021556701364787326, 0.017574503311258278, 0.02216912148510984)
2026-05-24 17:28:57,601 - optuna.study.study - INFO - Trial 116 finished with values: [0.021556701364787326, 0.017574503311258278, 0.02216912148510984] and parameters: {'n_layers': 4, 'embedding_dim': 96, 'lr': 0.0002991906586766703, 'lambda_val': 7.032021560377246e-05, 'batch_size': 2590, 'optimizer': 'Adam'}.
2026-05-24 17:29:05,779 - experiment_functions - INFO - Early stopping at epoch 600. Best Metrics: (0.021180481170039855, 0.01544701986754967, 0.02163631042084327)
2026-05-24 17:29:05,864 - optuna.study.study - INFO - Trial 117 finished with values: [0.021180481170039855, 0.01544701986754967, 0.02163631042084327] and parameters: {'n_layers': 1, 'embedding_dim': 32, 'lr': 0.0033504361141672117, 'lambda_val': 0.0012698784207975818, 'batch_size': 1209, 'optimizer': 'RMSprop'}.
2026-05-24 17:29:23,006 - experiment_functions - INFO - Early stopping at epoch 1550. Best Metrics: (0.029525260097046896, 0.022450331125827814, 0.030329037423744026)
2026-05-24 17:29:23,101 - optuna.study.study - INFO - Trial 118 finished with values: [0.029525260097046896, 0.022450331125827814, 0.030329037423744026] and parameters: {'n_layers': 4, 'embedding_dim': 32, 'lr': 0.0002426099667536793, 'lambda_val': 0.03885177809889165, 'batch_size': 3429, 'optimizer': 'RMSprop'}.
2026-05-24 17:29:33,159 - experiment_functions - INFO - Early stopping at epoch 750. Best Metrics: (0.022974403424634127, 0.017740066225165562, 0.023953070157361627)
2026-05-24 17:29:33,454 - optuna.study.study - INFO - Trial 119 finished with values: [0.022974403424634127, 0.017740066225165562, 0.023953070157361627] and parameters: {'n_layers': 2, 'embedding_dim': 128, 'lr': 0.0009144615335871839, 'lambda_val': 0.00011364672917450008, 'batch_size': 1565, 'optimizer': 'RMSprop'}.
2026-05-24 17:29:41,309 - experiment_functions - INFO - Early stopping at epoch 700. Best Metrics: (0.0184917052312382, 0.013915562913907286, 0.01833536563824021)
2026-05-24 17:29:41,387 - optuna.study.study - INFO - Trial 120 finished with values: [0.0184917052312382, 0.013915562913907286, 0.01833536563824021] and parameters: {'n_layers': 1, 'embedding_dim': 32, 'lr': 0.0024421865435223515, 'lambda_val': 0.0712753228725955, 'batch_size': 1909, 'optimizer': 'Adam'}.
2026-05-24 17:30:01,732 - experiment_functions - INFO - Early stopping at epoch 1850. Best Metrics: (0.022072621096206523, 0.017582781456953644, 0.022918514600120562)
2026-05-24 17:30:01,835 - optuna.study.study - INFO - Trial 121 finished with values: [0.022072621096206523, 0.017582781456953644, 0.022918514600120562] and parameters: {'n_layers': 4, 'embedding_dim': 64, 'lr': 0.0002426099667536793, 'lambda_val': 1.984739363175094e-06, 'batch_size': 2491, 'optimizer': 'Adam'}.
2026-05-24 17:30:15,629 - experiment_functions - INFO - Early stopping at epoch 1300. Best Metrics: (0.01922286693161229, 0.014511589403973511, 0.02003443034089113)
2026-05-24 17:30:15,947 - optuna.study.study - INFO - Trial 122 finished with values: [0.01922286693161229, 0.014511589403973511, 0.02003443034089113] and parameters: {'n_layers': 1, 'embedding_dim': 128, 'lr': 0.000647639505305291, 'lambda_val': 0.008908871884988769, 'batch_size': 682, 'optimizer': 'RMSprop'}.
2026-05-24 17:30:21,957 - experiment_functions - INFO - Early stopping at epoch 500. Best Metrics: (0.005167620074820016, 0.003907284768211921, 0.00505606028530808)
2026-05-24 17:30:22,159 - optuna.study.study - INFO - Trial 123 finished with values: [0.005167620074820016, 0.003907284768211921, 0.00505606028530808] and parameters: {'n_layers': 2, 'embedding_dim': 64, 'lr': 0.0002426099667536793, 'lambda_val': 0.0712753228725955, 'batch_size': 2857, 'optimizer': 'RMSprop'}.
2026-05-24 17:30:28,275 - experiment_functions - INFO - Early stopping at epoch 500. Best Metrics: (0.005715659347188991, 0.00445364238410596, 0.0059706129654075865)
2026-05-24 17:30:29,086 - optuna.study.study - INFO - Trial 124 finished with values: [0.005715659347188991, 0.00445364238410596, 0.0059706129654075865] and parameters: {'n_layers': 4, 'embedding_dim': 96, 'lr': 0.00015254433483856934, 'lambda_val': 0.03958976761123264, 'batch_size': 2959, 'optimizer': 'Adam'}.
2026-05-24 17:30:37,133 - experiment_functions - INFO - Early stopping at epoch 700. Best Metrics: (0.02436652286267225, 0.0177317880794702, 0.024505462974504757)
2026-05-24 17:30:37,229 - optuna.study.study - INFO - Trial 125 finished with values: [0.02436652286267225, 0.0177317880794702, 0.024505462974504757] and parameters: {'n_layers': 2, 'embedding_dim': 32, 'lr': 0.0013380689464122827, 'lambda_val': 1.984739363175094e-06, 'batch_size': 1452, 'optimizer': 'RMSprop'}.
2026-05-24 17:30:48,890 - experiment_functions - INFO - Early stopping at epoch 1050. Best Metrics: (0.022854411203587197, 0.017682119205298014, 0.023073535774837294)
2026-05-24 17:30:48,976 - optuna.study.study - INFO - Trial 126 finished with values: [0.022854411203587197, 0.017682119205298014, 0.023073535774837294] and parameters: {'n_layers': 2, 'embedding_dim': 128, 'lr': 0.0005173740894077295, 'lambda_val': 4.630487880914724e-05, 'batch_size': 2196, 'optimizer': 'RMSprop'}.
2026-05-24 17:30:56,081 - experiment_functions - INFO - Early stopping at epoch 550. Best Metrics: (0.018929313330109068, 0.015008278145695365, 0.020143721916781456)
2026-05-24 17:30:56,180 - optuna.study.study - INFO - Trial 127 finished with values: [0.018929313330109068, 0.015008278145695365, 0.020143721916781456] and parameters: {'n_layers': 3, 'embedding_dim': 64, 'lr': 0.012203428335465949, 'lambda_val': 9.827775235361319e-05, 'batch_size': 1565, 'optimizer': 'Adam'}.
2026-05-24 17:31:05,180 - experiment_functions - INFO - Early stopping at epoch 700. Best Metrics: (0.0243848488077612, 0.019304635761589407, 0.025752445868556715)
2026-05-24 17:31:05,278 - optuna.study.study - INFO - Trial 128 finished with values: [0.0243848488077612, 0.019304635761589407, 0.025752445868556715] and parameters: {'n_layers': 4, 'embedding_dim': 32, 'lr': 0.0013380689464122827, 'lambda_val': 0.00010084853954722559, 'batch_size': 1243, 'optimizer': 'Adam'}.
2026-05-24 17:31:50,232 - optuna.study.study - INFO - Trial 129 finished with values: [0.005763433409192651, 0.004536423841059603, 0.005694892194964698] and parameters: {'n_layers': 4, 'embedding_dim': 64, 'lr': 3.1330695763239794e-05, 'lambda_val': 0.006970697664400825, 'batch_size': 2355, 'optimizer': 'RMSprop'}.
2026-05-24 17:31:58,853 - experiment_functions - INFO - Early stopping at epoch 650. Best Metrics: (0.018737335586994492, 0.015099337748344372, 0.01897918304433307)
2026-05-24 17:31:58,996 - optuna.study.study - INFO - Trial 130 finished with values: [0.018737335586994492, 0.015099337748344372, 0.01897918304433307] and parameters: {'n_layers': 4, 'embedding_dim': 32, 'lr': 0.0008744410209870698, 'lambda_val': 1.984739363175094e-06, 'batch_size': 3909, 'optimizer': 'RMSprop'}.
2026-05-24 17:32:06,119 - experiment_functions - INFO - Early stopping at epoch 550. Best Metrics: (0.02292670154708521, 0.018816225165562916, 0.02388964060484907)
2026-05-24 17:32:06,198 - optuna.study.study - INFO - Trial 131 finished with values: [0.02292670154708521, 0.018816225165562916, 0.02388964060484907] and parameters: {'n_layers': 4, 'embedding_dim': 32, 'lr': 0.0065618298710489005, 'lambda_val': 0.03155276903145698, 'batch_size': 2590, 'optimizer': 'Adam'}.
2026-05-24 17:32:53,398 - optuna.study.study - INFO - Trial 132 finished with values: [0.019296502346406785, 0.01617549668874172, 0.020833899666079573] and parameters: {'n_layers': 4, 'embedding_dim': 64, 'lr': 0.0001267558264055704, 'lambda_val': 1.984739363175094e-06, 'batch_size': 2491, 'optimizer': 'RMSprop'}.
2026-05-24 17:33:38,087 - optuna.study.study - INFO - Trial 133 finished with values: [0.024997982540700216, 0.01777317880794702, 0.025140407874920875] and parameters: {'n_layers': 2, 'embedding_dim': 32, 'lr': 0.00032645317624320844, 'lambda_val': 0.00015017709627397348, 'batch_size': 859, 'optimizer': 'Adam'}.
2026-05-24 17:33:47,038 - experiment_functions - INFO - Early stopping at epoch 700. Best Metrics: (0.021594751197361862, 0.01673841059602649, 0.02186302277825432)
2026-05-24 17:33:47,129 - optuna.study.study - INFO - Trial 134 finished with values: [0.021594751197361862, 0.01673841059602649, 0.02186302277825432] and parameters: {'n_layers': 2, 'embedding_dim': 64, 'lr': 0.0009144615335871839, 'lambda_val': 0.0024722511092516997, 'batch_size': 2889, 'optimizer': 'RMSprop'}.
2026-05-24 17:34:03,140 - experiment_functions - INFO - Early stopping at epoch 1400. Best Metrics: (0.014257642832902089, 0.012466887417218542, 0.015598743026136874)
2026-05-24 17:34:03,447 - optuna.study.study - INFO - Trial 135 finished with values: [0.014257642832902089, 0.012466887417218542, 0.015598743026136874] and parameters: {'n_layers': 1, 'embedding_dim': 96, 'lr': 0.000647639505305291, 'lambda_val': 0.06321084010585615, 'batch_size': 1864, 'optimizer': 'Adam'}.
2026-05-24 17:34:46,844 - optuna.study.study - INFO - Trial 136 finished with values: [0.021264977724394275, 0.014321192052980132, 0.02075192286900424] and parameters: {'n_layers': 1, 'embedding_dim': 96, 'lr': 0.0002991906586766703, 'lambda_val': 1.6438287598570295e-05, 'batch_size': 1243, 'optimizer': 'Adam'}.
2026-05-24 17:34:54,025 - experiment_functions - INFO - Early stopping at epoch 600. Best Metrics: (0.020657942442307238, 0.015480132450331125, 0.020412450755066137)
2026-05-24 17:34:54,123 - optuna.study.study - INFO - Trial 137 finished with values: [0.020657942442307238, 0.015480132450331125, 0.020412450755066137] and parameters: {'n_layers': 2, 'embedding_dim': 128, 'lr': 0.003429601537868209, 'lambda_val': 0.00011364672917450008, 'batch_size': 2605, 'optimizer': 'Adam'}.
2026-05-24 17:35:00,744 - experiment_functions - INFO - Early stopping at epoch 550. Best Metrics: (0.010330974021934034, 0.009362582781456954, 0.011149531874051233)
2026-05-24 17:35:00,995 - optuna.study.study - INFO - Trial 138 finished with values: [0.010330974021934034, 0.009362582781456954, 0.011149531874051233] and parameters: {'n_layers': 4, 'embedding_dim': 128, 'lr': 0.00411385889676726, 'lambda_val': 4.639541424555153e-06, 'batch_size': 2807, 'optimizer': 'RMSprop'}.
2026-05-24 17:35:43,240 - optuna.study.study - INFO - Trial 139 finished with values: [0.031606061634211695, 0.02262417218543046, 0.03216168628021486] and parameters: {'n_layers': 4, 'embedding_dim': 32, 'lr': 0.00028561429900097026, 'lambda_val': 1.7730743790224436e-06, 'batch_size': 811, 'optimizer': 'RMSprop'}.
2026-05-24 17:36:22,932 - optuna.study.study - INFO - Trial 140 finished with values: [0.007266656258752131, 0.00538907284768212, 0.00733512480724318] and parameters: {'n_layers': 2, 'embedding_dim': 128, 'lr': 2.650219157157251e-05, 'lambda_val': 4.630487880914724e-05, 'batch_size': 2401, 'optimizer': 'RMSprop'}.
2026-05-24 17:36:39,215 - experiment_functions - INFO - Early stopping at epoch 1500. Best Metrics: (0.02619142417540233, 0.019735099337748346, 0.02610917319751504)
2026-05-24 17:36:39,996 - optuna.study.study - INFO - Trial 141 finished with values: [0.02619142417540233, 0.019735099337748346, 0.02610917319751504] and parameters: {'n_layers': 3, 'embedding_dim': 96, 'lr': 0.0002991906586766703, 'lambda_val': 0.0036922476620693135, 'batch_size': 1603, 'optimizer': 'Adam'}.
2026-05-24 17:36:57,284 - experiment_functions - INFO - Early stopping at epoch 1550. Best Metrics: (0.028546245685135592, 0.021581125827814573, 0.028103814577434647)
2026-05-24 17:36:57,366 - optuna.study.study - INFO - Trial 142 finished with values: [0.028546245685135592, 0.021581125827814573, 0.028103814577434647] and parameters: {'n_layers': 4, 'embedding_dim': 96, 'lr': 0.0003156053277132074, 'lambda_val': 0.0020230580830565862, 'batch_size': 720, 'optimizer': 'RMSprop'}.
2026-05-24 17:37:37,859 - optuna.study.study - INFO - Trial 143 finished with values: [0.02039833754590385, 0.014561258278145696, 0.020952812587666285] and parameters: {'n_layers': 2, 'embedding_dim': 96, 'lr': 0.0002692346266435404, 'lambda_val': 0.001164130600275734, 'batch_size': 559, 'optimizer': 'Adam'}.
2026-05-24 17:37:45,927 - experiment_functions - INFO - Early stopping at epoch 700. Best Metrics: (0.02793372099308017, 0.021200331125827816, 0.028527986955655945)
2026-05-24 17:37:46,012 - optuna.study.study - INFO - Trial 144 finished with values: [0.02793372099308017, 0.021200331125827816, 0.028527986955655945] and parameters: {'n_layers': 4, 'embedding_dim': 32, 'lr': 0.0006561721861091232, 'lambda_val': 0.03958976761123264, 'batch_size': 1525, 'optimizer': 'RMSprop'}.
2026-05-24 17:38:25,676 - optuna.study.study - INFO - Trial 145 finished with values: [0.018059111107789457, 0.013410596026490066, 0.018723174858259438] and parameters: {'n_layers': 1, 'embedding_dim': 96, 'lr': 0.0003156053277132074, 'lambda_val': 0.00017211939323660374, 'batch_size': 682, 'optimizer': 'Adam'}.
2026-05-24 17:38:32,460 - experiment_functions - INFO - Early stopping at epoch 500. Best Metrics: (0.009609477729150719, 0.0073013245033112595, 0.009237576062750894)
2026-05-24 17:38:32,713 - optuna.study.study - INFO - Trial 146 finished with values: [0.009609477729150719, 0.0073013245033112595, 0.009237576062750894] and parameters: {'n_layers': 4, 'embedding_dim': 256, 'lr': 0.014134811155656365, 'lambda_val': 0.0015978933099847826, 'batch_size': 1525, 'optimizer': 'RMSprop'}.
2026-05-24 17:38:39,792 - experiment_functions - INFO - Early stopping at epoch 600. Best Metrics: (0.019161990928944505, 0.013609271523178808, 0.0189836316617452)
2026-05-24 17:38:39,876 - optuna.study.study - INFO - Trial 147 finished with values: [0.019161990928944505, 0.013609271523178808, 0.0189836316617452] and parameters: {'n_layers': 1, 'embedding_dim': 128, 'lr': 0.004009595785666262, 'lambda_val': 0.00016785478865142132, 'batch_size': 1565, 'optimizer': 'Adam'}.
2026-05-24 17:38:50,306 - experiment_functions - INFO - Early stopping at epoch 900. Best Metrics: (0.022311048192746624, 0.017980132450331126, 0.02388160314684581)
2026-05-24 17:38:51,181 - optuna.study.study - INFO - Trial 148 finished with values: [0.022311048192746624, 0.017980132450331126, 0.02388160314684581] and parameters: {'n_layers': 4, 'embedding_dim': 64, 'lr': 0.0004912155896913429, 'lambda_val': 0.0002833202672041478, 'batch_size': 3794, 'optimizer': 'Adam'}.
2026-05-24 17:38:58,800 - experiment_functions - INFO - Early stopping at epoch 650. Best Metrics: (0.022320985965890338, 0.015620860927152317, 0.022293074158062864)
2026-05-24 17:38:58,875 - optuna.study.study - INFO - Trial 149 finished with values: [0.022320985965890338, 0.015620860927152317, 0.022293074158062864] and parameters: {'n_layers': 1, 'embedding_dim': 64, 'lr': 0.0024421865435223515, 'lambda_val': 4.630487880914724e-05, 'batch_size': 859, 'optimizer': 'RMSprop'}.
2026-05-24 17:39:06,022 - experiment_functions - INFO - Early stopping at epoch 600. Best Metrics: (0.01793265718356629, 0.01336092715231788, 0.018053544766645335)
2026-05-24 17:39:06,109 - optuna.study.study - INFO - Trial 150 finished with values: [0.01793265718356629, 0.01336092715231788, 0.018053544766645335] and parameters: {'n_layers': 1, 'embedding_dim': 64, 'lr': 0.00411385889676726, 'lambda_val': 2.3974044149892758e-05, 'batch_size': 3774, 'optimizer': 'Adam'}.
2026-05-24 17:39:11,741 - experiment_functions - INFO - Early stopping at epoch 500. Best Metrics: (0.004665394297746625, 0.004105960264900663, 0.005062274782993135)
2026-05-24 17:39:12,653 - optuna.study.study - INFO - Trial 151 finished with values: [0.004665394297746625, 0.004105960264900663, 0.005062274782993135] and parameters: {'n_layers': 2, 'embedding_dim': 64, 'lr': 0.0009144615335871839, 'lambda_val': 0.006970697664400825, 'batch_size': 675, 'optimizer': 'SGD'}.
2026-05-24 17:39:24,293 - experiment_functions - INFO - Early stopping at epoch 1000. Best Metrics: (0.02792846006304037, 0.021746688741721854, 0.02817172382747242)
2026-05-24 17:39:25,141 - optuna.study.study - INFO - Trial 152 finished with values: [0.02792846006304037, 0.021746688741721854, 0.02817172382747242] and parameters: {'n_layers': 4, 'embedding_dim': 32, 'lr': 0.00032645317624320844, 'lambda_val': 0.03958976761123264, 'batch_size': 3200, 'optimizer': 'RMSprop'}.
2026-05-24 17:39:38,789 - experiment_functions - INFO - Early stopping at epoch 1200. Best Metrics: (0.023217931075000794, 0.01833609271523179, 0.023739036967072275)
2026-05-24 17:39:38,883 - optuna.study.study - INFO - Trial 153 finished with values: [0.023217931075000794, 0.01833609271523179, 0.023739036967072275] and parameters: {'n_layers': 4, 'embedding_dim': 96, 'lr': 0.0002991906586766703, 'lambda_val': 4.630487880914724e-05, 'batch_size': 2338, 'optimizer': 'Adam'}.
