2026-05-24 14:30:47,293 - optuna.study.study - INFO - Trial 184 finished with values: [0.0540606883366633, 0.03314569536423841, 0.04781415658579068] and parameters: {'n_layers': 2, 'embedding_dim': 64, 'lr': 0.0002249192915429732, 'lambda_val': 5.836368620363864e-06, 'batch_size': 917, 'optimizer': 'RMSprop'}.
2026-05-24 14:31:00,683 - experiment_functions - INFO - Early stopping at epoch 1200. Best Metrics: (0.005928400669146151, 0.004552980132450331, 0.005867548065063328)
2026-05-24 14:31:00,779 - optuna.study.study - INFO - Trial 185 finished with values: [0.005928400669146151, 0.004552980132450331, 0.005867548065063328] and parameters: {'n_layers': 4, 'embedding_dim': 32, 'lr': 1.6531010583813524e-05, 'lambda_val': 7.985064351552862e-06, 'batch_size': 917, 'optimizer': 'RMSprop'}.
2026-05-24 14:31:28,073 - experiment_functions - INFO - Early stopping at epoch 2350. Best Metrics: (0.05487576645509637, 0.03322847682119205, 0.04862198842130605)
2026-05-24 14:31:28,152 - optuna.study.study - INFO - Trial 186 finished with values: [0.05487576645509637, 0.03322847682119205, 0.04862198842130605] and parameters: {'n_layers': 2, 'embedding_dim': 64, 'lr': 0.00027128245814660824, 'lambda_val': 0.0009801820764399163, 'batch_size': 1942, 'optimizer': 'RMSprop'}.
2026-05-24 14:31:39,762 - experiment_functions - INFO - Early stopping at epoch 850. Best Metrics: (0.03889712131035855, 0.02521523178807947, 0.03585929119036212)
2026-05-24 14:31:39,840 - optuna.study.study - INFO - Trial 187 finished with values: [0.03889712131035855, 0.02521523178807947, 0.03585929119036212] and parameters: {'n_layers': 4, 'embedding_dim': 96, 'lr': 0.0003859482391059796, 'lambda_val': 9.941912907121407e-06, 'batch_size': 1042, 'optimizer': 'RMSprop'}.
2026-05-24 14:31:46,150 - experiment_functions - INFO - Early stopping at epoch 500. Best Metrics: (0.005243905068891843, 0.004594370860927153, 0.0056786697670757275)
2026-05-24 14:31:46,349 - optuna.study.study - INFO - Trial 188 finished with values: [0.005243905068891843, 0.004594370860927153, 0.0056786697670757275] and parameters: {'n_layers': 3, 'embedding_dim': 32, 'lr': 0.0018843975064796988, 'lambda_val': 9.463812196591343e-06, 'batch_size': 3012, 'optimizer': 'SGD'}.
2026-05-24 14:32:19,318 - experiment_functions - INFO - Early stopping at epoch 3100. Best Metrics: (0.004933701891393866, 0.004362582781456953, 0.005222106506651378)
2026-05-24 14:32:19,456 - optuna.study.study - INFO - Trial 189 finished with values: [0.004933701891393866, 0.004362582781456953, 0.005222106506651378] and parameters: {'n_layers': 3, 'embedding_dim': 64, 'lr': 1.0662247719040478e-05, 'lambda_val': 1.8104361416880523e-06, 'batch_size': 917, 'optimizer': 'RMSprop'}.
2026-05-24 14:32:28,149 - experiment_functions - INFO - Early stopping at epoch 600. Best Metrics: (0.04120651477842942, 0.02744205298013245, 0.03769130912203844)
2026-05-24 14:32:28,641 - optuna.study.study - INFO - Trial 190 finished with values: [0.04120651477842942, 0.02744205298013245, 0.03769130912203844] and parameters: {'n_layers': 2, 'embedding_dim': 256, 'lr': 0.0007653011157039608, 'lambda_val': 7.187538783101437e-06, 'batch_size': 1970, 'optimizer': 'RMSprop'}.
2026-05-24 14:32:40,912 - experiment_functions - INFO - Early stopping at epoch 850. Best Metrics: (0.03640736510785147, 0.025364238410596023, 0.03394529694433288)
2026-05-24 14:32:41,010 - optuna.study.study - INFO - Trial 191 finished with values: [0.03640736510785147, 0.025364238410596023, 0.03394529694433288] and parameters: {'n_layers': 4, 'embedding_dim': 128, 'lr': 0.0003185031661628478, 'lambda_val': 7.187538783101437e-06, 'batch_size': 1438, 'optimizer': 'RMSprop'}.
2026-05-24 14:33:01,183 - experiment_functions - INFO - Early stopping at epoch 1200. Best Metrics: (0.04012759153571059, 0.02724337748344371, 0.03686223593755538)
2026-05-24 14:33:01,271 - optuna.study.study - INFO - Trial 192 finished with values: [0.04012759153571059, 0.02724337748344371, 0.03686223593755538] and parameters: {'n_layers': 4, 'embedding_dim': 128, 'lr': 0.0002249192915429732, 'lambda_val': 0.0034713999695200454, 'batch_size': 1149, 'optimizer': 'RMSprop'}.
2026-05-24 14:33:15,357 - experiment_functions - INFO - Early stopping at epoch 1150. Best Metrics: (0.05159519177685996, 0.030670529801324502, 0.04702799807476601)
2026-05-24 14:33:15,539 - optuna.study.study - INFO - Trial 193 finished with values: [0.05159519177685996, 0.030670529801324502, 0.04702799807476601] and parameters: {'n_layers': 2, 'embedding_dim': 64, 'lr': 0.0003540171758009511, 'lambda_val': 1.6606118736479167e-06, 'batch_size': 3012, 'optimizer': 'RMSprop'}.
2026-05-24 14:33:55,812 - optuna.study.study - INFO - Trial 194 finished with values: [0.018354538235172746, 0.012930463576158941, 0.017887089512537473] and parameters: {'n_layers': 1, 'embedding_dim': 32, 'lr': 0.0002431992437453443, 'lambda_val': 7.011674546086162e-05, 'batch_size': 1236, 'optimizer': 'Adam'}.
2026-05-24 14:34:09,068 - experiment_functions - INFO - Early stopping at epoch 850. Best Metrics: (0.03622618437210265, 0.02418874172185431, 0.03360965638191711)
2026-05-24 14:34:09,173 - optuna.study.study - INFO - Trial 195 finished with values: [0.03622618437210265, 0.02418874172185431, 0.03360965638191711] and parameters: {'n_layers': 3, 'embedding_dim': 256, 'lr': 0.00030176895436135383, 'lambda_val': 1.0152215023816412e-05, 'batch_size': 3618, 'optimizer': 'Adam'}.
2026-05-24 14:34:36,161 - experiment_functions - INFO - Early stopping at epoch 2200. Best Metrics: (0.04423309729437995, 0.028410596026490067, 0.040622473143719875)
2026-05-24 14:34:36,243 - optuna.study.study - INFO - Trial 196 finished with values: [0.04423309729437995, 0.028410596026490067, 0.040622473143719875] and parameters: {'n_layers': 4, 'embedding_dim': 64, 'lr': 0.0002249192915429732, 'lambda_val': 1.6606118736479167e-06, 'batch_size': 968, 'optimizer': 'RMSprop'}.
2026-05-24 14:34:44,623 - experiment_functions - INFO - Early stopping at epoch 650. Best Metrics: (0.05392925825674159, 0.03283112582781457, 0.04704833746039141)
2026-05-24 14:34:44,721 - optuna.study.study - INFO - Trial 197 finished with values: [0.05392925825674159, 0.03283112582781457, 0.04704833746039141] and parameters: {'n_layers': 2, 'embedding_dim': 96, 'lr': 0.0018843975064796988, 'lambda_val': 9.463812196591343e-06, 'batch_size': 901, 'optimizer': 'Adam'}.
2026-05-24 14:35:27,613 - optuna.study.study - INFO - Trial 198 finished with values: [0.03443703499385479, 0.022963576158940395, 0.03182553958850365] and parameters: {'n_layers': 2, 'embedding_dim': 32, 'lr': 0.00012749160505002986, 'lambda_val': 0.0034713999695200454, 'batch_size': 3462, 'optimizer': 'Adam'}.
2026-05-24 14:35:33,868 - experiment_functions - INFO - Early stopping at epoch 500. Best Metrics: (0.005807802336211319, 0.0043791390728476825, 0.005774423936900986)
2026-05-24 14:35:35,077 - optuna.study.study - INFO - Trial 199 finished with values: [0.005807802336211319, 0.0043791390728476825, 0.005774423936900986] and parameters: {'n_layers': 4, 'embedding_dim': 32, 'lr': 0.0005264581247601549, 'lambda_val': 7.985064351552862e-06, 'batch_size': 530, 'optimizer': 'SGD'}.
2026-05-24 14:35:45,529 - experiment_functions - INFO - Early stopping at epoch 850. Best Metrics: (0.030102501250846462, 0.020860927152317882, 0.029010837233400106)
2026-05-24 14:35:46,103 - optuna.study.study - INFO - Trial 200 finished with values: [0.030102501250846462, 0.020860927152317882, 0.029010837233400106] and parameters: {'n_layers': 4, 'embedding_dim': 32, 'lr': 0.0006563002976325864, 'lambda_val': 1.9444967836105092e-06, 'batch_size': 1970, 'optimizer': 'Adam'}.
2026-05-24 14:35:55,723 - experiment_functions - INFO - Early stopping at epoch 550. Best Metrics: (0.03295366297087546, 0.022193708609271525, 0.029896716616254326)
2026-05-24 14:35:56,770 - optuna.study.study - INFO - Trial 201 finished with values: [0.03295366297087546, 0.022193708609271525, 0.029896716616254326] and parameters: {'n_layers': 4, 'embedding_dim': 256, 'lr': 0.002967376329076086, 'lambda_val': 9.716926348898639e-06, 'batch_size': 606, 'optimizer': 'Adam'}.
2026-05-24 14:36:41,595 - optuna.study.study - INFO - Trial 202 finished with values: [0.05111616402821419, 0.031208609271523177, 0.044563799736251034] and parameters: {'n_layers': 2, 'embedding_dim': 64, 'lr': 0.0002249192915429732, 'lambda_val': 0.0012412306240145103, 'batch_size': 968, 'optimizer': 'RMSprop'}.
2026-05-24 14:36:55,173 - experiment_functions - INFO - Early stopping at epoch 1050. Best Metrics: (0.043285025897399645, 0.028692052980132454, 0.0396029647809391)
2026-05-24 14:36:55,394 - optuna.study.study - INFO - Trial 203 finished with values: [0.043285025897399645, 0.028692052980132454, 0.0396029647809391] and parameters: {'n_layers': 3, 'embedding_dim': 96, 'lr': 0.0003859482391059796, 'lambda_val': 0.000339235643209516, 'batch_size': 1042, 'optimizer': 'RMSprop'}.
2026-05-24 14:37:36,891 - optuna.study.study - INFO - Trial 204 finished with values: [0.022038568678491324, 0.015745033112582782, 0.02172207139118988] and parameters: {'n_layers': 1, 'embedding_dim': 96, 'lr': 0.0002249192915429732, 'lambda_val': 1.6606118736479167e-06, 'batch_size': 968, 'optimizer': 'RMSprop'}.
2026-05-24 14:37:47,943 - experiment_functions - INFO - Early stopping at epoch 850. Best Metrics: (0.05737494612831274, 0.03453642384105961, 0.05119230249285511)
2026-05-24 14:37:48,033 - optuna.study.study - INFO - Trial 205 finished with values: [0.05737494612831274, 0.03453642384105961, 0.05119230249285511] and parameters: {'n_layers': 2, 'embedding_dim': 128, 'lr': 0.0007653011157039608, 'lambda_val': 7.011674546086162e-05, 'batch_size': 1055, 'optimizer': 'Adam'}.
2026-05-24 14:37:56,241 - experiment_functions - INFO - Early stopping at epoch 650. Best Metrics: (0.049201015389041446, 0.03019039735099338, 0.04278392613989777)
2026-05-24 14:37:56,323 - optuna.study.study - INFO - Trial 206 finished with values: [0.049201015389041446, 0.03019039735099338, 0.04278392613989777] and parameters: {'n_layers': 2, 'embedding_dim': 64, 'lr': 0.0009078476703379587, 'lambda_val': 0.0009801820764399163, 'batch_size': 917, 'optimizer': 'RMSprop'}.
2026-05-24 14:38:02,555 - experiment_functions - INFO - Early stopping at epoch 500. Best Metrics: (0.005400638641341632, 0.004412251655629139, 0.005468554699443425)
2026-05-24 14:38:02,714 - optuna.study.study - INFO - Trial 207 finished with values: [0.005400638641341632, 0.004412251655629139, 0.005468554699443425] and parameters: {'n_layers': 4, 'embedding_dim': 32, 'lr': 0.0002249192915429732, 'lambda_val': 0.0009801820764399163, 'batch_size': 968, 'optimizer': 'SGD'}.
2026-05-24 14:38:23,389 - experiment_functions - INFO - Early stopping at epoch 1350. Best Metrics: (0.04975147020856942, 0.030422185430463575, 0.04547272574461869)
2026-05-24 14:38:24,004 - optuna.study.study - INFO - Trial 208 finished with values: [0.04975147020856942, 0.030422185430463575, 0.04547272574461869] and parameters: {'n_layers': 3, 'embedding_dim': 256, 'lr': 0.0002249192915429732, 'lambda_val': 7.187538783101437e-06, 'batch_size': 968, 'optimizer': 'RMSprop'}.
2026-05-24 14:39:09,417 - optuna.study.study - INFO - Trial 209 finished with values: [0.016368756295841027, 0.012110927152317881, 0.016304005474949895] and parameters: {'n_layers': 1, 'embedding_dim': 256, 'lr': 0.0002249192915429732, 'lambda_val': 2.6431113659875313e-06, 'batch_size': 917, 'optimizer': 'Adam'}.
2026-05-24 14:39:21,149 - experiment_functions - INFO - Early stopping at epoch 900. Best Metrics: (0.048213359825457824, 0.02975993377483444, 0.04369274840141774)
2026-05-24 14:39:21,637 - optuna.study.study - INFO - Trial 210 finished with values: [0.048213359825457824, 0.02975993377483444, 0.04369274840141774] and parameters: {'n_layers': 4, 'embedding_dim': 64, 'lr': 0.0003540171758009511, 'lambda_val': 1.6606118736479167e-06, 'batch_size': 968, 'optimizer': 'RMSprop'}.
2026-05-24 14:39:31,476 - experiment_functions - INFO - Early stopping at epoch 800. Best Metrics: (0.03327682831357732, 0.02279801324503311, 0.03098797034778374)
2026-05-24 14:39:31,572 - optuna.study.study - INFO - Trial 211 finished with values: [0.03327682831357732, 0.02279801324503311, 0.03098797034778374] and parameters: {'n_layers': 3, 'embedding_dim': 32, 'lr': 0.0006563002976325864, 'lambda_val': 3.1246121066332336e-06, 'batch_size': 3573, 'optimizer': 'Adam'}.
2026-05-24 14:40:17,232 - optuna.study.study - INFO - Trial 212 finished with values: [0.04406817446707765, 0.028029801324503313, 0.042570716807953726] and parameters: {'n_layers': 4, 'embedding_dim': 32, 'lr': 0.0002249192915429732, 'lambda_val': 0.0009801820764399163, 'batch_size': 1317, 'optimizer': 'RMSprop'}.
2026-05-24 14:40:25,995 - experiment_functions - INFO - Early stopping at epoch 600. Best Metrics: (0.04549630310849778, 0.028849337748344372, 0.04100563673615285)
2026-05-24 14:40:26,073 - optuna.study.study - INFO - Trial 213 finished with values: [0.04549630310849778, 0.028849337748344372, 0.04100563673615285] and parameters: {'n_layers': 2, 'embedding_dim': 256, 'lr': 0.0007653011157039608, 'lambda_val': 7.187538783101437e-06, 'batch_size': 1970, 'optimizer': 'RMSprop'}.
2026-05-24 14:40:34,897 - experiment_functions - INFO - Early stopping at epoch 650. Best Metrics: (0.02901625187802812, 0.020190397350993376, 0.027451030499553438)
2026-05-24 14:40:34,992 - optuna.study.study - INFO - Trial 214 finished with values: [0.02901625187802812, 0.020190397350993376, 0.027451030499553438] and parameters: {'n_layers': 1, 'embedding_dim': 256, 'lr': 0.01245800478955897, 'lambda_val': 7.985064351552862e-06, 'batch_size': 3353, 'optimizer': 'Adam'}.
2026-05-24 14:41:19,272 - optuna.study.study - INFO - Trial 215 finished with values: [0.04948621335610577, 0.030438741721854304, 0.043562375149361586] and parameters: {'n_layers': 2, 'embedding_dim': 32, 'lr': 0.0002249192915429732, 'lambda_val': 2.0723645088674174e-05, 'batch_size': 2154, 'optimizer': 'RMSprop'}.
2026-05-24 14:41:29,933 - experiment_functions - INFO - Early stopping at epoch 800. Best Metrics: (0.05289369645284678, 0.032342715231788076, 0.046276180546677745)
2026-05-24 14:41:30,108 - optuna.study.study - INFO - Trial 216 finished with values: [0.05289369645284678, 0.032342715231788076, 0.046276180546677745] and parameters: {'n_layers': 2, 'embedding_dim': 128, 'lr': 0.0007653011157039608, 'lambda_val': 0.0005506765945651771, 'batch_size': 1149, 'optimizer': 'Adam'}.
2026-05-24 14:41:38,856 - experiment_functions - INFO - Early stopping at epoch 700. Best Metrics: (0.05213153459844545, 0.031440397350993375, 0.046525450814136206)
2026-05-24 14:41:38,950 - optuna.study.study - INFO - Trial 217 finished with values: [0.05213153459844545, 0.031440397350993375, 0.046525450814136206] and parameters: {'n_layers': 2, 'embedding_dim': 64, 'lr': 0.0006563002976325864, 'lambda_val': 1.4247463760726523e-06, 'batch_size': 2154, 'optimizer': 'RMSprop'}.
2026-05-24 14:42:05,593 - experiment_functions - INFO - Early stopping at epoch 2150. Best Metrics: (0.04661106859498377, 0.02991721854304636, 0.042134212539930875)
2026-05-24 14:42:05,677 - optuna.study.study - INFO - Trial 218 finished with values: [0.04661106859498377, 0.02991721854304636, 0.042134212539930875] and parameters: {'n_layers': 4, 'embedding_dim': 64, 'lr': 0.0002249192915429732, 'lambda_val': 0.0009801820764399163, 'batch_size': 968, 'optimizer': 'RMSprop'}.
2026-05-24 14:42:11,949 - experiment_functions - INFO - Early stopping at epoch 500. Best Metrics: (0.004977754074243112, 0.003915562913907285, 0.004862832590004353)
2026-05-24 14:42:12,898 - optuna.study.study - INFO - Trial 219 finished with values: [0.004977754074243112, 0.003915562913907285, 0.004862832590004353] and parameters: {'n_layers': 1, 'embedding_dim': 128, 'lr': 0.0007653011157039608, 'lambda_val': 2.6431113659875313e-06, 'batch_size': 1238, 'optimizer': 'SGD'}.
2026-05-24 14:42:26,535 - experiment_functions - INFO - Early stopping at epoch 1050. Best Metrics: (0.03773931741834284, 0.02583609271523179, 0.03481651962305679)
2026-05-24 14:42:26,620 - optuna.study.study - INFO - Trial 220 finished with values: [0.03773931741834284, 0.02583609271523179, 0.03481651962305679] and parameters: {'n_layers': 3, 'embedding_dim': 96, 'lr': 0.00030176895436135383, 'lambda_val': 0.000339235643209516, 'batch_size': 2318, 'optimizer': 'Adam'}.
2026-05-24 14:42:42,958 - experiment_functions - INFO - Early stopping at epoch 1150. Best Metrics: (0.05021339984849993, 0.03131622516556291, 0.04507164975869922)
2026-05-24 14:42:43,604 - optuna.study.study - INFO - Trial 221 finished with values: [0.05021339984849993, 0.03131622516556291, 0.04507164975869922] and parameters: {'n_layers': 2, 'embedding_dim': 256, 'lr': 0.00027128245814660824, 'lambda_val': 0.0009801820764399163, 'batch_size': 1942, 'optimizer': 'RMSprop'}.
2026-05-24 14:42:53,909 - experiment_functions - INFO - Early stopping at epoch 700. Best Metrics: (0.04911676023442272, 0.030463576158940398, 0.04400833413409092)
2026-05-24 14:42:54,821 - optuna.study.study - INFO - Trial 222 finished with values: [0.04911676023442272, 0.030463576158940398, 0.04400833413409092] and parameters: {'n_layers': 2, 'embedding_dim': 256, 'lr': 0.0007653011157039608, 'lambda_val': 0.0007701916075392747, 'batch_size': 1970, 'optimizer': 'Adam'}.
2026-05-24 14:43:09,267 - experiment_functions - INFO - Early stopping at epoch 850. Best Metrics: (0.0315067510885596, 0.022566225165562916, 0.029560053996402418)
2026-05-24 14:43:09,495 - optuna.study.study - INFO - Trial 223 finished with values: [0.0315067510885596, 0.022566225165562916, 0.029560053996402418] and parameters: {'n_layers': 4, 'embedding_dim': 256, 'lr': 0.0002249192915429732, 'lambda_val': 0.0009801820764399163, 'batch_size': 1970, 'optimizer': 'RMSprop'}.
2026-05-24 14:43:25,630 - experiment_functions - INFO - Early stopping at epoch 1250. Best Metrics: (0.05803630255396089, 0.034875827814569535, 0.05146912747253852)
2026-05-24 14:43:25,956 - optuna.study.study - INFO - Trial 224 finished with values: [0.05803630255396089, 0.034875827814569535, 0.05146912747253852] and parameters: {'n_layers': 1, 'embedding_dim': 256, 'lr': 0.0007653011157039608, 'lambda_val': 2.6431113659875313e-06, 'batch_size': 1236, 'optimizer': 'Adam'}.
2026-05-24 14:43:40,611 - experiment_functions - INFO - Early stopping at epoch 1250. Best Metrics: (0.059710574404631345, 0.03598509933774835, 0.054894716326323374)
2026-05-24 14:43:40,728 - optuna.study.study - INFO - Trial 225 finished with values: [0.059710574404631345, 0.03598509933774835, 0.054894716326323374] and parameters: {'n_layers': 1, 'embedding_dim': 32, 'lr': 0.0007653011157039608, 'lambda_val': 2.6431113659875313e-06, 'batch_size': 1970, 'optimizer': 'Adam'}.
2026-05-24 14:43:51,471 - experiment_functions - INFO - Early stopping at epoch 750. Best Metrics: (0.02391729025084643, 0.01548841059602649, 0.02131646453332944)
2026-05-24 14:43:51,797 - optuna.study.study - INFO - Trial 226 finished with values: [0.02391729025084643, 0.01548841059602649, 0.02131646453332944] and parameters: {'n_layers': 2, 'embedding_dim': 256, 'lr': 0.015620253246524628, 'lambda_val': 0.0007701916075392747, 'batch_size': 1970, 'optimizer': 'Adam'}.
2026-05-24 14:44:00,539 - experiment_functions - INFO - Early stopping at epoch 600. Best Metrics: (0.053388328953197374, 0.031738410596026494, 0.046720499070284596)
2026-05-24 14:44:00,633 - optuna.study.study - INFO - Trial 227 finished with values: [0.053388328953197374, 0.031738410596026494, 0.046720499070284596] and parameters: {'n_layers': 2, 'embedding_dim': 256, 'lr': 0.0018843975064796988, 'lambda_val': 7.187538783101437e-06, 'batch_size': 1055, 'optimizer': 'Adam'}.
2026-05-24 14:44:08,310 - experiment_functions - INFO - Early stopping at epoch 550. Best Metrics: (0.034884682337819085, 0.02478476821192053, 0.03429322760479154)
2026-05-24 14:44:08,396 - optuna.study.study - INFO - Trial 228 finished with values: [0.034884682337819085, 0.02478476821192053, 0.03429322760479154] and parameters: {'n_layers': 1, 'embedding_dim': 256, 'lr': 0.01245800478955897, 'lambda_val': 0.00019642917096569077, 'batch_size': 1670, 'optimizer': 'Adam'}.
2026-05-24 14:44:24,541 - experiment_functions - INFO - Early stopping at epoch 1250. Best Metrics: (0.04940905234609185, 0.03087748344370861, 0.0447521840680125)
2026-05-24 14:44:25,339 - optuna.study.study - INFO - Trial 229 finished with values: [0.04940905234609185, 0.03087748344370861, 0.0447521840680125] and parameters: {'n_layers': 3, 'embedding_dim': 96, 'lr': 0.0003540171758009511, 'lambda_val': 0.000339235643209516, 'batch_size': 627, 'optimizer': 'RMSprop'}.
2026-05-24 14:44:35,361 - experiment_functions - INFO - Early stopping at epoch 750. Best Metrics: (0.054686486905462954, 0.03348509933774835, 0.048303865662807664)
2026-05-24 14:44:35,531 - optuna.study.study - INFO - Trial 230 finished with values: [0.054686486905462954, 0.03348509933774835, 0.048303865662807664] and parameters: {'n_layers': 2, 'embedding_dim': 128, 'lr': 0.0007653011157039608, 'lambda_val': 0.0007701916075392747, 'batch_size': 1763, 'optimizer': 'Adam'}.
2026-05-24 14:44:42,974 - experiment_functions - INFO - Early stopping at epoch 550. Best Metrics: (0.027919114375524964, 0.020885761589403973, 0.02678351631423005)
2026-05-24 14:44:43,104 - optuna.study.study - INFO - Trial 231 finished with values: [0.027919114375524964, 0.020885761589403973, 0.02678351631423005] and parameters: {'n_layers': 2, 'embedding_dim': 128, 'lr': 0.0017353534448035345, 'lambda_val': 0.0009801820764399163, 'batch_size': 1942, 'optimizer': 'RMSprop'}.
2026-05-24 14:44:56,623 - experiment_functions - INFO - Early stopping at epoch 1050. Best Metrics: (0.05385182844608249, 0.03410596026490066, 0.048982934965444605)
