2026-05-24 11:06:32,529 - optuna.study.study - INFO - Trial 27 finished with values: [0.005257503396164507, 0.004329470198675497, 0.005719923882440901] and parameters: {'n_layers': 3, 'embedding_dim': 64, 'lr': 0.00028922439183333665, 'lambda_val': 0.0030173755584190346, 'batch_size': 1859, 'optimizer': 'SGD'}.
2026-05-24 11:06:38,820 - experiment_functions - INFO - Early stopping at epoch 500. Best Metrics: (0.005244077108932764, 0.004271523178807948, 0.005290805931827014)
2026-05-24 11:06:39,870 - optuna.study.study - INFO - Trial 28 finished with values: [0.005244077108932764, 0.004271523178807948, 0.005290805931827014] and parameters: {'n_layers': 4, 'embedding_dim': 32, 'lr': 0.00020967418703668258, 'lambda_val': 5.711460610007183e-05, 'batch_size': 3284, 'optimizer': 'SGD'}.
2026-05-24 11:06:46,086 - experiment_functions - INFO - Early stopping at epoch 500. Best Metrics: (0.005670740561958831, 0.004089403973509934, 0.005424709206117406)
2026-05-24 11:06:46,588 - optuna.study.study - INFO - Trial 29 finished with values: [0.005670740561958831, 0.004089403973509934, 0.005424709206117406] and parameters: {'n_layers': 2, 'embedding_dim': 64, 'lr': 3.071436696133652e-05, 'lambda_val': 4.1936709800113786e-06, 'batch_size': 4051, 'optimizer': 'SGD'}.
2026-05-24 11:06:52,134 - experiment_functions - INFO - Early stopping at epoch 500. Best Metrics: (0.00543210278149926, 0.004751655629139073, 0.005989223957222847)
2026-05-24 11:06:52,343 - optuna.study.study - INFO - Trial 30 finished with values: [0.00543210278149926, 0.004751655629139073, 0.005989223957222847] and parameters: {'n_layers': 1, 'embedding_dim': 64, 'lr': 0.00015466190738157504, 'lambda_val': 0.007434349875467746, 'batch_size': 1236, 'optimizer': 'SGD'}.
2026-05-24 11:06:58,802 - experiment_functions - INFO - Early stopping at epoch 500. Best Metrics: (0.005343483512939894, 0.004470198675496689, 0.005538693833929047)
2026-05-24 11:06:59,747 - optuna.study.study - INFO - Trial 31 finished with values: [0.005343483512939894, 0.004470198675496689, 0.005538693833929047] and parameters: {'n_layers': 1, 'embedding_dim': 256, 'lr': 0.00039947370498239144, 'lambda_val': 0.010742243956363326, 'batch_size': 2056, 'optimizer': 'SGD'}.
2026-05-24 11:07:11,587 - experiment_functions - INFO - Early stopping at epoch 750. Best Metrics: (0.037803039591688445, 0.025364238410596023, 0.03503625169775089)
2026-05-24 11:07:11,675 - optuna.study.study - INFO - Trial 32 finished with values: [0.037803039591688445, 0.025364238410596023, 0.03503625169775089] and parameters: {'n_layers': 3, 'embedding_dim': 256, 'lr': 0.0004379727673244972, 'lambda_val': 2.666704909740151e-06, 'batch_size': 2551, 'optimizer': 'Adam'}.
2026-05-24 11:07:18,157 - experiment_functions - INFO - Early stopping at epoch 500. Best Metrics: (0.005031402233665425, 0.004263245033112583, 0.005333497329532383)
2026-05-24 11:07:18,687 - optuna.study.study - INFO - Trial 33 finished with values: [0.005031402233665425, 0.004263245033112583, 0.005333497329532383] and parameters: {'n_layers': 3, 'embedding_dim': 96, 'lr': 1.5263433072432353e-05, 'lambda_val': 0.08377689675973803, 'batch_size': 1013, 'optimizer': 'RMSprop'}.
2026-05-24 11:07:25,520 - experiment_functions - INFO - Early stopping at epoch 500. Best Metrics: (0.005050072946001634, 0.004329470198675497, 0.005425999918856481)
2026-05-24 11:07:25,914 - optuna.study.study - INFO - Trial 34 finished with values: [0.005050072946001634, 0.004329470198675497, 0.005425999918856481] and parameters: {'n_layers': 3, 'embedding_dim': 128, 'lr': 7.369019531353651e-05, 'lambda_val': 0.0041310531927301565, 'batch_size': 2295, 'optimizer': 'Adam'}.
2026-05-24 11:07:36,121 - experiment_functions - INFO - Early stopping at epoch 850. Best Metrics: (0.00549024488102164, 0.004445364238410596, 0.0055656251496054385)
2026-05-24 11:07:36,218 - optuna.study.study - INFO - Trial 35 finished with values: [0.00549024488102164, 0.004445364238410596, 0.0055656251496054385] and parameters: {'n_layers': 3, 'embedding_dim': 96, 'lr': 0.04988231450530844, 'lambda_val': 0.00021158087063845118, 'batch_size': 4008, 'optimizer': 'SGD'}.
2026-05-24 11:08:21,129 - optuna.study.study - INFO - Trial 36 finished with values: [0.05283632505531527, 0.031837748344370864, 0.04681387831765005] and parameters: {'n_layers': 2, 'embedding_dim': 96, 'lr': 0.00022526957918178337, 'lambda_val': 0.00014886396884558603, 'batch_size': 553, 'optimizer': 'RMSprop'}.
2026-05-24 11:08:29,597 - experiment_functions - INFO - Early stopping at epoch 650. Best Metrics: (0.0054797523625663225, 0.00447019867549669, 0.005559365295564258)
2026-05-24 11:08:29,687 - optuna.study.study - INFO - Trial 37 finished with values: [0.0054797523625663225, 0.00447019867549669, 0.005559365295564258] and parameters: {'n_layers': 3, 'embedding_dim': 128, 'lr': 1.3774652718861811e-05, 'lambda_val': 1.1822165425616537e-05, 'batch_size': 616, 'optimizer': 'Adam'}.
2026-05-24 11:08:36,965 - experiment_functions - INFO - Early stopping at epoch 550. Best Metrics: (0.025264458535893774, 0.0185182119205298, 0.023693500580658198)
2026-05-24 11:08:37,062 - optuna.study.study - INFO - Trial 38 finished with values: [0.025264458535893774, 0.0185182119205298, 0.023693500580658198] and parameters: {'n_layers': 4, 'embedding_dim': 64, 'lr': 0.0008807726550232883, 'lambda_val': 3.075785895847098e-05, 'batch_size': 2452, 'optimizer': 'RMSprop'}.
2026-05-24 11:09:05,330 - experiment_functions - INFO - Early stopping at epoch 2650. Best Metrics: (0.02997543915486606, 0.022284768211920533, 0.029785246068901913)
2026-05-24 11:09:05,928 - optuna.study.study - INFO - Trial 39 finished with values: [0.02997543915486606, 0.022284768211920533, 0.029785246068901913] and parameters: {'n_layers': 1, 'embedding_dim': 96, 'lr': 0.008927561661664776, 'lambda_val': 0.005696225579131193, 'batch_size': 1961, 'optimizer': 'RMSprop'}.
2026-05-24 11:09:47,158 - optuna.study.study - INFO - Trial 40 finished with values: [0.007275066744580658, 0.005604304635761589, 0.007391043819612871] and parameters: {'n_layers': 1, 'embedding_dim': 128, 'lr': 8.221381758917677e-05, 'lambda_val': 2.1681030987566817e-06, 'batch_size': 2673, 'optimizer': 'RMSprop'}.
2026-05-24 11:09:54,205 - experiment_functions - INFO - Early stopping at epoch 500. Best Metrics: (0.005336928873445484, 0.004039735099337748, 0.0053552976761438754)
2026-05-24 11:09:54,285 - optuna.study.study - INFO - Trial 41 finished with values: [0.005336928873445484, 0.004039735099337748, 0.0053552976761438754] and parameters: {'n_layers': 4, 'embedding_dim': 96, 'lr': 2.7055370467122505e-05, 'lambda_val': 4.153122801185327e-06, 'batch_size': 3542, 'optimizer': 'SGD'}.
2026-05-24 11:10:02,100 - experiment_functions - INFO - Early stopping at epoch 650. Best Metrics: (0.01794947675330845, 0.015612582781456956, 0.018885822477030068)
2026-05-24 11:10:02,195 - optuna.study.study - INFO - Trial 42 finished with values: [0.01794947675330845, 0.015612582781456956, 0.018885822477030068] and parameters: {'n_layers': 3, 'embedding_dim': 32, 'lr': 0.0022154414176574814, 'lambda_val': 0.09361555180015145, 'batch_size': 3429, 'optimizer': 'Adam'}.
2026-05-24 11:10:09,121 - experiment_functions - INFO - Early stopping at epoch 500. Best Metrics: (0.004242285761977734, 0.003741721854304636, 0.004566907332712885)
2026-05-24 11:10:09,212 - optuna.study.study - INFO - Trial 43 finished with values: [0.004242285761977734, 0.003741721854304636, 0.004566907332712885] and parameters: {'n_layers': 4, 'embedding_dim': 96, 'lr': 1.538425941174166e-05, 'lambda_val': 7.325990990797018e-06, 'batch_size': 1036, 'optimizer': 'SGD'}.
2026-05-24 11:10:15,805 - experiment_functions - INFO - Early stopping at epoch 500. Best Metrics: (0.005362265382765133, 0.00423841059602649, 0.005538714808138681)
2026-05-24 11:10:16,605 - optuna.study.study - INFO - Trial 44 finished with values: [0.005362265382765133, 0.00423841059602649, 0.005538714808138681] and parameters: {'n_layers': 4, 'embedding_dim': 64, 'lr': 4.997917667678734e-05, 'lambda_val': 0.008083148293037532, 'batch_size': 2199, 'optimizer': 'Adam'}.
2026-05-24 11:10:22,579 - experiment_functions - INFO - Early stopping at epoch 500. Best Metrics: (0.006142116979989835, 0.0045033112582781466, 0.006060953680943961)
2026-05-24 11:10:23,499 - optuna.study.study - INFO - Trial 45 finished with values: [0.006142116979989835, 0.0045033112582781466, 0.006060953680943961] and parameters: {'n_layers': 1, 'embedding_dim': 64, 'lr': 0.018885019007018673, 'lambda_val': 0.00010721489783167708, 'batch_size': 3689, 'optimizer': 'SGD'}.
2026-05-24 11:10:29,344 - experiment_functions - INFO - Early stopping at epoch 500. Best Metrics: (0.004784859053191366, 0.003965231788079471, 0.005057257344810197)
2026-05-24 11:10:29,887 - optuna.study.study - INFO - Trial 46 finished with values: [0.004784859053191366, 0.003965231788079471, 0.005057257344810197] and parameters: {'n_layers': 2, 'embedding_dim': 32, 'lr': 0.04482740072907398, 'lambda_val': 0.027870413703954457, 'batch_size': 820, 'optimizer': 'SGD'}.
2026-05-24 11:10:35,701 - experiment_functions - INFO - Early stopping at epoch 500. Best Metrics: (0.004884505660962978, 0.00408112582781457, 0.005205603786009421)
2026-05-24 11:10:36,194 - optuna.study.study - INFO - Trial 47 finished with values: [0.004884505660962978, 0.00408112582781457, 0.005205603786009421] and parameters: {'n_layers': 3, 'embedding_dim': 32, 'lr': 5.89663113631331e-05, 'lambda_val': 0.09543193313632686, 'batch_size': 1520, 'optimizer': 'Adam'}.
2026-05-24 11:10:42,748 - experiment_functions - INFO - Early stopping at epoch 500. Best Metrics: (0.005210226730009117, 0.004288079470198675, 0.005473178933199158)
2026-05-24 11:10:42,935 - optuna.study.study - INFO - Trial 48 finished with values: [0.005210226730009117, 0.004288079470198675, 0.005473178933199158] and parameters: {'n_layers': 4, 'embedding_dim': 64, 'lr': 1.072049541271781e-05, 'lambda_val': 0.0002735140037837386, 'batch_size': 1292, 'optimizer': 'SGD'}.
2026-05-24 11:10:52,328 - experiment_functions - INFO - Early stopping at epoch 500. Best Metrics: (0.005523894090787919, 0.004180463576158941, 0.005453449152830751)
2026-05-24 11:10:52,408 - optuna.study.study - INFO - Trial 49 finished with values: [0.005523894090787919, 0.004180463576158941, 0.005453449152830751] and parameters: {'n_layers': 4, 'embedding_dim': 256, 'lr': 0.00012051329161914554, 'lambda_val': 0.02755901911795409, 'batch_size': 1076, 'optimizer': 'SGD'}.
2026-05-24 11:11:04,841 - experiment_functions - INFO - Early stopping at epoch 500. Best Metrics: (0.004745336296397384, 0.004114238410596027, 0.005016494232614523)
2026-05-24 11:11:05,775 - optuna.study.study - INFO - Trial 50 finished with values: [0.004745336296397384, 0.004114238410596027, 0.005016494232614523] and parameters: {'n_layers': 4, 'embedding_dim': 256, 'lr': 0.005599714812976614, 'lambda_val': 0.02755901911795409, 'batch_size': 2452, 'optimizer': 'SGD'}.
2026-05-24 11:11:26,391 - experiment_functions - INFO - Early stopping at epoch 1950. Best Metrics: (0.018439393171934722, 0.015513245033112586, 0.020018081847411166)
2026-05-24 11:11:26,954 - optuna.study.study - INFO - Trial 51 finished with values: [0.018439393171934722, 0.015513245033112586, 0.020018081847411166] and parameters: {'n_layers': 1, 'embedding_dim': 128, 'lr': 0.09649987489792845, 'lambda_val': 0.0199181156306536, 'batch_size': 1238, 'optimizer': 'RMSprop'}.
2026-05-24 11:11:34,640 - experiment_functions - INFO - Early stopping at epoch 600. Best Metrics: (0.005247431769973584, 0.004114238410596027, 0.005285207929259952)
2026-05-24 11:11:34,744 - optuna.study.study - INFO - Trial 52 finished with values: [0.005247431769973584, 0.004114238410596027, 0.005285207929259952] and parameters: {'n_layers': 3, 'embedding_dim': 96, 'lr': 0.015874553334644437, 'lambda_val': 0.00021158087063845118, 'batch_size': 1859, 'optimizer': 'SGD'}.
2026-05-24 11:11:42,093 - experiment_functions - INFO - Early stopping at epoch 500. Best Metrics: (0.005589481448267858, 0.004205298013245033, 0.0055440154468026324)
2026-05-24 11:11:42,187 - optuna.study.study - INFO - Trial 53 finished with values: [0.005589481448267858, 0.004205298013245033, 0.0055440154468026324] and parameters: {'n_layers': 4, 'embedding_dim': 128, 'lr': 1.1055384105413037e-05, 'lambda_val': 0.018879263201751168, 'batch_size': 1557, 'optimizer': 'Adam'}.
2026-05-24 11:11:49,284 - experiment_functions - INFO - Early stopping at epoch 550. Best Metrics: (0.008912447627952232, 0.008725165562913908, 0.010293273429909032)
2026-05-24 11:11:49,374 - optuna.study.study - INFO - Trial 54 finished with values: [0.008912447627952232, 0.008725165562913908, 0.010293273429909032] and parameters: {'n_layers': 4, 'embedding_dim': 64, 'lr': 0.007734430860530913, 'lambda_val': 0.01723991176853604, 'batch_size': 1036, 'optimizer': 'Adam'}.
2026-05-24 11:11:54,988 - experiment_functions - INFO - Early stopping at epoch 500. Best Metrics: (0.005270538035901142, 0.00429635761589404, 0.005294256130638941)
2026-05-24 11:11:55,383 - optuna.study.study - INFO - Trial 55 finished with values: [0.005270538035901142, 0.00429635761589404, 0.005294256130638941] and parameters: {'n_layers': 1, 'embedding_dim': 32, 'lr': 2.5994299694258643e-05, 'lambda_val': 0.0018912353521433405, 'batch_size': 3460, 'optimizer': 'SGD'}.
2026-05-24 11:12:02,584 - experiment_functions - INFO - Early stopping at epoch 550. Best Metrics: (0.04831096725890203, 0.030389072847682122, 0.043568470855555284)
2026-05-24 11:12:02,743 - optuna.study.study - INFO - Trial 56 finished with values: [0.04831096725890203, 0.030389072847682122, 0.043568470855555284] and parameters: {'n_layers': 1, 'embedding_dim': 128, 'lr': 0.002147597357064978, 'lambda_val': 0.0001303671050452136, 'batch_size': 2361, 'optimizer': 'RMSprop'}.
2026-05-24 11:12:12,634 - experiment_functions - INFO - Early stopping at epoch 800. Best Metrics: (0.004974601908467098, 0.0040149006622516555, 0.005059886629358757)
2026-05-24 11:12:13,612 - optuna.study.study - INFO - Trial 57 finished with values: [0.004974601908467098, 0.0040149006622516555, 0.005059886629358757] and parameters: {'n_layers': 3, 'embedding_dim': 96, 'lr': 0.03294840052282247, 'lambda_val': 0.007487133552229504, 'batch_size': 2557, 'optimizer': 'SGD'}.
2026-05-24 11:12:20,651 - experiment_functions - INFO - Early stopping at epoch 500. Best Metrics: (0.005910126447121517, 0.004461920529801325, 0.005558273722037892)
2026-05-24 11:12:21,152 - optuna.study.study - INFO - Trial 58 finished with values: [0.005910126447121517, 0.004461920529801325, 0.005558273722037892] and parameters: {'n_layers': 4, 'embedding_dim': 96, 'lr': 0.04988231450530844, 'lambda_val': 0.0002735140037837386, 'batch_size': 4008, 'optimizer': 'SGD'}.
2026-05-24 11:12:50,732 - experiment_functions - INFO - Early stopping at epoch 3100. Best Metrics: (0.005512808207149472, 0.0045033112582781466, 0.005596764986880406)
2026-05-24 11:12:50,821 - optuna.study.study - INFO - Trial 59 finished with values: [0.005512808207149472, 0.0045033112582781466, 0.005596764986880406] and parameters: {'n_layers': 1, 'embedding_dim': 64, 'lr': 4.997917667678734e-05, 'lambda_val': 4.209354474043191e-05, 'batch_size': 2199, 'optimizer': 'Adam'}.
2026-05-24 11:12:57,221 - experiment_functions - INFO - Early stopping at epoch 500. Best Metrics: (0.0049223689633934465, 0.004246688741721854, 0.005209305431391279)
2026-05-24 11:12:57,466 - optuna.study.study - INFO - Trial 60 finished with values: [0.0049223689633934465, 0.004246688741721854, 0.005209305431391279] and parameters: {'n_layers': 2, 'embedding_dim': 96, 'lr': 0.004798378321965959, 'lambda_val': 0.0034451532245627563, 'batch_size': 3332, 'optimizer': 'SGD'}.
2026-05-24 11:13:03,114 - experiment_functions - INFO - Early stopping at epoch 500. Best Metrics: (0.005066575754968302, 0.004362582781456954, 0.00536814726710692)
2026-05-24 11:13:03,729 - optuna.study.study - INFO - Trial 61 finished with values: [0.005066575754968302, 0.004362582781456954, 0.00536814726710692] and parameters: {'n_layers': 1, 'embedding_dim': 32, 'lr': 0.00015466190738157504, 'lambda_val': 0.007434349875467746, 'batch_size': 704, 'optimizer': 'Adam'}.
2026-05-24 11:13:10,836 - experiment_functions - INFO - Early stopping at epoch 550. Best Metrics: (0.023151754980902703, 0.018824503311258282, 0.022328523324143677)
2026-05-24 11:13:10,926 - optuna.study.study - INFO - Trial 62 finished with values: [0.023151754980902703, 0.018824503311258282, 0.022328523324143677] and parameters: {'n_layers': 2, 'embedding_dim': 64, 'lr': 0.007734430860530913, 'lambda_val': 0.00013181376661387483, 'batch_size': 3332, 'optimizer': 'Adam'}.
2026-05-24 11:13:16,783 - experiment_functions - INFO - Early stopping at epoch 500. Best Metrics: (0.005338568433314582, 0.004437086092715233, 0.005506308152096985)
2026-05-24 11:13:17,468 - optuna.study.study - INFO - Trial 63 finished with values: [0.005338568433314582, 0.004437086092715233, 0.005506308152096985] and parameters: {'n_layers': 1, 'embedding_dim': 64, 'lr': 0.018885019007018673, 'lambda_val': 0.00010721489783167708, 'batch_size': 1013, 'optimizer': 'SGD'}.
2026-05-24 11:13:26,763 - experiment_functions - INFO - Early stopping at epoch 700. Best Metrics: (0.028756076246133914, 0.020596026490066227, 0.02811652280384664)
2026-05-24 11:13:27,161 - optuna.study.study - INFO - Trial 64 finished with values: [0.028756076246133914, 0.020596026490066227, 0.02811652280384664] and parameters: {'n_layers': 3, 'embedding_dim': 96, 'lr': 0.0005493990269458161, 'lambda_val': 0.005696225579131193, 'batch_size': 3906, 'optimizer': 'Adam'}.
2026-05-24 11:14:16,432 - optuna.study.study - INFO - Trial 65 finished with values: [0.005343275432451044, 0.004403973509933775, 0.005351335451162137] and parameters: {'n_layers': 4, 'embedding_dim': 96, 'lr': 1.5283251454570842e-05, 'lambda_val': 0.0001303671050452136, 'batch_size': 2557, 'optimizer': 'RMSprop'}.
2026-05-24 11:14:24,841 - experiment_functions - INFO - Early stopping at epoch 550. Best Metrics: (0.012495022560787213, 0.009147350993377483, 0.012042177986215862)
2026-05-24 11:14:24,930 - optuna.study.study - INFO - Trial 66 finished with values: [0.012495022560787213, 0.009147350993377483, 0.012042177986215862] and parameters: {'n_layers': 2, 'embedding_dim': 256, 'lr': 0.08286245740077018, 'lambda_val': 6.229045175154034e-06, 'batch_size': 2551, 'optimizer': 'Adam'}.
2026-05-24 11:14:35,809 - experiment_functions - INFO - Early stopping at epoch 650. Best Metrics: (0.033670835229822484, 0.02330298013245033, 0.03128104039603738)
2026-05-24 11:14:36,916 - optuna.study.study - INFO - Trial 67 finished with values: [0.033670835229822484, 0.02330298013245033, 0.03128104039603738] and parameters: {'n_layers': 3, 'embedding_dim': 256, 'lr': 0.0004379727673244972, 'lambda_val': 2.666704909740151e-06, 'batch_size': 2447, 'optimizer': 'RMSprop'}.
2026-05-24 11:14:43,761 - experiment_functions - INFO - Early stopping at epoch 500. Best Metrics: (0.00564814463680572, 0.004329470198675496, 0.00545048931442913)
2026-05-24 11:14:43,843 - optuna.study.study - INFO - Trial 68 finished with values: [0.00564814463680572, 0.004329470198675496, 0.00545048931442913] and parameters: {'n_layers': 1, 'embedding_dim': 256, 'lr': 0.00039947370498239144, 'lambda_val': 0.010742243956363326, 'batch_size': 553, 'optimizer': 'SGD'}.
2026-05-24 11:14:50,350 - experiment_functions - INFO - Early stopping at epoch 500. Best Metrics: (0.005100443588917608, 0.004403973509933775, 0.005305319620066887)
2026-05-24 11:14:50,573 - optuna.study.study - INFO - Trial 69 finished with values: [0.005100443588917608, 0.004403973509933775, 0.005305319620066887] and parameters: {'n_layers': 2, 'embedding_dim': 128, 'lr': 3.071436696133652e-05, 'lambda_val': 4.1936709800113786e-06, 'batch_size': 2295, 'optimizer': 'SGD'}.
2026-05-24 11:15:00,221 - experiment_functions - INFO - Early stopping at epoch 650. Best Metrics: (0.03277316919589568, 0.023054635761589403, 0.0310830861860678)
2026-05-24 11:15:00,857 - optuna.study.study - INFO - Trial 70 finished with values: [0.03277316919589568, 0.023054635761589403, 0.0310830861860678] and parameters: {'n_layers': 4, 'embedding_dim': 128, 'lr': 0.0005910069120800205, 'lambda_val': 7.481780308257389e-06, 'batch_size': 775, 'optimizer': 'RMSprop'}.
2026-05-24 11:15:09,584 - experiment_functions - INFO - Early stopping at epoch 500. Best Metrics: (0.0056042709768830915, 0.004577814569536424, 0.005851376565382617)
2026-05-24 11:15:09,974 - optuna.study.study - INFO - Trial 71 finished with values: [0.0056042709768830915, 0.004577814569536424, 0.005851376565382617] and parameters: {'n_layers': 4, 'embedding_dim': 256, 'lr': 0.00020967418703668258, 'lambda_val': 4.598956818766828e-05, 'batch_size': 1297, 'optimizer': 'SGD'}.
2026-05-24 11:15:55,649 - optuna.study.study - INFO - Trial 72 finished with values: [0.023518331339059357, 0.01695364238410596, 0.022767869760432376] and parameters: {'n_layers': 2, 'embedding_dim': 128, 'lr': 8.06262571124266e-05, 'lambda_val': 0.0001303671050452136, 'batch_size': 3482, 'optimizer': 'RMSprop'}.
2026-05-24 11:16:16,229 - experiment_functions - INFO - Early stopping at epoch 1900. Best Metrics: (0.005341367931631147, 0.004321192052980133, 0.005442175687115524)
2026-05-24 11:16:16,323 - optuna.study.study - INFO - Trial 73 finished with values: [0.005341367931631147, 0.004321192052980133, 0.005442175687115524] and parameters: {'n_layers': 2, 'embedding_dim': 96, 'lr': 1.3774652718861811e-05, 'lambda_val': 1.1822165425616537e-05, 'batch_size': 616, 'optimizer': 'Adam'}.
2026-05-24 11:16:22,885 - experiment_functions - INFO - Early stopping at epoch 500. Best Metrics: (0.0054073366491380545, 0.004230132450331127, 0.005390865744601843)
