2026-05-24 11:31:32,643 - optuna.study.study - INFO - Trial 122 finished with values: [0.02411831353816866, 0.016887417218543047, 0.022829359322862706] and parameters: {'n_layers': 2, 'embedding_dim': 96, 'lr': 0.03357202284005557, 'lambda_val': 0.0018912353521433405, 'batch_size': 3400, 'optimizer': 'RMSprop'}.
2026-05-24 11:31:41,646 - experiment_functions - INFO - Early stopping at epoch 650. Best Metrics: (0.005981413947410385, 0.004403973509933775, 0.005754023121135915)
2026-05-24 11:31:42,512 - optuna.study.study - INFO - Trial 123 finished with values: [0.005981413947410385, 0.004403973509933775, 0.005754023121135915] and parameters: {'n_layers': 4, 'embedding_dim': 96, 'lr': 0.04988231450530844, 'lambda_val': 0.0002735140037837386, 'batch_size': 3846, 'optimizer': 'SGD'}.
2026-05-24 11:32:29,560 - optuna.study.study - INFO - Trial 124 finished with values: [0.043519763634152706, 0.027673841059602647, 0.04002282981181027] and parameters: {'n_layers': 3, 'embedding_dim': 32, 'lr': 0.00018773198932182955, 'lambda_val': 0.01130665088103249, 'batch_size': 1297, 'optimizer': 'Adam'}.
2026-05-24 11:32:37,703 - experiment_functions - INFO - Early stopping at epoch 550. Best Metrics: (0.0165207754520062, 0.011026490066225164, 0.015305939620009514)
2026-05-24 11:32:37,807 - optuna.study.study - INFO - Trial 125 finished with values: [0.0165207754520062, 0.011026490066225164, 0.015305939620009514] and parameters: {'n_layers': 2, 'embedding_dim': 256, 'lr': 0.05436868082923806, 'lambda_val': 8.911285735615227e-05, 'batch_size': 3219, 'optimizer': 'Adam'}.
2026-05-24 11:32:45,012 - experiment_functions - INFO - Early stopping at epoch 550. Best Metrics: (0.04279899201897277, 0.02878311258278146, 0.03779590114004786)
2026-05-24 11:32:45,099 - optuna.study.study - INFO - Trial 126 finished with values: [0.04279899201897277, 0.02878311258278146, 0.03779590114004786] and parameters: {'n_layers': 1, 'embedding_dim': 32, 'lr': 0.002147597357064978, 'lambda_val': 0.0199181156306536, 'batch_size': 3482, 'optimizer': 'RMSprop'}.
2026-05-24 11:33:30,823 - optuna.study.study - INFO - Trial 127 finished with values: [0.03734032894001738, 0.02466887417218543, 0.03511174072932623] and parameters: {'n_layers': 2, 'embedding_dim': 32, 'lr': 0.00018773198932182955, 'lambda_val': 6.229045175154034e-06, 'batch_size': 1246, 'optimizer': 'RMSprop'}.
2026-05-24 11:33:38,192 - experiment_functions - INFO - Early stopping at epoch 550. Best Metrics: (0.013932452263879432, 0.011142384105960267, 0.014548701880264163)
2026-05-24 11:33:38,285 - optuna.study.study - INFO - Trial 128 finished with values: [0.013932452263879432, 0.011142384105960267, 0.014548701880264163] and parameters: {'n_layers': 4, 'embedding_dim': 32, 'lr': 0.008845891118614167, 'lambda_val': 0.00021158087063845118, 'batch_size': 775, 'optimizer': 'RMSprop'}.
2026-05-24 11:33:45,787 - experiment_functions - INFO - Early stopping at epoch 550. Best Metrics: (0.027200809148615248, 0.020008278145695363, 0.025229690711661572)
2026-05-24 11:33:46,374 - optuna.study.study - INFO - Trial 129 finished with values: [0.027200809148615248, 0.020008278145695363, 0.025229690711661572] and parameters: {'n_layers': 2, 'embedding_dim': 64, 'lr': 0.007734430860530913, 'lambda_val': 4.1936709800113786e-06, 'batch_size': 4051, 'optimizer': 'Adam'}.
2026-05-24 11:33:56,193 - experiment_functions - INFO - Early stopping at epoch 550. Best Metrics: (0.014118055980951975, 0.012822847682119205, 0.016101824851352167)
2026-05-24 11:33:56,440 - optuna.study.study - INFO - Trial 130 finished with values: [0.014118055980951975, 0.012822847682119205, 0.016101824851352167] and parameters: {'n_layers': 4, 'embedding_dim': 256, 'lr': 0.0050448109347620345, 'lambda_val': 8.876623948407677e-06, 'batch_size': 1297, 'optimizer': 'Adam'}.
2026-05-24 11:34:05,438 - experiment_functions - INFO - Early stopping at epoch 600. Best Metrics: (0.03542982197959623, 0.023319536423841065, 0.03174894603255353)
2026-05-24 11:34:06,207 - optuna.study.study - INFO - Trial 131 finished with values: [0.03542982197959623, 0.023319536423841065, 0.03174894603255353] and parameters: {'n_layers': 4, 'embedding_dim': 128, 'lr': 0.0005910069120800205, 'lambda_val': 0.0018912353521433405, 'batch_size': 944, 'optimizer': 'RMSprop'}.
2026-05-24 11:34:35,793 - experiment_functions - INFO - Early stopping at epoch 1800. Best Metrics: (0.030026807555755142, 0.021903973509933776, 0.02825922530668964)
2026-05-24 11:34:35,882 - optuna.study.study - INFO - Trial 132 finished with values: [0.030026807555755142, 0.021903973509933776, 0.02825922530668964] and parameters: {'n_layers': 4, 'embedding_dim': 256, 'lr': 0.00017275961945919233, 'lambda_val': 0.01723991176853604, 'batch_size': 746, 'optimizer': 'Adam'}.
2026-05-24 11:34:45,584 - experiment_functions - INFO - Early stopping at epoch 700. Best Metrics: (0.0326386245188541, 0.022723509933774835, 0.029553900110427377)
2026-05-24 11:34:45,729 - optuna.study.study - INFO - Trial 133 finished with values: [0.0326386245188541, 0.022723509933774835, 0.029553900110427377] and parameters: {'n_layers': 4, 'embedding_dim': 64, 'lr': 0.0005910069120800205, 'lambda_val': 3.075785895847098e-05, 'batch_size': 1299, 'optimizer': 'RMSprop'}.
2026-05-24 11:34:53,181 - experiment_functions - INFO - Early stopping at epoch 550. Best Metrics: (0.050486220743249266, 0.030811258278145695, 0.0454712837010882)
2026-05-24 11:34:53,275 - optuna.study.study - INFO - Trial 134 finished with values: [0.050486220743249266, 0.030811258278145695, 0.0454712837010882] and parameters: {'n_layers': 1, 'embedding_dim': 128, 'lr': 0.002147597357064978, 'lambda_val': 0.0001303671050452136, 'batch_size': 2188, 'optimizer': 'RMSprop'}.
2026-05-24 11:35:00,565 - experiment_functions - INFO - Early stopping at epoch 550. Best Metrics: (0.047358360875540406, 0.030380794701986756, 0.04373919984703562)
2026-05-24 11:35:00,676 - optuna.study.study - INFO - Trial 135 finished with values: [0.047358360875540406, 0.030380794701986756, 0.04373919984703562] and parameters: {'n_layers': 1, 'embedding_dim': 128, 'lr': 0.002147597357064978, 'lambda_val': 0.005696225579131193, 'batch_size': 1961, 'optimizer': 'RMSprop'}.
2026-05-24 11:35:09,278 - experiment_functions - INFO - Early stopping at epoch 550. Best Metrics: (0.048510995631303455, 0.030364238410596024, 0.04214732423478061)
2026-05-24 11:35:09,378 - optuna.study.study - INFO - Trial 136 finished with values: [0.048510995631303455, 0.030364238410596024, 0.04214732423478061] and parameters: {'n_layers': 2, 'embedding_dim': 256, 'lr': 0.004627149516425897, 'lambda_val': 6.229045175154034e-06, 'batch_size': 2105, 'optimizer': 'Adam'}.
2026-05-24 11:36:00,938 - optuna.study.study - INFO - Trial 137 finished with values: [0.006496451194712884, 0.005223509933774834, 0.006961517996285452] and parameters: {'n_layers': 2, 'embedding_dim': 256, 'lr': 4.900135250550837e-05, 'lambda_val': 0.00024416758921277655, 'batch_size': 1668, 'optimizer': 'RMSprop'}.
2026-05-24 11:36:11,139 - experiment_functions - INFO - Early stopping at epoch 700. Best Metrics: (0.042373654977355284, 0.027657284768211922, 0.03791523005878109)
2026-05-24 11:36:11,585 - optuna.study.study - INFO - Trial 138 finished with values: [0.042373654977355284, 0.027657284768211922, 0.03791523005878109] and parameters: {'n_layers': 3, 'embedding_dim': 128, 'lr': 0.0005493990269458161, 'lambda_val': 7.481780308257389e-06, 'batch_size': 775, 'optimizer': 'RMSprop'}.
2026-05-24 11:36:19,509 - experiment_functions - INFO - Early stopping at epoch 550. Best Metrics: (0.03564818826402871, 0.025289735099337747, 0.03360600149285888)
2026-05-24 11:36:19,595 - optuna.study.study - INFO - Trial 139 finished with values: [0.03564818826402871, 0.025289735099337747, 0.03360600149285888] and parameters: {'n_layers': 1, 'embedding_dim': 256, 'lr': 0.002147597357064978, 'lambda_val': 0.005696225579131193, 'batch_size': 1961, 'optimizer': 'RMSprop'}.
2026-05-24 11:36:58,405 - experiment_functions - INFO - Early stopping at epoch 3300. Best Metrics: (0.006182795507352436, 0.004577814569536424, 0.006124199102583413)
2026-05-24 11:36:58,495 - optuna.study.study - INFO - Trial 140 finished with values: [0.006182795507352436, 0.004577814569536424, 0.006124199102583413] and parameters: {'n_layers': 3, 'embedding_dim': 96, 'lr': 2.9950472931288183e-05, 'lambda_val': 4.598956818766828e-05, 'batch_size': 944, 'optimizer': 'Adam'}.
2026-05-24 11:37:05,984 - experiment_functions - INFO - Early stopping at epoch 550. Best Metrics: (0.03806986944424786, 0.026092715231788077, 0.0349122140454105)
2026-05-24 11:37:06,118 - optuna.study.study - INFO - Trial 141 finished with values: [0.03806986944424786, 0.026092715231788077, 0.0349122140454105] and parameters: {'n_layers': 1, 'embedding_dim': 128, 'lr': 0.002147597357064978, 'lambda_val': 0.0035441273991472224, 'batch_size': 3482, 'optimizer': 'RMSprop'}.
2026-05-24 11:37:14,223 - experiment_functions - INFO - Early stopping at epoch 600. Best Metrics: (0.050127927873953954, 0.030927152317880797, 0.04296121310231232)
2026-05-24 11:37:14,321 - optuna.study.study - INFO - Trial 142 finished with values: [0.050127927873953954, 0.030927152317880797, 0.04296121310231232] and parameters: {'n_layers': 1, 'embedding_dim': 96, 'lr': 0.002147597357064978, 'lambda_val': 0.0001303671050452136, 'batch_size': 553, 'optimizer': 'RMSprop'}.
2026-05-24 11:37:38,644 - experiment_functions - INFO - Early stopping at epoch 1950. Best Metrics: (0.029330155761337278, 0.018087748344370862, 0.026327878113897706)
2026-05-24 11:37:39,103 - optuna.study.study - INFO - Trial 143 finished with values: [0.029330155761337278, 0.018087748344370862, 0.026327878113897706] and parameters: {'n_layers': 2, 'embedding_dim': 128, 'lr': 0.008845891118614167, 'lambda_val': 0.001023536186227154, 'batch_size': 1246, 'optimizer': 'RMSprop'}.
2026-05-24 11:37:45,285 - experiment_functions - INFO - Early stopping at epoch 500. Best Metrics: (0.004937719971018476, 0.004114238410596027, 0.004887322223842872)
2026-05-24 11:37:46,153 - optuna.study.study - INFO - Trial 144 finished with values: [0.004937719971018476, 0.004114238410596027, 0.004887322223842872] and parameters: {'n_layers': 1, 'embedding_dim': 64, 'lr': 0.00018773198932182955, 'lambda_val': 0.00010721489783167708, 'batch_size': 1246, 'optimizer': 'SGD'}.
2026-05-24 11:37:53,907 - experiment_functions - INFO - Early stopping at epoch 550. Best Metrics: (0.011608633957305197, 0.009619205298013246, 0.012931885484399863)
2026-05-24 11:37:53,986 - optuna.study.study - INFO - Trial 145 finished with values: [0.011608633957305197, 0.009619205298013246, 0.012931885484399863] and parameters: {'n_layers': 4, 'embedding_dim': 64, 'lr': 0.005572405346022546, 'lambda_val': 8.876623948407677e-06, 'batch_size': 775, 'optimizer': 'RMSprop'}.
2026-05-24 11:38:06,251 - experiment_functions - INFO - Early stopping at epoch 750. Best Metrics: (0.03782080162423665, 0.02552980132450331, 0.03603882214410425)
2026-05-24 11:38:06,382 - optuna.study.study - INFO - Trial 146 finished with values: [0.03782080162423665, 0.02552980132450331, 0.03603882214410425] and parameters: {'n_layers': 3, 'embedding_dim': 256, 'lr': 0.0004379727673244972, 'lambda_val': 3.075785895847098e-05, 'batch_size': 2551, 'optimizer': 'Adam'}.
2026-05-24 11:38:13,952 - experiment_functions - INFO - Early stopping at epoch 500. Best Metrics: (0.005205204878050607, 0.004387417218543047, 0.0054725000037759135)
2026-05-24 11:38:14,403 - optuna.study.study - INFO - Trial 147 finished with values: [0.005205204878050607, 0.004387417218543047, 0.0054725000037759135] and parameters: {'n_layers': 2, 'embedding_dim': 256, 'lr': 0.0005493990269458161, 'lambda_val': 4.409124825621956e-05, 'batch_size': 2361, 'optimizer': 'SGD'}.
2026-05-24 11:38:20,979 - experiment_functions - INFO - Early stopping at epoch 500. Best Metrics: (0.006215637352098652, 0.004751655629139073, 0.005977285387048703)
2026-05-24 11:38:21,916 - optuna.study.study - INFO - Trial 148 finished with values: [0.006215637352098652, 0.004751655629139073, 0.005977285387048703] and parameters: {'n_layers': 2, 'embedding_dim': 64, 'lr': 0.0008807726550232883, 'lambda_val': 2.575235400225274e-06, 'batch_size': 2452, 'optimizer': 'SGD'}.
2026-05-24 11:39:11,364 - optuna.study.study - INFO - Trial 149 finished with values: [0.029886204331764765, 0.02048841059602649, 0.028706420586579615] and parameters: {'n_layers': 2, 'embedding_dim': 128, 'lr': 9.72729409185319e-05, 'lambda_val': 4.598956818766828e-05, 'batch_size': 3332, 'optimizer': 'Adam'}.
2026-05-24 11:39:22,216 - experiment_functions - INFO - Early stopping at epoch 650. Best Metrics: (0.03245030841945614, 0.023360927152317884, 0.03146756872198802)
2026-05-24 11:39:22,852 - optuna.study.study - INFO - Trial 150 finished with values: [0.03245030841945614, 0.023360927152317884, 0.03146756872198802] and parameters: {'n_layers': 3, 'embedding_dim': 256, 'lr': 0.0004379727673244972, 'lambda_val': 3.075785895847098e-05, 'batch_size': 2551, 'optimizer': 'RMSprop'}.
2026-05-24 11:39:29,541 - experiment_functions - INFO - Early stopping at epoch 500. Best Metrics: (0.005066876335554529, 0.004263245033112583, 0.005389966393578157)
2026-05-24 11:39:29,626 - optuna.study.study - INFO - Trial 151 finished with values: [0.005066876335554529, 0.004263245033112583, 0.005389966393578157] and parameters: {'n_layers': 4, 'embedding_dim': 96, 'lr': 0.0005910069120800205, 'lambda_val': 8.876623948407677e-06, 'batch_size': 775, 'optimizer': 'SGD'}.
2026-05-24 11:39:36,589 - experiment_functions - INFO - Early stopping at epoch 550. Best Metrics: (0.024013833579468617, 0.017549668874172187, 0.0231244444520886)
2026-05-24 11:39:36,690 - optuna.study.study - INFO - Trial 152 finished with values: [0.024013833579468617, 0.017549668874172187, 0.0231244444520886] and parameters: {'n_layers': 2, 'embedding_dim': 96, 'lr': 0.002147597357064978, 'lambda_val': 0.0001303671050452136, 'batch_size': 582, 'optimizer': 'RMSprop'}.
2026-05-24 11:39:47,816 - experiment_functions - INFO - Early stopping at epoch 650. Best Metrics: (0.03502213273043222, 0.02452814569536424, 0.03306959333303902)
2026-05-24 11:39:48,592 - optuna.study.study - INFO - Trial 153 finished with values: [0.03502213273043222, 0.02452814569536424, 0.03306959333303902] and parameters: {'n_layers': 4, 'embedding_dim': 256, 'lr': 0.0004379727673244972, 'lambda_val': 4.598956818766828e-05, 'batch_size': 944, 'optimizer': 'RMSprop'}.
2026-05-24 11:39:56,875 - experiment_functions - INFO - Early stopping at epoch 650. Best Metrics: (0.05724219647897475, 0.03463576158940397, 0.05101678384873473)
2026-05-24 11:39:56,977 - optuna.study.study - INFO - Trial 154 finished with values: [0.05724219647897475, 0.03463576158940397, 0.05101678384873473] and parameters: {'n_layers': 1, 'embedding_dim': 128, 'lr': 0.002147597357064978, 'lambda_val': 2.666704909740151e-06, 'batch_size': 2361, 'optimizer': 'Adam'}.
2026-05-24 11:40:04,526 - experiment_functions - INFO - Early stopping at epoch 550. Best Metrics: (0.03787945950424055, 0.025918874172185434, 0.03421989729187295)
2026-05-24 11:40:04,660 - optuna.study.study - INFO - Trial 155 finished with values: [0.03787945950424055, 0.025918874172185434, 0.03421989729187295] and parameters: {'n_layers': 1, 'embedding_dim': 256, 'lr': 0.002147597357064978, 'lambda_val': 0.005696225579131193, 'batch_size': 1299, 'optimizer': 'RMSprop'}.
2026-05-24 11:40:12,261 - experiment_functions - INFO - Early stopping at epoch 550. Best Metrics: (0.04776091991038077, 0.030463576158940398, 0.04329008781539625)
2026-05-24 11:40:12,363 - optuna.study.study - INFO - Trial 156 finished with values: [0.04776091991038077, 0.030463576158940398, 0.04329008781539625] and parameters: {'n_layers': 1, 'embedding_dim': 64, 'lr': 0.007734430860530913, 'lambda_val': 0.01723991176853604, 'batch_size': 1036, 'optimizer': 'Adam'}.
2026-05-24 11:40:20,609 - experiment_functions - INFO - Early stopping at epoch 650. Best Metrics: (0.05001928781116612, 0.031763245033112585, 0.04510971546270555)
2026-05-24 11:40:20,686 - optuna.study.study - INFO - Trial 157 finished with values: [0.05001928781116612, 0.031763245033112585, 0.04510971546270555] and parameters: {'n_layers': 2, 'embedding_dim': 128, 'lr': 0.0012566980437762067, 'lambda_val': 0.0018912353521433405, 'batch_size': 2294, 'optimizer': 'Adam'}.
2026-05-24 11:40:34,241 - experiment_functions - INFO - Early stopping at epoch 850. Best Metrics: (0.04775490252065253, 0.029014900662251656, 0.04361657456621591)
2026-05-24 11:40:34,339 - optuna.study.study - INFO - Trial 158 finished with values: [0.04775490252065253, 0.029014900662251656, 0.04361657456621591] and parameters: {'n_layers': 3, 'embedding_dim': 256, 'lr': 0.0004379727673244972, 'lambda_val': 3.075785895847098e-05, 'batch_size': 1116, 'optimizer': 'Adam'}.
2026-05-24 11:40:42,813 - experiment_functions - INFO - Early stopping at epoch 500. Best Metrics: (0.006702657445023492, 0.00615066225165563, 0.007429950724091416)
2026-05-24 11:40:43,795 - optuna.study.study - INFO - Trial 159 finished with values: [0.006702657445023492, 0.00615066225165563, 0.007429950724091416] and parameters: {'n_layers': 4, 'embedding_dim': 256, 'lr': 0.05473515439083082, 'lambda_val': 0.01723991176853604, 'batch_size': 746, 'optimizer': 'Adam'}.
2026-05-24 11:40:55,447 - experiment_functions - INFO - Early stopping at epoch 900. Best Metrics: (0.05538269147781164, 0.03394867549668874, 0.04872618429033169)
2026-05-24 11:40:55,592 - optuna.study.study - INFO - Trial 160 finished with values: [0.05538269147781164, 0.03394867549668874, 0.04872618429033169] and parameters: {'n_layers': 2, 'embedding_dim': 96, 'lr': 0.0005910069120800205, 'lambda_val': 0.004059133939758747, 'batch_size': 1299, 'optimizer': 'Adam'}.
2026-05-24 11:41:02,545 - experiment_functions - INFO - Early stopping at epoch 550. Best Metrics: (0.05092267156821329, 0.031175496688741724, 0.0452771711854692)
2026-05-24 11:41:02,644 - optuna.study.study - INFO - Trial 161 finished with values: [0.05092267156821329, 0.031175496688741724, 0.0452771711854692] and parameters: {'n_layers': 1, 'embedding_dim': 128, 'lr': 0.002147597357064978, 'lambda_val': 3.075785895847098e-05, 'batch_size': 1961, 'optimizer': 'RMSprop'}.
2026-05-24 11:42:00,525 - optuna.study.study - INFO - Trial 162 finished with values: [0.033308862937165895, 0.022301324503311258, 0.030629574617033417] and parameters: {'n_layers': 3, 'embedding_dim': 256, 'lr': 9.72729409185319e-05, 'lambda_val': 4.598956818766828e-05, 'batch_size': 1297, 'optimizer': 'RMSprop'}.
2026-05-24 11:42:21,918 - experiment_functions - INFO - Early stopping at epoch 1300. Best Metrics: (0.04268227221329369, 0.02794701986754967, 0.03898361850613124)
2026-05-24 11:42:22,704 - optuna.study.study - INFO - Trial 163 finished with values: [0.04268227221329369, 0.02794701986754967, 0.03898361850613124] and parameters: {'n_layers': 4, 'embedding_dim': 256, 'lr': 0.00022526957918178337, 'lambda_val': 0.001091542115945467, 'batch_size': 553, 'optimizer': 'Adam'}.
2026-05-24 11:42:29,826 - experiment_functions - INFO - Early stopping at epoch 550. Best Metrics: (0.049896523477578746, 0.031067880794701984, 0.04349661659547642)
2026-05-24 11:42:29,923 - optuna.study.study - INFO - Trial 164 finished with values: [0.049896523477578746, 0.031067880794701984, 0.04349661659547642] and parameters: {'n_layers': 1, 'embedding_dim': 128, 'lr': 0.002147597357064978, 'lambda_val': 0.0001303671050452136, 'batch_size': 2447, 'optimizer': 'RMSprop'}.
2026-05-24 11:42:35,900 - experiment_functions - INFO - Early stopping at epoch 500. Best Metrics: (0.0049643509972902575, 0.003998344370860928, 0.004909072977936193)
2026-05-24 11:42:36,212 - optuna.study.study - INFO - Trial 165 finished with values: [0.0049643509972902575, 0.003998344370860928, 0.004909072977936193] and parameters: {'n_layers': 1, 'embedding_dim': 128, 'lr': 0.0012566980437762067, 'lambda_val': 0.0018912353521433405, 'batch_size': 3482, 'optimizer': 'SGD'}.
2026-05-24 11:42:44,000 - experiment_functions - INFO - Early stopping at epoch 550. Best Metrics: (0.05686939487603895, 0.033973509933774834, 0.049258316540741566)
2026-05-24 11:42:44,432 - optuna.study.study - INFO - Trial 166 finished with values: [0.05686939487603895, 0.033973509933774834, 0.049258316540741566] and parameters: {'n_layers': 1, 'embedding_dim': 256, 'lr': 0.0063358656325518715, 'lambda_val': 0.00024416758921277655, 'batch_size': 2551, 'optimizer': 'Adam'}.
2026-05-24 11:42:51,938 - experiment_functions - INFO - Early stopping at epoch 550. Best Metrics: (0.05110437612327368, 0.03165562913907285, 0.046266031192438474)
2026-05-24 11:42:52,037 - optuna.study.study - INFO - Trial 167 finished with values: [0.05110437612327368, 0.03165562913907285, 0.046266031192438474] and parameters: {'n_layers': 1, 'embedding_dim': 128, 'lr': 0.002147597357064978, 'lambda_val': 0.0001303671050452136, 'batch_size': 3247, 'optimizer': 'RMSprop'}.
2026-05-24 11:43:01,688 - experiment_functions - INFO - Early stopping at epoch 750. Best Metrics: (0.03275253357427244, 0.02255794701986755, 0.030854178000426793)
2026-05-24 11:43:02,722 - optuna.study.study - INFO - Trial 168 finished with values: [0.03275253357427244, 0.02255794701986755, 0.030854178000426793] and parameters: {'n_layers': 3, 'embedding_dim': 64, 'lr': 0.0004379727673244972, 'lambda_val': 7.481780308257389e-06, 'batch_size': 2551, 'optimizer': 'RMSprop'}.
2026-05-24 11:43:23,138 - experiment_functions - INFO - Early stopping at epoch 1950. Best Metrics: (0.024043322482864993, 0.01593543046357616, 0.022136205352861784)
