2026-05-24 17:00:36,073 - optuna.study.study - INFO - Trial 11 finished with values: [0.009471369769176083, 0.007251655629139073, 0.009694945194001166] and parameters: {'n_layers': 2, 'embedding_dim': 256, 'lr': 9.594308885796871e-05, 'lambda_val': 2.1382055794180884e-06, 'batch_size': 586, 'optimizer': 'RMSprop'}.
2026-05-24 17:00:42,566 - experiment_functions - INFO - Early stopping at epoch 500. Best Metrics: (0.0055996382440046165, 0.004403973509933775, 0.005886338756736666)
2026-05-24 17:00:43,136 - optuna.study.study - INFO - Trial 12 finished with values: [0.0055996382440046165, 0.004403973509933775, 0.005886338756736666] and parameters: {'n_layers': 3, 'embedding_dim': 256, 'lr': 9.217719216081555e-05, 'lambda_val': 0.01473312658373961, 'batch_size': 1038, 'optimizer': 'SGD'}.
2026-05-24 17:01:27,757 - optuna.study.study - INFO - Trial 13 finished with values: [0.00831559633811432, 0.006721854304635762, 0.008756822518732913] and parameters: {'n_layers': 4, 'embedding_dim': 128, 'lr': 3.936600232228081e-05, 'lambda_val': 0.002426571205869054, 'batch_size': 3241, 'optimizer': 'Adam'}.
2026-05-24 17:02:09,184 - optuna.study.study - INFO - Trial 14 finished with values: [0.006521121986277584, 0.005231788079470199, 0.006684847966438872] and parameters: {'n_layers': 3, 'embedding_dim': 96, 'lr': 1.8447566912905774e-05, 'lambda_val': 1.3435623194499138e-06, 'batch_size': 3103, 'optimizer': 'RMSprop'}.
2026-05-24 17:02:23,582 - experiment_functions - INFO - Early stopping at epoch 1350. Best Metrics: (0.004869205679191128, 0.0038658940397350997, 0.004952273788586582)
2026-05-24 17:02:23,682 - optuna.study.study - INFO - Trial 15 finished with values: [0.004869205679191128, 0.0038658940397350997, 0.004952273788586582] and parameters: {'n_layers': 4, 'embedding_dim': 96, 'lr': 0.06535971055357154, 'lambda_val': 3.7558124406414846e-05, 'batch_size': 775, 'optimizer': 'SGD'}.
2026-05-24 17:02:29,779 - experiment_functions - INFO - Early stopping at epoch 500. Best Metrics: (0.00838694588233153, 0.006382450331125829, 0.007934379576380367)
2026-05-24 17:02:30,694 - optuna.study.study - INFO - Trial 16 finished with values: [0.00838694588233153, 0.006382450331125829, 0.007934379576380367] and parameters: {'n_layers': 2, 'embedding_dim': 128, 'lr': 0.012203428335465949, 'lambda_val': 0.004425109783649259, 'batch_size': 1565, 'optimizer': 'RMSprop'}.
2026-05-24 17:03:12,098 - optuna.study.study - INFO - Trial 17 finished with values: [0.022226434401548405, 0.016258278145695363, 0.02223747026104268] and parameters: {'n_layers': 2, 'embedding_dim': 96, 'lr': 0.0003156053277132074, 'lambda_val': 0.001164130600275734, 'batch_size': 559, 'optimizer': 'Adam'}.
2026-05-24 17:03:18,044 - experiment_functions - INFO - Early stopping at epoch 500. Best Metrics: (0.005662931842051049, 0.004362582781456954, 0.0056240840076765535)
2026-05-24 17:03:19,133 - optuna.study.study - INFO - Trial 18 finished with values: [0.005662931842051049, 0.004362582781456954, 0.0056240840076765535] and parameters: {'n_layers': 2, 'embedding_dim': 32, 'lr': 0.005499362853243718, 'lambda_val': 2.430037688843802e-06, 'batch_size': 924, 'optimizer': 'SGD'}.
2026-05-24 17:03:25,048 - experiment_functions - INFO - Early stopping at epoch 500. Best Metrics: (0.0058486108523323225, 0.00456953642384106, 0.006165412788104586)
2026-05-24 17:03:25,919 - optuna.study.study - INFO - Trial 19 finished with values: [0.0058486108523323225, 0.00456953642384106, 0.006165412788104586] and parameters: {'n_layers': 2, 'embedding_dim': 64, 'lr': 1.993933394974126e-05, 'lambda_val': 0.009936057250430284, 'batch_size': 2749, 'optimizer': 'SGD'}.
2026-05-24 17:03:32,020 - experiment_functions - INFO - Early stopping at epoch 500. Best Metrics: (0.0047044599553633095, 0.0040149006622516555, 0.004961906927101573)
2026-05-24 17:03:33,025 - optuna.study.study - INFO - Trial 20 finished with values: [0.0047044599553633095, 0.0040149006622516555, 0.004961906927101573] and parameters: {'n_layers': 2, 'embedding_dim': 96, 'lr': 5.238042759773907e-05, 'lambda_val': 0.036586024601884225, 'batch_size': 2809, 'optimizer': 'RMSprop'}.
2026-05-24 17:03:39,676 - experiment_functions - INFO - Early stopping at epoch 550. Best Metrics: (0.008299592244457222, 0.007591059602649007, 0.009182270055441536)
2026-05-24 17:03:40,407 - optuna.study.study - INFO - Trial 21 finished with values: [0.008299592244457222, 0.007591059602649007, 0.009182270055441536] and parameters: {'n_layers': 3, 'embedding_dim': 64, 'lr': 0.046268159527213755, 'lambda_val': 4.4252282308062394e-05, 'batch_size': 2074, 'optimizer': 'Adam'}.
2026-05-24 17:03:47,068 - experiment_functions - INFO - Early stopping at epoch 550. Best Metrics: (0.02318707717776887, 0.017723509933774837, 0.02391146199204716)
2026-05-24 17:03:47,425 - optuna.study.study - INFO - Trial 22 finished with values: [0.02318707717776887, 0.017723509933774837, 0.02391146199204716] and parameters: {'n_layers': 4, 'embedding_dim': 96, 'lr': 0.00411385889676726, 'lambda_val': 2.3974044149892758e-05, 'batch_size': 1752, 'optimizer': 'Adam'}.
2026-05-24 17:04:08,356 - experiment_functions - INFO - Early stopping at epoch 2000. Best Metrics: (0.0055132617731730475, 0.006125827814569536, 0.0068503386384643995)
2026-05-24 17:04:08,469 - optuna.study.study - INFO - Trial 23 finished with values: [0.0055132617731730475, 0.006125827814569536, 0.0068503386384643995] and parameters: {'n_layers': 3, 'embedding_dim': 96, 'lr': 0.05519756921645756, 'lambda_val': 0.03155276903145698, 'batch_size': 3093, 'optimizer': 'Adam'}.
2026-05-24 17:04:21,498 - experiment_functions - INFO - Early stopping at epoch 1200. Best Metrics: (0.01941598312385239, 0.016233443708609272, 0.02051352585396705)
2026-05-24 17:04:21,584 - optuna.study.study - INFO - Trial 24 finished with values: [0.01941598312385239, 0.016233443708609272, 0.02051352585396705] and parameters: {'n_layers': 4, 'embedding_dim': 96, 'lr': 0.0002991906586766703, 'lambda_val': 0.06321084010585615, 'batch_size': 3877, 'optimizer': 'Adam'}.
2026-05-24 17:04:28,124 - experiment_functions - INFO - Early stopping at epoch 550. Best Metrics: (0.015276240208621193, 0.013617549668874173, 0.016400661796442888)
2026-05-24 17:04:28,878 - optuna.study.study - INFO - Trial 25 finished with values: [0.015276240208621193, 0.013617549668874173, 0.016400661796442888] and parameters: {'n_layers': 4, 'embedding_dim': 128, 'lr': 0.0065618298710489005, 'lambda_val': 0.00011364672917450008, 'batch_size': 3115, 'optimizer': 'Adam'}.
2026-05-24 17:04:35,427 - experiment_functions - INFO - Early stopping at epoch 500. Best Metrics: (0.005378523883776657, 0.004114238410596027, 0.005352249641584841)
2026-05-24 17:04:35,531 - optuna.study.study - INFO - Trial 26 finished with values: [0.005378523883776657, 0.004114238410596027, 0.005352249641584841] and parameters: {'n_layers': 4, 'embedding_dim': 128, 'lr': 6.11495569161953e-05, 'lambda_val': 4.639541424555153e-06, 'batch_size': 2807, 'optimizer': 'SGD'}.
2026-05-24 17:04:59,381 - experiment_functions - INFO - Early stopping at epoch 2000. Best Metrics: (0.024118865225930774, 0.0189817880794702, 0.025121878706311877)
2026-05-24 17:04:59,477 - optuna.study.study - INFO - Trial 27 finished with values: [0.024118865225930774, 0.0189817880794702, 0.025121878706311877] and parameters: {'n_layers': 3, 'embedding_dim': 96, 'lr': 0.0002455263829380315, 'lambda_val': 0.0036922476620693135, 'batch_size': 2401, 'optimizer': 'Adam'}.
2026-05-24 17:05:13,499 - experiment_functions - INFO - Early stopping at epoch 1250. Best Metrics: (0.004872504302577552, 0.004180463576158941, 0.005119683875937314)
2026-05-24 17:05:14,185 - optuna.study.study - INFO - Trial 28 finished with values: [0.004872504302577552, 0.004180463576158941, 0.005119683875937314] and parameters: {'n_layers': 3, 'embedding_dim': 96, 'lr': 0.023101797496363468, 'lambda_val': 0.00036016135845345936, 'batch_size': 1083, 'optimizer': 'SGD'}.
2026-05-24 17:05:20,659 - experiment_functions - INFO - Early stopping at epoch 500. Best Metrics: (0.0049355374802640154, 0.003890728476821192, 0.005178654418414101)
2026-05-24 17:05:21,130 - optuna.study.study - INFO - Trial 29 finished with values: [0.0049355374802640154, 0.003890728476821192, 0.005178654418414101] and parameters: {'n_layers': 4, 'embedding_dim': 32, 'lr': 0.0005712571609959193, 'lambda_val': 0.0012595071838127825, 'batch_size': 2138, 'optimizer': 'SGD'}.
2026-05-24 17:05:27,619 - experiment_functions - INFO - Early stopping at epoch 500. Best Metrics: (0.005537636860638011, 0.004759933774834437, 0.005892045828238641)
2026-05-24 17:05:27,772 - optuna.study.study - INFO - Trial 30 finished with values: [0.005537636860638011, 0.004759933774834437, 0.005892045828238641] and parameters: {'n_layers': 3, 'embedding_dim': 128, 'lr': 0.08400712475852012, 'lambda_val': 0.049067092322527366, 'batch_size': 565, 'optimizer': 'Adam'}.
2026-05-24 17:05:36,694 - experiment_functions - INFO - Early stopping at epoch 700. Best Metrics: (0.024026196934069266, 0.01933774834437086, 0.025434366378009228)
2026-05-24 17:05:37,123 - optuna.study.study - INFO - Trial 31 finished with values: [0.024026196934069266, 0.01933774834437086, 0.025434366378009228] and parameters: {'n_layers': 4, 'embedding_dim': 64, 'lr': 0.0011476975681739769, 'lambda_val': 0.0002833202672041478, 'batch_size': 1627, 'optimizer': 'Adam'}.
2026-05-24 17:05:43,950 - experiment_functions - INFO - Early stopping at epoch 500. Best Metrics: (0.0052496911907921546, 0.004006622516556292, 0.005060402873344549)
2026-05-24 17:05:44,820 - optuna.study.study - INFO - Trial 32 finished with values: [0.0052496911907921546, 0.004006622516556292, 0.005060402873344549] and parameters: {'n_layers': 4, 'embedding_dim': 256, 'lr': 0.001014605840843128, 'lambda_val': 4.006774955873748e-06, 'batch_size': 633, 'optimizer': 'SGD'}.
2026-05-24 17:05:50,902 - experiment_functions - INFO - Early stopping at epoch 500. Best Metrics: (0.005041914824521499, 0.004230132450331126, 0.00521202915178782)
2026-05-24 17:05:51,518 - optuna.study.study - INFO - Trial 33 finished with values: [0.005041914824521499, 0.004230132450331126, 0.00521202915178782] and parameters: {'n_layers': 4, 'embedding_dim': 64, 'lr': 0.0013038790133562204, 'lambda_val': 4.6735044627170685e-05, 'batch_size': 1634, 'optimizer': 'SGD'}.
2026-05-24 17:06:04,128 - experiment_functions - INFO - Early stopping at epoch 1150. Best Metrics: (0.004439391364302018, 0.0048841059602649, 0.0056211880750696875)
2026-05-24 17:06:04,208 - optuna.study.study - INFO - Trial 34 finished with values: [0.004439391364302018, 0.0048841059602649, 0.0056211880750696875] and parameters: {'n_layers': 3, 'embedding_dim': 96, 'lr': 0.0972701713510638, 'lambda_val': 0.011970795572200042, 'batch_size': 3280, 'optimizer': 'Adam'}.
2026-05-24 17:06:10,763 - experiment_functions - INFO - Early stopping at epoch 550. Best Metrics: (0.012684344155934522, 0.010728476821192053, 0.013299714397096228)
2026-05-24 17:06:10,861 - optuna.study.study - INFO - Trial 35 finished with values: [0.012684344155934522, 0.010728476821192053, 0.013299714397096228] and parameters: {'n_layers': 1, 'embedding_dim': 256, 'lr': 0.004009595785666262, 'lambda_val': 0.0012698784207975818, 'batch_size': 2373, 'optimizer': 'RMSprop'}.
2026-05-24 17:06:19,562 - experiment_functions - INFO - Early stopping at epoch 800. Best Metrics: (0.005426956039952388, 0.004403973509933775, 0.005549030717145326)
2026-05-24 17:06:19,653 - optuna.study.study - INFO - Trial 36 finished with values: [0.005426956039952388, 0.004403973509933775, 0.005549030717145326] and parameters: {'n_layers': 2, 'embedding_dim': 32, 'lr': 0.003429601537868209, 'lambda_val': 4.095022581776763e-06, 'batch_size': 889, 'optimizer': 'SGD'}.
2026-05-24 17:06:59,847 - optuna.study.study - INFO - Trial 37 finished with values: [0.007363194546900529, 0.0058526490066225165, 0.007683025511157717] and parameters: {'n_layers': 4, 'embedding_dim': 64, 'lr': 3.5791019489543236e-05, 'lambda_val': 0.00028565339233446637, 'batch_size': 2008, 'optimizer': 'Adam'}.
2026-05-24 17:07:39,095 - optuna.study.study - INFO - Trial 38 finished with values: [0.010425648037741462, 0.008195364238410595, 0.01108912378719154] and parameters: {'n_layers': 2, 'embedding_dim': 32, 'lr': 0.0001267558264055704, 'lambda_val': 0.006970697664400825, 'batch_size': 1112, 'optimizer': 'RMSprop'}.
2026-05-24 17:07:52,748 - experiment_functions - INFO - Early stopping at epoch 1200. Best Metrics: (0.0250497289531301, 0.02044701986754967, 0.02593623256439368)
2026-05-24 17:07:52,842 - optuna.study.study - INFO - Trial 39 finished with values: [0.0250497289531301, 0.02044701986754967, 0.02593623256439368] and parameters: {'n_layers': 4, 'embedding_dim': 32, 'lr': 0.00032645317624320844, 'lambda_val': 0.03958976761123264, 'batch_size': 3200, 'optimizer': 'Adam'}.
2026-05-24 17:07:58,586 - experiment_functions - INFO - Early stopping at epoch 500. Best Metrics: (0.005268288455444357, 0.004312913907284768, 0.005606958389073173)
2026-05-24 17:07:59,075 - optuna.study.study - INFO - Trial 40 finished with values: [0.005268288455444357, 0.004312913907284768, 0.005606958389073173] and parameters: {'n_layers': 4, 'embedding_dim': 32, 'lr': 0.006500759119267065, 'lambda_val': 0.0459567442664202, 'batch_size': 1334, 'optimizer': 'SGD'}.
2026-05-24 17:08:11,992 - experiment_functions - INFO - Early stopping at epoch 1150. Best Metrics: (0.004936765107102423, 0.0040149006622516555, 0.005045400160407286)
2026-05-24 17:08:12,080 - optuna.study.study - INFO - Trial 41 finished with values: [0.004936765107102423, 0.0040149006622516555, 0.005045400160407286] and parameters: {'n_layers': 2, 'embedding_dim': 256, 'lr': 0.05711878298027994, 'lambda_val': 6.557278457387851e-05, 'batch_size': 2427, 'optimizer': 'SGD'}.
2026-05-24 17:08:26,986 - experiment_functions - INFO - Early stopping at epoch 1400. Best Metrics: (0.004781728388029575, 0.004726821192052981, 0.005776943834827157)
2026-05-24 17:08:28,015 - optuna.study.study - INFO - Trial 42 finished with values: [0.004781728388029575, 0.004726821192052981, 0.005776943834827157] and parameters: {'n_layers': 4, 'embedding_dim': 96, 'lr': 0.02343012040449479, 'lambda_val': 0.01167626812634998, 'batch_size': 1421, 'optimizer': 'Adam'}.
2026-05-24 17:09:08,032 - optuna.study.study - INFO - Trial 43 finished with values: [0.009483329233241565, 0.00783112582781457, 0.010041242281354864] and parameters: {'n_layers': 4, 'embedding_dim': 32, 'lr': 5.3171398873209266e-05, 'lambda_val': 0.004736943587584437, 'batch_size': 4048, 'optimizer': 'Adam'}.
2026-05-24 17:09:13,916 - experiment_functions - INFO - Early stopping at epoch 500. Best Metrics: (0.004838023471848206, 0.004105960264900663, 0.005189167824174739)
2026-05-24 17:09:14,729 - optuna.study.study - INFO - Trial 44 finished with values: [0.004838023471848206, 0.004105960264900663, 0.005189167824174739] and parameters: {'n_layers': 1, 'embedding_dim': 64, 'lr': 0.00047704131529501816, 'lambda_val': 8.197969725316934e-05, 'batch_size': 2302, 'optimizer': 'SGD'}.
2026-05-24 17:09:30,514 - experiment_functions - INFO - Early stopping at epoch 1350. Best Metrics: (0.02649702711364027, 0.01955298013245033, 0.026971189513665308)
2026-05-24 17:09:30,609 - optuna.study.study - INFO - Trial 45 finished with values: [0.02649702711364027, 0.01955298013245033, 0.026971189513665308] and parameters: {'n_layers': 2, 'embedding_dim': 128, 'lr': 0.0005173740894077295, 'lambda_val': 4.630487880914724e-05, 'batch_size': 859, 'optimizer': 'RMSprop'}.
2026-05-24 17:09:36,778 - experiment_functions - INFO - Early stopping at epoch 500. Best Metrics: (0.005502734343945869, 0.004048013245033113, 0.005159092523187016)
2026-05-24 17:09:37,527 - optuna.study.study - INFO - Trial 46 finished with values: [0.005502734343945869, 0.004048013245033113, 0.005159092523187016] and parameters: {'n_layers': 4, 'embedding_dim': 128, 'lr': 0.0009144615335871839, 'lambda_val': 1.1259762285821162e-05, 'batch_size': 2355, 'optimizer': 'SGD'}.
2026-05-24 17:09:45,485 - experiment_functions - INFO - Early stopping at epoch 650. Best Metrics: (0.02359693065022274, 0.017748344370860928, 0.024248540328930302)
2026-05-24 17:09:45,584 - optuna.study.study - INFO - Trial 47 finished with values: [0.02359693065022274, 0.017748344370860928, 0.024248540328930302] and parameters: {'n_layers': 4, 'embedding_dim': 64, 'lr': 0.0013380689464122827, 'lambda_val': 1.984739363175094e-06, 'batch_size': 2196, 'optimizer': 'Adam'}.
2026-05-24 17:09:52,131 - experiment_functions - INFO - Early stopping at epoch 550. Best Metrics: (0.007617612337072554, 0.0069784768211920535, 0.008533878406003078)
2026-05-24 17:09:52,519 - optuna.study.study - INFO - Trial 48 finished with values: [0.007617612337072554, 0.0069784768211920535, 0.008533878406003078] and parameters: {'n_layers': 4, 'embedding_dim': 64, 'lr': 0.02393707083593118, 'lambda_val': 0.0005177493901631796, 'batch_size': 2022, 'optimizer': 'Adam'}.
2026-05-24 17:09:59,019 - experiment_functions - INFO - Early stopping at epoch 550. Best Metrics: (0.008879592758982972, 0.007822847682119206, 0.009830148651280212)
2026-05-24 17:09:59,962 - optuna.study.study - INFO - Trial 49 finished with values: [0.008879592758982972, 0.007822847682119206, 0.009830148651280212] and parameters: {'n_layers': 2, 'embedding_dim': 32, 'lr': 0.014872157582619578, 'lambda_val': 0.0009396500736582227, 'batch_size': 3414, 'optimizer': 'RMSprop'}.
2026-05-24 17:10:27,657 - experiment_functions - INFO - Early stopping at epoch 2500. Best Metrics: (0.024127833893657132, 0.019188741721854304, 0.02483336403719238)
2026-05-24 17:10:27,755 - optuna.study.study - INFO - Trial 50 finished with values: [0.024127833893657132, 0.019188741721854304, 0.02483336403719238] and parameters: {'n_layers': 4, 'embedding_dim': 64, 'lr': 0.0002426099667536793, 'lambda_val': 1.984739363175094e-06, 'batch_size': 2491, 'optimizer': 'RMSprop'}.
2026-05-24 17:10:41,002 - experiment_functions - INFO - Early stopping at epoch 1100. Best Metrics: (0.02512407646639586, 0.01968543046357616, 0.025723728987525233)
2026-05-24 17:10:41,108 - optuna.study.study - INFO - Trial 51 finished with values: [0.02512407646639586, 0.01968543046357616, 0.025723728987525233] and parameters: {'n_layers': 2, 'embedding_dim': 128, 'lr': 0.000647639505305291, 'lambda_val': 4.630487880914724e-05, 'batch_size': 859, 'optimizer': 'RMSprop'}.
2026-05-24 17:10:47,708 - experiment_functions - INFO - Early stopping at epoch 550. Best Metrics: (0.021413968655189682, 0.015670529801324506, 0.021333316785857776)
2026-05-24 17:10:47,793 - optuna.study.study - INFO - Trial 52 finished with values: [0.021413968655189682, 0.015670529801324506, 0.021333316785857776] and parameters: {'n_layers': 2, 'embedding_dim': 32, 'lr': 0.005499362853243718, 'lambda_val': 2.430037688843802e-06, 'batch_size': 924, 'optimizer': 'RMSprop'}.
2026-05-24 17:10:53,742 - experiment_functions - INFO - Early stopping at epoch 500. Best Metrics: (0.008425107428594295, 0.0068543046357615895, 0.00831510267785905)
2026-05-24 17:10:54,242 - optuna.study.study - INFO - Trial 53 finished with values: [0.008425107428594295, 0.0068543046357615895, 0.00831510267785905] and parameters: {'n_layers': 1, 'embedding_dim': 96, 'lr': 0.014872157582619578, 'lambda_val': 0.018538435432608094, 'batch_size': 773, 'optimizer': 'RMSprop'}.
2026-05-24 17:11:00,843 - experiment_functions - INFO - Early stopping at epoch 550. Best Metrics: (0.01895195151965167, 0.013120860927152318, 0.018039812700945155)
2026-05-24 17:11:00,928 - optuna.study.study - INFO - Trial 54 finished with values: [0.01895195151965167, 0.013120860927152318, 0.018039812700945155] and parameters: {'n_layers': 1, 'embedding_dim': 96, 'lr': 0.0033504361141672117, 'lambda_val': 0.0012698784207975818, 'batch_size': 1209, 'optimizer': 'RMSprop'}.
2026-05-24 17:11:42,156 - optuna.study.study - INFO - Trial 55 finished with values: [0.005904342132113895, 0.004461920529801325, 0.005953023803870377] and parameters: {'n_layers': 4, 'embedding_dim': 64, 'lr': 1.150025240693646e-05, 'lambda_val': 8.330169033950404e-06, 'batch_size': 3241, 'optimizer': 'RMSprop'}.
2026-05-24 17:11:54,144 - experiment_functions - INFO - Early stopping at epoch 1050. Best Metrics: (0.022436014011694122, 0.018716887417218546, 0.023758697061892296)
2026-05-24 17:11:54,238 - optuna.study.study - INFO - Trial 56 finished with values: [0.022436014011694122, 0.018716887417218546, 0.023758697061892296] and parameters: {'n_layers': 4, 'embedding_dim': 96, 'lr': 0.0002991906586766703, 'lambda_val': 0.03958976761123264, 'batch_size': 3877, 'optimizer': 'Adam'}.
2026-05-24 17:12:01,145 - experiment_functions - INFO - Early stopping at epoch 550. Best Metrics: (0.019935621592590068, 0.016721854304635762, 0.02123051322402077)
2026-05-24 17:12:01,256 - optuna.study.study - INFO - Trial 57 finished with values: [0.019935621592590068, 0.016721854304635762, 0.02123051322402077] and parameters: {'n_layers': 4, 'embedding_dim': 32, 'lr': 0.0013380689464122827, 'lambda_val': 1.6438287598570295e-05, 'batch_size': 3553, 'optimizer': 'RMSprop'}.
2026-05-24 17:12:08,379 - experiment_functions - INFO - Early stopping at epoch 550. Best Metrics: (0.009403823326065286, 0.007094370860927153, 0.008747356142081738)
2026-05-24 17:12:08,472 - optuna.study.study - INFO - Trial 58 finished with values: [0.009403823326065286, 0.007094370860927153, 0.008747356142081738] and parameters: {'n_layers': 3, 'embedding_dim': 256, 'lr': 0.05711878298027994, 'lambda_val': 1.3435623194499138e-06, 'batch_size': 736, 'optimizer': 'RMSprop'}.
2026-05-24 17:12:14,498 - experiment_functions - INFO - Early stopping at epoch 500. Best Metrics: (0.005126045920168059, 0.004337748344370861, 0.005528529917565511)
