2026-05-23 20:35:46,110 - optuna.study.study - INFO - Trial 95 finished with values: [0.007305293710988889, 0.009991721854304638, 0.010731059716951907] and parameters: {'n_layers': 4, 'embedding_dim': 96, 'lr': 0.004184026134455368, 'lambda_val': 0.022717498758977165, 'batch_size': 576, 'optimizer': 'RMSprop'}.
2026-05-23 20:35:54,491 - experiment_functions - INFO - Early stopping at epoch 500. Best Metrics: (0.00623495566969737, 0.004966887417218543, 0.006260280992024081)
2026-05-23 20:35:54,576 - optuna.study.study - INFO - Trial 96 finished with values: [0.00623495566969737, 0.004966887417218543, 0.006260280992024081] and parameters: {'n_layers': 1, 'embedding_dim': 256, 'lr': 0.00021404168897179706, 'lambda_val': 0.0068325191706043835, 'batch_size': 585, 'optimizer': 'RMSprop'}.
2026-05-23 20:36:01,145 - experiment_functions - INFO - Early stopping at epoch 500. Best Metrics: (0.0051494741659452, 0.004445364238410596, 0.00534197180725587)
2026-05-23 20:36:01,792 - optuna.study.study - INFO - Trial 97 finished with values: [0.0051494741659452, 0.004445364238410596, 0.00534197180725587] and parameters: {'n_layers': 1, 'embedding_dim': 32, 'lr': 0.00021404168897179706, 'lambda_val': 0.020452511251658746, 'batch_size': 1295, 'optimizer': 'SGD'}.
2026-05-23 20:36:08,756 - experiment_functions - INFO - Early stopping at epoch 500. Best Metrics: (0.005607448064264894, 0.004834437086092716, 0.006247861124475327)
2026-05-23 20:36:08,854 - optuna.study.study - INFO - Trial 98 finished with values: [0.005607448064264894, 0.004834437086092716, 0.006247861124475327] and parameters: {'n_layers': 1, 'embedding_dim': 96, 'lr': 0.001325452189730596, 'lambda_val': 0.020452511251658746, 'batch_size': 2307, 'optimizer': 'SGD'}.
2026-05-23 20:36:20,047 - experiment_functions - INFO - Early stopping at epoch 650. Best Metrics: (0.07488989915553809, 0.05677980132450332, 0.07801755567238533)
2026-05-23 20:36:20,146 - optuna.study.study - INFO - Trial 99 finished with values: [0.07488989915553809, 0.05677980132450332, 0.07801755567238533] and parameters: {'n_layers': 1, 'embedding_dim': 256, 'lr': 0.0017544079546559647, 'lambda_val': 0.0006933074309064735, 'batch_size': 3999, 'optimizer': 'Adam'}.
2026-05-23 20:36:35,329 - experiment_functions - INFO - Early stopping at epoch 900. Best Metrics: (0.07718879840171725, 0.05748344370860927, 0.08032629257127387)
2026-05-23 20:36:35,650 - optuna.study.study - INFO - Trial 100 finished with values: [0.07718879840171725, 0.05748344370860927, 0.08032629257127387] and parameters: {'n_layers': 1, 'embedding_dim': 256, 'lr': 0.0006825513923366329, 'lambda_val': 0.0006933074309064735, 'batch_size': 2902, 'optimizer': 'Adam'}.
2026-05-23 20:37:39,612 - optuna.study.study - INFO - Trial 101 finished with values: [0.04815992328368564, 0.02969370860927153, 0.044334046473443287] and parameters: {'n_layers': 2, 'embedding_dim': 128, 'lr': 0.0196116163675917, 'lambda_val': 0.001076113642302791, 'batch_size': 3374, 'optimizer': 'Adam'}.
2026-05-23 20:37:49,741 - experiment_functions - INFO - Early stopping at epoch 600. Best Metrics: (0.043122539539260825, 0.03932119205298013, 0.04748784878749151)
2026-05-23 20:37:49,902 - optuna.study.study - INFO - Trial 102 finished with values: [0.043122539539260825, 0.03932119205298013, 0.04748784878749151] and parameters: {'n_layers': 1, 'embedding_dim': 256, 'lr': 0.004031587731005074, 'lambda_val': 0.0053912262075664795, 'batch_size': 1513, 'optimizer': 'Adam'}.
2026-05-23 20:38:40,641 - optuna.study.study - INFO - Trial 103 finished with values: [0.0431264777357506, 0.02954470198675497, 0.04229802323912855] and parameters: {'n_layers': 1, 'embedding_dim': 64, 'lr': 0.03195479337928965, 'lambda_val': 0.0007535837355673727, 'batch_size': 3031, 'optimizer': 'RMSprop'}.
2026-05-23 20:39:59,797 - experiment_functions - INFO - Early stopping at epoch 2950. Best Metrics: (0.021268514485329716, 0.015620860927152317, 0.02041871545919702)
2026-05-23 20:40:00,343 - optuna.study.study - INFO - Trial 104 finished with values: [0.021268514485329716, 0.015620860927152317, 0.02041871545919702] and parameters: {'n_layers': 4, 'embedding_dim': 256, 'lr': 0.004031587731005074, 'lambda_val': 0.0011279556330319215, 'batch_size': 886, 'optimizer': 'RMSprop'}.
2026-05-23 20:40:14,330 - experiment_functions - INFO - Early stopping at epoch 850. Best Metrics: (0.06714190509840182, 0.05463576158940398, 0.07169950794194392)
2026-05-23 20:40:14,446 - optuna.study.study - INFO - Trial 105 finished with values: [0.06714190509840182, 0.05463576158940398, 0.07169950794194392] and parameters: {'n_layers': 1, 'embedding_dim': 256, 'lr': 0.0006825513923366329, 'lambda_val': 0.021157307876022, 'batch_size': 2902, 'optimizer': 'Adam'}.
2026-05-23 20:40:45,432 - experiment_functions - INFO - Early stopping at epoch 2150. Best Metrics: (0.06362723626847962, 0.04706953642384107, 0.06560573783676833)
2026-05-23 20:40:45,734 - optuna.study.study - INFO - Trial 106 finished with values: [0.06362723626847962, 0.04706953642384107, 0.06560573783676833] and parameters: {'n_layers': 2, 'embedding_dim': 64, 'lr': 0.00022905061620751807, 'lambda_val': 1.826718502308613e-05, 'batch_size': 2875, 'optimizer': 'Adam'}.
2026-05-23 20:41:47,915 - experiment_functions - INFO - Early stopping at epoch 3850. Best Metrics: (0.0729054689365997, 0.046076158940397356, 0.06871206628857747)
2026-05-23 20:41:48,006 - optuna.study.study - INFO - Trial 107 finished with values: [0.0729054689365997, 0.046076158940397356, 0.06871206628857747] and parameters: {'n_layers': 1, 'embedding_dim': 256, 'lr': 0.004031587731005074, 'lambda_val': 0.00020136097974536503, 'batch_size': 2902, 'optimizer': 'Adam'}.
2026-05-23 20:42:02,013 - experiment_functions - INFO - Early stopping at epoch 1000. Best Metrics: (0.07262038937723402, 0.05440397350993378, 0.07331929413937886)
2026-05-23 20:42:02,099 - optuna.study.study - INFO - Trial 108 finished with values: [0.07262038937723402, 0.05440397350993378, 0.07331929413937886] and parameters: {'n_layers': 2, 'embedding_dim': 32, 'lr': 0.0007928857958215832, 'lambda_val': 0.0007535837355673727, 'batch_size': 833, 'optimizer': 'Adam'}.
2026-05-23 20:42:30,837 - experiment_functions - INFO - Early stopping at epoch 2050. Best Metrics: (0.04879220067007681, 0.0369205298013245, 0.04983960350562618)
2026-05-23 20:42:30,911 - optuna.study.study - INFO - Trial 109 finished with values: [0.04879220067007681, 0.0369205298013245, 0.04983960350562618] and parameters: {'n_layers': 3, 'embedding_dim': 32, 'lr': 0.0002519892414660267, 'lambda_val': 0.00031931562371042264, 'batch_size': 2170, 'optimizer': 'Adam'}.
2026-05-23 20:42:56,014 - experiment_functions - INFO - Early stopping at epoch 1500. Best Metrics: (0.08162559360901211, 0.060794701986754976, 0.08501382200851897)
2026-05-23 20:42:56,398 - optuna.study.study - INFO - Trial 110 finished with values: [0.08162559360901211, 0.060794701986754976, 0.08501382200851897] and parameters: {'n_layers': 1, 'embedding_dim': 256, 'lr': 0.0006825513923366329, 'lambda_val': 1.207883913872658e-06, 'batch_size': 808, 'optimizer': 'Adam'}.
2026-05-23 20:44:00,226 - optuna.study.study - INFO - Trial 111 finished with values: [0.08477975069371449, 0.06243377483443709, 0.08823275184138589] and parameters: {'n_layers': 1, 'embedding_dim': 256, 'lr': 0.00045141578622738895, 'lambda_val': 2.2621228626504235e-06, 'batch_size': 886, 'optimizer': 'Adam'}.
2026-05-23 20:44:08,387 - experiment_functions - INFO - Early stopping at epoch 500. Best Metrics: (0.005378461426171191, 0.004610927152317881, 0.005819414415618485)
2026-05-23 20:44:08,508 - optuna.study.study - INFO - Trial 112 finished with values: [0.005378461426171191, 0.004610927152317881, 0.005819414415618485] and parameters: {'n_layers': 1, 'embedding_dim': 256, 'lr': 0.0017544079546559647, 'lambda_val': 0.001076113642302791, 'batch_size': 3374, 'optimizer': 'SGD'}.
2026-05-23 20:44:58,601 - optuna.study.study - INFO - Trial 113 finished with values: [0.05271632169846382, 0.03746688741721854, 0.053184521583453784] and parameters: {'n_layers': 1, 'embedding_dim': 64, 'lr': 0.023789682142433273, 'lambda_val': 0.0018306388815656402, 'batch_size': 1893, 'optimizer': 'RMSprop'}.
2026-05-23 20:45:06,660 - experiment_functions - INFO - Early stopping at epoch 500. Best Metrics: (0.00467541643142278, 0.00435430463576159, 0.005240443003103329)
2026-05-23 20:45:06,779 - optuna.study.study - INFO - Trial 114 finished with values: [0.00467541643142278, 0.00435430463576159, 0.005240443003103329] and parameters: {'n_layers': 1, 'embedding_dim': 256, 'lr': 0.0003263341791003019, 'lambda_val': 0.009665452999254663, 'batch_size': 2268, 'optimizer': 'SGD'}.
2026-05-23 20:45:19,403 - experiment_functions - INFO - Early stopping at epoch 900. Best Metrics: (0.07288706103478042, 0.05537251655629139, 0.07609365052737807)
2026-05-23 20:45:19,491 - optuna.study.study - INFO - Trial 115 finished with values: [0.07288706103478042, 0.05537251655629139, 0.07609365052737807] and parameters: {'n_layers': 1, 'embedding_dim': 96, 'lr': 0.0007928857958215832, 'lambda_val': 1.207883913872658e-06, 'batch_size': 3432, 'optimizer': 'Adam'}.
2026-05-23 20:45:26,747 - experiment_functions - INFO - Early stopping at epoch 500. Best Metrics: (0.005170514181144791, 0.004544701986754968, 0.00568093172731469)
2026-05-23 20:45:26,836 - optuna.study.study - INFO - Trial 116 finished with values: [0.005170514181144791, 0.004544701986754968, 0.00568093172731469] and parameters: {'n_layers': 1, 'embedding_dim': 128, 'lr': 2.0448185132374713e-05, 'lambda_val': 0.006308703493993002, 'batch_size': 886, 'optimizer': 'Adam'}.
2026-05-23 20:46:16,860 - optuna.study.study - INFO - Trial 117 finished with values: [0.05111041816528078, 0.03490894039735099, 0.04984601549884388] and parameters: {'n_layers': 1, 'embedding_dim': 64, 'lr': 0.015671226158777793, 'lambda_val': 0.0006413167261517084, 'batch_size': 2138, 'optimizer': 'Adam'}.
2026-05-23 20:46:27,819 - experiment_functions - INFO - Early stopping at epoch 800. Best Metrics: (0.08481201614260227, 0.060902317880794705, 0.08597386448521642)
2026-05-23 20:46:28,267 - optuna.study.study - INFO - Trial 118 finished with values: [0.08481201614260227, 0.060902317880794705, 0.08597386448521642] and parameters: {'n_layers': 1, 'embedding_dim': 64, 'lr': 0.0017544079546559647, 'lambda_val': 0.00020136097974536503, 'batch_size': 886, 'optimizer': 'Adam'}.
2026-05-23 20:46:43,992 - experiment_functions - INFO - Early stopping at epoch 550. Best Metrics: (0.019855121957652246, 0.0196523178807947, 0.02326328630411263)
2026-05-23 20:46:45,063 - optuna.study.study - INFO - Trial 119 finished with values: [0.019855121957652246, 0.0196523178807947, 0.02326328630411263] and parameters: {'n_layers': 4, 'embedding_dim': 256, 'lr': 0.0006825513923366329, 'lambda_val': 0.021157307876022, 'batch_size': 2902, 'optimizer': 'RMSprop'}.
2026-05-23 20:46:51,511 - experiment_functions - INFO - Early stopping at epoch 500. Best Metrics: (0.006123729719553293, 0.005099337748344371, 0.0063656147362589266)
2026-05-23 20:46:51,598 - optuna.study.study - INFO - Trial 120 finished with values: [0.006123729719553293, 0.005099337748344371, 0.0063656147362589266] and parameters: {'n_layers': 1, 'embedding_dim': 32, 'lr': 0.0003263341791003019, 'lambda_val': 9.967237674188096e-06, 'batch_size': 576, 'optimizer': 'SGD'}.
2026-05-23 20:46:58,858 - experiment_functions - INFO - Early stopping at epoch 550. Best Metrics: (0.030531351361243037, 0.02822019867549669, 0.03136853060003126)
2026-05-23 20:46:58,942 - optuna.study.study - INFO - Trial 121 finished with values: [0.030531351361243037, 0.02822019867549669, 0.03136853060003126] and parameters: {'n_layers': 1, 'embedding_dim': 32, 'lr': 0.004031587731005074, 'lambda_val': 0.00020136097974536503, 'batch_size': 886, 'optimizer': 'RMSprop'}.
2026-05-23 20:47:12,650 - experiment_functions - INFO - Early stopping at epoch 550. Best Metrics: (0.04644560119779643, 0.035827814569536424, 0.04768801755405016)
2026-05-23 20:47:12,765 - optuna.study.study - INFO - Trial 122 finished with values: [0.04644560119779643, 0.035827814569536424, 0.04768801755405016] and parameters: {'n_layers': 3, 'embedding_dim': 256, 'lr': 0.0017544079546559647, 'lambda_val': 0.001076113642302791, 'batch_size': 3374, 'optimizer': 'Adam'}.
2026-05-23 20:48:06,199 - experiment_functions - INFO - Early stopping at epoch 3400. Best Metrics: (0.0838342007345887, 0.06199503311258279, 0.08400592086443455)
2026-05-23 20:48:06,297 - optuna.study.study - INFO - Trial 123 finished with values: [0.0838342007345887, 0.06199503311258279, 0.08400592086443455] and parameters: {'n_layers': 1, 'embedding_dim': 256, 'lr': 0.00045141578622738895, 'lambda_val': 0.0007535837355673727, 'batch_size': 886, 'optimizer': 'Adam'}.
2026-05-23 20:48:20,775 - experiment_functions - INFO - Early stopping at epoch 750. Best Metrics: (0.03562181389850434, 0.03054635761589404, 0.038558674822883145)
2026-05-23 20:48:21,340 - optuna.study.study - INFO - Trial 124 finished with values: [0.03562181389850434, 0.03054635761589404, 0.038558674822883145] and parameters: {'n_layers': 3, 'embedding_dim': 128, 'lr': 0.0003263341791003019, 'lambda_val': 7.066366944388039e-06, 'batch_size': 3855, 'optimizer': 'RMSprop'}.
2026-05-23 20:48:30,185 - experiment_functions - INFO - Early stopping at epoch 600. Best Metrics: (0.07957764473390443, 0.05788079470198676, 0.0824121979481923)
2026-05-23 20:48:30,282 - optuna.study.study - INFO - Trial 125 finished with values: [0.07957764473390443, 0.05788079470198676, 0.0824121979481923] and parameters: {'n_layers': 1, 'embedding_dim': 32, 'lr': 0.004031587731005074, 'lambda_val': 0.00020136097974536503, 'batch_size': 2170, 'optimizer': 'Adam'}.
2026-05-23 20:48:42,484 - experiment_functions - INFO - Early stopping at epoch 700. Best Metrics: (0.053712027096380836, 0.04437086092715232, 0.05990766042127642)
2026-05-23 20:48:42,587 - optuna.study.study - INFO - Trial 126 finished with values: [0.053712027096380836, 0.04437086092715232, 0.05990766042127642] and parameters: {'n_layers': 2, 'embedding_dim': 128, 'lr': 0.0007928857958215832, 'lambda_val': 0.0084174144866822, 'batch_size': 3432, 'optimizer': 'Adam'}.
2026-05-23 20:48:56,068 - experiment_functions - INFO - Early stopping at epoch 550. Best Metrics: (0.08123689088957108, 0.058990066225165554, 0.08552319031927874)
2026-05-23 20:48:56,508 - optuna.study.study - INFO - Trial 127 finished with values: [0.08123689088957108, 0.058990066225165554, 0.08552319031927874] and parameters: {'n_layers': 1, 'embedding_dim': 128, 'lr': 0.007131304194051908, 'lambda_val': 0.001076113642302791, 'batch_size': 3432, 'optimizer': 'Adam'}.
2026-05-23 20:49:42,917 - optuna.study.study - INFO - Trial 128 finished with values: [0.013996905271958845, 0.011142384105960265, 0.014711412827932186] and parameters: {'n_layers': 1, 'embedding_dim': 64, 'lr': 0.00024325382669259767, 'lambda_val': 2.3420359615170988e-05, 'batch_size': 886, 'optimizer': 'Adam'}.
2026-05-23 20:50:59,551 - optuna.study.study - INFO - Trial 129 finished with values: [0.042731392459416755, 0.033899006622516555, 0.04530287973428768] and parameters: {'n_layers': 2, 'embedding_dim': 256, 'lr': 0.00013491011852970758, 'lambda_val': 0.0005389031185277036, 'batch_size': 1044, 'optimizer': 'Adam'}.
2026-05-23 20:51:07,348 - experiment_functions - INFO - Early stopping at epoch 550. Best Metrics: (0.04892874753215803, 0.041192052980132454, 0.05126991189367914)
2026-05-23 20:51:07,496 - optuna.study.study - INFO - Trial 130 finished with values: [0.04892874753215803, 0.041192052980132454, 0.05126991189367914] and parameters: {'n_layers': 1, 'embedding_dim': 64, 'lr': 0.010318055219137296, 'lambda_val': 0.006308703493993002, 'batch_size': 2383, 'optimizer': 'Adam'}.
2026-05-23 20:51:22,379 - experiment_functions - INFO - Early stopping at epoch 800. Best Metrics: (0.02667834959547358, 0.02461092715231788, 0.02966349051576855)
2026-05-23 20:51:23,576 - optuna.study.study - INFO - Trial 131 finished with values: [0.02667834959547358, 0.02461092715231788, 0.02966349051576855] and parameters: {'n_layers': 3, 'embedding_dim': 128, 'lr': 0.0006274354192618561, 'lambda_val': 0.058286388766871935, 'batch_size': 3552, 'optimizer': 'Adam'}.
2026-05-23 20:51:39,427 - experiment_functions - INFO - Early stopping at epoch 950. Best Metrics: (0.05913975038791268, 0.04447847682119205, 0.06129200179343743)
2026-05-23 20:51:40,438 - optuna.study.study - INFO - Trial 132 finished with values: [0.05913975038791268, 0.04447847682119205, 0.06129200179343743] and parameters: {'n_layers': 2, 'embedding_dim': 128, 'lr': 0.00031605974728020873, 'lambda_val': 0.0014579384886447386, 'batch_size': 2731, 'optimizer': 'RMSprop'}.
2026-05-23 20:52:39,633 - optuna.study.study - INFO - Trial 133 finished with values: [0.025776628217973913, 0.020935430463576158, 0.027467177890145706] and parameters: {'n_layers': 1, 'embedding_dim': 256, 'lr': 0.00013400748935087667, 'lambda_val': 0.0014579384886447386, 'batch_size': 3277, 'optimizer': 'Adam'}.
2026-05-23 20:52:53,430 - experiment_functions - INFO - Early stopping at epoch 850. Best Metrics: (0.0699076065488188, 0.056390728476821195, 0.07539445898850175)
2026-05-23 20:52:54,063 - optuna.study.study - INFO - Trial 134 finished with values: [0.0699076065488188, 0.056390728476821195, 0.07539445898850175] and parameters: {'n_layers': 1, 'embedding_dim': 256, 'lr': 0.0006825513923366329, 'lambda_val': 0.021157307876022, 'batch_size': 2902, 'optimizer': 'Adam'}.
2026-05-23 20:53:01,411 - experiment_functions - INFO - Early stopping at epoch 500. Best Metrics: (0.00530905107374872, 0.004644039735099338, 0.0057207159294235185)
2026-05-23 20:53:01,538 - optuna.study.study - INFO - Trial 135 finished with values: [0.00530905107374872, 0.004644039735099338, 0.0057207159294235185] and parameters: {'n_layers': 1, 'embedding_dim': 96, 'lr': 1.060923517776014e-05, 'lambda_val': 0.0053912262075664795, 'batch_size': 2307, 'optimizer': 'RMSprop'}.
2026-05-23 20:53:10,930 - experiment_functions - INFO - Early stopping at epoch 600. Best Metrics: (0.07516630353031341, 0.05650662251655629, 0.07926148718283217)
2026-05-23 20:53:11,473 - optuna.study.study - INFO - Trial 136 finished with values: [0.07516630353031341, 0.05650662251655629, 0.07926148718283217] and parameters: {'n_layers': 1, 'embedding_dim': 96, 'lr': 0.004184026134455368, 'lambda_val': 0.0007535837355673727, 'batch_size': 2307, 'optimizer': 'Adam'}.
2026-05-23 20:54:13,618 - optuna.study.study - INFO - Trial 137 finished with values: [0.08135155495168558, 0.05937913907284769, 0.0835071638899022] and parameters: {'n_layers': 1, 'embedding_dim': 256, 'lr': 0.00045141578622738895, 'lambda_val': 0.00020136097974536503, 'batch_size': 576, 'optimizer': 'Adam'}.
2026-05-23 20:54:36,595 - experiment_functions - INFO - Early stopping at epoch 1350. Best Metrics: (0.03616565710108007, 0.030099337748344373, 0.038528277622257134)
2026-05-23 20:54:36,700 - optuna.study.study - INFO - Trial 138 finished with values: [0.03616565710108007, 0.030099337748344373, 0.038528277622257134] and parameters: {'n_layers': 4, 'embedding_dim': 64, 'lr': 0.00022905061620751807, 'lambda_val': 0.0006933074309064735, 'batch_size': 2358, 'optimizer': 'Adam'}.
2026-05-23 20:54:49,847 - experiment_functions - INFO - Early stopping at epoch 700. Best Metrics: (0.04569414172609793, 0.03817052980132451, 0.04900489106187344)
2026-05-23 20:54:49,958 - optuna.study.study - INFO - Trial 139 finished with values: [0.04569414172609793, 0.03817052980132451, 0.04900489106187344] and parameters: {'n_layers': 3, 'embedding_dim': 128, 'lr': 0.0007928857958215832, 'lambda_val': 0.006308703493993002, 'batch_size': 823, 'optimizer': 'Adam'}.
2026-05-23 20:55:00,160 - experiment_functions - INFO - Early stopping at epoch 500. Best Metrics: (0.004775357608439896, 0.00423841059602649, 0.00499308517058417)
2026-05-23 20:55:00,706 - optuna.study.study - INFO - Trial 140 finished with values: [0.004775357608439896, 0.00423841059602649, 0.00499308517058417] and parameters: {'n_layers': 2, 'embedding_dim': 256, 'lr': 0.00045141578622738895, 'lambda_val': 2.3420359615170988e-05, 'batch_size': 886, 'optimizer': 'SGD'}.
2026-05-23 20:55:21,363 - experiment_functions - INFO - Early stopping at epoch 850. Best Metrics: (0.043486052786064544, 0.03562086092715232, 0.04543748701559534)
2026-05-23 20:55:21,790 - optuna.study.study - INFO - Trial 141 finished with values: [0.043486052786064544, 0.03562086092715232, 0.04543748701559534] and parameters: {'n_layers': 3, 'embedding_dim': 256, 'lr': 0.0003263341791003019, 'lambda_val': 0.00020272782422991494, 'batch_size': 2638, 'optimizer': 'Adam'}.
2026-05-23 20:56:32,114 - optuna.study.study - INFO - Trial 142 finished with values: [0.04398701297366179, 0.035447019867549674, 0.04619682231550174] and parameters: {'n_layers': 3, 'embedding_dim': 128, 'lr': 0.00011254798405562515, 'lambda_val': 7.066366944388039e-06, 'batch_size': 1806, 'optimizer': 'Adam'}.
2026-05-23 20:56:45,806 - experiment_functions - INFO - Early stopping at epoch 550. Best Metrics: (0.04203162924485149, 0.032342715231788076, 0.044498620170110574)
2026-05-23 20:56:45,907 - optuna.study.study - INFO - Trial 143 finished with values: [0.04203162924485149, 0.032342715231788076, 0.044498620170110574] and parameters: {'n_layers': 3, 'embedding_dim': 256, 'lr': 0.0017544079546559647, 'lambda_val': 0.0006933074309064735, 'batch_size': 3999, 'optimizer': 'Adam'}.
