2026-05-24 10:29:48,083 - optuna.study.study - INFO - Trial 186 finished with values: [0.006428200801916725, 0.004958609271523179, 0.006653175616026013] and parameters: {'n_layers': 2, 'embedding_dim': 64, 'lr': 3.2084126219399766e-05, 'lambda_val': 1.9563512568026275e-06, 'batch_size': 3462, 'optimizer': 'Adam'}.
2026-05-24 10:29:56,437 - experiment_functions - INFO - Early stopping at epoch 600. Best Metrics: (0.014433655196151786, 0.012773178807947021, 0.016226381815320524)
2026-05-24 10:29:58,168 - optuna.study.study - INFO - Trial 187 finished with values: [0.014433655196151786, 0.012773178807947021, 0.016226381815320524] and parameters: {'n_layers': 4, 'embedding_dim': 64, 'lr': 0.0019052350516528542, 'lambda_val': 5.797866699774695e-06, 'batch_size': 688, 'optimizer': 'RMSprop'}.
2026-05-24 10:30:18,016 - experiment_functions - INFO - Early stopping at epoch 1550. Best Metrics: (0.050649816232782384, 0.03205298013245033, 0.0453045897516864)
2026-05-24 10:30:18,124 - optuna.study.study - INFO - Trial 188 finished with values: [0.050649816232782384, 0.03205298013245033, 0.0453045897516864] and parameters: {'n_layers': 3, 'embedding_dim': 64, 'lr': 0.0003489428053760722, 'lambda_val': 0.00021172971583081288, 'batch_size': 716, 'optimizer': 'Adam'}.
2026-05-24 10:30:39,501 - experiment_functions - INFO - Early stopping at epoch 1750. Best Metrics: (0.04882076682272202, 0.03128311258278146, 0.045526155978035054)
2026-05-24 10:30:40,664 - optuna.study.study - INFO - Trial 189 finished with values: [0.04882076682272202, 0.03128311258278146, 0.045526155978035054] and parameters: {'n_layers': 2, 'embedding_dim': 32, 'lr': 0.00033909998390093353, 'lambda_val': 1.9563512568026275e-06, 'batch_size': 2129, 'optimizer': 'Adam'}.
2026-05-24 10:30:48,711 - experiment_functions - INFO - Early stopping at epoch 550. Best Metrics: (0.047749062559434584, 0.030455298013245032, 0.042883341042622904)
2026-05-24 10:30:48,831 - optuna.study.study - INFO - Trial 190 finished with values: [0.047749062559434584, 0.030455298013245032, 0.042883341042622904] and parameters: {'n_layers': 1, 'embedding_dim': 128, 'lr': 0.001667262481946792, 'lambda_val': 1.9563512568026275e-06, 'batch_size': 3396, 'optimizer': 'RMSprop'}.
2026-05-24 10:31:34,913 - optuna.study.study - INFO - Trial 191 finished with values: [0.038075506476174165, 0.025256622516556294, 0.035953543456008874] and parameters: {'n_layers': 1, 'embedding_dim': 128, 'lr': 0.0002008346621954922, 'lambda_val': 2.0601952025948555e-06, 'batch_size': 2742, 'optimizer': 'Adam'}.
2026-05-24 10:31:43,941 - experiment_functions - INFO - Early stopping at epoch 650. Best Metrics: (0.047525129571780546, 0.02985099337748344, 0.04361810145921776)
2026-05-24 10:31:44,052 - optuna.study.study - INFO - Trial 192 finished with values: [0.047525129571780546, 0.02985099337748344, 0.04361810145921776] and parameters: {'n_layers': 2, 'embedding_dim': 96, 'lr': 0.0011339323609927568, 'lambda_val': 0.0005149605398707555, 'batch_size': 3366, 'optimizer': 'Adam'}.
2026-05-24 10:32:32,523 - optuna.study.study - INFO - Trial 193 finished with values: [0.04397469908278774, 0.027293046357615893, 0.04049792383018888] and parameters: {'n_layers': 3, 'embedding_dim': 32, 'lr': 0.0002008346621954922, 'lambda_val': 4.7374488373095054e-05, 'batch_size': 2904, 'optimizer': 'RMSprop'}.
2026-05-24 10:32:41,090 - experiment_functions - INFO - Early stopping at epoch 550. Best Metrics: (0.033897471911463785, 0.023253311258278144, 0.03196769948646647)
2026-05-24 10:32:41,199 - optuna.study.study - INFO - Trial 194 finished with values: [0.033897471911463785, 0.023253311258278144, 0.03196769948646647] and parameters: {'n_layers': 4, 'embedding_dim': 128, 'lr': 0.0028931100527333827, 'lambda_val': 0.0003213882390792333, 'batch_size': 2257, 'optimizer': 'Adam'}.
2026-05-24 10:32:50,556 - experiment_functions - INFO - Early stopping at epoch 600. Best Metrics: (0.05004338984364619, 0.03167218543046358, 0.04602179018361182)
2026-05-24 10:32:50,658 - optuna.study.study - INFO - Trial 195 finished with values: [0.05004338984364619, 0.03167218543046358, 0.04602179018361182] and parameters: {'n_layers': 2, 'embedding_dim': 256, 'lr': 0.001667262481946792, 'lambda_val': 0.00013747086007787122, 'batch_size': 2844, 'optimizer': 'Adam'}.
2026-05-24 10:32:58,752 - experiment_functions - INFO - Early stopping at epoch 600. Best Metrics: (0.04018870278603599, 0.02632450331125828, 0.03662528409424065)
2026-05-24 10:32:58,858 - optuna.study.study - INFO - Trial 196 finished with values: [0.04018870278603599, 0.02632450331125828, 0.03662528409424065] and parameters: {'n_layers': 3, 'embedding_dim': 32, 'lr': 0.0023286044951777046, 'lambda_val': 1.9563512568026275e-06, 'batch_size': 1431, 'optimizer': 'Adam'}.
2026-05-24 10:33:09,543 - experiment_functions - INFO - Early stopping at epoch 800. Best Metrics: (0.03031922889651247, 0.021258278145695364, 0.029334746844633736)
2026-05-24 10:33:09,738 - optuna.study.study - INFO - Trial 197 finished with values: [0.03031922889651247, 0.021258278145695364, 0.029334746844633736] and parameters: {'n_layers': 1, 'embedding_dim': 128, 'lr': 0.005921142718785096, 'lambda_val': 1.6361223952928733e-05, 'batch_size': 2742, 'optimizer': 'RMSprop'}.
2026-05-24 10:33:29,503 - experiment_functions - INFO - Early stopping at epoch 1450. Best Metrics: (0.028295916981220217, 0.016697019867549668, 0.024047707406322574)
2026-05-24 10:33:29,688 - optuna.study.study - INFO - Trial 198 finished with values: [0.028295916981220217, 0.016697019867549668, 0.024047707406322574] and parameters: {'n_layers': 3, 'embedding_dim': 128, 'lr': 0.0069551657405648405, 'lambda_val': 1.6361223952928733e-05, 'batch_size': 2905, 'optimizer': 'Adam'}.
2026-05-24 10:33:40,076 - experiment_functions - INFO - Early stopping at epoch 800. Best Metrics: (0.06501352279257083, 0.037425496688741726, 0.05611908309771788)
2026-05-24 10:33:41,343 - optuna.study.study - INFO - Trial 199 finished with values: [0.06501352279257083, 0.037425496688741726, 0.05611908309771788] and parameters: {'n_layers': 1, 'embedding_dim': 64, 'lr': 0.001667262481946792, 'lambda_val': 5.797866699774695e-06, 'batch_size': 1467, 'optimizer': 'Adam'}.
2026-05-24 10:33:50,793 - experiment_functions - INFO - Early stopping at epoch 650. Best Metrics: (0.0555122877104351, 0.03336092715231788, 0.049149055276340496)
2026-05-24 10:33:51,688 - optuna.study.study - INFO - Trial 200 finished with values: [0.0555122877104351, 0.03336092715231788, 0.049149055276340496] and parameters: {'n_layers': 1, 'embedding_dim': 256, 'lr': 0.002746129425384238, 'lambda_val': 1.2584915483536783e-06, 'batch_size': 961, 'optimizer': 'Adam'}.
2026-05-24 10:33:59,957 - experiment_functions - INFO - Early stopping at epoch 600. Best Metrics: (0.06435323424430923, 0.03714403973509934, 0.05436648963739998)
2026-05-24 10:34:00,076 - optuna.study.study - INFO - Trial 201 finished with values: [0.06435323424430923, 0.03714403973509934, 0.05436648963739998] and parameters: {'n_layers': 1, 'embedding_dim': 64, 'lr': 0.004028743321822881, 'lambda_val': 0.00014678836407597867, 'batch_size': 2844, 'optimizer': 'Adam'}.
2026-05-24 10:34:08,417 - experiment_functions - INFO - Early stopping at epoch 650. Best Metrics: (0.018177331587726678, 0.014048013245033112, 0.01825762603965029)
2026-05-24 10:34:08,528 - optuna.study.study - INFO - Trial 202 finished with values: [0.018177331587726678, 0.014048013245033112, 0.01825762603965029] and parameters: {'n_layers': 1, 'embedding_dim': 64, 'lr': 0.030443383643638237, 'lambda_val': 2.5452815323641335e-06, 'batch_size': 2129, 'optimizer': 'Adam'}.
2026-05-24 10:34:18,404 - experiment_functions - INFO - Early stopping at epoch 700. Best Metrics: (0.05692182871468293, 0.03376655629139073, 0.05010054389749149)
2026-05-24 10:34:18,517 - optuna.study.study - INFO - Trial 203 finished with values: [0.05692182871468293, 0.03376655629139073, 0.05010054389749149] and parameters: {'n_layers': 2, 'embedding_dim': 128, 'lr': 0.001061310207128634, 'lambda_val': 5.797866699774695e-06, 'batch_size': 1467, 'optimizer': 'Adam'}.
2026-05-24 10:35:05,650 - optuna.study.study - INFO - Trial 204 finished with values: [0.06520423337978819, 0.03735099337748344, 0.057145784941414896] and parameters: {'n_layers': 1, 'embedding_dim': 64, 'lr': 0.00033909998390093353, 'lambda_val': 1.9563512568026275e-06, 'batch_size': 2129, 'optimizer': 'RMSprop'}.
2026-05-24 10:35:13,816 - experiment_functions - INFO - Early stopping at epoch 550. Best Metrics: (0.051727577313408366, 0.031109271523178803, 0.0449267756290428)
2026-05-24 10:35:13,933 - optuna.study.study - INFO - Trial 205 finished with values: [0.051727577313408366, 0.031109271523178803, 0.0449267756290428] and parameters: {'n_layers': 1, 'embedding_dim': 256, 'lr': 0.001667262481946792, 'lambda_val': 5.797866699774695e-06, 'batch_size': 2740, 'optimizer': 'RMSprop'}.
2026-05-24 10:35:21,684 - experiment_functions - INFO - Early stopping at epoch 550. Best Metrics: (0.045187693378793435, 0.028129139072847684, 0.040627314118639464)
2026-05-24 10:35:21,789 - optuna.study.study - INFO - Trial 206 finished with values: [0.045187693378793435, 0.028129139072847684, 0.040627314118639464] and parameters: {'n_layers': 2, 'embedding_dim': 64, 'lr': 0.0011985229591796502, 'lambda_val': 0.0001501023123932292, 'batch_size': 2129, 'optimizer': 'RMSprop'}.
2026-05-24 10:36:10,021 - optuna.study.study - INFO - Trial 207 finished with values: [0.060082323986774655, 0.03621688741721854, 0.053495499194740254] and parameters: {'n_layers': 1, 'embedding_dim': 64, 'lr': 0.00033909998390093353, 'lambda_val': 5.797866699774695e-06, 'batch_size': 2986, 'optimizer': 'RMSprop'}.
2026-05-24 10:36:16,451 - experiment_functions - INFO - Early stopping at epoch 500. Best Metrics: (0.004544239430206399, 0.003642384105960265, 0.0046757875266112935)
2026-05-24 10:36:18,067 - optuna.study.study - INFO - Trial 208 finished with values: [0.004544239430206399, 0.003642384105960265, 0.0046757875266112935] and parameters: {'n_layers': 1, 'embedding_dim': 32, 'lr': 0.0002008346621954922, 'lambda_val': 2.5452815323641335e-06, 'batch_size': 2129, 'optimizer': 'SGD'}.
2026-05-24 10:36:38,926 - experiment_functions - INFO - Early stopping at epoch 1700. Best Metrics: (0.0409735317893971, 0.026937086092715234, 0.03918757425470058)
2026-05-24 10:36:39,029 - optuna.study.study - INFO - Trial 209 finished with values: [0.0409735317893971, 0.026937086092715234, 0.03918757425470058] and parameters: {'n_layers': 3, 'embedding_dim': 32, 'lr': 0.00033909998390093353, 'lambda_val': 1.9563512568026275e-06, 'batch_size': 2129, 'optimizer': 'RMSprop'}.
2026-05-24 10:36:45,707 - experiment_functions - INFO - Early stopping at epoch 500. Best Metrics: (0.005238747926612329, 0.00435430463576159, 0.005283974907413522)
2026-05-24 10:36:46,400 - optuna.study.study - INFO - Trial 210 finished with values: [0.005238747926612329, 0.00435430463576159, 0.005283974907413522] and parameters: {'n_layers': 1, 'embedding_dim': 128, 'lr': 0.00033909998390093353, 'lambda_val': 1.9563512568026275e-06, 'batch_size': 2129, 'optimizer': 'SGD'}.
2026-05-24 10:36:52,812 - experiment_functions - INFO - Early stopping at epoch 500. Best Metrics: (0.006041463271186483, 0.004246688741721854, 0.005482333029245158)
2026-05-24 10:36:52,980 - optuna.study.study - INFO - Trial 211 finished with values: [0.006041463271186483, 0.004246688741721854, 0.005482333029245158] and parameters: {'n_layers': 1, 'embedding_dim': 64, 'lr': 7.597019382425757e-05, 'lambda_val': 0.003154130669772898, 'batch_size': 2257, 'optimizer': 'RMSprop'}.
2026-05-24 10:37:02,099 - experiment_functions - INFO - Early stopping at epoch 650. Best Metrics: (0.04939067389566799, 0.031365894039735095, 0.04493905071844653)
2026-05-24 10:37:02,212 - optuna.study.study - INFO - Trial 212 finished with values: [0.04939067389566799, 0.031365894039735095, 0.04493905071844653] and parameters: {'n_layers': 2, 'embedding_dim': 128, 'lr': 0.001667262481946792, 'lambda_val': 1.9563512568026275e-06, 'batch_size': 1780, 'optimizer': 'Adam'}.
2026-05-24 10:37:12,327 - experiment_functions - INFO - Early stopping at epoch 550. Best Metrics: (0.03187419420558778, 0.02139072847682119, 0.02999455328631771)
2026-05-24 10:37:12,528 - optuna.study.study - INFO - Trial 213 finished with values: [0.03187419420558778, 0.02139072847682119, 0.02999455328631771] and parameters: {'n_layers': 4, 'embedding_dim': 256, 'lr': 0.001667262481946792, 'lambda_val': 0.00013747086007787122, 'batch_size': 1467, 'optimizer': 'Adam'}.
2026-05-24 10:37:20,167 - experiment_functions - INFO - Early stopping at epoch 550. Best Metrics: (0.011686113457199282, 0.011167218543046357, 0.013221872678498269)
2026-05-24 10:37:20,263 - optuna.study.study - INFO - Trial 214 finished with values: [0.011686113457199282, 0.011167218543046357, 0.013221872678498269] and parameters: {'n_layers': 3, 'embedding_dim': 64, 'lr': 0.002746129425384238, 'lambda_val': 5.198475548557465e-05, 'batch_size': 2844, 'optimizer': 'RMSprop'}.
2026-05-24 10:37:36,721 - experiment_functions - INFO - Early stopping at epoch 1350. Best Metrics: (0.022108158762393935, 0.01869205298013245, 0.023719853089544423)
2026-05-24 10:37:37,489 - optuna.study.study - INFO - Trial 215 finished with values: [0.022108158762393935, 0.01869205298013245, 0.023719853089544423] and parameters: {'n_layers': 4, 'embedding_dim': 32, 'lr': 0.00033909998390093353, 'lambda_val': 0.08238400869901934, 'batch_size': 2129, 'optimizer': 'RMSprop'}.
2026-05-24 10:37:49,584 - experiment_functions - INFO - Early stopping at epoch 850. Best Metrics: (0.05590760777423154, 0.03377483443708609, 0.04930849579599175)
2026-05-24 10:37:49,769 - optuna.study.study - INFO - Trial 216 finished with values: [0.05590760777423154, 0.03377483443708609, 0.04930849579599175] and parameters: {'n_layers': 1, 'embedding_dim': 256, 'lr': 0.0008645147173682575, 'lambda_val': 1.9563512568026275e-06, 'batch_size': 2901, 'optimizer': 'Adam'}.
2026-05-24 10:38:01,518 - experiment_functions - INFO - Early stopping at epoch 900. Best Metrics: (0.05138209144497634, 0.03271523178807947, 0.04605910006285147)
2026-05-24 10:38:01,931 - optuna.study.study - INFO - Trial 217 finished with values: [0.05138209144497634, 0.03271523178807947, 0.04605910006285147] and parameters: {'n_layers': 2, 'embedding_dim': 64, 'lr': 0.0006765239413532889, 'lambda_val': 0.0021842913573589164, 'batch_size': 1515, 'optimizer': 'Adam'}.
2026-05-24 10:38:10,560 - experiment_functions - INFO - Early stopping at epoch 600. Best Metrics: (0.03313547983252728, 0.022897350993377485, 0.031553681774053356)
2026-05-24 10:38:10,671 - optuna.study.study - INFO - Trial 218 finished with values: [0.03313547983252728, 0.022897350993377485, 0.031553681774053356] and parameters: {'n_layers': 3, 'embedding_dim': 64, 'lr': 0.001667262481946792, 'lambda_val': 2.791930910853256e-06, 'batch_size': 2740, 'optimizer': 'Adam'}.
2026-05-24 10:38:19,442 - experiment_functions - INFO - Early stopping at epoch 650. Best Metrics: (0.06134874485760129, 0.03630794701986755, 0.052856131516504666)
2026-05-24 10:38:19,553 - optuna.study.study - INFO - Trial 219 finished with values: [0.06134874485760129, 0.03630794701986755, 0.052856131516504666] and parameters: {'n_layers': 1, 'embedding_dim': 96, 'lr': 0.0028931100527333827, 'lambda_val': 0.003154130669772898, 'batch_size': 1789, 'optimizer': 'Adam'}.
2026-05-24 10:38:27,803 - experiment_functions - INFO - Early stopping at epoch 600. Best Metrics: (0.050934036522765035, 0.031564569536423843, 0.04562641918239102)
2026-05-24 10:38:27,928 - optuna.study.study - INFO - Trial 220 finished with values: [0.050934036522765035, 0.031564569536423843, 0.04562641918239102] and parameters: {'n_layers': 2, 'embedding_dim': 96, 'lr': 0.003043283191241845, 'lambda_val': 5.797866699774695e-06, 'batch_size': 961, 'optimizer': 'Adam'}.
2026-05-24 10:38:35,997 - experiment_functions - INFO - Early stopping at epoch 600. Best Metrics: (0.05865148572807766, 0.03451158940397351, 0.051235734243842875)
2026-05-24 10:38:36,116 - optuna.study.study - INFO - Trial 221 finished with values: [0.05865148572807766, 0.03451158940397351, 0.051235734243842875] and parameters: {'n_layers': 1, 'embedding_dim': 64, 'lr': 0.004028743321822881, 'lambda_val': 1.9563512568026275e-06, 'batch_size': 2844, 'optimizer': 'Adam'}.
2026-05-24 10:38:47,436 - experiment_functions - INFO - Early stopping at epoch 850. Best Metrics: (0.026372000987997156, 0.018667218543046357, 0.02536433413120177)
2026-05-24 10:38:48,628 - optuna.study.study - INFO - Trial 222 finished with values: [0.026372000987997156, 0.018667218543046357, 0.02536433413120177] and parameters: {'n_layers': 1, 'embedding_dim': 128, 'lr': 0.009194213632540334, 'lambda_val': 5.797866699774695e-06, 'batch_size': 2082, 'optimizer': 'RMSprop'}.
2026-05-24 10:38:56,988 - experiment_functions - INFO - Early stopping at epoch 600. Best Metrics: (0.056268184610993595, 0.034039735099337755, 0.051371568773020806)
2026-05-24 10:38:57,170 - optuna.study.study - INFO - Trial 223 finished with values: [0.056268184610993595, 0.034039735099337755, 0.051371568773020806] and parameters: {'n_layers': 1, 'embedding_dim': 32, 'lr': 0.001667262481946792, 'lambda_val': 5.797866699774695e-06, 'batch_size': 2129, 'optimizer': 'RMSprop'}.
2026-05-24 10:39:07,085 - experiment_functions - INFO - Early stopping at epoch 700. Best Metrics: (0.023366994176797436, 0.01720198675496689, 0.02315623295082236)
2026-05-24 10:39:07,324 - optuna.study.study - INFO - Trial 224 finished with values: [0.023366994176797436, 0.01720198675496689, 0.02315623295082236] and parameters: {'n_layers': 1, 'embedding_dim': 256, 'lr': 0.017371747985168953, 'lambda_val': 2.5452815323641335e-06, 'batch_size': 2844, 'optimizer': 'Adam'}.
2026-05-24 10:39:17,795 - experiment_functions - INFO - Early stopping at epoch 800. Best Metrics: (0.057928871700841544, 0.03463576158940398, 0.05087893320613945)
2026-05-24 10:39:17,912 - optuna.study.study - INFO - Trial 225 finished with values: [0.057928871700841544, 0.03463576158940398, 0.05087893320613945] and parameters: {'n_layers': 1, 'embedding_dim': 64, 'lr': 0.0013978493934357974, 'lambda_val': 5.797866699774695e-06, 'batch_size': 1780, 'optimizer': 'Adam'}.
2026-05-24 10:39:28,512 - experiment_functions - INFO - Early stopping at epoch 800. Best Metrics: (0.04207137220199265, 0.028418874172185433, 0.03874301203432883)
2026-05-24 10:39:28,827 - optuna.study.study - INFO - Trial 226 finished with values: [0.04207137220199265, 0.028418874172185433, 0.03874301203432883] and parameters: {'n_layers': 2, 'embedding_dim': 32, 'lr': 0.0008645147173682575, 'lambda_val': 1.9563512568026275e-06, 'batch_size': 2901, 'optimizer': 'Adam'}.
2026-05-24 10:39:37,379 - experiment_functions - INFO - Early stopping at epoch 550. Best Metrics: (0.01912840292022831, 0.015455298013245035, 0.019196089135088218)
2026-05-24 10:39:37,546 - optuna.study.study - INFO - Trial 227 finished with values: [0.01912840292022831, 0.015455298013245035, 0.019196089135088218] and parameters: {'n_layers': 3, 'embedding_dim': 32, 'lr': 0.002746129425384238, 'lambda_val': 0.0009904374338936715, 'batch_size': 1431, 'optimizer': 'RMSprop'}.
2026-05-24 10:39:48,584 - experiment_functions - INFO - Early stopping at epoch 550. Best Metrics: (0.031575633529191814, 0.021978476821192052, 0.02935646080208455)
2026-05-24 10:39:49,161 - optuna.study.study - INFO - Trial 228 finished with values: [0.031575633529191814, 0.021978476821192052, 0.02935646080208455] and parameters: {'n_layers': 4, 'embedding_dim': 256, 'lr': 0.002746129425384238, 'lambda_val': 2.5452815323641335e-06, 'batch_size': 2129, 'optimizer': 'Adam'}.
2026-05-24 10:39:56,220 - experiment_functions - INFO - Early stopping at epoch 500. Best Metrics: (0.006020095358232809, 0.004619205298013245, 0.005903763401806277)
2026-05-24 10:39:57,057 - optuna.study.study - INFO - Trial 229 finished with values: [0.006020095358232809, 0.004619205298013245, 0.005903763401806277] and parameters: {'n_layers': 3, 'embedding_dim': 64, 'lr': 0.0002008346621954922, 'lambda_val': 2.791930910853256e-06, 'batch_size': 1829, 'optimizer': 'SGD'}.
2026-05-24 10:40:05,841 - experiment_functions - INFO - Early stopping at epoch 650. Best Metrics: (0.053453700275224954, 0.033021523178807945, 0.0462791634424443)
2026-05-24 10:40:05,953 - optuna.study.study - INFO - Trial 230 finished with values: [0.053453700275224954, 0.033021523178807945, 0.0462791634424443] and parameters: {'n_layers': 1, 'embedding_dim': 96, 'lr': 0.002746129425384238, 'lambda_val': 2.5452815323641335e-06, 'batch_size': 2844, 'optimizer': 'Adam'}.
2026-05-24 10:40:52,466 - optuna.study.study - INFO - Trial 231 finished with values: [0.060520218285490604, 0.03561258278145695, 0.05271973275271088] and parameters: {'n_layers': 1, 'embedding_dim': 64, 'lr': 0.00033909998390093353, 'lambda_val': 5.797866699774695e-06, 'batch_size': 2129, 'optimizer': 'RMSprop'}.
2026-05-24 10:41:01,959 - experiment_functions - INFO - Early stopping at epoch 700. Best Metrics: (0.05665382690365736, 0.03560430463576159, 0.05119299134292498)
2026-05-24 10:41:02,077 - optuna.study.study - INFO - Trial 232 finished with values: [0.05665382690365736, 0.03560430463576159, 0.05119299134292498] and parameters: {'n_layers': 1, 'embedding_dim': 128, 'lr': 0.001667262481946792, 'lambda_val': 0.00038449950728469576, 'batch_size': 3053, 'optimizer': 'Adam'}.
2026-05-24 10:41:22,426 - experiment_functions - INFO - Early stopping at epoch 1700. Best Metrics: (0.04544892727353168, 0.03083609271523179, 0.04269045209767285)
