2026-05-23 22:52:02,196 - optuna.study.study - INFO - Trial 78 finished with values: [0.007822628642625805, 0.004155629139072848, 0.0066227204302797184] and parameters: {'n_layers': 2, 'embedding_dim': 64, 'lr': 0.0640007632858696, 'lambda_val': 2.829964802645351e-06, 'batch_size': 2947, 'optimizer': 'RMSprop'}.
2026-05-23 22:52:08,528 - experiment_functions - INFO - Early stopping at epoch 500. Best Metrics: (0.004477093561288795, 0.0031456953642384107, 0.004359948171338889)
2026-05-23 22:52:08,667 - optuna.study.study - INFO - Trial 79 finished with values: [0.004477093561288795, 0.0031456953642384107, 0.004359948171338889] and parameters: {'n_layers': 4, 'embedding_dim': 96, 'lr': 0.05747482424274449, 'lambda_val': 0.0018464106432939337, 'batch_size': 1061, 'optimizer': 'RMSprop'}.
2026-05-23 22:52:33,705 - experiment_functions - INFO - Early stopping at epoch 2100. Best Metrics: (0.02737584994000363, 0.008890728476821192, 0.024089028218152977)
2026-05-23 22:52:34,500 - optuna.study.study - INFO - Trial 80 finished with values: [0.02737584994000363, 0.008890728476821192, 0.024089028218152977] and parameters: {'n_layers': 2, 'embedding_dim': 256, 'lr': 0.00011132803279953378, 'lambda_val': 9.691061665067305e-06, 'batch_size': 3705, 'optimizer': 'RMSprop'}.
2026-05-23 22:52:40,671 - experiment_functions - INFO - Early stopping at epoch 500. Best Metrics: (0.005576231363733515, 0.004205298013245033, 0.0054190304417859134)
2026-05-23 22:52:41,038 - optuna.study.study - INFO - Trial 81 finished with values: [0.005576231363733515, 0.004205298013245033, 0.0054190304417859134] and parameters: {'n_layers': 3, 'embedding_dim': 32, 'lr': 1.217474007786209e-05, 'lambda_val': 0.0026752935915736586, 'batch_size': 608, 'optimizer': 'SGD'}.
2026-05-23 22:52:47,277 - experiment_functions - INFO - Early stopping at epoch 500. Best Metrics: (0.005563768943946018, 0.004420529801324504, 0.0055576111356749535)
2026-05-23 22:52:47,705 - optuna.study.study - INFO - Trial 82 finished with values: [0.005563768943946018, 0.004420529801324504, 0.0055576111356749535] and parameters: {'n_layers': 2, 'embedding_dim': 128, 'lr': 0.001978055566639153, 'lambda_val': 0.02056194581360825, 'batch_size': 3586, 'optimizer': 'Adam'}.
2026-05-23 22:52:54,131 - experiment_functions - INFO - Early stopping at epoch 500. Best Metrics: (0.004706078562634387, 0.003783112582781457, 0.0047048449372156876)
2026-05-23 22:52:54,716 - optuna.study.study - INFO - Trial 83 finished with values: [0.004706078562634387, 0.003783112582781457, 0.0047048449372156876] and parameters: {'n_layers': 4, 'embedding_dim': 64, 'lr': 0.0012665424339139031, 'lambda_val': 0.012607571681963144, 'batch_size': 3184, 'optimizer': 'RMSprop'}.
2026-05-23 22:53:00,957 - experiment_functions - INFO - Early stopping at epoch 500. Best Metrics: (0.004733057590651222, 0.004081125827814569, 0.005257828439167885)
2026-05-23 22:53:01,866 - optuna.study.study - INFO - Trial 84 finished with values: [0.004733057590651222, 0.004081125827814569, 0.005257828439167885] and parameters: {'n_layers': 4, 'embedding_dim': 96, 'lr': 0.0005579312455627987, 'lambda_val': 1.1124735762207802e-06, 'batch_size': 1272, 'optimizer': 'SGD'}.
2026-05-23 22:53:07,833 - experiment_functions - INFO - Early stopping at epoch 500. Best Metrics: (0.0054428513358255, 0.004254966887417219, 0.005630765265418974)
2026-05-23 22:53:08,572 - optuna.study.study - INFO - Trial 85 finished with values: [0.0054428513358255, 0.004254966887417219, 0.005630765265418974] and parameters: {'n_layers': 2, 'embedding_dim': 32, 'lr': 2.0206487716403182e-05, 'lambda_val': 0.0005555158504685463, 'batch_size': 1679, 'optimizer': 'RMSprop'}.
2026-05-23 22:53:15,844 - experiment_functions - INFO - Early stopping at epoch 550. Best Metrics: (0.01348431488803303, 0.005769867549668874, 0.011965630642952989)
2026-05-23 22:53:15,965 - optuna.study.study - INFO - Trial 86 finished with values: [0.01348431488803303, 0.005769867549668874, 0.011965630642952989] and parameters: {'n_layers': 3, 'embedding_dim': 128, 'lr': 0.0005362782660361518, 'lambda_val': 4.360746018288999e-05, 'batch_size': 2780, 'optimizer': 'RMSprop'}.
2026-05-23 22:53:22,737 - experiment_functions - INFO - Early stopping at epoch 500. Best Metrics: (0.005354834519504751, 0.00445364238410596, 0.005384930001266817)
2026-05-23 22:53:23,445 - optuna.study.study - INFO - Trial 87 finished with values: [0.005354834519504751, 0.00445364238410596, 0.005384930001266817] and parameters: {'n_layers': 4, 'embedding_dim': 128, 'lr': 0.00011132803279953378, 'lambda_val': 0.03039512423535505, 'batch_size': 1588, 'optimizer': 'RMSprop'}.
2026-05-23 22:53:32,358 - experiment_functions - INFO - Early stopping at epoch 700. Best Metrics: (0.005388922832112207, 0.00423841059602649, 0.005527174561581441)
2026-05-23 22:53:33,131 - optuna.study.study - INFO - Trial 88 finished with values: [0.005388922832112207, 0.00423841059602649, 0.005527174561581441] and parameters: {'n_layers': 4, 'embedding_dim': 64, 'lr': 4.696814526930695e-05, 'lambda_val': 0.08730084607066087, 'batch_size': 3892, 'optimizer': 'Adam'}.
2026-05-23 22:53:39,716 - experiment_functions - INFO - Early stopping at epoch 550. Best Metrics: (0.005899531129707872, 0.004370860927152318, 0.005823263845204578)
2026-05-23 22:53:39,850 - optuna.study.study - INFO - Trial 89 finished with values: [0.005899531129707872, 0.004370860927152318, 0.005823263845204578] and parameters: {'n_layers': 1, 'embedding_dim': 96, 'lr': 3.7710700707953124e-05, 'lambda_val': 0.0002398720988447927, 'batch_size': 2725, 'optimizer': 'Adam'}.
2026-05-23 22:53:51,825 - experiment_functions - INFO - Early stopping at epoch 1000. Best Metrics: (0.005359508466077968, 0.003849337748344371, 0.005098704848201792)
2026-05-23 22:53:51,917 - optuna.study.study - INFO - Trial 90 finished with values: [0.005359508466077968, 0.003849337748344371, 0.005098704848201792] and parameters: {'n_layers': 3, 'embedding_dim': 128, 'lr': 0.02329882039542195, 'lambda_val': 7.92013159514582e-05, 'batch_size': 2840, 'optimizer': 'SGD'}.
2026-05-23 22:54:03,429 - experiment_functions - INFO - Early stopping at epoch 850. Best Metrics: (0.005857700193574758, 0.004519867549668874, 0.0056091174348498335)
2026-05-23 22:54:03,896 - optuna.study.study - INFO - Trial 91 finished with values: [0.005857700193574758, 0.004519867549668874, 0.0056091174348498335] and parameters: {'n_layers': 4, 'embedding_dim': 256, 'lr': 1.0285526776008262e-05, 'lambda_val': 0.002482166316964702, 'batch_size': 2926, 'optimizer': 'Adam'}.
2026-05-23 22:54:12,251 - experiment_functions - INFO - Early stopping at epoch 650. Best Metrics: (0.005803396759352077, 0.004230132450331126, 0.005506853940392037)
2026-05-23 22:54:12,398 - optuna.study.study - INFO - Trial 92 finished with values: [0.005803396759352077, 0.004230132450331126, 0.005506853940392037] and parameters: {'n_layers': 3, 'embedding_dim': 256, 'lr': 0.01581982345441151, 'lambda_val': 0.0001334774692676944, 'batch_size': 892, 'optimizer': 'SGD'}.
2026-05-23 22:54:18,796 - experiment_functions - INFO - Early stopping at epoch 550. Best Metrics: (0.01398074997998988, 0.00462748344370861, 0.008837256410921876)
2026-05-23 22:54:18,961 - optuna.study.study - INFO - Trial 93 finished with values: [0.01398074997998988, 0.00462748344370861, 0.008837256410921876] and parameters: {'n_layers': 1, 'embedding_dim': 64, 'lr': 0.008789854846090673, 'lambda_val': 3.7036535224143254e-05, 'batch_size': 3639, 'optimizer': 'Adam'}.
2026-05-23 22:54:25,627 - experiment_functions - INFO - Early stopping at epoch 500. Best Metrics: (0.00573308608157457, 0.004437086092715233, 0.005651844406978836)
2026-05-23 22:54:25,856 - optuna.study.study - INFO - Trial 94 finished with values: [0.00573308608157457, 0.004437086092715233, 0.005651844406978836] and parameters: {'n_layers': 4, 'embedding_dim': 32, 'lr': 2.898730974585673e-05, 'lambda_val': 0.02353570435123328, 'batch_size': 2112, 'optimizer': 'SGD'}.
2026-05-23 22:54:32,812 - experiment_functions - INFO - Early stopping at epoch 600. Best Metrics: (0.007919504173416596, 0.004197019867549669, 0.006133703954888741)
2026-05-23 22:54:32,905 - optuna.study.study - INFO - Trial 95 finished with values: [0.007919504173416596, 0.004197019867549669, 0.006133703954888741] and parameters: {'n_layers': 2, 'embedding_dim': 32, 'lr': 0.0009470868010327422, 'lambda_val': 0.014733197162368416, 'batch_size': 1956, 'optimizer': 'Adam'}.
2026-05-23 22:54:40,302 - experiment_functions - INFO - Early stopping at epoch 600. Best Metrics: (0.0038929501421003055, 0.0036672185430463573, 0.004403537056774874)
2026-05-23 22:54:40,446 - optuna.study.study - INFO - Trial 96 finished with values: [0.0038929501421003055, 0.0036672185430463573, 0.004403537056774874] and parameters: {'n_layers': 1, 'embedding_dim': 256, 'lr': 1.073317556116755e-05, 'lambda_val': 0.017194844806607924, 'batch_size': 3007, 'optimizer': 'Adam'}.
2026-05-23 22:54:51,678 - experiment_functions - INFO - Early stopping at epoch 500. Best Metrics: (0.005341797608056364, 0.004114238410596027, 0.005644745339820184)
2026-05-23 22:54:52,294 - optuna.study.study - INFO - Trial 97 finished with values: [0.005341797608056364, 0.004114238410596027, 0.005644745339820184] and parameters: {'n_layers': 2, 'embedding_dim': 96, 'lr': 0.00038723708173308733, 'lambda_val': 3.7268864222597705e-06, 'batch_size': 1061, 'optimizer': 'SGD'}.
2026-05-23 22:55:02,805 - experiment_functions - INFO - Early stopping at epoch 500. Best Metrics: (0.004971215610189587, 0.004114238410596027, 0.004856322742505434)
2026-05-23 22:55:02,926 - optuna.study.study - INFO - Trial 98 finished with values: [0.004971215610189587, 0.004114238410596027, 0.004856322742505434] and parameters: {'n_layers': 2, 'embedding_dim': 256, 'lr': 5.1423395324241745e-05, 'lambda_val': 0.002609393831973727, 'batch_size': 1435, 'optimizer': 'SGD'}.
2026-05-23 22:55:09,180 - experiment_functions - INFO - Early stopping at epoch 500. Best Metrics: (0.004765451333212026, 0.00412251655629139, 0.00514947378016703)
2026-05-23 22:55:09,755 - optuna.study.study - INFO - Trial 99 finished with values: [0.004765451333212026, 0.00412251655629139, 0.00514947378016703] and parameters: {'n_layers': 2, 'embedding_dim': 64, 'lr': 0.0009470868010327422, 'lambda_val': 0.014733197162368416, 'batch_size': 2926, 'optimizer': 'Adam'}.
2026-05-23 22:55:53,795 - optuna.study.study - INFO - Trial 100 finished with values: [0.027013631521807944, 0.008518211920529801, 0.023167776268259773] and parameters: {'n_layers': 2, 'embedding_dim': 128, 'lr': 0.00011132803279953378, 'lambda_val': 4.360746018288999e-05, 'batch_size': 3950, 'optimizer': 'RMSprop'}.
2026-05-23 22:55:59,738 - experiment_functions - INFO - Early stopping at epoch 500. Best Metrics: (0.00391895374255311, 0.002740066225165563, 0.003836296741906787)
2026-05-23 22:56:00,346 - optuna.study.study - INFO - Trial 101 finished with values: [0.00391895374255311, 0.002740066225165563, 0.003836296741906787] and parameters: {'n_layers': 1, 'embedding_dim': 32, 'lr': 0.08811140126222361, 'lambda_val': 1.1001198490233584e-06, 'batch_size': 1063, 'optimizer': 'Adam'}.
2026-05-23 22:56:06,827 - experiment_functions - INFO - Early stopping at epoch 550. Best Metrics: (0.02800317669368275, 0.008882450331125828, 0.024412754112113858)
2026-05-23 22:56:07,352 - optuna.study.study - INFO - Trial 102 finished with values: [0.02800317669368275, 0.008882450331125828, 0.024412754112113858] and parameters: {'n_layers': 1, 'embedding_dim': 64, 'lr': 0.005587479616145046, 'lambda_val': 0.00031335292673571056, 'batch_size': 627, 'optimizer': 'Adam'}.
2026-05-23 22:56:14,710 - experiment_functions - INFO - Early stopping at epoch 650. Best Metrics: (0.020268367201968618, 0.007276490066225166, 0.01934752958433503)
2026-05-23 22:56:14,803 - optuna.study.study - INFO - Trial 103 finished with values: [0.020268367201968618, 0.007276490066225166, 0.01934752958433503] and parameters: {'n_layers': 2, 'embedding_dim': 32, 'lr': 0.0009470868010327422, 'lambda_val': 3.136622296234252e-05, 'batch_size': 1956, 'optimizer': 'Adam'}.
2026-05-23 22:56:21,047 - experiment_functions - INFO - Early stopping at epoch 500. Best Metrics: (0.004716585745598056, 0.0041390728476821195, 0.005260700963083169)
2026-05-23 22:56:21,613 - optuna.study.study - INFO - Trial 104 finished with values: [0.004716585745598056, 0.0041390728476821195, 0.005260700963083169] and parameters: {'n_layers': 4, 'embedding_dim': 64, 'lr': 0.0047404185338547926, 'lambda_val': 0.0028639996941338948, 'batch_size': 627, 'optimizer': 'Adam'}.
2026-05-23 22:56:29,172 - experiment_functions - INFO - Early stopping at epoch 600. Best Metrics: (0.025626158927870787, 0.008526490066225165, 0.02257886450591539)
2026-05-23 22:56:29,272 - optuna.study.study - INFO - Trial 105 finished with values: [0.025626158927870787, 0.008526490066225165, 0.02257886450591539] and parameters: {'n_layers': 2, 'embedding_dim': 256, 'lr': 0.0009299462051840892, 'lambda_val': 0.002482166316964702, 'batch_size': 556, 'optimizer': 'Adam'}.
2026-05-23 22:56:35,719 - experiment_functions - INFO - Early stopping at epoch 500. Best Metrics: (0.004578540176064786, 0.003683774834437086, 0.004666981431091035)
2026-05-23 22:56:35,813 - optuna.study.study - INFO - Trial 106 finished with values: [0.004578540176064786, 0.003683774834437086, 0.004666981431091035] and parameters: {'n_layers': 2, 'embedding_dim': 256, 'lr': 0.02669007517170644, 'lambda_val': 1.1148352472250892e-06, 'batch_size': 603, 'optimizer': 'Adam'}.
2026-05-23 22:56:42,667 - experiment_functions - INFO - Early stopping at epoch 550. Best Metrics: (0.018145601002460737, 0.006920529801324503, 0.015503595958733749)
2026-05-23 22:56:42,768 - optuna.study.study - INFO - Trial 107 finished with values: [0.018145601002460737, 0.006920529801324503, 0.015503595958733749] and parameters: {'n_layers': 2, 'embedding_dim': 128, 'lr': 0.0007742554383218026, 'lambda_val': 4.8991750764180146e-05, 'batch_size': 3705, 'optimizer': 'RMSprop'}.
2026-05-23 22:56:49,546 - experiment_functions - INFO - Early stopping at epoch 550. Best Metrics: (0.022763156263169698, 0.007110927152317881, 0.017201705031146278)
2026-05-23 22:56:49,689 - optuna.study.study - INFO - Trial 108 finished with values: [0.022763156263169698, 0.007110927152317881, 0.017201705031146278] and parameters: {'n_layers': 2, 'embedding_dim': 128, 'lr': 0.003241752579826309, 'lambda_val': 2.430474765536691e-05, 'batch_size': 1890, 'optimizer': 'Adam'}.
2026-05-23 22:56:55,809 - experiment_functions - INFO - Early stopping at epoch 500. Best Metrics: (0.005000887552432546, 0.004147350993377484, 0.005128705970011377)
2026-05-23 22:56:56,646 - optuna.study.study - INFO - Trial 109 finished with values: [0.005000887552432546, 0.004147350993377484, 0.005128705970011377] and parameters: {'n_layers': 1, 'embedding_dim': 64, 'lr': 0.00033654291553459676, 'lambda_val': 9.691061665067305e-06, 'batch_size': 3226, 'optimizer': 'SGD'}.
2026-05-23 22:57:03,643 - experiment_functions - INFO - Early stopping at epoch 600. Best Metrics: (0.005036152260720714, 0.004081125827814569, 0.005195036293115779)
2026-05-23 22:57:03,739 - optuna.study.study - INFO - Trial 110 finished with values: [0.005036152260720714, 0.004081125827814569, 0.005195036293115779] and parameters: {'n_layers': 1, 'embedding_dim': 64, 'lr': 3.7710700707953124e-05, 'lambda_val': 0.000783048776904608, 'batch_size': 627, 'optimizer': 'Adam'}.
2026-05-23 22:57:14,214 - experiment_functions - INFO - Early stopping at epoch 850. Best Metrics: (0.013133324352504853, 0.005149006622516557, 0.010008230356199535)
2026-05-23 22:57:14,376 - optuna.study.study - INFO - Trial 111 finished with values: [0.013133324352504853, 0.005149006622516557, 0.010008230356199535] and parameters: {'n_layers': 2, 'embedding_dim': 32, 'lr': 0.00038723708173308733, 'lambda_val': 0.00044072476163491587, 'batch_size': 3226, 'optimizer': 'Adam'}.
2026-05-23 22:57:21,359 - experiment_functions - INFO - Early stopping at epoch 550. Best Metrics: (0.009285929390695238, 0.003220198675496689, 0.005575831101895488)
2026-05-23 22:57:21,497 - optuna.study.study - INFO - Trial 112 finished with values: [0.009285929390695238, 0.003220198675496689, 0.005575831101895488] and parameters: {'n_layers': 1, 'embedding_dim': 128, 'lr': 0.02691251780056299, 'lambda_val': 1.7439980348390471e-06, 'batch_size': 3639, 'optimizer': 'Adam'}.
2026-05-23 22:57:28,886 - experiment_functions - INFO - Early stopping at epoch 600. Best Metrics: (0.009440190994623131, 0.004966887417218543, 0.008602095991815823)
2026-05-23 22:57:29,011 - optuna.study.study - INFO - Trial 113 finished with values: [0.009440190994623131, 0.004966887417218543, 0.008602095991815823] and parameters: {'n_layers': 4, 'embedding_dim': 96, 'lr': 0.0008027493612510268, 'lambda_val': 1.3393164785794325e-06, 'batch_size': 2206, 'optimizer': 'Adam'}.
2026-05-23 22:57:35,831 - experiment_functions - INFO - Early stopping at epoch 500. Best Metrics: (0.005084834125355804, 0.004172185430463576, 0.00510400487051749)
2026-05-23 22:57:35,933 - optuna.study.study - INFO - Trial 114 finished with values: [0.005084834125355804, 0.004172185430463576, 0.00510400487051749] and parameters: {'n_layers': 4, 'embedding_dim': 256, 'lr': 0.0047404185338547926, 'lambda_val': 4.246058277909158e-05, 'batch_size': 892, 'optimizer': 'Adam'}.
2026-05-23 22:57:43,666 - experiment_functions - INFO - Early stopping at epoch 550. Best Metrics: (0.00840174027252488, 0.004039735099337748, 0.006143740103853382)
2026-05-23 22:57:44,742 - optuna.study.study - INFO - Trial 115 finished with values: [0.00840174027252488, 0.004039735099337748, 0.006143740103853382] and parameters: {'n_layers': 4, 'embedding_dim': 256, 'lr': 0.003241752579826309, 'lambda_val': 4.246058277909158e-05, 'batch_size': 2949, 'optimizer': 'Adam'}.
2026-05-23 22:57:52,006 - experiment_functions - INFO - Early stopping at epoch 500. Best Metrics: (0.005626469732090908, 0.003899006622516557, 0.005239560428871878)
2026-05-23 22:57:52,098 - optuna.study.study - INFO - Trial 116 finished with values: [0.005626469732090908, 0.003899006622516557, 0.005239560428871878] and parameters: {'n_layers': 4, 'embedding_dim': 256, 'lr': 0.0019170109114511021, 'lambda_val': 0.014733197162368416, 'batch_size': 1956, 'optimizer': 'Adam'}.
2026-05-23 22:58:31,604 - optuna.study.study - INFO - Trial 117 finished with values: [0.024096729364495865, 0.007938741721854305, 0.02032299187083808] and parameters: {'n_layers': 1, 'embedding_dim': 32, 'lr': 0.0001575404982668674, 'lambda_val': 5.293319521753168e-06, 'batch_size': 2988, 'optimizer': 'RMSprop'}.
2026-05-23 22:59:02,512 - experiment_functions - INFO - Early stopping at epoch 2450. Best Metrics: (0.018992533286480578, 0.006829470198675497, 0.01498905989801472)
2026-05-23 22:59:02,959 - optuna.study.study - INFO - Trial 118 finished with values: [0.018992533286480578, 0.006829470198675497, 0.01498905989801472] and parameters: {'n_layers': 4, 'embedding_dim': 256, 'lr': 0.00011132803279953378, 'lambda_val': 3.136622296234252e-05, 'batch_size': 3705, 'optimizer': 'RMSprop'}.
2026-05-23 22:59:09,212 - experiment_functions - INFO - Early stopping at epoch 500. Best Metrics: (0.007154179433494919, 0.0038079470198675498, 0.0060452884881665395)
2026-05-23 22:59:09,641 - optuna.study.study - INFO - Trial 119 finished with values: [0.007154179433494919, 0.0038079470198675498, 0.0060452884881665395] and parameters: {'n_layers': 2, 'embedding_dim': 128, 'lr': 0.07509593355980354, 'lambda_val': 1.6221161102260363e-05, 'batch_size': 1817, 'optimizer': 'Adam'}.
2026-05-23 22:59:15,803 - experiment_functions - INFO - Early stopping at epoch 500. Best Metrics: (0.004819920689793391, 0.0037251655629139072, 0.004747501770643665)
2026-05-23 22:59:16,282 - optuna.study.study - INFO - Trial 120 finished with values: [0.004819920689793391, 0.0037251655629139072, 0.004747501770643665] and parameters: {'n_layers': 4, 'embedding_dim': 32, 'lr': 0.0062331306487161025, 'lambda_val': 1.285583991555478e-05, 'batch_size': 2988, 'optimizer': 'SGD'}.
2026-05-23 22:59:22,034 - experiment_functions - INFO - Early stopping at epoch 500. Best Metrics: (0.005740108810410784, 0.00435430463576159, 0.005574536831372585)
2026-05-23 22:59:22,413 - optuna.study.study - INFO - Trial 121 finished with values: [0.005740108810410784, 0.00435430463576159, 0.005574536831372585] and parameters: {'n_layers': 1, 'embedding_dim': 32, 'lr': 2.8627382130993375e-05, 'lambda_val': 5.293319521753168e-06, 'batch_size': 627, 'optimizer': 'RMSprop'}.
2026-05-23 22:59:31,055 - experiment_functions - INFO - Early stopping at epoch 700. Best Metrics: (0.017135708440513465, 0.006796357615894039, 0.014827977735361101)
2026-05-23 22:59:31,164 - optuna.study.study - INFO - Trial 122 finished with values: [0.017135708440513465, 0.006796357615894039, 0.014827977735361101] and parameters: {'n_layers': 4, 'embedding_dim': 128, 'lr': 0.0004485392810298456, 'lambda_val': 2.430474765536691e-05, 'batch_size': 603, 'optimizer': 'Adam'}.
2026-05-23 22:59:44,701 - experiment_functions - INFO - Early stopping at epoch 1100. Best Metrics: (0.017777868081505104, 0.006647350993377483, 0.015847245203565907)
2026-05-23 22:59:44,803 - optuna.study.study - INFO - Trial 123 finished with values: [0.017777868081505104, 0.006647350993377483, 0.015847245203565907] and parameters: {'n_layers': 2, 'embedding_dim': 256, 'lr': 0.00011132803279953378, 'lambda_val': 0.0028639996941338948, 'batch_size': 3705, 'optimizer': 'RMSprop'}.
