2026-05-24 05:18:58,003 - optuna.study.study - INFO - Trial 5 finished with values: [0.005364488060350711, 0.004213576158940397, 0.005398825073484777] and parameters: {'n_layers': 2, 'embedding_dim': 96, 'lr': 3.853890284485889e-05, 'lambda_val': 0.03418259321223303, 'batch_size': 3746, 'optimizer': 'RMSprop'}.
2026-05-24 05:19:04,741 - experiment_functions - INFO - Early stopping at epoch 550. Best Metrics: (0.015093194227358907, 0.010985099337748343, 0.014717482734475068)
2026-05-24 05:19:04,839 - optuna.study.study - INFO - Trial 6 finished with values: [0.015093194227358907, 0.010985099337748343, 0.014717482734475068] and parameters: {'n_layers': 1, 'embedding_dim': 256, 'lr': 0.0075729967336307024, 'lambda_val': 7.112074068161609e-06, 'batch_size': 1833, 'optimizer': 'Adam'}.
2026-05-24 05:19:11,392 - experiment_functions - INFO - Early stopping at epoch 550. Best Metrics: (0.013757119961140473, 0.010819536423841059, 0.013753864262453307)
2026-05-24 05:19:11,897 - optuna.study.study - INFO - Trial 7 finished with values: [0.013757119961140473, 0.010819536423841059, 0.013753864262453307] and parameters: {'n_layers': 2, 'embedding_dim': 256, 'lr': 0.014749507525991419, 'lambda_val': 1.823627061753692e-06, 'batch_size': 1049, 'optimizer': 'Adam'}.
2026-05-24 05:19:17,585 - experiment_functions - INFO - Early stopping at epoch 500. Best Metrics: (0.006139193784270304, 0.0045778145695364245, 0.005807639499970983)
2026-05-24 05:19:18,154 - optuna.study.study - INFO - Trial 8 finished with values: [0.006139193784270304, 0.0045778145695364245, 0.005807639499970983] and parameters: {'n_layers': 1, 'embedding_dim': 96, 'lr': 2.398718235617544e-05, 'lambda_val': 1.0136489220381389e-06, 'batch_size': 925, 'optimizer': 'SGD'}.
2026-05-24 05:19:24,683 - experiment_functions - INFO - Early stopping at epoch 550. Best Metrics: (0.011674039222881684, 0.008857615894039736, 0.01142219512821161)
2026-05-24 05:19:24,917 - optuna.study.study - INFO - Trial 9 finished with values: [0.011674039222881684, 0.008857615894039736, 0.01142219512821161] and parameters: {'n_layers': 3, 'embedding_dim': 64, 'lr': 0.08399718040285457, 'lambda_val': 3.854225178451463e-06, 'batch_size': 1815, 'optimizer': 'Adam'}.
2026-05-24 05:20:06,463 - optuna.study.study - INFO - Trial 10 finished with values: [0.005881186762773323, 0.004801324503311258, 0.00611589889580196] and parameters: {'n_layers': 2, 'embedding_dim': 96, 'lr': 2.6339785435109858e-05, 'lambda_val': 0.007620237155778278, 'batch_size': 1346, 'optimizer': 'RMSprop'}.
2026-05-24 05:20:13,448 - experiment_functions - INFO - Early stopping at epoch 500. Best Metrics: (0.004816243490565475, 0.0040562913907284765, 0.005158470230419693)
2026-05-24 05:20:13,904 - optuna.study.study - INFO - Trial 11 finished with values: [0.004816243490565475, 0.0040562913907284765, 0.005158470230419693] and parameters: {'n_layers': 3, 'embedding_dim': 256, 'lr': 0.00027673871514725777, 'lambda_val': 6.228992486003483e-06, 'batch_size': 3495, 'optimizer': 'SGD'}.
2026-05-24 05:20:24,297 - experiment_functions - INFO - Early stopping at epoch 900. Best Metrics: (0.015814274514821508, 0.012284768211920528, 0.016015751259072033)
2026-05-24 05:20:24,799 - optuna.study.study - INFO - Trial 12 finished with values: [0.015814274514821508, 0.012284768211920528, 0.016015751259072033] and parameters: {'n_layers': 2, 'embedding_dim': 256, 'lr': 0.0003788253863598979, 'lambda_val': 0.002110272822989257, 'batch_size': 2806, 'optimizer': 'RMSprop'}.
2026-05-24 05:20:30,548 - experiment_functions - INFO - Early stopping at epoch 500. Best Metrics: (0.005258037805723499, 0.004072847682119206, 0.005077082163897594)
2026-05-24 05:20:31,852 - optuna.study.study - INFO - Trial 13 finished with values: [0.005258037805723499, 0.004072847682119206, 0.005077082163897594] and parameters: {'n_layers': 2, 'embedding_dim': 32, 'lr': 0.0021499198540922532, 'lambda_val': 0.01832036668449495, 'batch_size': 1186, 'optimizer': 'SGD'}.
2026-05-24 05:20:39,369 - experiment_functions - INFO - Early stopping at epoch 550. Best Metrics: (0.009853759107793623, 0.007384105960264901, 0.009515787393720937)
2026-05-24 05:20:39,473 - optuna.study.study - INFO - Trial 14 finished with values: [0.009853759107793623, 0.007384105960264901, 0.009515787393720937] and parameters: {'n_layers': 4, 'embedding_dim': 256, 'lr': 0.08079653624912884, 'lambda_val': 1.65368303330965e-05, 'batch_size': 2624, 'optimizer': 'RMSprop'}.
2026-05-24 05:21:16,209 - optuna.study.study - INFO - Trial 15 finished with values: [0.008444233955085418, 0.006473509933774835, 0.008162740419205405] and parameters: {'n_layers': 1, 'embedding_dim': 64, 'lr': 3.728451255441807e-05, 'lambda_val': 0.0002702283536384827, 'batch_size': 4091, 'optimizer': 'RMSprop'}.
2026-05-24 05:21:22,558 - experiment_functions - INFO - Early stopping at epoch 550. Best Metrics: (0.01195659262466258, 0.009735099337748344, 0.012175939936625177)
2026-05-24 05:21:22,970 - optuna.study.study - INFO - Trial 16 finished with values: [0.01195659262466258, 0.009735099337748344, 0.012175939936625177] and parameters: {'n_layers': 1, 'embedding_dim': 96, 'lr': 0.03904827819087328, 'lambda_val': 2.2231917179944917e-06, 'batch_size': 2578, 'optimizer': 'RMSprop'}.
2026-05-24 05:21:29,455 - experiment_functions - INFO - Early stopping at epoch 550. Best Metrics: (0.01664958635325686, 0.011920529801324504, 0.016299704451188165)
2026-05-24 05:21:29,878 - optuna.study.study - INFO - Trial 17 finished with values: [0.01664958635325686, 0.011920529801324504, 0.016299704451188165] and parameters: {'n_layers': 1, 'embedding_dim': 64, 'lr': 0.007122747338051435, 'lambda_val': 0.00012012014373753211, 'batch_size': 2341, 'optimizer': 'RMSprop'}.
2026-05-24 05:21:36,724 - experiment_functions - INFO - Early stopping at epoch 550. Best Metrics: (0.018032193540391234, 0.012442052980132451, 0.01782979955331661)
2026-05-24 05:21:37,650 - optuna.study.study - INFO - Trial 18 finished with values: [0.018032193540391234, 0.012442052980132451, 0.01782979955331661] and parameters: {'n_layers': 1, 'embedding_dim': 96, 'lr': 0.00567629368896096, 'lambda_val': 9.854265988535646e-05, 'batch_size': 2492, 'optimizer': 'Adam'}.
2026-05-24 05:21:46,859 - experiment_functions - INFO - Early stopping at epoch 500. Best Metrics: (0.005089970113378619, 0.004031456953642384, 0.005093672768050702)
2026-05-24 05:21:47,065 - optuna.study.study - INFO - Trial 19 finished with values: [0.005089970113378619, 0.004031456953642384, 0.005093672768050702] and parameters: {'n_layers': 4, 'embedding_dim': 128, 'lr': 4.47562055737878e-05, 'lambda_val': 0.00014795949579654336, 'batch_size': 3988, 'optimizer': 'SGD'}.
2026-05-24 05:22:02,651 - experiment_functions - INFO - Early stopping at epoch 1450. Best Metrics: (0.023872680811920146, 0.017508278145695364, 0.02354157805829324)
2026-05-24 05:22:02,741 - optuna.study.study - INFO - Trial 20 finished with values: [0.023872680811920146, 0.017508278145695364, 0.02354157805829324] and parameters: {'n_layers': 2, 'embedding_dim': 32, 'lr': 0.0004890104603780292, 'lambda_val': 0.09383228839891232, 'batch_size': 2716, 'optimizer': 'Adam'}.
2026-05-24 05:22:09,348 - experiment_functions - INFO - Early stopping at epoch 550. Best Metrics: (0.01591702299211956, 0.011481788079470198, 0.01570233466762609)
2026-05-24 05:22:09,446 - optuna.study.study - INFO - Trial 21 finished with values: [0.01591702299211956, 0.011481788079470198, 0.01570233466762609] and parameters: {'n_layers': 1, 'embedding_dim': 128, 'lr': 0.001958850765144938, 'lambda_val': 2.9428916086760435e-06, 'batch_size': 3671, 'optimizer': 'RMSprop'}.
2026-05-24 05:22:21,218 - experiment_functions - INFO - Early stopping at epoch 1150. Best Metrics: (0.005068069086069718, 0.0038990066225165565, 0.00510798941924704)
2026-05-24 05:22:21,307 - optuna.study.study - INFO - Trial 22 finished with values: [0.005068069086069718, 0.0038990066225165565, 0.00510798941924704] and parameters: {'n_layers': 1, 'embedding_dim': 96, 'lr': 0.00705280266148392, 'lambda_val': 0.0004392445691257908, 'batch_size': 2573, 'optimizer': 'SGD'}.
2026-05-24 05:22:27,459 - experiment_functions - INFO - Early stopping at epoch 500. Best Metrics: (0.010467504809814886, 0.007483443708609272, 0.010366374481673346)
2026-05-24 05:22:27,903 - optuna.study.study - INFO - Trial 23 finished with values: [0.010467504809814886, 0.007483443708609272, 0.010366374481673346] and parameters: {'n_layers': 4, 'embedding_dim': 64, 'lr': 0.03585232036494216, 'lambda_val': 0.0004073525692499843, 'batch_size': 1056, 'optimizer': 'RMSprop'}.
2026-05-24 05:22:34,000 - experiment_functions - INFO - Early stopping at epoch 500. Best Metrics: (0.008782974009912523, 0.0069784768211920535, 0.009489100516942817)
2026-05-24 05:22:34,690 - optuna.study.study - INFO - Trial 24 finished with values: [0.008782974009912523, 0.0069784768211920535, 0.009489100516942817] and parameters: {'n_layers': 4, 'embedding_dim': 128, 'lr': 0.009667197874531769, 'lambda_val': 0.00039316400466458875, 'batch_size': 1612, 'optimizer': 'RMSprop'}.
2026-05-24 05:22:40,784 - experiment_functions - INFO - Early stopping at epoch 500. Best Metrics: (0.0051402568526783075, 0.004205298013245033, 0.005252008001496735)
2026-05-24 05:22:40,875 - optuna.study.study - INFO - Trial 25 finished with values: [0.0051402568526783075, 0.004205298013245033, 0.005252008001496735] and parameters: {'n_layers': 2, 'embedding_dim': 128, 'lr': 1.1553842940197404e-05, 'lambda_val': 2.635197951896229e-05, 'batch_size': 1899, 'optimizer': 'SGD'}.
2026-05-24 05:22:47,300 - experiment_functions - INFO - Early stopping at epoch 500. Best Metrics: (0.0048347391886198535, 0.004387417218543047, 0.005249935322892182)
2026-05-24 05:22:47,883 - optuna.study.study - INFO - Trial 26 finished with values: [0.0048347391886198535, 0.004387417218543047, 0.005249935322892182] and parameters: {'n_layers': 1, 'embedding_dim': 96, 'lr': 0.00017696117021219715, 'lambda_val': 8.564158503809343e-06, 'batch_size': 1192, 'optimizer': 'SGD'}.
2026-05-24 05:22:53,982 - experiment_functions - INFO - Early stopping at epoch 500. Best Metrics: (0.0047188299352550755, 0.0038990066225165565, 0.0049915913492957036)
2026-05-24 05:22:54,107 - optuna.study.study - INFO - Trial 27 finished with values: [0.0047188299352550755, 0.0038990066225165565, 0.0049915913492957036] and parameters: {'n_layers': 3, 'embedding_dim': 32, 'lr': 0.0017239347411488065, 'lambda_val': 9.666860474995647e-05, 'batch_size': 3290, 'optimizer': 'SGD'}.
2026-05-24 05:23:02,845 - experiment_functions - INFO - Early stopping at epoch 800. Best Metrics: (0.0045681310036802545, 0.00412251655629139, 0.005131074338118617)
2026-05-24 05:23:02,939 - optuna.study.study - INFO - Trial 28 finished with values: [0.0045681310036802545, 0.00412251655629139, 0.005131074338118617] and parameters: {'n_layers': 1, 'embedding_dim': 64, 'lr': 0.023302562696386038, 'lambda_val': 0.01617811760264484, 'batch_size': 3737, 'optimizer': 'SGD'}.
2026-05-24 05:23:10,802 - experiment_functions - INFO - Early stopping at epoch 550. Best Metrics: (0.01467106760658624, 0.010943708609271522, 0.014997404660247274)
2026-05-24 05:23:12,817 - optuna.study.study - INFO - Trial 29 finished with values: [0.01467106760658624, 0.010943708609271522, 0.014997404660247274] and parameters: {'n_layers': 1, 'embedding_dim': 128, 'lr': 0.0030329118790764138, 'lambda_val': 5.786389915206107e-05, 'batch_size': 3637, 'optimizer': 'RMSprop'}.
2026-05-24 05:23:24,910 - experiment_functions - INFO - Early stopping at epoch 550. Best Metrics: (0.013284739713273947, 0.010124172185430465, 0.01322182458590634)
2026-05-24 05:23:25,001 - optuna.study.study - INFO - Trial 30 finished with values: [0.013284739713273947, 0.010124172185430465, 0.01322182458590634] and parameters: {'n_layers': 1, 'embedding_dim': 256, 'lr': 0.01915493938891934, 'lambda_val': 0.00012823292249037775, 'batch_size': 3377, 'optimizer': 'Adam'}.
2026-05-24 05:23:32,142 - experiment_functions - INFO - Early stopping at epoch 550. Best Metrics: (0.01090468899536234, 0.00880794701986755, 0.01062893028851778)
2026-05-24 05:23:32,230 - optuna.study.study - INFO - Trial 31 finished with values: [0.01090468899536234, 0.00880794701986755, 0.01062893028851778] and parameters: {'n_layers': 3, 'embedding_dim': 256, 'lr': 0.05515736918516321, 'lambda_val': 3.999264894332394e-05, 'batch_size': 1575, 'optimizer': 'Adam'}.
2026-05-24 05:23:38,968 - experiment_functions - INFO - Early stopping at epoch 550. Best Metrics: (0.013525462626817418, 0.011051324503311259, 0.013627491535400557)
2026-05-24 05:23:39,051 - optuna.study.study - INFO - Trial 32 finished with values: [0.013525462626817418, 0.011051324503311259, 0.013627491535400557] and parameters: {'n_layers': 3, 'embedding_dim': 96, 'lr': 0.007172665906737051, 'lambda_val': 1.2569597282205344e-05, 'batch_size': 687, 'optimizer': 'RMSprop'}.
2026-05-24 05:23:49,608 - experiment_functions - INFO - Early stopping at epoch 1000. Best Metrics: (0.005962625663214391, 0.004362582781456954, 0.005608669460675505)
2026-05-24 05:23:49,704 - optuna.study.study - INFO - Trial 33 finished with values: [0.005962625663214391, 0.004362582781456954, 0.005608669460675505] and parameters: {'n_layers': 2, 'embedding_dim': 96, 'lr': 0.018727811950668527, 'lambda_val': 4.299922063442575e-05, 'batch_size': 1548, 'optimizer': 'SGD'}.
2026-05-24 05:23:55,923 - experiment_functions - INFO - Early stopping at epoch 500. Best Metrics: (0.00745606709869352, 0.005927152317880795, 0.00784458723441009)
2026-05-24 05:23:56,032 - optuna.study.study - INFO - Trial 34 finished with values: [0.00745606709869352, 0.005927152317880795, 0.00784458723441009] and parameters: {'n_layers': 3, 'embedding_dim': 96, 'lr': 0.00710351647147223, 'lambda_val': 0.00790162847267363, 'batch_size': 3708, 'optimizer': 'RMSprop'}.
2026-05-24 05:24:02,006 - experiment_functions - INFO - Early stopping at epoch 500. Best Metrics: (0.004950239520574412, 0.004172185430463576, 0.0052435030050220245)
2026-05-24 05:24:02,145 - optuna.study.study - INFO - Trial 35 finished with values: [0.004950239520574412, 0.004172185430463576, 0.0052435030050220245] and parameters: {'n_layers': 4, 'embedding_dim': 96, 'lr': 0.001136165578538667, 'lambda_val': 0.015286805243955792, 'batch_size': 1049, 'optimizer': 'SGD'}.
2026-05-24 05:24:12,545 - experiment_functions - INFO - Early stopping at epoch 950. Best Metrics: (0.005777075928554027, 0.006001655629139073, 0.0070187080366671)
2026-05-24 05:24:13,505 - optuna.study.study - INFO - Trial 36 finished with values: [0.005777075928554027, 0.006001655629139073, 0.0070187080366671] and parameters: {'n_layers': 1, 'embedding_dim': 32, 'lr': 0.022086031826130448, 'lambda_val': 0.06457517149861002, 'batch_size': 3065, 'optimizer': 'RMSprop'}.
2026-05-24 05:24:20,128 - experiment_functions - INFO - Early stopping at epoch 500. Best Metrics: (0.007986684114938228, 0.006713576158940398, 0.008545634608498298)
2026-05-24 05:24:20,230 - optuna.study.study - INFO - Trial 37 finished with values: [0.007986684114938228, 0.006713576158940398, 0.008545634608498298] and parameters: {'n_layers': 4, 'embedding_dim': 256, 'lr': 0.05485144580646257, 'lambda_val': 0.0137855947269666, 'batch_size': 1956, 'optimizer': 'RMSprop'}.
2026-05-24 05:24:30,588 - experiment_functions - INFO - Early stopping at epoch 500. Best Metrics: (0.004886437277792698, 0.004072847682119206, 0.005396127953524002)
2026-05-24 05:24:31,459 - optuna.study.study - INFO - Trial 38 finished with values: [0.004886437277792698, 0.004072847682119206, 0.005396127953524002] and parameters: {'n_layers': 4, 'embedding_dim': 128, 'lr': 0.032344887687467384, 'lambda_val': 0.013246418422740342, 'batch_size': 2567, 'optimizer': 'Adam'}.
2026-05-24 05:24:43,043 - experiment_functions - INFO - Early stopping at epoch 500. Best Metrics: (0.005981223385290311, 0.00435430463576159, 0.005868091283660837)
2026-05-24 05:24:43,288 - optuna.study.study - INFO - Trial 39 finished with values: [0.005981223385290311, 0.00435430463576159, 0.005868091283660837] and parameters: {'n_layers': 4, 'embedding_dim': 32, 'lr': 1.2829997692043829e-05, 'lambda_val': 1.0526149372432598e-06, 'batch_size': 2044, 'optimizer': 'SGD'}.
2026-05-24 05:24:49,914 - experiment_functions - INFO - Early stopping at epoch 550. Best Metrics: (0.010748097466009836, 0.009130794701986755, 0.011116868193979895)
2026-05-24 05:24:50,657 - optuna.study.study - INFO - Trial 40 finished with values: [0.010748097466009836, 0.009130794701986755, 0.011116868193979895] and parameters: {'n_layers': 2, 'embedding_dim': 64, 'lr': 0.018368346101023367, 'lambda_val': 0.0034547045843847037, 'batch_size': 2223, 'optimizer': 'Adam'}.
2026-05-24 05:24:57,620 - experiment_functions - INFO - Early stopping at epoch 550. Best Metrics: (0.013293016790101933, 0.010587748344370861, 0.013846935080866245)
2026-05-24 05:24:57,738 - optuna.study.study - INFO - Trial 41 finished with values: [0.013293016790101933, 0.010587748344370861, 0.013846935080866245] and parameters: {'n_layers': 2, 'embedding_dim': 256, 'lr': 0.0033498782435460272, 'lambda_val': 2.9809066173301263e-06, 'batch_size': 3706, 'optimizer': 'Adam'}.
2026-05-24 05:25:03,724 - experiment_functions - INFO - Early stopping at epoch 500. Best Metrics: (0.005279481531009961, 0.00423841059602649, 0.005376943130187084)
2026-05-24 05:25:04,619 - optuna.study.study - INFO - Trial 42 finished with values: [0.005279481531009961, 0.00423841059602649, 0.005376943130187084] and parameters: {'n_layers': 2, 'embedding_dim': 32, 'lr': 4.365827900239813e-05, 'lambda_val': 0.0518729676725349, 'batch_size': 2047, 'optimizer': 'Adam'}.
2026-05-24 05:25:11,063 - experiment_functions - INFO - Early stopping at epoch 500. Best Metrics: (0.00837871648420801, 0.0065728476821192055, 0.008224767920672102)
2026-05-24 05:25:11,180 - optuna.study.study - INFO - Trial 43 finished with values: [0.00837871648420801, 0.0065728476821192055, 0.008224767920672102] and parameters: {'n_layers': 2, 'embedding_dim': 256, 'lr': 0.049259468147439145, 'lambda_val': 0.004830254272011785, 'batch_size': 3072, 'optimizer': 'RMSprop'}.
2026-05-24 05:25:17,426 - experiment_functions - INFO - Early stopping at epoch 500. Best Metrics: (0.009616317861064634, 0.007541390728476821, 0.009785664227332016)
2026-05-24 05:25:18,512 - optuna.study.study - INFO - Trial 44 finished with values: [0.009616317861064634, 0.007541390728476821, 0.009785664227332016] and parameters: {'n_layers': 3, 'embedding_dim': 128, 'lr': 0.03287981994998895, 'lambda_val': 0.0002194072461538245, 'batch_size': 1834, 'optimizer': 'RMSprop'}.
2026-05-24 05:25:25,257 - experiment_functions - INFO - Early stopping at epoch 550. Best Metrics: (0.014113325407198006, 0.010273178807947021, 0.013453188606066292)
2026-05-24 05:25:25,503 - optuna.study.study - INFO - Trial 45 finished with values: [0.014113325407198006, 0.010273178807947021, 0.013453188606066292] and parameters: {'n_layers': 1, 'embedding_dim': 256, 'lr': 0.0034008688244003345, 'lambda_val': 3.1472646005870695e-06, 'batch_size': 2651, 'optimizer': 'RMSprop'}.
2026-05-24 05:25:32,605 - experiment_functions - INFO - Early stopping at epoch 600. Best Metrics: (0.01705756685799062, 0.013394039735099339, 0.0180576633092089)
2026-05-24 05:25:32,743 - optuna.study.study - INFO - Trial 46 finished with values: [0.01705756685799062, 0.013394039735099339, 0.0180576633092089] and parameters: {'n_layers': 3, 'embedding_dim': 64, 'lr': 0.004512010550703536, 'lambda_val': 0.0028168727253759383, 'batch_size': 1264, 'optimizer': 'Adam'}.
2026-05-24 05:26:11,519 - optuna.study.study - INFO - Trial 47 finished with values: [0.009421491872948473, 0.0070943708609271525, 0.009442826436062807] and parameters: {'n_layers': 1, 'embedding_dim': 32, 'lr': 8.214658834373145e-05, 'lambda_val': 0.007220871902486167, 'batch_size': 1976, 'optimizer': 'Adam'}.
2026-05-24 05:26:18,130 - experiment_functions - INFO - Early stopping at epoch 550. Best Metrics: (0.02085241370676186, 0.014577814569536423, 0.020704152308306304)
2026-05-24 05:26:18,622 - optuna.study.study - INFO - Trial 48 finished with values: [0.02085241370676186, 0.014577814569536423, 0.020704152308306304] and parameters: {'n_layers': 2, 'embedding_dim': 32, 'lr': 0.0037147017870386746, 'lambda_val': 2.1355760438149747e-05, 'batch_size': 542, 'optimizer': 'RMSprop'}.
2026-05-24 05:26:29,882 - experiment_functions - INFO - Early stopping at epoch 1050. Best Metrics: (0.004879076348240872, 0.003965231788079471, 0.0050420126106782695)
2026-05-24 05:26:30,832 - optuna.study.study - INFO - Trial 49 finished with values: [0.004879076348240872, 0.003965231788079471, 0.0050420126106782695] and parameters: {'n_layers': 3, 'embedding_dim': 96, 'lr': 0.06910446281372522, 'lambda_val': 2.8552441050810166e-06, 'batch_size': 1536, 'optimizer': 'SGD'}.
2026-05-24 05:26:52,349 - experiment_functions - INFO - Early stopping at epoch 1400. Best Metrics: (0.017028889764108227, 0.015124172185430468, 0.01873803045701114)
2026-05-24 05:26:53,352 - optuna.study.study - INFO - Trial 50 finished with values: [0.017028889764108227, 0.015124172185430468, 0.01873803045701114] and parameters: {'n_layers': 4, 'embedding_dim': 256, 'lr': 0.00018164145276986003, 'lambda_val': 0.010248606541800688, 'batch_size': 2144, 'optimizer': 'RMSprop'}.
2026-05-24 05:27:00,204 - experiment_functions - INFO - Early stopping at epoch 600. Best Metrics: (0.00484906608147151, 0.004031456953642384, 0.005101628015867961)
