2026-05-24 17:12:14,927 - optuna.study.study - INFO - Trial 59 finished with values: [0.005126045920168059, 0.004337748344370861, 0.005528529917565511] and parameters: {'n_layers': 4, 'embedding_dim': 64, 'lr': 3.5791019489543236e-05, 'lambda_val': 3.6969968978713284e-06, 'batch_size': 2008, 'optimizer': 'SGD'}.
2026-05-24 17:12:56,652 - optuna.study.study - INFO - Trial 60 finished with values: [0.0210610426259535, 0.014528145695364238, 0.021110938529886627] and parameters: {'n_layers': 1, 'embedding_dim': 32, 'lr': 0.00028561429900097026, 'lambda_val': 3.425227104917456e-05, 'batch_size': 3024, 'optimizer': 'RMSprop'}.
2026-05-24 17:13:02,551 - experiment_functions - INFO - Early stopping at epoch 500. Best Metrics: (0.00510423504915314, 0.004254966887417219, 0.005262413931104538)
2026-05-24 17:13:03,022 - optuna.study.study - INFO - Trial 61 finished with values: [0.00510423504915314, 0.004254966887417219, 0.005262413931104538] and parameters: {'n_layers': 2, 'embedding_dim': 96, 'lr': 1.993933394974126e-05, 'lambda_val': 0.0712753228725955, 'batch_size': 2749, 'optimizer': 'RMSprop'}.
2026-05-24 17:13:10,077 - experiment_functions - INFO - Early stopping at epoch 550. Best Metrics: (0.021597922789536074, 0.01695364238410596, 0.022431261751743405)
2026-05-24 17:13:10,162 - optuna.study.study - INFO - Trial 62 finished with values: [0.021597922789536074, 0.01695364238410596, 0.022431261751743405] and parameters: {'n_layers': 4, 'embedding_dim': 128, 'lr': 0.00411385889676726, 'lambda_val': 4.639541424555153e-06, 'batch_size': 2807, 'optimizer': 'Adam'}.
2026-05-24 17:13:54,956 - optuna.study.study - INFO - Trial 63 finished with values: [0.020356433705057665, 0.013360927152317879, 0.01953541145060042] and parameters: {'n_layers': 1, 'embedding_dim': 32, 'lr': 0.0002426099667536793, 'lambda_val': 0.00021418658580850628, 'batch_size': 3429, 'optimizer': 'RMSprop'}.
2026-05-24 17:14:02,079 - experiment_functions - INFO - Early stopping at epoch 550. Best Metrics: (0.008013967526752324, 0.007235099337748345, 0.008753873395261222)
2026-05-24 17:14:02,393 - optuna.study.study - INFO - Trial 64 finished with values: [0.008013967526752324, 0.007235099337748345, 0.008753873395261222] and parameters: {'n_layers': 4, 'embedding_dim': 64, 'lr': 0.02393707083593118, 'lambda_val': 0.0005177493901631796, 'batch_size': 2196, 'optimizer': 'Adam'}.
2026-05-24 17:14:09,167 - experiment_functions - INFO - Early stopping at epoch 500. Best Metrics: (0.009868116292074208, 0.0074917218543046355, 0.009997248898670277)
2026-05-24 17:14:10,208 - optuna.study.study - INFO - Trial 65 finished with values: [0.009868116292074208, 0.0074917218543046355, 0.009997248898670277] and parameters: {'n_layers': 4, 'embedding_dim': 128, 'lr': 0.012203428335465949, 'lambda_val': 1.1259762285821162e-05, 'batch_size': 1565, 'optimizer': 'RMSprop'}.
2026-05-24 17:14:53,956 - optuna.study.study - INFO - Trial 66 finished with values: [0.017783060050001215, 0.012624172185430464, 0.018000343148707965] and parameters: {'n_layers': 1, 'embedding_dim': 96, 'lr': 0.0003156053277132074, 'lambda_val': 0.001164130600275734, 'batch_size': 682, 'optimizer': 'Adam'}.
2026-05-24 17:15:01,580 - experiment_functions - INFO - Early stopping at epoch 600. Best Metrics: (0.014410693721904459, 0.011448675496688742, 0.014653664967866683)
2026-05-24 17:15:01,670 - optuna.study.study - INFO - Trial 67 finished with values: [0.014410693721904459, 0.011448675496688742, 0.014653664967866683] and parameters: {'n_layers': 1, 'embedding_dim': 96, 'lr': 0.0024421865435223515, 'lambda_val': 0.015164958999521902, 'batch_size': 682, 'optimizer': 'RMSprop'}.
2026-05-24 17:15:09,088 - experiment_functions - INFO - Early stopping at epoch 550. Best Metrics: (0.015566328246264914, 0.013352649006622518, 0.016678558287657075)
2026-05-24 17:15:10,314 - optuna.study.study - INFO - Trial 68 finished with values: [0.015566328246264914, 0.013352649006622518, 0.016678558287657075] and parameters: {'n_layers': 4, 'embedding_dim': 128, 'lr': 0.0065618298710489005, 'lambda_val': 0.00011364672917450008, 'batch_size': 3115, 'optimizer': 'Adam'}.
2026-05-24 17:15:55,207 - optuna.study.study - INFO - Trial 69 finished with values: [0.020138573149115883, 0.01517384105960265, 0.02128566991036019] and parameters: {'n_layers': 2, 'embedding_dim': 96, 'lr': 0.0002692346266435404, 'lambda_val': 0.001164130600275734, 'batch_size': 559, 'optimizer': 'Adam'}.
2026-05-24 17:16:02,342 - experiment_functions - INFO - Early stopping at epoch 550. Best Metrics: (0.015298057209396454, 0.01367549668874172, 0.016849976702500328)
2026-05-24 17:16:02,429 - optuna.study.study - INFO - Trial 70 finished with values: [0.015298057209396454, 0.01367549668874172, 0.016849976702500328] and parameters: {'n_layers': 3, 'embedding_dim': 96, 'lr': 0.012203428335465949, 'lambda_val': 9.827775235361319e-05, 'batch_size': 1565, 'optimizer': 'Adam'}.
2026-05-24 17:16:10,710 - experiment_functions - INFO - Early stopping at epoch 650. Best Metrics: (0.017972008045459797, 0.015720198675496688, 0.018772041585138875)
2026-05-24 17:16:11,542 - optuna.study.study - INFO - Trial 71 finished with values: [0.017972008045459797, 0.015720198675496688, 0.018772041585138875] and parameters: {'n_layers': 3, 'embedding_dim': 96, 'lr': 0.0009577842166100019, 'lambda_val': 0.0712753228725955, 'batch_size': 1209, 'optimizer': 'RMSprop'}.
2026-05-24 17:16:18,861 - experiment_functions - INFO - Early stopping at epoch 550. Best Metrics: (0.00917210059243319, 0.007392384105960266, 0.009175017718524862)
2026-05-24 17:16:18,952 - optuna.study.study - INFO - Trial 72 finished with values: [0.00917210059243319, 0.007392384105960266, 0.009175017718524862] and parameters: {'n_layers': 3, 'embedding_dim': 96, 'lr': 0.05519756921645756, 'lambda_val': 4.630487880914724e-05, 'batch_size': 3093, 'optimizer': 'RMSprop'}.
2026-05-24 17:17:03,514 - optuna.study.study - INFO - Trial 73 finished with values: [0.007166133902286425, 0.0058195364238410605, 0.007521402683403856] and parameters: {'n_layers': 4, 'embedding_dim': 96, 'lr': 3.936600232228081e-05, 'lambda_val': 0.002426571205869054, 'batch_size': 1752, 'optimizer': 'Adam'}.
2026-05-24 17:17:09,806 - experiment_functions - INFO - Early stopping at epoch 500. Best Metrics: (0.004964109886546613, 0.004006622516556292, 0.004930931526747859)
2026-05-24 17:17:09,889 - optuna.study.study - INFO - Trial 74 finished with values: [0.004964109886546613, 0.004006622516556292, 0.004930931526747859] and parameters: {'n_layers': 1, 'embedding_dim': 64, 'lr': 0.0024421865435223515, 'lambda_val': 0.015164958999521902, 'batch_size': 2302, 'optimizer': 'SGD'}.
2026-05-24 17:17:18,302 - experiment_functions - INFO - Early stopping at epoch 650. Best Metrics: (0.016533614387726697, 0.015480132450331125, 0.018402868016660967)
2026-05-24 17:17:18,377 - optuna.study.study - INFO - Trial 75 finished with values: [0.016533614387726697, 0.015480132450331125, 0.018402868016660967] and parameters: {'n_layers': 2, 'embedding_dim': 256, 'lr': 0.0009577842166100019, 'lambda_val': 0.0712753228725955, 'batch_size': 1909, 'optimizer': 'RMSprop'}.
2026-05-24 17:17:25,826 - experiment_functions - INFO - Early stopping at epoch 550. Best Metrics: (0.02073675404816451, 0.016316225165562914, 0.021832385098179623)
2026-05-24 17:17:25,926 - optuna.study.study - INFO - Trial 76 finished with values: [0.02073675404816451, 0.016316225165562914, 0.021832385098179623] and parameters: {'n_layers': 4, 'embedding_dim': 64, 'lr': 0.00411385889676726, 'lambda_val': 2.3974044149892758e-05, 'batch_size': 3774, 'optimizer': 'Adam'}.
2026-05-24 17:17:34,048 - experiment_functions - INFO - Early stopping at epoch 500. Best Metrics: (0.005007313392432718, 0.00423841059602649, 0.005389131225575069)
2026-05-24 17:17:35,066 - optuna.study.study - INFO - Trial 77 finished with values: [0.005007313392432718, 0.00423841059602649, 0.005389131225575069] and parameters: {'n_layers': 4, 'embedding_dim': 128, 'lr': 0.0024421865435223515, 'lambda_val': 1.1259762285821162e-05, 'batch_size': 2355, 'optimizer': 'SGD'}.
2026-05-24 17:17:51,580 - experiment_functions - INFO - Early stopping at epoch 900. Best Metrics: (0.01853135379969572, 0.014329470198675498, 0.018883053205724636)
2026-05-24 17:17:52,332 - optuna.study.study - INFO - Trial 78 finished with values: [0.01853135379969572, 0.014329470198675498, 0.018883053205724636] and parameters: {'n_layers': 1, 'embedding_dim': 128, 'lr': 0.0013380689464122827, 'lambda_val': 1.984739363175094e-06, 'batch_size': 2196, 'optimizer': 'Adam'}.
2026-05-24 17:17:59,491 - experiment_functions - INFO - Early stopping at epoch 550. Best Metrics: (0.01045137006440417, 0.010190397350993377, 0.01174936358905079)
2026-05-24 17:17:59,578 - optuna.study.study - INFO - Trial 79 finished with values: [0.01045137006440417, 0.010190397350993377, 0.01174936358905079] and parameters: {'n_layers': 3, 'embedding_dim': 128, 'lr': 0.0065618298710489005, 'lambda_val': 0.03155276903145698, 'batch_size': 3115, 'optimizer': 'Adam'}.
2026-05-24 17:18:45,914 - optuna.study.study - INFO - Trial 80 finished with values: [0.008925762869735732, 0.007408940397350993, 0.010046290577678427] and parameters: {'n_layers': 4, 'embedding_dim': 32, 'lr': 5.3171398873209266e-05, 'lambda_val': 0.004736943587584437, 'batch_size': 4048, 'optimizer': 'Adam'}.
2026-05-24 17:18:52,249 - experiment_functions - INFO - Early stopping at epoch 500. Best Metrics: (0.0065513279021308345, 0.005397350993377485, 0.006932895071847789)
2026-05-24 17:18:53,335 - optuna.study.study - INFO - Trial 81 finished with values: [0.0065513279021308345, 0.005397350993377485, 0.006932895071847789] and parameters: {'n_layers': 3, 'embedding_dim': 64, 'lr': 0.05519756921645756, 'lambda_val': 0.0029351170469678754, 'batch_size': 1132, 'optimizer': 'Adam'}.
2026-05-24 17:18:59,917 - experiment_functions - INFO - Early stopping at epoch 500. Best Metrics: (0.004638147029949491, 0.003816225165562914, 0.0047486402105250715)
2026-05-24 17:19:00,011 - optuna.study.study - INFO - Trial 82 finished with values: [0.004638147029949491, 0.003816225165562914, 0.0047486402105250715] and parameters: {'n_layers': 4, 'embedding_dim': 64, 'lr': 0.0013380689464122827, 'lambda_val': 1.984739363175094e-06, 'batch_size': 2196, 'optimizer': 'SGD'}.
2026-05-24 17:19:36,169 - experiment_functions - INFO - Early stopping at epoch 3450. Best Metrics: (0.005400446224187838, 0.00451158940397351, 0.005712348366025801)
2026-05-24 17:19:36,262 - optuna.study.study - INFO - Trial 83 finished with values: [0.005400446224187838, 0.00451158940397351, 0.005712348366025801] and parameters: {'n_layers': 1, 'embedding_dim': 32, 'lr': 1.150025240693646e-05, 'lambda_val': 0.0017669509061896686, 'batch_size': 775, 'optimizer': 'RMSprop'}.
2026-05-24 17:20:21,320 - optuna.study.study - INFO - Trial 84 finished with values: [0.012652479394873588, 0.009486754966887417, 0.012712478754502774] and parameters: {'n_layers': 2, 'embedding_dim': 256, 'lr': 0.0001259140473367841, 'lambda_val': 0.0020230580830565862, 'batch_size': 720, 'optimizer': 'RMSprop'}.
2026-05-24 17:21:06,197 - optuna.study.study - INFO - Trial 85 finished with values: [0.022098804334017123, 0.016481788079470202, 0.023085838820704026] and parameters: {'n_layers': 2, 'embedding_dim': 96, 'lr': 0.0003156053277132074, 'lambda_val': 0.00017211939323660374, 'batch_size': 559, 'optimizer': 'Adam'}.
2026-05-24 17:21:15,348 - experiment_functions - INFO - Early stopping at epoch 700. Best Metrics: (0.02133865437032678, 0.0168294701986755, 0.022295960191503816)
2026-05-24 17:21:15,443 - optuna.study.study - INFO - Trial 86 finished with values: [0.02133865437032678, 0.0168294701986755, 0.022295960191503816] and parameters: {'n_layers': 2, 'embedding_dim': 256, 'lr': 0.0009577842166100019, 'lambda_val': 4.630487880914724e-05, 'batch_size': 1209, 'optimizer': 'RMSprop'}.
2026-05-24 17:21:29,853 - experiment_functions - INFO - Early stopping at epoch 1250. Best Metrics: (0.009616558791941135, 0.0097682119205298, 0.011736112423325774)
2026-05-24 17:21:30,152 - optuna.study.study - INFO - Trial 87 finished with values: [0.009616558791941135, 0.0097682119205298, 0.011736112423325774] and parameters: {'n_layers': 1, 'embedding_dim': 256, 'lr': 0.0009577842166100019, 'lambda_val': 0.0712753228725955, 'batch_size': 859, 'optimizer': 'RMSprop'}.
2026-05-24 17:21:40,457 - experiment_functions - INFO - Early stopping at epoch 800. Best Metrics: (0.024803361081009428, 0.019950331125827815, 0.025442477129366845)
2026-05-24 17:21:40,664 - optuna.study.study - INFO - Trial 88 finished with values: [0.024803361081009428, 0.019950331125827815, 0.025442477129366845] and parameters: {'n_layers': 4, 'embedding_dim': 32, 'lr': 0.0006561721861091232, 'lambda_val': 0.0015978933099847826, 'batch_size': 1525, 'optimizer': 'RMSprop'}.
2026-05-24 17:21:47,096 - experiment_functions - INFO - Early stopping at epoch 500. Best Metrics: (0.0050729982695192416, 0.004197019867549669, 0.005218427531429478)
2026-05-24 17:21:47,191 - optuna.study.study - INFO - Trial 89 finished with values: [0.0050729982695192416, 0.004197019867549669, 0.005218427531429478] and parameters: {'n_layers': 2, 'embedding_dim': 96, 'lr': 5.727446252212702e-05, 'lambda_val': 1.2091493851780864e-06, 'batch_size': 2084, 'optimizer': 'SGD'}.
2026-05-24 17:21:55,117 - experiment_functions - INFO - Early stopping at epoch 600. Best Metrics: (0.020002383839219064, 0.014933774834437086, 0.02019360948462545)
2026-05-24 17:21:55,198 - optuna.study.study - INFO - Trial 90 finished with values: [0.020002383839219064, 0.014933774834437086, 0.02019360948462545] and parameters: {'n_layers': 2, 'embedding_dim': 32, 'lr': 0.003429601537868209, 'lambda_val': 1.3897461090429269e-06, 'batch_size': 3115, 'optimizer': 'Adam'}.
2026-05-24 17:22:25,624 - experiment_functions - INFO - Early stopping at epoch 2600. Best Metrics: (0.022798257126734712, 0.017235099337748343, 0.023237457923637655)
2026-05-24 17:22:25,756 - optuna.study.study - INFO - Trial 91 finished with values: [0.022798257126734712, 0.017235099337748343, 0.023237457923637655] and parameters: {'n_layers': 2, 'embedding_dim': 96, 'lr': 0.0003156053277132074, 'lambda_val': 0.001164130600275734, 'batch_size': 2590, 'optimizer': 'Adam'}.
2026-05-24 17:22:32,402 - experiment_functions - INFO - Early stopping at epoch 500. Best Metrics: (0.005323372171125701, 0.004230132450331126, 0.00563766698968709)
2026-05-24 17:22:32,723 - optuna.study.study - INFO - Trial 92 finished with values: [0.005323372171125701, 0.004230132450331126, 0.00563766698968709] and parameters: {'n_layers': 4, 'embedding_dim': 96, 'lr': 5.3171398873209266e-05, 'lambda_val': 0.0015978933099847826, 'batch_size': 4048, 'optimizer': 'SGD'}.
2026-05-24 17:22:39,389 - experiment_functions - INFO - Early stopping at epoch 500. Best Metrics: (0.005585712246727133, 0.004445364238410596, 0.005672949496934653)
2026-05-24 17:22:39,476 - optuna.study.study - INFO - Trial 93 finished with values: [0.005585712246727133, 0.004445364238410596, 0.005672949496934653] and parameters: {'n_layers': 4, 'embedding_dim': 128, 'lr': 6.11495569161953e-05, 'lambda_val': 4.639541424555153e-06, 'batch_size': 1854, 'optimizer': 'SGD'}.
2026-05-24 17:22:46,781 - experiment_functions - INFO - Early stopping at epoch 550. Best Metrics: (0.02161655467028632, 0.017392384105960265, 0.02261777430920179)
2026-05-24 17:22:46,865 - optuna.study.study - INFO - Trial 94 finished with values: [0.02161655467028632, 0.017392384105960265, 0.02261777430920179] and parameters: {'n_layers': 4, 'embedding_dim': 128, 'lr': 0.0065618298710489005, 'lambda_val': 0.00011364672917450008, 'batch_size': 1565, 'optimizer': 'Adam'}.
2026-05-24 17:22:55,863 - experiment_functions - INFO - Early stopping at epoch 700. Best Metrics: (0.022562008879263733, 0.01769039735099338, 0.023327884504386186)
2026-05-24 17:22:57,006 - optuna.study.study - INFO - Trial 95 finished with values: [0.022562008879263733, 0.01769039735099338, 0.023327884504386186] and parameters: {'n_layers': 2, 'embedding_dim': 64, 'lr': 0.0009144615335871839, 'lambda_val': 0.006970697664400825, 'batch_size': 2355, 'optimizer': 'RMSprop'}.
2026-05-24 17:23:03,611 - experiment_functions - INFO - Early stopping at epoch 500. Best Metrics: (0.0048126373126868545, 0.0038410596026490066, 0.0046361837257408965)
2026-05-24 17:23:03,708 - optuna.study.study - INFO - Trial 96 finished with values: [0.0048126373126868545, 0.0038410596026490066, 0.0046361837257408965] and parameters: {'n_layers': 3, 'embedding_dim': 96, 'lr': 5.238042759773907e-05, 'lambda_val': 0.0712753228725955, 'batch_size': 946, 'optimizer': 'RMSprop'}.
2026-05-24 17:23:10,430 - experiment_functions - INFO - Early stopping at epoch 500. Best Metrics: (0.004918081327499476, 0.004097682119205298, 0.005074475568029984)
2026-05-24 17:23:10,969 - optuna.study.study - INFO - Trial 97 finished with values: [0.004918081327499476, 0.004097682119205298, 0.005074475568029984] and parameters: {'n_layers': 4, 'embedding_dim': 64, 'lr': 0.0012102126589818853, 'lambda_val': 0.0013585882512720067, 'batch_size': 1634, 'optimizer': 'SGD'}.
2026-05-24 17:23:24,156 - experiment_functions - INFO - Early stopping at epoch 1050. Best Metrics: (0.021426137936568255, 0.01746688741721854, 0.021693591906289344)
2026-05-24 17:23:24,239 - optuna.study.study - INFO - Trial 98 finished with values: [0.021426137936568255, 0.01746688741721854, 0.021693591906289344] and parameters: {'n_layers': 4, 'embedding_dim': 96, 'lr': 0.00032645317624320844, 'lambda_val': 0.03958976761123264, 'batch_size': 2959, 'optimizer': 'Adam'}.
2026-05-24 17:23:32,206 - experiment_functions - INFO - Early stopping at epoch 600. Best Metrics: (0.02176835605756937, 0.018071192052980134, 0.023130688557577283)
2026-05-24 17:23:32,274 - optuna.study.study - INFO - Trial 99 finished with values: [0.02176835605756937, 0.018071192052980134, 0.023130688557577283] and parameters: {'n_layers': 4, 'embedding_dim': 64, 'lr': 0.0024421865435223515, 'lambda_val': 0.015164958999521902, 'batch_size': 2590, 'optimizer': 'Adam'}.
2026-05-24 17:23:39,926 - experiment_functions - INFO - Early stopping at epoch 550. Best Metrics: (0.01743534187552273, 0.015157284768211923, 0.019625310748112156)
2026-05-24 17:23:40,016 - optuna.study.study - INFO - Trial 100 finished with values: [0.01743534187552273, 0.015157284768211923, 0.019625310748112156] and parameters: {'n_layers': 4, 'embedding_dim': 128, 'lr': 0.0024421865435223515, 'lambda_val': 0.015164958999521902, 'batch_size': 2590, 'optimizer': 'Adam'}.
2026-05-24 17:23:52,007 - experiment_functions - INFO - Early stopping at epoch 700. Best Metrics: (0.024879539002484408, 0.01918046357615894, 0.02574148893280197)
2026-05-24 17:23:52,601 - optuna.study.study - INFO - Trial 101 finished with values: [0.024879539002484408, 0.01918046357615894, 0.02574148893280197] and parameters: {'n_layers': 4, 'embedding_dim': 128, 'lr': 0.0009577842166100019, 'lambda_val': 0.00011364672917450008, 'batch_size': 1209, 'optimizer': 'Adam'}.
2026-05-24 17:24:04,168 - experiment_functions - INFO - Early stopping at epoch 1000. Best Metrics: (0.0047860888769288915, 0.0040149006622516555, 0.005000487563858225)
2026-05-24 17:24:04,246 - optuna.study.study - INFO - Trial 102 finished with values: [0.0047860888769288915, 0.0040149006622516555, 0.005000487563858225] and parameters: {'n_layers': 2, 'embedding_dim': 128, 'lr': 0.000647639505305291, 'lambda_val': 0.0012598530121154562, 'batch_size': 859, 'optimizer': 'SGD'}.
2026-05-24 17:24:13,311 - experiment_functions - INFO - Early stopping at epoch 700. Best Metrics: (0.02276892320369464, 0.017872516556291393, 0.023724870205540764)
2026-05-24 17:24:13,404 - optuna.study.study - INFO - Trial 103 finished with values: [0.02276892320369464, 0.017872516556291393, 0.023724870205540764] and parameters: {'n_layers': 2, 'embedding_dim': 64, 'lr': 0.0009144615335871839, 'lambda_val': 0.006970697664400825, 'batch_size': 2355, 'optimizer': 'RMSprop'}.
2026-05-24 17:24:56,798 - optuna.study.study - INFO - Trial 104 finished with values: [0.015307604853144731, 0.010604304635761591, 0.015772604679049427] and parameters: {'n_layers': 1, 'embedding_dim': 32, 'lr': 0.0001715743810403738, 'lambda_val': 0.004034077153804417, 'batch_size': 1209, 'optimizer': 'Adam'}.
2026-05-24 17:25:39,927 - optuna.study.study - INFO - Trial 105 finished with values: [0.006937757242548417, 0.005397350993377484, 0.00712784525947596] and parameters: {'n_layers': 1, 'embedding_dim': 32, 'lr': 4.739130727053902e-05, 'lambda_val': 0.006970697664400825, 'batch_size': 2355, 'optimizer': 'RMSprop'}.
2026-05-24 17:25:55,175 - experiment_functions - INFO - Early stopping at epoch 1300. Best Metrics: (0.020841084908631, 0.016349337748344375, 0.021285773176094827)
2026-05-24 17:25:55,421 - optuna.study.study - INFO - Trial 106 finished with values: [0.020841084908631, 0.016349337748344375, 0.021285773176094827] and parameters: {'n_layers': 4, 'embedding_dim': 32, 'lr': 0.00032645317624320844, 'lambda_val': 9.827775235361319e-05, 'batch_size': 3200, 'optimizer': 'Adam'}.
2026-05-24 17:26:36,537 - optuna.study.study - INFO - Trial 107 finished with values: [0.019972708122908373, 0.015355960264900662, 0.02057219786752273] and parameters: {'n_layers': 2, 'embedding_dim': 96, 'lr': 0.0001715743810403738, 'lambda_val': 0.0036922476620693135, 'batch_size': 3657, 'optimizer': 'Adam'}.
2026-05-24 17:26:42,718 - experiment_functions - INFO - Early stopping at epoch 500. Best Metrics: (0.005494782540676405, 0.0043708609271523174, 0.005679502210146086)
