2026-05-24 00:02:29,657 - optuna.study.study - INFO - Trial 19 finished with values: [0.00577853687053095, 0.004602649006622517, 0.005984320290364589] and parameters: {'n_layers': 1, 'embedding_dim': 96, 'lr': 0.0008280830137711422, 'lambda_val': 0.06919724345202151, 'batch_size': 2936, 'optimizer': 'SGD'}.
2026-05-24 00:02:39,105 - experiment_functions - INFO - Early stopping at epoch 750. Best Metrics: (0.019543364914466142, 0.01568708609271523, 0.021325871329426777)
2026-05-24 00:02:40,062 - optuna.study.study - INFO - Trial 20 finished with values: [0.019543364914466142, 0.01568708609271523, 0.021325871329426777] and parameters: {'n_layers': 3, 'embedding_dim': 32, 'lr': 0.0010358017727309806, 'lambda_val': 0.04990172064077824, 'batch_size': 2478, 'optimizer': 'Adam'}.
2026-05-24 00:02:46,503 - experiment_functions - INFO - Early stopping at epoch 500. Best Metrics: (0.00494361730500425, 0.0038658940397350997, 0.0050089963526558845)
2026-05-24 00:02:47,204 - optuna.study.study - INFO - Trial 21 finished with values: [0.00494361730500425, 0.0038658940397350997, 0.0050089963526558845] and parameters: {'n_layers': 2, 'embedding_dim': 64, 'lr': 0.00026017257452444286, 'lambda_val': 0.0017420097476977836, 'batch_size': 710, 'optimizer': 'SGD'}.
2026-05-24 00:03:04,284 - experiment_functions - INFO - Early stopping at epoch 1500. Best Metrics: (0.004861589297961148, 0.0037168874172185434, 0.004697770601557295)
2026-05-24 00:03:04,358 - optuna.study.study - INFO - Trial 22 finished with values: [0.004861589297961148, 0.0037168874172185434, 0.004697770601557295] and parameters: {'n_layers': 3, 'embedding_dim': 96, 'lr': 0.025791237448043406, 'lambda_val': 5.352757517859833e-05, 'batch_size': 2411, 'optimizer': 'SGD'}.
2026-05-24 00:03:11,435 - experiment_functions - INFO - Early stopping at epoch 550. Best Metrics: (0.013850674875782763, 0.010587748344370861, 0.014115366153719012)
2026-05-24 00:03:11,589 - optuna.study.study - INFO - Trial 23 finished with values: [0.013850674875782763, 0.010587748344370861, 0.014115366153719012] and parameters: {'n_layers': 1, 'embedding_dim': 128, 'lr': 0.007270486947253559, 'lambda_val': 1.8572669235600176e-05, 'batch_size': 2757, 'optimizer': 'RMSprop'}.
2026-05-24 00:03:18,658 - experiment_functions - INFO - Early stopping at epoch 550. Best Metrics: (0.015259932672499487, 0.011490066225165563, 0.015083109794242294)
2026-05-24 00:03:18,753 - optuna.study.study - INFO - Trial 24 finished with values: [0.015259932672499487, 0.011490066225165563, 0.015083109794242294] and parameters: {'n_layers': 2, 'embedding_dim': 128, 'lr': 0.007418507936625942, 'lambda_val': 9.589938618813186e-06, 'batch_size': 2359, 'optimizer': 'Adam'}.
2026-05-24 00:03:25,344 - experiment_functions - INFO - Early stopping at epoch 500. Best Metrics: (0.004906335728614968, 0.004163907284768212, 0.005187716539362341)
2026-05-24 00:03:25,420 - optuna.study.study - INFO - Trial 25 finished with values: [0.004906335728614968, 0.004163907284768212, 0.005187716539362341] and parameters: {'n_layers': 1, 'embedding_dim': 96, 'lr': 2.1015280560874596e-05, 'lambda_val': 2.4180983993664434e-06, 'batch_size': 3343, 'optimizer': 'SGD'}.
2026-05-24 00:03:34,713 - experiment_functions - INFO - Early stopping at epoch 800. Best Metrics: (0.004990727589807071, 0.004039735099337749, 0.005038285084846182)
2026-05-24 00:03:35,195 - optuna.study.study - INFO - Trial 26 finished with values: [0.004990727589807071, 0.004039735099337749, 0.005038285084846182] and parameters: {'n_layers': 1, 'embedding_dim': 32, 'lr': 0.04393217183351347, 'lambda_val': 1.4738576132209548e-05, 'batch_size': 3179, 'optimizer': 'SGD'}.
2026-05-24 00:03:51,046 - experiment_functions - INFO - Early stopping at epoch 1350. Best Metrics: (0.016817621149458922, 0.012773178807947021, 0.01685046658507667)
2026-05-24 00:03:52,409 - optuna.study.study - INFO - Trial 27 finished with values: [0.016817621149458922, 0.012773178807947021, 0.01685046658507667] and parameters: {'n_layers': 2, 'embedding_dim': 128, 'lr': 0.0004002930085283158, 'lambda_val': 0.0001780893612713799, 'batch_size': 2347, 'optimizer': 'Adam'}.
2026-05-24 00:04:04,284 - experiment_functions - INFO - Early stopping at epoch 1050. Best Metrics: (0.005217893637338522, 0.004105960264900663, 0.005516339105771337)
2026-05-24 00:04:04,586 - optuna.study.study - INFO - Trial 28 finished with values: [0.005217893637338522, 0.004105960264900663, 0.005516339105771337] and parameters: {'n_layers': 2, 'embedding_dim': 256, 'lr': 0.014725567274987637, 'lambda_val': 0.00010225854042250717, 'batch_size': 2469, 'optimizer': 'SGD'}.
2026-05-24 00:04:33,192 - experiment_functions - INFO - Early stopping at epoch 2950. Best Metrics: (0.005581014903224697, 0.0044122516556291385, 0.005597128867972915)
2026-05-24 00:04:33,295 - optuna.study.study - INFO - Trial 29 finished with values: [0.005581014903224697, 0.0044122516556291385, 0.005597128867972915] and parameters: {'n_layers': 1, 'embedding_dim': 128, 'lr': 0.022561518980448614, 'lambda_val': 0.00022136029585900945, 'batch_size': 1697, 'optimizer': 'SGD'}.
2026-05-24 00:04:40,402 - experiment_functions - INFO - Early stopping at epoch 600. Best Metrics: (0.017677606904031886, 0.013062913907284769, 0.017646424212245094)
2026-05-24 00:04:40,482 - optuna.study.study - INFO - Trial 30 finished with values: [0.017677606904031886, 0.013062913907284769, 0.017646424212245094] and parameters: {'n_layers': 1, 'embedding_dim': 128, 'lr': 0.0014918556660024908, 'lambda_val': 0.0011861252157314979, 'batch_size': 1047, 'optimizer': 'RMSprop'}.
2026-05-24 00:04:46,558 - experiment_functions - INFO - Early stopping at epoch 500. Best Metrics: (0.005021157682928629, 0.004048013245033113, 0.004985877555709021)
2026-05-24 00:04:46,640 - optuna.study.study - INFO - Trial 31 finished with values: [0.005021157682928629, 0.004048013245033113, 0.004985877555709021] and parameters: {'n_layers': 2, 'embedding_dim': 256, 'lr': 7.304491165279911e-05, 'lambda_val': 0.0007472472464896581, 'batch_size': 2333, 'optimizer': 'SGD'}.
2026-05-24 00:04:52,702 - experiment_functions - INFO - Early stopping at epoch 550. Best Metrics: (0.009574839971364166, 0.008302980132450332, 0.010171235760904064)
2026-05-24 00:04:52,810 - optuna.study.study - INFO - Trial 32 finished with values: [0.009574839971364166, 0.008302980132450332, 0.010171235760904064] and parameters: {'n_layers': 1, 'embedding_dim': 96, 'lr': 0.06876339217839887, 'lambda_val': 0.00031880013656043093, 'batch_size': 1938, 'optimizer': 'Adam'}.
2026-05-24 00:04:58,190 - experiment_functions - INFO - Early stopping at epoch 500. Best Metrics: (0.00473743636617414, 0.004221854304635762, 0.00510154366102154)
2026-05-24 00:04:58,422 - optuna.study.study - INFO - Trial 33 finished with values: [0.00473743636617414, 0.004221854304635762, 0.00510154366102154] and parameters: {'n_layers': 4, 'embedding_dim': 32, 'lr': 0.00022798255951858533, 'lambda_val': 0.022117872867024636, 'batch_size': 3958, 'optimizer': 'SGD'}.
2026-05-24 00:05:04,868 - experiment_functions - INFO - Early stopping at epoch 500. Best Metrics: (0.004971002964598963, 0.003973509933774834, 0.004989805620302341)
2026-05-24 00:05:05,115 - optuna.study.study - INFO - Trial 34 finished with values: [0.004971002964598963, 0.003973509933774834, 0.004989805620302341] and parameters: {'n_layers': 4, 'embedding_dim': 256, 'lr': 0.06003194458009683, 'lambda_val': 0.03613152482240985, 'batch_size': 2407, 'optimizer': 'SGD'}.
2026-05-24 00:05:25,499 - experiment_functions - INFO - Early stopping at epoch 2000. Best Metrics: (0.02011669248461164, 0.014279801324503311, 0.020186677718692536)
2026-05-24 00:05:25,680 - optuna.study.study - INFO - Trial 35 finished with values: [0.02011669248461164, 0.014279801324503311, 0.020186677718692536] and parameters: {'n_layers': 2, 'embedding_dim': 64, 'lr': 0.0003602499380989214, 'lambda_val': 4.0551073365180215e-06, 'batch_size': 2049, 'optimizer': 'Adam'}.
2026-05-24 00:06:07,709 - optuna.study.study - INFO - Trial 36 finished with values: [0.013732745077456499, 0.010447019867549668, 0.014500479657913297] and parameters: {'n_layers': 1, 'embedding_dim': 96, 'lr': 0.00016981437705208634, 'lambda_val': 2.837707861077738e-05, 'batch_size': 905, 'optimizer': 'Adam'}.
2026-05-24 00:06:26,862 - experiment_functions - INFO - Early stopping at epoch 1850. Best Metrics: (0.021333620660102103, 0.016233443708609272, 0.022229988669705283)
2026-05-24 00:06:26,953 - optuna.study.study - INFO - Trial 37 finished with values: [0.021333620660102103, 0.016233443708609272, 0.022229988669705283] and parameters: {'n_layers': 3, 'embedding_dim': 32, 'lr': 0.00037394670395286464, 'lambda_val': 0.014393132529370842, 'batch_size': 1672, 'optimizer': 'Adam'}.
2026-05-24 00:07:02,415 - experiment_functions - INFO - Early stopping at epoch 3400. Best Metrics: (0.006973010759437089, 0.004942052980132451, 0.006681912387930451)
2026-05-24 00:07:02,602 - optuna.study.study - INFO - Trial 38 finished with values: [0.006973010759437089, 0.004942052980132451, 0.006681912387930451] and parameters: {'n_layers': 4, 'embedding_dim': 128, 'lr': 1.6810189469506768e-05, 'lambda_val': 1.9105778136490782e-06, 'batch_size': 2727, 'optimizer': 'RMSprop'}.
2026-05-24 00:07:14,471 - experiment_functions - INFO - Early stopping at epoch 1050. Best Metrics: (0.019037837578182264, 0.01677980132450331, 0.021233387460826734)
2026-05-24 00:07:14,553 - optuna.study.study - INFO - Trial 39 finished with values: [0.019037837578182264, 0.01677980132450331, 0.021233387460826734] and parameters: {'n_layers': 4, 'embedding_dim': 96, 'lr': 0.00036341523831303154, 'lambda_val': 0.0019340508111572378, 'batch_size': 2304, 'optimizer': 'RMSprop'}.
2026-05-24 00:07:20,678 - experiment_functions - INFO - Early stopping at epoch 500. Best Metrics: (0.004358733170665001, 0.003899006622516557, 0.004878322110209236)
2026-05-24 00:07:20,950 - optuna.study.study - INFO - Trial 40 finished with values: [0.004358733170665001, 0.003899006622516557, 0.004878322110209236] and parameters: {'n_layers': 4, 'embedding_dim': 128, 'lr': 0.0028910972703384235, 'lambda_val': 0.012220117015136304, 'batch_size': 1080, 'optimizer': 'SGD'}.
2026-05-24 00:07:29,016 - experiment_functions - INFO - Early stopping at epoch 600. Best Metrics: (0.016049963264982533, 0.013302980132450333, 0.01685172419710714)
2026-05-24 00:07:29,099 - optuna.study.study - INFO - Trial 41 finished with values: [0.016049963264982533, 0.013302980132450333, 0.01685172419710714] and parameters: {'n_layers': 4, 'embedding_dim': 256, 'lr': 0.001293588669347129, 'lambda_val': 0.00019532057311517592, 'batch_size': 3674, 'optimizer': 'Adam'}.
2026-05-24 00:08:07,987 - optuna.study.study - INFO - Trial 42 finished with values: [0.008179867003072612, 0.006514900662251655, 0.008723541581213868] and parameters: {'n_layers': 1, 'embedding_dim': 32, 'lr': 4.700608245912826e-05, 'lambda_val': 0.00019791296993912417, 'batch_size': 2847, 'optimizer': 'Adam'}.
2026-05-24 00:08:13,909 - experiment_functions - INFO - Early stopping at epoch 500. Best Metrics: (0.004531798554031796, 0.003932119205298013, 0.004905872953623935)
2026-05-24 00:08:15,178 - optuna.study.study - INFO - Trial 43 finished with values: [0.004531798554031796, 0.003932119205298013, 0.004905872953623935] and parameters: {'n_layers': 1, 'embedding_dim': 256, 'lr': 0.001331662925963099, 'lambda_val': 1.3372687885744846e-06, 'batch_size': 3885, 'optimizer': 'SGD'}.
2026-05-24 00:08:21,507 - experiment_functions - INFO - Early stopping at epoch 500. Best Metrics: (0.009937068306537464, 0.007425496688741722, 0.009839415570070934)
2026-05-24 00:08:21,611 - optuna.study.study - INFO - Trial 44 finished with values: [0.009937068306537464, 0.007425496688741722, 0.009839415570070934] and parameters: {'n_layers': 4, 'embedding_dim': 128, 'lr': 0.030062784466678812, 'lambda_val': 2.082608826974409e-05, 'batch_size': 4045, 'optimizer': 'RMSprop'}.
2026-05-24 00:08:27,965 - experiment_functions - INFO - Early stopping at epoch 550. Best Metrics: (0.008089027899379308, 0.007160596026490066, 0.008479296507025665)
2026-05-24 00:08:28,045 - optuna.study.study - INFO - Trial 45 finished with values: [0.008089027899379308, 0.007160596026490066, 0.008479296507025665] and parameters: {'n_layers': 4, 'embedding_dim': 96, 'lr': 0.022575574800972775, 'lambda_val': 0.0013678993343911928, 'batch_size': 2284, 'optimizer': 'Adam'}.
2026-05-24 00:09:07,436 - optuna.study.study - INFO - Trial 46 finished with values: [0.007868319628938148, 0.006076158940397351, 0.008406818351256203] and parameters: {'n_layers': 1, 'embedding_dim': 64, 'lr': 3.6747430355577643e-05, 'lambda_val': 2.990080656491796e-06, 'batch_size': 2285, 'optimizer': 'RMSprop'}.
2026-05-24 00:09:13,690 - experiment_functions - INFO - Early stopping at epoch 550. Best Metrics: (0.007190912961550779, 0.006597682119205298, 0.007888103179425015)
2026-05-24 00:09:13,759 - optuna.study.study - INFO - Trial 47 finished with values: [0.007190912961550779, 0.006597682119205298, 0.007888103179425015] and parameters: {'n_layers': 3, 'embedding_dim': 128, 'lr': 0.044206138096225325, 'lambda_val': 0.0006288901315672865, 'batch_size': 3598, 'optimizer': 'Adam'}.
2026-05-24 00:09:52,074 - optuna.study.study - INFO - Trial 48 finished with values: [0.009746847378724239, 0.007160596026490066, 0.010287067181993195] and parameters: {'n_layers': 2, 'embedding_dim': 32, 'lr': 6.0784614469481834e-05, 'lambda_val': 0.0001712246865715635, 'batch_size': 3540, 'optimizer': 'RMSprop'}.
2026-05-24 00:09:59,423 - experiment_functions - INFO - Early stopping at epoch 600. Best Metrics: (0.015279350689059895, 0.012309602649006622, 0.016391364137509336)
2026-05-24 00:09:59,525 - optuna.study.study - INFO - Trial 49 finished with values: [0.015279350689059895, 0.012309602649006622, 0.016391364137509336] and parameters: {'n_layers': 3, 'embedding_dim': 128, 'lr': 0.002281616661023266, 'lambda_val': 2.1584212621107985e-06, 'batch_size': 3137, 'optimizer': 'Adam'}.
2026-05-24 00:10:07,654 - experiment_functions - INFO - Early stopping at epoch 650. Best Metrics: (0.005626766801009991, 0.005347682119205299, 0.0061092727411586265)
2026-05-24 00:10:07,741 - optuna.study.study - INFO - Trial 50 finished with values: [0.005626766801009991, 0.005347682119205299, 0.0061092727411586265] and parameters: {'n_layers': 4, 'embedding_dim': 256, 'lr': 0.004151503242019667, 'lambda_val': 0.02448589859937424, 'batch_size': 2524, 'optimizer': 'RMSprop'}.
2026-05-24 00:10:31,527 - experiment_functions - INFO - Early stopping at epoch 2150. Best Metrics: (0.023404017563703302, 0.01609271523178808, 0.023500700395660327)
2026-05-24 00:10:31,610 - optuna.study.study - INFO - Trial 51 finished with values: [0.023404017563703302, 0.01609271523178808, 0.023500700395660327] and parameters: {'n_layers': 2, 'embedding_dim': 32, 'lr': 0.0005555935556782479, 'lambda_val': 2.1584212621107985e-06, 'batch_size': 947, 'optimizer': 'Adam'}.
2026-05-24 00:10:40,075 - experiment_functions - INFO - Early stopping at epoch 700. Best Metrics: (0.009431686671924911, 0.007955298013245033, 0.009705443843396)
2026-05-24 00:10:40,596 - optuna.study.study - INFO - Trial 52 finished with values: [0.009431686671924911, 0.007955298013245033, 0.009705443843396] and parameters: {'n_layers': 1, 'embedding_dim': 96, 'lr': 0.0008129182482291749, 'lambda_val': 0.06649097652898797, 'batch_size': 3873, 'optimizer': 'RMSprop'}.
2026-05-24 00:10:46,737 - experiment_functions - INFO - Early stopping at epoch 500. Best Metrics: (0.005294264783755539, 0.004312913907284768, 0.005547322963486549)
2026-05-24 00:10:46,810 - optuna.study.study - INFO - Trial 53 finished with values: [0.005294264783755539, 0.004312913907284768, 0.005547322963486549] and parameters: {'n_layers': 4, 'embedding_dim': 96, 'lr': 0.00022798255951858533, 'lambda_val': 2.356034595653627e-06, 'batch_size': 2524, 'optimizer': 'SGD'}.
2026-05-24 00:11:02,186 - experiment_functions - INFO - Early stopping at epoch 1400. Best Metrics: (0.01887283239291778, 0.01704470198675497, 0.02097285744572639)
2026-05-24 00:11:02,260 - optuna.study.study - INFO - Trial 54 finished with values: [0.01887283239291778, 0.01704470198675497, 0.02097285744572639] and parameters: {'n_layers': 4, 'embedding_dim': 96, 'lr': 0.00022798255951858533, 'lambda_val': 0.06649097652898797, 'batch_size': 3873, 'optimizer': 'RMSprop'}.
2026-05-24 00:11:10,739 - experiment_functions - INFO - Early stopping at epoch 600. Best Metrics: (0.01885714218151765, 0.013642384105960265, 0.019187641890830286)
2026-05-24 00:11:10,812 - optuna.study.study - INFO - Trial 55 finished with values: [0.01885714218151765, 0.013642384105960265, 0.019187641890830286] and parameters: {'n_layers': 2, 'embedding_dim': 64, 'lr': 0.0034624350757776097, 'lambda_val': 0.001970520642014681, 'batch_size': 1368, 'optimizer': 'Adam'}.
2026-05-24 00:11:21,795 - experiment_functions - INFO - Early stopping at epoch 1000. Best Metrics: (0.017051846685644616, 0.013120860927152318, 0.017462811167318917)
2026-05-24 00:11:22,951 - optuna.study.study - INFO - Trial 56 finished with values: [0.017051846685644616, 0.013120860927152318, 0.017462811167318917] and parameters: {'n_layers': 2, 'embedding_dim': 128, 'lr': 0.0007132643500643846, 'lambda_val': 0.012312281188503879, 'batch_size': 947, 'optimizer': 'Adam'}.
2026-05-24 00:11:29,466 - experiment_functions - INFO - Early stopping at epoch 550. Best Metrics: (0.013924845412126541, 0.011043046357615894, 0.013690777822773692)
2026-05-24 00:11:29,557 - optuna.study.study - INFO - Trial 57 finished with values: [0.013924845412126541, 0.011043046357615894, 0.013690777822773692] and parameters: {'n_layers': 3, 'embedding_dim': 64, 'lr': 0.00512647259656842, 'lambda_val': 0.04990172064077824, 'batch_size': 2049, 'optimizer': 'Adam'}.
2026-05-24 00:11:36,205 - experiment_functions - INFO - Early stopping at epoch 550. Best Metrics: (0.006670214343147104, 0.0061341059602649005, 0.0071938441993688465)
2026-05-24 00:11:36,274 - optuna.study.study - INFO - Trial 58 finished with values: [0.006670214343147104, 0.0061341059602649005, 0.0071938441993688465] and parameters: {'n_layers': 4, 'embedding_dim': 128, 'lr': 0.044206138096225325, 'lambda_val': 0.0006288901315672865, 'batch_size': 2217, 'optimizer': 'Adam'}.
2026-05-24 00:11:49,801 - experiment_functions - INFO - Early stopping at epoch 1250. Best Metrics: (0.01605754475290759, 0.014023178807947023, 0.017485689930758243)
2026-05-24 00:11:49,877 - optuna.study.study - INFO - Trial 59 finished with values: [0.01605754475290759, 0.014023178807947023, 0.017485689930758243] and parameters: {'n_layers': 3, 'embedding_dim': 96, 'lr': 0.00037394670395286464, 'lambda_val': 0.014393132529370842, 'batch_size': 1938, 'optimizer': 'Adam'}.
2026-05-24 00:12:00,611 - experiment_functions - INFO - Early stopping at epoch 950. Best Metrics: (0.01792629180287578, 0.014933774834437086, 0.019361532035220713)
2026-05-24 00:12:01,077 - optuna.study.study - INFO - Trial 60 finished with values: [0.01792629180287578, 0.014933774834437086, 0.019361532035220713] and parameters: {'n_layers': 3, 'embedding_dim': 96, 'lr': 0.0006541077805531833, 'lambda_val': 0.014393132529370842, 'batch_size': 900, 'optimizer': 'Adam'}.
2026-05-24 00:12:40,870 - optuna.study.study - INFO - Trial 61 finished with values: [0.0065451233981806125, 0.005314569536423841, 0.00716011842612809] and parameters: {'n_layers': 1, 'embedding_dim': 32, 'lr': 2.662936711429196e-05, 'lambda_val': 1.0589541331279516e-06, 'batch_size': 2847, 'optimizer': 'RMSprop'}.
2026-05-24 00:12:47,690 - experiment_functions - INFO - Early stopping at epoch 550. Best Metrics: (0.015977375056027785, 0.0115976821192053, 0.015758146781729074)
2026-05-24 00:12:47,908 - optuna.study.study - INFO - Trial 62 finished with values: [0.015977375056027785, 0.0115976821192053, 0.015758146781729074] and parameters: {'n_layers': 2, 'embedding_dim': 128, 'lr': 0.007418507936625942, 'lambda_val': 9.589938618813186e-06, 'batch_size': 2359, 'optimizer': 'Adam'}.
2026-05-24 00:12:54,329 - experiment_functions - INFO - Early stopping at epoch 550. Best Metrics: (0.00983603692184596, 0.008360927152317881, 0.010022138360399335)
2026-05-24 00:12:54,423 - optuna.study.study - INFO - Trial 63 finished with values: [0.00983603692184596, 0.008360927152317881, 0.010022138360399335] and parameters: {'n_layers': 3, 'embedding_dim': 64, 'lr': 0.030062784466678812, 'lambda_val': 2.082608826974409e-05, 'batch_size': 2524, 'optimizer': 'RMSprop'}.
2026-05-24 00:13:32,664 - optuna.study.study - INFO - Trial 64 finished with values: [0.006317972191999499, 0.004917218543046358, 0.006542612417029789] and parameters: {'n_layers': 1, 'embedding_dim': 96, 'lr': 2.269268327971105e-05, 'lambda_val': 0.00031880013656043093, 'batch_size': 1938, 'optimizer': 'Adam'}.
2026-05-24 00:14:12,243 - optuna.study.study - INFO - Trial 65 finished with values: [0.006217386589615968, 0.004726821192052981, 0.0061255565277132315] and parameters: {'n_layers': 3, 'embedding_dim': 96, 'lr': 1.6810189469506768e-05, 'lambda_val': 1.9105778136490782e-06, 'batch_size': 2304, 'optimizer': 'RMSprop'}.
2026-05-24 00:14:22,145 - experiment_functions - INFO - Early stopping at epoch 900. Best Metrics: (0.018388531388668982, 0.015653973509933774, 0.019984115204102853)
2026-05-24 00:14:22,674 - optuna.study.study - INFO - Trial 66 finished with values: [0.018388531388668982, 0.015653973509933774, 0.019984115204102853] and parameters: {'n_layers': 3, 'embedding_dim': 64, 'lr': 0.0006541077805531833, 'lambda_val': 0.04529231618764749, 'batch_size': 1702, 'optimizer': 'Adam'}.
2026-05-24 00:14:28,780 - experiment_functions - INFO - Early stopping at epoch 500. Best Metrics: (0.005506840877888897, 0.004254966887417219, 0.0054802150919001915)
