2026-05-24 12:35:13,828 - optuna.study.study - INFO - Trial 58 finished with values: [0.01635443826942964, 0.010471854304635762, 0.014379896516086095] and parameters: {'n_layers': 2, 'embedding_dim': 32, 'lr': 0.047580035695546315, 'lambda_val': 7.023187222892337e-06, 'batch_size': 3665, 'optimizer': 'Adam'}.
2026-05-24 12:35:21,906 - experiment_functions - INFO - Early stopping at epoch 600. Best Metrics: (0.06032721800885056, 0.03608443708609271, 0.053812686346010996)
2026-05-24 12:35:22,009 - optuna.study.study - INFO - Trial 59 finished with values: [0.06032721800885056, 0.03608443708609271, 0.053812686346010996] and parameters: {'n_layers': 1, 'embedding_dim': 96, 'lr': 0.004235289187226827, 'lambda_val': 0.0003409068265064018, 'batch_size': 1315, 'optimizer': 'Adam'}.
2026-05-24 12:35:50,024 - experiment_functions - INFO - Early stopping at epoch 2350. Best Metrics: (0.02303641688052698, 0.016018211920529803, 0.02204681188768135)
2026-05-24 12:35:50,108 - optuna.study.study - INFO - Trial 60 finished with values: [0.02303641688052698, 0.016018211920529803, 0.02204681188768135] and parameters: {'n_layers': 3, 'embedding_dim': 64, 'lr': 0.009059752461132777, 'lambda_val': 0.0011830463992159451, 'batch_size': 1525, 'optimizer': 'RMSprop'}.
2026-05-24 12:36:17,865 - experiment_functions - INFO - Early stopping at epoch 2250. Best Metrics: (0.03090784009193621, 0.019072847682119205, 0.02705390709966395)
2026-05-24 12:36:17,954 - optuna.study.study - INFO - Trial 61 finished with values: [0.03090784009193621, 0.019072847682119205, 0.02705390709966395] and parameters: {'n_layers': 2, 'embedding_dim': 128, 'lr': 0.004601744611421326, 'lambda_val': 0.00012607227916368514, 'batch_size': 2030, 'optimizer': 'RMSprop'}.
2026-05-24 12:37:10,501 - optuna.study.study - INFO - Trial 62 finished with values: [0.024711009633846166, 0.01689569536423841, 0.02383168497931542] and parameters: {'n_layers': 3, 'embedding_dim': 96, 'lr': 0.05687696119744688, 'lambda_val': 0.0018241216708581335, 'batch_size': 3448, 'optimizer': 'Adam'}.
2026-05-24 12:37:18,081 - experiment_functions - INFO - Early stopping at epoch 500. Best Metrics: (0.008105500364819032, 0.0063741721854304635, 0.008530978981552244)
2026-05-24 12:37:18,208 - optuna.study.study - INFO - Trial 63 finished with values: [0.008105500364819032, 0.0063741721854304635, 0.008530978981552244] and parameters: {'n_layers': 2, 'embedding_dim': 32, 'lr': 0.09884407033531244, 'lambda_val': 0.000325456155928982, 'batch_size': 3847, 'optimizer': 'RMSprop'}.
2026-05-24 12:37:30,395 - experiment_functions - INFO - Early stopping at epoch 900. Best Metrics: (0.013272864237934254, 0.00870860927152318, 0.011873807501737076)
2026-05-24 12:37:30,490 - optuna.study.study - INFO - Trial 64 finished with values: [0.013272864237934254, 0.00870860927152318, 0.011873807501737076] and parameters: {'n_layers': 4, 'embedding_dim': 96, 'lr': 0.05687696119744688, 'lambda_val': 3.4355332572174856e-05, 'batch_size': 539, 'optimizer': 'Adam'}.
2026-05-24 12:37:44,357 - experiment_functions - INFO - Early stopping at epoch 1100. Best Metrics: (0.03126760186641188, 0.021953642384105965, 0.029770386838123043)
2026-05-24 12:37:45,154 - optuna.study.study - INFO - Trial 65 finished with values: [0.03126760186641188, 0.021953642384105965, 0.029770386838123043] and parameters: {'n_layers': 1, 'embedding_dim': 96, 'lr': 0.004601744611421326, 'lambda_val': 0.00012607227916368514, 'batch_size': 4088, 'optimizer': 'RMSprop'}.
2026-05-24 12:37:53,858 - experiment_functions - INFO - Early stopping at epoch 600. Best Metrics: (0.050058744885093424, 0.03200331125827815, 0.04497884066092697)
2026-05-24 12:37:53,958 - optuna.study.study - INFO - Trial 66 finished with values: [0.050058744885093424, 0.03200331125827815, 0.04497884066092697] and parameters: {'n_layers': 1, 'embedding_dim': 256, 'lr': 0.004235289187226827, 'lambda_val': 0.007383021531734565, 'batch_size': 989, 'optimizer': 'Adam'}.
2026-05-24 12:38:04,932 - experiment_functions - INFO - Early stopping at epoch 800. Best Metrics: (0.027786280978922582, 0.018741721854304637, 0.02550543824102232)
2026-05-24 12:38:05,120 - optuna.study.study - INFO - Trial 67 finished with values: [0.027786280978922582, 0.018741721854304637, 0.02550543824102232] and parameters: {'n_layers': 4, 'embedding_dim': 64, 'lr': 0.0003842758751904418, 'lambda_val': 4.511533338088929e-06, 'batch_size': 3917, 'optimizer': 'Adam'}.
2026-05-24 12:38:28,238 - experiment_functions - INFO - Early stopping at epoch 2000. Best Metrics: (0.01067482769892361, 0.011175496688741722, 0.014055074457401152)
2026-05-24 12:38:28,327 - optuna.study.study - INFO - Trial 68 finished with values: [0.01067482769892361, 0.011175496688741722, 0.014055074457401152] and parameters: {'n_layers': 2, 'embedding_dim': 64, 'lr': 0.03244369482190977, 'lambda_val': 0.09726133739941059, 'batch_size': 3638, 'optimizer': 'RMSprop'}.
2026-05-24 12:38:37,542 - experiment_functions - INFO - Early stopping at epoch 650. Best Metrics: (0.036139849963600736, 0.023642384105960267, 0.03213256835337689)
2026-05-24 12:38:37,639 - optuna.study.study - INFO - Trial 69 finished with values: [0.036139849963600736, 0.023642384105960267, 0.03213256835337689] and parameters: {'n_layers': 4, 'embedding_dim': 64, 'lr': 0.0007313058414573923, 'lambda_val': 2.2201284414336642e-06, 'batch_size': 807, 'optimizer': 'RMSprop'}.
2026-05-24 12:38:46,727 - experiment_functions - INFO - Early stopping at epoch 550. Best Metrics: (0.020127156416597396, 0.016183774834437087, 0.020265098071776608)
2026-05-24 12:38:47,101 - optuna.study.study - INFO - Trial 70 finished with values: [0.020127156416597396, 0.016183774834437087, 0.020265098071776608] and parameters: {'n_layers': 3, 'embedding_dim': 256, 'lr': 0.0013252046344015903, 'lambda_val': 2.662938714668246e-05, 'batch_size': 1844, 'optimizer': 'RMSprop'}.
2026-05-24 12:39:05,183 - experiment_functions - INFO - Early stopping at epoch 1350. Best Metrics: (0.0468026875418058, 0.02953642384105961, 0.040352234417890556)
2026-05-24 12:39:05,271 - optuna.study.study - INFO - Trial 71 finished with values: [0.0468026875418058, 0.02953642384105961, 0.040352234417890556] and parameters: {'n_layers': 3, 'embedding_dim': 96, 'lr': 0.0002462077417891578, 'lambda_val': 0.004723687270229531, 'batch_size': 1533, 'optimizer': 'RMSprop'}.
2026-05-24 12:39:36,060 - experiment_functions - INFO - Early stopping at epoch 2500. Best Metrics: (0.005776306694890719, 0.004685430463576159, 0.00581617390977757)
2026-05-24 12:39:36,350 - optuna.study.study - INFO - Trial 72 finished with values: [0.005776306694890719, 0.004685430463576159, 0.00581617390977757] and parameters: {'n_layers': 3, 'embedding_dim': 128, 'lr': 2.3228644173842884e-05, 'lambda_val': 1.930629760861541e-06, 'batch_size': 1304, 'optimizer': 'Adam'}.
2026-05-24 12:39:47,901 - experiment_functions - INFO - Early stopping at epoch 1000. Best Metrics: (0.058620293852126276, 0.03666390728476821, 0.05387706548949276)
2026-05-24 12:39:49,118 - optuna.study.study - INFO - Trial 73 finished with values: [0.058620293852126276, 0.03666390728476821, 0.05387706548949276] and parameters: {'n_layers': 1, 'embedding_dim': 96, 'lr': 0.000684293575282855, 'lambda_val': 0.02843248434954034, 'batch_size': 2016, 'optimizer': 'Adam'}.
2026-05-24 12:39:56,145 - experiment_functions - INFO - Early stopping at epoch 600. Best Metrics: (0.05846624804649777, 0.03390728476821192, 0.04925094568190914)
2026-05-24 12:39:56,235 - optuna.study.study - INFO - Trial 74 finished with values: [0.05846624804649777, 0.03390728476821192, 0.04925094568190914] and parameters: {'n_layers': 1, 'embedding_dim': 32, 'lr': 0.005103877753824678, 'lambda_val': 0.0006796337932014016, 'batch_size': 1304, 'optimizer': 'Adam'}.
2026-05-24 12:40:07,886 - experiment_functions - INFO - Early stopping at epoch 650. Best Metrics: (0.03488318271861377, 0.02321192052980133, 0.031868603022987094)
2026-05-24 12:40:07,982 - optuna.study.study - INFO - Trial 75 finished with values: [0.03488318271861377, 0.02321192052980133, 0.031868603022987094] and parameters: {'n_layers': 4, 'embedding_dim': 256, 'lr': 0.0003842758751904418, 'lambda_val': 1.6384022903021963e-06, 'batch_size': 1587, 'optimizer': 'RMSprop'}.
2026-05-24 12:40:30,076 - experiment_functions - INFO - Early stopping at epoch 1800. Best Metrics: (0.021185737205389906, 0.012922185430463577, 0.018321171292391653)
2026-05-24 12:40:30,184 - optuna.study.study - INFO - Trial 76 finished with values: [0.021185737205389906, 0.012922185430463577, 0.018321171292391653] and parameters: {'n_layers': 3, 'embedding_dim': 32, 'lr': 0.01397072177266369, 'lambda_val': 8.471062459286831e-06, 'batch_size': 1975, 'optimizer': 'Adam'}.
2026-05-24 12:40:48,152 - experiment_functions - INFO - Early stopping at epoch 1050. Best Metrics: (0.026226267457059242, 0.015455298013245035, 0.02301864305892435)
2026-05-24 12:40:48,239 - optuna.study.study - INFO - Trial 77 finished with values: [0.026226267457059242, 0.015455298013245035, 0.02301864305892435] and parameters: {'n_layers': 4, 'embedding_dim': 256, 'lr': 0.016762510970554485, 'lambda_val': 1.6384022903021963e-06, 'batch_size': 1058, 'optimizer': 'RMSprop'}.
2026-05-24 12:41:03,652 - experiment_functions - INFO - Early stopping at epoch 1300. Best Metrics: (0.0148392873700663, 0.013874172185430465, 0.01631144227519018)
2026-05-24 12:41:04,574 - optuna.study.study - INFO - Trial 78 finished with values: [0.0148392873700663, 0.013874172185430465, 0.01631144227519018] and parameters: {'n_layers': 1, 'embedding_dim': 96, 'lr': 0.009255160575862861, 'lambda_val': 0.09726133739941059, 'batch_size': 3564, 'optimizer': 'RMSprop'}.
2026-05-24 12:41:52,341 - optuna.study.study - INFO - Trial 79 finished with values: [0.037826795026468414, 0.024470198675496692, 0.03414783914462197] and parameters: {'n_layers': 2, 'embedding_dim': 32, 'lr': 0.00015025434045445616, 'lambda_val': 0.0003172844221989213, 'batch_size': 3917, 'optimizer': 'Adam'}.
2026-05-24 12:42:12,828 - experiment_functions - INFO - Early stopping at epoch 1700. Best Metrics: (0.05759144149466107, 0.03536423841059603, 0.051577848265229244)
2026-05-24 12:42:13,135 - optuna.study.study - INFO - Trial 80 finished with values: [0.05759144149466107, 0.03536423841059603, 0.051577848265229244] and parameters: {'n_layers': 1, 'embedding_dim': 96, 'lr': 0.0005846659139515835, 'lambda_val': 8.471062459286831e-06, 'batch_size': 1315, 'optimizer': 'Adam'}.
2026-05-24 12:42:20,805 - experiment_functions - INFO - Early stopping at epoch 500. Best Metrics: (0.00549508652395857, 0.004163907284768211, 0.005218677487932379)
2026-05-24 12:42:21,614 - optuna.study.study - INFO - Trial 81 finished with values: [0.00549508652395857, 0.004163907284768211, 0.005218677487932379] and parameters: {'n_layers': 4, 'embedding_dim': 128, 'lr': 1.2381209061561318e-05, 'lambda_val': 0.09743177928614061, 'batch_size': 1587, 'optimizer': 'Adam'}.
2026-05-24 12:42:30,179 - experiment_functions - INFO - Early stopping at epoch 650. Best Metrics: (0.01976686813378159, 0.014420529801324503, 0.019472208403792962)
2026-05-24 12:42:30,282 - optuna.study.study - INFO - Trial 82 finished with values: [0.01976686813378159, 0.014420529801324503, 0.019472208403792962] and parameters: {'n_layers': 1, 'embedding_dim': 96, 'lr': 0.014781919899767581, 'lambda_val': 0.00047319112187695436, 'batch_size': 2030, 'optimizer': 'RMSprop'}.
2026-05-24 12:43:13,512 - optuna.study.study - INFO - Trial 83 finished with values: [0.006112218465981949, 0.004834437086092716, 0.006170604003267971] and parameters: {'n_layers': 1, 'embedding_dim': 96, 'lr': 0.00010985512440869878, 'lambda_val': 4.872635963398448e-05, 'batch_size': 807, 'optimizer': 'Adam'}.
2026-05-24 12:43:20,362 - experiment_functions - INFO - Early stopping at epoch 500. Best Metrics: (0.005035892768224986, 0.004155629139072848, 0.0050373809337691386)
2026-05-24 12:43:20,482 - optuna.study.study - INFO - Trial 84 finished with values: [0.005035892768224986, 0.004155629139072848, 0.0050373809337691386] and parameters: {'n_layers': 2, 'embedding_dim': 64, 'lr': 1.23213171707867e-05, 'lambda_val': 2.2008741258871497e-05, 'batch_size': 1676, 'optimizer': 'SGD'}.
2026-05-24 12:43:31,043 - experiment_functions - INFO - Early stopping at epoch 800. Best Metrics: (0.04267378924884738, 0.028071192052980136, 0.03829163306187441)
2026-05-24 12:43:31,698 - optuna.study.study - INFO - Trial 85 finished with values: [0.04267378924884738, 0.028071192052980136, 0.03829163306187441] and parameters: {'n_layers': 3, 'embedding_dim': 32, 'lr': 0.0005846659139515835, 'lambda_val': 0.004061323094641349, 'batch_size': 1221, 'optimizer': 'RMSprop'}.
2026-05-24 12:44:17,845 - optuna.study.study - INFO - Trial 86 finished with values: [0.018282311829754917, 0.013004966887417218, 0.017849716817000257] and parameters: {'n_layers': 3, 'embedding_dim': 32, 'lr': 0.007947853266904198, 'lambda_val': 1.990977814130034e-05, 'batch_size': 973, 'optimizer': 'RMSprop'}.
2026-05-24 12:45:05,963 - optuna.study.study - INFO - Trial 87 finished with values: [0.033644421825341435, 0.02222682119205298, 0.03026345346679462] and parameters: {'n_layers': 4, 'embedding_dim': 32, 'lr': 0.00015112824887092085, 'lambda_val': 3.4355332572174856e-05, 'batch_size': 1022, 'optimizer': 'RMSprop'}.
2026-05-24 12:45:14,838 - experiment_functions - INFO - Early stopping at epoch 650. Best Metrics: (0.06300703067645784, 0.03679635761589404, 0.05506691747766346)
2026-05-24 12:45:15,657 - optuna.study.study - INFO - Trial 88 finished with values: [0.06300703067645784, 0.03679635761589404, 0.05506691747766346] and parameters: {'n_layers': 1, 'embedding_dim': 96, 'lr': 0.003407247220990805, 'lambda_val': 1.6384022903021963e-06, 'batch_size': 1081, 'optimizer': 'Adam'}.
2026-05-24 12:46:04,054 - optuna.study.study - INFO - Trial 89 finished with values: [0.019743292728568253, 0.014072847682119206, 0.019758511161844964] and parameters: {'n_layers': 3, 'embedding_dim': 96, 'lr': 7.880914296234578e-05, 'lambda_val': 2.662938714668246e-05, 'batch_size': 1533, 'optimizer': 'RMSprop'}.
2026-05-24 12:46:33,437 - experiment_functions - INFO - Early stopping at epoch 2500. Best Metrics: (0.026902883264479743, 0.020066225165562914, 0.026599308807642483)
2026-05-24 12:46:34,420 - optuna.study.study - INFO - Trial 90 finished with values: [0.026902883264479743, 0.020066225165562914, 0.026599308807642483] and parameters: {'n_layers': 1, 'embedding_dim': 32, 'lr': 0.023222702118018915, 'lambda_val': 0.010466604496576043, 'batch_size': 1352, 'optimizer': 'Adam'}.
2026-05-24 12:46:42,010 - experiment_functions - INFO - Early stopping at epoch 550. Best Metrics: (0.039474261185821584, 0.02677152317880795, 0.03567924687466805)
2026-05-24 12:46:42,131 - optuna.study.study - INFO - Trial 91 finished with values: [0.039474261185821584, 0.02677152317880795, 0.03567924687466805] and parameters: {'n_layers': 2, 'embedding_dim': 96, 'lr': 0.0064837360922671665, 'lambda_val': 1.6384022903021963e-06, 'batch_size': 1081, 'optimizer': 'Adam'}.
2026-05-24 12:47:00,190 - experiment_functions - INFO - Early stopping at epoch 1550. Best Metrics: (0.01351990234383448, 0.013096026490066224, 0.0153350083540779)
2026-05-24 12:47:00,624 - optuna.study.study - INFO - Trial 92 finished with values: [0.01351990234383448, 0.013096026490066224, 0.0153350083540779] and parameters: {'n_layers': 1, 'embedding_dim': 64, 'lr': 0.033589494196969064, 'lambda_val': 0.04136926071879064, 'batch_size': 3193, 'optimizer': 'Adam'}.
2026-05-24 12:47:08,391 - experiment_functions - INFO - Early stopping at epoch 500. Best Metrics: (0.005048226583947212, 0.0040149006622516555, 0.00493416066007724)
2026-05-24 12:47:08,483 - optuna.study.study - INFO - Trial 93 finished with values: [0.005048226583947212, 0.0040149006622516555, 0.00493416066007724] and parameters: {'n_layers': 2, 'embedding_dim': 96, 'lr': 7.598326549962574e-05, 'lambda_val': 0.014499624791208778, 'batch_size': 3665, 'optimizer': 'Adam'}.
2026-05-24 12:47:29,052 - experiment_functions - INFO - Early stopping at epoch 1650. Best Metrics: (0.02128578619381005, 0.014850993377483444, 0.020010873622399776)
2026-05-24 12:47:29,143 - optuna.study.study - INFO - Trial 94 finished with values: [0.02128578619381005, 0.014850993377483444, 0.020010873622399776] and parameters: {'n_layers': 2, 'embedding_dim': 96, 'lr': 0.01925635042875226, 'lambda_val': 0.0010829249528974533, 'batch_size': 3564, 'optimizer': 'RMSprop'}.
2026-05-24 12:48:18,666 - optuna.study.study - INFO - Trial 95 finished with values: [0.022874850791624164, 0.014759933774834436, 0.020526869403004473] and parameters: {'n_layers': 4, 'embedding_dim': 64, 'lr': 0.024144161829978975, 'lambda_val': 0.0011830463992159451, 'batch_size': 2965, 'optimizer': 'RMSprop'}.
2026-05-24 12:49:11,721 - optuna.study.study - INFO - Trial 96 finished with values: [0.042212936822068475, 0.027806291390728474, 0.03922527136365972] and parameters: {'n_layers': 4, 'embedding_dim': 96, 'lr': 0.00012817614150118707, 'lambda_val': 0.00047319112187695436, 'batch_size': 989, 'optimizer': 'Adam'}.
2026-05-24 12:49:21,647 - experiment_functions - INFO - Early stopping at epoch 750. Best Metrics: (0.05880286408780489, 0.03526490066225166, 0.05048418737246141)
2026-05-24 12:49:22,258 - optuna.study.study - INFO - Trial 97 finished with values: [0.05880286408780489, 0.03526490066225166, 0.05048418737246141] and parameters: {'n_layers': 1, 'embedding_dim': 96, 'lr': 0.0017164560979354832, 'lambda_val': 0.0003409068265064018, 'batch_size': 1315, 'optimizer': 'Adam'}.
2026-05-24 12:49:31,140 - experiment_functions - INFO - Early stopping at epoch 650. Best Metrics: (0.005758472050483481, 0.004395695364238411, 0.005702566421791494)
2026-05-24 12:49:31,231 - optuna.study.study - INFO - Trial 98 finished with values: [0.005758472050483481, 0.004395695364238411, 0.005702566421791494] and parameters: {'n_layers': 3, 'embedding_dim': 128, 'lr': 0.0007313058414573923, 'lambda_val': 0.010412011323837839, 'batch_size': 807, 'optimizer': 'SGD'}.
2026-05-24 12:49:48,902 - experiment_functions - INFO - Early stopping at epoch 1550. Best Metrics: (0.005145797910377437, 0.004312913907284768, 0.005345436394198147)
2026-05-24 12:49:48,993 - optuna.study.study - INFO - Trial 99 finished with values: [0.005145797910377437, 0.004312913907284768, 0.005345436394198147] and parameters: {'n_layers': 4, 'embedding_dim': 32, 'lr': 1.4523523653234223e-05, 'lambda_val': 0.0003698300441251501, 'batch_size': 1239, 'optimizer': 'Adam'}.
2026-05-24 12:49:57,477 - experiment_functions - INFO - Early stopping at epoch 650. Best Metrics: (0.06134395025876376, 0.036208609271523175, 0.05325597561929332)
2026-05-24 12:49:57,552 - optuna.study.study - INFO - Trial 100 finished with values: [0.06134395025876376, 0.036208609271523175, 0.05325597561929332] and parameters: {'n_layers': 1, 'embedding_dim': 32, 'lr': 0.004235289187226827, 'lambda_val': 0.007383021531734565, 'batch_size': 563, 'optimizer': 'Adam'}.
2026-05-24 12:50:05,124 - experiment_functions - INFO - Early stopping at epoch 550. Best Metrics: (0.05192548310244468, 0.03182119205298013, 0.04732210230350743)
2026-05-24 12:50:05,225 - optuna.study.study - INFO - Trial 101 finished with values: [0.05192548310244468, 0.03182119205298013, 0.04732210230350743] and parameters: {'n_layers': 2, 'embedding_dim': 96, 'lr': 0.004235289187226827, 'lambda_val': 0.0003409068265064018, 'batch_size': 2525, 'optimizer': 'Adam'}.
2026-05-24 12:50:13,609 - experiment_functions - INFO - Early stopping at epoch 650. Best Metrics: (0.06747212986455503, 0.038435430463576156, 0.058947096369877855)
2026-05-24 12:50:13,694 - optuna.study.study - INFO - Trial 102 finished with values: [0.06747212986455503, 0.038435430463576156, 0.058947096369877855] and parameters: {'n_layers': 1, 'embedding_dim': 64, 'lr': 0.003407247220990805, 'lambda_val': 3.4355332572174856e-05, 'batch_size': 1081, 'optimizer': 'Adam'}.
2026-05-24 12:50:21,675 - experiment_functions - INFO - Early stopping at epoch 600. Best Metrics: (0.059707645834478115, 0.035504966887417215, 0.05276477551564833)
2026-05-24 12:50:21,754 - optuna.study.study - INFO - Trial 103 finished with values: [0.059707645834478115, 0.035504966887417215, 0.05276477551564833] and parameters: {'n_layers': 1, 'embedding_dim': 96, 'lr': 0.004235289187226827, 'lambda_val': 0.0003409068265064018, 'batch_size': 1315, 'optimizer': 'Adam'}.
2026-05-24 12:51:14,281 - optuna.study.study - INFO - Trial 104 finished with values: [0.043118124466313065, 0.027905629139072848, 0.03979753527179503] and parameters: {'n_layers': 4, 'embedding_dim': 96, 'lr': 0.00015112824887092085, 'lambda_val': 0.0006486108685787333, 'batch_size': 1022, 'optimizer': 'Adam'}.
2026-05-24 12:51:26,548 - experiment_functions - INFO - Early stopping at epoch 950. Best Metrics: (0.0578656061557994, 0.034975165562913905, 0.05137601139997663)
2026-05-24 12:51:26,631 - optuna.study.study - INFO - Trial 105 finished with values: [0.0578656061557994, 0.034975165562913905, 0.05137601139997663] and parameters: {'n_layers': 1, 'embedding_dim': 96, 'lr': 0.000684293575282855, 'lambda_val': 0.0018241216708581335, 'batch_size': 3564, 'optimizer': 'Adam'}.
2026-05-24 12:51:56,286 - experiment_functions - INFO - Early stopping at epoch 2600. Best Metrics: (0.01701182214938678, 0.013816225165562914, 0.01780198684693789)
2026-05-24 12:51:56,448 - optuna.study.study - INFO - Trial 106 finished with values: [0.01701182214938678, 0.013816225165562914, 0.01780198684693789] and parameters: {'n_layers': 1, 'embedding_dim': 64, 'lr': 0.024144161829978975, 'lambda_val': 0.0011830463992159451, 'batch_size': 2965, 'optimizer': 'RMSprop'}.
2026-05-24 12:52:15,494 - experiment_functions - INFO - Early stopping at epoch 1450. Best Metrics: (0.0406761225946672, 0.02683774834437086, 0.03697326094371765)
