2026-05-24 14:17:06,918 - optuna.study.study - INFO - Trial 136 finished with values: [0.05260853274064624, 0.03298841059602649, 0.047995687370995] and parameters: {'n_layers': 2, 'embedding_dim': 128, 'lr': 0.0007653011157039608, 'lambda_val': 7.187538783101437e-06, 'batch_size': 1055, 'optimizer': 'Adam'}.
2026-05-24 14:17:13,772 - experiment_functions - INFO - Early stopping at epoch 550. Best Metrics: (0.027563910612028373, 0.01925496688741722, 0.025874072983485614)
2026-05-24 14:17:13,863 - optuna.study.study - INFO - Trial 137 finished with values: [0.027563910612028373, 0.01925496688741722, 0.025874072983485614] and parameters: {'n_layers': 3, 'embedding_dim': 32, 'lr': 0.0018843975064796988, 'lambda_val': 1.4247463760726523e-06, 'batch_size': 3012, 'optimizer': 'RMSprop'}.
2026-05-24 14:17:57,893 - optuna.study.study - INFO - Trial 138 finished with values: [0.02575128909315395, 0.019056291390728477, 0.02502037933816243] and parameters: {'n_layers': 4, 'embedding_dim': 32, 'lr': 0.00012749160505002986, 'lambda_val': 7.187538783101437e-06, 'batch_size': 1238, 'optimizer': 'RMSprop'}.
2026-05-24 14:18:08,646 - experiment_functions - INFO - Early stopping at epoch 850. Best Metrics: (0.053460806739201394, 0.03298013245033113, 0.04945145615595079)
2026-05-24 14:18:08,800 - optuna.study.study - INFO - Trial 139 finished with values: [0.053460806739201394, 0.03298013245033113, 0.04945145615595079] and parameters: {'n_layers': 2, 'embedding_dim': 64, 'lr': 0.0006563002976325864, 'lambda_val': 1.4247463760726523e-06, 'batch_size': 1970, 'optimizer': 'Adam'}.
2026-05-24 14:18:15,508 - experiment_functions - INFO - Early stopping at epoch 550. Best Metrics: (0.026980756780809217, 0.01990066225165563, 0.026105849139985562)
2026-05-24 14:18:16,031 - optuna.study.study - INFO - Trial 140 finished with values: [0.026980756780809217, 0.01990066225165563, 0.026105849139985562] and parameters: {'n_layers': 2, 'embedding_dim': 32, 'lr': 0.01245800478955897, 'lambda_val': 2.6431113659875313e-06, 'batch_size': 1236, 'optimizer': 'Adam'}.
2026-05-24 14:18:22,830 - experiment_functions - INFO - Early stopping at epoch 550. Best Metrics: (0.01389830656788614, 0.013468543046357615, 0.015570390734034533)
2026-05-24 14:18:23,502 - optuna.study.study - INFO - Trial 141 finished with values: [0.01389830656788614, 0.013468543046357615, 0.015570390734034533] and parameters: {'n_layers': 1, 'embedding_dim': 96, 'lr': 0.01245800478955897, 'lambda_val': 0.03939417378241408, 'batch_size': 2103, 'optimizer': 'Adam'}.
2026-05-24 14:18:30,982 - experiment_functions - INFO - Early stopping at epoch 500. Best Metrics: (0.012348267766230913, 0.009759933774834438, 0.012312581541831487)
2026-05-24 14:18:31,088 - optuna.study.study - INFO - Trial 142 finished with values: [0.012348267766230913, 0.009759933774834438, 0.012312581541831487] and parameters: {'n_layers': 2, 'embedding_dim': 256, 'lr': 0.09366172543326454, 'lambda_val': 2.6934776912320816e-05, 'batch_size': 1236, 'optimizer': 'RMSprop'}.
2026-05-24 14:19:10,452 - experiment_functions - INFO - Early stopping at epoch 3250. Best Metrics: (0.02218757753586496, 0.012632450331125828, 0.01829465640443645)
2026-05-24 14:19:10,537 - optuna.study.study - INFO - Trial 143 finished with values: [0.02218757753586496, 0.012632450331125828, 0.01829465640443645] and parameters: {'n_layers': 4, 'embedding_dim': 96, 'lr': 0.01245800478955897, 'lambda_val': 7.985064351552862e-06, 'batch_size': 530, 'optimizer': 'Adam'}.
2026-05-24 14:19:24,430 - experiment_functions - INFO - Early stopping at epoch 1150. Best Metrics: (0.02836567196367386, 0.01820364238410596, 0.026488224065423487)
2026-05-24 14:19:24,522 - optuna.study.study - INFO - Trial 144 finished with values: [0.02836567196367386, 0.01820364238410596, 0.026488224065423487] and parameters: {'n_layers': 2, 'embedding_dim': 96, 'lr': 0.00914986330156684, 'lambda_val': 1.4446750706679519e-05, 'batch_size': 1236, 'optimizer': 'RMSprop'}.
2026-05-24 14:19:34,638 - experiment_functions - INFO - Early stopping at epoch 800. Best Metrics: (0.02619111799079385, 0.01685430463576159, 0.023509929647372366)
2026-05-24 14:19:34,727 - optuna.study.study - INFO - Trial 145 finished with values: [0.02619111799079385, 0.01685430463576159, 0.023509929647372366] and parameters: {'n_layers': 2, 'embedding_dim': 96, 'lr': 0.01245800478955897, 'lambda_val': 7.011674546086162e-05, 'batch_size': 3012, 'optimizer': 'RMSprop'}.
2026-05-24 14:19:43,597 - experiment_functions - INFO - Early stopping at epoch 550. Best Metrics: (0.023554122395023448, 0.018543046357615896, 0.023526416859466864)
2026-05-24 14:19:44,039 - optuna.study.study - INFO - Trial 146 finished with values: [0.023554122395023448, 0.018543046357615896, 0.023526416859466864] and parameters: {'n_layers': 3, 'embedding_dim': 256, 'lr': 0.0009315403640444384, 'lambda_val': 0.0031836753862071, 'batch_size': 1834, 'optimizer': 'RMSprop'}.
2026-05-24 14:20:28,515 - optuna.study.study - INFO - Trial 147 finished with values: [0.05323829384178046, 0.032996688741721854, 0.047190628047527695] and parameters: {'n_layers': 2, 'embedding_dim': 32, 'lr': 0.0002249192915429732, 'lambda_val': 2.0723645088674174e-05, 'batch_size': 2154, 'optimizer': 'RMSprop'}.
2026-05-24 14:20:37,318 - experiment_functions - INFO - Early stopping at epoch 600. Best Metrics: (0.035506333657810904, 0.02370033112582781, 0.03199754648715443)
2026-05-24 14:20:37,413 - optuna.study.study - INFO - Trial 148 finished with values: [0.035506333657810904, 0.02370033112582781, 0.03199754648715443] and parameters: {'n_layers': 4, 'embedding_dim': 128, 'lr': 0.0011385009641030693, 'lambda_val': 0.00036119255164558764, 'batch_size': 1494, 'optimizer': 'Adam'}.
2026-05-24 14:21:03,106 - experiment_functions - INFO - Early stopping at epoch 2550. Best Metrics: (0.005601805365538308, 0.0042632450331125836, 0.00558377858088502)
2026-05-24 14:21:03,194 - optuna.study.study - INFO - Trial 149 finished with values: [0.005601805365538308, 0.0042632450331125836, 0.00558377858088502] and parameters: {'n_layers': 1, 'embedding_dim': 96, 'lr': 7.77789201306019e-05, 'lambda_val': 7.011674546086162e-05, 'batch_size': 1236, 'optimizer': 'Adam'}.
2026-05-24 14:21:17,583 - experiment_functions - INFO - Early stopping at epoch 1150. Best Metrics: (0.04798207770858031, 0.03083609271523179, 0.04474355757276426)
2026-05-24 14:21:17,934 - optuna.study.study - INFO - Trial 150 finished with values: [0.04798207770858031, 0.03083609271523179, 0.04474355757276426] and parameters: {'n_layers': 2, 'embedding_dim': 96, 'lr': 0.0003540171758009511, 'lambda_val': 0.0034713999695200454, 'batch_size': 2532, 'optimizer': 'Adam'}.
2026-05-24 14:21:30,179 - experiment_functions - INFO - Early stopping at epoch 900. Best Metrics: (0.03770486965623348, 0.025753311258278146, 0.03459428025249753)
2026-05-24 14:21:30,347 - optuna.study.study - INFO - Trial 151 finished with values: [0.03770486965623348, 0.025753311258278146, 0.03459428025249753] and parameters: {'n_layers': 4, 'embedding_dim': 96, 'lr': 0.00028626012255777994, 'lambda_val': 0.0058310100320713406, 'batch_size': 1236, 'optimizer': 'RMSprop'}.
2026-05-24 14:22:14,250 - optuna.study.study - INFO - Trial 152 finished with values: [0.04967830339068671, 0.03134933774834438, 0.04384034024138169] and parameters: {'n_layers': 2, 'embedding_dim': 32, 'lr': 0.0002249192915429732, 'lambda_val': 2.0723645088674174e-05, 'batch_size': 2154, 'optimizer': 'RMSprop'}.
2026-05-24 14:22:28,587 - experiment_functions - INFO - Early stopping at epoch 1100. Best Metrics: (0.05379269601344397, 0.033468543046357616, 0.04852946648226108)
2026-05-24 14:22:28,680 - optuna.study.study - INFO - Trial 153 finished with values: [0.05379269601344397, 0.033468543046357616, 0.04852946648226108] and parameters: {'n_layers': 1, 'embedding_dim': 256, 'lr': 0.0005264581247601549, 'lambda_val': 7.985064351552862e-06, 'batch_size': 3353, 'optimizer': 'Adam'}.
2026-05-24 14:22:44,902 - experiment_functions - INFO - Early stopping at epoch 1350. Best Metrics: (0.026663220893442283, 0.016183774834437087, 0.023272612732333064)
2026-05-24 14:22:45,041 - optuna.study.study - INFO - Trial 154 finished with values: [0.026663220893442283, 0.016183774834437087, 0.023272612732333064] and parameters: {'n_layers': 2, 'embedding_dim': 128, 'lr': 0.01245800478955897, 'lambda_val': 7.187538783101437e-06, 'batch_size': 1055, 'optimizer': 'Adam'}.
2026-05-24 14:23:09,874 - experiment_functions - INFO - Early stopping at epoch 1900. Best Metrics: (0.04761930903704029, 0.03037251655629139, 0.04389806711205965)
2026-05-24 14:23:10,297 - optuna.study.study - INFO - Trial 155 finished with values: [0.04761930903704029, 0.03037251655629139, 0.04389806711205965] and parameters: {'n_layers': 3, 'embedding_dim': 128, 'lr': 0.0002249192915429732, 'lambda_val': 0.0009801820764399163, 'batch_size': 968, 'optimizer': 'RMSprop'}.
2026-05-24 14:23:27,874 - experiment_functions - INFO - Early stopping at epoch 1050. Best Metrics: (0.039619337960270395, 0.02616721854304636, 0.03735758085416059)
2026-05-24 14:23:27,967 - optuna.study.study - INFO - Trial 156 finished with values: [0.039619337960270395, 0.02616721854304636, 0.03735758085416059] and parameters: {'n_layers': 4, 'embedding_dim': 256, 'lr': 0.0002249192915429732, 'lambda_val': 7.011674546086162e-05, 'batch_size': 1055, 'optimizer': 'RMSprop'}.
2026-05-24 14:23:34,720 - experiment_functions - INFO - Early stopping at epoch 550. Best Metrics: (0.004967503018926592, 0.00429635761589404, 0.005545288806933533)
2026-05-24 14:23:34,818 - optuna.study.study - INFO - Trial 157 finished with values: [0.004967503018926592, 0.00429635761589404, 0.005545288806933533] and parameters: {'n_layers': 1, 'embedding_dim': 96, 'lr': 2.6658368881114617e-05, 'lambda_val': 0.0034713999695200454, 'batch_size': 3935, 'optimizer': 'Adam'}.
2026-05-24 14:23:47,767 - experiment_functions - INFO - Early stopping at epoch 1000. Best Metrics: (0.0389835512300911, 0.025637417218543044, 0.03604758312347374)
2026-05-24 14:23:47,889 - optuna.study.study - INFO - Trial 158 finished with values: [0.0389835512300911, 0.025637417218543044, 0.03604758312347374] and parameters: {'n_layers': 3, 'embedding_dim': 96, 'lr': 0.00030176895436135383, 'lambda_val': 0.000339235643209516, 'batch_size': 2318, 'optimizer': 'Adam'}.
2026-05-24 14:24:02,834 - experiment_functions - INFO - Early stopping at epoch 1150. Best Metrics: (0.049699215034286585, 0.030728476821192056, 0.04411690865440903)
2026-05-24 14:24:02,958 - optuna.study.study - INFO - Trial 159 finished with values: [0.049699215034286585, 0.030728476821192056, 0.04411690865440903] and parameters: {'n_layers': 3, 'embedding_dim': 96, 'lr': 0.0003859482391059796, 'lambda_val': 0.000339235643209516, 'batch_size': 1042, 'optimizer': 'Adam'}.
2026-05-24 14:24:20,051 - experiment_functions - INFO - Early stopping at epoch 1450. Best Metrics: (0.04173599946742672, 0.026945364238410596, 0.04139455547362877)
2026-05-24 14:24:20,136 - optuna.study.study - INFO - Trial 160 finished with values: [0.04173599946742672, 0.026945364238410596, 0.04139455547362877] and parameters: {'n_layers': 3, 'embedding_dim': 32, 'lr': 0.00030176895436135383, 'lambda_val': 0.000339235643209516, 'batch_size': 2318, 'optimizer': 'Adam'}.
2026-05-24 14:24:31,225 - experiment_functions - INFO - Early stopping at epoch 850. Best Metrics: (0.061906748590413715, 0.03641556291390729, 0.055682720988697865)
2026-05-24 14:24:31,422 - optuna.study.study - INFO - Trial 161 finished with values: [0.061906748590413715, 0.03641556291390729, 0.055682720988697865] and parameters: {'n_layers': 2, 'embedding_dim': 128, 'lr': 0.0007653011157039608, 'lambda_val': 7.187538783101437e-06, 'batch_size': 1055, 'optimizer': 'Adam'}.
2026-05-24 14:24:51,520 - experiment_functions - INFO - Early stopping at epoch 1600. Best Metrics: (0.061649585323904056, 0.03701986754966888, 0.05396117871489199)
2026-05-24 14:24:51,999 - optuna.study.study - INFO - Trial 162 finished with values: [0.061649585323904056, 0.03701986754966888, 0.05396117871489199] and parameters: {'n_layers': 1, 'embedding_dim': 256, 'lr': 0.0007653011157039608, 'lambda_val': 2.6431113659875313e-06, 'batch_size': 606, 'optimizer': 'Adam'}.
2026-05-24 14:25:03,836 - experiment_functions - INFO - Early stopping at epoch 800. Best Metrics: (0.04672609328316342, 0.02971026490066225, 0.04224758034501548)
2026-05-24 14:25:03,939 - optuna.study.study - INFO - Trial 163 finished with values: [0.04672609328316342, 0.02971026490066225, 0.04224758034501548] and parameters: {'n_layers': 2, 'embedding_dim': 256, 'lr': 0.0003540171758009511, 'lambda_val': 1.4446750706679519e-05, 'batch_size': 3012, 'optimizer': 'RMSprop'}.
2026-05-24 14:25:16,892 - experiment_functions - INFO - Early stopping at epoch 750. Best Metrics: (0.03188543815294091, 0.0219205298013245, 0.030041588684079103)
2026-05-24 14:25:18,091 - optuna.study.study - INFO - Trial 164 finished with values: [0.03188543815294091, 0.0219205298013245, 0.030041588684079103] and parameters: {'n_layers': 4, 'embedding_dim': 256, 'lr': 0.0003597678975110087, 'lambda_val': 7.187538783101437e-06, 'batch_size': 3618, 'optimizer': 'Adam'}.
2026-05-24 14:25:25,884 - experiment_functions - INFO - Early stopping at epoch 550. Best Metrics: (0.028307137630897948, 0.019908940397350992, 0.027896589001572616)
2026-05-24 14:25:25,996 - optuna.study.study - INFO - Trial 165 finished with values: [0.028307137630897948, 0.019908940397350992, 0.027896589001572616] and parameters: {'n_layers': 4, 'embedding_dim': 96, 'lr': 0.0011385009641030693, 'lambda_val': 1.4247463760726523e-06, 'batch_size': 1236, 'optimizer': 'RMSprop'}.
2026-05-24 14:25:35,130 - experiment_functions - INFO - Early stopping at epoch 650. Best Metrics: (0.038869207808717395, 0.02680463576158941, 0.03808244628919535)
2026-05-24 14:25:35,215 - optuna.study.study - INFO - Trial 166 finished with values: [0.038869207808717395, 0.02680463576158941, 0.03808244628919535] and parameters: {'n_layers': 4, 'embedding_dim': 96, 'lr': 0.0011385009641030693, 'lambda_val': 3.680187922808272e-05, 'batch_size': 875, 'optimizer': 'Adam'}.
2026-05-24 14:26:18,388 - optuna.study.study - INFO - Trial 167 finished with values: [0.03249942014240244, 0.021986754966887418, 0.030892481532658757] and parameters: {'n_layers': 2, 'embedding_dim': 32, 'lr': 0.00012749160505002986, 'lambda_val': 0.0034713999695200454, 'batch_size': 3462, 'optimizer': 'RMSprop'}.
2026-05-24 14:26:28,345 - experiment_functions - INFO - Early stopping at epoch 750. Best Metrics: (0.052644979628511876, 0.03272350993377483, 0.046611392036123356)
2026-05-24 14:26:28,440 - optuna.study.study - INFO - Trial 168 finished with values: [0.052644979628511876, 0.03272350993377483, 0.046611392036123356] and parameters: {'n_layers': 2, 'embedding_dim': 128, 'lr': 0.0007653011157039608, 'lambda_val': 0.0007701916075392747, 'batch_size': 1970, 'optimizer': 'Adam'}.
2026-05-24 14:26:39,668 - experiment_functions - INFO - Early stopping at epoch 850. Best Metrics: (0.04206760342877774, 0.02682119205298013, 0.038495998115683674)
2026-05-24 14:26:40,362 - optuna.study.study - INFO - Trial 169 finished with values: [0.04206760342877774, 0.02682119205298013, 0.038495998115683674] and parameters: {'n_layers': 3, 'embedding_dim': 96, 'lr': 0.0003859482391059796, 'lambda_val': 7.011674546086162e-05, 'batch_size': 1438, 'optimizer': 'RMSprop'}.
2026-05-24 14:26:51,172 - experiment_functions - INFO - Early stopping at epoch 850. Best Metrics: (0.04901124968429969, 0.03052980132450331, 0.04428880160608995)
2026-05-24 14:26:51,265 - optuna.study.study - INFO - Trial 170 finished with values: [0.04901124968429969, 0.03052980132450331, 0.04428880160608995] and parameters: {'n_layers': 3, 'embedding_dim': 64, 'lr': 0.0006563002976325864, 'lambda_val': 0.000339235643209516, 'batch_size': 968, 'optimizer': 'Adam'}.
2026-05-24 14:27:04,561 - experiment_functions - INFO - Early stopping at epoch 1100. Best Metrics: (0.045452132991578534, 0.02880794701986755, 0.04200833539721618)
2026-05-24 14:27:05,371 - optuna.study.study - INFO - Trial 171 finished with values: [0.045452132991578534, 0.02880794701986755, 0.04200833539721618] and parameters: {'n_layers': 3, 'embedding_dim': 32, 'lr': 0.0005496090398292237, 'lambda_val': 9.772502453834702e-06, 'batch_size': 1062, 'optimizer': 'Adam'}.
2026-05-24 14:27:12,900 - experiment_functions - INFO - Early stopping at epoch 500. Best Metrics: (0.005219977925833673, 0.004246688741721854, 0.005503887061766567)
2026-05-24 14:27:13,880 - optuna.study.study - INFO - Trial 172 finished with values: [0.005219977925833673, 0.004246688741721854, 0.005503887061766567] and parameters: {'n_layers': 4, 'embedding_dim': 128, 'lr': 0.00030176895436135383, 'lambda_val': 0.000339235643209516, 'batch_size': 2672, 'optimizer': 'SGD'}.
2026-05-24 14:28:00,450 - optuna.study.study - INFO - Trial 173 finished with values: [0.045267935679432346, 0.03003311258278146, 0.04133258269256069] and parameters: {'n_layers': 4, 'embedding_dim': 32, 'lr': 0.0002249192915429732, 'lambda_val': 0.0009801820764399163, 'batch_size': 968, 'optimizer': 'RMSprop'}.
2026-05-24 14:28:10,098 - experiment_functions - INFO - Early stopping at epoch 550. Best Metrics: (0.02500698861045843, 0.017988410596026492, 0.02346138404783445)
2026-05-24 14:28:10,278 - optuna.study.study - INFO - Trial 174 finished with values: [0.02500698861045843, 0.017988410596026492, 0.02346138404783445] and parameters: {'n_layers': 4, 'embedding_dim': 256, 'lr': 0.0007653011157039608, 'lambda_val': 7.011674546086162e-05, 'batch_size': 2532, 'optimizer': 'RMSprop'}.
2026-05-24 14:28:21,010 - experiment_functions - INFO - Early stopping at epoch 900. Best Metrics: (0.04822981860543119, 0.030430463576158938, 0.04365478086312442)
2026-05-24 14:28:21,342 - optuna.study.study - INFO - Trial 175 finished with values: [0.04822981860543119, 0.030430463576158938, 0.04365478086312442] and parameters: {'n_layers': 2, 'embedding_dim': 32, 'lr': 0.0007653011157039608, 'lambda_val': 3.1246121066332336e-06, 'batch_size': 1970, 'optimizer': 'Adam'}.
2026-05-24 14:28:27,725 - experiment_functions - INFO - Early stopping at epoch 500. Best Metrics: (0.012289977912741784, 0.009312913907284769, 0.012611048345542731)
2026-05-24 14:28:27,817 - optuna.study.study - INFO - Trial 176 finished with values: [0.012289977912741784, 0.009312913907284769, 0.012611048345542731] and parameters: {'n_layers': 4, 'embedding_dim': 32, 'lr': 0.06574660783298517, 'lambda_val': 9.772502453834702e-06, 'batch_size': 2532, 'optimizer': 'RMSprop'}.
2026-05-24 14:28:37,286 - experiment_functions - INFO - Early stopping at epoch 650. Best Metrics: (0.029680581162290012, 0.02106788079470199, 0.0282929275142902)
2026-05-24 14:28:37,571 - optuna.study.study - INFO - Trial 177 finished with values: [0.029680581162290012, 0.02106788079470199, 0.0282929275142902] and parameters: {'n_layers': 4, 'embedding_dim': 128, 'lr': 0.0007653011157039608, 'lambda_val': 1.4247463760726523e-06, 'batch_size': 3328, 'optimizer': 'Adam'}.
2026-05-24 14:28:52,016 - experiment_functions - INFO - Early stopping at epoch 1200. Best Metrics: (0.02558009020776325, 0.015695364238410597, 0.02286453758940496)
2026-05-24 14:28:52,112 - optuna.study.study - INFO - Trial 178 finished with values: [0.02558009020776325, 0.015695364238410597, 0.02286453758940496] and parameters: {'n_layers': 2, 'embedding_dim': 96, 'lr': 0.01245800478955897, 'lambda_val': 5.3247984790283065e-06, 'batch_size': 1236, 'optimizer': 'Adam'}.
2026-05-24 14:28:59,463 - experiment_functions - INFO - Early stopping at epoch 550. Best Metrics: (0.03495077505761038, 0.022574503311258282, 0.0314808967902454)
2026-05-24 14:28:59,562 - optuna.study.study - INFO - Trial 179 finished with values: [0.03495077505761038, 0.022574503311258282, 0.0314808967902454] and parameters: {'n_layers': 4, 'embedding_dim': 64, 'lr': 0.005319510559384135, 'lambda_val': 1.4247463760726523e-06, 'batch_size': 1042, 'optimizer': 'Adam'}.
2026-05-24 14:29:38,106 - experiment_functions - INFO - Early stopping at epoch 2900. Best Metrics: (0.03406593789093164, 0.021175496688741722, 0.030359728669479936)
2026-05-24 14:29:38,198 - optuna.study.study - INFO - Trial 180 finished with values: [0.03406593789093164, 0.021175496688741722, 0.030359728669479936] and parameters: {'n_layers': 2, 'embedding_dim': 256, 'lr': 0.004735427848686482, 'lambda_val': 7.011674546086162e-05, 'batch_size': 606, 'optimizer': 'RMSprop'}.
2026-05-24 14:29:46,333 - experiment_functions - INFO - Early stopping at epoch 650. Best Metrics: (0.04460669052998822, 0.02906456953642384, 0.04128863379781458)
2026-05-24 14:29:46,435 - optuna.study.study - INFO - Trial 181 finished with values: [0.04460669052998822, 0.02906456953642384, 0.04128863379781458] and parameters: {'n_layers': 2, 'embedding_dim': 64, 'lr': 0.0007653011157039608, 'lambda_val': 0.0030678147239284856, 'batch_size': 2154, 'optimizer': 'RMSprop'}.
2026-05-24 14:29:53,943 - experiment_functions - INFO - Early stopping at epoch 600. Best Metrics: (0.041526145954356546, 0.026961920529801325, 0.03873113855241006)
2026-05-24 14:29:54,029 - optuna.study.study - INFO - Trial 182 finished with values: [0.041526145954356546, 0.026961920529801325, 0.03873113855241006] and parameters: {'n_layers': 2, 'embedding_dim': 32, 'lr': 0.0018843975064796988, 'lambda_val': 8.741811894816274e-05, 'batch_size': 3012, 'optimizer': 'Adam'}.
2026-05-24 14:30:02,054 - experiment_functions - INFO - Early stopping at epoch 550. Best Metrics: (0.030945366683198118, 0.021937086092715233, 0.028988951570736367)
2026-05-24 14:30:02,152 - optuna.study.study - INFO - Trial 183 finished with values: [0.030945366683198118, 0.021937086092715233, 0.028988951570736367] and parameters: {'n_layers': 3, 'embedding_dim': 128, 'lr': 0.0007653011157039608, 'lambda_val': 0.0030678147239284856, 'batch_size': 3209, 'optimizer': 'RMSprop'}.
