2026-05-24 08:18:32,135 - optuna.study.study - INFO - Trial 15 finished with values: [0.004875545966130128, 0.004412251655629139, 0.005349091372548329] and parameters: {'n_layers': 2, 'embedding_dim': 32, 'lr': 2.291796767126894e-05, 'lambda_val': 1.8081595289686438e-06, 'batch_size': 592, 'optimizer': 'RMSprop'}.
2026-05-24 08:18:39,769 - experiment_functions - INFO - Early stopping at epoch 500. Best Metrics: (0.004990487666982221, 0.004403973509933775, 0.005302760658349423)
2026-05-24 08:18:39,861 - optuna.study.study - INFO - Trial 16 finished with values: [0.004990487666982221, 0.004403973509933775, 0.005302760658349423] and parameters: {'n_layers': 4, 'embedding_dim': 128, 'lr': 0.012284452742644272, 'lambda_val': 2.0338336707600834e-05, 'batch_size': 610, 'optimizer': 'SGD'}.
2026-05-24 08:18:47,783 - experiment_functions - INFO - Early stopping at epoch 500. Best Metrics: (0.005429658874408977, 0.004461920529801325, 0.005688526261028442)
2026-05-24 08:18:49,304 - optuna.study.study - INFO - Trial 17 finished with values: [0.005429658874408977, 0.004461920529801325, 0.005688526261028442] and parameters: {'n_layers': 3, 'embedding_dim': 256, 'lr': 0.09136477353131199, 'lambda_val': 0.0019877005245727054, 'batch_size': 1342, 'optimizer': 'SGD'}.
2026-05-24 08:18:55,951 - experiment_functions - INFO - Early stopping at epoch 500. Best Metrics: (0.00584599943060103, 0.004420529801324504, 0.0056244057524826975)
2026-05-24 08:18:56,878 - optuna.study.study - INFO - Trial 18 finished with values: [0.00584599943060103, 0.004420529801324504, 0.0056244057524826975] and parameters: {'n_layers': 1, 'embedding_dim': 96, 'lr': 0.00015717441755135915, 'lambda_val': 0.08233878044568804, 'batch_size': 3333, 'optimizer': 'SGD'}.
2026-05-24 08:19:20,368 - experiment_functions - INFO - Early stopping at epoch 1800. Best Metrics: (0.015699965281650376, 0.012798013245033114, 0.01634381703635818)
2026-05-24 08:19:21,357 - optuna.study.study - INFO - Trial 19 finished with values: [0.015699965281650376, 0.012798013245033114, 0.01634381703635818] and parameters: {'n_layers': 3, 'embedding_dim': 128, 'lr': 0.007394794471249828, 'lambda_val': 0.007566098648304109, 'batch_size': 3538, 'optimizer': 'RMSprop'}.
2026-05-24 08:19:28,342 - experiment_functions - INFO - Early stopping at epoch 500. Best Metrics: (0.004774162839123742, 0.004304635761589405, 0.005004776649808359)
2026-05-24 08:19:28,506 - optuna.study.study - INFO - Trial 20 finished with values: [0.004774162839123742, 0.004304635761589405, 0.005004776649808359] and parameters: {'n_layers': 2, 'embedding_dim': 128, 'lr': 5.6268998919697126e-05, 'lambda_val': 1.157908306146744e-06, 'batch_size': 2812, 'optimizer': 'SGD'}.
2026-05-24 08:19:42,210 - experiment_functions - INFO - Early stopping at epoch 1150. Best Metrics: (0.010667097028488205, 0.009470198675496689, 0.01171049232932741)
2026-05-24 08:19:42,296 - optuna.study.study - INFO - Trial 21 finished with values: [0.010667097028488205, 0.009470198675496689, 0.01171049232932741] and parameters: {'n_layers': 1, 'embedding_dim': 128, 'lr': 0.038976708230670724, 'lambda_val': 8.523357255734578e-06, 'batch_size': 1635, 'optimizer': 'RMSprop'}.
2026-05-24 08:19:48,777 - experiment_functions - INFO - Early stopping at epoch 500. Best Metrics: (0.005134661990203982, 0.0041390728476821195, 0.005297807533458297)
2026-05-24 08:19:49,832 - optuna.study.study - INFO - Trial 22 finished with values: [0.005134661990203982, 0.0041390728476821195, 0.005297807533458297] and parameters: {'n_layers': 2, 'embedding_dim': 96, 'lr': 2.0569711974797392e-05, 'lambda_val': 0.0009584392956396668, 'batch_size': 3275, 'optimizer': 'SGD'}.
2026-05-24 08:20:46,445 - experiment_functions - INFO - Early stopping at epoch 3800. Best Metrics: (0.03902806900067204, 0.026961920529801325, 0.03625482783285353)
2026-05-24 08:20:46,534 - optuna.study.study - INFO - Trial 23 finished with values: [0.03902806900067204, 0.026961920529801325, 0.03625482783285353] and parameters: {'n_layers': 3, 'embedding_dim': 256, 'lr': 0.00012197369968794222, 'lambda_val': 0.012192357251689472, 'batch_size': 1189, 'optimizer': 'RMSprop'}.
2026-05-24 08:20:55,488 - experiment_functions - INFO - Early stopping at epoch 500. Best Metrics: (0.01949177580809015, 0.013791390728476821, 0.02002549393210029)
2026-05-24 08:20:56,443 - optuna.study.study - INFO - Trial 24 finished with values: [0.01949177580809015, 0.013791390728476821, 0.02002549393210029] and parameters: {'n_layers': 4, 'embedding_dim': 256, 'lr': 0.07658891258151727, 'lambda_val': 0.00029167129961628466, 'batch_size': 2051, 'optimizer': 'RMSprop'}.
2026-05-24 08:21:03,020 - experiment_functions - INFO - Early stopping at epoch 500. Best Metrics: (0.004644762457715799, 0.003907284768211921, 0.00482582257355101)
2026-05-24 08:21:03,150 - optuna.study.study - INFO - Trial 25 finished with values: [0.004644762457715799, 0.003907284768211921, 0.00482582257355101] and parameters: {'n_layers': 2, 'embedding_dim': 64, 'lr': 0.000438414345650639, 'lambda_val': 1.2241270193234235e-05, 'batch_size': 1279, 'optimizer': 'SGD'}.
2026-05-24 08:21:09,744 - experiment_functions - INFO - Early stopping at epoch 500. Best Metrics: (0.005458092198588391, 0.00396523178807947, 0.005305614004328438)
2026-05-24 08:21:09,825 - optuna.study.study - INFO - Trial 26 finished with values: [0.005458092198588391, 0.00396523178807947, 0.005305614004328438] and parameters: {'n_layers': 2, 'embedding_dim': 96, 'lr': 0.0032608429322007904, 'lambda_val': 0.0006300408109060421, 'batch_size': 1445, 'optimizer': 'SGD'}.
2026-05-24 08:21:16,378 - experiment_functions - INFO - Early stopping at epoch 500. Best Metrics: (0.004424562992336193, 0.003874172185430464, 0.004602814917561976)
2026-05-24 08:21:16,754 - optuna.study.study - INFO - Trial 27 finished with values: [0.004424562992336193, 0.003874172185430464, 0.004602814917561976] and parameters: {'n_layers': 4, 'embedding_dim': 32, 'lr': 1.3690003472125729e-05, 'lambda_val': 0.0013940727337180328, 'batch_size': 3410, 'optimizer': 'SGD'}.
2026-05-24 08:22:03,263 - optuna.study.study - INFO - Trial 28 finished with values: [0.03015420318062838, 0.01997516556291391, 0.02763702518579713] and parameters: {'n_layers': 4, 'embedding_dim': 32, 'lr': 0.0001535328009845102, 'lambda_val': 2.346379884027025e-05, 'batch_size': 1833, 'optimizer': 'RMSprop'}.
2026-05-24 08:22:13,544 - experiment_functions - INFO - Early stopping at epoch 800. Best Metrics: (0.05301417593364925, 0.0339569536423841, 0.04832792341494881)
2026-05-24 08:22:14,645 - optuna.study.study - INFO - Trial 29 finished with values: [0.05301417593364925, 0.0339569536423841, 0.04832792341494881] and parameters: {'n_layers': 1, 'embedding_dim': 96, 'lr': 0.0006190490451202456, 'lambda_val': 0.0393518625138606, 'batch_size': 2675, 'optimizer': 'RMSprop'}.
2026-05-24 08:23:09,904 - optuna.study.study - INFO - Trial 30 finished with values: [0.039256417293286966, 0.02557119205298013, 0.037675049881629515] and parameters: {'n_layers': 4, 'embedding_dim': 128, 'lr': 0.00010049142370938069, 'lambda_val': 8.455049892667247e-06, 'batch_size': 1011, 'optimizer': 'RMSprop'}.
2026-05-24 08:23:20,700 - experiment_functions - INFO - Early stopping at epoch 850. Best Metrics: (0.01792166356142614, 0.014511589403973511, 0.01880090854759485)
2026-05-24 08:23:21,459 - optuna.study.study - INFO - Trial 31 finished with values: [0.01792166356142614, 0.014511589403973511, 0.01880090854759485] and parameters: {'n_layers': 1, 'embedding_dim': 96, 'lr': 0.016831383434644576, 'lambda_val': 8.046703555335414e-05, 'batch_size': 3069, 'optimizer': 'RMSprop'}.
2026-05-24 08:23:36,994 - experiment_functions - INFO - Early stopping at epoch 1300. Best Metrics: (0.005394634586167394, 0.004263245033112583, 0.005297312817720811)
2026-05-24 08:23:37,570 - optuna.study.study - INFO - Trial 32 finished with values: [0.005394634586167394, 0.004263245033112583, 0.005297312817720811] and parameters: {'n_layers': 3, 'embedding_dim': 64, 'lr': 1.1102646596738793e-05, 'lambda_val': 0.00012328074547414633, 'batch_size': 2044, 'optimizer': 'Adam'}.
2026-05-24 08:23:48,980 - experiment_functions - INFO - Early stopping at epoch 950. Best Metrics: (0.005488961843420384, 0.004172185430463576, 0.005387981614659204)
2026-05-24 08:23:49,983 - optuna.study.study - INFO - Trial 33 finished with values: [0.005488961843420384, 0.004172185430463576, 0.005387981614659204] and parameters: {'n_layers': 2, 'embedding_dim': 96, 'lr': 0.026120940360928036, 'lambda_val': 8.221737465473925e-06, 'batch_size': 3259, 'optimizer': 'SGD'}.
2026-05-24 08:23:57,455 - experiment_functions - INFO - Early stopping at epoch 550. Best Metrics: (0.005524640525249318, 0.004486754966887417, 0.005699040523239459)
2026-05-24 08:23:57,543 - optuna.study.study - INFO - Trial 34 finished with values: [0.005524640525249318, 0.004486754966887417, 0.005699040523239459] and parameters: {'n_layers': 2, 'embedding_dim': 128, 'lr': 1.994321668515169e-05, 'lambda_val': 0.0014947635378366633, 'batch_size': 914, 'optimizer': 'RMSprop'}.
2026-05-24 08:24:04,918 - experiment_functions - INFO - Early stopping at epoch 500. Best Metrics: (0.010724517242786969, 0.009503311258278146, 0.011626697736030566)
2026-05-24 08:24:05,018 - optuna.study.study - INFO - Trial 35 finished with values: [0.010724517242786969, 0.009503311258278146, 0.011626697736030566] and parameters: {'n_layers': 2, 'embedding_dim': 256, 'lr': 0.08770431760892448, 'lambda_val': 0.011013627734671632, 'batch_size': 669, 'optimizer': 'RMSprop'}.
2026-05-24 08:24:24,224 - experiment_functions - INFO - Early stopping at epoch 1350. Best Metrics: (0.026868160138983466, 0.014370860927152318, 0.021366433047708973)
2026-05-24 08:24:24,368 - optuna.study.study - INFO - Trial 36 finished with values: [0.026868160138983466, 0.014370860927152318, 0.021366433047708973] and parameters: {'n_layers': 4, 'embedding_dim': 128, 'lr': 0.011587678380610592, 'lambda_val': 1.415798354583243e-06, 'batch_size': 3275, 'optimizer': 'RMSprop'}.
2026-05-24 08:25:08,125 - experiment_functions - INFO - Early stopping at epoch 2900. Best Metrics: (0.026283965966564498, 0.017433774834437088, 0.024676810072451177)
2026-05-24 08:25:08,252 - optuna.study.study - INFO - Trial 37 finished with values: [0.026283965966564498, 0.017433774834437088, 0.024676810072451177] and parameters: {'n_layers': 3, 'embedding_dim': 256, 'lr': 0.017832494932834512, 'lambda_val': 0.002521356201322369, 'batch_size': 3605, 'optimizer': 'Adam'}.
2026-05-24 08:25:16,323 - experiment_functions - INFO - Early stopping at epoch 550. Best Metrics: (0.03077418569963539, 0.02109271523178808, 0.02860824209700633)
2026-05-24 08:25:16,412 - optuna.study.study - INFO - Trial 38 finished with values: [0.03077418569963539, 0.02109271523178808, 0.02860824209700633] and parameters: {'n_layers': 4, 'embedding_dim': 96, 'lr': 0.002221889493840201, 'lambda_val': 0.000963421834632777, 'batch_size': 3424, 'optimizer': 'Adam'}.
2026-05-24 08:25:25,402 - experiment_functions - INFO - Early stopping at epoch 600. Best Metrics: (0.02408939964960721, 0.01544701986754967, 0.021288958113516377)
2026-05-24 08:25:25,495 - optuna.study.study - INFO - Trial 39 finished with values: [0.02408939964960721, 0.01544701986754967, 0.021288958113516377] and parameters: {'n_layers': 2, 'embedding_dim': 256, 'lr': 0.014769636375767437, 'lambda_val': 5.10420277675261e-05, 'batch_size': 3642, 'optimizer': 'RMSprop'}.
2026-05-24 08:25:31,997 - experiment_functions - INFO - Early stopping at epoch 500. Best Metrics: (0.005296466023397847, 0.004312913907284768, 0.005282188325989387)
2026-05-24 08:25:32,948 - optuna.study.study - INFO - Trial 40 finished with values: [0.005296466023397847, 0.004312913907284768, 0.005282188325989387] and parameters: {'n_layers': 1, 'embedding_dim': 128, 'lr': 0.00015262674171811878, 'lambda_val': 0.07720465530276911, 'batch_size': 2363, 'optimizer': 'RMSprop'}.
2026-05-24 08:26:35,067 - optuna.study.study - INFO - Trial 41 finished with values: [0.008280083544861119, 0.006448675496688742, 0.008486396450770931] and parameters: {'n_layers': 4, 'embedding_dim': 256, 'lr': 3.917271636331136e-05, 'lambda_val': 1.0487619387576183e-05, 'batch_size': 840, 'optimizer': 'Adam'}.
2026-05-24 08:26:41,616 - experiment_functions - INFO - Early stopping at epoch 500. Best Metrics: (0.0052048563728059, 0.004304635761589404, 0.00524540950574912)
2026-05-24 08:26:41,708 - optuna.study.study - INFO - Trial 42 finished with values: [0.0052048563728059, 0.004304635761589404, 0.00524540950574912] and parameters: {'n_layers': 1, 'embedding_dim': 64, 'lr': 0.000992884943353568, 'lambda_val': 0.00042798715776986993, 'batch_size': 2308, 'optimizer': 'SGD'}.
2026-05-24 08:27:19,401 - experiment_functions - INFO - Early stopping at epoch 3100. Best Metrics: (0.005017864785838077, 0.004586092715231789, 0.005570230901600922)
2026-05-24 08:27:19,827 - optuna.study.study - INFO - Trial 43 finished with values: [0.005017864785838077, 0.004586092715231789, 0.005570230901600922] and parameters: {'n_layers': 3, 'embedding_dim': 128, 'lr': 1.1918045057122416e-05, 'lambda_val': 1.7528942361098337e-05, 'batch_size': 902, 'optimizer': 'RMSprop'}.
2026-05-24 08:27:26,591 - experiment_functions - INFO - Early stopping at epoch 500. Best Metrics: (0.004788347729976721, 0.004039735099337748, 0.004939987134434407)
2026-05-24 08:27:26,993 - optuna.study.study - INFO - Trial 44 finished with values: [0.004788347729976721, 0.004039735099337748, 0.004939987134434407] and parameters: {'n_layers': 4, 'embedding_dim': 32, 'lr': 3.211917621778991e-05, 'lambda_val': 0.029390877466770608, 'batch_size': 3761, 'optimizer': 'SGD'}.
2026-05-24 08:27:35,859 - experiment_functions - INFO - Early stopping at epoch 650. Best Metrics: (0.05933829446560381, 0.035273178807947024, 0.05134478710805933)
2026-05-24 08:27:36,376 - optuna.study.study - INFO - Trial 45 finished with values: [0.05933829446560381, 0.035273178807947024, 0.05134478710805933] and parameters: {'n_layers': 1, 'embedding_dim': 128, 'lr': 0.0015435244296002795, 'lambda_val': 4.601372605867572e-05, 'batch_size': 1091, 'optimizer': 'RMSprop'}.
2026-05-24 08:27:44,573 - experiment_functions - INFO - Early stopping at epoch 500. Best Metrics: (0.005564694509382724, 0.004263245033112583, 0.005489925885483103)
2026-05-24 08:27:44,653 - optuna.study.study - INFO - Trial 46 finished with values: [0.005564694509382724, 0.004263245033112583, 0.005489925885483103] and parameters: {'n_layers': 3, 'embedding_dim': 256, 'lr': 1.1097887236152852e-05, 'lambda_val': 0.030624583419705885, 'batch_size': 2097, 'optimizer': 'SGD'}.
2026-05-24 08:27:53,194 - experiment_functions - INFO - Early stopping at epoch 500. Best Metrics: (0.005205333265884905, 0.004097682119205298, 0.004956557705522835)
2026-05-24 08:27:53,296 - optuna.study.study - INFO - Trial 47 finished with values: [0.005205333265884905, 0.004097682119205298, 0.004956557705522835] and parameters: {'n_layers': 4, 'embedding_dim': 256, 'lr': 0.0023558428454586223, 'lambda_val': 0.02195890365002478, 'batch_size': 601, 'optimizer': 'SGD'}.
2026-05-24 08:28:00,101 - experiment_functions - INFO - Early stopping at epoch 500. Best Metrics: (0.005184862551724814, 0.004387417218543047, 0.005243081633171828)
2026-05-24 08:28:00,203 - optuna.study.study - INFO - Trial 48 finished with values: [0.005184862551724814, 0.004387417218543047, 0.005243081633171828] and parameters: {'n_layers': 2, 'embedding_dim': 128, 'lr': 0.002967061984195655, 'lambda_val': 0.0002288537777344949, 'batch_size': 990, 'optimizer': 'SGD'}.
2026-05-24 08:28:07,707 - experiment_functions - INFO - Early stopping at epoch 500. Best Metrics: (0.004622047603656321, 0.0040562913907284765, 0.004942938529600701)
2026-05-24 08:28:07,811 - optuna.study.study - INFO - Trial 49 finished with values: [0.004622047603656321, 0.0040562913907284765, 0.004942938529600701] and parameters: {'n_layers': 2, 'embedding_dim': 256, 'lr': 2.3801167000291896e-05, 'lambda_val': 0.004802854769557938, 'batch_size': 1013, 'optimizer': 'Adam'}.
2026-05-24 08:28:16,524 - experiment_functions - INFO - Early stopping at epoch 600. Best Metrics: (0.043899041664851875, 0.028559602649006623, 0.04036297887663114)
2026-05-24 08:28:16,623 - optuna.study.study - INFO - Trial 50 finished with values: [0.043899041664851875, 0.028559602649006623, 0.04036297887663114] and parameters: {'n_layers': 2, 'embedding_dim': 64, 'lr': 0.0019498675283919575, 'lambda_val': 0.0005144021469830869, 'batch_size': 3934, 'optimizer': 'Adam'}.
2026-05-24 08:28:23,065 - experiment_functions - INFO - Early stopping at epoch 500. Best Metrics: (0.004447646233116748, 0.00402317880794702, 0.004993866855633697)
2026-05-24 08:28:23,606 - optuna.study.study - INFO - Trial 51 finished with values: [0.004447646233116748, 0.00402317880794702, 0.004993866855633697] and parameters: {'n_layers': 1, 'embedding_dim': 128, 'lr': 0.00012678501077739075, 'lambda_val': 0.07720465530276911, 'batch_size': 1445, 'optimizer': 'RMSprop'}.
2026-05-24 08:28:37,625 - experiment_functions - INFO - Early stopping at epoch 1200. Best Metrics: (0.005384677090963246, 0.00451158940397351, 0.0056684382440602595)
2026-05-24 08:28:37,715 - optuna.study.study - INFO - Trial 52 finished with values: [0.005384677090963246, 0.00451158940397351, 0.0056684382440602595] and parameters: {'n_layers': 1, 'embedding_dim': 128, 'lr': 3.917271636331136e-05, 'lambda_val': 0.0010318653970364812, 'batch_size': 840, 'optimizer': 'Adam'}.
2026-05-24 08:28:45,410 - experiment_functions - INFO - Early stopping at epoch 550. Best Metrics: (0.021386214737647402, 0.017152317880794705, 0.021563182762698484)
2026-05-24 08:28:45,506 - optuna.study.study - INFO - Trial 53 finished with values: [0.021386214737647402, 0.017152317880794705, 0.021563182762698484] and parameters: {'n_layers': 2, 'embedding_dim': 128, 'lr': 0.002019850627421517, 'lambda_val': 0.0014947635378366633, 'batch_size': 914, 'optimizer': 'RMSprop'}.
2026-05-24 08:28:52,614 - experiment_functions - INFO - Early stopping at epoch 550. Best Metrics: (0.011029929196197762, 0.01044701986754967, 0.012766765601806547)
2026-05-24 08:28:52,701 - optuna.study.study - INFO - Trial 54 finished with values: [0.011029929196197762, 0.01044701986754967, 0.012766765601806547] and parameters: {'n_layers': 3, 'embedding_dim': 32, 'lr': 0.005444060961063268, 'lambda_val': 3.45726800599186e-05, 'batch_size': 1189, 'optimizer': 'RMSprop'}.
2026-05-24 08:29:09,215 - experiment_functions - INFO - Early stopping at epoch 1150. Best Metrics: (0.02696768645602753, 0.014536423841059605, 0.02186491846700674)
2026-05-24 08:29:09,319 - optuna.study.study - INFO - Trial 55 finished with values: [0.02696768645602753, 0.014536423841059605, 0.02186491846700674] and parameters: {'n_layers': 4, 'embedding_dim': 128, 'lr': 0.011587678380610592, 'lambda_val': 1.415798354583243e-06, 'batch_size': 3275, 'optimizer': 'RMSprop'}.
2026-05-24 08:29:17,054 - experiment_functions - INFO - Early stopping at epoch 500. Best Metrics: (0.00875298184603487, 0.00859271523178808, 0.010356344786023484)
2026-05-24 08:29:17,209 - optuna.study.study - INFO - Trial 56 finished with values: [0.00875298184603487, 0.00859271523178808, 0.010356344786023484] and parameters: {'n_layers': 4, 'embedding_dim': 128, 'lr': 0.012284452742644272, 'lambda_val': 0.011013627734671632, 'batch_size': 669, 'optimizer': 'RMSprop'}.
2026-05-24 08:29:24,651 - experiment_functions - INFO - Early stopping at epoch 500. Best Metrics: (0.004615649878583052, 0.004130794701986755, 0.005141271211791627)
2026-05-24 08:29:24,746 - optuna.study.study - INFO - Trial 57 finished with values: [0.004615649878583052, 0.004130794701986755, 0.005141271211791627] and parameters: {'n_layers': 4, 'embedding_dim': 128, 'lr': 1.994321668515169e-05, 'lambda_val': 0.012469532363722672, 'batch_size': 2907, 'optimizer': 'Adam'}.
2026-05-24 08:29:33,845 - experiment_functions - INFO - Early stopping at epoch 600. Best Metrics: (0.005187996139636232, 0.004221854304635762, 0.005515916815607398)
2026-05-24 08:29:33,946 - optuna.study.study - INFO - Trial 58 finished with values: [0.005187996139636232, 0.004221854304635762, 0.005515916815607398] and parameters: {'n_layers': 2, 'embedding_dim': 256, 'lr': 0.08770431760892448, 'lambda_val': 0.029390877466770608, 'batch_size': 2861, 'optimizer': 'SGD'}.
2026-05-24 08:29:41,647 - experiment_functions - INFO - Early stopping at epoch 550. Best Metrics: (0.043770677562616704, 0.028667218543046363, 0.03972149102255283)
2026-05-24 08:29:41,749 - optuna.study.study - INFO - Trial 59 finished with values: [0.043770677562616704, 0.028667218543046363, 0.03972149102255283] and parameters: {'n_layers': 1, 'embedding_dim': 128, 'lr': 0.002019850627421517, 'lambda_val': 0.000621169344675621, 'batch_size': 3974, 'optimizer': 'RMSprop'}.
2026-05-24 08:30:31,937 - optuna.study.study - INFO - Trial 60 finished with values: [0.036922465534509945, 0.02491721854304636, 0.033387623728439654] and parameters: {'n_layers': 3, 'embedding_dim': 64, 'lr': 0.00015717441755135915, 'lambda_val': 0.0013176857905753939, 'batch_size': 3363, 'optimizer': 'Adam'}.
2026-05-24 08:30:40,819 - experiment_functions - INFO - Early stopping at epoch 500. Best Metrics: (0.004946190481240141, 0.004023178807947021, 0.005401769957268136)
2026-05-24 08:30:41,266 - optuna.study.study - INFO - Trial 61 finished with values: [0.004946190481240141, 0.004023178807947021, 0.005401769957268136] and parameters: {'n_layers': 4, 'embedding_dim': 256, 'lr': 0.0023558428454586223, 'lambda_val': 0.02195890365002478, 'batch_size': 2907, 'optimizer': 'SGD'}.
2026-05-24 08:30:48,470 - experiment_functions - INFO - Early stopping at epoch 500. Best Metrics: (0.005391031694900142, 0.00462748344370861, 0.005673221446660529)
