2026-05-24 13:49:32,731 - optuna.study.study - INFO - Trial 41 finished with values: [0.0055018108350278596, 0.004271523178807948, 0.00534259312930614] and parameters: {'n_layers': 3, 'embedding_dim': 64, 'lr': 0.03712728735627538, 'lambda_val': 0.0003177654536369404, 'batch_size': 2215, 'optimizer': 'SGD'}.
2026-05-24 13:49:39,332 - experiment_functions - INFO - Early stopping at epoch 500. Best Metrics: (0.00461078217219351, 0.004130794701986755, 0.005352124401642119)
2026-05-24 13:49:39,932 - optuna.study.study - INFO - Trial 42 finished with values: [0.00461078217219351, 0.004130794701986755, 0.005352124401642119] and parameters: {'n_layers': 2, 'embedding_dim': 128, 'lr': 0.006077833304040838, 'lambda_val': 1.1805347524235836e-06, 'batch_size': 1537, 'optimizer': 'SGD'}.
2026-05-24 13:49:47,949 - experiment_functions - INFO - Early stopping at epoch 650. Best Metrics: (0.005040997127821687, 0.003956953642384106, 0.005007724088553823)
2026-05-24 13:49:49,287 - optuna.study.study - INFO - Trial 43 finished with values: [0.005040997127821687, 0.003956953642384106, 0.005007724088553823] and parameters: {'n_layers': 2, 'embedding_dim': 96, 'lr': 0.05582153873677429, 'lambda_val': 0.00010939611915819051, 'batch_size': 2923, 'optimizer': 'SGD'}.
2026-05-24 13:49:56,363 - experiment_functions - INFO - Early stopping at epoch 500. Best Metrics: (0.004974393323241056, 0.004089403973509933, 0.004971765490135195)
2026-05-24 13:49:56,539 - optuna.study.study - INFO - Trial 44 finished with values: [0.004974393323241056, 0.004089403973509933, 0.004971765490135195] and parameters: {'n_layers': 4, 'embedding_dim': 96, 'lr': 0.024981023714158942, 'lambda_val': 3.4157018827730662e-06, 'batch_size': 2630, 'optimizer': 'SGD'}.
2026-05-24 13:50:03,899 - experiment_functions - INFO - Early stopping at epoch 550. Best Metrics: (0.02684297841702909, 0.01966887417218543, 0.02506042816094309)
2026-05-24 13:50:03,992 - optuna.study.study - INFO - Trial 45 finished with values: [0.02684297841702909, 0.01966887417218543, 0.02506042816094309] and parameters: {'n_layers': 4, 'embedding_dim': 64, 'lr': 0.0009315403640444384, 'lambda_val': 0.0031836753862071, 'batch_size': 1834, 'optimizer': 'RMSprop'}.
2026-05-24 13:50:48,250 - optuna.study.study - INFO - Trial 46 finished with values: [0.007552307635430153, 0.005877483443708609, 0.007501632379270357] and parameters: {'n_layers': 1, 'embedding_dim': 256, 'lr': 0.0001368444724243216, 'lambda_val': 1.6380281272851419e-06, 'batch_size': 989, 'optimizer': 'Adam'}.
2026-05-24 13:50:55,218 - experiment_functions - INFO - Early stopping at epoch 500. Best Metrics: (0.00505459758146462, 0.004097682119205298, 0.005295587578918297)
2026-05-24 13:50:55,691 - optuna.study.study - INFO - Trial 47 finished with values: [0.00505459758146462, 0.004097682119205298, 0.005295587578918297] and parameters: {'n_layers': 3, 'embedding_dim': 128, 'lr': 0.01094149077377302, 'lambda_val': 0.00566838380319144, 'batch_size': 2571, 'optimizer': 'SGD'}.
2026-05-24 13:51:02,699 - experiment_functions - INFO - Early stopping at epoch 500. Best Metrics: (0.004679767505199384, 0.004312913907284768, 0.005213233231992051)
2026-05-24 13:51:02,796 - optuna.study.study - INFO - Trial 48 finished with values: [0.004679767505199384, 0.004312913907284768, 0.005213233231992051] and parameters: {'n_layers': 2, 'embedding_dim': 256, 'lr': 1.4583124958141983e-05, 'lambda_val': 7.156678286346417e-06, 'batch_size': 1925, 'optimizer': 'SGD'}.
2026-05-24 13:51:09,140 - experiment_functions - INFO - Early stopping at epoch 500. Best Metrics: (0.01030364854843044, 0.007806291390728478, 0.01080189377686628)
2026-05-24 13:51:09,519 - optuna.study.study - INFO - Trial 49 finished with values: [0.01030364854843044, 0.007806291390728478, 0.01080189377686628] and parameters: {'n_layers': 3, 'embedding_dim': 32, 'lr': 0.08024053236303301, 'lambda_val': 2.0723645088674174e-05, 'batch_size': 4070, 'optimizer': 'RMSprop'}.
2026-05-24 13:51:22,266 - experiment_functions - INFO - Early stopping at epoch 900. Best Metrics: (0.024336598412601867, 0.015571192052980133, 0.022102621901617745)
2026-05-24 13:51:22,376 - optuna.study.study - INFO - Trial 50 finished with values: [0.024336598412601867, 0.015571192052980133, 0.022102621901617745] and parameters: {'n_layers': 2, 'embedding_dim': 256, 'lr': 0.01245800478955897, 'lambda_val': 0.0001625918875278769, 'batch_size': 1034, 'optimizer': 'Adam'}.
2026-05-24 13:51:45,878 - experiment_functions - INFO - Early stopping at epoch 1900. Best Metrics: (0.04407575515997302, 0.028509933774834434, 0.039508144195280336)
2026-05-24 13:51:45,965 - optuna.study.study - INFO - Trial 51 finished with values: [0.04407575515997302, 0.028509933774834434, 0.039508144195280336] and parameters: {'n_layers': 4, 'embedding_dim': 64, 'lr': 0.0002249192915429732, 'lambda_val': 0.0034713999695200454, 'batch_size': 917, 'optimizer': 'RMSprop'}.
2026-05-24 13:51:55,114 - experiment_functions - INFO - Early stopping at epoch 700. Best Metrics: (0.03428670047552302, 0.023667218543046355, 0.031831885808549)
2026-05-24 13:51:55,407 - optuna.study.study - INFO - Trial 52 finished with values: [0.03428670047552302, 0.023667218543046355, 0.031831885808549] and parameters: {'n_layers': 4, 'embedding_dim': 64, 'lr': 0.0006563002976325864, 'lambda_val': 1.4247463760726523e-06, 'batch_size': 968, 'optimizer': 'RMSprop'}.
2026-05-24 13:52:15,827 - experiment_functions - INFO - Early stopping at epoch 1500. Best Metrics: (0.023114273545792645, 0.014644039735099338, 0.020956032728920777)
2026-05-24 13:52:16,486 - optuna.study.study - INFO - Trial 53 finished with values: [0.023114273545792645, 0.014644039735099338, 0.020956032728920777] and parameters: {'n_layers': 4, 'embedding_dim': 128, 'lr': 0.016540209207169757, 'lambda_val': 0.0009801820764399163, 'batch_size': 2712, 'optimizer': 'RMSprop'}.
2026-05-24 13:52:45,148 - experiment_functions - INFO - Early stopping at epoch 2550. Best Metrics: (0.021583189165108194, 0.014461920529801326, 0.020292679145071144)
2026-05-24 13:52:45,237 - optuna.study.study - INFO - Trial 54 finished with values: [0.021583189165108194, 0.014461920529801326, 0.020292679145071144] and parameters: {'n_layers': 4, 'embedding_dim': 32, 'lr': 0.08024053236303301, 'lambda_val': 0.0031836753862071, 'batch_size': 2802, 'optimizer': 'RMSprop'}.
2026-05-24 13:53:17,330 - experiment_functions - INFO - Early stopping at epoch 2600. Best Metrics: (0.02325661091181045, 0.013609271523178807, 0.019861352881165785)
2026-05-24 13:53:17,422 - optuna.study.study - INFO - Trial 55 finished with values: [0.02325661091181045, 0.013609271523178807, 0.019861352881165785] and parameters: {'n_layers': 4, 'embedding_dim': 96, 'lr': 0.01776203448481155, 'lambda_val': 0.0005450686189662139, 'batch_size': 1393, 'optimizer': 'Adam'}.
2026-05-24 13:53:23,654 - experiment_functions - INFO - Early stopping at epoch 500. Best Metrics: (0.004934213141992486, 0.004346026490066225, 0.005225500475509655)
2026-05-24 13:53:24,377 - optuna.study.study - INFO - Trial 56 finished with values: [0.004934213141992486, 0.004346026490066225, 0.005225500475509655] and parameters: {'n_layers': 2, 'embedding_dim': 96, 'lr': 0.0003540171758009511, 'lambda_val': 9.463812196591343e-06, 'batch_size': 2811, 'optimizer': 'SGD'}.
2026-05-24 13:53:31,589 - experiment_functions - INFO - Early stopping at epoch 550. Best Metrics: (0.05400441323705178, 0.03199503311258278, 0.04740581476068088)
2026-05-24 13:53:31,808 - optuna.study.study - INFO - Trial 57 finished with values: [0.05400441323705178, 0.03199503311258278, 0.04740581476068088] and parameters: {'n_layers': 1, 'embedding_dim': 96, 'lr': 0.01245800478955897, 'lambda_val': 2.6431113659875313e-06, 'batch_size': 1236, 'optimizer': 'Adam'}.
2026-05-24 13:53:55,480 - experiment_functions - INFO - Early stopping at epoch 1700. Best Metrics: (0.005931320972804907, 0.00451158940397351, 0.005885662386994049)
2026-05-24 13:53:55,992 - optuna.study.study - INFO - Trial 58 finished with values: [0.005931320972804907, 0.00451158940397351, 0.005885662386994049] and parameters: {'n_layers': 3, 'embedding_dim': 256, 'lr': 0.07323519135760621, 'lambda_val': 7.985064351552862e-06, 'batch_size': 1315, 'optimizer': 'SGD'}.
2026-05-24 13:54:02,417 - experiment_functions - INFO - Early stopping at epoch 500. Best Metrics: (0.004634765167798467, 0.004213576158940397, 0.004936430336882904)
2026-05-24 13:54:03,712 - optuna.study.study - INFO - Trial 59 finished with values: [0.004634765167798467, 0.004213576158940397, 0.004936430336882904] and parameters: {'n_layers': 3, 'embedding_dim': 64, 'lr': 0.0002249192915429732, 'lambda_val': 0.009766331040057696, 'batch_size': 832, 'optimizer': 'SGD'}.
2026-05-24 13:54:15,952 - experiment_functions - INFO - Early stopping at epoch 900. Best Metrics: (0.035857885326402994, 0.024966887417218545, 0.03379249548592119)
2026-05-24 13:54:16,043 - optuna.study.study - INFO - Trial 60 finished with values: [0.035857885326402994, 0.024966887417218545, 0.03379249548592119] and parameters: {'n_layers': 4, 'embedding_dim': 96, 'lr': 0.0003859482391059796, 'lambda_val': 1.4247463760726523e-06, 'batch_size': 1042, 'optimizer': 'Adam'}.
2026-05-24 13:54:46,552 - experiment_functions - INFO - Early stopping at epoch 2600. Best Metrics: (0.019688763611164423, 0.013137417218543048, 0.018287212631129285)
2026-05-24 13:54:46,663 - optuna.study.study - INFO - Trial 61 finished with values: [0.019688763611164423, 0.013137417218543048, 0.018287212631129285] and parameters: {'n_layers': 4, 'embedding_dim': 64, 'lr': 0.058586717719790266, 'lambda_val': 0.0009801820764399163, 'batch_size': 968, 'optimizer': 'Adam'}.
2026-05-24 13:54:59,706 - experiment_functions - INFO - Early stopping at epoch 1150. Best Metrics: (0.011719202964999748, 0.008451986754966887, 0.011339730717667092)
2026-05-24 13:54:59,804 - optuna.study.study - INFO - Trial 62 finished with values: [0.011719202964999748, 0.008451986754966887, 0.011339730717667092] and parameters: {'n_layers': 3, 'embedding_dim': 32, 'lr': 0.08024053236303301, 'lambda_val': 0.00036119255164558764, 'batch_size': 2548, 'optimizer': 'Adam'}.
2026-05-24 13:55:10,601 - experiment_functions - INFO - Early stopping at epoch 500. Best Metrics: (0.004646427637290593, 0.004155629139072848, 0.005268760676102396)
2026-05-24 13:55:10,688 - optuna.study.study - INFO - Trial 63 finished with values: [0.004646427637290593, 0.004155629139072848, 0.005268760676102396] and parameters: {'n_layers': 2, 'embedding_dim': 64, 'lr': 0.00020599646084784877, 'lambda_val': 0.000850057036094434, 'batch_size': 1481, 'optimizer': 'SGD'}.
2026-05-24 13:55:32,227 - experiment_functions - INFO - Early stopping at epoch 1650. Best Metrics: (0.006856796920982313, 0.008054635761589405, 0.00950319259026026)
2026-05-24 13:55:32,509 - optuna.study.study - INFO - Trial 64 finished with values: [0.006856796920982313, 0.008054635761589405, 0.00950319259026026] and parameters: {'n_layers': 4, 'embedding_dim': 128, 'lr': 0.016540209207169757, 'lambda_val': 0.0297587632074598, 'batch_size': 3628, 'optimizer': 'RMSprop'}.
2026-05-24 13:55:41,548 - experiment_functions - INFO - Early stopping at epoch 600. Best Metrics: (0.049176709000902055, 0.0298841059602649, 0.044156424099167285)
2026-05-24 13:55:41,892 - optuna.study.study - INFO - Trial 65 finished with values: [0.049176709000902055, 0.0298841059602649, 0.044156424099167285] and parameters: {'n_layers': 2, 'embedding_dim': 256, 'lr': 0.0007653011157039608, 'lambda_val': 0.00019642917096569077, 'batch_size': 1970, 'optimizer': 'RMSprop'}.
2026-05-24 13:56:07,936 - experiment_functions - INFO - Early stopping at epoch 2000. Best Metrics: (0.009455459220155832, 0.010049668874172185, 0.011869870973485425)
2026-05-24 13:56:08,300 - optuna.study.study - INFO - Trial 66 finished with values: [0.009455459220155832, 0.010049668874172185, 0.011869870973485425] and parameters: {'n_layers': 2, 'embedding_dim': 256, 'lr': 0.05279473690592034, 'lambda_val': 0.029288820281810176, 'batch_size': 2141, 'optimizer': 'Adam'}.
2026-05-24 13:56:20,145 - experiment_functions - INFO - Early stopping at epoch 750. Best Metrics: (0.02178470814886841, 0.013038079470198676, 0.019038387676099097)
2026-05-24 13:56:20,582 - optuna.study.study - INFO - Trial 67 finished with values: [0.02178470814886841, 0.013038079470198676, 0.019038387676099097] and parameters: {'n_layers': 3, 'embedding_dim': 256, 'lr': 0.02064447429932105, 'lambda_val': 1.0152215023816412e-05, 'batch_size': 3618, 'optimizer': 'Adam'}.
2026-05-24 13:56:27,133 - experiment_functions - INFO - Early stopping at epoch 500. Best Metrics: (0.011376414214638478, 0.008774834437086093, 0.011531463853855853)
2026-05-24 13:56:27,759 - optuna.study.study - INFO - Trial 68 finished with values: [0.011376414214638478, 0.008774834437086093, 0.011531463853855853] and parameters: {'n_layers': 3, 'embedding_dim': 64, 'lr': 0.06715639056660243, 'lambda_val': 0.0003177654536369404, 'batch_size': 2145, 'optimizer': 'RMSprop'}.
2026-05-24 13:56:33,775 - experiment_functions - INFO - Early stopping at epoch 500. Best Metrics: (0.004508846482467326, 0.004155629139072848, 0.005132251635017535)
2026-05-24 13:56:34,781 - optuna.study.study - INFO - Trial 69 finished with values: [0.004508846482467326, 0.004155629139072848, 0.005132251635017535] and parameters: {'n_layers': 1, 'embedding_dim': 32, 'lr': 7.175260580271771e-05, 'lambda_val': 0.018306309050312594, 'batch_size': 2630, 'optimizer': 'SGD'}.
2026-05-24 13:56:41,733 - experiment_functions - INFO - Early stopping at epoch 550. Best Metrics: (0.01317891430136416, 0.010463576158940398, 0.013752768408943213)
2026-05-24 13:56:41,842 - optuna.study.study - INFO - Trial 70 finished with values: [0.01317891430136416, 0.010463576158940398, 0.013752768408943213] and parameters: {'n_layers': 1, 'embedding_dim': 96, 'lr': 0.05601914360731388, 'lambda_val': 1.4446750706679519e-05, 'batch_size': 1236, 'optimizer': 'Adam'}.
2026-05-24 13:56:53,375 - experiment_functions - INFO - Early stopping at epoch 950. Best Metrics: (0.00663490917548177, 0.00706953642384106, 0.008126598918399357)
2026-05-24 13:56:53,502 - optuna.study.study - INFO - Trial 71 finished with values: [0.00663490917548177, 0.00706953642384106, 0.008126598918399357] and parameters: {'n_layers': 3, 'embedding_dim': 96, 'lr': 0.01245800478955897, 'lambda_val': 0.023279066392868517, 'batch_size': 939, 'optimizer': 'RMSprop'}.
2026-05-24 13:56:59,694 - experiment_functions - INFO - Early stopping at epoch 500. Best Metrics: (0.004745978608862203, 0.003956953642384106, 0.004958257778384475)
2026-05-24 13:57:00,379 - optuna.study.study - INFO - Trial 72 finished with values: [0.004745978608862203, 0.003956953642384106, 0.004958257778384475] and parameters: {'n_layers': 2, 'embedding_dim': 64, 'lr': 4.83467802640101e-05, 'lambda_val': 0.000850057036094434, 'batch_size': 1481, 'optimizer': 'SGD'}.
2026-05-24 13:57:14,092 - experiment_functions - INFO - Early stopping at epoch 800. Best Metrics: (0.041108485442314276, 0.026399006622516555, 0.03645121603079689)
2026-05-24 13:57:14,182 - optuna.study.study - INFO - Trial 73 finished with values: [0.041108485442314276, 0.026399006622516555, 0.03645121603079689] and parameters: {'n_layers': 4, 'embedding_dim': 256, 'lr': 0.0005264581247601549, 'lambda_val': 7.985064351552862e-06, 'batch_size': 530, 'optimizer': 'Adam'}.
2026-05-24 13:57:32,050 - experiment_functions - INFO - Early stopping at epoch 1550. Best Metrics: (0.03392718854303663, 0.023559602649006618, 0.031136272498394898)
2026-05-24 13:57:32,142 - optuna.study.study - INFO - Trial 74 finished with values: [0.03392718854303663, 0.023559602649006618, 0.031136272498394898] and parameters: {'n_layers': 3, 'embedding_dim': 32, 'lr': 0.00030176895436135383, 'lambda_val': 7.985064351552862e-06, 'batch_size': 2548, 'optimizer': 'Adam'}.
2026-05-24 13:57:39,113 - experiment_functions - INFO - Early stopping at epoch 500. Best Metrics: (0.005359598756895329, 0.004403973509933775, 0.005458674140819546)
2026-05-24 13:57:39,208 - optuna.study.study - INFO - Trial 75 finished with values: [0.005359598756895329, 0.004403973509933775, 0.005458674140819546] and parameters: {'n_layers': 3, 'embedding_dim': 128, 'lr': 0.0003540171758009511, 'lambda_val': 0.00566838380319144, 'batch_size': 2571, 'optimizer': 'SGD'}.
2026-05-24 13:57:54,556 - experiment_functions - INFO - Early stopping at epoch 1200. Best Metrics: (0.019791606658283667, 0.012740066225165563, 0.017562708358406343)
2026-05-24 13:57:54,642 - optuna.study.study - INFO - Trial 76 finished with values: [0.019791606658283667, 0.012740066225165563, 0.017562708358406343] and parameters: {'n_layers': 3, 'embedding_dim': 128, 'lr': 0.02064447429932105, 'lambda_val': 0.00036119255164558764, 'batch_size': 1494, 'optimizer': 'Adam'}.
2026-05-24 13:58:06,933 - experiment_functions - INFO - Early stopping at epoch 1000. Best Metrics: (0.026093583304294166, 0.016920529801324503, 0.023675881387182938)
2026-05-24 13:58:07,020 - optuna.study.study - INFO - Trial 77 finished with values: [0.026093583304294166, 0.016920529801324503, 0.023675881387182938] and parameters: {'n_layers': 2, 'embedding_dim': 96, 'lr': 0.01245800478955897, 'lambda_val': 7.011674546086162e-05, 'batch_size': 1438, 'optimizer': 'RMSprop'}.
2026-05-24 13:58:49,726 - experiment_functions - INFO - Early stopping at epoch 3950. Best Metrics: (0.02507261787534209, 0.01765728476821192, 0.02417471457441359)
2026-05-24 13:58:49,818 - optuna.study.study - INFO - Trial 78 finished with values: [0.02507261787534209, 0.01765728476821192, 0.02417471457441359] and parameters: {'n_layers': 2, 'embedding_dim': 64, 'lr': 0.00914986330156684, 'lambda_val': 0.0034713999695200454, 'batch_size': 592, 'optimizer': 'RMSprop'}.
2026-05-24 13:59:32,992 - optuna.study.study - INFO - Trial 79 finished with values: [0.029550255430806124, 0.020455298013245034, 0.02756976012807357] and parameters: {'n_layers': 3, 'embedding_dim': 32, 'lr': 0.00013047432521376867, 'lambda_val': 9.772502453834702e-06, 'batch_size': 1741, 'optimizer': 'Adam'}.
2026-05-24 13:59:41,489 - experiment_functions - INFO - Early stopping at epoch 750. Best Metrics: (0.0055855941523225055, 0.0043708609271523174, 0.005664392893529409)
2026-05-24 13:59:42,463 - optuna.study.study - INFO - Trial 80 finished with values: [0.0055855941523225055, 0.0043708609271523174, 0.005664392893529409] and parameters: {'n_layers': 1, 'embedding_dim': 96, 'lr': 0.011004812996539801, 'lambda_val': 0.00036119255164558764, 'batch_size': 2548, 'optimizer': 'SGD'}.
2026-05-24 14:00:09,171 - experiment_functions - INFO - Early stopping at epoch 2000. Best Metrics: (0.022719335124155058, 0.01649006622516556, 0.02268848312912413)
2026-05-24 14:00:09,256 - optuna.study.study - INFO - Trial 81 finished with values: [0.022719335124155058, 0.01649006622516556, 0.02268848312912413] and parameters: {'n_layers': 2, 'embedding_dim': 256, 'lr': 0.00914986330156684, 'lambda_val': 0.008933254496519926, 'batch_size': 2328, 'optimizer': 'RMSprop'}.
2026-05-24 14:00:52,174 - optuna.study.study - INFO - Trial 82 finished with values: [0.03187842678753499, 0.020985099337748343, 0.029634371859736098] and parameters: {'n_layers': 2, 'embedding_dim': 32, 'lr': 0.00012749160505002986, 'lambda_val': 2.0723645088674174e-05, 'batch_size': 4070, 'optimizer': 'Adam'}.
2026-05-24 14:00:59,619 - experiment_functions - INFO - Early stopping at epoch 550. Best Metrics: (0.016613347482423168, 0.010885761589403974, 0.01493617433273438)
2026-05-24 14:01:00,180 - optuna.study.study - INFO - Trial 83 finished with values: [0.016613347482423168, 0.010885761589403974, 0.01493617433273438] and parameters: {'n_layers': 2, 'embedding_dim': 64, 'lr': 0.05279473690592034, 'lambda_val': 9.463812196591343e-06, 'batch_size': 2141, 'optimizer': 'Adam'}.
2026-05-24 14:01:09,956 - experiment_functions - INFO - Early stopping at epoch 700. Best Metrics: (0.037244964730421805, 0.0240976821192053, 0.034080635778166286)
2026-05-24 14:01:10,562 - optuna.study.study - INFO - Trial 84 finished with values: [0.037244964730421805, 0.0240976821192053, 0.034080635778166286] and parameters: {'n_layers': 3, 'embedding_dim': 128, 'lr': 0.0006563002976325864, 'lambda_val': 1.4247463760726523e-06, 'batch_size': 3328, 'optimizer': 'Adam'}.
2026-05-24 14:01:24,573 - experiment_functions - INFO - Early stopping at epoch 1200. Best Metrics: (0.005783308034171383, 0.004445364238410596, 0.005695713635715361)
2026-05-24 14:01:24,652 - optuna.study.study - INFO - Trial 85 finished with values: [0.005783308034171383, 0.004445364238410596, 0.005695713635715361] and parameters: {'n_layers': 3, 'embedding_dim': 96, 'lr': 0.058586717719790266, 'lambda_val': 6.938379219467281e-05, 'batch_size': 530, 'optimizer': 'SGD'}.
2026-05-24 14:02:09,552 - optuna.study.study - INFO - Trial 86 finished with values: [0.023028016173132992, 0.016125827814569536, 0.022396914930939132] and parameters: {'n_layers': 2, 'embedding_dim': 96, 'lr': 0.0001368444724243216, 'lambda_val': 1.6380281272851419e-06, 'batch_size': 989, 'optimizer': 'Adam'}.
2026-05-24 14:02:18,447 - experiment_functions - INFO - Early stopping at epoch 600. Best Metrics: (0.0411608777331747, 0.027144039735099337, 0.03849273207512703)
2026-05-24 14:02:18,542 - optuna.study.study - INFO - Trial 87 finished with values: [0.0411608777331747, 0.027144039735099337, 0.03849273207512703] and parameters: {'n_layers': 4, 'embedding_dim': 128, 'lr': 0.0011385009641030693, 'lambda_val': 7.187538783101437e-06, 'batch_size': 1238, 'optimizer': 'Adam'}.
2026-05-24 14:02:26,472 - experiment_functions - INFO - Early stopping at epoch 550. Best Metrics: (0.0056339016136810515, 0.00435430463576159, 0.005541945407591772)
