2026-05-23 19:56:13,864 - root - INFO - **** Training e_1M_full
2026-05-23 19:56:16,090 - helper_functions - INFO - Users: 6040, Items: 3883
2026-05-23 19:56:19,230 - helper_functions - INFO - Edge index: torch.Size([2, 1000209])
2026-05-23 19:56:19,230 - root - INFO - **** Generating the graph:
2026-05-23 19:56:20,260 - helper_functions - INFO - Number of unique users: 6040
2026-05-23 19:56:20,269 - helper_functions - INFO - Number of unique items: 3706
2026-05-23 19:56:20,269 - helper_functions - INFO - Number of nodes: 9746
2026-05-23 19:56:20,273 - helper_functions - INFO - Number of edges: 1000209
2026-05-23 19:56:23,559 - optuna.storages._rdb.storage - INFO - A new study created in RDB with name: Study_e_1M_full
2026-05-23 19:56:33,399 - experiment_functions - INFO - Early stopping at epoch 500. Best Metrics: (0.00610804365778935, 0.004735099337748344, 0.006210777708598524)
2026-05-23 19:56:33,518 - optuna.study.study - INFO - Trial 0 finished with values: [0.00610804365778935, 0.004735099337748344, 0.006210777708598524] and parameters: {'n_layers': 3, 'embedding_dim': 128, 'lr': 6.969417485728512e-05, 'lambda_val': 2.5167677104418004e-05, 'batch_size': 864, 'optimizer': 'SGD'}.
2026-05-23 19:56:43,841 - experiment_functions - INFO - Early stopping at epoch 500. Best Metrics: (0.005336026866457948, 0.004594370860927152, 0.005561677411064342)
2026-05-23 19:56:44,944 - optuna.study.study - INFO - Trial 1 finished with values: [0.005336026866457948, 0.004594370860927152, 0.005561677411064342] and parameters: {'n_layers': 2, 'embedding_dim': 256, 'lr': 8.151488526318813e-05, 'lambda_val': 9.967237674188096e-06, 'batch_size': 3551, 'optimizer': 'SGD'}.
2026-05-23 19:56:53,361 - experiment_functions - INFO - Early stopping at epoch 500. Best Metrics: (0.005653097804574563, 0.004610927152317881, 0.005641045403443715)
2026-05-23 19:56:53,435 - optuna.study.study - INFO - Trial 2 finished with values: [0.005653097804574563, 0.004610927152317881, 0.005641045403443715] and parameters: {'n_layers': 2, 'embedding_dim': 128, 'lr': 3.7325419922945685e-05, 'lambda_val': 0.05740280806859373, 'batch_size': 1593, 'optimizer': 'Adam'}.
2026-05-23 19:57:06,603 - experiment_functions - INFO - Early stopping at epoch 950. Best Metrics: (0.006111978462134492, 0.004801324503311258, 0.006353679896395649)
2026-05-23 19:57:06,699 - optuna.study.study - INFO - Trial 3 finished with values: [0.006111978462134492, 0.004801324503311258, 0.006353679896395649] and parameters: {'n_layers': 2, 'embedding_dim': 64, 'lr': 1.723093560428365e-05, 'lambda_val': 1.826718502308613e-05, 'batch_size': 3803, 'optimizer': 'RMSprop'}.
2026-05-23 19:57:18,164 - experiment_functions - INFO - Early stopping at epoch 850. Best Metrics: (0.005130245149905195, 0.004321192052980133, 0.005318465510146124)
2026-05-23 19:57:18,448 - optuna.study.study - INFO - Trial 4 finished with values: [0.005130245149905195, 0.004321192052980133, 0.005318465510146124] and parameters: {'n_layers': 3, 'embedding_dim': 32, 'lr': 0.07970294862844048, 'lambda_val': 0.00012037529050145653, 'batch_size': 791, 'optimizer': 'SGD'}.
2026-05-23 19:57:31,823 - experiment_functions - INFO - Early stopping at epoch 550. Best Metrics: (0.014223056668343765, 0.015289735099337747, 0.01783239735777308)
2026-05-23 19:57:31,899 - optuna.study.study - INFO - Trial 5 finished with values: [0.014223056668343765, 0.015289735099337747, 0.01783239735777308] and parameters: {'n_layers': 3, 'embedding_dim': 256, 'lr': 0.001325452189730596, 'lambda_val': 0.0053912262075664795, 'batch_size': 2307, 'optimizer': 'RMSprop'}.
2026-05-23 19:57:40,640 - experiment_functions - INFO - Early stopping at epoch 550. Best Metrics: (0.037241921521524876, 0.03348509933774835, 0.040440536662037056)
2026-05-23 19:57:40,731 - optuna.study.study - INFO - Trial 6 finished with values: [0.037241921521524876, 0.03348509933774835, 0.040440536662037056] and parameters: {'n_layers': 2, 'embedding_dim': 96, 'lr': 0.0011822260534256749, 'lambda_val': 0.005788887427170339, 'batch_size': 3754, 'optimizer': 'RMSprop'}.
2026-05-23 19:57:51,839 - experiment_functions - INFO - Early stopping at epoch 650. Best Metrics: (0.06760559255090022, 0.05375, 0.07195669749208722)
2026-05-23 19:57:52,248 - optuna.study.study - INFO - Trial 7 finished with values: [0.06760559255090022, 0.05375, 0.07195669749208722] and parameters: {'n_layers': 1, 'embedding_dim': 256, 'lr': 0.0017544079546559647, 'lambda_val': 0.001076113642302791, 'batch_size': 3374, 'optimizer': 'Adam'}.
2026-05-23 19:58:36,148 - experiment_functions - INFO - Early stopping at epoch 3350. Best Metrics: (0.054491026275602115, 0.03759933774834437, 0.05482649791626235)
2026-05-23 19:58:36,231 - optuna.study.study - INFO - Trial 8 finished with values: [0.054491026275602115, 0.03759933774834437, 0.05482649791626235] and parameters: {'n_layers': 1, 'embedding_dim': 96, 'lr': 0.023789682142433273, 'lambda_val': 0.0018306388815656402, 'batch_size': 1783, 'optimizer': 'RMSprop'}.
2026-05-23 19:58:43,892 - experiment_functions - INFO - Early stopping at epoch 550. Best Metrics: (0.07177288136347668, 0.05307119205298014, 0.0702686187605861)
2026-05-23 19:58:43,982 - optuna.study.study - INFO - Trial 9 finished with values: [0.07177288136347668, 0.05307119205298014, 0.0702686187605861] and parameters: {'n_layers': 1, 'embedding_dim': 32, 'lr': 0.008795634295118489, 'lambda_val': 6.766531257910007e-05, 'batch_size': 1668, 'optimizer': 'Adam'}.
2026-05-23 19:58:59,599 - experiment_functions - INFO - Early stopping at epoch 550. Best Metrics: (0.009460598683534407, 0.011067880794701985, 0.01303894748897644)
2026-05-23 19:58:59,681 - optuna.study.study - INFO - Trial 10 finished with values: [0.009460598683534407, 0.011067880794701985, 0.01303894748897644] and parameters: {'n_layers': 4, 'embedding_dim': 256, 'lr': 0.001161194382684308, 'lambda_val': 0.044003420486240764, 'batch_size': 2296, 'optimizer': 'RMSprop'}.
2026-05-23 19:59:08,279 - experiment_functions - INFO - Early stopping at epoch 500. Best Metrics: (0.005039259706684854, 0.004221854304635762, 0.005106135362966027)
2026-05-23 19:59:08,350 - optuna.study.study - INFO - Trial 11 finished with values: [0.005039259706684854, 0.004221854304635762, 0.005106135362966027] and parameters: {'n_layers': 4, 'embedding_dim': 64, 'lr': 5.3531700944346876e-05, 'lambda_val': 0.020150485855600118, 'batch_size': 4046, 'optimizer': 'RMSprop'}.
2026-05-23 19:59:33,861 - experiment_functions - INFO - Early stopping at epoch 1100. Best Metrics: (0.004846821264779386, 0.004445364238410596, 0.005450221860546968)
2026-05-23 19:59:33,992 - optuna.study.study - INFO - Trial 12 finished with values: [0.004846821264779386, 0.004445364238410596, 0.005450221860546968] and parameters: {'n_layers': 3, 'embedding_dim': 256, 'lr': 1.5529773095394613e-05, 'lambda_val': 1.8499407406657154e-05, 'batch_size': 1153, 'optimizer': 'Adam'}.
2026-05-23 19:59:43,641 - experiment_functions - INFO - Early stopping at epoch 500. Best Metrics: (0.0050072287144304105, 0.004304635761589404, 0.005133555289746869)
2026-05-23 19:59:43,807 - optuna.study.study - INFO - Trial 13 finished with values: [0.0050072287144304105, 0.004304635761589404, 0.005133555289746869] and parameters: {'n_layers': 4, 'embedding_dim': 96, 'lr': 0.0006364863581346661, 'lambda_val': 7.959683440448575e-06, 'batch_size': 1136, 'optimizer': 'SGD'}.
2026-05-23 19:59:50,901 - experiment_functions - INFO - Early stopping at epoch 500. Best Metrics: (0.006252688492358358, 0.004975165562913908, 0.006546476879262447)
2026-05-23 19:59:50,980 - optuna.study.study - INFO - Trial 14 finished with values: [0.006252688492358358, 0.004975165562913908, 0.006546476879262447] and parameters: {'n_layers': 1, 'embedding_dim': 128, 'lr': 0.00015153608406178438, 'lambda_val': 2.902517287685474e-06, 'batch_size': 2563, 'optimizer': 'SGD'}.
2026-05-23 20:00:08,749 - experiment_functions - INFO - Early stopping at epoch 1250. Best Metrics: (0.042881218583330924, 0.029461920529801323, 0.04242907717143272)
2026-05-23 20:00:08,839 - optuna.study.study - INFO - Trial 15 finished with values: [0.042881218583330924, 0.029461920529801323, 0.04242907717143272] and parameters: {'n_layers': 1, 'embedding_dim': 128, 'lr': 0.015671226158777793, 'lambda_val': 2.389568370721752e-06, 'batch_size': 2138, 'optimizer': 'Adam'}.
2026-05-23 20:01:14,670 - optuna.study.study - INFO - Trial 16 finished with values: [0.042266299393217126, 0.02623344370860927, 0.03904796811297438] and parameters: {'n_layers': 3, 'embedding_dim': 96, 'lr': 0.0125220440110221, 'lambda_val': 0.00017143103585193984, 'batch_size': 2484, 'optimizer': 'RMSprop'}.
2026-05-23 20:01:30,572 - experiment_functions - INFO - Early stopping at epoch 1050. Best Metrics: (0.028545755854675114, 0.015471854304635761, 0.023922552973791693)
2026-05-23 20:01:31,230 - optuna.study.study - INFO - Trial 17 finished with values: [0.028545755854675114, 0.015471854304635761, 0.023922552973791693] and parameters: {'n_layers': 4, 'embedding_dim': 32, 'lr': 0.05175726784938008, 'lambda_val': 1.1656929797027377e-06, 'batch_size': 2498, 'optimizer': 'RMSprop'}.
2026-05-23 20:01:49,084 - experiment_functions - INFO - Early stopping at epoch 900. Best Metrics: (0.005206090875794809, 0.004693708609271523, 0.005659072494271764)
2026-05-23 20:01:49,184 - optuna.study.study - INFO - Trial 18 finished with values: [0.005206090875794809, 0.004693708609271523, 0.005659072494271764] and parameters: {'n_layers': 4, 'embedding_dim': 128, 'lr': 0.04150642981862428, 'lambda_val': 1.4031937943291496e-05, 'batch_size': 1989, 'optimizer': 'SGD'}.
2026-05-23 20:01:57,851 - experiment_functions - INFO - Early stopping at epoch 600. Best Metrics: (0.07290411131029707, 0.051556291390728474, 0.07386675620028928)
2026-05-23 20:01:57,926 - optuna.study.study - INFO - Trial 19 finished with values: [0.07290411131029707, 0.051556291390728474, 0.07386675620028928] and parameters: {'n_layers': 1, 'embedding_dim': 96, 'lr': 0.004184026134455368, 'lambda_val': 0.0007535837355673727, 'batch_size': 576, 'optimizer': 'Adam'}.
2026-05-23 20:02:11,684 - experiment_functions - INFO - Early stopping at epoch 850. Best Metrics: (0.06870738959053115, 0.05419701986754967, 0.07289041416299201)
2026-05-23 20:02:11,760 - optuna.study.study - INFO - Trial 20 finished with values: [0.06870738959053115, 0.05419701986754967, 0.07289041416299201] and parameters: {'n_layers': 1, 'embedding_dim': 256, 'lr': 0.0006825513923366329, 'lambda_val': 0.021157307876022, 'batch_size': 2902, 'optimizer': 'Adam'}.
2026-05-23 20:02:18,575 - experiment_functions - INFO - Early stopping at epoch 500. Best Metrics: (0.00532008860134254, 0.004652317880794702, 0.005726666226358843)
2026-05-23 20:02:18,668 - optuna.study.study - INFO - Trial 21 finished with values: [0.00532008860134254, 0.004652317880794702, 0.005726666226358843] and parameters: {'n_layers': 1, 'embedding_dim': 96, 'lr': 0.00021404168897179706, 'lambda_val': 0.020452511251658746, 'batch_size': 1842, 'optimizer': 'SGD'}.
2026-05-23 20:02:33,955 - experiment_functions - INFO - Early stopping at epoch 900. Best Metrics: (0.052882587502161175, 0.04245860927152319, 0.05700113224114267)
2026-05-23 20:02:34,061 - optuna.study.study - INFO - Trial 22 finished with values: [0.052882587502161175, 0.04245860927152319, 0.05700113224114267] and parameters: {'n_layers': 2, 'embedding_dim': 128, 'lr': 0.00031605974728020873, 'lambda_val': 0.0014579384886447386, 'batch_size': 3747, 'optimizer': 'RMSprop'}.
2026-05-23 20:02:41,366 - experiment_functions - INFO - Early stopping at epoch 500. Best Metrics: (0.005542427323581605, 0.004610927152317881, 0.0057511313054746886)
2026-05-23 20:02:41,442 - optuna.study.study - INFO - Trial 23 finished with values: [0.005542427323581605, 0.004610927152317881, 0.0057511313054746886] and parameters: {'n_layers': 2, 'embedding_dim': 64, 'lr': 4.638066700315778e-05, 'lambda_val': 1.8384501281542316e-06, 'batch_size': 2355, 'optimizer': 'SGD'}.
2026-05-23 20:02:54,730 - experiment_functions - INFO - Early stopping at epoch 700. Best Metrics: (0.044027628891174245, 0.03550496688741722, 0.047921492114568566)
2026-05-23 20:02:54,823 - optuna.study.study - INFO - Trial 24 finished with values: [0.044027628891174245, 0.03550496688741722, 0.047921492114568566] and parameters: {'n_layers': 3, 'embedding_dim': 128, 'lr': 0.0006274354192618561, 'lambda_val': 0.001151520053407667, 'batch_size': 3552, 'optimizer': 'Adam'}.
2026-05-23 20:03:54,510 - optuna.study.study - INFO - Trial 25 finished with values: [0.06067649914206019, 0.0489817880794702, 0.06501318879887667] and parameters: {'n_layers': 2, 'embedding_dim': 96, 'lr': 0.0001722725114045167, 'lambda_val': 0.0068325191706043835, 'batch_size': 1353, 'optimizer': 'RMSprop'}.
2026-05-23 20:04:02,313 - experiment_functions - INFO - Early stopping at epoch 500. Best Metrics: (0.005433200004718986, 0.004610927152317881, 0.005737101017433383)
2026-05-23 20:04:02,395 - optuna.study.study - INFO - Trial 26 finished with values: [0.005433200004718986, 0.004610927152317881, 0.005737101017433383] and parameters: {'n_layers': 2, 'embedding_dim': 96, 'lr': 1.0054314669442784e-05, 'lambda_val': 0.011324622699682792, 'batch_size': 1491, 'optimizer': 'Adam'}.
2026-05-23 20:04:24,894 - experiment_functions - INFO - Early stopping at epoch 1100. Best Metrics: (0.07012357704753845, 0.052591059602649, 0.07237230529214894)
2026-05-23 20:04:24,973 - optuna.study.study - INFO - Trial 27 finished with values: [0.07012357704753845, 0.052591059602649, 0.07237230529214894] and parameters: {'n_layers': 2, 'embedding_dim': 256, 'lr': 0.00045141578622738895, 'lambda_val': 2.2621228626504235e-06, 'batch_size': 886, 'optimizer': 'Adam'}.
2026-05-23 20:04:33,038 - experiment_functions - INFO - Early stopping at epoch 550. Best Metrics: (0.06581170328252055, 0.050190397350993385, 0.06787154887544868)
2026-05-23 20:04:33,128 - optuna.study.study - INFO - Trial 28 finished with values: [0.06581170328252055, 0.050190397350993385, 0.06787154887544868] and parameters: {'n_layers': 1, 'embedding_dim': 64, 'lr': 0.010318055219137296, 'lambda_val': 1.475751878769183e-05, 'batch_size': 2383, 'optimizer': 'Adam'}.
2026-05-23 20:04:42,608 - experiment_functions - INFO - Early stopping at epoch 500. Best Metrics: (0.004979975202767097, 0.004594370860927152, 0.005482643554500923)
2026-05-23 20:04:42,750 - optuna.study.study - INFO - Trial 29 finished with values: [0.004979975202767097, 0.004594370860927152, 0.005482643554500923] and parameters: {'n_layers': 4, 'embedding_dim': 96, 'lr': 8.596213801669404e-05, 'lambda_val': 0.0578557862812087, 'batch_size': 2358, 'optimizer': 'Adam'}.
2026-05-23 20:04:50,226 - experiment_functions - INFO - Early stopping at epoch 500. Best Metrics: (0.00484838864537984, 0.0045033112582781466, 0.0054052549023184725)
2026-05-23 20:04:50,309 - optuna.study.study - INFO - Trial 30 finished with values: [0.00484838864537984, 0.0045033112582781466, 0.0054052549023184725] and parameters: {'n_layers': 3, 'embedding_dim': 32, 'lr': 0.003484152717642414, 'lambda_val': 0.00027818937136086543, 'batch_size': 824, 'optimizer': 'SGD'}.
2026-05-23 20:04:57,575 - experiment_functions - INFO - Early stopping at epoch 500. Best Metrics: (0.0049260899732089655, 0.004172185430463576, 0.005191041397523163)
2026-05-23 20:04:57,657 - optuna.study.study - INFO - Trial 31 finished with values: [0.0049260899732089655, 0.004172185430463576, 0.005191041397523163] and parameters: {'n_layers': 1, 'embedding_dim': 128, 'lr': 0.0011474561920151382, 'lambda_val': 2.860497589069308e-05, 'batch_size': 1749, 'optimizer': 'SGD'}.
2026-05-23 20:05:07,128 - experiment_functions - INFO - Early stopping at epoch 550. Best Metrics: (0.02512314908241395, 0.018865894039735098, 0.025727961908301473)
2026-05-23 20:05:07,216 - optuna.study.study - INFO - Trial 32 finished with values: [0.02512314908241395, 0.018865894039735098, 0.025727961908301473] and parameters: {'n_layers': 1, 'embedding_dim': 256, 'lr': 0.035401596775805864, 'lambda_val': 2.164593457002043e-06, 'batch_size': 2576, 'optimizer': 'Adam'}.
2026-05-23 20:06:09,092 - optuna.study.study - INFO - Trial 33 finished with values: [0.053613507824948545, 0.03783112582781457, 0.05385018371302372] and parameters: {'n_layers': 1, 'embedding_dim': 256, 'lr': 0.004031587731005074, 'lambda_val': 0.00020136097974536503, 'batch_size': 535, 'optimizer': 'RMSprop'}.
2026-05-23 20:07:20,637 - optuna.study.study - INFO - Trial 34 finished with values: [0.03922072766944199, 0.025140728476821195, 0.036991974262492705] and parameters: {'n_layers': 3, 'embedding_dim': 128, 'lr': 0.0196116163675917, 'lambda_val': 0.0006933074309064735, 'batch_size': 3999, 'optimizer': 'Adam'}.
2026-05-23 20:07:32,869 - experiment_functions - INFO - Early stopping at epoch 500. Best Metrics: (0.005961275980830125, 0.00490066225165563, 0.0061500031506270545)
2026-05-23 20:07:32,950 - optuna.study.study - INFO - Trial 35 finished with values: [0.005961275980830125, 0.00490066225165563, 0.0061500031506270545] and parameters: {'n_layers': 3, 'embedding_dim': 256, 'lr': 5.253043563570832e-05, 'lambda_val': 0.0075236137452405, 'batch_size': 1297, 'optimizer': 'RMSprop'}.
2026-05-23 20:08:25,036 - optuna.study.study - INFO - Trial 36 finished with values: [0.04931682888515151, 0.03915562913907285, 0.052278103292992976] and parameters: {'n_layers': 1, 'embedding_dim': 96, 'lr': 0.03195479337928965, 'lambda_val': 0.009665452999254663, 'batch_size': 1893, 'optimizer': 'RMSprop'}.
2026-05-23 20:08:33,330 - experiment_functions - INFO - Early stopping at epoch 500. Best Metrics: (0.004886549022806896, 0.004486754966887417, 0.005353429947692686)
2026-05-23 20:08:33,413 - optuna.study.study - INFO - Trial 37 finished with values: [0.004886549022806896, 0.004486754966887417, 0.005353429947692686] and parameters: {'n_layers': 2, 'embedding_dim': 128, 'lr': 0.033105772358830866, 'lambda_val': 0.03089248809518067, 'batch_size': 773, 'optimizer': 'SGD'}.
2026-05-23 20:08:52,553 - experiment_functions - INFO - Early stopping at epoch 1400. Best Metrics: (0.05387579675499152, 0.041870860927152316, 0.054428495422919075)
2026-05-23 20:08:53,682 - optuna.study.study - INFO - Trial 38 finished with values: [0.05387579675499152, 0.041870860927152316, 0.054428495422919075] and parameters: {'n_layers': 2, 'embedding_dim': 32, 'lr': 0.0003263341791003019, 'lambda_val': 0.00020272782422991494, 'batch_size': 3855, 'optimizer': 'Adam'}.
2026-05-23 20:09:03,928 - experiment_functions - INFO - Early stopping at epoch 500. Best Metrics: (0.005280939052208634, 0.00435430463576159, 0.0054478958710617205)
2026-05-23 20:09:05,151 - optuna.study.study - INFO - Trial 39 finished with values: [0.005280939052208634, 0.00435430463576159, 0.0054478958710617205] and parameters: {'n_layers': 2, 'embedding_dim': 256, 'lr': 6.18131098302394e-05, 'lambda_val': 0.0031382087380616343, 'batch_size': 3485, 'optimizer': 'SGD'}.
2026-05-23 20:10:07,863 - optuna.study.study - INFO - Trial 40 finished with values: [0.05955239936277741, 0.04003311258278146, 0.05880444725071798] and parameters: {'n_layers': 1, 'embedding_dim': 256, 'lr': 0.007474732556550881, 'lambda_val': 0.0011279556330319215, 'batch_size': 1883, 'optimizer': 'RMSprop'}.
2026-05-23 20:10:18,427 - experiment_functions - INFO - Early stopping at epoch 500. Best Metrics: (0.004781517625919523, 0.004445364238410596, 0.005284841548533275)
2026-05-23 20:10:18,523 - optuna.study.study - INFO - Trial 41 finished with values: [0.004781517625919523, 0.004445364238410596, 0.005284841548533275] and parameters: {'n_layers': 4, 'embedding_dim': 128, 'lr': 0.00033139219581918613, 'lambda_val': 0.0005980010064698649, 'batch_size': 1917, 'optimizer': 'SGD'}.
2026-05-23 20:10:28,116 - experiment_functions - INFO - Early stopping at epoch 550. Best Metrics: (0.029912899322922456, 0.023716887417218543, 0.031979487075076606)
2026-05-23 20:10:28,543 - optuna.study.study - INFO - Trial 42 finished with values: [0.029912899322922456, 0.023716887417218543, 0.031979487075076606] and parameters: {'n_layers': 4, 'embedding_dim': 64, 'lr': 0.0007346939406659965, 'lambda_val': 2.3420359615170988e-05, 'batch_size': 3871, 'optimizer': 'RMSprop'}.
2026-05-23 20:11:30,684 - optuna.study.study - INFO - Trial 43 finished with values: [0.04186810536215422, 0.02478476821192053, 0.03735246089318314] and parameters: {'n_layers': 2, 'embedding_dim': 128, 'lr': 0.02707707664734598, 'lambda_val': 0.0005389031185277036, 'batch_size': 1044, 'optimizer': 'Adam'}.
2026-05-23 20:11:40,025 - experiment_functions - INFO - Early stopping at epoch 550. Best Metrics: (0.013090005602581115, 0.013302980132450331, 0.016177868267941587)
2026-05-23 20:11:40,118 - optuna.study.study - INFO - Trial 44 finished with values: [0.013090005602581115, 0.013302980132450331, 0.016177868267941587] and parameters: {'n_layers': 4, 'embedding_dim': 64, 'lr': 0.0030136909191112956, 'lambda_val': 7.066366944388039e-06, 'batch_size': 1806, 'optimizer': 'RMSprop'}.
2026-05-23 20:11:48,082 - experiment_functions - INFO - Early stopping at epoch 500. Best Metrics: (0.005413129098714686, 0.00462748344370861, 0.00598640928669326)
2026-05-23 20:11:48,174 - optuna.study.study - INFO - Trial 45 finished with values: [0.005413129098714686, 0.00462748344370861, 0.00598640928669326] and parameters: {'n_layers': 2, 'embedding_dim': 96, 'lr': 0.002297840706328893, 'lambda_val': 0.00033225177792127876, 'batch_size': 4056, 'optimizer': 'SGD'}.
2026-05-23 20:11:55,553 - experiment_functions - INFO - Early stopping at epoch 500. Best Metrics: (0.005258170919608747, 0.00412251655629139, 0.005345166993328257)
