2026-05-23 23:27:42,425 - optuna.study.study - INFO - Trial 221 finished with values: [0.028444567895426976, 0.00908112582781457, 0.025041032602485403] and parameters: {'n_layers': 1, 'embedding_dim': 64, 'lr': 0.00039700374197389405, 'lambda_val': 5.293319521753168e-06, 'batch_size': 1351, 'optimizer': 'RMSprop'}.
2026-05-23 23:28:13,664 - experiment_functions - INFO - Early stopping at epoch 2750. Best Metrics: (0.024072152702085257, 0.00788907284768212, 0.019865491810842704)
2026-05-23 23:28:14,512 - optuna.study.study - INFO - Trial 222 finished with values: [0.024072152702085257, 0.00788907284768212, 0.019865491810842704] and parameters: {'n_layers': 3, 'embedding_dim': 128, 'lr': 0.00011132803279953378, 'lambda_val': 0.0005877828856893911, 'batch_size': 3705, 'optimizer': 'RMSprop'}.
2026-05-23 23:29:01,691 - optuna.study.study - INFO - Trial 223 finished with values: [0.021790559820081812, 0.007624172185430465, 0.01870447460497971] and parameters: {'n_layers': 4, 'embedding_dim': 128, 'lr': 0.00011132803279953378, 'lambda_val': 4.360746018288999e-05, 'batch_size': 3950, 'optimizer': 'RMSprop'}.
2026-05-23 23:29:13,523 - experiment_functions - INFO - Early stopping at epoch 1050. Best Metrics: (0.027495447196489792, 0.008956953642384108, 0.024932579172672317)
2026-05-23 23:29:13,647 - optuna.study.study - INFO - Trial 224 finished with values: [0.027495447196489792, 0.008956953642384108, 0.024932579172672317] and parameters: {'n_layers': 1, 'embedding_dim': 256, 'lr': 0.00028881949474372873, 'lambda_val': 0.00031335292673571056, 'batch_size': 627, 'optimizer': 'RMSprop'}.
2026-05-23 23:29:19,968 - experiment_functions - INFO - Early stopping at epoch 500. Best Metrics: (0.005192148187337217, 0.004362582781456954, 0.005375366942195942)
2026-05-23 23:29:20,049 - optuna.study.study - INFO - Trial 225 finished with values: [0.005192148187337217, 0.004362582781456954, 0.005375366942195942] and parameters: {'n_layers': 2, 'embedding_dim': 128, 'lr': 0.00011132803279953378, 'lambda_val': 1.2927583321370151e-05, 'batch_size': 2177, 'optimizer': 'SGD'}.
2026-05-23 23:29:33,004 - experiment_functions - INFO - Early stopping at epoch 1100. Best Metrics: (0.02102993997241841, 0.007251655629139073, 0.018275014782663027)
2026-05-23 23:29:33,090 - optuna.study.study - INFO - Trial 226 finished with values: [0.02102993997241841, 0.007251655629139073, 0.018275014782663027] and parameters: {'n_layers': 2, 'embedding_dim': 256, 'lr': 0.00011705745989056773, 'lambda_val': 0.003227682115363012, 'batch_size': 1890, 'optimizer': 'RMSprop'}.
2026-05-23 23:29:59,590 - experiment_functions - INFO - Early stopping at epoch 2250. Best Metrics: (0.0258265111114273, 0.008385761589403974, 0.022512898960410494)
2026-05-23 23:29:59,951 - optuna.study.study - INFO - Trial 227 finished with values: [0.0258265111114273, 0.008385761589403974, 0.022512898960410494] and parameters: {'n_layers': 2, 'embedding_dim': 256, 'lr': 0.00011132803279953378, 'lambda_val': 5.293319521753168e-06, 'batch_size': 3705, 'optimizer': 'RMSprop'}.
2026-05-23 23:30:39,485 - optuna.study.study - INFO - Trial 228 finished with values: [0.026710166945797677, 0.00906456953642384, 0.023608518547793056] and parameters: {'n_layers': 1, 'embedding_dim': 128, 'lr': 0.00011132803279953378, 'lambda_val': 3.136622296234252e-05, 'batch_size': 1437, 'optimizer': 'RMSprop'}.
2026-05-23 23:30:46,829 - experiment_functions - INFO - Early stopping at epoch 650. Best Metrics: (0.01739669411823802, 0.006647350993377484, 0.01394945489711475)
2026-05-23 23:30:46,900 - optuna.study.study - INFO - Trial 229 finished with values: [0.01739669411823802, 0.006647350993377484, 0.01394945489711475] and parameters: {'n_layers': 2, 'embedding_dim': 32, 'lr': 0.0009470868010327422, 'lambda_val': 3.136622296234252e-05, 'batch_size': 1956, 'optimizer': 'Adam'}.
2026-05-23 23:30:56,918 - experiment_functions - INFO - Early stopping at epoch 850. Best Metrics: (0.02409505346012726, 0.008079470198675498, 0.021030889773798304)
2026-05-23 23:30:57,740 - optuna.study.study - INFO - Trial 230 finished with values: [0.02409505346012726, 0.008079470198675498, 0.021030889773798304] and parameters: {'n_layers': 1, 'embedding_dim': 256, 'lr': 0.00020853626135518792, 'lambda_val': 0.002482166316964702, 'batch_size': 2177, 'optimizer': 'RMSprop'}.
2026-05-23 23:31:04,575 - experiment_functions - INFO - Early stopping at epoch 500. Best Metrics: (0.005650845213345836, 0.004221854304635762, 0.005551657892082586)
2026-05-23 23:31:04,651 - optuna.study.study - INFO - Trial 231 finished with values: [0.005650845213345836, 0.004221854304635762, 0.005551657892082586] and parameters: {'n_layers': 3, 'embedding_dim': 128, 'lr': 0.0008725477105711385, 'lambda_val': 4.360746018288999e-05, 'batch_size': 3950, 'optimizer': 'SGD'}.
2026-05-23 23:31:47,653 - optuna.study.study - INFO - Trial 232 finished with values: [0.023121283209374233, 0.007922185430463576, 0.02080035092267219] and parameters: {'n_layers': 2, 'embedding_dim': 64, 'lr': 0.00011705745989056773, 'lambda_val': 9.691061665067305e-06, 'batch_size': 2988, 'optimizer': 'RMSprop'}.
2026-05-23 23:31:55,631 - experiment_functions - INFO - Early stopping at epoch 700. Best Metrics: (0.02549961089171449, 0.008178807947019869, 0.02230981602386271)
2026-05-23 23:31:55,713 - optuna.study.study - INFO - Trial 233 finished with values: [0.02549961089171449, 0.008178807947019869, 0.02230981602386271] and parameters: {'n_layers': 1, 'embedding_dim': 32, 'lr': 0.0009470868010327422, 'lambda_val': 0.0004946823991705582, 'batch_size': 2840, 'optimizer': 'Adam'}.
2026-05-23 23:32:39,969 - optuna.study.study - INFO - Trial 234 finished with values: [0.00998297719515988, 0.005248344370860927, 0.009452482835823027] and parameters: {'n_layers': 2, 'embedding_dim': 256, 'lr': 3.2255608796323204e-05, 'lambda_val': 2.2261760814938552e-05, 'batch_size': 1550, 'optimizer': 'Adam'}.
2026-05-23 23:33:29,243 - optuna.study.study - INFO - Trial 235 finished with values: [0.022131349937257183, 0.007706953642384107, 0.02005736176665954] and parameters: {'n_layers': 4, 'embedding_dim': 256, 'lr': 0.00011132803279953378, 'lambda_val': 4.360746018288999e-05, 'batch_size': 556, 'optimizer': 'Adam'}.
2026-05-23 23:33:35,733 - experiment_functions - INFO - Early stopping at epoch 550. Best Metrics: (0.01838046779532319, 0.00701158940397351, 0.01367096080632411)
2026-05-23 23:33:36,641 - optuna.study.study - INFO - Trial 236 finished with values: [0.01838046779532319, 0.00701158940397351, 0.01367096080632411] and parameters: {'n_layers': 2, 'embedding_dim': 128, 'lr': 0.0012665424339139031, 'lambda_val': 3.815128298863446e-06, 'batch_size': 601, 'optimizer': 'RMSprop'}.
2026-05-23 23:34:17,652 - optuna.study.study - INFO - Trial 237 finished with values: [0.02071305220424561, 0.007177152317880795, 0.017828903807191893] and parameters: {'n_layers': 1, 'embedding_dim': 32, 'lr': 0.00011132803279953378, 'lambda_val': 0.004482830763130357, 'batch_size': 2988, 'optimizer': 'RMSprop'}.
2026-05-23 23:34:25,313 - experiment_functions - INFO - Early stopping at epoch 600. Best Metrics: (0.023761023079673625, 0.008004966887417218, 0.0202405958895746)
2026-05-23 23:34:25,377 - optuna.study.study - INFO - Trial 238 finished with values: [0.023761023079673625, 0.008004966887417218, 0.0202405958895746] and parameters: {'n_layers': 2, 'embedding_dim': 256, 'lr': 0.0009299462051840892, 'lambda_val': 2.829964802645351e-06, 'batch_size': 1477, 'optimizer': 'Adam'}.
2026-05-23 23:35:04,226 - experiment_functions - INFO - Early stopping at epoch 3500. Best Metrics: (0.028185429352261544, 0.0089817880794702, 0.024858851548519773)
2026-05-23 23:35:04,495 - optuna.study.study - INFO - Trial 239 finished with values: [0.028185429352261544, 0.0089817880794702, 0.024858851548519773] and parameters: {'n_layers': 2, 'embedding_dim': 128, 'lr': 0.00011132803279953378, 'lambda_val': 1.2927583321370151e-05, 'batch_size': 3705, 'optimizer': 'RMSprop'}.
2026-05-23 23:35:11,166 - experiment_functions - INFO - Early stopping at epoch 550. Best Metrics: (0.02457673456356902, 0.008269867549668875, 0.020624955021584467)
2026-05-23 23:35:11,240 - optuna.study.study - INFO - Trial 240 finished with values: [0.02457673456356902, 0.008269867549668875, 0.020624955021584467] and parameters: {'n_layers': 1, 'embedding_dim': 256, 'lr': 0.0009476115504073459, 'lambda_val': 0.002482166316964702, 'batch_size': 556, 'optimizer': 'RMSprop'}.
2026-05-23 23:35:54,160 - optuna.study.study - INFO - Trial 241 finished with values: [0.026210881523024504, 0.008658940397350993, 0.023080171817595207] and parameters: {'n_layers': 2, 'embedding_dim': 64, 'lr': 0.00011705745989056773, 'lambda_val': 5.293319521753168e-06, 'batch_size': 3705, 'optimizer': 'RMSprop'}.
2026-05-23 23:36:08,691 - experiment_functions - INFO - Early stopping at epoch 1300. Best Metrics: (0.02767872948839514, 0.008625827814569538, 0.025182121929078122)
2026-05-23 23:36:09,008 - optuna.study.study - INFO - Trial 242 finished with values: [0.02767872948839514, 0.008625827814569538, 0.025182121929078122] and parameters: {'n_layers': 1, 'embedding_dim': 256, 'lr': 0.0003568831204476262, 'lambda_val': 1.0525537797663283e-06, 'batch_size': 627, 'optimizer': 'RMSprop'}.
2026-05-23 23:36:15,361 - experiment_functions - INFO - Early stopping at epoch 500. Best Metrics: (0.004430735923421714, 0.004163907284768212, 0.005113735876953715)
2026-05-23 23:36:16,063 - optuna.study.study - INFO - Trial 243 finished with values: [0.004430735923421714, 0.004163907284768212, 0.005113735876953715] and parameters: {'n_layers': 2, 'embedding_dim': 128, 'lr': 0.0009299462051840892, 'lambda_val': 0.030983305787764842, 'batch_size': 3705, 'optimizer': 'Adam'}.
2026-05-23 23:36:23,182 - experiment_functions - INFO - Early stopping at epoch 550. Best Metrics: (0.02518897084044128, 0.008211920529801325, 0.021961057843832912)
2026-05-23 23:36:23,272 - optuna.study.study - INFO - Trial 244 finished with values: [0.02518897084044128, 0.008211920529801325, 0.021961057843832912] and parameters: {'n_layers': 2, 'embedding_dim': 256, 'lr': 0.0019170109114511021, 'lambda_val': 0.00031335292673571056, 'batch_size': 2206, 'optimizer': 'Adam'}.
2026-05-23 23:36:31,262 - experiment_functions - INFO - Early stopping at epoch 650. Best Metrics: (0.015993618019933518, 0.006274834437086094, 0.013468150279639933)
2026-05-23 23:36:31,343 - optuna.study.study - INFO - Trial 245 finished with values: [0.015993618019933518, 0.006274834437086094, 0.013468150279639933] and parameters: {'n_layers': 2, 'embedding_dim': 128, 'lr': 0.00028881949474372873, 'lambda_val': 0.002482166316964702, 'batch_size': 3705, 'optimizer': 'RMSprop'}.
2026-05-23 23:36:47,285 - experiment_functions - INFO - Early stopping at epoch 1350. Best Metrics: (0.021659059628575054, 0.007640728476821193, 0.01922422745967902)
2026-05-23 23:36:47,464 - optuna.study.study - INFO - Trial 246 finished with values: [0.021659059628575054, 0.007640728476821193, 0.01922422745967902] and parameters: {'n_layers': 2, 'embedding_dim': 256, 'lr': 0.00011132803279953378, 'lambda_val': 0.0028639996941338948, 'batch_size': 1550, 'optimizer': 'Adam'}.
2026-05-23 23:36:54,927 - experiment_functions - INFO - Early stopping at epoch 600. Best Metrics: (0.02576501536519823, 0.008435430463576159, 0.022713673978661905)
2026-05-23 23:36:55,093 - optuna.study.study - INFO - Trial 247 finished with values: [0.02576501536519823, 0.008435430463576159, 0.022713673978661905] and parameters: {'n_layers': 1, 'embedding_dim': 256, 'lr': 0.0007742554383218026, 'lambda_val': 3.136622296234252e-05, 'batch_size': 667, 'optimizer': 'RMSprop'}.
2026-05-23 23:37:02,876 - experiment_functions - INFO - Early stopping at epoch 600. Best Metrics: (0.025666625269055065, 0.00869205298013245, 0.023012046856555432)
2026-05-23 23:37:02,966 - optuna.study.study - INFO - Trial 248 finished with values: [0.025666625269055065, 0.00869205298013245, 0.023012046856555432] and parameters: {'n_layers': 1, 'embedding_dim': 256, 'lr': 0.0007366903488898144, 'lambda_val': 9.691061665067305e-06, 'batch_size': 556, 'optimizer': 'RMSprop'}.
2026-05-23 23:37:45,735 - optuna.study.study - INFO - Trial 249 finished with values: [0.02711256937498458, 0.008932119205298013, 0.024230803531567577] and parameters: {'n_layers': 1, 'embedding_dim': 128, 'lr': 0.00011132803279953378, 'lambda_val': 3.5539557374354204e-05, 'batch_size': 3705, 'optimizer': 'RMSprop'}.
2026-05-23 23:37:52,798 - experiment_functions - INFO - Early stopping at epoch 550. Best Metrics: (0.021872903895122565, 0.0073013245033112595, 0.018965184123040154)
2026-05-23 23:37:53,068 - optuna.study.study - INFO - Trial 250 finished with values: [0.021872903895122565, 0.0073013245033112595, 0.018965184123040154] and parameters: {'n_layers': 1, 'embedding_dim': 128, 'lr': 0.0007742554383218026, 'lambda_val': 3.136622296234252e-05, 'batch_size': 3950, 'optimizer': 'RMSprop'}.
2026-05-23 23:38:04,748 - experiment_functions - INFO - Early stopping at epoch 1050. Best Metrics: (0.0274748424976755, 0.008915562913907285, 0.025305766210798136)
2026-05-23 23:38:04,837 - optuna.study.study - INFO - Trial 251 finished with values: [0.0274748424976755, 0.008915562913907285, 0.025305766210798136] and parameters: {'n_layers': 1, 'embedding_dim': 128, 'lr': 0.0003568831204476262, 'lambda_val': 0.00031335292673571056, 'batch_size': 627, 'optimizer': 'RMSprop'}.
2026-05-23 23:38:47,286 - experiment_functions - INFO - Early stopping at epoch 3850. Best Metrics: (0.02874151036441432, 0.009337748344370862, 0.02634584770091577)
2026-05-23 23:38:47,369 - optuna.study.study - INFO - Trial 252 finished with values: [0.02874151036441432, 0.009337748344370862, 0.02634584770091577] and parameters: {'n_layers': 2, 'embedding_dim': 128, 'lr': 0.00011132803279953378, 'lambda_val': 5.293319521753168e-06, 'batch_size': 3705, 'optimizer': 'RMSprop'}.
2026-05-23 23:39:29,834 - optuna.study.study - INFO - Trial 253 finished with values: [0.02836650537711446, 0.009486754966887417, 0.02646355922991606] and parameters: {'n_layers': 2, 'embedding_dim': 128, 'lr': 0.00011132803279953378, 'lambda_val': 9.691061665067305e-06, 'batch_size': 765, 'optimizer': 'RMSprop'}.
2026-05-23 23:39:35,768 - experiment_functions - INFO - Early stopping at epoch 500. Best Metrics: (0.006347349411475801, 0.00429635761589404, 0.006046072177362626)
2026-05-23 23:39:36,158 - optuna.study.study - INFO - Trial 254 finished with values: [0.006347349411475801, 0.00429635761589404, 0.006046072177362626] and parameters: {'n_layers': 1, 'embedding_dim': 64, 'lr': 0.09908702646591841, 'lambda_val': 5.293319521753168e-06, 'batch_size': 3950, 'optimizer': 'RMSprop'}.
2026-05-23 23:40:17,976 - experiment_functions - INFO - Early stopping at epoch 3750. Best Metrics: (0.027878657932380653, 0.009197019867549668, 0.023956230549387326)
2026-05-23 23:40:18,058 - optuna.study.study - INFO - Trial 255 finished with values: [0.027878657932380653, 0.009197019867549668, 0.023956230549387326] and parameters: {'n_layers': 2, 'embedding_dim': 128, 'lr': 0.00011132803279953378, 'lambda_val': 9.691061665067305e-06, 'batch_size': 3731, 'optimizer': 'RMSprop'}.
2026-05-23 23:40:24,272 - experiment_functions - INFO - Early stopping at epoch 500. Best Metrics: (0.005059007897164572, 0.0040562913907284765, 0.005037155928868766)
2026-05-23 23:40:25,093 - optuna.study.study - INFO - Trial 256 finished with values: [0.005059007897164572, 0.0040562913907284765, 0.005037155928868766] and parameters: {'n_layers': 1, 'embedding_dim': 256, 'lr': 0.0027774184001281023, 'lambda_val': 0.00031335292673571056, 'batch_size': 627, 'optimizer': 'RMSprop'}.
2026-05-23 23:40:33,552 - experiment_functions - INFO - Early stopping at epoch 700. Best Metrics: (0.016843761847018843, 0.006523178807947021, 0.016197710736549267)
2026-05-23 23:40:33,983 - optuna.study.study - INFO - Trial 257 finished with values: [0.016843761847018843, 0.006523178807947021, 0.016197710736549267] and parameters: {'n_layers': 2, 'embedding_dim': 64, 'lr': 0.00039700374197389405, 'lambda_val': 5.293319521753168e-06, 'batch_size': 3705, 'optimizer': 'RMSprop'}.
2026-05-23 23:41:00,175 - experiment_functions - INFO - Early stopping at epoch 2200. Best Metrics: (0.02703253611306029, 0.00855132450331126, 0.023256873632955914)
2026-05-23 23:41:00,245 - optuna.study.study - INFO - Trial 258 finished with values: [0.02703253611306029, 0.00855132450331126, 0.023256873632955914] and parameters: {'n_layers': 2, 'embedding_dim': 256, 'lr': 0.00011132803279953378, 'lambda_val': 9.691061665067305e-06, 'batch_size': 3705, 'optimizer': 'RMSprop'}.
2026-05-23 23:41:29,260 - experiment_functions - INFO - Early stopping at epoch 2600. Best Metrics: (0.026878668010339554, 0.008178807947019867, 0.02341897877569328)
2026-05-23 23:41:29,636 - optuna.study.study - INFO - Trial 259 finished with values: [0.026878668010339554, 0.008178807947019867, 0.02341897877569328] and parameters: {'n_layers': 1, 'embedding_dim': 256, 'lr': 0.00011132803279953378, 'lambda_val': 2.430474765536691e-05, 'batch_size': 3705, 'optimizer': 'RMSprop'}.
2026-05-23 23:41:55,144 - experiment_functions - INFO - Early stopping at epoch 2400. Best Metrics: (0.02605853972193914, 0.008650662251655629, 0.023753846016209782)
2026-05-23 23:41:55,274 - optuna.study.study - INFO - Trial 260 finished with values: [0.02605853972193914, 0.008650662251655629, 0.023753846016209782] and parameters: {'n_layers': 2, 'embedding_dim': 96, 'lr': 0.00011705745989056773, 'lambda_val': 0.002482166316964702, 'batch_size': 1610, 'optimizer': 'RMSprop'}.
2026-05-23 23:42:39,882 - optuna.study.study - INFO - Trial 261 finished with values: [0.027116209605563355, 0.00859271523178808, 0.023993211851838454] and parameters: {'n_layers': 2, 'embedding_dim': 128, 'lr': 0.00011132803279953378, 'lambda_val': 1.2927583321370151e-05, 'batch_size': 3705, 'optimizer': 'RMSprop'}.
2026-05-23 23:42:49,054 - experiment_functions - INFO - Early stopping at epoch 800. Best Metrics: (0.024288189172110404, 0.00816225165562914, 0.021392416668632713)
2026-05-23 23:42:49,143 - optuna.study.study - INFO - Trial 262 finished with values: [0.024288189172110404, 0.00816225165562914, 0.021392416668632713] and parameters: {'n_layers': 1, 'embedding_dim': 96, 'lr': 0.00039700374197389405, 'lambda_val': 0.002482166316964702, 'batch_size': 2579, 'optimizer': 'Adam'}.
2026-05-23 23:43:31,509 - optuna.study.study - INFO - Trial 263 finished with values: [0.028776884998689804, 0.009288079470198676, 0.02644670044278971] and parameters: {'n_layers': 2, 'embedding_dim': 128, 'lr': 0.00011132803279953378, 'lambda_val': 3.136622296234252e-05, 'batch_size': 1437, 'optimizer': 'RMSprop'}.
2026-05-23 23:43:45,523 - experiment_functions - INFO - Early stopping at epoch 1150. Best Metrics: (0.021146122304677693, 0.0069370860927152325, 0.015258323993018139)
2026-05-23 23:43:46,187 - optuna.study.study - INFO - Trial 264 finished with values: [0.021146122304677693, 0.0069370860927152325, 0.015258323993018139] and parameters: {'n_layers': 3, 'embedding_dim': 256, 'lr': 0.00028881949474372873, 'lambda_val': 3.136622296234252e-05, 'batch_size': 1437, 'optimizer': 'RMSprop'}.
2026-05-23 23:44:27,198 - optuna.study.study - INFO - Trial 265 finished with values: [0.02535223339794489, 0.008899006622516557, 0.02424406769272169] and parameters: {'n_layers': 1, 'embedding_dim': 96, 'lr': 0.00011705745989056773, 'lambda_val': 3.136622296234252e-05, 'batch_size': 667, 'optimizer': 'RMSprop'}.
2026-05-23 23:45:09,696 - optuna.study.study - INFO - Trial 266 finished with values: [0.023910296046871584, 0.008029801324503311, 0.02132690657160239] and parameters: {'n_layers': 2, 'embedding_dim': 64, 'lr': 0.00011705745989056773, 'lambda_val': 9.691061665067305e-06, 'batch_size': 3705, 'optimizer': 'RMSprop'}.
2026-05-23 23:45:22,744 - experiment_functions - INFO - Early stopping at epoch 1200. Best Metrics: (0.02983887321576513, 0.00956953642384106, 0.025066516607992518)
2026-05-23 23:45:22,842 - optuna.study.study - INFO - Trial 267 finished with values: [0.02983887321576513, 0.00956953642384106, 0.025066516607992518] and parameters: {'n_layers': 2, 'embedding_dim': 64, 'lr': 0.0003568831204476262, 'lambda_val': 1.0525537797663283e-06, 'batch_size': 627, 'optimizer': 'RMSprop'}.
2026-05-23 23:45:32,270 - experiment_functions - INFO - Early stopping at epoch 800. Best Metrics: (0.025238109991976572, 0.00826158940397351, 0.022421345905676134)
2026-05-23 23:45:32,358 - optuna.study.study - INFO - Trial 268 finished with values: [0.025238109991976572, 0.00826158940397351, 0.022421345905676134] and parameters: {'n_layers': 1, 'embedding_dim': 256, 'lr': 0.00039700374197389405, 'lambda_val': 2.430474765536691e-05, 'batch_size': 1894, 'optimizer': 'Adam'}.
2026-05-23 23:46:16,643 - optuna.study.study - INFO - Trial 269 finished with values: [0.02785960338750498, 0.008981788079470199, 0.024151169651622874] and parameters: {'n_layers': 2, 'embedding_dim': 128, 'lr': 0.00011132803279953378, 'lambda_val': 1.2927583321370151e-05, 'batch_size': 3705, 'optimizer': 'RMSprop'}.
2026-05-23 23:46:22,536 - experiment_functions - INFO - Early stopping at epoch 500. Best Metrics: (0.004791321913507064, 0.0038079470198675498, 0.004932989687130341)
2026-05-23 23:46:23,085 - optuna.study.study - INFO - Trial 270 finished with values: [0.004791321913507064, 0.0038079470198675498, 0.004932989687130341] and parameters: {'n_layers': 1, 'embedding_dim': 256, 'lr': 0.004336987092127606, 'lambda_val': 5.293319521753168e-06, 'batch_size': 1351, 'optimizer': 'RMSprop'}.
2026-05-23 23:47:02,275 - experiment_functions - INFO - Early stopping at epoch 3700. Best Metrics: (0.026341492612541574, 0.008758278145695365, 0.025478813059118633)
