2026-05-24 14:44:56,718 - optuna.study.study - INFO - Trial 232 finished with values: [0.05385182844608249, 0.03410596026490066, 0.048982934965444605] and parameters: {'n_layers': 1, 'embedding_dim': 256, 'lr': 0.0007653011157039608, 'lambda_val': 7.985064351552862e-06, 'batch_size': 1408, 'optimizer': 'Adam'}.
2026-05-24 14:45:45,214 - optuna.study.study - INFO - Trial 233 finished with values: [0.061221778917717455, 0.03468543046357616, 0.05274493774111009] and parameters: {'n_layers': 2, 'embedding_dim': 128, 'lr': 0.0002249192915429732, 'lambda_val': 2.0723645088674174e-05, 'batch_size': 917, 'optimizer': 'RMSprop'}.
2026-05-24 14:46:30,255 - optuna.study.study - INFO - Trial 234 finished with values: [0.06054278853655751, 0.03512417218543047, 0.05196603857665485] and parameters: {'n_layers': 2, 'embedding_dim': 64, 'lr': 0.0002249192915429732, 'lambda_val': 1.6606118736479167e-06, 'batch_size': 968, 'optimizer': 'RMSprop'}.
2026-05-24 14:46:46,515 - experiment_functions - INFO - Early stopping at epoch 1150. Best Metrics: (0.056534599442118506, 0.03330298013245033, 0.049583128949105916)
2026-05-24 14:46:46,625 - optuna.study.study - INFO - Trial 235 finished with values: [0.056534599442118506, 0.03330298013245033, 0.049583128949105916] and parameters: {'n_layers': 2, 'embedding_dim': 256, 'lr': 0.0003540171758009511, 'lambda_val': 1.4446750706679519e-05, 'batch_size': 1236, 'optimizer': 'RMSprop'}.
2026-05-24 14:46:57,561 - experiment_functions - INFO - Early stopping at epoch 900. Best Metrics: (0.054811222206388475, 0.03293046357615894, 0.04799527878927651)
2026-05-24 14:46:57,723 - optuna.study.study - INFO - Trial 236 finished with values: [0.054811222206388475, 0.03293046357615894, 0.04799527878927651] and parameters: {'n_layers': 2, 'embedding_dim': 64, 'lr': 0.0007653011157039608, 'lambda_val': 7.187538783101437e-06, 'batch_size': 1055, 'optimizer': 'Adam'}.
2026-05-24 14:47:11,275 - experiment_functions - INFO - Early stopping at epoch 1150. Best Metrics: (0.059904923165498176, 0.03562086092715232, 0.05224179396880339)
2026-05-24 14:47:11,360 - optuna.study.study - INFO - Trial 237 finished with values: [0.059904923165498176, 0.03562086092715232, 0.05224179396880339] and parameters: {'n_layers': 2, 'embedding_dim': 32, 'lr': 0.0005496090398292237, 'lambda_val': 9.772502453834702e-06, 'batch_size': 1970, 'optimizer': 'Adam'}.
2026-05-24 14:47:56,906 - optuna.study.study - INFO - Trial 238 finished with values: [0.06451044000680614, 0.03676324503311258, 0.05382346478097277] and parameters: {'n_layers': 2, 'embedding_dim': 32, 'lr': 0.0003540171758009511, 'lambda_val': 0.0009801820764399163, 'batch_size': 968, 'optimizer': 'RMSprop'}.
2026-05-24 14:48:41,847 - experiment_functions - INFO - Early stopping at epoch 3750. Best Metrics: (0.05241912677476971, 0.032913907284768215, 0.04778746602091588)
2026-05-24 14:48:42,169 - optuna.study.study - INFO - Trial 239 finished with values: [0.05241912677476971, 0.032913907284768215, 0.04778746602091588] and parameters: {'n_layers': 2, 'embedding_dim': 128, 'lr': 0.0002249192915429732, 'lambda_val': 5.836368620363864e-06, 'batch_size': 1970, 'optimizer': 'Adam'}.
2026-05-24 14:48:50,767 - experiment_functions - INFO - Early stopping at epoch 750. Best Metrics: (0.013088388902987738, 0.009428807947019868, 0.012482455596985157)
2026-05-24 14:48:50,845 - optuna.study.study - INFO - Trial 240 finished with values: [0.013088388902987738, 0.009428807947019868, 0.012482455596985157] and parameters: {'n_layers': 2, 'embedding_dim': 32, 'lr': 0.05107373402364573, 'lambda_val': 4.102618048031892e-06, 'batch_size': 1055, 'optimizer': 'Adam'}.
2026-05-24 14:49:01,448 - experiment_functions - INFO - Early stopping at epoch 850. Best Metrics: (0.051576272503673026, 0.030504966887417218, 0.0449063092669337)
2026-05-24 14:49:01,545 - optuna.study.study - INFO - Trial 241 finished with values: [0.051576272503673026, 0.030504966887417218, 0.0449063092669337] and parameters: {'n_layers': 3, 'embedding_dim': 64, 'lr': 0.0006563002976325864, 'lambda_val': 0.000339235643209516, 'batch_size': 968, 'optimizer': 'Adam'}.
2026-05-24 14:49:24,101 - experiment_functions - INFO - Early stopping at epoch 2000. Best Metrics: (0.06364309776197193, 0.03804635761589404, 0.05473082924756912)
2026-05-24 14:49:24,181 - optuna.study.study - INFO - Trial 242 finished with values: [0.06364309776197193, 0.03804635761589404, 0.05473082924756912] and parameters: {'n_layers': 1, 'embedding_dim': 96, 'lr': 0.0006563002976325864, 'lambda_val': 0.000339235643209516, 'batch_size': 901, 'optimizer': 'Adam'}.
2026-05-24 14:50:04,243 - optuna.study.study - INFO - Trial 243 finished with values: [0.017563504562014044, 0.013004966887417221, 0.017670514783224043] and parameters: {'n_layers': 1, 'embedding_dim': 32, 'lr': 0.0002249192915429732, 'lambda_val': 2.6431113659875313e-06, 'batch_size': 1236, 'optimizer': 'RMSprop'}.
2026-05-24 14:50:16,661 - experiment_functions - INFO - Early stopping at epoch 1050. Best Metrics: (0.05520933880834683, 0.03394867549668874, 0.04899018334311541)
2026-05-24 14:50:16,743 - optuna.study.study - INFO - Trial 244 finished with values: [0.05520933880834683, 0.03394867549668874, 0.04899018334311541] and parameters: {'n_layers': 1, 'embedding_dim': 64, 'lr': 0.0006563002976325864, 'lambda_val': 0.00025695451366523024, 'batch_size': 3012, 'optimizer': 'RMSprop'}.
2026-05-24 14:50:39,974 - experiment_functions - INFO - Early stopping at epoch 1900. Best Metrics: (0.05618150990948329, 0.035248344370860926, 0.05022474262246376)
2026-05-24 14:50:40,067 - optuna.study.study - INFO - Trial 245 finished with values: [0.05618150990948329, 0.035248344370860926, 0.05022474262246376] and parameters: {'n_layers': 1, 'embedding_dim': 256, 'lr': 0.0003859482391059796, 'lambda_val': 0.000339235643209516, 'batch_size': 2074, 'optimizer': 'Adam'}.
2026-05-24 14:51:22,200 - optuna.study.study - INFO - Trial 246 finished with values: [0.049140484491005665, 0.030778145695364245, 0.04498512965676353] and parameters: {'n_layers': 1, 'embedding_dim': 32, 'lr': 0.0005264581247601549, 'lambda_val': 2.6431113659875313e-06, 'batch_size': 530, 'optimizer': 'Adam'}.
2026-05-24 14:51:28,376 - experiment_functions - INFO - Early stopping at epoch 500. Best Metrics: (0.005236608504934018, 0.004105960264900663, 0.005131246829810396)
2026-05-24 14:51:28,622 - optuna.study.study - INFO - Trial 247 finished with values: [0.005236608504934018, 0.004105960264900663, 0.005131246829810396] and parameters: {'n_layers': 2, 'embedding_dim': 96, 'lr': 8.74299692574603e-05, 'lambda_val': 0.0037292276933401035, 'batch_size': 3012, 'optimizer': 'Adam'}.
2026-05-24 14:52:11,920 - optuna.study.study - INFO - Trial 248 finished with values: [0.035248557825437794, 0.023269867549668876, 0.03199301636396678] and parameters: {'n_layers': 3, 'embedding_dim': 32, 'lr': 0.00016144271630951973, 'lambda_val': 1.4247463760726523e-06, 'batch_size': 968, 'optimizer': 'Adam'}.
2026-05-24 14:52:28,311 - experiment_functions - INFO - Early stopping at epoch 1400. Best Metrics: (0.06108886787746213, 0.036945364238410605, 0.05414181734690179)
2026-05-24 14:52:29,026 - optuna.study.study - INFO - Trial 249 finished with values: [0.06108886787746213, 0.036945364238410605, 0.05414181734690179] and parameters: {'n_layers': 1, 'embedding_dim': 128, 'lr': 0.0007653011157039608, 'lambda_val': 1.0152215023816412e-05, 'batch_size': 1055, 'optimizer': 'Adam'}.
2026-05-24 14:53:15,898 - optuna.study.study - INFO - Trial 250 finished with values: [0.05902162039645746, 0.03500827814569536, 0.051588894696767106] and parameters: {'n_layers': 2, 'embedding_dim': 96, 'lr': 0.0002249192915429732, 'lambda_val': 7.187538783101437e-06, 'batch_size': 1055, 'optimizer': 'Adam'}.
2026-05-24 14:53:35,832 - experiment_functions - INFO - Early stopping at epoch 1600. Best Metrics: (0.058037458820010046, 0.03573675496688741, 0.05171457552504632)
2026-05-24 14:53:35,930 - optuna.study.study - INFO - Trial 251 finished with values: [0.058037458820010046, 0.03573675496688741, 0.05171457552504632] and parameters: {'n_layers': 1, 'embedding_dim': 256, 'lr': 0.0007653011157039608, 'lambda_val': 2.6431113659875313e-06, 'batch_size': 606, 'optimizer': 'Adam'}.
2026-05-24 14:53:50,873 - experiment_functions - INFO - Early stopping at epoch 1050. Best Metrics: (0.05045385453552306, 0.03225165562913907, 0.04548044545674376)
2026-05-24 14:53:51,663 - optuna.study.study - INFO - Trial 252 finished with values: [0.05045385453552306, 0.03225165562913907, 0.04548044545674376] and parameters: {'n_layers': 2, 'embedding_dim': 256, 'lr': 0.0003859482391059796, 'lambda_val': 1.4446750706679519e-05, 'batch_size': 1236, 'optimizer': 'RMSprop'}.
2026-05-24 14:53:59,544 - experiment_functions - INFO - Early stopping at epoch 500. Best Metrics: (0.0056669942318257486, 0.0043791390728476825, 0.0054926056023824185)
2026-05-24 14:53:59,633 - optuna.study.study - INFO - Trial 253 finished with values: [0.0056669942318257486, 0.0043791390728476825, 0.0054926056023824185] and parameters: {'n_layers': 3, 'embedding_dim': 256, 'lr': 0.0018843975064796988, 'lambda_val': 1.4446750706679519e-05, 'batch_size': 1970, 'optimizer': 'SGD'}.
2026-05-24 14:54:10,272 - experiment_functions - INFO - Early stopping at epoch 850. Best Metrics: (0.053585426091060886, 0.03262417218543046, 0.0468572083357656)
2026-05-24 14:54:10,368 - optuna.study.study - INFO - Trial 254 finished with values: [0.053585426091060886, 0.03262417218543046, 0.0468572083357656] and parameters: {'n_layers': 2, 'embedding_dim': 96, 'lr': 0.0008491317804224778, 'lambda_val': 7.011674546086162e-05, 'batch_size': 1055, 'optimizer': 'Adam'}.
2026-05-24 14:54:16,017 - experiment_functions - INFO - Early stopping at epoch 500. Best Metrics: (0.00523989303127307, 0.003998344370860927, 0.005124877922696425)
2026-05-24 14:54:17,345 - optuna.study.study - INFO - Trial 255 finished with values: [0.00523989303127307, 0.003998344370860927, 0.005124877922696425] and parameters: {'n_layers': 1, 'embedding_dim': 32, 'lr': 0.0003540171758009511, 'lambda_val': 2.6431113659875313e-06, 'batch_size': 968, 'optimizer': 'SGD'}.
2026-05-24 14:55:01,210 - optuna.study.study - INFO - Trial 256 finished with values: [0.0514158672241637, 0.030778145695364238, 0.046040918694037605] and parameters: {'n_layers': 2, 'embedding_dim': 32, 'lr': 0.0002249192915429732, 'lambda_val': 7.985064351552862e-06, 'batch_size': 2154, 'optimizer': 'Adam'}.
2026-05-24 14:55:15,369 - experiment_functions - INFO - Early stopping at epoch 1000. Best Metrics: (0.051974788927126696, 0.03201986754966887, 0.04634264374842275)
2026-05-24 14:55:15,457 - optuna.study.study - INFO - Trial 257 finished with values: [0.051974788927126696, 0.03201986754966887, 0.04634264374842275] and parameters: {'n_layers': 2, 'embedding_dim': 256, 'lr': 0.0003859482391059796, 'lambda_val': 0.000339235643209516, 'batch_size': 2074, 'optimizer': 'Adam'}.
2026-05-24 14:55:23,272 - experiment_functions - INFO - Early stopping at epoch 550. Best Metrics: (0.043315082031466036, 0.02808774834437086, 0.03950872280952455)
2026-05-24 14:55:23,403 - optuna.study.study - INFO - Trial 258 finished with values: [0.043315082031466036, 0.02808774834437086, 0.03950872280952455] and parameters: {'n_layers': 1, 'embedding_dim': 128, 'lr': 0.01245800478955897, 'lambda_val': 2.6431113659875313e-06, 'batch_size': 1055, 'optimizer': 'Adam'}.
2026-05-24 14:56:01,186 - experiment_functions - INFO - Early stopping at epoch 2800. Best Metrics: (0.06032230153534663, 0.03598509933774834, 0.05303319921686751)
2026-05-24 14:56:01,271 - optuna.study.study - INFO - Trial 259 finished with values: [0.06032230153534663, 0.03598509933774834, 0.05303319921686751] and parameters: {'n_layers': 2, 'embedding_dim': 256, 'lr': 0.0002249192915429732, 'lambda_val': 7.187538783101437e-06, 'batch_size': 1055, 'optimizer': 'RMSprop'}.
2026-05-24 14:56:25,076 - experiment_functions - INFO - Early stopping at epoch 1750. Best Metrics: (0.04833779278269635, 0.03117549668874172, 0.04436655213946922)
2026-05-24 14:56:25,256 - optuna.study.study - INFO - Trial 260 finished with values: [0.04833779278269635, 0.03117549668874172, 0.04436655213946922] and parameters: {'n_layers': 2, 'embedding_dim': 256, 'lr': 0.0002249192915429732, 'lambda_val': 2.0723645088674174e-05, 'batch_size': 2154, 'optimizer': 'Adam'}.
2026-05-24 14:56:34,713 - experiment_functions - INFO - Early stopping at epoch 650. Best Metrics: (0.05715357295830289, 0.033567880794701986, 0.04996902426751676)
2026-05-24 14:56:35,215 - optuna.study.study - INFO - Trial 261 finished with values: [0.05715357295830289, 0.033567880794701986, 0.04996902426751676] and parameters: {'n_layers': 2, 'embedding_dim': 256, 'lr': 0.0013803742426794694, 'lambda_val': 7.187538783101437e-06, 'batch_size': 968, 'optimizer': 'Adam'}.
2026-05-24 14:56:46,104 - experiment_functions - INFO - Early stopping at epoch 850. Best Metrics: (0.05436322000364177, 0.03304635761589404, 0.04782039806372009)
2026-05-24 14:56:46,532 - optuna.study.study - INFO - Trial 262 finished with values: [0.05436322000364177, 0.03304635761589404, 0.04782039806372009] and parameters: {'n_layers': 2, 'embedding_dim': 128, 'lr': 0.0007653011157039608, 'lambda_val': 7.011674546086162e-05, 'batch_size': 1055, 'optimizer': 'Adam'}.
2026-05-24 14:57:01,432 - experiment_functions - INFO - Early stopping at epoch 950. Best Metrics: (0.035848489316303495, 0.024395695364238416, 0.03315277160509177)
2026-05-24 14:57:01,505 - optuna.study.study - INFO - Trial 263 finished with values: [0.035848489316303495, 0.024395695364238416, 0.03315277160509177] and parameters: {'n_layers': 3, 'embedding_dim': 256, 'lr': 0.0002249192915429732, 'lambda_val': 0.0004350358036727403, 'batch_size': 3012, 'optimizer': 'RMSprop'}.
2026-05-24 14:57:07,851 - experiment_functions - INFO - Early stopping at epoch 500. Best Metrics: (0.004940750263444338, 0.004188741721854306, 0.005126657879689144)
2026-05-24 14:57:08,389 - optuna.study.study - INFO - Trial 264 finished with values: [0.004940750263444338, 0.004188741721854306, 0.005126657879689144] and parameters: {'n_layers': 1, 'embedding_dim': 256, 'lr': 0.0005264581247601549, 'lambda_val': 0.02135149180590564, 'batch_size': 530, 'optimizer': 'Adam'}.
2026-05-24 14:57:55,508 - optuna.study.study - INFO - Trial 265 finished with values: [0.04518151336612718, 0.028783112582781455, 0.04161979817314232] and parameters: {'n_layers': 1, 'embedding_dim': 256, 'lr': 0.0002249192915429732, 'lambda_val': 0.000339235643209516, 'batch_size': 1989, 'optimizer': 'Adam'}.
2026-05-24 14:58:10,172 - experiment_functions - INFO - Early stopping at epoch 1250. Best Metrics: (0.06833088617844381, 0.03882450331125828, 0.05664325776156191)
2026-05-24 14:58:10,904 - optuna.study.study - INFO - Trial 266 finished with values: [0.06833088617844381, 0.03882450331125828, 0.05664325776156191] and parameters: {'n_layers': 1, 'embedding_dim': 64, 'lr': 0.0007653011157039608, 'lambda_val': 2.6431113659875313e-06, 'batch_size': 1236, 'optimizer': 'RMSprop'}.
2026-05-24 14:58:50,641 - optuna.study.study - INFO - Trial 267 finished with values: [0.014189635921714759, 0.010703642384105962, 0.014620755405372624] and parameters: {'n_layers': 1, 'embedding_dim': 32, 'lr': 0.0002249192915429732, 'lambda_val': 5.379650201376577e-05, 'batch_size': 1236, 'optimizer': 'Adam'}.
2026-05-24 14:59:31,783 - optuna.study.study - INFO - Trial 268 finished with values: [0.02337885371513561, 0.016283112582781457, 0.022531495399876818] and parameters: {'n_layers': 1, 'embedding_dim': 96, 'lr': 0.0002249192915429732, 'lambda_val': 2.6431113659875313e-06, 'batch_size': 1236, 'optimizer': 'RMSprop'}.
2026-05-24 15:00:19,762 - optuna.study.study - INFO - Trial 269 finished with values: [0.05569691883716792, 0.0339569536423841, 0.049139418464259225] and parameters: {'n_layers': 2, 'embedding_dim': 128, 'lr': 0.0002249192915429732, 'lambda_val': 1.3799856511940875e-06, 'batch_size': 1055, 'optimizer': 'RMSprop'}.
2026-05-24 15:00:29,947 - experiment_functions - INFO - Early stopping at epoch 800. Best Metrics: (0.05263160986576176, 0.03253311258278146, 0.04730229128160118)
2026-05-24 15:00:30,163 - optuna.study.study - INFO - Trial 270 finished with values: [0.05263160986576176, 0.03253311258278146, 0.04730229128160118] and parameters: {'n_layers': 2, 'embedding_dim': 128, 'lr': 0.0007653011157039608, 'lambda_val': 0.008640405687105189, 'batch_size': 1055, 'optimizer': 'Adam'}.
2026-05-24 15:00:36,161 - experiment_functions - INFO - Early stopping at epoch 500. Best Metrics: (0.005194667826791108, 0.004163907284768212, 0.0054425698161079195)
2026-05-24 15:00:36,294 - optuna.study.study - INFO - Trial 271 finished with values: [0.005194667826791108, 0.004163907284768212, 0.0054425698161079195] and parameters: {'n_layers': 2, 'embedding_dim': 64, 'lr': 1.2189853842803061e-05, 'lambda_val': 0.0009801820764399163, 'batch_size': 1408, 'optimizer': 'RMSprop'}.
2026-05-24 15:00:46,494 - experiment_functions - INFO - Early stopping at epoch 850. Best Metrics: (0.05387468803913675, 0.03336092715231788, 0.04861187166199068)
2026-05-24 15:00:47,170 - optuna.study.study - INFO - Trial 272 finished with values: [0.05387468803913675, 0.03336092715231788, 0.04861187166199068] and parameters: {'n_layers': 2, 'embedding_dim': 32, 'lr': 0.0007653011157039608, 'lambda_val': 2.6431113659875313e-06, 'batch_size': 1970, 'optimizer': 'Adam'}.
2026-05-24 15:00:54,642 - experiment_functions - INFO - Early stopping at epoch 600. Best Metrics: (0.04575616916439028, 0.029834437086092718, 0.03957814010816849)
2026-05-24 15:00:54,734 - optuna.study.study - INFO - Trial 273 finished with values: [0.04575616916439028, 0.029834437086092718, 0.03957814010816849] and parameters: {'n_layers': 2, 'embedding_dim': 64, 'lr': 0.0038886620767420786, 'lambda_val': 1.6606118736479167e-06, 'batch_size': 968, 'optimizer': 'Adam'}.
2026-05-24 15:01:03,999 - experiment_functions - INFO - Early stopping at epoch 650. Best Metrics: (0.026982710123388147, 0.019403973509933774, 0.025151838991036138)
2026-05-24 15:01:04,085 - optuna.study.study - INFO - Trial 274 finished with values: [0.026982710123388147, 0.019403973509933774, 0.025151838991036138] and parameters: {'n_layers': 4, 'embedding_dim': 128, 'lr': 0.0007653011157039608, 'lambda_val': 7.011674546086162e-05, 'batch_size': 2572, 'optimizer': 'Adam'}.
2026-05-24 15:01:16,977 - experiment_functions - INFO - Early stopping at epoch 1000. Best Metrics: (0.05416369626611456, 0.03408940397350994, 0.04900191699372778)
2026-05-24 15:01:17,059 - optuna.study.study - INFO - Trial 275 finished with values: [0.05416369626611456, 0.03408940397350994, 0.04900191699372778] and parameters: {'n_layers': 1, 'embedding_dim': 256, 'lr': 0.0007653011157039608, 'lambda_val': 1.4247463760726523e-06, 'batch_size': 1970, 'optimizer': 'Adam'}.
2026-05-24 15:01:28,058 - experiment_functions - INFO - Early stopping at epoch 850. Best Metrics: (0.052991833016942554, 0.03291390728476821, 0.047755094753759386)
2026-05-24 15:01:28,345 - optuna.study.study - INFO - Trial 276 finished with values: [0.052991833016942554, 0.03291390728476821, 0.047755094753759386] and parameters: {'n_layers': 1, 'embedding_dim': 256, 'lr': 0.0007653011157039608, 'lambda_val': 0.004404686671464818, 'batch_size': 3353, 'optimizer': 'Adam'}.
2026-05-24 15:01:34,149 - experiment_functions - INFO - Early stopping at epoch 500. Best Metrics: (0.005147641549331969, 0.004263245033112583, 0.005363919142366083)
2026-05-24 15:01:34,556 - optuna.study.study - INFO - Trial 277 finished with values: [0.005147641549331969, 0.004263245033112583, 0.005363919142366083] and parameters: {'n_layers': 1, 'embedding_dim': 96, 'lr': 0.0007653011157039608, 'lambda_val': 7.187538783101437e-06, 'batch_size': 857, 'optimizer': 'SGD'}.
2026-05-24 15:01:47,598 - experiment_functions - INFO - Early stopping at epoch 1000. Best Metrics: (0.05849927970468216, 0.034793046357615896, 0.05120045218684977)
2026-05-24 15:01:47,669 - optuna.study.study - INFO - Trial 278 finished with values: [0.05849927970468216, 0.034793046357615896, 0.05120045218684977] and parameters: {'n_layers': 2, 'embedding_dim': 64, 'lr': 0.0006563002976325864, 'lambda_val': 7.187538783101437e-06, 'batch_size': 1055, 'optimizer': 'Adam'}.
2026-05-24 15:02:00,691 - experiment_functions - INFO - Early stopping at epoch 1100. Best Metrics: (0.062250579816247924, 0.037284768211920526, 0.055353590101924914)
2026-05-24 15:02:00,772 - optuna.study.study - INFO - Trial 279 finished with values: [0.062250579816247924, 0.037284768211920526, 0.055353590101924914] and parameters: {'n_layers': 1, 'embedding_dim': 128, 'lr': 0.0007653011157039608, 'lambda_val': 0.002394815533720739, 'batch_size': 1493, 'optimizer': 'Adam'}.
2026-05-24 15:02:15,811 - experiment_functions - INFO - Early stopping at epoch 1100. Best Metrics: (0.05684716032092844, 0.03561258278145695, 0.05110764333074909)
2026-05-24 15:02:15,914 - optuna.study.study - INFO - Trial 280 finished with values: [0.05684716032092844, 0.03561258278145695, 0.05110764333074909] and parameters: {'n_layers': 1, 'embedding_dim': 128, 'lr': 0.0007653011157039608, 'lambda_val': 0.0007701916075392747, 'batch_size': 1633, 'optimizer': 'Adam'}.
2026-05-24 15:02:26,839 - experiment_functions - INFO - Early stopping at epoch 850. Best Metrics: (0.05282661985455396, 0.03202814569536424, 0.0465657205784884)
2026-05-24 15:02:26,916 - optuna.study.study - INFO - Trial 281 finished with values: [0.05282661985455396, 0.03202814569536424, 0.0465657205784884] and parameters: {'n_layers': 2, 'embedding_dim': 128, 'lr': 0.0007653011157039608, 'lambda_val': 7.187538783101437e-06, 'batch_size': 1055, 'optimizer': 'Adam'}.
2026-05-24 15:02:37,824 - experiment_functions - INFO - Early stopping at epoch 900. Best Metrics: (0.055250305484188474, 0.033725165562913904, 0.048810267236103294)
