2026-05-24 02:08:44,622 - optuna.study.study - INFO - Trial 192 finished with values: [0.008538575335230223, 0.006812913907284768, 0.008663374736768042] and parameters: {'n_layers': 3, 'embedding_dim': 64, 'lr': 0.05511129184642489, 'lambda_val': 0.0007474419200611069, 'batch_size': 3717, 'optimizer': 'RMSprop'}.
2026-05-24 02:09:26,642 - optuna.study.study - INFO - Trial 193 finished with values: [0.020373327782683623, 0.01599337748344371, 0.021582690652229036] and parameters: {'n_layers': 3, 'embedding_dim': 64, 'lr': 0.0001986105443631555, 'lambda_val': 0.005694292664597612, 'batch_size': 1343, 'optimizer': 'Adam'}.
2026-05-24 02:09:34,088 - experiment_functions - INFO - Early stopping at epoch 600. Best Metrics: (0.016497461426030986, 0.012624172185430464, 0.017085375350399872)
2026-05-24 02:09:34,979 - optuna.study.study - INFO - Trial 194 finished with values: [0.016497461426030986, 0.012624172185430464, 0.017085375350399872] and parameters: {'n_layers': 2, 'embedding_dim': 64, 'lr': 0.003175767497275054, 'lambda_val': 3.968354235124371e-06, 'batch_size': 3458, 'optimizer': 'Adam'}.
2026-05-24 02:10:17,696 - optuna.study.study - INFO - Trial 195 finished with values: [0.017010685723654377, 0.013468543046357615, 0.01795405989880632] and parameters: {'n_layers': 3, 'embedding_dim': 96, 'lr': 0.0001986105443631555, 'lambda_val': 1.1540981830430722e-05, 'batch_size': 3238, 'optimizer': 'RMSprop'}.
2026-05-24 02:10:30,241 - experiment_functions - INFO - Early stopping at epoch 1050. Best Metrics: (0.017477144476505283, 0.013228476821192055, 0.018064122007446164)
2026-05-24 02:10:30,327 - optuna.study.study - INFO - Trial 196 finished with values: [0.017477144476505283, 0.013228476821192055, 0.018064122007446164] and parameters: {'n_layers': 2, 'embedding_dim': 128, 'lr': 0.0006783254829467676, 'lambda_val': 1.1741946550104087e-06, 'batch_size': 1343, 'optimizer': 'Adam'}.
2026-05-24 02:10:37,539 - experiment_functions - INFO - Early stopping at epoch 550. Best Metrics: (0.017872880163943675, 0.015124172185430464, 0.019781109944052872)
2026-05-24 02:10:37,636 - optuna.study.study - INFO - Trial 197 finished with values: [0.017872880163943675, 0.015124172185430464, 0.019781109944052872] and parameters: {'n_layers': 4, 'embedding_dim': 64, 'lr': 0.0019780306615905445, 'lambda_val': 0.00046616387875468264, 'batch_size': 2269, 'optimizer': 'RMSprop'}.
2026-05-24 02:10:56,976 - experiment_functions - INFO - Early stopping at epoch 1750. Best Metrics: (0.019133086963744137, 0.013551324503311257, 0.0193425453708619)
2026-05-24 02:10:57,967 - optuna.study.study - INFO - Trial 198 finished with values: [0.019133086963744137, 0.013551324503311257, 0.0193425453708619] and parameters: {'n_layers': 1, 'embedding_dim': 32, 'lr': 0.0004026770930500792, 'lambda_val': 0.00010466579371271554, 'batch_size': 3034, 'optimizer': 'RMSprop'}.
2026-05-24 02:11:08,159 - experiment_functions - INFO - Early stopping at epoch 850. Best Metrics: (0.02094402893878045, 0.016605960264900663, 0.022278386977922393)
2026-05-24 02:11:08,388 - optuna.study.study - INFO - Trial 199 finished with values: [0.02094402893878045, 0.016605960264900663, 0.022278386977922393] and parameters: {'n_layers': 4, 'embedding_dim': 96, 'lr': 0.0005233015481570266, 'lambda_val': 0.0009443756499535536, 'batch_size': 1772, 'optimizer': 'Adam'}.
2026-05-24 02:11:49,420 - optuna.study.study - INFO - Trial 200 finished with values: [0.006337855748752899, 0.005107615894039736, 0.006890685660609433] and parameters: {'n_layers': 4, 'embedding_dim': 64, 'lr': 3.668129670569576e-05, 'lambda_val': 0.0018342132495212666, 'batch_size': 567, 'optimizer': 'Adam'}.
2026-05-24 02:12:08,662 - experiment_functions - INFO - Early stopping at epoch 1350. Best Metrics: (0.022242414317583586, 0.016754966887417216, 0.022505548392698863)
2026-05-24 02:12:09,366 - optuna.study.study - INFO - Trial 201 finished with values: [0.022242414317583586, 0.016754966887417216, 0.022505548392698863] and parameters: {'n_layers': 3, 'embedding_dim': 96, 'lr': 0.0005233015481570266, 'lambda_val': 1.858625399381744e-05, 'batch_size': 652, 'optimizer': 'Adam'}.
2026-05-24 02:12:22,998 - experiment_functions - INFO - Early stopping at epoch 1150. Best Metrics: (0.021390975769919864, 0.01751655629139073, 0.022872765628877786)
2026-05-24 02:12:23,097 - optuna.study.study - INFO - Trial 202 finished with values: [0.021390975769919864, 0.01751655629139073, 0.022872765628877786] and parameters: {'n_layers': 4, 'embedding_dim': 128, 'lr': 0.0005233015481570266, 'lambda_val': 0.0009443756499535536, 'batch_size': 652, 'optimizer': 'Adam'}.
2026-05-24 02:12:30,091 - experiment_functions - INFO - Early stopping at epoch 550. Best Metrics: (0.019577548591616988, 0.015447019867549669, 0.020036090220076994)
2026-05-24 02:12:30,177 - optuna.study.study - INFO - Trial 203 finished with values: [0.019577548591616988, 0.015447019867549669, 0.020036090220076994] and parameters: {'n_layers': 4, 'embedding_dim': 64, 'lr': 0.003175767497275054, 'lambda_val': 0.0009443756499535536, 'batch_size': 664, 'optimizer': 'RMSprop'}.
2026-05-24 02:12:38,846 - experiment_functions - INFO - Early stopping at epoch 700. Best Metrics: (0.021930234537685587, 0.018509933774834435, 0.0241924779498723)
2026-05-24 02:12:38,945 - optuna.study.study - INFO - Trial 204 finished with values: [0.021930234537685587, 0.018509933774834435, 0.0241924779498723] and parameters: {'n_layers': 4, 'embedding_dim': 96, 'lr': 0.0007459913147507348, 'lambda_val': 0.004825444205218699, 'batch_size': 652, 'optimizer': 'RMSprop'}.
2026-05-24 02:12:48,470 - experiment_functions - INFO - Early stopping at epoch 800. Best Metrics: (0.02405747311249316, 0.017061258278145697, 0.024138043176040444)
2026-05-24 02:12:49,190 - optuna.study.study - INFO - Trial 205 finished with values: [0.02405747311249316, 0.017061258278145697, 0.024138043176040444] and parameters: {'n_layers': 3, 'embedding_dim': 64, 'lr': 0.001254073391314583, 'lambda_val': 0.0009443756499535536, 'batch_size': 652, 'optimizer': 'Adam'}.
2026-05-24 02:12:56,396 - experiment_functions - INFO - Early stopping at epoch 600. Best Metrics: (0.022550468490452412, 0.017235099337748343, 0.022594610694456778)
2026-05-24 02:12:57,276 - optuna.study.study - INFO - Trial 206 finished with values: [0.022550468490452412, 0.017235099337748343, 0.022594610694456778] and parameters: {'n_layers': 4, 'embedding_dim': 64, 'lr': 0.003175767497275054, 'lambda_val': 1.1741946550104087e-06, 'batch_size': 567, 'optimizer': 'Adam'}.
2026-05-24 02:13:18,737 - experiment_functions - INFO - Early stopping at epoch 1950. Best Metrics: (0.023403428015916095, 0.018228476821192052, 0.02451822666883576)
2026-05-24 02:13:18,908 - optuna.study.study - INFO - Trial 207 finished with values: [0.023403428015916095, 0.018228476821192052, 0.02451822666883576] and parameters: {'n_layers': 3, 'embedding_dim': 64, 'lr': 0.0005233015481570266, 'lambda_val': 0.0009443756499535536, 'batch_size': 664, 'optimizer': 'Adam'}.
2026-05-24 02:13:25,243 - experiment_functions - INFO - Early stopping at epoch 500. Best Metrics: (0.010826753880989779, 0.007632450331125829, 0.010354178324390834)
2026-05-24 02:13:25,874 - optuna.study.study - INFO - Trial 208 finished with values: [0.010826753880989779, 0.007632450331125829, 0.010354178324390834] and parameters: {'n_layers': 4, 'embedding_dim': 96, 'lr': 0.044632450196419884, 'lambda_val': 1.6235764756559573e-06, 'batch_size': 652, 'optimizer': 'RMSprop'}.
2026-05-24 02:13:35,785 - experiment_functions - INFO - Early stopping at epoch 800. Best Metrics: (0.017817052304178783, 0.014478476821192054, 0.018822243491324196)
2026-05-24 02:13:36,598 - optuna.study.study - INFO - Trial 209 finished with values: [0.017817052304178783, 0.014478476821192054, 0.018822243491324196] and parameters: {'n_layers': 4, 'embedding_dim': 96, 'lr': 0.0005233015481570266, 'lambda_val': 1.8497624196468907e-06, 'batch_size': 3926, 'optimizer': 'RMSprop'}.
2026-05-24 02:14:17,707 - optuna.study.study - INFO - Trial 210 finished with values: [0.01459056152450039, 0.010438741721854305, 0.014689146645688227] and parameters: {'n_layers': 1, 'embedding_dim': 32, 'lr': 0.00013009973989407732, 'lambda_val': 0.00010466579371271554, 'batch_size': 3649, 'optimizer': 'RMSprop'}.
2026-05-24 02:14:31,021 - experiment_functions - INFO - Early stopping at epoch 1150. Best Metrics: (0.02332067900303063, 0.01817880794701987, 0.02466284223969159)
2026-05-24 02:14:31,122 - optuna.study.study - INFO - Trial 211 finished with values: [0.02332067900303063, 0.01817880794701987, 0.02466284223969159] and parameters: {'n_layers': 4, 'embedding_dim': 96, 'lr': 0.0005233015481570266, 'lambda_val': 4.5116613809437874e-06, 'batch_size': 652, 'optimizer': 'Adam'}.
2026-05-24 02:14:52,858 - experiment_functions - INFO - Early stopping at epoch 2000. Best Metrics: (0.02194043871527163, 0.016614238410596026, 0.02251042066906169)
2026-05-24 02:14:53,318 - optuna.study.study - INFO - Trial 212 finished with values: [0.02194043871527163, 0.016614238410596026, 0.02251042066906169] and parameters: {'n_layers': 3, 'embedding_dim': 96, 'lr': 0.0004763946365214482, 'lambda_val': 1.858625399381744e-05, 'batch_size': 652, 'optimizer': 'Adam'}.
2026-05-24 02:15:00,553 - experiment_functions - INFO - Early stopping at epoch 550. Best Metrics: (0.017206098898369646, 0.014751655629139075, 0.01823831932328477)
2026-05-24 02:15:00,686 - optuna.study.study - INFO - Trial 213 finished with values: [0.017206098898369646, 0.014751655629139075, 0.01823831932328477] and parameters: {'n_layers': 4, 'embedding_dim': 96, 'lr': 0.0019780306615905445, 'lambda_val': 0.005694292664597612, 'batch_size': 1343, 'optimizer': 'RMSprop'}.
2026-05-24 02:15:07,277 - experiment_functions - INFO - Early stopping at epoch 500. Best Metrics: (0.005576502151813147, 0.004552980132450331, 0.005691995290298118)
2026-05-24 02:15:07,789 - optuna.study.study - INFO - Trial 214 finished with values: [0.005576502151813147, 0.004552980132450331, 0.005691995290298118] and parameters: {'n_layers': 3, 'embedding_dim': 64, 'lr': 0.0005233015481570266, 'lambda_val': 9.206863327207947e-05, 'batch_size': 911, 'optimizer': 'SGD'}.
2026-05-24 02:15:27,196 - experiment_functions - INFO - Early stopping at epoch 1900. Best Metrics: (0.005543269174105212, 0.004528145695364238, 0.005645041293993599)
2026-05-24 02:15:27,418 - optuna.study.study - INFO - Trial 215 finished with values: [0.005543269174105212, 0.004528145695364238, 0.005645041293993599] and parameters: {'n_layers': 2, 'embedding_dim': 64, 'lr': 1.4968832552084188e-05, 'lambda_val': 1.1741946550104087e-06, 'batch_size': 1661, 'optimizer': 'Adam'}.
2026-05-24 02:15:39,197 - experiment_functions - INFO - Early stopping at epoch 1000. Best Metrics: (0.02148757937066523, 0.017375827814569537, 0.02301053795329436)
2026-05-24 02:15:39,940 - optuna.study.study - INFO - Trial 216 finished with values: [0.02148757937066523, 0.017375827814569537, 0.02301053795329436] and parameters: {'n_layers': 4, 'embedding_dim': 64, 'lr': 0.0005233015481570266, 'lambda_val': 0.003592565815384345, 'batch_size': 1343, 'optimizer': 'Adam'}.
2026-05-24 02:15:50,619 - experiment_functions - INFO - Early stopping at epoch 900. Best Metrics: (0.021282172510222123, 0.01704470198675497, 0.022788849611488228)
2026-05-24 02:15:50,746 - optuna.study.study - INFO - Trial 217 finished with values: [0.021282172510222123, 0.01704470198675497, 0.022788849611488228] and parameters: {'n_layers': 4, 'embedding_dim': 96, 'lr': 0.0005233015481570266, 'lambda_val': 0.005694292664597612, 'batch_size': 1343, 'optimizer': 'Adam'}.
2026-05-24 02:15:59,549 - experiment_functions - INFO - Early stopping at epoch 550. Best Metrics: (0.017909752671955534, 0.012293046357615894, 0.017466604288676954)
2026-05-24 02:15:59,671 - optuna.study.study - INFO - Trial 218 finished with values: [0.017909752671955534, 0.012293046357615894, 0.017466604288676954] and parameters: {'n_layers': 1, 'embedding_dim': 96, 'lr': 0.006182125627780629, 'lambda_val': 1.1741946550104087e-06, 'batch_size': 1343, 'optimizer': 'Adam'}.
2026-05-24 02:16:08,799 - experiment_functions - INFO - Early stopping at epoch 750. Best Metrics: (0.020345038625600047, 0.01617549668874172, 0.021077098953976442)
2026-05-24 02:16:10,097 - optuna.study.study - INFO - Trial 219 finished with values: [0.020345038625600047, 0.01617549668874172, 0.021077098953976442] and parameters: {'n_layers': 4, 'embedding_dim': 96, 'lr': 0.0006783254829467676, 'lambda_val': 1.1741946550104087e-06, 'batch_size': 1661, 'optimizer': 'RMSprop'}.
2026-05-24 02:16:20,489 - experiment_functions - INFO - Early stopping at epoch 900. Best Metrics: (0.019097802959031497, 0.015264900662251656, 0.019340009025318603)
2026-05-24 02:16:20,722 - optuna.study.study - INFO - Trial 220 finished with values: [0.019097802959031497, 0.015264900662251656, 0.019340009025318603] and parameters: {'n_layers': 4, 'embedding_dim': 96, 'lr': 0.0005233015481570266, 'lambda_val': 0.0007474419200611069, 'batch_size': 1854, 'optimizer': 'Adam'}.
2026-05-24 02:16:29,819 - experiment_functions - INFO - Early stopping at epoch 800. Best Metrics: (0.018287958316279416, 0.015248344370860926, 0.019581333546430362)
2026-05-24 02:16:29,905 - optuna.study.study - INFO - Trial 221 finished with values: [0.018287958316279416, 0.015248344370860926, 0.019581333546430362] and parameters: {'n_layers': 4, 'embedding_dim': 96, 'lr': 0.0005233015481570266, 'lambda_val': 0.0009443756499535536, 'batch_size': 1772, 'optimizer': 'RMSprop'}.
2026-05-24 02:16:37,211 - experiment_functions - INFO - Early stopping at epoch 600. Best Metrics: (0.024106490865639946, 0.018485099337748345, 0.02487421633864276)
2026-05-24 02:16:37,451 - optuna.study.study - INFO - Trial 222 finished with values: [0.024106490865639946, 0.018485099337748345, 0.02487421633864276] and parameters: {'n_layers': 4, 'embedding_dim': 64, 'lr': 0.003175767497275054, 'lambda_val': 0.003592565815384345, 'batch_size': 567, 'optimizer': 'Adam'}.
2026-05-24 02:17:18,385 - optuna.study.study - INFO - Trial 223 finished with values: [0.021141021673904515, 0.014321192052980132, 0.021327862679871898] and parameters: {'n_layers': 1, 'embedding_dim': 32, 'lr': 0.00035899557766397706, 'lambda_val': 0.0009443756499535536, 'batch_size': 1393, 'optimizer': 'Adam'}.
2026-05-24 02:17:38,259 - experiment_functions - INFO - Early stopping at epoch 1850. Best Metrics: (0.02275406161584007, 0.016241721854304638, 0.02333748886471991)
2026-05-24 02:17:39,242 - optuna.study.study - INFO - Trial 224 finished with values: [0.02275406161584007, 0.016241721854304638, 0.02333748886471991] and parameters: {'n_layers': 1, 'embedding_dim': 32, 'lr': 0.0007459913147507348, 'lambda_val': 0.004825444205218699, 'batch_size': 652, 'optimizer': 'RMSprop'}.
2026-05-24 02:17:45,789 - experiment_functions - INFO - Early stopping at epoch 550. Best Metrics: (0.018930699415212172, 0.014230132450331124, 0.0198028471914465)
2026-05-24 02:17:45,869 - optuna.study.study - INFO - Trial 225 finished with values: [0.018930699415212172, 0.014230132450331124, 0.0198028471914465] and parameters: {'n_layers': 3, 'embedding_dim': 64, 'lr': 0.006950976730906385, 'lambda_val': 1.1741946550104087e-06, 'batch_size': 847, 'optimizer': 'Adam'}.
2026-05-24 02:18:06,402 - experiment_functions - INFO - Early stopping at epoch 1850. Best Metrics: (0.026368157743880245, 0.020082781456953646, 0.02642592032327439)
2026-05-24 02:18:06,504 - optuna.study.study - INFO - Trial 226 finished with values: [0.026368157743880245, 0.020082781456953646, 0.02642592032327439] and parameters: {'n_layers': 4, 'embedding_dim': 32, 'lr': 0.0005233015481570266, 'lambda_val': 2.582067375745636e-06, 'batch_size': 652, 'optimizer': 'RMSprop'}.
2026-05-24 02:18:15,835 - experiment_functions - INFO - Early stopping at epoch 800. Best Metrics: (0.01930054206683061, 0.015653973509933777, 0.02022552493049115)
2026-05-24 02:18:15,969 - optuna.study.study - INFO - Trial 227 finished with values: [0.01930054206683061, 0.015653973509933777, 0.02022552493049115] and parameters: {'n_layers': 4, 'embedding_dim': 96, 'lr': 0.0006783254829467676, 'lambda_val': 9.206863327207947e-05, 'batch_size': 1661, 'optimizer': 'Adam'}.
2026-05-24 02:18:27,496 - experiment_functions - INFO - Early stopping at epoch 1000. Best Metrics: (0.016125929754463014, 0.013816225165562914, 0.01778438920695358)
2026-05-24 02:18:27,687 - optuna.study.study - INFO - Trial 228 finished with values: [0.016125929754463014, 0.013816225165562914, 0.01778438920695358] and parameters: {'n_layers': 3, 'embedding_dim': 128, 'lr': 0.0004618030795087815, 'lambda_val': 0.01082901004055631, 'batch_size': 2154, 'optimizer': 'Adam'}.
2026-05-24 02:18:35,632 - experiment_functions - INFO - Early stopping at epoch 650. Best Metrics: (0.01829862810572655, 0.014726821192052979, 0.01916703315980337)
2026-05-24 02:18:35,753 - optuna.study.study - INFO - Trial 229 finished with values: [0.01829862810572655, 0.014726821192052979, 0.01916703315980337] and parameters: {'n_layers': 3, 'embedding_dim': 96, 'lr': 0.0030673346219172084, 'lambda_val': 0.0009443756499535536, 'batch_size': 652, 'optimizer': 'Adam'}.
2026-05-24 02:18:43,914 - experiment_functions - INFO - Early stopping at epoch 650. Best Metrics: (0.02368011919656966, 0.018468543046357616, 0.024767339950621376)
2026-05-24 02:18:43,980 - optuna.study.study - INFO - Trial 230 finished with values: [0.02368011919656966, 0.018468543046357616, 0.024767339950621376] and parameters: {'n_layers': 4, 'embedding_dim': 64, 'lr': 0.001254073391314583, 'lambda_val': 1.1741946550104087e-06, 'batch_size': 652, 'optimizer': 'RMSprop'}.
2026-05-24 02:19:23,145 - experiment_functions - INFO - Early stopping at epoch 3500. Best Metrics: (0.018875326976693384, 0.015894039735099338, 0.019968718175225074)
2026-05-24 02:19:23,234 - optuna.study.study - INFO - Trial 231 finished with values: [0.018875326976693384, 0.015894039735099338, 0.019968718175225074] and parameters: {'n_layers': 4, 'embedding_dim': 96, 'lr': 0.00018479274703767, 'lambda_val': 0.005694292664597612, 'batch_size': 2528, 'optimizer': 'RMSprop'}.
2026-05-24 02:19:38,324 - experiment_functions - INFO - Early stopping at epoch 1400. Best Metrics: (0.019116692577558925, 0.01470198675496689, 0.020107997225914522)
2026-05-24 02:19:38,402 - optuna.study.study - INFO - Trial 232 finished with values: [0.019116692577558925, 0.01470198675496689, 0.020107997225914522] and parameters: {'n_layers': 2, 'embedding_dim': 96, 'lr': 0.0005233015481570266, 'lambda_val': 1.858625399381744e-05, 'batch_size': 1343, 'optimizer': 'RMSprop'}.
2026-05-24 02:19:57,312 - experiment_functions - INFO - Early stopping at epoch 1700. Best Metrics: (0.020304402126048875, 0.016713576158940396, 0.021880342585449224)
2026-05-24 02:19:57,907 - optuna.study.study - INFO - Trial 233 finished with values: [0.020304402126048875, 0.016713576158940396, 0.021880342585449224] and parameters: {'n_layers': 4, 'embedding_dim': 96, 'lr': 0.00035899557766397706, 'lambda_val': 1.1741946550104087e-06, 'batch_size': 847, 'optimizer': 'Adam'}.
2026-05-24 02:20:19,249 - experiment_functions - INFO - Early stopping at epoch 2000. Best Metrics: (0.02039427031990245, 0.01517384105960265, 0.021111801578769532)
2026-05-24 02:20:19,558 - optuna.study.study - INFO - Trial 234 finished with values: [0.02039427031990245, 0.01517384105960265, 0.021111801578769532] and parameters: {'n_layers': 2, 'embedding_dim': 96, 'lr': 0.0005233015481570266, 'lambda_val': 0.0009443756499535536, 'batch_size': 664, 'optimizer': 'RMSprop'}.
2026-05-24 02:20:31,992 - experiment_functions - INFO - Early stopping at epoch 1050. Best Metrics: (0.024837130908611414, 0.019288079470198675, 0.025649787925963913)
2026-05-24 02:20:32,073 - optuna.study.study - INFO - Trial 235 finished with values: [0.024837130908611414, 0.019288079470198675, 0.025649787925963913] and parameters: {'n_layers': 4, 'embedding_dim': 96, 'lr': 0.0005233015481570266, 'lambda_val': 9.206863327207947e-05, 'batch_size': 652, 'optimizer': 'RMSprop'}.
2026-05-24 02:20:43,806 - experiment_functions - INFO - Early stopping at epoch 1000. Best Metrics: (0.02398599915054216, 0.018493377483443707, 0.024433252915903432)
2026-05-24 02:20:44,479 - optuna.study.study - INFO - Trial 236 finished with values: [0.02398599915054216, 0.018493377483443707, 0.024433252915903432] and parameters: {'n_layers': 4, 'embedding_dim': 96, 'lr': 0.0005233015481570266, 'lambda_val': 0.00010466579371271554, 'batch_size': 652, 'optimizer': 'RMSprop'}.
2026-05-24 02:20:57,668 - experiment_functions - INFO - Early stopping at epoch 1200. Best Metrics: (0.025014642413611243, 0.01908112582781457, 0.02589829846558084)
2026-05-24 02:20:57,798 - optuna.study.study - INFO - Trial 237 finished with values: [0.025014642413611243, 0.01908112582781457, 0.02589829846558084] and parameters: {'n_layers': 4, 'embedding_dim': 64, 'lr': 0.0005233015481570266, 'lambda_val': 1.1741946550104087e-06, 'batch_size': 652, 'optimizer': 'Adam'}.
2026-05-24 02:21:20,339 - experiment_functions - INFO - Early stopping at epoch 2250. Best Metrics: (0.019755331303985182, 0.015049668874172186, 0.020043769194636137)
2026-05-24 02:21:20,429 - optuna.study.study - INFO - Trial 238 finished with values: [0.019755331303985182, 0.015049668874172186, 0.020043769194636137] and parameters: {'n_layers': 2, 'embedding_dim': 96, 'lr': 0.0003847621589190308, 'lambda_val': 0.0003756946708567361, 'batch_size': 1343, 'optimizer': 'RMSprop'}.
2026-05-24 02:21:34,229 - experiment_functions - INFO - Early stopping at epoch 1300. Best Metrics: (0.02332092596942044, 0.01765728476821192, 0.024073895171856288)
