2026-05-24 09:50:01,236 - optuna.study.study - INFO - Trial 44 finished with values: [0.024844178211120796, 0.014908940397350995, 0.0215499893237867] and parameters: {'n_layers': 3, 'embedding_dim': 96, 'lr': 0.011699032315035515, 'lambda_val': 0.0003170478185858394, 'batch_size': 2546, 'optimizer': 'Adam'}.
2026-05-24 09:50:08,313 - experiment_functions - INFO - Early stopping at epoch 500. Best Metrics: (0.005462717760859775, 0.004403973509933775, 0.0055792047790346345)
2026-05-24 09:50:08,413 - optuna.study.study - INFO - Trial 45 finished with values: [0.005462717760859775, 0.004403973509933775, 0.0055792047790346345] and parameters: {'n_layers': 3, 'embedding_dim': 128, 'lr': 0.0016447639601767392, 'lambda_val': 0.00010893563578127668, 'batch_size': 1554, 'optimizer': 'SGD'}.
2026-05-24 09:50:15,000 - experiment_functions - INFO - Early stopping at epoch 500. Best Metrics: (0.004638356823150459, 0.00402317880794702, 0.00514279415398157)
2026-05-24 09:50:15,972 - optuna.study.study - INFO - Trial 46 finished with values: [0.004638356823150459, 0.00402317880794702, 0.00514279415398157] and parameters: {'n_layers': 1, 'embedding_dim': 128, 'lr': 4.87306443640302e-05, 'lambda_val': 0.03230874982277815, 'batch_size': 1976, 'optimizer': 'SGD'}.
2026-05-24 09:50:25,535 - experiment_functions - INFO - Early stopping at epoch 750. Best Metrics: (0.018868811882287635, 0.013923841059602649, 0.018551515126168334)
2026-05-24 09:50:25,863 - optuna.study.study - INFO - Trial 47 finished with values: [0.018868811882287635, 0.013923841059602649, 0.018551515126168334] and parameters: {'n_layers': 1, 'embedding_dim': 32, 'lr': 0.018571577973460266, 'lambda_val': 6.005415185221812e-05, 'batch_size': 4057, 'optimizer': 'RMSprop'}.
2026-05-24 09:50:41,069 - experiment_functions - INFO - Early stopping at epoch 1150. Best Metrics: (0.02379101878627914, 0.01616721854304636, 0.022417775691253927)
2026-05-24 09:50:41,687 - optuna.study.study - INFO - Trial 48 finished with values: [0.02379101878627914, 0.01616721854304636, 0.022417775691253927] and parameters: {'n_layers': 3, 'embedding_dim': 96, 'lr': 0.013140975437396974, 'lambda_val': 0.00038449950728469576, 'batch_size': 1213, 'optimizer': 'RMSprop'}.
2026-05-24 09:50:49,111 - experiment_functions - INFO - Early stopping at epoch 500. Best Metrics: (0.005104807608398768, 0.004346026490066225, 0.005500886135122365)
2026-05-24 09:50:49,213 - optuna.study.study - INFO - Trial 49 finished with values: [0.005104807608398768, 0.004346026490066225, 0.005500886135122365] and parameters: {'n_layers': 2, 'embedding_dim': 256, 'lr': 0.012623755921898306, 'lambda_val': 5.9906534541021376e-05, 'batch_size': 1797, 'optimizer': 'SGD'}.
2026-05-24 09:51:54,220 - optuna.study.study - INFO - Trial 50 finished with values: [0.025900021452733752, 0.01472682119205298, 0.022076407762204334] and parameters: {'n_layers': 4, 'embedding_dim': 256, 'lr': 0.003011889027190141, 'lambda_val': 6.700238629685478e-06, 'batch_size': 2742, 'optimizer': 'RMSprop'}.
2026-05-24 09:52:00,688 - experiment_functions - INFO - Early stopping at epoch 500. Best Metrics: (0.00488678071716742, 0.0040149006622516555, 0.004941895446186579)
2026-05-24 09:52:02,068 - optuna.study.study - INFO - Trial 51 finished with values: [0.00488678071716742, 0.0040149006622516555, 0.004941895446186579] and parameters: {'n_layers': 1, 'embedding_dim': 128, 'lr': 0.007811045968786406, 'lambda_val': 4.336462830610492e-06, 'batch_size': 1264, 'optimizer': 'SGD'}.
2026-05-24 09:52:10,876 - experiment_functions - INFO - Early stopping at epoch 650. Best Metrics: (0.057285701945298056, 0.03524006622516556, 0.05045577805955052)
2026-05-24 09:52:11,276 - optuna.study.study - INFO - Trial 52 finished with values: [0.057285701945298056, 0.03524006622516556, 0.05045577805955052] and parameters: {'n_layers': 1, 'embedding_dim': 32, 'lr': 0.001667262481946792, 'lambda_val': 5.797866699774695e-06, 'batch_size': 1467, 'optimizer': 'RMSprop'}.
2026-05-24 09:52:18,568 - experiment_functions - INFO - Early stopping at epoch 550. Best Metrics: (0.01186155956542538, 0.010869205298013246, 0.012567782216623864)
2026-05-24 09:52:18,658 - optuna.study.study - INFO - Trial 53 finished with values: [0.01186155956542538, 0.010869205298013246, 0.012567782216623864] and parameters: {'n_layers': 4, 'embedding_dim': 32, 'lr': 0.003011889027190141, 'lambda_val': 0.0009904374338936715, 'batch_size': 1623, 'optimizer': 'RMSprop'}.
2026-05-24 09:52:26,730 - experiment_functions - INFO - Early stopping at epoch 600. Best Metrics: (0.00526936741232622, 0.004254966887417219, 0.005278600025287767)
2026-05-24 09:52:26,823 - optuna.study.study - INFO - Trial 54 finished with values: [0.00526936741232622, 0.004254966887417219, 0.005278600025287767] and parameters: {'n_layers': 3, 'embedding_dim': 64, 'lr': 0.020974389902177336, 'lambda_val': 0.06666595456683828, 'batch_size': 2608, 'optimizer': 'SGD'}.
2026-05-24 09:52:33,841 - experiment_functions - INFO - Early stopping at epoch 500. Best Metrics: (0.005861260158242631, 0.004453642384105961, 0.005608414712719503)
2026-05-24 09:52:33,944 - optuna.study.study - INFO - Trial 55 finished with values: [0.005861260158242631, 0.004453642384105961, 0.005608414712719503] and parameters: {'n_layers': 3, 'embedding_dim': 128, 'lr': 5.71049234353412e-05, 'lambda_val': 0.0003170478185858394, 'batch_size': 1554, 'optimizer': 'SGD'}.
2026-05-24 09:53:16,396 - optuna.study.study - INFO - Trial 56 finished with values: [0.005950554703970384, 0.004701986754966888, 0.006214104337612316] and parameters: {'n_layers': 1, 'embedding_dim': 64, 'lr': 7.099389116280238e-05, 'lambda_val': 6.005415185221812e-05, 'batch_size': 990, 'optimizer': 'RMSprop'}.
2026-05-24 09:53:32,928 - experiment_functions - INFO - Early stopping at epoch 1400. Best Metrics: (0.013173668783918192, 0.011341059602649006, 0.013753187484142362)
2026-05-24 09:53:33,027 - optuna.study.study - INFO - Trial 57 finished with values: [0.013173668783918192, 0.011341059602649006, 0.013753187484142362] and parameters: {'n_layers': 1, 'embedding_dim': 128, 'lr': 0.025074765444195745, 'lambda_val': 0.00038449950728469576, 'batch_size': 1213, 'optimizer': 'RMSprop'}.
2026-05-24 09:53:42,205 - experiment_functions - INFO - Early stopping at epoch 600. Best Metrics: (0.03375601298772572, 0.022831125827814564, 0.03173845082917568)
2026-05-24 09:53:42,397 - optuna.study.study - INFO - Trial 58 finished with values: [0.03375601298772572, 0.022831125827814564, 0.03173845082917568] and parameters: {'n_layers': 4, 'embedding_dim': 128, 'lr': 0.001052146534164983, 'lambda_val': 2.791930910853256e-06, 'batch_size': 3139, 'optimizer': 'Adam'}.
2026-05-24 09:54:10,972 - experiment_functions - INFO - Early stopping at epoch 2050. Best Metrics: (0.026884500617491716, 0.018427152317880793, 0.025612898309414493)
2026-05-24 09:54:11,072 - optuna.study.study - INFO - Trial 59 finished with values: [0.026884500617491716, 0.018427152317880793, 0.025612898309414493] and parameters: {'n_layers': 2, 'embedding_dim': 256, 'lr': 0.012623755921898306, 'lambda_val': 0.0015545326916399916, 'batch_size': 1797, 'optimizer': 'RMSprop'}.
2026-05-24 09:54:18,395 - experiment_functions - INFO - Early stopping at epoch 550. Best Metrics: (0.03853073404026968, 0.02495860927152318, 0.036535158718119944)
2026-05-24 09:54:18,873 - optuna.study.study - INFO - Trial 60 finished with values: [0.03853073404026968, 0.02495860927152318, 0.036535158718119944] and parameters: {'n_layers': 3, 'embedding_dim': 32, 'lr': 0.00660067706198712, 'lambda_val': 0.00325865136231477, 'batch_size': 1431, 'optimizer': 'Adam'}.
2026-05-24 09:54:27,018 - experiment_functions - INFO - Early stopping at epoch 650. Best Metrics: (0.005944755235151054, 0.004710264900662252, 0.006103508750954825)
2026-05-24 09:54:27,116 - optuna.study.study - INFO - Trial 61 finished with values: [0.005944755235151054, 0.004710264900662252, 0.006103508750954825] and parameters: {'n_layers': 2, 'embedding_dim': 32, 'lr': 0.0559417521693863, 'lambda_val': 4.8599912504671415e-06, 'batch_size': 2436, 'optimizer': 'SGD'}.
2026-05-24 09:54:46,530 - experiment_functions - INFO - Early stopping at epoch 1400. Best Metrics: (0.031354198512625255, 0.022417218543046357, 0.029702636904843312)
2026-05-24 09:54:47,417 - optuna.study.study - INFO - Trial 62 finished with values: [0.031354198512625255, 0.022417218543046357, 0.029702636904843312] and parameters: {'n_layers': 4, 'embedding_dim': 96, 'lr': 0.0002008346621954922, 'lambda_val': 6.700238629685478e-06, 'batch_size': 2742, 'optimizer': 'RMSprop'}.
2026-05-24 09:54:54,118 - experiment_functions - INFO - Early stopping at epoch 500. Best Metrics: (0.0054197689261358106, 0.004089403973509934, 0.005476361282576154)
2026-05-24 09:54:54,599 - optuna.study.study - INFO - Trial 63 finished with values: [0.0054197689261358106, 0.004089403973509934, 0.005476361282576154] and parameters: {'n_layers': 3, 'embedding_dim': 64, 'lr': 0.0016447639601767392, 'lambda_val': 0.00010893563578127668, 'batch_size': 2608, 'optimizer': 'SGD'}.
2026-05-24 09:55:21,548 - experiment_functions - INFO - Early stopping at epoch 2100. Best Metrics: (0.03147662275144455, 0.018774834437086094, 0.026929524730873688)
2026-05-24 09:55:21,634 - optuna.study.study - INFO - Trial 64 finished with values: [0.03147662275144455, 0.018774834437086094, 0.026929524730873688] and parameters: {'n_layers': 2, 'embedding_dim': 128, 'lr': 0.004028743321822881, 'lambda_val': 1.9563512568026275e-06, 'batch_size': 2901, 'optimizer': 'RMSprop'}.
2026-05-24 09:55:37,453 - experiment_functions - INFO - Early stopping at epoch 1100. Best Metrics: (0.032080982916617394, 0.02167218543046357, 0.029031456511927522)
2026-05-24 09:55:38,269 - optuna.study.study - INFO - Trial 65 finished with values: [0.032080982916617394, 0.02167218543046357, 0.029031456511927522] and parameters: {'n_layers': 4, 'embedding_dim': 128, 'lr': 0.0002008346621954922, 'lambda_val': 0.00325865136231477, 'batch_size': 2129, 'optimizer': 'Adam'}.
2026-05-24 09:55:45,580 - experiment_functions - INFO - Early stopping at epoch 500. Best Metrics: (0.00515032214554359, 0.004230132450331127, 0.005395739364845048)
2026-05-24 09:55:45,672 - optuna.study.study - INFO - Trial 66 finished with values: [0.00515032214554359, 0.004230132450331127, 0.005395739364845048] and parameters: {'n_layers': 3, 'embedding_dim': 128, 'lr': 0.00010836665589207989, 'lambda_val': 7.536869044168119e-05, 'batch_size': 3771, 'optimizer': 'SGD'}.
2026-05-24 09:55:52,238 - experiment_functions - INFO - Early stopping at epoch 500. Best Metrics: (0.005637450282868782, 0.004254966887417219, 0.00543933753657773)
2026-05-24 09:55:52,328 - optuna.study.study - INFO - Trial 67 finished with values: [0.005637450282868782, 0.004254966887417219, 0.00543933753657773] and parameters: {'n_layers': 1, 'embedding_dim': 96, 'lr': 0.0036599567145017275, 'lambda_val': 2.5332086972915617e-06, 'batch_size': 3189, 'optimizer': 'SGD'}.
2026-05-24 09:55:59,648 - experiment_functions - INFO - Early stopping at epoch 550. Best Metrics: (0.010402634678414744, 0.008559602649006622, 0.010959329878911942)
2026-05-24 09:55:59,764 - optuna.study.study - INFO - Trial 68 finished with values: [0.010402634678414744, 0.008559602649006622, 0.010959329878911942] and parameters: {'n_layers': 2, 'embedding_dim': 96, 'lr': 0.0559417521693863, 'lambda_val': 4.8599912504671415e-06, 'batch_size': 1213, 'optimizer': 'RMSprop'}.
2026-05-24 09:56:11,217 - experiment_functions - INFO - Early stopping at epoch 750. Best Metrics: (0.004762026364708385, 0.004097682119205298, 0.004980743608853475)
2026-05-24 09:56:11,380 - optuna.study.study - INFO - Trial 69 finished with values: [0.004762026364708385, 0.004097682119205298, 0.004980743608853475] and parameters: {'n_layers': 3, 'embedding_dim': 256, 'lr': 0.024669538417958024, 'lambda_val': 8.14840512480391e-05, 'batch_size': 1567, 'optimizer': 'SGD'}.
2026-05-24 09:56:18,328 - experiment_functions - INFO - Early stopping at epoch 500. Best Metrics: (0.005632347549987894, 0.004561258278145696, 0.005738483215309065)
2026-05-24 09:56:18,419 - optuna.study.study - INFO - Trial 70 finished with values: [0.005632347549987894, 0.004561258278145696, 0.005738483215309065] and parameters: {'n_layers': 2, 'embedding_dim': 128, 'lr': 0.001667262481946792, 'lambda_val': 0.0005343996675124817, 'batch_size': 2428, 'optimizer': 'SGD'}.
2026-05-24 09:56:40,792 - experiment_functions - INFO - Early stopping at epoch 2000. Best Metrics: (0.00574025777378281, 0.004337748344370861, 0.005392722293169301)
2026-05-24 09:56:40,898 - optuna.study.study - INFO - Trial 71 finished with values: [0.00574025777378281, 0.004337748344370861, 0.005392722293169301] and parameters: {'n_layers': 1, 'embedding_dim': 32, 'lr': 0.03965113881953134, 'lambda_val': 4.336462830610492e-06, 'batch_size': 2901, 'optimizer': 'SGD'}.
2026-05-24 09:57:13,343 - experiment_functions - INFO - Early stopping at epoch 2950. Best Metrics: (0.005979242060943211, 0.004942052980132451, 0.006591660569580505)
2026-05-24 09:57:13,425 - optuna.study.study - INFO - Trial 72 finished with values: [0.005979242060943211, 0.004942052980132451, 0.006591660569580505] and parameters: {'n_layers': 1, 'embedding_dim': 64, 'lr': 4.885523061005691e-05, 'lambda_val': 6.476822722794838e-06, 'batch_size': 2866, 'optimizer': 'RMSprop'}.
2026-05-24 09:57:22,338 - experiment_functions - INFO - Early stopping at epoch 550. Best Metrics: (0.02262181390495495, 0.019230132450331127, 0.022892399022106557)
2026-05-24 09:57:22,431 - optuna.study.study - INFO - Trial 73 finished with values: [0.02262181390495495, 0.019230132450331127, 0.022892399022106557] and parameters: {'n_layers': 3, 'embedding_dim': 256, 'lr': 0.003043283191241845, 'lambda_val': 0.02634963524283978, 'batch_size': 3125, 'optimizer': 'Adam'}.
2026-05-24 09:57:41,192 - experiment_functions - INFO - Early stopping at epoch 1350. Best Metrics: (0.03266602487168989, 0.022640728476821192, 0.03209478132805712)
2026-05-24 09:57:41,343 - optuna.study.study - INFO - Trial 74 finished with values: [0.03266602487168989, 0.022640728476821192, 0.03209478132805712] and parameters: {'n_layers': 4, 'embedding_dim': 96, 'lr': 0.0002008346621954922, 'lambda_val': 5.198475548557465e-05, 'batch_size': 3366, 'optimizer': 'RMSprop'}.
2026-05-24 09:58:30,786 - optuna.study.study - INFO - Trial 75 finished with values: [0.02187821852964772, 0.011870860927152319, 0.01785791061107747] and parameters: {'n_layers': 4, 'embedding_dim': 64, 'lr': 0.008711010704037053, 'lambda_val': 2.791930910853256e-06, 'batch_size': 2742, 'optimizer': 'Adam'}.
2026-05-24 09:58:38,699 - experiment_functions - INFO - Early stopping at epoch 600. Best Metrics: (0.018643446849352548, 0.014155629139072848, 0.018369763909168356)
2026-05-24 09:58:38,797 - optuna.study.study - INFO - Trial 76 finished with values: [0.018643446849352548, 0.014155629139072848, 0.018369763909168356] and parameters: {'n_layers': 1, 'embedding_dim': 64, 'lr': 0.018571577973460266, 'lambda_val': 5.82487758268536e-06, 'batch_size': 4057, 'optimizer': 'RMSprop'}.
2026-05-24 09:58:45,354 - experiment_functions - INFO - Early stopping at epoch 500. Best Metrics: (0.008718687644213203, 0.006846026490066225, 0.009274094957173514)
2026-05-24 09:58:45,525 - optuna.study.study - INFO - Trial 77 finished with values: [0.008718687644213203, 0.006846026490066225, 0.009274094957173514] and parameters: {'n_layers': 2, 'embedding_dim': 32, 'lr': 0.09987215533091691, 'lambda_val': 0.0009904374338936715, 'batch_size': 1467, 'optimizer': 'RMSprop'}.
2026-05-24 09:58:53,257 - experiment_functions - INFO - Early stopping at epoch 550. Best Metrics: (0.011749922815479874, 0.011564569536423843, 0.01357640629009262)
2026-05-24 09:58:53,345 - optuna.study.study - INFO - Trial 78 finished with values: [0.011749922815479874, 0.011564569536423843, 0.01357640629009262] and parameters: {'n_layers': 4, 'embedding_dim': 64, 'lr': 0.008711010704037053, 'lambda_val': 2.03783312901811e-06, 'batch_size': 1177, 'optimizer': 'Adam'}.
2026-05-24 09:58:59,901 - experiment_functions - INFO - Early stopping at epoch 500. Best Metrics: (0.005637665482014418, 0.004528145695364238, 0.006002390121535376)
2026-05-24 09:59:00,255 - optuna.study.study - INFO - Trial 79 finished with values: [0.005637665482014418, 0.004528145695364238, 0.006002390121535376] and parameters: {'n_layers': 2, 'embedding_dim': 64, 'lr': 0.012623755921898306, 'lambda_val': 0.02379023525726417, 'batch_size': 3691, 'optimizer': 'SGD'}.
2026-05-24 09:59:08,718 - experiment_functions - INFO - Early stopping at epoch 550. Best Metrics: (0.05373101963810447, 0.03330298013245033, 0.04802482502936687)
2026-05-24 09:59:09,735 - optuna.study.study - INFO - Trial 80 finished with values: [0.05373101963810447, 0.03330298013245033, 0.04802482502936687] and parameters: {'n_layers': 1, 'embedding_dim': 128, 'lr': 0.009194213632540334, 'lambda_val': 2.0601952025948555e-06, 'batch_size': 2082, 'optimizer': 'Adam'}.
2026-05-24 09:59:19,781 - experiment_functions - INFO - Early stopping at epoch 750. Best Metrics: (0.0606268394933899, 0.03642384105960265, 0.052947020080684346)
2026-05-24 09:59:20,101 - optuna.study.study - INFO - Trial 81 finished with values: [0.0606268394933899, 0.03642384105960265, 0.052947020080684346] and parameters: {'n_layers': 1, 'embedding_dim': 128, 'lr': 0.001667262481946792, 'lambda_val': 0.00038449950728469576, 'batch_size': 1780, 'optimizer': 'Adam'}.
2026-05-24 09:59:48,574 - experiment_functions - INFO - Early stopping at epoch 2300. Best Metrics: (0.017915540813419954, 0.014114238410596027, 0.018314242009692738)
2026-05-24 09:59:48,677 - optuna.study.study - INFO - Trial 82 finished with values: [0.017915540813419954, 0.014114238410596027, 0.018314242009692738] and parameters: {'n_layers': 3, 'embedding_dim': 64, 'lr': 0.020974389902177336, 'lambda_val': 0.007220734716610771, 'batch_size': 2608, 'optimizer': 'RMSprop'}.
2026-05-24 10:00:00,003 - experiment_functions - INFO - Early stopping at epoch 600. Best Metrics: (0.03451949679019004, 0.02361754966887417, 0.03218309114208973)
2026-05-24 10:00:00,171 - optuna.study.study - INFO - Trial 83 finished with values: [0.03451949679019004, 0.02361754966887417, 0.03218309114208973] and parameters: {'n_layers': 3, 'embedding_dim': 256, 'lr': 0.0013978493934357974, 'lambda_val': 4.452603967565531e-05, 'batch_size': 3366, 'optimizer': 'Adam'}.
2026-05-24 10:00:07,931 - experiment_functions - INFO - Early stopping at epoch 550. Best Metrics: (0.02422447120781106, 0.018211920529801324, 0.023053505230065992)
2026-05-24 10:00:08,032 - optuna.study.study - INFO - Trial 84 finished with values: [0.02422447120781106, 0.018211920529801324, 0.023053505230065992] and parameters: {'n_layers': 3, 'embedding_dim': 64, 'lr': 0.0013887154155051873, 'lambda_val': 0.0004231980579073248, 'batch_size': 3462, 'optimizer': 'RMSprop'}.
2026-05-24 10:00:16,334 - experiment_functions - INFO - Early stopping at epoch 550. Best Metrics: (0.030452253041164765, 0.021258278145695364, 0.027946634049653394)
2026-05-24 10:00:16,430 - optuna.study.study - INFO - Trial 85 finished with values: [0.030452253041164765, 0.021258278145695364, 0.027946634049653394] and parameters: {'n_layers': 4, 'embedding_dim': 128, 'lr': 0.0028931100527333827, 'lambda_val': 0.00325865136231477, 'batch_size': 2257, 'optimizer': 'Adam'}.
2026-05-24 10:01:04,533 - optuna.study.study - INFO - Trial 86 finished with values: [0.01607049928722078, 0.010422185430463578, 0.013894208046682649] and parameters: {'n_layers': 4, 'embedding_dim': 32, 'lr': 0.00660067706198712, 'lambda_val': 4.452603967565531e-05, 'batch_size': 2740, 'optimizer': 'RMSprop'}.
2026-05-24 10:01:12,670 - experiment_functions - INFO - Early stopping at epoch 550. Best Metrics: (0.01186767230109349, 0.011456953642384107, 0.0130018551968176)
2026-05-24 10:01:12,770 - optuna.study.study - INFO - Trial 87 finished with values: [0.01186767230109349, 0.011456953642384107, 0.0130018551968176] and parameters: {'n_layers': 3, 'embedding_dim': 128, 'lr': 0.002746129425384238, 'lambda_val': 6.700238629685478e-06, 'batch_size': 1243, 'optimizer': 'RMSprop'}.
2026-05-24 10:01:57,030 - optuna.study.study - INFO - Trial 88 finished with values: [0.007295940182406106, 0.006316225165562915, 0.008220824715859075] and parameters: {'n_layers': 1, 'embedding_dim': 64, 'lr': 8.530575486069038e-05, 'lambda_val': 0.0004231980579073248, 'batch_size': 4019, 'optimizer': 'RMSprop'}.
2026-05-24 10:02:03,815 - experiment_functions - INFO - Early stopping at epoch 500. Best Metrics: (0.004969046743866372, 0.004205298013245033, 0.004913571441156234)
2026-05-24 10:02:04,223 - optuna.study.study - INFO - Trial 89 finished with values: [0.004969046743866372, 0.004205298013245033, 0.004913571441156234] and parameters: {'n_layers': 3, 'embedding_dim': 64, 'lr': 0.0002008346621954922, 'lambda_val': 0.06666595456683828, 'batch_size': 2931, 'optimizer': 'RMSprop'}.
2026-05-24 10:02:12,544 - experiment_functions - INFO - Early stopping at epoch 600. Best Metrics: (0.05565579554802232, 0.032963576158940404, 0.049840047943333736)
2026-05-24 10:02:12,649 - optuna.study.study - INFO - Trial 90 finished with values: [0.05565579554802232, 0.032963576158940404, 0.049840047943333736] and parameters: {'n_layers': 1, 'embedding_dim': 96, 'lr': 0.002746129425384238, 'lambda_val': 2.5452815323641335e-06, 'batch_size': 2844, 'optimizer': 'Adam'}.
2026-05-24 10:02:19,359 - experiment_functions - INFO - Early stopping at epoch 500. Best Metrics: (0.004547280480049097, 0.003973509933774834, 0.004843693713573206)
