2026-05-24 11:16:23,031 - optuna.study.study - INFO - Trial 74 finished with values: [0.0054073366491380545, 0.004230132450331127, 0.005390865744601843] and parameters: {'n_layers': 3, 'embedding_dim': 96, 'lr': 0.011633146306519645, 'lambda_val': 0.0007876603285208243, 'batch_size': 3203, 'optimizer': 'SGD'}.
2026-05-24 11:16:36,354 - experiment_functions - INFO - Early stopping at epoch 1100. Best Metrics: (0.004778770964529637, 0.003923841059602649, 0.004882702153502404)
2026-05-24 11:16:36,454 - optuna.study.study - INFO - Trial 75 finished with values: [0.004778770964529637, 0.003923841059602649, 0.004882702153502404] and parameters: {'n_layers': 2, 'embedding_dim': 128, 'lr': 1.2515052651774547e-05, 'lambda_val': 0.0015005255271309918, 'batch_size': 2188, 'optimizer': 'Adam'}.
2026-05-24 11:16:43,872 - experiment_functions - INFO - Early stopping at epoch 500. Best Metrics: (0.004926289456739966, 0.004180463576158941, 0.005178323601770973)
2026-05-24 11:16:43,967 - optuna.study.study - INFO - Trial 76 finished with values: [0.004926289456739966, 0.004180463576158941, 0.005178323601770973] and parameters: {'n_layers': 3, 'embedding_dim': 128, 'lr': 0.00012051329161914554, 'lambda_val': 6.086586423630953e-05, 'batch_size': 2294, 'optimizer': 'SGD'}.
2026-05-24 11:16:54,352 - experiment_functions - INFO - Early stopping at epoch 750. Best Metrics: (0.03367543431053105, 0.023493377483443708, 0.032219095128858004)
2026-05-24 11:16:54,621 - optuna.study.study - INFO - Trial 77 finished with values: [0.03367543431053105, 0.023493377483443708, 0.032219095128858004] and parameters: {'n_layers': 4, 'embedding_dim': 64, 'lr': 0.0005910069120800205, 'lambda_val': 0.00021158087063845118, 'batch_size': 775, 'optimizer': 'RMSprop'}.
2026-05-24 11:17:03,824 - experiment_functions - INFO - Early stopping at epoch 800. Best Metrics: (0.0049244379104264845, 0.004180463576158941, 0.005224308404551025)
2026-05-24 11:17:03,920 - optuna.study.study - INFO - Trial 78 finished with values: [0.0049244379104264845, 0.004180463576158941, 0.005224308404551025] and parameters: {'n_layers': 1, 'embedding_dim': 64, 'lr': 0.009521363220679336, 'lambda_val': 0.0023274365938951666, 'batch_size': 2294, 'optimizer': 'SGD'}.
2026-05-24 11:17:14,931 - experiment_functions - INFO - Early stopping at epoch 850. Best Metrics: (0.005053809414348261, 0.004188741721854305, 0.005283453683526616)
2026-05-24 11:17:15,667 - optuna.study.study - INFO - Trial 79 finished with values: [0.005053809414348261, 0.004188741721854305, 0.005283453683526616] and parameters: {'n_layers': 3, 'embedding_dim': 96, 'lr': 0.09649987489792845, 'lambda_val': 0.0001552700125515954, 'batch_size': 3313, 'optimizer': 'SGD'}.
2026-05-24 11:17:22,504 - experiment_functions - INFO - Early stopping at epoch 500. Best Metrics: (0.005481675355504802, 0.004279801324503311, 0.005287244305060315)
2026-05-24 11:17:22,661 - optuna.study.study - INFO - Trial 80 finished with values: [0.005481675355504802, 0.004279801324503311, 0.005287244305060315] and parameters: {'n_layers': 3, 'embedding_dim': 96, 'lr': 0.011633146306519645, 'lambda_val': 0.0010294983475462253, 'batch_size': 1385, 'optimizer': 'SGD'}.
2026-05-24 11:17:28,881 - experiment_functions - INFO - Early stopping at epoch 500. Best Metrics: (0.0048110383635382266, 0.0039817880794701995, 0.005032838701713576)
2026-05-24 11:17:29,159 - optuna.study.study - INFO - Trial 81 finished with values: [0.0048110383635382266, 0.0039817880794701995, 0.005032838701713576] and parameters: {'n_layers': 3, 'embedding_dim': 64, 'lr': 0.00022526957918178337, 'lambda_val': 0.00014886396884558603, 'batch_size': 1859, 'optimizer': 'SGD'}.
2026-05-24 11:17:35,757 - experiment_functions - INFO - Early stopping at epoch 550. Best Metrics: (0.04871164517706537, 0.030985099337748345, 0.043471544933335104)
2026-05-24 11:17:35,838 - optuna.study.study - INFO - Trial 82 finished with values: [0.04871164517706537, 0.030985099337748345, 0.043471544933335104] and parameters: {'n_layers': 1, 'embedding_dim': 64, 'lr': 0.007734430860530913, 'lambda_val': 0.01723991176853604, 'batch_size': 1113, 'optimizer': 'Adam'}.
2026-05-24 11:17:54,976 - experiment_functions - INFO - Early stopping at epoch 1500. Best Metrics: (0.0137521122388275, 0.01057119205298013, 0.01452488626266118)
2026-05-24 11:17:55,253 - optuna.study.study - INFO - Trial 83 finished with values: [0.0137521122388275, 0.01057119205298013, 0.01452488626266118] and parameters: {'n_layers': 3, 'embedding_dim': 128, 'lr': 0.03737584539835869, 'lambda_val': 0.0001303671050452136, 'batch_size': 3482, 'optimizer': 'RMSprop'}.
2026-05-24 11:18:36,095 - optuna.study.study - INFO - Trial 84 finished with values: [0.005958449969452766, 0.0051324503311258275, 0.006297875586532273] and parameters: {'n_layers': 1, 'embedding_dim': 128, 'lr': 8.221381758917677e-05, 'lambda_val': 2.1681030987566817e-06, 'batch_size': 1721, 'optimizer': 'RMSprop'}.
2026-05-24 11:18:45,201 - experiment_functions - INFO - Early stopping at epoch 750. Best Metrics: (0.02479791373566585, 0.01847682119205298, 0.0248397200887223)
2026-05-24 11:18:45,918 - optuna.study.study - INFO - Trial 85 finished with values: [0.02479791373566585, 0.01847682119205298, 0.0248397200887223] and parameters: {'n_layers': 1, 'embedding_dim': 128, 'lr': 0.008845891118614167, 'lambda_val': 0.0015005255271309918, 'batch_size': 2188, 'optimizer': 'RMSprop'}.
2026-05-24 11:19:28,706 - optuna.study.study - INFO - Trial 86 finished with values: [0.04029551455906067, 0.02584437086092715, 0.0372530630519875] and parameters: {'n_layers': 2, 'embedding_dim': 32, 'lr': 0.00018773198932182955, 'lambda_val': 0.001023536186227154, 'batch_size': 1246, 'optimizer': 'RMSprop'}.
2026-05-24 11:20:33,583 - optuna.study.study - INFO - Trial 87 finished with values: [0.038275856194523075, 0.024859271523178808, 0.035631533600132596] and parameters: {'n_layers': 4, 'embedding_dim': 256, 'lr': 9.72729409185319e-05, 'lambda_val': 4.598956818766828e-05, 'batch_size': 944, 'optimizer': 'Adam'}.
2026-05-24 11:20:42,669 - experiment_functions - INFO - Early stopping at epoch 650. Best Metrics: (0.005081409649484804, 0.004230132450331126, 0.005193326676140017)
2026-05-24 11:20:43,672 - optuna.study.study - INFO - Trial 88 finished with values: [0.005081409649484804, 0.004230132450331126, 0.005193326676140017] and parameters: {'n_layers': 4, 'embedding_dim': 96, 'lr': 0.0011754715868137952, 'lambda_val': 0.0002735140037837386, 'batch_size': 1292, 'optimizer': 'SGD'}.
2026-05-24 11:20:50,053 - experiment_functions - INFO - Early stopping at epoch 500. Best Metrics: (0.005390902729751405, 0.00445364238410596, 0.005637199170137807)
2026-05-24 11:20:51,333 - optuna.study.study - INFO - Trial 89 finished with values: [0.005390902729751405, 0.00445364238410596, 0.005637199170137807] and parameters: {'n_layers': 1, 'embedding_dim': 128, 'lr': 0.008927561661664776, 'lambda_val': 0.005696225579131193, 'batch_size': 1076, 'optimizer': 'SGD'}.
2026-05-24 11:21:43,372 - optuna.study.study - INFO - Trial 90 finished with values: [0.027896298463402594, 0.018153973509933776, 0.025200946638479518] and parameters: {'n_layers': 3, 'embedding_dim': 128, 'lr': 0.0050448109347620345, 'lambda_val': 8.876623948407677e-06, 'batch_size': 746, 'optimizer': 'RMSprop'}.
2026-05-24 11:21:49,767 - experiment_functions - INFO - Early stopping at epoch 500. Best Metrics: (0.0056185550859079, 0.004478476821192053, 0.005733701155802546)
2026-05-24 11:21:50,675 - optuna.study.study - INFO - Trial 91 finished with values: [0.0056185550859079, 0.004478476821192053, 0.005733701155802546] and parameters: {'n_layers': 1, 'embedding_dim': 64, 'lr': 0.018885019007018673, 'lambda_val': 0.094003100302451, 'batch_size': 3689, 'optimizer': 'SGD'}.
2026-05-24 11:21:59,032 - experiment_functions - INFO - Early stopping at epoch 500. Best Metrics: (0.01845474272650454, 0.01447019867549669, 0.018702514874617767)
2026-05-24 11:21:59,133 - optuna.study.study - INFO - Trial 92 finished with values: [0.01845474272650454, 0.01447019867549669, 0.018702514874617767] and parameters: {'n_layers': 3, 'embedding_dim': 256, 'lr': 0.09649987489792845, 'lambda_val': 0.00014886396884558603, 'batch_size': 1238, 'optimizer': 'RMSprop'}.
2026-05-24 11:22:06,839 - experiment_functions - INFO - Early stopping at epoch 500. Best Metrics: (0.005281795075650039, 0.004288079470198675, 0.005352428129421663)
2026-05-24 11:22:06,982 - optuna.study.study - INFO - Trial 93 finished with values: [0.005281795075650039, 0.004288079470198675, 0.005352428129421663] and parameters: {'n_layers': 4, 'embedding_dim': 128, 'lr': 2.4040744621933937e-05, 'lambda_val': 0.008083148293037532, 'batch_size': 3330, 'optimizer': 'RMSprop'}.
2026-05-24 11:22:15,095 - experiment_functions - INFO - Early stopping at epoch 500. Best Metrics: (0.004771007985956364, 0.004246688741721854, 0.005405538310418766)
2026-05-24 11:22:15,185 - optuna.study.study - INFO - Trial 94 finished with values: [0.004771007985956364, 0.004246688741721854, 0.005405538310418766] and parameters: {'n_layers': 3, 'embedding_dim': 256, 'lr': 0.00012051329161914554, 'lambda_val': 0.02755901911795409, 'batch_size': 1076, 'optimizer': 'SGD'}.
2026-05-24 11:22:22,766 - experiment_functions - INFO - Early stopping at epoch 550. Best Metrics: (0.053799114255792535, 0.0327317880794702, 0.048607403289367065)
2026-05-24 11:22:22,859 - optuna.study.study - INFO - Trial 95 finished with values: [0.053799114255792535, 0.0327317880794702, 0.048607403289367065] and parameters: {'n_layers': 2, 'embedding_dim': 96, 'lr': 0.004627149516425897, 'lambda_val': 8.876623948407677e-06, 'batch_size': 2105, 'optimizer': 'Adam'}.
2026-05-24 11:22:30,450 - experiment_functions - INFO - Early stopping at epoch 500. Best Metrics: (0.004319415135898007, 0.004105960264900663, 0.004994467671508397)
2026-05-24 11:22:30,537 - optuna.study.study - INFO - Trial 96 finished with values: [0.004319415135898007, 0.004105960264900663, 0.004994467671508397] and parameters: {'n_layers': 4, 'embedding_dim': 128, 'lr': 0.002147597357064978, 'lambda_val': 0.0001303671050452136, 'batch_size': 2557, 'optimizer': 'SGD'}.
2026-05-24 11:22:37,738 - experiment_functions - INFO - Early stopping at epoch 500. Best Metrics: (0.005119059212654944, 0.004230132450331126, 0.005459004819091135)
2026-05-24 11:22:37,841 - optuna.study.study - INFO - Trial 97 finished with values: [0.005119059212654944, 0.004230132450331126, 0.005459004819091135] and parameters: {'n_layers': 4, 'embedding_dim': 96, 'lr': 0.00012051329161914554, 'lambda_val': 0.01723991176853604, 'batch_size': 1036, 'optimizer': 'SGD'}.
2026-05-24 11:22:58,192 - experiment_functions - INFO - Early stopping at epoch 1600. Best Metrics: (0.02715288264888965, 0.017268211920529804, 0.02453192068883512)
2026-05-24 11:22:58,277 - optuna.study.study - INFO - Trial 98 finished with values: [0.02715288264888965, 0.017268211920529804, 0.02453192068883512] and parameters: {'n_layers': 2, 'embedding_dim': 128, 'lr': 0.008845891118614167, 'lambda_val': 0.0015005255271309918, 'batch_size': 2188, 'optimizer': 'Adam'}.
2026-05-24 11:23:44,118 - experiment_functions - INFO - Early stopping at epoch 3800. Best Metrics: (0.029535906088346053, 0.01859271523178808, 0.026438399406282873)
2026-05-24 11:23:44,215 - optuna.study.study - INFO - Trial 99 finished with values: [0.029535906088346053, 0.01859271523178808, 0.026438399406282873] and parameters: {'n_layers': 2, 'embedding_dim': 96, 'lr': 0.004578716191415064, 'lambda_val': 0.00024416758921277655, 'batch_size': 1668, 'optimizer': 'RMSprop'}.
2026-05-24 11:23:53,192 - experiment_functions - INFO - Early stopping at epoch 650. Best Metrics: (0.05657345999844538, 0.034271523178807946, 0.049745991178698545)
2026-05-24 11:23:53,716 - optuna.study.study - INFO - Trial 100 finished with values: [0.05657345999844538, 0.034271523178807946, 0.049745991178698545] and parameters: {'n_layers': 2, 'embedding_dim': 128, 'lr': 0.0012566980437762067, 'lambda_val': 0.0018912353521433405, 'batch_size': 2294, 'optimizer': 'Adam'}.
2026-05-24 11:24:00,388 - experiment_functions - INFO - Early stopping at epoch 500. Best Metrics: (0.005655223609206838, 0.004271523178807947, 0.005512770510151507)
2026-05-24 11:24:00,814 - optuna.study.study - INFO - Trial 101 finished with values: [0.005655223609206838, 0.004271523178807947, 0.005512770510151507] and parameters: {'n_layers': 1, 'embedding_dim': 128, 'lr': 8.221381758917677e-05, 'lambda_val': 2.1681030987566817e-06, 'batch_size': 1238, 'optimizer': 'RMSprop'}.
2026-05-24 11:24:45,945 - optuna.study.study - INFO - Trial 102 finished with values: [0.008428148556021064, 0.00642384105960265, 0.008449521706040287] and parameters: {'n_layers': 2, 'embedding_dim': 96, 'lr': 9.72729409185319e-05, 'lambda_val': 4.598956818766828e-05, 'batch_size': 553, 'optimizer': 'RMSprop'}.
2026-05-24 11:24:54,868 - experiment_functions - INFO - Early stopping at epoch 600. Best Metrics: (0.0284889582133911, 0.020008278145695366, 0.026545336084606127)
2026-05-24 11:24:55,492 - optuna.study.study - INFO - Trial 103 finished with values: [0.0284889582133911, 0.020008278145695366, 0.026545336084606127] and parameters: {'n_layers': 4, 'embedding_dim': 96, 'lr': 0.0005910069120800205, 'lambda_val': 7.481780308257389e-06, 'batch_size': 1668, 'optimizer': 'RMSprop'}.
2026-05-24 11:25:02,603 - experiment_functions - INFO - Early stopping at epoch 500. Best Metrics: (0.004664189156879286, 0.004230132450331127, 0.005171868266869943)
2026-05-24 11:25:02,702 - optuna.study.study - INFO - Trial 104 finished with values: [0.004664189156879286, 0.004230132450331127, 0.005171868266869943] and parameters: {'n_layers': 3, 'embedding_dim': 96, 'lr': 0.021136994026051716, 'lambda_val': 8.876623948407677e-06, 'batch_size': 2105, 'optimizer': 'SGD'}.
2026-05-24 11:25:52,880 - optuna.study.study - INFO - Trial 105 finished with values: [0.0055065824096070535, 0.004528145695364238, 0.005773621169916864] and parameters: {'n_layers': 3, 'embedding_dim': 128, 'lr': 1.3774652718861811e-05, 'lambda_val': 1.1822165425616537e-05, 'batch_size': 2361, 'optimizer': 'Adam'}.
2026-05-24 11:26:13,512 - experiment_functions - INFO - Early stopping at epoch 1700. Best Metrics: (0.027034215415244093, 0.019130794701986756, 0.02638059217049239)
2026-05-24 11:26:13,647 - optuna.study.study - INFO - Trial 106 finished with values: [0.027034215415244093, 0.019130794701986756, 0.02638059217049239] and parameters: {'n_layers': 1, 'embedding_dim': 128, 'lr': 0.007639341043118858, 'lambda_val': 0.0015005255271309918, 'batch_size': 1668, 'optimizer': 'RMSprop'}.
2026-05-24 11:27:06,243 - optuna.study.study - INFO - Trial 107 finished with values: [0.011295460910048977, 0.008567880794701986, 0.011759407111419526] and parameters: {'n_layers': 2, 'embedding_dim': 256, 'lr': 9.72729409185319e-05, 'lambda_val': 0.00024416758921277655, 'batch_size': 944, 'optimizer': 'Adam'}.
2026-05-24 11:27:38,036 - experiment_functions - INFO - Early stopping at epoch 2550. Best Metrics: (0.024048191722387213, 0.017624172185430463, 0.023782037624752016)
2026-05-24 11:27:38,123 - optuna.study.study - INFO - Trial 108 finished with values: [0.024048191722387213, 0.017624172185430463, 0.023782037624752016] and parameters: {'n_layers': 2, 'embedding_dim': 128, 'lr': 0.008845891118614167, 'lambda_val': 0.005696225579131193, 'batch_size': 2188, 'optimizer': 'Adam'}.
2026-05-24 11:27:52,251 - experiment_functions - INFO - Early stopping at epoch 1150. Best Metrics: (0.028104021053356847, 0.02002483443708609, 0.026972771885581275)
2026-05-24 11:27:52,688 - optuna.study.study - INFO - Trial 109 finished with values: [0.028104021053356847, 0.02002483443708609, 0.026972771885581275] and parameters: {'n_layers': 1, 'embedding_dim': 96, 'lr': 0.0063358656325518715, 'lambda_val': 0.00024416758921277655, 'batch_size': 2188, 'optimizer': 'RMSprop'}.
2026-05-24 11:28:20,022 - experiment_functions - INFO - Early stopping at epoch 2250. Best Metrics: (0.027419504189942184, 0.017963576158940397, 0.02551793832937791)
2026-05-24 11:28:20,122 - optuna.study.study - INFO - Trial 110 finished with values: [0.027419504189942184, 0.017963576158940397, 0.02551793832937791] and parameters: {'n_layers': 2, 'embedding_dim': 96, 'lr': 0.004578716191415064, 'lambda_val': 7.481780308257389e-06, 'batch_size': 1668, 'optimizer': 'RMSprop'}.
2026-05-24 11:28:27,766 - experiment_functions - INFO - Early stopping at epoch 550. Best Metrics: (0.045091589779972234, 0.028948675496688742, 0.04045113555768016)
2026-05-24 11:28:27,845 - optuna.study.study - INFO - Trial 111 finished with values: [0.045091589779972234, 0.028948675496688742, 0.04045113555768016] and parameters: {'n_layers': 2, 'embedding_dim': 96, 'lr': 0.004627149516425897, 'lambda_val': 8.876623948407677e-06, 'batch_size': 944, 'optimizer': 'Adam'}.
2026-05-24 11:28:53,051 - experiment_functions - INFO - Early stopping at epoch 2200. Best Metrics: (0.011581263887536131, 0.011854304635761589, 0.014300116573872987)
2026-05-24 11:28:53,452 - optuna.study.study - INFO - Trial 112 finished with values: [0.011581263887536131, 0.011854304635761589, 0.014300116573872987] and parameters: {'n_layers': 2, 'embedding_dim': 64, 'lr': 0.004627149516425897, 'lambda_val': 0.01980705031932114, 'batch_size': 2105, 'optimizer': 'RMSprop'}.
2026-05-24 11:29:37,597 - optuna.study.study - INFO - Trial 113 finished with values: [0.00607046187573148, 0.00468543046357616, 0.005871228315914776] and parameters: {'n_layers': 2, 'embedding_dim': 64, 'lr': 1.1988229525741345e-05, 'lambda_val': 8.911285735615227e-05, 'batch_size': 3219, 'optimizer': 'RMSprop'}.
2026-05-24 11:29:44,103 - experiment_functions - INFO - Early stopping at epoch 500. Best Metrics: (0.005630775753468455, 0.0040562913907284765, 0.005421806407941237)
2026-05-24 11:29:44,326 - optuna.study.study - INFO - Trial 114 finished with values: [0.005630775753468455, 0.0040562913907284765, 0.005421806407941237] and parameters: {'n_layers': 2, 'embedding_dim': 96, 'lr': 0.00022526957918178337, 'lambda_val': 0.012353009766661715, 'batch_size': 553, 'optimizer': 'SGD'}.
2026-05-24 11:29:52,744 - experiment_functions - INFO - Early stopping at epoch 500. Best Metrics: (0.013218626413561531, 0.009503311258278146, 0.012681307558057901)
2026-05-24 11:29:54,302 - optuna.study.study - INFO - Trial 115 finished with values: [0.013218626413561531, 0.009503311258278146, 0.012681307558057901] and parameters: {'n_layers': 3, 'embedding_dim': 256, 'lr': 0.09649987489792845, 'lambda_val': 2.3411808432792437e-06, 'batch_size': 3202, 'optimizer': 'RMSprop'}.
2026-05-24 11:30:05,364 - experiment_functions - INFO - Early stopping at epoch 800. Best Metrics: (0.038557465213852726, 0.025910596026490065, 0.03583554933499881)
2026-05-24 11:30:06,274 - optuna.study.study - INFO - Trial 116 finished with values: [0.038557465213852726, 0.025910596026490065, 0.03583554933499881] and parameters: {'n_layers': 4, 'embedding_dim': 64, 'lr': 0.0005910069120800205, 'lambda_val': 7.481780308257389e-06, 'batch_size': 775, 'optimizer': 'RMSprop'}.
2026-05-24 11:30:13,323 - experiment_functions - INFO - Early stopping at epoch 500. Best Metrics: (0.005406354957916892, 0.004420529801324504, 0.005601177407587574)
2026-05-24 11:30:13,411 - optuna.study.study - INFO - Trial 117 finished with values: [0.005406354957916892, 0.004420529801324504, 0.005601177407587574] and parameters: {'n_layers': 4, 'embedding_dim': 96, 'lr': 9.72729409185319e-05, 'lambda_val': 0.022306918419033143, 'batch_size': 944, 'optimizer': 'RMSprop'}.
2026-05-24 11:30:37,950 - experiment_functions - INFO - Early stopping at epoch 1750. Best Metrics: (0.03277163611261962, 0.019577814569536424, 0.028423186128918098)
2026-05-24 11:30:38,045 - optuna.study.study - INFO - Trial 118 finished with values: [0.03277163611261962, 0.019577814569536424, 0.028423186128918098] and parameters: {'n_layers': 2, 'embedding_dim': 256, 'lr': 0.004627149516425897, 'lambda_val': 0.00024416758921277655, 'batch_size': 2105, 'optimizer': 'RMSprop'}.
2026-05-24 11:30:44,819 - experiment_functions - INFO - Early stopping at epoch 500. Best Metrics: (0.010371775714935971, 0.007822847682119206, 0.010556284102745112)
2026-05-24 11:30:45,049 - optuna.study.study - INFO - Trial 119 finished with values: [0.010371775714935971, 0.007822847682119206, 0.010556284102745112] and parameters: {'n_layers': 3, 'embedding_dim': 64, 'lr': 0.08015017732463624, 'lambda_val': 4.598956818766828e-05, 'batch_size': 3689, 'optimizer': 'RMSprop'}.
2026-05-24 11:30:52,545 - experiment_functions - INFO - Early stopping at epoch 550. Best Metrics: (0.022306301897930893, 0.01705298013245033, 0.02046459590477427)
2026-05-24 11:30:52,628 - optuna.study.study - INFO - Trial 120 finished with values: [0.022306301897930893, 0.01705298013245033, 0.02046459590477427] and parameters: {'n_layers': 2, 'embedding_dim': 96, 'lr': 0.008845891118614167, 'lambda_val': 0.0015005255271309918, 'batch_size': 2105, 'optimizer': 'Adam'}.
2026-05-24 11:30:59,168 - experiment_functions - INFO - Early stopping at epoch 500. Best Metrics: (0.005748308248456374, 0.004536423841059603, 0.005863462502455606)
2026-05-24 11:30:59,406 - optuna.study.study - INFO - Trial 121 finished with values: [0.005748308248456374, 0.004536423841059603, 0.005863462502455606] and parameters: {'n_layers': 1, 'embedding_dim': 64, 'lr': 8.221381758917677e-05, 'lambda_val': 2.1681030987566817e-06, 'batch_size': 2551, 'optimizer': 'SGD'}.
2026-05-24 11:31:32,554 - experiment_functions - INFO - Early stopping at epoch 2750. Best Metrics: (0.02411831353816866, 0.016887417218543047, 0.022829359322862706)
