2026-05-24 06:54:26,945 - optuna.study.study - INFO - Trial 76 finished with values: [0.03877116255715073, 0.01939569536423841, 0.03663175645309563] and parameters: {'n_layers': 3, 'embedding_dim': 96, 'lr': 0.0004427403826510948, 'lambda_val': 7.532370886356362e-05, 'batch_size': 1308, 'optimizer': 'Adam'}.
2026-05-24 06:54:43,199 - experiment_functions - INFO - Early stopping at epoch 1250. Best Metrics: (0.05149222293004115, 0.01504139072847682, 0.03455648669874991)
2026-05-24 06:54:43,282 - optuna.study.study - INFO - Trial 77 finished with values: [0.05149222293004115, 0.01504139072847682, 0.03455648669874991] and parameters: {'n_layers': 2, 'embedding_dim': 128, 'lr': 0.007613283644844984, 'lambda_val': 2.4948249425733372e-05, 'batch_size': 2653, 'optimizer': 'RMSprop'}.
2026-05-24 06:55:04,310 - experiment_functions - INFO - Early stopping at epoch 1650. Best Metrics: (0.04097495804414586, 0.012077814569536424, 0.027440071974677658)
2026-05-24 06:55:04,399 - optuna.study.study - INFO - Trial 78 finished with values: [0.04097495804414586, 0.012077814569536424, 0.027440071974677658] and parameters: {'n_layers': 3, 'embedding_dim': 64, 'lr': 0.008825737855916319, 'lambda_val': 0.0003225666467685565, 'batch_size': 4089, 'optimizer': 'Adam'}.
2026-05-24 06:55:25,463 - experiment_functions - INFO - Early stopping at epoch 1700. Best Metrics: (0.05468820204013438, 0.01593543046357616, 0.036399538880383796)
2026-05-24 06:55:26,320 - optuna.study.study - INFO - Trial 79 finished with values: [0.05468820204013438, 0.01593543046357616, 0.036399538880383796] and parameters: {'n_layers': 2, 'embedding_dim': 96, 'lr': 0.0038879080432731965, 'lambda_val': 7.430828607206384e-06, 'batch_size': 3838, 'optimizer': 'RMSprop'}.
2026-05-24 06:56:17,746 - optuna.study.study - INFO - Trial 80 finished with values: [0.025189932279064017, 0.012268211920529801, 0.02089381674643042] and parameters: {'n_layers': 4, 'embedding_dim': 32, 'lr': 8.21225354130991e-05, 'lambda_val': 3.426862940771237e-05, 'batch_size': 2219, 'optimizer': 'Adam'}.
2026-05-24 06:56:35,690 - experiment_functions - INFO - Early stopping at epoch 1300. Best Metrics: (0.03824259280344191, 0.018741721854304637, 0.037337973983326195)
2026-05-24 06:56:35,786 - optuna.study.study - INFO - Trial 81 finished with values: [0.03824259280344191, 0.018741721854304637, 0.037337973983326195] and parameters: {'n_layers': 4, 'embedding_dim': 64, 'lr': 0.0003154862248546408, 'lambda_val': 6.875947708093636e-05, 'batch_size': 1929, 'optimizer': 'RMSprop'}.
2026-05-24 06:57:20,405 - experiment_functions - INFO - Early stopping at epoch 3950. Best Metrics: (0.037323078253707835, 0.012284768211920528, 0.02520747341533858)
2026-05-24 06:57:20,496 - optuna.study.study - INFO - Trial 82 finished with values: [0.037323078253707835, 0.012284768211920528, 0.02520747341533858] and parameters: {'n_layers': 2, 'embedding_dim': 64, 'lr': 0.03058183499071191, 'lambda_val': 0.013889992049358773, 'batch_size': 2938, 'optimizer': 'Adam'}.
2026-05-24 06:57:27,775 - experiment_functions - INFO - Early stopping at epoch 500. Best Metrics: (0.00544219210197308, 0.004395695364238411, 0.005635710687822183)
2026-05-24 06:57:27,861 - optuna.study.study - INFO - Trial 83 finished with values: [0.00544219210197308, 0.004395695364238411, 0.005635710687822183] and parameters: {'n_layers': 4, 'embedding_dim': 64, 'lr': 0.0001150739949127664, 'lambda_val': 0.0023999610459478756, 'batch_size': 3283, 'optimizer': 'SGD'}.
2026-05-24 06:57:43,118 - experiment_functions - INFO - Early stopping at epoch 1200. Best Metrics: (0.04024642001283801, 0.012566225165562914, 0.0280550583670564)
2026-05-24 06:57:43,239 - optuna.study.study - INFO - Trial 84 finished with values: [0.04024642001283801, 0.012566225165562914, 0.0280550583670564] and parameters: {'n_layers': 3, 'embedding_dim': 64, 'lr': 0.008825737855916319, 'lambda_val': 0.0003225666467685565, 'batch_size': 3585, 'optimizer': 'RMSprop'}.
2026-05-24 06:58:05,859 - experiment_functions - INFO - Early stopping at epoch 1700. Best Metrics: (0.005571516952457746, 0.004461920529801325, 0.005755912762468752)
2026-05-24 06:58:05,961 - optuna.study.study - INFO - Trial 85 finished with values: [0.005571516952457746, 0.004461920529801325, 0.005755912762468752] and parameters: {'n_layers': 4, 'embedding_dim': 96, 'lr': 1.1379156316569191e-05, 'lambda_val': 1.1068932700778532e-05, 'batch_size': 803, 'optimizer': 'RMSprop'}.
2026-05-24 06:58:58,967 - optuna.study.study - INFO - Trial 86 finished with values: [0.017821982663612637, 0.009933774834437087, 0.01482796923899389] and parameters: {'n_layers': 4, 'embedding_dim': 96, 'lr': 5.469206106625236e-05, 'lambda_val': 6.875947708093636e-05, 'batch_size': 2938, 'optimizer': 'RMSprop'}.
2026-05-24 06:59:05,612 - experiment_functions - INFO - Early stopping at epoch 500. Best Metrics: (0.0052294095405965, 0.004271523178807948, 0.005283517869555305)
2026-05-24 06:59:05,747 - optuna.study.study - INFO - Trial 87 finished with values: [0.0052294095405965, 0.004271523178807948, 0.005283517869555305] and parameters: {'n_layers': 2, 'embedding_dim': 96, 'lr': 5.2450990712037914e-05, 'lambda_val': 1.5905386217756802e-06, 'batch_size': 3182, 'optimizer': 'SGD'}.
2026-05-24 06:59:19,037 - experiment_functions - INFO - Early stopping at epoch 950. Best Metrics: (0.04337748572416394, 0.01320364238410596, 0.030036016774993242)
2026-05-24 06:59:19,144 - optuna.study.study - INFO - Trial 88 finished with values: [0.04337748572416394, 0.01320364238410596, 0.030036016774993242] and parameters: {'n_layers': 2, 'embedding_dim': 128, 'lr': 0.013331107819781259, 'lambda_val': 3.3538501213230604e-05, 'batch_size': 3507, 'optimizer': 'RMSprop'}.
2026-05-24 06:59:28,413 - experiment_functions - INFO - Early stopping at epoch 500. Best Metrics: (0.0052787797466249346, 0.004197019867549669, 0.005218215139673809)
2026-05-24 06:59:29,225 - optuna.study.study - INFO - Trial 89 finished with values: [0.0052787797466249346, 0.004197019867549669, 0.005218215139673809] and parameters: {'n_layers': 4, 'embedding_dim': 256, 'lr': 4.66334650969812e-05, 'lambda_val': 0.003036563361231438, 'batch_size': 3573, 'optimizer': 'SGD'}.
2026-05-24 06:59:36,048 - experiment_functions - INFO - Early stopping at epoch 500. Best Metrics: (0.005885560227479176, 0.004619205298013245, 0.005780109911657047)
2026-05-24 06:59:36,818 - optuna.study.study - INFO - Trial 90 finished with values: [0.005885560227479176, 0.004619205298013245, 0.005780109911657047] and parameters: {'n_layers': 4, 'embedding_dim': 32, 'lr': 0.0011036962062550273, 'lambda_val': 1.7648009836782235e-05, 'batch_size': 2189, 'optimizer': 'SGD'}.
2026-05-24 06:59:45,807 - experiment_functions - INFO - Early stopping at epoch 750. Best Metrics: (0.005492324678797281, 0.004130794701986755, 0.005418912178482016)
2026-05-24 06:59:46,277 - optuna.study.study - INFO - Trial 91 finished with values: [0.005492324678797281, 0.004130794701986755, 0.005418912178482016] and parameters: {'n_layers': 1, 'embedding_dim': 96, 'lr': 1.1952271169074727e-05, 'lambda_val': 2.9822943996985876e-05, 'batch_size': 3643, 'optimizer': 'RMSprop'}.
2026-05-24 07:00:23,244 - experiment_functions - INFO - Early stopping at epoch 2950. Best Metrics: (0.0064392090684099144, 0.004652317880794702, 0.006179742286614925)
2026-05-24 07:00:23,368 - optuna.study.study - INFO - Trial 92 finished with values: [0.0064392090684099144, 0.004652317880794702, 0.006179742286614925] and parameters: {'n_layers': 3, 'embedding_dim': 128, 'lr': 2.1883968141449496e-05, 'lambda_val': 2.4948249425733372e-05, 'batch_size': 2083, 'optimizer': 'RMSprop'}.
2026-05-24 07:00:35,968 - experiment_functions - INFO - Early stopping at epoch 950. Best Metrics: (0.02843466461177552, 0.011771523178807948, 0.020048551974850646)
2026-05-24 07:00:36,057 - optuna.study.study - INFO - Trial 93 finished with values: [0.02843466461177552, 0.011771523178807948, 0.020048551974850646] and parameters: {'n_layers': 3, 'embedding_dim': 96, 'lr': 0.0003154862248546408, 'lambda_val': 0.02518020325620793, 'batch_size': 2053, 'optimizer': 'Adam'}.
2026-05-24 07:01:28,150 - optuna.study.study - INFO - Trial 94 finished with values: [0.019948807044174236, 0.010637417218543046, 0.016511194524253852] and parameters: {'n_layers': 4, 'embedding_dim': 96, 'lr': 5.2450990712037914e-05, 'lambda_val': 1.8365768000629191e-06, 'batch_size': 1536, 'optimizer': 'RMSprop'}.
2026-05-24 07:02:35,344 - optuna.study.study - INFO - Trial 95 finished with values: [0.041519305395775474, 0.021233443708609273, 0.03535575590565621] and parameters: {'n_layers': 4, 'embedding_dim': 256, 'lr': 9.311633605007365e-05, 'lambda_val': 0.006128221667042127, 'batch_size': 803, 'optimizer': 'RMSprop'}.
2026-05-24 07:02:42,754 - experiment_functions - INFO - Early stopping at epoch 500. Best Metrics: (0.0046399220811312765, 0.003841059602649007, 0.004753517174224018)
2026-05-24 07:02:42,893 - optuna.study.study - INFO - Trial 96 finished with values: [0.0046399220811312765, 0.003841059602649007, 0.004753517174224018] and parameters: {'n_layers': 4, 'embedding_dim': 96, 'lr': 0.0001150739949127664, 'lambda_val': 0.0007715536445878253, 'batch_size': 2307, 'optimizer': 'SGD'}.
2026-05-24 07:02:52,749 - experiment_functions - INFO - Early stopping at epoch 650. Best Metrics: (0.02641139645318089, 0.00902317880794702, 0.017494968738301465)
2026-05-24 07:02:53,299 - optuna.study.study - INFO - Trial 97 finished with values: [0.02641139645318089, 0.00902317880794702, 0.017494968738301465] and parameters: {'n_layers': 4, 'embedding_dim': 96, 'lr': 0.04695408117684214, 'lambda_val': 1.1068932700778532e-05, 'batch_size': 3489, 'optimizer': 'RMSprop'}.
2026-05-24 07:03:25,547 - experiment_functions - INFO - Early stopping at epoch 2500. Best Metrics: (0.04048842064258621, 0.011374172185430464, 0.026266156696781888)
2026-05-24 07:03:25,629 - optuna.study.study - INFO - Trial 98 finished with values: [0.04048842064258621, 0.011374172185430464, 0.026266156696781888] and parameters: {'n_layers': 4, 'embedding_dim': 64, 'lr': 0.008718008162119376, 'lambda_val': 3.426862940771237e-05, 'batch_size': 3317, 'optimizer': 'Adam'}.
2026-05-24 07:04:12,516 - optuna.study.study - INFO - Trial 99 finished with values: [0.03749307862338713, 0.013576158940397352, 0.026618255678936123] and parameters: {'n_layers': 3, 'embedding_dim': 32, 'lr': 0.0981108711077032, 'lambda_val': 0.0006476604301141326, 'batch_size': 2437, 'optimizer': 'RMSprop'}.
2026-05-24 07:04:19,648 - experiment_functions - INFO - Early stopping at epoch 500. Best Metrics: (0.01986355293093128, 0.01146523178807947, 0.01949139342038005)
2026-05-24 07:04:19,735 - optuna.study.study - INFO - Trial 100 finished with values: [0.01986355293093128, 0.01146523178807947, 0.01949139342038005] and parameters: {'n_layers': 4, 'embedding_dim': 32, 'lr': 0.06054915076740644, 'lambda_val': 8.94244552694136e-05, 'batch_size': 2219, 'optimizer': 'RMSprop'}.
2026-05-24 07:04:30,971 - experiment_functions - INFO - Early stopping at epoch 800. Best Metrics: (0.04541654169581631, 0.024528145695364236, 0.042595077991687165)
2026-05-24 07:04:31,771 - optuna.study.study - INFO - Trial 101 finished with values: [0.04541654169581631, 0.024528145695364236, 0.042595077991687165] and parameters: {'n_layers': 3, 'embedding_dim': 96, 'lr': 0.0004427403826510948, 'lambda_val': 7.532370886356362e-05, 'batch_size': 1308, 'optimizer': 'Adam'}.
2026-05-24 07:05:20,159 - optuna.study.study - INFO - Trial 102 finished with values: [0.02851785843871072, 0.014759933774834437, 0.025413999190053174] and parameters: {'n_layers': 3, 'embedding_dim': 64, 'lr': 9.070524572655089e-05, 'lambda_val': 0.0003225666467685565, 'batch_size': 3945, 'optimizer': 'RMSprop'}.
2026-05-24 07:05:50,678 - experiment_functions - INFO - Early stopping at epoch 2700. Best Metrics: (0.07100342901321771, 0.0294205298013245, 0.06240434261716021)
2026-05-24 07:05:50,770 - optuna.study.study - INFO - Trial 103 finished with values: [0.07100342901321771, 0.0294205298013245, 0.06240434261716021] and parameters: {'n_layers': 1, 'embedding_dim': 96, 'lr': 0.0004427403826510948, 'lambda_val': 1.1068932700778532e-05, 'batch_size': 803, 'optimizer': 'Adam'}.
2026-05-24 07:06:04,633 - experiment_functions - INFO - Early stopping at epoch 900. Best Metrics: (0.035181143635526275, 0.0164817880794702, 0.031293294376484496)
2026-05-24 07:06:04,742 - optuna.study.study - INFO - Trial 104 finished with values: [0.035181143635526275, 0.0164817880794702, 0.031293294376484496] and parameters: {'n_layers': 4, 'embedding_dim': 96, 'lr': 0.0003154862248546408, 'lambda_val': 7.218310157739172e-05, 'batch_size': 3311, 'optimizer': 'Adam'}.
2026-05-24 07:06:12,747 - experiment_functions - INFO - Early stopping at epoch 550. Best Metrics: (0.04240890536233186, 0.02160596026490066, 0.03969208348629977)
2026-05-24 07:06:12,832 - optuna.study.study - INFO - Trial 105 finished with values: [0.04240890536233186, 0.02160596026490066, 0.03969208348629977] and parameters: {'n_layers': 3, 'embedding_dim': 96, 'lr': 0.0022852766065388956, 'lambda_val': 2.4948249425733372e-05, 'batch_size': 1670, 'optimizer': 'Adam'}.
2026-05-24 07:07:01,562 - experiment_functions - INFO - Early stopping at epoch 3650. Best Metrics: (0.04113692479330938, 0.014801324503311258, 0.02894430677357687)
2026-05-24 07:07:01,659 - optuna.study.study - INFO - Trial 106 finished with values: [0.04113692479330938, 0.014801324503311258, 0.02894430677357687] and parameters: {'n_layers': 3, 'embedding_dim': 96, 'lr': 0.04695408117684214, 'lambda_val': 0.0002386926134578054, 'batch_size': 4089, 'optimizer': 'RMSprop'}.
2026-05-24 07:07:15,880 - experiment_functions - INFO - Early stopping at epoch 1000. Best Metrics: (0.04194880733154174, 0.019519867549668876, 0.03731774547839309)
2026-05-24 07:07:16,620 - optuna.study.study - INFO - Trial 107 finished with values: [0.04194880733154174, 0.019519867549668876, 0.03731774547839309] and parameters: {'n_layers': 3, 'embedding_dim': 96, 'lr': 0.0003154862248546408, 'lambda_val': 0.0015142663387552227, 'batch_size': 2053, 'optimizer': 'Adam'}.
2026-05-24 07:07:25,105 - experiment_functions - INFO - Early stopping at epoch 600. Best Metrics: (0.028845784486351805, 0.013841059602649006, 0.025307153121439368)
2026-05-24 07:07:25,230 - optuna.study.study - INFO - Trial 108 finished with values: [0.028845784486351805, 0.013841059602649006, 0.025307153121439368] and parameters: {'n_layers': 3, 'embedding_dim': 32, 'lr': 0.0022852766065388956, 'lambda_val': 7.430828607206384e-06, 'batch_size': 3838, 'optimizer': 'Adam'}.
2026-05-24 07:08:22,044 - optuna.study.study - INFO - Trial 109 finished with values: [0.030881672234002552, 0.016001655629139074, 0.02784593778676193] and parameters: {'n_layers': 4, 'embedding_dim': 96, 'lr': 0.0001150739949127664, 'lambda_val': 0.0007715536445878253, 'batch_size': 2528, 'optimizer': 'Adam'}.
2026-05-24 07:08:35,724 - experiment_functions - INFO - Early stopping at epoch 950. Best Metrics: (0.032657478100460845, 0.015331125827814568, 0.029311809384416167)
2026-05-24 07:08:35,829 - optuna.study.study - INFO - Trial 110 finished with values: [0.032657478100460845, 0.015331125827814568, 0.029311809384416167] and parameters: {'n_layers': 4, 'embedding_dim': 64, 'lr': 0.00034776281673029824, 'lambda_val': 3.426862940771237e-05, 'batch_size': 2023, 'optimizer': 'Adam'}.
2026-05-24 07:08:43,602 - experiment_functions - INFO - Early stopping at epoch 500. Best Metrics: (0.005789418310758528, 0.004188741721854305, 0.005392943080627585)
2026-05-24 07:08:43,692 - optuna.study.study - INFO - Trial 111 finished with values: [0.005789418310758528, 0.004188741721854305, 0.005392943080627585] and parameters: {'n_layers': 4, 'embedding_dim': 96, 'lr': 0.0038879080432731965, 'lambda_val': 1.1068932700778532e-05, 'batch_size': 803, 'optimizer': 'SGD'}.
2026-05-24 07:08:54,985 - experiment_functions - INFO - Early stopping at epoch 600. Best Metrics: (0.030860481652242592, 0.013559602649006621, 0.027198409334934868)
2026-05-24 07:08:55,209 - optuna.study.study - INFO - Trial 112 finished with values: [0.030860481652242592, 0.013559602649006621, 0.027198409334934868] and parameters: {'n_layers': 4, 'embedding_dim': 256, 'lr': 0.0004427403826510948, 'lambda_val': 6.875947708093636e-05, 'batch_size': 3507, 'optimizer': 'RMSprop'}.
2026-05-24 07:09:02,984 - experiment_functions - INFO - Early stopping at epoch 550. Best Metrics: (0.025902584431197053, 0.01179635761589404, 0.0222808924109408)
2026-05-24 07:09:03,088 - optuna.study.study - INFO - Trial 113 finished with values: [0.025902584431197053, 0.01179635761589404, 0.0222808924109408] and parameters: {'n_layers': 3, 'embedding_dim': 32, 'lr': 0.0016583026871408255, 'lambda_val': 0.0016947112619254538, 'batch_size': 2219, 'optimizer': 'RMSprop'}.
2026-05-24 07:09:53,192 - optuna.study.study - INFO - Trial 114 finished with values: [0.0074810959576976374, 0.005438741721854305, 0.0070725006163572515] and parameters: {'n_layers': 3, 'embedding_dim': 64, 'lr': 2.7789143900041332e-05, 'lambda_val': 1.1068932700778532e-05, 'batch_size': 3585, 'optimizer': 'RMSprop'}.
2026-05-24 07:10:06,319 - experiment_functions - INFO - Early stopping at epoch 1050. Best Metrics: (0.05165836241105585, 0.015413907284768212, 0.035131934008437164)
2026-05-24 07:10:06,579 - optuna.study.study - INFO - Trial 115 finished with values: [0.05165836241105585, 0.015413907284768212, 0.035131934008437164] and parameters: {'n_layers': 1, 'embedding_dim': 64, 'lr': 0.008825737855916319, 'lambda_val': 3.426862940771237e-05, 'batch_size': 2219, 'optimizer': 'RMSprop'}.
2026-05-24 07:10:14,715 - experiment_functions - INFO - Early stopping at epoch 600. Best Metrics: (0.04078083385601346, 0.012549668874172188, 0.026945041534357214)
2026-05-24 07:10:14,816 - optuna.study.study - INFO - Trial 116 finished with values: [0.04078083385601346, 0.012549668874172188, 0.026945041534357214] and parameters: {'n_layers': 1, 'embedding_dim': 96, 'lr': 0.031181557217089314, 'lambda_val': 0.00021175743617969422, 'batch_size': 3025, 'optimizer': 'Adam'}.
2026-05-24 07:10:23,835 - experiment_functions - INFO - Early stopping at epoch 650. Best Metrics: (0.028482065867312095, 0.010024834437086093, 0.020002281157955007)
2026-05-24 07:10:23,946 - optuna.study.study - INFO - Trial 117 finished with values: [0.028482065867312095, 0.010024834437086093, 0.020002281157955007] and parameters: {'n_layers': 3, 'embedding_dim': 32, 'lr': 0.03733083201424205, 'lambda_val': 2.4948249425733372e-05, 'batch_size': 3507, 'optimizer': 'RMSprop'}.
2026-05-24 07:10:46,905 - experiment_functions - INFO - Early stopping at epoch 1700. Best Metrics: (0.03580388648643339, 0.018774834437086094, 0.03381650968566078)
2026-05-24 07:10:46,995 - optuna.study.study - INFO - Trial 118 finished with values: [0.03580388648643339, 0.018774834437086094, 0.03381650968566078] and parameters: {'n_layers': 3, 'embedding_dim': 64, 'lr': 0.0002382334927885136, 'lambda_val': 0.0002658688144855125, 'batch_size': 4089, 'optimizer': 'RMSprop'}.
2026-05-24 07:11:37,085 - optuna.study.study - INFO - Trial 119 finished with values: [0.04088753752359907, 0.012466887417218542, 0.027867415651438607] and parameters: {'n_layers': 3, 'embedding_dim': 64, 'lr': 0.008825737855916319, 'lambda_val': 6.717459892774834e-06, 'batch_size': 1308, 'optimizer': 'Adam'}.
2026-05-24 07:12:22,661 - experiment_functions - INFO - Early stopping at epoch 3700. Best Metrics: (0.05246099597984814, 0.015538079470198677, 0.03405894170472259)
2026-05-24 07:12:22,748 - optuna.study.study - INFO - Trial 120 finished with values: [0.05246099597984814, 0.015538079470198677, 0.03405894170472259] and parameters: {'n_layers': 2, 'embedding_dim': 96, 'lr': 0.0038879080432731965, 'lambda_val': 1.1068932700778532e-05, 'batch_size': 803, 'optimizer': 'RMSprop'}.
2026-05-24 07:12:49,581 - experiment_functions - INFO - Early stopping at epoch 2100. Best Metrics: (0.0370636902470818, 0.01833609271523179, 0.038058361673613234)
2026-05-24 07:12:49,982 - optuna.study.study - INFO - Trial 121 finished with values: [0.0370636902470818, 0.01833609271523179, 0.038058361673613234] and parameters: {'n_layers': 4, 'embedding_dim': 32, 'lr': 0.0003154862248546408, 'lambda_val': 6.875947708093636e-05, 'batch_size': 1929, 'optimizer': 'RMSprop'}.
2026-05-24 07:12:56,172 - experiment_functions - INFO - Early stopping at epoch 500. Best Metrics: (0.004780185217631917, 0.003948675496688742, 0.005017376312516619)
2026-05-24 07:12:56,879 - optuna.study.study - INFO - Trial 122 finished with values: [0.004780185217631917, 0.003948675496688742, 0.005017376312516619] and parameters: {'n_layers': 1, 'embedding_dim': 96, 'lr': 0.0004427403826510948, 'lambda_val': 0.0023999610459478756, 'batch_size': 3042, 'optimizer': 'SGD'}.
2026-05-24 07:13:10,838 - experiment_functions - INFO - Early stopping at epoch 950. Best Metrics: (0.040743073099133, 0.013129139072847684, 0.028071538470684155)
2026-05-24 07:13:10,934 - optuna.study.study - INFO - Trial 123 finished with values: [0.040743073099133, 0.013129139072847684, 0.028071538470684155] and parameters: {'n_layers': 4, 'embedding_dim': 96, 'lr': 0.020625687533512998, 'lambda_val': 7.620091816316645e-06, 'batch_size': 3507, 'optimizer': 'RMSprop'}.
2026-05-24 07:13:48,597 - experiment_functions - INFO - Early stopping at epoch 3000. Best Metrics: (0.035666307834475754, 0.010355960264900663, 0.023566817717572852)
2026-05-24 07:13:48,688 - optuna.study.study - INFO - Trial 124 finished with values: [0.035666307834475754, 0.010355960264900663, 0.023566817717572852] and parameters: {'n_layers': 4, 'embedding_dim': 64, 'lr': 0.008825737855916319, 'lambda_val': 0.0003225666467685565, 'batch_size': 1506, 'optimizer': 'Adam'}.
2026-05-24 07:14:51,208 - experiment_functions - INFO - Early stopping at epoch 3800. Best Metrics: (0.0425621798882208, 0.012483443708609272, 0.028044756305863516)
