2026-05-24 13:27:23,910 - optuna.study.study - INFO - Trial 249 finished with values: [0.012518338749152454, 0.012789735099337748, 0.014973851070152516] and parameters: {'n_layers': 1, 'embedding_dim': 96, 'lr': 0.0050557762652770595, 'lambda_val': 0.02843248434954034, 'batch_size': 571, 'optimizer': 'RMSprop'}.
2026-05-24 13:27:33,738 - experiment_functions - INFO - Early stopping at epoch 700. Best Metrics: (0.031070137953138496, 0.022516556291390728, 0.030428650597116885)
2026-05-24 13:27:34,687 - optuna.study.study - INFO - Trial 250 finished with values: [0.031070137953138496, 0.022516556291390728, 0.030428650597116885] and parameters: {'n_layers': 4, 'embedding_dim': 96, 'lr': 0.0005846659139515835, 'lambda_val': 0.00018703403293765332, 'batch_size': 2525, 'optimizer': 'Adam'}.
2026-05-24 13:27:44,046 - experiment_functions - INFO - Early stopping at epoch 750. Best Metrics: (0.060667343648556804, 0.035778145695364236, 0.05258967800547382)
2026-05-24 13:27:44,208 - optuna.study.study - INFO - Trial 251 finished with values: [0.060667343648556804, 0.035778145695364236, 0.05258967800547382] and parameters: {'n_layers': 1, 'embedding_dim': 96, 'lr': 0.0017164560979354832, 'lambda_val': 0.0003409068265064018, 'batch_size': 1315, 'optimizer': 'Adam'}.
2026-05-24 13:28:27,872 - optuna.study.study - INFO - Trial 252 finished with values: [0.06263040927068358, 0.03683774834437086, 0.056289827564449474] and parameters: {'n_layers': 1, 'embedding_dim': 32, 'lr': 0.0004536895931281477, 'lambda_val': 0.0006796337932014016, 'batch_size': 1315, 'optimizer': 'Adam'}.
2026-05-24 13:28:35,583 - experiment_functions - INFO - Early stopping at epoch 650. Best Metrics: (0.06393029963492053, 0.03684602649006623, 0.05378767555694731)
2026-05-24 13:28:35,692 - optuna.study.study - INFO - Trial 253 finished with values: [0.06393029963492053, 0.03684602649006623, 0.05378767555694731] and parameters: {'n_layers': 1, 'embedding_dim': 32, 'lr': 0.004235289187226827, 'lambda_val': 0.007383021531734565, 'batch_size': 563, 'optimizer': 'Adam'}.
2026-05-24 13:28:56,902 - experiment_functions - INFO - Early stopping at epoch 1900. Best Metrics: (0.06560180000560867, 0.03841887417218543, 0.058199878032208996)
2026-05-24 13:28:56,997 - optuna.study.study - INFO - Trial 254 finished with values: [0.06560180000560867, 0.03841887417218543, 0.058199878032208996] and parameters: {'n_layers': 1, 'embedding_dim': 32, 'lr': 0.0005846659139515835, 'lambda_val': 0.004190156106722824, 'batch_size': 1440, 'optimizer': 'Adam'}.
2026-05-24 13:29:03,945 - experiment_functions - INFO - Early stopping at epoch 500. Best Metrics: (0.004930866155582147, 0.003923841059602649, 0.005134306762683773)
2026-05-24 13:29:04,049 - optuna.study.study - INFO - Trial 255 finished with values: [0.004930866155582147, 0.003923841059602649, 0.005134306762683773] and parameters: {'n_layers': 4, 'embedding_dim': 96, 'lr': 0.03536653714167449, 'lambda_val': 0.00018703403293765332, 'batch_size': 1315, 'optimizer': 'SGD'}.
2026-05-24 13:29:18,598 - experiment_functions - INFO - Early stopping at epoch 1250. Best Metrics: (0.06043765385723022, 0.036299668874172186, 0.052395091392429115)
2026-05-24 13:29:19,705 - optuna.study.study - INFO - Trial 256 finished with values: [0.06043765385723022, 0.036299668874172186, 0.052395091392429115] and parameters: {'n_layers': 1, 'embedding_dim': 96, 'lr': 0.000684293575282855, 'lambda_val': 2.662938714668246e-05, 'batch_size': 1721, 'optimizer': 'Adam'}.
2026-05-24 13:29:27,479 - experiment_functions - INFO - Early stopping at epoch 600. Best Metrics: (0.0459444648797837, 0.02969370860927152, 0.04070114066800047)
2026-05-24 13:29:27,572 - optuna.study.study - INFO - Trial 257 finished with values: [0.0459444648797837, 0.02969370860927152, 0.04070114066800047] and parameters: {'n_layers': 1, 'embedding_dim': 96, 'lr': 0.004235289187226827, 'lambda_val': 0.0018241216708581335, 'batch_size': 3894, 'optimizer': 'Adam'}.
2026-05-24 13:29:42,798 - experiment_functions - INFO - Early stopping at epoch 1300. Best Metrics: (0.058849361849769674, 0.03582781456953643, 0.05230234848248581)
2026-05-24 13:29:42,892 - optuna.study.study - INFO - Trial 258 finished with values: [0.058849361849769674, 0.03582781456953643, 0.05230234848248581] and parameters: {'n_layers': 1, 'embedding_dim': 96, 'lr': 0.0005846659139515835, 'lambda_val': 1.3006040150007294e-06, 'batch_size': 2016, 'optimizer': 'Adam'}.
2026-05-24 13:30:01,898 - experiment_functions - INFO - Early stopping at epoch 1700. Best Metrics: (0.06290648371524638, 0.03754139072847682, 0.05532021671455857)
2026-05-24 13:30:01,996 - optuna.study.study - INFO - Trial 259 finished with values: [0.06290648371524638, 0.03754139072847682, 0.05532021671455857] and parameters: {'n_layers': 1, 'embedding_dim': 32, 'lr': 0.000684293575282855, 'lambda_val': 0.0006796337932014016, 'batch_size': 1365, 'optimizer': 'Adam'}.
2026-05-24 13:30:13,937 - experiment_functions - INFO - Early stopping at epoch 1000. Best Metrics: (0.05687486777994962, 0.03483443708609272, 0.05073136571736738)
2026-05-24 13:30:14,716 - optuna.study.study - INFO - Trial 260 finished with values: [0.05687486777994962, 0.03483443708609272, 0.05073136571736738] and parameters: {'n_layers': 1, 'embedding_dim': 96, 'lr': 0.000684293575282855, 'lambda_val': 0.0006796337932014016, 'batch_size': 2016, 'optimizer': 'RMSprop'}.
2026-05-24 13:30:58,519 - optuna.study.study - INFO - Trial 261 finished with values: [0.06303869081512055, 0.03619205298013245, 0.053588663334867566] and parameters: {'n_layers': 1, 'embedding_dim': 32, 'lr': 0.0004988299375625479, 'lambda_val': 0.0003409068265064018, 'batch_size': 1304, 'optimizer': 'Adam'}.
2026-05-24 13:31:05,822 - experiment_functions - INFO - Early stopping at epoch 600. Best Metrics: (0.059502435001253656, 0.03531456953642384, 0.05253479635245545)
2026-05-24 13:31:05,910 - optuna.study.study - INFO - Trial 262 finished with values: [0.059502435001253656, 0.03531456953642384, 0.05253479635245545] and parameters: {'n_layers': 1, 'embedding_dim': 32, 'lr': 0.006025982502557471, 'lambda_val': 0.0006796337932014016, 'batch_size': 1315, 'optimizer': 'Adam'}.
2026-05-24 13:31:13,352 - experiment_functions - INFO - Early stopping at epoch 600. Best Metrics: (0.06254321283656689, 0.036804635761589405, 0.05529587464969936)
2026-05-24 13:31:13,447 - optuna.study.study - INFO - Trial 263 finished with values: [0.06254321283656689, 0.036804635761589405, 0.05529587464969936] and parameters: {'n_layers': 1, 'embedding_dim': 96, 'lr': 0.004235289187226827, 'lambda_val': 0.007383021531734565, 'batch_size': 1315, 'optimizer': 'Adam'}.
2026-05-24 13:31:42,115 - experiment_functions - INFO - Early stopping at epoch 2550. Best Metrics: (0.06641882879117197, 0.03855960264900662, 0.05747094685283116)
2026-05-24 13:31:42,197 - optuna.study.study - INFO - Trial 264 finished with values: [0.06641882879117197, 0.03855960264900662, 0.05747094685283116] and parameters: {'n_layers': 1, 'embedding_dim': 64, 'lr': 0.0005846659139515835, 'lambda_val': 0.00019462201060576364, 'batch_size': 1315, 'optimizer': 'Adam'}.
2026-05-24 13:31:51,794 - experiment_functions - INFO - Early stopping at epoch 750. Best Metrics: (0.028817864350515008, 0.022640728476821192, 0.028557453117951312)
2026-05-24 13:31:52,204 - optuna.study.study - INFO - Trial 265 finished with values: [0.028817864350515008, 0.022640728476821192, 0.028557453117951312] and parameters: {'n_layers': 3, 'embedding_dim': 96, 'lr': 0.000684293575282855, 'lambda_val': 0.02843248434954034, 'batch_size': 2016, 'optimizer': 'Adam'}.
2026-05-24 13:31:59,561 - experiment_functions - INFO - Early stopping at epoch 600. Best Metrics: (0.05434279769123127, 0.0330794701986755, 0.04891030950262149)
2026-05-24 13:31:59,658 - optuna.study.study - INFO - Trial 266 finished with values: [0.05434279769123127, 0.0330794701986755, 0.04891030950262149] and parameters: {'n_layers': 1, 'embedding_dim': 96, 'lr': 0.0050557762652770595, 'lambda_val': 2.662938714668246e-05, 'batch_size': 598, 'optimizer': 'Adam'}.
2026-05-24 13:32:05,859 - experiment_functions - INFO - Early stopping at epoch 500. Best Metrics: (0.006018401113219602, 0.004230132450331127, 0.005574556079590666)
2026-05-24 13:32:07,005 - optuna.study.study - INFO - Trial 267 finished with values: [0.006018401113219602, 0.004230132450331127, 0.005574556079590666] and parameters: {'n_layers': 1, 'embedding_dim': 96, 'lr': 0.0005846659139515835, 'lambda_val': 0.033607690460835456, 'batch_size': 2016, 'optimizer': 'SGD'}.
2026-05-24 13:32:27,787 - experiment_functions - INFO - Early stopping at epoch 1800. Best Metrics: (0.06162340031612008, 0.035927152317880795, 0.05326606256538424)
2026-05-24 13:32:27,872 - optuna.study.study - INFO - Trial 268 finished with values: [0.06162340031612008, 0.035927152317880795, 0.05326606256538424] and parameters: {'n_layers': 1, 'embedding_dim': 96, 'lr': 0.0005846659139515835, 'lambda_val': 0.0003409068265064018, 'batch_size': 1315, 'optimizer': 'Adam'}.
2026-05-24 13:32:35,341 - experiment_functions - INFO - Early stopping at epoch 600. Best Metrics: (0.06212124360135353, 0.037152317880794705, 0.05388913994427115)
2026-05-24 13:32:35,441 - optuna.study.study - INFO - Trial 269 finished with values: [0.06212124360135353, 0.037152317880794705, 0.05388913994427115] and parameters: {'n_layers': 1, 'embedding_dim': 96, 'lr': 0.004235289187226827, 'lambda_val': 1.069785669533184e-06, 'batch_size': 2016, 'optimizer': 'Adam'}.
2026-05-24 13:32:43,929 - experiment_functions - INFO - Early stopping at epoch 700. Best Metrics: (0.05929792596649157, 0.035397350993377485, 0.052264058090911975)
2026-05-24 13:32:44,024 - optuna.study.study - INFO - Trial 270 finished with values: [0.05929792596649157, 0.035397350993377485, 0.052264058090911975] and parameters: {'n_layers': 1, 'embedding_dim': 96, 'lr': 0.0017164560979354832, 'lambda_val': 2.3348509369622703e-06, 'batch_size': 2225, 'optimizer': 'Adam'}.
2026-05-24 13:32:56,185 - experiment_functions - INFO - Early stopping at epoch 1100. Best Metrics: (0.0491566061339981, 0.03189569536423842, 0.04520248046180777)
2026-05-24 13:32:56,274 - optuna.study.study - INFO - Trial 271 finished with values: [0.0491566061339981, 0.03189569536423842, 0.04520248046180777] and parameters: {'n_layers': 1, 'embedding_dim': 32, 'lr': 0.000684293575282855, 'lambda_val': 2.662938714668246e-05, 'batch_size': 3276, 'optimizer': 'Adam'}.
2026-05-24 13:33:03,474 - experiment_functions - INFO - Early stopping at epoch 650. Best Metrics: (0.004529357706437064, 0.004197019867549669, 0.004975447471249144)
2026-05-24 13:33:03,572 - optuna.study.study - INFO - Trial 272 finished with values: [0.004529357706437064, 0.004197019867549669, 0.004975447471249144] and parameters: {'n_layers': 1, 'embedding_dim': 96, 'lr': 0.0050557762652770595, 'lambda_val': 0.0003409068265064018, 'batch_size': 2016, 'optimizer': 'SGD'}.
2026-05-24 13:33:10,791 - experiment_functions - INFO - Early stopping at epoch 600. Best Metrics: (0.050419186178346474, 0.03285596026490067, 0.04474994045990687)
2026-05-24 13:33:10,890 - optuna.study.study - INFO - Trial 273 finished with values: [0.050419186178346474, 0.03285596026490067, 0.04474994045990687] and parameters: {'n_layers': 1, 'embedding_dim': 96, 'lr': 0.004235289187226827, 'lambda_val': 0.013337952832619572, 'batch_size': 1787, 'optimizer': 'Adam'}.
2026-05-24 13:33:25,665 - experiment_functions - INFO - Early stopping at epoch 1200. Best Metrics: (0.058819507728594435, 0.035504966887417215, 0.05169612244254042)
2026-05-24 13:33:26,309 - optuna.study.study - INFO - Trial 274 finished with values: [0.058819507728594435, 0.035504966887417215, 0.05169612244254042] and parameters: {'n_layers': 1, 'embedding_dim': 256, 'lr': 0.0007414662359934248, 'lambda_val': 3.7081154785958387e-06, 'batch_size': 1397, 'optimizer': 'Adam'}.
2026-05-24 13:33:41,244 - experiment_functions - INFO - Early stopping at epoch 1350. Best Metrics: (0.06272371633916196, 0.03674668874172185, 0.05587124308119838)
2026-05-24 13:33:41,461 - optuna.study.study - INFO - Trial 275 finished with values: [0.06272371633916196, 0.03674668874172185, 0.05587124308119838] and parameters: {'n_layers': 1, 'embedding_dim': 32, 'lr': 0.000684293575282855, 'lambda_val': 0.0006796337932014016, 'batch_size': 2525, 'optimizer': 'Adam'}.
2026-05-24 13:33:57,052 - experiment_functions - INFO - Early stopping at epoch 1400. Best Metrics: (0.059306614322855056, 0.0361341059602649, 0.051938668646836106)
2026-05-24 13:33:57,815 - optuna.study.study - INFO - Trial 276 finished with values: [0.059306614322855056, 0.0361341059602649, 0.051938668646836106] and parameters: {'n_layers': 1, 'embedding_dim': 96, 'lr': 0.000684293575282855, 'lambda_val': 0.0005140602214325691, 'batch_size': 1315, 'optimizer': 'Adam'}.
2026-05-24 13:34:05,111 - experiment_functions - INFO - Early stopping at epoch 600. Best Metrics: (0.05970894277647175, 0.035447019867549674, 0.05310630082990398)
2026-05-24 13:34:05,201 - optuna.study.study - INFO - Trial 277 finished with values: [0.05970894277647175, 0.035447019867549674, 0.05310630082990398] and parameters: {'n_layers': 1, 'embedding_dim': 96, 'lr': 0.003407247220990805, 'lambda_val': 0.0023715399953398147, 'batch_size': 2016, 'optimizer': 'Adam'}.
2026-05-24 13:34:10,831 - experiment_functions - INFO - Early stopping at epoch 500. Best Metrics: (0.0051806275978758184, 0.004271523178807947, 0.0052606124580331926)
2026-05-24 13:34:11,587 - optuna.study.study - INFO - Trial 278 finished with values: [0.0051806275978758184, 0.004271523178807947, 0.0052606124580331926] and parameters: {'n_layers': 1, 'embedding_dim': 96, 'lr': 0.0005846659139515835, 'lambda_val': 0.0018241216708581335, 'batch_size': 1315, 'optimizer': 'SGD'}.
2026-05-24 13:34:30,436 - experiment_functions - INFO - Early stopping at epoch 1700. Best Metrics: (0.06014362061390408, 0.0363658940397351, 0.05237512458481028)
2026-05-24 13:34:30,798 - optuna.study.study - INFO - Trial 279 finished with values: [0.06014362061390408, 0.0363658940397351, 0.05237512458481028] and parameters: {'n_layers': 1, 'embedding_dim': 96, 'lr': 0.0005846659139515835, 'lambda_val': 0.00018703403293765332, 'batch_size': 1315, 'optimizer': 'Adam'}.
2026-05-24 13:35:13,776 - optuna.study.study - INFO - Trial 280 finished with values: [0.03461482224031373, 0.02283112582781457, 0.03254396380744637] and parameters: {'n_layers': 1, 'embedding_dim': 96, 'lr': 0.00025114086435199304, 'lambda_val': 3.4355332572174856e-05, 'batch_size': 1315, 'optimizer': 'Adam'}.
2026-05-24 13:35:33,671 - experiment_functions - INFO - Early stopping at epoch 1750. Best Metrics: (0.06060989541801978, 0.035728476821192054, 0.05376996235892053)
2026-05-24 13:35:33,794 - optuna.study.study - INFO - Trial 281 finished with values: [0.06060989541801978, 0.035728476821192054, 0.05376996235892053] and parameters: {'n_layers': 1, 'embedding_dim': 96, 'lr': 0.0005684700494807055, 'lambda_val': 0.0006796337932014016, 'batch_size': 1315, 'optimizer': 'Adam'}.
2026-05-24 13:35:46,246 - experiment_functions - INFO - Early stopping at epoch 1050. Best Metrics: (0.057351615602988175, 0.03529801324503311, 0.050073780791282274)
2026-05-24 13:35:46,376 - optuna.study.study - INFO - Trial 282 finished with values: [0.057351615602988175, 0.03529801324503311, 0.050073780791282274] and parameters: {'n_layers': 1, 'embedding_dim': 96, 'lr': 0.000684293575282855, 'lambda_val': 2.662938714668246e-05, 'batch_size': 1844, 'optimizer': 'RMSprop'}.
2026-05-24 13:36:19,796 - experiment_functions - INFO - Early stopping at epoch 3000. Best Metrics: (0.06426444665561788, 0.038832781456953645, 0.056204947800768686)
2026-05-24 13:36:19,881 - optuna.study.study - INFO - Trial 283 finished with values: [0.06426444665561788, 0.038832781456953645, 0.056204947800768686] and parameters: {'n_layers': 1, 'embedding_dim': 96, 'lr': 0.0005846659139515835, 'lambda_val': 0.007383021531734565, 'batch_size': 563, 'optimizer': 'Adam'}.
2026-05-24 13:36:31,953 - experiment_functions - INFO - Early stopping at epoch 1000. Best Metrics: (0.060162647165659854, 0.03644039735099338, 0.051678225799517884)
2026-05-24 13:36:32,049 - optuna.study.study - INFO - Trial 284 finished with values: [0.060162647165659854, 0.03644039735099338, 0.051678225799517884] and parameters: {'n_layers': 1, 'embedding_dim': 96, 'lr': 0.0010726171040359252, 'lambda_val': 1.86097482550664e-06, 'batch_size': 1365, 'optimizer': 'Adam'}.
2026-05-24 13:36:38,773 - experiment_functions - INFO - Early stopping at epoch 600. Best Metrics: (0.06482022091705587, 0.038038079470198674, 0.05403547991137691)
2026-05-24 13:36:38,861 - optuna.study.study - INFO - Trial 285 finished with values: [0.06482022091705587, 0.038038079470198674, 0.05403547991137691] and parameters: {'n_layers': 1, 'embedding_dim': 64, 'lr': 0.003407247220990805, 'lambda_val': 0.033607690460835456, 'batch_size': 2016, 'optimizer': 'Adam'}.
2026-05-24 13:36:46,722 - experiment_functions - INFO - Early stopping at epoch 650. Best Metrics: (0.056571253587758226, 0.03426324503311258, 0.049659334981577846)
2026-05-24 13:36:46,821 - optuna.study.study - INFO - Trial 286 finished with values: [0.056571253587758226, 0.03426324503311258, 0.049659334981577846] and parameters: {'n_layers': 1, 'embedding_dim': 96, 'lr': 0.003407247220990805, 'lambda_val': 3.4355332572174856e-05, 'batch_size': 1315, 'optimizer': 'Adam'}.
2026-05-24 13:36:54,038 - experiment_functions - INFO - Early stopping at epoch 600. Best Metrics: (0.061665068113625196, 0.037889072847682115, 0.05258978389928671)
2026-05-24 13:36:54,484 - optuna.study.study - INFO - Trial 287 finished with values: [0.061665068113625196, 0.037889072847682115, 0.05258978389928671] and parameters: {'n_layers': 1, 'embedding_dim': 96, 'lr': 0.003407247220990805, 'lambda_val': 0.01668282228117847, 'batch_size': 2558, 'optimizer': 'Adam'}.
2026-05-24 13:37:00,370 - experiment_functions - INFO - Early stopping at epoch 500. Best Metrics: (0.005525104519152436, 0.004610927152317881, 0.00600180991920621)
2026-05-24 13:37:01,351 - optuna.study.study - INFO - Trial 288 finished with values: [0.005525104519152436, 0.004610927152317881, 0.00600180991920621] and parameters: {'n_layers': 1, 'embedding_dim': 96, 'lr': 0.004235289187226827, 'lambda_val': 2.662938714668246e-05, 'batch_size': 1315, 'optimizer': 'SGD'}.
2026-05-24 13:37:15,576 - experiment_functions - INFO - Early stopping at epoch 1250. Best Metrics: (0.06021274185071509, 0.03640728476821192, 0.052543076153263445)
2026-05-24 13:37:16,761 - optuna.study.study - INFO - Trial 289 finished with values: [0.06021274185071509, 0.03640728476821192, 0.052543076153263445] and parameters: {'n_layers': 1, 'embedding_dim': 96, 'lr': 0.0007414662359934248, 'lambda_val': 2.662938714668246e-05, 'batch_size': 1315, 'optimizer': 'Adam'}.
2026-05-24 13:37:29,670 - experiment_functions - INFO - Early stopping at epoch 1150. Best Metrics: (0.06136136216073198, 0.03622516556291391, 0.05324253013577345)
2026-05-24 13:37:29,765 - optuna.study.study - INFO - Trial 290 finished with values: [0.06136136216073198, 0.03622516556291391, 0.05324253013577345] and parameters: {'n_layers': 1, 'embedding_dim': 96, 'lr': 0.000684293575282855, 'lambda_val': 0.0006796337932014016, 'batch_size': 1917, 'optimizer': 'Adam'}.
2026-05-24 13:37:42,568 - experiment_functions - INFO - Early stopping at epoch 700. Best Metrics: (0.03584492854370425, 0.023733443708609272, 0.03309849215748446)
2026-05-24 13:37:43,742 - optuna.study.study - INFO - Trial 291 finished with values: [0.03584492854370425, 0.023733443708609272, 0.03309849215748446] and parameters: {'n_layers': 4, 'embedding_dim': 96, 'lr': 0.000684293575282855, 'lambda_val': 2.662938714668246e-05, 'batch_size': 1844, 'optimizer': 'Adam'}.
2026-05-24 13:37:51,651 - experiment_functions - INFO - Early stopping at epoch 650. Best Metrics: (0.061242001789818, 0.03701158940397351, 0.053690693748960044)
2026-05-24 13:37:51,746 - optuna.study.study - INFO - Trial 292 finished with values: [0.061242001789818, 0.03701158940397351, 0.053690693748960044] and parameters: {'n_layers': 1, 'embedding_dim': 96, 'lr': 0.003407247220990805, 'lambda_val': 0.0012664724424904699, 'batch_size': 1081, 'optimizer': 'Adam'}.
2026-05-24 13:37:58,989 - experiment_functions - INFO - Early stopping at epoch 600. Best Metrics: (0.052533565705900655, 0.03334437086092715, 0.046305420307199134)
2026-05-24 13:37:59,088 - optuna.study.study - INFO - Trial 293 finished with values: [0.052533565705900655, 0.03334437086092715, 0.046305420307199134] and parameters: {'n_layers': 1, 'embedding_dim': 96, 'lr': 0.0050557762652770595, 'lambda_val': 0.00707067081753529, 'batch_size': 1315, 'optimizer': 'Adam'}.
2026-05-24 13:38:14,647 - experiment_functions - INFO - Early stopping at epoch 1450. Best Metrics: (0.07272899964319149, 0.04151490066225166, 0.061104451910358744)
2026-05-24 13:38:14,777 - optuna.study.study - INFO - Trial 294 finished with values: [0.07272899964319149, 0.04151490066225166, 0.061104451910358744] and parameters: {'n_layers': 1, 'embedding_dim': 32, 'lr': 0.000684293575282855, 'lambda_val': 0.02843248434954034, 'batch_size': 563, 'optimizer': 'RMSprop'}.
2026-05-24 13:38:35,496 - experiment_functions - INFO - Early stopping at epoch 2000. Best Metrics: (0.01604388579582034, 0.015538079470198677, 0.01884330308919873)
2026-05-24 13:38:36,098 - optuna.study.study - INFO - Trial 295 finished with values: [0.01604388579582034, 0.015538079470198677, 0.01884330308919873] and parameters: {'n_layers': 1, 'embedding_dim': 96, 'lr': 0.0050557762652770595, 'lambda_val': 0.021232440344085574, 'batch_size': 1315, 'optimizer': 'RMSprop'}.
2026-05-24 13:39:02,609 - experiment_functions - INFO - Early stopping at epoch 2400. Best Metrics: (0.05798054445116908, 0.034801324503311255, 0.05190640525948876)
