2026-05-24 12:05:57,340 - optuna.study.study - INFO - Trial 262 finished with values: [0.042595670321355555, 0.0279635761589404, 0.04006228159898528] and parameters: {'n_layers': 3, 'embedding_dim': 32, 'lr': 0.0004379727673244972, 'lambda_val': 3.075785895847098e-05, 'batch_size': 1297, 'optimizer': 'Adam'}.
2026-05-24 12:06:08,275 - experiment_functions - INFO - Early stopping at epoch 850. Best Metrics: (0.04570979513220231, 0.0289569536423841, 0.04274508334915687)
2026-05-24 12:06:09,195 - optuna.study.study - INFO - Trial 263 finished with values: [0.04570979513220231, 0.0289569536423841, 0.04274508334915687] and parameters: {'n_layers': 3, 'embedding_dim': 64, 'lr': 0.0005910069120800205, 'lambda_val': 8.876623948407677e-06, 'batch_size': 1221, 'optimizer': 'Adam'}.
2026-05-24 12:06:16,167 - experiment_functions - INFO - Early stopping at epoch 550. Best Metrics: (0.046945984701712504, 0.02879139072847682, 0.04130058143889759)
2026-05-24 12:06:16,255 - optuna.study.study - INFO - Trial 264 finished with values: [0.046945984701712504, 0.02879139072847682, 0.04130058143889759] and parameters: {'n_layers': 2, 'embedding_dim': 64, 'lr': 0.004627149516425897, 'lambda_val': 0.00021158087063845118, 'batch_size': 944, 'optimizer': 'Adam'}.
2026-05-24 12:06:38,435 - experiment_functions - INFO - Early stopping at epoch 1900. Best Metrics: (0.0637487242329966, 0.037889072847682115, 0.056579716010508194)
2026-05-24 12:06:38,522 - optuna.study.study - INFO - Trial 265 finished with values: [0.0637487242329966, 0.037889072847682115, 0.056579716010508194] and parameters: {'n_layers': 1, 'embedding_dim': 128, 'lr': 0.0005910069120800205, 'lambda_val': 4.175559758749336e-06, 'batch_size': 831, 'optimizer': 'RMSprop'}.
2026-05-24 12:06:47,223 - experiment_functions - INFO - Early stopping at epoch 650. Best Metrics: (0.04612899660744549, 0.02871688741721854, 0.04214857128999471)
2026-05-24 12:06:47,729 - optuna.study.study - INFO - Trial 266 finished with values: [0.04612899660744549, 0.02871688741721854, 0.04214857128999471] and parameters: {'n_layers': 2, 'embedding_dim': 128, 'lr': 0.0005910069120800205, 'lambda_val': 0.00024416758921277655, 'batch_size': 2580, 'optimizer': 'RMSprop'}.
2026-05-24 12:06:54,990 - experiment_functions - INFO - Early stopping at epoch 550. Best Metrics: (0.024248328932677865, 0.019288079470198675, 0.023574058268947002)
2026-05-24 12:06:55,061 - optuna.study.study - INFO - Trial 267 finished with values: [0.024248328932677865, 0.019288079470198675, 0.023574058268947002] and parameters: {'n_layers': 4, 'embedding_dim': 96, 'lr': 0.004627149516425897, 'lambda_val': 8.876623948407677e-06, 'batch_size': 1541, 'optimizer': 'Adam'}.
2026-05-24 12:07:03,590 - experiment_functions - INFO - Early stopping at epoch 650. Best Metrics: (0.052009090810375275, 0.03373344370860927, 0.04681701170075286)
2026-05-24 12:07:04,073 - optuna.study.study - INFO - Trial 268 finished with values: [0.052009090810375275, 0.03373344370860927, 0.04681701170075286] and parameters: {'n_layers': 1, 'embedding_dim': 256, 'lr': 0.002147597357064978, 'lambda_val': 0.005696225579131193, 'batch_size': 1961, 'optimizer': 'Adam'}.
2026-05-24 12:07:12,215 - experiment_functions - INFO - Early stopping at epoch 550. Best Metrics: (0.029850773107898278, 0.021274834437086092, 0.0296305096428566)
2026-05-24 12:07:13,272 - optuna.study.study - INFO - Trial 269 finished with values: [0.029850773107898278, 0.021274834437086092, 0.0296305096428566] and parameters: {'n_layers': 2, 'embedding_dim': 256, 'lr': 0.0063358656325518715, 'lambda_val': 0.00024416758921277655, 'batch_size': 2105, 'optimizer': 'Adam'}.
2026-05-24 12:07:26,200 - experiment_functions - INFO - Early stopping at epoch 1200. Best Metrics: (0.005417399968190356, 0.004470198675496689, 0.005564142148839704)
2026-05-24 12:07:26,276 - optuna.study.study - INFO - Trial 270 finished with values: [0.005417399968190356, 0.004470198675496689, 0.005564142148839704] and parameters: {'n_layers': 1, 'embedding_dim': 96, 'lr': 1.784093237292151e-05, 'lambda_val': 4.175559758749336e-06, 'batch_size': 775, 'optimizer': 'Adam'}.
2026-05-24 12:07:34,531 - experiment_functions - INFO - Early stopping at epoch 550. Best Metrics: (0.05739681553212422, 0.03518211920529801, 0.05163703232934327)
2026-05-24 12:07:34,624 - optuna.study.study - INFO - Trial 271 finished with values: [0.05739681553212422, 0.03518211920529801, 0.05163703232934327] and parameters: {'n_layers': 1, 'embedding_dim': 128, 'lr': 0.007734430860530913, 'lambda_val': 0.0018912353521433405, 'batch_size': 2294, 'optimizer': 'Adam'}.
2026-05-24 12:07:51,300 - experiment_functions - INFO - Early stopping at epoch 1350. Best Metrics: (0.060374681553624666, 0.036134105960264895, 0.05221047801712537)
2026-05-24 12:07:52,048 - optuna.study.study - INFO - Trial 272 finished with values: [0.060374681553624666, 0.036134105960264895, 0.05221047801712537] and parameters: {'n_layers': 1, 'embedding_dim': 64, 'lr': 0.0005910069120800205, 'lambda_val': 0.00024416758921277655, 'batch_size': 2356, 'optimizer': 'Adam'}.
2026-05-24 12:08:01,128 - experiment_functions - INFO - Early stopping at epoch 700. Best Metrics: (0.020760655141353255, 0.01524834437086093, 0.020573996508843402)
2026-05-24 12:08:01,220 - optuna.study.study - INFO - Trial 273 finished with values: [0.020760655141353255, 0.01524834437086093, 0.020573996508843402] and parameters: {'n_layers': 1, 'embedding_dim': 96, 'lr': 0.015166163184940526, 'lambda_val': 2.666704909740151e-06, 'batch_size': 4031, 'optimizer': 'RMSprop'}.
2026-05-24 12:08:08,367 - experiment_functions - INFO - Early stopping at epoch 550. Best Metrics: (0.02657801148559611, 0.020331125827814572, 0.02659664563459294)
2026-05-24 12:08:08,472 - optuna.study.study - INFO - Trial 274 finished with values: [0.02657801148559611, 0.020331125827814572, 0.02659664563459294] and parameters: {'n_layers': 1, 'embedding_dim': 32, 'lr': 0.024560930672172684, 'lambda_val': 3.075785895847098e-05, 'batch_size': 1116, 'optimizer': 'Adam'}.
2026-05-24 12:08:17,551 - experiment_functions - INFO - Early stopping at epoch 550. Best Metrics: (0.04729378727506493, 0.029867549668874168, 0.04269534979591008)
2026-05-24 12:08:17,952 - optuna.study.study - INFO - Trial 275 finished with values: [0.04729378727506493, 0.029867549668874168, 0.04269534979591008] and parameters: {'n_layers': 1, 'embedding_dim': 128, 'lr': 0.002147597357064978, 'lambda_val': 0.0001303671050452136, 'batch_size': 2361, 'optimizer': 'RMSprop'}.
2026-05-24 12:08:59,188 - optuna.study.study - INFO - Trial 276 finished with values: [0.006718887242920884, 0.00544701986754967, 0.006923250756952542] and parameters: {'n_layers': 2, 'embedding_dim': 64, 'lr': 6.702160117593154e-05, 'lambda_val': 3.881058900880862e-05, 'batch_size': 1299, 'optimizer': 'Adam'}.
2026-05-24 12:09:05,879 - experiment_functions - INFO - Early stopping at epoch 550. Best Metrics: (0.04117330038015567, 0.02682119205298013, 0.037149817534012454)
2026-05-24 12:09:06,324 - optuna.study.study - INFO - Trial 277 finished with values: [0.04117330038015567, 0.02682119205298013, 0.037149817534012454] and parameters: {'n_layers': 1, 'embedding_dim': 32, 'lr': 0.007734430860530913, 'lambda_val': 0.01723991176853604, 'batch_size': 1113, 'optimizer': 'Adam'}.
2026-05-24 12:09:54,021 - optuna.study.study - INFO - Trial 278 finished with values: [0.02440887733584865, 0.017235099337748347, 0.02338435496560233] and parameters: {'n_layers': 2, 'embedding_dim': 128, 'lr': 0.0036540666504326523, 'lambda_val': 0.004059133939758747, 'batch_size': 3690, 'optimizer': 'RMSprop'}.
2026-05-24 12:10:01,368 - experiment_functions - INFO - Early stopping at epoch 550. Best Metrics: (0.01627796083954636, 0.01375, 0.01721465273360574)
2026-05-24 12:10:01,501 - optuna.study.study - INFO - Trial 279 finished with values: [0.01627796083954636, 0.01375, 0.01721465273360574] and parameters: {'n_layers': 3, 'embedding_dim': 96, 'lr': 0.007734430860530913, 'lambda_val': 4.751284978770795e-06, 'batch_size': 1299, 'optimizer': 'Adam'}.
2026-05-24 12:10:08,339 - experiment_functions - INFO - Early stopping at epoch 550. Best Metrics: (0.05246918053432772, 0.03234271523178808, 0.04671247951340348)
2026-05-24 12:10:08,415 - optuna.study.study - INFO - Trial 280 finished with values: [0.05246918053432772, 0.03234271523178808, 0.04671247951340348] and parameters: {'n_layers': 1, 'embedding_dim': 64, 'lr': 0.0020262506885158522, 'lambda_val': 0.00024416758921277655, 'batch_size': 2188, 'optimizer': 'RMSprop'}.
2026-05-24 12:10:18,004 - experiment_functions - INFO - Early stopping at epoch 650. Best Metrics: (0.04874413014100628, 0.03131622516556292, 0.04363612634983223)
2026-05-24 12:10:19,437 - optuna.study.study - INFO - Trial 281 finished with values: [0.04874413014100628, 0.03131622516556292, 0.04363612634983223] and parameters: {'n_layers': 2, 'embedding_dim': 256, 'lr': 0.0012566980437762067, 'lambda_val': 0.0018912353521433405, 'batch_size': 2294, 'optimizer': 'Adam'}.
2026-05-24 12:11:01,401 - optuna.study.study - INFO - Trial 282 finished with values: [0.005646584424284759, 0.004718543046357616, 0.006106017621929348] and parameters: {'n_layers': 2, 'embedding_dim': 96, 'lr': 6.698303386334303e-05, 'lambda_val': 0.0001303671050452136, 'batch_size': 775, 'optimizer': 'Adam'}.
2026-05-24 12:11:10,198 - experiment_functions - INFO - Early stopping at epoch 650. Best Metrics: (0.056548291373851575, 0.03413079470198675, 0.05028606907277158)
2026-05-24 12:11:10,828 - optuna.study.study - INFO - Trial 283 finished with values: [0.056548291373851575, 0.03413079470198675, 0.05028606907277158] and parameters: {'n_layers': 1, 'embedding_dim': 256, 'lr': 0.0020262506885158522, 'lambda_val': 0.00024416758921277655, 'batch_size': 2188, 'optimizer': 'Adam'}.
2026-05-24 12:11:17,746 - experiment_functions - INFO - Early stopping at epoch 550. Best Metrics: (0.05100360013733977, 0.031713576158940396, 0.04681144417798253)
2026-05-24 12:11:18,894 - optuna.study.study - INFO - Trial 284 finished with values: [0.05100360013733977, 0.031713576158940396, 0.04681144417798253] and parameters: {'n_layers': 2, 'embedding_dim': 32, 'lr': 0.007734430860530913, 'lambda_val': 0.00021158087063845118, 'batch_size': 2105, 'optimizer': 'Adam'}.
2026-05-24 12:11:26,618 - experiment_functions - INFO - Early stopping at epoch 600. Best Metrics: (0.048350562805332675, 0.0316887417218543, 0.044551291055126355)
2026-05-24 12:11:26,716 - optuna.study.study - INFO - Trial 285 finished with values: [0.048350562805332675, 0.0316887417218543, 0.044551291055126355] and parameters: {'n_layers': 1, 'embedding_dim': 96, 'lr': 0.002147597357064978, 'lambda_val': 3.931579079039209e-05, 'batch_size': 775, 'optimizer': 'RMSprop'}.
2026-05-24 12:12:00,148 - experiment_functions - INFO - Early stopping at epoch 3050. Best Metrics: (0.0638720240567269, 0.03789735099337749, 0.056323026877437676)
2026-05-24 12:12:00,233 - optuna.study.study - INFO - Trial 286 finished with values: [0.0638720240567269, 0.03789735099337749, 0.056323026877437676] and parameters: {'n_layers': 1, 'embedding_dim': 64, 'lr': 0.0005910069120800205, 'lambda_val': 0.0009872055834063286, 'batch_size': 831, 'optimizer': 'Adam'}.
2026-05-24 12:12:27,621 - experiment_functions - INFO - Early stopping at epoch 2450. Best Metrics: (0.060140252316152394, 0.03678807947019867, 0.053981671052652246)
2026-05-24 12:12:27,717 - optuna.study.study - INFO - Trial 287 finished with values: [0.060140252316152394, 0.03678807947019867, 0.053981671052652246] and parameters: {'n_layers': 1, 'embedding_dim': 64, 'lr': 0.00041559380565905414, 'lambda_val': 0.00024416758921277655, 'batch_size': 2356, 'optimizer': 'RMSprop'}.
2026-05-24 12:12:42,684 - experiment_functions - INFO - Early stopping at epoch 1250. Best Metrics: (0.05972820901104749, 0.034776490066225164, 0.051945162066897324)
2026-05-24 12:12:42,770 - optuna.study.study - INFO - Trial 288 finished with values: [0.05972820901104749, 0.034776490066225164, 0.051945162066897324] and parameters: {'n_layers': 2, 'embedding_dim': 64, 'lr': 0.0004379727673244972, 'lambda_val': 7.708365059245802e-06, 'batch_size': 1299, 'optimizer': 'RMSprop'}.
2026-05-24 12:12:50,279 - experiment_functions - INFO - Early stopping at epoch 600. Best Metrics: (0.05158250296481619, 0.03237582781456954, 0.04655890292028262)
2026-05-24 12:12:50,389 - optuna.study.study - INFO - Trial 289 finished with values: [0.05158250296481619, 0.03237582781456954, 0.04655890292028262] and parameters: {'n_layers': 1, 'embedding_dim': 64, 'lr': 0.002147597357064978, 'lambda_val': 4.175559758749336e-06, 'batch_size': 1116, 'optimizer': 'RMSprop'}.
2026-05-24 12:12:57,592 - experiment_functions - INFO - Early stopping at epoch 550. Best Metrics: (0.044643289347414294, 0.028907284768211923, 0.039565824366664455)
2026-05-24 12:12:57,680 - optuna.study.study - INFO - Trial 290 finished with values: [0.044643289347414294, 0.028907284768211923, 0.039565824366664455] and parameters: {'n_layers': 2, 'embedding_dim': 128, 'lr': 0.00666600922301573, 'lambda_val': 8.876623948407677e-06, 'batch_size': 944, 'optimizer': 'Adam'}.
2026-05-24 12:13:04,236 - experiment_functions - INFO - Early stopping at epoch 550. Best Metrics: (0.011884969828751766, 0.00984271523178808, 0.012655719831024967)
2026-05-24 12:13:04,718 - optuna.study.study - INFO - Trial 291 finished with values: [0.011884969828751766, 0.00984271523178808, 0.012655719831024967] and parameters: {'n_layers': 1, 'embedding_dim': 64, 'lr': 0.09149669772310508, 'lambda_val': 1.770106371826926e-06, 'batch_size': 1961, 'optimizer': 'Adam'}.
2026-05-24 12:13:11,602 - experiment_functions - INFO - Early stopping at epoch 550. Best Metrics: (0.02255344881704175, 0.017541390728476824, 0.022331778664090987)
2026-05-24 12:13:11,692 - optuna.study.study - INFO - Trial 292 finished with values: [0.02255344881704175, 0.017541390728476824, 0.022331778664090987] and parameters: {'n_layers': 2, 'embedding_dim': 32, 'lr': 0.016482624641343972, 'lambda_val': 6.229045175154034e-06, 'batch_size': 908, 'optimizer': 'Adam'}.
2026-05-24 12:13:21,155 - experiment_functions - INFO - Early stopping at epoch 550. Best Metrics: (0.0202282366292569, 0.015844370860927152, 0.01921655188063807)
2026-05-24 12:13:21,245 - optuna.study.study - INFO - Trial 293 finished with values: [0.0202282366292569, 0.015844370860927152, 0.01921655188063807] and parameters: {'n_layers': 4, 'embedding_dim': 256, 'lr': 0.003957711816456887, 'lambda_val': 3.075785895847098e-05, 'batch_size': 1116, 'optimizer': 'Adam'}.
2026-05-24 12:13:30,395 - experiment_functions - INFO - Early stopping at epoch 650. Best Metrics: (0.05277457676051808, 0.031539735099337746, 0.04685483614112626)
2026-05-24 12:13:31,046 - optuna.study.study - INFO - Trial 294 finished with values: [0.05277457676051808, 0.031539735099337746, 0.04685483614112626] and parameters: {'n_layers': 2, 'embedding_dim': 96, 'lr': 0.0012566980437762067, 'lambda_val': 0.00024416758921277655, 'batch_size': 2294, 'optimizer': 'Adam'}.
2026-05-24 12:14:15,342 - optuna.study.study - INFO - Trial 295 finished with values: [0.062164886505964835, 0.03662251655629139, 0.053242837331106574] and parameters: {'n_layers': 1, 'embedding_dim': 96, 'lr': 0.0004379727673244972, 'lambda_val': 3.075785895847098e-05, 'batch_size': 1116, 'optimizer': 'Adam'}.
2026-05-24 12:14:24,420 - experiment_functions - INFO - Early stopping at epoch 600. Best Metrics: (0.04287025349229736, 0.02870033112582782, 0.03953427322925589)
2026-05-24 12:14:24,772 - optuna.study.study - INFO - Trial 296 finished with values: [0.04287025349229736, 0.02870033112582782, 0.03953427322925589] and parameters: {'n_layers': 2, 'embedding_dim': 256, 'lr': 0.002147597357064978, 'lambda_val': 0.00024416758921277655, 'batch_size': 2551, 'optimizer': 'Adam'}.
2026-05-24 12:14:36,296 - experiment_functions - INFO - Early stopping at epoch 900. Best Metrics: (0.04198120777204782, 0.027317880794701987, 0.0393587995259698)
2026-05-24 12:14:36,729 - optuna.study.study - INFO - Trial 297 finished with values: [0.04198120777204782, 0.027317880794701987, 0.0393587995259698] and parameters: {'n_layers': 3, 'embedding_dim': 32, 'lr': 0.0005910069120800205, 'lambda_val': 0.004059133939758747, 'batch_size': 1299, 'optimizer': 'Adam'}.
2026-05-24 12:14:50,593 - experiment_functions - INFO - Early stopping at epoch 1100. Best Metrics: (0.05423190698604027, 0.03325331125827815, 0.04727143931811357)
2026-05-24 12:14:51,373 - optuna.study.study - INFO - Trial 298 finished with values: [0.05423190698604027, 0.03325331125827815, 0.04727143931811357] and parameters: {'n_layers': 2, 'embedding_dim': 64, 'lr': 0.0005910069120800205, 'lambda_val': 3.075785895847098e-05, 'batch_size': 1116, 'optimizer': 'Adam'}.
2026-05-24 12:14:58,643 - experiment_functions - INFO - Early stopping at epoch 550. Best Metrics: (0.04566115807981103, 0.027955298013245037, 0.03966503327028526)
2026-05-24 12:14:59,715 - optuna.study.study - INFO - Trial 299 finished with values: [0.04566115807981103, 0.027955298013245037, 0.03966503327028526] and parameters: {'n_layers': 1, 'embedding_dim': 64, 'lr': 0.007734430860530913, 'lambda_val': 0.01723991176853604, 'batch_size': 1036, 'optimizer': 'Adam'}.
2026-05-24 12:14:59,730 - root - INFO - Selected Trial 220 based on Max ndcg: 0.0584
2026-05-24 12:14:59,730 - root - INFO - Associated Recall: 0.0672
2026-05-24 12:14:59,730 - experiment_functions - INFO - Training the best model ... for e_1M_1c1dcs_rand3
2026-05-24 12:15:20,300 - experiment_functions - INFO - Early stopping at epoch 1750. Best Metrics: (0.0632943427135889, 0.03777317880794702, 0.055780357914273694)
2026-05-24 12:15:21,367 - root - INFO -   **** Training e_1M_1c1dcs_rand4
2026-05-24 12:15:21,420 - root - INFO -   **** Getting 190231/805443 random edges
2026-05-24 12:15:21,567 - optuna.storages._rdb.storage - INFO - A new study created in RDB with name: Study_e_1M_1c1dcs_rand4
2026-05-24 12:15:31,430 - experiment_functions - INFO - Early stopping at epoch 850. Best Metrics: (0.005342249959430606, 0.004197019867549669, 0.0053281220633832425)
2026-05-24 12:15:31,529 - optuna.study.study - INFO - Trial 0 finished with values: [0.005342249959430606, 0.004197019867549669, 0.0053281220633832425] and parameters: {'n_layers': 1, 'embedding_dim': 32, 'lr': 2.613333654868152e-05, 'lambda_val': 0.0002960621156609557, 'batch_size': 684, 'optimizer': 'RMSprop'}.
2026-05-24 12:15:37,788 - experiment_functions - INFO - Early stopping at epoch 500. Best Metrics: (0.0055114055005837485, 0.004478476821192054, 0.005474941608914392)
2026-05-24 12:15:38,113 - optuna.study.study - INFO - Trial 1 finished with values: [0.0055114055005837485, 0.004478476821192054, 0.005474941608914392] and parameters: {'n_layers': 1, 'embedding_dim': 32, 'lr': 0.001091154683369008, 'lambda_val': 0.0004202822487430932, 'batch_size': 3350, 'optimizer': 'SGD'}.
2026-05-24 12:15:45,067 - experiment_functions - INFO - Early stopping at epoch 500. Best Metrics: (0.0057308706037158316, 0.00462748344370861, 0.0060619177290142535)
2026-05-24 12:15:45,649 - optuna.study.study - INFO - Trial 2 finished with values: [0.0057308706037158316, 0.00462748344370861, 0.0060619177290142535] and parameters: {'n_layers': 4, 'embedding_dim': 64, 'lr': 0.0003842758751904418, 'lambda_val': 0.09743177928614061, 'batch_size': 1587, 'optimizer': 'Adam'}.
2026-05-24 12:15:55,202 - experiment_functions - INFO - Early stopping at epoch 600. Best Metrics: (0.00510146311095675, 0.004370860927152318, 0.005487144363774214)
2026-05-24 12:15:56,003 - optuna.study.study - INFO - Trial 3 finished with values: [0.00510146311095675, 0.004370860927152318, 0.005487144363774214] and parameters: {'n_layers': 3, 'embedding_dim': 256, 'lr': 0.09937340805133851, 'lambda_val': 0.010554593425546242, 'batch_size': 1714, 'optimizer': 'SGD'}.
2026-05-24 12:16:06,350 - experiment_functions - INFO - Early stopping at epoch 500. Best Metrics: (0.0051328485979156005, 0.004486754966887417, 0.005486359047276184)
2026-05-24 12:16:06,771 - optuna.study.study - INFO - Trial 4 finished with values: [0.0051328485979156005, 0.004486754966887417, 0.005486359047276184] and parameters: {'n_layers': 3, 'embedding_dim': 32, 'lr': 0.002895546332210861, 'lambda_val': 1.068408507472861e-06, 'batch_size': 1952, 'optimizer': 'SGD'}.
2026-05-24 12:17:02,766 - optuna.study.study - INFO - Trial 5 finished with values: [0.04590852417494041, 0.02830298013245033, 0.041071637663973946] and parameters: {'n_layers': 4, 'embedding_dim': 64, 'lr': 0.00015112824887092085, 'lambda_val': 3.4355332572174856e-05, 'batch_size': 1022, 'optimizer': 'Adam'}.
2026-05-24 12:17:09,151 - experiment_functions - INFO - Early stopping at epoch 500. Best Metrics: (0.004920493107894174, 0.004180463576158941, 0.005083281623231518)
2026-05-24 12:17:09,249 - optuna.study.study - INFO - Trial 6 finished with values: [0.004920493107894174, 0.004180463576158941, 0.005083281623231518] and parameters: {'n_layers': 2, 'embedding_dim': 128, 'lr': 7.598326549962574e-05, 'lambda_val': 2.2008741258871497e-05, 'batch_size': 1676, 'optimizer': 'SGD'}.
2026-05-24 12:17:17,240 - experiment_functions - INFO - Early stopping at epoch 550. Best Metrics: (0.02798419087965253, 0.021117549668874174, 0.026616948263870815)
2026-05-24 12:17:17,834 - optuna.study.study - INFO - Trial 7 finished with values: [0.02798419087965253, 0.021117549668874174, 0.026616948263870815] and parameters: {'n_layers': 2, 'embedding_dim': 256, 'lr': 0.0064837360922671665, 'lambda_val': 1.6384022903021963e-06, 'batch_size': 1081, 'optimizer': 'Adam'}.
2026-05-24 12:17:24,771 - experiment_functions - INFO - Early stopping at epoch 500. Best Metrics: (0.004850985846680073, 0.0040562913907284765, 0.005094644366155815)
