2026-05-24 02:21:34,767 - optuna.study.study - INFO - Trial 239 finished with values: [0.02332092596942044, 0.01765728476821192, 0.024073895171856288] and parameters: {'n_layers': 3, 'embedding_dim': 96, 'lr': 0.0005233015481570266, 'lambda_val': 1.858625399381744e-05, 'batch_size': 652, 'optimizer': 'Adam'}.
2026-05-24 02:21:47,651 - experiment_functions - INFO - Early stopping at epoch 1250. Best Metrics: (0.018375749913627823, 0.013402317880794703, 0.01880155186470468)
2026-05-24 02:21:47,750 - optuna.study.study - INFO - Trial 240 finished with values: [0.018375749913627823, 0.013402317880794703, 0.01880155186470468] and parameters: {'n_layers': 1, 'embedding_dim': 64, 'lr': 0.0005233015481570266, 'lambda_val': 0.0009443756499535536, 'batch_size': 1888, 'optimizer': 'Adam'}.
2026-05-24 02:21:54,729 - experiment_functions - INFO - Early stopping at epoch 600. Best Metrics: (0.020860114852171287, 0.016415562913907285, 0.022141857657363092)
2026-05-24 02:21:54,814 - optuna.study.study - INFO - Trial 241 finished with values: [0.020860114852171287, 0.016415562913907285, 0.022141857657363092] and parameters: {'n_layers': 4, 'embedding_dim': 96, 'lr': 0.003175767497275054, 'lambda_val': 0.0009443756499535536, 'batch_size': 664, 'optimizer': 'Adam'}.
2026-05-24 02:22:02,281 - experiment_functions - INFO - Early stopping at epoch 700. Best Metrics: (0.004604411034383241, 0.003998344370860928, 0.004959946068766829)
2026-05-24 02:22:02,380 - optuna.study.study - INFO - Trial 242 finished with values: [0.004604411034383241, 0.003998344370860928, 0.004959946068766829] and parameters: {'n_layers': 4, 'embedding_dim': 32, 'lr': 0.0003847621589190308, 'lambda_val': 0.0008187140617702526, 'batch_size': 652, 'optimizer': 'SGD'}.
2026-05-24 02:22:23,941 - experiment_functions - INFO - Early stopping at epoch 2100. Best Metrics: (0.019153603943046618, 0.015115894039735102, 0.020058004344197973)
2026-05-24 02:22:24,050 - optuna.study.study - INFO - Trial 243 finished with values: [0.019153603943046618, 0.015115894039735102, 0.020058004344197973] and parameters: {'n_layers': 4, 'embedding_dim': 64, 'lr': 0.0001986105443631555, 'lambda_val': 0.0009443756499535536, 'batch_size': 3908, 'optimizer': 'Adam'}.
2026-05-24 02:22:37,056 - experiment_functions - INFO - Early stopping at epoch 1250. Best Metrics: (0.018791698079026156, 0.013799668874172185, 0.01917070003115115)
2026-05-24 02:22:37,145 - optuna.study.study - INFO - Trial 244 finished with values: [0.018791698079026156, 0.013799668874172185, 0.01917070003115115] and parameters: {'n_layers': 2, 'embedding_dim': 96, 'lr': 0.0005233015481570266, 'lambda_val': 1.858625399381744e-05, 'batch_size': 1343, 'optimizer': 'Adam'}.
2026-05-24 02:22:45,839 - experiment_functions - INFO - Early stopping at epoch 750. Best Metrics: (0.01930069658502595, 0.015604304635761589, 0.020172282883904564)
2026-05-24 02:22:46,674 - optuna.study.study - INFO - Trial 245 finished with values: [0.01930069658502595, 0.015604304635761589, 0.020172282883904564] and parameters: {'n_layers': 3, 'embedding_dim': 96, 'lr': 0.0007459913147507348, 'lambda_val': 0.0009443756499535536, 'batch_size': 1393, 'optimizer': 'RMSprop'}.
2026-05-24 02:22:52,169 - experiment_functions - INFO - Early stopping at epoch 500. Best Metrics: (0.005258761752293885, 0.004081125827814569, 0.005138465706366171)
2026-05-24 02:22:52,522 - optuna.study.study - INFO - Trial 246 finished with values: [0.005258761752293885, 0.004081125827814569, 0.005138465706366171] and parameters: {'n_layers': 1, 'embedding_dim': 96, 'lr': 0.0005233015481570266, 'lambda_val': 1.1741946550104087e-06, 'batch_size': 664, 'optimizer': 'SGD'}.
2026-05-24 02:23:32,430 - optuna.study.study - INFO - Trial 247 finished with values: [0.00622698581817216, 0.0047350993377483445, 0.006025476395851327] and parameters: {'n_layers': 4, 'embedding_dim': 64, 'lr': 4.432823695697189e-05, 'lambda_val': 0.006016678180825136, 'batch_size': 664, 'optimizer': 'Adam'}.
2026-05-24 02:24:15,058 - optuna.study.study - INFO - Trial 248 finished with values: [0.020997192708688554, 0.016258278145695363, 0.0213593818601313] and parameters: {'n_layers': 4, 'embedding_dim': 64, 'lr': 0.0001986105443631555, 'lambda_val': 1.1741946550104087e-06, 'batch_size': 847, 'optimizer': 'Adam'}.
2026-05-24 02:24:26,705 - experiment_functions - INFO - Early stopping at epoch 1050. Best Metrics: (0.01955598860651082, 0.014023178807947023, 0.019284917697610236)
2026-05-24 02:24:27,038 - optuna.study.study - INFO - Trial 249 finished with values: [0.01955598860651082, 0.014023178807947023, 0.019284917697610236] and parameters: {'n_layers': 2, 'embedding_dim': 64, 'lr': 0.0006783254829467676, 'lambda_val': 1.1741946550104087e-06, 'batch_size': 1661, 'optimizer': 'Adam'}.
2026-05-24 02:24:36,900 - experiment_functions - INFO - Early stopping at epoch 850. Best Metrics: (0.020947162100535554, 0.01665562913907285, 0.021638752803557298)
2026-05-24 02:24:37,000 - optuna.study.study - INFO - Trial 250 finished with values: [0.020947162100535554, 0.01665562913907285, 0.021638752803557298] and parameters: {'n_layers': 4, 'embedding_dim': 96, 'lr': 0.0005233015481570266, 'lambda_val': 0.00010466579371271554, 'batch_size': 1343, 'optimizer': 'RMSprop'}.
2026-05-24 02:25:17,787 - optuna.study.study - INFO - Trial 251 finished with values: [0.021560588089019575, 0.014950331125827814, 0.021690398676118494] and parameters: {'n_layers': 1, 'embedding_dim': 32, 'lr': 0.00042256050468704876, 'lambda_val': 1.1741946550104087e-06, 'batch_size': 567, 'optimizer': 'RMSprop'}.
2026-05-24 02:25:24,913 - experiment_functions - INFO - Early stopping at epoch 600. Best Metrics: (0.02132524328123306, 0.01722682119205298, 0.02301034290245032)
2026-05-24 02:25:25,315 - optuna.study.study - INFO - Trial 252 finished with values: [0.02132524328123306, 0.01722682119205298, 0.02301034290245032] and parameters: {'n_layers': 4, 'embedding_dim': 64, 'lr': 0.003175767497275054, 'lambda_val': 1.1741946550104087e-06, 'batch_size': 567, 'optimizer': 'Adam'}.
2026-05-24 02:25:46,480 - experiment_functions - INFO - Early stopping at epoch 1950. Best Metrics: (0.023403428015916095, 0.018228476821192052, 0.02451822666883576)
2026-05-24 02:25:47,079 - optuna.study.study - INFO - Trial 253 finished with values: [0.023403428015916095, 0.018228476821192052, 0.02451822666883576] and parameters: {'n_layers': 3, 'embedding_dim': 64, 'lr': 0.0005233015481570266, 'lambda_val': 0.0009443756499535536, 'batch_size': 664, 'optimizer': 'Adam'}.
2026-05-24 02:26:02,434 - experiment_functions - INFO - Early stopping at epoch 1400. Best Metrics: (0.01906489267447791, 0.01353476821192053, 0.01890209722050054)
2026-05-24 02:26:03,273 - optuna.study.study - INFO - Trial 254 finished with values: [0.01906489267447791, 0.01353476821192053, 0.01890209722050054] and parameters: {'n_layers': 2, 'embedding_dim': 32, 'lr': 0.0005233015481570266, 'lambda_val': 0.0009443756499535536, 'batch_size': 3279, 'optimizer': 'Adam'}.
2026-05-24 02:26:11,227 - experiment_functions - INFO - Early stopping at epoch 600. Best Metrics: (0.01894638021638859, 0.014097682119205299, 0.018984938295916617)
2026-05-24 02:26:11,322 - optuna.study.study - INFO - Trial 255 finished with values: [0.01894638021638859, 0.014097682119205299, 0.018984938295916617] and parameters: {'n_layers': 3, 'embedding_dim': 256, 'lr': 0.003175767497275054, 'lambda_val': 2.582067375745636e-06, 'batch_size': 567, 'optimizer': 'Adam'}.
2026-05-24 02:26:27,434 - experiment_functions - INFO - Early stopping at epoch 1450. Best Metrics: (0.02315452262989872, 0.017624172185430463, 0.023598101310749766)
2026-05-24 02:26:27,573 - optuna.study.study - INFO - Trial 256 finished with values: [0.02315452262989872, 0.017624172185430463, 0.023598101310749766] and parameters: {'n_layers': 3, 'embedding_dim': 96, 'lr': 0.0005233015481570266, 'lambda_val': 2.582067375745636e-06, 'batch_size': 652, 'optimizer': 'RMSprop'}.
2026-05-24 02:26:38,931 - experiment_functions - INFO - Early stopping at epoch 1000. Best Metrics: (0.020866005696612462, 0.01610927152317881, 0.02208385485541709)
2026-05-24 02:26:39,011 - optuna.study.study - INFO - Trial 257 finished with values: [0.020866005696612462, 0.01610927152317881, 0.02208385485541709] and parameters: {'n_layers': 3, 'embedding_dim': 96, 'lr': 0.0007459913147507348, 'lambda_val': 4.5116613809437874e-06, 'batch_size': 795, 'optimizer': 'Adam'}.
2026-05-24 02:26:51,798 - experiment_functions - INFO - Early stopping at epoch 800. Best Metrics: (0.017839434822953214, 0.015281456953642384, 0.01910288280152384)
2026-05-24 02:26:52,888 - optuna.study.study - INFO - Trial 258 finished with values: [0.017839434822953214, 0.015281456953642384, 0.01910288280152384] and parameters: {'n_layers': 3, 'embedding_dim': 64, 'lr': 0.0007459913147507348, 'lambda_val': 0.041490012486086775, 'batch_size': 795, 'optimizer': 'RMSprop'}.
2026-05-24 02:27:05,627 - experiment_functions - INFO - Early stopping at epoch 1100. Best Metrics: (0.024307707309580085, 0.018526490066225167, 0.025344120418692096)
2026-05-24 02:27:05,721 - optuna.study.study - INFO - Trial 259 finished with values: [0.024307707309580085, 0.018526490066225167, 0.025344120418692096] and parameters: {'n_layers': 4, 'embedding_dim': 32, 'lr': 0.0008040703808441612, 'lambda_val': 1.738144592818896e-06, 'batch_size': 652, 'optimizer': 'Adam'}.
2026-05-24 02:27:17,288 - experiment_functions - INFO - Early stopping at epoch 1000. Best Metrics: (0.02086621841540561, 0.016812913907284767, 0.022369643605982363)
2026-05-24 02:27:17,852 - optuna.study.study - INFO - Trial 260 finished with values: [0.02086621841540561, 0.016812913907284767, 0.022369643605982363] and parameters: {'n_layers': 4, 'embedding_dim': 96, 'lr': 0.0005233015481570266, 'lambda_val': 0.0009443756499535536, 'batch_size': 1343, 'optimizer': 'Adam'}.
2026-05-24 02:27:32,195 - experiment_functions - INFO - Early stopping at epoch 1250. Best Metrics: (0.023937118841638634, 0.01931291390728477, 0.02543207886496201)
2026-05-24 02:27:32,300 - optuna.study.study - INFO - Trial 261 finished with values: [0.023937118841638634, 0.01931291390728477, 0.02543207886496201] and parameters: {'n_layers': 4, 'embedding_dim': 64, 'lr': 0.0005233015481570266, 'lambda_val': 9.206863327207947e-05, 'batch_size': 652, 'optimizer': 'Adam'}.
2026-05-24 02:27:50,923 - experiment_functions - INFO - Early stopping at epoch 1750. Best Metrics: (0.02158566297323016, 0.014784768211920532, 0.021075728731040008)
2026-05-24 02:27:51,005 - optuna.study.study - INFO - Trial 262 finished with values: [0.02158566297323016, 0.014784768211920532, 0.021075728731040008] and parameters: {'n_layers': 1, 'embedding_dim': 32, 'lr': 0.0007459913147507348, 'lambda_val': 0.004825444205218699, 'batch_size': 795, 'optimizer': 'RMSprop'}.
2026-05-24 02:28:06,290 - experiment_functions - INFO - Early stopping at epoch 1350. Best Metrics: (0.0206902694492564, 0.016390728476821194, 0.02137246258077205)
2026-05-24 02:28:06,701 - optuna.study.study - INFO - Trial 263 finished with values: [0.0206902694492564, 0.016390728476821194, 0.02137246258077205] and parameters: {'n_layers': 3, 'embedding_dim': 128, 'lr': 0.0005233015481570266, 'lambda_val': 0.0009443756499535536, 'batch_size': 664, 'optimizer': 'Adam'}.
2026-05-24 02:28:13,496 - experiment_functions - INFO - Early stopping at epoch 550. Best Metrics: (0.022826911585163714, 0.01814569536423841, 0.02418109750755298)
2026-05-24 02:28:13,633 - optuna.study.study - INFO - Trial 264 finished with values: [0.022826911585163714, 0.01814569536423841, 0.02418109750755298] and parameters: {'n_layers': 4, 'embedding_dim': 32, 'lr': 0.003175767497275054, 'lambda_val': 0.0009443756499535536, 'batch_size': 652, 'optimizer': 'RMSprop'}.
2026-05-24 02:28:22,859 - experiment_functions - INFO - Early stopping at epoch 700. Best Metrics: (0.02126993253236642, 0.01638245033112583, 0.0212064862924754)
2026-05-24 02:28:23,017 - optuna.study.study - INFO - Trial 265 finished with values: [0.02126993253236642, 0.01638245033112583, 0.0212064862924754] and parameters: {'n_layers': 4, 'embedding_dim': 256, 'lr': 0.001254073391314583, 'lambda_val': 0.0009443756499535536, 'batch_size': 652, 'optimizer': 'Adam'}.
2026-05-24 02:29:03,147 - optuna.study.study - INFO - Trial 266 finished with values: [0.007307241817411816, 0.005745033112582782, 0.007549857236215305] and parameters: {'n_layers': 4, 'embedding_dim': 32, 'lr': 4.8332341376717914e-05, 'lambda_val': 6.8026566329648115e-06, 'batch_size': 652, 'optimizer': 'RMSprop'}.
2026-05-24 02:29:12,107 - experiment_functions - INFO - Early stopping at epoch 750. Best Metrics: (0.020058192695554065, 0.016225165562913906, 0.021136161140920838)
2026-05-24 02:29:13,363 - optuna.study.study - INFO - Trial 267 finished with values: [0.020058192695554065, 0.016225165562913906, 0.021136161140920838] and parameters: {'n_layers': 3, 'embedding_dim': 96, 'lr': 0.001254073391314583, 'lambda_val': 0.004825444205218699, 'batch_size': 722, 'optimizer': 'Adam'}.
2026-05-24 02:29:26,664 - experiment_functions - INFO - Early stopping at epoch 1150. Best Metrics: (0.023005156612481117, 0.017789735099337747, 0.024238526735626247)
2026-05-24 02:29:26,763 - optuna.study.study - INFO - Trial 268 finished with values: [0.023005156612481117, 0.017789735099337747, 0.024238526735626247] and parameters: {'n_layers': 4, 'embedding_dim': 96, 'lr': 0.0005233015481570266, 'lambda_val': 4.5116613809437874e-06, 'batch_size': 652, 'optimizer': 'Adam'}.
2026-05-24 02:29:33,020 - experiment_functions - INFO - Early stopping at epoch 500. Best Metrics: (0.005258130643775169, 0.004271523178807947, 0.005360586179890176)
2026-05-24 02:29:34,050 - optuna.study.study - INFO - Trial 269 finished with values: [0.005258130643775169, 0.004271523178807947, 0.005360586179890176] and parameters: {'n_layers': 4, 'embedding_dim': 96, 'lr': 0.0005233015481570266, 'lambda_val': 1.858625399381744e-05, 'batch_size': 652, 'optimizer': 'SGD'}.
2026-05-24 02:29:43,599 - experiment_functions - INFO - Early stopping at epoch 800. Best Metrics: (0.017890383237149848, 0.014122516556291393, 0.018546131364263883)
2026-05-24 02:29:44,069 - optuna.study.study - INFO - Trial 270 finished with values: [0.017890383237149848, 0.014122516556291393, 0.018546131364263883] and parameters: {'n_layers': 3, 'embedding_dim': 96, 'lr': 0.0005233015481570266, 'lambda_val': 0.005694292664597612, 'batch_size': 3176, 'optimizer': 'RMSprop'}.
2026-05-24 02:29:58,247 - experiment_functions - INFO - Early stopping at epoch 1250. Best Metrics: (0.022112057544879982, 0.015902317880794704, 0.022195218522118813)
2026-05-24 02:29:58,341 - optuna.study.study - INFO - Trial 271 finished with values: [0.022112057544879982, 0.015902317880794704, 0.022195218522118813] and parameters: {'n_layers': 3, 'embedding_dim': 96, 'lr': 0.0005233015481570266, 'lambda_val': 9.206863327207947e-05, 'batch_size': 911, 'optimizer': 'Adam'}.
2026-05-24 02:30:07,739 - experiment_functions - INFO - Early stopping at epoch 800. Best Metrics: (0.020820818573041095, 0.016100993377483445, 0.021350249750537266)
2026-05-24 02:30:08,551 - optuna.study.study - INFO - Trial 272 finished with values: [0.020820818573041095, 0.016100993377483445, 0.021350249750537266] and parameters: {'n_layers': 3, 'embedding_dim': 64, 'lr': 0.001254073391314583, 'lambda_val': 0.0009443756499535536, 'batch_size': 1050, 'optimizer': 'Adam'}.
2026-05-24 02:30:21,255 - experiment_functions - INFO - Early stopping at epoch 600. Best Metrics: (0.016162782915446514, 0.013485099337748345, 0.017310234669200675)
2026-05-24 02:30:21,802 - optuna.study.study - INFO - Trial 273 finished with values: [0.016162782915446514, 0.013485099337748345, 0.017310234669200675] and parameters: {'n_layers': 4, 'embedding_dim': 64, 'lr': 0.003175767497275054, 'lambda_val': 1.1741946550104087e-06, 'batch_size': 3112, 'optimizer': 'Adam'}.
2026-05-24 02:30:34,576 - experiment_functions - INFO - Early stopping at epoch 700. Best Metrics: (0.01793205661584784, 0.014346026490066227, 0.01853104213377295)
2026-05-24 02:30:35,618 - optuna.study.study - INFO - Trial 274 finished with values: [0.01793205661584784, 0.014346026490066227, 0.01853104213377295] and parameters: {'n_layers': 3, 'embedding_dim': 256, 'lr': 0.0007459913147507348, 'lambda_val': 0.0009443756499535536, 'batch_size': 652, 'optimizer': 'RMSprop'}.
2026-05-24 02:30:47,611 - experiment_functions - INFO - Early stopping at epoch 1000. Best Metrics: (0.020174452362196203, 0.01685430463576159, 0.02192337605199583)
2026-05-24 02:30:47,734 - optuna.study.study - INFO - Trial 275 finished with values: [0.020174452362196203, 0.01685430463576159, 0.02192337605199583] and parameters: {'n_layers': 4, 'embedding_dim': 96, 'lr': 0.0005233015481570266, 'lambda_val': 6.470519829517749e-05, 'batch_size': 1393, 'optimizer': 'Adam'}.
2026-05-24 02:31:06,159 - experiment_functions - INFO - Early stopping at epoch 1650. Best Metrics: (0.02609917246361779, 0.019387417218543045, 0.027133936423853842)
2026-05-24 02:31:06,260 - optuna.study.study - INFO - Trial 276 finished with values: [0.02609917246361779, 0.019387417218543045, 0.027133936423853842] and parameters: {'n_layers': 3, 'embedding_dim': 32, 'lr': 0.0007459913147507348, 'lambda_val': 2.582067375745636e-06, 'batch_size': 567, 'optimizer': 'RMSprop'}.
2026-05-24 02:31:22,501 - experiment_functions - INFO - Early stopping at epoch 1450. Best Metrics: (0.021699537807844973, 0.01706953642384106, 0.023148841508133285)
2026-05-24 02:31:22,916 - optuna.study.study - INFO - Trial 277 finished with values: [0.021699537807844973, 0.01706953642384106, 0.023148841508133285] and parameters: {'n_layers': 3, 'embedding_dim': 96, 'lr': 0.0005233015481570266, 'lambda_val': 1.858625399381744e-05, 'batch_size': 652, 'optimizer': 'RMSprop'}.
2026-05-24 02:31:29,072 - experiment_functions - INFO - Early stopping at epoch 500. Best Metrics: (0.009105304189628285, 0.007235099337748345, 0.009371163900534768)
2026-05-24 02:31:29,998 - optuna.study.study - INFO - Trial 278 finished with values: [0.009105304189628285, 0.007235099337748345, 0.009371163900534768] and parameters: {'n_layers': 3, 'embedding_dim': 32, 'lr': 0.0839591111182181, 'lambda_val': 0.0008187140617702526, 'batch_size': 925, 'optimizer': 'RMSprop'}.
2026-05-24 02:31:44,527 - experiment_functions - INFO - Early stopping at epoch 1250. Best Metrics: (0.024798800130647104, 0.01929635761589404, 0.025282471600264433)
2026-05-24 02:31:45,779 - optuna.study.study - INFO - Trial 279 finished with values: [0.024798800130647104, 0.01929635761589404, 0.025282471600264433] and parameters: {'n_layers': 4, 'embedding_dim': 64, 'lr': 0.0005233015481570266, 'lambda_val': 6.9654869504302275e-06, 'batch_size': 652, 'optimizer': 'RMSprop'}.
2026-05-24 02:31:51,799 - experiment_functions - INFO - Early stopping at epoch 500. Best Metrics: (0.005196406777698796, 0.004461920529801325, 0.005582867633447186)
2026-05-24 02:31:51,893 - optuna.study.study - INFO - Trial 280 finished with values: [0.005196406777698796, 0.004461920529801325, 0.005582867633447186] and parameters: {'n_layers': 4, 'embedding_dim': 96, 'lr': 0.00035899557766397706, 'lambda_val': 2.582067375745636e-06, 'batch_size': 1393, 'optimizer': 'SGD'}.
2026-05-24 02:32:00,670 - experiment_functions - INFO - Early stopping at epoch 700. Best Metrics: (0.017015122253357814, 0.014503311258278145, 0.018554429901286862)
2026-05-24 02:32:01,541 - optuna.study.study - INFO - Trial 281 finished with values: [0.017015122253357814, 0.014503311258278145, 0.018554429901286862] and parameters: {'n_layers': 4, 'embedding_dim': 96, 'lr': 0.0005233015481570266, 'lambda_val': 0.0009443756499535536, 'batch_size': 3645, 'optimizer': 'RMSprop'}.
2026-05-24 02:32:26,473 - experiment_functions - INFO - Early stopping at epoch 2350. Best Metrics: (0.022916541046595802, 0.01554635761589404, 0.022504232649407197)
2026-05-24 02:32:26,981 - optuna.study.study - INFO - Trial 282 finished with values: [0.022916541046595802, 0.01554635761589404, 0.022504232649407197] and parameters: {'n_layers': 1, 'embedding_dim': 32, 'lr': 0.0007459913147507348, 'lambda_val': 2.582067375745636e-06, 'batch_size': 652, 'optimizer': 'Adam'}.
2026-05-24 02:32:34,410 - experiment_functions - INFO - Early stopping at epoch 600. Best Metrics: (0.022619398842742593, 0.017301324503311257, 0.023150033180426167)
2026-05-24 02:32:34,498 - optuna.study.study - INFO - Trial 283 finished with values: [0.022619398842742593, 0.017301324503311257, 0.023150033180426167] and parameters: {'n_layers': 4, 'embedding_dim': 64, 'lr': 0.003175767497275054, 'lambda_val': 0.00030428340393083607, 'batch_size': 664, 'optimizer': 'Adam'}.
2026-05-24 02:32:47,014 - experiment_functions - INFO - Early stopping at epoch 1050. Best Metrics: (0.02108303120687564, 0.016109271523178807, 0.0210484733502752)
2026-05-24 02:32:47,102 - optuna.study.study - INFO - Trial 284 finished with values: [0.02108303120687564, 0.016109271523178807, 0.0210484733502752] and parameters: {'n_layers': 3, 'embedding_dim': 128, 'lr': 0.0005233015481570266, 'lambda_val': 9.206863327207947e-05, 'batch_size': 939, 'optimizer': 'RMSprop'}.
2026-05-24 02:32:53,932 - experiment_functions - INFO - Early stopping at epoch 550. Best Metrics: (0.01308966513716157, 0.010728476821192053, 0.013957740243846302)
2026-05-24 02:32:54,023 - optuna.study.study - INFO - Trial 285 finished with values: [0.01308966513716157, 0.010728476821192053, 0.013957740243846302] and parameters: {'n_layers': 3, 'embedding_dim': 32, 'lr': 0.010738168683982315, 'lambda_val': 2.582067375745636e-06, 'batch_size': 652, 'optimizer': 'RMSprop'}.
2026-05-24 02:33:10,784 - experiment_functions - INFO - Early stopping at epoch 1450. Best Metrics: (0.023296202645919157, 0.017450331125827816, 0.023989214183706222)
