2026-05-23 21:32:40,049 - optuna.study.study - INFO - Trial 238 finished with values: [0.08723999783204778, 0.063658940397351, 0.08813760027066951] and parameters: {'n_layers': 1, 'embedding_dim': 32, 'lr': 0.0008759611298328556, 'lambda_val': 1.2948481747134374e-05, 'batch_size': 833, 'optimizer': 'Adam'}.
2026-05-23 21:32:48,682 - experiment_functions - INFO - Early stopping at epoch 550. Best Metrics: (0.07121380523772919, 0.05439569536423841, 0.07255099712263377)
2026-05-23 21:32:48,795 - optuna.study.study - INFO - Trial 239 finished with values: [0.07121380523772919, 0.05439569536423841, 0.07255099712263377] and parameters: {'n_layers': 1, 'embedding_dim': 128, 'lr': 0.007131304194051908, 'lambda_val': 0.003788628070914743, 'batch_size': 3432, 'optimizer': 'Adam'}.
2026-05-23 21:33:00,013 - experiment_functions - INFO - Early stopping at epoch 650. Best Metrics: (0.06338694624373145, 0.04949503311258279, 0.06679049406461691)
2026-05-23 21:33:00,545 - optuna.study.study - INFO - Trial 240 finished with values: [0.06338694624373145, 0.04949503311258279, 0.06679049406461691] and parameters: {'n_layers': 1, 'embedding_dim': 256, 'lr': 0.001325452189730596, 'lambda_val': 0.0053912262075664795, 'batch_size': 3729, 'optimizer': 'Adam'}.
2026-05-23 21:33:14,597 - experiment_functions - INFO - Early stopping at epoch 850. Best Metrics: (0.06550510180597964, 0.05440397350993377, 0.07031712813402731)
2026-05-23 21:33:14,694 - optuna.study.study - INFO - Trial 241 finished with values: [0.06550510180597964, 0.05440397350993377, 0.07031712813402731] and parameters: {'n_layers': 1, 'embedding_dim': 256, 'lr': 0.0006825513923366329, 'lambda_val': 0.021157307876022, 'batch_size': 2902, 'optimizer': 'Adam'}.
2026-05-23 21:33:23,240 - experiment_functions - INFO - Early stopping at epoch 600. Best Metrics: (0.005317479914959019, 0.004652317880794702, 0.00573280208196588)
2026-05-23 21:33:23,347 - optuna.study.study - INFO - Trial 242 finished with values: [0.005317479914959019, 0.004652317880794702, 0.00573280208196588] and parameters: {'n_layers': 1, 'embedding_dim': 96, 'lr': 3.718487268660375e-05, 'lambda_val': 0.001076113642302791, 'batch_size': 2583, 'optimizer': 'Adam'}.
2026-05-23 21:33:33,981 - experiment_functions - INFO - Early stopping at epoch 750. Best Metrics: (0.07762432036772013, 0.05765728476821192, 0.07887623440802612)
2026-05-23 21:33:34,260 - optuna.study.study - INFO - Trial 243 finished with values: [0.07762432036772013, 0.05765728476821192, 0.07887623440802612] and parameters: {'n_layers': 1, 'embedding_dim': 64, 'lr': 0.001325452189730596, 'lambda_val': 0.000651768480252559, 'batch_size': 2875, 'optimizer': 'Adam'}.
2026-05-23 21:34:53,762 - optuna.study.study - INFO - Trial 244 finished with values: [0.07448452343017058, 0.05483443708609272, 0.07776596507712148] and parameters: {'n_layers': 2, 'embedding_dim': 256, 'lr': 0.00024071591856709453, 'lambda_val': 2.2621228626504235e-06, 'batch_size': 886, 'optimizer': 'Adam'}.
2026-05-23 21:35:46,701 - optuna.study.study - INFO - Trial 245 finished with values: [0.07678068992295349, 0.0575, 0.08027669345613152] and parameters: {'n_layers': 1, 'embedding_dim': 96, 'lr': 0.00045141578622738895, 'lambda_val': 0.0007535837355673727, 'batch_size': 576, 'optimizer': 'Adam'}.
2026-05-23 21:36:38,426 - optuna.study.study - INFO - Trial 246 finished with values: [0.08482083118161252, 0.06240066225165562, 0.08826023632694693] and parameters: {'n_layers': 1, 'embedding_dim': 64, 'lr': 0.00045141578622738895, 'lambda_val': 0.0008615372566412854, 'batch_size': 886, 'optimizer': 'Adam'}.
2026-05-23 21:36:59,914 - experiment_functions - INFO - Early stopping at epoch 1300. Best Metrics: (0.07251356853221189, 0.05655629139072848, 0.07517060053405833)
2026-05-23 21:37:00,076 - optuna.study.study - INFO - Trial 247 finished with values: [0.07251356853221189, 0.05655629139072848, 0.07517060053405833] and parameters: {'n_layers': 1, 'embedding_dim': 256, 'lr': 0.00045141578622738895, 'lambda_val': 0.0002373792354684068, 'batch_size': 2902, 'optimizer': 'Adam'}.
2026-05-23 21:37:51,963 - optuna.study.study - INFO - Trial 248 finished with values: [0.08528573054424848, 0.06178807947019868, 0.08690187754020492] and parameters: {'n_layers': 1, 'embedding_dim': 64, 'lr': 0.00048280119101609247, 'lambda_val': 1.8953018809835847e-05, 'batch_size': 886, 'optimizer': 'Adam'}.
2026-05-23 21:38:55,488 - optuna.study.study - INFO - Trial 249 finished with values: [0.07896268606318047, 0.06003311258278146, 0.08129143382911726] and parameters: {'n_layers': 1, 'embedding_dim': 256, 'lr': 0.00045141578622738895, 'lambda_val': 0.0007535837355673727, 'batch_size': 576, 'optimizer': 'Adam'}.
2026-05-23 21:39:03,853 - experiment_functions - INFO - Early stopping at epoch 500. Best Metrics: (0.005709576112076576, 0.00456953642384106, 0.005417790234890315)
2026-05-23 21:39:03,949 - optuna.study.study - INFO - Trial 250 finished with values: [0.005709576112076576, 0.00456953642384106, 0.005417790234890315] and parameters: {'n_layers': 1, 'embedding_dim': 256, 'lr': 8.735579889204084e-05, 'lambda_val': 2.3420359615170988e-05, 'batch_size': 886, 'optimizer': 'Adam'}.
2026-05-23 21:39:48,975 - experiment_functions - INFO - Early stopping at epoch 3550. Best Metrics: (0.09249267605045637, 0.06596854304635762, 0.09197312603290791)
2026-05-23 21:39:49,070 - optuna.study.study - INFO - Trial 251 finished with values: [0.09249267605045637, 0.06596854304635762, 0.09197312603290791] and parameters: {'n_layers': 1, 'embedding_dim': 32, 'lr': 0.0007928857958215832, 'lambda_val': 1.207883913872658e-06, 'batch_size': 576, 'optimizer': 'Adam'}.
2026-05-23 21:40:02,798 - experiment_functions - INFO - Early stopping at epoch 800. Best Metrics: (0.07290723779592186, 0.053567880794702, 0.07428481695723159)
2026-05-23 21:40:02,897 - optuna.study.study - INFO - Trial 252 finished with values: [0.07290723779592186, 0.053567880794702, 0.07428481695723159] and parameters: {'n_layers': 1, 'embedding_dim': 256, 'lr': 0.0008759611298328556, 'lambda_val': 1.0319773166587503e-06, 'batch_size': 808, 'optimizer': 'RMSprop'}.
2026-05-23 21:40:23,598 - experiment_functions - INFO - Early stopping at epoch 1250. Best Metrics: (0.07526169673499346, 0.055935430463576165, 0.07859016765065203)
2026-05-23 21:40:23,701 - optuna.study.study - INFO - Trial 253 finished with values: [0.07526169673499346, 0.055935430463576165, 0.07859016765065203] and parameters: {'n_layers': 1, 'embedding_dim': 256, 'lr': 0.00045141578622738895, 'lambda_val': 1.207883913872658e-06, 'batch_size': 2902, 'optimizer': 'Adam'}.
2026-05-23 21:40:37,218 - experiment_functions - INFO - Early stopping at epoch 900. Best Metrics: (0.08054669555033923, 0.05857615894039735, 0.0825707062060773)
2026-05-23 21:40:37,312 - optuna.study.study - INFO - Trial 254 finished with values: [0.08054669555033923, 0.05857615894039735, 0.0825707062060773] and parameters: {'n_layers': 1, 'embedding_dim': 128, 'lr': 0.0007928857958215832, 'lambda_val': 1.207883913872658e-06, 'batch_size': 2875, 'optimizer': 'Adam'}.
2026-05-23 21:40:46,298 - experiment_functions - INFO - Early stopping at epoch 600. Best Metrics: (0.07930562153584275, 0.055206953642384114, 0.08056975894517537)
2026-05-23 21:40:46,429 - optuna.study.study - INFO - Trial 255 finished with values: [0.07930562153584275, 0.055206953642384114, 0.08056975894517537] and parameters: {'n_layers': 1, 'embedding_dim': 96, 'lr': 0.004184026134455368, 'lambda_val': 1.207883913872658e-06, 'batch_size': 833, 'optimizer': 'Adam'}.
2026-05-23 21:41:00,101 - experiment_functions - INFO - Early stopping at epoch 850. Best Metrics: (0.058142097850784544, 0.04505794701986755, 0.06035906017040145)
2026-05-23 21:41:00,294 - optuna.study.study - INFO - Trial 256 finished with values: [0.058142097850784544, 0.04505794701986755, 0.06035906017040145] and parameters: {'n_layers': 2, 'embedding_dim': 96, 'lr': 0.00045141578622738895, 'lambda_val': 0.0053912262075664795, 'batch_size': 3838, 'optimizer': 'Adam'}.
2026-05-23 21:41:11,031 - experiment_functions - INFO - Early stopping at epoch 800. Best Metrics: (0.07919501677975188, 0.059246688741721856, 0.08192283057586713)
2026-05-23 21:41:11,291 - optuna.study.study - INFO - Trial 257 finished with values: [0.07919501677975188, 0.059246688741721856, 0.08192283057586713] and parameters: {'n_layers': 1, 'embedding_dim': 32, 'lr': 0.001325452189730596, 'lambda_val': 0.0053912262075664795, 'batch_size': 2875, 'optimizer': 'Adam'}.
2026-05-23 21:41:23,750 - experiment_functions - INFO - Early stopping at epoch 700. Best Metrics: (0.04202548044546386, 0.03443708609271523, 0.04445916995926494)
2026-05-23 21:41:23,845 - optuna.study.study - INFO - Trial 258 finished with values: [0.04202548044546386, 0.03443708609271523, 0.04445916995926494] and parameters: {'n_layers': 3, 'embedding_dim': 96, 'lr': 0.0007928857958215832, 'lambda_val': 1.207883913872658e-06, 'batch_size': 1990, 'optimizer': 'Adam'}.
2026-05-23 21:41:32,862 - experiment_functions - INFO - Early stopping at epoch 600. Best Metrics: (0.07556411862233757, 0.05631622516556292, 0.07848135148952994)
2026-05-23 21:41:33,052 - optuna.study.study - INFO - Trial 259 finished with values: [0.07556411862233757, 0.05631622516556292, 0.07848135148952994] and parameters: {'n_layers': 1, 'embedding_dim': 96, 'lr': 0.004184026134455368, 'lambda_val': 0.0007535837355673727, 'batch_size': 2307, 'optimizer': 'Adam'}.
2026-05-23 21:42:29,174 - optuna.study.study - INFO - Trial 260 finished with values: [0.08903766417643874, 0.06367549668874173, 0.09116357938336563] and parameters: {'n_layers': 1, 'embedding_dim': 128, 'lr': 0.00045141578622738895, 'lambda_val': 2.247882160372844e-05, 'batch_size': 886, 'optimizer': 'Adam'}.
2026-05-23 21:42:35,841 - experiment_functions - INFO - Early stopping at epoch 500. Best Metrics: (0.0057606761896253755, 0.004660596026490067, 0.006111242158004052)
2026-05-23 21:42:36,229 - optuna.study.study - INFO - Trial 261 finished with values: [0.0057606761896253755, 0.004660596026490067, 0.006111242158004052] and parameters: {'n_layers': 1, 'embedding_dim': 32, 'lr': 0.0017544079546559647, 'lambda_val': 0.0002325189021560843, 'batch_size': 541, 'optimizer': 'SGD'}.
2026-05-23 21:42:45,813 - experiment_functions - INFO - Early stopping at epoch 550. Best Metrics: (0.05578989068442266, 0.03570364238410596, 0.05133969292818505)
2026-05-23 21:42:47,060 - optuna.study.study - INFO - Trial 262 finished with values: [0.05578989068442266, 0.03570364238410596, 0.05133969292818505] and parameters: {'n_layers': 1, 'embedding_dim': 256, 'lr': 0.0056720054806726865, 'lambda_val': 0.00020136097974536503, 'batch_size': 576, 'optimizer': 'Adam'}.
2026-05-23 21:43:03,544 - experiment_functions - INFO - Early stopping at epoch 1250. Best Metrics: (0.08247908838597336, 0.05954470198675496, 0.081652017008185)
2026-05-23 21:43:03,667 - optuna.study.study - INFO - Trial 263 finished with values: [0.08247908838597336, 0.05954470198675496, 0.081652017008185] and parameters: {'n_layers': 1, 'embedding_dim': 32, 'lr': 0.0006825513923366329, 'lambda_val': 0.0026874049181166604, 'batch_size': 2170, 'optimizer': 'Adam'}.
2026-05-23 21:43:13,695 - experiment_functions - INFO - Early stopping at epoch 700. Best Metrics: (0.0716885974112352, 0.05719370860927153, 0.0741734112054113)
2026-05-23 21:43:14,255 - optuna.study.study - INFO - Trial 264 finished with values: [0.0716885974112352, 0.05719370860927153, 0.0741734112054113] and parameters: {'n_layers': 1, 'embedding_dim': 96, 'lr': 0.001325452189730596, 'lambda_val': 0.03383115944377013, 'batch_size': 2875, 'optimizer': 'Adam'}.
2026-05-23 21:43:27,157 - experiment_functions - INFO - Early stopping at epoch 1000. Best Metrics: (0.05534288278904921, 0.047789735099337746, 0.06014462502518339)
2026-05-23 21:43:27,291 - optuna.study.study - INFO - Trial 265 finished with values: [0.05534288278904921, 0.047789735099337746, 0.06014462502518339] and parameters: {'n_layers': 1, 'embedding_dim': 32, 'lr': 0.001325452189730596, 'lambda_val': 0.08667297467639798, 'batch_size': 872, 'optimizer': 'Adam'}.
2026-05-23 21:43:47,645 - experiment_functions - INFO - Early stopping at epoch 1300. Best Metrics: (0.08208956819048563, 0.059776490066225166, 0.08355224927083743)
2026-05-23 21:43:48,491 - optuna.study.study - INFO - Trial 266 finished with values: [0.08208956819048563, 0.059776490066225166, 0.08355224927083743] and parameters: {'n_layers': 2, 'embedding_dim': 96, 'lr': 0.00045141578622738895, 'lambda_val': 0.0053912262075664795, 'batch_size': 576, 'optimizer': 'Adam'}.
2026-05-23 21:43:56,743 - experiment_functions - INFO - Early stopping at epoch 500. Best Metrics: (0.004935519045288521, 0.004627483443708609, 0.00574257733368749)
2026-05-23 21:43:57,138 - optuna.study.study - INFO - Trial 267 finished with values: [0.004935519045288521, 0.004627483443708609, 0.00574257733368749] and parameters: {'n_layers': 1, 'embedding_dim': 256, 'lr': 0.004184026134455368, 'lambda_val': 1.0132645475196796e-05, 'batch_size': 2307, 'optimizer': 'SGD'}.
2026-05-23 21:44:50,155 - optuna.study.study - INFO - Trial 268 finished with values: [0.07442065792428756, 0.05574503311258279, 0.0776968680493147] and parameters: {'n_layers': 1, 'embedding_dim': 96, 'lr': 0.00045141578622738895, 'lambda_val': 2.2621228626504235e-06, 'batch_size': 576, 'optimizer': 'Adam'}.
2026-05-23 21:45:00,385 - experiment_functions - INFO - Early stopping at epoch 700. Best Metrics: (0.07757039110233961, 0.05875827814569537, 0.08067446059819597)
2026-05-23 21:45:01,220 - optuna.study.study - INFO - Trial 269 finished with values: [0.07757039110233961, 0.05875827814569537, 0.08067446059819597] and parameters: {'n_layers': 1, 'embedding_dim': 96, 'lr': 0.001325452189730596, 'lambda_val': 0.0053912262075664795, 'batch_size': 2875, 'optimizer': 'Adam'}.
2026-05-23 21:45:08,502 - experiment_functions - INFO - Early stopping at epoch 500. Best Metrics: (0.005030144506663966, 0.004602649006622517, 0.00534086448934261)
2026-05-23 21:45:08,606 - optuna.study.study - INFO - Trial 270 finished with values: [0.005030144506663966, 0.004602649006622517, 0.00534086448934261] and parameters: {'n_layers': 1, 'embedding_dim': 128, 'lr': 0.00045141578622738895, 'lambda_val': 0.0005113400255180309, 'batch_size': 3432, 'optimizer': 'SGD'}.
2026-05-23 21:45:19,807 - experiment_functions - INFO - Early stopping at epoch 800. Best Metrics: (0.0797970247943817, 0.05930463576158941, 0.083158314097829)
2026-05-23 21:45:20,261 - optuna.study.study - INFO - Trial 271 finished with values: [0.0797970247943817, 0.05930463576158941, 0.083158314097829] and parameters: {'n_layers': 1, 'embedding_dim': 64, 'lr': 0.0017544079546559647, 'lambda_val': 1.8953018809835847e-05, 'batch_size': 886, 'optimizer': 'Adam'}.
2026-05-23 21:45:31,967 - experiment_functions - INFO - Early stopping at epoch 600. Best Metrics: (0.05139265319078892, 0.03995033112582782, 0.05217221162654813)
2026-05-23 21:45:32,064 - optuna.study.study - INFO - Trial 272 finished with values: [0.05139265319078892, 0.03995033112582782, 0.05217221162654813] and parameters: {'n_layers': 3, 'embedding_dim': 128, 'lr': 0.0018056450324114327, 'lambda_val': 0.001076113642302791, 'batch_size': 576, 'optimizer': 'Adam'}.
2026-05-23 21:45:39,303 - experiment_functions - INFO - Early stopping at epoch 500. Best Metrics: (0.0050156250613067575, 0.004304635761589404, 0.005085193439895168)
2026-05-23 21:45:39,495 - optuna.study.study - INFO - Trial 273 finished with values: [0.0050156250613067575, 0.004304635761589404, 0.005085193439895168] and parameters: {'n_layers': 1, 'embedding_dim': 96, 'lr': 0.001325452189730596, 'lambda_val': 0.0053912262075664795, 'batch_size': 2307, 'optimizer': 'SGD'}.
2026-05-23 21:45:55,834 - experiment_functions - INFO - Early stopping at epoch 1000. Best Metrics: (0.06535874681026614, 0.05408940397350994, 0.07176980730941933)
2026-05-23 21:45:56,649 - optuna.study.study - INFO - Trial 274 finished with values: [0.06535874681026614, 0.05408940397350994, 0.07176980730941933] and parameters: {'n_layers': 1, 'embedding_dim': 256, 'lr': 0.0005075141516941063, 'lambda_val': 0.03017267955421239, 'batch_size': 3287, 'optimizer': 'Adam'}.
2026-05-23 21:46:06,079 - experiment_functions - INFO - Early stopping at epoch 550. Best Metrics: (0.020657638695154825, 0.015008278145695365, 0.020848138325104817)
2026-05-23 21:46:06,181 - optuna.study.study - INFO - Trial 275 finished with values: [0.020657638695154825, 0.015008278145695365, 0.020848138325104817] and parameters: {'n_layers': 1, 'embedding_dim': 256, 'lr': 0.037314031060140876, 'lambda_val': 2.2621228626504235e-06, 'batch_size': 806, 'optimizer': 'Adam'}.
2026-05-23 21:46:20,925 - experiment_functions - INFO - Early stopping at epoch 700. Best Metrics: (0.06230302238834819, 0.04699503311258278, 0.06421886097746148)
2026-05-23 21:46:22,111 - optuna.study.study - INFO - Trial 276 finished with values: [0.06230302238834819, 0.04699503311258278, 0.06421886097746148] and parameters: {'n_layers': 2, 'embedding_dim': 256, 'lr': 0.0006825513923366329, 'lambda_val': 0.0006933074309064735, 'batch_size': 2902, 'optimizer': 'Adam'}.
2026-05-23 21:47:15,098 - optuna.study.study - INFO - Trial 277 finished with values: [0.07759762840350791, 0.05759933774834438, 0.08082445277624736] and parameters: {'n_layers': 1, 'embedding_dim': 96, 'lr': 0.00045141578622738895, 'lambda_val': 0.0007535837355673727, 'batch_size': 576, 'optimizer': 'Adam'}.
2026-05-23 21:48:15,001 - experiment_functions - INFO - Early stopping at epoch 3850. Best Metrics: (0.08301345438152441, 0.061125827814569544, 0.08471555078825861)
2026-05-23 21:48:15,709 - optuna.study.study - INFO - Trial 278 finished with values: [0.08301345438152441, 0.061125827814569544, 0.08471555078825861] and parameters: {'n_layers': 1, 'embedding_dim': 256, 'lr': 0.00045141578622738895, 'lambda_val': 0.0007535837355673727, 'batch_size': 833, 'optimizer': 'Adam'}.
2026-05-23 21:48:26,975 - experiment_functions - INFO - Early stopping at epoch 550. Best Metrics: (0.013862985029217434, 0.013311258278145697, 0.016701747732859408)
2026-05-23 21:48:27,076 - optuna.study.study - INFO - Trial 279 finished with values: [0.013862985029217434, 0.013311258278145697, 0.016701747732859408] and parameters: {'n_layers': 4, 'embedding_dim': 128, 'lr': 0.007131304194051908, 'lambda_val': 0.0005099748742674305, 'batch_size': 886, 'optimizer': 'Adam'}.
2026-05-23 21:49:14,440 - optuna.study.study - INFO - Trial 280 finished with values: [0.06835061190402067, 0.051481788079470195, 0.07376365128013875] and parameters: {'n_layers': 1, 'embedding_dim': 32, 'lr': 0.00045141578622738895, 'lambda_val': 0.0007535837355673727, 'batch_size': 833, 'optimizer': 'Adam'}.
2026-05-23 21:50:07,691 - experiment_functions - INFO - Early stopping at epoch 3400. Best Metrics: (0.08546287203652142, 0.061597682119205306, 0.08636591970133085)
2026-05-23 21:50:07,781 - optuna.study.study - INFO - Trial 281 finished with values: [0.08546287203652142, 0.061597682119205306, 0.08636591970133085] and parameters: {'n_layers': 1, 'embedding_dim': 256, 'lr': 0.00045141578622738895, 'lambda_val': 0.0007535837355673727, 'batch_size': 886, 'optimizer': 'Adam'}.
2026-05-23 21:50:32,816 - experiment_functions - INFO - Early stopping at epoch 1700. Best Metrics: (0.08456016409579893, 0.0579139072847682, 0.08561925280087594)
2026-05-23 21:50:32,946 - optuna.study.study - INFO - Trial 282 finished with values: [0.08456016409579893, 0.0579139072847682, 0.08561925280087594] and parameters: {'n_layers': 2, 'embedding_dim': 64, 'lr': 0.00048280119101609247, 'lambda_val': 2.3420359615170988e-05, 'batch_size': 774, 'optimizer': 'Adam'}.
2026-05-23 21:50:40,944 - experiment_functions - INFO - Early stopping at epoch 550. Best Metrics: (0.06783145248459906, 0.04975165562913907, 0.06800617566383464)
2026-05-23 21:50:41,069 - optuna.study.study - INFO - Trial 283 finished with values: [0.06783145248459906, 0.04975165562913907, 0.06800617566383464] and parameters: {'n_layers': 1, 'embedding_dim': 64, 'lr': 0.01001425557665924, 'lambda_val': 1.207883913872658e-06, 'batch_size': 886, 'optimizer': 'Adam'}.
2026-05-23 21:51:32,078 - optuna.study.study - INFO - Trial 284 finished with values: [0.07518224779040214, 0.05646523178807946, 0.0770775715095397] and parameters: {'n_layers': 1, 'embedding_dim': 64, 'lr': 0.00048280119101609247, 'lambda_val': 1.8953018809835847e-05, 'batch_size': 576, 'optimizer': 'Adam'}.
2026-05-23 21:51:52,378 - experiment_functions - INFO - Early stopping at epoch 1400. Best Metrics: (0.07723349158703366, 0.058071192052980135, 0.07933265723611456)
2026-05-23 21:51:52,731 - optuna.study.study - INFO - Trial 285 finished with values: [0.07723349158703366, 0.058071192052980135, 0.07933265723611456] and parameters: {'n_layers': 1, 'embedding_dim': 128, 'lr': 0.00045141578622738895, 'lambda_val': 0.0007535837355673727, 'batch_size': 2902, 'optimizer': 'Adam'}.
2026-05-23 21:52:03,706 - experiment_functions - INFO - Early stopping at epoch 800. Best Metrics: (0.0761563456619165, 0.0572682119205298, 0.07915262833064324)
2026-05-23 21:52:04,442 - optuna.study.study - INFO - Trial 286 finished with values: [0.0761563456619165, 0.0572682119205298, 0.07915262833064324] and parameters: {'n_layers': 1, 'embedding_dim': 32, 'lr': 0.001325452189730596, 'lambda_val': 0.0023901546340645923, 'batch_size': 2875, 'optimizer': 'Adam'}.
2026-05-23 21:52:15,703 - experiment_functions - INFO - Early stopping at epoch 650. Best Metrics: (0.06643432263304304, 0.04937913907284768, 0.06873895408520729)
