2026-05-23 23:00:25,018 - optuna.study.study - INFO - Trial 124 finished with values: [0.014339800153756998, 0.006026490066225167, 0.013314435711534536] and parameters: {'n_layers': 2, 'embedding_dim': 64, 'lr': 6.370763283366987e-05, 'lambda_val': 0.00031335292673571056, 'batch_size': 1956, 'optimizer': 'Adam'}.
2026-05-23 23:00:32,483 - experiment_functions - INFO - Early stopping at epoch 650. Best Metrics: (0.01633445721120681, 0.006506622516556292, 0.013727063708666058)
2026-05-23 23:00:32,621 - optuna.study.study - INFO - Trial 125 finished with values: [0.01633445721120681, 0.006506622516556292, 0.013727063708666058] and parameters: {'n_layers': 2, 'embedding_dim': 32, 'lr': 0.0007501372551026504, 'lambda_val': 9.691061665067305e-06, 'batch_size': 1661, 'optimizer': 'RMSprop'}.
2026-05-23 23:00:43,273 - experiment_functions - INFO - Early stopping at epoch 850. Best Metrics: (0.017115148470060494, 0.00658112582781457, 0.015478524396392468)
2026-05-23 23:00:43,497 - optuna.study.study - INFO - Trial 126 finished with values: [0.017115148470060494, 0.00658112582781457, 0.015478524396392468] and parameters: {'n_layers': 2, 'embedding_dim': 256, 'lr': 0.00021389999053293392, 'lambda_val': 2.305336015266439e-06, 'batch_size': 2780, 'optimizer': 'Adam'}.
2026-05-23 23:00:50,588 - experiment_functions - INFO - Early stopping at epoch 550. Best Metrics: (0.02240536335817734, 0.007913907284768212, 0.020292400750613254)
2026-05-23 23:00:50,684 - optuna.study.study - INFO - Trial 127 finished with values: [0.02240536335817734, 0.007913907284768212, 0.020292400750613254] and parameters: {'n_layers': 2, 'embedding_dim': 256, 'lr': 0.0012665424339139031, 'lambda_val': 1.6221161102260363e-05, 'batch_size': 2121, 'optimizer': 'Adam'}.
2026-05-23 23:00:57,828 - experiment_functions - INFO - Early stopping at epoch 550. Best Metrics: (0.008988840320865613, 0.0046192052980132455, 0.007604304485284394)
2026-05-23 23:00:57,926 - optuna.study.study - INFO - Trial 128 finished with values: [0.008988840320865613, 0.0046192052980132455, 0.007604304485284394] and parameters: {'n_layers': 4, 'embedding_dim': 128, 'lr': 0.003241752579826309, 'lambda_val': 0.00022124347257706695, 'batch_size': 3607, 'optimizer': 'Adam'}.
2026-05-23 23:01:05,855 - experiment_functions - INFO - Early stopping at epoch 700. Best Metrics: (0.024134923814178918, 0.007947019867549669, 0.021132309969322482)
2026-05-23 23:01:06,230 - optuna.study.study - INFO - Trial 129 finished with values: [0.024134923814178918, 0.007947019867549669, 0.021132309969322482] and parameters: {'n_layers': 1, 'embedding_dim': 32, 'lr': 0.0007742554383218026, 'lambda_val': 1.0541423477399953e-06, 'batch_size': 2988, 'optimizer': 'Adam'}.
2026-05-23 23:01:55,692 - optuna.study.study - INFO - Trial 130 finished with values: [0.027319989523885563, 0.008899006622516557, 0.024603847409857323] and parameters: {'n_layers': 2, 'embedding_dim': 64, 'lr': 0.00011705745989056773, 'lambda_val': 5.293319521753168e-06, 'batch_size': 2988, 'optimizer': 'RMSprop'}.
2026-05-23 23:02:40,397 - optuna.study.study - INFO - Trial 131 finished with values: [0.028166232498160255, 0.008849337748344371, 0.024392155136513414] and parameters: {'n_layers': 2, 'embedding_dim': 128, 'lr': 0.00011132803279953378, 'lambda_val': 9.691061665067305e-06, 'batch_size': 3705, 'optimizer': 'RMSprop'}.
2026-05-23 23:02:47,426 - experiment_functions - INFO - Early stopping at epoch 550. Best Metrics: (0.022374781381150715, 0.00808774834437086, 0.02030491583273886)
2026-05-23 23:02:47,524 - optuna.study.study - INFO - Trial 132 finished with values: [0.022374781381150715, 0.00808774834437086, 0.02030491583273886] and parameters: {'n_layers': 2, 'embedding_dim': 256, 'lr': 0.0012665424339139031, 'lambda_val': 0.0028639996941338948, 'batch_size': 1550, 'optimizer': 'Adam'}.
2026-05-23 23:02:56,403 - experiment_functions - INFO - Early stopping at epoch 700. Best Metrics: (0.01919768191817274, 0.006928807947019867, 0.016477423205545367)
2026-05-23 23:02:56,531 - optuna.study.study - INFO - Trial 133 finished with values: [0.01919768191817274, 0.006928807947019867, 0.016477423205545367] and parameters: {'n_layers': 2, 'embedding_dim': 256, 'lr': 0.00028881949474372873, 'lambda_val': 2.9338354415205326e-06, 'batch_size': 2967, 'optimizer': 'RMSprop'}.
2026-05-23 23:03:05,140 - experiment_functions - INFO - Early stopping at epoch 700. Best Metrics: (0.013572416734431202, 0.005504966887417219, 0.011303068624157902)
2026-05-23 23:03:05,247 - optuna.study.study - INFO - Trial 134 finished with values: [0.013572416734431202, 0.005504966887417219, 0.011303068624157902] and parameters: {'n_layers': 3, 'embedding_dim': 128, 'lr': 0.0004485392810298456, 'lambda_val': 4.360746018288999e-05, 'batch_size': 2780, 'optimizer': 'Adam'}.
2026-05-23 23:03:11,443 - experiment_functions - INFO - Early stopping at epoch 500. Best Metrics: (0.005165361430992385, 0.004288079470198676, 0.005377199894069211)
2026-05-23 23:03:12,087 - optuna.study.study - INFO - Trial 135 finished with values: [0.005165361430992385, 0.004288079470198676, 0.005377199894069211] and parameters: {'n_layers': 1, 'embedding_dim': 128, 'lr': 0.00030067783612531895, 'lambda_val': 1.3004468111052655e-05, 'batch_size': 4059, 'optimizer': 'SGD'}.
2026-05-23 23:04:00,605 - optuna.study.study - INFO - Trial 136 finished with values: [0.020218000459685963, 0.007309602649006624, 0.01706385853884319] and parameters: {'n_layers': 4, 'embedding_dim': 256, 'lr': 0.00011132803279953378, 'lambda_val': 1.4421107433833644e-05, 'batch_size': 892, 'optimizer': 'Adam'}.
2026-05-23 23:04:06,775 - experiment_functions - INFO - Early stopping at epoch 500. Best Metrics: (0.005190923580132602, 0.004221854304635762, 0.005572645202982883)
2026-05-23 23:04:06,874 - optuna.study.study - INFO - Trial 137 finished with values: [0.005190923580132602, 0.004221854304635762, 0.005572645202982883] and parameters: {'n_layers': 2, 'embedding_dim': 64, 'lr': 0.001590270509010797, 'lambda_val': 0.0822636177947191, 'batch_size': 2947, 'optimizer': 'SGD'}.
2026-05-23 23:04:15,199 - experiment_functions - INFO - Early stopping at epoch 650. Best Metrics: (0.010447769498465563, 0.005198675496688741, 0.009737595288521493)
2026-05-23 23:04:15,299 - optuna.study.study - INFO - Trial 138 finished with values: [0.010447769498465563, 0.005198675496688741, 0.009737595288521493] and parameters: {'n_layers': 4, 'embedding_dim': 128, 'lr': 0.0004485392810298456, 'lambda_val': 1.285583991555478e-05, 'batch_size': 2617, 'optimizer': 'Adam'}.
2026-05-23 23:04:23,889 - experiment_functions - INFO - Early stopping at epoch 700. Best Metrics: (0.01341315077276038, 0.005314569536423841, 0.01188806992690533)
2026-05-23 23:04:23,983 - optuna.study.study - INFO - Trial 139 finished with values: [0.01341315077276038, 0.005314569536423841, 0.01188806992690533] and parameters: {'n_layers': 4, 'embedding_dim': 128, 'lr': 0.0004485392810298456, 'lambda_val': 1.7439980348390471e-06, 'batch_size': 1061, 'optimizer': 'Adam'}.
2026-05-23 23:04:34,008 - experiment_functions - INFO - Early stopping at epoch 800. Best Metrics: (0.015728733515220483, 0.006274834437086094, 0.012896357618954996)
2026-05-23 23:04:35,066 - optuna.study.study - INFO - Trial 140 finished with values: [0.015728733515220483, 0.006274834437086094, 0.012896357618954996] and parameters: {'n_layers': 4, 'embedding_dim': 128, 'lr': 0.00030067783612531895, 'lambda_val': 0.00031335292673571056, 'batch_size': 1061, 'optimizer': 'Adam'}.
2026-05-23 23:04:46,739 - experiment_functions - INFO - Early stopping at epoch 500. Best Metrics: (0.005893485435564799, 0.0037003311258278146, 0.005055467581350505)
2026-05-23 23:04:47,783 - optuna.study.study - INFO - Trial 141 finished with values: [0.005893485435564799, 0.0037003311258278146, 0.005055467581350505] and parameters: {'n_layers': 1, 'embedding_dim': 128, 'lr': 0.028309798508819872, 'lambda_val': 1.4287009839949832e-06, 'batch_size': 2988, 'optimizer': 'RMSprop'}.
2026-05-23 23:04:56,455 - experiment_functions - INFO - Early stopping at epoch 600. Best Metrics: (0.010032172421934476, 0.0047350993377483445, 0.009177300819078)
2026-05-23 23:04:56,656 - optuna.study.study - INFO - Trial 142 finished with values: [0.010032172421934476, 0.0047350993377483445, 0.009177300819078] and parameters: {'n_layers': 4, 'embedding_dim': 256, 'lr': 0.0003568831204476262, 'lambda_val': 2.829964802645351e-06, 'batch_size': 4059, 'optimizer': 'RMSprop'}.
2026-05-23 23:05:37,590 - optuna.study.study - INFO - Trial 143 finished with values: [0.010198170014053905, 0.004875827814569537, 0.009878035841367181] and parameters: {'n_layers': 4, 'embedding_dim': 32, 'lr': 6.370763283366987e-05, 'lambda_val': 2.9306505502359562e-05, 'batch_size': 627, 'optimizer': 'Adam'}.
2026-05-23 23:05:44,736 - experiment_functions - INFO - Early stopping at epoch 550. Best Metrics: (0.00890865262658043, 0.004387417218543047, 0.0067594262735169415)
2026-05-23 23:05:44,854 - optuna.study.study - INFO - Trial 144 finished with values: [0.00890865262658043, 0.004387417218543047, 0.0067594262735169415] and parameters: {'n_layers': 4, 'embedding_dim': 128, 'lr': 0.003241752579826309, 'lambda_val': 2.430474765536691e-05, 'batch_size': 1824, 'optimizer': 'Adam'}.
2026-05-23 23:05:51,186 - experiment_functions - INFO - Early stopping at epoch 500. Best Metrics: (0.00488092761428169, 0.004089403973509934, 0.005042047212452182)
2026-05-23 23:05:51,289 - optuna.study.study - INFO - Trial 145 finished with values: [0.00488092761428169, 0.004089403973509934, 0.005042047212452182] and parameters: {'n_layers': 2, 'embedding_dim': 256, 'lr': 0.00038723708173308733, 'lambda_val': 0.00044072476163491587, 'batch_size': 892, 'optimizer': 'SGD'}.
2026-05-23 23:05:58,075 - experiment_functions - INFO - Early stopping at epoch 500. Best Metrics: (0.005019977528163858, 0.003932119205298013, 0.00511122865083054)
2026-05-23 23:05:58,802 - optuna.study.study - INFO - Trial 146 finished with values: [0.005019977528163858, 0.003932119205298013, 0.00511122865083054] and parameters: {'n_layers': 4, 'embedding_dim': 256, 'lr': 0.001590270509010797, 'lambda_val': 0.0028639996941338948, 'batch_size': 696, 'optimizer': 'RMSprop'}.
2026-05-23 23:06:05,028 - experiment_functions - INFO - Early stopping at epoch 500. Best Metrics: (0.004618737817303879, 0.004163907284768211, 0.005002592008264001)
2026-05-23 23:06:05,492 - optuna.study.study - INFO - Trial 147 finished with values: [0.004618737817303879, 0.004163907284768211, 0.005002592008264001] and parameters: {'n_layers': 2, 'embedding_dim': 32, 'lr': 0.00038723708173308733, 'lambda_val': 5.293319521753168e-06, 'batch_size': 2988, 'optimizer': 'SGD'}.
2026-05-23 23:06:44,926 - optuna.study.study - INFO - Trial 148 finished with values: [0.020339298865589255, 0.007433774834437087, 0.016420520014182944] and parameters: {'n_layers': 2, 'embedding_dim': 32, 'lr': 0.00011132803279953378, 'lambda_val': 2.9338354415205326e-06, 'batch_size': 1085, 'optimizer': 'Adam'}.
2026-05-23 23:06:51,128 - experiment_functions - INFO - Early stopping at epoch 500. Best Metrics: (0.004854026285293577, 0.003824503311258278, 0.00474497259253732)
2026-05-23 23:06:51,881 - optuna.study.study - INFO - Trial 149 finished with values: [0.004854026285293577, 0.003824503311258278, 0.00474497259253732] and parameters: {'n_layers': 2, 'embedding_dim': 64, 'lr': 0.00011705745989056773, 'lambda_val': 0.028612497858300733, 'batch_size': 2840, 'optimizer': 'RMSprop'}.
2026-05-23 23:07:33,962 - optuna.study.study - INFO - Trial 150 finished with values: [0.027911863226086776, 0.009048013245033114, 0.02593461442876884] and parameters: {'n_layers': 2, 'embedding_dim': 128, 'lr': 0.00011132803279953378, 'lambda_val': 3.136622296234252e-05, 'batch_size': 1661, 'optimizer': 'RMSprop'}.
2026-05-23 23:08:15,145 - optuna.study.study - INFO - Trial 151 finished with values: [0.02323658306739656, 0.007839403973509936, 0.019908223216024028] and parameters: {'n_layers': 1, 'embedding_dim': 64, 'lr': 0.00011132803279953378, 'lambda_val': 1.6221161102260363e-05, 'batch_size': 2840, 'optimizer': 'Adam'}.
2026-05-23 23:08:55,518 - optuna.study.study - INFO - Trial 152 finished with values: [0.01216126423432499, 0.005562913907284768, 0.010861126347454338] and parameters: {'n_layers': 2, 'embedding_dim': 32, 'lr': 9.627214575650417e-05, 'lambda_val': 0.00044072476163491587, 'batch_size': 3226, 'optimizer': 'Adam'}.
2026-05-23 23:09:02,642 - experiment_functions - INFO - Early stopping at epoch 600. Best Metrics: (0.019491412551110494, 0.007086092715231787, 0.016034642597264698)
2026-05-23 23:09:02,782 - optuna.study.study - INFO - Trial 153 finished with values: [0.019491412551110494, 0.007086092715231787, 0.016034642597264698] and parameters: {'n_layers': 2, 'embedding_dim': 32, 'lr': 0.0007742554383218026, 'lambda_val': 2.9338354415205326e-06, 'batch_size': 1085, 'optimizer': 'RMSprop'}.
2026-05-23 23:09:09,889 - experiment_functions - INFO - Early stopping at epoch 600. Best Metrics: (0.026340695461797393, 0.008683774834437087, 0.023130440895452253)
2026-05-23 23:09:10,024 - optuna.study.study - INFO - Trial 154 finished with values: [0.026340695461797393, 0.008683774834437087, 0.023130440895452253] and parameters: {'n_layers': 1, 'embedding_dim': 256, 'lr': 0.0007742554383218026, 'lambda_val': 3.136622296234252e-05, 'batch_size': 667, 'optimizer': 'RMSprop'}.
2026-05-23 23:09:52,420 - optuna.study.study - INFO - Trial 155 finished with values: [0.02442540740997493, 0.007971854304635763, 0.020725029405907047] and parameters: {'n_layers': 2, 'embedding_dim': 128, 'lr': 0.00011705745989056773, 'lambda_val': 5.293319521753168e-06, 'batch_size': 1890, 'optimizer': 'Adam'}.
2026-05-23 23:10:29,432 - experiment_functions - INFO - Early stopping at epoch 3300. Best Metrics: (0.023921081236861368, 0.00798841059602649, 0.01964152419300071)
2026-05-23 23:10:29,536 - optuna.study.study - INFO - Trial 156 finished with values: [0.023921081236861368, 0.00798841059602649, 0.01964152419300071] and parameters: {'n_layers': 3, 'embedding_dim': 128, 'lr': 0.00011132803279953378, 'lambda_val': 0.0005877828856893911, 'batch_size': 3314, 'optimizer': 'RMSprop'}.
2026-05-23 23:10:39,122 - experiment_functions - INFO - Early stopping at epoch 700. Best Metrics: (0.020488537655873617, 0.007259933774834438, 0.01857066542079233)
2026-05-23 23:10:39,305 - optuna.study.study - INFO - Trial 157 finished with values: [0.020488537655873617, 0.007259933774834438, 0.01857066542079233] and parameters: {'n_layers': 2, 'embedding_dim': 256, 'lr': 0.0003568831204476262, 'lambda_val': 1.0525537797663283e-06, 'batch_size': 2206, 'optimizer': 'Adam'}.
2026-05-23 23:10:51,712 - experiment_functions - INFO - Early stopping at epoch 1150. Best Metrics: (0.027703716076779912, 0.00906456953642384, 0.025469522415875162)
2026-05-23 23:10:51,804 - optuna.study.study - INFO - Trial 158 finished with values: [0.027703716076779912, 0.00906456953642384, 0.025469522415875162] and parameters: {'n_layers': 1, 'embedding_dim': 128, 'lr': 0.0003568831204476262, 'lambda_val': 1.0525537797663283e-06, 'batch_size': 627, 'optimizer': 'RMSprop'}.
2026-05-23 23:11:00,487 - experiment_functions - INFO - Early stopping at epoch 700. Best Metrics: (0.013237881879302393, 0.005670529801324503, 0.011126862632291538)
2026-05-23 23:11:00,589 - optuna.study.study - INFO - Trial 159 finished with values: [0.013237881879302393, 0.005670529801324503, 0.011126862632291538] and parameters: {'n_layers': 4, 'embedding_dim': 128, 'lr': 0.0004485392810298456, 'lambda_val': 1.7439980348390471e-06, 'batch_size': 1061, 'optimizer': 'Adam'}.
2026-05-23 23:11:40,359 - optuna.study.study - INFO - Trial 160 finished with values: [0.01836997618534149, 0.006763245033112583, 0.017954044566274023] and parameters: {'n_layers': 2, 'embedding_dim': 32, 'lr': 0.00011132803279953378, 'lambda_val': 3.136622296234252e-05, 'batch_size': 892, 'optimizer': 'Adam'}.
2026-05-23 23:11:49,117 - experiment_functions - INFO - Early stopping at epoch 700. Best Metrics: (0.0156802687616963, 0.00625, 0.013080303105556159)
2026-05-23 23:11:49,215 - optuna.study.study - INFO - Trial 161 finished with values: [0.0156802687616963, 0.00625, 0.013080303105556159] and parameters: {'n_layers': 4, 'embedding_dim': 128, 'lr': 0.0004485392810298456, 'lambda_val': 1.7439980348390471e-06, 'batch_size': 1061, 'optimizer': 'Adam'}.
2026-05-23 23:12:34,527 - optuna.study.study - INFO - Trial 162 finished with values: [0.025842779461137236, 0.00841887417218543, 0.022853785345491262] and parameters: {'n_layers': 3, 'embedding_dim': 128, 'lr': 9.17855523064707e-05, 'lambda_val': 4.360746018288999e-05, 'batch_size': 3950, 'optimizer': 'RMSprop'}.
2026-05-23 23:12:41,061 - experiment_functions - INFO - Early stopping at epoch 550. Best Metrics: (0.017810738638190608, 0.006713576158940397, 0.0152225572980284)
2026-05-23 23:12:41,161 - optuna.study.study - INFO - Trial 163 finished with values: [0.017810738638190608, 0.006713576158940397, 0.0152225572980284] and parameters: {'n_layers': 2, 'embedding_dim': 64, 'lr': 0.0007742554383218026, 'lambda_val': 3.136622296234252e-05, 'batch_size': 1661, 'optimizer': 'RMSprop'}.
2026-05-23 23:12:48,102 - experiment_functions - INFO - Early stopping at epoch 550. Best Metrics: (0.02015540221764994, 0.007243377483443708, 0.017927015706292872)
2026-05-23 23:12:48,200 - optuna.study.study - INFO - Trial 164 finished with values: [0.02015540221764994, 0.007243377483443708, 0.017927015706292872] and parameters: {'n_layers': 2, 'embedding_dim': 256, 'lr': 0.0012665424339139031, 'lambda_val': 1.6221161102260363e-05, 'batch_size': 2121, 'optimizer': 'Adam'}.
2026-05-23 23:12:54,279 - experiment_functions - INFO - Early stopping at epoch 500. Best Metrics: (0.009174133208420593, 0.004536423841059603, 0.007644253170920754)
2026-05-23 23:12:55,132 - optuna.study.study - INFO - Trial 165 finished with values: [0.009174133208420593, 0.004536423841059603, 0.007644253170920754] and parameters: {'n_layers': 2, 'embedding_dim': 64, 'lr': 0.0640007632858696, 'lambda_val': 0.0001637829710580644, 'batch_size': 2988, 'optimizer': 'RMSprop'}.
2026-05-23 23:13:21,308 - experiment_functions - INFO - Early stopping at epoch 2350. Best Metrics: (0.020017468499877976, 0.007094370860927153, 0.01606679264746931)
2026-05-23 23:13:21,410 - optuna.study.study - INFO - Trial 166 finished with values: [0.020017468499877976, 0.007094370860927153, 0.01606679264746931] and parameters: {'n_layers': 2, 'embedding_dim': 128, 'lr': 0.00011132803279953378, 'lambda_val': 2.430474765536691e-05, 'batch_size': 4052, 'optimizer': 'Adam'}.
2026-05-23 23:14:02,774 - optuna.study.study - INFO - Trial 167 finished with values: [0.00967546978534092, 0.005016556291390729, 0.009215712316020372] and parameters: {'n_layers': 1, 'embedding_dim': 256, 'lr': 4.1818313902449076e-05, 'lambda_val': 1.0635438079438544e-06, 'batch_size': 1550, 'optimizer': 'Adam'}.
2026-05-23 23:14:10,929 - experiment_functions - INFO - Early stopping at epoch 700. Best Metrics: (0.01701083268819023, 0.0063327814569536425, 0.014111282928963161)
2026-05-23 23:14:11,890 - optuna.study.study - INFO - Trial 168 finished with values: [0.01701083268819023, 0.0063327814569536425, 0.014111282928963161] and parameters: {'n_layers': 2, 'embedding_dim': 128, 'lr': 0.0004485392810298456, 'lambda_val': 4.360746018288999e-05, 'batch_size': 1956, 'optimizer': 'Adam'}.
2026-05-23 23:14:19,647 - experiment_functions - INFO - Early stopping at epoch 550. Best Metrics: (0.006176283576469742, 0.0037251655629139072, 0.005080982613551881)
2026-05-23 23:14:19,740 - optuna.study.study - INFO - Trial 169 finished with values: [0.006176283576469742, 0.0037251655629139072, 0.005080982613551881] and parameters: {'n_layers': 4, 'embedding_dim': 256, 'lr': 0.0007742554383218026, 'lambda_val': 4.8991750764180146e-05, 'batch_size': 3705, 'optimizer': 'RMSprop'}.
2026-05-23 23:14:26,772 - experiment_functions - INFO - Early stopping at epoch 550. Best Metrics: (0.022016596825396674, 0.007466887417218543, 0.015994857697476668)
2026-05-23 23:14:26,872 - optuna.study.study - INFO - Trial 170 finished with values: [0.022016596825396674, 0.007466887417218543, 0.015994857697476668] and parameters: {'n_layers': 3, 'embedding_dim': 256, 'lr': 0.003241752579826309, 'lambda_val': 2.430474765536691e-05, 'batch_size': 603, 'optimizer': 'Adam'}.
2026-05-23 23:14:35,072 - experiment_functions - INFO - Early stopping at epoch 700. Best Metrics: (0.026122593370605723, 0.008427152317880795, 0.022931935288999946)
2026-05-23 23:14:35,211 - optuna.study.study - INFO - Trial 171 finished with values: [0.026122593370605723, 0.008427152317880795, 0.022931935288999946] and parameters: {'n_layers': 1, 'embedding_dim': 256, 'lr': 0.00039700374197389405, 'lambda_val': 2.430474765536691e-05, 'batch_size': 1894, 'optimizer': 'RMSprop'}.
2026-05-23 23:14:41,924 - experiment_functions - INFO - Early stopping at epoch 500. Best Metrics: (0.0052818556593866505, 0.0041390728476821195, 0.0053302972810170286)
2026-05-23 23:14:42,028 - optuna.study.study - INFO - Trial 172 finished with values: [0.0052818556593866505, 0.0041390728476821195, 0.0053302972810170286] and parameters: {'n_layers': 2, 'embedding_dim': 256, 'lr': 0.0009299462051840892, 'lambda_val': 3.136622296234252e-05, 'batch_size': 3705, 'optimizer': 'SGD'}.
2026-05-23 23:14:53,480 - experiment_functions - INFO - Early stopping at epoch 550. Best Metrics: (0.00550116083935247, 0.004180463576158941, 0.005481261965995383)
