2026-05-24 05:27:00,298 - optuna.study.study - INFO - Trial 51 finished with values: [0.00484906608147151, 0.004031456953642384, 0.005101628015867961] and parameters: {'n_layers': 3, 'embedding_dim': 96, 'lr': 0.0030329118790764138, 'lambda_val': 2.754765277101989e-06, 'batch_size': 1536, 'optimizer': 'SGD'}.
2026-05-24 05:27:07,084 - experiment_functions - INFO - Early stopping at epoch 550. Best Metrics: (0.013572647431009, 0.010149006622516556, 0.013322658735827494)
2026-05-24 05:27:07,716 - optuna.study.study - INFO - Trial 52 finished with values: [0.013572647431009, 0.010149006622516556, 0.013322658735827494] and parameters: {'n_layers': 1, 'embedding_dim': 256, 'lr': 0.0033498782435460272, 'lambda_val': 0.010248606541800688, 'batch_size': 3706, 'optimizer': 'Adam'}.
2026-05-24 05:27:14,443 - experiment_functions - INFO - Early stopping at epoch 550. Best Metrics: (0.018197657864534356, 0.012665562913907285, 0.01790159176199598)
2026-05-24 05:27:14,548 - optuna.study.study - INFO - Trial 53 finished with values: [0.018197657864534356, 0.012665562913907285, 0.01790159176199598] and parameters: {'n_layers': 1, 'embedding_dim': 96, 'lr': 0.00567629368896096, 'lambda_val': 9.854265988535646e-05, 'batch_size': 1575, 'optimizer': 'Adam'}.
2026-05-24 05:27:22,148 - experiment_functions - INFO - Early stopping at epoch 650. Best Metrics: (0.015854128984992832, 0.01130794701986755, 0.01585900102774123)
2026-05-24 05:27:22,246 - optuna.study.study - INFO - Trial 54 finished with values: [0.015854128984992832, 0.01130794701986755, 0.01585900102774123] and parameters: {'n_layers': 1, 'embedding_dim': 128, 'lr': 0.0007449772911574034, 'lambda_val': 0.007620237155778278, 'batch_size': 2878, 'optimizer': 'RMSprop'}.
2026-05-24 05:27:36,449 - experiment_functions - INFO - Early stopping at epoch 1300. Best Metrics: (0.022475588125875166, 0.01788907284768212, 0.022688535271958327)
2026-05-24 05:27:36,750 - optuna.study.study - INFO - Trial 55 finished with values: [0.022475588125875166, 0.01788907284768212, 0.022688535271958327] and parameters: {'n_layers': 2, 'embedding_dim': 32, 'lr': 0.0004890104603780292, 'lambda_val': 0.09383228839891232, 'batch_size': 2716, 'optimizer': 'RMSprop'}.
2026-05-24 05:27:42,700 - experiment_functions - INFO - Early stopping at epoch 500. Best Metrics: (0.007152585713603057, 0.006167218543046357, 0.007719037719590153)
2026-05-24 05:27:43,089 - optuna.study.study - INFO - Trial 56 finished with values: [0.007152585713603057, 0.006167218543046357, 0.007719037719590153] and parameters: {'n_layers': 4, 'embedding_dim': 96, 'lr': 0.03904827819087328, 'lambda_val': 0.0137855947269666, 'batch_size': 1171, 'optimizer': 'RMSprop'}.
2026-05-24 05:27:56,614 - experiment_functions - INFO - Early stopping at epoch 1300. Best Metrics: (0.005306161174254969, 0.004312913907284768, 0.005529984626680556)
2026-05-24 05:27:56,715 - optuna.study.study - INFO - Trial 57 finished with values: [0.005306161174254969, 0.004312913907284768, 0.005529984626680556] and parameters: {'n_layers': 3, 'embedding_dim': 64, 'lr': 0.004512010550703536, 'lambda_val': 8.564158503809343e-06, 'batch_size': 1192, 'optimizer': 'SGD'}.
2026-05-24 05:28:02,643 - experiment_functions - INFO - Early stopping at epoch 500. Best Metrics: (0.005095533091461514, 0.004197019867549669, 0.005238218773635821)
2026-05-24 05:28:03,032 - optuna.study.study - INFO - Trial 58 finished with values: [0.005095533091461514, 0.004197019867549669, 0.005238218773635821] and parameters: {'n_layers': 2, 'embedding_dim': 96, 'lr': 3.853890284485889e-05, 'lambda_val': 0.03418259321223303, 'batch_size': 3746, 'optimizer': 'Adam'}.
2026-05-24 05:28:30,709 - experiment_functions - INFO - Early stopping at epoch 2150. Best Metrics: (0.005154211401538134, 0.004172185430463576, 0.005007937743342536)
2026-05-24 05:28:30,799 - optuna.study.study - INFO - Trial 59 finished with values: [0.005154211401538134, 0.004172185430463576, 0.005007937743342536] and parameters: {'n_layers': 3, 'embedding_dim': 256, 'lr': 0.01915493938891934, 'lambda_val': 8.564158503809343e-06, 'batch_size': 1192, 'optimizer': 'SGD'}.
2026-05-24 05:28:37,145 - experiment_functions - INFO - Early stopping at epoch 550. Best Metrics: (0.012135532433206943, 0.00945364238410596, 0.011887405031078616)
2026-05-24 05:28:37,244 - optuna.study.study - INFO - Trial 60 finished with values: [0.012135532433206943, 0.00945364238410596, 0.011887405031078616] and parameters: {'n_layers': 1, 'embedding_dim': 256, 'lr': 0.04139361549036053, 'lambda_val': 0.00012823292249037775, 'batch_size': 1002, 'optimizer': 'Adam'}.
2026-05-24 05:29:00,483 - experiment_functions - INFO - Early stopping at epoch 2300. Best Metrics: (0.016626999936375658, 0.011912251655629136, 0.016378030044575984)
2026-05-24 05:29:00,582 - optuna.study.study - INFO - Trial 61 finished with values: [0.016626999936375658, 0.011912251655629136, 0.016378030044575984] and parameters: {'n_layers': 1, 'embedding_dim': 256, 'lr': 0.000312176782836151, 'lambda_val': 7.112074068161609e-06, 'batch_size': 1824, 'optimizer': 'RMSprop'}.
2026-05-24 05:29:06,752 - experiment_functions - INFO - Early stopping at epoch 550. Best Metrics: (0.005143251377312235, 0.004155629139072848, 0.005011784924412801)
2026-05-24 05:29:08,503 - optuna.study.study - INFO - Trial 62 finished with values: [0.005143251377312235, 0.004155629139072848, 0.005011784924412801] and parameters: {'n_layers': 2, 'embedding_dim': 128, 'lr': 0.004766962912598677, 'lambda_val': 2.0295896945818796e-06, 'batch_size': 1899, 'optimizer': 'SGD'}.
2026-05-24 05:29:46,311 - optuna.study.study - INFO - Trial 63 finished with values: [0.007039157221975441, 0.005836092715231788, 0.007479018111902792] and parameters: {'n_layers': 2, 'embedding_dim': 128, 'lr': 3.853890284485889e-05, 'lambda_val': 2.9428916086760435e-06, 'batch_size': 3746, 'optimizer': 'RMSprop'}.
2026-05-24 05:29:52,916 - experiment_functions - INFO - Early stopping at epoch 550. Best Metrics: (0.012607636776271702, 0.010182119205298013, 0.012568523047984928)
2026-05-24 05:29:53,009 - optuna.study.study - INFO - Trial 64 finished with values: [0.012607636776271702, 0.010182119205298013, 0.012568523047984928] and parameters: {'n_layers': 1, 'embedding_dim': 256, 'lr': 0.007122747338051435, 'lambda_val': 3.1472646005870695e-06, 'batch_size': 2651, 'optimizer': 'RMSprop'}.
2026-05-24 05:29:59,111 - experiment_functions - INFO - Early stopping at epoch 550. Best Metrics: (0.01762927427350281, 0.012649006622516556, 0.017715824813114758)
2026-05-24 05:29:59,886 - optuna.study.study - INFO - Trial 65 finished with values: [0.01762927427350281, 0.012649006622516556, 0.017715824813114758] and parameters: {'n_layers': 2, 'embedding_dim': 64, 'lr': 0.007293622224659535, 'lambda_val': 0.0028168727253759383, 'batch_size': 1264, 'optimizer': 'Adam'}.
2026-05-24 05:30:17,274 - experiment_functions - INFO - Early stopping at epoch 1500. Best Metrics: (0.021496926016481052, 0.017003311258278146, 0.02255517218495973)
2026-05-24 05:30:17,863 - optuna.study.study - INFO - Trial 66 finished with values: [0.021496926016481052, 0.017003311258278146, 0.02255517218495973] and parameters: {'n_layers': 4, 'embedding_dim': 96, 'lr': 0.0002909391164072771, 'lambda_val': 0.0002702283536384827, 'batch_size': 2144, 'optimizer': 'RMSprop'}.
2026-05-24 05:30:24,764 - experiment_functions - INFO - Early stopping at epoch 550. Best Metrics: (0.014097414143249278, 0.01087748344370861, 0.01447682813533944)
2026-05-24 05:30:24,983 - optuna.study.study - INFO - Trial 67 finished with values: [0.014097414143249278, 0.01087748344370861, 0.01447682813533944] and parameters: {'n_layers': 1, 'embedding_dim': 256, 'lr': 0.00567629368896096, 'lambda_val': 9.854265988535646e-05, 'batch_size': 2492, 'optimizer': 'Adam'}.
2026-05-24 05:30:42,780 - experiment_functions - INFO - Early stopping at epoch 1550. Best Metrics: (0.0189084490575229, 0.016142384105960264, 0.020516318043341426)
2026-05-24 05:30:43,218 - optuna.study.study - INFO - Trial 68 finished with values: [0.0189084490575229, 0.016142384105960264, 0.020516318043341426] and parameters: {'n_layers': 4, 'embedding_dim': 64, 'lr': 0.0002909391164072771, 'lambda_val': 0.004830254272011785, 'batch_size': 3218, 'optimizer': 'RMSprop'}.
2026-05-24 05:30:53,447 - experiment_functions - INFO - Early stopping at epoch 950. Best Metrics: (0.004267722705526476, 0.0036341059602649013, 0.0044933826379515845)
2026-05-24 05:30:53,544 - optuna.study.study - INFO - Trial 69 finished with values: [0.004267722705526476, 0.0036341059602649013, 0.0044933826379515845] and parameters: {'n_layers': 4, 'embedding_dim': 32, 'lr': 0.00705280266148392, 'lambda_val': 2.1355760438149747e-05, 'batch_size': 2573, 'optimizer': 'SGD'}.
2026-05-24 05:31:00,457 - experiment_functions - INFO - Early stopping at epoch 550. Best Metrics: (0.014202454966557988, 0.012044701986754967, 0.015241679087759159)
2026-05-24 05:31:00,553 - optuna.study.study - INFO - Trial 70 finished with values: [0.014202454966557988, 0.012044701986754967, 0.015241679087759159] and parameters: {'n_layers': 3, 'embedding_dim': 64, 'lr': 0.0030329118790764138, 'lambda_val': 5.786389915206107e-05, 'batch_size': 3637, 'optimizer': 'RMSprop'}.
2026-05-24 05:31:06,448 - experiment_functions - INFO - Early stopping at epoch 500. Best Metrics: (0.005060013950696994, 0.0040149006622516555, 0.005071198756343883)
2026-05-24 05:31:07,627 - optuna.study.study - INFO - Trial 71 finished with values: [0.005060013950696994, 0.0040149006622516555, 0.005071198756343883] and parameters: {'n_layers': 4, 'embedding_dim': 96, 'lr': 0.001136165578538667, 'lambda_val': 0.007620237155778278, 'batch_size': 1180, 'optimizer': 'SGD'}.
2026-05-24 05:31:48,303 - optuna.study.study - INFO - Trial 72 finished with values: [0.009041141572337392, 0.006490066225165563, 0.008709707489912198] and parameters: {'n_layers': 3, 'embedding_dim': 96, 'lr': 3.853890284485889e-05, 'lambda_val': 1.9599760337152658e-05, 'batch_size': 3746, 'optimizer': 'RMSprop'}.
2026-05-24 05:32:25,115 - experiment_functions - INFO - Early stopping at epoch 3650. Best Metrics: (0.016218278223103948, 0.011407284768211921, 0.015955916877556434)
2026-05-24 05:32:25,203 - optuna.study.study - INFO - Trial 73 finished with values: [0.016218278223103948, 0.011407284768211921, 0.015955916877556434] and parameters: {'n_layers': 1, 'embedding_dim': 96, 'lr': 0.00017696117021219715, 'lambda_val': 0.002110272822989257, 'batch_size': 3114, 'optimizer': 'Adam'}.
2026-05-24 05:32:31,922 - experiment_functions - INFO - Early stopping at epoch 550. Best Metrics: (0.01178796417505474, 0.01027317880794702, 0.012449323080773305)
2026-05-24 05:32:32,107 - optuna.study.study - INFO - Trial 74 finished with values: [0.01178796417505474, 0.01027317880794702, 0.012449323080773305] and parameters: {'n_layers': 3, 'embedding_dim': 64, 'lr': 0.004512010550703536, 'lambda_val': 0.0028168727253759383, 'batch_size': 2341, 'optimizer': 'RMSprop'}.
2026-05-24 05:32:38,325 - experiment_functions - INFO - Early stopping at epoch 500. Best Metrics: (0.008231903012883634, 0.006490066225165563, 0.008489281897937863)
2026-05-24 05:32:38,447 - optuna.study.study - INFO - Trial 75 finished with values: [0.008231903012883634, 0.006490066225165563, 0.008489281897937863] and parameters: {'n_layers': 2, 'embedding_dim': 256, 'lr': 0.08399718040285457, 'lambda_val': 0.004830254272011785, 'batch_size': 812, 'optimizer': 'RMSprop'}.
2026-05-24 05:33:16,727 - optuna.study.study - INFO - Trial 76 finished with values: [0.02000701565260102, 0.014387417218543048, 0.020248513790359548] and parameters: {'n_layers': 2, 'embedding_dim': 32, 'lr': 0.0003788253863598979, 'lambda_val': 0.00013892846035396848, 'batch_size': 2716, 'optimizer': 'Adam'}.
2026-05-24 05:33:29,095 - experiment_functions - INFO - Early stopping at epoch 1200. Best Metrics: (0.018273614594907197, 0.013402317880794703, 0.01856658588075933)
2026-05-24 05:33:29,186 - optuna.study.study - INFO - Trial 77 finished with values: [0.018273614594907197, 0.013402317880794703, 0.01856658588075933] and parameters: {'n_layers': 2, 'embedding_dim': 32, 'lr': 0.0004890104603780292, 'lambda_val': 0.007620237155778278, 'batch_size': 3745, 'optimizer': 'Adam'}.
2026-05-24 05:33:47,776 - experiment_functions - INFO - Early stopping at epoch 1750. Best Metrics: (0.021928202372571447, 0.01673841059602649, 0.021838605401505156)
2026-05-24 05:33:47,866 - optuna.study.study - INFO - Trial 78 finished with values: [0.021928202372571447, 0.01673841059602649, 0.021838605401505156] and parameters: {'n_layers': 4, 'embedding_dim': 128, 'lr': 0.0002909391164072771, 'lambda_val': 5.78540826635863e-05, 'batch_size': 1612, 'optimizer': 'RMSprop'}.
2026-05-24 05:33:54,470 - experiment_functions - INFO - Early stopping at epoch 550. Best Metrics: (0.01397783397655987, 0.010513245033112585, 0.014092561087018904)
2026-05-24 05:33:54,564 - optuna.study.study - INFO - Trial 79 finished with values: [0.01397783397655987, 0.010513245033112585, 0.014092561087018904] and parameters: {'n_layers': 1, 'embedding_dim': 64, 'lr': 0.007122747338051435, 'lambda_val': 0.00012012014373753211, 'batch_size': 3708, 'optimizer': 'RMSprop'}.
2026-05-24 05:34:01,292 - experiment_functions - INFO - Early stopping at epoch 500. Best Metrics: (0.0050547121880685055, 0.0038658940397350997, 0.004862532124158051)
2026-05-24 05:34:02,082 - optuna.study.study - INFO - Trial 80 finished with values: [0.0050547121880685055, 0.0038658940397350997, 0.004862532124158051] and parameters: {'n_layers': 3, 'embedding_dim': 128, 'lr': 1.1553842940197404e-05, 'lambda_val': 2.635197951896229e-05, 'batch_size': 1899, 'optimizer': 'SGD'}.
2026-05-24 05:34:14,319 - experiment_functions - INFO - Early stopping at epoch 550. Best Metrics: (0.016806378450036682, 0.01245860927152318, 0.016527909225030637)
2026-05-24 05:34:14,426 - optuna.study.study - INFO - Trial 81 finished with values: [0.016806378450036682, 0.01245860927152318, 0.016527909225030637] and parameters: {'n_layers': 1, 'embedding_dim': 128, 'lr': 0.0034008688244003345, 'lambda_val': 2.9428916086760435e-06, 'batch_size': 1501, 'optimizer': 'RMSprop'}.
2026-05-24 05:34:22,198 - experiment_functions - INFO - Early stopping at epoch 600. Best Metrics: (0.014152041742721508, 0.011067880794701985, 0.014691334619091704)
2026-05-24 05:34:22,291 - optuna.study.study - INFO - Trial 82 finished with values: [0.014152041742721508, 0.011067880794701985, 0.014691334619091704] and parameters: {'n_layers': 2, 'embedding_dim': 256, 'lr': 0.0033498782435460272, 'lambda_val': 2.9809066173301263e-06, 'batch_size': 2492, 'optimizer': 'Adam'}.
2026-05-24 05:34:28,754 - experiment_functions - INFO - Early stopping at epoch 550. Best Metrics: (0.01325281378195469, 0.008559602649006622, 0.012208455916280196)
2026-05-24 05:34:28,892 - optuna.study.study - INFO - Trial 83 finished with values: [0.01325281378195469, 0.008559602649006622, 0.012208455916280196] and parameters: {'n_layers': 1, 'embedding_dim': 32, 'lr': 0.00567629368896096, 'lambda_val': 0.09383228839891232, 'batch_size': 2492, 'optimizer': 'Adam'}.
2026-05-24 05:35:01,254 - experiment_functions - INFO - Early stopping at epoch 3400. Best Metrics: (0.004714632993842792, 0.0040562913907284765, 0.005140458564778585)
2026-05-24 05:35:01,346 - optuna.study.study - INFO - Trial 84 finished with values: [0.004714632993842792, 0.0040562913907284765, 0.005140458564778585] and parameters: {'n_layers': 1, 'embedding_dim': 96, 'lr': 0.06910446281372522, 'lambda_val': 1.0136489220381389e-06, 'batch_size': 1536, 'optimizer': 'SGD'}.
2026-05-24 05:35:08,000 - experiment_functions - INFO - Early stopping at epoch 550. Best Metrics: (0.01259413210731852, 0.00980132450331126, 0.012656966847989316)
2026-05-24 05:35:08,669 - optuna.study.study - INFO - Trial 85 finished with values: [0.01259413210731852, 0.00980132450331126, 0.012656966847989316] and parameters: {'n_layers': 2, 'embedding_dim': 32, 'lr': 0.05515736918516321, 'lambda_val': 2.7009268627161978e-06, 'batch_size': 2716, 'optimizer': 'Adam'}.
2026-05-24 05:35:15,394 - experiment_functions - INFO - Early stopping at epoch 550. Best Metrics: (0.013389159507900128, 0.010314569536423842, 0.013225064352323016)
2026-05-24 05:35:16,463 - optuna.study.study - INFO - Trial 86 finished with values: [0.013389159507900128, 0.010314569536423842, 0.013225064352323016] and parameters: {'n_layers': 1, 'embedding_dim': 96, 'lr': 0.03904827819087328, 'lambda_val': 1.9485224711598288e-05, 'batch_size': 1976, 'optimizer': 'Adam'}.
2026-05-24 05:35:32,532 - experiment_functions - INFO - Early stopping at epoch 1550. Best Metrics: (0.009635956644791664, 0.008079470198675496, 0.009760660932141724)
2026-05-24 05:35:33,864 - optuna.study.study - INFO - Trial 87 finished with values: [0.009635956644791664, 0.008079470198675496, 0.009760660932141724] and parameters: {'n_layers': 1, 'embedding_dim': 96, 'lr': 0.0004890104603780292, 'lambda_val': 0.09383228839891232, 'batch_size': 2716, 'optimizer': 'Adam'}.
2026-05-24 05:35:49,762 - experiment_functions - INFO - Early stopping at epoch 1500. Best Metrics: (0.005145270187582396, 0.004312913907284768, 0.005331828516941128)
2026-05-24 05:35:50,365 - optuna.study.study - INFO - Trial 88 finished with values: [0.005145270187582396, 0.004312913907284768, 0.005331828516941128] and parameters: {'n_layers': 4, 'embedding_dim': 96, 'lr': 0.00567629368896096, 'lambda_val': 0.00012366798634633208, 'batch_size': 3548, 'optimizer': 'SGD'}.
2026-05-24 05:35:56,848 - experiment_functions - INFO - Early stopping at epoch 550. Best Metrics: (0.011852713385365128, 0.01060430463576159, 0.012590527551032788)
2026-05-24 05:35:57,429 - optuna.study.study - INFO - Trial 89 finished with values: [0.011852713385365128, 0.01060430463576159, 0.012590527551032788] and parameters: {'n_layers': 4, 'embedding_dim': 32, 'lr': 0.00710351647147223, 'lambda_val': 0.002140680263427037, 'batch_size': 1056, 'optimizer': 'RMSprop'}.
2026-05-24 05:36:03,880 - experiment_functions - INFO - Early stopping at epoch 550. Best Metrics: (0.009880146833024817, 0.009105960264900662, 0.010841829942591575)
2026-05-24 05:36:04,252 - optuna.study.study - INFO - Trial 90 finished with values: [0.009880146833024817, 0.009105960264900662, 0.010841829942591575] and parameters: {'n_layers': 1, 'embedding_dim': 128, 'lr': 0.0033498782435460272, 'lambda_val': 0.007161127108464835, 'batch_size': 2878, 'optimizer': 'RMSprop'}.
2026-05-24 05:36:11,051 - experiment_functions - INFO - Early stopping at epoch 550. Best Metrics: (0.013241976031464951, 0.010024834437086093, 0.012946846221133243)
2026-05-24 05:36:11,680 - optuna.study.study - INFO - Trial 91 finished with values: [0.013241976031464951, 0.010024834437086093, 0.012946846221133243] and parameters: {'n_layers': 1, 'embedding_dim': 256, 'lr': 0.004413263724852242, 'lambda_val': 1.823627061753692e-06, 'batch_size': 2878, 'optimizer': 'RMSprop'}.
2026-05-24 05:36:25,601 - experiment_functions - INFO - Early stopping at epoch 650. Best Metrics: (0.017857529779654272, 0.012764900662251655, 0.0176050661623237)
2026-05-24 05:36:25,704 - optuna.study.study - INFO - Trial 92 finished with values: [0.017857529779654272, 0.012764900662251655, 0.0176050661623237] and parameters: {'n_layers': 1, 'embedding_dim': 96, 'lr': 0.001136165578538667, 'lambda_val': 3.1472646005870695e-06, 'batch_size': 2651, 'optimizer': 'RMSprop'}.
2026-05-24 05:36:32,660 - experiment_functions - INFO - Early stopping at epoch 500. Best Metrics: (0.009534138795532601, 0.007839403973509934, 0.01013075217526573)
2026-05-24 05:36:32,758 - optuna.study.study - INFO - Trial 93 finished with values: [0.009534138795532601, 0.007839403973509934, 0.01013075217526573] and parameters: {'n_layers': 3, 'embedding_dim': 256, 'lr': 0.014749507525991419, 'lambda_val': 0.001588524177660914, 'batch_size': 1834, 'optimizer': 'RMSprop'}.
2026-05-24 05:36:39,247 - experiment_functions - INFO - Early stopping at epoch 500. Best Metrics: (0.005093262146421143, 0.004230132450331126, 0.0050901565676545885)
2026-05-24 05:36:40,509 - optuna.study.study - INFO - Trial 94 finished with values: [0.005093262146421143, 0.004230132450331126, 0.0050901565676545885] and parameters: {'n_layers': 3, 'embedding_dim': 96, 'lr': 0.00027673871514725777, 'lambda_val': 6.228992486003483e-06, 'batch_size': 3746, 'optimizer': 'SGD'}.
2026-05-24 05:36:47,316 - experiment_functions - INFO - Early stopping at epoch 500. Best Metrics: (0.004654294602228173, 0.003791390728476821, 0.004703827920339408)
2026-05-24 05:36:47,411 - optuna.study.study - INFO - Trial 95 finished with values: [0.004654294602228173, 0.003791390728476821, 0.004703827920339408] and parameters: {'n_layers': 4, 'embedding_dim': 96, 'lr': 3.853890284485889e-05, 'lambda_val': 0.03418259321223303, 'batch_size': 3746, 'optimizer': 'RMSprop'}.
2026-05-24 05:36:57,946 - experiment_functions - INFO - Early stopping at epoch 850. Best Metrics: (0.023259261414831294, 0.01802980132450331, 0.023802448200040308)
2026-05-24 05:36:58,648 - optuna.study.study - INFO - Trial 96 finished with values: [0.023259261414831294, 0.01802980132450331, 0.023802448200040308] and parameters: {'n_layers': 2, 'embedding_dim': 32, 'lr': 0.0007714507483516837, 'lambda_val': 0.09383228839891232, 'batch_size': 2716, 'optimizer': 'RMSprop'}.
2026-05-24 05:37:08,309 - experiment_functions - INFO - Early stopping at epoch 750. Best Metrics: (0.014665175402185529, 0.011639072847682121, 0.015116107131060876)
