2026-05-24 01:13:32,930 - optuna.study.study - INFO - Trial 299 finished with values: [0.019970249103808027, 0.016622516556291392, 0.021667353790849518] and parameters: {'n_layers': 4, 'embedding_dim': 32, 'lr': 0.0005555935556782479, 'lambda_val': 0.0013089325113607559, 'batch_size': 2478, 'optimizer': 'RMSprop'}.
2026-05-24 01:13:32,945 - root - INFO - Selected Trial 216 based on Max ndcg: 0.0275
2026-05-24 01:13:32,945 - root - INFO - Associated Recall: 0.0265
2026-05-24 01:13:32,945 - experiment_functions - INFO - Training the best model ... for e_1M_1c1dcs_strict_rand1
2026-05-24 01:14:11,993 - root - INFO -   **** Training e_1M_1c1dcs_strict_rand2
2026-05-24 01:14:11,998 - root - INFO -   **** Getting 11896/805443 random edges
2026-05-24 01:14:12,112 - optuna.storages._rdb.storage - INFO - A new study created in RDB with name: Study_e_1M_1c1dcs_strict_rand2
2026-05-24 01:14:26,101 - experiment_functions - INFO - Early stopping at epoch 1450. Best Metrics: (0.0049249096325574265, 0.004105960264900663, 0.004942882672184998)
2026-05-24 01:14:26,453 - optuna.study.study - INFO - Trial 0 finished with values: [0.0049249096325574265, 0.004105960264900663, 0.004942882672184998] and parameters: {'n_layers': 1, 'embedding_dim': 96, 'lr': 0.025213536643147634, 'lambda_val': 0.0005306728325913248, 'batch_size': 1084, 'optimizer': 'SGD'}.
2026-05-24 01:14:33,351 - experiment_functions - INFO - Early stopping at epoch 500. Best Metrics: (0.005536746890321026, 0.004072847682119206, 0.005434035570237051)
2026-05-24 01:14:33,876 - optuna.study.study - INFO - Trial 1 finished with values: [0.005536746890321026, 0.004072847682119206, 0.005434035570237051] and parameters: {'n_layers': 3, 'embedding_dim': 256, 'lr': 0.006376235997279223, 'lambda_val': 0.018678503621327155, 'batch_size': 2172, 'optimizer': 'SGD'}.
2026-05-24 01:15:14,282 - optuna.study.study - INFO - Trial 2 finished with values: [0.016518188744338844, 0.012748344370860927, 0.017138901745502092] and parameters: {'n_layers': 2, 'embedding_dim': 96, 'lr': 0.00022989266518175493, 'lambda_val': 2.182273739992126e-05, 'batch_size': 3106, 'optimizer': 'RMSprop'}.
2026-05-24 01:15:25,648 - experiment_functions - INFO - Early stopping at epoch 1100. Best Metrics: (0.007503919887350042, 0.007839403973509936, 0.009215213003181923)
2026-05-24 01:15:26,640 - optuna.study.study - INFO - Trial 3 finished with values: [0.007503919887350042, 0.007839403973509936, 0.009215213003181923] and parameters: {'n_layers': 4, 'embedding_dim': 32, 'lr': 0.0066909817110652366, 'lambda_val': 0.06530239771643709, 'batch_size': 1395, 'optimizer': 'RMSprop'}.
2026-05-24 01:15:33,398 - experiment_functions - INFO - Early stopping at epoch 550. Best Metrics: (0.017852575284907954, 0.012756622516556293, 0.01751657248756951)
2026-05-24 01:15:33,498 - optuna.study.study - INFO - Trial 4 finished with values: [0.017852575284907954, 0.012756622516556293, 0.01751657248756951] and parameters: {'n_layers': 2, 'embedding_dim': 96, 'lr': 0.005852380695113062, 'lambda_val': 0.00010466579371271554, 'batch_size': 1362, 'optimizer': 'Adam'}.
2026-05-24 01:16:15,793 - optuna.study.study - INFO - Trial 5 finished with values: [0.01729353824108048, 0.013286423841059603, 0.018079255075889575] and parameters: {'n_layers': 3, 'embedding_dim': 128, 'lr': 0.00013176103494263525, 'lambda_val': 3.515785851729092e-05, 'batch_size': 2288, 'optimizer': 'Adam'}.
2026-05-24 01:16:57,195 - optuna.study.study - INFO - Trial 6 finished with values: [0.015503303702049864, 0.012036423841059603, 0.01640819847494579] and parameters: {'n_layers': 2, 'embedding_dim': 64, 'lr': 0.00019509942015877229, 'lambda_val': 0.00046616387875468264, 'batch_size': 3893, 'optimizer': 'Adam'}.
2026-05-24 01:17:42,079 - optuna.study.study - INFO - Trial 7 finished with values: [0.01519963545613869, 0.011407284768211921, 0.01529482731881621] and parameters: {'n_layers': 2, 'embedding_dim': 256, 'lr': 0.0002366530914941107, 'lambda_val': 2.460268686247144e-06, 'batch_size': 2213, 'optimizer': 'Adam'}.
2026-05-24 01:17:48,283 - experiment_functions - INFO - Early stopping at epoch 500. Best Metrics: (0.004990166482670499, 0.004089403973509934, 0.0052441278326881635)
2026-05-24 01:17:49,143 - optuna.study.study - INFO - Trial 8 finished with values: [0.004990166482670499, 0.004089403973509934, 0.0052441278326881635] and parameters: {'n_layers': 2, 'embedding_dim': 96, 'lr': 0.06318452305109733, 'lambda_val': 0.09102881555951325, 'batch_size': 1399, 'optimizer': 'SGD'}.
2026-05-24 01:17:55,550 - experiment_functions - INFO - Early stopping at epoch 500. Best Metrics: (0.005129758206875184, 0.0040976821192052985, 0.005201710054335473)
2026-05-24 01:17:55,813 - optuna.study.study - INFO - Trial 9 finished with values: [0.005129758206875184, 0.0040976821192052985, 0.005201710054335473] and parameters: {'n_layers': 3, 'embedding_dim': 256, 'lr': 3.6928340184332895e-05, 'lambda_val': 1.4652981275810046e-05, 'batch_size': 1660, 'optimizer': 'SGD'}.
2026-05-24 01:18:35,906 - optuna.study.study - INFO - Trial 10 finished with values: [0.01648490739379417, 0.012036423841059603, 0.01659458943372299] and parameters: {'n_layers': 3, 'embedding_dim': 64, 'lr': 0.0001329598595798264, 'lambda_val': 1.407610088867906e-05, 'batch_size': 2155, 'optimizer': 'Adam'}.
2026-05-24 01:19:15,892 - optuna.study.study - INFO - Trial 11 finished with values: [0.014494771362870964, 0.010993377483443709, 0.014824084848990492] and parameters: {'n_layers': 4, 'embedding_dim': 96, 'lr': 8.832720040270487e-05, 'lambda_val': 3.281017887674271e-05, 'batch_size': 3812, 'optimizer': 'RMSprop'}.
2026-05-24 01:19:21,596 - experiment_functions - INFO - Early stopping at epoch 500. Best Metrics: (0.005479909758628517, 0.00423841059602649, 0.005501941150174111)
2026-05-24 01:19:21,735 - optuna.study.study - INFO - Trial 12 finished with values: [0.005479909758628517, 0.00423841059602649, 0.005501941150174111] and parameters: {'n_layers': 2, 'embedding_dim': 96, 'lr': 3.0162265701435114e-05, 'lambda_val': 0.058904420301288354, 'batch_size': 1471, 'optimizer': 'SGD'}.
2026-05-24 01:19:27,401 - experiment_functions - INFO - Early stopping at epoch 500. Best Metrics: (0.005120406740983789, 0.004114238410596027, 0.004988823061104416)
2026-05-24 01:19:27,739 - optuna.study.study - INFO - Trial 13 finished with values: [0.005120406740983789, 0.004114238410596027, 0.004988823061104416] and parameters: {'n_layers': 2, 'embedding_dim': 128, 'lr': 0.000516874343535887, 'lambda_val': 0.00010062095176597195, 'batch_size': 1736, 'optimizer': 'SGD'}.
2026-05-24 01:20:03,236 - experiment_functions - INFO - Early stopping at epoch 3900. Best Metrics: (0.006270420733521685, 0.004991721854304636, 0.006786218784486979)
2026-05-24 01:20:04,052 - optuna.study.study - INFO - Trial 14 finished with values: [0.006270420733521685, 0.004991721854304636, 0.006786218784486979] and parameters: {'n_layers': 1, 'embedding_dim': 64, 'lr': 3.575741187418932e-05, 'lambda_val': 0.0007438990257531176, 'batch_size': 1502, 'optimizer': 'Adam'}.
2026-05-24 01:20:30,494 - experiment_functions - INFO - Early stopping at epoch 2350. Best Metrics: (0.005381835691963935, 0.004437086092715232, 0.005487013193229681)
2026-05-24 01:20:31,435 - optuna.study.study - INFO - Trial 15 finished with values: [0.005381835691963935, 0.004437086092715232, 0.005487013193229681] and parameters: {'n_layers': 3, 'embedding_dim': 256, 'lr': 0.03166710919149723, 'lambda_val': 2.1623754524614032e-05, 'batch_size': 2105, 'optimizer': 'SGD'}.
2026-05-24 01:20:39,296 - experiment_functions - INFO - Early stopping at epoch 650. Best Metrics: (0.01659578022282927, 0.012781456953642387, 0.017107421500317622)
2026-05-24 01:20:39,397 - optuna.study.study - INFO - Trial 16 finished with values: [0.01659578022282927, 0.012781456953642387, 0.017107421500317622] and parameters: {'n_layers': 3, 'embedding_dim': 64, 'lr': 0.001254073391314583, 'lambda_val': 0.003592565815384345, 'batch_size': 4026, 'optimizer': 'Adam'}.
2026-05-24 01:21:20,776 - optuna.study.study - INFO - Trial 17 finished with values: [0.01966932013823068, 0.013816225165562912, 0.01991715783886225] and parameters: {'n_layers': 1, 'embedding_dim': 32, 'lr': 0.0003847621589190308, 'lambda_val': 0.00034146769308132945, 'batch_size': 4005, 'optimizer': 'RMSprop'}.
2026-05-24 01:21:26,615 - experiment_functions - INFO - Early stopping at epoch 500. Best Metrics: (0.005334235382126284, 0.004197019867549669, 0.0053147615059254)
2026-05-24 01:21:27,516 - optuna.study.study - INFO - Trial 18 finished with values: [0.005334235382126284, 0.004197019867549669, 0.0053147615059254] and parameters: {'n_layers': 1, 'embedding_dim': 96, 'lr': 0.0028273233890272896, 'lambda_val': 0.04315639111953001, 'batch_size': 1111, 'optimizer': 'SGD'}.
2026-05-24 01:21:33,337 - experiment_functions - INFO - Early stopping at epoch 500. Best Metrics: (0.006578619272659798, 0.004486754966887417, 0.0060831919088054015)
2026-05-24 01:21:34,311 - optuna.study.study - INFO - Trial 19 finished with values: [0.006578619272659798, 0.004486754966887417, 0.0060831919088054015] and parameters: {'n_layers': 2, 'embedding_dim': 96, 'lr': 2.283297349480332e-05, 'lambda_val': 0.00028556990155787, 'batch_size': 2048, 'optimizer': 'SGD'}.
2026-05-24 01:21:40,451 - experiment_functions - INFO - Early stopping at epoch 500. Best Metrics: (0.008107836919255854, 0.006672185430463576, 0.008432875806344496)
2026-05-24 01:21:40,853 - optuna.study.study - INFO - Trial 20 finished with values: [0.008107836919255854, 0.006672185430463576, 0.008432875806344496] and parameters: {'n_layers': 1, 'embedding_dim': 256, 'lr': 0.009682712385462021, 'lambda_val': 0.012208803351137528, 'batch_size': 925, 'optimizer': 'RMSprop'}.
2026-05-24 01:21:46,875 - experiment_functions - INFO - Early stopping at epoch 500. Best Metrics: (0.004518372336152621, 0.003890728476821192, 0.004741253692156908)
2026-05-24 01:21:46,966 - optuna.study.study - INFO - Trial 21 finished with values: [0.004518372336152621, 0.003890728476821192, 0.004741253692156908] and parameters: {'n_layers': 4, 'embedding_dim': 32, 'lr': 0.00014762724938663778, 'lambda_val': 0.025508939522638042, 'batch_size': 1013, 'optimizer': 'Adam'}.
2026-05-24 01:22:24,256 - optuna.study.study - INFO - Trial 22 finished with values: [0.005675453789428894, 0.00478476821192053, 0.00590445762841198] and parameters: {'n_layers': 1, 'embedding_dim': 96, 'lr': 1.5754536094265085e-05, 'lambda_val': 0.00043944063270848416, 'batch_size': 1674, 'optimizer': 'RMSprop'}.
2026-05-24 01:22:37,904 - experiment_functions - INFO - Early stopping at epoch 1250. Best Metrics: (0.022868004107305644, 0.015281456953642386, 0.02233648929724046)
2026-05-24 01:22:37,991 - optuna.study.study - INFO - Trial 23 finished with values: [0.022868004107305644, 0.015281456953642386, 0.02233648929724046] and parameters: {'n_layers': 1, 'embedding_dim': 32, 'lr': 0.0007459913147507348, 'lambda_val': 0.004825444205218699, 'batch_size': 795, 'optimizer': 'RMSprop'}.
2026-05-24 01:22:50,808 - experiment_functions - INFO - Early stopping at epoch 1150. Best Metrics: (0.009205164731988567, 0.008625827814569538, 0.010283382130164519)
2026-05-24 01:22:51,163 - optuna.study.study - INFO - Trial 24 finished with values: [0.009205164731988567, 0.008625827814569538, 0.010283382130164519] and parameters: {'n_layers': 4, 'embedding_dim': 128, 'lr': 0.004599696596434292, 'lambda_val': 0.08511861936492485, 'batch_size': 681, 'optimizer': 'Adam'}.
2026-05-24 01:22:57,839 - experiment_functions - INFO - Early stopping at epoch 550. Best Metrics: (0.015429246555413056, 0.012408940397350991, 0.016118780152287043)
2026-05-24 01:22:57,966 - optuna.study.study - INFO - Trial 25 finished with values: [0.015429246555413056, 0.012408940397350991, 0.016118780152287043] and parameters: {'n_layers': 2, 'embedding_dim': 32, 'lr': 0.004320951557015901, 'lambda_val': 1.1443429579581734e-05, 'batch_size': 3241, 'optimizer': 'RMSprop'}.
2026-05-24 01:23:13,900 - experiment_functions - INFO - Early stopping at epoch 1350. Best Metrics: (0.021599913359395175, 0.016605960264900663, 0.022356697467967066)
2026-05-24 01:23:14,052 - optuna.study.study - INFO - Trial 26 finished with values: [0.021599913359395175, 0.016605960264900663, 0.022356697467967066] and parameters: {'n_layers': 3, 'embedding_dim': 96, 'lr': 0.0005233015481570266, 'lambda_val': 0.0009443756499535536, 'batch_size': 652, 'optimizer': 'RMSprop'}.
2026-05-24 01:23:23,251 - experiment_functions - INFO - Early stopping at epoch 500. Best Metrics: (0.004976835428428249, 0.003882450331125828, 0.004925772155978418)
2026-05-24 01:23:23,994 - optuna.study.study - INFO - Trial 27 finished with values: [0.004976835428428249, 0.003882450331125828, 0.004925772155978418] and parameters: {'n_layers': 4, 'embedding_dim': 32, 'lr': 2.133457805309601e-05, 'lambda_val': 0.02861834109399891, 'batch_size': 1032, 'optimizer': 'SGD'}.
2026-05-24 01:23:30,013 - experiment_functions - INFO - Early stopping at epoch 500. Best Metrics: (0.00515476391020752, 0.004172185430463576, 0.005314209891964881)
2026-05-24 01:23:30,417 - optuna.study.study - INFO - Trial 28 finished with values: [0.00515476391020752, 0.004172185430463576, 0.005314209891964881] and parameters: {'n_layers': 1, 'embedding_dim': 64, 'lr': 1.4543192979510406e-05, 'lambda_val': 0.05582046710492708, 'batch_size': 3684, 'optimizer': 'RMSprop'}.
2026-05-24 01:23:36,961 - experiment_functions - INFO - Early stopping at epoch 550. Best Metrics: (0.010825316370764301, 0.009031456953642384, 0.011346133317721266)
2026-05-24 01:23:37,042 - optuna.study.study - INFO - Trial 29 finished with values: [0.010825316370764301, 0.009031456953642384, 0.011346133317721266] and parameters: {'n_layers': 3, 'embedding_dim': 96, 'lr': 0.011889395183389205, 'lambda_val': 9.865482927727533e-05, 'batch_size': 1284, 'optimizer': 'RMSprop'}.
2026-05-24 01:23:42,855 - experiment_functions - INFO - Early stopping at epoch 500. Best Metrics: (0.005435064959283216, 0.00435430463576159, 0.005645750150384992)
2026-05-24 01:23:43,101 - optuna.study.study - INFO - Trial 30 finished with values: [0.005435064959283216, 0.00435430463576159, 0.005645750150384992] and parameters: {'n_layers': 2, 'embedding_dim': 96, 'lr': 0.07087177866466375, 'lambda_val': 0.036439244479801895, 'batch_size': 528, 'optimizer': 'SGD'}.
2026-05-24 01:23:50,994 - experiment_functions - INFO - Early stopping at epoch 700. Best Metrics: (0.00476191350374207, 0.004221854304635762, 0.005114777088670663)
2026-05-24 01:23:51,093 - optuna.study.study - INFO - Trial 31 finished with values: [0.00476191350374207, 0.004221854304635762, 0.005114777088670663] and parameters: {'n_layers': 3, 'embedding_dim': 32, 'lr': 0.013366015767924299, 'lambda_val': 5.315618527423719e-05, 'batch_size': 2772, 'optimizer': 'SGD'}.
2026-05-24 01:23:59,350 - experiment_functions - INFO - Early stopping at epoch 700. Best Metrics: (0.01589635771381599, 0.011705298013245033, 0.01603271121579759)
2026-05-24 01:24:00,383 - optuna.study.study - INFO - Trial 32 finished with values: [0.01589635771381599, 0.011705298013245033, 0.01603271121579759] and parameters: {'n_layers': 1, 'embedding_dim': 128, 'lr': 0.001268209095831261, 'lambda_val': 0.0019859082657926997, 'batch_size': 3586, 'optimizer': 'Adam'}.
2026-05-24 01:24:40,675 - optuna.study.study - INFO - Trial 33 finished with values: [0.006641468389708365, 0.005438741721854303, 0.00720915308269745] and parameters: {'n_layers': 1, 'embedding_dim': 128, 'lr': 3.543969928439421e-05, 'lambda_val': 1.0121139928255608e-06, 'batch_size': 1907, 'optimizer': 'RMSprop'}.
2026-05-24 01:25:03,117 - experiment_functions - INFO - Early stopping at epoch 2200. Best Metrics: (0.004848921099850687, 0.004089403973509934, 0.005237829969215942)
2026-05-24 01:25:03,205 - optuna.study.study - INFO - Trial 34 finished with values: [0.004848921099850687, 0.004089403973509934, 0.005237829969215942] and parameters: {'n_layers': 3, 'embedding_dim': 96, 'lr': 0.07364871401803891, 'lambda_val': 0.003110248138038542, 'batch_size': 3864, 'optimizer': 'SGD'}.
2026-05-24 01:25:42,230 - optuna.study.study - INFO - Trial 35 finished with values: [0.01295921497020251, 0.009966887417218543, 0.013584637750349985] and parameters: {'n_layers': 1, 'embedding_dim': 96, 'lr': 0.00011208408382523636, 'lambda_val': 1.4801449770617434e-06, 'batch_size': 3301, 'optimizer': 'RMSprop'}.
2026-05-24 01:25:49,334 - experiment_functions - INFO - Early stopping at epoch 600. Best Metrics: (0.02295261905354653, 0.01735927152317881, 0.023202818198881908)
2026-05-24 01:25:49,419 - optuna.study.study - INFO - Trial 36 finished with values: [0.02295261905354653, 0.01735927152317881, 0.023202818198881908] and parameters: {'n_layers': 4, 'embedding_dim': 64, 'lr': 0.003175767497275054, 'lambda_val': 1.1741946550104087e-06, 'batch_size': 847, 'optimizer': 'Adam'}.
2026-05-24 01:25:55,152 - experiment_functions - INFO - Early stopping at epoch 500. Best Metrics: (0.0053886460500189364, 0.0043708609271523174, 0.005421702911234753)
2026-05-24 01:25:55,239 - optuna.study.study - INFO - Trial 37 finished with values: [0.0053886460500189364, 0.0043708609271523174, 0.005421702911234753] and parameters: {'n_layers': 2, 'embedding_dim': 96, 'lr': 1.1599018450439644e-05, 'lambda_val': 0.09110107909394201, 'batch_size': 1328, 'optimizer': 'SGD'}.
2026-05-24 01:26:01,021 - experiment_functions - INFO - Early stopping at epoch 500. Best Metrics: (0.005595509814643014, 0.004114238410596027, 0.0053526212053897375)
2026-05-24 01:26:01,117 - optuna.study.study - INFO - Trial 38 finished with values: [0.005595509814643014, 0.004114238410596027, 0.0053526212053897375] and parameters: {'n_layers': 4, 'embedding_dim': 32, 'lr': 0.00020698621093568563, 'lambda_val': 0.0007474419200611069, 'batch_size': 3717, 'optimizer': 'SGD'}.
2026-05-24 01:26:07,817 - experiment_functions - INFO - Early stopping at epoch 550. Best Metrics: (0.009846153059920329, 0.007847682119205298, 0.009930432206292042)
2026-05-24 01:26:07,921 - optuna.study.study - INFO - Trial 39 finished with values: [0.009846153059920329, 0.007847682119205298, 0.009930432206292042] and parameters: {'n_layers': 1, 'embedding_dim': 256, 'lr': 0.07280438350821411, 'lambda_val': 0.00012201156746616951, 'batch_size': 2493, 'optimizer': 'Adam'}.
2026-05-24 01:26:43,048 - experiment_functions - INFO - Early stopping at epoch 3500. Best Metrics: (0.017579211171637764, 0.012144039735099336, 0.017546725317664724)
2026-05-24 01:26:43,150 - optuna.study.study - INFO - Trial 40 finished with values: [0.017579211171637764, 0.012144039735099336, 0.017546725317664724] and parameters: {'n_layers': 1, 'embedding_dim': 64, 'lr': 0.0001986105443631555, 'lambda_val': 1.1540981830430722e-05, 'batch_size': 3238, 'optimizer': 'RMSprop'}.
2026-05-24 01:27:22,092 - optuna.study.study - INFO - Trial 41 finished with values: [0.008707205768514522, 0.006879139072847683, 0.009132372361438571] and parameters: {'n_layers': 3, 'embedding_dim': 96, 'lr': 4.842135369182381e-05, 'lambda_val': 0.002720399768458268, 'batch_size': 3150, 'optimizer': 'RMSprop'}.
2026-05-24 01:27:28,358 - experiment_functions - INFO - Early stopping at epoch 500. Best Metrics: (0.009191682801596157, 0.007359271523178808, 0.009415042520180932)
2026-05-24 01:27:29,448 - optuna.study.study - INFO - Trial 42 finished with values: [0.009191682801596157, 0.007359271523178808, 0.009415042520180932] and parameters: {'n_layers': 4, 'embedding_dim': 128, 'lr': 0.017456045198614815, 'lambda_val': 0.00014088656710042042, 'batch_size': 1315, 'optimizer': 'RMSprop'}.
2026-05-24 01:27:35,293 - experiment_functions - INFO - Early stopping at epoch 500. Best Metrics: (0.005495232475976681, 0.00451158940397351, 0.005650783516717811)
2026-05-24 01:27:35,547 - optuna.study.study - INFO - Trial 43 finished with values: [0.005495232475976681, 0.00451158940397351, 0.005650783516717811] and parameters: {'n_layers': 2, 'embedding_dim': 32, 'lr': 0.004671785645491594, 'lambda_val': 3.937911987134133e-06, 'batch_size': 3309, 'optimizer': 'SGD'}.
2026-05-24 01:27:42,029 - experiment_functions - INFO - Early stopping at epoch 550. Best Metrics: (0.012586668362974084, 0.010198675496688741, 0.01298787933564835)
2026-05-24 01:27:42,207 - optuna.study.study - INFO - Trial 44 finished with values: [0.012586668362974084, 0.010198675496688741, 0.01298787933564835] and parameters: {'n_layers': 2, 'embedding_dim': 96, 'lr': 0.007215394766534314, 'lambda_val': 0.0003552832826716903, 'batch_size': 1343, 'optimizer': 'RMSprop'}.
2026-05-24 01:27:48,138 - experiment_functions - INFO - Early stopping at epoch 500. Best Metrics: (0.004937568040117635, 0.004130794701986755, 0.005020028539876662)
2026-05-24 01:27:49,604 - optuna.study.study - INFO - Trial 45 finished with values: [0.004937568040117635, 0.004130794701986755, 0.005020028539876662] and parameters: {'n_layers': 1, 'embedding_dim': 256, 'lr': 0.00039390593919075566, 'lambda_val': 0.0006212588130791788, 'batch_size': 884, 'optimizer': 'SGD'}.
2026-05-24 01:28:00,360 - experiment_functions - INFO - Early stopping at epoch 950. Best Metrics: (0.018046453984257266, 0.012748344370860927, 0.0180090117854422)
2026-05-24 01:28:01,898 - optuna.study.study - INFO - Trial 46 finished with values: [0.018046453984257266, 0.012748344370860927, 0.0180090117854422] and parameters: {'n_layers': 1, 'embedding_dim': 96, 'lr': 0.0011689507386455319, 'lambda_val': 8.226184191014992e-05, 'batch_size': 1080, 'optimizer': 'Adam'}.
2026-05-24 01:28:08,292 - experiment_functions - INFO - Early stopping at epoch 500. Best Metrics: (0.008823424661042365, 0.006879139072847681, 0.009436322863533148)
