2026-05-24 15:53:56,611 - optuna.study.study - INFO - Trial 27 finished with values: [0.035299558199301695, 0.011001655629139073, 0.026400557339770692] and parameters: {'n_layers': 3, 'embedding_dim': 128, 'lr': 0.00014827150350050635, 'lambda_val': 2.523449139198518e-05, 'batch_size': 1097, 'optimizer': 'Adam'}.
2026-05-24 15:54:02,804 - experiment_functions - INFO - Early stopping at epoch 500. Best Metrics: (0.0054030655759532, 0.003948675496688742, 0.0052832071758568)
2026-05-24 15:54:02,904 - optuna.study.study - INFO - Trial 28 finished with values: [0.0054030655759532, 0.003948675496688742, 0.0052832071758568] and parameters: {'n_layers': 4, 'embedding_dim': 128, 'lr': 0.00924501177008738, 'lambda_val': 0.005642241489507497, 'batch_size': 1699, 'optimizer': 'Adam'}.
2026-05-24 15:54:50,659 - optuna.study.study - INFO - Trial 29 finished with values: [0.013698954723607331, 0.0060099337748344365, 0.011659203017729868] and parameters: {'n_layers': 4, 'embedding_dim': 256, 'lr': 4.0356073708756354e-05, 'lambda_val': 0.00031091903696978807, 'batch_size': 1463, 'optimizer': 'Adam'}.
2026-05-24 15:54:56,933 - experiment_functions - INFO - Early stopping at epoch 550. Best Metrics: (0.012523259937516398, 0.004552980132450331, 0.007339066799215209)
2026-05-24 15:54:57,138 - optuna.study.study - INFO - Trial 30 finished with values: [0.012523259937516398, 0.004552980132450331, 0.007339066799215209] and parameters: {'n_layers': 1, 'embedding_dim': 96, 'lr': 0.0038122363815175056, 'lambda_val': 5.897592552004812e-06, 'batch_size': 1062, 'optimizer': 'RMSprop'}.
2026-05-24 15:55:03,016 - experiment_functions - INFO - Early stopping at epoch 500. Best Metrics: (0.0053133346003148806, 0.00423841059602649, 0.005320069075958901)
2026-05-24 15:55:03,279 - optuna.study.study - INFO - Trial 31 finished with values: [0.0053133346003148806, 0.00423841059602649, 0.005320069075958901] and parameters: {'n_layers': 1, 'embedding_dim': 96, 'lr': 0.0012971109624756183, 'lambda_val': 0.0001320099474533975, 'batch_size': 957, 'optimizer': 'SGD'}.
2026-05-24 15:55:09,259 - experiment_functions - INFO - Early stopping at epoch 500. Best Metrics: (0.0052528483423311435, 0.004097682119205298, 0.0053913477059137445)
2026-05-24 15:55:09,604 - optuna.study.study - INFO - Trial 32 finished with values: [0.0052528483423311435, 0.004097682119205298, 0.0053913477059137445] and parameters: {'n_layers': 2, 'embedding_dim': 32, 'lr': 0.0032732379007850278, 'lambda_val': 1.2584008258141712e-05, 'batch_size': 2363, 'optimizer': 'RMSprop'}.
2026-05-24 15:55:20,273 - experiment_functions - INFO - Early stopping at epoch 950. Best Metrics: (0.00461122798246696, 0.004048013245033113, 0.005073029027585249)
2026-05-24 15:55:21,370 - optuna.study.study - INFO - Trial 33 finished with values: [0.00461122798246696, 0.004048013245033113, 0.005073029027585249] and parameters: {'n_layers': 3, 'embedding_dim': 128, 'lr': 0.005912555463142586, 'lambda_val': 1.0507083238458336e-05, 'batch_size': 1110, 'optimizer': 'SGD'}.
2026-05-24 15:55:27,906 - experiment_functions - INFO - Early stopping at epoch 550. Best Metrics: (0.008253209518185381, 0.00375, 0.005471372568308758)
2026-05-24 15:55:27,982 - optuna.study.study - INFO - Trial 34 finished with values: [0.008253209518185381, 0.00375, 0.005471372568308758] and parameters: {'n_layers': 2, 'embedding_dim': 128, 'lr': 0.008785007453935428, 'lambda_val': 2.356921131543827e-06, 'batch_size': 774, 'optimizer': 'Adam'}.
2026-05-24 15:55:34,192 - experiment_functions - INFO - Early stopping at epoch 550. Best Metrics: (0.025156976472849712, 0.00822019867549669, 0.018546761154947963)
2026-05-24 15:55:34,679 - optuna.study.study - INFO - Trial 35 finished with values: [0.025156976472849712, 0.00822019867549669, 0.018546761154947963] and parameters: {'n_layers': 1, 'embedding_dim': 32, 'lr': 0.0025236562505997384, 'lambda_val': 0.012915602029765836, 'batch_size': 1428, 'optimizer': 'Adam'}.
2026-05-24 15:55:40,614 - experiment_functions - INFO - Early stopping at epoch 500. Best Metrics: (0.004644669566393183, 0.004089403973509934, 0.00497140982813902)
2026-05-24 15:55:41,745 - optuna.study.study - INFO - Trial 36 finished with values: [0.004644669566393183, 0.004089403973509934, 0.00497140982813902] and parameters: {'n_layers': 3, 'embedding_dim': 96, 'lr': 0.0021417456859094968, 'lambda_val': 0.006026087116371251, 'batch_size': 1102, 'optimizer': 'RMSprop'}.
2026-05-24 15:55:47,628 - experiment_functions - INFO - Early stopping at epoch 500. Best Metrics: (0.005442969208782431, 0.004362582781456954, 0.005463994562821552)
2026-05-24 15:55:47,745 - optuna.study.study - INFO - Trial 37 finished with values: [0.005442969208782431, 0.004362582781456954, 0.005463994562821552] and parameters: {'n_layers': 1, 'embedding_dim': 32, 'lr': 0.07106729258609701, 'lambda_val': 2.0549669964750215e-06, 'batch_size': 3440, 'optimizer': 'SGD'}.
2026-05-24 15:55:53,943 - experiment_functions - INFO - Early stopping at epoch 500. Best Metrics: (0.005100203326240601, 0.00408112582781457, 0.005054410614080631)
2026-05-24 15:55:54,346 - optuna.study.study - INFO - Trial 38 finished with values: [0.005100203326240601, 0.00408112582781457, 0.005054410614080631] and parameters: {'n_layers': 3, 'embedding_dim': 64, 'lr': 0.022020076988686237, 'lambda_val': 0.03818203468793652, 'batch_size': 3123, 'optimizer': 'SGD'}.
2026-05-24 15:56:00,985 - experiment_functions - INFO - Early stopping at epoch 550. Best Metrics: (0.0046888164203433245, 0.0038990066225165565, 0.004941818203275966)
2026-05-24 15:56:01,081 - optuna.study.study - INFO - Trial 39 finished with values: [0.0046888164203433245, 0.0038990066225165565, 0.004941818203275966] and parameters: {'n_layers': 2, 'embedding_dim': 128, 'lr': 5.218141647802109e-05, 'lambda_val': 0.021290191484791342, 'batch_size': 3891, 'optimizer': 'Adam'}.
2026-05-24 15:56:11,723 - experiment_functions - INFO - Early stopping at epoch 500. Best Metrics: (0.00568176893514979, 0.004097682119205298, 0.005686860913695398)
2026-05-24 15:56:12,200 - optuna.study.study - INFO - Trial 40 finished with values: [0.00568176893514979, 0.004097682119205298, 0.005686860913695398] and parameters: {'n_layers': 2, 'embedding_dim': 256, 'lr': 0.003028775819761759, 'lambda_val': 3.1140649076620497e-06, 'batch_size': 1931, 'optimizer': 'RMSprop'}.
2026-05-24 15:56:18,231 - experiment_functions - INFO - Early stopping at epoch 500. Best Metrics: (0.008058756818365176, 0.003849337748344371, 0.006728897665443599)
2026-05-24 15:56:19,304 - optuna.study.study - INFO - Trial 41 finished with values: [0.008058756818365176, 0.003849337748344371, 0.006728897665443599] and parameters: {'n_layers': 2, 'embedding_dim': 128, 'lr': 0.012446049552260335, 'lambda_val': 3.574372440847579e-05, 'batch_size': 1349, 'optimizer': 'RMSprop'}.
2026-05-24 15:56:31,450 - experiment_functions - INFO - Early stopping at epoch 950. Best Metrics: (0.022142337569341402, 0.007880794701986755, 0.016749142873351892)
2026-05-24 15:56:31,523 - optuna.study.study - INFO - Trial 42 finished with values: [0.022142337569341402, 0.007880794701986755, 0.016749142873351892] and parameters: {'n_layers': 4, 'embedding_dim': 256, 'lr': 0.00017772311243386462, 'lambda_val': 0.0014558727739107649, 'batch_size': 707, 'optimizer': 'RMSprop'}.
2026-05-24 15:56:38,031 - experiment_functions - INFO - Early stopping at epoch 500. Best Metrics: (0.004546952540522163, 0.003667218543046358, 0.004667147827463343)
2026-05-24 15:56:38,319 - optuna.study.study - INFO - Trial 43 finished with values: [0.004546952540522163, 0.003667218543046358, 0.004667147827463343] and parameters: {'n_layers': 4, 'embedding_dim': 128, 'lr': 0.015799830523627413, 'lambda_val': 6.685647352317125e-05, 'batch_size': 2768, 'optimizer': 'Adam'}.
2026-05-24 15:56:44,334 - experiment_functions - INFO - Early stopping at epoch 500. Best Metrics: (0.005137436795559173, 0.004279801324503311, 0.005385139846854713)
2026-05-24 15:56:44,706 - optuna.study.study - INFO - Trial 44 finished with values: [0.005137436795559173, 0.004279801324503311, 0.005385139846854713] and parameters: {'n_layers': 1, 'embedding_dim': 96, 'lr': 0.0005412859406393211, 'lambda_val': 0.03837915591350549, 'batch_size': 3968, 'optimizer': 'SGD'}.
2026-05-24 15:56:50,508 - experiment_functions - INFO - Early stopping at epoch 500. Best Metrics: (0.005038453533383832, 0.0040562913907284765, 0.004962230399507427)
2026-05-24 15:56:51,109 - optuna.study.study - INFO - Trial 45 finished with values: [0.005038453533383832, 0.0040562913907284765, 0.004962230399507427] and parameters: {'n_layers': 3, 'embedding_dim': 32, 'lr': 0.04697788057370489, 'lambda_val': 2.5648299092694756e-05, 'batch_size': 2355, 'optimizer': 'Adam'}.
2026-05-24 15:56:57,031 - experiment_functions - INFO - Early stopping at epoch 500. Best Metrics: (0.005194789931573647, 0.004271523178807947, 0.005283138482086981)
2026-05-24 15:56:57,335 - optuna.study.study - INFO - Trial 46 finished with values: [0.005194789931573647, 0.004271523178807947, 0.005283138482086981] and parameters: {'n_layers': 1, 'embedding_dim': 64, 'lr': 0.00021334040168743666, 'lambda_val': 0.05494265649974805, 'batch_size': 2889, 'optimizer': 'RMSprop'}.
2026-05-24 15:57:03,610 - experiment_functions - INFO - Early stopping at epoch 500. Best Metrics: (0.004862663153806353, 0.004130794701986755, 0.0050803396829506055)
2026-05-24 15:57:03,715 - optuna.study.study - INFO - Trial 47 finished with values: [0.004862663153806353, 0.004130794701986755, 0.0050803396829506055] and parameters: {'n_layers': 3, 'embedding_dim': 128, 'lr': 0.018430034786717567, 'lambda_val': 3.816471389387647e-06, 'batch_size': 2525, 'optimizer': 'SGD'}.
2026-05-24 15:57:09,852 - experiment_functions - INFO - Early stopping at epoch 500. Best Metrics: (0.005241345112897071, 0.004254966887417219, 0.005204122903904077)
2026-05-24 15:57:10,748 - optuna.study.study - INFO - Trial 48 finished with values: [0.005241345112897071, 0.004254966887417219, 0.005204122903904077] and parameters: {'n_layers': 4, 'embedding_dim': 96, 'lr': 0.0013118157271416449, 'lambda_val': 0.021672168569848903, 'batch_size': 1241, 'optimizer': 'Adam'}.
2026-05-24 15:57:17,091 - experiment_functions - INFO - Early stopping at epoch 550. Best Metrics: (0.042002186367379915, 0.012408940397350991, 0.030393492713979845)
2026-05-24 15:57:17,487 - optuna.study.study - INFO - Trial 49 finished with values: [0.042002186367379915, 0.012408940397350991, 0.030393492713979845] and parameters: {'n_layers': 1, 'embedding_dim': 96, 'lr': 0.005676961555550774, 'lambda_val': 4.9612924956814075e-05, 'batch_size': 1178, 'optimizer': 'Adam'}.
2026-05-24 15:57:23,781 - experiment_functions - INFO - Early stopping at epoch 500. Best Metrics: (0.005903995964774802, 0.004271523178807947, 0.005706160871807977)
2026-05-24 15:57:23,866 - optuna.study.study - INFO - Trial 50 finished with values: [0.005903995964774802, 0.004271523178807947, 0.005706160871807977] and parameters: {'n_layers': 4, 'embedding_dim': 96, 'lr': 0.0029758764816546083, 'lambda_val': 1.2584008258141712e-05, 'batch_size': 996, 'optimizer': 'RMSprop'}.
2026-05-24 15:57:29,875 - experiment_functions - INFO - Early stopping at epoch 500. Best Metrics: (0.005732936614696001, 0.004163907284768212, 0.005491788197883334)
2026-05-24 15:57:31,010 - optuna.study.study - INFO - Trial 51 finished with values: [0.005732936614696001, 0.004163907284768212, 0.005491788197883334] and parameters: {'n_layers': 3, 'embedding_dim': 32, 'lr': 1.5666145089259186e-05, 'lambda_val': 0.005762069964517917, 'batch_size': 2147, 'optimizer': 'SGD'}.
2026-05-24 15:57:36,830 - experiment_functions - INFO - Early stopping at epoch 500. Best Metrics: (0.005431352066834653, 0.004072847682119206, 0.005328888755952155)
2026-05-24 15:57:37,762 - optuna.study.study - INFO - Trial 52 finished with values: [0.005431352066834653, 0.004072847682119206, 0.005328888755952155] and parameters: {'n_layers': 2, 'embedding_dim': 32, 'lr': 0.0005412859406393211, 'lambda_val': 1.2482171681838817e-06, 'batch_size': 2154, 'optimizer': 'SGD'}.
2026-05-24 15:57:43,934 - experiment_functions - INFO - Early stopping at epoch 500. Best Metrics: (0.005858638192133778, 0.004412251655629139, 0.005564650718859839)
2026-05-24 15:57:44,241 - optuna.study.study - INFO - Trial 53 finished with values: [0.005858638192133778, 0.004412251655629139, 0.005564650718859839] and parameters: {'n_layers': 3, 'embedding_dim': 64, 'lr': 0.022020076988686237, 'lambda_val': 0.03818203468793652, 'batch_size': 4058, 'optimizer': 'Adam'}.
2026-05-24 15:57:52,160 - experiment_functions - INFO - Early stopping at epoch 700. Best Metrics: (0.004636520150871194, 0.0037913907284768214, 0.004602662604685193)
2026-05-24 15:57:52,252 - optuna.study.study - INFO - Trial 54 finished with values: [0.004636520150871194, 0.0037913907284768214, 0.004602662604685193] and parameters: {'n_layers': 2, 'embedding_dim': 96, 'lr': 1.6453780936680438e-05, 'lambda_val': 5.7906398074089765e-06, 'batch_size': 736, 'optimizer': 'Adam'}.
2026-05-24 15:57:58,281 - experiment_functions - INFO - Early stopping at epoch 500. Best Metrics: (0.00531348712717807, 0.0035264900662251657, 0.005242265101655383)
2026-05-24 15:57:58,683 - optuna.study.study - INFO - Trial 55 finished with values: [0.00531348712717807, 0.0035264900662251657, 0.005242265101655383] and parameters: {'n_layers': 1, 'embedding_dim': 256, 'lr': 0.02948640340735116, 'lambda_val': 0.00036429979790847324, 'batch_size': 1062, 'optimizer': 'RMSprop'}.
2026-05-24 15:58:06,735 - experiment_functions - INFO - Early stopping at epoch 700. Best Metrics: (0.004505433695790437, 0.003493377483443709, 0.004670166423395131)
2026-05-24 15:58:06,810 - optuna.study.study - INFO - Trial 56 finished with values: [0.004505433695790437, 0.003493377483443709, 0.004670166423395131] and parameters: {'n_layers': 3, 'embedding_dim': 64, 'lr': 0.00532575854276696, 'lambda_val': 0.0051198804126285635, 'batch_size': 2725, 'optimizer': 'SGD'}.
2026-05-24 15:58:14,218 - experiment_functions - INFO - Early stopping at epoch 600. Best Metrics: (0.014672966600907444, 0.006183774834437087, 0.012144104979529228)
2026-05-24 15:58:14,336 - optuna.study.study - INFO - Trial 57 finished with values: [0.014672966600907444, 0.006183774834437087, 0.012144104979529228] and parameters: {'n_layers': 4, 'embedding_dim': 96, 'lr': 0.0010413911280538683, 'lambda_val': 0.0005068128991295962, 'batch_size': 1204, 'optimizer': 'Adam'}.
2026-05-24 15:58:20,003 - experiment_functions - INFO - Early stopping at epoch 500. Best Metrics: (0.01285587873454715, 0.005562913907284768, 0.010347595264491524)
2026-05-24 15:58:20,920 - optuna.study.study - INFO - Trial 58 finished with values: [0.01285587873454715, 0.005562913907284768, 0.010347595264491524] and parameters: {'n_layers': 2, 'embedding_dim': 32, 'lr': 0.02431450470115027, 'lambda_val': 1.2482171681838817e-06, 'batch_size': 3431, 'optimizer': 'RMSprop'}.
2026-05-24 15:58:26,992 - experiment_functions - INFO - Early stopping at epoch 500. Best Metrics: (0.0050002623865054935, 0.004230132450331126, 0.0050463462240806015)
2026-05-24 15:58:28,334 - optuna.study.study - INFO - Trial 59 finished with values: [0.0050002623865054935, 0.004230132450331126, 0.0050463462240806015] and parameters: {'n_layers': 3, 'embedding_dim': 32, 'lr': 0.01346247069157871, 'lambda_val': 0.0021738629334005282, 'batch_size': 2779, 'optimizer': 'Adam'}.
2026-05-24 15:58:34,797 - experiment_functions - INFO - Early stopping at epoch 550. Best Metrics: (0.039634647728181954, 0.011125827814569536, 0.025781967368111808)
2026-05-24 15:58:34,953 - optuna.study.study - INFO - Trial 60 finished with values: [0.039634647728181954, 0.011125827814569536, 0.025781967368111808] and parameters: {'n_layers': 1, 'embedding_dim': 96, 'lr': 0.00532575854276696, 'lambda_val': 1.1594147319583239e-05, 'batch_size': 2725, 'optimizer': 'Adam'}.
2026-05-24 15:58:46,803 - experiment_functions - INFO - Early stopping at epoch 500. Best Metrics: (0.005442816681842676, 0.003890728476821192, 0.005136921802522341)
2026-05-24 15:58:47,923 - optuna.study.study - INFO - Trial 61 finished with values: [0.005442816681842676, 0.003890728476821192, 0.005136921802522341] and parameters: {'n_layers': 4, 'embedding_dim': 128, 'lr': 4.893882546497812e-05, 'lambda_val': 4.9612924956814075e-05, 'batch_size': 3431, 'optimizer': 'RMSprop'}.
2026-05-24 15:58:54,346 - experiment_functions - INFO - Early stopping at epoch 550. Best Metrics: (0.043171014242177355, 0.012624172185430464, 0.03276208507480132)
2026-05-24 15:58:54,436 - optuna.study.study - INFO - Trial 62 finished with values: [0.043171014242177355, 0.012624172185430464, 0.03276208507480132] and parameters: {'n_layers': 1, 'embedding_dim': 96, 'lr': 0.0038122363815175056, 'lambda_val': 0.002332362722517884, 'batch_size': 1062, 'optimizer': 'Adam'}.
2026-05-24 15:59:00,821 - experiment_functions - INFO - Early stopping at epoch 550. Best Metrics: (0.03828260973849355, 0.01103476821192053, 0.026523291369729)
2026-05-24 15:59:00,917 - optuna.study.study - INFO - Trial 63 finished with values: [0.03828260973849355, 0.01103476821192053, 0.026523291369729] and parameters: {'n_layers': 1, 'embedding_dim': 96, 'lr': 0.00532575854276696, 'lambda_val': 1.1594147319583239e-05, 'batch_size': 2725, 'optimizer': 'Adam'}.
2026-05-24 15:59:15,982 - experiment_functions - INFO - Early stopping at epoch 1450. Best Metrics: (0.005755713853489754, 0.004288079470198676, 0.005439545725282532)
2026-05-24 15:59:16,086 - optuna.study.study - INFO - Trial 64 finished with values: [0.005755713853489754, 0.004288079470198676, 0.005439545725282532] and parameters: {'n_layers': 2, 'embedding_dim': 96, 'lr': 1.6453780936680438e-05, 'lambda_val': 5.7906398074089765e-06, 'batch_size': 736, 'optimizer': 'Adam'}.
2026-05-24 15:59:25,246 - experiment_functions - INFO - Early stopping at epoch 750. Best Metrics: (0.005458616940353779, 0.004213576158940397, 0.005454299431032189)
2026-05-24 15:59:25,336 - optuna.study.study - INFO - Trial 65 finished with values: [0.005458616940353779, 0.004213576158940397, 0.005454299431032189] and parameters: {'n_layers': 4, 'embedding_dim': 96, 'lr': 2.3174363407539825e-05, 'lambda_val': 0.0002812677361610648, 'batch_size': 4077, 'optimizer': 'RMSprop'}.
2026-05-24 16:00:05,056 - optuna.study.study - INFO - Trial 66 finished with values: [0.039644384061074685, 0.012624172185430464, 0.03002927498937654] and parameters: {'n_layers': 1, 'embedding_dim': 32, 'lr': 0.00014827150350050635, 'lambda_val': 2.0549669964750215e-06, 'batch_size': 1097, 'optimizer': 'Adam'}.
2026-05-24 16:00:11,354 - experiment_functions - INFO - Early stopping at epoch 500. Best Metrics: (0.004756258778869532, 0.004039735099337748, 0.00509412543791011)
2026-05-24 16:00:12,294 - optuna.study.study - INFO - Trial 67 finished with values: [0.004756258778869532, 0.004039735099337748, 0.00509412543791011] and parameters: {'n_layers': 4, 'embedding_dim': 96, 'lr': 0.0003123228755541873, 'lambda_val': 0.0001320099474533975, 'batch_size': 957, 'optimizer': 'SGD'}.
2026-05-24 16:00:18,614 - experiment_functions - INFO - Early stopping at epoch 550. Best Metrics: (0.01608567028664581, 0.005794701986754967, 0.011135805966160046)
2026-05-24 16:00:18,996 - optuna.study.study - INFO - Trial 68 finished with values: [0.01608567028664581, 0.005794701986754967, 0.011135805966160046] and parameters: {'n_layers': 1, 'embedding_dim': 32, 'lr': 0.0025106536291826954, 'lambda_val': 4.345413817908026e-06, 'batch_size': 3564, 'optimizer': 'RMSprop'}.
2026-05-24 16:00:44,130 - experiment_functions - INFO - Early stopping at epoch 2150. Best Metrics: (0.02761532603743515, 0.00906456953642384, 0.020030575291196416)
2026-05-24 16:00:44,451 - optuna.study.study - INFO - Trial 69 finished with values: [0.02761532603743515, 0.00906456953642384, 0.020030575291196416] and parameters: {'n_layers': 4, 'embedding_dim': 96, 'lr': 0.00017772311243386462, 'lambda_val': 7.010718534955492e-06, 'batch_size': 4077, 'optimizer': 'RMSprop'}.
2026-05-24 16:00:52,835 - experiment_functions - INFO - Early stopping at epoch 500. Best Metrics: (0.004939615145198816, 0.0038079470198675498, 0.004933040440963662)
2026-05-24 16:00:52,928 - optuna.study.study - INFO - Trial 70 finished with values: [0.004939615145198816, 0.0038079470198675498, 0.004933040440963662] and parameters: {'n_layers': 3, 'embedding_dim': 128, 'lr': 0.0003795430866807098, 'lambda_val': 0.0021738629334005282, 'batch_size': 568, 'optimizer': 'SGD'}.
2026-05-24 16:01:00,423 - experiment_functions - INFO - Early stopping at epoch 650. Best Metrics: (0.04101410090376799, 0.011978476821192052, 0.02895277889865173)
2026-05-24 16:01:00,502 - optuna.study.study - INFO - Trial 71 finished with values: [0.04101410090376799, 0.011978476821192052, 0.02895277889865173] and parameters: {'n_layers': 1, 'embedding_dim': 128, 'lr': 0.0010413911280538683, 'lambda_val': 0.0005068128991295962, 'batch_size': 1463, 'optimizer': 'Adam'}.
2026-05-24 16:01:08,181 - experiment_functions - INFO - Early stopping at epoch 650. Best Metrics: (0.0436105737256286, 0.012864238410596028, 0.03390155154211001)
2026-05-24 16:01:08,265 - optuna.study.study - INFO - Trial 72 finished with values: [0.0436105737256286, 0.012864238410596028, 0.03390155154211001] and parameters: {'n_layers': 1, 'embedding_dim': 128, 'lr': 0.0010413911280538683, 'lambda_val': 5.897592552004812e-06, 'batch_size': 1062, 'optimizer': 'Adam'}.
2026-05-24 16:01:14,762 - experiment_functions - INFO - Early stopping at epoch 550. Best Metrics: (0.038950859342165176, 0.011390728476821191, 0.02922000850363701)
