2026-05-24 06:24:39,292 - optuna.study.study - INFO - Trial 283 finished with values: [0.019247478766064023, 0.014271523178807947, 0.019593096115735367] and parameters: {'n_layers': 2, 'embedding_dim': 32, 'lr': 0.0004890104603780292, 'lambda_val': 0.02057236680605429, 'batch_size': 2716, 'optimizer': 'RMSprop'}.
2026-05-24 06:24:45,204 - experiment_functions - INFO - Early stopping at epoch 500. Best Metrics: (0.0052157331951407405, 0.004271523178807947, 0.005478568998752021)
2026-05-24 06:24:45,312 - optuna.study.study - INFO - Trial 284 finished with values: [0.0052157331951407405, 0.004271523178807947, 0.005478568998752021] and parameters: {'n_layers': 2, 'embedding_dim': 32, 'lr': 0.0004890104603780292, 'lambda_val': 2.9428916086760435e-06, 'batch_size': 3682, 'optimizer': 'SGD'}.
2026-05-24 06:25:02,904 - experiment_functions - INFO - Early stopping at epoch 1600. Best Metrics: (0.02208086484139514, 0.01797185430463576, 0.023376826743461462)
2026-05-24 06:25:03,260 - optuna.study.study - INFO - Trial 285 finished with values: [0.02208086484139514, 0.01797185430463576, 0.023376826743461462] and parameters: {'n_layers': 4, 'embedding_dim': 64, 'lr': 0.0002909391164072771, 'lambda_val': 0.004830254272011785, 'batch_size': 1626, 'optimizer': 'Adam'}.
2026-05-24 06:25:44,099 - optuna.study.study - INFO - Trial 286 finished with values: [0.02432360736551672, 0.017367549668874174, 0.024955056841368523] and parameters: {'n_layers': 2, 'embedding_dim': 32, 'lr': 0.0004890104603780292, 'lambda_val': 0.007620237155778278, 'batch_size': 565, 'optimizer': 'RMSprop'}.
2026-05-24 06:25:59,558 - experiment_functions - INFO - Early stopping at epoch 1450. Best Metrics: (0.01925396208710012, 0.0157864238410596, 0.020508153251324584)
2026-05-24 06:25:59,677 - optuna.study.study - INFO - Trial 287 finished with values: [0.01925396208710012, 0.0157864238410596, 0.020508153251324584] and parameters: {'n_layers': 4, 'embedding_dim': 96, 'lr': 0.0002909391164072771, 'lambda_val': 5.78540826635863e-05, 'batch_size': 2144, 'optimizer': 'Adam'}.
2026-05-24 06:26:06,292 - experiment_functions - INFO - Early stopping at epoch 550. Best Metrics: (0.015735692598092384, 0.012475165562913906, 0.016112006517301224)
2026-05-24 06:26:07,206 - optuna.study.study - INFO - Trial 288 finished with values: [0.015735692598092384, 0.012475165562913906, 0.016112006517301224] and parameters: {'n_layers': 2, 'embedding_dim': 128, 'lr': 0.0037147017870386746, 'lambda_val': 2.1355760438149747e-05, 'batch_size': 542, 'optimizer': 'RMSprop'}.
2026-05-24 06:26:21,709 - experiment_functions - INFO - Early stopping at epoch 1350. Best Metrics: (0.018995959549005723, 0.01544701986754967, 0.020010942673259122)
2026-05-24 06:26:22,722 - optuna.study.study - INFO - Trial 289 finished with values: [0.018995959549005723, 0.01544701986754967, 0.020010942673259122] and parameters: {'n_layers': 4, 'embedding_dim': 96, 'lr': 0.0002909391164072771, 'lambda_val': 0.00013892846035396848, 'batch_size': 3218, 'optimizer': 'RMSprop'}.
2026-05-24 06:26:28,339 - experiment_functions - INFO - Early stopping at epoch 500. Best Metrics: (0.005139199242102009, 0.003998344370860928, 0.005076722053459767)
2026-05-24 06:26:29,449 - optuna.study.study - INFO - Trial 290 finished with values: [0.005139199242102009, 0.003998344370860928, 0.005076722053459767] and parameters: {'n_layers': 2, 'embedding_dim': 32, 'lr': 0.0004890104603780292, 'lambda_val': 0.09383228839891232, 'batch_size': 565, 'optimizer': 'RMSprop'}.
2026-05-24 06:26:35,086 - experiment_functions - INFO - Early stopping at epoch 500. Best Metrics: (0.004811783080644706, 0.003956953642384106, 0.004973760696579966)
2026-05-24 06:26:35,392 - optuna.study.study - INFO - Trial 291 finished with values: [0.004811783080644706, 0.003956953642384106, 0.004973760696579966] and parameters: {'n_layers': 1, 'embedding_dim': 32, 'lr': 0.0004890104603780292, 'lambda_val': 0.09383228839891232, 'batch_size': 1254, 'optimizer': 'Adam'}.
2026-05-24 06:26:41,886 - experiment_functions - INFO - Early stopping at epoch 550. Best Metrics: (0.017049631542038732, 0.01181291390728477, 0.01650232213114358)
2026-05-24 06:26:41,999 - optuna.study.study - INFO - Trial 292 finished with values: [0.017049631542038732, 0.01181291390728477, 0.01650232213114358] and parameters: {'n_layers': 1, 'embedding_dim': 128, 'lr': 0.00567629368896096, 'lambda_val': 5.78540826635863e-05, 'batch_size': 1264, 'optimizer': 'Adam'}.
2026-05-24 06:26:51,570 - experiment_functions - INFO - Early stopping at epoch 500. Best Metrics: (0.004865209626794125, 0.0038990066225165565, 0.004867140469685248)
2026-05-24 06:26:53,159 - optuna.study.study - INFO - Trial 293 finished with values: [0.004865209626794125, 0.0038990066225165565, 0.004867140469685248] and parameters: {'n_layers': 2, 'embedding_dim': 32, 'lr': 0.00030090646109548523, 'lambda_val': 0.09383228839891232, 'batch_size': 2144, 'optimizer': 'Adam'}.
2026-05-24 06:27:00,582 - experiment_functions - INFO - Early stopping at epoch 650. Best Metrics: (0.022921469640592485, 0.01646523178807947, 0.023477178808392406)
2026-05-24 06:27:00,681 - optuna.study.study - INFO - Trial 294 finished with values: [0.022921469640592485, 0.01646523178807947, 0.023477178808392406] and parameters: {'n_layers': 2, 'embedding_dim': 32, 'lr': 0.0037147017870386746, 'lambda_val': 2.1355760438149747e-05, 'batch_size': 542, 'optimizer': 'Adam'}.
2026-05-24 06:27:31,968 - experiment_functions - INFO - Early stopping at epoch 3150. Best Metrics: (0.017901875858596802, 0.013940397350993379, 0.01917949591719852)
2026-05-24 06:27:32,273 - optuna.study.study - INFO - Trial 295 finished with values: [0.017901875858596802, 0.013940397350993379, 0.01917949591719852] and parameters: {'n_layers': 2, 'embedding_dim': 128, 'lr': 0.0002909391164072771, 'lambda_val': 5.78540826635863e-05, 'batch_size': 1612, 'optimizer': 'Adam'}.
2026-05-24 06:27:43,368 - experiment_functions - INFO - Early stopping at epoch 1050. Best Metrics: (0.02178624994755101, 0.017582781456953644, 0.022676116980782274)
2026-05-24 06:27:43,980 - optuna.study.study - INFO - Trial 296 finished with values: [0.02178624994755101, 0.017582781456953644, 0.022676116980782274] and parameters: {'n_layers': 2, 'embedding_dim': 32, 'lr': 0.0006221732593163273, 'lambda_val': 0.09383228839891232, 'batch_size': 2716, 'optimizer': 'RMSprop'}.
2026-05-24 06:27:56,809 - experiment_functions - INFO - Early stopping at epoch 1250. Best Metrics: (0.02199604932372956, 0.017839403973509933, 0.022515057295061692)
2026-05-24 06:27:56,916 - optuna.study.study - INFO - Trial 297 finished with values: [0.02199604932372956, 0.017839403973509933, 0.022515057295061692] and parameters: {'n_layers': 4, 'embedding_dim': 32, 'lr': 0.0004915796983483617, 'lambda_val': 0.09383228839891232, 'batch_size': 2716, 'optimizer': 'Adam'}.
2026-05-24 06:28:11,989 - experiment_functions - INFO - Early stopping at epoch 1500. Best Metrics: (0.021141397088936694, 0.01630794701986755, 0.021379175915598275)
2026-05-24 06:28:12,835 - optuna.study.study - INFO - Trial 298 finished with values: [0.021141397088936694, 0.01630794701986755, 0.021379175915598275] and parameters: {'n_layers': 2, 'embedding_dim': 32, 'lr': 0.0004890104603780292, 'lambda_val': 0.05815679854929912, 'batch_size': 1264, 'optimizer': 'RMSprop'}.
2026-05-24 06:28:34,412 - experiment_functions - INFO - Early stopping at epoch 2150. Best Metrics: (0.021190620226369142, 0.017201986754966887, 0.02255804149749506)
2026-05-24 06:28:34,814 - optuna.study.study - INFO - Trial 299 finished with values: [0.021190620226369142, 0.017201986754966887, 0.02255804149749506] and parameters: {'n_layers': 4, 'embedding_dim': 32, 'lr': 0.0002909391164072771, 'lambda_val': 5.78540826635863e-05, 'batch_size': 2097, 'optimizer': 'Adam'}.
2026-05-24 06:28:34,829 - root - INFO - Selected Trial 267 based on Max ndcg: 0.0261
2026-05-24 06:28:34,829 - root - INFO - Associated Recall: 0.0245
2026-05-24 06:28:34,829 - experiment_functions - INFO - Training the best model ... for e_1M_1c1dcs_strict_rand5
2026-05-24 06:28:47,050 - experiment_functions - INFO - Early stopping at epoch 1250. Best Metrics: (0.026505523187946654, 0.019710264900662255, 0.026901575050404646)
2026-05-24 06:28:47,871 - root - INFO -   ** Getting the trainable edges:
2026-05-24 06:28:47,894 - helper_functions - INFO -      Number of nodes: 4740
2026-05-24 06:28:47,894 - helper_functions - INFO -      Ratio: 0.4863533757438949
2026-05-24 06:28:47,894 - helper_functions - INFO -      Number of unique users: 3156
2026-05-24 06:28:47,894 - helper_functions - INFO -      Number of unique items: 1584
2026-05-24 06:28:47,894 - helper_functions - INFO -      Total dominant set edge: 234063
2026-05-24 06:28:47,894 - helper_functions - INFO -      Trainable edges: 187250.40000000002
2026-05-24 06:28:47,962 - root - INFO -   **** Getting 234063 dominant set edges
2026-05-24 06:28:48,099 - optuna.storages._rdb.storage - INFO - A new study created in RDB with name: Study_e_1M_1c1dcs
2026-05-24 06:28:59,822 - experiment_functions - INFO - Early stopping at epoch 1000. Best Metrics: (0.059480071269197465, 0.026092715231788077, 0.053519659922339875)
2026-05-24 06:28:59,985 - optuna.study.study - INFO - Trial 0 finished with values: [0.059480071269197465, 0.026092715231788077, 0.053519659922339875] and parameters: {'n_layers': 1, 'embedding_dim': 64, 'lr': 0.0004427403826510948, 'lambda_val': 0.0023999610459478756, 'batch_size': 3507, 'optimizer': 'RMSprop'}.
2026-05-24 06:29:07,527 - experiment_functions - INFO - Early stopping at epoch 550. Best Metrics: (0.023159225163112186, 0.011498344370860928, 0.019790984781583962)
2026-05-24 06:29:07,633 - optuna.study.study - INFO - Trial 1 finished with values: [0.023159225163112186, 0.011498344370860928, 0.019790984781583962] and parameters: {'n_layers': 4, 'embedding_dim': 32, 'lr': 0.003423792553170454, 'lambda_val': 1.7648009836782235e-05, 'batch_size': 1592, 'optimizer': 'Adam'}.
2026-05-24 06:29:46,458 - experiment_functions - INFO - Early stopping at epoch 2950. Best Metrics: (0.02676599444170317, 0.009031456953642384, 0.017426113908152335)
2026-05-24 06:29:46,546 - optuna.study.study - INFO - Trial 2 finished with values: [0.02676599444170317, 0.009031456953642384, 0.017426113908152335] and parameters: {'n_layers': 4, 'embedding_dim': 96, 'lr': 0.010845984915572808, 'lambda_val': 0.006002075886005419, 'batch_size': 2276, 'optimizer': 'Adam'}.
2026-05-24 06:29:54,120 - experiment_functions - INFO - Early stopping at epoch 500. Best Metrics: (0.005379795211907371, 0.004254966887417219, 0.005442352152115358)
2026-05-24 06:29:54,228 - optuna.study.study - INFO - Trial 3 finished with values: [0.005379795211907371, 0.004254966887417219, 0.005442352152115358] and parameters: {'n_layers': 4, 'embedding_dim': 96, 'lr': 0.0001150739949127664, 'lambda_val': 0.0007715536445878253, 'batch_size': 2307, 'optimizer': 'SGD'}.
2026-05-24 06:30:46,638 - optuna.study.study - INFO - Trial 4 finished with values: [0.018387689099883954, 0.01, 0.016068289999944092] and parameters: {'n_layers': 4, 'embedding_dim': 96, 'lr': 5.469206106625236e-05, 'lambda_val': 6.875947708093636e-05, 'batch_size': 1536, 'optimizer': 'RMSprop'}.
2026-05-24 06:30:56,715 - experiment_functions - INFO - Early stopping at epoch 700. Best Metrics: (0.0053146425385271505, 0.004271523178807947, 0.0053665987442318985)
2026-05-24 06:30:57,025 - optuna.study.study - INFO - Trial 5 finished with values: [0.0053146425385271505, 0.004271523178807947, 0.0053665987442318985] and parameters: {'n_layers': 2, 'embedding_dim': 256, 'lr': 1.0912393535136732e-05, 'lambda_val': 4.362263684941159e-05, 'batch_size': 1950, 'optimizer': 'RMSprop'}.
2026-05-24 06:31:08,437 - experiment_functions - INFO - Early stopping at epoch 850. Best Metrics: (0.024696493638557263, 0.011804635761589405, 0.021155840396851176)
2026-05-24 06:31:08,832 - optuna.study.study - INFO - Trial 6 finished with values: [0.024696493638557263, 0.011804635761589405, 0.021155840396851176] and parameters: {'n_layers': 4, 'embedding_dim': 32, 'lr': 0.00047141847978292425, 'lambda_val': 7.430828607206384e-06, 'batch_size': 3838, 'optimizer': 'Adam'}.
2026-05-24 06:31:47,321 - experiment_functions - INFO - Early stopping at epoch 2850. Best Metrics: (0.04023884733546211, 0.012955298013245032, 0.026848148280549548)
2026-05-24 06:31:47,406 - optuna.study.study - INFO - Trial 7 finished with values: [0.04023884733546211, 0.012955298013245032, 0.026848148280549548] and parameters: {'n_layers': 4, 'embedding_dim': 96, 'lr': 0.04695408117684214, 'lambda_val': 0.0024917993264436437, 'batch_size': 2773, 'optimizer': 'RMSprop'}.
2026-05-24 06:31:55,144 - experiment_functions - INFO - Early stopping at epoch 500. Best Metrics: (0.00522665233377499, 0.0043708609271523174, 0.005477942164141001)
2026-05-24 06:31:55,617 - optuna.study.study - INFO - Trial 8 finished with values: [0.00522665233377499, 0.0043708609271523174, 0.005477942164141001] and parameters: {'n_layers': 2, 'embedding_dim': 64, 'lr': 0.0010401183506468117, 'lambda_val': 0.00022033926190523134, 'batch_size': 2777, 'optimizer': 'SGD'}.
2026-05-24 06:32:15,519 - experiment_functions - INFO - Early stopping at epoch 1550. Best Metrics: (0.0403224847925503, 0.012748344370860927, 0.027808339111326352)
2026-05-24 06:32:16,701 - optuna.study.study - INFO - Trial 9 finished with values: [0.0403224847925503, 0.012748344370860927, 0.027808339111326352] and parameters: {'n_layers': 3, 'embedding_dim': 64, 'lr': 0.008825737855916319, 'lambda_val': 0.0003225666467685565, 'batch_size': 4089, 'optimizer': 'RMSprop'}.
2026-05-24 06:32:24,117 - experiment_functions - INFO - Early stopping at epoch 500. Best Metrics: (0.00535007559450983, 0.004064569536423842, 0.005150302627298337)
2026-05-24 06:32:24,210 - optuna.study.study - INFO - Trial 10 finished with values: [0.00535007559450983, 0.004064569536423842, 0.005150302627298337] and parameters: {'n_layers': 4, 'embedding_dim': 96, 'lr': 0.0005840969819274049, 'lambda_val': 0.018690506303727972, 'batch_size': 2461, 'optimizer': 'SGD'}.
2026-05-24 06:32:31,015 - experiment_functions - INFO - Early stopping at epoch 500. Best Metrics: (0.00489725882005457, 0.003841059602649007, 0.00501388662001903)
2026-05-24 06:32:31,377 - optuna.study.study - INFO - Trial 11 finished with values: [0.00489725882005457, 0.003841059602649007, 0.00501388662001903] and parameters: {'n_layers': 2, 'embedding_dim': 96, 'lr': 0.009044345299282244, 'lambda_val': 2.3300369458783514e-06, 'batch_size': 2566, 'optimizer': 'SGD'}.
2026-05-24 06:32:38,792 - experiment_functions - INFO - Early stopping at epoch 500. Best Metrics: (0.005142258682711046, 0.004006622516556292, 0.005054791736515153)
2026-05-24 06:32:38,881 - optuna.study.study - INFO - Trial 12 finished with values: [0.005142258682711046, 0.004006622516556292, 0.005054791736515153] and parameters: {'n_layers': 3, 'embedding_dim': 128, 'lr': 0.08658801628058312, 'lambda_val': 0.03187369406229398, 'batch_size': 3708, 'optimizer': 'SGD'}.
2026-05-24 06:33:27,113 - optuna.study.study - INFO - Trial 13 finished with values: [0.02382997464662571, 0.011556291390728477, 0.019422530758498584] and parameters: {'n_layers': 4, 'embedding_dim': 32, 'lr': 8.21225354130991e-05, 'lambda_val': 3.426862940771237e-05, 'batch_size': 2219, 'optimizer': 'Adam'}.
2026-05-24 06:33:33,857 - experiment_functions - INFO - Early stopping at epoch 500. Best Metrics: (0.0044568377750898195, 0.003973509933774834, 0.0049813749640433835)
2026-05-24 06:33:34,938 - optuna.study.study - INFO - Trial 14 finished with values: [0.0044568377750898195, 0.003973509933774834, 0.0049813749640433835] and parameters: {'n_layers': 3, 'embedding_dim': 32, 'lr': 6.483937185713298e-05, 'lambda_val': 0.005539399900877261, 'batch_size': 2417, 'optimizer': 'SGD'}.
2026-05-24 06:34:18,189 - experiment_functions - INFO - Early stopping at epoch 3250. Best Metrics: (0.044785940320101934, 0.013476821192052981, 0.029512710936398335)
2026-05-24 06:34:18,265 - optuna.study.study - INFO - Trial 15 finished with values: [0.044785940320101934, 0.013476821192052981, 0.029512710936398335] and parameters: {'n_layers': 4, 'embedding_dim': 96, 'lr': 0.0038879080432731965, 'lambda_val': 1.1068932700778532e-05, 'batch_size': 803, 'optimizer': 'RMSprop'}.
2026-05-24 06:34:25,294 - experiment_functions - INFO - Early stopping at epoch 500. Best Metrics: (0.004973203879381972, 0.004213576158940397, 0.005199926128867626)
2026-05-24 06:34:25,388 - optuna.study.study - INFO - Trial 16 finished with values: [0.004973203879381972, 0.004213576158940397, 0.005199926128867626] and parameters: {'n_layers': 3, 'embedding_dim': 64, 'lr': 0.06469721848018067, 'lambda_val': 0.001656717227117558, 'batch_size': 4067, 'optimizer': 'SGD'}.
2026-05-24 06:34:32,301 - experiment_functions - INFO - Early stopping at epoch 550. Best Metrics: (0.005691887137394406, 0.004230132450331127, 0.005422760408641469)
2026-05-24 06:34:32,472 - optuna.study.study - INFO - Trial 17 finished with values: [0.005691887137394406, 0.004230132450331127, 0.005422760408641469] and parameters: {'n_layers': 1, 'embedding_dim': 96, 'lr': 0.024050557851221715, 'lambda_val': 2.9822943996985876e-05, 'batch_size': 3643, 'optimizer': 'SGD'}.
2026-05-24 06:34:39,501 - experiment_functions - INFO - Early stopping at epoch 500. Best Metrics: (0.0045761206501704395, 0.0043377483443708615, 0.005089927439373879)
2026-05-24 06:34:39,667 - optuna.study.study - INFO - Trial 18 finished with values: [0.0045761206501704395, 0.0043377483443708615, 0.005089927439373879] and parameters: {'n_layers': 4, 'embedding_dim': 64, 'lr': 0.0002974052327945212, 'lambda_val': 1.6595413164385067e-06, 'batch_size': 1964, 'optimizer': 'SGD'}.
2026-05-24 06:34:50,680 - experiment_functions - INFO - Early stopping at epoch 800. Best Metrics: (0.004691033197435557, 0.004279801324503311, 0.00519149254201641)
2026-05-24 06:34:51,432 - optuna.study.study - INFO - Trial 19 finished with values: [0.004691033197435557, 0.004279801324503311, 0.00519149254201641] and parameters: {'n_layers': 3, 'embedding_dim': 128, 'lr': 0.007613283644844984, 'lambda_val': 0.011054352471364673, 'batch_size': 2653, 'optimizer': 'SGD'}.
2026-05-24 06:34:59,986 - experiment_functions - INFO - Early stopping at epoch 700. Best Metrics: (0.006064665550331272, 0.004271523178807947, 0.005816302914724228)
2026-05-24 06:35:00,098 - optuna.study.study - INFO - Trial 20 finished with values: [0.006064665550331272, 0.004271523178807947, 0.005816302914724228] and parameters: {'n_layers': 2, 'embedding_dim': 32, 'lr': 1.2019898160521425e-05, 'lambda_val': 0.0010114613970801255, 'batch_size': 3606, 'optimizer': 'Adam'}.
2026-05-24 06:35:42,996 - optuna.study.study - INFO - Trial 21 finished with values: [0.010629974083296466, 0.00722682119205298, 0.010389740358402883] and parameters: {'n_layers': 2, 'embedding_dim': 32, 'lr': 6.831666867393747e-05, 'lambda_val': 2.4948249425733372e-05, 'batch_size': 2083, 'optimizer': 'RMSprop'}.
2026-05-24 06:36:37,103 - optuna.study.study - INFO - Trial 22 finished with values: [0.04071675654301576, 0.021870860927152323, 0.035258283780343534] and parameters: {'n_layers': 4, 'embedding_dim': 96, 'lr': 9.311633605007365e-05, 'lambda_val': 0.006128221667042127, 'batch_size': 891, 'optimizer': 'RMSprop'}.
2026-05-24 06:36:43,375 - experiment_functions - INFO - Early stopping at epoch 500. Best Metrics: (0.005627751320585656, 0.0045033112582781466, 0.005627422186807432)
2026-05-24 06:36:44,170 - optuna.study.study - INFO - Trial 23 finished with values: [0.005627751320585656, 0.0045033112582781466, 0.005627422186807432] and parameters: {'n_layers': 1, 'embedding_dim': 64, 'lr': 4.66334650969812e-05, 'lambda_val': 0.003036563361231438, 'batch_size': 3573, 'optimizer': 'Adam'}.
2026-05-24 06:37:29,423 - optuna.study.study - INFO - Trial 24 finished with values: [0.007369230433554501, 0.005182119205298014, 0.007061273167350965] and parameters: {'n_layers': 1, 'embedding_dim': 256, 'lr': 9.943305227838634e-05, 'lambda_val': 0.0014922246564445, 'batch_size': 668, 'optimizer': 'RMSprop'}.
2026-05-24 06:37:35,984 - experiment_functions - INFO - Early stopping at epoch 500. Best Metrics: (0.0058389997381613065, 0.004304635761589405, 0.005580949186633008)
2026-05-24 06:37:36,080 - optuna.study.study - INFO - Trial 25 finished with values: [0.0058389997381613065, 0.004304635761589405, 0.005580949186633008] and parameters: {'n_layers': 2, 'embedding_dim': 32, 'lr': 0.003653216793869049, 'lambda_val': 7.3951905188581575e-06, 'batch_size': 3105, 'optimizer': 'SGD'}.
2026-05-24 06:37:42,772 - experiment_functions - INFO - Early stopping at epoch 500. Best Metrics: (0.005322751998022531, 0.004370860927152318, 0.00551940987115285)
2026-05-24 06:37:43,573 - optuna.study.study - INFO - Trial 26 finished with values: [0.005322751998022531, 0.004370860927152318, 0.00551940987115285] and parameters: {'n_layers': 3, 'embedding_dim': 64, 'lr': 0.0012001660961712245, 'lambda_val': 0.0022319105510375183, 'batch_size': 847, 'optimizer': 'SGD'}.
2026-05-24 06:38:26,626 - optuna.study.study - INFO - Trial 27 finished with values: [0.008327482303440851, 0.005513245033112582, 0.008085811956971917] and parameters: {'n_layers': 2, 'embedding_dim': 32, 'lr': 5.2450990712037914e-05, 'lambda_val': 0.0003333223348807386, 'batch_size': 3182, 'optimizer': 'RMSprop'}.
2026-05-24 06:38:45,879 - experiment_functions - INFO - Early stopping at epoch 1750. Best Metrics: (0.00538783074017816, 0.004346026490066225, 0.005667667252871591)
