2026-05-24 03:50:27,558 - optuna.study.study - INFO - Trial 11 finished with values: [0.0048974646921945844, 0.003915562913907285, 0.005047251898898683] and parameters: {'n_layers': 1, 'embedding_dim': 256, 'lr': 4.324923583539931e-05, 'lambda_val': 0.06025175805337695, 'batch_size': 2926, 'optimizer': 'RMSprop'}.
2026-05-24 03:50:35,134 - experiment_functions - INFO - Early stopping at epoch 650. Best Metrics: (0.021930234501846703, 0.017897350993377484, 0.022720007941308323)
2026-05-24 03:50:35,604 - optuna.study.study - INFO - Trial 12 finished with values: [0.021930234501846703, 0.017897350993377484, 0.022720007941308323] and parameters: {'n_layers': 4, 'embedding_dim': 64, 'lr': 0.0013524049945715497, 'lambda_val': 0.030528649183713095, 'batch_size': 1735, 'optimizer': 'Adam'}.
2026-05-24 03:50:41,855 - experiment_functions - INFO - Early stopping at epoch 500. Best Metrics: (0.0047507600250731655, 0.003923841059602649, 0.004972680284271218)
2026-05-24 03:50:41,930 - optuna.study.study - INFO - Trial 13 finished with values: [0.0047507600250731655, 0.003923841059602649, 0.004972680284271218] and parameters: {'n_layers': 4, 'embedding_dim': 64, 'lr': 4.2370647370297135e-05, 'lambda_val': 0.001587327024093606, 'batch_size': 1048, 'optimizer': 'SGD'}.
2026-05-24 03:51:21,629 - optuna.study.study - INFO - Trial 14 finished with values: [0.006903124833870578, 0.005413907284768212, 0.007124840288803316] and parameters: {'n_layers': 3, 'embedding_dim': 96, 'lr': 4.155752622597645e-05, 'lambda_val': 0.01139141314375994, 'batch_size': 1744, 'optimizer': 'Adam'}.
2026-05-24 03:52:02,600 - optuna.study.study - INFO - Trial 15 finished with values: [0.010020585212318852, 0.00783112582781457, 0.010393864781930842] and parameters: {'n_layers': 1, 'embedding_dim': 256, 'lr': 6.318128044063991e-05, 'lambda_val': 0.002804027423252874, 'batch_size': 3958, 'optimizer': 'RMSprop'}.
2026-05-24 03:52:10,105 - experiment_functions - INFO - Early stopping at epoch 600. Best Metrics: (0.017198800673942003, 0.014519867549668875, 0.018568248291488974)
2026-05-24 03:52:10,198 - optuna.study.study - INFO - Trial 16 finished with values: [0.017198800673942003, 0.014519867549668875, 0.018568248291488974] and parameters: {'n_layers': 4, 'embedding_dim': 96, 'lr': 0.0007924927231928422, 'lambda_val': 1.788497394454551e-05, 'batch_size': 3956, 'optimizer': 'RMSprop'}.
2026-05-24 03:52:46,702 - experiment_functions - INFO - Early stopping at epoch 3500. Best Metrics: (0.01561449283165093, 0.011730132450331127, 0.015626012155226767)
2026-05-24 03:52:46,918 - optuna.study.study - INFO - Trial 17 finished with values: [0.01561449283165093, 0.011730132450331127, 0.015626012155226767] and parameters: {'n_layers': 1, 'embedding_dim': 256, 'lr': 0.00035213057205874806, 'lambda_val': 5.775200011460303e-06, 'batch_size': 1633, 'optimizer': 'Adam'}.
2026-05-24 03:52:53,689 - experiment_functions - INFO - Early stopping at epoch 550. Best Metrics: (0.005405722776525899, 0.005364238410596026, 0.006304444211542156)
2026-05-24 03:52:54,263 - optuna.study.study - INFO - Trial 18 finished with values: [0.005405722776525899, 0.005364238410596026, 0.006304444211542156] and parameters: {'n_layers': 2, 'embedding_dim': 256, 'lr': 0.044025814280472544, 'lambda_val': 0.014795226107322373, 'batch_size': 3080, 'optimizer': 'Adam'}.
2026-05-24 03:53:32,267 - experiment_functions - INFO - Early stopping at epoch 3800. Best Metrics: (0.005820215875783161, 0.004668874172185431, 0.005796100448420144)
2026-05-24 03:53:32,358 - optuna.study.study - INFO - Trial 19 finished with values: [0.005820215875783161, 0.004668874172185431, 0.005796100448420144] and parameters: {'n_layers': 3, 'embedding_dim': 128, 'lr': 1.4186623019382506e-05, 'lambda_val': 4.096597741696202e-06, 'batch_size': 2052, 'optimizer': 'RMSprop'}.
2026-05-24 03:54:13,638 - optuna.study.study - INFO - Trial 20 finished with values: [0.01780189327932366, 0.012897350993377485, 0.01808688974147167] and parameters: {'n_layers': 1, 'embedding_dim': 32, 'lr': 0.0002960115862018489, 'lambda_val': 0.0012311986942485985, 'batch_size': 3377, 'optimizer': 'Adam'}.
2026-05-24 03:54:19,580 - experiment_functions - INFO - Early stopping at epoch 500. Best Metrics: (0.004830784047815429, 0.004288079470198675, 0.005264798619435338)
2026-05-24 03:54:20,020 - optuna.study.study - INFO - Trial 21 finished with values: [0.004830784047815429, 0.004288079470198675, 0.005264798619435338] and parameters: {'n_layers': 3, 'embedding_dim': 128, 'lr': 1.651160937236865e-05, 'lambda_val': 9.299429587051057e-05, 'batch_size': 1767, 'optimizer': 'SGD'}.
2026-05-24 03:54:27,198 - experiment_functions - INFO - Early stopping at epoch 650. Best Metrics: (0.005612438777295247, 0.004064569536423841, 0.005311905307786624)
2026-05-24 03:54:27,297 - optuna.study.study - INFO - Trial 22 finished with values: [0.005612438777295247, 0.004064569536423841, 0.005311905307786624] and parameters: {'n_layers': 1, 'embedding_dim': 96, 'lr': 0.0014004062273845301, 'lambda_val': 0.0001736484744689997, 'batch_size': 538, 'optimizer': 'SGD'}.
2026-05-24 03:55:06,527 - optuna.study.study - INFO - Trial 23 finished with values: [0.007095935438627375, 0.005562913907284768, 0.0072719018803931584] and parameters: {'n_layers': 2, 'embedding_dim': 96, 'lr': 4.3213492015527625e-05, 'lambda_val': 1.7003820809069974e-06, 'batch_size': 1746, 'optimizer': 'Adam'}.
2026-05-24 03:55:12,397 - experiment_functions - INFO - Early stopping at epoch 500. Best Metrics: (0.005152469360535272, 0.004114238410596027, 0.005369400433761242)
2026-05-24 03:55:12,682 - optuna.study.study - INFO - Trial 24 finished with values: [0.005152469360535272, 0.004114238410596027, 0.005369400433761242] and parameters: {'n_layers': 1, 'embedding_dim': 64, 'lr': 0.00010936189711277886, 'lambda_val': 1.6488811140589769e-06, 'batch_size': 1543, 'optimizer': 'SGD'}.
2026-05-24 03:55:20,661 - experiment_functions - INFO - Early stopping at epoch 600. Best Metrics: (0.018631035071138034, 0.014006622516556292, 0.019568637836941252)
2026-05-24 03:55:20,750 - optuna.study.study - INFO - Trial 25 finished with values: [0.018631035071138034, 0.014006622516556292, 0.019568637836941252] and parameters: {'n_layers': 3, 'embedding_dim': 96, 'lr': 0.002717396800836918, 'lambda_val': 0.006420156392281269, 'batch_size': 796, 'optimizer': 'Adam'}.
2026-05-24 03:55:26,869 - experiment_functions - INFO - Early stopping at epoch 500. Best Metrics: (0.008450846735280898, 0.006928807947019869, 0.008783033893344889)
2026-05-24 03:55:27,817 - optuna.study.study - INFO - Trial 26 finished with values: [0.008450846735280898, 0.006928807947019869, 0.008783033893344889] and parameters: {'n_layers': 4, 'embedding_dim': 96, 'lr': 0.0984706015088339, 'lambda_val': 0.0007745083434430237, 'batch_size': 3664, 'optimizer': 'RMSprop'}.
2026-05-24 03:55:34,263 - experiment_functions - INFO - Early stopping at epoch 550. Best Metrics: (0.01000495165897092, 0.007764900662251655, 0.00989424558192938)
2026-05-24 03:55:34,353 - optuna.study.study - INFO - Trial 27 finished with values: [0.01000495165897092, 0.007764900662251655, 0.00989424558192938] and parameters: {'n_layers': 4, 'embedding_dim': 64, 'lr': 0.051596046295218745, 'lambda_val': 2.4395942388228857e-05, 'batch_size': 1729, 'optimizer': 'Adam'}.
2026-05-24 03:55:40,235 - experiment_functions - INFO - Early stopping at epoch 500. Best Metrics: (0.005357361425891893, 0.00423841059602649, 0.005490412802779955)
2026-05-24 03:55:41,352 - optuna.study.study - INFO - Trial 28 finished with values: [0.005357361425891893, 0.00423841059602649, 0.005490412802779955] and parameters: {'n_layers': 2, 'embedding_dim': 64, 'lr': 0.00016272925807286133, 'lambda_val': 0.004683694598349177, 'batch_size': 1409, 'optimizer': 'SGD'}.
2026-05-24 03:55:47,545 - experiment_functions - INFO - Early stopping at epoch 500. Best Metrics: (0.00551980966845753, 0.004279801324503311, 0.0056627732943539755)
2026-05-24 03:55:48,039 - optuna.study.study - INFO - Trial 29 finished with values: [0.00551980966845753, 0.004279801324503311, 0.0056627732943539755] and parameters: {'n_layers': 2, 'embedding_dim': 256, 'lr': 0.000761140613759794, 'lambda_val': 0.002020546735084958, 'batch_size': 2375, 'optimizer': 'SGD'}.
2026-05-24 03:55:57,037 - experiment_functions - INFO - Early stopping at epoch 800. Best Metrics: (0.016889675658712487, 0.012582781456953643, 0.017230325255872266)
2026-05-24 03:55:57,148 - optuna.study.study - INFO - Trial 30 finished with values: [0.016889675658712487, 0.012582781456953643, 0.017230325255872266] and parameters: {'n_layers': 1, 'embedding_dim': 128, 'lr': 0.0010345450541168627, 'lambda_val': 0.0005557477534433548, 'batch_size': 2098, 'optimizer': 'Adam'}.
2026-05-24 03:56:03,640 - experiment_functions - INFO - Early stopping at epoch 550. Best Metrics: (0.005871060349134453, 0.006299668874172185, 0.007071268737132229)
2026-05-24 03:56:03,733 - optuna.study.study - INFO - Trial 31 finished with values: [0.005871060349134453, 0.006299668874172185, 0.007071268737132229] and parameters: {'n_layers': 3, 'embedding_dim': 64, 'lr': 0.013741793349809859, 'lambda_val': 0.01288825884440106, 'batch_size': 4000, 'optimizer': 'Adam'}.
2026-05-24 03:56:46,999 - optuna.study.study - INFO - Trial 32 finished with values: [0.0057408235645141255, 0.004875827814569537, 0.006087506398512063] and parameters: {'n_layers': 3, 'embedding_dim': 256, 'lr': 1.454675542952412e-05, 'lambda_val': 1.2218508866888091e-05, 'batch_size': 3112, 'optimizer': 'RMSprop'}.
2026-05-24 03:56:52,821 - experiment_functions - INFO - Early stopping at epoch 500. Best Metrics: (0.005734914955252892, 0.004221854304635762, 0.005413127314980655)
2026-05-24 03:56:52,928 - optuna.study.study - INFO - Trial 33 finished with values: [0.005734914955252892, 0.004221854304635762, 0.005413127314980655] and parameters: {'n_layers': 3, 'embedding_dim': 32, 'lr': 1.2956159597118039e-05, 'lambda_val': 2.536948582092468e-06, 'batch_size': 1329, 'optimizer': 'SGD'}.
2026-05-24 03:56:58,745 - experiment_functions - INFO - Early stopping at epoch 500. Best Metrics: (0.005891977039298949, 0.00429635761589404, 0.005693071159267432)
2026-05-24 03:56:58,876 - optuna.study.study - INFO - Trial 34 finished with values: [0.005891977039298949, 0.00429635761589404, 0.005693071159267432] and parameters: {'n_layers': 2, 'embedding_dim': 32, 'lr': 0.00015155803146396787, 'lambda_val': 0.0026198298939258, 'batch_size': 1178, 'optimizer': 'SGD'}.
2026-05-24 03:57:05,376 - experiment_functions - INFO - Early stopping at epoch 550. Best Metrics: (0.020664021965444493, 0.015695364238410597, 0.02140795785803236)
2026-05-24 03:57:05,498 - optuna.study.study - INFO - Trial 35 finished with values: [0.020664021965444493, 0.015695364238410597, 0.02140795785803236] and parameters: {'n_layers': 4, 'embedding_dim': 64, 'lr': 0.0054266566794856745, 'lambda_val': 3.898561124366437e-06, 'batch_size': 764, 'optimizer': 'Adam'}.
2026-05-24 03:57:12,146 - experiment_functions - INFO - Early stopping at epoch 500. Best Metrics: (0.005241109702959762, 0.004014900662251656, 0.005109073422730507)
2026-05-24 03:57:12,791 - optuna.study.study - INFO - Trial 36 finished with values: [0.005241109702959762, 0.004014900662251656, 0.005109073422730507] and parameters: {'n_layers': 4, 'embedding_dim': 256, 'lr': 0.007020355811623997, 'lambda_val': 0.00232500725316245, 'batch_size': 942, 'optimizer': 'SGD'}.
2026-05-24 03:57:19,541 - experiment_functions - INFO - Early stopping at epoch 550. Best Metrics: (0.01106534699740343, 0.009942052980132449, 0.01204371859654316)
2026-05-24 03:57:21,319 - optuna.study.study - INFO - Trial 37 finished with values: [0.01106534699740343, 0.009942052980132449, 0.01204371859654316] and parameters: {'n_layers': 3, 'embedding_dim': 128, 'lr': 0.003599405628543548, 'lambda_val': 0.0007150353686754638, 'batch_size': 3635, 'optimizer': 'RMSprop'}.
2026-05-24 03:57:27,483 - experiment_functions - INFO - Early stopping at epoch 500. Best Metrics: (0.009276463807448279, 0.006879139072847683, 0.008896043933412824)
2026-05-24 03:57:27,617 - optuna.study.study - INFO - Trial 38 finished with values: [0.009276463807448279, 0.006879139072847683, 0.008896043933412824] and parameters: {'n_layers': 1, 'embedding_dim': 128, 'lr': 0.0756565446230281, 'lambda_val': 0.002796129202981768, 'batch_size': 916, 'optimizer': 'Adam'}.
2026-05-24 03:57:33,586 - experiment_functions - INFO - Early stopping at epoch 500. Best Metrics: (0.005671367771648218, 0.00429635761589404, 0.005784095214364058)
2026-05-24 03:57:33,893 - optuna.study.study - INFO - Trial 39 finished with values: [0.005671367771648218, 0.00429635761589404, 0.005784095214364058] and parameters: {'n_layers': 3, 'embedding_dim': 96, 'lr': 0.00023437389049620985, 'lambda_val': 0.08705972831998063, 'batch_size': 3975, 'optimizer': 'SGD'}.
2026-05-24 03:58:13,250 - optuna.study.study - INFO - Trial 40 finished with values: [0.0073263238336703325, 0.005571192052980132, 0.007051984539916052] and parameters: {'n_layers': 2, 'embedding_dim': 128, 'lr': 5.2589686303093634e-05, 'lambda_val': 1.434440959118923e-06, 'batch_size': 917, 'optimizer': 'Adam'}.
2026-05-24 03:58:19,187 - experiment_functions - INFO - Early stopping at epoch 500. Best Metrics: (0.005706769918234759, 0.004312913907284769, 0.005889334175280401)
2026-05-24 03:58:19,339 - optuna.study.study - INFO - Trial 41 finished with values: [0.005706769918234759, 0.004312913907284769, 0.005889334175280401] and parameters: {'n_layers': 4, 'embedding_dim': 96, 'lr': 0.0015178484474383724, 'lambda_val': 0.0003143683086228382, 'batch_size': 1609, 'optimizer': 'SGD'}.
2026-05-24 03:58:25,355 - experiment_functions - INFO - Early stopping at epoch 500. Best Metrics: (0.005359316160552081, 0.004321192052980133, 0.005671626589731377)
2026-05-24 03:58:25,489 - optuna.study.study - INFO - Trial 42 finished with values: [0.005359316160552081, 0.004321192052980133, 0.005671626589731377] and parameters: {'n_layers': 2, 'embedding_dim': 32, 'lr': 2.380380122355694e-05, 'lambda_val': 0.020024322546739484, 'batch_size': 2831, 'optimizer': 'SGD'}.
2026-05-24 03:58:33,068 - experiment_functions - INFO - Early stopping at epoch 650. Best Metrics: (0.016039595176372705, 0.014337748344370863, 0.017469983253215422)
2026-05-24 03:58:33,164 - optuna.study.study - INFO - Trial 43 finished with values: [0.016039595176372705, 0.014337748344370863, 0.017469983253215422] and parameters: {'n_layers': 4, 'embedding_dim': 96, 'lr': 0.0020206577109833958, 'lambda_val': 0.05904110892608641, 'batch_size': 642, 'optimizer': 'Adam'}.
2026-05-24 03:58:40,219 - experiment_functions - INFO - Early stopping at epoch 500. Best Metrics: (0.00790664527842912, 0.006316225165562914, 0.008066467551396997)
2026-05-24 03:58:41,171 - optuna.study.study - INFO - Trial 44 finished with values: [0.00790664527842912, 0.006316225165562914, 0.008066467551396997] and parameters: {'n_layers': 1, 'embedding_dim': 96, 'lr': 0.07858250774247641, 'lambda_val': 0.006116705605803979, 'batch_size': 2848, 'optimizer': 'Adam'}.
2026-05-24 03:58:51,275 - experiment_functions - INFO - Early stopping at epoch 900. Best Metrics: (0.0160675917816427, 0.014552980132450332, 0.017590147661551318)
2026-05-24 03:58:52,378 - optuna.study.study - INFO - Trial 45 finished with values: [0.0160675917816427, 0.014552980132450332, 0.017590147661551318] and parameters: {'n_layers': 3, 'embedding_dim': 96, 'lr': 0.0006691559391119897, 'lambda_val': 0.04918021699603916, 'batch_size': 694, 'optimizer': 'RMSprop'}.
2026-05-24 03:58:59,179 - experiment_functions - INFO - Early stopping at epoch 550. Best Metrics: (0.01482600276360834, 0.01185430463576159, 0.01530643138042319)
2026-05-24 03:59:00,226 - optuna.study.study - INFO - Trial 46 finished with values: [0.01482600276360834, 0.01185430463576159, 0.01530643138042319] and parameters: {'n_layers': 3, 'embedding_dim': 96, 'lr': 0.006176597452576965, 'lambda_val': 0.00011847884966446926, 'batch_size': 3180, 'optimizer': 'Adam'}.
2026-05-24 03:59:42,269 - optuna.study.study - INFO - Trial 47 finished with values: [0.01186476103005126, 0.009039735099337748, 0.012469727897384495] and parameters: {'n_layers': 2, 'embedding_dim': 256, 'lr': 8.355080094834955e-05, 'lambda_val': 1.688295648047332e-06, 'batch_size': 2286, 'optimizer': 'RMSprop'}.
2026-05-24 04:00:25,237 - optuna.study.study - INFO - Trial 48 finished with values: [0.01510924796361685, 0.012433774834437087, 0.016055087906986357] and parameters: {'n_layers': 4, 'embedding_dim': 128, 'lr': 9.989961915759321e-05, 'lambda_val': 2.2026053733354513e-05, 'batch_size': 3214, 'optimizer': 'RMSprop'}.
2026-05-24 04:00:37,027 - experiment_functions - INFO - Early stopping at epoch 1100. Best Metrics: (0.00543693936150253, 0.004197019867549669, 0.005449590324381233)
2026-05-24 04:00:37,124 - optuna.study.study - INFO - Trial 49 finished with values: [0.00543693936150253, 0.004197019867549669, 0.005449590324381233] and parameters: {'n_layers': 2, 'embedding_dim': 128, 'lr': 0.01038413256693664, 'lambda_val': 8.730817526627786e-06, 'batch_size': 4009, 'optimizer': 'SGD'}.
2026-05-24 04:01:21,390 - optuna.study.study - INFO - Trial 50 finished with values: [0.008132080686468045, 0.0066970198675496695, 0.008685803572634626] and parameters: {'n_layers': 3, 'embedding_dim': 128, 'lr': 4.098879095843898e-05, 'lambda_val': 0.0007150353686754638, 'batch_size': 3635, 'optimizer': 'RMSprop'}.
2026-05-24 04:01:27,441 - experiment_functions - INFO - Early stopping at epoch 500. Best Metrics: (0.005073808688319673, 0.004197019867549669, 0.0054109727581178645)
2026-05-24 04:01:27,556 - optuna.study.study - INFO - Trial 51 finished with values: [0.005073808688319673, 0.004197019867549669, 0.0054109727581178645] and parameters: {'n_layers': 4, 'embedding_dim': 64, 'lr': 0.0013524049945715497, 'lambda_val': 0.016113443657182445, 'batch_size': 3264, 'optimizer': 'SGD'}.
2026-05-24 04:01:34,172 - experiment_functions - INFO - Early stopping at epoch 550. Best Metrics: (0.00890414266986462, 0.007483443708609272, 0.009103114076593142)
2026-05-24 04:01:34,656 - optuna.study.study - INFO - Trial 52 finished with values: [0.00890414266986462, 0.007483443708609272, 0.009103114076593142] and parameters: {'n_layers': 1, 'embedding_dim': 256, 'lr': 0.007140866818804174, 'lambda_val': 0.014795226107322373, 'batch_size': 1609, 'optimizer': 'Adam'}.
2026-05-24 04:01:42,623 - experiment_functions - INFO - Early stopping at epoch 700. Best Metrics: (0.022700042241032885, 0.017731788079470196, 0.023040834424653534)
2026-05-24 04:01:42,735 - optuna.study.study - INFO - Trial 53 finished with values: [0.022700042241032885, 0.017731788079470196, 0.023040834424653534] and parameters: {'n_layers': 4, 'embedding_dim': 32, 'lr': 0.0013524049945715497, 'lambda_val': 0.030528649183713095, 'batch_size': 1735, 'optimizer': 'Adam'}.
2026-05-24 04:02:21,911 - optuna.study.study - INFO - Trial 54 finished with values: [0.01168691779101598, 0.00927980132450331, 0.012741170076765888] and parameters: {'n_layers': 1, 'embedding_dim': 64, 'lr': 0.00010936189711277886, 'lambda_val': 1.6488811140589769e-06, 'batch_size': 1543, 'optimizer': 'Adam'}.
2026-05-24 04:02:30,862 - experiment_functions - INFO - Early stopping at epoch 700. Best Metrics: (0.019511678258356216, 0.015587748344370862, 0.020239375444181768)
2026-05-24 04:02:31,001 - optuna.study.study - INFO - Trial 55 finished with values: [0.019511678258356216, 0.015587748344370862, 0.020239375444181768] and parameters: {'n_layers': 4, 'embedding_dim': 64, 'lr': 0.0010345450541168627, 'lambda_val': 2.571811162691067e-06, 'batch_size': 1829, 'optimizer': 'Adam'}.
2026-05-24 04:02:38,104 - experiment_functions - INFO - Early stopping at epoch 600. Best Metrics: (0.005970464184782719, 0.004437086092715232, 0.00590947497664718)
2026-05-24 04:02:39,372 - optuna.study.study - INFO - Trial 56 finished with values: [0.005970464184782719, 0.004437086092715232, 0.00590947497664718] and parameters: {'n_layers': 3, 'embedding_dim': 96, 'lr': 0.044025814280472544, 'lambda_val': 0.014795226107322373, 'batch_size': 3979, 'optimizer': 'SGD'}.
2026-05-24 04:02:46,571 - experiment_functions - INFO - Early stopping at epoch 600. Best Metrics: (0.020230081770111076, 0.015000000000000001, 0.020453593176082727)
2026-05-24 04:02:46,688 - optuna.study.study - INFO - Trial 57 finished with values: [0.020230081770111076, 0.015000000000000001, 0.020453593176082727] and parameters: {'n_layers': 3, 'embedding_dim': 96, 'lr': 0.002717396800836918, 'lambda_val': 0.006420156392281269, 'batch_size': 796, 'optimizer': 'Adam'}.
2026-05-24 04:03:20,651 - experiment_functions - INFO - Early stopping at epoch 3400. Best Metrics: (0.005528285907431994, 0.004288079470198676, 0.005518045199704536)
2026-05-24 04:03:20,767 - optuna.study.study - INFO - Trial 58 finished with values: [0.005528285907431994, 0.004288079470198676, 0.005518045199704536] and parameters: {'n_layers': 3, 'embedding_dim': 128, 'lr': 1.4186623019382506e-05, 'lambda_val': 4.096597741696202e-06, 'batch_size': 2052, 'optimizer': 'RMSprop'}.
2026-05-24 04:03:26,840 - experiment_functions - INFO - Early stopping at epoch 500. Best Metrics: (0.005108996629200098, 0.003990066225165563, 0.004919794511901135)
2026-05-24 04:03:26,995 - optuna.study.study - INFO - Trial 59 finished with values: [0.005108996629200098, 0.003990066225165563, 0.004919794511901135] and parameters: {'n_layers': 2, 'embedding_dim': 96, 'lr': 0.0006691559391119897, 'lambda_val': 0.04918021699603916, 'batch_size': 2945, 'optimizer': 'SGD'}.
2026-05-24 04:03:33,662 - experiment_functions - INFO - Early stopping at epoch 550. Best Metrics: (0.01487174200016095, 0.011216887417218543, 0.01486589646054959)
