2026-05-24 08:57:34,617 - optuna.study.study - INFO - Trial 156 finished with values: [0.055189709484970303, 0.03313741721854304, 0.048999010167393206] and parameters: {'n_layers': 1, 'embedding_dim': 128, 'lr': 0.0015435244296002795, 'lambda_val': 4.601372605867572e-05, 'batch_size': 1091, 'optimizer': 'RMSprop'}.
2026-05-24 08:57:41,870 - experiment_functions - INFO - Early stopping at epoch 550. Best Metrics: (0.04334373638928963, 0.02786423841059603, 0.039385279848312235)
2026-05-24 08:57:41,959 - optuna.study.study - INFO - Trial 157 finished with values: [0.04334373638928963, 0.02786423841059603, 0.039385279848312235] and parameters: {'n_layers': 1, 'embedding_dim': 128, 'lr': 0.0019498675283919575, 'lambda_val': 0.01924910562729115, 'batch_size': 1091, 'optimizer': 'RMSprop'}.
2026-05-24 08:57:57,401 - experiment_functions - INFO - Early stopping at epoch 1150. Best Metrics: (0.05152106383784934, 0.03348509933774835, 0.04704222211948288)
2026-05-24 08:57:58,423 - optuna.study.study - INFO - Trial 158 finished with values: [0.05152106383784934, 0.03348509933774835, 0.04704222211948288] and parameters: {'n_layers': 1, 'embedding_dim': 256, 'lr': 0.0003755353524054084, 'lambda_val': 0.00800073098738819, 'batch_size': 2675, 'optimizer': 'RMSprop'}.
2026-05-24 08:58:06,633 - experiment_functions - INFO - Early stopping at epoch 600. Best Metrics: (0.048919735073825986, 0.031539735099337746, 0.04423005809345093)
2026-05-24 08:58:06,749 - optuna.study.study - INFO - Trial 159 finished with values: [0.048919735073825986, 0.031539735099337746, 0.04423005809345093] and parameters: {'n_layers': 1, 'embedding_dim': 128, 'lr': 0.0019498675283919575, 'lambda_val': 0.0011457679520731478, 'batch_size': 1091, 'optimizer': 'RMSprop'}.
2026-05-24 08:58:56,281 - optuna.study.study - INFO - Trial 160 finished with values: [0.025163861720832587, 0.018667218543046357, 0.024545512647420956] and parameters: {'n_layers': 4, 'embedding_dim': 64, 'lr': 0.00010049142370938069, 'lambda_val': 2.2115866497471835e-05, 'batch_size': 1011, 'optimizer': 'RMSprop'}.
2026-05-24 08:59:03,828 - experiment_functions - INFO - Early stopping at epoch 550. Best Metrics: (0.05221343396981608, 0.03155629139072848, 0.04727298280958995)
2026-05-24 08:59:03,934 - optuna.study.study - INFO - Trial 161 finished with values: [0.05221343396981608, 0.03155629139072848, 0.04727298280958995] and parameters: {'n_layers': 1, 'embedding_dim': 64, 'lr': 0.0019498675283919575, 'lambda_val': 1.122316914307546e-06, 'batch_size': 2226, 'optimizer': 'RMSprop'}.
2026-05-24 08:59:51,300 - optuna.study.study - INFO - Trial 162 finished with values: [0.05655420885866424, 0.03438741721854304, 0.05041375893274453] and parameters: {'n_layers': 1, 'embedding_dim': 128, 'lr': 0.0003755353524054084, 'lambda_val': 0.000621169344675621, 'batch_size': 664, 'optimizer': 'RMSprop'}.
2026-05-24 09:00:08,141 - experiment_functions - INFO - Early stopping at epoch 1300. Best Metrics: (0.04854697973107733, 0.029991721854304636, 0.042957712412346034)
2026-05-24 09:00:08,227 - optuna.study.study - INFO - Trial 163 finished with values: [0.04854697973107733, 0.029991721854304636, 0.042957712412346034] and parameters: {'n_layers': 2, 'embedding_dim': 96, 'lr': 0.00027037181334258007, 'lambda_val': 8.523357255734578e-06, 'batch_size': 3449, 'optimizer': 'Adam'}.
2026-05-24 09:00:16,849 - experiment_functions - INFO - Early stopping at epoch 650. Best Metrics: (0.021394064775022956, 0.0159023178807947, 0.021569235723153862)
2026-05-24 09:00:16,958 - optuna.study.study - INFO - Trial 164 finished with values: [0.021394064775022956, 0.0159023178807947, 0.021569235723153862] and parameters: {'n_layers': 1, 'embedding_dim': 128, 'lr': 0.013569448108847812, 'lambda_val': 4.601372605867572e-05, 'batch_size': 3076, 'optimizer': 'RMSprop'}.
2026-05-24 09:00:23,166 - experiment_functions - INFO - Early stopping at epoch 500. Best Metrics: (0.00537375316005763, 0.00447019867549669, 0.005502022706523516)
2026-05-24 09:00:24,010 - optuna.study.study - INFO - Trial 165 finished with values: [0.00537375316005763, 0.00447019867549669, 0.005502022706523516] and parameters: {'n_layers': 1, 'embedding_dim': 64, 'lr': 0.0015435244296002795, 'lambda_val': 8.523357255734578e-06, 'batch_size': 2036, 'optimizer': 'SGD'}.
2026-05-24 09:00:41,488 - experiment_functions - INFO - Early stopping at epoch 1100. Best Metrics: (0.02701733371662268, 0.01576158940397351, 0.023138307553547257)
2026-05-24 09:00:42,092 - optuna.study.study - INFO - Trial 166 finished with values: [0.02701733371662268, 0.01576158940397351, 0.023138307553547257] and parameters: {'n_layers': 3, 'embedding_dim': 256, 'lr': 0.007911587240036237, 'lambda_val': 3.7429186547369787e-06, 'batch_size': 3605, 'optimizer': 'Adam'}.
2026-05-24 09:00:55,926 - experiment_functions - INFO - Early stopping at epoch 1100. Best Metrics: (0.033149954888254854, 0.022814569536423843, 0.031497177088072544)
2026-05-24 09:00:56,014 - optuna.study.study - INFO - Trial 167 finished with values: [0.033149954888254854, 0.022814569536423843, 0.031497177088072544] and parameters: {'n_layers': 1, 'embedding_dim': 128, 'lr': 0.004353257051363092, 'lambda_val': 1.122316914307546e-06, 'batch_size': 3069, 'optimizer': 'RMSprop'}.
2026-05-24 09:01:04,015 - experiment_functions - INFO - Early stopping at epoch 600. Best Metrics: (0.04343201140603032, 0.028071192052980136, 0.03781358918534974)
2026-05-24 09:01:04,119 - optuna.study.study - INFO - Trial 168 finished with values: [0.04343201140603032, 0.028071192052980136, 0.03781358918534974] and parameters: {'n_layers': 2, 'embedding_dim': 32, 'lr': 0.0015435244296002795, 'lambda_val': 1.4219577427815883e-06, 'batch_size': 914, 'optimizer': 'RMSprop'}.
2026-05-24 09:01:20,945 - experiment_functions - INFO - Early stopping at epoch 1250. Best Metrics: (0.054822040253892215, 0.033394039735099336, 0.049297106553540214)
2026-05-24 09:01:21,236 - optuna.study.study - INFO - Trial 169 finished with values: [0.054822040253892215, 0.033394039735099336, 0.049297106553540214] and parameters: {'n_layers': 1, 'embedding_dim': 256, 'lr': 0.0003755353524054084, 'lambda_val': 0.0007561839367868583, 'batch_size': 3076, 'optimizer': 'RMSprop'}.
2026-05-24 09:02:12,633 - experiment_functions - INFO - Early stopping at epoch 3450. Best Metrics: (0.039610228731926836, 0.026879139072847686, 0.03629235388471342)
2026-05-24 09:02:13,058 - optuna.study.study - INFO - Trial 170 finished with values: [0.039610228731926836, 0.026879139072847686, 0.03629235388471342] and parameters: {'n_layers': 3, 'embedding_dim': 256, 'lr': 0.00012197369968794222, 'lambda_val': 0.012192357251689472, 'batch_size': 1189, 'optimizer': 'RMSprop'}.
2026-05-24 09:02:55,239 - optuna.study.study - INFO - Trial 171 finished with values: [0.00486618466960071, 0.004172185430463576, 0.005084905161482085] and parameters: {'n_layers': 1, 'embedding_dim': 32, 'lr': 6.383793271359881e-05, 'lambda_val': 0.0011457679520731478, 'batch_size': 1458, 'optimizer': 'RMSprop'}.
2026-05-24 09:03:02,705 - experiment_functions - INFO - Early stopping at epoch 550. Best Metrics: (0.04586912970885754, 0.030629139072847682, 0.04254321142545804)
2026-05-24 09:03:02,810 - optuna.study.study - INFO - Trial 172 finished with values: [0.04586912970885754, 0.030629139072847682, 0.04254321142545804] and parameters: {'n_layers': 1, 'embedding_dim': 128, 'lr': 0.002019850627421517, 'lambda_val': 0.000621169344675621, 'batch_size': 3974, 'optimizer': 'RMSprop'}.
2026-05-24 09:03:56,539 - optuna.study.study - INFO - Trial 173 finished with values: [0.03312498450908217, 0.022251655629139073, 0.03065911738768549] and parameters: {'n_layers': 4, 'embedding_dim': 128, 'lr': 0.00010049142370938069, 'lambda_val': 0.0004077151861442529, 'batch_size': 3076, 'optimizer': 'RMSprop'}.
2026-05-24 09:04:04,126 - experiment_functions - INFO - Early stopping at epoch 600. Best Metrics: (0.0510657161957849, 0.032466887417218544, 0.04747311998679647)
2026-05-24 09:04:04,224 - optuna.study.study - INFO - Trial 174 finished with values: [0.0510657161957849, 0.032466887417218544, 0.04747311998679647] and parameters: {'n_layers': 1, 'embedding_dim': 128, 'lr': 0.0019498675283919575, 'lambda_val': 0.000621169344675621, 'batch_size': 1091, 'optimizer': 'RMSprop'}.
2026-05-24 09:04:48,332 - optuna.study.study - INFO - Trial 175 finished with values: [0.006746000372499041, 0.005281456953642384, 0.00676129183646676] and parameters: {'n_layers': 2, 'embedding_dim': 128, 'lr': 4.094991063756213e-05, 'lambda_val': 0.0011457679520731478, 'batch_size': 3458, 'optimizer': 'RMSprop'}.
2026-05-24 09:04:56,552 - experiment_functions - INFO - Early stopping at epoch 550. Best Metrics: (0.042178145604447354, 0.02889072847682119, 0.03910328522312557)
2026-05-24 09:04:56,649 - optuna.study.study - INFO - Trial 176 finished with values: [0.042178145604447354, 0.02889072847682119, 0.03910328522312557] and parameters: {'n_layers': 1, 'embedding_dim': 128, 'lr': 0.002019850627421517, 'lambda_val': 0.000621169344675621, 'batch_size': 3974, 'optimizer': 'RMSprop'}.
2026-05-24 09:05:04,152 - experiment_functions - INFO - Early stopping at epoch 600. Best Metrics: (0.04521598339844377, 0.03028973509933775, 0.042188451734017404)
2026-05-24 09:05:04,268 - optuna.study.study - INFO - Trial 177 finished with values: [0.04521598339844377, 0.03028973509933775, 0.042188451734017404] and parameters: {'n_layers': 1, 'embedding_dim': 32, 'lr': 0.0016555554597149236, 'lambda_val': 0.000621169344675621, 'batch_size': 3974, 'optimizer': 'RMSprop'}.
2026-05-24 09:05:11,762 - experiment_functions - INFO - Early stopping at epoch 550. Best Metrics: (0.009112326560870522, 0.00855132450331126, 0.010277431451985179)
2026-05-24 09:05:11,931 - optuna.study.study - INFO - Trial 178 finished with values: [0.009112326560870522, 0.00855132450331126, 0.010277431451985179] and parameters: {'n_layers': 1, 'embedding_dim': 256, 'lr': 0.09728638467365326, 'lambda_val': 0.000963421834632777, 'batch_size': 3538, 'optimizer': 'Adam'}.
2026-05-24 09:05:19,533 - experiment_functions - INFO - Early stopping at epoch 600. Best Metrics: (0.04791935448579623, 0.029503311258278143, 0.04241286470047864)
2026-05-24 09:05:19,630 - optuna.study.study - INFO - Trial 179 finished with values: [0.04791935448579623, 0.029503311258278143, 0.04241286470047864] and parameters: {'n_layers': 2, 'embedding_dim': 64, 'lr': 0.002019850627421517, 'lambda_val': 0.0005144021469830869, 'batch_size': 3974, 'optimizer': 'Adam'}.
2026-05-24 09:05:27,147 - experiment_functions - INFO - Early stopping at epoch 600. Best Metrics: (0.04963662245484563, 0.031084437086092716, 0.04409794815314395)
2026-05-24 09:05:27,249 - optuna.study.study - INFO - Trial 180 finished with values: [0.04963662245484563, 0.031084437086092716, 0.04409794815314395] and parameters: {'n_layers': 1, 'embedding_dim': 64, 'lr': 0.0019498675283919575, 'lambda_val': 8.523357255734578e-06, 'batch_size': 2036, 'optimizer': 'RMSprop'}.
2026-05-24 09:05:42,712 - experiment_functions - INFO - Early stopping at epoch 1250. Best Metrics: (0.05459352708092735, 0.034346026490066225, 0.04882424566715912)
2026-05-24 09:05:43,166 - optuna.study.study - INFO - Trial 181 finished with values: [0.05459352708092735, 0.034346026490066225, 0.04882424566715912] and parameters: {'n_layers': 1, 'embedding_dim': 256, 'lr': 0.0003755353524054084, 'lambda_val': 0.00800073098738819, 'batch_size': 2187, 'optimizer': 'RMSprop'}.
2026-05-24 09:05:52,776 - experiment_functions - INFO - Early stopping at epoch 750. Best Metrics: (0.05445312029474566, 0.03306291390728477, 0.04811697156286693)
2026-05-24 09:05:52,893 - optuna.study.study - INFO - Trial 182 finished with values: [0.05445312029474566, 0.03306291390728477, 0.04811697156286693] and parameters: {'n_layers': 1, 'embedding_dim': 128, 'lr': 0.000767834461150942, 'lambda_val': 8.523357255734578e-06, 'batch_size': 3076, 'optimizer': 'RMSprop'}.
2026-05-24 09:06:00,477 - experiment_functions - INFO - Early stopping at epoch 600. Best Metrics: (0.05645029474915509, 0.03390728476821192, 0.048924866426170416)
2026-05-24 09:06:00,573 - optuna.study.study - INFO - Trial 183 finished with values: [0.05645029474915509, 0.03390728476821192, 0.048924866426170416] and parameters: {'n_layers': 1, 'embedding_dim': 64, 'lr': 0.0019498675283919575, 'lambda_val': 4.601372605867572e-05, 'batch_size': 1091, 'optimizer': 'RMSprop'}.
2026-05-24 09:06:34,526 - experiment_functions - INFO - Early stopping at epoch 2950. Best Metrics: (0.05632393940856573, 0.03472682119205298, 0.050161465273853706)
2026-05-24 09:06:34,627 - optuna.study.study - INFO - Trial 184 finished with values: [0.05632393940856573, 0.03472682119205298, 0.050161465273853706] and parameters: {'n_layers': 1, 'embedding_dim': 128, 'lr': 0.00027037181334258007, 'lambda_val': 0.0007561839367868583, 'batch_size': 3825, 'optimizer': 'RMSprop'}.
2026-05-24 09:06:41,845 - experiment_functions - INFO - Early stopping at epoch 550. Best Metrics: (0.04989201688384969, 0.031192052980132452, 0.04433788692053327)
2026-05-24 09:06:41,994 - optuna.study.study - INFO - Trial 185 finished with values: [0.04989201688384969, 0.031192052980132452, 0.04433788692053327] and parameters: {'n_layers': 1, 'embedding_dim': 128, 'lr': 0.0019498675283919575, 'lambda_val': 0.0011457679520731478, 'batch_size': 3076, 'optimizer': 'RMSprop'}.
2026-05-24 09:06:54,386 - experiment_functions - INFO - Early stopping at epoch 850. Best Metrics: (0.04096127772859988, 0.027425496688741724, 0.03768538467104966)
2026-05-24 09:06:54,484 - optuna.study.study - INFO - Trial 186 finished with values: [0.04096127772859988, 0.027425496688741724, 0.03768538467104966] and parameters: {'n_layers': 2, 'embedding_dim': 256, 'lr': 0.00027037181334258007, 'lambda_val': 0.007566098648304109, 'batch_size': 3538, 'optimizer': 'RMSprop'}.
2026-05-24 09:07:07,592 - experiment_functions - INFO - Early stopping at epoch 1200. Best Metrics: (0.011720581441096391, 0.009751655629139072, 0.012369883667742769)
2026-05-24 09:07:07,680 - optuna.study.study - INFO - Trial 187 finished with values: [0.011720581441096391, 0.009751655629139072, 0.012369883667742769] and parameters: {'n_layers': 1, 'embedding_dim': 64, 'lr': 0.04125903018346233, 'lambda_val': 0.00021196993186172415, 'batch_size': 3974, 'optimizer': 'RMSprop'}.
2026-05-24 09:07:15,170 - experiment_functions - INFO - Early stopping at epoch 600. Best Metrics: (0.04894142164536221, 0.03110927152317881, 0.04420282104797129)
2026-05-24 09:07:15,306 - optuna.study.study - INFO - Trial 188 finished with values: [0.04894142164536221, 0.03110927152317881, 0.04420282104797129] and parameters: {'n_layers': 1, 'embedding_dim': 128, 'lr': 0.0019498675283919575, 'lambda_val': 0.000621169344675621, 'batch_size': 706, 'optimizer': 'RMSprop'}.
2026-05-24 09:07:23,723 - experiment_functions - INFO - Early stopping at epoch 650. Best Metrics: (0.05800479194334457, 0.0356705298013245, 0.05235752915825023)
2026-05-24 09:07:23,866 - optuna.study.study - INFO - Trial 189 finished with values: [0.05800479194334457, 0.0356705298013245, 0.05235752915825023] and parameters: {'n_layers': 1, 'embedding_dim': 128, 'lr': 0.002019850627421517, 'lambda_val': 0.000621169344675621, 'batch_size': 2915, 'optimizer': 'Adam'}.
2026-05-24 09:07:31,754 - experiment_functions - INFO - Early stopping at epoch 600. Best Metrics: (0.049726071339130824, 0.030993377483443708, 0.04517395508573106)
2026-05-24 09:07:31,857 - optuna.study.study - INFO - Trial 190 finished with values: [0.049726071339130824, 0.030993377483443708, 0.04517395508573106] and parameters: {'n_layers': 2, 'embedding_dim': 96, 'lr': 0.002019850627421517, 'lambda_val': 0.00028409774899038444, 'batch_size': 2675, 'optimizer': 'Adam'}.
2026-05-24 09:08:14,496 - optuna.study.study - INFO - Trial 191 finished with values: [0.03153394003858925, 0.021986754966887415, 0.030890384745436667] and parameters: {'n_layers': 1, 'embedding_dim': 128, 'lr': 0.000249352656785218, 'lambda_val': 0.0011457679520731478, 'batch_size': 1091, 'optimizer': 'RMSprop'}.
2026-05-24 09:08:21,668 - experiment_functions - INFO - Early stopping at epoch 600. Best Metrics: (0.005129453734303177, 0.004478476821192053, 0.005731451658173984)
2026-05-24 09:08:21,755 - optuna.study.study - INFO - Trial 192 finished with values: [0.005129453734303177, 0.004478476821192053, 0.005731451658173984] and parameters: {'n_layers': 1, 'embedding_dim': 128, 'lr': 0.0019498675283919575, 'lambda_val': 8.523357255734578e-06, 'batch_size': 3601, 'optimizer': 'SGD'}.
2026-05-24 09:09:08,718 - optuna.study.study - INFO - Trial 193 finished with values: [0.023157827841245027, 0.016663907284768215, 0.022127491904739897] and parameters: {'n_layers': 4, 'embedding_dim': 64, 'lr': 0.00010049142370938069, 'lambda_val': 8.455049892667247e-06, 'batch_size': 3922, 'optimizer': 'RMSprop'}.
2026-05-24 09:09:18,705 - experiment_functions - INFO - Early stopping at epoch 700. Best Metrics: (0.031337609795687185, 0.021870860927152323, 0.030414953002195662)
2026-05-24 09:09:19,282 - optuna.study.study - INFO - Trial 194 finished with values: [0.031337609795687185, 0.021870860927152323, 0.030414953002195662] and parameters: {'n_layers': 4, 'embedding_dim': 128, 'lr': 0.0003755353524054084, 'lambda_val': 0.0007561839367868583, 'batch_size': 2226, 'optimizer': 'RMSprop'}.
2026-05-24 09:10:11,540 - optuna.study.study - INFO - Trial 195 finished with values: [0.03533744014242595, 0.023650662251655633, 0.03302834236979115] and parameters: {'n_layers': 4, 'embedding_dim': 128, 'lr': 0.00010049142370938069, 'lambda_val': 8.455049892667247e-06, 'batch_size': 1011, 'optimizer': 'RMSprop'}.
2026-05-24 09:10:21,929 - experiment_functions - INFO - Early stopping at epoch 800. Best Metrics: (0.02199924973892311, 0.013791390728476821, 0.01961505577680271)
2026-05-24 09:10:23,089 - optuna.study.study - INFO - Trial 196 finished with values: [0.02199924973892311, 0.013791390728476821, 0.01961505577680271] and parameters: {'n_layers': 2, 'embedding_dim': 64, 'lr': 0.018817218651685848, 'lambda_val': 0.0005144021469830869, 'batch_size': 3934, 'optimizer': 'Adam'}.
2026-05-24 09:10:39,759 - experiment_functions - INFO - Early stopping at epoch 1300. Best Metrics: (0.06548475137828245, 0.038932119205298016, 0.05715287128645139)
2026-05-24 09:10:39,860 - optuna.study.study - INFO - Trial 197 finished with values: [0.06548475137828245, 0.038932119205298016, 0.05715287128645139] and parameters: {'n_layers': 1, 'embedding_dim': 128, 'lr': 0.0006251382018314868, 'lambda_val': 0.000621169344675621, 'batch_size': 1133, 'optimizer': 'RMSprop'}.
2026-05-24 09:10:47,374 - experiment_functions - INFO - Early stopping at epoch 550. Best Metrics: (0.04463025408735628, 0.029163907284768212, 0.040050545854923)
2026-05-24 09:10:47,462 - optuna.study.study - INFO - Trial 198 finished with values: [0.04463025408735628, 0.029163907284768212, 0.040050545854923] and parameters: {'n_layers': 1, 'embedding_dim': 128, 'lr': 0.002019850627421517, 'lambda_val': 0.0011457679520731478, 'batch_size': 3934, 'optimizer': 'RMSprop'}.
2026-05-24 09:11:00,588 - experiment_functions - INFO - Early stopping at epoch 1050. Best Metrics: (0.05711247762407603, 0.035049668874172185, 0.051418584864791776)
2026-05-24 09:11:01,160 - optuna.study.study - INFO - Trial 199 finished with values: [0.05711247762407603, 0.035049668874172185, 0.051418584864791776] and parameters: {'n_layers': 1, 'embedding_dim': 128, 'lr': 0.0005611343469820637, 'lambda_val': 0.000621169344675621, 'batch_size': 2675, 'optimizer': 'RMSprop'}.
2026-05-24 09:11:08,668 - experiment_functions - INFO - Early stopping at epoch 600. Best Metrics: (0.05125877631837206, 0.03269039735099338, 0.04499359093988551)
2026-05-24 09:11:08,752 - optuna.study.study - INFO - Trial 200 finished with values: [0.05125877631837206, 0.03269039735099338, 0.04499359093988551] and parameters: {'n_layers': 1, 'embedding_dim': 128, 'lr': 0.0015435244296002795, 'lambda_val': 0.00800073098738819, 'batch_size': 1731, 'optimizer': 'RMSprop'}.
2026-05-24 09:11:32,485 - experiment_functions - INFO - Early stopping at epoch 2050. Best Metrics: (0.0607456839919742, 0.03639900662251656, 0.05353740080904531)
2026-05-24 09:11:32,586 - optuna.study.study - INFO - Trial 201 finished with values: [0.0607456839919742, 0.03639900662251656, 0.05353740080904531] and parameters: {'n_layers': 1, 'embedding_dim': 128, 'lr': 0.0003755353524054084, 'lambda_val': 0.0004077151861442529, 'batch_size': 2226, 'optimizer': 'RMSprop'}.
2026-05-24 09:11:43,505 - experiment_functions - INFO - Early stopping at epoch 750. Best Metrics: (0.0435714919500644, 0.028733443708609273, 0.03972584491318155)
2026-05-24 09:11:43,827 - optuna.study.study - INFO - Trial 202 finished with values: [0.0435714919500644, 0.028733443708609273, 0.03972584491318155] and parameters: {'n_layers': 2, 'embedding_dim': 256, 'lr': 0.0003755353524054084, 'lambda_val': 0.00800073098738819, 'batch_size': 2553, 'optimizer': 'RMSprop'}.
2026-05-24 09:11:57,114 - experiment_functions - INFO - Early stopping at epoch 1100. Best Metrics: (0.04758634725853929, 0.031738410596026494, 0.04369450782097599)
2026-05-24 09:11:57,205 - optuna.study.study - INFO - Trial 203 finished with values: [0.04758634725853929, 0.031738410596026494, 0.04369450782097599] and parameters: {'n_layers': 1, 'embedding_dim': 128, 'lr': 0.0003755353524054084, 'lambda_val': 0.00800073098738819, 'batch_size': 3974, 'optimizer': 'RMSprop'}.
2026-05-24 09:12:39,324 - optuna.study.study - INFO - Trial 204 finished with values: [0.015413335951514675, 0.012392384105960266, 0.01592995416126598] and parameters: {'n_layers': 1, 'embedding_dim': 128, 'lr': 0.030795668525501727, 'lambda_val': 0.000621169344675621, 'batch_size': 1133, 'optimizer': 'RMSprop'}.
2026-05-24 09:12:58,133 - experiment_functions - INFO - Early stopping at epoch 1600. Best Metrics: (0.06396539964947269, 0.03792218543046358, 0.05508963512889742)
