2026-05-24 10:41:22,570 - optuna.study.study - INFO - Trial 233 finished with values: [0.04544892727353168, 0.03083609271523179, 0.04269045209767285] and parameters: {'n_layers': 2, 'embedding_dim': 32, 'lr': 0.00033909998390093353, 'lambda_val': 0.08238400869901934, 'batch_size': 2129, 'optimizer': 'RMSprop'}.
2026-05-24 10:41:31,841 - experiment_functions - INFO - Early stopping at epoch 700. Best Metrics: (0.059838984647183055, 0.03573675496688742, 0.05312653821910313)
2026-05-24 10:41:31,929 - optuna.study.study - INFO - Trial 234 finished with values: [0.059838984647183055, 0.03573675496688742, 0.05312653821910313] and parameters: {'n_layers': 1, 'embedding_dim': 128, 'lr': 0.001667262481946792, 'lambda_val': 2.5452815323641335e-06, 'batch_size': 2844, 'optimizer': 'Adam'}.
2026-05-24 10:41:39,784 - experiment_functions - INFO - Early stopping at epoch 600. Best Metrics: (0.05169022582386054, 0.032466887417218544, 0.04563829496652142)
2026-05-24 10:41:39,934 - optuna.study.study - INFO - Trial 235 finished with values: [0.05169022582386054, 0.032466887417218544, 0.04563829496652142] and parameters: {'n_layers': 1, 'embedding_dim': 64, 'lr': 0.005921142718785096, 'lambda_val': 0.0009904374338936715, 'batch_size': 1467, 'optimizer': 'Adam'}.
2026-05-24 10:41:46,973 - experiment_functions - INFO - Early stopping at epoch 500. Best Metrics: (0.005777983623338214, 0.004668874172185431, 0.005854646544004573)
2026-05-24 10:41:47,194 - optuna.study.study - INFO - Trial 236 finished with values: [0.005777983623338214, 0.004668874172185431, 0.005854646544004573] and parameters: {'n_layers': 3, 'embedding_dim': 128, 'lr': 0.001667262481946792, 'lambda_val': 0.00038449950728469576, 'batch_size': 716, 'optimizer': 'SGD'}.
2026-05-24 10:41:53,616 - experiment_functions - INFO - Early stopping at epoch 500. Best Metrics: (0.005200469688082946, 0.004130794701986755, 0.0053460008529182665)
2026-05-24 10:41:53,743 - optuna.study.study - INFO - Trial 237 finished with values: [0.005200469688082946, 0.004130794701986755, 0.0053460008529182665] and parameters: {'n_layers': 1, 'embedding_dim': 96, 'lr': 0.0002008346621954922, 'lambda_val': 0.00038449950728469576, 'batch_size': 2844, 'optimizer': 'SGD'}.
2026-05-24 10:42:02,436 - experiment_functions - INFO - Early stopping at epoch 700. Best Metrics: (0.04664669561941014, 0.03091887417218543, 0.04202856826811192)
2026-05-24 10:42:02,885 - optuna.study.study - INFO - Trial 238 finished with values: [0.04664669561941014, 0.03091887417218543, 0.04202856826811192] and parameters: {'n_layers': 1, 'embedding_dim': 96, 'lr': 0.001667262481946792, 'lambda_val': 0.04806784377912698, 'batch_size': 2844, 'optimizer': 'Adam'}.
2026-05-24 10:42:10,911 - experiment_functions - INFO - Early stopping at epoch 600. Best Metrics: (0.04618095988595606, 0.028973509933774833, 0.04206068417643816)
2026-05-24 10:42:11,000 - optuna.study.study - INFO - Trial 239 finished with values: [0.04618095988595606, 0.028973509933774833, 0.04206068417643816] and parameters: {'n_layers': 2, 'embedding_dim': 32, 'lr': 0.0011985229591796502, 'lambda_val': 0.0009904374338936715, 'batch_size': 1780, 'optimizer': 'RMSprop'}.
2026-05-24 10:42:17,817 - experiment_functions - INFO - Early stopping at epoch 500. Best Metrics: (0.0051015089491932425, 0.004023178807947021, 0.005039379616443363)
2026-05-24 10:42:17,906 - optuna.study.study - INFO - Trial 240 finished with values: [0.0051015089491932425, 0.004023178807947021, 0.005039379616443363] and parameters: {'n_layers': 1, 'embedding_dim': 256, 'lr': 0.0013978493934357974, 'lambda_val': 2.325208970097921e-05, 'batch_size': 2742, 'optimizer': 'SGD'}.
2026-05-24 10:42:32,493 - experiment_functions - INFO - Early stopping at epoch 750. Best Metrics: (0.059100605048931616, 0.035927152317880795, 0.05272350374443986)
2026-05-24 10:42:32,779 - optuna.study.study - INFO - Trial 241 finished with values: [0.059100605048931616, 0.035927152317880795, 0.05272350374443986] and parameters: {'n_layers': 1, 'embedding_dim': 128, 'lr': 0.001667262481946792, 'lambda_val': 5.797866699774695e-06, 'batch_size': 1780, 'optimizer': 'Adam'}.
2026-05-24 10:42:39,244 - experiment_functions - INFO - Early stopping at epoch 500. Best Metrics: (0.005481421491656134, 0.004188741721854305, 0.0055253199266018516)
2026-05-24 10:42:39,320 - optuna.study.study - INFO - Trial 242 finished with values: [0.005481421491656134, 0.004188741721854305, 0.0055253199266018516] and parameters: {'n_layers': 1, 'embedding_dim': 128, 'lr': 0.001667262481946792, 'lambda_val': 0.00038449950728469576, 'batch_size': 1780, 'optimizer': 'SGD'}.
2026-05-24 10:42:52,503 - experiment_functions - INFO - Early stopping at epoch 1050. Best Metrics: (0.0545044868135386, 0.03413079470198675, 0.048745731512848174)
2026-05-24 10:42:52,577 - optuna.study.study - INFO - Trial 243 finished with values: [0.0545044868135386, 0.03413079470198675, 0.048745731512848174] and parameters: {'n_layers': 1, 'embedding_dim': 32, 'lr': 0.0008645147173682575, 'lambda_val': 1.3598032344600187e-06, 'batch_size': 2901, 'optimizer': 'Adam'}.
2026-05-24 10:43:31,644 - experiment_functions - INFO - Early stopping at epoch 3200. Best Metrics: (0.047809841232559484, 0.030538079470198674, 0.044816606365634684)
2026-05-24 10:43:32,309 - optuna.study.study - INFO - Trial 244 finished with values: [0.047809841232559484, 0.030538079470198674, 0.044816606365634684] and parameters: {'n_layers': 3, 'embedding_dim': 64, 'lr': 0.0002008346621954922, 'lambda_val': 5.797866699774695e-06, 'batch_size': 2129, 'optimizer': 'RMSprop'}.
2026-05-24 10:43:41,183 - experiment_functions - INFO - Early stopping at epoch 700. Best Metrics: (0.05647013031873505, 0.035422185430463576, 0.051305287657193596)
2026-05-24 10:43:41,283 - optuna.study.study - INFO - Trial 245 finished with values: [0.05647013031873505, 0.035422185430463576, 0.051305287657193596] and parameters: {'n_layers': 1, 'embedding_dim': 64, 'lr': 0.001667262481946792, 'lambda_val': 0.003154130669772898, 'batch_size': 2257, 'optimizer': 'Adam'}.
2026-05-24 10:43:49,399 - experiment_functions - INFO - Early stopping at epoch 600. Best Metrics: (0.05093742331474752, 0.03137417218543046, 0.04565004315371193)
2026-05-24 10:43:49,561 - optuna.study.study - INFO - Trial 246 finished with values: [0.05093742331474752, 0.03137417218543046, 0.04565004315371193] and parameters: {'n_layers': 1, 'embedding_dim': 96, 'lr': 0.002746129425384238, 'lambda_val': 1.2584915483536783e-06, 'batch_size': 3531, 'optimizer': 'Adam'}.
2026-05-24 10:43:58,671 - experiment_functions - INFO - Early stopping at epoch 700. Best Metrics: (0.0642491703262635, 0.03712748344370861, 0.05647402458323386)
2026-05-24 10:43:58,974 - optuna.study.study - INFO - Trial 247 finished with values: [0.0642491703262635, 0.03712748344370861, 0.05647402458323386] and parameters: {'n_layers': 1, 'embedding_dim': 32, 'lr': 0.003043283191241845, 'lambda_val': 1.2584915483536783e-06, 'batch_size': 961, 'optimizer': 'Adam'}.
2026-05-24 10:44:05,735 - experiment_functions - INFO - Early stopping at epoch 500. Best Metrics: (0.0050593927034114266, 0.003824503311258278, 0.004906756924739007)
2026-05-24 10:44:05,873 - optuna.study.study - INFO - Trial 248 finished with values: [0.0050593927034114266, 0.003824503311258278, 0.004906756924739007] and parameters: {'n_layers': 3, 'embedding_dim': 64, 'lr': 0.0028931100527333827, 'lambda_val': 0.003154130669772898, 'batch_size': 2257, 'optimizer': 'SGD'}.
2026-05-24 10:44:13,153 - experiment_functions - INFO - Early stopping at epoch 550. Best Metrics: (0.04165982870390743, 0.028004966887417215, 0.039548265789093796)
2026-05-24 10:44:13,243 - optuna.study.study - INFO - Trial 249 finished with values: [0.04165982870390743, 0.028004966887417215, 0.039548265789093796] and parameters: {'n_layers': 2, 'embedding_dim': 32, 'lr': 0.00660067706198712, 'lambda_val': 0.00325865136231477, 'batch_size': 3117, 'optimizer': 'Adam'}.
2026-05-24 10:44:31,835 - experiment_functions - INFO - Early stopping at epoch 1700. Best Metrics: (0.049880164351183844, 0.032640728476821194, 0.04544437829902458)
2026-05-24 10:44:31,936 - optuna.study.study - INFO - Trial 250 finished with values: [0.049880164351183844, 0.032640728476821194, 0.04544437829902458] and parameters: {'n_layers': 2, 'embedding_dim': 32, 'lr': 0.00033909998390093353, 'lambda_val': 0.08238400869901934, 'batch_size': 2129, 'optimizer': 'RMSprop'}.
2026-05-24 10:45:24,958 - optuna.study.study - INFO - Trial 251 finished with values: [0.008465639377834832, 0.006622516556291391, 0.008663883641006901] and parameters: {'n_layers': 2, 'embedding_dim': 256, 'lr': 5.3080557861305985e-05, 'lambda_val': 0.0013971002162681053, 'batch_size': 2844, 'optimizer': 'Adam'}.
2026-05-24 10:45:34,780 - experiment_functions - INFO - Early stopping at epoch 750. Best Metrics: (0.05907804950013265, 0.03591059602649007, 0.05286906657511725)
2026-05-24 10:45:34,975 - optuna.study.study - INFO - Trial 252 finished with values: [0.05907804950013265, 0.03591059602649007, 0.05286906657511725] and parameters: {'n_layers': 1, 'embedding_dim': 128, 'lr': 0.001667262481946792, 'lambda_val': 2.5452815323641335e-06, 'batch_size': 1780, 'optimizer': 'Adam'}.
2026-05-24 10:45:41,424 - experiment_functions - INFO - Early stopping at epoch 500. Best Metrics: (0.00478989352379084, 0.004246688741721854, 0.005221394171752384)
2026-05-24 10:45:41,838 - optuna.study.study - INFO - Trial 253 finished with values: [0.00478989352379084, 0.004246688741721854, 0.005221394171752384] and parameters: {'n_layers': 1, 'embedding_dim': 32, 'lr': 0.0002593728771731237, 'lambda_val': 0.0212312522633215, 'batch_size': 3714, 'optimizer': 'Adam'}.
2026-05-24 10:45:49,933 - experiment_functions - INFO - Early stopping at epoch 600. Best Metrics: (0.05246260844182124, 0.0325, 0.04649152734614832)
2026-05-24 10:45:51,180 - optuna.study.study - INFO - Trial 254 finished with values: [0.05246260844182124, 0.0325, 0.04649152734614832] and parameters: {'n_layers': 1, 'embedding_dim': 128, 'lr': 0.0028931100527333827, 'lambda_val': 0.00038449950728469576, 'batch_size': 3037, 'optimizer': 'Adam'}.
2026-05-24 10:45:59,819 - experiment_functions - INFO - Early stopping at epoch 650. Best Metrics: (0.05960932070316053, 0.035389072847682126, 0.05178575240316921)
2026-05-24 10:45:59,915 - optuna.study.study - INFO - Trial 255 finished with values: [0.05960932070316053, 0.035389072847682126, 0.05178575240316921] and parameters: {'n_layers': 1, 'embedding_dim': 128, 'lr': 0.0027394930736470953, 'lambda_val': 5.797866699774695e-06, 'batch_size': 1467, 'optimizer': 'Adam'}.
2026-05-24 10:46:12,001 - experiment_functions - INFO - Early stopping at epoch 950. Best Metrics: (0.05875139480003015, 0.03431291390728477, 0.050936629204603456)
2026-05-24 10:46:12,100 - optuna.study.study - INFO - Trial 256 finished with values: [0.05875139480003015, 0.03431291390728477, 0.050936629204603456] and parameters: {'n_layers': 1, 'embedding_dim': 32, 'lr': 0.0008645147173682575, 'lambda_val': 0.00038449950728469576, 'batch_size': 3525, 'optimizer': 'Adam'}.
2026-05-24 10:46:20,147 - experiment_functions - INFO - Early stopping at epoch 600. Best Metrics: (0.06009789834111156, 0.03619205298013246, 0.05338344009842244)
2026-05-24 10:46:20,245 - optuna.study.study - INFO - Trial 257 finished with values: [0.06009789834111156, 0.03619205298013246, 0.05338344009842244] and parameters: {'n_layers': 1, 'embedding_dim': 64, 'lr': 0.004028743321822881, 'lambda_val': 2.5452815323641335e-06, 'batch_size': 2844, 'optimizer': 'Adam'}.
2026-05-24 10:46:39,783 - experiment_functions - INFO - Early stopping at epoch 1600. Best Metrics: (0.06448978788942851, 0.037408940397350994, 0.056035579147992856)
2026-05-24 10:46:40,366 - optuna.study.study - INFO - Trial 258 finished with values: [0.06448978788942851, 0.037408940397350994, 0.056035579147992856] and parameters: {'n_layers': 1, 'embedding_dim': 128, 'lr': 0.0005293717496578929, 'lambda_val': 2.565551081898317e-05, 'batch_size': 1780, 'optimizer': 'Adam'}.
2026-05-24 10:46:48,848 - experiment_functions - INFO - Early stopping at epoch 650. Best Metrics: (0.05703277891331389, 0.03500827814569536, 0.04933203100565676)
2026-05-24 10:46:48,930 - optuna.study.study - INFO - Trial 259 finished with values: [0.05703277891331389, 0.03500827814569536, 0.04933203100565676] and parameters: {'n_layers': 1, 'embedding_dim': 32, 'lr': 0.003043283191241845, 'lambda_val': 5.797866699774695e-06, 'batch_size': 2701, 'optimizer': 'Adam'}.
2026-05-24 10:46:55,467 - experiment_functions - INFO - Early stopping at epoch 500. Best Metrics: (0.005160185032959459, 0.0040562913907284765, 0.005188827801787971)
2026-05-24 10:46:55,559 - optuna.study.study - INFO - Trial 260 finished with values: [0.005160185032959459, 0.0040562913907284765, 0.005188827801787971] and parameters: {'n_layers': 1, 'embedding_dim': 96, 'lr': 0.002746129425384238, 'lambda_val': 2.5452815323641335e-06, 'batch_size': 2844, 'optimizer': 'SGD'}.
2026-05-24 10:47:06,257 - experiment_functions - INFO - Early stopping at epoch 600. Best Metrics: (0.05112830188846388, 0.031986754966887423, 0.04547730031892874)
2026-05-24 10:47:06,346 - optuna.study.study - INFO - Trial 261 finished with values: [0.05112830188846388, 0.031986754966887423, 0.04547730031892874] and parameters: {'n_layers': 1, 'embedding_dim': 32, 'lr': 0.001667262481946792, 'lambda_val': 5.797866699774695e-06, 'batch_size': 2986, 'optimizer': 'RMSprop'}.
2026-05-24 10:47:21,274 - experiment_functions - INFO - Early stopping at epoch 1150. Best Metrics: (0.03039460194783755, 0.017913907284768212, 0.02648410778202415)
2026-05-24 10:47:21,633 - optuna.study.study - INFO - Trial 262 finished with values: [0.03039460194783755, 0.017913907284768212, 0.02648410778202415] and parameters: {'n_layers': 2, 'embedding_dim': 128, 'lr': 0.009194213632540334, 'lambda_val': 2.0601952025948555e-06, 'batch_size': 2082, 'optimizer': 'RMSprop'}.
2026-05-24 10:47:30,767 - experiment_functions - INFO - Early stopping at epoch 700. Best Metrics: (0.060702703061733816, 0.03557119205298013, 0.052173661520130275)
2026-05-24 10:47:31,801 - optuna.study.study - INFO - Trial 263 finished with values: [0.060702703061733816, 0.03557119205298013, 0.052173661520130275] and parameters: {'n_layers': 1, 'embedding_dim': 96, 'lr': 0.001667262481946792, 'lambda_val': 2.5452815323641335e-06, 'batch_size': 2844, 'optimizer': 'Adam'}.
2026-05-24 10:47:41,638 - experiment_functions - INFO - Early stopping at epoch 750. Best Metrics: (0.05915985196809059, 0.035223509933774835, 0.05198843024971129)
2026-05-24 10:47:41,873 - optuna.study.study - INFO - Trial 264 finished with values: [0.05915985196809059, 0.035223509933774835, 0.05198843024971129] and parameters: {'n_layers': 1, 'embedding_dim': 128, 'lr': 0.001667262481946792, 'lambda_val': 3.18368169259221e-06, 'batch_size': 1431, 'optimizer': 'Adam'}.
2026-05-24 10:47:50,030 - experiment_functions - INFO - Early stopping at epoch 600. Best Metrics: (0.06397665232269632, 0.03749172185430463, 0.05623480751593385)
2026-05-24 10:47:50,110 - optuna.study.study - INFO - Trial 265 finished with values: [0.06397665232269632, 0.03749172185430463, 0.05623480751593385] and parameters: {'n_layers': 1, 'embedding_dim': 128, 'lr': 0.0028931100527333827, 'lambda_val': 0.003154130669772898, 'batch_size': 3451, 'optimizer': 'Adam'}.
2026-05-24 10:47:59,320 - experiment_functions - INFO - Early stopping at epoch 700. Best Metrics: (0.055985973214575324, 0.035074503311258276, 0.05046574443123523)
2026-05-24 10:47:59,615 - optuna.study.study - INFO - Trial 266 finished with values: [0.055985973214575324, 0.035074503311258276, 0.05046574443123523] and parameters: {'n_layers': 1, 'embedding_dim': 128, 'lr': 0.001667262481946792, 'lambda_val': 5.797866699774695e-06, 'batch_size': 2844, 'optimizer': 'Adam'}.
2026-05-24 10:48:43,728 - optuna.study.study - INFO - Trial 267 finished with values: [0.032034489525777844, 0.021953642384105958, 0.02981574467310408] and parameters: {'n_layers': 1, 'embedding_dim': 64, 'lr': 0.00031343320991475523, 'lambda_val': 1.2584915483536783e-06, 'batch_size': 961, 'optimizer': 'Adam'}.
2026-05-24 10:49:01,272 - experiment_functions - INFO - Early stopping at epoch 1350. Best Metrics: (0.06084057661328305, 0.03633278145695364, 0.05252696607549591)
2026-05-24 10:49:01,352 - optuna.study.study - INFO - Trial 268 finished with values: [0.06084057661328305, 0.03633278145695364, 0.05252696607549591] and parameters: {'n_layers': 1, 'embedding_dim': 256, 'lr': 0.0008645147173682575, 'lambda_val': 1.9563512568026275e-06, 'batch_size': 578, 'optimizer': 'Adam'}.
2026-05-24 10:49:45,914 - optuna.study.study - INFO - Trial 269 finished with values: [0.04005212482586223, 0.02640728476821192, 0.037895109585514924] and parameters: {'n_layers': 1, 'embedding_dim': 64, 'lr': 0.00033909998390093353, 'lambda_val': 1.9563512568026275e-06, 'batch_size': 961, 'optimizer': 'Adam'}.
2026-05-24 10:49:55,481 - experiment_functions - INFO - Early stopping at epoch 700. Best Metrics: (0.05698936149035947, 0.03418046357615894, 0.050529452862817875)
2026-05-24 10:49:55,910 - optuna.study.study - INFO - Trial 270 finished with values: [0.05698936149035947, 0.03418046357615894, 0.050529452862817875] and parameters: {'n_layers': 2, 'embedding_dim': 128, 'lr': 0.001061310207128634, 'lambda_val': 5.797866699774695e-06, 'batch_size': 1467, 'optimizer': 'Adam'}.
2026-05-24 10:50:39,537 - optuna.study.study - INFO - Trial 271 finished with values: [0.05100683350377507, 0.030819536423841064, 0.04570592806168462] and parameters: {'n_layers': 1, 'embedding_dim': 64, 'lr': 0.00033909998390093353, 'lambda_val': 5.797866699774695e-06, 'batch_size': 914, 'optimizer': 'RMSprop'}.
2026-05-24 10:50:45,814 - experiment_functions - INFO - Early stopping at epoch 500. Best Metrics: (0.004917720722504246, 0.0041390728476821195, 0.005026102029565462)
2026-05-24 10:50:45,983 - optuna.study.study - INFO - Trial 272 finished with values: [0.004917720722504246, 0.0041390728476821195, 0.005026102029565462] and parameters: {'n_layers': 1, 'embedding_dim': 64, 'lr': 0.00033909998390093353, 'lambda_val': 0.026016932290432247, 'batch_size': 2257, 'optimizer': 'Adam'}.
2026-05-24 10:51:29,623 - optuna.study.study - INFO - Trial 273 finished with values: [0.05796551982494125, 0.03437913907284768, 0.05135311994949133] and parameters: {'n_layers': 1, 'embedding_dim': 64, 'lr': 0.00033909998390093353, 'lambda_val': 5.797866699774695e-06, 'batch_size': 2129, 'optimizer': 'Adam'}.
2026-05-24 10:51:37,208 - experiment_functions - INFO - Early stopping at epoch 600. Best Metrics: (0.04815807595204219, 0.029809602649006624, 0.04270624022883782)
2026-05-24 10:51:37,302 - optuna.study.study - INFO - Trial 274 finished with values: [0.04815807595204219, 0.029809602649006624, 0.04270624022883782] and parameters: {'n_layers': 2, 'embedding_dim': 64, 'lr': 0.001667262481946792, 'lambda_val': 5.797866699774695e-06, 'batch_size': 2986, 'optimizer': 'Adam'}.
2026-05-24 10:51:43,854 - experiment_functions - INFO - Early stopping at epoch 550. Best Metrics: (0.022507724690414066, 0.01890728476821192, 0.023705149739265928)
2026-05-24 10:51:43,950 - optuna.study.study - INFO - Trial 275 finished with values: [0.022507724690414066, 0.01890728476821192, 0.023705149739265928] and parameters: {'n_layers': 1, 'embedding_dim': 32, 'lr': 0.0034283151809124646, 'lambda_val': 0.011566652555560959, 'batch_size': 2901, 'optimizer': 'RMSprop'}.
2026-05-24 10:51:54,569 - experiment_functions - INFO - Early stopping at epoch 850. Best Metrics: (0.05859382857538576, 0.03624172185430463, 0.05232361394664891)
2026-05-24 10:51:54,641 - optuna.study.study - INFO - Trial 276 finished with values: [0.05859382857538576, 0.03624172185430463, 0.05232361394664891] and parameters: {'n_layers': 1, 'embedding_dim': 128, 'lr': 0.0011611492771468898, 'lambda_val': 5.797866699774695e-06, 'batch_size': 1780, 'optimizer': 'Adam'}.
2026-05-24 10:52:01,895 - experiment_functions - INFO - Early stopping at epoch 600. Best Metrics: (0.06162620476201259, 0.03649006622516556, 0.05208902276028035)
2026-05-24 10:52:01,989 - optuna.study.study - INFO - Trial 277 finished with values: [0.06162620476201259, 0.03649006622516556, 0.05208902276028035] and parameters: {'n_layers': 1, 'embedding_dim': 64, 'lr': 0.004028743321822881, 'lambda_val': 1.9563512568026275e-06, 'batch_size': 2129, 'optimizer': 'Adam'}.
2026-05-24 10:52:16,966 - experiment_functions - INFO - Early stopping at epoch 1400. Best Metrics: (0.005416302561929856, 0.0040149006622516555, 0.005234777542730425)
2026-05-24 10:52:17,065 - optuna.study.study - INFO - Trial 278 finished with values: [0.005416302561929856, 0.0040149006622516555, 0.005234777542730425] and parameters: {'n_layers': 1, 'embedding_dim': 128, 'lr': 1.7569273866434614e-05, 'lambda_val': 1.2584915483536783e-06, 'batch_size': 961, 'optimizer': 'Adam'}.
2026-05-24 10:52:57,387 - optuna.study.study - INFO - Trial 279 finished with values: [0.005411548514860887, 0.0045033112582781466, 0.005659668710970631] and parameters: {'n_layers': 1, 'embedding_dim': 32, 'lr': 6.345828490274568e-05, 'lambda_val': 5.797866699774695e-06, 'batch_size': 2129, 'optimizer': 'RMSprop'}.
2026-05-24 10:53:08,742 - experiment_functions - INFO - Early stopping at epoch 850. Best Metrics: (0.055530788705926884, 0.033799668874172184, 0.04932165636304017)
2026-05-24 10:53:09,676 - optuna.study.study - INFO - Trial 280 finished with values: [0.055530788705926884, 0.033799668874172184, 0.04932165636304017] and parameters: {'n_layers': 1, 'embedding_dim': 256, 'lr': 0.0008645147173682575, 'lambda_val': 0.00038449950728469576, 'batch_size': 2740, 'optimizer': 'Adam'}.
2026-05-24 10:53:18,428 - experiment_functions - INFO - Early stopping at epoch 700. Best Metrics: (0.05570518554182287, 0.03500827814569537, 0.05185828297466367)
