2026-05-09 22:03:16,494 - optuna.study.study - INFO - Trial 10 finished with value: 0.0325647085827607 and parameters: {'n_layers': 2, 'embedding_dim': 128, 'lr': 0.0007206363550268436, 'lambda_val': 0.00014996457741615923, 'batch_size': 588, 'optimizer': 'RMSprop'}. Best is trial 3 with value: 0.04521008317074837.
2026-05-09 22:03:17,459 - optuna.study._optimize - INFO - Trial 11 pruned. 
2026-05-09 22:03:18,378 - optuna.study._optimize - INFO - Trial 12 pruned. 
2026-05-09 22:03:51,172 - optuna.study.study - INFO - Trial 13 finished with value: 0.036603088824696026 and parameters: {'n_layers': 2, 'embedding_dim': 128, 'lr': 0.01854430828659776, 'lambda_val': 5.172412493524587e-05, 'batch_size': 621, 'optimizer': 'RMSprop'}. Best is trial 3 with value: 0.04521008317074837.
2026-05-09 22:04:19,455 - optuna.study.study - INFO - Trial 14 finished with value: 0.0427097676150563 and parameters: {'n_layers': 1, 'embedding_dim': 128, 'lr': 0.01924945990018585, 'lambda_val': 1.202499481602373e-06, 'batch_size': 1673, 'optimizer': 'RMSprop'}. Best is trial 3 with value: 0.04521008317074837.
2026-05-09 22:04:21,157 - optuna.study._optimize - INFO - Trial 15 pruned. 
2026-05-09 22:04:48,737 - optuna.study.study - INFO - Trial 16 finished with value: 0.04034523132016139 and parameters: {'n_layers': 1, 'embedding_dim': 128, 'lr': 0.019156932804692613, 'lambda_val': 1.1242767712067384e-06, 'batch_size': 1864, 'optimizer': 'RMSprop'}. Best is trial 3 with value: 0.04521008317074837.
2026-05-09 22:04:49,732 - optuna.study._optimize - INFO - Trial 17 pruned. 
2026-05-09 22:04:51,456 - optuna.study._optimize - INFO - Trial 18 pruned. 
2026-05-09 22:04:52,375 - optuna.study._optimize - INFO - Trial 19 pruned. 
2026-05-09 22:04:54,271 - optuna.study._optimize - INFO - Trial 20 pruned. 
2026-05-09 22:05:22,025 - optuna.study.study - INFO - Trial 21 finished with value: 0.04816836925953509 and parameters: {'n_layers': 1, 'embedding_dim': 128, 'lr': 0.009605259285653561, 'lambda_val': 1.265060431915567e-06, 'batch_size': 1726, 'optimizer': 'RMSprop'}. Best is trial 21 with value: 0.04816836925953509.
2026-05-09 22:05:50,136 - optuna.study.study - INFO - Trial 22 finished with value: 0.04664253444857743 and parameters: {'n_layers': 1, 'embedding_dim': 128, 'lr': 0.01099917705511177, 'lambda_val': 2.7499997068327244e-06, 'batch_size': 1527, 'optimizer': 'RMSprop'}. Best is trial 21 with value: 0.04816836925953509.
2026-05-09 22:05:51,132 - optuna.study._optimize - INFO - Trial 23 pruned. 
2026-05-09 22:05:52,673 - optuna.study._optimize - INFO - Trial 24 pruned. 
2026-05-09 22:05:54,302 - optuna.study._optimize - INFO - Trial 25 pruned. 
2026-05-09 22:05:55,322 - optuna.study._optimize - INFO - Trial 26 pruned. 
2026-05-09 22:05:56,639 - optuna.study._optimize - INFO - Trial 27 pruned. 
2026-05-09 22:05:57,630 - optuna.study._optimize - INFO - Trial 28 pruned. 
2026-05-09 22:06:32,310 - optuna.study.study - INFO - Trial 29 finished with value: 0.06924064090490835 and parameters: {'n_layers': 1, 'embedding_dim': 256, 'lr': 0.00447102474945066, 'lambda_val': 0.0003421265032020461, 'batch_size': 2092, 'optimizer': 'Adam'}. Best is trial 29 with value: 0.06924064090490835.
2026-05-09 22:06:33,636 - optuna.study._optimize - INFO - Trial 30 pruned. 
2026-05-09 22:06:34,896 - optuna.study._optimize - INFO - Trial 31 pruned. 
2026-05-09 22:06:35,893 - optuna.study._optimize - INFO - Trial 32 pruned. 
2026-05-09 22:06:37,221 - optuna.study._optimize - INFO - Trial 33 pruned. 
2026-05-09 22:06:38,152 - optuna.study._optimize - INFO - Trial 34 pruned. 
2026-05-09 22:06:39,657 - optuna.study._optimize - INFO - Trial 35 pruned. 
2026-05-09 22:06:40,628 - optuna.study._optimize - INFO - Trial 36 pruned. 
2026-05-09 22:06:42,128 - optuna.study._optimize - INFO - Trial 37 pruned. 
2026-05-09 22:06:43,184 - optuna.study._optimize - INFO - Trial 38 pruned. 
2026-05-09 22:06:44,553 - optuna.study._optimize - INFO - Trial 39 pruned. 
2026-05-09 22:06:45,461 - optuna.study._optimize - INFO - Trial 40 pruned. 
2026-05-09 22:06:47,179 - optuna.study._optimize - INFO - Trial 41 pruned. 
2026-05-09 22:06:48,143 - optuna.study._optimize - INFO - Trial 42 pruned. 
2026-05-09 22:06:49,344 - optuna.study._optimize - INFO - Trial 43 pruned. 
2026-05-09 22:06:50,292 - optuna.study._optimize - INFO - Trial 44 pruned. 
2026-05-09 22:06:52,101 - optuna.study._optimize - INFO - Trial 45 pruned. 
2026-05-09 22:06:53,064 - optuna.study._optimize - INFO - Trial 46 pruned. 
2026-05-09 22:06:54,870 - optuna.study._optimize - INFO - Trial 47 pruned. 
2026-05-09 22:06:56,198 - optuna.study._optimize - INFO - Trial 48 pruned. 
2026-05-09 22:06:57,317 - optuna.study._optimize - INFO - Trial 49 pruned. 
2026-05-09 22:06:58,647 - optuna.study._optimize - INFO - Trial 50 pruned. 
2026-05-09 22:06:59,733 - optuna.study._optimize - INFO - Trial 51 pruned. 
2026-05-09 22:07:01,681 - optuna.study._optimize - INFO - Trial 52 pruned. 
2026-05-09 22:07:02,634 - optuna.study._optimize - INFO - Trial 53 pruned. 
2026-05-09 22:07:04,761 - optuna.study._optimize - INFO - Trial 54 pruned. 
2026-05-09 22:07:05,812 - optuna.study._optimize - INFO - Trial 55 pruned. 
2026-05-09 22:07:07,042 - optuna.study._optimize - INFO - Trial 56 pruned. 
2026-05-09 22:07:09,200 - optuna.study._optimize - INFO - Trial 57 pruned. 
2026-05-09 22:07:10,184 - optuna.study._optimize - INFO - Trial 58 pruned. 
2026-05-09 22:07:11,413 - optuna.study._optimize - INFO - Trial 59 pruned. 
2026-05-09 22:07:12,442 - optuna.study._optimize - INFO - Trial 60 pruned. 
2026-05-09 22:07:14,073 - optuna.study._optimize - INFO - Trial 61 pruned. 
2026-05-09 22:07:15,651 - optuna.study._optimize - INFO - Trial 62 pruned. 
2026-05-09 22:07:16,637 - optuna.study._optimize - INFO - Trial 63 pruned. 
2026-05-09 22:07:49,393 - optuna.study.study - INFO - Trial 64 finished with value: 0.060928904336262316 and parameters: {'n_layers': 1, 'embedding_dim': 256, 'lr': 0.013083007523641563, 'lambda_val': 0.00013746562311846048, 'batch_size': 1768, 'optimizer': 'RMSprop'}. Best is trial 29 with value: 0.06924064090490835.
2026-05-09 22:08:22,007 - optuna.study.study - INFO - Trial 65 finished with value: 0.06464592638982292 and parameters: {'n_layers': 1, 'embedding_dim': 256, 'lr': 0.011997425665469791, 'lambda_val': 0.00018077396569152678, 'batch_size': 1711, 'optimizer': 'RMSprop'}. Best is trial 29 with value: 0.06924064090490835.
2026-05-09 22:08:54,834 - optuna.study.study - INFO - Trial 66 finished with value: 0.06338183355215177 and parameters: {'n_layers': 1, 'embedding_dim': 256, 'lr': 0.012250362911756147, 'lambda_val': 0.00015277924834225962, 'batch_size': 1772, 'optimizer': 'RMSprop'}. Best is trial 29 with value: 0.06924064090490835.
2026-05-09 22:08:56,161 - optuna.study._optimize - INFO - Trial 67 pruned. 
2026-05-09 22:08:57,138 - optuna.study._optimize - INFO - Trial 68 pruned. 
2026-05-09 22:09:30,916 - optuna.study.study - INFO - Trial 69 finished with value: 0.07591698786339833 and parameters: {'n_layers': 1, 'embedding_dim': 256, 'lr': 0.009247951290333139, 'lambda_val': 0.00037676147241640925, 'batch_size': 1504, 'optimizer': 'RMSprop'}. Best is trial 69 with value: 0.07591698786339833.
2026-05-09 22:09:31,975 - optuna.study._optimize - INFO - Trial 70 pruned. 
2026-05-09 22:09:33,059 - optuna.study._optimize - INFO - Trial 71 pruned. 
2026-05-09 22:10:08,995 - optuna.study.study - INFO - Trial 72 finished with value: 0.07646396458028623 and parameters: {'n_layers': 1, 'embedding_dim': 256, 'lr': 0.011681381594623242, 'lambda_val': 0.0003821624193875874, 'batch_size': 1320, 'optimizer': 'RMSprop'}. Best is trial 72 with value: 0.07646396458028623.
2026-05-09 22:10:42,780 - optuna.study.study - INFO - Trial 73 finished with value: 0.08550040884980303 and parameters: {'n_layers': 1, 'embedding_dim': 256, 'lr': 0.009386381355192186, 'lambda_val': 0.0008383284734526852, 'batch_size': 1370, 'optimizer': 'RMSprop'}. Best is trial 73 with value: 0.08550040884980303.
2026-05-09 22:10:43,843 - optuna.study._optimize - INFO - Trial 74 pruned. 
2026-05-09 22:10:44,899 - optuna.study._optimize - INFO - Trial 75 pruned. 
2026-05-09 22:10:45,979 - optuna.study._optimize - INFO - Trial 76 pruned. 
2026-05-09 22:10:47,268 - optuna.study._optimize - INFO - Trial 77 pruned. 
2026-05-09 22:10:48,404 - optuna.study._optimize - INFO - Trial 78 pruned. 
2026-05-09 22:10:49,927 - optuna.study._optimize - INFO - Trial 79 pruned. 
2026-05-09 22:10:50,846 - optuna.study._optimize - INFO - Trial 80 pruned. 
2026-05-09 22:10:51,803 - optuna.study._optimize - INFO - Trial 81 pruned. 
2026-05-09 22:10:53,109 - optuna.study._optimize - INFO - Trial 82 pruned. 
2026-05-09 22:11:28,107 - optuna.study.study - INFO - Trial 83 finished with value: 0.07107498311001557 and parameters: {'n_layers': 1, 'embedding_dim': 256, 'lr': 0.012090076625375444, 'lambda_val': 0.00022702401000454205, 'batch_size': 1909, 'optimizer': 'RMSprop'}. Best is trial 73 with value: 0.08550040884980303.
2026-05-09 22:11:29,734 - optuna.study._optimize - INFO - Trial 84 pruned. 
2026-05-09 22:11:31,505 - optuna.study._optimize - INFO - Trial 85 pruned. 
2026-05-09 22:11:32,480 - optuna.study._optimize - INFO - Trial 86 pruned. 
2026-05-09 22:11:33,742 - optuna.study._optimize - INFO - Trial 87 pruned. 
2026-05-09 22:11:34,742 - optuna.study._optimize - INFO - Trial 88 pruned. 
2026-05-09 22:11:36,903 - optuna.study._optimize - INFO - Trial 89 pruned. 
2026-05-09 22:11:37,778 - optuna.study._optimize - INFO - Trial 90 pruned. 
2026-05-09 22:12:14,912 - optuna.study.study - INFO - Trial 91 finished with value: 0.07206897323470304 and parameters: {'n_layers': 1, 'embedding_dim': 256, 'lr': 0.011469760905618541, 'lambda_val': 0.00031817806408822704, 'batch_size': 1704, 'optimizer': 'RMSprop'}. Best is trial 73 with value: 0.08550040884980303.
2026-05-09 22:12:16,562 - optuna.study._optimize - INFO - Trial 92 pruned. 
2026-05-09 22:12:18,203 - optuna.study._optimize - INFO - Trial 93 pruned. 
2026-05-09 22:12:19,237 - optuna.study._optimize - INFO - Trial 94 pruned. 
2026-05-09 22:12:20,689 - optuna.study._optimize - INFO - Trial 95 pruned. 
2026-05-09 22:12:21,663 - optuna.study._optimize - INFO - Trial 96 pruned. 
2026-05-09 22:12:22,936 - optuna.study._optimize - INFO - Trial 97 pruned. 
2026-05-09 22:12:23,922 - optuna.study._optimize - INFO - Trial 98 pruned. 
2026-05-09 22:12:25,994 - optuna.study._optimize - INFO - Trial 99 pruned. 
2026-05-09 22:12:52,837 - root - INFO -   **** Training e_100K_1c3dcs_rand4
2026-05-09 22:12:52,849 - root - INFO -   **** Getting 56335/65410 random edges
2026-05-09 22:12:52,935 - optuna.storages._rdb.storage - INFO - A new study created in RDB with name: Study_e_100K_1c3dcs_rand4
2026-05-09 22:13:19,512 - optuna.study.study - INFO - Trial 0 finished with value: 0.0023609859087740537 and parameters: {'n_layers': 1, 'embedding_dim': 32, 'lr': 0.00021258814655240703, 'lambda_val': 8.671292448022827e-05, 'batch_size': 3575, 'optimizer': 'SGD'}. Best is trial 0 with value: 0.0023609859087740537.
2026-05-09 22:14:10,109 - optuna.study.study - INFO - Trial 1 finished with value: 0.0033816334910169183 and parameters: {'n_layers': 4, 'embedding_dim': 96, 'lr': 0.003899913261888169, 'lambda_val': 0.054156833198705435, 'batch_size': 2597, 'optimizer': 'RMSprop'}. Best is trial 1 with value: 0.0033816334910169183.
2026-05-09 22:14:43,759 - optuna.study.study - INFO - Trial 2 finished with value: 0.013080598443906698 and parameters: {'n_layers': 4, 'embedding_dim': 32, 'lr': 0.0005447828443116634, 'lambda_val': 8.277356905342672e-05, 'batch_size': 1379, 'optimizer': 'Adam'}. Best is trial 2 with value: 0.013080598443906698.
2026-05-09 22:15:41,020 - optuna.study.study - INFO - Trial 3 finished with value: 0.001886629957378108 and parameters: {'n_layers': 4, 'embedding_dim': 256, 'lr': 8.818845672387332e-05, 'lambda_val': 0.01798699093173936, 'batch_size': 3335, 'optimizer': 'SGD'}. Best is trial 2 with value: 0.013080598443906698.
2026-05-09 22:16:08,549 - optuna.study.study - INFO - Trial 4 finished with value: 0.003556395867911756 and parameters: {'n_layers': 2, 'embedding_dim': 32, 'lr': 1.9819812683850453e-05, 'lambda_val': 0.041468323140790506, 'batch_size': 2194, 'optimizer': 'RMSprop'}. Best is trial 2 with value: 0.013080598443906698.
2026-05-09 22:16:09,490 - optuna.study._optimize - INFO - Trial 5 pruned. 
2026-05-09 22:16:10,475 - optuna.study._optimize - INFO - Trial 6 pruned. 
2026-05-09 22:16:11,809 - optuna.study._optimize - INFO - Trial 7 pruned. 
2026-05-09 22:16:13,181 - optuna.study._optimize - INFO - Trial 8 pruned. 
2026-05-09 22:16:39,608 - optuna.study.study - INFO - Trial 9 finished with value: 0.027442787853203924 and parameters: {'n_layers': 1, 'embedding_dim': 96, 'lr': 0.03323230094705621, 'lambda_val': 2.3073492073922345e-06, 'batch_size': 1402, 'optimizer': 'RMSprop'}. Best is trial 9 with value: 0.027442787853203924.
2026-05-09 22:17:06,275 - optuna.study.study - INFO - Trial 10 finished with value: 0.05130120150199372 and parameters: {'n_layers': 1, 'embedding_dim': 96, 'lr': 0.0705609124127812, 'lambda_val': 0.0006440199725625934, 'batch_size': 581, 'optimizer': 'RMSprop'}. Best is trial 10 with value: 0.05130120150199372.
2026-05-09 22:17:33,548 - optuna.study.study - INFO - Trial 11 finished with value: 0.06390354129000528 and parameters: {'n_layers': 1, 'embedding_dim': 96, 'lr': 0.08310241890876693, 'lambda_val': 0.0011044513727970888, 'batch_size': 602, 'optimizer': 'RMSprop'}. Best is trial 11 with value: 0.06390354129000528.
2026-05-09 22:18:14,668 - optuna.study.study - INFO - Trial 12 finished with value: 0.043795874454426155 and parameters: {'n_layers': 2, 'embedding_dim': 96, 'lr': 0.09289014606865559, 'lambda_val': 0.0013697982871595225, 'batch_size': 850, 'optimizer': 'RMSprop'}. Best is trial 11 with value: 0.06390354129000528.
2026-05-09 22:18:48,524 - optuna.study.study - INFO - Trial 13 finished with value: 0.04213409630854571 and parameters: {'n_layers': 3, 'embedding_dim': 96, 'lr': 0.009893414362590164, 'lambda_val': 0.0007487508221374031, 'batch_size': 574, 'optimizer': 'RMSprop'}. Best is trial 11 with value: 0.06390354129000528.
2026-05-09 22:18:50,632 - optuna.study._optimize - INFO - Trial 14 pruned. 
2026-05-09 22:19:39,674 - optuna.study.study - INFO - Trial 15 finished with value: 0.04510009951816854 and parameters: {'n_layers': 3, 'embedding_dim': 256, 'lr': 0.01584080216185773, 'lambda_val': 0.00022437083928276787, 'batch_size': 2140, 'optimizer': 'RMSprop'}. Best is trial 11 with value: 0.06390354129000528.
2026-05-09 22:19:40,636 - optuna.study._optimize - INFO - Trial 16 pruned. 
2026-05-09 22:20:07,938 - optuna.study.study - INFO - Trial 17 finished with value: 0.06791036999548765 and parameters: {'n_layers': 1, 'embedding_dim': 96, 'lr': 0.036828016413693154, 'lambda_val': 0.0058493828696734715, 'batch_size': 986, 'optimizer': 'RMSprop'}. Best is trial 17 with value: 0.06791036999548765.
2026-05-09 22:20:08,903 - optuna.study._optimize - INFO - Trial 18 pruned. 
2026-05-09 22:20:09,757 - optuna.study._optimize - INFO - Trial 19 pruned. 
2026-05-09 22:20:10,986 - optuna.study._optimize - INFO - Trial 20 pruned. 
2026-05-09 22:20:11,829 - optuna.study._optimize - INFO - Trial 21 pruned. 
2026-05-09 22:20:14,811 - optuna.study._optimize - INFO - Trial 22 pruned. 
2026-05-09 22:20:15,752 - optuna.study._optimize - INFO - Trial 23 pruned. 
2026-05-09 22:20:46,944 - optuna.study.study - INFO - Trial 24 finished with value: 0.04614070535130248 and parameters: {'n_layers': 2, 'embedding_dim': 96, 'lr': 0.03841405477427237, 'lambda_val': 0.0019444479500245312, 'batch_size': 1203, 'optimizer': 'RMSprop'}. Best is trial 17 with value: 0.06791036999548765.
2026-05-09 22:20:48,013 - optuna.study._optimize - INFO - Trial 25 pruned. 
2026-05-09 22:20:49,410 - optuna.study._optimize - INFO - Trial 26 pruned. 
2026-05-09 22:21:11,890 - optuna.study._optimize - INFO - Trial 27 pruned. 
2026-05-09 22:21:12,944 - optuna.study._optimize - INFO - Trial 28 pruned. 
2026-05-09 22:21:14,209 - optuna.study._optimize - INFO - Trial 29 pruned. 
2026-05-09 22:21:15,456 - optuna.study._optimize - INFO - Trial 30 pruned. 
2026-05-09 22:21:46,371 - optuna.study.study - INFO - Trial 31 finished with value: 0.03860014645778355 and parameters: {'n_layers': 2, 'embedding_dim': 96, 'lr': 0.05350657876041615, 'lambda_val': 0.001965701382384213, 'batch_size': 1184, 'optimizer': 'RMSprop'}. Best is trial 17 with value: 0.06791036999548765.
2026-05-09 22:22:12,424 - optuna.study.study - INFO - Trial 32 finished with value: 0.056902351797331996 and parameters: {'n_layers': 1, 'embedding_dim': 96, 'lr': 0.024238051065574084, 'lambda_val': 0.00020581442884697398, 'batch_size': 959, 'optimizer': 'RMSprop'}. Best is trial 17 with value: 0.06791036999548765.
2026-05-09 22:22:13,319 - optuna.study._optimize - INFO - Trial 33 pruned. 
2026-05-09 22:22:14,283 - optuna.study._optimize - INFO - Trial 34 pruned. 
2026-05-09 22:22:15,618 - optuna.study._optimize - INFO - Trial 35 pruned. 
2026-05-09 22:22:16,552 - optuna.study._optimize - INFO - Trial 36 pruned. 
2026-05-09 22:22:18,414 - optuna.study._optimize - INFO - Trial 37 pruned. 
2026-05-09 22:22:19,525 - optuna.study._optimize - INFO - Trial 38 pruned. 
2026-05-09 22:22:20,625 - optuna.study._optimize - INFO - Trial 39 pruned. 
2026-05-09 22:22:21,954 - optuna.study._optimize - INFO - Trial 40 pruned. 
2026-05-09 22:22:35,538 - optuna.study._optimize - INFO - Trial 41 pruned. 
2026-05-09 22:23:06,414 - optuna.study.study - INFO - Trial 42 finished with value: 0.04300512782105458 and parameters: {'n_layers': 2, 'embedding_dim': 96, 'lr': 0.04293922687126302, 'lambda_val': 0.0024487703162209286, 'batch_size': 750, 'optimizer': 'RMSprop'}. Best is trial 17 with value: 0.06791036999548765.
2026-05-09 22:23:07,430 - optuna.study._optimize - INFO - Trial 43 pruned. 
2026-05-09 22:23:11,425 - optuna.study._optimize - INFO - Trial 44 pruned. 
2026-05-09 22:23:12,354 - optuna.study._optimize - INFO - Trial 45 pruned. 
2026-05-09 22:23:18,294 - optuna.study._optimize - INFO - Trial 46 pruned. 
2026-05-09 22:23:19,633 - optuna.study._optimize - INFO - Trial 47 pruned. 
2026-05-09 22:23:20,563 - optuna.study._optimize - INFO - Trial 48 pruned. 
2026-05-09 22:23:33,258 - optuna.study._optimize - INFO - Trial 49 pruned. 
2026-05-09 22:23:34,246 - optuna.study._optimize - INFO - Trial 50 pruned. 
2026-05-09 22:24:26,050 - optuna.study.study - INFO - Trial 51 finished with value: 0.03835456597673046 and parameters: {'n_layers': 3, 'embedding_dim': 256, 'lr': 0.014278719169434904, 'lambda_val': 0.0005909663170597603, 'batch_size': 3136, 'optimizer': 'RMSprop'}. Best is trial 17 with value: 0.06791036999548765.
2026-05-09 22:24:54,027 - optuna.study._optimize - INFO - Trial 52 pruned. 
2026-05-09 22:25:01,433 - optuna.study._optimize - INFO - Trial 53 pruned. 
2026-05-09 22:25:51,615 - optuna.study.study - INFO - Trial 54 finished with value: 0.04325800657062903 and parameters: {'n_layers': 3, 'embedding_dim': 256, 'lr': 0.009175311971186269, 'lambda_val': 0.00015737263791202908, 'batch_size': 2123, 'optimizer': 'RMSprop'}. Best is trial 17 with value: 0.06791036999548765.
2026-05-09 22:25:56,370 - optuna.study._optimize - INFO - Trial 55 pruned. 
2026-05-09 22:25:57,874 - optuna.study._optimize - INFO - Trial 56 pruned. 
2026-05-09 22:25:58,920 - optuna.study._optimize - INFO - Trial 57 pruned. 
2026-05-09 22:26:39,148 - optuna.study.study - INFO - Trial 58 finished with value: 0.04982063851955345 and parameters: {'n_layers': 2, 'embedding_dim': 256, 'lr': 0.02052939560104387, 'lambda_val': 0.0002692197034552448, 'batch_size': 531, 'optimizer': 'RMSprop'}. Best is trial 17 with value: 0.06791036999548765.
2026-05-09 22:26:55,484 - optuna.study._optimize - INFO - Trial 59 pruned. 
2026-05-09 22:26:56,501 - optuna.study._optimize - INFO - Trial 60 pruned. 
2026-05-09 22:27:44,529 - optuna.study.study - INFO - Trial 61 finished with value: 0.05011759477068925 and parameters: {'n_layers': 2, 'embedding_dim': 256, 'lr': 0.03393325068503792, 'lambda_val': 0.0002311764664498681, 'batch_size': 639, 'optimizer': 'RMSprop'}. Best is trial 17 with value: 0.06791036999548765.
2026-05-09 22:28:25,227 - optuna.study.study - INFO - Trial 62 finished with value: 0.04777338403665137 and parameters: {'n_layers': 2, 'embedding_dim': 256, 'lr': 0.04135429115332803, 'lambda_val': 0.0005537586447366714, 'batch_size': 654, 'optimizer': 'RMSprop'}. Best is trial 17 with value: 0.06791036999548765.
2026-05-09 22:29:05,666 - optuna.study.study - INFO - Trial 63 finished with value: 0.0462398914711716 and parameters: {'n_layers': 2, 'embedding_dim': 256, 'lr': 0.026159002612679283, 'lambda_val': 0.00021775342718076873, 'batch_size': 513, 'optimizer': 'RMSprop'}. Best is trial 17 with value: 0.06791036999548765.
2026-05-09 22:29:28,347 - optuna.study._optimize - INFO - Trial 64 pruned. 
2026-05-09 22:29:29,321 - optuna.study._optimize - INFO - Trial 65 pruned. 
2026-05-09 22:30:09,927 - optuna.study.study - INFO - Trial 66 finished with value: 0.04007656029886762 and parameters: {'n_layers': 2, 'embedding_dim': 256, 'lr': 0.07408046617730514, 'lambda_val': 0.0002685799484021503, 'batch_size': 611, 'optimizer': 'RMSprop'}. Best is trial 17 with value: 0.06791036999548765.
2026-05-09 22:30:11,290 - optuna.study._optimize - INFO - Trial 67 pruned. 
2026-05-09 22:30:12,511 - optuna.study._optimize - INFO - Trial 68 pruned. 
2026-05-09 22:30:13,691 - optuna.study._optimize - INFO - Trial 69 pruned. 
2026-05-09 22:30:53,906 - optuna.study.study - INFO - Trial 70 finished with value: 0.008747680414108453 and parameters: {'n_layers': 2, 'embedding_dim': 256, 'lr': 0.05470170703953, 'lambda_val': 4.523159545940822e-05, 'batch_size': 514, 'optimizer': 'RMSprop'}. Best is trial 17 with value: 0.06791036999548765.
