2026-05-09 18:53:05,498 - optuna.study.study - INFO - Trial 38 finished with value: 0.0367816891383989 and parameters: {'n_layers': 2, 'embedding_dim': 128, 'lr': 0.018820104674333333, 'lambda_val': 0.0033344065167153865, 'batch_size': 3814, 'optimizer': 'RMSprop'}. Best is trial 25 with value: 0.05576032853056878.
2026-05-09 18:53:06,473 - optuna.study._optimize - INFO - Trial 39 pruned. 
2026-05-09 18:53:07,459 - optuna.study._optimize - INFO - Trial 40 pruned. 
2026-05-09 18:53:08,787 - optuna.study._optimize - INFO - Trial 41 pruned. 
2026-05-09 18:53:10,981 - optuna.study._optimize - INFO - Trial 42 pruned. 
2026-05-09 18:53:40,808 - optuna.study.study - INFO - Trial 43 finished with value: 0.034407016491134874 and parameters: {'n_layers': 2, 'embedding_dim': 32, 'lr': 0.036146209919141, 'lambda_val': 0.0009449233851012269, 'batch_size': 3393, 'optimizer': 'RMSprop'}. Best is trial 25 with value: 0.05576032853056878.
2026-05-09 18:53:42,618 - optuna.study._optimize - INFO - Trial 44 pruned. 
2026-05-09 18:53:44,066 - optuna.study._optimize - INFO - Trial 45 pruned. 
2026-05-09 18:53:45,081 - optuna.study._optimize - INFO - Trial 46 pruned. 
2026-05-09 18:53:47,334 - optuna.study._optimize - INFO - Trial 47 pruned. 
2026-05-09 18:53:49,326 - optuna.study._optimize - INFO - Trial 48 pruned. 
2026-05-09 18:53:50,284 - optuna.study._optimize - INFO - Trial 49 pruned. 
2026-05-09 18:53:51,271 - optuna.study._optimize - INFO - Trial 50 pruned. 
2026-05-09 18:54:26,300 - optuna.study.study - INFO - Trial 51 finished with value: 0.03562535876296638 and parameters: {'n_layers': 2, 'embedding_dim': 128, 'lr': 0.013267719022569853, 'lambda_val': 0.0031961235547593248, 'batch_size': 3882, 'optimizer': 'RMSprop'}. Best is trial 25 with value: 0.05576032853056878.
2026-05-09 18:54:27,977 - optuna.study._optimize - INFO - Trial 52 pruned. 
2026-05-09 18:54:29,943 - optuna.study._optimize - INFO - Trial 53 pruned. 
2026-05-09 18:54:30,930 - optuna.study._optimize - INFO - Trial 54 pruned. 
2026-05-09 18:54:32,304 - optuna.study._optimize - INFO - Trial 55 pruned. 
2026-05-09 18:55:07,220 - optuna.study.study - INFO - Trial 56 finished with value: 0.04000961581129596 and parameters: {'n_layers': 2, 'embedding_dim': 128, 'lr': 0.03327622679954789, 'lambda_val': 0.00010825450836322663, 'batch_size': 3651, 'optimizer': 'RMSprop'}. Best is trial 25 with value: 0.05576032853056878.
2026-05-09 18:55:08,229 - optuna.study._optimize - INFO - Trial 57 pruned. 
2026-05-09 18:55:09,234 - optuna.study._optimize - INFO - Trial 58 pruned. 
2026-05-09 18:55:10,569 - optuna.study._optimize - INFO - Trial 59 pruned. 
2026-05-09 18:55:11,584 - optuna.study._optimize - INFO - Trial 60 pruned. 
2026-05-09 18:55:46,768 - optuna.study.study - INFO - Trial 61 finished with value: 0.04143752943036179 and parameters: {'n_layers': 2, 'embedding_dim': 128, 'lr': 0.016363875557483573, 'lambda_val': 0.00011652531743965529, 'batch_size': 3790, 'optimizer': 'RMSprop'}. Best is trial 25 with value: 0.05576032853056878.
2026-05-09 18:55:47,741 - optuna.study._optimize - INFO - Trial 62 pruned. 
2026-05-09 18:55:48,696 - optuna.study._optimize - INFO - Trial 63 pruned. 
2026-05-09 18:55:50,479 - optuna.study._optimize - INFO - Trial 64 pruned. 
2026-05-09 18:55:51,432 - optuna.study._optimize - INFO - Trial 65 pruned. 
2026-05-09 18:55:52,761 - optuna.study._optimize - INFO - Trial 66 pruned. 
2026-05-09 18:55:53,853 - optuna.study._optimize - INFO - Trial 67 pruned. 
2026-05-09 18:55:55,521 - optuna.study._optimize - INFO - Trial 68 pruned. 
2026-05-09 18:55:56,514 - optuna.study._optimize - INFO - Trial 69 pruned. 
2026-05-09 18:56:32,712 - optuna.study.study - INFO - Trial 70 finished with value: 0.03891809763336689 and parameters: {'n_layers': 3, 'embedding_dim': 96, 'lr': 0.049261514399870546, 'lambda_val': 0.0007752871673913508, 'batch_size': 1786, 'optimizer': 'RMSprop'}. Best is trial 25 with value: 0.05576032853056878.
2026-05-09 18:56:35,774 - optuna.study._optimize - INFO - Trial 71 pruned. 
2026-05-09 18:56:48,775 - optuna.study._optimize - INFO - Trial 72 pruned. 
2026-05-09 18:56:51,751 - optuna.study._optimize - INFO - Trial 73 pruned. 
2026-05-09 18:56:54,913 - optuna.study._optimize - INFO - Trial 74 pruned. 
2026-05-09 18:56:59,208 - optuna.study._optimize - INFO - Trial 75 pruned. 
2026-05-09 18:57:04,905 - optuna.study._optimize - INFO - Trial 76 pruned. 
2026-05-09 18:57:11,639 - optuna.study._optimize - INFO - Trial 77 pruned. 
2026-05-09 18:57:12,637 - optuna.study._optimize - INFO - Trial 78 pruned. 
2026-05-09 18:57:13,945 - optuna.study._optimize - INFO - Trial 79 pruned. 
2026-05-09 18:57:47,635 - optuna.study.study - INFO - Trial 80 finished with value: 0.037856282598332354 and parameters: {'n_layers': 2, 'embedding_dim': 96, 'lr': 0.026856710799404458, 'lambda_val': 0.001006585525851425, 'batch_size': 3733, 'optimizer': 'RMSprop'}. Best is trial 25 with value: 0.05576032853056878.
2026-05-09 18:58:20,571 - optuna.study.study - INFO - Trial 81 finished with value: 0.04736141348357565 and parameters: {'n_layers': 2, 'embedding_dim': 96, 'lr': 0.043676404668480696, 'lambda_val': 0.0009348734084339602, 'batch_size': 3748, 'optimizer': 'RMSprop'}. Best is trial 25 with value: 0.05576032853056878.
2026-05-09 18:58:53,606 - optuna.study.study - INFO - Trial 82 finished with value: 0.04524037401110246 and parameters: {'n_layers': 2, 'embedding_dim': 96, 'lr': 0.040476784128700795, 'lambda_val': 0.0002999124637030917, 'batch_size': 3544, 'optimizer': 'RMSprop'}. Best is trial 25 with value: 0.05576032853056878.
2026-05-09 18:58:55,056 - optuna.study._optimize - INFO - Trial 83 pruned. 
2026-05-09 18:58:56,897 - optuna.study._optimize - INFO - Trial 84 pruned. 
2026-05-09 18:58:58,540 - optuna.study._optimize - INFO - Trial 85 pruned. 
2026-05-09 18:58:59,571 - optuna.study._optimize - INFO - Trial 86 pruned. 
2026-05-09 18:59:01,055 - optuna.study._optimize - INFO - Trial 87 pruned. 
2026-05-09 18:59:02,021 - optuna.study._optimize - INFO - Trial 88 pruned. 
2026-05-09 18:59:03,030 - optuna.study._optimize - INFO - Trial 89 pruned. 
2026-05-09 18:59:04,360 - optuna.study._optimize - INFO - Trial 90 pruned. 
2026-05-09 18:59:37,419 - optuna.study.study - INFO - Trial 91 finished with value: 0.04047499356885865 and parameters: {'n_layers': 2, 'embedding_dim': 96, 'lr': 0.05013019701222438, 'lambda_val': 0.0008305209560436523, 'batch_size': 3825, 'optimizer': 'RMSprop'}. Best is trial 25 with value: 0.05576032853056878.
2026-05-09 18:59:39,010 - optuna.study._optimize - INFO - Trial 92 pruned. 
2026-05-09 18:59:40,737 - optuna.study._optimize - INFO - Trial 93 pruned. 
2026-05-09 19:00:14,515 - optuna.study.study - INFO - Trial 94 finished with value: 0.04316282199674317 and parameters: {'n_layers': 2, 'embedding_dim': 96, 'lr': 0.02192098273259649, 'lambda_val': 0.0008640362906420508, 'batch_size': 3510, 'optimizer': 'RMSprop'}. Best is trial 25 with value: 0.05576032853056878.
2026-05-09 19:00:15,755 - optuna.study._optimize - INFO - Trial 95 pruned. 
2026-05-09 19:00:55,055 - optuna.study.study - INFO - Trial 96 finished with value: 0.04418993025990617 and parameters: {'n_layers': 2, 'embedding_dim': 128, 'lr': 0.04003719244592147, 'lambda_val': 0.0009766919847439143, 'batch_size': 3667, 'optimizer': 'RMSprop'}. Best is trial 25 with value: 0.05576032853056878.
2026-05-09 19:00:56,333 - optuna.study._optimize - INFO - Trial 97 pruned. 
2026-05-09 19:00:58,541 - optuna.study._optimize - INFO - Trial 98 pruned. 
2026-05-09 19:00:59,955 - optuna.study._optimize - INFO - Trial 99 pruned. 
2026-05-09 19:01:21,903 - root - INFO -   **** Training e_100K_1c1dcs_rand4
2026-05-09 19:01:21,914 - root - INFO -   **** Getting 53072/65410 random edges
2026-05-09 19:01:23,329 - optuna.storages._rdb.storage - INFO - A new study created in RDB with name: Study_e_100K_1c1dcs_rand4
2026-05-09 19:01:58,775 - optuna.study.study - INFO - Trial 0 finished with value: 0.001322331054524459 and parameters: {'n_layers': 3, 'embedding_dim': 96, 'lr': 7.707826646671856e-05, 'lambda_val': 2.3297908501718975e-05, 'batch_size': 2491, 'optimizer': 'SGD'}. Best is trial 0 with value: 0.001322331054524459.
2026-05-09 19:02:47,809 - optuna.study.study - INFO - Trial 1 finished with value: 0.013524612624342049 and parameters: {'n_layers': 3, 'embedding_dim': 96, 'lr': 1.6878475033882415e-05, 'lambda_val': 1.924812398619587e-05, 'batch_size': 3304, 'optimizer': 'RMSprop'}. Best is trial 1 with value: 0.013524612624342049.
2026-05-09 19:03:29,643 - optuna.study.study - INFO - Trial 2 finished with value: 0.004083847795787353 and parameters: {'n_layers': 4, 'embedding_dim': 96, 'lr': 0.029402192285009468, 'lambda_val': 0.09986772486566546, 'batch_size': 3501, 'optimizer': 'RMSprop'}. Best is trial 1 with value: 0.013524612624342049.
2026-05-09 19:04:20,112 - optuna.study.study - INFO - Trial 3 finished with value: 0.037882041799651156 and parameters: {'n_layers': 3, 'embedding_dim': 256, 'lr': 0.004015124838693849, 'lambda_val': 1.2825865724941882e-06, 'batch_size': 3385, 'optimizer': 'RMSprop'}. Best is trial 3 with value: 0.037882041799651156.
2026-05-09 19:05:01,615 - optuna.study.study - INFO - Trial 4 finished with value: 0.020857068613762707 and parameters: {'n_layers': 3, 'embedding_dim': 32, 'lr': 2.0551650349243195e-05, 'lambda_val': 1.241005077288843e-06, 'batch_size': 1527, 'optimizer': 'RMSprop'}. Best is trial 3 with value: 0.037882041799651156.
2026-05-09 19:05:02,589 - optuna.study._optimize - INFO - Trial 5 pruned. 
2026-05-09 19:05:58,754 - optuna.study.study - INFO - Trial 6 finished with value: 0.010078090086049447 and parameters: {'n_layers': 4, 'embedding_dim': 256, 'lr': 0.029400853514050404, 'lambda_val': 0.018571662266712842, 'batch_size': 1322, 'optimizer': 'RMSprop'}. Best is trial 3 with value: 0.037882041799651156.
2026-05-09 19:05:59,871 - optuna.study._optimize - INFO - Trial 7 pruned. 
2026-05-09 19:06:01,185 - optuna.study._optimize - INFO - Trial 8 pruned. 
2026-05-09 19:06:02,221 - optuna.study._optimize - INFO - Trial 9 pruned. 
2026-05-09 19:06:31,740 - optuna.study.study - INFO - Trial 10 finished with value: 0.03929285556039324 and parameters: {'n_layers': 1, 'embedding_dim': 64, 'lr': 0.0037291909435151417, 'lambda_val': 1.2939424166175261e-06, 'batch_size': 4054, 'optimizer': 'RMSprop'}. Best is trial 10 with value: 0.03929285556039324.
2026-05-09 19:06:32,835 - optuna.study._optimize - INFO - Trial 11 pruned. 
2026-05-09 19:06:33,911 - optuna.study._optimize - INFO - Trial 12 pruned. 
2026-05-09 19:06:35,241 - optuna.study._optimize - INFO - Trial 13 pruned. 
2026-05-09 19:06:36,670 - optuna.study._optimize - INFO - Trial 14 pruned. 
2026-05-09 19:06:37,900 - optuna.study._optimize - INFO - Trial 15 pruned. 
2026-05-09 19:07:09,379 - optuna.study.study - INFO - Trial 16 finished with value: 0.05473050830218 and parameters: {'n_layers': 2, 'embedding_dim': 64, 'lr': 0.08885940975573954, 'lambda_val': 0.0009727960072275555, 'batch_size': 2943, 'optimizer': 'RMSprop'}. Best is trial 16 with value: 0.05473050830218.
2026-05-09 19:07:10,827 - optuna.study._optimize - INFO - Trial 17 pruned. 
2026-05-09 19:07:11,892 - optuna.study._optimize - INFO - Trial 18 pruned. 
2026-05-09 19:07:13,139 - optuna.study._optimize - INFO - Trial 19 pruned. 
2026-05-09 19:07:14,366 - optuna.study._optimize - INFO - Trial 20 pruned. 
2026-05-09 19:08:05,461 - optuna.study.study - INFO - Trial 21 finished with value: 0.03893519579123046 and parameters: {'n_layers': 3, 'embedding_dim': 256, 'lr': 0.006286369828533041, 'lambda_val': 3.8814736746570435e-06, 'batch_size': 3700, 'optimizer': 'RMSprop'}. Best is trial 16 with value: 0.05473050830218.
2026-05-09 19:08:49,106 - optuna.study.study - INFO - Trial 22 finished with value: 0.033109136147209624 and parameters: {'n_layers': 2, 'embedding_dim': 256, 'lr': 0.011564873057344762, 'lambda_val': 4.506939224514975e-06, 'batch_size': 3742, 'optimizer': 'RMSprop'}. Best is trial 16 with value: 0.05473050830218.
2026-05-09 19:08:50,146 - optuna.study._optimize - INFO - Trial 23 pruned. 
2026-05-09 19:08:51,553 - optuna.study._optimize - INFO - Trial 24 pruned. 
2026-05-09 19:09:30,390 - optuna.study.study - INFO - Trial 25 finished with value: 0.03976601673375998 and parameters: {'n_layers': 2, 'embedding_dim': 128, 'lr': 0.032198274309242984, 'lambda_val': 7.018243810417341e-05, 'batch_size': 3152, 'optimizer': 'RMSprop'}. Best is trial 16 with value: 0.05473050830218.
2026-05-09 19:09:39,107 - optuna.study._optimize - INFO - Trial 26 pruned. 
2026-05-09 19:09:42,699 - optuna.study._optimize - INFO - Trial 27 pruned. 
2026-05-09 19:09:43,698 - optuna.study._optimize - INFO - Trial 28 pruned. 
2026-05-09 19:09:45,016 - optuna.study._optimize - INFO - Trial 29 pruned. 
2026-05-09 19:09:46,079 - optuna.study._optimize - INFO - Trial 30 pruned. 
2026-05-09 19:09:47,099 - optuna.study._optimize - INFO - Trial 31 pruned. 
2026-05-09 19:09:48,495 - optuna.study._optimize - INFO - Trial 32 pruned. 
2026-05-09 19:09:51,866 - optuna.study._optimize - INFO - Trial 33 pruned. 
2026-05-09 19:10:34,598 - optuna.study.study - INFO - Trial 34 finished with value: 0.03919393304351859 and parameters: {'n_layers': 2, 'embedding_dim': 256, 'lr': 0.019913616091236142, 'lambda_val': 3.081745810538361e-05, 'batch_size': 3846, 'optimizer': 'RMSprop'}. Best is trial 16 with value: 0.05473050830218.
2026-05-09 19:11:19,807 - optuna.study.study - INFO - Trial 35 finished with value: 0.0317845413639087 and parameters: {'n_layers': 2, 'embedding_dim': 96, 'lr': 0.020080571041707313, 'lambda_val': 2.8082753134205377e-05, 'batch_size': 3883, 'optimizer': 'RMSprop'}. Best is trial 16 with value: 0.05473050830218.
2026-05-09 19:11:20,731 - optuna.study._optimize - INFO - Trial 36 pruned. 
2026-05-09 19:11:55,000 - optuna.study.study - INFO - Trial 37 finished with value: 0.03514052995393379 and parameters: {'n_layers': 2, 'embedding_dim': 128, 'lr': 0.011237695921012477, 'lambda_val': 9.685477268869941e-06, 'batch_size': 3147, 'optimizer': 'RMSprop'}. Best is trial 16 with value: 0.05473050830218.
2026-05-09 19:11:55,952 - optuna.study._optimize - INFO - Trial 38 pruned. 
2026-05-09 19:11:57,815 - optuna.study._optimize - INFO - Trial 39 pruned. 
2026-05-09 19:11:58,813 - optuna.study._optimize - INFO - Trial 40 pruned. 
2026-05-09 19:12:59,786 - optuna.study.study - INFO - Trial 41 finished with value: 0.03656224062193272 and parameters: {'n_layers': 3, 'embedding_dim': 256, 'lr': 0.006100621674617274, 'lambda_val': 2.5342867431777273e-06, 'batch_size': 3611, 'optimizer': 'RMSprop'}. Best is trial 16 with value: 0.05473050830218.
2026-05-09 19:13:31,602 - optuna.study._optimize - INFO - Trial 42 pruned. 
2026-05-09 19:13:32,633 - optuna.study._optimize - INFO - Trial 43 pruned. 
2026-05-09 19:14:24,454 - optuna.study.study - INFO - Trial 44 finished with value: 0.03255588025680876 and parameters: {'n_layers': 3, 'embedding_dim': 256, 'lr': 0.009473734790805157, 'lambda_val': 2.3541990026487784e-06, 'batch_size': 3616, 'optimizer': 'RMSprop'}. Best is trial 16 with value: 0.05473050830218.
2026-05-09 19:14:25,472 - optuna.study._optimize - INFO - Trial 45 pruned. 
2026-05-09 19:14:26,481 - optuna.study._optimize - INFO - Trial 46 pruned. 
2026-05-09 19:14:27,755 - optuna.study._optimize - INFO - Trial 47 pruned. 
2026-05-09 19:14:29,302 - optuna.study._optimize - INFO - Trial 48 pruned. 
2026-05-09 19:14:30,459 - optuna.study._optimize - INFO - Trial 49 pruned. 
2026-05-09 19:14:31,883 - optuna.study._optimize - INFO - Trial 50 pruned. 
2026-05-09 19:14:32,963 - optuna.study._optimize - INFO - Trial 51 pruned. 
2026-05-09 19:14:34,099 - optuna.study._optimize - INFO - Trial 52 pruned. 
2026-05-09 19:14:36,479 - optuna.study._optimize - INFO - Trial 53 pruned. 
2026-05-09 19:14:37,654 - optuna.study._optimize - INFO - Trial 54 pruned. 
2026-05-09 19:14:38,806 - optuna.study._optimize - INFO - Trial 55 pruned. 
2026-05-09 19:14:39,833 - optuna.study._optimize - INFO - Trial 56 pruned. 
2026-05-09 19:14:41,173 - optuna.study._optimize - INFO - Trial 57 pruned. 
2026-05-09 19:14:42,193 - optuna.study._optimize - INFO - Trial 58 pruned. 
2026-05-09 19:14:43,722 - optuna.study._optimize - INFO - Trial 59 pruned. 
2026-05-09 19:14:44,741 - optuna.study._optimize - INFO - Trial 60 pruned. 
2026-05-09 19:15:37,676 - optuna.study.study - INFO - Trial 61 finished with value: 0.03419746933147278 and parameters: {'n_layers': 3, 'embedding_dim': 256, 'lr': 0.0061340286311081125, 'lambda_val': 3.2010614942186946e-06, 'batch_size': 3637, 'optimizer': 'RMSprop'}. Best is trial 16 with value: 0.05473050830218.
2026-05-09 19:16:28,651 - optuna.study.study - INFO - Trial 62 finished with value: 0.03895485183039931 and parameters: {'n_layers': 3, 'embedding_dim': 256, 'lr': 0.009156752942708212, 'lambda_val': 2.691873319392672e-06, 'batch_size': 3563, 'optimizer': 'RMSprop'}. Best is trial 16 with value: 0.05473050830218.
2026-05-09 19:17:19,254 - optuna.study.study - INFO - Trial 63 finished with value: 0.034863085448855406 and parameters: {'n_layers': 3, 'embedding_dim': 256, 'lr': 0.009837437398786366, 'lambda_val': 1.6438438950710404e-06, 'batch_size': 3963, 'optimizer': 'RMSprop'}. Best is trial 16 with value: 0.05473050830218.
2026-05-09 19:18:08,760 - optuna.study.study - INFO - Trial 64 finished with value: 0.030715336936540327 and parameters: {'n_layers': 3, 'embedding_dim': 256, 'lr': 0.015125739694477773, 'lambda_val': 1.387122487409978e-06, 'batch_size': 3503, 'optimizer': 'RMSprop'}. Best is trial 16 with value: 0.05473050830218.
2026-05-09 19:18:11,121 - optuna.study._optimize - INFO - Trial 65 pruned. 
2026-05-09 19:18:12,169 - optuna.study._optimize - INFO - Trial 66 pruned. 
2026-05-09 19:19:11,652 - optuna.study.study - INFO - Trial 67 finished with value: 0.04324137751972847 and parameters: {'n_layers': 3, 'embedding_dim': 256, 'lr': 0.008282209978726767, 'lambda_val': 0.0004458179538783075, 'batch_size': 4087, 'optimizer': 'RMSprop'}. Best is trial 16 with value: 0.05473050830218.
2026-05-09 19:20:04,039 - optuna.study.study - INFO - Trial 68 finished with value: 0.04585964434148218 and parameters: {'n_layers': 3, 'embedding_dim': 256, 'lr': 0.013309172745849302, 'lambda_val': 0.0006139634986787636, 'batch_size': 4074, 'optimizer': 'RMSprop'}. Best is trial 16 with value: 0.05473050830218.
2026-05-09 19:20:46,874 - optuna.study.study - INFO - Trial 69 finished with value: 0.05344657562419513 and parameters: {'n_layers': 2, 'embedding_dim': 256, 'lr': 0.012975523566567754, 'lambda_val': 0.0004101062373787572, 'batch_size': 4061, 'optimizer': 'RMSprop'}. Best is trial 16 with value: 0.05473050830218.
2026-05-09 19:21:22,042 - optuna.study.study - INFO - Trial 70 finished with value: 0.050031254873645306 and parameters: {'n_layers': 2, 'embedding_dim': 128, 'lr': 0.013300002107062343, 'lambda_val': 0.00044122137846264604, 'batch_size': 4092, 'optimizer': 'RMSprop'}. Best is trial 16 with value: 0.05473050830218.
2026-05-09 19:21:56,649 - optuna.study.study - INFO - Trial 71 finished with value: 0.049289379087464134 and parameters: {'n_layers': 2, 'embedding_dim': 128, 'lr': 0.013073524953783998, 'lambda_val': 0.00042954386183741714, 'batch_size': 4079, 'optimizer': 'RMSprop'}. Best is trial 16 with value: 0.05473050830218.
2026-05-09 19:22:31,593 - optuna.study.study - INFO - Trial 72 finished with value: 0.052829743019057136 and parameters: {'n_layers': 2, 'embedding_dim': 128, 'lr': 0.012417602559913943, 'lambda_val': 0.0003951370962070506, 'batch_size': 4063, 'optimizer': 'RMSprop'}. Best is trial 16 with value: 0.05473050830218.
2026-05-09 19:23:06,081 - optuna.study.study - INFO - Trial 73 finished with value: 0.05029474426739021 and parameters: {'n_layers': 2, 'embedding_dim': 128, 'lr': 0.026185798097011832, 'lambda_val': 0.0004234333469209301, 'batch_size': 4066, 'optimizer': 'RMSprop'}. Best is trial 16 with value: 0.05473050830218.
2026-05-09 19:23:07,044 - optuna.study._optimize - INFO - Trial 74 pruned. 
2026-05-09 19:23:53,743 - optuna.study.study - INFO - Trial 75 finished with value: 0.051342062898319475 and parameters: {'n_layers': 2, 'embedding_dim': 128, 'lr': 0.0236984085160892, 'lambda_val': 0.0003391288728541889, 'batch_size': 3968, 'optimizer': 'RMSprop'}. Best is trial 16 with value: 0.05473050830218.
2026-05-09 19:23:56,250 - optuna.study._optimize - INFO - Trial 76 pruned. 
2026-05-09 19:24:31,568 - optuna.study.study - INFO - Trial 77 finished with value: 0.05416946699165903 and parameters: {'n_layers': 2, 'embedding_dim': 128, 'lr': 0.01602173077705778, 'lambda_val': 0.0016126832668177805, 'batch_size': 3947, 'optimizer': 'RMSprop'}. Best is trial 16 with value: 0.05473050830218.
2026-05-09 19:24:33,242 - optuna.study._optimize - INFO - Trial 78 pruned. 
2026-05-09 19:24:34,250 - optuna.study._optimize - INFO - Trial 79 pruned. 
2026-05-09 19:24:35,457 - optuna.study._optimize - INFO - Trial 80 pruned. 
2026-05-09 19:24:37,398 - optuna.study._optimize - INFO - Trial 81 pruned. 
2026-05-09 19:25:11,748 - optuna.study.study - INFO - Trial 82 finished with value: 0.054185251907130694 and parameters: {'n_layers': 2, 'embedding_dim': 128, 'lr': 0.025287712690300976, 'lambda_val': 0.0007945683927933049, 'batch_size': 3806, 'optimizer': 'RMSprop'}. Best is trial 16 with value: 0.05473050830218.
2026-05-09 19:25:13,621 - optuna.study._optimize - INFO - Trial 83 pruned. 
2026-05-09 19:25:14,637 - optuna.study._optimize - INFO - Trial 84 pruned. 
2026-05-09 19:25:16,175 - optuna.study._optimize - INFO - Trial 85 pruned. 
2026-05-09 19:25:17,313 - optuna.study._optimize - INFO - Trial 86 pruned. 
2026-05-09 19:25:18,376 - optuna.study._optimize - INFO - Trial 87 pruned. 
2026-05-09 19:25:20,227 - optuna.study._optimize - INFO - Trial 88 pruned. 
2026-05-09 19:25:21,969 - optuna.study._optimize - INFO - Trial 89 pruned. 
