2026-05-09 20:21:46,311 - optuna.study._optimize - INFO - Trial 10 pruned. 
2026-05-09 20:21:47,683 - optuna.study._optimize - INFO - Trial 11 pruned. 
2026-05-09 20:21:48,681 - optuna.study._optimize - INFO - Trial 12 pruned. 
2026-05-09 20:21:50,035 - optuna.study._optimize - INFO - Trial 13 pruned. 
2026-05-09 20:21:51,067 - optuna.study._optimize - INFO - Trial 14 pruned. 
2026-05-09 20:21:53,488 - optuna.study._optimize - INFO - Trial 15 pruned. 
2026-05-09 20:21:54,541 - optuna.study._optimize - INFO - Trial 16 pruned. 
2026-05-09 20:21:55,889 - optuna.study._optimize - INFO - Trial 17 pruned. 
2026-05-09 20:21:58,749 - optuna.study._optimize - INFO - Trial 18 pruned. 
2026-05-09 20:21:59,886 - optuna.study._optimize - INFO - Trial 19 pruned. 
2026-05-09 20:22:01,056 - optuna.study._optimize - INFO - Trial 20 pruned. 
2026-05-09 20:22:04,192 - optuna.study._optimize - INFO - Trial 21 pruned. 
2026-05-09 20:22:23,222 - optuna.study._optimize - INFO - Trial 22 pruned. 
2026-05-09 20:22:24,507 - optuna.study._optimize - INFO - Trial 23 pruned. 
2026-05-09 20:22:25,655 - optuna.study._optimize - INFO - Trial 24 pruned. 
2026-05-09 20:22:58,543 - optuna.study.study - INFO - Trial 25 finished with value: 0.00969229557574109 and parameters: {'n_layers': 3, 'embedding_dim': 32, 'lr': 0.00023018519099652406, 'lambda_val': 0.0012731002838638078, 'batch_size': 2986, 'optimizer': 'RMSprop'}. Best is trial 3 with value: 0.08362887689931989.
2026-05-09 20:22:59,567 - optuna.study._optimize - INFO - Trial 26 pruned. 
2026-05-09 20:23:02,083 - optuna.study._optimize - INFO - Trial 27 pruned. 
2026-05-09 20:23:03,596 - optuna.study._optimize - INFO - Trial 28 pruned. 
2026-05-09 20:23:04,685 - optuna.study._optimize - INFO - Trial 29 pruned. 
2026-05-09 20:23:05,940 - optuna.study._optimize - INFO - Trial 30 pruned. 
2026-05-09 20:23:12,641 - optuna.study._optimize - INFO - Trial 31 pruned. 
2026-05-09 20:24:01,187 - optuna.study.study - INFO - Trial 32 finished with value: 0.035692027880561576 and parameters: {'n_layers': 3, 'embedding_dim': 256, 'lr': 0.015701458752326942, 'lambda_val': 0.0023673049669610834, 'batch_size': 530, 'optimizer': 'RMSprop'}. Best is trial 3 with value: 0.08362887689931989.
2026-05-09 20:24:20,233 - optuna.study._optimize - INFO - Trial 33 pruned. 
2026-05-09 20:24:21,313 - optuna.study._optimize - INFO - Trial 34 pruned. 
2026-05-09 20:24:22,598 - optuna.study._optimize - INFO - Trial 35 pruned. 
2026-05-09 20:24:27,930 - optuna.study._optimize - INFO - Trial 36 pruned. 
2026-05-09 20:24:29,019 - optuna.study._optimize - INFO - Trial 37 pruned. 
2026-05-09 20:24:30,208 - optuna.study._optimize - INFO - Trial 38 pruned. 
2026-05-09 20:24:31,926 - optuna.study._optimize - INFO - Trial 39 pruned. 
2026-05-09 20:24:33,015 - optuna.study._optimize - INFO - Trial 40 pruned. 
2026-05-09 20:24:41,869 - optuna.study._optimize - INFO - Trial 41 pruned. 
2026-05-09 20:25:30,997 - optuna.study.study - INFO - Trial 42 finished with value: 0.033584541924542854 and parameters: {'n_layers': 3, 'embedding_dim': 256, 'lr': 0.03215674471891348, 'lambda_val': 0.0011053574606232459, 'batch_size': 731, 'optimizer': 'RMSprop'}. Best is trial 3 with value: 0.08362887689931989.
2026-05-09 20:25:40,976 - optuna.study._optimize - INFO - Trial 43 pruned. 
2026-05-09 20:26:13,862 - optuna.study.study - INFO - Trial 44 finished with value: 0.06869900853675713 and parameters: {'n_layers': 1, 'embedding_dim': 256, 'lr': 0.0031972779207973057, 'lambda_val': 0.005739641176868991, 'batch_size': 1250, 'optimizer': 'RMSprop'}. Best is trial 3 with value: 0.08362887689931989.
2026-05-09 20:26:15,000 - optuna.study._optimize - INFO - Trial 45 pruned. 
2026-05-09 20:26:16,066 - optuna.study._optimize - INFO - Trial 46 pruned. 
2026-05-09 20:26:17,282 - optuna.study._optimize - INFO - Trial 47 pruned. 
2026-05-09 20:26:18,348 - optuna.study._optimize - INFO - Trial 48 pruned. 
2026-05-09 20:26:19,375 - optuna.study._optimize - INFO - Trial 49 pruned. 
2026-05-09 20:26:23,036 - optuna.study._optimize - INFO - Trial 50 pruned. 
2026-05-09 20:27:03,039 - optuna.study.study - INFO - Trial 51 finished with value: 0.08137990624598673 and parameters: {'n_layers': 1, 'embedding_dim': 256, 'lr': 0.0186981624295526, 'lambda_val': 0.0019326043968594222, 'batch_size': 883, 'optimizer': 'RMSprop'}. Best is trial 3 with value: 0.08362887689931989.
2026-05-09 20:27:04,389 - optuna.study._optimize - INFO - Trial 52 pruned. 
2026-05-09 20:27:05,809 - optuna.study._optimize - INFO - Trial 53 pruned. 
2026-05-09 20:27:48,355 - optuna.study.study - INFO - Trial 54 finished with value: 0.08162582363522264 and parameters: {'n_layers': 1, 'embedding_dim': 256, 'lr': 0.01004657250233629, 'lambda_val': 0.0016234073336364523, 'batch_size': 894, 'optimizer': 'RMSprop'}. Best is trial 3 with value: 0.08362887689931989.
2026-05-09 20:27:49,328 - optuna.study._optimize - INFO - Trial 55 pruned. 
2026-05-09 20:27:50,788 - optuna.study._optimize - INFO - Trial 56 pruned. 
2026-05-09 20:27:51,794 - optuna.study._optimize - INFO - Trial 57 pruned. 
2026-05-09 20:27:53,066 - optuna.study._optimize - INFO - Trial 58 pruned. 
2026-05-09 20:28:21,552 - optuna.study.study - INFO - Trial 59 finished with value: 0.05855077318826393 and parameters: {'n_layers': 1, 'embedding_dim': 64, 'lr': 0.022892819994552456, 'lambda_val': 0.0002477455034879337, 'batch_size': 3091, 'optimizer': 'RMSprop'}. Best is trial 3 with value: 0.08362887689931989.
2026-05-09 20:28:23,029 - optuna.study._optimize - INFO - Trial 60 pruned. 
2026-05-09 20:28:25,329 - optuna.study._optimize - INFO - Trial 61 pruned. 
2026-05-09 20:28:28,455 - optuna.study._optimize - INFO - Trial 62 pruned. 
2026-05-09 20:28:29,514 - optuna.study._optimize - INFO - Trial 63 pruned. 
2026-05-09 20:28:30,712 - optuna.study._optimize - INFO - Trial 64 pruned. 
2026-05-09 20:28:32,711 - optuna.study._optimize - INFO - Trial 65 pruned. 
2026-05-09 20:29:00,533 - optuna.study.study - INFO - Trial 66 finished with value: 0.06245826374890106 and parameters: {'n_layers': 1, 'embedding_dim': 32, 'lr': 0.025552152379730447, 'lambda_val': 0.002585845329729872, 'batch_size': 3965, 'optimizer': 'RMSprop'}. Best is trial 3 with value: 0.08362887689931989.
2026-05-09 20:29:01,522 - optuna.study._optimize - INFO - Trial 67 pruned. 
2026-05-09 20:29:02,469 - optuna.study._optimize - INFO - Trial 68 pruned. 
2026-05-09 20:29:03,837 - optuna.study._optimize - INFO - Trial 69 pruned. 
2026-05-09 20:29:04,851 - optuna.study._optimize - INFO - Trial 70 pruned. 
2026-05-09 20:29:34,141 - optuna.study.study - INFO - Trial 71 finished with value: 0.07954893748205948 and parameters: {'n_layers': 1, 'embedding_dim': 64, 'lr': 0.012886337513600276, 'lambda_val': 0.0021337041708253987, 'batch_size': 3764, 'optimizer': 'RMSprop'}. Best is trial 3 with value: 0.08362887689931989.
2026-05-09 20:29:36,612 - optuna.study._optimize - INFO - Trial 72 pruned. 
2026-05-09 20:29:37,716 - optuna.study._optimize - INFO - Trial 73 pruned. 
2026-05-09 20:29:39,225 - optuna.study._optimize - INFO - Trial 74 pruned. 
2026-05-09 20:30:13,832 - optuna.study.study - INFO - Trial 75 finished with value: 0.08157530425851153 and parameters: {'n_layers': 1, 'embedding_dim': 256, 'lr': 0.009689643054823241, 'lambda_val': 0.0013626865463437136, 'batch_size': 3528, 'optimizer': 'RMSprop'}. Best is trial 3 with value: 0.08362887689931989.
2026-05-09 20:30:14,808 - optuna.study._optimize - INFO - Trial 76 pruned. 
2026-05-09 20:30:49,840 - optuna.study.study - INFO - Trial 77 finished with value: 0.08445076951706097 and parameters: {'n_layers': 1, 'embedding_dim': 256, 'lr': 0.014194980064888441, 'lambda_val': 0.001260336724852014, 'batch_size': 4006, 'optimizer': 'RMSprop'}. Best is trial 77 with value: 0.08445076951706097.
2026-05-09 20:30:51,360 - optuna.study._optimize - INFO - Trial 78 pruned. 
2026-05-09 20:30:52,385 - optuna.study._optimize - INFO - Trial 79 pruned. 
2026-05-09 20:30:55,212 - optuna.study._optimize - INFO - Trial 80 pruned. 
2026-05-09 20:30:56,613 - optuna.study._optimize - INFO - Trial 81 pruned. 
2026-05-09 20:30:57,636 - optuna.study._optimize - INFO - Trial 82 pruned. 
2026-05-09 20:30:58,872 - optuna.study._optimize - INFO - Trial 83 pruned. 
2026-05-09 20:31:33,748 - optuna.study.study - INFO - Trial 84 finished with value: 0.07476577244035312 and parameters: {'n_layers': 1, 'embedding_dim': 256, 'lr': 0.01862465174773911, 'lambda_val': 0.001456366160745748, 'batch_size': 3622, 'optimizer': 'RMSprop'}. Best is trial 77 with value: 0.08445076951706097.
2026-05-09 20:31:35,382 - optuna.study._optimize - INFO - Trial 85 pruned. 
2026-05-09 20:31:36,406 - optuna.study._optimize - INFO - Trial 86 pruned. 
2026-05-09 20:31:40,050 - optuna.study._optimize - INFO - Trial 87 pruned. 
2026-05-09 20:31:41,093 - optuna.study._optimize - INFO - Trial 88 pruned. 
2026-05-09 20:31:42,327 - optuna.study._optimize - INFO - Trial 89 pruned. 
2026-05-09 20:31:43,907 - optuna.study._optimize - INFO - Trial 90 pruned. 
2026-05-09 20:31:44,866 - optuna.study._optimize - INFO - Trial 91 pruned. 
2026-05-09 20:31:46,277 - optuna.study._optimize - INFO - Trial 92 pruned. 
2026-05-09 20:31:47,409 - optuna.study._optimize - INFO - Trial 93 pruned. 
2026-05-09 20:31:48,490 - optuna.study._optimize - INFO - Trial 94 pruned. 
2026-05-09 20:32:18,175 - optuna.study.study - INFO - Trial 95 finished with value: 0.07921439955872635 and parameters: {'n_layers': 1, 'embedding_dim': 96, 'lr': 0.015275331400473572, 'lambda_val': 0.0022513933980106158, 'batch_size': 2460, 'optimizer': 'RMSprop'}. Best is trial 77 with value: 0.08445076951706097.
2026-05-09 20:32:19,640 - optuna.study._optimize - INFO - Trial 96 pruned. 
2026-05-09 20:32:20,643 - optuna.study._optimize - INFO - Trial 97 pruned. 
2026-05-09 20:32:49,834 - optuna.study.study - INFO - Trial 98 finished with value: 0.08090803125489097 and parameters: {'n_layers': 1, 'embedding_dim': 96, 'lr': 0.023531670990830516, 'lambda_val': 0.0024429906727720567, 'batch_size': 4011, 'optimizer': 'RMSprop'}. Best is trial 77 with value: 0.08445076951706097.
2026-05-09 20:32:52,020 - optuna.study._optimize - INFO - Trial 99 pruned. 
2026-05-09 20:33:21,051 - root - INFO -   **** Training e_100K_1c2dcs_rand3
2026-05-09 20:33:21,063 - root - INFO -   **** Getting 54402/65410 random edges
2026-05-09 20:33:21,173 - optuna.storages._rdb.storage - INFO - A new study created in RDB with name: Study_e_100K_1c2dcs_rand3
2026-05-09 20:34:04,577 - optuna.study.study - INFO - Trial 0 finished with value: 0.0016759610238403912 and parameters: {'n_layers': 4, 'embedding_dim': 128, 'lr': 0.025961587672369727, 'lambda_val': 2.293420748056207e-05, 'batch_size': 1203, 'optimizer': 'SGD'}. Best is trial 0 with value: 0.0016759610238403912.
2026-05-09 20:34:46,976 - optuna.study.study - INFO - Trial 1 finished with value: 0.07279314189644938 and parameters: {'n_layers': 1, 'embedding_dim': 256, 'lr': 0.00031530914343393866, 'lambda_val': 0.0001204962131165671, 'batch_size': 1469, 'optimizer': 'RMSprop'}. Best is trial 1 with value: 0.07279314189644938.
2026-05-09 20:35:23,140 - optuna.study.study - INFO - Trial 2 finished with value: 0.0028777749539775767 and parameters: {'n_layers': 3, 'embedding_dim': 96, 'lr': 0.00018851520246311048, 'lambda_val': 1.4375994208833703e-06, 'batch_size': 2596, 'optimizer': 'SGD'}. Best is trial 1 with value: 0.07279314189644938.
2026-05-09 20:36:20,041 - optuna.study.study - INFO - Trial 3 finished with value: 0.015461432683548862 and parameters: {'n_layers': 4, 'embedding_dim': 256, 'lr': 0.025425666122926682, 'lambda_val': 0.00576846110511314, 'batch_size': 638, 'optimizer': 'Adam'}. Best is trial 1 with value: 0.07279314189644938.
2026-05-09 20:36:51,090 - optuna.study.study - INFO - Trial 4 finished with value: 0.051708877086661206 and parameters: {'n_layers': 1, 'embedding_dim': 96, 'lr': 0.0007452391246861761, 'lambda_val': 0.0026117023434797187, 'batch_size': 3222, 'optimizer': 'Adam'}. Best is trial 1 with value: 0.07279314189644938.
2026-05-09 20:36:52,048 - optuna.study._optimize - INFO - Trial 5 pruned. 
2026-05-09 20:37:41,486 - optuna.study.study - INFO - Trial 6 finished with value: 0.03222774431737836 and parameters: {'n_layers': 3, 'embedding_dim': 256, 'lr': 0.0024461519818688654, 'lambda_val': 0.0002666659111900487, 'batch_size': 1569, 'optimizer': 'RMSprop'}. Best is trial 1 with value: 0.07279314189644938.
2026-05-09 20:37:43,130 - optuna.study._optimize - INFO - Trial 7 pruned. 
2026-05-09 20:37:45,019 - optuna.study._optimize - INFO - Trial 8 pruned. 
2026-05-09 20:37:46,033 - optuna.study._optimize - INFO - Trial 9 pruned. 
2026-05-09 20:37:48,254 - optuna.study._optimize - INFO - Trial 10 pruned. 
2026-05-09 20:37:49,223 - optuna.study._optimize - INFO - Trial 11 pruned. 
2026-05-09 20:37:50,160 - optuna.study._optimize - INFO - Trial 12 pruned. 
2026-05-09 20:37:51,378 - optuna.study._optimize - INFO - Trial 13 pruned. 
2026-05-09 20:37:52,459 - optuna.study._optimize - INFO - Trial 14 pruned. 
2026-05-09 20:38:36,488 - optuna.study.study - INFO - Trial 15 finished with value: 0.03061772460785956 and parameters: {'n_layers': 2, 'embedding_dim': 256, 'lr': 0.001233498622661183, 'lambda_val': 0.010848771880394304, 'batch_size': 2013, 'optimizer': 'Adam'}. Best is trial 1 with value: 0.07279314189644938.
2026-05-09 20:38:37,387 - optuna.study._optimize - INFO - Trial 16 pruned. 
2026-05-09 20:38:38,977 - optuna.study._optimize - INFO - Trial 17 pruned. 
2026-05-09 20:38:40,701 - optuna.study._optimize - INFO - Trial 18 pruned. 
2026-05-09 20:38:41,582 - optuna.study._optimize - INFO - Trial 19 pruned. 
2026-05-09 20:38:42,529 - optuna.study._optimize - INFO - Trial 20 pruned. 
2026-05-09 20:38:53,081 - optuna.study._optimize - INFO - Trial 21 pruned. 
2026-05-09 20:39:42,011 - optuna.study.study - INFO - Trial 22 finished with value: 0.030022098993147034 and parameters: {'n_layers': 3, 'embedding_dim': 256, 'lr': 0.0021263301896331708, 'lambda_val': 0.00021005102058576156, 'batch_size': 1180, 'optimizer': 'RMSprop'}. Best is trial 1 with value: 0.07279314189644938.
2026-05-09 20:40:32,000 - optuna.study.study - INFO - Trial 23 finished with value: 0.031601717072971804 and parameters: {'n_layers': 3, 'embedding_dim': 256, 'lr': 0.007105724031777453, 'lambda_val': 3.6703832308941966e-05, 'batch_size': 1813, 'optimizer': 'RMSprop'}. Best is trial 1 with value: 0.07279314189644938.
2026-05-09 20:40:33,046 - optuna.study._optimize - INFO - Trial 24 pruned. 
2026-05-09 20:40:34,058 - optuna.study._optimize - INFO - Trial 25 pruned. 
2026-05-09 20:40:35,173 - optuna.study._optimize - INFO - Trial 26 pruned. 
2026-05-09 20:40:38,587 - optuna.study._optimize - INFO - Trial 27 pruned. 
2026-05-09 20:41:17,457 - optuna.study.study - INFO - Trial 28 finished with value: 0.030364786414498957 and parameters: {'n_layers': 2, 'embedding_dim': 96, 'lr': 0.0013385333870398549, 'lambda_val': 1.560774362880777e-05, 'batch_size': 1650, 'optimizer': 'Adam'}. Best is trial 1 with value: 0.07279314189644938.
2026-05-09 20:41:20,625 - optuna.study._optimize - INFO - Trial 29 pruned. 
2026-05-09 20:41:21,605 - optuna.study._optimize - INFO - Trial 30 pruned. 
2026-05-09 20:42:11,076 - optuna.study.study - INFO - Trial 31 finished with value: 0.03263243424223044 and parameters: {'n_layers': 3, 'embedding_dim': 256, 'lr': 0.009905044521025355, 'lambda_val': 4.0641612661042e-05, 'batch_size': 1782, 'optimizer': 'RMSprop'}. Best is trial 1 with value: 0.07279314189644938.
2026-05-09 20:42:28,665 - optuna.study._optimize - INFO - Trial 32 pruned. 
2026-05-09 20:42:30,521 - optuna.study._optimize - INFO - Trial 33 pruned. 
2026-05-09 20:43:21,169 - optuna.study.study - INFO - Trial 34 finished with value: 0.0468908527765938 and parameters: {'n_layers': 3, 'embedding_dim': 256, 'lr': 0.014944084487350491, 'lambda_val': 0.00018547472799963714, 'batch_size': 2500, 'optimizer': 'RMSprop'}. Best is trial 1 with value: 0.07279314189644938.
2026-05-09 20:43:23,365 - optuna.study._optimize - INFO - Trial 35 pruned. 
2026-05-09 20:43:25,398 - optuna.study._optimize - INFO - Trial 36 pruned. 
2026-05-09 20:43:26,429 - optuna.study._optimize - INFO - Trial 37 pruned. 
2026-05-09 20:43:28,661 - optuna.study._optimize - INFO - Trial 38 pruned. 
2026-05-09 20:43:29,689 - optuna.study._optimize - INFO - Trial 39 pruned. 
2026-05-09 20:43:31,001 - optuna.study._optimize - INFO - Trial 40 pruned. 
2026-05-09 20:43:33,011 - optuna.study._optimize - INFO - Trial 41 pruned. 
2026-05-09 20:43:34,136 - optuna.study._optimize - INFO - Trial 42 pruned. 
2026-05-09 20:43:36,401 - optuna.study._optimize - INFO - Trial 43 pruned. 
2026-05-09 20:44:10,084 - optuna.study.study - INFO - Trial 44 finished with value: 0.04323712251787183 and parameters: {'n_layers': 1, 'embedding_dim': 256, 'lr': 0.010676782061961829, 'lambda_val': 1.8109369565595915e-05, 'batch_size': 1785, 'optimizer': 'RMSprop'}. Best is trial 1 with value: 0.07279314189644938.
2026-05-09 20:44:11,199 - optuna.study._optimize - INFO - Trial 45 pruned. 
2026-05-09 20:44:12,348 - optuna.study._optimize - INFO - Trial 46 pruned. 
2026-05-09 20:44:52,077 - optuna.study.study - INFO - Trial 47 finished with value: 0.06032610329346413 and parameters: {'n_layers': 1, 'embedding_dim': 256, 'lr': 0.0005306815467946979, 'lambda_val': 3.828278753653958e-06, 'batch_size': 3241, 'optimizer': 'RMSprop'}. Best is trial 1 with value: 0.07279314189644938.
2026-05-09 20:45:20,436 - optuna.study.study - INFO - Trial 48 finished with value: 0.04555741439590345 and parameters: {'n_layers': 1, 'embedding_dim': 64, 'lr': 0.000500460720033613, 'lambda_val': 1.2735208194238693e-06, 'batch_size': 3166, 'optimizer': 'Adam'}. Best is trial 1 with value: 0.07279314189644938.
2026-05-09 20:45:21,503 - optuna.study._optimize - INFO - Trial 49 pruned. 
2026-05-09 20:45:22,727 - optuna.study._optimize - INFO - Trial 50 pruned. 
2026-05-09 20:45:23,728 - optuna.study._optimize - INFO - Trial 51 pruned. 
2026-05-09 20:45:24,735 - optuna.study._optimize - INFO - Trial 52 pruned. 
2026-05-09 20:45:26,356 - optuna.study._optimize - INFO - Trial 53 pruned. 
2026-05-09 20:45:27,297 - optuna.study._optimize - INFO - Trial 54 pruned. 
2026-05-09 20:45:28,554 - optuna.study._optimize - INFO - Trial 55 pruned. 
2026-05-09 20:45:29,798 - optuna.study._optimize - INFO - Trial 56 pruned. 
2026-05-09 20:45:31,113 - optuna.study._optimize - INFO - Trial 57 pruned. 
2026-05-09 20:45:32,381 - optuna.study._optimize - INFO - Trial 58 pruned. 
2026-05-09 20:45:33,484 - optuna.study._optimize - INFO - Trial 59 pruned. 
2026-05-09 20:45:34,521 - optuna.study._optimize - INFO - Trial 60 pruned. 
2026-05-09 20:46:08,114 - optuna.study.study - INFO - Trial 61 finished with value: 0.05292720216597855 and parameters: {'n_layers': 1, 'embedding_dim': 256, 'lr': 0.0083260428447577, 'lambda_val': 5.434429120100955e-05, 'batch_size': 1943, 'optimizer': 'RMSprop'}. Best is trial 1 with value: 0.07279314189644938.
2026-05-09 20:46:09,081 - optuna.study._optimize - INFO - Trial 62 pruned. 
2026-05-09 20:46:09,963 - optuna.study._optimize - INFO - Trial 63 pruned. 
2026-05-09 20:46:11,341 - optuna.study._optimize - INFO - Trial 64 pruned. 
2026-05-09 20:46:12,355 - optuna.study._optimize - INFO - Trial 65 pruned. 
2026-05-09 20:46:13,731 - optuna.study._optimize - INFO - Trial 66 pruned. 
2026-05-09 20:46:14,647 - optuna.study._optimize - INFO - Trial 67 pruned. 
2026-05-09 20:46:17,813 - optuna.study._optimize - INFO - Trial 68 pruned. 
2026-05-09 20:46:19,529 - optuna.study._optimize - INFO - Trial 69 pruned. 
2026-05-09 20:46:20,588 - optuna.study._optimize - INFO - Trial 70 pruned. 
2026-05-09 20:46:54,414 - optuna.study.study - INFO - Trial 71 finished with value: 0.04271520058361913 and parameters: {'n_layers': 1, 'embedding_dim': 256, 'lr': 0.010419093899677854, 'lambda_val': 3.339803906464802e-05, 'batch_size': 1898, 'optimizer': 'RMSprop'}. Best is trial 1 with value: 0.07279314189644938.
2026-05-09 20:46:56,003 - optuna.study._optimize - INFO - Trial 72 pruned. 
2026-05-09 20:47:30,204 - optuna.study.study - INFO - Trial 73 finished with value: 0.048053819246082284 and parameters: {'n_layers': 1, 'embedding_dim': 256, 'lr': 0.008352265844345291, 'lambda_val': 1.31354114902785e-05, 'batch_size': 1955, 'optimizer': 'RMSprop'}. Best is trial 1 with value: 0.07279314189644938.
2026-05-09 20:47:31,122 - optuna.study._optimize - INFO - Trial 74 pruned. 
2026-05-09 20:47:32,031 - optuna.study._optimize - INFO - Trial 75 pruned. 
2026-05-09 20:47:34,140 - optuna.study._optimize - INFO - Trial 76 pruned. 
2026-05-09 20:47:35,214 - optuna.study._optimize - INFO - Trial 77 pruned. 
2026-05-09 20:47:36,554 - optuna.study._optimize - INFO - Trial 78 pruned. 
2026-05-09 20:47:38,374 - optuna.study._optimize - INFO - Trial 79 pruned. 
2026-05-09 20:47:39,340 - optuna.study._optimize - INFO - Trial 80 pruned. 
2026-05-09 20:48:12,665 - optuna.study.study - INFO - Trial 81 finished with value: 0.046308157916930985 and parameters: {'n_layers': 1, 'embedding_dim': 256, 'lr': 0.015461582502082068, 'lambda_val': 3.3289675576516956e-05, 'batch_size': 1897, 'optimizer': 'RMSprop'}. Best is trial 1 with value: 0.07279314189644938.
2026-05-09 20:48:47,515 - optuna.study.study - INFO - Trial 82 finished with value: 0.04382115394523943 and parameters: {'n_layers': 1, 'embedding_dim': 256, 'lr': 0.012225005609175213, 'lambda_val': 6.960667018879037e-05, 'batch_size': 2418, 'optimizer': 'RMSprop'}. Best is trial 1 with value: 0.07279314189644938.
2026-05-09 20:49:21,913 - optuna.study.study - INFO - Trial 83 finished with value: 0.07515026315450825 and parameters: {'n_layers': 1, 'embedding_dim': 256, 'lr': 0.01435505831124402, 'lambda_val': 0.00029086398146741763, 'batch_size': 2401, 'optimizer': 'RMSprop'}. Best is trial 83 with value: 0.07515026315450825.
2026-05-09 20:49:23,049 - optuna.study._optimize - INFO - Trial 84 pruned. 
