2026-05-09 21:13:19,372 - optuna.study._optimize - INFO - Trial 72 pruned. 
2026-05-09 21:13:21,100 - optuna.study._optimize - INFO - Trial 73 pruned. 
2026-05-09 21:13:53,385 - optuna.study.study - INFO - Trial 74 finished with value: 0.07676260596776895 and parameters: {'n_layers': 1, 'embedding_dim': 128, 'lr': 0.021776774127381455, 'lambda_val': 0.0005323108267844284, 'batch_size': 3540, 'optimizer': 'RMSprop'}. Best is trial 37 with value: 0.08480728180183306.
2026-05-09 21:13:55,123 - optuna.study._optimize - INFO - Trial 75 pruned. 
2026-05-09 21:13:56,118 - optuna.study._optimize - INFO - Trial 76 pruned. 
2026-05-09 21:13:57,401 - optuna.study._optimize - INFO - Trial 77 pruned. 
2026-05-09 21:13:58,882 - optuna.study._optimize - INFO - Trial 78 pruned. 
2026-05-09 21:14:28,886 - optuna.study.study - INFO - Trial 79 finished with value: 0.08030907399047173 and parameters: {'n_layers': 1, 'embedding_dim': 128, 'lr': 0.028544094194716235, 'lambda_val': 0.0023111976548362955, 'batch_size': 3694, 'optimizer': 'RMSprop'}. Best is trial 37 with value: 0.08480728180183306.
2026-05-09 21:14:29,923 - optuna.study._optimize - INFO - Trial 80 pruned. 
2026-05-09 21:14:31,472 - optuna.study._optimize - INFO - Trial 81 pruned. 
2026-05-09 21:14:32,956 - optuna.study._optimize - INFO - Trial 82 pruned. 
2026-05-09 21:14:34,052 - optuna.study._optimize - INFO - Trial 83 pruned. 
2026-05-09 21:15:04,768 - optuna.study.study - INFO - Trial 84 finished with value: 0.08008536198048363 and parameters: {'n_layers': 1, 'embedding_dim': 128, 'lr': 0.023864752690357684, 'lambda_val': 0.000621551025361435, 'batch_size': 3637, 'optimizer': 'RMSprop'}. Best is trial 37 with value: 0.08480728180183306.
2026-05-09 21:15:35,807 - optuna.study.study - INFO - Trial 85 finished with value: 0.07978428842307105 and parameters: {'n_layers': 1, 'embedding_dim': 128, 'lr': 0.023315488953835888, 'lambda_val': 0.00046424760614356475, 'batch_size': 3672, 'optimizer': 'RMSprop'}. Best is trial 37 with value: 0.08480728180183306.
2026-05-09 21:15:36,911 - optuna.study._optimize - INFO - Trial 86 pruned. 
2026-05-09 21:15:39,038 - optuna.study._optimize - INFO - Trial 87 pruned. 
2026-05-09 21:15:40,552 - optuna.study._optimize - INFO - Trial 88 pruned. 
2026-05-09 21:15:41,569 - optuna.study._optimize - INFO - Trial 89 pruned. 
2026-05-09 21:15:42,552 - optuna.study._optimize - INFO - Trial 90 pruned. 
2026-05-09 21:15:44,704 - optuna.study._optimize - INFO - Trial 91 pruned. 
2026-05-09 21:15:45,864 - optuna.study._optimize - INFO - Trial 92 pruned. 
2026-05-09 21:15:47,714 - optuna.study._optimize - INFO - Trial 93 pruned. 
2026-05-09 21:16:16,701 - optuna.study.study - INFO - Trial 94 finished with value: 0.08381886804470985 and parameters: {'n_layers': 1, 'embedding_dim': 128, 'lr': 0.02339835122030215, 'lambda_val': 0.0018304408757986456, 'batch_size': 3557, 'optimizer': 'RMSprop'}. Best is trial 37 with value: 0.08480728180183306.
2026-05-09 21:16:18,428 - optuna.study._optimize - INFO - Trial 95 pruned. 
2026-05-09 21:16:19,362 - optuna.study._optimize - INFO - Trial 96 pruned. 
2026-05-09 21:16:20,832 - optuna.study._optimize - INFO - Trial 97 pruned. 
2026-05-09 21:16:21,905 - optuna.study._optimize - INFO - Trial 98 pruned. 
2026-05-09 21:16:23,143 - optuna.study._optimize - INFO - Trial 99 pruned. 
2026-05-09 21:16:43,947 - root - INFO - **** Training e_100K_1c3dcs
2026-05-09 21:16:43,947 - root - INFO -   ** 3-Dominant stats:
2026-05-09 21:16:43,947 - root - INFO -   ** Finding the dominant set:
2026-05-09 21:17:03,071 - root - INFO -   ** Getting the trainable edges:
2026-05-09 21:17:03,078 - helper_functions - INFO -      Number of nodes: 4883
2026-05-09 21:17:03,078 - helper_functions - INFO -      Ratio: 0.5389029908398631
2026-05-09 21:17:03,078 - helper_functions - INFO -      Number of unique users: 343
2026-05-09 21:17:03,078 - helper_functions - INFO -      Number of unique items: 4540
2026-05-09 21:17:03,078 - helper_functions - INFO -      Total dominant set edge: 70473
2026-05-09 21:17:03,078 - helper_functions - INFO -      Trainable edges: 56378.4
2026-05-09 21:17:03,086 - root - INFO -   **** Getting 70473 dominant set edges
2026-05-09 21:17:03,214 - optuna.storages._rdb.storage - INFO - A new study created in RDB with name: Study_e_100K_1c3dcs
2026-05-09 21:17:37,164 - optuna.study.study - INFO - Trial 0 finished with value: 0.03967331763151042 and parameters: {'n_layers': 1, 'embedding_dim': 256, 'lr': 2.217419687620455e-05, 'lambda_val': 0.0010610851954267824, 'batch_size': 2932, 'optimizer': 'Adam'}. Best is trial 0 with value: 0.03967331763151042.
2026-05-09 21:18:45,337 - optuna.study.study - INFO - Trial 1 finished with value: 0.001779900684598843 and parameters: {'n_layers': 4, 'embedding_dim': 256, 'lr': 0.09803700482116151, 'lambda_val': 0.09416768689406478, 'batch_size': 1857, 'optimizer': 'Adam'}. Best is trial 0 with value: 0.03967331763151042.
2026-05-09 21:19:15,639 - optuna.study.study - INFO - Trial 2 finished with value: 0.021829279939072962 and parameters: {'n_layers': 2, 'embedding_dim': 64, 'lr': 0.000164991832403312, 'lambda_val': 1.1013090359876524e-05, 'batch_size': 2137, 'optimizer': 'RMSprop'}. Best is trial 0 with value: 0.03967331763151042.
2026-05-09 21:19:43,750 - optuna.study.study - INFO - Trial 3 finished with value: 0.035247878243823055 and parameters: {'n_layers': 1, 'embedding_dim': 96, 'lr': 0.001242429736324732, 'lambda_val': 3.3490877978501114e-06, 'batch_size': 1986, 'optimizer': 'Adam'}. Best is trial 0 with value: 0.03967331763151042.
2026-05-09 21:20:12,927 - optuna.study.study - INFO - Trial 4 finished with value: 0.025659489546005283 and parameters: {'n_layers': 1, 'embedding_dim': 96, 'lr': 0.00012934698665314595, 'lambda_val': 0.06826299591936734, 'batch_size': 3119, 'optimizer': 'RMSprop'}. Best is trial 0 with value: 0.03967331763151042.
2026-05-09 21:20:13,898 - optuna.study._optimize - INFO - Trial 5 pruned. 
2026-05-09 21:20:17,261 - optuna.study._optimize - INFO - Trial 6 pruned. 
2026-05-09 21:20:18,632 - optuna.study._optimize - INFO - Trial 7 pruned. 
2026-05-09 21:20:19,471 - optuna.study._optimize - INFO - Trial 8 pruned. 
2026-05-09 21:20:20,335 - optuna.study._optimize - INFO - Trial 9 pruned. 
2026-05-09 21:20:21,672 - optuna.study._optimize - INFO - Trial 10 pruned. 
2026-05-09 21:20:24,117 - optuna.study._optimize - INFO - Trial 11 pruned. 
2026-05-09 21:20:27,682 - optuna.study._optimize - INFO - Trial 12 pruned. 
2026-05-09 21:20:28,677 - optuna.study._optimize - INFO - Trial 13 pruned. 
2026-05-09 21:20:29,937 - optuna.study._optimize - INFO - Trial 14 pruned. 
2026-05-09 21:21:05,542 - optuna.study.study - INFO - Trial 15 finished with value: 0.02998811363190784 and parameters: {'n_layers': 1, 'embedding_dim': 96, 'lr': 0.002439807033364836, 'lambda_val': 1.3560152067127868e-06, 'batch_size': 3266, 'optimizer': 'RMSprop'}. Best is trial 0 with value: 0.03967331763151042.
2026-05-09 21:21:06,536 - optuna.study._optimize - INFO - Trial 16 pruned. 
2026-05-09 21:21:07,769 - optuna.study._optimize - INFO - Trial 17 pruned. 
2026-05-09 21:21:08,631 - optuna.study._optimize - INFO - Trial 18 pruned. 
2026-05-09 21:21:09,946 - optuna.study._optimize - INFO - Trial 19 pruned. 
2026-05-09 21:21:10,908 - optuna.study._optimize - INFO - Trial 20 pruned. 
2026-05-09 21:21:12,257 - optuna.study._optimize - INFO - Trial 21 pruned. 
2026-05-09 21:21:49,753 - optuna.study.study - INFO - Trial 22 finished with value: 0.030062363585998373 and parameters: {'n_layers': 1, 'embedding_dim': 96, 'lr': 0.0033606428404527743, 'lambda_val': 2.7975217297672524e-06, 'batch_size': 3101, 'optimizer': 'RMSprop'}. Best is trial 0 with value: 0.03967331763151042.
2026-05-09 21:21:50,670 - optuna.study._optimize - INFO - Trial 23 pruned. 
2026-05-09 21:21:51,665 - optuna.study._optimize - INFO - Trial 24 pruned. 
2026-05-09 21:21:55,416 - optuna.study._optimize - INFO - Trial 25 pruned. 
2026-05-09 21:21:56,455 - optuna.study._optimize - INFO - Trial 26 pruned. 
2026-05-09 21:21:57,848 - optuna.study._optimize - INFO - Trial 27 pruned. 
2026-05-09 21:22:03,404 - optuna.study._optimize - INFO - Trial 28 pruned. 
2026-05-09 21:22:04,897 - optuna.study._optimize - INFO - Trial 29 pruned. 
2026-05-09 21:22:06,570 - optuna.study._optimize - INFO - Trial 30 pruned. 
2026-05-09 21:22:07,553 - optuna.study._optimize - INFO - Trial 31 pruned. 
2026-05-09 21:22:37,279 - optuna.study.study - INFO - Trial 32 finished with value: 0.02646197472161832 and parameters: {'n_layers': 1, 'embedding_dim': 96, 'lr': 0.0020206647188041847, 'lambda_val': 1.0355415651240855e-05, 'batch_size': 3603, 'optimizer': 'RMSprop'}. Best is trial 0 with value: 0.03967331763151042.
2026-05-09 21:22:38,302 - optuna.study._optimize - INFO - Trial 33 pruned. 
2026-05-09 21:22:40,217 - optuna.study._optimize - INFO - Trial 34 pruned. 
2026-05-09 21:23:08,456 - optuna.study.study - INFO - Trial 35 finished with value: 0.03541445980257719 and parameters: {'n_layers': 1, 'embedding_dim': 96, 'lr': 0.0012297530674507207, 'lambda_val': 2.5871967821600955e-06, 'batch_size': 2194, 'optimizer': 'RMSprop'}. Best is trial 0 with value: 0.03967331763151042.
2026-05-09 21:23:09,573 - optuna.study._optimize - INFO - Trial 36 pruned. 
2026-05-09 21:23:10,657 - optuna.study._optimize - INFO - Trial 37 pruned. 
2026-05-09 21:23:11,807 - optuna.study._optimize - INFO - Trial 38 pruned. 
2026-05-09 21:23:13,446 - optuna.study._optimize - INFO - Trial 39 pruned. 
2026-05-09 21:23:14,441 - optuna.study._optimize - INFO - Trial 40 pruned. 
2026-05-09 21:23:15,733 - optuna.study._optimize - INFO - Trial 41 pruned. 
2026-05-09 21:23:16,827 - optuna.study._optimize - INFO - Trial 42 pruned. 
2026-05-09 21:23:18,010 - optuna.study._optimize - INFO - Trial 43 pruned. 
2026-05-09 21:23:19,436 - optuna.study._optimize - INFO - Trial 44 pruned. 
2026-05-09 21:23:20,465 - optuna.study._optimize - INFO - Trial 45 pruned. 
2026-05-09 21:23:21,603 - optuna.study._optimize - INFO - Trial 46 pruned. 
2026-05-09 21:23:22,724 - optuna.study._optimize - INFO - Trial 47 pruned. 
2026-05-09 21:23:58,175 - optuna.study.study - INFO - Trial 48 finished with value: 0.04339636351537917 and parameters: {'n_layers': 1, 'embedding_dim': 256, 'lr': 0.0014025882198832624, 'lambda_val': 3.111217661454053e-05, 'batch_size': 2516, 'optimizer': 'Adam'}. Best is trial 48 with value: 0.04339636351537917.
2026-05-09 21:23:59,169 - optuna.study._optimize - INFO - Trial 49 pruned. 
2026-05-09 21:24:00,498 - optuna.study._optimize - INFO - Trial 50 pruned. 
2026-05-09 21:24:01,518 - optuna.study._optimize - INFO - Trial 51 pruned. 
2026-05-09 21:24:02,614 - optuna.study._optimize - INFO - Trial 52 pruned. 
2026-05-09 21:24:38,925 - optuna.study.study - INFO - Trial 53 finished with value: 0.055118926113818245 and parameters: {'n_layers': 1, 'embedding_dim': 256, 'lr': 0.007679842727911722, 'lambda_val': 7.902400968173864e-05, 'batch_size': 2450, 'optimizer': 'Adam'}. Best is trial 53 with value: 0.055118926113818245.
2026-05-09 21:24:39,998 - optuna.study._optimize - INFO - Trial 54 pruned. 
2026-05-09 21:24:40,886 - optuna.study._optimize - INFO - Trial 55 pruned. 
2026-05-09 21:24:42,047 - optuna.study._optimize - INFO - Trial 56 pruned. 
2026-05-09 21:24:43,172 - optuna.study._optimize - INFO - Trial 57 pruned. 
2026-05-09 21:24:44,499 - optuna.study._optimize - INFO - Trial 58 pruned. 
2026-05-09 21:24:45,479 - optuna.study._optimize - INFO - Trial 59 pruned. 
2026-05-09 21:24:47,273 - optuna.study._optimize - INFO - Trial 60 pruned. 
2026-05-09 21:24:48,238 - optuna.study._optimize - INFO - Trial 61 pruned. 
2026-05-09 21:24:49,690 - optuna.study._optimize - INFO - Trial 62 pruned. 
2026-05-09 21:24:50,688 - optuna.study._optimize - INFO - Trial 63 pruned. 
2026-05-09 21:24:51,681 - optuna.study._optimize - INFO - Trial 64 pruned. 
2026-05-09 21:24:53,093 - optuna.study._optimize - INFO - Trial 65 pruned. 
2026-05-09 21:24:54,186 - optuna.study._optimize - INFO - Trial 66 pruned. 
2026-05-09 21:24:55,356 - optuna.study._optimize - INFO - Trial 67 pruned. 
2026-05-09 21:24:56,463 - optuna.study._optimize - INFO - Trial 68 pruned. 
2026-05-09 21:24:58,094 - optuna.study._optimize - INFO - Trial 69 pruned. 
2026-05-09 21:24:59,158 - optuna.study._optimize - INFO - Trial 70 pruned. 
2026-05-09 21:25:00,477 - optuna.study._optimize - INFO - Trial 71 pruned. 
2026-05-09 21:25:02,041 - optuna.study._optimize - INFO - Trial 72 pruned. 
2026-05-09 21:25:03,029 - optuna.study._optimize - INFO - Trial 73 pruned. 
2026-05-09 21:25:04,338 - optuna.study._optimize - INFO - Trial 74 pruned. 
2026-05-09 21:25:05,247 - optuna.study._optimize - INFO - Trial 75 pruned. 
2026-05-09 21:25:06,217 - optuna.study._optimize - INFO - Trial 76 pruned. 
2026-05-09 21:25:07,867 - optuna.study._optimize - INFO - Trial 77 pruned. 
2026-05-09 21:25:09,359 - optuna.study._optimize - INFO - Trial 78 pruned. 
2026-05-09 21:25:10,419 - optuna.study._optimize - INFO - Trial 79 pruned. 
2026-05-09 21:25:11,523 - optuna.study._optimize - INFO - Trial 80 pruned. 
2026-05-09 21:25:12,619 - optuna.study._optimize - INFO - Trial 81 pruned. 
2026-05-09 21:25:13,816 - optuna.study._optimize - INFO - Trial 82 pruned. 
2026-05-09 21:25:14,879 - optuna.study._optimize - INFO - Trial 83 pruned. 
2026-05-09 21:25:16,909 - optuna.study._optimize - INFO - Trial 84 pruned. 
2026-05-09 21:25:17,907 - optuna.study._optimize - INFO - Trial 85 pruned. 
2026-05-09 21:25:19,751 - optuna.study._optimize - INFO - Trial 86 pruned. 
2026-05-09 21:25:20,811 - optuna.study._optimize - INFO - Trial 87 pruned. 
2026-05-09 21:25:21,904 - optuna.study._optimize - INFO - Trial 88 pruned. 
2026-05-09 21:25:22,996 - optuna.study._optimize - INFO - Trial 89 pruned. 
2026-05-09 21:25:24,497 - optuna.study._optimize - INFO - Trial 90 pruned. 
2026-05-09 21:25:26,220 - optuna.study._optimize - INFO - Trial 91 pruned. 
2026-05-09 21:25:27,401 - optuna.study._optimize - INFO - Trial 92 pruned. 
2026-05-09 21:25:28,533 - optuna.study._optimize - INFO - Trial 93 pruned. 
2026-05-09 21:25:29,634 - optuna.study._optimize - INFO - Trial 94 pruned. 
2026-05-09 21:25:31,079 - optuna.study._optimize - INFO - Trial 95 pruned. 
2026-05-09 21:25:32,522 - optuna.study._optimize - INFO - Trial 96 pruned. 
2026-05-09 21:25:33,476 - optuna.study._optimize - INFO - Trial 97 pruned. 
2026-05-09 21:25:34,839 - optuna.study._optimize - INFO - Trial 98 pruned. 
2026-05-09 21:25:36,529 - optuna.study._optimize - INFO - Trial 99 pruned. 
2026-05-09 21:26:06,189 - root - INFO -   **** Training e_100K_1c3dcs_rand1
2026-05-09 21:26:06,201 - root - INFO -   **** Getting 56335/65410 random edges
2026-05-09 21:26:06,318 - optuna.storages._rdb.storage - INFO - A new study created in RDB with name: Study_e_100K_1c3dcs_rand1
2026-05-09 21:26:49,859 - optuna.study.study - INFO - Trial 0 finished with value: 0.020012256991540644 and parameters: {'n_layers': 4, 'embedding_dim': 128, 'lr': 0.0013491210530874019, 'lambda_val': 0.00015561517777047334, 'batch_size': 1128, 'optimizer': 'Adam'}. Best is trial 0 with value: 0.020012256991540644.
2026-05-09 21:27:29,643 - optuna.study.study - INFO - Trial 1 finished with value: 0.032607666814716836 and parameters: {'n_layers': 1, 'embedding_dim': 32, 'lr': 0.009405980032672288, 'lambda_val': 9.37918010920692e-05, 'batch_size': 3471, 'optimizer': 'RMSprop'}. Best is trial 1 with value: 0.032607666814716836.
2026-05-09 21:28:03,263 - optuna.study.study - INFO - Trial 2 finished with value: 0.0011261725868543786 and parameters: {'n_layers': 2, 'embedding_dim': 128, 'lr': 0.0028170878496408063, 'lambda_val': 0.019728902698278573, 'batch_size': 3036, 'optimizer': 'SGD'}. Best is trial 1 with value: 0.032607666814716836.
2026-05-09 21:28:36,454 - optuna.study.study - INFO - Trial 3 finished with value: 0.024889206919306447 and parameters: {'n_layers': 3, 'embedding_dim': 64, 'lr': 0.00019153083285574805, 'lambda_val': 5.3290015666629194e-06, 'batch_size': 1295, 'optimizer': 'Adam'}. Best is trial 1 with value: 0.032607666814716836.
2026-05-09 21:29:09,205 - optuna.study.study - INFO - Trial 4 finished with value: 0.05160730533315384 and parameters: {'n_layers': 1, 'embedding_dim': 256, 'lr': 0.008594955072601421, 'lambda_val': 2.4853162744703307e-05, 'batch_size': 610, 'optimizer': 'RMSprop'}. Best is trial 4 with value: 0.05160730533315384.
2026-05-09 21:29:10,154 - optuna.study._optimize - INFO - Trial 5 pruned. 
2026-05-09 21:29:11,097 - optuna.study._optimize - INFO - Trial 6 pruned. 
2026-05-09 21:29:12,306 - optuna.study._optimize - INFO - Trial 7 pruned. 
2026-05-09 21:29:13,692 - optuna.study._optimize - INFO - Trial 8 pruned. 
2026-05-09 21:29:14,579 - optuna.study._optimize - INFO - Trial 9 pruned. 
2026-05-09 21:29:55,101 - optuna.study.study - INFO - Trial 10 finished with value: 0.009484855305816164 and parameters: {'n_layers': 2, 'embedding_dim': 256, 'lr': 0.07253574111929455, 'lambda_val': 9.375635241231002e-06, 'batch_size': 549, 'optimizer': 'RMSprop'}. Best is trial 4 with value: 0.05160730533315384.
2026-05-09 21:29:56,551 - optuna.study._optimize - INFO - Trial 11 pruned. 
2026-05-09 21:30:30,916 - optuna.study.study - INFO - Trial 12 finished with value: 0.080718242851006 and parameters: {'n_layers': 1, 'embedding_dim': 256, 'lr': 0.011571145616501024, 'lambda_val': 0.0016229526228668863, 'batch_size': 3010, 'optimizer': 'RMSprop'}. Best is trial 12 with value: 0.080718242851006.
2026-05-09 21:31:04,326 - optuna.study.study - INFO - Trial 13 finished with value: 0.08879461902849796 and parameters: {'n_layers': 1, 'embedding_dim': 256, 'lr': 0.011239144850338915, 'lambda_val': 0.0021144786935499127, 'batch_size': 2085, 'optimizer': 'RMSprop'}. Best is trial 13 with value: 0.08879461902849796.
2026-05-09 21:31:06,130 - optuna.study._optimize - INFO - Trial 14 pruned. 
2026-05-09 21:31:07,901 - optuna.study._optimize - INFO - Trial 15 pruned. 
2026-05-09 21:31:08,937 - optuna.study._optimize - INFO - Trial 16 pruned. 
2026-05-09 21:31:09,930 - optuna.study._optimize - INFO - Trial 17 pruned. 
2026-05-09 21:31:11,684 - optuna.study._optimize - INFO - Trial 18 pruned. 
2026-05-09 21:31:12,572 - optuna.study._optimize - INFO - Trial 19 pruned. 
2026-05-09 21:31:13,968 - optuna.study._optimize - INFO - Trial 20 pruned. 
2026-05-09 21:31:14,922 - optuna.study._optimize - INFO - Trial 21 pruned. 
2026-05-09 21:31:52,094 - optuna.study.study - INFO - Trial 22 finished with value: 0.07921164600971635 and parameters: {'n_layers': 1, 'embedding_dim': 256, 'lr': 0.01641553239019347, 'lambda_val': 0.0004366183275726986, 'batch_size': 1587, 'optimizer': 'RMSprop'}. Best is trial 13 with value: 0.08879461902849796.
2026-05-09 21:31:53,893 - optuna.study._optimize - INFO - Trial 23 pruned. 
2026-05-09 21:31:55,818 - optuna.study._optimize - INFO - Trial 24 pruned. 
2026-05-09 21:31:56,873 - optuna.study._optimize - INFO - Trial 25 pruned. 
2026-05-09 21:31:57,794 - optuna.study._optimize - INFO - Trial 26 pruned. 
2026-05-09 21:31:58,682 - optuna.study._optimize - INFO - Trial 27 pruned. 
2026-05-09 21:31:59,702 - optuna.study._optimize - INFO - Trial 28 pruned. 
2026-05-09 21:32:00,689 - optuna.study._optimize - INFO - Trial 29 pruned. 
2026-05-09 21:32:05,450 - optuna.study._optimize - INFO - Trial 30 pruned. 
2026-05-09 21:32:06,461 - optuna.study._optimize - INFO - Trial 31 pruned. 
2026-05-09 21:32:52,119 - optuna.study.study - INFO - Trial 32 finished with value: 0.07933506598121504 and parameters: {'n_layers': 1, 'embedding_dim': 256, 'lr': 0.012250644392617418, 'lambda_val': 0.00036801095980080236, 'batch_size': 1441, 'optimizer': 'RMSprop'}. Best is trial 13 with value: 0.08879461902849796.
2026-05-09 21:32:53,548 - optuna.study._optimize - INFO - Trial 33 pruned. 
2026-05-09 21:32:54,612 - optuna.study._optimize - INFO - Trial 34 pruned. 
2026-05-09 21:32:55,930 - optuna.study._optimize - INFO - Trial 35 pruned. 
2026-05-09 21:32:57,794 - optuna.study._optimize - INFO - Trial 36 pruned. 
2026-05-09 21:32:58,802 - optuna.study._optimize - INFO - Trial 37 pruned. 
2026-05-09 21:33:00,133 - optuna.study._optimize - INFO - Trial 38 pruned. 
2026-05-09 21:33:01,120 - optuna.study._optimize - INFO - Trial 39 pruned. 
2026-05-09 21:33:02,029 - optuna.study._optimize - INFO - Trial 40 pruned. 
2026-05-09 21:33:04,235 - optuna.study._optimize - INFO - Trial 41 pruned. 
2026-05-09 21:33:10,516 - optuna.study._optimize - INFO - Trial 42 pruned. 
2026-05-09 21:33:11,438 - optuna.study._optimize - INFO - Trial 43 pruned. 
2026-05-09 21:33:14,468 - optuna.study._optimize - INFO - Trial 44 pruned. 
2026-05-09 21:33:15,521 - optuna.study._optimize - INFO - Trial 45 pruned. 
2026-05-09 21:33:22,646 - optuna.study._optimize - INFO - Trial 46 pruned. 
2026-05-09 21:33:23,738 - optuna.study._optimize - INFO - Trial 47 pruned. 
2026-05-09 21:33:25,185 - optuna.study._optimize - INFO - Trial 48 pruned. 
2026-05-09 21:33:26,653 - optuna.study._optimize - INFO - Trial 49 pruned. 
2026-05-09 21:33:30,153 - optuna.study._optimize - INFO - Trial 50 pruned. 
2026-05-09 21:33:33,062 - optuna.study._optimize - INFO - Trial 51 pruned. 
2026-05-09 21:33:33,949 - optuna.study._optimize - INFO - Trial 52 pruned. 
2026-05-09 21:33:34,897 - optuna.study._optimize - INFO - Trial 53 pruned. 
2026-05-09 21:33:36,023 - optuna.study._optimize - INFO - Trial 54 pruned. 
2026-05-09 21:33:37,802 - optuna.study._optimize - INFO - Trial 55 pruned. 
2026-05-09 21:33:39,595 - optuna.study._optimize - INFO - Trial 56 pruned. 
2026-05-09 21:33:41,828 - optuna.study._optimize - INFO - Trial 57 pruned. 
2026-05-09 21:33:42,932 - optuna.study._optimize - INFO - Trial 58 pruned. 
2026-05-09 21:33:43,967 - optuna.study._optimize - INFO - Trial 59 pruned. 
2026-05-09 21:33:45,176 - optuna.study._optimize - INFO - Trial 60 pruned. 
2026-05-09 21:33:46,329 - optuna.study._optimize - INFO - Trial 61 pruned. 
