2026-05-09 17:49:31,041 - optuna.study._optimize - INFO - Trial 24 pruned. 
2026-05-09 17:49:32,386 - optuna.study._optimize - INFO - Trial 25 pruned. 
2026-05-09 17:49:34,363 - optuna.study._optimize - INFO - Trial 26 pruned. 
2026-05-09 17:49:36,186 - optuna.study._optimize - INFO - Trial 27 pruned. 
2026-05-09 17:49:37,684 - optuna.study._optimize - INFO - Trial 28 pruned. 
2026-05-09 17:49:38,808 - optuna.study._optimize - INFO - Trial 29 pruned. 
2026-05-09 17:49:39,922 - optuna.study._optimize - INFO - Trial 30 pruned. 
2026-05-09 17:49:46,632 - optuna.study._optimize - INFO - Trial 31 pruned. 
2026-05-09 17:50:23,873 - optuna.study.study - INFO - Trial 32 finished with value: 0.015794726571507187 and parameters: {'n_layers': 3, 'embedding_dim': 96, 'lr': 0.06217409034906103, 'lambda_val': 7.561280861950275e-06, 'batch_size': 1464, 'optimizer': 'RMSprop'}. Best is trial 19 with value: 0.033713660369335235.
2026-05-09 17:50:25,462 - optuna.study._optimize - INFO - Trial 33 pruned. 
2026-05-09 17:50:26,465 - optuna.study._optimize - INFO - Trial 34 pruned. 
2026-05-09 17:50:28,172 - optuna.study._optimize - INFO - Trial 35 pruned. 
2026-05-09 17:51:19,561 - optuna.study.study - INFO - Trial 36 finished with value: 0.014673040115272613 and parameters: {'n_layers': 4, 'embedding_dim': 64, 'lr': 0.019773773665456636, 'lambda_val': 1.864619888521625e-06, 'batch_size': 2726, 'optimizer': 'RMSprop'}. Best is trial 19 with value: 0.033713660369335235.
2026-05-09 17:51:20,473 - optuna.study._optimize - INFO - Trial 37 pruned. 
2026-05-09 17:52:00,235 - optuna.study.study - INFO - Trial 38 finished with value: 0.029886547532505515 and parameters: {'n_layers': 3, 'embedding_dim': 96, 'lr': 0.038500255416832996, 'lambda_val': 0.0006830452216796627, 'batch_size': 708, 'optimizer': 'RMSprop'}. Best is trial 19 with value: 0.033713660369335235.
2026-05-09 17:52:01,280 - optuna.study._optimize - INFO - Trial 39 pruned. 
2026-05-09 17:52:02,216 - optuna.study._optimize - INFO - Trial 40 pruned. 
2026-05-09 17:52:39,748 - optuna.study.study - INFO - Trial 41 finished with value: 0.03105725282201378 and parameters: {'n_layers': 3, 'embedding_dim': 96, 'lr': 0.034787503714737454, 'lambda_val': 0.00022871414168037683, 'batch_size': 1003, 'optimizer': 'RMSprop'}. Best is trial 19 with value: 0.033713660369335235.
2026-05-09 17:53:15,194 - optuna.study.study - INFO - Trial 42 finished with value: 0.03723249405847388 and parameters: {'n_layers': 3, 'embedding_dim': 96, 'lr': 0.0641456389520386, 'lambda_val': 0.00020401348411150564, 'batch_size': 933, 'optimizer': 'RMSprop'}. Best is trial 42 with value: 0.03723249405847388.
2026-05-09 17:53:16,742 - optuna.study._optimize - INFO - Trial 43 pruned. 
2026-05-09 17:53:21,303 - optuna.study._optimize - INFO - Trial 44 pruned. 
2026-05-09 17:54:19,450 - optuna.study.study - INFO - Trial 45 finished with value: 0.030968485999664307 and parameters: {'n_layers': 3, 'embedding_dim': 256, 'lr': 0.07355986706139737, 'lambda_val': 0.00030819792763713715, 'batch_size': 985, 'optimizer': 'RMSprop'}. Best is trial 42 with value: 0.03723249405847388.
2026-05-09 17:55:09,856 - optuna.study.study - INFO - Trial 46 finished with value: 0.03192027940472379 and parameters: {'n_layers': 3, 'embedding_dim': 256, 'lr': 0.07385255592880662, 'lambda_val': 0.0003111506778920229, 'batch_size': 1001, 'optimizer': 'RMSprop'}. Best is trial 42 with value: 0.03723249405847388.
2026-05-09 17:56:08,073 - optuna.study.study - INFO - Trial 47 finished with value: 0.02575529562996308 and parameters: {'n_layers': 4, 'embedding_dim': 256, 'lr': 0.08909425002259665, 'lambda_val': 0.0002990732735450255, 'batch_size': 1413, 'optimizer': 'RMSprop'}. Best is trial 42 with value: 0.03723249405847388.
2026-05-09 17:56:09,018 - optuna.study._optimize - INFO - Trial 48 pruned. 
2026-05-09 17:56:10,043 - optuna.study._optimize - INFO - Trial 49 pruned. 
2026-05-09 17:57:13,285 - optuna.study.study - INFO - Trial 50 finished with value: 0.015018723373689624 and parameters: {'n_layers': 4, 'embedding_dim': 256, 'lr': 0.09190972268041755, 'lambda_val': 0.001582120444858969, 'batch_size': 1116, 'optimizer': 'RMSprop'}. Best is trial 42 with value: 0.03723249405847388.
2026-05-09 17:58:03,780 - optuna.study.study - INFO - Trial 51 finished with value: 0.034702633466049876 and parameters: {'n_layers': 3, 'embedding_dim': 256, 'lr': 0.03624272743368411, 'lambda_val': 0.0006586894066915131, 'batch_size': 684, 'optimizer': 'RMSprop'}. Best is trial 42 with value: 0.03723249405847388.
2026-05-09 17:58:54,560 - optuna.study.study - INFO - Trial 52 finished with value: 0.03167683389538915 and parameters: {'n_layers': 3, 'embedding_dim': 256, 'lr': 0.029487891569598117, 'lambda_val': 6.458480088971744e-05, 'batch_size': 1429, 'optimizer': 'RMSprop'}. Best is trial 42 with value: 0.03723249405847388.
2026-05-09 17:59:45,563 - optuna.study.study - INFO - Trial 53 finished with value: 0.024977516369350947 and parameters: {'n_layers': 3, 'embedding_dim': 256, 'lr': 0.02924926580736497, 'lambda_val': 6.840418344931266e-05, 'batch_size': 559, 'optimizer': 'RMSprop'}. Best is trial 42 with value: 0.03723249405847388.
2026-05-09 17:59:46,553 - optuna.study._optimize - INFO - Trial 54 pruned. 
2026-05-09 18:00:37,601 - optuna.study.study - INFO - Trial 55 finished with value: 0.02856229190180186 and parameters: {'n_layers': 3, 'embedding_dim': 256, 'lr': 0.01792828127128521, 'lambda_val': 0.001115242571565089, 'batch_size': 1591, 'optimizer': 'RMSprop'}. Best is trial 42 with value: 0.03723249405847388.
2026-05-09 18:01:35,099 - optuna.study.study - INFO - Trial 56 finished with value: 0.031078637059052717 and parameters: {'n_layers': 3, 'embedding_dim': 256, 'lr': 0.03517659006007389, 'lambda_val': 0.00041855075966674705, 'batch_size': 826, 'optimizer': 'RMSprop'}. Best is trial 42 with value: 0.03723249405847388.
2026-05-09 18:02:26,733 - optuna.study.study - INFO - Trial 57 finished with value: 0.03791041192847666 and parameters: {'n_layers': 3, 'embedding_dim': 256, 'lr': 0.024372607581660016, 'lambda_val': 0.0004911847535827615, 'batch_size': 829, 'optimizer': 'RMSprop'}. Best is trial 57 with value: 0.03791041192847666.
2026-05-09 18:02:27,655 - optuna.study._optimize - INFO - Trial 58 pruned. 
2026-05-09 18:02:28,644 - optuna.study._optimize - INFO - Trial 59 pruned. 
2026-05-09 18:02:30,206 - optuna.study._optimize - INFO - Trial 60 pruned. 
2026-05-09 18:03:20,671 - optuna.study.study - INFO - Trial 61 finished with value: 0.03265074776535336 and parameters: {'n_layers': 3, 'embedding_dim': 256, 'lr': 0.047635415617254026, 'lambda_val': 0.0004041922151854043, 'batch_size': 839, 'optimizer': 'RMSprop'}. Best is trial 57 with value: 0.03791041192847666.
2026-05-09 18:04:11,577 - optuna.study.study - INFO - Trial 62 finished with value: 0.02539186133849106 and parameters: {'n_layers': 3, 'embedding_dim': 256, 'lr': 0.052579695804329855, 'lambda_val': 0.0016714809542050686, 'batch_size': 880, 'optimizer': 'RMSprop'}. Best is trial 57 with value: 0.03791041192847666.
2026-05-09 18:05:02,826 - optuna.study.study - INFO - Trial 63 finished with value: 0.041201820007524516 and parameters: {'n_layers': 3, 'embedding_dim': 256, 'lr': 0.015843188754113408, 'lambda_val': 0.00012134581337554393, 'batch_size': 1414, 'optimizer': 'RMSprop'}. Best is trial 63 with value: 0.041201820007524516.
2026-05-09 18:05:53,944 - optuna.study.study - INFO - Trial 64 finished with value: 0.0333699926750646 and parameters: {'n_layers': 3, 'embedding_dim': 256, 'lr': 0.02237803053677936, 'lambda_val': 0.000506014640619636, 'batch_size': 1115, 'optimizer': 'RMSprop'}. Best is trial 63 with value: 0.041201820007524516.
2026-05-09 18:06:44,712 - optuna.study.study - INFO - Trial 65 finished with value: 0.02907699181812981 and parameters: {'n_layers': 3, 'embedding_dim': 256, 'lr': 0.020290452765367714, 'lambda_val': 0.0009673254206822725, 'batch_size': 1145, 'optimizer': 'RMSprop'}. Best is trial 63 with value: 0.041201820007524516.
2026-05-09 18:06:45,718 - optuna.study._optimize - INFO - Trial 66 pruned. 
2026-05-09 18:06:46,694 - optuna.study._optimize - INFO - Trial 67 pruned. 
2026-05-09 18:06:47,812 - optuna.study._optimize - INFO - Trial 68 pruned. 
2026-05-09 18:06:49,095 - optuna.study._optimize - INFO - Trial 69 pruned. 
2026-05-09 18:06:50,346 - optuna.study._optimize - INFO - Trial 70 pruned. 
2026-05-09 18:06:51,624 - optuna.study._optimize - INFO - Trial 71 pruned. 
2026-05-09 18:07:42,841 - optuna.study.study - INFO - Trial 72 finished with value: 0.03244060949617613 and parameters: {'n_layers': 3, 'embedding_dim': 256, 'lr': 0.0760878169446907, 'lambda_val': 0.000491094128874358, 'batch_size': 907, 'optimizer': 'RMSprop'}. Best is trial 63 with value: 0.041201820007524516.
2026-05-09 18:08:37,775 - optuna.study.study - INFO - Trial 73 finished with value: 0.02729052945607993 and parameters: {'n_layers': 3, 'embedding_dim': 256, 'lr': 0.047404213840535336, 'lambda_val': 0.0012774875594195895, 'batch_size': 1214, 'optimizer': 'RMSprop'}. Best is trial 63 with value: 0.041201820007524516.
2026-05-09 18:08:43,026 - optuna.study._optimize - INFO - Trial 74 pruned. 
2026-05-09 18:09:34,029 - optuna.study.study - INFO - Trial 75 finished with value: 0.006550721531739615 and parameters: {'n_layers': 3, 'embedding_dim': 256, 'lr': 0.0998638080088952, 'lambda_val': 4.829449488184774e-05, 'batch_size': 823, 'optimizer': 'RMSprop'}. Best is trial 63 with value: 0.041201820007524516.
2026-05-09 18:09:35,135 - optuna.study._optimize - INFO - Trial 76 pruned. 
2026-05-09 18:10:26,087 - optuna.study.study - INFO - Trial 77 finished with value: 0.027631935021203965 and parameters: {'n_layers': 3, 'embedding_dim': 256, 'lr': 0.03350640488197273, 'lambda_val': 9.974372440419792e-05, 'batch_size': 592, 'optimizer': 'RMSprop'}. Best is trial 63 with value: 0.041201820007524516.
2026-05-09 18:10:27,084 - optuna.study._optimize - INFO - Trial 78 pruned. 
2026-05-09 18:10:28,191 - optuna.study._optimize - INFO - Trial 79 pruned. 
2026-05-09 18:11:19,244 - optuna.study.study - INFO - Trial 80 finished with value: 0.03343350527530918 and parameters: {'n_layers': 3, 'embedding_dim': 256, 'lr': 0.014227890457425023, 'lambda_val': 0.00071460915879639, 'batch_size': 1093, 'optimizer': 'RMSprop'}. Best is trial 63 with value: 0.041201820007524516.
2026-05-09 18:12:09,858 - optuna.study.study - INFO - Trial 81 finished with value: 0.033667495867599255 and parameters: {'n_layers': 3, 'embedding_dim': 256, 'lr': 0.01700468003800804, 'lambda_val': 0.000718583665763842, 'batch_size': 927, 'optimizer': 'RMSprop'}. Best is trial 63 with value: 0.041201820007524516.
2026-05-09 18:12:11,375 - optuna.study._optimize - INFO - Trial 82 pruned. 
2026-05-09 18:12:12,186 - optuna.study._optimize - INFO - Trial 83 pruned. 
2026-05-09 18:12:13,515 - optuna.study._optimize - INFO - Trial 84 pruned. 
2026-05-09 18:12:14,468 - optuna.study._optimize - INFO - Trial 85 pruned. 
2026-05-09 18:12:15,920 - optuna.study._optimize - INFO - Trial 86 pruned. 
2026-05-09 18:12:16,972 - optuna.study._optimize - INFO - Trial 87 pruned. 
2026-05-09 18:12:18,345 - optuna.study._optimize - INFO - Trial 88 pruned. 
2026-05-09 18:12:19,440 - optuna.study._optimize - INFO - Trial 89 pruned. 
2026-05-09 18:12:20,758 - optuna.study._optimize - INFO - Trial 90 pruned. 
2026-05-09 18:13:11,934 - optuna.study.study - INFO - Trial 91 finished with value: 0.03158952719134411 and parameters: {'n_layers': 3, 'embedding_dim': 256, 'lr': 0.05745190759258384, 'lambda_val': 0.00044738762110243217, 'batch_size': 912, 'optimizer': 'RMSprop'}. Best is trial 63 with value: 0.041201820007524516.
2026-05-09 18:14:02,992 - optuna.study.study - INFO - Trial 92 finished with value: 0.03487212776982755 and parameters: {'n_layers': 3, 'embedding_dim': 256, 'lr': 0.03113161071419044, 'lambda_val': 0.0005440343944990741, 'batch_size': 870, 'optimizer': 'RMSprop'}. Best is trial 63 with value: 0.041201820007524516.
2026-05-09 18:14:54,436 - optuna.study.study - INFO - Trial 93 finished with value: 0.03753311042467048 and parameters: {'n_layers': 3, 'embedding_dim': 256, 'lr': 0.03695277427475215, 'lambda_val': 0.00025265264875526166, 'batch_size': 1352, 'optimizer': 'RMSprop'}. Best is trial 63 with value: 0.041201820007524516.
2026-05-09 18:15:45,256 - optuna.study.study - INFO - Trial 94 finished with value: 0.03940882641835107 and parameters: {'n_layers': 3, 'embedding_dim': 256, 'lr': 0.03536821235885078, 'lambda_val': 0.0002680912413925616, 'batch_size': 1381, 'optimizer': 'RMSprop'}. Best is trial 63 with value: 0.041201820007524516.
2026-05-09 18:15:46,197 - optuna.study._optimize - INFO - Trial 95 pruned. 
2026-05-09 18:15:47,194 - optuna.study._optimize - INFO - Trial 96 pruned. 
2026-05-09 18:15:48,491 - optuna.study._optimize - INFO - Trial 97 pruned. 
2026-05-09 18:15:49,532 - optuna.study._optimize - INFO - Trial 98 pruned. 
2026-05-09 18:15:51,060 - optuna.study._optimize - INFO - Trial 99 pruned. 
2026-05-09 18:16:35,683 - root - INFO -   **** Training e_100K_1c1dcs_rand1
2026-05-09 18:16:35,694 - root - INFO -   **** Getting 53072/65410 random edges
2026-05-09 18:16:36,209 - optuna.storages._rdb.storage - INFO - A new study created in RDB with name: Study_e_100K_1c1dcs_rand1
2026-05-09 18:17:30,272 - optuna.study.study - INFO - Trial 0 finished with value: 0.0026215465555500922 and parameters: {'n_layers': 4, 'embedding_dim': 256, 'lr': 0.00024345977570882222, 'lambda_val': 1.0127809460778294e-06, 'batch_size': 601, 'optimizer': 'SGD'}. Best is trial 0 with value: 0.0026215465555500922.
2026-05-09 18:18:22,756 - optuna.study.study - INFO - Trial 1 finished with value: 0.05205232668484667 and parameters: {'n_layers': 4, 'embedding_dim': 96, 'lr': 3.5615013856454304e-05, 'lambda_val': 0.0009120028229223741, 'batch_size': 3833, 'optimizer': 'RMSprop'}. Best is trial 1 with value: 0.05205232668484667.
2026-05-09 18:18:55,859 - optuna.study.study - INFO - Trial 2 finished with value: 0.031341189813012774 and parameters: {'n_layers': 2, 'embedding_dim': 128, 'lr': 0.0005879561795852783, 'lambda_val': 5.48316393250194e-05, 'batch_size': 1342, 'optimizer': 'Adam'}. Best is trial 1 with value: 0.05205232668484667.
2026-05-09 18:19:26,560 - optuna.study.study - INFO - Trial 3 finished with value: 0.014316884167644412 and parameters: {'n_layers': 2, 'embedding_dim': 32, 'lr': 0.009709055907552775, 'lambda_val': 0.03679858717028766, 'batch_size': 3878, 'optimizer': 'Adam'}. Best is trial 1 with value: 0.05205232668484667.
2026-05-09 18:20:05,889 - optuna.study.study - INFO - Trial 4 finished with value: 0.0026812029031463673 and parameters: {'n_layers': 3, 'embedding_dim': 128, 'lr': 3.052858954159598e-05, 'lambda_val': 7.743545711562972e-05, 'batch_size': 2577, 'optimizer': 'SGD'}. Best is trial 1 with value: 0.05205232668484667.
2026-05-09 18:20:10,954 - optuna.study._optimize - INFO - Trial 5 pruned. 
2026-05-09 18:20:18,911 - optuna.study._optimize - INFO - Trial 6 pruned. 
2026-05-09 18:20:19,831 - optuna.study._optimize - INFO - Trial 7 pruned. 
2026-05-09 18:20:21,282 - optuna.study._optimize - INFO - Trial 8 pruned. 
2026-05-09 18:20:22,914 - optuna.study._optimize - INFO - Trial 9 pruned. 
2026-05-09 18:20:51,822 - optuna.study.study - INFO - Trial 10 finished with value: 0.06528571780659553 and parameters: {'n_layers': 1, 'embedding_dim': 64, 'lr': 0.008034457901309895, 'lambda_val': 0.001178418138979597, 'batch_size': 3978, 'optimizer': 'RMSprop'}. Best is trial 10 with value: 0.06528571780659553.
2026-05-09 18:21:20,137 - optuna.study.study - INFO - Trial 11 finished with value: 0.07063826636071883 and parameters: {'n_layers': 1, 'embedding_dim': 64, 'lr': 0.009354736290051026, 'lambda_val': 0.0013785793767687265, 'batch_size': 4039, 'optimizer': 'RMSprop'}. Best is trial 11 with value: 0.07063826636071883.
2026-05-09 18:21:51,284 - optuna.study.study - INFO - Trial 12 finished with value: 0.06454807463619026 and parameters: {'n_layers': 1, 'embedding_dim': 64, 'lr': 0.02871864772260588, 'lambda_val': 0.0021676419305304865, 'batch_size': 3343, 'optimizer': 'RMSprop'}. Best is trial 11 with value: 0.07063826636071883.
2026-05-09 18:22:20,834 - optuna.study.study - INFO - Trial 13 finished with value: 0.06396167526667795 and parameters: {'n_layers': 1, 'embedding_dim': 64, 'lr': 0.004912330089447791, 'lambda_val': 0.0032467728005001577, 'batch_size': 4051, 'optimizer': 'RMSprop'}. Best is trial 11 with value: 0.07063826636071883.
2026-05-09 18:22:22,752 - optuna.study._optimize - INFO - Trial 14 pruned. 
2026-05-09 18:22:23,763 - optuna.study._optimize - INFO - Trial 15 pruned. 
2026-05-09 18:22:25,374 - optuna.study._optimize - INFO - Trial 16 pruned. 
2026-05-09 18:22:57,423 - optuna.study.study - INFO - Trial 17 finished with value: 0.05849248151906368 and parameters: {'n_layers': 1, 'embedding_dim': 256, 'lr': 0.0021371463197985587, 'lambda_val': 0.00023694351174165313, 'batch_size': 3635, 'optimizer': 'RMSprop'}. Best is trial 11 with value: 0.07063826636071883.
2026-05-09 18:22:58,886 - optuna.study._optimize - INFO - Trial 18 pruned. 
2026-05-09 18:22:59,935 - optuna.study._optimize - INFO - Trial 19 pruned. 
2026-05-09 18:23:27,139 - optuna.study.study - INFO - Trial 20 finished with value: 0.07000365114059898 and parameters: {'n_layers': 1, 'embedding_dim': 64, 'lr': 0.006417311148049912, 'lambda_val': 0.0031764154055812775, 'batch_size': 4018, 'optimizer': 'RMSprop'}. Best is trial 11 with value: 0.07063826636071883.
2026-05-09 18:23:28,136 - optuna.study._optimize - INFO - Trial 21 pruned. 
2026-05-09 18:23:29,111 - optuna.study._optimize - INFO - Trial 22 pruned. 
2026-05-09 18:23:31,329 - optuna.study._optimize - INFO - Trial 23 pruned. 
2026-05-09 18:23:32,445 - optuna.study._optimize - INFO - Trial 24 pruned. 
2026-05-09 18:24:07,338 - optuna.study.study - INFO - Trial 25 finished with value: 0.07470476388625312 and parameters: {'n_layers': 1, 'embedding_dim': 256, 'lr': 0.015041350518799755, 'lambda_val': 0.0012063036658715002, 'batch_size': 4043, 'optimizer': 'RMSprop'}. Best is trial 25 with value: 0.07470476388625312.
2026-05-09 18:24:09,189 - optuna.study._optimize - INFO - Trial 26 pruned. 
2026-05-09 18:24:12,750 - optuna.study._optimize - INFO - Trial 27 pruned. 
2026-05-09 18:24:13,825 - optuna.study._optimize - INFO - Trial 28 pruned. 
2026-05-09 18:24:15,198 - optuna.study._optimize - INFO - Trial 29 pruned. 
2026-05-09 18:24:16,184 - optuna.study._optimize - INFO - Trial 30 pruned. 
2026-05-09 18:24:18,555 - optuna.study._optimize - INFO - Trial 31 pruned. 
2026-05-09 18:24:19,694 - optuna.study._optimize - INFO - Trial 32 pruned. 
2026-05-09 18:24:24,689 - optuna.study._optimize - INFO - Trial 33 pruned. 
2026-05-09 18:24:26,750 - optuna.study._optimize - INFO - Trial 34 pruned. 
2026-05-09 18:24:27,922 - optuna.study._optimize - INFO - Trial 35 pruned. 
2026-05-09 18:24:29,047 - optuna.study._optimize - INFO - Trial 36 pruned. 
2026-05-09 18:24:31,109 - optuna.study._optimize - INFO - Trial 37 pruned. 
2026-05-09 18:24:32,592 - optuna.study._optimize - INFO - Trial 38 pruned. 
2026-05-09 18:24:34,458 - optuna.study._optimize - INFO - Trial 39 pruned. 
2026-05-09 18:24:35,389 - optuna.study._optimize - INFO - Trial 40 pruned. 
2026-05-09 18:24:37,376 - optuna.study._optimize - INFO - Trial 41 pruned. 
2026-05-09 18:24:38,350 - optuna.study._optimize - INFO - Trial 42 pruned. 
2026-05-09 18:24:40,036 - optuna.study._optimize - INFO - Trial 43 pruned. 
2026-05-09 18:24:42,053 - optuna.study._optimize - INFO - Trial 44 pruned. 
2026-05-09 18:24:43,104 - optuna.study._optimize - INFO - Trial 45 pruned. 
2026-05-09 18:24:44,745 - optuna.study._optimize - INFO - Trial 46 pruned. 
2026-05-09 18:24:46,179 - optuna.study._optimize - INFO - Trial 47 pruned. 
2026-05-09 18:24:47,143 - optuna.study._optimize - INFO - Trial 48 pruned. 
2026-05-09 18:24:49,395 - optuna.study._optimize - INFO - Trial 49 pruned. 
2026-05-09 18:24:50,381 - optuna.study._optimize - INFO - Trial 50 pruned. 
2026-05-09 18:24:51,667 - optuna.study._optimize - INFO - Trial 51 pruned. 
2026-05-09 18:24:58,404 - optuna.study._optimize - INFO - Trial 52 pruned. 
2026-05-09 18:24:59,412 - optuna.study._optimize - INFO - Trial 53 pruned. 
2026-05-09 18:25:01,198 - optuna.study._optimize - INFO - Trial 54 pruned. 
2026-05-09 18:25:02,392 - optuna.study._optimize - INFO - Trial 55 pruned. 
2026-05-09 18:25:03,477 - optuna.study._optimize - INFO - Trial 56 pruned. 
2026-05-09 18:25:04,571 - optuna.study._optimize - INFO - Trial 57 pruned. 
2026-05-09 18:25:39,869 - optuna.study.study - INFO - Trial 58 finished with value: 0.07403064385468662 and parameters: {'n_layers': 1, 'embedding_dim': 256, 'lr': 0.007516841938499555, 'lambda_val': 0.0004635337041858887, 'batch_size': 3671, 'optimizer': 'RMSprop'}. Best is trial 25 with value: 0.07470476388625312.
2026-05-09 18:25:41,567 - optuna.study._optimize - INFO - Trial 59 pruned. 
2026-05-09 18:25:43,245 - optuna.study._optimize - INFO - Trial 60 pruned. 
2026-05-09 18:25:44,164 - optuna.study._optimize - INFO - Trial 61 pruned. 
2026-05-09 18:26:24,142 - optuna.study.study - INFO - Trial 62 finished with value: 0.07623265228279848 and parameters: {'n_layers': 1, 'embedding_dim': 256, 'lr': 0.013113561220525509, 'lambda_val': 0.0019223962900736654, 'batch_size': 4096, 'optimizer': 'RMSprop'}. Best is trial 62 with value: 0.07623265228279848.
2026-05-09 18:26:56,620 - optuna.study.study - INFO - Trial 63 finished with value: 0.07886764710679352 and parameters: {'n_layers': 1, 'embedding_dim': 256, 'lr': 0.012502858982556502, 'lambda_val': 0.0006261977886571561, 'batch_size': 1716, 'optimizer': 'RMSprop'}. Best is trial 63 with value: 0.07886764710679352.
2026-05-09 18:26:58,421 - optuna.study._optimize - INFO - Trial 64 pruned. 
2026-05-09 18:26:59,926 - optuna.study._optimize - INFO - Trial 65 pruned. 
