2026-05-09 21:33:47,560 - optuna.study._optimize - INFO - Trial 62 pruned. 
2026-05-09 21:33:54,484 - optuna.study._optimize - INFO - Trial 63 pruned. 
2026-05-09 21:33:59,464 - optuna.study._optimize - INFO - Trial 64 pruned. 
2026-05-09 21:34:00,940 - optuna.study._optimize - INFO - Trial 65 pruned. 
2026-05-09 21:34:01,981 - optuna.study._optimize - INFO - Trial 66 pruned. 
2026-05-09 21:34:03,208 - optuna.study._optimize - INFO - Trial 67 pruned. 
2026-05-09 21:34:04,315 - optuna.study._optimize - INFO - Trial 68 pruned. 
2026-05-09 21:34:05,374 - optuna.study._optimize - INFO - Trial 69 pruned. 
2026-05-09 21:34:06,446 - optuna.study._optimize - INFO - Trial 70 pruned. 
2026-05-09 21:34:07,594 - optuna.study._optimize - INFO - Trial 71 pruned. 
2026-05-09 21:34:08,698 - optuna.study._optimize - INFO - Trial 72 pruned. 
2026-05-09 21:34:09,836 - optuna.study._optimize - INFO - Trial 73 pruned. 
2026-05-09 21:34:11,377 - optuna.study._optimize - INFO - Trial 74 pruned. 
2026-05-09 21:34:14,469 - optuna.study._optimize - INFO - Trial 75 pruned. 
2026-05-09 21:34:15,556 - optuna.study._optimize - INFO - Trial 76 pruned. 
2026-05-09 21:34:16,910 - optuna.study._optimize - INFO - Trial 77 pruned. 
2026-05-09 21:34:17,842 - optuna.study._optimize - INFO - Trial 78 pruned. 
2026-05-09 21:34:19,740 - optuna.study._optimize - INFO - Trial 79 pruned. 
2026-05-09 21:34:20,687 - optuna.study._optimize - INFO - Trial 80 pruned. 
2026-05-09 21:34:24,403 - optuna.study._optimize - INFO - Trial 81 pruned. 
2026-05-09 21:35:13,339 - optuna.study.study - INFO - Trial 82 finished with value: 0.007109220591967819 and parameters: {'n_layers': 3, 'embedding_dim': 256, 'lr': 0.06136226242949284, 'lambda_val': 2.351546493852446e-06, 'batch_size': 570, 'optimizer': 'RMSprop'}. Best is trial 13 with value: 0.08879461902849796.
2026-05-09 21:35:14,329 - optuna.study._optimize - INFO - Trial 83 pruned. 
2026-05-09 21:35:15,709 - optuna.study._optimize - INFO - Trial 84 pruned. 
2026-05-09 21:35:16,835 - optuna.study._optimize - INFO - Trial 85 pruned. 
2026-05-09 21:35:19,011 - optuna.study._optimize - INFO - Trial 86 pruned. 
2026-05-09 21:35:20,878 - optuna.study._optimize - INFO - Trial 87 pruned. 
2026-05-09 21:35:22,024 - optuna.study._optimize - INFO - Trial 88 pruned. 
2026-05-09 21:35:25,842 - optuna.study._optimize - INFO - Trial 89 pruned. 
2026-05-09 21:35:27,850 - optuna.study._optimize - INFO - Trial 90 pruned. 
2026-05-09 21:35:35,469 - optuna.study._optimize - INFO - Trial 91 pruned. 
2026-05-09 21:36:25,270 - optuna.study.study - INFO - Trial 92 finished with value: 0.00898659100783958 and parameters: {'n_layers': 3, 'embedding_dim': 256, 'lr': 0.07484976870316792, 'lambda_val': 2.835190800888601e-06, 'batch_size': 591, 'optimizer': 'RMSprop'}. Best is trial 13 with value: 0.08879461902849796.
2026-05-09 21:37:16,319 - optuna.study.study - INFO - Trial 93 finished with value: 0.0090133492080628 and parameters: {'n_layers': 3, 'embedding_dim': 256, 'lr': 0.06502649183230197, 'lambda_val': 3.312246472729155e-05, 'batch_size': 806, 'optimizer': 'RMSprop'}. Best is trial 13 with value: 0.08879461902849796.
2026-05-09 21:38:06,113 - optuna.study.study - INFO - Trial 94 finished with value: 0.0390816238836485 and parameters: {'n_layers': 3, 'embedding_dim': 256, 'lr': 0.018651277056796162, 'lambda_val': 4.130132100827898e-05, 'batch_size': 789, 'optimizer': 'RMSprop'}. Best is trial 13 with value: 0.08879461902849796.
2026-05-09 21:38:13,680 - optuna.study._optimize - INFO - Trial 95 pruned. 
2026-05-09 21:38:16,366 - optuna.study._optimize - INFO - Trial 96 pruned. 
2026-05-09 21:38:17,392 - optuna.study._optimize - INFO - Trial 97 pruned. 
2026-05-09 21:38:18,478 - optuna.study._optimize - INFO - Trial 98 pruned. 
2026-05-09 21:38:19,673 - optuna.study._optimize - INFO - Trial 99 pruned. 
2026-05-09 21:38:50,056 - root - INFO -   **** Training e_100K_1c3dcs_rand2
2026-05-09 21:38:50,067 - root - INFO -   **** Getting 56335/65410 random edges
2026-05-09 21:38:50,192 - optuna.storages._rdb.storage - INFO - A new study created in RDB with name: Study_e_100K_1c3dcs_rand2
2026-05-09 21:39:20,277 - optuna.study.study - INFO - Trial 0 finished with value: 0.0020690332629240194 and parameters: {'n_layers': 2, 'embedding_dim': 96, 'lr': 5.858449909287137e-05, 'lambda_val': 5.2900307448400125e-05, 'batch_size': 2233, 'optimizer': 'SGD'}. Best is trial 0 with value: 0.0020690332629240194.
2026-05-09 21:40:02,619 - optuna.study.study - INFO - Trial 1 finished with value: 0.018185886731121505 and parameters: {'n_layers': 3, 'embedding_dim': 128, 'lr': 0.016077654415758022, 'lambda_val': 0.013446815277709247, 'batch_size': 880, 'optimizer': 'Adam'}. Best is trial 1 with value: 0.018185886731121505.
2026-05-09 21:40:43,454 - optuna.study.study - INFO - Trial 2 finished with value: 0.0026639999451006464 and parameters: {'n_layers': 4, 'embedding_dim': 64, 'lr': 9.111384973528038e-05, 'lambda_val': 1.7957559993204082e-06, 'batch_size': 2413, 'optimizer': 'SGD'}. Best is trial 1 with value: 0.018185886731121505.
2026-05-09 21:41:21,257 - optuna.study.study - INFO - Trial 3 finished with value: 0.012864635732080812 and parameters: {'n_layers': 2, 'embedding_dim': 32, 'lr': 2.117882342065465e-05, 'lambda_val': 0.00015858123250725204, 'batch_size': 2115, 'optimizer': 'RMSprop'}. Best is trial 1 with value: 0.018185886731121505.
2026-05-09 21:41:49,973 - optuna.study.study - INFO - Trial 4 finished with value: 0.022941189712476728 and parameters: {'n_layers': 2, 'embedding_dim': 32, 'lr': 0.0012230590889447746, 'lambda_val': 3.905925811421984e-06, 'batch_size': 2529, 'optimizer': 'RMSprop'}. Best is trial 4 with value: 0.022941189712476728.
2026-05-09 21:41:50,963 - optuna.study._optimize - INFO - Trial 5 pruned. 
2026-05-09 21:41:52,275 - optuna.study._optimize - INFO - Trial 6 pruned. 
2026-05-09 21:41:53,378 - optuna.study._optimize - INFO - Trial 7 pruned. 
2026-05-09 21:42:37,394 - optuna.study.study - INFO - Trial 8 finished with value: 0.023986701232438998 and parameters: {'n_layers': 4, 'embedding_dim': 128, 'lr': 0.006080127324506698, 'lambda_val': 3.647134017555818e-05, 'batch_size': 1878, 'optimizer': 'Adam'}. Best is trial 8 with value: 0.023986701232438998.
2026-05-09 21:43:18,818 - optuna.study.study - INFO - Trial 9 finished with value: 0.01987450270635635 and parameters: {'n_layers': 4, 'embedding_dim': 96, 'lr': 0.051340103967333114, 'lambda_val': 3.585630168649229e-06, 'batch_size': 2716, 'optimizer': 'RMSprop'}. Best is trial 8 with value: 0.023986701232438998.
2026-05-09 21:43:19,851 - optuna.study._optimize - INFO - Trial 10 pruned. 
2026-05-09 21:43:21,147 - optuna.study._optimize - INFO - Trial 11 pruned. 
2026-05-09 21:43:22,090 - optuna.study._optimize - INFO - Trial 12 pruned. 
2026-05-09 21:44:05,069 - optuna.study.study - INFO - Trial 13 finished with value: 0.03972018527191096 and parameters: {'n_layers': 2, 'embedding_dim': 256, 'lr': 0.005953467988190971, 'lambda_val': 1.417532260568005e-05, 'batch_size': 3274, 'optimizer': 'RMSprop'}. Best is trial 13 with value: 0.03972018527191096.
2026-05-09 21:44:57,311 - optuna.study.study - INFO - Trial 14 finished with value: 0.037251439138616255 and parameters: {'n_layers': 3, 'embedding_dim': 256, 'lr': 0.007720540601117656, 'lambda_val': 2.5569539387038285e-05, 'batch_size': 3363, 'optimizer': 'Adam'}. Best is trial 13 with value: 0.03972018527191096.
2026-05-09 21:45:46,000 - optuna.study.study - INFO - Trial 15 finished with value: 0.04679617134461116 and parameters: {'n_layers': 3, 'embedding_dim': 256, 'lr': 0.007985224694209224, 'lambda_val': 0.00032705090700537945, 'batch_size': 3555, 'optimizer': 'Adam'}. Best is trial 15 with value: 0.04679617134461116.
2026-05-09 21:45:48,027 - optuna.study._optimize - INFO - Trial 16 pruned. 
2026-05-09 21:45:49,046 - optuna.study._optimize - INFO - Trial 17 pruned. 
2026-05-09 21:45:50,320 - optuna.study._optimize - INFO - Trial 18 pruned. 
2026-05-09 21:45:51,855 - optuna.study._optimize - INFO - Trial 19 pruned. 
2026-05-09 21:45:52,772 - optuna.study._optimize - INFO - Trial 20 pruned. 
2026-05-09 21:45:54,078 - optuna.study._optimize - INFO - Trial 21 pruned. 
2026-05-09 21:45:55,010 - optuna.study._optimize - INFO - Trial 22 pruned. 
2026-05-09 21:45:55,996 - optuna.study._optimize - INFO - Trial 23 pruned. 
2026-05-09 21:45:57,558 - optuna.study._optimize - INFO - Trial 24 pruned. 
2026-05-09 21:45:59,026 - optuna.study._optimize - INFO - Trial 25 pruned. 
2026-05-09 21:45:59,946 - optuna.study._optimize - INFO - Trial 26 pruned. 
2026-05-09 21:46:48,169 - optuna.study.study - INFO - Trial 27 finished with value: 0.05563519834563069 and parameters: {'n_layers': 2, 'embedding_dim': 256, 'lr': 0.036548091281065995, 'lambda_val': 0.0005967607009917029, 'batch_size': 3057, 'optimizer': 'Adam'}. Best is trial 27 with value: 0.05563519834563069.
2026-05-09 21:46:49,583 - optuna.study._optimize - INFO - Trial 28 pruned. 
2026-05-09 21:46:51,534 - optuna.study._optimize - INFO - Trial 29 pruned. 
2026-05-09 21:46:52,499 - optuna.study._optimize - INFO - Trial 30 pruned. 
2026-05-09 21:46:53,806 - optuna.study._optimize - INFO - Trial 31 pruned. 
2026-05-09 21:46:54,814 - optuna.study._optimize - INFO - Trial 32 pruned. 
2026-05-09 21:46:55,810 - optuna.study._optimize - INFO - Trial 33 pruned. 
2026-05-09 21:47:31,845 - optuna.study.study - INFO - Trial 34 finished with value: 0.03890042424022034 and parameters: {'n_layers': 3, 'embedding_dim': 64, 'lr': 0.04011274510232419, 'lambda_val': 0.00027822403549055454, 'batch_size': 3757, 'optimizer': 'Adam'}. Best is trial 27 with value: 0.05563519834563069.
2026-05-09 21:47:32,918 - optuna.study._optimize - INFO - Trial 35 pruned. 
2026-05-09 21:47:34,641 - optuna.study._optimize - INFO - Trial 36 pruned. 
2026-05-09 21:47:35,743 - optuna.study._optimize - INFO - Trial 37 pruned. 
2026-05-09 21:47:37,621 - optuna.study._optimize - INFO - Trial 38 pruned. 
2026-05-09 21:47:38,779 - optuna.study._optimize - INFO - Trial 39 pruned. 
2026-05-09 21:47:40,333 - optuna.study._optimize - INFO - Trial 40 pruned. 
2026-05-09 21:47:41,508 - optuna.study._optimize - INFO - Trial 41 pruned. 
2026-05-09 21:47:42,631 - optuna.study._optimize - INFO - Trial 42 pruned. 
2026-05-09 21:47:43,596 - optuna.study._optimize - INFO - Trial 43 pruned. 
2026-05-09 21:47:44,892 - optuna.study._optimize - INFO - Trial 44 pruned. 
2026-05-09 21:48:24,935 - optuna.study.study - INFO - Trial 45 finished with value: 0.03906231505623338 and parameters: {'n_layers': 3, 'embedding_dim': 128, 'lr': 0.0546114347415442, 'lambda_val': 0.0011697345335849362, 'batch_size': 3154, 'optimizer': 'Adam'}. Best is trial 27 with value: 0.05563519834563069.
2026-05-09 21:48:59,263 - optuna.study.study - INFO - Trial 46 finished with value: 0.05110095393776159 and parameters: {'n_layers': 2, 'embedding_dim': 128, 'lr': 0.05736101993637933, 'lambda_val': 0.0011748188544959395, 'batch_size': 3126, 'optimizer': 'RMSprop'}. Best is trial 27 with value: 0.05563519834563069.
2026-05-09 21:49:00,429 - optuna.study._optimize - INFO - Trial 47 pruned. 
2026-05-09 21:49:01,960 - optuna.study._optimize - INFO - Trial 48 pruned. 
2026-05-09 21:49:02,882 - optuna.study._optimize - INFO - Trial 49 pruned. 
2026-05-09 21:49:31,624 - optuna.study.study - INFO - Trial 50 finished with value: 0.0813070407931682 and parameters: {'n_layers': 1, 'embedding_dim': 128, 'lr': 0.03135518334907097, 'lambda_val': 0.000789771726942715, 'batch_size': 2660, 'optimizer': 'RMSprop'}. Best is trial 50 with value: 0.0813070407931682.
2026-05-09 21:50:00,461 - optuna.study.study - INFO - Trial 51 finished with value: 0.08100726791795297 and parameters: {'n_layers': 1, 'embedding_dim': 128, 'lr': 0.03433965209595923, 'lambda_val': 0.0007432854022128304, 'batch_size': 2804, 'optimizer': 'RMSprop'}. Best is trial 50 with value: 0.0813070407931682.
2026-05-09 21:50:29,728 - optuna.study.study - INFO - Trial 52 finished with value: 0.08184249210433038 and parameters: {'n_layers': 1, 'embedding_dim': 128, 'lr': 0.0299901209259668, 'lambda_val': 0.0008716936360841752, 'batch_size': 2639, 'optimizer': 'RMSprop'}. Best is trial 52 with value: 0.08184249210433038.
2026-05-09 21:50:59,197 - optuna.study.study - INFO - Trial 53 finished with value: 0.08311667667587012 and parameters: {'n_layers': 1, 'embedding_dim': 128, 'lr': 0.03368137345930636, 'lambda_val': 0.0007877179223385252, 'batch_size': 2572, 'optimizer': 'RMSprop'}. Best is trial 53 with value: 0.08311667667587012.
2026-05-09 21:51:28,690 - optuna.study.study - INFO - Trial 54 finished with value: 0.08236131321468114 and parameters: {'n_layers': 1, 'embedding_dim': 128, 'lr': 0.033186495958078495, 'lambda_val': 0.0007280806470851664, 'batch_size': 2627, 'optimizer': 'RMSprop'}. Best is trial 53 with value: 0.08311667667587012.
2026-05-09 21:51:58,684 - optuna.study.study - INFO - Trial 55 finished with value: 0.08066466740194436 and parameters: {'n_layers': 1, 'embedding_dim': 128, 'lr': 0.024509786334809908, 'lambda_val': 0.0005583028809060534, 'batch_size': 2625, 'optimizer': 'RMSprop'}. Best is trial 53 with value: 0.08311667667587012.
2026-05-09 21:52:27,097 - optuna.study.study - INFO - Trial 56 finished with value: 0.08176630170707096 and parameters: {'n_layers': 1, 'embedding_dim': 128, 'lr': 0.0235789639844947, 'lambda_val': 0.002730645073605136, 'batch_size': 2260, 'optimizer': 'RMSprop'}. Best is trial 53 with value: 0.08311667667587012.
2026-05-09 21:52:55,753 - optuna.study.study - INFO - Trial 57 finished with value: 0.06916516820516919 and parameters: {'n_layers': 1, 'embedding_dim': 128, 'lr': 0.013237620573786833, 'lambda_val': 0.003638013603824413, 'batch_size': 2201, 'optimizer': 'RMSprop'}. Best is trial 53 with value: 0.08311667667587012.
2026-05-09 21:52:56,797 - optuna.study._optimize - INFO - Trial 58 pruned. 
2026-05-09 21:52:58,466 - optuna.study._optimize - INFO - Trial 59 pruned. 
2026-05-09 21:52:59,626 - optuna.study._optimize - INFO - Trial 60 pruned. 
2026-05-09 21:53:29,245 - optuna.study.study - INFO - Trial 61 finished with value: 0.07966983962405674 and parameters: {'n_layers': 1, 'embedding_dim': 128, 'lr': 0.03116844973315401, 'lambda_val': 0.0017755322477552185, 'batch_size': 2545, 'optimizer': 'RMSprop'}. Best is trial 53 with value: 0.08311667667587012.
2026-05-09 21:53:30,219 - optuna.study._optimize - INFO - Trial 62 pruned. 
2026-05-09 21:53:31,225 - optuna.study._optimize - INFO - Trial 63 pruned. 
2026-05-09 21:53:36,790 - optuna.study._optimize - INFO - Trial 64 pruned. 
2026-05-09 21:53:38,878 - optuna.study._optimize - INFO - Trial 65 pruned. 
2026-05-09 21:53:40,722 - optuna.study._optimize - INFO - Trial 66 pruned. 
2026-05-09 21:54:10,789 - optuna.study.study - INFO - Trial 67 finished with value: 0.08615288809290172 and parameters: {'n_layers': 1, 'embedding_dim': 128, 'lr': 0.019770194976388003, 'lambda_val': 0.0015088024494272973, 'batch_size': 2639, 'optimizer': 'RMSprop'}. Best is trial 67 with value: 0.08615288809290172.
2026-05-09 21:54:40,073 - optuna.study.study - INFO - Trial 68 finished with value: 0.08792481867412022 and parameters: {'n_layers': 1, 'embedding_dim': 128, 'lr': 0.020128264011354494, 'lambda_val': 0.001384797324277196, 'batch_size': 2743, 'optimizer': 'RMSprop'}. Best is trial 68 with value: 0.08792481867412022.
2026-05-09 21:54:41,044 - optuna.study._optimize - INFO - Trial 69 pruned. 
2026-05-09 21:55:10,429 - optuna.study.study - INFO - Trial 70 finished with value: 0.06136456082353293 and parameters: {'n_layers': 1, 'embedding_dim': 128, 'lr': 0.01890393412842456, 'lambda_val': 0.007993650632775592, 'batch_size': 2501, 'optimizer': 'RMSprop'}. Best is trial 68 with value: 0.08792481867412022.
2026-05-09 21:55:40,384 - optuna.study.study - INFO - Trial 71 finished with value: 0.0815886439599493 and parameters: {'n_layers': 1, 'embedding_dim': 128, 'lr': 0.0105333218738796, 'lambda_val': 0.0008701637323060565, 'batch_size': 2765, 'optimizer': 'RMSprop'}. Best is trial 68 with value: 0.08792481867412022.
2026-05-09 21:55:41,835 - optuna.study._optimize - INFO - Trial 72 pruned. 
2026-05-09 21:56:09,840 - optuna.study.study - INFO - Trial 73 finished with value: 0.08152147961962855 and parameters: {'n_layers': 1, 'embedding_dim': 128, 'lr': 0.012466753133991898, 'lambda_val': 0.001858132285175573, 'batch_size': 2286, 'optimizer': 'RMSprop'}. Best is trial 68 with value: 0.08792481867412022.
2026-05-09 21:56:40,289 - optuna.study.study - INFO - Trial 74 finished with value: 0.07928703527108846 and parameters: {'n_layers': 1, 'embedding_dim': 128, 'lr': 0.011798439858001063, 'lambda_val': 0.001990219346803426, 'batch_size': 2321, 'optimizer': 'RMSprop'}. Best is trial 68 with value: 0.08792481867412022.
2026-05-09 21:56:41,849 - optuna.study._optimize - INFO - Trial 75 pruned. 
2026-05-09 21:56:43,034 - optuna.study._optimize - INFO - Trial 76 pruned. 
2026-05-09 21:56:44,220 - optuna.study._optimize - INFO - Trial 77 pruned. 
2026-05-09 21:56:45,936 - optuna.study._optimize - INFO - Trial 78 pruned. 
2026-05-09 21:56:46,911 - optuna.study._optimize - INFO - Trial 79 pruned. 
2026-05-09 21:56:47,931 - optuna.study._optimize - INFO - Trial 80 pruned. 
2026-05-09 21:57:18,048 - optuna.study.study - INFO - Trial 81 finished with value: 0.07783530674014827 and parameters: {'n_layers': 1, 'embedding_dim': 128, 'lr': 0.027343729081287536, 'lambda_val': 0.0008036353374657315, 'batch_size': 2736, 'optimizer': 'RMSprop'}. Best is trial 68 with value: 0.08792481867412022.
2026-05-09 21:57:19,636 - optuna.study._optimize - INFO - Trial 82 pruned. 
2026-05-09 21:57:20,694 - optuna.study._optimize - INFO - Trial 83 pruned. 
2026-05-09 21:57:23,918 - optuna.study._optimize - INFO - Trial 84 pruned. 
2026-05-09 21:57:53,284 - optuna.study.study - INFO - Trial 85 finished with value: 0.08464892011667748 and parameters: {'n_layers': 1, 'embedding_dim': 128, 'lr': 0.026957562188337683, 'lambda_val': 0.0008513616534175612, 'batch_size': 2847, 'optimizer': 'RMSprop'}. Best is trial 68 with value: 0.08792481867412022.
2026-05-09 21:57:54,377 - optuna.study._optimize - INFO - Trial 86 pruned. 
2026-05-09 21:57:55,447 - optuna.study._optimize - INFO - Trial 87 pruned. 
2026-05-09 21:57:56,543 - optuna.study._optimize - INFO - Trial 88 pruned. 
2026-05-09 21:57:58,177 - optuna.study._optimize - INFO - Trial 89 pruned. 
2026-05-09 21:58:00,176 - optuna.study._optimize - INFO - Trial 90 pruned. 
2026-05-09 21:58:01,327 - optuna.study._optimize - INFO - Trial 91 pruned. 
2026-05-09 21:58:03,980 - optuna.study._optimize - INFO - Trial 92 pruned. 
2026-05-09 21:58:05,011 - optuna.study._optimize - INFO - Trial 93 pruned. 
2026-05-09 21:58:35,445 - optuna.study.study - INFO - Trial 94 finished with value: 0.08247020523063582 and parameters: {'n_layers': 1, 'embedding_dim': 128, 'lr': 0.015314189073575325, 'lambda_val': 0.0025357625648583662, 'batch_size': 2871, 'optimizer': 'RMSprop'}. Best is trial 68 with value: 0.08792481867412022.
2026-05-09 21:58:36,457 - optuna.study._optimize - INFO - Trial 95 pruned. 
2026-05-09 21:58:37,455 - optuna.study._optimize - INFO - Trial 96 pruned. 
2026-05-09 21:59:07,614 - optuna.study.study - INFO - Trial 97 finished with value: 0.08725847840863694 and parameters: {'n_layers': 1, 'embedding_dim': 128, 'lr': 0.018573514909233663, 'lambda_val': 0.0020152793082128437, 'batch_size': 3037, 'optimizer': 'RMSprop'}. Best is trial 68 with value: 0.08792481867412022.
2026-05-09 21:59:09,709 - optuna.study._optimize - INFO - Trial 98 pruned. 
2026-05-09 21:59:10,696 - optuna.study._optimize - INFO - Trial 99 pruned. 
2026-05-09 21:59:34,152 - root - INFO -   **** Training e_100K_1c3dcs_rand3
2026-05-09 21:59:34,163 - root - INFO -   **** Getting 56335/65410 random edges
2026-05-09 21:59:34,332 - optuna.storages._rdb.storage - INFO - A new study created in RDB with name: Study_e_100K_1c3dcs_rand3
2026-05-09 22:00:01,089 - optuna.study.study - INFO - Trial 0 finished with value: 0.002528673197400159 and parameters: {'n_layers': 1, 'embedding_dim': 32, 'lr': 0.007872859250673148, 'lambda_val': 0.00037780537400700174, 'batch_size': 2429, 'optimizer': 'SGD'}. Best is trial 0 with value: 0.002528673197400159.
2026-05-09 22:00:41,322 - optuna.study.study - INFO - Trial 1 finished with value: 0.023203153701462153 and parameters: {'n_layers': 3, 'embedding_dim': 32, 'lr': 0.004047795862801091, 'lambda_val': 0.0032725180359078642, 'batch_size': 997, 'optimizer': 'RMSprop'}. Best is trial 1 with value: 0.023203153701462153.
2026-05-09 22:01:16,119 - optuna.study.study - INFO - Trial 2 finished with value: 0.018091305592404665 and parameters: {'n_layers': 4, 'embedding_dim': 32, 'lr': 0.00013423846439254505, 'lambda_val': 1.2243363087689319e-05, 'batch_size': 3503, 'optimizer': 'RMSprop'}. Best is trial 1 with value: 0.023203153701462153.
2026-05-09 22:01:43,782 - optuna.study.study - INFO - Trial 3 finished with value: 0.04521008317074837 and parameters: {'n_layers': 1, 'embedding_dim': 128, 'lr': 0.013017370489761844, 'lambda_val': 2.1372440836388408e-05, 'batch_size': 1352, 'optimizer': 'RMSprop'}. Best is trial 3 with value: 0.04521008317074837.
2026-05-09 22:02:32,994 - optuna.study.study - INFO - Trial 4 finished with value: 0.0023612608897942535 and parameters: {'n_layers': 3, 'embedding_dim': 256, 'lr': 0.07142740345384072, 'lambda_val': 4.1584850836768796e-06, 'batch_size': 2374, 'optimizer': 'SGD'}. Best is trial 3 with value: 0.04521008317074837.
2026-05-09 22:02:33,878 - optuna.study._optimize - INFO - Trial 5 pruned. 
2026-05-09 22:02:34,897 - optuna.study._optimize - INFO - Trial 6 pruned. 
2026-05-09 22:02:37,113 - optuna.study._optimize - INFO - Trial 7 pruned. 
2026-05-09 22:02:42,176 - optuna.study._optimize - INFO - Trial 8 pruned. 
2026-05-09 22:02:43,289 - optuna.study._optimize - INFO - Trial 9 pruned. 
