2026-05-09 18:27:01,715 - optuna.study._optimize - INFO - Trial 66 pruned. 
2026-05-09 18:27:02,712 - optuna.study._optimize - INFO - Trial 67 pruned. 
2026-05-09 18:27:03,840 - optuna.study._optimize - INFO - Trial 68 pruned. 
2026-05-09 18:27:04,935 - optuna.study._optimize - INFO - Trial 69 pruned. 
2026-05-09 18:27:06,152 - optuna.study._optimize - INFO - Trial 70 pruned. 
2026-05-09 18:27:07,851 - optuna.study._optimize - INFO - Trial 71 pruned. 
2026-05-09 18:27:09,550 - optuna.study._optimize - INFO - Trial 72 pruned. 
2026-05-09 18:27:17,095 - optuna.study._optimize - INFO - Trial 73 pruned. 
2026-05-09 18:27:18,640 - optuna.study._optimize - INFO - Trial 74 pruned. 
2026-05-09 18:27:20,635 - optuna.study._optimize - INFO - Trial 75 pruned. 
2026-05-09 18:27:21,757 - optuna.study._optimize - INFO - Trial 76 pruned. 
2026-05-09 18:27:43,072 - optuna.study._optimize - INFO - Trial 77 pruned. 
2026-05-09 18:27:45,506 - optuna.study._optimize - INFO - Trial 78 pruned. 
2026-05-09 18:27:46,554 - optuna.study._optimize - INFO - Trial 79 pruned. 
2026-05-09 18:27:48,514 - optuna.study._optimize - INFO - Trial 80 pruned. 
2026-05-09 18:27:49,978 - optuna.study._optimize - INFO - Trial 81 pruned. 
2026-05-09 18:27:51,514 - optuna.study._optimize - INFO - Trial 82 pruned. 
2026-05-09 18:27:52,573 - optuna.study._optimize - INFO - Trial 83 pruned. 
2026-05-09 18:27:54,761 - optuna.study._optimize - INFO - Trial 84 pruned. 
2026-05-09 18:28:14,871 - optuna.study._optimize - INFO - Trial 85 pruned. 
2026-05-09 18:28:15,777 - optuna.study._optimize - INFO - Trial 86 pruned. 
2026-05-09 18:28:25,179 - optuna.study._optimize - INFO - Trial 87 pruned. 
2026-05-09 18:28:26,697 - optuna.study._optimize - INFO - Trial 88 pruned. 
2026-05-09 18:28:28,078 - optuna.study._optimize - INFO - Trial 89 pruned. 
2026-05-09 18:28:29,085 - optuna.study._optimize - INFO - Trial 90 pruned. 
2026-05-09 18:28:30,490 - optuna.study._optimize - INFO - Trial 91 pruned. 
2026-05-09 18:28:31,523 - optuna.study._optimize - INFO - Trial 92 pruned. 
2026-05-09 18:29:04,846 - optuna.study.study - INFO - Trial 93 finished with value: 0.0812703383046572 and parameters: {'n_layers': 1, 'embedding_dim': 256, 'lr': 0.007611209958867563, 'lambda_val': 0.0008955080358224154, 'batch_size': 3675, 'optimizer': 'RMSprop'}. Best is trial 93 with value: 0.0812703383046572.
2026-05-09 18:29:38,948 - optuna.study.study - INFO - Trial 94 finished with value: 0.07805030663046451 and parameters: {'n_layers': 1, 'embedding_dim': 256, 'lr': 0.008154666457637242, 'lambda_val': 0.0008923605632242646, 'batch_size': 4041, 'optimizer': 'RMSprop'}. Best is trial 93 with value: 0.0812703383046572.
2026-05-09 18:30:26,782 - optuna.study.study - INFO - Trial 95 finished with value: 0.08175429690633149 and parameters: {'n_layers': 1, 'embedding_dim': 256, 'lr': 0.007555942246374054, 'lambda_val': 0.0008671065641252272, 'batch_size': 4022, 'optimizer': 'RMSprop'}. Best is trial 95 with value: 0.08175429690633149.
2026-05-09 18:31:01,286 - optuna.study.study - INFO - Trial 96 finished with value: 0.0818047084937029 and parameters: {'n_layers': 1, 'embedding_dim': 256, 'lr': 0.008024924879139504, 'lambda_val': 0.0008251914516064217, 'batch_size': 4026, 'optimizer': 'RMSprop'}. Best is trial 96 with value: 0.0818047084937029.
2026-05-09 18:31:35,775 - optuna.study.study - INFO - Trial 97 finished with value: 0.07639939815231629 and parameters: {'n_layers': 1, 'embedding_dim': 256, 'lr': 0.007354785306618644, 'lambda_val': 0.000801619701435898, 'batch_size': 4006, 'optimizer': 'RMSprop'}. Best is trial 96 with value: 0.0818047084937029.
2026-05-09 18:31:36,746 - optuna.study._optimize - INFO - Trial 98 pruned. 
2026-05-09 18:31:55,283 - optuna.study._optimize - INFO - Trial 99 pruned. 
2026-05-09 18:32:23,960 - root - INFO -   **** Training e_100K_1c1dcs_rand2
2026-05-09 18:32:23,972 - root - INFO -   **** Getting 53072/65410 random edges
2026-05-09 18:32:24,299 - optuna.storages._rdb.storage - INFO - A new study created in RDB with name: Study_e_100K_1c1dcs_rand2
2026-05-09 18:32:53,806 - optuna.study.study - INFO - Trial 0 finished with value: 0.0007425299730769931 and parameters: {'n_layers': 2, 'embedding_dim': 96, 'lr': 0.0009021363008929866, 'lambda_val': 1.8521577854547488e-05, 'batch_size': 987, 'optimizer': 'SGD'}. Best is trial 0 with value: 0.0007425299730769931.
2026-05-09 18:33:26,762 - optuna.study.study - INFO - Trial 1 finished with value: 0.052637810203300786 and parameters: {'n_layers': 1, 'embedding_dim': 128, 'lr': 0.048517091173259336, 'lambda_val': 0.01410409264140906, 'batch_size': 2457, 'optimizer': 'Adam'}. Best is trial 1 with value: 0.052637810203300786.
2026-05-09 18:34:18,175 - optuna.study.study - INFO - Trial 2 finished with value: 0.017813451088216473 and parameters: {'n_layers': 4, 'embedding_dim': 128, 'lr': 0.00021627487271195012, 'lambda_val': 2.1467503313135154e-05, 'batch_size': 3071, 'optimizer': 'Adam'}. Best is trial 1 with value: 0.052637810203300786.
2026-05-09 18:34:46,489 - optuna.study.study - INFO - Trial 3 finished with value: 0.07138926134260008 and parameters: {'n_layers': 1, 'embedding_dim': 96, 'lr': 0.00014909483627344864, 'lambda_val': 0.0002042552923095513, 'batch_size': 3497, 'optimizer': 'RMSprop'}. Best is trial 3 with value: 0.07138926134260008.
2026-05-09 18:35:15,362 - optuna.study.study - INFO - Trial 4 finished with value: 0.04063177367829795 and parameters: {'n_layers': 1, 'embedding_dim': 32, 'lr': 0.0005853406866974734, 'lambda_val': 4.334158195537143e-06, 'batch_size': 3047, 'optimizer': 'RMSprop'}. Best is trial 3 with value: 0.07138926134260008.
2026-05-09 18:35:17,396 - optuna.study._optimize - INFO - Trial 5 pruned. 
2026-05-09 18:35:51,949 - optuna.study.study - INFO - Trial 6 finished with value: 0.020978870262258996 and parameters: {'n_layers': 3, 'embedding_dim': 64, 'lr': 0.00038204806873198724, 'lambda_val': 6.599821656978947e-06, 'batch_size': 2425, 'optimizer': 'RMSprop'}. Best is trial 3 with value: 0.07138926134260008.
2026-05-09 18:35:53,005 - optuna.study._optimize - INFO - Trial 7 pruned. 
2026-05-09 18:35:54,398 - optuna.study._optimize - INFO - Trial 8 pruned. 
2026-05-09 18:35:55,403 - optuna.study._optimize - INFO - Trial 9 pruned. 
2026-05-09 18:35:56,445 - optuna.study._optimize - INFO - Trial 10 pruned. 
2026-05-09 18:36:25,451 - optuna.study.study - INFO - Trial 11 finished with value: 0.059340436302417754 and parameters: {'n_layers': 1, 'embedding_dim': 128, 'lr': 0.00482161549546794, 'lambda_val': 0.008043995644568466, 'batch_size': 1737, 'optimizer': 'Adam'}. Best is trial 3 with value: 0.07138926134260008.
2026-05-09 18:36:26,685 - optuna.study._optimize - INFO - Trial 12 pruned. 
2026-05-09 18:36:27,780 - optuna.study._optimize - INFO - Trial 13 pruned. 
2026-05-09 18:36:29,316 - optuna.study._optimize - INFO - Trial 14 pruned. 
2026-05-09 18:36:30,322 - optuna.study._optimize - INFO - Trial 15 pruned. 
2026-05-09 18:36:33,839 - optuna.study._optimize - INFO - Trial 16 pruned. 
2026-05-09 18:36:34,846 - optuna.study._optimize - INFO - Trial 17 pruned. 
2026-05-09 18:36:36,206 - optuna.study._optimize - INFO - Trial 18 pruned. 
2026-05-09 18:36:37,213 - optuna.study._optimize - INFO - Trial 19 pruned. 
2026-05-09 18:36:38,408 - optuna.study._optimize - INFO - Trial 20 pruned. 
2026-05-09 18:36:39,926 - optuna.study._optimize - INFO - Trial 21 pruned. 
2026-05-09 18:36:40,855 - optuna.study._optimize - INFO - Trial 22 pruned. 
2026-05-09 18:36:42,275 - optuna.study._optimize - INFO - Trial 23 pruned. 
2026-05-09 18:36:43,292 - optuna.study._optimize - INFO - Trial 24 pruned. 
2026-05-09 18:36:44,586 - optuna.study._optimize - INFO - Trial 25 pruned. 
2026-05-09 18:36:45,559 - optuna.study._optimize - INFO - Trial 26 pruned. 
2026-05-09 18:37:16,062 - optuna.study.study - INFO - Trial 27 finished with value: 0.049924969718922976 and parameters: {'n_layers': 1, 'embedding_dim': 128, 'lr': 0.0006026641318563561, 'lambda_val': 8.672616876240587e-05, 'batch_size': 3314, 'optimizer': 'Adam'}. Best is trial 3 with value: 0.07138926134260008.
2026-05-09 18:37:17,773 - optuna.study._optimize - INFO - Trial 28 pruned. 
2026-05-09 18:37:19,622 - optuna.study._optimize - INFO - Trial 29 pruned. 
2026-05-09 18:37:21,560 - optuna.study._optimize - INFO - Trial 30 pruned. 
2026-05-09 18:37:22,587 - optuna.study._optimize - INFO - Trial 31 pruned. 
2026-05-09 18:37:23,605 - optuna.study._optimize - INFO - Trial 32 pruned. 
2026-05-09 18:37:24,753 - optuna.study._optimize - INFO - Trial 33 pruned. 
2026-05-09 18:37:26,258 - optuna.study._optimize - INFO - Trial 34 pruned. 
2026-05-09 18:37:27,673 - optuna.study._optimize - INFO - Trial 35 pruned. 
2026-05-09 18:37:29,484 - optuna.study._optimize - INFO - Trial 36 pruned. 
2026-05-09 18:37:30,457 - optuna.study._optimize - INFO - Trial 37 pruned. 
2026-05-09 18:37:31,784 - optuna.study._optimize - INFO - Trial 38 pruned. 
2026-05-09 18:37:32,746 - optuna.study._optimize - INFO - Trial 39 pruned. 
2026-05-09 18:37:36,539 - optuna.study._optimize - INFO - Trial 40 pruned. 
2026-05-09 18:37:37,622 - optuna.study._optimize - INFO - Trial 41 pruned. 
2026-05-09 18:37:38,733 - optuna.study._optimize - INFO - Trial 42 pruned. 
2026-05-09 18:37:41,190 - optuna.study._optimize - INFO - Trial 43 pruned. 
2026-05-09 18:37:42,195 - optuna.study._optimize - INFO - Trial 44 pruned. 
2026-05-09 18:37:43,243 - optuna.study._optimize - INFO - Trial 45 pruned. 
2026-05-09 18:37:44,515 - optuna.study._optimize - INFO - Trial 46 pruned. 
2026-05-09 18:37:45,620 - optuna.study._optimize - INFO - Trial 47 pruned. 
2026-05-09 18:37:47,469 - optuna.study._optimize - INFO - Trial 48 pruned. 
2026-05-09 18:37:48,452 - optuna.study._optimize - INFO - Trial 49 pruned. 
2026-05-09 18:38:15,237 - optuna.study.study - INFO - Trial 50 finished with value: 0.048593666723997654 and parameters: {'n_layers': 1, 'embedding_dim': 96, 'lr': 0.005439572610976059, 'lambda_val': 3.6207149467378484e-05, 'batch_size': 2382, 'optimizer': 'Adam'}. Best is trial 3 with value: 0.07138926134260008.
2026-05-09 18:38:16,241 - optuna.study._optimize - INFO - Trial 51 pruned. 
2026-05-09 18:38:17,667 - optuna.study._optimize - INFO - Trial 52 pruned. 
2026-05-09 18:38:18,684 - optuna.study._optimize - INFO - Trial 53 pruned. 
2026-05-09 18:38:19,917 - optuna.study._optimize - INFO - Trial 54 pruned. 
2026-05-09 18:38:48,569 - optuna.study.study - INFO - Trial 55 finished with value: 0.04919745846537043 and parameters: {'n_layers': 1, 'embedding_dim': 128, 'lr': 0.0008512905676868938, 'lambda_val': 0.011589605520561895, 'batch_size': 1972, 'optimizer': 'Adam'}. Best is trial 3 with value: 0.07138926134260008.
2026-05-09 18:38:49,519 - optuna.study._optimize - INFO - Trial 56 pruned. 
2026-05-09 18:38:50,580 - optuna.study._optimize - INFO - Trial 57 pruned. 
2026-05-09 18:38:52,250 - optuna.study._optimize - INFO - Trial 58 pruned. 
2026-05-09 18:38:53,266 - optuna.study._optimize - INFO - Trial 59 pruned. 
2026-05-09 18:38:54,251 - optuna.study._optimize - INFO - Trial 60 pruned. 
2026-05-09 18:38:55,572 - optuna.study._optimize - INFO - Trial 61 pruned. 
2026-05-09 18:38:56,544 - optuna.study._optimize - INFO - Trial 62 pruned. 
2026-05-09 18:39:26,314 - optuna.study.study - INFO - Trial 63 finished with value: 0.047704811621854054 and parameters: {'n_layers': 1, 'embedding_dim': 128, 'lr': 0.0009159051803989175, 'lambda_val': 1.124169285117211e-06, 'batch_size': 1958, 'optimizer': 'Adam'}. Best is trial 3 with value: 0.07138926134260008.
2026-05-09 18:39:27,317 - optuna.study._optimize - INFO - Trial 64 pruned. 
2026-05-09 18:39:28,379 - optuna.study._optimize - INFO - Trial 65 pruned. 
2026-05-09 18:39:29,705 - optuna.study._optimize - INFO - Trial 66 pruned. 
2026-05-09 18:39:31,153 - optuna.study._optimize - INFO - Trial 67 pruned. 
2026-05-09 18:39:32,392 - optuna.study._optimize - INFO - Trial 68 pruned. 
2026-05-09 18:39:33,187 - optuna.study._optimize - INFO - Trial 69 pruned. 
2026-05-09 18:39:34,382 - optuna.study._optimize - INFO - Trial 70 pruned. 
2026-05-09 18:39:35,438 - optuna.study._optimize - INFO - Trial 71 pruned. 
2026-05-09 18:39:36,864 - optuna.study._optimize - INFO - Trial 72 pruned. 
2026-05-09 18:39:38,292 - optuna.study._optimize - INFO - Trial 73 pruned. 
2026-05-09 18:39:39,320 - optuna.study._optimize - INFO - Trial 74 pruned. 
2026-05-09 18:39:40,625 - optuna.study._optimize - INFO - Trial 75 pruned. 
2026-05-09 18:39:41,615 - optuna.study._optimize - INFO - Trial 76 pruned. 
2026-05-09 18:39:43,856 - optuna.study._optimize - INFO - Trial 77 pruned. 
2026-05-09 18:39:45,095 - optuna.study._optimize - INFO - Trial 78 pruned. 
2026-05-09 18:39:47,032 - optuna.study._optimize - INFO - Trial 79 pruned. 
2026-05-09 18:39:48,159 - optuna.study._optimize - INFO - Trial 80 pruned. 
2026-05-09 18:39:49,730 - optuna.study._optimize - INFO - Trial 81 pruned. 
2026-05-09 18:39:50,880 - optuna.study._optimize - INFO - Trial 82 pruned. 
2026-05-09 18:39:52,151 - optuna.study._optimize - INFO - Trial 83 pruned. 
2026-05-09 18:39:53,507 - optuna.study._optimize - INFO - Trial 84 pruned. 
2026-05-09 18:39:54,525 - optuna.study._optimize - INFO - Trial 85 pruned. 
2026-05-09 18:39:55,553 - optuna.study._optimize - INFO - Trial 86 pruned. 
2026-05-09 18:39:56,647 - optuna.study._optimize - INFO - Trial 87 pruned. 
2026-05-09 18:39:58,625 - optuna.study._optimize - INFO - Trial 88 pruned. 
2026-05-09 18:39:59,649 - optuna.study._optimize - INFO - Trial 89 pruned. 
2026-05-09 18:40:01,144 - optuna.study._optimize - INFO - Trial 90 pruned. 
2026-05-09 18:40:06,789 - optuna.study._optimize - INFO - Trial 91 pruned. 
2026-05-09 18:40:12,277 - optuna.study._optimize - INFO - Trial 92 pruned. 
2026-05-09 18:40:13,272 - optuna.study._optimize - INFO - Trial 93 pruned. 
2026-05-09 18:40:14,204 - optuna.study._optimize - INFO - Trial 94 pruned. 
2026-05-09 18:40:15,108 - optuna.study._optimize - INFO - Trial 95 pruned. 
2026-05-09 18:40:16,147 - optuna.study._optimize - INFO - Trial 96 pruned. 
2026-05-09 18:40:17,121 - optuna.study._optimize - INFO - Trial 97 pruned. 
2026-05-09 18:40:18,069 - optuna.study._optimize - INFO - Trial 98 pruned. 
2026-05-09 18:40:19,519 - optuna.study._optimize - INFO - Trial 99 pruned. 
2026-05-09 18:40:43,046 - root - INFO -   **** Training e_100K_1c1dcs_rand3
2026-05-09 18:40:43,057 - root - INFO -   **** Getting 53072/65410 random edges
2026-05-09 18:40:43,167 - optuna.storages._rdb.storage - INFO - A new study created in RDB with name: Study_e_100K_1c1dcs_rand3
2026-05-09 18:41:31,309 - optuna.study.study - INFO - Trial 0 finished with value: 0.0022018464293117484 and parameters: {'n_layers': 2, 'embedding_dim': 256, 'lr': 0.00025979145812920725, 'lambda_val': 0.06625612452657943, 'batch_size': 3352, 'optimizer': 'SGD'}. Best is trial 0 with value: 0.0022018464293117484.
2026-05-09 18:42:14,792 - optuna.study.study - INFO - Trial 1 finished with value: 0.0029262705269950447 and parameters: {'n_layers': 4, 'embedding_dim': 128, 'lr': 0.0005554239808759256, 'lambda_val': 3.5336756223068724e-06, 'batch_size': 3411, 'optimizer': 'SGD'}. Best is trial 1 with value: 0.0029262705269950447.
2026-05-09 18:43:15,489 - optuna.study.study - INFO - Trial 2 finished with value: 0.011099764239398032 and parameters: {'n_layers': 4, 'embedding_dim': 256, 'lr': 0.0007711204012177192, 'lambda_val': 0.022555082290213937, 'batch_size': 2233, 'optimizer': 'Adam'}. Best is trial 2 with value: 0.011099764239398032.
2026-05-09 18:44:04,389 - optuna.study.study - INFO - Trial 3 finished with value: 0.033422361250921226 and parameters: {'n_layers': 3, 'embedding_dim': 96, 'lr': 2.5256391200152882e-05, 'lambda_val': 2.467165720584786e-05, 'batch_size': 3081, 'optimizer': 'RMSprop'}. Best is trial 3 with value: 0.033422361250921226.
2026-05-09 18:44:37,139 - optuna.study.study - INFO - Trial 4 finished with value: 0.01746966857130186 and parameters: {'n_layers': 4, 'embedding_dim': 32, 'lr': 0.00690319221849452, 'lambda_val': 6.368145782329904e-06, 'batch_size': 1607, 'optimizer': 'RMSprop'}. Best is trial 3 with value: 0.033422361250921226.
2026-05-09 18:44:38,088 - optuna.study._optimize - INFO - Trial 5 pruned. 
2026-05-09 18:44:39,065 - optuna.study._optimize - INFO - Trial 6 pruned. 
2026-05-09 18:44:40,570 - optuna.study._optimize - INFO - Trial 7 pruned. 
2026-05-09 18:44:43,237 - optuna.study._optimize - INFO - Trial 8 pruned. 
2026-05-09 18:44:44,332 - optuna.study._optimize - INFO - Trial 9 pruned. 
2026-05-09 18:44:45,460 - optuna.study._optimize - INFO - Trial 10 pruned. 
2026-05-09 18:45:16,359 - optuna.study.study - INFO - Trial 11 finished with value: 0.01632178858641803 and parameters: {'n_layers': 3, 'embedding_dim': 32, 'lr': 0.09235855321240773, 'lambda_val': 1.2309718541340319e-06, 'batch_size': 1212, 'optimizer': 'RMSprop'}. Best is trial 3 with value: 0.033422361250921226.
2026-05-09 18:45:49,513 - optuna.study.study - INFO - Trial 12 finished with value: 0.019688468554849847 and parameters: {'n_layers': 4, 'embedding_dim': 32, 'lr': 0.005334279234888203, 'lambda_val': 4.328384014784173e-05, 'batch_size': 1446, 'optimizer': 'RMSprop'}. Best is trial 3 with value: 0.033422361250921226.
2026-05-09 18:46:25,381 - optuna.study.study - INFO - Trial 13 finished with value: 0.025914291763692494 and parameters: {'n_layers': 3, 'embedding_dim': 96, 'lr': 0.0036785662095750234, 'lambda_val': 0.00010744886656060286, 'batch_size': 528, 'optimizer': 'RMSprop'}. Best is trial 3 with value: 0.033422361250921226.
2026-05-09 18:46:27,082 - optuna.study._optimize - INFO - Trial 14 pruned. 
2026-05-09 18:46:28,275 - optuna.study._optimize - INFO - Trial 15 pruned. 
2026-05-09 18:46:29,835 - optuna.study._optimize - INFO - Trial 16 pruned. 
2026-05-09 18:46:30,918 - optuna.study._optimize - INFO - Trial 17 pruned. 
2026-05-09 18:47:08,431 - optuna.study.study - INFO - Trial 18 finished with value: 0.022902616180020492 and parameters: {'n_layers': 3, 'embedding_dim': 96, 'lr': 0.025204792887150405, 'lambda_val': 0.0035661578944358257, 'batch_size': 4068, 'optimizer': 'RMSprop'}. Best is trial 3 with value: 0.033422361250921226.
2026-05-09 18:47:09,393 - optuna.study._optimize - INFO - Trial 19 pruned. 
2026-05-09 18:47:44,416 - optuna.study.study - INFO - Trial 20 finished with value: 0.021567062819307033 and parameters: {'n_layers': 3, 'embedding_dim': 96, 'lr': 0.0020692333634535053, 'lambda_val': 0.00129263502710807, 'batch_size': 2021, 'optimizer': 'RMSprop'}. Best is trial 3 with value: 0.033422361250921226.
2026-05-09 18:48:21,478 - optuna.study.study - INFO - Trial 21 finished with value: 0.02012575332149184 and parameters: {'n_layers': 3, 'embedding_dim': 96, 'lr': 0.030205071038968908, 'lambda_val': 0.007018783424744468, 'batch_size': 3952, 'optimizer': 'RMSprop'}. Best is trial 3 with value: 0.033422361250921226.
2026-05-09 18:48:59,236 - optuna.study.study - INFO - Trial 22 finished with value: 0.034605254708128225 and parameters: {'n_layers': 3, 'embedding_dim': 96, 'lr': 0.02896171433619799, 'lambda_val': 0.00015985536148581175, 'batch_size': 3697, 'optimizer': 'RMSprop'}. Best is trial 22 with value: 0.034605254708128225.
2026-05-09 18:49:36,160 - optuna.study.study - INFO - Trial 23 finished with value: 0.034445561393821274 and parameters: {'n_layers': 3, 'embedding_dim': 96, 'lr': 0.013096651909092781, 'lambda_val': 0.00015412001967727166, 'batch_size': 3595, 'optimizer': 'RMSprop'}. Best is trial 22 with value: 0.034605254708128225.
2026-05-09 18:50:08,315 - optuna.study.study - INFO - Trial 24 finished with value: 0.041307180691998784 and parameters: {'n_layers': 2, 'embedding_dim': 96, 'lr': 0.09641921862138086, 'lambda_val': 0.00030718575353107675, 'batch_size': 3668, 'optimizer': 'RMSprop'}. Best is trial 24 with value: 0.041307180691998784.
2026-05-09 18:50:37,119 - optuna.study.study - INFO - Trial 25 finished with value: 0.05576032853056878 and parameters: {'n_layers': 1, 'embedding_dim': 64, 'lr': 0.08521321047611913, 'lambda_val': 0.00031067980229939246, 'batch_size': 3650, 'optimizer': 'RMSprop'}. Best is trial 25 with value: 0.05576032853056878.
2026-05-09 18:50:38,066 - optuna.study._optimize - INFO - Trial 26 pruned. 
2026-05-09 18:50:39,294 - optuna.study._optimize - INFO - Trial 27 pruned. 
2026-05-09 18:50:40,482 - optuna.study._optimize - INFO - Trial 28 pruned. 
2026-05-09 18:50:41,701 - optuna.study._optimize - INFO - Trial 29 pruned. 
2026-05-09 18:50:42,699 - optuna.study._optimize - INFO - Trial 30 pruned. 
2026-05-09 18:51:15,834 - optuna.study.study - INFO - Trial 31 finished with value: 0.039811593496049104 and parameters: {'n_layers': 2, 'embedding_dim': 96, 'lr': 0.014386103968153036, 'lambda_val': 0.0001988527571792013, 'batch_size': 3479, 'optimizer': 'RMSprop'}. Best is trial 25 with value: 0.05576032853056878.
2026-05-09 18:51:50,625 - optuna.study.study - INFO - Trial 32 finished with value: 0.04568844484379121 and parameters: {'n_layers': 2, 'embedding_dim': 128, 'lr': 0.04606342430934398, 'lambda_val': 0.001225561676241344, 'batch_size': 3620, 'optimizer': 'RMSprop'}. Best is trial 25 with value: 0.05576032853056878.
2026-05-09 18:52:25,539 - optuna.study.study - INFO - Trial 33 finished with value: 0.04295498858588762 and parameters: {'n_layers': 2, 'embedding_dim': 128, 'lr': 0.05440986272851091, 'lambda_val': 0.0010177782856271452, 'batch_size': 3389, 'optimizer': 'RMSprop'}. Best is trial 25 with value: 0.05576032853056878.
2026-05-09 18:52:26,580 - optuna.study._optimize - INFO - Trial 34 pruned. 
2026-05-09 18:52:27,544 - optuna.study._optimize - INFO - Trial 35 pruned. 
2026-05-09 18:52:29,607 - optuna.study._optimize - INFO - Trial 36 pruned. 
2026-05-09 18:52:30,622 - optuna.study._optimize - INFO - Trial 37 pruned. 
