2026-05-09 20:49:24,615 - optuna.study._optimize - INFO - Trial 85 pruned. 
2026-05-09 20:49:26,325 - optuna.study._optimize - INFO - Trial 86 pruned. 
2026-05-09 20:49:28,212 - optuna.study._optimize - INFO - Trial 87 pruned. 
2026-05-09 20:49:29,232 - optuna.study._optimize - INFO - Trial 88 pruned. 
2026-05-09 20:49:30,505 - optuna.study._optimize - INFO - Trial 89 pruned. 
2026-05-09 20:49:31,622 - optuna.study._optimize - INFO - Trial 90 pruned. 
2026-05-09 20:49:33,094 - optuna.study._optimize - INFO - Trial 91 pruned. 
2026-05-09 20:49:34,845 - optuna.study._optimize - INFO - Trial 92 pruned. 
2026-05-09 20:49:36,587 - optuna.study._optimize - INFO - Trial 93 pruned. 
2026-05-09 20:49:37,731 - optuna.study._optimize - INFO - Trial 94 pruned. 
2026-05-09 20:49:38,803 - optuna.study._optimize - INFO - Trial 95 pruned. 
2026-05-09 20:49:40,017 - optuna.study._optimize - INFO - Trial 96 pruned. 
2026-05-09 20:49:41,722 - optuna.study._optimize - INFO - Trial 97 pruned. 
2026-05-09 20:50:14,874 - optuna.study.study - INFO - Trial 98 finished with value: 0.07388503843231418 and parameters: {'n_layers': 1, 'embedding_dim': 256, 'lr': 0.013167421973058936, 'lambda_val': 0.002545609868221183, 'batch_size': 1992, 'optimizer': 'RMSprop'}. Best is trial 83 with value: 0.07515026315450825.
2026-05-09 20:50:16,681 - optuna.study._optimize - INFO - Trial 99 pruned. 
2026-05-09 20:50:45,016 - root - INFO -   **** Training e_100K_1c2dcs_rand4
2026-05-09 20:50:45,027 - root - INFO -   **** Getting 54402/65410 random edges
2026-05-09 20:50:45,219 - optuna.storages._rdb.storage - INFO - A new study created in RDB with name: Study_e_100K_1c2dcs_rand4
2026-05-09 20:51:31,713 - optuna.study.study - INFO - Trial 0 finished with value: 0.0014478259650194173 and parameters: {'n_layers': 3, 'embedding_dim': 256, 'lr': 0.0055494150182006504, 'lambda_val': 3.0042680285822874e-05, 'batch_size': 532, 'optimizer': 'SGD'}. Best is trial 0 with value: 0.0014478259650194173.
2026-05-09 20:52:28,745 - optuna.study.study - INFO - Trial 1 finished with value: 0.03327627324914874 and parameters: {'n_layers': 2, 'embedding_dim': 256, 'lr': 0.0011038177720472907, 'lambda_val': 3.054214878942839e-05, 'batch_size': 3728, 'optimizer': 'Adam'}. Best is trial 1 with value: 0.03327627324914874.
2026-05-09 20:53:03,739 - optuna.study.study - INFO - Trial 2 finished with value: 0.018058083803279987 and parameters: {'n_layers': 3, 'embedding_dim': 64, 'lr': 0.00012508901239323883, 'lambda_val': 6.000710832536292e-06, 'batch_size': 3649, 'optimizer': 'Adam'}. Best is trial 1 with value: 0.03327627324914874.
2026-05-09 20:53:31,145 - optuna.study.study - INFO - Trial 3 finished with value: 0.002959670963998194 and parameters: {'n_layers': 1, 'embedding_dim': 128, 'lr': 6.863606199269274e-05, 'lambda_val': 0.0002534167371800711, 'batch_size': 798, 'optimizer': 'SGD'}. Best is trial 1 with value: 0.03327627324914874.
2026-05-09 20:54:22,109 - optuna.study.study - INFO - Trial 4 finished with value: 0.010609485771803345 and parameters: {'n_layers': 4, 'embedding_dim': 96, 'lr': 0.00012987693409943524, 'lambda_val': 0.006217265322963457, 'batch_size': 3662, 'optimizer': 'RMSprop'}. Best is trial 1 with value: 0.03327627324914874.
2026-05-09 20:54:23,107 - optuna.study._optimize - INFO - Trial 5 pruned. 
2026-05-09 20:54:24,436 - optuna.study._optimize - INFO - Trial 6 pruned. 
2026-05-09 20:54:25,992 - optuna.study._optimize - INFO - Trial 7 pruned. 
2026-05-09 20:54:26,967 - optuna.study._optimize - INFO - Trial 8 pruned. 
2026-05-09 20:54:27,997 - optuna.study._optimize - INFO - Trial 9 pruned. 
2026-05-09 20:54:29,249 - optuna.study._optimize - INFO - Trial 10 pruned. 
2026-05-09 20:54:30,202 - optuna.study._optimize - INFO - Trial 11 pruned. 
2026-05-09 20:54:31,553 - optuna.study._optimize - INFO - Trial 12 pruned. 
2026-05-09 20:54:32,658 - optuna.study._optimize - INFO - Trial 13 pruned. 
2026-05-09 20:54:33,731 - optuna.study._optimize - INFO - Trial 14 pruned. 
2026-05-09 20:54:34,848 - optuna.study._optimize - INFO - Trial 15 pruned. 
2026-05-09 20:54:36,457 - optuna.study._optimize - INFO - Trial 16 pruned. 
2026-05-09 20:54:37,519 - optuna.study._optimize - INFO - Trial 17 pruned. 
2026-05-09 20:54:40,507 - optuna.study._optimize - INFO - Trial 18 pruned. 
2026-05-09 20:54:41,620 - optuna.study._optimize - INFO - Trial 19 pruned. 
2026-05-09 20:54:42,607 - optuna.study._optimize - INFO - Trial 20 pruned. 
2026-05-09 20:54:43,703 - optuna.study._optimize - INFO - Trial 21 pruned. 
2026-05-09 20:54:44,778 - optuna.study._optimize - INFO - Trial 22 pruned. 
2026-05-09 20:54:45,798 - optuna.study._optimize - INFO - Trial 23 pruned. 
2026-05-09 20:54:46,844 - optuna.study._optimize - INFO - Trial 24 pruned. 
2026-05-09 20:54:48,251 - optuna.study._optimize - INFO - Trial 25 pruned. 
2026-05-09 20:54:49,487 - optuna.study._optimize - INFO - Trial 26 pruned. 
2026-05-09 20:54:50,668 - optuna.study._optimize - INFO - Trial 27 pruned. 
2026-05-09 20:54:52,573 - optuna.study._optimize - INFO - Trial 28 pruned. 
2026-05-09 20:54:53,771 - optuna.study._optimize - INFO - Trial 29 pruned. 
2026-05-09 20:54:55,017 - optuna.study._optimize - INFO - Trial 30 pruned. 
2026-05-09 20:54:56,231 - optuna.study._optimize - INFO - Trial 31 pruned. 
2026-05-09 20:54:57,480 - optuna.study._optimize - INFO - Trial 32 pruned. 
2026-05-09 20:54:59,180 - optuna.study._optimize - INFO - Trial 33 pruned. 
2026-05-09 20:55:00,461 - optuna.study._optimize - INFO - Trial 34 pruned. 
2026-05-09 20:55:01,980 - optuna.study._optimize - INFO - Trial 35 pruned. 
2026-05-09 20:55:07,375 - optuna.study._optimize - INFO - Trial 36 pruned. 
2026-05-09 20:55:08,589 - optuna.study._optimize - INFO - Trial 37 pruned. 
2026-05-09 20:56:01,024 - optuna.study.study - INFO - Trial 38 finished with value: 0.029137996104556696 and parameters: {'n_layers': 3, 'embedding_dim': 256, 'lr': 0.0065244157040147705, 'lambda_val': 2.0795904752945703e-06, 'batch_size': 3348, 'optimizer': 'Adam'}. Best is trial 1 with value: 0.03327627324914874.
2026-05-09 20:56:02,067 - optuna.study._optimize - INFO - Trial 39 pruned. 
2026-05-09 20:56:53,396 - optuna.study.study - INFO - Trial 40 finished with value: 0.027492042529008727 and parameters: {'n_layers': 3, 'embedding_dim': 256, 'lr': 0.007590866414934286, 'lambda_val': 1.0955019825969818e-06, 'batch_size': 3297, 'optimizer': 'Adam'}. Best is trial 1 with value: 0.03327627324914874.
2026-05-09 20:56:54,542 - optuna.study._optimize - INFO - Trial 41 pruned. 
2026-05-09 20:56:55,604 - optuna.study._optimize - INFO - Trial 42 pruned. 
2026-05-09 20:57:00,074 - optuna.study._optimize - INFO - Trial 43 pruned. 
2026-05-09 20:57:06,998 - optuna.study._optimize - INFO - Trial 44 pruned. 
2026-05-09 20:57:08,708 - optuna.study._optimize - INFO - Trial 45 pruned. 
2026-05-09 20:57:12,325 - optuna.study._optimize - INFO - Trial 46 pruned. 
2026-05-09 20:57:13,398 - optuna.study._optimize - INFO - Trial 47 pruned. 
2026-05-09 20:57:14,952 - optuna.study._optimize - INFO - Trial 48 pruned. 
2026-05-09 20:57:16,046 - optuna.study._optimize - INFO - Trial 49 pruned. 
2026-05-09 20:57:17,130 - optuna.study._optimize - INFO - Trial 50 pruned. 
2026-05-09 20:57:18,225 - optuna.study._optimize - INFO - Trial 51 pruned. 
2026-05-09 20:57:48,189 - optuna.study.study - INFO - Trial 52 finished with value: 0.020158394170330284 and parameters: {'n_layers': 2, 'embedding_dim': 64, 'lr': 0.00018770014962388336, 'lambda_val': 8.572323506641904e-06, 'batch_size': 3569, 'optimizer': 'RMSprop'}. Best is trial 1 with value: 0.03327627324914874.
2026-05-09 20:57:49,207 - optuna.study._optimize - INFO - Trial 53 pruned. 
2026-05-09 20:57:50,310 - optuna.study._optimize - INFO - Trial 54 pruned. 
2026-05-09 20:57:54,750 - optuna.study._optimize - INFO - Trial 55 pruned. 
2026-05-09 20:57:55,747 - optuna.study._optimize - INFO - Trial 56 pruned. 
2026-05-09 20:58:31,260 - optuna.study.study - INFO - Trial 57 finished with value: 0.020663442195158643 and parameters: {'n_layers': 3, 'embedding_dim': 96, 'lr': 0.0017564211083192242, 'lambda_val': 2.1738860465460513e-06, 'batch_size': 3683, 'optimizer': 'RMSprop'}. Best is trial 1 with value: 0.03327627324914874.
2026-05-09 20:58:32,214 - optuna.study._optimize - INFO - Trial 58 pruned. 
2026-05-09 20:58:33,156 - optuna.study._optimize - INFO - Trial 59 pruned. 
2026-05-09 20:58:34,397 - optuna.study._optimize - INFO - Trial 60 pruned. 
2026-05-09 20:58:37,019 - optuna.study._optimize - INFO - Trial 61 pruned. 
2026-05-09 20:58:38,048 - optuna.study._optimize - INFO - Trial 62 pruned. 
2026-05-09 20:58:39,640 - optuna.study._optimize - INFO - Trial 63 pruned. 
2026-05-09 20:58:40,725 - optuna.study._optimize - INFO - Trial 64 pruned. 
2026-05-09 20:58:41,787 - optuna.study._optimize - INFO - Trial 65 pruned. 
2026-05-09 20:58:42,947 - optuna.study._optimize - INFO - Trial 66 pruned. 
2026-05-09 20:58:44,086 - optuna.study._optimize - INFO - Trial 67 pruned. 
2026-05-09 20:58:45,213 - optuna.study._optimize - INFO - Trial 68 pruned. 
2026-05-09 20:58:47,282 - optuna.study._optimize - INFO - Trial 69 pruned. 
2026-05-09 20:58:48,410 - optuna.study._optimize - INFO - Trial 70 pruned. 
2026-05-09 20:58:50,165 - optuna.study._optimize - INFO - Trial 71 pruned. 
2026-05-09 20:58:51,627 - optuna.study._optimize - INFO - Trial 72 pruned. 
2026-05-09 20:58:52,624 - optuna.study._optimize - INFO - Trial 73 pruned. 
2026-05-09 20:58:54,633 - optuna.study._optimize - INFO - Trial 74 pruned. 
2026-05-09 20:58:55,663 - optuna.study._optimize - INFO - Trial 75 pruned. 
2026-05-09 20:58:56,813 - optuna.study._optimize - INFO - Trial 76 pruned. 
2026-05-09 20:58:58,095 - optuna.study._optimize - INFO - Trial 77 pruned. 
2026-05-09 20:58:59,326 - optuna.study._optimize - INFO - Trial 78 pruned. 
2026-05-09 20:59:00,789 - optuna.study._optimize - INFO - Trial 79 pruned. 
2026-05-09 20:59:02,748 - optuna.study._optimize - INFO - Trial 80 pruned. 
2026-05-09 20:59:04,734 - optuna.study._optimize - INFO - Trial 81 pruned. 
2026-05-09 20:59:05,732 - optuna.study._optimize - INFO - Trial 82 pruned. 
2026-05-09 20:59:06,740 - optuna.study._optimize - INFO - Trial 83 pruned. 
2026-05-09 20:59:07,749 - optuna.study._optimize - INFO - Trial 84 pruned. 
2026-05-09 20:59:09,746 - optuna.study._optimize - INFO - Trial 85 pruned. 
2026-05-09 20:59:10,819 - optuna.study._optimize - INFO - Trial 86 pruned. 
2026-05-09 20:59:11,858 - optuna.study._optimize - INFO - Trial 87 pruned. 
2026-05-09 20:59:13,765 - optuna.study._optimize - INFO - Trial 88 pruned. 
2026-05-09 20:59:15,216 - optuna.study._optimize - INFO - Trial 89 pruned. 
2026-05-09 20:59:16,246 - optuna.study._optimize - INFO - Trial 90 pruned. 
2026-05-09 20:59:17,730 - optuna.study._optimize - INFO - Trial 91 pruned. 
2026-05-09 20:59:18,816 - optuna.study._optimize - INFO - Trial 92 pruned. 
2026-05-09 20:59:50,035 - optuna.study.study - INFO - Trial 93 finished with value: 0.027361891685433595 and parameters: {'n_layers': 2, 'embedding_dim': 64, 'lr': 0.002180226403177311, 'lambda_val': 3.5804822544557854e-05, 'batch_size': 3442, 'optimizer': 'RMSprop'}. Best is trial 1 with value: 0.03327627324914874.
2026-05-09 20:59:50,998 - optuna.study._optimize - INFO - Trial 94 pruned. 
2026-05-09 20:59:51,995 - optuna.study._optimize - INFO - Trial 95 pruned. 
2026-05-09 20:59:53,301 - optuna.study._optimize - INFO - Trial 96 pruned. 
2026-05-09 20:59:55,222 - optuna.study._optimize - INFO - Trial 97 pruned. 
2026-05-09 20:59:56,197 - optuna.study._optimize - INFO - Trial 98 pruned. 
2026-05-09 20:59:57,526 - optuna.study._optimize - INFO - Trial 99 pruned. 
2026-05-09 21:00:35,018 - root - INFO -   **** Training e_100K_1c2dcs_rand5
2026-05-09 21:00:35,029 - root - INFO -   **** Getting 54402/65410 random edges
2026-05-09 21:00:36,192 - optuna.storages._rdb.storage - INFO - A new study created in RDB with name: Study_e_100K_1c2dcs_rand5
2026-05-09 21:01:15,404 - optuna.study.study - INFO - Trial 0 finished with value: 0.0358307917608393 and parameters: {'n_layers': 3, 'embedding_dim': 128, 'lr': 4.698372482736744e-05, 'lambda_val': 0.009723015516351926, 'batch_size': 1030, 'optimizer': 'Adam'}. Best is trial 0 with value: 0.0358307917608393.
2026-05-09 21:01:52,477 - optuna.study.study - INFO - Trial 1 finished with value: 0.0016925844737752467 and parameters: {'n_layers': 1, 'embedding_dim': 32, 'lr': 0.06608858227810768, 'lambda_val': 0.002303429041689037, 'batch_size': 3531, 'optimizer': 'SGD'}. Best is trial 0 with value: 0.0358307917608393.
2026-05-09 21:02:28,801 - optuna.study.study - INFO - Trial 2 finished with value: 0.07220646663531954 and parameters: {'n_layers': 2, 'embedding_dim': 96, 'lr': 5.2796880813856904e-05, 'lambda_val': 0.00025582785323893787, 'batch_size': 3871, 'optimizer': 'RMSprop'}. Best is trial 2 with value: 0.07220646663531954.
2026-05-09 21:03:06,955 - optuna.study.study - INFO - Trial 3 finished with value: 0.011923637550705149 and parameters: {'n_layers': 4, 'embedding_dim': 64, 'lr': 0.0003445132257546197, 'lambda_val': 0.00342738372852796, 'batch_size': 1959, 'optimizer': 'Adam'}. Best is trial 2 with value: 0.07220646663531954.
2026-05-09 21:03:41,874 - optuna.study.study - INFO - Trial 4 finished with value: 0.019692656754265507 and parameters: {'n_layers': 4, 'embedding_dim': 32, 'lr': 0.00749447703008976, 'lambda_val': 0.0015708684125219769, 'batch_size': 2686, 'optimizer': 'RMSprop'}. Best is trial 2 with value: 0.07220646663531954.
2026-05-09 21:04:20,864 - optuna.study.study - INFO - Trial 5 finished with value: 0.028770827587700314 and parameters: {'n_layers': 4, 'embedding_dim': 64, 'lr': 0.017088728968633372, 'lambda_val': 0.0005092618894604226, 'batch_size': 2576, 'optimizer': 'RMSprop'}. Best is trial 2 with value: 0.07220646663531954.
2026-05-09 21:04:21,772 - optuna.study._optimize - INFO - Trial 6 pruned. 
2026-05-09 21:04:23,404 - optuna.study._optimize - INFO - Trial 7 pruned. 
2026-05-09 21:04:55,153 - optuna.study.study - INFO - Trial 8 finished with value: 0.029964955414367934 and parameters: {'n_layers': 2, 'embedding_dim': 96, 'lr': 0.0032611571398634366, 'lambda_val': 2.20473238264857e-06, 'batch_size': 2104, 'optimizer': 'Adam'}. Best is trial 2 with value: 0.07220646663531954.
2026-05-09 21:04:56,201 - optuna.study._optimize - INFO - Trial 9 pruned. 
2026-05-09 21:04:58,088 - optuna.study._optimize - INFO - Trial 10 pruned. 
2026-05-09 21:04:59,129 - optuna.study._optimize - INFO - Trial 11 pruned. 
2026-05-09 21:05:01,050 - optuna.study._optimize - INFO - Trial 12 pruned. 
2026-05-09 21:05:02,158 - optuna.study._optimize - INFO - Trial 13 pruned. 
2026-05-09 21:05:04,245 - optuna.study._optimize - INFO - Trial 14 pruned. 
2026-05-09 21:05:05,252 - optuna.study._optimize - INFO - Trial 15 pruned. 
2026-05-09 21:05:06,416 - optuna.study._optimize - INFO - Trial 16 pruned. 
2026-05-09 21:05:13,219 - optuna.study._optimize - INFO - Trial 17 pruned. 
2026-05-09 21:05:18,273 - optuna.study._optimize - INFO - Trial 18 pruned. 
2026-05-09 21:05:20,215 - optuna.study._optimize - INFO - Trial 19 pruned. 
2026-05-09 21:05:21,357 - optuna.study._optimize - INFO - Trial 20 pruned. 
2026-05-09 21:05:22,761 - optuna.study._optimize - INFO - Trial 21 pruned. 
2026-05-09 21:05:55,446 - optuna.study.study - INFO - Trial 22 finished with value: 0.02318397014101844 and parameters: {'n_layers': 2, 'embedding_dim': 96, 'lr': 0.0025712541451553563, 'lambda_val': 4.157392171555057e-06, 'batch_size': 1212, 'optimizer': 'Adam'}. Best is trial 2 with value: 0.07220646663531954.
2026-05-09 21:05:56,450 - optuna.study._optimize - INFO - Trial 23 pruned. 
2026-05-09 21:05:57,656 - optuna.study._optimize - INFO - Trial 24 pruned. 
2026-05-09 21:06:41,852 - optuna.study.study - INFO - Trial 25 finished with value: 0.03333397134418433 and parameters: {'n_layers': 2, 'embedding_dim': 256, 'lr': 0.01288666537472868, 'lambda_val': 1.1259373747906657e-05, 'batch_size': 3062, 'optimizer': 'RMSprop'}. Best is trial 2 with value: 0.07220646663531954.
2026-05-09 21:07:17,032 - optuna.study.study - INFO - Trial 26 finished with value: 0.04236792220259214 and parameters: {'n_layers': 1, 'embedding_dim': 256, 'lr': 0.010811555001068224, 'lambda_val': 2.0288638325506855e-05, 'batch_size': 3237, 'optimizer': 'RMSprop'}. Best is trial 2 with value: 0.07220646663531954.
2026-05-09 21:07:18,781 - optuna.study._optimize - INFO - Trial 27 pruned. 
2026-05-09 21:07:20,601 - optuna.study._optimize - INFO - Trial 28 pruned. 
2026-05-09 21:07:21,602 - optuna.study._optimize - INFO - Trial 29 pruned. 
2026-05-09 21:07:52,412 - optuna.study.study - INFO - Trial 30 finished with value: 0.07396271267947538 and parameters: {'n_layers': 1, 'embedding_dim': 128, 'lr': 0.039623657014168305, 'lambda_val': 0.001008151560716813, 'batch_size': 3816, 'optimizer': 'RMSprop'}. Best is trial 30 with value: 0.07396271267947538.
2026-05-09 21:08:24,635 - optuna.study.study - INFO - Trial 31 finished with value: 0.07523636767980758 and parameters: {'n_layers': 1, 'embedding_dim': 128, 'lr': 0.02571342320497073, 'lambda_val': 0.0010807816166539634, 'batch_size': 3821, 'optimizer': 'RMSprop'}. Best is trial 31 with value: 0.07523636767980758.
2026-05-09 21:08:55,396 - optuna.study.study - INFO - Trial 32 finished with value: 0.07388199799064055 and parameters: {'n_layers': 1, 'embedding_dim': 128, 'lr': 0.03751794169540111, 'lambda_val': 0.0005820011603761867, 'batch_size': 3791, 'optimizer': 'RMSprop'}. Best is trial 31 with value: 0.07523636767980758.
2026-05-09 21:09:25,437 - optuna.study.study - INFO - Trial 33 finished with value: 0.08480001136842787 and parameters: {'n_layers': 1, 'embedding_dim': 128, 'lr': 0.04630876337892616, 'lambda_val': 0.0010457264327404707, 'batch_size': 3834, 'optimizer': 'RMSprop'}. Best is trial 33 with value: 0.08480001136842787.
2026-05-09 21:09:29,287 - optuna.study._optimize - INFO - Trial 34 pruned. 
2026-05-09 21:09:37,736 - optuna.study._optimize - INFO - Trial 35 pruned. 
2026-05-09 21:09:40,048 - optuna.study._optimize - INFO - Trial 36 pruned. 
2026-05-09 21:10:10,733 - optuna.study.study - INFO - Trial 37 finished with value: 0.08480728180183306 and parameters: {'n_layers': 1, 'embedding_dim': 128, 'lr': 0.020146947301268987, 'lambda_val': 0.000848528157691417, 'batch_size': 3420, 'optimizer': 'RMSprop'}. Best is trial 37 with value: 0.08480728180183306.
2026-05-09 21:10:41,576 - optuna.study.study - INFO - Trial 38 finished with value: 0.07582871311563326 and parameters: {'n_layers': 1, 'embedding_dim': 128, 'lr': 0.023069103156397767, 'lambda_val': 0.0024598954400016776, 'batch_size': 2814, 'optimizer': 'RMSprop'}. Best is trial 37 with value: 0.08480728180183306.
2026-05-09 21:10:42,533 - optuna.study._optimize - INFO - Trial 39 pruned. 
2026-05-09 21:10:43,676 - optuna.study._optimize - INFO - Trial 40 pruned. 
2026-05-09 21:11:14,201 - optuna.study.study - INFO - Trial 41 finished with value: 0.08096486063539475 and parameters: {'n_layers': 1, 'embedding_dim': 128, 'lr': 0.020731801199839417, 'lambda_val': 0.0013180207730337844, 'batch_size': 3481, 'optimizer': 'RMSprop'}. Best is trial 37 with value: 0.08480728180183306.
2026-05-09 21:11:15,172 - optuna.study._optimize - INFO - Trial 42 pruned. 
2026-05-09 21:11:16,956 - optuna.study._optimize - INFO - Trial 43 pruned. 
2026-05-09 21:11:18,017 - optuna.study._optimize - INFO - Trial 44 pruned. 
2026-05-09 21:11:19,023 - optuna.study._optimize - INFO - Trial 45 pruned. 
2026-05-09 21:11:21,438 - optuna.study._optimize - INFO - Trial 46 pruned. 
2026-05-09 21:11:23,988 - optuna.study._optimize - INFO - Trial 47 pruned. 
2026-05-09 21:11:29,715 - optuna.study._optimize - INFO - Trial 48 pruned. 
2026-05-09 21:12:03,658 - optuna.study.study - INFO - Trial 49 finished with value: 0.07500986031578577 and parameters: {'n_layers': 1, 'embedding_dim': 64, 'lr': 0.02778788157908297, 'lambda_val': 0.0014214193288736, 'batch_size': 3468, 'optimizer': 'RMSprop'}. Best is trial 37 with value: 0.08480728180183306.
2026-05-09 21:12:25,983 - optuna.study._optimize - INFO - Trial 50 pruned. 
2026-05-09 21:12:50,587 - optuna.study.study - INFO - Trial 51 finished with value: 0.0750212326951187 and parameters: {'n_layers': 1, 'embedding_dim': 64, 'lr': 0.023464961816873107, 'lambda_val': 0.001300896804894071, 'batch_size': 3473, 'optimizer': 'RMSprop'}. Best is trial 37 with value: 0.08480728180183306.
2026-05-09 21:12:52,037 - optuna.study._optimize - INFO - Trial 52 pruned. 
2026-05-09 21:12:52,949 - optuna.study._optimize - INFO - Trial 53 pruned. 
2026-05-09 21:12:54,121 - optuna.study._optimize - INFO - Trial 54 pruned. 
2026-05-09 21:12:55,104 - optuna.study._optimize - INFO - Trial 55 pruned. 
2026-05-09 21:12:56,630 - optuna.study._optimize - INFO - Trial 56 pruned. 
2026-05-09 21:12:57,625 - optuna.study._optimize - INFO - Trial 57 pruned. 
2026-05-09 21:12:59,077 - optuna.study._optimize - INFO - Trial 58 pruned. 
2026-05-09 21:13:00,072 - optuna.study._optimize - INFO - Trial 59 pruned. 
2026-05-09 21:13:01,697 - optuna.study._optimize - INFO - Trial 60 pruned. 
2026-05-09 21:13:03,425 - optuna.study._optimize - INFO - Trial 61 pruned. 
2026-05-09 21:13:04,354 - optuna.study._optimize - INFO - Trial 62 pruned. 
2026-05-09 21:13:05,338 - optuna.study._optimize - INFO - Trial 63 pruned. 
2026-05-09 21:13:06,732 - optuna.study._optimize - INFO - Trial 64 pruned. 
2026-05-09 21:13:08,260 - optuna.study._optimize - INFO - Trial 65 pruned. 
2026-05-09 21:13:10,310 - optuna.study._optimize - INFO - Trial 66 pruned. 
2026-05-09 21:13:11,272 - optuna.study._optimize - INFO - Trial 67 pruned. 
2026-05-09 21:13:12,599 - optuna.study._optimize - INFO - Trial 68 pruned. 
2026-05-09 21:13:14,502 - optuna.study._optimize - INFO - Trial 69 pruned. 
2026-05-09 21:13:15,531 - optuna.study._optimize - INFO - Trial 70 pruned. 
2026-05-09 21:13:17,269 - optuna.study._optimize - INFO - Trial 71 pruned. 
