2026-05-09 19:25:56,895 - optuna.study.study - INFO - Trial 90 finished with value: 0.05351569928034702 and parameters: {'n_layers': 2, 'embedding_dim': 128, 'lr': 0.017456410055338597, 'lambda_val': 0.001350653680147046, 'batch_size': 4002, 'optimizer': 'RMSprop'}. Best is trial 16 with value: 0.05473050830218.
2026-05-09 19:25:57,891 - optuna.study._optimize - INFO - Trial 91 pruned. 
2026-05-09 19:25:58,877 - optuna.study._optimize - INFO - Trial 92 pruned. 
2026-05-09 19:26:00,804 - optuna.study._optimize - INFO - Trial 93 pruned. 
2026-05-09 19:26:02,705 - optuna.study._optimize - INFO - Trial 94 pruned. 
2026-05-09 19:26:04,528 - optuna.study._optimize - INFO - Trial 95 pruned. 
2026-05-09 19:26:06,303 - optuna.study._optimize - INFO - Trial 96 pruned. 
2026-05-09 19:26:07,636 - optuna.study._optimize - INFO - Trial 97 pruned. 
2026-05-09 19:26:08,601 - optuna.study._optimize - INFO - Trial 98 pruned. 
2026-05-09 19:26:10,228 - optuna.study._optimize - INFO - Trial 99 pruned. 
2026-05-09 19:26:35,391 - root - INFO -   **** Training e_100K_1c1dcs_rand5
2026-05-09 19:26:35,402 - root - INFO -   **** Getting 53072/65410 random edges
2026-05-09 19:26:35,809 - optuna.storages._rdb.storage - INFO - A new study created in RDB with name: Study_e_100K_1c1dcs_rand5
2026-05-09 19:27:01,416 - optuna.study.study - INFO - Trial 0 finished with value: 0.0028624183334470337 and parameters: {'n_layers': 1, 'embedding_dim': 96, 'lr': 0.012778971413816082, 'lambda_val': 0.004560921099866264, 'batch_size': 1945, 'optimizer': 'SGD'}. Best is trial 0 with value: 0.0028624183334470337.
2026-05-09 19:27:50,537 - optuna.study.study - INFO - Trial 1 finished with value: 0.015520766983606986 and parameters: {'n_layers': 4, 'embedding_dim': 32, 'lr': 0.0014844056859807154, 'lambda_val': 0.0016542666821845885, 'batch_size': 1386, 'optimizer': 'Adam'}. Best is trial 1 with value: 0.015520766983606986.
2026-05-09 19:28:18,778 - optuna.study.study - INFO - Trial 2 finished with value: 0.06771714559113715 and parameters: {'n_layers': 1, 'embedding_dim': 128, 'lr': 0.0076140743361673225, 'lambda_val': 0.00039358534799998105, 'batch_size': 1485, 'optimizer': 'RMSprop'}. Best is trial 2 with value: 0.06771714559113715.
2026-05-09 19:29:02,919 - optuna.study.study - INFO - Trial 3 finished with value: 0.0016613544410485942 and parameters: {'n_layers': 3, 'embedding_dim': 96, 'lr': 0.000225229852863683, 'lambda_val': 0.0007331159064024845, 'batch_size': 3194, 'optimizer': 'SGD'}. Best is trial 2 with value: 0.06771714559113715.
2026-05-09 19:29:30,078 - optuna.study.study - INFO - Trial 4 finished with value: 0.06350425358850681 and parameters: {'n_layers': 1, 'embedding_dim': 32, 'lr': 0.00865538150570886, 'lambda_val': 0.0037528619454294575, 'batch_size': 1596, 'optimizer': 'Adam'}. Best is trial 2 with value: 0.06771714559113715.
2026-05-09 19:29:31,064 - optuna.study._optimize - INFO - Trial 5 pruned. 
2026-05-09 19:29:32,028 - optuna.study._optimize - INFO - Trial 6 pruned. 
2026-05-09 19:29:33,279 - optuna.study._optimize - INFO - Trial 7 pruned. 
2026-05-09 19:29:34,698 - optuna.study._optimize - INFO - Trial 8 pruned. 
2026-05-09 19:29:35,734 - optuna.study._optimize - INFO - Trial 9 pruned. 
2026-05-09 19:29:37,042 - optuna.study._optimize - INFO - Trial 10 pruned. 
2026-05-09 19:30:03,650 - optuna.study.study - INFO - Trial 11 finished with value: 0.026931577175132247 and parameters: {'n_layers': 1, 'embedding_dim': 32, 'lr': 0.006913899568664048, 'lambda_val': 1.248802739327501e-06, 'batch_size': 1809, 'optimizer': 'RMSprop'}. Best is trial 2 with value: 0.06771714559113715.
2026-05-09 19:30:05,369 - optuna.study._optimize - INFO - Trial 12 pruned. 
2026-05-09 19:30:07,163 - optuna.study._optimize - INFO - Trial 13 pruned. 
2026-05-09 19:30:09,057 - optuna.study._optimize - INFO - Trial 14 pruned. 
2026-05-09 19:30:42,622 - optuna.study.study - INFO - Trial 15 finished with value: 0.04865689812041659 and parameters: {'n_layers': 1, 'embedding_dim': 256, 'lr': 0.0026888674747232956, 'lambda_val': 6.270799108858268e-06, 'batch_size': 1138, 'optimizer': 'Adam'}. Best is trial 2 with value: 0.06771714559113715.
2026-05-09 19:30:43,758 - optuna.study._optimize - INFO - Trial 16 pruned. 
2026-05-09 19:30:45,400 - optuna.study._optimize - INFO - Trial 17 pruned. 
2026-05-09 19:30:46,375 - optuna.study._optimize - INFO - Trial 18 pruned. 
2026-05-09 19:30:47,726 - optuna.study._optimize - INFO - Trial 19 pruned. 
2026-05-09 19:30:48,713 - optuna.study._optimize - INFO - Trial 20 pruned. 
2026-05-09 19:30:49,711 - optuna.study._optimize - INFO - Trial 21 pruned. 
2026-05-09 19:30:51,062 - optuna.study._optimize - INFO - Trial 22 pruned. 
2026-05-09 19:30:52,458 - optuna.study._optimize - INFO - Trial 23 pruned. 
2026-05-09 19:30:53,411 - optuna.study._optimize - INFO - Trial 24 pruned. 
2026-05-09 19:30:54,564 - optuna.study._optimize - INFO - Trial 25 pruned. 
2026-05-09 19:30:55,685 - optuna.study._optimize - INFO - Trial 26 pruned. 
2026-05-09 19:30:57,058 - optuna.study._optimize - INFO - Trial 27 pruned. 
2026-05-09 19:30:58,083 - optuna.study._optimize - INFO - Trial 28 pruned. 
2026-05-09 19:30:59,350 - optuna.study._optimize - INFO - Trial 29 pruned. 
2026-05-09 19:31:00,359 - optuna.study._optimize - INFO - Trial 30 pruned. 
2026-05-09 19:31:40,229 - optuna.study.study - INFO - Trial 31 finished with value: 0.03315106041363485 and parameters: {'n_layers': 1, 'embedding_dim': 32, 'lr': 0.0059419955591891145, 'lambda_val': 1.6178370709286139e-06, 'batch_size': 1720, 'optimizer': 'RMSprop'}. Best is trial 2 with value: 0.06771714559113715.
2026-05-09 19:32:02,241 - optuna.study.study - INFO - Trial 32 finished with value: 0.030797448701120684 and parameters: {'n_layers': 1, 'embedding_dim': 32, 'lr': 0.010135099572504455, 'lambda_val': 1.0720545587061625e-05, 'batch_size': 1582, 'optimizer': 'RMSprop'}. Best is trial 2 with value: 0.06771714559113715.
2026-05-09 19:32:03,370 - optuna.study._optimize - INFO - Trial 33 pruned. 
2026-05-09 19:32:05,122 - optuna.study._optimize - INFO - Trial 34 pruned. 
2026-05-09 19:32:06,153 - optuna.study._optimize - INFO - Trial 35 pruned. 
2026-05-09 19:32:08,103 - optuna.study._optimize - INFO - Trial 36 pruned. 
2026-05-09 19:32:09,056 - optuna.study._optimize - INFO - Trial 37 pruned. 
2026-05-09 19:32:10,452 - optuna.study._optimize - INFO - Trial 38 pruned. 
2026-05-09 19:32:11,949 - optuna.study._optimize - INFO - Trial 39 pruned. 
2026-05-09 19:32:13,103 - optuna.study._optimize - INFO - Trial 40 pruned. 
2026-05-09 19:32:34,448 - optuna.study.study - INFO - Trial 41 finished with value: 0.030840350067732288 and parameters: {'n_layers': 1, 'embedding_dim': 32, 'lr': 0.007674395310385995, 'lambda_val': 1.0633450588557868e-05, 'batch_size': 1577, 'optimizer': 'RMSprop'}. Best is trial 2 with value: 0.06771714559113715.
2026-05-09 19:32:54,935 - optuna.study.study - INFO - Trial 42 finished with value: 0.02706771692907738 and parameters: {'n_layers': 1, 'embedding_dim': 32, 'lr': 0.004735562812660449, 'lambda_val': 1.5317594234277625e-05, 'batch_size': 1830, 'optimizer': 'RMSprop'}. Best is trial 2 with value: 0.06771714559113715.
2026-05-09 19:33:16,058 - optuna.study.study - INFO - Trial 43 finished with value: 0.025544334998442195 and parameters: {'n_layers': 1, 'embedding_dim': 32, 'lr': 0.0078548652915324, 'lambda_val': 2.0801251364769527e-06, 'batch_size': 1573, 'optimizer': 'RMSprop'}. Best is trial 2 with value: 0.06771714559113715.
2026-05-09 19:33:40,442 - optuna.study.study - INFO - Trial 44 finished with value: 0.05424324658284082 and parameters: {'n_layers': 1, 'embedding_dim': 128, 'lr': 0.0031020803083477064, 'lambda_val': 4.7483149957749444e-05, 'batch_size': 689, 'optimizer': 'RMSprop'}. Best is trial 2 with value: 0.06771714559113715.
2026-05-09 19:33:41,513 - optuna.study._optimize - INFO - Trial 45 pruned. 
2026-05-09 19:33:42,653 - optuna.study._optimize - INFO - Trial 46 pruned. 
2026-05-09 19:33:43,781 - optuna.study._optimize - INFO - Trial 47 pruned. 
2026-05-09 19:33:45,520 - optuna.study._optimize - INFO - Trial 48 pruned. 
2026-05-09 19:33:46,461 - optuna.study._optimize - INFO - Trial 49 pruned. 
2026-05-09 19:33:47,414 - optuna.study._optimize - INFO - Trial 50 pruned. 
2026-05-09 19:34:09,385 - optuna.study.study - INFO - Trial 51 finished with value: 0.036423495264159125 and parameters: {'n_layers': 1, 'embedding_dim': 32, 'lr': 0.00632344412012077, 'lambda_val': 3.4819359536989563e-06, 'batch_size': 1414, 'optimizer': 'RMSprop'}. Best is trial 2 with value: 0.06771714559113715.
2026-05-09 19:34:10,429 - optuna.study._optimize - INFO - Trial 52 pruned. 
2026-05-09 19:34:12,126 - optuna.study._optimize - INFO - Trial 53 pruned. 
2026-05-09 19:34:13,331 - optuna.study._optimize - INFO - Trial 54 pruned. 
2026-05-09 19:34:14,838 - optuna.study._optimize - INFO - Trial 55 pruned. 
2026-05-09 19:34:15,961 - optuna.study._optimize - INFO - Trial 56 pruned. 
2026-05-09 19:34:17,377 - optuna.study._optimize - INFO - Trial 57 pruned. 
2026-05-09 19:34:43,241 - optuna.study.study - INFO - Trial 58 finished with value: 0.03825046122190551 and parameters: {'n_layers': 1, 'embedding_dim': 32, 'lr': 0.0014080371008414422, 'lambda_val': 0.0025339669791948627, 'batch_size': 779, 'optimizer': 'RMSprop'}. Best is trial 2 with value: 0.06771714559113715.
2026-05-09 19:34:44,203 - optuna.study._optimize - INFO - Trial 59 pruned. 
2026-05-09 19:34:45,211 - optuna.study._optimize - INFO - Trial 60 pruned. 
2026-05-09 19:34:46,448 - optuna.study._optimize - INFO - Trial 61 pruned. 
2026-05-09 19:35:11,375 - optuna.study.study - INFO - Trial 62 finished with value: 0.03998778388335229 and parameters: {'n_layers': 1, 'embedding_dim': 32, 'lr': 0.00329468141190286, 'lambda_val': 0.000753589027983164, 'batch_size': 1661, 'optimizer': 'RMSprop'}. Best is trial 2 with value: 0.06771714559113715.
2026-05-09 19:35:12,354 - optuna.study._optimize - INFO - Trial 63 pruned. 
2026-05-09 19:35:13,499 - optuna.study._optimize - INFO - Trial 64 pruned. 
2026-05-09 19:35:14,700 - optuna.study._optimize - INFO - Trial 65 pruned. 
2026-05-09 19:35:15,680 - optuna.study._optimize - INFO - Trial 66 pruned. 
2026-05-09 19:35:17,069 - optuna.study._optimize - INFO - Trial 67 pruned. 
2026-05-09 19:35:18,622 - optuna.study._optimize - INFO - Trial 68 pruned. 
2026-05-09 19:35:50,339 - optuna.study.study - INFO - Trial 69 finished with value: 0.08424119433125025 and parameters: {'n_layers': 1, 'embedding_dim': 256, 'lr': 0.003821254348226356, 'lambda_val': 0.0013165090682152889, 'batch_size': 994, 'optimizer': 'Adam'}. Best is trial 69 with value: 0.08424119433125025.
2026-05-09 19:35:51,267 - optuna.study._optimize - INFO - Trial 70 pruned. 
2026-05-09 19:35:52,151 - optuna.study._optimize - INFO - Trial 71 pruned. 
2026-05-09 19:35:53,429 - optuna.study._optimize - INFO - Trial 72 pruned. 
2026-05-09 19:35:54,419 - optuna.study._optimize - INFO - Trial 73 pruned. 
2026-05-09 19:35:55,930 - optuna.study._optimize - INFO - Trial 74 pruned. 
2026-05-09 19:35:57,561 - optuna.study._optimize - INFO - Trial 75 pruned. 
2026-05-09 19:35:59,012 - optuna.study._optimize - INFO - Trial 76 pruned. 
2026-05-09 19:36:00,102 - optuna.study._optimize - INFO - Trial 77 pruned. 
2026-05-09 19:36:01,944 - optuna.study._optimize - INFO - Trial 78 pruned. 
2026-05-09 19:36:02,964 - optuna.study._optimize - INFO - Trial 79 pruned. 
2026-05-09 19:36:04,048 - optuna.study._optimize - INFO - Trial 80 pruned. 
2026-05-09 19:36:05,267 - optuna.study._optimize - INFO - Trial 81 pruned. 
2026-05-09 19:36:06,838 - optuna.study._optimize - INFO - Trial 82 pruned. 
2026-05-09 19:36:07,617 - optuna.study._optimize - INFO - Trial 83 pruned. 
2026-05-09 19:36:08,354 - optuna.study._optimize - INFO - Trial 84 pruned. 
2026-05-09 19:36:10,490 - optuna.study._optimize - INFO - Trial 85 pruned. 
2026-05-09 19:36:43,772 - optuna.study.study - INFO - Trial 86 finished with value: 0.041035447645196024 and parameters: {'n_layers': 1, 'embedding_dim': 256, 'lr': 0.012063129398280433, 'lambda_val': 7.704386923852783e-06, 'batch_size': 2054, 'optimizer': 'RMSprop'}. Best is trial 69 with value: 0.08424119433125025.
2026-05-09 19:37:16,730 - optuna.study.study - INFO - Trial 87 finished with value: 0.04056439300411942 and parameters: {'n_layers': 1, 'embedding_dim': 256, 'lr': 0.011640862475621919, 'lambda_val': 8.530394456794662e-06, 'batch_size': 2123, 'optimizer': 'RMSprop'}. Best is trial 69 with value: 0.08424119433125025.
2026-05-09 19:37:17,747 - optuna.study._optimize - INFO - Trial 88 pruned. 
2026-05-09 19:37:19,603 - optuna.study._optimize - INFO - Trial 89 pruned. 
2026-05-09 19:37:21,233 - optuna.study._optimize - INFO - Trial 90 pruned. 
2026-05-09 19:37:54,548 - optuna.study.study - INFO - Trial 91 finished with value: 0.0426706710549987 and parameters: {'n_layers': 1, 'embedding_dim': 256, 'lr': 0.00830115835526949, 'lambda_val': 7.56024113175246e-06, 'batch_size': 1864, 'optimizer': 'RMSprop'}. Best is trial 69 with value: 0.08424119433125025.
2026-05-09 19:37:55,692 - optuna.study._optimize - INFO - Trial 92 pruned. 
2026-05-09 19:38:28,899 - optuna.study.study - INFO - Trial 93 finished with value: 0.04911380762352181 and parameters: {'n_layers': 1, 'embedding_dim': 256, 'lr': 0.013888979906584676, 'lambda_val': 7.439270229485755e-05, 'batch_size': 1996, 'optimizer': 'RMSprop'}. Best is trial 69 with value: 0.08424119433125025.
2026-05-09 19:38:30,531 - optuna.study._optimize - INFO - Trial 94 pruned. 
2026-05-09 19:38:32,297 - optuna.study._optimize - INFO - Trial 95 pruned. 
2026-05-09 19:38:33,310 - optuna.study._optimize - INFO - Trial 96 pruned. 
2026-05-09 19:38:34,411 - optuna.study._optimize - INFO - Trial 97 pruned. 
2026-05-09 19:38:36,067 - optuna.study._optimize - INFO - Trial 98 pruned. 
2026-05-09 19:38:42,580 - optuna.study._optimize - INFO - Trial 99 pruned. 
2026-05-09 19:39:09,691 - root - INFO - **** Training e_100K_1c2dcs
2026-05-09 19:39:09,691 - root - INFO -   ** 2-Dominant stats:
2026-05-09 19:39:09,691 - root - INFO -   ** Finding the dominant set:
2026-05-09 19:39:28,124 - root - INFO -   ** Getting the trainable edges:
2026-05-09 19:39:28,130 - helper_functions - INFO -      Number of nodes: 3657
2026-05-09 19:39:28,130 - helper_functions - INFO -      Ratio: 0.4035978368833462
2026-05-09 19:39:28,130 - helper_functions - INFO -      Number of unique users: 325
2026-05-09 19:39:28,130 - helper_functions - INFO -      Number of unique items: 3332
2026-05-09 19:39:28,131 - helper_functions - INFO -      Total dominant set edge: 67989
2026-05-09 19:39:28,131 - helper_functions - INFO -      Trainable edges: 54391.200000000004
2026-05-09 19:39:28,139 - root - INFO -   **** Getting 67989 dominant set edges
2026-05-09 19:39:28,280 - optuna.storages._rdb.storage - INFO - A new study created in RDB with name: Study_e_100K_1c2dcs
2026-05-09 19:40:16,750 - optuna.study.study - INFO - Trial 0 finished with value: 0.0007589990502994232 and parameters: {'n_layers': 3, 'embedding_dim': 256, 'lr': 0.005342467949545388, 'lambda_val': 3.836034883203319e-06, 'batch_size': 849, 'optimizer': 'SGD'}. Best is trial 0 with value: 0.0007589990502994232.
2026-05-09 19:41:03,293 - optuna.study.study - INFO - Trial 1 finished with value: 0.015787599028287747 and parameters: {'n_layers': 3, 'embedding_dim': 96, 'lr': 0.006673840297687465, 'lambda_val': 0.009721061340493619, 'batch_size': 549, 'optimizer': 'Adam'}. Best is trial 1 with value: 0.015787599028287747.
2026-05-09 19:41:55,007 - optuna.study.study - INFO - Trial 2 finished with value: 0.001523443728630396 and parameters: {'n_layers': 3, 'embedding_dim': 256, 'lr': 0.003930657479181686, 'lambda_val': 0.007932802918628112, 'batch_size': 647, 'optimizer': 'SGD'}. Best is trial 1 with value: 0.015787599028287747.
2026-05-09 19:42:27,795 - optuna.study.study - INFO - Trial 3 finished with value: 0.05370591724349785 and parameters: {'n_layers': 3, 'embedding_dim': 96, 'lr': 5.37890901758094e-05, 'lambda_val': 7.67192216899067e-06, 'batch_size': 1130, 'optimizer': 'Adam'}. Best is trial 3 with value: 0.05370591724349785.
2026-05-09 19:43:13,209 - optuna.study.study - INFO - Trial 4 finished with value: 0.022154631094944654 and parameters: {'n_layers': 4, 'embedding_dim': 96, 'lr': 0.053965467119964264, 'lambda_val': 1.6688048155954993e-06, 'batch_size': 1602, 'optimizer': 'Adam'}. Best is trial 3 with value: 0.05370591724349785.
2026-05-09 19:43:43,782 - optuna.study.study - INFO - Trial 5 finished with value: 0.0248788488910438 and parameters: {'n_layers': 2, 'embedding_dim': 64, 'lr': 0.0006946053954561106, 'lambda_val': 0.009793299495741446, 'batch_size': 2908, 'optimizer': 'Adam'}. Best is trial 3 with value: 0.05370591724349785.
2026-05-09 19:43:46,908 - optuna.study._optimize - INFO - Trial 6 pruned. 
2026-05-09 19:43:47,927 - optuna.study._optimize - INFO - Trial 7 pruned. 
2026-05-09 19:43:50,121 - optuna.study._optimize - INFO - Trial 8 pruned. 
2026-05-09 19:43:52,219 - optuna.study._optimize - INFO - Trial 9 pruned. 
2026-05-09 19:43:54,237 - optuna.study._optimize - INFO - Trial 10 pruned. 
2026-05-09 19:43:55,700 - optuna.study._optimize - INFO - Trial 11 pruned. 
2026-05-09 19:43:57,552 - optuna.study._optimize - INFO - Trial 12 pruned. 
2026-05-09 19:43:58,526 - optuna.study._optimize - INFO - Trial 13 pruned. 
2026-05-09 19:44:00,546 - optuna.study._optimize - INFO - Trial 14 pruned. 
2026-05-09 19:44:42,088 - optuna.study.study - INFO - Trial 15 finished with value: 0.05566929115642312 and parameters: {'n_layers': 1, 'embedding_dim': 96, 'lr': 0.0006593396200109804, 'lambda_val': 0.005219457735956004, 'batch_size': 2501, 'optimizer': 'Adam'}. Best is trial 15 with value: 0.05566929115642312.
2026-05-09 19:44:43,637 - optuna.study._optimize - INFO - Trial 16 pruned. 
2026-05-09 19:44:45,233 - optuna.study._optimize - INFO - Trial 17 pruned. 
2026-05-09 19:44:48,383 - optuna.study._optimize - INFO - Trial 18 pruned. 
2026-05-09 19:44:57,618 - optuna.study._optimize - INFO - Trial 19 pruned. 
2026-05-09 19:44:59,165 - optuna.study._optimize - INFO - Trial 20 pruned. 
2026-05-09 19:45:00,200 - optuna.study._optimize - INFO - Trial 21 pruned. 
2026-05-09 19:45:07,743 - optuna.study._optimize - INFO - Trial 22 pruned. 
2026-05-09 19:45:09,703 - optuna.study._optimize - INFO - Trial 23 pruned. 
2026-05-09 19:45:53,932 - optuna.study.study - INFO - Trial 24 finished with value: 0.05189937177161145 and parameters: {'n_layers': 1, 'embedding_dim': 128, 'lr': 0.0017314938111554186, 'lambda_val': 0.029205710492672645, 'batch_size': 2753, 'optimizer': 'Adam'}. Best is trial 15 with value: 0.05566929115642312.
2026-05-09 19:46:23,173 - optuna.study.study - INFO - Trial 25 finished with value: 0.05402490494407326 and parameters: {'n_layers': 1, 'embedding_dim': 128, 'lr': 0.0022588753839873853, 'lambda_val': 0.03636809677281295, 'batch_size': 2189, 'optimizer': 'Adam'}. Best is trial 15 with value: 0.05566929115642312.
2026-05-09 19:46:51,940 - optuna.study.study - INFO - Trial 26 finished with value: 0.06778791739853979 and parameters: {'n_layers': 1, 'embedding_dim': 128, 'lr': 0.019761860326784987, 'lambda_val': 0.002208379974935007, 'batch_size': 2009, 'optimizer': 'Adam'}. Best is trial 26 with value: 0.06778791739853979.
2026-05-09 19:46:52,901 - optuna.study._optimize - INFO - Trial 27 pruned. 
2026-05-09 19:46:54,330 - optuna.study._optimize - INFO - Trial 28 pruned. 
2026-05-09 19:46:55,281 - optuna.study._optimize - INFO - Trial 29 pruned. 
2026-05-09 19:46:57,222 - optuna.study._optimize - INFO - Trial 30 pruned. 
2026-05-09 19:46:58,838 - optuna.study._optimize - INFO - Trial 31 pruned. 
2026-05-09 19:47:12,009 - optuna.study._optimize - INFO - Trial 32 pruned. 
2026-05-09 19:47:13,829 - optuna.study._optimize - INFO - Trial 33 pruned. 
2026-05-09 19:47:14,989 - optuna.study._optimize - INFO - Trial 34 pruned. 
2026-05-09 19:47:16,427 - optuna.study._optimize - INFO - Trial 35 pruned. 
2026-05-09 19:47:17,313 - optuna.study._optimize - INFO - Trial 36 pruned. 
2026-05-09 19:47:18,988 - optuna.study._optimize - INFO - Trial 37 pruned. 
2026-05-09 19:47:20,451 - optuna.study._optimize - INFO - Trial 38 pruned. 
2026-05-09 19:47:21,359 - optuna.study._optimize - INFO - Trial 39 pruned. 
2026-05-09 19:47:22,334 - optuna.study._optimize - INFO - Trial 40 pruned. 
2026-05-09 19:47:52,862 - optuna.study.study - INFO - Trial 41 finished with value: 0.05669686503777473 and parameters: {'n_layers': 1, 'embedding_dim': 128, 'lr': 0.0015185616372071298, 'lambda_val': 0.03463953471844717, 'batch_size': 2339, 'optimizer': 'Adam'}. Best is trial 26 with value: 0.06778791739853979.
2026-05-09 19:47:53,977 - optuna.study._optimize - INFO - Trial 42 pruned. 
2026-05-09 19:48:23,888 - optuna.study.study - INFO - Trial 43 finished with value: 0.05778914679511563 and parameters: {'n_layers': 1, 'embedding_dim': 128, 'lr': 0.001151185441081735, 'lambda_val': 0.0060357944485182604, 'batch_size': 1978, 'optimizer': 'Adam'}. Best is trial 26 with value: 0.06778791739853979.
2026-05-09 19:48:24,969 - optuna.study._optimize - INFO - Trial 44 pruned. 
2026-05-09 19:48:26,488 - optuna.study._optimize - INFO - Trial 45 pruned. 
2026-05-09 19:48:55,339 - optuna.study.study - INFO - Trial 46 finished with value: 0.05578491840722999 and parameters: {'n_layers': 1, 'embedding_dim': 128, 'lr': 0.0009857843167489304, 'lambda_val': 0.011768205195087766, 'batch_size': 2008, 'optimizer': 'RMSprop'}. Best is trial 26 with value: 0.06778791739853979.
2026-05-09 19:48:56,405 - optuna.study._optimize - INFO - Trial 47 pruned. 
2026-05-09 19:49:26,931 - optuna.study.study - INFO - Trial 48 finished with value: 0.058544880697134684 and parameters: {'n_layers': 1, 'embedding_dim': 128, 'lr': 0.0010401903615836513, 'lambda_val': 0.015171714656441494, 'batch_size': 2619, 'optimizer': 'RMSprop'}. Best is trial 26 with value: 0.06778791739853979.
