2026-05-09 19:49:28,545 - optuna.study._optimize - INFO - Trial 49 pruned. 
2026-05-09 19:49:29,816 - optuna.study._optimize - INFO - Trial 50 pruned. 
2026-05-09 19:49:30,999 - optuna.study._optimize - INFO - Trial 51 pruned. 
2026-05-09 19:49:32,298 - optuna.study._optimize - INFO - Trial 52 pruned. 
2026-05-09 19:49:33,530 - optuna.study._optimize - INFO - Trial 53 pruned. 
2026-05-09 19:49:35,091 - optuna.study._optimize - INFO - Trial 54 pruned. 
2026-05-09 19:49:43,908 - optuna.study._optimize - INFO - Trial 55 pruned. 
2026-05-09 19:49:46,408 - optuna.study._optimize - INFO - Trial 56 pruned. 
2026-05-09 19:49:48,455 - optuna.study._optimize - INFO - Trial 57 pruned. 
2026-05-09 19:50:21,960 - optuna.study.study - INFO - Trial 58 finished with value: 0.03937831378031946 and parameters: {'n_layers': 1, 'embedding_dim': 64, 'lr': 0.001589045752154401, 'lambda_val': 0.0006918498267711907, 'batch_size': 2821, 'optimizer': 'RMSprop'}. Best is trial 26 with value: 0.06778791739853979.
2026-05-09 19:50:24,545 - optuna.study._optimize - INFO - Trial 59 pruned. 
2026-05-09 19:50:26,585 - optuna.study._optimize - INFO - Trial 60 pruned. 
2026-05-09 19:50:28,599 - optuna.study._optimize - INFO - Trial 61 pruned. 
2026-05-09 19:50:29,925 - optuna.study._optimize - INFO - Trial 62 pruned. 
2026-05-09 19:50:31,214 - optuna.study._optimize - INFO - Trial 63 pruned. 
2026-05-09 19:51:02,440 - optuna.study.study - INFO - Trial 64 finished with value: 0.05876280516337233 and parameters: {'n_layers': 1, 'embedding_dim': 128, 'lr': 0.002317554422051985, 'lambda_val': 0.018412140538036352, 'batch_size': 2336, 'optimizer': 'Adam'}. Best is trial 26 with value: 0.06778791739853979.
2026-05-09 19:51:03,508 - optuna.study._optimize - INFO - Trial 65 pruned. 
2026-05-09 19:51:33,017 - optuna.study.study - INFO - Trial 66 finished with value: 0.05425658931447108 and parameters: {'n_layers': 1, 'embedding_dim': 128, 'lr': 0.0005542737162563338, 'lambda_val': 0.00981905216531244, 'batch_size': 1678, 'optimizer': 'Adam'}. Best is trial 26 with value: 0.06778791739853979.
2026-05-09 19:51:34,679 - optuna.study._optimize - INFO - Trial 67 pruned. 
2026-05-09 19:51:36,197 - optuna.study._optimize - INFO - Trial 68 pruned. 
2026-05-09 19:51:37,159 - optuna.study._optimize - INFO - Trial 69 pruned. 
2026-05-09 19:51:38,376 - optuna.study._optimize - INFO - Trial 70 pruned. 
2026-05-09 19:51:39,949 - optuna.study._optimize - INFO - Trial 71 pruned. 
2026-05-09 19:51:40,964 - optuna.study._optimize - INFO - Trial 72 pruned. 
2026-05-09 19:52:10,144 - optuna.study.study - INFO - Trial 73 finished with value: 0.057664878038378005 and parameters: {'n_layers': 1, 'embedding_dim': 128, 'lr': 0.0006896067089754571, 'lambda_val': 0.01044707561800595, 'batch_size': 1592, 'optimizer': 'Adam'}. Best is trial 26 with value: 0.06778791739853979.
2026-05-09 19:52:11,159 - optuna.study._optimize - INFO - Trial 74 pruned. 
2026-05-09 19:52:12,093 - optuna.study._optimize - INFO - Trial 75 pruned. 
2026-05-09 19:52:13,361 - optuna.study._optimize - INFO - Trial 76 pruned. 
2026-05-09 19:52:14,406 - optuna.study._optimize - INFO - Trial 77 pruned. 
2026-05-09 19:52:44,847 - optuna.study.study - INFO - Trial 78 finished with value: 0.06126349008800736 and parameters: {'n_layers': 1, 'embedding_dim': 128, 'lr': 0.0016324414922023218, 'lambda_val': 0.0027657697360417887, 'batch_size': 2546, 'optimizer': 'Adam'}. Best is trial 26 with value: 0.06778791739853979.
2026-05-09 19:53:14,047 - optuna.study.study - INFO - Trial 79 finished with value: 0.0599702631319266 and parameters: {'n_layers': 1, 'embedding_dim': 128, 'lr': 0.0014883193996503333, 'lambda_val': 0.0026717867853481873, 'batch_size': 2069, 'optimizer': 'Adam'}. Best is trial 26 with value: 0.06778791739853979.
2026-05-09 19:53:14,998 - optuna.study._optimize - INFO - Trial 80 pruned. 
2026-05-09 19:53:15,950 - optuna.study._optimize - INFO - Trial 81 pruned. 
2026-05-09 19:53:17,266 - optuna.study._optimize - INFO - Trial 82 pruned. 
2026-05-09 19:53:18,329 - optuna.study._optimize - INFO - Trial 83 pruned. 
2026-05-09 19:53:19,901 - optuna.study._optimize - INFO - Trial 84 pruned. 
2026-05-09 19:53:20,891 - optuna.study._optimize - INFO - Trial 85 pruned. 
2026-05-09 19:53:21,968 - optuna.study._optimize - INFO - Trial 86 pruned. 
2026-05-09 19:53:23,048 - optuna.study._optimize - INFO - Trial 87 pruned. 
2026-05-09 19:53:24,048 - optuna.study._optimize - INFO - Trial 88 pruned. 
2026-05-09 19:53:25,094 - optuna.study._optimize - INFO - Trial 89 pruned. 
2026-05-09 19:53:26,202 - optuna.study._optimize - INFO - Trial 90 pruned. 
2026-05-09 19:53:27,154 - optuna.study._optimize - INFO - Trial 91 pruned. 
2026-05-09 19:54:09,516 - optuna.study.study - INFO - Trial 92 finished with value: 0.06020360692815011 and parameters: {'n_layers': 1, 'embedding_dim': 128, 'lr': 0.001832387190378719, 'lambda_val': 0.008579608470333873, 'batch_size': 2726, 'optimizer': 'Adam'}. Best is trial 26 with value: 0.06778791739853979.
2026-05-09 19:54:10,545 - optuna.study._optimize - INFO - Trial 93 pruned. 
2026-05-09 19:54:11,618 - optuna.study._optimize - INFO - Trial 94 pruned. 
2026-05-09 19:54:42,272 - optuna.study.study - INFO - Trial 95 finished with value: 0.06228946940920564 and parameters: {'n_layers': 1, 'embedding_dim': 128, 'lr': 0.0015025449657244787, 'lambda_val': 0.01317039035044324, 'batch_size': 2341, 'optimizer': 'Adam'}. Best is trial 26 with value: 0.06778791739853979.
2026-05-09 19:54:43,289 - optuna.study._optimize - INFO - Trial 96 pruned. 
2026-05-09 19:54:44,274 - optuna.study._optimize - INFO - Trial 97 pruned. 
2026-05-09 19:54:46,261 - optuna.study._optimize - INFO - Trial 98 pruned. 
2026-05-09 19:55:27,167 - optuna.study.study - INFO - Trial 99 finished with value: 0.05964714335333501 and parameters: {'n_layers': 1, 'embedding_dim': 64, 'lr': 0.0034308453909964614, 'lambda_val': 0.0031008091861416624, 'batch_size': 3238, 'optimizer': 'Adam'}. Best is trial 26 with value: 0.06778791739853979.
2026-05-09 19:55:50,121 - root - INFO -   **** Training e_100K_1c2dcs_rand1
2026-05-09 19:55:50,132 - root - INFO -   **** Getting 54402/65410 random edges
2026-05-09 19:55:50,480 - optuna.storages._rdb.storage - INFO - A new study created in RDB with name: Study_e_100K_1c2dcs_rand1
2026-05-09 19:56:38,677 - optuna.study.study - INFO - Trial 0 finished with value: 0.042478333204173976 and parameters: {'n_layers': 3, 'embedding_dim': 256, 'lr': 0.008957642834348536, 'lambda_val': 1.025533964532764e-05, 'batch_size': 847, 'optimizer': 'RMSprop'}. Best is trial 0 with value: 0.042478333204173976.
2026-05-09 19:57:18,104 - optuna.study.study - INFO - Trial 1 finished with value: 0.017553078516816544 and parameters: {'n_layers': 4, 'embedding_dim': 64, 'lr': 0.0019905528919548702, 'lambda_val': 0.002854280848758518, 'batch_size': 1984, 'optimizer': 'RMSprop'}. Best is trial 0 with value: 0.042478333204173976.
2026-05-09 19:58:15,082 - optuna.study.study - INFO - Trial 2 finished with value: 0.0008337094299336944 and parameters: {'n_layers': 3, 'embedding_dim': 256, 'lr': 0.0001375200121681272, 'lambda_val': 1.5506150950136004e-05, 'batch_size': 3749, 'optimizer': 'SGD'}. Best is trial 0 with value: 0.042478333204173976.
2026-05-09 19:58:44,409 - optuna.study.study - INFO - Trial 3 finished with value: 0.0008461216527991043 and parameters: {'n_layers': 2, 'embedding_dim': 64, 'lr': 0.0226786710119297, 'lambda_val': 0.01201294209649316, 'batch_size': 1745, 'optimizer': 'SGD'}. Best is trial 0 with value: 0.042478333204173976.
2026-05-09 19:59:32,489 - optuna.study.study - INFO - Trial 4 finished with value: 0.012598974231181314 and parameters: {'n_layers': 3, 'embedding_dim': 64, 'lr': 9.461945227098437e-05, 'lambda_val': 0.004094856821605003, 'batch_size': 3638, 'optimizer': 'RMSprop'}. Best is trial 0 with value: 0.042478333204173976.
2026-05-09 19:59:34,282 - optuna.study._optimize - INFO - Trial 5 pruned. 
2026-05-09 19:59:36,083 - optuna.study._optimize - INFO - Trial 6 pruned. 
2026-05-09 19:59:37,585 - optuna.study._optimize - INFO - Trial 7 pruned. 
2026-05-09 19:59:39,605 - optuna.study._optimize - INFO - Trial 8 pruned. 
2026-05-09 19:59:40,579 - optuna.study._optimize - INFO - Trial 9 pruned. 
2026-05-09 20:00:25,908 - optuna.study.study - INFO - Trial 10 finished with value: 0.03562479813444998 and parameters: {'n_layers': 4, 'embedding_dim': 128, 'lr': 0.008636518870272343, 'lambda_val': 1.1459792815369721e-06, 'batch_size': 678, 'optimizer': 'RMSprop'}. Best is trial 0 with value: 0.042478333204173976.
2026-05-09 20:01:09,800 - optuna.study.study - INFO - Trial 11 finished with value: 0.03579636683422063 and parameters: {'n_layers': 4, 'embedding_dim': 128, 'lr': 0.01467634321367842, 'lambda_val': 1.5831591893924276e-06, 'batch_size': 585, 'optimizer': 'RMSprop'}. Best is trial 0 with value: 0.042478333204173976.
2026-05-09 20:01:49,574 - optuna.study.study - INFO - Trial 12 finished with value: 0.0338072643619211 and parameters: {'n_layers': 4, 'embedding_dim': 96, 'lr': 0.04273896527100215, 'lambda_val': 6.0945435304453e-05, 'batch_size': 571, 'optimizer': 'RMSprop'}. Best is trial 0 with value: 0.042478333204173976.
2026-05-09 20:01:50,535 - optuna.study._optimize - INFO - Trial 13 pruned. 
2026-05-09 20:01:51,565 - optuna.study._optimize - INFO - Trial 14 pruned. 
2026-05-09 20:01:52,815 - optuna.study._optimize - INFO - Trial 15 pruned. 
2026-05-09 20:01:53,956 - optuna.study._optimize - INFO - Trial 16 pruned. 
2026-05-09 20:01:55,715 - optuna.study._optimize - INFO - Trial 17 pruned. 
2026-05-09 20:02:02,757 - optuna.study._optimize - INFO - Trial 18 pruned. 
2026-05-09 20:02:03,680 - optuna.study._optimize - INFO - Trial 19 pruned. 
2026-05-09 20:02:04,632 - optuna.study._optimize - INFO - Trial 20 pruned. 
2026-05-09 20:02:48,118 - optuna.study.study - INFO - Trial 21 finished with value: 0.03314635088767916 and parameters: {'n_layers': 4, 'embedding_dim': 128, 'lr': 0.010590763501729102, 'lambda_val': 1.0870221588223615e-06, 'batch_size': 514, 'optimizer': 'RMSprop'}. Best is trial 0 with value: 0.042478333204173976.
2026-05-09 20:03:31,105 - optuna.study.study - INFO - Trial 22 finished with value: 0.02334718612672113 and parameters: {'n_layers': 4, 'embedding_dim': 128, 'lr': 0.03646099645482715, 'lambda_val': 2.4848231255259586e-06, 'batch_size': 812, 'optimizer': 'RMSprop'}. Best is trial 0 with value: 0.042478333204173976.
2026-05-09 20:03:32,419 - optuna.study._optimize - INFO - Trial 23 pruned. 
2026-05-09 20:03:33,383 - optuna.study._optimize - INFO - Trial 24 pruned. 
2026-05-09 20:04:47,399 - optuna.study.study - INFO - Trial 25 finished with value: 0.03327207213214756 and parameters: {'n_layers': 4, 'embedding_dim': 256, 'lr': 0.01479529978619132, 'lambda_val': 1.2226011552234206e-06, 'batch_size': 535, 'optimizer': 'RMSprop'}. Best is trial 0 with value: 0.042478333204173976.
2026-05-09 20:04:48,382 - optuna.study._optimize - INFO - Trial 26 pruned. 
2026-05-09 20:05:27,238 - optuna.study.study - INFO - Trial 27 finished with value: 0.043463072910443254 and parameters: {'n_layers': 3, 'embedding_dim': 128, 'lr': 0.0490240506718616, 'lambda_val': 0.00015218745930804358, 'batch_size': 1537, 'optimizer': 'RMSprop'}. Best is trial 27 with value: 0.043463072910443254.
2026-05-09 20:05:28,661 - optuna.study._optimize - INFO - Trial 28 pruned. 
2026-05-09 20:05:29,623 - optuna.study._optimize - INFO - Trial 29 pruned. 
2026-05-09 20:06:04,236 - optuna.study.study - INFO - Trial 30 finished with value: 0.03067662255946648 and parameters: {'n_layers': 3, 'embedding_dim': 64, 'lr': 0.026772097572299047, 'lambda_val': 4.8809035512810296e-05, 'batch_size': 4060, 'optimizer': 'RMSprop'}. Best is trial 27 with value: 0.043463072910443254.
2026-05-09 20:06:05,429 - optuna.study._optimize - INFO - Trial 31 pruned. 
2026-05-09 20:06:28,707 - optuna.study._optimize - INFO - Trial 32 pruned. 
2026-05-09 20:07:12,062 - optuna.study.study - INFO - Trial 33 finished with value: 0.03646748566409824 and parameters: {'n_layers': 4, 'embedding_dim': 128, 'lr': 0.017169902109888436, 'lambda_val': 2.5650118249621764e-05, 'batch_size': 944, 'optimizer': 'RMSprop'}. Best is trial 27 with value: 0.043463072910443254.
2026-05-09 20:07:13,071 - optuna.study._optimize - INFO - Trial 34 pruned. 
2026-05-09 20:07:14,099 - optuna.study._optimize - INFO - Trial 35 pruned. 
2026-05-09 20:08:12,085 - optuna.study.study - INFO - Trial 36 finished with value: 0.039950976622406785 and parameters: {'n_layers': 4, 'embedding_dim': 256, 'lr': 0.050303475134693035, 'lambda_val': 0.0004635445109308982, 'batch_size': 1513, 'optimizer': 'RMSprop'}. Best is trial 27 with value: 0.043463072910443254.
2026-05-09 20:08:13,081 - optuna.study._optimize - INFO - Trial 37 pruned. 
2026-05-09 20:08:13,998 - optuna.study._optimize - INFO - Trial 38 pruned. 
2026-05-09 20:08:15,370 - optuna.study._optimize - INFO - Trial 39 pruned. 
2026-05-09 20:09:06,556 - optuna.study.study - INFO - Trial 40 finished with value: 0.03557614183330493 and parameters: {'n_layers': 3, 'embedding_dim': 256, 'lr': 0.06281442855927767, 'lambda_val': 0.001345837510127171, 'batch_size': 2560, 'optimizer': 'RMSprop'}. Best is trial 27 with value: 0.043463072910443254.
2026-05-09 20:09:07,594 - optuna.study._optimize - INFO - Trial 41 pruned. 
2026-05-09 20:09:08,590 - optuna.study._optimize - INFO - Trial 42 pruned. 
2026-05-09 20:09:09,895 - optuna.study._optimize - INFO - Trial 43 pruned. 
2026-05-09 20:09:32,645 - optuna.study._optimize - INFO - Trial 44 pruned. 
2026-05-09 20:10:10,851 - optuna.study.study - INFO - Trial 45 finished with value: 0.04262251608078963 and parameters: {'n_layers': 3, 'embedding_dim': 128, 'lr': 0.02513381312048112, 'lambda_val': 8.982142126834798e-05, 'batch_size': 1060, 'optimizer': 'RMSprop'}. Best is trial 27 with value: 0.043463072910443254.
2026-05-09 20:10:11,889 - optuna.study._optimize - INFO - Trial 46 pruned. 
2026-05-09 20:10:13,439 - optuna.study._optimize - INFO - Trial 47 pruned. 
2026-05-09 20:10:14,550 - optuna.study._optimize - INFO - Trial 48 pruned. 
2026-05-09 20:10:15,627 - optuna.study._optimize - INFO - Trial 49 pruned. 
2026-05-09 20:10:16,649 - optuna.study._optimize - INFO - Trial 50 pruned. 
2026-05-09 20:10:17,727 - optuna.study._optimize - INFO - Trial 51 pruned. 
2026-05-09 20:11:00,946 - optuna.study.study - INFO - Trial 52 finished with value: 0.030371502219900915 and parameters: {'n_layers': 4, 'embedding_dim': 128, 'lr': 0.022691344289390746, 'lambda_val': 2.1613347921535093e-05, 'batch_size': 647, 'optimizer': 'RMSprop'}. Best is trial 27 with value: 0.043463072910443254.
2026-05-09 20:11:01,908 - optuna.study._optimize - INFO - Trial 53 pruned. 
2026-05-09 20:11:03,003 - optuna.study._optimize - INFO - Trial 54 pruned. 
2026-05-09 20:11:04,437 - optuna.study._optimize - INFO - Trial 55 pruned. 
2026-05-09 20:11:05,527 - optuna.study._optimize - INFO - Trial 56 pruned. 
2026-05-09 20:11:07,051 - optuna.study._optimize - INFO - Trial 57 pruned. 
2026-05-09 20:11:08,140 - optuna.study._optimize - INFO - Trial 58 pruned. 
2026-05-09 20:11:09,626 - optuna.study._optimize - INFO - Trial 59 pruned. 
2026-05-09 20:11:10,667 - optuna.study._optimize - INFO - Trial 60 pruned. 
2026-05-09 20:11:12,138 - optuna.study._optimize - INFO - Trial 61 pruned. 
2026-05-09 20:11:13,145 - optuna.study._optimize - INFO - Trial 62 pruned. 
2026-05-09 20:11:14,285 - optuna.study._optimize - INFO - Trial 63 pruned. 
2026-05-09 20:11:42,463 - optuna.study._optimize - INFO - Trial 64 pruned. 
2026-05-09 20:11:43,803 - optuna.study._optimize - INFO - Trial 65 pruned. 
2026-05-09 20:11:44,776 - optuna.study._optimize - INFO - Trial 66 pruned. 
2026-05-09 20:12:33,436 - optuna.study.study - INFO - Trial 67 finished with value: 0.00769081764035648 and parameters: {'n_layers': 3, 'embedding_dim': 256, 'lr': 0.05050789457203661, 'lambda_val': 1.0065560920675966e-06, 'batch_size': 798, 'optimizer': 'RMSprop'}. Best is trial 27 with value: 0.043463072910443254.
2026-05-09 20:12:34,833 - optuna.study._optimize - INFO - Trial 68 pruned. 
2026-05-09 20:13:36,590 - optuna.study.study - INFO - Trial 69 finished with value: 0.01946451908564418 and parameters: {'n_layers': 4, 'embedding_dim': 256, 'lr': 0.07427437436978293, 'lambda_val': 1.642107191948e-05, 'batch_size': 2809, 'optimizer': 'RMSprop'}. Best is trial 27 with value: 0.043463072910443254.
2026-05-09 20:13:37,540 - optuna.study._optimize - INFO - Trial 70 pruned. 
2026-05-09 20:13:38,602 - optuna.study._optimize - INFO - Trial 71 pruned. 
2026-05-09 20:13:39,852 - optuna.study._optimize - INFO - Trial 72 pruned. 
2026-05-09 20:13:41,456 - optuna.study._optimize - INFO - Trial 73 pruned. 
2026-05-09 20:14:41,238 - optuna.study.study - INFO - Trial 74 finished with value: 0.04042823149592469 and parameters: {'n_layers': 3, 'embedding_dim': 256, 'lr': 0.020560681451161134, 'lambda_val': 0.00042643486526757894, 'batch_size': 2608, 'optimizer': 'RMSprop'}. Best is trial 27 with value: 0.043463072910443254.
2026-05-09 20:14:42,112 - optuna.study._optimize - INFO - Trial 75 pruned. 
2026-05-09 20:14:43,488 - optuna.study._optimize - INFO - Trial 76 pruned. 
2026-05-09 20:14:44,532 - optuna.study._optimize - INFO - Trial 77 pruned. 
2026-05-09 20:14:45,621 - optuna.study._optimize - INFO - Trial 78 pruned. 
2026-05-09 20:14:46,975 - optuna.study._optimize - INFO - Trial 79 pruned. 
2026-05-09 20:14:48,064 - optuna.study._optimize - INFO - Trial 80 pruned. 
2026-05-09 20:15:39,444 - optuna.study.study - INFO - Trial 81 finished with value: 0.04117179596430624 and parameters: {'n_layers': 3, 'embedding_dim': 256, 'lr': 0.05155129500118959, 'lambda_val': 0.0007174467296596285, 'batch_size': 2358, 'optimizer': 'RMSprop'}. Best is trial 27 with value: 0.043463072910443254.
2026-05-09 20:15:40,759 - optuna.study._optimize - INFO - Trial 82 pruned. 
2026-05-09 20:15:41,934 - optuna.study._optimize - INFO - Trial 83 pruned. 
2026-05-09 20:15:43,152 - optuna.study._optimize - INFO - Trial 84 pruned. 
2026-05-09 20:15:44,394 - optuna.study._optimize - INFO - Trial 85 pruned. 
2026-05-09 20:15:45,641 - optuna.study._optimize - INFO - Trial 86 pruned. 
2026-05-09 20:15:46,916 - optuna.study._optimize - INFO - Trial 87 pruned. 
2026-05-09 20:15:48,255 - optuna.study._optimize - INFO - Trial 88 pruned. 
2026-05-09 20:15:49,364 - optuna.study._optimize - INFO - Trial 89 pruned. 
2026-05-09 20:15:50,581 - optuna.study._optimize - INFO - Trial 90 pruned. 
2026-05-09 20:15:51,577 - optuna.study._optimize - INFO - Trial 91 pruned. 
2026-05-09 20:15:53,045 - optuna.study._optimize - INFO - Trial 92 pruned. 
2026-05-09 20:15:54,249 - optuna.study._optimize - INFO - Trial 93 pruned. 
2026-05-09 20:15:55,424 - optuna.study._optimize - INFO - Trial 94 pruned. 
2026-05-09 20:15:56,721 - optuna.study._optimize - INFO - Trial 95 pruned. 
2026-05-09 20:15:57,950 - optuna.study._optimize - INFO - Trial 96 pruned. 
2026-05-09 20:16:42,902 - optuna.study.study - INFO - Trial 97 finished with value: 0.019131259943130398 and parameters: {'n_layers': 4, 'embedding_dim': 128, 'lr': 0.04636713678734621, 'lambda_val': 0.00429583878510223, 'batch_size': 1048, 'optimizer': 'RMSprop'}. Best is trial 27 with value: 0.043463072910443254.
2026-05-09 20:16:43,939 - optuna.study._optimize - INFO - Trial 98 pruned. 
2026-05-09 20:17:21,526 - optuna.study._optimize - INFO - Trial 99 pruned. 
2026-05-09 20:17:53,859 - root - INFO -   **** Training e_100K_1c2dcs_rand2
2026-05-09 20:17:53,870 - root - INFO -   **** Getting 54402/65410 random edges
2026-05-09 20:17:53,977 - optuna.storages._rdb.storage - INFO - A new study created in RDB with name: Study_e_100K_1c2dcs_rand2
2026-05-09 20:18:42,858 - optuna.study.study - INFO - Trial 0 finished with value: 0.04384221012496706 and parameters: {'n_layers': 3, 'embedding_dim': 256, 'lr': 0.017136885451822174, 'lambda_val': 0.0003865860948760019, 'batch_size': 1776, 'optimizer': 'RMSprop'}. Best is trial 0 with value: 0.04384221012496706.
2026-05-09 20:19:22,554 - optuna.study.study - INFO - Trial 1 finished with value: 0.018054678361575403 and parameters: {'n_layers': 2, 'embedding_dim': 32, 'lr': 0.0003140178881939322, 'lambda_val': 0.003163256459947253, 'batch_size': 595, 'optimizer': 'Adam'}. Best is trial 0 with value: 0.04384221012496706.
2026-05-09 20:19:56,449 - optuna.study.study - INFO - Trial 2 finished with value: 0.0011717805308047561 and parameters: {'n_layers': 3, 'embedding_dim': 32, 'lr': 0.00033684604555594847, 'lambda_val': 0.0025253788289892236, 'batch_size': 2411, 'optimizer': 'SGD'}. Best is trial 0 with value: 0.04384221012496706.
2026-05-09 20:20:22,477 - optuna.study.study - INFO - Trial 3 finished with value: 0.08362887689931989 and parameters: {'n_layers': 1, 'embedding_dim': 64, 'lr': 5.962442825314036e-05, 'lambda_val': 0.0007411494454085393, 'batch_size': 1012, 'optimizer': 'RMSprop'}. Best is trial 3 with value: 0.08362887689931989.
2026-05-09 20:21:01,531 - optuna.study.study - INFO - Trial 4 finished with value: 0.05876157211867467 and parameters: {'n_layers': 4, 'embedding_dim': 64, 'lr': 5.3406241620470203e-05, 'lambda_val': 0.001545318299813729, 'batch_size': 2850, 'optimizer': 'RMSprop'}. Best is trial 3 with value: 0.08362887689931989.
2026-05-09 20:21:02,536 - optuna.study._optimize - INFO - Trial 5 pruned. 
2026-05-09 20:21:29,410 - optuna.study.study - INFO - Trial 6 finished with value: 0.06010131782983228 and parameters: {'n_layers': 1, 'embedding_dim': 32, 'lr': 0.005971672790251219, 'lambda_val': 0.0034672711488047004, 'batch_size': 2257, 'optimizer': 'RMSprop'}. Best is trial 3 with value: 0.08362887689931989.
2026-05-09 20:21:30,437 - optuna.study._optimize - INFO - Trial 7 pruned. 
2026-05-09 20:21:31,444 - optuna.study._optimize - INFO - Trial 8 pruned. 
2026-05-09 20:21:39,145 - optuna.study._optimize - INFO - Trial 9 pruned. 
