2026-05-09 22:31:34,840 - optuna.study.study - INFO - Trial 71 finished with value: 0.042858929463543145 and parameters: {'n_layers': 2, 'embedding_dim': 256, 'lr': 0.02756606535173997, 'lambda_val': 0.0001467192376618383, 'batch_size': 623, 'optimizer': 'RMSprop'}. Best is trial 17 with value: 0.06791036999548765.
2026-05-09 22:32:15,256 - optuna.study.study - INFO - Trial 72 finished with value: 0.042782774034728605 and parameters: {'n_layers': 2, 'embedding_dim': 256, 'lr': 0.016112156906182878, 'lambda_val': 0.00019488910861618846, 'batch_size': 774, 'optimizer': 'RMSprop'}. Best is trial 17 with value: 0.06791036999548765.
2026-05-09 22:32:56,272 - optuna.study.study - INFO - Trial 73 finished with value: 0.05065188698917794 and parameters: {'n_layers': 2, 'embedding_dim': 256, 'lr': 0.031337079559630464, 'lambda_val': 0.0004416060127772273, 'batch_size': 518, 'optimizer': 'RMSprop'}. Best is trial 17 with value: 0.06791036999548765.
2026-05-09 22:32:57,386 - optuna.study._optimize - INFO - Trial 74 pruned. 
2026-05-09 22:32:58,452 - optuna.study._optimize - INFO - Trial 75 pruned. 
2026-05-09 22:32:59,762 - optuna.study._optimize - INFO - Trial 76 pruned. 
2026-05-09 22:33:00,929 - optuna.study._optimize - INFO - Trial 77 pruned. 
2026-05-09 22:33:02,110 - optuna.study._optimize - INFO - Trial 78 pruned. 
2026-05-09 22:33:46,427 - optuna.study.study - INFO - Trial 79 finished with value: 0.04450923214355984 and parameters: {'n_layers': 2, 'embedding_dim': 256, 'lr': 0.053244742922438915, 'lambda_val': 0.0013650690917283927, 'batch_size': 723, 'optimizer': 'RMSprop'}. Best is trial 17 with value: 0.06791036999548765.
2026-05-09 22:33:47,447 - optuna.study._optimize - INFO - Trial 80 pruned. 
2026-05-09 22:34:28,060 - optuna.study.study - INFO - Trial 81 finished with value: 0.054955575931786044 and parameters: {'n_layers': 2, 'embedding_dim': 256, 'lr': 0.028092470236232223, 'lambda_val': 0.0002558287532450854, 'batch_size': 523, 'optimizer': 'RMSprop'}. Best is trial 17 with value: 0.06791036999548765.
2026-05-09 22:35:09,179 - optuna.study.study - INFO - Trial 82 finished with value: 0.04907584722763174 and parameters: {'n_layers': 2, 'embedding_dim': 256, 'lr': 0.03052205441372623, 'lambda_val': 0.00023118096956086537, 'batch_size': 517, 'optimizer': 'RMSprop'}. Best is trial 17 with value: 0.06791036999548765.
2026-05-09 22:35:20,257 - optuna.study._optimize - INFO - Trial 83 pruned. 
2026-05-09 22:36:01,160 - optuna.study.study - INFO - Trial 84 finished with value: 0.046587055469744384 and parameters: {'n_layers': 2, 'embedding_dim': 256, 'lr': 0.01937582106458983, 'lambda_val': 0.0002269592257502902, 'batch_size': 764, 'optimizer': 'RMSprop'}. Best is trial 17 with value: 0.06791036999548765.
2026-05-09 22:36:02,236 - optuna.study._optimize - INFO - Trial 85 pruned. 
2026-05-09 22:36:03,613 - optuna.study._optimize - INFO - Trial 86 pruned. 
2026-05-09 22:36:04,772 - optuna.study._optimize - INFO - Trial 87 pruned. 
2026-05-09 22:36:05,920 - optuna.study._optimize - INFO - Trial 88 pruned. 
2026-05-09 22:36:07,221 - optuna.study._optimize - INFO - Trial 89 pruned. 
2026-05-09 22:36:08,200 - optuna.study._optimize - INFO - Trial 90 pruned. 
2026-05-09 22:36:48,775 - optuna.study.study - INFO - Trial 91 finished with value: 0.04973831425744481 and parameters: {'n_layers': 2, 'embedding_dim': 256, 'lr': 0.041894993642601484, 'lambda_val': 0.0005443325834316853, 'batch_size': 676, 'optimizer': 'RMSprop'}. Best is trial 17 with value: 0.06791036999548765.
2026-05-09 22:37:29,459 - optuna.study.study - INFO - Trial 92 finished with value: 0.05540749739380546 and parameters: {'n_layers': 2, 'embedding_dim': 256, 'lr': 0.02292452559260913, 'lambda_val': 0.0003600381037436561, 'batch_size': 663, 'optimizer': 'RMSprop'}. Best is trial 17 with value: 0.06791036999548765.
2026-05-09 22:37:45,027 - optuna.study._optimize - INFO - Trial 93 pruned. 
2026-05-09 22:38:25,650 - optuna.study.study - INFO - Trial 94 finished with value: 0.052862769511556586 and parameters: {'n_layers': 2, 'embedding_dim': 256, 'lr': 0.02300281541602017, 'lambda_val': 0.0003638083515836345, 'batch_size': 657, 'optimizer': 'RMSprop'}. Best is trial 17 with value: 0.06791036999548765.
2026-05-09 22:38:26,858 - optuna.study._optimize - INFO - Trial 95 pruned. 
2026-05-09 22:38:27,925 - optuna.study._optimize - INFO - Trial 96 pruned. 
2026-05-09 22:38:28,940 - optuna.study._optimize - INFO - Trial 97 pruned. 
2026-05-09 22:38:29,985 - optuna.study._optimize - INFO - Trial 98 pruned. 
2026-05-09 22:38:51,473 - optuna.study._optimize - INFO - Trial 99 pruned. 
2026-05-09 22:39:12,089 - root - INFO -   **** Training e_100K_1c3dcs_rand5
2026-05-09 22:39:12,102 - root - INFO -   **** Getting 56335/65410 random edges
2026-05-09 22:39:12,914 - optuna.storages._rdb.storage - INFO - A new study created in RDB with name: Study_e_100K_1c3dcs_rand5
2026-05-09 22:39:47,665 - optuna.study.study - INFO - Trial 0 finished with value: 0.04834816989930386 and parameters: {'n_layers': 4, 'embedding_dim': 32, 'lr': 8.314426337443011e-05, 'lambda_val': 1.4406191774810474e-05, 'batch_size': 3829, 'optimizer': 'RMSprop'}. Best is trial 0 with value: 0.04834816989930386.
2026-05-09 22:40:33,663 - optuna.study.study - INFO - Trial 1 finished with value: 0.05533924866101368 and parameters: {'n_layers': 3, 'embedding_dim': 128, 'lr': 2.885590443477823e-05, 'lambda_val': 7.21862935069882e-05, 'batch_size': 680, 'optimizer': 'Adam'}. Best is trial 1 with value: 0.05533924866101368.
2026-05-09 22:41:34,864 - optuna.study.study - INFO - Trial 2 finished with value: 0.013985576552605915 and parameters: {'n_layers': 4, 'embedding_dim': 256, 'lr': 0.0003277773166603891, 'lambda_val': 0.01971813209877781, 'batch_size': 2300, 'optimizer': 'Adam'}. Best is trial 1 with value: 0.05533924866101368.
2026-05-09 22:42:18,127 - optuna.study.study - INFO - Trial 3 finished with value: 0.012659303371493862 and parameters: {'n_layers': 4, 'embedding_dim': 128, 'lr': 0.0017492163815664291, 'lambda_val': 0.025517561302075546, 'batch_size': 855, 'optimizer': 'RMSprop'}. Best is trial 1 with value: 0.05533924866101368.
2026-05-09 22:43:07,289 - optuna.study.study - INFO - Trial 4 finished with value: 0.02490852081785814 and parameters: {'n_layers': 4, 'embedding_dim': 64, 'lr': 0.008753111839813891, 'lambda_val': 0.0001489612634069674, 'batch_size': 2415, 'optimizer': 'Adam'}. Best is trial 1 with value: 0.05533924866101368.
2026-05-09 22:43:08,354 - optuna.study._optimize - INFO - Trial 5 pruned. 
2026-05-09 22:43:09,620 - optuna.study._optimize - INFO - Trial 6 pruned. 
2026-05-09 22:44:19,852 - optuna.study.study - INFO - Trial 7 finished with value: 0.03329156701962356 and parameters: {'n_layers': 4, 'embedding_dim': 256, 'lr': 0.017298890125111568, 'lambda_val': 5.810215778260434e-05, 'batch_size': 3373, 'optimizer': 'RMSprop'}. Best is trial 1 with value: 0.05533924866101368.
2026-05-09 22:44:21,641 - optuna.study._optimize - INFO - Trial 8 pruned. 
2026-05-09 22:44:54,332 - optuna.study.study - INFO - Trial 9 finished with value: 0.012424882836788055 and parameters: {'n_layers': 3, 'embedding_dim': 32, 'lr': 0.00017165606592814672, 'lambda_val': 0.0003141305915095628, 'batch_size': 3274, 'optimizer': 'RMSprop'}. Best is trial 1 with value: 0.05533924866101368.
2026-05-09 22:44:56,132 - optuna.study._optimize - INFO - Trial 10 pruned. 
2026-05-09 22:44:57,962 - optuna.study._optimize - INFO - Trial 11 pruned. 
2026-05-09 22:44:59,637 - optuna.study._optimize - INFO - Trial 12 pruned. 
2026-05-09 22:45:00,715 - optuna.study._optimize - INFO - Trial 13 pruned. 
2026-05-09 22:45:02,012 - optuna.study._optimize - INFO - Trial 14 pruned. 
2026-05-09 22:45:03,105 - optuna.study._optimize - INFO - Trial 15 pruned. 
2026-05-09 22:45:04,254 - optuna.study._optimize - INFO - Trial 16 pruned. 
2026-05-09 22:45:06,230 - optuna.study._optimize - INFO - Trial 17 pruned. 
2026-05-09 22:45:18,303 - optuna.study._optimize - INFO - Trial 18 pruned. 
2026-05-09 22:45:20,176 - optuna.study._optimize - INFO - Trial 19 pruned. 
2026-05-09 22:45:21,220 - optuna.study._optimize - INFO - Trial 20 pruned. 
2026-05-09 22:46:37,568 - optuna.study.study - INFO - Trial 21 finished with value: 0.03086230335919596 and parameters: {'n_layers': 4, 'embedding_dim': 256, 'lr': 0.052102352476964896, 'lambda_val': 5.659024994282254e-05, 'batch_size': 3620, 'optimizer': 'RMSprop'}. Best is trial 1 with value: 0.05533924866101368.
2026-05-09 22:47:53,761 - optuna.study.study - INFO - Trial 22 finished with value: 0.028362587844290403 and parameters: {'n_layers': 4, 'embedding_dim': 256, 'lr': 0.029151645058187237, 'lambda_val': 2.412753777467662e-05, 'batch_size': 4049, 'optimizer': 'RMSprop'}. Best is trial 1 with value: 0.05533924866101368.
2026-05-09 22:48:57,181 - optuna.study.study - INFO - Trial 23 finished with value: 0.027742820104973528 and parameters: {'n_layers': 3, 'embedding_dim': 256, 'lr': 0.0025533488970505445, 'lambda_val': 7.287225231603348e-05, 'batch_size': 3602, 'optimizer': 'RMSprop'}. Best is trial 1 with value: 0.05533924866101368.
2026-05-09 22:49:45,835 - optuna.study.study - INFO - Trial 24 finished with value: 0.02446520543132733 and parameters: {'n_layers': 4, 'embedding_dim': 128, 'lr': 0.02260902002773243, 'lambda_val': 9.791313486437226e-06, 'batch_size': 2712, 'optimizer': 'RMSprop'}. Best is trial 1 with value: 0.05533924866101368.
2026-05-09 22:49:46,862 - optuna.study._optimize - INFO - Trial 25 pruned. 
2026-05-09 22:49:48,235 - optuna.study._optimize - INFO - Trial 26 pruned. 
2026-05-09 22:49:50,019 - optuna.study._optimize - INFO - Trial 27 pruned. 
2026-05-09 22:49:50,920 - optuna.study._optimize - INFO - Trial 28 pruned. 
2026-05-09 22:49:51,817 - optuna.study._optimize - INFO - Trial 29 pruned. 
2026-05-09 22:50:39,565 - optuna.study.study - INFO - Trial 30 finished with value: 0.035679335672708395 and parameters: {'n_layers': 2, 'embedding_dim': 256, 'lr': 0.0007518481530947555, 'lambda_val': 3.09284540259173e-06, 'batch_size': 2852, 'optimizer': 'Adam'}. Best is trial 1 with value: 0.05533924866101368.
2026-05-09 22:50:40,927 - optuna.study._optimize - INFO - Trial 31 pruned. 
2026-05-09 22:50:42,170 - optuna.study._optimize - INFO - Trial 32 pruned. 
2026-05-09 22:50:43,122 - optuna.study._optimize - INFO - Trial 33 pruned. 
2026-05-09 22:50:44,218 - optuna.study._optimize - INFO - Trial 34 pruned. 
2026-05-09 22:50:45,369 - optuna.study._optimize - INFO - Trial 35 pruned. 
2026-05-09 22:50:46,354 - optuna.study._optimize - INFO - Trial 36 pruned. 
2026-05-09 22:50:49,258 - optuna.study._optimize - INFO - Trial 37 pruned. 
2026-05-09 22:50:50,254 - optuna.study._optimize - INFO - Trial 38 pruned. 
2026-05-09 22:50:51,205 - optuna.study._optimize - INFO - Trial 39 pruned. 
2026-05-09 22:50:52,245 - optuna.study._optimize - INFO - Trial 40 pruned. 
2026-05-09 22:51:58,192 - optuna.study.study - INFO - Trial 41 finished with value: 0.03514661640303925 and parameters: {'n_layers': 4, 'embedding_dim': 256, 'lr': 0.07217061569240331, 'lambda_val': 6.197728007438597e-05, 'batch_size': 3707, 'optimizer': 'RMSprop'}. Best is trial 1 with value: 0.05533924866101368.
2026-05-09 22:53:08,989 - optuna.study.study - INFO - Trial 42 finished with value: 0.03172029447753077 and parameters: {'n_layers': 4, 'embedding_dim': 256, 'lr': 0.09206478064892834, 'lambda_val': 0.0002589419686870443, 'batch_size': 3283, 'optimizer': 'RMSprop'}. Best is trial 1 with value: 0.05533924866101368.
2026-05-09 22:54:13,042 - optuna.study.study - INFO - Trial 43 finished with value: 0.03397597503715699 and parameters: {'n_layers': 4, 'embedding_dim': 256, 'lr': 0.04144763186422692, 'lambda_val': 8.9085299976867e-05, 'batch_size': 3842, 'optimizer': 'RMSprop'}. Best is trial 1 with value: 0.05533924866101368.
2026-05-09 22:55:15,875 - optuna.study.study - INFO - Trial 44 finished with value: 0.036438258562320934 and parameters: {'n_layers': 4, 'embedding_dim': 256, 'lr': 0.04353630884524708, 'lambda_val': 7.407985403457348e-05, 'batch_size': 3926, 'optimizer': 'RMSprop'}. Best is trial 1 with value: 0.05533924866101368.
2026-05-09 22:56:02,902 - optuna.study.study - INFO - Trial 45 finished with value: 0.01662415997569197 and parameters: {'n_layers': 4, 'embedding_dim': 128, 'lr': 0.04495458738785791, 'lambda_val': 7.403273915128319e-06, 'batch_size': 3706, 'optimizer': 'RMSprop'}. Best is trial 1 with value: 0.05533924866101368.
2026-05-09 22:56:04,066 - optuna.study._optimize - INFO - Trial 46 pruned. 
2026-05-09 22:56:05,142 - optuna.study._optimize - INFO - Trial 47 pruned. 
2026-05-09 22:56:06,076 - optuna.study._optimize - INFO - Trial 48 pruned. 
2026-05-09 22:56:07,065 - optuna.study._optimize - INFO - Trial 49 pruned. 
2026-05-09 22:56:09,956 - optuna.study._optimize - INFO - Trial 50 pruned. 
2026-05-09 22:57:11,629 - optuna.study.study - INFO - Trial 51 finished with value: 0.03376919553848316 and parameters: {'n_layers': 4, 'embedding_dim': 256, 'lr': 0.03498853238419124, 'lambda_val': 8.314704444073593e-05, 'batch_size': 3840, 'optimizer': 'RMSprop'}. Best is trial 1 with value: 0.05533924866101368.
2026-05-09 22:57:12,561 - optuna.study._optimize - INFO - Trial 52 pruned. 
2026-05-09 22:57:13,615 - optuna.study._optimize - INFO - Trial 53 pruned. 
2026-05-09 22:58:21,255 - optuna.study.study - INFO - Trial 54 finished with value: 0.025942846809771897 and parameters: {'n_layers': 4, 'embedding_dim': 256, 'lr': 0.03923612418679679, 'lambda_val': 0.00044026638845876253, 'batch_size': 3980, 'optimizer': 'RMSprop'}. Best is trial 1 with value: 0.05533924866101368.
2026-05-09 22:58:22,227 - optuna.study._optimize - INFO - Trial 55 pruned. 
2026-05-09 22:58:23,179 - optuna.study._optimize - INFO - Trial 56 pruned. 
2026-05-09 22:58:24,186 - optuna.study._optimize - INFO - Trial 57 pruned. 
2026-05-09 22:58:25,171 - optuna.study._optimize - INFO - Trial 58 pruned. 
2026-05-09 22:58:26,155 - optuna.study._optimize - INFO - Trial 59 pruned. 
2026-05-09 22:58:27,151 - optuna.study._optimize - INFO - Trial 60 pruned. 
2026-05-09 22:59:29,584 - optuna.study.study - INFO - Trial 61 finished with value: 0.03150563785303993 and parameters: {'n_layers': 4, 'embedding_dim': 256, 'lr': 0.03373359709851746, 'lambda_val': 8.227465316132452e-05, 'batch_size': 3876, 'optimizer': 'RMSprop'}. Best is trial 1 with value: 0.05533924866101368.
2026-05-09 23:00:38,037 - optuna.study.study - INFO - Trial 62 finished with value: 0.03157309567791257 and parameters: {'n_layers': 4, 'embedding_dim': 256, 'lr': 0.050598081329437536, 'lambda_val': 0.0001702784477109231, 'batch_size': 4046, 'optimizer': 'RMSprop'}. Best is trial 1 with value: 0.05533924866101368.
2026-05-09 23:00:39,009 - optuna.study._optimize - INFO - Trial 63 pruned. 
2026-05-09 23:00:40,094 - optuna.study._optimize - INFO - Trial 64 pruned. 
2026-05-09 23:00:41,445 - optuna.study._optimize - INFO - Trial 65 pruned. 
2026-05-09 23:00:42,452 - optuna.study._optimize - INFO - Trial 66 pruned. 
2026-05-09 23:00:43,883 - optuna.study._optimize - INFO - Trial 67 pruned. 
2026-05-09 23:00:45,332 - optuna.study._optimize - INFO - Trial 68 pruned. 
2026-05-09 23:00:46,317 - optuna.study._optimize - INFO - Trial 69 pruned. 
2026-05-09 23:00:47,667 - optuna.study._optimize - INFO - Trial 70 pruned. 
2026-05-09 23:00:48,618 - optuna.study._optimize - INFO - Trial 71 pruned. 
2026-05-09 23:00:49,767 - optuna.study._optimize - INFO - Trial 72 pruned. 
2026-05-09 23:00:51,130 - optuna.study._optimize - INFO - Trial 73 pruned. 
2026-05-09 23:00:52,155 - optuna.study._optimize - INFO - Trial 74 pruned. 
2026-05-09 23:00:53,277 - optuna.study._optimize - INFO - Trial 75 pruned. 
2026-05-09 23:01:37,377 - optuna.study.study - INFO - Trial 76 finished with value: 0.041551345722002246 and parameters: {'n_layers': 4, 'embedding_dim': 128, 'lr': 0.09656239722519362, 'lambda_val': 0.0001886580163158608, 'batch_size': 534, 'optimizer': 'RMSprop'}. Best is trial 1 with value: 0.05533924866101368.
2026-05-09 23:01:38,393 - optuna.study._optimize - INFO - Trial 77 pruned. 
2026-05-09 23:01:39,467 - optuna.study._optimize - INFO - Trial 78 pruned. 
2026-05-09 23:02:22,497 - optuna.study.study - INFO - Trial 79 finished with value: 0.013041289994583883 and parameters: {'n_layers': 4, 'embedding_dim': 128, 'lr': 0.05961882837413816, 'lambda_val': 1.4752453051372414e-06, 'batch_size': 691, 'optimizer': 'RMSprop'}. Best is trial 1 with value: 0.05533924866101368.
2026-05-09 23:02:23,512 - optuna.study._optimize - INFO - Trial 80 pruned. 
2026-05-09 23:02:24,885 - optuna.study._optimize - INFO - Trial 81 pruned. 
2026-05-09 23:03:08,387 - optuna.study.study - INFO - Trial 82 finished with value: 0.03995072692868185 and parameters: {'n_layers': 4, 'embedding_dim': 128, 'lr': 0.021307688352281896, 'lambda_val': 0.00014217626109513687, 'batch_size': 546, 'optimizer': 'RMSprop'}. Best is trial 1 with value: 0.05533924866101368.
2026-05-09 23:03:51,415 - optuna.study.study - INFO - Trial 83 finished with value: 0.03587151844197439 and parameters: {'n_layers': 4, 'embedding_dim': 128, 'lr': 0.02331178651545509, 'lambda_val': 0.00026570721106214184, 'batch_size': 543, 'optimizer': 'RMSprop'}. Best is trial 1 with value: 0.05533924866101368.
2026-05-09 23:04:34,033 - optuna.study.study - INFO - Trial 84 finished with value: 0.02829155539416298 and parameters: {'n_layers': 4, 'embedding_dim': 128, 'lr': 0.02789495624707298, 'lambda_val': 0.0009532654850827069, 'batch_size': 562, 'optimizer': 'RMSprop'}. Best is trial 1 with value: 0.05533924866101368.
2026-05-09 23:04:39,041 - optuna.study._optimize - INFO - Trial 85 pruned. 
2026-05-09 23:04:45,953 - optuna.study._optimize - INFO - Trial 86 pruned. 
2026-05-09 23:04:47,181 - optuna.study._optimize - INFO - Trial 87 pruned. 
2026-05-09 23:04:48,199 - optuna.study._optimize - INFO - Trial 88 pruned. 
2026-05-09 23:04:49,439 - optuna.study._optimize - INFO - Trial 89 pruned. 
2026-05-09 23:04:50,390 - optuna.study._optimize - INFO - Trial 90 pruned. 
2026-05-09 23:04:51,766 - optuna.study._optimize - INFO - Trial 91 pruned. 
2026-05-09 23:04:52,852 - optuna.study._optimize - INFO - Trial 92 pruned. 
2026-05-09 23:05:33,233 - optuna.study.study - INFO - Trial 93 finished with value: 0.030445468638465638 and parameters: {'n_layers': 4, 'embedding_dim': 96, 'lr': 0.034900441781842734, 'lambda_val': 0.0002512328966339299, 'batch_size': 710, 'optimizer': 'RMSprop'}. Best is trial 1 with value: 0.05533924866101368.
2026-05-09 23:05:34,358 - optuna.study._optimize - INFO - Trial 94 pruned. 
2026-05-09 23:05:35,516 - optuna.study._optimize - INFO - Trial 95 pruned. 
2026-05-09 23:05:36,642 - optuna.study._optimize - INFO - Trial 96 pruned. 
2026-05-09 23:05:38,321 - optuna.study._optimize - INFO - Trial 97 pruned. 
2026-05-09 23:05:39,590 - optuna.study._optimize - INFO - Trial 98 pruned. 
2026-05-09 23:05:40,761 - optuna.study._optimize - INFO - Trial 99 pruned. 
