2026-05-09 17:16:56,508 - root - INFO - **** Training e_100K_full
2026-05-09 17:16:56,531 - helper_functions - INFO - Users: 610, Items: 9742
2026-05-09 17:16:56,656 - helper_functions - INFO - Edge index: torch.Size([2, 81763])
2026-05-09 17:16:56,656 - root - INFO - **** Generating the graph:
2026-05-09 17:16:56,722 - helper_functions - INFO - Number of unique users: 609
2026-05-09 17:16:56,723 - helper_functions - INFO - Number of unique items: 8452
2026-05-09 17:16:56,723 - helper_functions - INFO - Number of nodes: 9061
2026-05-09 17:16:56,724 - helper_functions - INFO - Number of edges: 81763
2026-05-09 17:16:59,445 - optuna.storages._rdb.storage - INFO - A new study created in RDB with name: Study_e_100K_full
2026-05-09 17:17:59,293 - optuna.study.study - INFO - Trial 0 finished with value: 0.003265438069196694 and parameters: {'n_layers': 4, 'embedding_dim': 256, 'lr': 1.5473944658045126e-05, 'lambda_val': 1.994796107440639e-05, 'batch_size': 2632, 'optimizer': 'SGD'}. Best is trial 0 with value: 0.003265438069196694.
2026-05-09 17:18:43,379 - optuna.study.study - INFO - Trial 1 finished with value: 0.015433030590020796 and parameters: {'n_layers': 3, 'embedding_dim': 128, 'lr': 1.3764889216814796e-05, 'lambda_val': 0.00021698662001788248, 'batch_size': 1644, 'optimizer': 'RMSprop'}. Best is trial 1 with value: 0.015433030590020796.
2026-05-09 17:19:19,443 - optuna.study.study - INFO - Trial 2 finished with value: 0.022538555734925685 and parameters: {'n_layers': 2, 'embedding_dim': 64, 'lr': 0.05784616903795026, 'lambda_val': 2.6225162561486838e-05, 'batch_size': 2138, 'optimizer': 'Adam'}. Best is trial 2 with value: 0.022538555734925685.
2026-05-09 17:19:57,702 - optuna.study.study - INFO - Trial 3 finished with value: 0.016575384397811498 and parameters: {'n_layers': 4, 'embedding_dim': 64, 'lr': 0.08128901010789277, 'lambda_val': 1.0600690726530654e-06, 'batch_size': 1044, 'optimizer': 'RMSprop'}. Best is trial 2 with value: 0.022538555734925685.
2026-05-09 17:20:40,449 - optuna.study.study - INFO - Trial 4 finished with value: 0.0533074483895665 and parameters: {'n_layers': 1, 'embedding_dim': 128, 'lr': 0.0017678319062592869, 'lambda_val': 7.455075327601651e-06, 'batch_size': 3057, 'optimizer': 'RMSprop'}. Best is trial 4 with value: 0.0533074483895665.
2026-05-09 17:20:41,433 - optuna.study._optimize - INFO - Trial 5 pruned. 
2026-05-09 17:20:43,009 - optuna.study._optimize - INFO - Trial 6 pruned. 
2026-05-09 17:20:44,053 - optuna.study._optimize - INFO - Trial 7 pruned. 
2026-05-09 17:20:45,043 - optuna.study._optimize - INFO - Trial 8 pruned. 
2026-05-09 17:20:46,317 - optuna.study._optimize - INFO - Trial 9 pruned. 
2026-05-09 17:20:47,312 - optuna.study._optimize - INFO - Trial 10 pruned. 
2026-05-09 17:20:48,739 - optuna.study._optimize - INFO - Trial 11 pruned. 
2026-05-09 17:20:49,779 - optuna.study._optimize - INFO - Trial 12 pruned. 
2026-05-09 17:20:51,140 - optuna.study._optimize - INFO - Trial 13 pruned. 
2026-05-09 17:20:52,181 - optuna.study._optimize - INFO - Trial 14 pruned. 
2026-05-09 17:20:53,667 - optuna.study._optimize - INFO - Trial 15 pruned. 
2026-05-09 17:20:54,656 - optuna.study._optimize - INFO - Trial 16 pruned. 
2026-05-09 17:20:56,088 - optuna.study._optimize - INFO - Trial 17 pruned. 
2026-05-09 17:20:57,187 - optuna.study._optimize - INFO - Trial 18 pruned. 
2026-05-09 17:21:26,084 - optuna.study.study - INFO - Trial 19 finished with value: 0.02926441294779927 and parameters: {'n_layers': 2, 'embedding_dim': 32, 'lr': 0.030166046054796433, 'lambda_val': 6.970912705889171e-05, 'batch_size': 542, 'optimizer': 'RMSprop'}. Best is trial 4 with value: 0.0533074483895665.
2026-05-09 17:21:57,743 - optuna.study.study - INFO - Trial 20 finished with value: 0.036113904102159755 and parameters: {'n_layers': 3, 'embedding_dim': 32, 'lr': 0.02214689736865075, 'lambda_val': 0.00010424240132519, 'batch_size': 546, 'optimizer': 'RMSprop'}. Best is trial 4 with value: 0.0533074483895665.
2026-05-09 17:21:59,812 - optuna.study._optimize - INFO - Trial 21 pruned. 
2026-05-09 17:22:31,767 - optuna.study.study - INFO - Trial 22 finished with value: 0.034958152036877875 and parameters: {'n_layers': 3, 'embedding_dim': 32, 'lr': 0.02283783004372437, 'lambda_val': 0.00044257308425398745, 'batch_size': 1080, 'optimizer': 'RMSprop'}. Best is trial 4 with value: 0.0533074483895665.
2026-05-09 17:22:32,793 - optuna.study._optimize - INFO - Trial 23 pruned. 
2026-05-09 17:22:33,801 - optuna.study._optimize - INFO - Trial 24 pruned. 
2026-05-09 17:22:35,506 - optuna.study._optimize - INFO - Trial 25 pruned. 
2026-05-09 17:22:37,403 - optuna.study._optimize - INFO - Trial 26 pruned. 
2026-05-09 17:22:38,447 - optuna.study._optimize - INFO - Trial 27 pruned. 
2026-05-09 17:23:04,272 - optuna.study._optimize - INFO - Trial 28 pruned. 
2026-05-09 17:23:05,300 - optuna.study._optimize - INFO - Trial 29 pruned. 
2026-05-09 17:23:06,720 - optuna.study._optimize - INFO - Trial 30 pruned. 
2026-05-09 17:23:35,830 - optuna.study.study - INFO - Trial 31 finished with value: 0.025998024664653237 and parameters: {'n_layers': 2, 'embedding_dim': 32, 'lr': 0.028473201280423473, 'lambda_val': 8.454824105745448e-05, 'batch_size': 576, 'optimizer': 'RMSprop'}. Best is trial 4 with value: 0.0533074483895665.
2026-05-09 17:23:37,825 - optuna.study._optimize - INFO - Trial 32 pruned. 
2026-05-09 17:23:38,899 - optuna.study._optimize - INFO - Trial 33 pruned. 
2026-05-09 17:23:40,261 - optuna.study._optimize - INFO - Trial 34 pruned. 
2026-05-09 17:24:21,027 - optuna.study.study - INFO - Trial 35 finished with value: 0.04708419245264216 and parameters: {'n_layers': 3, 'embedding_dim': 128, 'lr': 0.015129193861675065, 'lambda_val': 0.0002589707118319643, 'batch_size': 1805, 'optimizer': 'RMSprop'}. Best is trial 4 with value: 0.0533074483895665.
2026-05-09 17:24:22,026 - optuna.study._optimize - INFO - Trial 36 pruned. 
2026-05-09 17:24:23,469 - optuna.study._optimize - INFO - Trial 37 pruned. 
2026-05-09 17:24:24,527 - optuna.study._optimize - INFO - Trial 38 pruned. 
2026-05-09 17:24:25,635 - optuna.study._optimize - INFO - Trial 39 pruned. 
2026-05-09 17:24:26,827 - optuna.study._optimize - INFO - Trial 40 pruned. 
2026-05-09 17:24:59,536 - optuna.study.study - INFO - Trial 41 finished with value: 0.028726381942441193 and parameters: {'n_layers': 3, 'embedding_dim': 32, 'lr': 0.022154517130475167, 'lambda_val': 2.817603473913449e-05, 'batch_size': 987, 'optimizer': 'RMSprop'}. Best is trial 4 with value: 0.0533074483895665.
2026-05-09 17:25:33,733 - optuna.study.study - INFO - Trial 42 finished with value: 0.054368193966452115 and parameters: {'n_layers': 2, 'embedding_dim': 128, 'lr': 0.0385365130277391, 'lambda_val': 0.00034006815493167584, 'batch_size': 712, 'optimizer': 'RMSprop'}. Best is trial 42 with value: 0.054368193966452115.
2026-05-09 17:25:34,867 - optuna.study._optimize - INFO - Trial 43 pruned. 
2026-05-09 17:26:15,613 - optuna.study.study - INFO - Trial 44 finished with value: 0.05031327738589646 and parameters: {'n_layers': 3, 'embedding_dim': 128, 'lr': 0.019512021678594605, 'lambda_val': 0.0005472236436881581, 'batch_size': 742, 'optimizer': 'RMSprop'}. Best is trial 42 with value: 0.054368193966452115.
2026-05-09 17:26:16,607 - optuna.study._optimize - INFO - Trial 45 pruned. 
2026-05-09 17:26:17,902 - optuna.study._optimize - INFO - Trial 46 pruned. 
2026-05-09 17:26:20,580 - optuna.study._optimize - INFO - Trial 47 pruned. 
2026-05-09 17:26:21,587 - optuna.study._optimize - INFO - Trial 48 pruned. 
2026-05-09 17:26:22,726 - optuna.study._optimize - INFO - Trial 49 pruned. 
2026-05-09 17:26:23,892 - optuna.study._optimize - INFO - Trial 50 pruned. 
2026-05-09 17:27:04,929 - optuna.study.study - INFO - Trial 51 finished with value: 0.04795690772158605 and parameters: {'n_layers': 3, 'embedding_dim': 128, 'lr': 0.01890767029337905, 'lambda_val': 0.0006304935468814537, 'batch_size': 822, 'optimizer': 'RMSprop'}. Best is trial 42 with value: 0.054368193966452115.
2026-05-09 17:27:05,857 - optuna.study._optimize - INFO - Trial 52 pruned. 
2026-05-09 17:27:46,324 - optuna.study.study - INFO - Trial 53 finished with value: 0.0408778750224135 and parameters: {'n_layers': 3, 'embedding_dim': 128, 'lr': 0.03333942740284181, 'lambda_val': 0.0016040937137770895, 'batch_size': 717, 'optimizer': 'RMSprop'}. Best is trial 42 with value: 0.054368193966452115.
2026-05-09 17:28:27,165 - optuna.study.study - INFO - Trial 54 finished with value: 0.04386320099810839 and parameters: {'n_layers': 3, 'embedding_dim': 128, 'lr': 0.04082910615939713, 'lambda_val': 0.0010767026595672304, 'batch_size': 714, 'optimizer': 'RMSprop'}. Best is trial 42 with value: 0.054368193966452115.
2026-05-09 17:28:28,196 - optuna.study._optimize - INFO - Trial 55 pruned. 
2026-05-09 17:28:29,243 - optuna.study._optimize - INFO - Trial 56 pruned. 
2026-05-09 17:28:30,503 - optuna.study._optimize - INFO - Trial 57 pruned. 
2026-05-09 17:28:32,071 - optuna.study._optimize - INFO - Trial 58 pruned. 
2026-05-09 17:29:12,378 - optuna.study.study - INFO - Trial 59 finished with value: 0.050134049192376934 and parameters: {'n_layers': 3, 'embedding_dim': 128, 'lr': 0.015596575173032897, 'lambda_val': 0.0005193360458290278, 'batch_size': 714, 'optimizer': 'RMSprop'}. Best is trial 42 with value: 0.054368193966452115.
2026-05-09 17:29:13,377 - optuna.study._optimize - INFO - Trial 60 pruned. 
2026-05-09 17:29:54,317 - optuna.study.study - INFO - Trial 61 finished with value: 0.04649543354457324 and parameters: {'n_layers': 3, 'embedding_dim': 128, 'lr': 0.01574376049821788, 'lambda_val': 0.0013574170484593922, 'batch_size': 726, 'optimizer': 'RMSprop'}. Best is trial 42 with value: 0.054368193966452115.
2026-05-09 17:30:35,142 - optuna.study.study - INFO - Trial 62 finished with value: 0.033117546609416335 and parameters: {'n_layers': 3, 'embedding_dim': 128, 'lr': 0.01761423174260484, 'lambda_val': 0.0016386860023107996, 'batch_size': 2202, 'optimizer': 'RMSprop'}. Best is trial 42 with value: 0.054368193966452115.
2026-05-09 17:31:16,463 - optuna.study.study - INFO - Trial 63 finished with value: 0.04960213285683662 and parameters: {'n_layers': 3, 'embedding_dim': 128, 'lr': 0.011001280396974296, 'lambda_val': 0.00032473361331578304, 'batch_size': 1074, 'optimizer': 'RMSprop'}. Best is trial 42 with value: 0.054368193966452115.
2026-05-09 17:31:57,250 - optuna.study.study - INFO - Trial 64 finished with value: 0.04967557551698673 and parameters: {'n_layers': 3, 'embedding_dim': 128, 'lr': 0.01005340642200924, 'lambda_val': 0.00027838118825727247, 'batch_size': 1353, 'optimizer': 'RMSprop'}. Best is trial 42 with value: 0.054368193966452115.
2026-05-09 17:31:58,288 - optuna.study._optimize - INFO - Trial 65 pruned. 
2026-05-09 17:31:59,717 - optuna.study._optimize - INFO - Trial 66 pruned. 
2026-05-09 17:32:01,389 - optuna.study._optimize - INFO - Trial 67 pruned. 
2026-05-09 17:32:02,307 - optuna.study._optimize - INFO - Trial 68 pruned. 
2026-05-09 17:32:03,469 - optuna.study._optimize - INFO - Trial 69 pruned. 
2026-05-09 17:32:42,833 - optuna.study.study - INFO - Trial 70 finished with value: 0.04683077311927176 and parameters: {'n_layers': 3, 'embedding_dim': 128, 'lr': 0.025540665892498784, 'lambda_val': 0.000715761226731796, 'batch_size': 1033, 'optimizer': 'RMSprop'}. Best is trial 42 with value: 0.054368193966452115.
2026-05-09 17:32:43,602 - optuna.study._optimize - INFO - Trial 71 pruned. 
2026-05-09 17:32:44,350 - optuna.study._optimize - INFO - Trial 72 pruned. 
2026-05-09 17:32:46,000 - optuna.study._optimize - INFO - Trial 73 pruned. 
2026-05-09 17:32:52,918 - optuna.study._optimize - INFO - Trial 74 pruned. 
2026-05-09 17:33:27,012 - optuna.study.study - INFO - Trial 75 finished with value: 0.05146218379707229 and parameters: {'n_layers': 2, 'embedding_dim': 128, 'lr': 0.020098471613541363, 'lambda_val': 0.0008006291522817412, 'batch_size': 822, 'optimizer': 'RMSprop'}. Best is trial 42 with value: 0.054368193966452115.
2026-05-09 17:33:28,110 - optuna.study._optimize - INFO - Trial 76 pruned. 
2026-05-09 17:33:29,641 - optuna.study._optimize - INFO - Trial 77 pruned. 
2026-05-09 17:33:30,807 - optuna.study._optimize - INFO - Trial 78 pruned. 
2026-05-09 17:33:32,022 - optuna.study._optimize - INFO - Trial 79 pruned. 
2026-05-09 17:33:33,126 - optuna.study._optimize - INFO - Trial 80 pruned. 
2026-05-09 17:33:34,180 - optuna.study._optimize - INFO - Trial 81 pruned. 
2026-05-09 17:34:15,005 - optuna.study.study - INFO - Trial 82 finished with value: 0.04866346518666733 and parameters: {'n_layers': 3, 'embedding_dim': 128, 'lr': 0.017170906321659966, 'lambda_val': 0.00048493251460125656, 'batch_size': 1946, 'optimizer': 'RMSprop'}. Best is trial 42 with value: 0.054368193966452115.
2026-05-09 17:34:16,943 - optuna.study._optimize - INFO - Trial 83 pruned. 
2026-05-09 17:34:59,414 - optuna.study.study - INFO - Trial 84 finished with value: 0.0507454514601897 and parameters: {'n_layers': 3, 'embedding_dim': 128, 'lr': 0.022083654636985476, 'lambda_val': 0.0001658039917226078, 'batch_size': 2545, 'optimizer': 'RMSprop'}. Best is trial 42 with value: 0.054368193966452115.
2026-05-09 17:35:01,192 - optuna.study._optimize - INFO - Trial 85 pruned. 
2026-05-09 17:35:01,917 - optuna.study._optimize - INFO - Trial 86 pruned. 
2026-05-09 17:35:02,575 - optuna.study._optimize - INFO - Trial 87 pruned. 
2026-05-09 17:35:04,138 - optuna.study._optimize - INFO - Trial 88 pruned. 
2026-05-09 17:35:05,163 - optuna.study._optimize - INFO - Trial 89 pruned. 
2026-05-09 17:35:06,375 - optuna.study._optimize - INFO - Trial 90 pruned. 
2026-05-09 17:35:47,268 - optuna.study.study - INFO - Trial 91 finished with value: 0.047776515361207465 and parameters: {'n_layers': 3, 'embedding_dim': 128, 'lr': 0.019846435021072473, 'lambda_val': 0.00048663483097332975, 'batch_size': 2414, 'optimizer': 'RMSprop'}. Best is trial 42 with value: 0.054368193966452115.
2026-05-09 17:35:48,225 - optuna.study._optimize - INFO - Trial 92 pruned. 
2026-05-09 17:36:28,614 - optuna.study.study - INFO - Trial 93 finished with value: 0.04879687548327304 and parameters: {'n_layers': 3, 'embedding_dim': 128, 'lr': 0.01774098131695709, 'lambda_val': 0.0008249694794716741, 'batch_size': 911, 'optimizer': 'RMSprop'}. Best is trial 42 with value: 0.054368193966452115.
2026-05-09 17:37:05,497 - optuna.study.study - INFO - Trial 94 finished with value: 0.04379823414654538 and parameters: {'n_layers': 3, 'embedding_dim': 128, 'lr': 0.03338619737556628, 'lambda_val': 0.0009200309516478369, 'batch_size': 936, 'optimizer': 'RMSprop'}. Best is trial 42 with value: 0.054368193966452115.
2026-05-09 17:37:07,053 - optuna.study._optimize - INFO - Trial 95 pruned. 
2026-05-09 17:37:07,834 - optuna.study._optimize - INFO - Trial 96 pruned. 
2026-05-09 17:37:09,529 - optuna.study._optimize - INFO - Trial 97 pruned. 
2026-05-09 17:37:10,254 - optuna.study._optimize - INFO - Trial 98 pruned. 
2026-05-09 17:37:11,012 - optuna.study._optimize - INFO - Trial 99 pruned. 
2026-05-09 17:37:37,536 - root - INFO - **** Training e_100K_1c1dcs
2026-05-09 17:37:37,536 - root - INFO -   ** 1-Dominant stats:
2026-05-09 17:37:37,536 - root - INFO -   ** Finding the dominant set:
2026-05-09 17:37:51,796 - root - INFO -   ** Getting the trainable edges:
2026-05-09 17:37:51,801 - helper_functions - INFO -      Number of nodes: 547
2026-05-09 17:37:51,801 - helper_functions - INFO -      Ratio: 0.06036861273590111
2026-05-09 17:37:51,801 - helper_functions - INFO -      Number of unique users: 320
2026-05-09 17:37:51,801 - helper_functions - INFO -      Number of unique items: 227
2026-05-09 17:37:51,801 - helper_functions - INFO -      Total dominant set edge: 66391
2026-05-09 17:37:51,801 - helper_functions - INFO -      Trainable edges: 53112.8
2026-05-09 17:37:51,809 - root - INFO -   **** Getting 66391 dominant set edges
2026-05-09 17:37:52,676 - optuna.storages._rdb.storage - INFO - A new study created in RDB with name: Study_e_100K_1c1dcs
2026-05-09 17:38:25,963 - optuna.study.study - INFO - Trial 0 finished with value: 0.022549610297623198 and parameters: {'n_layers': 2, 'embedding_dim': 128, 'lr': 0.051460643352952376, 'lambda_val': 9.34850043522216e-06, 'batch_size': 2887, 'optimizer': 'Adam'}. Best is trial 0 with value: 0.022549610297623198.
2026-05-09 17:39:08,033 - optuna.study.study - INFO - Trial 1 finished with value: 0.0013159062877630622 and parameters: {'n_layers': 3, 'embedding_dim': 32, 'lr': 0.08412137786418492, 'lambda_val': 0.0011443935429989584, 'batch_size': 2097, 'optimizer': 'SGD'}. Best is trial 0 with value: 0.022549610297623198.
2026-05-09 17:39:45,839 - optuna.study.study - INFO - Trial 2 finished with value: 0.0005339499992314126 and parameters: {'n_layers': 1, 'embedding_dim': 96, 'lr': 0.0009804847556243255, 'lambda_val': 0.006396430229658719, 'batch_size': 3183, 'optimizer': 'SGD'}. Best is trial 0 with value: 0.022549610297623198.
2026-05-09 17:40:21,432 - optuna.study.study - INFO - Trial 3 finished with value: 0.009885119397205478 and parameters: {'n_layers': 3, 'embedding_dim': 32, 'lr': 0.006389476404254579, 'lambda_val': 9.31898449105483e-06, 'batch_size': 3140, 'optimizer': 'Adam'}. Best is trial 0 with value: 0.022549610297623198.
2026-05-09 17:40:48,654 - optuna.study.study - INFO - Trial 4 finished with value: 0.0009054459699959083 and parameters: {'n_layers': 1, 'embedding_dim': 64, 'lr': 0.00015537082085222338, 'lambda_val': 0.09267728884746318, 'batch_size': 3670, 'optimizer': 'SGD'}. Best is trial 0 with value: 0.022549610297623198.
2026-05-09 17:41:31,414 - optuna.study.study - INFO - Trial 5 finished with value: 0.017794794559440868 and parameters: {'n_layers': 2, 'embedding_dim': 256, 'lr': 1.3533433310065633e-05, 'lambda_val': 0.00024360440983803332, 'batch_size': 3415, 'optimizer': 'RMSprop'}. Best is trial 0 with value: 0.022549610297623198.
2026-05-09 17:41:32,993 - optuna.study._optimize - INFO - Trial 6 pruned. 
2026-05-09 17:42:35,916 - optuna.study.study - INFO - Trial 7 finished with value: 0.015078958115105786 and parameters: {'n_layers': 4, 'embedding_dim': 256, 'lr': 9.685471875273954e-05, 'lambda_val': 0.010220762422855906, 'batch_size': 1593, 'optimizer': 'RMSprop'}. Best is trial 0 with value: 0.022549610297623198.
2026-05-09 17:42:36,831 - optuna.study._optimize - INFO - Trial 8 pruned. 
2026-05-09 17:42:37,822 - optuna.study._optimize - INFO - Trial 9 pruned. 
2026-05-09 17:43:22,923 - optuna.study.study - INFO - Trial 10 finished with value: 0.009101652180868535 and parameters: {'n_layers': 4, 'embedding_dim': 128, 'lr': 0.09239005473808318, 'lambda_val': 1.6452790382472529e-06, 'batch_size': 530, 'optimizer': 'Adam'}. Best is trial 0 with value: 0.022549610297623198.
2026-05-09 17:43:23,934 - optuna.study._optimize - INFO - Trial 11 pruned. 
2026-05-09 17:43:57,365 - optuna.study.study - INFO - Trial 12 finished with value: 0.028938730216458222 and parameters: {'n_layers': 2, 'embedding_dim': 96, 'lr': 0.013997410423547373, 'lambda_val': 3.550190045273123e-05, 'batch_size': 2736, 'optimizer': 'RMSprop'}. Best is trial 12 with value: 0.028938730216458222.
2026-05-09 17:44:36,868 - optuna.study.study - INFO - Trial 13 finished with value: 0.025116440826315686 and parameters: {'n_layers': 3, 'embedding_dim': 96, 'lr': 0.017336173843020393, 'lambda_val': 1.2378001642811791e-05, 'batch_size': 2663, 'optimizer': 'RMSprop'}. Best is trial 12 with value: 0.028938730216458222.
2026-05-09 17:45:13,298 - optuna.study.study - INFO - Trial 14 finished with value: 0.022920422209111467 and parameters: {'n_layers': 3, 'embedding_dim': 96, 'lr': 0.014315339855586171, 'lambda_val': 2.9441736724637596e-05, 'batch_size': 1656, 'optimizer': 'RMSprop'}. Best is trial 12 with value: 0.028938730216458222.
2026-05-09 17:45:51,713 - optuna.study.study - INFO - Trial 15 finished with value: 0.02065454768452214 and parameters: {'n_layers': 3, 'embedding_dim': 96, 'lr': 0.012059219782176429, 'lambda_val': 1.0109529344516275e-06, 'batch_size': 2658, 'optimizer': 'RMSprop'}. Best is trial 12 with value: 0.028938730216458222.
2026-05-09 17:46:35,215 - optuna.study.study - INFO - Trial 16 finished with value: 0.016709948249734503 and parameters: {'n_layers': 4, 'embedding_dim': 96, 'lr': 0.004731445569301055, 'lambda_val': 4.8181438427065735e-05, 'batch_size': 1761, 'optimizer': 'RMSprop'}. Best is trial 12 with value: 0.028938730216458222.
2026-05-09 17:47:13,737 - optuna.study.study - INFO - Trial 17 finished with value: 0.021529679819393372 and parameters: {'n_layers': 3, 'embedding_dim': 96, 'lr': 0.0244291470985713, 'lambda_val': 6.025533882323613e-06, 'batch_size': 2585, 'optimizer': 'RMSprop'}. Best is trial 12 with value: 0.028938730216458222.
2026-05-09 17:47:15,302 - optuna.study._optimize - INFO - Trial 18 pruned. 
2026-05-09 17:48:01,007 - optuna.study.study - INFO - Trial 19 finished with value: 0.033713660369335235 and parameters: {'n_layers': 3, 'embedding_dim': 96, 'lr': 0.030421057186849808, 'lambda_val': 0.0007113853473936562, 'batch_size': 1229, 'optimizer': 'RMSprop'}. Best is trial 19 with value: 0.033713660369335235.
2026-05-09 17:48:02,682 - optuna.study._optimize - INFO - Trial 20 pruned. 
2026-05-09 17:48:39,681 - optuna.study.study - INFO - Trial 21 finished with value: 0.021465073135692833 and parameters: {'n_layers': 3, 'embedding_dim': 96, 'lr': 0.012670254372522838, 'lambda_val': 2.0199451871472546e-05, 'batch_size': 1176, 'optimizer': 'RMSprop'}. Best is trial 19 with value: 0.033713660369335235.
2026-05-09 17:49:29,092 - optuna.study.study - INFO - Trial 22 finished with value: 0.02489275322200759 and parameters: {'n_layers': 3, 'embedding_dim': 96, 'lr': 0.030218176134252043, 'lambda_val': 3.291396146458052e-06, 'batch_size': 1975, 'optimizer': 'RMSprop'}. Best is trial 19 with value: 0.033713660369335235.
2026-05-09 17:49:30,115 - optuna.study._optimize - INFO - Trial 23 pruned. 
