2026-05-17 19:42:12,327 - optuna.study.study - INFO - Trial 120 finished with value: 0.07384242582435084 and parameters: {'n_layers': 2, 'embedding_dim': 64, 'lr': 0.0007475049941641604, 'lambda_val': 6.146580519222069e-06, 'batch_size': 1004, 'optimizer': 'Adam'}. Best is trial 100 with value: 0.09325427051656286.
2026-05-17 19:42:26,682 - experiment_functions - INFO - Early stopping at epoch 850. Best Recall: 0.0773
2026-05-17 19:42:26,780 - optuna.study.study - INFO - Trial 121 finished with value: 0.07732427566050565 and parameters: {'n_layers': 1, 'embedding_dim': 64, 'lr': 0.0014227874639947862, 'lambda_val': 4.286881897061739e-06, 'batch_size': 1198, 'optimizer': 'Adam'}. Best is trial 100 with value: 0.09325427051656286.
2026-05-17 19:42:44,349 - experiment_functions - INFO - Early stopping at epoch 1050. Best Recall: 0.0847
2026-05-17 19:42:44,458 - optuna.study.study - INFO - Trial 122 finished with value: 0.08465566194775791 and parameters: {'n_layers': 1, 'embedding_dim': 64, 'lr': 0.0009732057573232267, 'lambda_val': 2.168264654781306e-06, 'batch_size': 1305, 'optimizer': 'Adam'}. Best is trial 100 with value: 0.09325427051656286.
2026-05-17 19:43:00,124 - optuna.study._optimize - INFO - Trial 123 pruned. 
2026-05-17 19:43:16,241 - optuna.study._optimize - INFO - Trial 124 pruned. 
2026-05-17 19:43:33,609 - experiment_functions - INFO - Early stopping at epoch 800. Best Recall: 0.0807
2026-05-17 19:43:33,698 - optuna.study.study - INFO - Trial 125 finished with value: 0.08070974440018368 and parameters: {'n_layers': 1, 'embedding_dim': 64, 'lr': 0.0022081783547098486, 'lambda_val': 1.6704706968636826e-06, 'batch_size': 555, 'optimizer': 'Adam'}. Best is trial 100 with value: 0.09325427051656286.
2026-05-17 19:43:55,797 - experiment_functions - INFO - Early stopping at epoch 950. Best Recall: 0.0828
2026-05-17 19:43:55,896 - optuna.study.study - INFO - Trial 126 finished with value: 0.08284140927348349 and parameters: {'n_layers': 1, 'embedding_dim': 96, 'lr': 0.0012769234156694116, 'lambda_val': 4.219103338307582e-06, 'batch_size': 806, 'optimizer': 'Adam'}. Best is trial 100 with value: 0.09325427051656286.
2026-05-17 19:44:25,019 - experiment_functions - INFO - Early stopping at epoch 1650. Best Recall: 0.0844
2026-05-17 19:44:25,111 - optuna.study.study - INFO - Trial 127 finished with value: 0.08443205832102058 and parameters: {'n_layers': 1, 'embedding_dim': 64, 'lr': 0.0006513894421109185, 'lambda_val': 9.261137395521204e-06, 'batch_size': 1185, 'optimizer': 'Adam'}. Best is trial 100 with value: 0.09325427051656286.
2026-05-17 19:44:42,785 - experiment_functions - INFO - Early stopping at epoch 1100. Best Recall: 0.0859
2026-05-17 19:44:42,887 - optuna.study.study - INFO - Trial 128 finished with value: 0.08587172653580795 and parameters: {'n_layers': 1, 'embedding_dim': 64, 'lr': 0.0010846558074602873, 'lambda_val': 4.578611149653308e-05, 'batch_size': 1058, 'optimizer': 'Adam'}. Best is trial 100 with value: 0.09325427051656286.
2026-05-17 19:45:03,869 - experiment_functions - INFO - Early stopping at epoch 1100. Best Recall: 0.0791
2026-05-17 19:45:03,969 - optuna.study.study - INFO - Trial 129 finished with value: 0.07908483028517097 and parameters: {'n_layers': 1, 'embedding_dim': 128, 'lr': 0.0008314829525389571, 'lambda_val': 2.878717443093424e-06, 'batch_size': 1274, 'optimizer': 'Adam'}. Best is trial 100 with value: 0.09325427051656286.
2026-05-17 19:45:12,679 - experiment_functions - INFO - Early stopping at epoch 500. Best Recall: 0.0053
2026-05-17 19:45:12,814 - optuna.study.study - INFO - Trial 130 finished with value: 0.005285136640685734 and parameters: {'n_layers': 1, 'embedding_dim': 64, 'lr': 0.0003647811675957506, 'lambda_val': 1.971443737834348e-06, 'batch_size': 973, 'optimizer': 'SGD'}. Best is trial 100 with value: 0.09325427051656286.
2026-05-17 19:45:53,572 - experiment_functions - INFO - Early stopping at epoch 2000. Best Recall: 0.0980
2026-05-17 19:45:53,672 - optuna.study.study - INFO - Trial 131 finished with value: 0.098022206917696 and parameters: {'n_layers': 1, 'embedding_dim': 64, 'lr': 0.000727417161661605, 'lambda_val': 1.0512180184472405e-06, 'batch_size': 794, 'optimizer': 'Adam'}. Best is trial 131 with value: 0.098022206917696.
2026-05-17 19:46:14,875 - optuna.study._optimize - INFO - Trial 132 pruned. 
2026-05-17 19:46:47,206 - experiment_functions - INFO - Early stopping at epoch 1850. Best Recall: 0.0875
2026-05-17 19:46:47,294 - optuna.study.study - INFO - Trial 133 finished with value: 0.08747050751773632 and parameters: {'n_layers': 1, 'embedding_dim': 64, 'lr': 0.0007077275015289492, 'lambda_val': 1.4266192854036423e-06, 'batch_size': 1093, 'optimizer': 'Adam'}. Best is trial 131 with value: 0.098022206917696.
2026-05-17 19:47:09,133 - experiment_functions - INFO - Early stopping at epoch 1100. Best Recall: 0.0850
2026-05-17 19:47:09,223 - optuna.study.study - INFO - Trial 134 finished with value: 0.08495587785740179 and parameters: {'n_layers': 1, 'embedding_dim': 64, 'lr': 0.0009895831372381302, 'lambda_val': 2.0939601634104487e-06, 'batch_size': 816, 'optimizer': 'Adam'}. Best is trial 131 with value: 0.098022206917696.
2026-05-17 19:47:25,995 - experiment_functions - INFO - Early stopping at epoch 800. Best Recall: 0.0882
2026-05-17 19:47:26,150 - optuna.study.study - INFO - Trial 135 finished with value: 0.08817746758963028 and parameters: {'n_layers': 1, 'embedding_dim': 64, 'lr': 0.0020640053383696104, 'lambda_val': 1.1807182956943855e-06, 'batch_size': 720, 'optimizer': 'Adam'}. Best is trial 131 with value: 0.098022206917696.
2026-05-17 19:47:39,897 - experiment_functions - INFO - Early stopping at epoch 850. Best Recall: 0.0815
2026-05-17 19:47:39,976 - optuna.study.study - INFO - Trial 136 finished with value: 0.08151025702389822 and parameters: {'n_layers': 1, 'embedding_dim': 64, 'lr': 0.0013607135162684717, 'lambda_val': 2.8134158438315462e-06, 'batch_size': 1541, 'optimizer': 'Adam'}. Best is trial 131 with value: 0.098022206917696.
2026-05-17 19:47:54,186 - optuna.study._optimize - INFO - Trial 137 pruned. 
2026-05-17 19:48:13,758 - optuna.study._optimize - INFO - Trial 138 pruned. 
2026-05-17 19:48:28,501 - optuna.study._optimize - INFO - Trial 139 pruned. 
2026-05-17 19:48:51,950 - experiment_functions - INFO - Early stopping at epoch 1450. Best Recall: 0.0898
2026-05-17 19:48:52,240 - optuna.study.study - INFO - Trial 140 finished with value: 0.08983869356287702 and parameters: {'n_layers': 1, 'embedding_dim': 64, 'lr': 0.0007925490957426797, 'lambda_val': 2.406587397673256e-06, 'batch_size': 669, 'optimizer': 'RMSprop'}. Best is trial 131 with value: 0.098022206917696.
2026-05-17 19:49:14,887 - experiment_functions - INFO - Early stopping at epoch 1350. Best Recall: 0.0917
2026-05-17 19:49:14,976 - optuna.study.study - INFO - Trial 141 finished with value: 0.09167651987516727 and parameters: {'n_layers': 1, 'embedding_dim': 64, 'lr': 0.0008004608797322804, 'lambda_val': 2.2701976944230754e-06, 'batch_size': 514, 'optimizer': 'RMSprop'}. Best is trial 131 with value: 0.098022206917696.
2026-05-17 19:49:36,583 - experiment_functions - INFO - Early stopping at epoch 1400. Best Recall: 0.0891
2026-05-17 19:49:36,683 - optuna.study.study - INFO - Trial 142 finished with value: 0.08912966098731508 and parameters: {'n_layers': 1, 'embedding_dim': 64, 'lr': 0.0007815321359731284, 'lambda_val': 2.361872820486455e-06, 'batch_size': 668, 'optimizer': 'RMSprop'}. Best is trial 131 with value: 0.098022206917696.
2026-05-17 19:49:56,444 - experiment_functions - INFO - Early stopping at epoch 1150. Best Recall: 0.0883
2026-05-17 19:49:56,556 - optuna.study.study - INFO - Trial 143 finished with value: 0.08830113275719433 and parameters: {'n_layers': 1, 'embedding_dim': 64, 'lr': 0.0008296658209360605, 'lambda_val': 2.3457428522977912e-06, 'batch_size': 653, 'optimizer': 'RMSprop'}. Best is trial 131 with value: 0.098022206917696.
2026-05-17 19:50:25,260 - experiment_functions - INFO - Early stopping at epoch 1800. Best Recall: 0.0904
2026-05-17 19:50:25,361 - optuna.study.study - INFO - Trial 144 finished with value: 0.09044303574181808 and parameters: {'n_layers': 1, 'embedding_dim': 64, 'lr': 0.0007193553210635631, 'lambda_val': 1.6940720554914396e-06, 'batch_size': 562, 'optimizer': 'RMSprop'}. Best is trial 131 with value: 0.098022206917696.
2026-05-17 19:50:45,458 - experiment_functions - INFO - Early stopping at epoch 1050. Best Recall: 0.0821
2026-05-17 19:50:45,547 - optuna.study.study - INFO - Trial 145 finished with value: 0.08205508684847054 and parameters: {'n_layers': 1, 'embedding_dim': 256, 'lr': 0.0007316027757341114, 'lambda_val': 1.3669318162206589e-06, 'batch_size': 546, 'optimizer': 'RMSprop'}. Best is trial 131 with value: 0.098022206917696.
2026-05-17 19:51:00,901 - optuna.study._optimize - INFO - Trial 146 pruned. 
2026-05-17 19:51:15,364 - experiment_functions - INFO - Early stopping at epoch 900. Best Recall: 0.0746
2026-05-17 19:51:15,475 - optuna.study.study - INFO - Trial 147 finished with value: 0.07461118020274574 and parameters: {'n_layers': 1, 'embedding_dim': 64, 'lr': 0.0009830529460703688, 'lambda_val': 3.0071041008885448e-06, 'batch_size': 683, 'optimizer': 'RMSprop'}. Best is trial 131 with value: 0.098022206917696.
2026-05-17 19:51:31,509 - optuna.study._optimize - INFO - Trial 148 pruned. 
2026-05-17 19:51:56,629 - experiment_functions - INFO - Early stopping at epoch 1650. Best Recall: 0.0890
2026-05-17 19:51:56,717 - optuna.study.study - INFO - Trial 149 finished with value: 0.08902063832962938 and parameters: {'n_layers': 1, 'embedding_dim': 64, 'lr': 0.0006597628963703801, 'lambda_val': 1.000504865417375e-06, 'batch_size': 777, 'optimizer': 'RMSprop'}. Best is trial 131 with value: 0.098022206917696.
2026-05-17 19:52:34,631 - experiment_functions - INFO - Early stopping at epoch 2400. Best Recall: 0.0994
2026-05-17 19:52:34,741 - optuna.study.study - INFO - Trial 150 finished with value: 0.09943758933682462 and parameters: {'n_layers': 1, 'embedding_dim': 64, 'lr': 0.0006157582343566493, 'lambda_val': 1.0088127113500322e-06, 'batch_size': 765, 'optimizer': 'RMSprop'}. Best is trial 150 with value: 0.09943758933682462.
2026-05-17 19:53:04,643 - experiment_functions - INFO - Early stopping at epoch 1900. Best Recall: 0.0897
2026-05-17 19:53:04,788 - optuna.study.study - INFO - Trial 151 finished with value: 0.08971735962022633 and parameters: {'n_layers': 1, 'embedding_dim': 64, 'lr': 0.0006312244431303622, 'lambda_val': 1.0444785552522538e-06, 'batch_size': 759, 'optimizer': 'RMSprop'}. Best is trial 150 with value: 0.09943758933682462.
2026-05-17 19:53:31,172 - experiment_functions - INFO - Early stopping at epoch 1700. Best Recall: 0.0917
2026-05-17 19:53:31,271 - optuna.study.study - INFO - Trial 152 finished with value: 0.09169094575801232 and parameters: {'n_layers': 1, 'embedding_dim': 64, 'lr': 0.000653075773978336, 'lambda_val': 1.051406751604073e-06, 'batch_size': 751, 'optimizer': 'RMSprop'}. Best is trial 150 with value: 0.09943758933682462.
2026-05-17 19:53:46,743 - optuna.study._optimize - INFO - Trial 153 pruned. 
2026-05-17 19:54:27,984 - experiment_functions - INFO - Early stopping at epoch 2700. Best Recall: 0.0931
2026-05-17 19:54:28,073 - optuna.study.study - INFO - Trial 154 finished with value: 0.09307528179430007 and parameters: {'n_layers': 1, 'embedding_dim': 64, 'lr': 0.000558292300216034, 'lambda_val': 1.5982685161848964e-06, 'batch_size': 682, 'optimizer': 'RMSprop'}. Best is trial 150 with value: 0.09943758933682462.
2026-05-17 19:55:06,482 - experiment_functions - INFO - Early stopping at epoch 2450. Best Recall: 0.0932
2026-05-17 19:55:06,582 - optuna.study.study - INFO - Trial 155 finished with value: 0.09324683779425628 and parameters: {'n_layers': 1, 'embedding_dim': 64, 'lr': 0.0005620918249070715, 'lambda_val': 1.379711928545228e-06, 'batch_size': 736, 'optimizer': 'RMSprop'}. Best is trial 150 with value: 0.09943758933682462.
2026-05-17 19:55:52,866 - experiment_functions - INFO - Early stopping at epoch 3000. Best Recall: 0.0980
2026-05-17 19:55:52,958 - optuna.study.study - INFO - Trial 156 finished with value: 0.09800462396678404 and parameters: {'n_layers': 1, 'embedding_dim': 64, 'lr': 0.0005248209121255299, 'lambda_val': 1.2077477893437039e-06, 'batch_size': 789, 'optimizer': 'RMSprop'}. Best is trial 150 with value: 0.09943758933682462.
2026-05-17 19:56:08,054 - optuna.study._optimize - INFO - Trial 157 pruned. 
2026-05-17 19:56:22,882 - optuna.study._optimize - INFO - Trial 158 pruned. 
2026-05-17 19:56:38,074 - optuna.study._optimize - INFO - Trial 159 pruned. 
2026-05-17 19:57:00,622 - optuna.study._optimize - INFO - Trial 160 pruned. 
2026-05-17 19:57:41,411 - experiment_functions - INFO - Early stopping at epoch 2600. Best Recall: 0.0979
2026-05-17 19:57:41,499 - optuna.study.study - INFO - Trial 161 finished with value: 0.0978978143490263 and parameters: {'n_layers': 1, 'embedding_dim': 64, 'lr': 0.0006164287598225655, 'lambda_val': 1.0679501842840685e-06, 'batch_size': 749, 'optimizer': 'RMSprop'}. Best is trial 150 with value: 0.09943758933682462.
2026-05-17 19:57:55,684 - experiment_functions - INFO - Early stopping at epoch 750. Best Recall: 0.0564
2026-05-17 19:57:55,774 - optuna.study.study - INFO - Trial 162 finished with value: 0.056406539005534946 and parameters: {'n_layers': 3, 'embedding_dim': 64, 'lr': 0.000578964012494501, 'lambda_val': 1.2125879694220754e-06, 'batch_size': 708, 'optimizer': 'RMSprop'}. Best is trial 150 with value: 0.09943758933682462.
2026-05-17 19:58:10,763 - optuna.study._optimize - INFO - Trial 163 pruned. 
2026-05-17 19:58:38,884 - experiment_functions - INFO - Early stopping at epoch 1800. Best Recall: 0.0908
2026-05-17 19:58:38,982 - optuna.study.study - INFO - Trial 164 finished with value: 0.09075347084830684 and parameters: {'n_layers': 1, 'embedding_dim': 64, 'lr': 0.0006850046174054032, 'lambda_val': 1.4543278809416498e-06, 'batch_size': 520, 'optimizer': 'RMSprop'}. Best is trial 150 with value: 0.09943758933682462.
2026-05-17 19:58:54,098 - optuna.study._optimize - INFO - Trial 165 pruned. 
2026-05-17 19:59:22,547 - experiment_functions - INFO - Early stopping at epoch 1850. Best Recall: 0.0933
2026-05-17 19:59:22,637 - optuna.study.study - INFO - Trial 166 finished with value: 0.09333454947958293 and parameters: {'n_layers': 1, 'embedding_dim': 64, 'lr': 0.0006211823905956782, 'lambda_val': 1.8161324067978914e-06, 'batch_size': 920, 'optimizer': 'RMSprop'}. Best is trial 150 with value: 0.09943758933682462.
2026-05-17 19:59:38,123 - optuna.study._optimize - INFO - Trial 167 pruned. 
2026-05-17 20:00:12,099 - experiment_functions - INFO - Early stopping at epoch 2200. Best Recall: 0.0956
2026-05-17 20:00:12,198 - optuna.study.study - INFO - Trial 168 finished with value: 0.09555078390149532 and parameters: {'n_layers': 1, 'embedding_dim': 64, 'lr': 0.0006433885834635713, 'lambda_val': 1.770277964092132e-06, 'batch_size': 764, 'optimizer': 'RMSprop'}. Best is trial 150 with value: 0.09943758933682462.
2026-05-17 20:00:41,253 - experiment_functions - INFO - Early stopping at epoch 1800. Best Recall: 0.0919
2026-05-17 20:00:41,354 - optuna.study.study - INFO - Trial 169 finished with value: 0.09193763739820562 and parameters: {'n_layers': 1, 'embedding_dim': 64, 'lr': 0.0006201516973866354, 'lambda_val': 1.9025395351517535e-06, 'batch_size': 893, 'optimizer': 'RMSprop'}. Best is trial 150 with value: 0.09943758933682462.
2026-05-17 20:00:55,829 - optuna.study._optimize - INFO - Trial 170 pruned. 
2026-05-17 20:01:17,235 - optuna.study._optimize - INFO - Trial 171 pruned. 
2026-05-17 20:01:32,497 - optuna.study._optimize - INFO - Trial 172 pruned. 
2026-05-17 20:01:49,487 - optuna.study._optimize - INFO - Trial 173 pruned. 
2026-05-17 20:02:05,082 - optuna.study._optimize - INFO - Trial 174 pruned. 
2026-05-17 20:02:19,645 - optuna.study._optimize - INFO - Trial 175 pruned. 
2026-05-17 20:02:48,881 - experiment_functions - INFO - Early stopping at epoch 1850. Best Recall: 0.0946
2026-05-17 20:02:49,016 - optuna.study.study - INFO - Trial 176 finished with value: 0.09462837293550716 and parameters: {'n_layers': 1, 'embedding_dim': 64, 'lr': 0.0006411766128801005, 'lambda_val': 1.9324952169302257e-06, 'batch_size': 659, 'optimizer': 'RMSprop'}. Best is trial 150 with value: 0.09943758933682462.
2026-05-17 20:03:07,527 - optuna.study._optimize - INFO - Trial 177 pruned. 
2026-05-17 20:03:23,034 - optuna.study._optimize - INFO - Trial 178 pruned. 
2026-05-17 20:03:42,487 - experiment_functions - INFO - Early stopping at epoch 1200. Best Recall: 0.0914
2026-05-17 20:03:42,597 - optuna.study.study - INFO - Trial 179 finished with value: 0.09141200753965484 and parameters: {'n_layers': 1, 'embedding_dim': 64, 'lr': 0.0008300296116728577, 'lambda_val': 2.5623016292021354e-06, 'batch_size': 780, 'optimizer': 'RMSprop'}. Best is trial 150 with value: 0.09943758933682462.
2026-05-17 20:04:02,225 - experiment_functions - INFO - Early stopping at epoch 1250. Best Recall: 0.0876
2026-05-17 20:04:02,320 - optuna.study.study - INFO - Trial 180 finished with value: 0.08764529152230069 and parameters: {'n_layers': 1, 'embedding_dim': 64, 'lr': 0.0008263204421750775, 'lambda_val': 2.7736313337066335e-06, 'batch_size': 771, 'optimizer': 'RMSprop'}. Best is trial 150 with value: 0.09943758933682462.
2026-05-17 20:04:17,322 - experiment_functions - INFO - Early stopping at epoch 750. Best Recall: 0.0447
2026-05-17 20:04:17,412 - optuna.study.study - INFO - Trial 181 finished with value: 0.044700123679751264 and parameters: {'n_layers': 4, 'embedding_dim': 64, 'lr': 0.000609589519466938, 'lambda_val': 1.8277051018699218e-06, 'batch_size': 636, 'optimizer': 'RMSprop'}. Best is trial 150 with value: 0.09943758933682462.
2026-05-17 20:04:33,898 - experiment_functions - INFO - Early stopping at epoch 1000. Best Recall: 0.0834
2026-05-17 20:04:34,034 - optuna.study.study - INFO - Trial 182 finished with value: 0.08341436738459856 and parameters: {'n_layers': 1, 'embedding_dim': 64, 'lr': 0.0009178582269378036, 'lambda_val': 1.226542370546571e-06, 'batch_size': 806, 'optimizer': 'RMSprop'}. Best is trial 150 with value: 0.09943758933682462.
2026-05-17 20:04:49,525 - optuna.study._optimize - INFO - Trial 183 pruned. 
2026-05-17 20:05:15,095 - experiment_functions - INFO - Early stopping at epoch 1550. Best Recall: 0.0922
2026-05-17 20:05:15,196 - optuna.study.study - INFO - Trial 184 finished with value: 0.09220922920250403 and parameters: {'n_layers': 1, 'embedding_dim': 64, 'lr': 0.000710274694524912, 'lambda_val': 2.261875725209431e-06, 'batch_size': 919, 'optimizer': 'RMSprop'}. Best is trial 150 with value: 0.09943758933682462.
2026-05-17 20:05:32,842 - experiment_functions - INFO - Early stopping at epoch 1100. Best Recall: 0.0865
2026-05-17 20:05:32,943 - optuna.study.study - INFO - Trial 185 finished with value: 0.08648414653717829 and parameters: {'n_layers': 1, 'embedding_dim': 64, 'lr': 0.0007956350085840242, 'lambda_val': 2.2405214459479867e-06, 'batch_size': 898, 'optimizer': 'RMSprop'}. Best is trial 150 with value: 0.09943758933682462.
2026-05-17 20:05:45,878 - experiment_functions - INFO - Early stopping at epoch 750. Best Recall: 0.0790
2026-05-17 20:05:45,977 - optuna.study.study - INFO - Trial 186 finished with value: 0.0789979334553962 and parameters: {'n_layers': 1, 'embedding_dim': 64, 'lr': 0.001113219631135132, 'lambda_val': 1.0002076375930402e-06, 'batch_size': 938, 'optimizer': 'RMSprop'}. Best is trial 150 with value: 0.09943758933682462.
2026-05-17 20:06:02,177 - optuna.study._optimize - INFO - Trial 187 pruned. 
2026-05-17 20:06:17,537 - optuna.study._optimize - INFO - Trial 188 pruned. 
2026-05-17 20:06:47,910 - experiment_functions - INFO - Early stopping at epoch 1800. Best Recall: 0.0899
2026-05-17 20:06:48,000 - optuna.study.study - INFO - Trial 189 finished with value: 0.08987785708455924 and parameters: {'n_layers': 1, 'embedding_dim': 96, 'lr': 0.0006419600758625512, 'lambda_val': 3.488997257200174e-06, 'batch_size': 628, 'optimizer': 'RMSprop'}. Best is trial 150 with value: 0.09943758933682462.
2026-05-17 20:07:04,567 - optuna.study._optimize - INFO - Trial 190 pruned. 
2026-05-17 20:07:23,739 - optuna.study._optimize - INFO - Trial 191 pruned. 
2026-05-17 20:07:55,095 - experiment_functions - INFO - Early stopping at epoch 1950. Best Recall: 0.0920
2026-05-17 20:07:55,204 - optuna.study.study - INFO - Trial 192 finished with value: 0.09200929572769628 and parameters: {'n_layers': 1, 'embedding_dim': 64, 'lr': 0.0006436680550278856, 'lambda_val': 1.538339372351867e-06, 'batch_size': 624, 'optimizer': 'RMSprop'}. Best is trial 150 with value: 0.09943758933682462.
2026-05-17 20:08:36,414 - experiment_functions - INFO - Early stopping at epoch 2600. Best Recall: 0.0952
2026-05-17 20:08:36,505 - optuna.study.study - INFO - Trial 193 finished with value: 0.09516937041433131 and parameters: {'n_layers': 1, 'embedding_dim': 64, 'lr': 0.0005736985827338946, 'lambda_val': 1.9377815840733874e-06, 'batch_size': 642, 'optimizer': 'RMSprop'}. Best is trial 150 with value: 0.09943758933682462.
2026-05-17 20:08:52,538 - optuna.study._optimize - INFO - Trial 194 pruned. 
2026-05-17 20:09:12,676 - experiment_functions - INFO - Early stopping at epoch 1200. Best Recall: 0.0903
2026-05-17 20:09:12,768 - optuna.study.study - INFO - Trial 195 finished with value: 0.0903419597429508 and parameters: {'n_layers': 1, 'embedding_dim': 64, 'lr': 0.0008153277389003488, 'lambda_val': 1.0017573507385513e-06, 'batch_size': 690, 'optimizer': 'RMSprop'}. Best is trial 150 with value: 0.09943758933682462.
2026-05-17 20:09:45,971 - experiment_functions - INFO - Early stopping at epoch 2100. Best Recall: 0.0941
