2026-05-18 21:08:14,862 - optuna.study.study - INFO - Trial 79 finished with value: 0.08890588337069986 and parameters: {'n_layers': 1, 'embedding_dim': 256, 'lr': 0.001071991294539531, 'lambda_val': 1.5398052472628826e-05, 'batch_size': 849, 'optimizer': 'Adam'}. Best is trial 63 with value: 0.09324104052534629.
2026-05-18 21:08:24,599 - experiment_functions - INFO - Early stopping at epoch 500. Best Recall: 0.0051
2026-05-18 21:08:24,747 - optuna.study.study - INFO - Trial 80 finished with value: 0.005085498086044309 and parameters: {'n_layers': 2, 'embedding_dim': 256, 'lr': 0.00012221385261431154, 'lambda_val': 4.828486498901899e-05, 'batch_size': 609, 'optimizer': 'SGD'}. Best is trial 63 with value: 0.09324104052534629.
2026-05-18 21:08:53,671 - experiment_functions - INFO - Early stopping at epoch 1400. Best Recall: 0.0909
2026-05-18 21:08:54,354 - optuna.study.study - INFO - Trial 81 finished with value: 0.09087724097585703 and parameters: {'n_layers': 1, 'embedding_dim': 256, 'lr': 0.0005348739593164281, 'lambda_val': 0.0006246855340249596, 'batch_size': 896, 'optimizer': 'Adam'}. Best is trial 63 with value: 0.09324104052534629.
2026-05-18 21:09:28,304 - experiment_functions - INFO - Early stopping at epoch 750. Best Recall: 0.0853
2026-05-18 21:09:29,818 - optuna.study.study - INFO - Trial 82 finished with value: 0.08529633053436828 and parameters: {'n_layers': 1, 'embedding_dim': 256, 'lr': 0.001525376979150116, 'lambda_val': 8.642558166001541e-05, 'batch_size': 865, 'optimizer': 'Adam'}. Best is trial 63 with value: 0.09324104052534629.
2026-05-18 21:10:24,841 - experiment_functions - INFO - Early stopping at epoch 2200. Best Recall: 0.0943
2026-05-18 21:10:24,933 - optuna.study.study - INFO - Trial 83 finished with value: 0.09426854705251331 and parameters: {'n_layers': 1, 'embedding_dim': 256, 'lr': 0.00036329015106830473, 'lambda_val': 0.000250291636750732, 'batch_size': 1007, 'optimizer': 'Adam'}. Best is trial 83 with value: 0.09426854705251331.
2026-05-18 21:10:52,897 - experiment_functions - INFO - Early stopping at epoch 1800. Best Recall: 0.0925
2026-05-18 21:10:52,990 - optuna.study.study - INFO - Trial 84 finished with value: 0.09248849968492732 and parameters: {'n_layers': 1, 'embedding_dim': 256, 'lr': 0.00039441901414963043, 'lambda_val': 0.00032639595056242656, 'batch_size': 1029, 'optimizer': 'Adam'}. Best is trial 83 with value: 0.09426854705251331.
2026-05-18 21:11:09,686 - optuna.study._optimize - INFO - Trial 85 pruned. 
2026-05-18 21:11:32,429 - optuna.study._optimize - INFO - Trial 86 pruned. 
2026-05-18 21:11:51,324 - experiment_functions - INFO - Early stopping at epoch 1200. Best Recall: 0.0894
2026-05-18 21:11:51,470 - optuna.study.study - INFO - Trial 87 finished with value: 0.0893612628108197 and parameters: {'n_layers': 1, 'embedding_dim': 256, 'lr': 0.00042070334213648096, 'lambda_val': 0.00035973675873582703, 'batch_size': 1236, 'optimizer': 'RMSprop'}. Best is trial 83 with value: 0.09426854705251331.
2026-05-18 21:12:05,016 - optuna.study._optimize - INFO - Trial 88 pruned. 
2026-05-18 21:12:13,443 - experiment_functions - INFO - Early stopping at epoch 550. Best Recall: 0.0125
2026-05-18 21:12:13,534 - optuna.study.study - INFO - Trial 89 finished with value: 0.012504576833260301 and parameters: {'n_layers': 1, 'embedding_dim': 256, 'lr': 0.0809333294168653, 'lambda_val': 0.00026695877314836757, 'batch_size': 627, 'optimizer': 'Adam'}. Best is trial 83 with value: 0.09426854705251331.
2026-05-18 21:12:27,853 - experiment_functions - INFO - Early stopping at epoch 800. Best Recall: 0.0883
2026-05-18 21:12:27,943 - optuna.study.study - INFO - Trial 90 finished with value: 0.08832674299241532 and parameters: {'n_layers': 1, 'embedding_dim': 256, 'lr': 0.001055011106379492, 'lambda_val': 0.0012425304957650331, 'batch_size': 962, 'optimizer': 'Adam'}. Best is trial 83 with value: 0.09426854705251331.
2026-05-18 21:12:42,925 - experiment_functions - INFO - Early stopping at epoch 950. Best Recall: 0.0901
2026-05-18 21:12:43,061 - optuna.study.study - INFO - Trial 91 finished with value: 0.09012215037275058 and parameters: {'n_layers': 1, 'embedding_dim': 256, 'lr': 0.0007210494830502113, 'lambda_val': 0.00016105941017757386, 'batch_size': 1142, 'optimizer': 'Adam'}. Best is trial 83 with value: 0.09426854705251331.
2026-05-18 21:13:16,859 - experiment_functions - INFO - Early stopping at epoch 1950. Best Recall: 0.0937
2026-05-18 21:13:16,948 - optuna.study.study - INFO - Trial 92 finished with value: 0.09365889002682641 and parameters: {'n_layers': 1, 'embedding_dim': 256, 'lr': 0.0003840027646192685, 'lambda_val': 3.765887201247568e-05, 'batch_size': 1042, 'optimizer': 'Adam'}. Best is trial 83 with value: 0.09426854705251331.
2026-05-18 21:13:55,374 - experiment_functions - INFO - Early stopping at epoch 2250. Best Recall: 0.0935
2026-05-18 21:13:55,507 - optuna.study.study - INFO - Trial 93 finished with value: 0.09353201154876493 and parameters: {'n_layers': 1, 'embedding_dim': 256, 'lr': 0.0003539109089803407, 'lambda_val': 4.054787578753664e-05, 'batch_size': 1031, 'optimizer': 'Adam'}. Best is trial 83 with value: 0.09426854705251331.
2026-05-18 21:14:16,236 - optuna.study._optimize - INFO - Trial 94 pruned. 
2026-05-18 21:14:36,845 - optuna.study._optimize - INFO - Trial 95 pruned. 
2026-05-18 21:14:54,112 - optuna.study._optimize - INFO - Trial 96 pruned. 
2026-05-18 21:15:15,669 - optuna.study._optimize - INFO - Trial 97 pruned. 
2026-05-18 21:15:34,613 - experiment_functions - INFO - Early stopping at epoch 1050. Best Recall: 0.0877
2026-05-18 21:15:34,701 - optuna.study.study - INFO - Trial 98 finished with value: 0.08771853757942286 and parameters: {'n_layers': 1, 'embedding_dim': 256, 'lr': 0.0005857296156734396, 'lambda_val': 0.00011759767648258849, 'batch_size': 1211, 'optimizer': 'Adam'}. Best is trial 83 with value: 0.09426854705251331.
2026-05-18 21:15:55,608 - experiment_functions - INFO - Early stopping at epoch 1300. Best Recall: 0.0925
2026-05-18 21:15:55,698 - optuna.study.study - INFO - Trial 99 finished with value: 0.09249639055370884 and parameters: {'n_layers': 1, 'embedding_dim': 256, 'lr': 0.0004539812170414062, 'lambda_val': 6.412083520108928e-05, 'batch_size': 932, 'optimizer': 'RMSprop'}. Best is trial 83 with value: 0.09426854705251331.
2026-05-18 21:16:10,537 - optuna.study._optimize - INFO - Trial 100 pruned. 
2026-05-18 21:16:27,362 - optuna.study._optimize - INFO - Trial 101 pruned. 
2026-05-18 21:17:01,403 - experiment_functions - INFO - Early stopping at epoch 1600. Best Recall: 0.0924
2026-05-18 21:17:01,493 - optuna.study.study - INFO - Trial 102 finished with value: 0.09244396940144742 and parameters: {'n_layers': 1, 'embedding_dim': 256, 'lr': 0.0004394620705663654, 'lambda_val': 6.247079463099572e-05, 'batch_size': 696, 'optimizer': 'RMSprop'}. Best is trial 83 with value: 0.09426854705251331.
2026-05-18 21:17:18,230 - optuna.study._optimize - INFO - Trial 103 pruned. 
2026-05-18 21:17:37,603 - experiment_functions - INFO - Early stopping at epoch 1200. Best Recall: 0.0910
2026-05-18 21:17:37,692 - optuna.study.study - INFO - Trial 104 finished with value: 0.09099983394365446 and parameters: {'n_layers': 1, 'embedding_dim': 256, 'lr': 0.0004375412080628285, 'lambda_val': 2.7975279061209358e-05, 'batch_size': 1055, 'optimizer': 'RMSprop'}. Best is trial 83 with value: 0.09426854705251331.
2026-05-18 21:17:58,784 - optuna.study._optimize - INFO - Trial 105 pruned. 
2026-05-18 21:18:25,090 - experiment_functions - INFO - Early stopping at epoch 1800. Best Recall: 0.0923
2026-05-18 21:18:25,190 - optuna.study.study - INFO - Trial 106 finished with value: 0.09234019720947423 and parameters: {'n_layers': 1, 'embedding_dim': 96, 'lr': 0.0004974467647156571, 'lambda_val': 0.00025448571061069956, 'batch_size': 657, 'optimizer': 'RMSprop'}. Best is trial 83 with value: 0.09426854705251331.
2026-05-18 21:18:38,911 - optuna.study._optimize - INFO - Trial 107 pruned. 
2026-05-18 21:19:27,578 - experiment_functions - INFO - Early stopping at epoch 2800. Best Recall: 0.0957
2026-05-18 21:19:27,680 - optuna.study.study - INFO - Trial 108 finished with value: 0.09569141189916612 and parameters: {'n_layers': 1, 'embedding_dim': 64, 'lr': 0.0004831006668517743, 'lambda_val': 0.0001525778279307085, 'batch_size': 692, 'optimizer': 'RMSprop'}. Best is trial 108 with value: 0.09569141189916612.
2026-05-18 21:19:41,362 - optuna.study._optimize - INFO - Trial 109 pruned. 
2026-05-18 21:20:10,261 - experiment_functions - INFO - Early stopping at epoch 1950. Best Recall: 0.0949
2026-05-18 21:20:10,351 - optuna.study.study - INFO - Trial 110 finished with value: 0.09493453986806856 and parameters: {'n_layers': 1, 'embedding_dim': 96, 'lr': 0.0005109096600472195, 'lambda_val': 0.0003079690999936125, 'batch_size': 589, 'optimizer': 'RMSprop'}. Best is trial 108 with value: 0.09569141189916612.
2026-05-18 21:20:56,858 - experiment_functions - INFO - Early stopping at epoch 2600. Best Recall: 0.0942
2026-05-18 21:20:56,949 - optuna.study.study - INFO - Trial 111 finished with value: 0.09417356157949144 and parameters: {'n_layers': 1, 'embedding_dim': 96, 'lr': 0.0004659472198250827, 'lambda_val': 0.00032315218650550727, 'batch_size': 673, 'optimizer': 'RMSprop'}. Best is trial 108 with value: 0.09569141189916612.
2026-05-18 21:21:11,522 - optuna.study._optimize - INFO - Trial 112 pruned. 
2026-05-18 21:21:18,937 - experiment_functions - INFO - Early stopping at epoch 500. Best Recall: 0.0047
2026-05-18 21:21:19,039 - optuna.study.study - INFO - Trial 113 finished with value: 0.0047018920703981275 and parameters: {'n_layers': 1, 'embedding_dim': 96, 'lr': 4.36172637833757e-05, 'lambda_val': 0.00036819783990603265, 'batch_size': 914, 'optimizer': 'RMSprop'}. Best is trial 108 with value: 0.09569141189916612.
2026-05-18 21:21:42,685 - experiment_functions - INFO - Early stopping at epoch 1600. Best Recall: 0.0933
2026-05-18 21:21:42,784 - optuna.study.study - INFO - Trial 114 finished with value: 0.09331674925475301 and parameters: {'n_layers': 1, 'embedding_dim': 64, 'lr': 0.0005938722359774243, 'lambda_val': 0.00012963402634736057, 'batch_size': 749, 'optimizer': 'RMSprop'}. Best is trial 108 with value: 0.09569141189916612.
2026-05-18 21:22:02,978 - experiment_functions - INFO - Early stopping at epoch 1350. Best Recall: 0.0946
2026-05-18 21:22:03,098 - optuna.study.study - INFO - Trial 115 finished with value: 0.09462211440587114 and parameters: {'n_layers': 1, 'embedding_dim': 64, 'lr': 0.000639125018300611, 'lambda_val': 0.00030506412689533557, 'batch_size': 771, 'optimizer': 'RMSprop'}. Best is trial 108 with value: 0.09569141189916612.
2026-05-18 21:22:26,824 - experiment_functions - INFO - Early stopping at epoch 1650. Best Recall: 0.0938
2026-05-18 21:22:26,913 - optuna.study.study - INFO - Trial 116 finished with value: 0.09384327878554845 and parameters: {'n_layers': 1, 'embedding_dim': 64, 'lr': 0.0006083093505822084, 'lambda_val': 0.0001421278296844344, 'batch_size': 563, 'optimizer': 'RMSprop'}. Best is trial 108 with value: 0.09569141189916612.
2026-05-18 21:23:00,365 - experiment_functions - INFO - Early stopping at epoch 1750. Best Recall: 0.0949
2026-05-18 21:23:00,456 - optuna.study.study - INFO - Trial 117 finished with value: 0.09488116708562584 and parameters: {'n_layers': 1, 'embedding_dim': 64, 'lr': 0.0005968580732083544, 'lambda_val': 0.00013393992155486632, 'batch_size': 566, 'optimizer': 'RMSprop'}. Best is trial 108 with value: 0.09569141189916612.
2026-05-18 21:23:29,280 - experiment_functions - INFO - Early stopping at epoch 2000. Best Recall: 0.0938
2026-05-18 21:23:29,381 - optuna.study.study - INFO - Trial 118 finished with value: 0.09381502995328722 and parameters: {'n_layers': 1, 'embedding_dim': 64, 'lr': 0.0006225952284039494, 'lambda_val': 0.0001737671785243392, 'batch_size': 531, 'optimizer': 'RMSprop'}. Best is trial 108 with value: 0.09569141189916612.
2026-05-18 21:23:46,781 - optuna.study._optimize - INFO - Trial 119 pruned. 
2026-05-18 21:24:01,214 - optuna.study._optimize - INFO - Trial 120 pruned. 
2026-05-18 21:24:35,990 - experiment_functions - INFO - Early stopping at epoch 2450. Best Recall: 0.0949
2026-05-18 21:24:36,080 - optuna.study.study - INFO - Trial 121 finished with value: 0.09493266637537474 and parameters: {'n_layers': 1, 'embedding_dim': 64, 'lr': 0.0006140768903875332, 'lambda_val': 0.0001425331266420755, 'batch_size': 526, 'optimizer': 'RMSprop'}. Best is trial 108 with value: 0.09569141189916612.
2026-05-18 21:25:00,627 - experiment_functions - INFO - Early stopping at epoch 1700. Best Recall: 0.0932
2026-05-18 21:25:00,717 - optuna.study.study - INFO - Trial 122 finished with value: 0.09323395430267863 and parameters: {'n_layers': 1, 'embedding_dim': 64, 'lr': 0.0006440045445554946, 'lambda_val': 0.00014312757444242443, 'batch_size': 531, 'optimizer': 'RMSprop'}. Best is trial 108 with value: 0.09569141189916612.
2026-05-18 21:25:11,561 - experiment_functions - INFO - Early stopping at epoch 700. Best Recall: 0.0890
2026-05-18 21:25:11,696 - optuna.study.study - INFO - Trial 123 finished with value: 0.08897514586359274 and parameters: {'n_layers': 1, 'embedding_dim': 64, 'lr': 0.001204396388419723, 'lambda_val': 0.00030611870419228876, 'batch_size': 674, 'optimizer': 'RMSprop'}. Best is trial 108 with value: 0.09569141189916612.
2026-05-18 21:26:04,081 - experiment_functions - INFO - Early stopping at epoch 3050. Best Recall: 0.0974
2026-05-18 21:26:04,177 - optuna.study.study - INFO - Trial 124 finished with value: 0.09743594012147899 and parameters: {'n_layers': 1, 'embedding_dim': 64, 'lr': 0.0005676217387925647, 'lambda_val': 0.00011039392333702603, 'batch_size': 582, 'optimizer': 'RMSprop'}. Best is trial 124 with value: 0.09743594012147899.
2026-05-18 21:26:17,615 - experiment_functions - INFO - Early stopping at epoch 750. Best Recall: 0.0687
2026-05-18 21:26:17,703 - optuna.study.study - INFO - Trial 125 finished with value: 0.06872509120433855 and parameters: {'n_layers': 3, 'embedding_dim': 64, 'lr': 0.0005815890378851437, 'lambda_val': 0.00010077691360042494, 'batch_size': 519, 'optimizer': 'RMSprop'}. Best is trial 124 with value: 0.09743594012147899.
2026-05-18 21:26:37,695 - experiment_functions - INFO - Early stopping at epoch 1400. Best Recall: 0.0953
2026-05-18 21:26:37,794 - optuna.study.study - INFO - Trial 126 finished with value: 0.09534335180433434 and parameters: {'n_layers': 1, 'embedding_dim': 64, 'lr': 0.0007272124267277449, 'lambda_val': 0.0001708640837959231, 'batch_size': 598, 'optimizer': 'RMSprop'}. Best is trial 124 with value: 0.09743594012147899.
2026-05-18 21:26:54,276 - experiment_functions - INFO - Early stopping at epoch 1100. Best Recall: 0.0909
2026-05-18 21:26:55,042 - optuna.study.study - INFO - Trial 127 finished with value: 0.09092443067937679 and parameters: {'n_layers': 1, 'embedding_dim': 64, 'lr': 0.000690415998962819, 'lambda_val': 0.0001779190303827899, 'batch_size': 589, 'optimizer': 'RMSprop'}. Best is trial 124 with value: 0.09743594012147899.
2026-05-18 21:27:15,894 - experiment_functions - INFO - Early stopping at epoch 800. Best Recall: 0.0841
2026-05-18 21:27:16,040 - optuna.study.study - INFO - Trial 128 finished with value: 0.08409104413439342 and parameters: {'n_layers': 1, 'embedding_dim': 64, 'lr': 0.0009789552110413206, 'lambda_val': 0.000512806094162063, 'batch_size': 594, 'optimizer': 'RMSprop'}. Best is trial 124 with value: 0.09743594012147899.
2026-05-18 21:27:29,989 - optuna.study._optimize - INFO - Trial 129 pruned. 
2026-05-18 21:27:49,650 - experiment_functions - INFO - Early stopping at epoch 1350. Best Recall: 0.0960
2026-05-18 21:27:49,739 - optuna.study.study - INFO - Trial 130 finished with value: 0.09602821730101907 and parameters: {'n_layers': 1, 'embedding_dim': 64, 'lr': 0.0007469415379700481, 'lambda_val': 0.0002750792365410158, 'batch_size': 522, 'optimizer': 'RMSprop'}. Best is trial 124 with value: 0.09743594012147899.
2026-05-18 21:28:08,182 - experiment_functions - INFO - Early stopping at epoch 1300. Best Recall: 0.0954
2026-05-18 21:28:08,283 - optuna.study.study - INFO - Trial 131 finished with value: 0.09539051314325395 and parameters: {'n_layers': 1, 'embedding_dim': 64, 'lr': 0.0007558247265533853, 'lambda_val': 0.0002750379214212714, 'batch_size': 521, 'optimizer': 'RMSprop'}. Best is trial 124 with value: 0.09743594012147899.
2026-05-18 21:28:29,311 - experiment_functions - INFO - Early stopping at epoch 1300. Best Recall: 0.0977
2026-05-18 21:28:29,585 - optuna.study.study - INFO - Trial 132 finished with value: 0.09765203524228237 and parameters: {'n_layers': 1, 'embedding_dim': 64, 'lr': 0.0007538876266204377, 'lambda_val': 0.00029541464284028125, 'batch_size': 529, 'optimizer': 'RMSprop'}. Best is trial 132 with value: 0.09765203524228237.
2026-05-18 21:28:42,639 - experiment_functions - INFO - Early stopping at epoch 750. Best Recall: 0.0853
2026-05-18 21:28:42,730 - optuna.study.study - INFO - Trial 133 finished with value: 0.08525381801842526 and parameters: {'n_layers': 1, 'embedding_dim': 64, 'lr': 0.001258666669570623, 'lambda_val': 0.00031030067225793444, 'batch_size': 513, 'optimizer': 'RMSprop'}. Best is trial 132 with value: 0.09765203524228237.
2026-05-18 21:28:58,957 - optuna.study._optimize - INFO - Trial 134 pruned. 
2026-05-18 21:29:12,818 - experiment_functions - INFO - Early stopping at epoch 950. Best Recall: 0.0924
2026-05-18 21:29:12,918 - optuna.study.study - INFO - Trial 135 finished with value: 0.0924454137820025 and parameters: {'n_layers': 1, 'embedding_dim': 64, 'lr': 0.0009352061588586501, 'lambda_val': 0.00020601505890217682, 'batch_size': 583, 'optimizer': 'RMSprop'}. Best is trial 132 with value: 0.09765203524228237.
2026-05-18 21:30:03,567 - experiment_functions - INFO - Early stopping at epoch 3550. Best Recall: 0.0964
2026-05-18 21:30:03,655 - optuna.study.study - INFO - Trial 136 finished with value: 0.09643370368903 and parameters: {'n_layers': 1, 'embedding_dim': 64, 'lr': 0.0005211284862613655, 'lambda_val': 0.0002580794288568082, 'batch_size': 513, 'optimizer': 'RMSprop'}. Best is trial 132 with value: 0.09765203524228237.
2026-05-18 21:30:12,598 - experiment_functions - INFO - Early stopping at epoch 600. Best Recall: 0.0800
2026-05-18 21:30:12,700 - optuna.study.study - INFO - Trial 137 finished with value: 0.08002620544530198 and parameters: {'n_layers': 1, 'embedding_dim': 64, 'lr': 0.0016159368943936886, 'lambda_val': 0.0002497411711324634, 'batch_size': 724, 'optimizer': 'RMSprop'}. Best is trial 132 with value: 0.09765203524228237.
2026-05-18 21:30:54,049 - optuna.study._optimize - INFO - Trial 138 pruned. 
2026-05-18 21:31:05,115 - experiment_functions - INFO - Early stopping at epoch 700. Best Recall: 0.0877
2026-05-18 21:31:05,283 - optuna.study.study - INFO - Trial 139 finished with value: 0.08772278619209153 and parameters: {'n_layers': 1, 'embedding_dim': 64, 'lr': 0.0011208014694701319, 'lambda_val': 0.00049274670171595, 'batch_size': 792, 'optimizer': 'RMSprop'}. Best is trial 132 with value: 0.09765203524228237.
2026-05-18 21:31:20,075 - experiment_functions - INFO - Early stopping at epoch 950. Best Recall: 0.0895
2026-05-18 21:31:20,154 - optuna.study.study - INFO - Trial 140 finished with value: 0.0895225198882879 and parameters: {'n_layers': 1, 'embedding_dim': 64, 'lr': 0.0008438041741969841, 'lambda_val': 0.0006530132709705558, 'batch_size': 694, 'optimizer': 'RMSprop'}. Best is trial 132 with value: 0.09765203524228237.
2026-05-18 21:31:37,379 - experiment_functions - INFO - Early stopping at epoch 1200. Best Recall: 0.0939
2026-05-18 21:31:37,469 - optuna.study.study - INFO - Trial 141 finished with value: 0.09387036017727396 and parameters: {'n_layers': 1, 'embedding_dim': 64, 'lr': 0.0007196406546988046, 'lambda_val': 0.0001631803165159267, 'batch_size': 523, 'optimizer': 'RMSprop'}. Best is trial 132 with value: 0.09765203524228237.
2026-05-18 21:31:55,213 - optuna.study._optimize - INFO - Trial 142 pruned. 
2026-05-18 21:32:22,935 - optuna.study._optimize - INFO - Trial 143 pruned. 
2026-05-18 21:32:37,842 - optuna.study._optimize - INFO - Trial 144 pruned. 
2026-05-18 21:33:06,952 - experiment_functions - INFO - Early stopping at epoch 2000. Best Recall: 0.0951
2026-05-18 21:33:07,087 - optuna.study.study - INFO - Trial 145 finished with value: 0.09510853005082227 and parameters: {'n_layers': 1, 'embedding_dim': 64, 'lr': 0.0005327271714888653, 'lambda_val': 0.0002303399624355667, 'batch_size': 774, 'optimizer': 'RMSprop'}. Best is trial 132 with value: 0.09765203524228237.
2026-05-18 21:33:21,868 - optuna.study._optimize - INFO - Trial 146 pruned. 
2026-05-18 21:33:36,198 - experiment_functions - INFO - Early stopping at epoch 950. Best Recall: 0.0885
2026-05-18 21:33:36,299 - optuna.study.study - INFO - Trial 147 finished with value: 0.08849719713840888 and parameters: {'n_layers': 1, 'embedding_dim': 64, 'lr': 0.000819993174431902, 'lambda_val': 0.00023349854252173474, 'batch_size': 828, 'optimizer': 'RMSprop'}. Best is trial 132 with value: 0.09765203524228237.
2026-05-18 21:33:47,652 - experiment_functions - INFO - Early stopping at epoch 750. Best Recall: 0.0896
2026-05-18 21:33:47,730 - optuna.study.study - INFO - Trial 148 finished with value: 0.08958416716998649 and parameters: {'n_layers': 1, 'embedding_dim': 64, 'lr': 0.0010146027720963598, 'lambda_val': 0.001110174501712898, 'batch_size': 725, 'optimizer': 'RMSprop'}. Best is trial 132 with value: 0.09765203524228237.
2026-05-18 21:34:00,128 - experiment_functions - INFO - Early stopping at epoch 850. Best Recall: 0.0857
