2026-05-18 13:51:20,807 - optuna.study.study - INFO - Trial 69 finished with value: 0.004693628521073158 and parameters: {'n_layers': 2, 'embedding_dim': 32, 'lr': 1.0881445743130967e-05, 'lambda_val': 5.079716690875382e-06, 'batch_size': 2127, 'optimizer': 'Adam'}. Best is trial 59 with value: 0.06448347813793345.
2026-05-18 13:51:31,488 - experiment_functions - INFO - Early stopping at epoch 600. Best Recall: 0.0323
2026-05-18 13:51:31,582 - optuna.study.study - INFO - Trial 70 finished with value: 0.032282671942720595 and parameters: {'n_layers': 4, 'embedding_dim': 128, 'lr': 0.001413637685010821, 'lambda_val': 0.0003971028839778958, 'batch_size': 3072, 'optimizer': 'Adam'}. Best is trial 59 with value: 0.06448347813793345.
2026-05-18 13:51:43,498 - experiment_functions - INFO - Early stopping at epoch 750. Best Recall: 0.0541
2026-05-18 13:51:43,590 - optuna.study.study - INFO - Trial 71 finished with value: 0.054131370929536904 and parameters: {'n_layers': 1, 'embedding_dim': 256, 'lr': 0.0011837761092310796, 'lambda_val': 0.0035964147135190945, 'batch_size': 2509, 'optimizer': 'Adam'}. Best is trial 59 with value: 0.06448347813793345.
2026-05-18 13:51:53,603 - experiment_functions - INFO - Early stopping at epoch 600. Best Recall: 0.0411
2026-05-18 13:51:53,706 - optuna.study.study - INFO - Trial 72 finished with value: 0.041086873293091596 and parameters: {'n_layers': 1, 'embedding_dim': 256, 'lr': 0.003478866101466148, 'lambda_val': 0.014381103896170486, 'batch_size': 1951, 'optimizer': 'Adam'}. Best is trial 59 with value: 0.06448347813793345.
2026-05-18 13:52:04,681 - experiment_functions - INFO - Early stopping at epoch 650. Best Recall: 0.0559
2026-05-18 13:52:04,785 - optuna.study.study - INFO - Trial 73 finished with value: 0.05590947542289817 and parameters: {'n_layers': 1, 'embedding_dim': 256, 'lr': 0.0019366827543199846, 'lambda_val': 0.0010112772427736268, 'batch_size': 2593, 'optimizer': 'Adam'}. Best is trial 59 with value: 0.06448347813793345.
2026-05-18 13:52:18,260 - experiment_functions - INFO - Early stopping at epoch 850. Best Recall: 0.0559
2026-05-18 13:52:18,397 - optuna.study.study - INFO - Trial 74 finished with value: 0.05585055473034262 and parameters: {'n_layers': 1, 'embedding_dim': 256, 'lr': 0.0009431372793793759, 'lambda_val': 0.0015779925858200078, 'batch_size': 2426, 'optimizer': 'Adam'}. Best is trial 59 with value: 0.06448347813793345.
2026-05-18 13:52:36,148 - optuna.study._optimize - INFO - Trial 75 pruned. 
2026-05-18 13:52:50,048 - optuna.study._optimize - INFO - Trial 76 pruned. 
2026-05-18 13:53:04,881 - optuna.study._optimize - INFO - Trial 77 pruned. 
2026-05-18 13:53:16,076 - experiment_functions - INFO - Early stopping at epoch 700. Best Recall: 0.0588
2026-05-18 13:53:16,180 - optuna.study.study - INFO - Trial 78 finished with value: 0.058818583253770575 and parameters: {'n_layers': 1, 'embedding_dim': 128, 'lr': 0.0016249838464297655, 'lambda_val': 1.931269560373951e-06, 'batch_size': 2457, 'optimizer': 'Adam'}. Best is trial 59 with value: 0.06448347813793345.
2026-05-18 13:53:23,571 - experiment_functions - INFO - Early stopping at epoch 500. Best Recall: 0.0053
2026-05-18 13:53:23,710 - optuna.study.study - INFO - Trial 79 finished with value: 0.005293776772226698 and parameters: {'n_layers': 1, 'embedding_dim': 128, 'lr': 0.002695830447677418, 'lambda_val': 1.8915385289800315e-06, 'batch_size': 2735, 'optimizer': 'SGD'}. Best is trial 59 with value: 0.06448347813793345.
2026-05-18 13:53:32,603 - experiment_functions - INFO - Early stopping at epoch 600. Best Recall: 0.0534
2026-05-18 13:53:32,696 - optuna.study.study - INFO - Trial 80 finished with value: 0.0534232026762206 and parameters: {'n_layers': 1, 'embedding_dim': 128, 'lr': 0.004240922502422954, 'lambda_val': 4.533627995571335e-06, 'batch_size': 2092, 'optimizer': 'Adam'}. Best is trial 59 with value: 0.06448347813793345.
2026-05-18 13:53:42,889 - experiment_functions - INFO - Early stopping at epoch 700. Best Recall: 0.0574
2026-05-18 13:53:43,200 - optuna.study.study - INFO - Trial 81 finished with value: 0.05738698878613114 and parameters: {'n_layers': 1, 'embedding_dim': 128, 'lr': 0.0016731553787050673, 'lambda_val': 1.3239666658257267e-06, 'batch_size': 2448, 'optimizer': 'Adam'}. Best is trial 59 with value: 0.06448347813793345.
2026-05-18 13:53:54,442 - experiment_functions - INFO - Early stopping at epoch 750. Best Recall: 0.0570
2026-05-18 13:53:54,546 - optuna.study.study - INFO - Trial 82 finished with value: 0.057020666212737714 and parameters: {'n_layers': 1, 'embedding_dim': 128, 'lr': 0.0013394872492519636, 'lambda_val': 2.933439364341704e-06, 'batch_size': 2406, 'optimizer': 'Adam'}. Best is trial 59 with value: 0.06448347813793345.
2026-05-18 13:54:10,459 - optuna.study._optimize - INFO - Trial 83 pruned. 
2026-05-18 13:54:21,018 - experiment_functions - INFO - Early stopping at epoch 750. Best Recall: 0.0241
2026-05-18 13:54:21,110 - optuna.study.study - INFO - Trial 84 finished with value: 0.024060645878776526 and parameters: {'n_layers': 3, 'embedding_dim': 32, 'lr': 0.0010033649305642705, 'lambda_val': 0.05878756855494355, 'batch_size': 2640, 'optimizer': 'Adam'}. Best is trial 59 with value: 0.06448347813793345.
2026-05-18 13:54:31,138 - experiment_functions - INFO - Early stopping at epoch 650. Best Recall: 0.0609
2026-05-18 13:54:31,230 - optuna.study.study - INFO - Trial 85 finished with value: 0.060870370691535676 and parameters: {'n_layers': 1, 'embedding_dim': 128, 'lr': 0.002193121207071113, 'lambda_val': 0.00024165442923089098, 'batch_size': 2912, 'optimizer': 'Adam'}. Best is trial 59 with value: 0.06448347813793345.
2026-05-18 13:54:41,223 - experiment_functions - INFO - Early stopping at epoch 650. Best Recall: 0.0556
2026-05-18 13:54:41,327 - optuna.study.study - INFO - Trial 86 finished with value: 0.05564377567112214 and parameters: {'n_layers': 1, 'embedding_dim': 128, 'lr': 0.0022569015625485706, 'lambda_val': 5.995221340036236e-05, 'batch_size': 2880, 'optimizer': 'Adam'}. Best is trial 59 with value: 0.06448347813793345.
2026-05-18 13:54:50,614 - experiment_functions - INFO - Early stopping at epoch 600. Best Recall: 0.0624
2026-05-18 13:54:50,707 - optuna.study.study - INFO - Trial 87 finished with value: 0.0624112656174442 and parameters: {'n_layers': 1, 'embedding_dim': 128, 'lr': 0.0031542241191584493, 'lambda_val': 0.00012422561367758864, 'batch_size': 3052, 'optimizer': 'Adam'}. Best is trial 59 with value: 0.06448347813793345.
2026-05-18 13:54:59,803 - experiment_functions - INFO - Early stopping at epoch 550. Best Recall: 0.0586
2026-05-18 13:54:59,895 - optuna.study.study - INFO - Trial 88 finished with value: 0.05861712779537609 and parameters: {'n_layers': 1, 'embedding_dim': 128, 'lr': 0.007101454375789663, 'lambda_val': 0.00022142141892229943, 'batch_size': 3793, 'optimizer': 'Adam'}. Best is trial 59 with value: 0.06448347813793345.
2026-05-18 13:55:14,190 - optuna.study._optimize - INFO - Trial 89 pruned. 
2026-05-18 13:55:22,639 - experiment_functions - INFO - Early stopping at epoch 550. Best Recall: 0.0603
2026-05-18 13:55:22,731 - optuna.study.study - INFO - Trial 90 finished with value: 0.06029065168888549 and parameters: {'n_layers': 1, 'embedding_dim': 128, 'lr': 0.0068259794899404765, 'lambda_val': 8.137313871925255e-05, 'batch_size': 3105, 'optimizer': 'Adam'}. Best is trial 59 with value: 0.06448347813793345.
2026-05-18 13:55:32,915 - experiment_functions - INFO - Early stopping at epoch 700. Best Recall: 0.0305
2026-05-18 13:55:33,030 - optuna.study.study - INFO - Trial 91 finished with value: 0.030453679044729412 and parameters: {'n_layers': 1, 'embedding_dim': 128, 'lr': 0.014470312706588231, 'lambda_val': 0.00010530132989315206, 'batch_size': 3491, 'optimizer': 'Adam'}. Best is trial 59 with value: 0.06448347813793345.
2026-05-18 13:55:42,717 - experiment_functions - INFO - Early stopping at epoch 600. Best Recall: 0.0564
2026-05-18 13:55:42,832 - optuna.study.study - INFO - Trial 92 finished with value: 0.05642605582068002 and parameters: {'n_layers': 1, 'embedding_dim': 128, 'lr': 0.003300067708916532, 'lambda_val': 0.000316600137338998, 'batch_size': 3066, 'optimizer': 'Adam'}. Best is trial 59 with value: 0.06448347813793345.
2026-05-18 13:55:51,558 - experiment_functions - INFO - Early stopping at epoch 550. Best Recall: 0.0572
2026-05-18 13:55:51,674 - optuna.study.study - INFO - Trial 93 finished with value: 0.05722530296515224 and parameters: {'n_layers': 1, 'embedding_dim': 128, 'lr': 0.0074202189110191275, 'lambda_val': 0.00024546329297198767, 'batch_size': 3328, 'optimizer': 'Adam'}. Best is trial 59 with value: 0.06448347813793345.
2026-05-18 13:56:00,993 - experiment_functions - INFO - Early stopping at epoch 600. Best Recall: 0.0535
2026-05-18 13:56:01,085 - optuna.study.study - INFO - Trial 94 finished with value: 0.053518107659489875 and parameters: {'n_layers': 1, 'embedding_dim': 128, 'lr': 0.0031865455210350136, 'lambda_val': 9.016686544900199e-05, 'batch_size': 1864, 'optimizer': 'Adam'}. Best is trial 59 with value: 0.06448347813793345.
2026-05-18 13:56:11,043 - experiment_functions - INFO - Early stopping at epoch 650. Best Recall: 0.0523
2026-05-18 13:56:11,340 - optuna.study.study - INFO - Trial 95 finished with value: 0.05234642104310769 and parameters: {'n_layers': 1, 'embedding_dim': 128, 'lr': 0.0022909733424119516, 'lambda_val': 4.848301002553362e-05, 'batch_size': 3188, 'optimizer': 'Adam'}. Best is trial 59 with value: 0.06448347813793345.
2026-05-18 13:56:19,741 - experiment_functions - INFO - Early stopping at epoch 550. Best Recall: 0.0580
2026-05-18 13:56:19,846 - optuna.study.study - INFO - Trial 96 finished with value: 0.05797182547923174 and parameters: {'n_layers': 1, 'embedding_dim': 128, 'lr': 0.009253550944717668, 'lambda_val': 2.0196097008466775e-05, 'batch_size': 1992, 'optimizer': 'Adam'}. Best is trial 59 with value: 0.06448347813793345.
2026-05-18 13:56:32,883 - experiment_functions - INFO - Early stopping at epoch 850. Best Recall: 0.0472
2026-05-18 13:56:32,986 - optuna.study.study - INFO - Trial 97 finished with value: 0.04722625975189092 and parameters: {'n_layers': 2, 'embedding_dim': 128, 'lr': 0.0005469578788668621, 'lambda_val': 0.00011370452723618956, 'batch_size': 2952, 'optimizer': 'Adam'}. Best is trial 59 with value: 0.06448347813793345.
2026-05-18 13:56:43,757 - experiment_functions - INFO - Early stopping at epoch 700. Best Recall: 0.0594
2026-05-18 13:56:43,850 - optuna.study.study - INFO - Trial 98 finished with value: 0.05943884340101339 and parameters: {'n_layers': 1, 'embedding_dim': 128, 'lr': 0.0016935949212597149, 'lambda_val': 0.0005590560645998363, 'batch_size': 3054, 'optimizer': 'Adam'}. Best is trial 59 with value: 0.06448347813793345.
2026-05-18 13:56:51,434 - experiment_functions - INFO - Early stopping at epoch 500. Best Recall: 0.0048
2026-05-18 13:56:51,527 - optuna.study.study - INFO - Trial 99 finished with value: 0.0048208510268048805 and parameters: {'n_layers': 1, 'embedding_dim': 32, 'lr': 0.0008000760357908532, 'lambda_val': 0.0004851401578530728, 'batch_size': 3049, 'optimizer': 'SGD'}. Best is trial 59 with value: 0.06448347813793345.
2026-05-18 13:57:01,827 - experiment_functions - INFO - Early stopping at epoch 700. Best Recall: 0.0566
2026-05-18 13:57:01,991 - optuna.study.study - INFO - Trial 100 finished with value: 0.05664203434367276 and parameters: {'n_layers': 1, 'embedding_dim': 128, 'lr': 0.0018606362722155987, 'lambda_val': 2.9830058909301672e-05, 'batch_size': 1781, 'optimizer': 'Adam'}. Best is trial 59 with value: 0.06448347813793345.
2026-05-18 13:57:14,210 - experiment_functions - INFO - Early stopping at epoch 850. Best Recall: 0.0582
2026-05-18 13:57:14,313 - optuna.study.study - INFO - Trial 101 finished with value: 0.05824140921919171 and parameters: {'n_layers': 1, 'embedding_dim': 128, 'lr': 0.001563607860227637, 'lambda_val': 0.00018986249214016348, 'batch_size': 850, 'optimizer': 'Adam'}. Best is trial 59 with value: 0.06448347813793345.
2026-05-18 13:57:23,409 - experiment_functions - INFO - Early stopping at epoch 600. Best Recall: 0.0532
2026-05-18 13:57:23,922 - optuna.study.study - INFO - Trial 102 finished with value: 0.053181273014634906 and parameters: {'n_layers': 1, 'embedding_dim': 128, 'lr': 0.002513797980339635, 'lambda_val': 6.91169734360148e-05, 'batch_size': 3404, 'optimizer': 'Adam'}. Best is trial 59 with value: 0.06448347813793345.
2026-05-18 13:57:33,047 - experiment_functions - INFO - Early stopping at epoch 600. Best Recall: 0.0588
2026-05-18 13:57:33,140 - optuna.study.study - INFO - Trial 103 finished with value: 0.058751170781573187 and parameters: {'n_layers': 1, 'embedding_dim': 128, 'lr': 0.0038352280350097863, 'lambda_val': 0.0002869415668458614, 'batch_size': 3129, 'optimizer': 'Adam'}. Best is trial 59 with value: 0.06448347813793345.
2026-05-18 13:57:44,654 - experiment_functions - INFO - Early stopping at epoch 800. Best Recall: 0.0538
2026-05-18 13:57:44,757 - optuna.study.study - INFO - Trial 104 finished with value: 0.05383262987194171 and parameters: {'n_layers': 1, 'embedding_dim': 128, 'lr': 0.0010460404292712432, 'lambda_val': 3.3725230074025922e-06, 'batch_size': 2779, 'optimizer': 'Adam'}. Best is trial 59 with value: 0.06448347813793345.
2026-05-18 13:57:55,011 - experiment_functions - INFO - Early stopping at epoch 700. Best Recall: 0.0563
2026-05-18 13:57:55,104 - optuna.study.study - INFO - Trial 105 finished with value: 0.056261924944907254 and parameters: {'n_layers': 1, 'embedding_dim': 128, 'lr': 0.0016634125393268293, 'lambda_val': 2.0229779300820785e-06, 'batch_size': 3612, 'optimizer': 'Adam'}. Best is trial 59 with value: 0.06448347813793345.
2026-05-18 13:58:04,502 - experiment_functions - INFO - Early stopping at epoch 600. Best Recall: 0.0582
2026-05-18 13:58:04,606 - optuna.study.study - INFO - Trial 106 finished with value: 0.05820982410569082 and parameters: {'n_layers': 1, 'embedding_dim': 32, 'lr': 0.004920980692714846, 'lambda_val': 1.012837094481717e-05, 'batch_size': 2224, 'optimizer': 'Adam'}. Best is trial 59 with value: 0.06448347813793345.
2026-05-18 13:58:14,981 - experiment_functions - INFO - Early stopping at epoch 650. Best Recall: 0.0550
2026-05-18 13:58:15,096 - optuna.study.study - INFO - Trial 107 finished with value: 0.054983263548443656 and parameters: {'n_layers': 1, 'embedding_dim': 64, 'lr': 0.0012150032373958364, 'lambda_val': 1.427873929422188e-06, 'batch_size': 2332, 'optimizer': 'RMSprop'}. Best is trial 59 with value: 0.06448347813793345.
2026-05-18 13:58:24,190 - experiment_functions - INFO - Early stopping at epoch 600. Best Recall: 0.0590
2026-05-18 13:58:24,282 - optuna.study.study - INFO - Trial 108 finished with value: 0.059043696843599516 and parameters: {'n_layers': 1, 'embedding_dim': 128, 'lr': 0.003010874118648728, 'lambda_val': 0.0006776500634378125, 'batch_size': 2916, 'optimizer': 'Adam'}. Best is trial 59 with value: 0.06448347813793345.
2026-05-18 13:58:33,434 - experiment_functions - INFO - Early stopping at epoch 650. Best Recall: 0.0546
2026-05-18 13:58:33,526 - optuna.study.study - INFO - Trial 109 finished with value: 0.0545768444336333 and parameters: {'n_layers': 1, 'embedding_dim': 32, 'lr': 0.0029128851310581978, 'lambda_val': 0.0006664351933384825, 'batch_size': 2974, 'optimizer': 'Adam'}. Best is trial 59 with value: 0.06448347813793345.
2026-05-18 13:58:44,101 - experiment_functions - INFO - Early stopping at epoch 700. Best Recall: 0.0258
2026-05-18 13:58:44,204 - optuna.study.study - INFO - Trial 110 finished with value: 0.02583874998140062 and parameters: {'n_layers': 1, 'embedding_dim': 128, 'lr': 0.018780324118419987, 'lambda_val': 0.0009069524534272562, 'batch_size': 3253, 'optimizer': 'Adam'}. Best is trial 59 with value: 0.06448347813793345.
2026-05-18 13:58:52,789 - experiment_functions - INFO - Early stopping at epoch 550. Best Recall: 0.0558
2026-05-18 13:58:52,894 - optuna.study.study - INFO - Trial 111 finished with value: 0.05577335280669869 and parameters: {'n_layers': 1, 'embedding_dim': 128, 'lr': 0.006199393140270694, 'lambda_val': 6.252375731466405e-06, 'batch_size': 3124, 'optimizer': 'Adam'}. Best is trial 59 with value: 0.06448347813793345.
2026-05-18 13:59:04,452 - experiment_functions - INFO - Early stopping at epoch 800. Best Recall: 0.0611
2026-05-18 13:59:04,545 - optuna.study.study - INFO - Trial 112 finished with value: 0.06106748875519679 and parameters: {'n_layers': 1, 'embedding_dim': 128, 'lr': 0.002162992293247291, 'lambda_val': 0.00014233598384789025, 'batch_size': 536, 'optimizer': 'Adam'}. Best is trial 59 with value: 0.06448347813793345.
2026-05-18 13:59:15,898 - experiment_functions - INFO - Early stopping at epoch 750. Best Recall: 0.0599
2026-05-18 13:59:16,002 - optuna.study.study - INFO - Trial 113 finished with value: 0.059888852423645576 and parameters: {'n_layers': 1, 'embedding_dim': 128, 'lr': 0.002150854385880315, 'lambda_val': 0.0003932741384412079, 'batch_size': 731, 'optimizer': 'Adam'}. Best is trial 59 with value: 0.06448347813793345.
2026-05-18 13:59:26,800 - experiment_functions - INFO - Early stopping at epoch 750. Best Recall: 0.0570
2026-05-18 13:59:26,893 - optuna.study.study - INFO - Trial 114 finished with value: 0.05703781174936587 and parameters: {'n_layers': 1, 'embedding_dim': 128, 'lr': 0.0022806015690192264, 'lambda_val': 0.00035232203177833324, 'batch_size': 723, 'optimizer': 'Adam'}. Best is trial 59 with value: 0.06448347813793345.
2026-05-18 13:59:38,451 - experiment_functions - INFO - Early stopping at epoch 800. Best Recall: 0.0572
2026-05-18 13:59:38,544 - optuna.study.study - INFO - Trial 115 finished with value: 0.057249687799700605 and parameters: {'n_layers': 1, 'embedding_dim': 128, 'lr': 0.0021040362483051626, 'lambda_val': 0.0001502206303709911, 'batch_size': 664, 'optimizer': 'Adam'}. Best is trial 59 with value: 0.06448347813793345.
2026-05-18 13:59:53,783 - optuna.study._optimize - INFO - Trial 116 pruned. 
2026-05-18 14:00:08,147 - experiment_functions - INFO - Early stopping at epoch 1000. Best Recall: 0.0621
2026-05-18 14:00:08,251 - optuna.study.study - INFO - Trial 117 finished with value: 0.062099207732057495 and parameters: {'n_layers': 1, 'embedding_dim': 128, 'lr': 0.001355662634040323, 'lambda_val': 0.0004803112009356908, 'batch_size': 559, 'optimizer': 'Adam'}. Best is trial 59 with value: 0.06448347813793345.
2026-05-18 14:00:17,892 - experiment_functions - INFO - Early stopping at epoch 650. Best Recall: 0.0574
2026-05-18 14:00:17,984 - optuna.study.study - INFO - Trial 118 finished with value: 0.05741698349264161 and parameters: {'n_layers': 1, 'embedding_dim': 128, 'lr': 0.003776406639526993, 'lambda_val': 0.0004108816335178148, 'batch_size': 515, 'optimizer': 'Adam'}. Best is trial 59 with value: 0.06448347813793345.
2026-05-18 14:00:28,766 - experiment_functions - INFO - Early stopping at epoch 650. Best Recall: 0.0457
2026-05-18 14:00:28,858 - optuna.study.study - INFO - Trial 119 finished with value: 0.045694427565480256 and parameters: {'n_layers': 3, 'embedding_dim': 128, 'lr': 0.001338910919626901, 'lambda_val': 0.0005026091933967787, 'batch_size': 609, 'optimizer': 'Adam'}. Best is trial 59 with value: 0.06448347813793345.
2026-05-18 14:00:35,835 - experiment_functions - INFO - Early stopping at epoch 500. Best Recall: 0.0046
2026-05-18 14:00:35,935 - optuna.study.study - INFO - Trial 120 finished with value: 0.004648223992955292 and parameters: {'n_layers': 1, 'embedding_dim': 32, 'lr': 0.0017858340490713401, 'lambda_val': 0.00012469731086766096, 'batch_size': 821, 'optimizer': 'SGD'}. Best is trial 59 with value: 0.06448347813793345.
2026-05-18 14:00:48,995 - experiment_functions - INFO - Early stopping at epoch 900. Best Recall: 0.0595
2026-05-18 14:00:49,133 - optuna.study.study - INFO - Trial 121 finished with value: 0.05953940736399105 and parameters: {'n_layers': 1, 'embedding_dim': 128, 'lr': 0.0014762857652791006, 'lambda_val': 0.0018460061220354218, 'batch_size': 601, 'optimizer': 'Adam'}. Best is trial 59 with value: 0.06448347813793345.
2026-05-18 14:01:03,659 - experiment_functions - INFO - Early stopping at epoch 1000. Best Recall: 0.0609
2026-05-18 14:01:03,826 - optuna.study.study - INFO - Trial 122 finished with value: 0.06089210468652142 and parameters: {'n_layers': 1, 'embedding_dim': 128, 'lr': 0.0011139890848802982, 'lambda_val': 0.000283941593564963, 'batch_size': 878, 'optimizer': 'Adam'}. Best is trial 59 with value: 0.06448347813793345.
2026-05-18 14:01:18,727 - experiment_functions - INFO - Early stopping at epoch 1000. Best Recall: 0.0585
2026-05-18 14:01:18,819 - optuna.study.study - INFO - Trial 123 finished with value: 0.05848779918602627 and parameters: {'n_layers': 1, 'embedding_dim': 128, 'lr': 0.0011180364378344711, 'lambda_val': 8.832205351496644e-05, 'batch_size': 859, 'optimizer': 'Adam'}. Best is trial 59 with value: 0.06448347813793345.
2026-05-18 14:01:29,545 - experiment_functions - INFO - Early stopping at epoch 750. Best Recall: 0.0570
2026-05-18 14:01:29,636 - optuna.study.study - INFO - Trial 124 finished with value: 0.056977937500097824 and parameters: {'n_layers': 1, 'embedding_dim': 128, 'lr': 0.002075829233000189, 'lambda_val': 0.0002694834061715542, 'batch_size': 939, 'optimizer': 'Adam'}. Best is trial 59 with value: 0.06448347813793345.
2026-05-18 14:01:51,074 - experiment_functions - INFO - Early stopping at epoch 850. Best Recall: 0.0627
2026-05-18 14:01:51,167 - optuna.study.study - INFO - Trial 125 finished with value: 0.06267849990116899 and parameters: {'n_layers': 1, 'embedding_dim': 128, 'lr': 0.0014217903114689498, 'lambda_val': 0.004302459548749013, 'batch_size': 743, 'optimizer': 'Adam'}. Best is trial 59 with value: 0.06448347813793345.
2026-05-18 14:02:01,069 - experiment_functions - INFO - Early stopping at epoch 650. Best Recall: 0.0553
