2026-05-18 23:00:40,591 - optuna.study.study - INFO - Trial 139 finished with value: 0.05936018621013117 and parameters: {'n_layers': 1, 'embedding_dim': 32, 'lr': 0.0009840424931746266, 'lambda_val': 0.05207325938610718, 'batch_size': 626, 'optimizer': 'RMSprop'}. Best is trial 53 with value: 0.07320461295991322.
2026-05-18 23:00:52,845 - experiment_functions - INFO - Early stopping at epoch 850. Best Recall: 0.0590
2026-05-18 23:00:52,935 - optuna.study.study - INFO - Trial 140 finished with value: 0.05902353073400396 and parameters: {'n_layers': 1, 'embedding_dim': 32, 'lr': 0.001238049765515604, 'lambda_val': 0.000593585347801469, 'batch_size': 1016, 'optimizer': 'RMSprop'}. Best is trial 53 with value: 0.07320461295991322.
2026-05-18 23:01:06,903 - optuna.study._optimize - INFO - Trial 141 pruned. 
2026-05-18 23:01:22,651 - experiment_functions - INFO - Early stopping at epoch 1100. Best Recall: 0.0705
2026-05-18 23:01:22,741 - optuna.study.study - INFO - Trial 142 finished with value: 0.07046442931310366 and parameters: {'n_layers': 1, 'embedding_dim': 32, 'lr': 0.0007284549787645961, 'lambda_val': 0.03476016882753932, 'batch_size': 833, 'optimizer': 'RMSprop'}. Best is trial 53 with value: 0.07320461295991322.
2026-05-18 23:01:37,929 - experiment_functions - INFO - Early stopping at epoch 1100. Best Recall: 0.0654
2026-05-18 23:01:38,022 - optuna.study.study - INFO - Trial 143 finished with value: 0.06536626333689284 and parameters: {'n_layers': 1, 'embedding_dim': 32, 'lr': 0.0007406250016761439, 'lambda_val': 0.032650072290645184, 'batch_size': 888, 'optimizer': 'RMSprop'}. Best is trial 53 with value: 0.07320461295991322.
2026-05-18 23:01:47,804 - experiment_functions - INFO - Early stopping at epoch 600. Best Recall: 0.0240
2026-05-18 23:01:47,894 - optuna.study.study - INFO - Trial 144 finished with value: 0.023980744639925014 and parameters: {'n_layers': 4, 'embedding_dim': 32, 'lr': 0.0008993103969950727, 'lambda_val': 0.037423729138882596, 'batch_size': 807, 'optimizer': 'RMSprop'}. Best is trial 53 with value: 0.07320461295991322.
2026-05-18 23:01:57,097 - experiment_functions - INFO - Early stopping at epoch 650. Best Recall: 0.0530
2026-05-18 23:01:57,189 - optuna.study.study - INFO - Trial 145 finished with value: 0.053040616339117094 and parameters: {'n_layers': 1, 'embedding_dim': 32, 'lr': 0.0015556341301147896, 'lambda_val': 0.01498128807127839, 'batch_size': 1102, 'optimizer': 'RMSprop'}. Best is trial 53 with value: 0.07320461295991322.
2026-05-18 23:02:11,866 - experiment_functions - INFO - Early stopping at epoch 800. Best Recall: 0.0631
2026-05-18 23:02:13,138 - optuna.study.study - INFO - Trial 146 finished with value: 0.06305037902404835 and parameters: {'n_layers': 1, 'embedding_dim': 32, 'lr': 0.0010010415775352944, 'lambda_val': 0.027659791726231397, 'batch_size': 972, 'optimizer': 'RMSprop'}. Best is trial 53 with value: 0.07320461295991322.
2026-05-18 23:02:32,439 - optuna.study._optimize - INFO - Trial 147 pruned. 
2026-05-18 23:02:47,404 - optuna.study._optimize - INFO - Trial 148 pruned. 
2026-05-18 23:03:02,563 - optuna.study._optimize - INFO - Trial 149 pruned. 
2026-05-18 23:03:15,096 - experiment_functions - INFO - Early stopping at epoch 850. Best Recall: 0.0618
2026-05-18 23:03:15,242 - optuna.study.study - INFO - Trial 150 finished with value: 0.06180275673874886 and parameters: {'n_layers': 1, 'embedding_dim': 32, 'lr': 0.0011917493498394484, 'lambda_val': 0.007380191056004874, 'batch_size': 755, 'optimizer': 'RMSprop'}. Best is trial 53 with value: 0.07320461295991322.
2026-05-18 23:03:50,144 - experiment_functions - INFO - Early stopping at epoch 2400. Best Recall: 0.0758
2026-05-18 23:03:50,238 - optuna.study.study - INFO - Trial 151 finished with value: 0.07582601723856444 and parameters: {'n_layers': 1, 'embedding_dim': 32, 'lr': 0.0005948346294676565, 'lambda_val': 0.018172008230241395, 'batch_size': 665, 'optimizer': 'RMSprop'}. Best is trial 151 with value: 0.07582601723856444.
2026-05-18 23:04:07,395 - experiment_functions - INFO - Early stopping at epoch 1250. Best Recall: 0.0727
2026-05-18 23:04:07,495 - optuna.study.study - INFO - Trial 152 finished with value: 0.07272083038489048 and parameters: {'n_layers': 1, 'embedding_dim': 32, 'lr': 0.0007696377473477791, 'lambda_val': 0.018571067805195855, 'batch_size': 640, 'optimizer': 'RMSprop'}. Best is trial 151 with value: 0.07582601723856444.
2026-05-18 23:04:28,716 - experiment_functions - INFO - Early stopping at epoch 1300. Best Recall: 0.0657
2026-05-18 23:04:28,805 - optuna.study.study - INFO - Trial 153 finished with value: 0.06574129126241443 and parameters: {'n_layers': 1, 'embedding_dim': 32, 'lr': 0.000770263988986808, 'lambda_val': 0.016458079891430593, 'batch_size': 638, 'optimizer': 'RMSprop'}. Best is trial 151 with value: 0.07582601723856444.
2026-05-18 23:04:41,493 - optuna.study._optimize - INFO - Trial 154 pruned. 
2026-05-18 23:05:11,181 - experiment_functions - INFO - Early stopping at epoch 2250. Best Recall: 0.0703
2026-05-18 23:05:11,343 - optuna.study.study - INFO - Trial 155 finished with value: 0.0703497044977547 and parameters: {'n_layers': 1, 'embedding_dim': 32, 'lr': 0.0005861650375653208, 'lambda_val': 0.011840960083319418, 'batch_size': 864, 'optimizer': 'RMSprop'}. Best is trial 151 with value: 0.07582601723856444.
2026-05-18 23:05:34,181 - optuna.study._optimize - INFO - Trial 156 pruned. 
2026-05-18 23:05:48,836 - experiment_functions - INFO - Early stopping at epoch 1050. Best Recall: 0.0678
2026-05-18 23:05:48,948 - optuna.study.study - INFO - Trial 157 finished with value: 0.06782268869691069 and parameters: {'n_layers': 1, 'embedding_dim': 32, 'lr': 0.0008903616045167187, 'lambda_val': 0.025476210739509057, 'batch_size': 666, 'optimizer': 'RMSprop'}. Best is trial 151 with value: 0.07582601723856444.
2026-05-18 23:06:02,528 - optuna.study._optimize - INFO - Trial 158 pruned. 
2026-05-18 23:06:15,450 - optuna.study._optimize - INFO - Trial 159 pruned. 
2026-05-18 23:06:30,863 - optuna.study._optimize - INFO - Trial 160 pruned. 
2026-05-18 23:06:46,002 - optuna.study._optimize - INFO - Trial 161 pruned. 
2026-05-18 23:07:33,239 - experiment_functions - INFO - Early stopping at epoch 1700. Best Recall: 0.0687
2026-05-18 23:07:33,331 - optuna.study.study - INFO - Trial 162 finished with value: 0.06865121093570352 and parameters: {'n_layers': 1, 'embedding_dim': 32, 'lr': 0.0005711043769723133, 'lambda_val': 0.0192951003769862, 'batch_size': 905, 'optimizer': 'RMSprop'}. Best is trial 151 with value: 0.07582601723856444.
2026-05-18 23:08:02,232 - experiment_functions - INFO - Early stopping at epoch 950. Best Recall: 0.0671
2026-05-18 23:08:02,334 - optuna.study.study - INFO - Trial 163 finished with value: 0.06705153819585129 and parameters: {'n_layers': 1, 'embedding_dim': 32, 'lr': 0.0007685283461437219, 'lambda_val': 0.03211225973405556, 'batch_size': 988, 'optimizer': 'RMSprop'}. Best is trial 151 with value: 0.07582601723856444.
2026-05-18 23:08:22,769 - optuna.study._optimize - INFO - Trial 164 pruned. 
2026-05-18 23:08:40,698 - experiment_functions - INFO - Early stopping at epoch 850. Best Recall: 0.0521
2026-05-18 23:08:40,778 - optuna.study.study - INFO - Trial 165 finished with value: 0.052101066021028604 and parameters: {'n_layers': 1, 'embedding_dim': 64, 'lr': 0.0009826859238853442, 'lambda_val': 0.0559084889698212, 'batch_size': 595, 'optimizer': 'RMSprop'}. Best is trial 151 with value: 0.07582601723856444.
2026-05-18 23:09:14,697 - experiment_functions - INFO - Early stopping at epoch 1550. Best Recall: 0.0676
2026-05-18 23:09:15,953 - optuna.study.study - INFO - Trial 166 finished with value: 0.06756621790515104 and parameters: {'n_layers': 1, 'embedding_dim': 32, 'lr': 0.000659788950437807, 'lambda_val': 0.015913373343934802, 'batch_size': 807, 'optimizer': 'RMSprop'}. Best is trial 151 with value: 0.07582601723856444.
2026-05-18 23:09:33,293 - experiment_functions - INFO - Early stopping at epoch 500. Best Recall: 0.0058
2026-05-18 23:09:33,441 - optuna.study.study - INFO - Trial 167 finished with value: 0.0057986485996493085 and parameters: {'n_layers': 1, 'embedding_dim': 32, 'lr': 0.0004457855923983959, 'lambda_val': 0.0105172481994368, 'batch_size': 669, 'optimizer': 'SGD'}. Best is trial 151 with value: 0.07582601723856444.
2026-05-18 23:10:08,327 - experiment_functions - INFO - Early stopping at epoch 1600. Best Recall: 0.0713
2026-05-18 23:10:08,462 - optuna.study.study - INFO - Trial 168 finished with value: 0.07132974817410521 and parameters: {'n_layers': 1, 'embedding_dim': 32, 'lr': 0.0008492961507153721, 'lambda_val': 0.00016760995337818853, 'batch_size': 874, 'optimizer': 'RMSprop'}. Best is trial 151 with value: 0.07582601723856444.
2026-05-18 23:10:32,980 - optuna.study._optimize - INFO - Trial 169 pruned. 
2026-05-18 23:10:54,773 - experiment_functions - INFO - Early stopping at epoch 1150. Best Recall: 0.0673
2026-05-18 23:10:54,854 - optuna.study.study - INFO - Trial 170 finished with value: 0.06731386319081413 and parameters: {'n_layers': 1, 'embedding_dim': 32, 'lr': 0.001088696142547539, 'lambda_val': 0.00013001480299384264, 'batch_size': 861, 'optimizer': 'RMSprop'}. Best is trial 151 with value: 0.07582601723856444.
2026-05-18 23:11:12,886 - experiment_functions - INFO - Early stopping at epoch 950. Best Recall: 0.0620
2026-05-18 23:11:12,978 - optuna.study.study - INFO - Trial 171 finished with value: 0.06200928224390461 and parameters: {'n_layers': 1, 'embedding_dim': 32, 'lr': 0.0008051289292792656, 'lambda_val': 0.025450513774921503, 'batch_size': 931, 'optimizer': 'RMSprop'}. Best is trial 151 with value: 0.07582601723856444.
2026-05-18 23:11:35,361 - optuna.study._optimize - INFO - Trial 172 pruned. 
2026-05-18 23:12:08,004 - experiment_functions - INFO - Early stopping at epoch 1500. Best Recall: 0.0711
2026-05-18 23:12:08,096 - optuna.study.study - INFO - Trial 173 finished with value: 0.0711075199339461 and parameters: {'n_layers': 1, 'embedding_dim': 32, 'lr': 0.0008601253272485412, 'lambda_val': 0.00019699715894460455, 'batch_size': 764, 'optimizer': 'RMSprop'}. Best is trial 151 with value: 0.07582601723856444.
2026-05-18 23:12:37,079 - optuna.study._optimize - INFO - Trial 174 pruned. 
2026-05-18 23:13:29,367 - optuna.study._optimize - INFO - Trial 175 pruned. 
2026-05-18 23:13:54,099 - optuna.study._optimize - INFO - Trial 176 pruned. 
2026-05-18 23:14:15,853 - experiment_functions - INFO - Early stopping at epoch 950. Best Recall: 0.0628
2026-05-18 23:14:15,954 - optuna.study.study - INFO - Trial 177 finished with value: 0.06276888610638458 and parameters: {'n_layers': 1, 'embedding_dim': 32, 'lr': 0.0008279944144688983, 'lambda_val': 0.0002259238454944821, 'batch_size': 2327, 'optimizer': 'RMSprop'}. Best is trial 151 with value: 0.07582601723856444.
2026-05-18 23:14:32,668 - experiment_functions - INFO - Early stopping at epoch 700. Best Recall: 0.0634
2026-05-18 23:14:32,759 - optuna.study.study - INFO - Trial 178 finished with value: 0.0634090005039986 and parameters: {'n_layers': 1, 'embedding_dim': 32, 'lr': 0.0013012566568790889, 'lambda_val': 0.020222875880781418, 'batch_size': 843, 'optimizer': 'RMSprop'}. Best is trial 151 with value: 0.07582601723856444.
2026-05-18 23:14:55,245 - optuna.study._optimize - INFO - Trial 179 pruned. 
2026-05-18 23:15:12,841 - experiment_functions - INFO - Early stopping at epoch 1150. Best Recall: 0.0684
2026-05-18 23:15:12,941 - optuna.study.study - INFO - Trial 180 finished with value: 0.06837419542970165 and parameters: {'n_layers': 1, 'embedding_dim': 32, 'lr': 0.0009688335507276034, 'lambda_val': 0.0034898975468277272, 'batch_size': 895, 'optimizer': 'RMSprop'}. Best is trial 151 with value: 0.07582601723856444.
2026-05-18 23:15:26,858 - optuna.study._optimize - INFO - Trial 181 pruned. 
2026-05-18 23:16:01,227 - experiment_functions - INFO - Early stopping at epoch 2500. Best Recall: 0.0707
2026-05-18 23:16:01,328 - optuna.study.study - INFO - Trial 182 finished with value: 0.07065422053169625 and parameters: {'n_layers': 1, 'embedding_dim': 32, 'lr': 0.0007520761866412459, 'lambda_val': 0.00010214949919848779, 'batch_size': 774, 'optimizer': 'RMSprop'}. Best is trial 151 with value: 0.07582601723856444.
2026-05-18 23:16:56,411 - experiment_functions - INFO - Early stopping at epoch 2800. Best Recall: 0.0716
2026-05-18 23:16:56,492 - optuna.study.study - INFO - Trial 183 finished with value: 0.07162615382387064 and parameters: {'n_layers': 1, 'embedding_dim': 32, 'lr': 0.0007334132261454534, 'lambda_val': 0.00019262614741195278, 'batch_size': 752, 'optimizer': 'RMSprop'}. Best is trial 151 with value: 0.07582601723856444.
2026-05-18 23:17:22,294 - optuna.study._optimize - INFO - Trial 184 pruned. 
2026-05-18 23:17:41,859 - optuna.study._optimize - INFO - Trial 185 pruned. 
2026-05-18 23:18:04,005 - optuna.study._optimize - INFO - Trial 186 pruned. 
2026-05-18 23:18:18,262 - optuna.study._optimize - INFO - Trial 187 pruned. 
2026-05-18 23:18:39,122 - experiment_functions - INFO - Early stopping at epoch 1400. Best Recall: 0.0703
2026-05-18 23:18:39,889 - optuna.study.study - INFO - Trial 188 finished with value: 0.07032835273781805 and parameters: {'n_layers': 1, 'embedding_dim': 32, 'lr': 0.001129302411168339, 'lambda_val': 0.0003821001250845205, 'batch_size': 643, 'optimizer': 'Adam'}. Best is trial 151 with value: 0.07582601723856444.
2026-05-18 23:18:56,965 - optuna.study._optimize - INFO - Trial 189 pruned. 
2026-05-18 23:19:20,744 - experiment_functions - INFO - Early stopping at epoch 1800. Best Recall: 0.0699
2026-05-18 23:19:20,833 - optuna.study.study - INFO - Trial 190 finished with value: 0.06985927752357111 and parameters: {'n_layers': 1, 'embedding_dim': 32, 'lr': 0.001066438938224828, 'lambda_val': 0.0004651914719234079, 'batch_size': 710, 'optimizer': 'Adam'}. Best is trial 151 with value: 0.07582601723856444.
2026-05-18 23:19:46,331 - optuna.study._optimize - INFO - Trial 191 pruned. 
2026-05-18 23:20:02,536 - experiment_functions - INFO - Early stopping at epoch 1200. Best Recall: 0.0712
2026-05-18 23:20:02,616 - optuna.study.study - INFO - Trial 192 finished with value: 0.07123873670123597 and parameters: {'n_layers': 1, 'embedding_dim': 32, 'lr': 0.0015610235661294093, 'lambda_val': 0.0003474974706295404, 'batch_size': 574, 'optimizer': 'Adam'}. Best is trial 151 with value: 0.07582601723856444.
2026-05-18 23:20:18,397 - experiment_functions - INFO - Early stopping at epoch 1200. Best Recall: 0.0706
2026-05-18 23:20:18,530 - optuna.study.study - INFO - Trial 193 finished with value: 0.07058850508862648 and parameters: {'n_layers': 1, 'embedding_dim': 32, 'lr': 0.0013986390792172852, 'lambda_val': 0.0006323877582688916, 'batch_size': 532, 'optimizer': 'Adam'}. Best is trial 151 with value: 0.07582601723856444.
2026-05-18 23:20:32,297 - experiment_functions - INFO - Early stopping at epoch 950. Best Recall: 0.0633
2026-05-18 23:20:32,422 - optuna.study.study - INFO - Trial 194 finished with value: 0.06325547405876798 and parameters: {'n_layers': 1, 'embedding_dim': 32, 'lr': 0.0017165306262817064, 'lambda_val': 0.0003168551997256745, 'batch_size': 557, 'optimizer': 'Adam'}. Best is trial 151 with value: 0.07582601723856444.
2026-05-18 23:20:45,037 - experiment_functions - INFO - Early stopping at epoch 900. Best Recall: 0.0669
2026-05-18 23:20:45,344 - optuna.study.study - INFO - Trial 195 finished with value: 0.06692159162537194 and parameters: {'n_layers': 1, 'embedding_dim': 32, 'lr': 0.0019055270523052256, 'lambda_val': 0.00020868648711031958, 'batch_size': 577, 'optimizer': 'Adam'}. Best is trial 151 with value: 0.07582601723856444.
2026-05-18 23:21:03,233 - optuna.study._optimize - INFO - Trial 196 pruned. 
2026-05-18 23:21:19,317 - experiment_functions - INFO - Early stopping at epoch 1150. Best Recall: 0.0670
2026-05-18 23:21:19,406 - optuna.study.study - INFO - Trial 197 finished with value: 0.0669656885096041 and parameters: {'n_layers': 1, 'embedding_dim': 32, 'lr': 0.0015371856821577276, 'lambda_val': 0.0002758173351340263, 'batch_size': 550, 'optimizer': 'Adam'}. Best is trial 151 with value: 0.07582601723856444.
2026-05-18 23:21:31,286 - experiment_functions - INFO - Early stopping at epoch 800. Best Recall: 0.0612
2026-05-18 23:21:31,376 - optuna.study.study - INFO - Trial 198 finished with value: 0.061194471318188254 and parameters: {'n_layers': 1, 'embedding_dim': 96, 'lr': 0.002210028346198706, 'lambda_val': 7.241363583661071e-05, 'batch_size': 513, 'optimizer': 'Adam'}. Best is trial 151 with value: 0.07582601723856444.
2026-05-18 23:21:46,575 - experiment_functions - INFO - Early stopping at epoch 1050. Best Recall: 0.0670
2026-05-18 23:21:46,676 - optuna.study.study - INFO - Trial 199 finished with value: 0.06695518673817942 and parameters: {'n_layers': 1, 'embedding_dim': 32, 'lr': 0.00137547511802079, 'lambda_val': 0.0007609579482876186, 'batch_size': 772, 'optimizer': 'Adam'}. Best is trial 151 with value: 0.07582601723856444.
2026-05-18 23:22:01,557 - optuna.study._optimize - INFO - Trial 200 pruned. 
2026-05-18 23:22:26,183 - experiment_functions - INFO - Early stopping at epoch 1750. Best Recall: 0.0712
2026-05-18 23:22:26,273 - optuna.study.study - INFO - Trial 201 finished with value: 0.07123065506618 and parameters: {'n_layers': 1, 'embedding_dim': 32, 'lr': 0.0009520705158245468, 'lambda_val': 0.0003492456332392688, 'batch_size': 760, 'optimizer': 'Adam'}. Best is trial 151 with value: 0.07582601723856444.
2026-05-18 23:22:51,815 - optuna.study._optimize - INFO - Trial 202 pruned. 
2026-05-18 23:23:09,130 - experiment_functions - INFO - Early stopping at epoch 1150. Best Recall: 0.0704
2026-05-18 23:23:09,275 - optuna.study.study - INFO - Trial 203 finished with value: 0.07036900700329758 and parameters: {'n_layers': 1, 'embedding_dim': 32, 'lr': 0.001457820656628755, 'lambda_val': 0.00025340852784261017, 'batch_size': 716, 'optimizer': 'Adam'}. Best is trial 151 with value: 0.07582601723856444.
2026-05-18 23:23:24,520 - experiment_functions - INFO - Early stopping at epoch 1100. Best Recall: 0.0700
2026-05-18 23:23:24,667 - optuna.study.study - INFO - Trial 204 finished with value: 0.07003812930953435 and parameters: {'n_layers': 1, 'embedding_dim': 32, 'lr': 0.0015218971270962956, 'lambda_val': 0.00024376309243537975, 'batch_size': 724, 'optimizer': 'Adam'}. Best is trial 151 with value: 0.07582601723856444.
2026-05-18 23:23:39,028 - optuna.study._optimize - INFO - Trial 205 pruned. 
2026-05-18 23:23:52,279 - optuna.study._optimize - INFO - Trial 206 pruned. 
2026-05-18 23:24:02,286 - experiment_functions - INFO - Early stopping at epoch 750. Best Recall: 0.0598
2026-05-18 23:24:02,375 - optuna.study.study - INFO - Trial 207 finished with value: 0.05975309552632592 and parameters: {'n_layers': 1, 'embedding_dim': 32, 'lr': 0.00274764256311465, 'lambda_val': 0.0010164120851972583, 'batch_size': 694, 'optimizer': 'Adam'}. Best is trial 151 with value: 0.07582601723856444.
2026-05-18 23:24:23,539 - experiment_functions - INFO - Early stopping at epoch 1000. Best Recall: 0.0668
2026-05-18 23:24:23,685 - optuna.study.study - INFO - Trial 208 finished with value: 0.06676301921037857 and parameters: {'n_layers': 1, 'embedding_dim': 32, 'lr': 0.0014058714584797472, 'lambda_val': 0.000368781353811381, 'batch_size': 847, 'optimizer': 'Adam'}. Best is trial 151 with value: 0.07582601723856444.
2026-05-18 23:24:47,443 - optuna.study._optimize - INFO - Trial 209 pruned. 
2026-05-18 23:25:08,595 - experiment_functions - INFO - Early stopping at epoch 900. Best Recall: 0.0665
2026-05-18 23:25:09,616 - optuna.study.study - INFO - Trial 210 finished with value: 0.06645467435431733 and parameters: {'n_layers': 1, 'embedding_dim': 32, 'lr': 0.001817891018860355, 'lambda_val': 0.00025458313695530263, 'batch_size': 741, 'optimizer': 'Adam'}. Best is trial 151 with value: 0.07582601723856444.
2026-05-18 23:25:31,135 - experiment_functions - INFO - Early stopping at epoch 1000. Best Recall: 0.0642
2026-05-18 23:25:31,259 - optuna.study.study - INFO - Trial 211 finished with value: 0.06415335467480832 and parameters: {'n_layers': 1, 'embedding_dim': 32, 'lr': 0.0016019129758932493, 'lambda_val': 0.00021733451527069025, 'batch_size': 742, 'optimizer': 'Adam'}. Best is trial 151 with value: 0.07582601723856444.
2026-05-18 23:25:43,587 - experiment_functions - INFO - Early stopping at epoch 800. Best Recall: 0.0647
2026-05-18 23:25:43,756 - optuna.study.study - INFO - Trial 212 finished with value: 0.06473077409408252 and parameters: {'n_layers': 1, 'embedding_dim': 32, 'lr': 0.00213801718487499, 'lambda_val': 0.0002765412869068513, 'batch_size': 691, 'optimizer': 'Adam'}. Best is trial 151 with value: 0.07582601723856444.
2026-05-18 23:26:02,898 - experiment_functions - INFO - Early stopping at epoch 1400. Best Recall: 0.0703
2026-05-18 23:26:02,975 - optuna.study.study - INFO - Trial 213 finished with value: 0.0703228300553122 and parameters: {'n_layers': 1, 'embedding_dim': 32, 'lr': 0.0012925332893342102, 'lambda_val': 0.00014414841330186046, 'batch_size': 512, 'optimizer': 'Adam'}. Best is trial 151 with value: 0.07582601723856444.
2026-05-18 23:26:23,519 - experiment_functions - INFO - Early stopping at epoch 1500. Best Recall: 0.0717
2026-05-18 23:26:23,615 - optuna.study.study - INFO - Trial 214 finished with value: 0.07168582224907825 and parameters: {'n_layers': 1, 'embedding_dim': 32, 'lr': 0.0011932289120260022, 'lambda_val': 0.00015120644220407607, 'batch_size': 536, 'optimizer': 'Adam'}. Best is trial 151 with value: 0.07582601723856444.
2026-05-18 23:27:04,033 - experiment_functions - INFO - Early stopping at epoch 1350. Best Recall: 0.0690
