2026-05-17 19:22:29,259 - optuna.study.study - INFO - Trial 57 finished with value: 0.006053913806811086 and parameters: {'n_layers': 1, 'embedding_dim': 32, 'lr': 1.1741036275355827e-05, 'lambda_val': 0.005174342537327482, 'batch_size': 702, 'optimizer': 'Adam'}. Best is trial 31 with value: 0.08619786480159895.
2026-05-17 19:22:40,035 - experiment_functions - INFO - Early stopping at epoch 700. Best Recall: 0.0058
2026-05-17 19:22:40,136 - optuna.study.study - INFO - Trial 58 finished with value: 0.005806794010635712 and parameters: {'n_layers': 1, 'embedding_dim': 32, 'lr': 3.0964880491945634e-05, 'lambda_val': 0.002939998210316972, 'batch_size': 934, 'optimizer': 'Adam'}. Best is trial 31 with value: 0.08619786480159895.
2026-05-17 19:22:50,923 - experiment_functions - INFO - Early stopping at epoch 600. Best Recall: 0.0511
2026-05-17 19:22:51,016 - optuna.study.study - INFO - Trial 59 finished with value: 0.05109044474601887 and parameters: {'n_layers': 2, 'embedding_dim': 64, 'lr': 0.001604509466338317, 'lambda_val': 0.0014803552410376595, 'batch_size': 3157, 'optimizer': 'Adam'}. Best is trial 31 with value: 0.08619786480159895.
2026-05-17 19:23:07,010 - experiment_functions - INFO - Early stopping at epoch 950. Best Recall: 0.0756
2026-05-17 19:23:07,123 - optuna.study.study - INFO - Trial 60 finished with value: 0.07556329357204837 and parameters: {'n_layers': 1, 'embedding_dim': 128, 'lr': 0.0006220141454374211, 'lambda_val': 0.02364982094644941, 'batch_size': 2559, 'optimizer': 'Adam'}. Best is trial 31 with value: 0.08619786480159895.
2026-05-17 19:23:17,628 - experiment_functions - INFO - Early stopping at epoch 650. Best Recall: 0.0886
2026-05-17 19:23:17,796 - optuna.study.study - INFO - Trial 61 finished with value: 0.08860395785856419 and parameters: {'n_layers': 1, 'embedding_dim': 64, 'lr': 0.002447360646658671, 'lambda_val': 0.012184126971826147, 'batch_size': 1418, 'optimizer': 'Adam'}. Best is trial 61 with value: 0.08860395785856419.
2026-05-17 19:23:27,584 - experiment_functions - INFO - Early stopping at epoch 600. Best Recall: 0.0653
2026-05-17 19:23:27,663 - optuna.study.study - INFO - Trial 62 finished with value: 0.06528805392900668 and parameters: {'n_layers': 1, 'embedding_dim': 64, 'lr': 0.0034173906137907398, 'lambda_val': 0.04246422978438109, 'batch_size': 1879, 'optimizer': 'Adam'}. Best is trial 61 with value: 0.08860395785856419.
2026-05-17 19:23:36,770 - experiment_functions - INFO - Early stopping at epoch 550. Best Recall: 0.0846
2026-05-17 19:23:36,906 - optuna.study.study - INFO - Trial 63 finished with value: 0.0846208941611594 and parameters: {'n_layers': 1, 'embedding_dim': 64, 'lr': 0.006554394974791962, 'lambda_val': 0.0067553625804002565, 'batch_size': 2815, 'optimizer': 'Adam'}. Best is trial 61 with value: 0.08860395785856419.
2026-05-17 19:23:45,888 - experiment_functions - INFO - Early stopping at epoch 550. Best Recall: 0.0776
2026-05-17 19:23:46,024 - optuna.study.study - INFO - Trial 64 finished with value: 0.07761944394162175 and parameters: {'n_layers': 1, 'embedding_dim': 64, 'lr': 0.0068148816356615885, 'lambda_val': 0.0142913420790888, 'batch_size': 1209, 'optimizer': 'Adam'}. Best is trial 61 with value: 0.08860395785856419.
2026-05-17 19:24:00,548 - experiment_functions - INFO - Early stopping at epoch 900. Best Recall: 0.0792
2026-05-17 19:24:00,638 - optuna.study.study - INFO - Trial 65 finished with value: 0.07916321573819338 and parameters: {'n_layers': 1, 'embedding_dim': 64, 'lr': 0.0010344368183396407, 'lambda_val': 0.006891168893706064, 'batch_size': 1461, 'optimizer': 'Adam'}. Best is trial 61 with value: 0.08860395785856419.
2026-05-17 19:24:19,509 - optuna.study._optimize - INFO - Trial 66 pruned. 
2026-05-17 19:24:29,754 - experiment_functions - INFO - Early stopping at epoch 550. Best Recall: 0.0185
2026-05-17 19:24:29,845 - optuna.study.study - INFO - Trial 67 finished with value: 0.018494211086866785 and parameters: {'n_layers': 3, 'embedding_dim': 64, 'lr': 0.004436913651444201, 'lambda_val': 0.05903669495472041, 'batch_size': 1584, 'optimizer': 'Adam'}. Best is trial 61 with value: 0.08860395785856419.
2026-05-17 19:24:38,950 - experiment_functions - INFO - Early stopping at epoch 550. Best Recall: 0.0626
2026-05-17 19:24:39,052 - optuna.study.study - INFO - Trial 68 finished with value: 0.06262499815788827 and parameters: {'n_layers': 1, 'embedding_dim': 64, 'lr': 0.006716481030114851, 'lambda_val': 0.004079479245722952, 'batch_size': 1147, 'optimizer': 'Adam'}. Best is trial 61 with value: 0.08860395785856419.
2026-05-17 19:24:47,903 - experiment_functions - INFO - Early stopping at epoch 500. Best Recall: 0.0055
2026-05-17 19:24:48,046 - optuna.study.study - INFO - Trial 69 finished with value: 0.005498194656331169 and parameters: {'n_layers': 1, 'embedding_dim': 96, 'lr': 0.02017812820276004, 'lambda_val': 0.02090325657748014, 'batch_size': 3287, 'optimizer': 'SGD'}. Best is trial 61 with value: 0.08860395785856419.
2026-05-17 19:24:58,487 - experiment_functions - INFO - Early stopping at epoch 600. Best Recall: 0.0302
2026-05-17 19:24:58,591 - optuna.study.study - INFO - Trial 70 finished with value: 0.03021834786603549 and parameters: {'n_layers': 2, 'embedding_dim': 64, 'lr': 0.002644703732090207, 'lambda_val': 0.03661479660671623, 'batch_size': 2315, 'optimizer': 'Adam'}. Best is trial 61 with value: 0.08860395785856419.
2026-05-17 19:25:09,312 - experiment_functions - INFO - Early stopping at epoch 700. Best Recall: 0.0772
2026-05-17 19:25:09,392 - optuna.study.study - INFO - Trial 71 finished with value: 0.07720267108024255 and parameters: {'n_layers': 1, 'embedding_dim': 32, 'lr': 0.0018470844380624747, 'lambda_val': 0.01414334060004719, 'batch_size': 2723, 'optimizer': 'Adam'}. Best is trial 61 with value: 0.08860395785856419.
2026-05-17 19:25:22,183 - experiment_functions - INFO - Early stopping at epoch 800. Best Recall: 0.0811
2026-05-17 19:25:22,295 - optuna.study.study - INFO - Trial 72 finished with value: 0.08106243365436794 and parameters: {'n_layers': 1, 'embedding_dim': 32, 'lr': 0.0013195768748423728, 'lambda_val': 5.34249428899367e-06, 'batch_size': 2537, 'optimizer': 'Adam'}. Best is trial 61 with value: 0.08860395785856419.
2026-05-17 19:25:35,327 - experiment_functions - INFO - Early stopping at epoch 750. Best Recall: 0.0725
2026-05-17 19:25:35,419 - optuna.study.study - INFO - Trial 73 finished with value: 0.0725156992496308 and parameters: {'n_layers': 1, 'embedding_dim': 128, 'lr': 0.00113989014661238, 'lambda_val': 7.885937784360723e-06, 'batch_size': 2985, 'optimizer': 'Adam'}. Best is trial 61 with value: 0.08860395785856419.
2026-05-17 19:25:45,528 - experiment_functions - INFO - Early stopping at epoch 650. Best Recall: 0.0802
2026-05-17 19:25:45,664 - optuna.study.study - INFO - Trial 74 finished with value: 0.0801912021532182 and parameters: {'n_layers': 1, 'embedding_dim': 32, 'lr': 0.0029662293003695807, 'lambda_val': 4.926006330710443e-06, 'batch_size': 2195, 'optimizer': 'Adam'}. Best is trial 61 with value: 0.08860395785856419.
2026-05-17 19:25:59,232 - experiment_functions - INFO - Early stopping at epoch 850. Best Recall: 0.0888
2026-05-17 19:25:59,334 - optuna.study.study - INFO - Trial 75 finished with value: 0.08877383989281264 and parameters: {'n_layers': 1, 'embedding_dim': 64, 'lr': 0.0014132633698927877, 'lambda_val': 2.2104529591313163e-06, 'batch_size': 1305, 'optimizer': 'Adam'}. Best is trial 75 with value: 0.08877383989281264.
2026-05-17 19:26:20,113 - experiment_functions - INFO - Early stopping at epoch 1300. Best Recall: 0.0788
2026-05-17 19:26:20,215 - optuna.study.study - INFO - Trial 76 finished with value: 0.078828693147393 and parameters: {'n_layers': 1, 'embedding_dim': 64, 'lr': 0.0007996218262225606, 'lambda_val': 2.5245105631661277e-06, 'batch_size': 1043, 'optimizer': 'Adam'}. Best is trial 75 with value: 0.08877383989281264.
2026-05-17 19:26:35,664 - optuna.study._optimize - INFO - Trial 77 pruned. 
2026-05-17 19:26:46,048 - experiment_functions - INFO - Early stopping at epoch 600. Best Recall: 0.0583
2026-05-17 19:26:46,360 - optuna.study.study - INFO - Trial 78 finished with value: 0.058258721005609644 and parameters: {'n_layers': 1, 'embedding_dim': 64, 'lr': 0.005902780357853288, 'lambda_val': 2.591709678555241e-06, 'batch_size': 638, 'optimizer': 'Adam'}. Best is trial 75 with value: 0.08877383989281264.
2026-05-17 19:26:55,531 - experiment_functions - INFO - Early stopping at epoch 550. Best Recall: 0.0305
2026-05-17 19:26:55,657 - optuna.study.study - INFO - Trial 79 finished with value: 0.030467872450105796 and parameters: {'n_layers': 1, 'embedding_dim': 64, 'lr': 0.008471881243494716, 'lambda_val': 0.07050220388175633, 'batch_size': 1512, 'optimizer': 'Adam'}. Best is trial 75 with value: 0.08877383989281264.
2026-05-17 19:27:08,021 - experiment_functions - INFO - Early stopping at epoch 750. Best Recall: 0.0815
2026-05-17 19:27:08,121 - optuna.study.study - INFO - Trial 80 finished with value: 0.08150241456582966 and parameters: {'n_layers': 1, 'embedding_dim': 64, 'lr': 0.0016719269465314895, 'lambda_val': 2.1392179971649157e-05, 'batch_size': 1729, 'optimizer': 'Adam'}. Best is trial 75 with value: 0.08877383989281264.
2026-05-17 19:27:21,181 - experiment_functions - INFO - Early stopping at epoch 800. Best Recall: 0.0819
2026-05-17 19:27:21,317 - optuna.study.study - INFO - Trial 81 finished with value: 0.08187895868703661 and parameters: {'n_layers': 1, 'embedding_dim': 64, 'lr': 0.0015354089983845973, 'lambda_val': 1.3303812099705557e-05, 'batch_size': 1731, 'optimizer': 'Adam'}. Best is trial 75 with value: 0.08877383989281264.
2026-05-17 19:27:33,871 - experiment_functions - INFO - Early stopping at epoch 750. Best Recall: 0.0835
2026-05-17 19:27:33,961 - optuna.study.study - INFO - Trial 82 finished with value: 0.08346030026778266 and parameters: {'n_layers': 1, 'embedding_dim': 64, 'lr': 0.0016116727276607617, 'lambda_val': 1.1509215034900692e-05, 'batch_size': 1704, 'optimizer': 'Adam'}. Best is trial 75 with value: 0.08877383989281264.
2026-05-17 19:27:48,353 - experiment_functions - INFO - Early stopping at epoch 850. Best Recall: 0.0886
2026-05-17 19:27:48,455 - optuna.study.study - INFO - Trial 83 finished with value: 0.08857135220807837 and parameters: {'n_layers': 1, 'embedding_dim': 64, 'lr': 0.001404525611927884, 'lambda_val': 1.2080514996111145e-05, 'batch_size': 1636, 'optimizer': 'Adam'}. Best is trial 75 with value: 0.08877383989281264.
2026-05-17 19:28:16,270 - experiment_functions - INFO - Early stopping at epoch 1700. Best Recall: 0.0838
2026-05-17 19:28:16,380 - optuna.study.study - INFO - Trial 84 finished with value: 0.08375984380516549 and parameters: {'n_layers': 1, 'embedding_dim': 64, 'lr': 0.0006130311734382425, 'lambda_val': 2.4847701373969187e-06, 'batch_size': 1416, 'optimizer': 'Adam'}. Best is trial 75 with value: 0.08877383989281264.
2026-05-17 19:28:33,237 - experiment_functions - INFO - Early stopping at epoch 850. Best Recall: 0.0393
2026-05-17 19:28:33,339 - optuna.study.study - INFO - Trial 85 finished with value: 0.039252752078214125 and parameters: {'n_layers': 4, 'embedding_dim': 64, 'lr': 0.00045020674602035463, 'lambda_val': 2.5421454642846797e-06, 'batch_size': 1287, 'optimizer': 'Adam'}. Best is trial 75 with value: 0.08877383989281264.
2026-05-17 19:29:02,835 - experiment_functions - INFO - Early stopping at epoch 1850. Best Recall: 0.0874
2026-05-17 19:29:02,947 - optuna.study.study - INFO - Trial 86 finished with value: 0.08737813831198638 and parameters: {'n_layers': 1, 'embedding_dim': 64, 'lr': 0.0005847878586767084, 'lambda_val': 3.6009133246781026e-06, 'batch_size': 1435, 'optimizer': 'Adam'}. Best is trial 75 with value: 0.08877383989281264.
2026-05-17 19:29:11,442 - experiment_functions - INFO - Early stopping at epoch 500. Best Recall: 0.0048
2026-05-17 19:29:11,586 - optuna.study.study - INFO - Trial 87 finished with value: 0.004803230882453454 and parameters: {'n_layers': 1, 'embedding_dim': 64, 'lr': 0.00030348703426123, 'lambda_val': 1.437311262547105e-06, 'batch_size': 1396, 'optimizer': 'SGD'}. Best is trial 75 with value: 0.08877383989281264.
2026-05-17 19:29:33,826 - experiment_functions - INFO - Early stopping at epoch 1350. Best Recall: 0.0891
2026-05-17 19:29:33,953 - optuna.study.study - INFO - Trial 88 finished with value: 0.08908288027212666 and parameters: {'n_layers': 1, 'embedding_dim': 64, 'lr': 0.0008808943829504952, 'lambda_val': 1.7209843617654444e-06, 'batch_size': 999, 'optimizer': 'Adam'}. Best is trial 88 with value: 0.08908288027212666.
2026-05-17 19:29:51,609 - experiment_functions - INFO - Early stopping at epoch 1100. Best Recall: 0.0755
2026-05-17 19:29:52,132 - optuna.study.study - INFO - Trial 89 finished with value: 0.07549255607006278 and parameters: {'n_layers': 1, 'embedding_dim': 64, 'lr': 0.0008419378805971252, 'lambda_val': 3.7431358603920994e-06, 'batch_size': 1619, 'optimizer': 'Adam'}. Best is trial 88 with value: 0.08908288027212666.
2026-05-17 19:30:06,944 - optuna.study._optimize - INFO - Trial 90 pruned. 
2026-05-17 19:30:54,186 - experiment_functions - INFO - Early stopping at epoch 2950. Best Recall: 0.0907
2026-05-17 19:30:54,313 - optuna.study.study - INFO - Trial 91 finished with value: 0.09068292813704805 and parameters: {'n_layers': 1, 'embedding_dim': 64, 'lr': 0.0005668322821884498, 'lambda_val': 2.0561469607327705e-06, 'batch_size': 977, 'optimizer': 'Adam'}. Best is trial 91 with value: 0.09068292813704805.
2026-05-17 19:31:37,895 - experiment_functions - INFO - Early stopping at epoch 2750. Best Recall: 0.0917
2026-05-17 19:31:38,012 - optuna.study.study - INFO - Trial 92 finished with value: 0.09168246275936569 and parameters: {'n_layers': 1, 'embedding_dim': 64, 'lr': 0.0005559019801500389, 'lambda_val': 1.6795803438658904e-06, 'batch_size': 1142, 'optimizer': 'Adam'}. Best is trial 92 with value: 0.09168246275936569.
2026-05-17 19:32:41,442 - optuna.study.study - INFO - Trial 93 finished with value: 0.08684210400522185 and parameters: {'n_layers': 1, 'embedding_dim': 64, 'lr': 0.0005268024828641616, 'lambda_val': 1.6866446117392758e-06, 'batch_size': 1032, 'optimizer': 'Adam'}. Best is trial 92 with value: 0.09168246275936569.
2026-05-17 19:32:56,143 - optuna.study._optimize - INFO - Trial 94 pruned. 
2026-05-17 19:33:38,308 - experiment_functions - INFO - Early stopping at epoch 2650. Best Recall: 0.0919
2026-05-17 19:33:38,412 - optuna.study.study - INFO - Trial 95 finished with value: 0.09192305429420808 and parameters: {'n_layers': 1, 'embedding_dim': 64, 'lr': 0.0005414373685834407, 'lambda_val': 1.916917268351663e-06, 'batch_size': 1156, 'optimizer': 'Adam'}. Best is trial 95 with value: 0.09192305429420808.
2026-05-17 19:33:56,792 - optuna.study._optimize - INFO - Trial 96 pruned. 
2026-05-17 19:34:44,916 - experiment_functions - INFO - Early stopping at epoch 3050. Best Recall: 0.0908
2026-05-17 19:34:45,019 - optuna.study.study - INFO - Trial 97 finished with value: 0.09079351454395689 and parameters: {'n_layers': 1, 'embedding_dim': 64, 'lr': 0.0005815150434476362, 'lambda_val': 3.6388337646727266e-06, 'batch_size': 894, 'optimizer': 'Adam'}. Best is trial 95 with value: 0.09192305429420808.
2026-05-17 19:35:00,517 - optuna.study._optimize - INFO - Trial 98 pruned. 
2026-05-17 19:35:15,916 - optuna.study._optimize - INFO - Trial 99 pruned. 
2026-05-17 19:36:03,111 - experiment_functions - INFO - Early stopping at epoch 2950. Best Recall: 0.0933
2026-05-17 19:36:03,239 - optuna.study.study - INFO - Trial 100 finished with value: 0.09325427051656286 and parameters: {'n_layers': 1, 'embedding_dim': 64, 'lr': 0.0006340338563421031, 'lambda_val': 1.099774751905869e-06, 'batch_size': 835, 'optimizer': 'Adam'}. Best is trial 100 with value: 0.09325427051656286.
2026-05-17 19:36:18,910 - optuna.study._optimize - INFO - Trial 101 pruned. 
2026-05-17 19:36:33,761 - optuna.study._optimize - INFO - Trial 102 pruned. 
2026-05-17 19:36:48,993 - optuna.study._optimize - INFO - Trial 103 pruned. 
2026-05-17 19:37:06,134 - optuna.study._optimize - INFO - Trial 104 pruned. 
2026-05-17 19:37:26,840 - experiment_functions - INFO - Early stopping at epoch 1300. Best Recall: 0.0826
2026-05-17 19:37:26,952 - optuna.study.study - INFO - Trial 105 finished with value: 0.0825578420930551 and parameters: {'n_layers': 1, 'embedding_dim': 64, 'lr': 0.0009076687036050988, 'lambda_val': 4.9475576452633555e-06, 'batch_size': 981, 'optimizer': 'Adam'}. Best is trial 100 with value: 0.09325427051656286.
2026-05-17 19:37:49,860 - experiment_functions - INFO - Early stopping at epoch 1350. Best Recall: 0.0849
2026-05-17 19:37:49,952 - optuna.study.study - INFO - Trial 106 finished with value: 0.08487491565673237 and parameters: {'n_layers': 1, 'embedding_dim': 96, 'lr': 0.0007065474670066877, 'lambda_val': 1.2128506885817523e-06, 'batch_size': 1230, 'optimizer': 'Adam'}. Best is trial 100 with value: 0.09325427051656286.
2026-05-17 19:38:05,115 - optuna.study._optimize - INFO - Trial 107 pruned. 
2026-05-17 19:38:13,801 - experiment_functions - INFO - Early stopping at epoch 500. Best Recall: 0.0054
2026-05-17 19:38:13,904 - optuna.study.study - INFO - Trial 108 finished with value: 0.005421519603190347 and parameters: {'n_layers': 1, 'embedding_dim': 128, 'lr': 0.00020556252202397394, 'lambda_val': 6.1817685428766175e-06, 'batch_size': 669, 'optimizer': 'SGD'}. Best is trial 100 with value: 0.09325427051656286.
2026-05-17 19:38:31,219 - experiment_functions - INFO - Early stopping at epoch 1050. Best Recall: 0.0889
2026-05-17 19:38:31,331 - optuna.study.study - INFO - Trial 109 finished with value: 0.08892117556047704 and parameters: {'n_layers': 1, 'embedding_dim': 64, 'lr': 0.0010443041165466803, 'lambda_val': 9.65326613225844e-06, 'batch_size': 1166, 'optimizer': 'Adam'}. Best is trial 100 with value: 0.09325427051656286.
2026-05-17 19:38:43,821 - experiment_functions - INFO - Early stopping at epoch 650. Best Recall: 0.0461
2026-05-17 19:38:43,923 - optuna.study.study - INFO - Trial 110 finished with value: 0.046142492622790986 and parameters: {'n_layers': 3, 'embedding_dim': 64, 'lr': 0.0010980879083568795, 'lambda_val': 1.0061941261882017e-06, 'batch_size': 1153, 'optimizer': 'Adam'}. Best is trial 100 with value: 0.09325427051656286.
2026-05-17 19:39:03,720 - optuna.study._optimize - INFO - Trial 111 pruned. 
2026-05-17 19:39:26,800 - experiment_functions - INFO - Early stopping at epoch 1450. Best Recall: 0.0889
2026-05-17 19:39:26,890 - optuna.study.study - INFO - Trial 112 finished with value: 0.08890255169950725 and parameters: {'n_layers': 1, 'embedding_dim': 64, 'lr': 0.0007715816732852546, 'lambda_val': 1.9909634199834993e-06, 'batch_size': 1042, 'optimizer': 'Adam'}. Best is trial 100 with value: 0.09325427051656286.
2026-05-17 19:39:53,479 - experiment_functions - INFO - Early stopping at epoch 1650. Best Recall: 0.0918
2026-05-17 19:39:53,576 - optuna.study.study - INFO - Trial 113 finished with value: 0.09183249923571317 and parameters: {'n_layers': 1, 'embedding_dim': 64, 'lr': 0.0007797649653123614, 'lambda_val': 2.1145175753987397e-06, 'batch_size': 819, 'optimizer': 'Adam'}. Best is trial 100 with value: 0.09325427051656286.
2026-05-17 19:40:09,851 - experiment_functions - INFO - Early stopping at epoch 950. Best Recall: 0.0872
2026-05-17 19:40:09,962 - optuna.study.study - INFO - Trial 114 finished with value: 0.0872139195478273 and parameters: {'n_layers': 1, 'embedding_dim': 64, 'lr': 0.0012668811154403592, 'lambda_val': 2.0691826213124658e-06, 'batch_size': 847, 'optimizer': 'Adam'}. Best is trial 100 with value: 0.09325427051656286.
2026-05-17 19:40:37,471 - experiment_functions - INFO - Early stopping at epoch 1700. Best Recall: 0.0876
2026-05-17 19:40:38,003 - optuna.study.study - INFO - Trial 115 finished with value: 0.08757564549762187 and parameters: {'n_layers': 1, 'embedding_dim': 64, 'lr': 0.0008336822416005826, 'lambda_val': 1.2443076900248996e-06, 'batch_size': 771, 'optimizer': 'Adam'}. Best is trial 100 with value: 0.09325427051656286.
2026-05-17 19:40:57,442 - experiment_functions - INFO - Early stopping at epoch 1200. Best Recall: 0.0903
2026-05-17 19:40:57,552 - optuna.study.study - INFO - Trial 116 finished with value: 0.09032862750409086 and parameters: {'n_layers': 1, 'embedding_dim': 64, 'lr': 0.0009488007234719272, 'lambda_val': 2.2465396731078966e-06, 'batch_size': 958, 'optimizer': 'Adam'}. Best is trial 100 with value: 0.09325427051656286.
2026-05-17 19:41:15,989 - experiment_functions - INFO - Early stopping at epoch 950. Best Recall: 0.0806
2026-05-17 19:41:16,100 - optuna.study.study - INFO - Trial 117 finished with value: 0.08058424959444199 and parameters: {'n_layers': 1, 'embedding_dim': 256, 'lr': 0.0007142231576970111, 'lambda_val': 2.334227383399295e-06, 'batch_size': 947, 'optimizer': 'RMSprop'}. Best is trial 100 with value: 0.09325427051656286.
2026-05-17 19:41:40,165 - experiment_functions - INFO - Early stopping at epoch 1450. Best Recall: 0.0875
2026-05-17 19:41:40,266 - optuna.study.study - INFO - Trial 118 finished with value: 0.08754249223273175 and parameters: {'n_layers': 1, 'embedding_dim': 64, 'lr': 0.0009320379276207348, 'lambda_val': 2.9328136541606003e-06, 'batch_size': 614, 'optimizer': 'Adam'}. Best is trial 100 with value: 0.09325427051656286.
2026-05-17 19:41:56,492 - experiment_functions - INFO - Early stopping at epoch 1000. Best Recall: 0.0873
2026-05-17 19:41:56,582 - optuna.study.study - INFO - Trial 119 finished with value: 0.08733242233014124 and parameters: {'n_layers': 1, 'embedding_dim': 64, 'lr': 0.0011589711898783747, 'lambda_val': 1.529562163168821e-06, 'batch_size': 1087, 'optimizer': 'Adam'}. Best is trial 100 with value: 0.09325427051656286.
2026-05-17 19:42:12,227 - experiment_functions - INFO - Early stopping at epoch 900. Best Recall: 0.0738
