2026-05-18 20:06:18,939 - optuna.study.study - INFO - Trial 137 finished with value: 0.06162504475729742 and parameters: {'n_layers': 1, 'embedding_dim': 32, 'lr': 0.0008393710210498267, 'lambda_val': 6.446612071883409e-06, 'batch_size': 585, 'optimizer': 'Adam'}. Best is trial 133 with value: 0.06361666449572526.
2026-05-18 20:06:29,687 - experiment_functions - INFO - Early stopping at epoch 800. Best Recall: 0.0574
2026-05-18 20:06:29,781 - optuna.study.study - INFO - Trial 138 finished with value: 0.05742822807515245 and parameters: {'n_layers': 1, 'embedding_dim': 32, 'lr': 0.0008504772747707466, 'lambda_val': 6.292935587431824e-06, 'batch_size': 579, 'optimizer': 'Adam'}. Best is trial 133 with value: 0.06361666449572526.
2026-05-18 20:06:41,507 - experiment_functions - INFO - Early stopping at epoch 850. Best Recall: 0.0576
2026-05-18 20:06:41,599 - optuna.study.study - INFO - Trial 139 finished with value: 0.05761896560220284 and parameters: {'n_layers': 1, 'embedding_dim': 32, 'lr': 0.0007111353263410624, 'lambda_val': 4.8212440445068025e-06, 'batch_size': 528, 'optimizer': 'Adam'}. Best is trial 133 with value: 0.06361666449572526.
2026-05-18 20:06:54,402 - experiment_functions - INFO - Early stopping at epoch 750. Best Recall: 0.0605
2026-05-18 20:06:54,506 - optuna.study.study - INFO - Trial 140 finished with value: 0.06045268817185182 and parameters: {'n_layers': 1, 'embedding_dim': 32, 'lr': 0.0009567786860834075, 'lambda_val': 7.788895685284505e-06, 'batch_size': 627, 'optimizer': 'Adam'}. Best is trial 133 with value: 0.06361666449572526.
2026-05-18 20:07:08,294 - experiment_functions - INFO - Early stopping at epoch 800. Best Recall: 0.0211
2026-05-18 20:07:08,477 - optuna.study.study - INFO - Trial 141 finished with value: 0.021132899442139617 and parameters: {'n_layers': 4, 'embedding_dim': 32, 'lr': 0.0009245199152407227, 'lambda_val': 7.62035760114584e-06, 'batch_size': 615, 'optimizer': 'Adam'}. Best is trial 133 with value: 0.06361666449572526.
2026-05-18 20:07:20,497 - experiment_functions - INFO - Early stopping at epoch 900. Best Recall: 0.0615
2026-05-18 20:07:20,589 - optuna.study.study - INFO - Trial 142 finished with value: 0.0614689725944121 and parameters: {'n_layers': 1, 'embedding_dim': 32, 'lr': 0.0006243615494150613, 'lambda_val': 5.287050055986489e-06, 'batch_size': 512, 'optimizer': 'Adam'}. Best is trial 133 with value: 0.06361666449572526.
2026-05-18 20:07:32,405 - experiment_functions - INFO - Early stopping at epoch 900. Best Recall: 0.0590
2026-05-18 20:07:32,973 - optuna.study.study - INFO - Trial 143 finished with value: 0.05901996110529321 and parameters: {'n_layers': 1, 'embedding_dim': 32, 'lr': 0.000642294901801554, 'lambda_val': 9.924635854588016e-06, 'batch_size': 713, 'optimizer': 'Adam'}. Best is trial 133 with value: 0.06361666449572526.
2026-05-18 20:07:44,679 - experiment_functions - INFO - Early stopping at epoch 850. Best Recall: 0.0625
2026-05-18 20:07:44,780 - optuna.study.study - INFO - Trial 144 finished with value: 0.06245106610647174 and parameters: {'n_layers': 1, 'embedding_dim': 32, 'lr': 0.0007895421564217762, 'lambda_val': 1.1901364575846895e-05, 'batch_size': 518, 'optimizer': 'Adam'}. Best is trial 133 with value: 0.06361666449572526.
2026-05-18 20:07:55,131 - experiment_functions - INFO - Early stopping at epoch 750. Best Recall: 0.0588
2026-05-18 20:07:55,232 - optuna.study.study - INFO - Trial 145 finished with value: 0.05884873787158318 and parameters: {'n_layers': 1, 'embedding_dim': 32, 'lr': 0.0011470793832322015, 'lambda_val': 1.2453851846193059e-05, 'batch_size': 512, 'optimizer': 'Adam'}. Best is trial 133 with value: 0.06361666449572526.
2026-05-18 20:08:09,092 - optuna.study._optimize - INFO - Trial 146 pruned. 
2026-05-18 20:08:20,545 - experiment_functions - INFO - Early stopping at epoch 850. Best Recall: 0.0592
2026-05-18 20:08:20,635 - optuna.study.study - INFO - Trial 147 finished with value: 0.059217235918634696 and parameters: {'n_layers': 1, 'embedding_dim': 32, 'lr': 0.0007685058859700846, 'lambda_val': 1.7306634576593028e-05, 'batch_size': 745, 'optimizer': 'Adam'}. Best is trial 133 with value: 0.06361666449572526.
2026-05-18 20:08:33,786 - optuna.study._optimize - INFO - Trial 148 pruned. 
2026-05-18 20:08:46,952 - experiment_functions - INFO - Early stopping at epoch 950. Best Recall: 0.0585
2026-05-18 20:08:47,054 - optuna.study.study - INFO - Trial 149 finished with value: 0.05849216566671854 and parameters: {'n_layers': 1, 'embedding_dim': 32, 'lr': 0.000584089811042971, 'lambda_val': 4.322188371687662e-06, 'batch_size': 514, 'optimizer': 'Adam'}. Best is trial 133 with value: 0.06361666449572526.
2026-05-18 20:09:01,926 - experiment_functions - INFO - Early stopping at epoch 1100. Best Recall: 0.0602
2026-05-18 20:09:02,037 - optuna.study.study - INFO - Trial 150 finished with value: 0.0601558877472 and parameters: {'n_layers': 1, 'embedding_dim': 32, 'lr': 0.0004518987702693041, 'lambda_val': 2.7210061310170933e-06, 'batch_size': 836, 'optimizer': 'Adam'}. Best is trial 133 with value: 0.06361666449572526.
2026-05-18 20:09:13,814 - experiment_functions - INFO - Early stopping at epoch 850. Best Recall: 0.0615
2026-05-18 20:09:13,950 - optuna.study.study - INFO - Trial 151 finished with value: 0.06153851300148201 and parameters: {'n_layers': 1, 'embedding_dim': 32, 'lr': 0.0008108999729777289, 'lambda_val': 5.554559244653819e-06, 'batch_size': 593, 'optimizer': 'Adam'}. Best is trial 133 with value: 0.06361666449572526.
2026-05-18 20:09:25,731 - experiment_functions - INFO - Early stopping at epoch 850. Best Recall: 0.0591
2026-05-18 20:09:25,821 - optuna.study.study - INFO - Trial 152 finished with value: 0.059134188137629426 and parameters: {'n_layers': 1, 'embedding_dim': 32, 'lr': 0.0008062047477732521, 'lambda_val': 9.605041316824874e-06, 'batch_size': 586, 'optimizer': 'Adam'}. Best is trial 133 with value: 0.06361666449572526.
2026-05-18 20:09:37,743 - experiment_functions - INFO - Early stopping at epoch 900. Best Recall: 0.0595
2026-05-18 20:09:37,843 - optuna.study.study - INFO - Trial 153 finished with value: 0.05945796512537976 and parameters: {'n_layers': 1, 'embedding_dim': 32, 'lr': 0.000648509733638558, 'lambda_val': 4.909449381262545e-06, 'batch_size': 740, 'optimizer': 'Adam'}. Best is trial 133 with value: 0.06361666449572526.
2026-05-18 20:09:48,179 - experiment_functions - INFO - Early stopping at epoch 750. Best Recall: 0.0574
2026-05-18 20:09:48,291 - optuna.study.study - INFO - Trial 154 finished with value: 0.05736002072071213 and parameters: {'n_layers': 1, 'embedding_dim': 32, 'lr': 0.0010681704245123537, 'lambda_val': 6.685198578971162e-06, 'batch_size': 649, 'optimizer': 'Adam'}. Best is trial 133 with value: 0.06361666449572526.
2026-05-18 20:09:55,444 - experiment_functions - INFO - Early stopping at epoch 500. Best Recall: 0.0057
2026-05-18 20:09:55,779 - optuna.study.study - INFO - Trial 155 finished with value: 0.005701043132892463 and parameters: {'n_layers': 1, 'embedding_dim': 32, 'lr': 0.0002552392820768344, 'lambda_val': 1.2225634061909008e-05, 'batch_size': 568, 'optimizer': 'SGD'}. Best is trial 133 with value: 0.06361666449572526.
2026-05-18 20:10:13,936 - experiment_functions - INFO - Early stopping at epoch 1350. Best Recall: 0.0627
2026-05-18 20:10:14,028 - optuna.study.study - INFO - Trial 156 finished with value: 0.06273802017501677 and parameters: {'n_layers': 1, 'embedding_dim': 32, 'lr': 0.0004164105594230138, 'lambda_val': 3.207914884614666e-06, 'batch_size': 675, 'optimizer': 'Adam'}. Best is trial 133 with value: 0.06361666449572526.
2026-05-18 20:10:26,674 - optuna.study._optimize - INFO - Trial 157 pruned. 
2026-05-18 20:10:40,791 - experiment_functions - INFO - Early stopping at epoch 1050. Best Recall: 0.0580
2026-05-18 20:10:40,960 - optuna.study.study - INFO - Trial 158 finished with value: 0.058032396730952826 and parameters: {'n_layers': 1, 'embedding_dim': 32, 'lr': 0.0005660793427905521, 'lambda_val': 5.580820469433289e-06, 'batch_size': 786, 'optimizer': 'Adam'}. Best is trial 133 with value: 0.06361666449572526.
2026-05-18 20:11:05,459 - optuna.study._optimize - INFO - Trial 159 pruned. 
2026-05-18 20:11:14,941 - experiment_functions - INFO - Early stopping at epoch 700. Best Recall: 0.0614
2026-05-18 20:11:15,032 - optuna.study.study - INFO - Trial 160 finished with value: 0.061415926263753924 and parameters: {'n_layers': 1, 'embedding_dim': 32, 'lr': 0.0013016322554478467, 'lambda_val': 3.0955916070688166e-06, 'batch_size': 659, 'optimizer': 'Adam'}. Best is trial 133 with value: 0.06361666449572526.
2026-05-18 20:11:25,698 - experiment_functions - INFO - Early stopping at epoch 750. Best Recall: 0.0608
2026-05-18 20:11:25,790 - optuna.study.study - INFO - Trial 161 finished with value: 0.06077431516284554 and parameters: {'n_layers': 1, 'embedding_dim': 32, 'lr': 0.0013262563110147513, 'lambda_val': 3.0600651312602292e-06, 'batch_size': 661, 'optimizer': 'Adam'}. Best is trial 133 with value: 0.06361666449572526.
2026-05-18 20:11:35,452 - experiment_functions - INFO - Early stopping at epoch 700. Best Recall: 0.0386
2026-05-18 20:11:35,552 - optuna.study.study - INFO - Trial 162 finished with value: 0.03856644812977514 and parameters: {'n_layers': 3, 'embedding_dim': 32, 'lr': 0.001262397591626579, 'lambda_val': 2.9944599441651115e-06, 'batch_size': 640, 'optimizer': 'Adam'}. Best is trial 133 with value: 0.06361666449572526.
2026-05-18 20:11:47,979 - experiment_functions - INFO - Early stopping at epoch 900. Best Recall: 0.0598
2026-05-18 20:11:48,069 - optuna.study.study - INFO - Trial 163 finished with value: 0.05980573521528714 and parameters: {'n_layers': 1, 'embedding_dim': 32, 'lr': 0.0009077179035544437, 'lambda_val': 4.0963983305559365e-06, 'batch_size': 673, 'optimizer': 'Adam'}. Best is trial 133 with value: 0.06361666449572526.
2026-05-18 20:11:58,553 - experiment_functions - INFO - Early stopping at epoch 750. Best Recall: 0.0619
2026-05-18 20:11:58,643 - optuna.study.study - INFO - Trial 164 finished with value: 0.06185633595164472 and parameters: {'n_layers': 1, 'embedding_dim': 32, 'lr': 0.001308765931881293, 'lambda_val': 3.163303294335203e-06, 'batch_size': 523, 'optimizer': 'Adam'}. Best is trial 133 with value: 0.06361666449572526.
2026-05-18 20:12:09,659 - experiment_functions - INFO - Early stopping at epoch 800. Best Recall: 0.0586
2026-05-18 20:12:09,748 - optuna.study.study - INFO - Trial 165 finished with value: 0.058626218222719816 and parameters: {'n_layers': 1, 'embedding_dim': 32, 'lr': 0.00109692808098215, 'lambda_val': 4.476739829288433e-06, 'batch_size': 549, 'optimizer': 'Adam'}. Best is trial 133 with value: 0.06361666449572526.
2026-05-18 20:12:19,423 - experiment_functions - INFO - Early stopping at epoch 700. Best Recall: 0.0598
2026-05-18 20:12:19,524 - optuna.study.study - INFO - Trial 166 finished with value: 0.05978461045077396 and parameters: {'n_layers': 1, 'embedding_dim': 32, 'lr': 0.0013918385140284399, 'lambda_val': 6.480851851673871e-06, 'batch_size': 519, 'optimizer': 'Adam'}. Best is trial 133 with value: 0.06361666449572526.
2026-05-18 20:12:31,649 - experiment_functions - INFO - Early stopping at epoch 900. Best Recall: 0.0625
2026-05-18 20:12:31,750 - optuna.study.study - INFO - Trial 167 finished with value: 0.06252375362233963 and parameters: {'n_layers': 1, 'embedding_dim': 32, 'lr': 0.0007425492725709493, 'lambda_val': 3.2165303805238447e-06, 'batch_size': 512, 'optimizer': 'Adam'}. Best is trial 133 with value: 0.06361666449572526.
2026-05-18 20:12:44,980 - experiment_functions - INFO - Early stopping at epoch 1000. Best Recall: 0.0578
2026-05-18 20:12:45,081 - optuna.study.study - INFO - Trial 168 finished with value: 0.05779986983898488 and parameters: {'n_layers': 1, 'embedding_dim': 32, 'lr': 0.0006055209399086977, 'lambda_val': 3.1582301390486284e-06, 'batch_size': 514, 'optimizer': 'Adam'}. Best is trial 133 with value: 0.06361666449572526.
2026-05-18 20:12:57,882 - experiment_functions - INFO - Early stopping at epoch 900. Best Recall: 0.0611
2026-05-18 20:12:57,974 - optuna.study.study - INFO - Trial 169 finished with value: 0.06108147311233382 and parameters: {'n_layers': 1, 'embedding_dim': 32, 'lr': 0.0007672256617009455, 'lambda_val': 2.6689219426450357e-06, 'batch_size': 652, 'optimizer': 'Adam'}. Best is trial 133 with value: 0.06361666449572526.
2026-05-18 20:13:09,649 - experiment_functions - INFO - Early stopping at epoch 800. Best Recall: 0.0597
2026-05-18 20:13:09,753 - optuna.study.study - INFO - Trial 170 finished with value: 0.05973884987957941 and parameters: {'n_layers': 1, 'embedding_dim': 32, 'lr': 0.0008765957946392233, 'lambda_val': 2.7279375185099546e-06, 'batch_size': 648, 'optimizer': 'Adam'}. Best is trial 133 with value: 0.06361666449572526.
2026-05-18 20:13:21,092 - experiment_functions - INFO - Early stopping at epoch 850. Best Recall: 0.0595
2026-05-18 20:13:21,183 - optuna.study.study - INFO - Trial 171 finished with value: 0.059530402491796884 and parameters: {'n_layers': 1, 'embedding_dim': 32, 'lr': 0.0007369881616854132, 'lambda_val': 3.5284088736046835e-06, 'batch_size': 595, 'optimizer': 'Adam'}. Best is trial 133 with value: 0.06361666449572526.
2026-05-18 20:13:32,864 - experiment_functions - INFO - Early stopping at epoch 850. Best Recall: 0.0600
2026-05-18 20:13:33,001 - optuna.study.study - INFO - Trial 172 finished with value: 0.059962035519923414 and parameters: {'n_layers': 1, 'embedding_dim': 32, 'lr': 0.0007092405412578626, 'lambda_val': 5.106779933454923e-06, 'batch_size': 798, 'optimizer': 'Adam'}. Best is trial 133 with value: 0.06361666449572526.
2026-05-18 20:13:49,447 - experiment_functions - INFO - Early stopping at epoch 1250. Best Recall: 0.0612
2026-05-18 20:13:49,560 - optuna.study.study - INFO - Trial 173 finished with value: 0.06118889621824558 and parameters: {'n_layers': 1, 'embedding_dim': 32, 'lr': 0.00041693838167229923, 'lambda_val': 2.577039032155941e-06, 'batch_size': 662, 'optimizer': 'Adam'}. Best is trial 133 with value: 0.06361666449572526.
2026-05-18 20:14:04,240 - experiment_functions - INFO - Early stopping at epoch 1100. Best Recall: 0.0584
2026-05-18 20:14:04,342 - optuna.study.study - INFO - Trial 174 finished with value: 0.05839226972188408 and parameters: {'n_layers': 1, 'embedding_dim': 32, 'lr': 0.00040755641632203967, 'lambda_val': 2.5530883223136783e-06, 'batch_size': 692, 'optimizer': 'Adam'}. Best is trial 133 with value: 0.06361666449572526.
2026-05-18 20:14:13,842 - experiment_functions - INFO - Early stopping at epoch 700. Best Recall: 0.0588
2026-05-18 20:14:14,013 - optuna.study.study - INFO - Trial 175 finished with value: 0.05876027705356569 and parameters: {'n_layers': 1, 'embedding_dim': 32, 'lr': 0.001298388891247877, 'lambda_val': 3.2302394430101204e-06, 'batch_size': 577, 'optimizer': 'Adam'}. Best is trial 133 with value: 0.06361666449572526.
2026-05-18 20:14:25,802 - experiment_functions - INFO - Early stopping at epoch 850. Best Recall: 0.0586
2026-05-18 20:14:25,894 - optuna.study.study - INFO - Trial 176 finished with value: 0.058592660426317715 and parameters: {'n_layers': 1, 'embedding_dim': 32, 'lr': 0.0008216151715636348, 'lambda_val': 2.4618325151735894e-06, 'batch_size': 654, 'optimizer': 'Adam'}. Best is trial 133 with value: 0.06361666449572526.
2026-05-18 20:14:35,755 - experiment_functions - INFO - Early stopping at epoch 700. Best Recall: 0.0468
2026-05-18 20:14:35,856 - optuna.study.study - INFO - Trial 177 finished with value: 0.04676244027617405 and parameters: {'n_layers': 1, 'embedding_dim': 32, 'lr': 0.0011174737323263494, 'lambda_val': 3.910230877606891e-06, 'batch_size': 3233, 'optimizer': 'Adam'}. Best is trial 133 with value: 0.06361666449572526.
2026-05-18 20:14:52,210 - experiment_functions - INFO - Early stopping at epoch 1250. Best Recall: 0.0592
2026-05-18 20:14:52,322 - optuna.study.study - INFO - Trial 178 finished with value: 0.05921320092188301 and parameters: {'n_layers': 1, 'embedding_dim': 64, 'lr': 0.0004397327660554947, 'lambda_val': 2.2796681920006566e-06, 'batch_size': 520, 'optimizer': 'Adam'}. Best is trial 133 with value: 0.06361666449572526.
2026-05-18 20:15:06,155 - experiment_functions - INFO - Early stopping at epoch 1000. Best Recall: 0.0607
2026-05-18 20:15:06,248 - optuna.study.study - INFO - Trial 179 finished with value: 0.06070355626734631 and parameters: {'n_layers': 1, 'embedding_dim': 32, 'lr': 0.0006389985227069216, 'lambda_val': 1.649460780633811e-06, 'batch_size': 734, 'optimizer': 'Adam'}. Best is trial 133 with value: 0.06361666449572526.
2026-05-18 20:15:12,938 - experiment_functions - INFO - Early stopping at epoch 500. Best Recall: 0.0052
2026-05-18 20:15:13,029 - optuna.study.study - INFO - Trial 180 finished with value: 0.005229845848567659 and parameters: {'n_layers': 1, 'embedding_dim': 32, 'lr': 0.0005046674944891983, 'lambda_val': 4.464040691535265e-06, 'batch_size': 618, 'optimizer': 'SGD'}. Best is trial 133 with value: 0.06361666449572526.
2026-05-18 20:15:25,372 - experiment_functions - INFO - Early stopping at epoch 900. Best Recall: 0.0577
2026-05-18 20:15:25,486 - optuna.study.study - INFO - Trial 181 finished with value: 0.05766166858861539 and parameters: {'n_layers': 1, 'embedding_dim': 32, 'lr': 0.0006266354572966551, 'lambda_val': 1.681051501912445e-06, 'batch_size': 759, 'optimizer': 'Adam'}. Best is trial 133 with value: 0.06361666449572526.
2026-05-18 20:15:38,566 - experiment_functions - INFO - Early stopping at epoch 950. Best Recall: 0.0636
2026-05-18 20:15:38,669 - optuna.study.study - INFO - Trial 182 finished with value: 0.06362387103793415 and parameters: {'n_layers': 1, 'embedding_dim': 32, 'lr': 0.0007251546869703505, 'lambda_val': 3.026558060869271e-06, 'batch_size': 689, 'optimizer': 'Adam'}. Best is trial 182 with value: 0.06362387103793415.
2026-05-18 20:15:52,160 - optuna.study._optimize - INFO - Trial 183 pruned. 
2026-05-18 20:16:04,356 - experiment_functions - INFO - Early stopping at epoch 900. Best Recall: 0.0579
2026-05-18 20:16:04,457 - optuna.study.study - INFO - Trial 184 finished with value: 0.05786415032090131 and parameters: {'n_layers': 1, 'embedding_dim': 32, 'lr': 0.0007609346891148693, 'lambda_val': 3.123497278711052e-06, 'batch_size': 860, 'optimizer': 'Adam'}. Best is trial 182 with value: 0.06362387103793415.
2026-05-18 20:16:15,765 - experiment_functions - INFO - Early stopping at epoch 800. Best Recall: 0.0585
2026-05-18 20:16:15,854 - optuna.study.study - INFO - Trial 185 finished with value: 0.05854767545059534 and parameters: {'n_layers': 1, 'embedding_dim': 32, 'lr': 0.0009392787655154019, 'lambda_val': 4.0018396379449864e-06, 'batch_size': 682, 'optimizer': 'Adam'}. Best is trial 182 with value: 0.06362387103793415.
2026-05-18 20:16:23,574 - experiment_functions - INFO - Early stopping at epoch 550. Best Recall: 0.0056
2026-05-18 20:16:23,691 - optuna.study.study - INFO - Trial 186 finished with value: 0.005619582710439483 and parameters: {'n_layers': 1, 'embedding_dim': 96, 'lr': 0.05430499263372517, 'lambda_val': 2.630383763520276e-06, 'batch_size': 578, 'optimizer': 'Adam'}. Best is trial 182 with value: 0.06362387103793415.
2026-05-18 20:16:33,631 - experiment_functions - INFO - Early stopping at epoch 700. Best Recall: 0.0595
2026-05-18 20:16:33,734 - optuna.study.study - INFO - Trial 187 finished with value: 0.059465314405651906 and parameters: {'n_layers': 1, 'embedding_dim': 32, 'lr': 0.0013794114631637483, 'lambda_val': 3.186576174510603e-06, 'batch_size': 674, 'optimizer': 'Adam'}. Best is trial 182 with value: 0.06362387103793415.
2026-05-18 20:16:47,598 - experiment_functions - INFO - Early stopping at epoch 950. Best Recall: 0.0589
2026-05-18 20:16:47,689 - optuna.study.study - INFO - Trial 188 finished with value: 0.05888496310546992 and parameters: {'n_layers': 1, 'embedding_dim': 32, 'lr': 0.0005342131241451804, 'lambda_val': 2.4506819166763695e-06, 'batch_size': 810, 'optimizer': 'Adam'}. Best is trial 182 with value: 0.06362387103793415.
2026-05-18 20:16:58,017 - experiment_functions - INFO - Early stopping at epoch 650. Best Recall: 0.0588
2026-05-18 20:16:58,107 - optuna.study.study - INFO - Trial 189 finished with value: 0.05877624502333246 and parameters: {'n_layers': 1, 'embedding_dim': 32, 'lr': 0.0017621235286896988, 'lambda_val': 0.00021096552932795318, 'batch_size': 512, 'optimizer': 'Adam'}. Best is trial 182 with value: 0.06362387103793415.
2026-05-18 20:17:11,540 - experiment_functions - INFO - Early stopping at epoch 750. Best Recall: 0.0597
2026-05-18 20:17:12,342 - optuna.study.study - INFO - Trial 190 finished with value: 0.059652849379088595 and parameters: {'n_layers': 1, 'embedding_dim': 32, 'lr': 0.0010509059370032718, 'lambda_val': 5.036668787403623e-06, 'batch_size': 639, 'optimizer': 'Adam'}. Best is trial 182 with value: 0.06362387103793415.
2026-05-18 20:17:31,917 - experiment_functions - INFO - Early stopping at epoch 900. Best Recall: 0.0631
2026-05-18 20:17:32,019 - optuna.study.study - INFO - Trial 191 finished with value: 0.06312432781646211 and parameters: {'n_layers': 1, 'embedding_dim': 32, 'lr': 0.0006887963569414937, 'lambda_val': 1.7650714262883818e-06, 'batch_size': 745, 'optimizer': 'Adam'}. Best is trial 182 with value: 0.06362387103793415.
2026-05-18 20:17:46,351 - experiment_functions - INFO - Early stopping at epoch 850. Best Recall: 0.0564
2026-05-18 20:17:46,432 - optuna.study.study - INFO - Trial 192 finished with value: 0.0563794308740722 and parameters: {'n_layers': 1, 'embedding_dim': 32, 'lr': 0.000716084324874824, 'lambda_val': 2.0299425713120408e-06, 'batch_size': 755, 'optimizer': 'Adam'}. Best is trial 182 with value: 0.06362387103793415.
2026-05-18 20:18:02,266 - experiment_functions - INFO - Early stopping at epoch 1200. Best Recall: 0.0592
