2026-05-19 03:20:52,913 - optuna.study._optimize - INFO - Trial 299 pruned. 
2026-05-19 03:21:15,553 - experiment_functions - INFO - Early stopping at epoch 1950. Best Recall: 0.0641
2026-05-19 03:21:16,458 - root - INFO -   **** Training e_1M_1c3dcs_rand4
2026-05-19 03:21:16,520 - root - INFO -   **** Getting 221091/805443 random edges
2026-05-19 03:21:16,718 - optuna.storages._rdb.storage - INFO - A new study created in RDB with name: Study_e_1M_1c3dcs_rand4
2026-05-19 03:21:24,190 - experiment_functions - INFO - Early stopping at epoch 500. Best Recall: 0.0044
2026-05-19 03:21:24,281 - optuna.study.study - INFO - Trial 0 finished with value: 0.004412751132334127 and parameters: {'n_layers': 4, 'embedding_dim': 32, 'lr': 1.0951701395702429e-05, 'lambda_val': 0.0002233863168841401, 'batch_size': 3307, 'optimizer': 'SGD'}. Best is trial 0 with value: 0.004412751132334127.
2026-05-19 03:21:31,695 - experiment_functions - INFO - Early stopping at epoch 500. Best Recall: 0.0044
2026-05-19 03:21:31,789 - optuna.study.study - INFO - Trial 1 finished with value: 0.004351530235602422 and parameters: {'n_layers': 1, 'embedding_dim': 64, 'lr': 1.8740764141054598e-05, 'lambda_val': 0.015254476647120818, 'batch_size': 1308, 'optimizer': 'RMSprop'}. Best is trial 0 with value: 0.004412751132334127.
2026-05-19 03:21:47,095 - experiment_functions - INFO - Early stopping at epoch 650. Best Recall: 0.0272
2026-05-19 03:21:47,201 - optuna.study.study - INFO - Trial 2 finished with value: 0.027216489204140874 and parameters: {'n_layers': 4, 'embedding_dim': 256, 'lr': 0.015450355756930588, 'lambda_val': 1.37999693679273e-06, 'batch_size': 3404, 'optimizer': 'RMSprop'}. Best is trial 2 with value: 0.027216489204140874.
2026-05-19 03:21:55,859 - experiment_functions - INFO - Early stopping at epoch 550. Best Recall: 0.0289
2026-05-19 03:21:55,996 - optuna.study.study - INFO - Trial 3 finished with value: 0.02892799766816291 and parameters: {'n_layers': 2, 'embedding_dim': 32, 'lr': 0.0012668028063841394, 'lambda_val': 0.0702108195500434, 'batch_size': 3208, 'optimizer': 'RMSprop'}. Best is trial 3 with value: 0.02892799766816291.
2026-05-19 03:23:22,559 - optuna.study.study - INFO - Trial 4 finished with value: 0.008305624206206749 and parameters: {'n_layers': 4, 'embedding_dim': 256, 'lr': 2.4182501100924372e-05, 'lambda_val': 1.0450784270266914e-06, 'batch_size': 3113, 'optimizer': 'RMSprop'}. Best is trial 3 with value: 0.02892799766816291.
2026-05-19 03:23:30,754 - experiment_functions - INFO - Early stopping at epoch 600. Best Recall: 0.0053
2026-05-19 03:23:30,855 - optuna.study.study - INFO - Trial 5 finished with value: 0.005316047369095017 and parameters: {'n_layers': 1, 'embedding_dim': 64, 'lr': 1.570752730638863e-05, 'lambda_val': 0.010409373827912578, 'batch_size': 1503, 'optimizer': 'Adam'}. Best is trial 3 with value: 0.02892799766816291.
2026-05-19 03:23:38,476 - experiment_functions - INFO - Early stopping at epoch 500. Best Recall: 0.0053
2026-05-19 03:23:38,576 - optuna.study.study - INFO - Trial 6 finished with value: 0.005271485911469737 and parameters: {'n_layers': 2, 'embedding_dim': 128, 'lr': 0.02139211078297375, 'lambda_val': 0.0050116114389581485, 'batch_size': 1211, 'optimizer': 'SGD'}. Best is trial 3 with value: 0.02892799766816291.
2026-05-19 03:23:46,520 - experiment_functions - INFO - Early stopping at epoch 500. Best Recall: 0.0047
2026-05-19 03:23:46,620 - optuna.study.study - INFO - Trial 7 finished with value: 0.004696038828848948 and parameters: {'n_layers': 4, 'embedding_dim': 64, 'lr': 0.011260661620424328, 'lambda_val': 0.06931270215382525, 'batch_size': 3423, 'optimizer': 'SGD'}. Best is trial 3 with value: 0.02892799766816291.
2026-05-19 03:24:00,944 - experiment_functions - INFO - Early stopping at epoch 500. Best Recall: 0.0054
2026-05-19 03:24:01,719 - optuna.study.study - INFO - Trial 8 finished with value: 0.005359782281652739 and parameters: {'n_layers': 4, 'embedding_dim': 256, 'lr': 0.04233356400039033, 'lambda_val': 0.0029520409907096866, 'batch_size': 4075, 'optimizer': 'SGD'}. Best is trial 3 with value: 0.02892799766816291.
2026-05-19 03:24:16,786 - experiment_functions - INFO - Early stopping at epoch 800. Best Recall: 0.0098
2026-05-19 03:24:17,394 - optuna.study.study - INFO - Trial 9 finished with value: 0.009755680678474338 and parameters: {'n_layers': 3, 'embedding_dim': 128, 'lr': 0.0035360460631203468, 'lambda_val': 0.08104484502747819, 'batch_size': 3724, 'optimizer': 'RMSprop'}. Best is trial 3 with value: 0.02892799766816291.
2026-05-19 03:25:23,767 - optuna.study.study - INFO - Trial 10 finished with value: 0.053833119977124845 and parameters: {'n_layers': 2, 'embedding_dim': 32, 'lr': 0.0002497746093771336, 'lambda_val': 0.00017337852577364168, 'batch_size': 2314, 'optimizer': 'Adam'}. Best is trial 10 with value: 0.053833119977124845.
2026-05-19 03:25:39,419 - experiment_functions - INFO - Early stopping at epoch 1100. Best Recall: 0.0439
2026-05-19 03:25:39,528 - optuna.study.study - INFO - Trial 11 finished with value: 0.04393436885415083 and parameters: {'n_layers': 2, 'embedding_dim': 32, 'lr': 0.00045245520950281645, 'lambda_val': 7.609198576229586e-05, 'batch_size': 2393, 'optimizer': 'Adam'}. Best is trial 10 with value: 0.053833119977124845.
2026-05-19 03:25:53,559 - optuna.study._optimize - INFO - Trial 12 pruned. 
2026-05-19 03:26:51,220 - optuna.study.study - INFO - Trial 13 finished with value: 0.046664095933326974 and parameters: {'n_layers': 3, 'embedding_dim': 32, 'lr': 0.00020838973122023292, 'lambda_val': 2.5262308176375156e-05, 'batch_size': 2348, 'optimizer': 'Adam'}. Best is trial 10 with value: 0.053833119977124845.
2026-05-19 03:27:05,379 - optuna.study._optimize - INFO - Trial 14 pruned. 
2026-05-19 03:27:20,175 - optuna.study._optimize - INFO - Trial 15 pruned. 
2026-05-19 03:27:31,719 - experiment_functions - INFO - Early stopping at epoch 750. Best Recall: 0.0364
2026-05-19 03:27:31,808 - optuna.study.study - INFO - Trial 16 finished with value: 0.03642217999291436 and parameters: {'n_layers': 3, 'embedding_dim': 96, 'lr': 0.0005578493119142298, 'lambda_val': 7.981918855493124e-06, 'batch_size': 2683, 'optimizer': 'Adam'}. Best is trial 10 with value: 0.053833119977124845.
2026-05-19 03:27:44,514 - experiment_functions - INFO - Early stopping at epoch 850. Best Recall: 0.0691
2026-05-19 03:27:44,604 - optuna.study.study - INFO - Trial 17 finished with value: 0.06908189211754309 and parameters: {'n_layers': 1, 'embedding_dim': 32, 'lr': 0.0021420294337599964, 'lambda_val': 0.00032748473804441357, 'batch_size': 758, 'optimizer': 'Adam'}. Best is trial 17 with value: 0.06908189211754309.
2026-05-19 03:27:55,335 - experiment_functions - INFO - Early stopping at epoch 750. Best Recall: 0.0597
2026-05-19 03:27:55,433 - optuna.study.study - INFO - Trial 18 finished with value: 0.059678737026570186 and parameters: {'n_layers': 1, 'embedding_dim': 32, 'lr': 0.0029926894271312997, 'lambda_val': 0.0008760136857014012, 'batch_size': 553, 'optimizer': 'Adam'}. Best is trial 17 with value: 0.06908189211754309.
2026-05-19 03:28:07,424 - experiment_functions - INFO - Early stopping at epoch 650. Best Recall: 0.0694
2026-05-19 03:28:07,526 - optuna.study.study - INFO - Trial 19 finished with value: 0.06939808527798064 and parameters: {'n_layers': 1, 'embedding_dim': 32, 'lr': 0.004063828411593592, 'lambda_val': 0.0008635223059759241, 'batch_size': 583, 'optimizer': 'Adam'}. Best is trial 19 with value: 0.06939808527798064.
2026-05-19 03:28:17,713 - experiment_functions - INFO - Early stopping at epoch 600. Best Recall: 0.0094
2026-05-19 03:28:17,804 - optuna.study.study - INFO - Trial 20 finished with value: 0.009442990490464693 and parameters: {'n_layers': 1, 'embedding_dim': 96, 'lr': 0.09754961001573811, 'lambda_val': 0.0008671922488898026, 'batch_size': 596, 'optimizer': 'Adam'}. Best is trial 19 with value: 0.06939808527798064.
2026-05-19 03:28:28,308 - experiment_functions - INFO - Early stopping at epoch 750. Best Recall: 0.0624
2026-05-19 03:28:28,407 - optuna.study.study - INFO - Trial 21 finished with value: 0.06238324730192075 and parameters: {'n_layers': 1, 'embedding_dim': 32, 'lr': 0.00333638213529355, 'lambda_val': 0.0013896925887602301, 'batch_size': 612, 'optimizer': 'Adam'}. Best is trial 19 with value: 0.06939808527798064.
2026-05-19 03:28:37,820 - experiment_functions - INFO - Early stopping at epoch 650. Best Recall: 0.0559
2026-05-19 03:28:37,921 - optuna.study.study - INFO - Trial 22 finished with value: 0.05586941948666973 and parameters: {'n_layers': 1, 'embedding_dim': 32, 'lr': 0.004384809765817947, 'lambda_val': 0.0015737526438401401, 'batch_size': 928, 'optimizer': 'Adam'}. Best is trial 19 with value: 0.06939808527798064.
2026-05-19 03:28:50,319 - experiment_functions - INFO - Early stopping at epoch 850. Best Recall: 0.0645
2026-05-19 03:28:50,420 - optuna.study.study - INFO - Trial 23 finished with value: 0.06447095479439441 and parameters: {'n_layers': 1, 'embedding_dim': 32, 'lr': 0.0016942140968209318, 'lambda_val': 0.00039723402053730146, 'batch_size': 924, 'optimizer': 'Adam'}. Best is trial 19 with value: 0.06939808527798064.
2026-05-19 03:29:02,916 - experiment_functions - INFO - Early stopping at epoch 850. Best Recall: 0.0606
2026-05-19 03:29:03,003 - optuna.study.study - INFO - Trial 24 finished with value: 0.06057620134611575 and parameters: {'n_layers': 1, 'embedding_dim': 128, 'lr': 0.0013962602630761044, 'lambda_val': 0.0003946144691400669, 'batch_size': 1007, 'optimizer': 'Adam'}. Best is trial 19 with value: 0.06939808527798064.
2026-05-19 03:29:11,857 - experiment_functions - INFO - Early stopping at epoch 600. Best Recall: 0.0537
2026-05-19 03:29:11,947 - optuna.study.study - INFO - Trial 25 finished with value: 0.05368725955336674 and parameters: {'n_layers': 1, 'embedding_dim': 32, 'lr': 0.0076854586223029046, 'lambda_val': 0.00012342410220320457, 'batch_size': 1651, 'optimizer': 'Adam'}. Best is trial 19 with value: 0.06939808527798064.
2026-05-19 03:29:22,456 - experiment_functions - INFO - Early stopping at epoch 700. Best Recall: 0.0594
2026-05-19 03:29:22,546 - optuna.study.study - INFO - Trial 26 finished with value: 0.05942913340034822 and parameters: {'n_layers': 2, 'embedding_dim': 32, 'lr': 0.0016870013233540302, 'lambda_val': 0.00043541784585951325, 'batch_size': 870, 'optimizer': 'Adam'}. Best is trial 19 with value: 0.06939808527798064.
2026-05-19 03:29:31,050 - experiment_functions - INFO - Early stopping at epoch 600. Best Recall: 0.0640
2026-05-19 03:29:31,139 - optuna.study.study - INFO - Trial 27 finished with value: 0.06404990716573368 and parameters: {'n_layers': 1, 'embedding_dim': 32, 'lr': 0.006140286554231178, 'lambda_val': 3.816798872955504e-05, 'batch_size': 1205, 'optimizer': 'Adam'}. Best is trial 19 with value: 0.06939808527798064.
2026-05-19 03:29:38,712 - experiment_functions - INFO - Early stopping at epoch 500. Best Recall: 0.0048
2026-05-19 03:29:38,859 - optuna.study.study - INFO - Trial 28 finished with value: 0.004834378284779988 and parameters: {'n_layers': 1, 'embedding_dim': 32, 'lr': 0.0006263777623765525, 'lambda_val': 0.00376127666555833, 'batch_size': 852, 'optimizer': 'SGD'}. Best is trial 19 with value: 0.06939808527798064.
2026-05-19 03:29:47,581 - experiment_functions - INFO - Early stopping at epoch 600. Best Recall: 0.0420
2026-05-19 03:29:47,716 - optuna.study.study - INFO - Trial 29 finished with value: 0.04200989217100368 and parameters: {'n_layers': 2, 'embedding_dim': 32, 'lr': 0.0021546537057968757, 'lambda_val': 0.0003439432396758706, 'batch_size': 1887, 'optimizer': 'Adam'}. Best is trial 19 with value: 0.06939808527798064.
2026-05-19 03:29:57,554 - experiment_functions - INFO - Early stopping at epoch 500. Best Recall: 0.0057
2026-05-19 03:29:57,654 - optuna.study.study - INFO - Trial 30 finished with value: 0.0056761140396276695 and parameters: {'n_layers': 1, 'embedding_dim': 128, 'lr': 0.0008750193202402305, 'lambda_val': 0.00019098283260298528, 'batch_size': 1401, 'optimizer': 'SGD'}. Best is trial 19 with value: 0.06939808527798064.
2026-05-19 03:30:06,441 - experiment_functions - INFO - Early stopping at epoch 600. Best Recall: 0.0657
2026-05-19 03:30:06,539 - optuna.study.study - INFO - Trial 31 finished with value: 0.06568803634863817 and parameters: {'n_layers': 1, 'embedding_dim': 32, 'lr': 0.006599768380595671, 'lambda_val': 7.040204495303764e-05, 'batch_size': 1143, 'optimizer': 'Adam'}. Best is trial 19 with value: 0.06939808527798064.
2026-05-19 03:30:14,630 - experiment_functions - INFO - Early stopping at epoch 550. Best Recall: 0.0188
2026-05-19 03:30:14,720 - optuna.study.study - INFO - Trial 32 finished with value: 0.018773796678300824 and parameters: {'n_layers': 1, 'embedding_dim': 32, 'lr': 0.03347370268435243, 'lambda_val': 9.028136343488173e-05, 'batch_size': 1075, 'optimizer': 'Adam'}. Best is trial 19 with value: 0.06939808527798064.
2026-05-19 03:30:23,467 - experiment_functions - INFO - Early stopping at epoch 600. Best Recall: 0.0554
2026-05-19 03:30:23,602 - optuna.study.study - INFO - Trial 33 finished with value: 0.05541155654062826 and parameters: {'n_layers': 1, 'embedding_dim': 64, 'lr': 0.00766897429693943, 'lambda_val': 4.156827117252995e-06, 'batch_size': 767, 'optimizer': 'Adam'}. Best is trial 19 with value: 0.06939808527798064.
2026-05-19 03:30:44,729 - experiment_functions - INFO - Early stopping at epoch 950. Best Recall: 0.0192
2026-05-19 03:30:45,504 - optuna.study.study - INFO - Trial 34 finished with value: 0.019202567865970056 and parameters: {'n_layers': 1, 'embedding_dim': 256, 'lr': 0.012722440766424141, 'lambda_val': 2.2990986018003068e-05, 'batch_size': 1091, 'optimizer': 'RMSprop'}. Best is trial 19 with value: 0.06939808527798064.
2026-05-19 03:30:58,040 - experiment_functions - INFO - Early stopping at epoch 650. Best Recall: 0.0597
2026-05-19 03:30:58,138 - optuna.study.study - INFO - Trial 35 finished with value: 0.05969520952931551 and parameters: {'n_layers': 2, 'embedding_dim': 32, 'lr': 0.002327425113287704, 'lambda_val': 0.0002534997837940502, 'batch_size': 725, 'optimizer': 'Adam'}. Best is trial 19 with value: 0.06939808527798064.
2026-05-19 03:31:05,286 - experiment_functions - INFO - Early stopping at epoch 500. Best Recall: 0.0060
2026-05-19 03:31:05,385 - optuna.study.study - INFO - Trial 36 finished with value: 0.005986829908379633 and parameters: {'n_layers': 1, 'embedding_dim': 32, 'lr': 5.515962605620742e-05, 'lambda_val': 0.0005783020805892973, 'batch_size': 1469, 'optimizer': 'RMSprop'}. Best is trial 19 with value: 0.06939808527798064.
2026-05-19 03:31:30,088 - experiment_functions - INFO - Early stopping at epoch 950. Best Recall: 0.0615
2026-05-19 03:31:30,861 - optuna.study.study - INFO - Trial 37 finished with value: 0.0615377189455316 and parameters: {'n_layers': 1, 'embedding_dim': 64, 'lr': 0.0009405165029951926, 'lambda_val': 0.014870565921330563, 'batch_size': 1297, 'optimizer': 'Adam'}. Best is trial 19 with value: 0.06939808527798064.
2026-05-19 03:31:41,737 - experiment_functions - INFO - Early stopping at epoch 550. Best Recall: 0.0291
2026-05-19 03:31:41,871 - optuna.study.study - INFO - Trial 38 finished with value: 0.02905151979127325 and parameters: {'n_layers': 2, 'embedding_dim': 256, 'lr': 0.00540196906969916, 'lambda_val': 0.007440477791875503, 'batch_size': 529, 'optimizer': 'Adam'}. Best is trial 19 with value: 0.06939808527798064.
2026-05-19 03:31:55,119 - optuna.study._optimize - INFO - Trial 39 pruned. 
2026-05-19 03:32:02,594 - experiment_functions - INFO - Early stopping at epoch 500. Best Recall: 0.0059
2026-05-19 03:32:02,694 - optuna.study.study - INFO - Trial 40 finished with value: 0.005861599373929177 and parameters: {'n_layers': 2, 'embedding_dim': 96, 'lr': 0.028306964156583164, 'lambda_val': 0.00011948761277394, 'batch_size': 1148, 'optimizer': 'SGD'}. Best is trial 19 with value: 0.06939808527798064.
2026-05-19 03:32:11,851 - experiment_functions - INFO - Early stopping at epoch 600. Best Recall: 0.0594
2026-05-19 03:32:11,953 - optuna.study.study - INFO - Trial 41 finished with value: 0.059359052727578514 and parameters: {'n_layers': 1, 'embedding_dim': 32, 'lr': 0.006940839001408296, 'lambda_val': 3.1834316971738984e-05, 'batch_size': 1208, 'optimizer': 'Adam'}. Best is trial 19 with value: 0.06939808527798064.
2026-05-19 03:32:20,338 - experiment_functions - INFO - Early stopping at epoch 600. Best Recall: 0.0598
2026-05-19 03:32:20,428 - optuna.study.study - INFO - Trial 42 finished with value: 0.05975170844092441 and parameters: {'n_layers': 1, 'embedding_dim': 32, 'lr': 0.008807358473268674, 'lambda_val': 4.864574746205206e-05, 'batch_size': 742, 'optimizer': 'Adam'}. Best is trial 19 with value: 0.06939808527798064.
2026-05-19 03:32:29,884 - experiment_functions - INFO - Early stopping at epoch 650. Best Recall: 0.0636
2026-05-19 03:32:30,005 - optuna.study.study - INFO - Trial 43 finished with value: 0.06355993579786001 and parameters: {'n_layers': 1, 'embedding_dim': 32, 'lr': 0.00437692509120551, 'lambda_val': 1.4070010118733863e-05, 'batch_size': 1024, 'optimizer': 'Adam'}. Best is trial 19 with value: 0.06939808527798064.
2026-05-19 03:32:40,196 - experiment_functions - INFO - Early stopping at epoch 700. Best Recall: 0.0551
2026-05-19 03:32:40,295 - optuna.study.study - INFO - Trial 44 finished with value: 0.055127529049788355 and parameters: {'n_layers': 1, 'embedding_dim': 32, 'lr': 0.002253337348377886, 'lambda_val': 3.822690780415851e-06, 'batch_size': 1371, 'optimizer': 'Adam'}. Best is trial 19 with value: 0.06939808527798064.
2026-05-19 03:32:55,727 - experiment_functions - INFO - Early stopping at epoch 1050. Best Recall: 0.0682
2026-05-19 03:32:55,879 - optuna.study.study - INFO - Trial 45 finished with value: 0.06816747353558426 and parameters: {'n_layers': 1, 'embedding_dim': 32, 'lr': 0.0012853913884928124, 'lambda_val': 4.8795320357139053e-05, 'batch_size': 910, 'optimizer': 'Adam'}. Best is trial 19 with value: 0.06939808527798064.
2026-05-19 03:33:11,239 - optuna.study._optimize - INFO - Trial 46 pruned. 
2026-05-19 03:33:20,427 - experiment_functions - INFO - Early stopping at epoch 550. Best Recall: 0.0163
2026-05-19 03:33:20,516 - optuna.study.study - INFO - Trial 47 finished with value: 0.016250964281476123 and parameters: {'n_layers': 2, 'embedding_dim': 256, 'lr': 0.0015200617484060863, 'lambda_val': 0.029537474610880805, 'batch_size': 955, 'optimizer': 'RMSprop'}. Best is trial 19 with value: 0.06939808527798064.
2026-05-19 03:33:27,548 - experiment_functions - INFO - Early stopping at epoch 500. Best Recall: 0.0057
2026-05-19 03:33:27,639 - optuna.study.study - INFO - Trial 48 finished with value: 0.0056646060567197105 and parameters: {'n_layers': 1, 'embedding_dim': 128, 'lr': 0.0006700163226569801, 'lambda_val': 6.928091631676646e-05, 'batch_size': 860, 'optimizer': 'SGD'}. Best is trial 19 with value: 0.06939808527798064.
2026-05-19 03:33:41,583 - experiment_functions - INFO - Early stopping at epoch 850. Best Recall: 0.0283
2026-05-19 03:33:41,704 - optuna.study.study - INFO - Trial 49 finished with value: 0.028322569855363983 and parameters: {'n_layers': 4, 'embedding_dim': 32, 'lr': 0.00039288570642710875, 'lambda_val': 0.002013944670922974, 'batch_size': 2651, 'optimizer': 'Adam'}. Best is trial 19 with value: 0.06939808527798064.
2026-05-19 03:33:52,484 - experiment_functions - INFO - Early stopping at epoch 750. Best Recall: 0.0521
2026-05-19 03:33:52,575 - optuna.study.study - INFO - Trial 50 finished with value: 0.05207090947910163 and parameters: {'n_layers': 2, 'embedding_dim': 32, 'lr': 0.0010878503150777133, 'lambda_val': 0.0006048798383681816, 'batch_size': 1733, 'optimizer': 'Adam'}. Best is trial 19 with value: 0.06939808527798064.
2026-05-19 03:34:01,177 - experiment_functions - INFO - Early stopping at epoch 600. Best Recall: 0.0592
2026-05-19 03:34:01,269 - optuna.study.study - INFO - Trial 51 finished with value: 0.05921122738397 and parameters: {'n_layers': 1, 'embedding_dim': 32, 'lr': 0.005555666789932509, 'lambda_val': 3.457446960376264e-05, 'batch_size': 1271, 'optimizer': 'Adam'}. Best is trial 19 with value: 0.06939808527798064.
2026-05-19 03:34:11,540 - experiment_functions - INFO - Early stopping at epoch 700. Best Recall: 0.0608
2026-05-19 03:34:11,640 - optuna.study.study - INFO - Trial 52 finished with value: 0.060847125653106474 and parameters: {'n_layers': 1, 'embedding_dim': 32, 'lr': 0.0027603250123084616, 'lambda_val': 0.0001390527553587827, 'batch_size': 2026, 'optimizer': 'Adam'}. Best is trial 19 with value: 0.06939808527798064.
2026-05-19 03:34:20,412 - experiment_functions - INFO - Early stopping at epoch 550. Best Recall: 0.0581
2026-05-19 03:34:20,511 - optuna.study.study - INFO - Trial 53 finished with value: 0.05806151243819251 and parameters: {'n_layers': 1, 'embedding_dim': 32, 'lr': 0.01025460678384205, 'lambda_val': 1.7063033449742195e-05, 'batch_size': 1522, 'optimizer': 'Adam'}. Best is trial 19 with value: 0.06939808527798064.
2026-05-19 03:34:31,944 - experiment_functions - INFO - Early stopping at epoch 550. Best Recall: 0.0552
2026-05-19 03:34:32,131 - optuna.study.study - INFO - Trial 54 finished with value: 0.05522107065844325 and parameters: {'n_layers': 1, 'embedding_dim': 32, 'lr': 0.016946574748989342, 'lambda_val': 6.948170681774046e-06, 'batch_size': 616, 'optimizer': 'Adam'}. Best is trial 19 with value: 0.06939808527798064.
2026-05-19 03:34:41,855 - experiment_functions - INFO - Early stopping at epoch 650. Best Recall: 0.0590
