2026-05-19 02:28:26,076 - optuna.study.study - INFO - Trial 125 finished with value: 0.0672053071094369 and parameters: {'n_layers': 1, 'embedding_dim': 64, 'lr': 0.0008938740309137258, 'lambda_val': 1.6503723911462077e-05, 'batch_size': 598, 'optimizer': 'Adam'}. Best is trial 88 with value: 0.07101789822319082.
2026-05-19 02:29:00,042 - optuna.study._optimize - INFO - Trial 126 pruned. 
2026-05-19 02:29:35,010 - optuna.study._optimize - INFO - Trial 127 pruned. 
2026-05-19 02:29:50,405 - optuna.study._optimize - INFO - Trial 128 pruned. 
2026-05-19 02:30:08,823 - experiment_functions - INFO - Early stopping at epoch 950. Best Recall: 0.0632
2026-05-19 02:30:08,916 - optuna.study.study - INFO - Trial 129 finished with value: 0.0632192762283921 and parameters: {'n_layers': 1, 'embedding_dim': 64, 'lr': 0.0014436280007485366, 'lambda_val': 5.198410007866488e-06, 'batch_size': 830, 'optimizer': 'Adam'}. Best is trial 88 with value: 0.07101789822319082.
2026-05-19 02:30:40,423 - experiment_functions - INFO - Early stopping at epoch 1500. Best Recall: 0.0666
2026-05-19 02:30:42,467 - optuna.study.study - INFO - Trial 130 finished with value: 0.06660806656494701 and parameters: {'n_layers': 1, 'embedding_dim': 64, 'lr': 0.0008878224382472266, 'lambda_val': 1.4285171952768748e-05, 'batch_size': 652, 'optimizer': 'Adam'}. Best is trial 88 with value: 0.07101789822319082.
2026-05-19 02:31:09,136 - optuna.study._optimize - INFO - Trial 131 pruned. 
2026-05-19 02:31:26,249 - experiment_functions - INFO - Early stopping at epoch 1250. Best Recall: 0.0664
2026-05-19 02:31:26,341 - optuna.study.study - INFO - Trial 132 finished with value: 0.06638865674115849 and parameters: {'n_layers': 1, 'embedding_dim': 64, 'lr': 0.0010099306794723731, 'lambda_val': 3.743448772774011e-05, 'batch_size': 744, 'optimizer': 'Adam'}. Best is trial 88 with value: 0.07101789822319082.
2026-05-19 02:31:39,724 - optuna.study._optimize - INFO - Trial 133 pruned. 
2026-05-19 02:32:12,882 - experiment_functions - INFO - Early stopping at epoch 1400. Best Recall: 0.0653
2026-05-19 02:32:12,984 - optuna.study.study - INFO - Trial 134 finished with value: 0.06534456738695406 and parameters: {'n_layers': 1, 'embedding_dim': 64, 'lr': 0.0009215500999436294, 'lambda_val': 3.938954200345414e-05, 'batch_size': 776, 'optimizer': 'Adam'}. Best is trial 88 with value: 0.07101789822319082.
2026-05-19 02:32:27,093 - optuna.study._optimize - INFO - Trial 135 pruned. 
2026-05-19 02:32:40,692 - experiment_functions - INFO - Early stopping at epoch 850. Best Recall: 0.0616
2026-05-19 02:32:40,793 - optuna.study.study - INFO - Trial 136 finished with value: 0.06155843282648973 and parameters: {'n_layers': 1, 'embedding_dim': 64, 'lr': 0.0013689932334001655, 'lambda_val': 1.3127184113294732e-05, 'batch_size': 521, 'optimizer': 'RMSprop'}. Best is trial 88 with value: 0.07101789822319082.
2026-05-19 02:32:56,247 - optuna.study._optimize - INFO - Trial 137 pruned. 
2026-05-19 02:33:05,514 - experiment_functions - INFO - Early stopping at epoch 500. Best Recall: 0.0051
2026-05-19 02:33:05,605 - optuna.study.study - INFO - Trial 138 finished with value: 0.005144651584350585 and parameters: {'n_layers': 1, 'embedding_dim': 64, 'lr': 0.0010742236024266622, 'lambda_val': 2.685172466602637e-05, 'batch_size': 668, 'optimizer': 'SGD'}. Best is trial 88 with value: 0.07101789822319082.
2026-05-19 02:33:37,587 - optuna.study._optimize - INFO - Trial 139 pruned. 
2026-05-19 02:34:16,312 - experiment_functions - INFO - Early stopping at epoch 2000. Best Recall: 0.0687
2026-05-19 02:34:16,412 - optuna.study.study - INFO - Trial 140 finished with value: 0.06865646724976841 and parameters: {'n_layers': 1, 'embedding_dim': 64, 'lr': 0.0008281607846350627, 'lambda_val': 4.448024674752588e-05, 'batch_size': 599, 'optimizer': 'Adam'}. Best is trial 88 with value: 0.07101789822319082.
2026-05-19 02:34:50,068 - experiment_functions - INFO - Early stopping at epoch 2200. Best Recall: 0.0710
2026-05-19 02:34:50,174 - optuna.study.study - INFO - Trial 141 finished with value: 0.0710491585598664 and parameters: {'n_layers': 1, 'embedding_dim': 64, 'lr': 0.0008143978511415358, 'lambda_val': 5.1333263405407225e-05, 'batch_size': 601, 'optimizer': 'Adam'}. Best is trial 141 with value: 0.0710491585598664.
2026-05-19 02:35:05,504 - optuna.study._optimize - INFO - Trial 142 pruned. 
2026-05-19 02:35:24,758 - experiment_functions - INFO - Early stopping at epoch 1300. Best Recall: 0.0692
2026-05-19 02:35:25,524 - optuna.study.study - INFO - Trial 143 finished with value: 0.06917104039507384 and parameters: {'n_layers': 1, 'embedding_dim': 64, 'lr': 0.0012437844068295108, 'lambda_val': 3.482181240489293e-05, 'batch_size': 520, 'optimizer': 'Adam'}. Best is trial 141 with value: 0.0710491585598664.
2026-05-19 02:35:46,860 - optuna.study._optimize - INFO - Trial 144 pruned. 
2026-05-19 02:36:04,265 - experiment_functions - INFO - Early stopping at epoch 1000. Best Recall: 0.0649
2026-05-19 02:36:04,361 - optuna.study.study - INFO - Trial 145 finished with value: 0.06494256271554887 and parameters: {'n_layers': 1, 'embedding_dim': 64, 'lr': 0.0015577759610790785, 'lambda_val': 1.0115481871190872e-05, 'batch_size': 642, 'optimizer': 'Adam'}. Best is trial 141 with value: 0.0710491585598664.
2026-05-19 02:36:17,740 - optuna.study._optimize - INFO - Trial 146 pruned. 
2026-05-19 02:36:33,851 - optuna.study._optimize - INFO - Trial 147 pruned. 
2026-05-19 02:36:52,627 - optuna.study._optimize - INFO - Trial 148 pruned. 
2026-05-19 02:37:05,990 - optuna.study._optimize - INFO - Trial 149 pruned. 
2026-05-19 02:37:19,792 - optuna.study._optimize - INFO - Trial 150 pruned. 
2026-05-19 02:37:35,064 - optuna.study._optimize - INFO - Trial 151 pruned. 
2026-05-19 02:37:56,615 - optuna.study._optimize - INFO - Trial 152 pruned. 
2026-05-19 02:38:21,988 - experiment_functions - INFO - Early stopping at epoch 1200. Best Recall: 0.0670
2026-05-19 02:38:22,080 - optuna.study.study - INFO - Trial 153 finished with value: 0.06697138814686228 and parameters: {'n_layers': 1, 'embedding_dim': 64, 'lr': 0.0012985357500765165, 'lambda_val': 0.00011040335763240478, 'batch_size': 743, 'optimizer': 'Adam'}. Best is trial 141 with value: 0.0710491585598664.
2026-05-19 02:38:38,105 - experiment_functions - INFO - Early stopping at epoch 1000. Best Recall: 0.0700
2026-05-19 02:38:38,194 - optuna.study.study - INFO - Trial 154 finished with value: 0.06996884574091264 and parameters: {'n_layers': 1, 'embedding_dim': 64, 'lr': 0.0015860261825297408, 'lambda_val': 0.000119853514489225, 'batch_size': 575, 'optimizer': 'Adam'}. Best is trial 141 with value: 0.0710491585598664.
2026-05-19 02:38:50,611 - experiment_functions - INFO - Early stopping at epoch 900. Best Recall: 0.0674
2026-05-19 02:38:50,700 - optuna.study.study - INFO - Trial 155 finished with value: 0.06736708716008871 and parameters: {'n_layers': 1, 'embedding_dim': 64, 'lr': 0.0016405866302514236, 'lambda_val': 0.00011008448220589419, 'batch_size': 683, 'optimizer': 'Adam'}. Best is trial 141 with value: 0.0710491585598664.
2026-05-19 02:39:10,459 - experiment_functions - INFO - Early stopping at epoch 700. Best Recall: 0.0577
2026-05-19 02:39:10,728 - optuna.study.study - INFO - Trial 156 finished with value: 0.05773235196800186 and parameters: {'n_layers': 1, 'embedding_dim': 64, 'lr': 0.001652273488876189, 'lambda_val': 0.0001110043364018548, 'batch_size': 3209, 'optimizer': 'Adam'}. Best is trial 141 with value: 0.0710491585598664.
2026-05-19 02:39:22,279 - experiment_functions - INFO - Early stopping at epoch 700. Best Recall: 0.0544
2026-05-19 02:39:22,383 - optuna.study.study - INFO - Trial 157 finished with value: 0.05443490648443371 and parameters: {'n_layers': 1, 'embedding_dim': 256, 'lr': 0.0026123149920976485, 'lambda_val': 0.00012587942519465836, 'batch_size': 829, 'optimizer': 'Adam'}. Best is trial 141 with value: 0.0710491585598664.
2026-05-19 02:39:35,333 - experiment_functions - INFO - Early stopping at epoch 750. Best Recall: 0.0531
2026-05-19 02:39:35,436 - optuna.study.study - INFO - Trial 158 finished with value: 0.05305477080565552 and parameters: {'n_layers': 1, 'embedding_dim': 64, 'lr': 0.0013930296647563253, 'lambda_val': 9.923820686082475e-05, 'batch_size': 3700, 'optimizer': 'Adam'}. Best is trial 141 with value: 0.0710491585598664.
2026-05-19 02:39:47,419 - experiment_functions - INFO - Early stopping at epoch 800. Best Recall: 0.0621
2026-05-19 02:39:47,519 - optuna.study.study - INFO - Trial 159 finished with value: 0.06213893903920196 and parameters: {'n_layers': 1, 'embedding_dim': 64, 'lr': 0.002265892285921428, 'lambda_val': 0.00014153277620890985, 'batch_size': 578, 'optimizer': 'Adam'}. Best is trial 141 with value: 0.0710491585598664.
2026-05-19 02:40:01,197 - experiment_functions - INFO - Early stopping at epoch 800. Best Recall: 0.0616
2026-05-19 02:40:01,334 - optuna.study.study - INFO - Trial 160 finished with value: 0.0615978647108637 and parameters: {'n_layers': 1, 'embedding_dim': 64, 'lr': 0.0019154861726085068, 'lambda_val': 0.00029763535797072373, 'batch_size': 690, 'optimizer': 'Adam'}. Best is trial 141 with value: 0.0710491585598664.
2026-05-19 02:40:18,599 - experiment_functions - INFO - Early stopping at epoch 1050. Best Recall: 0.0669
2026-05-19 02:40:18,700 - optuna.study.study - INFO - Trial 161 finished with value: 0.06691543291201286 and parameters: {'n_layers': 1, 'embedding_dim': 64, 'lr': 0.0012261077114078273, 'lambda_val': 2.0922626265560065e-05, 'batch_size': 652, 'optimizer': 'Adam'}. Best is trial 141 with value: 0.0710491585598664.
2026-05-19 02:40:35,470 - experiment_functions - INFO - Early stopping at epoch 1150. Best Recall: 0.0686
2026-05-19 02:40:35,561 - optuna.study.study - INFO - Trial 162 finished with value: 0.06857907838070244 and parameters: {'n_layers': 1, 'embedding_dim': 64, 'lr': 0.0011703782022065511, 'lambda_val': 6.140512792276971e-05, 'batch_size': 764, 'optimizer': 'Adam'}. Best is trial 141 with value: 0.0710491585598664.
2026-05-19 02:40:50,110 - optuna.study._optimize - INFO - Trial 163 pruned. 
2026-05-19 02:41:04,915 - experiment_functions - INFO - Early stopping at epoch 1000. Best Recall: 0.0648
2026-05-19 02:41:05,006 - optuna.study.study - INFO - Trial 164 finished with value: 0.06481701731330825 and parameters: {'n_layers': 1, 'embedding_dim': 64, 'lr': 0.0015610849779422345, 'lambda_val': 4.787498091264448e-05, 'batch_size': 579, 'optimizer': 'Adam'}. Best is trial 141 with value: 0.0710491585598664.
2026-05-19 02:41:23,229 - experiment_functions - INFO - Early stopping at epoch 1250. Best Recall: 0.0691
2026-05-19 02:41:23,329 - optuna.study.study - INFO - Trial 165 finished with value: 0.0690606543742308 and parameters: {'n_layers': 1, 'embedding_dim': 64, 'lr': 0.0011686935002947932, 'lambda_val': 2.576413326349389e-05, 'batch_size': 663, 'optimizer': 'Adam'}. Best is trial 141 with value: 0.0710491585598664.
2026-05-19 02:41:34,096 - experiment_functions - INFO - Early stopping at epoch 600. Best Recall: 0.0313
2026-05-19 02:41:34,187 - optuna.study.study - INFO - Trial 166 finished with value: 0.03125438403031161 and parameters: {'n_layers': 3, 'embedding_dim': 64, 'lr': 0.0011707920809623208, 'lambda_val': 5.75924086489434e-05, 'batch_size': 579, 'optimizer': 'RMSprop'}. Best is trial 141 with value: 0.0710491585598664.
2026-05-19 02:42:05,852 - experiment_functions - INFO - Early stopping at epoch 2200. Best Recall: 0.0686
2026-05-19 02:42:05,950 - optuna.study.study - INFO - Trial 167 finished with value: 0.06862871986186111 and parameters: {'n_layers': 1, 'embedding_dim': 64, 'lr': 0.0007537761854379743, 'lambda_val': 2.6170316776661856e-05, 'batch_size': 713, 'optimizer': 'Adam'}. Best is trial 141 with value: 0.0710491585598664.
2026-05-19 02:42:23,872 - experiment_functions - INFO - Early stopping at epoch 500. Best Recall: 0.0053
2026-05-19 02:42:24,637 - optuna.study.study - INFO - Trial 168 finished with value: 0.00533874669860928 and parameters: {'n_layers': 1, 'embedding_dim': 64, 'lr': 0.0006932145398571639, 'lambda_val': 3.0150102994866743e-05, 'batch_size': 685, 'optimizer': 'SGD'}. Best is trial 141 with value: 0.0710491585598664.
2026-05-19 02:42:48,445 - optuna.study._optimize - INFO - Trial 169 pruned. 
2026-05-19 02:43:01,026 - experiment_functions - INFO - Early stopping at epoch 850. Best Recall: 0.0639
2026-05-19 02:43:01,117 - optuna.study.study - INFO - Trial 170 finished with value: 0.06387488904183801 and parameters: {'n_layers': 1, 'embedding_dim': 64, 'lr': 0.0017232471351569442, 'lambda_val': 2.4116214652618462e-05, 'batch_size': 751, 'optimizer': 'Adam'}. Best is trial 141 with value: 0.0710491585598664.
2026-05-19 02:43:14,928 - optuna.study._optimize - INFO - Trial 171 pruned. 
2026-05-19 02:43:22,697 - experiment_functions - INFO - Early stopping at epoch 550. Best Recall: 0.0047
2026-05-19 02:43:22,766 - optuna.study.study - INFO - Trial 172 finished with value: 0.004722660416312044 and parameters: {'n_layers': 1, 'embedding_dim': 64, 'lr': 3.993351000983281e-05, 'lambda_val': 4.224476031495321e-05, 'batch_size': 883, 'optimizer': 'Adam'}. Best is trial 141 with value: 0.0710491585598664.
2026-05-19 02:43:37,622 - optuna.study._optimize - INFO - Trial 173 pruned. 
2026-05-19 02:43:59,418 - optuna.study._optimize - INFO - Trial 174 pruned. 
2026-05-19 02:44:19,586 - optuna.study._optimize - INFO - Trial 175 pruned. 
2026-05-19 02:44:27,190 - experiment_functions - INFO - Early stopping at epoch 500. Best Recall: 0.0050
2026-05-19 02:44:27,302 - optuna.study.study - INFO - Trial 176 finished with value: 0.005002053270304139 and parameters: {'n_layers': 1, 'embedding_dim': 64, 'lr': 1.0414472512587706e-05, 'lambda_val': 7.001300203048144e-05, 'batch_size': 601, 'optimizer': 'Adam'}. Best is trial 141 with value: 0.0710491585598664.
2026-05-19 02:44:42,166 - optuna.study._optimize - INFO - Trial 177 pruned. 
2026-05-19 02:45:07,745 - experiment_functions - INFO - Early stopping at epoch 1000. Best Recall: 0.0666
2026-05-19 02:45:07,887 - optuna.study.study - INFO - Trial 178 finished with value: 0.06661662393271629 and parameters: {'n_layers': 1, 'embedding_dim': 64, 'lr': 0.0014063328914944758, 'lambda_val': 1.6597633447622905e-05, 'batch_size': 830, 'optimizer': 'Adam'}. Best is trial 141 with value: 0.0710491585598664.
2026-05-19 02:45:19,899 - experiment_functions - INFO - Early stopping at epoch 650. Best Recall: 0.0566
2026-05-19 02:45:19,992 - optuna.study.study - INFO - Trial 179 finished with value: 0.05657039044783706 and parameters: {'n_layers': 1, 'embedding_dim': 128, 'lr': 0.0019988853873723206, 'lambda_val': 8.432585838011397e-05, 'batch_size': 2483, 'optimizer': 'Adam'}. Best is trial 141 with value: 0.0710491585598664.
2026-05-19 02:45:45,686 - experiment_functions - INFO - Early stopping at epoch 1750. Best Recall: 0.0684
2026-05-19 02:45:45,787 - optuna.study.study - INFO - Trial 180 finished with value: 0.0684282114701933 and parameters: {'n_layers': 1, 'embedding_dim': 64, 'lr': 0.0008143352180077353, 'lambda_val': 0.00014504558770474016, 'batch_size': 657, 'optimizer': 'Adam'}. Best is trial 141 with value: 0.0710491585598664.
2026-05-19 02:46:12,079 - experiment_functions - INFO - Early stopping at epoch 1700. Best Recall: 0.0727
2026-05-19 02:46:13,381 - optuna.study.study - INFO - Trial 181 finished with value: 0.07267092144390536 and parameters: {'n_layers': 1, 'embedding_dim': 64, 'lr': 0.0008610874482739758, 'lambda_val': 0.00011604964555520097, 'batch_size': 578, 'optimizer': 'Adam'}. Best is trial 181 with value: 0.07267092144390536.
2026-05-19 02:46:29,359 - optuna.study._optimize - INFO - Trial 182 pruned. 
2026-05-19 02:46:49,400 - optuna.study._optimize - INFO - Trial 183 pruned. 
2026-05-19 02:47:06,314 - optuna.study._optimize - INFO - Trial 184 pruned. 
2026-05-19 02:47:23,871 - experiment_functions - INFO - Early stopping at epoch 1200. Best Recall: 0.0654
2026-05-19 02:47:23,963 - optuna.study.study - INFO - Trial 185 finished with value: 0.06536870270985266 and parameters: {'n_layers': 1, 'embedding_dim': 64, 'lr': 0.001214103699734733, 'lambda_val': 6.0810148339693714e-05, 'batch_size': 661, 'optimizer': 'Adam'}. Best is trial 181 with value: 0.07267092144390536.
2026-05-19 02:47:44,972 - optuna.study._optimize - INFO - Trial 186 pruned. 
2026-05-19 02:47:59,343 - optuna.study._optimize - INFO - Trial 187 pruned. 
2026-05-19 02:48:24,294 - experiment_functions - INFO - Early stopping at epoch 1000. Best Recall: 0.0643
2026-05-19 02:48:24,384 - optuna.study.study - INFO - Trial 188 finished with value: 0.06428581126785711 and parameters: {'n_layers': 1, 'embedding_dim': 64, 'lr': 0.0015930326091827332, 'lambda_val': 8.935135260835039e-05, 'batch_size': 513, 'optimizer': 'Adam'}. Best is trial 181 with value: 0.07267092144390536.
2026-05-19 02:48:39,250 - optuna.study._optimize - INFO - Trial 189 pruned. 
2026-05-19 02:48:57,887 - experiment_functions - INFO - Early stopping at epoch 1200. Best Recall: 0.0664
2026-05-19 02:48:57,987 - optuna.study.study - INFO - Trial 190 finished with value: 0.06635173074856665 and parameters: {'n_layers': 1, 'embedding_dim': 64, 'lr': 0.0010443679773128349, 'lambda_val': 1.1379648713680217e-05, 'batch_size': 776, 'optimizer': 'Adam'}. Best is trial 181 with value: 0.07267092144390536.
2026-05-19 02:49:25,358 - optuna.study._optimize - INFO - Trial 191 pruned. 
2026-05-19 02:49:46,417 - experiment_functions - INFO - Early stopping at epoch 1450. Best Recall: 0.0702
2026-05-19 02:49:46,518 - optuna.study.study - INFO - Trial 192 finished with value: 0.07019747424087368 and parameters: {'n_layers': 1, 'embedding_dim': 64, 'lr': 0.0010688644133476212, 'lambda_val': 0.00014909704823788482, 'batch_size': 583, 'optimizer': 'Adam'}. Best is trial 181 with value: 0.07267092144390536.
2026-05-19 02:50:12,250 - experiment_functions - INFO - Early stopping at epoch 1800. Best Recall: 0.0695
2026-05-19 02:50:12,341 - optuna.study.study - INFO - Trial 193 finished with value: 0.06952444320820017 and parameters: {'n_layers': 1, 'embedding_dim': 64, 'lr': 0.0008486572026521979, 'lambda_val': 0.0001650121653231487, 'batch_size': 599, 'optimizer': 'Adam'}. Best is trial 181 with value: 0.07267092144390536.
2026-05-19 02:50:35,140 - optuna.study._optimize - INFO - Trial 194 pruned. 
2026-05-19 02:50:52,279 - optuna.study._optimize - INFO - Trial 195 pruned. 
2026-05-19 02:51:16,032 - experiment_functions - INFO - Early stopping at epoch 1500. Best Recall: 0.0696
2026-05-19 02:51:16,134 - optuna.study.study - INFO - Trial 196 finished with value: 0.06955965940794272 and parameters: {'n_layers': 1, 'embedding_dim': 64, 'lr': 0.0009617201444488101, 'lambda_val': 0.00024276174459217188, 'batch_size': 572, 'optimizer': 'Adam'}. Best is trial 181 with value: 0.07267092144390536.
2026-05-19 02:51:31,755 - optuna.study._optimize - INFO - Trial 197 pruned. 
2026-05-19 02:52:13,296 - experiment_functions - INFO - Early stopping at epoch 2700. Best Recall: 0.0715
2026-05-19 02:52:13,440 - optuna.study.study - INFO - Trial 198 finished with value: 0.07154644030293375 and parameters: {'n_layers': 1, 'embedding_dim': 64, 'lr': 0.0007446476823603552, 'lambda_val': 0.00021265066894511598, 'batch_size': 665, 'optimizer': 'Adam'}. Best is trial 181 with value: 0.07267092144390536.
2026-05-19 02:52:28,089 - optuna.study._optimize - INFO - Trial 199 pruned. 
2026-05-19 02:52:35,732 - experiment_functions - INFO - Early stopping at epoch 500. Best Recall: 0.0054
2026-05-19 02:52:35,823 - optuna.study.study - INFO - Trial 200 finished with value: 0.005351027556056569 and parameters: {'n_layers': 1, 'embedding_dim': 64, 'lr': 0.0005376728394559436, 'lambda_val': 0.000337104875776711, 'batch_size': 638, 'optimizer': 'SGD'}. Best is trial 181 with value: 0.07267092144390536.
2026-05-19 02:53:16,649 - experiment_functions - INFO - Early stopping at epoch 2550. Best Recall: 0.0721
2026-05-19 02:53:16,806 - optuna.study.study - INFO - Trial 201 finished with value: 0.07207466661523977 and parameters: {'n_layers': 1, 'embedding_dim': 64, 'lr': 0.0007488169808607534, 'lambda_val': 0.0001743581956436618, 'batch_size': 677, 'optimizer': 'Adam'}. Best is trial 181 with value: 0.07267092144390536.
2026-05-19 02:53:33,205 - optuna.study._optimize - INFO - Trial 202 pruned. 
2026-05-19 02:53:48,264 - optuna.study._optimize - INFO - Trial 203 pruned. 
2026-05-19 02:54:02,300 - optuna.study._optimize - INFO - Trial 204 pruned. 
2026-05-19 02:54:21,001 - experiment_functions - INFO - Early stopping at epoch 1250. Best Recall: 0.0675
2026-05-19 02:54:21,136 - optuna.study.study - INFO - Trial 205 finished with value: 0.06750395696166574 and parameters: {'n_layers': 1, 'embedding_dim': 64, 'lr': 0.0010431235404506926, 'lambda_val': 0.00020651621915800924, 'batch_size': 716, 'optimizer': 'Adam'}. Best is trial 181 with value: 0.07267092144390536.
2026-05-19 02:54:35,510 - optuna.study._optimize - INFO - Trial 206 pruned. 
2026-05-19 02:54:54,771 - optuna.study._optimize - INFO - Trial 207 pruned. 
2026-05-19 02:55:08,938 - optuna.study._optimize - INFO - Trial 208 pruned. 
2026-05-19 02:55:29,998 - experiment_functions - INFO - Early stopping at epoch 1350. Best Recall: 0.0674
2026-05-19 02:55:30,088 - optuna.study.study - INFO - Trial 209 finished with value: 0.0674029676543577 and parameters: {'n_layers': 1, 'embedding_dim': 64, 'lr': 0.0010007791913668586, 'lambda_val': 0.0001501065247852986, 'batch_size': 853, 'optimizer': 'Adam'}. Best is trial 181 with value: 0.07267092144390536.
2026-05-19 02:55:44,431 - optuna.study._optimize - INFO - Trial 210 pruned. 
2026-05-19 02:56:08,497 - optuna.study._optimize - INFO - Trial 211 pruned. 
2026-05-19 02:56:24,002 - optuna.study._optimize - INFO - Trial 212 pruned. 
2026-05-19 02:56:39,147 - optuna.study._optimize - INFO - Trial 213 pruned. 
2026-05-19 02:56:53,822 - optuna.study._optimize - INFO - Trial 214 pruned. 
