2026-05-18 18:39:38,991 - optuna.study.study - INFO - Trial 239 finished with value: 0.07112898259732112 and parameters: {'n_layers': 1, 'embedding_dim': 32, 'lr': 0.0009839376874014505, 'lambda_val': 0.000450038152932423, 'batch_size': 631, 'optimizer': 'Adam'}. Best is trial 183 with value: 0.07263779126466675.
2026-05-18 18:40:00,712 - optuna.study._optimize - INFO - Trial 240 pruned. 
2026-05-18 18:40:14,290 - optuna.study._optimize - INFO - Trial 241 pruned. 
2026-05-18 18:40:27,909 - optuna.study._optimize - INFO - Trial 242 pruned. 
2026-05-18 18:40:42,366 - optuna.study._optimize - INFO - Trial 243 pruned. 
2026-05-18 18:40:56,680 - optuna.study._optimize - INFO - Trial 244 pruned. 
2026-05-18 18:41:13,612 - experiment_functions - INFO - Early stopping at epoch 1250. Best Recall: 0.0685
2026-05-18 18:41:13,713 - optuna.study.study - INFO - Trial 245 finished with value: 0.06851063440829123 and parameters: {'n_layers': 1, 'embedding_dim': 32, 'lr': 0.0012599983481786181, 'lambda_val': 0.0010363756527582313, 'batch_size': 639, 'optimizer': 'Adam'}. Best is trial 183 with value: 0.07263779126466675.
2026-05-18 18:41:27,218 - optuna.study._optimize - INFO - Trial 246 pruned. 
2026-05-18 18:41:40,893 - optuna.study._optimize - INFO - Trial 247 pruned. 
2026-05-18 18:41:55,020 - optuna.study._optimize - INFO - Trial 248 pruned. 
2026-05-18 18:42:08,995 - optuna.study._optimize - INFO - Trial 249 pruned. 
2026-05-18 18:42:30,711 - optuna.study._optimize - INFO - Trial 250 pruned. 
2026-05-18 18:42:44,097 - optuna.study._optimize - INFO - Trial 251 pruned. 
2026-05-18 18:43:07,308 - experiment_functions - INFO - Early stopping at epoch 1700. Best Recall: 0.0705
2026-05-18 18:43:07,418 - optuna.study.study - INFO - Trial 252 finished with value: 0.0705283681391118 and parameters: {'n_layers': 1, 'embedding_dim': 32, 'lr': 0.000972679011009604, 'lambda_val': 0.0021517667292485785, 'batch_size': 705, 'optimizer': 'Adam'}. Best is trial 183 with value: 0.07263779126466675.
2026-05-18 18:43:23,058 - experiment_functions - INFO - Early stopping at epoch 1100. Best Recall: 0.0676
2026-05-18 18:43:23,211 - optuna.study.study - INFO - Trial 253 finished with value: 0.06761096113358124 and parameters: {'n_layers': 1, 'embedding_dim': 32, 'lr': 0.0013278926707609511, 'lambda_val': 0.002449583874536199, 'batch_size': 704, 'optimizer': 'Adam'}. Best is trial 183 with value: 0.07263779126466675.
2026-05-18 18:43:50,739 - experiment_functions - INFO - Early stopping at epoch 1950. Best Recall: 0.0718
2026-05-18 18:43:50,828 - optuna.study.study - INFO - Trial 254 finished with value: 0.0718320161683182 and parameters: {'n_layers': 1, 'embedding_dim': 32, 'lr': 0.0009618273093102895, 'lambda_val': 0.0022537172554593175, 'batch_size': 517, 'optimizer': 'Adam'}. Best is trial 183 with value: 0.07263779126466675.
2026-05-18 18:44:05,082 - optuna.study._optimize - INFO - Trial 255 pruned. 
2026-05-18 18:44:20,161 - optuna.study._optimize - INFO - Trial 256 pruned. 
2026-05-18 18:44:39,183 - optuna.study._optimize - INFO - Trial 257 pruned. 
2026-05-18 18:44:58,537 - optuna.study._optimize - INFO - Trial 258 pruned. 
2026-05-18 18:45:17,983 - optuna.study._optimize - INFO - Trial 259 pruned. 
2026-05-18 18:45:24,955 - experiment_functions - INFO - Early stopping at epoch 500. Best Recall: 0.0056
2026-05-18 18:45:25,044 - optuna.study.study - INFO - Trial 260 finished with value: 0.005558110647704468 and parameters: {'n_layers': 1, 'embedding_dim': 32, 'lr': 0.0007725827961115426, 'lambda_val': 0.004692768614955367, 'batch_size': 645, 'optimizer': 'SGD'}. Best is trial 183 with value: 0.07263779126466675.
2026-05-18 18:45:39,325 - optuna.study._optimize - INFO - Trial 261 pruned. 
2026-05-18 18:45:52,060 - optuna.study._optimize - INFO - Trial 262 pruned. 
2026-05-18 18:46:06,521 - optuna.study._optimize - INFO - Trial 263 pruned. 
2026-05-18 18:46:15,266 - experiment_functions - INFO - Early stopping at epoch 600. Best Recall: 0.0050
2026-05-18 18:46:15,399 - optuna.study.study - INFO - Trial 264 finished with value: 0.005032385666178707 and parameters: {'n_layers': 1, 'embedding_dim': 32, 'lr': 1.786105391164404e-05, 'lambda_val': 0.0007537345498867259, 'batch_size': 691, 'optimizer': 'Adam'}. Best is trial 183 with value: 0.07263779126466675.
2026-05-18 18:46:29,909 - optuna.study._optimize - INFO - Trial 265 pruned. 
2026-05-18 18:46:41,284 - experiment_functions - INFO - Early stopping at epoch 750. Best Recall: 0.0491
2026-05-18 18:46:41,376 - optuna.study.study - INFO - Trial 266 finished with value: 0.04911290975568329 and parameters: {'n_layers': 4, 'embedding_dim': 32, 'lr': 0.0009017773067038375, 'lambda_val': 0.009059253048934937, 'batch_size': 580, 'optimizer': 'Adam'}. Best is trial 183 with value: 0.07263779126466675.
2026-05-18 18:46:55,290 - experiment_functions - INFO - Early stopping at epoch 950. Best Recall: 0.0589
2026-05-18 18:46:55,379 - optuna.study.study - INFO - Trial 267 finished with value: 0.05892381996140215 and parameters: {'n_layers': 1, 'embedding_dim': 32, 'lr': 0.0016526783553399314, 'lambda_val': 0.0071054662403587715, 'batch_size': 512, 'optimizer': 'Adam'}. Best is trial 183 with value: 0.07263779126466675.
2026-05-18 18:47:14,258 - optuna.study._optimize - INFO - Trial 268 pruned. 
2026-05-18 18:47:28,950 - optuna.study._optimize - INFO - Trial 269 pruned. 
2026-05-18 18:47:42,735 - optuna.study._optimize - INFO - Trial 270 pruned. 
2026-05-18 18:47:52,515 - experiment_functions - INFO - Early stopping at epoch 650. Best Recall: 0.0530
2026-05-18 18:47:52,605 - optuna.study.study - INFO - Trial 271 finished with value: 0.05302366257409439 and parameters: {'n_layers': 1, 'embedding_dim': 256, 'lr': 0.0020899829338445644, 'lambda_val': 0.01874858744976774, 'batch_size': 1581, 'optimizer': 'Adam'}. Best is trial 183 with value: 0.07263779126466675.
2026-05-18 18:48:08,452 - optuna.study._optimize - INFO - Trial 272 pruned. 
2026-05-18 18:48:22,180 - experiment_functions - INFO - Early stopping at epoch 950. Best Recall: 0.0600
2026-05-18 18:48:22,300 - optuna.study.study - INFO - Trial 273 finished with value: 0.05998536376700842 and parameters: {'n_layers': 1, 'embedding_dim': 32, 'lr': 0.0012023248498717394, 'lambda_val': 0.0001770802241857362, 'batch_size': 1922, 'optimizer': 'Adam'}. Best is trial 183 with value: 0.07263779126466675.
2026-05-18 18:48:35,591 - experiment_functions - INFO - Early stopping at epoch 900. Best Recall: 0.0604
2026-05-18 18:48:35,680 - optuna.study.study - INFO - Trial 274 finished with value: 0.06042492577871703 and parameters: {'n_layers': 1, 'embedding_dim': 128, 'lr': 0.001463234867275823, 'lambda_val': 0.0004235203155325318, 'batch_size': 636, 'optimizer': 'Adam'}. Best is trial 183 with value: 0.07263779126466675.
2026-05-18 18:49:01,371 - experiment_functions - INFO - Early stopping at epoch 1950. Best Recall: 0.0699
2026-05-18 18:49:01,481 - optuna.study.study - INFO - Trial 275 finished with value: 0.06988564373931895 and parameters: {'n_layers': 1, 'embedding_dim': 32, 'lr': 0.0010650011075510443, 'lambda_val': 1.3937147466988318e-06, 'batch_size': 513, 'optimizer': 'Adam'}. Best is trial 183 with value: 0.07263779126466675.
2026-05-18 18:49:15,080 - optuna.study._optimize - INFO - Trial 276 pruned. 
2026-05-18 18:49:27,360 - experiment_functions - INFO - Early stopping at epoch 900. Best Recall: 0.0603
2026-05-18 18:49:27,460 - optuna.study.study - INFO - Trial 277 finished with value: 0.06029113268752101 and parameters: {'n_layers': 1, 'embedding_dim': 96, 'lr': 0.0017799297698107021, 'lambda_val': 1.2734391944190618e-06, 'batch_size': 517, 'optimizer': 'Adam'}. Best is trial 183 with value: 0.07263779126466675.
2026-05-18 18:49:40,786 - optuna.study._optimize - INFO - Trial 278 pruned. 
2026-05-18 18:49:47,499 - experiment_functions - INFO - Early stopping at epoch 500. Best Recall: 0.0046
2026-05-18 18:49:47,598 - optuna.study.study - INFO - Trial 279 finished with value: 0.004636922532586406 and parameters: {'n_layers': 1, 'embedding_dim': 32, 'lr': 0.0011520427930581795, 'lambda_val': 0.0005109645996139993, 'batch_size': 512, 'optimizer': 'SGD'}. Best is trial 183 with value: 0.07263779126466675.
2026-05-18 18:50:02,638 - optuna.study._optimize - INFO - Trial 280 pruned. 
2026-05-18 18:50:24,932 - experiment_functions - INFO - Early stopping at epoch 1550. Best Recall: 0.0703
2026-05-18 18:50:25,022 - optuna.study.study - INFO - Trial 281 finished with value: 0.07034907262588425 and parameters: {'n_layers': 1, 'embedding_dim': 32, 'lr': 0.0013283059891298927, 'lambda_val': 7.859065403921075e-05, 'batch_size': 588, 'optimizer': 'Adam'}. Best is trial 183 with value: 0.07263779126466675.
2026-05-18 18:50:39,189 - optuna.study._optimize - INFO - Trial 282 pruned. 
2026-05-18 18:50:53,845 - optuna.study._optimize - INFO - Trial 283 pruned. 
2026-05-18 18:51:05,391 - experiment_functions - INFO - Early stopping at epoch 750. Best Recall: 0.0644
2026-05-18 18:51:05,488 - optuna.study.study - INFO - Trial 284 finished with value: 0.06435018510998224 and parameters: {'n_layers': 2, 'embedding_dim': 32, 'lr': 0.001480128921896062, 'lambda_val': 0.0003060044802763528, 'batch_size': 596, 'optimizer': 'Adam'}. Best is trial 183 with value: 0.07263779126466675.
2026-05-18 18:51:25,108 - experiment_functions - INFO - Early stopping at epoch 1350. Best Recall: 0.0704
2026-05-18 18:51:25,203 - optuna.study.study - INFO - Trial 285 finished with value: 0.07035749938878869 and parameters: {'n_layers': 1, 'embedding_dim': 32, 'lr': 0.001166995534131334, 'lambda_val': 1.4973978774899104e-06, 'batch_size': 670, 'optimizer': 'Adam'}. Best is trial 183 with value: 0.07263779126466675.
2026-05-18 18:51:40,073 - optuna.study._optimize - INFO - Trial 286 pruned. 
2026-05-18 18:51:53,969 - optuna.study._optimize - INFO - Trial 287 pruned. 
2026-05-18 18:52:07,651 - experiment_functions - INFO - Early stopping at epoch 950. Best Recall: 0.0676
2026-05-18 18:52:07,750 - optuna.study.study - INFO - Trial 288 finished with value: 0.06764110444502028 and parameters: {'n_layers': 1, 'embedding_dim': 32, 'lr': 0.001788730553858311, 'lambda_val': 2.4117460776753473e-06, 'batch_size': 674, 'optimizer': 'Adam'}. Best is trial 183 with value: 0.07263779126466675.
2026-05-18 18:52:22,425 - optuna.study._optimize - INFO - Trial 289 pruned. 
2026-05-18 18:52:36,159 - optuna.study._optimize - INFO - Trial 290 pruned. 
2026-05-18 18:52:51,883 - optuna.study._optimize - INFO - Trial 291 pruned. 
2026-05-18 18:53:15,756 - experiment_functions - INFO - Early stopping at epoch 1750. Best Recall: 0.0706
2026-05-18 18:53:15,845 - optuna.study.study - INFO - Trial 292 finished with value: 0.07062257921425184 and parameters: {'n_layers': 1, 'embedding_dim': 32, 'lr': 0.0010521151480699178, 'lambda_val': 1.4595020016875285e-06, 'batch_size': 654, 'optimizer': 'Adam'}. Best is trial 183 with value: 0.07263779126466675.
2026-05-18 18:53:28,788 - optuna.study._optimize - INFO - Trial 293 pruned. 
2026-05-18 18:53:43,075 - optuna.study._optimize - INFO - Trial 294 pruned. 
2026-05-18 18:53:57,003 - optuna.study._optimize - INFO - Trial 295 pruned. 
2026-05-18 18:54:04,326 - experiment_functions - INFO - Early stopping at epoch 500. Best Recall: 0.0054
2026-05-18 18:54:04,430 - optuna.study.study - INFO - Trial 296 finished with value: 0.005378950166347401 and parameters: {'n_layers': 1, 'embedding_dim': 32, 'lr': 0.0015860265159219748, 'lambda_val': 0.00012762572389475786, 'batch_size': 644, 'optimizer': 'SGD'}. Best is trial 183 with value: 0.07263779126466675.
2026-05-18 18:54:19,340 - optuna.study._optimize - INFO - Trial 297 pruned. 
2026-05-18 18:54:33,933 - optuna.study._optimize - INFO - Trial 298 pruned. 
2026-05-18 18:54:48,477 - optuna.study._optimize - INFO - Trial 299 pruned. 
2026-05-18 18:55:03,966 - experiment_functions - INFO - Early stopping at epoch 1450. Best Recall: 0.0690
2026-05-18 18:55:05,158 - root - INFO - **** Training e_1M_1c3dcs
2026-05-18 18:55:05,159 - root - INFO -   ** 3-Dominant stats:
2026-05-18 18:55:05,159 - root - INFO -   ** Finding the dominant set:
2026-05-18 19:35:25,199 - root - INFO -   ** Getting the trainable edges:
2026-05-18 19:35:25,217 - helper_functions - INFO -      Number of nodes: 4781
2026-05-18 19:35:25,217 - helper_functions - INFO -      Ratio: 0.4905602298378822
2026-05-18 19:35:25,217 - helper_functions - INFO -      Number of unique users: 3174
2026-05-18 19:35:25,217 - helper_functions - INFO -      Number of unique items: 1607
2026-05-18 19:35:25,217 - helper_functions - INFO -      Total dominant set edge: 28653
2026-05-18 19:35:25,217 - helper_functions - INFO -      Trainable edges: 22922.4
2026-05-18 19:35:25,257 - root - INFO -   **** Getting 28653 dominant set edges
2026-05-18 19:35:25,426 - optuna.storages._rdb.storage - INFO - A new study created in RDB with name: Study_e_1M_1c3dcs_strict
2026-05-18 19:35:32,463 - experiment_functions - INFO - Early stopping at epoch 500. Best Recall: 0.0056
2026-05-18 19:35:32,560 - optuna.study.study - INFO - Trial 0 finished with value: 0.00564228287300482 and parameters: {'n_layers': 3, 'embedding_dim': 96, 'lr': 0.023663703315804873, 'lambda_val': 0.0239905459628835, 'batch_size': 2988, 'optimizer': 'SGD'}. Best is trial 0 with value: 0.00564228287300482.
2026-05-18 19:35:39,666 - experiment_functions - INFO - Early stopping at epoch 500. Best Recall: 0.0050
2026-05-18 19:35:39,755 - optuna.study.study - INFO - Trial 1 finished with value: 0.004953162691643857 and parameters: {'n_layers': 4, 'embedding_dim': 64, 'lr': 0.0025567511198067785, 'lambda_val': 0.0037053639947222453, 'batch_size': 3044, 'optimizer': 'SGD'}. Best is trial 0 with value: 0.00564228287300482.
2026-05-18 19:36:29,172 - experiment_functions - INFO - Early stopping at epoch 3700. Best Recall: 0.0065
2026-05-18 19:36:29,273 - optuna.study.study - INFO - Trial 2 finished with value: 0.006484910474830973 and parameters: {'n_layers': 1, 'embedding_dim': 64, 'lr': 3.388914545242794e-05, 'lambda_val': 3.858308985313226e-06, 'batch_size': 1800, 'optimizer': 'RMSprop'}. Best is trial 2 with value: 0.006484910474830973.
2026-05-18 19:36:36,474 - experiment_functions - INFO - Early stopping at epoch 550. Best Recall: 0.0061
2026-05-18 19:36:36,553 - optuna.study.study - INFO - Trial 3 finished with value: 0.00605989885418069 and parameters: {'n_layers': 2, 'embedding_dim': 128, 'lr': 0.018062166918787686, 'lambda_val': 1.4642857275207272e-06, 'batch_size': 1630, 'optimizer': 'Adam'}. Best is trial 2 with value: 0.006484910474830973.
2026-05-18 19:36:44,222 - experiment_functions - INFO - Early stopping at epoch 550. Best Recall: 0.0058
2026-05-18 19:36:44,323 - optuna.study.study - INFO - Trial 4 finished with value: 0.0057584093875245835 and parameters: {'n_layers': 1, 'embedding_dim': 32, 'lr': 1.346028307181223e-05, 'lambda_val': 0.0001762153348591207, 'batch_size': 2074, 'optimizer': 'Adam'}. Best is trial 2 with value: 0.006484910474830973.
2026-05-18 19:37:03,636 - optuna.study._optimize - INFO - Trial 5 pruned. 
2026-05-18 19:37:11,654 - experiment_functions - INFO - Early stopping at epoch 500. Best Recall: 0.0052
2026-05-18 19:37:11,788 - optuna.study.study - INFO - Trial 6 finished with value: 0.00516995659298606 and parameters: {'n_layers': 4, 'embedding_dim': 256, 'lr': 0.0038046313287844577, 'lambda_val': 0.0023383357354363754, 'batch_size': 2348, 'optimizer': 'SGD'}. Best is trial 2 with value: 0.006484910474830973.
2026-05-18 19:37:18,882 - experiment_functions - INFO - Early stopping at epoch 550. Best Recall: 0.0058
2026-05-18 19:37:18,971 - optuna.study.study - INFO - Trial 7 finished with value: 0.005751053184927879 and parameters: {'n_layers': 1, 'embedding_dim': 96, 'lr': 1.3781153817904356e-05, 'lambda_val': 0.001750749546644116, 'batch_size': 647, 'optimizer': 'RMSprop'}. Best is trial 2 with value: 0.006484910474830973.
2026-05-18 19:37:36,753 - experiment_functions - INFO - Early stopping at epoch 700. Best Recall: 0.0028
2026-05-18 19:37:36,831 - optuna.study.study - INFO - Trial 8 finished with value: 0.002849298242433811 and parameters: {'n_layers': 4, 'embedding_dim': 32, 'lr': 0.03358590391734332, 'lambda_val': 0.06369773241734472, 'batch_size': 2079, 'optimizer': 'RMSprop'}. Best is trial 2 with value: 0.006484910474830973.
2026-05-18 19:38:22,869 - optuna.study.study - INFO - Trial 9 finished with value: 0.009118969888975393 and parameters: {'n_layers': 1, 'embedding_dim': 128, 'lr': 5.163105258399697e-05, 'lambda_val': 0.00014168121518258497, 'batch_size': 717, 'optimizer': 'RMSprop'}. Best is trial 9 with value: 0.009118969888975393.
2026-05-18 19:38:39,800 - experiment_functions - INFO - Early stopping at epoch 1250. Best Recall: 0.0402
2026-05-18 19:38:39,911 - optuna.study.study - INFO - Trial 10 finished with value: 0.04018206846660927 and parameters: {'n_layers': 2, 'embedding_dim': 128, 'lr': 0.0002409456450495988, 'lambda_val': 4.855533464815688e-05, 'batch_size': 4085, 'optimizer': 'RMSprop'}. Best is trial 10 with value: 0.04018206846660927.
2026-05-18 19:38:59,507 - experiment_functions - INFO - Early stopping at epoch 1450. Best Recall: 0.0430
2026-05-18 19:38:59,600 - optuna.study.study - INFO - Trial 11 finished with value: 0.04302377151873588 and parameters: {'n_layers': 2, 'embedding_dim': 128, 'lr': 0.00022172160880978454, 'lambda_val': 4.4857609487117515e-05, 'batch_size': 4086, 'optimizer': 'RMSprop'}. Best is trial 11 with value: 0.04302377151873588.
2026-05-18 19:39:12,534 - experiment_functions - INFO - Early stopping at epoch 950. Best Recall: 0.0379
2026-05-18 19:39:12,679 - optuna.study.study - INFO - Trial 12 finished with value: 0.03787059486265694 and parameters: {'n_layers': 2, 'embedding_dim': 128, 'lr': 0.00033083910131063006, 'lambda_val': 1.939251901763921e-05, 'batch_size': 4089, 'optimizer': 'RMSprop'}. Best is trial 11 with value: 0.04302377151873588.
2026-05-18 19:39:28,776 - experiment_functions - INFO - Early stopping at epoch 1200. Best Recall: 0.0314
2026-05-18 19:39:28,874 - optuna.study.study - INFO - Trial 13 finished with value: 0.03141044970048001 and parameters: {'n_layers': 2, 'embedding_dim': 128, 'lr': 0.00026006953737235894, 'lambda_val': 2.5545243456805165e-05, 'batch_size': 4077, 'optimizer': 'RMSprop'}. Best is trial 11 with value: 0.04302377151873588.
2026-05-18 19:39:43,495 - experiment_functions - INFO - Early stopping at epoch 1050. Best Recall: 0.0297
2026-05-18 19:39:43,594 - optuna.study.study - INFO - Trial 14 finished with value: 0.02968057499232701 and parameters: {'n_layers': 3, 'embedding_dim': 128, 'lr': 0.00043482637973462496, 'lambda_val': 2.752292165591799e-05, 'batch_size': 3450, 'optimizer': 'RMSprop'}. Best is trial 11 with value: 0.04302377151873588.
2026-05-18 19:39:51,351 - experiment_functions - INFO - Early stopping at epoch 550. Best Recall: 0.0155
2026-05-18 19:39:51,504 - optuna.study.study - INFO - Trial 15 finished with value: 0.015487418445566163 and parameters: {'n_layers': 2, 'embedding_dim': 128, 'lr': 0.0013117089826291041, 'lambda_val': 0.00034256714765977184, 'batch_size': 3574, 'optimizer': 'RMSprop'}. Best is trial 11 with value: 0.04302377151873588.
2026-05-18 19:40:20,695 - experiment_functions - INFO - Early stopping at epoch 2200. Best Recall: 0.0531
2026-05-18 19:40:20,832 - optuna.study.study - INFO - Trial 16 finished with value: 0.05306898419999916 and parameters: {'n_layers': 2, 'embedding_dim': 128, 'lr': 0.0001521148125085972, 'lambda_val': 8.332907389925835e-05, 'batch_size': 3556, 'optimizer': 'RMSprop'}. Best is trial 16 with value: 0.05306898419999916.
2026-05-18 19:40:34,486 - optuna.study._optimize - INFO - Trial 17 pruned. 
2026-05-18 19:40:41,377 - experiment_functions - INFO - Early stopping at epoch 500. Best Recall: 0.0050
2026-05-18 19:40:41,519 - optuna.study.study - INFO - Trial 18 finished with value: 0.004952179853695354 and parameters: {'n_layers': 2, 'embedding_dim': 64, 'lr': 0.09756162939608255, 'lambda_val': 0.0007234227604875969, 'batch_size': 3029, 'optimizer': 'SGD'}. Best is trial 16 with value: 0.05306898419999916.
2026-05-18 19:40:51,377 - experiment_functions - INFO - Early stopping at epoch 650. Best Recall: 0.0231
2026-05-18 19:40:51,521 - optuna.study.study - INFO - Trial 19 finished with value: 0.023074578086520622 and parameters: {'n_layers': 3, 'embedding_dim': 96, 'lr': 0.0007642530627903267, 'lambda_val': 7.369466660627471e-05, 'batch_size': 2659, 'optimizer': 'Adam'}. Best is trial 16 with value: 0.05306898419999916.
2026-05-18 19:41:04,564 - optuna.study._optimize - INFO - Trial 20 pruned. 
2026-05-18 19:41:18,135 - optuna.study._optimize - INFO - Trial 21 pruned. 
2026-05-18 19:41:26,512 - experiment_functions - INFO - Early stopping at epoch 550. Best Recall: 0.0302
2026-05-18 19:41:26,613 - optuna.study.study - INFO - Trial 22 finished with value: 0.030202604105011067 and parameters: {'n_layers': 2, 'embedding_dim': 128, 'lr': 0.0008275552781603984, 'lambda_val': 0.00047193754854346067, 'batch_size': 3294, 'optimizer': 'RMSprop'}. Best is trial 16 with value: 0.05306898419999916.
2026-05-18 19:41:42,016 - experiment_functions - INFO - Early stopping at epoch 1150. Best Recall: 0.0383
2026-05-18 19:41:42,103 - optuna.study.study - INFO - Trial 23 finished with value: 0.038252094683964906 and parameters: {'n_layers': 2, 'embedding_dim': 128, 'lr': 0.00025069474863103746, 'lambda_val': 5.963990113247865e-05, 'batch_size': 3870, 'optimizer': 'RMSprop'}. Best is trial 16 with value: 0.05306898419999916.
2026-05-18 19:41:55,613 - optuna.study._optimize - INFO - Trial 24 pruned. 
2026-05-18 19:42:03,981 - experiment_functions - INFO - Early stopping at epoch 500. Best Recall: 0.0067
