2026-05-19 03:34:41,945 - optuna.study.study - INFO - Trial 55 finished with value: 0.05900257056563305 and parameters: {'n_layers': 1, 'embedding_dim': 96, 'lr': 0.0037412250304763987, 'lambda_val': 5.564620035116568e-05, 'batch_size': 1155, 'optimizer': 'Adam'}. Best is trial 19 with value: 0.06939808527798064.
2026-05-19 03:34:56,071 - experiment_functions - INFO - Early stopping at epoch 900. Best Recall: 0.0680
2026-05-19 03:34:56,161 - optuna.study.study - INFO - Trial 56 finished with value: 0.06799597498803282 and parameters: {'n_layers': 1, 'embedding_dim': 32, 'lr': 0.0018221531849904702, 'lambda_val': 9.514257914713222e-05, 'batch_size': 658, 'optimizer': 'Adam'}. Best is trial 19 with value: 0.06939808527798064.
2026-05-19 03:35:10,375 - experiment_functions - INFO - Early stopping at epoch 1000. Best Recall: 0.0662
2026-05-19 03:35:10,478 - optuna.study.study - INFO - Trial 57 finished with value: 0.06617321832689604 and parameters: {'n_layers': 1, 'embedding_dim': 32, 'lr': 0.0017598830468681826, 'lambda_val': 9.566372333112303e-05, 'batch_size': 671, 'optimizer': 'Adam'}. Best is trial 19 with value: 0.06939808527798064.
2026-05-19 03:35:32,108 - experiment_functions - INFO - Early stopping at epoch 1400. Best Recall: 0.0674
2026-05-19 03:35:32,208 - optuna.study.study - INFO - Trial 58 finished with value: 0.06735375302079455 and parameters: {'n_layers': 1, 'embedding_dim': 32, 'lr': 0.0011742725211013006, 'lambda_val': 8.504970539542028e-05, 'batch_size': 624, 'optimizer': 'Adam'}. Best is trial 19 with value: 0.06939808527798064.
2026-05-19 03:35:58,057 - experiment_functions - INFO - Early stopping at epoch 1950. Best Recall: 0.0720
2026-05-19 03:35:58,150 - optuna.study.study - INFO - Trial 59 finished with value: 0.0720283711312802 and parameters: {'n_layers': 1, 'embedding_dim': 32, 'lr': 0.0008763841065374117, 'lambda_val': 0.0011583496088613948, 'batch_size': 660, 'optimizer': 'Adam'}. Best is trial 59 with value: 0.0720283711312802.
2026-05-19 03:36:13,708 - experiment_functions - INFO - Early stopping at epoch 900. Best Recall: 0.0602
2026-05-19 03:36:14,477 - optuna.study.study - INFO - Trial 60 finished with value: 0.06019248255494596 and parameters: {'n_layers': 2, 'embedding_dim': 128, 'lr': 0.0008452771385261935, 'lambda_val': 0.0012331366301951514, 'batch_size': 547, 'optimizer': 'Adam'}. Best is trial 59 with value: 0.0720283711312802.
2026-05-19 03:36:37,346 - experiment_functions - INFO - Early stopping at epoch 1100. Best Recall: 0.0694
2026-05-19 03:36:37,445 - optuna.study.study - INFO - Trial 61 finished with value: 0.06939730753716823 and parameters: {'n_layers': 1, 'embedding_dim': 32, 'lr': 0.0012962853044116648, 'lambda_val': 9.970414316930677e-05, 'batch_size': 664, 'optimizer': 'Adam'}. Best is trial 59 with value: 0.0720283711312802.
2026-05-19 03:37:03,867 - experiment_functions - INFO - Early stopping at epoch 1450. Best Recall: 0.0665
2026-05-19 03:37:03,947 - optuna.study.study - INFO - Trial 62 finished with value: 0.06649859624089595 and parameters: {'n_layers': 1, 'embedding_dim': 32, 'lr': 0.0011909044954051412, 'lambda_val': 0.0002575469828352455, 'batch_size': 524, 'optimizer': 'Adam'}. Best is trial 59 with value: 0.0720283711312802.
2026-05-19 03:37:17,182 - optuna.study._optimize - INFO - Trial 63 pruned. 
2026-05-19 03:37:32,101 - optuna.study._optimize - INFO - Trial 64 pruned. 
2026-05-19 03:37:46,208 - optuna.study._optimize - INFO - Trial 65 pruned. 
2026-05-19 03:38:02,338 - experiment_functions - INFO - Early stopping at epoch 500. Best Recall: 0.0046
2026-05-19 03:38:03,110 - optuna.study.study - INFO - Trial 66 finished with value: 0.004566090300623706 and parameters: {'n_layers': 3, 'embedding_dim': 32, 'lr': 0.002852691390037451, 'lambda_val': 0.0009718068889508946, 'batch_size': 3061, 'optimizer': 'SGD'}. Best is trial 59 with value: 0.0720283711312802.
2026-05-19 03:38:17,839 - experiment_functions - INFO - Early stopping at epoch 800. Best Recall: 0.0634
2026-05-19 03:38:17,973 - optuna.study.study - INFO - Trial 67 finished with value: 0.0634493472272781 and parameters: {'n_layers': 1, 'embedding_dim': 64, 'lr': 0.002032174829772405, 'lambda_val': 0.0007125541941044007, 'batch_size': 801, 'optimizer': 'Adam'}. Best is trial 59 with value: 0.0720283711312802.
2026-05-19 03:38:36,537 - experiment_functions - INFO - Early stopping at epoch 1150. Best Recall: 0.0658
2026-05-19 03:38:36,627 - optuna.study.study - INFO - Trial 68 finished with value: 0.06583273388470136 and parameters: {'n_layers': 1, 'embedding_dim': 96, 'lr': 0.001061263920217838, 'lambda_val': 0.00011073561636463594, 'batch_size': 702, 'optimizer': 'Adam'}. Best is trial 59 with value: 0.0720283711312802.
2026-05-19 03:38:45,493 - experiment_functions - INFO - Early stopping at epoch 550. Best Recall: 0.0516
2026-05-19 03:38:45,594 - optuna.study.study - INFO - Trial 69 finished with value: 0.05155815236790458 and parameters: {'n_layers': 1, 'embedding_dim': 256, 'lr': 0.0014169494100763956, 'lambda_val': 0.00203440159739865, 'batch_size': 3947, 'optimizer': 'RMSprop'}. Best is trial 59 with value: 0.0720283711312802.
2026-05-19 03:39:00,239 - optuna.study._optimize - INFO - Trial 70 pruned. 
2026-05-19 03:39:22,160 - experiment_functions - INFO - Early stopping at epoch 1400. Best Recall: 0.0648
2026-05-19 03:39:22,267 - optuna.study.study - INFO - Trial 71 finished with value: 0.06480840502420028 and parameters: {'n_layers': 1, 'embedding_dim': 32, 'lr': 0.0013981548744380124, 'lambda_val': 0.0002669954975601421, 'batch_size': 522, 'optimizer': 'Adam'}. Best is trial 59 with value: 0.0720283711312802.
2026-05-19 03:39:39,383 - experiment_functions - INFO - Early stopping at epoch 1250. Best Recall: 0.0680
2026-05-19 03:39:39,473 - optuna.study.study - INFO - Trial 72 finished with value: 0.06800467661663603 and parameters: {'n_layers': 1, 'embedding_dim': 32, 'lr': 0.0012150773992753133, 'lambda_val': 0.00018613556567393264, 'batch_size': 637, 'optimizer': 'Adam'}. Best is trial 59 with value: 0.0720283711312802.
2026-05-19 03:39:52,849 - optuna.study._optimize - INFO - Trial 73 pruned. 
2026-05-19 03:40:08,646 - optuna.study._optimize - INFO - Trial 74 pruned. 
2026-05-19 03:40:18,641 - experiment_functions - INFO - Early stopping at epoch 700. Best Recall: 0.0628
2026-05-19 03:40:18,730 - optuna.study.study - INFO - Trial 75 finished with value: 0.06275195583443749 and parameters: {'n_layers': 1, 'embedding_dim': 32, 'lr': 0.0037434968614764546, 'lambda_val': 0.0004089153433890277, 'batch_size': 650, 'optimizer': 'Adam'}. Best is trial 59 with value: 0.0720283711312802.
2026-05-19 03:40:39,278 - experiment_functions - INFO - Early stopping at epoch 750. Best Recall: 0.0696
2026-05-19 03:40:39,370 - optuna.study.study - INFO - Trial 76 finished with value: 0.06957666484039213 and parameters: {'n_layers': 1, 'embedding_dim': 32, 'lr': 0.002783379479680459, 'lambda_val': 2.8161805801195897e-05, 'batch_size': 876, 'optimizer': 'Adam'}. Best is trial 59 with value: 0.0720283711312802.
2026-05-19 03:40:50,311 - experiment_functions - INFO - Early stopping at epoch 750. Best Recall: 0.0680
2026-05-19 03:40:50,390 - optuna.study.study - INFO - Trial 77 finished with value: 0.06797504676053405 and parameters: {'n_layers': 1, 'embedding_dim': 32, 'lr': 0.0025981922857441033, 'lambda_val': 2.6592120684886827e-05, 'batch_size': 1001, 'optimizer': 'Adam'}. Best is trial 59 with value: 0.0720283711312802.
2026-05-19 03:41:03,297 - experiment_functions - INFO - Early stopping at epoch 800. Best Recall: 0.0618
2026-05-19 03:41:03,388 - optuna.study.study - INFO - Trial 78 finished with value: 0.061775156915213125 and parameters: {'n_layers': 1, 'embedding_dim': 32, 'lr': 0.0020361431927024944, 'lambda_val': 1.666172040186361e-05, 'batch_size': 889, 'optimizer': 'Adam'}. Best is trial 59 with value: 0.0720283711312802.
2026-05-19 03:41:12,812 - experiment_functions - INFO - Early stopping at epoch 500. Best Recall: 0.0055
2026-05-19 03:41:12,914 - optuna.study.study - INFO - Trial 79 finished with value: 0.005537787908541552 and parameters: {'n_layers': 1, 'embedding_dim': 128, 'lr': 0.0041028427512305905, 'lambda_val': 9.023192563950127e-06, 'batch_size': 1050, 'optimizer': 'SGD'}. Best is trial 59 with value: 0.0720283711312802.
2026-05-19 03:41:25,653 - experiment_functions - INFO - Early stopping at epoch 600. Best Recall: 0.0047
2026-05-19 03:41:25,753 - optuna.study.study - INFO - Trial 80 finished with value: 0.0047278969192919695 and parameters: {'n_layers': 1, 'embedding_dim': 32, 'lr': 9.184857092645438e-05, 'lambda_val': 0.003730044819589047, 'batch_size': 823, 'optimizer': 'Adam'}. Best is trial 59 with value: 0.0720283711312802.
2026-05-19 03:41:36,399 - experiment_functions - INFO - Early stopping at epoch 700. Best Recall: 0.0629
2026-05-19 03:41:36,506 - optuna.study.study - INFO - Trial 81 finished with value: 0.06285067026978018 and parameters: {'n_layers': 1, 'embedding_dim': 32, 'lr': 0.002836110176818661, 'lambda_val': 4.615941321184152e-05, 'batch_size': 1009, 'optimizer': 'Adam'}. Best is trial 59 with value: 0.0720283711312802.
2026-05-19 03:41:50,414 - experiment_functions - INFO - Early stopping at epoch 800. Best Recall: 0.0679
2026-05-19 03:41:50,548 - optuna.study.study - INFO - Trial 82 finished with value: 0.06788416009351364 and parameters: {'n_layers': 1, 'embedding_dim': 32, 'lr': 0.0025581558132593196, 'lambda_val': 2.508102837819396e-05, 'batch_size': 710, 'optimizer': 'Adam'}. Best is trial 59 with value: 0.0720283711312802.
2026-05-19 03:42:03,037 - experiment_functions - INFO - Early stopping at epoch 850. Best Recall: 0.0615
2026-05-19 03:42:03,176 - optuna.study.study - INFO - Trial 83 finished with value: 0.06154329267158204 and parameters: {'n_layers': 1, 'embedding_dim': 32, 'lr': 0.0017614089787961757, 'lambda_val': 2.4031497445929738e-05, 'batch_size': 909, 'optimizer': 'Adam'}. Best is trial 59 with value: 0.0720283711312802.
2026-05-19 03:42:12,895 - experiment_functions - INFO - Early stopping at epoch 650. Best Recall: 0.0627
2026-05-19 03:42:13,042 - optuna.study.study - INFO - Trial 84 finished with value: 0.06272601644908833 and parameters: {'n_layers': 1, 'embedding_dim': 32, 'lr': 0.005027444072828054, 'lambda_val': 3.9132625545108935e-05, 'batch_size': 750, 'optimizer': 'Adam'}. Best is trial 59 with value: 0.0720283711312802.
2026-05-19 03:42:22,910 - experiment_functions - INFO - Early stopping at epoch 550. Best Recall: 0.0152
2026-05-19 03:42:23,055 - optuna.study.study - INFO - Trial 85 finished with value: 0.015192174271709854 and parameters: {'n_layers': 2, 'embedding_dim': 32, 'lr': 0.003068706083588391, 'lambda_val': 6.518872648980974e-05, 'batch_size': 584, 'optimizer': 'RMSprop'}. Best is trial 59 with value: 0.0720283711312802.
2026-05-19 03:42:36,915 - optuna.study._optimize - INFO - Trial 86 pruned. 
2026-05-19 03:42:52,407 - optuna.study._optimize - INFO - Trial 87 pruned. 
2026-05-19 03:43:01,720 - experiment_functions - INFO - Early stopping at epoch 600. Best Recall: 0.0048
2026-05-19 03:43:01,809 - optuna.study.study - INFO - Trial 88 finished with value: 0.004756485018862504 and parameters: {'n_layers': 3, 'embedding_dim': 32, 'lr': 1.065688129440787e-05, 'lambda_val': 0.0005114305383547264, 'batch_size': 995, 'optimizer': 'Adam'}. Best is trial 59 with value: 0.0720283711312802.
2026-05-19 03:43:18,370 - experiment_functions - INFO - Early stopping at epoch 900. Best Recall: 0.0727
2026-05-19 03:43:18,450 - optuna.study.study - INFO - Trial 89 finished with value: 0.07274820324430754 and parameters: {'n_layers': 1, 'embedding_dim': 32, 'lr': 0.0017587361051521414, 'lambda_val': 0.0011450155601874362, 'batch_size': 793, 'optimizer': 'Adam'}. Best is trial 89 with value: 0.07274820324430754.
2026-05-19 03:43:30,799 - experiment_functions - INFO - Early stopping at epoch 850. Best Recall: 0.0564
2026-05-19 03:43:30,891 - optuna.study.study - INFO - Trial 90 finished with value: 0.056373410300115105 and parameters: {'n_layers': 1, 'embedding_dim': 96, 'lr': 0.0016542777363302182, 'lambda_val': 0.0010143509704102337, 'batch_size': 779, 'optimizer': 'Adam'}. Best is trial 89 with value: 0.07274820324430754.
2026-05-19 03:43:42,890 - experiment_functions - INFO - Early stopping at epoch 800. Best Recall: 0.0646
2026-05-19 03:43:43,457 - optuna.study.study - INFO - Trial 91 finished with value: 0.06455144175665704 and parameters: {'n_layers': 1, 'embedding_dim': 32, 'lr': 0.002190578006151123, 'lambda_val': 0.0007184200768037844, 'batch_size': 866, 'optimizer': 'Adam'}. Best is trial 89 with value: 0.07274820324430754.
2026-05-19 03:44:03,508 - experiment_functions - INFO - Early stopping at epoch 1150. Best Recall: 0.0627
2026-05-19 03:44:03,607 - optuna.study.study - INFO - Trial 92 finished with value: 0.06269634039398614 and parameters: {'n_layers': 1, 'embedding_dim': 32, 'lr': 0.001289402217340072, 'lambda_val': 0.0016881859579321453, 'batch_size': 663, 'optimizer': 'Adam'}. Best is trial 89 with value: 0.07274820324430754.
2026-05-19 03:44:26,550 - experiment_functions - INFO - Early stopping at epoch 1650. Best Recall: 0.0602
2026-05-19 03:44:26,719 - optuna.study.study - INFO - Trial 93 finished with value: 0.06018652243148569 and parameters: {'n_layers': 1, 'embedding_dim': 32, 'lr': 0.000767136217504719, 'lambda_val': 3.0162985197017026e-05, 'batch_size': 1256, 'optimizer': 'Adam'}. Best is trial 89 with value: 0.07274820324430754.
2026-05-19 03:44:39,950 - experiment_functions - INFO - Early stopping at epoch 700. Best Recall: 0.0668
2026-05-19 03:44:40,727 - optuna.study.study - INFO - Trial 94 finished with value: 0.06681183513287557 and parameters: {'n_layers': 1, 'embedding_dim': 32, 'lr': 0.0032658360001140275, 'lambda_val': 0.0012344782766067902, 'batch_size': 947, 'optimizer': 'Adam'}. Best is trial 89 with value: 0.07274820324430754.
2026-05-19 03:45:14,346 - experiment_functions - INFO - Early stopping at epoch 1800. Best Recall: 0.0692
2026-05-19 03:45:14,445 - optuna.study.study - INFO - Trial 95 finished with value: 0.06917899021880615 and parameters: {'n_layers': 1, 'embedding_dim': 32, 'lr': 0.0010457885049610892, 'lambda_val': 0.00032382169314957166, 'batch_size': 728, 'optimizer': 'Adam'}. Best is trial 89 with value: 0.07274820324430754.
2026-05-19 03:45:28,475 - optuna.study._optimize - INFO - Trial 96 pruned. 
2026-05-19 03:45:37,755 - experiment_functions - INFO - Early stopping at epoch 500. Best Recall: 0.0048
2026-05-19 03:45:37,864 - optuna.study.study - INFO - Trial 97 finished with value: 0.004823065630193986 and parameters: {'n_layers': 1, 'embedding_dim': 32, 'lr': 0.0005893918097048296, 'lambda_val': 0.00022475564979168428, 'batch_size': 729, 'optimizer': 'SGD'}. Best is trial 89 with value: 0.07274820324430754.
2026-05-19 03:45:58,327 - experiment_functions - INFO - Early stopping at epoch 1450. Best Recall: 0.0634
2026-05-19 03:45:58,427 - optuna.study.study - INFO - Trial 98 finished with value: 0.06338468397133505 and parameters: {'n_layers': 1, 'embedding_dim': 32, 'lr': 0.0009877153901266236, 'lambda_val': 0.0007710935654906628, 'batch_size': 837, 'optimizer': 'Adam'}. Best is trial 89 with value: 0.07274820324430754.
2026-05-19 03:46:10,540 - experiment_functions - INFO - Early stopping at epoch 750. Best Recall: 0.0617
2026-05-19 03:46:10,640 - optuna.study.study - INFO - Trial 99 finished with value: 0.06171245421021461 and parameters: {'n_layers': 1, 'embedding_dim': 128, 'lr': 0.0019579910815081423, 'lambda_val': 0.00012582170441298988, 'batch_size': 1132, 'optimizer': 'Adam'}. Best is trial 89 with value: 0.07274820324430754.
2026-05-19 03:46:20,500 - experiment_functions - INFO - Early stopping at epoch 600. Best Recall: 0.0314
2026-05-19 03:46:20,600 - optuna.study.study - INFO - Trial 100 finished with value: 0.03135338226000015 and parameters: {'n_layers': 4, 'embedding_dim': 32, 'lr': 0.0012907348732373101, 'lambda_val': 0.0025192849569144185, 'batch_size': 574, 'optimizer': 'RMSprop'}. Best is trial 89 with value: 0.07274820324430754.
2026-05-19 03:46:31,418 - experiment_functions - INFO - Early stopping at epoch 650. Best Recall: 0.0613
2026-05-19 03:46:31,536 - optuna.study.study - INFO - Trial 101 finished with value: 0.0613116031717932 and parameters: {'n_layers': 1, 'embedding_dim': 32, 'lr': 0.004460566021275162, 'lambda_val': 0.0004358480389883812, 'batch_size': 760, 'optimizer': 'Adam'}. Best is trial 89 with value: 0.07274820324430754.
2026-05-19 03:46:46,303 - experiment_functions - INFO - Early stopping at epoch 750. Best Recall: 0.0652
2026-05-19 03:46:46,391 - optuna.study.study - INFO - Trial 102 finished with value: 0.06524401839544106 and parameters: {'n_layers': 1, 'embedding_dim': 32, 'lr': 0.0025452553038407344, 'lambda_val': 0.0060903636303170925, 'batch_size': 701, 'optimizer': 'Adam'}. Best is trial 89 with value: 0.07274820324430754.
2026-05-19 03:47:00,926 - experiment_functions - INFO - Early stopping at epoch 950. Best Recall: 0.0653
2026-05-19 03:47:01,027 - optuna.study.study - INFO - Trial 103 finished with value: 0.06529351545647197 and parameters: {'n_layers': 1, 'embedding_dim': 32, 'lr': 0.0014809668835925362, 'lambda_val': 6.182925200848681e-05, 'batch_size': 883, 'optimizer': 'Adam'}. Best is trial 89 with value: 0.07274820324430754.
2026-05-19 03:47:24,032 - experiment_functions - INFO - Early stopping at epoch 1500. Best Recall: 0.0682
2026-05-19 03:47:24,121 - optuna.study.study - INFO - Trial 104 finished with value: 0.0682152409673326 and parameters: {'n_layers': 1, 'embedding_dim': 32, 'lr': 0.001007371847470034, 'lambda_val': 0.00016706903920261018, 'batch_size': 979, 'optimizer': 'Adam'}. Best is trial 89 with value: 0.07274820324430754.
2026-05-19 03:47:45,391 - experiment_functions - INFO - Early stopping at epoch 1500. Best Recall: 0.0704
2026-05-19 03:47:45,481 - optuna.study.study - INFO - Trial 105 finished with value: 0.07042237964251333 and parameters: {'n_layers': 1, 'embedding_dim': 32, 'lr': 0.0010417349954907594, 'lambda_val': 9.875079944448876e-05, 'batch_size': 804, 'optimizer': 'Adam'}. Best is trial 89 with value: 0.07274820324430754.
2026-05-19 03:48:02,223 - optuna.study._optimize - INFO - Trial 106 pruned. 
2026-05-19 03:48:16,668 - optuna.study._optimize - INFO - Trial 107 pruned. 
2026-05-19 03:48:29,405 - optuna.study._optimize - INFO - Trial 108 pruned. 
2026-05-19 03:48:41,639 - experiment_functions - INFO - Early stopping at epoch 700. Best Recall: 0.0058
2026-05-19 03:48:41,760 - optuna.study.study - INFO - Trial 109 finished with value: 0.0057731521506809175 and parameters: {'n_layers': 1, 'embedding_dim': 256, 'lr': 2.67885733150918e-05, 'lambda_val': 0.0005139356992840586, 'batch_size': 947, 'optimizer': 'Adam'}. Best is trial 89 with value: 0.07274820324430754.
2026-05-19 03:48:53,929 - experiment_functions - INFO - Early stopping at epoch 850. Best Recall: 0.0626
2026-05-19 03:48:54,008 - optuna.study.study - INFO - Trial 110 finished with value: 0.0626062030835358 and parameters: {'n_layers': 1, 'embedding_dim': 32, 'lr': 0.0012180541513861036, 'lambda_val': 0.00022592682464528448, 'batch_size': 2923, 'optimizer': 'Adam'}. Best is trial 89 with value: 0.07274820324430754.
2026-05-19 03:49:08,063 - optuna.study._optimize - INFO - Trial 111 pruned. 
2026-05-19 03:49:23,933 - experiment_functions - INFO - Early stopping at epoch 1000. Best Recall: 0.0657
2026-05-19 03:49:24,032 - optuna.study.study - INFO - Trial 112 finished with value: 0.06573259236823409 and parameters: {'n_layers': 1, 'embedding_dim': 32, 'lr': 0.0016899031895375013, 'lambda_val': 0.00013485605835308312, 'batch_size': 608, 'optimizer': 'Adam'}. Best is trial 89 with value: 0.07274820324430754.
2026-05-19 03:49:41,945 - experiment_functions - INFO - Early stopping at epoch 1300. Best Recall: 0.0633
2026-05-19 03:49:42,034 - optuna.study.study - INFO - Trial 113 finished with value: 0.06330111089927107 and parameters: {'n_layers': 1, 'embedding_dim': 32, 'lr': 0.001136975530576931, 'lambda_val': 0.00018926473273587683, 'batch_size': 687, 'optimizer': 'Adam'}. Best is trial 89 with value: 0.07274820324430754.
2026-05-19 03:49:55,155 - optuna.study._optimize - INFO - Trial 114 pruned. 
2026-05-19 03:50:07,219 - experiment_functions - INFO - Early stopping at epoch 800. Best Recall: 0.0669
2026-05-19 03:50:07,318 - optuna.study.study - INFO - Trial 115 finished with value: 0.06694938456695299 and parameters: {'n_layers': 1, 'embedding_dim': 32, 'lr': 0.0020316818131532496, 'lambda_val': 0.00010277888878254346, 'batch_size': 1055, 'optimizer': 'Adam'}. Best is trial 89 with value: 0.07274820324430754.
2026-05-19 03:50:22,702 - experiment_functions - INFO - Early stopping at epoch 950. Best Recall: 0.0554
2026-05-19 03:50:22,801 - optuna.study.study - INFO - Trial 116 finished with value: 0.05537920913122633 and parameters: {'n_layers': 1, 'embedding_dim': 96, 'lr': 0.0016188815079059952, 'lambda_val': 0.001014078452795878, 'batch_size': 512, 'optimizer': 'Adam'}. Best is trial 89 with value: 0.07274820324430754.
2026-05-19 03:50:36,549 - optuna.study._optimize - INFO - Trial 117 pruned. 
2026-05-19 03:50:43,368 - experiment_functions - INFO - Early stopping at epoch 500. Best Recall: 0.0051
2026-05-19 03:50:43,457 - optuna.study.study - INFO - Trial 118 finished with value: 0.0051319327951595455 and parameters: {'n_layers': 1, 'embedding_dim': 32, 'lr': 0.003424190980932795, 'lambda_val': 1.9153007623794297e-05, 'batch_size': 896, 'optimizer': 'SGD'}. Best is trial 89 with value: 0.07274820324430754.
2026-05-19 03:50:54,680 - experiment_functions - INFO - Early stopping at epoch 800. Best Recall: 0.0624
