2026-05-19 03:50:54,778 - optuna.study.study - INFO - Trial 119 finished with value: 0.0624343572244243 and parameters: {'n_layers': 1, 'embedding_dim': 32, 'lr': 0.0014507377224380856, 'lambda_val': 5.632426599780286e-05, 'batch_size': 2484, 'optimizer': 'Adam'}. Best is trial 89 with value: 0.07274820324430754.
2026-05-19 03:51:06,802 - experiment_functions - INFO - Early stopping at epoch 800. Best Recall: 0.0690
2026-05-19 03:51:06,904 - optuna.study.study - INFO - Trial 120 finished with value: 0.0690387086849824 and parameters: {'n_layers': 1, 'embedding_dim': 32, 'lr': 0.002370570341555601, 'lambda_val': 0.0006322003081972956, 'batch_size': 735, 'optimizer': 'Adam'}. Best is trial 89 with value: 0.07274820324430754.
2026-05-19 03:51:32,751 - experiment_functions - INFO - Early stopping at epoch 1550. Best Recall: 0.0694
2026-05-19 03:51:32,885 - optuna.study.study - INFO - Trial 121 finished with value: 0.0694377103211405 and parameters: {'n_layers': 1, 'embedding_dim': 32, 'lr': 0.000883824333519228, 'lambda_val': 0.0015152208601264378, 'batch_size': 730, 'optimizer': 'Adam'}. Best is trial 89 with value: 0.07274820324430754.
2026-05-19 03:51:53,667 - experiment_functions - INFO - Early stopping at epoch 1500. Best Recall: 0.0694
2026-05-19 03:51:53,767 - optuna.study.study - INFO - Trial 122 finished with value: 0.06944477356030332 and parameters: {'n_layers': 1, 'embedding_dim': 32, 'lr': 0.0010401092166067623, 'lambda_val': 0.0006862531323011352, 'batch_size': 749, 'optimizer': 'Adam'}. Best is trial 89 with value: 0.07274820324430754.
2026-05-19 03:52:10,002 - optuna.study._optimize - INFO - Trial 123 pruned. 
2026-05-19 03:52:33,145 - experiment_functions - INFO - Early stopping at epoch 1300. Best Recall: 0.0657
2026-05-19 03:52:33,908 - optuna.study.study - INFO - Trial 124 finished with value: 0.06566304711981624 and parameters: {'n_layers': 1, 'embedding_dim': 32, 'lr': 0.0010306830487067117, 'lambda_val': 0.0006392910037820551, 'batch_size': 872, 'optimizer': 'Adam'}. Best is trial 89 with value: 0.07274820324430754.
2026-05-19 03:52:45,207 - experiment_functions - INFO - Early stopping at epoch 550. Best Recall: 0.0099
2026-05-19 03:52:45,306 - optuna.study.study - INFO - Trial 125 finished with value: 0.009863488605587051 and parameters: {'n_layers': 1, 'embedding_dim': 32, 'lr': 0.09953900080020213, 'lambda_val': 0.0011362875619846352, 'batch_size': 964, 'optimizer': 'Adam'}. Best is trial 89 with value: 0.07274820324430754.
2026-05-19 03:52:54,197 - experiment_functions - INFO - Early stopping at epoch 600. Best Recall: 0.0525
2026-05-19 03:52:54,284 - optuna.study.study - INFO - Trial 126 finished with value: 0.05254128942606439 and parameters: {'n_layers': 1, 'embedding_dim': 32, 'lr': 0.0023290317454709103, 'lambda_val': 0.0036225953452827947, 'batch_size': 789, 'optimizer': 'RMSprop'}. Best is trial 89 with value: 0.07274820324430754.
2026-05-19 03:53:07,808 - optuna.study._optimize - INFO - Trial 127 pruned. 
2026-05-19 03:53:21,667 - experiment_functions - INFO - Early stopping at epoch 900. Best Recall: 0.0116
2026-05-19 03:53:21,746 - optuna.study.study - INFO - Trial 128 finished with value: 0.011627255082803838 and parameters: {'n_layers': 1, 'embedding_dim': 32, 'lr': 0.06344569107568097, 'lambda_val': 0.002253545256046783, 'batch_size': 847, 'optimizer': 'Adam'}. Best is trial 89 with value: 0.07274820324430754.
2026-05-19 03:53:35,132 - optuna.study._optimize - INFO - Trial 129 pruned. 
2026-05-19 03:53:43,583 - experiment_functions - INFO - Early stopping at epoch 600. Best Recall: 0.0550
2026-05-19 03:53:43,664 - optuna.study.study - INFO - Trial 130 finished with value: 0.05504321986767977 and parameters: {'n_layers': 1, 'embedding_dim': 32, 'lr': 0.005974363508652614, 'lambda_val': 0.00041909786477150376, 'batch_size': 599, 'optimizer': 'Adam'}. Best is trial 89 with value: 0.07274820324430754.
2026-05-19 03:54:01,245 - experiment_functions - INFO - Early stopping at epoch 1300. Best Recall: 0.0671
2026-05-19 03:54:01,324 - optuna.study.study - INFO - Trial 131 finished with value: 0.06710898156913751 and parameters: {'n_layers': 1, 'embedding_dim': 32, 'lr': 0.001204167419552399, 'lambda_val': 0.0014058617487210216, 'batch_size': 732, 'optimizer': 'Adam'}. Best is trial 89 with value: 0.07274820324430754.
2026-05-19 03:54:16,626 - experiment_functions - INFO - Early stopping at epoch 1150. Best Recall: 0.0685
2026-05-19 03:54:16,774 - optuna.study.study - INFO - Trial 132 finished with value: 0.06852039063079675 and parameters: {'n_layers': 1, 'embedding_dim': 32, 'lr': 0.0014149117793861282, 'lambda_val': 0.000545353516307653, 'batch_size': 599, 'optimizer': 'Adam'}. Best is trial 89 with value: 0.07274820324430754.
2026-05-19 03:54:31,553 - experiment_functions - INFO - Early stopping at epoch 1100. Best Recall: 0.0740
2026-05-19 03:54:31,624 - optuna.study.study - INFO - Trial 133 finished with value: 0.07401608033989727 and parameters: {'n_layers': 1, 'embedding_dim': 32, 'lr': 0.0014670181795021322, 'lambda_val': 0.0006114625569715354, 'batch_size': 575, 'optimizer': 'Adam'}. Best is trial 133 with value: 0.07401608033989727.
2026-05-19 03:54:45,213 - experiment_functions - INFO - Early stopping at epoch 1000. Best Recall: 0.0697
2026-05-19 03:54:45,292 - optuna.study.study - INFO - Trial 134 finished with value: 0.06970785588272044 and parameters: {'n_layers': 1, 'embedding_dim': 32, 'lr': 0.0019040150012019858, 'lambda_val': 0.0006051515484081228, 'batch_size': 569, 'optimizer': 'Adam'}. Best is trial 133 with value: 0.07401608033989727.
2026-05-19 03:54:58,711 - experiment_functions - INFO - Early stopping at epoch 1000. Best Recall: 0.0696
2026-05-19 03:54:58,781 - optuna.study.study - INFO - Trial 135 finished with value: 0.06955202018236785 and parameters: {'n_layers': 1, 'embedding_dim': 32, 'lr': 0.0018865622973425918, 'lambda_val': 0.0006363974658038923, 'batch_size': 588, 'optimizer': 'Adam'}. Best is trial 133 with value: 0.07401608033989727.
2026-05-19 03:55:11,517 - experiment_functions - INFO - Early stopping at epoch 900. Best Recall: 0.0653
2026-05-19 03:55:11,599 - optuna.study.study - INFO - Trial 136 finished with value: 0.06527225754515244 and parameters: {'n_layers': 1, 'embedding_dim': 32, 'lr': 0.00234270393570403, 'lambda_val': 0.000821876934063584, 'batch_size': 524, 'optimizer': 'Adam'}. Best is trial 133 with value: 0.07401608033989727.
2026-05-19 03:55:23,734 - experiment_functions - INFO - Early stopping at epoch 850. Best Recall: 0.0643
2026-05-19 03:55:23,824 - optuna.study.study - INFO - Trial 137 finished with value: 0.06426847493410374 and parameters: {'n_layers': 1, 'embedding_dim': 64, 'lr': 0.0018641078591302904, 'lambda_val': 0.0006452599450953408, 'batch_size': 684, 'optimizer': 'Adam'}. Best is trial 133 with value: 0.07401608033989727.
2026-05-19 03:55:33,648 - experiment_functions - INFO - Early stopping at epoch 700. Best Recall: 0.0668
2026-05-19 03:55:33,737 - optuna.study.study - INFO - Trial 138 finished with value: 0.06678107070103319 and parameters: {'n_layers': 1, 'embedding_dim': 32, 'lr': 0.0032845957977600823, 'lambda_val': 0.0012756010677790984, 'batch_size': 571, 'optimizer': 'Adam'}. Best is trial 133 with value: 0.07401608033989727.
2026-05-19 03:55:43,487 - experiment_functions - INFO - Early stopping at epoch 600. Best Recall: 0.0583
2026-05-19 03:55:43,586 - optuna.study.study - INFO - Trial 139 finished with value: 0.05830139779299898 and parameters: {'n_layers': 1, 'embedding_dim': 256, 'lr': 0.0047451537366736485, 'lambda_val': 0.0004661299644608071, 'batch_size': 755, 'optimizer': 'Adam'}. Best is trial 133 with value: 0.07401608033989727.
2026-05-19 03:55:54,960 - experiment_functions - INFO - Early stopping at epoch 750. Best Recall: 0.0636
2026-05-19 03:55:55,059 - optuna.study.study - INFO - Trial 140 finished with value: 0.06362344651916926 and parameters: {'n_layers': 1, 'embedding_dim': 32, 'lr': 0.0027211988974191045, 'lambda_val': 0.0008444184509876648, 'batch_size': 665, 'optimizer': 'Adam'}. Best is trial 133 with value: 0.07401608033989727.
2026-05-19 03:56:05,508 - experiment_functions - INFO - Early stopping at epoch 700. Best Recall: 0.0463
2026-05-19 03:56:05,629 - optuna.study.study - INFO - Trial 141 finished with value: 0.04626754879879785 and parameters: {'n_layers': 3, 'embedding_dim': 32, 'lr': 0.0014770541094376924, 'lambda_val': 0.0006318795156336403, 'batch_size': 588, 'optimizer': 'Adam'}. Best is trial 133 with value: 0.07401608033989727.
2026-05-19 03:56:18,971 - experiment_functions - INFO - Early stopping at epoch 950. Best Recall: 0.0697
2026-05-19 03:56:19,062 - optuna.study.study - INFO - Trial 142 finished with value: 0.06970602925215601 and parameters: {'n_layers': 1, 'embedding_dim': 32, 'lr': 0.0019800610751899584, 'lambda_val': 0.0005361718146351804, 'batch_size': 586, 'optimizer': 'Adam'}. Best is trial 133 with value: 0.07401608033989727.
2026-05-19 03:56:32,722 - experiment_functions - INFO - Early stopping at epoch 950. Best Recall: 0.0687
2026-05-19 03:56:32,822 - optuna.study.study - INFO - Trial 143 finished with value: 0.06870570108863912 and parameters: {'n_layers': 1, 'embedding_dim': 32, 'lr': 0.0020220006603044282, 'lambda_val': 0.00030570520540408624, 'batch_size': 519, 'optimizer': 'Adam'}. Best is trial 133 with value: 0.07401608033989727.
2026-05-19 03:56:43,692 - experiment_functions - INFO - Early stopping at epoch 700. Best Recall: 0.0618
2026-05-19 03:56:43,787 - optuna.study.study - INFO - Trial 144 finished with value: 0.06176385127246126 and parameters: {'n_layers': 1, 'embedding_dim': 32, 'lr': 0.0036008381321070175, 'lambda_val': 0.00100721652396731, 'batch_size': 806, 'optimizer': 'Adam'}. Best is trial 133 with value: 0.07401608033989727.
2026-05-19 03:56:55,351 - experiment_functions - INFO - Early stopping at epoch 850. Best Recall: 0.0691
2026-05-19 03:56:55,432 - optuna.study.study - INFO - Trial 145 finished with value: 0.06910401869019633 and parameters: {'n_layers': 1, 'embedding_dim': 32, 'lr': 0.001843983617007665, 'lambda_val': 0.00036387675244785696, 'batch_size': 695, 'optimizer': 'Adam'}. Best is trial 133 with value: 0.07401608033989727.
2026-05-19 03:57:02,120 - experiment_functions - INFO - Early stopping at epoch 500. Best Recall: 0.0049
2026-05-19 03:57:02,269 - optuna.study.study - INFO - Trial 146 finished with value: 0.00488242432242003 and parameters: {'n_layers': 1, 'embedding_dim': 96, 'lr': 0.001715310528877971, 'lambda_val': 0.0003622900948962554, 'batch_size': 647, 'optimizer': 'SGD'}. Best is trial 133 with value: 0.07401608033989727.
2026-05-19 03:57:16,296 - optuna.study._optimize - INFO - Trial 147 pruned. 
2026-05-19 03:57:29,542 - experiment_functions - INFO - Early stopping at epoch 750. Best Recall: 0.0708
2026-05-19 03:57:29,633 - optuna.study.study - INFO - Trial 148 finished with value: 0.07080812200711853 and parameters: {'n_layers': 1, 'embedding_dim': 32, 'lr': 0.002856359725303603, 'lambda_val': 0.0004712021282410088, 'batch_size': 562, 'optimizer': 'Adam'}. Best is trial 133 with value: 0.07401608033989727.
2026-05-19 03:57:45,153 - experiment_functions - INFO - Early stopping at epoch 750. Best Recall: 0.0653
2026-05-19 03:57:45,917 - optuna.study.study - INFO - Trial 149 finished with value: 0.06529817066541511 and parameters: {'n_layers': 1, 'embedding_dim': 32, 'lr': 0.0029550070949906026, 'lambda_val': 0.000478157535132361, 'batch_size': 558, 'optimizer': 'Adam'}. Best is trial 133 with value: 0.07401608033989727.
2026-05-19 03:57:59,085 - experiment_functions - INFO - Early stopping at epoch 550. Best Recall: 0.0269
2026-05-19 03:57:59,196 - optuna.study.study - INFO - Trial 150 finished with value: 0.02690470068914322 and parameters: {'n_layers': 4, 'embedding_dim': 32, 'lr': 0.0016924998436812918, 'lambda_val': 0.0015198518752673265, 'batch_size': 643, 'optimizer': 'RMSprop'}. Best is trial 133 with value: 0.07401608033989727.
2026-05-19 03:58:09,170 - experiment_functions - INFO - Early stopping at epoch 700. Best Recall: 0.0618
2026-05-19 03:58:09,278 - optuna.study.study - INFO - Trial 151 finished with value: 0.06176140969801778 and parameters: {'n_layers': 1, 'embedding_dim': 32, 'lr': 0.0041134466210164524, 'lambda_val': 1.79861834744829e-06, 'batch_size': 770, 'optimizer': 'Adam'}. Best is trial 133 with value: 0.07401608033989727.
2026-05-19 03:58:23,435 - experiment_functions - INFO - Early stopping at epoch 1000. Best Recall: 0.0646
2026-05-19 03:58:23,525 - optuna.study.study - INFO - Trial 152 finished with value: 0.06463562587222439 and parameters: {'n_layers': 1, 'embedding_dim': 32, 'lr': 0.002014665322724183, 'lambda_val': 0.0007498872427649453, 'batch_size': 576, 'optimizer': 'Adam'}. Best is trial 133 with value: 0.07401608033989727.
2026-05-19 03:58:38,268 - experiment_functions - INFO - Early stopping at epoch 1050. Best Recall: 0.0682
2026-05-19 03:58:38,358 - optuna.study.study - INFO - Trial 153 finished with value: 0.0682345137598609 and parameters: {'n_layers': 1, 'embedding_dim': 32, 'lr': 0.001220649490929939, 'lambda_val': 0.0011028110790987087, 'batch_size': 840, 'optimizer': 'Adam'}. Best is trial 133 with value: 0.07401608033989727.
2026-05-19 03:58:53,503 - experiment_functions - INFO - Early stopping at epoch 1050. Best Recall: 0.0650
2026-05-19 03:58:53,593 - optuna.study.study - INFO - Trial 154 finished with value: 0.06502362772903647 and parameters: {'n_layers': 1, 'embedding_dim': 32, 'lr': 0.001458524781419138, 'lambda_val': 0.00038003576117165975, 'batch_size': 692, 'optimizer': 'Adam'}. Best is trial 133 with value: 0.07401608033989727.
2026-05-19 03:59:06,444 - experiment_functions - INFO - Early stopping at epoch 800. Best Recall: 0.0628
2026-05-19 03:59:06,532 - optuna.study.study - INFO - Trial 155 finished with value: 0.06283600465025131 and parameters: {'n_layers': 1, 'embedding_dim': 32, 'lr': 0.002529066580012892, 'lambda_val': 0.0005037154455567169, 'batch_size': 584, 'optimizer': 'Adam'}. Best is trial 133 with value: 0.07401608033989727.
2026-05-19 03:59:20,580 - experiment_functions - INFO - Early stopping at epoch 1000. Best Recall: 0.0649
2026-05-19 03:59:20,677 - optuna.study.study - INFO - Trial 156 finished with value: 0.06491732929404458 and parameters: {'n_layers': 1, 'embedding_dim': 32, 'lr': 0.0011346176083589987, 'lambda_val': 0.0002895682130615399, 'batch_size': 1997, 'optimizer': 'Adam'}. Best is trial 133 with value: 0.07401608033989727.
2026-05-19 03:59:36,712 - optuna.study._optimize - INFO - Trial 157 pruned. 
2026-05-19 03:59:47,329 - experiment_functions - INFO - Early stopping at epoch 700. Best Recall: 0.0556
2026-05-19 03:59:47,439 - optuna.study.study - INFO - Trial 158 finished with value: 0.055642589241326104 and parameters: {'n_layers': 1, 'embedding_dim': 128, 'lr': 0.0029157764955246358, 'lambda_val': 0.0009340280632594276, 'batch_size': 643, 'optimizer': 'Adam'}. Best is trial 133 with value: 0.07401608033989727.
2026-05-19 04:00:07,491 - experiment_functions - INFO - Early stopping at epoch 900. Best Recall: 0.0676
2026-05-19 04:00:07,626 - optuna.study.study - INFO - Trial 159 finished with value: 0.06762155350100107 and parameters: {'n_layers': 1, 'embedding_dim': 32, 'lr': 0.002130921826929507, 'lambda_val': 0.0006954148285146412, 'batch_size': 526, 'optimizer': 'Adam'}. Best is trial 133 with value: 0.07401608033989727.
2026-05-19 04:00:20,957 - experiment_functions - INFO - Early stopping at epoch 950. Best Recall: 0.0646
2026-05-19 04:00:21,047 - optuna.study.study - INFO - Trial 160 finished with value: 0.0645724970086836 and parameters: {'n_layers': 1, 'embedding_dim': 32, 'lr': 0.001705267620458202, 'lambda_val': 0.0004117741873311856, 'batch_size': 850, 'optimizer': 'Adam'}. Best is trial 133 with value: 0.07401608033989727.
2026-05-19 04:00:32,519 - experiment_functions - INFO - Early stopping at epoch 800. Best Recall: 0.0640
2026-05-19 04:00:32,621 - optuna.study.study - INFO - Trial 161 finished with value: 0.06402355322934286 and parameters: {'n_layers': 1, 'embedding_dim': 32, 'lr': 0.0023892812937887534, 'lambda_val': 0.0006004028795687699, 'batch_size': 743, 'optimizer': 'Adam'}. Best is trial 133 with value: 0.07401608033989727.
2026-05-19 04:00:57,327 - experiment_functions - INFO - Early stopping at epoch 1650. Best Recall: 0.0713
2026-05-19 04:00:57,406 - optuna.study.study - INFO - Trial 162 finished with value: 0.07133331423478867 and parameters: {'n_layers': 1, 'embedding_dim': 32, 'lr': 0.0009388043264459352, 'lambda_val': 0.0007911270602495169, 'batch_size': 780, 'optimizer': 'Adam'}. Best is trial 133 with value: 0.07401608033989727.
2026-05-19 04:01:19,120 - experiment_functions - INFO - Early stopping at epoch 1600. Best Recall: 0.0677
2026-05-19 04:01:19,227 - optuna.study.study - INFO - Trial 163 finished with value: 0.0676776309891864 and parameters: {'n_layers': 1, 'embedding_dim': 32, 'lr': 0.0009881579344287227, 'lambda_val': 0.0012894996066055372, 'batch_size': 645, 'optimizer': 'Adam'}. Best is trial 133 with value: 0.07401608033989727.
2026-05-19 04:01:36,874 - optuna.study._optimize - INFO - Trial 164 pruned. 
2026-05-19 04:01:57,631 - experiment_functions - INFO - Early stopping at epoch 1550. Best Recall: 0.0726
2026-05-19 04:01:57,700 - optuna.study.study - INFO - Trial 165 finished with value: 0.072615324225001 and parameters: {'n_layers': 1, 'embedding_dim': 32, 'lr': 0.0013351822797199198, 'lambda_val': 0.00022198141822019055, 'batch_size': 513, 'optimizer': 'Adam'}. Best is trial 133 with value: 0.07401608033989727.
2026-05-19 04:02:13,730 - experiment_functions - INFO - Early stopping at epoch 1200. Best Recall: 0.0701
2026-05-19 04:02:13,799 - optuna.study.study - INFO - Trial 166 finished with value: 0.070149022641655 and parameters: {'n_layers': 1, 'embedding_dim': 32, 'lr': 0.0013456777097010414, 'lambda_val': 0.0019748154590363528, 'batch_size': 595, 'optimizer': 'Adam'}. Best is trial 133 with value: 0.07401608033989727.
2026-05-19 04:02:26,244 - optuna.study._optimize - INFO - Trial 167 pruned. 
2026-05-19 04:02:42,383 - experiment_functions - INFO - Early stopping at epoch 1100. Best Recall: 0.0652
2026-05-19 04:02:42,460 - optuna.study.study - INFO - Trial 168 finished with value: 0.06522330208530591 and parameters: {'n_layers': 1, 'embedding_dim': 32, 'lr': 0.001380076464104133, 'lambda_val': 0.0016563926949956982, 'batch_size': 588, 'optimizer': 'Adam'}. Best is trial 133 with value: 0.07401608033989727.
2026-05-19 04:02:58,581 - experiment_functions - INFO - Early stopping at epoch 1200. Best Recall: 0.0656
2026-05-19 04:02:58,683 - optuna.study.study - INFO - Trial 169 finished with value: 0.06557227207160107 and parameters: {'n_layers': 1, 'embedding_dim': 64, 'lr': 0.0011002883095230192, 'lambda_val': 0.0030964827964059466, 'batch_size': 607, 'optimizer': 'Adam'}. Best is trial 133 with value: 0.07401608033989727.
2026-05-19 04:03:24,783 - experiment_functions - INFO - Early stopping at epoch 2000. Best Recall: 0.0694
2026-05-19 04:03:24,851 - optuna.study.study - INFO - Trial 170 finished with value: 0.06942934719655007 and parameters: {'n_layers': 1, 'embedding_dim': 32, 'lr': 0.0007194075838281792, 'lambda_val': 0.0019451750406698253, 'batch_size': 921, 'optimizer': 'Adam'}. Best is trial 133 with value: 0.07401608033989727.
2026-05-19 04:03:37,991 - optuna.study._optimize - INFO - Trial 171 pruned. 
2026-05-19 04:04:08,967 - experiment_functions - INFO - Early stopping at epoch 2200. Best Recall: 0.0703
2026-05-19 04:04:09,077 - optuna.study.study - INFO - Trial 172 finished with value: 0.07032815506908914 and parameters: {'n_layers': 1, 'embedding_dim': 32, 'lr': 0.0008640986403848002, 'lambda_val': 0.001813248045525117, 'batch_size': 704, 'optimizer': 'Adam'}. Best is trial 133 with value: 0.07401608033989727.
2026-05-19 04:04:22,267 - optuna.study._optimize - INFO - Trial 173 pruned. 
2026-05-19 04:04:41,843 - experiment_functions - INFO - Early stopping at epoch 1450. Best Recall: 0.0690
2026-05-19 04:04:41,934 - optuna.study.study - INFO - Trial 174 finished with value: 0.06900380810888264 and parameters: {'n_layers': 1, 'embedding_dim': 32, 'lr': 0.0009125781120774705, 'lambda_val': 0.002401678195118006, 'batch_size': 810, 'optimizer': 'Adam'}. Best is trial 133 with value: 0.07401608033989727.
2026-05-19 04:04:58,260 - optuna.study._optimize - INFO - Trial 175 pruned. 
2026-05-19 04:05:12,544 - experiment_functions - INFO - Early stopping at epoch 950. Best Recall: 0.0598
2026-05-19 04:05:12,645 - optuna.study.study - INFO - Trial 176 finished with value: 0.059779139158474624 and parameters: {'n_layers': 1, 'embedding_dim': 256, 'lr': 0.0013035279275102703, 'lambda_val': 0.0011678451660588345, 'batch_size': 627, 'optimizer': 'Adam'}. Best is trial 133 with value: 0.07401608033989727.
2026-05-19 04:05:38,600 - experiment_functions - INFO - Early stopping at epoch 1750. Best Recall: 0.0684
2026-05-19 04:05:38,699 - optuna.study.study - INFO - Trial 177 finished with value: 0.06840677419330961 and parameters: {'n_layers': 1, 'embedding_dim': 32, 'lr': 0.0008578099482884255, 'lambda_val': 0.0029454358331628943, 'batch_size': 708, 'optimizer': 'Adam'}. Best is trial 133 with value: 0.07401608033989727.
2026-05-19 04:05:52,568 - experiment_functions - INFO - Early stopping at epoch 950. Best Recall: 0.0649
2026-05-19 04:05:52,668 - optuna.study.study - INFO - Trial 178 finished with value: 0.06485836387359088 and parameters: {'n_layers': 1, 'embedding_dim': 32, 'lr': 0.0015830703651200824, 'lambda_val': 0.0007965563398521511, 'batch_size': 932, 'optimizer': 'Adam'}. Best is trial 133 with value: 0.07401608033989727.
2026-05-19 04:06:01,858 - experiment_functions - INFO - Early stopping at epoch 500. Best Recall: 0.0052
