2026-05-19 01:52:51,382 - optuna.study.study - INFO - Trial 299 finished with value: 0.07264447304081734 and parameters: {'n_layers': 1, 'embedding_dim': 96, 'lr': 0.0006894656835224387, 'lambda_val': 0.0006371971774294079, 'batch_size': 512, 'optimizer': 'RMSprop'}. Best is trial 299 with value: 0.07264447304081734.
2026-05-19 01:53:18,306 - experiment_functions - INFO - Early stopping at epoch 2300. Best Recall: 0.0720
2026-05-19 01:53:19,214 - root - INFO -   **** Training e_1M_1c3dcs_rand3
2026-05-19 01:53:19,273 - root - INFO -   **** Getting 221091/805443 random edges
2026-05-19 01:53:19,430 - optuna.storages._rdb.storage - INFO - A new study created in RDB with name: Study_e_1M_1c3dcs_rand3
2026-05-19 01:53:28,813 - experiment_functions - INFO - Early stopping at epoch 500. Best Recall: 0.0049
2026-05-19 01:53:28,904 - optuna.study.study - INFO - Trial 0 finished with value: 0.004926043841481695 and parameters: {'n_layers': 3, 'embedding_dim': 256, 'lr': 0.003437715410801765, 'lambda_val': 0.002097371354111413, 'batch_size': 3637, 'optimizer': 'SGD'}. Best is trial 0 with value: 0.004926043841481695.
2026-05-19 01:54:32,473 - optuna.study.study - INFO - Trial 1 finished with value: 0.042243858460768544 and parameters: {'n_layers': 1, 'embedding_dim': 64, 'lr': 0.00021855948788630135, 'lambda_val': 9.255235894560226e-05, 'batch_size': 2630, 'optimizer': 'RMSprop'}. Best is trial 1 with value: 0.042243858460768544.
2026-05-19 01:54:43,799 - experiment_functions - INFO - Early stopping at epoch 500. Best Recall: 0.0052
2026-05-19 01:54:43,901 - optuna.study.study - INFO - Trial 2 finished with value: 0.005192185477867473 and parameters: {'n_layers': 2, 'embedding_dim': 64, 'lr': 0.0011220304882420403, 'lambda_val': 1.065689677042841e-06, 'batch_size': 2567, 'optimizer': 'SGD'}. Best is trial 1 with value: 0.042243858460768544.
2026-05-19 01:54:52,851 - experiment_functions - INFO - Early stopping at epoch 550. Best Recall: 0.0235
2026-05-19 01:54:52,982 - optuna.study.study - INFO - Trial 3 finished with value: 0.023463048575835754 and parameters: {'n_layers': 4, 'embedding_dim': 96, 'lr': 0.004845893629581034, 'lambda_val': 0.005209152560313894, 'batch_size': 656, 'optimizer': 'Adam'}. Best is trial 1 with value: 0.042243858460768544.
2026-05-19 01:55:00,620 - experiment_functions - INFO - Early stopping at epoch 500. Best Recall: 0.0053
2026-05-19 01:55:00,708 - optuna.study.study - INFO - Trial 4 finished with value: 0.005266249035033015 and parameters: {'n_layers': 3, 'embedding_dim': 64, 'lr': 0.004589604128635869, 'lambda_val': 0.021616158705904935, 'batch_size': 1055, 'optimizer': 'SGD'}. Best is trial 1 with value: 0.042243858460768544.
2026-05-19 01:55:13,957 - experiment_functions - INFO - Early stopping at epoch 750. Best Recall: 0.0557
2026-05-19 01:55:14,063 - optuna.study.study - INFO - Trial 5 finished with value: 0.05570358081830177 and parameters: {'n_layers': 2, 'embedding_dim': 256, 'lr': 0.0004983775243642137, 'lambda_val': 5.903601812347291e-06, 'batch_size': 1271, 'optimizer': 'RMSprop'}. Best is trial 5 with value: 0.05570358081830177.
2026-05-19 01:55:32,459 - optuna.study._optimize - INFO - Trial 6 pruned. 
2026-05-19 01:55:57,204 - optuna.study._optimize - INFO - Trial 7 pruned. 
2026-05-19 01:56:04,641 - experiment_functions - INFO - Early stopping at epoch 500. Best Recall: 0.0055
2026-05-19 01:56:04,775 - optuna.study.study - INFO - Trial 8 finished with value: 0.005483635280295135 and parameters: {'n_layers': 3, 'embedding_dim': 32, 'lr': 0.00012878714652384611, 'lambda_val': 1.6411972874423787e-06, 'batch_size': 2300, 'optimizer': 'SGD'}. Best is trial 5 with value: 0.05570358081830177.
2026-05-19 01:56:12,881 - experiment_functions - INFO - Early stopping at epoch 500. Best Recall: 0.0049
2026-05-19 01:56:12,981 - optuna.study.study - INFO - Trial 9 finished with value: 0.004945726349257947 and parameters: {'n_layers': 2, 'embedding_dim': 64, 'lr': 0.0018312147474157045, 'lambda_val': 3.994790653475363e-05, 'batch_size': 3384, 'optimizer': 'SGD'}. Best is trial 5 with value: 0.05570358081830177.
2026-05-19 01:56:37,008 - optuna.study._optimize - INFO - Trial 10 pruned. 
2026-05-19 01:56:50,523 - optuna.study._optimize - INFO - Trial 11 pruned. 
2026-05-19 01:57:04,625 - optuna.study._optimize - INFO - Trial 12 pruned. 
2026-05-19 01:57:26,846 - experiment_functions - INFO - Early stopping at epoch 1400. Best Recall: 0.0563
2026-05-19 01:57:27,301 - optuna.study.study - INFO - Trial 13 finished with value: 0.056307181733068666 and parameters: {'n_layers': 2, 'embedding_dim': 96, 'lr': 0.0003452132727724633, 'lambda_val': 8.27096848361822e-06, 'batch_size': 1726, 'optimizer': 'RMSprop'}. Best is trial 13 with value: 0.056307181733068666.
2026-05-19 01:57:44,611 - experiment_functions - INFO - Early stopping at epoch 900. Best Recall: 0.0200
2026-05-19 01:57:45,377 - optuna.study.study - INFO - Trial 14 finished with value: 0.020031636653882825 and parameters: {'n_layers': 2, 'embedding_dim': 96, 'lr': 0.023852243166949776, 'lambda_val': 7.08627785336652e-06, 'batch_size': 1749, 'optimizer': 'RMSprop'}. Best is trial 13 with value: 0.056307181733068666.
2026-05-19 01:58:04,812 - experiment_functions - INFO - Early stopping at epoch 900. Best Recall: 0.0492
2026-05-19 01:58:04,956 - optuna.study.study - INFO - Trial 15 finished with value: 0.049158504840503894 and parameters: {'n_layers': 2, 'embedding_dim': 96, 'lr': 0.0004856498113054851, 'lambda_val': 6.215930315663027e-06, 'batch_size': 1217, 'optimizer': 'RMSprop'}. Best is trial 13 with value: 0.056307181733068666.
2026-05-19 01:58:16,360 - experiment_functions - INFO - Early stopping at epoch 550. Best Recall: 0.0054
2026-05-19 01:58:16,450 - optuna.study.study - INFO - Trial 16 finished with value: 0.005435448133556084 and parameters: {'n_layers': 4, 'embedding_dim': 256, 'lr': 2.9958693964697427e-05, 'lambda_val': 4.061339760025256e-06, 'batch_size': 627, 'optimizer': 'Adam'}. Best is trial 13 with value: 0.056307181733068666.
2026-05-19 01:58:30,409 - experiment_functions - INFO - Early stopping at epoch 800. Best Recall: 0.0497
2026-05-19 01:58:30,500 - optuna.study.study - INFO - Trial 17 finished with value: 0.0496805782382478 and parameters: {'n_layers': 2, 'embedding_dim': 96, 'lr': 0.000534737361645856, 'lambda_val': 2.451834733632333e-05, 'batch_size': 1903, 'optimizer': 'RMSprop'}. Best is trial 13 with value: 0.056307181733068666.
2026-05-19 01:58:45,428 - optuna.study._optimize - INFO - Trial 18 pruned. 
2026-05-19 01:58:53,451 - experiment_functions - INFO - Early stopping at epoch 500. Best Recall: 0.0050
2026-05-19 01:58:53,540 - optuna.study.study - INFO - Trial 19 finished with value: 0.004990690923494018 and parameters: {'n_layers': 1, 'embedding_dim': 256, 'lr': 6.474708467107267e-05, 'lambda_val': 0.06729466874119665, 'batch_size': 1959, 'optimizer': 'RMSprop'}. Best is trial 13 with value: 0.056307181733068666.
2026-05-19 01:59:08,980 - experiment_functions - INFO - Early stopping at epoch 1000. Best Recall: 0.0501
2026-05-19 01:59:09,123 - optuna.study.study - INFO - Trial 20 finished with value: 0.05008034474409172 and parameters: {'n_layers': 2, 'embedding_dim': 128, 'lr': 0.00037118565811134044, 'lambda_val': 2.738097102680397e-06, 'batch_size': 2991, 'optimizer': 'Adam'}. Best is trial 13 with value: 0.056307181733068666.
2026-05-19 01:59:23,579 - experiment_functions - INFO - Early stopping at epoch 800. Best Recall: 0.0489
2026-05-19 01:59:23,712 - optuna.study.study - INFO - Trial 21 finished with value: 0.048911857018654595 and parameters: {'n_layers': 2, 'embedding_dim': 128, 'lr': 0.0005399008302136617, 'lambda_val': 2.909499020394156e-06, 'batch_size': 3071, 'optimizer': 'Adam'}. Best is trial 13 with value: 0.056307181733068666.
2026-05-19 01:59:43,284 - experiment_functions - INFO - Early stopping at epoch 1200. Best Recall: 0.0499
2026-05-19 01:59:43,474 - optuna.study.study - INFO - Trial 22 finished with value: 0.04986416228427582 and parameters: {'n_layers': 2, 'embedding_dim': 128, 'lr': 0.0003207362334302995, 'lambda_val': 1.2025951906121926e-05, 'batch_size': 3043, 'optimizer': 'Adam'}. Best is trial 13 with value: 0.056307181733068666.
2026-05-19 01:59:56,566 - experiment_functions - INFO - Early stopping at epoch 700. Best Recall: 0.0488
2026-05-19 01:59:57,342 - optuna.study.study - INFO - Trial 23 finished with value: 0.04875367785484752 and parameters: {'n_layers': 2, 'embedding_dim': 128, 'lr': 0.0009436197242572822, 'lambda_val': 2.5660208713408334e-06, 'batch_size': 2161, 'optimizer': 'Adam'}. Best is trial 13 with value: 0.056307181733068666.
2026-05-19 02:00:18,539 - optuna.study._optimize - INFO - Trial 24 pruned. 
2026-05-19 02:00:28,518 - experiment_functions - INFO - Early stopping at epoch 550. Best Recall: 0.0451
2026-05-19 02:00:28,652 - optuna.study.study - INFO - Trial 25 finished with value: 0.04512779545640282 and parameters: {'n_layers': 2, 'embedding_dim': 256, 'lr': 0.001070443177260599, 'lambda_val': 1.7372413033710623e-05, 'batch_size': 880, 'optimizer': 'RMSprop'}. Best is trial 13 with value: 0.056307181733068666.
2026-05-19 02:00:44,072 - optuna.study._optimize - INFO - Trial 26 pruned. 
2026-05-19 02:01:00,349 - optuna.study._optimize - INFO - Trial 27 pruned. 
2026-05-19 02:01:17,773 - optuna.study._optimize - INFO - Trial 28 pruned. 
2026-05-19 02:01:29,266 - experiment_functions - INFO - Early stopping at epoch 550. Best Recall: 0.0313
2026-05-19 02:01:29,565 - optuna.study.study - INFO - Trial 29 finished with value: 0.031323486450954056 and parameters: {'n_layers': 4, 'embedding_dim': 256, 'lr': 0.0021482046998829414, 'lambda_val': 4.711058931705828e-05, 'batch_size': 3594, 'optimizer': 'Adam'}. Best is trial 13 with value: 0.056307181733068666.
2026-05-19 02:01:37,314 - experiment_functions - INFO - Early stopping at epoch 500. Best Recall: 0.0051
2026-05-19 02:01:37,476 - optuna.study.study - INFO - Trial 30 finished with value: 0.005147328021406115 and parameters: {'n_layers': 1, 'embedding_dim': 128, 'lr': 0.00039978989617498503, 'lambda_val': 2.9902523649392155e-06, 'batch_size': 3322, 'optimizer': 'SGD'}. Best is trial 13 with value: 0.056307181733068666.
2026-05-19 02:02:05,278 - experiment_functions - INFO - Early stopping at epoch 1150. Best Recall: 0.0478
2026-05-19 02:02:05,424 - optuna.study.study - INFO - Trial 31 finished with value: 0.04779750207377211 and parameters: {'n_layers': 2, 'embedding_dim': 128, 'lr': 0.00032491106411532714, 'lambda_val': 1.0535885800821765e-05, 'batch_size': 2840, 'optimizer': 'Adam'}. Best is trial 13 with value: 0.056307181733068666.
2026-05-19 02:02:27,004 - experiment_functions - INFO - Early stopping at epoch 1250. Best Recall: 0.0435
2026-05-19 02:02:27,099 - optuna.study.study - INFO - Trial 32 finished with value: 0.04348796060488343 and parameters: {'n_layers': 2, 'embedding_dim': 128, 'lr': 0.00027878327397859654, 'lambda_val': 2.11392889104307e-05, 'batch_size': 3892, 'optimizer': 'Adam'}. Best is trial 13 with value: 0.056307181733068666.
2026-05-19 02:02:41,932 - optuna.study._optimize - INFO - Trial 33 pruned. 
2026-05-19 02:02:54,211 - experiment_functions - INFO - Early stopping at epoch 700. Best Recall: 0.0503
2026-05-19 02:02:55,136 - optuna.study.study - INFO - Trial 34 finished with value: 0.05034260349312551 and parameters: {'n_layers': 2, 'embedding_dim': 128, 'lr': 0.0007930464522497559, 'lambda_val': 1.6841017588753149e-06, 'batch_size': 2997, 'optimizer': 'Adam'}. Best is trial 13 with value: 0.056307181733068666.
2026-05-19 02:03:06,678 - experiment_functions - INFO - Early stopping at epoch 700. Best Recall: 0.0341
2026-05-19 02:03:06,757 - optuna.study.study - INFO - Trial 35 finished with value: 0.034068331020993776 and parameters: {'n_layers': 3, 'embedding_dim': 64, 'lr': 0.000839972395699094, 'lambda_val': 1.0830775619438421e-06, 'batch_size': 3383, 'optimizer': 'Adam'}. Best is trial 13 with value: 0.056307181733068666.
2026-05-19 02:03:15,380 - experiment_functions - INFO - Early stopping at epoch 500. Best Recall: 0.0049
2026-05-19 02:03:15,469 - optuna.study.study - INFO - Trial 36 finished with value: 0.004949376285577093 and parameters: {'n_layers': 2, 'embedding_dim': 256, 'lr': 0.0014874761823243452, 'lambda_val': 1.9909175823901166e-06, 'batch_size': 2413, 'optimizer': 'SGD'}. Best is trial 13 with value: 0.056307181733068666.
2026-05-19 02:03:24,478 - experiment_functions - INFO - Early stopping at epoch 600. Best Recall: 0.0345
2026-05-19 02:03:24,557 - optuna.study.study - INFO - Trial 37 finished with value: 0.03451554246410546 and parameters: {'n_layers': 3, 'embedding_dim': 32, 'lr': 0.0008074795402238313, 'lambda_val': 3.552257167214471e-06, 'batch_size': 2699, 'optimizer': 'RMSprop'}. Best is trial 13 with value: 0.056307181733068666.
2026-05-19 02:03:34,138 - experiment_functions - INFO - Early stopping at epoch 650. Best Recall: 0.0592
2026-05-19 02:03:34,231 - optuna.study.study - INFO - Trial 38 finished with value: 0.05922117932002589 and parameters: {'n_layers': 1, 'embedding_dim': 64, 'lr': 0.0032009415230078468, 'lambda_val': 0.008059329497348798, 'batch_size': 812, 'optimizer': 'Adam'}. Best is trial 38 with value: 0.05922117932002589.
2026-05-19 02:03:45,152 - experiment_functions - INFO - Early stopping at epoch 550. Best Recall: 0.0199
2026-05-19 02:03:45,241 - optuna.study.study - INFO - Trial 39 finished with value: 0.01988725499230312 and parameters: {'n_layers': 1, 'embedding_dim': 64, 'lr': 0.004078770414869773, 'lambda_val': 0.005649649750544978, 'batch_size': 833, 'optimizer': 'RMSprop'}. Best is trial 38 with value: 0.05922117932002589.
2026-05-19 02:03:52,774 - experiment_functions - INFO - Early stopping at epoch 500. Best Recall: 0.0058
2026-05-19 02:03:52,872 - optuna.study.study - INFO - Trial 40 finished with value: 0.005843881994957282 and parameters: {'n_layers': 1, 'embedding_dim': 64, 'lr': 0.006755056078925815, 'lambda_val': 0.007670627662610784, 'batch_size': 826, 'optimizer': 'SGD'}. Best is trial 38 with value: 0.05922117932002589.
2026-05-19 02:04:01,894 - experiment_functions - INFO - Early stopping at epoch 600. Best Recall: 0.0514
2026-05-19 02:04:01,984 - optuna.study.study - INFO - Trial 41 finished with value: 0.051363462132881475 and parameters: {'n_layers': 2, 'embedding_dim': 64, 'lr': 0.0022903481622604275, 'lambda_val': 0.0024834545459132182, 'batch_size': 1458, 'optimizer': 'Adam'}. Best is trial 38 with value: 0.05922117932002589.
2026-05-19 02:04:16,887 - experiment_functions - INFO - Early stopping at epoch 650. Best Recall: 0.0616
2026-05-19 02:04:16,992 - optuna.study.study - INFO - Trial 42 finished with value: 0.06157159626177081 and parameters: {'n_layers': 1, 'embedding_dim': 64, 'lr': 0.0026523201003769434, 'lambda_val': 0.0023636216040236204, 'batch_size': 1444, 'optimizer': 'Adam'}. Best is trial 42 with value: 0.06157159626177081.
2026-05-19 02:04:27,416 - experiment_functions - INFO - Early stopping at epoch 700. Best Recall: 0.0589
2026-05-19 02:04:27,515 - optuna.study.study - INFO - Trial 43 finished with value: 0.05887419261833933 and parameters: {'n_layers': 1, 'embedding_dim': 64, 'lr': 0.002584576714893424, 'lambda_val': 0.0019105870183587137, 'batch_size': 1465, 'optimizer': 'Adam'}. Best is trial 42 with value: 0.06157159626177081.
2026-05-19 02:04:36,347 - experiment_functions - INFO - Early stopping at epoch 600. Best Recall: 0.0475
2026-05-19 02:04:36,516 - optuna.study.study - INFO - Trial 44 finished with value: 0.04747730273927779 and parameters: {'n_layers': 1, 'embedding_dim': 64, 'lr': 0.0032112479867580173, 'lambda_val': 0.020222255205009376, 'batch_size': 1170, 'optimizer': 'Adam'}. Best is trial 42 with value: 0.06157159626177081.
2026-05-19 02:04:44,840 - experiment_functions - INFO - Early stopping at epoch 550. Best Recall: 0.0358
2026-05-19 02:04:44,929 - optuna.study.study - INFO - Trial 45 finished with value: 0.03581276125472964 and parameters: {'n_layers': 1, 'embedding_dim': 64, 'lr': 0.016891650727370956, 'lambda_val': 0.0015329183678077095, 'batch_size': 1495, 'optimizer': 'Adam'}. Best is trial 42 with value: 0.06157159626177081.
2026-05-19 02:04:55,983 - experiment_functions - INFO - Early stopping at epoch 600. Best Recall: 0.0569
2026-05-19 02:04:56,081 - optuna.study.study - INFO - Trial 46 finished with value: 0.05688286333303113 and parameters: {'n_layers': 1, 'embedding_dim': 64, 'lr': 0.0015644184830094735, 'lambda_val': 0.011760956413859748, 'batch_size': 1308, 'optimizer': 'RMSprop'}. Best is trial 42 with value: 0.06157159626177081.
2026-05-19 02:05:07,977 - experiment_functions - INFO - Early stopping at epoch 800. Best Recall: 0.0640
2026-05-19 02:05:08,108 - optuna.study.study - INFO - Trial 47 finished with value: 0.06401754977421206 and parameters: {'n_layers': 1, 'embedding_dim': 64, 'lr': 0.001548920275126679, 'lambda_val': 0.015069352357251195, 'batch_size': 945, 'optimizer': 'Adam'}. Best is trial 47 with value: 0.06401754977421206.
2026-05-19 02:05:17,259 - experiment_functions - INFO - Early stopping at epoch 600. Best Recall: 0.0485
2026-05-19 02:05:17,366 - optuna.study.study - INFO - Trial 48 finished with value: 0.04850850328673026 and parameters: {'n_layers': 1, 'embedding_dim': 64, 'lr': 0.006275610927012748, 'lambda_val': 0.013659401830143525, 'batch_size': 562, 'optimizer': 'Adam'}. Best is trial 47 with value: 0.06401754977421206.
2026-05-19 02:05:32,003 - experiment_functions - INFO - Early stopping at epoch 800. Best Recall: 0.0486
2026-05-19 02:05:32,093 - optuna.study.study - INFO - Trial 49 finished with value: 0.04861855743315128 and parameters: {'n_layers': 1, 'embedding_dim': 64, 'lr': 0.001614247243556259, 'lambda_val': 0.05211570639310298, 'batch_size': 975, 'optimizer': 'Adam'}. Best is trial 47 with value: 0.06401754977421206.
2026-05-19 02:05:41,447 - experiment_functions - INFO - Early stopping at epoch 650. Best Recall: 0.0576
2026-05-19 02:05:41,548 - optuna.study.study - INFO - Trial 50 finished with value: 0.057620420127069846 and parameters: {'n_layers': 1, 'embedding_dim': 64, 'lr': 0.0031446455915635535, 'lambda_val': 0.035987626343808546, 'batch_size': 708, 'optimizer': 'Adam'}. Best is trial 47 with value: 0.06401754977421206.
2026-05-19 02:05:50,895 - experiment_functions - INFO - Early stopping at epoch 650. Best Recall: 0.0601
2026-05-19 02:05:50,993 - optuna.study.study - INFO - Trial 51 finished with value: 0.06010371579937456 and parameters: {'n_layers': 1, 'embedding_dim': 64, 'lr': 0.003058573102846232, 'lambda_val': 0.03466569528327218, 'batch_size': 721, 'optimizer': 'Adam'}. Best is trial 47 with value: 0.06401754977421206.
2026-05-19 02:06:07,296 - experiment_functions - INFO - Early stopping at epoch 650. Best Recall: 0.0532
2026-05-19 02:06:08,064 - optuna.study.study - INFO - Trial 52 finished with value: 0.05318267366935252 and parameters: {'n_layers': 1, 'embedding_dim': 64, 'lr': 0.003069220857873608, 'lambda_val': 0.03906142224935292, 'batch_size': 705, 'optimizer': 'Adam'}. Best is trial 47 with value: 0.06401754977421206.
2026-05-19 02:06:21,402 - experiment_functions - INFO - Early stopping at epoch 600. Best Recall: 0.0532
2026-05-19 02:06:21,529 - optuna.study.study - INFO - Trial 53 finished with value: 0.053187110277644556 and parameters: {'n_layers': 1, 'embedding_dim': 64, 'lr': 0.004856497853444858, 'lambda_val': 0.029789878159719178, 'batch_size': 714, 'optimizer': 'Adam'}. Best is trial 47 with value: 0.06401754977421206.
2026-05-19 02:06:29,811 - experiment_functions - INFO - Early stopping at epoch 550. Best Recall: 0.0154
2026-05-19 02:06:29,903 - optuna.study.study - INFO - Trial 54 finished with value: 0.015364948343216061 and parameters: {'n_layers': 1, 'embedding_dim': 64, 'lr': 0.013525449953377424, 'lambda_val': 0.08730493160199189, 'batch_size': 1036, 'optimizer': 'Adam'}. Best is trial 47 with value: 0.06401754977421206.
2026-05-19 02:06:39,080 - experiment_functions - INFO - Early stopping at epoch 550. Best Recall: 0.0590
2026-05-19 02:06:39,173 - optuna.study.study - INFO - Trial 55 finished with value: 0.059019261409425976 and parameters: {'n_layers': 1, 'embedding_dim': 64, 'lr': 0.00960965789401486, 'lambda_val': 0.003187973413891687, 'batch_size': 1165, 'optimizer': 'Adam'}. Best is trial 47 with value: 0.06401754977421206.
2026-05-19 02:06:53,097 - optuna.study._optimize - INFO - Trial 56 pruned. 
2026-05-19 02:07:01,934 - experiment_functions - INFO - Early stopping at epoch 550. Best Recall: 0.0470
2026-05-19 02:07:02,037 - optuna.study.study - INFO - Trial 57 finished with value: 0.047017537433774764 and parameters: {'n_layers': 1, 'embedding_dim': 64, 'lr': 0.009423045166834485, 'lambda_val': 0.001353605513304199, 'batch_size': 514, 'optimizer': 'Adam'}. Best is trial 47 with value: 0.06401754977421206.
2026-05-19 02:07:16,764 - optuna.study._optimize - INFO - Trial 58 pruned. 
2026-05-19 02:07:28,527 - experiment_functions - INFO - Early stopping at epoch 600. Best Recall: 0.0551
2026-05-19 02:07:28,631 - optuna.study.study - INFO - Trial 59 finished with value: 0.05513048001670402 and parameters: {'n_layers': 1, 'embedding_dim': 64, 'lr': 0.004547072673624799, 'lambda_val': 0.00816249700094512, 'batch_size': 1546, 'optimizer': 'Adam'}. Best is trial 47 with value: 0.06401754977421206.
2026-05-19 02:07:37,045 - experiment_functions - INFO - Early stopping at epoch 550. Best Recall: 0.0613
2026-05-19 02:07:37,149 - optuna.study.study - INFO - Trial 60 finished with value: 0.061330310627295354 and parameters: {'n_layers': 1, 'embedding_dim': 64, 'lr': 0.010220327962270124, 'lambda_val': 0.0006038867441642894, 'batch_size': 1268, 'optimizer': 'Adam'}. Best is trial 47 with value: 0.06401754977421206.
2026-05-19 02:07:47,099 - experiment_functions - INFO - Early stopping at epoch 600. Best Recall: 0.0479
