2026-05-18 02:22:24,422 - optuna.study.study - INFO - Trial 10 finished with value: 0.022189298053995523 and parameters: {'n_layers': 3, 'embedding_dim': 64, 'lr': 0.05760578699653628, 'lambda_val': 0.0016721717737592057, 'batch_size': 2924, 'optimizer': 'Adam'}. Best is trial 9 with value: 0.03439506216236266.
2026-05-18 02:22:35,355 - experiment_functions - INFO - Early stopping at epoch 650. Best Recall: 0.0339
2026-05-18 02:22:35,458 - optuna.study.study - INFO - Trial 11 finished with value: 0.0338713905531859 and parameters: {'n_layers': 4, 'embedding_dim': 32, 'lr': 0.0007223619115701019, 'lambda_val': 0.0010058677774957541, 'batch_size': 2202, 'optimizer': 'RMSprop'}. Best is trial 9 with value: 0.03439506216236266.
2026-05-18 02:22:47,930 - experiment_functions - INFO - Early stopping at epoch 750. Best Recall: 0.0264
2026-05-18 02:22:48,697 - optuna.study.study - INFO - Trial 12 finished with value: 0.026401503239654966 and parameters: {'n_layers': 4, 'embedding_dim': 32, 'lr': 0.0006830517839198707, 'lambda_val': 0.0012859630165761085, 'batch_size': 2928, 'optimizer': 'Adam'}. Best is trial 9 with value: 0.03439506216236266.
2026-05-18 02:23:43,813 - experiment_functions - INFO - Early stopping at epoch 3550. Best Recall: 0.0564
2026-05-18 02:23:43,911 - optuna.study.study - INFO - Trial 13 finished with value: 0.05636682877379237 and parameters: {'n_layers': 2, 'embedding_dim': 128, 'lr': 0.00022025209395790465, 'lambda_val': 0.0016018604351900126, 'batch_size': 1558, 'optimizer': 'Adam'}. Best is trial 13 with value: 0.05636682877379237.
2026-05-18 02:23:58,885 - experiment_functions - INFO - Early stopping at epoch 600. Best Recall: 0.0062
2026-05-18 02:23:59,663 - optuna.study.study - INFO - Trial 14 finished with value: 0.006214845790132482 and parameters: {'n_layers': 2, 'embedding_dim': 128, 'lr': 2.4106752711083942e-05, 'lambda_val': 0.006091819299121025, 'batch_size': 1397, 'optimizer': 'Adam'}. Best is trial 13 with value: 0.05636682877379237.
2026-05-18 02:25:01,953 - experiment_functions - INFO - Early stopping at epoch 3800. Best Recall: 0.0513
2026-05-18 02:25:02,043 - optuna.study.study - INFO - Trial 15 finished with value: 0.051336390412302514 and parameters: {'n_layers': 2, 'embedding_dim': 128, 'lr': 0.00017857600074646559, 'lambda_val': 0.00024258758578641514, 'batch_size': 2822, 'optimizer': 'Adam'}. Best is trial 13 with value: 0.05636682877379237.
2026-05-18 02:25:12,236 - experiment_functions - INFO - Early stopping at epoch 650. Best Recall: 0.0212
2026-05-18 02:25:12,337 - optuna.study.study - INFO - Trial 16 finished with value: 0.02117728595306084 and parameters: {'n_layers': 2, 'embedding_dim': 128, 'lr': 0.0024048792777265787, 'lambda_val': 0.09398859966346969, 'batch_size': 1647, 'optimizer': 'Adam'}. Best is trial 13 with value: 0.05636682877379237.
2026-05-18 02:26:00,125 - experiment_functions - INFO - Early stopping at epoch 3200. Best Recall: 0.0541
2026-05-18 02:26:00,249 - optuna.study.study - INFO - Trial 17 finished with value: 0.05412494835964932 and parameters: {'n_layers': 2, 'embedding_dim': 128, 'lr': 0.00028045409176416866, 'lambda_val': 0.0002639341106354547, 'batch_size': 1130, 'optimizer': 'Adam'}. Best is trial 13 with value: 0.05636682877379237.
2026-05-18 02:26:22,880 - experiment_functions - INFO - Early stopping at epoch 1500. Best Recall: 0.0535
2026-05-18 02:26:22,990 - optuna.study.study - INFO - Trial 18 finished with value: 0.0534912206664033 and parameters: {'n_layers': 2, 'embedding_dim': 128, 'lr': 0.0003200591956143229, 'lambda_val': 0.005821117676901799, 'batch_size': 1072, 'optimizer': 'Adam'}. Best is trial 13 with value: 0.05636682877379237.
2026-05-18 02:26:32,391 - experiment_functions - INFO - Early stopping at epoch 550. Best Recall: 0.0366
2026-05-18 02:26:32,538 - optuna.study.study - INFO - Trial 19 finished with value: 0.03660792813807973 and parameters: {'n_layers': 3, 'embedding_dim': 128, 'lr': 0.0025831553432508958, 'lambda_val': 1.7677810016773793e-05, 'batch_size': 1219, 'optimizer': 'Adam'}. Best is trial 13 with value: 0.05636682877379237.
2026-05-18 02:26:40,078 - experiment_functions - INFO - Early stopping at epoch 500. Best Recall: 0.0057
2026-05-18 02:26:40,180 - optuna.study.study - INFO - Trial 20 finished with value: 0.005661020311563625 and parameters: {'n_layers': 1, 'embedding_dim': 128, 'lr': 0.0003741803552050369, 'lambda_val': 0.0006611606767655051, 'batch_size': 1805, 'optimizer': 'SGD'}. Best is trial 13 with value: 0.05636682877379237.
2026-05-18 02:27:10,575 - experiment_functions - INFO - Early stopping at epoch 2000. Best Recall: 0.0606
2026-05-18 02:27:10,667 - optuna.study.study - INFO - Trial 21 finished with value: 0.060625291975989454 and parameters: {'n_layers': 2, 'embedding_dim': 128, 'lr': 0.0002788331401156126, 'lambda_val': 0.0038588665443192627, 'batch_size': 1234, 'optimizer': 'Adam'}. Best is trial 21 with value: 0.060625291975989454.
2026-05-18 02:27:37,615 - experiment_functions - INFO - Early stopping at epoch 1750. Best Recall: 0.0519
2026-05-18 02:27:37,717 - optuna.study.study - INFO - Trial 22 finished with value: 0.051944730978399974 and parameters: {'n_layers': 2, 'embedding_dim': 128, 'lr': 0.00026995881293054264, 'lambda_val': 0.0036630336686776835, 'batch_size': 1405, 'optimizer': 'Adam'}. Best is trial 21 with value: 0.060625291975989454.
2026-05-18 02:27:52,755 - optuna.study._optimize - INFO - Trial 23 pruned. 
2026-05-18 02:28:01,004 - experiment_functions - INFO - Early stopping at epoch 500. Best Recall: 0.0046
2026-05-18 02:28:01,171 - optuna.study.study - INFO - Trial 24 finished with value: 0.004588190936373984 and parameters: {'n_layers': 2, 'embedding_dim': 128, 'lr': 7.587962312404707e-05, 'lambda_val': 0.01653841103387626, 'batch_size': 1887, 'optimizer': 'Adam'}. Best is trial 21 with value: 0.060625291975989454.
2026-05-18 02:28:11,475 - experiment_functions - INFO - Early stopping at epoch 600. Best Recall: 0.0408
2026-05-18 02:28:11,566 - optuna.study.study - INFO - Trial 25 finished with value: 0.04076132719182696 and parameters: {'n_layers': 3, 'embedding_dim': 128, 'lr': 0.0012823831698006152, 'lambda_val': 0.00012120922709102219, 'batch_size': 1242, 'optimizer': 'Adam'}. Best is trial 21 with value: 0.060625291975989454.
2026-05-18 02:28:25,481 - optuna.study._optimize - INFO - Trial 26 pruned. 
2026-05-18 02:28:36,866 - experiment_functions - INFO - Early stopping at epoch 750. Best Recall: 0.0300
2026-05-18 02:28:36,967 - optuna.study.study - INFO - Trial 27 finished with value: 0.029980168385452977 and parameters: {'n_layers': 2, 'embedding_dim': 96, 'lr': 0.0013924545466309864, 'lambda_val': 0.08438955913755751, 'batch_size': 1536, 'optimizer': 'Adam'}. Best is trial 21 with value: 0.060625291975989454.
2026-05-18 02:29:06,081 - experiment_functions - INFO - Early stopping at epoch 1750. Best Recall: 0.0454
2026-05-18 02:29:06,204 - optuna.study.study - INFO - Trial 28 finished with value: 0.045389188832669694 and parameters: {'n_layers': 3, 'embedding_dim': 128, 'lr': 0.00021260702406027766, 'lambda_val': 0.0005360817269037826, 'batch_size': 1231, 'optimizer': 'Adam'}. Best is trial 21 with value: 0.060625291975989454.
2026-05-18 02:29:14,254 - experiment_functions - INFO - Early stopping at epoch 500. Best Recall: 0.0053
2026-05-18 02:29:14,365 - optuna.study.study - INFO - Trial 29 finished with value: 0.005327310252029685 and parameters: {'n_layers': 2, 'embedding_dim': 96, 'lr': 1.0401760292609217e-05, 'lambda_val': 0.01161249835026826, 'batch_size': 2512, 'optimizer': 'SGD'}. Best is trial 21 with value: 0.060625291975989454.
2026-05-18 02:29:21,726 - experiment_functions - INFO - Early stopping at epoch 500. Best Recall: 0.0045
2026-05-18 02:29:21,840 - optuna.study.study - INFO - Trial 30 finished with value: 0.0045191654781166725 and parameters: {'n_layers': 1, 'embedding_dim': 128, 'lr': 2.0991287602376352e-05, 'lambda_val': 0.04467894192447331, 'batch_size': 2179, 'optimizer': 'Adam'}. Best is trial 21 with value: 0.060625291975989454.
2026-05-18 02:29:36,187 - optuna.study._optimize - INFO - Trial 31 pruned. 
2026-05-18 02:29:54,416 - experiment_functions - INFO - Early stopping at epoch 1250. Best Recall: 0.0522
2026-05-18 02:29:54,495 - optuna.study.study - INFO - Trial 32 finished with value: 0.05219309859532283 and parameters: {'n_layers': 2, 'embedding_dim': 128, 'lr': 0.0003620681697827166, 'lambda_val': 0.009420946513165052, 'batch_size': 1063, 'optimizer': 'Adam'}. Best is trial 21 with value: 0.060625291975989454.
2026-05-18 02:30:08,565 - optuna.study._optimize - INFO - Trial 33 pruned. 
2026-05-18 02:30:38,419 - experiment_functions - INFO - Early stopping at epoch 2050. Best Recall: 0.0633
2026-05-18 02:30:38,512 - optuna.study.study - INFO - Trial 34 finished with value: 0.06330897578378734 and parameters: {'n_layers': 1, 'embedding_dim': 128, 'lr': 0.0005058018501013708, 'lambda_val': 0.0009012869770058619, 'batch_size': 1397, 'optimizer': 'Adam'}. Best is trial 34 with value: 0.06330897578378734.
2026-05-18 02:30:51,991 - optuna.study._optimize - INFO - Trial 35 pruned. 
2026-05-18 02:31:14,127 - experiment_functions - INFO - Early stopping at epoch 1500. Best Recall: 0.0575
2026-05-18 02:31:14,227 - optuna.study.study - INFO - Trial 36 finished with value: 0.05749858764770423 and parameters: {'n_layers': 1, 'embedding_dim': 256, 'lr': 0.0005473633819551831, 'lambda_val': 0.00014331785336307252, 'batch_size': 1458, 'optimizer': 'Adam'}. Best is trial 34 with value: 0.06330897578378734.
2026-05-18 02:31:37,631 - experiment_functions - INFO - Early stopping at epoch 1600. Best Recall: 0.0583
2026-05-18 02:31:37,729 - optuna.study.study - INFO - Trial 37 finished with value: 0.058273835499892755 and parameters: {'n_layers': 1, 'embedding_dim': 256, 'lr': 0.0005281424382530815, 'lambda_val': 4.280121288407535e-05, 'batch_size': 1468, 'optimizer': 'Adam'}. Best is trial 34 with value: 0.06330897578378734.
2026-05-18 02:31:45,444 - experiment_functions - INFO - Early stopping at epoch 500. Best Recall: 0.0054
2026-05-18 02:31:45,545 - optuna.study.study - INFO - Trial 38 finished with value: 0.005369829301131209 and parameters: {'n_layers': 1, 'embedding_dim': 256, 'lr': 0.0010028380492885505, 'lambda_val': 2.7851879810406215e-05, 'batch_size': 1966, 'optimizer': 'SGD'}. Best is trial 34 with value: 0.06330897578378734.
2026-05-18 02:32:01,142 - optuna.study._optimize - INFO - Trial 39 pruned. 
2026-05-18 02:32:45,530 - experiment_functions - INFO - Early stopping at epoch 3150. Best Recall: 0.0608
2026-05-18 02:32:45,632 - optuna.study.study - INFO - Trial 40 finished with value: 0.060800826622341535 and parameters: {'n_layers': 1, 'embedding_dim': 256, 'lr': 0.0005136067536174477, 'lambda_val': 7.337575008803322e-05, 'batch_size': 737, 'optimizer': 'Adam'}. Best is trial 34 with value: 0.06330897578378734.
2026-05-18 02:33:36,260 - experiment_functions - INFO - Early stopping at epoch 2900. Best Recall: 0.0610
2026-05-18 02:33:36,349 - optuna.study.study - INFO - Trial 41 finished with value: 0.06095842090865937 and parameters: {'n_layers': 1, 'embedding_dim': 256, 'lr': 0.000545162645068111, 'lambda_val': 7.770141028630314e-05, 'batch_size': 728, 'optimizer': 'Adam'}. Best is trial 34 with value: 0.06330897578378734.
2026-05-18 02:33:50,594 - experiment_functions - INFO - Early stopping at epoch 950. Best Recall: 0.0577
2026-05-18 02:33:50,695 - optuna.study.study - INFO - Trial 42 finished with value: 0.05769065465709154 and parameters: {'n_layers': 1, 'embedding_dim': 256, 'lr': 0.0014814454637496338, 'lambda_val': 5.968007225094314e-05, 'batch_size': 700, 'optimizer': 'Adam'}. Best is trial 34 with value: 0.06330897578378734.
2026-05-18 02:34:04,785 - optuna.study._optimize - INFO - Trial 43 pruned. 
2026-05-18 02:34:34,510 - experiment_functions - INFO - Early stopping at epoch 2000. Best Recall: 0.0596
2026-05-18 02:34:34,600 - optuna.study.study - INFO - Trial 44 finished with value: 0.05961261192032361 and parameters: {'n_layers': 1, 'embedding_dim': 256, 'lr': 0.0005742684553047284, 'lambda_val': 3.1269627629784117e-06, 'batch_size': 804, 'optimizer': 'Adam'}. Best is trial 34 with value: 0.06330897578378734.
2026-05-18 02:34:53,847 - experiment_functions - INFO - Early stopping at epoch 1300. Best Recall: 0.0636
2026-05-18 02:34:53,987 - optuna.study.study - INFO - Trial 45 finished with value: 0.06359008908397099 and parameters: {'n_layers': 1, 'embedding_dim': 256, 'lr': 0.0006814318751575779, 'lambda_val': 1.5984168853661564e-06, 'batch_size': 718, 'optimizer': 'RMSprop'}. Best is trial 45 with value: 0.06359008908397099.
2026-05-18 02:35:07,343 - experiment_functions - INFO - Early stopping at epoch 850. Best Recall: 0.0589
2026-05-18 02:35:07,433 - optuna.study.study - INFO - Trial 46 finished with value: 0.058863131793133315 and parameters: {'n_layers': 1, 'embedding_dim': 256, 'lr': 0.0009688027712103902, 'lambda_val': 1.1485579724497498e-06, 'batch_size': 755, 'optimizer': 'RMSprop'}. Best is trial 45 with value: 0.06359008908397099.
2026-05-18 02:35:20,236 - experiment_functions - INFO - Early stopping at epoch 900. Best Recall: 0.0105
2026-05-18 02:35:20,327 - optuna.study.study - INFO - Trial 47 finished with value: 0.010525310352748554 and parameters: {'n_layers': 1, 'embedding_dim': 256, 'lr': 0.027962031840793235, 'lambda_val': 8.21540696109309e-06, 'batch_size': 937, 'optimizer': 'RMSprop'}. Best is trial 45 with value: 0.06359008908397099.
2026-05-18 02:35:28,381 - experiment_functions - INFO - Early stopping at epoch 550. Best Recall: 0.0499
2026-05-18 02:35:28,482 - optuna.study.study - INFO - Trial 48 finished with value: 0.04991515756165219 and parameters: {'n_layers': 1, 'embedding_dim': 32, 'lr': 0.0035735413783901295, 'lambda_val': 2.7706458195113835e-06, 'batch_size': 659, 'optimizer': 'RMSprop'}. Best is trial 45 with value: 0.06359008908397099.
2026-05-18 02:35:36,083 - experiment_functions - INFO - Early stopping at epoch 550. Best Recall: 0.0050
2026-05-18 02:35:36,184 - optuna.study.study - INFO - Trial 49 finished with value: 0.005046792707955355 and parameters: {'n_layers': 1, 'embedding_dim': 64, 'lr': 7.371092654638286e-05, 'lambda_val': 0.00010943654954785308, 'batch_size': 524, 'optimizer': 'RMSprop'}. Best is trial 45 with value: 0.06359008908397099.
2026-05-18 02:35:45,294 - experiment_functions - INFO - Early stopping at epoch 550. Best Recall: 0.0405
2026-05-18 02:35:45,383 - optuna.study.study - INFO - Trial 50 finished with value: 0.04047990247333628 and parameters: {'n_layers': 1, 'embedding_dim': 256, 'lr': 0.0018655516965217292, 'lambda_val': 1.722093108309123e-05, 'batch_size': 922, 'optimizer': 'RMSprop'}. Best is trial 45 with value: 0.06359008908397099.
2026-05-18 02:36:03,050 - experiment_functions - INFO - Early stopping at epoch 1200. Best Recall: 0.0600
2026-05-18 02:36:03,195 - optuna.study.study - INFO - Trial 51 finished with value: 0.0600195681012127 and parameters: {'n_layers': 1, 'embedding_dim': 256, 'lr': 0.0008434960861137251, 'lambda_val': 3.914386058258578e-06, 'batch_size': 872, 'optimizer': 'Adam'}. Best is trial 45 with value: 0.06359008908397099.
2026-05-18 02:36:10,652 - experiment_functions - INFO - Early stopping at epoch 500. Best Recall: 0.0053
2026-05-18 02:36:10,754 - optuna.study.study - INFO - Trial 52 finished with value: 0.005259983158390864 and parameters: {'n_layers': 1, 'embedding_dim': 256, 'lr': 0.0008994672679061619, 'lambda_val': 4.712149986912393e-06, 'batch_size': 1227, 'optimizer': 'SGD'}. Best is trial 45 with value: 0.06359008908397099.
2026-05-18 02:36:24,932 - optuna.study._optimize - INFO - Trial 53 pruned. 
2026-05-18 02:36:38,109 - experiment_functions - INFO - Early stopping at epoch 850. Best Recall: 0.0525
2026-05-18 02:36:38,208 - optuna.study.study - INFO - Trial 54 finished with value: 0.05248481831440399 and parameters: {'n_layers': 1, 'embedding_dim': 256, 'lr': 0.0008140011879622257, 'lambda_val': 1.8059653233993956e-06, 'batch_size': 3559, 'optimizer': 'Adam'}. Best is trial 45 with value: 0.06359008908397099.
2026-05-18 02:36:46,413 - experiment_functions - INFO - Early stopping at epoch 550. Best Recall: 0.0573
2026-05-18 02:36:46,503 - optuna.study.study - INFO - Trial 55 finished with value: 0.05734209347063296 and parameters: {'n_layers': 1, 'embedding_dim': 96, 'lr': 0.010896545752637555, 'lambda_val': 1.5516322862824056e-05, 'batch_size': 938, 'optimizer': 'Adam'}. Best is trial 45 with value: 0.06359008908397099.
2026-05-18 02:37:00,291 - optuna.study._optimize - INFO - Trial 56 pruned. 
2026-05-18 02:37:15,112 - experiment_functions - INFO - Early stopping at epoch 1000. Best Recall: 0.0567
2026-05-18 02:37:15,203 - optuna.study.study - INFO - Trial 57 finished with value: 0.056747613567323926 and parameters: {'n_layers': 1, 'embedding_dim': 256, 'lr': 0.001269399021869189, 'lambda_val': 1.7736650425056383e-06, 'batch_size': 658, 'optimizer': 'Adam'}. Best is trial 45 with value: 0.06359008908397099.
2026-05-18 02:37:24,699 - experiment_functions - INFO - Early stopping at epoch 650. Best Recall: 0.0572
2026-05-18 02:37:24,798 - optuna.study.study - INFO - Trial 58 finished with value: 0.05720154490442966 and parameters: {'n_layers': 1, 'embedding_dim': 64, 'lr': 0.0029343557105982877, 'lambda_val': 0.00043174151896314386, 'batch_size': 1287, 'optimizer': 'Adam'}. Best is trial 45 with value: 0.06359008908397099.
2026-05-18 02:37:32,878 - experiment_functions - INFO - Early stopping at epoch 500. Best Recall: 0.0054
2026-05-18 02:37:32,970 - optuna.study.study - INFO - Trial 59 finished with value: 0.0053605025169911735 and parameters: {'n_layers': 1, 'embedding_dim': 256, 'lr': 0.00027381684481356803, 'lambda_val': 0.00020883013767584622, 'batch_size': 1013, 'optimizer': 'SGD'}. Best is trial 45 with value: 0.06359008908397099.
2026-05-18 02:37:43,589 - experiment_functions - INFO - Early stopping at epoch 700. Best Recall: 0.0593
2026-05-18 02:37:43,669 - optuna.study.study - INFO - Trial 60 finished with value: 0.05933275105254145 and parameters: {'n_layers': 1, 'embedding_dim': 256, 'lr': 0.0017892083329208613, 'lambda_val': 7.922789008714161e-05, 'batch_size': 1732, 'optimizer': 'Adam'}. Best is trial 45 with value: 0.06359008908397099.
2026-05-18 02:38:14,084 - experiment_functions - INFO - Early stopping at epoch 2200. Best Recall: 0.0598
2026-05-18 02:38:14,174 - optuna.study.study - INFO - Trial 61 finished with value: 0.05984244986235402 and parameters: {'n_layers': 1, 'embedding_dim': 256, 'lr': 0.000581279272637688, 'lambda_val': 4.20976888301741e-06, 'batch_size': 765, 'optimizer': 'Adam'}. Best is trial 45 with value: 0.06359008908397099.
2026-05-18 02:38:37,402 - experiment_functions - INFO - Early stopping at epoch 1650. Best Recall: 0.0616
2026-05-18 02:38:37,471 - optuna.study.study - INFO - Trial 62 finished with value: 0.0615697195918654 and parameters: {'n_layers': 1, 'embedding_dim': 256, 'lr': 0.0006467421702883616, 'lambda_val': 4.260141512049445e-06, 'batch_size': 819, 'optimizer': 'Adam'}. Best is trial 45 with value: 0.06359008908397099.
2026-05-18 02:38:59,101 - experiment_functions - INFO - Early stopping at epoch 1500. Best Recall: 0.0598
2026-05-18 02:38:59,247 - optuna.study.study - INFO - Trial 63 finished with value: 0.05977638279150565 and parameters: {'n_layers': 1, 'embedding_dim': 256, 'lr': 0.000711391550927622, 'lambda_val': 1.155945769941942e-05, 'batch_size': 841, 'optimizer': 'Adam'}. Best is trial 45 with value: 0.06359008908397099.
2026-05-18 02:39:16,652 - optuna.study._optimize - INFO - Trial 64 pruned. 
2026-05-18 02:39:29,890 - optuna.study._optimize - INFO - Trial 65 pruned. 
2026-05-18 02:39:43,607 - optuna.study._optimize - INFO - Trial 66 pruned. 
2026-05-18 02:39:55,957 - experiment_functions - INFO - Early stopping at epoch 700. Best Recall: 0.0543
2026-05-18 02:39:56,068 - optuna.study.study - INFO - Trial 67 finished with value: 0.05430627590759887 and parameters: {'n_layers': 2, 'embedding_dim': 256, 'lr': 0.0011997788296076067, 'lambda_val': 3.1357975937773668e-06, 'batch_size': 997, 'optimizer': 'Adam'}. Best is trial 45 with value: 0.06359008908397099.
2026-05-18 02:40:08,942 - optuna.study._optimize - INFO - Trial 68 pruned. 
2026-05-18 02:40:23,579 - optuna.study._optimize - INFO - Trial 69 pruned. 
2026-05-18 02:40:39,582 - optuna.study._optimize - INFO - Trial 70 pruned. 
2026-05-18 02:41:02,325 - experiment_functions - INFO - Early stopping at epoch 1500. Best Recall: 0.0607
2026-05-18 02:41:02,426 - optuna.study.study - INFO - Trial 71 finished with value: 0.06071712735453833 and parameters: {'n_layers': 1, 'embedding_dim': 256, 'lr': 0.0006934489911417567, 'lambda_val': 4.119575951170078e-06, 'batch_size': 740, 'optimizer': 'Adam'}. Best is trial 45 with value: 0.06359008908397099.
2026-05-18 02:41:24,140 - experiment_functions - INFO - Early stopping at epoch 1500. Best Recall: 0.0581
2026-05-18 02:41:24,303 - optuna.study.study - INFO - Trial 72 finished with value: 0.0581382092064537 and parameters: {'n_layers': 1, 'embedding_dim': 256, 'lr': 0.0007178516722383474, 'lambda_val': 2.2325550332803174e-06, 'batch_size': 715, 'optimizer': 'Adam'}. Best is trial 45 with value: 0.06359008908397099.
2026-05-18 02:41:40,046 - experiment_functions - INFO - Early stopping at epoch 950. Best Recall: 0.0598
2026-05-18 02:41:40,810 - optuna.study.study - INFO - Trial 73 finished with value: 0.059755896811289684 and parameters: {'n_layers': 1, 'embedding_dim': 256, 'lr': 0.0010070860031416672, 'lambda_val': 6.311813955957064e-06, 'batch_size': 1135, 'optimizer': 'Adam'}. Best is trial 45 with value: 0.06359008908397099.
2026-05-18 02:42:02,881 - experiment_functions - INFO - Early stopping at epoch 750. Best Recall: 0.0385
