2026-05-18 17:24:16,840 - optuna.study.study - INFO - Trial 258 finished with value: 0.0668021257457031 and parameters: {'n_layers': 1, 'embedding_dim': 32, 'lr': 0.0010151016095046933, 'lambda_val': 0.0014880722858722048, 'batch_size': 621, 'optimizer': 'RMSprop'}. Best is trial 253 with value: 0.07466919321678188.
2026-05-18 17:24:30,170 - optuna.study._optimize - INFO - Trial 259 pruned. 
2026-05-18 17:24:59,352 - experiment_functions - INFO - Early stopping at epoch 2100. Best Recall: 0.0757
2026-05-18 17:24:59,500 - optuna.study.study - INFO - Trial 260 finished with value: 0.07567445215757786 and parameters: {'n_layers': 1, 'embedding_dim': 32, 'lr': 0.000866834182359004, 'lambda_val': 0.00406903194063052, 'batch_size': 628, 'optimizer': 'RMSprop'}. Best is trial 260 with value: 0.07567445215757786.
2026-05-18 17:25:29,471 - experiment_functions - INFO - Early stopping at epoch 2250. Best Recall: 0.0736
2026-05-18 17:25:29,619 - optuna.study.study - INFO - Trial 261 finished with value: 0.07363635712581464 and parameters: {'n_layers': 1, 'embedding_dim': 32, 'lr': 0.0007577891268580082, 'lambda_val': 0.0037845903353338406, 'batch_size': 606, 'optimizer': 'RMSprop'}. Best is trial 260 with value: 0.07567445215757786.
2026-05-18 17:25:41,668 - optuna.study._optimize - INFO - Trial 262 pruned. 
2026-05-18 17:25:56,044 - experiment_functions - INFO - Early stopping at epoch 1050. Best Recall: 0.0694
2026-05-18 17:25:56,114 - optuna.study.study - INFO - Trial 263 finished with value: 0.06936551404503957 and parameters: {'n_layers': 2, 'embedding_dim': 32, 'lr': 0.0006564830004289065, 'lambda_val': 0.004930914041212467, 'batch_size': 613, 'optimizer': 'RMSprop'}. Best is trial 260 with value: 0.07567445215757786.
2026-05-18 17:26:09,640 - optuna.study._optimize - INFO - Trial 264 pruned. 
2026-05-18 17:26:27,967 - optuna.study._optimize - INFO - Trial 265 pruned. 
2026-05-18 17:26:40,556 - experiment_functions - INFO - Early stopping at epoch 850. Best Recall: 0.0610
2026-05-18 17:26:40,646 - optuna.study.study - INFO - Trial 266 finished with value: 0.06095031894911853 and parameters: {'n_layers': 2, 'embedding_dim': 32, 'lr': 0.0007644322377304767, 'lambda_val': 0.003883109724355698, 'batch_size': 512, 'optimizer': 'RMSprop'}. Best is trial 260 with value: 0.07567445215757786.
2026-05-18 17:26:52,057 - experiment_functions - INFO - Early stopping at epoch 600. Best Recall: 0.0290
2026-05-18 17:26:52,612 - optuna.study.study - INFO - Trial 267 finished with value: 0.02895395747230371 and parameters: {'n_layers': 3, 'embedding_dim': 256, 'lr': 0.0005809548993099589, 'lambda_val': 0.004795323526613613, 'batch_size': 615, 'optimizer': 'RMSprop'}. Best is trial 260 with value: 0.07567445215757786.
2026-05-18 17:27:02,288 - experiment_functions - INFO - Early stopping at epoch 650. Best Recall: 0.0294
2026-05-18 17:27:02,379 - optuna.study.study - INFO - Trial 268 finished with value: 0.029387413487949845 and parameters: {'n_layers': 4, 'embedding_dim': 32, 'lr': 0.0007023764295170407, 'lambda_val': 0.003230663361584526, 'batch_size': 1950, 'optimizer': 'RMSprop'}. Best is trial 260 with value: 0.07567445215757786.
2026-05-18 17:27:21,271 - experiment_functions - INFO - Early stopping at epoch 1350. Best Recall: 0.0712
2026-05-18 17:27:21,369 - optuna.study.study - INFO - Trial 269 finished with value: 0.07123187246497771 and parameters: {'n_layers': 1, 'embedding_dim': 32, 'lr': 0.000849385127237355, 'lambda_val': 0.006786757733696187, 'batch_size': 591, 'optimizer': 'RMSprop'}. Best is trial 260 with value: 0.07567445215757786.
2026-05-18 17:27:52,662 - experiment_functions - INFO - Early stopping at epoch 2250. Best Recall: 0.0720
2026-05-18 17:27:52,750 - optuna.study.study - INFO - Trial 270 finished with value: 0.07203221163193152 and parameters: {'n_layers': 1, 'embedding_dim': 32, 'lr': 0.0007737358612012415, 'lambda_val': 0.0025774251723231978, 'batch_size': 580, 'optimizer': 'RMSprop'}. Best is trial 260 with value: 0.07567445215757786.
2026-05-18 17:28:12,688 - experiment_functions - INFO - Early stopping at epoch 1400. Best Recall: 0.0713
2026-05-18 17:28:12,787 - optuna.study.study - INFO - Trial 271 finished with value: 0.07132305949776359 and parameters: {'n_layers': 1, 'embedding_dim': 32, 'lr': 0.0008251884641537274, 'lambda_val': 0.009176786760520347, 'batch_size': 591, 'optimizer': 'RMSprop'}. Best is trial 260 with value: 0.07567445215757786.
2026-05-18 17:28:32,828 - experiment_functions - INFO - Early stopping at epoch 1450. Best Recall: 0.0692
2026-05-18 17:28:33,587 - optuna.study.study - INFO - Trial 272 finished with value: 0.06919648353679937 and parameters: {'n_layers': 1, 'embedding_dim': 32, 'lr': 0.0008449499949184381, 'lambda_val': 0.006100846406791446, 'batch_size': 570, 'optimizer': 'RMSprop'}. Best is trial 260 with value: 0.07567445215757786.
2026-05-18 17:28:54,905 - optuna.study._optimize - INFO - Trial 273 pruned. 
2026-05-18 17:29:21,363 - experiment_functions - INFO - Early stopping at epoch 1900. Best Recall: 0.0696
2026-05-18 17:29:21,453 - optuna.study.study - INFO - Trial 274 finished with value: 0.06962679274803893 and parameters: {'n_layers': 1, 'embedding_dim': 32, 'lr': 0.0007647494718464187, 'lambda_val': 0.00924957205888996, 'batch_size': 651, 'optimizer': 'RMSprop'}. Best is trial 260 with value: 0.07567445215757786.
2026-05-18 17:29:34,897 - optuna.study._optimize - INFO - Trial 275 pruned. 
2026-05-18 17:29:42,423 - experiment_functions - INFO - Early stopping at epoch 500. Best Recall: 0.0055
2026-05-18 17:29:42,522 - optuna.study.study - INFO - Trial 276 finished with value: 0.005453287273786026 and parameters: {'n_layers': 1, 'embedding_dim': 32, 'lr': 0.0004161653520301984, 'lambda_val': 0.012190789856780408, 'batch_size': 649, 'optimizer': 'RMSprop'}. Best is trial 260 with value: 0.07567445215757786.
2026-05-18 17:29:57,222 - optuna.study._optimize - INFO - Trial 277 pruned. 
2026-05-18 17:30:10,416 - optuna.study._optimize - INFO - Trial 278 pruned. 
2026-05-18 17:30:20,713 - experiment_functions - INFO - Early stopping at epoch 750. Best Recall: 0.0490
2026-05-18 17:30:20,782 - optuna.study.study - INFO - Trial 279 finished with value: 0.049023039410475595 and parameters: {'n_layers': 2, 'embedding_dim': 32, 'lr': 0.0009694443226372417, 'lambda_val': 0.0024272464989020834, 'batch_size': 658, 'optimizer': 'RMSprop'}. Best is trial 260 with value: 0.07567445215757786.
2026-05-18 17:30:31,170 - experiment_functions - INFO - Early stopping at epoch 750. Best Recall: 0.0518
2026-05-18 17:30:31,262 - optuna.study.study - INFO - Trial 280 finished with value: 0.05179260655413544 and parameters: {'n_layers': 1, 'embedding_dim': 32, 'lr': 0.0008046409269250259, 'lambda_val': 0.003240760420049009, 'batch_size': 3869, 'optimizer': 'RMSprop'}. Best is trial 260 with value: 0.07567445215757786.
2026-05-18 17:30:45,039 - optuna.study._optimize - INFO - Trial 281 pruned. 
2026-05-18 17:30:59,944 - experiment_functions - INFO - Early stopping at epoch 1050. Best Recall: 0.0640
2026-05-18 17:31:00,042 - optuna.study.study - INFO - Trial 282 finished with value: 0.06403018934150101 and parameters: {'n_layers': 1, 'embedding_dim': 32, 'lr': 0.0009737752863919659, 'lambda_val': 0.016635796951337118, 'batch_size': 594, 'optimizer': 'RMSprop'}. Best is trial 260 with value: 0.07567445215757786.
2026-05-18 17:31:13,855 - optuna.study._optimize - INFO - Trial 283 pruned. 
2026-05-18 17:31:43,861 - experiment_functions - INFO - Early stopping at epoch 2250. Best Recall: 0.0712
2026-05-18 17:31:43,951 - optuna.study.study - INFO - Trial 284 finished with value: 0.0711577464137806 and parameters: {'n_layers': 1, 'embedding_dim': 32, 'lr': 0.0007759454038692614, 'lambda_val': 0.0018113372473844934, 'batch_size': 663, 'optimizer': 'RMSprop'}. Best is trial 260 with value: 0.07567445215757786.
2026-05-18 17:32:00,505 - experiment_functions - INFO - Early stopping at epoch 1150. Best Recall: 0.0661
2026-05-18 17:32:00,595 - optuna.study.study - INFO - Trial 285 finished with value: 0.06606972536578848 and parameters: {'n_layers': 1, 'embedding_dim': 96, 'lr': 0.0008613864238330004, 'lambda_val': 0.0019349021133293282, 'batch_size': 678, 'optimizer': 'RMSprop'}. Best is trial 260 with value: 0.07567445215757786.
2026-05-18 17:32:25,249 - experiment_functions - INFO - Early stopping at epoch 1800. Best Recall: 0.0706
2026-05-18 17:32:25,338 - optuna.study.study - INFO - Trial 286 finished with value: 0.07057030457444669 and parameters: {'n_layers': 1, 'embedding_dim': 32, 'lr': 0.0010388360041707727, 'lambda_val': 0.0012075463617873226, 'batch_size': 564, 'optimizer': 'RMSprop'}. Best is trial 260 with value: 0.07567445215757786.
2026-05-18 17:32:41,439 - optuna.study._optimize - INFO - Trial 287 pruned. 
2026-05-18 17:33:01,807 - optuna.study._optimize - INFO - Trial 288 pruned. 
2026-05-18 17:33:21,005 - experiment_functions - INFO - Early stopping at epoch 1400. Best Recall: 0.0692
2026-05-18 17:33:21,094 - optuna.study.study - INFO - Trial 289 finished with value: 0.06915130019999642 and parameters: {'n_layers': 1, 'embedding_dim': 32, 'lr': 0.0010341373703234324, 'lambda_val': 0.0012455594335580664, 'batch_size': 681, 'optimizer': 'RMSprop'}. Best is trial 260 with value: 0.07567445215757786.
2026-05-18 17:33:43,155 - experiment_functions - INFO - Early stopping at epoch 1400. Best Recall: 0.0676
2026-05-18 17:33:43,255 - optuna.study.study - INFO - Trial 290 finished with value: 0.06756971228449153 and parameters: {'n_layers': 1, 'embedding_dim': 32, 'lr': 0.0010428202704493717, 'lambda_val': 0.002718975217917931, 'batch_size': 583, 'optimizer': 'RMSprop'}. Best is trial 260 with value: 0.07567445215757786.
2026-05-18 17:34:17,665 - experiment_functions - INFO - Early stopping at epoch 2550. Best Recall: 0.0712
2026-05-18 17:34:17,756 - optuna.study.study - INFO - Trial 291 finished with value: 0.07123260880279268 and parameters: {'n_layers': 1, 'embedding_dim': 32, 'lr': 0.000765225593307272, 'lambda_val': 0.0018339911702803169, 'batch_size': 514, 'optimizer': 'RMSprop'}. Best is trial 260 with value: 0.07567445215757786.
2026-05-18 17:34:47,038 - optuna.study._optimize - INFO - Trial 292 pruned. 
2026-05-18 17:35:00,907 - optuna.study._optimize - INFO - Trial 293 pruned. 
2026-05-18 17:35:13,909 - experiment_functions - INFO - Early stopping at epoch 950. Best Recall: 0.0578
2026-05-18 17:35:13,967 - optuna.study.study - INFO - Trial 294 finished with value: 0.05777896046143655 and parameters: {'n_layers': 1, 'embedding_dim': 32, 'lr': 0.0008635123276247662, 'lambda_val': 0.0023463458857568434, 'batch_size': 2493, 'optimizer': 'RMSprop'}. Best is trial 260 with value: 0.07567445215757786.
2026-05-18 17:35:27,329 - optuna.study._optimize - INFO - Trial 295 pruned. 
2026-05-18 17:35:41,682 - experiment_functions - INFO - Early stopping at epoch 1000. Best Recall: 0.0663
2026-05-18 17:35:41,826 - optuna.study.study - INFO - Trial 296 finished with value: 0.0662500738421303 and parameters: {'n_layers': 1, 'embedding_dim': 32, 'lr': 0.0011003196576296703, 'lambda_val': 0.0031978863660771704, 'batch_size': 672, 'optimizer': 'RMSprop'}. Best is trial 260 with value: 0.07567445215757786.
2026-05-18 17:35:57,638 - optuna.study._optimize - INFO - Trial 297 pruned. 
2026-05-18 17:36:11,659 - optuna.study._optimize - INFO - Trial 298 pruned. 
2026-05-18 17:36:30,602 - experiment_functions - INFO - Early stopping at epoch 1350. Best Recall: 0.0707
2026-05-18 17:36:30,701 - optuna.study.study - INFO - Trial 299 finished with value: 0.07074802860066164 and parameters: {'n_layers': 1, 'embedding_dim': 32, 'lr': 0.0009991653102105476, 'lambda_val': 0.0015890908236852051, 'batch_size': 707, 'optimizer': 'RMSprop'}. Best is trial 260 with value: 0.07567445215757786.
2026-05-18 17:36:48,955 - experiment_functions - INFO - Early stopping at epoch 1650. Best Recall: 0.0726
2026-05-18 17:36:49,874 - root - INFO -   **** Training e_1M_1c2dcs_rand5
2026-05-18 17:36:49,932 - root - INFO -   **** Getting 202263/805443 random edges
2026-05-18 17:36:50,097 - optuna.storages._rdb.storage - INFO - A new study created in RDB with name: Study_e_1M_1c2dcs_rand5
2026-05-18 17:37:10,791 - experiment_functions - INFO - Early stopping at epoch 1200. Best Recall: 0.0189
2026-05-18 17:37:11,641 - optuna.study.study - INFO - Trial 0 finished with value: 0.018932924002280378 and parameters: {'n_layers': 4, 'embedding_dim': 32, 'lr': 0.03993728128114643, 'lambda_val': 0.00041564602792942254, 'batch_size': 1571, 'optimizer': 'RMSprop'}. Best is trial 0 with value: 0.018932924002280378.
2026-05-18 17:38:12,332 - experiment_functions - INFO - Early stopping at epoch 3050. Best Recall: 0.0232
2026-05-18 17:38:12,470 - optuna.study.study - INFO - Trial 1 finished with value: 0.02322769246114342 and parameters: {'n_layers': 4, 'embedding_dim': 128, 'lr': 0.008092747474894173, 'lambda_val': 2.2256179464307647e-05, 'batch_size': 1647, 'optimizer': 'Adam'}. Best is trial 1 with value: 0.02322769246114342.
2026-05-18 17:38:25,865 - experiment_functions - INFO - Early stopping at epoch 550. Best Recall: 0.0109
2026-05-18 17:38:25,966 - optuna.study.study - INFO - Trial 2 finished with value: 0.010877337803015547 and parameters: {'n_layers': 4, 'embedding_dim': 256, 'lr': 0.0013359379309534698, 'lambda_val': 6.095780286752661e-06, 'batch_size': 3657, 'optimizer': 'RMSprop'}. Best is trial 1 with value: 0.02322769246114342.
2026-05-18 17:38:50,107 - experiment_functions - INFO - Early stopping at epoch 800. Best Recall: 0.0196
2026-05-18 17:38:50,208 - optuna.study.study - INFO - Trial 3 finished with value: 0.01960025273638137 and parameters: {'n_layers': 4, 'embedding_dim': 256, 'lr': 0.03186027756783971, 'lambda_val': 1.1879066799768602e-05, 'batch_size': 1781, 'optimizer': 'Adam'}. Best is trial 1 with value: 0.02322769246114342.
2026-05-18 17:39:03,371 - experiment_functions - INFO - Early stopping at epoch 500. Best Recall: 0.0052
2026-05-18 17:39:03,580 - optuna.study.study - INFO - Trial 4 finished with value: 0.005195507636774401 and parameters: {'n_layers': 3, 'embedding_dim': 128, 'lr': 3.119422342351028e-05, 'lambda_val': 0.015899825683849286, 'batch_size': 3315, 'optimizer': 'RMSprop'}. Best is trial 1 with value: 0.02322769246114342.
2026-05-18 17:39:28,219 - experiment_functions - INFO - Early stopping at epoch 500. Best Recall: 0.0054
2026-05-18 17:39:28,311 - optuna.study.study - INFO - Trial 5 finished with value: 0.00543022203582829 and parameters: {'n_layers': 1, 'embedding_dim': 96, 'lr': 0.00021173239387519362, 'lambda_val': 0.026318702786822003, 'batch_size': 2175, 'optimizer': 'Adam'}. Best is trial 1 with value: 0.02322769246114342.
2026-05-18 17:39:39,831 - experiment_functions - INFO - Early stopping at epoch 500. Best Recall: 0.0045
2026-05-18 17:39:40,056 - optuna.study.study - INFO - Trial 6 finished with value: 0.004482393487640601 and parameters: {'n_layers': 4, 'embedding_dim': 128, 'lr': 0.04257782850977854, 'lambda_val': 0.011856496657543996, 'batch_size': 3733, 'optimizer': 'SGD'}. Best is trial 1 with value: 0.02322769246114342.
2026-05-18 17:39:51,923 - experiment_functions - INFO - Early stopping at epoch 500. Best Recall: 0.0048
2026-05-18 17:39:52,026 - optuna.study.study - INFO - Trial 7 finished with value: 0.0048165565691331595 and parameters: {'n_layers': 3, 'embedding_dim': 96, 'lr': 9.500841629313115e-05, 'lambda_val': 0.00018638839340413948, 'batch_size': 3988, 'optimizer': 'SGD'}. Best is trial 1 with value: 0.02322769246114342.
2026-05-18 17:40:19,352 - experiment_functions - INFO - Early stopping at epoch 900. Best Recall: 0.0320
2026-05-18 17:40:19,468 - optuna.study.study - INFO - Trial 8 finished with value: 0.03204988489467016 and parameters: {'n_layers': 4, 'embedding_dim': 128, 'lr': 0.0002659784851199236, 'lambda_val': 1.6149356020901745e-06, 'batch_size': 3216, 'optimizer': 'RMSprop'}. Best is trial 8 with value: 0.03204988489467016.
2026-05-18 17:40:27,963 - experiment_functions - INFO - Early stopping at epoch 500. Best Recall: 0.0055
2026-05-18 17:40:28,063 - optuna.study.study - INFO - Trial 9 finished with value: 0.005457766836635876 and parameters: {'n_layers': 3, 'embedding_dim': 128, 'lr': 1.1605071852055313e-05, 'lambda_val': 0.04392110541841219, 'batch_size': 2605, 'optimizer': 'Adam'}. Best is trial 8 with value: 0.03204988489467016.
2026-05-18 17:40:42,766 - experiment_functions - INFO - Early stopping at epoch 1000. Best Recall: 0.0630
2026-05-18 17:40:42,877 - optuna.study.study - INFO - Trial 10 finished with value: 0.06297039627990988 and parameters: {'n_layers': 1, 'embedding_dim': 64, 'lr': 0.0012902492933993869, 'lambda_val': 1.0511338729928802e-06, 'batch_size': 517, 'optimizer': 'RMSprop'}. Best is trial 10 with value: 0.06297039627990988.
2026-05-18 17:41:08,336 - experiment_functions - INFO - Early stopping at epoch 1500. Best Recall: 0.0678
2026-05-18 17:41:08,599 - optuna.study.study - INFO - Trial 11 finished with value: 0.06782848062522662 and parameters: {'n_layers': 1, 'embedding_dim': 64, 'lr': 0.0008295857608543063, 'lambda_val': 1.2947474831122393e-06, 'batch_size': 787, 'optimizer': 'RMSprop'}. Best is trial 11 with value: 0.06782848062522662.
2026-05-18 17:41:20,219 - experiment_functions - INFO - Early stopping at epoch 650. Best Recall: 0.0508
2026-05-18 17:41:20,310 - optuna.study.study - INFO - Trial 12 finished with value: 0.05081881537294665 and parameters: {'n_layers': 1, 'embedding_dim': 64, 'lr': 0.001871474046646349, 'lambda_val': 1.0546842179930534e-06, 'batch_size': 522, 'optimizer': 'RMSprop'}. Best is trial 11 with value: 0.06782848062522662.
2026-05-18 17:41:34,077 - optuna.study._optimize - INFO - Trial 13 pruned. 
2026-05-18 17:42:00,590 - experiment_functions - INFO - Early stopping at epoch 1200. Best Recall: 0.0495
2026-05-18 17:42:00,668 - optuna.study.study - INFO - Trial 14 finished with value: 0.04951817310878033 and parameters: {'n_layers': 2, 'embedding_dim': 64, 'lr': 0.000431630821781956, 'lambda_val': 0.001339152252859767, 'batch_size': 1133, 'optimizer': 'RMSprop'}. Best is trial 11 with value: 0.06782848062522662.
2026-05-18 17:42:15,804 - optuna.study._optimize - INFO - Trial 15 pruned. 
2026-05-18 17:42:23,204 - experiment_functions - INFO - Early stopping at epoch 500. Best Recall: 0.0049
2026-05-18 17:42:23,295 - optuna.study.study - INFO - Trial 16 finished with value: 0.0049486832336865065 and parameters: {'n_layers': 2, 'embedding_dim': 64, 'lr': 0.0007023919367897737, 'lambda_val': 2.841498687712078e-05, 'batch_size': 1287, 'optimizer': 'SGD'}. Best is trial 11 with value: 0.06782848062522662.
2026-05-18 17:42:38,244 - optuna.study._optimize - INFO - Trial 17 pruned. 
2026-05-18 17:42:46,124 - experiment_functions - INFO - Early stopping at epoch 500. Best Recall: 0.0051
2026-05-18 17:42:46,215 - optuna.study.study - INFO - Trial 18 finished with value: 0.005137561585299 and parameters: {'n_layers': 2, 'embedding_dim': 64, 'lr': 9.280225732660699e-05, 'lambda_val': 0.0034884501062346493, 'batch_size': 596, 'optimizer': 'RMSprop'}. Best is trial 11 with value: 0.06782848062522662.
2026-05-18 17:42:53,622 - experiment_functions - INFO - Early stopping at epoch 500. Best Recall: 0.0047
2026-05-18 17:42:53,714 - optuna.study.study - INFO - Trial 19 finished with value: 0.004702776114676006 and parameters: {'n_layers': 1, 'embedding_dim': 64, 'lr': 0.0017961441805398827, 'lambda_val': 8.071790113421341e-05, 'batch_size': 938, 'optimizer': 'SGD'}. Best is trial 11 with value: 0.06782848062522662.
2026-05-18 17:43:02,157 - experiment_functions - INFO - Early stopping at epoch 550. Best Recall: 0.0501
2026-05-18 17:43:02,238 - optuna.study.study - INFO - Trial 20 finished with value: 0.050064567794140896 and parameters: {'n_layers': 1, 'embedding_dim': 64, 'lr': 0.0027124503407103475, 'lambda_val': 1.0649883031188142e-06, 'batch_size': 1386, 'optimizer': 'RMSprop'}. Best is trial 11 with value: 0.06782848062522662.
2026-05-18 17:43:34,915 - experiment_functions - INFO - Early stopping at epoch 1600. Best Recall: 0.0703
2026-05-18 17:43:35,018 - optuna.study.study - INFO - Trial 21 finished with value: 0.07030532387982594 and parameters: {'n_layers': 1, 'embedding_dim': 64, 'lr': 0.0008983975760940889, 'lambda_val': 1.2120784474388718e-06, 'batch_size': 538, 'optimizer': 'RMSprop'}. Best is trial 21 with value: 0.07030532387982594.
2026-05-18 17:43:58,384 - experiment_functions - INFO - Early stopping at epoch 1650. Best Recall: 0.0667
2026-05-18 17:43:58,474 - optuna.study.study - INFO - Trial 22 finished with value: 0.06665501235973693 and parameters: {'n_layers': 1, 'embedding_dim': 64, 'lr': 0.0006620923037109347, 'lambda_val': 6.668250775440309e-06, 'batch_size': 814, 'optimizer': 'RMSprop'}. Best is trial 21 with value: 0.07030532387982594.
2026-05-18 17:44:13,464 - experiment_functions - INFO - Early stopping at epoch 950. Best Recall: 0.0526
2026-05-18 17:44:13,576 - optuna.study.study - INFO - Trial 23 finished with value: 0.05264950783151093 and parameters: {'n_layers': 2, 'embedding_dim': 64, 'lr': 0.0005878115401682965, 'lambda_val': 6.777230958791519e-06, 'batch_size': 904, 'optimizer': 'RMSprop'}. Best is trial 21 with value: 0.07030532387982594.
2026-05-18 17:44:27,158 - optuna.study._optimize - INFO - Trial 24 pruned. 
2026-05-18 17:44:40,417 - experiment_functions - INFO - Early stopping at epoch 800. Best Recall: 0.0482
2026-05-18 17:44:40,509 - optuna.study.study - INFO - Trial 25 finished with value: 0.04816472063763084 and parameters: {'n_layers': 2, 'embedding_dim': 256, 'lr': 0.0004752937543988718, 'lambda_val': 1.0002507887546984e-05, 'batch_size': 1232, 'optimizer': 'RMSprop'}. Best is trial 21 with value: 0.07030532387982594.
2026-05-18 17:44:53,775 - optuna.study._optimize - INFO - Trial 26 pruned. 
2026-05-18 17:45:13,934 - experiment_functions - INFO - Early stopping at epoch 750. Best Recall: 0.0573
