2026-05-18 15:28:57,543 - optuna.study.study - INFO - Trial 161 finished with value: 0.06431732756661418 and parameters: {'n_layers': 1, 'embedding_dim': 64, 'lr': 0.0028852258833877683, 'lambda_val': 0.0003161942055381865, 'batch_size': 1419, 'optimizer': 'Adam'}. Best is trial 91 with value: 0.06708054321961882.
2026-05-18 15:29:07,350 - experiment_functions - INFO - Early stopping at epoch 650. Best Recall: 0.0625
2026-05-18 15:29:07,484 - optuna.study.study - INFO - Trial 162 finished with value: 0.06245999118338425 and parameters: {'n_layers': 1, 'embedding_dim': 64, 'lr': 0.0034439294852342435, 'lambda_val': 0.00031032666948068165, 'batch_size': 1175, 'optimizer': 'Adam'}. Best is trial 91 with value: 0.06708054321961882.
2026-05-18 15:29:19,326 - experiment_functions - INFO - Early stopping at epoch 750. Best Recall: 0.0594
2026-05-18 15:29:19,425 - optuna.study.study - INFO - Trial 163 finished with value: 0.059360863399655746 and parameters: {'n_layers': 1, 'embedding_dim': 64, 'lr': 0.002024600907758444, 'lambda_val': 0.00018209125203086732, 'batch_size': 1331, 'optimizer': 'Adam'}. Best is trial 91 with value: 0.06708054321961882.
2026-05-18 15:29:29,402 - experiment_functions - INFO - Early stopping at epoch 650. Best Recall: 0.0503
2026-05-18 15:29:29,491 - optuna.study.study - INFO - Trial 164 finished with value: 0.0502550450770731 and parameters: {'n_layers': 1, 'embedding_dim': 64, 'lr': 0.002390356859815893, 'lambda_val': 0.03541700228625978, 'batch_size': 995, 'optimizer': 'Adam'}. Best is trial 91 with value: 0.06708054321961882.
2026-05-18 15:29:39,503 - experiment_functions - INFO - Early stopping at epoch 650. Best Recall: 0.0606
2026-05-18 15:29:39,593 - optuna.study.study - INFO - Trial 165 finished with value: 0.06060340818929913 and parameters: {'n_layers': 1, 'embedding_dim': 64, 'lr': 0.0029774870198699525, 'lambda_val': 0.0003775195851576773, 'batch_size': 1481, 'optimizer': 'Adam'}. Best is trial 91 with value: 0.06708054321961882.
2026-05-18 15:29:52,363 - experiment_functions - INFO - Early stopping at epoch 850. Best Recall: 0.0644
2026-05-18 15:29:52,463 - optuna.study.study - INFO - Trial 166 finished with value: 0.06439382446319596 and parameters: {'n_layers': 1, 'embedding_dim': 64, 'lr': 0.001385653982425549, 'lambda_val': 0.00023504179389962067, 'batch_size': 1260, 'optimizer': 'Adam'}. Best is trial 91 with value: 0.06708054321961882.
2026-05-18 15:30:06,846 - optuna.study._optimize - INFO - Trial 167 pruned. 
2026-05-18 15:30:21,915 - experiment_functions - INFO - Early stopping at epoch 1000. Best Recall: 0.0651
2026-05-18 15:30:22,004 - optuna.study.study - INFO - Trial 168 finished with value: 0.06512514853634402 and parameters: {'n_layers': 1, 'embedding_dim': 64, 'lr': 0.001205070678297636, 'lambda_val': 0.00025951492101756725, 'batch_size': 1063, 'optimizer': 'Adam'}. Best is trial 91 with value: 0.06708054321961882.
2026-05-18 15:30:32,443 - experiment_functions - INFO - Early stopping at epoch 650. Best Recall: 0.0445
2026-05-18 15:30:32,531 - optuna.study.study - INFO - Trial 169 finished with value: 0.04449692114136534 and parameters: {'n_layers': 4, 'embedding_dim': 64, 'lr': 0.001217179121916554, 'lambda_val': 0.00024108295999224652, 'batch_size': 1116, 'optimizer': 'Adam'}. Best is trial 91 with value: 0.06708054321961882.
2026-05-18 15:30:47,057 - experiment_functions - INFO - Early stopping at epoch 950. Best Recall: 0.0607
2026-05-18 15:30:47,199 - optuna.study.study - INFO - Trial 170 finished with value: 0.06068040346111055 and parameters: {'n_layers': 1, 'embedding_dim': 64, 'lr': 0.0014985533244870263, 'lambda_val': 0.00038310388721181203, 'batch_size': 866, 'optimizer': 'Adam'}. Best is trial 91 with value: 0.06708054321961882.
2026-05-18 15:30:58,304 - experiment_functions - INFO - Early stopping at epoch 750. Best Recall: 0.0557
2026-05-18 15:30:58,403 - optuna.study.study - INFO - Trial 171 finished with value: 0.055685059240674274 and parameters: {'n_layers': 1, 'embedding_dim': 64, 'lr': 0.0017461524676616953, 'lambda_val': 0.02425965208761252, 'batch_size': 1218, 'optimizer': 'Adam'}. Best is trial 91 with value: 0.06708054321961882.
2026-05-18 15:31:11,741 - experiment_functions - INFO - Early stopping at epoch 900. Best Recall: 0.0597
2026-05-18 15:31:11,846 - optuna.study.study - INFO - Trial 172 finished with value: 0.059675447062469834 and parameters: {'n_layers': 1, 'embedding_dim': 64, 'lr': 0.0013618346431294665, 'lambda_val': 2.372035310675549e-06, 'batch_size': 1407, 'optimizer': 'Adam'}. Best is trial 91 with value: 0.06708054321961882.
2026-05-18 15:31:28,056 - experiment_functions - INFO - Early stopping at epoch 1050. Best Recall: 0.0648
2026-05-18 15:31:28,146 - optuna.study.study - INFO - Trial 173 finished with value: 0.06481940834421424 and parameters: {'n_layers': 1, 'embedding_dim': 64, 'lr': 0.0010983756156398145, 'lambda_val': 0.00020718428017197063, 'batch_size': 1037, 'optimizer': 'Adam'}. Best is trial 91 with value: 0.06708054321961882.
2026-05-18 15:31:46,964 - experiment_functions - INFO - Early stopping at epoch 1300. Best Recall: 0.0593
2026-05-18 15:31:47,064 - optuna.study.study - INFO - Trial 174 finished with value: 0.05929553665886182 and parameters: {'n_layers': 1, 'embedding_dim': 64, 'lr': 0.0009315360265569843, 'lambda_val': 0.0002777891156160912, 'batch_size': 1022, 'optimizer': 'Adam'}. Best is trial 91 with value: 0.06708054321961882.
2026-05-18 15:32:03,653 - experiment_functions - INFO - Early stopping at epoch 1100. Best Recall: 0.0618
2026-05-18 15:32:03,765 - optuna.study.study - INFO - Trial 175 finished with value: 0.06175833994520985 and parameters: {'n_layers': 1, 'embedding_dim': 64, 'lr': 0.0010611274289187614, 'lambda_val': 0.00020721103403459047, 'batch_size': 1055, 'optimizer': 'Adam'}. Best is trial 91 with value: 0.06708054321961882.
2026-05-18 15:32:15,254 - experiment_functions - INFO - Early stopping at epoch 750. Best Recall: 0.0626
2026-05-18 15:32:15,344 - optuna.study.study - INFO - Trial 176 finished with value: 0.06261622754993458 and parameters: {'n_layers': 1, 'embedding_dim': 64, 'lr': 0.0023087665796637197, 'lambda_val': 0.0004522318452623409, 'batch_size': 1179, 'optimizer': 'Adam'}. Best is trial 91 with value: 0.06708054321961882.
2026-05-18 15:32:30,101 - experiment_functions - INFO - Early stopping at epoch 1000. Best Recall: 0.0617
2026-05-18 15:32:30,191 - optuna.study.study - INFO - Trial 177 finished with value: 0.06171912811482459 and parameters: {'n_layers': 1, 'embedding_dim': 64, 'lr': 0.0011612066467609492, 'lambda_val': 0.00014156174600931024, 'batch_size': 949, 'optimizer': 'Adam'}. Best is trial 91 with value: 0.06708054321961882.
2026-05-18 15:32:42,980 - experiment_functions - INFO - Early stopping at epoch 850. Best Recall: 0.0592
2026-05-18 15:32:43,047 - optuna.study.study - INFO - Trial 178 finished with value: 0.059209213312248384 and parameters: {'n_layers': 1, 'embedding_dim': 64, 'lr': 0.0016361263251108385, 'lambda_val': 0.00032631055783070243, 'batch_size': 1097, 'optimizer': 'Adam'}. Best is trial 91 with value: 0.06708054321961882.
2026-05-18 15:32:53,158 - experiment_functions - INFO - Early stopping at epoch 550. Best Recall: 0.0515
2026-05-18 15:32:53,248 - optuna.study.study - INFO - Trial 179 finished with value: 0.051544886854583936 and parameters: {'n_layers': 1, 'embedding_dim': 64, 'lr': 0.0028028199316588527, 'lambda_val': 0.0029424677730675924, 'batch_size': 1295, 'optimizer': 'RMSprop'}. Best is trial 91 with value: 0.06708054321961882.
2026-05-18 15:33:02,336 - experiment_functions - INFO - Early stopping at epoch 600. Best Recall: 0.0638
2026-05-18 15:33:02,423 - optuna.study.study - INFO - Trial 180 finished with value: 0.06384300243338091 and parameters: {'n_layers': 1, 'embedding_dim': 64, 'lr': 0.004595360367714043, 'lambda_val': 9.065142625471334e-05, 'batch_size': 1515, 'optimizer': 'Adam'}. Best is trial 91 with value: 0.06708054321961882.
2026-05-18 15:33:11,685 - experiment_functions - INFO - Early stopping at epoch 600. Best Recall: 0.0488
2026-05-18 15:33:11,776 - optuna.study.study - INFO - Trial 181 finished with value: 0.048794390780260426 and parameters: {'n_layers': 1, 'embedding_dim': 64, 'lr': 0.006342984573519514, 'lambda_val': 6.541256003404861e-05, 'batch_size': 1515, 'optimizer': 'Adam'}. Best is trial 91 with value: 0.06708054321961882.
2026-05-18 15:33:21,720 - experiment_functions - INFO - Early stopping at epoch 600. Best Recall: 0.0612
2026-05-18 15:33:21,819 - optuna.study.study - INFO - Trial 182 finished with value: 0.06121021993679941 and parameters: {'n_layers': 1, 'embedding_dim': 64, 'lr': 0.004845497574344755, 'lambda_val': 8.711536372105669e-05, 'batch_size': 1603, 'optimizer': 'Adam'}. Best is trial 91 with value: 0.06708054321961882.
2026-05-18 15:33:31,765 - experiment_functions - INFO - Early stopping at epoch 650. Best Recall: 0.0532
2026-05-18 15:33:31,864 - optuna.study.study - INFO - Trial 183 finished with value: 0.05316703216634722 and parameters: {'n_layers': 1, 'embedding_dim': 64, 'lr': 0.003715942554675404, 'lambda_val': 0.0001098031637596305, 'batch_size': 1360, 'optimizer': 'Adam'}. Best is trial 91 with value: 0.06708054321961882.
2026-05-18 15:33:41,163 - experiment_functions - INFO - Early stopping at epoch 600. Best Recall: 0.0605
2026-05-18 15:33:41,309 - optuna.study.study - INFO - Trial 184 finished with value: 0.06051110520411718 and parameters: {'n_layers': 1, 'embedding_dim': 64, 'lr': 0.004168758240610715, 'lambda_val': 0.00020913067522139044, 'batch_size': 1675, 'optimizer': 'Adam'}. Best is trial 91 with value: 0.06708054321961882.
2026-05-18 15:34:02,210 - experiment_functions - INFO - Early stopping at epoch 750. Best Recall: 0.0610
2026-05-18 15:34:02,299 - optuna.study.study - INFO - Trial 185 finished with value: 0.06097809527901634 and parameters: {'n_layers': 1, 'embedding_dim': 64, 'lr': 0.002094117767041109, 'lambda_val': 0.00015595364522096164, 'batch_size': 1203, 'optimizer': 'Adam'}. Best is trial 91 with value: 0.06708054321961882.
2026-05-18 15:34:12,559 - experiment_functions - INFO - Early stopping at epoch 650. Best Recall: 0.0611
2026-05-18 15:34:12,649 - optuna.study.study - INFO - Trial 186 finished with value: 0.06107613434065974 and parameters: {'n_layers': 1, 'embedding_dim': 64, 'lr': 0.003129779531205551, 'lambda_val': 0.00026942896168088114, 'batch_size': 1424, 'optimizer': 'Adam'}. Best is trial 91 with value: 0.06708054321961882.
2026-05-18 15:34:22,583 - experiment_functions - INFO - Early stopping at epoch 650. Best Recall: 0.0532
2026-05-18 15:34:22,683 - optuna.study.study - INFO - Trial 187 finished with value: 0.05317834040345329 and parameters: {'n_layers': 1, 'embedding_dim': 64, 'lr': 0.002523187057859556, 'lambda_val': 0.0018798890640980112, 'batch_size': 1559, 'optimizer': 'Adam'}. Best is trial 91 with value: 0.06708054321961882.
2026-05-18 15:34:35,268 - experiment_functions - INFO - Early stopping at epoch 850. Best Recall: 0.0585
2026-05-18 15:34:35,356 - optuna.study.study - INFO - Trial 188 finished with value: 0.058545757503845504 and parameters: {'n_layers': 1, 'embedding_dim': 64, 'lr': 0.0013712455417989407, 'lambda_val': 3.4897968756055594e-05, 'batch_size': 1499, 'optimizer': 'Adam'}. Best is trial 91 with value: 0.06708054321961882.
2026-05-18 15:34:47,769 - experiment_functions - INFO - Early stopping at epoch 800. Best Recall: 0.0603
2026-05-18 15:34:47,870 - optuna.study.study - INFO - Trial 189 finished with value: 0.060331284607194655 and parameters: {'n_layers': 1, 'embedding_dim': 96, 'lr': 0.0016403373913083075, 'lambda_val': 0.00010824625358878988, 'batch_size': 1268, 'optimizer': 'Adam'}. Best is trial 91 with value: 0.06708054321961882.
2026-05-18 15:34:55,170 - experiment_functions - INFO - Early stopping at epoch 500. Best Recall: 0.0048
2026-05-18 15:34:55,269 - optuna.study.study - INFO - Trial 190 finished with value: 0.004810283157345063 and parameters: {'n_layers': 1, 'embedding_dim': 64, 'lr': 0.009439682676548898, 'lambda_val': 0.00018363457197911236, 'batch_size': 776, 'optimizer': 'SGD'}. Best is trial 91 with value: 0.06708054321961882.
2026-05-18 15:35:05,726 - experiment_functions - INFO - Early stopping at epoch 700. Best Recall: 0.0611
2026-05-18 15:35:05,823 - optuna.study.study - INFO - Trial 191 finished with value: 0.06106312672056038 and parameters: {'n_layers': 1, 'embedding_dim': 32, 'lr': 0.0018822598251742283, 'lambda_val': 0.03006386955250389, 'batch_size': 1391, 'optimizer': 'Adam'}. Best is trial 91 with value: 0.06708054321961882.
2026-05-18 15:35:16,557 - experiment_functions - INFO - Early stopping at epoch 700. Best Recall: 0.0608
2026-05-18 15:35:16,658 - optuna.study.study - INFO - Trial 192 finished with value: 0.060783556181161755 and parameters: {'n_layers': 1, 'embedding_dim': 64, 'lr': 0.0022103965160674044, 'lambda_val': 0.000255254468928745, 'batch_size': 1459, 'optimizer': 'Adam'}. Best is trial 91 with value: 0.06708054321961882.
2026-05-18 15:35:29,026 - experiment_functions - INFO - Early stopping at epoch 800. Best Recall: 0.0615
2026-05-18 15:35:29,116 - optuna.study.study - INFO - Trial 193 finished with value: 0.061509983262740264 and parameters: {'n_layers': 1, 'embedding_dim': 64, 'lr': 0.0018117837447969773, 'lambda_val': 0.00012559895566193488, 'batch_size': 1329, 'optimizer': 'Adam'}. Best is trial 91 with value: 0.06708054321961882.
2026-05-18 15:35:39,593 - experiment_functions - INFO - Early stopping at epoch 700. Best Recall: 0.0649
2026-05-18 15:35:39,705 - optuna.study.study - INFO - Trial 194 finished with value: 0.06493026963284083 and parameters: {'n_layers': 1, 'embedding_dim': 32, 'lr': 0.0027147171040865937, 'lambda_val': 9.071382862583754e-05, 'batch_size': 1142, 'optimizer': 'Adam'}. Best is trial 91 with value: 0.06708054321961882.
2026-05-18 15:35:49,824 - experiment_functions - INFO - Early stopping at epoch 650. Best Recall: 0.0608
2026-05-18 15:35:49,923 - optuna.study.study - INFO - Trial 195 finished with value: 0.06077398721777212 and parameters: {'n_layers': 1, 'embedding_dim': 64, 'lr': 0.003246343324100257, 'lambda_val': 8.569014952451546e-05, 'batch_size': 1096, 'optimizer': 'Adam'}. Best is trial 91 with value: 0.06708054321961882.
2026-05-18 15:36:01,929 - experiment_functions - INFO - Early stopping at epoch 750. Best Recall: 0.0634
2026-05-18 15:36:02,037 - optuna.study.study - INFO - Trial 196 finished with value: 0.0633530525318965 and parameters: {'n_layers': 1, 'embedding_dim': 32, 'lr': 0.0025763851375716768, 'lambda_val': 6.71396915268221e-05, 'batch_size': 968, 'optimizer': 'Adam'}. Best is trial 91 with value: 0.06708054321961882.
2026-05-18 15:36:11,617 - experiment_functions - INFO - Early stopping at epoch 600. Best Recall: 0.0573
2026-05-18 15:36:11,707 - optuna.study.study - INFO - Trial 197 finished with value: 0.05726880380162263 and parameters: {'n_layers': 1, 'embedding_dim': 128, 'lr': 0.0044002229327303145, 'lambda_val': 9.830493528942951e-05, 'batch_size': 1152, 'optimizer': 'Adam'}. Best is trial 91 with value: 0.06708054321961882.
2026-05-18 15:36:21,606 - experiment_functions - INFO - Early stopping at epoch 650. Best Recall: 0.0611
2026-05-18 15:36:21,697 - optuna.study.study - INFO - Trial 198 finished with value: 0.061143725168782186 and parameters: {'n_layers': 1, 'embedding_dim': 64, 'lr': 0.0036648641906311973, 'lambda_val': 4.849019823552099e-05, 'batch_size': 1032, 'optimizer': 'Adam'}. Best is trial 91 with value: 0.06708054321961882.
2026-05-18 15:36:30,866 - experiment_functions - INFO - Early stopping at epoch 600. Best Recall: 0.0608
2026-05-18 15:36:30,958 - optuna.study.study - INFO - Trial 199 finished with value: 0.06076680021252214 and parameters: {'n_layers': 1, 'embedding_dim': 32, 'lr': 0.0057524183947581286, 'lambda_val': 0.00013810452191210834, 'batch_size': 1612, 'optimizer': 'Adam'}. Best is trial 91 with value: 0.06708054321961882.
2026-05-18 15:36:43,122 - experiment_functions - INFO - Early stopping at epoch 700. Best Recall: 0.0590
2026-05-18 15:36:43,224 - optuna.study.study - INFO - Trial 200 finished with value: 0.05902032651514051 and parameters: {'n_layers': 1, 'embedding_dim': 64, 'lr': 0.002779750353766519, 'lambda_val': 0.00036846857272809504, 'batch_size': 1231, 'optimizer': 'Adam'}. Best is trial 91 with value: 0.06708054321961882.
2026-05-18 15:36:54,299 - experiment_functions - INFO - Early stopping at epoch 750. Best Recall: 0.0640
2026-05-18 15:36:54,388 - optuna.study.study - INFO - Trial 201 finished with value: 0.06395184294412755 and parameters: {'n_layers': 1, 'embedding_dim': 32, 'lr': 0.0021882223396442295, 'lambda_val': 0.00020695681218082314, 'batch_size': 1522, 'optimizer': 'Adam'}. Best is trial 91 with value: 0.06708054321961882.
2026-05-18 15:37:05,291 - experiment_functions - INFO - Early stopping at epoch 700. Best Recall: 0.0593
2026-05-18 15:37:05,393 - optuna.study.study - INFO - Trial 202 finished with value: 0.05927250861314634 and parameters: {'n_layers': 1, 'embedding_dim': 32, 'lr': 0.0022424645215140754, 'lambda_val': 0.00021874717564811098, 'batch_size': 1557, 'optimizer': 'Adam'}. Best is trial 91 with value: 0.06708054321961882.
2026-05-18 15:37:20,306 - experiment_functions - INFO - Early stopping at epoch 1000. Best Recall: 0.0668
2026-05-18 15:37:20,396 - optuna.study.study - INFO - Trial 203 finished with value: 0.06679056343680984 and parameters: {'n_layers': 1, 'embedding_dim': 32, 'lr': 0.0013794560499561755, 'lambda_val': 0.00017693509090184817, 'batch_size': 901, 'optimizer': 'Adam'}. Best is trial 91 with value: 0.06708054321961882.
2026-05-18 15:37:36,311 - experiment_functions - INFO - Early stopping at epoch 1100. Best Recall: 0.0658
2026-05-18 15:37:36,411 - optuna.study.study - INFO - Trial 204 finished with value: 0.06581091207968377 and parameters: {'n_layers': 1, 'embedding_dim': 32, 'lr': 0.0012942210640515225, 'lambda_val': 0.00016514434167611388, 'batch_size': 929, 'optimizer': 'Adam'}. Best is trial 91 with value: 0.06708054321961882.
2026-05-18 15:38:14,141 - experiment_functions - INFO - Early stopping at epoch 2650. Best Recall: 0.0691
2026-05-18 15:38:14,255 - optuna.study.study - INFO - Trial 205 finished with value: 0.06910799715181551 and parameters: {'n_layers': 1, 'embedding_dim': 32, 'lr': 0.0008067379193837121, 'lambda_val': 0.0002937324630971368, 'batch_size': 732, 'optimizer': 'Adam'}. Best is trial 205 with value: 0.06910799715181551.
2026-05-18 15:38:45,199 - experiment_functions - INFO - Early stopping at epoch 2150. Best Recall: 0.0672
2026-05-18 15:38:45,290 - optuna.study.study - INFO - Trial 206 finished with value: 0.06719615591847317 and parameters: {'n_layers': 1, 'embedding_dim': 32, 'lr': 0.0007555440735192749, 'lambda_val': 0.0002906825004092895, 'batch_size': 890, 'optimizer': 'Adam'}. Best is trial 205 with value: 0.06910799715181551.
2026-05-18 15:39:36,989 - experiment_functions - INFO - Early stopping at epoch 3700. Best Recall: 0.0695
2026-05-18 15:39:37,080 - optuna.study.study - INFO - Trial 207 finished with value: 0.06947935245779073 and parameters: {'n_layers': 1, 'embedding_dim': 32, 'lr': 0.0007427237003294652, 'lambda_val': 0.00016044625477881883, 'batch_size': 663, 'optimizer': 'Adam'}. Best is trial 207 with value: 0.06947935245779073.
2026-05-18 15:40:09,684 - experiment_functions - INFO - Early stopping at epoch 2350. Best Recall: 0.0699
2026-05-18 15:40:09,800 - optuna.study.study - INFO - Trial 208 finished with value: 0.06990565316302094 and parameters: {'n_layers': 1, 'embedding_dim': 32, 'lr': 0.000832183118932362, 'lambda_val': 0.00017583380768434515, 'batch_size': 630, 'optimizer': 'Adam'}. Best is trial 208 with value: 0.06990565316302094.
2026-05-18 15:41:05,160 - optuna.study.study - INFO - Trial 209 finished with value: 0.07239457389190178 and parameters: {'n_layers': 1, 'embedding_dim': 32, 'lr': 0.0007262193277070157, 'lambda_val': 0.0001546737243568622, 'batch_size': 580, 'optimizer': 'Adam'}. Best is trial 209 with value: 0.07239457389190178.
2026-05-18 15:41:35,974 - optuna.study._optimize - INFO - Trial 210 pruned. 
2026-05-18 15:41:49,929 - optuna.study._optimize - INFO - Trial 211 pruned. 
2026-05-18 15:42:46,253 - optuna.study.study - INFO - Trial 212 finished with value: 0.07109092914493996 and parameters: {'n_layers': 1, 'embedding_dim': 32, 'lr': 0.0007749557925247427, 'lambda_val': 0.00013480811683948423, 'batch_size': 579, 'optimizer': 'Adam'}. Best is trial 209 with value: 0.07239457389190178.
2026-05-18 15:43:00,754 - optuna.study._optimize - INFO - Trial 213 pruned. 
2026-05-18 15:43:49,237 - experiment_functions - INFO - Early stopping at epoch 3450. Best Recall: 0.0703
2026-05-18 15:43:49,324 - optuna.study.study - INFO - Trial 214 finished with value: 0.07026988843190288 and parameters: {'n_layers': 1, 'embedding_dim': 32, 'lr': 0.0007400654732131446, 'lambda_val': 0.00012953732552930996, 'batch_size': 740, 'optimizer': 'Adam'}. Best is trial 209 with value: 0.07239457389190178.
2026-05-18 15:44:03,217 - optuna.study._optimize - INFO - Trial 215 pruned. 
2026-05-18 15:44:17,552 - optuna.study._optimize - INFO - Trial 216 pruned. 
2026-05-18 15:44:51,317 - optuna.study._optimize - INFO - Trial 217 pruned. 
2026-05-18 15:45:14,381 - experiment_functions - INFO - Early stopping at epoch 1600. Best Recall: 0.0668
2026-05-18 15:45:14,480 - optuna.study.study - INFO - Trial 218 finished with value: 0.06678322658040065 and parameters: {'n_layers': 1, 'embedding_dim': 32, 'lr': 0.0008617020744462155, 'lambda_val': 7.720462888219437e-05, 'batch_size': 853, 'optimizer': 'Adam'}. Best is trial 209 with value: 0.07239457389190178.
2026-05-18 15:45:27,378 - optuna.study._optimize - INFO - Trial 219 pruned. 
2026-05-18 15:45:50,077 - optuna.study._optimize - INFO - Trial 220 pruned. 
2026-05-18 15:46:02,952 - optuna.study._optimize - INFO - Trial 221 pruned. 
