2026-05-19 02:57:16,223 - optuna.study._optimize - INFO - Trial 215 pruned. 
2026-05-19 02:57:34,716 - experiment_functions - INFO - Early stopping at epoch 1250. Best Recall: 0.0669
2026-05-19 02:57:34,816 - optuna.study.study - INFO - Trial 216 finished with value: 0.06686224373308709 and parameters: {'n_layers': 1, 'embedding_dim': 64, 'lr': 0.0010977312926363685, 'lambda_val': 2.956637959950036e-05, 'batch_size': 636, 'optimizer': 'Adam'}. Best is trial 181 with value: 0.07267092144390536.
2026-05-19 02:57:58,748 - optuna.study._optimize - INFO - Trial 217 pruned. 
2026-05-19 02:58:14,343 - experiment_functions - INFO - Early stopping at epoch 950. Best Recall: 0.0638
2026-05-19 02:58:14,443 - optuna.study.study - INFO - Trial 218 finished with value: 0.06384060151959431 and parameters: {'n_layers': 1, 'embedding_dim': 64, 'lr': 0.001398075088592699, 'lambda_val': 5.5251431291219864e-05, 'batch_size': 796, 'optimizer': 'Adam'}. Best is trial 181 with value: 0.07267092144390536.
2026-05-19 02:58:23,354 - experiment_functions - INFO - Early stopping at epoch 550. Best Recall: 0.0128
2026-05-19 02:58:23,458 - optuna.study.study - INFO - Trial 219 finished with value: 0.012823245278954988 and parameters: {'n_layers': 1, 'embedding_dim': 64, 'lr': 0.087495605250216, 'lambda_val': 9.062634614342383e-05, 'batch_size': 2680, 'optimizer': 'Adam'}. Best is trial 181 with value: 0.07267092144390536.
2026-05-19 02:58:45,052 - optuna.study._optimize - INFO - Trial 220 pruned. 
2026-05-19 02:59:03,916 - optuna.study._optimize - INFO - Trial 221 pruned. 
2026-05-19 02:59:22,614 - experiment_functions - INFO - Early stopping at epoch 1250. Best Recall: 0.0684
2026-05-19 02:59:22,704 - optuna.study.study - INFO - Trial 222 finished with value: 0.06836872956413065 and parameters: {'n_layers': 1, 'embedding_dim': 64, 'lr': 0.0011082602320096671, 'lambda_val': 0.00017101004147571523, 'batch_size': 829, 'optimizer': 'Adam'}. Best is trial 181 with value: 0.07267092144390536.
2026-05-19 02:59:39,093 - experiment_functions - INFO - Early stopping at epoch 1200. Best Recall: 0.0664
2026-05-19 02:59:39,195 - optuna.study.study - INFO - Trial 223 finished with value: 0.06643811342687947 and parameters: {'n_layers': 1, 'embedding_dim': 64, 'lr': 0.0012260015424711216, 'lambda_val': 0.00017970499539993125, 'batch_size': 664, 'optimizer': 'Adam'}. Best is trial 181 with value: 0.07267092144390536.
2026-05-19 02:59:56,934 - optuna.study._optimize - INFO - Trial 224 pruned. 
2026-05-19 03:00:14,732 - optuna.study._optimize - INFO - Trial 225 pruned. 
2026-05-19 03:00:28,282 - experiment_functions - INFO - Early stopping at epoch 950. Best Recall: 0.0639
2026-05-19 03:00:28,792 - optuna.study.study - INFO - Trial 226 finished with value: 0.06391603148584987 and parameters: {'n_layers': 1, 'embedding_dim': 128, 'lr': 0.001395472137676895, 'lambda_val': 3.444753985277527e-05, 'batch_size': 635, 'optimizer': 'Adam'}. Best is trial 181 with value: 0.07267092144390536.
2026-05-19 03:00:36,564 - experiment_functions - INFO - Early stopping at epoch 550. Best Recall: 0.0054
2026-05-19 03:00:36,665 - optuna.study.study - INFO - Trial 227 finished with value: 0.005409504794191644 and parameters: {'n_layers': 2, 'embedding_dim': 64, 'lr': 2.0454976476810585e-05, 'lambda_val': 0.00020481655466849145, 'batch_size': 712, 'optimizer': 'Adam'}. Best is trial 181 with value: 0.07267092144390536.
2026-05-19 03:00:50,755 - optuna.study._optimize - INFO - Trial 228 pruned. 
2026-05-19 03:01:03,716 - optuna.study._optimize - INFO - Trial 229 pruned. 
2026-05-19 03:01:21,006 - experiment_functions - INFO - Early stopping at epoch 1250. Best Recall: 0.0655
2026-05-19 03:01:21,096 - optuna.study.study - INFO - Trial 230 finished with value: 0.06551188615091887 and parameters: {'n_layers': 1, 'embedding_dim': 64, 'lr': 0.0009429376389578995, 'lambda_val': 2.3034330673609923e-05, 'batch_size': 852, 'optimizer': 'Adam'}. Best is trial 181 with value: 0.07267092144390536.
2026-05-19 03:01:37,727 - experiment_functions - INFO - Early stopping at epoch 1200. Best Recall: 0.0666
2026-05-19 03:01:37,827 - optuna.study.study - INFO - Trial 231 finished with value: 0.066574744394329 and parameters: {'n_layers': 1, 'embedding_dim': 64, 'lr': 0.0010650641530959271, 'lambda_val': 0.00015365109328191443, 'batch_size': 876, 'optimizer': 'Adam'}. Best is trial 181 with value: 0.07267092144390536.
2026-05-19 03:01:55,886 - optuna.study._optimize - INFO - Trial 232 pruned. 
2026-05-19 03:02:09,520 - optuna.study._optimize - INFO - Trial 233 pruned. 
2026-05-19 03:02:25,221 - experiment_functions - INFO - Early stopping at epoch 1100. Best Recall: 0.0667
2026-05-19 03:02:25,319 - optuna.study.study - INFO - Trial 234 finished with value: 0.06673251746232955 and parameters: {'n_layers': 1, 'embedding_dim': 64, 'lr': 0.0011982393504113796, 'lambda_val': 0.0002570492144357142, 'batch_size': 707, 'optimizer': 'Adam'}. Best is trial 181 with value: 0.07267092144390536.
2026-05-19 03:02:38,704 - experiment_functions - INFO - Early stopping at epoch 950. Best Recall: 0.0615
2026-05-19 03:02:38,804 - optuna.study.study - INFO - Trial 235 finished with value: 0.061547580649161535 and parameters: {'n_layers': 1, 'embedding_dim': 64, 'lr': 0.001035032872803194, 'lambda_val': 0.00014662502630719853, 'batch_size': 1794, 'optimizer': 'Adam'}. Best is trial 181 with value: 0.07267092144390536.
2026-05-19 03:02:52,914 - optuna.study._optimize - INFO - Trial 236 pruned. 
2026-05-19 03:03:08,376 - experiment_functions - INFO - Early stopping at epoch 1100. Best Recall: 0.0660
2026-05-19 03:03:08,476 - optuna.study.study - INFO - Trial 237 finished with value: 0.06595478156694493 and parameters: {'n_layers': 1, 'embedding_dim': 64, 'lr': 0.0014149896946289312, 'lambda_val': 0.00022299301214490438, 'batch_size': 608, 'optimizer': 'Adam'}. Best is trial 181 with value: 0.07267092144390536.
2026-05-19 03:03:22,700 - optuna.study._optimize - INFO - Trial 238 pruned. 
2026-05-19 03:03:35,808 - experiment_functions - INFO - Early stopping at epoch 850. Best Recall: 0.0582
2026-05-19 03:03:35,899 - optuna.study.study - INFO - Trial 239 finished with value: 0.05821369602908848 and parameters: {'n_layers': 1, 'embedding_dim': 256, 'lr': 0.0009547388255409095, 'lambda_val': 0.00012478594824765922, 'batch_size': 825, 'optimizer': 'RMSprop'}. Best is trial 181 with value: 0.07267092144390536.
2026-05-19 03:03:54,166 - experiment_functions - INFO - Early stopping at epoch 1150. Best Recall: 0.0669
2026-05-19 03:03:54,266 - optuna.study.study - INFO - Trial 240 finished with value: 0.06690779012699041 and parameters: {'n_layers': 1, 'embedding_dim': 64, 'lr': 0.001270150295434519, 'lambda_val': 0.000161600925089157, 'batch_size': 575, 'optimizer': 'Adam'}. Best is trial 181 with value: 0.07267092144390536.
2026-05-19 03:04:08,444 - experiment_functions - INFO - Early stopping at epoch 900. Best Recall: 0.0642
2026-05-19 03:04:08,523 - optuna.study.study - INFO - Trial 241 finished with value: 0.06422749477188021 and parameters: {'n_layers': 1, 'embedding_dim': 64, 'lr': 0.0016437706593308084, 'lambda_val': 0.0001060318084109227, 'batch_size': 709, 'optimizer': 'Adam'}. Best is trial 181 with value: 0.07267092144390536.
2026-05-19 03:04:21,191 - experiment_functions - INFO - Early stopping at epoch 900. Best Recall: 0.0657
2026-05-19 03:04:21,281 - optuna.study.study - INFO - Trial 242 finished with value: 0.06572928855223274 and parameters: {'n_layers': 1, 'embedding_dim': 64, 'lr': 0.0016634443024524971, 'lambda_val': 0.00013292007458366435, 'batch_size': 672, 'optimizer': 'Adam'}. Best is trial 181 with value: 0.07267092144390536.
2026-05-19 03:04:39,436 - optuna.study._optimize - INFO - Trial 243 pruned. 
2026-05-19 03:04:57,188 - optuna.study._optimize - INFO - Trial 244 pruned. 
2026-05-19 03:05:04,165 - experiment_functions - INFO - Early stopping at epoch 500. Best Recall: 0.0052
2026-05-19 03:05:04,256 - optuna.study.study - INFO - Trial 245 finished with value: 0.0051540052387172 and parameters: {'n_layers': 1, 'embedding_dim': 64, 'lr': 0.0006441927869126981, 'lambda_val': 0.00010007616805754982, 'batch_size': 757, 'optimizer': 'SGD'}. Best is trial 181 with value: 0.07267092144390536.
2026-05-19 03:05:18,483 - experiment_functions - INFO - Early stopping at epoch 1000. Best Recall: 0.0657
2026-05-19 03:05:18,594 - optuna.study.study - INFO - Trial 246 finished with value: 0.06573334704976043 and parameters: {'n_layers': 1, 'embedding_dim': 64, 'lr': 0.0014642128317305756, 'lambda_val': 0.00018102328304161043, 'batch_size': 668, 'optimizer': 'Adam'}. Best is trial 181 with value: 0.07267092144390536.
2026-05-19 03:05:36,443 - optuna.study._optimize - INFO - Trial 247 pruned. 
2026-05-19 03:05:55,487 - experiment_functions - INFO - Early stopping at epoch 1200. Best Recall: 0.0650
2026-05-19 03:05:56,008 - optuna.study.study - INFO - Trial 248 finished with value: 0.06498874802476888 and parameters: {'n_layers': 1, 'embedding_dim': 64, 'lr': 0.0011497264392777383, 'lambda_val': 0.00011419167141059923, 'batch_size': 749, 'optimizer': 'Adam'}. Best is trial 181 with value: 0.07267092144390536.
2026-05-19 03:06:20,173 - experiment_functions - INFO - Early stopping at epoch 1750. Best Recall: 0.0686
2026-05-19 03:06:20,262 - optuna.study.study - INFO - Trial 249 finished with value: 0.0685933182810337 and parameters: {'n_layers': 1, 'embedding_dim': 64, 'lr': 0.0008675673397067527, 'lambda_val': 0.0002876289900443974, 'batch_size': 635, 'optimizer': 'Adam'}. Best is trial 181 with value: 0.07267092144390536.
2026-05-19 03:06:34,716 - optuna.study._optimize - INFO - Trial 250 pruned. 
2026-05-19 03:06:49,091 - optuna.study._optimize - INFO - Trial 251 pruned. 
2026-05-19 03:07:05,603 - optuna.study._optimize - INFO - Trial 252 pruned. 
2026-05-19 03:07:19,718 - experiment_functions - INFO - Early stopping at epoch 900. Best Recall: 0.0523
2026-05-19 03:07:19,823 - optuna.study.study - INFO - Trial 253 finished with value: 0.05227816790777319 and parameters: {'n_layers': 3, 'embedding_dim': 64, 'lr': 0.0007156729648316034, 'lambda_val': 0.00024342793861592234, 'batch_size': 693, 'optimizer': 'Adam'}. Best is trial 181 with value: 0.07267092144390536.
2026-05-19 03:07:31,201 - experiment_functions - INFO - Early stopping at epoch 700. Best Recall: 0.0381
2026-05-19 03:07:31,346 - optuna.study.study - INFO - Trial 254 finished with value: 0.03814918049705514 and parameters: {'n_layers': 4, 'embedding_dim': 64, 'lr': 0.0009320484786928355, 'lambda_val': 0.0002091660674717102, 'batch_size': 912, 'optimizer': 'Adam'}. Best is trial 181 with value: 0.07267092144390536.
2026-05-19 03:07:47,516 - experiment_functions - INFO - Early stopping at epoch 1050. Best Recall: 0.0669
2026-05-19 03:07:47,607 - optuna.study.study - INFO - Trial 255 finished with value: 0.06687899947245045 and parameters: {'n_layers': 1, 'embedding_dim': 64, 'lr': 0.0011897123371200423, 'lambda_val': 0.0004101279039241883, 'batch_size': 801, 'optimizer': 'Adam'}. Best is trial 181 with value: 0.07267092144390536.
2026-05-19 03:08:03,260 - optuna.study._optimize - INFO - Trial 256 pruned. 
2026-05-19 03:08:17,193 - optuna.study._optimize - INFO - Trial 257 pruned. 
2026-05-19 03:08:33,676 - experiment_functions - INFO - Early stopping at epoch 1200. Best Recall: 0.0636
2026-05-19 03:08:33,765 - optuna.study.study - INFO - Trial 258 finished with value: 0.06361549446862355 and parameters: {'n_layers': 1, 'embedding_dim': 64, 'lr': 0.0010667422369626423, 'lambda_val': 2.788194205030775e-05, 'batch_size': 732, 'optimizer': 'Adam'}. Best is trial 181 with value: 0.07267092144390536.
2026-05-19 03:08:54,040 - experiment_functions - INFO - Early stopping at epoch 850. Best Recall: 0.0573
2026-05-19 03:08:54,804 - optuna.study.study - INFO - Trial 259 finished with value: 0.05725577285902246 and parameters: {'n_layers': 1, 'embedding_dim': 64, 'lr': 0.0008711308521225123, 'lambda_val': 0.0004998917084686865, 'batch_size': 4059, 'optimizer': 'Adam'}. Best is trial 181 with value: 0.07267092144390536.
2026-05-19 03:09:10,589 - optuna.study._optimize - INFO - Trial 260 pruned. 
2026-05-19 03:09:28,277 - experiment_functions - INFO - Early stopping at epoch 1050. Best Recall: 0.0687
2026-05-19 03:09:28,367 - optuna.study.study - INFO - Trial 261 finished with value: 0.06869071603193243 and parameters: {'n_layers': 1, 'embedding_dim': 64, 'lr': 0.0013232201130526134, 'lambda_val': 0.00017579897657459716, 'batch_size': 637, 'optimizer': 'Adam'}. Best is trial 181 with value: 0.07267092144390536.
2026-05-19 03:09:42,868 - experiment_functions - INFO - Early stopping at epoch 1050. Best Recall: 0.0648
2026-05-19 03:09:42,958 - optuna.study.study - INFO - Trial 262 finished with value: 0.06480792259537724 and parameters: {'n_layers': 1, 'embedding_dim': 64, 'lr': 0.0012764992347748757, 'lambda_val': 3.482894549823884e-05, 'batch_size': 639, 'optimizer': 'Adam'}. Best is trial 181 with value: 0.07267092144390536.
2026-05-19 03:09:59,208 - optuna.study._optimize - INFO - Trial 263 pruned. 
2026-05-19 03:10:28,064 - optuna.study._optimize - INFO - Trial 264 pruned. 
2026-05-19 03:10:45,744 - optuna.study._optimize - INFO - Trial 265 pruned. 
2026-05-19 03:10:56,533 - experiment_functions - INFO - Early stopping at epoch 850. Best Recall: 0.0050
2026-05-19 03:10:56,625 - optuna.study.study - INFO - Trial 266 finished with value: 0.005041011887054283 and parameters: {'n_layers': 1, 'embedding_dim': 32, 'lr': 0.0011371801198533913, 'lambda_val': 6.322563473711276e-05, 'batch_size': 576, 'optimizer': 'SGD'}. Best is trial 181 with value: 0.07267092144390536.
2026-05-19 03:11:16,397 - optuna.study._optimize - INFO - Trial 267 pruned. 
2026-05-19 03:11:28,974 - experiment_functions - INFO - Early stopping at epoch 850. Best Recall: 0.0641
2026-05-19 03:11:29,074 - optuna.study.study - INFO - Trial 268 finished with value: 0.06413633203456776 and parameters: {'n_layers': 1, 'embedding_dim': 64, 'lr': 0.0019237788162846448, 'lambda_val': 2.496383714528757e-05, 'batch_size': 773, 'optimizer': 'Adam'}. Best is trial 181 with value: 0.07267092144390536.
2026-05-19 03:11:50,045 - experiment_functions - INFO - Early stopping at epoch 1400. Best Recall: 0.0678
2026-05-19 03:11:50,232 - optuna.study.study - INFO - Trial 269 finished with value: 0.067801219185214 and parameters: {'n_layers': 1, 'embedding_dim': 64, 'lr': 0.001004231392222365, 'lambda_val': 0.00016789164637203154, 'batch_size': 687, 'optimizer': 'Adam'}. Best is trial 181 with value: 0.07267092144390536.
2026-05-19 03:12:06,476 - experiment_functions - INFO - Early stopping at epoch 1000. Best Recall: 0.0647
2026-05-19 03:12:06,566 - optuna.study.study - INFO - Trial 270 finished with value: 0.06468490183950033 and parameters: {'n_layers': 1, 'embedding_dim': 64, 'lr': 0.0013369300756401487, 'lambda_val': 0.00016330458968717422, 'batch_size': 704, 'optimizer': 'Adam'}. Best is trial 181 with value: 0.07267092144390536.
2026-05-19 03:12:20,303 - optuna.study._optimize - INFO - Trial 271 pruned. 
2026-05-19 03:12:34,307 - experiment_functions - INFO - Early stopping at epoch 1000. Best Recall: 0.0664
2026-05-19 03:12:34,632 - optuna.study.study - INFO - Trial 272 finished with value: 0.06641535426524227 and parameters: {'n_layers': 1, 'embedding_dim': 64, 'lr': 0.001507631744033832, 'lambda_val': 0.00013481291464069106, 'batch_size': 661, 'optimizer': 'Adam'}. Best is trial 181 with value: 0.07267092144390536.
2026-05-19 03:12:51,763 - experiment_functions - INFO - Early stopping at epoch 1200. Best Recall: 0.0673
2026-05-19 03:12:51,854 - optuna.study.study - INFO - Trial 273 finished with value: 0.06727954025147183 and parameters: {'n_layers': 1, 'embedding_dim': 64, 'lr': 0.0011275443928141506, 'lambda_val': 0.00018706846392385466, 'batch_size': 616, 'optimizer': 'Adam'}. Best is trial 181 with value: 0.07267092144390536.
2026-05-19 03:13:11,491 - optuna.study._optimize - INFO - Trial 274 pruned. 
2026-05-19 03:13:27,914 - optuna.study._optimize - INFO - Trial 275 pruned. 
2026-05-19 03:13:50,020 - optuna.study._optimize - INFO - Trial 276 pruned. 
2026-05-19 03:14:06,696 - experiment_functions - INFO - Early stopping at epoch 1200. Best Recall: 0.0647
2026-05-19 03:14:06,807 - optuna.study.study - INFO - Trial 277 finished with value: 0.06472584643213591 and parameters: {'n_layers': 1, 'embedding_dim': 64, 'lr': 0.0012379700503253998, 'lambda_val': 0.00032020561144744633, 'batch_size': 581, 'optimizer': 'Adam'}. Best is trial 181 with value: 0.07267092144390536.
2026-05-19 03:14:35,589 - experiment_functions - INFO - Early stopping at epoch 1900. Best Recall: 0.0694
2026-05-19 03:14:35,681 - optuna.study.study - INFO - Trial 278 finished with value: 0.06938183500086578 and parameters: {'n_layers': 1, 'embedding_dim': 64, 'lr': 0.0008593778272534896, 'lambda_val': 0.00015542530251602565, 'batch_size': 657, 'optimizer': 'Adam'}. Best is trial 181 with value: 0.07267092144390536.
2026-05-19 03:15:04,459 - experiment_functions - INFO - Early stopping at epoch 2000. Best Recall: 0.0696
2026-05-19 03:15:04,582 - optuna.study.study - INFO - Trial 279 finished with value: 0.06956433681677472 and parameters: {'n_layers': 1, 'embedding_dim': 64, 'lr': 0.0008005492604350145, 'lambda_val': 0.00013383964951780612, 'batch_size': 622, 'optimizer': 'Adam'}. Best is trial 181 with value: 0.07267092144390536.
2026-05-19 03:15:20,639 - optuna.study._optimize - INFO - Trial 280 pruned. 
2026-05-19 03:15:34,315 - optuna.study._optimize - INFO - Trial 281 pruned. 
2026-05-19 03:15:53,139 - optuna.study._optimize - INFO - Trial 282 pruned. 
2026-05-19 03:16:07,126 - optuna.study._optimize - INFO - Trial 283 pruned. 
2026-05-19 03:16:21,741 - optuna.study._optimize - INFO - Trial 284 pruned. 
2026-05-19 03:16:43,936 - experiment_functions - INFO - Early stopping at epoch 1500. Best Recall: 0.0689
2026-05-19 03:16:44,026 - optuna.study.study - INFO - Trial 285 finished with value: 0.06891373188523066 and parameters: {'n_layers': 1, 'embedding_dim': 64, 'lr': 0.0009423857809211818, 'lambda_val': 2.1308833341858983e-05, 'batch_size': 649, 'optimizer': 'Adam'}. Best is trial 181 with value: 0.07267092144390536.
2026-05-19 03:17:03,120 - optuna.study._optimize - INFO - Trial 286 pruned. 
2026-05-19 03:17:19,753 - optuna.study._optimize - INFO - Trial 287 pruned. 
2026-05-19 03:17:34,246 - optuna.study._optimize - INFO - Trial 288 pruned. 
2026-05-19 03:17:44,928 - experiment_functions - INFO - Early stopping at epoch 750. Best Recall: 0.0514
2026-05-19 03:17:45,017 - optuna.study.study - INFO - Trial 289 finished with value: 0.05143801577604382 and parameters: {'n_layers': 2, 'embedding_dim': 64, 'lr': 0.0009017563160523768, 'lambda_val': 1.739707214182722e-05, 'batch_size': 2019, 'optimizer': 'Adam'}. Best is trial 181 with value: 0.07267092144390536.
2026-05-19 03:18:07,247 - optuna.study._optimize - INFO - Trial 290 pruned. 
2026-05-19 03:18:16,656 - experiment_functions - INFO - Early stopping at epoch 500. Best Recall: 0.0049
2026-05-19 03:18:16,745 - optuna.study.study - INFO - Trial 291 finished with value: 0.004853562685834279 and parameters: {'n_layers': 1, 'embedding_dim': 64, 'lr': 0.0008758118342666573, 'lambda_val': 2.0419463780987236e-05, 'batch_size': 513, 'optimizer': 'SGD'}. Best is trial 181 with value: 0.07267092144390536.
2026-05-19 03:18:33,886 - experiment_functions - INFO - Early stopping at epoch 1250. Best Recall: 0.0672
2026-05-19 03:18:33,976 - optuna.study.study - INFO - Trial 292 finished with value: 0.06722641830885233 and parameters: {'n_layers': 1, 'embedding_dim': 32, 'lr': 0.0012846064688340113, 'lambda_val': 5.443574006674735e-05, 'batch_size': 620, 'optimizer': 'Adam'}. Best is trial 181 with value: 0.07267092144390536.
2026-05-19 03:18:48,870 - experiment_functions - INFO - Early stopping at epoch 850. Best Recall: 0.0670
2026-05-19 03:18:48,972 - optuna.study.study - INFO - Trial 293 finished with value: 0.06695098420769706 and parameters: {'n_layers': 1, 'embedding_dim': 64, 'lr': 0.0017746156555001203, 'lambda_val': 6.727734501458434e-05, 'batch_size': 753, 'optimizer': 'Adam'}. Best is trial 181 with value: 0.07267092144390536.
2026-05-19 03:19:01,974 - experiment_functions - INFO - Early stopping at epoch 950. Best Recall: 0.0516
2026-05-19 03:19:02,062 - optuna.study.study - INFO - Trial 294 finished with value: 0.051552900689350804 and parameters: {'n_layers': 1, 'embedding_dim': 64, 'lr': 0.0007642162645141624, 'lambda_val': 3.385248940120528e-05, 'batch_size': 3503, 'optimizer': 'Adam'}. Best is trial 181 with value: 0.07267092144390536.
2026-05-19 03:19:22,858 - experiment_functions - INFO - Early stopping at epoch 1400. Best Recall: 0.0677
2026-05-19 03:19:22,957 - optuna.study.study - INFO - Trial 295 finished with value: 0.06768245785093793 and parameters: {'n_layers': 1, 'embedding_dim': 64, 'lr': 0.000986611941529481, 'lambda_val': 2.427425703090128e-05, 'batch_size': 657, 'optimizer': 'Adam'}. Best is trial 181 with value: 0.07267092144390536.
2026-05-19 03:19:40,827 - experiment_functions - INFO - Early stopping at epoch 1100. Best Recall: 0.0660
2026-05-19 03:19:40,936 - optuna.study.study - INFO - Trial 296 finished with value: 0.06595277925711182 and parameters: {'n_layers': 1, 'embedding_dim': 64, 'lr': 0.0014270790218634624, 'lambda_val': 0.00011596625645163008, 'batch_size': 574, 'optimizer': 'Adam'}. Best is trial 181 with value: 0.07267092144390536.
2026-05-19 03:19:58,350 - optuna.study._optimize - INFO - Trial 297 pruned. 
2026-05-19 03:20:35,898 - experiment_functions - INFO - Early stopping at epoch 2050. Best Recall: 0.0701
2026-05-19 03:20:35,987 - optuna.study.study - INFO - Trial 298 finished with value: 0.07009031319227282 and parameters: {'n_layers': 1, 'embedding_dim': 64, 'lr': 0.0008920075879678629, 'lambda_val': 7.857440575396009e-05, 'batch_size': 515, 'optimizer': 'Adam'}. Best is trial 181 with value: 0.07267092144390536.
