2026-05-18 15:46:25,859 - optuna.study._optimize - INFO - Trial 222 pruned. 
2026-05-18 15:46:46,959 - optuna.study._optimize - INFO - Trial 223 pruned. 
2026-05-18 15:47:07,904 - experiment_functions - INFO - Early stopping at epoch 1550. Best Recall: 0.0688
2026-05-18 15:47:07,993 - optuna.study.study - INFO - Trial 224 finished with value: 0.06881583594286182 and parameters: {'n_layers': 1, 'embedding_dim': 32, 'lr': 0.0010145164137573197, 'lambda_val': 0.00010270289703862449, 'batch_size': 898, 'optimizer': 'Adam'}. Best is trial 209 with value: 0.07239457389190178.
2026-05-18 15:47:26,132 - experiment_functions - INFO - Early stopping at epoch 1300. Best Recall: 0.0682
2026-05-18 15:47:26,279 - optuna.study.study - INFO - Trial 225 finished with value: 0.06818421691922948 and parameters: {'n_layers': 1, 'embedding_dim': 32, 'lr': 0.0010341977491401862, 'lambda_val': 0.0001773821594826563, 'batch_size': 908, 'optimizer': 'Adam'}. Best is trial 209 with value: 0.07239457389190178.
2026-05-18 15:47:43,426 - experiment_functions - INFO - Early stopping at epoch 1300. Best Recall: 0.0650
2026-05-18 15:47:43,527 - optuna.study.study - INFO - Trial 226 finished with value: 0.06496459200505367 and parameters: {'n_layers': 1, 'embedding_dim': 32, 'lr': 0.00103913143839641, 'lambda_val': 0.00016731249781293283, 'batch_size': 904, 'optimizer': 'Adam'}. Best is trial 209 with value: 0.07239457389190178.
2026-05-18 15:48:02,594 - experiment_functions - INFO - Early stopping at epoch 1350. Best Recall: 0.0680
2026-05-18 15:48:02,695 - optuna.study.study - INFO - Trial 227 finished with value: 0.0680377372539594 and parameters: {'n_layers': 1, 'embedding_dim': 32, 'lr': 0.0010388722015186942, 'lambda_val': 0.0001781901906398594, 'batch_size': 868, 'optimizer': 'Adam'}. Best is trial 209 with value: 0.07239457389190178.
2026-05-18 15:48:16,320 - experiment_functions - INFO - Early stopping at epoch 950. Best Recall: 0.0629
2026-05-18 15:48:16,421 - optuna.study.study - INFO - Trial 228 finished with value: 0.06289884875865727 and parameters: {'n_layers': 2, 'embedding_dim': 32, 'lr': 0.0010747429867318176, 'lambda_val': 0.00019191915986322764, 'batch_size': 673, 'optimizer': 'Adam'}. Best is trial 209 with value: 0.07239457389190178.
2026-05-18 15:48:35,648 - optuna.study._optimize - INFO - Trial 229 pruned. 
2026-05-18 15:48:57,267 - optuna.study._optimize - INFO - Trial 230 pruned. 
2026-05-18 15:49:16,840 - experiment_functions - INFO - Early stopping at epoch 1350. Best Recall: 0.0703
2026-05-18 15:49:16,950 - optuna.study.study - INFO - Trial 231 finished with value: 0.07026863465012356 and parameters: {'n_layers': 1, 'embedding_dim': 32, 'lr': 0.001056920431850535, 'lambda_val': 0.00013163931824819415, 'batch_size': 800, 'optimizer': 'Adam'}. Best is trial 209 with value: 0.07239457389190178.
2026-05-18 15:49:35,020 - experiment_functions - INFO - Early stopping at epoch 1250. Best Recall: 0.0607
2026-05-18 15:49:35,119 - optuna.study.study - INFO - Trial 232 finished with value: 0.06070034404065075 and parameters: {'n_layers': 1, 'embedding_dim': 32, 'lr': 0.0010391333934033477, 'lambda_val': 0.00015017139177312975, 'batch_size': 750, 'optimizer': 'Adam'}. Best is trial 209 with value: 0.07239457389190178.
2026-05-18 15:50:00,114 - experiment_functions - INFO - Early stopping at epoch 1700. Best Recall: 0.0676
2026-05-18 15:50:00,203 - optuna.study.study - INFO - Trial 233 finished with value: 0.06760469135595716 and parameters: {'n_layers': 1, 'embedding_dim': 32, 'lr': 0.0008271336897862629, 'lambda_val': 0.00012276594349757244, 'batch_size': 907, 'optimizer': 'Adam'}. Best is trial 209 with value: 0.07239457389190178.
2026-05-18 15:50:18,626 - optuna.study._optimize - INFO - Trial 234 pruned. 
2026-05-18 15:50:32,305 - optuna.study._optimize - INFO - Trial 235 pruned. 
2026-05-18 15:50:47,005 - optuna.study._optimize - INFO - Trial 236 pruned. 
2026-05-18 15:51:10,855 - experiment_functions - INFO - Early stopping at epoch 1650. Best Recall: 0.0685
2026-05-18 15:51:10,945 - optuna.study.study - INFO - Trial 237 finished with value: 0.06846575521781158 and parameters: {'n_layers': 1, 'embedding_dim': 32, 'lr': 0.0008357303488078282, 'lambda_val': 0.00011399444422835249, 'batch_size': 874, 'optimizer': 'Adam'}. Best is trial 209 with value: 0.07239457389190178.
2026-05-18 15:51:18,804 - experiment_functions - INFO - Early stopping at epoch 500. Best Recall: 0.0056
2026-05-18 15:51:18,905 - optuna.study.study - INFO - Trial 238 finished with value: 0.005588373281509699 and parameters: {'n_layers': 1, 'embedding_dim': 32, 'lr': 0.0009030047704842061, 'lambda_val': 0.00010393070925163037, 'batch_size': 920, 'optimizer': 'SGD'}. Best is trial 209 with value: 0.07239457389190178.
2026-05-18 15:51:43,642 - optuna.study._optimize - INFO - Trial 239 pruned. 
2026-05-18 15:52:09,118 - optuna.study._optimize - INFO - Trial 240 pruned. 
2026-05-18 15:52:19,929 - experiment_functions - INFO - Early stopping at epoch 700. Best Recall: 0.0561
2026-05-18 15:52:20,019 - optuna.study.study - INFO - Trial 241 finished with value: 0.05614551365373553 and parameters: {'n_layers': 3, 'embedding_dim': 32, 'lr': 0.001221665284673562, 'lambda_val': 0.0001687412528970482, 'batch_size': 525, 'optimizer': 'Adam'}. Best is trial 209 with value: 0.07239457389190178.
2026-05-18 15:52:53,932 - experiment_functions - INFO - Early stopping at epoch 2400. Best Recall: 0.0693
2026-05-18 15:52:54,031 - optuna.study.study - INFO - Trial 242 finished with value: 0.06926962206110426 and parameters: {'n_layers': 1, 'embedding_dim': 32, 'lr': 0.0009601076058055571, 'lambda_val': 0.00011219391347308193, 'batch_size': 708, 'optimizer': 'Adam'}. Best is trial 209 with value: 0.07239457389190178.
2026-05-18 15:53:18,556 - experiment_functions - INFO - Early stopping at epoch 1700. Best Recall: 0.0691
2026-05-18 15:53:18,663 - optuna.study.study - INFO - Trial 243 finished with value: 0.06908220931008621 and parameters: {'n_layers': 1, 'embedding_dim': 32, 'lr': 0.0009730648605855956, 'lambda_val': 0.00010910984766110792, 'batch_size': 706, 'optimizer': 'Adam'}. Best is trial 209 with value: 0.07239457389190178.
2026-05-18 15:53:47,821 - experiment_functions - INFO - Early stopping at epoch 2050. Best Recall: 0.0723
2026-05-18 15:53:47,911 - optuna.study.study - INFO - Trial 244 finished with value: 0.07227392298771909 and parameters: {'n_layers': 1, 'embedding_dim': 32, 'lr': 0.000958182351276172, 'lambda_val': 0.0001098135320660494, 'batch_size': 686, 'optimizer': 'Adam'}. Best is trial 209 with value: 0.07239457389190178.
2026-05-18 15:54:10,643 - experiment_functions - INFO - Early stopping at epoch 1600. Best Recall: 0.0699
2026-05-18 15:54:10,742 - optuna.study.study - INFO - Trial 245 finished with value: 0.06992878154114533 and parameters: {'n_layers': 1, 'embedding_dim': 32, 'lr': 0.0009868740844120847, 'lambda_val': 0.00012258146749317972, 'batch_size': 686, 'optimizer': 'Adam'}. Best is trial 209 with value: 0.07239457389190178.
2026-05-18 15:54:42,216 - experiment_functions - INFO - Early stopping at epoch 2200. Best Recall: 0.0730
2026-05-18 15:54:42,373 - optuna.study.study - INFO - Trial 246 finished with value: 0.07303555937805462 and parameters: {'n_layers': 1, 'embedding_dim': 32, 'lr': 0.0008169105460406048, 'lambda_val': 0.00010972815544882324, 'batch_size': 690, 'optimizer': 'Adam'}. Best is trial 246 with value: 0.07303555937805462.
2026-05-18 15:54:56,772 - optuna.study._optimize - INFO - Trial 247 pruned. 
2026-05-18 15:55:16,826 - optuna.study._optimize - INFO - Trial 248 pruned. 
2026-05-18 15:55:30,551 - optuna.study._optimize - INFO - Trial 249 pruned. 
2026-05-18 15:55:45,234 - optuna.study._optimize - INFO - Trial 250 pruned. 
2026-05-18 15:55:59,551 - optuna.study._optimize - INFO - Trial 251 pruned. 
2026-05-18 15:56:16,867 - optuna.study._optimize - INFO - Trial 252 pruned. 
2026-05-18 15:56:48,886 - optuna.study._optimize - INFO - Trial 253 pruned. 
2026-05-18 15:57:11,834 - optuna.study._optimize - INFO - Trial 254 pruned. 
2026-05-18 15:57:26,248 - optuna.study._optimize - INFO - Trial 255 pruned. 
2026-05-18 15:57:40,649 - optuna.study._optimize - INFO - Trial 256 pruned. 
2026-05-18 15:58:02,263 - experiment_functions - INFO - Early stopping at epoch 1500. Best Recall: 0.0675
2026-05-18 15:58:02,408 - optuna.study.study - INFO - Trial 257 finished with value: 0.06747119937906995 and parameters: {'n_layers': 1, 'embedding_dim': 32, 'lr': 0.0009456166910866182, 'lambda_val': 0.00010718011598090884, 'batch_size': 822, 'optimizer': 'Adam'}. Best is trial 246 with value: 0.07303555937805462.
2026-05-18 15:58:25,244 - experiment_functions - INFO - Early stopping at epoch 1600. Best Recall: 0.0677
2026-05-18 15:58:25,354 - optuna.study.study - INFO - Trial 258 finished with value: 0.06767934330828046 and parameters: {'n_layers': 1, 'embedding_dim': 32, 'lr': 0.0009265503046036516, 'lambda_val': 9.942660801579583e-05, 'batch_size': 845, 'optimizer': 'Adam'}. Best is trial 246 with value: 0.07303555937805462.
2026-05-18 15:58:51,472 - optuna.study._optimize - INFO - Trial 259 pruned. 
2026-05-18 15:59:11,446 - optuna.study._optimize - INFO - Trial 260 pruned. 
2026-05-18 15:59:28,874 - optuna.study._optimize - INFO - Trial 261 pruned. 
2026-05-18 15:59:48,399 - optuna.study._optimize - INFO - Trial 262 pruned. 
2026-05-18 16:00:03,704 - optuna.study._optimize - INFO - Trial 263 pruned. 
2026-05-18 16:00:20,672 - optuna.study._optimize - INFO - Trial 264 pruned. 
2026-05-18 16:00:42,651 - experiment_functions - INFO - Early stopping at epoch 1450. Best Recall: 0.0696
2026-05-18 16:00:43,414 - optuna.study.study - INFO - Trial 265 finished with value: 0.06963016300507402 and parameters: {'n_layers': 1, 'embedding_dim': 32, 'lr': 0.0012404698104534868, 'lambda_val': 0.0001192790267338756, 'batch_size': 619, 'optimizer': 'Adam'}. Best is trial 246 with value: 0.07303555937805462.
2026-05-18 16:01:09,639 - experiment_functions - INFO - Early stopping at epoch 1250. Best Recall: 0.0692
2026-05-18 16:01:09,738 - optuna.study.study - INFO - Trial 266 finished with value: 0.06923580957494434 and parameters: {'n_layers': 1, 'embedding_dim': 32, 'lr': 0.001221322604635134, 'lambda_val': 0.00013001665765351958, 'batch_size': 618, 'optimizer': 'Adam'}. Best is trial 246 with value: 0.07303555937805462.
2026-05-18 16:01:16,836 - experiment_functions - INFO - Early stopping at epoch 500. Best Recall: 0.0055
2026-05-18 16:01:16,944 - optuna.study.study - INFO - Trial 267 finished with value: 0.005526181479817439 and parameters: {'n_layers': 1, 'embedding_dim': 32, 'lr': 0.001125420503332802, 'lambda_val': 8.790473884817935e-05, 'batch_size': 625, 'optimizer': 'SGD'}. Best is trial 246 with value: 0.07303555937805462.
2026-05-18 16:01:30,658 - optuna.study._optimize - INFO - Trial 268 pruned. 
2026-05-18 16:01:49,376 - optuna.study._optimize - INFO - Trial 269 pruned. 
2026-05-18 16:02:02,704 - optuna.study._optimize - INFO - Trial 270 pruned. 
2026-05-18 16:02:16,465 - optuna.study._optimize - INFO - Trial 271 pruned. 
2026-05-18 16:02:33,207 - experiment_functions - INFO - Early stopping at epoch 1200. Best Recall: 0.0637
2026-05-18 16:02:33,296 - optuna.study.study - INFO - Trial 272 finished with value: 0.0637477329413282 and parameters: {'n_layers': 1, 'embedding_dim': 32, 'lr': 0.0012909081510191715, 'lambda_val': 0.00014033657285332892, 'batch_size': 798, 'optimizer': 'Adam'}. Best is trial 246 with value: 0.07303555937805462.
2026-05-18 16:02:46,511 - optuna.study._optimize - INFO - Trial 273 pruned. 
2026-05-18 16:03:09,620 - optuna.study._optimize - INFO - Trial 274 pruned. 
2026-05-18 16:03:37,820 - experiment_functions - INFO - Early stopping at epoch 2050. Best Recall: 0.0696
2026-05-18 16:03:37,910 - optuna.study.study - INFO - Trial 275 finished with value: 0.06962806253966392 and parameters: {'n_layers': 1, 'embedding_dim': 32, 'lr': 0.0008343025776237132, 'lambda_val': 0.0001431781191394667, 'batch_size': 853, 'optimizer': 'Adam'}. Best is trial 246 with value: 0.07303555937805462.
2026-05-18 16:03:54,838 - optuna.study._optimize - INFO - Trial 276 pruned. 
2026-05-18 16:04:08,034 - optuna.study._optimize - INFO - Trial 277 pruned. 
2026-05-18 16:04:41,847 - experiment_functions - INFO - Early stopping at epoch 2500. Best Recall: 0.0696
2026-05-18 16:04:41,945 - optuna.study.study - INFO - Trial 278 finished with value: 0.06964441390488942 and parameters: {'n_layers': 1, 'embedding_dim': 32, 'lr': 0.0008299415952891153, 'lambda_val': 0.00021676129017369564, 'batch_size': 804, 'optimizer': 'Adam'}. Best is trial 246 with value: 0.07303555937805462.
2026-05-18 16:04:55,357 - optuna.study._optimize - INFO - Trial 279 pruned. 
2026-05-18 16:05:28,677 - experiment_functions - INFO - Early stopping at epoch 2500. Best Recall: 0.0706
2026-05-18 16:05:28,830 - optuna.study.study - INFO - Trial 280 finished with value: 0.07062116227835613 and parameters: {'n_layers': 1, 'embedding_dim': 32, 'lr': 0.0008146595349112411, 'lambda_val': 1.0287875897102132e-05, 'batch_size': 647, 'optimizer': 'Adam'}. Best is trial 246 with value: 0.07303555937805462.
2026-05-18 16:05:44,425 - experiment_functions - INFO - Early stopping at epoch 800. Best Recall: 0.0445
2026-05-18 16:05:44,535 - optuna.study.study - INFO - Trial 281 finished with value: 0.04451377384367276 and parameters: {'n_layers': 4, 'embedding_dim': 256, 'lr': 0.0004371302392270853, 'lambda_val': 8.143429904940963e-06, 'batch_size': 629, 'optimizer': 'Adam'}. Best is trial 246 with value: 0.07303555937805462.
2026-05-18 16:05:59,000 - optuna.study._optimize - INFO - Trial 282 pruned. 
2026-05-18 16:06:12,582 - optuna.study._optimize - INFO - Trial 283 pruned. 
2026-05-18 16:06:29,100 - optuna.study._optimize - INFO - Trial 284 pruned. 
2026-05-18 16:06:44,065 - optuna.study._optimize - INFO - Trial 285 pruned. 
2026-05-18 16:07:03,154 - experiment_functions - INFO - Early stopping at epoch 1000. Best Recall: 0.0635
2026-05-18 16:07:03,243 - optuna.study.study - INFO - Trial 286 finished with value: 0.06348675300897356 and parameters: {'n_layers': 2, 'embedding_dim': 32, 'lr': 0.0008114021887529868, 'lambda_val': 0.0001176803207930394, 'batch_size': 750, 'optimizer': 'Adam'}. Best is trial 246 with value: 0.07303555937805462.
2026-05-18 16:07:22,713 - optuna.study._optimize - INFO - Trial 287 pruned. 
2026-05-18 16:07:36,814 - optuna.study._optimize - INFO - Trial 288 pruned. 
2026-05-18 16:07:58,554 - experiment_functions - INFO - Early stopping at epoch 1500. Best Recall: 0.0677
2026-05-18 16:07:58,645 - optuna.study.study - INFO - Trial 289 finished with value: 0.06768566300869258 and parameters: {'n_layers': 1, 'embedding_dim': 32, 'lr': 0.0009602199063380283, 'lambda_val': 0.00025819554705995036, 'batch_size': 822, 'optimizer': 'Adam'}. Best is trial 246 with value: 0.07303555937805462.
2026-05-18 16:08:05,875 - experiment_functions - INFO - Early stopping at epoch 500. Best Recall: 0.0047
2026-05-18 16:08:05,964 - optuna.study.study - INFO - Trial 290 finished with value: 0.0046721127580064675 and parameters: {'n_layers': 1, 'embedding_dim': 32, 'lr': 0.0011692132764627493, 'lambda_val': 2.878198343489896e-06, 'batch_size': 791, 'optimizer': 'SGD'}. Best is trial 246 with value: 0.07303555937805462.
2026-05-18 16:08:28,923 - experiment_functions - INFO - Early stopping at epoch 1600. Best Recall: 0.0668
2026-05-18 16:08:29,012 - optuna.study.study - INFO - Trial 291 finished with value: 0.06678330236917177 and parameters: {'n_layers': 1, 'embedding_dim': 32, 'lr': 0.0010200393056008508, 'lambda_val': 0.00010383958806300795, 'batch_size': 626, 'optimizer': 'Adam'}. Best is trial 246 with value: 0.07303555937805462.
2026-05-18 16:08:43,786 - optuna.study._optimize - INFO - Trial 292 pruned. 
2026-05-18 16:08:58,220 - optuna.study._optimize - INFO - Trial 293 pruned. 
2026-05-18 16:09:14,192 - optuna.study._optimize - INFO - Trial 294 pruned. 
2026-05-18 16:09:31,657 - optuna.study._optimize - INFO - Trial 295 pruned. 
2026-05-18 16:09:52,453 - experiment_functions - INFO - Early stopping at epoch 1250. Best Recall: 0.0681
2026-05-18 16:09:53,226 - optuna.study.study - INFO - Trial 296 finished with value: 0.0681256933781668 and parameters: {'n_layers': 1, 'embedding_dim': 32, 'lr': 0.0012875157550388677, 'lambda_val': 0.0002309440607528142, 'batch_size': 586, 'optimizer': 'Adam'}. Best is trial 246 with value: 0.07303555937805462.
2026-05-18 16:10:11,921 - experiment_functions - INFO - Early stopping at epoch 800. Best Recall: 0.0561
2026-05-18 16:10:12,066 - optuna.study.study - INFO - Trial 297 finished with value: 0.05605491700451067 and parameters: {'n_layers': 1, 'embedding_dim': 32, 'lr': 0.0012148260651145318, 'lambda_val': 0.0002593645036109082, 'batch_size': 3438, 'optimizer': 'Adam'}. Best is trial 246 with value: 0.07303555937805462.
2026-05-18 16:10:26,355 - optuna.study._optimize - INFO - Trial 298 pruned. 
2026-05-18 16:10:45,841 - experiment_functions - INFO - Early stopping at epoch 1300. Best Recall: 0.0698
2026-05-18 16:10:45,930 - optuna.study.study - INFO - Trial 299 finished with value: 0.06977448235116829 and parameters: {'n_layers': 1, 'embedding_dim': 32, 'lr': 0.0013393408636662209, 'lambda_val': 1.1129276460741867e-05, 'batch_size': 649, 'optimizer': 'Adam'}. Best is trial 246 with value: 0.07303555937805462.
2026-05-18 16:11:12,324 - experiment_functions - INFO - Early stopping at epoch 2300. Best Recall: 0.0687
2026-05-18 16:11:13,420 - root - INFO -   **** Training e_1M_1c2dcs_rand4
2026-05-18 16:11:13,476 - root - INFO -   **** Getting 202263/805443 random edges
2026-05-18 16:11:13,780 - optuna.storages._rdb.storage - INFO - A new study created in RDB with name: Study_e_1M_1c2dcs_rand4
2026-05-18 16:11:40,984 - experiment_functions - INFO - Early stopping at epoch 1150. Best Recall: 0.0072
2026-05-18 16:11:41,077 - optuna.study.study - INFO - Trial 0 finished with value: 0.007185702197662544 and parameters: {'n_layers': 3, 'embedding_dim': 128, 'lr': 0.008126891705539362, 'lambda_val': 0.02130999140682102, 'batch_size': 3976, 'optimizer': 'Adam'}. Best is trial 0 with value: 0.007185702197662544.
2026-05-18 16:11:54,696 - experiment_functions - INFO - Early stopping at epoch 500. Best Recall: 0.0053
2026-05-18 16:11:54,794 - optuna.study.study - INFO - Trial 1 finished with value: 0.0052733156719361445 and parameters: {'n_layers': 1, 'embedding_dim': 256, 'lr': 0.0024494969353722256, 'lambda_val': 0.05100313436396405, 'batch_size': 1603, 'optimizer': 'SGD'}. Best is trial 0 with value: 0.007185702197662544.
2026-05-18 16:12:02,673 - experiment_functions - INFO - Early stopping at epoch 500. Best Recall: 0.0048
2026-05-18 16:12:02,784 - optuna.study.study - INFO - Trial 2 finished with value: 0.004808334108345214 and parameters: {'n_layers': 1, 'embedding_dim': 256, 'lr': 5.766753218063098e-05, 'lambda_val': 0.013052092460434752, 'batch_size': 3246, 'optimizer': 'SGD'}. Best is trial 0 with value: 0.007185702197662544.
2026-05-18 16:12:25,276 - experiment_functions - INFO - Early stopping at epoch 850. Best Recall: 0.0260
2026-05-18 16:12:25,369 - optuna.study.study - INFO - Trial 3 finished with value: 0.02601320116135597 and parameters: {'n_layers': 2, 'embedding_dim': 96, 'lr': 0.01278351581499335, 'lambda_val': 5.111003303453014e-06, 'batch_size': 3951, 'optimizer': 'Adam'}. Best is trial 3 with value: 0.02601320116135597.
2026-05-18 16:12:33,681 - experiment_functions - INFO - Early stopping at epoch 500. Best Recall: 0.0045
2026-05-18 16:12:33,783 - optuna.study.study - INFO - Trial 4 finished with value: 0.004529978387013603 and parameters: {'n_layers': 3, 'embedding_dim': 96, 'lr': 0.06579234080428925, 'lambda_val': 2.99479550466863e-05, 'batch_size': 2984, 'optimizer': 'SGD'}. Best is trial 3 with value: 0.02601320116135597.
2026-05-18 16:12:53,071 - experiment_functions - INFO - Early stopping at epoch 1350. Best Recall: 0.0120
2026-05-18 16:12:53,161 - optuna.study.study - INFO - Trial 5 finished with value: 0.01204763113624731 and parameters: {'n_layers': 4, 'embedding_dim': 32, 'lr': 0.02258529931332386, 'lambda_val': 0.004369310002454528, 'batch_size': 2045, 'optimizer': 'Adam'}. Best is trial 3 with value: 0.02601320116135597.
2026-05-18 16:13:00,993 - experiment_functions - INFO - Early stopping at epoch 500. Best Recall: 0.0105
2026-05-18 16:13:01,093 - optuna.study.study - INFO - Trial 6 finished with value: 0.010546142683544714 and parameters: {'n_layers': 3, 'embedding_dim': 64, 'lr': 0.05057789272563472, 'lambda_val': 0.05507154772844521, 'batch_size': 703, 'optimizer': 'RMSprop'}. Best is trial 3 with value: 0.02601320116135597.
2026-05-18 16:13:08,298 - experiment_functions - INFO - Early stopping at epoch 500. Best Recall: 0.0056
2026-05-18 16:13:08,399 - optuna.study.study - INFO - Trial 7 finished with value: 0.005642154699595633 and parameters: {'n_layers': 1, 'embedding_dim': 32, 'lr': 0.0001979956907825471, 'lambda_val': 4.0598620867073336e-05, 'batch_size': 2280, 'optimizer': 'SGD'}. Best is trial 3 with value: 0.02601320116135597.
2026-05-18 16:13:49,094 - experiment_functions - INFO - Early stopping at epoch 2500. Best Recall: 0.0342
2026-05-18 16:13:49,184 - optuna.study.study - INFO - Trial 8 finished with value: 0.03418755925811379 and parameters: {'n_layers': 2, 'embedding_dim': 256, 'lr': 0.00263253671764612, 'lambda_val': 1.2279139758855593e-06, 'batch_size': 3239, 'optimizer': 'RMSprop'}. Best is trial 8 with value: 0.03418755925811379.
2026-05-18 16:14:00,157 - experiment_functions - INFO - Early stopping at epoch 750. Best Recall: 0.0196
