2026-05-18 01:30:23,272 - optuna.study.study - INFO - Trial 145 finished with value: 0.07135157249277717 and parameters: {'n_layers': 1, 'embedding_dim': 64, 'lr': 0.0007609709160529196, 'lambda_val': 1.1404469719508833e-05, 'batch_size': 650, 'optimizer': 'RMSprop'}. Best is trial 131 with value: 0.07240747462844048.
2026-05-18 01:30:46,442 - experiment_functions - INFO - Early stopping at epoch 1700. Best Recall: 0.0704
2026-05-18 01:30:46,542 - optuna.study.study - INFO - Trial 146 finished with value: 0.07042697428166776 and parameters: {'n_layers': 1, 'embedding_dim': 64, 'lr': 0.0007860242821913374, 'lambda_val': 2.2702192200684713e-05, 'batch_size': 613, 'optimizer': 'RMSprop'}. Best is trial 131 with value: 0.07240747462844048.
2026-05-18 01:30:59,987 - optuna.study._optimize - INFO - Trial 147 pruned. 
2026-05-18 01:31:15,212 - experiment_functions - INFO - Early stopping at epoch 1050. Best Recall: 0.0631
2026-05-18 01:31:15,313 - optuna.study.study - INFO - Trial 148 finished with value: 0.06313137663037159 and parameters: {'n_layers': 1, 'embedding_dim': 64, 'lr': 0.0010623718382977909, 'lambda_val': 2.0592914655908784e-05, 'batch_size': 714, 'optimizer': 'RMSprop'}. Best is trial 131 with value: 0.07240747462844048.
2026-05-18 01:31:28,615 - optuna.study._optimize - INFO - Trial 149 pruned. 
2026-05-18 01:31:41,915 - optuna.study._optimize - INFO - Trial 150 pruned. 
2026-05-18 01:32:20,273 - experiment_functions - INFO - Early stopping at epoch 2650. Best Recall: 0.0683
2026-05-18 01:32:20,407 - optuna.study.study - INFO - Trial 151 finished with value: 0.06833586375205254 and parameters: {'n_layers': 1, 'embedding_dim': 64, 'lr': 0.0007848824973161666, 'lambda_val': 1.1179890317792378e-05, 'batch_size': 515, 'optimizer': 'RMSprop'}. Best is trial 131 with value: 0.07240747462844048.
2026-05-18 01:32:38,231 - experiment_functions - INFO - Early stopping at epoch 1300. Best Recall: 0.0665
2026-05-18 01:32:38,329 - optuna.study.study - INFO - Trial 152 finished with value: 0.06650997280883107 and parameters: {'n_layers': 1, 'embedding_dim': 64, 'lr': 0.0009058248271507133, 'lambda_val': 1.5932778823985168e-05, 'batch_size': 654, 'optimizer': 'RMSprop'}. Best is trial 131 with value: 0.07240747462844048.
2026-05-18 01:32:52,150 - optuna.study._optimize - INFO - Trial 153 pruned. 
2026-05-18 01:33:01,402 - experiment_functions - INFO - Early stopping at epoch 650. Best Recall: 0.0054
2026-05-18 01:33:01,492 - optuna.study.study - INFO - Trial 154 finished with value: 0.005350205935497507 and parameters: {'n_layers': 1, 'embedding_dim': 64, 'lr': 1.954391944329624e-05, 'lambda_val': 1.1059828796503636e-05, 'batch_size': 600, 'optimizer': 'RMSprop'}. Best is trial 131 with value: 0.07240747462844048.
2026-05-18 01:33:22,163 - experiment_functions - INFO - Early stopping at epoch 1500. Best Recall: 0.0671
2026-05-18 01:33:22,264 - optuna.study.study - INFO - Trial 155 finished with value: 0.06709596070010414 and parameters: {'n_layers': 1, 'embedding_dim': 64, 'lr': 0.0007728955536828449, 'lambda_val': 1.7905825390317236e-05, 'batch_size': 902, 'optimizer': 'RMSprop'}. Best is trial 131 with value: 0.07240747462844048.
2026-05-18 01:33:36,312 - optuna.study._optimize - INFO - Trial 156 pruned. 
2026-05-18 01:33:52,998 - experiment_functions - INFO - Early stopping at epoch 700. Best Recall: 0.0580
2026-05-18 01:33:53,087 - optuna.study.study - INFO - Trial 157 finished with value: 0.058047311080069705 and parameters: {'n_layers': 1, 'embedding_dim': 128, 'lr': 0.0013647803355567487, 'lambda_val': 1.2533289301678129e-05, 'batch_size': 797, 'optimizer': 'RMSprop'}. Best is trial 131 with value: 0.07240747462844048.
2026-05-18 01:34:11,527 - experiment_functions - INFO - Early stopping at epoch 1350. Best Recall: 0.0674
2026-05-18 01:34:11,618 - optuna.study.study - INFO - Trial 158 finished with value: 0.06741446154429707 and parameters: {'n_layers': 1, 'embedding_dim': 64, 'lr': 0.0009215961318588726, 'lambda_val': 8.768294879196937e-06, 'batch_size': 678, 'optimizer': 'RMSprop'}. Best is trial 131 with value: 0.07240747462844048.
2026-05-18 01:34:35,487 - experiment_functions - INFO - Early stopping at epoch 1650. Best Recall: 0.0711
2026-05-18 01:34:35,587 - optuna.study.study - INFO - Trial 159 finished with value: 0.07110103543398337 and parameters: {'n_layers': 1, 'embedding_dim': 64, 'lr': 0.000803146622774888, 'lambda_val': 2.0788414138059436e-05, 'batch_size': 598, 'optimizer': 'RMSprop'}. Best is trial 131 with value: 0.07240747462844048.
2026-05-18 01:34:42,425 - experiment_functions - INFO - Early stopping at epoch 500. Best Recall: 0.0052
2026-05-18 01:34:42,514 - optuna.study.study - INFO - Trial 160 finished with value: 0.005175185063338883 and parameters: {'n_layers': 1, 'embedding_dim': 64, 'lr': 0.00047572496470163597, 'lambda_val': 2.333728450716864e-05, 'batch_size': 4095, 'optimizer': 'SGD'}. Best is trial 131 with value: 0.07240747462844048.
2026-05-18 01:35:12,399 - experiment_functions - INFO - Early stopping at epoch 1950. Best Recall: 0.0732
2026-05-18 01:35:13,169 - optuna.study.study - INFO - Trial 161 finished with value: 0.0732140772759469 and parameters: {'n_layers': 1, 'embedding_dim': 64, 'lr': 0.000789302303399349, 'lambda_val': 1.4917141655772208e-05, 'batch_size': 586, 'optimizer': 'RMSprop'}. Best is trial 161 with value: 0.0732140772759469.
2026-05-18 01:35:32,676 - experiment_functions - INFO - Early stopping at epoch 950. Best Recall: 0.0634
2026-05-18 01:35:32,775 - optuna.study.study - INFO - Trial 162 finished with value: 0.06335098258194025 and parameters: {'n_layers': 1, 'embedding_dim': 64, 'lr': 0.0010765604494267006, 'lambda_val': 1.553644247940433e-05, 'batch_size': 763, 'optimizer': 'RMSprop'}. Best is trial 161 with value: 0.0732140772759469.
2026-05-18 01:35:40,677 - experiment_functions - INFO - Early stopping at epoch 500. Best Recall: 0.0042
2026-05-18 01:35:40,775 - optuna.study.study - INFO - Trial 163 finished with value: 0.004241446778360351 and parameters: {'n_layers': 1, 'embedding_dim': 64, 'lr': 0.0005693524564978606, 'lambda_val': 0.07938110038371511, 'batch_size': 599, 'optimizer': 'RMSprop'}. Best is trial 161 with value: 0.0732140772759469.
2026-05-18 01:36:09,057 - experiment_functions - INFO - Early stopping at epoch 1650. Best Recall: 0.0668
2026-05-18 01:36:09,267 - optuna.study.study - INFO - Trial 164 finished with value: 0.06681187332886582 and parameters: {'n_layers': 1, 'embedding_dim': 64, 'lr': 0.0007906777717843331, 'lambda_val': 1.890962053039799e-05, 'batch_size': 665, 'optimizer': 'RMSprop'}. Best is trial 161 with value: 0.0732140772759469.
2026-05-18 01:36:51,493 - experiment_functions - INFO - Early stopping at epoch 2300. Best Recall: 0.0683
2026-05-18 01:36:51,581 - optuna.study.study - INFO - Trial 165 finished with value: 0.0682873634489802 and parameters: {'n_layers': 1, 'embedding_dim': 64, 'lr': 0.0006475133206374312, 'lambda_val': 3.144772854853975e-05, 'batch_size': 857, 'optimizer': 'RMSprop'}. Best is trial 161 with value: 0.0732140772759469.
2026-05-18 01:37:04,834 - optuna.study._optimize - INFO - Trial 166 pruned. 
2026-05-18 01:37:15,006 - experiment_functions - INFO - Early stopping at epoch 700. Best Recall: 0.0609
2026-05-18 01:37:15,107 - optuna.study.study - INFO - Trial 167 finished with value: 0.06091577558786517 and parameters: {'n_layers': 1, 'embedding_dim': 64, 'lr': 0.0016221900942989193, 'lambda_val': 2.5200530732703346e-05, 'batch_size': 759, 'optimizer': 'RMSprop'}. Best is trial 161 with value: 0.0732140772759469.
2026-05-18 01:37:28,620 - experiment_functions - INFO - Early stopping at epoch 900. Best Recall: 0.0650
2026-05-18 01:37:28,709 - optuna.study.study - INFO - Trial 168 finished with value: 0.06501305637745763 and parameters: {'n_layers': 1, 'embedding_dim': 64, 'lr': 0.0011925577684882777, 'lambda_val': 8.303769912170903e-06, 'batch_size': 591, 'optimizer': 'RMSprop'}. Best is trial 161 with value: 0.0732140772759469.
2026-05-18 01:37:48,531 - experiment_functions - INFO - Early stopping at epoch 1250. Best Recall: 0.0654
2026-05-18 01:37:48,632 - optuna.study.study - INFO - Trial 169 finished with value: 0.06543549592324027 and parameters: {'n_layers': 1, 'embedding_dim': 64, 'lr': 0.0009428393056359027, 'lambda_val': 1.0356397346812392e-05, 'batch_size': 677, 'optimizer': 'RMSprop'}. Best is trial 161 with value: 0.0732140772759469.
2026-05-18 01:38:00,460 - experiment_functions - INFO - Early stopping at epoch 900. Best Recall: 0.0165
2026-05-18 01:38:00,539 - optuna.study.study - INFO - Trial 170 finished with value: 0.016471444660872563 and parameters: {'n_layers': 1, 'embedding_dim': 64, 'lr': 0.018493819642028442, 'lambda_val': 1.8614025546401185e-05, 'batch_size': 586, 'optimizer': 'RMSprop'}. Best is trial 161 with value: 0.0732140772759469.
2026-05-18 01:38:53,486 - experiment_functions - INFO - Early stopping at epoch 2350. Best Recall: 0.0705
2026-05-18 01:38:54,249 - optuna.study.study - INFO - Trial 171 finished with value: 0.07053174909070586 and parameters: {'n_layers': 1, 'embedding_dim': 64, 'lr': 0.000749051010183497, 'lambda_val': 1.2286542260674718e-05, 'batch_size': 514, 'optimizer': 'RMSprop'}. Best is trial 161 with value: 0.0732140772759469.
2026-05-18 01:39:10,378 - optuna.study._optimize - INFO - Trial 172 pruned. 
2026-05-18 01:39:24,401 - optuna.study._optimize - INFO - Trial 173 pruned. 
2026-05-18 01:39:37,672 - optuna.study._optimize - INFO - Trial 174 pruned. 
2026-05-18 01:39:59,746 - experiment_functions - INFO - Early stopping at epoch 1500. Best Recall: 0.0659
2026-05-18 01:39:59,846 - optuna.study.study - INFO - Trial 175 finished with value: 0.06594693219687893 and parameters: {'n_layers': 1, 'embedding_dim': 64, 'lr': 0.0008024040928717729, 'lambda_val': 5.315634444829621e-06, 'batch_size': 670, 'optimizer': 'RMSprop'}. Best is trial 161 with value: 0.0732140772759469.
2026-05-18 01:40:20,852 - experiment_functions - INFO - Early stopping at epoch 1250. Best Recall: 0.0665
2026-05-18 01:40:21,615 - optuna.study.study - INFO - Trial 176 finished with value: 0.06649877070180958 and parameters: {'n_layers': 1, 'embedding_dim': 64, 'lr': 0.0009679591989100324, 'lambda_val': 2.217784359692373e-05, 'batch_size': 519, 'optimizer': 'RMSprop'}. Best is trial 161 with value: 0.0732140772759469.
2026-05-18 01:40:41,254 - optuna.study._optimize - INFO - Trial 177 pruned. 
2026-05-18 01:41:00,396 - experiment_functions - INFO - Early stopping at epoch 1200. Best Recall: 0.0670
2026-05-18 01:41:00,531 - optuna.study.study - INFO - Trial 178 finished with value: 0.06695628016134927 and parameters: {'n_layers': 1, 'embedding_dim': 64, 'lr': 0.0008347155169863512, 'lambda_val': 3.386748835888781e-05, 'batch_size': 892, 'optimizer': 'RMSprop'}. Best is trial 161 with value: 0.0732140772759469.
2026-05-18 01:41:19,627 - optuna.study._optimize - INFO - Trial 179 pruned. 
2026-05-18 01:41:28,967 - experiment_functions - INFO - Early stopping at epoch 500. Best Recall: 0.0051
2026-05-18 01:41:29,056 - optuna.study.study - INFO - Trial 180 finished with value: 0.005050428167758173 and parameters: {'n_layers': 1, 'embedding_dim': 64, 'lr': 0.00037119800671791555, 'lambda_val': 0.030818692666424962, 'batch_size': 638, 'optimizer': 'RMSprop'}. Best is trial 161 with value: 0.0732140772759469.
2026-05-18 01:41:53,441 - experiment_functions - INFO - Early stopping at epoch 1700. Best Recall: 0.0703
2026-05-18 01:41:53,541 - optuna.study.study - INFO - Trial 181 finished with value: 0.07029182537354516 and parameters: {'n_layers': 1, 'embedding_dim': 64, 'lr': 0.000806311586473863, 'lambda_val': 1.1149208080695435e-05, 'batch_size': 529, 'optimizer': 'RMSprop'}. Best is trial 161 with value: 0.0732140772759469.
2026-05-18 01:42:06,857 - experiment_functions - INFO - Early stopping at epoch 900. Best Recall: 0.0637
2026-05-18 01:42:06,954 - optuna.study.study - INFO - Trial 182 finished with value: 0.06368005598094675 and parameters: {'n_layers': 1, 'embedding_dim': 64, 'lr': 0.0011558962042777763, 'lambda_val': 1.0410175827588912e-05, 'batch_size': 584, 'optimizer': 'RMSprop'}. Best is trial 161 with value: 0.0732140772759469.
2026-05-18 01:42:45,540 - experiment_functions - INFO - Early stopping at epoch 2750. Best Recall: 0.0710
2026-05-18 01:42:45,629 - optuna.study.study - INFO - Trial 183 finished with value: 0.0709537291517107 and parameters: {'n_layers': 1, 'embedding_dim': 64, 'lr': 0.0006239194718877786, 'lambda_val': 1.3691821408742072e-05, 'batch_size': 685, 'optimizer': 'RMSprop'}. Best is trial 161 with value: 0.0732140772759469.
2026-05-18 01:42:59,806 - optuna.study._optimize - INFO - Trial 184 pruned. 
2026-05-18 01:43:19,137 - experiment_functions - INFO - Early stopping at epoch 1400. Best Recall: 0.0683
2026-05-18 01:43:19,258 - optuna.study.study - INFO - Trial 185 finished with value: 0.06829618781107699 and parameters: {'n_layers': 1, 'embedding_dim': 64, 'lr': 0.0008206190954397933, 'lambda_val': 8.218191587350864e-06, 'batch_size': 684, 'optimizer': 'RMSprop'}. Best is trial 161 with value: 0.0732140772759469.
2026-05-18 01:43:33,827 - optuna.study._optimize - INFO - Trial 186 pruned. 
2026-05-18 01:44:00,746 - experiment_functions - INFO - Early stopping at epoch 1900. Best Recall: 0.0706
2026-05-18 01:44:00,835 - optuna.study.study - INFO - Trial 187 finished with value: 0.07064067892434771 and parameters: {'n_layers': 1, 'embedding_dim': 64, 'lr': 0.0007274217029582908, 'lambda_val': 5.675337234059308e-06, 'batch_size': 597, 'optimizer': 'RMSprop'}. Best is trial 161 with value: 0.0732140772759469.
2026-05-18 01:44:14,330 - optuna.study._optimize - INFO - Trial 188 pruned. 
2026-05-18 01:44:28,525 - optuna.study._optimize - INFO - Trial 189 pruned. 
2026-05-18 01:44:40,686 - experiment_functions - INFO - Early stopping at epoch 850. Best Recall: 0.0682
2026-05-18 01:44:40,790 - optuna.study.study - INFO - Trial 190 finished with value: 0.06822232857319446 and parameters: {'n_layers': 1, 'embedding_dim': 64, 'lr': 0.0012752856046753407, 'lambda_val': 4.957043684360137e-06, 'batch_size': 704, 'optimizer': 'RMSprop'}. Best is trial 161 with value: 0.0732140772759469.
2026-05-18 01:45:14,099 - experiment_functions - INFO - Early stopping at epoch 1650. Best Recall: 0.0713
2026-05-18 01:45:14,203 - optuna.study.study - INFO - Trial 191 finished with value: 0.07131850320327339 and parameters: {'n_layers': 1, 'embedding_dim': 64, 'lr': 0.0007821325536583408, 'lambda_val': 1.0114672930717809e-05, 'batch_size': 586, 'optimizer': 'RMSprop'}. Best is trial 161 with value: 0.0732140772759469.
2026-05-18 01:45:28,970 - optuna.study._optimize - INFO - Trial 192 pruned. 
2026-05-18 01:45:47,541 - experiment_functions - INFO - Early stopping at epoch 1250. Best Recall: 0.0689
2026-05-18 01:45:47,656 - optuna.study.study - INFO - Trial 193 finished with value: 0.06894800511100484 and parameters: {'n_layers': 1, 'embedding_dim': 64, 'lr': 0.0009764637226726325, 'lambda_val': 9.027018157567814e-06, 'batch_size': 632, 'optimizer': 'RMSprop'}. Best is trial 161 with value: 0.0732140772759469.
2026-05-18 01:46:03,100 - optuna.study._optimize - INFO - Trial 194 pruned. 
2026-05-18 01:46:27,583 - optuna.study._optimize - INFO - Trial 195 pruned. 
2026-05-18 01:46:41,233 - optuna.study._optimize - INFO - Trial 196 pruned. 
2026-05-18 01:47:01,955 - experiment_functions - INFO - Early stopping at epoch 1300. Best Recall: 0.0675
2026-05-18 01:47:02,048 - optuna.study.study - INFO - Trial 197 finished with value: 0.06753658615696409 and parameters: {'n_layers': 1, 'embedding_dim': 64, 'lr': 0.0008672178704274912, 'lambda_val': 1.2715127040134978e-05, 'batch_size': 789, 'optimizer': 'RMSprop'}. Best is trial 161 with value: 0.0732140772759469.
2026-05-18 01:47:15,454 - optuna.study._optimize - INFO - Trial 198 pruned. 
2026-05-18 01:47:29,209 - experiment_functions - INFO - Early stopping at epoch 800. Best Recall: 0.0672
2026-05-18 01:47:29,978 - optuna.study.study - INFO - Trial 199 finished with value: 0.06715410869569118 and parameters: {'n_layers': 1, 'embedding_dim': 64, 'lr': 0.0012812653222571428, 'lambda_val': 9.135750731325741e-06, 'batch_size': 706, 'optimizer': 'RMSprop'}. Best is trial 161 with value: 0.0732140772759469.
2026-05-18 01:47:44,290 - experiment_functions - INFO - Early stopping at epoch 500. Best Recall: 0.0053
2026-05-18 01:47:44,394 - optuna.study.study - INFO - Trial 200 finished with value: 0.005347249716179545 and parameters: {'n_layers': 1, 'embedding_dim': 64, 'lr': 0.0007122166690337236, 'lambda_val': 4.976775710245091e-06, 'batch_size': 584, 'optimizer': 'SGD'}. Best is trial 161 with value: 0.0732140772759469.
2026-05-18 01:48:07,657 - experiment_functions - INFO - Early stopping at epoch 1500. Best Recall: 0.0675
2026-05-18 01:48:07,749 - optuna.study.study - INFO - Trial 201 finished with value: 0.06752362781175426 and parameters: {'n_layers': 1, 'embedding_dim': 64, 'lr': 0.0007898030078365765, 'lambda_val': 1.5233067836728784e-05, 'batch_size': 684, 'optimizer': 'RMSprop'}. Best is trial 161 with value: 0.0732140772759469.
2026-05-18 01:48:26,655 - experiment_functions - INFO - Early stopping at epoch 1400. Best Recall: 0.0682
2026-05-18 01:48:26,749 - optuna.study.study - INFO - Trial 202 finished with value: 0.06817124451732594 and parameters: {'n_layers': 1, 'embedding_dim': 64, 'lr': 0.000899635375195761, 'lambda_val': 1.7791389302980843e-05, 'batch_size': 638, 'optimizer': 'RMSprop'}. Best is trial 161 with value: 0.0732140772759469.
2026-05-18 01:48:40,500 - optuna.study._optimize - INFO - Trial 203 pruned. 
2026-05-18 01:48:55,966 - optuna.study._optimize - INFO - Trial 204 pruned. 
2026-05-18 01:49:12,057 - experiment_functions - INFO - Early stopping at epoch 1100. Best Recall: 0.0685
2026-05-18 01:49:12,160 - optuna.study.study - INFO - Trial 205 finished with value: 0.06854712983265826 and parameters: {'n_layers': 1, 'embedding_dim': 64, 'lr': 0.0010612225720921678, 'lambda_val': 9.720381728138059e-06, 'batch_size': 647, 'optimizer': 'RMSprop'}. Best is trial 161 with value: 0.0732140772759469.
2026-05-18 01:49:30,691 - experiment_functions - INFO - Early stopping at epoch 1300. Best Recall: 0.0664
2026-05-18 01:49:30,782 - optuna.study.study - INFO - Trial 206 finished with value: 0.06635462417379673 and parameters: {'n_layers': 1, 'embedding_dim': 64, 'lr': 0.0008271514050585861, 'lambda_val': 1.955001750892668e-05, 'batch_size': 758, 'optimizer': 'RMSprop'}. Best is trial 161 with value: 0.0732140772759469.
2026-05-18 01:49:48,606 - experiment_functions - INFO - Early stopping at epoch 950. Best Recall: 0.0479
2026-05-18 01:49:48,777 - optuna.study.study - INFO - Trial 207 finished with value: 0.047934038669745174 and parameters: {'n_layers': 3, 'embedding_dim': 64, 'lr': 0.0005458556726404449, 'lambda_val': 2.7885054327119214e-05, 'batch_size': 583, 'optimizer': 'RMSprop'}. Best is trial 161 with value: 0.0732140772759469.
2026-05-18 01:50:10,837 - experiment_functions - INFO - Early stopping at epoch 1700. Best Recall: 0.0675
2026-05-18 01:50:10,929 - optuna.study.study - INFO - Trial 208 finished with value: 0.06750284990433722 and parameters: {'n_layers': 1, 'embedding_dim': 64, 'lr': 0.0006718023036667499, 'lambda_val': 7.4905544069746434e-06, 'batch_size': 896, 'optimizer': 'RMSprop'}. Best is trial 161 with value: 0.0732140772759469.
2026-05-18 01:50:23,925 - optuna.study._optimize - INFO - Trial 209 pruned. 
2026-05-18 01:50:34,500 - experiment_functions - INFO - Early stopping at epoch 750. Best Recall: 0.0639
2026-05-18 01:50:34,602 - optuna.study.study - INFO - Trial 210 finished with value: 0.0639205298941436 and parameters: {'n_layers': 1, 'embedding_dim': 64, 'lr': 0.0014787969820369271, 'lambda_val': 1.546379240943657e-05, 'batch_size': 844, 'optimizer': 'RMSprop'}. Best is trial 161 with value: 0.0732140772759469.
2026-05-18 01:50:55,636 - experiment_functions - INFO - Early stopping at epoch 1600. Best Recall: 0.0718
2026-05-18 01:50:55,783 - optuna.study.study - INFO - Trial 211 finished with value: 0.07180990978630075 and parameters: {'n_layers': 1, 'embedding_dim': 64, 'lr': 0.0007783450846029942, 'lambda_val': 1.0927321500573819e-05, 'batch_size': 562, 'optimizer': 'RMSprop'}. Best is trial 161 with value: 0.0732140772759469.
2026-05-18 01:51:14,551 - experiment_functions - INFO - Early stopping at epoch 1400. Best Recall: 0.0677
2026-05-18 01:51:14,643 - optuna.study.study - INFO - Trial 212 finished with value: 0.06768518735690762 and parameters: {'n_layers': 1, 'embedding_dim': 64, 'lr': 0.0008716325369431554, 'lambda_val': 1.1260342268272635e-05, 'batch_size': 652, 'optimizer': 'RMSprop'}. Best is trial 161 with value: 0.0732140772759469.
2026-05-18 01:51:41,238 - experiment_functions - INFO - Early stopping at epoch 2050. Best Recall: 0.0682
2026-05-18 01:51:41,341 - optuna.study.study - INFO - Trial 213 finished with value: 0.0681662873301516 and parameters: {'n_layers': 1, 'embedding_dim': 64, 'lr': 0.0007603379514343424, 'lambda_val': 8.005972311799458e-06, 'batch_size': 614, 'optimizer': 'RMSprop'}. Best is trial 161 with value: 0.0732140772759469.
2026-05-18 01:51:58,463 - experiment_functions - INFO - Early stopping at epoch 1250. Best Recall: 0.0660
2026-05-18 01:51:58,556 - optuna.study.study - INFO - Trial 214 finished with value: 0.06596282317609968 and parameters: {'n_layers': 1, 'embedding_dim': 64, 'lr': 0.001078537797110189, 'lambda_val': 1.7092944743645783e-05, 'batch_size': 516, 'optimizer': 'RMSprop'}. Best is trial 161 with value: 0.0732140772759469.
2026-05-18 01:52:12,068 - optuna.study._optimize - INFO - Trial 215 pruned. 
2026-05-18 01:52:29,527 - optuna.study._optimize - INFO - Trial 216 pruned. 
2026-05-18 01:52:43,283 - optuna.study._optimize - INFO - Trial 217 pruned. 
2026-05-18 01:52:59,575 - optuna.study._optimize - INFO - Trial 218 pruned. 
