2026-05-19 01:21:12,060 - optuna.study.study - INFO - Trial 197 finished with value: 0.0681565740766708 and parameters: {'n_layers': 1, 'embedding_dim': 96, 'lr': 0.000605222233763702, 'lambda_val': 2.434285515863682e-06, 'batch_size': 814, 'optimizer': 'RMSprop'}. Best is trial 195 with value: 0.0726100687163915.
2026-05-19 01:21:26,181 - optuna.study._optimize - INFO - Trial 198 pruned. 
2026-05-19 01:21:45,585 - optuna.study._optimize - INFO - Trial 199 pruned. 
2026-05-19 01:22:17,458 - experiment_functions - INFO - Early stopping at epoch 1600. Best Recall: 0.0678
2026-05-19 01:22:17,549 - optuna.study.study - INFO - Trial 200 finished with value: 0.06781567864655705 and parameters: {'n_layers': 1, 'embedding_dim': 96, 'lr': 0.0007448186288905006, 'lambda_val': 5.818765031271821e-05, 'batch_size': 607, 'optimizer': 'RMSprop'}. Best is trial 195 with value: 0.0726100687163915.
2026-05-19 01:22:39,068 - optuna.study._optimize - INFO - Trial 201 pruned. 
2026-05-19 01:22:57,262 - optuna.study._optimize - INFO - Trial 202 pruned. 
2026-05-19 01:23:10,780 - optuna.study._optimize - INFO - Trial 203 pruned. 
2026-05-19 01:23:32,250 - optuna.study._optimize - INFO - Trial 204 pruned. 
2026-05-19 01:23:53,941 - optuna.study._optimize - INFO - Trial 205 pruned. 
2026-05-19 01:24:07,688 - optuna.study._optimize - INFO - Trial 206 pruned. 
2026-05-19 01:24:15,024 - experiment_functions - INFO - Early stopping at epoch 500. Best Recall: 0.0050
2026-05-19 01:24:15,094 - optuna.study.study - INFO - Trial 207 finished with value: 0.004999115452784698 and parameters: {'n_layers': 2, 'embedding_dim': 96, 'lr': 0.0004213367228738107, 'lambda_val': 0.00011817493085385408, 'batch_size': 760, 'optimizer': 'SGD'}. Best is trial 195 with value: 0.0726100687163915.
2026-05-19 01:24:24,964 - experiment_functions - INFO - Early stopping at epoch 700. Best Recall: 0.0506
2026-05-19 01:24:25,088 - optuna.study.study - INFO - Trial 208 finished with value: 0.050623797440089595 and parameters: {'n_layers': 1, 'embedding_dim': 128, 'lr': 0.0008569236366441252, 'lambda_val': 0.0002801899616394389, 'batch_size': 3457, 'optimizer': 'RMSprop'}. Best is trial 195 with value: 0.0726100687163915.
2026-05-19 01:24:46,931 - experiment_functions - INFO - Early stopping at epoch 1600. Best Recall: 0.0708
2026-05-19 01:24:47,022 - optuna.study.study - INFO - Trial 209 finished with value: 0.07082987815048222 and parameters: {'n_layers': 1, 'embedding_dim': 96, 'lr': 0.0006347824959562482, 'lambda_val': 0.0005137357783483038, 'batch_size': 875, 'optimizer': 'RMSprop'}. Best is trial 195 with value: 0.0726100687163915.
2026-05-19 01:24:58,416 - experiment_functions - INFO - Early stopping at epoch 550. Best Recall: 0.0085
2026-05-19 01:24:58,515 - optuna.study.study - INFO - Trial 210 finished with value: 0.008506346967403315 and parameters: {'n_layers': 1, 'embedding_dim': 96, 'lr': 0.05624411044008276, 'lambda_val': 0.0006443087607722404, 'batch_size': 887, 'optimizer': 'RMSprop'}. Best is trial 195 with value: 0.0726100687163915.
2026-05-19 01:25:47,483 - experiment_functions - INFO - Early stopping at epoch 1700. Best Recall: 0.0703
2026-05-19 01:25:47,602 - optuna.study.study - INFO - Trial 211 finished with value: 0.07026838494959926 and parameters: {'n_layers': 1, 'embedding_dim': 96, 'lr': 0.0006228286477721115, 'lambda_val': 0.0005029126315091742, 'batch_size': 827, 'optimizer': 'RMSprop'}. Best is trial 195 with value: 0.0726100687163915.
2026-05-19 01:26:14,314 - experiment_functions - INFO - Early stopping at epoch 1900. Best Recall: 0.0684
2026-05-19 01:26:14,403 - optuna.study.study - INFO - Trial 212 finished with value: 0.06839899886905518 and parameters: {'n_layers': 1, 'embedding_dim': 96, 'lr': 0.0005714590464659679, 'lambda_val': 0.0005310698750879293, 'batch_size': 990, 'optimizer': 'RMSprop'}. Best is trial 195 with value: 0.0726100687163915.
2026-05-19 01:26:30,761 - optuna.study._optimize - INFO - Trial 213 pruned. 
2026-05-19 01:26:44,368 - optuna.study._optimize - INFO - Trial 214 pruned. 
2026-05-19 01:27:24,954 - experiment_functions - INFO - Early stopping at epoch 2350. Best Recall: 0.0719
2026-05-19 01:27:25,052 - optuna.study.study - INFO - Trial 215 finished with value: 0.07186967962765557 and parameters: {'n_layers': 1, 'embedding_dim': 96, 'lr': 0.0006498866467621102, 'lambda_val': 0.0004126599671147923, 'batch_size': 678, 'optimizer': 'RMSprop'}. Best is trial 195 with value: 0.0726100687163915.
2026-05-19 01:27:56,365 - experiment_functions - INFO - Early stopping at epoch 2150. Best Recall: 0.0713
2026-05-19 01:27:56,454 - optuna.study.study - INFO - Trial 216 finished with value: 0.07132465394332364 and parameters: {'n_layers': 1, 'embedding_dim': 96, 'lr': 0.0006340176259428797, 'lambda_val': 0.0007391393264319573, 'batch_size': 647, 'optimizer': 'RMSprop'}. Best is trial 195 with value: 0.0726100687163915.
2026-05-19 01:28:34,972 - experiment_functions - INFO - Early stopping at epoch 2200. Best Recall: 0.0701
2026-05-19 01:28:35,061 - optuna.study.study - INFO - Trial 217 finished with value: 0.07013216093088162 and parameters: {'n_layers': 1, 'embedding_dim': 96, 'lr': 0.0006272944610122998, 'lambda_val': 0.0008152904192676262, 'batch_size': 640, 'optimizer': 'RMSprop'}. Best is trial 195 with value: 0.0726100687163915.
2026-05-19 01:28:48,424 - optuna.study._optimize - INFO - Trial 218 pruned. 
2026-05-19 01:29:02,222 - optuna.study._optimize - INFO - Trial 219 pruned. 
2026-05-19 01:29:17,539 - optuna.study._optimize - INFO - Trial 220 pruned. 
2026-05-19 01:29:32,698 - optuna.study._optimize - INFO - Trial 221 pruned. 
2026-05-19 01:29:49,417 - optuna.study._optimize - INFO - Trial 222 pruned. 
2026-05-19 01:30:17,106 - experiment_functions - INFO - Early stopping at epoch 1800. Best Recall: 0.0681
2026-05-19 01:30:17,249 - optuna.study.study - INFO - Trial 223 finished with value: 0.06810253979886745 and parameters: {'n_layers': 1, 'embedding_dim': 96, 'lr': 0.000677862843368862, 'lambda_val': 0.0006456725680740837, 'batch_size': 641, 'optimizer': 'RMSprop'}. Best is trial 195 with value: 0.0726100687163915.
2026-05-19 01:30:41,711 - optuna.study._optimize - INFO - Trial 224 pruned. 
2026-05-19 01:30:56,487 - optuna.study._optimize - INFO - Trial 225 pruned. 
2026-05-19 01:31:20,221 - optuna.study._optimize - INFO - Trial 226 pruned. 
2026-05-19 01:31:47,341 - experiment_functions - INFO - Early stopping at epoch 1750. Best Recall: 0.0682
2026-05-19 01:31:47,441 - optuna.study.study - INFO - Trial 227 finished with value: 0.06816043880461552 and parameters: {'n_layers': 1, 'embedding_dim': 96, 'lr': 0.0006333352929594004, 'lambda_val': 0.0003349546287730612, 'batch_size': 799, 'optimizer': 'RMSprop'}. Best is trial 195 with value: 0.0726100687163915.
2026-05-19 01:32:01,777 - optuna.study._optimize - INFO - Trial 228 pruned. 
2026-05-19 01:32:20,567 - optuna.study._optimize - INFO - Trial 229 pruned. 
2026-05-19 01:32:47,556 - optuna.study._optimize - INFO - Trial 230 pruned. 
2026-05-19 01:33:01,895 - optuna.study._optimize - INFO - Trial 231 pruned. 
2026-05-19 01:33:15,760 - experiment_functions - INFO - Early stopping at epoch 750. Best Recall: 0.0442
2026-05-19 01:33:15,905 - optuna.study.study - INFO - Trial 232 finished with value: 0.04423174722844043 and parameters: {'n_layers': 3, 'embedding_dim': 96, 'lr': 0.0005608005683378579, 'lambda_val': 4.2358432695933455e-05, 'batch_size': 704, 'optimizer': 'RMSprop'}. Best is trial 195 with value: 0.0726100687163915.
2026-05-19 01:33:37,104 - experiment_functions - INFO - Early stopping at epoch 1150. Best Recall: 0.0670
2026-05-19 01:33:37,202 - optuna.study.study - INFO - Trial 233 finished with value: 0.06698602887654519 and parameters: {'n_layers': 1, 'embedding_dim': 96, 'lr': 0.0008351625185455792, 'lambda_val': 0.0002823233472123515, 'batch_size': 756, 'optimizer': 'RMSprop'}. Best is trial 195 with value: 0.0726100687163915.
2026-05-19 01:33:54,764 - optuna.study._optimize - INFO - Trial 234 pruned. 
2026-05-19 01:34:10,281 - optuna.study._optimize - INFO - Trial 235 pruned. 
2026-05-19 01:34:25,197 - optuna.study._optimize - INFO - Trial 236 pruned. 
2026-05-19 01:34:47,540 - optuna.study._optimize - INFO - Trial 237 pruned. 
2026-05-19 01:35:13,146 - experiment_functions - INFO - Early stopping at epoch 1500. Best Recall: 0.0703
2026-05-19 01:35:13,234 - optuna.study.study - INFO - Trial 238 finished with value: 0.07028496959493195 and parameters: {'n_layers': 1, 'embedding_dim': 96, 'lr': 0.0007247882304422667, 'lambda_val': 0.00046980762475308383, 'batch_size': 571, 'optimizer': 'RMSprop'}. Best is trial 195 with value: 0.0726100687163915.
2026-05-19 01:35:42,383 - experiment_functions - INFO - Early stopping at epoch 2000. Best Recall: 0.0705
2026-05-19 01:35:42,472 - optuna.study.study - INFO - Trial 239 finished with value: 0.07051430072872379 and parameters: {'n_layers': 1, 'embedding_dim': 96, 'lr': 0.0006822634307400047, 'lambda_val': 0.000493931093986972, 'batch_size': 512, 'optimizer': 'RMSprop'}. Best is trial 195 with value: 0.0726100687163915.
2026-05-19 01:36:03,387 - optuna.study._optimize - INFO - Trial 240 pruned. 
2026-05-19 01:36:33,712 - experiment_functions - INFO - Early stopping at epoch 2100. Best Recall: 0.0698
2026-05-19 01:36:33,822 - optuna.study.study - INFO - Trial 241 finished with value: 0.06981367691716237 and parameters: {'n_layers': 1, 'embedding_dim': 96, 'lr': 0.0006791711363005607, 'lambda_val': 0.00047442880209125663, 'batch_size': 579, 'optimizer': 'RMSprop'}. Best is trial 195 with value: 0.0726100687163915.
2026-05-19 01:36:48,433 - optuna.study._optimize - INFO - Trial 242 pruned. 
2026-05-19 01:37:09,726 - optuna.study._optimize - INFO - Trial 243 pruned. 
2026-05-19 01:37:28,324 - optuna.study._optimize - INFO - Trial 244 pruned. 
2026-05-19 01:37:42,334 - optuna.study._optimize - INFO - Trial 245 pruned. 
2026-05-19 01:37:59,123 - experiment_functions - INFO - Early stopping at epoch 1150. Best Recall: 0.0664
2026-05-19 01:37:59,212 - optuna.study.study - INFO - Trial 246 finished with value: 0.06636580954475778 and parameters: {'n_layers': 1, 'embedding_dim': 96, 'lr': 0.0008893486891156492, 'lambda_val': 0.0005319507891187235, 'batch_size': 646, 'optimizer': 'RMSprop'}. Best is trial 195 with value: 0.0726100687163915.
2026-05-19 01:38:07,110 - experiment_functions - INFO - Early stopping at epoch 500. Best Recall: 0.0051
2026-05-19 01:38:07,199 - optuna.study.study - INFO - Trial 247 finished with value: 0.005098657691589487 and parameters: {'n_layers': 1, 'embedding_dim': 128, 'lr': 0.0007588158191637569, 'lambda_val': 0.0003572525720310614, 'batch_size': 620, 'optimizer': 'SGD'}. Best is trial 195 with value: 0.0726100687163915.
2026-05-19 01:38:22,485 - experiment_functions - INFO - Early stopping at epoch 950. Best Recall: 0.0645
2026-05-19 01:38:22,586 - optuna.study.study - INFO - Trial 248 finished with value: 0.06448153445301234 and parameters: {'n_layers': 2, 'embedding_dim': 96, 'lr': 0.0006093469337538096, 'lambda_val': 0.0004425862597462952, 'batch_size': 599, 'optimizer': 'RMSprop'}. Best is trial 195 with value: 0.0726100687163915.
2026-05-19 01:38:39,810 - optuna.study._optimize - INFO - Trial 249 pruned. 
2026-05-19 01:38:56,957 - optuna.study._optimize - INFO - Trial 250 pruned. 
2026-05-19 01:39:17,437 - optuna.study._optimize - INFO - Trial 251 pruned. 
2026-05-19 01:39:32,216 - optuna.study._optimize - INFO - Trial 252 pruned. 
2026-05-19 01:39:45,460 - optuna.study._optimize - INFO - Trial 253 pruned. 
2026-05-19 01:39:59,162 - optuna.study._optimize - INFO - Trial 254 pruned. 
2026-05-19 01:40:14,080 - optuna.study._optimize - INFO - Trial 255 pruned. 
2026-05-19 01:40:35,728 - optuna.study._optimize - INFO - Trial 256 pruned. 
2026-05-19 01:41:01,657 - experiment_functions - INFO - Early stopping at epoch 1450. Best Recall: 0.0701
2026-05-19 01:41:01,755 - optuna.study.study - INFO - Trial 257 finished with value: 0.07005038371343861 and parameters: {'n_layers': 1, 'embedding_dim': 96, 'lr': 0.0007067996577747212, 'lambda_val': 7.329892980714716e-06, 'batch_size': 739, 'optimizer': 'RMSprop'}. Best is trial 195 with value: 0.0726100687163915.
2026-05-19 01:41:28,412 - optuna.study._optimize - INFO - Trial 258 pruned. 
2026-05-19 01:41:42,428 - experiment_functions - INFO - Early stopping at epoch 900. Best Recall: 0.0620
2026-05-19 01:41:42,519 - optuna.study.study - INFO - Trial 259 finished with value: 0.06204226904090838 and parameters: {'n_layers': 1, 'embedding_dim': 256, 'lr': 0.0008150207964238761, 'lambda_val': 4.8957560946450215e-06, 'batch_size': 935, 'optimizer': 'RMSprop'}. Best is trial 195 with value: 0.0726100687163915.
2026-05-19 01:41:56,798 - optuna.study._optimize - INFO - Trial 260 pruned. 
2026-05-19 01:42:13,767 - optuna.study._optimize - INFO - Trial 261 pruned. 
2026-05-19 01:42:29,313 - optuna.study._optimize - INFO - Trial 262 pruned. 
2026-05-19 01:42:40,783 - experiment_functions - INFO - Early stopping at epoch 700. Best Recall: 0.0376
2026-05-19 01:42:40,883 - optuna.study.study - INFO - Trial 263 finished with value: 0.03756711590631674 and parameters: {'n_layers': 4, 'embedding_dim': 96, 'lr': 0.0005360777410548391, 'lambda_val': 0.000740928056076188, 'batch_size': 716, 'optimizer': 'RMSprop'}. Best is trial 195 with value: 0.0726100687163915.
2026-05-19 01:42:54,678 - optuna.study._optimize - INFO - Trial 264 pruned. 
2026-05-19 01:43:14,342 - optuna.study._optimize - INFO - Trial 265 pruned. 
2026-05-19 01:43:28,337 - optuna.study._optimize - INFO - Trial 266 pruned. 
2026-05-19 01:43:36,103 - experiment_functions - INFO - Early stopping at epoch 500. Best Recall: 0.0049
2026-05-19 01:43:36,201 - optuna.study.study - INFO - Trial 267 finished with value: 0.0049435462476760976 and parameters: {'n_layers': 2, 'embedding_dim': 96, 'lr': 0.0006551228612194372, 'lambda_val': 0.00013965254476930747, 'batch_size': 915, 'optimizer': 'SGD'}. Best is trial 195 with value: 0.0726100687163915.
2026-05-19 01:43:53,372 - experiment_functions - INFO - Early stopping at epoch 950. Best Recall: 0.0600
2026-05-19 01:43:53,490 - optuna.study.study - INFO - Trial 268 finished with value: 0.059972610581008376 and parameters: {'n_layers': 1, 'embedding_dim': 96, 'lr': 0.000964750639404516, 'lambda_val': 0.0005907999457103012, 'batch_size': 821, 'optimizer': 'RMSprop'}. Best is trial 195 with value: 0.0726100687163915.
2026-05-19 01:44:07,619 - optuna.study._optimize - INFO - Trial 269 pruned. 
2026-05-19 01:44:27,057 - optuna.study._optimize - INFO - Trial 270 pruned. 
2026-05-19 01:44:57,954 - experiment_functions - INFO - Early stopping at epoch 1950. Best Recall: 0.0696
2026-05-19 01:44:58,043 - optuna.study.study - INFO - Trial 271 finished with value: 0.06956044087750864 and parameters: {'n_layers': 1, 'embedding_dim': 128, 'lr': 0.000583632924219133, 'lambda_val': 1.04984534718643e-06, 'batch_size': 736, 'optimizer': 'RMSprop'}. Best is trial 195 with value: 0.0726100687163915.
2026-05-19 01:45:12,722 - optuna.study._optimize - INFO - Trial 272 pruned. 
2026-05-19 01:45:27,474 - optuna.study._optimize - INFO - Trial 273 pruned. 
2026-05-19 01:45:41,558 - optuna.study._optimize - INFO - Trial 274 pruned. 
2026-05-19 01:45:53,838 - experiment_functions - INFO - Early stopping at epoch 800. Best Recall: 0.0608
2026-05-19 01:45:53,938 - optuna.study.study - INFO - Trial 275 finished with value: 0.060809917342259434 and parameters: {'n_layers': 1, 'embedding_dim': 128, 'lr': 0.0011722910241957693, 'lambda_val': 1.735998494028518e-05, 'batch_size': 803, 'optimizer': 'RMSprop'}. Best is trial 195 with value: 0.0726100687163915.
2026-05-19 01:46:15,505 - experiment_functions - INFO - Early stopping at epoch 1400. Best Recall: 0.0697
2026-05-19 01:46:15,606 - optuna.study.study - INFO - Trial 276 finished with value: 0.06967072947804907 and parameters: {'n_layers': 1, 'embedding_dim': 96, 'lr': 0.0008206065605053781, 'lambda_val': 1.5398438433753868e-06, 'batch_size': 581, 'optimizer': 'RMSprop'}. Best is trial 195 with value: 0.0726100687163915.
2026-05-19 01:46:30,468 - optuna.study._optimize - INFO - Trial 277 pruned. 
2026-05-19 01:46:47,236 - optuna.study._optimize - INFO - Trial 278 pruned. 
2026-05-19 01:47:10,443 - experiment_functions - INFO - Early stopping at epoch 1650. Best Recall: 0.0681
2026-05-19 01:47:12,086 - optuna.study.study - INFO - Trial 279 finished with value: 0.06807838517955203 and parameters: {'n_layers': 1, 'embedding_dim': 96, 'lr': 0.000723981860832256, 'lambda_val': 1.1254925841157397e-06, 'batch_size': 569, 'optimizer': 'RMSprop'}. Best is trial 195 with value: 0.0726100687163915.
2026-05-19 01:47:26,843 - optuna.study._optimize - INFO - Trial 280 pruned. 
2026-05-19 01:47:45,158 - experiment_functions - INFO - Early stopping at epoch 1250. Best Recall: 0.0685
2026-05-19 01:47:45,255 - optuna.study.study - INFO - Trial 281 finished with value: 0.06854680324123724 and parameters: {'n_layers': 1, 'embedding_dim': 128, 'lr': 0.0009028914759836816, 'lambda_val': 1.6365563851453549e-06, 'batch_size': 525, 'optimizer': 'RMSprop'}. Best is trial 195 with value: 0.0726100687163915.
2026-05-19 01:47:59,301 - experiment_functions - INFO - Early stopping at epoch 950. Best Recall: 0.0583
2026-05-19 01:47:59,391 - optuna.study.study - INFO - Trial 282 finished with value: 0.05833404162632122 and parameters: {'n_layers': 1, 'embedding_dim': 96, 'lr': 0.0006635305531872383, 'lambda_val': 2.236884650885291e-06, 'batch_size': 2582, 'optimizer': 'RMSprop'}. Best is trial 195 with value: 0.0726100687163915.
2026-05-19 01:48:14,788 - experiment_functions - INFO - Early stopping at epoch 900. Best Recall: 0.0639
2026-05-19 01:48:14,884 - optuna.study.study - INFO - Trial 283 finished with value: 0.06385993293936996 and parameters: {'n_layers': 1, 'embedding_dim': 96, 'lr': 0.0011392025295203893, 'lambda_val': 1.7063674541608795e-06, 'batch_size': 615, 'optimizer': 'RMSprop'}. Best is trial 195 with value: 0.0726100687163915.
2026-05-19 01:48:30,333 - optuna.study._optimize - INFO - Trial 284 pruned. 
2026-05-19 01:48:45,291 - optuna.study._optimize - INFO - Trial 285 pruned. 
2026-05-19 01:48:59,969 - optuna.study._optimize - INFO - Trial 286 pruned. 
2026-05-19 01:49:17,084 - optuna.study._optimize - INFO - Trial 287 pruned. 
2026-05-19 01:49:32,860 - experiment_functions - INFO - Early stopping at epoch 1100. Best Recall: 0.0696
2026-05-19 01:49:32,960 - optuna.study.study - INFO - Trial 288 finished with value: 0.06958944168076586 and parameters: {'n_layers': 1, 'embedding_dim': 96, 'lr': 0.000963686456628481, 'lambda_val': 0.0002428819568761676, 'batch_size': 607, 'optimizer': 'RMSprop'}. Best is trial 195 with value: 0.0726100687163915.
2026-05-19 01:49:50,455 - experiment_functions - INFO - Early stopping at epoch 1200. Best Recall: 0.0693
2026-05-19 01:49:50,564 - optuna.study.study - INFO - Trial 289 finished with value: 0.06933884947946428 and parameters: {'n_layers': 1, 'embedding_dim': 96, 'lr': 0.0009915827732430692, 'lambda_val': 0.00026723729060387845, 'batch_size': 512, 'optimizer': 'RMSprop'}. Best is trial 195 with value: 0.0726100687163915.
2026-05-19 01:49:58,422 - experiment_functions - INFO - Early stopping at epoch 500. Best Recall: 0.0051
2026-05-19 01:49:58,522 - optuna.study.study - INFO - Trial 290 finished with value: 0.0051123870605225465 and parameters: {'n_layers': 1, 'embedding_dim': 96, 'lr': 0.0007721021376262172, 'lambda_val': 0.00022125884013938138, 'batch_size': 596, 'optimizer': 'SGD'}. Best is trial 195 with value: 0.0726100687163915.
2026-05-19 01:50:12,118 - experiment_functions - INFO - Early stopping at epoch 850. Best Recall: 0.0569
2026-05-19 01:50:12,217 - optuna.study.study - INFO - Trial 291 finished with value: 0.056919511440433404 and parameters: {'n_layers': 1, 'embedding_dim': 96, 'lr': 0.0013221233983670396, 'lambda_val': 1.2408521778029238e-06, 'batch_size': 665, 'optimizer': 'RMSprop'}. Best is trial 195 with value: 0.0726100687163915.
2026-05-19 01:50:31,552 - optuna.study._optimize - INFO - Trial 292 pruned. 
2026-05-19 01:50:48,800 - experiment_functions - INFO - Early stopping at epoch 1200. Best Recall: 0.0671
2026-05-19 01:50:48,898 - optuna.study.study - INFO - Trial 293 finished with value: 0.06711275150411052 and parameters: {'n_layers': 1, 'embedding_dim': 96, 'lr': 0.0009234898874821365, 'lambda_val': 0.00033641161710673675, 'batch_size': 655, 'optimizer': 'RMSprop'}. Best is trial 195 with value: 0.0726100687163915.
2026-05-19 01:51:03,396 - optuna.study._optimize - INFO - Trial 294 pruned. 
2026-05-19 01:51:34,566 - experiment_functions - INFO - Early stopping at epoch 2150. Best Recall: 0.0708
2026-05-19 01:51:34,654 - optuna.study.study - INFO - Trial 295 finished with value: 0.0708466414354746 and parameters: {'n_layers': 1, 'embedding_dim': 96, 'lr': 0.0007306901028726948, 'lambda_val': 0.0007150227054334871, 'batch_size': 513, 'optimizer': 'RMSprop'}. Best is trial 195 with value: 0.0726100687163915.
2026-05-19 01:51:47,460 - experiment_functions - INFO - Early stopping at epoch 850. Best Recall: 0.0632
2026-05-19 01:51:47,560 - optuna.study.study - INFO - Trial 296 finished with value: 0.06322336274755522 and parameters: {'n_layers': 1, 'embedding_dim': 96, 'lr': 0.0011725537038643923, 'lambda_val': 0.000769959530274154, 'batch_size': 567, 'optimizer': 'RMSprop'}. Best is trial 195 with value: 0.0726100687163915.
2026-05-19 01:52:03,475 - optuna.study._optimize - INFO - Trial 297 pruned. 
2026-05-19 01:52:17,919 - optuna.study._optimize - INFO - Trial 298 pruned. 
2026-05-19 01:52:51,295 - experiment_functions - INFO - Early stopping at epoch 2250. Best Recall: 0.0726
