2026-05-18 12:26:05,142 - optuna.study.study - INFO - Trial 63 finished with value: 0.05446771243690215 and parameters: {'n_layers': 1, 'embedding_dim': 128, 'lr': 0.0023415586617026377, 'lambda_val': 0.00030236209096237037, 'batch_size': 1419, 'optimizer': 'Adam'}. Best is trial 23 with value: 0.06979390339363536.
2026-05-18 12:26:19,192 - optuna.study._optimize - INFO - Trial 64 pruned. 
2026-05-18 12:26:26,651 - experiment_functions - INFO - Early stopping at epoch 500. Best Recall: 0.0048
2026-05-18 12:26:26,758 - optuna.study.study - INFO - Trial 65 finished with value: 0.004752495140517432 and parameters: {'n_layers': 1, 'embedding_dim': 64, 'lr': 0.0009401580034904549, 'lambda_val': 1.9006227679174932e-05, 'batch_size': 2160, 'optimizer': 'SGD'}. Best is trial 23 with value: 0.06979390339363536.
2026-05-18 12:26:41,822 - optuna.study._optimize - INFO - Trial 66 pruned. 
2026-05-18 12:26:55,999 - optuna.study._optimize - INFO - Trial 67 pruned. 
2026-05-18 12:27:05,524 - experiment_functions - INFO - Early stopping at epoch 650. Best Recall: 0.0052
2026-05-18 12:27:05,635 - optuna.study.study - INFO - Trial 68 finished with value: 0.0052446688627051955 and parameters: {'n_layers': 1, 'embedding_dim': 128, 'lr': 5.950616313682349e-05, 'lambda_val': 0.004668446901665744, 'batch_size': 2359, 'optimizer': 'Adam'}. Best is trial 23 with value: 0.06979390339363536.
2026-05-18 12:27:15,932 - experiment_functions - INFO - Early stopping at epoch 600. Best Recall: 0.0499
2026-05-18 12:27:16,045 - optuna.study.study - INFO - Trial 69 finished with value: 0.04990930534059774 and parameters: {'n_layers': 1, 'embedding_dim': 256, 'lr': 0.0015334398484452066, 'lambda_val': 9.580842757785619e-06, 'batch_size': 890, 'optimizer': 'RMSprop'}. Best is trial 23 with value: 0.06979390339363536.
2026-05-18 12:27:29,289 - experiment_functions - INFO - Early stopping at epoch 850. Best Recall: 0.0407
2026-05-18 12:27:29,454 - optuna.study.study - INFO - Trial 70 finished with value: 0.04071658928452682 and parameters: {'n_layers': 3, 'embedding_dim': 64, 'lr': 0.0005858757719503296, 'lambda_val': 1.0989090082140027e-06, 'batch_size': 1323, 'optimizer': 'Adam'}. Best is trial 23 with value: 0.06979390339363536.
2026-05-18 12:27:44,618 - experiment_functions - INFO - Early stopping at epoch 1000. Best Recall: 0.0608
2026-05-18 12:27:44,709 - optuna.study.study - INFO - Trial 71 finished with value: 0.06078213692234095 and parameters: {'n_layers': 1, 'embedding_dim': 128, 'lr': 0.0008925719142519884, 'lambda_val': 3.121959043442743e-05, 'batch_size': 1850, 'optimizer': 'Adam'}. Best is trial 23 with value: 0.06979390339363536.
2026-05-18 12:27:54,691 - experiment_functions - INFO - Early stopping at epoch 650. Best Recall: 0.0595
2026-05-18 12:27:54,984 - optuna.study.study - INFO - Trial 72 finished with value: 0.05953664722077535 and parameters: {'n_layers': 1, 'embedding_dim': 128, 'lr': 0.002134416804698269, 'lambda_val': 6.167580861123457e-05, 'batch_size': 1996, 'optimizer': 'Adam'}. Best is trial 23 with value: 0.06979390339363536.
2026-05-18 12:28:04,248 - experiment_functions - INFO - Early stopping at epoch 600. Best Recall: 0.0472
2026-05-18 12:28:04,347 - optuna.study.study - INFO - Trial 73 finished with value: 0.04717199164748499 and parameters: {'n_layers': 1, 'embedding_dim': 128, 'lr': 0.005451620077801298, 'lambda_val': 0.00014248283993868448, 'batch_size': 1806, 'optimizer': 'Adam'}. Best is trial 23 with value: 0.06979390339363536.
2026-05-18 12:28:15,836 - experiment_functions - INFO - Early stopping at epoch 750. Best Recall: 0.0563
2026-05-18 12:28:15,936 - optuna.study.study - INFO - Trial 74 finished with value: 0.056254772421560545 and parameters: {'n_layers': 1, 'embedding_dim': 128, 'lr': 0.001769833889114044, 'lambda_val': 2.631075859881633e-05, 'batch_size': 1506, 'optimizer': 'Adam'}. Best is trial 23 with value: 0.06979390339363536.
2026-05-18 12:28:35,164 - experiment_functions - INFO - Early stopping at epoch 1300. Best Recall: 0.0635
2026-05-18 12:28:35,272 - optuna.study.study - INFO - Trial 75 finished with value: 0.06347834272700022 and parameters: {'n_layers': 1, 'embedding_dim': 96, 'lr': 0.000772973137723042, 'lambda_val': 0.02043861325727074, 'batch_size': 714, 'optimizer': 'Adam'}. Best is trial 23 with value: 0.06979390339363536.
2026-05-18 12:28:46,879 - experiment_functions - INFO - Early stopping at epoch 700. Best Recall: 0.0295
2026-05-18 12:28:46,968 - optuna.study.study - INFO - Trial 76 finished with value: 0.02947089025491473 and parameters: {'n_layers': 4, 'embedding_dim': 96, 'lr': 0.0004081052204492938, 'lambda_val': 0.010175087152712257, 'batch_size': 720, 'optimizer': 'RMSprop'}. Best is trial 23 with value: 0.06979390339363536.
2026-05-18 12:28:54,072 - experiment_functions - INFO - Early stopping at epoch 500. Best Recall: 0.0053
2026-05-18 12:28:54,164 - optuna.study.study - INFO - Trial 77 finished with value: 0.005300077316028663 and parameters: {'n_layers': 1, 'embedding_dim': 96, 'lr': 0.001220968152771342, 'lambda_val': 0.020773536162069457, 'batch_size': 519, 'optimizer': 'SGD'}. Best is trial 23 with value: 0.06979390339363536.
2026-05-18 12:29:09,012 - experiment_functions - INFO - Early stopping at epoch 1050. Best Recall: 0.0542
2026-05-18 12:29:09,102 - optuna.study.study - INFO - Trial 78 finished with value: 0.05420844601242298 and parameters: {'n_layers': 1, 'embedding_dim': 96, 'lr': 0.0008403729719252187, 'lambda_val': 0.03930729895152054, 'batch_size': 1026, 'optimizer': 'Adam'}. Best is trial 23 with value: 0.06979390339363536.
2026-05-18 12:29:23,297 - optuna.study._optimize - INFO - Trial 79 pruned. 
2026-05-18 12:29:43,631 - experiment_functions - INFO - Early stopping at epoch 1400. Best Recall: 0.0605
2026-05-18 12:29:43,719 - optuna.study.study - INFO - Trial 80 finished with value: 0.06046566336897368 and parameters: {'n_layers': 1, 'embedding_dim': 32, 'lr': 0.0005254595151408658, 'lambda_val': 0.00022716407487283435, 'batch_size': 3231, 'optimizer': 'RMSprop'}. Best is trial 23 with value: 0.06979390339363536.
2026-05-18 12:30:03,928 - experiment_functions - INFO - Early stopping at epoch 1400. Best Recall: 0.0628
2026-05-18 12:30:04,063 - optuna.study.study - INFO - Trial 81 finished with value: 0.06275261460584675 and parameters: {'n_layers': 1, 'embedding_dim': 64, 'lr': 0.0007592914875405651, 'lambda_val': 4.592879200031091e-05, 'batch_size': 1287, 'optimizer': 'Adam'}. Best is trial 23 with value: 0.06979390339363536.
2026-05-18 12:30:26,403 - experiment_functions - INFO - Early stopping at epoch 1600. Best Recall: 0.0624
2026-05-18 12:30:26,503 - optuna.study.study - INFO - Trial 82 finished with value: 0.062443936512722995 and parameters: {'n_layers': 1, 'embedding_dim': 64, 'lr': 0.0007058153667716966, 'lambda_val': 4.4416773726664704e-05, 'batch_size': 1151, 'optimizer': 'Adam'}. Best is trial 23 with value: 0.06979390339363536.
2026-05-18 12:30:46,696 - experiment_functions - INFO - Early stopping at epoch 1350. Best Recall: 0.0666
2026-05-18 12:30:46,786 - optuna.study.study - INFO - Trial 83 finished with value: 0.06660757893597372 and parameters: {'n_layers': 1, 'embedding_dim': 64, 'lr': 0.0010181761639708573, 'lambda_val': 5.252357005013454e-05, 'batch_size': 634, 'optimizer': 'Adam'}. Best is trial 23 with value: 0.06979390339363536.
2026-05-18 12:31:00,184 - optuna.study._optimize - INFO - Trial 84 pruned. 
2026-05-18 12:31:13,789 - optuna.study._optimize - INFO - Trial 85 pruned. 
2026-05-18 12:31:34,985 - experiment_functions - INFO - Early stopping at epoch 1450. Best Recall: 0.0638
2026-05-18 12:31:35,085 - optuna.study.study - INFO - Trial 86 finished with value: 0.06382477781276119 and parameters: {'n_layers': 1, 'embedding_dim': 64, 'lr': 0.0007384974326680807, 'lambda_val': 0.0012646844968007833, 'batch_size': 1155, 'optimizer': 'Adam'}. Best is trial 23 with value: 0.06979390339363536.
2026-05-18 12:31:52,832 - experiment_functions - INFO - Early stopping at epoch 1250. Best Recall: 0.0609
2026-05-18 12:31:52,921 - optuna.study.study - INFO - Trial 87 finished with value: 0.06094423285644285 and parameters: {'n_layers': 1, 'embedding_dim': 64, 'lr': 0.0010343880552770217, 'lambda_val': 0.0021809145799621724, 'batch_size': 622, 'optimizer': 'Adam'}. Best is trial 23 with value: 0.06979390339363536.
2026-05-18 12:32:07,674 - optuna.study._optimize - INFO - Trial 88 pruned. 
2026-05-18 12:32:26,561 - experiment_functions - INFO - Early stopping at epoch 1300. Best Recall: 0.0616
2026-05-18 12:32:26,651 - optuna.study.study - INFO - Trial 89 finished with value: 0.061589538454235565 and parameters: {'n_layers': 1, 'embedding_dim': 64, 'lr': 0.000824790376344681, 'lambda_val': 0.0008692067702108828, 'batch_size': 977, 'optimizer': 'Adam'}. Best is trial 23 with value: 0.06979390339363536.
2026-05-18 12:32:35,038 - experiment_functions - INFO - Early stopping at epoch 550. Best Recall: 0.0422
2026-05-18 12:32:35,129 - optuna.study.study - INFO - Trial 90 finished with value: 0.042239197975929295 and parameters: {'n_layers': 2, 'embedding_dim': 64, 'lr': 0.0014422504940649673, 'lambda_val': 0.0041564136402200275, 'batch_size': 1069, 'optimizer': 'RMSprop'}. Best is trial 23 with value: 0.06979390339363536.
2026-05-18 12:32:59,430 - experiment_functions - INFO - Early stopping at epoch 1700. Best Recall: 0.0639
2026-05-18 12:32:59,563 - optuna.study.study - INFO - Trial 91 finished with value: 0.06391207413828696 and parameters: {'n_layers': 1, 'embedding_dim': 64, 'lr': 0.0006545243761253074, 'lambda_val': 6.49478471500621e-05, 'batch_size': 1260, 'optimizer': 'Adam'}. Best is trial 23 with value: 0.06979390339363536.
2026-05-18 12:33:21,012 - experiment_functions - INFO - Early stopping at epoch 1500. Best Recall: 0.0669
2026-05-18 12:33:21,100 - optuna.study.study - INFO - Trial 92 finished with value: 0.06693513731351464 and parameters: {'n_layers': 1, 'embedding_dim': 64, 'lr': 0.0006752748533214298, 'lambda_val': 6.93744423239372e-05, 'batch_size': 1286, 'optimizer': 'Adam'}. Best is trial 23 with value: 0.06979390339363536.
2026-05-18 12:33:45,382 - optuna.study._optimize - INFO - Trial 93 pruned. 
2026-05-18 12:33:58,921 - optuna.study._optimize - INFO - Trial 94 pruned. 
2026-05-18 12:34:18,709 - optuna.study._optimize - INFO - Trial 95 pruned. 
2026-05-18 12:34:32,537 - optuna.study._optimize - INFO - Trial 96 pruned. 
2026-05-18 12:34:41,290 - experiment_functions - INFO - Early stopping at epoch 600. Best Recall: 0.0107
2026-05-18 12:34:41,378 - optuna.study.study - INFO - Trial 97 finished with value: 0.01069622698804934 and parameters: {'n_layers': 1, 'embedding_dim': 64, 'lr': 0.07735041249746348, 'lambda_val': 0.00016856067004770842, 'batch_size': 788, 'optimizer': 'Adam'}. Best is trial 23 with value: 0.06979390339363536.
2026-05-18 12:34:57,719 - experiment_functions - INFO - Early stopping at epoch 1100. Best Recall: 0.0605
2026-05-18 12:34:57,818 - optuna.study.study - INFO - Trial 98 finished with value: 0.060462909162068104 and parameters: {'n_layers': 1, 'embedding_dim': 64, 'lr': 0.0011217279787059504, 'lambda_val': 4.959245274354879e-05, 'batch_size': 1246, 'optimizer': 'Adam'}. Best is trial 23 with value: 0.06979390339363536.
2026-05-18 12:35:20,891 - experiment_functions - INFO - Early stopping at epoch 950. Best Recall: 0.0531
2026-05-18 12:35:20,991 - optuna.study.study - INFO - Trial 99 finished with value: 0.05311291046349872 and parameters: {'n_layers': 1, 'embedding_dim': 64, 'lr': 0.0009548836725780678, 'lambda_val': 0.05342837127394164, 'batch_size': 1392, 'optimizer': 'Adam'}. Best is trial 23 with value: 0.06979390339363536.
2026-05-18 12:35:34,861 - optuna.study._optimize - INFO - Trial 100 pruned. 
2026-05-18 12:36:00,699 - experiment_functions - INFO - Early stopping at epoch 1800. Best Recall: 0.0633
2026-05-18 12:36:00,812 - optuna.study.study - INFO - Trial 101 finished with value: 0.06332324431527224 and parameters: {'n_layers': 1, 'embedding_dim': 64, 'lr': 0.0007154829877647772, 'lambda_val': 1.975012819052434e-05, 'batch_size': 1179, 'optimizer': 'Adam'}. Best is trial 23 with value: 0.06979390339363536.
2026-05-18 12:36:25,628 - experiment_functions - INFO - Early stopping at epoch 1750. Best Recall: 0.0638
2026-05-18 12:36:25,717 - optuna.study.study - INFO - Trial 102 finished with value: 0.06380936026145871 and parameters: {'n_layers': 1, 'embedding_dim': 64, 'lr': 0.0007069827703510166, 'lambda_val': 3.544944060977925e-05, 'batch_size': 1088, 'optimizer': 'Adam'}. Best is trial 23 with value: 0.06979390339363536.
2026-05-18 12:36:53,445 - optuna.study._optimize - INFO - Trial 103 pruned. 
2026-05-18 12:37:14,075 - optuna.study._optimize - INFO - Trial 104 pruned. 
2026-05-18 12:37:34,697 - optuna.study._optimize - INFO - Trial 105 pruned. 
2026-05-18 12:37:41,982 - experiment_functions - INFO - Early stopping at epoch 500. Best Recall: 0.0060
2026-05-18 12:37:42,071 - optuna.study.study - INFO - Trial 106 finished with value: 0.0060270547133172625 and parameters: {'n_layers': 1, 'embedding_dim': 64, 'lr': 0.0006347075186371831, 'lambda_val': 9.920146540390996e-05, 'batch_size': 661, 'optimizer': 'SGD'}. Best is trial 23 with value: 0.06979390339363536.
2026-05-18 12:37:55,700 - optuna.study._optimize - INFO - Trial 107 pruned. 
2026-05-18 12:38:10,618 - experiment_functions - INFO - Early stopping at epoch 950. Best Recall: 0.0633
2026-05-18 12:38:10,708 - optuna.study.study - INFO - Trial 108 finished with value: 0.06329734913761882 and parameters: {'n_layers': 1, 'embedding_dim': 32, 'lr': 0.0014058950069891735, 'lambda_val': 3.4114499115256834e-05, 'batch_size': 1379, 'optimizer': 'Adam'}. Best is trial 23 with value: 0.06979390339363536.
2026-05-18 12:38:24,459 - experiment_functions - INFO - Early stopping at epoch 1000. Best Recall: 0.0586
2026-05-18 12:38:24,549 - optuna.study.study - INFO - Trial 109 finished with value: 0.058602707837100546 and parameters: {'n_layers': 1, 'embedding_dim': 32, 'lr': 0.0013001191333206889, 'lambda_val': 5.331635773866686e-06, 'batch_size': 1390, 'optimizer': 'Adam'}. Best is trial 23 with value: 0.06979390339363536.
2026-05-18 12:38:36,315 - experiment_functions - INFO - Early stopping at epoch 850. Best Recall: 0.0642
2026-05-18 12:38:36,405 - optuna.study.study - INFO - Trial 110 finished with value: 0.06423728162703424 and parameters: {'n_layers': 1, 'embedding_dim': 32, 'lr': 0.0017951290034988777, 'lambda_val': 3.5966481819211564e-05, 'batch_size': 1033, 'optimizer': 'Adam'}. Best is trial 23 with value: 0.06979390339363536.
2026-05-18 12:38:48,743 - experiment_functions - INFO - Early stopping at epoch 750. Best Recall: 0.0651
2026-05-18 12:38:48,843 - optuna.study.study - INFO - Trial 111 finished with value: 0.06507409736015396 and parameters: {'n_layers': 1, 'embedding_dim': 32, 'lr': 0.002360594789981807, 'lambda_val': 2.328000430073889e-05, 'batch_size': 1024, 'optimizer': 'Adam'}. Best is trial 23 with value: 0.06979390339363536.
2026-05-18 12:38:58,901 - experiment_functions - INFO - Early stopping at epoch 700. Best Recall: 0.0636
2026-05-18 12:38:59,002 - optuna.study.study - INFO - Trial 112 finished with value: 0.06363568429280766 and parameters: {'n_layers': 1, 'embedding_dim': 32, 'lr': 0.0035698636388656, 'lambda_val': 2.2342642521570278e-05, 'batch_size': 1004, 'optimizer': 'Adam'}. Best is trial 23 with value: 0.06979390339363536.
2026-05-18 12:39:08,154 - experiment_functions - INFO - Early stopping at epoch 650. Best Recall: 0.0537
2026-05-18 12:39:08,264 - optuna.study.study - INFO - Trial 113 finished with value: 0.053669396339805706 and parameters: {'n_layers': 1, 'embedding_dim': 32, 'lr': 0.003988665530189387, 'lambda_val': 2.5588758902587185e-05, 'batch_size': 1007, 'optimizer': 'Adam'}. Best is trial 23 with value: 0.06979390339363536.
2026-05-18 12:39:18,967 - experiment_functions - INFO - Early stopping at epoch 750. Best Recall: 0.0613
2026-05-18 12:39:19,490 - optuna.study.study - INFO - Trial 114 finished with value: 0.06130421240893807 and parameters: {'n_layers': 1, 'embedding_dim': 32, 'lr': 0.002641242679566179, 'lambda_val': 9.47604451217173e-06, 'batch_size': 1077, 'optimizer': 'Adam'}. Best is trial 23 with value: 0.06979390339363536.
2026-05-18 12:39:29,310 - experiment_functions - INFO - Early stopping at epoch 700. Best Recall: 0.0594
2026-05-18 12:39:29,412 - optuna.study.study - INFO - Trial 115 finished with value: 0.05935195160735192 and parameters: {'n_layers': 1, 'embedding_dim': 32, 'lr': 0.0033219651183135496, 'lambda_val': 7.359328933990319e-05, 'batch_size': 915, 'optimizer': 'Adam'}. Best is trial 23 with value: 0.06979390339363536.
2026-05-18 12:39:41,088 - experiment_functions - INFO - Early stopping at epoch 850. Best Recall: 0.0638
2026-05-18 12:39:41,179 - optuna.study.study - INFO - Trial 116 finished with value: 0.0638264225443089 and parameters: {'n_layers': 1, 'embedding_dim': 32, 'lr': 0.0019369572096792124, 'lambda_val': 1.623312255636095e-05, 'batch_size': 757, 'optimizer': 'Adam'}. Best is trial 23 with value: 0.06979390339363536.
2026-05-18 12:39:53,279 - experiment_functions - INFO - Early stopping at epoch 850. Best Recall: 0.0644
2026-05-18 12:39:53,390 - optuna.study.study - INFO - Trial 117 finished with value: 0.06439845775103434 and parameters: {'n_layers': 1, 'embedding_dim': 32, 'lr': 0.001930304837642665, 'lambda_val': 1.3691536275377504e-05, 'batch_size': 727, 'optimizer': 'Adam'}. Best is trial 23 with value: 0.06979390339363536.
2026-05-18 12:40:06,018 - experiment_functions - INFO - Early stopping at epoch 900. Best Recall: 0.0649
2026-05-18 12:40:06,087 - optuna.study.study - INFO - Trial 118 finished with value: 0.06493876166101852 and parameters: {'n_layers': 1, 'embedding_dim': 32, 'lr': 0.0018507034701566647, 'lambda_val': 1.712099139402741e-05, 'batch_size': 835, 'optimizer': 'Adam'}. Best is trial 23 with value: 0.06979390339363536.
2026-05-18 12:40:17,912 - experiment_functions - INFO - Early stopping at epoch 900. Best Recall: 0.0631
2026-05-18 12:40:18,003 - optuna.study.study - INFO - Trial 119 finished with value: 0.06314913914456781 and parameters: {'n_layers': 1, 'embedding_dim': 32, 'lr': 0.0019600807655353607, 'lambda_val': 6.64440065593314e-06, 'batch_size': 571, 'optimizer': 'Adam'}. Best is trial 23 with value: 0.06979390339363536.
2026-05-18 12:40:26,638 - experiment_functions - INFO - Early stopping at epoch 600. Best Recall: 0.0401
2026-05-18 12:40:26,740 - optuna.study.study - INFO - Trial 120 finished with value: 0.040101846738001413 and parameters: {'n_layers': 3, 'embedding_dim': 32, 'lr': 0.002761437206650208, 'lambda_val': 1.678923199367369e-05, 'batch_size': 853, 'optimizer': 'Adam'}. Best is trial 23 with value: 0.06979390339363536.
2026-05-18 12:40:35,274 - experiment_functions - INFO - Early stopping at epoch 600. Best Recall: 0.0577
2026-05-18 12:40:35,363 - optuna.study.study - INFO - Trial 121 finished with value: 0.05771754603208114 and parameters: {'n_layers': 1, 'embedding_dim': 32, 'lr': 0.007688397433795431, 'lambda_val': 1.2392985154418125e-05, 'batch_size': 783, 'optimizer': 'Adam'}. Best is trial 23 with value: 0.06979390339363536.
2026-05-18 12:40:47,670 - experiment_functions - INFO - Early stopping at epoch 850. Best Recall: 0.0609
2026-05-18 12:40:47,769 - optuna.study.study - INFO - Trial 122 finished with value: 0.06088916799132329 and parameters: {'n_layers': 1, 'embedding_dim': 32, 'lr': 0.002340301702320249, 'lambda_val': 2.237792732156849e-05, 'batch_size': 678, 'optimizer': 'Adam'}. Best is trial 23 with value: 0.06979390339363536.
2026-05-18 12:40:56,431 - experiment_functions - INFO - Early stopping at epoch 600. Best Recall: 0.0549
2026-05-18 12:40:56,531 - optuna.study.study - INFO - Trial 123 finished with value: 0.054933424016802006 and parameters: {'n_layers': 1, 'embedding_dim': 32, 'lr': 0.004671234948774334, 'lambda_val': 8.069033391587616e-06, 'batch_size': 962, 'optimizer': 'Adam'}. Best is trial 23 with value: 0.06979390339363536.
2026-05-18 12:41:08,687 - experiment_functions - INFO - Early stopping at epoch 900. Best Recall: 0.0622
2026-05-18 12:41:08,788 - optuna.study.study - INFO - Trial 124 finished with value: 0.06216578307186685 and parameters: {'n_layers': 1, 'embedding_dim': 32, 'lr': 0.0017664750185924106, 'lambda_val': 3.4006102285335054e-05, 'batch_size': 763, 'optimizer': 'Adam'}. Best is trial 23 with value: 0.06979390339363536.
2026-05-18 12:41:18,723 - experiment_functions - INFO - Early stopping at epoch 700. Best Recall: 0.0599
2026-05-18 12:41:18,823 - optuna.study.study - INFO - Trial 125 finished with value: 0.059855216942888215 and parameters: {'n_layers': 1, 'embedding_dim': 32, 'lr': 0.0031573419108235907, 'lambda_val': 3.2914930990193786e-06, 'batch_size': 846, 'optimizer': 'Adam'}. Best is trial 23 with value: 0.06979390339363536.
2026-05-18 12:41:32,263 - experiment_functions - INFO - Early stopping at epoch 750. Best Recall: 0.0644
2026-05-18 12:41:32,353 - optuna.study.study - INFO - Trial 126 finished with value: 0.06440920840630683 and parameters: {'n_layers': 1, 'embedding_dim': 32, 'lr': 0.002161771907233525, 'lambda_val': 1.6496807763223245e-05, 'batch_size': 1009, 'optimizer': 'Adam'}. Best is trial 23 with value: 0.06979390339363536.
2026-05-18 12:41:47,996 - experiment_functions - INFO - Early stopping at epoch 1150. Best Recall: 0.0651
2026-05-18 12:41:48,094 - optuna.study.study - INFO - Trial 127 finished with value: 0.06507215194072437 and parameters: {'n_layers': 1, 'embedding_dim': 32, 'lr': 0.0016400204690077017, 'lambda_val': 1.6044978050591495e-05, 'batch_size': 580, 'optimizer': 'Adam'}. Best is trial 23 with value: 0.06979390339363536.
2026-05-18 12:41:55,482 - experiment_functions - INFO - Early stopping at epoch 500. Best Recall: 0.0048
