2026-05-17 19:05:40,942 - root - INFO - **** Training e_1M_full
2026-05-17 19:05:43,206 - helper_functions - INFO - Users: 6040, Items: 3883
2026-05-17 19:05:46,419 - helper_functions - INFO - Edge index: torch.Size([2, 1000209])
2026-05-17 19:05:46,420 - root - INFO - **** Generating the graph:
2026-05-17 19:05:47,328 - helper_functions - INFO - Number of unique users: 6040
2026-05-17 19:05:47,337 - helper_functions - INFO - Number of unique items: 3706
2026-05-17 19:05:47,337 - helper_functions - INFO - Number of nodes: 9746
2026-05-17 19:05:47,341 - helper_functions - INFO - Number of edges: 1000209
2026-05-17 19:05:50,443 - optuna.storages._rdb.storage - INFO - A new study created in RDB with name: Study_e_1M_full
2026-05-17 19:06:05,919 - experiment_functions - INFO - Early stopping at epoch 500. Best Recall: 0.0053
2026-05-17 19:06:06,024 - optuna.study.study - INFO - Trial 0 finished with value: 0.005297254006500499 and parameters: {'n_layers': 4, 'embedding_dim': 256, 'lr': 0.09819700069448005, 'lambda_val': 2.674654570105616e-05, 'batch_size': 2244, 'optimizer': 'SGD'}. Best is trial 0 with value: 0.005297254006500499.
2026-05-17 19:06:16,576 - experiment_functions - INFO - Early stopping at epoch 550. Best Recall: 0.0325
2026-05-17 19:06:16,683 - optuna.study.study - INFO - Trial 1 finished with value: 0.032489900675882685 and parameters: {'n_layers': 3, 'embedding_dim': 64, 'lr': 0.003737648827793816, 'lambda_val': 0.0037894048194566914, 'batch_size': 3244, 'optimizer': 'Adam'}. Best is trial 1 with value: 0.032489900675882685.
2026-05-17 19:06:33,938 - experiment_functions - INFO - Early stopping at epoch 950. Best Recall: 0.0054
2026-05-17 19:06:34,040 - optuna.study.study - INFO - Trial 2 finished with value: 0.005366747297095368 and parameters: {'n_layers': 1, 'embedding_dim': 256, 'lr': 1.582851347076343e-05, 'lambda_val': 0.00015064354920213405, 'batch_size': 3845, 'optimizer': 'RMSprop'}. Best is trial 1 with value: 0.032489900675882685.
2026-05-17 19:06:43,250 - experiment_functions - INFO - Early stopping at epoch 500. Best Recall: 0.0055
2026-05-17 19:06:43,331 - optuna.study.study - INFO - Trial 3 finished with value: 0.005457061754463231 and parameters: {'n_layers': 1, 'embedding_dim': 256, 'lr': 0.007225335921176925, 'lambda_val': 0.0002269707727103, 'batch_size': 1808, 'optimizer': 'SGD'}. Best is trial 1 with value: 0.032489900675882685.
2026-05-17 19:06:52,404 - experiment_functions - INFO - Early stopping at epoch 500. Best Recall: 0.0047
2026-05-17 19:06:52,496 - optuna.study.study - INFO - Trial 4 finished with value: 0.004668849519434105 and parameters: {'n_layers': 3, 'embedding_dim': 64, 'lr': 1.5275374449852183e-05, 'lambda_val': 0.006527649692433564, 'batch_size': 2410, 'optimizer': 'Adam'}. Best is trial 1 with value: 0.032489900675882685.
2026-05-17 19:07:09,599 - experiment_functions - INFO - Early stopping at epoch 500. Best Recall: 0.0249
2026-05-17 19:07:10,121 - optuna.study.study - INFO - Trial 5 finished with value: 0.024881473278562515 and parameters: {'n_layers': 3, 'embedding_dim': 32, 'lr': 0.06607901268712182, 'lambda_val': 7.392649451542829e-06, 'batch_size': 756, 'optimizer': 'RMSprop'}. Best is trial 1 with value: 0.032489900675882685.
2026-05-17 19:08:30,397 - optuna.study.study - INFO - Trial 6 finished with value: 0.0367831523668944 and parameters: {'n_layers': 4, 'embedding_dim': 96, 'lr': 9.816698348055473e-05, 'lambda_val': 0.005239660972346654, 'batch_size': 1137, 'optimizer': 'Adam'}. Best is trial 6 with value: 0.0367831523668944.
2026-05-17 19:08:38,566 - experiment_functions - INFO - Early stopping at epoch 500. Best Recall: 0.0046
2026-05-17 19:08:38,659 - optuna.study.study - INFO - Trial 7 finished with value: 0.004626788203862248 and parameters: {'n_layers': 1, 'embedding_dim': 96, 'lr': 0.0010818951039663685, 'lambda_val': 0.005054443450049402, 'batch_size': 968, 'optimizer': 'SGD'}. Best is trial 6 with value: 0.0367831523668944.
2026-05-17 19:08:51,606 - experiment_functions - INFO - Early stopping at epoch 500. Best Recall: 0.0047
2026-05-17 19:08:51,699 - optuna.study.study - INFO - Trial 8 finished with value: 0.004724361929488368 and parameters: {'n_layers': 3, 'embedding_dim': 256, 'lr': 0.002638503330581236, 'lambda_val': 0.005847468980213715, 'batch_size': 1785, 'optimizer': 'SGD'}. Best is trial 6 with value: 0.0367831523668944.
2026-05-17 19:10:17,465 - experiment_functions - INFO - Early stopping at epoch 3150. Best Recall: 0.0486
2026-05-17 19:10:17,558 - optuna.study.study - INFO - Trial 9 finished with value: 0.048550193243080374 and parameters: {'n_layers': 3, 'embedding_dim': 256, 'lr': 0.008778391581952684, 'lambda_val': 5.084506883393184e-06, 'batch_size': 1609, 'optimizer': 'RMSprop'}. Best is trial 9 with value: 0.048550193243080374.
2026-05-17 19:10:37,963 - experiment_functions - INFO - Early stopping at epoch 1100. Best Recall: 0.0444
2026-05-17 19:10:38,056 - optuna.study.study - INFO - Trial 10 finished with value: 0.044356266365627055 and parameters: {'n_layers': 2, 'embedding_dim': 128, 'lr': 0.01724122094296618, 'lambda_val': 1.175684453923871e-06, 'batch_size': 2953, 'optimizer': 'RMSprop'}. Best is trial 9 with value: 0.048550193243080374.
2026-05-17 19:11:14,384 - experiment_functions - INFO - Early stopping at epoch 2000. Best Recall: 0.0467
2026-05-17 19:11:14,488 - optuna.study.study - INFO - Trial 11 finished with value: 0.04667347250926556 and parameters: {'n_layers': 2, 'embedding_dim': 128, 'lr': 0.01772865330015926, 'lambda_val': 1.1569491889517934e-06, 'batch_size': 3010, 'optimizer': 'RMSprop'}. Best is trial 9 with value: 0.048550193243080374.
2026-05-17 19:12:00,771 - experiment_functions - INFO - Early stopping at epoch 2550. Best Recall: 0.0476
2026-05-17 19:12:00,863 - optuna.study.study - INFO - Trial 12 finished with value: 0.04758316056667982 and parameters: {'n_layers': 2, 'embedding_dim': 128, 'lr': 0.018300055277097323, 'lambda_val': 1.0176254216002596e-06, 'batch_size': 3098, 'optimizer': 'RMSprop'}. Best is trial 9 with value: 0.048550193243080374.
2026-05-17 19:12:20,949 - experiment_functions - INFO - Early stopping at epoch 1050. Best Recall: 0.0544
2026-05-17 19:12:21,055 - optuna.study.study - INFO - Trial 13 finished with value: 0.05440624601591588 and parameters: {'n_layers': 2, 'embedding_dim': 128, 'lr': 0.00027424670524797825, 'lambda_val': 1.5506546917089037e-05, 'batch_size': 4011, 'optimizer': 'RMSprop'}. Best is trial 13 with value: 0.05440624601591588.
2026-05-17 19:13:23,054 - optuna.study.study - INFO - Trial 14 finished with value: 0.05384982067653678 and parameters: {'n_layers': 2, 'embedding_dim': 32, 'lr': 0.00021364490662652898, 'lambda_val': 1.613748147453981e-05, 'batch_size': 4077, 'optimizer': 'RMSprop'}. Best is trial 13 with value: 0.05440624601591588.
2026-05-17 19:13:39,181 - optuna.study._optimize - INFO - Trial 15 pruned. 
2026-05-17 19:13:47,195 - experiment_functions - INFO - Early stopping at epoch 500. Best Recall: 0.0054
2026-05-17 19:13:47,333 - optuna.study.study - INFO - Trial 16 finished with value: 0.005403460185263672 and parameters: {'n_layers': 2, 'embedding_dim': 32, 'lr': 0.00022409626902084422, 'lambda_val': 0.09914820549541098, 'batch_size': 3997, 'optimizer': 'RMSprop'}. Best is trial 13 with value: 0.05440624601591588.
2026-05-17 19:14:25,325 - experiment_functions - INFO - Early stopping at epoch 2550. Best Recall: 0.0666
2026-05-17 19:14:25,441 - optuna.study.study - INFO - Trial 17 finished with value: 0.0666165923901734 and parameters: {'n_layers': 1, 'embedding_dim': 32, 'lr': 0.0004188152301285565, 'lambda_val': 1.7462141083333726e-05, 'batch_size': 3657, 'optimizer': 'RMSprop'}. Best is trial 17 with value: 0.0666165923901734.
2026-05-17 19:14:37,825 - experiment_functions - INFO - Early stopping at epoch 700. Best Recall: 0.0708
2026-05-17 19:14:37,921 - optuna.study.study - INFO - Trial 18 finished with value: 0.07079208842992843 and parameters: {'n_layers': 1, 'embedding_dim': 128, 'lr': 0.0007011060469364464, 'lambda_val': 0.0009514785678273333, 'batch_size': 3493, 'optimizer': 'RMSprop'}. Best is trial 18 with value: 0.07079208842992843.
2026-05-17 19:14:53,388 - experiment_functions - INFO - Early stopping at epoch 1000. Best Recall: 0.0702
2026-05-17 19:14:53,482 - optuna.study.study - INFO - Trial 19 finished with value: 0.07021408596479874 and parameters: {'n_layers': 1, 'embedding_dim': 32, 'lr': 0.000745005767887465, 'lambda_val': 0.0006072748730334543, 'batch_size': 3511, 'optimizer': 'Adam'}. Best is trial 18 with value: 0.07079208842992843.
2026-05-17 19:15:03,503 - experiment_functions - INFO - Early stopping at epoch 600. Best Recall: 0.0051
2026-05-17 19:15:03,640 - optuna.study.study - INFO - Trial 20 finished with value: 0.005098977377725684 and parameters: {'n_layers': 1, 'embedding_dim': 128, 'lr': 5.1178862793159e-05, 'lambda_val': 0.0010431889592851169, 'batch_size': 3486, 'optimizer': 'Adam'}. Best is trial 18 with value: 0.07079208842992843.
2026-05-17 19:15:19,791 - experiment_functions - INFO - Early stopping at epoch 1050. Best Recall: 0.0737
2026-05-17 19:15:19,896 - optuna.study.study - INFO - Trial 21 finished with value: 0.07366063317792675 and parameters: {'n_layers': 1, 'embedding_dim': 32, 'lr': 0.0007653622676743109, 'lambda_val': 0.0008120235567302051, 'batch_size': 3536, 'optimizer': 'Adam'}. Best is trial 21 with value: 0.07366063317792675.
2026-05-17 19:15:34,099 - experiment_functions - INFO - Early stopping at epoch 900. Best Recall: 0.0768
2026-05-17 19:15:34,205 - optuna.study.study - INFO - Trial 22 finished with value: 0.07676735543851085 and parameters: {'n_layers': 1, 'embedding_dim': 32, 'lr': 0.001056494184950012, 'lambda_val': 0.0008752634087905429, 'batch_size': 2652, 'optimizer': 'Adam'}. Best is trial 22 with value: 0.07676735543851085.
2026-05-17 19:15:47,403 - experiment_functions - INFO - Early stopping at epoch 800. Best Recall: 0.0730
2026-05-17 19:15:47,528 - optuna.study.study - INFO - Trial 23 finished with value: 0.07296758758916654 and parameters: {'n_layers': 1, 'embedding_dim': 32, 'lr': 0.0012459231034965153, 'lambda_val': 0.0010104516499661047, 'batch_size': 2689, 'optimizer': 'Adam'}. Best is trial 22 with value: 0.07676735543851085.
2026-05-17 19:15:58,700 - experiment_functions - INFO - Early stopping at epoch 700. Best Recall: 0.0704
2026-05-17 19:15:58,838 - optuna.study.study - INFO - Trial 24 finished with value: 0.0704200425924823 and parameters: {'n_layers': 1, 'embedding_dim': 32, 'lr': 0.0015936347341693148, 'lambda_val': 0.04886117461419902, 'batch_size': 2651, 'optimizer': 'Adam'}. Best is trial 22 with value: 0.07676735543851085.
2026-05-17 19:16:10,118 - experiment_functions - INFO - Early stopping at epoch 700. Best Recall: 0.0804
2026-05-17 19:16:10,212 - optuna.study.study - INFO - Trial 25 finished with value: 0.0804486802832235 and parameters: {'n_layers': 1, 'embedding_dim': 32, 'lr': 0.0021892582913467826, 'lambda_val': 0.0015177772877979277, 'batch_size': 2586, 'optimizer': 'Adam'}. Best is trial 25 with value: 0.0804486802832235.
2026-05-17 19:16:19,227 - experiment_functions - INFO - Early stopping at epoch 600. Best Recall: 0.0836
2026-05-17 19:16:19,334 - optuna.study.study - INFO - Trial 26 finished with value: 0.08361092474702067 and parameters: {'n_layers': 1, 'embedding_dim': 32, 'lr': 0.0031830059017889864, 'lambda_val': 0.01628805219989121, 'batch_size': 2018, 'optimizer': 'Adam'}. Best is trial 26 with value: 0.08361092474702067.
2026-05-17 19:16:29,046 - experiment_functions - INFO - Early stopping at epoch 600. Best Recall: 0.0812
2026-05-17 19:16:29,149 - optuna.study.study - INFO - Trial 27 finished with value: 0.08115124494012955 and parameters: {'n_layers': 1, 'embedding_dim': 32, 'lr': 0.0032456379969487957, 'lambda_val': 0.029829464363794127, 'batch_size': 2220, 'optimizer': 'Adam'}. Best is trial 26 with value: 0.08361092474702067.
2026-05-17 19:16:38,125 - experiment_functions - INFO - Early stopping at epoch 550. Best Recall: 0.0596
2026-05-17 19:16:38,219 - optuna.study.study - INFO - Trial 28 finished with value: 0.059618448260438196 and parameters: {'n_layers': 2, 'embedding_dim': 32, 'lr': 0.0036921140559366397, 'lambda_val': 0.018181668819142124, 'batch_size': 2252, 'optimizer': 'Adam'}. Best is trial 26 with value: 0.08361092474702067.
2026-05-17 19:16:58,406 - optuna.study._optimize - INFO - Trial 29 pruned. 
2026-05-17 19:17:07,632 - experiment_functions - INFO - Early stopping at epoch 550. Best Recall: 0.0773
2026-05-17 19:17:07,770 - optuna.study.study - INFO - Trial 30 finished with value: 0.07727627689707131 and parameters: {'n_layers': 1, 'embedding_dim': 64, 'lr': 0.008131434919320878, 'lambda_val': 0.016480979070605615, 'batch_size': 1470, 'optimizer': 'Adam'}. Best is trial 26 with value: 0.08361092474702067.
2026-05-17 19:17:16,559 - experiment_functions - INFO - Early stopping at epoch 550. Best Recall: 0.0862
2026-05-17 19:17:16,661 - optuna.study.study - INFO - Trial 31 finished with value: 0.08619786480159895 and parameters: {'n_layers': 1, 'embedding_dim': 64, 'lr': 0.006391766225836976, 'lambda_val': 0.018436262000031407, 'batch_size': 1437, 'optimizer': 'Adam'}. Best is trial 31 with value: 0.08619786480159895.
2026-05-17 19:17:26,269 - experiment_functions - INFO - Early stopping at epoch 600. Best Recall: 0.0663
2026-05-17 19:17:26,450 - optuna.study.study - INFO - Trial 32 finished with value: 0.06627316895308881 and parameters: {'n_layers': 1, 'embedding_dim': 64, 'lr': 0.0033597009957447173, 'lambda_val': 0.040705794277494774, 'batch_size': 1994, 'optimizer': 'Adam'}. Best is trial 31 with value: 0.08619786480159895.
2026-05-17 19:17:36,903 - experiment_functions - INFO - Early stopping at epoch 650. Best Recall: 0.0777
2026-05-17 19:17:37,029 - optuna.study.study - INFO - Trial 33 finished with value: 0.07771526852188969 and parameters: {'n_layers': 1, 'embedding_dim': 64, 'lr': 0.0021700543059065274, 'lambda_val': 0.011182546917500638, 'batch_size': 1387, 'optimizer': 'Adam'}. Best is trial 31 with value: 0.08619786480159895.
2026-05-17 19:17:46,634 - experiment_functions - INFO - Early stopping at epoch 550. Best Recall: 0.0581
2026-05-17 19:17:46,783 - optuna.study.study - INFO - Trial 34 finished with value: 0.058084344655142256 and parameters: {'n_layers': 1, 'embedding_dim': 64, 'lr': 0.0055727237109495596, 'lambda_val': 0.0028157295719178346, 'batch_size': 2053, 'optimizer': 'Adam'}. Best is trial 31 with value: 0.08619786480159895.
2026-05-17 19:18:11,400 - optuna.study._optimize - INFO - Trial 35 pruned. 
2026-05-17 19:18:19,102 - experiment_functions - INFO - Early stopping at epoch 500. Best Recall: 0.0053
2026-05-17 19:18:19,203 - optuna.study.study - INFO - Trial 36 finished with value: 0.005346248125452925 and parameters: {'n_layers': 1, 'embedding_dim': 32, 'lr': 0.005025368519275832, 'lambda_val': 0.06343250810399446, 'batch_size': 2443, 'optimizer': 'SGD'}. Best is trial 31 with value: 0.08619786480159895.
2026-05-17 19:18:34,912 - optuna.study._optimize - INFO - Trial 37 pruned. 
2026-05-17 19:18:47,558 - experiment_functions - INFO - Early stopping at epoch 750. Best Recall: 0.0839
2026-05-17 19:18:47,671 - optuna.study.study - INFO - Trial 38 finished with value: 0.08392636421816405 and parameters: {'n_layers': 1, 'embedding_dim': 64, 'lr': 0.0018138077644655384, 'lambda_val': 0.00011387425219575424, 'batch_size': 1261, 'optimizer': 'Adam'}. Best is trial 31 with value: 0.08619786480159895.
2026-05-17 19:18:57,466 - experiment_functions - INFO - Early stopping at epoch 500. Best Recall: 0.0049
2026-05-17 19:18:57,558 - optuna.study.study - INFO - Trial 39 finished with value: 0.004850178750061744 and parameters: {'n_layers': 4, 'embedding_dim': 64, 'lr': 0.0005146577152870812, 'lambda_val': 0.00012128341940608165, 'batch_size': 1241, 'optimizer': 'SGD'}. Best is trial 31 with value: 0.08619786480159895.
2026-05-17 19:19:07,285 - experiment_functions - INFO - Early stopping at epoch 600. Best Recall: 0.0767
2026-05-17 19:19:07,376 - optuna.study.study - INFO - Trial 40 finished with value: 0.07672452221670012 and parameters: {'n_layers': 1, 'embedding_dim': 64, 'lr': 0.004740301051436128, 'lambda_val': 0.000295782890389061, 'batch_size': 1688, 'optimizer': 'Adam'}. Best is trial 31 with value: 0.08619786480159895.
2026-05-17 19:19:19,580 - experiment_functions - INFO - Early stopping at epoch 750. Best Recall: 0.0768
2026-05-17 19:19:19,727 - optuna.study.study - INFO - Trial 41 finished with value: 0.07677526392748525 and parameters: {'n_layers': 1, 'embedding_dim': 64, 'lr': 0.002073169516144605, 'lambda_val': 9.69496756849814e-05, 'batch_size': 1035, 'optimizer': 'Adam'}. Best is trial 31 with value: 0.08619786480159895.
2026-05-17 19:19:32,118 - experiment_functions - INFO - Early stopping at epoch 650. Best Recall: 0.0665
2026-05-17 19:19:32,220 - optuna.study.study - INFO - Trial 42 finished with value: 0.06653526332347623 and parameters: {'n_layers': 1, 'embedding_dim': 256, 'lr': 0.0017569240175972117, 'lambda_val': 0.010036022974285182, 'batch_size': 1540, 'optimizer': 'Adam'}. Best is trial 31 with value: 0.08619786480159895.
2026-05-17 19:19:42,463 - experiment_functions - INFO - Early stopping at epoch 600. Best Recall: 0.0774
2026-05-17 19:19:42,564 - optuna.study.study - INFO - Trial 43 finished with value: 0.07735064025406554 and parameters: {'n_layers': 1, 'embedding_dim': 96, 'lr': 0.0030425958821563856, 'lambda_val': 0.0020218301072289337, 'batch_size': 1855, 'optimizer': 'Adam'}. Best is trial 31 with value: 0.08619786480159895.
2026-05-17 19:19:51,789 - experiment_functions - INFO - Early stopping at epoch 550. Best Recall: 0.0736
2026-05-17 19:19:51,879 - optuna.study.study - INFO - Trial 44 finished with value: 0.07355756908298476 and parameters: {'n_layers': 1, 'embedding_dim': 64, 'lr': 0.009729000232602637, 'lambda_val': 6.139536484406695e-05, 'batch_size': 1323, 'optimizer': 'Adam'}. Best is trial 31 with value: 0.08619786480159895.
2026-05-17 19:20:10,571 - optuna.study._optimize - INFO - Trial 45 pruned. 
2026-05-17 19:20:18,801 - experiment_functions - INFO - Early stopping at epoch 500. Best Recall: 0.0051
2026-05-17 19:20:18,903 - optuna.study.study - INFO - Trial 46 finished with value: 0.005108642460336657 and parameters: {'n_layers': 3, 'embedding_dim': 32, 'lr': 0.005526416854672559, 'lambda_val': 0.0004351343354149468, 'batch_size': 2448, 'optimizer': 'SGD'}. Best is trial 31 with value: 0.08619786480159895.
2026-05-17 19:20:36,950 - optuna.study._optimize - INFO - Trial 47 pruned. 
2026-05-17 19:20:52,505 - optuna.study._optimize - INFO - Trial 48 pruned. 
2026-05-17 19:21:02,067 - experiment_functions - INFO - Early stopping at epoch 600. Best Recall: 0.0624
2026-05-17 19:21:02,204 - optuna.study.study - INFO - Trial 49 finished with value: 0.062385615252111226 and parameters: {'n_layers': 2, 'embedding_dim': 32, 'lr': 0.002495904406071593, 'lambda_val': 0.0307330232565244, 'batch_size': 1781, 'optimizer': 'Adam'}. Best is trial 31 with value: 0.08619786480159895.
2026-05-17 19:21:09,703 - experiment_functions - INFO - Early stopping at epoch 500. Best Recall: 0.0059
2026-05-17 19:21:09,792 - optuna.study.study - INFO - Trial 50 finished with value: 0.005863263613940874 and parameters: {'n_layers': 1, 'embedding_dim': 32, 'lr': 0.001368582187965496, 'lambda_val': 0.08510896155881216, 'batch_size': 1199, 'optimizer': 'SGD'}. Best is trial 31 with value: 0.08619786480159895.
2026-05-17 19:21:20,627 - experiment_functions - INFO - Early stopping at epoch 650. Best Recall: 0.0757
2026-05-17 19:21:20,729 - optuna.study.study - INFO - Trial 51 finished with value: 0.0756527770372326 and parameters: {'n_layers': 1, 'embedding_dim': 64, 'lr': 0.002349918278278208, 'lambda_val': 0.012638577624275095, 'batch_size': 1378, 'optimizer': 'Adam'}. Best is trial 31 with value: 0.08619786480159895.
2026-05-17 19:21:30,320 - experiment_functions - INFO - Early stopping at epoch 600. Best Recall: 0.0759
2026-05-17 19:21:30,466 - optuna.study.study - INFO - Trial 52 finished with value: 0.07587774664145305 and parameters: {'n_layers': 1, 'embedding_dim': 64, 'lr': 0.003918453472621189, 'lambda_val': 0.02630956493111387, 'batch_size': 892, 'optimizer': 'Adam'}. Best is trial 31 with value: 0.08619786480159895.
2026-05-17 19:21:39,391 - experiment_functions - INFO - Early stopping at epoch 550. Best Recall: 0.0770
2026-05-17 19:21:39,502 - optuna.study.study - INFO - Trial 53 finished with value: 0.07702966294343508 and parameters: {'n_layers': 1, 'embedding_dim': 64, 'lr': 0.007185978565943638, 'lambda_val': 0.008421108270559226, 'batch_size': 1671, 'optimizer': 'Adam'}. Best is trial 31 with value: 0.08619786480159895.
2026-05-17 19:21:51,276 - experiment_functions - INFO - Early stopping at epoch 750. Best Recall: 0.0842
2026-05-17 19:21:51,413 - optuna.study.study - INFO - Trial 54 finished with value: 0.08416116834084422 and parameters: {'n_layers': 1, 'embedding_dim': 64, 'lr': 0.0018564133190517758, 'lambda_val': 0.005495340627540615, 'batch_size': 1075, 'optimizer': 'Adam'}. Best is trial 31 with value: 0.08619786480159895.
2026-05-17 19:22:09,561 - optuna.study._optimize - INFO - Trial 55 pruned. 
2026-05-17 19:22:21,611 - experiment_functions - INFO - Early stopping at epoch 700. Best Recall: 0.0625
2026-05-17 19:22:21,746 - optuna.study.study - INFO - Trial 56 finished with value: 0.06250003995342907 and parameters: {'n_layers': 2, 'embedding_dim': 64, 'lr': 0.000928247794560416, 'lambda_val': 0.0015987610924539078, 'batch_size': 2135, 'optimizer': 'Adam'}. Best is trial 31 with value: 0.08619786480159895.
2026-05-17 19:22:29,168 - experiment_functions - INFO - Early stopping at epoch 500. Best Recall: 0.0061
