2026-05-18 22:26:29,432 - optuna.study.study - INFO - Trial 5 finished with value: 0.05762505368055127 and parameters: {'n_layers': 1, 'embedding_dim': 64, 'lr': 0.0003512105449331203, 'lambda_val': 0.00010905370056256563, 'batch_size': 2921, 'optimizer': 'Adam'}. Best is trial 0 with value: 0.0587424388882642.
2026-05-18 22:26:39,433 - experiment_functions - INFO - Early stopping at epoch 500. Best Recall: 0.0055
2026-05-18 22:26:39,521 - optuna.study.study - INFO - Trial 6 finished with value: 0.0054763675253734385 and parameters: {'n_layers': 4, 'embedding_dim': 256, 'lr': 0.016750154783975194, 'lambda_val': 0.0008804890933390844, 'batch_size': 2398, 'optimizer': 'SGD'}. Best is trial 0 with value: 0.0587424388882642.
2026-05-18 22:26:48,701 - experiment_functions - INFO - Early stopping at epoch 500. Best Recall: 0.0048
2026-05-18 22:26:48,846 - optuna.study.study - INFO - Trial 7 finished with value: 0.004786978363343161 and parameters: {'n_layers': 3, 'embedding_dim': 64, 'lr': 0.08472152378939175, 'lambda_val': 0.00034092858323673056, 'batch_size': 2291, 'optimizer': 'SGD'}. Best is trial 0 with value: 0.0587424388882642.
2026-05-18 22:26:57,945 - experiment_functions - INFO - Early stopping at epoch 550. Best Recall: 0.0408
2026-05-18 22:26:58,078 - optuna.study.study - INFO - Trial 8 finished with value: 0.04081858060860058 and parameters: {'n_layers': 3, 'embedding_dim': 96, 'lr': 0.0047558172446961885, 'lambda_val': 2.6010156281081033e-05, 'batch_size': 1701, 'optimizer': 'Adam'}. Best is trial 0 with value: 0.0587424388882642.
2026-05-18 22:27:05,405 - experiment_functions - INFO - Early stopping at epoch 500. Best Recall: 0.0056
2026-05-18 22:27:05,507 - optuna.study.study - INFO - Trial 9 finished with value: 0.005638232322241557 and parameters: {'n_layers': 2, 'embedding_dim': 64, 'lr': 0.062410068129016505, 'lambda_val': 0.054217617220374284, 'batch_size': 1781, 'optimizer': 'SGD'}. Best is trial 0 with value: 0.0587424388882642.
2026-05-18 22:27:21,960 - experiment_functions - INFO - Early stopping at epoch 800. Best Recall: 0.0365
2026-05-18 22:27:22,049 - optuna.study.study - INFO - Trial 10 finished with value: 0.036497139489738 and parameters: {'n_layers': 2, 'embedding_dim': 96, 'lr': 0.0006400048772690797, 'lambda_val': 0.06033970590884718, 'batch_size': 897, 'optimizer': 'RMSprop'}. Best is trial 0 with value: 0.0587424388882642.
2026-05-18 22:27:38,435 - optuna.study._optimize - INFO - Trial 11 pruned. 
2026-05-18 22:27:53,178 - optuna.study._optimize - INFO - Trial 12 pruned. 
2026-05-18 22:28:01,797 - experiment_functions - INFO - Early stopping at epoch 550. Best Recall: 0.0051
2026-05-18 22:28:02,045 - optuna.study.study - INFO - Trial 13 finished with value: 0.005055919346752369 and parameters: {'n_layers': 2, 'embedding_dim': 128, 'lr': 1.0701263382417533e-05, 'lambda_val': 0.00440230262045487, 'batch_size': 3156, 'optimizer': 'RMSprop'}. Best is trial 0 with value: 0.0587424388882642.
2026-05-18 22:28:11,510 - experiment_functions - INFO - Early stopping at epoch 550. Best Recall: 0.0267
2026-05-18 22:28:11,610 - optuna.study.study - INFO - Trial 14 finished with value: 0.026719575491971882 and parameters: {'n_layers': 4, 'embedding_dim': 96, 'lr': 0.001798754252589092, 'lambda_val': 3.155496026930218e-05, 'batch_size': 4029, 'optimizer': 'Adam'}. Best is trial 0 with value: 0.0587424388882642.
2026-05-18 22:28:22,148 - experiment_functions - INFO - Early stopping at epoch 700. Best Recall: 0.0620
2026-05-18 22:28:22,228 - optuna.study.study - INFO - Trial 15 finished with value: 0.061984109835561435 and parameters: {'n_layers': 1, 'embedding_dim': 64, 'lr': 0.0023824425745809746, 'lambda_val': 0.0010333890396561094, 'batch_size': 1517, 'optimizer': 'Adam'}. Best is trial 15 with value: 0.061984109835561435.
2026-05-18 22:28:36,586 - optuna.study._optimize - INFO - Trial 16 pruned. 
2026-05-18 22:28:50,310 - experiment_functions - INFO - Early stopping at epoch 550. Best Recall: 0.0537
2026-05-18 22:28:51,076 - optuna.study.study - INFO - Trial 17 finished with value: 0.05365150811576877 and parameters: {'n_layers': 2, 'embedding_dim': 64, 'lr': 0.005847296524783498, 'lambda_val': 0.0012325997543885356, 'batch_size': 1288, 'optimizer': 'Adam'}. Best is trial 15 with value: 0.061984109835561435.
2026-05-18 22:29:05,533 - experiment_functions - INFO - Early stopping at epoch 700. Best Recall: 0.0462
2026-05-18 22:29:05,611 - optuna.study.study - INFO - Trial 18 finished with value: 0.046223556582177146 and parameters: {'n_layers': 1, 'embedding_dim': 256, 'lr': 0.0015773491252695723, 'lambda_val': 0.015323568601863936, 'batch_size': 1939, 'optimizer': 'Adam'}. Best is trial 15 with value: 0.061984109835561435.
2026-05-18 22:29:19,978 - optuna.study._optimize - INFO - Trial 19 pruned. 
2026-05-18 22:29:38,591 - experiment_functions - INFO - Early stopping at epoch 1050. Best Recall: 0.0710
2026-05-18 22:29:38,694 - optuna.study.study - INFO - Trial 20 finished with value: 0.07104344500773296 and parameters: {'n_layers': 1, 'embedding_dim': 32, 'lr': 0.0008052647789016666, 'lambda_val': 0.016986391661789765, 'batch_size': 823, 'optimizer': 'RMSprop'}. Best is trial 20 with value: 0.07104344500773296.
2026-05-18 22:29:56,241 - experiment_functions - INFO - Early stopping at epoch 1150. Best Recall: 0.0653
2026-05-18 22:29:57,101 - optuna.study.study - INFO - Trial 21 finished with value: 0.0652574482694446 and parameters: {'n_layers': 1, 'embedding_dim': 32, 'lr': 0.0007626268212726786, 'lambda_val': 0.019607971289546913, 'batch_size': 726, 'optimizer': 'RMSprop'}. Best is trial 20 with value: 0.07104344500773296.
2026-05-18 22:30:04,148 - experiment_functions - INFO - Early stopping at epoch 500. Best Recall: 0.0046
2026-05-18 22:30:04,238 - optuna.study.study - INFO - Trial 22 finished with value: 0.0046219094697196855 and parameters: {'n_layers': 1, 'embedding_dim': 32, 'lr': 0.0005148310349639721, 'lambda_val': 0.06154327804392556, 'batch_size': 560, 'optimizer': 'RMSprop'}. Best is trial 20 with value: 0.07104344500773296.
2026-05-18 22:30:17,980 - optuna.study._optimize - INFO - Trial 23 pruned. 
2026-05-18 22:30:25,739 - experiment_functions - INFO - Early stopping at epoch 550. Best Recall: 0.0135
2026-05-18 22:30:25,895 - optuna.study.study - INFO - Trial 24 finished with value: 0.01345568770231843 and parameters: {'n_layers': 2, 'embedding_dim': 32, 'lr': 0.0027928382686737683, 'lambda_val': 0.01894944676365654, 'batch_size': 904, 'optimizer': 'RMSprop'}. Best is trial 20 with value: 0.07104344500773296.
2026-05-18 22:30:43,817 - experiment_functions - INFO - Early stopping at epoch 1250. Best Recall: 0.0702
2026-05-18 22:30:43,923 - optuna.study.study - INFO - Trial 25 finished with value: 0.07023208960031743 and parameters: {'n_layers': 1, 'embedding_dim': 32, 'lr': 0.0008873300578573641, 'lambda_val': 0.0004613007185635022, 'batch_size': 784, 'optimizer': 'RMSprop'}. Best is trial 20 with value: 0.07104344500773296.
2026-05-18 22:30:53,443 - experiment_functions - INFO - Early stopping at epoch 500. Best Recall: 0.0057
2026-05-18 22:30:54,206 - optuna.study.study - INFO - Trial 26 finished with value: 0.0057365261527279904 and parameters: {'n_layers': 2, 'embedding_dim': 32, 'lr': 4.939451448752954e-05, 'lambda_val': 0.09642281229575225, 'batch_size': 682, 'optimizer': 'RMSprop'}. Best is trial 20 with value: 0.07104344500773296.
2026-05-18 22:31:20,178 - experiment_functions - INFO - Early stopping at epoch 1500. Best Recall: 0.0651
2026-05-18 22:31:20,279 - optuna.study.study - INFO - Trial 27 finished with value: 0.06507145234635955 and parameters: {'n_layers': 1, 'embedding_dim': 32, 'lr': 0.0007869235176913923, 'lambda_val': 4.220090561726962e-06, 'batch_size': 1041, 'optimizer': 'RMSprop'}. Best is trial 20 with value: 0.07104344500773296.
2026-05-18 22:31:30,076 - experiment_functions - INFO - Early stopping at epoch 650. Best Recall: 0.0368
2026-05-18 22:31:30,164 - optuna.study.study - INFO - Trial 28 finished with value: 0.03676139873454864 and parameters: {'n_layers': 3, 'embedding_dim': 32, 'lr': 0.0009791443376071687, 'lambda_val': 0.0005886326891732062, 'batch_size': 769, 'optimizer': 'RMSprop'}. Best is trial 20 with value: 0.07104344500773296.
2026-05-18 22:31:43,485 - optuna.study._optimize - INFO - Trial 29 pruned. 
2026-05-18 22:31:54,968 - experiment_functions - INFO - Early stopping at epoch 700. Best Recall: 0.0576
2026-05-18 22:31:55,060 - optuna.study.study - INFO - Trial 30 finished with value: 0.05757586359549623 and parameters: {'n_layers': 1, 'embedding_dim': 32, 'lr': 0.0011326681082955315, 'lambda_val': 0.0028493356543064048, 'batch_size': 1984, 'optimizer': 'RMSprop'}. Best is trial 20 with value: 0.07104344500773296.
2026-05-18 22:32:28,925 - experiment_functions - INFO - Early stopping at epoch 2450. Best Recall: 0.0712
2026-05-18 22:32:29,019 - optuna.study.study - INFO - Trial 31 finished with value: 0.07116529109719333 and parameters: {'n_layers': 1, 'embedding_dim': 32, 'lr': 0.0006990165845608697, 'lambda_val': 1.2935688876621188e-06, 'batch_size': 1056, 'optimizer': 'RMSprop'}. Best is trial 31 with value: 0.07116529109719333.
2026-05-18 22:32:44,165 - optuna.study._optimize - INFO - Trial 32 pruned. 
2026-05-18 22:33:37,933 - optuna.study.study - INFO - Trial 33 finished with value: 0.06943060859451525 and parameters: {'n_layers': 1, 'embedding_dim': 32, 'lr': 0.000539124923778873, 'lambda_val': 5.0009738531910135e-06, 'batch_size': 1101, 'optimizer': 'RMSprop'}. Best is trial 31 with value: 0.07116529109719333.
2026-05-18 22:33:53,716 - optuna.study._optimize - INFO - Trial 34 pruned. 
2026-05-18 22:34:08,736 - optuna.study._optimize - INFO - Trial 35 pruned. 
2026-05-18 22:34:21,829 - optuna.study._optimize - INFO - Trial 36 pruned. 
2026-05-18 22:34:38,808 - optuna.study._optimize - INFO - Trial 37 pruned. 
2026-05-18 22:34:57,031 - optuna.study._optimize - INFO - Trial 38 pruned. 
2026-05-18 22:35:10,836 - experiment_functions - INFO - Early stopping at epoch 500. Best Recall: 0.0052
2026-05-18 22:35:10,947 - optuna.study.study - INFO - Trial 39 finished with value: 0.005245431797913199 and parameters: {'n_layers': 2, 'embedding_dim': 128, 'lr': 0.0004299893796101053, 'lambda_val': 2.193969199472883e-06, 'batch_size': 2670, 'optimizer': 'SGD'}. Best is trial 31 with value: 0.07116529109719333.
2026-05-18 22:35:25,440 - experiment_functions - INFO - Early stopping at epoch 900. Best Recall: 0.0578
2026-05-18 22:35:25,530 - optuna.study.study - INFO - Trial 40 finished with value: 0.05778069532921361 and parameters: {'n_layers': 1, 'embedding_dim': 32, 'lr': 0.0011465559635687457, 'lambda_val': 0.00034730465091017813, 'batch_size': 1749, 'optimizer': 'RMSprop'}. Best is trial 31 with value: 0.07116529109719333.
2026-05-18 22:35:45,978 - experiment_functions - INFO - Early stopping at epoch 1350. Best Recall: 0.0682
2026-05-18 22:35:46,070 - optuna.study.study - INFO - Trial 41 finished with value: 0.06822616675721059 and parameters: {'n_layers': 1, 'embedding_dim': 32, 'lr': 0.000651765469909051, 'lambda_val': 0.035237386079301956, 'batch_size': 746, 'optimizer': 'RMSprop'}. Best is trial 31 with value: 0.07116529109719333.
2026-05-18 22:36:04,618 - experiment_functions - INFO - Early stopping at epoch 1350. Best Recall: 0.0695
2026-05-18 22:36:04,710 - optuna.study.study - INFO - Trial 42 finished with value: 0.06951558764131675 and parameters: {'n_layers': 1, 'embedding_dim': 32, 'lr': 0.0005993559099230418, 'lambda_val': 0.033295892916164804, 'batch_size': 900, 'optimizer': 'RMSprop'}. Best is trial 31 with value: 0.07116529109719333.
2026-05-18 22:36:26,831 - optuna.study._optimize - INFO - Trial 43 pruned. 
2026-05-18 22:36:35,374 - experiment_functions - INFO - Early stopping at epoch 500. Best Recall: 0.0056
2026-05-18 22:36:35,466 - optuna.study.study - INFO - Trial 44 finished with value: 0.005556191006048945 and parameters: {'n_layers': 1, 'embedding_dim': 32, 'lr': 0.0022054783576378983, 'lambda_val': 0.00018072543617019766, 'batch_size': 1023, 'optimizer': 'SGD'}. Best is trial 31 with value: 0.07116529109719333.
2026-05-18 22:36:56,039 - optuna.study._optimize - INFO - Trial 45 pruned. 
2026-05-18 22:37:11,310 - experiment_functions - INFO - Early stopping at epoch 600. Best Recall: 0.0415
2026-05-18 22:37:11,691 - optuna.study.study - INFO - Trial 46 finished with value: 0.04151454373859903 and parameters: {'n_layers': 2, 'embedding_dim': 32, 'lr': 0.0013693162042027979, 'lambda_val': 0.00793763376447415, 'batch_size': 532, 'optimizer': 'RMSprop'}. Best is trial 31 with value: 0.07116529109719333.
2026-05-18 22:37:31,107 - experiment_functions - INFO - Early stopping at epoch 650. Best Recall: 0.0275
2026-05-18 22:37:31,874 - optuna.study.study - INFO - Trial 47 finished with value: 0.02746796135186177 and parameters: {'n_layers': 4, 'embedding_dim': 32, 'lr': 0.0005973785302766413, 'lambda_val': 0.03240087507130001, 'batch_size': 1584, 'optimizer': 'RMSprop'}. Best is trial 31 with value: 0.07116529109719333.
2026-05-18 22:37:50,984 - experiment_functions - INFO - Early stopping at epoch 500. Best Recall: 0.0049
2026-05-18 22:37:51,086 - optuna.study.study - INFO - Trial 48 finished with value: 0.004926293435972589 and parameters: {'n_layers': 1, 'embedding_dim': 128, 'lr': 0.0035807659487936934, 'lambda_val': 2.2738150437133743e-06, 'batch_size': 929, 'optimizer': 'SGD'}. Best is trial 31 with value: 0.07116529109719333.
2026-05-18 22:38:15,581 - optuna.study._optimize - INFO - Trial 49 pruned. 
2026-05-18 22:38:37,100 - experiment_functions - INFO - Early stopping at epoch 900. Best Recall: 0.0456
2026-05-18 22:38:37,216 - optuna.study.study - INFO - Trial 50 finished with value: 0.04563799703973658 and parameters: {'n_layers': 2, 'embedding_dim': 96, 'lr': 0.0003526901993578395, 'lambda_val': 0.00011088418023644143, 'batch_size': 3614, 'optimizer': 'RMSprop'}. Best is trial 31 with value: 0.07116529109719333.
2026-05-18 22:38:51,204 - experiment_functions - INFO - Early stopping at epoch 1000. Best Recall: 0.0643
2026-05-18 22:38:51,297 - optuna.study.study - INFO - Trial 51 finished with value: 0.06429866125303962 and parameters: {'n_layers': 1, 'embedding_dim': 32, 'lr': 0.0008028194666733901, 'lambda_val': 0.03637140633669907, 'batch_size': 730, 'optimizer': 'RMSprop'}. Best is trial 31 with value: 0.07116529109719333.
2026-05-18 22:39:06,413 - experiment_functions - INFO - Early stopping at epoch 600. Best Recall: 0.0536
2026-05-18 22:39:07,180 - optuna.study.study - INFO - Trial 52 finished with value: 0.05363734315407665 and parameters: {'n_layers': 1, 'embedding_dim': 32, 'lr': 0.001769667261503463, 'lambda_val': 0.030052674876052992, 'batch_size': 793, 'optimizer': 'RMSprop'}. Best is trial 31 with value: 0.07116529109719333.
2026-05-18 22:39:36,143 - experiment_functions - INFO - Early stopping at epoch 1950. Best Recall: 0.0732
2026-05-18 22:39:36,249 - optuna.study.study - INFO - Trial 53 finished with value: 0.07320461295991322 and parameters: {'n_layers': 1, 'embedding_dim': 32, 'lr': 0.0005836749615603886, 'lambda_val': 0.009746473000955488, 'batch_size': 1261, 'optimizer': 'RMSprop'}. Best is trial 53 with value: 0.07320461295991322.
2026-05-18 22:39:47,435 - experiment_functions - INFO - Early stopping at epoch 750. Best Recall: 0.0632
2026-05-18 22:39:47,550 - optuna.study.study - INFO - Trial 54 finished with value: 0.06319634153466461 and parameters: {'n_layers': 1, 'embedding_dim': 64, 'lr': 0.0009971925751969036, 'lambda_val': 0.007154507014704044, 'batch_size': 1261, 'optimizer': 'RMSprop'}. Best is trial 53 with value: 0.07320461295991322.
2026-05-18 22:40:01,803 - optuna.study._optimize - INFO - Trial 55 pruned. 
2026-05-18 22:40:18,017 - optuna.study._optimize - INFO - Trial 56 pruned. 
2026-05-18 22:40:25,362 - experiment_functions - INFO - Early stopping at epoch 500. Best Recall: 0.0054
2026-05-18 22:40:25,464 - optuna.study.study - INFO - Trial 57 finished with value: 0.0054401666279170185 and parameters: {'n_layers': 1, 'embedding_dim': 32, 'lr': 9.843680722480492e-05, 'lambda_val': 0.09862148131665413, 'batch_size': 985, 'optimizer': 'SGD'}. Best is trial 53 with value: 0.07320461295991322.
2026-05-18 22:40:34,852 - experiment_functions - INFO - Early stopping at epoch 600. Best Recall: 0.0398
2026-05-18 22:40:34,956 - optuna.study.study - INFO - Trial 58 finished with value: 0.03979368032062743 and parameters: {'n_layers': 2, 'embedding_dim': 32, 'lr': 0.001361569164863659, 'lambda_val': 0.0021128952544769326, 'batch_size': 1135, 'optimizer': 'RMSprop'}. Best is trial 53 with value: 0.07320461295991322.
2026-05-18 22:40:43,934 - experiment_functions - INFO - Early stopping at epoch 550. Best Recall: 0.0120
2026-05-18 22:40:44,058 - optuna.study.study - INFO - Trial 59 finished with value: 0.012014651632184091 and parameters: {'n_layers': 3, 'embedding_dim': 96, 'lr': 0.0025228281622818437, 'lambda_val': 0.0004198171255062207, 'batch_size': 1382, 'optimizer': 'RMSprop'}. Best is trial 53 with value: 0.07320461295991322.
2026-05-18 22:40:51,333 - experiment_functions - INFO - Early stopping at epoch 500. Best Recall: 0.0049
2026-05-18 22:40:51,416 - optuna.study.study - INFO - Trial 60 finished with value: 0.004911725599631687 and parameters: {'n_layers': 1, 'embedding_dim': 128, 'lr': 0.0002667773420730322, 'lambda_val': 0.01460414578310899, 'batch_size': 650, 'optimizer': 'Adam'}. Best is trial 53 with value: 0.07320461295991322.
2026-05-18 22:41:05,808 - experiment_functions - INFO - Early stopping at epoch 1000. Best Recall: 0.0615
2026-05-18 22:41:05,911 - optuna.study.study - INFO - Trial 61 finished with value: 0.06147451078823738 and parameters: {'n_layers': 1, 'embedding_dim': 32, 'lr': 0.0007280722581774571, 'lambda_val': 0.04989018589793951, 'batch_size': 854, 'optimizer': 'RMSprop'}. Best is trial 53 with value: 0.07320461295991322.
2026-05-18 22:41:30,711 - experiment_functions - INFO - Early stopping at epoch 1850. Best Recall: 0.0687
2026-05-18 22:41:30,824 - optuna.study.study - INFO - Trial 62 finished with value: 0.06868019401066115 and parameters: {'n_layers': 1, 'embedding_dim': 32, 'lr': 0.0005845756936440392, 'lambda_val': 0.023365698937686884, 'batch_size': 688, 'optimizer': 'RMSprop'}. Best is trial 53 with value: 0.07320461295991322.
2026-05-18 22:41:43,680 - experiment_functions - INFO - Early stopping at epoch 900. Best Recall: 0.0647
2026-05-18 22:41:43,784 - optuna.study.study - INFO - Trial 63 finished with value: 0.06471144118218201 and parameters: {'n_layers': 1, 'embedding_dim': 32, 'lr': 0.0009731007000999284, 'lambda_val': 0.0224302820805602, 'batch_size': 688, 'optimizer': 'RMSprop'}. Best is trial 53 with value: 0.07320461295991322.
2026-05-18 22:41:58,708 - optuna.study._optimize - INFO - Trial 64 pruned. 
2026-05-18 22:42:07,504 - experiment_functions - INFO - Early stopping at epoch 600. Best Recall: 0.0518
2026-05-18 22:42:07,596 - optuna.study.study - INFO - Trial 65 finished with value: 0.051819306152326425 and parameters: {'n_layers': 1, 'embedding_dim': 64, 'lr': 0.001527231384109248, 'lambda_val': 0.012888952792343769, 'batch_size': 1108, 'optimizer': 'RMSprop'}. Best is trial 53 with value: 0.07320461295991322.
2026-05-18 22:42:14,532 - experiment_functions - INFO - Early stopping at epoch 500. Best Recall: 0.0048
2026-05-18 22:42:14,623 - optuna.study.study - INFO - Trial 66 finished with value: 0.0048122098004237095 and parameters: {'n_layers': 1, 'embedding_dim': 32, 'lr': 0.00036297094059016517, 'lambda_val': 0.07032970166829358, 'batch_size': 607, 'optimizer': 'RMSprop'}. Best is trial 53 with value: 0.07320461295991322.
2026-05-18 22:42:28,320 - experiment_functions - INFO - Early stopping at epoch 950. Best Recall: 0.0678
2026-05-18 22:42:28,423 - optuna.study.study - INFO - Trial 67 finished with value: 0.06784787283715901 and parameters: {'n_layers': 1, 'embedding_dim': 32, 'lr': 0.000813684527909309, 'lambda_val': 0.024076566773242013, 'batch_size': 1260, 'optimizer': 'RMSprop'}. Best is trial 53 with value: 0.07320461295991322.
2026-05-18 22:42:41,769 - optuna.study._optimize - INFO - Trial 68 pruned. 
2026-05-18 22:42:54,919 - optuna.study._optimize - INFO - Trial 69 pruned. 
2026-05-18 22:43:03,683 - experiment_functions - INFO - Early stopping at epoch 550. Best Recall: 0.0372
2026-05-18 22:43:03,777 - optuna.study.study - INFO - Trial 70 finished with value: 0.03721893672910661 and parameters: {'n_layers': 1, 'embedding_dim': 32, 'lr': 0.0034763467029917403, 'lambda_val': 2.0974632589376412e-05, 'batch_size': 1884, 'optimizer': 'RMSprop'}. Best is trial 53 with value: 0.07320461295991322.
2026-05-18 22:43:19,965 - experiment_functions - INFO - Early stopping at epoch 1200. Best Recall: 0.0676
2026-05-18 22:43:20,063 - optuna.study.study - INFO - Trial 71 finished with value: 0.0676212567177402 and parameters: {'n_layers': 1, 'embedding_dim': 32, 'lr': 0.0006550303054360684, 'lambda_val': 0.037412057319930185, 'batch_size': 777, 'optimizer': 'RMSprop'}. Best is trial 53 with value: 0.07320461295991322.
2026-05-18 22:43:28,656 - experiment_functions - INFO - Early stopping at epoch 600. Best Recall: 0.0341
2026-05-18 22:43:28,760 - optuna.study.study - INFO - Trial 72 finished with value: 0.03405815439434387 and parameters: {'n_layers': 1, 'embedding_dim': 32, 'lr': 0.0020315797868157614, 'lambda_val': 0.048299426543303665, 'batch_size': 1002, 'optimizer': 'RMSprop'}. Best is trial 53 with value: 0.07320461295991322.
2026-05-18 22:43:51,382 - experiment_functions - INFO - Early stopping at epoch 1600. Best Recall: 0.0725
