2026-05-18 06:48:57,108 - optuna.study.study - INFO - Trial 292 finished with value: 0.07220681346654508 and parameters: {'n_layers': 1, 'embedding_dim': 32, 'lr': 0.0008754125355499956, 'lambda_val': 6.040191263729672e-05, 'batch_size': 706, 'optimizer': 'RMSprop'}. Best is trial 171 with value: 0.07732428247066869.
2026-05-18 06:49:08,148 - experiment_functions - INFO - Early stopping at epoch 700. Best Recall: 0.0503
2026-05-18 06:49:08,237 - optuna.study.study - INFO - Trial 293 finished with value: 0.05026578838075743 and parameters: {'n_layers': 1, 'embedding_dim': 256, 'lr': 0.0012549517604289043, 'lambda_val': 4.992778610105997e-05, 'batch_size': 676, 'optimizer': 'RMSprop'}. Best is trial 171 with value: 0.07732428247066869.
2026-05-18 06:49:33,507 - experiment_functions - INFO - Early stopping at epoch 1850. Best Recall: 0.0704
2026-05-18 06:49:33,640 - optuna.study.study - INFO - Trial 294 finished with value: 0.0704114552849327 and parameters: {'n_layers': 1, 'embedding_dim': 32, 'lr': 0.0009191351689849581, 'lambda_val': 3.500997544369187e-05, 'batch_size': 614, 'optimizer': 'RMSprop'}. Best is trial 171 with value: 0.07732428247066869.
2026-05-18 06:50:00,679 - experiment_functions - INFO - Early stopping at epoch 1950. Best Recall: 0.0729
2026-05-18 06:50:00,856 - optuna.study.study - INFO - Trial 295 finished with value: 0.07292186540462255 and parameters: {'n_layers': 1, 'embedding_dim': 32, 'lr': 0.0009519511064079507, 'lambda_val': 3.3124899320495233e-05, 'batch_size': 561, 'optimizer': 'RMSprop'}. Best is trial 171 with value: 0.07732428247066869.
2026-05-18 06:50:18,367 - optuna.study._optimize - INFO - Trial 296 pruned. 
2026-05-18 06:50:34,322 - experiment_functions - INFO - Early stopping at epoch 1150. Best Recall: 0.0671
2026-05-18 06:50:34,424 - optuna.study.study - INFO - Trial 297 finished with value: 0.06709627818994898 and parameters: {'n_layers': 1, 'embedding_dim': 32, 'lr': 0.001209801597895134, 'lambda_val': 4.057628052135417e-05, 'batch_size': 563, 'optimizer': 'RMSprop'}. Best is trial 171 with value: 0.07732428247066869.
2026-05-18 06:50:43,477 - experiment_functions - INFO - Early stopping at epoch 600. Best Recall: 0.0530
2026-05-18 06:50:43,546 - optuna.study.study - INFO - Trial 298 finished with value: 0.052994601912971964 and parameters: {'n_layers': 1, 'embedding_dim': 128, 'lr': 0.0016080972672873936, 'lambda_val': 1.380029311823387e-05, 'batch_size': 1742, 'optimizer': 'RMSprop'}. Best is trial 171 with value: 0.07732428247066869.
2026-05-18 06:51:11,788 - experiment_functions - INFO - Early stopping at epoch 2200. Best Recall: 0.0723
2026-05-18 06:51:11,879 - optuna.study.study - INFO - Trial 299 finished with value: 0.07225619821586354 and parameters: {'n_layers': 1, 'embedding_dim': 32, 'lr': 0.0009221487701248786, 'lambda_val': 2.2927784720644173e-05, 'batch_size': 522, 'optimizer': 'RMSprop'}. Best is trial 171 with value: 0.07732428247066869.
2026-05-18 06:51:51,028 - experiment_functions - INFO - Early stopping at epoch 3600. Best Recall: 0.0728
2026-05-18 06:51:51,940 - root - INFO -   **** Training e_1M_1c1dcs_rand5
2026-05-18 06:51:51,992 - root - INFO -   **** Getting 190231/805443 random edges
2026-05-18 06:51:52,747 - optuna.storages._rdb.storage - INFO - A new study created in RDB with name: Study_e_1M_1c1dcs_rand5
2026-05-18 06:52:27,406 - experiment_functions - INFO - Early stopping at epoch 1600. Best Recall: 0.0586
2026-05-18 06:52:28,409 - optuna.study.study - INFO - Trial 0 finished with value: 0.0586378680264751 and parameters: {'n_layers': 1, 'embedding_dim': 96, 'lr': 0.00041051810817020827, 'lambda_val': 0.00015811189485459917, 'batch_size': 2812, 'optimizer': 'RMSprop'}. Best is trial 0 with value: 0.0586378680264751.
2026-05-18 06:52:38,884 - experiment_functions - INFO - Early stopping at epoch 500. Best Recall: 0.0048
2026-05-18 06:52:38,974 - optuna.study.study - INFO - Trial 1 finished with value: 0.004764090896162627 and parameters: {'n_layers': 4, 'embedding_dim': 32, 'lr': 0.0006512325638330624, 'lambda_val': 1.0643128110815683e-06, 'batch_size': 1548, 'optimizer': 'SGD'}. Best is trial 0 with value: 0.0586378680264751.
2026-05-18 06:52:49,353 - experiment_functions - INFO - Early stopping at epoch 600. Best Recall: 0.0463
2026-05-18 06:52:49,474 - optuna.study.study - INFO - Trial 2 finished with value: 0.04625525995807415 and parameters: {'n_layers': 2, 'embedding_dim': 256, 'lr': 0.0006293702096833078, 'lambda_val': 2.969408966516107e-06, 'batch_size': 3519, 'optimizer': 'RMSprop'}. Best is trial 0 with value: 0.0586378680264751.
2026-05-18 06:53:50,323 - optuna.study.study - INFO - Trial 3 finished with value: 0.06082158673349592 and parameters: {'n_layers': 1, 'embedding_dim': 32, 'lr': 0.00045314977763347364, 'lambda_val': 0.00028674777874201554, 'batch_size': 1480, 'optimizer': 'Adam'}. Best is trial 3 with value: 0.06082158673349592.
2026-05-18 06:53:58,512 - experiment_functions - INFO - Early stopping at epoch 600. Best Recall: 0.0058
2026-05-18 06:53:58,602 - optuna.study.study - INFO - Trial 4 finished with value: 0.005753029207972665 and parameters: {'n_layers': 1, 'embedding_dim': 128, 'lr': 1.613202241320693e-05, 'lambda_val': 5.046741103419746e-06, 'batch_size': 1469, 'optimizer': 'RMSprop'}. Best is trial 3 with value: 0.06082158673349592.
2026-05-18 06:54:14,595 - optuna.study._optimize - INFO - Trial 5 pruned. 
2026-05-18 06:54:26,145 - experiment_functions - INFO - Early stopping at epoch 750. Best Recall: 0.0529
2026-05-18 06:54:26,280 - optuna.study.study - INFO - Trial 6 finished with value: 0.05290936910538567 and parameters: {'n_layers': 1, 'embedding_dim': 256, 'lr': 0.0007932688661116723, 'lambda_val': 9.459467712349948e-06, 'batch_size': 2316, 'optimizer': 'RMSprop'}. Best is trial 3 with value: 0.06082158673349592.
2026-05-18 06:54:33,639 - experiment_functions - INFO - Early stopping at epoch 500. Best Recall: 0.0056
2026-05-18 06:54:33,729 - optuna.study.study - INFO - Trial 7 finished with value: 0.0056360443168829155 and parameters: {'n_layers': 2, 'embedding_dim': 96, 'lr': 0.00022987689143535599, 'lambda_val': 2.4754165898725035e-05, 'batch_size': 1750, 'optimizer': 'SGD'}. Best is trial 3 with value: 0.06082158673349592.
2026-05-18 06:54:41,322 - experiment_functions - INFO - Early stopping at epoch 500. Best Recall: 0.0050
2026-05-18 06:54:41,423 - optuna.study.study - INFO - Trial 8 finished with value: 0.005048886420390231 and parameters: {'n_layers': 3, 'embedding_dim': 96, 'lr': 0.013866926134819671, 'lambda_val': 1.492456283710391e-06, 'batch_size': 2273, 'optimizer': 'SGD'}. Best is trial 3 with value: 0.06082158673349592.
2026-05-18 06:54:55,970 - optuna.study._optimize - INFO - Trial 9 pruned. 
2026-05-18 06:55:09,972 - optuna.study._optimize - INFO - Trial 10 pruned. 
2026-05-18 06:55:23,171 - optuna.study._optimize - INFO - Trial 11 pruned. 
2026-05-18 06:55:32,592 - experiment_functions - INFO - Early stopping at epoch 600. Best Recall: 0.0566
2026-05-18 06:55:32,727 - optuna.study.study - INFO - Trial 12 finished with value: 0.05655574325555957 and parameters: {'n_layers': 1, 'embedding_dim': 96, 'lr': 0.004735814703213561, 'lambda_val': 0.00013394448676211617, 'batch_size': 737, 'optimizer': 'Adam'}. Best is trial 3 with value: 0.06082158673349592.
2026-05-18 06:55:39,728 - experiment_functions - INFO - Early stopping at epoch 500. Best Recall: 0.0048
2026-05-18 06:55:39,819 - optuna.study.study - INFO - Trial 13 finished with value: 0.0048126744279028775 and parameters: {'n_layers': 2, 'embedding_dim': 32, 'lr': 0.00010934883849622567, 'lambda_val': 0.0010050135798361395, 'batch_size': 1138, 'optimizer': 'Adam'}. Best is trial 3 with value: 0.06082158673349592.
2026-05-18 06:55:49,138 - experiment_functions - INFO - Early stopping at epoch 650. Best Recall: 0.0571
2026-05-18 06:55:49,228 - optuna.study.study - INFO - Trial 14 finished with value: 0.05709754747357042 and parameters: {'n_layers': 1, 'embedding_dim': 64, 'lr': 0.003051854602061259, 'lambda_val': 5.0834540858393535e-05, 'batch_size': 2081, 'optimizer': 'Adam'}. Best is trial 3 with value: 0.06082158673349592.
2026-05-18 06:56:05,115 - optuna.study._optimize - INFO - Trial 15 pruned. 
2026-05-18 06:56:20,248 - optuna.study._optimize - INFO - Trial 16 pruned. 
2026-05-18 06:56:29,634 - experiment_functions - INFO - Early stopping at epoch 650. Best Recall: 0.0526
2026-05-18 06:56:29,755 - optuna.study.study - INFO - Trial 17 finished with value: 0.052636670127260914 and parameters: {'n_layers': 2, 'embedding_dim': 32, 'lr': 0.0025137600328382806, 'lambda_val': 0.000254886424013161, 'batch_size': 1007, 'optimizer': 'Adam'}. Best is trial 3 with value: 0.06082158673349592.
2026-05-18 06:57:24,020 - optuna.study.study - INFO - Trial 18 finished with value: 0.06227910385892588 and parameters: {'n_layers': 1, 'embedding_dim': 96, 'lr': 0.0003176812482922384, 'lambda_val': 3.2195109307726064e-05, 'batch_size': 2642, 'optimizer': 'RMSprop'}. Best is trial 18 with value: 0.06227910385892588.
2026-05-18 06:57:31,336 - experiment_functions - INFO - Early stopping at epoch 500. Best Recall: 0.0048
2026-05-18 06:57:31,436 - optuna.study.study - INFO - Trial 19 finished with value: 0.004811262395056848 and parameters: {'n_layers': 2, 'embedding_dim': 32, 'lr': 3.7568758632651683e-05, 'lambda_val': 2.6765646374655228e-05, 'batch_size': 1854, 'optimizer': 'SGD'}. Best is trial 18 with value: 0.06227910385892588.
2026-05-18 06:57:40,388 - experiment_functions - INFO - Early stopping at epoch 600. Best Recall: 0.0517
2026-05-18 06:57:40,498 - optuna.study.study - INFO - Trial 20 finished with value: 0.051711887554256875 and parameters: {'n_layers': 1, 'embedding_dim': 64, 'lr': 0.0015884902365178814, 'lambda_val': 0.005052937088845626, 'batch_size': 2528, 'optimizer': 'RMSprop'}. Best is trial 18 with value: 0.06227910385892588.
2026-05-18 06:58:05,751 - optuna.study._optimize - INFO - Trial 21 pruned. 
2026-05-18 06:58:29,751 - experiment_functions - INFO - Early stopping at epoch 1750. Best Recall: 0.0609
2026-05-18 06:58:29,850 - optuna.study.study - INFO - Trial 22 finished with value: 0.060918506991530515 and parameters: {'n_layers': 1, 'embedding_dim': 96, 'lr': 0.00037744731824227817, 'lambda_val': 0.00038083339642852495, 'batch_size': 2648, 'optimizer': 'RMSprop'}. Best is trial 18 with value: 0.06227910385892588.
2026-05-18 06:58:43,233 - optuna.study._optimize - INFO - Trial 23 pruned. 
2026-05-18 06:58:52,057 - experiment_functions - INFO - Early stopping at epoch 550. Best Recall: 0.0475
2026-05-18 06:58:52,165 - optuna.study.study - INFO - Trial 24 finished with value: 0.047518793764557414 and parameters: {'n_layers': 2, 'embedding_dim': 96, 'lr': 0.00111435011968917, 'lambda_val': 0.0021695471787625507, 'batch_size': 2028, 'optimizer': 'RMSprop'}. Best is trial 18 with value: 0.06227910385892588.
2026-05-18 06:59:05,783 - optuna.study._optimize - INFO - Trial 25 pruned. 
2026-05-18 06:59:19,565 - optuna.study._optimize - INFO - Trial 26 pruned. 
2026-05-18 06:59:40,656 - optuna.study._optimize - INFO - Trial 27 pruned. 
2026-05-18 06:59:56,702 - optuna.study._optimize - INFO - Trial 28 pruned. 
2026-05-18 07:00:04,038 - experiment_functions - INFO - Early stopping at epoch 500. Best Recall: 0.0051
2026-05-18 07:00:04,126 - optuna.study.study - INFO - Trial 29 finished with value: 0.005075719265514732 and parameters: {'n_layers': 1, 'embedding_dim': 96, 'lr': 0.00039257466267551854, 'lambda_val': 7.544378792666595e-05, 'batch_size': 2790, 'optimizer': 'SGD'}. Best is trial 18 with value: 0.06227910385892588.
2026-05-18 07:00:16,054 - experiment_functions - INFO - Early stopping at epoch 800. Best Recall: 0.0591
2026-05-18 07:00:16,142 - optuna.study.study - INFO - Trial 30 finished with value: 0.059136749399684226 and parameters: {'n_layers': 1, 'embedding_dim': 32, 'lr': 0.0012324344281094855, 'lambda_val': 0.0019098551772089316, 'batch_size': 1732, 'optimizer': 'RMSprop'}. Best is trial 18 with value: 0.06227910385892588.
2026-05-18 07:00:26,626 - experiment_functions - INFO - Early stopping at epoch 700. Best Recall: 0.0577
2026-05-18 07:00:26,716 - optuna.study.study - INFO - Trial 31 finished with value: 0.05767622947822459 and parameters: {'n_layers': 1, 'embedding_dim': 32, 'lr': 0.001399573879596411, 'lambda_val': 0.0020953682498634496, 'batch_size': 1714, 'optimizer': 'RMSprop'}. Best is trial 18 with value: 0.06227910385892588.
2026-05-18 07:00:40,589 - optuna.study._optimize - INFO - Trial 32 pruned. 
2026-05-18 07:00:54,711 - optuna.study._optimize - INFO - Trial 33 pruned. 
2026-05-18 07:01:26,285 - experiment_functions - INFO - Early stopping at epoch 2250. Best Recall: 0.0610
2026-05-18 07:01:26,392 - optuna.study.study - INFO - Trial 34 finished with value: 0.06104709088975171 and parameters: {'n_layers': 1, 'embedding_dim': 32, 'lr': 0.0006131048492815755, 'lambda_val': 0.00019485836714497397, 'batch_size': 1595, 'optimizer': 'RMSprop'}. Best is trial 18 with value: 0.06227910385892588.
2026-05-18 07:01:37,585 - experiment_functions - INFO - Early stopping at epoch 600. Best Recall: 0.0310
2026-05-18 07:01:37,675 - optuna.study.study - INFO - Trial 35 finished with value: 0.030978447478323793 and parameters: {'n_layers': 4, 'embedding_dim': 128, 'lr': 0.0005433457827090766, 'lambda_val': 0.0002047208204712736, 'batch_size': 2289, 'optimizer': 'RMSprop'}. Best is trial 18 with value: 0.06227910385892588.
2026-05-18 07:01:56,443 - experiment_functions - INFO - Early stopping at epoch 700. Best Recall: 0.0546
2026-05-18 07:01:57,207 - optuna.study.study - INFO - Trial 36 finished with value: 0.0546182410116779 and parameters: {'n_layers': 2, 'embedding_dim': 32, 'lr': 0.0008391164991373056, 'lambda_val': 9.40140344469773e-06, 'batch_size': 1463, 'optimizer': 'RMSprop'}. Best is trial 18 with value: 0.06227910385892588.
2026-05-18 07:02:06,498 - experiment_functions - INFO - Early stopping at epoch 550. Best Recall: 0.0366
2026-05-18 07:02:06,590 - optuna.study.study - INFO - Trial 37 finished with value: 0.03662414611737476 and parameters: {'n_layers': 1, 'embedding_dim': 256, 'lr': 0.002308766083379462, 'lambda_val': 3.6638680222833746e-05, 'batch_size': 3030, 'optimizer': 'RMSprop'}. Best is trial 18 with value: 0.06227910385892588.
2026-05-18 07:02:14,449 - experiment_functions - INFO - Early stopping at epoch 500. Best Recall: 0.0052
2026-05-18 07:02:14,549 - optuna.study.study - INFO - Trial 38 finished with value: 0.005157164944554818 and parameters: {'n_layers': 2, 'embedding_dim': 96, 'lr': 0.0001811655996771575, 'lambda_val': 1.4086084780963561e-05, 'batch_size': 2431, 'optimizer': 'SGD'}. Best is trial 18 with value: 0.06227910385892588.
2026-05-18 07:02:36,543 - experiment_functions - INFO - Early stopping at epoch 1500. Best Recall: 0.0641
2026-05-18 07:02:36,665 - optuna.study.study - INFO - Trial 39 finished with value: 0.06407376696623482 and parameters: {'n_layers': 1, 'embedding_dim': 64, 'lr': 0.0005562895953725549, 'lambda_val': 4.2410282374225004e-06, 'batch_size': 1942, 'optimizer': 'RMSprop'}. Best is trial 39 with value: 0.06407376696623482.
2026-05-18 07:02:51,476 - experiment_functions - INFO - Early stopping at epoch 1000. Best Recall: 0.0626
2026-05-18 07:02:51,565 - optuna.study.study - INFO - Trial 40 finished with value: 0.0625713018250637 and parameters: {'n_layers': 1, 'embedding_dim': 64, 'lr': 0.0007029227921958839, 'lambda_val': 3.7317021928592553e-06, 'batch_size': 2215, 'optimizer': 'RMSprop'}. Best is trial 39 with value: 0.06407376696623482.
2026-05-18 07:03:07,076 - experiment_functions - INFO - Early stopping at epoch 1050. Best Recall: 0.0604
2026-05-18 07:03:07,166 - optuna.study.study - INFO - Trial 41 finished with value: 0.060412659203261034 and parameters: {'n_layers': 1, 'embedding_dim': 64, 'lr': 0.0006963522075786094, 'lambda_val': 3.4360411697923154e-06, 'batch_size': 2158, 'optimizer': 'RMSprop'}. Best is trial 39 with value: 0.06407376696623482.
2026-05-18 07:03:20,815 - optuna.study._optimize - INFO - Trial 42 pruned. 
2026-05-18 07:03:43,331 - experiment_functions - INFO - Early stopping at epoch 1550. Best Recall: 0.0609
2026-05-18 07:03:43,429 - optuna.study.study - INFO - Trial 43 finished with value: 0.060904188690532594 and parameters: {'n_layers': 1, 'embedding_dim': 64, 'lr': 0.0005056059713896219, 'lambda_val': 1.0922871145697228e-06, 'batch_size': 2762, 'optimizer': 'RMSprop'}. Best is trial 39 with value: 0.06407376696623482.
2026-05-18 07:03:56,219 - experiment_functions - INFO - Early stopping at epoch 800. Best Recall: 0.0543
2026-05-18 07:03:56,329 - optuna.study.study - INFO - Trial 44 finished with value: 0.054287264318707576 and parameters: {'n_layers': 1, 'embedding_dim': 64, 'lr': 0.0008370808635788227, 'lambda_val': 2.1056411078642865e-06, 'batch_size': 2637, 'optimizer': 'RMSprop'}. Best is trial 39 with value: 0.06407376696623482.
2026-05-18 07:04:05,906 - experiment_functions - INFO - Early stopping at epoch 600. Best Recall: 0.0548
2026-05-18 07:04:05,997 - optuna.study.study - INFO - Trial 45 finished with value: 0.0548368920145754 and parameters: {'n_layers': 1, 'embedding_dim': 64, 'lr': 0.0017821589445005685, 'lambda_val': 7.492595168129193e-06, 'batch_size': 1625, 'optimizer': 'RMSprop'}. Best is trial 39 with value: 0.06407376696623482.
2026-05-18 07:04:19,745 - optuna.study._optimize - INFO - Trial 46 pruned. 
2026-05-18 07:04:35,204 - optuna.study._optimize - INFO - Trial 47 pruned. 
2026-05-18 07:04:43,731 - experiment_functions - INFO - Early stopping at epoch 550. Best Recall: 0.0291
2026-05-18 07:04:44,507 - optuna.study.study - INFO - Trial 48 finished with value: 0.029142255616815393 and parameters: {'n_layers': 1, 'embedding_dim': 64, 'lr': 0.0038283104668165413, 'lambda_val': 5.360039692123607e-06, 'batch_size': 1931, 'optimizer': 'RMSprop'}. Best is trial 39 with value: 0.06407376696623482.
2026-05-18 07:05:00,739 - experiment_functions - INFO - Early stopping at epoch 500. Best Recall: 0.0053
2026-05-18 07:05:00,848 - optuna.study.study - INFO - Trial 49 finished with value: 0.005273650794505746 and parameters: {'n_layers': 2, 'embedding_dim': 64, 'lr': 0.008741379545075489, 'lambda_val': 4.6601873685286624e-05, 'batch_size': 2900, 'optimizer': 'SGD'}. Best is trial 39 with value: 0.06407376696623482.
2026-05-18 07:05:15,606 - optuna.study._optimize - INFO - Trial 50 pruned. 
2026-05-18 07:05:30,197 - optuna.study._optimize - INFO - Trial 51 pruned. 
2026-05-18 07:05:43,963 - optuna.study._optimize - INFO - Trial 52 pruned. 
2026-05-18 07:06:07,019 - experiment_functions - INFO - Early stopping at epoch 1550. Best Recall: 0.0623
2026-05-18 07:06:07,126 - optuna.study.study - INFO - Trial 53 finished with value: 0.06228000654358355 and parameters: {'n_layers': 1, 'embedding_dim': 64, 'lr': 0.0005170845540706996, 'lambda_val': 2.990125807816503e-06, 'batch_size': 2439, 'optimizer': 'RMSprop'}. Best is trial 39 with value: 0.06407376696623482.
2026-05-18 07:06:21,500 - optuna.study._optimize - INFO - Trial 54 pruned. 
2026-05-18 07:06:32,034 - experiment_functions - INFO - Early stopping at epoch 700. Best Recall: 0.0581
2026-05-18 07:06:32,136 - optuna.study.study - INFO - Trial 55 finished with value: 0.0580754805082943 and parameters: {'n_layers': 1, 'embedding_dim': 128, 'lr': 0.0009789485006596397, 'lambda_val': 1.966359873820535e-06, 'batch_size': 2179, 'optimizer': 'RMSprop'}. Best is trial 39 with value: 0.06407376696623482.
2026-05-18 07:06:49,989 - optuna.study._optimize - INFO - Trial 56 pruned. 
2026-05-18 07:07:07,307 - optuna.study._optimize - INFO - Trial 57 pruned. 
2026-05-18 07:07:22,867 - optuna.study._optimize - INFO - Trial 58 pruned. 
2026-05-18 07:07:30,081 - experiment_functions - INFO - Early stopping at epoch 500. Best Recall: 0.0049
2026-05-18 07:07:30,171 - optuna.study.study - INFO - Trial 59 finished with value: 0.004885280583291811 and parameters: {'n_layers': 1, 'embedding_dim': 96, 'lr': 0.0002170630798330969, 'lambda_val': 3.906613956988271e-06, 'batch_size': 1995, 'optimizer': 'SGD'}. Best is trial 39 with value: 0.06407376696623482.
2026-05-18 07:07:41,931 - experiment_functions - INFO - Early stopping at epoch 800. Best Recall: 0.0626
2026-05-18 07:07:42,066 - optuna.study.study - INFO - Trial 60 finished with value: 0.06263372401553509 and parameters: {'n_layers': 1, 'embedding_dim': 64, 'lr': 0.0010780468968556612, 'lambda_val': 2.8038915501999217e-05, 'batch_size': 1603, 'optimizer': 'RMSprop'}. Best is trial 39 with value: 0.06407376696623482.
2026-05-18 07:07:55,526 - experiment_functions - INFO - Early stopping at epoch 900. Best Recall: 0.0640
2026-05-18 07:07:55,625 - optuna.study.study - INFO - Trial 61 finished with value: 0.06400644855464704 and parameters: {'n_layers': 1, 'embedding_dim': 64, 'lr': 0.0009495532600913439, 'lambda_val': 0.00017185647656307694, 'batch_size': 1536, 'optimizer': 'RMSprop'}. Best is trial 39 with value: 0.06407376696623482.
2026-05-18 07:08:16,879 - experiment_functions - INFO - Early stopping at epoch 750. Best Recall: 0.0579
2026-05-18 07:08:16,979 - optuna.study.study - INFO - Trial 62 finished with value: 0.05786635267785141 and parameters: {'n_layers': 1, 'embedding_dim': 64, 'lr': 0.0011054406967393206, 'lambda_val': 0.00017321072079674968, 'batch_size': 1559, 'optimizer': 'RMSprop'}. Best is trial 39 with value: 0.06407376696623482.
2026-05-18 07:08:25,522 - experiment_functions - INFO - Early stopping at epoch 550. Best Recall: 0.0469
2026-05-18 07:08:25,630 - optuna.study.study - INFO - Trial 63 finished with value: 0.046897407831705165 and parameters: {'n_layers': 1, 'embedding_dim': 64, 'lr': 0.0030666757185601424, 'lambda_val': 2.3874582447544316e-05, 'batch_size': 1269, 'optimizer': 'RMSprop'}. Best is trial 39 with value: 0.06407376696623482.
2026-05-18 07:08:35,660 - experiment_functions - INFO - Early stopping at epoch 650. Best Recall: 0.0526
