2026-05-18 11:34:35,355 - optuna.study._optimize - INFO - Trial 195 pruned. 
2026-05-18 11:35:07,413 - experiment_functions - INFO - Early stopping at epoch 2300. Best Recall: 0.0889
2026-05-18 11:35:07,558 - optuna.study.study - INFO - Trial 196 finished with value: 0.0889363065421503 and parameters: {'n_layers': 1, 'embedding_dim': 64, 'lr': 0.0004864636520962468, 'lambda_val': 0.0004195653935227201, 'batch_size': 636, 'optimizer': 'RMSprop'}. Best is trial 190 with value: 0.09244881852742834.
2026-05-18 11:35:29,245 - optuna.study._optimize - INFO - Trial 197 pruned. 
2026-05-18 11:35:43,411 - optuna.study._optimize - INFO - Trial 198 pruned. 
2026-05-18 11:35:56,217 - optuna.study._optimize - INFO - Trial 199 pruned. 
2026-05-18 11:36:23,293 - experiment_functions - INFO - Early stopping at epoch 1950. Best Recall: 0.0877
2026-05-18 11:36:23,394 - optuna.study.study - INFO - Trial 200 finished with value: 0.08772039153067002 and parameters: {'n_layers': 1, 'embedding_dim': 64, 'lr': 0.0005383678235637581, 'lambda_val': 0.00078161689709847, 'batch_size': 598, 'optimizer': 'RMSprop'}. Best is trial 190 with value: 0.09244881852742834.
2026-05-18 11:36:51,423 - experiment_functions - INFO - Early stopping at epoch 2000. Best Recall: 0.0895
2026-05-18 11:36:51,503 - optuna.study.study - INFO - Trial 201 finished with value: 0.08945849195640852 and parameters: {'n_layers': 1, 'embedding_dim': 64, 'lr': 0.0005315933527510984, 'lambda_val': 0.0008330014661782945, 'batch_size': 623, 'optimizer': 'RMSprop'}. Best is trial 190 with value: 0.09244881852742834.
2026-05-18 11:37:05,508 - optuna.study._optimize - INFO - Trial 202 pruned. 
2026-05-18 11:37:23,911 - experiment_functions - INFO - Early stopping at epoch 1300. Best Recall: 0.0841
2026-05-18 11:37:24,057 - optuna.study.study - INFO - Trial 203 finished with value: 0.08405932150595691 and parameters: {'n_layers': 1, 'embedding_dim': 64, 'lr': 0.0005749769194447625, 'lambda_val': 0.0011486245022431603, 'batch_size': 720, 'optimizer': 'RMSprop'}. Best is trial 190 with value: 0.09244881852742834.
2026-05-18 11:37:38,331 - optuna.study._optimize - INFO - Trial 204 pruned. 
2026-05-18 11:38:00,360 - experiment_functions - INFO - Early stopping at epoch 1500. Best Recall: 0.0863
2026-05-18 11:38:00,450 - optuna.study.study - INFO - Trial 205 finished with value: 0.08630695376468424 and parameters: {'n_layers': 1, 'embedding_dim': 64, 'lr': 0.0005784295998012975, 'lambda_val': 0.0003145116636655747, 'batch_size': 678, 'optimizer': 'RMSprop'}. Best is trial 190 with value: 0.09244881852742834.
2026-05-18 11:38:20,201 - optuna.study._optimize - INFO - Trial 206 pruned. 
2026-05-18 11:38:34,497 - optuna.study._optimize - INFO - Trial 207 pruned. 
2026-05-18 11:38:53,064 - optuna.study._optimize - INFO - Trial 208 pruned. 
2026-05-18 11:39:13,618 - experiment_functions - INFO - Early stopping at epoch 1450. Best Recall: 0.0874
2026-05-18 11:39:13,718 - optuna.study.study - INFO - Trial 209 finished with value: 0.0873799253817626 and parameters: {'n_layers': 1, 'embedding_dim': 64, 'lr': 0.0006144527652893082, 'lambda_val': 0.00030351848699100895, 'batch_size': 518, 'optimizer': 'RMSprop'}. Best is trial 190 with value: 0.09244881852742834.
2026-05-18 11:39:30,567 - experiment_functions - INFO - Early stopping at epoch 1200. Best Recall: 0.0841
2026-05-18 11:39:30,667 - optuna.study.study - INFO - Trial 210 finished with value: 0.08408832150367007 and parameters: {'n_layers': 1, 'embedding_dim': 64, 'lr': 0.0006164917329111189, 'lambda_val': 0.0006299089273208391, 'batch_size': 610, 'optimizer': 'RMSprop'}. Best is trial 190 with value: 0.09244881852742834.
2026-05-18 11:39:45,029 - optuna.study._optimize - INFO - Trial 211 pruned. 
2026-05-18 11:39:59,214 - optuna.study._optimize - INFO - Trial 212 pruned. 
2026-05-18 11:40:13,441 - optuna.study._optimize - INFO - Trial 213 pruned. 
2026-05-18 11:40:27,544 - optuna.study._optimize - INFO - Trial 214 pruned. 
2026-05-18 11:40:42,554 - optuna.study._optimize - INFO - Trial 215 pruned. 
2026-05-18 11:41:04,365 - optuna.study._optimize - INFO - Trial 216 pruned. 
2026-05-18 11:41:22,011 - experiment_functions - INFO - Early stopping at epoch 1200. Best Recall: 0.0847
2026-05-18 11:41:22,100 - optuna.study.study - INFO - Trial 217 finished with value: 0.0846655153130857 and parameters: {'n_layers': 1, 'embedding_dim': 64, 'lr': 0.0006504939816723083, 'lambda_val': 0.0009537857216375893, 'batch_size': 633, 'optimizer': 'RMSprop'}. Best is trial 190 with value: 0.09244881852742834.
2026-05-18 11:41:35,944 - optuna.study._optimize - INFO - Trial 218 pruned. 
2026-05-18 11:41:50,295 - optuna.study._optimize - INFO - Trial 219 pruned. 
2026-05-18 11:42:21,224 - experiment_functions - INFO - Early stopping at epoch 2200. Best Recall: 0.0898
2026-05-18 11:42:21,314 - optuna.study.study - INFO - Trial 220 finished with value: 0.08978882549642753 and parameters: {'n_layers': 1, 'embedding_dim': 64, 'lr': 0.0005398132450310623, 'lambda_val': 0.00035735331264310783, 'batch_size': 569, 'optimizer': 'RMSprop'}. Best is trial 190 with value: 0.09244881852742834.
2026-05-18 11:42:56,250 - experiment_functions - INFO - Early stopping at epoch 1850. Best Recall: 0.0884
2026-05-18 11:42:56,385 - optuna.study.study - INFO - Trial 221 finished with value: 0.08841102374885097 and parameters: {'n_layers': 1, 'embedding_dim': 64, 'lr': 0.0005565322623042845, 'lambda_val': 0.000376110625604392, 'batch_size': 514, 'optimizer': 'RMSprop'}. Best is trial 190 with value: 0.09244881852742834.
2026-05-18 11:43:15,876 - experiment_functions - INFO - Early stopping at epoch 1350. Best Recall: 0.0900
2026-05-18 11:43:15,986 - optuna.study.study - INFO - Trial 222 finished with value: 0.09002806408330949 and parameters: {'n_layers': 1, 'embedding_dim': 64, 'lr': 0.0006724486997661679, 'lambda_val': 0.0003448703556805361, 'batch_size': 584, 'optimizer': 'RMSprop'}. Best is trial 190 with value: 0.09244881852742834.
2026-05-18 11:43:33,332 - optuna.study._optimize - INFO - Trial 223 pruned. 
2026-05-18 11:43:50,912 - experiment_functions - INFO - Early stopping at epoch 1250. Best Recall: 0.0877
2026-05-18 11:43:51,000 - optuna.study.study - INFO - Trial 224 finished with value: 0.08769096516685575 and parameters: {'n_layers': 1, 'embedding_dim': 64, 'lr': 0.0006748322814835463, 'lambda_val': 0.0003134695304315045, 'batch_size': 716, 'optimizer': 'RMSprop'}. Best is trial 190 with value: 0.09244881852742834.
2026-05-18 11:44:06,895 - experiment_functions - INFO - Early stopping at epoch 1100. Best Recall: 0.0846
2026-05-18 11:44:07,039 - optuna.study.study - INFO - Trial 225 finished with value: 0.08460827822566859 and parameters: {'n_layers': 1, 'embedding_dim': 64, 'lr': 0.0006876635456599733, 'lambda_val': 0.00026912117113089037, 'batch_size': 720, 'optimizer': 'RMSprop'}. Best is trial 190 with value: 0.09244881852742834.
2026-05-18 11:44:21,142 - optuna.study._optimize - INFO - Trial 226 pruned. 
2026-05-18 11:44:41,144 - experiment_functions - INFO - Early stopping at epoch 1400. Best Recall: 0.0864
2026-05-18 11:44:41,244 - optuna.study.study - INFO - Trial 227 finished with value: 0.08641878160213873 and parameters: {'n_layers': 1, 'embedding_dim': 64, 'lr': 0.00068047808672753, 'lambda_val': 0.0001743572006269576, 'batch_size': 570, 'optimizer': 'RMSprop'}. Best is trial 190 with value: 0.09244881852742834.
2026-05-18 11:45:03,291 - optuna.study._optimize - INFO - Trial 228 pruned. 
2026-05-18 11:45:17,887 - experiment_functions - INFO - Early stopping at epoch 1000. Best Recall: 0.0839
2026-05-18 11:45:17,986 - optuna.study.study - INFO - Trial 229 finished with value: 0.0838879292325151 and parameters: {'n_layers': 1, 'embedding_dim': 64, 'lr': 0.0007506557230641553, 'lambda_val': 0.0003627189898926498, 'batch_size': 658, 'optimizer': 'RMSprop'}. Best is trial 190 with value: 0.09244881852742834.
2026-05-18 11:45:53,628 - experiment_functions - INFO - Early stopping at epoch 2550. Best Recall: 0.0888
2026-05-18 11:45:53,718 - optuna.study.study - INFO - Trial 230 finished with value: 0.0887984437252313 and parameters: {'n_layers': 1, 'embedding_dim': 64, 'lr': 0.00046195053590231946, 'lambda_val': 0.00026439991334351406, 'batch_size': 727, 'optimizer': 'RMSprop'}. Best is trial 190 with value: 0.09244881852742834.
2026-05-18 11:46:07,464 - optuna.study._optimize - INFO - Trial 231 pruned. 
2026-05-18 11:46:23,586 - experiment_functions - INFO - Early stopping at epoch 1100. Best Recall: 0.0822
2026-05-18 11:46:23,685 - optuna.study.study - INFO - Trial 232 finished with value: 0.08217652875659989 and parameters: {'n_layers': 1, 'embedding_dim': 64, 'lr': 0.0006069034436032086, 'lambda_val': 0.0003918225688045391, 'batch_size': 732, 'optimizer': 'RMSprop'}. Best is trial 190 with value: 0.09244881852742834.
2026-05-18 11:46:37,653 - optuna.study._optimize - INFO - Trial 233 pruned. 
2026-05-18 11:47:07,727 - experiment_functions - INFO - Early stopping at epoch 2150. Best Recall: 0.0914
2026-05-18 11:47:07,816 - optuna.study.study - INFO - Trial 234 finished with value: 0.0914082164516814 and parameters: {'n_layers': 1, 'embedding_dim': 64, 'lr': 0.0004909612230075198, 'lambda_val': 0.0005455794403158333, 'batch_size': 652, 'optimizer': 'RMSprop'}. Best is trial 190 with value: 0.09244881852742834.
2026-05-18 11:47:40,765 - experiment_functions - INFO - Early stopping at epoch 2300. Best Recall: 0.0904
2026-05-18 11:47:40,908 - optuna.study.study - INFO - Trial 235 finished with value: 0.09040336014208808 and parameters: {'n_layers': 1, 'embedding_dim': 64, 'lr': 0.0004563513680486966, 'lambda_val': 0.00045022165635755674, 'batch_size': 713, 'optimizer': 'RMSprop'}. Best is trial 190 with value: 0.09244881852742834.
2026-05-18 11:47:55,450 - optuna.study._optimize - INFO - Trial 236 pruned. 
2026-05-18 11:48:10,085 - optuna.study._optimize - INFO - Trial 237 pruned. 
2026-05-18 11:48:42,054 - experiment_functions - INFO - Early stopping at epoch 2200. Best Recall: 0.0898
2026-05-18 11:48:42,202 - optuna.study.study - INFO - Trial 238 finished with value: 0.08978379604377867 and parameters: {'n_layers': 1, 'embedding_dim': 64, 'lr': 0.00045910054774666215, 'lambda_val': 0.0006017892685771344, 'batch_size': 663, 'optimizer': 'RMSprop'}. Best is trial 190 with value: 0.09244881852742834.
2026-05-18 11:48:57,011 - optuna.study._optimize - INFO - Trial 239 pruned. 
2026-05-18 11:49:11,503 - optuna.study._optimize - INFO - Trial 240 pruned. 
2026-05-18 11:49:26,617 - optuna.study._optimize - INFO - Trial 241 pruned. 
2026-05-18 11:49:42,149 - optuna.study._optimize - INFO - Trial 242 pruned. 
2026-05-18 11:50:00,132 - optuna.study._optimize - INFO - Trial 243 pruned. 
2026-05-18 11:50:14,830 - optuna.study._optimize - INFO - Trial 244 pruned. 
2026-05-18 11:50:28,297 - experiment_functions - INFO - Early stopping at epoch 900. Best Recall: 0.0839
2026-05-18 11:50:28,387 - optuna.study.study - INFO - Trial 245 finished with value: 0.08394339393119601 and parameters: {'n_layers': 1, 'embedding_dim': 64, 'lr': 0.0007925531874468004, 'lambda_val': 0.0005230802577641327, 'batch_size': 619, 'optimizer': 'RMSprop'}. Best is trial 190 with value: 0.09244881852742834.
2026-05-18 11:50:46,316 - optuna.study._optimize - INFO - Trial 246 pruned. 
2026-05-18 11:51:01,148 - optuna.study._optimize - INFO - Trial 247 pruned. 
2026-05-18 11:51:21,816 - experiment_functions - INFO - Early stopping at epoch 1400. Best Recall: 0.0875
2026-05-18 11:51:21,948 - optuna.study.study - INFO - Trial 248 finished with value: 0.08745175620341748 and parameters: {'n_layers': 1, 'embedding_dim': 64, 'lr': 0.0005970185432275327, 'lambda_val': 0.0008391469498770584, 'batch_size': 665, 'optimizer': 'RMSprop'}. Best is trial 190 with value: 0.09244881852742834.
2026-05-18 11:51:36,798 - optuna.study._optimize - INFO - Trial 249 pruned. 
2026-05-18 11:51:54,272 - optuna.study._optimize - INFO - Trial 250 pruned. 
2026-05-18 11:52:16,960 - experiment_functions - INFO - Early stopping at epoch 1150. Best Recall: 0.0861
2026-05-18 11:52:17,734 - optuna.study.study - INFO - Trial 251 finished with value: 0.08609489131726626 and parameters: {'n_layers': 1, 'embedding_dim': 64, 'lr': 0.0006951480540444286, 'lambda_val': 0.0003000770259249093, 'batch_size': 584, 'optimizer': 'RMSprop'}. Best is trial 190 with value: 0.09244881852742834.
2026-05-18 11:52:36,076 - optuna.study._optimize - INFO - Trial 252 pruned. 
2026-05-18 11:52:47,314 - experiment_functions - INFO - Early stopping at epoch 650. Best Recall: 0.0488
2026-05-18 11:52:47,436 - optuna.study.study - INFO - Trial 253 finished with value: 0.04880872378866006 and parameters: {'n_layers': 3, 'embedding_dim': 64, 'lr': 0.000819272575751929, 'lambda_val': 0.0007190398248170108, 'batch_size': 685, 'optimizer': 'RMSprop'}. Best is trial 190 with value: 0.09244881852742834.
2026-05-18 11:53:02,489 - optuna.study._optimize - INFO - Trial 254 pruned. 
2026-05-18 11:53:34,997 - experiment_functions - INFO - Early stopping at epoch 2200. Best Recall: 0.0945
2026-05-18 11:53:35,165 - optuna.study.study - INFO - Trial 255 finished with value: 0.09452521629467195 and parameters: {'n_layers': 1, 'embedding_dim': 64, 'lr': 0.0005272161028497826, 'lambda_val': 0.00031960510288797065, 'batch_size': 639, 'optimizer': 'RMSprop'}. Best is trial 255 with value: 0.09452521629467195.
2026-05-18 11:53:54,624 - optuna.study._optimize - INFO - Trial 256 pruned. 
2026-05-18 11:54:09,139 - optuna.study._optimize - INFO - Trial 257 pruned. 
2026-05-18 11:54:24,201 - optuna.study._optimize - INFO - Trial 258 pruned. 
2026-05-18 11:54:38,979 - experiment_functions - INFO - Early stopping at epoch 850. Best Recall: 0.0520
2026-05-18 11:54:39,081 - optuna.study.study - INFO - Trial 259 finished with value: 0.05197817753272721 and parameters: {'n_layers': 4, 'embedding_dim': 64, 'lr': 0.000574764233725786, 'lambda_val': 0.0009881595496474302, 'batch_size': 647, 'optimizer': 'RMSprop'}. Best is trial 255 with value: 0.09452521629467195.
2026-05-18 11:54:56,651 - optuna.study._optimize - INFO - Trial 260 pruned. 
2026-05-18 11:55:12,195 - experiment_functions - INFO - Early stopping at epoch 1000. Best Recall: 0.0816
2026-05-18 11:55:12,968 - optuna.study.study - INFO - Trial 261 finished with value: 0.08155325912752072 and parameters: {'n_layers': 1, 'embedding_dim': 64, 'lr': 0.0006679931202956464, 'lambda_val': 0.00024416674342304934, 'batch_size': 710, 'optimizer': 'RMSprop'}. Best is trial 255 with value: 0.09452521629467195.
2026-05-18 11:55:36,833 - optuna.study._optimize - INFO - Trial 262 pruned. 
2026-05-18 11:55:44,269 - experiment_functions - INFO - Early stopping at epoch 500. Best Recall: 0.0054
2026-05-18 11:55:44,361 - optuna.study.study - INFO - Trial 263 finished with value: 0.005385514191715091 and parameters: {'n_layers': 1, 'embedding_dim': 64, 'lr': 0.0005592082259104873, 'lambda_val': 0.00011012255281783315, 'batch_size': 761, 'optimizer': 'SGD'}. Best is trial 255 with value: 0.09452521629467195.
2026-05-18 11:56:02,100 - optuna.study._optimize - INFO - Trial 264 pruned. 
2026-05-18 11:56:16,612 - optuna.study._optimize - INFO - Trial 265 pruned. 
2026-05-18 11:56:32,355 - optuna.study._optimize - INFO - Trial 266 pruned. 
2026-05-18 11:56:50,335 - optuna.study._optimize - INFO - Trial 267 pruned. 
2026-05-18 11:57:05,173 - experiment_functions - INFO - Early stopping at epoch 950. Best Recall: 0.0836
2026-05-18 11:57:05,263 - optuna.study.study - INFO - Trial 268 finished with value: 0.0835981349236755 and parameters: {'n_layers': 1, 'embedding_dim': 64, 'lr': 0.0008122786343239681, 'lambda_val': 0.0002940904898720462, 'batch_size': 695, 'optimizer': 'RMSprop'}. Best is trial 255 with value: 0.09452521629467195.
2026-05-18 11:57:23,884 - optuna.study._optimize - INFO - Trial 269 pruned. 
2026-05-18 11:58:18,448 - experiment_functions - INFO - Early stopping at epoch 3750. Best Recall: 0.0921
2026-05-18 11:58:18,546 - optuna.study.study - INFO - Trial 270 finished with value: 0.09207361564951486 and parameters: {'n_layers': 1, 'embedding_dim': 64, 'lr': 0.000441985557301023, 'lambda_val': 0.0006683897631688472, 'batch_size': 573, 'optimizer': 'RMSprop'}. Best is trial 255 with value: 0.09452521629467195.
2026-05-18 11:58:57,852 - experiment_functions - INFO - Early stopping at epoch 2700. Best Recall: 0.0912
2026-05-18 11:58:57,941 - optuna.study.study - INFO - Trial 271 finished with value: 0.0912392417073163 and parameters: {'n_layers': 1, 'embedding_dim': 64, 'lr': 0.0004570649148342878, 'lambda_val': 0.0011687239969668374, 'batch_size': 568, 'optimizer': 'RMSprop'}. Best is trial 255 with value: 0.09452521629467195.
2026-05-18 11:59:12,220 - optuna.study._optimize - INFO - Trial 272 pruned. 
2026-05-18 11:59:26,897 - optuna.study._optimize - INFO - Trial 273 pruned. 
2026-05-18 11:59:41,904 - optuna.study._optimize - INFO - Trial 274 pruned. 
2026-05-18 11:59:56,603 - optuna.study._optimize - INFO - Trial 275 pruned. 
2026-05-18 12:00:10,758 - optuna.study._optimize - INFO - Trial 276 pruned. 
2026-05-18 12:00:25,826 - optuna.study._optimize - INFO - Trial 277 pruned. 
2026-05-18 12:00:47,980 - experiment_functions - INFO - Early stopping at epoch 1500. Best Recall: 0.0901
2026-05-18 12:00:48,070 - optuna.study.study - INFO - Trial 278 finished with value: 0.09007455548089566 and parameters: {'n_layers': 1, 'embedding_dim': 64, 'lr': 0.0005677134306350562, 'lambda_val': 0.002114811833466427, 'batch_size': 768, 'optimizer': 'RMSprop'}. Best is trial 255 with value: 0.09452521629467195.
2026-05-18 12:01:03,174 - optuna.study._optimize - INFO - Trial 279 pruned. 
2026-05-18 12:01:17,853 - optuna.study._optimize - INFO - Trial 280 pruned. 
2026-05-18 12:01:39,234 - optuna.study._optimize - INFO - Trial 281 pruned. 
2026-05-18 12:02:05,859 - optuna.study._optimize - INFO - Trial 282 pruned. 
2026-05-18 12:02:20,194 - optuna.study._optimize - INFO - Trial 283 pruned. 
2026-05-18 12:02:35,176 - optuna.study._optimize - INFO - Trial 284 pruned. 
2026-05-18 12:03:19,249 - experiment_functions - INFO - Early stopping at epoch 3050. Best Recall: 0.0900
2026-05-18 12:03:19,337 - optuna.study.study - INFO - Trial 285 finished with value: 0.08996016081624887 and parameters: {'n_layers': 1, 'embedding_dim': 64, 'lr': 0.0004244195358438838, 'lambda_val': 0.0004123495481729218, 'batch_size': 808, 'optimizer': 'RMSprop'}. Best is trial 255 with value: 0.09452521629467195.
2026-05-18 12:03:26,994 - experiment_functions - INFO - Early stopping at epoch 500. Best Recall: 0.0056
2026-05-18 12:03:27,084 - optuna.study.study - INFO - Trial 286 finished with value: 0.00555345428901921 and parameters: {'n_layers': 1, 'embedding_dim': 64, 'lr': 0.00042419640259683375, 'lambda_val': 0.0002728768777437182, 'batch_size': 789, 'optimizer': 'SGD'}. Best is trial 255 with value: 0.09452521629467195.
2026-05-18 12:03:41,012 - optuna.study._optimize - INFO - Trial 287 pruned. 
2026-05-18 12:03:55,875 - optuna.study._optimize - INFO - Trial 288 pruned. 
2026-05-18 12:04:13,393 - optuna.study._optimize - INFO - Trial 289 pruned. 
2026-05-18 12:04:28,349 - experiment_functions - INFO - Early stopping at epoch 1000. Best Recall: 0.0872
2026-05-18 12:04:28,440 - optuna.study.study - INFO - Trial 290 finished with value: 0.08719743590437688 and parameters: {'n_layers': 1, 'embedding_dim': 64, 'lr': 0.0007214744402575478, 'lambda_val': 0.00023425560238251377, 'batch_size': 762, 'optimizer': 'RMSprop'}. Best is trial 255 with value: 0.09452521629467195.
2026-05-18 12:05:00,636 - optuna.study._optimize - INFO - Trial 291 pruned. 
2026-05-18 12:05:20,228 - experiment_functions - INFO - Early stopping at epoch 1300. Best Recall: 0.0873
2026-05-18 12:05:20,337 - optuna.study.study - INFO - Trial 292 finished with value: 0.08730462485496908 and parameters: {'n_layers': 1, 'embedding_dim': 64, 'lr': 0.0006227233239695117, 'lambda_val': 0.0016426650053256967, 'batch_size': 520, 'optimizer': 'RMSprop'}. Best is trial 255 with value: 0.09452521629467195.
2026-05-18 12:05:52,957 - experiment_functions - INFO - Early stopping at epoch 2200. Best Recall: 0.0905
2026-05-18 12:05:53,047 - optuna.study.study - INFO - Trial 293 finished with value: 0.09047069173294367 and parameters: {'n_layers': 1, 'embedding_dim': 64, 'lr': 0.0004987122663126989, 'lambda_val': 0.0006656573494984262, 'batch_size': 645, 'optimizer': 'RMSprop'}. Best is trial 255 with value: 0.09452521629467195.
2026-05-18 12:06:07,568 - optuna.study._optimize - INFO - Trial 294 pruned. 
2026-05-18 12:06:39,987 - experiment_functions - INFO - Early stopping at epoch 2200. Best Recall: 0.0895
2026-05-18 12:06:40,271 - optuna.study.study - INFO - Trial 295 finished with value: 0.08948144537643193 and parameters: {'n_layers': 1, 'embedding_dim': 64, 'lr': 0.0004654841733481189, 'lambda_val': 0.0007122548485292935, 'batch_size': 631, 'optimizer': 'RMSprop'}. Best is trial 255 with value: 0.09452521629467195.
2026-05-18 12:06:55,367 - optuna.study._optimize - INFO - Trial 296 pruned. 
2026-05-18 12:07:10,012 - optuna.study._optimize - INFO - Trial 297 pruned. 
2026-05-18 12:07:27,161 - optuna.study._optimize - INFO - Trial 298 pruned. 
2026-05-18 12:07:41,568 - experiment_functions - INFO - Early stopping at epoch 950. Best Recall: 0.0857
