2026-05-18 01:09:25,796 - optuna.study._optimize - INFO - Trial 80 pruned. 
2026-05-18 01:10:11,099 - experiment_functions - INFO - Early stopping at epoch 3350. Best Recall: 0.0686
2026-05-18 01:10:11,268 - optuna.study.study - INFO - Trial 81 finished with value: 0.06859114671589611 and parameters: {'n_layers': 1, 'embedding_dim': 64, 'lr': 0.000446730634281659, 'lambda_val': 1.6941039191536107e-05, 'batch_size': 1577, 'optimizer': 'RMSprop'}. Best is trial 78 with value: 0.07075337190743955.
2026-05-18 01:10:26,110 - optuna.study._optimize - INFO - Trial 82 pruned. 
2026-05-18 01:10:43,446 - experiment_functions - INFO - Early stopping at epoch 550. Best Recall: 0.0224
2026-05-18 01:10:43,546 - optuna.study.study - INFO - Trial 83 finished with value: 0.022372308029873826 and parameters: {'n_layers': 3, 'embedding_dim': 64, 'lr': 0.0015711504292949838, 'lambda_val': 1.411655251963683e-05, 'batch_size': 1181, 'optimizer': 'RMSprop'}. Best is trial 78 with value: 0.07075337190743955.
2026-05-18 01:11:03,711 - experiment_functions - INFO - Early stopping at epoch 1350. Best Recall: 0.0693
2026-05-18 01:11:03,811 - optuna.study.study - INFO - Trial 84 finished with value: 0.06932778465642007 and parameters: {'n_layers': 1, 'embedding_dim': 64, 'lr': 0.0008975273235528386, 'lambda_val': 2.6249073666521348e-05, 'batch_size': 802, 'optimizer': 'RMSprop'}. Best is trial 78 with value: 0.07075337190743955.
2026-05-18 01:11:11,267 - experiment_functions - INFO - Early stopping at epoch 500. Best Recall: 0.0057
2026-05-18 01:11:11,387 - optuna.study.study - INFO - Trial 85 finished with value: 0.005671450363359555 and parameters: {'n_layers': 1, 'embedding_dim': 64, 'lr': 0.0009011326424578389, 'lambda_val': 1.849766991120014e-05, 'batch_size': 859, 'optimizer': 'SGD'}. Best is trial 78 with value: 0.07075337190743955.
2026-05-18 01:11:25,783 - experiment_functions - INFO - Early stopping at epoch 950. Best Recall: 0.0592
2026-05-18 01:11:25,862 - optuna.study.study - INFO - Trial 86 finished with value: 0.05922465369870159 and parameters: {'n_layers': 1, 'embedding_dim': 64, 'lr': 0.0011858896372048257, 'lambda_val': 3.065114583778607e-05, 'batch_size': 592, 'optimizer': 'RMSprop'}. Best is trial 78 with value: 0.07075337190743955.
2026-05-18 01:11:45,656 - experiment_functions - INFO - Early stopping at epoch 1350. Best Recall: 0.0665
2026-05-18 01:11:45,755 - optuna.study.study - INFO - Trial 87 finished with value: 0.06647264926126567 and parameters: {'n_layers': 1, 'embedding_dim': 64, 'lr': 0.0008410669750888114, 'lambda_val': 5.833188985999913e-05, 'batch_size': 780, 'optimizer': 'RMSprop'}. Best is trial 78 with value: 0.07075337190743955.
2026-05-18 01:11:54,318 - experiment_functions - INFO - Early stopping at epoch 550. Best Recall: 0.0422
2026-05-18 01:11:54,417 - optuna.study.study - INFO - Trial 88 finished with value: 0.042154179209399664 and parameters: {'n_layers': 1, 'embedding_dim': 64, 'lr': 0.003522232729764026, 'lambda_val': 5.836544256608131e-05, 'batch_size': 796, 'optimizer': 'RMSprop'}. Best is trial 78 with value: 0.07075337190743955.
2026-05-18 01:12:04,657 - experiment_functions - INFO - Early stopping at epoch 650. Best Recall: 0.0543
2026-05-18 01:12:04,756 - optuna.study.study - INFO - Trial 89 finished with value: 0.054289713696756725 and parameters: {'n_layers': 1, 'embedding_dim': 64, 'lr': 0.001743066717142948, 'lambda_val': 8.12712555664835e-05, 'batch_size': 941, 'optimizer': 'RMSprop'}. Best is trial 78 with value: 0.07075337190743955.
2026-05-18 01:12:14,004 - experiment_functions - INFO - Early stopping at epoch 550. Best Recall: 0.0220
2026-05-18 01:12:14,124 - optuna.study.study - INFO - Trial 90 finished with value: 0.02195964315389378 and parameters: {'n_layers': 2, 'embedding_dim': 64, 'lr': 0.002509607963090681, 'lambda_val': 2.4819904688175723e-05, 'batch_size': 694, 'optimizer': 'RMSprop'}. Best is trial 78 with value: 0.07075337190743955.
2026-05-18 01:12:30,077 - experiment_functions - INFO - Early stopping at epoch 1100. Best Recall: 0.0601
2026-05-18 01:12:30,178 - optuna.study.study - INFO - Trial 91 finished with value: 0.06009172348408084 and parameters: {'n_layers': 1, 'embedding_dim': 64, 'lr': 0.0008317684663297533, 'lambda_val': 1.5838621907522784e-05, 'batch_size': 1501, 'optimizer': 'RMSprop'}. Best is trial 78 with value: 0.07075337190743955.
2026-05-18 01:12:44,238 - optuna.study._optimize - INFO - Trial 92 pruned. 
2026-05-18 01:12:58,021 - experiment_functions - INFO - Early stopping at epoch 900. Best Recall: 0.0619
2026-05-18 01:12:58,120 - optuna.study.study - INFO - Trial 93 finished with value: 0.06186445264268073 and parameters: {'n_layers': 1, 'embedding_dim': 64, 'lr': 0.0010047780433755894, 'lambda_val': 1.1049935817536293e-05, 'batch_size': 1386, 'optimizer': 'RMSprop'}. Best is trial 78 with value: 0.07075337190743955.
2026-05-18 01:13:12,136 - optuna.study._optimize - INFO - Trial 94 pruned. 
2026-05-18 01:13:37,468 - experiment_functions - INFO - Early stopping at epoch 1750. Best Recall: 0.0635
2026-05-18 01:13:37,557 - optuna.study.study - INFO - Trial 95 finished with value: 0.06346384724330724 and parameters: {'n_layers': 1, 'embedding_dim': 96, 'lr': 0.0005294127844498391, 'lambda_val': 2.657361769434811e-05, 'batch_size': 1316, 'optimizer': 'RMSprop'}. Best is trial 78 with value: 0.07075337190743955.
2026-05-18 01:13:44,952 - experiment_functions - INFO - Early stopping at epoch 500. Best Recall: 0.0059
2026-05-18 01:13:45,050 - optuna.study.study - INFO - Trial 96 finished with value: 0.005914132626287652 and parameters: {'n_layers': 1, 'embedding_dim': 96, 'lr': 0.00033255680366395924, 'lambda_val': 2.5332904600420935e-05, 'batch_size': 1248, 'optimizer': 'SGD'}. Best is trial 78 with value: 0.07075337190743955.
2026-05-18 01:14:03,636 - experiment_functions - INFO - Early stopping at epoch 1250. Best Recall: 0.0610
2026-05-18 01:14:03,736 - optuna.study.study - INFO - Trial 97 finished with value: 0.06103364047653719 and parameters: {'n_layers': 1, 'embedding_dim': 96, 'lr': 0.0007291516086211314, 'lambda_val': 2.5686926532172724e-06, 'batch_size': 958, 'optimizer': 'RMSprop'}. Best is trial 78 with value: 0.07075337190743955.
2026-05-18 01:14:17,822 - optuna.study._optimize - INFO - Trial 98 pruned. 
2026-05-18 01:14:28,463 - experiment_functions - INFO - Early stopping at epoch 700. Best Recall: 0.0554
2026-05-18 01:14:28,564 - optuna.study.study - INFO - Trial 99 finished with value: 0.05535483545997544 and parameters: {'n_layers': 1, 'embedding_dim': 128, 'lr': 0.0012074678382366943, 'lambda_val': 1.7552052742642994e-05, 'batch_size': 1370, 'optimizer': 'RMSprop'}. Best is trial 78 with value: 0.07075337190743955.
2026-05-18 01:15:02,453 - experiment_functions - INFO - Early stopping at epoch 2400. Best Recall: 0.0678
2026-05-18 01:15:02,543 - optuna.study.study - INFO - Trial 100 finished with value: 0.06776817181001182 and parameters: {'n_layers': 1, 'embedding_dim': 64, 'lr': 0.0005596866351397101, 'lambda_val': 4.00004329156899e-06, 'batch_size': 1058, 'optimizer': 'RMSprop'}. Best is trial 78 with value: 0.07075337190743955.
2026-05-18 01:15:33,921 - experiment_functions - INFO - Early stopping at epoch 2250. Best Recall: 0.0710
2026-05-18 01:15:34,056 - optuna.study.study - INFO - Trial 101 finished with value: 0.07096849058773737 and parameters: {'n_layers': 1, 'embedding_dim': 64, 'lr': 0.0005807127166402362, 'lambda_val': 4.315834716892634e-06, 'batch_size': 1073, 'optimizer': 'RMSprop'}. Best is trial 101 with value: 0.07096849058773737.
2026-05-18 01:15:48,638 - optuna.study._optimize - INFO - Trial 102 pruned. 
2026-05-18 01:16:27,448 - experiment_functions - INFO - Early stopping at epoch 2750. Best Recall: 0.0671
2026-05-18 01:16:27,538 - optuna.study.study - INFO - Trial 103 finished with value: 0.06706325316367998 and parameters: {'n_layers': 1, 'embedding_dim': 64, 'lr': 0.0006203758081077124, 'lambda_val': 6.853331950882783e-06, 'batch_size': 755, 'optimizer': 'RMSprop'}. Best is trial 101 with value: 0.07096849058773737.
2026-05-18 01:17:15,551 - experiment_functions - INFO - Early stopping at epoch 3250. Best Recall: 0.0663
2026-05-18 01:17:15,652 - optuna.study.study - INFO - Trial 104 finished with value: 0.06632920740360174 and parameters: {'n_layers': 1, 'embedding_dim': 64, 'lr': 0.0006163411069274416, 'lambda_val': 6.625028953423959e-06, 'batch_size': 720, 'optimizer': 'RMSprop'}. Best is trial 101 with value: 0.07096849058773737.
2026-05-18 01:17:34,513 - experiment_functions - INFO - Early stopping at epoch 1250. Best Recall: 0.0657
2026-05-18 01:17:34,648 - optuna.study.study - INFO - Trial 105 finished with value: 0.06571971140808587 and parameters: {'n_layers': 1, 'embedding_dim': 64, 'lr': 0.0008469512446292796, 'lambda_val': 6.76961949628082e-06, 'batch_size': 889, 'optimizer': 'RMSprop'}. Best is trial 101 with value: 0.07096849058773737.
2026-05-18 01:17:53,106 - experiment_functions - INFO - Early stopping at epoch 1250. Best Recall: 0.0639
2026-05-18 01:17:53,206 - optuna.study.study - INFO - Trial 106 finished with value: 0.06392112569286303 and parameters: {'n_layers': 1, 'embedding_dim': 64, 'lr': 0.0009153559880027496, 'lambda_val': 9.484632748586929e-06, 'batch_size': 737, 'optimizer': 'RMSprop'}. Best is trial 101 with value: 0.07096849058773737.
2026-05-18 01:18:34,250 - experiment_functions - INFO - Early stopping at epoch 2200. Best Recall: 0.0681
2026-05-18 01:18:34,404 - optuna.study.study - INFO - Trial 107 finished with value: 0.06812029349245458 and parameters: {'n_layers': 1, 'embedding_dim': 64, 'lr': 0.000744203217628891, 'lambda_val': 6.519027255298366e-06, 'batch_size': 523, 'optimizer': 'RMSprop'}. Best is trial 101 with value: 0.07096849058773737.
2026-05-18 01:18:49,174 - optuna.study._optimize - INFO - Trial 108 pruned. 
2026-05-18 01:19:03,091 - optuna.study._optimize - INFO - Trial 109 pruned. 
2026-05-18 01:19:09,829 - experiment_functions - INFO - Early stopping at epoch 500. Best Recall: 0.0047
2026-05-18 01:19:09,928 - optuna.study.study - INFO - Trial 110 finished with value: 0.004728267850820709 and parameters: {'n_layers': 1, 'embedding_dim': 64, 'lr': 0.00024245103809097729, 'lambda_val': 1.3194770829242563e-05, 'batch_size': 782, 'optimizer': 'SGD'}. Best is trial 101 with value: 0.07096849058773737.
2026-05-18 01:19:32,192 - experiment_functions - INFO - Early stopping at epoch 1650. Best Recall: 0.0679
2026-05-18 01:19:32,291 - optuna.study.study - INFO - Trial 111 finished with value: 0.06789155181341339 and parameters: {'n_layers': 1, 'embedding_dim': 64, 'lr': 0.0006945619494768504, 'lambda_val': 6.973939174825196e-06, 'batch_size': 844, 'optimizer': 'RMSprop'}. Best is trial 101 with value: 0.07096849058773737.
2026-05-18 01:19:53,035 - experiment_functions - INFO - Early stopping at epoch 1500. Best Recall: 0.0679
2026-05-18 01:19:53,125 - optuna.study.study - INFO - Trial 112 finished with value: 0.06790552901599167 and parameters: {'n_layers': 1, 'embedding_dim': 64, 'lr': 0.0006902117651769277, 'lambda_val': 3.5020791172407944e-06, 'batch_size': 1076, 'optimizer': 'RMSprop'}. Best is trial 101 with value: 0.07096849058773737.
2026-05-18 01:20:11,763 - optuna.study._optimize - INFO - Trial 113 pruned. 
2026-05-18 01:20:26,353 - optuna.study._optimize - INFO - Trial 114 pruned. 
2026-05-18 01:20:37,273 - experiment_functions - INFO - Early stopping at epoch 700. Best Recall: 0.0585
2026-05-18 01:20:37,394 - optuna.study.study - INFO - Trial 115 finished with value: 0.058463121570825095 and parameters: {'n_layers': 1, 'embedding_dim': 64, 'lr': 0.0014065631489046555, 'lambda_val': 1.994985216817334e-06, 'batch_size': 1082, 'optimizer': 'RMSprop'}. Best is trial 101 with value: 0.07096849058773737.
2026-05-18 01:20:51,547 - optuna.study._optimize - INFO - Trial 116 pruned. 
2026-05-18 01:21:05,553 - optuna.study._optimize - INFO - Trial 117 pruned. 
2026-05-18 01:21:15,926 - experiment_functions - INFO - Early stopping at epoch 650. Best Recall: 0.0350
2026-05-18 01:21:16,015 - optuna.study.study - INFO - Trial 118 finished with value: 0.03503961017558918 and parameters: {'n_layers': 4, 'embedding_dim': 64, 'lr': 0.0007217221234425238, 'lambda_val': 1.1579439970944197e-05, 'batch_size': 805, 'optimizer': 'RMSprop'}. Best is trial 101 with value: 0.07096849058773737.
2026-05-18 01:21:31,311 - experiment_functions - INFO - Early stopping at epoch 1050. Best Recall: 0.0604
2026-05-18 01:21:31,422 - optuna.study.study - INFO - Trial 119 finished with value: 0.060419945185402724 and parameters: {'n_layers': 1, 'embedding_dim': 64, 'lr': 0.0009295486653176077, 'lambda_val': 4.532752723673619e-06, 'batch_size': 1205, 'optimizer': 'RMSprop'}. Best is trial 101 with value: 0.07096849058773737.
2026-05-18 01:21:45,903 - optuna.study._optimize - INFO - Trial 120 pruned. 
2026-05-18 01:22:34,336 - experiment_functions - INFO - Early stopping at epoch 3500. Best Recall: 0.0706
2026-05-18 01:22:34,404 - optuna.study.study - INFO - Trial 121 finished with value: 0.07061706651547908 and parameters: {'n_layers': 1, 'embedding_dim': 64, 'lr': 0.0005975711774720943, 'lambda_val': 7.656545310527852e-06, 'batch_size': 737, 'optimizer': 'RMSprop'}. Best is trial 101 with value: 0.07096849058773737.
2026-05-18 01:22:48,239 - optuna.study._optimize - INFO - Trial 122 pruned. 
2026-05-18 01:23:02,366 - optuna.study._optimize - INFO - Trial 123 pruned. 
2026-05-18 01:23:16,136 - experiment_functions - INFO - Early stopping at epoch 900. Best Recall: 0.0600
2026-05-18 01:23:16,228 - optuna.study.study - INFO - Trial 124 finished with value: 0.059982714604679764 and parameters: {'n_layers': 1, 'embedding_dim': 64, 'lr': 0.0010821886858505129, 'lambda_val': 3.7451229293309684e-06, 'batch_size': 1042, 'optimizer': 'RMSprop'}. Best is trial 101 with value: 0.07096849058773737.
2026-05-18 01:23:41,445 - experiment_functions - INFO - Early stopping at epoch 1750. Best Recall: 0.0677
2026-05-18 01:23:41,544 - optuna.study.study - INFO - Trial 125 finished with value: 0.067714200763573 and parameters: {'n_layers': 1, 'embedding_dim': 64, 'lr': 0.0006525508488268832, 'lambda_val': 9.26224529954027e-06, 'batch_size': 766, 'optimizer': 'RMSprop'}. Best is trial 101 with value: 0.07096849058773737.
2026-05-18 01:24:18,860 - experiment_functions - INFO - Early stopping at epoch 2600. Best Recall: 0.0722
2026-05-18 01:24:18,951 - optuna.study.study - INFO - Trial 126 finished with value: 0.07223509478301464 and parameters: {'n_layers': 1, 'embedding_dim': 64, 'lr': 0.0006550796123829119, 'lambda_val': 9.169300555733362e-06, 'batch_size': 596, 'optimizer': 'RMSprop'}. Best is trial 126 with value: 0.07223509478301464.
2026-05-18 01:24:52,890 - experiment_functions - INFO - Early stopping at epoch 2450. Best Recall: 0.0677
2026-05-18 01:24:52,988 - optuna.study.study - INFO - Trial 127 finished with value: 0.06765772624103557 and parameters: {'n_layers': 1, 'embedding_dim': 64, 'lr': 0.000692556239954182, 'lambda_val': 9.164479131622138e-06, 'batch_size': 603, 'optimizer': 'RMSprop'}. Best is trial 126 with value: 0.07223509478301464.
2026-05-18 01:25:05,983 - experiment_functions - INFO - Early stopping at epoch 900. Best Recall: 0.0671
2026-05-18 01:25:06,080 - optuna.study.study - INFO - Trial 128 finished with value: 0.06707295034435427 and parameters: {'n_layers': 1, 'embedding_dim': 64, 'lr': 0.001298765757173414, 'lambda_val': 9.904983707270586e-06, 'batch_size': 599, 'optimizer': 'RMSprop'}. Best is trial 126 with value: 0.07223509478301464.
2026-05-18 01:25:29,560 - experiment_functions - INFO - Early stopping at epoch 1650. Best Recall: 0.0710
2026-05-18 01:25:29,660 - optuna.study.study - INFO - Trial 129 finished with value: 0.0710078173180302 and parameters: {'n_layers': 1, 'embedding_dim': 64, 'lr': 0.0007567283852962085, 'lambda_val': 2.0532218683946754e-05, 'batch_size': 680, 'optimizer': 'RMSprop'}. Best is trial 126 with value: 0.07223509478301464.
2026-05-18 01:25:44,225 - optuna.study._optimize - INFO - Trial 130 pruned. 
2026-05-18 01:26:17,281 - experiment_functions - INFO - Early stopping at epoch 2300. Best Recall: 0.0724
2026-05-18 01:26:17,376 - optuna.study.study - INFO - Trial 131 finished with value: 0.07240747462844048 and parameters: {'n_layers': 1, 'embedding_dim': 64, 'lr': 0.0007177663768808625, 'lambda_val': 1.344158102945705e-05, 'batch_size': 602, 'optimizer': 'RMSprop'}. Best is trial 131 with value: 0.07240747462844048.
2026-05-18 01:26:45,903 - experiment_functions - INFO - Early stopping at epoch 2050. Best Recall: 0.0687
2026-05-18 01:26:45,992 - optuna.study.study - INFO - Trial 132 finished with value: 0.06868209527355851 and parameters: {'n_layers': 1, 'embedding_dim': 64, 'lr': 0.0007832873305269612, 'lambda_val': 1.2226504559334605e-05, 'batch_size': 532, 'optimizer': 'RMSprop'}. Best is trial 131 with value: 0.07240747462844048.
2026-05-18 01:27:06,689 - experiment_functions - INFO - Early stopping at epoch 1400. Best Recall: 0.0670
2026-05-18 01:27:06,778 - optuna.study.study - INFO - Trial 133 finished with value: 0.06700095893634214 and parameters: {'n_layers': 1, 'embedding_dim': 64, 'lr': 0.0009648939829534195, 'lambda_val': 1.3118568168685872e-05, 'batch_size': 542, 'optimizer': 'RMSprop'}. Best is trial 131 with value: 0.07240747462844048.
2026-05-18 01:27:34,166 - experiment_functions - INFO - Early stopping at epoch 1900. Best Recall: 0.0702
2026-05-18 01:27:34,265 - optuna.study.study - INFO - Trial 134 finished with value: 0.07017143446786361 and parameters: {'n_layers': 1, 'embedding_dim': 64, 'lr': 0.0007941742319372455, 'lambda_val': 2.172022407954664e-05, 'batch_size': 638, 'optimizer': 'RMSprop'}. Best is trial 131 with value: 0.07240747462844048.
2026-05-18 01:27:45,021 - experiment_functions - INFO - Early stopping at epoch 700. Best Recall: 0.0584
2026-05-18 01:27:45,110 - optuna.study.study - INFO - Trial 135 finished with value: 0.05842111110195573 and parameters: {'n_layers': 1, 'embedding_dim': 64, 'lr': 0.0016286707944973854, 'lambda_val': 3.1602452172623624e-05, 'batch_size': 659, 'optimizer': 'RMSprop'}. Best is trial 131 with value: 0.07240747462844048.
2026-05-18 01:28:06,173 - experiment_functions - INFO - Early stopping at epoch 1550. Best Recall: 0.0671
2026-05-18 01:28:06,271 - optuna.study.study - INFO - Trial 136 finished with value: 0.06707814378328514 and parameters: {'n_layers': 1, 'embedding_dim': 64, 'lr': 0.0007995667197397319, 'lambda_val': 2.2373133519732374e-05, 'batch_size': 606, 'optimizer': 'RMSprop'}. Best is trial 131 with value: 0.07240747462844048.
2026-05-18 01:28:19,891 - experiment_functions - INFO - Early stopping at epoch 950. Best Recall: 0.0625
2026-05-18 01:28:19,990 - optuna.study.study - INFO - Trial 137 finished with value: 0.06252117157061525 and parameters: {'n_layers': 1, 'embedding_dim': 128, 'lr': 0.0010372701897151985, 'lambda_val': 4.116579958339323e-05, 'batch_size': 541, 'optimizer': 'RMSprop'}. Best is trial 131 with value: 0.07240747462844048.
2026-05-18 01:28:27,190 - experiment_functions - INFO - Early stopping at epoch 500. Best Recall: 0.0044
2026-05-18 01:28:27,296 - optuna.study.study - INFO - Trial 138 finished with value: 0.004446652043672425 and parameters: {'n_layers': 1, 'embedding_dim': 64, 'lr': 0.0020080100439747667, 'lambda_val': 1.2009766837466063e-05, 'batch_size': 690, 'optimizer': 'SGD'}. Best is trial 131 with value: 0.07240747462844048.
2026-05-18 01:28:50,852 - experiment_functions - INFO - Early stopping at epoch 1750. Best Recall: 0.0717
2026-05-18 01:28:50,940 - optuna.study.study - INFO - Trial 139 finished with value: 0.07166058314728947 and parameters: {'n_layers': 1, 'embedding_dim': 64, 'lr': 0.000775486455796312, 'lambda_val': 1.7860977479862868e-05, 'batch_size': 519, 'optimizer': 'RMSprop'}. Best is trial 131 with value: 0.07240747462844048.
2026-05-18 01:29:02,037 - experiment_functions - INFO - Early stopping at epoch 800. Best Recall: 0.0606
2026-05-18 01:29:02,115 - optuna.study.study - INFO - Trial 140 finished with value: 0.0605723609269646 and parameters: {'n_layers': 1, 'embedding_dim': 64, 'lr': 0.0013285999532698354, 'lambda_val': 1.9554261581020112e-05, 'batch_size': 535, 'optimizer': 'RMSprop'}. Best is trial 131 with value: 0.07240747462844048.
2026-05-18 01:29:25,026 - experiment_functions - INFO - Early stopping at epoch 1750. Best Recall: 0.0688
2026-05-18 01:29:25,116 - optuna.study.study - INFO - Trial 141 finished with value: 0.06880322558208994 and parameters: {'n_layers': 1, 'embedding_dim': 64, 'lr': 0.0007841404581406969, 'lambda_val': 1.5786345422570417e-05, 'batch_size': 638, 'optimizer': 'RMSprop'}. Best is trial 131 with value: 0.07240747462844048.
2026-05-18 01:29:34,451 - experiment_functions - INFO - Early stopping at epoch 650. Best Recall: 0.0428
2026-05-18 01:29:34,548 - optuna.study.study - INFO - Trial 142 finished with value: 0.04280618662713204 and parameters: {'n_layers': 3, 'embedding_dim': 64, 'lr': 0.0008706304526341543, 'lambda_val': 1.5913050929174437e-05, 'batch_size': 649, 'optimizer': 'RMSprop'}. Best is trial 131 with value: 0.07240747462844048.
2026-05-18 01:29:47,410 - optuna.study._optimize - INFO - Trial 143 pruned. 
2026-05-18 01:30:00,538 - experiment_functions - INFO - Early stopping at epoch 950. Best Recall: 0.0646
2026-05-18 01:30:00,618 - optuna.study.study - INFO - Trial 144 finished with value: 0.06458127367117598 and parameters: {'n_layers': 1, 'embedding_dim': 64, 'lr': 0.0011596820951972487, 'lambda_val': 2.8726952347373863e-05, 'batch_size': 720, 'optimizer': 'RMSprop'}. Best is trial 131 with value: 0.07240747462844048.
2026-05-18 01:30:22,917 - experiment_functions - INFO - Early stopping at epoch 1650. Best Recall: 0.0714
