2026-05-17 22:58:26,739 - optuna.study._optimize - INFO - Trial 292 pruned. 
2026-05-17 22:58:58,029 - experiment_functions - INFO - Early stopping at epoch 2300. Best Recall: 0.0303
2026-05-17 22:58:58,221 - optuna.study.study - INFO - Trial 293 finished with value: 0.030291816474047033 and parameters: {'n_layers': 2, 'embedding_dim': 32, 'lr': 0.00032929588908261895, 'lambda_val': 3.5939229617902082e-06, 'batch_size': 1025, 'optimizer': 'RMSprop'}. Best is trial 277 with value: 0.03049967928078329.
2026-05-17 22:59:13,046 - optuna.study._optimize - INFO - Trial 294 pruned. 
2026-05-17 22:59:27,047 - optuna.study._optimize - INFO - Trial 295 pruned. 
2026-05-17 23:00:03,985 - experiment_functions - INFO - Early stopping at epoch 2900. Best Recall: 0.0305
2026-05-17 23:00:04,086 - optuna.study.study - INFO - Trial 296 finished with value: 0.03045388095166324 and parameters: {'n_layers': 2, 'embedding_dim': 32, 'lr': 0.00032694605817589595, 'lambda_val': 1.2589184312164931e-06, 'batch_size': 1077, 'optimizer': 'RMSprop'}. Best is trial 277 with value: 0.03049967928078329.
2026-05-17 23:00:17,400 - optuna.study._optimize - INFO - Trial 297 pruned. 
2026-05-17 23:00:30,863 - optuna.study._optimize - INFO - Trial 298 pruned. 
2026-05-17 23:00:45,288 - optuna.study._optimize - INFO - Trial 299 pruned. 
2026-05-17 23:01:27,748 - root - INFO -   ** Getting the trainable edges:
2026-05-17 23:01:27,765 - helper_functions - INFO -      Number of nodes: 4740
2026-05-17 23:01:27,765 - helper_functions - INFO -      Ratio: 0.4863533757438949
2026-05-17 23:01:27,765 - helper_functions - INFO -      Number of unique users: 3156
2026-05-17 23:01:27,765 - helper_functions - INFO -      Number of unique items: 1584
2026-05-17 23:01:27,765 - helper_functions - INFO -      Total dominant set edge: 234063
2026-05-17 23:01:27,765 - helper_functions - INFO -      Trainable edges: 187250.40000000002
2026-05-17 23:01:27,831 - root - INFO -   **** Getting 234063 dominant set edges
2026-05-17 23:01:28,008 - optuna.storages._rdb.storage - INFO - A new study created in RDB with name: Study_e_1M_1c1dcs
2026-05-17 23:02:13,597 - experiment_functions - INFO - Early stopping at epoch 2100. Best Recall: 0.0409
2026-05-17 23:02:14,290 - optuna.study.study - INFO - Trial 0 finished with value: 0.04093056405302998 and parameters: {'n_layers': 4, 'embedding_dim': 64, 'lr': 0.005046554151778016, 'lambda_val': 0.00026928677693488615, 'batch_size': 2744, 'optimizer': 'RMSprop'}. Best is trial 0 with value: 0.04093056405302998.
2026-05-17 23:02:23,220 - experiment_functions - INFO - Early stopping at epoch 500. Best Recall: 0.0046
2026-05-17 23:02:23,311 - optuna.study.study - INFO - Trial 1 finished with value: 0.004614143950823554 and parameters: {'n_layers': 4, 'embedding_dim': 96, 'lr': 5.943994610371633e-05, 'lambda_val': 0.014217737758049348, 'batch_size': 3380, 'optimizer': 'SGD'}. Best is trial 0 with value: 0.04093056405302998.
2026-05-17 23:02:59,539 - experiment_functions - INFO - Early stopping at epoch 1850. Best Recall: 0.0425
2026-05-17 23:02:59,645 - optuna.study.study - INFO - Trial 2 finished with value: 0.04249249854956803 and parameters: {'n_layers': 3, 'embedding_dim': 64, 'lr': 0.009968943227563672, 'lambda_val': 5.890869853508947e-06, 'batch_size': 1644, 'optimizer': 'RMSprop'}. Best is trial 2 with value: 0.04249249854956803.
2026-05-17 23:03:38,082 - experiment_functions - INFO - Early stopping at epoch 1300. Best Recall: 0.0329
2026-05-17 23:03:38,846 - optuna.study.study - INFO - Trial 3 finished with value: 0.032893355760312624 and parameters: {'n_layers': 3, 'embedding_dim': 32, 'lr': 0.025302001406918087, 'lambda_val': 1.932045251153726e-05, 'batch_size': 1678, 'optimizer': 'Adam'}. Best is trial 2 with value: 0.04249249854956803.
2026-05-17 23:03:49,431 - experiment_functions - INFO - Early stopping at epoch 500. Best Recall: 0.0049
2026-05-17 23:03:49,594 - optuna.study.study - INFO - Trial 4 finished with value: 0.004919163126425364 and parameters: {'n_layers': 3, 'embedding_dim': 128, 'lr': 5.5919696641403056e-05, 'lambda_val': 0.04519369754121641, 'batch_size': 2513, 'optimizer': 'SGD'}. Best is trial 2 with value: 0.04249249854956803.
2026-05-17 23:03:59,518 - experiment_functions - INFO - Early stopping at epoch 500. Best Recall: 0.0049
2026-05-17 23:03:59,599 - optuna.study.study - INFO - Trial 5 finished with value: 0.004913833011099512 and parameters: {'n_layers': 2, 'embedding_dim': 96, 'lr': 0.0012857360519516275, 'lambda_val': 9.25296114474858e-05, 'batch_size': 2692, 'optimizer': 'SGD'}. Best is trial 2 with value: 0.04249249854956803.
2026-05-17 23:04:17,692 - optuna.study._optimize - INFO - Trial 6 pruned. 
2026-05-17 23:04:36,792 - experiment_functions - INFO - Early stopping at epoch 500. Best Recall: 0.0054
2026-05-17 23:04:37,368 - optuna.study.study - INFO - Trial 7 finished with value: 0.005392760730207547 and parameters: {'n_layers': 2, 'embedding_dim': 96, 'lr': 0.000905358048832833, 'lambda_val': 1.949475688879723e-06, 'batch_size': 3077, 'optimizer': 'SGD'}. Best is trial 2 with value: 0.04249249854956803.
2026-05-17 23:04:52,033 - experiment_functions - INFO - Early stopping at epoch 500. Best Recall: 0.0049
2026-05-17 23:04:52,134 - optuna.study.study - INFO - Trial 8 finished with value: 0.0048643941792492675 and parameters: {'n_layers': 4, 'embedding_dim': 64, 'lr': 0.08098511840034574, 'lambda_val': 0.0002005033043322675, 'batch_size': 2707, 'optimizer': 'SGD'}. Best is trial 2 with value: 0.04249249854956803.
2026-05-17 23:05:12,557 - optuna.study._optimize - INFO - Trial 9 pruned. 
2026-05-17 23:05:24,171 - experiment_functions - INFO - Early stopping at epoch 550. Best Recall: 0.0580
2026-05-17 23:05:24,252 - optuna.study.study - INFO - Trial 10 finished with value: 0.058049797935762704 and parameters: {'n_layers': 1, 'embedding_dim': 256, 'lr': 0.01250079752002613, 'lambda_val': 1.3837230482667253e-06, 'batch_size': 782, 'optimizer': 'Adam'}. Best is trial 10 with value: 0.058049797935762704.
2026-05-17 23:05:35,082 - experiment_functions - INFO - Early stopping at epoch 700. Best Recall: 0.0419
2026-05-17 23:05:35,228 - optuna.study.study - INFO - Trial 11 finished with value: 0.041870023285315604 and parameters: {'n_layers': 1, 'embedding_dim': 256, 'lr': 0.014857322984847604, 'lambda_val': 1.3462901227681783e-06, 'batch_size': 710, 'optimizer': 'Adam'}. Best is trial 10 with value: 0.058049797935762704.
2026-05-17 23:05:43,580 - experiment_functions - INFO - Early stopping at epoch 550. Best Recall: 0.0242
2026-05-17 23:05:43,671 - optuna.study.study - INFO - Trial 12 finished with value: 0.024192531463311514 and parameters: {'n_layers': 1, 'embedding_dim': 256, 'lr': 0.04915722159190377, 'lambda_val': 1.07029543805821e-05, 'batch_size': 1377, 'optimizer': 'Adam'}. Best is trial 10 with value: 0.058049797935762704.
2026-05-17 23:06:55,296 - optuna.study.study - INFO - Trial 13 finished with value: 0.04694498065991117 and parameters: {'n_layers': 2, 'embedding_dim': 256, 'lr': 0.00875436806218359, 'lambda_val': 0.0016466683922963157, 'batch_size': 1265, 'optimizer': 'Adam'}. Best is trial 10 with value: 0.058049797935762704.
2026-05-17 23:07:06,173 - experiment_functions - INFO - Early stopping at epoch 700. Best Recall: 0.0741
2026-05-17 23:07:06,265 - optuna.study.study - INFO - Trial 14 finished with value: 0.07405528968257863 and parameters: {'n_layers': 1, 'embedding_dim': 256, 'lr': 0.0012701846924722715, 'lambda_val': 0.0028264581604731695, 'batch_size': 4041, 'optimizer': 'Adam'}. Best is trial 14 with value: 0.07405528968257863.
2026-05-17 23:07:17,430 - experiment_functions - INFO - Early stopping at epoch 750. Best Recall: 0.0058
2026-05-17 23:07:17,532 - optuna.study.study - INFO - Trial 15 finished with value: 0.005809902041685993 and parameters: {'n_layers': 1, 'embedding_dim': 256, 'lr': 1.0801334978649488e-05, 'lambda_val': 0.0023258853978927597, 'batch_size': 4035, 'optimizer': 'Adam'}. Best is trial 14 with value: 0.07405528968257863.
2026-05-17 23:07:27,999 - experiment_functions - INFO - Early stopping at epoch 650. Best Recall: 0.0679
2026-05-17 23:07:28,099 - optuna.study.study - INFO - Trial 16 finished with value: 0.06789986659569788 and parameters: {'n_layers': 1, 'embedding_dim': 256, 'lr': 0.0012332484300736162, 'lambda_val': 0.0026345107233442873, 'batch_size': 4037, 'optimizer': 'Adam'}. Best is trial 14 with value: 0.07405528968257863.
2026-05-17 23:07:39,001 - experiment_functions - INFO - Early stopping at epoch 650. Best Recall: 0.0465
2026-05-17 23:07:39,100 - optuna.study.study - INFO - Trial 17 finished with value: 0.0464667749599593 and parameters: {'n_layers': 2, 'embedding_dim': 128, 'lr': 0.0009471962641204606, 'lambda_val': 0.0014806475438894444, 'batch_size': 3986, 'optimizer': 'Adam'}. Best is trial 14 with value: 0.07405528968257863.
2026-05-17 23:07:48,935 - experiment_functions - INFO - Early stopping at epoch 600. Best Recall: 0.0696
2026-05-17 23:07:49,026 - optuna.study.study - INFO - Trial 18 finished with value: 0.06955278519664834 and parameters: {'n_layers': 1, 'embedding_dim': 256, 'lr': 0.0022500738525824274, 'lambda_val': 0.005440537991128912, 'batch_size': 3595, 'optimizer': 'Adam'}. Best is trial 14 with value: 0.07405528968257863.
2026-05-17 23:07:56,816 - experiment_functions - INFO - Early stopping at epoch 500. Best Recall: 0.0049
2026-05-17 23:07:56,952 - optuna.study.study - INFO - Trial 19 finished with value: 0.004909305360424944 and parameters: {'n_layers': 1, 'embedding_dim': 256, 'lr': 0.00026214756661379333, 'lambda_val': 0.08491814555766801, 'batch_size': 3510, 'optimizer': 'Adam'}. Best is trial 14 with value: 0.07405528968257863.
2026-05-17 23:08:06,476 - experiment_functions - INFO - Early stopping at epoch 550. Best Recall: 0.0499
2026-05-17 23:08:06,612 - optuna.study.study - INFO - Trial 20 finished with value: 0.04991430566291755 and parameters: {'n_layers': 2, 'embedding_dim': 256, 'lr': 0.0025713629388473213, 'lambda_val': 0.011155289083903421, 'batch_size': 3592, 'optimizer': 'Adam'}. Best is trial 14 with value: 0.07405528968257863.
2026-05-17 23:08:39,419 - experiment_functions - INFO - Early stopping at epoch 2250. Best Recall: 0.0645
2026-05-17 23:08:39,520 - optuna.study.study - INFO - Trial 21 finished with value: 0.06451990020036007 and parameters: {'n_layers': 1, 'embedding_dim': 256, 'lr': 0.00024801007268883505, 'lambda_val': 0.003861580214803537, 'batch_size': 3773, 'optimizer': 'Adam'}. Best is trial 14 with value: 0.07405528968257863.
2026-05-17 23:08:50,664 - experiment_functions - INFO - Early stopping at epoch 700. Best Recall: 0.0737
2026-05-17 23:08:50,765 - optuna.study.study - INFO - Trial 22 finished with value: 0.07373925600777699 and parameters: {'n_layers': 1, 'embedding_dim': 256, 'lr': 0.0016729022585181149, 'lambda_val': 0.0007243116424630001, 'batch_size': 3193, 'optimizer': 'Adam'}. Best is trial 14 with value: 0.07405528968257863.
2026-05-17 23:09:29,743 - experiment_functions - INFO - Early stopping at epoch 2650. Best Recall: 0.0723
2026-05-17 23:09:29,835 - optuna.study.study - INFO - Trial 23 finished with value: 0.0723435248446904 and parameters: {'n_layers': 1, 'embedding_dim': 256, 'lr': 0.0005031427343883603, 'lambda_val': 0.0004947930398576341, 'batch_size': 3133, 'optimizer': 'Adam'}. Best is trial 14 with value: 0.07405528968257863.
2026-05-17 23:09:43,951 - experiment_functions - INFO - Early stopping at epoch 950. Best Recall: 0.0471
2026-05-17 23:09:44,292 - optuna.study.study - INFO - Trial 24 finished with value: 0.04708755659386086 and parameters: {'n_layers': 2, 'embedding_dim': 32, 'lr': 0.00047767945923339584, 'lambda_val': 0.000601118182180114, 'batch_size': 3185, 'optimizer': 'Adam'}. Best is trial 14 with value: 0.07405528968257863.
2026-05-17 23:09:58,593 - optuna.study._optimize - INFO - Trial 25 pruned. 
2026-05-17 23:11:02,655 - optuna.study.study - INFO - Trial 26 finished with value: 0.07371685181688567 and parameters: {'n_layers': 1, 'embedding_dim': 128, 'lr': 0.00045994505760977656, 'lambda_val': 0.00013538938425207124, 'batch_size': 2277, 'optimizer': 'Adam'}. Best is trial 14 with value: 0.07405528968257863.
2026-05-17 23:11:17,323 - optuna.study._optimize - INFO - Trial 27 pruned. 
2026-05-17 23:11:49,625 - experiment_functions - INFO - Early stopping at epoch 2250. Best Recall: 0.0720
2026-05-17 23:11:49,774 - optuna.study.study - INFO - Trial 28 finished with value: 0.0720225497343727 and parameters: {'n_layers': 1, 'embedding_dim': 128, 'lr': 0.0005951216159137127, 'lambda_val': 5.065170064125061e-05, 'batch_size': 2355, 'optimizer': 'Adam'}. Best is trial 14 with value: 0.07405528968257863.
2026-05-17 23:12:04,670 - optuna.study._optimize - INFO - Trial 29 pruned. 
2026-05-17 23:12:13,422 - experiment_functions - INFO - Early stopping at epoch 550. Best Recall: 0.0599
2026-05-17 23:12:13,513 - optuna.study.study - INFO - Trial 30 finished with value: 0.059872381765435856 and parameters: {'n_layers': 1, 'embedding_dim': 64, 'lr': 0.0020417277771808233, 'lambda_val': 0.0010796819160158776, 'batch_size': 2857, 'optimizer': 'RMSprop'}. Best is trial 14 with value: 0.07405528968257863.
2026-05-17 23:12:27,346 - experiment_functions - INFO - Early stopping at epoch 950. Best Recall: 0.0698
2026-05-17 23:12:27,439 - optuna.study.study - INFO - Trial 31 finished with value: 0.06982431075431515 and parameters: {'n_layers': 1, 'embedding_dim': 128, 'lr': 0.0006190742241903758, 'lambda_val': 0.00041870719872350845, 'batch_size': 2221, 'optimizer': 'Adam'}. Best is trial 14 with value: 0.07405528968257863.
2026-05-17 23:13:00,021 - optuna.study._optimize - INFO - Trial 32 pruned. 
2026-05-17 23:13:15,156 - optuna.study._optimize - INFO - Trial 33 pruned. 
2026-05-17 23:13:35,482 - experiment_functions - INFO - Early stopping at epoch 1500. Best Recall: 0.0671
2026-05-17 23:13:35,584 - optuna.study.study - INFO - Trial 34 finished with value: 0.06709052638604825 and parameters: {'n_layers': 1, 'embedding_dim': 64, 'lr': 0.0004163669558579371, 'lambda_val': 0.006646590252356245, 'batch_size': 2447, 'optimizer': 'Adam'}. Best is trial 14 with value: 0.07405528968257863.
2026-05-17 23:13:46,116 - experiment_functions - INFO - Early stopping at epoch 700. Best Recall: 0.0586
2026-05-17 23:13:46,217 - optuna.study.study - INFO - Trial 35 finished with value: 0.058562649883745224 and parameters: {'n_layers': 1, 'embedding_dim': 32, 'lr': 0.0016970724225196477, 'lambda_val': 4.016568295999588e-05, 'batch_size': 3742, 'optimizer': 'Adam'}. Best is trial 14 with value: 0.07405528968257863.
2026-05-17 23:14:01,160 - experiment_functions - INFO - Early stopping at epoch 500. Best Recall: 0.0047
2026-05-17 23:14:01,925 - optuna.study.study - INFO - Trial 36 finished with value: 0.004692366386187348 and parameters: {'n_layers': 2, 'embedding_dim': 128, 'lr': 2.1334644688318215e-05, 'lambda_val': 0.00033624969020994, 'batch_size': 3271, 'optimizer': 'SGD'}. Best is trial 14 with value: 0.07405528968257863.
2026-05-17 23:14:25,783 - experiment_functions - INFO - Early stopping at epoch 1450. Best Recall: 0.0797
2026-05-17 23:14:25,896 - optuna.study.study - INFO - Trial 37 finished with value: 0.07967197157748351 and parameters: {'n_layers': 1, 'embedding_dim': 256, 'lr': 0.0033475687555076725, 'lambda_val': 6.712189708505942e-05, 'batch_size': 2581, 'optimizer': 'Adam'}. Best is trial 37 with value: 0.07967197157748351.
2026-05-17 23:14:41,940 - optuna.study._optimize - INFO - Trial 38 pruned. 
2026-05-17 23:14:49,229 - experiment_functions - INFO - Early stopping at epoch 500. Best Recall: 0.0049
2026-05-17 23:14:49,365 - optuna.study.study - INFO - Trial 39 finished with value: 0.004921754527764182 and parameters: {'n_layers': 2, 'embedding_dim': 32, 'lr': 0.006597100262004491, 'lambda_val': 4.793823173324536e-06, 'batch_size': 2583, 'optimizer': 'SGD'}. Best is trial 37 with value: 0.07967197157748351.
2026-05-17 23:15:00,300 - experiment_functions - INFO - Early stopping at epoch 650. Best Recall: 0.0398
2026-05-17 23:15:00,400 - optuna.study.study - INFO - Trial 40 finished with value: 0.03979633320885025 and parameters: {'n_layers': 3, 'embedding_dim': 128, 'lr': 0.0009414563758896608, 'lambda_val': 7.200414654498185e-05, 'batch_size': 2226, 'optimizer': 'Adam'}. Best is trial 37 with value: 0.07967197157748351.
2026-05-17 23:15:13,363 - experiment_functions - INFO - Early stopping at epoch 800. Best Recall: 0.0747
2026-05-17 23:15:13,466 - optuna.study.study - INFO - Trial 41 finished with value: 0.07473147132569556 and parameters: {'n_layers': 1, 'embedding_dim': 256, 'lr': 0.001475414121643107, 'lambda_val': 0.00017994422521402706, 'batch_size': 2849, 'optimizer': 'Adam'}. Best is trial 37 with value: 0.07967197157748351.
2026-05-17 23:16:02,462 - experiment_functions - INFO - Early stopping at epoch 3350. Best Recall: 0.0838
2026-05-17 23:16:02,557 - optuna.study.study - INFO - Trial 42 finished with value: 0.0837957435704636 and parameters: {'n_layers': 1, 'embedding_dim': 256, 'lr': 0.0015382178816428923, 'lambda_val': 0.00013657553158524089, 'batch_size': 2919, 'optimizer': 'Adam'}. Best is trial 42 with value: 0.0837957435704636.
2026-05-17 23:16:45,067 - experiment_functions - INFO - Early stopping at epoch 2850. Best Recall: 0.0817
2026-05-17 23:16:45,157 - optuna.study.study - INFO - Trial 43 finished with value: 0.08167506023377294 and parameters: {'n_layers': 1, 'embedding_dim': 256, 'lr': 0.0014614132952833318, 'lambda_val': 1.7066033460031023e-05, 'batch_size': 2932, 'optimizer': 'Adam'}. Best is trial 42 with value: 0.0837957435704636.
2026-05-17 23:16:56,537 - experiment_functions - INFO - Early stopping at epoch 500. Best Recall: 0.0054
2026-05-17 23:16:57,525 - optuna.study.study - INFO - Trial 44 finished with value: 0.005401969743252749 and parameters: {'n_layers': 1, 'embedding_dim': 256, 'lr': 0.020848685591680575, 'lambda_val': 2.3023720590070086e-05, 'batch_size': 2948, 'optimizer': 'SGD'}. Best is trial 42 with value: 0.0837957435704636.
2026-05-17 23:17:26,109 - experiment_functions - INFO - Early stopping at epoch 1500. Best Recall: 0.0824
2026-05-17 23:17:26,211 - optuna.study.study - INFO - Trial 45 finished with value: 0.08237851135697088 and parameters: {'n_layers': 1, 'embedding_dim': 256, 'lr': 0.0031338050447682043, 'lambda_val': 5.829367913774024e-06, 'batch_size': 2588, 'optimizer': 'Adam'}. Best is trial 42 with value: 0.0837957435704636.
2026-05-17 23:17:46,405 - optuna.study._optimize - INFO - Trial 46 pruned. 
2026-05-17 23:18:05,523 - experiment_functions - INFO - Early stopping at epoch 1250. Best Recall: 0.0730
2026-05-17 23:18:05,624 - optuna.study.study - INFO - Trial 47 finished with value: 0.07303990825475705 and parameters: {'n_layers': 1, 'embedding_dim': 256, 'lr': 0.0027162211246615432, 'lambda_val': 3.0795994138280793e-06, 'batch_size': 2593, 'optimizer': 'RMSprop'}. Best is trial 42 with value: 0.0837957435704636.
2026-05-17 23:18:15,559 - experiment_functions - INFO - Early stopping at epoch 550. Best Recall: 0.0663
2026-05-17 23:18:16,591 - optuna.study.study - INFO - Trial 48 finished with value: 0.06627197503303597 and parameters: {'n_layers': 1, 'embedding_dim': 96, 'lr': 0.006888285281057323, 'lambda_val': 1.0586120382391787e-05, 'batch_size': 2991, 'optimizer': 'Adam'}. Best is trial 42 with value: 0.0837957435704636.
2026-05-17 23:18:33,236 - experiment_functions - INFO - Early stopping at epoch 550. Best Recall: 0.0601
2026-05-17 23:18:33,371 - optuna.study.study - INFO - Trial 49 finished with value: 0.0600638853812094 and parameters: {'n_layers': 2, 'embedding_dim': 256, 'lr': 0.003427237011851443, 'lambda_val': 2.8780896683019e-05, 'batch_size': 2754, 'optimizer': 'Adam'}. Best is trial 42 with value: 0.0837957435704636.
2026-05-17 23:18:40,830 - experiment_functions - INFO - Early stopping at epoch 500. Best Recall: 0.0048
2026-05-17 23:18:40,931 - optuna.study.study - INFO - Trial 50 finished with value: 0.004777785787176925 and parameters: {'n_layers': 1, 'embedding_dim': 64, 'lr': 0.012072661651762353, 'lambda_val': 7.286792631587561e-05, 'batch_size': 2489, 'optimizer': 'SGD'}. Best is trial 42 with value: 0.0837957435704636.
2026-05-17 23:19:45,989 - experiment_functions - INFO - Early stopping at epoch 3750. Best Recall: 0.0853
2026-05-17 23:19:46,088 - optuna.study.study - INFO - Trial 51 finished with value: 0.08533224549370667 and parameters: {'n_layers': 1, 'embedding_dim': 256, 'lr': 0.0013317042476924989, 'lambda_val': 1.3990739253940633e-05, 'batch_size': 3023, 'optimizer': 'Adam'}. Best is trial 51 with value: 0.08533224549370667.
2026-05-17 23:20:27,218 - optuna.study._optimize - INFO - Trial 52 pruned. 
2026-05-17 23:20:40,010 - experiment_functions - INFO - Early stopping at epoch 750. Best Recall: 0.0758
2026-05-17 23:20:40,179 - optuna.study.study - INFO - Trial 53 finished with value: 0.07576594344712126 and parameters: {'n_layers': 1, 'embedding_dim': 256, 'lr': 0.0014144038819770986, 'lambda_val': 7.634427345846615e-06, 'batch_size': 3008, 'optimizer': 'Adam'}. Best is trial 51 with value: 0.08533224549370667.
2026-05-17 23:20:49,659 - experiment_functions - INFO - Early stopping at epoch 550. Best Recall: 0.0747
2026-05-17 23:20:49,739 - optuna.study.study - INFO - Trial 54 finished with value: 0.07472593516902383 and parameters: {'n_layers': 1, 'embedding_dim': 256, 'lr': 0.004435184141608935, 'lambda_val': 2.644905753253102e-06, 'batch_size': 3358, 'optimizer': 'Adam'}. Best is trial 51 with value: 0.08533224549370667.
2026-05-17 23:21:43,836 - experiment_functions - INFO - Early stopping at epoch 3600. Best Recall: 0.0834
