2026-05-19 05:20:48,549 - optuna.study.study - INFO - Trial 150 finished with value: 0.06881365118446758 and parameters: {'n_layers': 1, 'embedding_dim': 32, 'lr': 0.000937850680513898, 'lambda_val': 0.00029390393236219096, 'batch_size': 822, 'optimizer': 'RMSprop'}. Best is trial 117 with value: 0.07472982005213619.
2026-05-19 05:21:14,725 - experiment_functions - INFO - Early stopping at epoch 1900. Best Recall: 0.0738
2026-05-19 05:21:15,036 - optuna.study.study - INFO - Trial 151 finished with value: 0.07377023909997354 and parameters: {'n_layers': 1, 'embedding_dim': 32, 'lr': 0.0008537786084394308, 'lambda_val': 0.00030421503034477806, 'batch_size': 758, 'optimizer': 'RMSprop'}. Best is trial 117 with value: 0.07472982005213619.
2026-05-19 05:21:37,554 - optuna.study._optimize - INFO - Trial 152 pruned. 
2026-05-19 05:22:20,791 - experiment_functions - INFO - Early stopping at epoch 3050. Best Recall: 0.0746
2026-05-19 05:22:20,883 - optuna.study.study - INFO - Trial 153 finished with value: 0.07456121490802796 and parameters: {'n_layers': 1, 'embedding_dim': 32, 'lr': 0.000640851431830463, 'lambda_val': 0.0016172131632900813, 'batch_size': 834, 'optimizer': 'RMSprop'}. Best is trial 117 with value: 0.07472982005213619.
2026-05-19 05:23:01,938 - experiment_functions - INFO - Early stopping at epoch 2900. Best Recall: 0.0731
2026-05-19 05:23:02,031 - optuna.study.study - INFO - Trial 154 finished with value: 0.07305807271062426 and parameters: {'n_layers': 1, 'embedding_dim': 32, 'lr': 0.0007021986222818236, 'lambda_val': 0.001712691652207408, 'batch_size': 706, 'optimizer': 'RMSprop'}. Best is trial 117 with value: 0.07472982005213619.
2026-05-19 05:23:15,955 - optuna.study._optimize - INFO - Trial 155 pruned. 
2026-05-19 05:23:29,903 - optuna.study._optimize - INFO - Trial 156 pruned. 
2026-05-19 05:24:14,962 - experiment_functions - INFO - Early stopping at epoch 3000. Best Recall: 0.0733
2026-05-19 05:24:15,053 - optuna.study.study - INFO - Trial 157 finished with value: 0.07329290291206142 and parameters: {'n_layers': 1, 'embedding_dim': 32, 'lr': 0.0006840028762038394, 'lambda_val': 0.0023112031932138962, 'batch_size': 649, 'optimizer': 'RMSprop'}. Best is trial 117 with value: 0.07472982005213619.
2026-05-19 05:24:29,267 - optuna.study._optimize - INFO - Trial 158 pruned. 
2026-05-19 05:24:54,741 - optuna.study._optimize - INFO - Trial 159 pruned. 
2026-05-19 05:25:02,167 - experiment_functions - INFO - Early stopping at epoch 500. Best Recall: 0.0050
2026-05-19 05:25:02,259 - optuna.study.study - INFO - Trial 160 finished with value: 0.005041695657471196 and parameters: {'n_layers': 1, 'embedding_dim': 32, 'lr': 0.0004371611534211857, 'lambda_val': 0.0012959515487103532, 'batch_size': 827, 'optimizer': 'SGD'}. Best is trial 117 with value: 0.07472982005213619.
2026-05-19 05:25:33,359 - experiment_functions - INFO - Early stopping at epoch 2150. Best Recall: 0.0741
2026-05-19 05:25:33,507 - optuna.study.study - INFO - Trial 161 finished with value: 0.07412632903749106 and parameters: {'n_layers': 1, 'embedding_dim': 32, 'lr': 0.0008558114542396714, 'lambda_val': 0.0014561304746631809, 'batch_size': 528, 'optimizer': 'RMSprop'}. Best is trial 117 with value: 0.07472982005213619.
2026-05-19 05:26:03,586 - experiment_functions - INFO - Early stopping at epoch 2000. Best Recall: 0.0733
2026-05-19 05:26:03,676 - optuna.study.study - INFO - Trial 162 finished with value: 0.0732636640507191 and parameters: {'n_layers': 1, 'embedding_dim': 32, 'lr': 0.0008187108828233013, 'lambda_val': 0.0018429641370006395, 'batch_size': 560, 'optimizer': 'RMSprop'}. Best is trial 117 with value: 0.07472982005213619.
2026-05-19 05:26:25,533 - experiment_functions - INFO - Early stopping at epoch 1600. Best Recall: 0.0719
2026-05-19 05:26:25,634 - optuna.study.study - INFO - Trial 163 finished with value: 0.0718745585065169 and parameters: {'n_layers': 1, 'embedding_dim': 32, 'lr': 0.0008291735435193261, 'lambda_val': 0.0021323581702212503, 'batch_size': 658, 'optimizer': 'RMSprop'}. Best is trial 117 with value: 0.07472982005213619.
2026-05-19 05:26:40,846 - optuna.study._optimize - INFO - Trial 164 pruned. 
2026-05-19 05:27:17,421 - experiment_functions - INFO - Early stopping at epoch 2750. Best Recall: 0.0759
2026-05-19 05:27:17,514 - optuna.study.study - INFO - Trial 165 finished with value: 0.07590076772023732 and parameters: {'n_layers': 1, 'embedding_dim': 32, 'lr': 0.0008114533296619067, 'lambda_val': 0.0015972395796885787, 'batch_size': 517, 'optimizer': 'RMSprop'}. Best is trial 165 with value: 0.07590076772023732.
2026-05-19 05:27:33,116 - experiment_functions - INFO - Early stopping at epoch 1100. Best Recall: 0.0706
2026-05-19 05:27:33,215 - optuna.study.study - INFO - Trial 166 finished with value: 0.0705847517859547 and parameters: {'n_layers': 1, 'embedding_dim': 32, 'lr': 0.001163599174789176, 'lambda_val': 0.001438765833341841, 'batch_size': 559, 'optimizer': 'RMSprop'}. Best is trial 165 with value: 0.07590076772023732.
2026-05-19 05:27:48,844 - experiment_functions - INFO - Early stopping at epoch 800. Best Recall: 0.0637
2026-05-19 05:27:48,935 - optuna.study.study - INFO - Trial 167 finished with value: 0.06371508072755215 and parameters: {'n_layers': 1, 'embedding_dim': 96, 'lr': 0.0013733599842634025, 'lambda_val': 0.0014742569602715873, 'batch_size': 545, 'optimizer': 'RMSprop'}. Best is trial 165 with value: 0.07590076772023732.
2026-05-19 05:28:07,873 - experiment_functions - INFO - Early stopping at epoch 1250. Best Recall: 0.0683
2026-05-19 05:28:07,964 - optuna.study.study - INFO - Trial 168 finished with value: 0.06828041675473481 and parameters: {'n_layers': 1, 'embedding_dim': 32, 'lr': 0.001023214486312819, 'lambda_val': 0.0010864213910964683, 'batch_size': 623, 'optimizer': 'RMSprop'}. Best is trial 165 with value: 0.07590076772023732.
2026-05-19 05:28:36,276 - experiment_functions - INFO - Early stopping at epoch 1950. Best Recall: 0.0736
2026-05-19 05:28:36,377 - optuna.study.study - INFO - Trial 169 finished with value: 0.07363289474670609 and parameters: {'n_layers': 1, 'embedding_dim': 32, 'lr': 0.0008538983515713304, 'lambda_val': 0.001658727007147379, 'batch_size': 674, 'optimizer': 'RMSprop'}. Best is trial 165 with value: 0.07590076772023732.
2026-05-19 05:28:51,087 - experiment_functions - INFO - Early stopping at epoch 1050. Best Recall: 0.0681
2026-05-19 05:28:51,179 - optuna.study.study - INFO - Trial 170 finished with value: 0.06814851415255936 and parameters: {'n_layers': 1, 'embedding_dim': 32, 'lr': 0.0012082597974145302, 'lambda_val': 0.0017662438437770008, 'batch_size': 682, 'optimizer': 'RMSprop'}. Best is trial 165 with value: 0.07590076772023732.
2026-05-19 05:29:14,307 - optuna.study._optimize - INFO - Trial 171 pruned. 
2026-05-19 05:29:35,191 - optuna.study._optimize - INFO - Trial 172 pruned. 
2026-05-19 05:29:48,553 - experiment_functions - INFO - Early stopping at epoch 850. Best Recall: 0.0594
2026-05-19 05:29:48,699 - optuna.study.study - INFO - Trial 173 finished with value: 0.05941025882634974 and parameters: {'n_layers': 1, 'embedding_dim': 32, 'lr': 0.0014934172507256186, 'lambda_val': 0.0006172033153933319, 'batch_size': 743, 'optimizer': 'RMSprop'}. Best is trial 165 with value: 0.07590076772023732.
2026-05-19 05:30:20,615 - experiment_functions - INFO - Early stopping at epoch 1950. Best Recall: 0.0725
2026-05-19 05:30:20,704 - optuna.study.study - INFO - Trial 174 finished with value: 0.07247468579035783 and parameters: {'n_layers': 1, 'embedding_dim': 32, 'lr': 0.0008028165140904744, 'lambda_val': 0.0017268613813432583, 'batch_size': 644, 'optimizer': 'RMSprop'}. Best is trial 165 with value: 0.07590076772023732.
2026-05-19 05:30:44,337 - optuna.study._optimize - INFO - Trial 175 pruned. 
2026-05-19 05:31:01,135 - experiment_functions - INFO - Early stopping at epoch 1050. Best Recall: 0.0719
2026-05-19 05:31:01,280 - optuna.study.study - INFO - Trial 176 finished with value: 0.0719369059129345 and parameters: {'n_layers': 1, 'embedding_dim': 32, 'lr': 0.0011888923276700872, 'lambda_val': 0.002518746301114773, 'batch_size': 580, 'optimizer': 'RMSprop'}. Best is trial 165 with value: 0.07590076772023732.
2026-05-19 05:31:18,575 - experiment_functions - INFO - Early stopping at epoch 1000. Best Recall: 0.0694
2026-05-19 05:31:18,687 - optuna.study.study - INFO - Trial 177 finished with value: 0.06939549788480773 and parameters: {'n_layers': 1, 'embedding_dim': 32, 'lr': 0.0012259283257663013, 'lambda_val': 0.0025237751506420585, 'batch_size': 578, 'optimizer': 'RMSprop'}. Best is trial 165 with value: 0.07590076772023732.
2026-05-19 05:31:32,817 - optuna.study._optimize - INFO - Trial 178 pruned. 
2026-05-19 05:31:43,016 - experiment_functions - INFO - Early stopping at epoch 650. Best Recall: 0.0375
2026-05-19 05:31:43,107 - optuna.study.study - INFO - Trial 179 finished with value: 0.03748827595095471 and parameters: {'n_layers': 3, 'embedding_dim': 64, 'lr': 0.0007854627695178671, 'lambda_val': 0.0037456376565810517, 'batch_size': 649, 'optimizer': 'RMSprop'}. Best is trial 165 with value: 0.07590076772023732.
2026-05-19 05:32:03,081 - optuna.study._optimize - INFO - Trial 180 pruned. 
2026-05-19 05:32:20,641 - experiment_functions - INFO - Early stopping at epoch 1100. Best Recall: 0.0696
2026-05-19 05:32:20,731 - optuna.study.study - INFO - Trial 181 finished with value: 0.06960546428123522 and parameters: {'n_layers': 1, 'embedding_dim': 32, 'lr': 0.0013109802393157016, 'lambda_val': 0.0020335486632485113, 'batch_size': 571, 'optimizer': 'RMSprop'}. Best is trial 165 with value: 0.07590076772023732.
2026-05-19 05:32:33,141 - experiment_functions - INFO - Early stopping at epoch 700. Best Recall: 0.0642
2026-05-19 05:32:33,231 - optuna.study.study - INFO - Trial 182 finished with value: 0.06416922456642758 and parameters: {'n_layers': 1, 'embedding_dim': 32, 'lr': 0.0017101730224708808, 'lambda_val': 0.0018866703511543792, 'batch_size': 593, 'optimizer': 'RMSprop'}. Best is trial 165 with value: 0.07590076772023732.
2026-05-19 05:33:00,022 - optuna.study._optimize - INFO - Trial 183 pruned. 
2026-05-19 05:33:29,226 - optuna.study._optimize - INFO - Trial 184 pruned. 
2026-05-19 05:33:42,567 - experiment_functions - INFO - Early stopping at epoch 850. Best Recall: 0.0600
2026-05-19 05:33:42,713 - optuna.study.study - INFO - Trial 185 finished with value: 0.0599717778814635 and parameters: {'n_layers': 1, 'embedding_dim': 32, 'lr': 0.0014536084970461667, 'lambda_val': 0.0016476440364642081, 'batch_size': 715, 'optimizer': 'RMSprop'}. Best is trial 165 with value: 0.07590076772023732.
2026-05-19 05:34:03,125 - optuna.study._optimize - INFO - Trial 186 pruned. 
2026-05-19 05:34:25,847 - optuna.study._optimize - INFO - Trial 187 pruned. 
2026-05-19 05:34:42,802 - experiment_functions - INFO - Early stopping at epoch 1000. Best Recall: 0.0663
2026-05-19 05:34:42,904 - optuna.study.study - INFO - Trial 188 finished with value: 0.06626091704546735 and parameters: {'n_layers': 1, 'embedding_dim': 32, 'lr': 0.0011041720254710127, 'lambda_val': 0.0014608041695881085, 'batch_size': 673, 'optimizer': 'RMSprop'}. Best is trial 165 with value: 0.07590076772023732.
2026-05-19 05:35:37,102 - experiment_functions - INFO - Early stopping at epoch 3700. Best Recall: 0.0755
2026-05-19 05:35:38,619 - optuna.study.study - INFO - Trial 189 finished with value: 0.07546658574479362 and parameters: {'n_layers': 1, 'embedding_dim': 32, 'lr': 0.0007087487711575105, 'lambda_val': 0.0029736052675663135, 'batch_size': 573, 'optimizer': 'RMSprop'}. Best is trial 165 with value: 0.07590076772023732.
2026-05-19 05:36:06,329 - experiment_functions - INFO - Early stopping at epoch 1900. Best Recall: 0.0745
2026-05-19 05:36:06,431 - optuna.study.study - INFO - Trial 190 finished with value: 0.07452379179640455 and parameters: {'n_layers': 1, 'embedding_dim': 32, 'lr': 0.0006931681389300202, 'lambda_val': 0.004367799822132908, 'batch_size': 798, 'optimizer': 'RMSprop'}. Best is trial 165 with value: 0.07590076772023732.
2026-05-19 05:36:26,484 - optuna.study._optimize - INFO - Trial 191 pruned. 
2026-05-19 05:36:48,483 - optuna.study._optimize - INFO - Trial 192 pruned. 
2026-05-19 05:37:03,055 - optuna.study._optimize - INFO - Trial 193 pruned. 
2026-05-19 05:37:21,428 - optuna.study._optimize - INFO - Trial 194 pruned. 
2026-05-19 05:37:36,822 - experiment_functions - INFO - Early stopping at epoch 950. Best Recall: 0.0596
2026-05-19 05:37:36,913 - optuna.study.study - INFO - Trial 195 finished with value: 0.05960472354499347 and parameters: {'n_layers': 1, 'embedding_dim': 256, 'lr': 0.0008560513718521797, 'lambda_val': 0.0016346507913628796, 'batch_size': 620, 'optimizer': 'RMSprop'}. Best is trial 165 with value: 0.07590076772023732.
2026-05-19 05:37:52,459 - optuna.study._optimize - INFO - Trial 196 pruned. 
2026-05-19 05:38:16,828 - experiment_functions - INFO - Early stopping at epoch 1550. Best Recall: 0.0728
2026-05-19 05:38:16,988 - optuna.study.study - INFO - Trial 197 finished with value: 0.07284591551035703 and parameters: {'n_layers': 1, 'embedding_dim': 32, 'lr': 0.000952075523287367, 'lambda_val': 0.0012761713628502574, 'batch_size': 654, 'optimizer': 'RMSprop'}. Best is trial 165 with value: 0.07590076772023732.
2026-05-19 05:38:38,969 - experiment_functions - INFO - Early stopping at epoch 1450. Best Recall: 0.0761
2026-05-19 05:38:39,888 - optuna.study.study - INFO - Trial 198 finished with value: 0.07614129859637384 and parameters: {'n_layers': 1, 'embedding_dim': 32, 'lr': 0.0009693799502842944, 'lambda_val': 0.001112286248867487, 'batch_size': 649, 'optimizer': 'RMSprop'}. Best is trial 198 with value: 0.07614129859637384.
2026-05-19 05:38:47,335 - experiment_functions - INFO - Early stopping at epoch 500. Best Recall: 0.0055
2026-05-19 05:38:47,427 - optuna.study.study - INFO - Trial 199 finished with value: 0.005479371121899643 and parameters: {'n_layers': 1, 'embedding_dim': 32, 'lr': 0.0009779718036465798, 'lambda_val': 0.0012686506189584891, 'batch_size': 672, 'optimizer': 'SGD'}. Best is trial 198 with value: 0.07614129859637384.
2026-05-19 05:39:06,565 - optuna.study._optimize - INFO - Trial 200 pruned. 
2026-05-19 05:39:54,178 - experiment_functions - INFO - Early stopping at epoch 3350. Best Recall: 0.0760
2026-05-19 05:39:54,279 - optuna.study.study - INFO - Trial 201 finished with value: 0.07603133895160645 and parameters: {'n_layers': 1, 'embedding_dim': 32, 'lr': 0.0006731574557308847, 'lambda_val': 0.0018465343284921243, 'batch_size': 725, 'optimizer': 'RMSprop'}. Best is trial 198 with value: 0.07614129859637384.
2026-05-19 05:40:09,391 - experiment_functions - INFO - Early stopping at epoch 1100. Best Recall: 0.0666
2026-05-19 05:40:09,520 - optuna.study.study - INFO - Trial 202 finished with value: 0.06658584574443448 and parameters: {'n_layers': 1, 'embedding_dim': 32, 'lr': 0.0010603717763238542, 'lambda_val': 0.0017697703986724277, 'batch_size': 724, 'optimizer': 'RMSprop'}. Best is trial 198 with value: 0.07614129859637384.
2026-05-19 05:40:43,668 - experiment_functions - INFO - Early stopping at epoch 2500. Best Recall: 0.0760
2026-05-19 05:40:43,769 - optuna.study.study - INFO - Trial 203 finished with value: 0.07601850110359976 and parameters: {'n_layers': 1, 'embedding_dim': 32, 'lr': 0.0006963998816034661, 'lambda_val': 0.0013222137063795287, 'batch_size': 796, 'optimizer': 'RMSprop'}. Best is trial 198 with value: 0.07614129859637384.
2026-05-19 05:41:11,466 - optuna.study._optimize - INFO - Trial 204 pruned. 
2026-05-19 05:41:32,483 - optuna.study._optimize - INFO - Trial 205 pruned. 
2026-05-19 05:41:56,719 - experiment_functions - INFO - Early stopping at epoch 1650. Best Recall: 0.0770
2026-05-19 05:41:56,799 - optuna.study.study - INFO - Trial 206 finished with value: 0.07695563236837606 and parameters: {'n_layers': 1, 'embedding_dim': 32, 'lr': 0.0010627630448638097, 'lambda_val': 0.001975845073588187, 'batch_size': 570, 'optimizer': 'RMSprop'}. Best is trial 206 with value: 0.07695563236837606.
2026-05-19 05:42:10,988 - experiment_functions - INFO - Early stopping at epoch 1000. Best Recall: 0.0652
2026-05-19 05:42:11,087 - optuna.study.study - INFO - Trial 207 finished with value: 0.06521504071870439 and parameters: {'n_layers': 1, 'embedding_dim': 96, 'lr': 0.0009463506812929796, 'lambda_val': 0.002304565707541179, 'batch_size': 798, 'optimizer': 'RMSprop'}. Best is trial 206 with value: 0.07695563236837606.
2026-05-19 05:42:26,222 - optuna.study._optimize - INFO - Trial 208 pruned. 
2026-05-19 05:42:42,788 - optuna.study._optimize - INFO - Trial 209 pruned. 
2026-05-19 05:42:56,708 - optuna.study._optimize - INFO - Trial 210 pruned. 
2026-05-19 05:43:18,246 - optuna.study._optimize - INFO - Trial 211 pruned. 
2026-05-19 05:43:37,264 - optuna.study._optimize - INFO - Trial 212 pruned. 
2026-05-19 05:43:52,973 - experiment_functions - INFO - Early stopping at epoch 1050. Best Recall: 0.0694
2026-05-19 05:43:53,143 - optuna.study.study - INFO - Trial 213 finished with value: 0.06942317352906607 and parameters: {'n_layers': 1, 'embedding_dim': 32, 'lr': 0.0012501355394067383, 'lambda_val': 0.0011470092846938215, 'batch_size': 640, 'optimizer': 'RMSprop'}. Best is trial 206 with value: 0.07695563236837606.
2026-05-19 05:44:10,569 - optuna.study._optimize - INFO - Trial 214 pruned. 
2026-05-19 05:44:31,183 - optuna.study._optimize - INFO - Trial 215 pruned. 
2026-05-19 05:44:46,746 - experiment_functions - INFO - Early stopping at epoch 900. Best Recall: 0.0491
2026-05-19 05:44:46,858 - optuna.study.study - INFO - Trial 216 finished with value: 0.04909071831779566 and parameters: {'n_layers': 1, 'embedding_dim': 32, 'lr': 0.0006822162292117623, 'lambda_val': 0.0026391000870233487, 'batch_size': 4060, 'optimizer': 'RMSprop'}. Best is trial 206 with value: 0.07695563236837606.
2026-05-19 05:45:08,367 - experiment_functions - INFO - Early stopping at epoch 1550. Best Recall: 0.0719
2026-05-19 05:45:08,467 - optuna.study.study - INFO - Trial 217 finished with value: 0.07194634472197368 and parameters: {'n_layers': 1, 'embedding_dim': 32, 'lr': 0.0009309928461469223, 'lambda_val': 0.00137135130064207, 'batch_size': 675, 'optimizer': 'RMSprop'}. Best is trial 206 with value: 0.07695563236837606.
2026-05-19 05:45:21,739 - optuna.study._optimize - INFO - Trial 218 pruned. 
2026-05-19 05:45:40,157 - optuna.study._optimize - INFO - Trial 219 pruned. 
2026-05-19 05:45:55,562 - optuna.study._optimize - INFO - Trial 220 pruned. 
2026-05-19 05:46:11,762 - experiment_functions - INFO - Early stopping at epoch 1150. Best Recall: 0.0713
2026-05-19 05:46:11,851 - optuna.study.study - INFO - Trial 221 finished with value: 0.07128538635255825 and parameters: {'n_layers': 1, 'embedding_dim': 32, 'lr': 0.0013342270862939222, 'lambda_val': 0.0013857556888435215, 'batch_size': 514, 'optimizer': 'RMSprop'}. Best is trial 206 with value: 0.07695563236837606.
2026-05-19 05:46:26,773 - experiment_functions - INFO - Early stopping at epoch 950. Best Recall: 0.0647
2026-05-19 05:46:26,875 - optuna.study.study - INFO - Trial 222 finished with value: 0.06472262392010185 and parameters: {'n_layers': 1, 'embedding_dim': 32, 'lr': 0.001288552071023576, 'lambda_val': 0.0012284902128934247, 'batch_size': 632, 'optimizer': 'RMSprop'}. Best is trial 206 with value: 0.07695563236837606.
2026-05-19 05:46:39,854 - experiment_functions - INFO - Early stopping at epoch 900. Best Recall: 0.0665
2026-05-19 05:46:39,956 - optuna.study.study - INFO - Trial 223 finished with value: 0.0665098790422101 and parameters: {'n_layers': 1, 'embedding_dim': 32, 'lr': 0.001481580878477002, 'lambda_val': 0.001458798229851495, 'batch_size': 513, 'optimizer': 'RMSprop'}. Best is trial 206 with value: 0.07695563236837606.
2026-05-19 05:46:56,982 - optuna.study._optimize - INFO - Trial 224 pruned. 
2026-05-19 05:47:15,299 - optuna.study._optimize - INFO - Trial 225 pruned. 
2026-05-19 05:47:24,658 - experiment_functions - INFO - Early stopping at epoch 650. Best Recall: 0.0609
2026-05-19 05:47:24,746 - optuna.study.study - INFO - Trial 226 finished with value: 0.060897547313730344 and parameters: {'n_layers': 1, 'embedding_dim': 32, 'lr': 0.002024174806381288, 'lambda_val': 0.0017538031211753156, 'batch_size': 718, 'optimizer': 'RMSprop'}. Best is trial 206 with value: 0.07695563236837606.
2026-05-19 05:47:59,131 - optuna.study._optimize - INFO - Trial 227 pruned. 
2026-05-19 05:48:18,316 - experiment_functions - INFO - Early stopping at epoch 1250. Best Recall: 0.0727
2026-05-19 05:48:18,408 - optuna.study.study - INFO - Trial 228 finished with value: 0.07274337977120322 and parameters: {'n_layers': 1, 'embedding_dim': 32, 'lr': 0.0010664248600925283, 'lambda_val': 0.0012798385282458847, 'batch_size': 517, 'optimizer': 'RMSprop'}. Best is trial 206 with value: 0.07695563236837606.
2026-05-19 05:48:33,930 - experiment_functions - INFO - Early stopping at epoch 950. Best Recall: 0.0650
2026-05-19 05:48:34,067 - optuna.study.study - INFO - Trial 229 finished with value: 0.06495574343620006 and parameters: {'n_layers': 1, 'embedding_dim': 128, 'lr': 0.0009513935030465404, 'lambda_val': 0.0010633205124596992, 'batch_size': 596, 'optimizer': 'RMSprop'}. Best is trial 206 with value: 0.07695563236837606.
2026-05-19 05:48:53,420 - optuna.study._optimize - INFO - Trial 230 pruned. 
2026-05-19 05:49:11,912 - experiment_functions - INFO - Early stopping at epoch 1250. Best Recall: 0.0704
2026-05-19 05:49:12,010 - optuna.study.study - INFO - Trial 231 finished with value: 0.07037176408371734 and parameters: {'n_layers': 1, 'embedding_dim': 32, 'lr': 0.0010597788950583232, 'lambda_val': 0.0011571383508041646, 'batch_size': 528, 'optimizer': 'RMSprop'}. Best is trial 206 with value: 0.07695563236837606.
2026-05-19 05:49:20,843 - experiment_functions - INFO - Early stopping at epoch 500. Best Recall: 0.0077
