2026-05-18 05:47:47,614 - optuna.study.study - INFO - Trial 79 finished with value: 0.0441111926493431 and parameters: {'n_layers': 3, 'embedding_dim': 32, 'lr': 0.002560301640114737, 'lambda_val': 0.0014413912460256415, 'batch_size': 520, 'optimizer': 'Adam'}. Best is trial 57 with value: 0.06827998896428639.
2026-05-18 05:47:55,228 - experiment_functions - INFO - Early stopping at epoch 500. Best Recall: 0.0051
2026-05-18 05:47:55,639 - optuna.study.study - INFO - Trial 80 finished with value: 0.005077727304941124 and parameters: {'n_layers': 1, 'embedding_dim': 32, 'lr': 0.0013146268031080169, 'lambda_val': 0.003535955670059573, 'batch_size': 911, 'optimizer': 'SGD'}. Best is trial 57 with value: 0.06827998896428639.
2026-05-18 05:48:18,202 - experiment_functions - INFO - Early stopping at epoch 1350. Best Recall: 0.0641
2026-05-18 05:48:18,293 - optuna.study.study - INFO - Trial 81 finished with value: 0.06409593996736497 and parameters: {'n_layers': 1, 'embedding_dim': 32, 'lr': 0.0009854752291155926, 'lambda_val': 0.0077192108269486534, 'batch_size': 722, 'optimizer': 'Adam'}. Best is trial 57 with value: 0.06827998896428639.
2026-05-18 05:48:42,050 - experiment_functions - INFO - Early stopping at epoch 1700. Best Recall: 0.0640
2026-05-18 05:48:42,140 - optuna.study.study - INFO - Trial 82 finished with value: 0.06403016627662304 and parameters: {'n_layers': 1, 'embedding_dim': 32, 'lr': 0.000746430864832968, 'lambda_val': 0.014899200777701795, 'batch_size': 781, 'optimizer': 'Adam'}. Best is trial 57 with value: 0.06827998896428639.
2026-05-18 05:48:54,957 - experiment_functions - INFO - Early stopping at epoch 700. Best Recall: 0.0642
2026-05-18 05:48:55,435 - optuna.study.study - INFO - Trial 83 finished with value: 0.06419867974936594 and parameters: {'n_layers': 1, 'embedding_dim': 32, 'lr': 0.002130567153020076, 'lambda_val': 0.020647517061353714, 'batch_size': 1116, 'optimizer': 'Adam'}. Best is trial 57 with value: 0.06827998896428639.
2026-05-18 05:49:03,536 - experiment_functions - INFO - Early stopping at epoch 500. Best Recall: 0.0053
2026-05-18 05:49:03,626 - optuna.study.study - INFO - Trial 84 finished with value: 0.005326727258160772 and parameters: {'n_layers': 1, 'embedding_dim': 32, 'lr': 0.0005606693555298873, 'lambda_val': 0.055482625630240076, 'batch_size': 637, 'optimizer': 'Adam'}. Best is trial 57 with value: 0.06827998896428639.
2026-05-18 05:49:15,027 - experiment_functions - INFO - Early stopping at epoch 800. Best Recall: 0.0634
2026-05-18 05:49:17,837 - optuna.study.study - INFO - Trial 85 finished with value: 0.06342806681075046 and parameters: {'n_layers': 1, 'embedding_dim': 32, 'lr': 0.0015376166428606214, 'lambda_val': 0.0340747911263828, 'batch_size': 949, 'optimizer': 'Adam'}. Best is trial 57 with value: 0.06827998896428639.
2026-05-18 05:49:28,518 - experiment_functions - INFO - Early stopping at epoch 700. Best Recall: 0.0608
2026-05-18 05:49:28,684 - optuna.study.study - INFO - Trial 86 finished with value: 0.06075191179017569 and parameters: {'n_layers': 1, 'embedding_dim': 32, 'lr': 0.0031766700270272493, 'lambda_val': 0.0008102702722479564, 'batch_size': 595, 'optimizer': 'Adam'}. Best is trial 57 with value: 0.06827998896428639.
2026-05-18 05:49:44,569 - experiment_functions - INFO - Early stopping at epoch 1050. Best Recall: 0.0630
2026-05-18 05:49:44,680 - optuna.study.study - INFO - Trial 87 finished with value: 0.06298558284393634 and parameters: {'n_layers': 1, 'embedding_dim': 32, 'lr': 0.0010866109129367898, 'lambda_val': 0.002294535839066958, 'batch_size': 834, 'optimizer': 'RMSprop'}. Best is trial 57 with value: 0.06827998896428639.
2026-05-18 05:50:09,451 - optuna.study._optimize - INFO - Trial 88 pruned. 
2026-05-18 05:50:24,225 - optuna.study._optimize - INFO - Trial 89 pruned. 
2026-05-18 05:50:34,126 - experiment_functions - INFO - Early stopping at epoch 650. Best Recall: 0.0585
2026-05-18 05:50:34,216 - optuna.study.study - INFO - Trial 90 finished with value: 0.05852414138525846 and parameters: {'n_layers': 2, 'embedding_dim': 32, 'lr': 0.0018011223028341406, 'lambda_val': 0.012899732451502244, 'batch_size': 969, 'optimizer': 'Adam'}. Best is trial 57 with value: 0.06827998896428639.
2026-05-18 05:50:55,580 - experiment_functions - INFO - Early stopping at epoch 1350. Best Recall: 0.0662
2026-05-18 05:50:55,680 - optuna.study.study - INFO - Trial 91 finished with value: 0.06620969768745998 and parameters: {'n_layers': 1, 'embedding_dim': 32, 'lr': 0.0008484952340089695, 'lambda_val': 0.010574949894737003, 'batch_size': 997, 'optimizer': 'Adam'}. Best is trial 57 with value: 0.06827998896428639.
2026-05-18 05:51:11,767 - experiment_functions - INFO - Early stopping at epoch 1150. Best Recall: 0.0664
2026-05-18 05:51:11,857 - optuna.study.study - INFO - Trial 92 finished with value: 0.06644969055205012 and parameters: {'n_layers': 1, 'embedding_dim': 32, 'lr': 0.0009996752587561623, 'lambda_val': 0.019179923195599826, 'batch_size': 704, 'optimizer': 'Adam'}. Best is trial 57 with value: 0.06827998896428639.
2026-05-18 05:51:24,703 - experiment_functions - INFO - Early stopping at epoch 900. Best Recall: 0.0678
2026-05-18 05:51:24,813 - optuna.study.study - INFO - Trial 93 finished with value: 0.06775176350737071 and parameters: {'n_layers': 1, 'embedding_dim': 32, 'lr': 0.001265881669390691, 'lambda_val': 0.01772576026470632, 'batch_size': 890, 'optimizer': 'Adam'}. Best is trial 57 with value: 0.06827998896428639.
2026-05-18 05:51:39,150 - experiment_functions - INFO - Early stopping at epoch 950. Best Recall: 0.0607
2026-05-18 05:51:39,304 - optuna.study.study - INFO - Trial 94 finished with value: 0.06071843521650718 and parameters: {'n_layers': 1, 'embedding_dim': 32, 'lr': 0.0012358775596954391, 'lambda_val': 0.04468885468905164, 'batch_size': 863, 'optimizer': 'Adam'}. Best is trial 57 with value: 0.06827998896428639.
2026-05-18 05:51:49,600 - experiment_functions - INFO - Early stopping at epoch 600. Best Recall: 0.0112
2026-05-18 05:51:49,788 - optuna.study.study - INFO - Trial 95 finished with value: 0.011237158849597566 and parameters: {'n_layers': 1, 'embedding_dim': 32, 'lr': 0.09233547329555865, 'lambda_val': 0.00022482074681909399, 'batch_size': 1192, 'optimizer': 'Adam'}. Best is trial 57 with value: 0.06827998896428639.
2026-05-18 05:51:57,245 - experiment_functions - INFO - Early stopping at epoch 500. Best Recall: 0.0046
2026-05-18 05:51:57,366 - optuna.study.study - INFO - Trial 96 finished with value: 0.004593721738856403 and parameters: {'n_layers': 1, 'embedding_dim': 32, 'lr': 0.0005712914196977076, 'lambda_val': 0.02205973736869847, 'batch_size': 693, 'optimizer': 'Adam'}. Best is trial 57 with value: 0.06827998896428639.
2026-05-18 05:52:21,452 - experiment_functions - INFO - Early stopping at epoch 1500. Best Recall: 0.0649
2026-05-18 05:52:21,542 - optuna.study.study - INFO - Trial 97 finished with value: 0.0649397969569587 and parameters: {'n_layers': 1, 'embedding_dim': 32, 'lr': 0.0007652573090931857, 'lambda_val': 0.008836582471412729, 'batch_size': 954, 'optimizer': 'Adam'}. Best is trial 57 with value: 0.06827998896428639.
2026-05-18 05:52:29,159 - experiment_functions - INFO - Early stopping at epoch 500. Best Recall: 0.0050
2026-05-18 05:52:29,257 - optuna.study.study - INFO - Trial 98 finished with value: 0.00504006536345551 and parameters: {'n_layers': 1, 'embedding_dim': 32, 'lr': 1.5296631497312112e-05, 'lambda_val': 0.0026864556067844308, 'batch_size': 793, 'optimizer': 'SGD'}. Best is trial 57 with value: 0.06827998896428639.
2026-05-18 05:53:00,247 - experiment_functions - INFO - Early stopping at epoch 700. Best Recall: 0.0453
2026-05-18 05:53:00,391 - optuna.study.study - INFO - Trial 99 finished with value: 0.04531401622008066 and parameters: {'n_layers': 1, 'embedding_dim': 256, 'lr': 0.00237544395154121, 'lambda_val': 0.02798534125589198, 'batch_size': 514, 'optimizer': 'Adam'}. Best is trial 57 with value: 0.06827998896428639.
2026-05-18 05:53:34,915 - optuna.study._optimize - INFO - Trial 100 pruned. 
2026-05-18 05:53:53,819 - experiment_functions - INFO - Early stopping at epoch 1300. Best Recall: 0.0676
2026-05-18 05:53:53,910 - optuna.study.study - INFO - Trial 101 finished with value: 0.06764806082518768 and parameters: {'n_layers': 1, 'embedding_dim': 32, 'lr': 0.0009646703423065443, 'lambda_val': 0.01620861729398514, 'batch_size': 587, 'optimizer': 'Adam'}. Best is trial 57 with value: 0.06827998896428639.
2026-05-18 05:54:17,863 - experiment_functions - INFO - Early stopping at epoch 1500. Best Recall: 0.0658
2026-05-18 05:54:17,961 - optuna.study.study - INFO - Trial 102 finished with value: 0.06577348635091844 and parameters: {'n_layers': 1, 'embedding_dim': 32, 'lr': 0.0009214774918426483, 'lambda_val': 0.005427789633049159, 'batch_size': 676, 'optimizer': 'Adam'}. Best is trial 57 with value: 0.06827998896428639.
2026-05-18 05:54:29,232 - experiment_functions - INFO - Early stopping at epoch 750. Best Recall: 0.0586
2026-05-18 05:54:29,342 - optuna.study.study - INFO - Trial 103 finished with value: 0.0585793704676246 and parameters: {'n_layers': 1, 'embedding_dim': 32, 'lr': 0.0013652024173019684, 'lambda_val': 0.01595467225604074, 'batch_size': 3821, 'optimizer': 'Adam'}. Best is trial 57 with value: 0.06827998896428639.
2026-05-18 05:54:43,327 - optuna.study._optimize - INFO - Trial 104 pruned. 
2026-05-18 05:54:57,036 - experiment_functions - INFO - Early stopping at epoch 900. Best Recall: 0.0560
2026-05-18 05:54:57,125 - optuna.study.study - INFO - Trial 105 finished with value: 0.05601618127771843 and parameters: {'n_layers': 1, 'embedding_dim': 128, 'lr': 0.0010401225673456506, 'lambda_val': 0.011094813149260016, 'batch_size': 1046, 'optimizer': 'Adam'}. Best is trial 57 with value: 0.06827998896428639.
2026-05-18 05:55:53,816 - optuna.study.study - INFO - Trial 106 finished with value: 0.0752064597146643 and parameters: {'n_layers': 1, 'embedding_dim': 32, 'lr': 0.000533671509395812, 'lambda_val': 0.006903589022203319, 'batch_size': 776, 'optimizer': 'RMSprop'}. Best is trial 106 with value: 0.0752064597146643.
2026-05-18 05:56:59,495 - experiment_functions - INFO - Early stopping at epoch 500. Best Recall: 0.0050
2026-05-18 05:56:59,642 - optuna.study.study - INFO - Trial 107 finished with value: 0.0050389958674631865 and parameters: {'n_layers': 1, 'embedding_dim': 32, 'lr': 0.00024552564157581533, 'lambda_val': 0.007474769392022287, 'batch_size': 798, 'optimizer': 'RMSprop'}. Best is trial 106 with value: 0.0752064597146643.
2026-05-18 05:57:07,000 - experiment_functions - INFO - Early stopping at epoch 500. Best Recall: 0.0052
2026-05-18 05:57:07,089 - optuna.study.study - INFO - Trial 108 finished with value: 0.005224978162906397 and parameters: {'n_layers': 1, 'embedding_dim': 32, 'lr': 0.0005054161980760638, 'lambda_val': 0.01578541626509239, 'batch_size': 598, 'optimizer': 'RMSprop'}. Best is trial 106 with value: 0.0752064597146643.
2026-05-18 05:57:25,926 - experiment_functions - INFO - Early stopping at epoch 1300. Best Recall: 0.0687
2026-05-18 05:57:26,027 - optuna.study.study - INFO - Trial 109 finished with value: 0.06873968329277579 and parameters: {'n_layers': 1, 'embedding_dim': 32, 'lr': 0.0008263890236755822, 'lambda_val': 0.005910471025374888, 'batch_size': 998, 'optimizer': 'RMSprop'}. Best is trial 106 with value: 0.0752064597146643.
2026-05-18 05:57:40,003 - optuna.study._optimize - INFO - Trial 110 pruned. 
2026-05-18 05:57:57,272 - experiment_functions - INFO - Early stopping at epoch 1200. Best Recall: 0.0668
2026-05-18 05:57:57,371 - optuna.study.study - INFO - Trial 111 finished with value: 0.06683219346861222 and parameters: {'n_layers': 1, 'embedding_dim': 32, 'lr': 0.0008341990267549137, 'lambda_val': 0.006465501974430509, 'batch_size': 1017, 'optimizer': 'RMSprop'}. Best is trial 106 with value: 0.0752064597146643.
2026-05-18 05:58:13,487 - optuna.study._optimize - INFO - Trial 112 pruned. 
2026-05-18 05:58:38,481 - optuna.study._optimize - INFO - Trial 113 pruned. 
2026-05-18 05:58:54,831 - experiment_functions - INFO - Early stopping at epoch 1100. Best Recall: 0.0581
2026-05-18 05:58:54,966 - optuna.study.study - INFO - Trial 114 finished with value: 0.05806084854126124 and parameters: {'n_layers': 1, 'embedding_dim': 32, 'lr': 0.0006491598572201333, 'lambda_val': 0.007031974303279552, 'batch_size': 2390, 'optimizer': 'RMSprop'}. Best is trial 106 with value: 0.0752064597146643.
2026-05-18 05:59:06,934 - experiment_functions - INFO - Early stopping at epoch 800. Best Recall: 0.0636
2026-05-18 05:59:07,046 - optuna.study.study - INFO - Trial 115 finished with value: 0.06364604202801546 and parameters: {'n_layers': 1, 'embedding_dim': 32, 'lr': 0.0011052832408020396, 'lambda_val': 0.024673044958662134, 'batch_size': 858, 'optimizer': 'RMSprop'}. Best is trial 106 with value: 0.0752064597146643.
2026-05-18 05:59:27,955 - experiment_functions - INFO - Early stopping at epoch 1250. Best Recall: 0.0685
2026-05-18 05:59:28,025 - optuna.study.study - INFO - Trial 116 finished with value: 0.06848666281812776 and parameters: {'n_layers': 1, 'embedding_dim': 32, 'lr': 0.0008221857939173425, 'lambda_val': 0.012788640552176015, 'batch_size': 772, 'optimizer': 'RMSprop'}. Best is trial 106 with value: 0.0752064597146643.
2026-05-18 05:59:42,229 - optuna.study._optimize - INFO - Trial 117 pruned. 
2026-05-18 05:59:55,530 - experiment_functions - INFO - Early stopping at epoch 950. Best Recall: 0.0573
2026-05-18 05:59:55,600 - optuna.study.study - INFO - Trial 118 finished with value: 0.05725448296154958 and parameters: {'n_layers': 1, 'embedding_dim': 32, 'lr': 0.000781917752651623, 'lambda_val': 0.014006555111172183, 'batch_size': 1398, 'optimizer': 'RMSprop'}. Best is trial 106 with value: 0.0752064597146643.
2026-05-18 06:00:11,577 - optuna.study._optimize - INFO - Trial 119 pruned. 
2026-05-18 06:00:29,211 - experiment_functions - INFO - Early stopping at epoch 550. Best Recall: 0.0289
2026-05-18 06:00:29,318 - optuna.study.study - INFO - Trial 120 finished with value: 0.028854343368253148 and parameters: {'n_layers': 3, 'embedding_dim': 32, 'lr': 0.0016349434963351982, 'lambda_val': 0.008734025024104471, 'batch_size': 1089, 'optimizer': 'RMSprop'}. Best is trial 106 with value: 0.0752064597146643.
2026-05-18 06:00:45,295 - experiment_functions - INFO - Early stopping at epoch 1050. Best Recall: 0.0708
2026-05-18 06:00:45,384 - optuna.study.study - INFO - Trial 121 finished with value: 0.07081389115460582 and parameters: {'n_layers': 1, 'embedding_dim': 32, 'lr': 0.0009229166198010673, 'lambda_val': 0.018380245970812312, 'batch_size': 762, 'optimizer': 'RMSprop'}. Best is trial 106 with value: 0.0752064597146643.
2026-05-18 06:01:14,783 - experiment_functions - INFO - Early stopping at epoch 1950. Best Recall: 0.0692
2026-05-18 06:01:14,927 - optuna.study.study - INFO - Trial 122 finished with value: 0.06919499179864749 and parameters: {'n_layers': 1, 'embedding_dim': 32, 'lr': 0.0006321853061490669, 'lambda_val': 0.013624509820625273, 'batch_size': 777, 'optimizer': 'RMSprop'}. Best is trial 106 with value: 0.0752064597146643.
2026-05-18 06:01:40,030 - experiment_functions - INFO - Early stopping at epoch 1750. Best Recall: 0.0708
2026-05-18 06:01:40,120 - optuna.study.study - INFO - Trial 123 finished with value: 0.07082174330522234 and parameters: {'n_layers': 1, 'embedding_dim': 32, 'lr': 0.0006408057968916101, 'lambda_val': 0.012530116640337539, 'batch_size': 804, 'optimizer': 'RMSprop'}. Best is trial 106 with value: 0.0752064597146643.
2026-05-18 06:01:59,793 - experiment_functions - INFO - Early stopping at epoch 1350. Best Recall: 0.0653
2026-05-18 06:01:59,938 - optuna.study.study - INFO - Trial 124 finished with value: 0.06534839197081266 and parameters: {'n_layers': 1, 'embedding_dim': 32, 'lr': 0.0006404787602006236, 'lambda_val': 0.03002944749752943, 'batch_size': 808, 'optimizer': 'RMSprop'}. Best is trial 106 with value: 0.0752064597146643.
2026-05-18 06:02:14,662 - optuna.study._optimize - INFO - Trial 125 pruned. 
2026-05-18 06:02:24,585 - experiment_functions - INFO - Early stopping at epoch 650. Best Recall: 0.0535
2026-05-18 06:02:24,686 - optuna.study.study - INFO - Trial 126 finished with value: 0.053455809493166424 and parameters: {'n_layers': 1, 'embedding_dim': 64, 'lr': 0.001446829477900561, 'lambda_val': 0.020567491547658547, 'batch_size': 910, 'optimizer': 'RMSprop'}. Best is trial 106 with value: 0.0752064597146643.
2026-05-18 06:02:42,219 - experiment_functions - INFO - Early stopping at epoch 1100. Best Recall: 0.0590
2026-05-18 06:02:42,479 - optuna.study.study - INFO - Trial 127 finished with value: 0.05903138737162581 and parameters: {'n_layers': 1, 'embedding_dim': 128, 'lr': 0.0006948928617022288, 'lambda_val': 0.016713552292989344, 'batch_size': 647, 'optimizer': 'RMSprop'}. Best is trial 106 with value: 0.0752064597146643.
2026-05-18 06:02:54,258 - experiment_functions - INFO - Early stopping at epoch 500. Best Recall: 0.0053
2026-05-18 06:02:55,024 - optuna.study.study - INFO - Trial 128 finished with value: 0.005292626769967489 and parameters: {'n_layers': 1, 'embedding_dim': 32, 'lr': 0.0002899996285010434, 'lambda_val': 0.03930208782664983, 'batch_size': 786, 'optimizer': 'RMSprop'}. Best is trial 106 with value: 0.0752064597146643.
2026-05-18 06:03:07,009 - experiment_functions - INFO - Early stopping at epoch 800. Best Recall: 0.0647
2026-05-18 06:03:07,099 - optuna.study.study - INFO - Trial 129 finished with value: 0.0647324370114 and parameters: {'n_layers': 1, 'embedding_dim': 32, 'lr': 0.0012066620710909565, 'lambda_val': 0.012582081390316288, 'batch_size': 873, 'optimizer': 'RMSprop'}. Best is trial 106 with value: 0.0752064597146643.
2026-05-18 06:03:29,717 - experiment_functions - INFO - Early stopping at epoch 1550. Best Recall: 0.0657
2026-05-18 06:03:29,816 - optuna.study.study - INFO - Trial 130 finished with value: 0.06565107323789127 and parameters: {'n_layers': 1, 'embedding_dim': 32, 'lr': 0.0008295133764279892, 'lambda_val': 0.008550290309416965, 'batch_size': 605, 'optimizer': 'RMSprop'}. Best is trial 106 with value: 0.0752064597146643.
2026-05-18 06:03:50,655 - experiment_functions - INFO - Early stopping at epoch 1450. Best Recall: 0.0646
2026-05-18 06:03:50,744 - optuna.study.study - INFO - Trial 131 finished with value: 0.06464537427507 and parameters: {'n_layers': 1, 'embedding_dim': 32, 'lr': 0.0008086090655635571, 'lambda_val': 0.0046766764526742065, 'batch_size': 1024, 'optimizer': 'RMSprop'}. Best is trial 106 with value: 0.0752064597146643.
2026-05-18 06:04:07,703 - experiment_functions - INFO - Early stopping at epoch 1150. Best Recall: 0.0613
2026-05-18 06:04:07,805 - optuna.study.study - INFO - Trial 132 finished with value: 0.061319964730351735 and parameters: {'n_layers': 1, 'embedding_dim': 32, 'lr': 0.0009496298021484078, 'lambda_val': 0.011386109446912113, 'batch_size': 738, 'optimizer': 'RMSprop'}. Best is trial 106 with value: 0.0752064597146643.
2026-05-18 06:04:30,516 - experiment_functions - INFO - Early stopping at epoch 1600. Best Recall: 0.0643
2026-05-18 06:04:30,615 - optuna.study.study - INFO - Trial 133 finished with value: 0.06426168816147237 and parameters: {'n_layers': 1, 'embedding_dim': 32, 'lr': 0.0005758207101983215, 'lambda_val': 0.016571344606606368, 'batch_size': 987, 'optimizer': 'RMSprop'}. Best is trial 106 with value: 0.0752064597146643.
2026-05-18 06:04:38,514 - experiment_functions - INFO - Early stopping at epoch 500. Best Recall: 0.0053
2026-05-18 06:04:38,614 - optuna.study.study - INFO - Trial 134 finished with value: 0.005347292517101698 and parameters: {'n_layers': 1, 'embedding_dim': 32, 'lr': 0.0004434986812566684, 'lambda_val': 0.024463034745059162, 'batch_size': 513, 'optimizer': 'RMSprop'}. Best is trial 106 with value: 0.0752064597146643.
2026-05-18 06:05:10,517 - experiment_functions - INFO - Early stopping at epoch 2150. Best Recall: 0.0720
2026-05-18 06:05:10,608 - optuna.study.study - INFO - Trial 135 finished with value: 0.07202693733918519 and parameters: {'n_layers': 1, 'embedding_dim': 32, 'lr': 0.0006726909917539836, 'lambda_val': 0.00621604240186326, 'batch_size': 809, 'optimizer': 'RMSprop'}. Best is trial 106 with value: 0.0752064597146643.
2026-05-18 06:05:20,450 - experiment_functions - INFO - Early stopping at epoch 650. Best Recall: 0.0604
2026-05-18 06:05:20,541 - optuna.study.study - INFO - Trial 136 finished with value: 0.06040806325496748 and parameters: {'n_layers': 1, 'embedding_dim': 32, 'lr': 0.002011024120279802, 'lambda_val': 0.0037755384180980303, 'batch_size': 759, 'optimizer': 'RMSprop'}. Best is trial 106 with value: 0.0752064597146643.
2026-05-18 06:05:38,037 - experiment_functions - INFO - Early stopping at epoch 1050. Best Recall: 0.0652
2026-05-18 06:05:38,182 - optuna.study.study - INFO - Trial 137 finished with value: 0.0652197900427479 and parameters: {'n_layers': 1, 'embedding_dim': 32, 'lr': 0.0011460390814887521, 'lambda_val': 0.007910559302140376, 'batch_size': 677, 'optimizer': 'RMSprop'}. Best is trial 106 with value: 0.0752064597146643.
2026-05-18 06:06:03,510 - experiment_functions - INFO - Early stopping at epoch 1700. Best Recall: 0.0734
2026-05-18 06:06:03,618 - optuna.study.study - INFO - Trial 138 finished with value: 0.07341653941857787 and parameters: {'n_layers': 1, 'embedding_dim': 32, 'lr': 0.0006393969224258273, 'lambda_val': 0.01314604431610878, 'batch_size': 849, 'optimizer': 'RMSprop'}. Best is trial 106 with value: 0.0752064597146643.
2026-05-18 06:06:25,283 - experiment_functions - INFO - Early stopping at epoch 1600. Best Recall: 0.0730
