2026-05-17 20:09:46,107 - optuna.study.study - INFO - Trial 196 finished with value: 0.09405428317058216 and parameters: {'n_layers': 1, 'embedding_dim': 64, 'lr': 0.0006156224905653382, 'lambda_val': 1.4595734548217922e-06, 'batch_size': 629, 'optimizer': 'RMSprop'}. Best is trial 150 with value: 0.09943758933682462.
2026-05-17 20:10:02,260 - optuna.study._optimize - INFO - Trial 197 pruned. 
2026-05-17 20:10:22,229 - optuna.study._optimize - INFO - Trial 198 pruned. 
2026-05-17 20:10:37,886 - optuna.study._optimize - INFO - Trial 199 pruned. 
2026-05-17 20:10:53,223 - optuna.study._optimize - INFO - Trial 200 pruned. 
2026-05-17 20:11:09,593 - optuna.study._optimize - INFO - Trial 201 pruned. 
2026-05-17 20:11:28,195 - optuna.study._optimize - INFO - Trial 202 pruned. 
2026-05-17 20:11:43,502 - experiment_functions - INFO - Early stopping at epoch 900. Best Recall: 0.0824
2026-05-17 20:11:43,593 - optuna.study.study - INFO - Trial 203 finished with value: 0.08235097412524052 and parameters: {'n_layers': 1, 'embedding_dim': 64, 'lr': 0.0009573869933532413, 'lambda_val': 2.1166446290560094e-06, 'batch_size': 867, 'optimizer': 'RMSprop'}. Best is trial 150 with value: 0.09943758933682462.
2026-05-17 20:12:24,322 - experiment_functions - INFO - Early stopping at epoch 2550. Best Recall: 0.0953
2026-05-17 20:12:24,423 - optuna.study.study - INFO - Trial 204 finished with value: 0.09525009949562725 and parameters: {'n_layers': 1, 'embedding_dim': 64, 'lr': 0.0006268093285943004, 'lambda_val': 1.5065597346278294e-06, 'batch_size': 621, 'optimizer': 'RMSprop'}. Best is trial 150 with value: 0.09943758933682462.
2026-05-17 20:12:39,726 - optuna.study._optimize - INFO - Trial 205 pruned. 
2026-05-17 20:13:15,783 - optuna.study._optimize - INFO - Trial 206 pruned. 
2026-05-17 20:13:31,105 - optuna.study._optimize - INFO - Trial 207 pruned. 
2026-05-17 20:14:24,019 - experiment_functions - INFO - Early stopping at epoch 3400. Best Recall: 0.0980
2026-05-17 20:14:24,153 - optuna.study.study - INFO - Trial 208 finished with value: 0.09803612738815687 and parameters: {'n_layers': 1, 'embedding_dim': 64, 'lr': 0.0005861385918814249, 'lambda_val': 1.471486525978642e-06, 'batch_size': 635, 'optimizer': 'RMSprop'}. Best is trial 150 with value: 0.09943758933682462.
2026-05-17 20:14:57,045 - experiment_functions - INFO - Early stopping at epoch 2100. Best Recall: 0.0942
2026-05-17 20:14:57,201 - optuna.study.study - INFO - Trial 209 finished with value: 0.09418220714735875 and parameters: {'n_layers': 1, 'embedding_dim': 64, 'lr': 0.0005587913203942195, 'lambda_val': 1.0107563793431127e-06, 'batch_size': 940, 'optimizer': 'RMSprop'}. Best is trial 150 with value: 0.09943758933682462.
2026-05-17 20:15:22,206 - experiment_functions - INFO - Early stopping at epoch 1600. Best Recall: 0.0921
2026-05-17 20:15:22,308 - optuna.study.study - INFO - Trial 210 finished with value: 0.0920852903545754 and parameters: {'n_layers': 1, 'embedding_dim': 64, 'lr': 0.0006126684415476122, 'lambda_val': 1.165689907898115e-06, 'batch_size': 938, 'optimizer': 'RMSprop'}. Best is trial 150 with value: 0.09943758933682462.
2026-05-17 20:15:46,964 - optuna.study._optimize - INFO - Trial 211 pruned. 
2026-05-17 20:16:02,560 - optuna.study._optimize - INFO - Trial 212 pruned. 
2026-05-17 20:16:27,309 - experiment_functions - INFO - Early stopping at epoch 1550. Best Recall: 0.0936
2026-05-17 20:16:27,400 - optuna.study.study - INFO - Trial 213 finished with value: 0.09357825803671566 and parameters: {'n_layers': 1, 'embedding_dim': 64, 'lr': 0.0006662166002359096, 'lambda_val': 1.432129280308502e-06, 'batch_size': 850, 'optimizer': 'RMSprop'}. Best is trial 150 with value: 0.09943758933682462.
2026-05-17 20:16:45,286 - optuna.study._optimize - INFO - Trial 214 pruned. 
2026-05-17 20:17:14,031 - optuna.study._optimize - INFO - Trial 215 pruned. 
2026-05-17 20:17:29,286 - optuna.study._optimize - INFO - Trial 216 pruned. 
2026-05-17 20:17:44,573 - optuna.study._optimize - INFO - Trial 217 pruned. 
2026-05-17 20:18:04,267 - experiment_functions - INFO - Early stopping at epoch 600. Best Recall: 0.0626
2026-05-17 20:18:04,367 - optuna.study.study - INFO - Trial 218 finished with value: 0.06260334258288604 and parameters: {'n_layers': 1, 'embedding_dim': 256, 'lr': 0.0010676942015638126, 'lambda_val': 1.2778030414710899e-06, 'batch_size': 3821, 'optimizer': 'RMSprop'}. Best is trial 150 with value: 0.09943758933682462.
2026-05-17 20:18:21,562 - optuna.study._optimize - INFO - Trial 219 pruned. 
2026-05-17 20:18:39,936 - experiment_functions - INFO - Early stopping at epoch 1100. Best Recall: 0.0873
2026-05-17 20:18:40,046 - optuna.study.study - INFO - Trial 220 finished with value: 0.08731745075518342 and parameters: {'n_layers': 1, 'embedding_dim': 64, 'lr': 0.0008561870107848591, 'lambda_val': 1.0139563664855844e-06, 'batch_size': 847, 'optimizer': 'RMSprop'}. Best is trial 150 with value: 0.09943758933682462.
2026-05-17 20:19:11,037 - experiment_functions - INFO - Early stopping at epoch 2000. Best Recall: 0.0967
2026-05-17 20:19:11,127 - optuna.study.study - INFO - Trial 221 finished with value: 0.0966525651622393 and parameters: {'n_layers': 1, 'embedding_dim': 64, 'lr': 0.0006468643312302403, 'lambda_val': 1.0064041929960078e-06, 'batch_size': 766, 'optimizer': 'RMSprop'}. Best is trial 150 with value: 0.09943758933682462.
2026-05-17 20:19:26,907 - optuna.study._optimize - INFO - Trial 222 pruned. 
2026-05-17 20:19:42,634 - optuna.study._optimize - INFO - Trial 223 pruned. 
2026-05-17 20:20:11,166 - experiment_functions - INFO - Early stopping at epoch 1800. Best Recall: 0.0935
2026-05-17 20:20:11,256 - optuna.study.study - INFO - Trial 224 finished with value: 0.09345946956810655 and parameters: {'n_layers': 1, 'embedding_dim': 64, 'lr': 0.0006743609085121083, 'lambda_val': 1.5921087258992154e-06, 'batch_size': 653, 'optimizer': 'RMSprop'}. Best is trial 150 with value: 0.09943758933682462.
2026-05-17 20:20:43,928 - experiment_functions - INFO - Early stopping at epoch 2100. Best Recall: 0.0933
2026-05-17 20:20:44,038 - optuna.study.study - INFO - Trial 225 finished with value: 0.09333084168584216 and parameters: {'n_layers': 1, 'embedding_dim': 64, 'lr': 0.0006597293475919668, 'lambda_val': 0.00017761395170611232, 'batch_size': 619, 'optimizer': 'RMSprop'}. Best is trial 150 with value: 0.09943758933682462.
2026-05-17 20:21:00,016 - optuna.study._optimize - INFO - Trial 226 pruned. 
2026-05-17 20:21:15,790 - optuna.study._optimize - INFO - Trial 227 pruned. 
2026-05-17 20:21:30,495 - experiment_functions - INFO - Early stopping at epoch 800. Best Recall: 0.0501
2026-05-17 20:21:30,585 - optuna.study.study - INFO - Trial 228 finished with value: 0.050130095183930454 and parameters: {'n_layers': 3, 'embedding_dim': 64, 'lr': 0.0006201366882360331, 'lambda_val': 0.00041717539152257244, 'batch_size': 590, 'optimizer': 'RMSprop'}. Best is trial 150 with value: 0.09943758933682462.
2026-05-17 20:21:45,940 - optuna.study._optimize - INFO - Trial 229 pruned. 
2026-05-17 20:22:04,605 - optuna.study._optimize - INFO - Trial 230 pruned. 
2026-05-17 20:22:20,175 - optuna.study._optimize - INFO - Trial 231 pruned. 
2026-05-17 20:22:36,676 - optuna.study._optimize - INFO - Trial 232 pruned. 
2026-05-17 20:22:45,099 - experiment_functions - INFO - Early stopping at epoch 500. Best Recall: 0.0046
2026-05-17 20:22:45,209 - optuna.study.study - INFO - Trial 233 finished with value: 0.004635279481224547 and parameters: {'n_layers': 1, 'embedding_dim': 64, 'lr': 0.0005379342692974627, 'lambda_val': 1.296968249862255e-06, 'batch_size': 686, 'optimizer': 'SGD'}. Best is trial 150 with value: 0.09943758933682462.
2026-05-17 20:23:27,954 - experiment_functions - INFO - Early stopping at epoch 2150. Best Recall: 0.0927
2026-05-17 20:23:28,072 - optuna.study.study - INFO - Trial 234 finished with value: 0.09274785702826789 and parameters: {'n_layers': 1, 'embedding_dim': 64, 'lr': 0.0006538722948870361, 'lambda_val': 1.2345249127499195e-06, 'batch_size': 588, 'optimizer': 'RMSprop'}. Best is trial 150 with value: 0.09943758933682462.
2026-05-17 20:23:52,533 - experiment_functions - INFO - Early stopping at epoch 1550. Best Recall: 0.0921
2026-05-17 20:23:52,623 - optuna.study.study - INFO - Trial 235 finished with value: 0.09207440309158546 and parameters: {'n_layers': 1, 'embedding_dim': 64, 'lr': 0.0007554725851188179, 'lambda_val': 1.0175546254693783e-06, 'batch_size': 601, 'optimizer': 'RMSprop'}. Best is trial 150 with value: 0.09943758933682462.
2026-05-17 20:24:13,736 - experiment_functions - INFO - Early stopping at epoch 1350. Best Recall: 0.0904
2026-05-17 20:24:13,837 - optuna.study.study - INFO - Trial 236 finished with value: 0.09038224543085806 and parameters: {'n_layers': 1, 'embedding_dim': 64, 'lr': 0.0008053531738575378, 'lambda_val': 1.2577762929269488e-06, 'batch_size': 576, 'optimizer': 'RMSprop'}. Best is trial 150 with value: 0.09943758933682462.
2026-05-17 20:24:40,135 - optuna.study._optimize - INFO - Trial 237 pruned. 
2026-05-17 20:24:57,313 - experiment_functions - INFO - Early stopping at epoch 1100. Best Recall: 0.0871
2026-05-17 20:24:57,404 - optuna.study.study - INFO - Trial 238 finished with value: 0.08710551350145261 and parameters: {'n_layers': 1, 'embedding_dim': 64, 'lr': 0.0008881844750650793, 'lambda_val': 1.0237412238101578e-06, 'batch_size': 526, 'optimizer': 'RMSprop'}. Best is trial 150 with value: 0.09943758933682462.
2026-05-17 20:25:12,928 - optuna.study._optimize - INFO - Trial 239 pruned. 
2026-05-17 20:25:23,090 - experiment_functions - INFO - Early stopping at epoch 650. Best Recall: 0.0055
2026-05-17 20:25:23,347 - optuna.study.study - INFO - Trial 240 finished with value: 0.00545781687004207 and parameters: {'n_layers': 1, 'embedding_dim': 96, 'lr': 3.6964842721122296e-05, 'lambda_val': 0.00015925684501783954, 'batch_size': 712, 'optimizer': 'RMSprop'}. Best is trial 150 with value: 0.09943758933682462.
2026-05-17 20:26:04,594 - optuna.study._optimize - INFO - Trial 241 pruned. 
2026-05-17 20:26:21,675 - optuna.study._optimize - INFO - Trial 242 pruned. 
2026-05-17 20:26:58,403 - experiment_functions - INFO - Early stopping at epoch 2400. Best Recall: 0.0962
2026-05-17 20:26:58,492 - optuna.study.study - INFO - Trial 243 finished with value: 0.0961802381862113 and parameters: {'n_layers': 1, 'embedding_dim': 64, 'lr': 0.0005974187252381348, 'lambda_val': 1.7669791422672e-06, 'batch_size': 694, 'optimizer': 'RMSprop'}. Best is trial 150 with value: 0.09943758933682462.
2026-05-17 20:27:14,241 - optuna.study._optimize - INFO - Trial 244 pruned. 
2026-05-17 20:27:37,021 - optuna.study._optimize - INFO - Trial 245 pruned. 
2026-05-17 20:27:54,557 - optuna.study._optimize - INFO - Trial 246 pruned. 
2026-05-17 20:28:12,997 - experiment_functions - INFO - Early stopping at epoch 1150. Best Recall: 0.0916
2026-05-17 20:28:13,087 - optuna.study.study - INFO - Trial 247 finished with value: 0.09156097128892686 and parameters: {'n_layers': 1, 'embedding_dim': 64, 'lr': 0.000845809804561918, 'lambda_val': 1.488196475389508e-06, 'batch_size': 590, 'optimizer': 'RMSprop'}. Best is trial 150 with value: 0.09943758933682462.
2026-05-17 20:28:42,212 - experiment_functions - INFO - Early stopping at epoch 1850. Best Recall: 0.0961
2026-05-17 20:28:42,387 - optuna.study.study - INFO - Trial 248 finished with value: 0.09612122843544914 and parameters: {'n_layers': 1, 'embedding_dim': 64, 'lr': 0.0006317050632319858, 'lambda_val': 2.0386598482960737e-06, 'batch_size': 671, 'optimizer': 'RMSprop'}. Best is trial 150 with value: 0.09943758933682462.
2026-05-17 20:28:55,638 - experiment_functions - INFO - Early stopping at epoch 800. Best Recall: 0.0803
2026-05-17 20:28:55,737 - optuna.study.study - INFO - Trial 249 finished with value: 0.08030376807926032 and parameters: {'n_layers': 1, 'embedding_dim': 64, 'lr': 0.0010652257845223544, 'lambda_val': 2.1012552706416718e-06, 'batch_size': 794, 'optimizer': 'RMSprop'}. Best is trial 150 with value: 0.09943758933682462.
2026-05-17 20:29:11,201 - optuna.study._optimize - INFO - Trial 250 pruned. 
2026-05-17 20:29:27,018 - optuna.study._optimize - INFO - Trial 251 pruned. 
2026-05-17 20:29:43,034 - optuna.study._optimize - INFO - Trial 252 pruned. 
2026-05-17 20:30:03,612 - optuna.study._optimize - INFO - Trial 253 pruned. 
2026-05-17 20:30:23,333 - optuna.study._optimize - INFO - Trial 254 pruned. 
2026-05-17 20:30:38,279 - optuna.study._optimize - INFO - Trial 255 pruned. 
2026-05-17 20:30:54,443 - optuna.study._optimize - INFO - Trial 256 pruned. 
2026-05-17 20:31:10,292 - optuna.study._optimize - INFO - Trial 257 pruned. 
2026-05-17 20:31:31,688 - experiment_functions - INFO - Early stopping at epoch 1350. Best Recall: 0.0916
2026-05-17 20:31:31,799 - optuna.study.study - INFO - Trial 258 finished with value: 0.0916014988897408 and parameters: {'n_layers': 1, 'embedding_dim': 64, 'lr': 0.0007451023772827369, 'lambda_val': 1.973113353566725e-06, 'batch_size': 851, 'optimizer': 'RMSprop'}. Best is trial 150 with value: 0.09943758933682462.
2026-05-17 20:31:40,322 - experiment_functions - INFO - Early stopping at epoch 500. Best Recall: 0.0049
2026-05-17 20:31:40,412 - optuna.study.study - INFO - Trial 259 finished with value: 0.004944815567345694 and parameters: {'n_layers': 1, 'embedding_dim': 64, 'lr': 0.0005497446361040154, 'lambda_val': 0.0007236641099889965, 'batch_size': 657, 'optimizer': 'SGD'}. Best is trial 150 with value: 0.09943758933682462.
2026-05-17 20:31:54,387 - experiment_functions - INFO - Early stopping at epoch 800. Best Recall: 0.0731
2026-05-17 20:31:54,477 - optuna.study.study - INFO - Trial 260 finished with value: 0.07313704585769579 and parameters: {'n_layers': 2, 'embedding_dim': 64, 'lr': 0.0006531668877842499, 'lambda_val': 3.49683353669644e-05, 'batch_size': 741, 'optimizer': 'RMSprop'}. Best is trial 150 with value: 0.09943758933682462.
2026-05-17 20:32:12,192 - experiment_functions - INFO - Early stopping at epoch 950. Best Recall: 0.0704
2026-05-17 20:32:12,292 - optuna.study.study - INFO - Trial 261 finished with value: 0.07038784950325229 and parameters: {'n_layers': 1, 'embedding_dim': 256, 'lr': 0.0008225607950763197, 'lambda_val': 2.6623804744172986e-06, 'batch_size': 579, 'optimizer': 'RMSprop'}. Best is trial 150 with value: 0.09943758933682462.
2026-05-17 20:32:28,397 - optuna.study._optimize - INFO - Trial 262 pruned. 
2026-05-17 20:32:44,029 - optuna.study._optimize - INFO - Trial 263 pruned. 
2026-05-17 20:32:58,782 - optuna.study._optimize - INFO - Trial 264 pruned. 
2026-05-17 20:33:24,479 - experiment_functions - INFO - Early stopping at epoch 1650. Best Recall: 0.0964
2026-05-17 20:33:24,568 - optuna.study.study - INFO - Trial 265 finished with value: 0.09642788265780557 and parameters: {'n_layers': 1, 'embedding_dim': 64, 'lr': 0.0007084266241286497, 'lambda_val': 1.2654523734309857e-06, 'batch_size': 602, 'optimizer': 'RMSprop'}. Best is trial 150 with value: 0.09943758933682462.
2026-05-17 20:33:53,441 - experiment_functions - INFO - Early stopping at epoch 1900. Best Recall: 0.0929
2026-05-17 20:33:53,531 - optuna.study.study - INFO - Trial 266 finished with value: 0.09292397101585886 and parameters: {'n_layers': 1, 'embedding_dim': 64, 'lr': 0.0006091180913366409, 'lambda_val': 1.4582398078171259e-06, 'batch_size': 950, 'optimizer': 'RMSprop'}. Best is trial 150 with value: 0.09943758933682462.
2026-05-17 20:34:06,951 - experiment_functions - INFO - Early stopping at epoch 800. Best Recall: 0.0862
2026-05-17 20:34:07,029 - optuna.study.study - INFO - Trial 267 finished with value: 0.08619995301663262 and parameters: {'n_layers': 1, 'embedding_dim': 64, 'lr': 0.0011620387394143978, 'lambda_val': 1.915845536824912e-06, 'batch_size': 714, 'optimizer': 'RMSprop'}. Best is trial 150 with value: 0.09943758933682462.
2026-05-17 20:34:21,745 - optuna.study._optimize - INFO - Trial 268 pruned. 
2026-05-17 20:34:37,494 - experiment_functions - INFO - Early stopping at epoch 950. Best Recall: 0.0862
2026-05-17 20:34:37,615 - optuna.study.study - INFO - Trial 269 finished with value: 0.08623685224841238 and parameters: {'n_layers': 1, 'embedding_dim': 64, 'lr': 0.0008973658036118674, 'lambda_val': 2.922819573448753e-06, 'batch_size': 820, 'optimizer': 'RMSprop'}. Best is trial 150 with value: 0.09943758933682462.
2026-05-17 20:35:13,224 - experiment_functions - INFO - Early stopping at epoch 2150. Best Recall: 0.0940
2026-05-17 20:35:13,326 - optuna.study.study - INFO - Trial 270 finished with value: 0.09401707622927685 and parameters: {'n_layers': 1, 'embedding_dim': 96, 'lr': 0.000579141550117187, 'lambda_val': 2.1922875836777053e-06, 'batch_size': 650, 'optimizer': 'RMSprop'}. Best is trial 150 with value: 0.09943758933682462.
2026-05-17 20:35:29,496 - optuna.study._optimize - INFO - Trial 271 pruned. 
2026-05-17 20:35:45,343 - optuna.study._optimize - INFO - Trial 272 pruned. 
2026-05-17 20:36:00,450 - experiment_functions - INFO - Early stopping at epoch 950. Best Recall: 0.0668
2026-05-17 20:36:00,601 - optuna.study.study - INFO - Trial 273 finished with value: 0.06683529873318862 and parameters: {'n_layers': 1, 'embedding_dim': 64, 'lr': 0.000612241225937421, 'lambda_val': 1.3980793783833995e-06, 'batch_size': 3666, 'optimizer': 'RMSprop'}. Best is trial 150 with value: 0.09943758933682462.
2026-05-17 20:36:17,105 - optuna.study._optimize - INFO - Trial 274 pruned. 
2026-05-17 20:36:30,907 - experiment_functions - INFO - Early stopping at epoch 650. Best Recall: 0.0378
2026-05-17 20:36:30,997 - optuna.study.study - INFO - Trial 275 finished with value: 0.0377937878941585 and parameters: {'n_layers': 4, 'embedding_dim': 96, 'lr': 0.00068938084099851, 'lambda_val': 0.0002686814848299885, 'batch_size': 683, 'optimizer': 'RMSprop'}. Best is trial 150 with value: 0.09943758933682462.
2026-05-17 20:36:46,695 - optuna.study._optimize - INFO - Trial 276 pruned. 
2026-05-17 20:37:03,755 - optuna.study._optimize - INFO - Trial 277 pruned. 
2026-05-17 20:37:18,439 - optuna.study._optimize - INFO - Trial 278 pruned. 
2026-05-17 20:37:26,127 - experiment_functions - INFO - Early stopping at epoch 500. Best Recall: 0.0048
2026-05-17 20:37:26,214 - optuna.study.study - INFO - Trial 279 finished with value: 0.004752533949557577 and parameters: {'n_layers': 1, 'embedding_dim': 64, 'lr': 0.0006287766328176147, 'lambda_val': 1.2268832014835669e-06, 'batch_size': 676, 'optimizer': 'SGD'}. Best is trial 150 with value: 0.09943758933682462.
2026-05-17 20:37:41,635 - experiment_functions - INFO - Early stopping at epoch 950. Best Recall: 0.0852
2026-05-17 20:37:41,725 - optuna.study.study - INFO - Trial 280 finished with value: 0.085170715527783 and parameters: {'n_layers': 1, 'embedding_dim': 64, 'lr': 0.0009242873371719432, 'lambda_val': 2.665419878963455e-06, 'batch_size': 824, 'optimizer': 'RMSprop'}. Best is trial 150 with value: 0.09943758933682462.
2026-05-17 20:37:56,416 - optuna.study._optimize - INFO - Trial 281 pruned. 
2026-05-17 20:38:12,724 - optuna.study._optimize - INFO - Trial 282 pruned. 
2026-05-17 20:38:43,695 - experiment_functions - INFO - Early stopping at epoch 1950. Best Recall: 0.0957
2026-05-17 20:38:43,785 - optuna.study.study - INFO - Trial 283 finished with value: 0.09572267439293422 and parameters: {'n_layers': 1, 'embedding_dim': 64, 'lr': 0.0006982791501337893, 'lambda_val': 1.024897618317961e-06, 'batch_size': 577, 'optimizer': 'RMSprop'}. Best is trial 150 with value: 0.09943758933682462.
2026-05-17 20:39:03,223 - experiment_functions - INFO - Early stopping at epoch 1250. Best Recall: 0.0891
2026-05-17 20:39:03,312 - optuna.study.study - INFO - Trial 284 finished with value: 0.08913141268420989 and parameters: {'n_layers': 1, 'embedding_dim': 64, 'lr': 0.0007623485633209289, 'lambda_val': 1.025931373748761e-06, 'batch_size': 693, 'optimizer': 'RMSprop'}. Best is trial 150 with value: 0.09943758933682462.
2026-05-17 20:39:22,398 - optuna.study._optimize - INFO - Trial 285 pruned. 
2026-05-17 20:39:36,816 - experiment_functions - INFO - Early stopping at epoch 900. Best Recall: 0.0874
2026-05-17 20:39:36,906 - optuna.study.study - INFO - Trial 286 finished with value: 0.08744853232663975 and parameters: {'n_layers': 1, 'embedding_dim': 64, 'lr': 0.0009933293606744188, 'lambda_val': 1.5272521257248114e-06, 'batch_size': 775, 'optimizer': 'RMSprop'}. Best is trial 150 with value: 0.09943758933682462.
2026-05-17 20:39:53,276 - experiment_functions - INFO - Early stopping at epoch 950. Best Recall: 0.0726
2026-05-17 20:39:53,366 - optuna.study.study - INFO - Trial 287 finished with value: 0.07257092579103551 and parameters: {'n_layers': 2, 'embedding_dim': 64, 'lr': 0.0005736517569329538, 'lambda_val': 1.2395611308945803e-06, 'batch_size': 571, 'optimizer': 'RMSprop'}. Best is trial 150 with value: 0.09943758933682462.
2026-05-17 20:40:09,615 - optuna.study._optimize - INFO - Trial 288 pruned. 
2026-05-17 20:40:24,884 - optuna.study._optimize - INFO - Trial 289 pruned. 
2026-05-17 20:40:43,993 - experiment_functions - INFO - Early stopping at epoch 1200. Best Recall: 0.0895
2026-05-17 20:40:44,083 - optuna.study.study - INFO - Trial 290 finished with value: 0.08952916356068416 and parameters: {'n_layers': 1, 'embedding_dim': 64, 'lr': 0.000834666526884783, 'lambda_val': 1.4345515170496791e-06, 'batch_size': 864, 'optimizer': 'RMSprop'}. Best is trial 150 with value: 0.09943758933682462.
2026-05-17 20:41:00,164 - experiment_functions - INFO - Early stopping at epoch 850. Best Recall: 0.0479
2026-05-17 20:41:00,263 - optuna.study.study - INFO - Trial 291 finished with value: 0.04792766691807694 and parameters: {'n_layers': 3, 'embedding_dim': 64, 'lr': 0.0005354658505638555, 'lambda_val': 3.2220151136366044e-06, 'batch_size': 985, 'optimizer': 'RMSprop'}. Best is trial 150 with value: 0.09943758933682462.
2026-05-17 20:41:15,020 - optuna.study._optimize - INFO - Trial 292 pruned. 
