2026-05-19 00:49:54,627 - optuna.study.study - INFO - Trial 118 finished with value: 0.06642846342249159 and parameters: {'n_layers': 1, 'embedding_dim': 96, 'lr': 0.0006479231793346473, 'lambda_val': 0.0004572889779624729, 'batch_size': 719, 'optimizer': 'RMSprop'}. Best is trial 86 with value: 0.07177725012789209.
2026-05-19 00:50:09,142 - optuna.study._optimize - INFO - Trial 119 pruned. 
2026-05-19 00:50:30,505 - optuna.study._optimize - INFO - Trial 120 pruned. 
2026-05-19 00:50:53,355 - experiment_functions - INFO - Early stopping at epoch 1350. Best Recall: 0.0675
2026-05-19 00:50:53,498 - optuna.study.study - INFO - Trial 121 finished with value: 0.0675050212983846 and parameters: {'n_layers': 1, 'embedding_dim': 96, 'lr': 0.0007827894284574522, 'lambda_val': 0.0001910217044464955, 'batch_size': 647, 'optimizer': 'RMSprop'}. Best is trial 86 with value: 0.07177725012789209.
2026-05-19 00:51:14,515 - experiment_functions - INFO - Early stopping at epoch 1450. Best Recall: 0.0674
2026-05-19 00:51:14,618 - optuna.study.study - INFO - Trial 122 finished with value: 0.06743761884159508 and parameters: {'n_layers': 1, 'embedding_dim': 96, 'lr': 0.0007604411828839361, 'lambda_val': 6.4116951790141e-05, 'batch_size': 651, 'optimizer': 'RMSprop'}. Best is trial 86 with value: 0.07177725012789209.
2026-05-19 00:51:29,604 - optuna.study._optimize - INFO - Trial 123 pruned. 
2026-05-19 00:51:43,134 - optuna.study._optimize - INFO - Trial 124 pruned. 
2026-05-19 00:52:12,871 - experiment_functions - INFO - Early stopping at epoch 1550. Best Recall: 0.0647
2026-05-19 00:52:13,645 - optuna.study.study - INFO - Trial 125 finished with value: 0.0647305245221421 and parameters: {'n_layers': 1, 'embedding_dim': 96, 'lr': 0.0008096581429613639, 'lambda_val': 4.2795733043162466e-05, 'batch_size': 633, 'optimizer': 'RMSprop'}. Best is trial 86 with value: 0.07177725012789209.
2026-05-19 00:52:45,289 - experiment_functions - INFO - Early stopping at epoch 2100. Best Recall: 0.0693
2026-05-19 00:52:45,401 - optuna.study.study - INFO - Trial 126 finished with value: 0.06929231361416155 and parameters: {'n_layers': 1, 'embedding_dim': 96, 'lr': 0.0005977993419335034, 'lambda_val': 0.0001270122953161342, 'batch_size': 730, 'optimizer': 'RMSprop'}. Best is trial 86 with value: 0.07177725012789209.
2026-05-19 00:53:35,525 - experiment_functions - INFO - Early stopping at epoch 3350. Best Recall: 0.0714
2026-05-19 00:53:35,671 - optuna.study.study - INFO - Trial 127 finished with value: 0.0714178865078409 and parameters: {'n_layers': 1, 'embedding_dim': 96, 'lr': 0.0005611941916313066, 'lambda_val': 0.0002529694436614734, 'batch_size': 736, 'optimizer': 'RMSprop'}. Best is trial 86 with value: 0.07177725012789209.
2026-05-19 00:54:21,195 - experiment_functions - INFO - Early stopping at epoch 3100. Best Recall: 0.0723
2026-05-19 00:54:21,292 - optuna.study.study - INFO - Trial 128 finished with value: 0.07229790478244166 and parameters: {'n_layers': 1, 'embedding_dim': 96, 'lr': 0.0005439718506072393, 'lambda_val': 0.0003541035281963919, 'batch_size': 741, 'optimizer': 'RMSprop'}. Best is trial 128 with value: 0.07229790478244166.
2026-05-19 00:54:33,110 - experiment_functions - INFO - Early stopping at epoch 750. Best Recall: 0.0401
2026-05-19 00:54:33,218 - optuna.study.study - INFO - Trial 129 finished with value: 0.040109766816860855 and parameters: {'n_layers': 3, 'embedding_dim': 96, 'lr': 0.0005688488739410675, 'lambda_val': 0.0005631696799130753, 'batch_size': 886, 'optimizer': 'RMSprop'}. Best is trial 128 with value: 0.07229790478244166.
2026-05-19 00:54:42,423 - experiment_functions - INFO - Early stopping at epoch 500. Best Recall: 0.0052
2026-05-19 00:54:42,510 - optuna.study.study - INFO - Trial 130 finished with value: 0.005232414428528971 and parameters: {'n_layers': 1, 'embedding_dim': 96, 'lr': 0.0003965485533411035, 'lambda_val': 0.0008763748616549274, 'batch_size': 4079, 'optimizer': 'SGD'}. Best is trial 128 with value: 0.07229790478244166.
2026-05-19 00:55:07,393 - experiment_functions - INFO - Early stopping at epoch 1750. Best Recall: 0.0694
2026-05-19 00:55:07,483 - optuna.study.study - INFO - Trial 131 finished with value: 0.069362764018932 and parameters: {'n_layers': 1, 'embedding_dim': 96, 'lr': 0.0006108673623611096, 'lambda_val': 0.00035483215918519765, 'batch_size': 746, 'optimizer': 'RMSprop'}. Best is trial 128 with value: 0.07229790478244166.
2026-05-19 00:55:21,112 - optuna.study._optimize - INFO - Trial 132 pruned. 
2026-05-19 00:55:40,531 - optuna.study._optimize - INFO - Trial 133 pruned. 
2026-05-19 00:55:53,823 - optuna.study._optimize - INFO - Trial 134 pruned. 
2026-05-19 00:56:07,892 - experiment_functions - INFO - Early stopping at epoch 1000. Best Recall: 0.0614
2026-05-19 00:56:07,981 - optuna.study.study - INFO - Trial 135 finished with value: 0.06138403153588166 and parameters: {'n_layers': 1, 'embedding_dim': 96, 'lr': 0.0010180347046069985, 'lambda_val': 0.0013139510624465016, 'batch_size': 732, 'optimizer': 'RMSprop'}. Best is trial 128 with value: 0.07229790478244166.
2026-05-19 00:56:40,355 - experiment_functions - INFO - Early stopping at epoch 2300. Best Recall: 0.0703
2026-05-19 00:56:40,488 - optuna.study.study - INFO - Trial 136 finished with value: 0.07029691206052774 and parameters: {'n_layers': 1, 'embedding_dim': 96, 'lr': 0.0005552713797401686, 'lambda_val': 0.0001334936075763523, 'batch_size': 831, 'optimizer': 'RMSprop'}. Best is trial 128 with value: 0.07229790478244166.
2026-05-19 00:56:55,123 - optuna.study._optimize - INFO - Trial 137 pruned. 
2026-05-19 00:57:10,962 - optuna.study._optimize - INFO - Trial 138 pruned. 
2026-05-19 00:57:26,007 - experiment_functions - INFO - Early stopping at epoch 950. Best Recall: 0.0511
2026-05-19 00:57:26,104 - optuna.study.study - INFO - Trial 139 finished with value: 0.05110233983498529 and parameters: {'n_layers': 1, 'embedding_dim': 96, 'lr': 0.0005906288278357454, 'lambda_val': 0.0003344533869993325, 'batch_size': 3717, 'optimizer': 'RMSprop'}. Best is trial 128 with value: 0.07229790478244166.
2026-05-19 00:57:39,099 - optuna.study._optimize - INFO - Trial 140 pruned. 
2026-05-19 00:57:52,009 - experiment_functions - INFO - Early stopping at epoch 900. Best Recall: 0.0683
2026-05-19 00:57:52,108 - optuna.study.study - INFO - Trial 141 finished with value: 0.06832737930987988 and parameters: {'n_layers': 1, 'embedding_dim': 96, 'lr': 0.0010418368478067644, 'lambda_val': 0.00025557837840076456, 'batch_size': 724, 'optimizer': 'RMSprop'}. Best is trial 128 with value: 0.07229790478244166.
2026-05-19 00:58:03,588 - experiment_functions - INFO - Early stopping at epoch 750. Best Recall: 0.0628
2026-05-19 00:58:03,687 - optuna.study.study - INFO - Trial 142 finished with value: 0.06276545747958671 and parameters: {'n_layers': 1, 'embedding_dim': 96, 'lr': 0.0012777801128342594, 'lambda_val': 0.0002699959944750892, 'batch_size': 730, 'optimizer': 'RMSprop'}. Best is trial 128 with value: 0.07229790478244166.
2026-05-19 00:58:18,157 - experiment_functions - INFO - Early stopping at epoch 950. Best Recall: 0.0586
2026-05-19 00:58:18,247 - optuna.study.study - INFO - Trial 143 finished with value: 0.05860495024259363 and parameters: {'n_layers': 1, 'embedding_dim': 96, 'lr': 0.0010256667073299582, 'lambda_val': 2.348505608862975e-05, 'batch_size': 771, 'optimizer': 'RMSprop'}. Best is trial 128 with value: 0.07229790478244166.
2026-05-19 00:58:34,301 - optuna.study._optimize - INFO - Trial 144 pruned. 
2026-05-19 00:58:57,925 - experiment_functions - INFO - Early stopping at epoch 1750. Best Recall: 0.0679
2026-05-19 00:58:58,016 - optuna.study.study - INFO - Trial 145 finished with value: 0.06789722846648727 and parameters: {'n_layers': 1, 'embedding_dim': 96, 'lr': 0.0006347029839577325, 'lambda_val': 0.00043837463057783946, 'batch_size': 696, 'optimizer': 'RMSprop'}. Best is trial 128 with value: 0.07229790478244166.
2026-05-19 00:59:08,271 - experiment_functions - INFO - Early stopping at epoch 700. Best Recall: 0.0564
2026-05-19 00:59:08,370 - optuna.study.study - INFO - Trial 146 finished with value: 0.056446549434942865 and parameters: {'n_layers': 1, 'embedding_dim': 96, 'lr': 0.001357029703168067, 'lambda_val': 0.0006147347997367397, 'batch_size': 852, 'optimizer': 'RMSprop'}. Best is trial 128 with value: 0.07229790478244166.
2026-05-19 00:59:22,944 - optuna.study._optimize - INFO - Trial 147 pruned. 
2026-05-19 00:59:34,903 - experiment_functions - INFO - Early stopping at epoch 600. Best Recall: 0.0551
2026-05-19 00:59:35,011 - optuna.study.study - INFO - Trial 148 finished with value: 0.05511000144609793 and parameters: {'n_layers': 1, 'embedding_dim': 96, 'lr': 0.001709113571167467, 'lambda_val': 0.0001354459065824009, 'batch_size': 1133, 'optimizer': 'RMSprop'}. Best is trial 128 with value: 0.07229790478244166.
2026-05-19 00:59:48,544 - experiment_functions - INFO - Early stopping at epoch 950. Best Recall: 0.0655
2026-05-19 00:59:48,642 - optuna.study.study - INFO - Trial 149 finished with value: 0.06550276301983342 and parameters: {'n_layers': 1, 'embedding_dim': 96, 'lr': 0.0009956719850592246, 'lambda_val': 0.00010076944844548731, 'batch_size': 804, 'optimizer': 'RMSprop'}. Best is trial 128 with value: 0.07229790478244166.
2026-05-19 01:00:17,104 - experiment_functions - INFO - Early stopping at epoch 1300. Best Recall: 0.0649
2026-05-19 01:00:17,425 - optuna.study.study - INFO - Trial 150 finished with value: 0.0649366175117585 and parameters: {'n_layers': 1, 'embedding_dim': 96, 'lr': 0.0008578651305721322, 'lambda_val': 0.00031370686800839863, 'batch_size': 620, 'optimizer': 'RMSprop'}. Best is trial 128 with value: 0.07229790478244166.
2026-05-19 01:00:50,027 - experiment_functions - INFO - Early stopping at epoch 2250. Best Recall: 0.0708
2026-05-19 01:00:50,116 - optuna.study.study - INFO - Trial 151 finished with value: 0.07078501845716764 and parameters: {'n_layers': 1, 'embedding_dim': 96, 'lr': 0.0006447095071383936, 'lambda_val': 0.00044951400533621013, 'batch_size': 695, 'optimizer': 'RMSprop'}. Best is trial 128 with value: 0.07229790478244166.
2026-05-19 01:01:17,903 - experiment_functions - INFO - Early stopping at epoch 1900. Best Recall: 0.0674
2026-05-19 01:01:18,037 - optuna.study.study - INFO - Trial 152 finished with value: 0.06738896090277317 and parameters: {'n_layers': 1, 'embedding_dim': 96, 'lr': 0.0006836325440121447, 'lambda_val': 0.00039509574043186544, 'batch_size': 697, 'optimizer': 'RMSprop'}. Best is trial 128 with value: 0.07229790478244166.
2026-05-19 01:01:26,896 - experiment_functions - INFO - Early stopping at epoch 500. Best Recall: 0.0056
2026-05-19 01:01:27,041 - optuna.study.study - INFO - Trial 153 finished with value: 0.005601223948185915 and parameters: {'n_layers': 1, 'embedding_dim': 96, 'lr': 0.0005337272888599634, 'lambda_val': 0.0005335320726773088, 'batch_size': 771, 'optimizer': 'SGD'}. Best is trial 128 with value: 0.07229790478244166.
2026-05-19 01:01:42,384 - experiment_functions - INFO - Early stopping at epoch 950. Best Recall: 0.0650
2026-05-19 01:01:42,528 - optuna.study.study - INFO - Trial 154 finished with value: 0.06498251632701325 and parameters: {'n_layers': 1, 'embedding_dim': 32, 'lr': 0.0011919048956753734, 'lambda_val': 0.00026609915857147925, 'batch_size': 1048, 'optimizer': 'RMSprop'}. Best is trial 128 with value: 0.07229790478244166.
2026-05-19 01:01:59,865 - optuna.study._optimize - INFO - Trial 155 pruned. 
2026-05-19 01:02:25,490 - experiment_functions - INFO - Early stopping at epoch 1800. Best Recall: 0.0699
2026-05-19 01:02:25,591 - optuna.study.study - INFO - Trial 156 finished with value: 0.06994528825387242 and parameters: {'n_layers': 1, 'embedding_dim': 96, 'lr': 0.0006261124402540073, 'lambda_val': 0.00036939819887282446, 'batch_size': 893, 'optimizer': 'RMSprop'}. Best is trial 128 with value: 0.07229790478244166.
2026-05-19 01:02:39,966 - experiment_functions - INFO - Early stopping at epoch 700. Best Recall: 0.0420
2026-05-19 01:02:40,057 - optuna.study.study - INFO - Trial 157 finished with value: 0.04202622287463913 and parameters: {'n_layers': 3, 'embedding_dim': 256, 'lr': 0.00044693353480788873, 'lambda_val': 0.00037596246466283856, 'batch_size': 913, 'optimizer': 'RMSprop'}. Best is trial 128 with value: 0.07229790478244166.
2026-05-19 01:02:57,733 - optuna.study._optimize - INFO - Trial 158 pruned. 
2026-05-19 01:03:18,416 - experiment_functions - INFO - Early stopping at epoch 800. Best Recall: 0.0586
2026-05-19 01:03:18,506 - optuna.study.study - INFO - Trial 159 finished with value: 0.058608420861739244 and parameters: {'n_layers': 1, 'embedding_dim': 96, 'lr': 0.0010703128459442215, 'lambda_val': 0.0006779745504113467, 'batch_size': 1026, 'optimizer': 'RMSprop'}. Best is trial 128 with value: 0.07229790478244166.
2026-05-19 01:03:51,886 - optuna.study._optimize - INFO - Trial 160 pruned. 
2026-05-19 01:04:21,848 - experiment_functions - INFO - Early stopping at epoch 1950. Best Recall: 0.0683
2026-05-19 01:04:21,955 - optuna.study.study - INFO - Trial 161 finished with value: 0.06827159872219059 and parameters: {'n_layers': 1, 'embedding_dim': 96, 'lr': 0.0007232243497111203, 'lambda_val': 0.00045766952007655237, 'batch_size': 640, 'optimizer': 'RMSprop'}. Best is trial 128 with value: 0.07229790478244166.
2026-05-19 01:05:53,830 - experiment_functions - INFO - Early stopping at epoch 1950. Best Recall: 0.0673
2026-05-19 01:05:53,920 - optuna.study.study - INFO - Trial 162 finished with value: 0.06725573530053283 and parameters: {'n_layers': 1, 'embedding_dim': 96, 'lr': 0.0007098634283147745, 'lambda_val': 0.00046174139746412075, 'batch_size': 518, 'optimizer': 'RMSprop'}. Best is trial 128 with value: 0.07229790478244166.
2026-05-19 01:06:27,753 - optuna.study._optimize - INFO - Trial 163 pruned. 
2026-05-19 01:07:04,750 - experiment_functions - INFO - Early stopping at epoch 950. Best Recall: 0.0675
2026-05-19 01:07:04,859 - optuna.study.study - INFO - Trial 164 finished with value: 0.06752794748677206 and parameters: {'n_layers': 1, 'embedding_dim': 96, 'lr': 0.0009213712944519497, 'lambda_val': 0.0004791299771943153, 'batch_size': 793, 'optimizer': 'RMSprop'}. Best is trial 128 with value: 0.07229790478244166.
2026-05-19 01:07:36,202 - optuna.study._optimize - INFO - Trial 165 pruned. 
2026-05-19 01:07:54,378 - optuna.study._optimize - INFO - Trial 166 pruned. 
2026-05-19 01:08:10,743 - optuna.study._optimize - INFO - Trial 167 pruned. 
2026-05-19 01:08:24,272 - experiment_functions - INFO - Early stopping at epoch 700. Best Recall: 0.0594
2026-05-19 01:08:24,352 - optuna.study.study - INFO - Trial 168 finished with value: 0.059355386391456176 and parameters: {'n_layers': 1, 'embedding_dim': 96, 'lr': 0.0014369860553782735, 'lambda_val': 4.9934570947656476e-05, 'batch_size': 855, 'optimizer': 'RMSprop'}. Best is trial 128 with value: 0.07229790478244166.
2026-05-19 01:08:45,325 - experiment_functions - INFO - Early stopping at epoch 1150. Best Recall: 0.0657
2026-05-19 01:08:45,417 - optuna.study.study - INFO - Trial 169 finished with value: 0.06570658625501999 and parameters: {'n_layers': 1, 'embedding_dim': 128, 'lr': 0.0008416988452593862, 'lambda_val': 0.00014618508176554977, 'batch_size': 677, 'optimizer': 'RMSprop'}. Best is trial 128 with value: 0.07229790478244166.
2026-05-19 01:09:04,078 - optuna.study._optimize - INFO - Trial 170 pruned. 
2026-05-19 01:09:26,039 - experiment_functions - INFO - Early stopping at epoch 1600. Best Recall: 0.0695
2026-05-19 01:09:26,128 - optuna.study.study - INFO - Trial 171 finished with value: 0.06947376245884287 and parameters: {'n_layers': 1, 'embedding_dim': 96, 'lr': 0.0007146494248366269, 'lambda_val': 0.00017655746272398932, 'batch_size': 629, 'optimizer': 'RMSprop'}. Best is trial 128 with value: 0.07229790478244166.
2026-05-19 01:09:58,500 - experiment_functions - INFO - Early stopping at epoch 1500. Best Recall: 0.0707
2026-05-19 01:09:58,633 - optuna.study.study - INFO - Trial 172 finished with value: 0.07068144243016375 and parameters: {'n_layers': 1, 'embedding_dim': 96, 'lr': 0.0007592788138699345, 'lambda_val': 0.000349605717841164, 'batch_size': 596, 'optimizer': 'RMSprop'}. Best is trial 128 with value: 0.07229790478244166.
2026-05-19 01:10:12,551 - experiment_functions - INFO - Early stopping at epoch 900. Best Recall: 0.0658
2026-05-19 01:10:12,642 - optuna.study.study - INFO - Trial 173 finished with value: 0.06583624002366632 and parameters: {'n_layers': 1, 'embedding_dim': 96, 'lr': 0.0011076652554558503, 'lambda_val': 0.0003553971185599914, 'batch_size': 569, 'optimizer': 'RMSprop'}. Best is trial 128 with value: 0.07229790478244166.
2026-05-19 01:10:28,185 - experiment_functions - INFO - Early stopping at epoch 1050. Best Recall: 0.0659
2026-05-19 01:10:28,275 - optuna.study.study - INFO - Trial 174 finished with value: 0.06594895555096868 and parameters: {'n_layers': 1, 'embedding_dim': 96, 'lr': 0.0009043634130879106, 'lambda_val': 0.0001750922344402361, 'batch_size': 796, 'optimizer': 'RMSprop'}. Best is trial 128 with value: 0.07229790478244166.
2026-05-19 01:11:12,183 - experiment_functions - INFO - Early stopping at epoch 2200. Best Recall: 0.0693
2026-05-19 01:11:12,261 - optuna.study.study - INFO - Trial 175 finished with value: 0.06925715460283217 and parameters: {'n_layers': 1, 'embedding_dim': 96, 'lr': 0.0005985112072060308, 'lambda_val': 0.0003173007388774331, 'batch_size': 707, 'optimizer': 'RMSprop'}. Best is trial 128 with value: 0.07229790478244166.
2026-05-19 01:11:25,159 - experiment_functions - INFO - Early stopping at epoch 500. Best Recall: 0.0049
2026-05-19 01:11:25,258 - optuna.study.study - INFO - Trial 176 finished with value: 0.004900464867561539 and parameters: {'n_layers': 4, 'embedding_dim': 96, 'lr': 0.0005746286387988265, 'lambda_val': 0.0002948219838391873, 'batch_size': 736, 'optimizer': 'SGD'}. Best is trial 128 with value: 0.07229790478244166.
2026-05-19 01:11:43,388 - optuna.study._optimize - INFO - Trial 177 pruned. 
2026-05-19 01:12:01,839 - optuna.study._optimize - INFO - Trial 178 pruned. 
2026-05-19 01:12:27,516 - experiment_functions - INFO - Early stopping at epoch 1400. Best Recall: 0.0695
2026-05-19 01:12:27,617 - optuna.study.study - INFO - Trial 179 finished with value: 0.06954049651918326 and parameters: {'n_layers': 1, 'embedding_dim': 96, 'lr': 0.0006785259898700065, 'lambda_val': 0.00022337935278384202, 'batch_size': 755, 'optimizer': 'RMSprop'}. Best is trial 128 with value: 0.07229790478244166.
2026-05-19 01:12:49,017 - optuna.study._optimize - INFO - Trial 180 pruned. 
2026-05-19 01:13:22,734 - experiment_functions - INFO - Early stopping at epoch 1550. Best Recall: 0.0691
2026-05-19 01:13:22,920 - optuna.study.study - INFO - Trial 181 finished with value: 0.06910295520176873 and parameters: {'n_layers': 1, 'embedding_dim': 96, 'lr': 0.0007428098742136576, 'lambda_val': 0.0002154824253893592, 'batch_size': 724, 'optimizer': 'RMSprop'}. Best is trial 128 with value: 0.07229790478244166.
2026-05-19 01:14:04,608 - experiment_functions - INFO - Early stopping at epoch 1700. Best Recall: 0.0683
2026-05-19 01:14:04,717 - optuna.study.study - INFO - Trial 182 finished with value: 0.06825522786140407 and parameters: {'n_layers': 1, 'embedding_dim': 96, 'lr': 0.0007343188748293975, 'lambda_val': 0.00015025666682538875, 'batch_size': 640, 'optimizer': 'RMSprop'}. Best is trial 128 with value: 0.07229790478244166.
2026-05-19 01:14:22,122 - optuna.study._optimize - INFO - Trial 183 pruned. 
2026-05-19 01:14:43,931 - optuna.study._optimize - INFO - Trial 184 pruned. 
2026-05-19 01:15:06,858 - optuna.study._optimize - INFO - Trial 185 pruned. 
2026-05-19 01:15:29,594 - optuna.study._optimize - INFO - Trial 186 pruned. 
2026-05-19 01:15:51,892 - optuna.study._optimize - INFO - Trial 187 pruned. 
2026-05-19 01:16:13,941 - experiment_functions - INFO - Early stopping at epoch 750. Best Recall: 0.0564
2026-05-19 01:16:14,201 - optuna.study.study - INFO - Trial 188 finished with value: 0.056350954871066124 and parameters: {'n_layers': 1, 'embedding_dim': 96, 'lr': 0.0007947427096905901, 'lambda_val': 0.00019638023394004563, 'batch_size': 3130, 'optimizer': 'RMSprop'}. Best is trial 128 with value: 0.07229790478244166.
2026-05-19 01:16:39,345 - optuna.study._optimize - INFO - Trial 189 pruned. 
2026-05-19 01:17:00,197 - optuna.study._optimize - INFO - Trial 190 pruned. 
2026-05-19 01:18:35,783 - optuna.study._optimize - INFO - Trial 191 pruned. 
2026-05-19 01:18:51,252 - optuna.study._optimize - INFO - Trial 192 pruned. 
2026-05-19 01:19:20,140 - optuna.study._optimize - INFO - Trial 193 pruned. 
2026-05-19 01:19:43,967 - experiment_functions - INFO - Early stopping at epoch 950. Best Recall: 0.0614
2026-05-19 01:19:44,076 - optuna.study.study - INFO - Trial 194 finished with value: 0.061445642371898306 and parameters: {'n_layers': 1, 'embedding_dim': 96, 'lr': 0.001213736953851019, 'lambda_val': 0.0003833274562425153, 'batch_size': 643, 'optimizer': 'RMSprop'}. Best is trial 128 with value: 0.07229790478244166.
2026-05-19 01:20:30,889 - experiment_functions - INFO - Early stopping at epoch 2700. Best Recall: 0.0726
2026-05-19 01:20:31,014 - optuna.study.study - INFO - Trial 195 finished with value: 0.0726100687163915 and parameters: {'n_layers': 1, 'embedding_dim': 96, 'lr': 0.0005261734438398612, 'lambda_val': 9.724481657446651e-05, 'batch_size': 809, 'optimizer': 'RMSprop'}. Best is trial 195 with value: 0.0726100687163915.
2026-05-19 01:20:46,759 - optuna.study._optimize - INFO - Trial 196 pruned. 
2026-05-19 01:21:11,969 - experiment_functions - INFO - Early stopping at epoch 1850. Best Recall: 0.0682
