2026-05-18 14:02:01,169 - optuna.study.study - INFO - Trial 126 finished with value: 0.055271593723103946 and parameters: {'n_layers': 1, 'embedding_dim': 128, 'lr': 0.0025768539864060645, 'lambda_val': 0.008480279957423535, 'batch_size': 1107, 'optimizer': 'Adam'}. Best is trial 59 with value: 0.06448347813793345.
2026-05-18 14:02:17,177 - experiment_functions - INFO - Early stopping at epoch 1200. Best Recall: 0.0602
2026-05-18 14:02:17,268 - optuna.study.study - INFO - Trial 127 finished with value: 0.06024347950760331 and parameters: {'n_layers': 1, 'embedding_dim': 64, 'lr': 0.0009050570269168097, 'lambda_val': 0.01120664396571427, 'batch_size': 758, 'optimizer': 'Adam'}. Best is trial 59 with value: 0.06448347813793345.
2026-05-18 14:02:24,278 - experiment_functions - INFO - Early stopping at epoch 500. Best Recall: 0.0052
2026-05-18 14:02:24,369 - optuna.study.study - INFO - Trial 128 finished with value: 0.0052361392217194595 and parameters: {'n_layers': 1, 'embedding_dim': 64, 'lr': 0.0005188250955746611, 'lambda_val': 0.01625845891563883, 'batch_size': 732, 'optimizer': 'Adam'}. Best is trial 59 with value: 0.06448347813793345.
2026-05-18 14:02:41,167 - optuna.study._optimize - INFO - Trial 129 pruned. 
2026-05-18 14:02:49,831 - experiment_functions - INFO - Early stopping at epoch 550. Best Recall: 0.0254
2026-05-18 14:02:49,932 - optuna.study.study - INFO - Trial 130 finished with value: 0.025444875252214262 and parameters: {'n_layers': 4, 'embedding_dim': 64, 'lr': 0.0008962497717938113, 'lambda_val': 0.00980483027202035, 'batch_size': 1330, 'optimizer': 'RMSprop'}. Best is trial 59 with value: 0.06448347813793345.
2026-05-18 14:03:05,606 - experiment_functions - INFO - Early stopping at epoch 1150. Best Recall: 0.0613
2026-05-18 14:03:05,709 - optuna.study.study - INFO - Trial 131 finished with value: 0.06127019987346132 and parameters: {'n_layers': 1, 'embedding_dim': 32, 'lr': 0.0013033028797430632, 'lambda_val': 0.004609836121102607, 'batch_size': 687, 'optimizer': 'Adam'}. Best is trial 59 with value: 0.06448347813793345.
2026-05-18 14:03:31,502 - experiment_functions - INFO - Early stopping at epoch 1950. Best Recall: 0.0677
2026-05-18 14:03:31,607 - optuna.study.study - INFO - Trial 132 finished with value: 0.06771987827595986 and parameters: {'n_layers': 1, 'embedding_dim': 32, 'lr': 0.0007035629922094789, 'lambda_val': 0.004355367737945734, 'batch_size': 923, 'optimizer': 'Adam'}. Best is trial 132 with value: 0.06771987827595986.
2026-05-18 14:03:45,269 - experiment_functions - INFO - Early stopping at epoch 1000. Best Recall: 0.0641
2026-05-18 14:03:45,376 - optuna.study.study - INFO - Trial 133 finished with value: 0.06413921043910145 and parameters: {'n_layers': 1, 'embedding_dim': 32, 'lr': 0.0012779779709081295, 'lambda_val': 0.004098539939885949, 'batch_size': 936, 'optimizer': 'Adam'}. Best is trial 132 with value: 0.06771987827595986.
2026-05-18 14:03:58,528 - optuna.study._optimize - INFO - Trial 134 pruned. 
2026-05-18 14:04:14,086 - experiment_functions - INFO - Early stopping at epoch 1150. Best Recall: 0.0655
2026-05-18 14:04:14,198 - optuna.study.study - INFO - Trial 135 finished with value: 0.06550437192866353 and parameters: {'n_layers': 1, 'embedding_dim': 32, 'lr': 0.0011939899941212555, 'lambda_val': 0.004280893885349651, 'batch_size': 654, 'optimizer': 'Adam'}. Best is trial 132 with value: 0.06771987827595986.
2026-05-18 14:04:55,353 - experiment_functions - INFO - Early stopping at epoch 3100. Best Recall: 0.0678
2026-05-18 14:04:55,457 - optuna.study.study - INFO - Trial 136 finished with value: 0.06779944795677835 and parameters: {'n_layers': 1, 'embedding_dim': 32, 'lr': 0.0007486559238320162, 'lambda_val': 0.004160339284839262, 'batch_size': 648, 'optimizer': 'Adam'}. Best is trial 136 with value: 0.06779944795677835.
2026-05-18 14:05:09,577 - optuna.study._optimize - INFO - Trial 137 pruned. 
2026-05-18 14:05:23,640 - experiment_functions - INFO - Early stopping at epoch 1000. Best Recall: 0.0654
2026-05-18 14:05:23,732 - optuna.study.study - INFO - Trial 138 finished with value: 0.06539104658463009 and parameters: {'n_layers': 1, 'embedding_dim': 32, 'lr': 0.001174321733254833, 'lambda_val': 0.004081114730774765, 'batch_size': 1046, 'optimizer': 'Adam'}. Best is trial 136 with value: 0.06779944795677835.
2026-05-18 14:06:15,547 - optuna.study.study - INFO - Trial 139 finished with value: 0.07010716373925278 and parameters: {'n_layers': 1, 'embedding_dim': 32, 'lr': 0.0005797703528421987, 'lambda_val': 0.0040044904811797465, 'batch_size': 1040, 'optimizer': 'Adam'}. Best is trial 139 with value: 0.07010716373925278.
2026-05-18 14:06:28,587 - optuna.study._optimize - INFO - Trial 140 pruned. 
2026-05-18 14:06:35,923 - experiment_functions - INFO - Early stopping at epoch 500. Best Recall: 0.0054
2026-05-18 14:06:36,230 - optuna.study.study - INFO - Trial 141 finished with value: 0.0053978980328620255 and parameters: {'n_layers': 1, 'embedding_dim': 32, 'lr': 0.000355518218807104, 'lambda_val': 0.004767029239377759, 'batch_size': 1084, 'optimizer': 'Adam'}. Best is trial 139 with value: 0.07010716373925278.
2026-05-18 14:06:59,446 - experiment_functions - INFO - Early stopping at epoch 1750. Best Recall: 0.0664
2026-05-18 14:06:59,537 - optuna.study.study - INFO - Trial 142 finished with value: 0.06636316410072478 and parameters: {'n_layers': 1, 'embedding_dim': 32, 'lr': 0.0006523282524432253, 'lambda_val': 0.0029085243579066358, 'batch_size': 1229, 'optimizer': 'Adam'}. Best is trial 139 with value: 0.07010716373925278.
2026-05-18 14:07:14,254 - optuna.study._optimize - INFO - Trial 143 pruned. 
2026-05-18 14:07:43,431 - experiment_functions - INFO - Early stopping at epoch 2100. Best Recall: 0.0690
2026-05-18 14:07:43,540 - optuna.study.study - INFO - Trial 144 finished with value: 0.06899799048111949 and parameters: {'n_layers': 1, 'embedding_dim': 32, 'lr': 0.000730487395404745, 'lambda_val': 0.006848444903890365, 'batch_size': 792, 'optimizer': 'Adam'}. Best is trial 139 with value: 0.07010716373925278.
2026-05-18 14:08:09,785 - experiment_functions - INFO - Early stopping at epoch 1950. Best Recall: 0.0675
2026-05-18 14:08:09,885 - optuna.study.study - INFO - Trial 145 finished with value: 0.06745711909707588 and parameters: {'n_layers': 1, 'embedding_dim': 32, 'lr': 0.0007701941233403004, 'lambda_val': 0.006777866950265453, 'batch_size': 658, 'optimizer': 'Adam'}. Best is trial 139 with value: 0.07010716373925278.
2026-05-18 14:08:29,629 - optuna.study._optimize - INFO - Trial 146 pruned. 
2026-05-18 14:08:48,095 - optuna.study._optimize - INFO - Trial 147 pruned. 
2026-05-18 14:09:00,994 - optuna.study._optimize - INFO - Trial 148 pruned. 
2026-05-18 14:09:16,502 - experiment_functions - INFO - Early stopping at epoch 1150. Best Recall: 0.0671
2026-05-18 14:09:16,593 - optuna.study.study - INFO - Trial 149 finished with value: 0.06707257754792195 and parameters: {'n_layers': 1, 'embedding_dim': 32, 'lr': 0.0010316053447207588, 'lambda_val': 0.003387986750871065, 'batch_size': 1034, 'optimizer': 'Adam'}. Best is trial 139 with value: 0.07010716373925278.
2026-05-18 14:09:23,959 - experiment_functions - INFO - Early stopping at epoch 500. Best Recall: 0.0054
2026-05-18 14:09:24,061 - optuna.study.study - INFO - Trial 150 finished with value: 0.005375435582854795 and parameters: {'n_layers': 1, 'embedding_dim': 32, 'lr': 0.001002142565344837, 'lambda_val': 0.0030222785901362647, 'batch_size': 1431, 'optimizer': 'SGD'}. Best is trial 139 with value: 0.07010716373925278.
2026-05-18 14:09:40,196 - optuna.study._optimize - INFO - Trial 151 pruned. 
2026-05-18 14:09:54,459 - experiment_functions - INFO - Early stopping at epoch 1050. Best Recall: 0.0609
2026-05-18 14:09:54,550 - optuna.study.study - INFO - Trial 152 finished with value: 0.06092847575595422 and parameters: {'n_layers': 1, 'embedding_dim': 32, 'lr': 0.0012818799598088286, 'lambda_val': 0.006764288409874786, 'batch_size': 686, 'optimizer': 'Adam'}. Best is trial 139 with value: 0.07010716373925278.
2026-05-18 14:10:07,923 - optuna.study._optimize - INFO - Trial 153 pruned. 
2026-05-18 14:10:26,722 - experiment_functions - INFO - Early stopping at epoch 1400. Best Recall: 0.0687
2026-05-18 14:10:26,813 - optuna.study.study - INFO - Trial 154 finished with value: 0.06865775217366153 and parameters: {'n_layers': 1, 'embedding_dim': 32, 'lr': 0.0009181813668548041, 'lambda_val': 0.002241762340866854, 'batch_size': 1031, 'optimizer': 'Adam'}. Best is trial 139 with value: 0.07010716373925278.
2026-05-18 14:10:43,032 - experiment_functions - INFO - Early stopping at epoch 1150. Best Recall: 0.0642
2026-05-18 14:10:43,119 - optuna.study.study - INFO - Trial 155 finished with value: 0.06422516068332755 and parameters: {'n_layers': 1, 'embedding_dim': 32, 'lr': 0.001039539394787536, 'lambda_val': 0.0024221234218439777, 'batch_size': 1057, 'optimizer': 'Adam'}. Best is trial 139 with value: 0.07010716373925278.
2026-05-18 14:10:58,282 - experiment_functions - INFO - Early stopping at epoch 1100. Best Recall: 0.0633
2026-05-18 14:10:58,394 - optuna.study.study - INFO - Trial 156 finished with value: 0.0632754816702278 and parameters: {'n_layers': 1, 'embedding_dim': 32, 'lr': 0.0009998144508005236, 'lambda_val': 0.002094526289400882, 'batch_size': 1280, 'optimizer': 'Adam'}. Best is trial 139 with value: 0.07010716373925278.
2026-05-18 14:11:15,245 - experiment_functions - INFO - Early stopping at epoch 1200. Best Recall: 0.0637
2026-05-18 14:11:15,410 - optuna.study.study - INFO - Trial 157 finished with value: 0.0636714305731637 and parameters: {'n_layers': 1, 'embedding_dim': 32, 'lr': 0.0010139849184453255, 'lambda_val': 0.0020447912832705717, 'batch_size': 1169, 'optimizer': 'Adam'}. Best is trial 139 with value: 0.07010716373925278.
2026-05-18 14:11:32,793 - experiment_functions - INFO - Early stopping at epoch 1250. Best Recall: 0.0646
2026-05-18 14:11:32,926 - optuna.study.study - INFO - Trial 158 finished with value: 0.06463781543272411 and parameters: {'n_layers': 1, 'embedding_dim': 32, 'lr': 0.000971971134627766, 'lambda_val': 0.0020533235738477997, 'batch_size': 1289, 'optimizer': 'Adam'}. Best is trial 139 with value: 0.07010716373925278.
2026-05-18 14:11:48,729 - experiment_functions - INFO - Early stopping at epoch 1150. Best Recall: 0.0646
2026-05-18 14:11:48,830 - optuna.study.study - INFO - Trial 159 finished with value: 0.06458802399814845 and parameters: {'n_layers': 1, 'embedding_dim': 32, 'lr': 0.0009833040078530866, 'lambda_val': 0.002184904067975991, 'batch_size': 1281, 'optimizer': 'Adam'}. Best is trial 139 with value: 0.07010716373925278.
2026-05-18 14:12:05,645 - optuna.study._optimize - INFO - Trial 160 pruned. 
2026-05-18 14:12:20,161 - experiment_functions - INFO - Early stopping at epoch 1050. Best Recall: 0.0631
2026-05-18 14:12:20,297 - optuna.study.study - INFO - Trial 161 finished with value: 0.06309169031829896 and parameters: {'n_layers': 1, 'embedding_dim': 32, 'lr': 0.0010763676249909949, 'lambda_val': 0.0021771081500176017, 'batch_size': 1280, 'optimizer': 'Adam'}. Best is trial 139 with value: 0.07010716373925278.
2026-05-18 14:12:37,489 - experiment_functions - INFO - Early stopping at epoch 1250. Best Recall: 0.0636
2026-05-18 14:12:37,590 - optuna.study.study - INFO - Trial 162 finished with value: 0.06362876454011442 and parameters: {'n_layers': 1, 'embedding_dim': 32, 'lr': 0.0010137299777812985, 'lambda_val': 0.0018036231049979032, 'batch_size': 1063, 'optimizer': 'Adam'}. Best is trial 139 with value: 0.07010716373925278.
2026-05-18 14:12:56,080 - optuna.study._optimize - INFO - Trial 163 pruned. 
2026-05-18 14:13:38,274 - experiment_functions - INFO - Early stopping at epoch 3150. Best Recall: 0.0693
2026-05-18 14:13:38,420 - optuna.study.study - INFO - Trial 164 finished with value: 0.06930473665541607 and parameters: {'n_layers': 1, 'embedding_dim': 32, 'lr': 0.0006029223812267868, 'lambda_val': 0.001302403277183023, 'batch_size': 1174, 'optimizer': 'Adam'}. Best is trial 139 with value: 0.07010716373925278.
2026-05-18 14:13:52,004 - optuna.study._optimize - INFO - Trial 165 pruned. 
2026-05-18 14:14:09,363 - optuna.study._optimize - INFO - Trial 166 pruned. 
2026-05-18 14:14:23,232 - experiment_functions - INFO - Early stopping at epoch 1000. Best Recall: 0.0617
2026-05-18 14:14:23,323 - optuna.study.study - INFO - Trial 167 finished with value: 0.06167361944808243 and parameters: {'n_layers': 1, 'embedding_dim': 32, 'lr': 0.0008792674371888277, 'lambda_val': 0.0026070902760221915, 'batch_size': 1209, 'optimizer': 'RMSprop'}. Best is trial 139 with value: 0.07010716373925278.
2026-05-18 14:14:30,380 - experiment_functions - INFO - Early stopping at epoch 500. Best Recall: 0.0050
2026-05-18 14:14:30,479 - optuna.study.study - INFO - Trial 168 finished with value: 0.005045591581136256 and parameters: {'n_layers': 1, 'embedding_dim': 32, 'lr': 2.4359222328186753e-05, 'lambda_val': 0.007636603473437424, 'batch_size': 1340, 'optimizer': 'Adam'}. Best is trial 139 with value: 0.07010716373925278.
2026-05-18 14:14:44,401 - optuna.study._optimize - INFO - Trial 169 pruned. 
2026-05-18 14:15:11,898 - experiment_functions - INFO - Early stopping at epoch 2050. Best Recall: 0.0685
2026-05-18 14:15:11,978 - optuna.study.study - INFO - Trial 170 finished with value: 0.06854409061540243 and parameters: {'n_layers': 1, 'embedding_dim': 32, 'lr': 0.00064161741529562, 'lambda_val': 0.002496524576888179, 'batch_size': 974, 'optimizer': 'Adam'}. Best is trial 139 with value: 0.07010716373925278.
2026-05-18 14:15:25,770 - optuna.study._optimize - INFO - Trial 171 pruned. 
2026-05-18 14:15:48,532 - experiment_functions - INFO - Early stopping at epoch 1700. Best Recall: 0.0682
2026-05-18 14:15:48,626 - optuna.study.study - INFO - Trial 172 finished with value: 0.06819457391609855 and parameters: {'n_layers': 1, 'embedding_dim': 32, 'lr': 0.0008656802656948454, 'lambda_val': 0.0016381720231759692, 'batch_size': 824, 'optimizer': 'Adam'}. Best is trial 139 with value: 0.07010716373925278.
2026-05-18 14:16:11,374 - experiment_functions - INFO - Early stopping at epoch 1700. Best Recall: 0.0681
2026-05-18 14:16:11,506 - optuna.study.study - INFO - Trial 173 finished with value: 0.06812563254594592 and parameters: {'n_layers': 1, 'embedding_dim': 32, 'lr': 0.0008206873558507267, 'lambda_val': 0.0033811162522008756, 'batch_size': 822, 'optimizer': 'Adam'}. Best is trial 139 with value: 0.07010716373925278.
2026-05-18 14:16:24,270 - optuna.study._optimize - INFO - Trial 174 pruned. 
2026-05-18 14:16:41,757 - optuna.study._optimize - INFO - Trial 175 pruned. 
2026-05-18 14:16:55,125 - optuna.study._optimize - INFO - Trial 176 pruned. 
2026-05-18 14:17:08,893 - optuna.study._optimize - INFO - Trial 177 pruned. 
2026-05-18 14:17:24,975 - optuna.study._optimize - INFO - Trial 178 pruned. 
2026-05-18 14:17:38,792 - optuna.study._optimize - INFO - Trial 179 pruned. 
2026-05-18 14:17:52,526 - optuna.study._optimize - INFO - Trial 180 pruned. 
2026-05-18 14:18:18,278 - optuna.study._optimize - INFO - Trial 181 pruned. 
2026-05-18 14:18:33,162 - experiment_functions - INFO - Early stopping at epoch 1100. Best Recall: 0.0606
2026-05-18 14:18:33,295 - optuna.study.study - INFO - Trial 182 finished with value: 0.060557188174032044 and parameters: {'n_layers': 1, 'embedding_dim': 32, 'lr': 0.0009763048109661824, 'lambda_val': 0.0038373559059742095, 'batch_size': 1256, 'optimizer': 'Adam'}. Best is trial 139 with value: 0.07010716373925278.
2026-05-18 14:18:50,538 - experiment_functions - INFO - Early stopping at epoch 1250. Best Recall: 0.0664
2026-05-18 14:18:50,705 - optuna.study.study - INFO - Trial 183 finished with value: 0.06644708214171667 and parameters: {'n_layers': 1, 'embedding_dim': 32, 'lr': 0.0011145303669830133, 'lambda_val': 0.004012077616944426, 'batch_size': 891, 'optimizer': 'Adam'}. Best is trial 139 with value: 0.07010716373925278.
2026-05-18 14:19:04,128 - optuna.study._optimize - INFO - Trial 184 pruned. 
2026-05-18 14:19:18,714 - experiment_functions - INFO - Early stopping at epoch 1050. Best Recall: 0.0647
2026-05-18 14:19:18,826 - optuna.study.study - INFO - Trial 185 finished with value: 0.0647308554611726 and parameters: {'n_layers': 1, 'embedding_dim': 32, 'lr': 0.0011224107712805536, 'lambda_val': 0.0024111699769440212, 'batch_size': 1038, 'optimizer': 'Adam'}. Best is trial 139 with value: 0.07010716373925278.
2026-05-18 14:19:26,079 - experiment_functions - INFO - Early stopping at epoch 500. Best Recall: 0.0044
2026-05-18 14:19:26,191 - optuna.study.study - INFO - Trial 186 finished with value: 0.004440118420370111 and parameters: {'n_layers': 1, 'embedding_dim': 32, 'lr': 0.0004443440290560079, 'lambda_val': 0.012285496850872869, 'batch_size': 786, 'optimizer': 'Adam'}. Best is trial 139 with value: 0.07010716373925278.
2026-05-18 14:19:44,423 - optuna.study._optimize - INFO - Trial 187 pruned. 
2026-05-18 14:19:51,476 - experiment_functions - INFO - Early stopping at epoch 500. Best Recall: 0.0055
2026-05-18 14:19:51,579 - optuna.study.study - INFO - Trial 188 finished with value: 0.00547484287112056 and parameters: {'n_layers': 1, 'embedding_dim': 32, 'lr': 0.0005810250098374862, 'lambda_val': 0.003486485098053754, 'batch_size': 1144, 'optimizer': 'SGD'}. Best is trial 139 with value: 0.07010716373925278.
2026-05-18 14:20:07,155 - experiment_functions - INFO - Early stopping at epoch 1100. Best Recall: 0.0626
2026-05-18 14:20:07,248 - optuna.study.study - INFO - Trial 189 finished with value: 0.06257157399147048 and parameters: {'n_layers': 1, 'embedding_dim': 32, 'lr': 0.0012496274147216838, 'lambda_val': 0.004618631329817404, 'batch_size': 867, 'optimizer': 'Adam'}. Best is trial 139 with value: 0.07010716373925278.
2026-05-18 14:20:19,408 - experiment_functions - INFO - Early stopping at epoch 850. Best Recall: 0.0627
2026-05-18 14:20:19,509 - optuna.study.study - INFO - Trial 190 finished with value: 0.06273580966251233 and parameters: {'n_layers': 1, 'embedding_dim': 32, 'lr': 0.00149663872178347, 'lambda_val': 0.0015305238126717697, 'batch_size': 1293, 'optimizer': 'Adam'}. Best is trial 139 with value: 0.07010716373925278.
2026-05-18 14:20:39,021 - experiment_functions - INFO - Early stopping at epoch 1050. Best Recall: 0.0610
2026-05-18 14:20:39,133 - optuna.study.study - INFO - Trial 191 finished with value: 0.060960350476663434 and parameters: {'n_layers': 1, 'embedding_dim': 32, 'lr': 0.0011233639604165896, 'lambda_val': 0.0023302627781434937, 'batch_size': 1056, 'optimizer': 'Adam'}. Best is trial 139 with value: 0.07010716373925278.
2026-05-18 14:20:57,907 - optuna.study._optimize - INFO - Trial 192 pruned. 
2026-05-18 14:21:16,936 - experiment_functions - INFO - Early stopping at epoch 1300. Best Recall: 0.0680
2026-05-18 14:21:17,092 - optuna.study.study - INFO - Trial 193 finished with value: 0.06795184351813824 and parameters: {'n_layers': 1, 'embedding_dim': 32, 'lr': 0.000915960019751544, 'lambda_val': 0.0031706294326962967, 'batch_size': 1028, 'optimizer': 'Adam'}. Best is trial 139 with value: 0.07010716373925278.
2026-05-18 14:21:39,699 - experiment_functions - INFO - Early stopping at epoch 1600. Best Recall: 0.0678
2026-05-18 14:21:39,790 - optuna.study.study - INFO - Trial 194 finished with value: 0.06775072216943581 and parameters: {'n_layers': 1, 'embedding_dim': 32, 'lr': 0.0007384883248345565, 'lambda_val': 0.003605571720488213, 'batch_size': 984, 'optimizer': 'Adam'}. Best is trial 139 with value: 0.07010716373925278.
2026-05-18 14:21:58,660 - optuna.study._optimize - INFO - Trial 195 pruned. 
2026-05-18 14:22:14,777 - optuna.study._optimize - INFO - Trial 196 pruned. 
2026-05-18 14:22:34,504 - experiment_functions - INFO - Early stopping at epoch 1400. Best Recall: 0.0685
2026-05-18 14:22:34,925 - optuna.study.study - INFO - Trial 197 finished with value: 0.06848913930111308 and parameters: {'n_layers': 1, 'embedding_dim': 32, 'lr': 0.0008808036357620451, 'lambda_val': 0.001977187789486226, 'batch_size': 980, 'optimizer': 'Adam'}. Best is trial 139 with value: 0.07010716373925278.
2026-05-18 14:22:56,315 - experiment_functions - INFO - Early stopping at epoch 1350. Best Recall: 0.0687
2026-05-18 14:22:56,414 - optuna.study.study - INFO - Trial 198 finished with value: 0.0686527826294459 and parameters: {'n_layers': 1, 'embedding_dim': 32, 'lr': 0.0008292194506248207, 'lambda_val': 0.004038467325655626, 'batch_size': 981, 'optimizer': 'Adam'}. Best is trial 139 with value: 0.07010716373925278.
2026-05-18 14:23:12,903 - optuna.study._optimize - INFO - Trial 199 pruned. 
2026-05-18 14:23:32,984 - optuna.study._optimize - INFO - Trial 200 pruned. 
2026-05-18 14:23:51,256 - optuna.study._optimize - INFO - Trial 201 pruned. 
2026-05-18 14:24:10,078 - optuna.study._optimize - INFO - Trial 202 pruned. 
2026-05-18 14:24:24,639 - optuna.study._optimize - INFO - Trial 203 pruned. 
2026-05-18 14:24:51,398 - experiment_functions - INFO - Early stopping at epoch 1850. Best Recall: 0.0692
2026-05-18 14:24:51,488 - optuna.study.study - INFO - Trial 204 finished with value: 0.06921105088282416 and parameters: {'n_layers': 1, 'embedding_dim': 32, 'lr': 0.0009168614098935764, 'lambda_val': 0.004969859408569228, 'batch_size': 602, 'optimizer': 'Adam'}. Best is trial 139 with value: 0.07010716373925278.
2026-05-18 14:25:05,319 - experiment_functions - INFO - Early stopping at epoch 850. Best Recall: 0.0632
2026-05-18 14:25:05,419 - optuna.study.study - INFO - Trial 205 finished with value: 0.06324030652310657 and parameters: {'n_layers': 1, 'embedding_dim': 32, 'lr': 0.0012033995449034325, 'lambda_val': 0.004869389696955142, 'batch_size': 655, 'optimizer': 'RMSprop'}. Best is trial 139 with value: 0.07010716373925278.
2026-05-18 14:25:25,130 - optuna.study._optimize - INFO - Trial 206 pruned. 
