2026-05-18 00:49:42,205 - optuna.study.study - INFO - Trial 16 finished with value: 0.0547627458361881 and parameters: {'n_layers': 1, 'embedding_dim': 256, 'lr': 0.0005487983908804518, 'lambda_val': 0.0003186639461678922, 'batch_size': 2879, 'optimizer': 'Adam'}. Best is trial 10 with value: 0.05534347802916179.
2026-05-18 00:50:33,462 - experiment_functions - INFO - Early stopping at epoch 3450. Best Recall: 0.0257
2026-05-18 00:50:33,551 - optuna.study.study - INFO - Trial 17 finished with value: 0.025670378280903596 and parameters: {'n_layers': 3, 'embedding_dim': 96, 'lr': 0.007891902141129795, 'lambda_val': 1.3831159699909416e-05, 'batch_size': 1371, 'optimizer': 'Adam'}. Best is trial 10 with value: 0.05534347802916179.
2026-05-18 00:51:33,083 - optuna.study.study - INFO - Trial 18 finished with value: 0.03853522376136106 and parameters: {'n_layers': 2, 'embedding_dim': 32, 'lr': 0.0001568629459240008, 'lambda_val': 1.3433287592561027e-06, 'batch_size': 2954, 'optimizer': 'Adam'}. Best is trial 10 with value: 0.05534347802916179.
2026-05-18 00:51:43,351 - experiment_functions - INFO - Early stopping at epoch 550. Best Recall: 0.0262
2026-05-18 00:51:43,460 - optuna.study.study - INFO - Trial 19 finished with value: 0.026178319380432552 and parameters: {'n_layers': 1, 'embedding_dim': 32, 'lr': 0.02107951746637533, 'lambda_val': 0.00029612081210862316, 'batch_size': 2190, 'optimizer': 'Adam'}. Best is trial 10 with value: 0.05534347802916179.
2026-05-18 00:51:52,975 - experiment_functions - INFO - Early stopping at epoch 600. Best Recall: 0.0396
2026-05-18 00:51:53,110 - optuna.study.study - INFO - Trial 20 finished with value: 0.03955711782805618 and parameters: {'n_layers': 2, 'embedding_dim': 96, 'lr': 0.0013213070312745293, 'lambda_val': 0.0042354424755275755, 'batch_size': 3724, 'optimizer': 'Adam'}. Best is trial 10 with value: 0.05534347802916179.
2026-05-18 00:52:13,889 - experiment_functions - INFO - Early stopping at epoch 1200. Best Recall: 0.0568
2026-05-18 00:52:14,004 - optuna.study.study - INFO - Trial 21 finished with value: 0.05680208683603767 and parameters: {'n_layers': 1, 'embedding_dim': 256, 'lr': 0.0004705160628270505, 'lambda_val': 0.0006232838706517156, 'batch_size': 2805, 'optimizer': 'Adam'}. Best is trial 21 with value: 0.05680208683603767.
2026-05-18 00:52:29,295 - optuna.study._optimize - INFO - Trial 22 pruned. 
2026-05-18 00:52:44,159 - experiment_functions - INFO - Early stopping at epoch 800. Best Recall: 0.0567
2026-05-18 00:52:44,336 - optuna.study.study - INFO - Trial 23 finished with value: 0.05665842846931371 and parameters: {'n_layers': 1, 'embedding_dim': 256, 'lr': 0.0009612867333554961, 'lambda_val': 0.00014086198225458693, 'batch_size': 3048, 'optimizer': 'Adam'}. Best is trial 21 with value: 0.05680208683603767.
2026-05-18 00:52:58,979 - experiment_functions - INFO - Early stopping at epoch 900. Best Recall: 0.0522
2026-05-18 00:52:59,080 - optuna.study.study - INFO - Trial 24 finished with value: 0.052155538279698696 and parameters: {'n_layers': 1, 'embedding_dim': 256, 'lr': 0.0007144258193105279, 'lambda_val': 2.0819918027010376e-05, 'batch_size': 3425, 'optimizer': 'Adam'}. Best is trial 21 with value: 0.05680208683603767.
2026-05-18 00:53:09,541 - experiment_functions - INFO - Early stopping at epoch 550. Best Recall: 0.0531
2026-05-18 00:53:09,643 - optuna.study.study - INFO - Trial 25 finished with value: 0.05313171213823954 and parameters: {'n_layers': 2, 'embedding_dim': 256, 'lr': 0.0038831966561700885, 'lambda_val': 0.00013226955274429935, 'batch_size': 1922, 'optimizer': 'Adam'}. Best is trial 21 with value: 0.05680208683603767.
2026-05-18 00:53:49,498 - experiment_functions - INFO - Early stopping at epoch 2500. Best Recall: 0.0583
2026-05-18 00:53:49,588 - optuna.study.study - INFO - Trial 26 finished with value: 0.05829657270144525 and parameters: {'n_layers': 1, 'embedding_dim': 256, 'lr': 0.0002953946333649644, 'lambda_val': 0.0007734556163940516, 'batch_size': 2634, 'optimizer': 'Adam'}. Best is trial 26 with value: 0.05829657270144525.
2026-05-18 00:53:58,766 - experiment_functions - INFO - Early stopping at epoch 500. Best Recall: 0.0050
2026-05-18 00:53:58,911 - optuna.study.study - INFO - Trial 27 finished with value: 0.005038093592144184 and parameters: {'n_layers': 2, 'embedding_dim': 256, 'lr': 5.946459509777528e-05, 'lambda_val': 0.007002448074334092, 'batch_size': 1644, 'optimizer': 'Adam'}. Best is trial 26 with value: 0.05829657270144525.
2026-05-18 00:54:44,897 - experiment_functions - INFO - Early stopping at epoch 2800. Best Recall: 0.0581
2026-05-18 00:54:44,986 - optuna.study.study - INFO - Trial 28 finished with value: 0.05808159872389958 and parameters: {'n_layers': 1, 'embedding_dim': 256, 'lr': 0.0002836680641671564, 'lambda_val': 0.0008889375042992462, 'batch_size': 2394, 'optimizer': 'RMSprop'}. Best is trial 26 with value: 0.05829657270144525.
2026-05-18 00:55:04,102 - optuna.study._optimize - INFO - Trial 29 pruned. 
2026-05-18 00:55:32,857 - experiment_functions - INFO - Early stopping at epoch 1650. Best Recall: 0.0519
2026-05-18 00:55:32,977 - optuna.study.study - INFO - Trial 30 finished with value: 0.051905156279411 and parameters: {'n_layers': 1, 'embedding_dim': 256, 'lr': 0.0002765464893431978, 'lambda_val': 0.011085161552423553, 'batch_size': 2722, 'optimizer': 'RMSprop'}. Best is trial 26 with value: 0.05829657270144525.
2026-05-18 00:55:44,761 - experiment_functions - INFO - Early stopping at epoch 700. Best Recall: 0.0516
2026-05-18 00:55:44,850 - optuna.study.study - INFO - Trial 31 finished with value: 0.05162006161818274 and parameters: {'n_layers': 1, 'embedding_dim': 256, 'lr': 0.000843106806066688, 'lambda_val': 0.0004750670575072487, 'batch_size': 2486, 'optimizer': 'RMSprop'}. Best is trial 26 with value: 0.05829657270144525.
2026-05-18 00:55:55,515 - experiment_functions - INFO - Early stopping at epoch 500. Best Recall: 0.0043
2026-05-18 00:55:55,606 - optuna.study.study - INFO - Trial 32 finished with value: 0.004276382606968308 and parameters: {'n_layers': 1, 'embedding_dim': 256, 'lr': 0.000297932106725701, 'lambda_val': 0.001577123159042443, 'batch_size': 3004, 'optimizer': 'SGD'}. Best is trial 26 with value: 0.05829657270144525.
2026-05-18 00:56:03,415 - experiment_functions - INFO - Early stopping at epoch 500. Best Recall: 0.0054
2026-05-18 00:56:03,502 - optuna.study.study - INFO - Trial 33 finished with value: 0.00537141831330357 and parameters: {'n_layers': 1, 'embedding_dim': 256, 'lr': 0.00012557791469273584, 'lambda_val': 0.05424665249804396, 'batch_size': 2281, 'optimizer': 'SGD'}. Best is trial 26 with value: 0.05829657270144525.
2026-05-18 00:56:18,655 - optuna.study._optimize - INFO - Trial 34 pruned. 
2026-05-18 00:56:39,250 - experiment_functions - INFO - Early stopping at epoch 1250. Best Recall: 0.0546
2026-05-18 00:56:39,391 - optuna.study.study - INFO - Trial 35 finished with value: 0.054567151415968254 and parameters: {'n_layers': 1, 'embedding_dim': 256, 'lr': 0.0004018676720342464, 'lambda_val': 0.0001128940652296884, 'batch_size': 2736, 'optimizer': 'RMSprop'}. Best is trial 26 with value: 0.05829657270144525.
2026-05-18 00:56:55,159 - experiment_functions - INFO - Early stopping at epoch 950. Best Recall: 0.0544
2026-05-18 00:56:55,375 - optuna.study.study - INFO - Trial 36 finished with value: 0.05442983856846291 and parameters: {'n_layers': 1, 'embedding_dim': 256, 'lr': 0.0007294140515173759, 'lambda_val': 0.0010213694114628651, 'batch_size': 2548, 'optimizer': 'Adam'}. Best is trial 26 with value: 0.05829657270144525.
2026-05-18 00:57:11,886 - optuna.study._optimize - INFO - Trial 37 pruned. 
2026-05-18 00:57:20,277 - experiment_functions - INFO - Early stopping at epoch 500. Best Recall: 0.0054
2026-05-18 00:57:20,367 - optuna.study.study - INFO - Trial 38 finished with value: 0.0054270408058477064 and parameters: {'n_layers': 2, 'embedding_dim': 256, 'lr': 3.958694117161906e-05, 'lambda_val': 0.004434445356596643, 'batch_size': 542, 'optimizer': 'SGD'}. Best is trial 26 with value: 0.05829657270144525.
2026-05-18 00:57:36,182 - optuna.study._optimize - INFO - Trial 39 pruned. 
2026-05-18 00:57:45,788 - experiment_functions - INFO - Early stopping at epoch 600. Best Recall: 0.0504
2026-05-18 00:57:45,879 - optuna.study.study - INFO - Trial 40 finished with value: 0.05043781269097623 and parameters: {'n_layers': 1, 'embedding_dim': 256, 'lr': 0.0011388186193105388, 'lambda_val': 0.00013581556937196878, 'batch_size': 3477, 'optimizer': 'RMSprop'}. Best is trial 26 with value: 0.05829657270144525.
2026-05-18 00:57:56,057 - experiment_functions - INFO - Early stopping at epoch 700. Best Recall: 0.0556
2026-05-18 00:57:56,157 - optuna.study.study - INFO - Trial 41 finished with value: 0.055644274695618466 and parameters: {'n_layers': 1, 'embedding_dim': 32, 'lr': 0.001981232426973135, 'lambda_val': 4.18739557358243e-05, 'batch_size': 3079, 'optimizer': 'Adam'}. Best is trial 26 with value: 0.05829657270144525.
2026-05-18 00:58:16,830 - experiment_functions - INFO - Early stopping at epoch 1300. Best Recall: 0.0527
2026-05-18 00:58:16,930 - optuna.study.study - INFO - Trial 42 finished with value: 0.05273064618304492 and parameters: {'n_layers': 1, 'embedding_dim': 32, 'lr': 0.0005556437281693847, 'lambda_val': 0.0009692174548712344, 'batch_size': 3081, 'optimizer': 'Adam'}. Best is trial 26 with value: 0.05829657270144525.
2026-05-18 00:58:27,185 - experiment_functions - INFO - Early stopping at epoch 650. Best Recall: 0.0546
2026-05-18 00:58:27,263 - optuna.study.study - INFO - Trial 43 finished with value: 0.05458249784161717 and parameters: {'n_layers': 1, 'embedding_dim': 256, 'lr': 0.0018372776644311254, 'lambda_val': 8.184931724357006e-05, 'batch_size': 2701, 'optimizer': 'Adam'}. Best is trial 26 with value: 0.05829657270144525.
2026-05-18 00:58:41,419 - optuna.study._optimize - INFO - Trial 44 pruned. 
2026-05-18 00:58:50,644 - experiment_functions - INFO - Early stopping at epoch 600. Best Recall: 0.0477
2026-05-18 00:58:50,789 - optuna.study.study - INFO - Trial 45 finished with value: 0.047747553068508586 and parameters: {'n_layers': 1, 'embedding_dim': 64, 'lr': 0.00468471218988583, 'lambda_val': 0.003439967866915027, 'batch_size': 2390, 'optimizer': 'Adam'}. Best is trial 26 with value: 0.05829657270144525.
2026-05-18 00:58:59,663 - experiment_functions - INFO - Early stopping at epoch 600. Best Recall: 0.0405
2026-05-18 00:58:59,808 - optuna.study.study - INFO - Trial 46 finished with value: 0.04052713969229614 and parameters: {'n_layers': 2, 'embedding_dim': 32, 'lr': 0.0024110797656305785, 'lambda_val': 0.00021795072229253642, 'batch_size': 3417, 'optimizer': 'Adam'}. Best is trial 26 with value: 0.05829657270144525.
2026-05-18 00:59:08,920 - experiment_functions - INFO - Early stopping at epoch 500. Best Recall: 0.0052
2026-05-18 00:59:09,021 - optuna.study.study - INFO - Trial 47 finished with value: 0.0051711602313615854 and parameters: {'n_layers': 1, 'embedding_dim': 256, 'lr': 0.008502466072019736, 'lambda_val': 3.3899327189023937e-05, 'batch_size': 3142, 'optimizer': 'SGD'}. Best is trial 26 with value: 0.05829657270144525.
2026-05-18 00:59:38,302 - experiment_functions - INFO - Early stopping at epoch 2100. Best Recall: 0.0630
2026-05-18 00:59:39,184 - optuna.study.study - INFO - Trial 48 finished with value: 0.06302274198290596 and parameters: {'n_layers': 1, 'embedding_dim': 32, 'lr': 0.000516406970945281, 'lambda_val': 1.1966531801406824e-05, 'batch_size': 2616, 'optimizer': 'RMSprop'}. Best is trial 48 with value: 0.06302274198290596.
2026-05-18 00:59:51,744 - experiment_functions - INFO - Early stopping at epoch 850. Best Recall: 0.0516
2026-05-18 00:59:51,835 - optuna.study.study - INFO - Trial 49 finished with value: 0.051615086128836536 and parameters: {'n_layers': 2, 'embedding_dim': 128, 'lr': 0.000454193007912565, 'lambda_val': 3.649446437681886e-06, 'batch_size': 2126, 'optimizer': 'RMSprop'}. Best is trial 48 with value: 0.06302274198290596.
2026-05-18 01:00:05,827 - optuna.study._optimize - INFO - Trial 50 pruned. 
2026-05-18 01:00:18,423 - experiment_functions - INFO - Early stopping at epoch 800. Best Recall: 0.0563
2026-05-18 01:00:18,524 - optuna.study.study - INFO - Trial 51 finished with value: 0.056294729981787736 and parameters: {'n_layers': 1, 'embedding_dim': 32, 'lr': 0.0010131770823631773, 'lambda_val': 6.678261303178841e-06, 'batch_size': 2832, 'optimizer': 'RMSprop'}. Best is trial 48 with value: 0.06302274198290596.
2026-05-18 01:00:32,150 - experiment_functions - INFO - Early stopping at epoch 950. Best Recall: 0.0512
2026-05-18 01:00:32,240 - optuna.study.study - INFO - Trial 52 finished with value: 0.05116404579657724 and parameters: {'n_layers': 1, 'embedding_dim': 32, 'lr': 0.000895159142561619, 'lambda_val': 4.43729359289013e-06, 'batch_size': 2862, 'optimizer': 'RMSprop'}. Best is trial 48 with value: 0.06302274198290596.
2026-05-18 01:01:15,830 - experiment_functions - INFO - Early stopping at epoch 2900. Best Recall: 0.0617
2026-05-18 01:01:15,920 - optuna.study.study - INFO - Trial 53 finished with value: 0.06173527668325751 and parameters: {'n_layers': 1, 'embedding_dim': 32, 'lr': 0.000491133226793319, 'lambda_val': 1.0025704991753146e-06, 'batch_size': 2453, 'optimizer': 'RMSprop'}. Best is trial 48 with value: 0.06302274198290596.
2026-05-18 01:01:37,658 - experiment_functions - INFO - Early stopping at epoch 1550. Best Recall: 0.0577
2026-05-18 01:01:37,813 - optuna.study.study - INFO - Trial 54 finished with value: 0.057698332366537035 and parameters: {'n_layers': 1, 'embedding_dim': 32, 'lr': 0.0005385503165852236, 'lambda_val': 1.4918284572629455e-06, 'batch_size': 2452, 'optimizer': 'RMSprop'}. Best is trial 48 with value: 0.06302274198290596.
2026-05-18 01:02:01,223 - experiment_functions - INFO - Early stopping at epoch 1700. Best Recall: 0.0647
2026-05-18 01:02:01,334 - optuna.study.study - INFO - Trial 55 finished with value: 0.0647396174833636 and parameters: {'n_layers': 1, 'embedding_dim': 32, 'lr': 0.0005802416044399437, 'lambda_val': 4.653886181306129e-06, 'batch_size': 2435, 'optimizer': 'RMSprop'}. Best is trial 55 with value: 0.0647396174833636.
2026-05-18 01:02:25,167 - experiment_functions - INFO - Early stopping at epoch 1600. Best Recall: 0.0671
2026-05-18 01:02:25,260 - optuna.study.study - INFO - Trial 56 finished with value: 0.06706257189442368 and parameters: {'n_layers': 1, 'embedding_dim': 32, 'lr': 0.0005846734327908852, 'lambda_val': 1.1631134089502057e-06, 'batch_size': 2282, 'optimizer': 'RMSprop'}. Best is trial 56 with value: 0.06706257189442368.
2026-05-18 01:02:39,249 - optuna.study._optimize - INFO - Trial 57 pruned. 
2026-05-18 01:02:56,044 - optuna.study._optimize - INFO - Trial 58 pruned. 
2026-05-18 01:03:09,659 - optuna.study._optimize - INFO - Trial 59 pruned. 
2026-05-18 01:03:20,802 - experiment_functions - INFO - Early stopping at epoch 550. Best Recall: 0.0084
2026-05-18 01:03:21,383 - optuna.study.study - INFO - Trial 60 finished with value: 0.00844467453663429 and parameters: {'n_layers': 1, 'embedding_dim': 32, 'lr': 0.06161910577810881, 'lambda_val': 3.685929592527147e-06, 'batch_size': 2412, 'optimizer': 'RMSprop'}. Best is trial 56 with value: 0.06706257189442368.
2026-05-18 01:03:47,394 - experiment_functions - INFO - Early stopping at epoch 1600. Best Recall: 0.0596
2026-05-18 01:03:47,971 - optuna.study.study - INFO - Trial 61 finished with value: 0.05959351916933118 and parameters: {'n_layers': 1, 'embedding_dim': 32, 'lr': 0.0006115656279470211, 'lambda_val': 1.6347586897402032e-06, 'batch_size': 2538, 'optimizer': 'RMSprop'}. Best is trial 56 with value: 0.06706257189442368.
2026-05-18 01:04:03,924 - experiment_functions - INFO - Early stopping at epoch 1100. Best Recall: 0.0579
2026-05-18 01:04:04,068 - optuna.study.study - INFO - Trial 62 finished with value: 0.05793822809393464 and parameters: {'n_layers': 1, 'embedding_dim': 32, 'lr': 0.0006662698285467906, 'lambda_val': 1.6676790913985671e-06, 'batch_size': 2601, 'optimizer': 'RMSprop'}. Best is trial 56 with value: 0.06706257189442368.
2026-05-18 01:04:17,669 - optuna.study._optimize - INFO - Trial 63 pruned. 
2026-05-18 01:04:30,352 - experiment_functions - INFO - Early stopping at epoch 700. Best Recall: 0.0489
2026-05-18 01:04:30,442 - optuna.study.study - INFO - Trial 64 finished with value: 0.048908329670141686 and parameters: {'n_layers': 1, 'embedding_dim': 32, 'lr': 0.001477533057363254, 'lambda_val': 1.095554420881381e-06, 'batch_size': 2089, 'optimizer': 'RMSprop'}. Best is trial 56 with value: 0.06706257189442368.
2026-05-18 01:04:59,494 - experiment_functions - INFO - Early stopping at epoch 2050. Best Recall: 0.0655
2026-05-18 01:04:59,592 - optuna.study.study - INFO - Trial 65 finished with value: 0.06552113767480028 and parameters: {'n_layers': 1, 'embedding_dim': 32, 'lr': 0.000620503143427411, 'lambda_val': 5.166028775587846e-06, 'batch_size': 1778, 'optimizer': 'RMSprop'}. Best is trial 56 with value: 0.06706257189442368.
2026-05-18 01:05:33,682 - experiment_functions - INFO - Early stopping at epoch 1700. Best Recall: 0.0629
2026-05-18 01:05:33,827 - optuna.study.study - INFO - Trial 66 finished with value: 0.06287380823553387 and parameters: {'n_layers': 1, 'embedding_dim': 32, 'lr': 0.0006417674102835396, 'lambda_val': 8.418457712124664e-06, 'batch_size': 1697, 'optimizer': 'RMSprop'}. Best is trial 56 with value: 0.06706257189442368.
2026-05-18 01:05:49,241 - optuna.study._optimize - INFO - Trial 67 pruned. 
2026-05-18 01:06:00,319 - experiment_functions - INFO - Early stopping at epoch 700. Best Recall: 0.0534
2026-05-18 01:06:00,408 - optuna.study.study - INFO - Trial 68 finished with value: 0.05336106803064462 and parameters: {'n_layers': 1, 'embedding_dim': 32, 'lr': 0.0014696242750728088, 'lambda_val': 1.0305477430865732e-05, 'batch_size': 1458, 'optimizer': 'RMSprop'}. Best is trial 56 with value: 0.06706257189442368.
2026-05-18 01:06:08,840 - experiment_functions - INFO - Early stopping at epoch 550. Best Recall: 0.0517
2026-05-18 01:06:08,942 - optuna.study.study - INFO - Trial 69 finished with value: 0.05166133646896141 and parameters: {'n_layers': 1, 'embedding_dim': 32, 'lr': 0.003138850906662367, 'lambda_val': 8.22691636224578e-06, 'batch_size': 1092, 'optimizer': 'RMSprop'}. Best is trial 56 with value: 0.06706257189442368.
2026-05-18 01:06:21,868 - experiment_functions - INFO - Early stopping at epoch 850. Best Recall: 0.0639
2026-05-18 01:06:21,967 - optuna.study.study - INFO - Trial 70 finished with value: 0.06387576480593805 and parameters: {'n_layers': 1, 'embedding_dim': 32, 'lr': 0.0011174177794893224, 'lambda_val': 1.5934424133611943e-05, 'batch_size': 1687, 'optimizer': 'RMSprop'}. Best is trial 56 with value: 0.06706257189442368.
2026-05-18 01:06:34,077 - experiment_functions - INFO - Early stopping at epoch 800. Best Recall: 0.0594
2026-05-18 01:06:34,188 - optuna.study.study - INFO - Trial 71 finished with value: 0.059407565715279505 and parameters: {'n_layers': 1, 'embedding_dim': 32, 'lr': 0.0012279751921619184, 'lambda_val': 2.386865398633124e-05, 'batch_size': 1697, 'optimizer': 'RMSprop'}. Best is trial 56 with value: 0.06706257189442368.
2026-05-18 01:06:49,738 - optuna.study._optimize - INFO - Trial 72 pruned. 
2026-05-18 01:07:06,417 - experiment_functions - INFO - Early stopping at epoch 1150. Best Recall: 0.0598
2026-05-18 01:07:06,518 - optuna.study.study - INFO - Trial 73 finished with value: 0.05983451217080895 and parameters: {'n_layers': 1, 'embedding_dim': 32, 'lr': 0.0007950793987969185, 'lambda_val': 1.8465762103631998e-06, 'batch_size': 1775, 'optimizer': 'RMSprop'}. Best is trial 56 with value: 0.06706257189442368.
2026-05-18 01:07:27,176 - experiment_functions - INFO - Early stopping at epoch 1400. Best Recall: 0.0616
2026-05-18 01:07:27,275 - optuna.study.study - INFO - Trial 74 finished with value: 0.061606590402794065 and parameters: {'n_layers': 1, 'embedding_dim': 32, 'lr': 0.0007333262105827454, 'lambda_val': 5.380590364804066e-06, 'batch_size': 1801, 'optimizer': 'RMSprop'}. Best is trial 56 with value: 0.06706257189442368.
2026-05-18 01:07:38,842 - experiment_functions - INFO - Early stopping at epoch 750. Best Recall: 0.0562
2026-05-18 01:07:38,942 - optuna.study.study - INFO - Trial 75 finished with value: 0.05619556563614505 and parameters: {'n_layers': 1, 'embedding_dim': 96, 'lr': 0.0010533944648341512, 'lambda_val': 1.978238304493996e-05, 'batch_size': 1259, 'optimizer': 'RMSprop'}. Best is trial 56 with value: 0.06706257189442368.
2026-05-18 01:07:48,178 - experiment_functions - INFO - Early stopping at epoch 600. Best Recall: 0.0469
2026-05-18 01:07:48,289 - optuna.study.study - INFO - Trial 76 finished with value: 0.04689472026964315 and parameters: {'n_layers': 1, 'embedding_dim': 32, 'lr': 0.002148098618132538, 'lambda_val': 4.761937752988626e-06, 'batch_size': 1615, 'optimizer': 'RMSprop'}. Best is trial 56 with value: 0.06706257189442368.
2026-05-18 01:08:03,353 - optuna.study._optimize - INFO - Trial 77 pruned. 
2026-05-18 01:08:25,586 - experiment_functions - INFO - Early stopping at epoch 1550. Best Recall: 0.0708
2026-05-18 01:08:25,699 - optuna.study.study - INFO - Trial 78 finished with value: 0.07075337190743955 and parameters: {'n_layers': 1, 'embedding_dim': 32, 'lr': 0.0008089777619709826, 'lambda_val': 9.655902335259329e-06, 'batch_size': 1096, 'optimizer': 'RMSprop'}. Best is trial 78 with value: 0.07075337190743955.
2026-05-18 01:09:11,746 - experiment_functions - INFO - Early stopping at epoch 3200. Best Recall: 0.0689
2026-05-18 01:09:11,824 - optuna.study.study - INFO - Trial 79 finished with value: 0.06888219859495658 and parameters: {'n_layers': 1, 'embedding_dim': 64, 'lr': 0.00042927384815155445, 'lambda_val': 8.04905734884227e-06, 'batch_size': 1539, 'optimizer': 'RMSprop'}. Best is trial 78 with value: 0.07075337190743955.
