2026-05-18 07:08:35,750 - optuna.study.study - INFO - Trial 64 finished with value: 0.05257471571764241 and parameters: {'n_layers': 1, 'embedding_dim': 64, 'lr': 0.0014884853783661606, 'lambda_val': 8.682194242988347e-05, 'batch_size': 1683, 'optimizer': 'RMSprop'}. Best is trial 39 with value: 0.06407376696623482.
2026-05-18 07:08:54,943 - experiment_functions - INFO - Early stopping at epoch 1300. Best Recall: 0.0617
2026-05-18 07:08:55,033 - optuna.study.study - INFO - Trial 65 finished with value: 0.06172867064593774 and parameters: {'n_layers': 1, 'embedding_dim': 64, 'lr': 0.000681411808798772, 'lambda_val': 3.7330600504063105e-05, 'batch_size': 1204, 'optimizer': 'RMSprop'}. Best is trial 39 with value: 0.06407376696623482.
2026-05-18 07:09:11,234 - experiment_functions - INFO - Early stopping at epoch 1100. Best Recall: 0.0663
2026-05-18 07:09:11,348 - optuna.study.study - INFO - Trial 66 finished with value: 0.06632213490628613 and parameters: {'n_layers': 1, 'embedding_dim': 64, 'lr': 0.0009056214650699644, 'lambda_val': 4.046133802813067e-05, 'batch_size': 868, 'optimizer': 'RMSprop'}. Best is trial 66 with value: 0.06632213490628613.
2026-05-18 07:09:21,995 - experiment_functions - INFO - Early stopping at epoch 700. Best Recall: 0.0419
2026-05-18 07:09:22,104 - optuna.study.study - INFO - Trial 67 finished with value: 0.0419275738775186 and parameters: {'n_layers': 3, 'embedding_dim': 64, 'lr': 0.0009636995799751103, 'lambda_val': 7.789114324870972e-06, 'batch_size': 1046, 'optimizer': 'Adam'}. Best is trial 66 with value: 0.06632213490628613.
2026-05-18 07:09:31,202 - experiment_functions - INFO - Early stopping at epoch 550. Best Recall: 0.0279
2026-05-18 07:09:31,319 - optuna.study.study - INFO - Trial 68 finished with value: 0.027853403401589226 and parameters: {'n_layers': 1, 'embedding_dim': 64, 'lr': 0.005178845162771552, 'lambda_val': 1.9188729155556314e-05, 'batch_size': 716, 'optimizer': 'RMSprop'}. Best is trial 66 with value: 0.06632213490628613.
2026-05-18 07:09:43,214 - experiment_functions - INFO - Early stopping at epoch 800. Best Recall: 0.0583
2026-05-18 07:09:43,306 - optuna.study.study - INFO - Trial 69 finished with value: 0.05829137717283712 and parameters: {'n_layers': 1, 'embedding_dim': 64, 'lr': 0.0013880760197056074, 'lambda_val': 5.2327207076877546e-05, 'batch_size': 799, 'optimizer': 'RMSprop'}. Best is trial 66 with value: 0.06632213490628613.
2026-05-18 07:09:57,098 - optuna.study._optimize - INFO - Trial 70 pruned. 
2026-05-18 07:10:15,685 - experiment_functions - INFO - Early stopping at epoch 1250. Best Recall: 0.0614
2026-05-18 07:10:15,783 - optuna.study.study - INFO - Trial 71 finished with value: 0.06137629050627507 and parameters: {'n_layers': 1, 'embedding_dim': 64, 'lr': 0.0007640726844035434, 'lambda_val': 1.110449813555914e-05, 'batch_size': 1172, 'optimizer': 'RMSprop'}. Best is trial 66 with value: 0.06632213490628613.
2026-05-18 07:10:54,123 - experiment_functions - INFO - Early stopping at epoch 2700. Best Recall: 0.0675
2026-05-18 07:10:54,217 - optuna.study.study - INFO - Trial 72 finished with value: 0.06754372710880222 and parameters: {'n_layers': 1, 'embedding_dim': 64, 'lr': 0.000491842609013955, 'lambda_val': 3.994859916923151e-05, 'batch_size': 1459, 'optimizer': 'RMSprop'}. Best is trial 72 with value: 0.06754372710880222.
2026-05-18 07:11:08,526 - optuna.study._optimize - INFO - Trial 73 pruned. 
2026-05-18 07:11:17,939 - experiment_functions - INFO - Early stopping at epoch 600. Best Recall: 0.0513
2026-05-18 07:11:18,040 - optuna.study.study - INFO - Trial 74 finished with value: 0.05127257497014535 and parameters: {'n_layers': 1, 'embedding_dim': 64, 'lr': 0.0018959208903224132, 'lambda_val': 0.00010375085922245477, 'batch_size': 2153, 'optimizer': 'RMSprop'}. Best is trial 72 with value: 0.06754372710880222.
2026-05-18 07:11:26,851 - experiment_functions - INFO - Early stopping at epoch 550. Best Recall: 0.0293
2026-05-18 07:11:26,951 - optuna.study.study - INFO - Trial 75 finished with value: 0.029260687571297624 and parameters: {'n_layers': 4, 'embedding_dim': 64, 'lr': 0.0010680277391842763, 'lambda_val': 2.185196750462229e-05, 'batch_size': 1867, 'optimizer': 'RMSprop'}. Best is trial 72 with value: 0.06754372710880222.
2026-05-18 07:11:37,183 - experiment_functions - INFO - Early stopping at epoch 500. Best Recall: 0.0055
2026-05-18 07:11:37,291 - optuna.study.study - INFO - Trial 76 finished with value: 0.005463069869044842 and parameters: {'n_layers': 1, 'embedding_dim': 128, 'lr': 0.0001440985974545635, 'lambda_val': 0.0001428740878931047, 'batch_size': 1539, 'optimizer': 'SGD'}. Best is trial 72 with value: 0.06754372710880222.
2026-05-18 07:11:52,537 - optuna.study._optimize - INFO - Trial 77 pruned. 
2026-05-18 07:12:02,215 - experiment_functions - INFO - Early stopping at epoch 650. Best Recall: 0.0579
2026-05-18 07:12:02,314 - optuna.study.study - INFO - Trial 78 finished with value: 0.0578932273201875 and parameters: {'n_layers': 1, 'embedding_dim': 64, 'lr': 0.0028059367874968045, 'lambda_val': 4.341458843585313e-06, 'batch_size': 1806, 'optimizer': 'Adam'}. Best is trial 72 with value: 0.06754372710880222.
2026-05-18 07:12:16,439 - optuna.study._optimize - INFO - Trial 79 pruned. 
2026-05-18 07:12:29,471 - optuna.study._optimize - INFO - Trial 80 pruned. 
2026-05-18 07:12:43,284 - experiment_functions - INFO - Early stopping at epoch 1000. Best Recall: 0.0622
2026-05-18 07:12:43,384 - optuna.study.study - INFO - Trial 81 finished with value: 0.06222383444065187 and parameters: {'n_layers': 1, 'embedding_dim': 64, 'lr': 0.0008717594083175874, 'lambda_val': 3.814511473262745e-05, 'batch_size': 1247, 'optimizer': 'RMSprop'}. Best is trial 72 with value: 0.06754372710880222.
2026-05-18 07:12:57,718 - experiment_functions - INFO - Early stopping at epoch 950. Best Recall: 0.0625
2026-05-18 07:12:57,829 - optuna.study.study - INFO - Trial 82 finished with value: 0.06251924642574705 and parameters: {'n_layers': 1, 'embedding_dim': 64, 'lr': 0.0008872700560214779, 'lambda_val': 6.936084937052788e-05, 'batch_size': 1254, 'optimizer': 'RMSprop'}. Best is trial 72 with value: 0.06754372710880222.
2026-05-18 07:13:07,356 - experiment_functions - INFO - Early stopping at epoch 650. Best Recall: 0.0602
2026-05-18 07:13:07,464 - optuna.study.study - INFO - Trial 83 finished with value: 0.06023896690417657 and parameters: {'n_layers': 1, 'embedding_dim': 64, 'lr': 0.0013441542675197784, 'lambda_val': 0.00026127981358300555, 'batch_size': 1423, 'optimizer': 'RMSprop'}. Best is trial 72 with value: 0.06754372710880222.
2026-05-18 07:13:34,966 - experiment_functions - INFO - Early stopping at epoch 2000. Best Recall: 0.0677
2026-05-18 07:13:35,115 - optuna.study.study - INFO - Trial 84 finished with value: 0.06766327511988478 and parameters: {'n_layers': 1, 'embedding_dim': 64, 'lr': 0.0005627924226955929, 'lambda_val': 5.9581163315269244e-05, 'batch_size': 1286, 'optimizer': 'RMSprop'}. Best is trial 84 with value: 0.06766327511988478.
2026-05-18 07:13:51,771 - experiment_functions - INFO - Early stopping at epoch 1200. Best Recall: 0.0646
2026-05-18 07:13:51,869 - optuna.study.study - INFO - Trial 85 finished with value: 0.06455320735720518 and parameters: {'n_layers': 1, 'embedding_dim': 64, 'lr': 0.0007260281699294741, 'lambda_val': 8.511066787733906e-05, 'batch_size': 1327, 'optimizer': 'RMSprop'}. Best is trial 84 with value: 0.06766327511988478.
2026-05-18 07:14:07,846 - experiment_functions - INFO - Early stopping at epoch 1150. Best Recall: 0.0638
2026-05-18 07:14:07,936 - optuna.study.study - INFO - Trial 86 finished with value: 0.06379053115126089 and parameters: {'n_layers': 1, 'embedding_dim': 64, 'lr': 0.0008190089940395501, 'lambda_val': 4.9988149002210143e-05, 'batch_size': 1311, 'optimizer': 'RMSprop'}. Best is trial 84 with value: 0.06766327511988478.
2026-05-18 07:14:17,320 - experiment_functions - INFO - Early stopping at epoch 600. Best Recall: 0.0564
2026-05-18 07:14:17,431 - optuna.study.study - INFO - Trial 87 finished with value: 0.056419790989960986 and parameters: {'n_layers': 1, 'embedding_dim': 64, 'lr': 0.0016729311939035986, 'lambda_val': 4.9720343934812384e-05, 'batch_size': 1350, 'optimizer': 'RMSprop'}. Best is trial 84 with value: 0.06766327511988478.
2026-05-18 07:14:27,615 - experiment_functions - INFO - Early stopping at epoch 650. Best Recall: 0.0557
2026-05-18 07:14:27,714 - optuna.study.study - INFO - Trial 88 finished with value: 0.055718420686570035 and parameters: {'n_layers': 1, 'embedding_dim': 256, 'lr': 0.0011847941903101837, 'lambda_val': 9.32460856304542e-05, 'batch_size': 1499, 'optimizer': 'RMSprop'}. Best is trial 84 with value: 0.06766327511988478.
2026-05-18 07:14:47,783 - experiment_functions - INFO - Early stopping at epoch 1350. Best Recall: 0.0613
2026-05-18 07:14:47,873 - optuna.study.study - INFO - Trial 89 finished with value: 0.06134175163702058 and parameters: {'n_layers': 1, 'embedding_dim': 64, 'lr': 0.0007777879190743318, 'lambda_val': 0.00012578114669694612, 'batch_size': 1082, 'optimizer': 'RMSprop'}. Best is trial 84 with value: 0.06766327511988478.
2026-05-18 07:14:55,272 - experiment_functions - INFO - Early stopping at epoch 500. Best Recall: 0.0047
2026-05-18 07:14:55,363 - optuna.study.study - INFO - Trial 90 finished with value: 0.004721680485967861 and parameters: {'n_layers': 1, 'embedding_dim': 64, 'lr': 0.0022814654229949926, 'lambda_val': 1.757692211631527e-05, 'batch_size': 1650, 'optimizer': 'SGD'}. Best is trial 84 with value: 0.06766327511988478.
2026-05-18 07:15:08,968 - optuna.study._optimize - INFO - Trial 91 pruned. 
2026-05-18 07:15:25,684 - experiment_functions - INFO - Early stopping at epoch 1200. Best Recall: 0.0615
2026-05-18 07:15:25,795 - optuna.study.study - INFO - Trial 92 finished with value: 0.061490985391061216 and parameters: {'n_layers': 1, 'embedding_dim': 64, 'lr': 0.0007924932993089532, 'lambda_val': 5.547428680194786e-05, 'batch_size': 1259, 'optimizer': 'RMSprop'}. Best is trial 84 with value: 0.06766327511988478.
2026-05-18 07:15:39,616 - optuna.study._optimize - INFO - Trial 93 pruned. 
2026-05-18 07:15:54,634 - experiment_functions - INFO - Early stopping at epoch 1050. Best Recall: 0.0618
2026-05-18 07:15:54,711 - optuna.study.study - INFO - Trial 94 finished with value: 0.06183818276290535 and parameters: {'n_layers': 1, 'embedding_dim': 64, 'lr': 0.000911303604878628, 'lambda_val': 7.775754176018928e-05, 'batch_size': 1168, 'optimizer': 'RMSprop'}. Best is trial 84 with value: 0.06766327511988478.
2026-05-18 07:16:08,328 - optuna.study._optimize - INFO - Trial 95 pruned. 
2026-05-18 07:16:18,308 - experiment_functions - INFO - Early stopping at epoch 700. Best Recall: 0.0578
2026-05-18 07:16:18,396 - optuna.study.study - INFO - Trial 96 finished with value: 0.05777345371648814 and parameters: {'n_layers': 1, 'embedding_dim': 64, 'lr': 0.0011873160402032282, 'lambda_val': 0.00011492086257542247, 'batch_size': 1751, 'optimizer': 'RMSprop'}. Best is trial 84 with value: 0.06766327511988478.
2026-05-18 07:16:40,417 - optuna.study._optimize - INFO - Trial 97 pruned. 
2026-05-18 07:16:49,976 - experiment_functions - INFO - Early stopping at epoch 650. Best Recall: 0.0590
2026-05-18 07:16:50,066 - optuna.study.study - INFO - Trial 98 finished with value: 0.05896053477630736 and parameters: {'n_layers': 1, 'embedding_dim': 64, 'lr': 0.0016617508497334425, 'lambda_val': 5.934098812581893e-05, 'batch_size': 1101, 'optimizer': 'RMSprop'}. Best is trial 84 with value: 0.06766327511988478.
2026-05-18 07:17:03,894 - experiment_functions - INFO - Early stopping at epoch 950. Best Recall: 0.0424
2026-05-18 07:17:03,993 - optuna.study.study - INFO - Trial 99 finished with value: 0.0424305337640388 and parameters: {'n_layers': 3, 'embedding_dim': 64, 'lr': 0.000468217884106468, 'lambda_val': 4.7561555935895295e-05, 'batch_size': 1280, 'optimizer': 'RMSprop'}. Best is trial 84 with value: 0.06766327511988478.
2026-05-18 07:17:20,931 - experiment_functions - INFO - Early stopping at epoch 1150. Best Recall: 0.0616
2026-05-18 07:17:21,030 - optuna.study.study - INFO - Trial 100 finished with value: 0.061621628901223774 and parameters: {'n_layers': 1, 'embedding_dim': 64, 'lr': 0.0007010988955640161, 'lambda_val': 8.424909462829645e-05, 'batch_size': 1620, 'optimizer': 'RMSprop'}. Best is trial 84 with value: 0.06766327511988478.
2026-05-18 07:17:35,100 - optuna.study._optimize - INFO - Trial 101 pruned. 
2026-05-18 07:17:49,088 - experiment_functions - INFO - Early stopping at epoch 1000. Best Recall: 0.0654
2026-05-18 07:17:49,187 - optuna.study.study - INFO - Trial 102 finished with value: 0.06544023567722651 and parameters: {'n_layers': 1, 'embedding_dim': 64, 'lr': 0.0009699843808848341, 'lambda_val': 3.0907215172222725e-05, 'batch_size': 983, 'optimizer': 'RMSprop'}. Best is trial 84 with value: 0.06766327511988478.
2026-05-18 07:18:06,421 - experiment_functions - INFO - Early stopping at epoch 1000. Best Recall: 0.0591
2026-05-18 07:18:07,193 - optuna.study.study - INFO - Trial 103 finished with value: 0.059117411409505716 and parameters: {'n_layers': 1, 'embedding_dim': 64, 'lr': 0.0010140897392202815, 'lambda_val': 3.0516892833349087e-05, 'batch_size': 1033, 'optimizer': 'RMSprop'}. Best is trial 84 with value: 0.06766327511988478.
2026-05-18 07:18:25,553 - experiment_functions - INFO - Early stopping at epoch 800. Best Recall: 0.0630
2026-05-18 07:18:25,642 - optuna.study.study - INFO - Trial 104 finished with value: 0.06295149587278388 and parameters: {'n_layers': 1, 'embedding_dim': 64, 'lr': 0.0012917091362608807, 'lambda_val': 4.1724674963839874e-05, 'batch_size': 770, 'optimizer': 'RMSprop'}. Best is trial 84 with value: 0.06766327511988478.
2026-05-18 07:18:36,360 - experiment_functions - INFO - Early stopping at epoch 750. Best Recall: 0.0605
2026-05-18 07:18:36,451 - optuna.study.study - INFO - Trial 105 finished with value: 0.060476303619035277 and parameters: {'n_layers': 1, 'embedding_dim': 64, 'lr': 0.0013399123084627711, 'lambda_val': 1.2438370661828484e-05, 'batch_size': 852, 'optimizer': 'RMSprop'}. Best is trial 84 with value: 0.06766327511988478.
2026-05-18 07:19:08,365 - experiment_functions - INFO - Early stopping at epoch 2350. Best Recall: 0.0691
2026-05-18 07:19:08,533 - optuna.study.study - INFO - Trial 106 finished with value: 0.06911264322413338 and parameters: {'n_layers': 1, 'embedding_dim': 64, 'lr': 0.000688373206199894, 'lambda_val': 4.45441686831155e-05, 'batch_size': 633, 'optimizer': 'RMSprop'}. Best is trial 106 with value: 0.06911264322413338.
2026-05-18 07:19:18,043 - experiment_functions - INFO - Early stopping at epoch 650. Best Recall: 0.0554
2026-05-18 07:19:18,149 - optuna.study.study - INFO - Trial 107 finished with value: 0.055441011261043865 and parameters: {'n_layers': 1, 'embedding_dim': 64, 'lr': 0.0020772051881624265, 'lambda_val': 4.2125700326155887e-05, 'batch_size': 565, 'optimizer': 'RMSprop'}. Best is trial 106 with value: 0.06911264322413338.
2026-05-18 07:19:32,864 - optuna.study._optimize - INFO - Trial 108 pruned. 
2026-05-18 07:19:46,443 - optuna.study._optimize - INFO - Trial 109 pruned. 
2026-05-18 07:20:01,610 - optuna.study._optimize - INFO - Trial 110 pruned. 
2026-05-18 07:20:33,567 - experiment_functions - INFO - Early stopping at epoch 2250. Best Recall: 0.0661
2026-05-18 07:20:33,658 - optuna.study.study - INFO - Trial 111 finished with value: 0.06605126744444173 and parameters: {'n_layers': 1, 'embedding_dim': 64, 'lr': 0.0006738220960874804, 'lambda_val': 4.203945958181617e-05, 'batch_size': 809, 'optimizer': 'RMSprop'}. Best is trial 106 with value: 0.06911264322413338.
2026-05-18 07:20:58,451 - experiment_functions - INFO - Early stopping at epoch 1850. Best Recall: 0.0666
2026-05-18 07:20:58,558 - optuna.study.study - INFO - Trial 112 finished with value: 0.06655376324292481 and parameters: {'n_layers': 1, 'embedding_dim': 64, 'lr': 0.0006380281874665276, 'lambda_val': 4.5704524521674014e-05, 'batch_size': 878, 'optimizer': 'RMSprop'}. Best is trial 106 with value: 0.06911264322413338.
2026-05-18 07:21:33,501 - experiment_functions - INFO - Early stopping at epoch 2400. Best Recall: 0.0684
2026-05-18 07:21:33,590 - optuna.study.study - INFO - Trial 113 finished with value: 0.06837178627488805 and parameters: {'n_layers': 1, 'embedding_dim': 64, 'lr': 0.0006254443988801664, 'lambda_val': 4.062081976241924e-05, 'batch_size': 825, 'optimizer': 'RMSprop'}. Best is trial 106 with value: 0.06911264322413338.
2026-05-18 07:22:03,597 - optuna.study._optimize - INFO - Trial 114 pruned. 
2026-05-18 07:22:16,769 - optuna.study._optimize - INFO - Trial 115 pruned. 
2026-05-18 07:22:23,897 - experiment_functions - INFO - Early stopping at epoch 500. Best Recall: 0.0054
2026-05-18 07:22:24,021 - optuna.study.study - INFO - Trial 116 finished with value: 0.005383144677525606 and parameters: {'n_layers': 1, 'embedding_dim': 64, 'lr': 0.0005708166004126667, 'lambda_val': 0.00013198494795672823, 'batch_size': 643, 'optimizer': 'SGD'}. Best is trial 106 with value: 0.06911264322413338.
2026-05-18 07:22:37,593 - optuna.study._optimize - INFO - Trial 117 pruned. 
2026-05-18 07:22:53,948 - experiment_functions - INFO - Early stopping at epoch 1200. Best Recall: 0.0675
2026-05-18 07:22:54,091 - optuna.study.study - INFO - Trial 118 finished with value: 0.06746305355831565 and parameters: {'n_layers': 1, 'embedding_dim': 64, 'lr': 0.0007966126299114389, 'lambda_val': 0.00040290245968310783, 'batch_size': 1003, 'optimizer': 'RMSprop'}. Best is trial 106 with value: 0.06911264322413338.
2026-05-18 07:23:16,911 - optuna.study._optimize - INFO - Trial 119 pruned. 
2026-05-18 07:23:31,167 - optuna.study._optimize - INFO - Trial 120 pruned. 
2026-05-18 07:23:49,911 - experiment_functions - INFO - Early stopping at epoch 1200. Best Recall: 0.0617
2026-05-18 07:23:50,001 - optuna.study.study - INFO - Trial 121 finished with value: 0.06171488008334466 and parameters: {'n_layers': 1, 'embedding_dim': 64, 'lr': 0.0007946484764278378, 'lambda_val': 0.0003900562015458746, 'batch_size': 1125, 'optimizer': 'RMSprop'}. Best is trial 106 with value: 0.06911264322413338.
2026-05-18 07:24:06,070 - experiment_functions - INFO - Early stopping at epoch 1000. Best Recall: 0.0583
2026-05-18 07:24:06,169 - optuna.study.study - INFO - Trial 122 finished with value: 0.058306722178454194 and parameters: {'n_layers': 1, 'embedding_dim': 64, 'lr': 0.0009574795647067992, 'lambda_val': 0.0002264032084637692, 'batch_size': 1022, 'optimizer': 'RMSprop'}. Best is trial 106 with value: 0.06911264322413338.
2026-05-18 07:24:37,078 - optuna.study._optimize - INFO - Trial 123 pruned. 
2026-05-18 07:24:50,848 - optuna.study._optimize - INFO - Trial 124 pruned. 
2026-05-18 07:25:06,385 - experiment_functions - INFO - Early stopping at epoch 1050. Best Recall: 0.0636
2026-05-18 07:25:06,475 - optuna.study.study - INFO - Trial 125 finished with value: 0.06357122797425863 and parameters: {'n_layers': 1, 'embedding_dim': 64, 'lr': 0.0010597187309637835, 'lambda_val': 0.0003007003656583918, 'batch_size': 910, 'optimizer': 'RMSprop'}. Best is trial 106 with value: 0.06911264322413338.
2026-05-18 07:25:20,839 - optuna.study._optimize - INFO - Trial 126 pruned. 
2026-05-18 07:25:31,461 - experiment_functions - INFO - Early stopping at epoch 700. Best Recall: 0.0514
2026-05-18 07:25:31,571 - optuna.study.study - INFO - Trial 127 finished with value: 0.05142245793847681 and parameters: {'n_layers': 1, 'embedding_dim': 64, 'lr': 0.0008514802388350066, 'lambda_val': 0.00017313218972513442, 'batch_size': 4075, 'optimizer': 'RMSprop'}. Best is trial 106 with value: 0.06911264322413338.
2026-05-18 07:25:53,126 - experiment_functions - INFO - Early stopping at epoch 1500. Best Recall: 0.0655
2026-05-18 07:25:53,669 - optuna.study.study - INFO - Trial 128 finished with value: 0.06552805327725189 and parameters: {'n_layers': 1, 'embedding_dim': 64, 'lr': 0.0006695660333284041, 'lambda_val': 7.221212521813334e-05, 'batch_size': 1161, 'optimizer': 'RMSprop'}. Best is trial 106 with value: 0.06911264322413338.
2026-05-18 07:26:09,246 - optuna.study._optimize - INFO - Trial 129 pruned. 
2026-05-18 07:26:37,162 - experiment_functions - INFO - Early stopping at epoch 2000. Best Recall: 0.0688
2026-05-18 07:26:37,260 - optuna.study.study - INFO - Trial 130 finished with value: 0.06877626309781823 and parameters: {'n_layers': 1, 'embedding_dim': 64, 'lr': 0.0006508627812492716, 'lambda_val': 0.00011559906265861166, 'batch_size': 989, 'optimizer': 'RMSprop'}. Best is trial 106 with value: 0.06911264322413338.
2026-05-18 07:27:09,652 - experiment_functions - INFO - Early stopping at epoch 2300. Best Recall: 0.0682
2026-05-18 07:27:09,741 - optuna.study.study - INFO - Trial 131 finished with value: 0.06822551256395479 and parameters: {'n_layers': 1, 'embedding_dim': 64, 'lr': 0.0005969131614491727, 'lambda_val': 0.00010977007970900658, 'batch_size': 977, 'optimizer': 'RMSprop'}. Best is trial 106 with value: 0.06911264322413338.
2026-05-18 07:27:33,463 - optuna.study._optimize - INFO - Trial 132 pruned. 
2026-05-18 07:27:50,773 - optuna.study._optimize - INFO - Trial 133 pruned. 
2026-05-18 07:28:12,902 - experiment_functions - INFO - Early stopping at epoch 1550. Best Recall: 0.0665
2026-05-18 07:28:12,991 - optuna.study.study - INFO - Trial 134 finished with value: 0.06654574892754578 and parameters: {'n_layers': 1, 'embedding_dim': 64, 'lr': 0.0006365282895395957, 'lambda_val': 6.237566116783012e-05, 'batch_size': 974, 'optimizer': 'RMSprop'}. Best is trial 106 with value: 0.06911264322413338.
2026-05-18 07:28:27,245 - optuna.study._optimize - INFO - Trial 135 pruned. 
2026-05-18 07:28:49,076 - optuna.study._optimize - INFO - Trial 136 pruned. 
2026-05-18 07:28:59,550 - experiment_functions - INFO - Early stopping at epoch 700. Best Recall: 0.0605
