2026-05-18 02:42:02,980 - optuna.study.study - INFO - Trial 74 finished with value: 0.03846122135616028 and parameters: {'n_layers': 4, 'embedding_dim': 256, 'lr': 0.0005172491863477844, 'lambda_val': 2.7702860833185117e-05, 'batch_size': 857, 'optimizer': 'Adam'}. Best is trial 45 with value: 0.06359008908397099.
2026-05-18 02:42:15,586 - experiment_functions - INFO - Early stopping at epoch 850. Best Recall: 0.0614
2026-05-18 02:42:15,696 - optuna.study.study - INFO - Trial 75 finished with value: 0.061427531978155994 and parameters: {'n_layers': 1, 'embedding_dim': 128, 'lr': 0.0017046583749944068, 'lambda_val': 0.00016297051400732763, 'batch_size': 593, 'optimizer': 'Adam'}. Best is trial 45 with value: 0.06359008908397099.
2026-05-18 02:42:28,302 - experiment_functions - INFO - Early stopping at epoch 850. Best Recall: 0.0589
2026-05-18 02:42:28,405 - optuna.study.study - INFO - Trial 76 finished with value: 0.058876075445075726 and parameters: {'n_layers': 1, 'embedding_dim': 128, 'lr': 0.0017223311452185305, 'lambda_val': 0.0007728982526320823, 'batch_size': 617, 'optimizer': 'Adam'}. Best is trial 45 with value: 0.06359008908397099.
2026-05-18 02:42:35,432 - experiment_functions - INFO - Early stopping at epoch 500. Best Recall: 0.0054
2026-05-18 02:42:35,521 - optuna.study.study - INFO - Trial 77 finished with value: 0.005434833763669755 and parameters: {'n_layers': 1, 'embedding_dim': 128, 'lr': 0.0003093681571768962, 'lambda_val': 0.0001783847470964442, 'batch_size': 601, 'optimizer': 'SGD'}. Best is trial 45 with value: 0.06359008908397099.
2026-05-18 02:42:50,532 - experiment_functions - INFO - Early stopping at epoch 1050. Best Recall: 0.0553
2026-05-18 02:42:50,664 - optuna.study.study - INFO - Trial 78 finished with value: 0.05533373867734701 and parameters: {'n_layers': 1, 'embedding_dim': 128, 'lr': 0.0006587288953936167, 'lambda_val': 6.749042656249658e-05, 'batch_size': 3194, 'optimizer': 'Adam'}. Best is trial 45 with value: 0.06359008908397099.
2026-05-18 02:43:12,152 - experiment_functions - INFO - Early stopping at epoch 1400. Best Recall: 0.0564
2026-05-18 02:43:12,242 - optuna.study.study - INFO - Trial 79 finished with value: 0.056409126169622036 and parameters: {'n_layers': 2, 'embedding_dim': 128, 'lr': 0.000427421200349002, 'lambda_val': 4.2065126942440485e-05, 'batch_size': 1010, 'optimizer': 'Adam'}. Best is trial 45 with value: 0.06359008908397099.
2026-05-18 02:43:21,609 - experiment_functions - INFO - Early stopping at epoch 600. Best Recall: 0.0504
2026-05-18 02:43:21,699 - optuna.study.study - INFO - Trial 80 finished with value: 0.05041573910008052 and parameters: {'n_layers': 1, 'embedding_dim': 128, 'lr': 0.002128585521523781, 'lambda_val': 0.00010526597606228093, 'batch_size': 718, 'optimizer': 'RMSprop'}. Best is trial 45 with value: 0.06359008908397099.
2026-05-18 02:43:36,637 - experiment_functions - INFO - Early stopping at epoch 950. Best Recall: 0.0553
2026-05-18 02:43:36,737 - optuna.study.study - INFO - Trial 81 finished with value: 0.05531902215117243 and parameters: {'n_layers': 1, 'embedding_dim': 256, 'lr': 0.0011150351368335886, 'lambda_val': 0.0002958083648848664, 'batch_size': 947, 'optimizer': 'Adam'}. Best is trial 45 with value: 0.06359008908397099.
2026-05-18 02:43:54,134 - experiment_functions - INFO - Early stopping at epoch 1150. Best Recall: 0.0632
2026-05-18 02:43:54,213 - optuna.study.study - INFO - Trial 82 finished with value: 0.06322881678233463 and parameters: {'n_layers': 1, 'embedding_dim': 128, 'lr': 0.0008557161207783262, 'lambda_val': 0.008971898306939381, 'batch_size': 830, 'optimizer': 'Adam'}. Best is trial 45 with value: 0.06359008908397099.
2026-05-18 02:44:01,617 - experiment_functions - INFO - Early stopping at epoch 500. Best Recall: 0.0051
2026-05-18 02:44:01,707 - optuna.study.study - INFO - Trial 83 finished with value: 0.005104061566901559 and parameters: {'n_layers': 1, 'embedding_dim': 128, 'lr': 0.0004945581133779235, 'lambda_val': 0.03835336434717941, 'batch_size': 520, 'optimizer': 'Adam'}. Best is trial 45 with value: 0.06359008908397099.
2026-05-18 02:44:12,271 - experiment_functions - INFO - Early stopping at epoch 700. Best Recall: 0.0560
2026-05-18 02:44:12,414 - optuna.study.study - INFO - Trial 84 finished with value: 0.056030409322459084 and parameters: {'n_layers': 1, 'embedding_dim': 128, 'lr': 0.001345749757619992, 'lambda_val': 0.007943333520487612, 'batch_size': 2388, 'optimizer': 'Adam'}. Best is trial 45 with value: 0.06359008908397099.
2026-05-18 02:44:19,864 - experiment_functions - INFO - Early stopping at epoch 500. Best Recall: 0.0057
2026-05-18 02:44:19,974 - optuna.study.study - INFO - Trial 85 finished with value: 0.005673404215295775 and parameters: {'n_layers': 1, 'embedding_dim': 128, 'lr': 0.0003440263295870116, 'lambda_val': 0.015949478930382992, 'batch_size': 741, 'optimizer': 'Adam'}. Best is trial 45 with value: 0.06359008908397099.
2026-05-18 02:44:30,351 - experiment_functions - INFO - Early stopping at epoch 650. Best Recall: 0.0583
2026-05-18 02:44:30,442 - optuna.study.study - INFO - Trial 86 finished with value: 0.05833613782377977 and parameters: {'n_layers': 1, 'embedding_dim': 128, 'lr': 0.0028353201953175105, 'lambda_val': 0.004663998596188028, 'batch_size': 1101, 'optimizer': 'Adam'}. Best is trial 45 with value: 0.06359008908397099.
2026-05-18 02:44:43,479 - experiment_functions - INFO - Early stopping at epoch 800. Best Recall: 0.0479
2026-05-18 02:44:43,569 - optuna.study.study - INFO - Trial 87 finished with value: 0.04786804993292324 and parameters: {'n_layers': 3, 'embedding_dim': 128, 'lr': 0.0006820023594006518, 'lambda_val': 0.00017104754529071882, 'batch_size': 792, 'optimizer': 'Adam'}. Best is trial 45 with value: 0.06359008908397099.
2026-05-18 02:44:50,981 - experiment_functions - INFO - Early stopping at epoch 500. Best Recall: 0.0051
2026-05-18 02:44:51,082 - optuna.study.study - INFO - Trial 88 finished with value: 0.0051430811627889254 and parameters: {'n_layers': 1, 'embedding_dim': 32, 'lr': 0.00023453933163597178, 'lambda_val': 0.011175010975078226, 'batch_size': 1350, 'optimizer': 'Adam'}. Best is trial 45 with value: 0.06359008908397099.
2026-05-18 02:45:04,598 - experiment_functions - INFO - Early stopping at epoch 900. Best Recall: 0.0594
2026-05-18 02:45:04,697 - optuna.study.study - INFO - Trial 89 finished with value: 0.05937276208094197 and parameters: {'n_layers': 1, 'embedding_dim': 96, 'lr': 0.0008640024668655956, 'lambda_val': 0.0004966561001523653, 'batch_size': 1588, 'optimizer': 'RMSprop'}. Best is trial 45 with value: 0.06359008908397099.
2026-05-18 02:45:14,375 - experiment_functions - INFO - Early stopping at epoch 600. Best Recall: 0.0557
2026-05-18 02:45:14,487 - optuna.study.study - INFO - Trial 90 finished with value: 0.05572020667502214 and parameters: {'n_layers': 1, 'embedding_dim': 128, 'lr': 0.003696008858961023, 'lambda_val': 0.022403571479825492, 'batch_size': 1202, 'optimizer': 'Adam'}. Best is trial 45 with value: 0.06359008908397099.
2026-05-18 02:45:33,362 - experiment_functions - INFO - Early stopping at epoch 1200. Best Recall: 0.0573
2026-05-18 02:45:33,497 - optuna.study.study - INFO - Trial 91 finished with value: 0.057272558432793934 and parameters: {'n_layers': 1, 'embedding_dim': 256, 'lr': 0.0008628569808318052, 'lambda_val': 1.2800998001896401e-05, 'batch_size': 877, 'optimizer': 'Adam'}. Best is trial 45 with value: 0.06359008908397099.
2026-05-18 02:45:46,759 - experiment_functions - INFO - Early stopping at epoch 850. Best Recall: 0.0563
2026-05-18 02:45:46,892 - optuna.study.study - INFO - Trial 92 finished with value: 0.056292430019456254 and parameters: {'n_layers': 1, 'embedding_dim': 256, 'lr': 0.0015416697662595442, 'lambda_val': 2.210702678954136e-06, 'batch_size': 615, 'optimizer': 'Adam'}. Best is trial 45 with value: 0.06359008908397099.
2026-05-18 02:46:03,639 - experiment_functions - INFO - Early stopping at epoch 1000. Best Recall: 0.0559
2026-05-18 02:46:03,718 - optuna.study.study - INFO - Trial 93 finished with value: 0.055889802038225266 and parameters: {'n_layers': 1, 'embedding_dim': 256, 'lr': 0.0010360371719143398, 'lambda_val': 1.290936399919262e-06, 'batch_size': 815, 'optimizer': 'Adam'}. Best is trial 45 with value: 0.06359008908397099.
2026-05-18 02:46:39,359 - experiment_functions - INFO - Early stopping at epoch 2650. Best Recall: 0.0634
2026-05-18 02:46:39,494 - optuna.study.study - INFO - Trial 94 finished with value: 0.06339855607080065 and parameters: {'n_layers': 1, 'embedding_dim': 64, 'lr': 0.0006137970342049868, 'lambda_val': 3.5090799263054386e-06, 'batch_size': 962, 'optimizer': 'Adam'}. Best is trial 45 with value: 0.06359008908397099.
2026-05-18 02:46:46,964 - experiment_functions - INFO - Early stopping at epoch 500. Best Recall: 0.0059
2026-05-18 02:46:47,065 - optuna.study.study - INFO - Trial 95 finished with value: 0.005915057706776665 and parameters: {'n_layers': 1, 'embedding_dim': 64, 'lr': 0.0005588327330891299, 'lambda_val': 2.1150688615518356e-05, 'batch_size': 975, 'optimizer': 'SGD'}. Best is trial 45 with value: 0.06359008908397099.
2026-05-18 02:47:00,937 - optuna.study._optimize - INFO - Trial 96 pruned. 
2026-05-18 02:47:14,822 - optuna.study._optimize - INFO - Trial 97 pruned. 
2026-05-18 02:47:28,691 - optuna.study._optimize - INFO - Trial 98 pruned. 
2026-05-18 02:47:43,253 - optuna.study._optimize - INFO - Trial 99 pruned. 
2026-05-18 02:47:56,053 - optuna.study._optimize - INFO - Trial 100 pruned. 
2026-05-18 02:48:14,426 - experiment_functions - INFO - Early stopping at epoch 1250. Best Recall: 0.0585
2026-05-18 02:48:14,536 - optuna.study.study - INFO - Trial 101 finished with value: 0.058531429146627956 and parameters: {'n_layers': 1, 'embedding_dim': 256, 'lr': 0.0007925251537396477, 'lambda_val': 3.78023925366236e-06, 'batch_size': 948, 'optimizer': 'Adam'}. Best is trial 45 with value: 0.06359008908397099.
2026-05-18 02:48:29,553 - optuna.study._optimize - INFO - Trial 102 pruned. 
2026-05-18 02:48:44,462 - experiment_functions - INFO - Early stopping at epoch 1000. Best Recall: 0.0591
2026-05-18 02:48:44,551 - optuna.study.study - INFO - Trial 103 finished with value: 0.05905019547986859 and parameters: {'n_layers': 1, 'embedding_dim': 256, 'lr': 0.001102433614291555, 'lambda_val': 2.4017646382338695e-06, 'batch_size': 767, 'optimizer': 'Adam'}. Best is trial 45 with value: 0.06359008908397099.
2026-05-18 02:48:54,534 - experiment_functions - INFO - Early stopping at epoch 700. Best Recall: 0.0575
2026-05-18 02:48:54,681 - optuna.study.study - INFO - Trial 104 finished with value: 0.05752298825516166 and parameters: {'n_layers': 1, 'embedding_dim': 96, 'lr': 0.0023231536260978508, 'lambda_val': 1.7414861150530328e-06, 'batch_size': 1024, 'optimizer': 'Adam'}. Best is trial 45 with value: 0.06359008908397099.
2026-05-18 02:49:09,135 - experiment_functions - INFO - Early stopping at epoch 1000. Best Recall: 0.0581
2026-05-18 02:49:09,223 - optuna.study.study - INFO - Trial 105 finished with value: 0.05807559460655265 and parameters: {'n_layers': 1, 'embedding_dim': 128, 'lr': 0.0007709514922736932, 'lambda_val': 0.00013085703923782386, 'batch_size': 2111, 'optimizer': 'Adam'}. Best is trial 45 with value: 0.06359008908397099.
2026-05-18 02:49:21,869 - experiment_functions - INFO - Early stopping at epoch 850. Best Recall: 0.0522
2026-05-18 02:49:21,967 - optuna.study.study - INFO - Trial 106 finished with value: 0.0522249121300218 and parameters: {'n_layers': 1, 'embedding_dim': 256, 'lr': 0.0015986003928761777, 'lambda_val': 4.891636837679642e-06, 'batch_size': 665, 'optimizer': 'Adam'}. Best is trial 45 with value: 0.06359008908397099.
2026-05-18 02:49:47,851 - experiment_functions - INFO - Early stopping at epoch 1750. Best Recall: 0.0598
2026-05-18 02:49:47,941 - optuna.study.study - INFO - Trial 107 finished with value: 0.05978471573695493 and parameters: {'n_layers': 1, 'embedding_dim': 256, 'lr': 0.0006230833640899838, 'lambda_val': 9.897294427088776e-05, 'batch_size': 834, 'optimizer': 'Adam'}. Best is trial 45 with value: 0.06359008908397099.
2026-05-18 02:50:22,355 - experiment_functions - INFO - Early stopping at epoch 2600. Best Recall: 0.0702
2026-05-18 02:50:22,459 - optuna.study.study - INFO - Trial 108 finished with value: 0.07017812247835042 and parameters: {'n_layers': 2, 'embedding_dim': 32, 'lr': 0.0004900937596707541, 'lambda_val': 0.0012726792217056778, 'batch_size': 561, 'optimizer': 'Adam'}. Best is trial 108 with value: 0.07017812247835042.
2026-05-18 02:50:48,082 - experiment_functions - INFO - Early stopping at epoch 1850. Best Recall: 0.0683
2026-05-18 02:50:48,171 - optuna.study.study - INFO - Trial 109 finished with value: 0.06833593102145813 and parameters: {'n_layers': 2, 'embedding_dim': 32, 'lr': 0.0004884848641670789, 'lambda_val': 0.0019065605449948345, 'batch_size': 567, 'optimizer': 'RMSprop'}. Best is trial 108 with value: 0.07017812247835042.
2026-05-18 02:51:23,542 - experiment_functions - INFO - Early stopping at epoch 2550. Best Recall: 0.0699
2026-05-18 02:51:23,653 - optuna.study.study - INFO - Trial 110 finished with value: 0.06992595802012369 and parameters: {'n_layers': 2, 'embedding_dim': 32, 'lr': 0.00047368555431190714, 'lambda_val': 0.0010600068080334319, 'batch_size': 575, 'optimizer': 'RMSprop'}. Best is trial 108 with value: 0.07017812247835042.
2026-05-18 02:51:53,277 - experiment_functions - INFO - Early stopping at epoch 2150. Best Recall: 0.0704
2026-05-18 02:51:53,414 - optuna.study.study - INFO - Trial 111 finished with value: 0.07044888189238487 and parameters: {'n_layers': 2, 'embedding_dim': 32, 'lr': 0.00047991650459194667, 'lambda_val': 0.0012909756559202322, 'batch_size': 569, 'optimizer': 'RMSprop'}. Best is trial 111 with value: 0.07044888189238487.
2026-05-18 02:52:01,004 - experiment_functions - INFO - Early stopping at epoch 500. Best Recall: 0.0094
2026-05-18 02:52:01,105 - optuna.study.study - INFO - Trial 112 finished with value: 0.009444014435662586 and parameters: {'n_layers': 2, 'embedding_dim': 32, 'lr': 0.0783760567465502, 'lambda_val': 0.001092572348348963, 'batch_size': 565, 'optimizer': 'RMSprop'}. Best is trial 111 with value: 0.07044888189238487.
2026-05-18 02:52:37,659 - experiment_functions - INFO - Early stopping at epoch 2700. Best Recall: 0.0697
2026-05-18 02:52:37,804 - optuna.study.study - INFO - Trial 113 finished with value: 0.06970458426070739 and parameters: {'n_layers': 2, 'embedding_dim': 32, 'lr': 0.00046549412406246494, 'lambda_val': 0.0018544173238781644, 'batch_size': 573, 'optimizer': 'RMSprop'}. Best is trial 111 with value: 0.07044888189238487.
2026-05-18 02:53:27,473 - experiment_functions - INFO - Early stopping at epoch 3600. Best Recall: 0.0677
2026-05-18 02:53:27,562 - optuna.study.study - INFO - Trial 114 finished with value: 0.0676817355579386 and parameters: {'n_layers': 2, 'embedding_dim': 32, 'lr': 0.0004216945865732343, 'lambda_val': 0.0017837559861733322, 'batch_size': 516, 'optimizer': 'RMSprop'}. Best is trial 111 with value: 0.07044888189238487.
2026-05-18 02:54:16,276 - experiment_functions - INFO - Early stopping at epoch 3450. Best Recall: 0.0725
2026-05-18 02:54:16,375 - optuna.study.study - INFO - Trial 115 finished with value: 0.07250019550945037 and parameters: {'n_layers': 2, 'embedding_dim': 32, 'lr': 0.000391878050218346, 'lambda_val': 0.001926621335346449, 'batch_size': 521, 'optimizer': 'RMSprop'}. Best is trial 115 with value: 0.07250019550945037.
2026-05-18 02:54:31,732 - optuna.study._optimize - INFO - Trial 116 pruned. 
2026-05-18 02:54:45,864 - optuna.study._optimize - INFO - Trial 117 pruned. 
2026-05-18 02:55:00,285 - optuna.study._optimize - INFO - Trial 118 pruned. 
2026-05-18 02:55:36,039 - experiment_functions - INFO - Early stopping at epoch 2550. Best Recall: 0.0650
2026-05-18 02:55:36,140 - optuna.study.study - INFO - Trial 119 finished with value: 0.06500313023361308 and parameters: {'n_layers': 2, 'embedding_dim': 32, 'lr': 0.0004765593244399165, 'lambda_val': 0.0007103059694600371, 'batch_size': 518, 'optimizer': 'RMSprop'}. Best is trial 115 with value: 0.07250019550945037.
2026-05-18 02:56:18,016 - experiment_functions - INFO - Early stopping at epoch 2950. Best Recall: 0.0655
2026-05-18 02:56:18,115 - optuna.study.study - INFO - Trial 120 finished with value: 0.06554027192341759 and parameters: {'n_layers': 2, 'embedding_dim': 32, 'lr': 0.0004748010515501425, 'lambda_val': 0.0006828564600389977, 'batch_size': 531, 'optimizer': 'RMSprop'}. Best is trial 115 with value: 0.07250019550945037.
2026-05-18 02:56:57,416 - experiment_functions - INFO - Early stopping at epoch 2750. Best Recall: 0.0677
2026-05-18 02:56:57,506 - optuna.study.study - INFO - Trial 121 finished with value: 0.06770149791430038 and parameters: {'n_layers': 2, 'embedding_dim': 32, 'lr': 0.0004630632114427636, 'lambda_val': 0.0006063466270133895, 'batch_size': 517, 'optimizer': 'RMSprop'}. Best is trial 115 with value: 0.07250019550945037.
2026-05-18 02:57:11,549 - optuna.study._optimize - INFO - Trial 122 pruned. 
2026-05-18 02:57:43,548 - experiment_functions - INFO - Early stopping at epoch 2200. Best Recall: 0.0668
2026-05-18 02:57:43,638 - optuna.study.study - INFO - Trial 123 finished with value: 0.06681186704853821 and parameters: {'n_layers': 2, 'embedding_dim': 32, 'lr': 0.0004807515635293222, 'lambda_val': 0.0016231455034718951, 'batch_size': 658, 'optimizer': 'RMSprop'}. Best is trial 115 with value: 0.07250019550945037.
2026-05-18 02:58:22,186 - experiment_functions - INFO - Early stopping at epoch 2600. Best Recall: 0.0663
2026-05-18 02:58:22,265 - optuna.study.study - INFO - Trial 124 finished with value: 0.0663196096696802 and parameters: {'n_layers': 2, 'embedding_dim': 32, 'lr': 0.0004362688902035447, 'lambda_val': 0.0017264875196967672, 'batch_size': 649, 'optimizer': 'RMSprop'}. Best is trial 115 with value: 0.07250019550945037.
2026-05-18 02:58:48,192 - experiment_functions - INFO - Early stopping at epoch 1950. Best Recall: 0.0666
2026-05-18 02:58:48,282 - optuna.study.study - INFO - Trial 125 finished with value: 0.06663400589850668 and parameters: {'n_layers': 2, 'embedding_dim': 32, 'lr': 0.0004525180159957317, 'lambda_val': 0.0016598582535860785, 'batch_size': 656, 'optimizer': 'RMSprop'}. Best is trial 115 with value: 0.07250019550945037.
2026-05-18 02:59:25,273 - experiment_functions - INFO - Early stopping at epoch 2200. Best Recall: 0.0660
2026-05-18 02:59:25,373 - optuna.study.study - INFO - Trial 126 finished with value: 0.06604392348132851 and parameters: {'n_layers': 2, 'embedding_dim': 32, 'lr': 0.00046303936561439943, 'lambda_val': 0.0017255874819304034, 'batch_size': 614, 'optimizer': 'RMSprop'}. Best is trial 115 with value: 0.07250019550945037.
2026-05-18 02:59:39,201 - optuna.study._optimize - INFO - Trial 127 pruned. 
2026-05-18 02:59:52,646 - optuna.study._optimize - INFO - Trial 128 pruned. 
2026-05-18 03:00:59,197 - experiment_functions - INFO - Early stopping at epoch 3000. Best Recall: 0.0651
2026-05-18 03:00:59,377 - optuna.study.study - INFO - Trial 129 finished with value: 0.0650858298154754 and parameters: {'n_layers': 2, 'embedding_dim': 32, 'lr': 0.00043236647298429875, 'lambda_val': 0.0012565896548454693, 'batch_size': 682, 'optimizer': 'RMSprop'}. Best is trial 115 with value: 0.07250019550945037.
2026-05-18 03:01:13,041 - optuna.study._optimize - INFO - Trial 130 pruned. 
2026-05-18 03:01:49,653 - experiment_functions - INFO - Early stopping at epoch 2750. Best Recall: 0.0676
2026-05-18 03:01:49,722 - optuna.study.study - INFO - Trial 131 finished with value: 0.06759924074054749 and parameters: {'n_layers': 2, 'embedding_dim': 32, 'lr': 0.00042917967162946755, 'lambda_val': 0.001208369424798947, 'batch_size': 670, 'optimizer': 'RMSprop'}. Best is trial 115 with value: 0.07250019550945037.
2026-05-18 03:02:15,492 - experiment_functions - INFO - Early stopping at epoch 1900. Best Recall: 0.0735
2026-05-18 03:02:15,585 - optuna.study.study - INFO - Trial 132 finished with value: 0.07345797140105066 and parameters: {'n_layers': 2, 'embedding_dim': 32, 'lr': 0.0004827414719742662, 'lambda_val': 0.001025419792788108, 'batch_size': 670, 'optimizer': 'RMSprop'}. Best is trial 132 with value: 0.07345797140105066.
2026-05-18 03:02:28,995 - optuna.study._optimize - INFO - Trial 133 pruned. 
2026-05-18 03:02:45,639 - optuna.study._optimize - INFO - Trial 134 pruned. 
2026-05-18 03:03:01,882 - optuna.study._optimize - INFO - Trial 135 pruned. 
2026-05-18 03:03:26,072 - optuna.study._optimize - INFO - Trial 136 pruned. 
2026-05-18 03:04:08,499 - experiment_functions - INFO - Early stopping at epoch 3100. Best Recall: 0.0695
2026-05-18 03:04:08,644 - optuna.study.study - INFO - Trial 137 finished with value: 0.06946080585587494 and parameters: {'n_layers': 2, 'embedding_dim': 32, 'lr': 0.0004219367591966903, 'lambda_val': 0.0005465934245157643, 'batch_size': 694, 'optimizer': 'RMSprop'}. Best is trial 132 with value: 0.07345797140105066.
2026-05-18 03:04:23,295 - optuna.study._optimize - INFO - Trial 138 pruned. 
2026-05-18 03:04:37,740 - optuna.study._optimize - INFO - Trial 139 pruned. 
2026-05-18 03:05:10,328 - optuna.study._optimize - INFO - Trial 140 pruned. 
2026-05-18 03:05:42,557 - experiment_functions - INFO - Early stopping at epoch 2250. Best Recall: 0.0697
2026-05-18 03:05:42,668 - optuna.study.study - INFO - Trial 141 finished with value: 0.06970247274626434 and parameters: {'n_layers': 2, 'embedding_dim': 32, 'lr': 0.0004905155914050553, 'lambda_val': 0.0017510132162421603, 'batch_size': 582, 'optimizer': 'RMSprop'}. Best is trial 132 with value: 0.07345797140105066.
2026-05-18 03:06:06,104 - experiment_functions - INFO - Early stopping at epoch 1500. Best Recall: 0.0611
