2026-05-17 23:21:43,970 - optuna.study.study - INFO - Trial 55 finished with value: 0.08338304823845903 and parameters: {'n_layers': 1, 'embedding_dim': 256, 'lr': 0.0011923133962940253, 'lambda_val': 1.2729624421853626e-05, 'batch_size': 2968, 'optimizer': 'Adam'}. Best is trial 51 with value: 0.08533224549370667.
2026-05-17 23:22:09,790 - experiment_functions - INFO - Early stopping at epoch 1650. Best Recall: 0.0802
2026-05-17 23:22:09,924 - optuna.study.study - INFO - Trial 56 finished with value: 0.08017792726292149 and parameters: {'n_layers': 1, 'embedding_dim': 256, 'lr': 0.0029330522779551014, 'lambda_val': 1.3194629512780082e-05, 'batch_size': 2401, 'optimizer': 'Adam'}. Best is trial 51 with value: 0.08533224549370667.
2026-05-17 23:22:30,315 - experiment_functions - INFO - Early stopping at epoch 950. Best Recall: 0.0753
2026-05-17 23:22:30,455 - optuna.study.study - INFO - Trial 57 finished with value: 0.07532034111003126 and parameters: {'n_layers': 1, 'embedding_dim': 256, 'lr': 0.0011028886107484438, 'lambda_val': 1.3057916856178682e-05, 'batch_size': 2113, 'optimizer': 'Adam'}. Best is trial 51 with value: 0.08533224549370667.
2026-05-17 23:22:56,072 - experiment_functions - INFO - Early stopping at epoch 1650. Best Recall: 0.0826
2026-05-17 23:22:56,163 - optuna.study.study - INFO - Trial 58 finished with value: 0.08264105018018558 and parameters: {'n_layers': 1, 'embedding_dim': 256, 'lr': 0.0022929464536549245, 'lambda_val': 4.254572895415419e-06, 'batch_size': 2443, 'optimizer': 'Adam'}. Best is trial 51 with value: 0.08533224549370667.
2026-05-17 23:23:07,369 - experiment_functions - INFO - Early stopping at epoch 550. Best Recall: 0.0425
2026-05-17 23:23:07,516 - optuna.study.study - INFO - Trial 59 finished with value: 0.042534624901019356 and parameters: {'n_layers': 3, 'embedding_dim': 256, 'lr': 0.002120010449067899, 'lambda_val': 3.4611173714780394e-06, 'batch_size': 2819, 'optimizer': 'Adam'}. Best is trial 51 with value: 0.08533224549370667.
2026-05-17 23:23:32,432 - optuna.study._optimize - INFO - Trial 60 pruned. 
2026-05-17 23:24:01,453 - experiment_functions - INFO - Early stopping at epoch 1850. Best Recall: 0.0830
2026-05-17 23:24:01,587 - optuna.study.study - INFO - Trial 61 finished with value: 0.08295086598198614 and parameters: {'n_layers': 1, 'embedding_dim': 256, 'lr': 0.0026314825733407265, 'lambda_val': 2.0133355609331102e-06, 'batch_size': 2397, 'optimizer': 'Adam'}. Best is trial 51 with value: 0.08533224549370667.
2026-05-17 23:24:49,051 - experiment_functions - INFO - Early stopping at epoch 3150. Best Recall: 0.0847
2026-05-17 23:24:49,595 - optuna.study.study - INFO - Trial 62 finished with value: 0.08469711668564466 and parameters: {'n_layers': 1, 'embedding_dim': 256, 'lr': 0.0018451697361034306, 'lambda_val': 1.7881224275142682e-06, 'batch_size': 2662, 'optimizer': 'Adam'}. Best is trial 51 with value: 0.08533224549370667.
2026-05-17 23:24:59,164 - experiment_functions - INFO - Early stopping at epoch 550. Best Recall: 0.0756
2026-05-17 23:24:59,299 - optuna.study.study - INFO - Trial 63 finished with value: 0.07562704647242495 and parameters: {'n_layers': 1, 'embedding_dim': 256, 'lr': 0.005296893910627852, 'lambda_val': 2.1317592465129465e-06, 'batch_size': 2669, 'optimizer': 'Adam'}. Best is trial 51 with value: 0.08533224549370667.
2026-05-17 23:25:52,261 - experiment_functions - INFO - Early stopping at epoch 3550. Best Recall: 0.0840
2026-05-17 23:25:52,407 - optuna.study.study - INFO - Trial 64 finished with value: 0.08401284615966112 and parameters: {'n_layers': 1, 'embedding_dim': 256, 'lr': 0.0019782669269127065, 'lambda_val': 4.410920328210105e-06, 'batch_size': 1894, 'optimizer': 'Adam'}. Best is trial 51 with value: 0.08533224549370667.
2026-05-17 23:26:03,194 - experiment_functions - INFO - Early stopping at epoch 600. Best Recall: 0.0587
2026-05-17 23:26:03,317 - optuna.study.study - INFO - Trial 65 finished with value: 0.058661733272006265 and parameters: {'n_layers': 2, 'embedding_dim': 256, 'lr': 0.001964303210326752, 'lambda_val': 1.6100933136381898e-06, 'batch_size': 1734, 'optimizer': 'Adam'}. Best is trial 51 with value: 0.08533224549370667.
2026-05-17 23:26:20,358 - optuna.study._optimize - INFO - Trial 66 pruned. 
2026-05-17 23:26:33,957 - experiment_functions - INFO - Early stopping at epoch 900. Best Recall: 0.0671
2026-05-17 23:26:34,092 - optuna.study.study - INFO - Trial 67 finished with value: 0.0671230169657394 and parameters: {'n_layers': 1, 'embedding_dim': 32, 'lr': 0.001023865087909857, 'lambda_val': 4.416462390636803e-06, 'batch_size': 1494, 'optimizer': 'Adam'}. Best is trial 51 with value: 0.08533224549370667.
2026-05-17 23:26:57,900 - optuna.study._optimize - INFO - Trial 68 pruned. 
2026-05-17 23:27:16,499 - experiment_functions - INFO - Early stopping at epoch 750. Best Recall: 0.0695
2026-05-17 23:27:16,633 - optuna.study.study - INFO - Trial 69 finished with value: 0.06948883194061725 and parameters: {'n_layers': 1, 'embedding_dim': 64, 'lr': 0.0011538904713618281, 'lambda_val': 9.06537396693209e-06, 'batch_size': 2335, 'optimizer': 'Adam'}. Best is trial 51 with value: 0.08533224549370667.
2026-05-17 23:27:34,326 - optuna.study._optimize - INFO - Trial 70 pruned. 
2026-05-17 23:27:47,999 - experiment_functions - INFO - Early stopping at epoch 850. Best Recall: 0.0725
2026-05-17 23:27:48,133 - optuna.study.study - INFO - Trial 71 finished with value: 0.07254558050250146 and parameters: {'n_layers': 1, 'embedding_dim': 256, 'lr': 0.0017716386515301509, 'lambda_val': 4.721939587894809e-06, 'batch_size': 1000, 'optimizer': 'Adam'}. Best is trial 51 with value: 0.08533224549370667.
2026-05-17 23:28:04,513 - optuna.study._optimize - INFO - Trial 72 pruned. 
2026-05-17 23:28:14,249 - experiment_functions - INFO - Early stopping at epoch 550. Best Recall: 0.0686
2026-05-17 23:28:15,014 - optuna.study.study - INFO - Trial 73 finished with value: 0.06856486472423691 and parameters: {'n_layers': 1, 'embedding_dim': 256, 'lr': 0.010035129177397215, 'lambda_val': 1.8478121406599684e-06, 'batch_size': 3111, 'optimizer': 'Adam'}. Best is trial 51 with value: 0.08533224549370667.
2026-05-17 23:28:57,783 - optuna.study._optimize - INFO - Trial 74 pruned. 
2026-05-17 23:29:14,117 - optuna.study._optimize - INFO - Trial 75 pruned. 
2026-05-17 23:29:22,164 - experiment_functions - INFO - Early stopping at epoch 500. Best Recall: 0.0051
2026-05-17 23:29:22,243 - optuna.study.study - INFO - Trial 76 finished with value: 0.005095382497254487 and parameters: {'n_layers': 1, 'embedding_dim': 256, 'lr': 0.0005925809636080821, 'lambda_val': 3.954952379148104e-06, 'batch_size': 3292, 'optimizer': 'SGD'}. Best is trial 51 with value: 0.08533224549370667.
2026-05-17 23:29:35,483 - experiment_functions - INFO - Early stopping at epoch 850. Best Recall: 0.0743
2026-05-17 23:29:35,572 - optuna.study.study - INFO - Trial 77 finished with value: 0.07433058000975781 and parameters: {'n_layers': 1, 'embedding_dim': 256, 'lr': 0.0012985465904181198, 'lambda_val': 1.6703851655807468e-06, 'batch_size': 2173, 'optimizer': 'Adam'}. Best is trial 51 with value: 0.08533224549370667.
2026-05-17 23:30:14,370 - experiment_functions - INFO - Early stopping at epoch 2300. Best Recall: 0.0833
2026-05-17 23:30:14,503 - optuna.study.study - INFO - Trial 78 finished with value: 0.0832578021920863 and parameters: {'n_layers': 1, 'embedding_dim': 256, 'lr': 0.0018220817058984162, 'lambda_val': 3.638523475066042e-05, 'batch_size': 2290, 'optimizer': 'Adam'}. Best is trial 51 with value: 0.08533224549370667.
2026-05-17 23:30:23,149 - experiment_functions - INFO - Early stopping at epoch 550. Best Recall: 0.0600
2026-05-17 23:30:23,273 - optuna.study.study - INFO - Trial 79 finished with value: 0.05996360549808568 and parameters: {'n_layers': 1, 'embedding_dim': 96, 'lr': 0.0021104688162108015, 'lambda_val': 4.1611611570952285e-05, 'batch_size': 2017, 'optimizer': 'RMSprop'}. Best is trial 51 with value: 0.08533224549370667.
2026-05-17 23:30:40,014 - experiment_functions - INFO - Early stopping at epoch 750. Best Recall: 0.0301
2026-05-17 23:30:40,779 - optuna.study.study - INFO - Trial 80 finished with value: 0.030100006491344353 and parameters: {'n_layers': 4, 'embedding_dim': 32, 'lr': 0.0008894767108152238, 'lambda_val': 2.8144257733057288e-05, 'batch_size': 2289, 'optimizer': 'Adam'}. Best is trial 51 with value: 0.08533224549370667.
2026-05-17 23:30:58,406 - experiment_functions - INFO - Early stopping at epoch 800. Best Recall: 0.0778
2026-05-17 23:30:58,529 - optuna.study.study - INFO - Trial 81 finished with value: 0.07780164717339498 and parameters: {'n_layers': 1, 'embedding_dim': 256, 'lr': 0.0016830300936638632, 'lambda_val': 5.666066563201572e-06, 'batch_size': 2424, 'optimizer': 'Adam'}. Best is trial 51 with value: 0.08533224549370667.
2026-05-17 23:31:18,666 - experiment_functions - INFO - Early stopping at epoch 1300. Best Recall: 0.0783
2026-05-17 23:31:18,755 - optuna.study.study - INFO - Trial 82 finished with value: 0.07830884941434405 and parameters: {'n_layers': 1, 'embedding_dim': 256, 'lr': 0.003548328821487832, 'lambda_val': 1.0421563827055842e-05, 'batch_size': 2808, 'optimizer': 'Adam'}. Best is trial 51 with value: 0.08533224549370667.
2026-05-17 23:31:45,593 - experiment_functions - INFO - Early stopping at epoch 1750. Best Recall: 0.0807
2026-05-17 23:31:45,740 - optuna.study.study - INFO - Trial 83 finished with value: 0.08074630210796913 and parameters: {'n_layers': 1, 'embedding_dim': 256, 'lr': 0.0027072799232453573, 'lambda_val': 1.4000236289384408e-06, 'batch_size': 2661, 'optimizer': 'Adam'}. Best is trial 51 with value: 0.08533224549370667.
2026-05-17 23:32:00,668 - experiment_functions - INFO - Early stopping at epoch 950. Best Recall: 0.0762
2026-05-17 23:32:00,759 - optuna.study.study - INFO - Trial 84 finished with value: 0.07623868190186538 and parameters: {'n_layers': 1, 'embedding_dim': 256, 'lr': 0.0012525521023313113, 'lambda_val': 2.4926654849429858e-05, 'batch_size': 2516, 'optimizer': 'Adam'}. Best is trial 51 with value: 0.08533224549370667.
2026-05-17 23:32:23,249 - optuna.study._optimize - INFO - Trial 85 pruned. 
2026-05-17 23:32:35,964 - experiment_functions - INFO - Early stopping at epoch 550. Best Recall: 0.0183
2026-05-17 23:32:36,044 - optuna.study.study - INFO - Trial 86 finished with value: 0.018264400063440503 and parameters: {'n_layers': 1, 'embedding_dim': 256, 'lr': 0.09287916640738365, 'lambda_val': 1.8577452594757216e-05, 'batch_size': 2737, 'optimizer': 'Adam'}. Best is trial 51 with value: 0.08533224549370667.
2026-05-17 23:32:44,511 - experiment_functions - INFO - Early stopping at epoch 550. Best Recall: 0.0678
2026-05-17 23:32:44,636 - optuna.study.study - INFO - Trial 87 finished with value: 0.06784912982675334 and parameters: {'n_layers': 1, 'embedding_dim': 64, 'lr': 0.00786863591905081, 'lambda_val': 2.8026044835239385e-06, 'batch_size': 2342, 'optimizer': 'Adam'}. Best is trial 51 with value: 0.08533224549370667.
2026-05-17 23:32:54,043 - experiment_functions - INFO - Early stopping at epoch 550. Best Recall: 0.0740
2026-05-17 23:32:54,133 - optuna.study.study - INFO - Trial 88 finished with value: 0.07398322376036758 and parameters: {'n_layers': 1, 'embedding_dim': 256, 'lr': 0.005755906248848305, 'lambda_val': 5.4215080201133666e-05, 'batch_size': 2542, 'optimizer': 'Adam'}. Best is trial 51 with value: 0.08533224549370667.
2026-05-17 23:33:02,156 - experiment_functions - INFO - Early stopping at epoch 500. Best Recall: 0.0056
2026-05-17 23:33:02,236 - optuna.study.study - INFO - Trial 89 finished with value: 0.005587384843428634 and parameters: {'n_layers': 1, 'embedding_dim': 256, 'lr': 0.0003757499309729837, 'lambda_val': 3.142291683452185e-05, 'batch_size': 3217, 'optimizer': 'SGD'}. Best is trial 51 with value: 0.08533224549370667.
2026-05-17 23:33:18,402 - optuna.study._optimize - INFO - Trial 90 pruned. 
2026-05-17 23:33:49,674 - optuna.study._optimize - INFO - Trial 91 pruned. 
2026-05-17 23:34:11,105 - experiment_functions - INFO - Early stopping at epoch 1350. Best Recall: 0.0805
2026-05-17 23:34:11,882 - optuna.study.study - INFO - Trial 92 finished with value: 0.08045421022414843 and parameters: {'n_layers': 1, 'embedding_dim': 256, 'lr': 0.0024026441365481896, 'lambda_val': 1.2029356916085753e-05, 'batch_size': 2964, 'optimizer': 'Adam'}. Best is trial 51 with value: 0.08533224549370667.
2026-05-17 23:34:35,886 - optuna.study._optimize - INFO - Trial 93 pruned. 
2026-05-17 23:35:07,464 - optuna.study._optimize - INFO - Trial 94 pruned. 
2026-05-17 23:35:22,783 - optuna.study._optimize - INFO - Trial 95 pruned. 
2026-05-17 23:35:50,580 - experiment_functions - INFO - Early stopping at epoch 1850. Best Recall: 0.0818
2026-05-17 23:35:50,680 - optuna.study.study - INFO - Trial 96 finished with value: 0.08176942947024536 and parameters: {'n_layers': 1, 'embedding_dim': 256, 'lr': 0.002080661352426226, 'lambda_val': 5.776963449590773e-06, 'batch_size': 2655, 'optimizer': 'Adam'}. Best is trial 51 with value: 0.08533224549370667.
2026-05-17 23:36:21,504 - experiment_functions - INFO - Early stopping at epoch 1650. Best Recall: 0.0806
2026-05-17 23:36:22,270 - optuna.study.study - INFO - Trial 97 finished with value: 0.0805989331744245 and parameters: {'n_layers': 1, 'embedding_dim': 256, 'lr': 0.0018863781376996795, 'lambda_val': 5.6149794175272405e-06, 'batch_size': 2435, 'optimizer': 'Adam'}. Best is trial 51 with value: 0.08533224549370667.
2026-05-17 23:36:39,241 - optuna.study._optimize - INFO - Trial 98 pruned. 
2026-05-17 23:36:49,137 - experiment_functions - INFO - Early stopping at epoch 550. Best Recall: 0.0317
2026-05-17 23:36:49,249 - optuna.study.study - INFO - Trial 99 finished with value: 0.03174220153743544 and parameters: {'n_layers': 2, 'embedding_dim': 256, 'lr': 0.05087103000602827, 'lambda_val': 3.997090430510154e-06, 'batch_size': 2656, 'optimizer': 'Adam'}. Best is trial 51 with value: 0.08533224549370667.
2026-05-17 23:36:59,971 - experiment_functions - INFO - Early stopping at epoch 700. Best Recall: 0.0609
2026-05-17 23:37:00,061 - optuna.study.study - INFO - Trial 100 finished with value: 0.06090903432951143 and parameters: {'n_layers': 1, 'embedding_dim': 32, 'lr': 0.0020641160097645914, 'lambda_val': 1.299408423065637e-06, 'batch_size': 2390, 'optimizer': 'Adam'}. Best is trial 51 with value: 0.08533224549370667.
2026-05-17 23:37:50,526 - experiment_functions - INFO - Early stopping at epoch 3450. Best Recall: 0.0839
2026-05-17 23:37:50,615 - optuna.study.study - INFO - Trial 101 finished with value: 0.0839130137619055 and parameters: {'n_layers': 1, 'embedding_dim': 256, 'lr': 0.001344864456040244, 'lambda_val': 8.713562114762693e-06, 'batch_size': 3081, 'optimizer': 'Adam'}. Best is trial 51 with value: 0.08533224549370667.
2026-05-17 23:38:06,463 - optuna.study._optimize - INFO - Trial 102 pruned. 
2026-05-17 23:38:45,919 - optuna.study._optimize - INFO - Trial 103 pruned. 
2026-05-17 23:39:39,292 - experiment_functions - INFO - Early stopping at epoch 3600. Best Recall: 0.0853
2026-05-17 23:39:39,383 - optuna.study.study - INFO - Trial 104 finished with value: 0.08529503330078009 and parameters: {'n_layers': 1, 'embedding_dim': 256, 'lr': 0.0015219048691834064, 'lambda_val': 1.0262407909627916e-05, 'batch_size': 3213, 'optimizer': 'Adam'}. Best is trial 51 with value: 0.08533224549370667.
2026-05-17 23:39:56,628 - optuna.study._optimize - INFO - Trial 105 pruned. 
2026-05-17 23:40:06,005 - experiment_functions - INFO - Early stopping at epoch 600. Best Recall: 0.0692
2026-05-17 23:40:06,096 - optuna.study.study - INFO - Trial 106 finished with value: 0.06924202624509443 and parameters: {'n_layers': 1, 'embedding_dim': 128, 'lr': 0.003018140607810306, 'lambda_val': 0.00022219605493055395, 'batch_size': 3423, 'optimizer': 'Adam'}. Best is trial 51 with value: 0.08533224549370667.
2026-05-17 23:40:17,587 - experiment_functions - INFO - Early stopping at epoch 750. Best Recall: 0.0766
2026-05-17 23:40:17,633 - optuna.study.study - INFO - Trial 107 finished with value: 0.0766062076744889 and parameters: {'n_layers': 1, 'embedding_dim': 256, 'lr': 0.001600939641505227, 'lambda_val': 8.239060868725318e-06, 'batch_size': 3121, 'optimizer': 'Adam'}. Best is trial 51 with value: 0.08533224549370667.
2026-05-17 23:40:26,677 - experiment_functions - INFO - Early stopping at epoch 600. Best Recall: 0.0323
2026-05-17 23:40:26,746 - optuna.study.study - INFO - Trial 108 finished with value: 0.03228451176918961 and parameters: {'n_layers': 3, 'embedding_dim': 64, 'lr': 0.0011662602947541281, 'lambda_val': 0.00015195906382467746, 'batch_size': 3635, 'optimizer': 'Adam'}. Best is trial 51 with value: 0.08533224549370667.
2026-05-17 23:40:57,637 - optuna.study._optimize - INFO - Trial 109 pruned. 
2026-05-17 23:41:05,177 - experiment_functions - INFO - Early stopping at epoch 500. Best Recall: 0.0047
2026-05-17 23:41:05,312 - optuna.study.study - INFO - Trial 110 finished with value: 0.004660681485775899 and parameters: {'n_layers': 1, 'embedding_dim': 256, 'lr': 0.0008010326569888693, 'lambda_val': 2.3413115081623966e-05, 'batch_size': 3238, 'optimizer': 'SGD'}. Best is trial 51 with value: 0.08533224549370667.
2026-05-17 23:41:32,048 - experiment_functions - INFO - Early stopping at epoch 1800. Best Recall: 0.0842
2026-05-17 23:41:32,137 - optuna.study.study - INFO - Trial 111 finished with value: 0.0842014358894119 and parameters: {'n_layers': 1, 'embedding_dim': 256, 'lr': 0.0020495094986148006, 'lambda_val': 5.082730161291511e-06, 'batch_size': 2825, 'optimizer': 'Adam'}. Best is trial 51 with value: 0.08533224549370667.
2026-05-17 23:41:43,704 - experiment_functions - INFO - Early stopping at epoch 700. Best Recall: 0.0768
2026-05-17 23:41:43,793 - optuna.study.study - INFO - Trial 112 finished with value: 0.0767975568147692 and parameters: {'n_layers': 1, 'embedding_dim': 256, 'lr': 0.0016451210159961719, 'lambda_val': 3.1321213094934036e-06, 'batch_size': 2859, 'optimizer': 'Adam'}. Best is trial 51 with value: 0.08533224549370667.
2026-05-17 23:42:04,749 - experiment_functions - INFO - Early stopping at epoch 1400. Best Recall: 0.0802
2026-05-17 23:42:04,839 - optuna.study.study - INFO - Trial 113 finished with value: 0.08024143617186874 and parameters: {'n_layers': 1, 'embedding_dim': 256, 'lr': 0.0026704741544710704, 'lambda_val': 5.080073266370961e-06, 'batch_size': 3010, 'optimizer': 'Adam'}. Best is trial 51 with value: 0.08533224549370667.
2026-05-17 23:42:20,247 - optuna.study._optimize - INFO - Trial 114 pruned. 
2026-05-17 23:42:30,148 - experiment_functions - INFO - Early stopping at epoch 600. Best Recall: 0.0453
2026-05-17 23:42:30,249 - optuna.study.study - INFO - Trial 115 finished with value: 0.0452790464949475 and parameters: {'n_layers': 1, 'embedding_dim': 256, 'lr': 0.0019189409840455673, 'lambda_val': 0.044835035486746874, 'batch_size': 2794, 'optimizer': 'Adam'}. Best is trial 51 with value: 0.08533224549370667.
2026-05-17 23:42:43,276 - experiment_functions - INFO - Early stopping at epoch 800. Best Recall: 0.0754
2026-05-17 23:42:43,396 - optuna.study.study - INFO - Trial 116 finished with value: 0.07538840257752755 and parameters: {'n_layers': 1, 'embedding_dim': 256, 'lr': 0.0013189035281156011, 'lambda_val': 9.67803803017745e-06, 'batch_size': 2918, 'optimizer': 'Adam'}. Best is trial 51 with value: 0.08533224549370667.
2026-05-17 23:42:59,058 - optuna.study._optimize - INFO - Trial 117 pruned. 
2026-05-17 23:43:14,254 - optuna.study._optimize - INFO - Trial 118 pruned. 
2026-05-17 23:43:23,908 - experiment_functions - INFO - Early stopping at epoch 600. Best Recall: 0.0731
2026-05-17 23:43:24,019 - optuna.study.study - INFO - Trial 119 finished with value: 0.07311586499928524 and parameters: {'n_layers': 1, 'embedding_dim': 256, 'lr': 0.003263707760691295, 'lambda_val': 3.8582942301071476e-06, 'batch_size': 2467, 'optimizer': 'Adam'}. Best is trial 51 with value: 0.08533224549370667.
2026-05-17 23:43:46,902 - optuna.study._optimize - INFO - Trial 120 pruned. 
2026-05-17 23:43:57,496 - experiment_functions - INFO - Early stopping at epoch 650. Best Recall: 0.0760
2026-05-17 23:43:57,598 - optuna.study.study - INFO - Trial 121 finished with value: 0.07601543385058508 and parameters: {'n_layers': 1, 'embedding_dim': 256, 'lr': 0.0022423720078357727, 'lambda_val': 6.207732103249199e-06, 'batch_size': 2706, 'optimizer': 'Adam'}. Best is trial 51 with value: 0.08533224549370667.
2026-05-17 23:44:30,758 - experiment_functions - INFO - Early stopping at epoch 2250. Best Recall: 0.0831
2026-05-17 23:44:30,879 - optuna.study.study - INFO - Trial 122 finished with value: 0.08314775593219055 and parameters: {'n_layers': 1, 'embedding_dim': 256, 'lr': 0.0018806775340810247, 'lambda_val': 4.919428283984722e-06, 'batch_size': 2634, 'optimizer': 'Adam'}. Best is trial 51 with value: 0.08533224549370667.
2026-05-17 23:44:59,910 - experiment_functions - INFO - Early stopping at epoch 1900. Best Recall: 0.0829
2026-05-17 23:45:00,019 - optuna.study.study - INFO - Trial 123 finished with value: 0.08289353130742627 and parameters: {'n_layers': 1, 'embedding_dim': 256, 'lr': 0.0016924310953523377, 'lambda_val': 4.811737875293899e-06, 'batch_size': 2593, 'optimizer': 'Adam'}. Best is trial 51 with value: 0.08533224549370667.
2026-05-17 23:45:16,082 - optuna.study._optimize - INFO - Trial 124 pruned. 
2026-05-17 23:45:26,127 - experiment_functions - INFO - Early stopping at epoch 650. Best Recall: 0.0724
2026-05-17 23:45:26,174 - optuna.study.study - INFO - Trial 125 finished with value: 0.07240188624276166 and parameters: {'n_layers': 1, 'embedding_dim': 256, 'lr': 0.0013462250742570592, 'lambda_val': 1.632737504283979e-06, 'batch_size': 2526, 'optimizer': 'Adam'}. Best is trial 51 with value: 0.08533224549370667.
2026-05-17 23:45:39,834 - optuna.study._optimize - INFO - Trial 126 pruned. 
