2026-05-18 18:01:06,647 - optuna.study.study - INFO - Trial 99 finished with value: 0.06550705859302666 and parameters: {'n_layers': 1, 'embedding_dim': 64, 'lr': 0.0009510635974138487, 'lambda_val': 4.629484949221281e-06, 'batch_size': 700, 'optimizer': 'RMSprop'}. Best is trial 86 with value: 0.0704995300424917.
2026-05-18 18:01:17,146 - experiment_functions - INFO - Early stopping at epoch 750. Best Recall: 0.0619
2026-05-18 18:01:17,236 - optuna.study.study - INFO - Trial 100 finished with value: 0.061856132320391624 and parameters: {'n_layers': 1, 'embedding_dim': 64, 'lr': 0.001375598716314447, 'lambda_val': 0.00024778582335696793, 'batch_size': 681, 'optimizer': 'RMSprop'}. Best is trial 86 with value: 0.0704995300424917.
2026-05-18 18:01:31,735 - experiment_functions - INFO - Early stopping at epoch 1050. Best Recall: 0.0674
2026-05-18 18:01:31,822 - optuna.study.study - INFO - Trial 101 finished with value: 0.06741216733527754 and parameters: {'n_layers': 1, 'embedding_dim': 64, 'lr': 0.0010187326435383364, 'lambda_val': 4.680917643105542e-06, 'batch_size': 768, 'optimizer': 'RMSprop'}. Best is trial 86 with value: 0.0704995300424917.
2026-05-18 18:01:42,043 - experiment_functions - INFO - Early stopping at epoch 700. Best Recall: 0.0555
2026-05-18 18:01:42,178 - optuna.study.study - INFO - Trial 102 finished with value: 0.05551547286186861 and parameters: {'n_layers': 1, 'embedding_dim': 64, 'lr': 0.0008873078113758557, 'lambda_val': 3.445160948693435e-06, 'batch_size': 3852, 'optimizer': 'RMSprop'}. Best is trial 86 with value: 0.0704995300424917.
2026-05-18 18:01:56,131 - optuna.study._optimize - INFO - Trial 103 pruned. 
2026-05-18 18:02:04,824 - experiment_functions - INFO - Early stopping at epoch 600. Best Recall: 0.0545
2026-05-18 18:02:04,911 - optuna.study.study - INFO - Trial 104 finished with value: 0.05451708237980566 and parameters: {'n_layers': 1, 'embedding_dim': 64, 'lr': 0.0021711649743492343, 'lambda_val': 1.9528507078356e-06, 'batch_size': 1060, 'optimizer': 'RMSprop'}. Best is trial 86 with value: 0.0704995300424917.
2026-05-18 18:02:18,233 - optuna.study._optimize - INFO - Trial 105 pruned. 
2026-05-18 18:02:29,465 - experiment_functions - INFO - Early stopping at epoch 750. Best Recall: 0.0605
2026-05-18 18:02:29,610 - optuna.study.study - INFO - Trial 106 finished with value: 0.06049813078476378 and parameters: {'n_layers': 1, 'embedding_dim': 32, 'lr': 0.0017415325169074633, 'lambda_val': 1.6769986653958393e-05, 'batch_size': 682, 'optimizer': 'RMSprop'}. Best is trial 86 with value: 0.0704995300424917.
2026-05-18 18:02:43,005 - experiment_functions - INFO - Early stopping at epoch 950. Best Recall: 0.0585
2026-05-18 18:02:43,158 - optuna.study.study - INFO - Trial 107 finished with value: 0.058510508118775645 and parameters: {'n_layers': 1, 'embedding_dim': 64, 'lr': 0.001139497817866325, 'lambda_val': 5.145269095158213e-06, 'batch_size': 923, 'optimizer': 'RMSprop'}. Best is trial 86 with value: 0.0704995300424917.
2026-05-18 18:02:59,835 - optuna.study._optimize - INFO - Trial 108 pruned. 
2026-05-18 18:03:09,946 - experiment_functions - INFO - Early stopping at epoch 700. Best Recall: 0.0627
2026-05-18 18:03:10,036 - optuna.study.study - INFO - Trial 109 finished with value: 0.0627157044725402 and parameters: {'n_layers': 1, 'embedding_dim': 64, 'lr': 0.0013814505892439349, 'lambda_val': 2.8718016560728646e-06, 'batch_size': 1146, 'optimizer': 'RMSprop'}. Best is trial 86 with value: 0.0704995300424917.
2026-05-18 18:03:27,610 - optuna.study._optimize - INFO - Trial 110 pruned. 
2026-05-18 18:03:45,670 - experiment_functions - INFO - Early stopping at epoch 1300. Best Recall: 0.0671
2026-05-18 18:03:45,770 - optuna.study.study - INFO - Trial 111 finished with value: 0.06712451279264131 and parameters: {'n_layers': 1, 'embedding_dim': 64, 'lr': 0.0008075310879726688, 'lambda_val': 1.1040642160554411e-05, 'batch_size': 859, 'optimizer': 'RMSprop'}. Best is trial 86 with value: 0.0704995300424917.
2026-05-18 18:04:02,365 - experiment_functions - INFO - Early stopping at epoch 900. Best Recall: 0.0625
2026-05-18 18:04:03,141 - optuna.study.study - INFO - Trial 112 finished with value: 0.06250642718973994 and parameters: {'n_layers': 1, 'embedding_dim': 64, 'lr': 0.001064168704001891, 'lambda_val': 1.4933513828473267e-05, 'batch_size': 1009, 'optimizer': 'RMSprop'}. Best is trial 86 with value: 0.0704995300424917.
2026-05-18 18:04:27,168 - experiment_functions - INFO - Early stopping at epoch 1300. Best Recall: 0.0664
2026-05-18 18:04:27,258 - optuna.study.study - INFO - Trial 113 finished with value: 0.06636185331063424 and parameters: {'n_layers': 1, 'embedding_dim': 64, 'lr': 0.0007471504302946002, 'lambda_val': 8.354826279159568e-06, 'batch_size': 885, 'optimizer': 'RMSprop'}. Best is trial 86 with value: 0.0704995300424917.
2026-05-18 18:04:45,928 - optuna.study._optimize - INFO - Trial 114 pruned. 
2026-05-18 18:05:04,217 - experiment_functions - INFO - Early stopping at epoch 1350. Best Recall: 0.0689
2026-05-18 18:05:04,306 - optuna.study.study - INFO - Trial 115 finished with value: 0.0688520246152499 and parameters: {'n_layers': 1, 'embedding_dim': 64, 'lr': 0.0008184631751747966, 'lambda_val': 1.228977224335041e-05, 'batch_size': 800, 'optimizer': 'RMSprop'}. Best is trial 86 with value: 0.0704995300424917.
2026-05-18 18:05:18,092 - optuna.study._optimize - INFO - Trial 116 pruned. 
2026-05-18 18:05:25,664 - experiment_functions - INFO - Early stopping at epoch 550. Best Recall: 0.0254
2026-05-18 18:05:25,764 - optuna.study.study - INFO - Trial 117 finished with value: 0.02538886839304022 and parameters: {'n_layers': 1, 'embedding_dim': 64, 'lr': 0.0227750454674261, 'lambda_val': 2.14053635003332e-05, 'batch_size': 801, 'optimizer': 'Adam'}. Best is trial 86 with value: 0.0704995300424917.
2026-05-18 18:05:33,081 - experiment_functions - INFO - Early stopping at epoch 500. Best Recall: 0.0048
2026-05-18 18:05:33,259 - optuna.study.study - INFO - Trial 118 finished with value: 0.004790139032617698 and parameters: {'n_layers': 1, 'embedding_dim': 64, 'lr': 0.00033839698695140063, 'lambda_val': 1.1603680033295976e-05, 'batch_size': 518, 'optimizer': 'SGD'}. Best is trial 86 with value: 0.0704995300424917.
2026-05-18 18:05:48,187 - experiment_functions - INFO - Early stopping at epoch 1000. Best Recall: 0.0620
2026-05-18 18:05:48,287 - optuna.study.study - INFO - Trial 119 finished with value: 0.06201860642391462 and parameters: {'n_layers': 1, 'embedding_dim': 64, 'lr': 0.0009577616352936759, 'lambda_val': 6.019484018397078e-05, 'batch_size': 1019, 'optimizer': 'RMSprop'}. Best is trial 86 with value: 0.0704995300424917.
2026-05-18 18:06:02,485 - optuna.study._optimize - INFO - Trial 120 pruned. 
2026-05-18 18:06:22,990 - experiment_functions - INFO - Early stopping at epoch 1400. Best Recall: 0.0672
2026-05-18 18:06:23,100 - optuna.study.study - INFO - Trial 121 finished with value: 0.06724821630313776 and parameters: {'n_layers': 1, 'embedding_dim': 64, 'lr': 0.0008010609274190698, 'lambda_val': 4.5921675245332405e-06, 'batch_size': 929, 'optimizer': 'RMSprop'}. Best is trial 86 with value: 0.0704995300424917.
2026-05-18 18:06:43,186 - optuna.study._optimize - INFO - Trial 122 pruned. 
2026-05-18 18:06:53,496 - experiment_functions - INFO - Early stopping at epoch 650. Best Recall: 0.0432
2026-05-18 18:06:53,663 - optuna.study.study - INFO - Trial 123 finished with value: 0.04318930474588112 and parameters: {'n_layers': 3, 'embedding_dim': 64, 'lr': 0.0008063137774242022, 'lambda_val': 7.685320104158112e-06, 'batch_size': 935, 'optimizer': 'RMSprop'}. Best is trial 86 with value: 0.0704995300424917.
2026-05-18 18:07:05,706 - experiment_functions - INFO - Early stopping at epoch 800. Best Recall: 0.0615
2026-05-18 18:07:05,807 - optuna.study.study - INFO - Trial 124 finished with value: 0.061536803727583585 and parameters: {'n_layers': 1, 'embedding_dim': 64, 'lr': 0.0012311496628405274, 'lambda_val': 3.7623286273360554e-06, 'batch_size': 843, 'optimizer': 'RMSprop'}. Best is trial 86 with value: 0.0704995300424917.
2026-05-18 18:07:24,579 - optuna.study._optimize - INFO - Trial 125 pruned. 
2026-05-18 18:07:38,456 - experiment_functions - INFO - Early stopping at epoch 900. Best Recall: 0.0619
2026-05-18 18:07:38,574 - optuna.study.study - INFO - Trial 126 finished with value: 0.061883299740767804 and parameters: {'n_layers': 1, 'embedding_dim': 64, 'lr': 0.0009919227645398692, 'lambda_val': 9.436496885021619e-06, 'batch_size': 1099, 'optimizer': 'RMSprop'}. Best is trial 86 with value: 0.0704995300424917.
2026-05-18 18:07:48,612 - experiment_functions - INFO - Early stopping at epoch 650. Best Recall: 0.0557
2026-05-18 18:07:48,714 - optuna.study.study - INFO - Trial 127 finished with value: 0.05570624249027896 and parameters: {'n_layers': 1, 'embedding_dim': 64, 'lr': 0.001546773623015209, 'lambda_val': 1.888814997211067e-05, 'batch_size': 1254, 'optimizer': 'RMSprop'}. Best is trial 86 with value: 0.0704995300424917.
2026-05-18 18:08:03,826 - optuna.study._optimize - INFO - Trial 128 pruned. 
2026-05-18 18:08:18,380 - optuna.study._optimize - INFO - Trial 129 pruned. 
2026-05-18 18:08:35,229 - experiment_functions - INFO - Early stopping at epoch 1100. Best Recall: 0.0708
2026-05-18 18:08:35,343 - optuna.study.study - INFO - Trial 130 finished with value: 0.07079069166223705 and parameters: {'n_layers': 1, 'embedding_dim': 32, 'lr': 0.0012798564211241566, 'lambda_val': 6.1566332153535324e-06, 'batch_size': 611, 'optimizer': 'RMSprop'}. Best is trial 130 with value: 0.07079069166223705.
2026-05-18 18:08:49,017 - experiment_functions - INFO - Early stopping at epoch 850. Best Recall: 0.0614
2026-05-18 18:08:49,116 - optuna.study.study - INFO - Trial 131 finished with value: 0.061394913104394835 and parameters: {'n_layers': 1, 'embedding_dim': 128, 'lr': 0.0012925403596570927, 'lambda_val': 5.7789200278555776e-06, 'batch_size': 662, 'optimizer': 'RMSprop'}. Best is trial 130 with value: 0.07079069166223705.
2026-05-18 18:09:10,617 - experiment_functions - INFO - Early stopping at epoch 1450. Best Recall: 0.0698
2026-05-18 18:09:10,771 - optuna.study.study - INFO - Trial 132 finished with value: 0.06976822678973396 and parameters: {'n_layers': 1, 'embedding_dim': 32, 'lr': 0.0010686500838289839, 'lambda_val': 1.054300550798859e-05, 'batch_size': 589, 'optimizer': 'RMSprop'}. Best is trial 130 with value: 0.07079069166223705.
2026-05-18 18:09:22,521 - experiment_functions - INFO - Early stopping at epoch 750. Best Recall: 0.0570
2026-05-18 18:09:22,610 - optuna.study.study - INFO - Trial 133 finished with value: 0.05703005546659218 and parameters: {'n_layers': 1, 'embedding_dim': 32, 'lr': 0.0018866384947165045, 'lambda_val': 1.0242544091701851e-05, 'batch_size': 574, 'optimizer': 'RMSprop'}. Best is trial 130 with value: 0.07079069166223705.
2026-05-18 18:09:36,982 - optuna.study._optimize - INFO - Trial 134 pruned. 
2026-05-18 18:09:52,569 - experiment_functions - INFO - Early stopping at epoch 1050. Best Recall: 0.0683
2026-05-18 18:09:52,713 - optuna.study.study - INFO - Trial 135 finished with value: 0.06832254376959088 and parameters: {'n_layers': 1, 'embedding_dim': 32, 'lr': 0.0011984855243738323, 'lambda_val': 1.4872748162888858e-05, 'batch_size': 624, 'optimizer': 'RMSprop'}. Best is trial 130 with value: 0.07079069166223705.
2026-05-18 18:10:06,596 - experiment_functions - INFO - Early stopping at epoch 900. Best Recall: 0.0621
2026-05-18 18:10:06,696 - optuna.study.study - INFO - Trial 136 finished with value: 0.062117813734961363 and parameters: {'n_layers': 1, 'embedding_dim': 32, 'lr': 0.0015468467621602851, 'lambda_val': 1.5354619430021628e-05, 'batch_size': 598, 'optimizer': 'RMSprop'}. Best is trial 130 with value: 0.07079069166223705.
2026-05-18 18:10:16,596 - experiment_functions - INFO - Early stopping at epoch 650. Best Recall: 0.0549
2026-05-18 18:10:16,683 - optuna.study.study - INFO - Trial 137 finished with value: 0.05485024820543842 and parameters: {'n_layers': 1, 'embedding_dim': 32, 'lr': 0.002285172335985062, 'lambda_val': 7.015229666665097e-06, 'batch_size': 519, 'optimizer': 'RMSprop'}. Best is trial 130 with value: 0.07079069166223705.
2026-05-18 18:10:33,355 - optuna.study._optimize - INFO - Trial 138 pruned. 
2026-05-18 18:10:53,301 - experiment_functions - INFO - Early stopping at epoch 1350. Best Recall: 0.0664
2026-05-18 18:10:53,445 - optuna.study.study - INFO - Trial 139 finished with value: 0.0664230139126561 and parameters: {'n_layers': 1, 'embedding_dim': 32, 'lr': 0.0011270396447441958, 'lambda_val': 8.049144469436885e-06, 'batch_size': 802, 'optimizer': 'Adam'}. Best is trial 130 with value: 0.07079069166223705.
2026-05-18 18:11:14,637 - experiment_functions - INFO - Early stopping at epoch 1450. Best Recall: 0.0670
2026-05-18 18:11:14,728 - optuna.study.study - INFO - Trial 140 finished with value: 0.066970541315723 and parameters: {'n_layers': 1, 'embedding_dim': 32, 'lr': 0.0011914419815894869, 'lambda_val': 2.311019677255787e-06, 'batch_size': 622, 'optimizer': 'Adam'}. Best is trial 130 with value: 0.07079069166223705.
2026-05-18 18:11:33,881 - experiment_functions - INFO - Early stopping at epoch 1300. Best Recall: 0.0676
2026-05-18 18:11:33,972 - optuna.study.study - INFO - Trial 141 finished with value: 0.06762595675895346 and parameters: {'n_layers': 1, 'embedding_dim': 32, 'lr': 0.0011308599863804377, 'lambda_val': 1.1309427378264479e-06, 'batch_size': 630, 'optimizer': 'Adam'}. Best is trial 130 with value: 0.07079069166223705.
2026-05-18 18:11:50,011 - experiment_functions - INFO - Early stopping at epoch 1100. Best Recall: 0.0639
2026-05-18 18:11:50,121 - optuna.study.study - INFO - Trial 142 finished with value: 0.06393446127372426 and parameters: {'n_layers': 1, 'embedding_dim': 32, 'lr': 0.0013736639070191115, 'lambda_val': 2.424560217155333e-06, 'batch_size': 633, 'optimizer': 'Adam'}. Best is trial 130 with value: 0.07079069166223705.
2026-05-18 18:12:04,373 - experiment_functions - INFO - Early stopping at epoch 950. Best Recall: 0.0671
2026-05-18 18:12:04,471 - optuna.study.study - INFO - Trial 143 finished with value: 0.06713885170825336 and parameters: {'n_layers': 1, 'embedding_dim': 32, 'lr': 0.001824127611489349, 'lambda_val': 1.0134649940321764e-06, 'batch_size': 569, 'optimizer': 'Adam'}. Best is trial 130 with value: 0.07079069166223705.
2026-05-18 18:12:15,548 - experiment_functions - INFO - Early stopping at epoch 750. Best Recall: 0.0625
2026-05-18 18:12:15,649 - optuna.study.study - INFO - Trial 144 finished with value: 0.062481259622270316 and parameters: {'n_layers': 1, 'embedding_dim': 32, 'lr': 0.0034294912244949376, 'lambda_val': 1.0833107808365981e-06, 'batch_size': 606, 'optimizer': 'Adam'}. Best is trial 130 with value: 0.07079069166223705.
2026-05-18 18:12:30,270 - experiment_functions - INFO - Early stopping at epoch 1000. Best Recall: 0.0636
2026-05-18 18:12:30,370 - optuna.study.study - INFO - Trial 145 finished with value: 0.06357667639679776 and parameters: {'n_layers': 1, 'embedding_dim': 32, 'lr': 0.0017184117756385078, 'lambda_val': 1.243950542890039e-06, 'batch_size': 568, 'optimizer': 'Adam'}. Best is trial 130 with value: 0.07079069166223705.
2026-05-18 18:12:53,626 - experiment_functions - INFO - Early stopping at epoch 1600. Best Recall: 0.0677
2026-05-18 18:12:53,723 - optuna.study.study - INFO - Trial 146 finished with value: 0.06773882927964714 and parameters: {'n_layers': 1, 'embedding_dim': 32, 'lr': 0.001214836311574728, 'lambda_val': 1.7304908435460668e-06, 'batch_size': 512, 'optimizer': 'Adam'}. Best is trial 130 with value: 0.07079069166223705.
2026-05-18 18:13:05,000 - experiment_functions - INFO - Early stopping at epoch 750. Best Recall: 0.0633
2026-05-18 18:13:05,080 - optuna.study.study - INFO - Trial 147 finished with value: 0.06325222817870019 and parameters: {'n_layers': 1, 'embedding_dim': 32, 'lr': 0.002764900790853704, 'lambda_val': 1.5326292893532964e-06, 'batch_size': 677, 'optimizer': 'Adam'}. Best is trial 130 with value: 0.07079069166223705.
2026-05-18 18:13:18,782 - experiment_functions - INFO - Early stopping at epoch 950. Best Recall: 0.0657
2026-05-18 18:13:18,872 - optuna.study.study - INFO - Trial 148 finished with value: 0.06574255240998968 and parameters: {'n_layers': 1, 'embedding_dim': 32, 'lr': 0.001928666498565212, 'lambda_val': 1.879627878903295e-06, 'batch_size': 716, 'optimizer': 'Adam'}. Best is trial 130 with value: 0.07079069166223705.
2026-05-18 18:13:33,536 - optuna.study._optimize - INFO - Trial 149 pruned. 
2026-05-18 18:13:50,374 - experiment_functions - INFO - Early stopping at epoch 1150. Best Recall: 0.0675
2026-05-18 18:13:50,473 - optuna.study.study - INFO - Trial 150 finished with value: 0.06745748612949805 and parameters: {'n_layers': 1, 'embedding_dim': 32, 'lr': 0.0014453294173515363, 'lambda_val': 1.6593070980824585e-06, 'batch_size': 750, 'optimizer': 'Adam'}. Best is trial 130 with value: 0.07079069166223705.
2026-05-18 18:14:00,985 - experiment_functions - INFO - Early stopping at epoch 650. Best Recall: 0.0413
2026-05-18 18:14:01,075 - optuna.study.study - INFO - Trial 151 finished with value: 0.04128308748875905 and parameters: {'n_layers': 4, 'embedding_dim': 32, 'lr': 0.001497778345705756, 'lambda_val': 1.0725869129173598e-06, 'batch_size': 753, 'optimizer': 'Adam'}. Best is trial 130 with value: 0.07079069166223705.
2026-05-18 18:14:14,054 - experiment_functions - INFO - Early stopping at epoch 850. Best Recall: 0.0669
2026-05-18 18:14:14,143 - optuna.study.study - INFO - Trial 152 finished with value: 0.06688086692123625 and parameters: {'n_layers': 1, 'embedding_dim': 32, 'lr': 0.0024045131352021477, 'lambda_val': 1.6006986204151165e-06, 'batch_size': 521, 'optimizer': 'Adam'}. Best is trial 130 with value: 0.07079069166223705.
2026-05-18 18:14:30,149 - experiment_functions - INFO - Early stopping at epoch 1100. Best Recall: 0.0676
2026-05-18 18:14:30,327 - optuna.study.study - INFO - Trial 153 finished with value: 0.06755476313479028 and parameters: {'n_layers': 1, 'embedding_dim': 32, 'lr': 0.0013031707359469867, 'lambda_val': 1.4547442481742834e-06, 'batch_size': 698, 'optimizer': 'Adam'}. Best is trial 130 with value: 0.07079069166223705.
2026-05-18 18:14:48,289 - experiment_functions - INFO - Early stopping at epoch 1200. Best Recall: 0.0699
2026-05-18 18:14:48,388 - optuna.study.study - INFO - Trial 154 finished with value: 0.06994986855601709 and parameters: {'n_layers': 1, 'embedding_dim': 32, 'lr': 0.0013054733918344465, 'lambda_val': 1.0101236240602598e-06, 'batch_size': 655, 'optimizer': 'Adam'}. Best is trial 130 with value: 0.07079069166223705.
2026-05-18 18:15:05,302 - optuna.study._optimize - INFO - Trial 155 pruned. 
2026-05-18 18:15:27,110 - experiment_functions - INFO - Early stopping at epoch 1550. Best Recall: 0.0669
2026-05-18 18:15:27,199 - optuna.study.study - INFO - Trial 156 finished with value: 0.0668915627250611 and parameters: {'n_layers': 1, 'embedding_dim': 32, 'lr': 0.0010520281857283574, 'lambda_val': 2.0515690556121258e-06, 'batch_size': 723, 'optimizer': 'Adam'}. Best is trial 130 with value: 0.07079069166223705.
2026-05-18 18:15:40,370 - experiment_functions - INFO - Early stopping at epoch 850. Best Recall: 0.0587
2026-05-18 18:15:40,450 - optuna.study.study - INFO - Trial 157 finished with value: 0.058745869891403533 and parameters: {'n_layers': 1, 'embedding_dim': 32, 'lr': 0.001408085706194266, 'lambda_val': 1.8204340134022293e-06, 'batch_size': 2455, 'optimizer': 'Adam'}. Best is trial 130 with value: 0.07079069166223705.
2026-05-18 18:16:06,982 - experiment_functions - INFO - Early stopping at epoch 1900. Best Recall: 0.0670
2026-05-18 18:16:07,141 - optuna.study.study - INFO - Trial 158 finished with value: 0.06702542277760362 and parameters: {'n_layers': 1, 'embedding_dim': 32, 'lr': 0.0009162943030581949, 'lambda_val': 2.87625366183304e-06, 'batch_size': 796, 'optimizer': 'Adam'}. Best is trial 130 with value: 0.07079069166223705.
2026-05-18 18:16:29,116 - experiment_functions - INFO - Early stopping at epoch 1500. Best Recall: 0.0716
2026-05-18 18:16:29,217 - optuna.study.study - INFO - Trial 159 finished with value: 0.07162660798099917 and parameters: {'n_layers': 1, 'embedding_dim': 32, 'lr': 0.0011435984075779317, 'lambda_val': 1.369611030134276e-06, 'batch_size': 655, 'optimizer': 'Adam'}. Best is trial 159 with value: 0.07162660798099917.
2026-05-18 18:16:44,119 - experiment_functions - INFO - Early stopping at epoch 1000. Best Recall: 0.0676
2026-05-18 18:16:44,208 - optuna.study.study - INFO - Trial 160 finished with value: 0.06761736186689694 and parameters: {'n_layers': 1, 'embedding_dim': 32, 'lr': 0.0016561292268313008, 'lambda_val': 1.391252888610046e-06, 'batch_size': 630, 'optimizer': 'Adam'}. Best is trial 159 with value: 0.07162660798099917.
2026-05-18 18:16:58,998 - experiment_functions - INFO - Early stopping at epoch 1000. Best Recall: 0.0674
2026-05-18 18:16:59,132 - optuna.study.study - INFO - Trial 161 finished with value: 0.0673833724545274 and parameters: {'n_layers': 1, 'embedding_dim': 32, 'lr': 0.0016339946502835446, 'lambda_val': 1.634459701235166e-06, 'batch_size': 638, 'optimizer': 'Adam'}. Best is trial 159 with value: 0.07162660798099917.
2026-05-18 18:17:11,528 - experiment_functions - INFO - Early stopping at epoch 850. Best Recall: 0.0624
2026-05-18 18:17:11,628 - optuna.study.study - INFO - Trial 162 finished with value: 0.06243926791400582 and parameters: {'n_layers': 1, 'embedding_dim': 32, 'lr': 0.002197934715579363, 'lambda_val': 1.30469072800721e-06, 'batch_size': 642, 'optimizer': 'Adam'}. Best is trial 159 with value: 0.07162660798099917.
2026-05-18 18:17:26,332 - experiment_functions - INFO - Early stopping at epoch 1000. Best Recall: 0.0639
