2026-05-18 16:48:14,447 - optuna.study.study - INFO - Trial 132 finished with value: 0.06925061852879516 and parameters: {'n_layers': 1, 'embedding_dim': 32, 'lr': 0.0011248159262228154, 'lambda_val': 3.517885837328461e-05, 'batch_size': 742, 'optimizer': 'Adam'}. Best is trial 76 with value: 0.06986108774395815.
2026-05-18 16:48:28,223 - optuna.study._optimize - INFO - Trial 133 pruned. 
2026-05-18 16:48:43,743 - experiment_functions - INFO - Early stopping at epoch 1150. Best Recall: 0.0651
2026-05-18 16:48:43,845 - optuna.study.study - INFO - Trial 134 finished with value: 0.06514508205552698 and parameters: {'n_layers': 1, 'embedding_dim': 32, 'lr': 0.001253992170573476, 'lambda_val': 3.1468846145433706e-05, 'batch_size': 863, 'optimizer': 'Adam'}. Best is trial 76 with value: 0.06986108774395815.
2026-05-18 16:48:57,343 - experiment_functions - INFO - Early stopping at epoch 950. Best Recall: 0.0622
2026-05-18 16:48:57,479 - optuna.study.study - INFO - Trial 135 finished with value: 0.06222356877427513 and parameters: {'n_layers': 1, 'embedding_dim': 32, 'lr': 0.0018147179016261789, 'lambda_val': 7.307527903313304e-05, 'batch_size': 585, 'optimizer': 'Adam'}. Best is trial 76 with value: 0.06986108774395815.
2026-05-18 16:49:12,712 - experiment_functions - INFO - Early stopping at epoch 1200. Best Recall: 0.0630
2026-05-18 16:49:12,802 - optuna.study.study - INFO - Trial 136 finished with value: 0.06303424083436128 and parameters: {'n_layers': 1, 'embedding_dim': 32, 'lr': 0.001407468410605268, 'lambda_val': 4.143336531578669e-05, 'batch_size': 737, 'optimizer': 'Adam'}. Best is trial 76 with value: 0.06986108774395815.
2026-05-18 16:49:28,821 - experiment_functions - INFO - Early stopping at epoch 1200. Best Recall: 0.0653
2026-05-18 16:49:28,922 - optuna.study.study - INFO - Trial 137 finished with value: 0.06533393237911571 and parameters: {'n_layers': 1, 'embedding_dim': 32, 'lr': 0.0011012889927925137, 'lambda_val': 5.1221422829471126e-05, 'batch_size': 805, 'optimizer': 'Adam'}. Best is trial 76 with value: 0.06986108774395815.
2026-05-18 16:49:41,739 - optuna.study._optimize - INFO - Trial 138 pruned. 
2026-05-18 16:49:49,589 - experiment_functions - INFO - Early stopping at epoch 550. Best Recall: 0.0279
2026-05-18 16:49:49,690 - optuna.study.study - INFO - Trial 139 finished with value: 0.027945527516398817 and parameters: {'n_layers': 3, 'embedding_dim': 32, 'lr': 0.003042370654272118, 'lambda_val': 3.1189636582186936e-05, 'batch_size': 3613, 'optimizer': 'Adam'}. Best is trial 76 with value: 0.06986108774395815.
2026-05-18 16:49:56,757 - experiment_functions - INFO - Early stopping at epoch 500. Best Recall: 0.0052
2026-05-18 16:49:56,868 - optuna.study.study - INFO - Trial 140 finished with value: 0.005168392103984131 and parameters: {'n_layers': 1, 'embedding_dim': 32, 'lr': 0.0008912565268125545, 'lambda_val': 5.9993440142316094e-05, 'batch_size': 969, 'optimizer': 'SGD'}. Best is trial 76 with value: 0.06986108774395815.
2026-05-18 16:50:15,919 - experiment_functions - INFO - Early stopping at epoch 1450. Best Recall: 0.0674
2026-05-18 16:50:16,021 - optuna.study.study - INFO - Trial 141 finished with value: 0.06735985467055747 and parameters: {'n_layers': 1, 'embedding_dim': 32, 'lr': 0.0010275800607381068, 'lambda_val': 7.843736581568347e-05, 'batch_size': 690, 'optimizer': 'Adam'}. Best is trial 76 with value: 0.06986108774395815.
2026-05-18 16:50:31,067 - experiment_functions - INFO - Early stopping at epoch 1150. Best Recall: 0.0687
2026-05-18 16:50:31,169 - optuna.study.study - INFO - Trial 142 finished with value: 0.06870492464424334 and parameters: {'n_layers': 1, 'embedding_dim': 32, 'lr': 0.0012166099671944682, 'lambda_val': 4.073713541452676e-05, 'batch_size': 711, 'optimizer': 'Adam'}. Best is trial 76 with value: 0.06986108774395815.
2026-05-18 16:50:46,050 - experiment_functions - INFO - Early stopping at epoch 1100. Best Recall: 0.0652
2026-05-18 16:50:46,150 - optuna.study.study - INFO - Trial 143 finished with value: 0.06515829148209144 and parameters: {'n_layers': 1, 'embedding_dim': 32, 'lr': 0.0012612580939475957, 'lambda_val': 3.6929335708379435e-05, 'batch_size': 837, 'optimizer': 'Adam'}. Best is trial 76 with value: 0.06986108774395815.
2026-05-18 16:51:00,379 - experiment_functions - INFO - Early stopping at epoch 1050. Best Recall: 0.0693
2026-05-18 16:51:00,480 - optuna.study.study - INFO - Trial 144 finished with value: 0.06926883570057422 and parameters: {'n_layers': 1, 'embedding_dim': 32, 'lr': 0.001533113913085744, 'lambda_val': 4.612039274738382e-05, 'batch_size': 588, 'optimizer': 'Adam'}. Best is trial 76 with value: 0.06986108774395815.
2026-05-18 16:51:12,968 - experiment_functions - INFO - Early stopping at epoch 950. Best Recall: 0.0661
2026-05-18 16:51:13,071 - optuna.study.study - INFO - Trial 145 finished with value: 0.06610363586103112 and parameters: {'n_layers': 1, 'embedding_dim': 32, 'lr': 0.001910326052342746, 'lambda_val': 4.9537753298571494e-05, 'batch_size': 518, 'optimizer': 'Adam'}. Best is trial 76 with value: 0.06986108774395815.
2026-05-18 16:51:28,061 - experiment_functions - INFO - Early stopping at epoch 1050. Best Recall: 0.0670
2026-05-18 16:51:28,218 - optuna.study.study - INFO - Trial 146 finished with value: 0.06697040535970283 and parameters: {'n_layers': 1, 'embedding_dim': 32, 'lr': 0.0015531448695188853, 'lambda_val': 1.8441698131724507e-05, 'batch_size': 601, 'optimizer': 'Adam'}. Best is trial 76 with value: 0.06986108774395815.
2026-05-18 16:51:43,031 - experiment_functions - INFO - Early stopping at epoch 1050. Best Recall: 0.0611
2026-05-18 16:51:43,168 - optuna.study.study - INFO - Trial 147 finished with value: 0.061068463707310845 and parameters: {'n_layers': 1, 'embedding_dim': 32, 'lr': 0.0014790608082213667, 'lambda_val': 2.6530695321832814e-05, 'batch_size': 761, 'optimizer': 'Adam'}. Best is trial 76 with value: 0.06986108774395815.
2026-05-18 16:51:54,299 - experiment_functions - INFO - Early stopping at epoch 750. Best Recall: 0.0673
2026-05-18 16:51:54,831 - optuna.study.study - INFO - Trial 148 finished with value: 0.06726351263353857 and parameters: {'n_layers': 1, 'embedding_dim': 32, 'lr': 0.0027675986203691888, 'lambda_val': 4.063115820883523e-05, 'batch_size': 596, 'optimizer': 'Adam'}. Best is trial 76 with value: 0.06986108774395815.
2026-05-18 16:52:06,989 - experiment_functions - INFO - Early stopping at epoch 850. Best Recall: 0.0624
2026-05-18 16:52:07,081 - optuna.study.study - INFO - Trial 149 finished with value: 0.06239622896820533 and parameters: {'n_layers': 1, 'embedding_dim': 32, 'lr': 0.0020357538050091327, 'lambda_val': 6.413889859681632e-05, 'batch_size': 836, 'optimizer': 'Adam'}. Best is trial 76 with value: 0.06986108774395815.
2026-05-18 16:52:20,692 - optuna.study._optimize - INFO - Trial 150 pruned. 
2026-05-18 16:52:39,488 - experiment_functions - INFO - Early stopping at epoch 1450. Best Recall: 0.0643
2026-05-18 16:52:39,623 - optuna.study.study - INFO - Trial 151 finished with value: 0.06432565921790924 and parameters: {'n_layers': 1, 'embedding_dim': 32, 'lr': 0.0011301948433244588, 'lambda_val': 9.292605124483785e-05, 'batch_size': 712, 'optimizer': 'Adam'}. Best is trial 76 with value: 0.06986108774395815.
2026-05-18 16:53:10,384 - experiment_functions - INFO - Early stopping at epoch 2250. Best Recall: 0.0676
2026-05-18 16:53:10,473 - optuna.study.study - INFO - Trial 152 finished with value: 0.0676384406508245 and parameters: {'n_layers': 1, 'embedding_dim': 32, 'lr': 0.000947342626441, 'lambda_val': 7.860629522277258e-05, 'batch_size': 663, 'optimizer': 'Adam'}. Best is trial 76 with value: 0.06986108774395815.
2026-05-18 16:53:38,653 - experiment_functions - INFO - Early stopping at epoch 2000. Best Recall: 0.0684
2026-05-18 16:53:38,789 - optuna.study.study - INFO - Trial 153 finished with value: 0.06843870546037532 and parameters: {'n_layers': 1, 'embedding_dim': 32, 'lr': 0.0008933815014074391, 'lambda_val': 3.4098035325779754e-05, 'batch_size': 629, 'optimizer': 'Adam'}. Best is trial 76 with value: 0.06986108774395815.
2026-05-18 16:53:49,318 - experiment_functions - INFO - Early stopping at epoch 700. Best Recall: 0.0414
2026-05-18 16:53:49,409 - optuna.study.study - INFO - Trial 154 finished with value: 0.041396977330626646 and parameters: {'n_layers': 4, 'embedding_dim': 32, 'lr': 0.0012130482915096252, 'lambda_val': 3.2104229109813006e-05, 'batch_size': 582, 'optimizer': 'Adam'}. Best is trial 76 with value: 0.06986108774395815.
2026-05-18 16:54:04,299 - experiment_functions - INFO - Early stopping at epoch 1050. Best Recall: 0.0688
2026-05-18 16:54:04,465 - optuna.study.study - INFO - Trial 155 finished with value: 0.06883791875688247 and parameters: {'n_layers': 1, 'embedding_dim': 32, 'lr': 0.00175231145316067, 'lambda_val': 5.472047836573957e-05, 'batch_size': 646, 'optimizer': 'Adam'}. Best is trial 76 with value: 0.06986108774395815.
2026-05-18 16:54:18,370 - experiment_functions - INFO - Early stopping at epoch 1000. Best Recall: 0.0687
2026-05-18 16:54:18,466 - optuna.study.study - INFO - Trial 156 finished with value: 0.06871964537561603 and parameters: {'n_layers': 1, 'embedding_dim': 32, 'lr': 0.0016089413455585328, 'lambda_val': 5.5085314591707284e-05, 'batch_size': 653, 'optimizer': 'Adam'}. Best is trial 76 with value: 0.06986108774395815.
2026-05-18 16:54:29,819 - experiment_functions - INFO - Early stopping at epoch 800. Best Recall: 0.0663
2026-05-18 16:54:29,919 - optuna.study.study - INFO - Trial 157 finished with value: 0.06632241461725746 and parameters: {'n_layers': 1, 'embedding_dim': 32, 'lr': 0.0024869722183251597, 'lambda_val': 4.9722831624130246e-05, 'batch_size': 782, 'optimizer': 'Adam'}. Best is trial 76 with value: 0.06986108774395815.
2026-05-18 16:54:44,397 - experiment_functions - INFO - Early stopping at epoch 1000. Best Recall: 0.0621
2026-05-18 16:54:44,497 - optuna.study.study - INFO - Trial 158 finished with value: 0.06214431548003764 and parameters: {'n_layers': 1, 'embedding_dim': 32, 'lr': 0.0016912743680945485, 'lambda_val': 5.092633134985054e-05, 'batch_size': 512, 'optimizer': 'Adam'}. Best is trial 76 with value: 0.06986108774395815.
2026-05-18 16:54:57,838 - experiment_functions - INFO - Early stopping at epoch 950. Best Recall: 0.0644
2026-05-18 16:54:57,950 - optuna.study.study - INFO - Trial 159 finished with value: 0.06443829378577301 and parameters: {'n_layers': 1, 'embedding_dim': 32, 'lr': 0.0021312730039748104, 'lambda_val': 6.432757777272315e-05, 'batch_size': 635, 'optimizer': 'Adam'}. Best is trial 76 with value: 0.06986108774395815.
2026-05-18 16:55:06,443 - experiment_functions - INFO - Early stopping at epoch 600. Best Recall: 0.0109
2026-05-18 16:55:06,534 - optuna.study.study - INFO - Trial 160 finished with value: 0.010911443958880326 and parameters: {'n_layers': 1, 'embedding_dim': 32, 'lr': 0.08692344011788708, 'lambda_val': 0.00012067512956150269, 'batch_size': 586, 'optimizer': 'Adam'}. Best is trial 76 with value: 0.06986108774395815.
2026-05-18 16:55:22,102 - experiment_functions - INFO - Early stopping at epoch 1100. Best Recall: 0.0631
2026-05-18 16:55:22,193 - optuna.study.study - INFO - Trial 161 finished with value: 0.06310659030911878 and parameters: {'n_layers': 1, 'embedding_dim': 32, 'lr': 0.001386782039360571, 'lambda_val': 8.453975972116353e-05, 'batch_size': 682, 'optimizer': 'Adam'}. Best is trial 76 with value: 0.06986108774395815.
2026-05-18 16:55:46,888 - experiment_functions - INFO - Early stopping at epoch 1850. Best Recall: 0.0672
2026-05-18 16:55:46,980 - optuna.study.study - INFO - Trial 162 finished with value: 0.06722087451168071 and parameters: {'n_layers': 1, 'embedding_dim': 32, 'lr': 0.0009415264142598021, 'lambda_val': 6.937045292776705e-05, 'batch_size': 652, 'optimizer': 'Adam'}. Best is trial 76 with value: 0.06986108774395815.
2026-05-18 16:56:01,247 - experiment_functions - INFO - Early stopping at epoch 1000. Best Recall: 0.0650
2026-05-18 16:56:01,382 - optuna.study.study - INFO - Trial 163 finished with value: 0.06501300407472572 and parameters: {'n_layers': 1, 'embedding_dim': 32, 'lr': 0.0015569934101971159, 'lambda_val': 2.3086829022627035e-05, 'batch_size': 774, 'optimizer': 'Adam'}. Best is trial 76 with value: 0.06986108774395815.
2026-05-18 16:56:25,852 - experiment_functions - INFO - Early stopping at epoch 1800. Best Recall: 0.0651
2026-05-18 16:56:25,986 - optuna.study.study - INFO - Trial 164 finished with value: 0.06510753629027356 and parameters: {'n_layers': 1, 'embedding_dim': 32, 'lr': 0.0008026359788095777, 'lambda_val': 8.392757375783813e-05, 'batch_size': 830, 'optimizer': 'Adam'}. Best is trial 76 with value: 0.06986108774395815.
2026-05-18 16:56:39,753 - experiment_functions - INFO - Early stopping at epoch 950. Best Recall: 0.0666
2026-05-18 16:56:39,844 - optuna.study.study - INFO - Trial 165 finished with value: 0.06659365423983879 and parameters: {'n_layers': 1, 'embedding_dim': 32, 'lr': 0.0018685372260609028, 'lambda_val': 4.201658528692665e-05, 'batch_size': 512, 'optimizer': 'Adam'}. Best is trial 76 with value: 0.06986108774395815.
2026-05-18 16:56:57,223 - experiment_functions - INFO - Early stopping at epoch 1200. Best Recall: 0.0661
2026-05-18 16:56:57,314 - optuna.study.study - INFO - Trial 166 finished with value: 0.06606542556457529 and parameters: {'n_layers': 1, 'embedding_dim': 32, 'lr': 0.0013474848759056906, 'lambda_val': 3.264216311342484e-05, 'batch_size': 641, 'optimizer': 'Adam'}. Best is trial 76 with value: 0.06986108774395815.
2026-05-18 16:57:20,054 - experiment_functions - INFO - Early stopping at epoch 1600. Best Recall: 0.0684
2026-05-18 16:57:20,146 - optuna.study.study - INFO - Trial 167 finished with value: 0.06839200213516172 and parameters: {'n_layers': 1, 'embedding_dim': 32, 'lr': 0.0009253169707813049, 'lambda_val': 5.650132230858693e-05, 'batch_size': 902, 'optimizer': 'Adam'}. Best is trial 76 with value: 0.06986108774395815.
2026-05-18 16:57:30,065 - experiment_functions - INFO - Early stopping at epoch 650. Best Recall: 0.0641
2026-05-18 16:57:30,155 - optuna.study.study - INFO - Trial 168 finished with value: 0.06414877297574476 and parameters: {'n_layers': 1, 'embedding_dim': 96, 'lr': 0.003337335608854409, 'lambda_val': 5.637230089921796e-05, 'batch_size': 917, 'optimizer': 'Adam'}. Best is trial 76 with value: 0.06986108774395815.
2026-05-18 16:57:37,653 - experiment_functions - INFO - Early stopping at epoch 500. Best Recall: 0.0046
2026-05-18 16:57:37,744 - optuna.study.study - INFO - Trial 169 finished with value: 0.00458612653515449 and parameters: {'n_layers': 1, 'embedding_dim': 32, 'lr': 0.0016972406240361247, 'lambda_val': 0.00011123990061717708, 'batch_size': 743, 'optimizer': 'SGD'}. Best is trial 76 with value: 0.06986108774395815.
2026-05-18 16:57:45,065 - experiment_functions - INFO - Early stopping at epoch 500. Best Recall: 0.0049
2026-05-18 16:57:45,155 - optuna.study.study - INFO - Trial 170 finished with value: 0.004886425397621014 and parameters: {'n_layers': 1, 'embedding_dim': 32, 'lr': 0.0005581929511491829, 'lambda_val': 0.037683148682146186, 'batch_size': 844, 'optimizer': 'Adam'}. Best is trial 76 with value: 0.06986108774395815.
2026-05-18 16:58:09,150 - experiment_functions - INFO - Early stopping at epoch 1850. Best Recall: 0.0730
2026-05-18 16:58:09,233 - optuna.study.study - INFO - Trial 171 finished with value: 0.07296168750388608 and parameters: {'n_layers': 1, 'embedding_dim': 32, 'lr': 0.0010039446278879603, 'lambda_val': 5.9986852767088015e-05, 'batch_size': 585, 'optimizer': 'Adam'}. Best is trial 171 with value: 0.07296168750388608.
2026-05-18 16:58:29,237 - experiment_functions - INFO - Early stopping at epoch 1550. Best Recall: 0.0679
2026-05-18 16:58:29,338 - optuna.study.study - INFO - Trial 172 finished with value: 0.0678886848533945 and parameters: {'n_layers': 1, 'embedding_dim': 32, 'lr': 0.0010767977455780925, 'lambda_val': 6.13460170873913e-05, 'batch_size': 604, 'optimizer': 'Adam'}. Best is trial 171 with value: 0.07296168750388608.
2026-05-18 16:58:47,999 - experiment_functions - INFO - Early stopping at epoch 1400. Best Recall: 0.0662
2026-05-18 16:58:48,119 - optuna.study.study - INFO - Trial 173 finished with value: 0.06617371502567974 and parameters: {'n_layers': 1, 'embedding_dim': 32, 'lr': 0.0013659749995947419, 'lambda_val': 3.923399602579558e-05, 'batch_size': 575, 'optimizer': 'Adam'}. Best is trial 171 with value: 0.07296168750388608.
2026-05-18 16:59:10,482 - optuna.study._optimize - INFO - Trial 174 pruned. 
2026-05-18 16:59:24,393 - optuna.study._optimize - INFO - Trial 175 pruned. 
2026-05-18 16:59:35,868 - experiment_functions - INFO - Early stopping at epoch 800. Best Recall: 0.0689
2026-05-18 16:59:35,967 - optuna.study.study - INFO - Trial 176 finished with value: 0.06891209599001587 and parameters: {'n_layers': 1, 'embedding_dim': 32, 'lr': 0.0024369609670342697, 'lambda_val': 0.00015472869339180694, 'batch_size': 697, 'optimizer': 'Adam'}. Best is trial 171 with value: 0.07296168750388608.
2026-05-18 16:59:48,781 - experiment_functions - INFO - Early stopping at epoch 900. Best Recall: 0.0574
2026-05-18 16:59:48,873 - optuna.study.study - INFO - Trial 177 finished with value: 0.05742446839713226 and parameters: {'n_layers': 1, 'embedding_dim': 32, 'lr': 0.0021921183211725138, 'lambda_val': 9.802591618998272e-05, 'batch_size': 795, 'optimizer': 'Adam'}. Best is trial 171 with value: 0.07296168750388608.
2026-05-18 16:59:59,952 - experiment_functions - INFO - Early stopping at epoch 750. Best Recall: 0.0655
2026-05-18 17:00:00,043 - optuna.study.study - INFO - Trial 178 finished with value: 0.06547552125453587 and parameters: {'n_layers': 1, 'embedding_dim': 32, 'lr': 0.002576576964209229, 'lambda_val': 0.00012458700154011423, 'batch_size': 653, 'optimizer': 'Adam'}. Best is trial 171 with value: 0.07296168750388608.
2026-05-18 17:00:11,862 - experiment_functions - INFO - Early stopping at epoch 850. Best Recall: 0.0603
2026-05-18 17:00:11,952 - optuna.study.study - INFO - Trial 179 finished with value: 0.060275917223620176 and parameters: {'n_layers': 1, 'embedding_dim': 32, 'lr': 0.0017188336420567326, 'lambda_val': 0.00017339887700080077, 'batch_size': 885, 'optimizer': 'Adam'}. Best is trial 171 with value: 0.07296168750388608.
2026-05-18 17:00:46,503 - experiment_functions - INFO - Early stopping at epoch 2600. Best Recall: 0.0695
2026-05-18 17:00:46,605 - optuna.study.study - INFO - Trial 180 finished with value: 0.06953729166379813 and parameters: {'n_layers': 1, 'embedding_dim': 32, 'lr': 0.0009782337050266, 'lambda_val': 0.0001521222262270512, 'batch_size': 513, 'optimizer': 'Adam'}. Best is trial 171 with value: 0.07296168750388608.
2026-05-18 17:01:17,286 - experiment_functions - INFO - Early stopping at epoch 1900. Best Recall: 0.0683
2026-05-18 17:01:18,052 - optuna.study.study - INFO - Trial 181 finished with value: 0.06825899756490149 and parameters: {'n_layers': 1, 'embedding_dim': 32, 'lr': 0.0009831301590383097, 'lambda_val': 0.00014382394234163944, 'batch_size': 565, 'optimizer': 'Adam'}. Best is trial 171 with value: 0.07296168750388608.
2026-05-18 17:01:44,419 - experiment_functions - INFO - Early stopping at epoch 1650. Best Recall: 0.0736
2026-05-18 17:01:44,521 - optuna.study.study - INFO - Trial 182 finished with value: 0.07364666864617787 and parameters: {'n_layers': 1, 'embedding_dim': 32, 'lr': 0.0009527845230527896, 'lambda_val': 5.6349858568908926e-05, 'batch_size': 705, 'optimizer': 'Adam'}. Best is trial 182 with value: 0.07364666864617787.
2026-05-18 17:02:37,292 - optuna.study.study - INFO - Trial 183 finished with value: 0.07072631054614219 and parameters: {'n_layers': 1, 'embedding_dim': 32, 'lr': 0.0007859816853353891, 'lambda_val': 5.5317723847834e-05, 'batch_size': 719, 'optimizer': 'Adam'}. Best is trial 182 with value: 0.07364666864617787.
2026-05-18 17:02:52,837 - optuna.study._optimize - INFO - Trial 184 pruned. 
2026-05-18 17:03:09,938 - optuna.study._optimize - INFO - Trial 185 pruned. 
2026-05-18 17:03:25,347 - experiment_functions - INFO - Early stopping at epoch 1100. Best Recall: 0.0691
2026-05-18 17:03:25,482 - optuna.study.study - INFO - Trial 186 finished with value: 0.06914969892402867 and parameters: {'n_layers': 1, 'embedding_dim': 32, 'lr': 0.0012907349296454771, 'lambda_val': 9.112170230620348e-05, 'batch_size': 756, 'optimizer': 'Adam'}. Best is trial 182 with value: 0.07364666864617787.
2026-05-18 17:03:42,878 - experiment_functions - INFO - Early stopping at epoch 1200. Best Recall: 0.0650
2026-05-18 17:03:42,980 - optuna.study.study - INFO - Trial 187 finished with value: 0.0649872221107235 and parameters: {'n_layers': 1, 'embedding_dim': 32, 'lr': 0.001239720246048731, 'lambda_val': 9.336721834591322e-05, 'batch_size': 779, 'optimizer': 'Adam'}. Best is trial 182 with value: 0.07364666864617787.
2026-05-18 17:03:59,525 - experiment_functions - INFO - Early stopping at epoch 1100. Best Recall: 0.0697
2026-05-18 17:03:59,626 - optuna.study.study - INFO - Trial 188 finished with value: 0.06966160722121038 and parameters: {'n_layers': 1, 'embedding_dim': 32, 'lr': 0.0013565332340858384, 'lambda_val': 7.459307141883693e-05, 'batch_size': 734, 'optimizer': 'Adam'}. Best is trial 182 with value: 0.07364666864617787.
2026-05-18 17:04:20,019 - experiment_functions - INFO - Early stopping at epoch 750. Best Recall: 0.0611
2026-05-18 17:04:20,120 - optuna.study.study - INFO - Trial 189 finished with value: 0.061053661425069884 and parameters: {'n_layers': 1, 'embedding_dim': 96, 'lr': 0.002117544654750258, 'lambda_val': 0.00011101230816908942, 'batch_size': 795, 'optimizer': 'Adam'}. Best is trial 182 with value: 0.07364666864617787.
2026-05-18 17:04:35,950 - experiment_functions - INFO - Early stopping at epoch 1050. Best Recall: 0.0700
