2026-05-18 17:45:14,078 - optuna.study.study - INFO - Trial 27 finished with value: 0.0573248753476422 and parameters: {'n_layers': 1, 'embedding_dim': 96, 'lr': 0.0008670180038770728, 'lambda_val': 1.1600519401758285e-05, 'batch_size': 2764, 'optimizer': 'RMSprop'}. Best is trial 21 with value: 0.07030532387982594.
2026-05-18 17:45:23,206 - experiment_functions - INFO - Early stopping at epoch 600. Best Recall: 0.0517
2026-05-18 17:45:23,306 - optuna.study.study - INFO - Trial 28 finished with value: 0.05167741542856402 and parameters: {'n_layers': 2, 'embedding_dim': 64, 'lr': 0.003214439332367303, 'lambda_val': 3.303306732298631e-05, 'batch_size': 1513, 'optimizer': 'Adam'}. Best is trial 21 with value: 0.07030532387982594.
2026-05-18 17:45:30,296 - experiment_functions - INFO - Early stopping at epoch 500. Best Recall: 0.0058
2026-05-18 17:45:30,396 - optuna.study.study - INFO - Trial 29 finished with value: 0.005768380070372062 and parameters: {'n_layers': 1, 'embedding_dim': 32, 'lr': 0.08486780532491259, 'lambda_val': 0.001325137623493481, 'batch_size': 1104, 'optimizer': 'SGD'}. Best is trial 21 with value: 0.07030532387982594.
2026-05-18 17:45:45,646 - optuna.study._optimize - INFO - Trial 30 pruned. 
2026-05-18 17:45:59,083 - experiment_functions - INFO - Early stopping at epoch 950. Best Recall: 0.0652
2026-05-18 17:45:59,173 - optuna.study.study - INFO - Trial 31 finished with value: 0.06521732284044036 and parameters: {'n_layers': 1, 'embedding_dim': 64, 'lr': 0.001191265620371363, 'lambda_val': 1.7412416077269537e-06, 'batch_size': 523, 'optimizer': 'RMSprop'}. Best is trial 21 with value: 0.07030532387982594.
2026-05-18 17:46:13,393 - optuna.study._optimize - INFO - Trial 32 pruned. 
2026-05-18 17:46:26,193 - experiment_functions - INFO - Early stopping at epoch 850. Best Recall: 0.0584
2026-05-18 17:46:26,272 - optuna.study.study - INFO - Trial 33 finished with value: 0.0584089417407427 and parameters: {'n_layers': 1, 'embedding_dim': 64, 'lr': 0.0010323392621343715, 'lambda_val': 5.17289508428707e-06, 'batch_size': 1559, 'optimizer': 'RMSprop'}. Best is trial 21 with value: 0.07030532387982594.
2026-05-18 17:46:40,429 - optuna.study._optimize - INFO - Trial 34 pruned. 
2026-05-18 17:46:50,703 - experiment_functions - INFO - Early stopping at epoch 700. Best Recall: 0.0617
2026-05-18 17:46:50,793 - optuna.study.study - INFO - Trial 35 finished with value: 0.061736997925537315 and parameters: {'n_layers': 1, 'embedding_dim': 64, 'lr': 0.002202660107877963, 'lambda_val': 6.553220887283731e-06, 'batch_size': 1813, 'optimizer': 'Adam'}. Best is trial 21 with value: 0.07030532387982594.
2026-05-18 17:47:04,505 - optuna.study._optimize - INFO - Trial 36 pruned. 
2026-05-18 17:47:15,947 - experiment_functions - INFO - Early stopping at epoch 700. Best Recall: 0.0159
2026-05-18 17:47:16,106 - optuna.study.study - INFO - Trial 37 finished with value: 0.015866094650977422 and parameters: {'n_layers': 2, 'embedding_dim': 256, 'lr': 0.001198835772164991, 'lambda_val': 0.09852036797264592, 'batch_size': 720, 'optimizer': 'RMSprop'}. Best is trial 21 with value: 0.07030532387982594.
2026-05-18 17:47:31,743 - optuna.study._optimize - INFO - Trial 38 pruned. 
2026-05-18 17:47:45,207 - optuna.study._optimize - INFO - Trial 39 pruned. 
2026-05-18 17:47:52,369 - experiment_functions - INFO - Early stopping at epoch 500. Best Recall: 0.0054
2026-05-18 17:47:52,459 - optuna.study.study - INFO - Trial 40 finished with value: 0.005379653396609143 and parameters: {'n_layers': 1, 'embedding_dim': 128, 'lr': 0.0008396952848686313, 'lambda_val': 6.60741125280885e-06, 'batch_size': 1184, 'optimizer': 'SGD'}. Best is trial 21 with value: 0.07030532387982594.
2026-05-18 17:48:04,990 - experiment_functions - INFO - Early stopping at epoch 850. Best Recall: 0.0630
2026-05-18 17:48:05,125 - optuna.study.study - INFO - Trial 41 finished with value: 0.06297460754839125 and parameters: {'n_layers': 1, 'embedding_dim': 64, 'lr': 0.001535430189640306, 'lambda_val': 1.0833553420581326e-06, 'batch_size': 521, 'optimizer': 'RMSprop'}. Best is trial 21 with value: 0.07030532387982594.
2026-05-18 17:48:16,153 - experiment_functions - INFO - Early stopping at epoch 750. Best Recall: 0.0636
2026-05-18 17:48:16,243 - optuna.study.study - INFO - Trial 42 finished with value: 0.06362762593135317 and parameters: {'n_layers': 1, 'embedding_dim': 64, 'lr': 0.001520734202947573, 'lambda_val': 1.6733736185810726e-06, 'batch_size': 700, 'optimizer': 'RMSprop'}. Best is trial 21 with value: 0.07030532387982594.
2026-05-18 17:48:24,555 - experiment_functions - INFO - Early stopping at epoch 550. Best Recall: 0.0426
2026-05-18 17:48:24,679 - optuna.study.study - INFO - Trial 43 finished with value: 0.04263106252057456 and parameters: {'n_layers': 1, 'embedding_dim': 64, 'lr': 0.003374254046867156, 'lambda_val': 3.904443286050511e-06, 'batch_size': 781, 'optimizer': 'RMSprop'}. Best is trial 21 with value: 0.07030532387982594.
2026-05-18 17:48:42,301 - optuna.study._optimize - INFO - Trial 44 pruned. 
2026-05-18 17:48:55,432 - optuna.study._optimize - INFO - Trial 45 pruned. 
2026-05-18 17:49:08,773 - experiment_functions - INFO - Early stopping at epoch 950. Best Recall: 0.0617
2026-05-18 17:49:08,884 - optuna.study.study - INFO - Trial 46 finished with value: 0.061683384979376595 and parameters: {'n_layers': 1, 'embedding_dim': 64, 'lr': 0.0011409297797451462, 'lambda_val': 8.643617149548134e-06, 'batch_size': 850, 'optimizer': 'RMSprop'}. Best is trial 21 with value: 0.07030532387982594.
2026-05-18 17:49:25,802 - optuna.study._optimize - INFO - Trial 47 pruned. 
2026-05-18 17:49:39,985 - optuna.study._optimize - INFO - Trial 48 pruned. 
2026-05-18 17:49:53,988 - experiment_functions - INFO - Early stopping at epoch 950. Best Recall: 0.0564
2026-05-18 17:49:54,079 - optuna.study.study - INFO - Trial 49 finished with value: 0.056406427754534874 and parameters: {'n_layers': 1, 'embedding_dim': 64, 'lr': 0.0006889971967203369, 'lambda_val': 1.0131552613820728e-06, 'batch_size': 2769, 'optimizer': 'RMSprop'}. Best is trial 21 with value: 0.07030532387982594.
2026-05-18 17:50:01,747 - experiment_functions - INFO - Early stopping at epoch 500. Best Recall: 0.0053
2026-05-18 17:50:01,847 - optuna.study.study - INFO - Trial 50 finished with value: 0.005279189282634446 and parameters: {'n_layers': 3, 'embedding_dim': 64, 'lr': 0.0020839198009414465, 'lambda_val': 2.0859467230369675e-06, 'batch_size': 1343, 'optimizer': 'SGD'}. Best is trial 21 with value: 0.07030532387982594.
2026-05-18 17:50:12,635 - experiment_functions - INFO - Early stopping at epoch 750. Best Recall: 0.0608
2026-05-18 17:50:12,735 - optuna.study.study - INFO - Trial 51 finished with value: 0.06082609562710343 and parameters: {'n_layers': 1, 'embedding_dim': 64, 'lr': 0.001803238193301511, 'lambda_val': 1.0036458740020786e-06, 'batch_size': 518, 'optimizer': 'RMSprop'}. Best is trial 21 with value: 0.07030532387982594.
2026-05-18 17:50:23,182 - experiment_functions - INFO - Early stopping at epoch 700. Best Recall: 0.0637
2026-05-18 17:50:23,282 - optuna.study.study - INFO - Trial 52 finished with value: 0.06366220002400973 and parameters: {'n_layers': 1, 'embedding_dim': 64, 'lr': 0.0015154709927446947, 'lambda_val': 3.2699611939614237e-06, 'batch_size': 658, 'optimizer': 'RMSprop'}. Best is trial 21 with value: 0.07030532387982594.
2026-05-18 17:50:37,677 - optuna.study._optimize - INFO - Trial 53 pruned. 
2026-05-18 17:50:54,665 - experiment_functions - INFO - Early stopping at epoch 1200. Best Recall: 0.0654
2026-05-18 17:50:54,755 - optuna.study.study - INFO - Trial 54 finished with value: 0.06541455073066987 and parameters: {'n_layers': 1, 'embedding_dim': 64, 'lr': 0.0008320510293847184, 'lambda_val': 4.975688992035072e-06, 'batch_size': 932, 'optimizer': 'RMSprop'}. Best is trial 21 with value: 0.07030532387982594.
2026-05-18 17:51:08,752 - optuna.study._optimize - INFO - Trial 55 pruned. 
2026-05-18 17:51:19,813 - experiment_functions - INFO - Early stopping at epoch 650. Best Recall: 0.0506
2026-05-18 17:51:19,903 - optuna.study.study - INFO - Trial 56 finished with value: 0.05060527855314886 and parameters: {'n_layers': 1, 'embedding_dim': 256, 'lr': 0.0008415161330853437, 'lambda_val': 4.98048652222928e-06, 'batch_size': 4046, 'optimizer': 'RMSprop'}. Best is trial 21 with value: 0.07030532387982594.
2026-05-18 17:51:33,488 - experiment_functions - INFO - Early stopping at epoch 900. Best Recall: 0.0565
2026-05-18 17:51:33,578 - optuna.study.study - INFO - Trial 57 finished with value: 0.056543840727036436 and parameters: {'n_layers': 2, 'embedding_dim': 64, 'lr': 0.0006048592403173789, 'lambda_val': 3.076204237018377e-06, 'batch_size': 869, 'optimizer': 'RMSprop'}. Best is trial 21 with value: 0.07030532387982594.
2026-05-18 17:51:41,981 - experiment_functions - INFO - Early stopping at epoch 550. Best Recall: 0.0411
2026-05-18 17:51:42,072 - optuna.study.study - INFO - Trial 58 finished with value: 0.04107625188380411 and parameters: {'n_layers': 1, 'embedding_dim': 128, 'lr': 0.0026371221806107607, 'lambda_val': 8.925782100958054e-06, 'batch_size': 1099, 'optimizer': 'RMSprop'}. Best is trial 21 with value: 0.07030532387982594.
2026-05-18 17:51:56,132 - optuna.study._optimize - INFO - Trial 59 pruned. 
2026-05-18 17:52:10,583 - optuna.study._optimize - INFO - Trial 60 pruned. 
2026-05-18 17:52:21,988 - experiment_functions - INFO - Early stopping at epoch 800. Best Recall: 0.0613
2026-05-18 17:52:22,090 - optuna.study.study - INFO - Trial 61 finished with value: 0.06128669930218966 and parameters: {'n_layers': 1, 'embedding_dim': 64, 'lr': 0.0013857918846571597, 'lambda_val': 1.6571191569272108e-06, 'batch_size': 640, 'optimizer': 'RMSprop'}. Best is trial 21 with value: 0.07030532387982594.
2026-05-18 17:52:35,109 - experiment_functions - INFO - Early stopping at epoch 900. Best Recall: 0.0634
2026-05-18 17:52:35,277 - optuna.study.study - INFO - Trial 62 finished with value: 0.06336043702834704 and parameters: {'n_layers': 1, 'embedding_dim': 64, 'lr': 0.0010579591937794344, 'lambda_val': 2.827681836060896e-06, 'batch_size': 900, 'optimizer': 'RMSprop'}. Best is trial 21 with value: 0.07030532387982594.
2026-05-18 17:52:45,557 - experiment_functions - INFO - Early stopping at epoch 700. Best Recall: 0.0609
2026-05-18 17:52:45,657 - optuna.study.study - INFO - Trial 63 finished with value: 0.060936219484905255 and parameters: {'n_layers': 1, 'embedding_dim': 64, 'lr': 0.0015367827501730398, 'lambda_val': 5.0754071400852325e-06, 'batch_size': 634, 'optimizer': 'RMSprop'}. Best is trial 21 with value: 0.07030532387982594.
2026-05-18 17:53:13,544 - experiment_functions - INFO - Early stopping at epoch 2050. Best Recall: 0.0684
2026-05-18 17:53:13,643 - optuna.study.study - INFO - Trial 64 finished with value: 0.06839479532897232 and parameters: {'n_layers': 1, 'embedding_dim': 64, 'lr': 0.0007166862749969404, 'lambda_val': 9.88962797774238e-05, 'batch_size': 780, 'optimizer': 'RMSprop'}. Best is trial 21 with value: 0.07030532387982594.
2026-05-18 17:53:27,502 - optuna.study._optimize - INFO - Trial 65 pruned. 
2026-05-18 17:53:34,572 - experiment_functions - INFO - Early stopping at epoch 500. Best Recall: 0.0047
2026-05-18 17:53:34,671 - optuna.study.study - INFO - Trial 66 finished with value: 0.004702105219611359 and parameters: {'n_layers': 1, 'embedding_dim': 96, 'lr': 0.00036648707203108035, 'lambda_val': 0.005259923823951271, 'batch_size': 807, 'optimizer': 'SGD'}. Best is trial 21 with value: 0.07030532387982594.
2026-05-18 17:53:48,444 - optuna.study._optimize - INFO - Trial 67 pruned. 
2026-05-18 17:53:59,466 - experiment_functions - INFO - Early stopping at epoch 750. Best Recall: 0.0508
2026-05-18 17:53:59,567 - optuna.study.study - INFO - Trial 68 finished with value: 0.050817174575871225 and parameters: {'n_layers': 1, 'embedding_dim': 64, 'lr': 0.0009919531021980285, 'lambda_val': 0.0002786439393899189, 'batch_size': 2082, 'optimizer': 'RMSprop'}. Best is trial 21 with value: 0.07030532387982594.
2026-05-18 17:54:06,504 - experiment_functions - INFO - Early stopping at epoch 500. Best Recall: 0.0053
2026-05-18 17:54:06,594 - optuna.study.study - INFO - Trial 69 finished with value: 0.005328926569356544 and parameters: {'n_layers': 1, 'embedding_dim': 64, 'lr': 1.4565816922375007e-05, 'lambda_val': 0.0009160351960345134, 'batch_size': 1462, 'optimizer': 'RMSprop'}. Best is trial 21 with value: 0.07030532387982594.
2026-05-18 17:54:21,187 - optuna.study._optimize - INFO - Trial 70 pruned. 
2026-05-18 17:54:30,554 - experiment_functions - INFO - Early stopping at epoch 600. Best Recall: 0.0505
2026-05-18 17:54:30,645 - optuna.study.study - INFO - Trial 71 finished with value: 0.05051669138706539 and parameters: {'n_layers': 1, 'embedding_dim': 64, 'lr': 0.0024825772713446366, 'lambda_val': 1.3342645001980544e-05, 'batch_size': 726, 'optimizer': 'RMSprop'}. Best is trial 21 with value: 0.07030532387982594.
2026-05-18 17:54:53,171 - optuna.study._optimize - INFO - Trial 72 pruned. 
2026-05-18 17:55:07,075 - experiment_functions - INFO - Early stopping at epoch 900. Best Recall: 0.0648
2026-05-18 17:55:07,379 - optuna.study.study - INFO - Trial 73 finished with value: 0.06476086818916735 and parameters: {'n_layers': 1, 'embedding_dim': 64, 'lr': 0.001293516831112843, 'lambda_val': 1.4164428842377958e-06, 'batch_size': 618, 'optimizer': 'RMSprop'}. Best is trial 21 with value: 0.07030532387982594.
2026-05-18 17:55:21,076 - experiment_functions - INFO - Early stopping at epoch 900. Best Recall: 0.0641
2026-05-18 17:55:21,175 - optuna.study.study - INFO - Trial 74 finished with value: 0.06409352113007184 and parameters: {'n_layers': 1, 'embedding_dim': 64, 'lr': 0.0012283787574733649, 'lambda_val': 2.6046385516738543e-06, 'batch_size': 585, 'optimizer': 'RMSprop'}. Best is trial 21 with value: 0.07030532387982594.
2026-05-18 17:55:38,510 - experiment_functions - INFO - Early stopping at epoch 1150. Best Recall: 0.0649
2026-05-18 17:55:38,656 - optuna.study.study - INFO - Trial 75 finished with value: 0.0648925993122684 and parameters: {'n_layers': 1, 'embedding_dim': 64, 'lr': 0.000873155642340489, 'lambda_val': 2.4839105408273646e-06, 'batch_size': 954, 'optimizer': 'RMSprop'}. Best is trial 21 with value: 0.07030532387982594.
2026-05-18 17:55:51,921 - optuna.study._optimize - INFO - Trial 76 pruned. 
2026-05-18 17:55:58,887 - experiment_functions - INFO - Early stopping at epoch 500. Best Recall: 0.0047
2026-05-18 17:55:58,985 - optuna.study.study - INFO - Trial 77 finished with value: 0.004747170986418522 and parameters: {'n_layers': 2, 'embedding_dim': 64, 'lr': 0.00036869692185220905, 'lambda_val': 4.184060626717906e-06, 'batch_size': 912, 'optimizer': 'SGD'}. Best is trial 21 with value: 0.07030532387982594.
2026-05-18 17:56:14,172 - experiment_functions - INFO - Early stopping at epoch 1150. Best Recall: 0.0627
2026-05-18 17:56:14,272 - optuna.study.study - INFO - Trial 78 finished with value: 0.06268053419912462 and parameters: {'n_layers': 1, 'embedding_dim': 64, 'lr': 0.0009542937959761674, 'lambda_val': 2.2099965787274176e-06, 'batch_size': 1169, 'optimizer': 'Adam'}. Best is trial 21 with value: 0.07030532387982594.
2026-05-18 17:56:30,468 - optuna.study._optimize - INFO - Trial 79 pruned. 
2026-05-18 17:56:44,575 - experiment_functions - INFO - Early stopping at epoch 1000. Best Recall: 0.0650
2026-05-18 17:56:44,655 - optuna.study.study - INFO - Trial 80 finished with value: 0.06498664267514732 and parameters: {'n_layers': 1, 'embedding_dim': 96, 'lr': 0.0007570097390358323, 'lambda_val': 6.5874449393552535e-06, 'batch_size': 1658, 'optimizer': 'RMSprop'}. Best is trial 21 with value: 0.07030532387982594.
2026-05-18 17:57:06,738 - experiment_functions - INFO - Early stopping at epoch 900. Best Recall: 0.0559
2026-05-18 17:57:06,829 - optuna.study.study - INFO - Trial 81 finished with value: 0.05585490334852324 and parameters: {'n_layers': 1, 'embedding_dim': 96, 'lr': 0.0008022061494486022, 'lambda_val': 5.65469076168318e-06, 'batch_size': 1692, 'optimizer': 'RMSprop'}. Best is trial 21 with value: 0.07030532387982594.
2026-05-18 17:57:23,899 - optuna.study._optimize - INFO - Trial 82 pruned. 
2026-05-18 17:57:32,375 - experiment_functions - INFO - Early stopping at epoch 600. Best Recall: 0.0567
2026-05-18 17:57:32,465 - optuna.study.study - INFO - Trial 83 finished with value: 0.05669619618075132 and parameters: {'n_layers': 1, 'embedding_dim': 96, 'lr': 0.0021076356795075883, 'lambda_val': 1.338861534526765e-06, 'batch_size': 962, 'optimizer': 'RMSprop'}. Best is trial 21 with value: 0.07030532387982594.
2026-05-18 17:57:46,567 - experiment_functions - INFO - Early stopping at epoch 950. Best Recall: 0.0493
2026-05-18 17:57:46,664 - optuna.study.study - INFO - Trial 84 finished with value: 0.04930482950359237 and parameters: {'n_layers': 3, 'embedding_dim': 96, 'lr': 0.00040205204561576536, 'lambda_val': 3.783135597399433e-06, 'batch_size': 742, 'optimizer': 'RMSprop'}. Best is trial 21 with value: 0.07030532387982594.
2026-05-18 17:58:00,185 - optuna.study._optimize - INFO - Trial 85 pruned. 
2026-05-18 17:58:24,295 - experiment_functions - INFO - Early stopping at epoch 1100. Best Recall: 0.0705
2026-05-18 17:58:24,377 - optuna.study.study - INFO - Trial 86 finished with value: 0.0704995300424917 and parameters: {'n_layers': 1, 'embedding_dim': 64, 'lr': 0.0011850432922072458, 'lambda_val': 1.8226811357590353e-06, 'batch_size': 525, 'optimizer': 'RMSprop'}. Best is trial 86 with value: 0.0704995300424917.
2026-05-18 17:58:37,894 - optuna.study._optimize - INFO - Trial 87 pruned. 
2026-05-18 17:58:52,996 - experiment_functions - INFO - Early stopping at epoch 1100. Best Recall: 0.0650
2026-05-18 17:58:53,095 - optuna.study.study - INFO - Trial 88 finished with value: 0.0650317313903173 and parameters: {'n_layers': 1, 'embedding_dim': 64, 'lr': 0.0009467038012525729, 'lambda_val': 9.713816651876755e-06, 'batch_size': 832, 'optimizer': 'RMSprop'}. Best is trial 86 with value: 0.0704995300424917.
2026-05-18 17:59:03,451 - experiment_functions - INFO - Early stopping at epoch 750. Best Recall: 0.0588
2026-05-18 17:59:03,562 - optuna.study.study - INFO - Trial 89 finished with value: 0.058782619291149356 and parameters: {'n_layers': 1, 'embedding_dim': 64, 'lr': 0.0016295545946341137, 'lambda_val': 9.614610236652733e-06, 'batch_size': 727, 'optimizer': 'RMSprop'}. Best is trial 86 with value: 0.0704995300424917.
2026-05-18 17:59:18,309 - optuna.study._optimize - INFO - Trial 90 pruned. 
2026-05-18 17:59:33,658 - experiment_functions - INFO - Early stopping at epoch 1150. Best Recall: 0.0672
2026-05-18 17:59:33,747 - optuna.study.study - INFO - Trial 91 finished with value: 0.06719941464942192 and parameters: {'n_layers': 1, 'embedding_dim': 64, 'lr': 0.0007996226345669154, 'lambda_val': 3.5090125842518675e-05, 'batch_size': 1101, 'optimizer': 'RMSprop'}. Best is trial 86 with value: 0.0704995300424917.
2026-05-18 17:59:47,420 - experiment_functions - INFO - Early stopping at epoch 950. Best Recall: 0.0656
2026-05-18 17:59:47,554 - optuna.study.study - INFO - Trial 92 finished with value: 0.06563252297786365 and parameters: {'n_layers': 1, 'embedding_dim': 64, 'lr': 0.0010532951770346117, 'lambda_val': 1.190587737249802e-05, 'batch_size': 1081, 'optimizer': 'RMSprop'}. Best is trial 86 with value: 0.0704995300424917.
2026-05-18 17:59:58,253 - experiment_functions - INFO - Early stopping at epoch 750. Best Recall: 0.0576
2026-05-18 17:59:58,395 - optuna.study.study - INFO - Trial 93 finished with value: 0.05764445964005976 and parameters: {'n_layers': 1, 'embedding_dim': 64, 'lr': 0.0011978927302119038, 'lambda_val': 6.94649444029654e-05, 'batch_size': 1091, 'optimizer': 'RMSprop'}. Best is trial 86 with value: 0.0704995300424917.
2026-05-18 18:00:07,098 - experiment_functions - INFO - Early stopping at epoch 600. Best Recall: 0.0559
2026-05-18 18:00:07,189 - optuna.study.study - INFO - Trial 94 finished with value: 0.055893096577689705 and parameters: {'n_layers': 1, 'embedding_dim': 64, 'lr': 0.001850862565422368, 'lambda_val': 4.232299311846394e-05, 'batch_size': 1313, 'optimizer': 'RMSprop'}. Best is trial 86 with value: 0.0704995300424917.
2026-05-18 18:00:16,333 - experiment_functions - INFO - Early stopping at epoch 650. Best Recall: 0.0532
2026-05-18 18:00:16,435 - optuna.study.study - INFO - Trial 95 finished with value: 0.05319694641937808 and parameters: {'n_layers': 1, 'embedding_dim': 64, 'lr': 0.0010581402075735345, 'lambda_val': 3.090739509062581e-05, 'batch_size': 3079, 'optimizer': 'RMSprop'}. Best is trial 86 with value: 0.0704995300424917.
2026-05-18 18:00:26,412 - experiment_functions - INFO - Early stopping at epoch 700. Best Recall: 0.0557
2026-05-18 18:00:26,547 - optuna.study.study - INFO - Trial 96 finished with value: 0.05567331633063795 and parameters: {'n_layers': 1, 'embedding_dim': 64, 'lr': 0.0029403369360575093, 'lambda_val': 2.2084760088799485e-05, 'batch_size': 872, 'optimizer': 'Adam'}. Best is trial 86 with value: 0.0704995300424917.
2026-05-18 18:00:33,897 - experiment_functions - INFO - Early stopping at epoch 500. Best Recall: 0.0051
2026-05-18 18:00:33,998 - optuna.study.study - INFO - Trial 97 finished with value: 0.00508974592618142 and parameters: {'n_layers': 1, 'embedding_dim': 64, 'lr': 0.0005054675459651149, 'lambda_val': 1.1660008058541471e-05, 'batch_size': 557, 'optimizer': 'SGD'}. Best is trial 86 with value: 0.0704995300424917.
2026-05-18 18:00:50,929 - optuna.study._optimize - INFO - Trial 98 pruned. 
2026-05-18 18:01:06,503 - experiment_functions - INFO - Early stopping at epoch 1100. Best Recall: 0.0655
