2026-05-18 10:43:40,180 - optuna.study.study - INFO - Trial 7 finished with value: 0.04489239777068223 and parameters: {'n_layers': 4, 'embedding_dim': 128, 'lr': 0.020322400884614535, 'lambda_val': 1.480219201517516e-05, 'batch_size': 563, 'optimizer': 'RMSprop'}. Best is trial 4 with value: 0.08067839919821178.
2026-05-18 10:43:47,873 - experiment_functions - INFO - Early stopping at epoch 500. Best Recall: 0.0047
2026-05-18 10:43:47,981 - optuna.study.study - INFO - Trial 8 finished with value: 0.004705987446265009 and parameters: {'n_layers': 1, 'embedding_dim': 96, 'lr': 0.0005913374327557816, 'lambda_val': 0.00019546683732481798, 'batch_size': 2693, 'optimizer': 'SGD'}. Best is trial 4 with value: 0.08067839919821178.
2026-05-18 10:43:55,868 - experiment_functions - INFO - Early stopping at epoch 500. Best Recall: 0.0058
2026-05-18 10:43:56,218 - optuna.study.study - INFO - Trial 9 finished with value: 0.005819786704128453 and parameters: {'n_layers': 2, 'embedding_dim': 64, 'lr': 0.00011049406115032935, 'lambda_val': 4.762919392588513e-06, 'batch_size': 1414, 'optimizer': 'SGD'}. Best is trial 4 with value: 0.08067839919821178.
2026-05-18 10:44:05,382 - experiment_functions - INFO - Early stopping at epoch 550. Best Recall: 0.0730
2026-05-18 10:44:05,472 - optuna.study.study - INFO - Trial 10 finished with value: 0.07296016661455462 and parameters: {'n_layers': 1, 'embedding_dim': 256, 'lr': 0.00501963367259142, 'lambda_val': 1.1401018090557996e-06, 'batch_size': 3187, 'optimizer': 'Adam'}. Best is trial 4 with value: 0.08067839919821178.
2026-05-18 10:44:14,567 - experiment_functions - INFO - Early stopping at epoch 550. Best Recall: 0.0752
2026-05-18 10:44:14,665 - optuna.study.study - INFO - Trial 11 finished with value: 0.07518367119621518 and parameters: {'n_layers': 1, 'embedding_dim': 256, 'lr': 0.0052961979492777865, 'lambda_val': 1.2320608346987518e-06, 'batch_size': 3125, 'optimizer': 'Adam'}. Best is trial 4 with value: 0.08067839919821178.
2026-05-18 10:44:42,179 - experiment_functions - INFO - Early stopping at epoch 1150. Best Recall: 0.0545
2026-05-18 10:44:42,289 - optuna.study.study - INFO - Trial 12 finished with value: 0.05453536864737024 and parameters: {'n_layers': 2, 'embedding_dim': 256, 'lr': 0.006549159745468456, 'lambda_val': 2.22498869501069e-06, 'batch_size': 2988, 'optimizer': 'Adam'}. Best is trial 4 with value: 0.08067839919821178.
2026-05-18 10:44:57,203 - optuna.study._optimize - INFO - Trial 13 pruned. 
2026-05-18 10:45:06,465 - experiment_functions - INFO - Early stopping at epoch 550. Best Recall: 0.0546
2026-05-18 10:45:06,615 - optuna.study.study - INFO - Trial 14 finished with value: 0.05462369274745207 and parameters: {'n_layers': 2, 'embedding_dim': 128, 'lr': 0.0055955632102570145, 'lambda_val': 1.0583455296069832e-06, 'batch_size': 2176, 'optimizer': 'Adam'}. Best is trial 4 with value: 0.08067839919821178.
2026-05-18 10:45:20,986 - experiment_functions - INFO - Early stopping at epoch 900. Best Recall: 0.0757
2026-05-18 10:45:21,076 - optuna.study.study - INFO - Trial 15 finished with value: 0.07570598672974285 and parameters: {'n_layers': 1, 'embedding_dim': 256, 'lr': 0.0006033723525344046, 'lambda_val': 0.002091158743859896, 'batch_size': 2155, 'optimizer': 'Adam'}. Best is trial 4 with value: 0.08067839919821178.
2026-05-18 10:46:10,427 - experiment_functions - INFO - Early stopping at epoch 3400. Best Recall: 0.0808
2026-05-18 10:46:10,581 - optuna.study.study - INFO - Trial 16 finished with value: 0.08081597941439948 and parameters: {'n_layers': 1, 'embedding_dim': 96, 'lr': 0.00025041639235852175, 'lambda_val': 0.002008588981661745, 'batch_size': 1973, 'optimizer': 'Adam'}. Best is trial 16 with value: 0.08081597941439948.
2026-05-18 10:46:27,004 - optuna.study._optimize - INFO - Trial 17 pruned. 
2026-05-18 10:46:34,816 - experiment_functions - INFO - Early stopping at epoch 500. Best Recall: 0.0047
2026-05-18 10:46:34,906 - optuna.study.study - INFO - Trial 18 finished with value: 0.004719949784288939 and parameters: {'n_layers': 2, 'embedding_dim': 96, 'lr': 1.5009888950059403e-05, 'lambda_val': 0.014893270187727736, 'batch_size': 1818, 'optimizer': 'Adam'}. Best is trial 16 with value: 0.08081597941439948.
2026-05-18 10:46:48,620 - optuna.study._optimize - INFO - Trial 19 pruned. 
2026-05-18 10:47:04,626 - experiment_functions - INFO - Early stopping at epoch 1000. Best Recall: 0.0588
2026-05-18 10:47:04,772 - optuna.study.study - INFO - Trial 20 finished with value: 0.05875536669220213 and parameters: {'n_layers': 2, 'embedding_dim': 96, 'lr': 0.00035610400260823615, 'lambda_val': 6.725307006359551e-05, 'batch_size': 2535, 'optimizer': 'Adam'}. Best is trial 16 with value: 0.08081597941439948.
2026-05-18 10:47:18,671 - experiment_functions - INFO - Early stopping at epoch 850. Best Recall: 0.0744
2026-05-18 10:47:18,760 - optuna.study.study - INFO - Trial 21 finished with value: 0.07436624611350436 and parameters: {'n_layers': 1, 'embedding_dim': 256, 'lr': 0.0006153166075453102, 'lambda_val': 0.0023918359963037987, 'batch_size': 2112, 'optimizer': 'Adam'}. Best is trial 16 with value: 0.08081597941439948.
2026-05-18 10:48:07,789 - experiment_functions - INFO - Early stopping at epoch 3450. Best Recall: 0.0834
2026-05-18 10:48:07,879 - optuna.study.study - INFO - Trial 22 finished with value: 0.08336386393826255 and parameters: {'n_layers': 1, 'embedding_dim': 96, 'lr': 0.0002865186449347889, 'lambda_val': 0.0005273994642695142, 'batch_size': 1682, 'optimizer': 'Adam'}. Best is trial 22 with value: 0.08336386393826255.
2026-05-18 10:48:21,257 - optuna.study._optimize - INFO - Trial 23 pruned. 
2026-05-18 10:48:31,238 - experiment_functions - INFO - Early stopping at epoch 650. Best Recall: 0.0766
2026-05-18 10:48:31,337 - optuna.study.study - INFO - Trial 24 finished with value: 0.07663916955068402 and parameters: {'n_layers': 1, 'embedding_dim': 96, 'lr': 0.0019214684485408277, 'lambda_val': 0.008510034301840122, 'batch_size': 1095, 'optimizer': 'Adam'}. Best is trial 22 with value: 0.08336386393826255.
2026-05-18 10:48:45,812 - optuna.study._optimize - INFO - Trial 25 pruned. 
2026-05-18 10:48:54,746 - experiment_functions - INFO - Early stopping at epoch 600. Best Recall: 0.0780
2026-05-18 10:48:54,846 - optuna.study.study - INFO - Trial 26 finished with value: 0.07798722471739776 and parameters: {'n_layers': 1, 'embedding_dim': 128, 'lr': 0.002719861684322079, 'lambda_val': 7.874362703432812e-05, 'batch_size': 2434, 'optimizer': 'Adam'}. Best is trial 22 with value: 0.08336386393826255.
2026-05-18 10:49:09,157 - optuna.study._optimize - INFO - Trial 27 pruned. 
2026-05-18 10:49:35,117 - optuna.study._optimize - INFO - Trial 28 pruned. 
2026-05-18 10:49:43,414 - experiment_functions - INFO - Early stopping at epoch 500. Best Recall: 0.0050
2026-05-18 10:49:43,571 - optuna.study.study - INFO - Trial 29 finished with value: 0.0050120779838023965 and parameters: {'n_layers': 3, 'embedding_dim': 96, 'lr': 0.0001255896393416328, 'lambda_val': 0.02336123143417524, 'batch_size': 3557, 'optimizer': 'SGD'}. Best is trial 22 with value: 0.08336386393826255.
2026-05-18 10:49:53,379 - experiment_functions - INFO - Early stopping at epoch 600. Best Recall: 0.0687
2026-05-18 10:49:53,468 - optuna.study.study - INFO - Trial 30 finished with value: 0.06869748989270237 and parameters: {'n_layers': 1, 'embedding_dim': 96, 'lr': 0.0010078832082953562, 'lambda_val': 0.00011650811675965819, 'batch_size': 2891, 'optimizer': 'RMSprop'}. Best is trial 22 with value: 0.08336386393826255.
2026-05-18 10:50:02,609 - experiment_functions - INFO - Early stopping at epoch 600. Best Recall: 0.0769
2026-05-18 10:50:02,756 - optuna.study.study - INFO - Trial 31 finished with value: 0.07691392629687968 and parameters: {'n_layers': 1, 'embedding_dim': 128, 'lr': 0.002505277414489255, 'lambda_val': 3.741584215807936e-05, 'batch_size': 3295, 'optimizer': 'Adam'}. Best is trial 22 with value: 0.08336386393826255.
2026-05-18 10:50:11,040 - experiment_functions - INFO - Early stopping at epoch 550. Best Recall: 0.0654
2026-05-18 10:50:11,139 - optuna.study.study - INFO - Trial 32 finished with value: 0.06535147283623391 and parameters: {'n_layers': 1, 'embedding_dim': 128, 'lr': 0.011351357399476604, 'lambda_val': 7.966547089102133e-05, 'batch_size': 2349, 'optimizer': 'Adam'}. Best is trial 22 with value: 0.08336386393826255.
2026-05-18 10:50:20,423 - experiment_functions - INFO - Early stopping at epoch 600. Best Recall: 0.0701
2026-05-18 10:50:20,521 - optuna.study.study - INFO - Trial 33 finished with value: 0.07006767449140791 and parameters: {'n_layers': 1, 'embedding_dim': 128, 'lr': 0.0036722905499150106, 'lambda_val': 0.0005686591990000285, 'batch_size': 2409, 'optimizer': 'Adam'}. Best is trial 22 with value: 0.08336386393826255.
2026-05-18 10:50:32,063 - experiment_functions - INFO - Early stopping at epoch 750. Best Recall: 0.0768
2026-05-18 10:50:32,163 - optuna.study.study - INFO - Trial 34 finished with value: 0.07681506213139698 and parameters: {'n_layers': 1, 'embedding_dim': 32, 'lr': 0.001060134682212625, 'lambda_val': 7.789755456953805e-06, 'batch_size': 3829, 'optimizer': 'Adam'}. Best is trial 22 with value: 0.08336386393826255.
2026-05-18 10:50:54,482 - experiment_functions - INFO - Early stopping at epoch 850. Best Recall: 0.0621
2026-05-18 10:50:54,588 - optuna.study.study - INFO - Trial 35 finished with value: 0.06205728153519141 and parameters: {'n_layers': 2, 'embedding_dim': 64, 'lr': 0.00037114185251124635, 'lambda_val': 0.00026227541524319185, 'batch_size': 2772, 'optimizer': 'RMSprop'}. Best is trial 22 with value: 0.08336386393826255.
2026-05-18 10:51:02,830 - experiment_functions - INFO - Early stopping at epoch 550. Best Recall: 0.0403
2026-05-18 10:51:02,918 - optuna.study.study - INFO - Trial 36 finished with value: 0.0402684914608998 and parameters: {'n_layers': 1, 'embedding_dim': 128, 'lr': 0.012385354248346761, 'lambda_val': 0.003998369105793059, 'batch_size': 1647, 'optimizer': 'Adam'}. Best is trial 22 with value: 0.08336386393826255.
2026-05-18 10:51:18,133 - optuna.study._optimize - INFO - Trial 37 pruned. 
2026-05-18 10:51:25,857 - experiment_functions - INFO - Early stopping at epoch 500. Best Recall: 0.0049
2026-05-18 10:51:25,955 - optuna.study.study - INFO - Trial 38 finished with value: 0.004934877206224184 and parameters: {'n_layers': 3, 'embedding_dim': 32, 'lr': 0.001447575267672852, 'lambda_val': 1.1778742537872784e-05, 'batch_size': 3386, 'optimizer': 'SGD'}. Best is trial 22 with value: 0.08336386393826255.
2026-05-18 10:51:34,531 - experiment_functions - INFO - Early stopping at epoch 600. Best Recall: 0.0283
2026-05-18 10:51:34,641 - optuna.study.study - INFO - Trial 39 finished with value: 0.028272658437127104 and parameters: {'n_layers': 1, 'embedding_dim': 64, 'lr': 0.04078263085389836, 'lambda_val': 0.00012515926885863806, 'batch_size': 1979, 'optimizer': 'Adam'}. Best is trial 22 with value: 0.08336386393826255.
2026-05-18 10:51:43,855 - experiment_functions - INFO - Early stopping at epoch 500. Best Recall: 0.0056
2026-05-18 10:51:43,974 - optuna.study.study - INFO - Trial 40 finished with value: 0.005588472753281096 and parameters: {'n_layers': 4, 'embedding_dim': 128, 'lr': 0.010385300503430093, 'lambda_val': 0.0008633116045674978, 'batch_size': 3776, 'optimizer': 'SGD'}. Best is trial 22 with value: 0.08336386393826255.
2026-05-18 10:51:53,331 - experiment_functions - INFO - Early stopping at epoch 600. Best Recall: 0.0726
2026-05-18 10:51:53,431 - optuna.study.study - INFO - Trial 41 finished with value: 0.07264515864155742 and parameters: {'n_layers': 1, 'embedding_dim': 128, 'lr': 0.002930049645791663, 'lambda_val': 3.25972596351723e-05, 'batch_size': 3332, 'optimizer': 'Adam'}. Best is trial 22 with value: 0.08336386393826255.
2026-05-18 10:52:03,250 - experiment_functions - INFO - Early stopping at epoch 650. Best Recall: 0.0718
2026-05-18 10:52:03,329 - optuna.study.study - INFO - Trial 42 finished with value: 0.0717747896139529 and parameters: {'n_layers': 1, 'embedding_dim': 128, 'lr': 0.001798785901035093, 'lambda_val': 3.8992730881311434e-06, 'batch_size': 2551, 'optimizer': 'Adam'}. Best is trial 22 with value: 0.08336386393826255.
2026-05-18 10:52:15,293 - experiment_functions - INFO - Early stopping at epoch 800. Best Recall: 0.0702
2026-05-18 10:52:15,381 - optuna.study.study - INFO - Trial 43 finished with value: 0.07019650787767705 and parameters: {'n_layers': 1, 'embedding_dim': 128, 'lr': 0.0007537021305147638, 'lambda_val': 5.888332470923199e-05, 'batch_size': 3512, 'optimizer': 'Adam'}. Best is trial 22 with value: 0.08336386393826255.
2026-05-18 10:52:24,525 - experiment_functions - INFO - Early stopping at epoch 600. Best Recall: 0.0728
2026-05-18 10:52:24,635 - optuna.study.study - INFO - Trial 44 finished with value: 0.07278283700787339 and parameters: {'n_layers': 1, 'embedding_dim': 32, 'lr': 0.002528360113567565, 'lambda_val': 0.00021688718043108598, 'batch_size': 3915, 'optimizer': 'Adam'}. Best is trial 22 with value: 0.08336386393826255.
2026-05-18 10:52:40,769 - experiment_functions - INFO - Early stopping at epoch 1100. Best Recall: 0.0727
2026-05-18 10:52:40,867 - optuna.study.study - INFO - Trial 45 finished with value: 0.07267337956647713 and parameters: {'n_layers': 1, 'embedding_dim': 128, 'lr': 0.0003869409659152834, 'lambda_val': 2.5010230921133597e-05, 'batch_size': 3131, 'optimizer': 'RMSprop'}. Best is trial 22 with value: 0.08336386393826255.
2026-05-18 10:52:54,170 - optuna.study._optimize - INFO - Trial 46 pruned. 
2026-05-18 10:53:02,527 - experiment_functions - INFO - Early stopping at epoch 550. Best Recall: 0.0683
2026-05-18 10:53:02,628 - optuna.study.study - INFO - Trial 47 finished with value: 0.06825286678964732 and parameters: {'n_layers': 1, 'embedding_dim': 64, 'lr': 0.008011493354012736, 'lambda_val': 2.3727471975988597e-06, 'batch_size': 3679, 'optimizer': 'Adam'}. Best is trial 22 with value: 0.08336386393826255.
2026-05-18 10:53:11,403 - experiment_functions - INFO - Early stopping at epoch 550. Best Recall: 0.0609
2026-05-18 10:53:11,492 - optuna.study.study - INFO - Trial 48 finished with value: 0.06090564633277827 and parameters: {'n_layers': 2, 'embedding_dim': 128, 'lr': 0.004051849750141124, 'lambda_val': 0.00012689828261668742, 'batch_size': 3254, 'optimizer': 'Adam'}. Best is trial 22 with value: 0.08336386393826255.
2026-05-18 10:53:18,441 - experiment_functions - INFO - Early stopping at epoch 500. Best Recall: 0.0052
2026-05-18 10:53:18,530 - optuna.study.study - INFO - Trial 49 finished with value: 0.00522374538811917 and parameters: {'n_layers': 1, 'embedding_dim': 96, 'lr': 8.070732976480204e-05, 'lambda_val': 0.00036814286750388433, 'batch_size': 1749, 'optimizer': 'SGD'}. Best is trial 22 with value: 0.08336386393826255.
2026-05-18 10:53:27,977 - experiment_functions - INFO - Early stopping at epoch 650. Best Recall: 0.0385
2026-05-18 10:53:28,079 - optuna.study.study - INFO - Trial 50 finished with value: 0.03845919649211605 and parameters: {'n_layers': 1, 'embedding_dim': 128, 'lr': 0.022361800853453375, 'lambda_val': 4.8202087735012496e-05, 'batch_size': 1355, 'optimizer': 'Adam'}. Best is trial 22 with value: 0.08336386393826255.
2026-05-18 10:53:38,703 - experiment_functions - INFO - Early stopping at epoch 700. Best Recall: 0.0699
2026-05-18 10:53:38,808 - optuna.study.study - INFO - Trial 51 finished with value: 0.06994063257937563 and parameters: {'n_layers': 1, 'embedding_dim': 32, 'lr': 0.0011007245871627416, 'lambda_val': 9.051278530098769e-06, 'batch_size': 3902, 'optimizer': 'Adam'}. Best is trial 22 with value: 0.08336386393826255.
2026-05-18 10:53:51,512 - experiment_functions - INFO - Early stopping at epoch 850. Best Recall: 0.0736
2026-05-18 10:53:51,638 - optuna.study.study - INFO - Trial 52 finished with value: 0.07359398792357318 and parameters: {'n_layers': 1, 'embedding_dim': 32, 'lr': 0.0008153092381487886, 'lambda_val': 4.935595206681836e-06, 'batch_size': 3614, 'optimizer': 'Adam'}. Best is trial 22 with value: 0.08336386393826255.
2026-05-18 10:54:02,204 - experiment_functions - INFO - Early stopping at epoch 700. Best Recall: 0.0742
2026-05-18 10:54:02,298 - optuna.study.study - INFO - Trial 53 finished with value: 0.07422905818316322 and parameters: {'n_layers': 1, 'embedding_dim': 32, 'lr': 0.0013581843354199792, 'lambda_val': 9.793718169411584e-06, 'batch_size': 3843, 'optimizer': 'Adam'}. Best is trial 22 with value: 0.08336386393826255.
2026-05-18 10:54:19,171 - experiment_functions - INFO - Early stopping at epoch 1200. Best Recall: 0.0762
2026-05-18 10:54:19,263 - optuna.study.study - INFO - Trial 54 finished with value: 0.07624865304984092 and parameters: {'n_layers': 1, 'embedding_dim': 32, 'lr': 0.0005493360868687622, 'lambda_val': 8.307922415669705e-06, 'batch_size': 2061, 'optimizer': 'Adam'}. Best is trial 22 with value: 0.08336386393826255.
2026-05-18 10:54:28,117 - experiment_functions - INFO - Early stopping at epoch 550. Best Recall: 0.0794
2026-05-18 10:54:28,226 - optuna.study.study - INFO - Trial 55 finished with value: 0.07937864090179843 and parameters: {'n_layers': 1, 'embedding_dim': 256, 'lr': 0.0043676436377025575, 'lambda_val': 2.9748115056478383e-06, 'batch_size': 3398, 'optimizer': 'Adam'}. Best is trial 22 with value: 0.08336386393826255.
2026-05-18 10:54:46,637 - optuna.study._optimize - INFO - Trial 56 pruned. 
2026-05-18 10:54:55,834 - experiment_functions - INFO - Early stopping at epoch 550. Best Recall: 0.0791
2026-05-18 10:54:55,949 - optuna.study.study - INFO - Trial 57 finished with value: 0.07909347584934001 and parameters: {'n_layers': 1, 'embedding_dim': 256, 'lr': 0.004180164894699799, 'lambda_val': 2.988036467822602e-06, 'batch_size': 2627, 'optimizer': 'Adam'}. Best is trial 22 with value: 0.08336386393826255.
2026-05-18 10:55:05,572 - experiment_functions - INFO - Early stopping at epoch 600. Best Recall: 0.0492
2026-05-18 10:55:05,675 - optuna.study.study - INFO - Trial 58 finished with value: 0.04918808271263084 and parameters: {'n_layers': 1, 'embedding_dim': 256, 'lr': 0.017051913992737346, 'lambda_val': 2.9568047156149083e-06, 'batch_size': 2196, 'optimizer': 'Adam'}. Best is trial 22 with value: 0.08336386393826255.
2026-05-18 10:55:23,502 - optuna.study._optimize - INFO - Trial 59 pruned. 
2026-05-18 10:55:36,212 - experiment_functions - INFO - Early stopping at epoch 850. Best Recall: 0.0061
2026-05-18 10:55:36,307 - optuna.study.study - INFO - Trial 60 finished with value: 0.006091457730982084 and parameters: {'n_layers': 1, 'embedding_dim': 256, 'lr': 1.0304769434203353e-05, 'lambda_val': 0.0015354701174711397, 'batch_size': 2599, 'optimizer': 'Adam'}. Best is trial 22 with value: 0.08336386393826255.
2026-05-18 10:55:46,505 - experiment_functions - INFO - Early stopping at epoch 600. Best Recall: 0.0801
2026-05-18 10:55:46,608 - optuna.study.study - INFO - Trial 61 finished with value: 0.08012907780877518 and parameters: {'n_layers': 1, 'embedding_dim': 256, 'lr': 0.0020960535447292652, 'lambda_val': 1.9136366239918158e-05, 'batch_size': 3408, 'optimizer': 'Adam'}. Best is trial 22 with value: 0.08336386393826255.
2026-05-18 10:55:56,221 - experiment_functions - INFO - Early stopping at epoch 600. Best Recall: 0.0737
2026-05-18 10:55:56,359 - optuna.study.study - INFO - Trial 62 finished with value: 0.07374488182951788 and parameters: {'n_layers': 1, 'embedding_dim': 256, 'lr': 0.0019939167495448052, 'lambda_val': 5.901382032164849e-06, 'batch_size': 2264, 'optimizer': 'Adam'}. Best is trial 22 with value: 0.08336386393826255.
2026-05-18 10:56:05,266 - experiment_functions - INFO - Early stopping at epoch 550. Best Recall: 0.0729
2026-05-18 10:56:05,370 - optuna.study.study - INFO - Trial 63 finished with value: 0.07287804912265143 and parameters: {'n_layers': 1, 'embedding_dim': 256, 'lr': 0.007788537536694556, 'lambda_val': 2.019369487764676e-05, 'batch_size': 3019, 'optimizer': 'Adam'}. Best is trial 22 with value: 0.08336386393826255.
2026-05-18 10:56:33,862 - optuna.study._optimize - INFO - Trial 64 pruned. 
2026-05-18 10:56:44,689 - experiment_functions - INFO - Early stopping at epoch 550. Best Recall: 0.0840
2026-05-18 10:56:44,797 - optuna.study.study - INFO - Trial 65 finished with value: 0.08395096205355591 and parameters: {'n_layers': 1, 'embedding_dim': 256, 'lr': 0.005106464947722236, 'lambda_val': 6.200930579894666e-06, 'batch_size': 3380, 'optimizer': 'Adam'}. Best is trial 65 with value: 0.08395096205355591.
2026-05-18 10:57:00,217 - experiment_functions - INFO - Early stopping at epoch 550. Best Recall: 0.0383
2026-05-18 10:57:00,366 - optuna.study.study - INFO - Trial 66 finished with value: 0.03827191506669128 and parameters: {'n_layers': 1, 'embedding_dim': 256, 'lr': 0.03700829455309751, 'lambda_val': 1.8252321241791453e-06, 'batch_size': 4074, 'optimizer': 'Adam'}. Best is trial 65 with value: 0.08395096205355591.
2026-05-18 10:57:22,774 - experiment_functions - INFO - Early stopping at epoch 850. Best Recall: 0.0743
2026-05-18 10:57:22,856 - optuna.study.study - INFO - Trial 67 finished with value: 0.07434437409231663 and parameters: {'n_layers': 1, 'embedding_dim': 256, 'lr': 0.005316434540339004, 'lambda_val': 2.964454782744423e-06, 'batch_size': 3699, 'optimizer': 'Adam'}. Best is trial 65 with value: 0.08395096205355591.
2026-05-18 10:57:40,095 - experiment_functions - INFO - Early stopping at epoch 500. Best Recall: 0.0049
2026-05-18 10:57:40,243 - optuna.study.study - INFO - Trial 68 finished with value: 0.004947064691208358 and parameters: {'n_layers': 1, 'embedding_dim': 256, 'lr': 0.003615988651985989, 'lambda_val': 6.481874897130288e-06, 'batch_size': 3416, 'optimizer': 'SGD'}. Best is trial 65 with value: 0.08395096205355591.
