2026-05-17 20:41:37,372 - optuna.study._optimize - INFO - Trial 293 pruned. 
2026-05-17 20:41:49,535 - experiment_functions - INFO - Early stopping at epoch 750. Best Recall: 0.0743
2026-05-17 20:41:49,627 - optuna.study.study - INFO - Trial 294 finished with value: 0.0743259309991672 and parameters: {'n_layers': 1, 'embedding_dim': 64, 'lr': 0.00118285162913497, 'lambda_val': 1.0091308405796942e-06, 'batch_size': 694, 'optimizer': 'RMSprop'}. Best is trial 150 with value: 0.09943758933682462.
2026-05-17 20:42:05,069 - optuna.study._optimize - INFO - Trial 295 pruned. 
2026-05-17 20:42:21,015 - optuna.study._optimize - INFO - Trial 296 pruned. 
2026-05-17 20:42:37,279 - experiment_functions - INFO - Early stopping at epoch 950. Best Recall: 0.0778
2026-05-17 20:42:37,396 - optuna.study.study - INFO - Trial 297 finished with value: 0.0777524967395173 and parameters: {'n_layers': 1, 'embedding_dim': 96, 'lr': 0.000896705587425347, 'lambda_val': 2.477885634930721e-06, 'batch_size': 649, 'optimizer': 'RMSprop'}. Best is trial 150 with value: 0.09943758933682462.
2026-05-17 20:42:53,924 - optuna.study._optimize - INFO - Trial 298 pruned. 
2026-05-17 20:43:17,949 - experiment_functions - INFO - Early stopping at epoch 1550. Best Recall: 0.0948
2026-05-17 20:43:18,041 - optuna.study.study - INFO - Trial 299 finished with value: 0.09480263157993918 and parameters: {'n_layers': 1, 'embedding_dim': 64, 'lr': 0.0006938810239611639, 'lambda_val': 1.221453036747758e-06, 'batch_size': 771, 'optimizer': 'RMSprop'}. Best is trial 150 with value: 0.09943758933682462.
2026-05-17 20:43:50,089 - experiment_functions - INFO - Early stopping at epoch 2500. Best Recall: 0.0968
2026-05-17 20:43:51,035 - root - INFO - **** Training e_1M_1c1dcs
2026-05-17 20:43:51,035 - root - INFO -   ** 1-Dominant stats:
2026-05-17 20:43:51,035 - root - INFO -   ** Finding the dominant set:
2026-05-17 21:25:01,294 - root - INFO -   ** Getting the trainable edges:
2026-05-17 21:25:01,309 - helper_functions - INFO -      Number of nodes: 4740
2026-05-17 21:25:01,309 - helper_functions - INFO -      Ratio: 0.4863533757438949
2026-05-17 21:25:01,309 - helper_functions - INFO -      Number of unique users: 3156
2026-05-17 21:25:01,309 - helper_functions - INFO -      Number of unique items: 1584
2026-05-17 21:25:01,309 - helper_functions - INFO -      Total dominant set edge: 14614
2026-05-17 21:25:01,310 - helper_functions - INFO -      Trainable edges: 11691.2
2026-05-17 21:25:01,351 - root - INFO -   **** Getting 14614 dominant set edges
2026-05-17 21:25:01,472 - optuna.storages._rdb.storage - INFO - A new study created in RDB with name: Study_e_1M_1c1dcs_strict
2026-05-17 21:25:08,664 - experiment_functions - INFO - Early stopping at epoch 500. Best Recall: 0.0047
2026-05-17 21:25:08,770 - optuna.study.study - INFO - Trial 0 finished with value: 0.00473061877631465 and parameters: {'n_layers': 2, 'embedding_dim': 256, 'lr': 0.01392975189046524, 'lambda_val': 0.00010579419427182262, 'batch_size': 1463, 'optimizer': 'SGD'}. Best is trial 0 with value: 0.00473061877631465.
2026-05-17 21:25:16,559 - experiment_functions - INFO - Early stopping at epoch 600. Best Recall: 0.0212
2026-05-17 21:25:16,652 - optuna.study.study - INFO - Trial 1 finished with value: 0.02122341497472757 and parameters: {'n_layers': 2, 'embedding_dim': 32, 'lr': 0.00110006667905287, 'lambda_val': 1.293029380867827e-05, 'batch_size': 787, 'optimizer': 'RMSprop'}. Best is trial 1 with value: 0.02122341497472757.
2026-05-17 21:25:24,000 - experiment_functions - INFO - Early stopping at epoch 500. Best Recall: 0.0053
2026-05-17 21:25:24,090 - optuna.study.study - INFO - Trial 2 finished with value: 0.005308794972197307 and parameters: {'n_layers': 3, 'embedding_dim': 64, 'lr': 0.0001364693367706237, 'lambda_val': 0.01986896204693618, 'batch_size': 3621, 'optimizer': 'SGD'}. Best is trial 1 with value: 0.02122341497472757.
2026-05-17 21:25:31,204 - experiment_functions - INFO - Early stopping at epoch 500. Best Recall: 0.0051
2026-05-17 21:25:31,348 - optuna.study.study - INFO - Trial 3 finished with value: 0.005092036051385703 and parameters: {'n_layers': 2, 'embedding_dim': 128, 'lr': 0.01580257921436224, 'lambda_val': 0.00017666969654278283, 'batch_size': 4090, 'optimizer': 'Adam'}. Best is trial 1 with value: 0.02122341497472757.
2026-05-17 21:25:39,234 - experiment_functions - INFO - Early stopping at epoch 500. Best Recall: 0.0051
2026-05-17 21:25:39,393 - optuna.study.study - INFO - Trial 4 finished with value: 0.005092366055429734 and parameters: {'n_layers': 4, 'embedding_dim': 96, 'lr': 0.004865420512720702, 'lambda_val': 0.025119211785717296, 'batch_size': 1503, 'optimizer': 'SGD'}. Best is trial 1 with value: 0.02122341497472757.
2026-05-17 21:25:46,363 - experiment_functions - INFO - Early stopping at epoch 500. Best Recall: 0.0052
2026-05-17 21:25:46,460 - optuna.study.study - INFO - Trial 5 finished with value: 0.005209374752942042 and parameters: {'n_layers': 1, 'embedding_dim': 96, 'lr': 0.00031390177551454565, 'lambda_val': 0.025243117375177895, 'batch_size': 1577, 'optimizer': 'SGD'}. Best is trial 1 with value: 0.02122341497472757.
2026-05-17 21:26:04,091 - experiment_functions - INFO - Early stopping at epoch 500. Best Recall: 0.0053
2026-05-17 21:26:04,276 - optuna.study.study - INFO - Trial 6 finished with value: 0.005254258272731288 and parameters: {'n_layers': 2, 'embedding_dim': 256, 'lr': 0.0005768527812434053, 'lambda_val': 0.07294910430146716, 'batch_size': 2234, 'optimizer': 'RMSprop'}. Best is trial 1 with value: 0.02122341497472757.
2026-05-17 21:26:12,118 - experiment_functions - INFO - Early stopping at epoch 500. Best Recall: 0.0053
2026-05-17 21:26:12,264 - optuna.study.study - INFO - Trial 7 finished with value: 0.005300948425012921 and parameters: {'n_layers': 3, 'embedding_dim': 256, 'lr': 0.00029822964176587987, 'lambda_val': 0.009763018601496741, 'batch_size': 2996, 'optimizer': 'RMSprop'}. Best is trial 1 with value: 0.02122341497472757.
2026-05-17 21:27:00,274 - optuna.study.study - INFO - Trial 8 finished with value: 0.018676584107647845 and parameters: {'n_layers': 1, 'embedding_dim': 96, 'lr': 7.910583390641371e-05, 'lambda_val': 0.010994017593370887, 'batch_size': 1528, 'optimizer': 'RMSprop'}. Best is trial 1 with value: 0.02122341497472757.
2026-05-17 21:27:09,257 - experiment_functions - INFO - Early stopping at epoch 650. Best Recall: 0.0139
2026-05-17 21:27:09,401 - optuna.study.study - INFO - Trial 9 finished with value: 0.01388673205743475 and parameters: {'n_layers': 2, 'embedding_dim': 64, 'lr': 0.00037313255771462316, 'lambda_val': 0.005708868464696612, 'batch_size': 3081, 'optimizer': 'RMSprop'}. Best is trial 1 with value: 0.02122341497472757.
2026-05-17 21:27:18,260 - experiment_functions - INFO - Early stopping at epoch 650. Best Recall: 0.0051
2026-05-17 21:27:18,430 - optuna.study.study - INFO - Trial 10 finished with value: 0.005131037714602091 and parameters: {'n_layers': 4, 'embedding_dim': 32, 'lr': 1.0562754293675702e-05, 'lambda_val': 1.3489172955974588e-06, 'batch_size': 540, 'optimizer': 'Adam'}. Best is trial 1 with value: 0.02122341497472757.
2026-05-17 21:27:27,299 - experiment_functions - INFO - Early stopping at epoch 700. Best Recall: 0.0049
2026-05-17 21:27:27,422 - optuna.study.study - INFO - Trial 11 finished with value: 0.004916137548658294 and parameters: {'n_layers': 1, 'embedding_dim': 32, 'lr': 1.743020469507089e-05, 'lambda_val': 1.2969291198592883e-05, 'batch_size': 694, 'optimizer': 'RMSprop'}. Best is trial 1 with value: 0.02122341497472757.
2026-05-17 21:27:34,860 - experiment_functions - INFO - Early stopping at epoch 550. Best Recall: 0.0145
2026-05-17 21:27:34,961 - optuna.study.study - INFO - Trial 12 finished with value: 0.01449658409198598 and parameters: {'n_layers': 1, 'embedding_dim': 32, 'lr': 0.0023929581020121628, 'lambda_val': 0.0015833987365192928, 'batch_size': 1133, 'optimizer': 'RMSprop'}. Best is trial 1 with value: 0.02122341497472757.
2026-05-17 21:27:47,642 - optuna.study._optimize - INFO - Trial 13 pruned. 
2026-05-17 21:27:54,835 - experiment_functions - INFO - Early stopping at epoch 500. Best Recall: 0.0065
2026-05-17 21:27:54,936 - optuna.study.study - INFO - Trial 14 finished with value: 0.00646015869447657 and parameters: {'n_layers': 3, 'embedding_dim': 128, 'lr': 0.08595992925704495, 'lambda_val': 0.0012948380960568532, 'batch_size': 954, 'optimizer': 'RMSprop'}. Best is trial 1 with value: 0.02122341497472757.
2026-05-17 21:28:08,283 - optuna.study._optimize - INFO - Trial 15 pruned. 
2026-05-17 21:28:15,790 - experiment_functions - INFO - Early stopping at epoch 550. Best Recall: 0.0074
2026-05-17 21:28:15,890 - optuna.study.study - INFO - Trial 16 finished with value: 0.007403011857130694 and parameters: {'n_layers': 2, 'embedding_dim': 32, 'lr': 0.0014083582522165918, 'lambda_val': 0.0007400821629152183, 'batch_size': 2686, 'optimizer': 'RMSprop'}. Best is trial 1 with value: 0.02122341497472757.
2026-05-17 21:28:32,771 - optuna.study._optimize - INFO - Trial 17 pruned. 
2026-05-17 21:28:40,262 - experiment_functions - INFO - Early stopping at epoch 500. Best Recall: 0.0052
2026-05-17 21:28:40,363 - optuna.study.study - INFO - Trial 18 finished with value: 0.00523442141055466 and parameters: {'n_layers': 2, 'embedding_dim': 32, 'lr': 0.004008131551773401, 'lambda_val': 6.399488167779275e-06, 'batch_size': 1259, 'optimizer': 'RMSprop'}. Best is trial 1 with value: 0.02122341497472757.
2026-05-17 21:28:48,860 - experiment_functions - INFO - Early stopping at epoch 600. Best Recall: 0.0109
2026-05-17 21:28:48,957 - optuna.study.study - INFO - Trial 19 finished with value: 0.010882657711638282 and parameters: {'n_layers': 3, 'embedding_dim': 64, 'lr': 0.0010695887728065553, 'lambda_val': 0.00039129480751005664, 'batch_size': 2489, 'optimizer': 'Adam'}. Best is trial 1 with value: 0.02122341497472757.
2026-05-17 21:28:56,287 - experiment_functions - INFO - Early stopping at epoch 500. Best Recall: 0.0051
2026-05-17 21:28:56,398 - optuna.study.study - INFO - Trial 20 finished with value: 0.005089243134037553 and parameters: {'n_layers': 1, 'embedding_dim': 128, 'lr': 2.4389813835870253e-05, 'lambda_val': 0.0034188583231456473, 'batch_size': 1760, 'optimizer': 'RMSprop'}. Best is trial 1 with value: 0.02122341497472757.
2026-05-17 21:29:04,124 - experiment_functions - INFO - Early stopping at epoch 550. Best Recall: 0.0103
2026-05-17 21:29:04,260 - optuna.study.study - INFO - Trial 21 finished with value: 0.01025787529307326 and parameters: {'n_layers': 1, 'embedding_dim': 32, 'lr': 0.002476640567743956, 'lambda_val': 0.0018575591255132126, 'batch_size': 1053, 'optimizer': 'RMSprop'}. Best is trial 1 with value: 0.02122341497472757.
2026-05-17 21:29:11,547 - experiment_functions - INFO - Early stopping at epoch 500. Best Recall: 0.0040
2026-05-17 21:29:11,638 - optuna.study.study - INFO - Trial 22 finished with value: 0.003973590353184633 and parameters: {'n_layers': 1, 'embedding_dim': 32, 'lr': 0.007241346748572445, 'lambda_val': 7.572820215820003e-05, 'batch_size': 763, 'optimizer': 'RMSprop'}. Best is trial 1 with value: 0.02122341497472757.
2026-05-17 21:29:18,943 - experiment_functions - INFO - Early stopping at epoch 550. Best Recall: 0.0119
2026-05-17 21:29:19,030 - optuna.study.study - INFO - Trial 23 finished with value: 0.011919055001088622 and parameters: {'n_layers': 2, 'embedding_dim': 32, 'lr': 0.0017033582475746848, 'lambda_val': 0.0003703507403274779, 'batch_size': 1231, 'optimizer': 'RMSprop'}. Best is trial 1 with value: 0.02122341497472757.
2026-05-17 21:29:26,153 - experiment_functions - INFO - Early stopping at epoch 500. Best Recall: 0.0050
2026-05-17 21:29:26,277 - optuna.study.study - INFO - Trial 24 finished with value: 0.004953452812673805 and parameters: {'n_layers': 1, 'embedding_dim': 32, 'lr': 0.00014710765642937863, 'lambda_val': 0.09591733929497409, 'batch_size': 1915, 'optimizer': 'RMSprop'}. Best is trial 1 with value: 0.02122341497472757.
2026-05-17 21:29:33,982 - experiment_functions - INFO - Early stopping at epoch 550. Best Recall: 0.0157
2026-05-17 21:29:34,082 - optuna.study.study - INFO - Trial 25 finished with value: 0.015730686601001614 and parameters: {'n_layers': 2, 'embedding_dim': 96, 'lr': 0.000660531476309279, 'lambda_val': 0.0025284609149390574, 'batch_size': 1264, 'optimizer': 'RMSprop'}. Best is trial 1 with value: 0.02122341497472757.
2026-05-17 21:29:42,090 - experiment_functions - INFO - Early stopping at epoch 550. Best Recall: 0.0153
2026-05-17 21:29:42,210 - optuna.study.study - INFO - Trial 26 finished with value: 0.015297684827946563 and parameters: {'n_layers': 2, 'embedding_dim': 96, 'lr': 0.0006543447488542974, 'lambda_val': 0.009116109830606171, 'batch_size': 539, 'optimizer': 'RMSprop'}. Best is trial 1 with value: 0.02122341497472757.
2026-05-17 21:29:56,258 - experiment_functions - INFO - Early stopping at epoch 1050. Best Recall: 0.0131
2026-05-17 21:29:56,359 - optuna.study.study - INFO - Trial 27 finished with value: 0.01314327783861131 and parameters: {'n_layers': 3, 'embedding_dim': 96, 'lr': 0.00016916315629335373, 'lambda_val': 0.004075085081463778, 'batch_size': 1472, 'optimizer': 'RMSprop'}. Best is trial 1 with value: 0.02122341497472757.
2026-05-17 21:30:03,309 - experiment_functions - INFO - Early stopping at epoch 500. Best Recall: 0.0054
2026-05-17 21:30:03,399 - optuna.study.study - INFO - Trial 28 finished with value: 0.005386564663075375 and parameters: {'n_layers': 2, 'embedding_dim': 96, 'lr': 3.3875013659183875e-05, 'lambda_val': 4.613040910514838e-06, 'batch_size': 866, 'optimizer': 'SGD'}. Best is trial 1 with value: 0.02122341497472757.
2026-05-17 21:30:10,702 - experiment_functions - INFO - Early stopping at epoch 500. Best Recall: 0.0047
2026-05-17 21:30:10,790 - optuna.study.study - INFO - Trial 29 finished with value: 0.004729264386382962 and parameters: {'n_layers': 2, 'embedding_dim': 256, 'lr': 0.01660393449872733, 'lambda_val': 0.000577864256728017, 'batch_size': 1682, 'optimizer': 'Adam'}. Best is trial 1 with value: 0.02122341497472757.
2026-05-17 21:30:18,189 - experiment_functions - INFO - Early stopping at epoch 500. Best Recall: 0.0048
2026-05-17 21:30:18,280 - optuna.study.study - INFO - Trial 30 finished with value: 0.00480713209576963 and parameters: {'n_layers': 3, 'embedding_dim': 96, 'lr': 0.000694119226936082, 'lambda_val': 0.00020521088542425713, 'batch_size': 1269, 'optimizer': 'SGD'}. Best is trial 1 with value: 0.02122341497472757.
2026-05-17 21:30:25,559 - experiment_functions - INFO - Early stopping at epoch 550. Best Recall: 0.0167
2026-05-17 21:30:25,650 - optuna.study.study - INFO - Trial 31 finished with value: 0.01669799253645087 and parameters: {'n_layers': 2, 'embedding_dim': 96, 'lr': 0.0005330586466366599, 'lambda_val': 0.010647438075411606, 'batch_size': 541, 'optimizer': 'RMSprop'}. Best is trial 1 with value: 0.02122341497472757.
2026-05-17 21:30:32,527 - experiment_functions - INFO - Early stopping at epoch 500. Best Recall: 0.0052
2026-05-17 21:30:32,624 - optuna.study.study - INFO - Trial 32 finished with value: 0.0051861664259542474 and parameters: {'n_layers': 2, 'embedding_dim': 96, 'lr': 0.00022938138845741128, 'lambda_val': 0.038695812387757385, 'batch_size': 766, 'optimizer': 'RMSprop'}. Best is trial 1 with value: 0.02122341497472757.
2026-05-17 21:30:48,175 - optuna.study._optimize - INFO - Trial 33 pruned. 
2026-05-17 21:30:56,998 - experiment_functions - INFO - Early stopping at epoch 650. Best Recall: 0.0245
2026-05-17 21:30:57,088 - optuna.study.study - INFO - Trial 34 finished with value: 0.024496273194529624 and parameters: {'n_layers': 2, 'embedding_dim': 96, 'lr': 0.0005122017355961064, 'lambda_val': 0.002729254236077741, 'batch_size': 616, 'optimizer': 'RMSprop'}. Best is trial 34 with value: 0.024496273194529624.
2026-05-17 21:31:04,323 - experiment_functions - INFO - Early stopping at epoch 500. Best Recall: 0.0047
2026-05-17 21:31:04,421 - optuna.study.study - INFO - Trial 35 finished with value: 0.004732106757725841 and parameters: {'n_layers': 4, 'embedding_dim': 64, 'lr': 0.0004160701798421338, 'lambda_val': 0.015186696995540263, 'batch_size': 564, 'optimizer': 'SGD'}. Best is trial 34 with value: 0.024496273194529624.
2026-05-17 21:31:11,309 - experiment_functions - INFO - Early stopping at epoch 500. Best Recall: 0.0020
2026-05-17 21:31:11,419 - optuna.study.study - INFO - Trial 36 finished with value: 0.0020167599060855372 and parameters: {'n_layers': 2, 'embedding_dim': 128, 'lr': 0.0077557810339988695, 'lambda_val': 0.03157334618472501, 'batch_size': 855, 'optimizer': 'RMSprop'}. Best is trial 34 with value: 0.024496273194529624.
2026-05-17 21:31:19,023 - experiment_functions - INFO - Early stopping at epoch 500. Best Recall: 0.0053
2026-05-17 21:31:19,532 - optuna.study.study - INFO - Trial 37 finished with value: 0.0053260568650362146 and parameters: {'n_layers': 3, 'embedding_dim': 96, 'lr': 0.00011694376409225589, 'lambda_val': 0.005554597521022538, 'batch_size': 3996, 'optimizer': 'SGD'}. Best is trial 34 with value: 0.024496273194529624.
2026-05-17 21:31:26,921 - experiment_functions - INFO - Early stopping at epoch 500. Best Recall: 0.0052
2026-05-17 21:31:27,011 - optuna.study.study - INFO - Trial 38 finished with value: 0.005240059659700853 and parameters: {'n_layers': 2, 'embedding_dim': 256, 'lr': 0.0002317127754389396, 'lambda_val': 0.052134349306853775, 'batch_size': 944, 'optimizer': 'RMSprop'}. Best is trial 34 with value: 0.024496273194529624.
2026-05-17 21:31:35,532 - experiment_functions - INFO - Early stopping at epoch 600. Best Recall: 0.0199
2026-05-17 21:31:35,632 - optuna.study.study - INFO - Trial 39 finished with value: 0.019926154942042126 and parameters: {'n_layers': 3, 'embedding_dim': 96, 'lr': 0.0009686033225254235, 'lambda_val': 0.00012106210304519458, 'batch_size': 660, 'optimizer': 'Adam'}. Best is trial 34 with value: 0.024496273194529624.
2026-05-17 21:31:43,947 - experiment_functions - INFO - Early stopping at epoch 600. Best Recall: 0.0141
2026-05-17 21:31:44,059 - optuna.study.study - INFO - Trial 40 finished with value: 0.014122509700791406 and parameters: {'n_layers': 3, 'embedding_dim': 64, 'lr': 0.0010419470505553983, 'lambda_val': 7.598188184132119e-05, 'batch_size': 1451, 'optimizer': 'Adam'}. Best is trial 34 with value: 0.024496273194529624.
2026-05-17 21:31:55,654 - experiment_functions - INFO - Early stopping at epoch 800. Best Recall: 0.0197
2026-05-17 21:31:55,744 - optuna.study.study - INFO - Trial 41 finished with value: 0.019749784916051123 and parameters: {'n_layers': 3, 'embedding_dim': 96, 'lr': 0.00045038145466577885, 'lambda_val': 0.0001285438148180461, 'batch_size': 669, 'optimizer': 'Adam'}. Best is trial 34 with value: 0.024496273194529624.
2026-05-17 21:32:03,593 - experiment_functions - INFO - Early stopping at epoch 550. Best Recall: 0.0188
2026-05-17 21:32:03,685 - optuna.study.study - INFO - Trial 42 finished with value: 0.01875897075256529 and parameters: {'n_layers': 4, 'embedding_dim': 96, 'lr': 0.0021385156569637947, 'lambda_val': 0.00015554574698280942, 'batch_size': 722, 'optimizer': 'Adam'}. Best is trial 34 with value: 0.024496273194529624.
2026-05-17 21:32:11,760 - experiment_functions - INFO - Early stopping at epoch 550. Best Recall: 0.0101
2026-05-17 21:32:11,860 - optuna.study.study - INFO - Trial 43 finished with value: 0.01011413632177391 and parameters: {'n_layers': 4, 'embedding_dim': 96, 'lr': 0.0028648909900745247, 'lambda_val': 0.0001587790238372797, 'batch_size': 702, 'optimizer': 'Adam'}. Best is trial 34 with value: 0.024496273194529624.
2026-05-17 21:32:20,544 - experiment_functions - INFO - Early stopping at epoch 600. Best Recall: 0.0116
2026-05-17 21:32:20,635 - optuna.study.study - INFO - Trial 44 finished with value: 0.011616631979589757 and parameters: {'n_layers': 4, 'embedding_dim': 96, 'lr': 0.0012487932843337861, 'lambda_val': 3.579031760039444e-05, 'batch_size': 1061, 'optimizer': 'Adam'}. Best is trial 34 with value: 0.024496273194529624.
2026-05-17 21:32:28,743 - experiment_functions - INFO - Early stopping at epoch 550. Best Recall: 0.0211
2026-05-17 21:32:28,823 - optuna.study.study - INFO - Trial 45 finished with value: 0.0211272158773125 and parameters: {'n_layers': 3, 'embedding_dim': 96, 'lr': 0.0019729803722743373, 'lambda_val': 0.00012427840594870132, 'batch_size': 717, 'optimizer': 'Adam'}. Best is trial 34 with value: 0.024496273194529624.
2026-05-17 21:32:37,010 - experiment_functions - INFO - Early stopping at epoch 550. Best Recall: 0.0104
2026-05-17 21:32:37,099 - optuna.study.study - INFO - Trial 46 finished with value: 0.010363883928564499 and parameters: {'n_layers': 3, 'embedding_dim': 256, 'lr': 0.004419052032061549, 'lambda_val': 1.4003142173809983e-05, 'batch_size': 660, 'optimizer': 'Adam'}. Best is trial 34 with value: 0.024496273194529624.
2026-05-17 21:32:48,732 - experiment_functions - INFO - Early stopping at epoch 850. Best Recall: 0.0194
2026-05-17 21:32:48,820 - optuna.study.study - INFO - Trial 47 finished with value: 0.019377890247039613 and parameters: {'n_layers': 3, 'embedding_dim': 96, 'lr': 0.0004056985065958171, 'lambda_val': 7.004684470528143e-05, 'batch_size': 867, 'optimizer': 'Adam'}. Best is trial 34 with value: 0.024496273194529624.
2026-05-17 21:32:57,452 - experiment_functions - INFO - Early stopping at epoch 600. Best Recall: 0.0116
2026-05-17 21:32:57,575 - optuna.study.study - INFO - Trial 48 finished with value: 0.0116382945241522 and parameters: {'n_layers': 3, 'embedding_dim': 128, 'lr': 0.0008500539445042602, 'lambda_val': 0.0010659718661060627, 'batch_size': 3029, 'optimizer': 'Adam'}. Best is trial 34 with value: 0.024496273194529624.
2026-05-17 21:33:05,339 - experiment_functions - INFO - Early stopping at epoch 500. Best Recall: 0.0053
