2026-05-18 14:25:41,569 - optuna.study._optimize - INFO - Trial 207 pruned. 
2026-05-18 14:25:58,124 - experiment_functions - INFO - Early stopping at epoch 1250. Best Recall: 0.0677
2026-05-18 14:25:58,214 - optuna.study.study - INFO - Trial 208 finished with value: 0.06769081339089691 and parameters: {'n_layers': 1, 'embedding_dim': 32, 'lr': 0.001150617846732318, 'lambda_val': 0.00419303921262416, 'batch_size': 582, 'optimizer': 'Adam'}. Best is trial 139 with value: 0.07010716373925278.
2026-05-18 14:26:13,276 - optuna.study._optimize - INFO - Trial 209 pruned. 
2026-05-18 14:26:33,342 - optuna.study._optimize - INFO - Trial 210 pruned. 
2026-05-18 14:26:59,132 - optuna.study._optimize - INFO - Trial 211 pruned. 
2026-05-18 14:27:31,956 - experiment_functions - INFO - Early stopping at epoch 1250. Best Recall: 0.0685
2026-05-18 14:27:32,424 - optuna.study.study - INFO - Trial 212 finished with value: 0.06847157508907749 and parameters: {'n_layers': 1, 'embedding_dim': 32, 'lr': 0.0009379956354337027, 'lambda_val': 0.006868548113471277, 'batch_size': 873, 'optimizer': 'Adam'}. Best is trial 139 with value: 0.07010716373925278.
2026-05-18 14:27:48,995 - optuna.study._optimize - INFO - Trial 213 pruned. 
2026-05-18 14:28:05,273 - optuna.study._optimize - INFO - Trial 214 pruned. 
2026-05-18 14:28:21,626 - optuna.study._optimize - INFO - Trial 215 pruned. 
2026-05-18 14:28:35,461 - optuna.study._optimize - INFO - Trial 216 pruned. 
2026-05-18 14:28:50,567 - experiment_functions - INFO - Early stopping at epoch 1050. Best Recall: 0.0680
2026-05-18 14:28:50,667 - optuna.study.study - INFO - Trial 217 finished with value: 0.06803707306935736 and parameters: {'n_layers': 1, 'embedding_dim': 32, 'lr': 0.0014263588101306344, 'lambda_val': 0.0030704345871676165, 'batch_size': 690, 'optimizer': 'Adam'}. Best is trial 139 with value: 0.07010716373925278.
2026-05-18 14:29:04,351 - experiment_functions - INFO - Early stopping at epoch 950. Best Recall: 0.0631
2026-05-18 14:29:04,451 - optuna.study.study - INFO - Trial 218 finished with value: 0.06305106814179355 and parameters: {'n_layers': 1, 'embedding_dim': 32, 'lr': 0.0015015950414172116, 'lambda_val': 0.0058989481357891735, 'batch_size': 640, 'optimizer': 'Adam'}. Best is trial 139 with value: 0.07010716373925278.
2026-05-18 14:29:30,014 - experiment_functions - INFO - Early stopping at epoch 1800. Best Recall: 0.0674
2026-05-18 14:29:30,149 - optuna.study.study - INFO - Trial 219 finished with value: 0.06741789621962072 and parameters: {'n_layers': 1, 'embedding_dim': 32, 'lr': 0.0008304992929926511, 'lambda_val': 0.003033663835160109, 'batch_size': 703, 'optimizer': 'Adam'}. Best is trial 139 with value: 0.07010716373925278.
2026-05-18 14:29:42,389 - optuna.study._optimize - INFO - Trial 220 pruned. 
2026-05-18 14:30:01,424 - optuna.study._optimize - INFO - Trial 221 pruned. 
2026-05-18 14:30:16,594 - optuna.study._optimize - INFO - Trial 222 pruned. 
2026-05-18 14:30:39,000 - experiment_functions - INFO - Early stopping at epoch 1500. Best Recall: 0.0721
2026-05-18 14:30:39,101 - optuna.study.study - INFO - Trial 223 finished with value: 0.07213731043349277 and parameters: {'n_layers': 1, 'embedding_dim': 32, 'lr': 0.0009607240825880506, 'lambda_val': 0.004626358903706538, 'batch_size': 720, 'optimizer': 'Adam'}. Best is trial 223 with value: 0.07213731043349277.
2026-05-18 14:31:01,991 - experiment_functions - INFO - Early stopping at epoch 1650. Best Recall: 0.0698
2026-05-18 14:31:02,137 - optuna.study.study - INFO - Trial 224 finished with value: 0.06981835551277597 and parameters: {'n_layers': 1, 'embedding_dim': 32, 'lr': 0.0009349454030339263, 'lambda_val': 0.005499313036804042, 'batch_size': 753, 'optimizer': 'Adam'}. Best is trial 223 with value: 0.07213731043349277.
2026-05-18 14:31:21,980 - experiment_functions - INFO - Early stopping at epoch 1400. Best Recall: 0.0699
2026-05-18 14:31:22,079 - optuna.study.study - INFO - Trial 225 finished with value: 0.06990490800294782 and parameters: {'n_layers': 1, 'embedding_dim': 32, 'lr': 0.0009332268243269989, 'lambda_val': 0.005198595219116176, 'batch_size': 733, 'optimizer': 'Adam'}. Best is trial 223 with value: 0.07213731043349277.
2026-05-18 14:31:47,690 - experiment_functions - INFO - Early stopping at epoch 1650. Best Recall: 0.0702
2026-05-18 14:31:47,790 - optuna.study.study - INFO - Trial 226 finished with value: 0.07017851961527953 and parameters: {'n_layers': 1, 'embedding_dim': 32, 'lr': 0.0009028986645023647, 'lambda_val': 0.006975201651742209, 'batch_size': 716, 'optimizer': 'Adam'}. Best is trial 223 with value: 0.07213731043349277.
2026-05-18 14:32:04,627 - optuna.study._optimize - INFO - Trial 227 pruned. 
2026-05-18 14:32:22,456 - optuna.study._optimize - INFO - Trial 228 pruned. 
2026-05-18 14:32:33,271 - experiment_functions - INFO - Early stopping at epoch 750. Best Recall: 0.0394
2026-05-18 14:32:33,406 - optuna.study.study - INFO - Trial 229 finished with value: 0.03938012789274153 and parameters: {'n_layers': 4, 'embedding_dim': 32, 'lr': 0.0009322090795616718, 'lambda_val': 0.005588956277588025, 'batch_size': 615, 'optimizer': 'Adam'}. Best is trial 223 with value: 0.07213731043349277.
2026-05-18 14:32:41,351 - experiment_functions - INFO - Early stopping at epoch 500. Best Recall: 0.0057
2026-05-18 14:32:41,450 - optuna.study.study - INFO - Trial 230 finished with value: 0.005690203819868922 and parameters: {'n_layers': 1, 'embedding_dim': 32, 'lr': 0.0005533799340433518, 'lambda_val': 0.01201116291450999, 'batch_size': 778, 'optimizer': 'SGD'}. Best is trial 223 with value: 0.07213731043349277.
2026-05-18 14:32:59,321 - optuna.study._optimize - INFO - Trial 231 pruned. 
2026-05-18 14:33:17,532 - optuna.study._optimize - INFO - Trial 232 pruned. 
2026-05-18 14:33:35,594 - optuna.study._optimize - INFO - Trial 233 pruned. 
2026-05-18 14:33:50,489 - experiment_functions - INFO - Early stopping at epoch 1050. Best Recall: 0.0642
2026-05-18 14:33:50,578 - optuna.study.study - INFO - Trial 234 finished with value: 0.06417007268614634 and parameters: {'n_layers': 1, 'embedding_dim': 32, 'lr': 0.0013804556657611626, 'lambda_val': 0.0063444237330240435, 'batch_size': 579, 'optimizer': 'Adam'}. Best is trial 223 with value: 0.07213731043349277.
2026-05-18 14:33:58,263 - experiment_functions - INFO - Early stopping at epoch 500. Best Recall: 0.0047
2026-05-18 14:33:58,366 - optuna.study.study - INFO - Trial 235 finished with value: 0.004656864930330877 and parameters: {'n_layers': 1, 'embedding_dim': 32, 'lr': 0.0006514610980293344, 'lambda_val': 0.008316290767221806, 'batch_size': 516, 'optimizer': 'Adam'}. Best is trial 223 with value: 0.07213731043349277.
2026-05-18 14:34:15,327 - optuna.study._optimize - INFO - Trial 236 pruned. 
2026-05-18 14:34:31,788 - optuna.study._optimize - INFO - Trial 237 pruned. 
2026-05-18 14:34:54,245 - experiment_functions - INFO - Early stopping at epoch 1500. Best Recall: 0.0669
2026-05-18 14:34:54,345 - optuna.study.study - INFO - Trial 238 finished with value: 0.06686427183370937 and parameters: {'n_layers': 1, 'embedding_dim': 32, 'lr': 0.0008930019431633383, 'lambda_val': 0.003557971779727614, 'batch_size': 742, 'optimizer': 'Adam'}. Best is trial 223 with value: 0.07213731043349277.
2026-05-18 14:35:08,229 - optuna.study._optimize - INFO - Trial 239 pruned. 
2026-05-18 14:35:22,156 - experiment_functions - INFO - Early stopping at epoch 1000. Best Recall: 0.0657
2026-05-18 14:35:22,245 - optuna.study.study - INFO - Trial 240 finished with value: 0.0657295302605339 and parameters: {'n_layers': 1, 'embedding_dim': 32, 'lr': 0.0012526553430305875, 'lambda_val': 0.004117532042460872, 'batch_size': 981, 'optimizer': 'Adam'}. Best is trial 223 with value: 0.07213731043349277.
2026-05-18 14:35:44,694 - optuna.study._optimize - INFO - Trial 241 pruned. 
2026-05-18 14:36:08,586 - experiment_functions - INFO - Early stopping at epoch 1650. Best Recall: 0.0680
2026-05-18 14:36:08,656 - optuna.study.study - INFO - Trial 242 finished with value: 0.0679860053810812 and parameters: {'n_layers': 1, 'embedding_dim': 32, 'lr': 0.0007689456871515125, 'lambda_val': 0.003210292347790673, 'batch_size': 839, 'optimizer': 'Adam'}. Best is trial 223 with value: 0.07213731043349277.
2026-05-18 14:36:23,412 - optuna.study._optimize - INFO - Trial 243 pruned. 
2026-05-18 14:36:37,170 - optuna.study._optimize - INFO - Trial 244 pruned. 
2026-05-18 14:36:55,999 - experiment_functions - INFO - Early stopping at epoch 1150. Best Recall: 0.0653
2026-05-18 14:36:56,090 - optuna.study.study - INFO - Trial 245 finished with value: 0.06532417999325751 and parameters: {'n_layers': 1, 'embedding_dim': 32, 'lr': 0.0010908103064393407, 'lambda_val': 0.004929159832424324, 'batch_size': 939, 'optimizer': 'Adam'}. Best is trial 223 with value: 0.07213731043349277.
2026-05-18 14:37:13,458 - optuna.study._optimize - INFO - Trial 246 pruned. 
2026-05-18 14:37:27,715 - optuna.study._optimize - INFO - Trial 247 pruned. 
2026-05-18 14:37:45,975 - optuna.study._optimize - INFO - Trial 248 pruned. 
2026-05-18 14:38:04,296 - optuna.study._optimize - INFO - Trial 249 pruned. 
2026-05-18 14:38:24,847 - optuna.study._optimize - INFO - Trial 250 pruned. 
2026-05-18 14:38:37,175 - experiment_functions - INFO - Early stopping at epoch 850. Best Recall: 0.0579
2026-05-18 14:38:37,320 - optuna.study.study - INFO - Trial 251 finished with value: 0.057887035611864764 and parameters: {'n_layers': 1, 'embedding_dim': 96, 'lr': 0.0013622922342824146, 'lambda_val': 0.005976520618250229, 'batch_size': 1086, 'optimizer': 'Adam'}. Best is trial 223 with value: 0.07213731043349277.
2026-05-18 14:38:53,551 - optuna.study._optimize - INFO - Trial 252 pruned. 
2026-05-18 14:39:10,298 - optuna.study._optimize - INFO - Trial 253 pruned. 
2026-05-18 14:39:30,056 - optuna.study._optimize - INFO - Trial 254 pruned. 
2026-05-18 14:39:47,517 - optuna.study._optimize - INFO - Trial 255 pruned. 
2026-05-18 14:40:06,525 - optuna.study._optimize - INFO - Trial 256 pruned. 
2026-05-18 14:40:25,393 - optuna.study._optimize - INFO - Trial 257 pruned. 
2026-05-18 14:40:58,847 - experiment_functions - INFO - Early stopping at epoch 2100. Best Recall: 0.0684
2026-05-18 14:40:58,971 - optuna.study.study - INFO - Trial 258 finished with value: 0.06840201200721596 and parameters: {'n_layers': 1, 'embedding_dim': 32, 'lr': 0.0008196474865831379, 'lambda_val': 0.003877589702868147, 'batch_size': 686, 'optimizer': 'Adam'}. Best is trial 223 with value: 0.07213731043349277.
2026-05-18 14:41:34,909 - experiment_functions - INFO - Early stopping at epoch 2150. Best Recall: 0.0695
2026-05-18 14:41:34,989 - optuna.study.study - INFO - Trial 259 finished with value: 0.06951563790404976 and parameters: {'n_layers': 1, 'embedding_dim': 32, 'lr': 0.0007651209010547275, 'lambda_val': 0.006128824158298591, 'batch_size': 659, 'optimizer': 'Adam'}. Best is trial 223 with value: 0.07213731043349277.
2026-05-18 14:41:44,040 - experiment_functions - INFO - Early stopping at epoch 500. Best Recall: 0.0054
2026-05-18 14:41:44,131 - optuna.study.study - INFO - Trial 260 finished with value: 0.005419461816117797 and parameters: {'n_layers': 1, 'embedding_dim': 256, 'lr': 0.00048215158292391665, 'lambda_val': 0.007056473689040989, 'batch_size': 645, 'optimizer': 'SGD'}. Best is trial 223 with value: 0.07213731043349277.
2026-05-18 14:41:53,528 - experiment_functions - INFO - Early stopping at epoch 500. Best Recall: 0.0051
2026-05-18 14:41:53,650 - optuna.study.study - INFO - Trial 261 finished with value: 0.005137302808908342 and parameters: {'n_layers': 1, 'embedding_dim': 32, 'lr': 0.0006499884503141139, 'lambda_val': 0.010917379030954591, 'batch_size': 530, 'optimizer': 'Adam'}. Best is trial 223 with value: 0.07213731043349277.
2026-05-18 14:42:10,892 - optuna.study._optimize - INFO - Trial 262 pruned. 
2026-05-18 14:42:29,087 - optuna.study._optimize - INFO - Trial 263 pruned. 
2026-05-18 14:42:59,649 - experiment_functions - INFO - Early stopping at epoch 2000. Best Recall: 0.0684
2026-05-18 14:42:59,728 - optuna.study.study - INFO - Trial 264 finished with value: 0.06838103449164054 and parameters: {'n_layers': 1, 'embedding_dim': 32, 'lr': 0.000892900860697879, 'lambda_val': 0.005304486977058227, 'batch_size': 657, 'optimizer': 'Adam'}. Best is trial 223 with value: 0.07213731043349277.
2026-05-18 14:43:15,895 - experiment_functions - INFO - Early stopping at epoch 1000. Best Recall: 0.0703
2026-05-18 14:43:16,039 - optuna.study.study - INFO - Trial 265 finished with value: 0.07031148127156601 and parameters: {'n_layers': 1, 'embedding_dim': 32, 'lr': 0.0013933233253760383, 'lambda_val': 0.005452425944821385, 'batch_size': 769, 'optimizer': 'Adam'}. Best is trial 223 with value: 0.07213731043349277.
2026-05-18 14:43:31,822 - experiment_functions - INFO - Early stopping at epoch 900. Best Recall: 0.0633
2026-05-18 14:43:32,059 - optuna.study.study - INFO - Trial 266 finished with value: 0.06332215986594454 and parameters: {'n_layers': 1, 'embedding_dim': 32, 'lr': 0.001651702905841424, 'lambda_val': 0.005033650842493885, 'batch_size': 848, 'optimizer': 'Adam'}. Best is trial 223 with value: 0.07213731043349277.
2026-05-18 14:43:46,732 - experiment_functions - INFO - Early stopping at epoch 950. Best Recall: 0.0645
2026-05-18 14:43:46,886 - optuna.study.study - INFO - Trial 267 finished with value: 0.06452262579350941 and parameters: {'n_layers': 1, 'embedding_dim': 32, 'lr': 0.0013925264483885503, 'lambda_val': 0.008754098898725459, 'batch_size': 798, 'optimizer': 'Adam'}. Best is trial 223 with value: 0.07213731043349277.
2026-05-18 14:44:03,945 - experiment_functions - INFO - Early stopping at epoch 1150. Best Recall: 0.0677
2026-05-18 14:44:04,080 - optuna.study.study - INFO - Trial 268 finished with value: 0.06769058543245914 and parameters: {'n_layers': 1, 'embedding_dim': 32, 'lr': 0.0009005276987446874, 'lambda_val': 0.014672350112606824, 'batch_size': 934, 'optimizer': 'Adam'}. Best is trial 223 with value: 0.07213731043349277.
2026-05-18 14:44:18,746 - optuna.study._optimize - INFO - Trial 269 pruned. 
2026-05-18 14:44:36,107 - optuna.study._optimize - INFO - Trial 270 pruned. 
2026-05-18 14:44:51,960 - experiment_functions - INFO - Early stopping at epoch 1000. Best Recall: 0.0682
2026-05-18 14:44:52,071 - optuna.study.study - INFO - Trial 271 finished with value: 0.06820756217569232 and parameters: {'n_layers': 1, 'embedding_dim': 32, 'lr': 0.0012675391611400419, 'lambda_val': 0.007518847993921142, 'batch_size': 884, 'optimizer': 'Adam'}. Best is trial 223 with value: 0.07213731043349277.
2026-05-18 14:45:06,977 - experiment_functions - INFO - Early stopping at epoch 1000. Best Recall: 0.0679
2026-05-18 14:45:07,670 - optuna.study.study - INFO - Trial 272 finished with value: 0.06794279440625535 and parameters: {'n_layers': 1, 'embedding_dim': 32, 'lr': 0.0013105577423396285, 'lambda_val': 0.007521264478498705, 'batch_size': 852, 'optimizer': 'Adam'}. Best is trial 223 with value: 0.07213731043349277.
2026-05-18 14:45:20,150 - experiment_functions - INFO - Early stopping at epoch 850. Best Recall: 0.0630
2026-05-18 14:45:20,241 - optuna.study.study - INFO - Trial 273 finished with value: 0.06299712124434088 and parameters: {'n_layers': 1, 'embedding_dim': 32, 'lr': 0.001604010728693609, 'lambda_val': 0.010626661599300303, 'batch_size': 859, 'optimizer': 'Adam'}. Best is trial 223 with value: 0.07213731043349277.
2026-05-18 14:45:36,383 - experiment_functions - INFO - Early stopping at epoch 1100. Best Recall: 0.0667
2026-05-18 14:45:36,475 - optuna.study.study - INFO - Trial 274 finished with value: 0.06669973190138097 and parameters: {'n_layers': 1, 'embedding_dim': 32, 'lr': 0.0012898086674799996, 'lambda_val': 0.00698518189435879, 'batch_size': 784, 'optimizer': 'Adam'}. Best is trial 223 with value: 0.07213731043349277.
2026-05-18 14:45:48,277 - experiment_functions - INFO - Early stopping at epoch 800. Best Recall: 0.0615
2026-05-18 14:45:48,412 - optuna.study.study - INFO - Trial 275 finished with value: 0.061522700360184604 and parameters: {'n_layers': 1, 'embedding_dim': 96, 'lr': 0.0017260489127062595, 'lambda_val': 0.007875881314295218, 'batch_size': 716, 'optimizer': 'Adam'}. Best is trial 223 with value: 0.07213731043349277.
2026-05-18 14:46:01,147 - experiment_functions - INFO - Early stopping at epoch 850. Best Recall: 0.0611
2026-05-18 14:46:01,239 - optuna.study.study - INFO - Trial 276 finished with value: 0.06110695365135093 and parameters: {'n_layers': 1, 'embedding_dim': 64, 'lr': 0.0013990061032372759, 'lambda_val': 0.009325147207633349, 'batch_size': 876, 'optimizer': 'Adam'}. Best is trial 223 with value: 0.07213731043349277.
2026-05-18 14:46:12,681 - experiment_functions - INFO - Early stopping at epoch 700. Best Recall: 0.0489
2026-05-18 14:46:12,772 - optuna.study.study - INFO - Trial 277 finished with value: 0.0489068489559197 and parameters: {'n_layers': 3, 'embedding_dim': 32, 'lr': 0.0011797289296980767, 'lambda_val': 0.006032421647689503, 'batch_size': 647, 'optimizer': 'Adam'}. Best is trial 223 with value: 0.07213731043349277.
2026-05-18 14:46:28,717 - experiment_functions - INFO - Early stopping at epoch 1050. Best Recall: 0.0620
2026-05-18 14:46:28,816 - optuna.study.study - INFO - Trial 278 finished with value: 0.06203072764223944 and parameters: {'n_layers': 1, 'embedding_dim': 32, 'lr': 0.0010710208016754229, 'lambda_val': 0.013338188744782717, 'batch_size': 809, 'optimizer': 'Adam'}. Best is trial 223 with value: 0.07213731043349277.
2026-05-18 14:46:46,345 - experiment_functions - INFO - Early stopping at epoch 1050. Best Recall: 0.0653
2026-05-18 14:46:46,435 - optuna.study.study - INFO - Trial 279 finished with value: 0.06526994310494443 and parameters: {'n_layers': 1, 'embedding_dim': 32, 'lr': 0.0013408993518008218, 'lambda_val': 0.005632858243143481, 'batch_size': 745, 'optimizer': 'Adam'}. Best is trial 223 with value: 0.07213731043349277.
2026-05-18 14:47:04,977 - optuna.study._optimize - INFO - Trial 280 pruned. 
2026-05-18 14:47:14,198 - experiment_functions - INFO - Early stopping at epoch 550. Best Recall: 0.0124
2026-05-18 14:47:14,289 - optuna.study.study - INFO - Trial 281 finished with value: 0.012402339197705623 and parameters: {'n_layers': 1, 'embedding_dim': 32, 'lr': 0.049781821509076334, 'lambda_val': 0.00087499567620107, 'batch_size': 663, 'optimizer': 'Adam'}. Best is trial 223 with value: 0.07213731043349277.
2026-05-18 14:47:22,113 - experiment_functions - INFO - Early stopping at epoch 500. Best Recall: 0.0048
2026-05-18 14:47:22,685 - optuna.study.study - INFO - Trial 282 finished with value: 0.004827576525935919 and parameters: {'n_layers': 1, 'embedding_dim': 32, 'lr': 0.0010927282246000415, 'lambda_val': 0.009177185001487344, 'batch_size': 1123, 'optimizer': 'SGD'}. Best is trial 223 with value: 0.07213731043349277.
2026-05-18 14:47:36,413 - experiment_functions - INFO - Early stopping at epoch 900. Best Recall: 0.0624
2026-05-18 14:47:36,515 - optuna.study.study - INFO - Trial 283 finished with value: 0.06240989153118578 and parameters: {'n_layers': 1, 'embedding_dim': 32, 'lr': 0.0017831871082171636, 'lambda_val': 0.0014315470386977707, 'batch_size': 832, 'optimizer': 'Adam'}. Best is trial 223 with value: 0.07213731043349277.
2026-05-18 14:47:58,741 - experiment_functions - INFO - Early stopping at epoch 1550. Best Recall: 0.0671
2026-05-18 14:47:58,855 - optuna.study.study - INFO - Trial 284 finished with value: 0.06714385725055687 and parameters: {'n_layers': 1, 'embedding_dim': 32, 'lr': 0.0008595686962780984, 'lambda_val': 0.005381713988441425, 'batch_size': 746, 'optimizer': 'Adam'}. Best is trial 223 with value: 0.07213731043349277.
2026-05-18 14:48:14,964 - experiment_functions - INFO - Early stopping at epoch 1100. Best Recall: 0.0674
2026-05-18 14:48:15,063 - optuna.study.study - INFO - Trial 285 finished with value: 0.06744669628217778 and parameters: {'n_layers': 1, 'embedding_dim': 32, 'lr': 0.0012639330966880678, 'lambda_val': 0.0018812059522486364, 'batch_size': 884, 'optimizer': 'Adam'}. Best is trial 223 with value: 0.07213731043349277.
2026-05-18 14:48:34,084 - experiment_functions - INFO - Early stopping at epoch 1300. Best Recall: 0.0682
2026-05-18 14:48:34,231 - optuna.study.study - INFO - Trial 286 finished with value: 0.06824351503737926 and parameters: {'n_layers': 1, 'embedding_dim': 32, 'lr': 0.0009906588164642469, 'lambda_val': 0.004688866294904353, 'batch_size': 690, 'optimizer': 'Adam'}. Best is trial 223 with value: 0.07213731043349277.
2026-05-18 14:48:49,460 - experiment_functions - INFO - Early stopping at epoch 950. Best Recall: 0.0543
2026-05-18 14:48:49,558 - optuna.study.study - INFO - Trial 287 finished with value: 0.05433024323945656 and parameters: {'n_layers': 1, 'embedding_dim': 256, 'lr': 0.0010759721612584382, 'lambda_val': 0.006806869447363911, 'batch_size': 775, 'optimizer': 'Adam'}. Best is trial 223 with value: 0.07213731043349277.
2026-05-18 14:49:03,744 - experiment_functions - INFO - Early stopping at epoch 900. Best Recall: 0.0631
2026-05-18 14:49:03,835 - optuna.study.study - INFO - Trial 288 finished with value: 0.06305431892634387 and parameters: {'n_layers': 1, 'embedding_dim': 32, 'lr': 0.0014767937516780535, 'lambda_val': 0.0049369460566547245, 'batch_size': 960, 'optimizer': 'Adam'}. Best is trial 223 with value: 0.07213731043349277.
2026-05-18 14:49:21,173 - optuna.study._optimize - INFO - Trial 289 pruned. 
2026-05-18 14:49:37,493 - experiment_functions - INFO - Early stopping at epoch 1050. Best Recall: 0.0633
2026-05-18 14:49:37,592 - optuna.study.study - INFO - Trial 290 finished with value: 0.0633302899949876 and parameters: {'n_layers': 1, 'embedding_dim': 32, 'lr': 0.0011400514996702778, 'lambda_val': 0.008186444205338476, 'batch_size': 868, 'optimizer': 'Adam'}. Best is trial 223 with value: 0.07213731043349277.
