2026-05-18 20:30:20,325 - optuna.study.study - INFO - Trial 248 finished with value: 0.059851971587936106 and parameters: {'n_layers': 1, 'embedding_dim': 64, 'lr': 0.0009624870116052418, 'lambda_val': 4.3530071008882305e-06, 'batch_size': 515, 'optimizer': 'Adam'}. Best is trial 182 with value: 0.06362387103793415.
2026-05-18 20:30:30,475 - experiment_functions - INFO - Early stopping at epoch 700. Best Recall: 0.0594
2026-05-18 20:30:30,554 - optuna.study.study - INFO - Trial 249 finished with value: 0.059403158756146164 and parameters: {'n_layers': 1, 'embedding_dim': 32, 'lr': 0.0012601134229623348, 'lambda_val': 5.941488562935355e-06, 'batch_size': 577, 'optimizer': 'Adam'}. Best is trial 182 with value: 0.06362387103793415.
2026-05-18 20:30:41,936 - experiment_functions - INFO - Early stopping at epoch 850. Best Recall: 0.0602
2026-05-18 20:30:42,027 - optuna.study.study - INFO - Trial 250 finished with value: 0.06019953965637239 and parameters: {'n_layers': 1, 'embedding_dim': 32, 'lr': 0.00092721174008592, 'lambda_val': 7.4249132095030205e-06, 'batch_size': 514, 'optimizer': 'Adam'}. Best is trial 182 with value: 0.06362387103793415.
2026-05-18 20:30:59,585 - optuna.study._optimize - INFO - Trial 251 pruned. 
2026-05-18 20:31:13,363 - experiment_functions - INFO - Early stopping at epoch 650. Best Recall: 0.0602
2026-05-18 20:31:13,454 - optuna.study.study - INFO - Trial 252 finished with value: 0.060225176038828335 and parameters: {'n_layers': 1, 'embedding_dim': 32, 'lr': 0.0014187768253126406, 'lambda_val': 4.590618388638419e-06, 'batch_size': 697, 'optimizer': 'Adam'}. Best is trial 182 with value: 0.06362387103793415.
2026-05-18 20:31:24,227 - experiment_functions - INFO - Early stopping at epoch 750. Best Recall: 0.0615
2026-05-18 20:31:24,320 - optuna.study.study - INFO - Trial 253 finished with value: 0.06150742307220273 and parameters: {'n_layers': 1, 'embedding_dim': 32, 'lr': 0.0010742125420813604, 'lambda_val': 3.458476690794707e-06, 'batch_size': 625, 'optimizer': 'Adam'}. Best is trial 182 with value: 0.06362387103793415.
2026-05-18 20:31:31,634 - experiment_functions - INFO - Early stopping at epoch 500. Best Recall: 0.0056
2026-05-18 20:31:31,714 - optuna.study.study - INFO - Trial 254 finished with value: 0.0055546657928337425 and parameters: {'n_layers': 3, 'embedding_dim': 96, 'lr': 0.0011539076139702557, 'lambda_val': 1.237906362289497e-06, 'batch_size': 763, 'optimizer': 'SGD'}. Best is trial 182 with value: 0.06362387103793415.
2026-05-18 20:31:42,022 - experiment_functions - INFO - Early stopping at epoch 750. Best Recall: 0.0590
2026-05-18 20:31:42,113 - optuna.study.study - INFO - Trial 255 finished with value: 0.059000132285816624 and parameters: {'n_layers': 1, 'embedding_dim': 32, 'lr': 0.0010554864330320941, 'lambda_val': 6.4321844394274535e-06, 'batch_size': 624, 'optimizer': 'Adam'}. Best is trial 182 with value: 0.06362387103793415.
2026-05-18 20:31:52,655 - experiment_functions - INFO - Early stopping at epoch 750. Best Recall: 0.0406
2026-05-18 20:31:52,766 - optuna.study.study - INFO - Trial 256 finished with value: 0.04056474404428035 and parameters: {'n_layers': 1, 'embedding_dim': 32, 'lr': 0.0008606431351307883, 'lambda_val': 3.6727164715038823e-06, 'batch_size': 3935, 'optimizer': 'Adam'}. Best is trial 182 with value: 0.06362387103793415.
2026-05-18 20:32:01,665 - experiment_functions - INFO - Early stopping at epoch 650. Best Recall: 0.0590
2026-05-18 20:32:01,754 - optuna.study.study - INFO - Trial 257 finished with value: 0.058999938911345 and parameters: {'n_layers': 1, 'embedding_dim': 32, 'lr': 0.0016430650980826598, 'lambda_val': 9.274108263630772e-06, 'batch_size': 702, 'optimizer': 'Adam'}. Best is trial 182 with value: 0.06362387103793415.
2026-05-18 20:32:19,233 - experiment_functions - INFO - Early stopping at epoch 700. Best Recall: 0.0587
2026-05-18 20:32:19,323 - optuna.study.study - INFO - Trial 258 finished with value: 0.058664958132201704 and parameters: {'n_layers': 1, 'embedding_dim': 32, 'lr': 0.0013964723181769903, 'lambda_val': 4.1811166319747074e-06, 'batch_size': 621, 'optimizer': 'Adam'}. Best is trial 182 with value: 0.06362387103793415.
2026-05-18 20:32:30,939 - experiment_functions - INFO - Early stopping at epoch 850. Best Recall: 0.0590
2026-05-18 20:32:31,041 - optuna.study.study - INFO - Trial 259 finished with value: 0.059049584564425175 and parameters: {'n_layers': 1, 'embedding_dim': 32, 'lr': 0.001028437190428924, 'lambda_val': 5.469142932986795e-06, 'batch_size': 605, 'optimizer': 'Adam'}. Best is trial 182 with value: 0.06362387103793415.
2026-05-18 20:32:42,077 - experiment_functions - INFO - Early stopping at epoch 800. Best Recall: 0.0612
2026-05-18 20:32:42,176 - optuna.study.study - INFO - Trial 260 finished with value: 0.06121696220863411 and parameters: {'n_layers': 1, 'embedding_dim': 32, 'lr': 0.0008425826425538357, 'lambda_val': 3.4921299241257536e-06, 'batch_size': 719, 'optimizer': 'Adam'}. Best is trial 182 with value: 0.06362387103793415.
2026-05-18 20:32:51,583 - experiment_functions - INFO - Early stopping at epoch 700. Best Recall: 0.0567
2026-05-18 20:32:51,718 - optuna.study.study - INFO - Trial 261 finished with value: 0.05668530485048732 and parameters: {'n_layers': 1, 'embedding_dim': 32, 'lr': 0.0012278281191045314, 'lambda_val': 1.237296288620311e-06, 'batch_size': 815, 'optimizer': 'Adam'}. Best is trial 182 with value: 0.06362387103793415.
2026-05-18 20:33:02,568 - experiment_functions - INFO - Early stopping at epoch 800. Best Recall: 0.0591
2026-05-18 20:33:02,716 - optuna.study.study - INFO - Trial 262 finished with value: 0.059105624378250995 and parameters: {'n_layers': 1, 'embedding_dim': 32, 'lr': 0.0008429060588962233, 'lambda_val': 7.141047273854461e-06, 'batch_size': 642, 'optimizer': 'Adam'}. Best is trial 182 with value: 0.06362387103793415.
2026-05-18 20:33:14,708 - experiment_functions - INFO - Early stopping at epoch 850. Best Recall: 0.0616
2026-05-18 20:33:14,800 - optuna.study.study - INFO - Trial 263 finished with value: 0.061615103433568325 and parameters: {'n_layers': 1, 'embedding_dim': 32, 'lr': 0.0007163826048229926, 'lambda_val': 1.830375522260113e-06, 'batch_size': 583, 'optimizer': 'Adam'}. Best is trial 182 with value: 0.06362387103793415.
2026-05-18 20:33:27,324 - experiment_functions - INFO - Early stopping at epoch 950. Best Recall: 0.0586
2026-05-18 20:33:27,425 - optuna.study.study - INFO - Trial 264 finished with value: 0.05862962149012632 and parameters: {'n_layers': 1, 'embedding_dim': 32, 'lr': 0.0006809015228110947, 'lambda_val': 2.019715788478987e-06, 'batch_size': 574, 'optimizer': 'Adam'}. Best is trial 182 with value: 0.06362387103793415.
2026-05-18 20:33:37,154 - experiment_functions - INFO - Early stopping at epoch 700. Best Recall: 0.0482
2026-05-18 20:33:37,244 - optuna.study.study - INFO - Trial 265 finished with value: 0.04817478934098973 and parameters: {'n_layers': 2, 'embedding_dim': 32, 'lr': 0.0010399220700706992, 'lambda_val': 4.49149445961793e-06, 'batch_size': 578, 'optimizer': 'Adam'}. Best is trial 182 with value: 0.06362387103793415.
2026-05-18 20:33:49,939 - experiment_functions - INFO - Early stopping at epoch 950. Best Recall: 0.0615
2026-05-18 20:33:50,027 - optuna.study.study - INFO - Trial 266 finished with value: 0.06146398929731309 and parameters: {'n_layers': 1, 'embedding_dim': 32, 'lr': 0.0005961793383975548, 'lambda_val': 0.0028371269178407554, 'batch_size': 512, 'optimizer': 'Adam'}. Best is trial 182 with value: 0.06362387103793415.
2026-05-18 20:34:03,621 - experiment_functions - INFO - Early stopping at epoch 1050. Best Recall: 0.0617
2026-05-18 20:34:03,756 - optuna.study.study - INFO - Trial 267 finished with value: 0.061674915733443955 and parameters: {'n_layers': 1, 'embedding_dim': 32, 'lr': 0.0005758091994889899, 'lambda_val': 0.00012395251797438515, 'batch_size': 516, 'optimizer': 'Adam'}. Best is trial 182 with value: 0.06362387103793415.
2026-05-18 20:34:18,526 - experiment_functions - INFO - Early stopping at epoch 1100. Best Recall: 0.0625
2026-05-18 20:34:18,627 - optuna.study.study - INFO - Trial 268 finished with value: 0.06249686461959281 and parameters: {'n_layers': 1, 'embedding_dim': 32, 'lr': 0.0005542712136356896, 'lambda_val': 0.00011233684971031226, 'batch_size': 579, 'optimizer': 'Adam'}. Best is trial 182 with value: 0.06362387103793415.
2026-05-18 20:34:30,587 - experiment_functions - INFO - Early stopping at epoch 900. Best Recall: 0.0582
2026-05-18 20:34:30,677 - optuna.study.study - INFO - Trial 269 finished with value: 0.05818315472886946 and parameters: {'n_layers': 1, 'embedding_dim': 128, 'lr': 0.00047183375182489017, 'lambda_val': 3.3351126370314535e-05, 'batch_size': 606, 'optimizer': 'Adam'}. Best is trial 182 with value: 0.06362387103793415.
2026-05-18 20:34:43,567 - optuna.study._optimize - INFO - Trial 270 pruned. 
2026-05-18 20:35:07,342 - experiment_functions - INFO - Early stopping at epoch 1800. Best Recall: 0.0625
2026-05-18 20:35:07,450 - optuna.study.study - INFO - Trial 271 finished with value: 0.06250889491369856 and parameters: {'n_layers': 1, 'embedding_dim': 32, 'lr': 0.0003577431678112317, 'lambda_val': 0.0009921297217717927, 'batch_size': 583, 'optimizer': 'RMSprop'}. Best is trial 182 with value: 0.06362387103793415.
2026-05-18 20:35:20,637 - optuna.study._optimize - INFO - Trial 272 pruned. 
2026-05-18 20:36:03,030 - experiment_functions - INFO - Early stopping at epoch 3400. Best Recall: 0.0628
2026-05-18 20:36:03,119 - optuna.study.study - INFO - Trial 273 finished with value: 0.06276847407090122 and parameters: {'n_layers': 1, 'embedding_dim': 32, 'lr': 0.0003078843480951294, 'lambda_val': 2.272554652821966e-05, 'batch_size': 581, 'optimizer': 'RMSprop'}. Best is trial 182 with value: 0.06362387103793415.
2026-05-18 20:36:20,331 - optuna.study._optimize - INFO - Trial 274 pruned. 
2026-05-18 20:37:17,987 - optuna.study.study - INFO - Trial 275 finished with value: 0.06345334552295977 and parameters: {'n_layers': 1, 'embedding_dim': 32, 'lr': 0.00026831586609140886, 'lambda_val': 0.00045020571235597295, 'batch_size': 565, 'optimizer': 'RMSprop'}. Best is trial 182 with value: 0.06362387103793415.
2026-05-18 20:37:33,923 - optuna.study._optimize - INFO - Trial 276 pruned. 
2026-05-18 20:38:11,940 - experiment_functions - INFO - Early stopping at epoch 2550. Best Recall: 0.0628
2026-05-18 20:38:12,030 - optuna.study.study - INFO - Trial 277 finished with value: 0.06278143336857372 and parameters: {'n_layers': 1, 'embedding_dim': 32, 'lr': 0.000369927358866672, 'lambda_val': 0.0003750099143424686, 'batch_size': 512, 'optimizer': 'RMSprop'}. Best is trial 182 with value: 0.06362387103793415.
2026-05-18 20:38:53,983 - experiment_functions - INFO - Early stopping at epoch 3250. Best Recall: 0.0632
2026-05-18 20:38:54,093 - optuna.study.study - INFO - Trial 278 finished with value: 0.06320248156124629 and parameters: {'n_layers': 1, 'embedding_dim': 32, 'lr': 0.0002883650446210845, 'lambda_val': 0.0004678155315904618, 'batch_size': 528, 'optimizer': 'RMSprop'}. Best is trial 182 with value: 0.06362387103793415.
2026-05-18 20:39:07,411 - optuna.study._optimize - INFO - Trial 279 pruned. 
2026-05-18 20:39:57,712 - optuna.study.study - INFO - Trial 280 finished with value: 0.06305850861818094 and parameters: {'n_layers': 1, 'embedding_dim': 32, 'lr': 0.00029284159386119233, 'lambda_val': 0.0008834218105665081, 'batch_size': 514, 'optimizer': 'RMSprop'}. Best is trial 182 with value: 0.06362387103793415.
2026-05-18 20:40:15,509 - optuna.study._optimize - INFO - Trial 281 pruned. 
2026-05-18 20:40:30,210 - optuna.study._optimize - INFO - Trial 282 pruned. 
2026-05-18 20:41:02,849 - experiment_functions - INFO - Early stopping at epoch 2550. Best Recall: 0.0629
2026-05-18 20:41:02,980 - optuna.study.study - INFO - Trial 283 finished with value: 0.06291072711275361 and parameters: {'n_layers': 1, 'embedding_dim': 32, 'lr': 0.000309015900857956, 'lambda_val': 0.0011221868377838307, 'batch_size': 526, 'optimizer': 'RMSprop'}. Best is trial 182 with value: 0.06362387103793415.
2026-05-18 20:41:38,372 - experiment_functions - INFO - Early stopping at epoch 2800. Best Recall: 0.0621
2026-05-18 20:41:38,472 - optuna.study.study - INFO - Trial 284 finished with value: 0.06214262308140627 and parameters: {'n_layers': 1, 'embedding_dim': 32, 'lr': 0.00030016384224615205, 'lambda_val': 0.0015308646926364842, 'batch_size': 516, 'optimizer': 'RMSprop'}. Best is trial 182 with value: 0.06362387103793415.
2026-05-18 20:42:26,799 - optuna.study._optimize - INFO - Trial 285 pruned. 
2026-05-18 20:42:43,125 - optuna.study._optimize - INFO - Trial 286 pruned. 
2026-05-18 20:42:56,252 - optuna.study._optimize - INFO - Trial 287 pruned. 
2026-05-18 20:43:18,956 - optuna.study._optimize - INFO - Trial 288 pruned. 
2026-05-18 20:43:32,965 - optuna.study._optimize - INFO - Trial 289 pruned. 
2026-05-18 20:43:54,051 - experiment_functions - INFO - Early stopping at epoch 1450. Best Recall: 0.0618
2026-05-18 20:43:54,207 - optuna.study.study - INFO - Trial 290 finished with value: 0.061840439159430695 and parameters: {'n_layers': 1, 'embedding_dim': 32, 'lr': 0.00037857259537280437, 'lambda_val': 0.0006100159058441237, 'batch_size': 728, 'optimizer': 'RMSprop'}. Best is trial 182 with value: 0.06362387103793415.
2026-05-18 20:44:23,015 - optuna.study._optimize - INFO - Trial 291 pruned. 
2026-05-18 20:44:48,252 - experiment_functions - INFO - Early stopping at epoch 1600. Best Recall: 0.0611
2026-05-18 20:44:48,388 - optuna.study.study - INFO - Trial 292 finished with value: 0.06111931013165505 and parameters: {'n_layers': 1, 'embedding_dim': 32, 'lr': 0.00040411790347904294, 'lambda_val': 0.0007971962932041601, 'batch_size': 643, 'optimizer': 'RMSprop'}. Best is trial 182 with value: 0.06362387103793415.
2026-05-18 20:45:17,324 - optuna.study._optimize - INFO - Trial 293 pruned. 
2026-05-18 20:45:33,090 - optuna.study._optimize - INFO - Trial 294 pruned. 
2026-05-18 20:46:14,882 - experiment_functions - INFO - Early stopping at epoch 3300. Best Recall: 0.0637
2026-05-18 20:46:15,037 - optuna.study.study - INFO - Trial 295 finished with value: 0.06371732064652846 and parameters: {'n_layers': 1, 'embedding_dim': 32, 'lr': 0.0003057410259093391, 'lambda_val': 0.0009218731621534771, 'batch_size': 512, 'optimizer': 'RMSprop'}. Best is trial 295 with value: 0.06371732064652846.
2026-05-18 20:46:28,564 - optuna.study._optimize - INFO - Trial 296 pruned. 
2026-05-18 20:46:42,418 - optuna.study._optimize - INFO - Trial 297 pruned. 
2026-05-18 20:46:55,888 - optuna.study._optimize - INFO - Trial 298 pruned. 
2026-05-18 20:47:12,570 - optuna.study._optimize - INFO - Trial 299 pruned. 
2026-05-18 20:47:52,611 - experiment_functions - INFO - Early stopping at epoch 3950. Best Recall: 0.0627
2026-05-18 20:47:53,614 - root - INFO -   ** Getting the trainable edges:
2026-05-18 20:47:53,633 - helper_functions - INFO -      Number of nodes: 4781
2026-05-18 20:47:53,633 - helper_functions - INFO -      Ratio: 0.4905602298378822
2026-05-18 20:47:53,633 - helper_functions - INFO -      Number of unique users: 3174
2026-05-18 20:47:53,633 - helper_functions - INFO -      Number of unique items: 1607
2026-05-18 20:47:53,633 - helper_functions - INFO -      Total dominant set edge: 272498
2026-05-18 20:47:53,633 - helper_functions - INFO -      Trainable edges: 217998.40000000002
2026-05-18 20:47:53,703 - root - INFO -   **** Getting 272498 dominant set edges
2026-05-18 20:47:54,234 - optuna.storages._rdb.storage - INFO - A new study created in RDB with name: Study_e_1M_1c3dcs
2026-05-18 20:48:05,225 - experiment_functions - INFO - Early stopping at epoch 700. Best Recall: 0.0815
2026-05-18 20:48:05,376 - optuna.study.study - INFO - Trial 0 finished with value: 0.0814578591097973 and parameters: {'n_layers': 1, 'embedding_dim': 128, 'lr': 0.0006128864713110185, 'lambda_val': 8.872479708686835e-05, 'batch_size': 3667, 'optimizer': 'RMSprop'}. Best is trial 0 with value: 0.0814578591097973.
2026-05-18 20:48:12,774 - experiment_functions - INFO - Early stopping at epoch 500. Best Recall: 0.0049
2026-05-18 20:48:12,865 - optuna.study.study - INFO - Trial 1 finished with value: 0.004890642136723098 and parameters: {'n_layers': 1, 'embedding_dim': 256, 'lr': 9.297732117898816e-05, 'lambda_val': 0.015539268080637996, 'batch_size': 1173, 'optimizer': 'SGD'}. Best is trial 0 with value: 0.0814578591097973.
2026-05-18 20:48:22,049 - experiment_functions - INFO - Early stopping at epoch 500. Best Recall: 0.0051
2026-05-18 20:48:22,148 - optuna.study.study - INFO - Trial 2 finished with value: 0.005069878815540376 and parameters: {'n_layers': 4, 'embedding_dim': 128, 'lr': 0.0028530562431828203, 'lambda_val': 0.006852019586363661, 'batch_size': 1306, 'optimizer': 'SGD'}. Best is trial 0 with value: 0.0814578591097973.
2026-05-18 20:49:52,503 - optuna.study.study - INFO - Trial 3 finished with value: 0.051149789674872756 and parameters: {'n_layers': 4, 'embedding_dim': 256, 'lr': 6.777481198927351e-05, 'lambda_val': 0.0014914313229712165, 'batch_size': 1444, 'optimizer': 'Adam'}. Best is trial 0 with value: 0.0814578591097973.
2026-05-18 20:50:00,552 - experiment_functions - INFO - Early stopping at epoch 500. Best Recall: 0.0052
2026-05-18 20:50:00,641 - optuna.study.study - INFO - Trial 4 finished with value: 0.0052032316407553715 and parameters: {'n_layers': 3, 'embedding_dim': 32, 'lr': 0.0002436080438668237, 'lambda_val': 5.127001191448239e-06, 'batch_size': 1073, 'optimizer': 'SGD'}. Best is trial 0 with value: 0.0814578591097973.
2026-05-18 20:50:07,814 - experiment_functions - INFO - Early stopping at epoch 500. Best Recall: 0.0052
2026-05-18 20:50:07,914 - optuna.study.study - INFO - Trial 5 finished with value: 0.005231084116352261 and parameters: {'n_layers': 1, 'embedding_dim': 64, 'lr': 0.006705645865728431, 'lambda_val': 0.0002675497691429699, 'batch_size': 569, 'optimizer': 'SGD'}. Best is trial 0 with value: 0.0814578591097973.
2026-05-18 20:50:21,621 - optuna.study._optimize - INFO - Trial 6 pruned. 
2026-05-18 20:50:33,103 - experiment_functions - INFO - Early stopping at epoch 850. Best Recall: 0.0050
2026-05-18 20:50:33,194 - optuna.study.study - INFO - Trial 7 finished with value: 0.005039813528484297 and parameters: {'n_layers': 1, 'embedding_dim': 32, 'lr': 4.261093307271113e-05, 'lambda_val': 0.0008254719215700747, 'batch_size': 1998, 'optimizer': 'Adam'}. Best is trial 0 with value: 0.0814578591097973.
2026-05-18 20:50:43,332 - experiment_functions - INFO - Early stopping at epoch 550. Best Recall: 0.0735
2026-05-18 20:50:43,508 - optuna.study.study - INFO - Trial 8 finished with value: 0.07349559363805333 and parameters: {'n_layers': 2, 'embedding_dim': 256, 'lr': 0.0033471104948176087, 'lambda_val': 6.996243612433858e-06, 'batch_size': 2682, 'optimizer': 'Adam'}. Best is trial 0 with value: 0.0814578591097973.
2026-05-18 20:50:56,233 - experiment_functions - INFO - Early stopping at epoch 800. Best Recall: 0.0788
2026-05-18 20:50:56,333 - optuna.study.study - INFO - Trial 9 finished with value: 0.07882636678582962 and parameters: {'n_layers': 2, 'embedding_dim': 64, 'lr': 0.0006188068550920224, 'lambda_val': 7.3302900667728025e-06, 'batch_size': 1216, 'optimizer': 'Adam'}. Best is trial 0 with value: 0.0814578591097973.
2026-05-18 20:51:12,059 - optuna.study._optimize - INFO - Trial 10 pruned. 
2026-05-18 20:51:23,268 - experiment_functions - INFO - Early stopping at epoch 650. Best Recall: 0.0686
2026-05-18 20:51:23,369 - optuna.study.study - INFO - Trial 11 finished with value: 0.0685696476734668 and parameters: {'n_layers': 2, 'embedding_dim': 64, 'lr': 0.0006073911752058139, 'lambda_val': 1.1716571361171329e-06, 'batch_size': 3203, 'optimizer': 'RMSprop'}. Best is trial 0 with value: 0.0814578591097973.
2026-05-18 20:51:34,311 - experiment_functions - INFO - Early stopping at epoch 700. Best Recall: 0.0805
2026-05-18 20:51:34,400 - optuna.study.study - INFO - Trial 12 finished with value: 0.08049773371396086 and parameters: {'n_layers': 1, 'embedding_dim': 128, 'lr': 0.0006114232652950834, 'lambda_val': 5.8708861535494856e-05, 'batch_size': 3622, 'optimizer': 'RMSprop'}. Best is trial 0 with value: 0.0814578591097973.
2026-05-18 20:51:48,069 - optuna.study._optimize - INFO - Trial 13 pruned. 
2026-05-18 20:51:58,994 - experiment_functions - INFO - Early stopping at epoch 700. Best Recall: 0.0440
2026-05-18 20:51:59,094 - optuna.study.study - INFO - Trial 14 finished with value: 0.043968435434687404 and parameters: {'n_layers': 1, 'embedding_dim': 128, 'lr': 0.012897471171085872, 'lambda_val': 6.469532966966634e-05, 'batch_size': 3209, 'optimizer': 'RMSprop'}. Best is trial 0 with value: 0.0814578591097973.
2026-05-18 20:52:07,866 - experiment_functions - INFO - Early stopping at epoch 550. Best Recall: 0.0786
2026-05-18 20:52:07,976 - optuna.study.study - INFO - Trial 15 finished with value: 0.07859058456823685 and parameters: {'n_layers': 1, 'embedding_dim': 128, 'lr': 0.0013225992111297836, 'lambda_val': 0.00017440881149529365, 'batch_size': 3447, 'optimizer': 'RMSprop'}. Best is trial 0 with value: 0.0814578591097973.
2026-05-18 20:52:16,726 - experiment_functions - INFO - Early stopping at epoch 500. Best Recall: 0.0058
2026-05-18 20:52:16,846 - optuna.study.study - INFO - Trial 16 finished with value: 0.005757984128563518 and parameters: {'n_layers': 3, 'embedding_dim': 128, 'lr': 0.00020880172649291107, 'lambda_val': 0.07951776133722996, 'batch_size': 2641, 'optimizer': 'RMSprop'}. Best is trial 0 with value: 0.0814578591097973.
2026-05-18 20:52:27,543 - experiment_functions - INFO - Early stopping at epoch 700. Best Recall: 0.0339
