2026-05-17 21:33:05,430 - optuna.study.study - INFO - Trial 49 finished with value: 0.005273495224928639 and parameters: {'n_layers': 3, 'embedding_dim': 96, 'lr': 0.02474255366370091, 'lambda_val': 0.0002464234762288081, 'batch_size': 3288, 'optimizer': 'Adam'}. Best is trial 34 with value: 0.024496273194529624.
2026-05-17 21:33:13,154 - experiment_functions - INFO - Early stopping at epoch 550. Best Recall: 0.0172
2026-05-17 21:33:13,263 - optuna.study.study - INFO - Trial 50 finished with value: 0.01723689288603023 and parameters: {'n_layers': 3, 'embedding_dim': 96, 'lr': 0.0015833302531614549, 'lambda_val': 2.9125550012062563e-05, 'batch_size': 1130, 'optimizer': 'Adam'}. Best is trial 34 with value: 0.024496273194529624.
2026-05-17 21:33:29,182 - experiment_functions - INFO - Early stopping at epoch 1200. Best Recall: 0.0190
2026-05-17 21:33:29,337 - optuna.study.study - INFO - Trial 51 finished with value: 0.01904129170675888 and parameters: {'n_layers': 3, 'embedding_dim': 96, 'lr': 0.0002877313482431679, 'lambda_val': 9.958429683194879e-05, 'batch_size': 897, 'optimizer': 'Adam'}. Best is trial 34 with value: 0.024496273194529624.
2026-05-17 21:33:40,234 - experiment_functions - INFO - Early stopping at epoch 750. Best Recall: 0.0182
2026-05-17 21:33:40,342 - optuna.study.study - INFO - Trial 52 finished with value: 0.01815214815853386 and parameters: {'n_layers': 3, 'embedding_dim': 96, 'lr': 0.000471622406139168, 'lambda_val': 6.01904303302585e-05, 'batch_size': 865, 'optimizer': 'Adam'}. Best is trial 34 with value: 0.024496273194529624.
2026-05-17 21:33:55,592 - experiment_functions - INFO - Early stopping at epoch 1100. Best Recall: 0.0244
2026-05-17 21:33:55,693 - optuna.study.study - INFO - Trial 53 finished with value: 0.02443285429174765 and parameters: {'n_layers': 3, 'embedding_dim': 96, 'lr': 0.0003785979904793085, 'lambda_val': 1.924943115073859e-05, 'batch_size': 522, 'optimizer': 'Adam'}. Best is trial 34 with value: 0.024496273194529624.
2026-05-17 21:34:04,858 - experiment_functions - INFO - Early stopping at epoch 650. Best Recall: 0.0185
2026-05-17 21:34:04,936 - optuna.study.study - INFO - Trial 54 finished with value: 0.01850937579161243 and parameters: {'n_layers': 3, 'embedding_dim': 96, 'lr': 0.0008550199627254517, 'lambda_val': 1.6655626785929967e-05, 'batch_size': 666, 'optimizer': 'Adam'}. Best is trial 34 with value: 0.024496273194529624.
2026-05-17 21:34:12,892 - experiment_functions - INFO - Early stopping at epoch 550. Best Recall: 0.0185
2026-05-17 21:34:12,982 - optuna.study.study - INFO - Trial 55 finished with value: 0.01845980886415352 and parameters: {'n_layers': 3, 'embedding_dim': 32, 'lr': 0.00320984468375237, 'lambda_val': 7.759604299880978e-06, 'batch_size': 615, 'optimizer': 'Adam'}. Best is trial 34 with value: 0.024496273194529624.
2026-05-17 21:34:21,084 - experiment_functions - INFO - Early stopping at epoch 600. Best Recall: 0.0149
2026-05-17 21:34:21,184 - optuna.study.study - INFO - Trial 56 finished with value: 0.014903436724248343 and parameters: {'n_layers': 3, 'embedding_dim': 64, 'lr': 0.001743666493703752, 'lambda_val': 2.4248003264103817e-06, 'batch_size': 1035, 'optimizer': 'Adam'}. Best is trial 34 with value: 0.024496273194529624.
2026-05-17 21:35:12,855 - optuna.study.study - INFO - Trial 57 finished with value: 0.022716775765787393 and parameters: {'n_layers': 3, 'embedding_dim': 96, 'lr': 0.00028301167825251216, 'lambda_val': 4.4290771338031944e-05, 'batch_size': 789, 'optimizer': 'Adam'}. Best is trial 34 with value: 0.024496273194529624.
2026-05-17 21:35:25,900 - optuna.study._optimize - INFO - Trial 58 pruned. 
2026-05-17 21:35:33,908 - experiment_functions - INFO - Early stopping at epoch 550. Best Recall: 0.0087
2026-05-17 21:35:34,009 - optuna.study.study - INFO - Trial 59 finished with value: 0.008726227926199547 and parameters: {'n_layers': 2, 'embedding_dim': 96, 'lr': 0.006345697645424262, 'lambda_val': 4.8998958806097215e-05, 'batch_size': 1172, 'optimizer': 'Adam'}. Best is trial 34 with value: 0.024496273194529624.
2026-05-17 21:36:27,022 - optuna.study.study - INFO - Trial 60 finished with value: 0.026412947386639133 and parameters: {'n_layers': 3, 'embedding_dim': 128, 'lr': 0.00019001269758623266, 'lambda_val': 9.256632543299832e-06, 'batch_size': 529, 'optimizer': 'Adam'}. Best is trial 60 with value: 0.026412947386639133.
2026-05-17 21:37:19,203 - optuna.study.study - INFO - Trial 61 finished with value: 0.028195981858449803 and parameters: {'n_layers': 3, 'embedding_dim': 128, 'lr': 0.00019836870374792762, 'lambda_val': 1.0466701229026323e-05, 'batch_size': 521, 'optimizer': 'Adam'}. Best is trial 61 with value: 0.028195981858449803.
2026-05-17 21:38:12,022 - optuna.study.study - INFO - Trial 62 finished with value: 0.02717774821748049 and parameters: {'n_layers': 3, 'embedding_dim': 128, 'lr': 0.00016365803923628738, 'lambda_val': 1.0535105264242288e-05, 'batch_size': 531, 'optimizer': 'Adam'}. Best is trial 61 with value: 0.028195981858449803.
2026-05-17 21:39:03,391 - optuna.study.study - INFO - Trial 63 finished with value: 0.02764175798454443 and parameters: {'n_layers': 3, 'embedding_dim': 128, 'lr': 0.00016794804934412754, 'lambda_val': 8.659080528285698e-06, 'batch_size': 554, 'optimizer': 'Adam'}. Best is trial 61 with value: 0.028195981858449803.
2026-05-17 21:39:55,447 - optuna.study.study - INFO - Trial 64 finished with value: 0.027764630034472607 and parameters: {'n_layers': 3, 'embedding_dim': 128, 'lr': 0.00016996217806830848, 'lambda_val': 1.0494116064552419e-05, 'batch_size': 544, 'optimizer': 'Adam'}. Best is trial 61 with value: 0.028195981858449803.
2026-05-17 21:40:22,918 - optuna.study._optimize - INFO - Trial 65 pruned. 
2026-05-17 21:40:36,580 - optuna.study._optimize - INFO - Trial 66 pruned. 
2026-05-17 21:40:50,277 - optuna.study._optimize - INFO - Trial 67 pruned. 
2026-05-17 21:41:05,157 - optuna.study._optimize - INFO - Trial 68 pruned. 
2026-05-17 21:41:18,844 - optuna.study._optimize - INFO - Trial 69 pruned. 
2026-05-17 21:41:26,325 - experiment_functions - INFO - Early stopping at epoch 500. Best Recall: 0.0058
2026-05-17 21:41:26,416 - optuna.study.study - INFO - Trial 70 finished with value: 0.005794258259288422 and parameters: {'n_layers': 3, 'embedding_dim': 128, 'lr': 0.00011621549734652553, 'lambda_val': 1.0997422445002583e-05, 'batch_size': 526, 'optimizer': 'SGD'}. Best is trial 61 with value: 0.028195981858449803.
2026-05-17 21:41:41,063 - experiment_functions - INFO - Early stopping at epoch 1050. Best Recall: 0.0238
2026-05-17 21:41:41,197 - optuna.study.study - INFO - Trial 71 finished with value: 0.023802516555115213 and parameters: {'n_layers': 3, 'embedding_dim': 128, 'lr': 0.0003213660062371726, 'lambda_val': 2.3148013386806406e-05, 'batch_size': 816, 'optimizer': 'Adam'}. Best is trial 61 with value: 0.028195981858449803.
2026-05-17 21:41:53,720 - experiment_functions - INFO - Early stopping at epoch 900. Best Recall: 0.0201
2026-05-17 21:41:53,863 - optuna.study.study - INFO - Trial 72 finished with value: 0.020059399474481578 and parameters: {'n_layers': 3, 'embedding_dim': 128, 'lr': 0.00033891173777728133, 'lambda_val': 2.5857256857060357e-05, 'batch_size': 798, 'optimizer': 'Adam'}. Best is trial 61 with value: 0.028195981858449803.
2026-05-17 21:42:07,413 - optuna.study._optimize - INFO - Trial 73 pruned. 
2026-05-17 21:42:30,895 - optuna.study._optimize - INFO - Trial 74 pruned. 
2026-05-17 21:42:45,539 - optuna.study._optimize - INFO - Trial 75 pruned. 
2026-05-17 21:42:59,873 - optuna.study._optimize - INFO - Trial 76 pruned. 
2026-05-17 21:43:09,229 - experiment_functions - INFO - Early stopping at epoch 650. Best Recall: 0.0169
2026-05-17 21:43:09,331 - optuna.study.study - INFO - Trial 77 finished with value: 0.01689161374397259 and parameters: {'n_layers': 4, 'embedding_dim': 128, 'lr': 0.0005834767997551041, 'lambda_val': 6.457753261398114e-06, 'batch_size': 526, 'optimizer': 'Adam'}. Best is trial 61 with value: 0.028195981858449803.
2026-05-17 21:43:16,609 - experiment_functions - INFO - Early stopping at epoch 500. Best Recall: 0.0049
2026-05-17 21:43:16,711 - optuna.study.study - INFO - Trial 78 finished with value: 0.004907600053666128 and parameters: {'n_layers': 3, 'embedding_dim': 128, 'lr': 0.00036857485467705145, 'lambda_val': 1.7169394344884453e-06, 'batch_size': 616, 'optimizer': 'SGD'}. Best is trial 61 with value: 0.028195981858449803.
2026-05-17 21:43:23,867 - experiment_functions - INFO - Early stopping at epoch 500. Best Recall: 0.0052
2026-05-17 21:43:23,946 - optuna.study.study - INFO - Trial 79 finished with value: 0.005219556763807042 and parameters: {'n_layers': 3, 'embedding_dim': 128, 'lr': 4.107386771437141e-05, 'lambda_val': 2.1384196020942453e-05, 'batch_size': 2203, 'optimizer': 'Adam'}. Best is trial 61 with value: 0.028195981858449803.
2026-05-17 21:43:47,748 - optuna.study._optimize - INFO - Trial 80 pruned. 
2026-05-17 21:44:01,428 - optuna.study._optimize - INFO - Trial 81 pruned. 
2026-05-17 21:44:15,020 - optuna.study._optimize - INFO - Trial 82 pruned. 
2026-05-17 21:44:31,281 - optuna.study._optimize - INFO - Trial 83 pruned. 
2026-05-17 21:44:45,476 - experiment_functions - INFO - Early stopping at epoch 950. Best Recall: 0.0248
2026-05-17 21:44:45,597 - optuna.study.study - INFO - Trial 84 finished with value: 0.024816586476188205 and parameters: {'n_layers': 3, 'embedding_dim': 256, 'lr': 0.00033084728739933583, 'lambda_val': 2.7126811967708016e-05, 'batch_size': 512, 'optimizer': 'Adam'}. Best is trial 61 with value: 0.028195981858449803.
2026-05-17 21:45:00,542 - optuna.study._optimize - INFO - Trial 85 pruned. 
2026-05-17 21:45:15,586 - optuna.study._optimize - INFO - Trial 86 pruned. 
2026-05-17 21:45:28,460 - experiment_functions - INFO - Early stopping at epoch 900. Best Recall: 0.0268
2026-05-17 21:45:28,594 - optuna.study.study - INFO - Trial 87 finished with value: 0.026786832719571545 and parameters: {'n_layers': 2, 'embedding_dim': 256, 'lr': 0.00034214409774645807, 'lambda_val': 3.782715171240225e-06, 'batch_size': 1102, 'optimizer': 'Adam'}. Best is trial 61 with value: 0.028195981858449803.
2026-05-17 21:45:41,066 - experiment_functions - INFO - Early stopping at epoch 900. Best Recall: 0.0265
2026-05-17 21:45:41,147 - optuna.study.study - INFO - Trial 88 finished with value: 0.026471463228245017 and parameters: {'n_layers': 2, 'embedding_dim': 256, 'lr': 0.0004510161085586843, 'lambda_val': 3.821374245124667e-06, 'batch_size': 523, 'optimizer': 'Adam'}. Best is trial 61 with value: 0.028195981858449803.
2026-05-17 21:45:48,723 - experiment_functions - INFO - Early stopping at epoch 500. Best Recall: 0.0052
2026-05-17 21:45:48,804 - optuna.study.study - INFO - Trial 89 finished with value: 0.005159377743504032 and parameters: {'n_layers': 2, 'embedding_dim': 256, 'lr': 0.0005171167052243274, 'lambda_val': 4.678829456943961e-06, 'batch_size': 1150, 'optimizer': 'SGD'}. Best is trial 61 with value: 0.028195981858449803.
2026-05-17 21:45:58,083 - experiment_functions - INFO - Early stopping at epoch 650. Best Recall: 0.0259
2026-05-17 21:45:58,163 - optuna.study.study - INFO - Trial 90 finished with value: 0.025909549231322302 and parameters: {'n_layers': 2, 'embedding_dim': 256, 'lr': 0.0008248404560390088, 'lambda_val': 1.962752728606463e-06, 'batch_size': 943, 'optimizer': 'Adam'}. Best is trial 61 with value: 0.028195981858449803.
2026-05-17 21:46:07,448 - experiment_functions - INFO - Early stopping at epoch 650. Best Recall: 0.0264
2026-05-17 21:46:07,538 - optuna.study.study - INFO - Trial 91 finished with value: 0.026364147732309568 and parameters: {'n_layers': 2, 'embedding_dim': 256, 'lr': 0.0007346678672366607, 'lambda_val': 1.6671664444002408e-06, 'batch_size': 699, 'optimizer': 'Adam'}. Best is trial 61 with value: 0.028195981858449803.
2026-05-17 21:46:16,975 - experiment_functions - INFO - Early stopping at epoch 650. Best Recall: 0.0252
2026-05-17 21:46:17,096 - optuna.study.study - INFO - Trial 92 finished with value: 0.025180087871284784 and parameters: {'n_layers': 2, 'embedding_dim': 256, 'lr': 0.000724263497949972, 'lambda_val': 1.8625227300502225e-06, 'batch_size': 929, 'optimizer': 'Adam'}. Best is trial 61 with value: 0.028195981858449803.
2026-05-17 21:46:26,330 - experiment_functions - INFO - Early stopping at epoch 650. Best Recall: 0.0247
2026-05-17 21:46:26,465 - optuna.study.study - INFO - Trial 93 finished with value: 0.02467641697644006 and parameters: {'n_layers': 2, 'embedding_dim': 256, 'lr': 0.0006854207823571319, 'lambda_val': 1.7382861730526046e-06, 'batch_size': 971, 'optimizer': 'Adam'}. Best is trial 61 with value: 0.028195981858449803.
2026-05-17 21:46:35,627 - experiment_functions - INFO - Early stopping at epoch 600. Best Recall: 0.0254
2026-05-17 21:46:35,738 - optuna.study.study - INFO - Trial 94 finished with value: 0.025434004135137175 and parameters: {'n_layers': 2, 'embedding_dim': 256, 'lr': 0.0013086572770515297, 'lambda_val': 1.945150566907077e-06, 'batch_size': 1104, 'optimizer': 'Adam'}. Best is trial 61 with value: 0.028195981858449803.
2026-05-17 21:46:45,141 - experiment_functions - INFO - Early stopping at epoch 600. Best Recall: 0.0266
2026-05-17 21:46:45,231 - optuna.study.study - INFO - Trial 95 finished with value: 0.02663262361307485 and parameters: {'n_layers': 2, 'embedding_dim': 256, 'lr': 0.0013854002675892216, 'lambda_val': 1.1146777403925776e-06, 'batch_size': 1081, 'optimizer': 'Adam'}. Best is trial 61 with value: 0.028195981858449803.
2026-05-17 21:46:54,683 - experiment_functions - INFO - Early stopping at epoch 650. Best Recall: 0.0263
2026-05-17 21:46:54,774 - optuna.study.study - INFO - Trial 96 finished with value: 0.02625815565046308 and parameters: {'n_layers': 2, 'embedding_dim': 256, 'lr': 0.0007917824808350612, 'lambda_val': 3.4561040910944623e-06, 'batch_size': 705, 'optimizer': 'Adam'}. Best is trial 61 with value: 0.028195981858449803.
2026-05-17 21:47:16,235 - optuna.study._optimize - INFO - Trial 97 pruned. 
2026-05-17 21:47:31,244 - experiment_functions - INFO - Early stopping at epoch 1100. Best Recall: 0.0249
2026-05-17 21:47:31,745 - optuna.study.study - INFO - Trial 98 finished with value: 0.02489878065388889 and parameters: {'n_layers': 2, 'embedding_dim': 256, 'lr': 0.00022631227552713038, 'lambda_val': 3.3481458415262623e-06, 'batch_size': 1566, 'optimizer': 'Adam'}. Best is trial 61 with value: 0.028195981858449803.
2026-05-17 21:47:42,545 - experiment_functions - INFO - Early stopping at epoch 600. Best Recall: 0.0263
2026-05-17 21:47:42,691 - optuna.study.study - INFO - Trial 99 finished with value: 0.026300216303348854 and parameters: {'n_layers': 2, 'embedding_dim': 256, 'lr': 0.0011035797323596655, 'lambda_val': 4.009933098412949e-06, 'batch_size': 739, 'optimizer': 'Adam'}. Best is trial 61 with value: 0.028195981858449803.
2026-05-17 21:47:51,876 - experiment_functions - INFO - Early stopping at epoch 600. Best Recall: 0.0261
2026-05-17 21:47:52,010 - optuna.study.study - INFO - Trial 100 finished with value: 0.02606789480517963 and parameters: {'n_layers': 2, 'embedding_dim': 256, 'lr': 0.0011340095558254693, 'lambda_val': 5.656010354924152e-06, 'batch_size': 710, 'optimizer': 'Adam'}. Best is trial 61 with value: 0.028195981858449803.
2026-05-17 21:48:02,990 - experiment_functions - INFO - Early stopping at epoch 700. Best Recall: 0.0258
2026-05-17 21:48:03,206 - optuna.study.study - INFO - Trial 101 finished with value: 0.025831709871247742 and parameters: {'n_layers': 2, 'embedding_dim': 256, 'lr': 0.0005880574345384506, 'lambda_val': 3.880849459330289e-06, 'batch_size': 707, 'optimizer': 'Adam'}. Best is trial 61 with value: 0.028195981858449803.
2026-05-17 21:48:12,260 - experiment_functions - INFO - Early stopping at epoch 600. Best Recall: 0.0248
2026-05-17 21:48:12,349 - optuna.study.study - INFO - Trial 102 finished with value: 0.024753821598534044 and parameters: {'n_layers': 2, 'embedding_dim': 256, 'lr': 0.0014279649097440836, 'lambda_val': 2.729310504508144e-06, 'batch_size': 598, 'optimizer': 'Adam'}. Best is trial 61 with value: 0.028195981858449803.
2026-05-17 21:48:24,236 - experiment_functions - INFO - Early stopping at epoch 800. Best Recall: 0.0258
2026-05-17 21:48:24,369 - optuna.study.study - INFO - Trial 103 finished with value: 0.025819852342650135 and parameters: {'n_layers': 2, 'embedding_dim': 256, 'lr': 0.0003962163333281549, 'lambda_val': 1.009756204353931e-06, 'batch_size': 844, 'optimizer': 'Adam'}. Best is trial 61 with value: 0.028195981858449803.
2026-05-17 21:48:34,707 - experiment_functions - INFO - Early stopping at epoch 600. Best Recall: 0.0235
2026-05-17 21:48:35,471 - optuna.study.study - INFO - Trial 104 finished with value: 0.023528999984443758 and parameters: {'n_layers': 2, 'embedding_dim': 256, 'lr': 0.0009371576607818112, 'lambda_val': 1.3818350491508964e-06, 'batch_size': 1983, 'optimizer': 'Adam'}. Best is trial 61 with value: 0.028195981858449803.
2026-05-17 21:48:54,382 - experiment_functions - INFO - Early stopping at epoch 750. Best Recall: 0.0257
2026-05-17 21:48:54,472 - optuna.study.study - INFO - Trial 105 finished with value: 0.02567568148586811 and parameters: {'n_layers': 2, 'embedding_dim': 256, 'lr': 0.0004313711834188302, 'lambda_val': 6.5116140125191745e-06, 'batch_size': 1060, 'optimizer': 'Adam'}. Best is trial 61 with value: 0.028195981858449803.
2026-05-17 21:49:08,579 - optuna.study._optimize - INFO - Trial 106 pruned. 
2026-05-17 21:49:15,816 - experiment_functions - INFO - Early stopping at epoch 500. Best Recall: 0.0053
2026-05-17 21:49:15,904 - optuna.study.study - INFO - Trial 107 finished with value: 0.005285975167357155 and parameters: {'n_layers': 2, 'embedding_dim': 64, 'lr': 0.09493637597399458, 'lambda_val': 2.9215882224762675e-06, 'batch_size': 1204, 'optimizer': 'Adam'}. Best is trial 61 with value: 0.028195981858449803.
2026-05-17 21:49:52,321 - experiment_functions - INFO - Early stopping at epoch 2650. Best Recall: 0.0274
2026-05-17 21:49:52,411 - optuna.study.study - INFO - Trial 108 finished with value: 0.02744527514086149 and parameters: {'n_layers': 2, 'embedding_dim': 256, 'lr': 0.00019264729448584259, 'lambda_val': 1.1586975782965543e-05, 'batch_size': 598, 'optimizer': 'Adam'}. Best is trial 61 with value: 0.028195981858449803.
2026-05-17 21:50:55,281 - optuna.study.study - INFO - Trial 109 finished with value: 0.02817115797436704 and parameters: {'n_layers': 2, 'embedding_dim': 256, 'lr': 0.0001452190512109065, 'lambda_val': 8.764752167660533e-06, 'batch_size': 581, 'optimizer': 'Adam'}. Best is trial 61 with value: 0.028195981858449803.
2026-05-17 21:51:34,055 - experiment_functions - INFO - Early stopping at epoch 2900. Best Recall: 0.0278
2026-05-17 21:51:34,154 - optuna.study.study - INFO - Trial 110 finished with value: 0.027778213038110875 and parameters: {'n_layers': 2, 'embedding_dim': 256, 'lr': 0.0001944055133749388, 'lambda_val': 1.088506735585178e-05, 'batch_size': 583, 'optimizer': 'Adam'}. Best is trial 61 with value: 0.028195981858449803.
2026-05-17 21:52:02,972 - optuna.study._optimize - INFO - Trial 111 pruned. 
2026-05-17 21:52:56,259 - optuna.study.study - INFO - Trial 112 finished with value: 0.028337401404625366 and parameters: {'n_layers': 2, 'embedding_dim': 256, 'lr': 0.00013905135760056413, 'lambda_val': 9.229976400364706e-06, 'batch_size': 589, 'optimizer': 'Adam'}. Best is trial 112 with value: 0.028337401404625366.
2026-05-17 21:53:38,465 - experiment_functions - INFO - Early stopping at epoch 3200. Best Recall: 0.0284
2026-05-17 21:53:38,565 - optuna.study.study - INFO - Trial 113 finished with value: 0.028425147964278603 and parameters: {'n_layers': 2, 'embedding_dim': 256, 'lr': 0.0001357910985841202, 'lambda_val': 7.857115160152559e-06, 'batch_size': 580, 'optimizer': 'Adam'}. Best is trial 113 with value: 0.028425147964278603.
2026-05-17 21:53:53,921 - optuna.study._optimize - INFO - Trial 114 pruned. 
2026-05-17 21:54:08,420 - optuna.study._optimize - INFO - Trial 115 pruned. 
2026-05-17 21:54:28,401 - experiment_functions - INFO - Early stopping at epoch 1500. Best Recall: 0.0278
2026-05-17 21:54:28,534 - optuna.study.study - INFO - Trial 116 finished with value: 0.027781940275288585 and parameters: {'n_layers': 2, 'embedding_dim': 256, 'lr': 0.000268498287221249, 'lambda_val': 1.4298310993475795e-05, 'batch_size': 582, 'optimizer': 'Adam'}. Best is trial 113 with value: 0.028425147964278603.
2026-05-17 21:55:26,400 - optuna.study.study - INFO - Trial 117 finished with value: 0.028025050990708247 and parameters: {'n_layers': 2, 'embedding_dim': 256, 'lr': 0.00013436323203186692, 'lambda_val': 1.3578100111970339e-05, 'batch_size': 587, 'optimizer': 'Adam'}. Best is trial 113 with value: 0.028425147964278603.
2026-05-17 21:55:36,820 - experiment_functions - INFO - Early stopping at epoch 500. Best Recall: 0.0058
2026-05-17 21:55:36,919 - optuna.study.study - INFO - Trial 118 finished with value: 0.0058043173748864516 and parameters: {'n_layers': 2, 'embedding_dim': 256, 'lr': 7.796873148314581e-05, 'lambda_val': 1.6946854106337397e-05, 'batch_size': 588, 'optimizer': 'SGD'}. Best is trial 113 with value: 0.028425147964278603.
2026-05-17 21:55:50,836 - optuna.study._optimize - INFO - Trial 119 pruned. 
2026-05-17 21:56:03,207 - optuna.study._optimize - INFO - Trial 120 pruned. 
2026-05-17 21:56:51,670 - experiment_functions - INFO - Early stopping at epoch 3700. Best Recall: 0.0287
2026-05-17 21:56:51,761 - optuna.study.study - INFO - Trial 121 finished with value: 0.028725385044156507 and parameters: {'n_layers': 2, 'embedding_dim': 256, 'lr': 0.0001494914414876375, 'lambda_val': 8.453066970120244e-06, 'batch_size': 595, 'optimizer': 'Adam'}. Best is trial 121 with value: 0.028725385044156507.
