2026-05-18 23:27:41,389 - optuna.study.study - INFO - Trial 215 finished with value: 0.06901239246249309 and parameters: {'n_layers': 1, 'embedding_dim': 32, 'lr': 0.001248056648908879, 'lambda_val': 0.00012238393845597067, 'batch_size': 538, 'optimizer': 'Adam'}. Best is trial 151 with value: 0.07582601723856444.
2026-05-18 23:30:08,512 - experiment_functions - INFO - Early stopping at epoch 550. Best Recall: 0.0480
2026-05-18 23:30:08,603 - optuna.study.study - INFO - Trial 216 finished with value: 0.04799189256214653 and parameters: {'n_layers': 1, 'embedding_dim': 32, 'lr': 0.011199131613685213, 'lambda_val': 0.00014006555823815588, 'batch_size': 589, 'optimizer': 'Adam'}. Best is trial 151 with value: 0.07582601723856444.
2026-05-18 23:30:33,982 - experiment_functions - INFO - Early stopping at epoch 850. Best Recall: 0.0528
2026-05-18 23:30:34,083 - optuna.study.study - INFO - Trial 217 finished with value: 0.052795368632666706 and parameters: {'n_layers': 3, 'embedding_dim': 32, 'lr': 0.0009573244277376087, 'lambda_val': 0.00017522798719656047, 'batch_size': 520, 'optimizer': 'Adam'}. Best is trial 151 with value: 0.07582601723856444.
2026-05-18 23:31:06,241 - optuna.study._optimize - INFO - Trial 218 pruned. 
2026-05-18 23:32:10,065 - experiment_functions - INFO - Early stopping at epoch 3100. Best Recall: 0.0719
2026-05-18 23:32:10,163 - optuna.study.study - INFO - Trial 219 finished with value: 0.07194455407612635 and parameters: {'n_layers': 1, 'embedding_dim': 32, 'lr': 0.0007883249670440135, 'lambda_val': 0.0001148808677783595, 'batch_size': 649, 'optimizer': 'Adam'}. Best is trial 151 with value: 0.07582601723856444.
2026-05-18 23:32:34,058 - optuna.study._optimize - INFO - Trial 220 pruned. 
2026-05-18 23:33:01,994 - optuna.study._optimize - INFO - Trial 221 pruned. 
2026-05-18 23:33:28,741 - optuna.study._optimize - INFO - Trial 222 pruned. 
2026-05-18 23:33:43,753 - optuna.study._optimize - INFO - Trial 223 pruned. 
2026-05-18 23:34:01,548 - optuna.study._optimize - INFO - Trial 224 pruned. 
2026-05-18 23:34:20,633 - optuna.study._optimize - INFO - Trial 225 pruned. 
2026-05-18 23:35:06,256 - experiment_functions - INFO - Early stopping at epoch 1350. Best Recall: 0.0716
2026-05-18 23:35:06,346 - optuna.study.study - INFO - Trial 226 finished with value: 0.0716340034000938 and parameters: {'n_layers': 1, 'embedding_dim': 32, 'lr': 0.00111384694644791, 'lambda_val': 0.0001442586846831791, 'batch_size': 714, 'optimizer': 'Adam'}. Best is trial 151 with value: 0.07582601723856444.
2026-05-18 23:35:49,846 - optuna.study._optimize - INFO - Trial 227 pruned. 
2026-05-18 23:37:06,075 - optuna.study._optimize - INFO - Trial 228 pruned. 
2026-05-18 23:37:45,207 - optuna.study._optimize - INFO - Trial 229 pruned. 
2026-05-18 23:38:22,250 - experiment_functions - INFO - Early stopping at epoch 500. Best Recall: 0.0052
2026-05-18 23:38:28,661 - optuna.study.study - INFO - Trial 230 finished with value: 0.0051748298656813865 and parameters: {'n_layers': 1, 'embedding_dim': 32, 'lr': 0.000639347442642887, 'lambda_val': 0.001731108880131685, 'batch_size': 809, 'optimizer': 'SGD'}. Best is trial 151 with value: 0.07582601723856444.
2026-05-18 23:41:02,078 - experiment_functions - INFO - Early stopping at epoch 1200. Best Recall: 0.0695
2026-05-18 23:41:06,615 - optuna.study.study - INFO - Trial 231 finished with value: 0.06947668064321233 and parameters: {'n_layers': 1, 'embedding_dim': 32, 'lr': 0.0013488118354736754, 'lambda_val': 0.0001563168294030787, 'batch_size': 599, 'optimizer': 'Adam'}. Best is trial 151 with value: 0.07582601723856444.
2026-05-18 23:43:17,710 - optuna.study._optimize - INFO - Trial 232 pruned. 
2026-05-18 23:44:09,511 - optuna.study._optimize - INFO - Trial 233 pruned. 
2026-05-18 23:44:59,806 - experiment_functions - INFO - Early stopping at epoch 700. Best Recall: 0.0600
2026-05-18 23:45:00,371 - optuna.study.study - INFO - Trial 234 finished with value: 0.060020854772769965 and parameters: {'n_layers': 1, 'embedding_dim': 256, 'lr': 0.0016885593653351231, 'lambda_val': 0.00013357597010477506, 'batch_size': 2081, 'optimizer': 'Adam'}. Best is trial 151 with value: 0.07582601723856444.
2026-05-18 23:46:58,411 - experiment_functions - INFO - Early stopping at epoch 1450. Best Recall: 0.0687
2026-05-18 23:46:58,511 - optuna.study.study - INFO - Trial 235 finished with value: 0.06872738868808068 and parameters: {'n_layers': 1, 'embedding_dim': 32, 'lr': 0.001096366317583345, 'lambda_val': 0.00020642421220449324, 'batch_size': 755, 'optimizer': 'Adam'}. Best is trial 151 with value: 0.07582601723856444.
2026-05-18 23:47:24,143 - optuna.study._optimize - INFO - Trial 236 pruned. 
2026-05-18 23:47:45,508 - optuna.study._optimize - INFO - Trial 237 pruned. 
2026-05-18 23:48:49,713 - experiment_functions - INFO - Early stopping at epoch 1500. Best Recall: 0.0690
2026-05-18 23:48:49,803 - optuna.study.study - INFO - Trial 238 finished with value: 0.06901585710483485 and parameters: {'n_layers': 1, 'embedding_dim': 32, 'lr': 0.0008710144509475559, 'lambda_val': 0.00012385992012139103, 'batch_size': 917, 'optimizer': 'Adam'}. Best is trial 151 with value: 0.07582601723856444.
2026-05-18 23:49:43,793 - experiment_functions - INFO - Early stopping at epoch 1100. Best Recall: 0.0720
2026-05-18 23:49:43,883 - optuna.study.study - INFO - Trial 239 finished with value: 0.07203031833804074 and parameters: {'n_layers': 1, 'embedding_dim': 32, 'lr': 0.001455602781115783, 'lambda_val': 0.000147545180619616, 'batch_size': 587, 'optimizer': 'Adam'}. Best is trial 151 with value: 0.07582601723856444.
2026-05-18 23:50:50,557 - optuna.study._optimize - INFO - Trial 240 pruned. 
2026-05-18 23:52:17,026 - optuna.study._optimize - INFO - Trial 241 pruned. 
2026-05-18 23:54:07,088 - experiment_functions - INFO - Early stopping at epoch 1300. Best Recall: 0.0685
2026-05-18 23:54:11,755 - optuna.study.study - INFO - Trial 242 finished with value: 0.06854426752666958 and parameters: {'n_layers': 1, 'embedding_dim': 32, 'lr': 0.0012342741712248928, 'lambda_val': 0.00019023009070950336, 'batch_size': 649, 'optimizer': 'Adam'}. Best is trial 151 with value: 0.07582601723856444.
2026-05-18 23:55:40,328 - optuna.study._optimize - INFO - Trial 243 pruned. 
2026-05-18 23:58:37,529 - experiment_functions - INFO - Early stopping at epoch 850. Best Recall: 0.0586
2026-05-18 23:58:37,621 - optuna.study.study - INFO - Trial 244 finished with value: 0.05859764594471105 and parameters: {'n_layers': 1, 'embedding_dim': 32, 'lr': 0.0019036519497524541, 'lambda_val': 0.00014359531126745102, 'batch_size': 737, 'optimizer': 'Adam'}. Best is trial 151 with value: 0.07582601723856444.
2026-05-18 23:58:54,171 - experiment_functions - INFO - Early stopping at epoch 1150. Best Recall: 0.0680
2026-05-18 23:58:54,261 - optuna.study.study - INFO - Trial 245 finished with value: 0.06801718879278201 and parameters: {'n_layers': 1, 'embedding_dim': 32, 'lr': 0.0014082856303937591, 'lambda_val': 0.00024388813515897583, 'batch_size': 595, 'optimizer': 'Adam'}. Best is trial 151 with value: 0.07582601723856444.
2026-05-18 23:59:13,324 - experiment_functions - INFO - Early stopping at epoch 1200. Best Recall: 0.0693
2026-05-18 23:59:13,435 - optuna.study.study - INFO - Trial 246 finished with value: 0.06928067482134029 and parameters: {'n_layers': 1, 'embedding_dim': 32, 'lr': 0.0009492969391927922, 'lambda_val': 0.017833984727441438, 'batch_size': 674, 'optimizer': 'Adam'}. Best is trial 151 with value: 0.07582601723856444.
2026-05-18 23:59:31,058 - optuna.study._optimize - INFO - Trial 247 pruned. 
2026-05-18 23:59:39,184 - experiment_functions - INFO - Early stopping at epoch 500. Best Recall: 0.0053
2026-05-18 23:59:39,286 - optuna.study.study - INFO - Trial 248 finished with value: 0.00530954661769056 and parameters: {'n_layers': 1, 'embedding_dim': 128, 'lr': 1.0198704696021056e-05, 'lambda_val': 0.00011597631560983872, 'batch_size': 578, 'optimizer': 'SGD'}. Best is trial 151 with value: 0.07582601723856444.
2026-05-19 00:00:00,309 - optuna.study._optimize - INFO - Trial 249 pruned. 
2026-05-19 00:00:16,338 - optuna.study._optimize - INFO - Trial 250 pruned. 
2026-05-19 00:00:42,226 - experiment_functions - INFO - Early stopping at epoch 1700. Best Recall: 0.0749
2026-05-19 00:00:42,318 - optuna.study.study - INFO - Trial 251 finished with value: 0.07492563488327827 and parameters: {'n_layers': 1, 'embedding_dim': 32, 'lr': 0.0006203038849777402, 'lambda_val': 0.022653617864305562, 'batch_size': 697, 'optimizer': 'RMSprop'}. Best is trial 151 with value: 0.07582601723856444.
2026-05-19 00:01:08,977 - experiment_functions - INFO - Early stopping at epoch 1750. Best Recall: 0.0720
2026-05-19 00:01:09,140 - optuna.study.study - INFO - Trial 252 finished with value: 0.07199740232645145 and parameters: {'n_layers': 1, 'embedding_dim': 32, 'lr': 0.0005844238073954435, 'lambda_val': 0.02336076408888749, 'batch_size': 732, 'optimizer': 'RMSprop'}. Best is trial 151 with value: 0.07582601723856444.
2026-05-19 00:01:33,604 - optuna.study._optimize - INFO - Trial 253 pruned. 
2026-05-19 00:01:48,094 - optuna.study._optimize - INFO - Trial 254 pruned. 
2026-05-19 00:02:02,074 - optuna.study._optimize - INFO - Trial 255 pruned. 
2026-05-19 00:02:20,308 - experiment_functions - INFO - Early stopping at epoch 1150. Best Recall: 0.0668
2026-05-19 00:02:20,398 - optuna.study.study - INFO - Trial 256 finished with value: 0.06679833532271688 and parameters: {'n_layers': 1, 'embedding_dim': 32, 'lr': 0.0006604735052888217, 'lambda_val': 0.02926195925863481, 'batch_size': 921, 'optimizer': 'RMSprop'}. Best is trial 151 with value: 0.07582601723856444.
2026-05-19 00:02:27,707 - experiment_functions - INFO - Early stopping at epoch 500. Best Recall: 0.0050
2026-05-19 00:02:27,797 - optuna.study.study - INFO - Trial 257 finished with value: 0.005028161841399088 and parameters: {'n_layers': 1, 'embedding_dim': 32, 'lr': 0.000408969489937946, 'lambda_val': 0.024836727108379152, 'batch_size': 723, 'optimizer': 'RMSprop'}. Best is trial 151 with value: 0.07582601723856444.
2026-05-19 00:02:46,629 - experiment_functions - INFO - Early stopping at epoch 1250. Best Recall: 0.0689
2026-05-19 00:02:46,719 - optuna.study.study - INFO - Trial 258 finished with value: 0.0688803364319386 and parameters: {'n_layers': 1, 'embedding_dim': 32, 'lr': 0.0007169353577017239, 'lambda_val': 0.022882702962552872, 'batch_size': 862, 'optimizer': 'RMSprop'}. Best is trial 151 with value: 0.07582601723856444.
2026-05-19 00:02:55,814 - experiment_functions - INFO - Early stopping at epoch 500. Best Recall: 0.0049
2026-05-19 00:02:55,916 - optuna.study.study - INFO - Trial 259 finished with value: 0.004903558833285504 and parameters: {'n_layers': 1, 'embedding_dim': 32, 'lr': 1.5808964381607793e-05, 'lambda_val': 0.020615130157284476, 'batch_size': 781, 'optimizer': 'RMSprop'}. Best is trial 151 with value: 0.07582601723856444.
2026-05-19 00:03:11,502 - optuna.study._optimize - INFO - Trial 260 pruned. 
2026-05-19 00:03:28,913 - experiment_functions - INFO - Early stopping at epoch 1150. Best Recall: 0.0715
2026-05-19 00:03:29,023 - optuna.study.study - INFO - Trial 261 finished with value: 0.07154630976596499 and parameters: {'n_layers': 1, 'embedding_dim': 32, 'lr': 0.0007536952105233223, 'lambda_val': 0.01994830003458528, 'batch_size': 969, 'optimizer': 'RMSprop'}. Best is trial 151 with value: 0.07582601723856444.
2026-05-19 00:03:44,378 - experiment_functions - INFO - Early stopping at epoch 850. Best Recall: 0.0653
2026-05-19 00:03:44,514 - optuna.study.study - INFO - Trial 262 finished with value: 0.06527573119948507 and parameters: {'n_layers': 1, 'embedding_dim': 32, 'lr': 0.0008639330256967854, 'lambda_val': 0.03374897809865295, 'batch_size': 973, 'optimizer': 'RMSprop'}. Best is trial 151 with value: 0.07582601723856444.
2026-05-19 00:03:59,403 - experiment_functions - INFO - Early stopping at epoch 1050. Best Recall: 0.0677
2026-05-19 00:03:59,494 - optuna.study.study - INFO - Trial 263 finished with value: 0.06770230418662816 and parameters: {'n_layers': 1, 'embedding_dim': 32, 'lr': 0.0007889129257027766, 'lambda_val': 0.04038626076765323, 'batch_size': 651, 'optimizer': 'RMSprop'}. Best is trial 151 with value: 0.07582601723856444.
2026-05-19 00:04:28,180 - experiment_functions - INFO - Early stopping at epoch 1600. Best Recall: 0.0714
2026-05-19 00:04:28,942 - optuna.study.study - INFO - Trial 264 finished with value: 0.07139351066506441 and parameters: {'n_layers': 1, 'embedding_dim': 32, 'lr': 0.0006606621282928934, 'lambda_val': 0.020867988722243692, 'batch_size': 732, 'optimizer': 'RMSprop'}. Best is trial 151 with value: 0.07582601723856444.
2026-05-19 00:04:44,814 - experiment_functions - INFO - Early stopping at epoch 550. Best Recall: 0.0157
2026-05-19 00:04:44,906 - optuna.study.study - INFO - Trial 265 finished with value: 0.015726600492115564 and parameters: {'n_layers': 4, 'embedding_dim': 256, 'lr': 0.0006584804629664163, 'lambda_val': 0.016734900406858225, 'batch_size': 802, 'optimizer': 'RMSprop'}. Best is trial 151 with value: 0.07582601723856444.
2026-05-19 00:04:59,666 - optuna.study._optimize - INFO - Trial 266 pruned. 
2026-05-19 00:05:12,720 - experiment_functions - INFO - Early stopping at epoch 900. Best Recall: 0.0618
2026-05-19 00:05:12,809 - optuna.study.study - INFO - Trial 267 finished with value: 0.06182854661582658 and parameters: {'n_layers': 1, 'embedding_dim': 32, 'lr': 0.0008608616121710273, 'lambda_val': 0.028120701895003587, 'batch_size': 939, 'optimizer': 'RMSprop'}. Best is trial 151 with value: 0.07582601723856444.
2026-05-19 00:05:38,538 - experiment_functions - INFO - Early stopping at epoch 1600. Best Recall: 0.0750
2026-05-19 00:05:38,636 - optuna.study.study - INFO - Trial 268 finished with value: 0.07501257778051729 and parameters: {'n_layers': 1, 'embedding_dim': 32, 'lr': 0.0006841342556717883, 'lambda_val': 0.019972325186211573, 'batch_size': 623, 'optimizer': 'RMSprop'}. Best is trial 151 with value: 0.07582601723856444.
2026-05-19 00:05:49,711 - experiment_functions - INFO - Early stopping at epoch 750. Best Recall: 0.0389
2026-05-19 00:05:49,881 - optuna.study.study - INFO - Trial 269 finished with value: 0.038938741411159716 and parameters: {'n_layers': 3, 'embedding_dim': 32, 'lr': 0.0006493424951741414, 'lambda_val': 0.01527848883018419, 'batch_size': 622, 'optimizer': 'RMSprop'}. Best is trial 151 with value: 0.07582601723856444.
2026-05-19 00:06:00,395 - experiment_functions - INFO - Early stopping at epoch 500. Best Recall: 0.0047
2026-05-19 00:06:00,644 - optuna.study.study - INFO - Trial 270 finished with value: 0.004678868773279062 and parameters: {'n_layers': 1, 'embedding_dim': 32, 'lr': 0.0004552954017590936, 'lambda_val': 0.01819632646065055, 'batch_size': 684, 'optimizer': 'RMSprop'}. Best is trial 151 with value: 0.07582601723856444.
2026-05-19 00:06:17,840 - optuna.study._optimize - INFO - Trial 271 pruned. 
2026-05-19 00:06:31,437 - experiment_functions - INFO - Early stopping at epoch 1000. Best Recall: 0.0673
2026-05-19 00:06:31,527 - optuna.study.study - INFO - Trial 272 finished with value: 0.06726244933682497 and parameters: {'n_layers': 1, 'embedding_dim': 32, 'lr': 0.0009186971138358633, 'lambda_val': 0.020483000461969065, 'batch_size': 715, 'optimizer': 'RMSprop'}. Best is trial 151 with value: 0.07582601723856444.
2026-05-19 00:06:48,509 - experiment_functions - INFO - Early stopping at epoch 750. Best Recall: 0.0575
2026-05-19 00:06:48,620 - optuna.study.study - INFO - Trial 273 finished with value: 0.05747650457934949 and parameters: {'n_layers': 1, 'embedding_dim': 32, 'lr': 0.0007802827252954377, 'lambda_val': 7.589611854749552e-05, 'batch_size': 3812, 'optimizer': 'RMSprop'}. Best is trial 151 with value: 0.07582601723856444.
2026-05-19 00:07:10,799 - experiment_functions - INFO - Early stopping at epoch 1600. Best Recall: 0.0696
2026-05-19 00:07:10,888 - optuna.study.study - INFO - Trial 274 finished with value: 0.06962264375276303 and parameters: {'n_layers': 1, 'embedding_dim': 32, 'lr': 0.0006888223666022145, 'lambda_val': 0.015347003226520542, 'batch_size': 605, 'optimizer': 'RMSprop'}. Best is trial 151 with value: 0.07582601723856444.
2026-05-19 00:07:18,385 - experiment_functions - INFO - Early stopping at epoch 500. Best Recall: 0.0051
2026-05-19 00:07:18,486 - optuna.study.study - INFO - Trial 275 finished with value: 0.005058980063520995 and parameters: {'n_layers': 1, 'embedding_dim': 128, 'lr': 0.00035749165611450234, 'lambda_val': 0.028590994240078542, 'batch_size': 747, 'optimizer': 'RMSprop'}. Best is trial 151 with value: 0.07582601723856444.
2026-05-19 00:07:39,475 - experiment_functions - INFO - Early stopping at epoch 850. Best Recall: 0.0057
2026-05-19 00:07:39,575 - optuna.study.study - INFO - Trial 276 finished with value: 0.005682830983234872 and parameters: {'n_layers': 1, 'embedding_dim': 32, 'lr': 6.262526979591759e-05, 'lambda_val': 9.576064797271744e-05, 'batch_size': 664, 'optimizer': 'RMSprop'}. Best is trial 151 with value: 0.07582601723856444.
2026-05-19 00:07:53,970 - experiment_functions - INFO - Early stopping at epoch 850. Best Recall: 0.0626
2026-05-19 00:07:54,088 - optuna.study.study - INFO - Trial 277 finished with value: 0.06258671170037264 and parameters: {'n_layers': 1, 'embedding_dim': 64, 'lr': 0.0009182120088802855, 'lambda_val': 0.019507283326815245, 'batch_size': 778, 'optimizer': 'RMSprop'}. Best is trial 151 with value: 0.07582601723856444.
2026-05-19 00:08:08,024 - optuna.study._optimize - INFO - Trial 278 pruned. 
2026-05-19 00:08:30,128 - experiment_functions - INFO - Early stopping at epoch 1350. Best Recall: 0.0722
2026-05-19 00:08:30,230 - optuna.study.study - INFO - Trial 279 finished with value: 0.07224895823548176 and parameters: {'n_layers': 1, 'embedding_dim': 32, 'lr': 0.0007502509902678037, 'lambda_val': 0.0165268231663809, 'batch_size': 657, 'optimizer': 'RMSprop'}. Best is trial 151 with value: 0.07582601723856444.
2026-05-19 00:09:00,130 - experiment_functions - INFO - Early stopping at epoch 1450. Best Recall: 0.0688
2026-05-19 00:09:00,208 - optuna.study.study - INFO - Trial 280 finished with value: 0.06884744365670152 and parameters: {'n_layers': 1, 'embedding_dim': 32, 'lr': 0.0007008167700966163, 'lambda_val': 0.013783834143753983, 'batch_size': 860, 'optimizer': 'RMSprop'}. Best is trial 151 with value: 0.07582601723856444.
2026-05-19 00:09:15,548 - experiment_functions - INFO - Early stopping at epoch 1000. Best Recall: 0.0667
2026-05-19 00:09:15,651 - optuna.study.study - INFO - Trial 281 finished with value: 0.06669991622831044 and parameters: {'n_layers': 1, 'embedding_dim': 32, 'lr': 0.0008400191250226686, 'lambda_val': 0.021172115336463213, 'batch_size': 719, 'optimizer': 'RMSprop'}. Best is trial 151 with value: 0.07582601723856444.
2026-05-19 00:09:30,181 - optuna.study._optimize - INFO - Trial 282 pruned. 
2026-05-19 00:09:51,932 - experiment_functions - INFO - Early stopping at epoch 1500. Best Recall: 0.0697
2026-05-19 00:09:53,249 - optuna.study.study - INFO - Trial 283 finished with value: 0.06973794886703516 and parameters: {'n_layers': 1, 'embedding_dim': 32, 'lr': 0.0006083868224816565, 'lambda_val': 0.01486043350909716, 'batch_size': 903, 'optimizer': 'RMSprop'}. Best is trial 151 with value: 0.07582601723856444.
2026-05-19 00:10:10,167 - optuna.study._optimize - INFO - Trial 284 pruned. 
2026-05-19 00:10:21,598 - experiment_functions - INFO - Early stopping at epoch 500. Best Recall: 0.0050
2026-05-19 00:10:21,697 - optuna.study.study - INFO - Trial 285 finished with value: 0.004958303061730101 and parameters: {'n_layers': 1, 'embedding_dim': 32, 'lr': 0.0004453173111454261, 'lambda_val': 0.02567820163320672, 'batch_size': 718, 'optimizer': 'RMSprop'}. Best is trial 151 with value: 0.07582601723856444.
2026-05-19 00:10:37,558 - optuna.study._optimize - INFO - Trial 286 pruned. 
2026-05-19 00:10:44,864 - experiment_functions - INFO - Early stopping at epoch 500. Best Recall: 0.0051
2026-05-19 00:10:46,703 - optuna.study.study - INFO - Trial 287 finished with value: 0.005097746371998007 and parameters: {'n_layers': 1, 'embedding_dim': 32, 'lr': 0.000658117567166133, 'lambda_val': 0.018154692050541415, 'batch_size': 976, 'optimizer': 'SGD'}. Best is trial 151 with value: 0.07582601723856444.
2026-05-19 00:11:17,668 - optuna.study._optimize - INFO - Trial 288 pruned. 
2026-05-19 00:11:46,316 - experiment_functions - INFO - Early stopping at epoch 1350. Best Recall: 0.0687
2026-05-19 00:11:46,451 - optuna.study.study - INFO - Trial 289 finished with value: 0.06871717465562924 and parameters: {'n_layers': 1, 'embedding_dim': 32, 'lr': 0.0009627115254319315, 'lambda_val': 2.844759523381266e-05, 'batch_size': 710, 'optimizer': 'RMSprop'}. Best is trial 151 with value: 0.07582601723856444.
2026-05-19 00:12:01,771 - optuna.study._optimize - INFO - Trial 290 pruned. 
2026-05-19 00:12:08,938 - experiment_functions - INFO - Early stopping at epoch 500. Best Recall: 0.0058
2026-05-19 00:12:09,029 - optuna.study.study - INFO - Trial 291 finished with value: 0.005823495049217383 and parameters: {'n_layers': 1, 'embedding_dim': 32, 'lr': 0.0005092486678175655, 'lambda_val': 0.018317067938325, 'batch_size': 607, 'optimizer': 'RMSprop'}. Best is trial 151 with value: 0.07582601723856444.
2026-05-19 00:12:25,976 - optuna.study._optimize - INFO - Trial 292 pruned. 
2026-05-19 00:13:14,660 - experiment_functions - INFO - Early stopping at epoch 3250. Best Recall: 0.0723
2026-05-19 00:13:14,759 - optuna.study.study - INFO - Trial 293 finished with value: 0.07233674052356259 and parameters: {'n_layers': 1, 'embedding_dim': 32, 'lr': 0.0007127272773092596, 'lambda_val': 0.00019942192880972943, 'batch_size': 673, 'optimizer': 'RMSprop'}. Best is trial 151 with value: 0.07582601723856444.
2026-05-19 00:13:34,870 - optuna.study._optimize - INFO - Trial 294 pruned. 
