2026-05-18 04:02:29,583 - optuna.study.study - INFO - Trial 21 finished with value: 0.04945023703411929 and parameters: {'n_layers': 1, 'embedding_dim': 256, 'lr': 0.0011304440038123582, 'lambda_val': 0.008675349572573725, 'batch_size': 2502, 'optimizer': 'RMSprop'}. Best is trial 11 with value: 0.05659095175911454.
2026-05-18 04:02:38,247 - experiment_functions - INFO - Early stopping at epoch 550. Best Recall: 0.0440
2026-05-18 04:02:38,347 - optuna.study.study - INFO - Trial 22 finished with value: 0.04400678640775309 and parameters: {'n_layers': 1, 'embedding_dim': 256, 'lr': 0.0017233416384177603, 'lambda_val': 0.006102237879613015, 'batch_size': 1880, 'optimizer': 'RMSprop'}. Best is trial 11 with value: 0.05659095175911454.
2026-05-18 04:02:54,957 - experiment_functions - INFO - Early stopping at epoch 1100. Best Recall: 0.0348
2026-05-18 04:02:55,069 - optuna.study.study - INFO - Trial 23 finished with value: 0.03480722712835777 and parameters: {'n_layers': 1, 'embedding_dim': 256, 'lr': 0.003898502152472746, 'lambda_val': 0.0011124791919225345, 'batch_size': 2306, 'optimizer': 'RMSprop'}. Best is trial 11 with value: 0.05659095175911454.
2026-05-18 04:03:07,806 - experiment_functions - INFO - Early stopping at epoch 750. Best Recall: 0.0414
2026-05-18 04:03:07,951 - optuna.study.study - INFO - Trial 24 finished with value: 0.041435521496101295 and parameters: {'n_layers': 2, 'embedding_dim': 256, 'lr': 0.00040591378912282886, 'lambda_val': 0.024729925308202585, 'batch_size': 1610, 'optimizer': 'RMSprop'}. Best is trial 11 with value: 0.05659095175911454.
2026-05-18 04:03:18,803 - experiment_functions - INFO - Early stopping at epoch 750. Best Recall: 0.0502
2026-05-18 04:03:18,892 - optuna.study.study - INFO - Trial 25 finished with value: 0.050243394325885156 and parameters: {'n_layers': 1, 'embedding_dim': 64, 'lr': 0.0009319327302989721, 'lambda_val': 0.005545398701620899, 'batch_size': 2100, 'optimizer': 'RMSprop'}. Best is trial 11 with value: 0.05659095175911454.
2026-05-18 04:03:33,637 - optuna.study._optimize - INFO - Trial 26 pruned. 
2026-05-18 04:03:47,337 - optuna.study._optimize - INFO - Trial 27 pruned. 
2026-05-18 04:04:03,991 - experiment_functions - INFO - Early stopping at epoch 500. Best Recall: 0.0055
2026-05-18 04:04:04,755 - optuna.study.study - INFO - Trial 28 finished with value: 0.005506214326510442 and parameters: {'n_layers': 3, 'embedding_dim': 64, 'lr': 6.0396771216360585e-05, 'lambda_val': 0.09502509526974377, 'batch_size': 1798, 'optimizer': 'Adam'}. Best is trial 11 with value: 0.05659095175911454.
2026-05-18 04:04:12,241 - experiment_functions - INFO - Early stopping at epoch 500. Best Recall: 0.0057
2026-05-18 04:04:12,339 - optuna.study.study - INFO - Trial 29 finished with value: 0.00571322964710044 and parameters: {'n_layers': 1, 'embedding_dim': 64, 'lr': 0.0026389462693971345, 'lambda_val': 0.00269138822625556, 'batch_size': 2037, 'optimizer': 'SGD'}. Best is trial 11 with value: 0.05659095175911454.
2026-05-18 04:04:32,649 - experiment_functions - INFO - Early stopping at epoch 1450. Best Recall: 0.0645
2026-05-18 04:04:32,742 - optuna.study.study - INFO - Trial 30 finished with value: 0.06445190031949083 and parameters: {'n_layers': 1, 'embedding_dim': 64, 'lr': 0.0008082477651671475, 'lambda_val': 0.00453783592812995, 'batch_size': 856, 'optimizer': 'Adam'}. Best is trial 30 with value: 0.06445190031949083.
2026-05-18 04:05:02,904 - experiment_functions - INFO - Early stopping at epoch 2200. Best Recall: 0.0647
2026-05-18 04:05:03,218 - optuna.study.study - INFO - Trial 31 finished with value: 0.06470357467796602 and parameters: {'n_layers': 1, 'embedding_dim': 64, 'lr': 0.0006573957528087138, 'lambda_val': 0.0038249101364136143, 'batch_size': 872, 'optimizer': 'Adam'}. Best is trial 31 with value: 0.06470357467796602.
2026-05-18 04:05:19,096 - optuna.study._optimize - INFO - Trial 32 pruned. 
2026-05-18 04:05:31,558 - experiment_functions - INFO - Early stopping at epoch 850. Best Recall: 0.0619
2026-05-18 04:05:31,650 - optuna.study.study - INFO - Trial 33 finished with value: 0.06190196581947871 and parameters: {'n_layers': 1, 'embedding_dim': 64, 'lr': 0.0015315814434887234, 'lambda_val': 0.0032828038405897752, 'batch_size': 921, 'optimizer': 'Adam'}. Best is trial 31 with value: 0.06470357467796602.
2026-05-18 04:05:51,332 - experiment_functions - INFO - Early stopping at epoch 900. Best Recall: 0.0615
2026-05-18 04:05:52,107 - optuna.study.study - INFO - Trial 34 finished with value: 0.06146261606608415 and parameters: {'n_layers': 1, 'embedding_dim': 64, 'lr': 0.0014484486962430942, 'lambda_val': 0.0030925619887184662, 'batch_size': 936, 'optimizer': 'Adam'}. Best is trial 31 with value: 0.06470357467796602.
2026-05-18 04:06:03,943 - experiment_functions - INFO - Early stopping at epoch 600. Best Recall: 0.0583
2026-05-18 04:06:04,045 - optuna.study.study - INFO - Trial 35 finished with value: 0.05830465527466037 and parameters: {'n_layers': 1, 'embedding_dim': 64, 'lr': 0.00589403695441829, 'lambda_val': 0.002809687711052407, 'batch_size': 932, 'optimizer': 'Adam'}. Best is trial 31 with value: 0.06470357467796602.
2026-05-18 04:06:14,482 - experiment_functions - INFO - Early stopping at epoch 700. Best Recall: 0.0571
2026-05-18 04:06:14,583 - optuna.study.study - INFO - Trial 36 finished with value: 0.057103818478105514 and parameters: {'n_layers': 1, 'embedding_dim': 64, 'lr': 0.0020074690670565357, 'lambda_val': 0.017717335668009322, 'batch_size': 979, 'optimizer': 'Adam'}. Best is trial 31 with value: 0.06470357467796602.
2026-05-18 04:06:28,289 - experiment_functions - INFO - Early stopping at epoch 750. Best Recall: 0.0549
2026-05-18 04:06:28,434 - optuna.study.study - INFO - Trial 37 finished with value: 0.05485643515604589 and parameters: {'n_layers': 2, 'embedding_dim': 64, 'lr': 0.0013091174149644795, 'lambda_val': 0.0002879376735265816, 'batch_size': 724, 'optimizer': 'Adam'}. Best is trial 31 with value: 0.06470357467796602.
2026-05-18 04:06:38,667 - experiment_functions - INFO - Early stopping at epoch 650. Best Recall: 0.0614
2026-05-18 04:06:38,801 - optuna.study.study - INFO - Trial 38 finished with value: 0.061367230909223566 and parameters: {'n_layers': 1, 'embedding_dim': 64, 'lr': 0.003501855740822953, 'lambda_val': 0.000669314706590735, 'batch_size': 1046, 'optimizer': 'Adam'}. Best is trial 31 with value: 0.06470357467796602.
2026-05-18 04:06:47,474 - experiment_functions - INFO - Early stopping at epoch 550. Best Recall: 0.0125
2026-05-18 04:06:47,563 - optuna.study.study - INFO - Trial 39 finished with value: 0.012539063521121482 and parameters: {'n_layers': 4, 'embedding_dim': 64, 'lr': 0.010174132736998237, 'lambda_val': 0.0013428121527914354, 'batch_size': 552, 'optimizer': 'Adam'}. Best is trial 31 with value: 0.06470357467796602.
2026-05-18 04:07:09,750 - experiment_functions - INFO - Early stopping at epoch 1600. Best Recall: 0.0632
2026-05-18 04:07:09,849 - optuna.study.study - INFO - Trial 40 finished with value: 0.06319097943676964 and parameters: {'n_layers': 1, 'embedding_dim': 96, 'lr': 0.00087852545885911, 'lambda_val': 8.843782178074384e-05, 'batch_size': 789, 'optimizer': 'Adam'}. Best is trial 31 with value: 0.06470357467796602.
2026-05-18 04:07:44,832 - experiment_functions - INFO - Early stopping at epoch 2600. Best Recall: 0.0652
2026-05-18 04:07:44,981 - optuna.study.study - INFO - Trial 41 finished with value: 0.0651925925868279 and parameters: {'n_layers': 1, 'embedding_dim': 96, 'lr': 0.0006761358901827594, 'lambda_val': 9.867728895846706e-05, 'batch_size': 772, 'optimizer': 'Adam'}. Best is trial 41 with value: 0.0651925925868279.
2026-05-18 04:08:16,339 - experiment_functions - INFO - Early stopping at epoch 2250. Best Recall: 0.0649
2026-05-18 04:08:16,446 - optuna.study.study - INFO - Trial 42 finished with value: 0.06489591181625808 and parameters: {'n_layers': 1, 'embedding_dim': 96, 'lr': 0.0006462804293142478, 'lambda_val': 4.9245755674292604e-05, 'batch_size': 796, 'optimizer': 'Adam'}. Best is trial 41 with value: 0.0651925925868279.
2026-05-18 04:08:47,546 - experiment_functions - INFO - Early stopping at epoch 2350. Best Recall: 0.0658
2026-05-18 04:08:47,635 - optuna.study.study - INFO - Trial 43 finished with value: 0.06579360267897888 and parameters: {'n_layers': 1, 'embedding_dim': 96, 'lr': 0.0008175058444556109, 'lambda_val': 8.925632217170135e-05, 'batch_size': 514, 'optimizer': 'Adam'}. Best is trial 43 with value: 0.06579360267897888.
2026-05-18 04:09:17,584 - experiment_functions - INFO - Early stopping at epoch 2100. Best Recall: 0.0665
2026-05-18 04:09:17,724 - optuna.study.study - INFO - Trial 44 finished with value: 0.066524779347258 and parameters: {'n_layers': 1, 'embedding_dim': 96, 'lr': 0.0007782317596859844, 'lambda_val': 2.822286286014712e-05, 'batch_size': 558, 'optimizer': 'Adam'}. Best is trial 44 with value: 0.066524779347258.
2026-05-18 04:09:33,402 - optuna.study._optimize - INFO - Trial 45 pruned. 
2026-05-18 04:09:46,885 - optuna.study._optimize - INFO - Trial 46 pruned. 
2026-05-18 04:10:00,194 - optuna.study._optimize - INFO - Trial 47 pruned. 
2026-05-18 04:10:14,441 - experiment_functions - INFO - Early stopping at epoch 900. Best Recall: 0.0480
2026-05-18 04:10:14,531 - optuna.study.study - INFO - Trial 48 finished with value: 0.04795853747756562 and parameters: {'n_layers': 3, 'embedding_dim': 96, 'lr': 0.0006171699687872321, 'lambda_val': 1.72312567548863e-05, 'batch_size': 664, 'optimizer': 'Adam'}. Best is trial 44 with value: 0.066524779347258.
2026-05-18 04:10:25,513 - experiment_functions - INFO - Early stopping at epoch 750. Best Recall: 0.0585
2026-05-18 04:10:25,614 - optuna.study.study - INFO - Trial 49 finished with value: 0.05852605828562083 and parameters: {'n_layers': 1, 'embedding_dim': 96, 'lr': 0.0026645203552366197, 'lambda_val': 9.933847275572868e-05, 'batch_size': 525, 'optimizer': 'Adam'}. Best is trial 44 with value: 0.066524779347258.
2026-05-18 04:10:40,139 - optuna.study._optimize - INFO - Trial 50 pruned. 
2026-05-18 04:10:59,313 - optuna.study._optimize - INFO - Trial 51 pruned. 
2026-05-18 04:11:18,606 - optuna.study._optimize - INFO - Trial 52 pruned. 
2026-05-18 04:11:30,937 - optuna.study._optimize - INFO - Trial 53 pruned. 
2026-05-18 04:11:43,613 - optuna.study._optimize - INFO - Trial 54 pruned. 
2026-05-18 04:12:05,557 - optuna.study._optimize - INFO - Trial 55 pruned. 
2026-05-18 04:12:12,949 - experiment_functions - INFO - Early stopping at epoch 500. Best Recall: 0.0057
2026-05-18 04:12:13,094 - optuna.study.study - INFO - Trial 56 finished with value: 0.005660195033344648 and parameters: {'n_layers': 1, 'embedding_dim': 32, 'lr': 0.00013569110960878351, 'lambda_val': 2.131848564541907e-05, 'batch_size': 826, 'optimizer': 'SGD'}. Best is trial 44 with value: 0.066524779347258.
2026-05-18 04:12:24,232 - experiment_functions - INFO - Early stopping at epoch 750. Best Recall: 0.0546
2026-05-18 04:12:24,311 - optuna.study.study - INFO - Trial 57 finished with value: 0.05456981931245428 and parameters: {'n_layers': 2, 'embedding_dim': 96, 'lr': 0.0010823535021844471, 'lambda_val': 0.0001528175540154867, 'batch_size': 1206, 'optimizer': 'Adam'}. Best is trial 44 with value: 0.066524779347258.
2026-05-18 04:12:37,814 - optuna.study._optimize - INFO - Trial 58 pruned. 
2026-05-18 04:12:49,907 - experiment_functions - INFO - Early stopping at epoch 650. Best Recall: 0.0572
2026-05-18 04:12:49,998 - optuna.study.study - INFO - Trial 59 finished with value: 0.057223444673953135 and parameters: {'n_layers': 1, 'embedding_dim': 128, 'lr': 0.002333914607745769, 'lambda_val': 0.00023263961824524388, 'batch_size': 2887, 'optimizer': 'Adam'}. Best is trial 44 with value: 0.066524779347258.
2026-05-18 04:13:02,160 - experiment_functions - INFO - Early stopping at epoch 800. Best Recall: 0.0485
2026-05-18 04:13:02,261 - optuna.study.study - INFO - Trial 60 finished with value: 0.048520821141075185 and parameters: {'n_layers': 2, 'embedding_dim': 96, 'lr': 0.0008173812632428827, 'lambda_val': 0.00013844618085723326, 'batch_size': 1415, 'optimizer': 'Adam'}. Best is trial 44 with value: 0.066524779347258.
2026-05-18 04:13:22,800 - optuna.study._optimize - INFO - Trial 61 pruned. 
2026-05-18 04:13:37,968 - optuna.study._optimize - INFO - Trial 62 pruned. 
2026-05-18 04:13:51,288 - optuna.study._optimize - INFO - Trial 63 pruned. 
2026-05-18 04:13:58,569 - experiment_functions - INFO - Early stopping at epoch 500. Best Recall: 0.0048
2026-05-18 04:13:58,669 - optuna.study.study - INFO - Trial 64 finished with value: 0.004751793123969523 and parameters: {'n_layers': 1, 'embedding_dim': 32, 'lr': 0.0018150212556212683, 'lambda_val': 0.00010094939097176549, 'batch_size': 514, 'optimizer': 'SGD'}. Best is trial 44 with value: 0.066524779347258.
2026-05-18 04:14:14,781 - optuna.study._optimize - INFO - Trial 65 pruned. 
2026-05-18 04:14:27,708 - optuna.study._optimize - INFO - Trial 66 pruned. 
2026-05-18 04:14:37,307 - experiment_functions - INFO - Early stopping at epoch 650. Best Recall: 0.0547
2026-05-18 04:14:37,397 - optuna.study.study - INFO - Trial 67 finished with value: 0.05473076201774836 and parameters: {'n_layers': 1, 'embedding_dim': 96, 'lr': 0.0034110124804426108, 'lambda_val': 0.00017335026223781088, 'batch_size': 1542, 'optimizer': 'Adam'}. Best is trial 44 with value: 0.066524779347258.
2026-05-18 04:14:48,103 - experiment_functions - INFO - Early stopping at epoch 700. Best Recall: 0.0531
2026-05-18 04:14:48,244 - optuna.study.study - INFO - Trial 68 finished with value: 0.05312315506532302 and parameters: {'n_layers': 1, 'embedding_dim': 96, 'lr': 0.0013442805549812144, 'lambda_val': 0.00012199550491943558, 'batch_size': 3970, 'optimizer': 'Adam'}. Best is trial 44 with value: 0.066524779347258.
2026-05-18 04:15:03,796 - optuna.study._optimize - INFO - Trial 69 pruned. 
2026-05-18 04:15:11,872 - experiment_functions - INFO - Early stopping at epoch 500. Best Recall: 0.0051
2026-05-18 04:15:11,972 - optuna.study.study - INFO - Trial 70 finished with value: 0.00508749453824438 and parameters: {'n_layers': 3, 'embedding_dim': 128, 'lr': 0.0002654386379702922, 'lambda_val': 0.0007648941124503758, 'batch_size': 1311, 'optimizer': 'SGD'}. Best is trial 44 with value: 0.066524779347258.
2026-05-18 04:15:24,159 - experiment_functions - INFO - Early stopping at epoch 800. Best Recall: 0.0632
2026-05-18 04:15:24,248 - optuna.study.study - INFO - Trial 71 finished with value: 0.06316042070986437 and parameters: {'n_layers': 1, 'embedding_dim': 64, 'lr': 0.0015897158277470784, 'lambda_val': 0.004366749030866734, 'batch_size': 962, 'optimizer': 'Adam'}. Best is trial 44 with value: 0.066524779347258.
2026-05-18 04:15:36,330 - experiment_functions - INFO - Early stopping at epoch 850. Best Recall: 0.0589
2026-05-18 04:15:36,431 - optuna.study.study - INFO - Trial 72 finished with value: 0.05892346789192693 and parameters: {'n_layers': 1, 'embedding_dim': 64, 'lr': 0.0018460307836181676, 'lambda_val': 0.005125399959443293, 'batch_size': 660, 'optimizer': 'Adam'}. Best is trial 44 with value: 0.066524779347258.
2026-05-18 04:15:50,706 - experiment_functions - INFO - Early stopping at epoch 1000. Best Recall: 0.0615
2026-05-18 04:15:50,795 - optuna.study.study - INFO - Trial 73 finished with value: 0.06149977286571652 and parameters: {'n_layers': 1, 'embedding_dim': 64, 'lr': 0.0010428795269472292, 'lambda_val': 0.011206281168210036, 'batch_size': 875, 'optimizer': 'Adam'}. Best is trial 44 with value: 0.066524779347258.
2026-05-18 04:16:07,114 - optuna.study._optimize - INFO - Trial 74 pruned. 
2026-05-18 04:16:16,108 - experiment_functions - INFO - Early stopping at epoch 600. Best Recall: 0.0534
2026-05-18 04:16:16,188 - optuna.study.study - INFO - Trial 75 finished with value: 0.05337255823520916 and parameters: {'n_layers': 1, 'embedding_dim': 64, 'lr': 0.004477554731105092, 'lambda_val': 0.0018932483910568544, 'batch_size': 927, 'optimizer': 'Adam'}. Best is trial 44 with value: 0.066524779347258.
2026-05-18 04:16:23,610 - experiment_functions - INFO - Early stopping at epoch 500. Best Recall: 0.0050
2026-05-18 04:16:23,702 - optuna.study.study - INFO - Trial 76 finished with value: 0.005001142174739564 and parameters: {'n_layers': 1, 'embedding_dim': 32, 'lr': 0.0006903462371134933, 'lambda_val': 0.019507402795269874, 'batch_size': 616, 'optimizer': 'Adam'}. Best is trial 44 with value: 0.066524779347258.
2026-05-18 04:16:37,983 - experiment_functions - INFO - Early stopping at epoch 950. Best Recall: 0.0662
2026-05-18 04:16:38,081 - optuna.study.study - INFO - Trial 77 finished with value: 0.06615477666342233 and parameters: {'n_layers': 1, 'embedding_dim': 64, 'lr': 0.0013945044720736547, 'lambda_val': 0.002068318189316072, 'batch_size': 755, 'optimizer': 'Adam'}. Best is trial 44 with value: 0.066524779347258.
2026-05-18 04:16:50,459 - experiment_functions - INFO - Early stopping at epoch 750. Best Recall: 0.0636
2026-05-18 04:16:50,550 - optuna.study.study - INFO - Trial 78 finished with value: 0.06359842718909804 and parameters: {'n_layers': 1, 'embedding_dim': 96, 'lr': 0.002526564634609577, 'lambda_val': 2.2915102233548504e-05, 'batch_size': 749, 'optimizer': 'Adam'}. Best is trial 44 with value: 0.066524779347258.
2026-05-18 04:16:58,820 - experiment_functions - INFO - Early stopping at epoch 500. Best Recall: 0.0053
2026-05-18 04:16:58,910 - optuna.study.study - INFO - Trial 79 finished with value: 0.0052543878499231415 and parameters: {'n_layers': 4, 'embedding_dim': 64, 'lr': 1.0973929048553073e-05, 'lambda_val': 0.00769665824770268, 'batch_size': 748, 'optimizer': 'Adam'}. Best is trial 44 with value: 0.066524779347258.
2026-05-18 04:17:08,600 - experiment_functions - INFO - Early stopping at epoch 600. Best Recall: 0.0510
2026-05-18 04:17:08,691 - optuna.study.study - INFO - Trial 80 finished with value: 0.051013988181410425 and parameters: {'n_layers': 1, 'embedding_dim': 96, 'lr': 0.006963440260493044, 'lambda_val': 3.3193364268245314e-06, 'batch_size': 619, 'optimizer': 'Adam'}. Best is trial 44 with value: 0.066524779347258.
2026-05-18 04:17:25,076 - experiment_functions - INFO - Early stopping at epoch 1100. Best Recall: 0.0638
2026-05-18 04:17:25,228 - optuna.study.study - INFO - Trial 81 finished with value: 0.06379582564407325 and parameters: {'n_layers': 1, 'embedding_dim': 96, 'lr': 0.0011592130741387022, 'lambda_val': 2.219729650865863e-05, 'batch_size': 722, 'optimizer': 'Adam'}. Best is trial 44 with value: 0.066524779347258.
2026-05-18 04:17:43,542 - experiment_functions - INFO - Early stopping at epoch 1250. Best Recall: 0.0634
2026-05-18 04:17:43,706 - optuna.study.study - INFO - Trial 82 finished with value: 0.06341278765857002 and parameters: {'n_layers': 1, 'embedding_dim': 96, 'lr': 0.0012182486106536664, 'lambda_val': 2.131292880159505e-05, 'batch_size': 517, 'optimizer': 'Adam'}. Best is trial 44 with value: 0.066524779347258.
2026-05-18 04:17:55,407 - experiment_functions - INFO - Early stopping at epoch 750. Best Recall: 0.0604
2026-05-18 04:17:55,486 - optuna.study.study - INFO - Trial 83 finished with value: 0.06041994695762394 and parameters: {'n_layers': 1, 'embedding_dim': 96, 'lr': 0.0023190824340530267, 'lambda_val': 1.6034608481646965e-05, 'batch_size': 739, 'optimizer': 'Adam'}. Best is trial 44 with value: 0.066524779347258.
2026-05-18 04:18:05,481 - experiment_functions - INFO - Early stopping at epoch 650. Best Recall: 0.0519
2026-05-18 04:18:05,617 - optuna.study.study - INFO - Trial 84 finished with value: 0.051945467006126976 and parameters: {'n_layers': 1, 'embedding_dim': 96, 'lr': 0.0028001321109361807, 'lambda_val': 3.039022062516703e-05, 'batch_size': 3181, 'optimizer': 'Adam'}. Best is trial 44 with value: 0.066524779347258.
2026-05-18 04:18:25,604 - experiment_functions - INFO - Early stopping at epoch 850. Best Recall: 0.0618
2026-05-18 04:18:26,370 - optuna.study.study - INFO - Trial 85 finished with value: 0.061839872315774175 and parameters: {'n_layers': 1, 'embedding_dim': 96, 'lr': 0.0014610885790730388, 'lambda_val': 0.0020427773288359194, 'batch_size': 1017, 'optimizer': 'Adam'}. Best is trial 44 with value: 0.066524779347258.
2026-05-18 04:18:40,341 - experiment_functions - INFO - Early stopping at epoch 800. Best Recall: 0.0617
2026-05-18 04:18:40,439 - optuna.study.study - INFO - Trial 86 finished with value: 0.06171842297222125 and parameters: {'n_layers': 1, 'embedding_dim': 64, 'lr': 0.0020866353597852874, 'lambda_val': 6.730823074715413e-05, 'batch_size': 836, 'optimizer': 'Adam'}. Best is trial 44 with value: 0.066524779347258.
2026-05-18 04:18:55,204 - optuna.study._optimize - INFO - Trial 87 pruned. 
2026-05-18 04:19:02,680 - experiment_functions - INFO - Early stopping at epoch 500. Best Recall: 0.0048
2026-05-18 04:19:02,790 - optuna.study.study - INFO - Trial 88 finished with value: 0.004789460136995244 and parameters: {'n_layers': 1, 'embedding_dim': 64, 'lr': 0.0006762073671551605, 'lambda_val': 0.0010149182123734238, 'batch_size': 593, 'optimizer': 'SGD'}. Best is trial 44 with value: 0.066524779347258.
2026-05-18 04:19:19,720 - optuna.study._optimize - INFO - Trial 89 pruned. 
2026-05-18 04:19:34,345 - optuna.study._optimize - INFO - Trial 90 pruned. 
2026-05-18 04:19:42,455 - experiment_functions - INFO - Early stopping at epoch 550. Best Recall: 0.0278
2026-05-18 04:19:42,524 - optuna.study.study - INFO - Trial 91 finished with value: 0.027788252199173 and parameters: {'n_layers': 1, 'embedding_dim': 96, 'lr': 0.0221709640344765, 'lambda_val': 2.2818657762316064e-05, 'batch_size': 538, 'optimizer': 'Adam'}. Best is trial 44 with value: 0.066524779347258.
2026-05-18 04:19:56,693 - experiment_functions - INFO - Early stopping at epoch 1000. Best Recall: 0.0602
