2026-05-18 04:19:56,796 - optuna.study.study - INFO - Trial 92 finished with value: 0.060214292641536035 and parameters: {'n_layers': 1, 'embedding_dim': 96, 'lr': 0.0012701769475898686, 'lambda_val': 2.0661627671166447e-05, 'batch_size': 689, 'optimizer': 'Adam'}. Best is trial 44 with value: 0.066524779347258.
2026-05-18 04:20:06,164 - experiment_functions - INFO - Early stopping at epoch 650. Best Recall: 0.0568
2026-05-18 04:20:06,254 - optuna.study.study - INFO - Trial 93 finished with value: 0.056845266097652655 and parameters: {'n_layers': 1, 'embedding_dim': 96, 'lr': 0.002880811004765411, 'lambda_val': 1.4738286641500998e-05, 'batch_size': 1090, 'optimizer': 'Adam'}. Best is trial 44 with value: 0.066524779347258.
2026-05-18 04:20:22,014 - optuna.study._optimize - INFO - Trial 94 pruned. 
2026-05-18 04:20:36,584 - optuna.study._optimize - INFO - Trial 95 pruned. 
2026-05-18 04:20:52,097 - experiment_functions - INFO - Early stopping at epoch 1100. Best Recall: 0.0627
2026-05-18 04:20:52,177 - optuna.study.study - INFO - Trial 96 finished with value: 0.06265793124403386 and parameters: {'n_layers': 1, 'embedding_dim': 96, 'lr': 0.0011819828351516566, 'lambda_val': 5.267976973091524e-05, 'batch_size': 707, 'optimizer': 'Adam'}. Best is trial 44 with value: 0.066524779347258.
2026-05-18 04:21:06,285 - experiment_functions - INFO - Early stopping at epoch 1000. Best Recall: 0.0645
2026-05-18 04:21:06,365 - optuna.study.study - INFO - Trial 97 finished with value: 0.0644768136274866 and parameters: {'n_layers': 1, 'embedding_dim': 32, 'lr': 0.001709384960730665, 'lambda_val': 3.579357422002963e-05, 'batch_size': 526, 'optimizer': 'Adam'}. Best is trial 44 with value: 0.066524779347258.
2026-05-18 04:21:19,605 - experiment_functions - INFO - Early stopping at epoch 900. Best Recall: 0.0651
2026-05-18 04:21:19,705 - optuna.study.study - INFO - Trial 98 finished with value: 0.06505453813176959 and parameters: {'n_layers': 1, 'embedding_dim': 32, 'lr': 0.0016771341017266165, 'lambda_val': 3.8799275196004425e-05, 'batch_size': 981, 'optimizer': 'Adam'}. Best is trial 44 with value: 0.066524779347258.
2026-05-18 04:21:33,496 - experiment_functions - INFO - Early stopping at epoch 950. Best Recall: 0.0639
2026-05-18 04:21:33,599 - optuna.study.study - INFO - Trial 99 finished with value: 0.06386968292141197 and parameters: {'n_layers': 1, 'embedding_dim': 32, 'lr': 0.0016462991733216842, 'lambda_val': 3.5787431711527896e-05, 'batch_size': 984, 'optimizer': 'Adam'}. Best is trial 44 with value: 0.066524779347258.
2026-05-18 04:21:47,483 - experiment_functions - INFO - Early stopping at epoch 950. Best Recall: 0.0630
2026-05-18 04:21:47,576 - optuna.study.study - INFO - Trial 100 finished with value: 0.06295276889593503 and parameters: {'n_layers': 1, 'embedding_dim': 32, 'lr': 0.001619697636544124, 'lambda_val': 3.928585750531142e-05, 'batch_size': 996, 'optimizer': 'Adam'}. Best is trial 44 with value: 0.066524779347258.
2026-05-18 04:22:16,745 - experiment_functions - INFO - Early stopping at epoch 2000. Best Recall: 0.0666
2026-05-18 04:22:16,856 - optuna.study.study - INFO - Trial 101 finished with value: 0.0666159646775296 and parameters: {'n_layers': 1, 'embedding_dim': 32, 'lr': 0.0010260768835379545, 'lambda_val': 6.0177997783611956e-05, 'batch_size': 628, 'optimizer': 'Adam'}. Best is trial 101 with value: 0.0666159646775296.
2026-05-18 04:22:57,690 - experiment_functions - INFO - Early stopping at epoch 2800. Best Recall: 0.0681
2026-05-18 04:22:57,813 - optuna.study.study - INFO - Trial 102 finished with value: 0.06814584022308921 and parameters: {'n_layers': 1, 'embedding_dim': 32, 'lr': 0.0009034743159420333, 'lambda_val': 0.00011752696790411439, 'batch_size': 623, 'optimizer': 'Adam'}. Best is trial 102 with value: 0.06814584022308921.
2026-05-18 04:23:22,272 - experiment_functions - INFO - Early stopping at epoch 1900. Best Recall: 0.0673
2026-05-18 04:23:22,392 - optuna.study.study - INFO - Trial 103 finished with value: 0.0673028476419638 and parameters: {'n_layers': 1, 'embedding_dim': 32, 'lr': 0.0009185781689940503, 'lambda_val': 0.00011749315278537218, 'batch_size': 626, 'optimizer': 'Adam'}. Best is trial 102 with value: 0.06814584022308921.
2026-05-18 04:23:44,563 - optuna.study._optimize - INFO - Trial 104 pruned. 
2026-05-18 04:23:56,410 - optuna.study._optimize - INFO - Trial 105 pruned. 
2026-05-18 04:24:36,072 - experiment_functions - INFO - Early stopping at epoch 3250. Best Recall: 0.0677
2026-05-18 04:24:36,162 - optuna.study.study - INFO - Trial 106 finished with value: 0.06767645532439072 and parameters: {'n_layers': 1, 'embedding_dim': 32, 'lr': 0.0007327916248845093, 'lambda_val': 6.901403949338447e-05, 'batch_size': 798, 'optimizer': 'RMSprop'}. Best is trial 102 with value: 0.06814584022308921.
2026-05-18 04:24:53,694 - optuna.study._optimize - INFO - Trial 107 pruned. 
2026-05-18 04:25:10,617 - optuna.study._optimize - INFO - Trial 108 pruned. 
2026-05-18 04:25:52,487 - experiment_functions - INFO - Early stopping at epoch 3250. Best Recall: 0.0686
2026-05-18 04:25:52,590 - optuna.study.study - INFO - Trial 109 finished with value: 0.0686094159630245 and parameters: {'n_layers': 1, 'embedding_dim': 32, 'lr': 0.0006964233165613974, 'lambda_val': 0.0003102999357549967, 'batch_size': 787, 'optimizer': 'RMSprop'}. Best is trial 109 with value: 0.0686094159630245.
2026-05-18 04:26:25,829 - experiment_functions - INFO - Early stopping at epoch 2450. Best Recall: 0.0719
2026-05-18 04:26:25,921 - optuna.study.study - INFO - Trial 110 finished with value: 0.07190155420048029 and parameters: {'n_layers': 1, 'embedding_dim': 32, 'lr': 0.0007297126724753181, 'lambda_val': 0.00035932077403194373, 'batch_size': 785, 'optimizer': 'RMSprop'}. Best is trial 110 with value: 0.07190155420048029.
2026-05-18 04:26:59,100 - experiment_functions - INFO - Early stopping at epoch 2550. Best Recall: 0.0679
2026-05-18 04:26:59,186 - optuna.study.study - INFO - Trial 111 finished with value: 0.06785778772007406 and parameters: {'n_layers': 1, 'embedding_dim': 32, 'lr': 0.0007462827035873743, 'lambda_val': 0.00012878106698523906, 'batch_size': 773, 'optimizer': 'RMSprop'}. Best is trial 110 with value: 0.07190155420048029.
2026-05-18 04:27:23,743 - experiment_functions - INFO - Early stopping at epoch 1750. Best Recall: 0.0715
2026-05-18 04:27:23,843 - optuna.study.study - INFO - Trial 112 finished with value: 0.07147020709854643 and parameters: {'n_layers': 1, 'embedding_dim': 32, 'lr': 0.0009448626794603904, 'lambda_val': 0.00032562946547898155, 'batch_size': 686, 'optimizer': 'RMSprop'}. Best is trial 110 with value: 0.07190155420048029.
2026-05-18 04:27:55,585 - experiment_functions - INFO - Early stopping at epoch 2350. Best Recall: 0.0714
2026-05-18 04:27:55,684 - optuna.study.study - INFO - Trial 113 finished with value: 0.0713657588169877 and parameters: {'n_layers': 1, 'embedding_dim': 32, 'lr': 0.0007423719017910516, 'lambda_val': 0.0003538005361422325, 'batch_size': 678, 'optimizer': 'RMSprop'}. Best is trial 110 with value: 0.07190155420048029.
2026-05-18 04:28:10,017 - optuna.study._optimize - INFO - Trial 114 pruned. 
2026-05-18 04:28:31,575 - experiment_functions - INFO - Early stopping at epoch 1600. Best Recall: 0.0682
2026-05-18 04:28:31,664 - optuna.study.study - INFO - Trial 115 finished with value: 0.06822970798068252 and parameters: {'n_layers': 1, 'embedding_dim': 32, 'lr': 0.0009553717212382851, 'lambda_val': 0.0005214569988997411, 'batch_size': 580, 'optimizer': 'RMSprop'}. Best is trial 110 with value: 0.07190155420048029.
2026-05-18 04:28:52,150 - experiment_functions - INFO - Early stopping at epoch 1500. Best Recall: 0.0701
2026-05-18 04:28:52,239 - optuna.study.study - INFO - Trial 116 finished with value: 0.07005275497618196 and parameters: {'n_layers': 1, 'embedding_dim': 32, 'lr': 0.0009410414984491808, 'lambda_val': 0.0005335270763850254, 'batch_size': 586, 'optimizer': 'RMSprop'}. Best is trial 110 with value: 0.07190155420048029.
2026-05-18 04:29:13,023 - experiment_functions - INFO - Early stopping at epoch 1600. Best Recall: 0.0703
2026-05-18 04:29:13,113 - optuna.study.study - INFO - Trial 117 finished with value: 0.07031101084945167 and parameters: {'n_layers': 1, 'embedding_dim': 32, 'lr': 0.0009896995392665393, 'lambda_val': 0.00042083268344421095, 'batch_size': 577, 'optimizer': 'RMSprop'}. Best is trial 110 with value: 0.07190155420048029.
2026-05-18 04:29:22,131 - experiment_functions - INFO - Early stopping at epoch 600. Best Recall: 0.0360
2026-05-18 04:29:22,228 - optuna.study.study - INFO - Trial 118 finished with value: 0.03602933802343287 and parameters: {'n_layers': 3, 'embedding_dim': 32, 'lr': 0.0009854249369438575, 'lambda_val': 0.0005934219079140404, 'batch_size': 2631, 'optimizer': 'RMSprop'}. Best is trial 110 with value: 0.07190155420048029.
2026-05-18 04:29:38,065 - optuna.study._optimize - INFO - Trial 119 pruned. 
2026-05-18 04:29:50,608 - optuna.study._optimize - INFO - Trial 120 pruned. 
2026-05-18 04:30:15,188 - experiment_functions - INFO - Early stopping at epoch 1900. Best Recall: 0.0701
2026-05-18 04:30:15,287 - optuna.study.study - INFO - Trial 121 finished with value: 0.07011551812441909 and parameters: {'n_layers': 1, 'embedding_dim': 32, 'lr': 0.0009055771876706385, 'lambda_val': 0.00025148176103271863, 'batch_size': 569, 'optimizer': 'RMSprop'}. Best is trial 110 with value: 0.07190155420048029.
2026-05-18 04:30:36,570 - experiment_functions - INFO - Early stopping at epoch 1600. Best Recall: 0.0720
2026-05-18 04:30:37,795 - optuna.study.study - INFO - Trial 122 finished with value: 0.07197503842975904 and parameters: {'n_layers': 1, 'embedding_dim': 32, 'lr': 0.0009009435615474346, 'lambda_val': 0.0002425072219355652, 'batch_size': 682, 'optimizer': 'RMSprop'}. Best is trial 122 with value: 0.07197503842975904.
2026-05-18 04:31:03,210 - experiment_functions - INFO - Early stopping at epoch 1850. Best Recall: 0.0698
2026-05-18 04:31:03,312 - optuna.study.study - INFO - Trial 123 finished with value: 0.06977445809963674 and parameters: {'n_layers': 1, 'embedding_dim': 32, 'lr': 0.0008692498017945952, 'lambda_val': 0.0002744635259176262, 'batch_size': 709, 'optimizer': 'RMSprop'}. Best is trial 122 with value: 0.07197503842975904.
2026-05-18 04:31:31,037 - experiment_functions - INFO - Early stopping at epoch 2150. Best Recall: 0.0710
2026-05-18 04:31:31,126 - optuna.study.study - INFO - Trial 124 finished with value: 0.07099474217397234 and parameters: {'n_layers': 1, 'embedding_dim': 32, 'lr': 0.0007197467292851506, 'lambda_val': 0.0002773391743557332, 'batch_size': 814, 'optimizer': 'RMSprop'}. Best is trial 122 with value: 0.07197503842975904.
2026-05-18 04:31:50,613 - experiment_functions - INFO - Early stopping at epoch 1450. Best Recall: 0.0688
2026-05-18 04:31:50,712 - optuna.study.study - INFO - Trial 125 finished with value: 0.06877109956896783 and parameters: {'n_layers': 1, 'embedding_dim': 32, 'lr': 0.0008824298704754525, 'lambda_val': 0.0005301164616199062, 'batch_size': 699, 'optimizer': 'RMSprop'}. Best is trial 122 with value: 0.07197503842975904.
2026-05-18 04:32:12,253 - experiment_functions - INFO - Early stopping at epoch 1650. Best Recall: 0.0695
2026-05-18 04:32:12,350 - optuna.study.study - INFO - Trial 126 finished with value: 0.06947260370134292 and parameters: {'n_layers': 1, 'embedding_dim': 32, 'lr': 0.0008861538096774012, 'lambda_val': 0.0005531667262573557, 'batch_size': 696, 'optimizer': 'RMSprop'}. Best is trial 122 with value: 0.07197503842975904.
2026-05-18 04:32:25,520 - optuna.study._optimize - INFO - Trial 127 pruned. 
2026-05-18 04:32:38,894 - experiment_functions - INFO - Early stopping at epoch 950. Best Recall: 0.0660
2026-05-18 04:32:39,045 - optuna.study.study - INFO - Trial 128 finished with value: 0.06595782060208837 and parameters: {'n_layers': 1, 'embedding_dim': 32, 'lr': 0.001290380466139185, 'lambda_val': 0.000276581122678448, 'batch_size': 881, 'optimizer': 'RMSprop'}. Best is trial 122 with value: 0.07197503842975904.
2026-05-18 04:32:52,497 - optuna.study._optimize - INFO - Trial 129 pruned. 
2026-05-18 04:33:01,490 - experiment_functions - INFO - Early stopping at epoch 600. Best Recall: 0.0262
2026-05-18 04:33:01,579 - optuna.study.study - INFO - Trial 130 finished with value: 0.026242367251009865 and parameters: {'n_layers': 4, 'embedding_dim': 32, 'lr': 0.0011248024579429772, 'lambda_val': 0.0003786483154198218, 'batch_size': 1722, 'optimizer': 'RMSprop'}. Best is trial 122 with value: 0.07197503842975904.
2026-05-18 04:33:18,712 - experiment_functions - INFO - Early stopping at epoch 1250. Best Recall: 0.0668
2026-05-18 04:33:18,808 - optuna.study.study - INFO - Trial 131 finished with value: 0.06678806610061604 and parameters: {'n_layers': 1, 'embedding_dim': 32, 'lr': 0.000984062955721906, 'lambda_val': 0.00021209401896704318, 'batch_size': 687, 'optimizer': 'RMSprop'}. Best is trial 122 with value: 0.07197503842975904.
2026-05-18 04:33:50,239 - experiment_functions - INFO - Early stopping at epoch 2250. Best Recall: 0.0702
2026-05-18 04:33:50,338 - optuna.study.study - INFO - Trial 132 finished with value: 0.07016694178726558 and parameters: {'n_layers': 1, 'embedding_dim': 32, 'lr': 0.0008801416959616224, 'lambda_val': 0.0005246087462355936, 'batch_size': 565, 'optimizer': 'RMSprop'}. Best is trial 122 with value: 0.07197503842975904.
2026-05-18 04:34:03,552 - optuna.study._optimize - INFO - Trial 133 pruned. 
2026-05-18 04:34:29,100 - experiment_functions - INFO - Early stopping at epoch 1850. Best Recall: 0.0694
2026-05-18 04:34:29,211 - optuna.study.study - INFO - Trial 134 finished with value: 0.06942208724693552 and parameters: {'n_layers': 1, 'embedding_dim': 32, 'lr': 0.000811491618779632, 'lambda_val': 0.0005147609599415982, 'batch_size': 833, 'optimizer': 'RMSprop'}. Best is trial 122 with value: 0.07197503842975904.
2026-05-18 04:34:42,677 - optuna.study._optimize - INFO - Trial 135 pruned. 
2026-05-18 04:34:55,746 - experiment_functions - INFO - Early stopping at epoch 900. Best Recall: 0.0668
2026-05-18 04:34:55,846 - optuna.study.study - INFO - Trial 136 finished with value: 0.0668171295806233 and parameters: {'n_layers': 1, 'embedding_dim': 32, 'lr': 0.0013868603044964467, 'lambda_val': 0.0013711294821314667, 'batch_size': 725, 'optimizer': 'RMSprop'}. Best is trial 122 with value: 0.07197503842975904.
2026-05-18 04:35:13,602 - optuna.study._optimize - INFO - Trial 137 pruned. 
2026-05-18 04:35:27,084 - optuna.study._optimize - INFO - Trial 138 pruned. 
2026-05-18 04:35:41,195 - optuna.study._optimize - INFO - Trial 139 pruned. 
2026-05-18 04:35:57,612 - experiment_functions - INFO - Early stopping at epoch 1150. Best Recall: 0.0673
2026-05-18 04:35:57,744 - optuna.study.study - INFO - Trial 140 finished with value: 0.06729050611078534 and parameters: {'n_layers': 1, 'embedding_dim': 32, 'lr': 0.0011485271977940297, 'lambda_val': 0.00017418331165930994, 'batch_size': 697, 'optimizer': 'RMSprop'}. Best is trial 122 with value: 0.07197503842975904.
2026-05-18 04:36:43,736 - experiment_functions - INFO - Early stopping at epoch 2700. Best Recall: 0.0723
2026-05-18 04:36:43,873 - optuna.study.study - INFO - Trial 141 finished with value: 0.07228923135535623 and parameters: {'n_layers': 1, 'embedding_dim': 32, 'lr': 0.0008373963474710459, 'lambda_val': 0.0004757427824719744, 'batch_size': 555, 'optimizer': 'RMSprop'}. Best is trial 141 with value: 0.07228923135535623.
2026-05-18 04:36:57,317 - optuna.study._optimize - INFO - Trial 142 pruned. 
2026-05-18 04:37:12,965 - optuna.study._optimize - INFO - Trial 143 pruned. 
2026-05-18 04:37:24,318 - experiment_functions - INFO - Early stopping at epoch 800. Best Recall: 0.0662
2026-05-18 04:37:24,398 - optuna.study.study - INFO - Trial 144 finished with value: 0.06617930067056159 and parameters: {'n_layers': 1, 'embedding_dim': 32, 'lr': 0.0014276711645532327, 'lambda_val': 0.001010244135371838, 'batch_size': 792, 'optimizer': 'RMSprop'}. Best is trial 141 with value: 0.07228923135535623.
2026-05-18 04:37:37,258 - optuna.study._optimize - INFO - Trial 145 pruned. 
2026-05-18 04:37:54,600 - experiment_functions - INFO - Early stopping at epoch 1250. Best Recall: 0.0680
2026-05-18 04:37:54,690 - optuna.study.study - INFO - Trial 146 finished with value: 0.06797072537392358 and parameters: {'n_layers': 1, 'embedding_dim': 32, 'lr': 0.0011045644623473227, 'lambda_val': 0.0003980046192132165, 'batch_size': 568, 'optimizer': 'RMSprop'}. Best is trial 141 with value: 0.07228923135535623.
2026-05-18 04:38:30,200 - experiment_functions - INFO - Early stopping at epoch 2700. Best Recall: 0.0716
2026-05-18 04:38:30,306 - optuna.study.study - INFO - Trial 147 finished with value: 0.07158027424656978 and parameters: {'n_layers': 1, 'embedding_dim': 32, 'lr': 0.0008042893901638885, 'lambda_val': 0.000297455000142249, 'batch_size': 677, 'optimizer': 'RMSprop'}. Best is trial 141 with value: 0.07228923135535623.
2026-05-18 04:38:56,875 - experiment_functions - INFO - Early stopping at epoch 1800. Best Recall: 0.0730
2026-05-18 04:38:56,968 - optuna.study.study - INFO - Trial 148 finished with value: 0.07301657077043636 and parameters: {'n_layers': 1, 'embedding_dim': 32, 'lr': 0.00087168023094344, 'lambda_val': 0.00022376147101462642, 'batch_size': 670, 'optimizer': 'RMSprop'}. Best is trial 148 with value: 0.07301657077043636.
2026-05-18 04:39:10,047 - optuna.study._optimize - INFO - Trial 149 pruned. 
2026-05-18 04:39:31,703 - experiment_functions - INFO - Early stopping at epoch 1200. Best Recall: 0.0676
2026-05-18 04:39:32,466 - optuna.study.study - INFO - Trial 150 finished with value: 0.06759156233244676 and parameters: {'n_layers': 1, 'embedding_dim': 32, 'lr': 0.0012535747191882091, 'lambda_val': 0.0002758687501873695, 'batch_size': 522, 'optimizer': 'RMSprop'}. Best is trial 148 with value: 0.07301657077043636.
2026-05-18 04:40:17,019 - experiment_functions - INFO - Early stopping at epoch 2800. Best Recall: 0.0734
2026-05-18 04:40:17,132 - optuna.study.study - INFO - Trial 151 finished with value: 0.07335068013441892 and parameters: {'n_layers': 1, 'embedding_dim': 32, 'lr': 0.0007693862407023149, 'lambda_val': 0.0006377286505739201, 'batch_size': 706, 'optimizer': 'RMSprop'}. Best is trial 151 with value: 0.07335068013441892.
2026-05-18 04:40:26,482 - experiment_functions - INFO - Early stopping at epoch 650. Best Recall: 0.0618
2026-05-18 04:40:26,594 - optuna.study.study - INFO - Trial 152 finished with value: 0.06175756700903797 and parameters: {'n_layers': 1, 'embedding_dim': 32, 'lr': 0.0020756689647668846, 'lambda_val': 0.000636968231929522, 'batch_size': 693, 'optimizer': 'RMSprop'}. Best is trial 151 with value: 0.07335068013441892.
2026-05-18 04:40:41,186 - optuna.study._optimize - INFO - Trial 153 pruned. 
2026-05-18 04:40:56,308 - experiment_functions - INFO - Early stopping at epoch 1100. Best Recall: 0.0663
2026-05-18 04:40:56,405 - optuna.study.study - INFO - Trial 154 finished with value: 0.06633841244812821 and parameters: {'n_layers': 1, 'embedding_dim': 32, 'lr': 0.0010777549140624587, 'lambda_val': 0.0003883325809989284, 'batch_size': 849, 'optimizer': 'RMSprop'}. Best is trial 151 with value: 0.07335068013441892.
2026-05-18 04:41:30,388 - experiment_functions - INFO - Early stopping at epoch 2400. Best Recall: 0.0699
2026-05-18 04:41:30,475 - optuna.study.study - INFO - Trial 155 finished with value: 0.06987831794716842 and parameters: {'n_layers': 1, 'embedding_dim': 32, 'lr': 0.0008723746347633561, 'lambda_val': 0.00025172171057366094, 'batch_size': 600, 'optimizer': 'RMSprop'}. Best is trial 151 with value: 0.07335068013441892.
2026-05-18 04:41:44,177 - optuna.study._optimize - INFO - Trial 156 pruned. 
2026-05-18 04:42:03,604 - experiment_functions - INFO - Early stopping at epoch 1400. Best Recall: 0.0725
2026-05-18 04:42:03,693 - optuna.study.study - INFO - Trial 157 finished with value: 0.07247394756708288 and parameters: {'n_layers': 1, 'embedding_dim': 32, 'lr': 0.0009815651480982364, 'lambda_val': 0.0012136911964670853, 'batch_size': 584, 'optimizer': 'RMSprop'}. Best is trial 151 with value: 0.07335068013441892.
2026-05-18 04:42:18,967 - experiment_functions - INFO - Early stopping at epoch 1050. Best Recall: 0.0706
2026-05-18 04:42:19,065 - optuna.study.study - INFO - Trial 158 finished with value: 0.0706395760875614 and parameters: {'n_layers': 1, 'embedding_dim': 32, 'lr': 0.0013909264040510801, 'lambda_val': 0.0012413013567624865, 'batch_size': 579, 'optimizer': 'RMSprop'}. Best is trial 151 with value: 0.07335068013441892.
2026-05-18 04:42:32,030 - experiment_functions - INFO - Early stopping at epoch 850. Best Recall: 0.0677
2026-05-18 04:42:32,128 - optuna.study.study - INFO - Trial 159 finished with value: 0.06766291098529735 and parameters: {'n_layers': 1, 'embedding_dim': 32, 'lr': 0.0014522343283418424, 'lambda_val': 0.0012988434901278962, 'batch_size': 585, 'optimizer': 'RMSprop'}. Best is trial 151 with value: 0.07335068013441892.
2026-05-18 04:42:41,548 - experiment_functions - INFO - Early stopping at epoch 650. Best Recall: 0.0075
2026-05-18 04:42:41,636 - optuna.study.study - INFO - Trial 160 finished with value: 0.007461544806537238 and parameters: {'n_layers': 1, 'embedding_dim': 32, 'lr': 0.07646434956057878, 'lambda_val': 0.0008165043422717503, 'batch_size': 516, 'optimizer': 'RMSprop'}. Best is trial 151 with value: 0.07335068013441892.
2026-05-18 04:43:00,185 - experiment_functions - INFO - Early stopping at epoch 1300. Best Recall: 0.0717
2026-05-18 04:43:00,287 - optuna.study.study - INFO - Trial 161 finished with value: 0.07173243609437041 and parameters: {'n_layers': 1, 'embedding_dim': 32, 'lr': 0.0010686461536539647, 'lambda_val': 0.000210172506525778, 'batch_size': 654, 'optimizer': 'RMSprop'}. Best is trial 151 with value: 0.07335068013441892.
