2026-05-18 15:09:03,983 - optuna.study.study - INFO - Trial 54 finished with value: 0.06253472689594244 and parameters: {'n_layers': 1, 'embedding_dim': 32, 'lr': 0.007599284057725872, 'lambda_val': 0.043799038909366365, 'batch_size': 1647, 'optimizer': 'Adam'}. Best is trial 53 with value: 0.06485913862449923.
2026-05-18 15:09:12,640 - experiment_functions - INFO - Early stopping at epoch 550. Best Recall: 0.0402
2026-05-18 15:09:12,987 - optuna.study.study - INFO - Trial 55 finished with value: 0.0402177487809233 and parameters: {'n_layers': 1, 'embedding_dim': 32, 'lr': 0.009899609359622261, 'lambda_val': 0.045950310663792626, 'batch_size': 1660, 'optimizer': 'Adam'}. Best is trial 53 with value: 0.06485913862449923.
2026-05-18 15:09:23,379 - experiment_functions - INFO - Early stopping at epoch 500. Best Recall: 0.0056
2026-05-18 15:09:23,469 - optuna.study.study - INFO - Trial 56 finished with value: 0.0055969293824917705 and parameters: {'n_layers': 1, 'embedding_dim': 32, 'lr': 0.026091442650884786, 'lambda_val': 0.01566895094519184, 'batch_size': 1915, 'optimizer': 'SGD'}. Best is trial 53 with value: 0.06485913862449923.
2026-05-18 15:09:34,165 - experiment_functions - INFO - Early stopping at epoch 550. Best Recall: 0.0370
2026-05-18 15:09:34,276 - optuna.study.study - INFO - Trial 57 finished with value: 0.036973385113040255 and parameters: {'n_layers': 1, 'embedding_dim': 32, 'lr': 0.006253639911873063, 'lambda_val': 0.061675881755466413, 'batch_size': 2142, 'optimizer': 'Adam'}. Best is trial 53 with value: 0.06485913862449923.
2026-05-18 15:09:47,130 - experiment_functions - INFO - Early stopping at epoch 650. Best Recall: 0.0602
2026-05-18 15:09:47,229 - optuna.study.study - INFO - Trial 58 finished with value: 0.060177382990130264 and parameters: {'n_layers': 1, 'embedding_dim': 32, 'lr': 0.002513253162355325, 'lambda_val': 0.029579811736722073, 'batch_size': 1521, 'optimizer': 'Adam'}. Best is trial 53 with value: 0.06485913862449923.
2026-05-18 15:09:55,569 - experiment_functions - INFO - Early stopping at epoch 550. Best Recall: 0.0398
2026-05-18 15:09:55,669 - optuna.study.study - INFO - Trial 59 finished with value: 0.03976216727467997 and parameters: {'n_layers': 1, 'embedding_dim': 32, 'lr': 0.004046626725391224, 'lambda_val': 0.0056620031598410845, 'batch_size': 1389, 'optimizer': 'RMSprop'}. Best is trial 53 with value: 0.06485913862449923.
2026-05-18 15:10:06,954 - experiment_functions - INFO - Early stopping at epoch 550. Best Recall: 0.0290
2026-05-18 15:10:07,062 - optuna.study.study - INFO - Trial 60 finished with value: 0.028966088182842437 and parameters: {'n_layers': 1, 'embedding_dim': 32, 'lr': 0.014203700906382639, 'lambda_val': 0.014807634040067692, 'batch_size': 1738, 'optimizer': 'Adam'}. Best is trial 53 with value: 0.06485913862449923.
2026-05-18 15:10:20,522 - experiment_functions - INFO - Early stopping at epoch 650. Best Recall: 0.0558
2026-05-18 15:10:20,611 - optuna.study.study - INFO - Trial 61 finished with value: 0.05578839599981914 and parameters: {'n_layers': 1, 'embedding_dim': 32, 'lr': 0.0027564422487553167, 'lambda_val': 0.037731666854439676, 'batch_size': 1519, 'optimizer': 'Adam'}. Best is trial 53 with value: 0.06485913862449923.
2026-05-18 15:10:35,200 - experiment_functions - INFO - Early stopping at epoch 750. Best Recall: 0.0638
2026-05-18 15:10:35,302 - optuna.study.study - INFO - Trial 62 finished with value: 0.06378059886027145 and parameters: {'n_layers': 1, 'embedding_dim': 32, 'lr': 0.0018164825707320774, 'lambda_val': 0.02856633192628204, 'batch_size': 1440, 'optimizer': 'Adam'}. Best is trial 53 with value: 0.06485913862449923.
2026-05-18 15:10:59,414 - experiment_functions - INFO - Early stopping at epoch 950. Best Recall: 0.0539
2026-05-18 15:10:59,556 - optuna.study.study - INFO - Trial 63 finished with value: 0.05387703527783703 and parameters: {'n_layers': 1, 'embedding_dim': 32, 'lr': 0.0011386759879728407, 'lambda_val': 0.05955669385521285, 'batch_size': 1703, 'optimizer': 'Adam'}. Best is trial 53 with value: 0.06485913862449923.
2026-05-18 15:11:12,488 - experiment_functions - INFO - Early stopping at epoch 700. Best Recall: 0.0655
2026-05-18 15:11:12,590 - optuna.study.study - INFO - Trial 64 finished with value: 0.0654668970616543 and parameters: {'n_layers': 1, 'embedding_dim': 32, 'lr': 0.0019478896405947246, 'lambda_val': 0.02796463791810654, 'batch_size': 1839, 'optimizer': 'Adam'}. Best is trial 64 with value: 0.0654668970616543.
2026-05-18 15:11:27,020 - experiment_functions - INFO - Early stopping at epoch 650. Best Recall: 0.0394
2026-05-18 15:11:27,132 - optuna.study.study - INFO - Trial 65 finished with value: 0.03937432941183423 and parameters: {'n_layers': 1, 'embedding_dim': 32, 'lr': 0.0035135971843014016, 'lambda_val': 0.09084074830813277, 'batch_size': 1409, 'optimizer': 'Adam'}. Best is trial 64 with value: 0.0654668970616543.
2026-05-18 15:11:39,620 - experiment_functions - INFO - Early stopping at epoch 550. Best Recall: 0.0307
2026-05-18 15:11:39,723 - optuna.study.study - INFO - Trial 66 finished with value: 0.030736248407373642 and parameters: {'n_layers': 1, 'embedding_dim': 32, 'lr': 0.005194460851317702, 'lambda_val': 0.026603466492326287, 'batch_size': 2131, 'optimizer': 'Adam'}. Best is trial 64 with value: 0.0654668970616543.
2026-05-18 15:11:57,552 - experiment_functions - INFO - Early stopping at epoch 750. Best Recall: 0.0604
2026-05-18 15:11:57,652 - optuna.study.study - INFO - Trial 67 finished with value: 0.060373870434918535 and parameters: {'n_layers': 1, 'embedding_dim': 32, 'lr': 0.0015961127226789302, 'lambda_val': 0.005557660783675407, 'batch_size': 1851, 'optimizer': 'Adam'}. Best is trial 64 with value: 0.0654668970616543.
2026-05-18 15:12:06,515 - experiment_functions - INFO - Early stopping at epoch 500. Best Recall: 0.0056
2026-05-18 15:12:06,614 - optuna.study.study - INFO - Trial 68 finished with value: 0.005626728146070517 and parameters: {'n_layers': 2, 'embedding_dim': 128, 'lr': 0.0018613735251609505, 'lambda_val': 0.0003876020019763995, 'batch_size': 1303, 'optimizer': 'SGD'}. Best is trial 64 with value: 0.0654668970616543.
2026-05-18 15:12:21,295 - optuna.study._optimize - INFO - Trial 69 pruned. 
2026-05-18 15:12:29,726 - experiment_functions - INFO - Early stopping at epoch 550. Best Recall: 0.0578
2026-05-18 15:12:29,824 - optuna.study.study - INFO - Trial 70 finished with value: 0.057763094275084116 and parameters: {'n_layers': 1, 'embedding_dim': 32, 'lr': 0.010741040296634233, 'lambda_val': 0.00872506557533665, 'batch_size': 1831, 'optimizer': 'Adam'}. Best is trial 64 with value: 0.0654668970616543.
2026-05-18 15:12:43,527 - experiment_functions - INFO - Early stopping at epoch 900. Best Recall: 0.0626
2026-05-18 15:12:43,617 - optuna.study.study - INFO - Trial 71 finished with value: 0.06258723624484261 and parameters: {'n_layers': 1, 'embedding_dim': 32, 'lr': 0.0010546854024568889, 'lambda_val': 0.02744872663535789, 'batch_size': 1616, 'optimizer': 'Adam'}. Best is trial 64 with value: 0.0654668970616543.
2026-05-18 15:12:55,462 - experiment_functions - INFO - Early stopping at epoch 850. Best Recall: 0.0546
2026-05-18 15:12:55,550 - optuna.study.study - INFO - Trial 72 finished with value: 0.05459152746646969 and parameters: {'n_layers': 1, 'embedding_dim': 32, 'lr': 0.0010420913531000767, 'lambda_val': 0.05159436321749661, 'batch_size': 1980, 'optimizer': 'Adam'}. Best is trial 64 with value: 0.0654668970616543.
2026-05-18 15:13:04,452 - experiment_functions - INFO - Early stopping at epoch 650. Best Recall: 0.0502
2026-05-18 15:13:04,542 - optuna.study.study - INFO - Trial 73 finished with value: 0.050163347859992574 and parameters: {'n_layers': 1, 'embedding_dim': 32, 'lr': 0.00319908804961482, 'lambda_val': 0.033126588560002106, 'batch_size': 1459, 'optimizer': 'Adam'}. Best is trial 64 with value: 0.0654668970616543.
2026-05-18 15:13:12,673 - experiment_functions - INFO - Early stopping at epoch 550. Best Recall: 0.0583
2026-05-18 15:13:12,818 - optuna.study.study - INFO - Trial 74 finished with value: 0.05832960302288302 and parameters: {'n_layers': 1, 'embedding_dim': 32, 'lr': 0.007381634520682197, 'lambda_val': 0.02284058401138057, 'batch_size': 1610, 'optimizer': 'Adam'}. Best is trial 64 with value: 0.0654668970616543.
2026-05-18 15:13:24,833 - experiment_functions - INFO - Early stopping at epoch 900. Best Recall: 0.0491
2026-05-18 15:13:24,933 - optuna.study.study - INFO - Trial 75 finished with value: 0.04914792296186386 and parameters: {'n_layers': 1, 'embedding_dim': 32, 'lr': 0.0013008774817907516, 'lambda_val': 0.06768484340440031, 'batch_size': 1223, 'optimizer': 'Adam'}. Best is trial 64 with value: 0.0654668970616543.
2026-05-18 15:13:34,430 - experiment_functions - INFO - Early stopping at epoch 700. Best Recall: 0.0478
2026-05-18 15:13:34,520 - optuna.study.study - INFO - Trial 76 finished with value: 0.04779297724796597 and parameters: {'n_layers': 1, 'embedding_dim': 32, 'lr': 0.0021666885854918633, 'lambda_val': 0.09884393092885238, 'batch_size': 2120, 'optimizer': 'Adam'}. Best is trial 64 with value: 0.0654668970616543.
2026-05-18 15:13:43,458 - experiment_functions - INFO - Early stopping at epoch 600. Best Recall: 0.0483
2026-05-18 15:13:43,548 - optuna.study.study - INFO - Trial 77 finished with value: 0.04833739685059887 and parameters: {'n_layers': 1, 'embedding_dim': 64, 'lr': 0.0055385568400441055, 'lambda_val': 0.003685255323910097, 'batch_size': 1791, 'optimizer': 'Adam'}. Best is trial 64 with value: 0.0654668970616543.
2026-05-18 15:13:56,018 - experiment_functions - INFO - Early stopping at epoch 900. Best Recall: 0.0616
2026-05-18 15:13:56,130 - optuna.study.study - INFO - Trial 78 finished with value: 0.0615783947838094 and parameters: {'n_layers': 1, 'embedding_dim': 96, 'lr': 0.0009710108886729572, 'lambda_val': 0.015685696659587408, 'batch_size': 1355, 'optimizer': 'Adam'}. Best is trial 64 with value: 0.0654668970616543.
2026-05-18 15:14:04,082 - experiment_functions - INFO - Early stopping at epoch 550. Best Recall: 0.0176
2026-05-18 15:14:04,181 - optuna.study.study - INFO - Trial 79 finished with value: 0.01759779948052046 and parameters: {'n_layers': 2, 'embedding_dim': 32, 'lr': 0.003270747676305562, 'lambda_val': 0.007408784603675164, 'batch_size': 1515, 'optimizer': 'RMSprop'}. Best is trial 64 with value: 0.0654668970616543.
2026-05-18 15:14:14,860 - experiment_functions - INFO - Early stopping at epoch 750. Best Recall: 0.0637
2026-05-18 15:14:14,959 - optuna.study.study - INFO - Trial 80 finished with value: 0.06365221831993148 and parameters: {'n_layers': 1, 'embedding_dim': 32, 'lr': 0.0019431394384419021, 'lambda_val': 0.00016655653717352487, 'batch_size': 1947, 'optimizer': 'Adam'}. Best is trial 64 with value: 0.0654668970616543.
2026-05-18 15:14:26,147 - experiment_functions - INFO - Early stopping at epoch 750. Best Recall: 0.0610
2026-05-18 15:14:26,236 - optuna.study.study - INFO - Trial 81 finished with value: 0.06099205078756304 and parameters: {'n_layers': 1, 'embedding_dim': 32, 'lr': 0.001923367423787422, 'lambda_val': 0.00017431317230584762, 'batch_size': 1621, 'optimizer': 'Adam'}. Best is trial 64 with value: 0.0654668970616543.
2026-05-18 15:14:36,404 - experiment_functions - INFO - Early stopping at epoch 750. Best Recall: 0.0622
2026-05-18 15:14:36,506 - optuna.study.study - INFO - Trial 82 finished with value: 0.062192487189731485 and parameters: {'n_layers': 1, 'embedding_dim': 32, 'lr': 0.001314110075584803, 'lambda_val': 0.030325668699568518, 'batch_size': 2045, 'optimizer': 'Adam'}. Best is trial 64 with value: 0.0654668970616543.
2026-05-18 15:14:47,925 - experiment_functions - INFO - Early stopping at epoch 800. Best Recall: 0.0586
2026-05-18 15:14:48,035 - optuna.study.study - INFO - Trial 83 finished with value: 0.05856517496915481 and parameters: {'n_layers': 1, 'embedding_dim': 128, 'lr': 0.0012171679740382608, 'lambda_val': 8.6559662983269e-05, 'batch_size': 2055, 'optimizer': 'Adam'}. Best is trial 64 with value: 0.0654668970616543.
2026-05-18 15:15:09,753 - experiment_functions - INFO - Early stopping at epoch 1550. Best Recall: 0.0586
2026-05-18 15:15:09,843 - optuna.study.study - INFO - Trial 84 finished with value: 0.05861052361310764 and parameters: {'n_layers': 1, 'embedding_dim': 32, 'lr': 0.0006345221484266044, 'lambda_val': 4.1135225683339026e-05, 'batch_size': 2312, 'optimizer': 'Adam'}. Best is trial 64 with value: 0.0654668970616543.
2026-05-18 15:15:22,133 - experiment_functions - INFO - Early stopping at epoch 950. Best Recall: 0.0613
2026-05-18 15:15:22,224 - optuna.study.study - INFO - Trial 85 finished with value: 0.06127899604241609 and parameters: {'n_layers': 1, 'embedding_dim': 32, 'lr': 0.0008688855680251293, 'lambda_val': 0.032724019802109955, 'batch_size': 1969, 'optimizer': 'Adam'}. Best is trial 64 with value: 0.0654668970616543.
2026-05-18 15:15:32,579 - experiment_functions - INFO - Early stopping at epoch 750. Best Recall: 0.0564
2026-05-18 15:15:32,680 - optuna.study.study - INFO - Trial 86 finished with value: 0.056443043215553386 and parameters: {'n_layers': 1, 'embedding_dim': 32, 'lr': 0.0013466938844141838, 'lambda_val': 0.04477300111064629, 'batch_size': 2227, 'optimizer': 'Adam'}. Best is trial 64 with value: 0.0654668970616543.
2026-05-18 15:15:39,485 - experiment_functions - INFO - Early stopping at epoch 500. Best Recall: 0.0055
2026-05-18 15:15:39,575 - optuna.study.study - INFO - Trial 87 finished with value: 0.005493708702263397 and parameters: {'n_layers': 1, 'embedding_dim': 32, 'lr': 0.0026340371861962386, 'lambda_val': 0.02356176471409864, 'batch_size': 1785, 'optimizer': 'SGD'}. Best is trial 64 with value: 0.0654668970616543.
2026-05-18 15:15:53,641 - optuna.study._optimize - INFO - Trial 88 pruned. 
2026-05-18 15:16:02,476 - experiment_functions - INFO - Early stopping at epoch 600. Best Recall: 0.0611
2026-05-18 15:16:02,566 - optuna.study.study - INFO - Trial 89 finished with value: 0.0610970599421287 and parameters: {'n_layers': 1, 'embedding_dim': 64, 'lr': 0.0045580013542556135, 'lambda_val': 1.5216112075890264e-05, 'batch_size': 1693, 'optimizer': 'Adam'}. Best is trial 64 with value: 0.0654668970616543.
2026-05-18 15:16:11,186 - experiment_functions - INFO - Early stopping at epoch 550. Best Recall: 0.0437
2026-05-18 15:16:11,278 - optuna.study.study - INFO - Trial 90 finished with value: 0.04366667922985952 and parameters: {'n_layers': 1, 'embedding_dim': 96, 'lr': 0.007911024326895161, 'lambda_val': 6.433121860689282e-06, 'batch_size': 1028, 'optimizer': 'Adam'}. Best is trial 64 with value: 0.0654668970616543.
2026-05-18 15:16:20,989 - experiment_functions - INFO - Early stopping at epoch 700. Best Recall: 0.0671
2026-05-18 15:16:21,092 - optuna.study.study - INFO - Trial 91 finished with value: 0.06708054321961882 and parameters: {'n_layers': 1, 'embedding_dim': 32, 'lr': 0.0017725350470008073, 'lambda_val': 0.01944165598033031, 'batch_size': 1587, 'optimizer': 'Adam'}. Best is trial 91 with value: 0.06708054321961882.
2026-05-18 15:16:31,876 - experiment_functions - INFO - Early stopping at epoch 750. Best Recall: 0.0657
2026-05-18 15:16:31,985 - optuna.study.study - INFO - Trial 92 finished with value: 0.0657337553641312 and parameters: {'n_layers': 1, 'embedding_dim': 32, 'lr': 0.0019857221419128674, 'lambda_val': 0.00011169498800829859, 'batch_size': 1479, 'optimizer': 'Adam'}. Best is trial 91 with value: 0.06708054321961882.
2026-05-18 15:16:44,445 - experiment_functions - INFO - Early stopping at epoch 750. Best Recall: 0.0574
2026-05-18 15:16:44,546 - optuna.study.study - INFO - Trial 93 finished with value: 0.057428624647586954 and parameters: {'n_layers': 1, 'embedding_dim': 32, 'lr': 0.0021978153458866055, 'lambda_val': 0.00015279343308590855, 'batch_size': 1456, 'optimizer': 'Adam'}. Best is trial 91 with value: 0.06708054321961882.
2026-05-18 15:16:54,280 - experiment_functions - INFO - Early stopping at epoch 700. Best Recall: 0.0560
2026-05-18 15:16:54,381 - optuna.study.study - INFO - Trial 94 finished with value: 0.05604957092196132 and parameters: {'n_layers': 1, 'embedding_dim': 32, 'lr': 0.0029280869507428767, 'lambda_val': 5.164386982368419e-05, 'batch_size': 1483, 'optimizer': 'Adam'}. Best is trial 91 with value: 0.06708054321961882.
2026-05-18 15:17:17,038 - experiment_functions - INFO - Early stopping at epoch 1600. Best Recall: 0.0578
2026-05-18 15:17:17,134 - optuna.study.study - INFO - Trial 95 finished with value: 0.05784445428694187 and parameters: {'n_layers': 1, 'embedding_dim': 32, 'lr': 0.0007613433016758866, 'lambda_val': 8.2053929145201e-05, 'batch_size': 1236, 'optimizer': 'Adam'}. Best is trial 91 with value: 0.06708054321961882.
2026-05-18 15:17:26,726 - experiment_functions - INFO - Early stopping at epoch 650. Best Recall: 0.0509
2026-05-18 15:17:26,871 - optuna.study.study - INFO - Trial 96 finished with value: 0.05088823401329291 and parameters: {'n_layers': 1, 'embedding_dim': 32, 'lr': 0.003845754181293915, 'lambda_val': 0.0003501452881482682, 'batch_size': 1302, 'optimizer': 'Adam'}. Best is trial 91 with value: 0.06708054321961882.
2026-05-18 15:17:36,295 - experiment_functions - INFO - Early stopping at epoch 650. Best Recall: 0.0561
2026-05-18 15:17:36,395 - optuna.study.study - INFO - Trial 97 finished with value: 0.056068956672816236 and parameters: {'n_layers': 1, 'embedding_dim': 32, 'lr': 0.0018158231854410855, 'lambda_val': 0.00011558004375302269, 'batch_size': 1724, 'optimizer': 'RMSprop'}. Best is trial 91 with value: 0.06708054321961882.
2026-05-18 15:17:50,752 - optuna.study._optimize - INFO - Trial 98 pruned. 
2026-05-18 15:18:02,039 - experiment_functions - INFO - Early stopping at epoch 750. Best Recall: 0.0621
2026-05-18 15:18:02,141 - optuna.study.study - INFO - Trial 99 finished with value: 0.06206363060071286 and parameters: {'n_layers': 1, 'embedding_dim': 128, 'lr': 0.0022636435920872344, 'lambda_val': 0.00021434347278341567, 'batch_size': 836, 'optimizer': 'Adam'}. Best is trial 91 with value: 0.06708054321961882.
2026-05-18 15:18:14,549 - experiment_functions - INFO - Early stopping at epoch 900. Best Recall: 0.0598
2026-05-18 15:18:14,649 - optuna.study.study - INFO - Trial 100 finished with value: 0.059824329047001426 and parameters: {'n_layers': 1, 'embedding_dim': 32, 'lr': 0.0014801975968223029, 'lambda_val': 6.343071545384829e-05, 'batch_size': 1155, 'optimizer': 'Adam'}. Best is trial 91 with value: 0.06708054321961882.
2026-05-18 15:18:26,268 - experiment_functions - INFO - Early stopping at epoch 850. Best Recall: 0.0627
2026-05-18 15:18:26,367 - optuna.study.study - INFO - Trial 101 finished with value: 0.06274191029950416 and parameters: {'n_layers': 1, 'embedding_dim': 32, 'lr': 0.0010899730552063826, 'lambda_val': 0.018077195723237318, 'batch_size': 2043, 'optimizer': 'Adam'}. Best is trial 91 with value: 0.06708054321961882.
2026-05-18 15:18:39,695 - experiment_functions - INFO - Early stopping at epoch 950. Best Recall: 0.0627
2026-05-18 15:18:39,782 - optuna.study.study - INFO - Trial 102 finished with value: 0.06271667659871337 and parameters: {'n_layers': 1, 'embedding_dim': 32, 'lr': 0.0009609664776633728, 'lambda_val': 0.009644180839898719, 'batch_size': 1908, 'optimizer': 'Adam'}. Best is trial 91 with value: 0.06708054321961882.
2026-05-18 15:18:51,894 - experiment_functions - INFO - Early stopping at epoch 900. Best Recall: 0.0616
2026-05-18 15:18:51,973 - optuna.study.study - INFO - Trial 103 finished with value: 0.06156495722778107 and parameters: {'n_layers': 1, 'embedding_dim': 32, 'lr': 0.0009867640072889264, 'lambda_val': 0.017005568877276302, 'batch_size': 1808, 'optimizer': 'Adam'}. Best is trial 91 with value: 0.06708054321961882.
2026-05-18 15:19:04,691 - optuna.study._optimize - INFO - Trial 104 pruned. 
2026-05-18 15:19:16,540 - experiment_functions - INFO - Early stopping at epoch 900. Best Recall: 0.0596
2026-05-18 15:19:16,631 - optuna.study.study - INFO - Trial 105 finished with value: 0.059578382276984206 and parameters: {'n_layers': 1, 'embedding_dim': 32, 'lr': 0.0011241853649655929, 'lambda_val': 0.00916729262838807, 'batch_size': 1933, 'optimizer': 'Adam'}. Best is trial 91 with value: 0.06708054321961882.
2026-05-18 15:19:32,569 - experiment_functions - INFO - Early stopping at epoch 1150. Best Recall: 0.0609
2026-05-18 15:19:32,659 - optuna.study.study - INFO - Trial 106 finished with value: 0.06092754174195968 and parameters: {'n_layers': 1, 'embedding_dim': 32, 'lr': 0.0006355814015147334, 'lambda_val': 0.012399455098102646, 'batch_size': 2400, 'optimizer': 'Adam'}. Best is trial 91 with value: 0.06708054321961882.
2026-05-18 15:19:42,037 - experiment_functions - INFO - Early stopping at epoch 700. Best Recall: 0.0582
2026-05-18 15:19:42,128 - optuna.study.study - INFO - Trial 107 finished with value: 0.058228875811835966 and parameters: {'n_layers': 1, 'embedding_dim': 32, 'lr': 0.001644889058037471, 'lambda_val': 0.02027987234412686, 'batch_size': 2081, 'optimizer': 'Adam'}. Best is trial 91 with value: 0.06708054321961882.
2026-05-18 15:19:48,914 - experiment_functions - INFO - Early stopping at epoch 500. Best Recall: 0.0051
2026-05-18 15:19:49,005 - optuna.study.study - INFO - Trial 108 finished with value: 0.005134901649415735 and parameters: {'n_layers': 1, 'embedding_dim': 32, 'lr': 0.0008170079447703842, 'lambda_val': 0.009488871189805743, 'batch_size': 2204, 'optimizer': 'SGD'}. Best is trial 91 with value: 0.06708054321961882.
2026-05-18 15:19:58,496 - experiment_functions - INFO - Early stopping at epoch 650. Best Recall: 0.0655
