2026-05-17 21:57:20,085 - optuna.study._optimize - INFO - Trial 122 pruned. 
2026-05-17 21:57:39,366 - experiment_functions - INFO - Early stopping at epoch 1450. Best Recall: 0.0277
2026-05-17 21:57:39,468 - optuna.study.study - INFO - Trial 123 finished with value: 0.02772264314546348 and parameters: {'n_layers': 2, 'embedding_dim': 256, 'lr': 0.00026366890806279493, 'lambda_val': 1.2936036535836381e-05, 'batch_size': 786, 'optimizer': 'Adam'}. Best is trial 121 with value: 0.028725385044156507.
2026-05-17 21:57:56,395 - experiment_functions - INFO - Early stopping at epoch 1200. Best Recall: 0.0272
2026-05-17 21:57:56,484 - optuna.study.study - INFO - Trial 124 finished with value: 0.027189882228620555 and parameters: {'n_layers': 2, 'embedding_dim': 256, 'lr': 0.00027161111063399806, 'lambda_val': 1.3666131286042753e-05, 'batch_size': 778, 'optimizer': 'Adam'}. Best is trial 121 with value: 0.028725385044156507.
2026-05-17 21:58:10,530 - optuna.study._optimize - INFO - Trial 125 pruned. 
2026-05-17 21:58:28,829 - optuna.study._optimize - INFO - Trial 126 pruned. 
2026-05-17 21:58:46,514 - experiment_functions - INFO - Early stopping at epoch 1300. Best Recall: 0.0269
2026-05-17 21:58:46,604 - optuna.study.study - INFO - Trial 127 finished with value: 0.026889860237899757 and parameters: {'n_layers': 2, 'embedding_dim': 256, 'lr': 0.000237275870311475, 'lambda_val': 5.575029361521984e-06, 'batch_size': 829, 'optimizer': 'Adam'}. Best is trial 121 with value: 0.028725385044156507.
2026-05-17 21:59:25,745 - experiment_functions - INFO - Early stopping at epoch 2650. Best Recall: 0.0281
2026-05-17 21:59:26,510 - optuna.study.study - INFO - Trial 128 finished with value: 0.028091063245052963 and parameters: {'n_layers': 1, 'embedding_dim': 256, 'lr': 0.0002697270685225183, 'lambda_val': 8.150266738169092e-06, 'batch_size': 652, 'optimizer': 'Adam'}. Best is trial 121 with value: 0.028725385044156507.
2026-05-17 21:59:39,466 - optuna.study._optimize - INFO - Trial 129 pruned. 
2026-05-17 21:59:56,253 - optuna.study._optimize - INFO - Trial 130 pruned. 
2026-05-17 22:00:11,938 - optuna.study._optimize - INFO - Trial 131 pruned. 
2026-05-17 22:00:26,780 - optuna.study._optimize - INFO - Trial 132 pruned. 
2026-05-17 22:00:41,523 - optuna.study._optimize - INFO - Trial 133 pruned. 
2026-05-17 22:01:11,964 - experiment_functions - INFO - Early stopping at epoch 2150. Best Recall: 0.0279
2026-05-17 22:01:12,262 - optuna.study.study - INFO - Trial 134 finished with value: 0.02790786339495167 and parameters: {'n_layers': 2, 'embedding_dim': 256, 'lr': 0.00014611981303310644, 'lambda_val': 1.1215532083295515e-05, 'batch_size': 514, 'optimizer': 'Adam'}. Best is trial 121 with value: 0.028725385044156507.
2026-05-17 22:01:27,456 - optuna.study._optimize - INFO - Trial 135 pruned. 
2026-05-17 22:01:42,102 - optuna.study._optimize - INFO - Trial 136 pruned. 
2026-05-17 22:02:19,292 - experiment_functions - INFO - Early stopping at epoch 2600. Best Recall: 0.0281
2026-05-17 22:02:19,393 - optuna.study.study - INFO - Trial 137 finished with value: 0.028118278760936206 and parameters: {'n_layers': 2, 'embedding_dim': 256, 'lr': 0.00018572719892000615, 'lambda_val': 5.437649911882581e-06, 'batch_size': 526, 'optimizer': 'Adam'}. Best is trial 121 with value: 0.028725385044156507.
2026-05-17 22:02:33,841 - optuna.study._optimize - INFO - Trial 138 pruned. 
2026-05-17 22:02:42,996 - experiment_functions - INFO - Early stopping at epoch 500. Best Recall: 0.0055
2026-05-17 22:02:43,139 - optuna.study.study - INFO - Trial 139 finished with value: 0.0054884960171071384 and parameters: {'n_layers': 2, 'embedding_dim': 256, 'lr': 0.00015941811006402068, 'lambda_val': 6.897076285278897e-06, 'batch_size': 3325, 'optimizer': 'SGD'}. Best is trial 121 with value: 0.028725385044156507.
2026-05-17 22:02:58,299 - optuna.study._optimize - INFO - Trial 140 pruned. 
2026-05-17 22:03:56,026 - experiment_functions - INFO - Early stopping at epoch 3800. Best Recall: 0.0286
2026-05-17 22:03:56,126 - optuna.study.study - INFO - Trial 141 finished with value: 0.028562558286779595 and parameters: {'n_layers': 2, 'embedding_dim': 256, 'lr': 0.00019735307725578832, 'lambda_val': 1.2437557560460315e-05, 'batch_size': 515, 'optimizer': 'Adam'}. Best is trial 121 with value: 0.028725385044156507.
2026-05-17 22:04:17,260 - optuna.study._optimize - INFO - Trial 142 pruned. 
2026-05-17 22:04:32,051 - optuna.study._optimize - INFO - Trial 143 pruned. 
2026-05-17 22:04:47,849 - optuna.study._optimize - INFO - Trial 144 pruned. 
2026-05-17 22:05:02,748 - optuna.study._optimize - INFO - Trial 145 pruned. 
2026-05-17 22:05:18,311 - optuna.study._optimize - INFO - Trial 146 pruned. 
2026-05-17 22:05:33,654 - optuna.study._optimize - INFO - Trial 147 pruned. 
2026-05-17 22:06:11,453 - experiment_functions - INFO - Early stopping at epoch 2700. Best Recall: 0.0293
2026-05-17 22:06:11,621 - optuna.study.study - INFO - Trial 148 finished with value: 0.029318823355627542 and parameters: {'n_layers': 2, 'embedding_dim': 64, 'lr': 0.0002097926186850383, 'lambda_val': 8.436842297056411e-06, 'batch_size': 512, 'optimizer': 'Adam'}. Best is trial 148 with value: 0.029318823355627542.
2026-05-17 22:06:55,000 - experiment_functions - INFO - Early stopping at epoch 3100. Best Recall: 0.0294
2026-05-17 22:06:55,092 - optuna.study.study - INFO - Trial 149 finished with value: 0.029444196641040882 and parameters: {'n_layers': 2, 'embedding_dim': 64, 'lr': 0.00022540251295779325, 'lambda_val': 2.3561752330471555e-05, 'batch_size': 516, 'optimizer': 'Adam'}. Best is trial 149 with value: 0.029444196641040882.
2026-05-17 22:07:09,219 - optuna.study._optimize - INFO - Trial 150 pruned. 
2026-05-17 22:07:23,810 - optuna.study._optimize - INFO - Trial 151 pruned. 
2026-05-17 22:08:06,349 - experiment_functions - INFO - Early stopping at epoch 3200. Best Recall: 0.0287
2026-05-17 22:08:06,427 - optuna.study.study - INFO - Trial 152 finished with value: 0.02865126949631295 and parameters: {'n_layers': 2, 'embedding_dim': 64, 'lr': 0.00024999231970237464, 'lambda_val': 7.840764652592161e-06, 'batch_size': 636, 'optimizer': 'Adam'}. Best is trial 149 with value: 0.029444196641040882.
2026-05-17 22:08:20,110 - optuna.study._optimize - INFO - Trial 153 pruned. 
2026-05-17 22:09:18,916 - optuna.study.study - INFO - Trial 154 finished with value: 0.02888004304183937 and parameters: {'n_layers': 2, 'embedding_dim': 64, 'lr': 0.00021358083693420672, 'lambda_val': 5.973016918703532e-06, 'batch_size': 595, 'optimizer': 'Adam'}. Best is trial 149 with value: 0.029444196641040882.
2026-05-17 22:10:09,614 - optuna.study.study - INFO - Trial 155 finished with value: 0.02913379906766483 and parameters: {'n_layers': 2, 'embedding_dim': 64, 'lr': 0.00021537748586849566, 'lambda_val': 5.704220616095293e-06, 'batch_size': 713, 'optimizer': 'Adam'}. Best is trial 149 with value: 0.029444196641040882.
2026-05-17 22:10:32,824 - optuna.study._optimize - INFO - Trial 156 pruned. 
2026-05-17 22:10:46,840 - optuna.study._optimize - INFO - Trial 157 pruned. 
2026-05-17 22:11:11,727 - optuna.study._optimize - INFO - Trial 158 pruned. 
2026-05-17 22:11:25,710 - optuna.study._optimize - INFO - Trial 159 pruned. 
2026-05-17 22:11:38,999 - optuna.study._optimize - INFO - Trial 160 pruned. 
2026-05-17 22:12:36,555 - optuna.study.study - INFO - Trial 161 finished with value: 0.028882121423114655 and parameters: {'n_layers': 2, 'embedding_dim': 64, 'lr': 0.00021369852724816222, 'lambda_val': 9.829022330731858e-06, 'batch_size': 521, 'optimizer': 'Adam'}. Best is trial 149 with value: 0.029444196641040882.
2026-05-17 22:12:50,062 - optuna.study._optimize - INFO - Trial 162 pruned. 
2026-05-17 22:13:05,776 - optuna.study._optimize - INFO - Trial 163 pruned. 
2026-05-17 22:13:19,334 - optuna.study._optimize - INFO - Trial 164 pruned. 
2026-05-17 22:13:33,114 - optuna.study._optimize - INFO - Trial 165 pruned. 
2026-05-17 22:13:46,464 - optuna.study._optimize - INFO - Trial 166 pruned. 
2026-05-17 22:14:00,182 - optuna.study._optimize - INFO - Trial 167 pruned. 
2026-05-17 22:14:22,728 - experiment_functions - INFO - Early stopping at epoch 1750. Best Recall: 0.0285
2026-05-17 22:14:22,895 - optuna.study.study - INFO - Trial 168 finished with value: 0.028473723815923745 and parameters: {'n_layers': 2, 'embedding_dim': 64, 'lr': 0.0003270243045124619, 'lambda_val': 1.5911943209500796e-05, 'batch_size': 584, 'optimizer': 'Adam'}. Best is trial 149 with value: 0.029444196641040882.
2026-05-17 22:14:36,395 - optuna.study._optimize - INFO - Trial 169 pruned. 
2026-05-17 22:14:43,673 - experiment_functions - INFO - Early stopping at epoch 500. Best Recall: 0.0044
2026-05-17 22:14:43,774 - optuna.study.study - INFO - Trial 170 finished with value: 0.00435494773344976 and parameters: {'n_layers': 2, 'embedding_dim': 64, 'lr': 0.00019837199942642026, 'lambda_val': 4.729491391367663e-06, 'batch_size': 666, 'optimizer': 'SGD'}. Best is trial 149 with value: 0.029444196641040882.
2026-05-17 22:14:55,170 - experiment_functions - INFO - Early stopping at epoch 500. Best Recall: 0.0038
2026-05-17 22:14:55,935 - optuna.study.study - INFO - Trial 171 finished with value: 0.0038475942632128835 and parameters: {'n_layers': 2, 'embedding_dim': 64, 'lr': 0.06766739637161606, 'lambda_val': 1.584587367734693e-05, 'batch_size': 590, 'optimizer': 'Adam'}. Best is trial 149 with value: 0.029444196641040882.
2026-05-17 22:15:22,588 - experiment_functions - INFO - Early stopping at epoch 1750. Best Recall: 0.0287
2026-05-17 22:15:22,680 - optuna.study.study - INFO - Trial 172 finished with value: 0.028681412864564233 and parameters: {'n_layers': 2, 'embedding_dim': 64, 'lr': 0.0003263862607141856, 'lambda_val': 1.051222001208867e-05, 'batch_size': 517, 'optimizer': 'Adam'}. Best is trial 149 with value: 0.029444196641040882.
2026-05-17 22:15:37,048 - optuna.study._optimize - INFO - Trial 173 pruned. 
2026-05-17 22:15:54,108 - experiment_functions - INFO - Early stopping at epoch 1250. Best Recall: 0.0294
2026-05-17 22:15:54,240 - optuna.study.study - INFO - Trial 174 finished with value: 0.029354729611790774 and parameters: {'n_layers': 2, 'embedding_dim': 64, 'lr': 0.0004312405178620487, 'lambda_val': 1.2101243992098e-05, 'batch_size': 515, 'optimizer': 'Adam'}. Best is trial 149 with value: 0.029444196641040882.
2026-05-17 22:16:12,176 - experiment_functions - INFO - Early stopping at epoch 1350. Best Recall: 0.0284
2026-05-17 22:16:12,266 - optuna.study.study - INFO - Trial 175 finished with value: 0.028415179729030446 and parameters: {'n_layers': 2, 'embedding_dim': 64, 'lr': 0.0004320193879494516, 'lambda_val': 6.863324904723262e-06, 'batch_size': 512, 'optimizer': 'Adam'}. Best is trial 149 with value: 0.029444196641040882.
2026-05-17 22:16:27,425 - experiment_functions - INFO - Early stopping at epoch 1100. Best Recall: 0.0282
2026-05-17 22:16:27,513 - optuna.study.study - INFO - Trial 176 finished with value: 0.028245530516503217 and parameters: {'n_layers': 2, 'embedding_dim': 64, 'lr': 0.0004231180751865444, 'lambda_val': 8.261122497109865e-06, 'batch_size': 512, 'optimizer': 'Adam'}. Best is trial 149 with value: 0.029444196641040882.
2026-05-17 22:16:41,297 - experiment_functions - INFO - Early stopping at epoch 1050. Best Recall: 0.0283
2026-05-17 22:16:41,396 - optuna.study.study - INFO - Trial 177 finished with value: 0.028275407949305643 and parameters: {'n_layers': 2, 'embedding_dim': 64, 'lr': 0.00048462791315890874, 'lambda_val': 6.8812084004236345e-06, 'batch_size': 520, 'optimizer': 'Adam'}. Best is trial 149 with value: 0.029444196641040882.
2026-05-17 22:16:51,420 - experiment_functions - INFO - Early stopping at epoch 700. Best Recall: 0.0168
2026-05-17 22:16:51,498 - optuna.study.study - INFO - Trial 178 finished with value: 0.016780528179982688 and parameters: {'n_layers': 2, 'embedding_dim': 64, 'lr': 0.0004980348282589868, 'lambda_val': 6.7400926559468695e-06, 'batch_size': 2682, 'optimizer': 'Adam'}. Best is trial 149 with value: 0.029444196641040882.
2026-05-17 22:17:05,510 - optuna.study._optimize - INFO - Trial 179 pruned. 
2026-05-17 22:17:22,821 - experiment_functions - INFO - Early stopping at epoch 1200. Best Recall: 0.0287
2026-05-17 22:17:22,943 - optuna.study.study - INFO - Trial 180 finished with value: 0.028719408262589313 and parameters: {'n_layers': 2, 'embedding_dim': 64, 'lr': 0.00038315465149871915, 'lambda_val': 7.251313921902896e-06, 'batch_size': 719, 'optimizer': 'Adam'}. Best is trial 149 with value: 0.029444196641040882.
2026-05-17 22:17:35,154 - experiment_functions - INFO - Early stopping at epoch 900. Best Recall: 0.0218
2026-05-17 22:17:35,275 - optuna.study.study - INFO - Trial 181 finished with value: 0.021809347418886807 and parameters: {'n_layers': 2, 'embedding_dim': 64, 'lr': 0.00046349703908225013, 'lambda_val': 7.109555436494936e-06, 'batch_size': 725, 'optimizer': 'Adam'}. Best is trial 149 with value: 0.029444196641040882.
2026-05-17 22:17:47,858 - experiment_functions - INFO - Early stopping at epoch 900. Best Recall: 0.0279
2026-05-17 22:17:47,947 - optuna.study.study - INFO - Trial 182 finished with value: 0.02790213561254122 and parameters: {'n_layers': 2, 'embedding_dim': 64, 'lr': 0.0006167499409898653, 'lambda_val': 9.409092736914166e-06, 'batch_size': 599, 'optimizer': 'Adam'}. Best is trial 149 with value: 0.029444196641040882.
2026-05-17 22:18:03,081 - experiment_functions - INFO - Early stopping at epoch 1100. Best Recall: 0.0274
2026-05-17 22:18:03,179 - optuna.study.study - INFO - Trial 183 finished with value: 0.027416543959059046 and parameters: {'n_layers': 2, 'embedding_dim': 64, 'lr': 0.00040469926064091793, 'lambda_val': 0.000489813458971711, 'batch_size': 520, 'optimizer': 'Adam'}. Best is trial 149 with value: 0.029444196641040882.
2026-05-17 22:18:14,305 - experiment_functions - INFO - Early stopping at epoch 800. Best Recall: 0.0255
2026-05-17 22:18:14,438 - optuna.study.study - INFO - Trial 184 finished with value: 0.02549230285272244 and parameters: {'n_layers': 2, 'embedding_dim': 64, 'lr': 0.0005349328436459899, 'lambda_val': 3.933072182757302e-06, 'batch_size': 710, 'optimizer': 'Adam'}. Best is trial 149 with value: 0.029444196641040882.
2026-05-17 22:18:35,420 - experiment_functions - INFO - Early stopping at epoch 1600. Best Recall: 0.0293
2026-05-17 22:18:35,566 - optuna.study.study - INFO - Trial 185 finished with value: 0.029258018815998377 and parameters: {'n_layers': 2, 'embedding_dim': 64, 'lr': 0.00036066550196704186, 'lambda_val': 5.8590971816786565e-06, 'batch_size': 512, 'optimizer': 'Adam'}. Best is trial 149 with value: 0.029444196641040882.
2026-05-17 22:19:07,877 - experiment_functions - INFO - Early stopping at epoch 1850. Best Recall: 0.0285
2026-05-17 22:19:08,023 - optuna.study.study - INFO - Trial 186 finished with value: 0.02847212270096812 and parameters: {'n_layers': 2, 'embedding_dim': 64, 'lr': 0.0003219044098856402, 'lambda_val': 5.8890556574085245e-06, 'batch_size': 512, 'optimizer': 'Adam'}. Best is trial 149 with value: 0.029444196641040882.
2026-05-17 22:19:30,927 - experiment_functions - INFO - Early stopping at epoch 1750. Best Recall: 0.0294
2026-05-17 22:19:31,016 - optuna.study.study - INFO - Trial 187 finished with value: 0.029351046043303994 and parameters: {'n_layers': 2, 'embedding_dim': 64, 'lr': 0.0003322275878147415, 'lambda_val': 3.1063044392409533e-06, 'batch_size': 650, 'optimizer': 'RMSprop'}. Best is trial 149 with value: 0.029444196641040882.
2026-05-17 22:19:52,540 - experiment_functions - INFO - Early stopping at epoch 1650. Best Recall: 0.0292
2026-05-17 22:19:52,630 - optuna.study.study - INFO - Trial 188 finished with value: 0.029167839786653615 and parameters: {'n_layers': 2, 'embedding_dim': 64, 'lr': 0.0003444499903227526, 'lambda_val': 3.4509353951506834e-06, 'batch_size': 829, 'optimizer': 'RMSprop'}. Best is trial 149 with value: 0.029444196641040882.
2026-05-17 22:20:18,565 - experiment_functions - INFO - Early stopping at epoch 2050. Best Recall: 0.0292
2026-05-17 22:20:18,700 - optuna.study.study - INFO - Trial 189 finished with value: 0.029220639279618554 and parameters: {'n_layers': 2, 'embedding_dim': 64, 'lr': 0.00030297494287466535, 'lambda_val': 2.3293257638226924e-06, 'batch_size': 810, 'optimizer': 'RMSprop'}. Best is trial 149 with value: 0.029444196641040882.
2026-05-17 22:20:36,125 - experiment_functions - INFO - Early stopping at epoch 1300. Best Recall: 0.0294
2026-05-17 22:20:36,258 - optuna.study.study - INFO - Trial 190 finished with value: 0.029363866581748995 and parameters: {'n_layers': 2, 'embedding_dim': 64, 'lr': 0.00031908484448096836, 'lambda_val': 2.872938130232335e-06, 'batch_size': 826, 'optimizer': 'RMSprop'}. Best is trial 149 with value: 0.029444196641040882.
2026-05-17 22:20:56,342 - experiment_functions - INFO - Early stopping at epoch 1550. Best Recall: 0.0281
2026-05-17 22:20:56,432 - optuna.study.study - INFO - Trial 191 finished with value: 0.028129126426713048 and parameters: {'n_layers': 2, 'embedding_dim': 64, 'lr': 0.0003287999959888488, 'lambda_val': 3.0628459022876405e-06, 'batch_size': 896, 'optimizer': 'RMSprop'}. Best is trial 149 with value: 0.029444196641040882.
2026-05-17 22:21:03,734 - experiment_functions - INFO - Early stopping at epoch 500. Best Recall: 0.0056
2026-05-17 22:21:03,824 - optuna.study.study - INFO - Trial 192 finished with value: 0.005564747502465515 and parameters: {'n_layers': 2, 'embedding_dim': 64, 'lr': 0.00031966533926501876, 'lambda_val': 2.4923756821089036e-06, 'batch_size': 812, 'optimizer': 'SGD'}. Best is trial 149 with value: 0.029444196641040882.
2026-05-17 22:21:35,929 - experiment_functions - INFO - Early stopping at epoch 1850. Best Recall: 0.0292
2026-05-17 22:21:36,029 - optuna.study.study - INFO - Trial 193 finished with value: 0.02923589715652895 and parameters: {'n_layers': 2, 'embedding_dim': 64, 'lr': 0.0003446862303403158, 'lambda_val': 2.0527902480988647e-06, 'batch_size': 791, 'optimizer': 'RMSprop'}. Best is trial 149 with value: 0.029444196641040882.
2026-05-17 22:22:03,177 - experiment_functions - INFO - Early stopping at epoch 2100. Best Recall: 0.0296
2026-05-17 22:22:03,271 - optuna.study.study - INFO - Trial 194 finished with value: 0.029582844951066566 and parameters: {'n_layers': 2, 'embedding_dim': 64, 'lr': 0.00028183156315055594, 'lambda_val': 3.0162711389438356e-06, 'batch_size': 859, 'optimizer': 'RMSprop'}. Best is trial 194 with value: 0.029582844951066566.
2026-05-17 22:22:22,809 - experiment_functions - INFO - Early stopping at epoch 1500. Best Recall: 0.0288
2026-05-17 22:22:22,931 - optuna.study.study - INFO - Trial 195 finished with value: 0.028831472143115128 and parameters: {'n_layers': 2, 'embedding_dim': 64, 'lr': 0.00036295443721050686, 'lambda_val': 2.410793172168089e-06, 'batch_size': 853, 'optimizer': 'RMSprop'}. Best is trial 194 with value: 0.029582844951066566.
2026-05-17 22:22:49,733 - experiment_functions - INFO - Early stopping at epoch 1450. Best Recall: 0.0281
2026-05-17 22:22:49,867 - optuna.study.study - INFO - Trial 196 finished with value: 0.028104805075482825 and parameters: {'n_layers': 2, 'embedding_dim': 64, 'lr': 0.00037185175993338995, 'lambda_val': 2.122695318395123e-06, 'batch_size': 961, 'optimizer': 'RMSprop'}. Best is trial 194 with value: 0.029582844951066566.
2026-05-17 22:23:03,484 - optuna.study._optimize - INFO - Trial 197 pruned. 
2026-05-17 22:23:27,969 - experiment_functions - INFO - Early stopping at epoch 1950. Best Recall: 0.0288
2026-05-17 22:23:28,102 - optuna.study.study - INFO - Trial 198 finished with value: 0.02882717082983036 and parameters: {'n_layers': 2, 'embedding_dim': 64, 'lr': 0.00025040536952885693, 'lambda_val': 1.3693784387700469e-06, 'batch_size': 1012, 'optimizer': 'RMSprop'}. Best is trial 194 with value: 0.029582844951066566.
2026-05-17 22:23:41,480 - optuna.study._optimize - INFO - Trial 199 pruned. 
2026-05-17 22:23:59,814 - experiment_functions - INFO - Early stopping at epoch 1400. Best Recall: 0.0283
2026-05-17 22:23:59,947 - optuna.study.study - INFO - Trial 200 finished with value: 0.028260004550513126 and parameters: {'n_layers': 2, 'embedding_dim': 64, 'lr': 0.00037534976707502706, 'lambda_val': 1.5379425912836317e-06, 'batch_size': 848, 'optimizer': 'RMSprop'}. Best is trial 194 with value: 0.029582844951066566.
2026-05-17 22:24:22,147 - experiment_functions - INFO - Early stopping at epoch 1650. Best Recall: 0.0295
2026-05-17 22:24:22,237 - optuna.study.study - INFO - Trial 201 finished with value: 0.029496413551384455 and parameters: {'n_layers': 2, 'embedding_dim': 64, 'lr': 0.0003051815597350973, 'lambda_val': 2.3470320818883008e-06, 'batch_size': 775, 'optimizer': 'RMSprop'}. Best is trial 194 with value: 0.029582844951066566.
2026-05-17 22:25:01,573 - experiment_functions - INFO - Early stopping at epoch 2650. Best Recall: 0.0292
2026-05-17 22:25:02,331 - optuna.study.study - INFO - Trial 202 finished with value: 0.02918023052122624 and parameters: {'n_layers': 2, 'embedding_dim': 64, 'lr': 0.0002735537440355006, 'lambda_val': 2.2473559054621965e-06, 'batch_size': 849, 'optimizer': 'RMSprop'}. Best is trial 194 with value: 0.029582844951066566.
2026-05-17 22:25:35,180 - experiment_functions - INFO - Early stopping at epoch 2250. Best Recall: 0.0294
2026-05-17 22:25:35,312 - optuna.study.study - INFO - Trial 203 finished with value: 0.02942578200476157 and parameters: {'n_layers': 2, 'embedding_dim': 64, 'lr': 0.00028114598100797636, 'lambda_val': 2.1635315316870676e-06, 'batch_size': 819, 'optimizer': 'RMSprop'}. Best is trial 194 with value: 0.029582844951066566.
2026-05-17 22:25:58,081 - experiment_functions - INFO - Early stopping at epoch 1750. Best Recall: 0.0286
