2026-05-18 03:06:06,195 - optuna.study.study - INFO - Trial 142 finished with value: 0.06105030617690335 and parameters: {'n_layers': 2, 'embedding_dim': 32, 'lr': 0.0005487673916196262, 'lambda_val': 0.0009251701563450968, 'batch_size': 566, 'optimizer': 'RMSprop'}. Best is trial 132 with value: 0.07345797140105066.
2026-05-18 03:06:20,414 - optuna.study._optimize - INFO - Trial 143 pruned. 
2026-05-18 03:06:52,294 - optuna.study._optimize - INFO - Trial 144 pruned. 
2026-05-18 03:07:13,025 - experiment_functions - INFO - Early stopping at epoch 1500. Best Recall: 0.0621
2026-05-18 03:07:13,115 - optuna.study.study - INFO - Trial 145 finished with value: 0.06211951890465774 and parameters: {'n_layers': 2, 'embedding_dim': 32, 'lr': 0.0005222546651535758, 'lambda_val': 0.002022285336072121, 'batch_size': 716, 'optimizer': 'RMSprop'}. Best is trial 132 with value: 0.07345797140105066.
2026-05-18 03:07:28,428 - experiment_functions - INFO - Early stopping at epoch 1050. Best Recall: 0.0613
2026-05-18 03:07:28,675 - optuna.study.study - INFO - Trial 146 finished with value: 0.06128716687670142 and parameters: {'n_layers': 2, 'embedding_dim': 32, 'lr': 0.0007072039250170937, 'lambda_val': 0.0014163410868615188, 'batch_size': 579, 'optimizer': 'RMSprop'}. Best is trial 132 with value: 0.07345797140105066.
2026-05-18 03:07:46,284 - optuna.study._optimize - INFO - Trial 147 pruned. 
2026-05-18 03:07:59,564 - optuna.study._optimize - INFO - Trial 148 pruned. 
2026-05-18 03:08:10,388 - experiment_functions - INFO - Early stopping at epoch 750. Best Recall: 0.0444
2026-05-18 03:08:10,468 - optuna.study.study - INFO - Trial 149 finished with value: 0.04439186925989511 and parameters: {'n_layers': 2, 'embedding_dim': 32, 'lr': 0.0006207776992185371, 'lambda_val': 0.0005480611815603171, 'batch_size': 3833, 'optimizer': 'RMSprop'}. Best is trial 132 with value: 0.07345797140105066.
2026-05-18 03:08:23,976 - optuna.study._optimize - INFO - Trial 150 pruned. 
2026-05-18 03:08:49,734 - optuna.study._optimize - INFO - Trial 151 pruned. 
2026-05-18 03:09:26,021 - experiment_functions - INFO - Early stopping at epoch 2000. Best Recall: 0.0671
2026-05-18 03:09:26,784 - optuna.study.study - INFO - Trial 152 finished with value: 0.06706033876298836 and parameters: {'n_layers': 2, 'embedding_dim': 32, 'lr': 0.0004569197884256061, 'lambda_val': 0.0025577439270861074, 'batch_size': 658, 'optimizer': 'RMSprop'}. Best is trial 132 with value: 0.07345797140105066.
2026-05-18 03:09:49,344 - experiment_functions - INFO - Early stopping at epoch 1500. Best Recall: 0.0649
2026-05-18 03:09:49,434 - optuna.study.study - INFO - Trial 153 finished with value: 0.06489967782928384 and parameters: {'n_layers': 2, 'embedding_dim': 32, 'lr': 0.0005264583403284094, 'lambda_val': 0.002589900947603172, 'batch_size': 718, 'optimizer': 'RMSprop'}. Best is trial 132 with value: 0.07345797140105066.
2026-05-18 03:10:02,789 - optuna.study._optimize - INFO - Trial 154 pruned. 
2026-05-18 03:10:46,303 - experiment_functions - INFO - Early stopping at epoch 3200. Best Recall: 0.0677
2026-05-18 03:10:46,448 - optuna.study.study - INFO - Trial 155 finished with value: 0.06767831602458195 and parameters: {'n_layers': 2, 'embedding_dim': 32, 'lr': 0.00039996504850393374, 'lambda_val': 0.0014157402911782475, 'batch_size': 791, 'optimizer': 'RMSprop'}. Best is trial 132 with value: 0.07345797140105066.
2026-05-18 03:11:04,892 - optuna.study._optimize - INFO - Trial 156 pruned. 
2026-05-18 03:11:24,348 - optuna.study._optimize - INFO - Trial 157 pruned. 
2026-05-18 03:11:36,467 - experiment_functions - INFO - Early stopping at epoch 850. Best Recall: 0.0608
2026-05-18 03:11:36,567 - optuna.study.study - INFO - Trial 158 finished with value: 0.060788148074491004 and parameters: {'n_layers': 2, 'embedding_dim': 32, 'lr': 0.0007554353265507506, 'lambda_val': 0.0023574507535910425, 'batch_size': 713, 'optimizer': 'RMSprop'}. Best is trial 132 with value: 0.07345797140105066.
2026-05-18 03:12:00,349 - experiment_functions - INFO - Early stopping at epoch 1700. Best Recall: 0.0682
2026-05-18 03:12:00,448 - optuna.study.study - INFO - Trial 159 finished with value: 0.06816249383777635 and parameters: {'n_layers': 2, 'embedding_dim': 32, 'lr': 0.0005986349605235613, 'lambda_val': 0.0004224602267848422, 'batch_size': 578, 'optimizer': 'RMSprop'}. Best is trial 132 with value: 0.07345797140105066.
2026-05-18 03:12:15,544 - experiment_functions - INFO - Early stopping at epoch 800. Best Recall: 0.0595
2026-05-18 03:12:15,698 - optuna.study.study - INFO - Trial 160 finished with value: 0.059503030158263144 and parameters: {'n_layers': 2, 'embedding_dim': 32, 'lr': 0.0009222234986315237, 'lambda_val': 0.00037061747389013683, 'batch_size': 587, 'optimizer': 'RMSprop'}. Best is trial 132 with value: 0.07345797140105066.
2026-05-18 03:12:37,562 - optuna.study._optimize - INFO - Trial 161 pruned. 
2026-05-18 03:12:53,360 - optuna.study._optimize - INFO - Trial 162 pruned. 
2026-05-18 03:13:26,853 - experiment_functions - INFO - Early stopping at epoch 2350. Best Recall: 0.0687
2026-05-18 03:13:26,974 - optuna.study.study - INFO - Trial 163 finished with value: 0.06872525271524609 and parameters: {'n_layers': 2, 'embedding_dim': 32, 'lr': 0.000424456358549604, 'lambda_val': 0.000536392156235838, 'batch_size': 828, 'optimizer': 'RMSprop'}. Best is trial 132 with value: 0.07345797140105066.
2026-05-18 03:13:41,545 - optuna.study._optimize - INFO - Trial 164 pruned. 
2026-05-18 03:14:02,799 - optuna.study._optimize - INFO - Trial 165 pruned. 
2026-05-18 03:14:16,634 - optuna.study._optimize - INFO - Trial 166 pruned. 
2026-05-18 03:14:29,516 - experiment_functions - INFO - Early stopping at epoch 850. Best Recall: 0.0564
2026-05-18 03:14:29,625 - optuna.study.study - INFO - Trial 167 finished with value: 0.05640995890320812 and parameters: {'n_layers': 2, 'embedding_dim': 32, 'lr': 0.0007468020911509422, 'lambda_val': 0.000678443786828867, 'batch_size': 874, 'optimizer': 'RMSprop'}. Best is trial 132 with value: 0.07345797140105066.
2026-05-18 03:14:43,687 - optuna.study._optimize - INFO - Trial 168 pruned. 
2026-05-18 03:14:58,324 - experiment_functions - INFO - Early stopping at epoch 1000. Best Recall: 0.0638
2026-05-18 03:14:58,426 - optuna.study.study - INFO - Trial 169 finished with value: 0.06375910407680281 and parameters: {'n_layers': 2, 'embedding_dim': 32, 'lr': 0.0006628057440975743, 'lambda_val': 0.0007874473715990183, 'batch_size': 723, 'optimizer': 'RMSprop'}. Best is trial 132 with value: 0.07345797140105066.
2026-05-18 03:15:26,738 - optuna.study._optimize - INFO - Trial 170 pruned. 
2026-05-18 03:15:40,617 - optuna.study._optimize - INFO - Trial 171 pruned. 
2026-05-18 03:15:56,452 - optuna.study._optimize - INFO - Trial 172 pruned. 
2026-05-18 03:16:14,684 - optuna.study._optimize - INFO - Trial 173 pruned. 
2026-05-18 03:16:27,837 - optuna.study._optimize - INFO - Trial 174 pruned. 
2026-05-18 03:16:56,508 - experiment_functions - INFO - Early stopping at epoch 1350. Best Recall: 0.0645
2026-05-18 03:16:56,608 - optuna.study.study - INFO - Trial 175 finished with value: 0.0645306816431182 and parameters: {'n_layers': 2, 'embedding_dim': 32, 'lr': 0.0005787172913857515, 'lambda_val': 0.000560908651278228, 'batch_size': 631, 'optimizer': 'RMSprop'}. Best is trial 132 with value: 0.07345797140105066.
2026-05-18 03:17:24,540 - experiment_functions - INFO - Early stopping at epoch 1950. Best Recall: 0.0667
2026-05-18 03:17:24,637 - optuna.study.study - INFO - Trial 176 finished with value: 0.0666909875683749 and parameters: {'n_layers': 2, 'embedding_dim': 32, 'lr': 0.0004066386575957292, 'lambda_val': 0.0054129618357096195, 'batch_size': 699, 'optimizer': 'RMSprop'}. Best is trial 132 with value: 0.07345797140105066.
2026-05-18 03:17:31,681 - experiment_functions - INFO - Early stopping at epoch 500. Best Recall: 0.0045
2026-05-18 03:17:31,771 - optuna.study.study - INFO - Trial 177 finished with value: 0.004455352941519001 and parameters: {'n_layers': 2, 'embedding_dim': 32, 'lr': 0.00024650034451047595, 'lambda_val': 0.004527357626054369, 'batch_size': 716, 'optimizer': 'SGD'}. Best is trial 132 with value: 0.07345797140105066.
2026-05-18 03:17:45,763 - optuna.study._optimize - INFO - Trial 178 pruned. 
2026-05-18 03:18:00,194 - optuna.study._optimize - INFO - Trial 179 pruned. 
2026-05-18 03:18:22,031 - experiment_functions - INFO - Early stopping at epoch 950. Best Recall: 0.0183
2026-05-18 03:18:22,121 - optuna.study.study - INFO - Trial 180 finished with value: 0.018324139042705436 and parameters: {'n_layers': 2, 'embedding_dim': 32, 'lr': 0.02532071863197883, 'lambda_val': 0.0003830496752715115, 'batch_size': 575, 'optimizer': 'RMSprop'}. Best is trial 132 with value: 0.07345797140105066.
2026-05-18 03:18:56,227 - experiment_functions - INFO - Early stopping at epoch 2450. Best Recall: 0.0681
2026-05-18 03:18:56,315 - optuna.study.study - INFO - Trial 181 finished with value: 0.06808007209939552 and parameters: {'n_layers': 2, 'embedding_dim': 32, 'lr': 0.000466935123335815, 'lambda_val': 0.0014849722611338238, 'batch_size': 651, 'optimizer': 'RMSprop'}. Best is trial 132 with value: 0.07345797140105066.
2026-05-18 03:19:09,681 - optuna.study._optimize - INFO - Trial 182 pruned. 
2026-05-18 03:19:29,518 - experiment_functions - INFO - Early stopping at epoch 1450. Best Recall: 0.0634
2026-05-18 03:19:29,617 - optuna.study.study - INFO - Trial 183 finished with value: 0.06338115774675039 and parameters: {'n_layers': 2, 'embedding_dim': 32, 'lr': 0.0006175060728003334, 'lambda_val': 0.0012778918942564802, 'batch_size': 623, 'optimizer': 'RMSprop'}. Best is trial 132 with value: 0.07345797140105066.
2026-05-18 03:19:43,133 - optuna.study._optimize - INFO - Trial 184 pruned. 
2026-05-18 03:19:56,900 - experiment_functions - INFO - Early stopping at epoch 850. Best Recall: 0.0529
2026-05-18 03:19:56,990 - optuna.study.study - INFO - Trial 185 finished with value: 0.05292842763923446 and parameters: {'n_layers': 2, 'embedding_dim': 32, 'lr': 0.0007907338562389475, 'lambda_val': 0.0021418797933895704, 'batch_size': 849, 'optimizer': 'RMSprop'}. Best is trial 132 with value: 0.07345797140105066.
2026-05-18 03:20:10,155 - optuna.study._optimize - INFO - Trial 186 pruned. 
2026-05-18 03:20:24,216 - experiment_functions - INFO - Early stopping at epoch 950. Best Recall: 0.0579
2026-05-18 03:20:24,776 - optuna.study.study - INFO - Trial 187 finished with value: 0.057865994185071344 and parameters: {'n_layers': 2, 'embedding_dim': 96, 'lr': 0.0005530176960850295, 'lambda_val': 0.0014628274072408986, 'batch_size': 756, 'optimizer': 'RMSprop'}. Best is trial 132 with value: 0.07345797140105066.
2026-05-18 03:20:52,575 - experiment_functions - INFO - Early stopping at epoch 2000. Best Recall: 0.0657
2026-05-18 03:20:52,664 - optuna.study.study - INFO - Trial 188 finished with value: 0.06572429231116428 and parameters: {'n_layers': 2, 'embedding_dim': 32, 'lr': 0.0004798308257324547, 'lambda_val': 0.0011302050845200843, 'batch_size': 622, 'optimizer': 'RMSprop'}. Best is trial 132 with value: 0.07345797140105066.
2026-05-18 03:21:10,090 - experiment_functions - INFO - Early stopping at epoch 1150. Best Recall: 0.0630
2026-05-18 03:21:10,179 - optuna.study.study - INFO - Trial 189 finished with value: 0.06304861432491086 and parameters: {'n_layers': 2, 'embedding_dim': 32, 'lr': 0.0006939988753654055, 'lambda_val': 0.0006673312853247993, 'batch_size': 514, 'optimizer': 'RMSprop'}. Best is trial 132 with value: 0.07345797140105066.
2026-05-18 03:21:25,364 - optuna.study._optimize - INFO - Trial 190 pruned. 
2026-05-18 03:21:39,662 - optuna.study._optimize - INFO - Trial 191 pruned. 
2026-05-18 03:22:21,213 - experiment_functions - INFO - Early stopping at epoch 2850. Best Recall: 0.0675
2026-05-18 03:22:21,315 - optuna.study.study - INFO - Trial 192 finished with value: 0.06753264087959661 and parameters: {'n_layers': 2, 'embedding_dim': 32, 'lr': 0.0004267047981762311, 'lambda_val': 0.0019724767348482572, 'batch_size': 564, 'optimizer': 'RMSprop'}. Best is trial 132 with value: 0.07345797140105066.
2026-05-18 03:22:34,469 - optuna.study._optimize - INFO - Trial 193 pruned. 
2026-05-18 03:22:49,081 - optuna.study._optimize - INFO - Trial 194 pruned. 
2026-05-18 03:23:09,159 - optuna.study._optimize - INFO - Trial 195 pruned. 
2026-05-18 03:23:36,152 - experiment_functions - INFO - Early stopping at epoch 1500. Best Recall: 0.0691
2026-05-18 03:23:36,300 - optuna.study.study - INFO - Trial 196 finished with value: 0.06907355431150657 and parameters: {'n_layers': 2, 'embedding_dim': 32, 'lr': 0.0005912443651596844, 'lambda_val': 0.0004925377524704486, 'batch_size': 596, 'optimizer': 'RMSprop'}. Best is trial 132 with value: 0.07345797140105066.
2026-05-18 03:23:58,561 - experiment_functions - INFO - Early stopping at epoch 1550. Best Recall: 0.0649
2026-05-18 03:23:58,660 - optuna.study.study - INFO - Trial 197 finished with value: 0.06485023052851886 and parameters: {'n_layers': 2, 'embedding_dim': 32, 'lr': 0.0006121919738221039, 'lambda_val': 0.00044840213471601393, 'batch_size': 597, 'optimizer': 'RMSprop'}. Best is trial 132 with value: 0.07345797140105066.
2026-05-18 03:24:15,878 - experiment_functions - INFO - Early stopping at epoch 500. Best Recall: 0.0050
2026-05-18 03:24:15,989 - optuna.study.study - INFO - Trial 198 finished with value: 0.005035351847133493 and parameters: {'n_layers': 2, 'embedding_dim': 32, 'lr': 0.0005524756399837691, 'lambda_val': 0.0005036906695953367, 'batch_size': 585, 'optimizer': 'SGD'}. Best is trial 132 with value: 0.07345797140105066.
2026-05-18 03:24:44,061 - experiment_functions - INFO - Early stopping at epoch 1000. Best Recall: 0.0623
2026-05-18 03:24:44,160 - optuna.study.study - INFO - Trial 199 finished with value: 0.062337243367527745 and parameters: {'n_layers': 2, 'embedding_dim': 32, 'lr': 0.0008558305292807239, 'lambda_val': 0.0003576161576641772, 'batch_size': 512, 'optimizer': 'RMSprop'}. Best is trial 132 with value: 0.07345797140105066.
2026-05-18 03:24:59,494 - optuna.study._optimize - INFO - Trial 200 pruned. 
2026-05-18 03:25:14,011 - optuna.study._optimize - INFO - Trial 201 pruned. 
2026-05-18 03:25:30,010 - optuna.study._optimize - INFO - Trial 202 pruned. 
2026-05-18 03:25:47,644 - optuna.study._optimize - INFO - Trial 203 pruned. 
2026-05-18 03:26:09,673 - experiment_functions - INFO - Early stopping at epoch 1400. Best Recall: 0.0646
2026-05-18 03:26:09,762 - optuna.study.study - INFO - Trial 204 finished with value: 0.06463194911441336 and parameters: {'n_layers': 2, 'embedding_dim': 32, 'lr': 0.0005556894512521247, 'lambda_val': 0.0027552170407634294, 'batch_size': 587, 'optimizer': 'RMSprop'}. Best is trial 132 with value: 0.07345797140105066.
2026-05-18 03:26:43,888 - experiment_functions - INFO - Early stopping at epoch 2500. Best Recall: 0.0697
2026-05-18 03:26:43,988 - optuna.study.study - INFO - Trial 205 finished with value: 0.06973135094384782 and parameters: {'n_layers': 2, 'embedding_dim': 32, 'lr': 0.00041020877730945027, 'lambda_val': 0.0015481391611859607, 'batch_size': 742, 'optimizer': 'RMSprop'}. Best is trial 132 with value: 0.07345797140105066.
2026-05-18 03:26:59,367 - optuna.study._optimize - INFO - Trial 206 pruned. 
2026-05-18 03:27:31,062 - optuna.study._optimize - INFO - Trial 207 pruned. 
2026-05-18 03:27:46,776 - optuna.study._optimize - INFO - Trial 208 pruned. 
2026-05-18 03:28:02,028 - optuna.study._optimize - INFO - Trial 209 pruned. 
2026-05-18 03:28:17,954 - optuna.study._optimize - INFO - Trial 210 pruned. 
2026-05-18 03:28:31,761 - optuna.study._optimize - INFO - Trial 211 pruned. 
2026-05-18 03:29:12,246 - experiment_functions - INFO - Early stopping at epoch 3000. Best Recall: 0.0687
2026-05-18 03:29:12,334 - optuna.study.study - INFO - Trial 212 finished with value: 0.06866989142788317 and parameters: {'n_layers': 2, 'embedding_dim': 32, 'lr': 0.00045712310106233746, 'lambda_val': 0.001715411942043738, 'batch_size': 577, 'optimizer': 'RMSprop'}. Best is trial 132 with value: 0.07345797140105066.
2026-05-18 03:29:33,376 - experiment_functions - INFO - Early stopping at epoch 1500. Best Recall: 0.0683
2026-05-18 03:29:33,467 - optuna.study.study - INFO - Trial 213 finished with value: 0.06828441270848212 and parameters: {'n_layers': 2, 'embedding_dim': 32, 'lr': 0.0005537065982336003, 'lambda_val': 0.0019104421944908141, 'batch_size': 572, 'optimizer': 'RMSprop'}. Best is trial 132 with value: 0.07345797140105066.
2026-05-18 03:29:49,129 - experiment_functions - INFO - Early stopping at epoch 1100. Best Recall: 0.0750
2026-05-18 03:29:49,220 - optuna.study.study - INFO - Trial 214 finished with value: 0.07497030493998583 and parameters: {'n_layers': 2, 'embedding_dim': 32, 'lr': 0.0006831508551771692, 'lambda_val': 0.0021759256207615103, 'batch_size': 583, 'optimizer': 'RMSprop'}. Best is trial 214 with value: 0.07497030493998583.
2026-05-18 03:30:05,596 - experiment_functions - INFO - Early stopping at epoch 1150. Best Recall: 0.0672
2026-05-18 03:30:05,686 - optuna.study.study - INFO - Trial 215 finished with value: 0.06721179945716808 and parameters: {'n_layers': 2, 'embedding_dim': 32, 'lr': 0.000700188471705772, 'lambda_val': 0.0018678229885911487, 'batch_size': 567, 'optimizer': 'RMSprop'}. Best is trial 214 with value: 0.07497030493998583.
2026-05-18 03:30:25,722 - experiment_functions - INFO - Early stopping at epoch 1400. Best Recall: 0.0649
2026-05-18 03:30:25,822 - optuna.study.study - INFO - Trial 216 finished with value: 0.06485669977777946 and parameters: {'n_layers': 2, 'embedding_dim': 32, 'lr': 0.0005900478016143448, 'lambda_val': 0.001475665264554458, 'batch_size': 582, 'optimizer': 'RMSprop'}. Best is trial 214 with value: 0.07497030493998583.
2026-05-18 03:30:38,674 - experiment_functions - INFO - Early stopping at epoch 900. Best Recall: 0.0613
2026-05-18 03:30:38,764 - optuna.study.study - INFO - Trial 217 finished with value: 0.061269806523720854 and parameters: {'n_layers': 2, 'embedding_dim': 32, 'lr': 0.0007518975897369125, 'lambda_val': 0.0010693128406309312, 'batch_size': 575, 'optimizer': 'RMSprop'}. Best is trial 214 with value: 0.07497030493998583.
2026-05-18 03:30:55,258 - optuna.study._optimize - INFO - Trial 218 pruned. 
2026-05-18 03:31:14,394 - experiment_functions - INFO - Early stopping at epoch 750. Best Recall: 0.0540
2026-05-18 03:31:14,495 - optuna.study.study - INFO - Trial 219 finished with value: 0.05402997017478837 and parameters: {'n_layers': 2, 'embedding_dim': 32, 'lr': 0.0010120110203615605, 'lambda_val': 0.0029432882925088657, 'batch_size': 620, 'optimizer': 'RMSprop'}. Best is trial 214 with value: 0.07497030493998583.
2026-05-18 03:31:28,392 - optuna.study._optimize - INFO - Trial 220 pruned. 
2026-05-18 03:31:43,487 - optuna.study._optimize - INFO - Trial 221 pruned. 
2026-05-18 03:32:00,864 - experiment_functions - INFO - Early stopping at epoch 1200. Best Recall: 0.0677
2026-05-18 03:32:01,017 - optuna.study.study - INFO - Trial 222 finished with value: 0.0676642338738471 and parameters: {'n_layers': 2, 'embedding_dim': 32, 'lr': 0.0006367880143659814, 'lambda_val': 0.0012411997154584123, 'batch_size': 569, 'optimizer': 'RMSprop'}. Best is trial 214 with value: 0.07497030493998583.
2026-05-18 03:32:18,015 - experiment_functions - INFO - Early stopping at epoch 1200. Best Recall: 0.0676
2026-05-18 03:32:18,150 - optuna.study.study - INFO - Trial 223 finished with value: 0.06757412137024398 and parameters: {'n_layers': 2, 'embedding_dim': 32, 'lr': 0.0005963690672063871, 'lambda_val': 0.0011644923045717236, 'batch_size': 643, 'optimizer': 'RMSprop'}. Best is trial 214 with value: 0.07497030493998583.
2026-05-18 03:32:32,837 - optuna.study._optimize - INFO - Trial 224 pruned. 
2026-05-18 03:32:55,070 - experiment_functions - INFO - Early stopping at epoch 900. Best Recall: 0.0562
2026-05-18 03:32:55,403 - optuna.study.study - INFO - Trial 225 finished with value: 0.056174318617293814 and parameters: {'n_layers': 2, 'embedding_dim': 32, 'lr': 0.0008480311389505733, 'lambda_val': 0.0006853998458477634, 'batch_size': 641, 'optimizer': 'RMSprop'}. Best is trial 214 with value: 0.07497030493998583.
2026-05-18 03:33:15,845 - experiment_functions - INFO - Early stopping at epoch 1400. Best Recall: 0.0660
2026-05-18 03:33:15,979 - optuna.study.study - INFO - Trial 226 finished with value: 0.06596363402057032 and parameters: {'n_layers': 2, 'embedding_dim': 32, 'lr': 0.0006195035749016447, 'lambda_val': 0.0009335426647040508, 'batch_size': 512, 'optimizer': 'RMSprop'}. Best is trial 214 with value: 0.07497030493998583.
2026-05-18 03:33:29,394 - experiment_functions - INFO - Early stopping at epoch 900. Best Recall: 0.0491
2026-05-18 03:33:29,485 - optuna.study.study - INFO - Trial 227 finished with value: 0.04908861677015556 and parameters: {'n_layers': 2, 'embedding_dim': 32, 'lr': 0.0005236363805684771, 'lambda_val': 0.0004841737368361404, 'batch_size': 2467, 'optimizer': 'RMSprop'}. Best is trial 214 with value: 0.07497030493998583.
2026-05-18 03:33:45,487 - optuna.study._optimize - INFO - Trial 228 pruned. 
2026-05-18 03:34:09,199 - experiment_functions - INFO - Early stopping at epoch 1450. Best Recall: 0.0641
2026-05-18 03:34:09,299 - optuna.study.study - INFO - Trial 229 finished with value: 0.06414450747910334 and parameters: {'n_layers': 3, 'embedding_dim': 32, 'lr': 0.0004737629597397044, 'lambda_val': 0.00028485668078316297, 'batch_size': 617, 'optimizer': 'RMSprop'}. Best is trial 214 with value: 0.07497030493998583.
2026-05-18 03:34:21,137 - experiment_functions - INFO - Early stopping at epoch 500. Best Recall: 0.0050
