2026-05-18 07:53:57,258 - optuna.study._optimize - INFO - Trial 225 pruned. 
2026-05-18 07:54:34,465 - experiment_functions - INFO - Early stopping at epoch 2750. Best Recall: 0.0701
2026-05-18 07:54:34,557 - optuna.study.study - INFO - Trial 226 finished with value: 0.07007501074215217 and parameters: {'n_layers': 1, 'embedding_dim': 32, 'lr': 0.0008054068502168797, 'lambda_val': 0.0002949564893867955, 'batch_size': 661, 'optimizer': 'RMSprop'}. Best is trial 196 with value: 0.07108908999977814.
2026-05-18 07:54:46,783 - experiment_functions - INFO - Early stopping at epoch 950. Best Recall: 0.0055
2026-05-18 07:54:46,875 - optuna.study.study - INFO - Trial 227 finished with value: 0.005489575517616625 and parameters: {'n_layers': 1, 'embedding_dim': 32, 'lr': 3.3192417971602224e-05, 'lambda_val': 0.0002761298728423229, 'batch_size': 657, 'optimizer': 'RMSprop'}. Best is trial 196 with value: 0.07108908999977814.
2026-05-18 07:55:00,506 - optuna.study._optimize - INFO - Trial 228 pruned. 
2026-05-18 07:55:15,005 - optuna.study._optimize - INFO - Trial 229 pruned. 
2026-05-18 07:55:28,962 - optuna.study._optimize - INFO - Trial 230 pruned. 
2026-05-18 07:55:48,376 - experiment_functions - INFO - Early stopping at epoch 1350. Best Recall: 0.0687
2026-05-18 07:55:48,552 - optuna.study.study - INFO - Trial 231 finished with value: 0.0686809834956562 and parameters: {'n_layers': 1, 'embedding_dim': 32, 'lr': 0.0008808312472249622, 'lambda_val': 0.0004777852037988096, 'batch_size': 750, 'optimizer': 'RMSprop'}. Best is trial 196 with value: 0.07108908999977814.
2026-05-18 07:56:08,410 - experiment_functions - INFO - Early stopping at epoch 1400. Best Recall: 0.0714
2026-05-18 07:56:08,490 - optuna.study.study - INFO - Trial 232 finished with value: 0.0714455606399712 and parameters: {'n_layers': 1, 'embedding_dim': 32, 'lr': 0.0009095812465604236, 'lambda_val': 0.0006373198055496834, 'batch_size': 748, 'optimizer': 'RMSprop'}. Best is trial 232 with value: 0.0714455606399712.
2026-05-18 07:56:18,595 - experiment_functions - INFO - Early stopping at epoch 700. Best Recall: 0.0540
2026-05-18 07:56:18,708 - optuna.study.study - INFO - Trial 233 finished with value: 0.05400205729946628 and parameters: {'n_layers': 1, 'embedding_dim': 32, 'lr': 0.0010134669616105017, 'lambda_val': 0.0004860617613184427, 'batch_size': 3930, 'optimizer': 'RMSprop'}. Best is trial 232 with value: 0.0714455606399712.
2026-05-18 07:56:34,082 - optuna.study._optimize - INFO - Trial 234 pruned. 
2026-05-18 07:56:47,589 - optuna.study._optimize - INFO - Trial 235 pruned. 
2026-05-18 07:57:01,352 - experiment_functions - INFO - Early stopping at epoch 1000. Best Recall: 0.0655
2026-05-18 07:57:01,488 - optuna.study.study - INFO - Trial 236 finished with value: 0.06554399528790228 and parameters: {'n_layers': 1, 'embedding_dim': 32, 'lr': 0.0012244817394217345, 'lambda_val': 0.0003122412396538973, 'batch_size': 734, 'optimizer': 'RMSprop'}. Best is trial 232 with value: 0.0714455606399712.
2026-05-18 07:57:15,663 - optuna.study._optimize - INFO - Trial 237 pruned. 
2026-05-18 07:57:27,534 - experiment_functions - INFO - Early stopping at epoch 800. Best Recall: 0.0614
2026-05-18 07:57:27,635 - optuna.study.study - INFO - Trial 238 finished with value: 0.06142598769478014 and parameters: {'n_layers': 1, 'embedding_dim': 32, 'lr': 0.0016021480177412892, 'lambda_val': 0.0006623264345258724, 'batch_size': 654, 'optimizer': 'RMSprop'}. Best is trial 232 with value: 0.0714455606399712.
2026-05-18 07:57:39,237 - experiment_functions - INFO - Early stopping at epoch 750. Best Recall: 0.0345
2026-05-18 07:57:39,330 - optuna.study.study - INFO - Trial 239 finished with value: 0.03453439862839662 and parameters: {'n_layers': 4, 'embedding_dim': 32, 'lr': 0.0007696955724325824, 'lambda_val': 0.0004650672837918228, 'batch_size': 749, 'optimizer': 'RMSprop'}. Best is trial 232 with value: 0.0714455606399712.
2026-05-18 07:57:53,409 - optuna.study._optimize - INFO - Trial 240 pruned. 
2026-05-18 07:58:15,570 - optuna.study._optimize - INFO - Trial 241 pruned. 
2026-05-18 07:58:39,525 - optuna.study._optimize - INFO - Trial 242 pruned. 
2026-05-18 07:59:05,622 - experiment_functions - INFO - Early stopping at epoch 1800. Best Recall: 0.0746
2026-05-18 07:59:05,737 - optuna.study.study - INFO - Trial 243 finished with value: 0.07457215298749434 and parameters: {'n_layers': 1, 'embedding_dim': 32, 'lr': 0.0009998693795464698, 'lambda_val': 0.0006440577380394858, 'batch_size': 584, 'optimizer': 'RMSprop'}. Best is trial 243 with value: 0.07457215298749434.
2026-05-18 07:59:25,640 - optuna.study._optimize - INFO - Trial 244 pruned. 
2026-05-18 07:59:40,396 - optuna.study._optimize - INFO - Trial 245 pruned. 
2026-05-18 08:00:00,050 - experiment_functions - INFO - Early stopping at epoch 1200. Best Recall: 0.0709
2026-05-18 08:00:00,151 - optuna.study.study - INFO - Trial 246 finished with value: 0.07090868581381132 and parameters: {'n_layers': 1, 'embedding_dim': 32, 'lr': 0.0011515241305462252, 'lambda_val': 0.0011921168224336518, 'batch_size': 594, 'optimizer': 'RMSprop'}. Best is trial 243 with value: 0.07457215298749434.
2026-05-18 08:00:17,155 - experiment_functions - INFO - Early stopping at epoch 1150. Best Recall: 0.0690
2026-05-18 08:00:17,258 - optuna.study.study - INFO - Trial 247 finished with value: 0.06901442505137999 and parameters: {'n_layers': 1, 'embedding_dim': 32, 'lr': 0.0011646853474579968, 'lambda_val': 0.0009956570346561578, 'batch_size': 555, 'optimizer': 'RMSprop'}. Best is trial 243 with value: 0.07457215298749434.
2026-05-18 08:00:33,586 - experiment_functions - INFO - Early stopping at epoch 1100. Best Recall: 0.0710
2026-05-18 08:00:34,143 - optuna.study.study - INFO - Trial 248 finished with value: 0.07097794941564324 and parameters: {'n_layers': 1, 'embedding_dim': 32, 'lr': 0.0012278007343786243, 'lambda_val': 0.001688825275638306, 'batch_size': 565, 'optimizer': 'RMSprop'}. Best is trial 243 with value: 0.07457215298749434.
2026-05-18 08:00:45,328 - experiment_functions - INFO - Early stopping at epoch 750. Best Recall: 0.0653
2026-05-18 08:00:45,431 - optuna.study.study - INFO - Trial 249 finished with value: 0.06528117579260788 and parameters: {'n_layers': 1, 'embedding_dim': 32, 'lr': 0.001848644717334308, 'lambda_val': 0.00137053088364369, 'batch_size': 558, 'optimizer': 'RMSprop'}. Best is trial 243 with value: 0.07457215298749434.
2026-05-18 08:00:59,325 - experiment_functions - INFO - Early stopping at epoch 950. Best Recall: 0.0668
2026-05-18 08:00:59,416 - optuna.study.study - INFO - Trial 250 finished with value: 0.06683043820234724 and parameters: {'n_layers': 1, 'embedding_dim': 32, 'lr': 0.0014486458313664804, 'lambda_val': 0.0012766384833042775, 'batch_size': 563, 'optimizer': 'RMSprop'}. Best is trial 243 with value: 0.07457215298749434.
2026-05-18 08:01:19,757 - experiment_functions - INFO - Early stopping at epoch 1400. Best Recall: 0.0695
2026-05-18 08:01:19,847 - optuna.study.study - INFO - Trial 251 finished with value: 0.06946339846335496 and parameters: {'n_layers': 1, 'embedding_dim': 32, 'lr': 0.0010941846198161687, 'lambda_val': 0.002540140888897398, 'batch_size': 512, 'optimizer': 'RMSprop'}. Best is trial 243 with value: 0.07457215298749434.
2026-05-18 08:01:35,077 - experiment_functions - INFO - Early stopping at epoch 850. Best Recall: 0.0636
2026-05-18 08:01:35,159 - optuna.study.study - INFO - Trial 252 finished with value: 0.06359813409800422 and parameters: {'n_layers': 1, 'embedding_dim': 32, 'lr': 0.0014840714882089808, 'lambda_val': 0.0032386757836473127, 'batch_size': 513, 'optimizer': 'RMSprop'}. Best is trial 243 with value: 0.07457215298749434.
2026-05-18 08:01:50,045 - optuna.study._optimize - INFO - Trial 253 pruned. 
2026-05-18 08:02:05,410 - optuna.study._optimize - INFO - Trial 254 pruned. 
2026-05-18 08:02:22,476 - optuna.study._optimize - INFO - Trial 255 pruned. 
2026-05-18 08:02:32,422 - experiment_functions - INFO - Early stopping at epoch 650. Best Recall: 0.0500
2026-05-18 08:02:32,510 - optuna.study.study - INFO - Trial 256 finished with value: 0.05003551639188046 and parameters: {'n_layers': 2, 'embedding_dim': 32, 'lr': 0.0013534335068499119, 'lambda_val': 0.0020206452502609207, 'batch_size': 530, 'optimizer': 'RMSprop'}. Best is trial 243 with value: 0.07457215298749434.
2026-05-18 08:02:52,972 - experiment_functions - INFO - Early stopping at epoch 750. Best Recall: 0.0601
2026-05-18 08:02:53,139 - optuna.study.study - INFO - Trial 257 finished with value: 0.060120146506745874 and parameters: {'n_layers': 1, 'embedding_dim': 32, 'lr': 0.0018163892549998189, 'lambda_val': 0.0007326832242264383, 'batch_size': 633, 'optimizer': 'RMSprop'}. Best is trial 243 with value: 0.07457215298749434.
2026-05-18 08:03:00,647 - experiment_functions - INFO - Early stopping at epoch 500. Best Recall: 0.0048
2026-05-18 08:03:00,748 - optuna.study.study - INFO - Trial 258 finished with value: 0.004758789579103902 and parameters: {'n_layers': 1, 'embedding_dim': 32, 'lr': 0.0011070906192557398, 'lambda_val': 0.001432952413639958, 'batch_size': 529, 'optimizer': 'SGD'}. Best is trial 243 with value: 0.07457215298749434.
2026-05-18 08:03:22,134 - experiment_functions - INFO - Early stopping at epoch 1350. Best Recall: 0.0711
2026-05-18 08:03:22,212 - optuna.study.study - INFO - Trial 259 finished with value: 0.07111834573814826 and parameters: {'n_layers': 1, 'embedding_dim': 32, 'lr': 0.0010506894656655834, 'lambda_val': 0.001057658585208834, 'batch_size': 666, 'optimizer': 'RMSprop'}. Best is trial 243 with value: 0.07457215298749434.
2026-05-18 08:03:33,245 - experiment_functions - INFO - Early stopping at epoch 750. Best Recall: 0.0638
2026-05-18 08:03:33,336 - optuna.study.study - INFO - Trial 260 finished with value: 0.0638480879747472 and parameters: {'n_layers': 1, 'embedding_dim': 32, 'lr': 0.0015493332649555507, 'lambda_val': 0.001226152544477716, 'batch_size': 663, 'optimizer': 'RMSprop'}. Best is trial 243 with value: 0.07457215298749434.
2026-05-18 08:03:55,450 - experiment_functions - INFO - Early stopping at epoch 1500. Best Recall: 0.0754
2026-05-18 08:03:55,600 - optuna.study.study - INFO - Trial 261 finished with value: 0.07542654320885167 and parameters: {'n_layers': 1, 'embedding_dim': 32, 'lr': 0.0010202158413525925, 'lambda_val': 0.0010560191026238697, 'batch_size': 612, 'optimizer': 'RMSprop'}. Best is trial 261 with value: 0.07542654320885167.
2026-05-18 08:04:15,400 - experiment_functions - INFO - Early stopping at epoch 1300. Best Recall: 0.0682
2026-05-18 08:04:16,174 - optuna.study.study - INFO - Trial 262 finished with value: 0.06816016955567358 and parameters: {'n_layers': 1, 'embedding_dim': 32, 'lr': 0.001044115377181194, 'lambda_val': 0.001172920292871064, 'batch_size': 614, 'optimizer': 'RMSprop'}. Best is trial 261 with value: 0.07542654320885167.
2026-05-18 08:04:37,948 - experiment_functions - INFO - Early stopping at epoch 900. Best Recall: 0.0654
2026-05-18 08:04:38,038 - optuna.study.study - INFO - Trial 263 finished with value: 0.06543211543432173 and parameters: {'n_layers': 1, 'embedding_dim': 32, 'lr': 0.0013168049566685373, 'lambda_val': 0.0011962784260770895, 'batch_size': 513, 'optimizer': 'RMSprop'}. Best is trial 261 with value: 0.07542654320885167.
2026-05-18 08:04:53,923 - optuna.study._optimize - INFO - Trial 264 pruned. 
2026-05-18 08:05:09,263 - optuna.study._optimize - INFO - Trial 265 pruned. 
2026-05-18 08:05:32,458 - experiment_functions - INFO - Early stopping at epoch 1400. Best Recall: 0.0687
2026-05-18 08:05:32,559 - optuna.study.study - INFO - Trial 266 finished with value: 0.06868948603986766 and parameters: {'n_layers': 1, 'embedding_dim': 32, 'lr': 0.000985139853970132, 'lambda_val': 0.0009563917246006586, 'batch_size': 685, 'optimizer': 'RMSprop'}. Best is trial 261 with value: 0.07542654320885167.
2026-05-18 08:05:50,998 - experiment_functions - INFO - Early stopping at epoch 1250. Best Recall: 0.0689
2026-05-18 08:05:51,100 - optuna.study.study - INFO - Trial 267 finished with value: 0.06893836640519502 and parameters: {'n_layers': 1, 'embedding_dim': 32, 'lr': 0.000998804638733694, 'lambda_val': 0.000871981007415145, 'batch_size': 648, 'optimizer': 'RMSprop'}. Best is trial 261 with value: 0.07542654320885167.
2026-05-18 08:06:04,057 - experiment_functions - INFO - Early stopping at epoch 850. Best Recall: 0.0574
2026-05-18 08:06:04,148 - optuna.study.study - INFO - Trial 268 finished with value: 0.05738956004871008 and parameters: {'n_layers': 1, 'embedding_dim': 32, 'lr': 0.0016231333977993227, 'lambda_val': 0.0010146460609476362, 'batch_size': 677, 'optimizer': 'RMSprop'}. Best is trial 261 with value: 0.07542654320885167.
2026-05-18 08:06:19,239 - experiment_functions - INFO - Early stopping at epoch 1000. Best Recall: 0.0690
2026-05-18 08:06:19,340 - optuna.study.study - INFO - Trial 269 finished with value: 0.06895080158150362 and parameters: {'n_layers': 1, 'embedding_dim': 32, 'lr': 0.0012781889975521101, 'lambda_val': 0.0008976197412622322, 'batch_size': 584, 'optimizer': 'RMSprop'}. Best is trial 261 with value: 0.07542654320885167.
2026-05-18 08:06:30,864 - experiment_functions - INFO - Early stopping at epoch 700. Best Recall: 0.0613
2026-05-18 08:06:30,966 - optuna.study.study - INFO - Trial 270 finished with value: 0.06126509181055796 and parameters: {'n_layers': 1, 'embedding_dim': 32, 'lr': 0.00200954124649465, 'lambda_val': 0.0008641957202712967, 'batch_size': 592, 'optimizer': 'RMSprop'}. Best is trial 261 with value: 0.07542654320885167.
2026-05-18 08:06:45,782 - experiment_functions - INFO - Early stopping at epoch 950. Best Recall: 0.0593
2026-05-18 08:06:45,873 - optuna.study.study - INFO - Trial 271 finished with value: 0.05929116492273485 and parameters: {'n_layers': 1, 'embedding_dim': 32, 'lr': 0.0013333851596142232, 'lambda_val': 0.001027926948100103, 'batch_size': 699, 'optimizer': 'RMSprop'}. Best is trial 261 with value: 0.07542654320885167.
2026-05-18 08:07:03,844 - experiment_functions - INFO - Early stopping at epoch 1250. Best Recall: 0.0665
2026-05-18 08:07:03,944 - optuna.study.study - INFO - Trial 272 finished with value: 0.06649526374961036 and parameters: {'n_layers': 1, 'embedding_dim': 32, 'lr': 0.001075252933592454, 'lambda_val': 0.002246442747195376, 'batch_size': 635, 'optimizer': 'RMSprop'}. Best is trial 261 with value: 0.07542654320885167.
2026-05-18 08:07:29,951 - experiment_functions - INFO - Early stopping at epoch 1150. Best Recall: 0.0664
2026-05-18 08:07:30,052 - optuna.study.study - INFO - Trial 273 finished with value: 0.06637237392380034 and parameters: {'n_layers': 1, 'embedding_dim': 32, 'lr': 0.00124238190524914, 'lambda_val': 0.0007608080782758183, 'batch_size': 523, 'optimizer': 'RMSprop'}. Best is trial 261 with value: 0.07542654320885167.
2026-05-18 08:07:42,021 - experiment_functions - INFO - Early stopping at epoch 750. Best Recall: 0.0659
2026-05-18 08:07:42,122 - optuna.study.study - INFO - Trial 274 finished with value: 0.06593358119141862 and parameters: {'n_layers': 1, 'embedding_dim': 32, 'lr': 0.0016125782046155911, 'lambda_val': 0.0015499699017622595, 'batch_size': 701, 'optimizer': 'RMSprop'}. Best is trial 261 with value: 0.07542654320885167.
2026-05-18 08:08:05,166 - experiment_functions - INFO - Early stopping at epoch 1550. Best Recall: 0.0709
2026-05-18 08:08:05,287 - optuna.study.study - INFO - Trial 275 finished with value: 0.07086166125593595 and parameters: {'n_layers': 1, 'embedding_dim': 32, 'lr': 0.0010122752900844085, 'lambda_val': 0.0005685465463681177, 'batch_size': 595, 'optimizer': 'RMSprop'}. Best is trial 261 with value: 0.07542654320885167.
2026-05-18 08:08:28,718 - experiment_functions - INFO - Early stopping at epoch 1400. Best Recall: 0.0693
2026-05-18 08:08:28,809 - optuna.study.study - INFO - Trial 276 finished with value: 0.06930228169881077 and parameters: {'n_layers': 1, 'embedding_dim': 32, 'lr': 0.0010028945599488376, 'lambda_val': 0.0005884532717340981, 'batch_size': 512, 'optimizer': 'RMSprop'}. Best is trial 261 with value: 0.07542654320885167.
2026-05-18 08:08:38,026 - experiment_functions - INFO - Early stopping at epoch 600. Best Recall: 0.0531
2026-05-18 08:08:38,124 - optuna.study.study - INFO - Trial 277 finished with value: 0.053050656106642245 and parameters: {'n_layers': 1, 'embedding_dim': 32, 'lr': 0.002492273426762991, 'lambda_val': 0.0005714440490296388, 'batch_size': 559, 'optimizer': 'RMSprop'}. Best is trial 261 with value: 0.07542654320885167.
2026-05-18 08:09:01,300 - experiment_functions - INFO - Early stopping at epoch 1550. Best Recall: 0.0724
2026-05-18 08:09:01,446 - optuna.study.study - INFO - Trial 278 finished with value: 0.07237306319842221 and parameters: {'n_layers': 1, 'embedding_dim': 32, 'lr': 0.0009670109766492457, 'lambda_val': 0.0053925322969657396, 'batch_size': 523, 'optimizer': 'RMSprop'}. Best is trial 261 with value: 0.07542654320885167.
2026-05-18 08:09:14,349 - experiment_functions - INFO - Early stopping at epoch 850. Best Recall: 0.0673
2026-05-18 08:09:14,460 - optuna.study.study - INFO - Trial 279 finished with value: 0.067344069850679 and parameters: {'n_layers': 1, 'embedding_dim': 32, 'lr': 0.0012934587207946847, 'lambda_val': 0.010530898828625087, 'batch_size': 527, 'optimizer': 'RMSprop'}. Best is trial 261 with value: 0.07542654320885167.
2026-05-18 08:09:40,686 - experiment_functions - INFO - Early stopping at epoch 1800. Best Recall: 0.0710
2026-05-18 08:09:40,777 - optuna.study.study - INFO - Trial 280 finished with value: 0.07099524049152837 and parameters: {'n_layers': 1, 'embedding_dim': 32, 'lr': 0.0009642162529934445, 'lambda_val': 0.0008466456160829294, 'batch_size': 570, 'optimizer': 'RMSprop'}. Best is trial 261 with value: 0.07542654320885167.
2026-05-18 08:09:48,280 - experiment_functions - INFO - Early stopping at epoch 500. Best Recall: 0.0065
2026-05-18 08:09:48,381 - optuna.study.study - INFO - Trial 281 finished with value: 0.006521515580524926 and parameters: {'n_layers': 1, 'embedding_dim': 32, 'lr': 0.001006767097320586, 'lambda_val': 0.0006418171621353984, 'batch_size': 519, 'optimizer': 'SGD'}. Best is trial 261 with value: 0.07542654320885167.
2026-05-18 08:10:01,369 - experiment_functions - INFO - Early stopping at epoch 850. Best Recall: 0.0616
2026-05-18 08:10:01,470 - optuna.study.study - INFO - Trial 282 finished with value: 0.06159842590781214 and parameters: {'n_layers': 1, 'embedding_dim': 32, 'lr': 0.0014183340165940053, 'lambda_val': 0.0008850068469565884, 'batch_size': 587, 'optimizer': 'RMSprop'}. Best is trial 261 with value: 0.07542654320885167.
2026-05-18 08:10:26,475 - optuna.study._optimize - INFO - Trial 283 pruned. 
2026-05-18 08:10:41,011 - experiment_functions - INFO - Early stopping at epoch 1000. Best Recall: 0.0660
2026-05-18 08:10:41,114 - optuna.study.study - INFO - Trial 284 finished with value: 0.06598006792576888 and parameters: {'n_layers': 1, 'embedding_dim': 32, 'lr': 0.001198705378654159, 'lambda_val': 0.005241056383566545, 'batch_size': 518, 'optimizer': 'RMSprop'}. Best is trial 261 with value: 0.07542654320885167.
2026-05-18 08:10:52,020 - experiment_functions - INFO - Early stopping at epoch 700. Best Recall: 0.0593
2026-05-18 08:10:52,121 - optuna.study.study - INFO - Trial 285 finished with value: 0.059337405441569346 and parameters: {'n_layers': 1, 'embedding_dim': 32, 'lr': 0.0017387270838551193, 'lambda_val': 0.005442998669045509, 'batch_size': 583, 'optimizer': 'RMSprop'}. Best is trial 261 with value: 0.07542654320885167.
2026-05-18 08:11:06,940 - optuna.study._optimize - INFO - Trial 286 pruned. 
2026-05-18 08:11:28,283 - experiment_functions - INFO - Early stopping at epoch 1150. Best Recall: 0.0656
2026-05-18 08:11:28,390 - optuna.study.study - INFO - Trial 287 finished with value: 0.06564591786093985 and parameters: {'n_layers': 1, 'embedding_dim': 32, 'lr': 0.0011430327822617198, 'lambda_val': 0.000954054852839852, 'batch_size': 689, 'optimizer': 'RMSprop'}. Best is trial 261 with value: 0.07542654320885167.
2026-05-18 08:11:55,423 - experiment_functions - INFO - Early stopping at epoch 1550. Best Recall: 0.0675
2026-05-18 08:11:55,514 - optuna.study.study - INFO - Trial 288 finished with value: 0.06747032730565343 and parameters: {'n_layers': 1, 'embedding_dim': 32, 'lr': 0.0009384027372295197, 'lambda_val': 0.000672130534598544, 'batch_size': 604, 'optimizer': 'RMSprop'}. Best is trial 261 with value: 0.07542654320885167.
2026-05-18 08:12:14,722 - experiment_functions - INFO - Early stopping at epoch 850. Best Recall: 0.0626
2026-05-18 08:12:17,390 - optuna.study.study - INFO - Trial 289 finished with value: 0.06257855691884766 and parameters: {'n_layers': 1, 'embedding_dim': 32, 'lr': 0.001434057575620067, 'lambda_val': 0.0005069772981155903, 'batch_size': 512, 'optimizer': 'RMSprop'}. Best is trial 261 with value: 0.07542654320885167.
2026-05-18 08:12:30,921 - experiment_functions - INFO - Early stopping at epoch 900. Best Recall: 0.0661
2026-05-18 08:12:31,023 - optuna.study.study - INFO - Trial 290 finished with value: 0.06611031114683069 and parameters: {'n_layers': 1, 'embedding_dim': 32, 'lr': 0.001171207261191382, 'lambda_val': 0.006682169164801583, 'batch_size': 707, 'optimizer': 'RMSprop'}. Best is trial 261 with value: 0.07542654320885167.
2026-05-18 08:12:48,817 - experiment_functions - INFO - Early stopping at epoch 700. Best Recall: 0.0429
2026-05-18 08:12:48,928 - optuna.study.study - INFO - Trial 291 finished with value: 0.042929412757643955 and parameters: {'n_layers': 3, 'embedding_dim': 32, 'lr': 0.000937689114254934, 'lambda_val': 0.0010985949503066652, 'batch_size': 583, 'optimizer': 'RMSprop'}. Best is trial 261 with value: 0.07542654320885167.
2026-05-18 08:13:02,466 - experiment_functions - INFO - Early stopping at epoch 900. Best Recall: 0.0658
