2026-05-18 22:43:51,498 - optuna.study.study - INFO - Trial 73 finished with value: 0.07254463290028153 and parameters: {'n_layers': 1, 'embedding_dim': 32, 'lr': 0.0006290770347319913, 'lambda_val': 0.02396586640697874, 'batch_size': 662, 'optimizer': 'RMSprop'}. Best is trial 53 with value: 0.07320461295991322.
2026-05-18 22:44:07,638 - experiment_functions - INFO - Early stopping at epoch 1150. Best Recall: 0.0656
2026-05-18 22:44:07,742 - optuna.study.study - INFO - Trial 74 finished with value: 0.06557191164777171 and parameters: {'n_layers': 1, 'embedding_dim': 32, 'lr': 0.0010014894939618273, 'lambda_val': 0.006479592573237996, 'batch_size': 649, 'optimizer': 'RMSprop'}. Best is trial 53 with value: 0.07320461295991322.
2026-05-18 22:44:21,570 - optuna.study._optimize - INFO - Trial 75 pruned. 
2026-05-18 22:44:36,220 - optuna.study._optimize - INFO - Trial 76 pruned. 
2026-05-18 22:44:43,304 - experiment_functions - INFO - Early stopping at epoch 500. Best Recall: 0.0047
2026-05-18 22:44:43,395 - optuna.study.study - INFO - Trial 77 finished with value: 0.00466250067334528 and parameters: {'n_layers': 2, 'embedding_dim': 32, 'lr': 0.0013102843283284045, 'lambda_val': 0.00019298279573947864, 'batch_size': 3011, 'optimizer': 'SGD'}. Best is trial 53 with value: 0.07320461295991322.
2026-05-18 22:44:53,863 - experiment_functions - INFO - Early stopping at epoch 600. Best Recall: 0.0250
2026-05-18 22:44:54,641 - optuna.study.study - INFO - Trial 78 finished with value: 0.025042904332183973 and parameters: {'n_layers': 4, 'embedding_dim': 96, 'lr': 0.0005440904118326838, 'lambda_val': 0.02023870965605512, 'batch_size': 1494, 'optimizer': 'RMSprop'}. Best is trial 53 with value: 0.07320461295991322.
2026-05-18 22:45:10,088 - experiment_functions - INFO - Early stopping at epoch 500. Best Recall: 0.0051
2026-05-18 22:45:10,192 - optuna.study.study - INFO - Trial 79 finished with value: 0.005105262341881023 and parameters: {'n_layers': 1, 'embedding_dim': 64, 'lr': 0.00027994032233564765, 'lambda_val': 0.0770980274109254, 'batch_size': 950, 'optimizer': 'RMSprop'}. Best is trial 53 with value: 0.07320461295991322.
2026-05-18 22:45:28,091 - experiment_functions - INFO - Early stopping at epoch 1250. Best Recall: 0.0671
2026-05-18 22:45:28,204 - optuna.study.study - INFO - Trial 80 finished with value: 0.0670979413447119 and parameters: {'n_layers': 1, 'embedding_dim': 32, 'lr': 0.0008375645415293291, 'lambda_val': 1.064699576501633e-06, 'batch_size': 1059, 'optimizer': 'RMSprop'}. Best is trial 53 with value: 0.07320461295991322.
2026-05-18 22:45:35,594 - experiment_functions - INFO - Early stopping at epoch 500. Best Recall: 0.0052
2026-05-18 22:45:35,698 - optuna.study.study - INFO - Trial 81 finished with value: 0.0051953046812878685 and parameters: {'n_layers': 1, 'embedding_dim': 32, 'lr': 0.0003916974315442558, 'lambda_val': 0.031296460352113545, 'batch_size': 749, 'optimizer': 'RMSprop'}. Best is trial 53 with value: 0.07320461295991322.
2026-05-18 22:45:54,589 - experiment_functions - INFO - Early stopping at epoch 1300. Best Recall: 0.0652
2026-05-18 22:45:55,356 - optuna.study.study - INFO - Trial 82 finished with value: 0.06522245689958496 and parameters: {'n_layers': 1, 'embedding_dim': 32, 'lr': 0.0006541433366748029, 'lambda_val': 0.04794869425880425, 'batch_size': 619, 'optimizer': 'RMSprop'}. Best is trial 53 with value: 0.07320461295991322.
2026-05-18 22:46:22,077 - experiment_functions - INFO - Early stopping at epoch 1450. Best Recall: 0.0676
2026-05-18 22:46:22,180 - optuna.study.study - INFO - Trial 83 finished with value: 0.06763519415883266 and parameters: {'n_layers': 1, 'embedding_dim': 32, 'lr': 0.0006285551360856496, 'lambda_val': 0.017356745152545774, 'batch_size': 809, 'optimizer': 'RMSprop'}. Best is trial 53 with value: 0.07320461295991322.
2026-05-18 22:46:34,577 - experiment_functions - INFO - Early stopping at epoch 850. Best Recall: 0.0727
2026-05-18 22:46:34,680 - optuna.study.study - INFO - Trial 84 finished with value: 0.07273425957030162 and parameters: {'n_layers': 1, 'embedding_dim': 32, 'lr': 0.0012039272629433828, 'lambda_val': 0.008368574287248529, 'batch_size': 709, 'optimizer': 'RMSprop'}. Best is trial 53 with value: 0.07320461295991322.
2026-05-18 22:46:48,763 - experiment_functions - INFO - Early stopping at epoch 650. Best Recall: 0.0525
2026-05-18 22:46:48,855 - optuna.study.study - INFO - Trial 85 finished with value: 0.05254655631855718 and parameters: {'n_layers': 1, 'embedding_dim': 128, 'lr': 0.0011017562120447053, 'lambda_val': 0.005827888914254961, 'batch_size': 2145, 'optimizer': 'RMSprop'}. Best is trial 53 with value: 0.07320461295991322.
2026-05-18 22:47:01,844 - experiment_functions - INFO - Early stopping at epoch 600. Best Recall: 0.0620
2026-05-18 22:47:01,948 - optuna.study.study - INFO - Trial 86 finished with value: 0.061963917030315 and parameters: {'n_layers': 1, 'embedding_dim': 32, 'lr': 0.001711949669712889, 'lambda_val': 0.009086232205666794, 'batch_size': 1320, 'optimizer': 'RMSprop'}. Best is trial 53 with value: 0.07320461295991322.
2026-05-18 22:47:13,409 - experiment_functions - INFO - Early stopping at epoch 650. Best Recall: 0.0052
2026-05-18 22:47:13,500 - optuna.study.study - INFO - Trial 87 finished with value: 0.005158244486472592 and parameters: {'n_layers': 1, 'embedding_dim': 32, 'lr': 0.0001992478889354651, 'lambda_val': 0.0032234900124043916, 'batch_size': 696, 'optimizer': 'Adam'}. Best is trial 53 with value: 0.07320461295991322.
2026-05-18 22:47:26,364 - optuna.study._optimize - INFO - Trial 88 pruned. 
2026-05-18 22:47:34,325 - experiment_functions - INFO - Early stopping at epoch 550. Best Recall: 0.0454
2026-05-18 22:47:34,491 - optuna.study.study - INFO - Trial 89 finished with value: 0.04536796713983125 and parameters: {'n_layers': 1, 'embedding_dim': 32, 'lr': 0.0029561648090062455, 'lambda_val': 0.005436397934145133, 'batch_size': 922, 'optimizer': 'RMSprop'}. Best is trial 53 with value: 0.07320461295991322.
2026-05-18 22:47:46,104 - experiment_functions - INFO - Early stopping at epoch 500. Best Recall: 0.0049
2026-05-18 22:47:46,207 - optuna.study.study - INFO - Trial 90 finished with value: 0.004928576434076218 and parameters: {'n_layers': 3, 'embedding_dim': 32, 'lr': 0.0012188174002883097, 'lambda_val': 5.0391149024373075e-05, 'batch_size': 1051, 'optimizer': 'SGD'}. Best is trial 53 with value: 0.07320461295991322.
2026-05-18 22:48:00,366 - optuna.study._optimize - INFO - Trial 91 pruned. 
2026-05-18 22:48:14,039 - optuna.study._optimize - INFO - Trial 92 pruned. 
2026-05-18 22:48:22,698 - experiment_functions - INFO - Early stopping at epoch 500. Best Recall: 0.0049
2026-05-18 22:48:23,468 - optuna.study.study - INFO - Trial 93 finished with value: 0.004917758746719014 and parameters: {'n_layers': 1, 'embedding_dim': 32, 'lr': 0.0004196956308989196, 'lambda_val': 0.02375657454790248, 'batch_size': 596, 'optimizer': 'RMSprop'}. Best is trial 53 with value: 0.07320461295991322.
2026-05-18 22:48:46,775 - experiment_functions - INFO - Early stopping at epoch 1150. Best Recall: 0.0670
2026-05-18 22:48:46,879 - optuna.study.study - INFO - Trial 94 finished with value: 0.06695442814896076 and parameters: {'n_layers': 1, 'embedding_dim': 32, 'lr': 0.000695456028153507, 'lambda_val': 0.02656812730123951, 'batch_size': 864, 'optimizer': 'RMSprop'}. Best is trial 53 with value: 0.07320461295991322.
2026-05-18 22:49:01,914 - optuna.study._optimize - INFO - Trial 95 pruned. 
2026-05-18 22:49:11,996 - experiment_functions - INFO - Early stopping at epoch 600. Best Recall: 0.0624
2026-05-18 22:49:12,144 - optuna.study.study - INFO - Trial 96 finished with value: 0.06236557631008087 and parameters: {'n_layers': 1, 'embedding_dim': 32, 'lr': 0.001915145541836952, 'lambda_val': 0.007924163268506555, 'batch_size': 982, 'optimizer': 'RMSprop'}. Best is trial 53 with value: 0.07320461295991322.
2026-05-18 22:49:22,387 - experiment_functions - INFO - Early stopping at epoch 700. Best Recall: 0.0625
2026-05-18 22:49:22,479 - optuna.study.study - INFO - Trial 97 finished with value: 0.06252023032079009 and parameters: {'n_layers': 1, 'embedding_dim': 32, 'lr': 0.001521689420513456, 'lambda_val': 0.012244188903278908, 'batch_size': 635, 'optimizer': 'RMSprop'}. Best is trial 53 with value: 0.07320461295991322.
2026-05-18 22:49:30,837 - experiment_functions - INFO - Early stopping at epoch 550. Best Recall: 0.0392
2026-05-18 22:49:30,930 - optuna.study.study - INFO - Trial 98 finished with value: 0.03916802949779729 and parameters: {'n_layers': 2, 'embedding_dim': 96, 'lr': 0.0009093955931527691, 'lambda_val': 2.957784953194595e-06, 'batch_size': 3964, 'optimizer': 'RMSprop'}. Best is trial 53 with value: 0.07320461295991322.
2026-05-18 22:49:38,157 - experiment_functions - INFO - Early stopping at epoch 500. Best Recall: 0.0052
2026-05-18 22:49:38,250 - optuna.study.study - INFO - Trial 99 finished with value: 0.0051696138201782925 and parameters: {'n_layers': 1, 'embedding_dim': 32, 'lr': 2.401282264773615e-05, 'lambda_val': 0.016681922850505015, 'batch_size': 879, 'optimizer': 'RMSprop'}. Best is trial 53 with value: 0.07320461295991322.
2026-05-18 22:49:52,240 - optuna.study._optimize - INFO - Trial 100 pruned. 
2026-05-18 22:50:05,275 - experiment_functions - INFO - Early stopping at epoch 900. Best Recall: 0.0658
2026-05-18 22:50:05,378 - optuna.study.study - INFO - Trial 101 finished with value: 0.06581537483703985 and parameters: {'n_layers': 1, 'embedding_dim': 32, 'lr': 0.0007664240182220061, 'lambda_val': 0.024683695339672164, 'batch_size': 1197, 'optimizer': 'RMSprop'}. Best is trial 53 with value: 0.07320461295991322.
2026-05-18 22:50:19,407 - experiment_functions - INFO - Early stopping at epoch 1000. Best Recall: 0.0630
2026-05-18 22:50:19,499 - optuna.study.study - INFO - Trial 102 finished with value: 0.06303676257812206 and parameters: {'n_layers': 1, 'embedding_dim': 32, 'lr': 0.0005972236660911201, 'lambda_val': 0.041336162473938114, 'batch_size': 1428, 'optimizer': 'RMSprop'}. Best is trial 53 with value: 0.07320461295991322.
2026-05-18 22:50:30,143 - experiment_functions - INFO - Early stopping at epoch 700. Best Recall: 0.0493
2026-05-18 22:50:30,237 - optuna.study.study - INFO - Trial 103 finished with value: 0.049326824310675046 and parameters: {'n_layers': 1, 'embedding_dim': 32, 'lr': 0.0011851976985800202, 'lambda_val': 0.06291390342138446, 'batch_size': 1285, 'optimizer': 'RMSprop'}. Best is trial 53 with value: 0.07320461295991322.
2026-05-18 22:50:47,405 - experiment_functions - INFO - Early stopping at epoch 1200. Best Recall: 0.0697
2026-05-18 22:50:47,509 - optuna.study.study - INFO - Trial 104 finished with value: 0.06972606181226698 and parameters: {'n_layers': 1, 'embedding_dim': 32, 'lr': 0.0007891426794058981, 'lambda_val': 0.02872659918782735, 'batch_size': 695, 'optimizer': 'RMSprop'}. Best is trial 53 with value: 0.07320461295991322.
2026-05-18 22:51:00,620 - experiment_functions - INFO - Early stopping at epoch 850. Best Recall: 0.0625
2026-05-18 22:51:00,712 - optuna.study.study - INFO - Trial 105 finished with value: 0.06250938195462892 and parameters: {'n_layers': 1, 'embedding_dim': 32, 'lr': 0.0010261047298426892, 'lambda_val': 0.019498675931983046, 'batch_size': 694, 'optimizer': 'RMSprop'}. Best is trial 53 with value: 0.07320461295991322.
2026-05-18 22:51:07,954 - experiment_functions - INFO - Early stopping at epoch 500. Best Recall: 0.0055
2026-05-18 22:51:08,047 - optuna.study.study - INFO - Trial 106 finished with value: 0.005506322411843708 and parameters: {'n_layers': 1, 'embedding_dim': 32, 'lr': 0.0007283586426146769, 'lambda_val': 0.029231267864898918, 'batch_size': 585, 'optimizer': 'Adam'}. Best is trial 53 with value: 0.07320461295991322.
2026-05-18 22:51:15,063 - experiment_functions - INFO - Early stopping at epoch 500. Best Recall: 0.0050
2026-05-18 22:51:15,156 - optuna.study.study - INFO - Trial 107 finished with value: 0.005035192942120604 and parameters: {'n_layers': 1, 'embedding_dim': 64, 'lr': 0.00046392887502554015, 'lambda_val': 0.08041844920678966, 'batch_size': 815, 'optimizer': 'RMSprop'}. Best is trial 53 with value: 0.07320461295991322.
2026-05-18 22:51:55,104 - experiment_functions - INFO - Early stopping at epoch 2650. Best Recall: 0.0711
2026-05-18 22:51:55,868 - optuna.study.study - INFO - Trial 108 finished with value: 0.07114222251871298 and parameters: {'n_layers': 1, 'embedding_dim': 32, 'lr': 0.0006021805241353196, 'lambda_val': 0.000237477832216524, 'batch_size': 948, 'optimizer': 'RMSprop'}. Best is trial 53 with value: 0.07320461295991322.
2026-05-18 22:52:11,932 - experiment_functions - INFO - Early stopping at epoch 800. Best Recall: 0.0655
2026-05-18 22:52:12,036 - optuna.study.study - INFO - Trial 109 finished with value: 0.06548698625619297 and parameters: {'n_layers': 1, 'embedding_dim': 32, 'lr': 0.001418183484960733, 'lambda_val': 0.0005045500118410446, 'batch_size': 956, 'optimizer': 'RMSprop'}. Best is trial 53 with value: 0.07320461295991322.
2026-05-18 22:52:19,232 - experiment_functions - INFO - Early stopping at epoch 500. Best Recall: 0.0051
2026-05-18 22:52:19,335 - optuna.study.study - INFO - Trial 110 finished with value: 0.005085085779957184 and parameters: {'n_layers': 1, 'embedding_dim': 32, 'lr': 0.0005636647552502547, 'lambda_val': 0.00011648309619492578, 'batch_size': 1128, 'optimizer': 'SGD'}. Best is trial 53 with value: 0.07320461295991322.
2026-05-18 22:52:32,845 - optuna.study._optimize - INFO - Trial 111 pruned. 
2026-05-18 22:52:47,518 - experiment_functions - INFO - Early stopping at epoch 1050. Best Recall: 0.0686
2026-05-18 22:52:47,618 - optuna.study.study - INFO - Trial 112 finished with value: 0.06861639041750461 and parameters: {'n_layers': 1, 'embedding_dim': 32, 'lr': 0.0008949445430238579, 'lambda_val': 0.009675906472506435, 'batch_size': 848, 'optimizer': 'RMSprop'}. Best is trial 53 with value: 0.07320461295991322.
2026-05-18 22:53:06,086 - experiment_functions - INFO - Early stopping at epoch 1300. Best Recall: 0.0645
2026-05-18 22:53:06,176 - optuna.study.study - INFO - Trial 113 finished with value: 0.0645341060245556 and parameters: {'n_layers': 1, 'embedding_dim': 32, 'lr': 0.0008891133174071568, 'lambda_val': 1.3268222560881585e-05, 'batch_size': 911, 'optimizer': 'RMSprop'}. Best is trial 53 with value: 0.07320461295991322.
2026-05-18 22:53:19,980 - experiment_functions - INFO - Early stopping at epoch 1000. Best Recall: 0.0700
2026-05-18 22:53:20,071 - optuna.study.study - INFO - Trial 114 finished with value: 0.06999674709555881 and parameters: {'n_layers': 1, 'embedding_dim': 32, 'lr': 0.0011138209665860245, 'lambda_val': 7.809803134847488e-05, 'batch_size': 1018, 'optimizer': 'RMSprop'}. Best is trial 53 with value: 0.07320461295991322.
2026-05-18 22:53:28,981 - experiment_functions - INFO - Early stopping at epoch 600. Best Recall: 0.0563
2026-05-18 22:53:29,082 - optuna.study.study - INFO - Trial 115 finished with value: 0.05627509660365562 and parameters: {'n_layers': 1, 'embedding_dim': 32, 'lr': 0.0022685249254252573, 'lambda_val': 1.9678575761671355e-05, 'batch_size': 1059, 'optimizer': 'RMSprop'}. Best is trial 53 with value: 0.07320461295991322.
2026-05-18 22:53:43,326 - experiment_functions - INFO - Early stopping at epoch 950. Best Recall: 0.0644
2026-05-18 22:53:43,408 - optuna.study.study - INFO - Trial 116 finished with value: 0.0643643931390963 and parameters: {'n_layers': 1, 'embedding_dim': 32, 'lr': 0.0011121117345377143, 'lambda_val': 3.6606536060260195e-05, 'batch_size': 982, 'optimizer': 'RMSprop'}. Best is trial 53 with value: 0.07320461295991322.
2026-05-18 22:54:06,631 - optuna.study._optimize - INFO - Trial 117 pruned. 
2026-05-18 22:54:36,493 - experiment_functions - INFO - Early stopping at epoch 2000. Best Recall: 0.0672
2026-05-18 22:54:37,016 - optuna.study.study - INFO - Trial 118 finished with value: 0.06719739295501545 and parameters: {'n_layers': 1, 'embedding_dim': 256, 'lr': 0.0005227530917950094, 'lambda_val': 1.1510693094252723e-05, 'batch_size': 661, 'optimizer': 'RMSprop'}. Best is trial 53 with value: 0.07320461295991322.
2026-05-18 22:54:51,150 - optuna.study._optimize - INFO - Trial 119 pruned. 
2026-05-18 22:55:07,198 - experiment_functions - INFO - Early stopping at epoch 1150. Best Recall: 0.0685
2026-05-18 22:55:07,300 - optuna.study.study - INFO - Trial 120 finished with value: 0.06847529110209177 and parameters: {'n_layers': 1, 'embedding_dim': 32, 'lr': 0.001296074272984967, 'lambda_val': 8.341025895731634e-05, 'batch_size': 583, 'optimizer': 'RMSprop'}. Best is trial 53 with value: 0.07320461295991322.
2026-05-18 22:55:31,675 - experiment_functions - INFO - Early stopping at epoch 1150. Best Recall: 0.0646
2026-05-18 22:55:31,765 - optuna.study.study - INFO - Trial 121 finished with value: 0.06460583146388323 and parameters: {'n_layers': 1, 'embedding_dim': 32, 'lr': 0.0008273315838150879, 'lambda_val': 0.009937639114430552, 'batch_size': 845, 'optimizer': 'RMSprop'}. Best is trial 53 with value: 0.07320461295991322.
2026-05-18 22:55:40,442 - experiment_functions - INFO - Early stopping at epoch 600. Best Recall: 0.0551
2026-05-18 22:55:40,534 - optuna.study.study - INFO - Trial 122 finished with value: 0.05508740748414662 and parameters: {'n_layers': 1, 'embedding_dim': 32, 'lr': 0.0016225154468917833, 'lambda_val': 0.0002668543608922815, 'batch_size': 2678, 'optimizer': 'RMSprop'}. Best is trial 53 with value: 0.07320461295991322.
2026-05-18 22:55:54,753 - optuna.study._optimize - INFO - Trial 123 pruned. 
2026-05-18 22:56:37,157 - experiment_functions - INFO - Early stopping at epoch 3150. Best Recall: 0.0718
2026-05-18 22:56:37,236 - optuna.study.study - INFO - Trial 124 finished with value: 0.0717557678857516 and parameters: {'n_layers': 1, 'embedding_dim': 32, 'lr': 0.0006480832985610136, 'lambda_val': 0.00014486540779580007, 'batch_size': 770, 'optimizer': 'RMSprop'}. Best is trial 53 with value: 0.07320461295991322.
2026-05-18 22:56:51,040 - optuna.study._optimize - INFO - Trial 125 pruned. 
2026-05-18 22:57:11,978 - optuna.study._optimize - INFO - Trial 126 pruned. 
2026-05-18 22:57:31,007 - optuna.study._optimize - INFO - Trial 127 pruned. 
2026-05-18 22:57:44,782 - optuna.study._optimize - INFO - Trial 128 pruned. 
2026-05-18 22:57:58,292 - optuna.study._optimize - INFO - Trial 129 pruned. 
2026-05-18 22:58:09,065 - experiment_functions - INFO - Early stopping at epoch 600. Best Recall: 0.0371
2026-05-18 22:58:09,156 - optuna.study.study - INFO - Trial 130 finished with value: 0.03713400412027251 and parameters: {'n_layers': 3, 'embedding_dim': 128, 'lr': 0.0007029011694647905, 'lambda_val': 5.8944685423612314e-05, 'batch_size': 1190, 'optimizer': 'RMSprop'}. Best is trial 53 with value: 0.07320461295991322.
2026-05-18 22:58:32,277 - experiment_functions - INFO - Early stopping at epoch 950. Best Recall: 0.0695
2026-05-18 22:58:32,370 - optuna.study.study - INFO - Trial 131 finished with value: 0.06948138234965298 and parameters: {'n_layers': 1, 'embedding_dim': 32, 'lr': 0.0009186775602378407, 'lambda_val': 0.015435419990797804, 'batch_size': 860, 'optimizer': 'RMSprop'}. Best is trial 53 with value: 0.07320461295991322.
2026-05-18 22:58:45,911 - experiment_functions - INFO - Early stopping at epoch 900. Best Recall: 0.0654
2026-05-18 22:58:46,001 - optuna.study.study - INFO - Trial 132 finished with value: 0.06535551116906439 and parameters: {'n_layers': 1, 'embedding_dim': 32, 'lr': 0.0011381504843761387, 'lambda_val': 0.013842345462063676, 'batch_size': 669, 'optimizer': 'RMSprop'}. Best is trial 53 with value: 0.07320461295991322.
2026-05-18 22:59:00,542 - optuna.study._optimize - INFO - Trial 133 pruned. 
2026-05-18 22:59:32,567 - optuna.study._optimize - INFO - Trial 134 pruned. 
2026-05-18 22:59:55,286 - experiment_functions - INFO - Early stopping at epoch 1600. Best Recall: 0.0677
2026-05-18 22:59:55,376 - optuna.study.study - INFO - Trial 135 finished with value: 0.06769883886628399 and parameters: {'n_layers': 1, 'embedding_dim': 32, 'lr': 0.0008217668476543904, 'lambda_val': 0.00011941551922298542, 'batch_size': 811, 'optimizer': 'RMSprop'}. Best is trial 53 with value: 0.07320461295991322.
2026-05-18 23:00:06,093 - experiment_functions - INFO - Early stopping at epoch 750. Best Recall: 0.0693
2026-05-18 23:00:06,192 - optuna.study.study - INFO - Trial 136 finished with value: 0.06927238030690099 and parameters: {'n_layers': 1, 'embedding_dim': 32, 'lr': 0.0013297486167675537, 'lambda_val': 0.020196920965113763, 'batch_size': 728, 'optimizer': 'RMSprop'}. Best is trial 53 with value: 0.07320461295991322.
2026-05-18 23:00:12,981 - experiment_functions - INFO - Early stopping at epoch 500. Best Recall: 0.0055
2026-05-18 23:00:13,072 - optuna.study.study - INFO - Trial 137 finished with value: 0.005466633374861355 and parameters: {'n_layers': 1, 'embedding_dim': 32, 'lr': 0.0018644735551764952, 'lambda_val': 1.970835200427088e-06, 'batch_size': 922, 'optimizer': 'SGD'}. Best is trial 53 with value: 0.07320461295991322.
2026-05-18 23:00:28,217 - experiment_functions - INFO - Early stopping at epoch 850. Best Recall: 0.0681
2026-05-18 23:00:28,310 - optuna.study.study - INFO - Trial 138 finished with value: 0.06810445853741065 and parameters: {'n_layers': 1, 'embedding_dim': 32, 'lr': 0.0014263515420646143, 'lambda_val': 2.942414855752359e-06, 'batch_size': 761, 'optimizer': 'RMSprop'}. Best is trial 53 with value: 0.07320461295991322.
2026-05-18 23:00:40,498 - experiment_functions - INFO - Early stopping at epoch 900. Best Recall: 0.0594
