2026-05-19 05:03:21,769 - optuna.study.study - INFO - Trial 83 finished with value: 0.06469455086181564 and parameters: {'n_layers': 1, 'embedding_dim': 32, 'lr': 0.0016143219707994666, 'lambda_val': 0.0007620149676538132, 'batch_size': 966, 'optimizer': 'RMSprop'}. Best is trial 64 with value: 0.0688305382200038.
2026-05-19 05:03:44,432 - experiment_functions - INFO - Early stopping at epoch 1600. Best Recall: 0.0697
2026-05-19 05:03:44,522 - optuna.study.study - INFO - Trial 84 finished with value: 0.06970078686067657 and parameters: {'n_layers': 1, 'embedding_dim': 32, 'lr': 0.0007565101181034109, 'lambda_val': 0.00013066962754227385, 'batch_size': 1157, 'optimizer': 'RMSprop'}. Best is trial 84 with value: 0.06970078686067657.
2026-05-19 05:03:57,715 - experiment_functions - INFO - Early stopping at epoch 900. Best Recall: 0.0609
2026-05-19 05:03:57,811 - optuna.study.study - INFO - Trial 85 finished with value: 0.06085246349596091 and parameters: {'n_layers': 1, 'embedding_dim': 32, 'lr': 0.0012358048732318133, 'lambda_val': 0.00015187575425491663, 'batch_size': 1152, 'optimizer': 'RMSprop'}. Best is trial 84 with value: 0.06970078686067657.
2026-05-19 05:04:12,898 - optuna.study._optimize - INFO - Trial 86 pruned. 
2026-05-19 05:04:24,238 - experiment_functions - INFO - Early stopping at epoch 650. Best Recall: 0.0386
2026-05-19 05:04:24,343 - optuna.study.study - INFO - Trial 87 finished with value: 0.03859580380991445 and parameters: {'n_layers': 3, 'embedding_dim': 64, 'lr': 0.0008850519902151616, 'lambda_val': 0.00010504352781955274, 'batch_size': 1239, 'optimizer': 'RMSprop'}. Best is trial 84 with value: 0.06970078686067657.
2026-05-19 05:04:39,878 - optuna.study._optimize - INFO - Trial 88 pruned. 
2026-05-19 05:04:47,359 - experiment_functions - INFO - Early stopping at epoch 500. Best Recall: 0.0053
2026-05-19 05:04:47,448 - optuna.study.study - INFO - Trial 89 finished with value: 0.005269094829869907 and parameters: {'n_layers': 1, 'embedding_dim': 128, 'lr': 0.0002243585491252576, 'lambda_val': 3.6352000336313104e-05, 'batch_size': 2528, 'optimizer': 'SGD'}. Best is trial 84 with value: 0.06970078686067657.
2026-05-19 05:05:01,667 - optuna.study._optimize - INFO - Trial 90 pruned. 
2026-05-19 05:05:18,323 - experiment_functions - INFO - Early stopping at epoch 1150. Best Recall: 0.0633
2026-05-19 05:05:18,892 - optuna.study.study - INFO - Trial 91 finished with value: 0.06326576976804571 and parameters: {'n_layers': 1, 'embedding_dim': 32, 'lr': 0.0007502212478672431, 'lambda_val': 0.006698181218900935, 'batch_size': 1385, 'optimizer': 'RMSprop'}. Best is trial 84 with value: 0.06970078686067657.
2026-05-19 05:05:28,024 - experiment_functions - INFO - Early stopping at epoch 600. Best Recall: 0.0658
2026-05-19 05:05:28,130 - optuna.study.study - INFO - Trial 92 finished with value: 0.06581285691652483 and parameters: {'n_layers': 1, 'embedding_dim': 32, 'lr': 0.0018066967647235067, 'lambda_val': 0.017138092999178334, 'batch_size': 1173, 'optimizer': 'RMSprop'}. Best is trial 84 with value: 0.06970078686067657.
2026-05-19 05:05:36,763 - experiment_functions - INFO - Early stopping at epoch 600. Best Recall: 0.0589
2026-05-19 05:05:36,845 - optuna.study.study - INFO - Trial 93 finished with value: 0.058931163286843065 and parameters: {'n_layers': 1, 'embedding_dim': 32, 'lr': 0.0018086634253092829, 'lambda_val': 0.027426236372257197, 'batch_size': 1118, 'optimizer': 'RMSprop'}. Best is trial 84 with value: 0.06970078686067657.
2026-05-19 05:05:49,128 - experiment_functions - INFO - Early stopping at epoch 750. Best Recall: 0.0498
2026-05-19 05:05:49,219 - optuna.study.study - INFO - Trial 94 finished with value: 0.04977191399194208 and parameters: {'n_layers': 1, 'embedding_dim': 32, 'lr': 0.0010988769959261757, 'lambda_val': 0.05269602517381604, 'batch_size': 875, 'optimizer': 'RMSprop'}. Best is trial 84 with value: 0.06970078686067657.
2026-05-19 05:05:57,711 - experiment_functions - INFO - Early stopping at epoch 550. Best Recall: 0.0491
2026-05-19 05:05:57,804 - optuna.study.study - INFO - Trial 95 finished with value: 0.04905573556172821 and parameters: {'n_layers': 1, 'embedding_dim': 32, 'lr': 0.002296217134366797, 'lambda_val': 0.014309989269314064, 'batch_size': 1183, 'optimizer': 'RMSprop'}. Best is trial 84 with value: 0.06970078686067657.
2026-05-19 05:06:07,613 - experiment_functions - INFO - Early stopping at epoch 600. Best Recall: 0.0281
2026-05-19 05:06:07,717 - optuna.study.study - INFO - Trial 96 finished with value: 0.028105019888520183 and parameters: {'n_layers': 1, 'embedding_dim': 256, 'lr': 0.0015293614183745233, 'lambda_val': 0.03843097283515686, 'batch_size': 1005, 'optimizer': 'RMSprop'}. Best is trial 84 with value: 0.06970078686067657.
2026-05-19 05:06:15,928 - experiment_functions - INFO - Early stopping at epoch 550. Best Recall: 0.0194
2026-05-19 05:06:16,031 - optuna.study.study - INFO - Trial 97 finished with value: 0.019421095751002652 and parameters: {'n_layers': 1, 'embedding_dim': 32, 'lr': 0.003915822168663675, 'lambda_val': 0.022275724500409873, 'batch_size': 1251, 'optimizer': 'RMSprop'}. Best is trial 84 with value: 0.06970078686067657.
2026-05-19 05:06:23,467 - experiment_functions - INFO - Early stopping at epoch 500. Best Recall: 0.0048
2026-05-19 05:06:23,583 - optuna.study.study - INFO - Trial 98 finished with value: 0.0047652330881028165 and parameters: {'n_layers': 1, 'embedding_dim': 32, 'lr': 0.00039143304002297566, 'lambda_val': 0.01046698319861957, 'batch_size': 520, 'optimizer': 'RMSprop'}. Best is trial 84 with value: 0.06970078686067657.
2026-05-19 05:06:34,474 - experiment_functions - INFO - Early stopping at epoch 550. Best Recall: 0.0557
2026-05-19 05:06:34,589 - optuna.study.study - INFO - Trial 99 finished with value: 0.05572895960747674 and parameters: {'n_layers': 1, 'embedding_dim': 32, 'lr': 0.0027362554176818005, 'lambda_val': 0.00011383141584410458, 'batch_size': 1593, 'optimizer': 'RMSprop'}. Best is trial 84 with value: 0.06970078686067657.
2026-05-19 05:06:52,137 - optuna.study._optimize - INFO - Trial 100 pruned. 
2026-05-19 05:07:10,488 - experiment_functions - INFO - Early stopping at epoch 1300. Best Recall: 0.0674
2026-05-19 05:07:10,591 - optuna.study.study - INFO - Trial 101 finished with value: 0.06736853420413895 and parameters: {'n_layers': 1, 'embedding_dim': 32, 'lr': 0.0006423948324204952, 'lambda_val': 0.010735651787543595, 'batch_size': 1450, 'optimizer': 'RMSprop'}. Best is trial 84 with value: 0.06970078686067657.
2026-05-19 05:07:32,987 - experiment_functions - INFO - Early stopping at epoch 1300. Best Recall: 0.0664
2026-05-19 05:07:33,088 - optuna.study.study - INFO - Trial 102 finished with value: 0.06635396867994026 and parameters: {'n_layers': 1, 'embedding_dim': 32, 'lr': 0.0006254564725366857, 'lambda_val': 0.01779150984819416, 'batch_size': 1327, 'optimizer': 'RMSprop'}. Best is trial 84 with value: 0.06970078686067657.
2026-05-19 05:07:52,846 - experiment_functions - INFO - Early stopping at epoch 1200. Best Recall: 0.0613
2026-05-19 05:07:52,939 - optuna.study.study - INFO - Trial 103 finished with value: 0.06128070284763334 and parameters: {'n_layers': 1, 'embedding_dim': 32, 'lr': 0.0006431449779911816, 'lambda_val': 0.016268845378702643, 'batch_size': 1423, 'optimizer': 'RMSprop'}. Best is trial 84 with value: 0.06970078686067657.
2026-05-19 05:08:04,082 - experiment_functions - INFO - Early stopping at epoch 750. Best Recall: 0.0631
2026-05-19 05:08:04,175 - optuna.study.study - INFO - Trial 104 finished with value: 0.063059831747317 and parameters: {'n_layers': 1, 'embedding_dim': 32, 'lr': 0.001116775990369789, 'lambda_val': 0.00998019542179744, 'batch_size': 1310, 'optimizer': 'RMSprop'}. Best is trial 84 with value: 0.06970078686067657.
2026-05-19 05:08:18,307 - optuna.study._optimize - INFO - Trial 105 pruned. 
2026-05-19 05:08:32,799 - experiment_functions - INFO - Early stopping at epoch 750. Best Recall: 0.0663
2026-05-19 05:08:32,895 - optuna.study.study - INFO - Trial 106 finished with value: 0.06630129204464387 and parameters: {'n_layers': 1, 'embedding_dim': 32, 'lr': 0.0010023745795151816, 'lambda_val': 0.02494093295785916, 'batch_size': 1757, 'optimizer': 'RMSprop'}. Best is trial 84 with value: 0.06970078686067657.
2026-05-19 05:08:40,551 - experiment_functions - INFO - Early stopping at epoch 500. Best Recall: 0.0051
2026-05-19 05:08:40,655 - optuna.study.study - INFO - Trial 107 finished with value: 0.0050754662800450235 and parameters: {'n_layers': 1, 'embedding_dim': 32, 'lr': 0.0009455779835312393, 'lambda_val': 0.037306674717381846, 'batch_size': 1771, 'optimizer': 'SGD'}. Best is trial 84 with value: 0.06970078686067657.
2026-05-19 05:08:47,938 - experiment_functions - INFO - Early stopping at epoch 500. Best Recall: 0.0045
2026-05-19 05:08:48,053 - optuna.study.study - INFO - Trial 108 finished with value: 0.004485332238392429 and parameters: {'n_layers': 1, 'embedding_dim': 32, 'lr': 0.00030464585394997717, 'lambda_val': 0.02199975735427872, 'batch_size': 1461, 'optimizer': 'RMSprop'}. Best is trial 84 with value: 0.06970078686067657.
2026-05-19 05:09:03,082 - optuna.study._optimize - INFO - Trial 109 pruned. 
2026-05-19 05:09:14,334 - experiment_functions - INFO - Early stopping at epoch 650. Best Recall: 0.0570
2026-05-19 05:09:14,427 - optuna.study.study - INFO - Trial 110 finished with value: 0.05699450783366642 and parameters: {'n_layers': 1, 'embedding_dim': 32, 'lr': 0.0013311553176080133, 'lambda_val': 0.028389994410562343, 'batch_size': 1223, 'optimizer': 'RMSprop'}. Best is trial 84 with value: 0.06970078686067657.
2026-05-19 05:09:23,287 - experiment_functions - INFO - Early stopping at epoch 600. Best Recall: 0.0579
2026-05-19 05:09:23,393 - optuna.study.study - INFO - Trial 111 finished with value: 0.057889850549652296 and parameters: {'n_layers': 1, 'embedding_dim': 32, 'lr': 0.0018353740544855275, 'lambda_val': 0.01729042146484777, 'batch_size': 1160, 'optimizer': 'RMSprop'}. Best is trial 84 with value: 0.06970078686067657.
2026-05-19 05:09:35,530 - experiment_functions - INFO - Early stopping at epoch 750. Best Recall: 0.0563
2026-05-19 05:09:35,623 - optuna.study.study - INFO - Trial 112 finished with value: 0.056340679593255255 and parameters: {'n_layers': 1, 'embedding_dim': 32, 'lr': 0.0011610339225894375, 'lambda_val': 0.012023026870067307, 'batch_size': 1529, 'optimizer': 'RMSprop'}. Best is trial 84 with value: 0.06970078686067657.
2026-05-19 05:09:56,135 - experiment_functions - INFO - Early stopping at epoch 800. Best Recall: 0.0611
2026-05-19 05:09:56,912 - optuna.study.study - INFO - Trial 113 finished with value: 0.061119420820266446 and parameters: {'n_layers': 1, 'embedding_dim': 32, 'lr': 0.000992374488728021, 'lambda_val': 0.008013575096090481, 'batch_size': 1629, 'optimizer': 'RMSprop'}. Best is trial 84 with value: 0.06970078686067657.
2026-05-19 05:10:13,860 - experiment_functions - INFO - Early stopping at epoch 1150. Best Recall: 0.0609
2026-05-19 05:10:13,964 - optuna.study.study - INFO - Trial 114 finished with value: 0.06087469807455181 and parameters: {'n_layers': 1, 'embedding_dim': 32, 'lr': 0.000788898536276218, 'lambda_val': 0.0036718793354214275, 'batch_size': 1316, 'optimizer': 'RMSprop'}. Best is trial 84 with value: 0.06970078686067657.
2026-05-19 05:10:27,391 - experiment_functions - INFO - Early stopping at epoch 700. Best Recall: 0.0561
2026-05-19 05:10:27,505 - optuna.study.study - INFO - Trial 115 finished with value: 0.05613206174275975 and parameters: {'n_layers': 1, 'embedding_dim': 32, 'lr': 0.0015823907315169919, 'lambda_val': 0.000146073217817706, 'batch_size': 1124, 'optimizer': 'RMSprop'}. Best is trial 84 with value: 0.06970078686067657.
2026-05-19 05:10:43,114 - experiment_functions - INFO - Early stopping at epoch 850. Best Recall: 0.0573
2026-05-19 05:10:43,207 - optuna.study.study - INFO - Trial 116 finished with value: 0.05733073733600934 and parameters: {'n_layers': 1, 'embedding_dim': 128, 'lr': 0.0006013271147408936, 'lambda_val': 0.03931146219884204, 'batch_size': 1829, 'optimizer': 'RMSprop'}. Best is trial 84 with value: 0.06970078686067657.
2026-05-19 05:11:14,454 - experiment_functions - INFO - Early stopping at epoch 2200. Best Recall: 0.0747
2026-05-19 05:11:14,564 - optuna.study.study - INFO - Trial 117 finished with value: 0.07472982005213619 and parameters: {'n_layers': 1, 'embedding_dim': 32, 'lr': 0.00048191253232681444, 'lambda_val': 0.02584044233257306, 'batch_size': 982, 'optimizer': 'RMSprop'}. Best is trial 117 with value: 0.07472982005213619.
2026-05-19 05:11:29,131 - optuna.study._optimize - INFO - Trial 118 pruned. 
2026-05-19 05:11:46,847 - optuna.study._optimize - INFO - Trial 119 pruned. 
2026-05-19 05:11:59,657 - experiment_functions - INFO - Early stopping at epoch 850. Best Recall: 0.0586
2026-05-19 05:11:59,749 - optuna.study.study - INFO - Trial 120 finished with value: 0.05855886807384908 and parameters: {'n_layers': 1, 'embedding_dim': 32, 'lr': 0.0007261883900007186, 'lambda_val': 0.02555283634327878, 'batch_size': 2399, 'optimizer': 'RMSprop'}. Best is trial 117 with value: 0.07472982005213619.
2026-05-19 05:12:07,057 - experiment_functions - INFO - Early stopping at epoch 500. Best Recall: 0.0050
2026-05-19 05:12:07,160 - optuna.study.study - INFO - Trial 121 finished with value: 0.004953336324605793 and parameters: {'n_layers': 1, 'embedding_dim': 32, 'lr': 0.0005188038004764143, 'lambda_val': 0.03235654517699802, 'batch_size': 719, 'optimizer': 'RMSprop'}. Best is trial 117 with value: 0.07472982005213619.
2026-05-19 05:12:22,977 - experiment_functions - INFO - Early stopping at epoch 1050. Best Recall: 0.0716
2026-05-19 05:12:23,081 - optuna.study.study - INFO - Trial 122 finished with value: 0.07160543479953686 and parameters: {'n_layers': 1, 'embedding_dim': 32, 'lr': 0.0008721208015554947, 'lambda_val': 0.01657522905971607, 'batch_size': 924, 'optimizer': 'RMSprop'}. Best is trial 117 with value: 0.07472982005213619.
2026-05-19 05:12:39,084 - experiment_functions - INFO - Early stopping at epoch 950. Best Recall: 0.0638
2026-05-19 05:12:39,198 - optuna.study.study - INFO - Trial 123 finished with value: 0.06383749565064517 and parameters: {'n_layers': 1, 'embedding_dim': 32, 'lr': 0.0008861132119418991, 'lambda_val': 0.047162327659006645, 'batch_size': 926, 'optimizer': 'RMSprop'}. Best is trial 117 with value: 0.07472982005213619.
2026-05-19 05:13:11,732 - experiment_functions - INFO - Early stopping at epoch 2300. Best Recall: 0.0702
2026-05-19 05:13:11,824 - optuna.study.study - INFO - Trial 124 finished with value: 0.07015466959122273 and parameters: {'n_layers': 1, 'embedding_dim': 32, 'lr': 0.0006552937907345857, 'lambda_val': 0.0002937082026986683, 'batch_size': 1082, 'optimizer': 'RMSprop'}. Best is trial 117 with value: 0.07472982005213619.
2026-05-19 05:14:13,396 - optuna.study.study - INFO - Trial 125 finished with value: 0.0704063063961437 and parameters: {'n_layers': 1, 'embedding_dim': 32, 'lr': 0.0006305728138067963, 'lambda_val': 0.00029353415467013876, 'batch_size': 838, 'optimizer': 'RMSprop'}. Best is trial 117 with value: 0.07472982005213619.
2026-05-19 05:14:26,679 - optuna.study._optimize - INFO - Trial 126 pruned. 
2026-05-19 05:14:41,916 - optuna.study._optimize - INFO - Trial 127 pruned. 
2026-05-19 05:14:55,722 - optuna.study._optimize - INFO - Trial 128 pruned. 
2026-05-19 05:15:02,870 - experiment_functions - INFO - Early stopping at epoch 500. Best Recall: 0.0045
2026-05-19 05:15:02,973 - optuna.study.study - INFO - Trial 129 finished with value: 0.004469476846119983 and parameters: {'n_layers': 1, 'embedding_dim': 96, 'lr': 0.0013664623513432392, 'lambda_val': 0.00037165810494751023, 'batch_size': 875, 'optimizer': 'SGD'}. Best is trial 117 with value: 0.07472982005213619.
2026-05-19 05:15:17,145 - optuna.study._optimize - INFO - Trial 130 pruned. 
2026-05-19 05:15:48,317 - experiment_functions - INFO - Early stopping at epoch 2250. Best Recall: 0.0744
2026-05-19 05:15:48,408 - optuna.study.study - INFO - Trial 131 finished with value: 0.07435266670924906 and parameters: {'n_layers': 1, 'embedding_dim': 32, 'lr': 0.0006714447319076456, 'lambda_val': 0.0005524970047838084, 'batch_size': 1102, 'optimizer': 'RMSprop'}. Best is trial 117 with value: 0.07472982005213619.
2026-05-19 05:16:07,888 - experiment_functions - INFO - Early stopping at epoch 1400. Best Recall: 0.0662
2026-05-19 05:16:07,991 - optuna.study.study - INFO - Trial 132 finished with value: 0.0661505002461853 and parameters: {'n_layers': 1, 'embedding_dim': 32, 'lr': 0.0007845801199555302, 'lambda_val': 0.0004681180928878275, 'batch_size': 1089, 'optimizer': 'RMSprop'}. Best is trial 117 with value: 0.07472982005213619.
2026-05-19 05:16:22,280 - optuna.study._optimize - INFO - Trial 133 pruned. 
2026-05-19 05:16:39,296 - experiment_functions - INFO - Early stopping at epoch 1000. Best Recall: 0.0647
2026-05-19 05:16:39,400 - optuna.study.study - INFO - Trial 134 finished with value: 0.06467461636345581 and parameters: {'n_layers': 1, 'embedding_dim': 32, 'lr': 0.0011010406521511946, 'lambda_val': 0.0005721684471496676, 'batch_size': 838, 'optimizer': 'RMSprop'}. Best is trial 117 with value: 0.07472982005213619.
2026-05-19 05:16:53,489 - optuna.study._optimize - INFO - Trial 135 pruned. 
2026-05-19 05:17:06,712 - optuna.study._optimize - INFO - Trial 136 pruned. 
2026-05-19 05:17:22,783 - experiment_functions - INFO - Early stopping at epoch 900. Best Recall: 0.0580
2026-05-19 05:17:22,887 - optuna.study.study - INFO - Trial 137 finished with value: 0.05804661621312865 and parameters: {'n_layers': 1, 'embedding_dim': 32, 'lr': 0.000853491164089724, 'lambda_val': 0.0001199677155073982, 'batch_size': 2806, 'optimizer': 'RMSprop'}. Best is trial 117 with value: 0.07472982005213619.
2026-05-19 05:17:37,427 - optuna.study._optimize - INFO - Trial 138 pruned. 
2026-05-19 05:17:48,313 - experiment_functions - INFO - Early stopping at epoch 550. Best Recall: 0.0312
2026-05-19 05:17:48,394 - optuna.study.study - INFO - Trial 139 finished with value: 0.031235082690194767 and parameters: {'n_layers': 4, 'embedding_dim': 32, 'lr': 0.0012490028185500963, 'lambda_val': 0.0004106288673202754, 'batch_size': 1240, 'optimizer': 'RMSprop'}. Best is trial 117 with value: 0.07472982005213619.
2026-05-19 05:18:05,232 - experiment_functions - INFO - Early stopping at epoch 900. Best Recall: 0.0656
2026-05-19 05:18:06,000 - optuna.study.study - INFO - Trial 140 finished with value: 0.06557425465681563 and parameters: {'n_layers': 1, 'embedding_dim': 128, 'lr': 0.0009687490925717627, 'lambda_val': 0.00018468046545665488, 'batch_size': 973, 'optimizer': 'RMSprop'}. Best is trial 117 with value: 0.07472982005213619.
2026-05-19 05:18:27,273 - optuna.study._optimize - INFO - Trial 141 pruned. 
2026-05-19 05:18:44,037 - experiment_functions - INFO - Early stopping at epoch 1200. Best Recall: 0.0678
2026-05-19 05:18:44,139 - optuna.study.study - INFO - Trial 142 finished with value: 0.0678271483113845 and parameters: {'n_layers': 1, 'embedding_dim': 32, 'lr': 0.0006845418768240396, 'lambda_val': 0.011948520172941752, 'batch_size': 1195, 'optimizer': 'RMSprop'}. Best is trial 117 with value: 0.07472982005213619.
2026-05-19 05:18:59,951 - experiment_functions - INFO - Early stopping at epoch 1000. Best Recall: 0.0660
2026-05-19 05:19:00,043 - optuna.study.study - INFO - Trial 143 finished with value: 0.0659788121798311 and parameters: {'n_layers': 1, 'embedding_dim': 32, 'lr': 0.0008184770926218402, 'lambda_val': 0.009635778713477714, 'batch_size': 1183, 'optimizer': 'RMSprop'}. Best is trial 117 with value: 0.07472982005213619.
2026-05-19 05:19:13,493 - optuna.study._optimize - INFO - Trial 144 pruned. 
2026-05-19 05:19:20,814 - experiment_functions - INFO - Early stopping at epoch 500. Best Recall: 0.0052
2026-05-19 05:19:20,917 - optuna.study.study - INFO - Trial 145 finished with value: 0.005167144611335917 and parameters: {'n_layers': 1, 'embedding_dim': 32, 'lr': 0.00033691975679367306, 'lambda_val': 0.06162077513816102, 'batch_size': 3099, 'optimizer': 'RMSprop'}. Best is trial 117 with value: 0.07472982005213619.
2026-05-19 05:19:38,561 - experiment_functions - INFO - Early stopping at epoch 1250. Best Recall: 0.0658
2026-05-19 05:19:38,676 - optuna.study.study - INFO - Trial 146 finished with value: 0.06575376666457444 and parameters: {'n_layers': 1, 'embedding_dim': 32, 'lr': 0.0007285255437792879, 'lambda_val': 0.0144744461146706, 'batch_size': 1385, 'optimizer': 'Adam'}. Best is trial 117 with value: 0.07472982005213619.
2026-05-19 05:19:54,260 - experiment_functions - INFO - Early stopping at epoch 900. Best Recall: 0.0638
2026-05-19 05:19:54,375 - optuna.study.study - INFO - Trial 147 finished with value: 0.06376651922838283 and parameters: {'n_layers': 1, 'embedding_dim': 32, 'lr': 0.0011267200709529166, 'lambda_val': 0.006567010939219945, 'batch_size': 1021, 'optimizer': 'RMSprop'}. Best is trial 117 with value: 0.07472982005213619.
2026-05-19 05:20:05,522 - experiment_functions - INFO - Early stopping at epoch 850. Best Recall: 0.0055
2026-05-19 05:20:05,603 - optuna.study.study - INFO - Trial 148 finished with value: 0.005450239327297466 and parameters: {'n_layers': 1, 'embedding_dim': 32, 'lr': 1.2515234514358548e-05, 'lambda_val': 7.185735662398211e-05, 'batch_size': 1224, 'optimizer': 'RMSprop'}. Best is trial 117 with value: 0.07472982005213619.
2026-05-19 05:20:28,548 - optuna.study._optimize - INFO - Trial 149 pruned. 
2026-05-19 05:20:48,445 - experiment_functions - INFO - Early stopping at epoch 1300. Best Recall: 0.0688
