2026-05-19 00:13:50,153 - optuna.study._optimize - INFO - Trial 295 pruned. 
2026-05-19 00:14:05,920 - optuna.study._optimize - INFO - Trial 296 pruned. 
2026-05-19 00:14:27,358 - experiment_functions - INFO - Early stopping at epoch 900. Best Recall: 0.0676
2026-05-19 00:14:28,133 - optuna.study.study - INFO - Trial 297 finished with value: 0.06762841570835039 and parameters: {'n_layers': 1, 'embedding_dim': 32, 'lr': 0.0010520901031542875, 'lambda_val': 0.013924337720406098, 'batch_size': 575, 'optimizer': 'RMSprop'}. Best is trial 151 with value: 0.07582601723856444.
2026-05-19 00:14:43,477 - optuna.study._optimize - INFO - Trial 298 pruned. 
2026-05-19 00:14:58,342 - optuna.study._optimize - INFO - Trial 299 pruned. 
2026-05-19 00:15:21,196 - experiment_functions - INFO - Early stopping at epoch 1950. Best Recall: 0.0722
2026-05-19 00:15:22,117 - root - INFO -   **** Training e_1M_1c3dcs_rand2
2026-05-19 00:15:22,177 - root - INFO -   **** Getting 221091/805443 random edges
2026-05-19 00:15:22,334 - optuna.storages._rdb.storage - INFO - A new study created in RDB with name: Study_e_1M_1c3dcs_rand2
2026-05-19 00:15:33,528 - experiment_functions - INFO - Early stopping at epoch 600. Best Recall: 0.0368
2026-05-19 00:15:33,625 - optuna.study.study - INFO - Trial 0 finished with value: 0.036801498771353365 and parameters: {'n_layers': 3, 'embedding_dim': 128, 'lr': 0.0010646073873717104, 'lambda_val': 4.134993308032542e-05, 'batch_size': 3403, 'optimizer': 'Adam'}. Best is trial 0 with value: 0.036801498771353365.
2026-05-19 00:15:42,859 - experiment_functions - INFO - Early stopping at epoch 550. Best Recall: 0.0226
2026-05-19 00:15:42,950 - optuna.study.study - INFO - Trial 1 finished with value: 0.022573814360424726 and parameters: {'n_layers': 3, 'embedding_dim': 128, 'lr': 0.001296841833685766, 'lambda_val': 9.37223148842391e-05, 'batch_size': 812, 'optimizer': 'RMSprop'}. Best is trial 0 with value: 0.036801498771353365.
2026-05-19 00:17:02,467 - optuna.study.study - INFO - Trial 2 finished with value: 0.03311822618806977 and parameters: {'n_layers': 3, 'embedding_dim': 256, 'lr': 0.0063772692209262205, 'lambda_val': 1.706898816744042e-05, 'batch_size': 1423, 'optimizer': 'RMSprop'}. Best is trial 0 with value: 0.036801498771353365.
2026-05-19 00:18:04,885 - optuna.study.study - INFO - Trial 3 finished with value: 0.022087979052921192 and parameters: {'n_layers': 4, 'embedding_dim': 96, 'lr': 6.44888954369228e-05, 'lambda_val': 4.418548491248057e-06, 'batch_size': 2118, 'optimizer': 'Adam'}. Best is trial 0 with value: 0.036801498771353365.
2026-05-19 00:18:13,896 - experiment_functions - INFO - Early stopping at epoch 500. Best Recall: 0.0054
2026-05-19 00:18:13,995 - optuna.study.study - INFO - Trial 4 finished with value: 0.005435163982262089 and parameters: {'n_layers': 3, 'embedding_dim': 128, 'lr': 0.0009834181382288323, 'lambda_val': 0.009074487903527948, 'batch_size': 3854, 'optimizer': 'SGD'}. Best is trial 0 with value: 0.036801498771353365.
2026-05-19 00:18:25,355 - experiment_functions - INFO - Early stopping at epoch 500. Best Recall: 0.0049
2026-05-19 00:18:26,120 - optuna.study.study - INFO - Trial 5 finished with value: 0.004875145767146037 and parameters: {'n_layers': 2, 'embedding_dim': 32, 'lr': 2.4336254095034593e-05, 'lambda_val': 0.002682442401578663, 'batch_size': 3672, 'optimizer': 'SGD'}. Best is trial 0 with value: 0.036801498771353365.
2026-05-19 00:18:44,814 - experiment_functions - INFO - Early stopping at epoch 750. Best Recall: 0.0054
2026-05-19 00:18:44,926 - optuna.study.study - INFO - Trial 6 finished with value: 0.005375486031152676 and parameters: {'n_layers': 3, 'embedding_dim': 128, 'lr': 1.1194140719670847e-05, 'lambda_val': 8.90333715777043e-06, 'batch_size': 3853, 'optimizer': 'Adam'}. Best is trial 0 with value: 0.036801498771353365.
2026-05-19 00:18:53,407 - experiment_functions - INFO - Early stopping at epoch 500. Best Recall: 0.0052
2026-05-19 00:18:53,506 - optuna.study.study - INFO - Trial 7 finished with value: 0.0052116060847074 and parameters: {'n_layers': 4, 'embedding_dim': 64, 'lr': 0.0003928927624044167, 'lambda_val': 0.002463537483635924, 'batch_size': 1042, 'optimizer': 'SGD'}. Best is trial 0 with value: 0.036801498771353365.
2026-05-19 00:19:01,639 - experiment_functions - INFO - Early stopping at epoch 500. Best Recall: 0.0038
2026-05-19 00:19:01,738 - optuna.study.study - INFO - Trial 8 finished with value: 0.0037668784455085302 and parameters: {'n_layers': 2, 'embedding_dim': 32, 'lr': 0.0011220391628792713, 'lambda_val': 0.00012379769000459812, 'batch_size': 3698, 'optimizer': 'SGD'}. Best is trial 0 with value: 0.036801498771353365.
2026-05-19 00:19:18,031 - optuna.study._optimize - INFO - Trial 9 pruned. 
2026-05-19 00:19:26,389 - experiment_functions - INFO - Early stopping at epoch 550. Best Recall: 0.0130
2026-05-19 00:19:26,480 - optuna.study.study - INFO - Trial 10 finished with value: 0.01299304173147637 and parameters: {'n_layers': 1, 'embedding_dim': 64, 'lr': 0.09211826014322533, 'lambda_val': 1.2211720516937085e-06, 'batch_size': 2873, 'optimizer': 'Adam'}. Best is trial 0 with value: 0.036801498771353365.
2026-05-19 00:19:55,083 - experiment_functions - INFO - Early stopping at epoch 1350. Best Recall: 0.0261
2026-05-19 00:19:55,193 - optuna.study.study - INFO - Trial 11 finished with value: 0.026130758326345385 and parameters: {'n_layers': 3, 'embedding_dim': 256, 'lr': 0.012753234466689582, 'lambda_val': 0.0004922030326809883, 'batch_size': 1552, 'optimizer': 'RMSprop'}. Best is trial 0 with value: 0.036801498771353365.
2026-05-19 00:20:25,449 - experiment_functions - INFO - Early stopping at epoch 1550. Best Recall: 0.0303
2026-05-19 00:20:25,550 - optuna.study.study - INFO - Trial 12 finished with value: 0.030275786162677152 and parameters: {'n_layers': 4, 'embedding_dim': 256, 'lr': 0.009841922355154142, 'lambda_val': 1.9876414242959126e-05, 'batch_size': 2689, 'optimizer': 'RMSprop'}. Best is trial 0 with value: 0.036801498771353365.
2026-05-19 00:20:39,383 - optuna.study._optimize - INFO - Trial 13 pruned. 
2026-05-19 00:21:12,058 - experiment_functions - INFO - Early stopping at epoch 1650. Best Recall: 0.0371
2026-05-19 00:21:12,148 - optuna.study.study - INFO - Trial 14 finished with value: 0.03706104902400701 and parameters: {'n_layers': 3, 'embedding_dim': 256, 'lr': 0.00014453682606444494, 'lambda_val': 1.5227253650261867e-06, 'batch_size': 3010, 'optimizer': 'Adam'}. Best is trial 14 with value: 0.03706104902400701.
2026-05-19 00:21:33,227 - experiment_functions - INFO - Early stopping at epoch 1350. Best Recall: 0.0533
2026-05-19 00:21:33,353 - optuna.study.study - INFO - Trial 15 finished with value: 0.05333315199598062 and parameters: {'n_layers': 2, 'embedding_dim': 128, 'lr': 0.0002655110415593966, 'lambda_val': 1.0038978717325622e-06, 'batch_size': 3200, 'optimizer': 'Adam'}. Best is trial 15 with value: 0.05333315199598062.
2026-05-19 00:22:35,478 - optuna.study.study - INFO - Trial 16 finished with value: 0.04943185219809054 and parameters: {'n_layers': 2, 'embedding_dim': 128, 'lr': 0.00016230229589106506, 'lambda_val': 1.6115979656890582e-06, 'batch_size': 3050, 'optimizer': 'Adam'}. Best is trial 15 with value: 0.05333315199598062.
2026-05-19 00:22:49,695 - optuna.study._optimize - INFO - Trial 17 pruned. 
2026-05-19 00:23:15,259 - experiment_functions - INFO - Early stopping at epoch 1650. Best Recall: 0.0527
2026-05-19 00:23:15,369 - optuna.study.study - INFO - Trial 18 finished with value: 0.052735387257285465 and parameters: {'n_layers': 2, 'embedding_dim': 128, 'lr': 0.00022415018735682333, 'lambda_val': 3.384232159849083e-06, 'batch_size': 3302, 'optimizer': 'Adam'}. Best is trial 15 with value: 0.05333315199598062.
2026-05-19 00:23:26,111 - experiment_functions - INFO - Early stopping at epoch 550. Best Recall: 0.0464
2026-05-19 00:23:26,200 - optuna.study.study - INFO - Trial 19 finished with value: 0.046444945468499275 and parameters: {'n_layers': 2, 'embedding_dim': 128, 'lr': 0.002934249693187901, 'lambda_val': 0.0005231741049853378, 'batch_size': 3407, 'optimizer': 'Adam'}. Best is trial 15 with value: 0.05333315199598062.
2026-05-19 00:24:05,152 - experiment_functions - INFO - Early stopping at epoch 2100. Best Recall: 0.0590
2026-05-19 00:24:05,243 - optuna.study.study - INFO - Trial 20 finished with value: 0.05901568438012813 and parameters: {'n_layers': 1, 'embedding_dim': 128, 'lr': 0.0003233620232015143, 'lambda_val': 5.437212827018222e-06, 'batch_size': 3266, 'optimizer': 'Adam'}. Best is trial 20 with value: 0.05901568438012813.
2026-05-19 00:24:33,848 - experiment_functions - INFO - Early stopping at epoch 1850. Best Recall: 0.0574
2026-05-19 00:24:33,945 - optuna.study.study - INFO - Trial 21 finished with value: 0.05736053397187599 and parameters: {'n_layers': 1, 'embedding_dim': 128, 'lr': 0.0003529978239569767, 'lambda_val': 4.860014825459377e-06, 'batch_size': 3390, 'optimizer': 'Adam'}. Best is trial 20 with value: 0.05901568438012813.
2026-05-19 00:25:00,266 - experiment_functions - INFO - Early stopping at epoch 1700. Best Recall: 0.0555
2026-05-19 00:25:00,356 - optuna.study.study - INFO - Trial 22 finished with value: 0.05551752795401083 and parameters: {'n_layers': 1, 'embedding_dim': 128, 'lr': 0.0004130439426826593, 'lambda_val': 8.524363069835344e-06, 'batch_size': 2524, 'optimizer': 'Adam'}. Best is trial 20 with value: 0.05901568438012813.
2026-05-19 00:25:14,934 - optuna.study._optimize - INFO - Trial 23 pruned. 
2026-05-19 00:25:58,267 - experiment_functions - INFO - Early stopping at epoch 2500. Best Recall: 0.0610
2026-05-19 00:25:59,043 - optuna.study.study - INFO - Trial 24 finished with value: 0.060999603692679316 and parameters: {'n_layers': 1, 'embedding_dim': 64, 'lr': 0.00043810098991554745, 'lambda_val': 7.990841844362061e-05, 'batch_size': 2109, 'optimizer': 'Adam'}. Best is trial 24 with value: 0.060999603692679316.
2026-05-19 00:26:14,712 - experiment_functions - INFO - Early stopping at epoch 650. Best Recall: 0.0667
2026-05-19 00:26:14,824 - optuna.study.study - INFO - Trial 25 finished with value: 0.06665248425797392 and parameters: {'n_layers': 1, 'embedding_dim': 64, 'lr': 0.002801550291848151, 'lambda_val': 8.907379399547448e-05, 'batch_size': 1968, 'optimizer': 'Adam'}. Best is trial 25 with value: 0.06665248425797392.
2026-05-19 00:26:25,457 - experiment_functions - INFO - Early stopping at epoch 650. Best Recall: 0.0589
2026-05-19 00:26:25,548 - optuna.study.study - INFO - Trial 26 finished with value: 0.058885680637253246 and parameters: {'n_layers': 1, 'embedding_dim': 64, 'lr': 0.0024623059531620195, 'lambda_val': 0.0001443347682288038, 'batch_size': 2125, 'optimizer': 'Adam'}. Best is trial 25 with value: 0.06665248425797392.
2026-05-19 00:26:41,421 - experiment_functions - INFO - Early stopping at epoch 900. Best Recall: 0.0212
2026-05-19 00:26:41,499 - optuna.study.study - INFO - Trial 27 finished with value: 0.02116005594727166 and parameters: {'n_layers': 1, 'embedding_dim': 64, 'lr': 0.026521423595824867, 'lambda_val': 5.436867080139649e-05, 'batch_size': 1800, 'optimizer': 'Adam'}. Best is trial 25 with value: 0.06665248425797392.
2026-05-19 00:26:48,614 - experiment_functions - INFO - Early stopping at epoch 500. Best Recall: 0.0053
2026-05-19 00:26:49,158 - optuna.study.study - INFO - Trial 28 finished with value: 0.005298489034400928 and parameters: {'n_layers': 1, 'embedding_dim': 64, 'lr': 0.0038177762427428785, 'lambda_val': 0.0002625009056028524, 'batch_size': 1295, 'optimizer': 'SGD'}. Best is trial 25 with value: 0.06665248425797392.
2026-05-19 00:27:07,249 - experiment_functions - INFO - Early stopping at epoch 1250. Best Recall: 0.0603
2026-05-19 00:27:07,348 - optuna.study.study - INFO - Trial 29 finished with value: 0.06028094509599989 and parameters: {'n_layers': 1, 'embedding_dim': 64, 'lr': 0.0007640919742229976, 'lambda_val': 4.7058036535210576e-05, 'batch_size': 1851, 'optimizer': 'Adam'}. Best is trial 25 with value: 0.06665248425797392.
2026-05-19 00:27:25,759 - experiment_functions - INFO - Early stopping at epoch 1250. Best Recall: 0.0605
2026-05-19 00:27:25,849 - optuna.study.study - INFO - Trial 30 finished with value: 0.060487729444526635 and parameters: {'n_layers': 1, 'embedding_dim': 64, 'lr': 0.0007293849920970417, 'lambda_val': 0.0013846735596184053, 'batch_size': 1800, 'optimizer': 'Adam'}. Best is trial 25 with value: 0.06665248425797392.
2026-05-19 00:27:45,633 - experiment_functions - INFO - Early stopping at epoch 1250. Best Recall: 0.0612
2026-05-19 00:27:45,723 - optuna.study.study - INFO - Trial 31 finished with value: 0.061246618038063486 and parameters: {'n_layers': 1, 'embedding_dim': 64, 'lr': 0.000688456206262711, 'lambda_val': 0.0010932508052973083, 'batch_size': 1734, 'optimizer': 'Adam'}. Best is trial 25 with value: 0.06665248425797392.
2026-05-19 00:28:03,415 - experiment_functions - INFO - Early stopping at epoch 1200. Best Recall: 0.0598
2026-05-19 00:28:03,515 - optuna.study.study - INFO - Trial 32 finished with value: 0.05980331943236247 and parameters: {'n_layers': 1, 'embedding_dim': 64, 'lr': 0.0006624956250210921, 'lambda_val': 0.0012032949758505962, 'batch_size': 2185, 'optimizer': 'Adam'}. Best is trial 25 with value: 0.06665248425797392.
2026-05-19 00:28:13,864 - experiment_functions - INFO - Early stopping at epoch 700. Best Recall: 0.0641
2026-05-19 00:28:13,974 - optuna.study.study - INFO - Trial 33 finished with value: 0.064106070973677 and parameters: {'n_layers': 1, 'embedding_dim': 64, 'lr': 0.0018933186936110375, 'lambda_val': 0.0157519038676803, 'batch_size': 1685, 'optimizer': 'Adam'}. Best is trial 25 with value: 0.06665248425797392.
2026-05-19 00:28:25,253 - experiment_functions - INFO - Early stopping at epoch 700. Best Recall: 0.0639
2026-05-19 00:28:25,362 - optuna.study.study - INFO - Trial 34 finished with value: 0.06394888012160477 and parameters: {'n_layers': 1, 'embedding_dim': 64, 'lr': 0.0020200319596531437, 'lambda_val': 0.015992278885203635, 'batch_size': 1172, 'optimizer': 'Adam'}. Best is trial 25 with value: 0.06665248425797392.
2026-05-19 00:28:35,498 - experiment_functions - INFO - Early stopping at epoch 550. Best Recall: 0.0138
2026-05-19 00:28:35,600 - optuna.study.study - INFO - Trial 35 finished with value: 0.013768834013683732 and parameters: {'n_layers': 2, 'embedding_dim': 64, 'lr': 0.0023291506021411845, 'lambda_val': 0.025217281195870623, 'batch_size': 976, 'optimizer': 'RMSprop'}. Best is trial 25 with value: 0.06665248425797392.
2026-05-19 00:28:45,157 - experiment_functions - INFO - Early stopping at epoch 650. Best Recall: 0.0500
2026-05-19 00:28:45,246 - optuna.study.study - INFO - Trial 36 finished with value: 0.05003512577560851 and parameters: {'n_layers': 1, 'embedding_dim': 64, 'lr': 0.004462067143279837, 'lambda_val': 0.011784947911099736, 'batch_size': 557, 'optimizer': 'Adam'}. Best is trial 25 with value: 0.06665248425797392.
2026-05-19 00:28:56,657 - experiment_functions - INFO - Early stopping at epoch 750. Best Recall: 0.0604
2026-05-19 00:28:56,757 - optuna.study.study - INFO - Trial 37 finished with value: 0.06043285253028477 and parameters: {'n_layers': 1, 'embedding_dim': 96, 'lr': 0.0016272648231558959, 'lambda_val': 0.007484401783745192, 'batch_size': 1340, 'optimizer': 'Adam'}. Best is trial 25 with value: 0.06665248425797392.
2026-05-19 00:29:06,040 - experiment_functions - INFO - Early stopping at epoch 500. Best Recall: 0.0049
2026-05-19 00:29:06,129 - optuna.study.study - INFO - Trial 38 finished with value: 0.004946892501311916 and parameters: {'n_layers': 2, 'embedding_dim': 32, 'lr': 0.020769046990376246, 'lambda_val': 0.032426201798887014, 'batch_size': 1158, 'optimizer': 'SGD'}. Best is trial 25 with value: 0.06665248425797392.
2026-05-19 00:29:19,420 - experiment_functions - INFO - Early stopping at epoch 750. Best Recall: 0.0657
2026-05-19 00:29:19,508 - optuna.study.study - INFO - Trial 39 finished with value: 0.06574646808042355 and parameters: {'n_layers': 1, 'embedding_dim': 64, 'lr': 0.0016655435151673146, 'lambda_val': 0.004330104677477074, 'batch_size': 1585, 'optimizer': 'Adam'}. Best is trial 25 with value: 0.06665248425797392.
2026-05-19 00:29:28,709 - experiment_functions - INFO - Early stopping at epoch 600. Best Recall: 0.0224
2026-05-19 00:29:28,808 - optuna.study.study - INFO - Trial 40 finished with value: 0.02243911346656783 and parameters: {'n_layers': 2, 'embedding_dim': 64, 'lr': 0.0014686952049963718, 'lambda_val': 0.0995821764732657, 'batch_size': 1538, 'optimizer': 'RMSprop'}. Best is trial 25 with value: 0.06665248425797392.
2026-05-19 00:29:37,829 - experiment_functions - INFO - Early stopping at epoch 600. Best Recall: 0.0533
2026-05-19 00:29:37,918 - optuna.study.study - INFO - Trial 41 finished with value: 0.05333490662767551 and parameters: {'n_layers': 1, 'embedding_dim': 64, 'lr': 0.004666360531156686, 'lambda_val': 0.005574207475885948, 'batch_size': 1631, 'optimizer': 'Adam'}. Best is trial 25 with value: 0.06665248425797392.
2026-05-19 00:29:51,003 - experiment_functions - INFO - Early stopping at epoch 850. Best Recall: 0.0670
2026-05-19 00:29:51,093 - optuna.study.study - INFO - Trial 42 finished with value: 0.06701910241028815 and parameters: {'n_layers': 1, 'embedding_dim': 64, 'lr': 0.0016193254622807862, 'lambda_val': 0.00412444291852903, 'batch_size': 869, 'optimizer': 'Adam'}. Best is trial 42 with value: 0.06701910241028815.
2026-05-19 00:30:04,024 - experiment_functions - INFO - Early stopping at epoch 850. Best Recall: 0.0580
2026-05-19 00:30:04,145 - optuna.study.study - INFO - Trial 43 finished with value: 0.057984204117511165 and parameters: {'n_layers': 1, 'embedding_dim': 64, 'lr': 0.0015935876920204453, 'lambda_val': 0.019126432204257, 'batch_size': 675, 'optimizer': 'Adam'}. Best is trial 42 with value: 0.06701910241028815.
2026-05-19 00:30:13,133 - experiment_functions - INFO - Early stopping at epoch 500. Best Recall: 0.0052
2026-05-19 00:30:13,233 - optuna.study.study - INFO - Trial 44 finished with value: 0.005160583900638921 and parameters: {'n_layers': 1, 'embedding_dim': 64, 'lr': 0.005910578439524997, 'lambda_val': 0.0039025420885655396, 'batch_size': 909, 'optimizer': 'SGD'}. Best is trial 42 with value: 0.06701910241028815.
2026-05-19 00:30:24,356 - experiment_functions - INFO - Early stopping at epoch 750. Best Recall: 0.0614
2026-05-19 00:30:24,482 - optuna.study.study - INFO - Trial 45 finished with value: 0.0613970524134597 and parameters: {'n_layers': 1, 'embedding_dim': 32, 'lr': 0.0019824624292324555, 'lambda_val': 0.0164344553158121, 'batch_size': 1105, 'optimizer': 'Adam'}. Best is trial 42 with value: 0.06701910241028815.
2026-05-19 00:30:35,175 - experiment_functions - INFO - Early stopping at epoch 650. Best Recall: 0.0201
2026-05-19 00:30:35,294 - optuna.study.study - INFO - Trial 46 finished with value: 0.020051433652170405 and parameters: {'n_layers': 4, 'embedding_dim': 96, 'lr': 0.001201646872015862, 'lambda_val': 0.04488009710045292, 'batch_size': 758, 'optimizer': 'Adam'}. Best is trial 42 with value: 0.06701910241028815.
2026-05-19 00:30:45,824 - experiment_functions - INFO - Early stopping at epoch 650. Best Recall: 0.0619
2026-05-19 00:30:45,932 - optuna.study.study - INFO - Trial 47 finished with value: 0.06193734306116176 and parameters: {'n_layers': 1, 'embedding_dim': 64, 'lr': 0.0038432699986983205, 'lambda_val': 0.002715346128898437, 'batch_size': 1215, 'optimizer': 'Adam'}. Best is trial 42 with value: 0.06701910241028815.
2026-05-19 00:31:01,053 - optuna.study._optimize - INFO - Trial 48 pruned. 
2026-05-19 00:31:09,538 - experiment_functions - INFO - Early stopping at epoch 550. Best Recall: 0.0446
2026-05-19 00:31:09,626 - optuna.study.study - INFO - Trial 49 finished with value: 0.044554504052489036 and parameters: {'n_layers': 1, 'embedding_dim': 64, 'lr': 0.0062527755897299414, 'lambda_val': 0.004784691533215052, 'batch_size': 1942, 'optimizer': 'Adam'}. Best is trial 42 with value: 0.06701910241028815.
2026-05-19 00:31:17,861 - experiment_functions - INFO - Early stopping at epoch 500. Best Recall: 0.0053
2026-05-19 00:31:17,951 - optuna.study.study - INFO - Trial 50 finished with value: 0.005335891981623659 and parameters: {'n_layers': 2, 'embedding_dim': 256, 'lr': 0.00298190134116694, 'lambda_val': 0.0018234711601266497, 'batch_size': 1415, 'optimizer': 'SGD'}. Best is trial 42 with value: 0.06701910241028815.
2026-05-19 00:31:31,958 - experiment_functions - INFO - Early stopping at epoch 1000. Best Recall: 0.0610
2026-05-19 00:31:32,048 - optuna.study.study - INFO - Trial 51 finished with value: 0.06102459766184997 and parameters: {'n_layers': 1, 'embedding_dim': 64, 'lr': 0.0010357576079116752, 'lambda_val': 0.003284123230857731, 'batch_size': 1210, 'optimizer': 'Adam'}. Best is trial 42 with value: 0.06701910241028815.
2026-05-19 00:31:41,204 - experiment_functions - INFO - Early stopping at epoch 650. Best Recall: 0.0616
2026-05-19 00:31:41,294 - optuna.study.study - INFO - Trial 52 finished with value: 0.061639175213464674 and parameters: {'n_layers': 1, 'embedding_dim': 64, 'lr': 0.003200069009598898, 'lambda_val': 0.0007470680305791323, 'batch_size': 954, 'optimizer': 'Adam'}. Best is trial 42 with value: 0.06701910241028815.
2026-05-19 00:31:56,174 - optuna.study._optimize - INFO - Trial 53 pruned. 
2026-05-19 00:32:04,696 - experiment_functions - INFO - Early stopping at epoch 550. Best Recall: 0.0624
2026-05-19 00:32:04,787 - optuna.study.study - INFO - Trial 54 finished with value: 0.06240025570422674 and parameters: {'n_layers': 1, 'embedding_dim': 64, 'lr': 0.008026185123339278, 'lambda_val': 0.013737581513653611, 'batch_size': 1953, 'optimizer': 'Adam'}. Best is trial 42 with value: 0.06701910241028815.
2026-05-19 00:32:22,278 - experiment_functions - INFO - Early stopping at epoch 550. Best Recall: 0.0587
