2026-05-18 20:52:27,633 - optuna.study.study - INFO - Trial 17 finished with value: 0.03390741336172583 and parameters: {'n_layers': 2, 'embedding_dim': 96, 'lr': 0.025124217591397966, 'lambda_val': 2.084400140673529e-05, 'batch_size': 3612, 'optimizer': 'RMSprop'}. Best is trial 0 with value: 0.0814578591097973.
2026-05-18 20:52:36,521 - experiment_functions - INFO - Early stopping at epoch 550. Best Recall: 0.0763
2026-05-18 20:52:36,600 - optuna.study.study - INFO - Trial 18 finished with value: 0.07625903214793348 and parameters: {'n_layers': 1, 'embedding_dim': 128, 'lr': 0.0011997414905424242, 'lambda_val': 0.003928319867296508, 'batch_size': 2587, 'optimizer': 'RMSprop'}. Best is trial 0 with value: 0.0814578591097973.
2026-05-18 20:52:54,469 - experiment_functions - INFO - Early stopping at epoch 1100. Best Recall: 0.0637
2026-05-18 20:52:54,569 - optuna.study.study - INFO - Trial 19 finished with value: 0.06366343365062829 and parameters: {'n_layers': 2, 'embedding_dim': 128, 'lr': 0.00023370372681528817, 'lambda_val': 1.0933868272489963e-06, 'batch_size': 3619, 'optimizer': 'RMSprop'}. Best is trial 0 with value: 0.0814578591097973.
2026-05-18 20:53:26,105 - experiment_functions - INFO - Early stopping at epoch 2200. Best Recall: 0.0712
2026-05-18 20:53:26,206 - optuna.study.study - INFO - Trial 20 finished with value: 0.07116089455170126 and parameters: {'n_layers': 1, 'embedding_dim': 128, 'lr': 0.0025115003025312577, 'lambda_val': 1.934781778381462e-05, 'batch_size': 3044, 'optimizer': 'RMSprop'}. Best is trial 0 with value: 0.0814578591097973.
2026-05-18 20:53:41,132 - experiment_functions - INFO - Early stopping at epoch 1000. Best Recall: 0.0818
2026-05-18 20:53:41,215 - optuna.study.study - INFO - Trial 21 finished with value: 0.08182839434776583 and parameters: {'n_layers': 2, 'embedding_dim': 64, 'lr': 0.0003479340284156755, 'lambda_val': 5.615958909460866e-06, 'batch_size': 2255, 'optimizer': 'Adam'}. Best is trial 21 with value: 0.08182839434776583.
2026-05-18 20:53:53,541 - experiment_functions - INFO - Early stopping at epoch 800. Best Recall: 0.0855
2026-05-18 20:53:53,647 - optuna.study.study - INFO - Trial 22 finished with value: 0.08549105645091526 and parameters: {'n_layers': 2, 'embedding_dim': 64, 'lr': 0.0005592499449853292, 'lambda_val': 2.0655764726342466e-05, 'batch_size': 2052, 'optimizer': 'Adam'}. Best is trial 22 with value: 0.08549105645091526.
2026-05-18 20:54:09,624 - optuna.study._optimize - INFO - Trial 23 pruned. 
2026-05-18 20:54:24,323 - experiment_functions - INFO - Early stopping at epoch 950. Best Recall: 0.0718
2026-05-18 20:54:24,422 - optuna.study.study - INFO - Trial 24 finished with value: 0.07175432130280715 and parameters: {'n_layers': 2, 'embedding_dim': 64, 'lr': 0.0003944514397277164, 'lambda_val': 1.830982767956629e-05, 'batch_size': 1905, 'optimizer': 'Adam'}. Best is trial 22 with value: 0.08549105645091526.
2026-05-18 20:54:34,813 - experiment_functions - INFO - Early stopping at epoch 650. Best Recall: 0.0775
2026-05-18 20:54:34,933 - optuna.study.study - INFO - Trial 25 finished with value: 0.07748494613372053 and parameters: {'n_layers': 2, 'embedding_dim': 64, 'lr': 0.0013293661378814092, 'lambda_val': 2.7926846058907207e-06, 'batch_size': 2291, 'optimizer': 'Adam'}. Best is trial 22 with value: 0.08549105645091526.
2026-05-18 20:54:46,139 - experiment_functions - INFO - Early stopping at epoch 700. Best Recall: 0.0060
2026-05-18 20:54:46,240 - optuna.study.study - INFO - Trial 26 finished with value: 0.006021861246405235 and parameters: {'n_layers': 3, 'embedding_dim': 64, 'lr': 1.5112626313230342e-05, 'lambda_val': 0.00015171496673289833, 'batch_size': 2424, 'optimizer': 'Adam'}. Best is trial 22 with value: 0.08549105645091526.
2026-05-18 20:55:01,867 - experiment_functions - INFO - Early stopping at epoch 1050. Best Recall: 0.0801
2026-05-18 20:55:01,956 - optuna.study.study - INFO - Trial 27 finished with value: 0.08013356185630514 and parameters: {'n_layers': 2, 'embedding_dim': 64, 'lr': 0.00035209355956330226, 'lambda_val': 1.6724362695803103e-05, 'batch_size': 1785, 'optimizer': 'Adam'}. Best is trial 22 with value: 0.08549105645091526.
2026-05-18 20:55:17,235 - optuna.study._optimize - INFO - Trial 28 pruned. 
2026-05-18 20:55:27,573 - experiment_functions - INFO - Early stopping at epoch 500. Best Recall: 0.0053
2026-05-18 20:55:27,709 - optuna.study.study - INFO - Trial 29 finished with value: 0.005278817865736397 and parameters: {'n_layers': 3, 'embedding_dim': 256, 'lr': 0.00010246046680627212, 'lambda_val': 0.0001385434665640326, 'batch_size': 2242, 'optimizer': 'SGD'}. Best is trial 22 with value: 0.08549105645091526.
2026-05-18 20:55:35,200 - experiment_functions - INFO - Early stopping at epoch 500. Best Recall: 0.0045
2026-05-18 20:55:35,290 - optuna.study.study - INFO - Trial 30 finished with value: 0.004532929297729302 and parameters: {'n_layers': 1, 'embedding_dim': 64, 'lr': 7.286527639468862e-05, 'lambda_val': 9.87008554591491e-06, 'batch_size': 1735, 'optimizer': 'Adam'}. Best is trial 22 with value: 0.08549105645091526.
2026-05-18 20:55:46,717 - experiment_functions - INFO - Early stopping at epoch 700. Best Recall: 0.0788
2026-05-18 20:55:46,818 - optuna.study.study - INFO - Trial 31 finished with value: 0.07882852626036234 and parameters: {'n_layers': 1, 'embedding_dim': 128, 'lr': 0.0006161511510577505, 'lambda_val': 4.59034384784245e-05, 'batch_size': 3759, 'optimizer': 'RMSprop'}. Best is trial 22 with value: 0.08549105645091526.
2026-05-18 20:55:54,719 - experiment_functions - INFO - Early stopping at epoch 500. Best Recall: 0.0053
2026-05-18 20:55:54,810 - optuna.study.study - INFO - Trial 32 finished with value: 0.005299138597743538 and parameters: {'n_layers': 1, 'embedding_dim': 128, 'lr': 0.00199145081135563, 'lambda_val': 0.0004983709327239369, 'batch_size': 2878, 'optimizer': 'SGD'}. Best is trial 22 with value: 0.08549105645091526.
2026-05-18 20:56:12,819 - optuna.study._optimize - INFO - Trial 33 pruned. 
2026-05-18 20:56:27,744 - experiment_functions - INFO - Early stopping at epoch 900. Best Recall: 0.0911
2026-05-18 20:56:27,834 - optuna.study.study - INFO - Trial 34 finished with value: 0.09107548000969144 and parameters: {'n_layers': 1, 'embedding_dim': 256, 'lr': 0.0009337218709448976, 'lambda_val': 1.2459578384764462e-05, 'batch_size': 876, 'optimizer': 'Adam'}. Best is trial 34 with value: 0.09107548000969144.
2026-05-18 20:56:46,594 - optuna.study._optimize - INFO - Trial 35 pruned. 
2026-05-18 20:57:03,138 - experiment_functions - INFO - Early stopping at epoch 1050. Best Recall: 0.0897
2026-05-18 20:57:03,216 - optuna.study.study - INFO - Trial 36 finished with value: 0.08968953631195722 and parameters: {'n_layers': 1, 'embedding_dim': 256, 'lr': 0.0008962263770984578, 'lambda_val': 9.867151881719135e-06, 'batch_size': 532, 'optimizer': 'Adam'}. Best is trial 34 with value: 0.09107548000969144.
2026-05-18 20:57:12,379 - experiment_functions - INFO - Early stopping at epoch 550. Best Recall: 0.0706
2026-05-18 20:57:12,470 - optuna.study.study - INFO - Trial 37 finished with value: 0.0706234731445959 and parameters: {'n_layers': 1, 'embedding_dim': 256, 'lr': 0.005095281763979051, 'lambda_val': 1.9619854949471943e-06, 'batch_size': 605, 'optimizer': 'Adam'}. Best is trial 34 with value: 0.09107548000969144.
2026-05-18 20:57:26,016 - experiment_functions - INFO - Early stopping at epoch 600. Best Recall: 0.0552
2026-05-18 20:57:26,106 - optuna.study.study - INFO - Trial 38 finished with value: 0.05516636343745947 and parameters: {'n_layers': 4, 'embedding_dim': 256, 'lr': 0.0008263971290867693, 'lambda_val': 1.122635281402059e-05, 'batch_size': 885, 'optimizer': 'Adam'}. Best is trial 34 with value: 0.09107548000969144.
2026-05-18 20:57:38,408 - experiment_functions - INFO - Early stopping at epoch 650. Best Recall: 0.0806
2026-05-18 20:57:38,499 - optuna.study.study - INFO - Trial 39 finished with value: 0.08059371911955814 and parameters: {'n_layers': 2, 'embedding_dim': 256, 'lr': 0.001005090979040725, 'lambda_val': 5.030000887306337e-06, 'batch_size': 780, 'optimizer': 'Adam'}. Best is trial 34 with value: 0.09107548000969144.
2026-05-18 20:57:49,351 - experiment_functions - INFO - Early stopping at epoch 650. Best Recall: 0.0895
2026-05-18 20:57:49,484 - optuna.study.study - INFO - Trial 40 finished with value: 0.08949237961843182 and parameters: {'n_layers': 1, 'embedding_dim': 256, 'lr': 0.001990713208295699, 'lambda_val': 2.8339569291914788e-05, 'batch_size': 1331, 'optimizer': 'Adam'}. Best is trial 34 with value: 0.09107548000969144.
2026-05-18 20:58:00,213 - experiment_functions - INFO - Early stopping at epoch 650. Best Recall: 0.0860
2026-05-18 20:58:00,332 - optuna.study.study - INFO - Trial 41 finished with value: 0.08602216318379685 and parameters: {'n_layers': 1, 'embedding_dim': 256, 'lr': 0.0017801975396878021, 'lambda_val': 2.3619713568508517e-05, 'batch_size': 1429, 'optimizer': 'Adam'}. Best is trial 34 with value: 0.09107548000969144.
2026-05-18 20:58:09,351 - experiment_functions - INFO - Early stopping at epoch 550. Best Recall: 0.0771
2026-05-18 20:58:09,442 - optuna.study.study - INFO - Trial 42 finished with value: 0.07707378182912947 and parameters: {'n_layers': 1, 'embedding_dim': 256, 'lr': 0.004028486183070804, 'lambda_val': 3.005488845110548e-05, 'batch_size': 1451, 'optimizer': 'Adam'}. Best is trial 34 with value: 0.09107548000969144.
2026-05-18 20:58:20,046 - experiment_functions - INFO - Early stopping at epoch 650. Best Recall: 0.0882
2026-05-18 20:58:20,144 - optuna.study.study - INFO - Trial 43 finished with value: 0.08818740536238465 and parameters: {'n_layers': 1, 'embedding_dim': 256, 'lr': 0.002009481812796942, 'lambda_val': 1.1378815806722352e-05, 'batch_size': 1062, 'optimizer': 'Adam'}. Best is trial 34 with value: 0.09107548000969144.
2026-05-18 20:58:30,535 - experiment_functions - INFO - Early stopping at epoch 650. Best Recall: 0.0876
2026-05-18 20:58:30,678 - optuna.study.study - INFO - Trial 44 finished with value: 0.08761576507843669 and parameters: {'n_layers': 1, 'embedding_dim': 256, 'lr': 0.002182128986621884, 'lambda_val': 1.0247868554084993e-05, 'batch_size': 1095, 'optimizer': 'Adam'}. Best is trial 34 with value: 0.09107548000969144.
2026-05-18 20:58:39,524 - experiment_functions - INFO - Early stopping at epoch 550. Best Recall: 0.0632
2026-05-18 20:58:39,691 - optuna.study.study - INFO - Trial 45 finished with value: 0.06320424942916263 and parameters: {'n_layers': 1, 'embedding_dim': 256, 'lr': 0.010100266723277861, 'lambda_val': 7.0421423078389685e-06, 'batch_size': 1087, 'optimizer': 'Adam'}. Best is trial 34 with value: 0.09107548000969144.
2026-05-18 20:58:47,721 - experiment_functions - INFO - Early stopping at epoch 500. Best Recall: 0.0059
2026-05-18 20:58:47,889 - optuna.study.study - INFO - Trial 46 finished with value: 0.005944368517576504 and parameters: {'n_layers': 1, 'embedding_dim': 256, 'lr': 0.0032392373120393087, 'lambda_val': 1.124697030073863e-05, 'batch_size': 710, 'optimizer': 'SGD'}. Best is trial 34 with value: 0.09107548000969144.
2026-05-18 20:58:58,637 - experiment_functions - INFO - Early stopping at epoch 650. Best Recall: 0.0852
2026-05-18 20:58:58,779 - optuna.study.study - INFO - Trial 47 finished with value: 0.08522451841968955 and parameters: {'n_layers': 1, 'embedding_dim': 256, 'lr': 0.002113002983749584, 'lambda_val': 4.396044604078619e-06, 'batch_size': 1242, 'optimizer': 'Adam'}. Best is trial 34 with value: 0.09107548000969144.
2026-05-18 20:59:11,703 - optuna.study._optimize - INFO - Trial 48 pruned. 
2026-05-18 20:59:25,105 - experiment_functions - INFO - Early stopping at epoch 750. Best Recall: 0.0873
2026-05-18 20:59:25,196 - optuna.study.study - INFO - Trial 49 finished with value: 0.08733115782337522 and parameters: {'n_layers': 1, 'embedding_dim': 256, 'lr': 0.001510946395163244, 'lambda_val': 0.0003159803379257656, 'batch_size': 558, 'optimizer': 'Adam'}. Best is trial 34 with value: 0.09107548000969144.
2026-05-18 20:59:39,611 - experiment_functions - INFO - Early stopping at epoch 900. Best Recall: 0.0904
2026-05-18 20:59:39,711 - optuna.study.study - INFO - Trial 50 finished with value: 0.09036382791822646 and parameters: {'n_layers': 1, 'embedding_dim': 256, 'lr': 0.0008890115710827785, 'lambda_val': 1.2878891896850147e-05, 'batch_size': 955, 'optimizer': 'Adam'}. Best is trial 34 with value: 0.09107548000969144.
2026-05-18 20:59:54,109 - experiment_functions - INFO - Early stopping at epoch 900. Best Recall: 0.0922
2026-05-18 20:59:54,203 - optuna.study.study - INFO - Trial 51 finished with value: 0.09216412114729271 and parameters: {'n_layers': 1, 'embedding_dim': 256, 'lr': 0.0008239691909298955, 'lambda_val': 1.119241877695867e-05, 'batch_size': 985, 'optimizer': 'Adam'}. Best is trial 51 with value: 0.09216412114729271.
2026-05-18 21:00:08,999 - experiment_functions - INFO - Early stopping at epoch 900. Best Recall: 0.0931
2026-05-18 21:00:09,101 - optuna.study.study - INFO - Trial 52 finished with value: 0.09311253002988648 and parameters: {'n_layers': 1, 'embedding_dim': 256, 'lr': 0.0008752219723658135, 'lambda_val': 4.357267033938194e-05, 'batch_size': 908, 'optimizer': 'Adam'}. Best is trial 52 with value: 0.09311253002988648.
2026-05-18 21:00:25,303 - experiment_functions - INFO - Early stopping at epoch 1000. Best Recall: 0.0893
2026-05-18 21:00:25,412 - optuna.study.study - INFO - Trial 53 finished with value: 0.08926644798466493 and parameters: {'n_layers': 1, 'embedding_dim': 256, 'lr': 0.0008082016055617416, 'lambda_val': 3.367757146715261e-05, 'batch_size': 929, 'optimizer': 'Adam'}. Best is trial 52 with value: 0.09311253002988648.
2026-05-18 21:00:46,946 - experiment_functions - INFO - Early stopping at epoch 1050. Best Recall: 0.0916
2026-05-18 21:00:47,081 - optuna.study.study - INFO - Trial 54 finished with value: 0.09161998166701603 and parameters: {'n_layers': 1, 'embedding_dim': 256, 'lr': 0.0008160248978859668, 'lambda_val': 0.00010245637356858226, 'batch_size': 725, 'optimizer': 'Adam'}. Best is trial 52 with value: 0.09311253002988648.
2026-05-18 21:01:05,753 - experiment_functions - INFO - Early stopping at epoch 1200. Best Recall: 0.0930
2026-05-18 21:01:05,843 - optuna.study.study - INFO - Trial 55 finished with value: 0.09300572406894364 and parameters: {'n_layers': 1, 'embedding_dim': 32, 'lr': 0.0008873206953569191, 'lambda_val': 7.350292495232868e-05, 'batch_size': 738, 'optimizer': 'Adam'}. Best is trial 52 with value: 0.09311253002988648.
2026-05-18 21:01:12,532 - experiment_functions - INFO - Early stopping at epoch 500. Best Recall: 0.0052
2026-05-18 21:01:12,667 - optuna.study.study - INFO - Trial 56 finished with value: 0.005211049748377166 and parameters: {'n_layers': 1, 'embedding_dim': 32, 'lr': 0.00030402642330706767, 'lambda_val': 0.00011439411964341149, 'batch_size': 717, 'optimizer': 'SGD'}. Best is trial 52 with value: 0.09311253002988648.
2026-05-18 21:01:48,753 - experiment_functions - INFO - Early stopping at epoch 2600. Best Recall: 0.0922
2026-05-18 21:01:48,843 - optuna.study.study - INFO - Trial 57 finished with value: 0.09217941986196783 and parameters: {'n_layers': 1, 'embedding_dim': 32, 'lr': 0.0005406734224548553, 'lambda_val': 0.00022809663213255827, 'batch_size': 822, 'optimizer': 'Adam'}. Best is trial 52 with value: 0.09311253002988648.
2026-05-18 21:02:01,857 - optuna.study._optimize - INFO - Trial 58 pruned. 
2026-05-18 21:02:23,385 - experiment_functions - INFO - Early stopping at epoch 1500. Best Recall: 0.0905
2026-05-18 21:02:23,474 - optuna.study.study - INFO - Trial 59 finished with value: 0.09054723963001299 and parameters: {'n_layers': 1, 'embedding_dim': 32, 'lr': 0.0005116730155255278, 'lambda_val': 0.0005706736468756332, 'batch_size': 1578, 'optimizer': 'Adam'}. Best is trial 52 with value: 0.09311253002988648.
2026-05-18 21:02:36,754 - optuna.study._optimize - INFO - Trial 60 pruned. 
2026-05-18 21:02:56,481 - experiment_functions - INFO - Early stopping at epoch 1350. Best Recall: 0.0869
2026-05-18 21:02:56,578 - optuna.study.study - INFO - Trial 61 finished with value: 0.08690458562965175 and parameters: {'n_layers': 1, 'embedding_dim': 32, 'lr': 0.0005054145621309775, 'lambda_val': 0.0004373175728903548, 'batch_size': 1630, 'optimizer': 'Adam'}. Best is trial 52 with value: 0.09311253002988648.
2026-05-18 21:03:23,729 - experiment_functions - INFO - Early stopping at epoch 1200. Best Recall: 0.0875
2026-05-18 21:03:23,820 - optuna.study.study - INFO - Trial 62 finished with value: 0.0875468562968553 and parameters: {'n_layers': 1, 'embedding_dim': 32, 'lr': 0.0006999673905683009, 'lambda_val': 0.002144248274623395, 'batch_size': 1207, 'optimizer': 'Adam'}. Best is trial 52 with value: 0.09311253002988648.
2026-05-18 21:04:13,892 - experiment_functions - INFO - Early stopping at epoch 3500. Best Recall: 0.0932
2026-05-18 21:04:13,987 - optuna.study.study - INFO - Trial 63 finished with value: 0.09324104052534629 and parameters: {'n_layers': 1, 'embedding_dim': 32, 'lr': 0.0004759407829690851, 'lambda_val': 7.405748280117676e-05, 'batch_size': 807, 'optimizer': 'Adam'}. Best is trial 63 with value: 0.09324104052534629.
2026-05-18 21:04:28,520 - experiment_functions - INFO - Early stopping at epoch 1000. Best Recall: 0.0868
2026-05-18 21:04:28,599 - optuna.study.study - INFO - Trial 64 finished with value: 0.08677187317992706 and parameters: {'n_layers': 1, 'embedding_dim': 32, 'lr': 0.0011186661231727328, 'lambda_val': 7.06808392295133e-05, 'batch_size': 824, 'optimizer': 'Adam'}. Best is trial 63 with value: 0.09324104052534629.
2026-05-18 21:04:43,712 - experiment_functions - INFO - Early stopping at epoch 800. Best Recall: 0.0894
2026-05-18 21:04:43,802 - optuna.study.study - INFO - Trial 65 finished with value: 0.0894278114947086 and parameters: {'n_layers': 1, 'embedding_dim': 96, 'lr': 0.0013185598737222675, 'lambda_val': 8.377990243094242e-05, 'batch_size': 998, 'optimizer': 'Adam'}. Best is trial 63 with value: 0.09324104052534629.
2026-05-18 21:04:57,264 - optuna.study._optimize - INFO - Trial 66 pruned. 
2026-05-18 21:05:10,509 - optuna.study._optimize - INFO - Trial 67 pruned. 
2026-05-18 21:05:17,969 - experiment_functions - INFO - Early stopping at epoch 500. Best Recall: 0.0049
2026-05-18 21:05:18,060 - optuna.study.study - INFO - Trial 68 finished with value: 0.004946831309093129 and parameters: {'n_layers': 1, 'embedding_dim': 32, 'lr': 0.0006730289945769929, 'lambda_val': 4.1478252390220545e-05, 'batch_size': 1155, 'optimizer': 'SGD'}. Best is trial 63 with value: 0.09324104052534629.
2026-05-18 21:05:30,819 - optuna.study._optimize - INFO - Trial 69 pruned. 
2026-05-18 21:05:44,020 - experiment_functions - INFO - Early stopping at epoch 900. Best Recall: 0.0495
2026-05-18 21:05:44,109 - optuna.study.study - INFO - Trial 70 finished with value: 0.049485104456171075 and parameters: {'n_layers': 1, 'embedding_dim': 96, 'lr': 0.0014505596019767587, 'lambda_val': 0.05305171635297517, 'batch_size': 522, 'optimizer': 'Adam'}. Best is trial 63 with value: 0.09324104052534629.
2026-05-18 21:06:12,250 - experiment_functions - INFO - Early stopping at epoch 2000. Best Recall: 0.0892
2026-05-18 21:06:12,360 - optuna.study.study - INFO - Trial 71 finished with value: 0.08924400886566904 and parameters: {'n_layers': 1, 'embedding_dim': 32, 'lr': 0.0005178510340621399, 'lambda_val': 0.0004615569628497901, 'batch_size': 941, 'optimizer': 'Adam'}. Best is trial 63 with value: 0.09324104052534629.
2026-05-18 21:06:26,323 - optuna.study._optimize - INFO - Trial 72 pruned. 
2026-05-18 21:06:43,814 - experiment_functions - INFO - Early stopping at epoch 1100. Best Recall: 0.0903
2026-05-18 21:06:43,894 - optuna.study.study - INFO - Trial 73 finished with value: 0.0903025083233532 and parameters: {'n_layers': 1, 'embedding_dim': 32, 'lr': 0.0009541829794048316, 'lambda_val': 0.0018416708860072794, 'batch_size': 764, 'optimizer': 'Adam'}. Best is trial 63 with value: 0.09324104052534629.
2026-05-18 21:07:01,340 - optuna.study._optimize - INFO - Trial 74 pruned. 
2026-05-18 21:07:21,867 - experiment_functions - INFO - Early stopping at epoch 1300. Best Recall: 0.0895
2026-05-18 21:07:21,952 - optuna.study.study - INFO - Trial 75 finished with value: 0.08953480033646499 and parameters: {'n_layers': 1, 'embedding_dim': 32, 'lr': 0.0006215298023116207, 'lambda_val': 0.00012346507172320646, 'batch_size': 1295, 'optimizer': 'Adam'}. Best is trial 63 with value: 0.09324104052534629.
2026-05-18 21:07:36,767 - experiment_functions - INFO - Early stopping at epoch 900. Best Recall: 0.0909
2026-05-18 21:07:36,867 - optuna.study.study - INFO - Trial 76 finished with value: 0.0908970154810213 and parameters: {'n_layers': 1, 'embedding_dim': 256, 'lr': 0.0007639332709137827, 'lambda_val': 0.00020491881122564225, 'batch_size': 1133, 'optimizer': 'Adam'}. Best is trial 63 with value: 0.09324104052534629.
2026-05-18 21:07:49,769 - experiment_functions - INFO - Early stopping at epoch 700. Best Recall: 0.0851
2026-05-18 21:07:49,859 - optuna.study.study - INFO - Trial 77 finished with value: 0.08507891522758879 and parameters: {'n_layers': 2, 'embedding_dim': 256, 'lr': 0.0007722702194437093, 'lambda_val': 6.813686037727585e-05, 'batch_size': 1000, 'optimizer': 'Adam'}. Best is trial 63 with value: 0.09324104052534629.
2026-05-18 21:07:59,745 - experiment_functions - INFO - Early stopping at epoch 600. Best Recall: 0.0882
2026-05-18 21:07:59,836 - optuna.study.study - INFO - Trial 78 finished with value: 0.0882210028089195 and parameters: {'n_layers': 1, 'embedding_dim': 256, 'lr': 0.0025781833646442904, 'lambda_val': 0.00020544464053210012, 'batch_size': 1128, 'optimizer': 'Adam'}. Best is trial 63 with value: 0.09324104052534629.
2026-05-18 21:08:14,739 - experiment_functions - INFO - Early stopping at epoch 850. Best Recall: 0.0889
