2026-05-18 06:06:25,373 - optuna.study.study - INFO - Trial 139 finished with value: 0.07295373820275552 and parameters: {'n_layers': 1, 'embedding_dim': 32, 'lr': 0.000666440215301599, 'lambda_val': 0.014225673698608589, 'batch_size': 847, 'optimizer': 'RMSprop'}. Best is trial 106 with value: 0.0752064597146643.
2026-05-18 06:06:32,223 - experiment_functions - INFO - Early stopping at epoch 500. Best Recall: 0.0056
2026-05-18 06:06:32,301 - optuna.study.study - INFO - Trial 140 finished with value: 0.005572063956852066 and parameters: {'n_layers': 1, 'embedding_dim': 32, 'lr': 0.00037966922768398247, 'lambda_val': 0.019773216008847225, 'batch_size': 829, 'optimizer': 'RMSprop'}. Best is trial 106 with value: 0.0752064597146643.
2026-05-18 06:06:53,473 - experiment_functions - INFO - Early stopping at epoch 1550. Best Recall: 0.0713
2026-05-18 06:06:53,563 - optuna.study.study - INFO - Trial 141 finished with value: 0.07134496463822343 and parameters: {'n_layers': 1, 'embedding_dim': 32, 'lr': 0.0006454797103195156, 'lambda_val': 0.012276538653481106, 'batch_size': 947, 'optimizer': 'RMSprop'}. Best is trial 106 with value: 0.0752064597146643.
2026-05-18 06:07:08,426 - optuna.study._optimize - INFO - Trial 142 pruned. 
2026-05-18 06:07:26,533 - experiment_functions - INFO - Early stopping at epoch 1300. Best Recall: 0.0678
2026-05-18 06:07:26,633 - optuna.study.study - INFO - Trial 143 finished with value: 0.06775378389983851 and parameters: {'n_layers': 1, 'embedding_dim': 32, 'lr': 0.0006624186450198401, 'lambda_val': 0.03177194201545831, 'batch_size': 941, 'optimizer': 'RMSprop'}. Best is trial 106 with value: 0.0752064597146643.
2026-05-18 06:07:40,411 - optuna.study._optimize - INFO - Trial 144 pruned. 
2026-05-18 06:07:58,801 - experiment_functions - INFO - Early stopping at epoch 1400. Best Recall: 0.0676
2026-05-18 06:07:58,890 - optuna.study.study - INFO - Trial 145 finished with value: 0.0675908501828257 and parameters: {'n_layers': 1, 'embedding_dim': 32, 'lr': 0.0005546084491060825, 'lambda_val': 0.03696197689835382, 'batch_size': 922, 'optimizer': 'RMSprop'}. Best is trial 106 with value: 0.0752064597146643.
2026-05-18 06:08:16,574 - experiment_functions - INFO - Early stopping at epoch 1200. Best Recall: 0.0625
2026-05-18 06:08:17,338 - optuna.study.study - INFO - Trial 146 finished with value: 0.06250717736697661 and parameters: {'n_layers': 1, 'embedding_dim': 32, 'lr': 0.0007013443705599781, 'lambda_val': 0.030041046444282217, 'batch_size': 965, 'optimizer': 'RMSprop'}. Best is trial 106 with value: 0.0752064597146643.
2026-05-18 06:08:30,953 - experiment_functions - INFO - Early stopping at epoch 500. Best Recall: 0.0057
2026-05-18 06:08:31,032 - optuna.study.study - INFO - Trial 147 finished with value: 0.00574437529629031 and parameters: {'n_layers': 1, 'embedding_dim': 32, 'lr': 0.0003467601544471694, 'lambda_val': 0.012632048780226677, 'batch_size': 858, 'optimizer': 'RMSprop'}. Best is trial 106 with value: 0.0752064597146643.
2026-05-18 06:08:40,166 - experiment_functions - INFO - Early stopping at epoch 500. Best Recall: 0.0047
2026-05-18 06:08:40,256 - optuna.study.study - INFO - Trial 148 finished with value: 0.0047333078825497095 and parameters: {'n_layers': 1, 'embedding_dim': 32, 'lr': 0.00048038804668800497, 'lambda_val': 0.02393077051709241, 'batch_size': 756, 'optimizer': 'RMSprop'}. Best is trial 106 with value: 0.0752064597146643.
2026-05-18 06:08:53,335 - experiment_functions - INFO - Early stopping at epoch 950. Best Recall: 0.0614
2026-05-18 06:08:53,427 - optuna.study.study - INFO - Trial 149 finished with value: 0.06141658605471202 and parameters: {'n_layers': 1, 'embedding_dim': 64, 'lr': 0.0008053063726387598, 'lambda_val': 0.018906315500322773, 'batch_size': 805, 'optimizer': 'RMSprop'}. Best is trial 106 with value: 0.0752064597146643.
2026-05-18 06:09:07,100 - experiment_functions - INFO - Early stopping at epoch 950. Best Recall: 0.0483
2026-05-18 06:09:07,201 - optuna.study.study - INFO - Trial 150 finished with value: 0.04834151726889101 and parameters: {'n_layers': 1, 'embedding_dim': 256, 'lr': 0.0005961897733546659, 'lambda_val': 0.048978001083272625, 'batch_size': 1092, 'optimizer': 'RMSprop'}. Best is trial 106 with value: 0.0752064597146643.
2026-05-18 06:09:28,375 - experiment_functions - INFO - Early stopping at epoch 1550. Best Recall: 0.0676
2026-05-18 06:09:28,476 - optuna.study.study - INFO - Trial 151 finished with value: 0.0675963066443488 and parameters: {'n_layers': 1, 'embedding_dim': 32, 'lr': 0.0005514557863269808, 'lambda_val': 0.03994215450365975, 'batch_size': 941, 'optimizer': 'RMSprop'}. Best is trial 106 with value: 0.0752064597146643.
2026-05-18 06:09:42,407 - experiment_functions - INFO - Early stopping at epoch 850. Best Recall: 0.0546
2026-05-18 06:09:42,507 - optuna.study.study - INFO - Trial 152 finished with value: 0.05462309677690582 and parameters: {'n_layers': 1, 'embedding_dim': 32, 'lr': 0.0009202309048239344, 'lambda_val': 0.05935271201574483, 'batch_size': 969, 'optimizer': 'RMSprop'}. Best is trial 106 with value: 0.0752064597146643.
2026-05-18 06:09:56,157 - optuna.study._optimize - INFO - Trial 153 pruned. 
2026-05-18 06:10:19,642 - experiment_functions - INFO - Early stopping at epoch 1750. Best Recall: 0.0734
2026-05-18 06:10:19,731 - optuna.study.study - INFO - Trial 154 finished with value: 0.07343203279884568 and parameters: {'n_layers': 1, 'embedding_dim': 32, 'lr': 0.0006291134424784513, 'lambda_val': 0.015194073272530336, 'batch_size': 715, 'optimizer': 'RMSprop'}. Best is trial 106 with value: 0.0752064597146643.
2026-05-18 06:10:44,119 - experiment_functions - INFO - Early stopping at epoch 1800. Best Recall: 0.0672
2026-05-18 06:10:44,216 - optuna.study.study - INFO - Trial 155 finished with value: 0.06718131036177025 and parameters: {'n_layers': 1, 'embedding_dim': 32, 'lr': 0.0007056345137914121, 'lambda_val': 0.013853675343167006, 'batch_size': 716, 'optimizer': 'RMSprop'}. Best is trial 106 with value: 0.0752064597146643.
2026-05-18 06:10:55,792 - experiment_functions - INFO - Early stopping at epoch 800. Best Recall: 0.0611
2026-05-18 06:10:55,903 - optuna.study.study - INFO - Trial 156 finished with value: 0.06105621142460665 and parameters: {'n_layers': 1, 'embedding_dim': 32, 'lr': 0.0012323328641107708, 'lambda_val': 0.01689451738934671, 'batch_size': 766, 'optimizer': 'RMSprop'}. Best is trial 106 with value: 0.0752064597146643.
2026-05-18 06:11:10,587 - experiment_functions - INFO - Early stopping at epoch 1050. Best Recall: 0.0647
2026-05-18 06:11:10,695 - optuna.study.study - INFO - Trial 157 finished with value: 0.0646531394334719 and parameters: {'n_layers': 1, 'embedding_dim': 32, 'lr': 0.000911992237563118, 'lambda_val': 0.023535535615787792, 'batch_size': 674, 'optimizer': 'RMSprop'}. Best is trial 106 with value: 0.0752064597146643.
2026-05-18 06:11:30,376 - experiment_functions - INFO - Early stopping at epoch 1400. Best Recall: 0.0685
2026-05-18 06:11:30,508 - optuna.study.study - INFO - Trial 158 finished with value: 0.06854915016982013 and parameters: {'n_layers': 1, 'embedding_dim': 32, 'lr': 0.000755846649274888, 'lambda_val': 0.010920865082581882, 'batch_size': 860, 'optimizer': 'RMSprop'}. Best is trial 106 with value: 0.0752064597146643.
2026-05-18 06:11:43,728 - experiment_functions - INFO - Early stopping at epoch 950. Best Recall: 0.0556
2026-05-18 06:11:43,826 - optuna.study.study - INFO - Trial 159 finished with value: 0.05555445214302918 and parameters: {'n_layers': 1, 'embedding_dim': 128, 'lr': 0.0006961827762324693, 'lambda_val': 0.030828667530940622, 'batch_size': 1035, 'optimizer': 'RMSprop'}. Best is trial 106 with value: 0.0752064597146643.
2026-05-18 06:11:50,904 - experiment_functions - INFO - Early stopping at epoch 500. Best Recall: 0.0054
2026-05-18 06:11:51,002 - optuna.study.study - INFO - Trial 160 finished with value: 0.005403308065968162 and parameters: {'n_layers': 1, 'embedding_dim': 32, 'lr': 0.00025901356462882026, 'lambda_val': 0.0084996376511034, 'batch_size': 826, 'optimizer': 'RMSprop'}. Best is trial 106 with value: 0.0752064597146643.
2026-05-18 06:12:03,990 - experiment_functions - INFO - Early stopping at epoch 900. Best Recall: 0.0628
2026-05-18 06:12:04,175 - optuna.study.study - INFO - Trial 161 finished with value: 0.06277475064039625 and parameters: {'n_layers': 1, 'embedding_dim': 32, 'lr': 0.001016042916191562, 'lambda_val': 0.011255082209805494, 'batch_size': 899, 'optimizer': 'RMSprop'}. Best is trial 106 with value: 0.0752064597146643.
2026-05-18 06:12:22,863 - experiment_functions - INFO - Early stopping at epoch 1200. Best Recall: 0.0679
2026-05-18 06:12:22,953 - optuna.study.study - INFO - Trial 162 finished with value: 0.06793301317712075 and parameters: {'n_layers': 1, 'embedding_dim': 32, 'lr': 0.000821477941212247, 'lambda_val': 0.014136914304082059, 'batch_size': 784, 'optimizer': 'RMSprop'}. Best is trial 106 with value: 0.0752064597146643.
2026-05-18 06:12:41,689 - experiment_functions - INFO - Early stopping at epoch 1400. Best Recall: 0.0683
2026-05-18 06:12:41,788 - optuna.study.study - INFO - Trial 163 finished with value: 0.06834901259900789 and parameters: {'n_layers': 1, 'embedding_dim': 32, 'lr': 0.0007767275136002768, 'lambda_val': 0.014170948452375242, 'batch_size': 820, 'optimizer': 'RMSprop'}. Best is trial 106 with value: 0.0752064597146643.
2026-05-18 06:13:04,267 - optuna.study._optimize - INFO - Trial 164 pruned. 
2026-05-18 06:13:29,449 - experiment_functions - INFO - Early stopping at epoch 1900. Best Recall: 0.0649
2026-05-18 06:13:29,539 - optuna.study.study - INFO - Trial 165 finished with value: 0.06490387174961555 and parameters: {'n_layers': 1, 'embedding_dim': 32, 'lr': 0.0006333017006673001, 'lambda_val': 0.014262958236109999, 'batch_size': 939, 'optimizer': 'RMSprop'}. Best is trial 106 with value: 0.0752064597146643.
2026-05-18 06:13:42,632 - optuna.study._optimize - INFO - Trial 166 pruned. 
2026-05-18 06:13:58,024 - experiment_functions - INFO - Early stopping at epoch 1100. Best Recall: 0.0651
2026-05-18 06:13:58,170 - optuna.study.study - INFO - Trial 167 finished with value: 0.06508564033663328 and parameters: {'n_layers': 1, 'embedding_dim': 32, 'lr': 0.0007975679640491846, 'lambda_val': 0.020949128448604706, 'batch_size': 889, 'optimizer': 'RMSprop'}. Best is trial 106 with value: 0.0752064597146643.
2026-05-18 06:14:24,537 - experiment_functions - INFO - Early stopping at epoch 2000. Best Recall: 0.0673
2026-05-18 06:14:25,116 - optuna.study.study - INFO - Trial 168 finished with value: 0.06731138713146124 and parameters: {'n_layers': 1, 'embedding_dim': 32, 'lr': 0.0005358192472771556, 'lambda_val': 0.013077819129837442, 'batch_size': 1209, 'optimizer': 'RMSprop'}. Best is trial 106 with value: 0.0752064597146643.
2026-05-18 06:14:40,037 - experiment_functions - INFO - Early stopping at epoch 1100. Best Recall: 0.0630
2026-05-18 06:14:40,148 - optuna.study.study - INFO - Trial 169 finished with value: 0.06303443926734252 and parameters: {'n_layers': 1, 'embedding_dim': 32, 'lr': 0.0007575863028328074, 'lambda_val': 0.018785998689442505, 'batch_size': 1062, 'optimizer': 'RMSprop'}. Best is trial 106 with value: 0.0752064597146643.
2026-05-18 06:15:18,146 - experiment_functions - INFO - Early stopping at epoch 2800. Best Recall: 0.0694
2026-05-18 06:15:19,097 - optuna.study.study - INFO - Trial 170 finished with value: 0.06940310869802373 and parameters: {'n_layers': 1, 'embedding_dim': 32, 'lr': 0.0006110520305332062, 'lambda_val': 0.007788106897779138, 'batch_size': 714, 'optimizer': 'RMSprop'}. Best is trial 106 with value: 0.0752064597146643.
2026-05-18 06:16:16,537 - experiment_functions - INFO - Early stopping at epoch 3600. Best Recall: 0.0773
2026-05-18 06:16:16,695 - optuna.study.study - INFO - Trial 171 finished with value: 0.07732428247066869 and parameters: {'n_layers': 1, 'embedding_dim': 32, 'lr': 0.0005948233659766302, 'lambda_val': 0.008333481735828414, 'batch_size': 725, 'optimizer': 'RMSprop'}. Best is trial 171 with value: 0.07732428247066869.
2026-05-18 06:16:32,835 - optuna.study._optimize - INFO - Trial 172 pruned. 
2026-05-18 06:16:45,888 - optuna.study._optimize - INFO - Trial 173 pruned. 
2026-05-18 06:16:59,178 - optuna.study._optimize - INFO - Trial 174 pruned. 
2026-05-18 06:17:17,416 - experiment_functions - INFO - Early stopping at epoch 1250. Best Recall: 0.0616
2026-05-18 06:17:17,494 - optuna.study.study - INFO - Trial 175 finished with value: 0.06162480447761114 and parameters: {'n_layers': 1, 'embedding_dim': 32, 'lr': 0.0008086871276093578, 'lambda_val': 0.0108267948060908, 'batch_size': 822, 'optimizer': 'RMSprop'}. Best is trial 171 with value: 0.07732428247066869.
2026-05-18 06:17:31,295 - optuna.study._optimize - INFO - Trial 176 pruned. 
2026-05-18 06:17:38,454 - experiment_functions - INFO - Early stopping at epoch 500. Best Recall: 0.0047
2026-05-18 06:17:38,554 - optuna.study.study - INFO - Trial 177 finished with value: 0.004683301700415762 and parameters: {'n_layers': 1, 'embedding_dim': 32, 'lr': 0.00037853181933673245, 'lambda_val': 0.014159639423228745, 'batch_size': 663, 'optimizer': 'RMSprop'}. Best is trial 171 with value: 0.07732428247066869.
2026-05-18 06:17:46,198 - experiment_functions - INFO - Early stopping at epoch 500. Best Recall: 0.0050
2026-05-18 06:17:46,318 - optuna.study.study - INFO - Trial 178 finished with value: 0.004951339659460933 and parameters: {'n_layers': 1, 'embedding_dim': 32, 'lr': 0.0008698054268453055, 'lambda_val': 0.008082635879853176, 'batch_size': 725, 'optimizer': 'SGD'}. Best is trial 171 with value: 0.07732428247066869.
2026-05-18 06:18:14,945 - experiment_functions - INFO - Early stopping at epoch 1450. Best Recall: 0.0646
2026-05-18 06:18:15,033 - optuna.study.study - INFO - Trial 179 finished with value: 0.0646409337497295 and parameters: {'n_layers': 1, 'embedding_dim': 32, 'lr': 0.00072330771548295, 'lambda_val': 0.01113902613266185, 'batch_size': 987, 'optimizer': 'RMSprop'}. Best is trial 171 with value: 0.07732428247066869.
2026-05-18 06:18:28,070 - optuna.study._optimize - INFO - Trial 180 pruned. 
2026-05-18 06:18:38,212 - experiment_functions - INFO - Early stopping at epoch 750. Best Recall: 0.0605
2026-05-18 06:18:38,281 - optuna.study.study - INFO - Trial 181 finished with value: 0.06050599045917881 and parameters: {'n_layers': 1, 'embedding_dim': 32, 'lr': 0.0011967049193546712, 'lambda_val': 0.016713162865099822, 'batch_size': 893, 'optimizer': 'RMSprop'}. Best is trial 171 with value: 0.07732428247066869.
2026-05-18 06:18:57,458 - experiment_functions - INFO - Early stopping at epoch 1500. Best Recall: 0.0691
2026-05-18 06:18:57,556 - optuna.study.study - INFO - Trial 182 finished with value: 0.06913449090303149 and parameters: {'n_layers': 1, 'embedding_dim': 32, 'lr': 0.0006126933998777647, 'lambda_val': 0.024915924311917272, 'batch_size': 778, 'optimizer': 'RMSprop'}. Best is trial 171 with value: 0.07732428247066869.
2026-05-18 06:19:18,191 - experiment_functions - INFO - Early stopping at epoch 1650. Best Recall: 0.0727
2026-05-18 06:19:18,269 - optuna.study.study - INFO - Trial 183 finished with value: 0.07269253877807376 and parameters: {'n_layers': 1, 'embedding_dim': 32, 'lr': 0.0006030879734916121, 'lambda_val': 0.029578377982989557, 'batch_size': 791, 'optimizer': 'RMSprop'}. Best is trial 171 with value: 0.07732428247066869.
2026-05-18 06:19:30,944 - optuna.study._optimize - INFO - Trial 184 pruned. 
2026-05-18 06:19:37,490 - experiment_functions - INFO - Early stopping at epoch 500. Best Recall: 0.0053
2026-05-18 06:19:37,560 - optuna.study.study - INFO - Trial 185 finished with value: 0.0053120202386234385 and parameters: {'n_layers': 1, 'embedding_dim': 32, 'lr': 0.00042333071982780335, 'lambda_val': 0.013256232274397957, 'batch_size': 784, 'optimizer': 'RMSprop'}. Best is trial 171 with value: 0.07732428247066869.
2026-05-18 06:19:51,539 - optuna.study._optimize - INFO - Trial 186 pruned. 
2026-05-18 06:20:09,400 - optuna.study._optimize - INFO - Trial 187 pruned. 
2026-05-18 06:20:23,876 - optuna.study._optimize - INFO - Trial 188 pruned. 
2026-05-18 06:20:32,895 - experiment_functions - INFO - Early stopping at epoch 600. Best Recall: 0.0274
2026-05-18 06:20:33,039 - optuna.study.study - INFO - Trial 189 finished with value: 0.027405667710044806 and parameters: {'n_layers': 3, 'embedding_dim': 32, 'lr': 0.0007400930457889752, 'lambda_val': 0.02111764710297049, 'batch_size': 4069, 'optimizer': 'RMSprop'}. Best is trial 171 with value: 0.07732428247066869.
2026-05-18 06:20:49,505 - experiment_functions - INFO - Early stopping at epoch 1150. Best Recall: 0.0681
2026-05-18 06:20:49,574 - optuna.study.study - INFO - Trial 190 finished with value: 0.06814072157862235 and parameters: {'n_layers': 1, 'embedding_dim': 32, 'lr': 0.0009892511774285053, 'lambda_val': 0.011901096020016759, 'batch_size': 567, 'optimizer': 'RMSprop'}. Best is trial 171 with value: 0.07732428247066869.
2026-05-18 06:21:04,738 - experiment_functions - INFO - Early stopping at epoch 1150. Best Recall: 0.0641
2026-05-18 06:21:04,806 - optuna.study.study - INFO - Trial 191 finished with value: 0.06410745889979648 and parameters: {'n_layers': 1, 'embedding_dim': 32, 'lr': 0.0009858109298397264, 'lambda_val': 0.012634143458012545, 'batch_size': 577, 'optimizer': 'RMSprop'}. Best is trial 171 with value: 0.07732428247066869.
2026-05-18 06:21:17,850 - optuna.study._optimize - INFO - Trial 192 pruned. 
2026-05-18 06:21:37,271 - experiment_functions - INFO - Early stopping at epoch 1500. Best Recall: 0.0648
2026-05-18 06:21:37,351 - optuna.study.study - INFO - Trial 193 finished with value: 0.0647634407416887 and parameters: {'n_layers': 1, 'embedding_dim': 32, 'lr': 0.0007211597051951721, 'lambda_val': 0.009967740738733327, 'batch_size': 830, 'optimizer': 'RMSprop'}. Best is trial 171 with value: 0.07732428247066869.
2026-05-18 06:21:50,271 - experiment_functions - INFO - Early stopping at epoch 950. Best Recall: 0.0638
2026-05-18 06:21:50,369 - optuna.study.study - INFO - Trial 194 finished with value: 0.06378232056449251 and parameters: {'n_layers': 1, 'embedding_dim': 32, 'lr': 0.0010483740793365004, 'lambda_val': 0.012311229276042503, 'batch_size': 626, 'optimizer': 'RMSprop'}. Best is trial 171 with value: 0.07732428247066869.
2026-05-18 06:22:04,255 - optuna.study._optimize - INFO - Trial 195 pruned. 
2026-05-18 06:22:17,661 - experiment_functions - INFO - Early stopping at epoch 950. Best Recall: 0.0618
2026-05-18 06:22:17,772 - optuna.study.study - INFO - Trial 196 finished with value: 0.06176097655443885 and parameters: {'n_layers': 1, 'embedding_dim': 128, 'lr': 0.0008615400858279762, 'lambda_val': 0.01700623639456315, 'batch_size': 550, 'optimizer': 'RMSprop'}. Best is trial 171 with value: 0.07732428247066869.
2026-05-18 06:22:31,878 - optuna.study._optimize - INFO - Trial 197 pruned. 
2026-05-18 06:23:00,905 - optuna.study._optimize - INFO - Trial 198 pruned. 
2026-05-18 06:23:12,511 - experiment_functions - INFO - Early stopping at epoch 700. Best Recall: 0.0575
2026-05-18 06:23:12,612 - optuna.study.study - INFO - Trial 199 finished with value: 0.057509543036431854 and parameters: {'n_layers': 1, 'embedding_dim': 32, 'lr': 0.0014614581198992944, 'lambda_val': 0.014442484299409591, 'batch_size': 855, 'optimizer': 'RMSprop'}. Best is trial 171 with value: 0.07732428247066869.
2026-05-18 06:23:21,029 - experiment_functions - INFO - Early stopping at epoch 600. Best Recall: 0.0483
2026-05-18 06:23:21,130 - optuna.study.study - INFO - Trial 200 finished with value: 0.04830863016045749 and parameters: {'n_layers': 2, 'embedding_dim': 32, 'lr': 0.0011238364349672224, 'lambda_val': 0.02115382344808519, 'batch_size': 764, 'optimizer': 'RMSprop'}. Best is trial 171 with value: 0.07732428247066869.
2026-05-18 06:23:37,832 - experiment_functions - INFO - Early stopping at epoch 1300. Best Recall: 0.0666
2026-05-18 06:23:37,932 - optuna.study.study - INFO - Trial 201 finished with value: 0.06657865035007558 and parameters: {'n_layers': 1, 'embedding_dim': 32, 'lr': 0.0006169351179019962, 'lambda_val': 0.0324995141232037, 'batch_size': 953, 'optimizer': 'RMSprop'}. Best is trial 171 with value: 0.07732428247066869.
2026-05-18 06:23:51,343 - optuna.study._optimize - INFO - Trial 202 pruned. 
2026-05-18 06:24:09,843 - experiment_functions - INFO - Early stopping at epoch 1450. Best Recall: 0.0685
2026-05-18 06:24:09,933 - optuna.study.study - INFO - Trial 203 finished with value: 0.06852739975946333 and parameters: {'n_layers': 1, 'embedding_dim': 32, 'lr': 0.0008793137029691372, 'lambda_val': 9.380884586409839e-05, 'batch_size': 806, 'optimizer': 'RMSprop'}. Best is trial 171 with value: 0.07732428247066869.
2026-05-18 06:24:23,295 - experiment_functions - INFO - Early stopping at epoch 950. Best Recall: 0.0539
2026-05-18 06:24:23,385 - optuna.study.study - INFO - Trial 204 finished with value: 0.05394376904503538 and parameters: {'n_layers': 1, 'embedding_dim': 32, 'lr': 0.0008944462588897949, 'lambda_val': 8.850498471122065e-05, 'batch_size': 2240, 'optimizer': 'RMSprop'}. Best is trial 171 with value: 0.07732428247066869.
2026-05-18 06:24:30,024 - experiment_functions - INFO - Early stopping at epoch 500. Best Recall: 0.0047
2026-05-18 06:24:30,125 - optuna.study.study - INFO - Trial 205 finished with value: 0.004698741991797967 and parameters: {'n_layers': 1, 'embedding_dim': 32, 'lr': 0.0007848482328184588, 'lambda_val': 7.532401665366655e-05, 'batch_size': 799, 'optimizer': 'SGD'}. Best is trial 171 with value: 0.07732428247066869.
2026-05-18 06:24:44,874 - experiment_functions - INFO - Early stopping at epoch 1100. Best Recall: 0.0666
