2026-05-18 12:41:55,582 - optuna.study.study - INFO - Trial 128 finished with value: 0.00478196595375675 and parameters: {'n_layers': 4, 'embedding_dim': 32, 'lr': 0.0019123608603543974, 'lambda_val': 1.1643593023906291e-05, 'batch_size': 578, 'optimizer': 'SGD'}. Best is trial 23 with value: 0.06979390339363536.
2026-05-18 12:42:09,673 - experiment_functions - INFO - Early stopping at epoch 1000. Best Recall: 0.0641
2026-05-18 12:42:09,796 - optuna.study.study - INFO - Trial 129 finished with value: 0.06405995452275953 and parameters: {'n_layers': 1, 'embedding_dim': 32, 'lr': 0.0015225339327224977, 'lambda_val': 5.0556917549613766e-06, 'batch_size': 662, 'optimizer': 'Adam'}. Best is trial 23 with value: 0.06979390339363536.
2026-05-18 12:42:25,335 - experiment_functions - INFO - Early stopping at epoch 1000. Best Recall: 0.0637
2026-05-18 12:42:25,435 - optuna.study.study - INFO - Trial 130 finished with value: 0.0637170750226183 and parameters: {'n_layers': 1, 'embedding_dim': 32, 'lr': 0.0016021862612304832, 'lambda_val': 4.40783085342339e-06, 'batch_size': 658, 'optimizer': 'Adam'}. Best is trial 23 with value: 0.06979390339363536.
2026-05-18 12:42:42,425 - experiment_functions - INFO - Early stopping at epoch 1250. Best Recall: 0.0694
2026-05-18 12:42:42,581 - optuna.study.study - INFO - Trial 131 finished with value: 0.06940539858935682 and parameters: {'n_layers': 1, 'embedding_dim': 32, 'lr': 0.001120355936311607, 'lambda_val': 5.622021398321581e-06, 'batch_size': 897, 'optimizer': 'Adam'}. Best is trial 23 with value: 0.06979390339363536.
2026-05-18 12:42:56,300 - experiment_functions - INFO - Early stopping at epoch 950. Best Recall: 0.0619
2026-05-18 12:42:56,399 - optuna.study.study - INFO - Trial 132 finished with value: 0.06190219858502464 and parameters: {'n_layers': 1, 'embedding_dim': 32, 'lr': 0.002171994384392979, 'lambda_val': 5.794643699479456e-06, 'batch_size': 515, 'optimizer': 'Adam'}. Best is trial 23 with value: 0.06979390339363536.
2026-05-18 12:43:08,718 - experiment_functions - INFO - Early stopping at epoch 750. Best Recall: 0.0648
2026-05-18 12:43:08,828 - optuna.study.study - INFO - Trial 133 finished with value: 0.06481435619442841 and parameters: {'n_layers': 1, 'embedding_dim': 32, 'lr': 0.0025618883515031035, 'lambda_val': 2.4891449694628213e-06, 'batch_size': 717, 'optimizer': 'Adam'}. Best is trial 23 with value: 0.06979390339363536.
2026-05-18 12:43:19,662 - experiment_functions - INFO - Early stopping at epoch 750. Best Recall: 0.0616
2026-05-18 12:43:19,753 - optuna.study.study - INFO - Trial 134 finished with value: 0.06156489779349027 and parameters: {'n_layers': 1, 'embedding_dim': 32, 'lr': 0.002502309756415793, 'lambda_val': 4.167912597866461e-06, 'batch_size': 874, 'optimizer': 'Adam'}. Best is trial 23 with value: 0.06979390339363536.
2026-05-18 12:43:38,374 - experiment_functions - INFO - Early stopping at epoch 1400. Best Recall: 0.0680
2026-05-18 12:43:38,473 - optuna.study.study - INFO - Trial 135 finished with value: 0.06798166061880415 and parameters: {'n_layers': 1, 'embedding_dim': 32, 'lr': 0.0011563288532006775, 'lambda_val': 2.0466293806361085e-06, 'batch_size': 587, 'optimizer': 'Adam'}. Best is trial 23 with value: 0.06979390339363536.
2026-05-18 12:44:00,226 - experiment_functions - INFO - Early stopping at epoch 1450. Best Recall: 0.0699
2026-05-18 12:44:00,329 - optuna.study.study - INFO - Trial 136 finished with value: 0.06985880348247454 and parameters: {'n_layers': 1, 'embedding_dim': 32, 'lr': 0.0011935436478840422, 'lambda_val': 2.2361670086515234e-06, 'batch_size': 594, 'optimizer': 'Adam'}. Best is trial 136 with value: 0.06985880348247454.
2026-05-18 12:44:19,957 - experiment_functions - INFO - Early stopping at epoch 1400. Best Recall: 0.0687
2026-05-18 12:44:20,065 - optuna.study.study - INFO - Trial 137 finished with value: 0.06871583807510041 and parameters: {'n_layers': 1, 'embedding_dim': 32, 'lr': 0.0011859896297163961, 'lambda_val': 1.5703537318014054e-06, 'batch_size': 592, 'optimizer': 'Adam'}. Best is trial 136 with value: 0.06985880348247454.
2026-05-18 12:44:38,300 - experiment_functions - INFO - Early stopping at epoch 1350. Best Recall: 0.0665
2026-05-18 12:44:38,390 - optuna.study.study - INFO - Trial 138 finished with value: 0.06652857197252474 and parameters: {'n_layers': 1, 'embedding_dim': 32, 'lr': 0.001148385732977332, 'lambda_val': 1.0454906598329151e-06, 'batch_size': 588, 'optimizer': 'Adam'}. Best is trial 136 with value: 0.06985880348247454.
2026-05-18 12:44:58,775 - experiment_functions - INFO - Early stopping at epoch 1550. Best Recall: 0.0650
2026-05-18 12:44:58,875 - optuna.study.study - INFO - Trial 139 finished with value: 0.06502502178053839 and parameters: {'n_layers': 1, 'embedding_dim': 32, 'lr': 0.0011397224750635962, 'lambda_val': 1.3960799566109225e-06, 'batch_size': 585, 'optimizer': 'Adam'}. Best is trial 136 with value: 0.06985880348247454.
2026-05-18 12:45:15,612 - experiment_functions - INFO - Early stopping at epoch 1200. Best Recall: 0.0667
2026-05-18 12:45:15,720 - optuna.study.study - INFO - Trial 140 finished with value: 0.0666975462109795 and parameters: {'n_layers': 1, 'embedding_dim': 32, 'lr': 0.0012297927329816545, 'lambda_val': 1.4877573343297205e-06, 'batch_size': 580, 'optimizer': 'Adam'}. Best is trial 136 with value: 0.06985880348247454.
2026-05-18 12:45:36,446 - experiment_functions - INFO - Early stopping at epoch 1550. Best Recall: 0.0651
2026-05-18 12:45:36,546 - optuna.study.study - INFO - Trial 141 finished with value: 0.06512708926182299 and parameters: {'n_layers': 1, 'embedding_dim': 32, 'lr': 0.0011236779641429233, 'lambda_val': 1.5802729853920004e-06, 'batch_size': 574, 'optimizer': 'Adam'}. Best is trial 136 with value: 0.06985880348247454.
2026-05-18 12:45:59,123 - experiment_functions - INFO - Early stopping at epoch 1700. Best Recall: 0.0647
2026-05-18 12:45:59,222 - optuna.study.study - INFO - Trial 142 finished with value: 0.06469618322964273 and parameters: {'n_layers': 1, 'embedding_dim': 32, 'lr': 0.0011371837373515049, 'lambda_val': 1.5227897721667154e-06, 'batch_size': 574, 'optimizer': 'Adam'}. Best is trial 136 with value: 0.06985880348247454.
2026-05-18 12:46:20,859 - experiment_functions - INFO - Early stopping at epoch 1650. Best Recall: 0.0666
2026-05-18 12:46:20,952 - optuna.study.study - INFO - Trial 143 finished with value: 0.06661337225771956 and parameters: {'n_layers': 1, 'embedding_dim': 32, 'lr': 0.0010403813005720004, 'lambda_val': 2.50754955375542e-06, 'batch_size': 603, 'optimizer': 'Adam'}. Best is trial 136 with value: 0.06985880348247454.
2026-05-18 12:46:44,353 - experiment_functions - INFO - Early stopping at epoch 1750. Best Recall: 0.0703
2026-05-18 12:46:44,458 - optuna.study.study - INFO - Trial 144 finished with value: 0.07026256349663933 and parameters: {'n_layers': 1, 'embedding_dim': 32, 'lr': 0.0009955548312889553, 'lambda_val': 1.3604627163158368e-06, 'batch_size': 583, 'optimizer': 'Adam'}. Best is trial 144 with value: 0.07026256349663933.
2026-05-18 12:47:11,092 - experiment_functions - INFO - Early stopping at epoch 2050. Best Recall: 0.0683
2026-05-18 12:47:11,190 - optuna.study.study - INFO - Trial 145 finished with value: 0.06831463956503839 and parameters: {'n_layers': 1, 'embedding_dim': 32, 'lr': 0.000954953418104023, 'lambda_val': 1.0085487320969943e-06, 'batch_size': 531, 'optimizer': 'Adam'}. Best is trial 144 with value: 0.07026256349663933.
2026-05-18 12:47:40,088 - experiment_functions - INFO - Early stopping at epoch 2150. Best Recall: 0.0720
2026-05-18 12:47:40,177 - optuna.study.study - INFO - Trial 146 finished with value: 0.07199296484248736 and parameters: {'n_layers': 1, 'embedding_dim': 32, 'lr': 0.0009632066938135581, 'lambda_val': 1.0601412293176138e-06, 'batch_size': 536, 'optimizer': 'RMSprop'}. Best is trial 146 with value: 0.07199296484248736.
2026-05-18 12:47:53,643 - experiment_functions - INFO - Early stopping at epoch 900. Best Recall: 0.0577
2026-05-18 12:47:53,733 - optuna.study.study - INFO - Trial 147 finished with value: 0.05772715459727547 and parameters: {'n_layers': 1, 'embedding_dim': 256, 'lr': 0.0009724049874872672, 'lambda_val': 1.0158499963206417e-06, 'batch_size': 620, 'optimizer': 'RMSprop'}. Best is trial 146 with value: 0.07199296484248736.
2026-05-18 12:48:13,247 - experiment_functions - INFO - Early stopping at epoch 1450. Best Recall: 0.0716
2026-05-18 12:48:13,334 - optuna.study.study - INFO - Trial 148 finished with value: 0.07159060748589781 and parameters: {'n_layers': 1, 'embedding_dim': 32, 'lr': 0.0009700794688911489, 'lambda_val': 1.8661651943064368e-06, 'batch_size': 517, 'optimizer': 'RMSprop'}. Best is trial 146 with value: 0.07199296484248736.
2026-05-18 12:48:40,784 - experiment_functions - INFO - Early stopping at epoch 2050. Best Recall: 0.0754
2026-05-18 12:48:40,887 - optuna.study.study - INFO - Trial 149 finished with value: 0.07541976849128529 and parameters: {'n_layers': 1, 'embedding_dim': 32, 'lr': 0.0009475632147688274, 'lambda_val': 1.932339464009741e-06, 'batch_size': 531, 'optimizer': 'RMSprop'}. Best is trial 149 with value: 0.07541976849128529.
2026-05-18 12:49:06,789 - experiment_functions - INFO - Early stopping at epoch 1950. Best Recall: 0.0704
2026-05-18 12:49:06,880 - optuna.study.study - INFO - Trial 150 finished with value: 0.07038142233964367 and parameters: {'n_layers': 1, 'embedding_dim': 32, 'lr': 0.0009410969539182729, 'lambda_val': 2.1636930104775533e-06, 'batch_size': 542, 'optimizer': 'RMSprop'}. Best is trial 149 with value: 0.07541976849128529.
2026-05-18 12:49:22,631 - experiment_functions - INFO - Early stopping at epoch 1200. Best Recall: 0.0694
2026-05-18 12:49:22,786 - optuna.study.study - INFO - Trial 151 finished with value: 0.06940179143942199 and parameters: {'n_layers': 1, 'embedding_dim': 32, 'lr': 0.0013472321890097563, 'lambda_val': 2.2650382048838467e-06, 'batch_size': 513, 'optimizer': 'RMSprop'}. Best is trial 149 with value: 0.07541976849128529.
2026-05-18 12:49:45,104 - experiment_functions - INFO - Early stopping at epoch 1650. Best Recall: 0.0718
2026-05-18 12:49:45,205 - optuna.study.study - INFO - Trial 152 finished with value: 0.07180020139987635 and parameters: {'n_layers': 1, 'embedding_dim': 32, 'lr': 0.0009366788086610084, 'lambda_val': 2.0774172661908466e-06, 'batch_size': 520, 'optimizer': 'RMSprop'}. Best is trial 149 with value: 0.07541976849128529.
2026-05-18 12:50:12,566 - experiment_functions - INFO - Early stopping at epoch 2100. Best Recall: 0.0704
2026-05-18 12:50:13,137 - optuna.study.study - INFO - Trial 153 finished with value: 0.07038950626297742 and parameters: {'n_layers': 1, 'embedding_dim': 32, 'lr': 0.0008441534331359436, 'lambda_val': 2.2019112602638815e-06, 'batch_size': 688, 'optimizer': 'RMSprop'}. Best is trial 149 with value: 0.07541976849128529.
2026-05-18 12:50:40,713 - experiment_functions - INFO - Early stopping at epoch 2050. Best Recall: 0.0728
2026-05-18 12:50:40,812 - optuna.study.study - INFO - Trial 154 finished with value: 0.07275100466367755 and parameters: {'n_layers': 1, 'embedding_dim': 32, 'lr': 0.0008927104980393334, 'lambda_val': 1.8300239830621158e-06, 'batch_size': 513, 'optimizer': 'RMSprop'}. Best is trial 149 with value: 0.07541976849128529.
2026-05-18 12:51:04,461 - experiment_functions - INFO - Early stopping at epoch 1750. Best Recall: 0.0719
2026-05-18 12:51:04,562 - optuna.study.study - INFO - Trial 155 finished with value: 0.07189118590379066 and parameters: {'n_layers': 1, 'embedding_dim': 32, 'lr': 0.0009445963791512014, 'lambda_val': 2.002669631466474e-06, 'batch_size': 527, 'optimizer': 'RMSprop'}. Best is trial 149 with value: 0.07541976849128529.
2026-05-18 12:51:24,043 - experiment_functions - INFO - Early stopping at epoch 1450. Best Recall: 0.0734
2026-05-18 12:51:24,142 - optuna.study.study - INFO - Trial 156 finished with value: 0.07341055496993298 and parameters: {'n_layers': 1, 'embedding_dim': 32, 'lr': 0.0009457302804085288, 'lambda_val': 2.1441074862170515e-06, 'batch_size': 523, 'optimizer': 'RMSprop'}. Best is trial 149 with value: 0.07541976849128529.
2026-05-18 12:51:51,399 - experiment_functions - INFO - Early stopping at epoch 2000. Best Recall: 0.0719
2026-05-18 12:51:51,518 - optuna.study.study - INFO - Trial 157 finished with value: 0.07188313843843402 and parameters: {'n_layers': 1, 'embedding_dim': 32, 'lr': 0.0008961368245015644, 'lambda_val': 3.311164258468686e-06, 'batch_size': 515, 'optimizer': 'RMSprop'}. Best is trial 149 with value: 0.07541976849128529.
2026-05-18 12:52:26,100 - experiment_functions - INFO - Early stopping at epoch 2600. Best Recall: 0.0753
2026-05-18 12:52:26,245 - optuna.study.study - INFO - Trial 158 finished with value: 0.07527404668492678 and parameters: {'n_layers': 1, 'embedding_dim': 32, 'lr': 0.0008525147794501823, 'lambda_val': 3.120652930532168e-06, 'batch_size': 515, 'optimizer': 'RMSprop'}. Best is trial 149 with value: 0.07541976849128529.
2026-05-18 12:52:51,475 - optuna.study._optimize - INFO - Trial 159 pruned. 
2026-05-18 12:53:19,733 - experiment_functions - INFO - Early stopping at epoch 2100. Best Recall: 0.0708
2026-05-18 12:53:19,835 - optuna.study.study - INFO - Trial 160 finished with value: 0.07080291491282072 and parameters: {'n_layers': 1, 'embedding_dim': 32, 'lr': 0.0008406167595139766, 'lambda_val': 2.0510082602725043e-06, 'batch_size': 515, 'optimizer': 'RMSprop'}. Best is trial 149 with value: 0.07541976849128529.
2026-05-18 12:53:33,251 - optuna.study._optimize - INFO - Trial 161 pruned. 
2026-05-18 12:53:45,462 - experiment_functions - INFO - Early stopping at epoch 850. Best Recall: 0.0654
2026-05-18 12:53:45,551 - optuna.study.study - INFO - Trial 162 finished with value: 0.06539125052723521 and parameters: {'n_layers': 1, 'embedding_dim': 32, 'lr': 0.0014129414721270914, 'lambda_val': 2.4129385365178025e-06, 'batch_size': 531, 'optimizer': 'RMSprop'}. Best is trial 149 with value: 0.07541976849128529.
2026-05-18 12:53:59,135 - optuna.study._optimize - INFO - Trial 163 pruned. 
2026-05-18 12:54:32,831 - experiment_functions - INFO - Early stopping at epoch 2550. Best Recall: 0.0706
2026-05-18 12:54:32,930 - optuna.study.study - INFO - Trial 164 finished with value: 0.07063687559604143 and parameters: {'n_layers': 1, 'embedding_dim': 32, 'lr': 0.0008645520123285909, 'lambda_val': 1.9400090261350983e-06, 'batch_size': 520, 'optimizer': 'RMSprop'}. Best is trial 149 with value: 0.07541976849128529.
2026-05-18 12:54:54,824 - optuna.study._optimize - INFO - Trial 165 pruned. 
2026-05-18 12:55:08,212 - optuna.study._optimize - INFO - Trial 166 pruned. 
2026-05-18 12:55:30,289 - optuna.study._optimize - INFO - Trial 167 pruned. 
2026-05-18 12:55:43,550 - optuna.study._optimize - INFO - Trial 168 pruned. 
2026-05-18 12:56:05,472 - experiment_functions - INFO - Early stopping at epoch 1600. Best Recall: 0.0729
2026-05-18 12:56:05,570 - optuna.study.study - INFO - Trial 169 finished with value: 0.07287266656716944 and parameters: {'n_layers': 1, 'embedding_dim': 32, 'lr': 0.0008978414021251513, 'lambda_val': 2.795926201558788e-06, 'batch_size': 662, 'optimizer': 'RMSprop'}. Best is trial 149 with value: 0.07541976849128529.
2026-05-18 12:56:13,998 - experiment_functions - INFO - Early stopping at epoch 550. Best Recall: 0.0139
2026-05-18 12:56:14,089 - optuna.study.study - INFO - Trial 170 finished with value: 0.013912788383301703 and parameters: {'n_layers': 3, 'embedding_dim': 32, 'lr': 0.05169123306484143, 'lambda_val': 1.258772353663474e-06, 'batch_size': 654, 'optimizer': 'RMSprop'}. Best is trial 149 with value: 0.07541976849128529.
2026-05-18 12:56:35,935 - experiment_functions - INFO - Early stopping at epoch 1500. Best Recall: 0.0713
2026-05-18 12:56:36,026 - optuna.study.study - INFO - Trial 171 finished with value: 0.07132155034040771 and parameters: {'n_layers': 1, 'embedding_dim': 32, 'lr': 0.0009295662220233954, 'lambda_val': 3.930320803841837e-06, 'batch_size': 649, 'optimizer': 'RMSprop'}. Best is trial 149 with value: 0.07541976849128529.
2026-05-18 12:57:00,247 - experiment_functions - INFO - Early stopping at epoch 1650. Best Recall: 0.0721
2026-05-18 12:57:00,336 - optuna.study.study - INFO - Trial 172 finished with value: 0.07207723272858081 and parameters: {'n_layers': 1, 'embedding_dim': 32, 'lr': 0.0008391473288368666, 'lambda_val': 3.868838911055403e-06, 'batch_size': 649, 'optimizer': 'RMSprop'}. Best is trial 149 with value: 0.07541976849128529.
2026-05-18 12:57:28,731 - experiment_functions - INFO - Early stopping at epoch 1950. Best Recall: 0.0730
2026-05-18 12:57:28,887 - optuna.study.study - INFO - Trial 173 finished with value: 0.0730173780227728 and parameters: {'n_layers': 1, 'embedding_dim': 32, 'lr': 0.0008707006709708783, 'lambda_val': 2.8826914420299964e-06, 'batch_size': 653, 'optimizer': 'RMSprop'}. Best is trial 149 with value: 0.07541976849128529.
2026-05-18 12:57:43,465 - optuna.study._optimize - INFO - Trial 174 pruned. 
2026-05-18 12:57:57,657 - optuna.study._optimize - INFO - Trial 175 pruned. 
2026-05-18 12:58:22,317 - experiment_functions - INFO - Early stopping at epoch 1650. Best Recall: 0.0729
2026-05-18 12:58:22,416 - optuna.study.study - INFO - Trial 176 finished with value: 0.07287322460476207 and parameters: {'n_layers': 1, 'embedding_dim': 32, 'lr': 0.0009653041097346732, 'lambda_val': 3.7331335967194895e-06, 'batch_size': 665, 'optimizer': 'RMSprop'}. Best is trial 149 with value: 0.07541976849128529.
2026-05-18 12:58:43,624 - optuna.study._optimize - INFO - Trial 177 pruned. 
2026-05-18 12:58:58,375 - optuna.study._optimize - INFO - Trial 178 pruned. 
2026-05-18 12:59:19,080 - optuna.study._optimize - INFO - Trial 179 pruned. 
2026-05-18 12:59:33,475 - optuna.study._optimize - INFO - Trial 180 pruned. 
2026-05-18 12:59:48,734 - optuna.study._optimize - INFO - Trial 181 pruned. 
2026-05-18 13:00:03,065 - experiment_functions - INFO - Early stopping at epoch 950. Best Recall: 0.0647
2026-05-18 13:00:03,155 - optuna.study.study - INFO - Trial 182 finished with value: 0.06468245719231777 and parameters: {'n_layers': 1, 'embedding_dim': 32, 'lr': 0.001392554374558616, 'lambda_val': 2.6039176511825936e-06, 'batch_size': 646, 'optimizer': 'RMSprop'}. Best is trial 149 with value: 0.07541976849128529.
2026-05-18 13:00:14,691 - experiment_functions - INFO - Early stopping at epoch 750. Best Recall: 0.0507
2026-05-18 13:00:14,783 - optuna.study.study - INFO - Trial 183 finished with value: 0.05069740867597012 and parameters: {'n_layers': 1, 'embedding_dim': 32, 'lr': 0.0009699934397681174, 'lambda_val': 1.2980008319998371e-06, 'batch_size': 3448, 'optimizer': 'RMSprop'}. Best is trial 149 with value: 0.07541976849128529.
2026-05-18 13:00:35,428 - optuna.study._optimize - INFO - Trial 184 pruned. 
2026-05-18 13:00:50,852 - optuna.study._optimize - INFO - Trial 185 pruned. 
2026-05-18 13:01:05,445 - optuna.study._optimize - INFO - Trial 186 pruned. 
2026-05-18 13:01:19,705 - optuna.study._optimize - INFO - Trial 187 pruned. 
2026-05-18 13:01:34,268 - experiment_functions - INFO - Early stopping at epoch 950. Best Recall: 0.0722
2026-05-18 13:01:34,367 - optuna.study.study - INFO - Trial 188 finished with value: 0.07220947235484403 and parameters: {'n_layers': 1, 'embedding_dim': 32, 'lr': 0.001433125796461762, 'lambda_val': 4.588727878133199e-06, 'batch_size': 587, 'optimizer': 'RMSprop'}. Best is trial 149 with value: 0.07541976849128529.
2026-05-18 13:01:48,670 - experiment_functions - INFO - Early stopping at epoch 950. Best Recall: 0.0635
2026-05-18 13:01:48,762 - optuna.study.study - INFO - Trial 189 finished with value: 0.06354860016997488 and parameters: {'n_layers': 1, 'embedding_dim': 32, 'lr': 0.001357578693630518, 'lambda_val': 4.5660063805791815e-06, 'batch_size': 516, 'optimizer': 'RMSprop'}. Best is trial 149 with value: 0.07541976849128529.
2026-05-18 13:02:03,007 - optuna.study._optimize - INFO - Trial 190 pruned. 
2026-05-18 13:02:25,279 - experiment_functions - INFO - Early stopping at epoch 1550. Best Recall: 0.0703
2026-05-18 13:02:25,358 - optuna.study.study - INFO - Trial 191 finished with value: 0.0703172223694048 and parameters: {'n_layers': 1, 'embedding_dim': 32, 'lr': 0.0009757561841132206, 'lambda_val': 1.2484727462093031e-06, 'batch_size': 606, 'optimizer': 'RMSprop'}. Best is trial 149 with value: 0.07541976849128529.
2026-05-18 13:02:51,634 - experiment_functions - INFO - Early stopping at epoch 1850. Best Recall: 0.0733
2026-05-18 13:02:51,733 - optuna.study.study - INFO - Trial 192 finished with value: 0.07328905669295561 and parameters: {'n_layers': 1, 'embedding_dim': 32, 'lr': 0.0009189268287115469, 'lambda_val': 3.452999464024121e-06, 'batch_size': 625, 'optimizer': 'RMSprop'}. Best is trial 149 with value: 0.07541976849128529.
2026-05-18 13:03:05,455 - experiment_functions - INFO - Early stopping at epoch 900. Best Recall: 0.0618
2026-05-18 13:03:05,561 - optuna.study.study - INFO - Trial 193 finished with value: 0.061770517213936164 and parameters: {'n_layers': 1, 'embedding_dim': 32, 'lr': 0.0012925730544779816, 'lambda_val': 3.7919458318092633e-06, 'batch_size': 656, 'optimizer': 'RMSprop'}. Best is trial 149 with value: 0.07541976849128529.
2026-05-18 13:03:31,796 - experiment_functions - INFO - Early stopping at epoch 1850. Best Recall: 0.0704
2026-05-18 13:03:31,964 - optuna.study.study - INFO - Trial 194 finished with value: 0.07041035568825088 and parameters: {'n_layers': 1, 'embedding_dim': 32, 'lr': 0.0008068749639303321, 'lambda_val': 2.981314705937821e-06, 'batch_size': 581, 'optimizer': 'RMSprop'}. Best is trial 149 with value: 0.07541976849128529.
2026-05-18 13:04:19,270 - experiment_functions - INFO - Early stopping at epoch 3250. Best Recall: 0.0730
