2026-05-18 18:17:26,431 - optuna.study.study - INFO - Trial 163 finished with value: 0.06394391391716876 and parameters: {'n_layers': 1, 'embedding_dim': 32, 'lr': 0.001763259634080623, 'lambda_val': 1.0257724506093724e-06, 'batch_size': 512, 'optimizer': 'Adam'}. Best is trial 159 with value: 0.07162660798099917.
2026-05-18 18:17:44,353 - experiment_functions - INFO - Early stopping at epoch 1200. Best Recall: 0.0667
2026-05-18 18:17:44,460 - optuna.study.study - INFO - Trial 164 finished with value: 0.06672617812938983 and parameters: {'n_layers': 1, 'embedding_dim': 32, 'lr': 0.0013392776005423314, 'lambda_val': 1.7501960623271037e-06, 'batch_size': 602, 'optimizer': 'Adam'}. Best is trial 159 with value: 0.07162660798099917.
2026-05-18 18:17:52,748 - experiment_functions - INFO - Early stopping at epoch 550. Best Recall: 0.0117
2026-05-18 18:17:52,851 - optuna.study.study - INFO - Trial 165 finished with value: 0.011732477127561704 and parameters: {'n_layers': 1, 'embedding_dim': 32, 'lr': 0.07571654420947826, 'lambda_val': 1.4762405769138869e-06, 'batch_size': 677, 'optimizer': 'Adam'}. Best is trial 159 with value: 0.07162660798099917.
2026-05-18 18:18:07,917 - optuna.study._optimize - INFO - Trial 166 pruned. 
2026-05-18 18:18:22,312 - experiment_functions - INFO - Early stopping at epoch 950. Best Recall: 0.0628
2026-05-18 18:18:22,401 - optuna.study.study - INFO - Trial 167 finished with value: 0.06279886903942812 and parameters: {'n_layers': 1, 'embedding_dim': 32, 'lr': 0.0015688920569140313, 'lambda_val': 1.264097963209068e-06, 'batch_size': 744, 'optimizer': 'Adam'}. Best is trial 159 with value: 0.07162660798099917.
2026-05-18 18:18:34,835 - experiment_functions - INFO - Early stopping at epoch 850. Best Recall: 0.0654
2026-05-18 18:18:34,944 - optuna.study.study - INFO - Trial 168 finished with value: 0.06542413233828337 and parameters: {'n_layers': 1, 'embedding_dim': 32, 'lr': 0.0019853492792823602, 'lambda_val': 2.5899310905855898e-06, 'batch_size': 651, 'optimizer': 'Adam'}. Best is trial 159 with value: 0.07162660798099917.
2026-05-18 18:19:00,585 - experiment_functions - INFO - Early stopping at epoch 1300. Best Recall: 0.0659
2026-05-18 18:19:01,348 - optuna.study.study - INFO - Trial 169 finished with value: 0.06587935501739732 and parameters: {'n_layers': 1, 'embedding_dim': 32, 'lr': 0.0012567354954517139, 'lambda_val': 1.5100147339315947e-06, 'batch_size': 717, 'optimizer': 'Adam'}. Best is trial 159 with value: 0.07162660798099917.
2026-05-18 18:19:14,350 - experiment_functions - INFO - Early stopping at epoch 700. Best Recall: 0.0627
2026-05-18 18:19:14,441 - optuna.study.study - INFO - Trial 170 finished with value: 0.06271323429852944 and parameters: {'n_layers': 1, 'embedding_dim': 32, 'lr': 0.0025477504742496917, 'lambda_val': 2.0786369175674484e-06, 'batch_size': 2178, 'optimizer': 'Adam'}. Best is trial 159 with value: 0.07162660798099917.
2026-05-18 18:19:35,131 - experiment_functions - INFO - Early stopping at epoch 1450. Best Recall: 0.0675
2026-05-18 18:19:35,220 - optuna.study.study - INFO - Trial 171 finished with value: 0.06754412204538796 and parameters: {'n_layers': 1, 'embedding_dim': 32, 'lr': 0.0009532310316048154, 'lambda_val': 1.002209911866506e-06, 'batch_size': 799, 'optimizer': 'Adam'}. Best is trial 159 with value: 0.07162660798099917.
2026-05-18 18:20:05,894 - experiment_functions - INFO - Early stopping at epoch 2150. Best Recall: 0.0701
2026-05-18 18:20:05,994 - optuna.study.study - INFO - Trial 172 finished with value: 0.07010623661777546 and parameters: {'n_layers': 1, 'embedding_dim': 32, 'lr': 0.0010052204980965387, 'lambda_val': 1.0087756690558183e-06, 'batch_size': 592, 'optimizer': 'Adam'}. Best is trial 159 with value: 0.07162660798099917.
2026-05-18 18:20:36,888 - experiment_functions - INFO - Early stopping at epoch 2200. Best Recall: 0.0704
2026-05-18 18:20:37,022 - optuna.study.study - INFO - Trial 173 finished with value: 0.07035038795269842 and parameters: {'n_layers': 1, 'embedding_dim': 32, 'lr': 0.0009681247600597288, 'lambda_val': 1.0302115640973335e-06, 'batch_size': 581, 'optimizer': 'Adam'}. Best is trial 159 with value: 0.07162660798099917.
2026-05-18 18:21:12,072 - experiment_functions - INFO - Early stopping at epoch 2650. Best Recall: 0.0710
2026-05-18 18:21:12,162 - optuna.study.study - INFO - Trial 174 finished with value: 0.07099389179863477 and parameters: {'n_layers': 1, 'embedding_dim': 32, 'lr': 0.0009646345505742848, 'lambda_val': 1.05051608322843e-06, 'batch_size': 512, 'optimizer': 'Adam'}. Best is trial 159 with value: 0.07162660798099917.
2026-05-18 18:21:37,589 - experiment_functions - INFO - Early stopping at epoch 1900. Best Recall: 0.0711
2026-05-18 18:21:37,679 - optuna.study.study - INFO - Trial 175 finished with value: 0.07112151434515294 and parameters: {'n_layers': 1, 'embedding_dim': 32, 'lr': 0.0009724576412932193, 'lambda_val': 1.064688265544668e-06, 'batch_size': 521, 'optimizer': 'Adam'}. Best is trial 159 with value: 0.07162660798099917.
2026-05-18 18:21:50,401 - optuna.study._optimize - INFO - Trial 176 pruned. 
2026-05-18 18:22:10,643 - experiment_functions - INFO - Early stopping at epoch 1650. Best Recall: 0.0694
2026-05-18 18:22:10,734 - optuna.study.study - INFO - Trial 177 finished with value: 0.06944869800597214 and parameters: {'n_layers': 1, 'embedding_dim': 32, 'lr': 0.0011015801760845593, 'lambda_val': 1.2371453542445375e-06, 'batch_size': 563, 'optimizer': 'Adam'}. Best is trial 159 with value: 0.07162660798099917.
2026-05-18 18:22:24,516 - optuna.study._optimize - INFO - Trial 178 pruned. 
2026-05-18 18:22:44,423 - optuna.study._optimize - INFO - Trial 179 pruned. 
2026-05-18 18:22:58,116 - optuna.study._optimize - INFO - Trial 180 pruned. 
2026-05-18 18:23:11,851 - optuna.study._optimize - INFO - Trial 181 pruned. 
2026-05-18 18:23:25,875 - optuna.study._optimize - INFO - Trial 182 pruned. 
2026-05-18 18:23:46,913 - experiment_functions - INFO - Early stopping at epoch 1550. Best Recall: 0.0726
2026-05-18 18:23:47,005 - optuna.study.study - INFO - Trial 183 finished with value: 0.07263779126466675 and parameters: {'n_layers': 1, 'embedding_dim': 32, 'lr': 0.0012607533666335726, 'lambda_val': 1.3148499700977716e-06, 'batch_size': 518, 'optimizer': 'Adam'}. Best is trial 183 with value: 0.07263779126466675.
2026-05-18 18:23:59,789 - optuna.study._optimize - INFO - Trial 184 pruned. 
2026-05-18 18:24:14,387 - optuna.study._optimize - INFO - Trial 185 pruned. 
2026-05-18 18:24:43,420 - experiment_functions - INFO - Early stopping at epoch 2250. Best Recall: 0.0702
2026-05-18 18:24:43,518 - optuna.study.study - INFO - Trial 186 finished with value: 0.07019064559914313 and parameters: {'n_layers': 1, 'embedding_dim': 32, 'lr': 0.000900648073962664, 'lambda_val': 0.003108369548368504, 'batch_size': 572, 'optimizer': 'Adam'}. Best is trial 183 with value: 0.07263779126466675.
2026-05-18 18:25:06,225 - optuna.study._optimize - INFO - Trial 187 pruned. 
2026-05-18 18:25:13,043 - experiment_functions - INFO - Early stopping at epoch 500. Best Recall: 0.0058
2026-05-18 18:25:13,160 - optuna.study.study - INFO - Trial 188 finished with value: 0.0058387517395315025 and parameters: {'n_layers': 1, 'embedding_dim': 32, 'lr': 0.0009904162293961057, 'lambda_val': 0.0012948222606417518, 'batch_size': 576, 'optimizer': 'SGD'}. Best is trial 183 with value: 0.07263779126466675.
2026-05-18 18:25:20,162 - experiment_functions - INFO - Early stopping at epoch 500. Best Recall: 0.0053
2026-05-18 18:25:20,253 - optuna.study.study - INFO - Trial 189 finished with value: 0.005278775758879081 and parameters: {'n_layers': 1, 'embedding_dim': 32, 'lr': 0.0006764990256097418, 'lambda_val': 0.022132304048370754, 'batch_size': 670, 'optimizer': 'Adam'}. Best is trial 183 with value: 0.07263779126466675.
2026-05-18 18:25:33,398 - optuna.study._optimize - INFO - Trial 190 pruned. 
2026-05-18 18:25:47,204 - optuna.study._optimize - INFO - Trial 191 pruned. 
2026-05-18 18:26:08,505 - experiment_functions - INFO - Early stopping at epoch 1550. Best Recall: 0.0691
2026-05-18 18:26:08,593 - optuna.study.study - INFO - Trial 192 finished with value: 0.0691129522396843 and parameters: {'n_layers': 1, 'embedding_dim': 32, 'lr': 0.001091553064511935, 'lambda_val': 1.75232036852658e-06, 'batch_size': 625, 'optimizer': 'Adam'}. Best is trial 183 with value: 0.07263779126466675.
2026-05-18 18:26:33,570 - experiment_functions - INFO - Early stopping at epoch 1900. Best Recall: 0.0706
2026-05-18 18:26:33,689 - optuna.study.study - INFO - Trial 193 finished with value: 0.07058029854861646 and parameters: {'n_layers': 1, 'embedding_dim': 32, 'lr': 0.0010219318155963526, 'lambda_val': 0.0005710016342842856, 'batch_size': 586, 'optimizer': 'Adam'}. Best is trial 183 with value: 0.07263779126466675.
2026-05-18 18:26:47,137 - optuna.study._optimize - INFO - Trial 194 pruned. 
2026-05-18 18:27:02,535 - optuna.study._optimize - INFO - Trial 195 pruned. 
2026-05-18 18:27:15,657 - optuna.study._optimize - INFO - Trial 196 pruned. 
2026-05-18 18:27:27,603 - experiment_functions - INFO - Early stopping at epoch 800. Best Recall: 0.0483
2026-05-18 18:27:27,704 - optuna.study.study - INFO - Trial 197 finished with value: 0.048264481013888284 and parameters: {'n_layers': 3, 'embedding_dim': 32, 'lr': 0.0010390609618439654, 'lambda_val': 1.9438403178350694e-06, 'batch_size': 587, 'optimizer': 'Adam'}. Best is trial 183 with value: 0.07263779126466675.
2026-05-18 18:27:45,462 - experiment_functions - INFO - Early stopping at epoch 1300. Best Recall: 0.0670
2026-05-18 18:27:45,607 - optuna.study.study - INFO - Trial 198 finished with value: 0.06699223366466574 and parameters: {'n_layers': 1, 'embedding_dim': 32, 'lr': 0.001407461628867134, 'lambda_val': 0.0005224785830659495, 'batch_size': 515, 'optimizer': 'Adam'}. Best is trial 183 with value: 0.07263779126466675.
2026-05-18 18:27:52,580 - experiment_functions - INFO - Early stopping at epoch 500. Best Recall: 0.0052
2026-05-18 18:27:52,695 - optuna.study.study - INFO - Trial 199 finished with value: 0.005226156939064419 and parameters: {'n_layers': 1, 'embedding_dim': 32, 'lr': 0.0007048503312169882, 'lambda_val': 0.09383478366926479, 'batch_size': 696, 'optimizer': 'Adam'}. Best is trial 183 with value: 0.07263779126466675.
2026-05-18 18:28:06,981 - optuna.study._optimize - INFO - Trial 200 pruned. 
2026-05-18 18:28:25,791 - experiment_functions - INFO - Early stopping at epoch 1400. Best Recall: 0.0696
2026-05-18 18:28:25,939 - optuna.study.study - INFO - Trial 201 finished with value: 0.06960156660794098 and parameters: {'n_layers': 1, 'embedding_dim': 32, 'lr': 0.0011705323696718213, 'lambda_val': 1.0328360513289189e-06, 'batch_size': 627, 'optimizer': 'Adam'}. Best is trial 183 with value: 0.07263779126466675.
2026-05-18 18:28:38,655 - experiment_functions - INFO - Early stopping at epoch 900. Best Recall: 0.0602
2026-05-18 18:28:38,745 - optuna.study.study - INFO - Trial 202 finished with value: 0.060182134271401136 and parameters: {'n_layers': 1, 'embedding_dim': 32, 'lr': 0.001118746435282931, 'lambda_val': 1.6878543032856298e-06, 'batch_size': 3002, 'optimizer': 'Adam'}. Best is trial 183 with value: 0.07263779126466675.
2026-05-18 18:28:56,706 - experiment_functions - INFO - Early stopping at epoch 1300. Best Recall: 0.0684
2026-05-18 18:28:56,805 - optuna.study.study - INFO - Trial 203 finished with value: 0.06844808761205662 and parameters: {'n_layers': 1, 'embedding_dim': 32, 'lr': 0.0012698764513904687, 'lambda_val': 1.0016662675170075e-06, 'batch_size': 588, 'optimizer': 'Adam'}. Best is trial 183 with value: 0.07263779126466675.
2026-05-18 18:29:12,434 - experiment_functions - INFO - Early stopping at epoch 1150. Best Recall: 0.0685
2026-05-18 18:29:12,524 - optuna.study.study - INFO - Trial 204 finished with value: 0.06848176355129804 and parameters: {'n_layers': 1, 'embedding_dim': 32, 'lr': 0.001363146832993293, 'lambda_val': 1.0334744302783625e-06, 'batch_size': 739, 'optimizer': 'Adam'}. Best is trial 183 with value: 0.07263779126466675.
2026-05-18 18:29:27,836 - experiment_functions - INFO - Early stopping at epoch 1050. Best Recall: 0.0656
2026-05-18 18:29:28,004 - optuna.study.study - INFO - Trial 205 finished with value: 0.06563699629256059 and parameters: {'n_layers': 1, 'embedding_dim': 32, 'lr': 0.0015273498782956544, 'lambda_val': 1.224842566188718e-06, 'batch_size': 701, 'optimizer': 'Adam'}. Best is trial 183 with value: 0.07263779126466675.
2026-05-18 18:29:48,142 - experiment_functions - INFO - Early stopping at epoch 1300. Best Recall: 0.0691
2026-05-18 18:29:48,243 - optuna.study.study - INFO - Trial 206 finished with value: 0.06911214690352306 and parameters: {'n_layers': 1, 'embedding_dim': 32, 'lr': 0.0013112909618524403, 'lambda_val': 1.0283913935087e-06, 'batch_size': 602, 'optimizer': 'Adam'}. Best is trial 183 with value: 0.07263779126466675.
2026-05-18 18:30:08,971 - optuna.study._optimize - INFO - Trial 207 pruned. 
2026-05-18 18:30:27,993 - optuna.study._optimize - INFO - Trial 208 pruned. 
2026-05-18 18:30:47,327 - experiment_functions - INFO - Early stopping at epoch 950. Best Recall: 0.0640
2026-05-18 18:30:47,480 - optuna.study.study - INFO - Trial 209 finished with value: 0.06404551944360608 and parameters: {'n_layers': 1, 'embedding_dim': 32, 'lr': 0.0018819121660892477, 'lambda_val': 1.0149776484020912e-06, 'batch_size': 654, 'optimizer': 'Adam'}. Best is trial 183 with value: 0.07263779126466675.
2026-05-18 18:31:04,759 - experiment_functions - INFO - Early stopping at epoch 1100. Best Recall: 0.0656
2026-05-18 18:31:04,848 - optuna.study.study - INFO - Trial 210 finished with value: 0.06564178750763962 and parameters: {'n_layers': 1, 'embedding_dim': 32, 'lr': 0.0014953253427124724, 'lambda_val': 1.2339309001192915e-06, 'batch_size': 595, 'optimizer': 'Adam'}. Best is trial 183 with value: 0.07263779126466675.
2026-05-18 18:31:23,172 - experiment_functions - INFO - Early stopping at epoch 1350. Best Recall: 0.0669
2026-05-18 18:31:23,262 - optuna.study.study - INFO - Trial 211 finished with value: 0.06694110064986328 and parameters: {'n_layers': 1, 'embedding_dim': 32, 'lr': 0.0012200040356046896, 'lambda_val': 1.4685418433286402e-06, 'batch_size': 652, 'optimizer': 'Adam'}. Best is trial 183 with value: 0.07263779126466675.
2026-05-18 18:31:36,643 - experiment_functions - INFO - Early stopping at epoch 950. Best Recall: 0.0550
2026-05-18 18:31:36,787 - optuna.study.study - INFO - Trial 212 finished with value: 0.05499147083414933 and parameters: {'n_layers': 1, 'embedding_dim': 32, 'lr': 0.0008768958052061088, 'lambda_val': 1.013502661169034e-06, 'batch_size': 3513, 'optimizer': 'Adam'}. Best is trial 183 with value: 0.07263779126466675.
2026-05-18 18:32:04,255 - experiment_functions - INFO - Early stopping at epoch 2000. Best Recall: 0.0703
2026-05-18 18:32:04,344 - optuna.study.study - INFO - Trial 213 finished with value: 0.07026117174214692 and parameters: {'n_layers': 1, 'embedding_dim': 32, 'lr': 0.0010956828203302113, 'lambda_val': 1.4872203106044375e-06, 'batch_size': 591, 'optimizer': 'Adam'}. Best is trial 183 with value: 0.07263779126466675.
2026-05-18 18:32:25,841 - optuna.study._optimize - INFO - Trial 214 pruned. 
2026-05-18 18:32:48,406 - optuna.study._optimize - INFO - Trial 215 pruned. 
2026-05-18 18:33:03,956 - optuna.study._optimize - INFO - Trial 216 pruned. 
2026-05-18 18:33:17,515 - experiment_functions - INFO - Early stopping at epoch 900. Best Recall: 0.0676
2026-05-18 18:33:17,606 - optuna.study.study - INFO - Trial 217 finished with value: 0.06763449465166158 and parameters: {'n_layers': 1, 'embedding_dim': 32, 'lr': 0.00168430717742291, 'lambda_val': 1.9563452056212044e-06, 'batch_size': 822, 'optimizer': 'Adam'}. Best is trial 183 with value: 0.07263779126466675.
2026-05-18 18:33:35,415 - experiment_functions - INFO - Early stopping at epoch 1300. Best Recall: 0.0699
2026-05-18 18:33:35,494 - optuna.study.study - INFO - Trial 218 finished with value: 0.0699205392821978 and parameters: {'n_layers': 1, 'embedding_dim': 32, 'lr': 0.000999771084840548, 'lambda_val': 0.009006818937604067, 'batch_size': 668, 'optimizer': 'Adam'}. Best is trial 183 with value: 0.07263779126466675.
2026-05-18 18:33:55,227 - optuna.study._optimize - INFO - Trial 219 pruned. 
2026-05-18 18:34:12,975 - optuna.study._optimize - INFO - Trial 220 pruned. 
2026-05-18 18:34:26,933 - experiment_functions - INFO - Early stopping at epoch 900. Best Recall: 0.0607
2026-05-18 18:34:27,002 - optuna.study.study - INFO - Trial 221 finished with value: 0.06074238817937822 and parameters: {'n_layers': 1, 'embedding_dim': 32, 'lr': 0.0012577355486691388, 'lambda_val': 0.03179999654654774, 'batch_size': 756, 'optimizer': 'Adam'}. Best is trial 183 with value: 0.07263779126466675.
2026-05-18 18:34:40,596 - optuna.study._optimize - INFO - Trial 222 pruned. 
2026-05-18 18:35:03,701 - optuna.study._optimize - INFO - Trial 223 pruned. 
2026-05-18 18:35:18,027 - optuna.study._optimize - INFO - Trial 224 pruned. 
2026-05-18 18:35:24,843 - experiment_functions - INFO - Early stopping at epoch 500. Best Recall: 0.0057
2026-05-18 18:35:24,966 - optuna.study.study - INFO - Trial 225 finished with value: 0.00569726909573914 and parameters: {'n_layers': 1, 'embedding_dim': 32, 'lr': 0.0008609947196902706, 'lambda_val': 1.6045016348128664e-06, 'batch_size': 627, 'optimizer': 'SGD'}. Best is trial 183 with value: 0.07263779126466675.
2026-05-18 18:35:42,281 - experiment_functions - INFO - Early stopping at epoch 1150. Best Recall: 0.0723
2026-05-18 18:35:42,368 - optuna.study.study - INFO - Trial 226 finished with value: 0.07225886133421786 and parameters: {'n_layers': 1, 'embedding_dim': 32, 'lr': 0.0014546724273183113, 'lambda_val': 9.450835041311843e-05, 'batch_size': 516, 'optimizer': 'Adam'}. Best is trial 183 with value: 0.07263779126466675.
2026-05-18 18:35:55,501 - experiment_functions - INFO - Early stopping at epoch 950. Best Recall: 0.0651
2026-05-18 18:35:55,590 - optuna.study.study - INFO - Trial 227 finished with value: 0.06507896021243255 and parameters: {'n_layers': 1, 'embedding_dim': 32, 'lr': 0.0015486426776098667, 'lambda_val': 0.014228966048521752, 'batch_size': 514, 'optimizer': 'Adam'}. Best is trial 183 with value: 0.07263779126466675.
2026-05-18 18:36:11,338 - experiment_functions - INFO - Early stopping at epoch 1150. Best Recall: 0.0707
2026-05-18 18:36:11,450 - optuna.study.study - INFO - Trial 228 finished with value: 0.07067485248540133 and parameters: {'n_layers': 1, 'embedding_dim': 32, 'lr': 0.001372926824986836, 'lambda_val': 1.2548339046420916e-06, 'batch_size': 599, 'optimizer': 'Adam'}. Best is trial 183 with value: 0.07263779126466675.
2026-05-18 18:36:31,859 - experiment_functions - INFO - Early stopping at epoch 900. Best Recall: 0.0605
2026-05-18 18:36:32,625 - optuna.study.study - INFO - Trial 229 finished with value: 0.06051098346755211 and parameters: {'n_layers': 1, 'embedding_dim': 32, 'lr': 0.0020057104600472555, 'lambda_val': 0.003184199299653456, 'batch_size': 571, 'optimizer': 'Adam'}. Best is trial 183 with value: 0.07263779126466675.
2026-05-18 18:36:48,267 - experiment_functions - INFO - Early stopping at epoch 950. Best Recall: 0.0641
2026-05-18 18:36:48,368 - optuna.study.study - INFO - Trial 230 finished with value: 0.06410243321462368 and parameters: {'n_layers': 1, 'embedding_dim': 32, 'lr': 0.0016569088515152868, 'lambda_val': 2.4198398946295007e-06, 'batch_size': 661, 'optimizer': 'Adam'}. Best is trial 183 with value: 0.07263779126466675.
2026-05-18 18:37:06,688 - optuna.study._optimize - INFO - Trial 231 pruned. 
2026-05-18 18:37:20,915 - optuna.study._optimize - INFO - Trial 232 pruned. 
2026-05-18 18:37:45,193 - experiment_functions - INFO - Early stopping at epoch 1100. Best Recall: 0.0674
2026-05-18 18:37:45,290 - optuna.study.study - INFO - Trial 233 finished with value: 0.06735550807292433 and parameters: {'n_layers': 1, 'embedding_dim': 32, 'lr': 0.001394453998491054, 'lambda_val': 1.1826512799390606e-06, 'batch_size': 515, 'optimizer': 'Adam'}. Best is trial 183 with value: 0.07263779126466675.
2026-05-18 18:38:01,116 - optuna.study._optimize - INFO - Trial 234 pruned. 
2026-05-18 18:38:17,309 - experiment_functions - INFO - Early stopping at epoch 1150. Best Recall: 0.0692
2026-05-18 18:38:17,398 - optuna.study.study - INFO - Trial 235 finished with value: 0.06923523381061357 and parameters: {'n_layers': 1, 'embedding_dim': 32, 'lr': 0.0013360055306908937, 'lambda_val': 0.0006733065408937725, 'batch_size': 624, 'optimizer': 'Adam'}. Best is trial 183 with value: 0.07263779126466675.
2026-05-18 18:38:30,820 - experiment_functions - INFO - Early stopping at epoch 950. Best Recall: 0.0640
2026-05-18 18:38:30,918 - optuna.study.study - INFO - Trial 236 finished with value: 0.06404952165504775 and parameters: {'n_layers': 1, 'embedding_dim': 32, 'lr': 0.0016921931245678424, 'lambda_val': 0.0005006797714298587, 'batch_size': 709, 'optimizer': 'Adam'}. Best is trial 183 with value: 0.07263779126466675.
2026-05-18 18:38:58,728 - experiment_functions - INFO - Early stopping at epoch 2000. Best Recall: 0.0713
2026-05-18 18:38:58,881 - optuna.study.study - INFO - Trial 237 finished with value: 0.07133746449731782 and parameters: {'n_layers': 1, 'embedding_dim': 32, 'lr': 0.0009100342830814528, 'lambda_val': 0.0008653371279687472, 'batch_size': 631, 'optimizer': 'Adam'}. Best is trial 183 with value: 0.07263779126466675.
2026-05-18 18:39:13,746 - optuna.study._optimize - INFO - Trial 238 pruned. 
2026-05-18 18:39:38,893 - experiment_functions - INFO - Early stopping at epoch 1850. Best Recall: 0.0711
