2026-05-18 05:33:47,655 - optuna.study.study - INFO - Trial 26 finished with value: 0.04621481492511444 and parameters: {'n_layers': 2, 'embedding_dim': 32, 'lr': 0.003997722470762195, 'lambda_val': 0.00029397253599959105, 'batch_size': 1595, 'optimizer': 'Adam'}. Best is trial 19 with value: 0.06020028666994786.
2026-05-18 05:33:56,034 - experiment_functions - INFO - Early stopping at epoch 550. Best Recall: 0.0129
2026-05-18 05:33:56,134 - optuna.study.study - INFO - Trial 27 finished with value: 0.012897812913449542 and parameters: {'n_layers': 1, 'embedding_dim': 96, 'lr': 0.0679267207314501, 'lambda_val': 3.524577677366682e-05, 'batch_size': 689, 'optimizer': 'Adam'}. Best is trial 19 with value: 0.06020028666994786.
2026-05-18 05:34:10,265 - experiment_functions - INFO - Early stopping at epoch 950. Best Recall: 0.0208
2026-05-18 05:34:10,389 - optuna.study.study - INFO - Trial 28 finished with value: 0.020805746324632064 and parameters: {'n_layers': 2, 'embedding_dim': 96, 'lr': 0.025058779163733114, 'lambda_val': 1.1484739233787536e-05, 'batch_size': 1868, 'optimizer': 'Adam'}. Best is trial 19 with value: 0.06020028666994786.
2026-05-18 05:34:18,775 - experiment_functions - INFO - Early stopping at epoch 500. Best Recall: 0.0047
2026-05-18 05:34:18,896 - optuna.study.study - INFO - Trial 29 finished with value: 0.004687617356842325 and parameters: {'n_layers': 1, 'embedding_dim': 128, 'lr': 0.00021846461784240595, 'lambda_val': 0.00025418700133065646, 'batch_size': 1445, 'optimizer': 'SGD'}. Best is trial 19 with value: 0.06020028666994786.
2026-05-18 05:34:28,403 - experiment_functions - INFO - Early stopping at epoch 600. Best Recall: 0.0505
2026-05-18 05:34:28,557 - optuna.study.study - INFO - Trial 30 finished with value: 0.05054591675070734 and parameters: {'n_layers': 1, 'embedding_dim': 96, 'lr': 0.006281894877945737, 'lambda_val': 0.0031381682080560114, 'batch_size': 889, 'optimizer': 'Adam'}. Best is trial 19 with value: 0.06020028666994786.
2026-05-18 05:34:38,945 - experiment_functions - INFO - Early stopping at epoch 650. Best Recall: 0.0580
2026-05-18 05:34:39,109 - optuna.study.study - INFO - Trial 31 finished with value: 0.058049432674059286 and parameters: {'n_layers': 1, 'embedding_dim': 96, 'lr': 0.0028160485396360097, 'lambda_val': 7.714272873891998e-06, 'batch_size': 1781, 'optimizer': 'Adam'}. Best is trial 19 with value: 0.06020028666994786.
2026-05-18 05:34:51,552 - experiment_functions - INFO - Early stopping at epoch 750. Best Recall: 0.0555
2026-05-18 05:34:51,715 - optuna.study.study - INFO - Trial 32 finished with value: 0.055529769111078306 and parameters: {'n_layers': 1, 'embedding_dim': 96, 'lr': 0.0014758428299219523, 'lambda_val': 4.372094652402027e-06, 'batch_size': 1842, 'optimizer': 'Adam'}. Best is trial 19 with value: 0.06020028666994786.
2026-05-18 05:35:01,458 - experiment_functions - INFO - Early stopping at epoch 600. Best Recall: 0.0587
2026-05-18 05:35:01,547 - optuna.study.study - INFO - Trial 33 finished with value: 0.05869049768019393 and parameters: {'n_layers': 1, 'embedding_dim': 96, 'lr': 0.00358936444223784, 'lambda_val': 1.0745623536718229e-06, 'batch_size': 2164, 'optimizer': 'Adam'}. Best is trial 19 with value: 0.06020028666994786.
2026-05-18 05:35:34,032 - experiment_functions - INFO - Early stopping at epoch 2100. Best Recall: 0.0546
2026-05-18 05:35:34,180 - optuna.study.study - INFO - Trial 34 finished with value: 0.05457867121115599 and parameters: {'n_layers': 1, 'embedding_dim': 32, 'lr': 0.0005037514229749051, 'lambda_val': 1.2943147992053983e-06, 'batch_size': 2476, 'optimizer': 'Adam'}. Best is trial 19 with value: 0.06020028666994786.
2026-05-18 05:35:43,444 - experiment_functions - INFO - Early stopping at epoch 550. Best Recall: 0.0495
2026-05-18 05:35:43,578 - optuna.study.study - INFO - Trial 35 finished with value: 0.049495067989643635 and parameters: {'n_layers': 2, 'embedding_dim': 96, 'lr': 0.005284354095713442, 'lambda_val': 0.00012915078534796772, 'batch_size': 2772, 'optimizer': 'Adam'}. Best is trial 19 with value: 0.06020028666994786.
2026-05-18 05:35:51,359 - experiment_functions - INFO - Early stopping at epoch 500. Best Recall: 0.0052
2026-05-18 05:35:51,450 - optuna.study.study - INFO - Trial 36 finished with value: 0.005228925632184477 and parameters: {'n_layers': 1, 'embedding_dim': 256, 'lr': 0.014294371459656577, 'lambda_val': 1.714577053907361e-05, 'batch_size': 2132, 'optimizer': 'SGD'}. Best is trial 19 with value: 0.06020028666994786.
2026-05-18 05:36:00,373 - experiment_functions - INFO - Early stopping at epoch 550. Best Recall: 0.0402
2026-05-18 05:36:00,474 - optuna.study.study - INFO - Trial 37 finished with value: 0.04023909123701417 and parameters: {'n_layers': 3, 'embedding_dim': 96, 'lr': 0.0032950287547327856, 'lambda_val': 5.1640374204071084e-05, 'batch_size': 1149, 'optimizer': 'Adam'}. Best is trial 19 with value: 0.06020028666994786.
2026-05-18 05:36:17,127 - experiment_functions - INFO - Early stopping at epoch 1050. Best Recall: 0.0279
2026-05-18 05:36:17,238 - optuna.study.study - INFO - Trial 38 finished with value: 0.02789608744146552 and parameters: {'n_layers': 2, 'embedding_dim': 128, 'lr': 0.008385809966093463, 'lambda_val': 1.0099488622056e-06, 'batch_size': 1996, 'optimizer': 'Adam'}. Best is trial 19 with value: 0.06020028666994786.
2026-05-18 05:36:24,659 - experiment_functions - INFO - Early stopping at epoch 500. Best Recall: 0.0046
2026-05-18 05:36:24,750 - optuna.study.study - INFO - Trial 39 finished with value: 0.004585891362816471 and parameters: {'n_layers': 1, 'embedding_dim': 96, 'lr': 0.001206746338218787, 'lambda_val': 0.0001374948258519755, 'batch_size': 1340, 'optimizer': 'SGD'}. Best is trial 19 with value: 0.06020028666994786.
2026-05-18 05:37:02,154 - experiment_functions - INFO - Early stopping at epoch 2050. Best Recall: 0.0621
2026-05-18 05:37:02,248 - optuna.study.study - INFO - Trial 40 finished with value: 0.06208642032966096 and parameters: {'n_layers': 1, 'embedding_dim': 96, 'lr': 0.0004798074935926387, 'lambda_val': 0.0024074268674295018, 'batch_size': 1508, 'optimizer': 'Adam'}. Best is trial 40 with value: 0.06208642032966096.
2026-05-18 05:37:10,801 - experiment_functions - INFO - Early stopping at epoch 550. Best Recall: 0.0052
2026-05-18 05:37:10,948 - optuna.study.study - INFO - Trial 41 finished with value: 0.005198903702193891 and parameters: {'n_layers': 1, 'embedding_dim': 96, 'lr': 4.3459254047456735e-05, 'lambda_val': 0.00294001851786735, 'batch_size': 1506, 'optimizer': 'Adam'}. Best is trial 40 with value: 0.06208642032966096.
2026-05-18 05:37:40,262 - experiment_functions - INFO - Early stopping at epoch 2100. Best Recall: 0.0645
2026-05-18 05:37:40,364 - optuna.study.study - INFO - Trial 42 finished with value: 0.06454376417037642 and parameters: {'n_layers': 1, 'embedding_dim': 96, 'lr': 0.00048241945845932903, 'lambda_val': 0.004960418668971793, 'batch_size': 1313, 'optimizer': 'Adam'}. Best is trial 42 with value: 0.06454376417037642.
2026-05-18 05:38:14,394 - experiment_functions - INFO - Early stopping at epoch 2350. Best Recall: 0.0625
2026-05-18 05:38:14,505 - optuna.study.study - INFO - Trial 43 finished with value: 0.06246562397729698 and parameters: {'n_layers': 1, 'embedding_dim': 96, 'lr': 0.00044136056620807366, 'lambda_val': 0.006070201653876822, 'batch_size': 1298, 'optimizer': 'Adam'}. Best is trial 42 with value: 0.06454376417037642.
2026-05-18 05:38:22,173 - experiment_functions - INFO - Early stopping at epoch 500. Best Recall: 0.0049
2026-05-18 05:38:22,274 - optuna.study.study - INFO - Trial 44 finished with value: 0.004933939054460203 and parameters: {'n_layers': 1, 'embedding_dim': 96, 'lr': 0.00013412116106333613, 'lambda_val': 0.007151297312400111, 'batch_size': 931, 'optimizer': 'Adam'}. Best is trial 42 with value: 0.06454376417037642.
2026-05-18 05:38:42,084 - experiment_functions - INFO - Early stopping at epoch 1150. Best Recall: 0.0431
2026-05-18 05:38:42,194 - optuna.study.study - INFO - Trial 45 finished with value: 0.04305849846539418 and parameters: {'n_layers': 2, 'embedding_dim': 256, 'lr': 0.00037908580302459407, 'lambda_val': 0.03385003675142362, 'batch_size': 1303, 'optimizer': 'Adam'}. Best is trial 42 with value: 0.06454376417037642.
2026-05-18 05:38:50,116 - experiment_functions - INFO - Early stopping at epoch 500. Best Recall: 0.0055
2026-05-18 05:38:50,208 - optuna.study.study - INFO - Trial 46 finished with value: 0.00548539574078504 and parameters: {'n_layers': 2, 'embedding_dim': 128, 'lr': 4.120387156130422e-05, 'lambda_val': 0.006709535927587817, 'batch_size': 1493, 'optimizer': 'SGD'}. Best is trial 42 with value: 0.06454376417037642.
2026-05-18 05:39:19,589 - experiment_functions - INFO - Early stopping at epoch 1450. Best Recall: 0.0627
2026-05-18 05:39:19,689 - optuna.study.study - INFO - Trial 47 finished with value: 0.06265670188013724 and parameters: {'n_layers': 1, 'embedding_dim': 64, 'lr': 0.000607189582267205, 'lambda_val': 0.016932715668503483, 'batch_size': 1242, 'optimizer': 'Adam'}. Best is trial 42 with value: 0.06454376417037642.
2026-05-18 05:39:32,497 - experiment_functions - INFO - Early stopping at epoch 800. Best Recall: 0.0370
2026-05-18 05:39:32,641 - optuna.study.study - INFO - Trial 48 finished with value: 0.03700430578465149 and parameters: {'n_layers': 3, 'embedding_dim': 64, 'lr': 0.0006541867958338008, 'lambda_val': 0.022739545604502334, 'batch_size': 794, 'optimizer': 'Adam'}. Best is trial 42 with value: 0.06454376417037642.
2026-05-18 05:39:40,253 - experiment_functions - INFO - Early stopping at epoch 500. Best Recall: 0.0047
2026-05-18 05:39:40,352 - optuna.study.study - INFO - Trial 49 finished with value: 0.0047327547431315975 and parameters: {'n_layers': 1, 'embedding_dim': 64, 'lr': 0.00025337662417998714, 'lambda_val': 0.050001546490379904, 'batch_size': 1196, 'optimizer': 'RMSprop'}. Best is trial 42 with value: 0.06454376417037642.
2026-05-18 05:39:49,112 - experiment_functions - INFO - Early stopping at epoch 550. Best Recall: 0.0055
2026-05-18 05:39:49,264 - optuna.study.study - INFO - Trial 50 finished with value: 0.005480295578864779 and parameters: {'n_layers': 2, 'embedding_dim': 64, 'lr': 9.358566970275296e-05, 'lambda_val': 0.0017881883547799522, 'batch_size': 1121, 'optimizer': 'Adam'}. Best is trial 42 with value: 0.06454376417037642.
2026-05-18 05:39:56,842 - experiment_functions - INFO - Early stopping at epoch 500. Best Recall: 0.0055
2026-05-18 05:39:56,941 - optuna.study.study - INFO - Trial 51 finished with value: 0.005516767671101979 and parameters: {'n_layers': 1, 'embedding_dim': 64, 'lr': 0.00046257529458903655, 'lambda_val': 0.014258881830483938, 'batch_size': 1265, 'optimizer': 'Adam'}. Best is trial 42 with value: 0.06454376417037642.
2026-05-18 05:40:19,856 - experiment_functions - INFO - Early stopping at epoch 1600. Best Recall: 0.0648
2026-05-18 05:40:19,958 - optuna.study.study - INFO - Trial 52 finished with value: 0.0648288855967413 and parameters: {'n_layers': 1, 'embedding_dim': 32, 'lr': 0.0007521261772732105, 'lambda_val': 0.005406231321588044, 'batch_size': 1034, 'optimizer': 'Adam'}. Best is trial 52 with value: 0.0648288855967413.
2026-05-18 05:40:30,601 - experiment_functions - INFO - Early stopping at epoch 500. Best Recall: 0.0053
2026-05-18 05:40:31,374 - optuna.study.study - INFO - Trial 53 finished with value: 0.005282238100033716 and parameters: {'n_layers': 1, 'embedding_dim': 32, 'lr': 0.0001540031133356615, 'lambda_val': 0.006521055634319847, 'batch_size': 970, 'optimizer': 'Adam'}. Best is trial 52 with value: 0.0648288855967413.
2026-05-18 05:41:07,956 - experiment_functions - INFO - Early stopping at epoch 1700. Best Recall: 0.0673
2026-05-18 05:41:09,406 - optuna.study.study - INFO - Trial 54 finished with value: 0.06732468725592715 and parameters: {'n_layers': 1, 'embedding_dim': 32, 'lr': 0.0006510877820920573, 'lambda_val': 0.004219708764722793, 'batch_size': 1380, 'optimizer': 'Adam'}. Best is trial 54 with value: 0.06732468725592715.
2026-05-18 05:41:50,399 - experiment_functions - INFO - Early stopping at epoch 1850. Best Recall: 0.0587
2026-05-18 05:41:50,489 - optuna.study.study - INFO - Trial 55 finished with value: 0.058700281602916404 and parameters: {'n_layers': 1, 'embedding_dim': 32, 'lr': 0.0006071964171342659, 'lambda_val': 0.004347325251130166, 'batch_size': 1413, 'optimizer': 'Adam'}. Best is trial 54 with value: 0.06732468725592715.
2026-05-18 05:42:04,406 - optuna.study._optimize - INFO - Trial 56 pruned. 
2026-05-18 05:42:28,795 - experiment_functions - INFO - Early stopping at epoch 1300. Best Recall: 0.0683
2026-05-18 05:42:28,915 - optuna.study.study - INFO - Trial 57 finished with value: 0.06827998896428639 and parameters: {'n_layers': 1, 'embedding_dim': 32, 'lr': 0.000893631202241058, 'lambda_val': 0.011998960102840765, 'batch_size': 757, 'optimizer': 'Adam'}. Best is trial 57 with value: 0.06827998896428639.
2026-05-18 05:42:49,517 - experiment_functions - INFO - Early stopping at epoch 1450. Best Recall: 0.0654
2026-05-18 05:42:49,652 - optuna.study.study - INFO - Trial 58 finished with value: 0.06539311128869842 and parameters: {'n_layers': 1, 'embedding_dim': 32, 'lr': 0.0008933766987148094, 'lambda_val': 0.011722451097806216, 'batch_size': 750, 'optimizer': 'Adam'}. Best is trial 57 with value: 0.06827998896428639.
2026-05-18 05:43:06,858 - experiment_functions - INFO - Early stopping at epoch 1200. Best Recall: 0.0676
2026-05-18 05:43:06,948 - optuna.study.study - INFO - Trial 59 finished with value: 0.06760420183347576 and parameters: {'n_layers': 1, 'embedding_dim': 32, 'lr': 0.0010028885601439295, 'lambda_val': 0.01147047616947517, 'batch_size': 747, 'optimizer': 'Adam'}. Best is trial 57 with value: 0.06827998896428639.
2026-05-18 05:43:14,475 - experiment_functions - INFO - Early stopping at epoch 500. Best Recall: 0.0054
2026-05-18 05:43:14,554 - optuna.study.study - INFO - Trial 60 finished with value: 0.005417809004551221 and parameters: {'n_layers': 4, 'embedding_dim': 32, 'lr': 0.0009178648258769582, 'lambda_val': 0.009517900710438652, 'batch_size': 738, 'optimizer': 'SGD'}. Best is trial 57 with value: 0.06827998896428639.
2026-05-18 05:43:26,971 - experiment_functions - INFO - Early stopping at epoch 850. Best Recall: 0.0655
2026-05-18 05:43:27,061 - optuna.study.study - INFO - Trial 61 finished with value: 0.06545363102924891 and parameters: {'n_layers': 1, 'embedding_dim': 32, 'lr': 0.0016866747520071152, 'lambda_val': 0.01845054443807693, 'batch_size': 573, 'optimizer': 'Adam'}. Best is trial 57 with value: 0.06827998896428639.
2026-05-18 05:43:39,741 - experiment_functions - INFO - Early stopping at epoch 850. Best Recall: 0.0628
2026-05-18 05:43:39,831 - optuna.study.study - INFO - Trial 62 finished with value: 0.0627924422775254 and parameters: {'n_layers': 1, 'embedding_dim': 32, 'lr': 0.0016548035556707577, 'lambda_val': 0.02711753368830639, 'batch_size': 562, 'optimizer': 'Adam'}. Best is trial 57 with value: 0.06827998896428639.
2026-05-18 05:43:54,081 - experiment_functions - INFO - Early stopping at epoch 1000. Best Recall: 0.0553
2026-05-18 05:43:54,175 - optuna.study.study - INFO - Trial 63 finished with value: 0.05532081323773365 and parameters: {'n_layers': 1, 'embedding_dim': 32, 'lr': 0.0010987470885214724, 'lambda_val': 0.0561684338635449, 'batch_size': 839, 'optimizer': 'Adam'}. Best is trial 57 with value: 0.06827998896428639.
2026-05-18 05:44:11,172 - experiment_functions - INFO - Early stopping at epoch 1200. Best Recall: 0.0650
2026-05-18 05:44:11,309 - optuna.study.study - INFO - Trial 64 finished with value: 0.06499310398491352 and parameters: {'n_layers': 1, 'embedding_dim': 32, 'lr': 0.0007811001035271964, 'lambda_val': 0.013217089906281676, 'batch_size': 1035, 'optimizer': 'Adam'}. Best is trial 57 with value: 0.06827998896428639.
2026-05-18 05:44:29,497 - experiment_functions - INFO - Early stopping at epoch 1250. Best Recall: 0.0650
2026-05-18 05:44:29,587 - optuna.study.study - INFO - Trial 65 finished with value: 0.0649971903403558 and parameters: {'n_layers': 1, 'embedding_dim': 32, 'lr': 0.0008651493690527337, 'lambda_val': 0.010994788998143714, 'batch_size': 1015, 'optimizer': 'Adam'}. Best is trial 57 with value: 0.06827998896428639.
2026-05-18 05:44:41,767 - experiment_functions - INFO - Early stopping at epoch 850. Best Recall: 0.0670
2026-05-18 05:44:41,858 - optuna.study.study - INFO - Trial 66 finished with value: 0.06696145632726516 and parameters: {'n_layers': 1, 'embedding_dim': 32, 'lr': 0.0018506869553589884, 'lambda_val': 0.010967967594479386, 'batch_size': 612, 'optimizer': 'Adam'}. Best is trial 57 with value: 0.06827998896428639.
2026-05-18 05:44:51,731 - experiment_functions - INFO - Early stopping at epoch 650. Best Recall: 0.0587
2026-05-18 05:44:52,389 - optuna.study.study - INFO - Trial 67 finished with value: 0.058716997681871184 and parameters: {'n_layers': 1, 'embedding_dim': 32, 'lr': 0.0019980015866643917, 'lambda_val': 0.010075305837490308, 'batch_size': 658, 'optimizer': 'RMSprop'}. Best is trial 57 with value: 0.06827998896428639.
2026-05-18 05:45:03,531 - experiment_functions - INFO - Early stopping at epoch 750. Best Recall: 0.0522
2026-05-18 05:45:03,679 - optuna.study.study - INFO - Trial 68 finished with value: 0.05222112679365536 and parameters: {'n_layers': 2, 'embedding_dim': 32, 'lr': 0.0013507168025778656, 'lambda_val': 0.03687618053973316, 'batch_size': 522, 'optimizer': 'Adam'}. Best is trial 57 with value: 0.06827998896428639.
2026-05-18 05:45:20,587 - experiment_functions - INFO - Early stopping at epoch 1200. Best Recall: 0.0667
2026-05-18 05:45:20,677 - optuna.study.study - INFO - Trial 69 finished with value: 0.06670800482561083 and parameters: {'n_layers': 1, 'embedding_dim': 32, 'lr': 0.0010447274138839586, 'lambda_val': 0.009471403868179849, 'batch_size': 747, 'optimizer': 'Adam'}. Best is trial 57 with value: 0.06827998896428639.
2026-05-18 05:45:28,148 - experiment_functions - INFO - Early stopping at epoch 500. Best Recall: 0.0060
2026-05-18 05:45:28,247 - optuna.study.study - INFO - Trial 70 finished with value: 0.00600809478421068 and parameters: {'n_layers': 1, 'embedding_dim': 32, 'lr': 0.001014676207537937, 'lambda_val': 0.08371365640968759, 'batch_size': 740, 'optimizer': 'Adam'}. Best is trial 57 with value: 0.06827998896428639.
2026-05-18 05:45:40,660 - experiment_functions - INFO - Early stopping at epoch 800. Best Recall: 0.0608
2026-05-18 05:45:40,751 - optuna.study.study - INFO - Trial 71 finished with value: 0.060849747938277896 and parameters: {'n_layers': 1, 'embedding_dim': 32, 'lr': 0.0019720527304555526, 'lambda_val': 0.01841966619850501, 'batch_size': 627, 'optimizer': 'Adam'}. Best is trial 57 with value: 0.06827998896428639.
2026-05-18 05:45:59,443 - experiment_functions - INFO - Early stopping at epoch 900. Best Recall: 0.0629
2026-05-18 05:45:59,553 - optuna.study.study - INFO - Trial 72 finished with value: 0.06289803476734745 and parameters: {'n_layers': 1, 'embedding_dim': 32, 'lr': 0.0014549925290305845, 'lambda_val': 0.009730018997090677, 'batch_size': 841, 'optimizer': 'Adam'}. Best is trial 57 with value: 0.06827998896428639.
2026-05-18 05:46:11,034 - experiment_functions - INFO - Early stopping at epoch 600. Best Recall: 0.0551
2026-05-18 05:46:11,124 - optuna.study.study - INFO - Trial 73 finished with value: 0.055120208138240354 and parameters: {'n_layers': 1, 'embedding_dim': 32, 'lr': 0.004732792034215194, 'lambda_val': 0.026367944919335293, 'batch_size': 889, 'optimizer': 'Adam'}. Best is trial 57 with value: 0.06827998896428639.
2026-05-18 05:46:36,530 - experiment_functions - INFO - Early stopping at epoch 1800. Best Recall: 0.0672
2026-05-18 05:46:36,641 - optuna.study.study - INFO - Trial 74 finished with value: 0.0672260944083555 and parameters: {'n_layers': 1, 'embedding_dim': 32, 'lr': 0.0009848391948405236, 'lambda_val': 0.0038948735356820513, 'batch_size': 640, 'optimizer': 'Adam'}. Best is trial 57 with value: 0.06827998896428639.
2026-05-18 05:46:47,218 - experiment_functions - INFO - Early stopping at epoch 750. Best Recall: 0.0052
2026-05-18 05:46:47,309 - optuna.study.study - INFO - Trial 75 finished with value: 0.0052388040651256615 and parameters: {'n_layers': 1, 'embedding_dim': 32, 'lr': 0.00029838082560816294, 'lambda_val': 0.004044089881666046, 'batch_size': 625, 'optimizer': 'Adam'}. Best is trial 57 with value: 0.06827998896428639.
2026-05-18 05:47:05,168 - experiment_functions - INFO - Early stopping at epoch 1200. Best Recall: 0.0660
2026-05-18 05:47:05,257 - optuna.study.study - INFO - Trial 76 finished with value: 0.06602418361571137 and parameters: {'n_layers': 1, 'embedding_dim': 32, 'lr': 0.0012912545320247226, 'lambda_val': 0.0006247648573293567, 'batch_size': 730, 'optimizer': 'Adam'}. Best is trial 57 with value: 0.06827998896428639.
2026-05-18 05:47:22,544 - experiment_functions - INFO - Early stopping at epoch 1200. Best Recall: 0.0644
2026-05-18 05:47:22,646 - optuna.study.study - INFO - Trial 77 finished with value: 0.06435831859591698 and parameters: {'n_layers': 1, 'embedding_dim': 32, 'lr': 0.0011665487039487982, 'lambda_val': 0.0010965842801154975, 'batch_size': 663, 'optimizer': 'Adam'}. Best is trial 57 with value: 0.06827998896428639.
2026-05-18 05:47:38,060 - experiment_functions - INFO - Early stopping at epoch 900. Best Recall: 0.0628
2026-05-18 05:47:38,160 - optuna.study.study - INFO - Trial 78 finished with value: 0.06282390300161127 and parameters: {'n_layers': 1, 'embedding_dim': 32, 'lr': 0.0017193546254376502, 'lambda_val': 0.0006028050811211894, 'batch_size': 801, 'optimizer': 'Adam'}. Best is trial 57 with value: 0.06827998896428639.
2026-05-18 05:47:47,513 - experiment_functions - INFO - Early stopping at epoch 600. Best Recall: 0.0441
