2026-05-18 04:43:17,300 - optuna.study._optimize - INFO - Trial 162 pruned. 
2026-05-18 04:43:27,079 - experiment_functions - INFO - Early stopping at epoch 700. Best Recall: 0.0619
2026-05-18 04:43:27,246 - optuna.study.study - INFO - Trial 163 finished with value: 0.06190790225946 and parameters: {'n_layers': 1, 'embedding_dim': 32, 'lr': 0.001815149454896065, 'lambda_val': 0.0001658168519287243, 'batch_size': 589, 'optimizer': 'RMSprop'}. Best is trial 151 with value: 0.07335068013441892.
2026-05-18 04:43:39,657 - experiment_functions - INFO - Early stopping at epoch 850. Best Recall: 0.0060
2026-05-18 04:43:39,755 - optuna.study.study - INFO - Trial 164 finished with value: 0.005977159624470455 and parameters: {'n_layers': 1, 'embedding_dim': 32, 'lr': 3.691818329583332e-05, 'lambda_val': 0.0003559569767820786, 'batch_size': 662, 'optimizer': 'RMSprop'}. Best is trial 151 with value: 0.07335068013441892.
2026-05-18 04:43:50,774 - experiment_functions - INFO - Early stopping at epoch 700. Best Recall: 0.0515
2026-05-18 04:43:50,870 - optuna.study.study - INFO - Trial 165 finished with value: 0.05154800506834886 and parameters: {'n_layers': 1, 'embedding_dim': 256, 'lr': 0.0012459359701503692, 'lambda_val': 0.00103816665467204, 'batch_size': 761, 'optimizer': 'RMSprop'}. Best is trial 151 with value: 0.07335068013441892.
2026-05-18 04:44:13,437 - experiment_functions - INFO - Early stopping at epoch 1500. Best Recall: 0.0690
2026-05-18 04:44:13,516 - optuna.study.study - INFO - Trial 166 finished with value: 0.06898891007353251 and parameters: {'n_layers': 1, 'embedding_dim': 128, 'lr': 0.0007121584553294766, 'lambda_val': 0.00015529250157997527, 'batch_size': 587, 'optimizer': 'RMSprop'}. Best is trial 151 with value: 0.07335068013441892.
2026-05-18 04:44:33,965 - experiment_functions - INFO - Early stopping at epoch 1500. Best Recall: 0.0727
2026-05-18 04:44:34,056 - optuna.study.study - INFO - Trial 167 finished with value: 0.07269837990796972 and parameters: {'n_layers': 1, 'embedding_dim': 32, 'lr': 0.0010206296685254732, 'lambda_val': 0.0004054197321366024, 'batch_size': 513, 'optimizer': 'RMSprop'}. Best is trial 151 with value: 0.07335068013441892.
2026-05-18 04:44:50,078 - optuna.study._optimize - INFO - Trial 168 pruned. 
2026-05-18 04:45:04,149 - experiment_functions - INFO - Early stopping at epoch 1000. Best Recall: 0.0682
2026-05-18 04:45:04,302 - optuna.study.study - INFO - Trial 169 finished with value: 0.06824205340859531 and parameters: {'n_layers': 1, 'embedding_dim': 32, 'lr': 0.0011469849361930187, 'lambda_val': 0.0016282468954637605, 'batch_size': 661, 'optimizer': 'RMSprop'}. Best is trial 151 with value: 0.07335068013441892.
2026-05-18 04:45:17,316 - optuna.study._optimize - INFO - Trial 170 pruned. 
2026-05-18 04:45:38,567 - experiment_functions - INFO - Early stopping at epoch 1450. Best Recall: 0.0738
2026-05-18 04:45:38,656 - optuna.study.study - INFO - Trial 171 finished with value: 0.07379176940750196 and parameters: {'n_layers': 1, 'embedding_dim': 32, 'lr': 0.0009969193114338184, 'lambda_val': 0.00023849259120653832, 'batch_size': 593, 'optimizer': 'RMSprop'}. Best is trial 171 with value: 0.07379176940750196.
2026-05-18 04:46:06,555 - optuna.study._optimize - INFO - Trial 172 pruned. 
2026-05-18 04:46:44,617 - experiment_functions - INFO - Early stopping at epoch 2750. Best Recall: 0.0739
2026-05-18 04:46:44,720 - optuna.study.study - INFO - Trial 173 finished with value: 0.07394503416584505 and parameters: {'n_layers': 1, 'embedding_dim': 32, 'lr': 0.0007313697763319142, 'lambda_val': 0.0006110341186301207, 'batch_size': 743, 'optimizer': 'RMSprop'}. Best is trial 173 with value: 0.07394503416584505.
2026-05-18 04:46:59,087 - optuna.study._optimize - INFO - Trial 174 pruned. 
2026-05-18 04:47:13,443 - optuna.study._optimize - INFO - Trial 175 pruned. 
2026-05-18 04:47:26,355 - optuna.study._optimize - INFO - Trial 176 pruned. 
2026-05-18 04:47:46,728 - experiment_functions - INFO - Early stopping at epoch 1450. Best Recall: 0.0698
2026-05-18 04:47:46,815 - optuna.study.study - INFO - Trial 177 finished with value: 0.06982073625257021 and parameters: {'n_layers': 1, 'embedding_dim': 32, 'lr': 0.0009746039546366123, 'lambda_val': 0.00038391193714898576, 'batch_size': 751, 'optimizer': 'RMSprop'}. Best is trial 173 with value: 0.07394503416584505.
2026-05-18 04:47:53,743 - experiment_functions - INFO - Early stopping at epoch 500. Best Recall: 0.0053
2026-05-18 04:47:53,829 - optuna.study.study - INFO - Trial 178 finished with value: 0.005349924365755353 and parameters: {'n_layers': 1, 'embedding_dim': 32, 'lr': 0.0012671850848006171, 'lambda_val': 0.0003353653169649061, 'batch_size': 888, 'optimizer': 'SGD'}. Best is trial 173 with value: 0.07394503416584505.
2026-05-18 04:48:03,090 - experiment_functions - INFO - Early stopping at epoch 650. Best Recall: 0.0570
2026-05-18 04:48:03,183 - optuna.study.study - INFO - Trial 179 finished with value: 0.056971833582755864 and parameters: {'n_layers': 1, 'embedding_dim': 32, 'lr': 0.002051855802285078, 'lambda_val': 0.0001929083559066378, 'batch_size': 661, 'optimizer': 'RMSprop'}. Best is trial 173 with value: 0.07394503416584505.
2026-05-18 04:48:17,357 - optuna.study._optimize - INFO - Trial 180 pruned. 
2026-05-18 04:48:31,874 - optuna.study._optimize - INFO - Trial 181 pruned. 
2026-05-18 04:49:07,716 - experiment_functions - INFO - Early stopping at epoch 2700. Best Recall: 0.0708
2026-05-18 04:49:07,809 - optuna.study.study - INFO - Trial 182 finished with value: 0.070767494789122 and parameters: {'n_layers': 1, 'embedding_dim': 32, 'lr': 0.0007663967878267242, 'lambda_val': 0.000631867090287185, 'batch_size': 645, 'optimizer': 'RMSprop'}. Best is trial 173 with value: 0.07394503416584505.
2026-05-18 04:49:21,788 - optuna.study._optimize - INFO - Trial 183 pruned. 
2026-05-18 04:49:32,833 - experiment_functions - INFO - Early stopping at epoch 750. Best Recall: 0.0409
2026-05-18 04:49:32,925 - optuna.study.study - INFO - Trial 184 finished with value: 0.040917746937104156 and parameters: {'n_layers': 3, 'embedding_dim': 32, 'lr': 0.0007801624002582854, 'lambda_val': 0.0006608529012570017, 'batch_size': 731, 'optimizer': 'RMSprop'}. Best is trial 173 with value: 0.07394503416584505.
2026-05-18 04:49:47,005 - optuna.study._optimize - INFO - Trial 185 pruned. 
2026-05-18 04:50:01,589 - optuna.study._optimize - INFO - Trial 186 pruned. 
2026-05-18 04:50:16,538 - experiment_functions - INFO - Early stopping at epoch 950. Best Recall: 0.0669
2026-05-18 04:50:16,641 - optuna.study.study - INFO - Trial 187 finished with value: 0.06690280549726693 and parameters: {'n_layers': 1, 'embedding_dim': 32, 'lr': 0.0014045376470954306, 'lambda_val': 0.0003014903293366765, 'batch_size': 577, 'optimizer': 'RMSprop'}. Best is trial 173 with value: 0.07394503416584505.
2026-05-18 04:50:35,495 - optuna.study._optimize - INFO - Trial 188 pruned. 
2026-05-18 04:50:49,520 - optuna.study._optimize - INFO - Trial 189 pruned. 
2026-05-18 04:50:59,435 - experiment_functions - INFO - Early stopping at epoch 600. Best Recall: 0.0486
2026-05-18 04:50:59,539 - optuna.study.study - INFO - Trial 190 finished with value: 0.04864216586791376 and parameters: {'n_layers': 1, 'embedding_dim': 256, 'lr': 0.0016547670057930539, 'lambda_val': 0.000452248832778022, 'batch_size': 696, 'optimizer': 'RMSprop'}. Best is trial 173 with value: 0.07394503416584505.
2026-05-18 04:51:24,767 - experiment_functions - INFO - Early stopping at epoch 1700. Best Recall: 0.0712
2026-05-18 04:51:24,860 - optuna.study.study - INFO - Trial 191 finished with value: 0.0711536926286166 and parameters: {'n_layers': 1, 'embedding_dim': 32, 'lr': 0.0009755438648002938, 'lambda_val': 0.0005600100423326461, 'batch_size': 605, 'optimizer': 'RMSprop'}. Best is trial 173 with value: 0.07394503416584505.
2026-05-18 04:51:39,155 - optuna.study._optimize - INFO - Trial 192 pruned. 
2026-05-18 04:52:17,747 - experiment_functions - INFO - Early stopping at epoch 2550. Best Recall: 0.0730
2026-05-18 04:52:17,852 - optuna.study.study - INFO - Trial 193 finished with value: 0.07304706737287765 and parameters: {'n_layers': 1, 'embedding_dim': 32, 'lr': 0.000812188793291195, 'lambda_val': 0.0007200055374138789, 'batch_size': 594, 'optimizer': 'RMSprop'}. Best is trial 173 with value: 0.07394503416584505.
2026-05-18 04:52:34,339 - optuna.study._optimize - INFO - Trial 194 pruned. 
2026-05-18 04:52:49,505 - optuna.study._optimize - INFO - Trial 195 pruned. 
2026-05-18 04:53:04,342 - optuna.study._optimize - INFO - Trial 196 pruned. 
2026-05-18 04:53:40,542 - experiment_functions - INFO - Early stopping at epoch 2650. Best Recall: 0.0734
2026-05-18 04:53:40,623 - optuna.study.study - INFO - Trial 197 finished with value: 0.07343919897961443 and parameters: {'n_layers': 1, 'embedding_dim': 32, 'lr': 0.0007899914663442283, 'lambda_val': 0.0009141642874170922, 'batch_size': 593, 'optimizer': 'RMSprop'}. Best is trial 173 with value: 0.07394503416584505.
2026-05-18 04:53:55,156 - optuna.study._optimize - INFO - Trial 198 pruned. 
2026-05-18 04:54:11,939 - optuna.study._optimize - INFO - Trial 199 pruned. 
2026-05-18 04:54:26,715 - optuna.study._optimize - INFO - Trial 200 pruned. 
2026-05-18 04:55:02,189 - experiment_functions - INFO - Early stopping at epoch 2500. Best Recall: 0.0748
2026-05-18 04:55:02,340 - optuna.study.study - INFO - Trial 201 finished with value: 0.07482557231887864 and parameters: {'n_layers': 1, 'embedding_dim': 32, 'lr': 0.000840344551771007, 'lambda_val': 0.0004687086470659903, 'batch_size': 576, 'optimizer': 'RMSprop'}. Best is trial 201 with value: 0.07482557231887864.
2026-05-18 04:55:17,493 - optuna.study._optimize - INFO - Trial 202 pruned. 
2026-05-18 04:55:35,829 - experiment_functions - INFO - Early stopping at epoch 1250. Best Recall: 0.0682
2026-05-18 04:55:35,966 - optuna.study.study - INFO - Trial 203 finished with value: 0.06818940401064755 and parameters: {'n_layers': 1, 'embedding_dim': 32, 'lr': 0.0009876426158214287, 'lambda_val': 0.0012524819319364297, 'batch_size': 661, 'optimizer': 'RMSprop'}. Best is trial 201 with value: 0.07482557231887864.
2026-05-18 04:56:07,657 - experiment_functions - INFO - Early stopping at epoch 2250. Best Recall: 0.0719
2026-05-18 04:56:07,749 - optuna.study.study - INFO - Trial 204 finished with value: 0.07186191174019708 and parameters: {'n_layers': 1, 'embedding_dim': 32, 'lr': 0.000836715691319617, 'lambda_val': 0.0007594600847291275, 'batch_size': 581, 'optimizer': 'RMSprop'}. Best is trial 201 with value: 0.07482557231887864.
2026-05-18 04:56:15,361 - experiment_functions - INFO - Early stopping at epoch 500. Best Recall: 0.0054
2026-05-18 04:56:15,466 - optuna.study.study - INFO - Trial 205 finished with value: 0.005404689882552897 and parameters: {'n_layers': 1, 'embedding_dim': 32, 'lr': 0.0008268738294055939, 'lambda_val': 0.0008965491157892947, 'batch_size': 728, 'optimizer': 'SGD'}. Best is trial 201 with value: 0.07482557231887864.
2026-05-18 04:56:29,578 - optuna.study._optimize - INFO - Trial 206 pruned. 
2026-05-18 04:56:42,858 - optuna.study._optimize - INFO - Trial 207 pruned. 
2026-05-18 04:56:56,678 - experiment_functions - INFO - Early stopping at epoch 950. Best Recall: 0.0689
2026-05-18 04:56:56,759 - optuna.study.study - INFO - Trial 208 finished with value: 0.0688926504888207 and parameters: {'n_layers': 1, 'embedding_dim': 32, 'lr': 0.0012579392486668278, 'lambda_val': 0.0005353768634133841, 'batch_size': 811, 'optimizer': 'RMSprop'}. Best is trial 201 with value: 0.07482557231887864.
2026-05-18 04:57:27,931 - experiment_functions - INFO - Early stopping at epoch 2150. Best Recall: 0.0707
2026-05-18 04:57:28,078 - optuna.study.study - INFO - Trial 209 finished with value: 0.07073345187375223 and parameters: {'n_layers': 1, 'embedding_dim': 32, 'lr': 0.0007993109515867037, 'lambda_val': 0.0003677776210158873, 'batch_size': 679, 'optimizer': 'RMSprop'}. Best is trial 201 with value: 0.07482557231887864.
2026-05-18 04:57:41,994 - optuna.study._optimize - INFO - Trial 210 pruned. 
2026-05-18 04:58:14,858 - experiment_functions - INFO - Early stopping at epoch 2350. Best Recall: 0.0755
2026-05-18 04:58:14,950 - optuna.study.study - INFO - Trial 211 finished with value: 0.07552732782181781 and parameters: {'n_layers': 1, 'embedding_dim': 32, 'lr': 0.0007845471506002365, 'lambda_val': 0.0009752632561673676, 'batch_size': 611, 'optimizer': 'RMSprop'}. Best is trial 211 with value: 0.07552732782181781.
2026-05-18 04:58:29,884 - optuna.study._optimize - INFO - Trial 212 pruned. 
2026-05-18 04:58:54,340 - experiment_functions - INFO - Early stopping at epoch 1600. Best Recall: 0.0695
2026-05-18 04:58:54,433 - optuna.study.study - INFO - Trial 213 finished with value: 0.06949582824889168 and parameters: {'n_layers': 1, 'embedding_dim': 32, 'lr': 0.0008676165377470199, 'lambda_val': 0.00036842927958867375, 'batch_size': 759, 'optimizer': 'RMSprop'}. Best is trial 211 with value: 0.07552732782181781.
2026-05-18 04:59:09,472 - optuna.study._optimize - INFO - Trial 214 pruned. 
2026-05-18 04:59:38,342 - optuna.study._optimize - INFO - Trial 215 pruned. 
2026-05-18 05:00:00,133 - optuna.study._optimize - INFO - Trial 216 pruned. 
2026-05-18 05:00:15,144 - optuna.study._optimize - INFO - Trial 217 pruned. 
2026-05-18 05:00:30,517 - optuna.study._optimize - INFO - Trial 218 pruned. 
2026-05-18 05:00:47,365 - optuna.study._optimize - INFO - Trial 219 pruned. 
2026-05-18 05:01:11,353 - optuna.study._optimize - INFO - Trial 220 pruned. 
2026-05-18 05:01:36,866 - experiment_functions - INFO - Early stopping at epoch 1750. Best Recall: 0.0711
2026-05-18 05:01:36,957 - optuna.study.study - INFO - Trial 221 finished with value: 0.07112443884725589 and parameters: {'n_layers': 1, 'embedding_dim': 32, 'lr': 0.0009227102571296744, 'lambda_val': 0.0011695293579343936, 'batch_size': 576, 'optimizer': 'RMSprop'}. Best is trial 211 with value: 0.07552732782181781.
2026-05-18 05:01:56,636 - optuna.study._optimize - INFO - Trial 222 pruned. 
2026-05-18 05:02:12,147 - optuna.study._optimize - INFO - Trial 223 pruned. 
2026-05-18 05:02:48,227 - experiment_functions - INFO - Early stopping at epoch 2300. Best Recall: 0.0725
2026-05-18 05:02:48,364 - optuna.study.study - INFO - Trial 224 finished with value: 0.07248233371906586 and parameters: {'n_layers': 1, 'embedding_dim': 32, 'lr': 0.0008646517331634986, 'lambda_val': 0.0008143780468907303, 'batch_size': 517, 'optimizer': 'RMSprop'}. Best is trial 211 with value: 0.07552732782181781.
2026-05-18 05:03:17,382 - experiment_functions - INFO - Early stopping at epoch 2000. Best Recall: 0.0732
2026-05-18 05:03:17,485 - optuna.study.study - INFO - Trial 225 finished with value: 0.07319200538531134 and parameters: {'n_layers': 1, 'embedding_dim': 32, 'lr': 0.0009121395288266556, 'lambda_val': 0.0008015433837301058, 'batch_size': 587, 'optimizer': 'RMSprop'}. Best is trial 211 with value: 0.07552732782181781.
2026-05-18 05:03:36,222 - experiment_functions - INFO - Early stopping at epoch 1250. Best Recall: 0.0699
2026-05-18 05:03:36,377 - optuna.study.study - INFO - Trial 226 finished with value: 0.06988342843570576 and parameters: {'n_layers': 1, 'embedding_dim': 32, 'lr': 0.0011077116096888595, 'lambda_val': 0.0008325030738216472, 'batch_size': 573, 'optimizer': 'RMSprop'}. Best is trial 211 with value: 0.07552732782181781.
2026-05-18 05:04:05,095 - optuna.study._optimize - INFO - Trial 227 pruned. 
2026-05-18 05:04:25,969 - experiment_functions - INFO - Early stopping at epoch 950. Best Recall: 0.0571
2026-05-18 05:04:26,096 - optuna.study.study - INFO - Trial 228 finished with value: 0.05708568939571685 and parameters: {'n_layers': 1, 'embedding_dim': 256, 'lr': 0.0009235400451897291, 'lambda_val': 0.0011125860629648977, 'batch_size': 515, 'optimizer': 'RMSprop'}. Best is trial 211 with value: 0.07552732782181781.
2026-05-18 05:04:41,793 - optuna.study._optimize - INFO - Trial 229 pruned. 
2026-05-18 05:04:57,133 - optuna.study._optimize - INFO - Trial 230 pruned. 
2026-05-18 05:05:16,980 - optuna.study._optimize - INFO - Trial 231 pruned. 
2026-05-18 05:05:33,544 - optuna.study._optimize - INFO - Trial 232 pruned. 
2026-05-18 05:05:48,334 - optuna.study._optimize - INFO - Trial 233 pruned. 
2026-05-18 05:06:04,702 - experiment_functions - INFO - Early stopping at epoch 900. Best Recall: 0.0551
2026-05-18 05:06:05,360 - optuna.study.study - INFO - Trial 234 finished with value: 0.0551469173527149 and parameters: {'n_layers': 2, 'embedding_dim': 32, 'lr': 0.0008237646844515546, 'lambda_val': 0.0008953803304446221, 'batch_size': 614, 'optimizer': 'RMSprop'}. Best is trial 211 with value: 0.07552732782181781.
2026-05-18 05:06:20,553 - optuna.study._optimize - INFO - Trial 235 pruned. 
2026-05-18 05:06:33,396 - experiment_functions - INFO - Early stopping at epoch 800. Best Recall: 0.0540
2026-05-18 05:06:33,509 - optuna.study.study - INFO - Trial 236 finished with value: 0.05400641630589852 and parameters: {'n_layers': 1, 'embedding_dim': 32, 'lr': 0.00099238618093083, 'lambda_val': 0.0006272293579744967, 'batch_size': 2895, 'optimizer': 'RMSprop'}. Best is trial 211 with value: 0.07552732782181781.
2026-05-18 05:06:41,290 - experiment_functions - INFO - Early stopping at epoch 500. Best Recall: 0.0051
2026-05-18 05:06:41,383 - optuna.study.study - INFO - Trial 237 finished with value: 0.005067340347236556 and parameters: {'n_layers': 1, 'embedding_dim': 32, 'lr': 0.0007239027542529172, 'lambda_val': 0.0004375771022024729, 'batch_size': 591, 'optimizer': 'SGD'}. Best is trial 211 with value: 0.07552732782181781.
2026-05-18 05:06:56,233 - experiment_functions - INFO - Early stopping at epoch 1050. Best Recall: 0.0674
2026-05-18 05:06:56,326 - optuna.study.study - INFO - Trial 238 finished with value: 0.06735995645066786 and parameters: {'n_layers': 1, 'embedding_dim': 32, 'lr': 0.0011709376600882607, 'lambda_val': 0.0007744287480163298, 'batch_size': 693, 'optimizer': 'RMSprop'}. Best is trial 211 with value: 0.07552732782181781.
2026-05-18 05:07:12,784 - optuna.study._optimize - INFO - Trial 239 pruned. 
2026-05-18 05:07:27,185 - optuna.study._optimize - INFO - Trial 240 pruned. 
2026-05-18 05:07:42,776 - optuna.study._optimize - INFO - Trial 241 pruned. 
2026-05-18 05:07:57,868 - optuna.study._optimize - INFO - Trial 242 pruned. 
2026-05-18 05:08:16,912 - optuna.study._optimize - INFO - Trial 243 pruned. 
2026-05-18 05:08:36,011 - optuna.study._optimize - INFO - Trial 244 pruned. 
2026-05-18 05:08:50,512 - optuna.study._optimize - INFO - Trial 245 pruned. 
2026-05-18 05:09:06,410 - experiment_functions - INFO - Early stopping at epoch 1000. Best Recall: 0.0667
2026-05-18 05:09:06,502 - optuna.study.study - INFO - Trial 246 finished with value: 0.06673201323074006 and parameters: {'n_layers': 1, 'embedding_dim': 32, 'lr': 0.001288610079654877, 'lambda_val': 0.0002979898952642696, 'batch_size': 693, 'optimizer': 'RMSprop'}. Best is trial 211 with value: 0.07552732782181781.
2026-05-18 05:09:39,619 - optuna.study._optimize - INFO - Trial 247 pruned. 
2026-05-18 05:09:54,612 - optuna.study._optimize - INFO - Trial 248 pruned. 
2026-05-18 05:10:10,335 - optuna.study._optimize - INFO - Trial 249 pruned. 
2026-05-18 05:10:33,305 - experiment_functions - INFO - Early stopping at epoch 1550. Best Recall: 0.0718
2026-05-18 05:10:33,395 - optuna.study.study - INFO - Trial 250 finished with value: 0.07180669721254206 and parameters: {'n_layers': 1, 'embedding_dim': 32, 'lr': 0.001046223107346979, 'lambda_val': 0.00035154143567129296, 'batch_size': 518, 'optimizer': 'RMSprop'}. Best is trial 211 with value: 0.07552732782181781.
2026-05-18 05:10:59,116 - experiment_functions - INFO - Early stopping at epoch 1650. Best Recall: 0.0704
2026-05-18 05:10:59,251 - optuna.study.study - INFO - Trial 251 finished with value: 0.07038758249653808 and parameters: {'n_layers': 1, 'embedding_dim': 32, 'lr': 0.0010288534600164823, 'lambda_val': 0.0002457736655205976, 'batch_size': 514, 'optimizer': 'RMSprop'}. Best is trial 211 with value: 0.07552732782181781.
2026-05-18 05:11:14,269 - experiment_functions - INFO - Early stopping at epoch 1000. Best Recall: 0.0666
2026-05-18 05:11:14,361 - optuna.study.study - INFO - Trial 252 finished with value: 0.06662796409783389 and parameters: {'n_layers': 1, 'embedding_dim': 32, 'lr': 0.0013515656543699303, 'lambda_val': 0.00048257538342072936, 'batch_size': 515, 'optimizer': 'RMSprop'}. Best is trial 211 with value: 0.07552732782181781.
2026-05-18 05:11:37,411 - experiment_functions - INFO - Early stopping at epoch 1400. Best Recall: 0.0722
2026-05-18 05:11:37,500 - optuna.study.study - INFO - Trial 253 finished with value: 0.07223625211277003 and parameters: {'n_layers': 1, 'embedding_dim': 32, 'lr': 0.0011257493953542275, 'lambda_val': 0.0006631513499192666, 'batch_size': 601, 'optimizer': 'RMSprop'}. Best is trial 211 with value: 0.07552732782181781.
2026-05-18 05:11:49,422 - experiment_functions - INFO - Early stopping at epoch 750. Best Recall: 0.0647
2026-05-18 05:11:49,512 - optuna.study.study - INFO - Trial 254 finished with value: 0.0646569224647079 and parameters: {'n_layers': 1, 'embedding_dim': 32, 'lr': 0.0015854527739460015, 'lambda_val': 0.00018007654573770477, 'batch_size': 583, 'optimizer': 'RMSprop'}. Best is trial 211 with value: 0.07552732782181781.
2026-05-18 05:12:09,029 - experiment_functions - INFO - Early stopping at epoch 1200. Best Recall: 0.0688
2026-05-18 05:12:09,130 - optuna.study.study - INFO - Trial 255 finished with value: 0.0688100863497441 and parameters: {'n_layers': 1, 'embedding_dim': 32, 'lr': 0.0011554618728685856, 'lambda_val': 0.0011118207150920575, 'batch_size': 587, 'optimizer': 'RMSprop'}. Best is trial 211 with value: 0.07552732782181781.
