2026-05-19 00:32:22,368 - optuna.study.study - INFO - Trial 55 finished with value: 0.05865686935843834 and parameters: {'n_layers': 1, 'embedding_dim': 32, 'lr': 0.0068256542545654855, 'lambda_val': 0.01301888445381463, 'batch_size': 1986, 'optimizer': 'Adam'}. Best is trial 42 with value: 0.06701910241028815.
2026-05-19 00:32:32,044 - experiment_functions - INFO - Early stopping at epoch 650. Best Recall: 0.0176
2026-05-19 00:32:32,133 - optuna.study.study - INFO - Trial 56 finished with value: 0.017632276864028667 and parameters: {'n_layers': 3, 'embedding_dim': 64, 'lr': 0.0020142891313310474, 'lambda_val': 0.08275677392104923, 'batch_size': 1994, 'optimizer': 'Adam'}. Best is trial 42 with value: 0.06701910241028815.
2026-05-19 00:32:41,193 - experiment_functions - INFO - Early stopping at epoch 550. Best Recall: 0.0520
2026-05-19 00:32:41,293 - optuna.study.study - INFO - Trial 57 finished with value: 0.05195684550361311 and parameters: {'n_layers': 1, 'embedding_dim': 96, 'lr': 0.009554817926912498, 'lambda_val': 0.007684324163970008, 'batch_size': 2231, 'optimizer': 'Adam'}. Best is trial 42 with value: 0.06701910241028815.
2026-05-19 00:32:58,094 - optuna.study._optimize - INFO - Trial 58 pruned. 
2026-05-19 00:33:08,080 - experiment_functions - INFO - Early stopping at epoch 550. Best Recall: 0.0380
2026-05-19 00:33:08,188 - optuna.study.study - INFO - Trial 59 finished with value: 0.03803705292088348 and parameters: {'n_layers': 2, 'embedding_dim': 256, 'lr': 0.0010561452722976927, 'lambda_val': 0.00022565165598352713, 'batch_size': 830, 'optimizer': 'RMSprop'}. Best is trial 42 with value: 0.06701910241028815.
2026-05-19 00:33:18,565 - experiment_functions - INFO - Early stopping at epoch 550. Best Recall: 0.0481
2026-05-19 00:33:18,664 - optuna.study.study - INFO - Trial 60 finished with value: 0.048149387768455426 and parameters: {'n_layers': 1, 'embedding_dim': 64, 'lr': 0.005351254249328936, 'lambda_val': 0.01909843263695882, 'batch_size': 2326, 'optimizer': 'Adam'}. Best is trial 42 with value: 0.06701910241028815.
2026-05-19 00:33:28,211 - experiment_functions - INFO - Early stopping at epoch 650. Best Recall: 0.0629
2026-05-19 00:33:28,289 - optuna.study.study - INFO - Trial 61 finished with value: 0.06286339956615487 and parameters: {'n_layers': 1, 'embedding_dim': 64, 'lr': 0.0032373317820121976, 'lambda_val': 0.005553783457316454, 'batch_size': 1284, 'optimizer': 'Adam'}. Best is trial 42 with value: 0.06701910241028815.
2026-05-19 00:33:37,806 - experiment_functions - INFO - Early stopping at epoch 650. Best Recall: 0.0627
2026-05-19 00:33:37,906 - optuna.study.study - INFO - Trial 62 finished with value: 0.06269963174376332 and parameters: {'n_layers': 1, 'embedding_dim': 64, 'lr': 0.0027068621083278298, 'lambda_val': 0.006364276692012126, 'batch_size': 1384, 'optimizer': 'Adam'}. Best is trial 42 with value: 0.06701910241028815.
2026-05-19 00:33:48,308 - experiment_functions - INFO - Early stopping at epoch 700. Best Recall: 0.0587
2026-05-19 00:33:48,885 - optuna.study.study - INFO - Trial 63 finished with value: 0.058722582839920386 and parameters: {'n_layers': 1, 'embedding_dim': 64, 'lr': 0.002477380221441838, 'lambda_val': 0.006400635198526434, 'batch_size': 1342, 'optimizer': 'Adam'}. Best is trial 42 with value: 0.06701910241028815.
2026-05-19 00:34:03,077 - optuna.study._optimize - INFO - Trial 64 pruned. 
2026-05-19 00:34:17,122 - experiment_functions - INFO - Early stopping at epoch 750. Best Recall: 0.0624
2026-05-19 00:34:17,223 - optuna.study.study - INFO - Trial 65 finished with value: 0.06243975174870072 and parameters: {'n_layers': 1, 'embedding_dim': 64, 'lr': 0.0016890183309437748, 'lambda_val': 0.00037703259907647947, 'batch_size': 1603, 'optimizer': 'Adam'}. Best is trial 42 with value: 0.06701910241028815.
2026-05-19 00:34:26,834 - experiment_functions - INFO - Early stopping at epoch 650. Best Recall: 0.0631
2026-05-19 00:34:26,935 - optuna.study.study - INFO - Trial 66 finished with value: 0.0630611589274431 and parameters: {'n_layers': 1, 'embedding_dim': 64, 'lr': 0.0033648120563035872, 'lambda_val': 2.595550871800642e-05, 'batch_size': 1407, 'optimizer': 'Adam'}. Best is trial 42 with value: 0.06701910241028815.
2026-05-19 00:34:37,574 - experiment_functions - INFO - Early stopping at epoch 700. Best Recall: 0.0440
2026-05-19 00:34:37,674 - optuna.study.study - INFO - Trial 67 finished with value: 0.04400232787718712 and parameters: {'n_layers': 3, 'embedding_dim': 64, 'lr': 0.0009040162752771131, 'lambda_val': 2.6640603399725427e-05, 'batch_size': 1700, 'optimizer': 'Adam'}. Best is trial 42 with value: 0.06701910241028815.
2026-05-19 00:34:47,263 - experiment_functions - INFO - Early stopping at epoch 600. Best Recall: 0.0560
2026-05-19 00:34:47,342 - optuna.study.study - INFO - Trial 68 finished with value: 0.05597248264575784 and parameters: {'n_layers': 1, 'embedding_dim': 64, 'lr': 0.0038732876842394143, 'lambda_val': 1.187213924461157e-05, 'batch_size': 1520, 'optimizer': 'Adam'}. Best is trial 42 with value: 0.06701910241028815.
2026-05-19 00:34:54,428 - experiment_functions - INFO - Early stopping at epoch 500. Best Recall: 0.0052
2026-05-19 00:34:54,517 - optuna.study.study - INFO - Trial 69 finished with value: 0.0052326750920147465 and parameters: {'n_layers': 1, 'embedding_dim': 32, 'lr': 0.0013956983196115426, 'lambda_val': 9.30247184053937e-05, 'batch_size': 1182, 'optimizer': 'SGD'}. Best is trial 42 with value: 0.06701910241028815.
2026-05-19 00:35:05,155 - experiment_functions - INFO - Early stopping at epoch 650. Best Recall: 0.0588
2026-05-19 00:35:05,257 - optuna.study.study - INFO - Trial 70 finished with value: 0.05877296690417053 and parameters: {'n_layers': 1, 'embedding_dim': 64, 'lr': 0.0035065765138179777, 'lambda_val': 6.107400147157632e-05, 'batch_size': 1453, 'optimizer': 'Adam'}. Best is trial 42 with value: 0.06701910241028815.
2026-05-19 00:35:25,078 - experiment_functions - INFO - Early stopping at epoch 700. Best Recall: 0.0589
2026-05-19 00:35:25,169 - optuna.study.study - INFO - Trial 71 finished with value: 0.05886610163918603 and parameters: {'n_layers': 1, 'embedding_dim': 64, 'lr': 0.0022559961699774637, 'lambda_val': 1.809158008973346e-05, 'batch_size': 1425, 'optimizer': 'Adam'}. Best is trial 42 with value: 0.06701910241028815.
2026-05-19 00:35:34,977 - experiment_functions - INFO - Early stopping at epoch 650. Best Recall: 0.0545
2026-05-19 00:35:35,067 - optuna.study.study - INFO - Trial 72 finished with value: 0.05447615524748552 and parameters: {'n_layers': 1, 'embedding_dim': 64, 'lr': 0.0029364649378203866, 'lambda_val': 0.030343660552553723, 'batch_size': 1283, 'optimizer': 'Adam'}. Best is trial 42 with value: 0.06701910241028815.
2026-05-19 00:36:01,830 - experiment_functions - INFO - Early stopping at epoch 1950. Best Recall: 0.0664
2026-05-19 00:36:01,919 - optuna.study.study - INFO - Trial 73 finished with value: 0.06641413895420376 and parameters: {'n_layers': 1, 'embedding_dim': 64, 'lr': 0.0005730635829377385, 'lambda_val': 0.010594333555318606, 'batch_size': 1013, 'optimizer': 'Adam'}. Best is trial 42 with value: 0.06701910241028815.
2026-05-19 00:36:29,736 - experiment_functions - INFO - Early stopping at epoch 1900. Best Recall: 0.0656
2026-05-19 00:36:29,825 - optuna.study.study - INFO - Trial 74 finished with value: 0.06561411919553295 and parameters: {'n_layers': 1, 'embedding_dim': 64, 'lr': 0.0005483743155463061, 'lambda_val': 0.009979973253137004, 'batch_size': 1030, 'optimizer': 'Adam'}. Best is trial 42 with value: 0.06701910241028815.
2026-05-19 00:36:37,107 - experiment_functions - INFO - Early stopping at epoch 500. Best Recall: 0.0052
2026-05-19 00:36:37,217 - optuna.study.study - INFO - Trial 75 finished with value: 0.005180815690997547 and parameters: {'n_layers': 1, 'embedding_dim': 96, 'lr': 0.0005407084211506808, 'lambda_val': 0.05637492035655684, 'batch_size': 617, 'optimizer': 'Adam'}. Best is trial 42 with value: 0.06701910241028815.
2026-05-19 00:36:52,504 - optuna.study._optimize - INFO - Trial 76 pruned. 
2026-05-19 00:37:02,898 - experiment_functions - INFO - Early stopping at epoch 500. Best Recall: 0.0048
2026-05-19 00:37:02,988 - optuna.study.study - INFO - Trial 77 finished with value: 0.004775553546774449 and parameters: {'n_layers': 1, 'embedding_dim': 64, 'lr': 0.00010287744729525088, 'lambda_val': 0.010563730106954737, 'batch_size': 718, 'optimizer': 'Adam'}. Best is trial 42 with value: 0.06701910241028815.
2026-05-19 00:37:18,371 - experiment_functions - INFO - Early stopping at epoch 1050. Best Recall: 0.0664
2026-05-19 00:37:18,468 - optuna.study.study - INFO - Trial 78 finished with value: 0.0663654035815405 and parameters: {'n_layers': 1, 'embedding_dim': 64, 'lr': 0.000909159731109987, 'lambda_val': 0.00013901396104262287, 'batch_size': 1095, 'optimizer': 'RMSprop'}. Best is trial 42 with value: 0.06701910241028815.
2026-05-19 00:37:25,802 - experiment_functions - INFO - Early stopping at epoch 500. Best Recall: 0.0053
2026-05-19 00:37:25,889 - optuna.study.study - INFO - Trial 79 finished with value: 0.0053268805514202315 and parameters: {'n_layers': 1, 'embedding_dim': 64, 'lr': 0.000316467328145647, 'lambda_val': 0.02525164602637492, 'batch_size': 1009, 'optimizer': 'RMSprop'}. Best is trial 42 with value: 0.06701910241028815.
2026-05-19 00:37:45,253 - experiment_functions - INFO - Early stopping at epoch 1300. Best Recall: 0.0637
2026-05-19 00:37:45,354 - optuna.study.study - INFO - Trial 80 finished with value: 0.06370288862443498 and parameters: {'n_layers': 1, 'embedding_dim': 64, 'lr': 0.0008410123724808438, 'lambda_val': 0.000133395775509511, 'batch_size': 855, 'optimizer': 'RMSprop'}. Best is trial 42 with value: 0.06701910241028815.
2026-05-19 00:38:02,605 - experiment_functions - INFO - Early stopping at epoch 1200. Best Recall: 0.0676
2026-05-19 00:38:02,698 - optuna.study.study - INFO - Trial 81 finished with value: 0.06761526536675438 and parameters: {'n_layers': 1, 'embedding_dim': 64, 'lr': 0.0008353359985717755, 'lambda_val': 0.00017447449654893173, 'batch_size': 861, 'optimizer': 'RMSprop'}. Best is trial 81 with value: 0.06761526536675438.
2026-05-19 00:38:13,921 - experiment_functions - INFO - Early stopping at epoch 700. Best Recall: 0.0367
2026-05-19 00:38:14,018 - optuna.study.study - INFO - Trial 82 finished with value: 0.0367443008704241 and parameters: {'n_layers': 4, 'embedding_dim': 64, 'lr': 0.0005847439545374661, 'lambda_val': 0.0002198339272356572, 'batch_size': 1073, 'optimizer': 'RMSprop'}. Best is trial 81 with value: 0.06761526536675438.
2026-05-19 00:38:29,973 - experiment_functions - INFO - Early stopping at epoch 1050. Best Recall: 0.0674
2026-05-19 00:38:30,084 - optuna.study.study - INFO - Trial 83 finished with value: 0.06740753968760875 and parameters: {'n_layers': 1, 'embedding_dim': 64, 'lr': 0.0011168354334245131, 'lambda_val': 0.00017312644185024184, 'batch_size': 539, 'optimizer': 'RMSprop'}. Best is trial 81 with value: 0.06761526536675438.
2026-05-19 00:38:44,834 - experiment_functions - INFO - Early stopping at epoch 850. Best Recall: 0.0553
2026-05-19 00:38:44,925 - optuna.study.study - INFO - Trial 84 finished with value: 0.05526377224223874 and parameters: {'n_layers': 1, 'embedding_dim': 64, 'lr': 0.001262279562370124, 'lambda_val': 0.00015945369520865743, 'batch_size': 684, 'optimizer': 'RMSprop'}. Best is trial 81 with value: 0.06761526536675438.
2026-05-19 00:38:58,931 - optuna.study._optimize - INFO - Trial 85 pruned. 
2026-05-19 00:39:34,903 - experiment_functions - INFO - Early stopping at epoch 2500. Best Recall: 0.0718
2026-05-19 00:39:34,995 - optuna.study.study - INFO - Trial 86 finished with value: 0.07177725012789209 and parameters: {'n_layers': 1, 'embedding_dim': 64, 'lr': 0.0006693675295171654, 'lambda_val': 0.0005352089387698675, 'batch_size': 769, 'optimizer': 'RMSprop'}. Best is trial 86 with value: 0.07177725012789209.
2026-05-19 00:39:48,877 - optuna.study._optimize - INFO - Trial 87 pruned. 
2026-05-19 00:40:07,141 - experiment_functions - INFO - Early stopping at epoch 1200. Best Recall: 0.0602
2026-05-19 00:40:07,251 - optuna.study.study - INFO - Trial 88 finished with value: 0.06023368709880746 and parameters: {'n_layers': 1, 'embedding_dim': 128, 'lr': 0.0007477182878420924, 'lambda_val': 0.000361581390224663, 'batch_size': 908, 'optimizer': 'RMSprop'}. Best is trial 86 with value: 0.07177725012789209.
2026-05-19 00:41:04,761 - optuna.study.study - INFO - Trial 89 finished with value: 0.06942922784981283 and parameters: {'n_layers': 2, 'embedding_dim': 64, 'lr': 0.00031187860342551894, 'lambda_val': 9.895836878429725e-05, 'batch_size': 765, 'optimizer': 'RMSprop'}. Best is trial 86 with value: 0.07177725012789209.
2026-05-19 00:41:19,413 - optuna.study._optimize - INFO - Trial 90 pruned. 
2026-05-19 00:41:37,142 - optuna.study._optimize - INFO - Trial 91 pruned. 
2026-05-19 00:41:52,189 - experiment_functions - INFO - Early stopping at epoch 850. Best Recall: 0.0563
2026-05-19 00:41:52,279 - optuna.study.study - INFO - Trial 92 finished with value: 0.05626110747542189 and parameters: {'n_layers': 2, 'embedding_dim': 64, 'lr': 0.0006376558327058448, 'lambda_val': 7.107059368797272e-05, 'batch_size': 925, 'optimizer': 'RMSprop'}. Best is trial 86 with value: 0.07177725012789209.
2026-05-19 00:42:08,073 - experiment_functions - INFO - Early stopping at epoch 1150. Best Recall: 0.0667
2026-05-19 00:42:08,184 - optuna.study.study - INFO - Trial 93 finished with value: 0.06669410867173571 and parameters: {'n_layers': 1, 'embedding_dim': 64, 'lr': 0.0009651239440665035, 'lambda_val': 0.00021707425743436236, 'batch_size': 779, 'optimizer': 'RMSprop'}. Best is trial 86 with value: 0.07177725012789209.
2026-05-19 00:42:26,726 - experiment_functions - INFO - Early stopping at epoch 1150. Best Recall: 0.0683
2026-05-19 00:42:26,825 - optuna.study.study - INFO - Trial 94 finished with value: 0.06829053330351936 and parameters: {'n_layers': 1, 'embedding_dim': 64, 'lr': 0.000938922660782178, 'lambda_val': 0.0001953140056961515, 'batch_size': 670, 'optimizer': 'RMSprop'}. Best is trial 86 with value: 0.07177725012789209.
2026-05-19 00:42:36,726 - experiment_functions - INFO - Early stopping at epoch 650. Best Recall: 0.0389
2026-05-19 00:42:36,845 - optuna.study.study - INFO - Trial 95 finished with value: 0.03890149672897092 and parameters: {'n_layers': 3, 'embedding_dim': 64, 'lr': 0.0009521058558703782, 'lambda_val': 0.00018195686303324713, 'batch_size': 629, 'optimizer': 'RMSprop'}. Best is trial 86 with value: 0.07177725012789209.
2026-05-19 00:42:51,332 - optuna.study._optimize - INFO - Trial 96 pruned. 
2026-05-19 00:43:01,197 - experiment_functions - INFO - Early stopping at epoch 650. Best Recall: 0.0474
2026-05-19 00:43:01,299 - optuna.study.study - INFO - Trial 97 finished with value: 0.04738620117090101 and parameters: {'n_layers': 2, 'embedding_dim': 64, 'lr': 0.001186354588294841, 'lambda_val': 0.0005230032836389068, 'batch_size': 695, 'optimizer': 'RMSprop'}. Best is trial 86 with value: 0.07177725012789209.
2026-05-19 00:43:16,199 - experiment_functions - INFO - Early stopping at epoch 850. Best Recall: 0.0567
2026-05-19 00:43:16,299 - optuna.study.study - INFO - Trial 98 finished with value: 0.05672263548879651 and parameters: {'n_layers': 1, 'embedding_dim': 256, 'lr': 0.0009049635906606417, 'lambda_val': 0.00010808579153333572, 'batch_size': 864, 'optimizer': 'RMSprop'}. Best is trial 86 with value: 0.07177725012789209.
2026-05-19 00:43:37,490 - experiment_functions - INFO - Early stopping at epoch 1450. Best Recall: 0.0690
2026-05-19 00:43:37,579 - optuna.study.study - INFO - Trial 99 finished with value: 0.0690094163641385 and parameters: {'n_layers': 1, 'embedding_dim': 96, 'lr': 0.0007578776361072181, 'lambda_val': 4.210054413288445e-05, 'batch_size': 777, 'optimizer': 'RMSprop'}. Best is trial 86 with value: 0.07177725012789209.
2026-05-19 00:43:52,930 - optuna.study._optimize - INFO - Trial 100 pruned. 
2026-05-19 00:44:13,335 - experiment_functions - INFO - Early stopping at epoch 1400. Best Recall: 0.0663
2026-05-19 00:44:13,425 - optuna.study.study - INFO - Trial 101 finished with value: 0.06634651170892296 and parameters: {'n_layers': 1, 'embedding_dim': 96, 'lr': 0.0006646752837360507, 'lambda_val': 3.380659453264216e-05, 'batch_size': 785, 'optimizer': 'RMSprop'}. Best is trial 86 with value: 0.07177725012789209.
2026-05-19 00:44:24,521 - experiment_functions - INFO - Early stopping at epoch 700. Best Recall: 0.0594
2026-05-19 00:44:24,612 - optuna.study.study - INFO - Trial 102 finished with value: 0.059416621816940386 and parameters: {'n_layers': 1, 'embedding_dim': 96, 'lr': 0.0013293178732473865, 'lambda_val': 0.0002676274835494567, 'batch_size': 991, 'optimizer': 'RMSprop'}. Best is trial 86 with value: 0.07177725012789209.
2026-05-19 00:44:45,771 - experiment_functions - INFO - Early stopping at epoch 1300. Best Recall: 0.0717
2026-05-19 00:44:45,860 - optuna.study.study - INFO - Trial 103 finished with value: 0.07170476369824585 and parameters: {'n_layers': 1, 'embedding_dim': 96, 'lr': 0.0008221568138275904, 'lambda_val': 3.8525782236849e-05, 'batch_size': 697, 'optimizer': 'RMSprop'}. Best is trial 86 with value: 0.07177725012789209.
2026-05-19 00:45:00,982 - optuna.study._optimize - INFO - Trial 104 pruned. 
2026-05-19 00:45:26,648 - experiment_functions - INFO - Early stopping at epoch 1800. Best Recall: 0.0642
2026-05-19 00:45:26,746 - optuna.study.study - INFO - Trial 105 finished with value: 0.06417591100200228 and parameters: {'n_layers': 1, 'embedding_dim': 96, 'lr': 0.00041005239808087555, 'lambda_val': 0.0007519560953325281, 'batch_size': 2690, 'optimizer': 'RMSprop'}. Best is trial 86 with value: 0.07177725012789209.
2026-05-19 00:45:46,997 - experiment_functions - INFO - Early stopping at epoch 1400. Best Recall: 0.0676
2026-05-19 00:45:47,087 - optuna.study.study - INFO - Trial 106 finished with value: 0.0675981945012338 and parameters: {'n_layers': 1, 'embedding_dim': 96, 'lr': 0.0007429629895687057, 'lambda_val': 0.00019433281766591292, 'batch_size': 756, 'optimizer': 'RMSprop'}. Best is trial 86 with value: 0.07177725012789209.
2026-05-19 00:45:59,452 - experiment_functions - INFO - Early stopping at epoch 700. Best Recall: 0.0575
2026-05-19 00:45:59,531 - optuna.study.study - INFO - Trial 107 finished with value: 0.05749887076285607 and parameters: {'n_layers': 1, 'embedding_dim': 96, 'lr': 0.001542801181213267, 'lambda_val': 3.944033081334216e-05, 'batch_size': 743, 'optimizer': 'RMSprop'}. Best is trial 86 with value: 0.07177725012789209.
2026-05-19 00:46:11,403 - experiment_functions - INFO - Early stopping at epoch 800. Best Recall: 0.0688
2026-05-19 00:46:11,492 - optuna.study.study - INFO - Trial 108 finished with value: 0.06876413046475267 and parameters: {'n_layers': 1, 'embedding_dim': 96, 'lr': 0.0011071602592668036, 'lambda_val': 0.000423533935651736, 'batch_size': 895, 'optimizer': 'RMSprop'}. Best is trial 86 with value: 0.07177725012789209.
2026-05-19 00:46:25,463 - experiment_functions - INFO - Early stopping at epoch 850. Best Recall: 0.0604
2026-05-19 00:46:25,552 - optuna.study.study - INFO - Trial 109 finished with value: 0.060401413975651096 and parameters: {'n_layers': 1, 'embedding_dim': 96, 'lr': 0.0011266431033352211, 'lambda_val': 0.0004126235453842089, 'batch_size': 899, 'optimizer': 'RMSprop'}. Best is trial 86 with value: 0.07177725012789209.
2026-05-19 00:46:53,464 - experiment_functions - INFO - Early stopping at epoch 1950. Best Recall: 0.0674
2026-05-19 00:46:54,392 - optuna.study.study - INFO - Trial 110 finished with value: 0.06741174201366477 and parameters: {'n_layers': 1, 'embedding_dim': 96, 'lr': 0.0007329131280884242, 'lambda_val': 0.0001991142543565536, 'batch_size': 519, 'optimizer': 'RMSprop'}. Best is trial 86 with value: 0.07177725012789209.
2026-05-19 00:47:18,563 - experiment_functions - INFO - Early stopping at epoch 1650. Best Recall: 0.0709
2026-05-19 00:47:18,661 - optuna.study.study - INFO - Trial 111 finished with value: 0.07085410371952885 and parameters: {'n_layers': 1, 'embedding_dim': 96, 'lr': 0.0007604821616335316, 'lambda_val': 0.00019662236817806245, 'batch_size': 585, 'optimizer': 'RMSprop'}. Best is trial 86 with value: 0.07177725012789209.
2026-05-19 00:47:41,801 - experiment_functions - INFO - Early stopping at epoch 1600. Best Recall: 0.0664
2026-05-19 00:47:41,901 - optuna.study.study - INFO - Trial 112 finished with value: 0.06641773914210652 and parameters: {'n_layers': 1, 'embedding_dim': 96, 'lr': 0.0008184427357001189, 'lambda_val': 0.00027313077154262255, 'batch_size': 574, 'optimizer': 'RMSprop'}. Best is trial 86 with value: 0.07177725012789209.
2026-05-19 00:48:07,932 - experiment_functions - INFO - Early stopping at epoch 1750. Best Recall: 0.0683
2026-05-19 00:48:08,039 - optuna.study.study - INFO - Trial 113 finished with value: 0.06826454485235524 and parameters: {'n_layers': 1, 'embedding_dim': 96, 'lr': 0.0006772348633311763, 'lambda_val': 0.00017566707767026314, 'batch_size': 650, 'optimizer': 'RMSprop'}. Best is trial 86 with value: 0.07177725012789209.
2026-05-19 00:48:30,099 - optuna.study._optimize - INFO - Trial 114 pruned. 
2026-05-19 00:48:43,116 - optuna.study._optimize - INFO - Trial 115 pruned. 
2026-05-19 00:48:58,217 - optuna.study._optimize - INFO - Trial 116 pruned. 
2026-05-19 00:49:28,947 - experiment_functions - INFO - Early stopping at epoch 2250. Best Recall: 0.0703
2026-05-19 00:49:29,037 - optuna.study.study - INFO - Trial 117 finished with value: 0.07025492671335909 and parameters: {'n_layers': 1, 'embedding_dim': 96, 'lr': 0.0006196381172542145, 'lambda_val': 0.00047154851140105444, 'batch_size': 717, 'optimizer': 'RMSprop'}. Best is trial 86 with value: 0.07177725012789209.
2026-05-19 00:49:54,527 - experiment_functions - INFO - Early stopping at epoch 1850. Best Recall: 0.0664
