2026-05-18 17:04:36,048 - optuna.study.study - INFO - Trial 190 finished with value: 0.07002188820250446 and parameters: {'n_layers': 1, 'embedding_dim': 32, 'lr': 0.0015072797050864014, 'lambda_val': 8.20754009080335e-05, 'batch_size': 850, 'optimizer': 'Adam'}. Best is trial 182 with value: 0.07364666864617787.
2026-05-18 17:04:51,877 - experiment_functions - INFO - Early stopping at epoch 1100. Best Recall: 0.0639
2026-05-18 17:04:51,967 - optuna.study.study - INFO - Trial 191 finished with value: 0.063900660925933 and parameters: {'n_layers': 1, 'embedding_dim': 32, 'lr': 0.0014441861376585778, 'lambda_val': 8.38504143939902e-05, 'batch_size': 728, 'optimizer': 'Adam'}. Best is trial 182 with value: 0.07364666864617787.
2026-05-18 17:05:06,111 - experiment_functions - INFO - Early stopping at epoch 1100. Best Recall: 0.0656
2026-05-18 17:05:06,203 - optuna.study.study - INFO - Trial 192 finished with value: 0.06557562819733026 and parameters: {'n_layers': 1, 'embedding_dim': 32, 'lr': 0.0013158379703599506, 'lambda_val': 6.738526459930001e-05, 'batch_size': 818, 'optimizer': 'Adam'}. Best is trial 182 with value: 0.07364666864617787.
2026-05-18 17:05:19,383 - experiment_functions - INFO - Early stopping at epoch 950. Best Recall: 0.0597
2026-05-18 17:05:19,485 - optuna.study.study - INFO - Trial 193 finished with value: 0.05968592353221196 and parameters: {'n_layers': 1, 'embedding_dim': 32, 'lr': 0.00185089865027506, 'lambda_val': 0.00014866453943758345, 'batch_size': 683, 'optimizer': 'Adam'}. Best is trial 182 with value: 0.07364666864617787.
2026-05-18 17:05:27,253 - experiment_functions - INFO - Early stopping at epoch 550. Best Recall: 0.0323
2026-05-18 17:05:27,345 - optuna.study.study - INFO - Trial 194 finished with value: 0.0323110547792764 and parameters: {'n_layers': 1, 'embedding_dim': 32, 'lr': 0.025689134962583602, 'lambda_val': 5.206288674246684e-05, 'batch_size': 579, 'optimizer': 'Adam'}. Best is trial 182 with value: 0.07364666864617787.
2026-05-18 17:05:55,243 - experiment_functions - INFO - Early stopping at epoch 1400. Best Recall: 0.0692
2026-05-18 17:05:56,008 - optuna.study.study - INFO - Trial 195 finished with value: 0.06924748340404126 and parameters: {'n_layers': 1, 'embedding_dim': 32, 'lr': 0.001142261453848567, 'lambda_val': 0.00024720943233145403, 'batch_size': 747, 'optimizer': 'Adam'}. Best is trial 182 with value: 0.07364666864617787.
2026-05-18 17:06:09,559 - experiment_functions - INFO - Early stopping at epoch 950. Best Recall: 0.0617
2026-05-18 17:06:09,660 - optuna.study.study - INFO - Trial 196 finished with value: 0.06168065556530795 and parameters: {'n_layers': 1, 'embedding_dim': 32, 'lr': 0.0015420411465665268, 'lambda_val': 0.00024423886201215277, 'batch_size': 847, 'optimizer': 'Adam'}. Best is trial 182 with value: 0.07364666864617787.
2026-05-18 17:06:29,655 - experiment_functions - INFO - Early stopping at epoch 1450. Best Recall: 0.0642
2026-05-18 17:06:29,766 - optuna.study.study - INFO - Trial 197 finished with value: 0.06420530573287969 and parameters: {'n_layers': 1, 'embedding_dim': 32, 'lr': 0.0010238881903526641, 'lambda_val': 0.00023866299389406923, 'batch_size': 944, 'optimizer': 'Adam'}. Best is trial 182 with value: 0.07364666864617787.
2026-05-18 17:06:40,451 - experiment_functions - INFO - Early stopping at epoch 750. Best Recall: 0.0567
2026-05-18 17:06:40,553 - optuna.study.study - INFO - Trial 198 finished with value: 0.056721836024319565 and parameters: {'n_layers': 1, 'embedding_dim': 32, 'lr': 0.0024952330481907347, 'lambda_val': 0.00010814123779224918, 'batch_size': 765, 'optimizer': 'Adam'}. Best is trial 182 with value: 0.07364666864617787.
2026-05-18 17:06:48,539 - experiment_functions - INFO - Early stopping at epoch 500. Best Recall: 0.0049
2026-05-18 17:06:48,631 - optuna.study.study - INFO - Trial 199 finished with value: 0.004911882924597722 and parameters: {'n_layers': 1, 'embedding_dim': 32, 'lr': 1.040224693314907e-05, 'lambda_val': 7.703495950923501e-05, 'batch_size': 624, 'optimizer': 'Adam'}. Best is trial 182 with value: 0.07364666864617787.
2026-05-18 17:07:02,102 - optuna.study._optimize - INFO - Trial 200 pruned. 
2026-05-18 17:07:19,415 - experiment_functions - INFO - Early stopping at epoch 1250. Best Recall: 0.0689
2026-05-18 17:07:19,494 - optuna.study.study - INFO - Trial 201 finished with value: 0.06891156093739897 and parameters: {'n_layers': 1, 'embedding_dim': 32, 'lr': 0.0011958587194091002, 'lambda_val': 4.7306143741650057e-05, 'batch_size': 729, 'optimizer': 'Adam'}. Best is trial 182 with value: 0.07364666864617787.
2026-05-18 17:07:39,669 - experiment_functions - INFO - Early stopping at epoch 1500. Best Recall: 0.0647
2026-05-18 17:07:39,760 - optuna.study.study - INFO - Trial 202 finished with value: 0.06472088657036984 and parameters: {'n_layers': 1, 'embedding_dim': 32, 'lr': 0.0011011005257553492, 'lambda_val': 7.221199126859411e-05, 'batch_size': 747, 'optimizer': 'Adam'}. Best is trial 182 with value: 0.07364666864617787.
2026-05-18 17:07:55,678 - experiment_functions - INFO - Early stopping at epoch 1100. Best Recall: 0.0678
2026-05-18 17:07:55,778 - optuna.study.study - INFO - Trial 203 finished with value: 0.0677792579829477 and parameters: {'n_layers': 1, 'embedding_dim': 32, 'lr': 0.0014648590698022085, 'lambda_val': 9.142044774284592e-05, 'batch_size': 573, 'optimizer': 'Adam'}. Best is trial 182 with value: 0.07364666864617787.
2026-05-18 17:08:08,565 - experiment_functions - INFO - Early stopping at epoch 850. Best Recall: 0.0653
2026-05-18 17:08:08,665 - optuna.study.study - INFO - Trial 204 finished with value: 0.06532762572786167 and parameters: {'n_layers': 1, 'embedding_dim': 32, 'lr': 0.001932225004297533, 'lambda_val': 5.191933110245909e-05, 'batch_size': 831, 'optimizer': 'Adam'}. Best is trial 182 with value: 0.07364666864617787.
2026-05-18 17:08:27,288 - experiment_functions - INFO - Early stopping at epoch 1300. Best Recall: 0.0661
2026-05-18 17:08:27,378 - optuna.study.study - INFO - Trial 205 finished with value: 0.0660513702418582 and parameters: {'n_layers': 1, 'embedding_dim': 32, 'lr': 0.0012313584226503686, 'lambda_val': 0.00016891666400827696, 'batch_size': 686, 'optimizer': 'Adam'}. Best is trial 182 with value: 0.07364666864617787.
2026-05-18 17:08:41,459 - optuna.study._optimize - INFO - Trial 206 pruned. 
2026-05-18 17:08:48,568 - experiment_functions - INFO - Early stopping at epoch 500. Best Recall: 0.0047
2026-05-18 17:08:48,702 - optuna.study.study - INFO - Trial 207 finished with value: 0.004691853807579373 and parameters: {'n_layers': 1, 'embedding_dim': 32, 'lr': 0.0008653702531928923, 'lambda_val': 7.473746809085957e-05, 'batch_size': 621, 'optimizer': 'SGD'}. Best is trial 182 with value: 0.07364666864617787.
2026-05-18 17:09:02,065 - experiment_functions - INFO - Early stopping at epoch 950. Best Recall: 0.0663
2026-05-18 17:09:02,164 - optuna.study.study - INFO - Trial 208 finished with value: 0.06626978191007582 and parameters: {'n_layers': 1, 'embedding_dim': 32, 'lr': 0.0015360894178048858, 'lambda_val': 0.00011406930216606048, 'batch_size': 862, 'optimizer': 'Adam'}. Best is trial 182 with value: 0.07364666864617787.
2026-05-18 17:09:17,166 - experiment_functions - INFO - Early stopping at epoch 1050. Best Recall: 0.0627
2026-05-18 17:09:17,256 - optuna.study.study - INFO - Trial 209 finished with value: 0.0626724095328759 and parameters: {'n_layers': 1, 'embedding_dim': 128, 'lr': 0.0010640947187766686, 'lambda_val': 4.8304592113966646e-05, 'batch_size': 987, 'optimizer': 'Adam'}. Best is trial 182 with value: 0.07364666864617787.
2026-05-18 17:09:33,875 - experiment_functions - INFO - Early stopping at epoch 1200. Best Recall: 0.0687
2026-05-18 17:09:34,009 - optuna.study.study - INFO - Trial 210 finished with value: 0.06871852119969105 and parameters: {'n_layers': 1, 'embedding_dim': 32, 'lr': 0.001314923871442952, 'lambda_val': 0.0002808609108837667, 'batch_size': 665, 'optimizer': 'Adam'}. Best is trial 182 with value: 0.07364666864617787.
2026-05-18 17:09:45,876 - experiment_functions - INFO - Early stopping at epoch 850. Best Recall: 0.0572
2026-05-18 17:09:45,999 - optuna.study.study - INFO - Trial 211 finished with value: 0.05715716824111223 and parameters: {'n_layers': 1, 'embedding_dim': 32, 'lr': 0.0012298178709261101, 'lambda_val': 0.00024409971633098363, 'batch_size': 3029, 'optimizer': 'Adam'}. Best is trial 182 with value: 0.07364666864617787.
2026-05-18 17:10:00,465 - experiment_functions - INFO - Early stopping at epoch 1000. Best Recall: 0.0647
2026-05-18 17:10:00,564 - optuna.study.study - INFO - Trial 212 finished with value: 0.06473340106791159 and parameters: {'n_layers': 1, 'embedding_dim': 32, 'lr': 0.0018096144783790419, 'lambda_val': 0.0002846962907667459, 'batch_size': 512, 'optimizer': 'Adam'}. Best is trial 182 with value: 0.07364666864617787.
2026-05-18 17:10:11,101 - experiment_functions - INFO - Early stopping at epoch 700. Best Recall: 0.0484
2026-05-18 17:10:11,201 - optuna.study.study - INFO - Trial 213 finished with value: 0.04843307469865439 and parameters: {'n_layers': 3, 'embedding_dim': 32, 'lr': 0.0014186359782199275, 'lambda_val': 0.00020665272509014053, 'batch_size': 692, 'optimizer': 'Adam'}. Best is trial 182 with value: 0.07364666864617787.
2026-05-18 17:10:39,034 - experiment_functions - INFO - Early stopping at epoch 2000. Best Recall: 0.0725
2026-05-18 17:10:39,135 - optuna.study.study - INFO - Trial 214 finished with value: 0.07254806054231842 and parameters: {'n_layers': 1, 'embedding_dim': 32, 'lr': 0.0009586504700232846, 'lambda_val': 6.245406071270543e-05, 'batch_size': 626, 'optimizer': 'Adam'}. Best is trial 182 with value: 0.07364666864617787.
2026-05-18 17:11:04,626 - experiment_functions - INFO - Early stopping at epoch 1900. Best Recall: 0.0692
2026-05-18 17:11:04,724 - optuna.study.study - INFO - Trial 215 finished with value: 0.0692415821526745 and parameters: {'n_layers': 1, 'embedding_dim': 32, 'lr': 0.0009043675871827808, 'lambda_val': 6.330049557839406e-05, 'batch_size': 740, 'optimizer': 'Adam'}. Best is trial 182 with value: 0.07364666864617787.
2026-05-18 17:11:18,336 - optuna.study._optimize - INFO - Trial 216 pruned. 
2026-05-18 17:11:33,285 - optuna.study._optimize - INFO - Trial 217 pruned. 
2026-05-18 17:11:48,155 - optuna.study._optimize - INFO - Trial 218 pruned. 
2026-05-18 17:12:10,752 - experiment_functions - INFO - Early stopping at epoch 1650. Best Recall: 0.0673
2026-05-18 17:12:10,841 - optuna.study.study - INFO - Trial 219 finished with value: 0.06728678682130589 and parameters: {'n_layers': 1, 'embedding_dim': 32, 'lr': 0.001003405150898173, 'lambda_val': 4.360835624789822e-05, 'batch_size': 759, 'optimizer': 'Adam'}. Best is trial 182 with value: 0.07364666864617787.
2026-05-18 17:12:25,653 - optuna.study._optimize - INFO - Trial 220 pruned. 
2026-05-18 17:12:46,204 - experiment_functions - INFO - Early stopping at epoch 1450. Best Recall: 0.0683
2026-05-18 17:12:46,293 - optuna.study.study - INFO - Trial 221 finished with value: 0.06827904109977523 and parameters: {'n_layers': 1, 'embedding_dim': 32, 'lr': 0.001165875432731954, 'lambda_val': 5.518940281321465e-05, 'batch_size': 615, 'optimizer': 'Adam'}. Best is trial 182 with value: 0.07364666864617787.
2026-05-18 17:12:59,844 - optuna.study._optimize - INFO - Trial 222 pruned. 
2026-05-18 17:13:13,597 - optuna.study._optimize - INFO - Trial 223 pruned. 
2026-05-18 17:13:34,352 - experiment_functions - INFO - Early stopping at epoch 950. Best Recall: 0.0642
2026-05-18 17:13:35,118 - optuna.study.study - INFO - Trial 224 finished with value: 0.06424435084712468 and parameters: {'n_layers': 1, 'embedding_dim': 32, 'lr': 0.0016476576492140751, 'lambda_val': 8.619237257196943e-05, 'batch_size': 722, 'optimizer': 'Adam'}. Best is trial 182 with value: 0.07364666864617787.
2026-05-18 17:13:51,174 - experiment_functions - INFO - Early stopping at epoch 1000. Best Recall: 0.0657
2026-05-18 17:13:51,263 - optuna.study.study - INFO - Trial 225 finished with value: 0.06566514917526836 and parameters: {'n_layers': 1, 'embedding_dim': 32, 'lr': 0.0011299744879215898, 'lambda_val': 6.328677902734765e-05, 'batch_size': 1624, 'optimizer': 'Adam'}. Best is trial 182 with value: 0.07364666864617787.
2026-05-18 17:14:07,253 - experiment_functions - INFO - Early stopping at epoch 1150. Best Recall: 0.0657
2026-05-18 17:14:07,388 - optuna.study.study - INFO - Trial 226 finished with value: 0.06567160554242922 and parameters: {'n_layers': 1, 'embedding_dim': 32, 'lr': 0.0014393816249048238, 'lambda_val': 0.00013267791930298258, 'batch_size': 570, 'optimizer': 'Adam'}. Best is trial 182 with value: 0.07364666864617787.
2026-05-18 17:14:19,938 - experiment_functions - INFO - Early stopping at epoch 850. Best Recall: 0.0630
2026-05-18 17:14:20,060 - optuna.study.study - INFO - Trial 227 finished with value: 0.0630061558551429 and parameters: {'n_layers': 1, 'embedding_dim': 32, 'lr': 0.0021315776556225237, 'lambda_val': 4.993100844634801e-05, 'batch_size': 788, 'optimizer': 'Adam'}. Best is trial 182 with value: 0.07364666864617787.
2026-05-18 17:14:45,145 - experiment_functions - INFO - Early stopping at epoch 1850. Best Recall: 0.0719
2026-05-18 17:14:45,235 - optuna.study.study - INFO - Trial 228 finished with value: 0.0718559027280266 and parameters: {'n_layers': 1, 'embedding_dim': 32, 'lr': 0.0009146686554903422, 'lambda_val': 7.71478576381493e-05, 'batch_size': 647, 'optimizer': 'Adam'}. Best is trial 182 with value: 0.07364666864617787.
2026-05-18 17:14:58,968 - optuna.study._optimize - INFO - Trial 229 pruned. 
2026-05-18 17:15:12,653 - optuna.study._optimize - INFO - Trial 230 pruned. 
2026-05-18 17:15:37,862 - experiment_functions - INFO - Early stopping at epoch 1800. Best Recall: 0.0677
2026-05-18 17:15:37,972 - optuna.study.study - INFO - Trial 231 finished with value: 0.0676707992223808 and parameters: {'n_layers': 1, 'embedding_dim': 32, 'lr': 0.0010019645162778102, 'lambda_val': 5.5574407392192647e-05, 'batch_size': 645, 'optimizer': 'Adam'}. Best is trial 182 with value: 0.07364666864617787.
2026-05-18 17:15:57,572 - experiment_functions - INFO - Early stopping at epoch 1400. Best Recall: 0.0711
2026-05-18 17:15:57,652 - optuna.study.study - INFO - Trial 232 finished with value: 0.07111300077848594 and parameters: {'n_layers': 1, 'embedding_dim': 32, 'lr': 0.0012919897814751035, 'lambda_val': 8.030407067103408e-05, 'batch_size': 642, 'optimizer': 'Adam'}. Best is trial 182 with value: 0.07364666864617787.
2026-05-18 17:16:14,268 - experiment_functions - INFO - Early stopping at epoch 1200. Best Recall: 0.0689
2026-05-18 17:16:14,388 - optuna.study.study - INFO - Trial 233 finished with value: 0.06886964622574124 and parameters: {'n_layers': 1, 'embedding_dim': 32, 'lr': 0.001224647215463061, 'lambda_val': 8.158529222194025e-05, 'batch_size': 727, 'optimizer': 'Adam'}. Best is trial 182 with value: 0.07364666864617787.
2026-05-18 17:16:31,198 - experiment_functions - INFO - Early stopping at epoch 1200. Best Recall: 0.0686
2026-05-18 17:16:31,298 - optuna.study.study - INFO - Trial 234 finished with value: 0.06862400002402433 and parameters: {'n_layers': 1, 'embedding_dim': 32, 'lr': 0.0012034353742461806, 'lambda_val': 8.478231798530115e-05, 'batch_size': 755, 'optimizer': 'Adam'}. Best is trial 182 with value: 0.07364666864617787.
2026-05-18 17:16:48,702 - optuna.study._optimize - INFO - Trial 235 pruned. 
2026-05-18 17:17:05,012 - experiment_functions - INFO - Early stopping at epoch 1150. Best Recall: 0.0661
2026-05-18 17:17:05,102 - optuna.study.study - INFO - Trial 236 finished with value: 0.06613538291674104 and parameters: {'n_layers': 1, 'embedding_dim': 32, 'lr': 0.0012756460656219864, 'lambda_val': 3.797624365141634e-05, 'batch_size': 845, 'optimizer': 'Adam'}. Best is trial 182 with value: 0.07364666864617787.
2026-05-18 17:17:27,251 - experiment_functions - INFO - Early stopping at epoch 1550. Best Recall: 0.0678
2026-05-18 17:17:27,364 - optuna.study.study - INFO - Trial 237 finished with value: 0.06780565678112066 and parameters: {'n_layers': 1, 'embedding_dim': 32, 'lr': 0.0010736347301430035, 'lambda_val': 2.901354067834315e-05, 'batch_size': 692, 'optimizer': 'Adam'}. Best is trial 182 with value: 0.07364666864617787.
2026-05-18 17:17:41,179 - optuna.study._optimize - INFO - Trial 238 pruned. 
2026-05-18 17:18:23,580 - experiment_functions - INFO - Early stopping at epoch 2500. Best Recall: 0.0727
2026-05-18 17:18:23,678 - optuna.study.study - INFO - Trial 239 finished with value: 0.07273916933074646 and parameters: {'n_layers': 1, 'embedding_dim': 32, 'lr': 0.000870168038662563, 'lambda_val': 0.00015687128567287267, 'batch_size': 614, 'optimizer': 'Adam'}. Best is trial 182 with value: 0.07364666864617787.
2026-05-18 17:18:39,194 - optuna.study._optimize - INFO - Trial 240 pruned. 
2026-05-18 17:19:07,332 - experiment_functions - INFO - Early stopping at epoch 2100. Best Recall: 0.0681
2026-05-18 17:19:07,423 - optuna.study.study - INFO - Trial 241 finished with value: 0.0681483369138136 and parameters: {'n_layers': 1, 'embedding_dim': 32, 'lr': 0.0009385105778895549, 'lambda_val': 0.0001402723129073344, 'batch_size': 698, 'optimizer': 'Adam'}. Best is trial 182 with value: 0.07364666864617787.
2026-05-18 17:19:27,623 - optuna.study._optimize - INFO - Trial 242 pruned. 
2026-05-18 17:19:41,061 - optuna.study._optimize - INFO - Trial 243 pruned. 
2026-05-18 17:19:59,971 - experiment_functions - INFO - Early stopping at epoch 1350. Best Recall: 0.0678
2026-05-18 17:20:00,059 - optuna.study.study - INFO - Trial 244 finished with value: 0.06781025514986476 and parameters: {'n_layers': 1, 'embedding_dim': 32, 'lr': 0.0013437495255975978, 'lambda_val': 9.880470009070154e-05, 'batch_size': 581, 'optimizer': 'Adam'}. Best is trial 182 with value: 0.07364666864617787.
2026-05-18 17:20:32,184 - experiment_functions - INFO - Early stopping at epoch 2400. Best Recall: 0.0705
2026-05-18 17:20:32,339 - optuna.study.study - INFO - Trial 245 finished with value: 0.07052665620499893 and parameters: {'n_layers': 1, 'embedding_dim': 32, 'lr': 0.0008556713560334013, 'lambda_val': 6.0500577475674166e-05, 'batch_size': 656, 'optimizer': 'Adam'}. Best is trial 182 with value: 0.07364666864617787.
2026-05-18 17:20:46,396 - optuna.study._optimize - INFO - Trial 246 pruned. 
2026-05-18 17:20:53,415 - experiment_functions - INFO - Early stopping at epoch 500. Best Recall: 0.0044
2026-05-18 17:20:53,549 - optuna.study.study - INFO - Trial 247 finished with value: 0.0044031673080365385 and parameters: {'n_layers': 1, 'embedding_dim': 32, 'lr': 0.0009107103684970085, 'lambda_val': 6.281442222858879e-05, 'batch_size': 875, 'optimizer': 'SGD'}. Best is trial 182 with value: 0.07364666864617787.
2026-05-18 17:21:11,404 - experiment_functions - INFO - Early stopping at epoch 1300. Best Recall: 0.0705
2026-05-18 17:21:11,548 - optuna.study.study - INFO - Trial 248 finished with value: 0.07054354066318907 and parameters: {'n_layers': 1, 'embedding_dim': 32, 'lr': 0.0010644046992771387, 'lambda_val': 0.002158544202892597, 'batch_size': 698, 'optimizer': 'Adam'}. Best is trial 182 with value: 0.07364666864617787.
2026-05-18 17:21:25,305 - optuna.study._optimize - INFO - Trial 249 pruned. 
2026-05-18 17:21:39,351 - optuna.study._optimize - INFO - Trial 250 pruned. 
2026-05-18 17:21:57,857 - experiment_functions - INFO - Early stopping at epoch 1300. Best Recall: 0.0710
2026-05-18 17:21:57,959 - optuna.study.study - INFO - Trial 251 finished with value: 0.0710174229240127 and parameters: {'n_layers': 1, 'embedding_dim': 32, 'lr': 0.0010055707553472191, 'lambda_val': 0.0024163792643569003, 'batch_size': 696, 'optimizer': 'RMSprop'}. Best is trial 182 with value: 0.07364666864617787.
2026-05-18 17:22:21,400 - experiment_functions - INFO - Early stopping at epoch 1750. Best Recall: 0.0709
2026-05-18 17:22:21,546 - optuna.study.study - INFO - Trial 252 finished with value: 0.07090873469961594 and parameters: {'n_layers': 1, 'embedding_dim': 32, 'lr': 0.0009440636642597253, 'lambda_val': 0.0021876123976129827, 'batch_size': 513, 'optimizer': 'RMSprop'}. Best is trial 182 with value: 0.07364666864617787.
2026-05-18 17:22:42,187 - experiment_functions - INFO - Early stopping at epoch 1500. Best Recall: 0.0747
2026-05-18 17:22:42,335 - optuna.study.study - INFO - Trial 253 finished with value: 0.07466919321678188 and parameters: {'n_layers': 1, 'embedding_dim': 32, 'lr': 0.0009635016562977769, 'lambda_val': 0.0028710092093508738, 'batch_size': 519, 'optimizer': 'RMSprop'}. Best is trial 253 with value: 0.07466919321678188.
2026-05-18 17:23:04,091 - experiment_functions - INFO - Early stopping at epoch 1600. Best Recall: 0.0687
2026-05-18 17:23:04,192 - optuna.study.study - INFO - Trial 254 finished with value: 0.06869653504672928 and parameters: {'n_layers': 1, 'embedding_dim': 32, 'lr': 0.0009529967668869753, 'lambda_val': 0.00337524839163329, 'batch_size': 572, 'optimizer': 'RMSprop'}. Best is trial 253 with value: 0.07466919321678188.
2026-05-18 17:23:18,390 - optuna.study._optimize - INFO - Trial 255 pruned. 
2026-05-18 17:23:39,988 - optuna.study._optimize - INFO - Trial 256 pruned. 
2026-05-18 17:23:58,090 - experiment_functions - INFO - Early stopping at epoch 1250. Best Recall: 0.0690
2026-05-18 17:23:58,200 - optuna.study.study - INFO - Trial 257 finished with value: 0.0689558129405751 and parameters: {'n_layers': 1, 'embedding_dim': 96, 'lr': 0.0008815739735951724, 'lambda_val': 0.0029330882164591322, 'batch_size': 556, 'optimizer': 'RMSprop'}. Best is trial 253 with value: 0.07466919321678188.
2026-05-18 17:24:16,706 - experiment_functions - INFO - Early stopping at epoch 1300. Best Recall: 0.0668
