2026-05-18 11:15:35,859 - optuna.study.study - INFO - Trial 134 finished with value: 0.07938715418695877 and parameters: {'n_layers': 1, 'embedding_dim': 256, 'lr': 0.003856697451106928, 'lambda_val': 3.0043839151405295e-05, 'batch_size': 3810, 'optimizer': 'Adam'}. Best is trial 101 with value: 0.08450551456517907.
2026-05-18 11:15:46,634 - experiment_functions - INFO - Early stopping at epoch 650. Best Recall: 0.0800
2026-05-18 11:15:46,735 - optuna.study.study - INFO - Trial 135 finished with value: 0.08004774369461441 and parameters: {'n_layers': 1, 'embedding_dim': 256, 'lr': 0.0013128365201987217, 'lambda_val': 4.699077250216553e-05, 'batch_size': 3417, 'optimizer': 'Adam'}. Best is trial 101 with value: 0.08450551456517907.
2026-05-18 11:15:57,307 - experiment_functions - INFO - Early stopping at epoch 650. Best Recall: 0.0767
2026-05-18 11:15:57,410 - optuna.study.study - INFO - Trial 136 finished with value: 0.0767002087982909 and parameters: {'n_layers': 1, 'embedding_dim': 256, 'lr': 0.0013412324305517535, 'lambda_val': 5.1853022517318894e-05, 'batch_size': 3399, 'optimizer': 'Adam'}. Best is trial 101 with value: 0.08450551456517907.
2026-05-18 11:16:09,352 - experiment_functions - INFO - Early stopping at epoch 800. Best Recall: 0.0849
2026-05-18 11:16:09,488 - optuna.study.study - INFO - Trial 137 finished with value: 0.08493906208815657 and parameters: {'n_layers': 1, 'embedding_dim': 128, 'lr': 0.0010996840701486337, 'lambda_val': 4.284316146825275e-05, 'batch_size': 1265, 'optimizer': 'Adam'}. Best is trial 137 with value: 0.08493906208815657.
2026-05-18 11:16:20,151 - experiment_functions - INFO - Early stopping at epoch 700. Best Recall: 0.0805
2026-05-18 11:16:20,719 - optuna.study.study - INFO - Trial 138 finished with value: 0.08050765773285815 and parameters: {'n_layers': 1, 'embedding_dim': 128, 'lr': 0.0016345387889410482, 'lambda_val': 3.645501675993338e-05, 'batch_size': 1060, 'optimizer': 'Adam'}. Best is trial 137 with value: 0.08493906208815657.
2026-05-18 11:16:29,080 - experiment_functions - INFO - Early stopping at epoch 550. Best Recall: 0.0552
2026-05-18 11:16:29,172 - optuna.study.study - INFO - Trial 139 finished with value: 0.0552250523515459 and parameters: {'n_layers': 1, 'embedding_dim': 128, 'lr': 0.002287537072505408, 'lambda_val': 3.6457840383146556e-05, 'batch_size': 968, 'optimizer': 'RMSprop'}. Best is trial 137 with value: 0.08493906208815657.
2026-05-18 11:16:40,372 - experiment_functions - INFO - Early stopping at epoch 700. Best Recall: 0.0800
2026-05-18 11:16:40,476 - optuna.study.study - INFO - Trial 140 finished with value: 0.07996658079562499 and parameters: {'n_layers': 1, 'embedding_dim': 128, 'lr': 0.0017194451780888945, 'lambda_val': 0.00010527887423914296, 'batch_size': 1188, 'optimizer': 'Adam'}. Best is trial 137 with value: 0.08493906208815657.
2026-05-18 11:16:52,307 - experiment_functions - INFO - Early stopping at epoch 800. Best Recall: 0.0834
2026-05-18 11:16:52,398 - optuna.study.study - INFO - Trial 141 finished with value: 0.08336156333382021 and parameters: {'n_layers': 1, 'embedding_dim': 128, 'lr': 0.0011927990713109212, 'lambda_val': 4.418305254742431e-05, 'batch_size': 887, 'optimizer': 'Adam'}. Best is trial 137 with value: 0.08493906208815657.
2026-05-18 11:17:06,413 - optuna.study._optimize - INFO - Trial 142 pruned. 
2026-05-18 11:17:21,173 - experiment_functions - INFO - Early stopping at epoch 1050. Best Recall: 0.0809
2026-05-18 11:17:21,276 - optuna.study.study - INFO - Trial 143 finished with value: 0.08091074920384023 and parameters: {'n_layers': 1, 'embedding_dim': 64, 'lr': 0.0008098685904469421, 'lambda_val': 2.7071360576986603e-05, 'batch_size': 958, 'optimizer': 'Adam'}. Best is trial 137 with value: 0.08493906208815657.
2026-05-18 11:17:37,500 - experiment_functions - INFO - Early stopping at epoch 1150. Best Recall: 0.0828
2026-05-18 11:17:38,067 - optuna.study.study - INFO - Trial 144 finished with value: 0.08279047962601352 and parameters: {'n_layers': 1, 'embedding_dim': 64, 'lr': 0.0007047416719551228, 'lambda_val': 3.7476238505031214e-05, 'batch_size': 935, 'optimizer': 'Adam'}. Best is trial 137 with value: 0.08493906208815657.
2026-05-18 11:17:52,276 - optuna.study._optimize - INFO - Trial 145 pruned. 
2026-05-18 11:18:06,913 - optuna.study._optimize - INFO - Trial 146 pruned. 
2026-05-18 11:18:38,614 - experiment_functions - INFO - Early stopping at epoch 1650. Best Recall: 0.0886
2026-05-18 11:18:38,716 - optuna.study.study - INFO - Trial 147 finished with value: 0.08860341365890499 and parameters: {'n_layers': 1, 'embedding_dim': 64, 'lr': 0.0005631167580269304, 'lambda_val': 8.271923540488737e-05, 'batch_size': 663, 'optimizer': 'Adam'}. Best is trial 147 with value: 0.08860341365890499.
2026-05-18 11:18:55,067 - optuna.study._optimize - INFO - Trial 148 pruned. 
2026-05-18 11:19:12,360 - experiment_functions - INFO - Early stopping at epoch 1200. Best Recall: 0.0885
2026-05-18 11:19:12,496 - optuna.study.study - INFO - Trial 149 finished with value: 0.08846536238939443 and parameters: {'n_layers': 1, 'embedding_dim': 64, 'lr': 0.0008125205514381451, 'lambda_val': 0.00014005765133693493, 'batch_size': 694, 'optimizer': 'Adam'}. Best is trial 147 with value: 0.08860341365890499.
2026-05-18 11:19:27,324 - optuna.study._optimize - INFO - Trial 150 pruned. 
2026-05-18 11:19:42,991 - experiment_functions - INFO - Early stopping at epoch 1050. Best Recall: 0.0862
2026-05-18 11:19:43,082 - optuna.study.study - INFO - Trial 151 finished with value: 0.08619121660673038 and parameters: {'n_layers': 1, 'embedding_dim': 64, 'lr': 0.0008826471800302752, 'lambda_val': 5.6966970059803165e-05, 'batch_size': 716, 'optimizer': 'Adam'}. Best is trial 147 with value: 0.08860341365890499.
2026-05-18 11:20:05,535 - experiment_functions - INFO - Early stopping at epoch 1500. Best Recall: 0.0850
2026-05-18 11:20:05,638 - optuna.study.study - INFO - Trial 152 finished with value: 0.08503023821716663 and parameters: {'n_layers': 1, 'embedding_dim': 64, 'lr': 0.0007060378569942154, 'lambda_val': 7.499926562368454e-05, 'batch_size': 534, 'optimizer': 'Adam'}. Best is trial 147 with value: 0.08860341365890499.
2026-05-18 11:20:31,678 - experiment_functions - INFO - Early stopping at epoch 1400. Best Recall: 0.0800
2026-05-18 11:20:31,834 - optuna.study.study - INFO - Trial 153 finished with value: 0.08000779947680688 and parameters: {'n_layers': 1, 'embedding_dim': 64, 'lr': 0.00071007344957616, 'lambda_val': 0.00014163101874412808, 'batch_size': 637, 'optimizer': 'Adam'}. Best is trial 147 with value: 0.08860341365890499.
2026-05-18 11:20:47,325 - experiment_functions - INFO - Early stopping at epoch 1000. Best Recall: 0.0806
2026-05-18 11:20:47,415 - optuna.study.study - INFO - Trial 154 finished with value: 0.08055464574977488 and parameters: {'n_layers': 1, 'embedding_dim': 64, 'lr': 0.0009085727356772542, 'lambda_val': 7.746500928675025e-05, 'batch_size': 775, 'optimizer': 'Adam'}. Best is trial 147 with value: 0.08860341365890499.
2026-05-18 11:21:02,202 - optuna.study._optimize - INFO - Trial 155 pruned. 
2026-05-18 11:21:09,590 - experiment_functions - INFO - Early stopping at epoch 500. Best Recall: 0.0053
2026-05-18 11:21:09,693 - optuna.study.study - INFO - Trial 156 finished with value: 0.005348492782077766 and parameters: {'n_layers': 1, 'embedding_dim': 64, 'lr': 0.0008523864206349445, 'lambda_val': 0.00012460949060303435, 'batch_size': 730, 'optimizer': 'SGD'}. Best is trial 147 with value: 0.08860341365890499.
2026-05-18 11:21:39,577 - experiment_functions - INFO - Early stopping at epoch 1350. Best Recall: 0.0834
2026-05-18 11:21:39,677 - optuna.study.study - INFO - Trial 157 finished with value: 0.08339582013176655 and parameters: {'n_layers': 1, 'embedding_dim': 64, 'lr': 0.0006198438798077088, 'lambda_val': 4.2261196711181877e-05, 'batch_size': 974, 'optimizer': 'Adam'}. Best is trial 147 with value: 0.08860341365890499.
2026-05-18 11:22:00,664 - experiment_functions - INFO - Early stopping at epoch 1500. Best Recall: 0.0808
2026-05-18 11:22:00,753 - optuna.study.study - INFO - Trial 158 finished with value: 0.08075420465966104 and parameters: {'n_layers': 1, 'embedding_dim': 64, 'lr': 0.0006205084385663608, 'lambda_val': 4.120599476677297e-05, 'batch_size': 613, 'optimizer': 'Adam'}. Best is trial 147 with value: 0.08860341365890499.
2026-05-18 11:22:13,234 - experiment_functions - INFO - Early stopping at epoch 850. Best Recall: 0.0823
2026-05-18 11:22:13,535 - optuna.study.study - INFO - Trial 159 finished with value: 0.08227731035677568 and parameters: {'n_layers': 1, 'embedding_dim': 64, 'lr': 0.0011228532834560792, 'lambda_val': 7.745083781752674e-05, 'batch_size': 978, 'optimizer': 'Adam'}. Best is trial 147 with value: 0.08860341365890499.
2026-05-18 11:22:28,233 - experiment_functions - INFO - Early stopping at epoch 1000. Best Recall: 0.0866
2026-05-18 11:22:28,324 - optuna.study.study - INFO - Trial 160 finished with value: 0.08656548468525019 and parameters: {'n_layers': 1, 'embedding_dim': 64, 'lr': 0.0011177510505531686, 'lambda_val': 8.528131986407915e-05, 'batch_size': 528, 'optimizer': 'Adam'}. Best is trial 147 with value: 0.08860341365890499.
2026-05-18 11:22:41,561 - experiment_functions - INFO - Early stopping at epoch 900. Best Recall: 0.0847
2026-05-18 11:22:41,661 - optuna.study.study - INFO - Trial 161 finished with value: 0.08473213372328357 and parameters: {'n_layers': 1, 'embedding_dim': 64, 'lr': 0.0011500533895228762, 'lambda_val': 7.877690289335916e-05, 'batch_size': 702, 'optimizer': 'Adam'}. Best is trial 147 with value: 0.08860341365890499.
2026-05-18 11:22:54,256 - experiment_functions - INFO - Early stopping at epoch 850. Best Recall: 0.0815
2026-05-18 11:22:54,348 - optuna.study.study - INFO - Trial 162 finished with value: 0.08149261256480023 and parameters: {'n_layers': 1, 'embedding_dim': 64, 'lr': 0.0011600439053113414, 'lambda_val': 0.00010468279574387879, 'batch_size': 698, 'optimizer': 'Adam'}. Best is trial 147 with value: 0.08860341365890499.
2026-05-18 11:23:07,373 - experiment_functions - INFO - Early stopping at epoch 900. Best Recall: 0.0870
2026-05-18 11:23:07,486 - optuna.study.study - INFO - Trial 163 finished with value: 0.0870487934587495 and parameters: {'n_layers': 1, 'embedding_dim': 64, 'lr': 0.0009969991829546073, 'lambda_val': 8.075505842598243e-05, 'batch_size': 965, 'optimizer': 'Adam'}. Best is trial 147 with value: 0.08860341365890499.
2026-05-18 11:23:32,491 - experiment_functions - INFO - Early stopping at epoch 1750. Best Recall: 0.0910
2026-05-18 11:23:32,595 - optuna.study.study - INFO - Trial 164 finished with value: 0.09100528932171693 and parameters: {'n_layers': 1, 'embedding_dim': 64, 'lr': 0.000671453145697449, 'lambda_val': 8.405139579159675e-05, 'batch_size': 539, 'optimizer': 'Adam'}. Best is trial 164 with value: 0.09100528932171693.
2026-05-18 11:23:47,018 - optuna.study._optimize - INFO - Trial 165 pruned. 
2026-05-18 11:23:59,859 - experiment_functions - INFO - Early stopping at epoch 800. Best Recall: 0.0574
2026-05-18 11:23:59,937 - optuna.study.study - INFO - Trial 166 finished with value: 0.05744509813707887 and parameters: {'n_layers': 3, 'embedding_dim': 64, 'lr': 0.0006843710813208742, 'lambda_val': 0.0001598031676970654, 'batch_size': 1004, 'optimizer': 'Adam'}. Best is trial 164 with value: 0.09100528932171693.
2026-05-18 11:24:13,892 - experiment_functions - INFO - Early stopping at epoch 950. Best Recall: 0.0863
2026-05-18 11:24:13,994 - optuna.study.study - INFO - Trial 167 finished with value: 0.08629833605667259 and parameters: {'n_layers': 1, 'embedding_dim': 64, 'lr': 0.0009630325211136233, 'lambda_val': 0.00022031498092094006, 'batch_size': 896, 'optimizer': 'Adam'}. Best is trial 164 with value: 0.09100528932171693.
2026-05-18 11:24:28,311 - experiment_functions - INFO - Early stopping at epoch 950. Best Recall: 0.0831
2026-05-18 11:24:28,424 - optuna.study.study - INFO - Trial 168 finished with value: 0.08312494598668226 and parameters: {'n_layers': 1, 'embedding_dim': 64, 'lr': 0.001006992259040077, 'lambda_val': 0.00021940981693434103, 'batch_size': 787, 'optimizer': 'Adam'}. Best is trial 164 with value: 0.09100528932171693.
2026-05-18 11:24:42,359 - experiment_functions - INFO - Early stopping at epoch 950. Best Recall: 0.0851
2026-05-18 11:24:42,515 - optuna.study.study - INFO - Trial 169 finished with value: 0.08510728837067791 and parameters: {'n_layers': 1, 'embedding_dim': 64, 'lr': 0.0009802930918023263, 'lambda_val': 0.00020784192663074336, 'batch_size': 769, 'optimizer': 'Adam'}. Best is trial 164 with value: 0.09100528932171693.
2026-05-18 11:24:51,223 - experiment_functions - INFO - Early stopping at epoch 600. Best Recall: 0.0179
2026-05-18 11:24:51,314 - optuna.study.study - INFO - Trial 170 finished with value: 0.01793293835720945 and parameters: {'n_layers': 1, 'embedding_dim': 64, 'lr': 0.07043149221085779, 'lambda_val': 0.00019867382017086418, 'batch_size': 767, 'optimizer': 'Adam'}. Best is trial 164 with value: 0.09100528932171693.
2026-05-18 11:25:05,759 - optuna.study._optimize - INFO - Trial 171 pruned. 
2026-05-18 11:25:27,309 - experiment_functions - INFO - Early stopping at epoch 1000. Best Recall: 0.0876
2026-05-18 11:25:28,087 - optuna.study.study - INFO - Trial 172 finished with value: 0.08763049726145623 and parameters: {'n_layers': 1, 'embedding_dim': 64, 'lr': 0.0009576436527580353, 'lambda_val': 0.00012661918499726186, 'batch_size': 653, 'optimizer': 'Adam'}. Best is trial 164 with value: 0.09100528932171693.
2026-05-18 11:25:48,490 - experiment_functions - INFO - Early stopping at epoch 1300. Best Recall: 0.0912
2026-05-18 11:25:48,626 - optuna.study.study - INFO - Trial 173 finished with value: 0.09121241392205567 and parameters: {'n_layers': 1, 'embedding_dim': 64, 'lr': 0.0008752628288312056, 'lambda_val': 0.00037971732051956744, 'batch_size': 660, 'optimizer': 'Adam'}. Best is trial 173 with value: 0.09121241392205567.
2026-05-18 11:26:17,716 - experiment_functions - INFO - Early stopping at epoch 2150. Best Recall: 0.0882
2026-05-18 11:26:17,818 - optuna.study.study - INFO - Trial 174 finished with value: 0.08819469882458052 and parameters: {'n_layers': 1, 'embedding_dim': 64, 'lr': 0.0005333421919497008, 'lambda_val': 0.00029411562600812783, 'batch_size': 641, 'optimizer': 'Adam'}. Best is trial 173 with value: 0.09121241392205567.
2026-05-18 11:26:31,921 - optuna.study._optimize - INFO - Trial 175 pruned. 
2026-05-18 11:26:45,516 - optuna.study._optimize - INFO - Trial 176 pruned. 
2026-05-18 11:27:00,876 - experiment_functions - INFO - Early stopping at epoch 1050. Best Recall: 0.0876
2026-05-18 11:27:00,975 - optuna.study.study - INFO - Trial 177 finished with value: 0.08761445055753148 and parameters: {'n_layers': 1, 'embedding_dim': 64, 'lr': 0.0007878741935670905, 'lambda_val': 0.0004287915238177491, 'batch_size': 514, 'optimizer': 'RMSprop'}. Best is trial 173 with value: 0.09121241392205567.
2026-05-18 11:27:16,617 - experiment_functions - INFO - Early stopping at epoch 1050. Best Recall: 0.0857
2026-05-18 11:27:16,742 - optuna.study.study - INFO - Trial 178 finished with value: 0.08565052157034182 and parameters: {'n_layers': 1, 'embedding_dim': 64, 'lr': 0.0007905062379172337, 'lambda_val': 0.0006097303185860052, 'batch_size': 546, 'optimizer': 'RMSprop'}. Best is trial 173 with value: 0.09121241392205567.
2026-05-18 11:27:30,638 - experiment_functions - INFO - Early stopping at epoch 950. Best Recall: 0.0818
2026-05-18 11:27:30,740 - optuna.study.study - INFO - Trial 179 finished with value: 0.08183384532236558 and parameters: {'n_layers': 1, 'embedding_dim': 64, 'lr': 0.0008743653622075923, 'lambda_val': 0.0003799799348745285, 'batch_size': 525, 'optimizer': 'RMSprop'}. Best is trial 173 with value: 0.09121241392205567.
2026-05-18 11:27:47,301 - experiment_functions - INFO - Early stopping at epoch 1150. Best Recall: 0.0848
2026-05-18 11:27:47,457 - optuna.study.study - INFO - Trial 180 finished with value: 0.08480809629261529 and parameters: {'n_layers': 1, 'embedding_dim': 64, 'lr': 0.0007285247017938167, 'lambda_val': 0.0001289645975003695, 'batch_size': 597, 'optimizer': 'RMSprop'}. Best is trial 173 with value: 0.09121241392205567.
2026-05-18 11:28:10,296 - experiment_functions - INFO - Early stopping at epoch 950. Best Recall: 0.0834
2026-05-18 11:28:10,376 - optuna.study.study - INFO - Trial 181 finished with value: 0.08340210815838489 and parameters: {'n_layers': 1, 'embedding_dim': 64, 'lr': 0.0008071312518567586, 'lambda_val': 0.00013957416597360338, 'batch_size': 605, 'optimizer': 'RMSprop'}. Best is trial 173 with value: 0.09121241392205567.
2026-05-18 11:28:25,008 - experiment_functions - INFO - Early stopping at epoch 1000. Best Recall: 0.0826
2026-05-18 11:28:25,107 - optuna.study.study - INFO - Trial 182 finished with value: 0.08258926653568698 and parameters: {'n_layers': 1, 'embedding_dim': 64, 'lr': 0.0007724105704301733, 'lambda_val': 0.0006977703354715036, 'batch_size': 694, 'optimizer': 'RMSprop'}. Best is trial 173 with value: 0.09121241392205567.
2026-05-18 11:28:53,165 - experiment_functions - INFO - Early stopping at epoch 2000. Best Recall: 0.0874
2026-05-18 11:28:53,289 - optuna.study.study - INFO - Trial 183 finished with value: 0.0873587973846623 and parameters: {'n_layers': 1, 'embedding_dim': 64, 'lr': 0.0005425924759006505, 'lambda_val': 0.00018008683394744255, 'batch_size': 515, 'optimizer': 'RMSprop'}. Best is trial 173 with value: 0.09121241392205567.
2026-05-18 11:29:19,479 - experiment_functions - INFO - Early stopping at epoch 1850. Best Recall: 0.0895
2026-05-18 11:29:19,570 - optuna.study.study - INFO - Trial 184 finished with value: 0.08951029357928682 and parameters: {'n_layers': 1, 'embedding_dim': 64, 'lr': 0.000545095017385811, 'lambda_val': 0.00048638453418718485, 'batch_size': 606, 'optimizer': 'RMSprop'}. Best is trial 173 with value: 0.09121241392205567.
2026-05-18 11:29:45,995 - experiment_functions - INFO - Early stopping at epoch 1900. Best Recall: 0.0881
2026-05-18 11:29:46,143 - optuna.study.study - INFO - Trial 185 finished with value: 0.08809398981137256 and parameters: {'n_layers': 1, 'embedding_dim': 64, 'lr': 0.0005361073184300413, 'lambda_val': 0.0005173596160060883, 'batch_size': 578, 'optimizer': 'RMSprop'}. Best is trial 173 with value: 0.09121241392205567.
2026-05-18 11:30:18,613 - experiment_functions - INFO - Early stopping at epoch 2250. Best Recall: 0.0907
2026-05-18 11:30:18,704 - optuna.study.study - INFO - Trial 186 finished with value: 0.09070190512675967 and parameters: {'n_layers': 1, 'embedding_dim': 64, 'lr': 0.0005295665647517244, 'lambda_val': 0.0005517059964015603, 'batch_size': 516, 'optimizer': 'RMSprop'}. Best is trial 173 with value: 0.09121241392205567.
2026-05-18 11:30:57,479 - experiment_functions - INFO - Early stopping at epoch 2700. Best Recall: 0.0923
2026-05-18 11:30:57,574 - optuna.study.study - INFO - Trial 187 finished with value: 0.0923319314019191 and parameters: {'n_layers': 1, 'embedding_dim': 64, 'lr': 0.0005050334234951997, 'lambda_val': 0.0005070137053816672, 'batch_size': 549, 'optimizer': 'RMSprop'}. Best is trial 187 with value: 0.0923319314019191.
2026-05-18 11:31:30,176 - experiment_functions - INFO - Early stopping at epoch 2250. Best Recall: 0.0911
2026-05-18 11:31:30,312 - optuna.study.study - INFO - Trial 188 finished with value: 0.0911099915357036 and parameters: {'n_layers': 1, 'embedding_dim': 64, 'lr': 0.0005122765700773204, 'lambda_val': 0.0005339601730466765, 'batch_size': 547, 'optimizer': 'RMSprop'}. Best is trial 187 with value: 0.0923319314019191.
2026-05-18 11:31:44,093 - optuna.study._optimize - INFO - Trial 189 pruned. 
2026-05-18 11:32:15,826 - experiment_functions - INFO - Early stopping at epoch 2250. Best Recall: 0.0924
2026-05-18 11:32:15,917 - optuna.study.study - INFO - Trial 190 finished with value: 0.09244881852742834 and parameters: {'n_layers': 1, 'embedding_dim': 64, 'lr': 0.0005258082308935917, 'lambda_val': 0.0005041293557021702, 'batch_size': 581, 'optimizer': 'RMSprop'}. Best is trial 190 with value: 0.09244881852742834.
2026-05-18 11:32:48,386 - experiment_functions - INFO - Early stopping at epoch 2350. Best Recall: 0.0866
2026-05-18 11:32:48,488 - optuna.study.study - INFO - Trial 191 finished with value: 0.08660956169884006 and parameters: {'n_layers': 1, 'embedding_dim': 64, 'lr': 0.000520069946953602, 'lambda_val': 0.0005186040844764355, 'batch_size': 520, 'optimizer': 'RMSprop'}. Best is trial 190 with value: 0.09244881852742834.
2026-05-18 11:33:22,353 - experiment_functions - INFO - Early stopping at epoch 2400. Best Recall: 0.0897
2026-05-18 11:33:22,424 - optuna.study.study - INFO - Trial 192 finished with value: 0.0896708687129374 and parameters: {'n_layers': 1, 'embedding_dim': 64, 'lr': 0.0005006461487343291, 'lambda_val': 0.0005101377107976604, 'batch_size': 580, 'optimizer': 'RMSprop'}. Best is trial 190 with value: 0.09244881852742834.
2026-05-18 11:33:53,686 - experiment_functions - INFO - Early stopping at epoch 2350. Best Recall: 0.0872
2026-05-18 11:33:53,810 - optuna.study.study - INFO - Trial 193 finished with value: 0.08717708737770234 and parameters: {'n_layers': 1, 'embedding_dim': 64, 'lr': 0.0005085364089954356, 'lambda_val': 0.0004777905046896355, 'batch_size': 598, 'optimizer': 'RMSprop'}. Best is trial 190 with value: 0.09244881852742834.
2026-05-18 11:34:21,832 - experiment_functions - INFO - Early stopping at epoch 2100. Best Recall: 0.0869
2026-05-18 11:34:21,934 - optuna.study.study - INFO - Trial 194 finished with value: 0.086916878197105 and parameters: {'n_layers': 1, 'embedding_dim': 64, 'lr': 0.0005275209466971599, 'lambda_val': 0.0004987722633531538, 'batch_size': 517, 'optimizer': 'RMSprop'}. Best is trial 190 with value: 0.09244881852742834.
