2026-05-18 20:18:02,357 - optuna.study.study - INFO - Trial 193 finished with value: 0.0592233007020084 and parameters: {'n_layers': 1, 'embedding_dim': 32, 'lr': 0.00043120790216609375, 'lambda_val': 3.6909180741219137e-06, 'batch_size': 594, 'optimizer': 'Adam'}. Best is trial 182 with value: 0.06362387103793415.
2026-05-18 20:18:16,303 - experiment_functions - INFO - Early stopping at epoch 900. Best Recall: 0.0575
2026-05-18 20:18:16,406 - optuna.study.study - INFO - Trial 194 finished with value: 0.057473751765569646 and parameters: {'n_layers': 1, 'embedding_dim': 32, 'lr': 0.0006379915069110806, 'lambda_val': 2.150076939710815e-06, 'batch_size': 706, 'optimizer': 'Adam'}. Best is trial 182 with value: 0.06362387103793415.
2026-05-18 20:18:45,522 - experiment_functions - INFO - Early stopping at epoch 1750. Best Recall: 0.0598
2026-05-18 20:18:45,613 - optuna.study.study - INFO - Trial 195 finished with value: 0.059782676275416474 and parameters: {'n_layers': 1, 'embedding_dim': 32, 'lr': 0.00032171880263018754, 'lambda_val': 1.5482083477657393e-06, 'batch_size': 586, 'optimizer': 'Adam'}. Best is trial 182 with value: 0.06362387103793415.
2026-05-18 20:18:57,378 - experiment_functions - INFO - Early stopping at epoch 800. Best Recall: 0.0584
2026-05-18 20:18:57,468 - optuna.study.study - INFO - Trial 196 finished with value: 0.058423378214274825 and parameters: {'n_layers': 1, 'embedding_dim': 32, 'lr': 0.0008124522783182255, 'lambda_val': 2.8923368173516862e-06, 'batch_size': 654, 'optimizer': 'Adam'}. Best is trial 182 with value: 0.06362387103793415.
2026-05-18 20:19:13,807 - optuna.study._optimize - INFO - Trial 197 pruned. 
2026-05-18 20:19:33,188 - experiment_functions - INFO - Early stopping at epoch 1300. Best Recall: 0.0595
2026-05-18 20:19:33,289 - optuna.study.study - INFO - Trial 198 finished with value: 0.05945186601918141 and parameters: {'n_layers': 1, 'embedding_dim': 32, 'lr': 0.00041566699015452356, 'lambda_val': 2.062793904264447e-06, 'batch_size': 816, 'optimizer': 'Adam'}. Best is trial 182 with value: 0.06362387103793415.
2026-05-18 20:19:44,842 - experiment_functions - INFO - Early stopping at epoch 750. Best Recall: 0.0579
2026-05-18 20:19:44,952 - optuna.study.study - INFO - Trial 199 finished with value: 0.05787758929519514 and parameters: {'n_layers': 1, 'embedding_dim': 32, 'lr': 0.0009837513380527723, 'lambda_val': 9.066853741548419e-05, 'batch_size': 730, 'optimizer': 'Adam'}. Best is trial 182 with value: 0.06362387103793415.
2026-05-18 20:20:01,515 - optuna.study._optimize - INFO - Trial 200 pruned. 
2026-05-18 20:20:14,935 - experiment_functions - INFO - Early stopping at epoch 850. Best Recall: 0.0597
2026-05-18 20:20:15,082 - optuna.study.study - INFO - Trial 201 finished with value: 0.05969627977790699 and parameters: {'n_layers': 1, 'embedding_dim': 32, 'lr': 0.0006525700333130315, 'lambda_val': 1.7292044881329281e-06, 'batch_size': 707, 'optimizer': 'Adam'}. Best is trial 182 with value: 0.06362387103793415.
2026-05-18 20:20:28,877 - experiment_functions - INFO - Early stopping at epoch 850. Best Recall: 0.0614
2026-05-18 20:20:28,967 - optuna.study.study - INFO - Trial 202 finished with value: 0.06140557421582512 and parameters: {'n_layers': 1, 'embedding_dim': 32, 'lr': 0.0007726847605130825, 'lambda_val': 1.4731585699798127e-06, 'batch_size': 754, 'optimizer': 'Adam'}. Best is trial 182 with value: 0.06362387103793415.
2026-05-18 20:20:40,985 - experiment_functions - INFO - Early stopping at epoch 900. Best Recall: 0.0605
2026-05-18 20:20:41,086 - optuna.study.study - INFO - Trial 203 finished with value: 0.060466674769274725 and parameters: {'n_layers': 1, 'embedding_dim': 32, 'lr': 0.0008102493965956333, 'lambda_val': 1.450296362716997e-06, 'batch_size': 586, 'optimizer': 'Adam'}. Best is trial 182 with value: 0.06362387103793415.
2026-05-18 20:20:51,571 - experiment_functions - INFO - Early stopping at epoch 750. Best Recall: 0.0635
2026-05-18 20:20:51,672 - optuna.study.study - INFO - Trial 204 finished with value: 0.06350521506198388 and parameters: {'n_layers': 1, 'embedding_dim': 32, 'lr': 0.0011309932479245605, 'lambda_val': 1.0106745473965838e-06, 'batch_size': 515, 'optimizer': 'Adam'}. Best is trial 182 with value: 0.06362387103793415.
2026-05-18 20:21:03,727 - experiment_functions - INFO - Early stopping at epoch 850. Best Recall: 0.0622
2026-05-18 20:21:03,808 - optuna.study.study - INFO - Trial 205 finished with value: 0.062168066761103584 and parameters: {'n_layers': 1, 'embedding_dim': 32, 'lr': 0.0008316793286747473, 'lambda_val': 1.0681294015798525e-06, 'batch_size': 512, 'optimizer': 'Adam'}. Best is trial 182 with value: 0.06362387103793415.
2026-05-18 20:21:13,460 - experiment_functions - INFO - Early stopping at epoch 700. Best Recall: 0.0583
2026-05-18 20:21:13,551 - optuna.study.study - INFO - Trial 206 finished with value: 0.05834126432718886 and parameters: {'n_layers': 1, 'embedding_dim': 32, 'lr': 0.0011451324008720412, 'lambda_val': 1.1201163725180853e-06, 'batch_size': 531, 'optimizer': 'Adam'}. Best is trial 182 with value: 0.06362387103793415.
2026-05-18 20:21:24,540 - experiment_functions - INFO - Early stopping at epoch 800. Best Recall: 0.0597
2026-05-18 20:21:24,641 - optuna.study.study - INFO - Trial 207 finished with value: 0.05966078931388801 and parameters: {'n_layers': 1, 'embedding_dim': 32, 'lr': 0.0008630236919863432, 'lambda_val': 1.0423988705431608e-06, 'batch_size': 569, 'optimizer': 'Adam'}. Best is trial 182 with value: 0.06362387103793415.
2026-05-18 20:21:34,452 - experiment_functions - INFO - Early stopping at epoch 700. Best Recall: 0.0578
2026-05-18 20:21:34,542 - optuna.study.study - INFO - Trial 208 finished with value: 0.05782292400816629 and parameters: {'n_layers': 1, 'embedding_dim': 64, 'lr': 0.0010291247333633882, 'lambda_val': 1.0229227751631365e-06, 'batch_size': 516, 'optimizer': 'Adam'}. Best is trial 182 with value: 0.06362387103793415.
2026-05-18 20:21:46,533 - experiment_functions - INFO - Early stopping at epoch 850. Best Recall: 0.0599
2026-05-18 20:21:46,625 - optuna.study.study - INFO - Trial 209 finished with value: 0.0598861503529216 and parameters: {'n_layers': 1, 'embedding_dim': 32, 'lr': 0.000724603634411387, 'lambda_val': 1.6201342036271811e-06, 'batch_size': 772, 'optimizer': 'Adam'}. Best is trial 182 with value: 0.06362387103793415.
2026-05-18 20:22:01,352 - experiment_functions - INFO - Early stopping at epoch 1100. Best Recall: 0.0610
2026-05-18 20:22:01,487 - optuna.study.study - INFO - Trial 210 finished with value: 0.060966290063188544 and parameters: {'n_layers': 1, 'embedding_dim': 32, 'lr': 0.0005769176673139131, 'lambda_val': 1.2773224315123073e-06, 'batch_size': 634, 'optimizer': 'Adam'}. Best is trial 182 with value: 0.06362387103793415.
2026-05-18 20:22:16,800 - experiment_functions - INFO - Early stopping at epoch 1150. Best Recall: 0.0593
2026-05-18 20:22:16,902 - optuna.study.study - INFO - Trial 211 finished with value: 0.059332165453526056 and parameters: {'n_layers': 1, 'embedding_dim': 32, 'lr': 0.0004751721433310411, 'lambda_val': 1.4220222978537738e-06, 'batch_size': 583, 'optimizer': 'Adam'}. Best is trial 182 with value: 0.06362387103793415.
2026-05-18 20:22:29,164 - experiment_functions - INFO - Early stopping at epoch 900. Best Recall: 0.0605
2026-05-18 20:22:29,275 - optuna.study.study - INFO - Trial 212 finished with value: 0.0604938210231416 and parameters: {'n_layers': 1, 'embedding_dim': 32, 'lr': 0.0007126768513100256, 'lambda_val': 2.012647787379563e-06, 'batch_size': 512, 'optimizer': 'Adam'}. Best is trial 182 with value: 0.06362387103793415.
2026-05-18 20:22:49,861 - experiment_functions - INFO - Early stopping at epoch 1550. Best Recall: 0.0608
2026-05-18 20:22:49,971 - optuna.study.study - INFO - Trial 213 finished with value: 0.06076570843903338 and parameters: {'n_layers': 1, 'embedding_dim': 32, 'lr': 0.000393456877002552, 'lambda_val': 2.3329525668845913e-06, 'batch_size': 660, 'optimizer': 'Adam'}. Best is trial 182 with value: 0.06362387103793415.
2026-05-18 20:23:02,128 - experiment_functions - INFO - Early stopping at epoch 850. Best Recall: 0.0590
2026-05-18 20:23:02,208 - optuna.study.study - INFO - Trial 214 finished with value: 0.05904486143938174 and parameters: {'n_layers': 1, 'embedding_dim': 32, 'lr': 0.0008574052050524761, 'lambda_val': 5.631258127547614e-06, 'batch_size': 602, 'optimizer': 'Adam'}. Best is trial 182 with value: 0.06362387103793415.
2026-05-18 20:23:16,779 - experiment_functions - INFO - Early stopping at epoch 1100. Best Recall: 0.0583
2026-05-18 20:23:16,880 - optuna.study.study - INFO - Trial 215 finished with value: 0.058264335654264726 and parameters: {'n_layers': 1, 'embedding_dim': 32, 'lr': 0.0005362959838669976, 'lambda_val': 1.346911188813488e-06, 'batch_size': 710, 'optimizer': 'Adam'}. Best is trial 182 with value: 0.06362387103793415.
2026-05-18 20:23:26,808 - experiment_functions - INFO - Early stopping at epoch 700. Best Recall: 0.0584
2026-05-18 20:23:26,909 - optuna.study.study - INFO - Trial 216 finished with value: 0.05835431298080074 and parameters: {'n_layers': 1, 'embedding_dim': 32, 'lr': 0.0011765141704390772, 'lambda_val': 1.780766543038442e-06, 'batch_size': 632, 'optimizer': 'Adam'}. Best is trial 182 with value: 0.06362387103793415.
2026-05-18 20:23:34,717 - experiment_functions - INFO - Early stopping at epoch 500. Best Recall: 0.0047
2026-05-18 20:23:34,818 - optuna.study.study - INFO - Trial 217 finished with value: 0.0046808266573237205 and parameters: {'n_layers': 1, 'embedding_dim': 96, 'lr': 0.00033099969278197193, 'lambda_val': 4.02325969278305e-06, 'batch_size': 849, 'optimizer': 'SGD'}. Best is trial 182 with value: 0.06362387103793415.
2026-05-18 20:23:48,384 - experiment_functions - INFO - Early stopping at epoch 950. Best Recall: 0.0612
2026-05-18 20:23:48,477 - optuna.study.study - INFO - Trial 218 finished with value: 0.06123928641017171 and parameters: {'n_layers': 1, 'embedding_dim': 32, 'lr': 0.0006221145525104603, 'lambda_val': 2.535716302601491e-06, 'batch_size': 573, 'optimizer': 'Adam'}. Best is trial 182 with value: 0.06362387103793415.
2026-05-18 20:24:00,692 - experiment_functions - INFO - Early stopping at epoch 900. Best Recall: 0.0601
2026-05-18 20:24:00,782 - optuna.study.study - INFO - Trial 219 finished with value: 0.06009571649640043 and parameters: {'n_layers': 1, 'embedding_dim': 32, 'lr': 0.0006695526554545495, 'lambda_val': 2.633111609336125e-06, 'batch_size': 565, 'optimizer': 'Adam'}. Best is trial 182 with value: 0.06362387103793415.
2026-05-18 20:24:11,584 - experiment_functions - INFO - Early stopping at epoch 750. Best Recall: 0.0609
2026-05-18 20:24:11,686 - optuna.study.study - INFO - Trial 220 finished with value: 0.06094481352878714 and parameters: {'n_layers': 1, 'embedding_dim': 32, 'lr': 0.0008753556731518253, 'lambda_val': 1.0164108440708436e-06, 'batch_size': 726, 'optimizer': 'Adam'}. Best is trial 182 with value: 0.06362387103793415.
2026-05-18 20:24:36,042 - experiment_functions - INFO - Early stopping at epoch 1150. Best Recall: 0.0624
2026-05-18 20:24:36,210 - optuna.study.study - INFO - Trial 221 finished with value: 0.06240546745089248 and parameters: {'n_layers': 1, 'embedding_dim': 32, 'lr': 0.0005365199286065514, 'lambda_val': 2.6078813998587995e-06, 'batch_size': 512, 'optimizer': 'Adam'}. Best is trial 182 with value: 0.06362387103793415.
2026-05-18 20:24:49,288 - experiment_functions - INFO - Early stopping at epoch 950. Best Recall: 0.0601
2026-05-18 20:24:49,455 - optuna.study.study - INFO - Trial 222 finished with value: 0.06012164076149664 and parameters: {'n_layers': 1, 'embedding_dim': 32, 'lr': 0.0005736838061418972, 'lambda_val': 2.3387496180124945e-06, 'batch_size': 568, 'optimizer': 'Adam'}. Best is trial 182 with value: 0.06362387103793415.
2026-05-18 20:25:01,708 - experiment_functions - INFO - Early stopping at epoch 850. Best Recall: 0.0580
2026-05-18 20:25:01,810 - optuna.study.study - INFO - Trial 223 finished with value: 0.057959101315205756 and parameters: {'n_layers': 1, 'embedding_dim': 32, 'lr': 0.0007410791553879056, 'lambda_val': 1.5534860604371716e-06, 'batch_size': 520, 'optimizer': 'Adam'}. Best is trial 182 with value: 0.06362387103793415.
2026-05-18 20:25:10,955 - experiment_functions - INFO - Early stopping at epoch 650. Best Recall: 0.0590
2026-05-18 20:25:11,047 - optuna.study.study - INFO - Trial 224 finished with value: 0.05896982505916877 and parameters: {'n_layers': 1, 'embedding_dim': 32, 'lr': 0.0015426965573642505, 'lambda_val': 2.0303979803775433e-06, 'batch_size': 662, 'optimizer': 'Adam'}. Best is trial 182 with value: 0.06362387103793415.
2026-05-18 20:25:23,926 - experiment_functions - INFO - Early stopping at epoch 950. Best Recall: 0.0610
2026-05-18 20:25:24,048 - optuna.study.study - INFO - Trial 225 finished with value: 0.061001640504545734 and parameters: {'n_layers': 1, 'embedding_dim': 32, 'lr': 0.000608273262713345, 'lambda_val': 0.0005125347284377608, 'batch_size': 514, 'optimizer': 'Adam'}. Best is trial 182 with value: 0.06362387103793415.
2026-05-18 20:25:34,637 - experiment_functions - INFO - Early stopping at epoch 750. Best Recall: 0.0582
2026-05-18 20:25:34,739 - optuna.study.study - INFO - Trial 226 finished with value: 0.05819910446021431 and parameters: {'n_layers': 1, 'embedding_dim': 32, 'lr': 0.0009761887492374968, 'lambda_val': 2.624047345078956e-06, 'batch_size': 612, 'optimizer': 'Adam'}. Best is trial 182 with value: 0.06362387103793415.
2026-05-18 20:25:56,736 - optuna.study._optimize - INFO - Trial 227 pruned. 
2026-05-18 20:26:08,969 - experiment_functions - INFO - Early stopping at epoch 900. Best Recall: 0.0604
2026-05-18 20:26:09,070 - optuna.study.study - INFO - Trial 228 finished with value: 0.06039250417830811 and parameters: {'n_layers': 1, 'embedding_dim': 32, 'lr': 0.0007753573299498287, 'lambda_val': 3.650351483855518e-06, 'batch_size': 512, 'optimizer': 'Adam'}. Best is trial 182 with value: 0.06362387103793415.
2026-05-18 20:26:21,472 - experiment_functions - INFO - Early stopping at epoch 900. Best Recall: 0.0584
2026-05-18 20:26:21,570 - optuna.study.study - INFO - Trial 229 finished with value: 0.05837533977099224 and parameters: {'n_layers': 1, 'embedding_dim': 32, 'lr': 0.0006411694279469595, 'lambda_val': 5.147380843857747e-06, 'batch_size': 774, 'optimizer': 'Adam'}. Best is trial 182 with value: 0.06362387103793415.
2026-05-18 20:26:31,544 - experiment_functions - INFO - Early stopping at epoch 700. Best Recall: 0.0628
2026-05-18 20:26:31,653 - optuna.study.study - INFO - Trial 230 finished with value: 0.06281826776641569 and parameters: {'n_layers': 1, 'embedding_dim': 32, 'lr': 0.0012183445729843786, 'lambda_val': 1.934482466532624e-06, 'batch_size': 618, 'optimizer': 'Adam'}. Best is trial 182 with value: 0.06362387103793415.
2026-05-18 20:26:42,831 - experiment_functions - INFO - Early stopping at epoch 750. Best Recall: 0.0602
2026-05-18 20:26:42,920 - optuna.study.study - INFO - Trial 231 finished with value: 0.060163848906550244 and parameters: {'n_layers': 1, 'embedding_dim': 32, 'lr': 0.0010555495401225745, 'lambda_val': 1.5326413680100143e-06, 'batch_size': 603, 'optimizer': 'Adam'}. Best is trial 182 with value: 0.06362387103793415.
2026-05-18 20:26:57,512 - experiment_functions - INFO - Early stopping at epoch 800. Best Recall: 0.0602
2026-05-18 20:26:57,602 - optuna.study.study - INFO - Trial 232 finished with value: 0.06018320947391637 and parameters: {'n_layers': 1, 'embedding_dim': 32, 'lr': 0.00086036869605381, 'lambda_val': 1.9100163145569373e-06, 'batch_size': 656, 'optimizer': 'Adam'}. Best is trial 182 with value: 0.06362387103793415.
2026-05-18 20:27:09,943 - experiment_functions - INFO - Early stopping at epoch 700. Best Recall: 0.0621
2026-05-18 20:27:10,044 - optuna.study.study - INFO - Trial 233 finished with value: 0.06208405721984693 and parameters: {'n_layers': 1, 'embedding_dim': 32, 'lr': 0.0013800747660741599, 'lambda_val': 2.78788004749276e-06, 'batch_size': 579, 'optimizer': 'Adam'}. Best is trial 182 with value: 0.06362387103793415.
2026-05-18 20:27:19,961 - experiment_functions - INFO - Early stopping at epoch 700. Best Recall: 0.0604
2026-05-18 20:27:20,061 - optuna.study.study - INFO - Trial 234 finished with value: 0.060442633650087126 and parameters: {'n_layers': 1, 'embedding_dim': 32, 'lr': 0.0012854151540947177, 'lambda_val': 2.5043071706009553e-06, 'batch_size': 586, 'optimizer': 'Adam'}. Best is trial 182 with value: 0.06362387103793415.
2026-05-18 20:27:29,769 - experiment_functions - INFO - Early stopping at epoch 650. Best Recall: 0.0559
2026-05-18 20:27:29,868 - optuna.study.study - INFO - Trial 235 finished with value: 0.055935760310138846 and parameters: {'n_layers': 1, 'embedding_dim': 32, 'lr': 0.0016377783242809986, 'lambda_val': 3.0266879055485845e-06, 'batch_size': 678, 'optimizer': 'Adam'}. Best is trial 182 with value: 0.06362387103793415.
2026-05-18 20:27:40,163 - experiment_functions - INFO - Early stopping at epoch 700. Best Recall: 0.0576
2026-05-18 20:27:40,254 - optuna.study.study - INFO - Trial 236 finished with value: 0.0576035622857929 and parameters: {'n_layers': 1, 'embedding_dim': 32, 'lr': 0.0011593640159732615, 'lambda_val': 1.960952264466586e-06, 'batch_size': 577, 'optimizer': 'Adam'}. Best is trial 182 with value: 0.06362387103793415.
2026-05-18 20:27:49,180 - experiment_functions - INFO - Early stopping at epoch 600. Best Recall: 0.0589
2026-05-18 20:27:50,444 - optuna.study.study - INFO - Trial 237 finished with value: 0.05885025379962442 and parameters: {'n_layers': 1, 'embedding_dim': 32, 'lr': 0.001999287596853171, 'lambda_val': 1.353575462132084e-06, 'batch_size': 737, 'optimizer': 'Adam'}. Best is trial 182 with value: 0.06362387103793415.
2026-05-18 20:28:09,534 - experiment_functions - INFO - Early stopping at epoch 600. Best Recall: 0.0227
2026-05-18 20:28:09,626 - optuna.study.study - INFO - Trial 238 finished with value: 0.022666676336891862 and parameters: {'n_layers': 4, 'embedding_dim': 128, 'lr': 0.001511369559356824, 'lambda_val': 2.8740383433735053e-06, 'batch_size': 651, 'optimizer': 'Adam'}. Best is trial 182 with value: 0.06362387103793415.
2026-05-18 20:28:22,780 - experiment_functions - INFO - Early stopping at epoch 800. Best Recall: 0.0607
2026-05-18 20:28:22,880 - optuna.study.study - INFO - Trial 239 finished with value: 0.060664781329085406 and parameters: {'n_layers': 1, 'embedding_dim': 32, 'lr': 0.0009728529727532744, 'lambda_val': 2.212832688862911e-06, 'batch_size': 514, 'optimizer': 'Adam'}. Best is trial 182 with value: 0.06362387103793415.
2026-05-18 20:28:33,981 - experiment_functions - INFO - Early stopping at epoch 700. Best Recall: 0.0591
2026-05-18 20:28:34,082 - optuna.study.study - INFO - Trial 240 finished with value: 0.059115285700877984 and parameters: {'n_layers': 1, 'embedding_dim': 32, 'lr': 0.0012004270995865194, 'lambda_val': 1.6624701773441176e-06, 'batch_size': 631, 'optimizer': 'Adam'}. Best is trial 182 with value: 0.06362387103793415.
2026-05-18 20:28:49,575 - experiment_functions - INFO - Early stopping at epoch 1000. Best Recall: 0.0606
2026-05-18 20:28:49,664 - optuna.study.study - INFO - Trial 241 finished with value: 0.060572748960234755 and parameters: {'n_layers': 1, 'embedding_dim': 32, 'lr': 0.0005371166618325506, 'lambda_val': 4.0085094553522504e-06, 'batch_size': 581, 'optimizer': 'Adam'}. Best is trial 182 with value: 0.06362387103793415.
2026-05-18 20:29:03,830 - experiment_functions - INFO - Early stopping at epoch 900. Best Recall: 0.0634
2026-05-18 20:29:03,920 - optuna.study.study - INFO - Trial 242 finished with value: 0.06339018146479602 and parameters: {'n_layers': 1, 'embedding_dim': 32, 'lr': 0.0007569432085997997, 'lambda_val': 3.401848777377774e-06, 'batch_size': 575, 'optimizer': 'Adam'}. Best is trial 182 with value: 0.06362387103793415.
2026-05-18 20:29:20,614 - experiment_functions - INFO - Early stopping at epoch 850. Best Recall: 0.0613
2026-05-18 20:29:20,714 - optuna.study.study - INFO - Trial 243 finished with value: 0.06130804506063367 and parameters: {'n_layers': 1, 'embedding_dim': 32, 'lr': 0.0007237767389762925, 'lambda_val': 3.054850570066403e-06, 'batch_size': 512, 'optimizer': 'Adam'}. Best is trial 182 with value: 0.06362387103793415.
2026-05-18 20:29:32,679 - experiment_functions - INFO - Early stopping at epoch 850. Best Recall: 0.0604
2026-05-18 20:29:32,780 - optuna.study.study - INFO - Trial 244 finished with value: 0.06041586364167387 and parameters: {'n_layers': 1, 'embedding_dim': 32, 'lr': 0.000726697840030326, 'lambda_val': 3.4782215319582288e-06, 'batch_size': 518, 'optimizer': 'Adam'}. Best is trial 182 with value: 0.06362387103793415.
2026-05-18 20:29:44,368 - experiment_functions - INFO - Early stopping at epoch 800. Best Recall: 0.0618
2026-05-18 20:29:44,471 - optuna.study.study - INFO - Trial 245 finished with value: 0.061845480784241146 and parameters: {'n_layers': 1, 'embedding_dim': 32, 'lr': 0.0009319047784893203, 'lambda_val': 4.889662847034848e-06, 'batch_size': 554, 'optimizer': 'Adam'}. Best is trial 182 with value: 0.06362387103793415.
2026-05-18 20:29:56,619 - experiment_functions - INFO - Early stopping at epoch 800. Best Recall: 0.0623
2026-05-18 20:29:56,719 - optuna.study.study - INFO - Trial 246 finished with value: 0.062315113985795936 and parameters: {'n_layers': 1, 'embedding_dim': 32, 'lr': 0.000908405675583467, 'lambda_val': 4.654692943677017e-06, 'batch_size': 569, 'optimizer': 'Adam'}. Best is trial 182 with value: 0.06362387103793415.
2026-05-18 20:30:09,717 - optuna.study._optimize - INFO - Trial 247 pruned. 
2026-05-18 20:30:20,235 - experiment_functions - INFO - Early stopping at epoch 750. Best Recall: 0.0599
