2026-05-18 09:34:05,680 - optuna.study._optimize - INFO - Trial 129 pruned. 
2026-05-18 09:34:20,133 - optuna.study._optimize - INFO - Trial 130 pruned. 
2026-05-18 09:34:36,026 - optuna.study._optimize - INFO - Trial 131 pruned. 
2026-05-18 09:34:50,168 - optuna.study._optimize - INFO - Trial 132 pruned. 
2026-05-18 09:35:03,424 - optuna.study._optimize - INFO - Trial 133 pruned. 
2026-05-18 09:35:16,343 - optuna.study._optimize - INFO - Trial 134 pruned. 
2026-05-18 09:35:29,480 - optuna.study._optimize - INFO - Trial 135 pruned. 
2026-05-18 09:35:42,210 - optuna.study._optimize - INFO - Trial 136 pruned. 
2026-05-18 09:35:56,250 - optuna.study._optimize - INFO - Trial 137 pruned. 
2026-05-18 09:36:10,639 - optuna.study._optimize - INFO - Trial 138 pruned. 
2026-05-18 09:36:18,265 - experiment_functions - INFO - Early stopping at epoch 500. Best Recall: 0.0050
2026-05-18 09:36:18,365 - optuna.study.study - INFO - Trial 139 finished with value: 0.0050050768167185875 and parameters: {'n_layers': 1, 'embedding_dim': 32, 'lr': 0.00030540758783909034, 'lambda_val': 0.0004010731532807133, 'batch_size': 1837, 'optimizer': 'SGD'}. Best is trial 46 with value: 0.04748435995661139.
2026-05-18 09:36:32,572 - optuna.study._optimize - INFO - Trial 140 pruned. 
2026-05-18 09:36:47,322 - experiment_functions - INFO - Early stopping at epoch 1000. Best Recall: 0.0461
2026-05-18 09:36:47,412 - optuna.study.study - INFO - Trial 141 finished with value: 0.04607015377205725 and parameters: {'n_layers': 1, 'embedding_dim': 32, 'lr': 0.001030483321562301, 'lambda_val': 2.8927632422581455e-06, 'batch_size': 573, 'optimizer': 'Adam'}. Best is trial 46 with value: 0.04748435995661139.
2026-05-18 09:37:01,769 - experiment_functions - INFO - Early stopping at epoch 1050. Best Recall: 0.0467
2026-05-18 09:37:01,859 - optuna.study.study - INFO - Trial 142 finished with value: 0.04668847007299296 and parameters: {'n_layers': 1, 'embedding_dim': 32, 'lr': 0.0008057145548780541, 'lambda_val': 2.5376710399613027e-06, 'batch_size': 647, 'optimizer': 'Adam'}. Best is trial 46 with value: 0.04748435995661139.
2026-05-18 09:37:15,908 - optuna.study._optimize - INFO - Trial 143 pruned. 
2026-05-18 09:37:30,700 - optuna.study._optimize - INFO - Trial 144 pruned. 
2026-05-18 09:37:58,532 - experiment_functions - INFO - Early stopping at epoch 2050. Best Recall: 0.0467
2026-05-18 09:37:58,621 - optuna.study.study - INFO - Trial 145 finished with value: 0.04674243912886629 and parameters: {'n_layers': 1, 'embedding_dim': 32, 'lr': 0.0006436947787734689, 'lambda_val': 1.7046095272562947e-06, 'batch_size': 727, 'optimizer': 'Adam'}. Best is trial 46 with value: 0.04748435995661139.
2026-05-18 09:38:13,071 - optuna.study._optimize - INFO - Trial 146 pruned. 
2026-05-18 09:38:30,961 - experiment_functions - INFO - Early stopping at epoch 1300. Best Recall: 0.0461
2026-05-18 09:38:31,060 - optuna.study.study - INFO - Trial 147 finished with value: 0.046126466818183 and parameters: {'n_layers': 1, 'embedding_dim': 32, 'lr': 0.000612142672986282, 'lambda_val': 1.2632892730288033e-06, 'batch_size': 632, 'optimizer': 'Adam'}. Best is trial 46 with value: 0.04748435995661139.
2026-05-18 09:38:46,050 - optuna.study._optimize - INFO - Trial 148 pruned. 
2026-05-18 09:39:00,208 - optuna.study._optimize - INFO - Trial 149 pruned. 
2026-05-18 09:39:21,635 - experiment_functions - INFO - Early stopping at epoch 1600. Best Recall: 0.0464
2026-05-18 09:39:21,771 - optuna.study.study - INFO - Trial 150 finished with value: 0.04638255861162228 and parameters: {'n_layers': 1, 'embedding_dim': 32, 'lr': 0.0008598115316320503, 'lambda_val': 6.611621549222866e-06, 'batch_size': 703, 'optimizer': 'RMSprop'}. Best is trial 46 with value: 0.04748435995661139.
2026-05-18 09:39:50,703 - experiment_functions - INFO - Early stopping at epoch 2150. Best Recall: 0.0470
2026-05-18 09:39:50,803 - optuna.study.study - INFO - Trial 151 finished with value: 0.04700778708377851 and parameters: {'n_layers': 1, 'embedding_dim': 32, 'lr': 0.0006904893639052606, 'lambda_val': 1.5076907556730198e-06, 'batch_size': 515, 'optimizer': 'Adam'}. Best is trial 46 with value: 0.04748435995661139.
2026-05-18 09:40:04,556 - optuna.study._optimize - INFO - Trial 152 pruned. 
2026-05-18 09:40:20,311 - experiment_functions - INFO - Early stopping at epoch 1100. Best Recall: 0.0462
2026-05-18 09:40:20,421 - optuna.study.study - INFO - Trial 153 finished with value: 0.04618695920150113 and parameters: {'n_layers': 1, 'embedding_dim': 32, 'lr': 0.0006575219517634, 'lambda_val': 2.096075727915459e-06, 'batch_size': 643, 'optimizer': 'Adam'}. Best is trial 46 with value: 0.04748435995661139.
2026-05-18 09:40:27,972 - experiment_functions - INFO - Early stopping at epoch 500. Best Recall: 0.0050
2026-05-18 09:40:28,073 - optuna.study.study - INFO - Trial 154 finished with value: 0.005030860040575691 and parameters: {'n_layers': 4, 'embedding_dim': 32, 'lr': 0.09865447441953987, 'lambda_val': 1.257775423760211e-06, 'batch_size': 514, 'optimizer': 'Adam'}. Best is trial 46 with value: 0.04748435995661139.
2026-05-18 09:41:01,369 - experiment_functions - INFO - Early stopping at epoch 2500. Best Recall: 0.0466
2026-05-18 09:41:01,504 - optuna.study.study - INFO - Trial 155 finished with value: 0.046582794042099265 and parameters: {'n_layers': 1, 'embedding_dim': 32, 'lr': 0.00053254540482077, 'lambda_val': 6.556717155513356e-05, 'batch_size': 589, 'optimizer': 'Adam'}. Best is trial 46 with value: 0.04748435995661139.
2026-05-18 09:41:15,294 - optuna.study._optimize - INFO - Trial 156 pruned. 
2026-05-18 09:41:29,221 - optuna.study._optimize - INFO - Trial 157 pruned. 
2026-05-18 09:41:39,311 - experiment_functions - INFO - Early stopping at epoch 700. Best Recall: 0.0340
2026-05-18 09:41:39,413 - optuna.study.study - INFO - Trial 158 finished with value: 0.03403719965092449 and parameters: {'n_layers': 1, 'embedding_dim': 32, 'lr': 0.0011591676466895233, 'lambda_val': 1.1314201980929672e-06, 'batch_size': 2887, 'optimizer': 'Adam'}. Best is trial 46 with value: 0.04748435995661139.
2026-05-18 09:41:53,604 - optuna.study._optimize - INFO - Trial 159 pruned. 
2026-05-18 09:42:04,351 - experiment_functions - INFO - Early stopping at epoch 750. Best Recall: 0.0169
2026-05-18 09:42:04,506 - optuna.study.study - INFO - Trial 160 finished with value: 0.01685645665959008 and parameters: {'n_layers': 1, 'embedding_dim': 32, 'lr': 0.0005956983918424437, 'lambda_val': 0.04707097190372568, 'batch_size': 576, 'optimizer': 'Adam'}. Best is trial 46 with value: 0.04748435995661139.
2026-05-18 09:42:18,643 - optuna.study._optimize - INFO - Trial 161 pruned. 
2026-05-18 09:42:35,053 - experiment_functions - INFO - Early stopping at epoch 1200. Best Recall: 0.0465
2026-05-18 09:42:35,152 - optuna.study.study - INFO - Trial 162 finished with value: 0.04646474427211328 and parameters: {'n_layers': 1, 'embedding_dim': 32, 'lr': 0.000704181053467298, 'lambda_val': 2.21513396312684e-06, 'batch_size': 636, 'optimizer': 'Adam'}. Best is trial 46 with value: 0.04748435995661139.
2026-05-18 09:42:49,721 - optuna.study._optimize - INFO - Trial 163 pruned. 
2026-05-18 09:43:43,535 - optuna.study.study - INFO - Trial 164 finished with value: 0.04727598019659236 and parameters: {'n_layers': 1, 'embedding_dim': 32, 'lr': 0.0005300658857114292, 'lambda_val': 2.4775411355675182e-06, 'batch_size': 514, 'optimizer': 'Adam'}. Best is trial 46 with value: 0.04748435995661139.
2026-05-18 09:43:57,659 - optuna.study._optimize - INFO - Trial 165 pruned. 
2026-05-18 09:44:12,690 - optuna.study._optimize - INFO - Trial 166 pruned. 
2026-05-18 09:44:26,855 - optuna.study._optimize - INFO - Trial 167 pruned. 
2026-05-18 09:44:40,730 - optuna.study._optimize - INFO - Trial 168 pruned. 
2026-05-18 09:44:48,086 - experiment_functions - INFO - Early stopping at epoch 500. Best Recall: 0.0048
2026-05-18 09:44:48,187 - optuna.study.study - INFO - Trial 169 finished with value: 0.004828938644909468 and parameters: {'n_layers': 1, 'embedding_dim': 32, 'lr': 0.00025006768123902524, 'lambda_val': 2.0015872685980006e-06, 'batch_size': 611, 'optimizer': 'SGD'}. Best is trial 46 with value: 0.04748435995661139.
2026-05-18 09:45:02,932 - optuna.study._optimize - INFO - Trial 170 pruned. 
2026-05-18 09:45:33,540 - experiment_functions - INFO - Early stopping at epoch 2250. Best Recall: 0.0470
2026-05-18 09:45:34,050 - optuna.study.study - INFO - Trial 171 finished with value: 0.047029945026849325 and parameters: {'n_layers': 1, 'embedding_dim': 32, 'lr': 0.0006234409901984015, 'lambda_val': 1.6212509862300706e-06, 'batch_size': 578, 'optimizer': 'Adam'}. Best is trial 46 with value: 0.04748435995661139.
2026-05-18 09:45:59,931 - experiment_functions - INFO - Early stopping at epoch 1900. Best Recall: 0.0467
2026-05-18 09:46:00,030 - optuna.study.study - INFO - Trial 172 finished with value: 0.04665545112171318 and parameters: {'n_layers': 1, 'embedding_dim': 32, 'lr': 0.0006189550414444028, 'lambda_val': 1.2295645218459653e-06, 'batch_size': 513, 'optimizer': 'Adam'}. Best is trial 46 with value: 0.04748435995661139.
2026-05-18 09:46:21,301 - optuna.study._optimize - INFO - Trial 173 pruned. 
2026-05-18 09:46:52,793 - experiment_functions - INFO - Early stopping at epoch 2300. Best Recall: 0.0471
2026-05-18 09:46:52,883 - optuna.study.study - INFO - Trial 174 finished with value: 0.04708151296170831 and parameters: {'n_layers': 1, 'embedding_dim': 32, 'lr': 0.00042101162527012967, 'lambda_val': 1.46270308580222e-06, 'batch_size': 662, 'optimizer': 'Adam'}. Best is trial 46 with value: 0.04748435995661139.
2026-05-18 09:47:07,504 - optuna.study._optimize - INFO - Trial 175 pruned. 
2026-05-18 09:47:21,913 - optuna.study._optimize - INFO - Trial 176 pruned. 
2026-05-18 09:47:36,078 - optuna.study._optimize - INFO - Trial 177 pruned. 
2026-05-18 09:48:06,116 - experiment_functions - INFO - Early stopping at epoch 2200. Best Recall: 0.0467
2026-05-18 09:48:06,219 - optuna.study.study - INFO - Trial 178 finished with value: 0.04666189322614524 and parameters: {'n_layers': 1, 'embedding_dim': 32, 'lr': 0.0005523430607013707, 'lambda_val': 1.2945002376719544e-06, 'batch_size': 658, 'optimizer': 'Adam'}. Best is trial 46 with value: 0.04748435995661139.
2026-05-18 09:48:20,324 - optuna.study._optimize - INFO - Trial 179 pruned. 
2026-05-18 09:48:35,202 - optuna.study._optimize - INFO - Trial 180 pruned. 
2026-05-18 09:48:51,022 - experiment_functions - INFO - Early stopping at epoch 1200. Best Recall: 0.0464
2026-05-18 09:48:51,112 - optuna.study.study - INFO - Trial 181 finished with value: 0.046442061906735284 and parameters: {'n_layers': 1, 'embedding_dim': 32, 'lr': 0.0008460748987092983, 'lambda_val': 2.360077128759873e-06, 'batch_size': 652, 'optimizer': 'Adam'}. Best is trial 46 with value: 0.04748435995661139.
2026-05-18 09:49:04,323 - optuna.study._optimize - INFO - Trial 182 pruned. 
2026-05-18 09:49:19,503 - experiment_functions - INFO - Early stopping at epoch 1200. Best Recall: 0.0469
2026-05-18 09:49:19,594 - optuna.study.study - INFO - Trial 183 finished with value: 0.04685676373393025 and parameters: {'n_layers': 1, 'embedding_dim': 32, 'lr': 0.0007158279250979092, 'lambda_val': 1.9261222540441708e-06, 'batch_size': 649, 'optimizer': 'Adam'}. Best is trial 46 with value: 0.04748435995661139.
2026-05-18 09:49:32,637 - optuna.study._optimize - INFO - Trial 184 pruned. 
2026-05-18 09:49:46,200 - optuna.study._optimize - INFO - Trial 185 pruned. 
2026-05-18 09:50:23,721 - experiment_functions - INFO - Early stopping at epoch 3050. Best Recall: 0.0476
2026-05-18 09:50:23,811 - optuna.study.study - INFO - Trial 186 finished with value: 0.04761100058709113 and parameters: {'n_layers': 1, 'embedding_dim': 32, 'lr': 0.0004046337998239144, 'lambda_val': 1.4253270999173283e-06, 'batch_size': 570, 'optimizer': 'RMSprop'}. Best is trial 186 with value: 0.04761100058709113.
2026-05-18 09:51:06,139 - experiment_functions - INFO - Early stopping at epoch 2800. Best Recall: 0.0473
2026-05-18 09:51:06,228 - optuna.study.study - INFO - Trial 187 finished with value: 0.0473078930158761 and parameters: {'n_layers': 1, 'embedding_dim': 32, 'lr': 0.0004234627903067298, 'lambda_val': 1.2031129842062022e-06, 'batch_size': 570, 'optimizer': 'RMSprop'}. Best is trial 186 with value: 0.04761100058709113.
2026-05-18 09:51:53,335 - experiment_functions - INFO - Early stopping at epoch 3800. Best Recall: 0.0472
2026-05-18 09:51:53,426 - optuna.study.study - INFO - Trial 188 finished with value: 0.04718930148055661 and parameters: {'n_layers': 1, 'embedding_dim': 32, 'lr': 0.00043426716177105674, 'lambda_val': 1.018848006683318e-06, 'batch_size': 583, 'optimizer': 'RMSprop'}. Best is trial 186 with value: 0.04761100058709113.
2026-05-18 09:52:18,213 - experiment_functions - INFO - Early stopping at epoch 2000. Best Recall: 0.0476
2026-05-18 09:52:18,369 - optuna.study.study - INFO - Trial 189 finished with value: 0.047584754158203305 and parameters: {'n_layers': 1, 'embedding_dim': 32, 'lr': 0.00045664079781434206, 'lambda_val': 1.0520526693528796e-06, 'batch_size': 571, 'optimizer': 'RMSprop'}. Best is trial 186 with value: 0.04761100058709113.
2026-05-18 09:53:06,668 - experiment_functions - INFO - Early stopping at epoch 3850. Best Recall: 0.0479
2026-05-18 09:53:06,781 - optuna.study.study - INFO - Trial 190 finished with value: 0.04787569419915062 and parameters: {'n_layers': 1, 'embedding_dim': 32, 'lr': 0.00039148756418993147, 'lambda_val': 1.086513733824673e-06, 'batch_size': 578, 'optimizer': 'RMSprop'}. Best is trial 190 with value: 0.04787569419915062.
2026-05-18 09:54:02,003 - experiment_functions - INFO - Early stopping at epoch 3700. Best Recall: 0.0476
2026-05-18 09:54:02,131 - optuna.study.study - INFO - Trial 191 finished with value: 0.04758732410881848 and parameters: {'n_layers': 1, 'embedding_dim': 32, 'lr': 0.0004000981352356287, 'lambda_val': 1.0087241168291436e-06, 'batch_size': 579, 'optimizer': 'RMSprop'}. Best is trial 190 with value: 0.04787569419915062.
2026-05-18 09:54:41,182 - experiment_functions - INFO - Early stopping at epoch 2950. Best Recall: 0.0477
2026-05-18 09:54:41,310 - optuna.study.study - INFO - Trial 192 finished with value: 0.047704654145401156 and parameters: {'n_layers': 1, 'embedding_dim': 32, 'lr': 0.0004318484888390431, 'lambda_val': 1.0111695273926051e-06, 'batch_size': 580, 'optimizer': 'RMSprop'}. Best is trial 190 with value: 0.04787569419915062.
2026-05-18 09:54:55,240 - optuna.study._optimize - INFO - Trial 193 pruned. 
2026-05-18 09:55:42,914 - experiment_functions - INFO - Early stopping at epoch 3750. Best Recall: 0.0477
2026-05-18 09:55:43,002 - optuna.study.study - INFO - Trial 194 finished with value: 0.047670711672244986 and parameters: {'n_layers': 1, 'embedding_dim': 32, 'lr': 0.00041760855582949417, 'lambda_val': 1.0272893707962657e-06, 'batch_size': 548, 'optimizer': 'RMSprop'}. Best is trial 190 with value: 0.04787569419915062.
2026-05-18 09:56:12,703 - experiment_functions - INFO - Early stopping at epoch 2400. Best Recall: 0.0474
2026-05-18 09:56:12,793 - optuna.study.study - INFO - Trial 195 finished with value: 0.04735462140586073 and parameters: {'n_layers': 1, 'embedding_dim': 32, 'lr': 0.0004369803882279388, 'lambda_val': 1.0111140311292612e-06, 'batch_size': 515, 'optimizer': 'RMSprop'}. Best is trial 190 with value: 0.04787569419915062.
2026-05-18 09:57:10,629 - optuna.study.study - INFO - Trial 196 finished with value: 0.047783120606554846 and parameters: {'n_layers': 1, 'embedding_dim': 32, 'lr': 0.0003280398149499257, 'lambda_val': 1.037470624091338e-06, 'batch_size': 558, 'optimizer': 'RMSprop'}. Best is trial 190 with value: 0.04787569419915062.
2026-05-18 09:57:24,427 - optuna.study._optimize - INFO - Trial 197 pruned. 
2026-05-18 09:58:03,081 - experiment_functions - INFO - Early stopping at epoch 2550. Best Recall: 0.0475
2026-05-18 09:58:03,171 - optuna.study.study - INFO - Trial 198 finished with value: 0.04754457144801017 and parameters: {'n_layers': 1, 'embedding_dim': 32, 'lr': 0.0004189085443211096, 'lambda_val': 1.014101371279309e-06, 'batch_size': 514, 'optimizer': 'RMSprop'}. Best is trial 190 with value: 0.04787569419915062.
2026-05-18 09:58:16,231 - optuna.study._optimize - INFO - Trial 199 pruned. 
2026-05-18 09:58:29,321 - optuna.study._optimize - INFO - Trial 200 pruned. 
2026-05-18 09:59:00,222 - experiment_functions - INFO - Early stopping at epoch 2450. Best Recall: 0.0480
2026-05-18 09:59:00,313 - optuna.study.study - INFO - Trial 201 finished with value: 0.04801397345004151 and parameters: {'n_layers': 1, 'embedding_dim': 32, 'lr': 0.0004246915659866627, 'lambda_val': 1.2958522679040898e-06, 'batch_size': 577, 'optimizer': 'RMSprop'}. Best is trial 201 with value: 0.04801397345004151.
2026-05-18 09:59:41,900 - experiment_functions - INFO - Early stopping at epoch 3150. Best Recall: 0.0481
2026-05-18 09:59:42,680 - optuna.study.study - INFO - Trial 202 finished with value: 0.04806681194414436 and parameters: {'n_layers': 1, 'embedding_dim': 32, 'lr': 0.00036830829273655426, 'lambda_val': 1.2849540274879117e-06, 'batch_size': 626, 'optimizer': 'RMSprop'}. Best is trial 202 with value: 0.04806681194414436.
2026-05-18 10:00:24,652 - experiment_functions - INFO - Early stopping at epoch 2950. Best Recall: 0.0476
2026-05-18 10:00:24,743 - optuna.study.study - INFO - Trial 203 finished with value: 0.04758656057434808 and parameters: {'n_layers': 1, 'embedding_dim': 32, 'lr': 0.00040904378888527145, 'lambda_val': 1.2988380124377784e-06, 'batch_size': 600, 'optimizer': 'RMSprop'}. Best is trial 202 with value: 0.04806681194414436.
2026-05-18 10:01:05,155 - experiment_functions - INFO - Early stopping at epoch 3300. Best Recall: 0.0475
2026-05-18 10:01:05,504 - optuna.study.study - INFO - Trial 204 finished with value: 0.04749431794073255 and parameters: {'n_layers': 1, 'embedding_dim': 32, 'lr': 0.00040718062628964356, 'lambda_val': 1.0064125502079716e-06, 'batch_size': 622, 'optimizer': 'RMSprop'}. Best is trial 202 with value: 0.04806681194414436.
2026-05-18 10:01:47,104 - experiment_functions - INFO - Early stopping at epoch 3450. Best Recall: 0.0479
2026-05-18 10:01:47,195 - optuna.study.study - INFO - Trial 205 finished with value: 0.04788445933967644 and parameters: {'n_layers': 1, 'embedding_dim': 32, 'lr': 0.00041002308222505546, 'lambda_val': 1.2613282230191793e-06, 'batch_size': 631, 'optimizer': 'RMSprop'}. Best is trial 202 with value: 0.04806681194414436.
2026-05-18 10:02:35,613 - optuna.study.study - INFO - Trial 206 finished with value: 0.04782398742870653 and parameters: {'n_layers': 1, 'embedding_dim': 32, 'lr': 0.00033999009184116686, 'lambda_val': 1.0153162216106374e-06, 'batch_size': 626, 'optimizer': 'RMSprop'}. Best is trial 202 with value: 0.04806681194414436.
2026-05-18 10:02:48,490 - optuna.study._optimize - INFO - Trial 207 pruned. 
2026-05-18 10:03:01,047 - optuna.study._optimize - INFO - Trial 208 pruned. 
2026-05-18 10:03:14,208 - optuna.study._optimize - INFO - Trial 209 pruned. 
2026-05-18 10:03:48,438 - experiment_functions - INFO - Early stopping at epoch 2800. Best Recall: 0.0477
2026-05-18 10:03:48,537 - optuna.study.study - INFO - Trial 210 finished with value: 0.04765088146496386 and parameters: {'n_layers': 1, 'embedding_dim': 32, 'lr': 0.0004013212589614597, 'lambda_val': 1.3327997411758754e-06, 'batch_size': 581, 'optimizer': 'RMSprop'}. Best is trial 202 with value: 0.04806681194414436.
2026-05-18 10:04:31,914 - experiment_functions - INFO - Early stopping at epoch 3550. Best Recall: 0.0483
2026-05-18 10:04:32,014 - optuna.study.study - INFO - Trial 211 finished with value: 0.04825753319366663 and parameters: {'n_layers': 1, 'embedding_dim': 32, 'lr': 0.00040452504367858574, 'lambda_val': 1.2718637993075716e-06, 'batch_size': 587, 'optimizer': 'RMSprop'}. Best is trial 211 with value: 0.04825753319366663.
2026-05-18 10:05:13,895 - experiment_functions - INFO - Early stopping at epoch 2900. Best Recall: 0.0479
2026-05-18 10:05:13,985 - optuna.study.study - INFO - Trial 212 finished with value: 0.04785488597572818 and parameters: {'n_layers': 1, 'embedding_dim': 32, 'lr': 0.0003841468573372481, 'lambda_val': 1.2395325046659192e-06, 'batch_size': 581, 'optimizer': 'RMSprop'}. Best is trial 211 with value: 0.04825753319366663.
2026-05-18 10:05:27,517 - optuna.study._optimize - INFO - Trial 213 pruned. 
2026-05-18 10:06:19,569 - experiment_functions - INFO - Early stopping at epoch 3550. Best Recall: 0.0479
2026-05-18 10:06:19,669 - optuna.study.study - INFO - Trial 214 finished with value: 0.04792508934942867 and parameters: {'n_layers': 1, 'embedding_dim': 32, 'lr': 0.00038404323062327653, 'lambda_val': 1.3403046712195395e-06, 'batch_size': 518, 'optimizer': 'RMSprop'}. Best is trial 211 with value: 0.04825753319366663.
2026-05-18 10:06:33,217 - optuna.study._optimize - INFO - Trial 215 pruned. 
2026-05-18 10:06:46,062 - optuna.study._optimize - INFO - Trial 216 pruned. 
2026-05-18 10:06:59,370 - optuna.study._optimize - INFO - Trial 217 pruned. 
2026-05-18 10:07:52,880 - experiment_functions - INFO - Early stopping at epoch 3750. Best Recall: 0.0475
2026-05-18 10:07:52,969 - optuna.study.study - INFO - Trial 218 finished with value: 0.047511478040646 and parameters: {'n_layers': 1, 'embedding_dim': 32, 'lr': 0.0003804038953581511, 'lambda_val': 1.0108421495740936e-06, 'batch_size': 602, 'optimizer': 'RMSprop'}. Best is trial 211 with value: 0.04825753319366663.
2026-05-18 10:08:05,799 - optuna.study._optimize - INFO - Trial 219 pruned. 
2026-05-18 10:08:19,263 - optuna.study._optimize - INFO - Trial 220 pruned. 
2026-05-18 10:09:04,541 - experiment_functions - INFO - Early stopping at epoch 3400. Best Recall: 0.0480
