2026-05-18 05:12:27,850 - optuna.study._optimize - INFO - Trial 256 pruned. 
2026-05-18 05:12:44,470 - experiment_functions - INFO - Early stopping at epoch 1100. Best Recall: 0.0686
2026-05-18 05:12:44,563 - optuna.study.study - INFO - Trial 257 finished with value: 0.06861114129167606 and parameters: {'n_layers': 1, 'embedding_dim': 32, 'lr': 0.0012246307371243889, 'lambda_val': 0.0007820235607828352, 'batch_size': 514, 'optimizer': 'RMSprop'}. Best is trial 211 with value: 0.07552732782181781.
2026-05-18 05:12:57,885 - experiment_functions - INFO - Early stopping at epoch 800. Best Recall: 0.0656
2026-05-18 05:12:57,988 - optuna.study.study - INFO - Trial 258 finished with value: 0.0655666379294803 and parameters: {'n_layers': 1, 'embedding_dim': 32, 'lr': 0.0015142242121223353, 'lambda_val': 0.00037990374457986083, 'batch_size': 846, 'optimizer': 'RMSprop'}. Best is trial 211 with value: 0.07552732782181781.
2026-05-18 05:13:16,296 - optuna.study._optimize - INFO - Trial 259 pruned. 
2026-05-18 05:13:35,196 - experiment_functions - INFO - Early stopping at epoch 1250. Best Recall: 0.0678
2026-05-18 05:13:35,288 - optuna.study.study - INFO - Trial 260 finished with value: 0.06784330387086451 and parameters: {'n_layers': 1, 'embedding_dim': 32, 'lr': 0.0010563305759763394, 'lambda_val': 0.0018239956290651731, 'batch_size': 585, 'optimizer': 'RMSprop'}. Best is trial 211 with value: 0.07552732782181781.
2026-05-18 05:13:48,517 - experiment_functions - INFO - Early stopping at epoch 600. Best Recall: 0.0321
2026-05-18 05:13:48,618 - optuna.study.study - INFO - Trial 261 finished with value: 0.03212600845069935 and parameters: {'n_layers': 4, 'embedding_dim': 256, 'lr': 0.0005691052122162544, 'lambda_val': 1.0398647615519872e-06, 'batch_size': 638, 'optimizer': 'RMSprop'}. Best is trial 211 with value: 0.07552732782181781.
2026-05-18 05:14:11,671 - experiment_functions - INFO - Early stopping at epoch 1450. Best Recall: 0.0719
2026-05-18 05:14:11,805 - optuna.study.study - INFO - Trial 262 finished with value: 0.07185952894544564 and parameters: {'n_layers': 1, 'embedding_dim': 32, 'lr': 0.0009394942753809655, 'lambda_val': 0.0005240868955359679, 'batch_size': 799, 'optimizer': 'RMSprop'}. Best is trial 211 with value: 0.07552732782181781.
2026-05-18 05:14:19,512 - experiment_functions - INFO - Early stopping at epoch 500. Best Recall: 0.0054
2026-05-18 05:14:19,602 - optuna.study.study - INFO - Trial 263 finished with value: 0.005392093961246179 and parameters: {'n_layers': 1, 'embedding_dim': 32, 'lr': 0.0009341164937084676, 'lambda_val': 0.0005263576846648951, 'batch_size': 719, 'optimizer': 'SGD'}. Best is trial 211 with value: 0.07552732782181781.
2026-05-18 05:14:32,529 - experiment_functions - INFO - Early stopping at epoch 800. Best Recall: 0.0551
2026-05-18 05:14:32,620 - optuna.study.study - INFO - Trial 264 finished with value: 0.055078639395860884 and parameters: {'n_layers': 1, 'embedding_dim': 128, 'lr': 0.0013212112816025341, 'lambda_val': 0.0009125100379985907, 'batch_size': 513, 'optimizer': 'RMSprop'}. Best is trial 211 with value: 0.07552732782181781.
2026-05-18 05:15:03,125 - optuna.study._optimize - INFO - Trial 265 pruned. 
2026-05-18 05:15:12,966 - experiment_functions - INFO - Early stopping at epoch 600. Best Recall: 0.0438
2026-05-18 05:15:13,121 - optuna.study.study - INFO - Trial 266 finished with value: 0.04380389838077866 and parameters: {'n_layers': 2, 'embedding_dim': 32, 'lr': 0.001064109611800744, 'lambda_val': 0.0006903973109583828, 'batch_size': 3238, 'optimizer': 'RMSprop'}. Best is trial 211 with value: 0.07552732782181781.
2026-05-18 05:15:35,313 - experiment_functions - INFO - Early stopping at epoch 1250. Best Recall: 0.0702
2026-05-18 05:15:35,436 - optuna.study.study - INFO - Trial 267 finished with value: 0.07015133959674957 and parameters: {'n_layers': 1, 'embedding_dim': 32, 'lr': 0.0011730520174926228, 'lambda_val': 0.00046814742790659116, 'batch_size': 577, 'optimizer': 'RMSprop'}. Best is trial 211 with value: 0.07552732782181781.
2026-05-18 05:16:11,901 - experiment_functions - INFO - Early stopping at epoch 1850. Best Recall: 0.0706
2026-05-18 05:16:12,820 - optuna.study.study - INFO - Trial 268 finished with value: 0.07055995175044401 and parameters: {'n_layers': 1, 'embedding_dim': 32, 'lr': 0.0008795173114610252, 'lambda_val': 0.0009044225871190544, 'batch_size': 784, 'optimizer': 'RMSprop'}. Best is trial 211 with value: 0.07552732782181781.
2026-05-18 05:16:29,992 - optuna.study._optimize - INFO - Trial 269 pruned. 
2026-05-18 05:16:44,463 - experiment_functions - INFO - Early stopping at epoch 950. Best Recall: 0.0652
2026-05-18 05:16:44,553 - optuna.study.study - INFO - Trial 270 finished with value: 0.06521405855282146 and parameters: {'n_layers': 1, 'embedding_dim': 32, 'lr': 0.0014504028251803934, 'lambda_val': 0.0003797029622224825, 'batch_size': 578, 'optimizer': 'RMSprop'}. Best is trial 211 with value: 0.07552732782181781.
2026-05-18 05:17:23,507 - experiment_functions - INFO - Early stopping at epoch 2000. Best Recall: 0.0720
2026-05-18 05:17:23,632 - optuna.study.study - INFO - Trial 271 finished with value: 0.07196840544846902 and parameters: {'n_layers': 1, 'embedding_dim': 32, 'lr': 0.0008361056860731448, 'lambda_val': 0.0006960560431229464, 'batch_size': 662, 'optimizer': 'RMSprop'}. Best is trial 211 with value: 0.07552732782181781.
2026-05-18 05:17:38,253 - optuna.study._optimize - INFO - Trial 272 pruned. 
2026-05-18 05:17:55,327 - optuna.study._optimize - INFO - Trial 273 pruned. 
2026-05-18 05:18:12,051 - optuna.study._optimize - INFO - Trial 274 pruned. 
2026-05-18 05:18:52,945 - optuna.study._optimize - INFO - Trial 275 pruned. 
2026-05-18 05:19:10,473 - optuna.study._optimize - INFO - Trial 276 pruned. 
2026-05-18 05:19:27,228 - experiment_functions - INFO - Early stopping at epoch 950. Best Recall: 0.0582
2026-05-18 05:19:27,438 - optuna.study.study - INFO - Trial 277 finished with value: 0.05819391619940223 and parameters: {'n_layers': 1, 'embedding_dim': 32, 'lr': 0.0009691119801774886, 'lambda_val': 2.477181868968711e-06, 'batch_size': 1604, 'optimizer': 'RMSprop'}. Best is trial 211 with value: 0.07552732782181781.
2026-05-18 05:19:42,208 - optuna.study._optimize - INFO - Trial 278 pruned. 
2026-05-18 05:19:59,906 - experiment_functions - INFO - Early stopping at epoch 1200. Best Recall: 0.0684
2026-05-18 05:19:59,996 - optuna.study.study - INFO - Trial 279 finished with value: 0.06835516274164462 and parameters: {'n_layers': 1, 'embedding_dim': 32, 'lr': 0.0012168847707350046, 'lambda_val': 0.0005073131894289917, 'batch_size': 641, 'optimizer': 'RMSprop'}. Best is trial 211 with value: 0.07552732782181781.
2026-05-18 05:20:14,752 - optuna.study._optimize - INFO - Trial 280 pruned. 
2026-05-18 05:20:26,170 - experiment_functions - INFO - Early stopping at epoch 750. Best Recall: 0.0668
2026-05-18 05:20:26,262 - optuna.study.study - INFO - Trial 281 finished with value: 0.06679771932114115 and parameters: {'n_layers': 1, 'embedding_dim': 32, 'lr': 0.0017584579674691356, 'lambda_val': 0.0007674418043927109, 'batch_size': 514, 'optimizer': 'RMSprop'}. Best is trial 211 with value: 0.07552732782181781.
2026-05-18 05:20:42,472 - experiment_functions - INFO - Early stopping at epoch 950. Best Recall: 0.0636
2026-05-18 05:20:42,563 - optuna.study.study - INFO - Trial 282 finished with value: 0.06363908813471642 and parameters: {'n_layers': 1, 'embedding_dim': 32, 'lr': 0.0010066038979499718, 'lambda_val': 0.00038857047124188257, 'batch_size': 1489, 'optimizer': 'RMSprop'}. Best is trial 211 with value: 0.07552732782181781.
2026-05-18 05:20:49,905 - experiment_functions - INFO - Early stopping at epoch 500. Best Recall: 0.0045
2026-05-18 05:20:50,008 - optuna.study.study - INFO - Trial 283 finished with value: 0.004519309683228475 and parameters: {'n_layers': 1, 'embedding_dim': 32, 'lr': 0.0005426316156732126, 'lambda_val': 0.00019436765468471215, 'batch_size': 716, 'optimizer': 'SGD'}. Best is trial 211 with value: 0.07552732782181781.
2026-05-18 05:21:18,014 - optuna.study._optimize - INFO - Trial 284 pruned. 
2026-05-18 05:21:33,735 - optuna.study._optimize - INFO - Trial 285 pruned. 
2026-05-18 05:21:54,745 - experiment_functions - INFO - Early stopping at epoch 1250. Best Recall: 0.0682
2026-05-18 05:21:54,836 - optuna.study.study - INFO - Trial 286 finished with value: 0.06823872581972354 and parameters: {'n_layers': 1, 'embedding_dim': 32, 'lr': 0.0011732535511051543, 'lambda_val': 0.0002365722839289183, 'batch_size': 840, 'optimizer': 'RMSprop'}. Best is trial 211 with value: 0.07552732782181781.
2026-05-18 05:22:09,110 - experiment_functions - INFO - Early stopping at epoch 950. Best Recall: 0.0657
2026-05-18 05:22:09,258 - optuna.study.study - INFO - Trial 287 finished with value: 0.06567799816826159 and parameters: {'n_layers': 1, 'embedding_dim': 32, 'lr': 0.001386945488270542, 'lambda_val': 0.0004582792142142084, 'batch_size': 757, 'optimizer': 'RMSprop'}. Best is trial 211 with value: 0.07552732782181781.
2026-05-18 05:22:23,977 - optuna.study._optimize - INFO - Trial 288 pruned. 
2026-05-18 05:22:38,537 - optuna.study._optimize - INFO - Trial 289 pruned. 
2026-05-18 05:22:54,042 - optuna.study._optimize - INFO - Trial 290 pruned. 
2026-05-18 05:23:27,397 - experiment_functions - INFO - Early stopping at epoch 2300. Best Recall: 0.0719
2026-05-18 05:23:27,527 - optuna.study.study - INFO - Trial 291 finished with value: 0.07193878356257162 and parameters: {'n_layers': 1, 'embedding_dim': 32, 'lr': 0.0008037554690553653, 'lambda_val': 0.0005653079671412874, 'batch_size': 701, 'optimizer': 'RMSprop'}. Best is trial 211 with value: 0.07552732782181781.
2026-05-18 05:23:42,465 - optuna.study._optimize - INFO - Trial 292 pruned. 
2026-05-18 05:23:57,984 - optuna.study._optimize - INFO - Trial 293 pruned. 
2026-05-18 05:24:15,163 - optuna.study._optimize - INFO - Trial 294 pruned. 
2026-05-18 05:24:52,410 - optuna.study._optimize - INFO - Trial 295 pruned. 
2026-05-18 05:25:06,970 - optuna.study._optimize - INFO - Trial 296 pruned. 
2026-05-18 05:25:21,986 - optuna.study._optimize - INFO - Trial 297 pruned. 
2026-05-18 05:25:36,875 - optuna.study._optimize - INFO - Trial 298 pruned. 
2026-05-18 05:25:51,519 - experiment_functions - INFO - Early stopping at epoch 950. Best Recall: 0.0605
2026-05-18 05:25:51,630 - optuna.study.study - INFO - Trial 299 finished with value: 0.0605265977911966 and parameters: {'n_layers': 1, 'embedding_dim': 32, 'lr': 0.0013932360910570711, 'lambda_val': 0.0002316277756479347, 'batch_size': 605, 'optimizer': 'RMSprop'}. Best is trial 211 with value: 0.07552732782181781.
2026-05-18 05:26:26,891 - experiment_functions - INFO - Early stopping at epoch 3000. Best Recall: 0.0739
2026-05-18 05:26:27,804 - root - INFO -   **** Training e_1M_1c1dcs_rand4
2026-05-18 05:26:27,858 - root - INFO -   **** Getting 190231/805443 random edges
2026-05-18 05:26:28,504 - optuna.storages._rdb.storage - INFO - A new study created in RDB with name: Study_e_1M_1c1dcs_rand4
2026-05-18 05:26:40,381 - experiment_functions - INFO - Early stopping at epoch 500. Best Recall: 0.0051
2026-05-18 05:26:40,481 - optuna.study.study - INFO - Trial 0 finished with value: 0.005098705105205122 and parameters: {'n_layers': 1, 'embedding_dim': 128, 'lr': 5.5314223717789756e-05, 'lambda_val': 0.018397803638087788, 'batch_size': 3112, 'optimizer': 'RMSprop'}. Best is trial 0 with value: 0.005098705105205122.
2026-05-18 05:26:55,319 - experiment_functions - INFO - Early stopping at epoch 700. Best Recall: 0.0435
2026-05-18 05:26:55,421 - optuna.study.study - INFO - Trial 1 finished with value: 0.04351281551725167 and parameters: {'n_layers': 2, 'embedding_dim': 96, 'lr': 0.0004964267764420377, 'lambda_val': 0.0012206522029014316, 'batch_size': 3778, 'optimizer': 'RMSprop'}. Best is trial 1 with value: 0.04351281551725167.
2026-05-18 05:28:08,255 - optuna.study.study - INFO - Trial 2 finished with value: 0.024470244829915447 and parameters: {'n_layers': 4, 'embedding_dim': 32, 'lr': 0.00010486241298286033, 'lambda_val': 0.00011929734271222384, 'batch_size': 3820, 'optimizer': 'RMSprop'}. Best is trial 1 with value: 0.04351281551725167.
2026-05-18 05:28:16,527 - experiment_functions - INFO - Early stopping at epoch 500. Best Recall: 0.0044
2026-05-18 05:28:16,619 - optuna.study.study - INFO - Trial 3 finished with value: 0.0043716172698221025 and parameters: {'n_layers': 2, 'embedding_dim': 96, 'lr': 8.949982253152196e-05, 'lambda_val': 0.02017867453037046, 'batch_size': 1182, 'optimizer': 'SGD'}. Best is trial 1 with value: 0.04351281551725167.
2026-05-18 05:28:45,325 - experiment_functions - INFO - Early stopping at epoch 1600. Best Recall: 0.0108
2026-05-18 05:28:46,089 - optuna.study.study - INFO - Trial 4 finished with value: 0.0108042898144282 and parameters: {'n_layers': 3, 'embedding_dim': 256, 'lr': 0.006292767429321633, 'lambda_val': 0.09812950978553057, 'batch_size': 3940, 'optimizer': 'RMSprop'}. Best is trial 1 with value: 0.04351281551725167.
2026-05-18 05:29:01,327 - experiment_functions - INFO - Early stopping at epoch 500. Best Recall: 0.0050
2026-05-18 05:29:01,504 - optuna.study.study - INFO - Trial 5 finished with value: 0.0049777749284387555 and parameters: {'n_layers': 1, 'embedding_dim': 96, 'lr': 0.014461922095829334, 'lambda_val': 0.012682742404368926, 'batch_size': 4047, 'optimizer': 'SGD'}. Best is trial 1 with value: 0.04351281551725167.
2026-05-18 05:29:34,961 - experiment_functions - INFO - Early stopping at epoch 2100. Best Recall: 0.0259
2026-05-18 05:29:35,052 - optuna.study.study - INFO - Trial 6 finished with value: 0.02591864483469831 and parameters: {'n_layers': 3, 'embedding_dim': 128, 'lr': 0.0043803741996931555, 'lambda_val': 0.00018422313574558338, 'batch_size': 3342, 'optimizer': 'RMSprop'}. Best is trial 1 with value: 0.04351281551725167.
2026-05-18 05:29:42,770 - experiment_functions - INFO - Early stopping at epoch 500. Best Recall: 0.0050
2026-05-18 05:29:42,861 - optuna.study.study - INFO - Trial 7 finished with value: 0.004967422195339971 and parameters: {'n_layers': 2, 'embedding_dim': 128, 'lr': 0.024042235095086385, 'lambda_val': 0.009784602724831724, 'batch_size': 1348, 'optimizer': 'SGD'}. Best is trial 1 with value: 0.04351281551725167.
2026-05-18 05:30:09,659 - experiment_functions - INFO - Early stopping at epoch 1600. Best Recall: 0.0226
2026-05-18 05:30:09,760 - optuna.study.study - INFO - Trial 8 finished with value: 0.022557979568633462 and parameters: {'n_layers': 2, 'embedding_dim': 256, 'lr': 0.008587454698918175, 'lambda_val': 0.002921665459585434, 'batch_size': 633, 'optimizer': 'Adam'}. Best is trial 1 with value: 0.04351281551725167.
2026-05-18 05:30:18,009 - experiment_functions - INFO - Early stopping at epoch 500. Best Recall: 0.0046
2026-05-18 05:30:18,118 - optuna.study.study - INFO - Trial 9 finished with value: 0.004614703538293502 and parameters: {'n_layers': 3, 'embedding_dim': 96, 'lr': 1.4273743985386787e-05, 'lambda_val': 0.08060595660143655, 'batch_size': 2094, 'optimizer': 'Adam'}. Best is trial 1 with value: 0.04351281551725167.
2026-05-18 05:30:28,315 - experiment_functions - INFO - Early stopping at epoch 600. Best Recall: 0.0283
2026-05-18 05:30:28,471 - optuna.study.study - INFO - Trial 10 finished with value: 0.028315645578690016 and parameters: {'n_layers': 4, 'embedding_dim': 64, 'lr': 0.000726245483446737, 'lambda_val': 4.107428130917877e-06, 'batch_size': 2580, 'optimizer': 'RMSprop'}. Best is trial 1 with value: 0.04351281551725167.
2026-05-18 05:30:37,496 - experiment_functions - INFO - Early stopping at epoch 550. Best Recall: 0.0337
2026-05-18 05:30:37,633 - optuna.study.study - INFO - Trial 11 finished with value: 0.033707726639670324 and parameters: {'n_layers': 4, 'embedding_dim': 64, 'lr': 0.0009324546099714793, 'lambda_val': 2.829821685964629e-06, 'batch_size': 2462, 'optimizer': 'RMSprop'}. Best is trial 1 with value: 0.04351281551725167.
2026-05-18 05:30:46,681 - experiment_functions - INFO - Early stopping at epoch 550. Best Recall: 0.0235
2026-05-18 05:30:46,772 - optuna.study.study - INFO - Trial 12 finished with value: 0.023485744479443658 and parameters: {'n_layers': 4, 'embedding_dim': 64, 'lr': 0.0013073372938294091, 'lambda_val': 1.5577130012771462e-06, 'batch_size': 2232, 'optimizer': 'RMSprop'}. Best is trial 1 with value: 0.04351281551725167.
2026-05-18 05:30:56,333 - experiment_functions - INFO - Early stopping at epoch 600. Best Recall: 0.0426
2026-05-18 05:30:56,458 - optuna.study.study - INFO - Trial 13 finished with value: 0.04255738380251327 and parameters: {'n_layers': 2, 'embedding_dim': 64, 'lr': 0.0008150428387606686, 'lambda_val': 2.524222555302746e-05, 'batch_size': 2933, 'optimizer': 'RMSprop'}. Best is trial 1 with value: 0.04351281551725167.
2026-05-18 05:31:25,047 - experiment_functions - INFO - Early stopping at epoch 1950. Best Recall: 0.0416
2026-05-18 05:31:25,146 - optuna.study.study - INFO - Trial 14 finished with value: 0.0415648166499646 and parameters: {'n_layers': 2, 'embedding_dim': 32, 'lr': 0.00033464231998336274, 'lambda_val': 3.0374859581766935e-05, 'batch_size': 3088, 'optimizer': 'RMSprop'}. Best is trial 1 with value: 0.04351281551725167.
2026-05-18 05:31:35,421 - experiment_functions - INFO - Early stopping at epoch 650. Best Recall: 0.0500
2026-05-18 05:31:35,524 - optuna.study.study - INFO - Trial 15 finished with value: 0.04996706591898963 and parameters: {'n_layers': 1, 'embedding_dim': 96, 'lr': 0.0022426407056811305, 'lambda_val': 0.001011108998986462, 'batch_size': 3463, 'optimizer': 'Adam'}. Best is trial 15 with value: 0.04996706591898963.
2026-05-18 05:31:44,338 - experiment_functions - INFO - Early stopping at epoch 550. Best Recall: 0.0121
2026-05-18 05:31:44,437 - optuna.study.study - INFO - Trial 16 finished with value: 0.012122783771405474 and parameters: {'n_layers': 1, 'embedding_dim': 96, 'lr': 0.06727494699737206, 'lambda_val': 0.0012315556046727954, 'batch_size': 3585, 'optimizer': 'Adam'}. Best is trial 15 with value: 0.04996706591898963.
2026-05-18 05:31:54,900 - experiment_functions - INFO - Early stopping at epoch 650. Best Recall: 0.0557
2026-05-18 05:31:55,670 - optuna.study.study - INFO - Trial 17 finished with value: 0.055728908376572676 and parameters: {'n_layers': 1, 'embedding_dim': 96, 'lr': 0.0018780633509674195, 'lambda_val': 0.0007711215416400463, 'batch_size': 3574, 'optimizer': 'Adam'}. Best is trial 17 with value: 0.055728908376572676.
2026-05-18 05:32:14,345 - experiment_functions - INFO - Early stopping at epoch 650. Best Recall: 0.0544
2026-05-18 05:32:14,435 - optuna.study.study - INFO - Trial 18 finished with value: 0.05444905694435839 and parameters: {'n_layers': 1, 'embedding_dim': 96, 'lr': 0.002306585308448081, 'lambda_val': 0.0004871952181325345, 'batch_size': 3441, 'optimizer': 'Adam'}. Best is trial 17 with value: 0.055728908376572676.
2026-05-18 05:32:24,335 - experiment_functions - INFO - Early stopping at epoch 650. Best Recall: 0.0602
2026-05-18 05:32:24,427 - optuna.study.study - INFO - Trial 19 finished with value: 0.06020028666994786 and parameters: {'n_layers': 1, 'embedding_dim': 96, 'lr': 0.002667247013932029, 'lambda_val': 5.177223174471498e-05, 'batch_size': 1822, 'optimizer': 'Adam'}. Best is trial 19 with value: 0.06020028666994786.
2026-05-18 05:32:38,301 - optuna.study._optimize - INFO - Trial 20 pruned. 
2026-05-18 05:32:49,243 - experiment_functions - INFO - Early stopping at epoch 700. Best Recall: 0.0581
2026-05-18 05:32:49,377 - optuna.study.study - INFO - Trial 21 finished with value: 0.05813512969877492 and parameters: {'n_layers': 1, 'embedding_dim': 96, 'lr': 0.0024724144199803773, 'lambda_val': 0.00040147267669786717, 'batch_size': 1690, 'optimizer': 'Adam'}. Best is trial 19 with value: 0.06020028666994786.
2026-05-18 05:32:59,659 - experiment_functions - INFO - Early stopping at epoch 650. Best Recall: 0.0567
2026-05-18 05:32:59,767 - optuna.study.study - INFO - Trial 22 finished with value: 0.05670242738697392 and parameters: {'n_layers': 1, 'embedding_dim': 96, 'lr': 0.0027458268964797683, 'lambda_val': 1.0657690697145243e-05, 'batch_size': 1674, 'optimizer': 'Adam'}. Best is trial 19 with value: 0.06020028666994786.
2026-05-18 05:33:09,039 - experiment_functions - INFO - Early stopping at epoch 600. Best Recall: 0.0219
2026-05-18 05:33:09,204 - optuna.study.study - INFO - Trial 23 finished with value: 0.021911230342935285 and parameters: {'n_layers': 1, 'embedding_dim': 96, 'lr': 0.028940096810312285, 'lambda_val': 1.0264069192301428e-05, 'batch_size': 1696, 'optimizer': 'Adam'}. Best is trial 19 with value: 0.06020028666994786.
2026-05-18 05:33:23,027 - experiment_functions - INFO - Early stopping at epoch 650. Best Recall: 0.0590
2026-05-18 05:33:23,794 - optuna.study.study - INFO - Trial 24 finished with value: 0.05895424323885002 and parameters: {'n_layers': 1, 'embedding_dim': 96, 'lr': 0.0032138095134068953, 'lambda_val': 1.8543469624341926e-05, 'batch_size': 1655, 'optimizer': 'Adam'}. Best is trial 19 with value: 0.06020028666994786.
2026-05-18 05:33:38,244 - experiment_functions - INFO - Early stopping at epoch 550. Best Recall: 0.0432
2026-05-18 05:33:38,323 - optuna.study.study - INFO - Trial 25 finished with value: 0.04320276416888575 and parameters: {'n_layers': 1, 'embedding_dim': 256, 'lr': 0.01147568525742646, 'lambda_val': 8.532482890998998e-05, 'batch_size': 1056, 'optimizer': 'Adam'}. Best is trial 19 with value: 0.06020028666994786.
2026-05-18 05:33:47,554 - experiment_functions - INFO - Early stopping at epoch 600. Best Recall: 0.0462
