2026-05-18 06:24:44,964 - optuna.study.study - INFO - Trial 206 finished with value: 0.06655368641415775 and parameters: {'n_layers': 1, 'embedding_dim': 32, 'lr': 0.0009943897181499605, 'lambda_val': 0.008239916720663631, 'batch_size': 697, 'optimizer': 'RMSprop'}. Best is trial 171 with value: 0.07732428247066869.
2026-05-18 06:24:57,743 - optuna.study._optimize - INFO - Trial 207 pruned. 
2026-05-18 06:25:20,900 - experiment_functions - INFO - Early stopping at epoch 1800. Best Recall: 0.0698
2026-05-18 06:25:21,008 - optuna.study.study - INFO - Trial 208 finished with value: 0.06983960550173783 and parameters: {'n_layers': 1, 'embedding_dim': 32, 'lr': 0.0006910744166027024, 'lambda_val': 0.015098143714802515, 'batch_size': 722, 'optimizer': 'RMSprop'}. Best is trial 171 with value: 0.07732428247066869.
2026-05-18 06:25:33,702 - optuna.study._optimize - INFO - Trial 209 pruned. 
2026-05-18 06:25:51,640 - experiment_functions - INFO - Early stopping at epoch 1350. Best Recall: 0.0669
2026-05-18 06:25:51,730 - optuna.study.study - INFO - Trial 210 finished with value: 0.06687841199082636 and parameters: {'n_layers': 1, 'embedding_dim': 32, 'lr': 0.0006947108568031171, 'lambda_val': 0.021179707197943053, 'batch_size': 719, 'optimizer': 'RMSprop'}. Best is trial 171 with value: 0.07732428247066869.
2026-05-18 06:26:15,738 - experiment_functions - INFO - Early stopping at epoch 1050. Best Recall: 0.0620
2026-05-18 06:26:15,828 - optuna.study.study - INFO - Trial 211 finished with value: 0.06195562845240591 and parameters: {'n_layers': 1, 'embedding_dim': 32, 'lr': 0.0008277223312813593, 'lambda_val': 0.014777371964901465, 'batch_size': 778, 'optimizer': 'RMSprop'}. Best is trial 171 with value: 0.07732428247066869.
2026-05-18 06:26:42,048 - experiment_functions - INFO - Early stopping at epoch 1900. Best Recall: 0.0724
2026-05-18 06:26:42,138 - optuna.study.study - INFO - Trial 212 finished with value: 0.07244644863652863 and parameters: {'n_layers': 1, 'embedding_dim': 32, 'lr': 0.0006390201800552757, 'lambda_val': 0.011084230194879896, 'batch_size': 868, 'optimizer': 'RMSprop'}. Best is trial 171 with value: 0.07732428247066869.
2026-05-18 06:26:55,719 - optuna.study._optimize - INFO - Trial 213 pruned. 
2026-05-18 06:27:22,294 - experiment_functions - INFO - Early stopping at epoch 2100. Best Recall: 0.0697
2026-05-18 06:27:22,437 - optuna.study.study - INFO - Trial 214 finished with value: 0.06974149766220601 and parameters: {'n_layers': 1, 'embedding_dim': 32, 'lr': 0.0006661247503695124, 'lambda_val': 0.006993723212614609, 'batch_size': 694, 'optimizer': 'RMSprop'}. Best is trial 171 with value: 0.07732428247066869.
2026-05-18 06:27:35,631 - optuna.study._optimize - INFO - Trial 215 pruned. 
2026-05-18 06:27:48,740 - optuna.study._optimize - INFO - Trial 216 pruned. 
2026-05-18 06:28:09,874 - optuna.study._optimize - INFO - Trial 217 pruned. 
2026-05-18 06:28:37,768 - optuna.study._optimize - INFO - Trial 218 pruned. 
2026-05-18 06:29:05,230 - optuna.study._optimize - INFO - Trial 219 pruned. 
2026-05-18 06:29:18,929 - optuna.study._optimize - INFO - Trial 220 pruned. 
2026-05-18 06:29:34,119 - experiment_functions - INFO - Early stopping at epoch 1100. Best Recall: 0.0662
2026-05-18 06:29:34,226 - optuna.study.study - INFO - Trial 221 finished with value: 0.06624557375683914 and parameters: {'n_layers': 1, 'embedding_dim': 32, 'lr': 0.0009379902516581737, 'lambda_val': 0.011812520517088457, 'batch_size': 652, 'optimizer': 'RMSprop'}. Best is trial 171 with value: 0.07732428247066869.
2026-05-18 06:29:51,943 - experiment_functions - INFO - Early stopping at epoch 1250. Best Recall: 0.0675
2026-05-18 06:29:52,070 - optuna.study.study - INFO - Trial 222 finished with value: 0.06753766122410698 and parameters: {'n_layers': 1, 'embedding_dim': 32, 'lr': 0.0007342052718877495, 'lambda_val': 0.01903159477379086, 'batch_size': 824, 'optimizer': 'RMSprop'}. Best is trial 171 with value: 0.07732428247066869.
2026-05-18 06:30:12,367 - experiment_functions - INFO - Early stopping at epoch 1250. Best Recall: 0.0729
2026-05-18 06:30:12,468 - optuna.study.study - INFO - Trial 223 finished with value: 0.07289177441369464 and parameters: {'n_layers': 1, 'embedding_dim': 32, 'lr': 0.0011064113355895378, 'lambda_val': 3.680654355248785e-05, 'batch_size': 627, 'optimizer': 'RMSprop'}. Best is trial 171 with value: 0.07732428247066869.
2026-05-18 06:30:25,667 - optuna.study._optimize - INFO - Trial 224 pruned. 
2026-05-18 06:30:38,268 - experiment_functions - INFO - Early stopping at epoch 650. Best Recall: 0.0338
2026-05-18 06:30:39,033 - optuna.study.study - INFO - Trial 225 finished with value: 0.03377114030525962 and parameters: {'n_layers': 4, 'embedding_dim': 32, 'lr': 0.0011498895551172717, 'lambda_val': 3.765585457127795e-05, 'batch_size': 659, 'optimizer': 'RMSprop'}. Best is trial 171 with value: 0.07732428247066869.
2026-05-18 06:30:57,250 - optuna.study._optimize - INFO - Trial 226 pruned. 
2026-05-18 06:31:18,992 - experiment_functions - INFO - Early stopping at epoch 1700. Best Recall: 0.0685
2026-05-18 06:31:19,092 - optuna.study.study - INFO - Trial 227 finished with value: 0.06853985295452394 and parameters: {'n_layers': 1, 'embedding_dim': 32, 'lr': 0.0008316038202560832, 'lambda_val': 9.985726183425865e-05, 'batch_size': 766, 'optimizer': 'RMSprop'}. Best is trial 171 with value: 0.07732428247066869.
2026-05-18 06:31:38,166 - optuna.study._optimize - INFO - Trial 228 pruned. 
2026-05-18 06:31:57,019 - optuna.study._optimize - INFO - Trial 229 pruned. 
2026-05-18 06:32:08,099 - experiment_functions - INFO - Early stopping at epoch 800. Best Recall: 0.0116
2026-05-18 06:32:08,190 - optuna.study.study - INFO - Trial 230 finished with value: 0.011618943707115281 and parameters: {'n_layers': 1, 'embedding_dim': 32, 'lr': 0.03977923353491384, 'lambda_val': 4.885775300100515e-05, 'batch_size': 938, 'optimizer': 'RMSprop'}. Best is trial 171 with value: 0.07732428247066869.
2026-05-18 06:32:37,283 - experiment_functions - INFO - Early stopping at epoch 2150. Best Recall: 0.0700
2026-05-18 06:32:37,373 - optuna.study.study - INFO - Trial 231 finished with value: 0.07002022335571657 and parameters: {'n_layers': 1, 'embedding_dim': 32, 'lr': 0.0008772087343434357, 'lambda_val': 6.402624469563329e-05, 'batch_size': 767, 'optimizer': 'RMSprop'}. Best is trial 171 with value: 0.07732428247066869.
2026-05-18 06:32:59,072 - experiment_functions - INFO - Early stopping at epoch 1550. Best Recall: 0.0690
2026-05-18 06:32:59,215 - optuna.study.study - INFO - Trial 232 finished with value: 0.06897239741385786 and parameters: {'n_layers': 1, 'embedding_dim': 32, 'lr': 0.0008461898414723929, 'lambda_val': 6.029708276784812e-05, 'batch_size': 785, 'optimizer': 'RMSprop'}. Best is trial 171 with value: 0.07732428247066869.
2026-05-18 06:33:24,123 - experiment_functions - INFO - Early stopping at epoch 1800. Best Recall: 0.0669
2026-05-18 06:33:24,213 - optuna.study.study - INFO - Trial 233 finished with value: 0.06686941206529676 and parameters: {'n_layers': 1, 'embedding_dim': 32, 'lr': 0.0008715118383633779, 'lambda_val': 5.354393809418571e-05, 'batch_size': 674, 'optimizer': 'RMSprop'}. Best is trial 171 with value: 0.07732428247066869.
2026-05-18 06:33:38,219 - optuna.study._optimize - INFO - Trial 234 pruned. 
2026-05-18 06:33:55,668 - experiment_functions - INFO - Early stopping at epoch 1200. Best Recall: 0.0688
2026-05-18 06:33:55,755 - optuna.study.study - INFO - Trial 235 finished with value: 0.06879587108607607 and parameters: {'n_layers': 1, 'embedding_dim': 32, 'lr': 0.0010897974708792885, 'lambda_val': 0.0001091287088759179, 'batch_size': 867, 'optimizer': 'RMSprop'}. Best is trial 171 with value: 0.07732428247066869.
2026-05-18 06:34:08,497 - experiment_functions - INFO - Early stopping at epoch 900. Best Recall: 0.0654
2026-05-18 06:34:08,598 - optuna.study.study - INFO - Trial 236 finished with value: 0.06544351072970973 and parameters: {'n_layers': 1, 'embedding_dim': 32, 'lr': 0.001358129077371912, 'lambda_val': 4.347738049029463e-05, 'batch_size': 869, 'optimizer': 'RMSprop'}. Best is trial 171 with value: 0.07732428247066869.
2026-05-18 06:34:27,324 - experiment_functions - INFO - Early stopping at epoch 1300. Best Recall: 0.0683
2026-05-18 06:34:27,423 - optuna.study.study - INFO - Trial 237 finished with value: 0.06828273908796674 and parameters: {'n_layers': 1, 'embedding_dim': 32, 'lr': 0.0011210586013159181, 'lambda_val': 8.609872874307308e-05, 'batch_size': 602, 'optimizer': 'RMSprop'}. Best is trial 171 with value: 0.07732428247066869.
2026-05-18 06:34:46,089 - experiment_functions - INFO - Early stopping at epoch 1350. Best Recall: 0.0693
2026-05-18 06:34:46,178 - optuna.study.study - INFO - Trial 238 finished with value: 0.06925960910776817 and parameters: {'n_layers': 1, 'embedding_dim': 32, 'lr': 0.0009423625120501513, 'lambda_val': 0.0001131971644334519, 'batch_size': 985, 'optimizer': 'RMSprop'}. Best is trial 171 with value: 0.07732428247066869.
2026-05-18 06:35:01,832 - optuna.study._optimize - INFO - Trial 239 pruned. 
2026-05-18 06:35:16,420 - experiment_functions - INFO - Early stopping at epoch 1050. Best Recall: 0.0639
2026-05-18 06:35:16,521 - optuna.study.study - INFO - Trial 240 finished with value: 0.06388254413675247 and parameters: {'n_layers': 1, 'embedding_dim': 32, 'lr': 0.001109498274565796, 'lambda_val': 6.798437039367277e-05, 'batch_size': 909, 'optimizer': 'RMSprop'}. Best is trial 171 with value: 0.07732428247066869.
2026-05-18 06:35:30,639 - optuna.study._optimize - INFO - Trial 241 pruned. 
2026-05-18 06:35:59,987 - optuna.study._optimize - INFO - Trial 242 pruned. 
2026-05-18 06:36:21,096 - experiment_functions - INFO - Early stopping at epoch 1500. Best Recall: 0.0711
2026-05-18 06:36:21,185 - optuna.study.study - INFO - Trial 243 finished with value: 0.07114121964242966 and parameters: {'n_layers': 1, 'embedding_dim': 32, 'lr': 0.0008931072790553913, 'lambda_val': 9.218042793561918e-05, 'batch_size': 1032, 'optimizer': 'RMSprop'}. Best is trial 171 with value: 0.07732428247066869.
2026-05-18 06:36:40,272 - optuna.study._optimize - INFO - Trial 244 pruned. 
2026-05-18 06:36:58,534 - optuna.study._optimize - INFO - Trial 245 pruned. 
2026-05-18 06:37:12,212 - experiment_functions - INFO - Early stopping at epoch 950. Best Recall: 0.0663
2026-05-18 06:37:12,312 - optuna.study.study - INFO - Trial 246 finished with value: 0.06629863932795849 and parameters: {'n_layers': 1, 'embedding_dim': 32, 'lr': 0.0012970473533386877, 'lambda_val': 6.446436618050862e-05, 'batch_size': 921, 'optimizer': 'RMSprop'}. Best is trial 171 with value: 0.07732428247066869.
2026-05-18 06:37:35,338 - experiment_functions - INFO - Early stopping at epoch 1700. Best Recall: 0.0691
2026-05-18 06:37:35,471 - optuna.study.study - INFO - Trial 247 finished with value: 0.06913953130641076 and parameters: {'n_layers': 1, 'embedding_dim': 32, 'lr': 0.0007808082056679476, 'lambda_val': 0.00011687705465004926, 'batch_size': 934, 'optimizer': 'RMSprop'}. Best is trial 171 with value: 0.07732428247066869.
2026-05-18 06:37:42,394 - experiment_functions - INFO - Early stopping at epoch 500. Best Recall: 0.0060
2026-05-18 06:37:42,493 - optuna.study.study - INFO - Trial 248 finished with value: 0.0060027893963903066 and parameters: {'n_layers': 1, 'embedding_dim': 32, 'lr': 0.0007239459051510199, 'lambda_val': 0.00011833145277388139, 'batch_size': 994, 'optimizer': 'SGD'}. Best is trial 171 with value: 0.07732428247066869.
2026-05-18 06:37:56,379 - optuna.study._optimize - INFO - Trial 249 pruned. 
2026-05-18 06:38:09,853 - optuna.study._optimize - INFO - Trial 250 pruned. 
2026-05-18 06:38:32,931 - experiment_functions - INFO - Early stopping at epoch 1550. Best Recall: 0.0686
2026-05-18 06:38:33,042 - optuna.study.study - INFO - Trial 251 finished with value: 0.06861251631058604 and parameters: {'n_layers': 1, 'embedding_dim': 32, 'lr': 0.0008825500893608517, 'lambda_val': 0.00013777623377915342, 'batch_size': 994, 'optimizer': 'RMSprop'}. Best is trial 171 with value: 0.07732428247066869.
2026-05-18 06:38:49,878 - experiment_functions - INFO - Early stopping at epoch 1200. Best Recall: 0.0664
2026-05-18 06:38:49,976 - optuna.study.study - INFO - Trial 252 finished with value: 0.0664063947694684 and parameters: {'n_layers': 1, 'embedding_dim': 32, 'lr': 0.0009909285849280978, 'lambda_val': 0.00020415425311803324, 'batch_size': 1093, 'optimizer': 'RMSprop'}. Best is trial 171 with value: 0.07732428247066869.
2026-05-18 06:39:10,695 - experiment_functions - INFO - Early stopping at epoch 1450. Best Recall: 0.0683
2026-05-18 06:39:10,784 - optuna.study.study - INFO - Trial 253 finished with value: 0.06828572064881909 and parameters: {'n_layers': 1, 'embedding_dim': 32, 'lr': 0.0008573255562215514, 'lambda_val': 0.00014245617568991756, 'batch_size': 1009, 'optimizer': 'RMSprop'}. Best is trial 171 with value: 0.07732428247066869.
2026-05-18 06:39:23,998 - optuna.study._optimize - INFO - Trial 254 pruned. 
2026-05-18 06:39:36,934 - optuna.study._optimize - INFO - Trial 255 pruned. 
2026-05-18 06:39:50,296 - experiment_functions - INFO - Early stopping at epoch 800. Best Recall: 0.0613
2026-05-18 06:39:50,400 - optuna.study.study - INFO - Trial 256 finished with value: 0.06126613140845086 and parameters: {'n_layers': 1, 'embedding_dim': 32, 'lr': 0.0015661792259199611, 'lambda_val': 5.854151639644424e-05, 'batch_size': 870, 'optimizer': 'RMSprop'}. Best is trial 171 with value: 0.07732428247066869.
2026-05-18 06:40:07,853 - experiment_functions - INFO - Early stopping at epoch 1150. Best Recall: 0.0657
2026-05-18 06:40:07,943 - optuna.study.study - INFO - Trial 257 finished with value: 0.06573483160004222 and parameters: {'n_layers': 1, 'embedding_dim': 32, 'lr': 0.0011983020101458731, 'lambda_val': 0.00011664535132127174, 'batch_size': 675, 'optimizer': 'RMSprop'}. Best is trial 171 with value: 0.07732428247066869.
2026-05-18 06:40:21,490 - optuna.study._optimize - INFO - Trial 258 pruned. 
2026-05-18 06:40:36,156 - optuna.study._optimize - INFO - Trial 259 pruned. 
2026-05-18 06:40:47,735 - experiment_functions - INFO - Early stopping at epoch 800. Best Recall: 0.0528
2026-05-18 06:40:47,834 - optuna.study.study - INFO - Trial 260 finished with value: 0.05276866759444205 and parameters: {'n_layers': 1, 'embedding_dim': 32, 'lr': 0.0009873807016037616, 'lambda_val': 0.0001618957605185782, 'batch_size': 3621, 'optimizer': 'RMSprop'}. Best is trial 171 with value: 0.07732428247066869.
2026-05-18 06:40:57,549 - experiment_functions - INFO - Early stopping at epoch 750. Best Recall: 0.0051
2026-05-18 06:40:57,648 - optuna.study.study - INFO - Trial 261 finished with value: 0.005134986253524314 and parameters: {'n_layers': 1, 'embedding_dim': 32, 'lr': 2.5056097909216472e-05, 'lambda_val': 0.00018160498900216343, 'batch_size': 830, 'optimizer': 'RMSprop'}. Best is trial 171 with value: 0.07732428247066869.
2026-05-18 06:41:11,120 - optuna.study._optimize - INFO - Trial 262 pruned. 
2026-05-18 06:41:25,004 - optuna.study._optimize - INFO - Trial 263 pruned. 
2026-05-18 06:41:38,681 - optuna.study._optimize - INFO - Trial 264 pruned. 
2026-05-18 06:41:54,398 - experiment_functions - INFO - Early stopping at epoch 1100. Best Recall: 0.0630
2026-05-18 06:41:54,494 - optuna.study.study - INFO - Trial 265 finished with value: 0.06302091557750518 and parameters: {'n_layers': 1, 'embedding_dim': 32, 'lr': 0.0009027334223203892, 'lambda_val': 3.572338970973122e-05, 'batch_size': 1614, 'optimizer': 'RMSprop'}. Best is trial 171 with value: 0.07732428247066869.
2026-05-18 06:42:09,630 - optuna.study._optimize - INFO - Trial 266 pruned. 
2026-05-18 06:42:22,633 - experiment_functions - INFO - Early stopping at epoch 750. Best Recall: 0.0477
2026-05-18 06:42:22,712 - optuna.study.study - INFO - Trial 267 finished with value: 0.047673363429509556 and parameters: {'n_layers': 3, 'embedding_dim': 32, 'lr': 0.0007736746539732572, 'lambda_val': 0.00011233470569969748, 'batch_size': 997, 'optimizer': 'RMSprop'}. Best is trial 171 with value: 0.07732428247066869.
2026-05-18 06:42:29,715 - experiment_functions - INFO - Early stopping at epoch 500. Best Recall: 0.0043
2026-05-18 06:42:30,032 - optuna.study.study - INFO - Trial 268 finished with value: 0.0042730192440740685 and parameters: {'n_layers': 1, 'embedding_dim': 32, 'lr': 0.001303232399476985, 'lambda_val': 0.00043950383620813425, 'batch_size': 869, 'optimizer': 'SGD'}. Best is trial 171 with value: 0.07732428247066869.
2026-05-18 06:42:43,516 - optuna.study._optimize - INFO - Trial 269 pruned. 
2026-05-18 06:43:00,942 - experiment_functions - INFO - Early stopping at epoch 1250. Best Recall: 0.0638
2026-05-18 06:43:01,039 - optuna.study.study - INFO - Trial 270 finished with value: 0.06379661337008205 and parameters: {'n_layers': 1, 'embedding_dim': 32, 'lr': 0.001064279217886531, 'lambda_val': 0.007641995731799565, 'batch_size': 575, 'optimizer': 'RMSprop'}. Best is trial 171 with value: 0.07732428247066869.
2026-05-18 06:43:15,600 - optuna.study._optimize - INFO - Trial 271 pruned. 
2026-05-18 06:43:35,570 - experiment_functions - INFO - Early stopping at epoch 1450. Best Recall: 0.0670
2026-05-18 06:43:35,681 - optuna.study.study - INFO - Trial 272 finished with value: 0.06700165407447267 and parameters: {'n_layers': 1, 'embedding_dim': 32, 'lr': 0.000868378971749773, 'lambda_val': 0.00013768346772203375, 'batch_size': 868, 'optimizer': 'RMSprop'}. Best is trial 171 with value: 0.07732428247066869.
2026-05-18 06:43:49,380 - optuna.study._optimize - INFO - Trial 273 pruned. 
2026-05-18 06:43:56,660 - experiment_functions - INFO - Early stopping at epoch 500. Best Recall: 0.0055
2026-05-18 06:43:56,750 - optuna.study.study - INFO - Trial 274 finished with value: 0.005545559799463346 and parameters: {'n_layers': 1, 'embedding_dim': 32, 'lr': 0.00040582269082924707, 'lambda_val': 0.008854942775028567, 'batch_size': 669, 'optimizer': 'RMSprop'}. Best is trial 171 with value: 0.07732428247066869.
2026-05-18 06:44:10,679 - optuna.study._optimize - INFO - Trial 275 pruned. 
2026-05-18 06:44:23,770 - optuna.study._optimize - INFO - Trial 276 pruned. 
2026-05-18 06:44:40,504 - optuna.study._optimize - INFO - Trial 277 pruned. 
2026-05-18 06:44:52,737 - experiment_functions - INFO - Early stopping at epoch 850. Best Recall: 0.0643
2026-05-18 06:44:52,828 - optuna.study.study - INFO - Trial 278 finished with value: 0.06425225203249438 and parameters: {'n_layers': 1, 'embedding_dim': 32, 'lr': 0.00110342144890852, 'lambda_val': 0.017880700428303562, 'batch_size': 820, 'optimizer': 'RMSprop'}. Best is trial 171 with value: 0.07732428247066869.
2026-05-18 06:45:17,559 - experiment_functions - INFO - Early stopping at epoch 1800. Best Recall: 0.0691
2026-05-18 06:45:17,655 - optuna.study.study - INFO - Trial 279 finished with value: 0.0691488321478919 and parameters: {'n_layers': 1, 'embedding_dim': 32, 'lr': 0.0008504097898892079, 'lambda_val': 4.220251692545675e-05, 'batch_size': 651, 'optimizer': 'RMSprop'}. Best is trial 171 with value: 0.07732428247066869.
2026-05-18 06:45:52,942 - experiment_functions - INFO - Early stopping at epoch 2350. Best Recall: 0.0706
2026-05-18 06:45:53,042 - optuna.study.study - INFO - Trial 280 finished with value: 0.07059381230651234 and parameters: {'n_layers': 1, 'embedding_dim': 32, 'lr': 0.0007784295866587758, 'lambda_val': 3.139683153672312e-05, 'batch_size': 624, 'optimizer': 'RMSprop'}. Best is trial 171 with value: 0.07732428247066869.
2026-05-18 06:46:05,919 - optuna.study._optimize - INFO - Trial 281 pruned. 
2026-05-18 06:46:19,836 - optuna.study._optimize - INFO - Trial 282 pruned. 
2026-05-18 06:46:48,512 - optuna.study._optimize - INFO - Trial 283 pruned. 
2026-05-18 06:47:00,301 - experiment_functions - INFO - Early stopping at epoch 800. Best Recall: 0.0524
2026-05-18 06:47:00,401 - optuna.study.study - INFO - Trial 284 finished with value: 0.05235136038102122 and parameters: {'n_layers': 2, 'embedding_dim': 32, 'lr': 0.0009874916233466688, 'lambda_val': 2.0399242974938552e-05, 'batch_size': 578, 'optimizer': 'RMSprop'}. Best is trial 171 with value: 0.07732428247066869.
2026-05-18 06:47:15,429 - experiment_functions - INFO - Early stopping at epoch 1000. Best Recall: 0.0653
2026-05-18 06:47:15,584 - optuna.study.study - INFO - Trial 285 finished with value: 0.06529727634518141 and parameters: {'n_layers': 1, 'embedding_dim': 32, 'lr': 0.001457456227407587, 'lambda_val': 3.0305684426988323e-05, 'batch_size': 667, 'optimizer': 'RMSprop'}. Best is trial 171 with value: 0.07732428247066869.
2026-05-18 06:47:29,418 - optuna.study._optimize - INFO - Trial 286 pruned. 
2026-05-18 06:47:43,080 - optuna.study._optimize - INFO - Trial 287 pruned. 
2026-05-18 06:47:59,383 - optuna.study._optimize - INFO - Trial 288 pruned. 
2026-05-18 06:48:06,100 - experiment_functions - INFO - Early stopping at epoch 500. Best Recall: 0.0055
2026-05-18 06:48:06,159 - optuna.study.study - INFO - Trial 289 finished with value: 0.005486078196903387 and parameters: {'n_layers': 1, 'embedding_dim': 64, 'lr': 0.0006313550461272494, 'lambda_val': 3.486810543443891e-05, 'batch_size': 764, 'optimizer': 'SGD'}. Best is trial 171 with value: 0.07732428247066869.
2026-05-18 06:48:18,295 - optuna.study._optimize - INFO - Trial 290 pruned. 
2026-05-18 06:48:32,535 - experiment_functions - INFO - Early stopping at epoch 1050. Best Recall: 0.0695
2026-05-18 06:48:32,624 - optuna.study.study - INFO - Trial 291 finished with value: 0.06950501116599789 and parameters: {'n_layers': 1, 'embedding_dim': 32, 'lr': 0.0011340223345022878, 'lambda_val': 5.70663460952526e-05, 'batch_size': 722, 'optimizer': 'RMSprop'}. Best is trial 171 with value: 0.07732428247066869.
2026-05-18 06:48:57,019 - experiment_functions - INFO - Early stopping at epoch 1800. Best Recall: 0.0722
