2026-05-18 10:09:04,629 - optuna.study.study - INFO - Trial 221 finished with value: 0.04799260928231477 and parameters: {'n_layers': 1, 'embedding_dim': 32, 'lr': 0.00041485181007945484, 'lambda_val': 1.3515534026614396e-06, 'batch_size': 614, 'optimizer': 'RMSprop'}. Best is trial 211 with value: 0.04825753319366663.
2026-05-18 10:09:18,774 - optuna.study._optimize - INFO - Trial 222 pruned. 
2026-05-18 10:09:32,643 - optuna.study._optimize - INFO - Trial 223 pruned. 
2026-05-18 10:10:12,732 - experiment_functions - INFO - Early stopping at epoch 3000. Best Recall: 0.0477
2026-05-18 10:10:12,831 - optuna.study.study - INFO - Trial 224 finished with value: 0.04765897849156054 and parameters: {'n_layers': 1, 'embedding_dim': 32, 'lr': 0.0004394263831423886, 'lambda_val': 1.2970782379440265e-06, 'batch_size': 634, 'optimizer': 'RMSprop'}. Best is trial 211 with value: 0.04825753319366663.
2026-05-18 10:10:52,871 - experiment_functions - INFO - Early stopping at epoch 2200. Best Recall: 0.0472
2026-05-18 10:10:52,971 - optuna.study.study - INFO - Trial 225 finished with value: 0.047217240634857986 and parameters: {'n_layers': 1, 'embedding_dim': 32, 'lr': 0.00044055244646928145, 'lambda_val': 1.3358155767562786e-06, 'batch_size': 705, 'optimizer': 'RMSprop'}. Best is trial 211 with value: 0.04825753319366663.
2026-05-18 10:11:06,763 - optuna.study._optimize - INFO - Trial 226 pruned. 
2026-05-18 10:11:38,930 - optuna.study._optimize - INFO - Trial 227 pruned. 
2026-05-18 10:11:52,990 - optuna.study._optimize - INFO - Trial 228 pruned. 
2026-05-18 10:12:40,967 - experiment_functions - INFO - Early stopping at epoch 3600. Best Recall: 0.0479
2026-05-18 10:12:41,065 - optuna.study.study - INFO - Trial 229 finished with value: 0.04793952399881043 and parameters: {'n_layers': 1, 'embedding_dim': 32, 'lr': 0.00038254500908685885, 'lambda_val': 1.4576272342652928e-06, 'batch_size': 512, 'optimizer': 'RMSprop'}. Best is trial 211 with value: 0.04825753319366663.
2026-05-18 10:12:55,454 - optuna.study._optimize - INFO - Trial 230 pruned. 
2026-05-18 10:13:57,510 - optuna.study.study - INFO - Trial 231 finished with value: 0.04824855387896155 and parameters: {'n_layers': 1, 'embedding_dim': 32, 'lr': 0.00039808631062675915, 'lambda_val': 1.219549332053504e-06, 'batch_size': 527, 'optimizer': 'RMSprop'}. Best is trial 211 with value: 0.04825753319366663.
2026-05-18 10:14:11,640 - optuna.study._optimize - INFO - Trial 232 pruned. 
2026-05-18 10:14:51,480 - experiment_functions - INFO - Early stopping at epoch 2950. Best Recall: 0.0477
2026-05-18 10:14:51,627 - optuna.study.study - INFO - Trial 233 finished with value: 0.0476855428816497 and parameters: {'n_layers': 1, 'embedding_dim': 32, 'lr': 0.0003780941857729404, 'lambda_val': 1.2369543032160712e-06, 'batch_size': 514, 'optimizer': 'RMSprop'}. Best is trial 211 with value: 0.04825753319366663.
2026-05-18 10:15:05,739 - optuna.study._optimize - INFO - Trial 234 pruned. 
2026-05-18 10:16:01,205 - optuna.study.study - INFO - Trial 235 finished with value: 0.048172067776419664 and parameters: {'n_layers': 1, 'embedding_dim': 32, 'lr': 0.00038416962698052567, 'lambda_val': 1.2465866332052545e-06, 'batch_size': 580, 'optimizer': 'RMSprop'}. Best is trial 211 with value: 0.04825753319366663.
2026-05-18 10:16:21,767 - optuna.study._optimize - INFO - Trial 236 pruned. 
2026-05-18 10:16:36,279 - optuna.study._optimize - INFO - Trial 237 pruned. 
2026-05-18 10:16:51,431 - optuna.study._optimize - INFO - Trial 238 pruned. 
2026-05-18 10:17:22,936 - experiment_functions - INFO - Early stopping at epoch 2250. Best Recall: 0.0475
2026-05-18 10:17:23,035 - optuna.study.study - INFO - Trial 239 finished with value: 0.0475366053786782 and parameters: {'n_layers': 1, 'embedding_dim': 32, 'lr': 0.0004799247149414027, 'lambda_val': 1.2403549016711413e-06, 'batch_size': 581, 'optimizer': 'RMSprop'}. Best is trial 211 with value: 0.04825753319366663.
2026-05-18 10:17:37,511 - optuna.study._optimize - INFO - Trial 240 pruned. 
2026-05-18 10:18:32,017 - optuna.study.study - INFO - Trial 241 finished with value: 0.04798245622135732 and parameters: {'n_layers': 1, 'embedding_dim': 32, 'lr': 0.00038974437097183363, 'lambda_val': 1.2190627849308634e-06, 'batch_size': 580, 'optimizer': 'RMSprop'}. Best is trial 211 with value: 0.04825753319366663.
2026-05-18 10:19:06,358 - optuna.study._optimize - INFO - Trial 242 pruned. 
2026-05-18 10:19:51,981 - experiment_functions - INFO - Early stopping at epoch 3100. Best Recall: 0.0477
2026-05-18 10:19:52,071 - optuna.study.study - INFO - Trial 243 finished with value: 0.04772212175738081 and parameters: {'n_layers': 1, 'embedding_dim': 32, 'lr': 0.0003957705650960649, 'lambda_val': 1.2813737569872919e-06, 'batch_size': 573, 'optimizer': 'RMSprop'}. Best is trial 211 with value: 0.04825753319366663.
2026-05-18 10:20:07,784 - optuna.study._optimize - INFO - Trial 244 pruned. 
2026-05-18 10:20:49,304 - optuna.study._optimize - INFO - Trial 245 pruned. 
2026-05-18 10:21:04,351 - optuna.study._optimize - INFO - Trial 246 pruned. 
2026-05-18 10:21:37,848 - optuna.study._optimize - INFO - Trial 247 pruned. 
2026-05-18 10:21:52,657 - optuna.study._optimize - INFO - Trial 248 pruned. 
2026-05-18 10:22:07,990 - optuna.study._optimize - INFO - Trial 249 pruned. 
2026-05-18 10:22:32,079 - optuna.study._optimize - INFO - Trial 250 pruned. 
2026-05-18 10:22:40,058 - experiment_functions - INFO - Early stopping at epoch 500. Best Recall: 0.0033
2026-05-18 10:22:40,187 - optuna.study.study - INFO - Trial 251 finished with value: 0.003310396284368814 and parameters: {'n_layers': 1, 'embedding_dim': 32, 'lr': 0.022719101911655267, 'lambda_val': 1.873058949286164e-06, 'batch_size': 739, 'optimizer': 'RMSprop'}. Best is trial 211 with value: 0.04825753319366663.
2026-05-18 10:22:55,808 - optuna.study._optimize - INFO - Trial 252 pruned. 
2026-05-18 10:23:09,117 - optuna.study._optimize - INFO - Trial 253 pruned. 
2026-05-18 10:23:37,918 - experiment_functions - INFO - Early stopping at epoch 2150. Best Recall: 0.0478
2026-05-18 10:23:38,017 - optuna.study.study - INFO - Trial 254 finished with value: 0.047779001317155956 and parameters: {'n_layers': 1, 'embedding_dim': 32, 'lr': 0.00044362557749137927, 'lambda_val': 1.5669259468099662e-06, 'batch_size': 677, 'optimizer': 'RMSprop'}. Best is trial 211 with value: 0.04825753319366663.
2026-05-18 10:24:15,158 - experiment_functions - INFO - Early stopping at epoch 2750. Best Recall: 0.0477
2026-05-18 10:24:15,256 - optuna.study.study - INFO - Trial 255 finished with value: 0.04774616609275002 and parameters: {'n_layers': 1, 'embedding_dim': 32, 'lr': 0.0005203071054246233, 'lambda_val': 1.680778662027678e-06, 'batch_size': 683, 'optimizer': 'RMSprop'}. Best is trial 211 with value: 0.04825753319366663.
2026-05-18 10:24:44,221 - experiment_functions - INFO - Early stopping at epoch 2150. Best Recall: 0.0477
2026-05-18 10:24:44,331 - optuna.study.study - INFO - Trial 256 finished with value: 0.04765651376211152 and parameters: {'n_layers': 1, 'embedding_dim': 32, 'lr': 0.0005403205423696551, 'lambda_val': 1.7590702145761956e-06, 'batch_size': 715, 'optimizer': 'RMSprop'}. Best is trial 211 with value: 0.04825753319366663.
2026-05-18 10:25:05,525 - optuna.study._optimize - INFO - Trial 257 pruned. 
2026-05-18 10:25:23,021 - optuna.study._optimize - INFO - Trial 258 pruned. 
2026-05-18 10:25:36,894 - optuna.study._optimize - INFO - Trial 259 pruned. 
2026-05-18 10:25:51,419 - optuna.study._optimize - INFO - Trial 260 pruned. 
2026-05-18 10:26:13,524 - experiment_functions - INFO - Early stopping at epoch 1600. Best Recall: 0.0474
2026-05-18 10:26:13,622 - optuna.study.study - INFO - Trial 261 finished with value: 0.04742207253709359 and parameters: {'n_layers': 1, 'embedding_dim': 32, 'lr': 0.0005151566632798515, 'lambda_val': 2.0128689009375e-06, 'batch_size': 657, 'optimizer': 'RMSprop'}. Best is trial 211 with value: 0.04825753319366663.
2026-05-18 10:26:28,040 - optuna.study._optimize - INFO - Trial 262 pruned. 
2026-05-18 10:26:57,210 - experiment_functions - INFO - Early stopping at epoch 2100. Best Recall: 0.0472
2026-05-18 10:26:57,300 - optuna.study.study - INFO - Trial 263 finished with value: 0.047227863525048173 and parameters: {'n_layers': 1, 'embedding_dim': 32, 'lr': 0.00043062138486601835, 'lambda_val': 1.552745436215655e-06, 'batch_size': 640, 'optimizer': 'RMSprop'}. Best is trial 211 with value: 0.04825753319366663.
2026-05-18 10:27:11,701 - optuna.study._optimize - INFO - Trial 264 pruned. 
2026-05-18 10:27:27,954 - optuna.study._optimize - INFO - Trial 265 pruned. 
2026-05-18 10:28:02,438 - experiment_functions - INFO - Early stopping at epoch 2550. Best Recall: 0.0475
2026-05-18 10:28:02,548 - optuna.study.study - INFO - Trial 266 finished with value: 0.047536451004856775 and parameters: {'n_layers': 1, 'embedding_dim': 32, 'lr': 0.00045839418616293044, 'lambda_val': 1.5308279787229239e-06, 'batch_size': 717, 'optimizer': 'RMSprop'}. Best is trial 211 with value: 0.04825753319366663.
2026-05-18 10:28:16,973 - optuna.study._optimize - INFO - Trial 267 pruned. 
2026-05-18 10:28:31,801 - optuna.study._optimize - INFO - Trial 268 pruned. 
2026-05-18 10:28:38,949 - experiment_functions - INFO - Early stopping at epoch 500. Best Recall: 0.0050
2026-05-18 10:28:39,051 - optuna.study.study - INFO - Trial 269 finished with value: 0.005005313330166941 and parameters: {'n_layers': 1, 'embedding_dim': 32, 'lr': 3.606244988607262e-05, 'lambda_val': 0.0006801446058460433, 'batch_size': 570, 'optimizer': 'RMSprop'}. Best is trial 211 with value: 0.04825753319366663.
2026-05-18 10:28:52,900 - optuna.study._optimize - INFO - Trial 270 pruned. 
2026-05-18 10:29:07,087 - optuna.study._optimize - INFO - Trial 271 pruned. 
2026-05-18 10:29:21,382 - optuna.study._optimize - INFO - Trial 272 pruned. 
2026-05-18 10:29:55,563 - experiment_functions - INFO - Early stopping at epoch 2500. Best Recall: 0.0487
2026-05-18 10:29:55,653 - optuna.study.study - INFO - Trial 273 finished with value: 0.04869007441460256 and parameters: {'n_layers': 1, 'embedding_dim': 32, 'lr': 0.00045004568876780103, 'lambda_val': 1.2310262752937854e-06, 'batch_size': 517, 'optimizer': 'RMSprop'}. Best is trial 273 with value: 0.04869007441460256.
2026-05-18 10:30:33,620 - experiment_functions - INFO - Early stopping at epoch 2150. Best Recall: 0.0481
2026-05-18 10:30:33,710 - optuna.study.study - INFO - Trial 274 finished with value: 0.04813653419937989 and parameters: {'n_layers': 1, 'embedding_dim': 32, 'lr': 0.0005489933648939249, 'lambda_val': 1.4317585339530978e-06, 'batch_size': 521, 'optimizer': 'RMSprop'}. Best is trial 273 with value: 0.04869007441460256.
2026-05-18 10:31:02,850 - experiment_functions - INFO - Early stopping at epoch 2150. Best Recall: 0.0478
2026-05-18 10:31:02,951 - optuna.study.study - INFO - Trial 275 finished with value: 0.04777125598486304 and parameters: {'n_layers': 1, 'embedding_dim': 32, 'lr': 0.0005736251403531373, 'lambda_val': 1.8863810662874681e-06, 'batch_size': 516, 'optimizer': 'RMSprop'}. Best is trial 273 with value: 0.04869007441460256.
2026-05-18 10:31:14,348 - experiment_functions - INFO - Early stopping at epoch 800. Best Recall: 0.0421
2026-05-18 10:31:14,438 - optuna.study.study - INFO - Trial 276 finished with value: 0.042102611142471755 and parameters: {'n_layers': 1, 'embedding_dim': 256, 'lr': 0.0005929296571559903, 'lambda_val': 2.0970799197775533e-06, 'batch_size': 1958, 'optimizer': 'RMSprop'}. Best is trial 273 with value: 0.04869007441460256.
2026-05-18 10:31:33,230 - optuna.study._optimize - INFO - Trial 277 pruned. 
2026-05-18 10:32:03,893 - experiment_functions - INFO - Early stopping at epoch 2300. Best Recall: 0.0485
2026-05-18 10:32:03,994 - optuna.study.study - INFO - Trial 278 finished with value: 0.048487220935219545 and parameters: {'n_layers': 1, 'embedding_dim': 32, 'lr': 0.0005905501226195734, 'lambda_val': 1.22067000587589e-06, 'batch_size': 512, 'optimizer': 'RMSprop'}. Best is trial 273 with value: 0.04869007441460256.
2026-05-18 10:32:27,489 - experiment_functions - INFO - Early stopping at epoch 1700. Best Recall: 0.0474
2026-05-18 10:32:27,597 - optuna.study.study - INFO - Trial 279 finished with value: 0.04735034401748671 and parameters: {'n_layers': 1, 'embedding_dim': 32, 'lr': 0.0006780978559259417, 'lambda_val': 1.2164935428184915e-06, 'batch_size': 532, 'optimizer': 'RMSprop'}. Best is trial 273 with value: 0.04869007441460256.
2026-05-18 10:33:20,647 - optuna.study.study - INFO - Trial 280 finished with value: 0.048219892646016456 and parameters: {'n_layers': 1, 'embedding_dim': 32, 'lr': 0.0004509558673842529, 'lambda_val': 1.0024538201111516e-06, 'batch_size': 512, 'optimizer': 'RMSprop'}. Best is trial 273 with value: 0.04869007441460256.
2026-05-18 10:33:58,767 - experiment_functions - INFO - Early stopping at epoch 2800. Best Recall: 0.0479
2026-05-18 10:33:58,900 - optuna.study.study - INFO - Trial 281 finished with value: 0.04789971701636172 and parameters: {'n_layers': 1, 'embedding_dim': 32, 'lr': 0.0004963740951323989, 'lambda_val': 1.0298577912057436e-06, 'batch_size': 514, 'optimizer': 'RMSprop'}. Best is trial 273 with value: 0.04869007441460256.
2026-05-18 10:34:22,468 - experiment_functions - INFO - Early stopping at epoch 1750. Best Recall: 0.0482
2026-05-18 10:34:22,566 - optuna.study.study - INFO - Trial 282 finished with value: 0.048177616627997404 and parameters: {'n_layers': 1, 'embedding_dim': 32, 'lr': 0.000602049512301222, 'lambda_val': 1.1994721821247728e-06, 'batch_size': 513, 'optimizer': 'RMSprop'}. Best is trial 273 with value: 0.04869007441460256.
2026-05-18 10:34:46,591 - experiment_functions - INFO - Early stopping at epoch 1750. Best Recall: 0.0478
2026-05-18 10:34:46,679 - optuna.study.study - INFO - Trial 283 finished with value: 0.04780147161731711 and parameters: {'n_layers': 1, 'embedding_dim': 32, 'lr': 0.0006472682803513287, 'lambda_val': 1.0126798169895923e-06, 'batch_size': 531, 'optimizer': 'RMSprop'}. Best is trial 273 with value: 0.04869007441460256.
2026-05-18 10:35:00,579 - optuna.study._optimize - INFO - Trial 284 pruned. 
2026-05-18 10:35:13,950 - experiment_functions - INFO - Early stopping at epoch 950. Best Recall: 0.0454
2026-05-18 10:35:14,041 - optuna.study.study - INFO - Trial 285 finished with value: 0.04538749241413287 and parameters: {'n_layers': 1, 'embedding_dim': 128, 'lr': 0.0007423645022737832, 'lambda_val': 1.005198425774123e-06, 'batch_size': 513, 'optimizer': 'RMSprop'}. Best is trial 273 with value: 0.04869007441460256.
2026-05-18 10:35:40,938 - experiment_functions - INFO - Early stopping at epoch 2000. Best Recall: 0.0477
2026-05-18 10:35:41,049 - optuna.study.study - INFO - Trial 286 finished with value: 0.04769943973975912 and parameters: {'n_layers': 1, 'embedding_dim': 32, 'lr': 0.0006388786976763784, 'lambda_val': 2.110691138442495e-06, 'batch_size': 516, 'optimizer': 'RMSprop'}. Best is trial 273 with value: 0.04869007441460256.
2026-05-18 10:36:09,942 - optuna.study._optimize - INFO - Trial 287 pruned. 
2026-05-18 10:36:41,206 - experiment_functions - INFO - Early stopping at epoch 2350. Best Recall: 0.0476
2026-05-18 10:36:41,296 - optuna.study.study - INFO - Trial 288 finished with value: 0.047645020307139824 and parameters: {'n_layers': 1, 'embedding_dim': 32, 'lr': 0.0006122031607323125, 'lambda_val': 1.2484106895515153e-06, 'batch_size': 513, 'optimizer': 'RMSprop'}. Best is trial 273 with value: 0.04869007441460256.
2026-05-18 10:36:58,792 - experiment_functions - INFO - Early stopping at epoch 1300. Best Recall: 0.0471
2026-05-18 10:36:58,927 - optuna.study.study - INFO - Trial 289 finished with value: 0.047139674672255535 and parameters: {'n_layers': 1, 'embedding_dim': 32, 'lr': 0.0007575277246659607, 'lambda_val': 1.514291812730893e-06, 'batch_size': 620, 'optimizer': 'RMSprop'}. Best is trial 273 with value: 0.04869007441460256.
2026-05-18 10:37:15,778 - optuna.study._optimize - INFO - Trial 290 pruned. 
2026-05-18 10:37:31,869 - optuna.study._optimize - INFO - Trial 291 pruned. 
2026-05-18 10:38:02,848 - experiment_functions - INFO - Early stopping at epoch 2250. Best Recall: 0.0479
2026-05-18 10:38:02,959 - optuna.study.study - INFO - Trial 292 finished with value: 0.047937733774659166 and parameters: {'n_layers': 1, 'embedding_dim': 32, 'lr': 0.0005855170888294625, 'lambda_val': 1.724080177057984e-06, 'batch_size': 512, 'optimizer': 'RMSprop'}. Best is trial 273 with value: 0.04869007441460256.
2026-05-18 10:38:26,510 - experiment_functions - INFO - Early stopping at epoch 1700. Best Recall: 0.0475
2026-05-18 10:38:26,617 - optuna.study.study - INFO - Trial 293 finished with value: 0.04747369142547719 and parameters: {'n_layers': 1, 'embedding_dim': 32, 'lr': 0.0008144210629757471, 'lambda_val': 1.8232699250450086e-06, 'batch_size': 512, 'optimizer': 'RMSprop'}. Best is trial 273 with value: 0.04869007441460256.
2026-05-18 10:38:40,762 - optuna.study._optimize - INFO - Trial 294 pruned. 
2026-05-18 10:38:54,997 - optuna.study._optimize - INFO - Trial 295 pruned. 
2026-05-18 10:39:10,126 - optuna.study._optimize - INFO - Trial 296 pruned. 
2026-05-18 10:39:24,900 - optuna.study._optimize - INFO - Trial 297 pruned. 
2026-05-18 10:39:56,212 - experiment_functions - INFO - Early stopping at epoch 2350. Best Recall: 0.0478
2026-05-18 10:39:56,301 - optuna.study.study - INFO - Trial 298 finished with value: 0.04783919985175984 and parameters: {'n_layers': 1, 'embedding_dim': 32, 'lr': 0.0007095358866839307, 'lambda_val': 1.5298460406277828e-06, 'batch_size': 512, 'optimizer': 'RMSprop'}. Best is trial 273 with value: 0.04869007441460256.
2026-05-18 10:40:11,186 - optuna.study._optimize - INFO - Trial 299 pruned. 
2026-05-18 10:40:47,680 - experiment_functions - INFO - Early stopping at epoch 3400. Best Recall: 0.0475
2026-05-18 10:40:48,483 - root - INFO -   ** Getting the trainable edges:
2026-05-18 10:40:48,506 - helper_functions - INFO -      Number of nodes: 4753
2026-05-18 10:40:48,506 - helper_functions - INFO -      Ratio: 0.48768725631028115
2026-05-18 10:40:48,506 - helper_functions - INFO -      Number of unique users: 3162
2026-05-18 10:40:48,506 - helper_functions - INFO -      Number of unique items: 1591
2026-05-18 10:40:48,506 - helper_functions - INFO -      Total dominant set edge: 249067
2026-05-18 10:40:48,506 - helper_functions - INFO -      Trainable edges: 199253.6
2026-05-18 10:40:48,574 - root - INFO -   **** Getting 249067 dominant set edges
2026-05-18 10:40:49,851 - optuna.storages._rdb.storage - INFO - A new study created in RDB with name: Study_e_1M_1c2dcs
2026-05-18 10:42:09,224 - optuna.study.study - INFO - Trial 0 finished with value: 0.045123322176885604 and parameters: {'n_layers': 3, 'embedding_dim': 32, 'lr': 0.00017916192290701595, 'lambda_val': 4.564984833668234e-05, 'batch_size': 3490, 'optimizer': 'RMSprop'}. Best is trial 0 with value: 0.045123322176885604.
2026-05-18 10:42:23,869 - experiment_functions - INFO - Early stopping at epoch 550. Best Recall: 0.0291
2026-05-18 10:42:23,967 - optuna.study.study - INFO - Trial 1 finished with value: 0.0290862944124257 and parameters: {'n_layers': 4, 'embedding_dim': 32, 'lr': 0.0013493522753097642, 'lambda_val': 0.007877533628961887, 'batch_size': 2668, 'optimizer': 'RMSprop'}. Best is trial 0 with value: 0.045123322176885604.
2026-05-18 10:42:34,301 - experiment_functions - INFO - Early stopping at epoch 700. Best Recall: 0.0331
2026-05-18 10:42:34,398 - optuna.study.study - INFO - Trial 2 finished with value: 0.033089996902177 and parameters: {'n_layers': 1, 'embedding_dim': 64, 'lr': 0.022533136643012864, 'lambda_val': 0.00016806532643724237, 'batch_size': 4006, 'optimizer': 'RMSprop'}. Best is trial 0 with value: 0.045123322176885604.
2026-05-18 10:42:42,787 - experiment_functions - INFO - Early stopping at epoch 500. Best Recall: 0.0046
2026-05-18 10:42:42,885 - optuna.study.study - INFO - Trial 3 finished with value: 0.004632465986048358 and parameters: {'n_layers': 3, 'embedding_dim': 32, 'lr': 1.5608987005288684e-05, 'lambda_val': 5.247736311413468e-06, 'batch_size': 1364, 'optimizer': 'SGD'}. Best is trial 0 with value: 0.045123322176885604.
2026-05-18 10:42:51,858 - experiment_functions - INFO - Early stopping at epoch 550. Best Recall: 0.0807
2026-05-18 10:42:51,961 - optuna.study.study - INFO - Trial 4 finished with value: 0.08067839919821178 and parameters: {'n_layers': 1, 'embedding_dim': 128, 'lr': 0.005057809881136035, 'lambda_val': 1.013175798568523e-05, 'batch_size': 3488, 'optimizer': 'Adam'}. Best is trial 4 with value: 0.08067839919821178.
2026-05-18 10:43:00,378 - experiment_functions - INFO - Early stopping at epoch 550. Best Recall: 0.0372
2026-05-18 10:43:00,468 - optuna.study.study - INFO - Trial 5 finished with value: 0.03716129612194226 and parameters: {'n_layers': 2, 'embedding_dim': 64, 'lr': 0.0019141780694372675, 'lambda_val': 1.827322672709032e-05, 'batch_size': 3684, 'optimizer': 'RMSprop'}. Best is trial 4 with value: 0.08067839919821178.
2026-05-18 10:43:08,635 - experiment_functions - INFO - Early stopping at epoch 500. Best Recall: 0.0052
2026-05-18 10:43:08,743 - optuna.study.study - INFO - Trial 6 finished with value: 0.005174399911612503 and parameters: {'n_layers': 4, 'embedding_dim': 32, 'lr': 0.03218196885382222, 'lambda_val': 0.0003380131835480967, 'batch_size': 1372, 'optimizer': 'SGD'}. Best is trial 4 with value: 0.08067839919821178.
2026-05-18 10:43:40,072 - experiment_functions - INFO - Early stopping at epoch 1800. Best Recall: 0.0449
