2026-05-18 21:58:03,855 - optuna.study.study - INFO - Trial 225 finished with value: 0.08881297380292644 and parameters: {'n_layers': 1, 'embedding_dim': 64, 'lr': 0.0010548652066666058, 'lambda_val': 0.0002652544403362278, 'batch_size': 688, 'optimizer': 'RMSprop'}. Best is trial 132 with value: 0.09765203524228237.
2026-05-18 21:58:26,727 - optuna.study._optimize - INFO - Trial 226 pruned. 
2026-05-18 21:58:41,594 - optuna.study._optimize - INFO - Trial 227 pruned. 
2026-05-18 21:58:55,502 - experiment_functions - INFO - Early stopping at epoch 950. Best Recall: 0.0917
2026-05-18 21:58:55,592 - optuna.study.study - INFO - Trial 228 finished with value: 0.0917113020305168 and parameters: {'n_layers': 1, 'embedding_dim': 64, 'lr': 0.0008035817868084744, 'lambda_val': 0.0002911827336983598, 'batch_size': 704, 'optimizer': 'RMSprop'}. Best is trial 132 with value: 0.09765203524228237.
2026-05-18 21:59:10,392 - optuna.study._optimize - INFO - Trial 229 pruned. 
2026-05-18 21:59:43,035 - experiment_functions - INFO - Early stopping at epoch 1650. Best Recall: 0.0959
2026-05-18 21:59:43,145 - optuna.study.study - INFO - Trial 230 finished with value: 0.09594618089694956 and parameters: {'n_layers': 1, 'embedding_dim': 64, 'lr': 0.0006458781773747518, 'lambda_val': 8.522618947995131e-05, 'batch_size': 512, 'optimizer': 'RMSprop'}. Best is trial 132 with value: 0.09765203524228237.
2026-05-18 22:00:02,572 - optuna.study._optimize - INFO - Trial 231 pruned. 
2026-05-18 22:00:40,285 - optuna.study._optimize - INFO - Trial 232 pruned. 
2026-05-18 22:01:00,545 - experiment_functions - INFO - Early stopping at epoch 1300. Best Recall: 0.0934
2026-05-18 22:01:00,634 - optuna.study.study - INFO - Trial 233 finished with value: 0.09336343398887526 and parameters: {'n_layers': 1, 'embedding_dim': 64, 'lr': 0.0007451678880347744, 'lambda_val': 7.187526282585643e-05, 'batch_size': 639, 'optimizer': 'RMSprop'}. Best is trial 132 with value: 0.09765203524228237.
2026-05-18 22:01:13,509 - experiment_functions - INFO - Early stopping at epoch 850. Best Recall: 0.0909
2026-05-18 22:01:13,598 - optuna.study.study - INFO - Trial 234 finished with value: 0.09094947825087665 and parameters: {'n_layers': 1, 'embedding_dim': 64, 'lr': 0.000906097900102918, 'lambda_val': 0.00013248679066005825, 'batch_size': 628, 'optimizer': 'RMSprop'}. Best is trial 132 with value: 0.09765203524228237.
2026-05-18 22:01:56,955 - experiment_functions - INFO - Early stopping at epoch 2400. Best Recall: 0.0972
2026-05-18 22:01:57,044 - optuna.study.study - INFO - Trial 235 finished with value: 0.09717364277004438 and parameters: {'n_layers': 1, 'embedding_dim': 64, 'lr': 0.0005717531266599037, 'lambda_val': 5.7875158854679e-05, 'batch_size': 514, 'optimizer': 'RMSprop'}. Best is trial 132 with value: 0.09765203524228237.
2026-05-18 22:02:11,484 - optuna.study._optimize - INFO - Trial 236 pruned. 
2026-05-18 22:02:18,566 - experiment_functions - INFO - Early stopping at epoch 500. Best Recall: 0.0057
2026-05-18 22:02:18,670 - optuna.study.study - INFO - Trial 237 finished with value: 0.005675458796975922 and parameters: {'n_layers': 1, 'embedding_dim': 64, 'lr': 2.1758671160434833e-05, 'lambda_val': 5.640062102523216e-05, 'batch_size': 575, 'optimizer': 'RMSprop'}. Best is trial 132 with value: 0.09765203524228237.
2026-05-18 22:02:33,924 - optuna.study._optimize - INFO - Trial 238 pruned. 
2026-05-18 22:02:53,718 - optuna.study._optimize - INFO - Trial 239 pruned. 
2026-05-18 22:03:08,793 - experiment_functions - INFO - Early stopping at epoch 1000. Best Recall: 0.0920
2026-05-18 22:03:08,883 - optuna.study.study - INFO - Trial 240 finished with value: 0.09201247865765658 and parameters: {'n_layers': 1, 'embedding_dim': 64, 'lr': 0.0007762450153900103, 'lambda_val': 0.0001100278235668144, 'batch_size': 675, 'optimizer': 'RMSprop'}. Best is trial 132 with value: 0.09765203524228237.
2026-05-18 22:03:27,696 - optuna.study._optimize - INFO - Trial 241 pruned. 
2026-05-18 22:03:50,852 - experiment_functions - INFO - Early stopping at epoch 1400. Best Recall: 0.0950
2026-05-18 22:03:50,953 - optuna.study.study - INFO - Trial 242 finished with value: 0.0950153788658416 and parameters: {'n_layers': 1, 'embedding_dim': 64, 'lr': 0.0006642430294644573, 'lambda_val': 0.00020711400950392642, 'batch_size': 585, 'optimizer': 'RMSprop'}. Best is trial 132 with value: 0.09765203524228237.
2026-05-18 22:04:07,688 - optuna.study._optimize - INFO - Trial 243 pruned. 
2026-05-18 22:04:28,336 - optuna.study._optimize - INFO - Trial 244 pruned. 
2026-05-18 22:04:45,035 - optuna.study._optimize - INFO - Trial 245 pruned. 
2026-05-18 22:05:00,094 - experiment_functions - INFO - Early stopping at epoch 1050. Best Recall: 0.0909
2026-05-18 22:05:00,184 - optuna.study.study - INFO - Trial 246 finished with value: 0.0909002000512725 and parameters: {'n_layers': 1, 'embedding_dim': 64, 'lr': 0.0008623495236198313, 'lambda_val': 0.00013158442716775803, 'batch_size': 572, 'optimizer': 'RMSprop'}. Best is trial 132 with value: 0.09765203524228237.
2026-05-18 22:05:27,326 - experiment_functions - INFO - Early stopping at epoch 1800. Best Recall: 0.0950
2026-05-18 22:05:27,427 - optuna.study.study - INFO - Trial 247 finished with value: 0.09503136293583427 and parameters: {'n_layers': 1, 'embedding_dim': 64, 'lr': 0.0005833309149162972, 'lambda_val': 0.0002332049489956653, 'batch_size': 642, 'optimizer': 'RMSprop'}. Best is trial 132 with value: 0.09765203524228237.
2026-05-18 22:06:13,673 - optuna.study._optimize - INFO - Trial 248 pruned. 
2026-05-18 22:06:33,513 - optuna.study._optimize - INFO - Trial 249 pruned. 
2026-05-18 22:06:40,549 - experiment_functions - INFO - Early stopping at epoch 500. Best Recall: 0.0048
2026-05-18 22:06:40,641 - optuna.study.study - INFO - Trial 250 finished with value: 0.0047927973663241304 and parameters: {'n_layers': 1, 'embedding_dim': 64, 'lr': 0.0004883221237235348, 'lambda_val': 0.00023492742594745887, 'batch_size': 703, 'optimizer': 'SGD'}. Best is trial 132 with value: 0.09765203524228237.
2026-05-18 22:06:55,892 - optuna.study._optimize - INFO - Trial 251 pruned. 
2026-05-18 22:07:10,173 - optuna.study._optimize - INFO - Trial 252 pruned. 
2026-05-18 22:07:26,915 - experiment_functions - INFO - Early stopping at epoch 1150. Best Recall: 0.0936
2026-05-18 22:07:27,016 - optuna.study.study - INFO - Trial 253 finished with value: 0.09356807759225388 and parameters: {'n_layers': 1, 'embedding_dim': 64, 'lr': 0.00065090794478447, 'lambda_val': 0.000270713404171754, 'batch_size': 737, 'optimizer': 'RMSprop'}. Best is trial 132 with value: 0.09765203524228237.
2026-05-18 22:07:41,540 - optuna.study._optimize - INFO - Trial 254 pruned. 
2026-05-18 22:07:54,579 - experiment_functions - INFO - Early stopping at epoch 800. Best Recall: 0.0897
2026-05-18 22:07:54,680 - optuna.study.study - INFO - Trial 255 finished with value: 0.08973821345649989 and parameters: {'n_layers': 1, 'embedding_dim': 64, 'lr': 0.0010520693257176424, 'lambda_val': 0.0001458724426293545, 'batch_size': 620, 'optimizer': 'RMSprop'}. Best is trial 132 with value: 0.09765203524228237.
2026-05-18 22:08:14,971 - optuna.study._optimize - INFO - Trial 256 pruned. 
2026-05-18 22:08:39,727 - experiment_functions - INFO - Early stopping at epoch 1100. Best Recall: 0.0915
2026-05-18 22:08:40,235 - optuna.study.study - INFO - Trial 257 finished with value: 0.09150996682681924 and parameters: {'n_layers': 1, 'embedding_dim': 64, 'lr': 0.0007750553178228457, 'lambda_val': 0.00024278201136543939, 'batch_size': 675, 'optimizer': 'RMSprop'}. Best is trial 132 with value: 0.09765203524228237.
2026-05-18 22:09:05,484 - experiment_functions - INFO - Early stopping at epoch 1700. Best Recall: 0.0944
2026-05-18 22:09:05,585 - optuna.study.study - INFO - Trial 258 finished with value: 0.09437287386531167 and parameters: {'n_layers': 1, 'embedding_dim': 64, 'lr': 0.0005803811048610779, 'lambda_val': 0.00033431251978722424, 'batch_size': 583, 'optimizer': 'RMSprop'}. Best is trial 132 with value: 0.09765203524228237.
2026-05-18 22:09:20,028 - optuna.study._optimize - INFO - Trial 259 pruned. 
2026-05-18 22:09:29,490 - experiment_functions - INFO - Early stopping at epoch 600. Best Recall: 0.0764
2026-05-18 22:09:29,581 - optuna.study.study - INFO - Trial 260 finished with value: 0.07636592501056147 and parameters: {'n_layers': 1, 'embedding_dim': 64, 'lr': 0.0009568408902529904, 'lambda_val': 0.00014135628415388316, 'batch_size': 3044, 'optimizer': 'RMSprop'}. Best is trial 132 with value: 0.09765203524228237.
2026-05-18 22:09:49,797 - experiment_functions - INFO - Early stopping at epoch 1350. Best Recall: 0.0949
2026-05-18 22:09:49,886 - optuna.study.study - INFO - Trial 261 finished with value: 0.09491103431976085 and parameters: {'n_layers': 1, 'embedding_dim': 64, 'lr': 0.0006632546417699812, 'lambda_val': 0.00020795927652673556, 'batch_size': 689, 'optimizer': 'RMSprop'}. Best is trial 132 with value: 0.09765203524228237.
2026-05-18 22:10:18,592 - experiment_functions - INFO - Early stopping at epoch 1350. Best Recall: 0.0935
2026-05-18 22:10:18,681 - optuna.study.study - INFO - Trial 262 finished with value: 0.09352273084240376 and parameters: {'n_layers': 1, 'embedding_dim': 64, 'lr': 0.0006826687915716275, 'lambda_val': 0.00020401579533963456, 'batch_size': 675, 'optimizer': 'RMSprop'}. Best is trial 132 with value: 0.09765203524228237.
2026-05-18 22:11:03,223 - optuna.study._optimize - INFO - Trial 263 pruned. 
2026-05-18 22:11:29,251 - experiment_functions - INFO - Early stopping at epoch 1300. Best Recall: 0.0952
2026-05-18 22:11:29,352 - optuna.study.study - INFO - Trial 264 finished with value: 0.09521576066848153 and parameters: {'n_layers': 1, 'embedding_dim': 64, 'lr': 0.0008146428009935531, 'lambda_val': 0.0002557268679553101, 'batch_size': 512, 'optimizer': 'RMSprop'}. Best is trial 132 with value: 0.09765203524228237.
2026-05-18 22:11:41,412 - experiment_functions - INFO - Early stopping at epoch 750. Best Recall: 0.0876
2026-05-18 22:11:41,522 - optuna.study.study - INFO - Trial 265 finished with value: 0.0876383157382059 and parameters: {'n_layers': 1, 'embedding_dim': 64, 'lr': 0.0012000631686464854, 'lambda_val': 0.00026311540931119243, 'batch_size': 642, 'optimizer': 'RMSprop'}. Best is trial 132 with value: 0.09765203524228237.
2026-05-18 22:11:55,896 - optuna.study._optimize - INFO - Trial 266 pruned. 
2026-05-18 22:12:09,473 - experiment_functions - INFO - Early stopping at epoch 900. Best Recall: 0.0918
2026-05-18 22:12:09,607 - optuna.study.study - INFO - Trial 267 finished with value: 0.09178210438134501 and parameters: {'n_layers': 1, 'embedding_dim': 64, 'lr': 0.0008600162938855872, 'lambda_val': 0.0003527317772868389, 'batch_size': 617, 'optimizer': 'RMSprop'}. Best is trial 132 with value: 0.09765203524228237.
2026-05-18 22:12:28,618 - optuna.study._optimize - INFO - Trial 268 pruned. 
2026-05-18 22:12:42,901 - optuna.study._optimize - INFO - Trial 269 pruned. 
2026-05-18 22:12:58,120 - optuna.study._optimize - INFO - Trial 270 pruned. 
2026-05-18 22:13:05,190 - experiment_functions - INFO - Early stopping at epoch 500. Best Recall: 0.0050
2026-05-18 22:13:05,280 - optuna.study.study - INFO - Trial 271 finished with value: 0.004981426293806179 and parameters: {'n_layers': 1, 'embedding_dim': 64, 'lr': 0.00051377040542155, 'lambda_val': 0.00016646633630927477, 'batch_size': 653, 'optimizer': 'SGD'}. Best is trial 132 with value: 0.09765203524228237.
2026-05-18 22:13:18,550 - experiment_functions - INFO - Early stopping at epoch 900. Best Recall: 0.0885
2026-05-18 22:13:18,662 - optuna.study.study - INFO - Trial 272 finished with value: 0.08853225806564614 and parameters: {'n_layers': 1, 'embedding_dim': 64, 'lr': 0.0009215281441769944, 'lambda_val': 0.00024068707745695863, 'batch_size': 814, 'optimizer': 'RMSprop'}. Best is trial 132 with value: 0.09765203524228237.
2026-05-18 22:13:31,549 - experiment_functions - INFO - Early stopping at epoch 750. Best Recall: 0.0549
2026-05-18 22:13:31,660 - optuna.study.study - INFO - Trial 273 finished with value: 0.054935744118317274 and parameters: {'n_layers': 4, 'embedding_dim': 64, 'lr': 0.0006306034745007709, 'lambda_val': 0.0001023116702110288, 'batch_size': 515, 'optimizer': 'RMSprop'}. Best is trial 132 with value: 0.09765203524228237.
2026-05-18 22:13:46,419 - optuna.study._optimize - INFO - Trial 274 pruned. 
2026-05-18 22:14:03,078 - optuna.study._optimize - INFO - Trial 275 pruned. 
2026-05-18 22:14:18,552 - optuna.study._optimize - INFO - Trial 276 pruned. 
2026-05-18 22:14:31,066 - experiment_functions - INFO - Early stopping at epoch 750. Best Recall: 0.0814
2026-05-18 22:14:31,212 - optuna.study.study - INFO - Trial 277 finished with value: 0.08139253189350133 and parameters: {'n_layers': 2, 'embedding_dim': 64, 'lr': 0.0006473714819710314, 'lambda_val': 0.0002968630263424107, 'batch_size': 582, 'optimizer': 'RMSprop'}. Best is trial 132 with value: 0.09765203524228237.
2026-05-18 22:14:43,985 - experiment_functions - INFO - Early stopping at epoch 850. Best Recall: 0.0871
2026-05-18 22:14:44,086 - optuna.study.study - INFO - Trial 278 finished with value: 0.08714511258169218 and parameters: {'n_layers': 1, 'embedding_dim': 64, 'lr': 0.0010569379847585711, 'lambda_val': 0.00015833005777478887, 'batch_size': 513, 'optimizer': 'RMSprop'}. Best is trial 132 with value: 0.09765203524228237.
2026-05-18 22:14:59,099 - optuna.study._optimize - INFO - Trial 279 pruned. 
2026-05-18 22:15:33,991 - experiment_functions - INFO - Early stopping at epoch 2450. Best Recall: 0.0949
2026-05-18 22:15:34,126 - optuna.study.study - INFO - Trial 280 finished with value: 0.09492475987987278 and parameters: {'n_layers': 1, 'embedding_dim': 96, 'lr': 0.0005037799602360962, 'lambda_val': 0.00022946917621313506, 'batch_size': 630, 'optimizer': 'RMSprop'}. Best is trial 132 with value: 0.09765203524228237.
2026-05-18 22:16:05,337 - experiment_functions - INFO - Early stopping at epoch 2100. Best Recall: 0.0947
2026-05-18 22:16:05,436 - optuna.study.study - INFO - Trial 281 finished with value: 0.09474859768257805 and parameters: {'n_layers': 1, 'embedding_dim': 96, 'lr': 0.00045524831369177997, 'lambda_val': 0.00022268723285535946, 'batch_size': 787, 'optimizer': 'RMSprop'}. Best is trial 132 with value: 0.09765203524228237.
2026-05-18 22:16:30,100 - experiment_functions - INFO - Early stopping at epoch 1700. Best Recall: 0.0953
2026-05-18 22:16:30,399 - optuna.study.study - INFO - Trial 282 finished with value: 0.09530907037356422 and parameters: {'n_layers': 1, 'embedding_dim': 96, 'lr': 0.0005147349045945126, 'lambda_val': 0.0003635951919979137, 'batch_size': 653, 'optimizer': 'RMSprop'}. Best is trial 132 with value: 0.09765203524228237.
2026-05-18 22:16:45,356 - optuna.study._optimize - INFO - Trial 283 pruned. 
2026-05-18 22:17:50,929 - optuna.study.study - INFO - Trial 284 finished with value: 0.09705041081769761 and parameters: {'n_layers': 1, 'embedding_dim': 96, 'lr': 0.0004892077838486261, 'lambda_val': 0.00037689964283194353, 'batch_size': 592, 'optimizer': 'RMSprop'}. Best is trial 132 with value: 0.09765203524228237.
2026-05-18 22:18:04,860 - optuna.study._optimize - INFO - Trial 285 pruned. 
2026-05-18 22:18:20,028 - optuna.study._optimize - INFO - Trial 286 pruned. 
2026-05-18 22:19:01,972 - experiment_functions - INFO - Early stopping at epoch 2350. Best Recall: 0.0956
2026-05-18 22:19:02,117 - optuna.study.study - INFO - Trial 287 finished with value: 0.0956152489043964 and parameters: {'n_layers': 1, 'embedding_dim': 96, 'lr': 0.0005456373955485167, 'lambda_val': 0.00031755746631792833, 'batch_size': 517, 'optimizer': 'RMSprop'}. Best is trial 132 with value: 0.09765203524228237.
2026-05-18 22:19:33,941 - experiment_functions - INFO - Early stopping at epoch 2200. Best Recall: 0.0954
2026-05-18 22:19:34,039 - optuna.study.study - INFO - Trial 288 finished with value: 0.09543690001349633 and parameters: {'n_layers': 1, 'embedding_dim': 96, 'lr': 0.0005220049375536527, 'lambda_val': 0.0005436760876313333, 'batch_size': 513, 'optimizer': 'RMSprop'}. Best is trial 132 with value: 0.09765203524228237.
2026-05-18 22:19:48,490 - optuna.study._optimize - INFO - Trial 289 pruned. 
2026-05-18 22:20:18,025 - optuna.study._optimize - INFO - Trial 290 pruned. 
2026-05-18 22:20:30,731 - experiment_functions - INFO - Early stopping at epoch 800. Best Recall: 0.0869
2026-05-18 22:20:30,832 - optuna.study.study - INFO - Trial 291 finished with value: 0.0869201500106151 and parameters: {'n_layers': 1, 'embedding_dim': 96, 'lr': 0.0008548387764381189, 'lambda_val': 0.0007965906354831537, 'batch_size': 650, 'optimizer': 'RMSprop'}. Best is trial 132 with value: 0.09765203524228237.
2026-05-18 22:20:47,721 - experiment_functions - INFO - Early stopping at epoch 850. Best Recall: 0.0742
2026-05-18 22:20:47,810 - optuna.study.study - INFO - Trial 292 finished with value: 0.07417723434970268 and parameters: {'n_layers': 3, 'embedding_dim': 96, 'lr': 0.00041362957945131066, 'lambda_val': 0.0003825005204520927, 'batch_size': 574, 'optimizer': 'RMSprop'}. Best is trial 132 with value: 0.09765203524228237.
2026-05-18 22:21:23,194 - optuna.study._optimize - INFO - Trial 293 pruned. 
2026-05-18 22:21:32,003 - experiment_functions - INFO - Early stopping at epoch 500. Best Recall: 0.0053
2026-05-18 22:21:32,104 - optuna.study.study - INFO - Trial 294 finished with value: 0.005313597495620977 and parameters: {'n_layers': 1, 'embedding_dim': 96, 'lr': 0.0007279919749510465, 'lambda_val': 0.0006207308269225749, 'batch_size': 678, 'optimizer': 'SGD'}. Best is trial 132 with value: 0.09765203524228237.
2026-05-18 22:21:58,775 - experiment_functions - INFO - Early stopping at epoch 1600. Best Recall: 0.0953
2026-05-18 22:21:58,863 - optuna.study.study - INFO - Trial 295 finished with value: 0.0952729355761191 and parameters: {'n_layers': 1, 'embedding_dim': 96, 'lr': 0.0005728611679957247, 'lambda_val': 0.00044440598253843336, 'batch_size': 512, 'optimizer': 'RMSprop'}. Best is trial 132 with value: 0.09765203524228237.
2026-05-18 22:22:09,341 - experiment_functions - INFO - Early stopping at epoch 650. Best Recall: 0.0837
2026-05-18 22:22:09,430 - optuna.study.study - INFO - Trial 296 finished with value: 0.08368286645158758 and parameters: {'n_layers': 1, 'embedding_dim': 96, 'lr': 0.001438581651770733, 'lambda_val': 0.0004859398808933619, 'batch_size': 517, 'optimizer': 'RMSprop'}. Best is trial 132 with value: 0.09765203524228237.
2026-05-18 22:22:23,110 - optuna.study._optimize - INFO - Trial 297 pruned. 
2026-05-18 22:22:44,534 - experiment_functions - INFO - Early stopping at epoch 950. Best Recall: 0.0878
2026-05-18 22:22:44,623 - optuna.study.study - INFO - Trial 298 finished with value: 0.08782827375342996 and parameters: {'n_layers': 1, 'embedding_dim': 96, 'lr': 0.00045953985114373407, 'lambda_val': 0.0002975423896874301, 'batch_size': 2458, 'optimizer': 'RMSprop'}. Best is trial 132 with value: 0.09765203524228237.
2026-05-18 22:23:00,373 - optuna.study._optimize - INFO - Trial 299 pruned. 
2026-05-18 22:23:14,753 - experiment_functions - INFO - Early stopping at epoch 1200. Best Recall: 0.0915
2026-05-18 22:23:15,698 - root - INFO -   **** Training e_1M_1c3dcs_rand1
2026-05-18 22:23:15,765 - root - INFO -   **** Getting 221091/805443 random edges
2026-05-18 22:23:15,947 - optuna.storages._rdb.storage - INFO - A new study created in RDB with name: Study_e_1M_1c3dcs_rand1
2026-05-18 22:23:31,092 - experiment_functions - INFO - Early stopping at epoch 750. Best Recall: 0.0587
2026-05-18 22:23:31,227 - optuna.study.study - INFO - Trial 0 finished with value: 0.0587424388882642 and parameters: {'n_layers': 1, 'embedding_dim': 96, 'lr': 0.0014383095083477816, 'lambda_val': 0.01597080472403683, 'batch_size': 1460, 'optimizer': 'Adam'}. Best is trial 0 with value: 0.0587424388882642.
2026-05-18 22:25:06,040 - experiment_functions - INFO - Early stopping at epoch 3400. Best Recall: 0.0306
2026-05-18 22:25:06,174 - optuna.study.study - INFO - Trial 1 finished with value: 0.03061021996175147 and parameters: {'n_layers': 2, 'embedding_dim': 256, 'lr': 0.029479276025990014, 'lambda_val': 0.00592873198976942, 'batch_size': 2820, 'optimizer': 'Adam'}. Best is trial 0 with value: 0.0587424388882642.
2026-05-18 22:25:16,024 - experiment_functions - INFO - Early stopping at epoch 500. Best Recall: 0.0052
2026-05-18 22:25:16,113 - optuna.study.study - INFO - Trial 2 finished with value: 0.005219741250428288 and parameters: {'n_layers': 1, 'embedding_dim': 32, 'lr': 0.02871038757820438, 'lambda_val': 1.6110113133572154e-06, 'batch_size': 3401, 'optimizer': 'SGD'}. Best is trial 0 with value: 0.0587424388882642.
2026-05-18 22:25:45,343 - experiment_functions - INFO - Early stopping at epoch 2250. Best Recall: 0.0052
2026-05-18 22:25:45,443 - optuna.study.study - INFO - Trial 3 finished with value: 0.005155807791384898 and parameters: {'n_layers': 1, 'embedding_dim': 32, 'lr': 5.437946170524193e-05, 'lambda_val': 0.00017142807165835658, 'batch_size': 2228, 'optimizer': 'Adam'}. Best is trial 0 with value: 0.0587424388882642.
2026-05-18 22:25:53,117 - experiment_functions - INFO - Early stopping at epoch 500. Best Recall: 0.0055
2026-05-18 22:25:53,208 - optuna.study.study - INFO - Trial 4 finished with value: 0.005549306730371578 and parameters: {'n_layers': 1, 'embedding_dim': 128, 'lr': 0.015745085374521687, 'lambda_val': 0.00016640201277071085, 'batch_size': 3662, 'optimizer': 'SGD'}. Best is trial 0 with value: 0.0587424388882642.
2026-05-18 22:26:29,272 - experiment_functions - INFO - Early stopping at epoch 2300. Best Recall: 0.0576
