2026-05-19 04:45:15,873 - optuna.study.study - INFO - Trial 12 finished with value: 0.05805972493621394 and parameters: {'n_layers': 1, 'embedding_dim': 256, 'lr': 0.0026508567584490957, 'lambda_val': 1.0949179933924168e-05, 'batch_size': 2693, 'optimizer': 'Adam'}. Best is trial 12 with value: 0.05805972493621394.
2026-05-19 04:45:25,811 - experiment_functions - INFO - Early stopping at epoch 550. Best Recall: 0.0484
2026-05-19 04:45:25,954 - optuna.study.study - INFO - Trial 13 finished with value: 0.048367643483821006 and parameters: {'n_layers': 2, 'embedding_dim': 256, 'lr': 0.0028058974768146133, 'lambda_val': 1.5579780274324173e-06, 'batch_size': 2575, 'optimizer': 'Adam'}. Best is trial 12 with value: 0.05805972493621394.
2026-05-19 04:45:44,269 - optuna.study._optimize - INFO - Trial 14 pruned. 
2026-05-19 04:45:56,801 - experiment_functions - INFO - Early stopping at epoch 750. Best Recall: 0.0562
2026-05-19 04:45:56,899 - optuna.study.study - INFO - Trial 15 finished with value: 0.056177171188033746 and parameters: {'n_layers': 1, 'embedding_dim': 256, 'lr': 0.0012068259787338794, 'lambda_val': 0.0007081761842276617, 'batch_size': 2523, 'optimizer': 'Adam'}. Best is trial 12 with value: 0.05805972493621394.
2026-05-19 04:46:09,762 - experiment_functions - INFO - Early stopping at epoch 750. Best Recall: 0.0311
2026-05-19 04:46:11,907 - optuna.study.study - INFO - Trial 16 finished with value: 0.03113034264041158 and parameters: {'n_layers': 2, 'embedding_dim': 256, 'lr': 0.010696193906067632, 'lambda_val': 3.946546813511558e-06, 'batch_size': 4004, 'optimizer': 'Adam'}. Best is trial 12 with value: 0.05805972493621394.
2026-05-19 04:46:29,104 - experiment_functions - INFO - Early stopping at epoch 1000. Best Recall: 0.0603
2026-05-19 04:46:29,203 - optuna.study.study - INFO - Trial 17 finished with value: 0.060291347022818687 and parameters: {'n_layers': 1, 'embedding_dim': 32, 'lr': 0.0011153934502776172, 'lambda_val': 3.177594051926854e-05, 'batch_size': 1854, 'optimizer': 'Adam'}. Best is trial 17 with value: 0.060291347022818687.
2026-05-19 04:46:53,385 - experiment_functions - INFO - Early stopping at epoch 1600. Best Recall: 0.0607
2026-05-19 04:46:53,474 - optuna.study.study - INFO - Trial 18 finished with value: 0.06069343485345401 and parameters: {'n_layers': 1, 'embedding_dim': 32, 'lr': 0.0007520011183002669, 'lambda_val': 4.190403948183137e-05, 'batch_size': 1764, 'optimizer': 'Adam'}. Best is trial 18 with value: 0.06069343485345401.
2026-05-19 04:47:10,138 - optuna.study._optimize - INFO - Trial 19 pruned. 
2026-05-19 04:47:29,853 - experiment_functions - INFO - Early stopping at epoch 1400. Best Recall: 0.0608
2026-05-19 04:47:29,998 - optuna.study.study - INFO - Trial 20 finished with value: 0.06081847224757791 and parameters: {'n_layers': 1, 'embedding_dim': 32, 'lr': 0.0007110003034994819, 'lambda_val': 0.0008511308105621101, 'batch_size': 1638, 'optimizer': 'RMSprop'}. Best is trial 20 with value: 0.06081847224757791.
2026-05-19 04:47:46,338 - optuna.study._optimize - INFO - Trial 21 pruned. 
2026-05-19 04:48:10,079 - experiment_functions - INFO - Early stopping at epoch 1600. Best Recall: 0.0667
2026-05-19 04:48:10,187 - optuna.study.study - INFO - Trial 22 finished with value: 0.06671336317018832 and parameters: {'n_layers': 1, 'embedding_dim': 32, 'lr': 0.0007790968447726069, 'lambda_val': 0.0003030946124929897, 'batch_size': 1159, 'optimizer': 'RMSprop'}. Best is trial 22 with value: 0.06671336317018832.
2026-05-19 04:48:34,347 - optuna.study._optimize - INFO - Trial 23 pruned. 
2026-05-19 04:48:53,033 - experiment_functions - INFO - Early stopping at epoch 1100. Best Recall: 0.0669
2026-05-19 04:48:53,134 - optuna.study.study - INFO - Trial 24 finished with value: 0.0668806861475537 and parameters: {'n_layers': 1, 'embedding_dim': 32, 'lr': 0.0009277270001740394, 'lambda_val': 0.0025419512132977885, 'batch_size': 1207, 'optimizer': 'RMSprop'}. Best is trial 24 with value: 0.0668806861475537.
2026-05-19 04:49:01,468 - experiment_functions - INFO - Early stopping at epoch 550. Best Recall: 0.0245
2026-05-19 04:49:01,566 - optuna.study.study - INFO - Trial 25 finished with value: 0.02451780494037788 and parameters: {'n_layers': 1, 'embedding_dim': 32, 'lr': 0.0054937067079353285, 'lambda_val': 0.0016957193504856126, 'batch_size': 1043, 'optimizer': 'RMSprop'}. Best is trial 24 with value: 0.0668806861475537.
2026-05-19 04:49:15,384 - optuna.study._optimize - INFO - Trial 26 pruned. 
2026-05-19 04:49:29,346 - optuna.study._optimize - INFO - Trial 27 pruned. 
2026-05-19 04:49:40,576 - experiment_functions - INFO - Early stopping at epoch 650. Best Recall: 0.0519
2026-05-19 04:49:40,664 - optuna.study.study - INFO - Trial 28 finished with value: 0.05190162824977737 and parameters: {'n_layers': 2, 'embedding_dim': 32, 'lr': 0.0011412955001076997, 'lambda_val': 0.001007769406249392, 'batch_size': 1024, 'optimizer': 'RMSprop'}. Best is trial 24 with value: 0.0668806861475537.
2026-05-19 04:49:54,425 - optuna.study._optimize - INFO - Trial 29 pruned. 
2026-05-19 04:50:08,077 - experiment_functions - INFO - Early stopping at epoch 850. Best Recall: 0.0540
2026-05-19 04:50:08,175 - optuna.study.study - INFO - Trial 30 finished with value: 0.053956869303292625 and parameters: {'n_layers': 2, 'embedding_dim': 96, 'lr': 0.0005384483945598402, 'lambda_val': 0.00017459855226937973, 'batch_size': 1115, 'optimizer': 'RMSprop'}. Best is trial 24 with value: 0.0668806861475537.
2026-05-19 04:50:30,908 - experiment_functions - INFO - Early stopping at epoch 1600. Best Recall: 0.0647
2026-05-19 04:50:31,060 - optuna.study.study - INFO - Trial 31 finished with value: 0.06470894766681529 and parameters: {'n_layers': 1, 'embedding_dim': 32, 'lr': 0.0006283431476366624, 'lambda_val': 5.077739063353211e-05, 'batch_size': 1689, 'optimizer': 'RMSprop'}. Best is trial 24 with value: 0.0668806861475537.
2026-05-19 04:50:41,048 - experiment_functions - INFO - Early stopping at epoch 650. Best Recall: 0.0586
2026-05-19 04:50:41,141 - optuna.study.study - INFO - Trial 32 finished with value: 0.05855167948334375 and parameters: {'n_layers': 1, 'embedding_dim': 32, 'lr': 0.0015447591471711773, 'lambda_val': 0.0005832423388662773, 'batch_size': 1520, 'optimizer': 'RMSprop'}. Best is trial 24 with value: 0.0668806861475537.
2026-05-19 04:51:00,170 - experiment_functions - INFO - Early stopping at epoch 1150. Best Recall: 0.0668
2026-05-19 04:51:00,277 - optuna.study.study - INFO - Trial 33 finished with value: 0.06683591550394863 and parameters: {'n_layers': 1, 'embedding_dim': 32, 'lr': 0.000775156802987468, 'lambda_val': 0.023115810959855855, 'batch_size': 845, 'optimizer': 'RMSprop'}. Best is trial 24 with value: 0.0668806861475537.
2026-05-19 04:51:07,519 - experiment_functions - INFO - Early stopping at epoch 500. Best Recall: 0.0053
2026-05-19 04:51:07,618 - optuna.study.study - INFO - Trial 34 finished with value: 0.005326674867361847 and parameters: {'n_layers': 1, 'embedding_dim': 32, 'lr': 0.00021295018229493544, 'lambda_val': 0.019779487593805854, 'batch_size': 838, 'optimizer': 'RMSprop'}. Best is trial 24 with value: 0.0668806861475537.
2026-05-19 04:51:26,509 - optuna.study._optimize - INFO - Trial 35 pruned. 
2026-05-19 04:51:40,682 - experiment_functions - INFO - Early stopping at epoch 500. Best Recall: 0.0064
2026-05-19 04:51:40,772 - optuna.study.study - INFO - Trial 36 finished with value: 0.006443326640540511 and parameters: {'n_layers': 2, 'embedding_dim': 64, 'lr': 5.224930009550064e-05, 'lambda_val': 0.07737492234439763, 'batch_size': 850, 'optimizer': 'RMSprop'}. Best is trial 24 with value: 0.0668806861475537.
2026-05-19 04:51:49,881 - experiment_functions - INFO - Early stopping at epoch 500. Best Recall: 0.0056
2026-05-19 04:51:49,981 - optuna.study.study - INFO - Trial 37 finished with value: 0.005638717973645794 and parameters: {'n_layers': 1, 'embedding_dim': 128, 'lr': 0.00032588292681168306, 'lambda_val': 0.006103719810115523, 'batch_size': 619, 'optimizer': 'SGD'}. Best is trial 24 with value: 0.0668806861475537.
2026-05-19 04:52:03,930 - optuna.study._optimize - INFO - Trial 38 pruned. 
2026-05-19 04:52:11,502 - experiment_functions - INFO - Early stopping at epoch 500. Best Recall: 0.0045
2026-05-19 04:52:11,601 - optuna.study.study - INFO - Trial 39 finished with value: 0.004488608713754417 and parameters: {'n_layers': 1, 'embedding_dim': 64, 'lr': 3.8388060960822035e-05, 'lambda_val': 0.012577249122835, 'batch_size': 1206, 'optimizer': 'RMSprop'}. Best is trial 24 with value: 0.0668806861475537.
2026-05-19 04:52:19,087 - experiment_functions - INFO - Early stopping at epoch 500. Best Recall: 0.0061
2026-05-19 04:52:19,185 - optuna.study.study - INFO - Trial 40 finished with value: 0.006090918120602084 and parameters: {'n_layers': 1, 'embedding_dim': 32, 'lr': 0.00042737939235262064, 'lambda_val': 0.029578196334516572, 'batch_size': 528, 'optimizer': 'SGD'}. Best is trial 24 with value: 0.0668806861475537.
2026-05-19 04:52:39,737 - experiment_functions - INFO - Early stopping at epoch 1250. Best Recall: 0.0641
2026-05-19 04:52:39,825 - optuna.study.study - INFO - Trial 41 finished with value: 0.06411523883628992 and parameters: {'n_layers': 1, 'embedding_dim': 32, 'lr': 0.0007860650720818099, 'lambda_val': 0.0024788555980306804, 'batch_size': 1390, 'optimizer': 'RMSprop'}. Best is trial 24 with value: 0.0668806861475537.
2026-05-19 04:53:07,209 - experiment_functions - INFO - Early stopping at epoch 1200. Best Recall: 0.0649
2026-05-19 04:53:07,973 - optuna.study.study - INFO - Trial 42 finished with value: 0.06491020639932167 and parameters: {'n_layers': 1, 'embedding_dim': 32, 'lr': 0.000736610956267246, 'lambda_val': 0.006045403462586678, 'batch_size': 1495, 'optimizer': 'RMSprop'}. Best is trial 24 with value: 0.0668806861475537.
2026-05-19 04:53:18,116 - experiment_functions - INFO - Early stopping at epoch 550. Best Recall: 0.0489
2026-05-19 04:53:18,226 - optuna.study.study - INFO - Trial 43 finished with value: 0.04885562190711276 and parameters: {'n_layers': 1, 'embedding_dim': 128, 'lr': 0.0018729255060357577, 'lambda_val': 0.005613164255484987, 'batch_size': 1491, 'optimizer': 'RMSprop'}. Best is trial 24 with value: 0.0668806861475537.
2026-05-19 04:53:26,769 - experiment_functions - INFO - Early stopping at epoch 500. Best Recall: 0.0052
2026-05-19 04:53:26,868 - optuna.study.study - INFO - Trial 44 finished with value: 0.005163223125318399 and parameters: {'n_layers': 1, 'embedding_dim': 32, 'lr': 0.00024653037490199374, 'lambda_val': 0.008417759661655986, 'batch_size': 951, 'optimizer': 'RMSprop'}. Best is trial 24 with value: 0.0668806861475537.
2026-05-19 04:53:34,560 - experiment_functions - INFO - Early stopping at epoch 500. Best Recall: 0.0086
2026-05-19 04:53:34,657 - optuna.study.study - INFO - Trial 45 finished with value: 0.00858897364810526 and parameters: {'n_layers': 3, 'embedding_dim': 32, 'lr': 0.08561824487845117, 'lambda_val': 0.04404502705965653, 'batch_size': 2084, 'optimizer': 'RMSprop'}. Best is trial 24 with value: 0.0668806861475537.
2026-05-19 04:53:46,081 - experiment_functions - INFO - Early stopping at epoch 650. Best Recall: 0.0066
2026-05-19 04:53:46,190 - optuna.study.study - INFO - Trial 46 finished with value: 0.0066289128666592095 and parameters: {'n_layers': 4, 'embedding_dim': 96, 'lr': 0.003660644066416983, 'lambda_val': 0.02038831564675218, 'batch_size': 1179, 'optimizer': 'RMSprop'}. Best is trial 24 with value: 0.0668806861475537.
2026-05-19 04:53:53,519 - experiment_functions - INFO - Early stopping at epoch 500. Best Recall: 0.0046
2026-05-19 04:53:53,608 - optuna.study.study - INFO - Trial 47 finished with value: 0.004596902812471189 and parameters: {'n_layers': 1, 'embedding_dim': 32, 'lr': 0.0007818002154735341, 'lambda_val': 0.004339570624848494, 'batch_size': 3207, 'optimizer': 'SGD'}. Best is trial 24 with value: 0.0668806861475537.
2026-05-19 04:54:04,092 - experiment_functions - INFO - Early stopping at epoch 700. Best Recall: 0.0573
2026-05-19 04:54:04,182 - optuna.study.study - INFO - Trial 48 finished with value: 0.05727408052466903 and parameters: {'n_layers': 1, 'embedding_dim': 64, 'lr': 0.0015688467634418011, 'lambda_val': 0.0003824583512495215, 'batch_size': 711, 'optimizer': 'RMSprop'}. Best is trial 24 with value: 0.0668806861475537.
2026-05-19 04:54:18,425 - optuna.study._optimize - INFO - Trial 49 pruned. 
2026-05-19 04:54:32,969 - optuna.study._optimize - INFO - Trial 50 pruned. 
2026-05-19 04:54:48,280 - experiment_functions - INFO - Early stopping at epoch 1050. Best Recall: 0.0676
2026-05-19 04:54:48,413 - optuna.study.study - INFO - Trial 51 finished with value: 0.0676145010634335 and parameters: {'n_layers': 1, 'embedding_dim': 32, 'lr': 0.0008755813137510107, 'lambda_val': 0.0030126346969215124, 'batch_size': 1449, 'optimizer': 'RMSprop'}. Best is trial 51 with value: 0.0676145010634335.
2026-05-19 04:55:03,933 - experiment_functions - INFO - Early stopping at epoch 950. Best Recall: 0.0572
2026-05-19 04:55:04,031 - optuna.study.study - INFO - Trial 52 finished with value: 0.057241433407083965 and parameters: {'n_layers': 1, 'embedding_dim': 32, 'lr': 0.0010856006673773178, 'lambda_val': 8.60862031794308e-05, 'batch_size': 1385, 'optimizer': 'RMSprop'}. Best is trial 51 with value: 0.0676145010634335.
2026-05-19 04:55:12,579 - experiment_functions - INFO - Early stopping at epoch 550. Best Recall: 0.0551
2026-05-19 04:55:12,685 - optuna.study.study - INFO - Trial 53 finished with value: 0.05513691168310913 and parameters: {'n_layers': 1, 'embedding_dim': 32, 'lr': 0.0029127455447902403, 'lambda_val': 0.0011956721160241387, 'batch_size': 1250, 'optimizer': 'RMSprop'}. Best is trial 51 with value: 0.0676145010634335.
2026-05-19 04:55:20,100 - experiment_functions - INFO - Early stopping at epoch 500. Best Recall: 0.0049
2026-05-19 04:55:20,191 - optuna.study.study - INFO - Trial 54 finished with value: 0.004929662637656544 and parameters: {'n_layers': 1, 'embedding_dim': 32, 'lr': 0.00028716592276868306, 'lambda_val': 0.0141992036029768, 'batch_size': 1765, 'optimizer': 'RMSprop'}. Best is trial 51 with value: 0.0676145010634335.
2026-05-19 04:55:34,431 - optuna.study._optimize - INFO - Trial 55 pruned. 
2026-05-19 04:55:44,159 - experiment_functions - INFO - Early stopping at epoch 500. Best Recall: 0.0048
2026-05-19 04:55:44,247 - optuna.study.study - INFO - Trial 56 finished with value: 0.004752370847549254 and parameters: {'n_layers': 1, 'embedding_dim': 32, 'lr': 0.0007332531815011664, 'lambda_val': 0.003419263139729442, 'batch_size': 1440, 'optimizer': 'SGD'}. Best is trial 51 with value: 0.0676145010634335.
2026-05-19 04:55:53,264 - experiment_functions - INFO - Early stopping at epoch 600. Best Recall: 0.0594
2026-05-19 04:55:53,362 - optuna.study.study - INFO - Trial 57 finished with value: 0.0593758557248637 and parameters: {'n_layers': 1, 'embedding_dim': 32, 'lr': 0.0018360154701404497, 'lambda_val': 0.00836811134916496, 'batch_size': 1127, 'optimizer': 'RMSprop'}. Best is trial 51 with value: 0.0676145010634335.
2026-05-19 04:56:09,846 - optuna.study._optimize - INFO - Trial 58 pruned. 
2026-05-19 04:56:18,438 - experiment_functions - INFO - Early stopping at epoch 550. Best Recall: 0.0350
2026-05-19 04:56:18,525 - optuna.study.study - INFO - Trial 59 finished with value: 0.03498816601676667 and parameters: {'n_layers': 2, 'embedding_dim': 96, 'lr': 0.001389790725869229, 'lambda_val': 0.002421517765820878, 'batch_size': 2232, 'optimizer': 'RMSprop'}. Best is trial 51 with value: 0.0676145010634335.
2026-05-19 04:56:43,018 - optuna.study._optimize - INFO - Trial 60 pruned. 
2026-05-19 04:56:57,668 - experiment_functions - INFO - Early stopping at epoch 950. Best Recall: 0.0634
2026-05-19 04:56:57,756 - optuna.study.study - INFO - Trial 61 finished with value: 0.06342406274011379 and parameters: {'n_layers': 1, 'embedding_dim': 32, 'lr': 0.0009144164122902881, 'lambda_val': 0.0028277279488033084, 'batch_size': 1555, 'optimizer': 'RMSprop'}. Best is trial 51 with value: 0.0676145010634335.
2026-05-19 04:57:23,551 - experiment_functions - INFO - Early stopping at epoch 1850. Best Recall: 0.0686
2026-05-19 04:57:23,650 - optuna.study.study - INFO - Trial 62 finished with value: 0.06856487161502701 and parameters: {'n_layers': 1, 'embedding_dim': 32, 'lr': 0.0006306049100462083, 'lambda_val': 0.00018712909964172178, 'batch_size': 1344, 'optimizer': 'RMSprop'}. Best is trial 62 with value: 0.06856487161502701.
2026-05-19 04:57:58,247 - experiment_functions - INFO - Early stopping at epoch 2350. Best Recall: 0.0642
2026-05-19 04:57:58,415 - optuna.study.study - INFO - Trial 63 finished with value: 0.06424868281921578 and parameters: {'n_layers': 1, 'embedding_dim': 32, 'lr': 0.0006313239674997446, 'lambda_val': 0.00019512846120117621, 'batch_size': 1295, 'optimizer': 'RMSprop'}. Best is trial 62 with value: 0.06856487161502701.
2026-05-19 04:58:19,626 - experiment_functions - INFO - Early stopping at epoch 1250. Best Recall: 0.0688
2026-05-19 04:58:19,728 - optuna.study.study - INFO - Trial 64 finished with value: 0.0688305382200038 and parameters: {'n_layers': 1, 'embedding_dim': 32, 'lr': 0.0009259674631411372, 'lambda_val': 6.0925781819656395e-05, 'batch_size': 918, 'optimizer': 'RMSprop'}. Best is trial 64 with value: 0.0688305382200038.
2026-05-19 04:58:31,355 - experiment_functions - INFO - Early stopping at epoch 650. Best Recall: 0.0566
2026-05-19 04:58:31,453 - optuna.study.study - INFO - Trial 65 finished with value: 0.056620035758111295 and parameters: {'n_layers': 1, 'embedding_dim': 32, 'lr': 0.002328836526397603, 'lambda_val': 0.00010716254437620963, 'batch_size': 698, 'optimizer': 'RMSprop'}. Best is trial 64 with value: 0.0688305382200038.
2026-05-19 04:58:52,193 - experiment_functions - INFO - Early stopping at epoch 1250. Best Recall: 0.0647
2026-05-19 04:58:52,291 - optuna.study.study - INFO - Trial 66 finished with value: 0.0647259111846376 and parameters: {'n_layers': 1, 'embedding_dim': 32, 'lr': 0.0009969862806842886, 'lambda_val': 0.00016359638231935893, 'batch_size': 959, 'optimizer': 'RMSprop'}. Best is trial 64 with value: 0.0688305382200038.
2026-05-19 04:59:19,966 - experiment_functions - INFO - Early stopping at epoch 1850. Best Recall: 0.0651
2026-05-19 04:59:20,589 - optuna.study.study - INFO - Trial 67 finished with value: 0.06505941804191075 and parameters: {'n_layers': 2, 'embedding_dim': 32, 'lr': 0.00045071054636365153, 'lambda_val': 0.00021903237010203227, 'batch_size': 1072, 'optimizer': 'RMSprop'}. Best is trial 64 with value: 0.0688305382200038.
2026-05-19 04:59:36,923 - optuna.study._optimize - INFO - Trial 68 pruned. 
2026-05-19 04:59:51,474 - optuna.study._optimize - INFO - Trial 69 pruned. 
2026-05-19 05:00:00,643 - experiment_functions - INFO - Early stopping at epoch 500. Best Recall: 0.0056
2026-05-19 05:00:00,710 - optuna.study.study - INFO - Trial 70 finished with value: 0.005623129098764686 and parameters: {'n_layers': 3, 'embedding_dim': 128, 'lr': 0.0013646054136748932, 'lambda_val': 0.0002306279262402628, 'batch_size': 877, 'optimizer': 'SGD'}. Best is trial 64 with value: 0.0688305382200038.
2026-05-19 05:00:16,306 - experiment_functions - INFO - Early stopping at epoch 1100. Best Recall: 0.0627
2026-05-19 05:00:16,386 - optuna.study.study - INFO - Trial 71 finished with value: 0.06273674112102341 and parameters: {'n_layers': 1, 'embedding_dim': 32, 'lr': 0.0009613213280358278, 'lambda_val': 3.056128957047002e-05, 'batch_size': 1302, 'optimizer': 'RMSprop'}. Best is trial 64 with value: 0.0688305382200038.
2026-05-19 05:00:30,050 - optuna.study._optimize - INFO - Trial 72 pruned. 
2026-05-19 05:00:45,026 - optuna.study._optimize - INFO - Trial 73 pruned. 
2026-05-19 05:00:59,277 - optuna.study._optimize - INFO - Trial 74 pruned. 
2026-05-19 05:01:12,592 - optuna.study._optimize - INFO - Trial 75 pruned. 
2026-05-19 05:01:27,964 - optuna.study._optimize - INFO - Trial 76 pruned. 
2026-05-19 05:01:36,193 - experiment_functions - INFO - Early stopping at epoch 550. Best Recall: 0.0276
2026-05-19 05:01:36,315 - optuna.study.study - INFO - Trial 77 finished with value: 0.02759688879159159 and parameters: {'n_layers': 2, 'embedding_dim': 32, 'lr': 0.003273552051182924, 'lambda_val': 4.695662793900083e-05, 'batch_size': 904, 'optimizer': 'RMSprop'}. Best is trial 64 with value: 0.0688305382200038.
2026-05-19 05:01:51,007 - experiment_functions - INFO - Early stopping at epoch 850. Best Recall: 0.0584
2026-05-19 05:01:51,110 - optuna.study.study - INFO - Trial 78 finished with value: 0.05839820189837179 and parameters: {'n_layers': 1, 'embedding_dim': 32, 'lr': 0.0012633659847657755, 'lambda_val': 0.0013687556880294157, 'batch_size': 1066, 'optimizer': 'RMSprop'}. Best is trial 64 with value: 0.0688305382200038.
2026-05-19 05:02:09,805 - experiment_functions - INFO - Early stopping at epoch 1050. Best Recall: 0.0640
2026-05-19 05:02:09,915 - optuna.study.study - INFO - Trial 79 finished with value: 0.06403804660755386 and parameters: {'n_layers': 1, 'embedding_dim': 96, 'lr': 0.0008906925860037311, 'lambda_val': 8.295585965122356e-05, 'batch_size': 1484, 'optimizer': 'Adam'}. Best is trial 64 with value: 0.0688305382200038.
2026-05-19 05:02:26,295 - optuna.study._optimize - INFO - Trial 80 pruned. 
2026-05-19 05:02:49,287 - experiment_functions - INFO - Early stopping at epoch 1150. Best Recall: 0.0664
2026-05-19 05:02:50,052 - optuna.study.study - INFO - Trial 81 finished with value: 0.06644162252947068 and parameters: {'n_layers': 1, 'embedding_dim': 32, 'lr': 0.0010230899139581572, 'lambda_val': 0.00017933858930363597, 'batch_size': 966, 'optimizer': 'RMSprop'}. Best is trial 64 with value: 0.0688305382200038.
2026-05-19 05:03:09,037 - optuna.study._optimize - INFO - Trial 82 pruned. 
2026-05-19 05:03:21,678 - experiment_functions - INFO - Early stopping at epoch 700. Best Recall: 0.0647
