2026-05-18 07:28:59,640 - optuna.study.study - INFO - Trial 137 finished with value: 0.060488760791696496 and parameters: {'n_layers': 1, 'embedding_dim': 64, 'lr': 0.0015214802898616186, 'lambda_val': 5.4161526854738044e-05, 'batch_size': 1077, 'optimizer': 'RMSprop'}. Best is trial 106 with value: 0.06911264322413338.
2026-05-18 07:29:23,361 - experiment_functions - INFO - Early stopping at epoch 1650. Best Recall: 0.0686
2026-05-18 07:29:23,505 - optuna.study.study - INFO - Trial 138 finished with value: 0.06858048979401776 and parameters: {'n_layers': 1, 'embedding_dim': 64, 'lr': 0.0007110127189399309, 'lambda_val': 0.00012160378142882063, 'batch_size': 793, 'optimizer': 'RMSprop'}. Best is trial 106 with value: 0.06911264322413338.
2026-05-18 07:29:30,974 - experiment_functions - INFO - Early stopping at epoch 500. Best Recall: 0.0053
2026-05-18 07:29:31,064 - optuna.study.study - INFO - Trial 139 finished with value: 0.0053410072535603125 and parameters: {'n_layers': 1, 'embedding_dim': 64, 'lr': 0.00035807881717557315, 'lambda_val': 0.000122706768650837, 'batch_size': 712, 'optimizer': 'SGD'}. Best is trial 106 with value: 0.06911264322413338.
2026-05-18 07:29:46,531 - experiment_functions - INFO - Early stopping at epoch 1050. Best Recall: 0.0624
2026-05-18 07:29:46,618 - optuna.study.study - INFO - Trial 140 finished with value: 0.062390384279432894 and parameters: {'n_layers': 1, 'embedding_dim': 64, 'lr': 0.0011337357245709604, 'lambda_val': 2.402948926995645e-05, 'batch_size': 570, 'optimizer': 'RMSprop'}. Best is trial 106 with value: 0.06911264322413338.
2026-05-18 07:30:10,703 - experiment_functions - INFO - Early stopping at epoch 1700. Best Recall: 0.0667
2026-05-18 07:30:10,812 - optuna.study.study - INFO - Trial 141 finished with value: 0.06671520819758157 and parameters: {'n_layers': 1, 'embedding_dim': 64, 'lr': 0.0007395105641744795, 'lambda_val': 4.376389294013732e-05, 'batch_size': 900, 'optimizer': 'RMSprop'}. Best is trial 106 with value: 0.06911264322413338.
2026-05-18 07:30:31,692 - experiment_functions - INFO - Early stopping at epoch 1400. Best Recall: 0.0670
2026-05-18 07:30:31,808 - optuna.study.study - INFO - Trial 142 finished with value: 0.06700080731071853 and parameters: {'n_layers': 1, 'embedding_dim': 64, 'lr': 0.0007516588081659172, 'lambda_val': 4.1520229230477464e-05, 'batch_size': 795, 'optimizer': 'RMSprop'}. Best is trial 106 with value: 0.06911264322413338.
2026-05-18 07:30:56,184 - optuna.study._optimize - INFO - Trial 143 pruned. 
2026-05-18 07:31:10,332 - optuna.study._optimize - INFO - Trial 144 pruned. 
2026-05-18 07:31:30,317 - experiment_functions - INFO - Early stopping at epoch 1350. Best Recall: 0.0675
2026-05-18 07:31:30,461 - optuna.study.study - INFO - Trial 145 finished with value: 0.06754000845297092 and parameters: {'n_layers': 1, 'embedding_dim': 64, 'lr': 0.0007629656704368252, 'lambda_val': 6.810585280467742e-05, 'batch_size': 899, 'optimizer': 'RMSprop'}. Best is trial 106 with value: 0.06911264322413338.
2026-05-18 07:31:51,527 - experiment_functions - INFO - Early stopping at epoch 1450. Best Recall: 0.0655
2026-05-18 07:31:51,615 - optuna.study.study - INFO - Trial 146 finished with value: 0.06546077984289563 and parameters: {'n_layers': 1, 'embedding_dim': 32, 'lr': 0.0008920496234508529, 'lambda_val': 0.00010449284567843895, 'batch_size': 897, 'optimizer': 'RMSprop'}. Best is trial 106 with value: 0.06911264322413338.
2026-05-18 07:32:13,378 - experiment_functions - INFO - Early stopping at epoch 1500. Best Recall: 0.0670
2026-05-18 07:32:13,477 - optuna.study.study - INFO - Trial 147 finished with value: 0.06698526027469251 and parameters: {'n_layers': 1, 'embedding_dim': 64, 'lr': 0.0008248553294158159, 'lambda_val': 5.919453199029412e-05, 'batch_size': 676, 'optimizer': 'RMSprop'}. Best is trial 106 with value: 0.06911264322413338.
2026-05-18 07:32:23,701 - experiment_functions - INFO - Early stopping at epoch 700. Best Recall: 0.0078
2026-05-18 07:32:23,800 - optuna.study.study - INFO - Trial 148 finished with value: 0.0078066056615103295 and parameters: {'n_layers': 1, 'embedding_dim': 128, 'lr': 0.08901667074796202, 'lambda_val': 5.517776309967052e-05, 'batch_size': 672, 'optimizer': 'RMSprop'}. Best is trial 106 with value: 0.06911264322413338.
2026-05-18 07:32:44,998 - experiment_functions - INFO - Early stopping at epoch 1500. Best Recall: 0.0671
2026-05-18 07:32:45,229 - optuna.study.study - INFO - Trial 149 finished with value: 0.06710367206986195 and parameters: {'n_layers': 1, 'embedding_dim': 64, 'lr': 0.0008357780161794819, 'lambda_val': 0.0001409245575822017, 'batch_size': 753, 'optimizer': 'Adam'}. Best is trial 106 with value: 0.06911264322413338.
2026-05-18 07:32:59,644 - optuna.study._optimize - INFO - Trial 150 pruned. 
2026-05-18 07:33:17,095 - optuna.study._optimize - INFO - Trial 151 pruned. 
2026-05-18 07:33:29,579 - experiment_functions - INFO - Early stopping at epoch 800. Best Recall: 0.0616
2026-05-18 07:33:29,677 - optuna.study.study - INFO - Trial 152 finished with value: 0.061615555311994995 and parameters: {'n_layers': 1, 'embedding_dim': 64, 'lr': 0.0011869419721049644, 'lambda_val': 0.00024279923004061354, 'batch_size': 923, 'optimizer': 'RMSprop'}. Best is trial 106 with value: 0.06911264322413338.
2026-05-18 07:33:53,497 - experiment_functions - INFO - Early stopping at epoch 1700. Best Recall: 0.0668
2026-05-18 07:33:53,650 - optuna.study.study - INFO - Trial 153 finished with value: 0.06683768857996245 and parameters: {'n_layers': 1, 'embedding_dim': 64, 'lr': 0.0008152658533236934, 'lambda_val': 6.417637655911418e-05, 'batch_size': 773, 'optimizer': 'Adam'}. Best is trial 106 with value: 0.06911264322413338.
2026-05-18 07:34:07,334 - optuna.study._optimize - INFO - Trial 154 pruned. 
2026-05-18 07:34:24,301 - optuna.study._optimize - INFO - Trial 155 pruned. 
2026-05-18 07:34:32,353 - experiment_functions - INFO - Early stopping at epoch 550. Best Recall: 0.0158
2026-05-18 07:34:32,454 - optuna.study.study - INFO - Trial 156 finished with value: 0.015780922728304895 and parameters: {'n_layers': 1, 'embedding_dim': 64, 'lr': 0.03610868760358296, 'lambda_val': 0.00017392258632552027, 'batch_size': 517, 'optimizer': 'Adam'}. Best is trial 106 with value: 0.06911264322413338.
2026-05-18 07:34:46,339 - optuna.study._optimize - INFO - Trial 157 pruned. 
2026-05-18 07:34:59,068 - experiment_functions - INFO - Early stopping at epoch 800. Best Recall: 0.0424
2026-05-18 07:34:59,228 - optuna.study.study - INFO - Trial 158 finished with value: 0.04240577417698274 and parameters: {'n_layers': 3, 'embedding_dim': 64, 'lr': 0.0008636984368675135, 'lambda_val': 5.4768157611302436e-05, 'batch_size': 983, 'optimizer': 'Adam'}. Best is trial 106 with value: 0.06911264322413338.
2026-05-18 07:35:13,975 - optuna.study._optimize - INFO - Trial 159 pruned. 
2026-05-18 07:35:27,648 - optuna.study._optimize - INFO - Trial 160 pruned. 
2026-05-18 07:35:43,164 - experiment_functions - INFO - Early stopping at epoch 1000. Best Recall: 0.0612
2026-05-18 07:35:43,279 - optuna.study.study - INFO - Trial 161 finished with value: 0.061188768262092616 and parameters: {'n_layers': 1, 'embedding_dim': 64, 'lr': 0.0010534639085857942, 'lambda_val': 3.573944819711959e-05, 'batch_size': 873, 'optimizer': 'RMSprop'}. Best is trial 106 with value: 0.06911264322413338.
2026-05-18 07:36:05,455 - experiment_functions - INFO - Early stopping at epoch 900. Best Recall: 0.0614
2026-05-18 07:36:05,570 - optuna.study.study - INFO - Trial 162 finished with value: 0.061352457239260666 and parameters: {'n_layers': 1, 'embedding_dim': 64, 'lr': 0.0008050622644490999, 'lambda_val': 0.015588974753555187, 'batch_size': 922, 'optimizer': 'RMSprop'}. Best is trial 106 with value: 0.06911264322413338.
2026-05-18 07:36:21,551 - optuna.study._optimize - INFO - Trial 163 pruned. 
2026-05-18 07:36:37,788 - optuna.study._optimize - INFO - Trial 164 pruned. 
2026-05-18 07:36:51,895 - experiment_functions - INFO - Early stopping at epoch 950. Best Recall: 0.0623
2026-05-18 07:36:51,988 - optuna.study.study - INFO - Trial 165 finished with value: 0.062283038534501796 and parameters: {'n_layers': 1, 'embedding_dim': 64, 'lr': 0.0009962483056210245, 'lambda_val': 7.759760695388297e-05, 'batch_size': 981, 'optimizer': 'RMSprop'}. Best is trial 106 with value: 0.06911264322413338.
2026-05-18 07:37:14,134 - optuna.study._optimize - INFO - Trial 166 pruned. 
2026-05-18 07:37:29,429 - optuna.study._optimize - INFO - Trial 167 pruned. 
2026-05-18 07:37:47,071 - optuna.study._optimize - INFO - Trial 168 pruned. 
2026-05-18 07:38:03,378 - experiment_functions - INFO - Early stopping at epoch 1100. Best Recall: 0.0664
2026-05-18 07:38:03,530 - optuna.study.study - INFO - Trial 169 finished with value: 0.06643781798318317 and parameters: {'n_layers': 1, 'embedding_dim': 64, 'lr': 0.0009311673863858119, 'lambda_val': 3.356286362334508e-05, 'batch_size': 812, 'optimizer': 'RMSprop'}. Best is trial 106 with value: 0.06911264322413338.
2026-05-18 07:38:11,126 - experiment_functions - INFO - Early stopping at epoch 500. Best Recall: 0.0047
2026-05-18 07:38:11,276 - optuna.study.study - INFO - Trial 170 finished with value: 0.0047228581391940885 and parameters: {'n_layers': 1, 'embedding_dim': 64, 'lr': 0.0011652746209830061, 'lambda_val': 3.016039911015915e-05, 'batch_size': 783, 'optimizer': 'SGD'}. Best is trial 106 with value: 0.06911264322413338.
2026-05-18 07:38:26,189 - experiment_functions - INFO - Early stopping at epoch 1000. Best Recall: 0.0639
2026-05-18 07:38:26,350 - optuna.study.study - INFO - Trial 171 finished with value: 0.06390081829330972 and parameters: {'n_layers': 1, 'embedding_dim': 64, 'lr': 0.0009524842485370452, 'lambda_val': 2.0336152770263948e-05, 'batch_size': 892, 'optimizer': 'RMSprop'}. Best is trial 106 with value: 0.06911264322413338.
2026-05-18 07:38:49,200 - experiment_functions - INFO - Early stopping at epoch 1550. Best Recall: 0.0681
2026-05-18 07:38:49,292 - optuna.study.study - INFO - Trial 172 finished with value: 0.06812036161921332 and parameters: {'n_layers': 1, 'embedding_dim': 64, 'lr': 0.0007380854523996373, 'lambda_val': 3.618613371281343e-05, 'batch_size': 822, 'optimizer': 'RMSprop'}. Best is trial 106 with value: 0.06911264322413338.
2026-05-18 07:39:25,984 - experiment_functions - INFO - Early stopping at epoch 2200. Best Recall: 0.0678
2026-05-18 07:39:26,121 - optuna.study.study - INFO - Trial 173 finished with value: 0.06782944006389503 and parameters: {'n_layers': 1, 'embedding_dim': 64, 'lr': 0.0007155293728511257, 'lambda_val': 3.5241087311708546e-05, 'batch_size': 682, 'optimizer': 'RMSprop'}. Best is trial 106 with value: 0.06911264322413338.
2026-05-18 07:39:51,759 - experiment_functions - INFO - Early stopping at epoch 1800. Best Recall: 0.0680
2026-05-18 07:39:52,552 - optuna.study.study - INFO - Trial 174 finished with value: 0.06798563699978559 and parameters: {'n_layers': 1, 'embedding_dim': 64, 'lr': 0.0007417545329013777, 'lambda_val': 5.286307694241061e-05, 'batch_size': 600, 'optimizer': 'RMSprop'}. Best is trial 106 with value: 0.06911264322413338.
2026-05-18 07:40:15,779 - optuna.study._optimize - INFO - Trial 175 pruned. 
2026-05-18 07:40:42,786 - optuna.study._optimize - INFO - Trial 176 pruned. 
2026-05-18 07:40:58,039 - optuna.study._optimize - INFO - Trial 177 pruned. 
2026-05-18 07:41:04,852 - experiment_functions - INFO - Early stopping at epoch 500. Best Recall: 0.0046
2026-05-18 07:41:04,945 - optuna.study.study - INFO - Trial 178 finished with value: 0.004596703232366262 and parameters: {'n_layers': 1, 'embedding_dim': 64, 'lr': 0.00037006933808389443, 'lambda_val': 0.07604925937283395, 'batch_size': 675, 'optimizer': 'RMSprop'}. Best is trial 106 with value: 0.06911264322413338.
2026-05-18 07:41:18,741 - optuna.study._optimize - INFO - Trial 179 pruned. 
2026-05-18 07:41:43,070 - optuna.study._optimize - INFO - Trial 180 pruned. 
2026-05-18 07:42:00,331 - optuna.study._optimize - INFO - Trial 181 pruned. 
2026-05-18 07:42:29,766 - experiment_functions - INFO - Early stopping at epoch 2150. Best Recall: 0.0702
2026-05-18 07:42:29,857 - optuna.study.study - INFO - Trial 182 finished with value: 0.07019081918850711 and parameters: {'n_layers': 1, 'embedding_dim': 64, 'lr': 0.0006493117522034338, 'lambda_val': 5.0830342873731055e-05, 'batch_size': 810, 'optimizer': 'RMSprop'}. Best is trial 182 with value: 0.07019081918850711.
2026-05-18 07:42:53,060 - optuna.study._optimize - INFO - Trial 183 pruned. 
2026-05-18 07:43:06,043 - experiment_functions - INFO - Early stopping at epoch 900. Best Recall: 0.0655
2026-05-18 07:43:06,166 - optuna.study.study - INFO - Trial 184 finished with value: 0.0654685487314963 and parameters: {'n_layers': 1, 'embedding_dim': 64, 'lr': 0.0011366866682600435, 'lambda_val': 5.006403703806136e-05, 'batch_size': 722, 'optimizer': 'RMSprop'}. Best is trial 182 with value: 0.07019081918850711.
2026-05-18 07:43:21,361 - optuna.study._optimize - INFO - Trial 185 pruned. 
2026-05-18 07:43:36,173 - optuna.study._optimize - INFO - Trial 186 pruned. 
2026-05-18 07:43:50,669 - optuna.study._optimize - INFO - Trial 187 pruned. 
2026-05-18 07:44:03,943 - optuna.study._optimize - INFO - Trial 188 pruned. 
2026-05-18 07:44:14,187 - experiment_functions - INFO - Early stopping at epoch 700. Best Recall: 0.0614
2026-05-18 07:44:14,291 - optuna.study.study - INFO - Trial 189 finished with value: 0.06143379595962748 and parameters: {'n_layers': 1, 'embedding_dim': 64, 'lr': 0.0015082780921094774, 'lambda_val': 0.0005905278167228882, 'batch_size': 900, 'optimizer': 'RMSprop'}. Best is trial 182 with value: 0.07019081918850711.
2026-05-18 07:44:29,385 - optuna.study._optimize - INFO - Trial 190 pruned. 
2026-05-18 07:44:44,447 - optuna.study._optimize - INFO - Trial 191 pruned. 
2026-05-18 07:45:00,961 - optuna.study._optimize - INFO - Trial 192 pruned. 
2026-05-18 07:45:14,634 - optuna.study._optimize - INFO - Trial 193 pruned. 
2026-05-18 07:45:28,550 - optuna.study._optimize - INFO - Trial 194 pruned. 
2026-05-18 07:45:56,386 - experiment_functions - INFO - Early stopping at epoch 2050. Best Recall: 0.0705
2026-05-18 07:45:56,506 - optuna.study.study - INFO - Trial 195 finished with value: 0.07051482318087861 and parameters: {'n_layers': 1, 'embedding_dim': 64, 'lr': 0.0007149125396667459, 'lambda_val': 3.979832465828645e-05, 'batch_size': 729, 'optimizer': 'RMSprop'}. Best is trial 195 with value: 0.07051482318087861.
2026-05-18 07:46:19,051 - experiment_functions - INFO - Early stopping at epoch 1600. Best Recall: 0.0711
2026-05-18 07:46:19,160 - optuna.study.study - INFO - Trial 196 finished with value: 0.07108908999977814 and parameters: {'n_layers': 1, 'embedding_dim': 96, 'lr': 0.0007498144976205494, 'lambda_val': 4.053429018707842e-05, 'batch_size': 726, 'optimizer': 'RMSprop'}. Best is trial 196 with value: 0.07108908999977814.
2026-05-18 07:46:33,415 - experiment_functions - INFO - Early stopping at epoch 1000. Best Recall: 0.0627
2026-05-18 07:46:33,518 - optuna.study.study - INFO - Trial 197 finished with value: 0.06273048155663903 and parameters: {'n_layers': 1, 'embedding_dim': 96, 'lr': 0.0010575556746539275, 'lambda_val': 3.9517905363558654e-05, 'batch_size': 705, 'optimizer': 'RMSprop'}. Best is trial 196 with value: 0.07108908999977814.
2026-05-18 07:46:51,381 - experiment_functions - INFO - Early stopping at epoch 1250. Best Recall: 0.0666
2026-05-18 07:46:51,485 - optuna.study.study - INFO - Trial 198 finished with value: 0.06659971452542376 and parameters: {'n_layers': 1, 'embedding_dim': 96, 'lr': 0.0009169736909201358, 'lambda_val': 2.2192158681483074e-05, 'batch_size': 636, 'optimizer': 'RMSprop'}. Best is trial 196 with value: 0.07108908999977814.
2026-05-18 07:47:06,803 - optuna.study._optimize - INFO - Trial 199 pruned. 
2026-05-18 07:47:17,170 - experiment_functions - INFO - Early stopping at epoch 650. Best Recall: 0.0492
2026-05-18 07:47:17,291 - optuna.study.study - INFO - Trial 200 finished with value: 0.04915691650990177 and parameters: {'n_layers': 1, 'embedding_dim': 256, 'lr': 0.001305724505951003, 'lambda_val': 0.00013795982052465825, 'batch_size': 832, 'optimizer': 'RMSprop'}. Best is trial 196 with value: 0.07108908999977814.
2026-05-18 07:47:33,212 - experiment_functions - INFO - Early stopping at epoch 1100. Best Recall: 0.0654
2026-05-18 07:47:33,313 - optuna.study.study - INFO - Trial 201 finished with value: 0.06544704982210145 and parameters: {'n_layers': 1, 'embedding_dim': 96, 'lr': 0.0008672443333006706, 'lambda_val': 2.1504299396540206e-05, 'batch_size': 635, 'optimizer': 'RMSprop'}. Best is trial 196 with value: 0.07108908999977814.
2026-05-18 07:47:47,614 - optuna.study._optimize - INFO - Trial 202 pruned. 
2026-05-18 07:48:07,138 - experiment_functions - INFO - Early stopping at epoch 1400. Best Recall: 0.0671
2026-05-18 07:48:07,239 - optuna.study.study - INFO - Trial 203 finished with value: 0.06706190730083313 and parameters: {'n_layers': 1, 'embedding_dim': 96, 'lr': 0.0007804205354428913, 'lambda_val': 3.3904047566887426e-05, 'batch_size': 650, 'optimizer': 'RMSprop'}. Best is trial 196 with value: 0.07108908999977814.
2026-05-18 07:48:28,120 - experiment_functions - INFO - Early stopping at epoch 1450. Best Recall: 0.0666
2026-05-18 07:48:28,278 - optuna.study.study - INFO - Trial 204 finished with value: 0.06660788987705749 and parameters: {'n_layers': 1, 'embedding_dim': 96, 'lr': 0.0007588926933198265, 'lambda_val': 3.6932264084486577e-05, 'batch_size': 735, 'optimizer': 'RMSprop'}. Best is trial 196 with value: 0.07108908999977814.
2026-05-18 07:48:42,328 - optuna.study._optimize - INFO - Trial 205 pruned. 
2026-05-18 07:48:57,879 - optuna.study._optimize - INFO - Trial 206 pruned. 
2026-05-18 07:49:11,900 - optuna.study._optimize - INFO - Trial 207 pruned. 
2026-05-18 07:49:25,588 - optuna.study._optimize - INFO - Trial 208 pruned. 
2026-05-18 07:49:32,562 - experiment_functions - INFO - Early stopping at epoch 500. Best Recall: 0.0048
2026-05-18 07:49:32,654 - optuna.study.study - INFO - Trial 209 finished with value: 0.004779581890833288 and parameters: {'n_layers': 1, 'embedding_dim': 64, 'lr': 0.000841287054783674, 'lambda_val': 4.026559297204931e-05, 'batch_size': 560, 'optimizer': 'SGD'}. Best is trial 196 with value: 0.07108908999977814.
2026-05-18 07:49:46,099 - experiment_functions - INFO - Early stopping at epoch 950. Best Recall: 0.0598
2026-05-18 07:49:46,202 - optuna.study.study - INFO - Trial 210 finished with value: 0.05984273736980742 and parameters: {'n_layers': 1, 'embedding_dim': 64, 'lr': 0.0011181190421478992, 'lambda_val': 6.658706524604083e-05, 'batch_size': 686, 'optimizer': 'RMSprop'}. Best is trial 196 with value: 0.07108908999977814.
2026-05-18 07:50:16,244 - experiment_functions - INFO - Early stopping at epoch 1500. Best Recall: 0.0671
2026-05-18 07:50:16,348 - optuna.study.study - INFO - Trial 211 finished with value: 0.06705861439995016 and parameters: {'n_layers': 1, 'embedding_dim': 96, 'lr': 0.0007058041279089907, 'lambda_val': 3.622056043674544e-05, 'batch_size': 767, 'optimizer': 'RMSprop'}. Best is trial 196 with value: 0.07108908999977814.
2026-05-18 07:50:41,241 - optuna.study._optimize - INFO - Trial 212 pruned. 
2026-05-18 07:50:55,277 - optuna.study._optimize - INFO - Trial 213 pruned. 
2026-05-18 07:51:09,551 - optuna.study._optimize - INFO - Trial 214 pruned. 
2026-05-18 07:51:20,632 - experiment_functions - INFO - Early stopping at epoch 700. Best Recall: 0.0554
2026-05-18 07:51:20,756 - optuna.study.study - INFO - Trial 215 finished with value: 0.05540701497997749 and parameters: {'n_layers': 1, 'embedding_dim': 96, 'lr': 0.0009174293651937591, 'lambda_val': 4.413836690749987e-05, 'batch_size': 3456, 'optimizer': 'RMSprop'}. Best is trial 196 with value: 0.07108908999977814.
2026-05-18 07:51:36,261 - optuna.study._optimize - INFO - Trial 216 pruned. 
2026-05-18 07:51:48,973 - optuna.study._optimize - INFO - Trial 217 pruned. 
2026-05-18 07:52:01,407 - experiment_functions - INFO - Early stopping at epoch 650. Best Recall: 0.0391
2026-05-18 07:52:01,656 - optuna.study.study - INFO - Trial 218 finished with value: 0.0390657997376285 and parameters: {'n_layers': 3, 'embedding_dim': 64, 'lr': 0.0008413989225906049, 'lambda_val': 3.407713566636004e-05, 'batch_size': 512, 'optimizer': 'RMSprop'}. Best is trial 196 with value: 0.07108908999977814.
2026-05-18 07:52:17,609 - optuna.study._optimize - INFO - Trial 219 pruned. 
2026-05-18 07:52:37,518 - experiment_functions - INFO - Early stopping at epoch 1450. Best Recall: 0.0703
2026-05-18 07:52:37,610 - optuna.study.study - INFO - Trial 220 finished with value: 0.07029315141486023 and parameters: {'n_layers': 1, 'embedding_dim': 32, 'lr': 0.001044709509174293, 'lambda_val': 0.0004395535590555166, 'batch_size': 601, 'optimizer': 'RMSprop'}. Best is trial 196 with value: 0.07108908999977814.
2026-05-18 07:52:55,148 - experiment_functions - INFO - Early stopping at epoch 1250. Best Recall: 0.0684
2026-05-18 07:52:55,251 - optuna.study.study - INFO - Trial 221 finished with value: 0.0683995044853321 and parameters: {'n_layers': 1, 'embedding_dim': 32, 'lr': 0.0010321535576245928, 'lambda_val': 0.00041958657100561655, 'batch_size': 698, 'optimizer': 'RMSprop'}. Best is trial 196 with value: 0.07108908999977814.
2026-05-18 07:53:09,798 - optuna.study._optimize - INFO - Trial 222 pruned. 
2026-05-18 07:53:28,993 - optuna.study._optimize - INFO - Trial 223 pruned. 
2026-05-18 07:53:41,743 - experiment_functions - INFO - Early stopping at epoch 900. Best Recall: 0.0640
2026-05-18 07:53:41,853 - optuna.study.study - INFO - Trial 224 finished with value: 0.06395132082605096 and parameters: {'n_layers': 1, 'embedding_dim': 32, 'lr': 0.0013243293634216816, 'lambda_val': 0.0003751053745570646, 'batch_size': 712, 'optimizer': 'RMSprop'}. Best is trial 196 with value: 0.07108908999977814.
