2026-05-18 19:50:45,773 - optuna.study.study - INFO - Trial 79 finished with value: 0.05325875266269899 and parameters: {'n_layers': 1, 'embedding_dim': 256, 'lr': 0.0021131822425263227, 'lambda_val': 5.429778243392237e-05, 'batch_size': 2566, 'optimizer': 'Adam'}. Best is trial 27 with value: 0.05941431359795208.
2026-05-18 19:50:53,223 - experiment_functions - INFO - Early stopping at epoch 550. Best Recall: 0.0501
2026-05-18 19:50:53,333 - optuna.study.study - INFO - Trial 80 finished with value: 0.05011069569186633 and parameters: {'n_layers': 1, 'embedding_dim': 32, 'lr': 0.0056092335514703355, 'lambda_val': 2.554669945883116e-06, 'batch_size': 1912, 'optimizer': 'Adam'}. Best is trial 27 with value: 0.05941431359795208.
2026-05-18 19:51:01,005 - experiment_functions - INFO - Early stopping at epoch 550. Best Recall: 0.0574
2026-05-18 19:51:01,098 - optuna.study.study - INFO - Trial 81 finished with value: 0.05738042522410087 and parameters: {'n_layers': 1, 'embedding_dim': 256, 'lr': 0.002756272055471822, 'lambda_val': 5.245582909054066e-06, 'batch_size': 1693, 'optimizer': 'Adam'}. Best is trial 27 with value: 0.05941431359795208.
2026-05-18 19:51:09,302 - experiment_functions - INFO - Early stopping at epoch 550. Best Recall: 0.0579
2026-05-18 19:51:09,417 - optuna.study.study - INFO - Trial 82 finished with value: 0.057919153670060744 and parameters: {'n_layers': 1, 'embedding_dim': 256, 'lr': 0.0023394988045480824, 'lambda_val': 4.021250978345501e-06, 'batch_size': 1517, 'optimizer': 'Adam'}. Best is trial 27 with value: 0.05941431359795208.
2026-05-18 19:51:18,727 - experiment_functions - INFO - Early stopping at epoch 600. Best Recall: 0.0586
2026-05-18 19:51:18,830 - optuna.study.study - INFO - Trial 83 finished with value: 0.058637836831112934 and parameters: {'n_layers': 1, 'embedding_dim': 256, 'lr': 0.0015375256414505384, 'lambda_val': 1.3900678845142492e-06, 'batch_size': 515, 'optimizer': 'Adam'}. Best is trial 27 with value: 0.05941431359795208.
2026-05-18 19:51:27,835 - experiment_functions - INFO - Early stopping at epoch 600. Best Recall: 0.0557
2026-05-18 19:51:27,949 - optuna.study.study - INFO - Trial 84 finished with value: 0.05574571724674597 and parameters: {'n_layers': 1, 'embedding_dim': 256, 'lr': 0.0022922956408852673, 'lambda_val': 1.4420925919902987e-06, 'batch_size': 743, 'optimizer': 'Adam'}. Best is trial 27 with value: 0.05941431359795208.
2026-05-18 19:51:36,707 - experiment_functions - INFO - Early stopping at epoch 600. Best Recall: 0.0579
2026-05-18 19:51:36,799 - optuna.study.study - INFO - Trial 85 finished with value: 0.05793755288964428 and parameters: {'n_layers': 1, 'embedding_dim': 256, 'lr': 0.001603329459618583, 'lambda_val': 1.036414782317267e-06, 'batch_size': 1058, 'optimizer': 'Adam'}. Best is trial 27 with value: 0.05941431359795208.
2026-05-18 19:51:45,749 - experiment_functions - INFO - Early stopping at epoch 600. Best Recall: 0.0559
2026-05-18 19:51:45,843 - optuna.study.study - INFO - Trial 86 finished with value: 0.055942651686573634 and parameters: {'n_layers': 1, 'embedding_dim': 256, 'lr': 0.0015244111666998387, 'lambda_val': 1.074469523803564e-06, 'batch_size': 1127, 'optimizer': 'Adam'}. Best is trial 27 with value: 0.05941431359795208.
2026-05-18 19:51:54,482 - experiment_functions - INFO - Early stopping at epoch 600. Best Recall: 0.0567
2026-05-18 19:51:54,586 - optuna.study.study - INFO - Trial 87 finished with value: 0.05674023648726067 and parameters: {'n_layers': 1, 'embedding_dim': 256, 'lr': 0.0012534173031508332, 'lambda_val': 1.6729220387893485e-06, 'batch_size': 826, 'optimizer': 'Adam'}. Best is trial 27 with value: 0.05941431359795208.
2026-05-18 19:52:01,756 - experiment_functions - INFO - Early stopping at epoch 500. Best Recall: 0.0045
2026-05-18 19:52:01,870 - optuna.study.study - INFO - Trial 88 finished with value: 0.004521320791894064 and parameters: {'n_layers': 1, 'embedding_dim': 256, 'lr': 0.000346943428668191, 'lambda_val': 1.3695012298455473e-06, 'batch_size': 1326, 'optimizer': 'SGD'}. Best is trial 27 with value: 0.05941431359795208.
2026-05-18 19:52:11,450 - experiment_functions - INFO - Early stopping at epoch 650. Best Recall: 0.0575
2026-05-18 19:52:11,553 - optuna.study.study - INFO - Trial 89 finished with value: 0.057479829175845064 and parameters: {'n_layers': 1, 'embedding_dim': 256, 'lr': 0.0005934555064042092, 'lambda_val': 2.6481333405105643e-06, 'batch_size': 549, 'optimizer': 'RMSprop'}. Best is trial 27 with value: 0.05941431359795208.
2026-05-18 19:52:20,091 - experiment_functions - INFO - Early stopping at epoch 600. Best Recall: 0.0552
2026-05-18 19:52:20,182 - optuna.study.study - INFO - Trial 90 finished with value: 0.0552338618789687 and parameters: {'n_layers': 1, 'embedding_dim': 128, 'lr': 0.0016957523301006174, 'lambda_val': 0.004315937942994403, 'batch_size': 1085, 'optimizer': 'Adam'}. Best is trial 27 with value: 0.05941431359795208.
2026-05-18 19:52:33,188 - optuna.study._optimize - INFO - Trial 91 pruned. 
2026-05-18 19:52:41,970 - experiment_functions - INFO - Early stopping at epoch 600. Best Recall: 0.0560
2026-05-18 19:52:42,084 - optuna.study.study - INFO - Trial 92 finished with value: 0.05596648147095473 and parameters: {'n_layers': 1, 'embedding_dim': 256, 'lr': 0.0007655178980139839, 'lambda_val': 1.0130750351893913e-06, 'batch_size': 518, 'optimizer': 'RMSprop'}. Best is trial 27 with value: 0.05941431359795208.
2026-05-18 19:52:51,466 - experiment_functions - INFO - Early stopping at epoch 650. Best Recall: 0.0546
2026-05-18 19:52:51,569 - optuna.study.study - INFO - Trial 93 finished with value: 0.05456061825310064 and parameters: {'n_layers': 1, 'embedding_dim': 256, 'lr': 0.000624277323014501, 'lambda_val': 3.288866096737548e-06, 'batch_size': 957, 'optimizer': 'RMSprop'}. Best is trial 27 with value: 0.05941431359795208.
2026-05-18 19:53:00,323 - experiment_functions - INFO - Early stopping at epoch 550. Best Recall: 0.0177
2026-05-18 19:53:00,438 - optuna.study.study - INFO - Trial 94 finished with value: 0.017709113587446354 and parameters: {'n_layers': 1, 'embedding_dim': 256, 'lr': 0.0037277027649802092, 'lambda_val': 2.0886706155711533e-06, 'batch_size': 778, 'optimizer': 'RMSprop'}. Best is trial 27 with value: 0.05941431359795208.
2026-05-18 19:53:09,082 - experiment_functions - INFO - Early stopping at epoch 550. Best Recall: 0.0184
2026-05-18 19:53:09,173 - optuna.study.study - INFO - Trial 95 finished with value: 0.01841337618868277 and parameters: {'n_layers': 3, 'embedding_dim': 256, 'lr': 0.0010202937349282797, 'lambda_val': 3.689919222680887e-06, 'batch_size': 550, 'optimizer': 'RMSprop'}. Best is trial 27 with value: 0.05941431359795208.
2026-05-18 19:53:21,803 - optuna.study._optimize - INFO - Trial 96 pruned. 
2026-05-18 19:53:31,100 - experiment_functions - INFO - Early stopping at epoch 600. Best Recall: 0.0556
2026-05-18 19:53:31,204 - optuna.study.study - INFO - Trial 97 finished with value: 0.05557667065391964 and parameters: {'n_layers': 1, 'embedding_dim': 256, 'lr': 0.0019404143480646994, 'lambda_val': 6.167266784475155e-06, 'batch_size': 1442, 'optimizer': 'Adam'}. Best is trial 27 with value: 0.05941431359795208.
2026-05-18 19:53:45,847 - experiment_functions - INFO - Early stopping at epoch 1050. Best Recall: 0.0587
2026-05-18 19:53:45,951 - optuna.study.study - INFO - Trial 98 finished with value: 0.05867156792072314 and parameters: {'n_layers': 1, 'embedding_dim': 256, 'lr': 0.0003729286082424425, 'lambda_val': 1.757272786891698e-06, 'batch_size': 656, 'optimizer': 'Adam'}. Best is trial 27 with value: 0.05941431359795208.
2026-05-18 19:54:24,765 - experiment_functions - INFO - Early stopping at epoch 3050. Best Recall: 0.0569
2026-05-18 19:54:24,879 - optuna.study.study - INFO - Trial 99 finished with value: 0.05689767051327633 and parameters: {'n_layers': 1, 'embedding_dim': 128, 'lr': 0.00019613118593374068, 'lambda_val': 1.7150312872823116e-06, 'batch_size': 1010, 'optimizer': 'Adam'}. Best is trial 27 with value: 0.05941431359795208.
2026-05-18 19:54:33,746 - experiment_functions - INFO - Early stopping at epoch 600. Best Recall: 0.0565
2026-05-18 19:54:33,839 - optuna.study.study - INFO - Trial 100 finished with value: 0.05648327955876692 and parameters: {'n_layers': 1, 'embedding_dim': 96, 'lr': 0.0024851635933837847, 'lambda_val': 1.3245906246503136e-06, 'batch_size': 677, 'optimizer': 'Adam'}. Best is trial 27 with value: 0.05941431359795208.
2026-05-18 19:54:47,812 - experiment_functions - INFO - Early stopping at epoch 1000. Best Recall: 0.0598
2026-05-18 19:54:47,907 - optuna.study.study - INFO - Trial 101 finished with value: 0.059757184640820554 and parameters: {'n_layers': 1, 'embedding_dim': 256, 'lr': 0.0003811448212345991, 'lambda_val': 1.8717495633839318e-06, 'batch_size': 812, 'optimizer': 'Adam'}. Best is trial 101 with value: 0.059757184640820554.
2026-05-18 19:55:03,620 - experiment_functions - INFO - Early stopping at epoch 1150. Best Recall: 0.0586
2026-05-18 19:55:03,734 - optuna.study.study - INFO - Trial 102 finished with value: 0.05861163756571555 and parameters: {'n_layers': 1, 'embedding_dim': 256, 'lr': 0.00029168608155703346, 'lambda_val': 1.850706588893567e-06, 'batch_size': 778, 'optimizer': 'Adam'}. Best is trial 101 with value: 0.059757184640820554.
2026-05-18 19:55:18,363 - experiment_functions - INFO - Early stopping at epoch 1050. Best Recall: 0.0587
2026-05-18 19:55:18,466 - optuna.study.study - INFO - Trial 103 finished with value: 0.05872008180683726 and parameters: {'n_layers': 1, 'embedding_dim': 256, 'lr': 0.00035549839245599076, 'lambda_val': 1.8560299983974148e-06, 'batch_size': 829, 'optimizer': 'Adam'}. Best is trial 101 with value: 0.059757184640820554.
2026-05-18 19:55:35,072 - experiment_functions - INFO - Early stopping at epoch 1150. Best Recall: 0.0573
2026-05-18 19:55:35,165 - optuna.study.study - INFO - Trial 104 finished with value: 0.057291436118750566 and parameters: {'n_layers': 1, 'embedding_dim': 256, 'lr': 0.00032298397768130093, 'lambda_val': 1.80045962226735e-06, 'batch_size': 833, 'optimizer': 'Adam'}. Best is trial 101 with value: 0.059757184640820554.
2026-05-18 19:55:48,548 - optuna.study._optimize - INFO - Trial 105 pruned. 
2026-05-18 19:56:05,558 - experiment_functions - INFO - Early stopping at epoch 1250. Best Recall: 0.0588
2026-05-18 19:56:05,707 - optuna.study.study - INFO - Trial 106 finished with value: 0.05878338600201853 and parameters: {'n_layers': 1, 'embedding_dim': 256, 'lr': 0.00031753278729675246, 'lambda_val': 1.2644984762531806e-06, 'batch_size': 704, 'optimizer': 'Adam'}. Best is trial 101 with value: 0.059757184640820554.
2026-05-18 19:56:36,989 - experiment_functions - INFO - Early stopping at epoch 1700. Best Recall: 0.0595
2026-05-18 19:56:37,104 - optuna.study.study - INFO - Trial 107 finished with value: 0.05953188359578029 and parameters: {'n_layers': 1, 'embedding_dim': 32, 'lr': 0.00040877908403593133, 'lambda_val': 2.083854006476449e-06, 'batch_size': 718, 'optimizer': 'Adam'}. Best is trial 101 with value: 0.059757184640820554.
2026-05-18 19:57:04,447 - experiment_functions - INFO - Early stopping at epoch 2100. Best Recall: 0.0588
2026-05-18 19:57:04,551 - optuna.study.study - INFO - Trial 108 finished with value: 0.058847107901292675 and parameters: {'n_layers': 1, 'embedding_dim': 32, 'lr': 0.0003114681786720734, 'lambda_val': 2.1134772561061775e-06, 'batch_size': 704, 'optimizer': 'Adam'}. Best is trial 101 with value: 0.059757184640820554.
2026-05-18 19:57:24,676 - experiment_functions - INFO - Early stopping at epoch 1550. Best Recall: 0.0596
2026-05-18 19:57:24,780 - optuna.study.study - INFO - Trial 109 finished with value: 0.05959113979067031 and parameters: {'n_layers': 1, 'embedding_dim': 32, 'lr': 0.00029695455364687855, 'lambda_val': 1.2730861995357828e-06, 'batch_size': 678, 'optimizer': 'Adam'}. Best is trial 101 with value: 0.059757184640820554.
2026-05-18 19:57:39,931 - experiment_functions - INFO - Early stopping at epoch 1100. Best Recall: 0.0599
2026-05-18 19:57:40,048 - optuna.study.study - INFO - Trial 110 finished with value: 0.05991667414430123 and parameters: {'n_layers': 1, 'embedding_dim': 32, 'lr': 0.000401408278935495, 'lambda_val': 1.164722412875683e-06, 'batch_size': 645, 'optimizer': 'Adam'}. Best is trial 110 with value: 0.05991667414430123.
2026-05-18 19:57:59,792 - experiment_functions - INFO - Early stopping at epoch 1500. Best Recall: 0.0583
2026-05-18 19:57:59,873 - optuna.study.study - INFO - Trial 111 finished with value: 0.05834619003217725 and parameters: {'n_layers': 1, 'embedding_dim': 32, 'lr': 0.0003801836868833685, 'lambda_val': 1.3868055452845437e-06, 'batch_size': 697, 'optimizer': 'Adam'}. Best is trial 110 with value: 0.05991667414430123.
2026-05-18 19:58:44,477 - experiment_functions - INFO - Early stopping at epoch 3500. Best Recall: 0.0604
2026-05-18 19:58:44,594 - optuna.study.study - INFO - Trial 112 finished with value: 0.06035480652509273 and parameters: {'n_layers': 1, 'embedding_dim': 32, 'lr': 0.00027527180761612805, 'lambda_val': 1.85715133224888e-06, 'batch_size': 734, 'optimizer': 'Adam'}. Best is trial 112 with value: 0.06035480652509273.
2026-05-18 19:59:35,207 - optuna.study.study - INFO - Trial 113 finished with value: 0.061737870669382106 and parameters: {'n_layers': 1, 'embedding_dim': 32, 'lr': 0.00022485431821248119, 'lambda_val': 1.2358553921552186e-06, 'batch_size': 618, 'optimizer': 'Adam'}. Best is trial 113 with value: 0.061737870669382106.
2026-05-18 19:59:48,833 - optuna.study._optimize - INFO - Trial 114 pruned. 
2026-05-18 20:00:06,497 - experiment_functions - INFO - Early stopping at epoch 1300. Best Recall: 0.0619
2026-05-18 20:00:06,755 - optuna.study.study - INFO - Trial 115 finished with value: 0.0619140780842832 and parameters: {'n_layers': 1, 'embedding_dim': 32, 'lr': 0.0004195107273034565, 'lambda_val': 2.0003388571578484e-06, 'batch_size': 593, 'optimizer': 'Adam'}. Best is trial 115 with value: 0.0619140780842832.
2026-05-18 20:00:19,378 - experiment_functions - INFO - Early stopping at epoch 950. Best Recall: 0.0590
2026-05-18 20:00:19,480 - optuna.study.study - INFO - Trial 116 finished with value: 0.058955725597307655 and parameters: {'n_layers': 1, 'embedding_dim': 32, 'lr': 0.00048766667382323754, 'lambda_val': 3.0309630729941746e-06, 'batch_size': 850, 'optimizer': 'Adam'}. Best is trial 115 with value: 0.0619140780842832.
2026-05-18 20:00:33,005 - experiment_functions - INFO - Early stopping at epoch 1000. Best Recall: 0.0568
2026-05-18 20:00:33,154 - optuna.study.study - INFO - Trial 117 finished with value: 0.056809016638704565 and parameters: {'n_layers': 1, 'embedding_dim': 32, 'lr': 0.0004815840095634428, 'lambda_val': 3.005472376633976e-06, 'batch_size': 950, 'optimizer': 'Adam'}. Best is trial 115 with value: 0.0619140780842832.
2026-05-18 20:01:10,112 - experiment_functions - INFO - Early stopping at epoch 2850. Best Recall: 0.0604
2026-05-18 20:01:10,206 - optuna.study.study - INFO - Trial 118 finished with value: 0.060352264885799714 and parameters: {'n_layers': 1, 'embedding_dim': 32, 'lr': 0.0002788201479016657, 'lambda_val': 2.1775526498917095e-06, 'batch_size': 722, 'optimizer': 'Adam'}. Best is trial 115 with value: 0.0619140780842832.
2026-05-18 20:01:24,947 - optuna.study._optimize - INFO - Trial 119 pruned. 
2026-05-18 20:01:32,407 - experiment_functions - INFO - Early stopping at epoch 500. Best Recall: 0.0053
2026-05-18 20:01:32,511 - optuna.study.study - INFO - Trial 120 finished with value: 0.0052953353459725926 and parameters: {'n_layers': 1, 'embedding_dim': 32, 'lr': 0.0002688420701312616, 'lambda_val': 2.608565150493242e-06, 'batch_size': 746, 'optimizer': 'SGD'}. Best is trial 115 with value: 0.0619140780842832.
2026-05-18 20:01:48,898 - experiment_functions - INFO - Early stopping at epoch 1200. Best Recall: 0.0610
2026-05-18 20:01:48,991 - optuna.study.study - INFO - Trial 121 finished with value: 0.06098281589305413 and parameters: {'n_layers': 1, 'embedding_dim': 32, 'lr': 0.00044877287198816105, 'lambda_val': 3.4133160263149653e-06, 'batch_size': 608, 'optimizer': 'Adam'}. Best is trial 115 with value: 0.0619140780842832.
2026-05-18 20:02:03,266 - experiment_functions - INFO - Early stopping at epoch 1100. Best Recall: 0.0603
2026-05-18 20:02:03,358 - optuna.study.study - INFO - Trial 122 finished with value: 0.060348910279493 and parameters: {'n_layers': 1, 'embedding_dim': 32, 'lr': 0.00046992424954473924, 'lambda_val': 2.3342175670264625e-06, 'batch_size': 587, 'optimizer': 'Adam'}. Best is trial 115 with value: 0.0619140780842832.
2026-05-18 20:02:24,294 - experiment_functions - INFO - Early stopping at epoch 1450. Best Recall: 0.0624
2026-05-18 20:02:24,389 - optuna.study.study - INFO - Trial 123 finished with value: 0.0623769821847391 and parameters: {'n_layers': 1, 'embedding_dim': 32, 'lr': 0.00045976740750601003, 'lambda_val': 2.125658819043402e-06, 'batch_size': 591, 'optimizer': 'Adam'}. Best is trial 123 with value: 0.0623769821847391.
2026-05-18 20:02:39,112 - experiment_functions - INFO - Early stopping at epoch 1100. Best Recall: 0.0610
2026-05-18 20:02:39,217 - optuna.study.study - INFO - Trial 124 finished with value: 0.061032474868141146 and parameters: {'n_layers': 1, 'embedding_dim': 32, 'lr': 0.000523535280428295, 'lambda_val': 3.897368312410496e-06, 'batch_size': 589, 'optimizer': 'Adam'}. Best is trial 123 with value: 0.0623769821847391.
2026-05-18 20:02:51,731 - optuna.study._optimize - INFO - Trial 125 pruned. 
2026-05-18 20:03:08,858 - optuna.study._optimize - INFO - Trial 126 pruned. 
2026-05-18 20:03:27,263 - experiment_functions - INFO - Early stopping at epoch 1000. Best Recall: 0.0600
2026-05-18 20:03:27,365 - optuna.study.study - INFO - Trial 127 finished with value: 0.06001960977579729 and parameters: {'n_layers': 1, 'embedding_dim': 32, 'lr': 0.0005393708325530052, 'lambda_val': 3.779298594244355e-06, 'batch_size': 617, 'optimizer': 'Adam'}. Best is trial 123 with value: 0.0623769821847391.
2026-05-18 20:03:42,994 - experiment_functions - INFO - Early stopping at epoch 1150. Best Recall: 0.0620
2026-05-18 20:03:43,109 - optuna.study.study - INFO - Trial 128 finished with value: 0.062048908301453806 and parameters: {'n_layers': 1, 'embedding_dim': 32, 'lr': 0.00053732711842211, 'lambda_val': 6.151198282960827e-06, 'batch_size': 769, 'optimizer': 'Adam'}. Best is trial 123 with value: 0.0623769821847391.
2026-05-18 20:03:57,881 - experiment_functions - INFO - Early stopping at epoch 1100. Best Recall: 0.0606
2026-05-18 20:03:58,006 - optuna.study.study - INFO - Trial 129 finished with value: 0.0605603142579465 and parameters: {'n_layers': 1, 'embedding_dim': 32, 'lr': 0.0005404483558969562, 'lambda_val': 5.832998522828692e-06, 'batch_size': 933, 'optimizer': 'Adam'}. Best is trial 123 with value: 0.0623769821847391.
2026-05-18 20:04:13,024 - experiment_functions - INFO - Early stopping at epoch 1100. Best Recall: 0.0582
2026-05-18 20:04:13,128 - optuna.study.study - INFO - Trial 130 finished with value: 0.058164673850996926 and parameters: {'n_layers': 1, 'embedding_dim': 32, 'lr': 0.0005176744634421428, 'lambda_val': 6.138939164608828e-06, 'batch_size': 939, 'optimizer': 'Adam'}. Best is trial 123 with value: 0.0623769821847391.
2026-05-18 20:04:25,116 - experiment_functions - INFO - Early stopping at epoch 900. Best Recall: 0.0581
2026-05-18 20:04:25,219 - optuna.study.study - INFO - Trial 131 finished with value: 0.05807070654310372 and parameters: {'n_layers': 1, 'embedding_dim': 32, 'lr': 0.0005666481366949359, 'lambda_val': 3.5769923856828293e-06, 'batch_size': 778, 'optimizer': 'Adam'}. Best is trial 123 with value: 0.0623769821847391.
2026-05-18 20:04:37,044 - experiment_functions - INFO - Early stopping at epoch 900. Best Recall: 0.0585
2026-05-18 20:04:37,146 - optuna.study.study - INFO - Trial 132 finished with value: 0.05845952419290705 and parameters: {'n_layers': 1, 'embedding_dim': 32, 'lr': 0.0007027693380991465, 'lambda_val': 3.722276745810854e-06, 'batch_size': 604, 'optimizer': 'Adam'}. Best is trial 123 with value: 0.0623769821847391.
2026-05-18 20:05:25,866 - experiment_functions - INFO - Early stopping at epoch 3950. Best Recall: 0.0636
2026-05-18 20:05:25,974 - optuna.study.study - INFO - Trial 133 finished with value: 0.06361666449572526 and parameters: {'n_layers': 1, 'embedding_dim': 32, 'lr': 0.0002572296296576595, 'lambda_val': 4.83942095041786e-06, 'batch_size': 532, 'optimizer': 'Adam'}. Best is trial 133 with value: 0.06361666449572526.
2026-05-18 20:05:39,264 - optuna.study._optimize - INFO - Trial 134 pruned. 
2026-05-18 20:05:54,222 - experiment_functions - INFO - Early stopping at epoch 1150. Best Recall: 0.0585
2026-05-18 20:05:54,325 - optuna.study.study - INFO - Trial 135 finished with value: 0.058538800178903436 and parameters: {'n_layers': 1, 'embedding_dim': 32, 'lr': 0.0004386092644858934, 'lambda_val': 7.943932307201787e-06, 'batch_size': 780, 'optimizer': 'Adam'}. Best is trial 133 with value: 0.06361666449572526.
2026-05-18 20:06:06,485 - experiment_functions - INFO - Early stopping at epoch 900. Best Recall: 0.0603
2026-05-18 20:06:06,600 - optuna.study.study - INFO - Trial 136 finished with value: 0.060339546833367855 and parameters: {'n_layers': 1, 'embedding_dim': 32, 'lr': 0.0009210527917980797, 'lambda_val': 5.328920144969571e-06, 'batch_size': 592, 'optimizer': 'Adam'}. Best is trial 133 with value: 0.06361666449572526.
2026-05-18 20:06:18,855 - experiment_functions - INFO - Early stopping at epoch 850. Best Recall: 0.0616
