2026-05-18 13:33:40,361 - optuna.study._optimize - INFO - Trial 299 pruned. 
2026-05-18 13:34:06,162 - experiment_functions - INFO - Early stopping at epoch 2250. Best Recall: 0.0741
2026-05-18 13:34:07,080 - root - INFO -   **** Training e_1M_1c2dcs_rand2
2026-05-18 13:34:07,136 - root - INFO -   **** Getting 202263/805443 random edges
2026-05-18 13:34:07,703 - optuna.storages._rdb.storage - INFO - A new study created in RDB with name: Study_e_1M_1c2dcs_rand2
2026-05-18 13:34:28,614 - experiment_functions - INFO - Early stopping at epoch 750. Best Recall: 0.0249
2026-05-18 13:34:28,703 - optuna.study.study - INFO - Trial 0 finished with value: 0.024940070895252197 and parameters: {'n_layers': 4, 'embedding_dim': 64, 'lr': 0.0003327251784513068, 'lambda_val': 0.030751647960469544, 'batch_size': 3520, 'optimizer': 'RMSprop'}. Best is trial 0 with value: 0.024940070895252197.
2026-05-18 13:34:48,542 - experiment_functions - INFO - Early stopping at epoch 650. Best Recall: 0.0450
2026-05-18 13:34:49,253 - optuna.study.study - INFO - Trial 1 finished with value: 0.04501339934851901 and parameters: {'n_layers': 2, 'embedding_dim': 96, 'lr': 0.001217831782928733, 'lambda_val': 8.206387280647546e-06, 'batch_size': 2341, 'optimizer': 'Adam'}. Best is trial 1 with value: 0.04501339934851901.
2026-05-18 13:35:13,744 - experiment_functions - INFO - Early stopping at epoch 800. Best Recall: 0.0333
2026-05-18 13:35:13,843 - optuna.study.study - INFO - Trial 2 finished with value: 0.033309125171179156 and parameters: {'n_layers': 4, 'embedding_dim': 128, 'lr': 0.00033823302468682107, 'lambda_val': 1.863759753847441e-05, 'batch_size': 3385, 'optimizer': 'Adam'}. Best is trial 1 with value: 0.04501339934851901.
2026-05-18 13:35:33,789 - experiment_functions - INFO - Early stopping at epoch 1050. Best Recall: 0.0160
2026-05-18 13:35:33,879 - optuna.study.study - INFO - Trial 3 finished with value: 0.01602586853367419 and parameters: {'n_layers': 4, 'embedding_dim': 32, 'lr': 0.040910820913273485, 'lambda_val': 2.8032150489844785e-06, 'batch_size': 3949, 'optimizer': 'Adam'}. Best is trial 1 with value: 0.04501339934851901.
2026-05-18 13:35:42,078 - experiment_functions - INFO - Early stopping at epoch 500. Best Recall: 0.0060
2026-05-18 13:35:42,147 - optuna.study.study - INFO - Trial 4 finished with value: 0.006011891609932804 and parameters: {'n_layers': 2, 'embedding_dim': 32, 'lr': 0.052322287705169356, 'lambda_val': 2.5611058182927537e-05, 'batch_size': 4069, 'optimizer': 'SGD'}. Best is trial 1 with value: 0.04501339934851901.
2026-05-18 13:35:51,622 - experiment_functions - INFO - Early stopping at epoch 600. Best Recall: 0.0336
2026-05-18 13:35:51,711 - optuna.study.study - INFO - Trial 5 finished with value: 0.03363589462725981 and parameters: {'n_layers': 2, 'embedding_dim': 128, 'lr': 0.00165582620363907, 'lambda_val': 0.04119285272503587, 'batch_size': 2424, 'optimizer': 'Adam'}. Best is trial 1 with value: 0.04501339934851901.
2026-05-18 13:36:00,485 - experiment_functions - INFO - Early stopping at epoch 500. Best Recall: 0.0050
2026-05-18 13:36:00,576 - optuna.study.study - INFO - Trial 6 finished with value: 0.005035060112990728 and parameters: {'n_layers': 2, 'embedding_dim': 64, 'lr': 4.937252893565758e-05, 'lambda_val': 0.0026230910687355244, 'batch_size': 785, 'optimizer': 'Adam'}. Best is trial 1 with value: 0.04501339934851901.
2026-05-18 13:36:09,512 - experiment_functions - INFO - Early stopping at epoch 500. Best Recall: 0.0052
2026-05-18 13:36:09,602 - optuna.study.study - INFO - Trial 7 finished with value: 0.005244223370823275 and parameters: {'n_layers': 2, 'embedding_dim': 256, 'lr': 1.3607447196131827e-05, 'lambda_val': 0.006778192008224884, 'batch_size': 3198, 'optimizer': 'RMSprop'}. Best is trial 1 with value: 0.04501339934851901.
2026-05-18 13:36:18,274 - experiment_functions - INFO - Early stopping at epoch 600. Best Recall: 0.0118
2026-05-18 13:36:18,364 - optuna.study.study - INFO - Trial 8 finished with value: 0.011821105781978333 and parameters: {'n_layers': 1, 'embedding_dim': 128, 'lr': 0.06465568503544475, 'lambda_val': 3.116301072561335e-06, 'batch_size': 1032, 'optimizer': 'Adam'}. Best is trial 1 with value: 0.04501339934851901.
2026-05-18 13:36:26,032 - experiment_functions - INFO - Early stopping at epoch 500. Best Recall: 0.0052
2026-05-18 13:36:26,123 - optuna.study.study - INFO - Trial 9 finished with value: 0.005201816444802568 and parameters: {'n_layers': 1, 'embedding_dim': 128, 'lr': 0.005970866608379244, 'lambda_val': 0.0024553257692125053, 'batch_size': 2386, 'optimizer': 'SGD'}. Best is trial 1 with value: 0.04501339934851901.
2026-05-18 13:36:45,850 - optuna.study._optimize - INFO - Trial 10 pruned. 
2026-05-18 13:37:07,803 - experiment_functions - INFO - Early stopping at epoch 700. Best Recall: 0.0176
2026-05-18 13:37:07,905 - optuna.study.study - INFO - Trial 11 finished with value: 0.01755785503913657 and parameters: {'n_layers': 3, 'embedding_dim': 96, 'lr': 0.0012248048292252602, 'lambda_val': 0.07636185703915344, 'batch_size': 2356, 'optimizer': 'Adam'}. Best is trial 1 with value: 0.04501339934851901.
2026-05-18 13:37:22,767 - experiment_functions - INFO - Early stopping at epoch 550. Best Recall: 0.0429
2026-05-18 13:37:23,374 - optuna.study.study - INFO - Trial 12 finished with value: 0.04289531367892604 and parameters: {'n_layers': 2, 'embedding_dim': 96, 'lr': 0.007085235000117641, 'lambda_val': 0.0005494471192929855, 'batch_size': 1737, 'optimizer': 'Adam'}. Best is trial 1 with value: 0.04501339934851901.
2026-05-18 13:37:35,906 - experiment_functions - INFO - Early stopping at epoch 550. Best Recall: 0.0486
2026-05-18 13:37:38,015 - optuna.study.study - INFO - Trial 13 finished with value: 0.04864252746540062 and parameters: {'n_layers': 1, 'embedding_dim': 96, 'lr': 0.010655399257587572, 'lambda_val': 0.00023067625961012246, 'batch_size': 1563, 'optimizer': 'Adam'}. Best is trial 13 with value: 0.04864252746540062.
2026-05-18 13:37:47,755 - experiment_functions - INFO - Early stopping at epoch 500. Best Recall: 0.0058
2026-05-18 13:37:47,843 - optuna.study.study - INFO - Trial 14 finished with value: 0.0058216790991756995 and parameters: {'n_layers': 1, 'embedding_dim': 96, 'lr': 0.011914397421738296, 'lambda_val': 8.071740941331955e-05, 'batch_size': 1599, 'optimizer': 'SGD'}. Best is trial 13 with value: 0.04864252746540062.
2026-05-18 13:38:42,817 - experiment_functions - INFO - Early stopping at epoch 3800. Best Recall: 0.0580
2026-05-18 13:38:42,914 - optuna.study.study - INFO - Trial 15 finished with value: 0.058039451566854944 and parameters: {'n_layers': 1, 'embedding_dim': 96, 'lr': 0.000308122240899214, 'lambda_val': 1.0437174417871332e-06, 'batch_size': 2840, 'optimizer': 'Adam'}. Best is trial 15 with value: 0.058039451566854944.
2026-05-18 13:38:59,953 - optuna.study._optimize - INFO - Trial 16 pruned. 
2026-05-18 13:39:08,964 - experiment_functions - INFO - Early stopping at epoch 550. Best Recall: 0.0328
2026-05-18 13:39:09,053 - optuna.study.study - INFO - Trial 17 finished with value: 0.032846052790135874 and parameters: {'n_layers': 1, 'embedding_dim': 96, 'lr': 0.017022427753942273, 'lambda_val': 1.2432327418144938e-06, 'batch_size': 1903, 'optimizer': 'Adam'}. Best is trial 15 with value: 0.058039451566854944.
2026-05-18 13:39:16,150 - experiment_functions - INFO - Early stopping at epoch 500. Best Recall: 0.0047
2026-05-18 13:39:16,790 - optuna.study.study - INFO - Trial 18 finished with value: 0.004696348031318538 and parameters: {'n_layers': 1, 'embedding_dim': 96, 'lr': 0.00011015592432768281, 'lambda_val': 7.618841259369534e-05, 'batch_size': 1190, 'optimizer': 'SGD'}. Best is trial 15 with value: 0.058039451566854944.
2026-05-18 13:39:32,733 - optuna.study._optimize - INFO - Trial 19 pruned. 
2026-05-18 13:40:14,361 - experiment_functions - INFO - Early stopping at epoch 2700. Best Recall: 0.0632
2026-05-18 13:40:15,152 - optuna.study.study - INFO - Trial 20 finished with value: 0.0631541319413486 and parameters: {'n_layers': 1, 'embedding_dim': 32, 'lr': 0.000512711317559946, 'lambda_val': 1.03470398059071e-06, 'batch_size': 1984, 'optimizer': 'Adam'}. Best is trial 20 with value: 0.0631541319413486.
2026-05-18 13:40:49,351 - experiment_functions - INFO - Early stopping at epoch 2250. Best Recall: 0.0610
2026-05-18 13:40:49,484 - optuna.study.study - INFO - Trial 21 finished with value: 0.06100663883151786 and parameters: {'n_layers': 1, 'embedding_dim': 32, 'lr': 0.0005275337500859393, 'lambda_val': 1.0680163611845021e-06, 'batch_size': 2076, 'optimizer': 'Adam'}. Best is trial 20 with value: 0.0631541319413486.
2026-05-18 13:41:06,345 - optuna.study._optimize - INFO - Trial 22 pruned. 
2026-05-18 13:41:20,570 - optuna.study._optimize - INFO - Trial 23 pruned. 
2026-05-18 13:41:39,205 - optuna.study._optimize - INFO - Trial 24 pruned. 
2026-05-18 13:41:48,779 - experiment_functions - INFO - Early stopping at epoch 600. Best Recall: 0.0452
2026-05-18 13:41:48,868 - optuna.study.study - INFO - Trial 25 finished with value: 0.04518717158314353 and parameters: {'n_layers': 2, 'embedding_dim': 32, 'lr': 0.002195202233890725, 'lambda_val': 2.2110074723929223e-05, 'batch_size': 2718, 'optimizer': 'Adam'}. Best is trial 20 with value: 0.0631541319413486.
2026-05-18 13:42:02,915 - optuna.study._optimize - INFO - Trial 26 pruned. 
2026-05-18 13:42:17,304 - experiment_functions - INFO - Early stopping at epoch 900. Best Recall: 0.0472
2026-05-18 13:42:17,394 - optuna.study.study - INFO - Trial 27 finished with value: 0.047236781660107745 and parameters: {'n_layers': 2, 'embedding_dim': 32, 'lr': 0.0006560563156084144, 'lambda_val': 1.0443066213091514e-06, 'batch_size': 3136, 'optimizer': 'Adam'}. Best is trial 20 with value: 0.0631541319413486.
2026-05-18 13:42:25,194 - experiment_functions - INFO - Early stopping at epoch 500. Best Recall: 0.0043
2026-05-18 13:42:25,305 - optuna.study.study - INFO - Trial 28 finished with value: 0.004342403384994961 and parameters: {'n_layers': 1, 'embedding_dim': 256, 'lr': 8.640533198298998e-05, 'lambda_val': 5.507786767804138e-06, 'batch_size': 2014, 'optimizer': 'SGD'}. Best is trial 20 with value: 0.0631541319413486.
2026-05-18 13:42:39,945 - optuna.study._optimize - INFO - Trial 29 pruned. 
2026-05-18 13:42:53,063 - experiment_functions - INFO - Early stopping at epoch 900. Best Recall: 0.0530
2026-05-18 13:42:53,168 - optuna.study.study - INFO - Trial 30 finished with value: 0.052953858146504475 and parameters: {'n_layers': 1, 'embedding_dim': 64, 'lr': 0.0007904826855168178, 'lambda_val': 2.372689465834034e-06, 'batch_size': 2552, 'optimizer': 'RMSprop'}. Best is trial 20 with value: 0.0631541319413486.
2026-05-18 13:43:04,582 - experiment_functions - INFO - Early stopping at epoch 800. Best Recall: 0.0551
2026-05-18 13:43:04,700 - optuna.study.study - INFO - Trial 31 finished with value: 0.05511767549989437 and parameters: {'n_layers': 1, 'embedding_dim': 64, 'lr': 0.0008173255711933224, 'lambda_val': 2.3571388269874734e-06, 'batch_size': 2588, 'optimizer': 'RMSprop'}. Best is trial 20 with value: 0.0631541319413486.
2026-05-18 13:43:28,499 - optuna.study._optimize - INFO - Trial 32 pruned. 
2026-05-18 13:43:37,589 - experiment_functions - INFO - Early stopping at epoch 550. Best Recall: 0.0487
2026-05-18 13:43:37,682 - optuna.study.study - INFO - Trial 33 finished with value: 0.04872835301515982 and parameters: {'n_layers': 1, 'embedding_dim': 64, 'lr': 0.0025492020149440295, 'lambda_val': 1.802054577213599e-06, 'batch_size': 2203, 'optimizer': 'RMSprop'}. Best is trial 20 with value: 0.0631541319413486.
2026-05-18 13:43:48,251 - experiment_functions - INFO - Early stopping at epoch 750. Best Recall: 0.0516
2026-05-18 13:43:48,355 - optuna.study.study - INFO - Trial 34 finished with value: 0.051608739647043246 and parameters: {'n_layers': 1, 'embedding_dim': 32, 'lr': 0.0010829931728533171, 'lambda_val': 4.632400390952725e-05, 'batch_size': 2636, 'optimizer': 'RMSprop'}. Best is trial 20 with value: 0.0631541319413486.
2026-05-18 13:44:02,556 - optuna.study._optimize - INFO - Trial 35 pruned. 
2026-05-18 13:44:11,234 - experiment_functions - INFO - Early stopping at epoch 550. Best Recall: 0.0269
2026-05-18 13:44:11,349 - optuna.study.study - INFO - Trial 36 finished with value: 0.026943106460015045 and parameters: {'n_layers': 4, 'embedding_dim': 32, 'lr': 0.003934628470377213, 'lambda_val': 1.519565395924051e-06, 'batch_size': 2222, 'optimizer': 'Adam'}. Best is trial 20 with value: 0.0631541319413486.
2026-05-18 13:44:19,570 - experiment_functions - INFO - Early stopping at epoch 550. Best Recall: 0.0398
2026-05-18 13:44:19,673 - optuna.study.study - INFO - Trial 37 finished with value: 0.039819781180883425 and parameters: {'n_layers': 2, 'embedding_dim': 32, 'lr': 0.0015553923672696332, 'lambda_val': 5.0268682746105735e-06, 'batch_size': 1838, 'optimizer': 'RMSprop'}. Best is trial 20 with value: 0.0631541319413486.
2026-05-18 13:44:33,570 - optuna.study._optimize - INFO - Trial 38 pruned. 
2026-05-18 13:44:56,366 - experiment_functions - INFO - Early stopping at epoch 950. Best Recall: 0.0571
2026-05-18 13:44:56,480 - optuna.study.study - INFO - Trial 39 finished with value: 0.05707751046340079 and parameters: {'n_layers': 1, 'embedding_dim': 128, 'lr': 0.0008068701305376743, 'lambda_val': 3.057952474051036e-05, 'batch_size': 2493, 'optimizer': 'Adam'}. Best is trial 20 with value: 0.0631541319413486.
2026-05-18 13:45:11,104 - optuna.study._optimize - INFO - Trial 40 pruned. 
2026-05-18 13:45:25,371 - experiment_functions - INFO - Early stopping at epoch 950. Best Recall: 0.0593
2026-05-18 13:45:25,497 - optuna.study.study - INFO - Trial 41 finished with value: 0.05931585300028128 and parameters: {'n_layers': 1, 'embedding_dim': 128, 'lr': 0.000912998094045888, 'lambda_val': 1.999232628249872e-06, 'batch_size': 2516, 'optimizer': 'Adam'}. Best is trial 20 with value: 0.0631541319413486.
2026-05-18 13:45:40,422 - optuna.study._optimize - INFO - Trial 42 pruned. 
2026-05-18 13:45:51,742 - experiment_functions - INFO - Early stopping at epoch 700. Best Recall: 0.0609
2026-05-18 13:45:51,888 - optuna.study.study - INFO - Trial 43 finished with value: 0.06094064563822699 and parameters: {'n_layers': 1, 'embedding_dim': 128, 'lr': 0.0016621026896806892, 'lambda_val': 3.826755769807625e-06, 'batch_size': 2392, 'optimizer': 'Adam'}. Best is trial 20 with value: 0.0631541319413486.
2026-05-18 13:46:01,826 - experiment_functions - INFO - Early stopping at epoch 600. Best Recall: 0.0473
2026-05-18 13:46:01,965 - optuna.study.study - INFO - Trial 44 finished with value: 0.04727675609928063 and parameters: {'n_layers': 2, 'embedding_dim': 128, 'lr': 0.001532500336747723, 'lambda_val': 3.548067001340179e-06, 'batch_size': 3004, 'optimizer': 'Adam'}. Best is trial 20 with value: 0.0631541319413486.
2026-05-18 13:46:11,438 - experiment_functions - INFO - Early stopping at epoch 650. Best Recall: 0.0609
2026-05-18 13:46:11,576 - optuna.study.study - INFO - Trial 45 finished with value: 0.06085060137155853 and parameters: {'n_layers': 1, 'embedding_dim': 128, 'lr': 0.002066074288298945, 'lambda_val': 0.009605917479687897, 'batch_size': 2374, 'optimizer': 'Adam'}. Best is trial 20 with value: 0.0631541319413486.
2026-05-18 13:46:20,788 - experiment_functions - INFO - Early stopping at epoch 600. Best Recall: 0.0269
2026-05-18 13:46:20,879 - optuna.study.study - INFO - Trial 46 finished with value: 0.026934858336813916 and parameters: {'n_layers': 1, 'embedding_dim': 128, 'lr': 0.004197648980447095, 'lambda_val': 0.024944027713392998, 'batch_size': 2365, 'optimizer': 'Adam'}. Best is trial 20 with value: 0.0631541319413486.
2026-05-18 13:46:34,650 - optuna.study._optimize - INFO - Trial 47 pruned. 
2026-05-18 13:46:42,220 - experiment_functions - INFO - Early stopping at epoch 500. Best Recall: 0.0049
2026-05-18 13:46:42,312 - optuna.study.study - INFO - Trial 48 finished with value: 0.004896022181338784 and parameters: {'n_layers': 2, 'embedding_dim': 128, 'lr': 0.09553221315590678, 'lambda_val': 0.0024641025677087777, 'batch_size': 1525, 'optimizer': 'SGD'}. Best is trial 20 with value: 0.0631541319413486.
2026-05-18 13:46:52,398 - experiment_functions - INFO - Early stopping at epoch 650. Best Recall: 0.0533
2026-05-18 13:46:52,490 - optuna.study.study - INFO - Trial 49 finished with value: 0.05331180946156271 and parameters: {'n_layers': 1, 'embedding_dim': 128, 'lr': 0.0025023241745684406, 'lambda_val': 0.0007050349665124354, 'batch_size': 2155, 'optimizer': 'Adam'}. Best is trial 20 with value: 0.0631541319413486.
2026-05-18 13:47:00,808 - experiment_functions - INFO - Early stopping at epoch 550. Best Recall: 0.0210
2026-05-18 13:47:00,901 - optuna.study.study - INFO - Trial 50 finished with value: 0.02104226549187129 and parameters: {'n_layers': 2, 'embedding_dim': 128, 'lr': 0.005699144149914058, 'lambda_val': 0.010667810487604505, 'batch_size': 2382, 'optimizer': 'Adam'}. Best is trial 20 with value: 0.0631541319413486.
2026-05-18 13:47:12,860 - experiment_functions - INFO - Early stopping at epoch 750. Best Recall: 0.0580
2026-05-18 13:47:12,953 - optuna.study.study - INFO - Trial 51 finished with value: 0.05796528343060262 and parameters: {'n_layers': 1, 'embedding_dim': 256, 'lr': 0.0012359548591522425, 'lambda_val': 0.0015322793565983707, 'batch_size': 2459, 'optimizer': 'Adam'}. Best is trial 20 with value: 0.0631541319413486.
2026-05-18 13:47:30,580 - optuna.study._optimize - INFO - Trial 52 pruned. 
2026-05-18 13:47:40,777 - experiment_functions - INFO - Early stopping at epoch 650. Best Recall: 0.0557
2026-05-18 13:47:40,880 - optuna.study.study - INFO - Trial 53 finished with value: 0.055682983065934215 and parameters: {'n_layers': 1, 'embedding_dim': 128, 'lr': 0.002016277441678937, 'lambda_val': 6.567537531214816e-06, 'batch_size': 2936, 'optimizer': 'Adam'}. Best is trial 20 with value: 0.0631541319413486.
2026-05-18 13:47:56,241 - optuna.study._optimize - INFO - Trial 54 pruned. 
2026-05-18 13:48:18,775 - experiment_functions - INFO - Early stopping at epoch 900. Best Recall: 0.0529
2026-05-18 13:48:18,877 - optuna.study.study - INFO - Trial 55 finished with value: 0.052936446006228766 and parameters: {'n_layers': 1, 'embedding_dim': 32, 'lr': 0.0010430145662983547, 'lambda_val': 0.0001318373850663642, 'batch_size': 2719, 'optimizer': 'Adam'}. Best is trial 20 with value: 0.0631541319413486.
2026-05-18 13:48:26,872 - experiment_functions - INFO - Early stopping at epoch 500. Best Recall: 0.0052
2026-05-18 13:48:26,987 - optuna.study.study - INFO - Trial 56 finished with value: 0.00517067898233863 and parameters: {'n_layers': 1, 'embedding_dim': 96, 'lr': 0.00048366225698385297, 'lambda_val': 0.0973117294142687, 'batch_size': 1695, 'optimizer': 'Adam'}. Best is trial 20 with value: 0.0631541319413486.
2026-05-18 13:48:34,697 - experiment_functions - INFO - Early stopping at epoch 500. Best Recall: 0.0050
2026-05-18 13:48:34,788 - optuna.study.study - INFO - Trial 57 finished with value: 0.0050380021336104705 and parameters: {'n_layers': 1, 'embedding_dim': 128, 'lr': 0.0029103706796057617, 'lambda_val': 3.679922782831869e-06, 'batch_size': 2291, 'optimizer': 'SGD'}. Best is trial 20 with value: 0.0631541319413486.
2026-05-18 13:48:52,793 - optuna.study._optimize - INFO - Trial 58 pruned. 
2026-05-18 13:49:06,444 - experiment_functions - INFO - Early stopping at epoch 900. Best Recall: 0.0645
2026-05-18 13:49:06,561 - optuna.study.study - INFO - Trial 59 finished with value: 0.06448347813793345 and parameters: {'n_layers': 1, 'embedding_dim': 32, 'lr': 0.001595021705592749, 'lambda_val': 9.582174070963919e-06, 'batch_size': 1354, 'optimizer': 'Adam'}. Best is trial 59 with value: 0.06448347813793345.
2026-05-18 13:49:15,714 - experiment_functions - INFO - Early stopping at epoch 600. Best Recall: 0.0441
2026-05-18 13:49:15,864 - optuna.study.study - INFO - Trial 60 finished with value: 0.04413988271495578 and parameters: {'n_layers': 1, 'embedding_dim': 32, 'lr': 0.009470281620777475, 'lambda_val': 1.0795760725298022e-05, 'batch_size': 963, 'optimizer': 'Adam'}. Best is trial 59 with value: 0.06448347813793345.
2026-05-18 13:49:31,934 - optuna.study._optimize - INFO - Trial 61 pruned. 
2026-05-18 13:49:43,666 - experiment_functions - INFO - Early stopping at epoch 750. Best Recall: 0.0561
2026-05-18 13:49:43,760 - optuna.study.study - INFO - Trial 62 finished with value: 0.056081591724717134 and parameters: {'n_layers': 1, 'embedding_dim': 32, 'lr': 0.0018533228618977384, 'lambda_val': 1.00079926169715e-06, 'batch_size': 2669, 'optimizer': 'Adam'}. Best is trial 59 with value: 0.06448347813793345.
2026-05-18 13:49:59,717 - optuna.study._optimize - INFO - Trial 63 pruned. 
2026-05-18 13:50:23,175 - optuna.study._optimize - INFO - Trial 64 pruned. 
2026-05-18 13:50:39,786 - optuna.study._optimize - INFO - Trial 65 pruned. 
2026-05-18 13:50:47,669 - experiment_functions - INFO - Early stopping at epoch 500. Best Recall: 0.0049
2026-05-18 13:50:47,784 - optuna.study.study - INFO - Trial 66 finished with value: 0.004927774530446977 and parameters: {'n_layers': 1, 'embedding_dim': 128, 'lr': 0.0003774993182077688, 'lambda_val': 0.030643957150611457, 'batch_size': 1006, 'optimizer': 'Adam'}. Best is trial 59 with value: 0.06448347813793345.
2026-05-18 13:50:54,954 - experiment_functions - INFO - Early stopping at epoch 500. Best Recall: 0.0055
2026-05-18 13:50:55,045 - optuna.study.study - INFO - Trial 67 finished with value: 0.005547343644861963 and parameters: {'n_layers': 1, 'embedding_dim': 32, 'lr': 0.005456292527596993, 'lambda_val': 2.0650273029040457e-06, 'batch_size': 1706, 'optimizer': 'SGD'}. Best is trial 59 with value: 0.06448347813793345.
2026-05-18 13:51:11,888 - optuna.study._optimize - INFO - Trial 68 pruned. 
2026-05-18 13:51:20,691 - experiment_functions - INFO - Early stopping at epoch 600. Best Recall: 0.0047
