2026-05-18 12:07:41,668 - optuna.study.study - INFO - Trial 299 finished with value: 0.08574701433615532 and parameters: {'n_layers': 1, 'embedding_dim': 64, 'lr': 0.0007894831851457461, 'lambda_val': 0.0006247509213230209, 'batch_size': 633, 'optimizer': 'RMSprop'}. Best is trial 255 with value: 0.09452521629467195.
2026-05-18 12:08:00,983 - experiment_functions - INFO - Early stopping at epoch 1600. Best Recall: 0.0863
2026-05-18 12:08:01,893 - root - INFO -   **** Training e_1M_1c2dcs_rand1
2026-05-18 12:08:01,948 - root - INFO -   **** Getting 202263/805443 random edges
2026-05-18 12:08:02,454 - optuna.storages._rdb.storage - INFO - A new study created in RDB with name: Study_e_1M_1c2dcs_rand1
2026-05-18 12:08:16,029 - experiment_functions - INFO - Early stopping at epoch 500. Best Recall: 0.0054
2026-05-18 12:08:16,171 - optuna.study.study - INFO - Trial 0 finished with value: 0.005391752639176849 and parameters: {'n_layers': 2, 'embedding_dim': 32, 'lr': 0.040260060966979566, 'lambda_val': 1.0763065440226052e-06, 'batch_size': 2084, 'optimizer': 'SGD'}. Best is trial 0 with value: 0.005391752639176849.
2026-05-18 12:08:30,065 - experiment_functions - INFO - Early stopping at epoch 600. Best Recall: 0.0417
2026-05-18 12:08:30,934 - optuna.study.study - INFO - Trial 1 finished with value: 0.04173594512025967 and parameters: {'n_layers': 2, 'embedding_dim': 128, 'lr': 0.0027575237928748387, 'lambda_val': 0.0002031013766004321, 'batch_size': 2626, 'optimizer': 'Adam'}. Best is trial 1 with value: 0.04173594512025967.
2026-05-18 12:09:55,057 - experiment_functions - INFO - Early stopping at epoch 3500. Best Recall: 0.0346
2026-05-18 12:09:55,193 - optuna.study.study - INFO - Trial 2 finished with value: 0.034550482412160126 and parameters: {'n_layers': 1, 'embedding_dim': 96, 'lr': 0.055424336978655724, 'lambda_val': 0.010438048698939894, 'batch_size': 2402, 'optimizer': 'Adam'}. Best is trial 1 with value: 0.04173594512025967.
2026-05-18 12:10:07,493 - experiment_functions - INFO - Early stopping at epoch 500. Best Recall: 0.0051
2026-05-18 12:10:07,582 - optuna.study.study - INFO - Trial 3 finished with value: 0.0050629767849330026 and parameters: {'n_layers': 2, 'embedding_dim': 32, 'lr': 1.7683291069139162e-05, 'lambda_val': 0.007585696424506158, 'batch_size': 1877, 'optimizer': 'SGD'}. Best is trial 1 with value: 0.04173594512025967.
2026-05-18 12:10:18,877 - experiment_functions - INFO - Early stopping at epoch 550. Best Recall: 0.0056
2026-05-18 12:10:18,967 - optuna.study.study - INFO - Trial 4 finished with value: 0.005616003055540212 and parameters: {'n_layers': 3, 'embedding_dim': 32, 'lr': 3.3904910530983815e-05, 'lambda_val': 0.02985066589868938, 'batch_size': 2881, 'optimizer': 'Adam'}. Best is trial 1 with value: 0.04173594512025967.
2026-05-18 12:10:32,464 - experiment_functions - INFO - Early stopping at epoch 550. Best Recall: 0.0136
2026-05-18 12:10:32,854 - optuna.study.study - INFO - Trial 5 finished with value: 0.013564316652751611 and parameters: {'n_layers': 4, 'embedding_dim': 128, 'lr': 0.0030048703584797435, 'lambda_val': 0.00014185605198280244, 'batch_size': 527, 'optimizer': 'RMSprop'}. Best is trial 1 with value: 0.04173594512025967.
2026-05-18 12:10:49,565 - experiment_functions - INFO - Early stopping at epoch 850. Best Recall: 0.0055
2026-05-18 12:10:50,300 - optuna.study.study - INFO - Trial 6 finished with value: 0.0055028767446212625 and parameters: {'n_layers': 2, 'embedding_dim': 96, 'lr': 0.004867576822570627, 'lambda_val': 0.06738332059061057, 'batch_size': 3930, 'optimizer': 'SGD'}. Best is trial 1 with value: 0.04173594512025967.
2026-05-18 12:11:09,064 - optuna.study._optimize - INFO - Trial 7 pruned. 
2026-05-18 12:11:28,432 - experiment_functions - INFO - Early stopping at epoch 800. Best Recall: 0.0580
2026-05-18 12:11:28,536 - optuna.study.study - INFO - Trial 8 finished with value: 0.058022476544747584 and parameters: {'n_layers': 2, 'embedding_dim': 32, 'lr': 0.0009351652099630489, 'lambda_val': 0.0042239226349381365, 'batch_size': 1045, 'optimizer': 'Adam'}. Best is trial 8 with value: 0.058022476544747584.
2026-05-18 12:11:35,903 - experiment_functions - INFO - Early stopping at epoch 500. Best Recall: 0.0051
2026-05-18 12:11:36,017 - optuna.study.study - INFO - Trial 9 finished with value: 0.005077833754221742 and parameters: {'n_layers': 1, 'embedding_dim': 96, 'lr': 0.011917720370155056, 'lambda_val': 0.000675338227711686, 'batch_size': 4036, 'optimizer': 'SGD'}. Best is trial 8 with value: 0.058022476544747584.
2026-05-18 12:11:54,476 - experiment_functions - INFO - Early stopping at epoch 1200. Best Recall: 0.0330
2026-05-18 12:11:54,621 - optuna.study.study - INFO - Trial 10 finished with value: 0.03303546685312515 and parameters: {'n_layers': 4, 'embedding_dim': 64, 'lr': 0.0002795429137214948, 'lambda_val': 8.307739508394515e-06, 'batch_size': 1354, 'optimizer': 'Adam'}. Best is trial 8 with value: 0.058022476544747584.
2026-05-18 12:12:09,056 - experiment_functions - INFO - Early stopping at epoch 750. Best Recall: 0.0363
2026-05-18 12:12:09,146 - optuna.study.study - INFO - Trial 11 finished with value: 0.03628038487897511 and parameters: {'n_layers': 3, 'embedding_dim': 256, 'lr': 0.00048724346092456425, 'lambda_val': 0.00034327729168879786, 'batch_size': 2987, 'optimizer': 'Adam'}. Best is trial 8 with value: 0.058022476544747584.
2026-05-18 12:12:46,165 - experiment_functions - INFO - Early stopping at epoch 2300. Best Recall: 0.0355
2026-05-18 12:12:46,930 - optuna.study.study - INFO - Trial 12 finished with value: 0.0354680343567198 and parameters: {'n_layers': 3, 'embedding_dim': 128, 'lr': 0.00013543836244545807, 'lambda_val': 0.0019686854815578435, 'batch_size': 3156, 'optimizer': 'Adam'}. Best is trial 8 with value: 0.058022476544747584.
2026-05-18 12:13:07,040 - experiment_functions - INFO - Early stopping at epoch 800. Best Recall: 0.0617
2026-05-18 12:13:07,131 - optuna.study.study - INFO - Trial 13 finished with value: 0.06172939368873753 and parameters: {'n_layers': 1, 'embedding_dim': 128, 'lr': 0.0014826495733038334, 'lambda_val': 5.123179234475856e-05, 'batch_size': 1476, 'optimizer': 'Adam'}. Best is trial 13 with value: 0.06172939368873753.
2026-05-18 12:13:21,613 - experiment_functions - INFO - Early stopping at epoch 1000. Best Recall: 0.0604
2026-05-18 12:13:21,781 - optuna.study.study - INFO - Trial 14 finished with value: 0.06035584486900436 and parameters: {'n_layers': 1, 'embedding_dim': 64, 'lr': 0.0009976638071262681, 'lambda_val': 4.697545781356829e-05, 'batch_size': 1458, 'optimizer': 'Adam'}. Best is trial 13 with value: 0.06172939368873753.
2026-05-18 12:13:35,613 - optuna.study._optimize - INFO - Trial 15 pruned. 
2026-05-18 12:13:48,393 - experiment_functions - INFO - Early stopping at epoch 850. Best Recall: 0.0619
2026-05-18 12:13:48,495 - optuna.study.study - INFO - Trial 16 finished with value: 0.061860346295700974 and parameters: {'n_layers': 1, 'embedding_dim': 64, 'lr': 0.0011151359903590415, 'lambda_val': 5.6121365447394534e-05, 'batch_size': 1514, 'optimizer': 'RMSprop'}. Best is trial 16 with value: 0.061860346295700974.
2026-05-18 12:13:59,370 - experiment_functions - INFO - Early stopping at epoch 700. Best Recall: 0.0218
2026-05-18 12:13:59,471 - optuna.study.study - INFO - Trial 17 finished with value: 0.021770503601888244 and parameters: {'n_layers': 1, 'embedding_dim': 256, 'lr': 0.011092937998018765, 'lambda_val': 3.68605618745124e-06, 'batch_size': 540, 'optimizer': 'RMSprop'}. Best is trial 16 with value: 0.061860346295700974.
2026-05-18 12:14:13,868 - optuna.study._optimize - INFO - Trial 18 pruned. 
2026-05-18 12:14:23,296 - experiment_functions - INFO - Early stopping at epoch 600. Best Recall: 0.0588
2026-05-18 12:14:23,416 - optuna.study.study - INFO - Trial 19 finished with value: 0.05884596596265231 and parameters: {'n_layers': 1, 'embedding_dim': 64, 'lr': 0.001635936340832529, 'lambda_val': 1.5079809206459469e-05, 'batch_size': 1471, 'optimizer': 'RMSprop'}. Best is trial 16 with value: 0.061860346295700974.
2026-05-18 12:14:36,623 - experiment_functions - INFO - Early stopping at epoch 900. Best Recall: 0.0269
2026-05-18 12:14:36,712 - optuna.study.study - INFO - Trial 20 finished with value: 0.02689322141547992 and parameters: {'n_layers': 1, 'embedding_dim': 128, 'lr': 0.0081150068412137, 'lambda_val': 0.00099150663553888, 'batch_size': 2303, 'optimizer': 'RMSprop'}. Best is trial 16 with value: 0.061860346295700974.
2026-05-18 12:14:51,098 - experiment_functions - INFO - Early stopping at epoch 1000. Best Recall: 0.0603
2026-05-18 12:14:51,188 - optuna.study.study - INFO - Trial 21 finished with value: 0.06034475261649215 and parameters: {'n_layers': 1, 'embedding_dim': 64, 'lr': 0.0010097931964584564, 'lambda_val': 6.043729698466178e-05, 'batch_size': 1545, 'optimizer': 'Adam'}. Best is trial 16 with value: 0.061860346295700974.
2026-05-18 12:15:21,152 - experiment_functions - INFO - Early stopping at epoch 2100. Best Recall: 0.0634
2026-05-18 12:15:21,301 - optuna.study.study - INFO - Trial 22 finished with value: 0.06339200022017667 and parameters: {'n_layers': 1, 'embedding_dim': 64, 'lr': 0.0005715539622647047, 'lambda_val': 8.72377011392776e-05, 'batch_size': 1285, 'optimizer': 'Adam'}. Best is trial 22 with value: 0.06339200022017667.
2026-05-18 12:16:16,977 - optuna.study.study - INFO - Trial 23 finished with value: 0.06979390339363536 and parameters: {'n_layers': 1, 'embedding_dim': 64, 'lr': 0.00047237383424238356, 'lambda_val': 0.00010517142038073241, 'batch_size': 948, 'optimizer': 'RMSprop'}. Best is trial 23 with value: 0.06979390339363536.
2026-05-18 12:16:35,500 - experiment_functions - INFO - Early stopping at epoch 1250. Best Recall: 0.0565
2026-05-18 12:16:35,600 - optuna.study.study - INFO - Trial 24 finished with value: 0.056464555167654716 and parameters: {'n_layers': 2, 'embedding_dim': 64, 'lr': 0.00047140485603491453, 'lambda_val': 9.871495842099448e-05, 'batch_size': 864, 'optimizer': 'RMSprop'}. Best is trial 23 with value: 0.06979390339363536.
2026-05-18 12:16:51,903 - experiment_functions - INFO - Early stopping at epoch 950. Best Recall: 0.0058
2026-05-18 12:16:52,004 - optuna.study.study - INFO - Trial 25 finished with value: 0.005805225142123372 and parameters: {'n_layers': 1, 'embedding_dim': 64, 'lr': 8.676611398424205e-05, 'lambda_val': 0.0003143970816025115, 'batch_size': 773, 'optimizer': 'RMSprop'}. Best is trial 23 with value: 0.06979390339363536.
2026-05-18 12:17:05,385 - experiment_functions - INFO - Early stopping at epoch 900. Best Recall: 0.0522
2026-05-18 12:17:05,541 - optuna.study.study - INFO - Trial 26 finished with value: 0.0521524827370661 and parameters: {'n_layers': 2, 'embedding_dim': 64, 'lr': 0.0004885585344467751, 'lambda_val': 5.148314172012791e-06, 'batch_size': 1858, 'optimizer': 'RMSprop'}. Best is trial 23 with value: 0.06979390339363536.
2026-05-18 12:17:19,349 - optuna.study._optimize - INFO - Trial 27 pruned. 
2026-05-18 12:17:40,511 - optuna.study._optimize - INFO - Trial 28 pruned. 
2026-05-18 12:17:51,235 - experiment_functions - INFO - Early stopping at epoch 500. Best Recall: 0.0049
2026-05-18 12:17:51,348 - optuna.study.study - INFO - Trial 29 finished with value: 0.004923538382567246 and parameters: {'n_layers': 2, 'embedding_dim': 256, 'lr': 0.025472594255653944, 'lambda_val': 1.1711098946059153e-06, 'batch_size': 2057, 'optimizer': 'SGD'}. Best is trial 23 with value: 0.06979390339363536.
2026-05-18 12:18:12,475 - optuna.study._optimize - INFO - Trial 30 pruned. 
2026-05-18 12:18:32,570 - experiment_functions - INFO - Early stopping at epoch 700. Best Recall: 0.0612
2026-05-18 12:18:32,762 - optuna.study.study - INFO - Trial 31 finished with value: 0.061234261278073764 and parameters: {'n_layers': 1, 'embedding_dim': 128, 'lr': 0.0018073634386246574, 'lambda_val': 2.9768995849831953e-05, 'batch_size': 1777, 'optimizer': 'Adam'}. Best is trial 23 with value: 0.06979390339363536.
2026-05-18 12:18:42,726 - experiment_functions - INFO - Early stopping at epoch 650. Best Recall: 0.0569
2026-05-18 12:18:42,828 - optuna.study.study - INFO - Trial 32 finished with value: 0.05688600530646311 and parameters: {'n_layers': 1, 'embedding_dim': 64, 'lr': 0.0032475590806923657, 'lambda_val': 0.00024594038547096666, 'batch_size': 1154, 'optimizer': 'Adam'}. Best is trial 23 with value: 0.06979390339363536.
2026-05-18 12:19:01,240 - experiment_functions - INFO - Early stopping at epoch 1250. Best Recall: 0.0615
2026-05-18 12:19:01,329 - optuna.study.study - INFO - Trial 33 finished with value: 0.06151939277474114 and parameters: {'n_layers': 1, 'embedding_dim': 128, 'lr': 0.000667277671812206, 'lambda_val': 8.101289904380897e-05, 'batch_size': 1649, 'optimizer': 'Adam'}. Best is trial 23 with value: 0.06979390339363536.
2026-05-18 12:19:08,769 - experiment_functions - INFO - Early stopping at epoch 500. Best Recall: 0.0049
2026-05-18 12:19:08,870 - optuna.study.study - INFO - Trial 34 finished with value: 0.004937952328071812 and parameters: {'n_layers': 1, 'embedding_dim': 64, 'lr': 0.0018957399783189573, 'lambda_val': 2.1289907499509773e-05, 'batch_size': 2216, 'optimizer': 'SGD'}. Best is trial 23 with value: 0.06979390339363536.
2026-05-18 12:19:17,467 - experiment_functions - INFO - Early stopping at epoch 550. Best Recall: 0.0519
2026-05-18 12:19:17,566 - optuna.study.study - INFO - Trial 35 finished with value: 0.05188412357163489 and parameters: {'n_layers': 2, 'embedding_dim': 32, 'lr': 0.005845526787706993, 'lambda_val': 0.00018525114637231018, 'batch_size': 2073, 'optimizer': 'Adam'}. Best is trial 23 with value: 0.06979390339363536.
2026-05-18 12:19:27,350 - experiment_functions - INFO - Early stopping at epoch 600. Best Recall: 0.0521
2026-05-18 12:19:28,113 - optuna.study.study - INFO - Trial 36 finished with value: 0.05208775506844605 and parameters: {'n_layers': 1, 'embedding_dim': 128, 'lr': 0.0016050658625431503, 'lambda_val': 6.0709144755863455e-05, 'batch_size': 1238, 'optimizer': 'RMSprop'}. Best is trial 23 with value: 0.06979390339363536.
2026-05-18 12:19:52,225 - experiment_functions - INFO - Early stopping at epoch 950. Best Recall: 0.0607
2026-05-18 12:19:52,369 - optuna.study.study - INFO - Trial 37 finished with value: 0.06070875918574758 and parameters: {'n_layers': 2, 'embedding_dim': 64, 'lr': 0.0007531556938260158, 'lambda_val': 2.746021654620433e-06, 'batch_size': 975, 'optimizer': 'Adam'}. Best is trial 23 with value: 0.06979390339363536.
2026-05-18 12:19:59,804 - experiment_functions - INFO - Early stopping at epoch 500. Best Recall: 0.0055
2026-05-18 12:19:59,895 - optuna.study.study - INFO - Trial 38 finished with value: 0.005507897336598609 and parameters: {'n_layers': 1, 'embedding_dim': 96, 'lr': 0.0036109841173600026, 'lambda_val': 0.00043211264600508554, 'batch_size': 2525, 'optimizer': 'SGD'}. Best is trial 23 with value: 0.06979390339363536.
2026-05-18 12:20:07,178 - experiment_functions - INFO - Early stopping at epoch 500. Best Recall: 0.0051
2026-05-18 12:20:07,278 - optuna.study.study - INFO - Trial 39 finished with value: 0.00508186039934869 and parameters: {'n_layers': 2, 'embedding_dim': 32, 'lr': 1.101636294060299e-05, 'lambda_val': 0.0016570667832614574, 'batch_size': 1951, 'optimizer': 'RMSprop'}. Best is trial 23 with value: 0.06979390339363536.
2026-05-18 12:20:23,166 - experiment_functions - INFO - Early stopping at epoch 800. Best Recall: 0.0234
2026-05-18 12:20:23,265 - optuna.study.study - INFO - Trial 40 finished with value: 0.023393780171826133 and parameters: {'n_layers': 4, 'embedding_dim': 256, 'lr': 0.019834549460933017, 'lambda_val': 0.00012770970843203864, 'batch_size': 3692, 'optimizer': 'Adam'}. Best is trial 23 with value: 0.06979390339363536.
2026-05-18 12:20:47,582 - experiment_functions - INFO - Early stopping at epoch 1650. Best Recall: 0.0585
2026-05-18 12:20:47,691 - optuna.study.study - INFO - Trial 41 finished with value: 0.05848380663461354 and parameters: {'n_layers': 1, 'embedding_dim': 128, 'lr': 0.000509492509527678, 'lambda_val': 8.80812263675976e-05, 'batch_size': 1631, 'optimizer': 'Adam'}. Best is trial 23 with value: 0.06979390339363536.
2026-05-18 12:21:11,604 - experiment_functions - INFO - Early stopping at epoch 1250. Best Recall: 0.0618
2026-05-18 12:21:12,373 - optuna.study.study - INFO - Trial 42 finished with value: 0.0617908951154441 and parameters: {'n_layers': 1, 'embedding_dim': 128, 'lr': 0.0006980841734122014, 'lambda_val': 3.607889835362602e-05, 'batch_size': 1655, 'optimizer': 'Adam'}. Best is trial 23 with value: 0.06979390339363536.
2026-05-18 12:21:29,896 - optuna.study._optimize - INFO - Trial 43 pruned. 
2026-05-18 12:21:44,662 - experiment_functions - INFO - Early stopping at epoch 1000. Best Recall: 0.0593
2026-05-18 12:21:44,761 - optuna.study.study - INFO - Trial 44 finished with value: 0.05925901175030312 and parameters: {'n_layers': 1, 'embedding_dim': 128, 'lr': 0.0013096691573368342, 'lambda_val': 2.8470063680318536e-05, 'batch_size': 616, 'optimizer': 'Adam'}. Best is trial 23 with value: 0.06979390339363536.
2026-05-18 12:21:55,193 - experiment_functions - INFO - Early stopping at epoch 700. Best Recall: 0.0599
2026-05-18 12:21:55,284 - optuna.study.study - INFO - Trial 45 finished with value: 0.05992211844410906 and parameters: {'n_layers': 1, 'embedding_dim': 96, 'lr': 0.0022520117228410734, 'lambda_val': 0.00020473910419836408, 'batch_size': 1483, 'optimizer': 'Adam'}. Best is trial 23 with value: 0.06979390339363536.
2026-05-18 12:22:10,236 - optuna.study._optimize - INFO - Trial 46 pruned. 
2026-05-18 12:22:17,641 - experiment_functions - INFO - Early stopping at epoch 500. Best Recall: 0.0050
2026-05-18 12:22:17,741 - optuna.study.study - INFO - Trial 47 finished with value: 0.0049928764461925615 and parameters: {'n_layers': 1, 'embedding_dim': 64, 'lr': 0.0010947427331913556, 'lambda_val': 1.553239268958108e-05, 'batch_size': 861, 'optimizer': 'SGD'}. Best is trial 23 with value: 0.06979390339363536.
2026-05-18 12:22:37,260 - experiment_functions - INFO - Early stopping at epoch 1400. Best Recall: 0.0640
2026-05-18 12:22:37,392 - optuna.study.study - INFO - Trial 48 finished with value: 0.06396142524920431 and parameters: {'n_layers': 1, 'embedding_dim': 32, 'lr': 0.0007040684137780526, 'lambda_val': 5.743767319759486e-06, 'batch_size': 1714, 'optimizer': 'Adam'}. Best is trial 23 with value: 0.06979390339363536.
2026-05-18 12:22:51,423 - optuna.study._optimize - INFO - Trial 49 pruned. 
2026-05-18 12:23:10,062 - optuna.study._optimize - INFO - Trial 50 pruned. 
2026-05-18 12:23:24,218 - optuna.study._optimize - INFO - Trial 51 pruned. 
2026-05-18 12:23:38,293 - optuna.study._optimize - INFO - Trial 52 pruned. 
2026-05-18 12:23:57,237 - optuna.study._optimize - INFO - Trial 53 pruned. 
2026-05-18 12:24:07,691 - experiment_functions - INFO - Early stopping at epoch 700. Best Recall: 0.0450
2026-05-18 12:24:07,793 - optuna.study.study - INFO - Trial 54 finished with value: 0.04503407402196659 and parameters: {'n_layers': 1, 'embedding_dim': 64, 'lr': 0.002780222060313691, 'lambda_val': 0.09677684292811993, 'batch_size': 956, 'optimizer': 'Adam'}. Best is trial 23 with value: 0.06979390339363536.
2026-05-18 12:24:16,690 - experiment_functions - INFO - Early stopping at epoch 550. Best Recall: 0.0345
2026-05-18 12:24:16,780 - optuna.study.study - INFO - Trial 55 finished with value: 0.034531543174629746 and parameters: {'n_layers': 3, 'embedding_dim': 96, 'lr': 0.0011606746861725003, 'lambda_val': 0.00016621702609109562, 'batch_size': 1551, 'optimizer': 'RMSprop'}. Best is trial 23 with value: 0.06979390339363536.
2026-05-18 12:24:31,518 - optuna.study._optimize - INFO - Trial 56 pruned. 
2026-05-18 12:24:40,428 - experiment_functions - INFO - Early stopping at epoch 550. Best Recall: 0.0299
2026-05-18 12:24:40,518 - optuna.study.study - INFO - Trial 57 finished with value: 0.029864065131186317 and parameters: {'n_layers': 1, 'embedding_dim': 64, 'lr': 0.004233153125937516, 'lambda_val': 0.00047847953140173454, 'batch_size': 1707, 'optimizer': 'RMSprop'}. Best is trial 23 with value: 0.06979390339363536.
2026-05-18 12:24:53,746 - experiment_functions - INFO - Early stopping at epoch 900. Best Recall: 0.0562
2026-05-18 12:24:53,881 - optuna.study.study - INFO - Trial 58 finished with value: 0.056152988165989556 and parameters: {'n_layers': 1, 'embedding_dim': 128, 'lr': 0.0008788719773819069, 'lambda_val': 3.952966285077444e-05, 'batch_size': 2250, 'optimizer': 'Adam'}. Best is trial 23 with value: 0.06979390339363536.
2026-05-18 12:25:08,031 - optuna.study._optimize - INFO - Trial 59 pruned. 
2026-05-18 12:25:21,977 - experiment_functions - INFO - Early stopping at epoch 900. Best Recall: 0.0455
2026-05-18 12:25:22,076 - optuna.study.study - INFO - Trial 60 finished with value: 0.04551317569957373 and parameters: {'n_layers': 2, 'embedding_dim': 64, 'lr': 0.0005930899742938545, 'lambda_val': 4.052466140134983e-06, 'batch_size': 2711, 'optimizer': 'Adam'}. Best is trial 23 with value: 0.06979390339363536.
2026-05-18 12:25:35,172 - experiment_functions - INFO - Early stopping at epoch 850. Best Recall: 0.0593
2026-05-18 12:25:35,293 - optuna.study.study - INFO - Trial 61 finished with value: 0.059305117804979206 and parameters: {'n_layers': 1, 'embedding_dim': 128, 'lr': 0.0013488527009317343, 'lambda_val': 8.035917222484545e-05, 'batch_size': 1652, 'optimizer': 'Adam'}. Best is trial 23 with value: 0.06979390339363536.
2026-05-18 12:25:54,196 - optuna.study._optimize - INFO - Trial 62 pruned. 
2026-05-18 12:26:05,032 - experiment_functions - INFO - Early stopping at epoch 700. Best Recall: 0.0545
