2026-05-19 02:07:47,216 - optuna.study.study - INFO - Trial 61 finished with value: 0.04792342064191542 and parameters: {'n_layers': 1, 'embedding_dim': 64, 'lr': 0.006230863943758851, 'lambda_val': 0.0005918277764244286, 'batch_size': 1272, 'optimizer': 'Adam'}. Best is trial 47 with value: 0.06401754977421206.
2026-05-19 02:07:55,921 - experiment_functions - INFO - Early stopping at epoch 550. Best Recall: 0.0566
2026-05-19 02:07:56,025 - optuna.study.study - INFO - Trial 62 finished with value: 0.05659480936222878 and parameters: {'n_layers': 1, 'embedding_dim': 64, 'lr': 0.010402537569141517, 'lambda_val': 0.0036878440513826924, 'batch_size': 1827, 'optimizer': 'Adam'}. Best is trial 47 with value: 0.06401754977421206.
2026-05-19 02:08:05,171 - experiment_functions - INFO - Early stopping at epoch 600. Best Recall: 0.0137
2026-05-19 02:08:05,272 - optuna.study.study - INFO - Trial 63 finished with value: 0.013652923266328228 and parameters: {'n_layers': 1, 'embedding_dim': 64, 'lr': 0.054725208724501956, 'lambda_val': 0.0002859085460380385, 'batch_size': 1155, 'optimizer': 'Adam'}. Best is trial 47 with value: 0.06401754977421206.
2026-05-19 02:08:18,261 - experiment_functions - INFO - Early stopping at epoch 700. Best Recall: 0.0626
2026-05-19 02:08:18,364 - optuna.study.study - INFO - Trial 64 finished with value: 0.06259673464542079 and parameters: {'n_layers': 1, 'embedding_dim': 64, 'lr': 0.0022368591962538082, 'lambda_val': 0.000998132466850388, 'batch_size': 1383, 'optimizer': 'Adam'}. Best is trial 47 with value: 0.06401754977421206.
2026-05-19 02:08:29,321 - experiment_functions - INFO - Early stopping at epoch 550. Best Recall: 0.0288
2026-05-19 02:08:29,414 - optuna.study.study - INFO - Trial 65 finished with value: 0.028778601996167108 and parameters: {'n_layers': 1, 'embedding_dim': 64, 'lr': 0.018817533897463837, 'lambda_val': 0.0009034318576314808, 'batch_size': 1397, 'optimizer': 'Adam'}. Best is trial 47 with value: 0.06401754977421206.
2026-05-19 02:08:36,601 - experiment_functions - INFO - Early stopping at epoch 500. Best Recall: 0.0049
2026-05-19 02:08:36,693 - optuna.study.study - INFO - Trial 66 finished with value: 0.004917412523573024 and parameters: {'n_layers': 1, 'embedding_dim': 32, 'lr': 0.001931427811803321, 'lambda_val': 0.01935397901281722, 'batch_size': 1054, 'optimizer': 'SGD'}. Best is trial 47 with value: 0.06401754977421206.
2026-05-19 02:08:52,769 - experiment_functions - INFO - Early stopping at epoch 1100. Best Recall: 0.0631
2026-05-19 02:08:52,872 - optuna.study.study - INFO - Trial 67 finished with value: 0.06308539576902965 and parameters: {'n_layers': 1, 'embedding_dim': 64, 'lr': 0.001253778025022661, 'lambda_val': 0.00019089482690583132, 'batch_size': 813, 'optimizer': 'Adam'}. Best is trial 47 with value: 0.06401754977421206.
2026-05-19 02:09:13,678 - experiment_functions - INFO - Early stopping at epoch 1300. Best Recall: 0.0669
2026-05-19 02:09:13,797 - optuna.study.study - INFO - Trial 68 finished with value: 0.06688600591487161 and parameters: {'n_layers': 1, 'embedding_dim': 64, 'lr': 0.0010386642182612172, 'lambda_val': 0.00018624562350924256, 'batch_size': 806, 'optimizer': 'Adam'}. Best is trial 68 with value: 0.06688600591487161.
2026-05-19 02:09:33,031 - experiment_functions - INFO - Early stopping at epoch 1100. Best Recall: 0.0670
2026-05-19 02:09:33,138 - optuna.study.study - INFO - Trial 69 finished with value: 0.06696333330599523 and parameters: {'n_layers': 1, 'embedding_dim': 64, 'lr': 0.0010805331037962783, 'lambda_val': 0.00013882344369590743, 'batch_size': 979, 'optimizer': 'Adam'}. Best is trial 69 with value: 0.06696333330599523.
2026-05-19 02:09:54,309 - experiment_functions - INFO - Early stopping at epoch 1500. Best Recall: 0.0610
2026-05-19 02:09:54,446 - optuna.study.study - INFO - Trial 70 finished with value: 0.060956348083722606 and parameters: {'n_layers': 1, 'embedding_dim': 64, 'lr': 0.0006474592866673948, 'lambda_val': 0.00011194913488610498, 'batch_size': 1634, 'optimizer': 'Adam'}. Best is trial 69 with value: 0.06696333330599523.
2026-05-19 02:10:18,696 - experiment_functions - INFO - Early stopping at epoch 1500. Best Recall: 0.0622
2026-05-19 02:10:18,788 - optuna.study.study - INFO - Trial 71 finished with value: 0.06223058927310422 and parameters: {'n_layers': 1, 'embedding_dim': 64, 'lr': 0.0006090049094229401, 'lambda_val': 0.00015858195211527825, 'batch_size': 1669, 'optimizer': 'Adam'}. Best is trial 69 with value: 0.06696333330599523.
2026-05-19 02:10:37,299 - experiment_functions - INFO - Early stopping at epoch 1100. Best Recall: 0.0660
2026-05-19 02:10:37,402 - optuna.study.study - INFO - Trial 72 finished with value: 0.06597527118003307 and parameters: {'n_layers': 1, 'embedding_dim': 64, 'lr': 0.0010755720015119452, 'lambda_val': 0.00019815385541333992, 'batch_size': 944, 'optimizer': 'Adam'}. Best is trial 69 with value: 0.06696333330599523.
2026-05-19 02:10:53,940 - experiment_functions - INFO - Early stopping at epoch 1000. Best Recall: 0.0644
2026-05-19 02:10:54,032 - optuna.study.study - INFO - Trial 73 finished with value: 0.0643862342273171 and parameters: {'n_layers': 1, 'embedding_dim': 64, 'lr': 0.0012295028074636098, 'lambda_val': 0.00017955483830348358, 'batch_size': 952, 'optimizer': 'Adam'}. Best is trial 69 with value: 0.06696333330599523.
2026-05-19 02:11:09,713 - experiment_functions - INFO - Early stopping at epoch 1100. Best Recall: 0.0658
2026-05-19 02:11:09,804 - optuna.study.study - INFO - Trial 74 finished with value: 0.06580803218669068 and parameters: {'n_layers': 1, 'embedding_dim': 64, 'lr': 0.001204269398981649, 'lambda_val': 0.00018559205527564777, 'batch_size': 956, 'optimizer': 'Adam'}. Best is trial 69 with value: 0.06696333330599523.
2026-05-19 02:11:20,807 - experiment_functions - INFO - Early stopping at epoch 700. Best Recall: 0.0368
2026-05-19 02:11:21,636 - optuna.study.study - INFO - Trial 75 finished with value: 0.03681833547416467 and parameters: {'n_layers': 4, 'embedding_dim': 32, 'lr': 0.0010307316304218755, 'lambda_val': 6.427223168637844e-05, 'batch_size': 966, 'optimizer': 'Adam'}. Best is trial 69 with value: 0.06696333330599523.
2026-05-19 02:11:36,689 - experiment_functions - INFO - Early stopping at epoch 1000. Best Recall: 0.0637
2026-05-19 02:11:36,793 - optuna.study.study - INFO - Trial 76 finished with value: 0.06366782411051496 and parameters: {'n_layers': 1, 'embedding_dim': 64, 'lr': 0.0014246287674785634, 'lambda_val': 0.0001952357155107814, 'batch_size': 608, 'optimizer': 'Adam'}. Best is trial 69 with value: 0.06696333330599523.
2026-05-19 02:11:46,819 - experiment_functions - INFO - Early stopping at epoch 500. Best Recall: 0.0054
2026-05-19 02:11:46,922 - optuna.study.study - INFO - Trial 77 finished with value: 0.005403926169290515 and parameters: {'n_layers': 1, 'embedding_dim': 64, 'lr': 0.001254282081366494, 'lambda_val': 0.00019921138100792343, 'batch_size': 609, 'optimizer': 'SGD'}. Best is trial 69 with value: 0.06696333330599523.
2026-05-19 02:12:02,762 - experiment_functions - INFO - Early stopping at epoch 950. Best Recall: 0.0613
2026-05-19 02:12:02,977 - optuna.study.study - INFO - Trial 78 finished with value: 0.06125523719480493 and parameters: {'n_layers': 1, 'embedding_dim': 96, 'lr': 0.0013372998841154004, 'lambda_val': 0.00040753357677534533, 'batch_size': 867, 'optimizer': 'Adam'}. Best is trial 69 with value: 0.06696333330599523.
2026-05-19 02:12:34,049 - experiment_functions - INFO - Early stopping at epoch 2250. Best Recall: 0.0645
2026-05-19 02:12:34,164 - optuna.study.study - INFO - Trial 79 finished with value: 0.0644808631827638 and parameters: {'n_layers': 1, 'embedding_dim': 64, 'lr': 0.0007213400647895048, 'lambda_val': 0.00012691535115297078, 'batch_size': 775, 'optimizer': 'Adam'}. Best is trial 69 with value: 0.06696333330599523.
2026-05-19 02:12:54,879 - experiment_functions - INFO - Early stopping at epoch 1300. Best Recall: 0.0581
2026-05-19 02:12:54,972 - optuna.study.study - INFO - Trial 80 finished with value: 0.05814251121269584 and parameters: {'n_layers': 1, 'embedding_dim': 256, 'lr': 0.0006923267159633841, 'lambda_val': 0.00013245174854519722, 'batch_size': 1038, 'optimizer': 'Adam'}. Best is trial 69 with value: 0.06696333330599523.
2026-05-19 02:13:10,466 - optuna.study._optimize - INFO - Trial 81 pruned. 
2026-05-19 02:13:32,356 - experiment_functions - INFO - Early stopping at epoch 1400. Best Recall: 0.0655
2026-05-19 02:13:32,458 - optuna.study.study - INFO - Trial 82 finished with value: 0.06550016440399697 and parameters: {'n_layers': 1, 'embedding_dim': 64, 'lr': 0.0010050472914901814, 'lambda_val': 0.0002360513666292072, 'batch_size': 629, 'optimizer': 'Adam'}. Best is trial 69 with value: 0.06696333330599523.
2026-05-19 02:13:57,106 - experiment_functions - INFO - Early stopping at epoch 1450. Best Recall: 0.0697
2026-05-19 02:13:57,281 - optuna.study.study - INFO - Trial 83 finished with value: 0.06965503054218432 and parameters: {'n_layers': 1, 'embedding_dim': 64, 'lr': 0.0009368059565352642, 'lambda_val': 0.0002841337669928949, 'batch_size': 627, 'optimizer': 'Adam'}. Best is trial 83 with value: 0.06965503054218432.
2026-05-19 02:14:11,646 - optuna.study._optimize - INFO - Trial 84 pruned. 
2026-05-19 02:14:32,528 - experiment_functions - INFO - Early stopping at epoch 1450. Best Recall: 0.0656
2026-05-19 02:14:32,665 - optuna.study.study - INFO - Trial 85 finished with value: 0.06563527182083143 and parameters: {'n_layers': 1, 'embedding_dim': 64, 'lr': 0.0009746557863730443, 'lambda_val': 3.0340782889080178e-05, 'batch_size': 632, 'optimizer': 'Adam'}. Best is trial 83 with value: 0.06965503054218432.
2026-05-19 02:14:57,440 - experiment_functions - INFO - Early stopping at epoch 1650. Best Recall: 0.0666
2026-05-19 02:14:57,542 - optuna.study.study - INFO - Trial 86 finished with value: 0.06659797404410518 and parameters: {'n_layers': 1, 'embedding_dim': 64, 'lr': 0.0009606764593671038, 'lambda_val': 7.495676791953965e-05, 'batch_size': 513, 'optimizer': 'Adam'}. Best is trial 83 with value: 0.06965503054218432.
2026-05-19 02:15:16,178 - optuna.study._optimize - INFO - Trial 87 pruned. 
2026-05-19 02:15:41,404 - experiment_functions - INFO - Early stopping at epoch 1550. Best Recall: 0.0710
2026-05-19 02:15:41,503 - optuna.study.study - INFO - Trial 88 finished with value: 0.07101789822319082 and parameters: {'n_layers': 1, 'embedding_dim': 64, 'lr': 0.0008731130748682855, 'lambda_val': 5.747499730023513e-05, 'batch_size': 659, 'optimizer': 'Adam'}. Best is trial 88 with value: 0.07101789822319082.
2026-05-19 02:15:48,867 - experiment_functions - INFO - Early stopping at epoch 500. Best Recall: 0.0050
2026-05-19 02:15:48,960 - optuna.study.study - INFO - Trial 89 finished with value: 0.005008312247824653 and parameters: {'n_layers': 1, 'embedding_dim': 32, 'lr': 0.0009267442522639058, 'lambda_val': 7.431068229877283e-05, 'batch_size': 643, 'optimizer': 'SGD'}. Best is trial 88 with value: 0.07101789822319082.
2026-05-19 02:16:10,956 - optuna.study._optimize - INFO - Trial 90 pruned. 
2026-05-19 02:16:34,009 - optuna.study._optimize - INFO - Trial 91 pruned. 
2026-05-19 02:16:48,382 - optuna.study._optimize - INFO - Trial 92 pruned. 
2026-05-19 02:17:03,032 - experiment_functions - INFO - Early stopping at epoch 800. Best Recall: 0.0634
2026-05-19 02:17:03,124 - optuna.study.study - INFO - Trial 93 finished with value: 0.06337554645765762 and parameters: {'n_layers': 1, 'embedding_dim': 64, 'lr': 0.0018639916394821408, 'lambda_val': 4.996559331126629e-05, 'batch_size': 856, 'optimizer': 'Adam'}. Best is trial 88 with value: 0.07101789822319082.
2026-05-19 02:17:18,332 - optuna.study._optimize - INFO - Trial 94 pruned. 
2026-05-19 02:17:36,693 - experiment_functions - INFO - Early stopping at epoch 1150. Best Recall: 0.0613
2026-05-19 02:17:36,808 - optuna.study.study - INFO - Trial 95 finished with value: 0.06129232562193 and parameters: {'n_layers': 1, 'embedding_dim': 96, 'lr': 0.0010688771857877014, 'lambda_val': 3.158925822584131e-05, 'batch_size': 758, 'optimizer': 'Adam'}. Best is trial 88 with value: 0.07101789822319082.
2026-05-19 02:18:18,353 - experiment_functions - INFO - Early stopping at epoch 2250. Best Recall: 0.0687
2026-05-19 02:18:18,444 - optuna.study.study - INFO - Trial 96 finished with value: 0.06866186579824901 and parameters: {'n_layers': 1, 'embedding_dim': 64, 'lr': 0.000839227746731942, 'lambda_val': 8.802165246185911e-05, 'batch_size': 522, 'optimizer': 'Adam'}. Best is trial 88 with value: 0.07101789822319082.
2026-05-19 02:18:32,850 - optuna.study._optimize - INFO - Trial 97 pruned. 
2026-05-19 02:18:49,876 - optuna.study._optimize - INFO - Trial 98 pruned. 
2026-05-19 02:19:02,136 - experiment_functions - INFO - Early stopping at epoch 800. Best Recall: 0.0633
2026-05-19 02:19:02,229 - optuna.study.study - INFO - Trial 99 finished with value: 0.06334558425942308 and parameters: {'n_layers': 1, 'embedding_dim': 64, 'lr': 0.001730855055433988, 'lambda_val': 0.0002451263970952873, 'batch_size': 1095, 'optimizer': 'Adam'}. Best is trial 88 with value: 0.07101789822319082.
2026-05-19 02:19:24,807 - experiment_functions - INFO - Early stopping at epoch 1400. Best Recall: 0.0663
2026-05-19 02:19:24,900 - optuna.study.study - INFO - Trial 100 finished with value: 0.0663161167758715 and parameters: {'n_layers': 1, 'embedding_dim': 64, 'lr': 0.0008914046037459176, 'lambda_val': 7.817552497612793e-05, 'batch_size': 895, 'optimizer': 'Adam'}. Best is trial 88 with value: 0.07101789822319082.
2026-05-19 02:19:39,630 - optuna.study._optimize - INFO - Trial 101 pruned. 
2026-05-19 02:20:15,443 - experiment_functions - INFO - Early stopping at epoch 2050. Best Recall: 0.0674
2026-05-19 02:20:15,569 - optuna.study.study - INFO - Trial 102 finished with value: 0.06742183709657823 and parameters: {'n_layers': 1, 'embedding_dim': 64, 'lr': 0.0008924893490518867, 'lambda_val': 8.233023047564433e-05, 'batch_size': 574, 'optimizer': 'Adam'}. Best is trial 88 with value: 0.07101789822319082.
2026-05-19 02:20:40,856 - experiment_functions - INFO - Early stopping at epoch 1650. Best Recall: 0.0687
2026-05-19 02:20:40,948 - optuna.study.study - INFO - Trial 103 finished with value: 0.0686536411792917 and parameters: {'n_layers': 1, 'embedding_dim': 64, 'lr': 0.0009196732157845104, 'lambda_val': 2.3786569617232054e-05, 'batch_size': 591, 'optimizer': 'Adam'}. Best is trial 88 with value: 0.07101789822319082.
2026-05-19 02:21:30,639 - optuna.study._optimize - INFO - Trial 104 pruned. 
2026-05-19 02:21:50,303 - optuna.study._optimize - INFO - Trial 105 pruned. 
2026-05-19 02:22:18,593 - optuna.study._optimize - INFO - Trial 106 pruned. 
2026-05-19 02:22:37,500 - experiment_functions - INFO - Early stopping at epoch 750. Best Recall: 0.0657
2026-05-19 02:22:37,593 - optuna.study.study - INFO - Trial 107 finished with value: 0.06569609735596244 and parameters: {'n_layers': 1, 'embedding_dim': 64, 'lr': 0.0020851511729676714, 'lambda_val': 6.686822439637266e-05, 'batch_size': 1001, 'optimizer': 'Adam'}. Best is trial 88 with value: 0.07101789822319082.
2026-05-19 02:22:53,780 - experiment_functions - INFO - Early stopping at epoch 1000. Best Recall: 0.0645
2026-05-19 02:22:53,885 - optuna.study.study - INFO - Trial 108 finished with value: 0.0644749661515297 and parameters: {'n_layers': 1, 'embedding_dim': 64, 'lr': 0.001155606672844251, 'lambda_val': 3.947715469577761e-05, 'batch_size': 893, 'optimizer': 'Adam'}. Best is trial 88 with value: 0.07101789822319082.
2026-05-19 02:23:01,544 - experiment_functions - INFO - Early stopping at epoch 500. Best Recall: 0.0049
2026-05-19 02:23:01,646 - optuna.study.study - INFO - Trial 109 finished with value: 0.004942156781294906 and parameters: {'n_layers': 1, 'embedding_dim': 64, 'lr': 0.0005394799638832369, 'lambda_val': 7.810787611563362e-05, 'batch_size': 573, 'optimizer': 'SGD'}. Best is trial 88 with value: 0.07101789822319082.
2026-05-19 02:23:25,044 - optuna.study._optimize - INFO - Trial 110 pruned. 
2026-05-19 02:23:55,475 - experiment_functions - INFO - Early stopping at epoch 750. Best Recall: 0.0651
2026-05-19 02:23:55,579 - optuna.study.study - INFO - Trial 111 finished with value: 0.06505748541740658 and parameters: {'n_layers': 1, 'embedding_dim': 64, 'lr': 0.0021817176920299404, 'lambda_val': 5.873037535875696e-05, 'batch_size': 1007, 'optimizer': 'Adam'}. Best is trial 88 with value: 0.07101789822319082.
2026-05-19 02:24:11,001 - experiment_functions - INFO - Early stopping at epoch 900. Best Recall: 0.0634
2026-05-19 02:24:11,093 - optuna.study.study - INFO - Trial 112 finished with value: 0.06337959728474311 and parameters: {'n_layers': 1, 'embedding_dim': 64, 'lr': 0.0014393182536818665, 'lambda_val': 0.0001153593895662686, 'batch_size': 1095, 'optimizer': 'Adam'}. Best is trial 88 with value: 0.07101789822319082.
2026-05-19 02:24:27,740 - experiment_functions - INFO - Early stopping at epoch 850. Best Recall: 0.0658
2026-05-19 02:24:27,844 - optuna.study.study - INFO - Trial 113 finished with value: 0.06579659529838246 and parameters: {'n_layers': 1, 'embedding_dim': 64, 'lr': 0.0018559996620172163, 'lambda_val': 7.440123829548695e-05, 'batch_size': 693, 'optimizer': 'Adam'}. Best is trial 88 with value: 0.07101789822319082.
2026-05-19 02:24:51,142 - experiment_functions - INFO - Early stopping at epoch 950. Best Recall: 0.0641
2026-05-19 02:24:51,245 - optuna.study.study - INFO - Trial 114 finished with value: 0.06407984346104155 and parameters: {'n_layers': 1, 'embedding_dim': 64, 'lr': 0.0016331603103178624, 'lambda_val': 8.371324078599107e-05, 'batch_size': 668, 'optimizer': 'Adam'}. Best is trial 88 with value: 0.07101789822319082.
2026-05-19 02:25:14,248 - experiment_functions - INFO - Early stopping at epoch 1100. Best Recall: 0.0647
2026-05-19 02:25:14,361 - optuna.study.study - INFO - Trial 115 finished with value: 0.06472589614077769 and parameters: {'n_layers': 1, 'embedding_dim': 64, 'lr': 0.001233281312700628, 'lambda_val': 0.00033138270555045543, 'batch_size': 819, 'optimizer': 'Adam'}. Best is trial 88 with value: 0.07101789822319082.
2026-05-19 02:25:23,196 - experiment_functions - INFO - Early stopping at epoch 550. Best Recall: 0.0486
2026-05-19 02:25:23,290 - optuna.study.study - INFO - Trial 116 finished with value: 0.04857242313565119 and parameters: {'n_layers': 1, 'embedding_dim': 96, 'lr': 0.0024949162268747683, 'lambda_val': 0.00014576639946518305, 'batch_size': 707, 'optimizer': 'RMSprop'}. Best is trial 88 with value: 0.07101789822319082.
2026-05-19 02:25:35,113 - experiment_functions - INFO - Early stopping at epoch 700. Best Recall: 0.0425
2026-05-19 02:25:35,206 - optuna.study.study - INFO - Trial 117 finished with value: 0.04247943678860583 and parameters: {'n_layers': 4, 'embedding_dim': 64, 'lr': 0.0008243194516272855, 'lambda_val': 0.00046737284394214113, 'batch_size': 521, 'optimizer': 'Adam'}. Best is trial 88 with value: 0.07101789822319082.
2026-05-19 02:25:54,870 - experiment_functions - INFO - Early stopping at epoch 850. Best Recall: 0.0467
2026-05-19 02:25:54,972 - optuna.study.study - INFO - Trial 118 finished with value: 0.046694141606931965 and parameters: {'n_layers': 3, 'embedding_dim': 128, 'lr': 0.000601893883823036, 'lambda_val': 0.00010372474377582337, 'batch_size': 882, 'optimizer': 'Adam'}. Best is trial 88 with value: 0.07101789822319082.
2026-05-19 02:26:10,372 - optuna.study._optimize - INFO - Trial 119 pruned. 
2026-05-19 02:26:24,672 - experiment_functions - INFO - Early stopping at epoch 650. Best Recall: 0.0598
2026-05-19 02:26:24,788 - optuna.study.study - INFO - Trial 120 finished with value: 0.05979919922507646 and parameters: {'n_layers': 1, 'embedding_dim': 64, 'lr': 0.003921816913048504, 'lambda_val': 0.00020372397624304677, 'batch_size': 780, 'optimizer': 'Adam'}. Best is trial 88 with value: 0.07101789822319082.
2026-05-19 02:26:39,363 - experiment_functions - INFO - Early stopping at epoch 800. Best Recall: 0.0576
2026-05-19 02:26:39,458 - optuna.study.study - INFO - Trial 121 finished with value: 0.05757285355451958 and parameters: {'n_layers': 1, 'embedding_dim': 64, 'lr': 0.0018284175803057108, 'lambda_val': 6.83794670785841e-05, 'batch_size': 997, 'optimizer': 'Adam'}. Best is trial 88 with value: 0.07101789822319082.
2026-05-19 02:26:59,600 - experiment_functions - INFO - Early stopping at epoch 1200. Best Recall: 0.0684
2026-05-19 02:26:59,694 - optuna.study.study - INFO - Trial 122 finished with value: 0.06839740479507164 and parameters: {'n_layers': 1, 'embedding_dim': 64, 'lr': 0.0011166617772430313, 'lambda_val': 2.4408694928752842e-05, 'batch_size': 688, 'optimizer': 'Adam'}. Best is trial 88 with value: 0.07101789822319082.
2026-05-19 02:27:24,593 - experiment_functions - INFO - Early stopping at epoch 1250. Best Recall: 0.0654
2026-05-19 02:27:24,685 - optuna.study.study - INFO - Trial 123 finished with value: 0.06536133317117143 and parameters: {'n_layers': 1, 'embedding_dim': 64, 'lr': 0.001149362683773012, 'lambda_val': 1.2671490261027084e-05, 'batch_size': 713, 'optimizer': 'Adam'}. Best is trial 88 with value: 0.07101789822319082.
2026-05-19 02:27:57,601 - experiment_functions - INFO - Early stopping at epoch 1900. Best Recall: 0.0707
2026-05-19 02:28:00,293 - optuna.study.study - INFO - Trial 124 finished with value: 0.07072425128027535 and parameters: {'n_layers': 1, 'embedding_dim': 64, 'lr': 0.0008808829199288711, 'lambda_val': 2.410322506383708e-05, 'batch_size': 596, 'optimizer': 'Adam'}. Best is trial 88 with value: 0.07101789822319082.
2026-05-19 02:28:25,985 - experiment_functions - INFO - Early stopping at epoch 1700. Best Recall: 0.0672
