2026-05-18 14:49:56,356 - optuna.study._optimize - INFO - Trial 291 pruned. 
2026-05-18 14:50:11,455 - experiment_functions - INFO - Early stopping at epoch 1050. Best Recall: 0.0601
2026-05-18 14:50:11,557 - optuna.study.study - INFO - Trial 292 finished with value: 0.06007044460532781 and parameters: {'n_layers': 1, 'embedding_dim': 32, 'lr': 0.0012791844617274749, 'lambda_val': 0.004008123191336285, 'batch_size': 793, 'optimizer': 'Adam'}. Best is trial 223 with value: 0.07213731043349277.
2026-05-18 14:50:50,814 - experiment_functions - INFO - Early stopping at epoch 2500. Best Recall: 0.0722
2026-05-18 14:50:50,918 - optuna.study.study - INFO - Trial 293 finished with value: 0.0722059023836398 and parameters: {'n_layers': 1, 'embedding_dim': 32, 'lr': 0.0006843784240362879, 'lambda_val': 0.011000526766635493, 'batch_size': 575, 'optimizer': 'RMSprop'}. Best is trial 293 with value: 0.0722059023836398.
2026-05-18 14:51:05,480 - optuna.study._optimize - INFO - Trial 294 pruned. 
2026-05-18 14:51:23,146 - optuna.study._optimize - INFO - Trial 295 pruned. 
2026-05-18 14:51:54,006 - experiment_functions - INFO - Early stopping at epoch 1900. Best Recall: 0.0679
2026-05-18 14:51:54,096 - optuna.study.study - INFO - Trial 296 finished with value: 0.06788801751020097 and parameters: {'n_layers': 1, 'embedding_dim': 32, 'lr': 0.0007149339760961874, 'lambda_val': 0.011166928415932085, 'batch_size': 515, 'optimizer': 'RMSprop'}. Best is trial 293 with value: 0.0722059023836398.
2026-05-18 14:52:09,858 - optuna.study._optimize - INFO - Trial 297 pruned. 
2026-05-18 14:52:30,652 - optuna.study._optimize - INFO - Trial 298 pruned. 
2026-05-18 14:52:44,544 - experiment_functions - INFO - Early stopping at epoch 800. Best Recall: 0.0522
2026-05-18 14:52:45,044 - optuna.study.study - INFO - Trial 299 finished with value: 0.052199235736958616 and parameters: {'n_layers': 1, 'embedding_dim': 32, 'lr': 0.0009711083563489809, 'lambda_val': 0.004659544783369021, 'batch_size': 3907, 'optimizer': 'Adam'}. Best is trial 293 with value: 0.0722059023836398.
2026-05-18 14:53:13,421 - experiment_functions - INFO - Early stopping at epoch 2600. Best Recall: 0.0694
2026-05-18 14:53:14,328 - root - INFO -   **** Training e_1M_1c2dcs_rand3
2026-05-18 14:53:14,384 - root - INFO -   **** Getting 202263/805443 random edges
2026-05-18 14:53:16,507 - optuna.storages._rdb.storage - INFO - A new study created in RDB with name: Study_e_1M_1c2dcs_rand3
2026-05-18 14:53:53,129 - experiment_functions - INFO - Early stopping at epoch 1100. Best Recall: 0.0120
2026-05-18 14:53:53,236 - optuna.study.study - INFO - Trial 0 finished with value: 0.011975017904417504 and parameters: {'n_layers': 1, 'embedding_dim': 256, 'lr': 0.014250857317910925, 'lambda_val': 0.06540781728725834, 'batch_size': 3927, 'optimizer': 'RMSprop'}. Best is trial 0 with value: 0.011975017904417504.
2026-05-18 14:54:19,891 - experiment_functions - INFO - Early stopping at epoch 800. Best Recall: 0.0314
2026-05-18 14:54:19,999 - optuna.study.study - INFO - Trial 1 finished with value: 0.031404124239685464 and parameters: {'n_layers': 3, 'embedding_dim': 64, 'lr': 0.0004195900108122231, 'lambda_val': 9.916807223399024e-05, 'batch_size': 3875, 'optimizer': 'RMSprop'}. Best is trial 1 with value: 0.031404124239685464.
2026-05-18 14:55:09,109 - experiment_functions - INFO - Early stopping at epoch 1650. Best Recall: 0.0267
2026-05-18 14:55:09,258 - optuna.study.study - INFO - Trial 2 finished with value: 0.02671371448046795 and parameters: {'n_layers': 2, 'embedding_dim': 64, 'lr': 0.011603026081935601, 'lambda_val': 0.001552175118951969, 'batch_size': 3605, 'optimizer': 'Adam'}. Best is trial 1 with value: 0.031404124239685464.
2026-05-18 14:55:17,015 - experiment_functions - INFO - Early stopping at epoch 550. Best Recall: 0.0048
2026-05-18 14:55:17,105 - optuna.study.study - INFO - Trial 3 finished with value: 0.004805646716230568 and parameters: {'n_layers': 1, 'embedding_dim': 128, 'lr': 1.605873056396757e-05, 'lambda_val': 0.00025553896318272724, 'batch_size': 2715, 'optimizer': 'RMSprop'}. Best is trial 1 with value: 0.031404124239685464.
2026-05-18 14:56:17,813 - optuna.study.study - INFO - Trial 4 finished with value: 0.032193991250207485 and parameters: {'n_layers': 4, 'embedding_dim': 64, 'lr': 0.00014884123388187492, 'lambda_val': 0.0007518774491175146, 'batch_size': 2823, 'optimizer': 'Adam'}. Best is trial 4 with value: 0.032193991250207485.
2026-05-18 14:56:31,672 - optuna.study._optimize - INFO - Trial 5 pruned. 
2026-05-18 14:56:41,874 - experiment_functions - INFO - Early stopping at epoch 550. Best Recall: 0.0222
2026-05-18 14:56:41,953 - optuna.study.study - INFO - Trial 6 finished with value: 0.022206512743655215 and parameters: {'n_layers': 2, 'embedding_dim': 64, 'lr': 0.0021595942555733875, 'lambda_val': 0.00025620304400971307, 'batch_size': 3347, 'optimizer': 'RMSprop'}. Best is trial 4 with value: 0.032193991250207485.
2026-05-18 14:56:51,412 - experiment_functions - INFO - Early stopping at epoch 550. Best Recall: 0.0377
2026-05-18 14:56:51,540 - optuna.study.study - INFO - Trial 7 finished with value: 0.03767658705670016 and parameters: {'n_layers': 1, 'embedding_dim': 128, 'lr': 0.0032252511518928136, 'lambda_val': 0.00012038258669241984, 'batch_size': 1472, 'optimizer': 'RMSprop'}. Best is trial 7 with value: 0.03767658705670016.
2026-05-18 14:56:59,338 - experiment_functions - INFO - Early stopping at epoch 500. Best Recall: 0.0050
2026-05-18 14:56:59,440 - optuna.study.study - INFO - Trial 8 finished with value: 0.004966582193492028 and parameters: {'n_layers': 2, 'embedding_dim': 128, 'lr': 0.017470568347712764, 'lambda_val': 0.00337932118538532, 'batch_size': 2776, 'optimizer': 'SGD'}. Best is trial 7 with value: 0.03767658705670016.
2026-05-18 14:57:08,812 - experiment_functions - INFO - Early stopping at epoch 500. Best Recall: 0.0050
2026-05-18 14:57:09,333 - optuna.study.study - INFO - Trial 9 finished with value: 0.005013315816971914 and parameters: {'n_layers': 2, 'embedding_dim': 64, 'lr': 0.0024256412833712836, 'lambda_val': 0.00012742697405230782, 'batch_size': 745, 'optimizer': 'SGD'}. Best is trial 7 with value: 0.03767658705670016.
2026-05-18 14:57:17,987 - experiment_functions - INFO - Early stopping at epoch 550. Best Recall: 0.0131
2026-05-18 14:57:18,413 - optuna.study.study - INFO - Trial 10 finished with value: 0.013093954013087623 and parameters: {'n_layers': 1, 'embedding_dim': 96, 'lr': 0.061594433229444495, 'lambda_val': 8.517179085856191e-06, 'batch_size': 1411, 'optimizer': 'Adam'}. Best is trial 7 with value: 0.03767658705670016.
2026-05-18 14:57:40,391 - experiment_functions - INFO - Early stopping at epoch 1350. Best Recall: 0.0336
2026-05-18 14:57:40,527 - optuna.study.study - INFO - Trial 11 finished with value: 0.033599396104369406 and parameters: {'n_layers': 4, 'embedding_dim': 128, 'lr': 0.00018778115759560495, 'lambda_val': 7.17959909823642e-06, 'batch_size': 1773, 'optimizer': 'Adam'}. Best is trial 7 with value: 0.03767658705670016.
2026-05-18 14:57:58,148 - optuna.study._optimize - INFO - Trial 12 pruned. 
2026-05-18 14:58:11,665 - experiment_functions - INFO - Early stopping at epoch 750. Best Recall: 0.0441
2026-05-18 14:58:11,770 - optuna.study.study - INFO - Trial 13 finished with value: 0.044071972927320326 and parameters: {'n_layers': 3, 'embedding_dim': 128, 'lr': 0.0005552183166317696, 'lambda_val': 1.9346183082654696e-05, 'batch_size': 1775, 'optimizer': 'Adam'}. Best is trial 13 with value: 0.044071972927320326.
2026-05-18 14:58:19,971 - experiment_functions - INFO - Early stopping at epoch 500. Best Recall: 0.0054
2026-05-18 14:58:20,061 - optuna.study.study - INFO - Trial 14 finished with value: 0.005373768838831497 and parameters: {'n_layers': 3, 'embedding_dim': 128, 'lr': 0.001225951238326187, 'lambda_val': 2.8703395751858777e-05, 'batch_size': 936, 'optimizer': 'SGD'}. Best is trial 13 with value: 0.044071972927320326.
2026-05-18 14:58:38,470 - optuna.study._optimize - INFO - Trial 15 pruned. 
2026-05-18 14:59:38,625 - optuna.study.study - INFO - Trial 16 finished with value: 0.0629759371588367 and parameters: {'n_layers': 1, 'embedding_dim': 32, 'lr': 0.00044325655139230714, 'lambda_val': 4.5004504421674784e-05, 'batch_size': 1220, 'optimizer': 'Adam'}. Best is trial 16 with value: 0.0629759371588367.
2026-05-18 14:59:54,452 - experiment_functions - INFO - Early stopping at epoch 1150. Best Recall: 0.0550
2026-05-18 14:59:54,597 - optuna.study.study - INFO - Trial 17 finished with value: 0.05504168026889849 and parameters: {'n_layers': 2, 'embedding_dim': 32, 'lr': 0.0005749831494600423, 'lambda_val': 2.3839684055987954e-05, 'batch_size': 1167, 'optimizer': 'Adam'}. Best is trial 16 with value: 0.0629759371588367.
2026-05-18 15:00:07,409 - optuna.study._optimize - INFO - Trial 18 pruned. 
2026-05-18 15:01:04,677 - experiment_functions - INFO - Early stopping at epoch 3550. Best Recall: 0.0584
2026-05-18 15:01:04,767 - optuna.study.study - INFO - Trial 19 finished with value: 0.05842297298838011 and parameters: {'n_layers': 2, 'embedding_dim': 32, 'lr': 0.0004715952500034222, 'lambda_val': 3.509483752994417e-05, 'batch_size': 620, 'optimizer': 'Adam'}. Best is trial 16 with value: 0.0629759371588367.
2026-05-18 15:01:17,693 - optuna.study._optimize - INFO - Trial 20 pruned. 
2026-05-18 15:01:37,858 - experiment_functions - INFO - Early stopping at epoch 1550. Best Recall: 0.0511
2026-05-18 15:01:37,960 - optuna.study.study - INFO - Trial 21 finished with value: 0.05113969874858204 and parameters: {'n_layers': 2, 'embedding_dim': 32, 'lr': 0.0004899110021253808, 'lambda_val': 3.4025335495855625e-05, 'batch_size': 1117, 'optimizer': 'Adam'}. Best is trial 16 with value: 0.0629759371588367.
2026-05-18 15:01:50,834 - optuna.study._optimize - INFO - Trial 22 pruned. 
2026-05-18 15:02:01,974 - experiment_functions - INFO - Early stopping at epoch 800. Best Recall: 0.0443
2026-05-18 15:02:02,065 - optuna.study.study - INFO - Trial 23 finished with value: 0.04427581125475985 and parameters: {'n_layers': 2, 'embedding_dim': 32, 'lr': 0.0009399006358833759, 'lambda_val': 1.3434105623976325e-05, 'batch_size': 2246, 'optimizer': 'Adam'}. Best is trial 16 with value: 0.0629759371588367.
2026-05-18 15:02:15,126 - optuna.study._optimize - INFO - Trial 24 pruned. 
2026-05-18 15:02:28,694 - optuna.study._optimize - INFO - Trial 25 pruned. 
2026-05-18 15:02:36,111 - experiment_functions - INFO - Early stopping at epoch 500. Best Recall: 0.0050
2026-05-18 15:02:36,200 - optuna.study.study - INFO - Trial 26 finished with value: 0.004971095099374311 and parameters: {'n_layers': 2, 'embedding_dim': 32, 'lr': 0.0011579098318760246, 'lambda_val': 0.0004924882133953843, 'batch_size': 956, 'optimizer': 'SGD'}. Best is trial 16 with value: 0.0629759371588367.
2026-05-18 15:02:49,690 - optuna.study._optimize - INFO - Trial 27 pruned. 
2026-05-18 15:02:58,828 - experiment_functions - INFO - Early stopping at epoch 600. Best Recall: 0.0486
2026-05-18 15:02:58,928 - optuna.study.study - INFO - Trial 28 finished with value: 0.04858594359747063 and parameters: {'n_layers': 2, 'embedding_dim': 32, 'lr': 0.005282142335231704, 'lambda_val': 1.739324018374134e-05, 'batch_size': 699, 'optimizer': 'Adam'}. Best is trial 16 with value: 0.0629759371588367.
2026-05-18 15:03:13,395 - experiment_functions - INFO - Early stopping at epoch 950. Best Recall: 0.0524
2026-05-18 15:03:13,540 - optuna.study.study - INFO - Trial 29 finished with value: 0.05235627081990193 and parameters: {'n_layers': 1, 'embedding_dim': 256, 'lr': 0.0008465005720418046, 'lambda_val': 0.024813881529648998, 'batch_size': 1097, 'optimizer': 'Adam'}. Best is trial 16 with value: 0.0629759371588367.
2026-05-18 15:03:21,710 - experiment_functions - INFO - Early stopping at epoch 500. Best Recall: 0.0059
2026-05-18 15:03:21,865 - optuna.study.study - INFO - Trial 30 finished with value: 0.0058713399018922915 and parameters: {'n_layers': 3, 'embedding_dim': 96, 'lr': 6.34456813715273e-05, 'lambda_val': 7.29935519637296e-05, 'batch_size': 1607, 'optimizer': 'SGD'}. Best is trial 16 with value: 0.0629759371588367.
2026-05-18 15:03:37,836 - experiment_functions - INFO - Early stopping at epoch 1000. Best Recall: 0.0552
2026-05-18 15:03:37,925 - optuna.study.study - INFO - Trial 31 finished with value: 0.0551678136503848 and parameters: {'n_layers': 1, 'embedding_dim': 256, 'lr': 0.0007679390184499161, 'lambda_val': 0.020966249290198618, 'batch_size': 1111, 'optimizer': 'Adam'}. Best is trial 16 with value: 0.0629759371588367.
2026-05-18 15:03:48,621 - experiment_functions - INFO - Early stopping at epoch 700. Best Recall: 0.0427
2026-05-18 15:03:48,721 - optuna.study.study - INFO - Trial 32 finished with value: 0.04273414443361809 and parameters: {'n_layers': 1, 'embedding_dim': 256, 'lr': 0.0016026232448141402, 'lambda_val': 0.04059605233219044, 'batch_size': 1999, 'optimizer': 'Adam'}. Best is trial 16 with value: 0.0629759371588367.
2026-05-18 15:04:06,328 - experiment_functions - INFO - Early stopping at epoch 1150. Best Recall: 0.0556
2026-05-18 15:04:06,508 - optuna.study.study - INFO - Trial 33 finished with value: 0.0555997266176793 and parameters: {'n_layers': 1, 'embedding_dim': 256, 'lr': 0.0006394216258306016, 'lambda_val': 0.008452580446911944, 'batch_size': 1217, 'optimizer': 'Adam'}. Best is trial 16 with value: 0.0629759371588367.
2026-05-18 15:04:14,164 - experiment_functions - INFO - Early stopping at epoch 500. Best Recall: 0.0045
2026-05-18 15:04:14,731 - optuna.study.study - INFO - Trial 34 finished with value: 0.004497535442452966 and parameters: {'n_layers': 1, 'embedding_dim': 256, 'lr': 0.0003409906069998569, 'lambda_val': 0.011187411720706714, 'batch_size': 898, 'optimizer': 'Adam'}. Best is trial 16 with value: 0.0629759371588367.
2026-05-18 15:04:23,708 - experiment_functions - INFO - Early stopping at epoch 550. Best Recall: 0.0477
2026-05-18 15:04:23,798 - optuna.study.study - INFO - Trial 35 finished with value: 0.04770572274213763 and parameters: {'n_layers': 1, 'embedding_dim': 256, 'lr': 0.007735417759242829, 'lambda_val': 0.002437630058027122, 'batch_size': 686, 'optimizer': 'Adam'}. Best is trial 16 with value: 0.0629759371588367.
2026-05-18 15:04:32,397 - experiment_functions - INFO - Early stopping at epoch 550. Best Recall: 0.0050
2026-05-18 15:04:32,498 - optuna.study.study - INFO - Trial 36 finished with value: 0.005021162648616602 and parameters: {'n_layers': 1, 'embedding_dim': 256, 'lr': 0.00012246610554685959, 'lambda_val': 0.00748223881553246, 'batch_size': 2307, 'optimizer': 'Adam'}. Best is trial 16 with value: 0.0629759371588367.
2026-05-18 15:04:45,215 - experiment_functions - INFO - Early stopping at epoch 800. Best Recall: 0.0552
2026-05-18 15:04:45,305 - optuna.study.study - INFO - Trial 37 finished with value: 0.05515420638724433 and parameters: {'n_layers': 1, 'embedding_dim': 256, 'lr': 0.0007730740800784501, 'lambda_val': 0.0012819302710683409, 'batch_size': 4031, 'optimizer': 'Adam'}. Best is trial 16 with value: 0.0629759371588367.
2026-05-18 15:05:05,921 - experiment_functions - INFO - Early stopping at epoch 1350. Best Recall: 0.0487
2026-05-18 15:05:05,998 - optuna.study.study - INFO - Trial 38 finished with value: 0.04870067560703525 and parameters: {'n_layers': 1, 'embedding_dim': 256, 'lr': 0.0002811321416549525, 'lambda_val': 0.019132585644760034, 'batch_size': 3327, 'optimizer': 'RMSprop'}. Best is trial 16 with value: 0.0629759371588367.
2026-05-18 15:05:13,745 - experiment_functions - INFO - Early stopping at epoch 500. Best Recall: 0.0052
2026-05-18 15:05:13,845 - optuna.study.study - INFO - Trial 39 finished with value: 0.00517670011466732 and parameters: {'n_layers': 1, 'embedding_dim': 256, 'lr': 1.0514848675056937e-05, 'lambda_val': 0.07908466969727136, 'batch_size': 1557, 'optimizer': 'Adam'}. Best is trial 16 with value: 0.0629759371588367.
2026-05-18 15:05:23,084 - experiment_functions - INFO - Early stopping at epoch 600. Best Recall: 0.0498
2026-05-18 15:05:23,181 - optuna.study.study - INFO - Trial 40 finished with value: 0.04976064261205809 and parameters: {'n_layers': 1, 'embedding_dim': 64, 'lr': 0.0020450252761711973, 'lambda_val': 0.00025734055994706707, 'batch_size': 1285, 'optimizer': 'RMSprop'}. Best is trial 16 with value: 0.0629759371588367.
2026-05-18 15:05:37,241 - experiment_functions - INFO - Early stopping at epoch 850. Best Recall: 0.0533
2026-05-18 15:05:37,331 - optuna.study.study - INFO - Trial 41 finished with value: 0.053336162682434955 and parameters: {'n_layers': 1, 'embedding_dim': 256, 'lr': 0.0007451880869542419, 'lambda_val': 0.00098468122259442, 'batch_size': 3598, 'optimizer': 'Adam'}. Best is trial 16 with value: 0.0629759371588367.
2026-05-18 15:05:47,891 - experiment_functions - INFO - Early stopping at epoch 650. Best Recall: 0.0553
2026-05-18 15:05:47,981 - optuna.study.study - INFO - Trial 42 finished with value: 0.05529452916485014 and parameters: {'n_layers': 1, 'embedding_dim': 256, 'lr': 0.0015395640175695931, 'lambda_val': 0.002351394024932874, 'batch_size': 3831, 'optimizer': 'Adam'}. Best is trial 16 with value: 0.0629759371588367.
2026-05-18 15:05:58,475 - experiment_functions - INFO - Early stopping at epoch 650. Best Recall: 0.0534
2026-05-18 15:05:58,565 - optuna.study.study - INFO - Trial 43 finished with value: 0.05343725844543303 and parameters: {'n_layers': 1, 'embedding_dim': 256, 'lr': 0.0015138700549917753, 'lambda_val': 0.0036591879350888114, 'batch_size': 3044, 'optimizer': 'Adam'}. Best is trial 16 with value: 0.0629759371588367.
2026-05-18 15:06:08,515 - experiment_functions - INFO - Early stopping at epoch 600. Best Recall: 0.0510
2026-05-18 15:06:08,606 - optuna.study.study - INFO - Trial 44 finished with value: 0.05097663629668723 and parameters: {'n_layers': 1, 'embedding_dim': 256, 'lr': 0.002613623071693321, 'lambda_val': 0.00015739360455788122, 'batch_size': 2576, 'optimizer': 'Adam'}. Best is trial 16 with value: 0.0629759371588367.
2026-05-18 15:06:28,010 - experiment_functions - INFO - Early stopping at epoch 1350. Best Recall: 0.0549
2026-05-18 15:06:28,152 - optuna.study.study - INFO - Trial 45 finished with value: 0.054949094687606614 and parameters: {'n_layers': 1, 'embedding_dim': 64, 'lr': 0.00041217871611613994, 'lambda_val': 0.040357823645317266, 'batch_size': 3826, 'optimizer': 'Adam'}. Best is trial 16 with value: 0.0629759371588367.
2026-05-18 15:06:35,840 - experiment_functions - INFO - Early stopping at epoch 500. Best Recall: 0.0061
2026-05-18 15:06:35,948 - optuna.study.study - INFO - Trial 46 finished with value: 0.00612228051456694 and parameters: {'n_layers': 2, 'embedding_dim': 96, 'lr': 0.02310512526828033, 'lambda_val': 0.0005996294596321611, 'batch_size': 1029, 'optimizer': 'SGD'}. Best is trial 16 with value: 0.0629759371588367.
2026-05-18 15:06:50,359 - experiment_functions - INFO - Early stopping at epoch 550. Best Recall: 0.0347
2026-05-18 15:06:50,450 - optuna.study.study - INFO - Trial 47 finished with value: 0.03471034759692188 and parameters: {'n_layers': 1, 'embedding_dim': 256, 'lr': 0.004012580908995079, 'lambda_val': 0.004735794572181614, 'batch_size': 3010, 'optimizer': 'Adam'}. Best is trial 16 with value: 0.0629759371588367.
2026-05-18 15:07:18,977 - optuna.study._optimize - INFO - Trial 48 pruned. 
2026-05-18 15:07:49,235 - experiment_functions - INFO - Early stopping at epoch 1700. Best Recall: 0.0614
2026-05-18 15:07:49,735 - optuna.study.study - INFO - Trial 49 finished with value: 0.061353361753609455 and parameters: {'n_layers': 1, 'embedding_dim': 32, 'lr': 0.0005079202573103771, 'lambda_val': 0.012615610467742287, 'batch_size': 1655, 'optimizer': 'Adam'}. Best is trial 16 with value: 0.0629759371588367.
2026-05-18 15:08:04,093 - experiment_functions - INFO - Early stopping at epoch 750. Best Recall: 0.0320
2026-05-18 15:08:04,182 - optuna.study.study - INFO - Trial 50 finished with value: 0.03196088522984466 and parameters: {'n_layers': 4, 'embedding_dim': 32, 'lr': 0.000577073882678183, 'lambda_val': 0.011171775821844837, 'batch_size': 1869, 'optimizer': 'Adam'}. Best is trial 16 with value: 0.0629759371588367.
2026-05-18 15:08:23,003 - experiment_functions - INFO - Early stopping at epoch 750. Best Recall: 0.0628
2026-05-18 15:08:23,092 - optuna.study.study - INFO - Trial 51 finished with value: 0.06279286998552412 and parameters: {'n_layers': 1, 'embedding_dim': 32, 'lr': 0.0015688664855911744, 'lambda_val': 0.017559049107258754, 'batch_size': 1615, 'optimizer': 'Adam'}. Best is trial 16 with value: 0.0629759371588367.
2026-05-18 15:08:37,268 - experiment_functions - INFO - Early stopping at epoch 750. Best Recall: 0.0618
2026-05-18 15:08:37,369 - optuna.study.study - INFO - Trial 52 finished with value: 0.061828615078563444 and parameters: {'n_layers': 1, 'embedding_dim': 32, 'lr': 0.0017129844768738306, 'lambda_val': 0.00572423347182783, 'batch_size': 1597, 'optimizer': 'Adam'}. Best is trial 16 with value: 0.0629759371588367.
2026-05-18 15:08:49,979 - experiment_functions - INFO - Early stopping at epoch 650. Best Recall: 0.0649
2026-05-18 15:08:50,083 - optuna.study.study - INFO - Trial 53 finished with value: 0.06485913862449923 and parameters: {'n_layers': 1, 'embedding_dim': 32, 'lr': 0.003159444443032853, 'lambda_val': 0.005719699996085253, 'batch_size': 1620, 'optimizer': 'Adam'}. Best is trial 53 with value: 0.06485913862449923.
2026-05-18 15:09:03,891 - experiment_functions - INFO - Early stopping at epoch 550. Best Recall: 0.0625
