2026-05-19 04:26:45,739 - optuna.study.study - INFO - Trial 248 finished with value: 0.056959810270604386 and parameters: {'n_layers': 1, 'embedding_dim': 128, 'lr': 0.002761589734292221, 'lambda_val': 0.0004882510563392375, 'batch_size': 839, 'optimizer': 'Adam'}. Best is trial 133 with value: 0.07401608033989727.
2026-05-19 04:27:14,098 - experiment_functions - INFO - Early stopping at epoch 1550. Best Recall: 0.0678
2026-05-19 04:27:14,199 - optuna.study.study - INFO - Trial 249 finished with value: 0.06781774716641967 and parameters: {'n_layers': 1, 'embedding_dim': 32, 'lr': 0.0009917231841303621, 'lambda_val': 0.0002566720370965685, 'batch_size': 763, 'optimizer': 'Adam'}. Best is trial 133 with value: 0.07401608033989727.
2026-05-19 04:27:27,354 - experiment_functions - INFO - Early stopping at epoch 850. Best Recall: 0.0634
2026-05-19 04:27:27,445 - optuna.study.study - INFO - Trial 250 finished with value: 0.0634080133540272 and parameters: {'n_layers': 1, 'embedding_dim': 32, 'lr': 0.0012966757314158866, 'lambda_val': 0.0009463847655901948, 'batch_size': 2693, 'optimizer': 'Adam'}. Best is trial 133 with value: 0.07401608033989727.
2026-05-19 04:27:39,504 - experiment_functions - INFO - Early stopping at epoch 800. Best Recall: 0.0632
2026-05-19 04:27:39,604 - optuna.study.study - INFO - Trial 251 finished with value: 0.0632284213084424 and parameters: {'n_layers': 1, 'embedding_dim': 32, 'lr': 0.002333232672557501, 'lambda_val': 0.0003794546987354024, 'batch_size': 692, 'optimizer': 'Adam'}. Best is trial 133 with value: 0.07401608033989727.
2026-05-19 04:27:54,025 - optuna.study._optimize - INFO - Trial 252 pruned. 
2026-05-19 04:28:16,296 - experiment_functions - INFO - Early stopping at epoch 1500. Best Recall: 0.0731
2026-05-19 04:28:16,431 - optuna.study.study - INFO - Trial 253 finished with value: 0.07308846313210253 and parameters: {'n_layers': 1, 'embedding_dim': 32, 'lr': 0.0010434881568791795, 'lambda_val': 0.0017875412614911004, 'batch_size': 728, 'optimizer': 'Adam'}. Best is trial 133 with value: 0.07401608033989727.
2026-05-19 04:28:23,918 - experiment_functions - INFO - Early stopping at epoch 500. Best Recall: 0.0053
2026-05-19 04:28:24,008 - optuna.study.study - INFO - Trial 254 finished with value: 0.005258401828243244 and parameters: {'n_layers': 1, 'embedding_dim': 32, 'lr': 0.0006686797710184765, 'lambda_val': 0.0018257225227172231, 'batch_size': 1701, 'optimizer': 'SGD'}. Best is trial 133 with value: 0.07401608033989727.
2026-05-19 04:28:42,450 - experiment_functions - INFO - Early stopping at epoch 1100. Best Recall: 0.0661
2026-05-19 04:28:42,549 - optuna.study.study - INFO - Trial 255 finished with value: 0.06611390549526178 and parameters: {'n_layers': 1, 'embedding_dim': 64, 'lr': 0.0010828714199134608, 'lambda_val': 0.0024108976304172696, 'batch_size': 846, 'optimizer': 'Adam'}. Best is trial 133 with value: 0.07401608033989727.
2026-05-19 04:29:01,604 - optuna.study._optimize - INFO - Trial 256 pruned. 
2026-05-19 04:29:21,157 - optuna.study._optimize - INFO - Trial 257 pruned. 
2026-05-19 04:29:43,725 - experiment_functions - INFO - Early stopping at epoch 850. Best Recall: 0.0589
2026-05-19 04:29:43,818 - optuna.study.study - INFO - Trial 258 finished with value: 0.05890100362580896 and parameters: {'n_layers': 1, 'embedding_dim': 256, 'lr': 0.0014412083513560437, 'lambda_val': 0.0014664348444172691, 'batch_size': 693, 'optimizer': 'Adam'}. Best is trial 133 with value: 0.07401608033989727.
2026-05-19 04:29:57,465 - optuna.study._optimize - INFO - Trial 259 pruned. 
2026-05-19 04:30:17,550 - optuna.study._optimize - INFO - Trial 260 pruned. 
2026-05-19 04:30:44,095 - optuna.study._optimize - INFO - Trial 261 pruned. 
2026-05-19 04:31:06,506 - experiment_functions - INFO - Early stopping at epoch 1450. Best Recall: 0.0715
2026-05-19 04:31:06,607 - optuna.study.study - INFO - Trial 262 finished with value: 0.07150886394894376 and parameters: {'n_layers': 1, 'embedding_dim': 32, 'lr': 0.0012174749716607196, 'lambda_val': 0.0010082654081633223, 'batch_size': 519, 'optimizer': 'Adam'}. Best is trial 133 with value: 0.07401608033989727.
2026-05-19 04:31:26,779 - experiment_functions - INFO - Early stopping at epoch 1400. Best Recall: 0.0706
2026-05-19 04:31:26,879 - optuna.study.study - INFO - Trial 263 finished with value: 0.07060453315905169 and parameters: {'n_layers': 1, 'embedding_dim': 32, 'lr': 0.0012669001690329366, 'lambda_val': 0.0010933269100234777, 'batch_size': 517, 'optimizer': 'Adam'}. Best is trial 133 with value: 0.07401608033989727.
2026-05-19 04:31:38,715 - experiment_functions - INFO - Early stopping at epoch 650. Best Recall: 0.0404
2026-05-19 04:31:38,825 - optuna.study.study - INFO - Trial 264 finished with value: 0.040392604782040625 and parameters: {'n_layers': 4, 'embedding_dim': 96, 'lr': 0.001292656267508382, 'lambda_val': 0.001250857593914437, 'batch_size': 528, 'optimizer': 'Adam'}. Best is trial 133 with value: 0.07401608033989727.
2026-05-19 04:32:03,419 - experiment_functions - INFO - Early stopping at epoch 1050. Best Recall: 0.0718
2026-05-19 04:32:03,508 - optuna.study.study - INFO - Trial 265 finished with value: 0.07177733382498269 and parameters: {'n_layers': 1, 'embedding_dim': 32, 'lr': 0.0015943946338642361, 'lambda_val': 0.0014065707082278546, 'batch_size': 584, 'optimizer': 'Adam'}. Best is trial 133 with value: 0.07401608033989727.
2026-05-19 04:32:19,217 - optuna.study._optimize - INFO - Trial 266 pruned. 
2026-05-19 04:32:35,510 - experiment_functions - INFO - Early stopping at epoch 950. Best Recall: 0.0676
2026-05-19 04:32:35,610 - optuna.study.study - INFO - Trial 267 finished with value: 0.06761836963507653 and parameters: {'n_layers': 1, 'embedding_dim': 32, 'lr': 0.0017049418172115102, 'lambda_val': 0.0014288242518517157, 'batch_size': 589, 'optimizer': 'Adam'}. Best is trial 133 with value: 0.07401608033989727.
2026-05-19 04:32:50,996 - experiment_functions - INFO - Early stopping at epoch 1050. Best Recall: 0.0670
2026-05-19 04:32:51,084 - optuna.study.study - INFO - Trial 268 finished with value: 0.06699118991960698 and parameters: {'n_layers': 1, 'embedding_dim': 32, 'lr': 0.0015570073622824141, 'lambda_val': 0.0032445105182155416, 'batch_size': 581, 'optimizer': 'Adam'}. Best is trial 133 with value: 0.07401608033989727.
2026-05-19 04:33:14,267 - experiment_functions - INFO - Early stopping at epoch 1600. Best Recall: 0.0713
2026-05-19 04:33:14,368 - optuna.study.study - INFO - Trial 269 finished with value: 0.07130150145644838 and parameters: {'n_layers': 1, 'embedding_dim': 32, 'lr': 0.0010975501953621699, 'lambda_val': 0.0010046864262099747, 'batch_size': 518, 'optimizer': 'Adam'}. Best is trial 133 with value: 0.07401608033989727.
2026-05-19 04:33:39,429 - experiment_functions - INFO - Early stopping at epoch 1650. Best Recall: 0.0684
2026-05-19 04:33:39,518 - optuna.study.study - INFO - Trial 270 finished with value: 0.0684180803316419 and parameters: {'n_layers': 1, 'embedding_dim': 32, 'lr': 0.0012039459659280783, 'lambda_val': 0.0010420246766185124, 'batch_size': 515, 'optimizer': 'Adam'}. Best is trial 133 with value: 0.07401608033989727.
2026-05-19 04:33:57,831 - experiment_functions - INFO - Early stopping at epoch 1250. Best Recall: 0.0699
2026-05-19 04:33:57,919 - optuna.study.study - INFO - Trial 271 finished with value: 0.06989420694730215 and parameters: {'n_layers': 1, 'embedding_dim': 32, 'lr': 0.001395443755693929, 'lambda_val': 0.0013860333333282101, 'batch_size': 573, 'optimizer': 'Adam'}. Best is trial 133 with value: 0.07401608033989727.
2026-05-19 04:34:16,816 - experiment_functions - INFO - Early stopping at epoch 1300. Best Recall: 0.0687
2026-05-19 04:34:16,927 - optuna.study.study - INFO - Trial 272 finished with value: 0.06869385205871424 and parameters: {'n_layers': 1, 'embedding_dim': 32, 'lr': 0.001368969351484748, 'lambda_val': 0.0021737381261681408, 'batch_size': 530, 'optimizer': 'Adam'}. Best is trial 133 with value: 0.07401608033989727.
2026-05-19 04:34:36,511 - optuna.study._optimize - INFO - Trial 273 pruned. 
2026-05-19 04:35:04,405 - experiment_functions - INFO - Early stopping at epoch 1900. Best Recall: 0.0702
2026-05-19 04:35:04,504 - optuna.study.study - INFO - Trial 274 finished with value: 0.07024787883418683 and parameters: {'n_layers': 1, 'embedding_dim': 32, 'lr': 0.0010513865514197517, 'lambda_val': 0.001117545305127404, 'batch_size': 514, 'optimizer': 'Adam'}. Best is trial 133 with value: 0.07401608033989727.
2026-05-19 04:35:15,606 - experiment_functions - INFO - Early stopping at epoch 700. Best Recall: 0.0607
2026-05-19 04:35:15,715 - optuna.study.study - INFO - Trial 275 finished with value: 0.060705543292995635 and parameters: {'n_layers': 2, 'embedding_dim': 128, 'lr': 0.001027764194631084, 'lambda_val': 0.00154517435931881, 'batch_size': 1516, 'optimizer': 'Adam'}. Best is trial 133 with value: 0.07401608033989727.
2026-05-19 04:35:30,322 - optuna.study._optimize - INFO - Trial 276 pruned. 
2026-05-19 04:35:50,742 - experiment_functions - INFO - Early stopping at epoch 1450. Best Recall: 0.0678
2026-05-19 04:35:50,832 - optuna.study.study - INFO - Trial 277 finished with value: 0.0678036855936273 and parameters: {'n_layers': 1, 'embedding_dim': 32, 'lr': 0.0010884796762695983, 'lambda_val': 0.0017489142947431167, 'batch_size': 632, 'optimizer': 'Adam'}. Best is trial 133 with value: 0.07401608033989727.
2026-05-19 04:36:00,564 - experiment_functions - INFO - Early stopping at epoch 500. Best Recall: 0.0045
2026-05-19 04:36:00,657 - optuna.study.study - INFO - Trial 278 finished with value: 0.0044609682623308975 and parameters: {'n_layers': 1, 'embedding_dim': 32, 'lr': 0.0013603639670679262, 'lambda_val': 0.001026601299842596, 'batch_size': 515, 'optimizer': 'SGD'}. Best is trial 133 with value: 0.07401608033989727.
2026-05-19 04:36:15,173 - experiment_functions - INFO - Early stopping at epoch 900. Best Recall: 0.0521
2026-05-19 04:36:15,316 - optuna.study.study - INFO - Trial 279 finished with value: 0.05211031859104275 and parameters: {'n_layers': 3, 'embedding_dim': 32, 'lr': 0.0008825332834852343, 'lambda_val': 0.001339365303499542, 'batch_size': 512, 'optimizer': 'Adam'}. Best is trial 133 with value: 0.07401608033989727.
2026-05-19 04:36:33,664 - experiment_functions - INFO - Early stopping at epoch 1300. Best Recall: 0.0715
2026-05-19 04:36:33,811 - optuna.study.study - INFO - Trial 280 finished with value: 0.07153785209608983 and parameters: {'n_layers': 1, 'embedding_dim': 32, 'lr': 0.001213414013577772, 'lambda_val': 0.0027595097010682575, 'batch_size': 594, 'optimizer': 'Adam'}. Best is trial 133 with value: 0.07401608033989727.
2026-05-19 04:36:49,825 - optuna.study._optimize - INFO - Trial 281 pruned. 
2026-05-19 04:37:07,678 - experiment_functions - INFO - Early stopping at epoch 1150. Best Recall: 0.0685
2026-05-19 04:37:07,812 - optuna.study.study - INFO - Trial 282 finished with value: 0.06850123739632343 and parameters: {'n_layers': 1, 'embedding_dim': 32, 'lr': 0.0012327581003697915, 'lambda_val': 0.004390969092716334, 'batch_size': 593, 'optimizer': 'Adam'}. Best is trial 133 with value: 0.07401608033989727.
2026-05-19 04:37:22,832 - experiment_functions - INFO - Early stopping at epoch 900. Best Recall: 0.0659
2026-05-19 04:37:22,901 - optuna.study.study - INFO - Trial 283 finished with value: 0.06585447032171272 and parameters: {'n_layers': 1, 'embedding_dim': 64, 'lr': 0.001147571746509962, 'lambda_val': 0.0024231255393889167, 'batch_size': 659, 'optimizer': 'RMSprop'}. Best is trial 133 with value: 0.07401608033989727.
2026-05-19 04:37:36,557 - experiment_functions - INFO - Early stopping at epoch 950. Best Recall: 0.0670
2026-05-19 04:37:36,626 - optuna.study.study - INFO - Trial 284 finished with value: 0.06698911181202465 and parameters: {'n_layers': 1, 'embedding_dim': 32, 'lr': 0.0016473486603724612, 'lambda_val': 0.0019863135455243553, 'batch_size': 581, 'optimizer': 'Adam'}. Best is trial 133 with value: 0.07401608033989727.
2026-05-19 04:37:50,496 - experiment_functions - INFO - Early stopping at epoch 1000. Best Recall: 0.0652
2026-05-19 04:37:50,565 - optuna.study.study - INFO - Trial 285 finished with value: 0.06517993641070836 and parameters: {'n_layers': 1, 'embedding_dim': 32, 'lr': 0.0010171613084033221, 'lambda_val': 0.002646142302508677, 'batch_size': 1877, 'optimizer': 'Adam'}. Best is trial 133 with value: 0.07401608033989727.
2026-05-19 04:38:07,212 - experiment_functions - INFO - Early stopping at epoch 1200. Best Recall: 0.0711
2026-05-19 04:38:07,281 - optuna.study.study - INFO - Trial 286 finished with value: 0.07107017345322285 and parameters: {'n_layers': 1, 'embedding_dim': 32, 'lr': 0.0013546473844057727, 'lambda_val': 0.0010796231510448386, 'batch_size': 684, 'optimizer': 'Adam'}. Best is trial 133 with value: 0.07401608033989727.
2026-05-19 04:38:22,454 - optuna.study._optimize - INFO - Trial 287 pruned. 
2026-05-19 04:38:38,317 - optuna.study._optimize - INFO - Trial 288 pruned. 
2026-05-19 04:38:46,198 - experiment_functions - INFO - Early stopping at epoch 550. Best Recall: 0.0047
2026-05-19 04:38:46,297 - optuna.study.study - INFO - Trial 289 finished with value: 0.0047321036892510136 and parameters: {'n_layers': 1, 'embedding_dim': 32, 'lr': 1.489768266345897e-05, 'lambda_val': 0.001673733025993733, 'batch_size': 681, 'optimizer': 'Adam'}. Best is trial 133 with value: 0.07401608033989727.
2026-05-19 04:39:04,194 - optuna.study._optimize - INFO - Trial 290 pruned. 
2026-05-19 04:39:27,964 - experiment_functions - INFO - Early stopping at epoch 1750. Best Recall: 0.0696
2026-05-19 04:39:28,031 - optuna.study.study - INFO - Trial 291 finished with value: 0.06962314390678775 and parameters: {'n_layers': 1, 'embedding_dim': 32, 'lr': 0.000963160194421778, 'lambda_val': 0.0012384014722930567, 'batch_size': 512, 'optimizer': 'Adam'}. Best is trial 133 with value: 0.07401608033989727.
2026-05-19 04:39:41,338 - experiment_functions - INFO - Early stopping at epoch 950. Best Recall: 0.0674
2026-05-19 04:39:41,419 - optuna.study.study - INFO - Trial 292 finished with value: 0.06736212056747683 and parameters: {'n_layers': 1, 'embedding_dim': 32, 'lr': 0.0015307533449668484, 'lambda_val': 0.0017832731209658618, 'batch_size': 708, 'optimizer': 'Adam'}. Best is trial 133 with value: 0.07401608033989727.
2026-05-19 04:39:58,359 - optuna.study._optimize - INFO - Trial 293 pruned. 
2026-05-19 04:40:18,629 - experiment_functions - INFO - Early stopping at epoch 850. Best Recall: 0.0668
2026-05-19 04:40:19,396 - optuna.study.study - INFO - Trial 294 finished with value: 0.06682365829745793 and parameters: {'n_layers': 1, 'embedding_dim': 32, 'lr': 0.0017981314781654492, 'lambda_val': 0.004182102641012092, 'batch_size': 720, 'optimizer': 'Adam'}. Best is trial 133 with value: 0.07401608033989727.
2026-05-19 04:40:37,945 - experiment_functions - INFO - Early stopping at epoch 1300. Best Recall: 0.0721
2026-05-19 04:40:38,066 - optuna.study.study - INFO - Trial 295 finished with value: 0.0721317339806494 and parameters: {'n_layers': 1, 'embedding_dim': 32, 'lr': 0.001261491926000007, 'lambda_val': 0.0021724646939720003, 'batch_size': 598, 'optimizer': 'Adam'}. Best is trial 133 with value: 0.07401608033989727.
2026-05-19 04:40:54,704 - optuna.study._optimize - INFO - Trial 296 pruned. 
2026-05-19 04:41:15,289 - experiment_functions - INFO - Early stopping at epoch 1250. Best Recall: 0.0680
2026-05-19 04:41:15,399 - optuna.study.study - INFO - Trial 297 finished with value: 0.06795961375831008 and parameters: {'n_layers': 1, 'embedding_dim': 32, 'lr': 0.0013455752536828429, 'lambda_val': 0.0021325690138906646, 'batch_size': 572, 'optimizer': 'Adam'}. Best is trial 133 with value: 0.07401608033989727.
2026-05-19 04:41:38,593 - experiment_functions - INFO - Early stopping at epoch 1650. Best Recall: 0.0729
2026-05-19 04:41:38,683 - optuna.study.study - INFO - Trial 298 finished with value: 0.07292840678225447 and parameters: {'n_layers': 1, 'embedding_dim': 32, 'lr': 0.0009755815298020959, 'lambda_val': 0.0030535797222323875, 'batch_size': 661, 'optimizer': 'Adam'}. Best is trial 133 with value: 0.07401608033989727.
2026-05-19 04:42:09,366 - experiment_functions - INFO - Early stopping at epoch 1400. Best Recall: 0.0681
2026-05-19 04:42:09,465 - optuna.study.study - INFO - Trial 299 finished with value: 0.06813433846456685 and parameters: {'n_layers': 1, 'embedding_dim': 32, 'lr': 0.001100562380119372, 'lambda_val': 0.002659928911088857, 'batch_size': 517, 'optimizer': 'Adam'}. Best is trial 133 with value: 0.07401608033989727.
2026-05-19 04:42:23,449 - experiment_functions - INFO - Early stopping at epoch 1200. Best Recall: 0.0698
2026-05-19 04:42:24,332 - root - INFO -   **** Training e_1M_1c3dcs_rand5
2026-05-19 04:42:24,392 - root - INFO -   **** Getting 221091/805443 random edges
2026-05-19 04:42:24,826 - optuna.storages._rdb.storage - INFO - A new study created in RDB with name: Study_e_1M_1c3dcs_rand5
2026-05-19 04:42:32,552 - experiment_functions - INFO - Early stopping at epoch 500. Best Recall: 0.0051
2026-05-19 04:42:32,658 - optuna.study.study - INFO - Trial 0 finished with value: 0.005127146116545951 and parameters: {'n_layers': 2, 'embedding_dim': 96, 'lr': 0.00043555618612902346, 'lambda_val': 0.007627916651246409, 'batch_size': 3223, 'optimizer': 'SGD'}. Best is trial 0 with value: 0.005127146116545951.
2026-05-19 04:42:40,561 - experiment_functions - INFO - Early stopping at epoch 500. Best Recall: 0.0054
2026-05-19 04:42:40,654 - optuna.study.study - INFO - Trial 1 finished with value: 0.005448812779035161 and parameters: {'n_layers': 3, 'embedding_dim': 96, 'lr': 7.014166125389672e-05, 'lambda_val': 0.04754951375735733, 'batch_size': 3510, 'optimizer': 'SGD'}. Best is trial 1 with value: 0.005448812779035161.
2026-05-19 04:42:49,393 - experiment_functions - INFO - Early stopping at epoch 500. Best Recall: 0.0049
2026-05-19 04:42:49,481 - optuna.study.study - INFO - Trial 2 finished with value: 0.004895276519464369 and parameters: {'n_layers': 4, 'embedding_dim': 64, 'lr': 2.159618352544035e-05, 'lambda_val': 0.010862909024731835, 'batch_size': 691, 'optimizer': 'Adam'}. Best is trial 1 with value: 0.005448812779035161.
2026-05-19 04:43:11,026 - experiment_functions - INFO - Early stopping at epoch 1000. Best Recall: 0.0387
2026-05-19 04:43:11,802 - optuna.study.study - INFO - Trial 3 finished with value: 0.03874172347585927 and parameters: {'n_layers': 3, 'embedding_dim': 128, 'lr': 0.00024270653473762663, 'lambda_val': 0.00012742879707115033, 'batch_size': 3624, 'optimizer': 'RMSprop'}. Best is trial 3 with value: 0.03874172347585927.
2026-05-19 04:43:23,131 - experiment_functions - INFO - Early stopping at epoch 500. Best Recall: 0.0051
2026-05-19 04:43:23,220 - optuna.study.study - INFO - Trial 4 finished with value: 0.005093861906485417 and parameters: {'n_layers': 3, 'embedding_dim': 128, 'lr': 0.0381144926335834, 'lambda_val': 0.05896701894404196, 'batch_size': 2042, 'optimizer': 'SGD'}. Best is trial 3 with value: 0.03874172347585927.
2026-05-19 04:43:32,754 - experiment_functions - INFO - Early stopping at epoch 500. Best Recall: 0.0055
2026-05-19 04:43:32,855 - optuna.study.study - INFO - Trial 5 finished with value: 0.005533418786374372 and parameters: {'n_layers': 1, 'embedding_dim': 64, 'lr': 0.039295945226973515, 'lambda_val': 0.0039673083965058135, 'batch_size': 763, 'optimizer': 'SGD'}. Best is trial 3 with value: 0.03874172347585927.
2026-05-19 04:44:07,368 - experiment_functions - INFO - Early stopping at epoch 2400. Best Recall: 0.0564
2026-05-19 04:44:07,468 - optuna.study.study - INFO - Trial 6 finished with value: 0.05638982616654933 and parameters: {'n_layers': 1, 'embedding_dim': 64, 'lr': 0.00036219170708775953, 'lambda_val': 1.2568375774373709e-05, 'batch_size': 3011, 'optimizer': 'Adam'}. Best is trial 6 with value: 0.05638982616654933.
2026-05-19 04:44:17,579 - experiment_functions - INFO - Early stopping at epoch 600. Best Recall: 0.0160
2026-05-19 04:44:17,722 - optuna.study.study - INFO - Trial 7 finished with value: 0.015994718678098093 and parameters: {'n_layers': 3, 'embedding_dim': 96, 'lr': 0.0385138364648865, 'lambda_val': 8.414287505166864e-05, 'batch_size': 1545, 'optimizer': 'RMSprop'}. Best is trial 6 with value: 0.05638982616654933.
2026-05-19 04:44:32,352 - optuna.study._optimize - INFO - Trial 8 pruned. 
2026-05-19 04:44:41,001 - experiment_functions - INFO - Early stopping at epoch 500. Best Recall: 0.0047
2026-05-19 04:44:41,090 - optuna.study.study - INFO - Trial 9 finished with value: 0.004738527184550134 and parameters: {'n_layers': 4, 'embedding_dim': 128, 'lr': 0.009788338485592496, 'lambda_val': 0.011471303374883557, 'batch_size': 1341, 'optimizer': 'SGD'}. Best is trial 6 with value: 0.05638982616654933.
2026-05-19 04:44:51,694 - experiment_functions - INFO - Early stopping at epoch 650. Best Recall: 0.0578
2026-05-19 04:44:53,975 - optuna.study.study - INFO - Trial 10 finished with value: 0.05779700537840662 and parameters: {'n_layers': 1, 'embedding_dim': 256, 'lr': 0.002000733138192488, 'lambda_val': 1.2141058157362177e-06, 'batch_size': 2858, 'optimizer': 'Adam'}. Best is trial 10 with value: 0.05779700537840662.
2026-05-19 04:45:05,606 - experiment_functions - INFO - Early stopping at epoch 600. Best Recall: 0.0554
2026-05-19 04:45:05,706 - optuna.study.study - INFO - Trial 11 finished with value: 0.05536228369200998 and parameters: {'n_layers': 1, 'embedding_dim': 256, 'lr': 0.0024654446503211856, 'lambda_val': 1.127012361694202e-06, 'batch_size': 2839, 'optimizer': 'Adam'}. Best is trial 10 with value: 0.05779700537840662.
2026-05-19 04:45:15,694 - experiment_functions - INFO - Early stopping at epoch 600. Best Recall: 0.0581
