2026-05-18 15:19:58,596 - optuna.study.study - INFO - Trial 109 finished with value: 0.06550868637575508 and parameters: {'n_layers': 1, 'embedding_dim': 32, 'lr': 0.0024232504509514403, 'lambda_val': 0.0248530260201467, 'batch_size': 1410, 'optimizer': 'Adam'}. Best is trial 91 with value: 0.06708054321961882.
2026-05-18 15:20:08,679 - experiment_functions - INFO - Early stopping at epoch 700. Best Recall: 0.0629
2026-05-18 15:20:08,779 - optuna.study.study - INFO - Trial 110 finished with value: 0.06285205426385189 and parameters: {'n_layers': 1, 'embedding_dim': 64, 'lr': 0.0023486535864713667, 'lambda_val': 0.00012234856021535353, 'batch_size': 1383, 'optimizer': 'Adam'}. Best is trial 91 with value: 0.06708054321961882.
2026-05-18 15:20:19,027 - experiment_functions - INFO - Early stopping at epoch 700. Best Recall: 0.0642
2026-05-18 15:20:19,144 - optuna.study.study - INFO - Trial 111 finished with value: 0.06419468548297062 and parameters: {'n_layers': 1, 'embedding_dim': 64, 'lr': 0.002401527130783675, 'lambda_val': 0.00012375525480475889, 'batch_size': 1361, 'optimizer': 'Adam'}. Best is trial 91 with value: 0.06708054321961882.
2026-05-18 15:20:29,428 - experiment_functions - INFO - Early stopping at epoch 700. Best Recall: 0.0561
2026-05-18 15:20:29,973 - optuna.study.study - INFO - Trial 112 finished with value: 0.05607257451986098 and parameters: {'n_layers': 1, 'embedding_dim': 64, 'lr': 0.002384381236668062, 'lambda_val': 0.0001163433764184986, 'batch_size': 1374, 'optimizer': 'Adam'}. Best is trial 91 with value: 0.06708054321961882.
2026-05-18 15:20:39,161 - experiment_functions - INFO - Early stopping at epoch 650. Best Recall: 0.0630
2026-05-18 15:20:39,252 - optuna.study.study - INFO - Trial 113 finished with value: 0.06301904965514663 and parameters: {'n_layers': 1, 'embedding_dim': 64, 'lr': 0.0032228419100661437, 'lambda_val': 0.00010328042328871242, 'batch_size': 1349, 'optimizer': 'Adam'}. Best is trial 91 with value: 0.06708054321961882.
2026-05-18 15:20:47,907 - experiment_functions - INFO - Early stopping at epoch 600. Best Recall: 0.0591
2026-05-18 15:20:48,009 - optuna.study.study - INFO - Trial 114 finished with value: 0.0591243812681336 and parameters: {'n_layers': 1, 'embedding_dim': 64, 'lr': 0.004483166435094384, 'lambda_val': 9.970981893735875e-05, 'batch_size': 1058, 'optimizer': 'Adam'}. Best is trial 91 with value: 0.06708054321961882.
2026-05-18 15:20:57,330 - experiment_functions - INFO - Early stopping at epoch 650. Best Recall: 0.0624
2026-05-18 15:20:57,410 - optuna.study.study - INFO - Trial 115 finished with value: 0.06235826804062028 and parameters: {'n_layers': 1, 'embedding_dim': 64, 'lr': 0.0032189044438267465, 'lambda_val': 4.3347312074726944e-05, 'batch_size': 1335, 'optimizer': 'Adam'}. Best is trial 91 with value: 0.06708054321961882.
2026-05-18 15:21:08,397 - experiment_functions - INFO - Early stopping at epoch 750. Best Recall: 0.0649
2026-05-18 15:21:08,497 - optuna.study.study - INFO - Trial 116 finished with value: 0.06485386971021694 and parameters: {'n_layers': 1, 'embedding_dim': 64, 'lr': 0.001993047446928159, 'lambda_val': 0.00019782771380165418, 'batch_size': 1437, 'optimizer': 'Adam'}. Best is trial 91 with value: 0.06708054321961882.
2026-05-18 15:21:19,291 - experiment_functions - INFO - Early stopping at epoch 750. Best Recall: 0.0641
2026-05-18 15:21:19,426 - optuna.study.study - INFO - Trial 117 finished with value: 0.06412323817878224 and parameters: {'n_layers': 1, 'embedding_dim': 64, 'lr': 0.001989450918920926, 'lambda_val': 0.0004529124179045211, 'batch_size': 1205, 'optimizer': 'Adam'}. Best is trial 91 with value: 0.06708054321961882.
2026-05-18 15:21:27,946 - experiment_functions - INFO - Early stopping at epoch 600. Best Recall: 0.0530
2026-05-18 15:21:28,047 - optuna.study.study - INFO - Trial 118 finished with value: 0.05301041151197806 and parameters: {'n_layers': 1, 'embedding_dim': 64, 'lr': 0.0019949040712530556, 'lambda_val': 0.00045768094065340925, 'batch_size': 1234, 'optimizer': 'RMSprop'}. Best is trial 91 with value: 0.06708054321961882.
2026-05-18 15:21:37,202 - experiment_functions - INFO - Early stopping at epoch 600. Best Recall: 0.0389
2026-05-18 15:21:37,311 - optuna.study.study - INFO - Trial 119 finished with value: 0.038882002833758235 and parameters: {'n_layers': 3, 'embedding_dim': 64, 'lr': 0.0028750038201355607, 'lambda_val': 0.00018114151007097656, 'batch_size': 943, 'optimizer': 'Adam'}. Best is trial 91 with value: 0.06708054321961882.
2026-05-18 15:21:47,629 - experiment_functions - INFO - Early stopping at epoch 650. Best Recall: 0.0549
2026-05-18 15:21:47,719 - optuna.study.study - INFO - Trial 120 finished with value: 0.054851186895633904 and parameters: {'n_layers': 1, 'embedding_dim': 64, 'lr': 0.004065369783310019, 'lambda_val': 0.00028249678198841855, 'batch_size': 1163, 'optimizer': 'Adam'}. Best is trial 91 with value: 0.06708054321961882.
2026-05-18 15:21:57,508 - experiment_functions - INFO - Early stopping at epoch 700. Best Recall: 0.0628
2026-05-18 15:21:57,599 - optuna.study.study - INFO - Trial 121 finished with value: 0.06281711600289924 and parameters: {'n_layers': 1, 'embedding_dim': 64, 'lr': 0.0023975315080259304, 'lambda_val': 7.028122559194363e-05, 'batch_size': 1464, 'optimizer': 'Adam'}. Best is trial 91 with value: 0.06708054321961882.
2026-05-18 15:22:07,220 - experiment_functions - INFO - Early stopping at epoch 650. Best Recall: 0.0572
2026-05-18 15:22:07,320 - optuna.study.study - INFO - Trial 122 finished with value: 0.05719364485933214 and parameters: {'n_layers': 1, 'embedding_dim': 64, 'lr': 0.0034755401850763775, 'lambda_val': 0.0007818801519593637, 'batch_size': 1401, 'optimizer': 'Adam'}. Best is trial 91 with value: 0.06708054321961882.
2026-05-18 15:22:19,070 - experiment_functions - INFO - Early stopping at epoch 800. Best Recall: 0.0605
2026-05-18 15:22:19,169 - optuna.study.study - INFO - Trial 123 finished with value: 0.0605415127186615 and parameters: {'n_layers': 1, 'embedding_dim': 64, 'lr': 0.0019246566420896471, 'lambda_val': 0.0001387661560427025, 'batch_size': 1250, 'optimizer': 'Adam'}. Best is trial 91 with value: 0.06708054321961882.
2026-05-18 15:22:28,594 - experiment_functions - INFO - Early stopping at epoch 650. Best Recall: 0.0648
2026-05-18 15:22:28,694 - optuna.study.study - INFO - Trial 124 finished with value: 0.06478420255634658 and parameters: {'n_layers': 1, 'embedding_dim': 64, 'lr': 0.0027263636843344132, 'lambda_val': 9.778083664916701e-05, 'batch_size': 1557, 'optimizer': 'Adam'}. Best is trial 91 with value: 0.06708054321961882.
2026-05-18 15:22:40,978 - experiment_functions - INFO - Early stopping at epoch 850. Best Recall: 0.0617
2026-05-18 15:22:41,086 - optuna.study.study - INFO - Trial 125 finished with value: 0.061745418736143705 and parameters: {'n_layers': 1, 'embedding_dim': 64, 'lr': 0.0014255728532343295, 'lambda_val': 0.00021090508759956256, 'batch_size': 1533, 'optimizer': 'Adam'}. Best is trial 91 with value: 0.06708054321961882.
2026-05-18 15:22:49,961 - experiment_functions - INFO - Early stopping at epoch 600. Best Recall: 0.0644
2026-05-18 15:22:50,041 - optuna.study.study - INFO - Trial 126 finished with value: 0.06444641674019783 and parameters: {'n_layers': 1, 'embedding_dim': 64, 'lr': 0.0057835875603253215, 'lambda_val': 9.901590235273144e-05, 'batch_size': 1106, 'optimizer': 'Adam'}. Best is trial 91 with value: 0.06708054321961882.
2026-05-18 15:22:59,062 - experiment_functions - INFO - Early stopping at epoch 600. Best Recall: 0.0585
2026-05-18 15:22:59,164 - optuna.study.study - INFO - Trial 127 finished with value: 0.05849593674254779 and parameters: {'n_layers': 1, 'embedding_dim': 64, 'lr': 0.0057212200127080915, 'lambda_val': 9.131225651753709e-05, 'batch_size': 1307, 'optimizer': 'Adam'}. Best is trial 91 with value: 0.06708054321961882.
2026-05-18 15:23:07,696 - experiment_functions - INFO - Early stopping at epoch 600. Best Recall: 0.0631
2026-05-18 15:23:07,807 - optuna.study.study - INFO - Trial 128 finished with value: 0.06310284363692736 and parameters: {'n_layers': 1, 'embedding_dim': 64, 'lr': 0.00490505716271622, 'lambda_val': 5.7300206626236686e-05, 'batch_size': 1110, 'optimizer': 'Adam'}. Best is trial 91 with value: 0.06708054321961882.
2026-05-18 15:23:14,971 - experiment_functions - INFO - Early stopping at epoch 500. Best Recall: 0.0051
2026-05-18 15:23:15,071 - optuna.study.study - INFO - Trial 129 finished with value: 0.005114116781171467 and parameters: {'n_layers': 1, 'embedding_dim': 64, 'lr': 0.004996653824029051, 'lambda_val': 3.37367613978963e-05, 'batch_size': 1099, 'optimizer': 'SGD'}. Best is trial 91 with value: 0.06708054321961882.
2026-05-18 15:23:25,724 - experiment_functions - INFO - Early stopping at epoch 700. Best Recall: 0.0647
2026-05-18 15:23:25,830 - optuna.study.study - INFO - Trial 130 finished with value: 0.0646731410622467 and parameters: {'n_layers': 1, 'embedding_dim': 64, 'lr': 0.002713607815959529, 'lambda_val': 5.722564024572025e-05, 'batch_size': 1004, 'optimizer': 'Adam'}. Best is trial 91 with value: 0.06708054321961882.
2026-05-18 15:23:36,187 - experiment_functions - INFO - Early stopping at epoch 700. Best Recall: 0.0584
2026-05-18 15:23:36,277 - optuna.study.study - INFO - Trial 131 finished with value: 0.05838103406156156 and parameters: {'n_layers': 1, 'embedding_dim': 64, 'lr': 0.002960016644913318, 'lambda_val': 4.995161770589252e-05, 'batch_size': 1005, 'optimizer': 'Adam'}. Best is trial 91 with value: 0.06708054321961882.
2026-05-18 15:23:44,813 - experiment_functions - INFO - Early stopping at epoch 600. Best Recall: 0.0589
2026-05-18 15:23:44,937 - optuna.study.study - INFO - Trial 132 finished with value: 0.058894861637964556 and parameters: {'n_layers': 1, 'embedding_dim': 64, 'lr': 0.006318354225457534, 'lambda_val': 5.5727668127554194e-05, 'batch_size': 816, 'optimizer': 'Adam'}. Best is trial 91 with value: 0.06708054321961882.
2026-05-18 15:23:54,126 - experiment_functions - INFO - Early stopping at epoch 650. Best Recall: 0.0608
2026-05-18 15:23:54,214 - optuna.study.study - INFO - Trial 133 finished with value: 0.06083349085589764 and parameters: {'n_layers': 1, 'embedding_dim': 64, 'lr': 0.0037670955327991744, 'lambda_val': 7.350371246655252e-05, 'batch_size': 920, 'optimizer': 'Adam'}. Best is trial 91 with value: 0.06708054321961882.
2026-05-18 15:24:05,863 - experiment_functions - INFO - Early stopping at epoch 800. Best Recall: 0.0602
2026-05-18 15:24:05,961 - optuna.study.study - INFO - Trial 134 finished with value: 0.06023381310876534 and parameters: {'n_layers': 1, 'embedding_dim': 64, 'lr': 0.0017031803804553787, 'lambda_val': 0.00014763645484894457, 'batch_size': 1179, 'optimizer': 'Adam'}. Best is trial 91 with value: 0.06708054321961882.
2026-05-18 15:24:16,635 - experiment_functions - INFO - Early stopping at epoch 750. Best Recall: 0.0644
2026-05-18 15:24:16,734 - optuna.study.study - INFO - Trial 135 finished with value: 0.06437084064291969 and parameters: {'n_layers': 1, 'embedding_dim': 64, 'lr': 0.0021364758740019924, 'lambda_val': 0.0003054047477620636, 'batch_size': 1446, 'optimizer': 'Adam'}. Best is trial 91 with value: 0.06708054321961882.
2026-05-18 15:24:26,474 - experiment_functions - INFO - Early stopping at epoch 650. Best Recall: 0.0597
2026-05-18 15:24:26,595 - optuna.study.study - INFO - Trial 136 finished with value: 0.059735735600509245 and parameters: {'n_layers': 1, 'embedding_dim': 64, 'lr': 0.0026168430328883303, 'lambda_val': 0.0005645452394810066, 'batch_size': 1461, 'optimizer': 'Adam'}. Best is trial 91 with value: 0.06708054321961882.
2026-05-18 15:24:37,769 - experiment_functions - INFO - Early stopping at epoch 750. Best Recall: 0.0600
2026-05-18 15:24:37,860 - optuna.study.study - INFO - Trial 137 finished with value: 0.059999677749057394 and parameters: {'n_layers': 1, 'embedding_dim': 64, 'lr': 0.0019913659329303442, 'lambda_val': 0.00019567959010297038, 'batch_size': 1589, 'optimizer': 'Adam'}. Best is trial 91 with value: 0.06708054321961882.
2026-05-18 15:24:49,567 - experiment_functions - INFO - Early stopping at epoch 850. Best Recall: 0.0583
2026-05-18 15:24:49,657 - optuna.study.study - INFO - Trial 138 finished with value: 0.05834836262573654 and parameters: {'n_layers': 1, 'embedding_dim': 64, 'lr': 0.001387879323521033, 'lambda_val': 0.0003273460160759335, 'batch_size': 1688, 'optimizer': 'Adam'}. Best is trial 91 with value: 0.06708054321961882.
2026-05-18 15:24:59,689 - experiment_functions - INFO - Early stopping at epoch 700. Best Recall: 0.0642
2026-05-18 15:24:59,790 - optuna.study.study - INFO - Trial 139 finished with value: 0.06417342250430144 and parameters: {'n_layers': 1, 'embedding_dim': 64, 'lr': 0.0021970387092234136, 'lambda_val': 0.00026736499781062934, 'batch_size': 1539, 'optimizer': 'Adam'}. Best is trial 91 with value: 0.06708054321961882.
2026-05-18 15:25:09,177 - experiment_functions - INFO - Early stopping at epoch 650. Best Recall: 0.0632
2026-05-18 15:25:09,321 - optuna.study.study - INFO - Trial 140 finished with value: 0.06321225033028098 and parameters: {'n_layers': 1, 'embedding_dim': 64, 'lr': 0.0027780600852798645, 'lambda_val': 0.00027668551061836257, 'batch_size': 1437, 'optimizer': 'Adam'}. Best is trial 91 with value: 0.06708054321961882.
2026-05-18 15:25:20,615 - experiment_functions - INFO - Early stopping at epoch 750. Best Recall: 0.0628
2026-05-18 15:25:20,735 - optuna.study.study - INFO - Trial 141 finished with value: 0.06276875384813665 and parameters: {'n_layers': 1, 'embedding_dim': 64, 'lr': 0.0020870812231803954, 'lambda_val': 0.0007552226582608324, 'batch_size': 1546, 'optimizer': 'Adam'}. Best is trial 91 with value: 0.06708054321961882.
2026-05-18 15:25:31,483 - experiment_functions - INFO - Early stopping at epoch 750. Best Recall: 0.0590
2026-05-18 15:25:31,573 - optuna.study.study - INFO - Trial 142 finished with value: 0.05903714842359331 and parameters: {'n_layers': 1, 'embedding_dim': 96, 'lr': 0.0017753924615966975, 'lambda_val': 0.00015471219064579932, 'batch_size': 1738, 'optimizer': 'Adam'}. Best is trial 91 with value: 0.06708054321961882.
2026-05-18 15:25:41,239 - experiment_functions - INFO - Early stopping at epoch 700. Best Recall: 0.0611
2026-05-18 15:25:41,329 - optuna.study.study - INFO - Trial 143 finished with value: 0.061141909005599834 and parameters: {'n_layers': 1, 'embedding_dim': 64, 'lr': 0.002290375570759002, 'lambda_val': 0.00040886195344069207, 'batch_size': 1500, 'optimizer': 'Adam'}. Best is trial 91 with value: 0.06708054321961882.
2026-05-18 15:25:52,298 - experiment_functions - INFO - Early stopping at epoch 750. Best Recall: 0.0645
2026-05-18 15:25:52,404 - optuna.study.study - INFO - Trial 144 finished with value: 0.06446939798418694 and parameters: {'n_layers': 1, 'embedding_dim': 64, 'lr': 0.001654681146876371, 'lambda_val': 0.00032266622391684675, 'batch_size': 1654, 'optimizer': 'Adam'}. Best is trial 91 with value: 0.06708054321961882.
2026-05-18 15:26:03,250 - experiment_functions - INFO - Early stopping at epoch 750. Best Recall: 0.0601
2026-05-18 15:26:03,340 - optuna.study.study - INFO - Trial 145 finished with value: 0.060122657749922294 and parameters: {'n_layers': 1, 'embedding_dim': 64, 'lr': 0.0015999316954445754, 'lambda_val': 0.0014336887090533597, 'batch_size': 1581, 'optimizer': 'Adam'}. Best is trial 91 with value: 0.06708054321961882.
2026-05-18 15:26:15,332 - experiment_functions - INFO - Early stopping at epoch 800. Best Recall: 0.0600
2026-05-18 15:26:15,422 - optuna.study.study - INFO - Trial 146 finished with value: 0.06000542316846764 and parameters: {'n_layers': 1, 'embedding_dim': 64, 'lr': 0.0013109971155303081, 'lambda_val': 0.00024085284290555046, 'batch_size': 1655, 'optimizer': 'Adam'}. Best is trial 91 with value: 0.06708054321961882.
2026-05-18 15:26:25,677 - experiment_functions - INFO - Early stopping at epoch 650. Best Recall: 0.0608
2026-05-18 15:26:25,797 - optuna.study.study - INFO - Trial 147 finished with value: 0.06083066882037386 and parameters: {'n_layers': 1, 'embedding_dim': 64, 'lr': 0.003778510035901984, 'lambda_val': 0.0005476256355627898, 'batch_size': 1304, 'optimizer': 'Adam'}. Best is trial 91 with value: 0.06708054321961882.
2026-05-18 15:26:35,637 - experiment_functions - INFO - Early stopping at epoch 650. Best Recall: 0.0570
2026-05-18 15:26:35,728 - optuna.study.study - INFO - Trial 148 finished with value: 0.05702236467241601 and parameters: {'n_layers': 1, 'embedding_dim': 64, 'lr': 0.002698575078919049, 'lambda_val': 8.822528020341439e-05, 'batch_size': 1395, 'optimizer': 'Adam'}. Best is trial 91 with value: 0.06708054321961882.
2026-05-18 15:26:48,718 - experiment_functions - INFO - Early stopping at epoch 550. Best Recall: 0.0331
2026-05-18 15:26:48,819 - optuna.study.study - INFO - Trial 149 finished with value: 0.033096152704817076 and parameters: {'n_layers': 1, 'embedding_dim': 128, 'lr': 0.0030521398541789187, 'lambda_val': 0.0003463502507751228, 'batch_size': 1446, 'optimizer': 'RMSprop'}. Best is trial 91 with value: 0.06708054321961882.
2026-05-18 15:27:06,132 - experiment_functions - INFO - Early stopping at epoch 700. Best Recall: 0.0617
2026-05-18 15:27:06,221 - optuna.study.study - INFO - Trial 150 finished with value: 0.061733208108121676 and parameters: {'n_layers': 1, 'embedding_dim': 64, 'lr': 0.002289000229790091, 'lambda_val': 0.00012691894684954477, 'batch_size': 1549, 'optimizer': 'Adam'}. Best is trial 91 with value: 0.06708054321961882.
2026-05-18 15:27:16,705 - experiment_functions - INFO - Early stopping at epoch 750. Best Recall: 0.0612
2026-05-18 15:27:16,808 - optuna.study.study - INFO - Trial 151 finished with value: 0.061187936483012705 and parameters: {'n_layers': 1, 'embedding_dim': 64, 'lr': 0.0018247277265177715, 'lambda_val': 0.00016414904369730672, 'batch_size': 1783, 'optimizer': 'Adam'}. Best is trial 91 with value: 0.06708054321961882.
2026-05-18 15:27:28,158 - experiment_functions - INFO - Early stopping at epoch 800. Best Recall: 0.0579
2026-05-18 15:27:28,248 - optuna.study.study - INFO - Trial 152 finished with value: 0.057875496917868224 and parameters: {'n_layers': 1, 'embedding_dim': 64, 'lr': 0.0015341157304007403, 'lambda_val': 0.000284790216627599, 'batch_size': 1671, 'optimizer': 'Adam'}. Best is trial 91 with value: 0.06708054321961882.
2026-05-18 15:27:38,926 - experiment_functions - INFO - Early stopping at epoch 750. Best Recall: 0.0605
2026-05-18 15:27:39,017 - optuna.study.study - INFO - Trial 153 finished with value: 0.06052577193951296 and parameters: {'n_layers': 1, 'embedding_dim': 64, 'lr': 0.0020485682966703135, 'lambda_val': 0.001142335312642305, 'batch_size': 1504, 'optimizer': 'Adam'}. Best is trial 91 with value: 0.06708054321961882.
2026-05-18 15:27:52,002 - experiment_functions - INFO - Early stopping at epoch 950. Best Recall: 0.0631
2026-05-18 15:27:52,093 - optuna.study.study - INFO - Trial 154 finished with value: 0.06308746964997923 and parameters: {'n_layers': 1, 'embedding_dim': 64, 'lr': 0.001246287555356818, 'lambda_val': 0.0002322653003189068, 'batch_size': 1255, 'optimizer': 'Adam'}. Best is trial 91 with value: 0.06708054321961882.
2026-05-18 15:28:00,394 - experiment_functions - INFO - Early stopping at epoch 550. Best Recall: 0.0362
2026-05-18 15:28:00,484 - optuna.study.study - INFO - Trial 155 finished with value: 0.03620962555306336 and parameters: {'n_layers': 3, 'embedding_dim': 96, 'lr': 0.002640630120969838, 'lambda_val': 0.00019256993124606975, 'batch_size': 1626, 'optimizer': 'Adam'}. Best is trial 91 with value: 0.06708054321961882.
2026-05-18 15:28:10,109 - experiment_functions - INFO - Early stopping at epoch 650. Best Recall: 0.0619
2026-05-18 15:28:10,209 - optuna.study.study - INFO - Trial 156 finished with value: 0.06185263339131243 and parameters: {'n_layers': 1, 'embedding_dim': 64, 'lr': 0.00333395373467722, 'lambda_val': 0.00013156975729771794, 'batch_size': 1354, 'optimizer': 'Adam'}. Best is trial 91 with value: 0.06708054321961882.
2026-05-18 15:28:20,570 - experiment_functions - INFO - Early stopping at epoch 700. Best Recall: 0.0574
2026-05-18 15:28:20,670 - optuna.study.study - INFO - Trial 157 finished with value: 0.057397022048641215 and parameters: {'n_layers': 1, 'embedding_dim': 64, 'lr': 0.0019660095861236035, 'lambda_val': 0.00010687291725043601, 'batch_size': 1750, 'optimizer': 'Adam'}. Best is trial 91 with value: 0.06708054321961882.
2026-05-18 15:28:29,790 - experiment_functions - INFO - Early stopping at epoch 600. Best Recall: 0.0584
2026-05-18 15:28:29,880 - optuna.study.study - INFO - Trial 158 finished with value: 0.05836252711998847 and parameters: {'n_layers': 1, 'embedding_dim': 64, 'lr': 0.0041488134835760615, 'lambda_val': 0.00046119938318408497, 'batch_size': 1436, 'optimizer': 'Adam'}. Best is trial 91 with value: 0.06708054321961882.
2026-05-18 15:28:37,483 - experiment_functions - INFO - Early stopping at epoch 500. Best Recall: 0.0050
2026-05-18 15:28:37,573 - optuna.study.study - INFO - Trial 159 finished with value: 0.004994220786724598 and parameters: {'n_layers': 1, 'embedding_dim': 128, 'lr': 0.0016167513065543139, 'lambda_val': 7.54829415236174e-05, 'batch_size': 1840, 'optimizer': 'SGD'}. Best is trial 91 with value: 0.06708054321961882.
2026-05-18 15:28:47,390 - experiment_functions - INFO - Early stopping at epoch 650. Best Recall: 0.0569
2026-05-18 15:28:47,481 - optuna.study.study - INFO - Trial 160 finished with value: 0.056869670907972784 and parameters: {'n_layers': 1, 'embedding_dim': 64, 'lr': 0.0025151255856556472, 'lambda_val': 0.05219702464595086, 'batch_size': 1568, 'optimizer': 'Adam'}. Best is trial 91 with value: 0.06708054321961882.
2026-05-18 15:28:57,453 - experiment_functions - INFO - Early stopping at epoch 650. Best Recall: 0.0643
