2026-05-18 08:13:02,557 - optuna.study.study - INFO - Trial 292 finished with value: 0.06576667974074175 and parameters: {'n_layers': 1, 'embedding_dim': 32, 'lr': 0.0014028524917954136, 'lambda_val': 0.0008326089304981565, 'batch_size': 675, 'optimizer': 'RMSprop'}. Best is trial 261 with value: 0.07542654320885167.
2026-05-18 08:13:28,262 - experiment_functions - INFO - Early stopping at epoch 1800. Best Recall: 0.0699
2026-05-18 08:13:28,342 - optuna.study.study - INFO - Trial 293 finished with value: 0.06989380196093815 and parameters: {'n_layers': 1, 'embedding_dim': 32, 'lr': 0.0009227285880343326, 'lambda_val': 0.001717458651921928, 'batch_size': 584, 'optimizer': 'RMSprop'}. Best is trial 261 with value: 0.07542654320885167.
2026-05-18 08:13:49,320 - experiment_functions - INFO - Early stopping at epoch 1450. Best Recall: 0.0713
2026-05-18 08:13:49,419 - optuna.study.study - INFO - Trial 294 finished with value: 0.07126426784131179 and parameters: {'n_layers': 1, 'embedding_dim': 32, 'lr': 0.0009677120876159903, 'lambda_val': 0.002748664643144595, 'batch_size': 512, 'optimizer': 'RMSprop'}. Best is trial 261 with value: 0.07542654320885167.
2026-05-18 08:14:06,476 - experiment_functions - INFO - Early stopping at epoch 1150. Best Recall: 0.0678
2026-05-18 08:14:06,598 - optuna.study.study - INFO - Trial 295 finished with value: 0.06781156060953927 and parameters: {'n_layers': 1, 'embedding_dim': 32, 'lr': 0.00119574095127245, 'lambda_val': 0.002948941829325052, 'batch_size': 512, 'optimizer': 'RMSprop'}. Best is trial 261 with value: 0.07542654320885167.
2026-05-18 08:14:34,199 - experiment_functions - INFO - Early stopping at epoch 1900. Best Recall: 0.0740
2026-05-18 08:14:34,322 - optuna.study.study - INFO - Trial 296 finished with value: 0.07398260391248067 and parameters: {'n_layers': 1, 'embedding_dim': 32, 'lr': 0.0009039109947748264, 'lambda_val': 0.0019697193910717795, 'batch_size': 578, 'optimizer': 'RMSprop'}. Best is trial 261 with value: 0.07542654320885167.
2026-05-18 08:14:45,653 - experiment_functions - INFO - Early stopping at epoch 750. Best Recall: 0.0597
2026-05-18 08:14:45,755 - optuna.study.study - INFO - Trial 297 finished with value: 0.05966143273470652 and parameters: {'n_layers': 1, 'embedding_dim': 32, 'lr': 0.0018200007077318063, 'lambda_val': 0.004145984582372836, 'batch_size': 582, 'optimizer': 'RMSprop'}. Best is trial 261 with value: 0.07542654320885167.
2026-05-18 08:15:11,327 - experiment_functions - INFO - Early stopping at epoch 1800. Best Recall: 0.0681
2026-05-18 08:15:11,429 - optuna.study.study - INFO - Trial 298 finished with value: 0.06813118233999073 and parameters: {'n_layers': 1, 'embedding_dim': 32, 'lr': 0.0009310075106740433, 'lambda_val': 0.0019132733122236237, 'batch_size': 610, 'optimizer': 'RMSprop'}. Best is trial 261 with value: 0.07542654320885167.
2026-05-18 08:15:20,678 - experiment_functions - INFO - Early stopping at epoch 600. Best Recall: 0.0443
2026-05-18 08:15:20,767 - optuna.study.study - INFO - Trial 299 finished with value: 0.04427196510891472 and parameters: {'n_layers': 1, 'embedding_dim': 32, 'lr': 0.0014435528998363264, 'lambda_val': 0.0023617846729672614, 'batch_size': 2876, 'optimizer': 'RMSprop'}. Best is trial 261 with value: 0.07542654320885167.
2026-05-18 08:15:37,259 - experiment_functions - INFO - Early stopping at epoch 1400. Best Recall: 0.0688
2026-05-18 08:15:38,147 - root - INFO - **** Training e_1M_1c2dcs
2026-05-18 08:15:38,147 - root - INFO -   ** 2-Dominant stats:
2026-05-18 08:15:38,147 - root - INFO -   ** Finding the dominant set:
2026-05-18 08:55:33,120 - root - INFO -   ** Getting the trainable edges:
2026-05-18 08:55:33,139 - helper_functions - INFO -      Number of nodes: 4753
2026-05-18 08:55:33,139 - helper_functions - INFO -      Ratio: 0.48768725631028115
2026-05-18 08:55:33,139 - helper_functions - INFO -      Number of unique users: 3162
2026-05-18 08:55:33,139 - helper_functions - INFO -      Number of unique items: 1591
2026-05-18 08:55:33,139 - helper_functions - INFO -      Total dominant set edge: 20467
2026-05-18 08:55:33,139 - helper_functions - INFO -      Trainable edges: 16373.6
2026-05-18 08:55:33,180 - root - INFO -   **** Getting 20467 dominant set edges
2026-05-18 08:55:33,291 - optuna.storages._rdb.storage - INFO - A new study created in RDB with name: Study_e_1M_1c2dcs_strict
2026-05-18 08:56:03,026 - experiment_functions - INFO - Early stopping at epoch 2300. Best Recall: 0.0054
2026-05-18 08:56:03,144 - optuna.study.study - INFO - Trial 0 finished with value: 0.005449603204367225 and parameters: {'n_layers': 2, 'embedding_dim': 128, 'lr': 1.5005232504401057e-05, 'lambda_val': 1.4603144315342451e-05, 'batch_size': 1616, 'optimizer': 'Adam'}. Best is trial 0 with value: 0.005449603204367225.
2026-05-18 08:57:08,412 - optuna.study.study - INFO - Trial 1 finished with value: 0.03878536999316267 and parameters: {'n_layers': 3, 'embedding_dim': 256, 'lr': 8.486056424599823e-05, 'lambda_val': 0.00031999079099438916, 'batch_size': 2207, 'optimizer': 'RMSprop'}. Best is trial 1 with value: 0.03878536999316267.
2026-05-18 08:57:16,283 - experiment_functions - INFO - Early stopping at epoch 500. Best Recall: 0.0049
2026-05-18 08:57:16,382 - optuna.study.study - INFO - Trial 2 finished with value: 0.004918710981404032 and parameters: {'n_layers': 3, 'embedding_dim': 128, 'lr': 8.265143209211559e-05, 'lambda_val': 9.63227742614296e-05, 'batch_size': 898, 'optimizer': 'SGD'}. Best is trial 1 with value: 0.03878536999316267.
2026-05-18 08:57:27,796 - experiment_functions - INFO - Early stopping at epoch 800. Best Recall: 0.0434
2026-05-18 08:57:27,887 - optuna.study.study - INFO - Trial 3 finished with value: 0.043431899934352695 and parameters: {'n_layers': 1, 'embedding_dim': 256, 'lr': 0.0008648944244528221, 'lambda_val': 1.5899352832963228e-06, 'batch_size': 625, 'optimizer': 'Adam'}. Best is trial 3 with value: 0.043431899934352695.
2026-05-18 08:57:35,520 - experiment_functions - INFO - Early stopping at epoch 550. Best Recall: 0.0412
2026-05-18 08:57:35,665 - optuna.study.study - INFO - Trial 4 finished with value: 0.04120535900703039 and parameters: {'n_layers': 1, 'embedding_dim': 128, 'lr': 0.005693948537253761, 'lambda_val': 8.89547009301425e-06, 'batch_size': 1973, 'optimizer': 'Adam'}. Best is trial 3 with value: 0.043431899934352695.
2026-05-18 08:57:53,287 - experiment_functions - INFO - Early stopping at epoch 900. Best Recall: 0.0057
2026-05-18 08:57:54,051 - optuna.study.study - INFO - Trial 5 finished with value: 0.005657733595797577 and parameters: {'n_layers': 1, 'embedding_dim': 64, 'lr': 1.9198719108590056e-05, 'lambda_val': 0.00030155926914017213, 'batch_size': 608, 'optimizer': 'RMSprop'}. Best is trial 3 with value: 0.043431899934352695.
2026-05-18 08:58:06,330 - experiment_functions - INFO - Early stopping at epoch 500. Best Recall: 0.0051
2026-05-18 08:58:06,420 - optuna.study.study - INFO - Trial 6 finished with value: 0.005085971877592058 and parameters: {'n_layers': 4, 'embedding_dim': 128, 'lr': 0.00012890465441115978, 'lambda_val': 0.008271480004138668, 'batch_size': 3137, 'optimizer': 'SGD'}. Best is trial 3 with value: 0.043431899934352695.
2026-05-18 08:58:20,403 - optuna.study._optimize - INFO - Trial 7 pruned. 
2026-05-18 08:58:29,935 - experiment_functions - INFO - Early stopping at epoch 650. Best Recall: 0.0049
2026-05-18 08:58:30,036 - optuna.study.study - INFO - Trial 8 finished with value: 0.004854938068115119 and parameters: {'n_layers': 2, 'embedding_dim': 64, 'lr': 4.8784667944385626e-05, 'lambda_val': 0.02248613960573055, 'batch_size': 3041, 'optimizer': 'RMSprop'}. Best is trial 3 with value: 0.043431899934352695.
2026-05-18 08:58:37,909 - experiment_functions - INFO - Early stopping at epoch 500. Best Recall: 0.0053
2026-05-18 08:58:38,002 - optuna.study.study - INFO - Trial 9 finished with value: 0.005256442135270207 and parameters: {'n_layers': 2, 'embedding_dim': 128, 'lr': 0.0006944520954397214, 'lambda_val': 0.014902240887271953, 'batch_size': 2695, 'optimizer': 'RMSprop'}. Best is trial 3 with value: 0.043431899934352695.
2026-05-18 08:58:45,906 - experiment_functions - INFO - Early stopping at epoch 550. Best Recall: 0.0077
2026-05-18 08:58:46,007 - optuna.study.study - INFO - Trial 10 finished with value: 0.00771081054578311 and parameters: {'n_layers': 1, 'embedding_dim': 96, 'lr': 0.047721404063237854, 'lambda_val': 3.015037401073509e-06, 'batch_size': 3746, 'optimizer': 'Adam'}. Best is trial 3 with value: 0.043431899934352695.
2026-05-18 08:58:53,944 - experiment_functions - INFO - Early stopping at epoch 550. Best Recall: 0.0407
2026-05-18 08:58:54,035 - optuna.study.study - INFO - Trial 11 finished with value: 0.040727093650178216 and parameters: {'n_layers': 1, 'embedding_dim': 256, 'lr': 0.008432218925852579, 'lambda_val': 1.0705682304099664e-06, 'batch_size': 1355, 'optimizer': 'Adam'}. Best is trial 3 with value: 0.043431899934352695.
2026-05-18 08:59:02,315 - experiment_functions - INFO - Early stopping at epoch 550. Best Recall: 0.0425
2026-05-18 08:59:02,414 - optuna.study.study - INFO - Trial 12 finished with value: 0.042462043775287735 and parameters: {'n_layers': 1, 'embedding_dim': 256, 'lr': 0.004194351301346532, 'lambda_val': 1.1007116731839155e-05, 'batch_size': 1214, 'optimizer': 'Adam'}. Best is trial 3 with value: 0.043431899934352695.
2026-05-18 08:59:10,993 - experiment_functions - INFO - Early stopping at epoch 550. Best Recall: 0.0425
2026-05-18 08:59:11,104 - optuna.study.study - INFO - Trial 13 finished with value: 0.042544374720156125 and parameters: {'n_layers': 1, 'embedding_dim': 256, 'lr': 0.0036501491888833943, 'lambda_val': 1.836180463302697e-05, 'batch_size': 1310, 'optimizer': 'Adam'}. Best is trial 3 with value: 0.043431899934352695.
2026-05-18 08:59:19,729 - experiment_functions - INFO - Early stopping at epoch 550. Best Recall: 0.0393
2026-05-18 08:59:19,838 - optuna.study.study - INFO - Trial 14 finished with value: 0.03929612739818051 and parameters: {'n_layers': 2, 'embedding_dim': 256, 'lr': 0.0018703242822561952, 'lambda_val': 1.0722165816969059e-06, 'batch_size': 604, 'optimizer': 'Adam'}. Best is trial 3 with value: 0.043431899934352695.
2026-05-18 08:59:30,365 - experiment_functions - INFO - Early stopping at epoch 650. Best Recall: 0.0049
2026-05-18 08:59:30,467 - optuna.study.study - INFO - Trial 15 finished with value: 0.004928888329496688 and parameters: {'n_layers': 4, 'embedding_dim': 256, 'lr': 0.03338445321074057, 'lambda_val': 3.549346137059223e-05, 'batch_size': 1101, 'optimizer': 'SGD'}. Best is trial 3 with value: 0.043431899934352695.
2026-05-18 08:59:39,583 - experiment_functions - INFO - Early stopping at epoch 650. Best Recall: 0.0414
2026-05-18 08:59:39,730 - optuna.study.study - INFO - Trial 16 finished with value: 0.04135891177793317 and parameters: {'n_layers': 1, 'embedding_dim': 32, 'lr': 0.0015223167416144635, 'lambda_val': 0.0022197738083007744, 'batch_size': 1467, 'optimizer': 'Adam'}. Best is trial 3 with value: 0.043431899934352695.
2026-05-18 08:59:47,518 - experiment_functions - INFO - Early stopping at epoch 500. Best Recall: 0.0052
2026-05-18 08:59:47,610 - optuna.study.study - INFO - Trial 17 finished with value: 0.005160763007692413 and parameters: {'n_layers': 2, 'embedding_dim': 96, 'lr': 0.01195365648284941, 'lambda_val': 2.9289499447834775e-06, 'batch_size': 546, 'optimizer': 'Adam'}. Best is trial 3 with value: 0.043431899934352695.
2026-05-18 09:00:19,232 - experiment_functions - INFO - Early stopping at epoch 2350. Best Recall: 0.0422
2026-05-18 09:00:19,339 - optuna.study.study - INFO - Trial 18 finished with value: 0.0421685790040265 and parameters: {'n_layers': 1, 'embedding_dim': 256, 'lr': 0.0002588988405409173, 'lambda_val': 3.2702536192823865e-05, 'batch_size': 1693, 'optimizer': 'Adam'}. Best is trial 3 with value: 0.043431899934352695.
2026-05-18 09:00:27,508 - experiment_functions - INFO - Early stopping at epoch 500. Best Recall: 0.0057
2026-05-18 09:00:27,661 - optuna.study.study - INFO - Trial 19 finished with value: 0.005731321099445088 and parameters: {'n_layers': 2, 'embedding_dim': 256, 'lr': 0.02202945902320895, 'lambda_val': 3.833512204649244e-06, 'batch_size': 814, 'optimizer': 'SGD'}. Best is trial 3 with value: 0.043431899934352695.
2026-05-18 09:00:35,129 - experiment_functions - INFO - Early stopping at epoch 550. Best Recall: 0.0417
2026-05-18 09:00:35,187 - optuna.study.study - INFO - Trial 20 finished with value: 0.041660741283812516 and parameters: {'n_layers': 1, 'embedding_dim': 256, 'lr': 0.0034350411966325785, 'lambda_val': 0.001283599383715687, 'batch_size': 1026, 'optimizer': 'Adam'}. Best is trial 3 with value: 0.043431899934352695.
2026-05-18 09:00:41,822 - experiment_functions - INFO - Early stopping at epoch 500. Best Recall: 0.0054
2026-05-18 09:00:41,892 - optuna.study.study - INFO - Trial 21 finished with value: 0.005364555128069455 and parameters: {'n_layers': 1, 'embedding_dim': 256, 'lr': 0.0027584679598955833, 'lambda_val': 0.0985841416874269, 'batch_size': 1204, 'optimizer': 'Adam'}. Best is trial 3 with value: 0.043431899934352695.
2026-05-18 09:00:52,194 - experiment_functions - INFO - Early stopping at epoch 750. Best Recall: 0.0431
2026-05-18 09:00:52,283 - optuna.study.study - INFO - Trial 22 finished with value: 0.04314631875447995 and parameters: {'n_layers': 1, 'embedding_dim': 256, 'lr': 0.0007870125100068032, 'lambda_val': 8.513120767720832e-06, 'batch_size': 1756, 'optimizer': 'Adam'}. Best is trial 3 with value: 0.043431899934352695.
2026-05-18 09:01:01,679 - experiment_functions - INFO - Early stopping at epoch 700. Best Recall: 0.0418
2026-05-18 09:01:01,727 - optuna.study.study - INFO - Trial 23 finished with value: 0.04175492626029239 and parameters: {'n_layers': 1, 'embedding_dim': 256, 'lr': 0.0008706628849890439, 'lambda_val': 4.829067134791887e-06, 'batch_size': 1821, 'optimizer': 'Adam'}. Best is trial 3 with value: 0.043431899934352695.
2026-05-18 09:01:13,193 - experiment_functions - INFO - Early stopping at epoch 850. Best Recall: 0.0258
2026-05-18 09:01:13,265 - optuna.study.study - INFO - Trial 24 finished with value: 0.025803755369956865 and parameters: {'n_layers': 2, 'embedding_dim': 64, 'lr': 0.0004196326344530335, 'lambda_val': 3.423618209707528e-05, 'batch_size': 2425, 'optimizer': 'Adam'}. Best is trial 3 with value: 0.043431899934352695.
2026-05-18 09:01:20,194 - experiment_functions - INFO - Early stopping at epoch 500. Best Recall: 0.0061
2026-05-18 09:01:20,318 - optuna.study.study - INFO - Trial 25 finished with value: 0.006109804486892998 and parameters: {'n_layers': 1, 'embedding_dim': 256, 'lr': 0.09973329867244364, 'lambda_val': 1.8281034627096361e-06, 'batch_size': 1478, 'optimizer': 'Adam'}. Best is trial 3 with value: 0.043431899934352695.
2026-05-18 09:01:29,500 - experiment_functions - INFO - Early stopping at epoch 650. Best Recall: 0.0196
2026-05-18 09:01:29,602 - optuna.study.study - INFO - Trial 26 finished with value: 0.019620687685803374 and parameters: {'n_layers': 2, 'embedding_dim': 32, 'lr': 0.0011872311099096425, 'lambda_val': 8.97445306264392e-06, 'batch_size': 2292, 'optimizer': 'Adam'}. Best is trial 3 with value: 0.043431899934352695.
2026-05-18 09:02:22,962 - optuna.study.study - INFO - Trial 27 finished with value: 0.04479706882171404 and parameters: {'n_layers': 1, 'embedding_dim': 96, 'lr': 0.00020644944877665705, 'lambda_val': 8.672730900211818e-05, 'batch_size': 903, 'optimizer': 'Adam'}. Best is trial 27 with value: 0.04479706882171404.
2026-05-18 09:02:30,590 - experiment_functions - INFO - Early stopping at epoch 500. Best Recall: 0.0048
2026-05-18 09:02:30,726 - optuna.study.study - INFO - Trial 28 finished with value: 0.0047872519435318865 and parameters: {'n_layers': 3, 'embedding_dim': 96, 'lr': 0.00018151452728749746, 'lambda_val': 0.00010604105429730794, 'batch_size': 891, 'optimizer': 'SGD'}. Best is trial 27 with value: 0.04479706882171404.
2026-05-18 09:02:44,094 - optuna.study._optimize - INFO - Trial 29 pruned. 
2026-05-18 09:02:54,459 - experiment_functions - INFO - Early stopping at epoch 700. Best Recall: 0.0274
2026-05-18 09:02:54,559 - optuna.study.study - INFO - Trial 30 finished with value: 0.027418844987026857 and parameters: {'n_layers': 2, 'embedding_dim': 96, 'lr': 0.0005193018326006939, 'lambda_val': 5.25230779010165e-05, 'batch_size': 4034, 'optimizer': 'Adam'}. Best is trial 27 with value: 0.04479706882171404.
2026-05-18 09:03:03,982 - experiment_functions - INFO - Early stopping at epoch 600. Best Recall: 0.0416
2026-05-18 09:03:04,084 - optuna.study.study - INFO - Trial 31 finished with value: 0.041619681932812506 and parameters: {'n_layers': 1, 'embedding_dim': 96, 'lr': 0.0019214757494633759, 'lambda_val': 1.7878716808269842e-05, 'batch_size': 1623, 'optimizer': 'Adam'}. Best is trial 27 with value: 0.04479706882171404.
2026-05-18 09:03:35,418 - experiment_functions - INFO - Early stopping at epoch 2300. Best Recall: 0.0429
2026-05-18 09:03:35,506 - optuna.study.study - INFO - Trial 32 finished with value: 0.04290659375348395 and parameters: {'n_layers': 1, 'embedding_dim': 256, 'lr': 0.00025083117337431477, 'lambda_val': 1.4861479868015338e-05, 'batch_size': 1337, 'optimizer': 'Adam'}. Best is trial 27 with value: 0.04479706882171404.
2026-05-18 09:04:14,608 - experiment_functions - INFO - Early stopping at epoch 2900. Best Recall: 0.0441
2026-05-18 09:04:14,750 - optuna.study.study - INFO - Trial 33 finished with value: 0.04409380341662978 and parameters: {'n_layers': 1, 'embedding_dim': 256, 'lr': 0.00023041353060289328, 'lambda_val': 5.968067555585111e-06, 'batch_size': 1079, 'optimizer': 'Adam'}. Best is trial 27 with value: 0.04479706882171404.
2026-05-18 09:04:29,319 - optuna.study._optimize - INFO - Trial 34 pruned. 
2026-05-18 09:04:38,625 - experiment_functions - INFO - Early stopping at epoch 650. Best Recall: 0.0063
2026-05-18 09:04:38,758 - optuna.study.study - INFO - Trial 35 finished with value: 0.006253828375673334 and parameters: {'n_layers': 1, 'embedding_dim': 96, 'lr': 1.2758243650643175e-05, 'lambda_val': 0.00023371027615594141, 'batch_size': 743, 'optimizer': 'Adam'}. Best is trial 27 with value: 0.04479706882171404.
2026-05-18 09:04:52,792 - optuna.study._optimize - INFO - Trial 36 pruned. 
2026-05-18 09:05:00,171 - experiment_functions - INFO - Early stopping at epoch 500. Best Recall: 0.0058
2026-05-18 09:05:00,271 - optuna.study.study - INFO - Trial 37 finished with value: 0.005790925878651503 and parameters: {'n_layers': 1, 'embedding_dim': 128, 'lr': 5.502960411802286e-05, 'lambda_val': 5.373798431431961e-05, 'batch_size': 1084, 'optimizer': 'SGD'}. Best is trial 27 with value: 0.04479706882171404.
2026-05-18 09:05:53,376 - optuna.study.study - INFO - Trial 38 finished with value: 0.046528950484758066 and parameters: {'n_layers': 1, 'embedding_dim': 32, 'lr': 0.00028820305600093664, 'lambda_val': 2.318635242167086e-06, 'batch_size': 528, 'optimizer': 'Adam'}. Best is trial 38 with value: 0.046528950484758066.
2026-05-18 09:06:07,191 - optuna.study._optimize - INFO - Trial 39 pruned. 
2026-05-18 09:06:20,886 - optuna.study._optimize - INFO - Trial 40 pruned. 
2026-05-18 09:07:13,561 - optuna.study.study - INFO - Trial 41 finished with value: 0.04579667035274725 and parameters: {'n_layers': 1, 'embedding_dim': 32, 'lr': 0.00030044672450192964, 'lambda_val': 2.6804288752294227e-06, 'batch_size': 954, 'optimizer': 'Adam'}. Best is trial 38 with value: 0.046528950484758066.
2026-05-18 09:07:57,918 - experiment_functions - INFO - Early stopping at epoch 3300. Best Recall: 0.0455
2026-05-18 09:07:58,025 - optuna.study.study - INFO - Trial 42 finished with value: 0.04552720754284049 and parameters: {'n_layers': 1, 'embedding_dim': 32, 'lr': 0.0002988294575168472, 'lambda_val': 2.2271387920795465e-06, 'batch_size': 843, 'optimizer': 'Adam'}. Best is trial 38 with value: 0.046528950484758066.
2026-05-18 09:08:12,009 - optuna.study._optimize - INFO - Trial 43 pruned. 
2026-05-18 09:08:45,877 - experiment_functions - INFO - Early stopping at epoch 2550. Best Recall: 0.0463
2026-05-18 09:08:45,976 - optuna.study.study - INFO - Trial 44 finished with value: 0.04625416233627117 and parameters: {'n_layers': 1, 'embedding_dim': 32, 'lr': 0.00036853598090163083, 'lambda_val': 1.1609928094487877e-06, 'batch_size': 876, 'optimizer': 'Adam'}. Best is trial 38 with value: 0.046528950484758066.
2026-05-18 09:09:21,834 - experiment_functions - INFO - Early stopping at epoch 2650. Best Recall: 0.0469
2026-05-18 09:09:21,933 - optuna.study.study - INFO - Trial 45 finished with value: 0.04694736148340025 and parameters: {'n_layers': 1, 'embedding_dim': 32, 'lr': 0.0004696318949119691, 'lambda_val': 1.0718620727233082e-06, 'batch_size': 513, 'optimizer': 'Adam'}. Best is trial 45 with value: 0.04694736148340025.
2026-05-18 09:10:14,975 - optuna.study.study - INFO - Trial 46 finished with value: 0.04748435995661139 and parameters: {'n_layers': 1, 'embedding_dim': 32, 'lr': 0.0003881520900675621, 'lambda_val': 1.0742712379467495e-06, 'batch_size': 528, 'optimizer': 'Adam'}. Best is trial 46 with value: 0.04748435995661139.
2026-05-18 09:10:29,385 - optuna.study._optimize - INFO - Trial 47 pruned. 
2026-05-18 09:10:36,213 - experiment_functions - INFO - Early stopping at epoch 500. Best Recall: 0.0057
2026-05-18 09:10:36,272 - optuna.study.study - INFO - Trial 48 finished with value: 0.005739340392226496 and parameters: {'n_layers': 1, 'embedding_dim': 32, 'lr': 0.0005279864503416726, 'lambda_val': 1.2453789965789324e-06, 'batch_size': 684, 'optimizer': 'SGD'}. Best is trial 46 with value: 0.04748435995661139.
2026-05-18 09:10:48,903 - optuna.study._optimize - INFO - Trial 49 pruned. 
2026-05-18 09:11:02,343 - optuna.study._optimize - INFO - Trial 50 pruned. 
2026-05-18 09:11:35,500 - experiment_functions - INFO - Early stopping at epoch 2500. Best Recall: 0.0465
