2026-05-18 10:58:06,498 - optuna.study._optimize - INFO - Trial 69 pruned. 
2026-05-18 10:58:19,380 - experiment_functions - INFO - Early stopping at epoch 550. Best Recall: 0.0773
2026-05-18 10:58:19,482 - optuna.study.study - INFO - Trial 70 finished with value: 0.07732596257226158 and parameters: {'n_layers': 1, 'embedding_dim': 96, 'lr': 0.0069229248777413, 'lambda_val': 1.0046740568621802e-06, 'batch_size': 1529, 'optimizer': 'Adam'}. Best is trial 65 with value: 0.08395096205355591.
2026-05-18 10:59:02,408 - experiment_functions - INFO - Early stopping at epoch 1550. Best Recall: 0.0795
2026-05-18 10:59:02,996 - optuna.study.study - INFO - Trial 71 finished with value: 0.07953971190877174 and parameters: {'n_layers': 1, 'embedding_dim': 256, 'lr': 0.003218363049562612, 'lambda_val': 1.799849331855669e-05, 'batch_size': 3505, 'optimizer': 'Adam'}. Best is trial 65 with value: 0.08395096205355591.
2026-05-18 10:59:17,100 - experiment_functions - INFO - Early stopping at epoch 650. Best Recall: 0.0556
2026-05-18 10:59:17,236 - optuna.study.study - INFO - Trial 72 finished with value: 0.05557086339999508 and parameters: {'n_layers': 1, 'embedding_dim': 256, 'lr': 0.015562234554175158, 'lambda_val': 1.4146212733562216e-05, 'batch_size': 3438, 'optimizer': 'Adam'}. Best is trial 65 with value: 0.08395096205355591.
2026-05-18 10:59:37,175 - optuna.study._optimize - INFO - Trial 73 pruned. 
2026-05-18 10:59:52,115 - experiment_functions - INFO - Early stopping at epoch 900. Best Recall: 0.0784
2026-05-18 10:59:52,263 - optuna.study.study - INFO - Trial 74 finished with value: 0.07844145783370556 and parameters: {'n_layers': 1, 'embedding_dim': 256, 'lr': 0.000465425027041462, 'lambda_val': 0.0006458572008727335, 'batch_size': 3105, 'optimizer': 'Adam'}. Best is trial 65 with value: 0.08395096205355591.
2026-05-18 11:00:17,997 - experiment_functions - INFO - Early stopping at epoch 1700. Best Recall: 0.0814
2026-05-18 11:00:18,113 - optuna.study.study - INFO - Trial 75 finished with value: 0.08137118731574408 and parameters: {'n_layers': 1, 'embedding_dim': 256, 'lr': 0.0032862679281016856, 'lambda_val': 1.6758203042756013e-06, 'batch_size': 3342, 'optimizer': 'Adam'}. Best is trial 65 with value: 0.08395096205355591.
2026-05-18 11:00:27,788 - experiment_functions - INFO - Early stopping at epoch 600. Best Recall: 0.0694
2026-05-18 11:00:27,880 - optuna.study.study - INFO - Trial 76 finished with value: 0.06939871867142317 and parameters: {'n_layers': 1, 'embedding_dim': 96, 'lr': 0.0032930958080372654, 'lambda_val': 0.0010371226499123229, 'batch_size': 3452, 'optimizer': 'Adam'}. Best is trial 65 with value: 0.08395096205355591.
2026-05-18 11:00:45,124 - experiment_functions - INFO - Early stopping at epoch 1150. Best Recall: 0.0733
2026-05-18 11:00:45,330 - optuna.study.study - INFO - Trial 77 finished with value: 0.07326153788096984 and parameters: {'n_layers': 1, 'embedding_dim': 256, 'lr': 0.002161861436314176, 'lambda_val': 2.6680169443022674e-05, 'batch_size': 3327, 'optimizer': 'RMSprop'}. Best is trial 65 with value: 0.08395096205355591.
2026-05-18 11:00:53,440 - experiment_functions - INFO - Early stopping at epoch 550. Best Recall: 0.0772
2026-05-18 11:00:53,545 - optuna.study.study - INFO - Trial 78 finished with value: 0.07716949491845881 and parameters: {'n_layers': 1, 'embedding_dim': 96, 'lr': 0.004963322752658577, 'lambda_val': 0.007444365369097819, 'batch_size': 3573, 'optimizer': 'Adam'}. Best is trial 65 with value: 0.08395096205355591.
2026-05-18 11:01:02,685 - experiment_functions - INFO - Early stopping at epoch 550. Best Recall: 0.0729
2026-05-18 11:01:02,778 - optuna.study.study - INFO - Trial 79 finished with value: 0.07287638986239435 and parameters: {'n_layers': 1, 'embedding_dim': 256, 'lr': 0.008830684043222096, 'lambda_val': 1.4764716040683506e-06, 'batch_size': 3670, 'optimizer': 'Adam'}. Best is trial 65 with value: 0.08395096205355591.
2026-05-18 11:01:18,090 - optuna.study._optimize - INFO - Trial 80 pruned. 
2026-05-18 11:01:27,302 - experiment_functions - INFO - Early stopping at epoch 550. Best Recall: 0.0738
2026-05-18 11:01:27,395 - optuna.study.study - INFO - Trial 81 finished with value: 0.07378914834349051 and parameters: {'n_layers': 1, 'embedding_dim': 256, 'lr': 0.004594454866117645, 'lambda_val': 2.7927165642453557e-06, 'batch_size': 1859, 'optimizer': 'Adam'}. Best is trial 65 with value: 0.08395096205355591.
2026-05-18 11:01:58,056 - experiment_functions - INFO - Early stopping at epoch 1400. Best Recall: 0.0783
2026-05-18 11:01:58,150 - optuna.study.study - INFO - Trial 82 finished with value: 0.07828634812962006 and parameters: {'n_layers': 1, 'embedding_dim': 256, 'lr': 0.003310839380076382, 'lambda_val': 1.1545360378858833e-05, 'batch_size': 2899, 'optimizer': 'Adam'}. Best is trial 65 with value: 0.08395096205355591.
2026-05-18 11:02:33,882 - experiment_functions - INFO - Early stopping at epoch 2350. Best Recall: 0.0811
2026-05-18 11:02:33,975 - optuna.study.study - INFO - Trial 83 finished with value: 0.08111277672231733 and parameters: {'n_layers': 1, 'embedding_dim': 256, 'lr': 0.001622049753831057, 'lambda_val': 1.727470573587672e-05, 'batch_size': 3754, 'optimizer': 'Adam'}. Best is trial 65 with value: 0.08395096205355591.
2026-05-18 11:02:44,030 - experiment_functions - INFO - Early stopping at epoch 600. Best Recall: 0.0766
2026-05-18 11:02:44,133 - optuna.study.study - INFO - Trial 84 finished with value: 0.07658116474329986 and parameters: {'n_layers': 1, 'embedding_dim': 256, 'lr': 0.0015622705203517052, 'lambda_val': 1.8792201878279263e-05, 'batch_size': 3764, 'optimizer': 'Adam'}. Best is trial 65 with value: 0.08395096205355591.
2026-05-18 11:02:52,250 - experiment_functions - INFO - Early stopping at epoch 500. Best Recall: 0.0048
2026-05-18 11:02:52,355 - optuna.study.study - INFO - Trial 85 finished with value: 0.004838044164258557 and parameters: {'n_layers': 1, 'embedding_dim': 96, 'lr': 0.002240165887642749, 'lambda_val': 0.05210182579385996, 'batch_size': 3999, 'optimizer': 'SGD'}. Best is trial 65 with value: 0.08395096205355591.
2026-05-18 11:03:03,698 - experiment_functions - INFO - Early stopping at epoch 650. Best Recall: 0.0753
2026-05-18 11:03:03,801 - optuna.study.study - INFO - Trial 86 finished with value: 0.07532519021881884 and parameters: {'n_layers': 1, 'embedding_dim': 256, 'lr': 0.0012014504476524114, 'lambda_val': 1.1970559181535666e-05, 'batch_size': 3342, 'optimizer': 'Adam'}. Best is trial 65 with value: 0.08395096205355591.
2026-05-18 11:03:33,503 - experiment_functions - INFO - Early stopping at epoch 1850. Best Recall: 0.0808
2026-05-18 11:03:33,595 - optuna.study.study - INFO - Trial 87 finished with value: 0.0808182747933846 and parameters: {'n_layers': 1, 'embedding_dim': 256, 'lr': 0.002811225353181653, 'lambda_val': 2.7884250291469777e-05, 'batch_size': 3504, 'optimizer': 'Adam'}. Best is trial 65 with value: 0.08395096205355591.
2026-05-18 11:03:43,078 - experiment_functions - INFO - Early stopping at epoch 600. Best Recall: 0.0695
2026-05-18 11:03:43,147 - optuna.study.study - INFO - Trial 88 finished with value: 0.06950325421335683 and parameters: {'n_layers': 1, 'embedding_dim': 96, 'lr': 0.0028971341947789156, 'lambda_val': 3.167309600240077e-05, 'batch_size': 3518, 'optimizer': 'Adam'}. Best is trial 65 with value: 0.08395096205355591.
2026-05-18 11:04:08,848 - optuna.study._optimize - INFO - Trial 89 pruned. 
2026-05-18 11:04:24,897 - optuna.study._optimize - INFO - Trial 90 pruned. 
2026-05-18 11:04:34,031 - experiment_functions - INFO - Early stopping at epoch 550. Best Recall: 0.0742
2026-05-18 11:04:34,124 - optuna.study.study - INFO - Trial 91 finished with value: 0.07419010985590108 and parameters: {'n_layers': 1, 'embedding_dim': 256, 'lr': 0.0056659440493067, 'lambda_val': 4.803273095026062e-06, 'batch_size': 3460, 'optimizer': 'Adam'}. Best is trial 65 with value: 0.08395096205355591.
2026-05-18 11:04:53,111 - optuna.study._optimize - INFO - Trial 92 pruned. 
2026-05-18 11:05:09,409 - optuna.study._optimize - INFO - Trial 93 pruned. 
2026-05-18 11:05:19,147 - experiment_functions - INFO - Early stopping at epoch 600. Best Recall: 0.0780
2026-05-18 11:05:19,239 - optuna.study.study - INFO - Trial 94 finished with value: 0.07803975093480732 and parameters: {'n_layers': 1, 'embedding_dim': 256, 'lr': 0.002370677553157215, 'lambda_val': 8.47201827720941e-05, 'batch_size': 1749, 'optimizer': 'Adam'}. Best is trial 65 with value: 0.08395096205355591.
2026-05-18 11:05:28,763 - experiment_functions - INFO - Early stopping at epoch 600. Best Recall: 0.0393
2026-05-18 11:05:28,868 - optuna.study.study - INFO - Trial 95 finished with value: 0.03934348324341373 and parameters: {'n_layers': 3, 'embedding_dim': 64, 'lr': 0.0008895367636788989, 'lambda_val': 0.00015927802568268203, 'batch_size': 3131, 'optimizer': 'RMSprop'}. Best is trial 65 with value: 0.08395096205355591.
2026-05-18 11:05:39,207 - experiment_functions - INFO - Early stopping at epoch 650. Best Recall: 0.0767
2026-05-18 11:05:39,341 - optuna.study.study - INFO - Trial 96 finished with value: 0.07667473468598672 and parameters: {'n_layers': 1, 'embedding_dim': 96, 'lr': 0.0013813648936841247, 'lambda_val': 1.6980380710791665e-06, 'batch_size': 3647, 'optimizer': 'Adam'}. Best is trial 65 with value: 0.08395096205355591.
2026-05-18 11:06:12,253 - experiment_functions - INFO - Early stopping at epoch 2200. Best Recall: 0.0816
2026-05-18 11:06:12,368 - optuna.study.study - INFO - Trial 97 finished with value: 0.08160347260694299 and parameters: {'n_layers': 1, 'embedding_dim': 256, 'lr': 0.0016486352198083268, 'lambda_val': 1.4721605619711888e-05, 'batch_size': 3845, 'optimizer': 'Adam'}. Best is trial 65 with value: 0.08395096205355591.
2026-05-18 11:06:50,236 - experiment_functions - INFO - Early stopping at epoch 2500. Best Recall: 0.0831
2026-05-18 11:06:50,374 - optuna.study.study - INFO - Trial 98 finished with value: 0.08311241377848912 and parameters: {'n_layers': 1, 'embedding_dim': 256, 'lr': 0.0016312375570403824, 'lambda_val': 3.014650480050615e-05, 'batch_size': 3931, 'optimizer': 'Adam'}. Best is trial 65 with value: 0.08395096205355591.
2026-05-18 11:07:00,257 - experiment_functions - INFO - Early stopping at epoch 650. Best Recall: 0.0715
2026-05-18 11:07:00,359 - optuna.study.study - INFO - Trial 99 finished with value: 0.07153366318804472 and parameters: {'n_layers': 1, 'embedding_dim': 96, 'lr': 0.001600022682774515, 'lambda_val': 2.93276880927563e-05, 'batch_size': 3935, 'optimizer': 'Adam'}. Best is trial 65 with value: 0.08395096205355591.
2026-05-18 11:07:08,204 - experiment_functions - INFO - Early stopping at epoch 500. Best Recall: 0.0045
2026-05-18 11:07:08,362 - optuna.study.study - INFO - Trial 100 finished with value: 0.0045496769949436204 and parameters: {'n_layers': 1, 'embedding_dim': 256, 'lr': 0.0006894533124916857, 'lambda_val': 0.0004632231879487734, 'batch_size': 3807, 'optimizer': 'SGD'}. Best is trial 65 with value: 0.08395096205355591.
2026-05-18 11:08:07,834 - optuna.study.study - INFO - Trial 101 finished with value: 0.08450551456517907 and parameters: {'n_layers': 1, 'embedding_dim': 256, 'lr': 0.0011822224379811075, 'lambda_val': 4.009409885743596e-05, 'batch_size': 3973, 'optimizer': 'Adam'}. Best is trial 101 with value: 0.08450551456517907.
2026-05-18 11:08:38,070 - experiment_functions - INFO - Early stopping at epoch 2000. Best Recall: 0.0822
2026-05-18 11:08:38,219 - optuna.study.study - INFO - Trial 102 finished with value: 0.08224360917721284 and parameters: {'n_layers': 1, 'embedding_dim': 256, 'lr': 0.0011645693536191696, 'lambda_val': 3.613901228174649e-05, 'batch_size': 3866, 'optimizer': 'Adam'}. Best is trial 101 with value: 0.08450551456517907.
2026-05-18 11:08:52,428 - experiment_functions - INFO - Early stopping at epoch 900. Best Recall: 0.0760
2026-05-18 11:08:52,986 - optuna.study.study - INFO - Trial 103 finished with value: 0.07598911633253083 and parameters: {'n_layers': 1, 'embedding_dim': 256, 'lr': 0.00046318825667051363, 'lambda_val': 4.357353547166548e-05, 'batch_size': 4010, 'optimizer': 'Adam'}. Best is trial 101 with value: 0.08450551456517907.
2026-05-18 11:09:10,403 - optuna.study._optimize - INFO - Trial 104 pruned. 
2026-05-18 11:09:20,908 - experiment_functions - INFO - Early stopping at epoch 650. Best Recall: 0.0754
2026-05-18 11:09:21,057 - optuna.study.study - INFO - Trial 105 finished with value: 0.07538067526810384 and parameters: {'n_layers': 1, 'embedding_dim': 256, 'lr': 0.0012291127893832147, 'lambda_val': 3.8285427882721696e-05, 'batch_size': 3971, 'optimizer': 'Adam'}. Best is trial 101 with value: 0.08450551456517907.
2026-05-18 11:09:35,865 - optuna.study._optimize - INFO - Trial 106 pruned. 
2026-05-18 11:09:46,387 - experiment_functions - INFO - Early stopping at epoch 700. Best Recall: 0.0800
2026-05-18 11:09:46,490 - optuna.study.study - INFO - Trial 107 finished with value: 0.08004496295083409 and parameters: {'n_layers': 1, 'embedding_dim': 96, 'lr': 0.0010255198603000657, 'lambda_val': 9.92068391309171e-06, 'batch_size': 3737, 'optimizer': 'Adam'}. Best is trial 101 with value: 0.08450551456517907.
2026-05-18 11:09:56,467 - experiment_functions - INFO - Early stopping at epoch 600. Best Recall: 0.0766
2026-05-18 11:09:56,571 - optuna.study.study - INFO - Trial 108 finished with value: 0.07660112398017511 and parameters: {'n_layers': 1, 'embedding_dim': 256, 'lr': 0.0017481046668826165, 'lambda_val': 9.79319714276572e-05, 'batch_size': 3872, 'optimizer': 'Adam'}. Best is trial 101 with value: 0.08450551456517907.
2026-05-18 11:10:10,929 - experiment_functions - INFO - Early stopping at epoch 900. Best Recall: 0.0757
2026-05-18 11:10:11,042 - optuna.study.study - INFO - Trial 109 finished with value: 0.07574659043325384 and parameters: {'n_layers': 1, 'embedding_dim': 256, 'lr': 0.00047228224342729116, 'lambda_val': 0.000293423393077528, 'batch_size': 4004, 'optimizer': 'Adam'}. Best is trial 101 with value: 0.08450551456517907.
2026-05-18 11:10:23,840 - experiment_functions - INFO - Early stopping at epoch 800. Best Recall: 0.0763
2026-05-18 11:10:23,956 - optuna.study.study - INFO - Trial 110 finished with value: 0.07629231941282341 and parameters: {'n_layers': 1, 'embedding_dim': 128, 'lr': 0.0006615435946486237, 'lambda_val': 0.0016992520774047279, 'batch_size': 3797, 'optimizer': 'Adam'}. Best is trial 101 with value: 0.08450551456517907.
2026-05-18 11:10:46,495 - optuna.study._optimize - INFO - Trial 111 pruned. 
2026-05-18 11:10:58,059 - experiment_functions - INFO - Early stopping at epoch 700. Best Recall: 0.0782
2026-05-18 11:10:58,402 - optuna.study.study - INFO - Trial 112 finished with value: 0.07824652464338618 and parameters: {'n_layers': 1, 'embedding_dim': 256, 'lr': 0.0014223800144872946, 'lambda_val': 1.5855862381028865e-05, 'batch_size': 1586, 'optimizer': 'Adam'}. Best is trial 101 with value: 0.08450551456517907.
2026-05-18 11:11:09,054 - experiment_functions - INFO - Early stopping at epoch 650. Best Recall: 0.0785
2026-05-18 11:11:09,158 - optuna.study.study - INFO - Trial 113 finished with value: 0.07852109328094797 and parameters: {'n_layers': 1, 'embedding_dim': 256, 'lr': 0.0019282939031656425, 'lambda_val': 2.3049202149763535e-05, 'batch_size': 1422, 'optimizer': 'Adam'}. Best is trial 101 with value: 0.08450551456517907.
2026-05-18 11:11:28,921 - optuna.study._optimize - INFO - Trial 114 pruned. 
2026-05-18 11:11:39,348 - experiment_functions - INFO - Early stopping at epoch 650. Best Recall: 0.0756
2026-05-18 11:11:39,484 - optuna.study.study - INFO - Trial 115 finished with value: 0.07557197111231845 and parameters: {'n_layers': 1, 'embedding_dim': 256, 'lr': 0.0023561255125575174, 'lambda_val': 2.083393543048481e-05, 'batch_size': 619, 'optimizer': 'Adam'}. Best is trial 101 with value: 0.08450551456517907.
2026-05-18 11:11:53,818 - optuna.study._optimize - INFO - Trial 116 pruned. 
2026-05-18 11:12:11,073 - optuna.study._optimize - INFO - Trial 117 pruned. 
2026-05-18 11:12:24,812 - experiment_functions - INFO - Early stopping at epoch 900. Best Recall: 0.0710
2026-05-18 11:12:24,918 - optuna.study.study - INFO - Trial 118 finished with value: 0.07102043434519566 and parameters: {'n_layers': 1, 'embedding_dim': 96, 'lr': 0.0005635627840535672, 'lambda_val': 1.5869463669317388e-05, 'batch_size': 3872, 'optimizer': 'Adam'}. Best is trial 101 with value: 0.08450551456517907.
2026-05-18 11:12:37,204 - experiment_functions - INFO - Early stopping at epoch 750. Best Recall: 0.0780
2026-05-18 11:12:37,352 - optuna.study.study - INFO - Trial 119 finished with value: 0.0779742827679647 and parameters: {'n_layers': 1, 'embedding_dim': 256, 'lr': 0.0008412848443022639, 'lambda_val': 3.663793735702693e-05, 'batch_size': 3518, 'optimizer': 'Adam'}. Best is trial 101 with value: 0.08450551456517907.
2026-05-18 11:12:54,900 - optuna.study._optimize - INFO - Trial 120 pruned. 
2026-05-18 11:13:05,852 - experiment_functions - INFO - Early stopping at epoch 700. Best Recall: 0.0689
2026-05-18 11:13:05,957 - optuna.study.study - INFO - Trial 121 finished with value: 0.06886922148956665 and parameters: {'n_layers': 1, 'embedding_dim': 96, 'lr': 0.0010608955745854442, 'lambda_val': 9.496767621050847e-06, 'batch_size': 3741, 'optimizer': 'Adam'}. Best is trial 101 with value: 0.08450551456517907.
2026-05-18 11:13:15,751 - experiment_functions - INFO - Early stopping at epoch 650. Best Recall: 0.0744
2026-05-18 11:13:15,855 - optuna.study.study - INFO - Trial 122 finished with value: 0.07443018115244654 and parameters: {'n_layers': 1, 'embedding_dim': 96, 'lr': 0.0016522692288865194, 'lambda_val': 1.2536994480908252e-05, 'batch_size': 3385, 'optimizer': 'Adam'}. Best is trial 101 with value: 0.08450551456517907.
2026-05-18 11:13:24,442 - experiment_functions - INFO - Early stopping at epoch 550. Best Recall: 0.0727
2026-05-18 11:13:24,544 - optuna.study.study - INFO - Trial 123 finished with value: 0.07274952118368659 and parameters: {'n_layers': 1, 'embedding_dim': 96, 'lr': 0.006784091118544618, 'lambda_val': 0.0010742005656574562, 'batch_size': 3577, 'optimizer': 'Adam'}. Best is trial 101 with value: 0.08450551456517907.
2026-05-18 11:13:33,711 - experiment_functions - INFO - Early stopping at epoch 600. Best Recall: 0.0711
2026-05-18 11:13:33,813 - optuna.study.study - INFO - Trial 124 finished with value: 0.07107864760714684 and parameters: {'n_layers': 1, 'embedding_dim': 96, 'lr': 0.0027236680760480943, 'lambda_val': 2.585230455604066e-05, 'batch_size': 3804, 'optimizer': 'Adam'}. Best is trial 101 with value: 0.08450551456517907.
2026-05-18 11:13:46,220 - experiment_functions - INFO - Early stopping at epoch 750. Best Recall: 0.0702
2026-05-18 11:13:46,344 - optuna.study.study - INFO - Trial 125 finished with value: 0.07019378256330976 and parameters: {'n_layers': 1, 'embedding_dim': 96, 'lr': 0.0009222753165938669, 'lambda_val': 7.682220925523278e-06, 'batch_size': 3914, 'optimizer': 'Adam'}. Best is trial 101 with value: 0.08450551456517907.
2026-05-18 11:13:53,893 - experiment_functions - INFO - Early stopping at epoch 500. Best Recall: 0.0044
2026-05-18 11:13:53,986 - optuna.study.study - INFO - Trial 126 finished with value: 0.004442047191959104 and parameters: {'n_layers': 1, 'embedding_dim': 128, 'lr': 0.0010963187108490875, 'lambda_val': 5.305937405095478e-06, 'batch_size': 4022, 'optimizer': 'SGD'}. Best is trial 101 with value: 0.08450551456517907.
2026-05-18 11:14:09,281 - optuna.study._optimize - INFO - Trial 127 pruned. 
2026-05-18 11:14:19,531 - experiment_functions - INFO - Early stopping at epoch 650. Best Recall: 0.0703
2026-05-18 11:14:19,636 - optuna.study.study - INFO - Trial 128 finished with value: 0.07028043698962816 and parameters: {'n_layers': 1, 'embedding_dim': 256, 'lr': 0.0014898767841642993, 'lambda_val': 0.004301105959710748, 'batch_size': 3728, 'optimizer': 'Adam'}. Best is trial 101 with value: 0.08450551456517907.
2026-05-18 11:14:29,742 - experiment_functions - INFO - Early stopping at epoch 650. Best Recall: 0.0776
2026-05-18 11:14:29,844 - optuna.study.study - INFO - Trial 129 finished with value: 0.07760068003187244 and parameters: {'n_layers': 1, 'embedding_dim': 96, 'lr': 0.0020559279985287154, 'lambda_val': 6.778194854799614e-05, 'batch_size': 1926, 'optimizer': 'Adam'}. Best is trial 101 with value: 0.08450551456517907.
2026-05-18 11:14:45,493 - optuna.study._optimize - INFO - Trial 130 pruned. 
2026-05-18 11:14:55,275 - experiment_functions - INFO - Early stopping at epoch 600. Best Recall: 0.0788
2026-05-18 11:14:55,367 - optuna.study.study - INFO - Trial 131 finished with value: 0.07883543045389352 and parameters: {'n_layers': 1, 'embedding_dim': 256, 'lr': 0.003239943633340538, 'lambda_val': 1.5543677857041433e-05, 'batch_size': 3544, 'optimizer': 'Adam'}. Best is trial 101 with value: 0.08450551456517907.
2026-05-18 11:15:05,884 - experiment_functions - INFO - Early stopping at epoch 600. Best Recall: 0.0762
2026-05-18 11:15:05,987 - optuna.study.study - INFO - Trial 132 finished with value: 0.07618761892033314 and parameters: {'n_layers': 1, 'embedding_dim': 256, 'lr': 0.0028693201111646346, 'lambda_val': 1.9807762631313317e-05, 'batch_size': 3328, 'optimizer': 'Adam'}. Best is trial 101 with value: 0.08450551456517907.
2026-05-18 11:15:15,293 - experiment_functions - INFO - Early stopping at epoch 550. Best Recall: 0.0786
2026-05-18 11:15:15,395 - optuna.study.study - INFO - Trial 133 finished with value: 0.07862030039770596 and parameters: {'n_layers': 1, 'embedding_dim': 256, 'lr': 0.00492499865710634, 'lambda_val': 1.0659875142603324e-05, 'batch_size': 3647, 'optimizer': 'Adam'}. Best is trial 101 with value: 0.08450551456517907.
2026-05-18 11:15:35,765 - experiment_functions - INFO - Early stopping at epoch 1350. Best Recall: 0.0794
