2026-05-18 13:04:19,416 - optuna.study.study - INFO - Trial 195 finished with value: 0.07301676918676983 and parameters: {'n_layers': 1, 'embedding_dim': 32, 'lr': 0.0007714851505993723, 'lambda_val': 3.073758849343983e-06, 'batch_size': 712, 'optimizer': 'RMSprop'}. Best is trial 149 with value: 0.07541976849128529.
2026-05-18 13:04:35,451 - optuna.study._optimize - INFO - Trial 196 pruned. 
2026-05-18 13:04:51,922 - optuna.study._optimize - INFO - Trial 197 pruned. 
2026-05-18 13:05:04,365 - experiment_functions - INFO - Early stopping at epoch 750. Best Recall: 0.0608
2026-05-18 13:05:04,483 - optuna.study.study - INFO - Trial 198 finished with value: 0.06076892346055441 and parameters: {'n_layers': 1, 'embedding_dim': 32, 'lr': 0.0016032493011457268, 'lambda_val': 3.1265394093004144e-06, 'batch_size': 716, 'optimizer': 'RMSprop'}. Best is trial 149 with value: 0.07541976849128529.
2026-05-18 13:05:20,789 - optuna.study._optimize - INFO - Trial 199 pruned. 
2026-05-18 13:05:38,832 - experiment_functions - INFO - Early stopping at epoch 1150. Best Recall: 0.0695
2026-05-18 13:05:38,966 - optuna.study.study - INFO - Trial 200 finished with value: 0.06947142973987991 and parameters: {'n_layers': 1, 'embedding_dim': 32, 'lr': 0.00108096392758582, 'lambda_val': 2.8313988931530396e-06, 'batch_size': 626, 'optimizer': 'RMSprop'}. Best is trial 149 with value: 0.07541976849128529.
2026-05-18 13:05:54,725 - optuna.study._optimize - INFO - Trial 201 pruned. 
2026-05-18 13:06:27,831 - experiment_functions - INFO - Early stopping at epoch 2300. Best Recall: 0.0727
2026-05-18 13:06:27,918 - optuna.study.study - INFO - Trial 202 finished with value: 0.0726675618227443 and parameters: {'n_layers': 1, 'embedding_dim': 32, 'lr': 0.0007824272037718171, 'lambda_val': 2.572742595626748e-06, 'batch_size': 607, 'optimizer': 'RMSprop'}. Best is trial 149 with value: 0.07541976849128529.
2026-05-18 13:06:43,779 - optuna.study._optimize - INFO - Trial 203 pruned. 
2026-05-18 13:06:57,445 - optuna.study._optimize - INFO - Trial 204 pruned. 
2026-05-18 13:07:12,272 - experiment_functions - INFO - Early stopping at epoch 1050. Best Recall: 0.0672
2026-05-18 13:07:12,362 - optuna.study.study - INFO - Trial 205 finished with value: 0.0671562024340664 and parameters: {'n_layers': 1, 'embedding_dim': 32, 'lr': 0.0012938110899569815, 'lambda_val': 7.442392582114547e-06, 'batch_size': 637, 'optimizer': 'RMSprop'}. Best is trial 149 with value: 0.07541976849128529.
2026-05-18 13:07:29,584 - optuna.study._optimize - INFO - Trial 206 pruned. 
2026-05-18 13:07:41,076 - experiment_functions - INFO - Early stopping at epoch 750. Best Recall: 0.0542
2026-05-18 13:07:41,155 - optuna.study.study - INFO - Trial 207 finished with value: 0.05418991828659564 and parameters: {'n_layers': 1, 'embedding_dim': 32, 'lr': 0.0010307320679402393, 'lambda_val': 4.8206912935657705e-06, 'batch_size': 2534, 'optimizer': 'RMSprop'}. Best is trial 149 with value: 0.07541976849128529.
2026-05-18 13:07:58,603 - optuna.study._optimize - INFO - Trial 208 pruned. 
2026-05-18 13:08:14,191 - optuna.study._optimize - INFO - Trial 209 pruned. 
2026-05-18 13:08:33,238 - optuna.study._optimize - INFO - Trial 210 pruned. 
2026-05-18 13:08:54,793 - optuna.study._optimize - INFO - Trial 211 pruned. 
2026-05-18 13:09:13,400 - experiment_functions - INFO - Early stopping at epoch 1300. Best Recall: 0.0724
2026-05-18 13:09:13,496 - optuna.study.study - INFO - Trial 212 finished with value: 0.07240675935910797 and parameters: {'n_layers': 1, 'embedding_dim': 32, 'lr': 0.001042633197580169, 'lambda_val': 1.7274659144774945e-06, 'batch_size': 574, 'optimizer': 'RMSprop'}. Best is trial 149 with value: 0.07541976849128529.
2026-05-18 13:09:33,116 - experiment_functions - INFO - Early stopping at epoch 1350. Best Recall: 0.0692
2026-05-18 13:09:33,263 - optuna.study.study - INFO - Trial 213 finished with value: 0.0691696046104715 and parameters: {'n_layers': 1, 'embedding_dim': 32, 'lr': 0.00111324406319354, 'lambda_val': 1.6525971813184843e-06, 'batch_size': 583, 'optimizer': 'RMSprop'}. Best is trial 149 with value: 0.07541976849128529.
2026-05-18 13:09:46,862 - experiment_functions - INFO - Early stopping at epoch 800. Best Recall: 0.0617
2026-05-18 13:09:46,981 - optuna.study.study - INFO - Trial 214 finished with value: 0.06166218220649835 and parameters: {'n_layers': 1, 'embedding_dim': 32, 'lr': 0.0015056778109463354, 'lambda_val': 2.9318260406333325e-06, 'batch_size': 568, 'optimizer': 'RMSprop'}. Best is trial 149 with value: 0.07541976849128529.
2026-05-18 13:10:06,789 - experiment_functions - INFO - Early stopping at epoch 1400. Best Recall: 0.0689
2026-05-18 13:10:06,867 - optuna.study.study - INFO - Trial 215 finished with value: 0.06889432362289512 and parameters: {'n_layers': 1, 'embedding_dim': 32, 'lr': 0.0010381207058341177, 'lambda_val': 3.9839728833410005e-06, 'batch_size': 512, 'optimizer': 'RMSprop'}. Best is trial 149 with value: 0.07541976849128529.
2026-05-18 13:10:20,900 - optuna.study._optimize - INFO - Trial 216 pruned. 
2026-05-18 13:10:40,778 - optuna.study._optimize - INFO - Trial 217 pruned. 
2026-05-18 13:10:56,012 - optuna.study._optimize - INFO - Trial 218 pruned. 
2026-05-18 13:11:10,086 - experiment_functions - INFO - Early stopping at epoch 950. Best Recall: 0.0648
2026-05-18 13:11:10,220 - optuna.study.study - INFO - Trial 219 finished with value: 0.06475591774050969 and parameters: {'n_layers': 1, 'embedding_dim': 96, 'lr': 0.001207121713086213, 'lambda_val': 6.002170316434469e-06, 'batch_size': 574, 'optimizer': 'RMSprop'}. Best is trial 149 with value: 0.07541976849128529.
2026-05-18 13:11:33,385 - optuna.study._optimize - INFO - Trial 220 pruned. 
2026-05-18 13:12:08,935 - experiment_functions - INFO - Early stopping at epoch 2250. Best Recall: 0.0724
2026-05-18 13:12:09,053 - optuna.study.study - INFO - Trial 221 finished with value: 0.07242376184078844 and parameters: {'n_layers': 1, 'embedding_dim': 32, 'lr': 0.0007986303119200862, 'lambda_val': 2.0928092829706846e-06, 'batch_size': 692, 'optimizer': 'RMSprop'}. Best is trial 149 with value: 0.07541976849128529.
2026-05-18 13:12:24,124 - optuna.study._optimize - INFO - Trial 222 pruned. 
2026-05-18 13:13:00,855 - experiment_functions - INFO - Early stopping at epoch 2550. Best Recall: 0.0729
2026-05-18 13:13:00,997 - optuna.study.study - INFO - Trial 223 finished with value: 0.07292455106676221 and parameters: {'n_layers': 1, 'embedding_dim': 32, 'lr': 0.0007440085495862408, 'lambda_val': 2.488383051295286e-06, 'batch_size': 806, 'optimizer': 'RMSprop'}. Best is trial 149 with value: 0.07541976849128529.
2026-05-18 13:13:16,400 - optuna.study._optimize - INFO - Trial 224 pruned. 
2026-05-18 13:13:36,056 - optuna.study._optimize - INFO - Trial 225 pruned. 
2026-05-18 13:13:50,750 - optuna.study._optimize - INFO - Trial 226 pruned. 
2026-05-18 13:14:05,340 - optuna.study._optimize - INFO - Trial 227 pruned. 
2026-05-18 13:14:24,277 - experiment_functions - INFO - Early stopping at epoch 1200. Best Recall: 0.0703
2026-05-18 13:14:24,385 - optuna.study.study - INFO - Trial 228 finished with value: 0.07034474606180076 and parameters: {'n_layers': 1, 'embedding_dim': 32, 'lr': 0.0013082190399764013, 'lambda_val': 4.616870876914743e-06, 'batch_size': 513, 'optimizer': 'RMSprop'}. Best is trial 149 with value: 0.07541976849128529.
2026-05-18 13:14:36,285 - experiment_functions - INFO - Early stopping at epoch 700. Best Recall: 0.0536
2026-05-18 13:14:36,388 - optuna.study.study - INFO - Trial 229 finished with value: 0.053602344212881244 and parameters: {'n_layers': 2, 'embedding_dim': 32, 'lr': 0.0010415354432808262, 'lambda_val': 2.5760873687956254e-06, 'batch_size': 725, 'optimizer': 'RMSprop'}. Best is trial 149 with value: 0.07541976849128529.
2026-05-18 13:14:51,442 - optuna.study._optimize - INFO - Trial 230 pruned. 
2026-05-18 13:15:34,510 - experiment_functions - INFO - Early stopping at epoch 3000. Best Recall: 0.0734
2026-05-18 13:15:34,599 - optuna.study.study - INFO - Trial 231 finished with value: 0.07340589301471168 and parameters: {'n_layers': 1, 'embedding_dim': 32, 'lr': 0.0007718666386216927, 'lambda_val': 3.1861387003945777e-06, 'batch_size': 575, 'optimizer': 'RMSprop'}. Best is trial 149 with value: 0.07541976849128529.
2026-05-18 13:15:49,511 - optuna.study._optimize - INFO - Trial 232 pruned. 
2026-05-18 13:16:03,853 - optuna.study._optimize - INFO - Trial 233 pruned. 
2026-05-18 13:16:18,630 - optuna.study._optimize - INFO - Trial 234 pruned. 
2026-05-18 13:16:30,434 - experiment_functions - INFO - Early stopping at epoch 750. Best Recall: 0.0581
2026-05-18 13:16:30,543 - optuna.study.study - INFO - Trial 235 finished with value: 0.05814602789839155 and parameters: {'n_layers': 1, 'embedding_dim': 32, 'lr': 0.0011216694135665482, 'lambda_val': 3.914732550727338e-06, 'batch_size': 3838, 'optimizer': 'RMSprop'}. Best is trial 149 with value: 0.07541976849128529.
2026-05-18 13:16:58,516 - experiment_functions - INFO - Early stopping at epoch 2000. Best Recall: 0.0724
2026-05-18 13:16:58,604 - optuna.study.study - INFO - Trial 236 finished with value: 0.07236663469804308 and parameters: {'n_layers': 1, 'embedding_dim': 32, 'lr': 0.0008863916967096013, 'lambda_val': 2.215035485283454e-06, 'batch_size': 625, 'optimizer': 'RMSprop'}. Best is trial 149 with value: 0.07541976849128529.
2026-05-18 13:17:13,812 - experiment_functions - INFO - Early stopping at epoch 850. Best Recall: 0.0561
2026-05-18 13:17:13,903 - optuna.study.study - INFO - Trial 237 finished with value: 0.05612471458906841 and parameters: {'n_layers': 1, 'embedding_dim': 32, 'lr': 0.001442407840049904, 'lambda_val': 3.001888419639362e-06, 'batch_size': 640, 'optimizer': 'RMSprop'}. Best is trial 149 with value: 0.07541976849128529.
2026-05-18 13:17:28,371 - optuna.study._optimize - INFO - Trial 238 pruned. 
2026-05-18 13:17:44,908 - optuna.study._optimize - INFO - Trial 239 pruned. 
2026-05-18 13:17:58,400 - experiment_functions - INFO - Early stopping at epoch 950. Best Recall: 0.0051
2026-05-18 13:17:58,546 - optuna.study.study - INFO - Trial 240 finished with value: 0.005101122195120531 and parameters: {'n_layers': 1, 'embedding_dim': 32, 'lr': 3.4006945690560115e-05, 'lambda_val': 1.6245152946009018e-06, 'batch_size': 591, 'optimizer': 'RMSprop'}. Best is trial 149 with value: 0.07541976849128529.
2026-05-18 13:18:20,195 - optuna.study._optimize - INFO - Trial 241 pruned. 
2026-05-18 13:18:39,917 - optuna.study._optimize - INFO - Trial 242 pruned. 
2026-05-18 13:18:55,043 - optuna.study._optimize - INFO - Trial 243 pruned. 
2026-05-18 13:19:09,982 - optuna.study._optimize - INFO - Trial 244 pruned. 
2026-05-18 13:19:17,726 - experiment_functions - INFO - Early stopping at epoch 500. Best Recall: 0.0052
2026-05-18 13:19:17,823 - optuna.study.study - INFO - Trial 245 finished with value: 0.0052255559507519925 and parameters: {'n_layers': 1, 'embedding_dim': 32, 'lr': 0.000892080122697288, 'lambda_val': 2.899729933815247e-06, 'batch_size': 678, 'optimizer': 'SGD'}. Best is trial 149 with value: 0.07541976849128529.
2026-05-18 13:19:34,948 - optuna.study._optimize - INFO - Trial 246 pruned. 
2026-05-18 13:19:42,694 - experiment_functions - INFO - Early stopping at epoch 550. Best Recall: 0.0055
2026-05-18 13:19:42,794 - optuna.study.study - INFO - Trial 247 finished with value: 0.005518138001683098 and parameters: {'n_layers': 1, 'embedding_dim': 32, 'lr': 1.574979509064263e-05, 'lambda_val': 2.1193660672971983e-06, 'batch_size': 574, 'optimizer': 'RMSprop'}. Best is trial 149 with value: 0.07541976849128529.
2026-05-18 13:19:56,462 - optuna.study._optimize - INFO - Trial 248 pruned. 
2026-05-18 13:20:19,895 - experiment_functions - INFO - Early stopping at epoch 1550. Best Recall: 0.0712
2026-05-18 13:20:19,994 - optuna.study.study - INFO - Trial 249 finished with value: 0.07117657626007624 and parameters: {'n_layers': 1, 'embedding_dim': 32, 'lr': 0.0010505372799654196, 'lambda_val': 1.7407326139583802e-06, 'batch_size': 627, 'optimizer': 'RMSprop'}. Best is trial 149 with value: 0.07541976849128529.
2026-05-18 13:20:35,878 - experiment_functions - INFO - Early stopping at epoch 1050. Best Recall: 0.0664
2026-05-18 13:20:35,975 - optuna.study.study - INFO - Trial 250 finished with value: 0.06635865035984483 and parameters: {'n_layers': 1, 'embedding_dim': 32, 'lr': 0.0012255104874780527, 'lambda_val': 1.3225288930341326e-06, 'batch_size': 760, 'optimizer': 'RMSprop'}. Best is trial 149 with value: 0.07541976849128529.
2026-05-18 13:20:59,844 - experiment_functions - INFO - Early stopping at epoch 1500. Best Recall: 0.0704
2026-05-18 13:20:59,932 - optuna.study.study - INFO - Trial 251 finished with value: 0.07037893193670419 and parameters: {'n_layers': 1, 'embedding_dim': 32, 'lr': 0.00103132408612814, 'lambda_val': 4.270423760398909e-06, 'batch_size': 628, 'optimizer': 'RMSprop'}. Best is trial 149 with value: 0.07541976849128529.
2026-05-18 13:21:11,915 - experiment_functions - INFO - Early stopping at epoch 850. Best Recall: 0.0613
2026-05-18 13:21:12,007 - optuna.study.study - INFO - Trial 252 finished with value: 0.06132190920183906 and parameters: {'n_layers': 1, 'embedding_dim': 32, 'lr': 0.0014513788343658034, 'lambda_val': 2.730940794144201e-06, 'batch_size': 709, 'optimizer': 'RMSprop'}. Best is trial 149 with value: 0.07541976849128529.
2026-05-18 13:21:28,664 - optuna.study._optimize - INFO - Trial 253 pruned. 
2026-05-18 13:21:53,358 - experiment_functions - INFO - Early stopping at epoch 1600. Best Recall: 0.0743
2026-05-18 13:21:53,447 - optuna.study.study - INFO - Trial 254 finished with value: 0.07430008101231417 and parameters: {'n_layers': 1, 'embedding_dim': 32, 'lr': 0.0010637706840737348, 'lambda_val': 1.098793296583205e-06, 'batch_size': 513, 'optimizer': 'RMSprop'}. Best is trial 149 with value: 0.07541976849128529.
2026-05-18 13:22:03,197 - experiment_functions - INFO - Early stopping at epoch 550. Best Recall: 0.0254
2026-05-18 13:22:03,731 - optuna.study.study - INFO - Trial 255 finished with value: 0.025430645895782554 and parameters: {'n_layers': 4, 'embedding_dim': 96, 'lr': 0.0011066223483643851, 'lambda_val': 1.0468288447418193e-06, 'batch_size': 643, 'optimizer': 'RMSprop'}. Best is trial 149 with value: 0.07541976849128529.
2026-05-18 13:22:18,431 - optuna.study._optimize - INFO - Trial 256 pruned. 
2026-05-18 13:22:33,488 - optuna.study._optimize - INFO - Trial 257 pruned. 
2026-05-18 13:22:47,748 - optuna.study._optimize - INFO - Trial 258 pruned. 
2026-05-18 13:23:02,708 - experiment_functions - INFO - Early stopping at epoch 900. Best Recall: 0.0663
2026-05-18 13:23:02,820 - optuna.study.study - INFO - Trial 259 finished with value: 0.06633299039679558 and parameters: {'n_layers': 1, 'embedding_dim': 32, 'lr': 0.001513040004195493, 'lambda_val': 5.350776283236284e-06, 'batch_size': 674, 'optimizer': 'RMSprop'}. Best is trial 149 with value: 0.07541976849128529.
2026-05-18 13:23:18,054 - optuna.study._optimize - INFO - Trial 260 pruned. 
2026-05-18 13:23:38,150 - experiment_functions - INFO - Early stopping at epoch 1350. Best Recall: 0.0717
2026-05-18 13:23:38,259 - optuna.study.study - INFO - Trial 261 finished with value: 0.07169342079280075 and parameters: {'n_layers': 1, 'embedding_dim': 32, 'lr': 0.0011287577972811996, 'lambda_val': 3.7118396435527984e-06, 'batch_size': 581, 'optimizer': 'RMSprop'}. Best is trial 149 with value: 0.07541976849128529.
2026-05-18 13:23:54,249 - optuna.study._optimize - INFO - Trial 262 pruned. 
2026-05-18 13:24:08,359 - optuna.study._optimize - INFO - Trial 263 pruned. 
2026-05-18 13:24:20,678 - experiment_functions - INFO - Early stopping at epoch 850. Best Recall: 0.0127
2026-05-18 13:24:20,777 - optuna.study.study - INFO - Trial 264 finished with value: 0.012738472714124075 and parameters: {'n_layers': 1, 'embedding_dim': 32, 'lr': 0.02954819938340252, 'lambda_val': 4.511694868352082e-06, 'batch_size': 576, 'optimizer': 'RMSprop'}. Best is trial 149 with value: 0.07541976849128529.
2026-05-18 13:24:43,539 - optuna.study._optimize - INFO - Trial 265 pruned. 
2026-05-18 13:24:50,447 - experiment_functions - INFO - Early stopping at epoch 500. Best Recall: 0.0043
2026-05-18 13:24:50,536 - optuna.study.study - INFO - Trial 266 finished with value: 0.00429348739648743 and parameters: {'n_layers': 1, 'embedding_dim': 32, 'lr': 0.0007339413348756373, 'lambda_val': 3.924003723630442e-06, 'batch_size': 572, 'optimizer': 'SGD'}. Best is trial 149 with value: 0.07541976849128529.
2026-05-18 13:25:04,318 - experiment_functions - INFO - Early stopping at epoch 900. Best Recall: 0.0655
2026-05-18 13:25:04,407 - optuna.study.study - INFO - Trial 267 finished with value: 0.06545757021557289 and parameters: {'n_layers': 1, 'embedding_dim': 32, 'lr': 0.0016095781569599313, 'lambda_val': 2.540776789030825e-06, 'batch_size': 517, 'optimizer': 'RMSprop'}. Best is trial 149 with value: 0.07541976849128529.
2026-05-18 13:25:25,925 - optuna.study._optimize - INFO - Trial 268 pruned. 
2026-05-18 13:25:41,356 - optuna.study._optimize - INFO - Trial 269 pruned. 
2026-05-18 13:25:57,064 - optuna.study._optimize - INFO - Trial 270 pruned. 
2026-05-18 13:26:11,470 - optuna.study._optimize - INFO - Trial 271 pruned. 
2026-05-18 13:26:27,623 - optuna.study._optimize - INFO - Trial 272 pruned. 
2026-05-18 13:26:45,462 - optuna.study._optimize - INFO - Trial 273 pruned. 
2026-05-18 13:27:02,861 - optuna.study._optimize - INFO - Trial 274 pruned. 
2026-05-18 13:27:18,460 - experiment_functions - INFO - Early stopping at epoch 1050. Best Recall: 0.0694
2026-05-18 13:27:18,548 - optuna.study.study - INFO - Trial 275 finished with value: 0.06938612738982554 and parameters: {'n_layers': 1, 'embedding_dim': 32, 'lr': 0.001263478097307297, 'lambda_val': 2.207462285523408e-06, 'batch_size': 587, 'optimizer': 'RMSprop'}. Best is trial 149 with value: 0.07541976849128529.
2026-05-18 13:27:28,796 - experiment_functions - INFO - Early stopping at epoch 600. Best Recall: 0.0376
2026-05-18 13:27:28,884 - optuna.study.study - INFO - Trial 276 finished with value: 0.03763584588398538 and parameters: {'n_layers': 3, 'embedding_dim': 32, 'lr': 0.001038245136784019, 'lambda_val': 3.3015940183442524e-06, 'batch_size': 675, 'optimizer': 'RMSprop'}. Best is trial 149 with value: 0.07541976849128529.
2026-05-18 13:27:46,447 - optuna.study._optimize - INFO - Trial 277 pruned. 
2026-05-18 13:28:01,923 - optuna.study._optimize - INFO - Trial 278 pruned. 
2026-05-18 13:28:19,952 - optuna.study._optimize - INFO - Trial 279 pruned. 
2026-05-18 13:28:33,763 - experiment_functions - INFO - Early stopping at epoch 800. Best Recall: 0.0687
2026-05-18 13:28:33,853 - optuna.study.study - INFO - Trial 280 finished with value: 0.06865477260743914 and parameters: {'n_layers': 1, 'embedding_dim': 32, 'lr': 0.0014829161360357284, 'lambda_val': 3.6191724762283064e-06, 'batch_size': 729, 'optimizer': 'RMSprop'}. Best is trial 149 with value: 0.07541976849128529.
2026-05-18 13:28:50,165 - optuna.study._optimize - INFO - Trial 281 pruned. 
2026-05-18 13:29:07,194 - optuna.study._optimize - INFO - Trial 282 pruned. 
2026-05-18 13:29:22,946 - optuna.study._optimize - INFO - Trial 283 pruned. 
2026-05-18 13:29:43,223 - optuna.study._optimize - INFO - Trial 284 pruned. 
2026-05-18 13:29:58,181 - optuna.study._optimize - INFO - Trial 285 pruned. 
2026-05-18 13:30:13,507 - optuna.study._optimize - INFO - Trial 286 pruned. 
2026-05-18 13:30:29,975 - optuna.study._optimize - INFO - Trial 287 pruned. 
2026-05-18 13:30:37,698 - experiment_functions - INFO - Early stopping at epoch 500. Best Recall: 0.0052
2026-05-18 13:30:37,797 - optuna.study.study - INFO - Trial 288 finished with value: 0.005244854102462564 and parameters: {'n_layers': 1, 'embedding_dim': 32, 'lr': 0.00039629722792967453, 'lambda_val': 2.3004786674542532e-06, 'batch_size': 695, 'optimizer': 'SGD'}. Best is trial 149 with value: 0.07541976849128529.
2026-05-18 13:30:54,812 - optuna.study._optimize - INFO - Trial 289 pruned. 
2026-05-18 13:31:06,829 - experiment_functions - INFO - Early stopping at epoch 800. Best Recall: 0.0589
2026-05-18 13:31:06,929 - optuna.study.study - INFO - Trial 290 finished with value: 0.05893295555184222 and parameters: {'n_layers': 1, 'embedding_dim': 32, 'lr': 0.001667008918005155, 'lambda_val': 5.188198440668393e-06, 'batch_size': 635, 'optimizer': 'RMSprop'}. Best is trial 149 with value: 0.07541976849128529.
2026-05-18 13:31:28,287 - experiment_functions - INFO - Early stopping at epoch 1400. Best Recall: 0.0708
2026-05-18 13:31:28,374 - optuna.study.study - INFO - Trial 291 finished with value: 0.07078465164813275 and parameters: {'n_layers': 1, 'embedding_dim': 32, 'lr': 0.0008767151434446314, 'lambda_val': 1.8765022294775232e-06, 'batch_size': 791, 'optimizer': 'RMSprop'}. Best is trial 149 with value: 0.07541976849128529.
2026-05-18 13:31:49,141 - optuna.study._optimize - INFO - Trial 292 pruned. 
2026-05-18 13:31:59,486 - experiment_functions - INFO - Early stopping at epoch 650. Best Recall: 0.0530
2026-05-18 13:31:59,585 - optuna.study.study - INFO - Trial 293 finished with value: 0.05297000829526424 and parameters: {'n_layers': 2, 'embedding_dim': 32, 'lr': 0.0011995694631244543, 'lambda_val': 3.7717259025902697e-06, 'batch_size': 693, 'optimizer': 'RMSprop'}. Best is trial 149 with value: 0.07541976849128529.
2026-05-18 13:32:13,471 - optuna.study._optimize - INFO - Trial 294 pruned. 
2026-05-18 13:32:27,767 - optuna.study._optimize - INFO - Trial 295 pruned. 
2026-05-18 13:32:41,395 - optuna.study._optimize - INFO - Trial 296 pruned. 
2026-05-18 13:33:07,600 - optuna.study._optimize - INFO - Trial 297 pruned. 
2026-05-18 13:33:24,639 - optuna.study._optimize - INFO - Trial 298 pruned. 
