2026-05-18 03:34:21,759 - optuna.study.study - INFO - Trial 230 finished with value: 0.004999312932862973 and parameters: {'n_layers': 2, 'embedding_dim': 32, 'lr': 0.0008393234711688246, 'lambda_val': 0.0007853098900130348, 'batch_size': 699, 'optimizer': 'SGD'}. Best is trial 214 with value: 0.07497030493998583.
2026-05-18 03:35:00,459 - experiment_functions - INFO - Early stopping at epoch 2550. Best Recall: 0.0702
2026-05-18 03:35:00,547 - optuna.study.study - INFO - Trial 231 finished with value: 0.07015203157296664 and parameters: {'n_layers': 2, 'embedding_dim': 32, 'lr': 0.00042836108248847855, 'lambda_val': 0.0016629892991435718, 'batch_size': 573, 'optimizer': 'RMSprop'}. Best is trial 214 with value: 0.07497030493998583.
2026-05-18 03:35:14,762 - optuna.study._optimize - INFO - Trial 232 pruned. 
2026-05-18 03:35:36,118 - optuna.study._optimize - INFO - Trial 233 pruned. 
2026-05-18 03:36:41,711 - optuna.study.study - INFO - Trial 234 finished with value: 0.07125185449314278 and parameters: {'n_layers': 2, 'embedding_dim': 32, 'lr': 0.00041634945989857034, 'lambda_val': 0.0016543534376828736, 'batch_size': 512, 'optimizer': 'RMSprop'}. Best is trial 214 with value: 0.07497030493998583.
2026-05-18 03:36:55,917 - optuna.study._optimize - INFO - Trial 235 pruned. 
2026-05-18 03:37:11,028 - optuna.study._optimize - INFO - Trial 236 pruned. 
2026-05-18 03:37:25,458 - optuna.study._optimize - INFO - Trial 237 pruned. 
2026-05-18 03:37:40,147 - optuna.study._optimize - INFO - Trial 238 pruned. 
2026-05-18 03:38:06,613 - experiment_functions - INFO - Early stopping at epoch 1550. Best Recall: 0.0682
2026-05-18 03:38:07,379 - optuna.study.study - INFO - Trial 239 finished with value: 0.06820613578585279 and parameters: {'n_layers': 2, 'embedding_dim': 32, 'lr': 0.0005103179102566505, 'lambda_val': 0.0013149517453805142, 'batch_size': 722, 'optimizer': 'RMSprop'}. Best is trial 214 with value: 0.07497030493998583.
2026-05-18 03:38:26,138 - optuna.study._optimize - INFO - Trial 240 pruned. 
2026-05-18 03:38:40,758 - optuna.study._optimize - INFO - Trial 241 pruned. 
2026-05-18 03:39:02,612 - optuna.study._optimize - INFO - Trial 242 pruned. 
2026-05-18 03:39:18,932 - optuna.study._optimize - INFO - Trial 243 pruned. 
2026-05-18 03:39:46,118 - experiment_functions - INFO - Early stopping at epoch 2000. Best Recall: 0.0687
2026-05-18 03:39:46,208 - optuna.study.study - INFO - Trial 244 finished with value: 0.06866296720993675 and parameters: {'n_layers': 2, 'embedding_dim': 32, 'lr': 0.0005353808914888667, 'lambda_val': 0.0012395086496116035, 'batch_size': 513, 'optimizer': 'RMSprop'}. Best is trial 214 with value: 0.07497030493998583.
2026-05-18 03:40:04,110 - experiment_functions - INFO - Early stopping at epoch 1250. Best Recall: 0.0652
2026-05-18 03:40:04,210 - optuna.study.study - INFO - Trial 245 finished with value: 0.06522125837294912 and parameters: {'n_layers': 2, 'embedding_dim': 32, 'lr': 0.0005426861336845189, 'lambda_val': 0.0022711959998503984, 'batch_size': 579, 'optimizer': 'RMSprop'}. Best is trial 214 with value: 0.07497030493998583.
2026-05-18 03:40:32,168 - experiment_functions - INFO - Early stopping at epoch 1350. Best Recall: 0.0646
2026-05-18 03:40:32,258 - optuna.study.study - INFO - Trial 246 finished with value: 0.06463022198269362 and parameters: {'n_layers': 2, 'embedding_dim': 32, 'lr': 0.0006468301236453951, 'lambda_val': 0.0014209983644191306, 'batch_size': 569, 'optimizer': 'RMSprop'}. Best is trial 214 with value: 0.07497030493998583.
2026-05-18 03:40:46,983 - optuna.study._optimize - INFO - Trial 247 pruned. 
2026-05-18 03:41:02,141 - optuna.study._optimize - INFO - Trial 248 pruned. 
2026-05-18 03:41:15,370 - experiment_functions - INFO - Early stopping at epoch 900. Best Recall: 0.0533
2026-05-18 03:41:15,479 - optuna.study.study - INFO - Trial 249 finished with value: 0.05328000067856608 and parameters: {'n_layers': 2, 'embedding_dim': 32, 'lr': 0.0007198294101097951, 'lambda_val': 0.0031580329671008146, 'batch_size': 741, 'optimizer': 'RMSprop'}. Best is trial 214 with value: 0.07497030493998583.
2026-05-18 03:41:29,121 - optuna.study._optimize - INFO - Trial 250 pruned. 
2026-05-18 03:42:01,138 - experiment_functions - INFO - Early stopping at epoch 2350. Best Recall: 0.0678
2026-05-18 03:42:01,227 - optuna.study.study - INFO - Trial 251 finished with value: 0.06781016940045625 and parameters: {'n_layers': 2, 'embedding_dim': 32, 'lr': 0.0005422756301396002, 'lambda_val': 0.001239170641323664, 'batch_size': 521, 'optimizer': 'RMSprop'}. Best is trial 214 with value: 0.07497030493998583.
2026-05-18 03:42:15,280 - experiment_functions - INFO - Early stopping at epoch 950. Best Recall: 0.0453
2026-05-18 03:42:15,381 - optuna.study.study - INFO - Trial 252 finished with value: 0.04530715131656894 and parameters: {'n_layers': 4, 'embedding_dim': 32, 'lr': 0.0005324218837921801, 'lambda_val': 0.0004736101903585334, 'batch_size': 524, 'optimizer': 'RMSprop'}. Best is trial 214 with value: 0.07497030493998583.
2026-05-18 03:42:30,124 - optuna.study._optimize - INFO - Trial 253 pruned. 
2026-05-18 03:42:53,420 - optuna.study._optimize - INFO - Trial 254 pruned. 
2026-05-18 03:43:07,298 - optuna.study._optimize - INFO - Trial 255 pruned. 
2026-05-18 03:43:30,766 - experiment_functions - INFO - Early stopping at epoch 1700. Best Recall: 0.0661
2026-05-18 03:43:30,864 - optuna.study.study - INFO - Trial 256 finished with value: 0.0661246924731999 and parameters: {'n_layers': 2, 'embedding_dim': 32, 'lr': 0.0005561008057510601, 'lambda_val': 0.0012211023198152612, 'batch_size': 634, 'optimizer': 'RMSprop'}. Best is trial 214 with value: 0.07497030493998583.
2026-05-18 03:44:08,156 - experiment_functions - INFO - Early stopping at epoch 1950. Best Recall: 0.0664
2026-05-18 03:44:08,343 - optuna.study.study - INFO - Trial 257 finished with value: 0.06635061549757824 and parameters: {'n_layers': 2, 'embedding_dim': 32, 'lr': 0.0004332178294633368, 'lambda_val': 0.0019127718584125296, 'batch_size': 848, 'optimizer': 'RMSprop'}. Best is trial 214 with value: 0.07497030493998583.
2026-05-18 03:44:22,552 - optuna.study._optimize - INFO - Trial 258 pruned. 
2026-05-18 03:44:37,243 - optuna.study._optimize - INFO - Trial 259 pruned. 
2026-05-18 03:44:44,376 - experiment_functions - INFO - Early stopping at epoch 500. Best Recall: 0.0051
2026-05-18 03:44:44,445 - optuna.study.study - INFO - Trial 260 finished with value: 0.005050271001852993 and parameters: {'n_layers': 2, 'embedding_dim': 32, 'lr': 0.0006564204564044237, 'lambda_val': 0.0006118808466910434, 'batch_size': 513, 'optimizer': 'SGD'}. Best is trial 214 with value: 0.07497030493998583.
2026-05-18 03:45:02,127 - optuna.study._optimize - INFO - Trial 261 pruned. 
2026-05-18 03:45:17,506 - optuna.study._optimize - INFO - Trial 262 pruned. 
2026-05-18 03:45:29,050 - experiment_functions - INFO - Early stopping at epoch 850. Best Recall: 0.0537
2026-05-18 03:45:29,184 - optuna.study.study - INFO - Trial 263 finished with value: 0.05365424071561676 and parameters: {'n_layers': 2, 'embedding_dim': 32, 'lr': 0.0008252519107820127, 'lambda_val': 0.0011486793234400032, 'batch_size': 715, 'optimizer': 'RMSprop'}. Best is trial 214 with value: 0.07497030493998583.
2026-05-18 03:45:43,146 - optuna.study._optimize - INFO - Trial 264 pruned. 
2026-05-18 03:46:12,761 - optuna.study._optimize - INFO - Trial 265 pruned. 
2026-05-18 03:46:36,728 - optuna.study._optimize - INFO - Trial 266 pruned. 
2026-05-18 03:46:51,198 - optuna.study._optimize - INFO - Trial 267 pruned. 
2026-05-18 03:47:11,301 - optuna.study._optimize - INFO - Trial 268 pruned. 
2026-05-18 03:47:21,505 - experiment_functions - INFO - Early stopping at epoch 700. Best Recall: 0.0398
2026-05-18 03:47:21,605 - optuna.study.study - INFO - Trial 269 finished with value: 0.03975306000164602 and parameters: {'n_layers': 2, 'embedding_dim': 32, 'lr': 0.0007552248431669243, 'lambda_val': 0.0024631441397554043, 'batch_size': 2680, 'optimizer': 'RMSprop'}. Best is trial 214 with value: 0.07497030493998583.
2026-05-18 03:47:35,332 - optuna.study._optimize - INFO - Trial 270 pruned. 
2026-05-18 03:47:59,341 - optuna.study._optimize - INFO - Trial 271 pruned. 
2026-05-18 03:48:30,973 - experiment_functions - INFO - Early stopping at epoch 2100. Best Recall: 0.0666
2026-05-18 03:48:31,058 - optuna.study.study - INFO - Trial 272 finished with value: 0.0665655611097462 and parameters: {'n_layers': 2, 'embedding_dim': 32, 'lr': 0.0005547621857531034, 'lambda_val': 0.0017386519101254294, 'batch_size': 515, 'optimizer': 'RMSprop'}. Best is trial 214 with value: 0.07497030493998583.
2026-05-18 03:48:44,445 - experiment_functions - INFO - Early stopping at epoch 800. Best Recall: 0.0534
2026-05-18 03:48:44,536 - optuna.study.study - INFO - Trial 273 finished with value: 0.05339921768203864 and parameters: {'n_layers': 2, 'embedding_dim': 32, 'lr': 0.0009505440956141609, 'lambda_val': 0.0005835299581624978, 'batch_size': 623, 'optimizer': 'RMSprop'}. Best is trial 214 with value: 0.07497030493998583.
2026-05-18 03:48:58,625 - optuna.study._optimize - INFO - Trial 274 pruned. 
2026-05-18 03:49:12,115 - optuna.study._optimize - INFO - Trial 275 pruned. 
2026-05-18 03:49:23,575 - experiment_functions - INFO - Early stopping at epoch 750. Best Recall: 0.0464
2026-05-18 03:49:23,710 - optuna.study.study - INFO - Trial 276 finished with value: 0.04637681691222842 and parameters: {'n_layers': 2, 'embedding_dim': 32, 'lr': 0.0006646052840146124, 'lambda_val': 0.0014216511033043166, 'batch_size': 2026, 'optimizer': 'RMSprop'}. Best is trial 214 with value: 0.07497030493998583.
2026-05-18 03:49:43,376 - optuna.study._optimize - INFO - Trial 277 pruned. 
2026-05-18 03:49:58,255 - optuna.study._optimize - INFO - Trial 278 pruned. 
2026-05-18 03:50:05,643 - experiment_functions - INFO - Early stopping at epoch 500. Best Recall: 0.0050
2026-05-18 03:50:05,742 - optuna.study.study - INFO - Trial 279 finished with value: 0.005026196674513512 and parameters: {'n_layers': 2, 'embedding_dim': 32, 'lr': 0.0003898453017707106, 'lambda_val': 0.0018973904960799838, 'batch_size': 844, 'optimizer': 'SGD'}. Best is trial 214 with value: 0.07497030493998583.
2026-05-18 03:50:22,544 - experiment_functions - INFO - Early stopping at epoch 1150. Best Recall: 0.0651
2026-05-18 03:50:22,663 - optuna.study.study - INFO - Trial 280 finished with value: 0.06505092565024267 and parameters: {'n_layers': 2, 'embedding_dim': 32, 'lr': 0.0006080883707281668, 'lambda_val': 0.0009130423828241723, 'batch_size': 674, 'optimizer': 'RMSprop'}. Best is trial 214 with value: 0.07497030493998583.
2026-05-18 03:50:40,358 - optuna.study._optimize - INFO - Trial 281 pruned. 
2026-05-18 03:50:54,107 - optuna.study._optimize - INFO - Trial 282 pruned. 
2026-05-18 03:51:06,783 - experiment_functions - INFO - Early stopping at epoch 850. Best Recall: 0.0588
2026-05-18 03:51:06,883 - optuna.study.study - INFO - Trial 283 finished with value: 0.05881956865218253 and parameters: {'n_layers': 2, 'embedding_dim': 64, 'lr': 0.0007446752035274469, 'lambda_val': 0.0017094272710773716, 'batch_size': 639, 'optimizer': 'RMSprop'}. Best is trial 214 with value: 0.07497030493998583.
2026-05-18 03:52:04,419 - optuna.study.study - INFO - Trial 284 finished with value: 0.07331837769819723 and parameters: {'n_layers': 2, 'embedding_dim': 32, 'lr': 0.0003994060895431405, 'lambda_val': 0.0023267948481937254, 'batch_size': 596, 'optimizer': 'RMSprop'}. Best is trial 214 with value: 0.07497030493998583.
2026-05-18 03:52:25,063 - experiment_functions - INFO - Early stopping at epoch 1450. Best Recall: 0.0655
2026-05-18 03:52:25,218 - optuna.study.study - INFO - Trial 285 finished with value: 0.06552828201875575 and parameters: {'n_layers': 2, 'embedding_dim': 32, 'lr': 0.0005673319822315887, 'lambda_val': 0.002480027421754294, 'batch_size': 589, 'optimizer': 'RMSprop'}. Best is trial 214 with value: 0.07497030493998583.
2026-05-18 03:52:39,413 - optuna.study._optimize - INFO - Trial 286 pruned. 
2026-05-18 03:52:53,618 - optuna.study._optimize - INFO - Trial 287 pruned. 
2026-05-18 03:53:07,650 - optuna.study._optimize - INFO - Trial 288 pruned. 
2026-05-18 03:53:22,234 - experiment_functions - INFO - Early stopping at epoch 500. Best Recall: 0.0048
2026-05-18 03:53:23,012 - optuna.study.study - INFO - Trial 289 finished with value: 0.004781205886908146 and parameters: {'n_layers': 2, 'embedding_dim': 32, 'lr': 6.23718318717907e-05, 'lambda_val': 0.0038374292959917635, 'batch_size': 515, 'optimizer': 'RMSprop'}. Best is trial 214 with value: 0.07497030493998583.
2026-05-18 03:53:38,605 - optuna.study._optimize - INFO - Trial 290 pruned. 
2026-05-18 03:53:54,570 - optuna.study._optimize - INFO - Trial 291 pruned. 
2026-05-18 03:54:07,962 - optuna.study._optimize - INFO - Trial 292 pruned. 
2026-05-18 03:54:41,639 - experiment_functions - INFO - Early stopping at epoch 2450. Best Recall: 0.0688
2026-05-18 03:54:41,728 - optuna.study.study - INFO - Trial 293 finished with value: 0.06875511888883785 and parameters: {'n_layers': 2, 'embedding_dim': 32, 'lr': 0.00044746704416547575, 'lambda_val': 0.0020460295873345434, 'batch_size': 728, 'optimizer': 'RMSprop'}. Best is trial 214 with value: 0.07497030493998583.
2026-05-18 03:54:51,181 - experiment_functions - INFO - Early stopping at epoch 650. Best Recall: 0.0520
2026-05-18 03:54:51,316 - optuna.study.study - INFO - Trial 294 finished with value: 0.0519770527088359 and parameters: {'n_layers': 2, 'embedding_dim': 32, 'lr': 0.0011370913787873956, 'lambda_val': 0.0024666105741178337, 'batch_size': 746, 'optimizer': 'RMSprop'}. Best is trial 214 with value: 0.07497030493998583.
2026-05-18 03:55:19,363 - experiment_functions - INFO - Early stopping at epoch 1300. Best Recall: 0.0644
2026-05-18 03:55:19,498 - optuna.study.study - INFO - Trial 295 finished with value: 0.06440407294741395 and parameters: {'n_layers': 2, 'embedding_dim': 32, 'lr': 0.0006158756586765359, 'lambda_val': 0.0011089981600840909, 'batch_size': 723, 'optimizer': 'RMSprop'}. Best is trial 214 with value: 0.07497030493998583.
2026-05-18 03:55:34,699 - optuna.study._optimize - INFO - Trial 296 pruned. 
2026-05-18 03:55:48,350 - optuna.study._optimize - INFO - Trial 297 pruned. 
2026-05-18 03:56:00,962 - experiment_functions - INFO - Early stopping at epoch 850. Best Recall: 0.0605
2026-05-18 03:56:01,061 - optuna.study.study - INFO - Trial 298 finished with value: 0.06050798402291865 and parameters: {'n_layers': 2, 'embedding_dim': 32, 'lr': 0.0008231385680256501, 'lambda_val': 0.0012997262893071524, 'batch_size': 690, 'optimizer': 'RMSprop'}. Best is trial 214 with value: 0.07497030493998583.
2026-05-18 03:56:24,416 - optuna.study._optimize - INFO - Trial 299 pruned. 
2026-05-18 03:56:37,470 - experiment_functions - INFO - Early stopping at epoch 1150. Best Recall: 0.0560
2026-05-18 03:56:38,352 - root - INFO -   **** Training e_1M_1c1dcs_rand3
2026-05-18 03:56:38,405 - root - INFO -   **** Getting 190231/805443 random edges
2026-05-18 03:56:38,979 - optuna.storages._rdb.storage - INFO - A new study created in RDB with name: Study_e_1M_1c1dcs_rand3
2026-05-18 03:56:54,132 - experiment_functions - INFO - Early stopping at epoch 950. Best Recall: 0.0514
2026-05-18 03:56:54,224 - optuna.study.study - INFO - Trial 0 finished with value: 0.05138458081899172 and parameters: {'n_layers': 1, 'embedding_dim': 256, 'lr': 0.0005544537271220411, 'lambda_val': 0.007046704718508998, 'batch_size': 1595, 'optimizer': 'RMSprop'}. Best is trial 0 with value: 0.05138458081899172.
2026-05-18 03:57:03,017 - experiment_functions - INFO - Early stopping at epoch 550. Best Recall: 0.0399
2026-05-18 03:57:03,162 - optuna.study.study - INFO - Trial 1 finished with value: 0.03991704866208128 and parameters: {'n_layers': 1, 'embedding_dim': 256, 'lr': 0.004978481755671881, 'lambda_val': 0.0001541660821862141, 'batch_size': 2038, 'optimizer': 'Adam'}. Best is trial 0 with value: 0.05138458081899172.
2026-05-18 03:57:10,329 - experiment_functions - INFO - Early stopping at epoch 500. Best Recall: 0.0057
2026-05-18 03:57:10,432 - optuna.study.study - INFO - Trial 2 finished with value: 0.005657589370566193 and parameters: {'n_layers': 1, 'embedding_dim': 96, 'lr': 0.0016828896180878352, 'lambda_val': 3.970396274661267e-06, 'batch_size': 882, 'optimizer': 'SGD'}. Best is trial 0 with value: 0.05138458081899172.
2026-05-18 03:57:38,018 - experiment_functions - INFO - Early stopping at epoch 1350. Best Recall: 0.0105
2026-05-18 03:57:38,096 - optuna.study.study - INFO - Trial 3 finished with value: 0.010486918833985042 and parameters: {'n_layers': 3, 'embedding_dim': 64, 'lr': 0.014964162205476137, 'lambda_val': 0.01498498757483377, 'batch_size': 3286, 'optimizer': 'RMSprop'}. Best is trial 0 with value: 0.05138458081899172.
2026-05-18 03:57:46,880 - experiment_functions - INFO - Early stopping at epoch 550. Best Recall: 0.0162
2026-05-18 03:57:46,981 - optuna.study.study - INFO - Trial 4 finished with value: 0.016184971207328994 and parameters: {'n_layers': 4, 'embedding_dim': 64, 'lr': 0.002448610175294417, 'lambda_val': 1.4716105074826455e-05, 'batch_size': 848, 'optimizer': 'RMSprop'}. Best is trial 0 with value: 0.05138458081899172.
2026-05-18 03:57:57,051 - experiment_functions - INFO - Early stopping at epoch 650. Best Recall: 0.0417
2026-05-18 03:57:57,151 - optuna.study.study - INFO - Trial 5 finished with value: 0.04169217295631692 and parameters: {'n_layers': 1, 'embedding_dim': 256, 'lr': 0.0009062509181794331, 'lambda_val': 0.01264489763019978, 'batch_size': 2614, 'optimizer': 'RMSprop'}. Best is trial 0 with value: 0.05138458081899172.
2026-05-18 03:58:05,843 - experiment_functions - INFO - Early stopping at epoch 600. Best Recall: 0.0053
2026-05-18 03:58:05,941 - optuna.study.study - INFO - Trial 6 finished with value: 0.005336569633950566 and parameters: {'n_layers': 1, 'embedding_dim': 96, 'lr': 9.999080227084317e-05, 'lambda_val': 0.000435927626669478, 'batch_size': 556, 'optimizer': 'Adam'}. Best is trial 0 with value: 0.05138458081899172.
2026-05-18 03:58:26,147 - experiment_functions - INFO - Early stopping at epoch 1300. Best Recall: 0.0358
2026-05-18 03:58:26,448 - optuna.study.study - INFO - Trial 7 finished with value: 0.0357506564607112 and parameters: {'n_layers': 3, 'embedding_dim': 96, 'lr': 0.0002168905884425703, 'lambda_val': 4.832468549141545e-06, 'batch_size': 3564, 'optimizer': 'Adam'}. Best is trial 0 with value: 0.05138458081899172.
2026-05-18 03:58:33,890 - experiment_functions - INFO - Early stopping at epoch 500. Best Recall: 0.0052
2026-05-18 03:58:33,979 - optuna.study.study - INFO - Trial 8 finished with value: 0.005209544601575429 and parameters: {'n_layers': 2, 'embedding_dim': 128, 'lr': 1.6091259795201698e-05, 'lambda_val': 0.0423248421632005, 'batch_size': 2749, 'optimizer': 'RMSprop'}. Best is trial 0 with value: 0.05138458081899172.
2026-05-18 03:58:44,505 - experiment_functions - INFO - Early stopping at epoch 650. Best Recall: 0.0351
2026-05-18 03:58:44,639 - optuna.study.study - INFO - Trial 9 finished with value: 0.03511602891627202 and parameters: {'n_layers': 3, 'embedding_dim': 128, 'lr': 0.0007515994474069109, 'lambda_val': 3.7806743503488852e-06, 'batch_size': 3393, 'optimizer': 'Adam'}. Best is trial 0 with value: 0.05138458081899172.
2026-05-18 03:58:51,693 - experiment_functions - INFO - Early stopping at epoch 500. Best Recall: 0.0052
2026-05-18 03:58:51,789 - optuna.study.study - INFO - Trial 10 finished with value: 0.005221523322333309 and parameters: {'n_layers': 2, 'embedding_dim': 32, 'lr': 0.07285481918502544, 'lambda_val': 0.0016439112943016495, 'batch_size': 1695, 'optimizer': 'SGD'}. Best is trial 0 with value: 0.05138458081899172.
2026-05-18 03:59:46,739 - experiment_functions - INFO - Early stopping at epoch 3200. Best Recall: 0.0566
2026-05-18 03:59:46,876 - optuna.study.study - INFO - Trial 11 finished with value: 0.05659095175911454 and parameters: {'n_layers': 1, 'embedding_dim': 256, 'lr': 0.0002791304337648775, 'lambda_val': 0.008805693188841068, 'batch_size': 1532, 'optimizer': 'RMSprop'}. Best is trial 11 with value: 0.05659095175911454.
2026-05-18 04:00:02,600 - optuna.study._optimize - INFO - Trial 12 pruned. 
2026-05-18 04:00:17,084 - optuna.study._optimize - INFO - Trial 13 pruned. 
2026-05-18 04:00:34,409 - optuna.study._optimize - INFO - Trial 14 pruned. 
2026-05-18 04:00:48,009 - optuna.study._optimize - INFO - Trial 15 pruned. 
2026-05-18 04:00:55,400 - experiment_functions - INFO - Early stopping at epoch 500. Best Recall: 0.0058
2026-05-18 04:00:55,546 - optuna.study.study - INFO - Trial 16 finished with value: 0.005761601964672455 and parameters: {'n_layers': 1, 'embedding_dim': 256, 'lr': 0.0004889308284585846, 'lambda_val': 0.0008497097778946965, 'batch_size': 1838, 'optimizer': 'SGD'}. Best is trial 11 with value: 0.05659095175911454.
2026-05-18 04:01:12,262 - optuna.study._optimize - INFO - Trial 17 pruned. 
2026-05-18 04:01:38,181 - optuna.study._optimize - INFO - Trial 18 pruned. 
2026-05-18 04:01:56,920 - experiment_functions - INFO - Early stopping at epoch 500. Best Recall: 0.0053
2026-05-18 04:01:57,705 - optuna.study.study - INFO - Trial 19 finished with value: 0.0053177426996545325 and parameters: {'n_layers': 2, 'embedding_dim': 32, 'lr': 0.00020257418292909504, 'lambda_val': 3.906714040837541e-05, 'batch_size': 1143, 'optimizer': 'SGD'}. Best is trial 11 with value: 0.05659095175911454.
2026-05-18 04:02:20,140 - optuna.study._optimize - INFO - Trial 20 pruned. 
2026-05-18 04:02:29,494 - experiment_functions - INFO - Early stopping at epoch 600. Best Recall: 0.0495
