2026-05-18 16:14:00,245 - optuna.study.study - INFO - Trial 9 finished with value: 0.01956036143778487 and parameters: {'n_layers': 1, 'embedding_dim': 64, 'lr': 0.018232100218817146, 'lambda_val': 3.544790950980566e-05, 'batch_size': 3548, 'optimizer': 'RMSprop'}. Best is trial 8 with value: 0.03418755925811379.
2026-05-18 16:14:11,023 - experiment_functions - INFO - Early stopping at epoch 600. Best Recall: 0.0485
2026-05-18 16:14:11,114 - optuna.study.study - INFO - Trial 10 finished with value: 0.04846622759310079 and parameters: {'n_layers': 2, 'embedding_dim': 256, 'lr': 0.0006318061961330958, 'lambda_val': 1.021343646051878e-06, 'batch_size': 2870, 'optimizer': 'RMSprop'}. Best is trial 10 with value: 0.04846622759310079.
2026-05-18 16:14:23,400 - experiment_functions - INFO - Early stopping at epoch 700. Best Recall: 0.0443
2026-05-18 16:14:23,490 - optuna.study.study - INFO - Trial 11 finished with value: 0.04432856766527465 and parameters: {'n_layers': 2, 'embedding_dim': 256, 'lr': 0.000498458535074027, 'lambda_val': 1.0643248659294321e-06, 'batch_size': 2885, 'optimizer': 'RMSprop'}. Best is trial 10 with value: 0.04846622759310079.
2026-05-18 16:14:37,376 - experiment_functions - INFO - Early stopping at epoch 800. Best Recall: 0.0507
2026-05-18 16:14:37,477 - optuna.study.study - INFO - Trial 12 finished with value: 0.05065807519484178 and parameters: {'n_layers': 2, 'embedding_dim': 256, 'lr': 0.0003866894252755524, 'lambda_val': 1.429982174850222e-06, 'batch_size': 2641, 'optimizer': 'RMSprop'}. Best is trial 12 with value: 0.05065807519484178.
2026-05-18 16:14:53,743 - optuna.study._optimize - INFO - Trial 13 pruned. 
2026-05-18 16:15:23,820 - experiment_functions - INFO - Early stopping at epoch 1800. Best Recall: 0.0414
2026-05-18 16:15:23,899 - optuna.study.study - INFO - Trial 14 finished with value: 0.041401452813944854 and parameters: {'n_layers': 4, 'embedding_dim': 128, 'lr': 0.0001581897675074724, 'lambda_val': 6.574351428433582e-06, 'batch_size': 2568, 'optimizer': 'RMSprop'}. Best is trial 12 with value: 0.05065807519484178.
2026-05-18 16:15:33,650 - experiment_functions - INFO - Early stopping at epoch 550. Best Recall: 0.0429
2026-05-18 16:15:33,741 - optuna.study.study - INFO - Trial 15 finished with value: 0.042906774044582596 and parameters: {'n_layers': 2, 'embedding_dim': 256, 'lr': 0.0008715124346033444, 'lambda_val': 5.62487141533941e-06, 'batch_size': 1691, 'optimizer': 'RMSprop'}. Best is trial 12 with value: 0.05065807519484178.
2026-05-18 16:15:51,731 - optuna.study._optimize - INFO - Trial 16 pruned. 
2026-05-18 16:16:11,182 - optuna.study._optimize - INFO - Trial 17 pruned. 
2026-05-18 16:16:23,450 - experiment_functions - INFO - Early stopping at epoch 750. Best Recall: 0.0382
2026-05-18 16:16:23,539 - optuna.study.study - INFO - Trial 18 finished with value: 0.03818511456098605 and parameters: {'n_layers': 3, 'embedding_dim': 128, 'lr': 0.00038443417408208085, 'lambda_val': 2.7821769344344858e-06, 'batch_size': 2769, 'optimizer': 'RMSprop'}. Best is trial 12 with value: 0.05065807519484178.
2026-05-18 16:16:37,263 - optuna.study._optimize - INFO - Trial 19 pruned. 
2026-05-18 16:16:51,842 - experiment_functions - INFO - Early stopping at epoch 550. Best Recall: 0.0384
2026-05-18 16:16:52,663 - optuna.study.study - INFO - Trial 20 finished with value: 0.038433470418125615 and parameters: {'n_layers': 2, 'embedding_dim': 64, 'lr': 0.0012299569558287123, 'lambda_val': 0.00014545981795161645, 'batch_size': 3413, 'optimizer': 'RMSprop'}. Best is trial 12 with value: 0.05065807519484178.
2026-05-18 16:17:10,613 - experiment_functions - INFO - Early stopping at epoch 600. Best Recall: 0.0478
2026-05-18 16:17:10,702 - optuna.study.study - INFO - Trial 21 finished with value: 0.04775121208827925 and parameters: {'n_layers': 2, 'embedding_dim': 256, 'lr': 0.0005645989805024928, 'lambda_val': 1.1226883222938773e-06, 'batch_size': 2890, 'optimizer': 'RMSprop'}. Best is trial 12 with value: 0.05065807519484178.
2026-05-18 16:18:01,336 - experiment_functions - INFO - Early stopping at epoch 1850. Best Recall: 0.0499
2026-05-18 16:18:01,436 - optuna.study.study - INFO - Trial 22 finished with value: 0.04988550376595937 and parameters: {'n_layers': 2, 'embedding_dim': 256, 'lr': 0.00018630336419727867, 'lambda_val': 2.2217105224912563e-06, 'batch_size': 2530, 'optimizer': 'RMSprop'}. Best is trial 12 with value: 0.05065807519484178.
2026-05-18 16:18:56,023 - experiment_functions - INFO - Early stopping at epoch 2250. Best Recall: 0.0534
2026-05-18 16:18:56,891 - optuna.study.study - INFO - Trial 23 finished with value: 0.053429444356337716 and parameters: {'n_layers': 2, 'embedding_dim': 256, 'lr': 0.00017421903489588605, 'lambda_val': 1.4094025991255915e-05, 'batch_size': 2419, 'optimizer': 'RMSprop'}. Best is trial 23 with value: 0.053429444356337716.
2026-05-18 16:19:28,036 - optuna.study._optimize - INFO - Trial 24 pruned. 
2026-05-18 16:20:00,165 - optuna.study._optimize - INFO - Trial 25 pruned. 
2026-05-18 16:21:13,786 - optuna.study.study - INFO - Trial 26 finished with value: 0.06014558857555085 and parameters: {'n_layers': 1, 'embedding_dim': 256, 'lr': 0.00026112647817112784, 'lambda_val': 1.1586014652450388e-05, 'batch_size': 2268, 'optimizer': 'RMSprop'}. Best is trial 26 with value: 0.06014558857555085.
2026-05-18 16:21:28,449 - optuna.study._optimize - INFO - Trial 27 pruned. 
2026-05-18 16:21:43,595 - optuna.study._optimize - INFO - Trial 28 pruned. 
2026-05-18 16:21:51,010 - experiment_functions - INFO - Early stopping at epoch 500. Best Recall: 0.0055
2026-05-18 16:21:51,109 - optuna.study.study - INFO - Trial 29 finished with value: 0.005536103834937625 and parameters: {'n_layers': 1, 'embedding_dim': 128, 'lr': 0.005668346565942697, 'lambda_val': 7.84117680410325e-05, 'batch_size': 1799, 'optimizer': 'SGD'}. Best is trial 26 with value: 0.06014558857555085.
2026-05-18 16:21:58,401 - experiment_functions - INFO - Early stopping at epoch 500. Best Recall: 0.0053
2026-05-18 16:21:58,490 - optuna.study.study - INFO - Trial 30 finished with value: 0.005281047963331229 and parameters: {'n_layers': 4, 'embedding_dim': 32, 'lr': 3.133632147283371e-05, 'lambda_val': 0.0022489840745837045, 'batch_size': 3776, 'optimizer': 'Adam'}. Best is trial 26 with value: 0.06014558857555085.
2026-05-18 16:22:10,051 - experiment_functions - INFO - Early stopping at epoch 550. Best Recall: 0.0351
2026-05-18 16:22:10,184 - optuna.study.study - INFO - Trial 31 finished with value: 0.035062067877509574 and parameters: {'n_layers': 2, 'embedding_dim': 256, 'lr': 0.0013126217222437517, 'lambda_val': 3.0463015312758525e-06, 'batch_size': 2598, 'optimizer': 'RMSprop'}. Best is trial 26 with value: 0.06014558857555085.
2026-05-18 16:22:42,370 - experiment_functions - INFO - Early stopping at epoch 1350. Best Recall: 0.0493
2026-05-18 16:22:42,459 - optuna.study.study - INFO - Trial 32 finished with value: 0.04931601299440575 and parameters: {'n_layers': 2, 'embedding_dim': 256, 'lr': 0.00024322686490711701, 'lambda_val': 1.00656934756577e-05, 'batch_size': 2319, 'optimizer': 'RMSprop'}. Best is trial 26 with value: 0.06014558857555085.
2026-05-18 16:22:56,692 - optuna.study._optimize - INFO - Trial 33 pruned. 
2026-05-18 16:23:05,823 - experiment_functions - INFO - Early stopping at epoch 500. Best Recall: 0.0048
2026-05-18 16:23:05,933 - optuna.study.study - INFO - Trial 34 finished with value: 0.004841345289499339 and parameters: {'n_layers': 3, 'embedding_dim': 256, 'lr': 0.00010707848738591806, 'lambda_val': 5.693706172843522e-06, 'batch_size': 2699, 'optimizer': 'SGD'}. Best is trial 26 with value: 0.06014558857555085.
2026-05-18 16:23:13,592 - experiment_functions - INFO - Early stopping at epoch 500. Best Recall: 0.0045
2026-05-18 16:23:13,737 - optuna.study.study - INFO - Trial 35 finished with value: 0.004534147010211259 and parameters: {'n_layers': 1, 'embedding_dim': 96, 'lr': 2.9291097827614395e-05, 'lambda_val': 1.8627430877646123e-05, 'batch_size': 3074, 'optimizer': 'RMSprop'}. Best is trial 26 with value: 0.06014558857555085.
2026-05-18 16:23:28,852 - experiment_functions - INFO - Early stopping at epoch 900. Best Recall: 0.0485
2026-05-18 16:23:28,941 - optuna.study.study - INFO - Trial 36 finished with value: 0.048497846078629114 and parameters: {'n_layers': 2, 'embedding_dim': 256, 'lr': 0.0003302803706665605, 'lambda_val': 2.0305116811815304e-06, 'batch_size': 2407, 'optimizer': 'RMSprop'}. Best is trial 26 with value: 0.06014558857555085.
2026-05-18 16:23:36,000 - experiment_functions - INFO - Early stopping at epoch 500. Best Recall: 0.0055
2026-05-18 16:23:36,091 - optuna.study.study - INFO - Trial 37 finished with value: 0.005498297419199488 and parameters: {'n_layers': 2, 'embedding_dim': 64, 'lr': 0.0008775601881223389, 'lambda_val': 8.031063381716913e-06, 'batch_size': 1964, 'optimizer': 'SGD'}. Best is trial 26 with value: 0.06014558857555085.
2026-05-18 16:23:45,278 - experiment_functions - INFO - Early stopping at epoch 600. Best Recall: 0.0436
2026-05-18 16:23:45,378 - optuna.study.study - INFO - Trial 38 finished with value: 0.04362007278779907 and parameters: {'n_layers': 3, 'embedding_dim': 96, 'lr': 0.0016232503137582344, 'lambda_val': 4.080272771832643e-06, 'batch_size': 1364, 'optimizer': 'Adam'}. Best is trial 26 with value: 0.06014558857555085.
2026-05-18 16:23:59,928 - optuna.study._optimize - INFO - Trial 39 pruned. 
2026-05-18 16:24:07,818 - experiment_functions - INFO - Early stopping at epoch 500. Best Recall: 0.0053
2026-05-18 16:24:07,927 - optuna.study.study - INFO - Trial 40 finished with value: 0.005307476182361021 and parameters: {'n_layers': 3, 'embedding_dim': 128, 'lr': 1.6626280440157722e-05, 'lambda_val': 0.018571248799583877, 'batch_size': 549, 'optimizer': 'RMSprop'}. Best is trial 26 with value: 0.06014558857555085.
2026-05-18 16:24:25,718 - optuna.study._optimize - INFO - Trial 41 pruned. 
2026-05-18 16:25:01,658 - experiment_functions - INFO - Early stopping at epoch 2100. Best Recall: 0.0539
2026-05-18 16:25:01,762 - optuna.study.study - INFO - Trial 42 finished with value: 0.05393207631055512 and parameters: {'n_layers': 2, 'embedding_dim': 256, 'lr': 0.00017850262200950673, 'lambda_val': 2.9527954237746742e-05, 'batch_size': 2166, 'optimizer': 'RMSprop'}. Best is trial 26 with value: 0.06014558857555085.
2026-05-18 16:25:17,813 - optuna.study._optimize - INFO - Trial 43 pruned. 
2026-05-18 16:25:31,830 - experiment_functions - INFO - Early stopping at epoch 800. Best Recall: 0.0513
2026-05-18 16:25:31,968 - optuna.study.study - INFO - Trial 44 finished with value: 0.051267021691928434 and parameters: {'n_layers': 2, 'embedding_dim': 256, 'lr': 0.0004384877678790848, 'lambda_val': 1.8159124246215837e-06, 'batch_size': 1794, 'optimizer': 'RMSprop'}. Best is trial 26 with value: 0.06014558857555085.
2026-05-18 16:25:38,949 - experiment_functions - INFO - Early stopping at epoch 500. Best Recall: 0.0046
2026-05-18 16:25:39,042 - optuna.study.study - INFO - Trial 45 finished with value: 0.0046285574735475555 and parameters: {'n_layers': 2, 'embedding_dim': 32, 'lr': 0.0004079823699232683, 'lambda_val': 0.09161795612831575, 'batch_size': 1859, 'optimizer': 'SGD'}. Best is trial 26 with value: 0.06014558857555085.
2026-05-18 16:25:51,977 - experiment_functions - INFO - Early stopping at epoch 850. Best Recall: 0.0524
2026-05-18 16:25:52,069 - optuna.study.study - INFO - Trial 46 finished with value: 0.05237606726040988 and parameters: {'n_layers': 1, 'embedding_dim': 256, 'lr': 0.0007317006884159941, 'lambda_val': 4.012149644852362e-05, 'batch_size': 1578, 'optimizer': 'RMSprop'}. Best is trial 26 with value: 0.06014558857555085.
2026-05-18 16:26:08,409 - experiment_functions - INFO - Early stopping at epoch 1150. Best Recall: 0.0644
2026-05-18 16:26:08,516 - optuna.study.study - INFO - Trial 47 finished with value: 0.06438076704590731 and parameters: {'n_layers': 1, 'embedding_dim': 64, 'lr': 0.0007681160335516023, 'lambda_val': 3.729473531717465e-05, 'batch_size': 1403, 'optimizer': 'RMSprop'}. Best is trial 47 with value: 0.06438076704590731.
2026-05-18 16:26:22,508 - optuna.study._optimize - INFO - Trial 48 pruned. 
2026-05-18 16:26:32,194 - experiment_functions - INFO - Early stopping at epoch 550. Best Recall: 0.0400
2026-05-18 16:26:32,308 - optuna.study.study - INFO - Trial 49 finished with value: 0.0400303802296118 and parameters: {'n_layers': 1, 'embedding_dim': 64, 'lr': 0.0038171927064316598, 'lambda_val': 5.3223423277123355e-05, 'batch_size': 1002, 'optimizer': 'RMSprop'}. Best is trial 47 with value: 0.06438076704590731.
2026-05-18 16:26:45,138 - experiment_functions - INFO - Early stopping at epoch 850. Best Recall: 0.0605
2026-05-18 16:26:45,227 - optuna.study.study - INFO - Trial 50 finished with value: 0.060527790645814726 and parameters: {'n_layers': 1, 'embedding_dim': 64, 'lr': 0.0016912099461564643, 'lambda_val': 0.00029006428908564136, 'batch_size': 900, 'optimizer': 'Adam'}. Best is trial 47 with value: 0.06438076704590731.
2026-05-18 16:27:11,760 - experiment_functions - INFO - Early stopping at epoch 2000. Best Recall: 0.0644
2026-05-18 16:27:11,868 - optuna.study.study - INFO - Trial 51 finished with value: 0.06442163052696788 and parameters: {'n_layers': 1, 'embedding_dim': 64, 'lr': 0.0006799901985170524, 'lambda_val': 0.00030663779147752486, 'batch_size': 981, 'optimizer': 'Adam'}. Best is trial 51 with value: 0.06442163052696788.
2026-05-18 16:27:23,145 - experiment_functions - INFO - Early stopping at epoch 750. Best Recall: 0.0625
2026-05-18 16:27:23,248 - optuna.study.study - INFO - Trial 52 finished with value: 0.062479932528949074 and parameters: {'n_layers': 1, 'embedding_dim': 64, 'lr': 0.0021563024849509927, 'lambda_val': 0.00036268420150697273, 'batch_size': 831, 'optimizer': 'Adam'}. Best is trial 51 with value: 0.06442163052696788.
2026-05-18 16:27:35,678 - experiment_functions - INFO - Early stopping at epoch 750. Best Recall: 0.0661
2026-05-18 16:27:35,806 - optuna.study.study - INFO - Trial 53 finished with value: 0.06609518457102453 and parameters: {'n_layers': 1, 'embedding_dim': 64, 'lr': 0.002199597143611013, 'lambda_val': 0.0005841411198607081, 'batch_size': 883, 'optimizer': 'Adam'}. Best is trial 53 with value: 0.06609518457102453.
2026-05-18 16:27:47,320 - experiment_functions - INFO - Early stopping at epoch 800. Best Recall: 0.0576
2026-05-18 16:27:47,459 - optuna.study.study - INFO - Trial 54 finished with value: 0.05756684588221897 and parameters: {'n_layers': 1, 'embedding_dim': 64, 'lr': 0.0019473109223533554, 'lambda_val': 0.0005568503150909463, 'batch_size': 836, 'optimizer': 'Adam'}. Best is trial 53 with value: 0.06609518457102453.
2026-05-18 16:27:56,733 - experiment_functions - INFO - Early stopping at epoch 650. Best Recall: 0.0565
2026-05-18 16:27:56,871 - optuna.study.study - INFO - Trial 55 finished with value: 0.05648054482999704 and parameters: {'n_layers': 1, 'embedding_dim': 64, 'lr': 0.003183429818074446, 'lambda_val': 0.0017194813814688332, 'batch_size': 947, 'optimizer': 'Adam'}. Best is trial 53 with value: 0.06609518457102453.
2026-05-18 16:28:05,493 - experiment_functions - INFO - Early stopping at epoch 550. Best Recall: 0.0405
2026-05-18 16:28:05,597 - optuna.study.study - INFO - Trial 56 finished with value: 0.04047236934464479 and parameters: {'n_layers': 1, 'embedding_dim': 64, 'lr': 0.009559209489417825, 'lambda_val': 0.0011012732289310526, 'batch_size': 626, 'optimizer': 'Adam'}. Best is trial 53 with value: 0.06609518457102453.
2026-05-18 16:28:15,165 - experiment_functions - INFO - Early stopping at epoch 650. Best Recall: 0.0586
2026-05-18 16:28:15,280 - optuna.study.study - INFO - Trial 57 finished with value: 0.05855883537583759 and parameters: {'n_layers': 1, 'embedding_dim': 64, 'lr': 0.004368831646913769, 'lambda_val': 0.00025772641124402175, 'batch_size': 776, 'optimizer': 'Adam'}. Best is trial 53 with value: 0.06609518457102453.
2026-05-18 16:28:28,922 - experiment_functions - INFO - Early stopping at epoch 750. Best Recall: 0.0661
2026-05-18 16:28:29,053 - optuna.study.study - INFO - Trial 58 finished with value: 0.06609623799102947 and parameters: {'n_layers': 1, 'embedding_dim': 64, 'lr': 0.0020470772987341455, 'lambda_val': 0.0003827740604554896, 'batch_size': 1163, 'optimizer': 'Adam'}. Best is trial 58 with value: 0.06609623799102947.
2026-05-18 16:28:40,403 - experiment_functions - INFO - Early stopping at epoch 750. Best Recall: 0.0620
2026-05-18 16:28:40,495 - optuna.study.study - INFO - Trial 59 finished with value: 0.06198465710284109 and parameters: {'n_layers': 1, 'embedding_dim': 64, 'lr': 0.002007117326443231, 'lambda_val': 0.0004050573508522899, 'batch_size': 1076, 'optimizer': 'Adam'}. Best is trial 58 with value: 0.06609623799102947.
2026-05-18 16:28:50,252 - experiment_functions - INFO - Early stopping at epoch 700. Best Recall: 0.0580
2026-05-18 16:28:50,355 - optuna.study.study - INFO - Trial 60 finished with value: 0.05799271553850576 and parameters: {'n_layers': 1, 'embedding_dim': 64, 'lr': 0.0022963522502893754, 'lambda_val': 0.00841777639513926, 'batch_size': 1115, 'optimizer': 'Adam'}. Best is trial 58 with value: 0.06609623799102947.
2026-05-18 16:29:02,764 - experiment_functions - INFO - Early stopping at epoch 900. Best Recall: 0.0591
2026-05-18 16:29:02,868 - optuna.study.study - INFO - Trial 61 finished with value: 0.059104622876847535 and parameters: {'n_layers': 1, 'embedding_dim': 64, 'lr': 0.0013290166100333473, 'lambda_val': 0.0003511425519068102, 'batch_size': 1310, 'optimizer': 'Adam'}. Best is trial 58 with value: 0.06609623799102947.
2026-05-18 16:29:18,950 - experiment_functions - INFO - Early stopping at epoch 1150. Best Recall: 0.0644
2026-05-18 16:29:19,088 - optuna.study.study - INFO - Trial 62 finished with value: 0.06437451718623281 and parameters: {'n_layers': 1, 'embedding_dim': 64, 'lr': 0.0011018975448309706, 'lambda_val': 0.00038668367274400034, 'batch_size': 946, 'optimizer': 'Adam'}. Best is trial 58 with value: 0.06609623799102947.
2026-05-18 16:29:37,944 - experiment_functions - INFO - Early stopping at epoch 1400. Best Recall: 0.0674
2026-05-18 16:29:38,037 - optuna.study.study - INFO - Trial 63 finished with value: 0.06737458571860842 and parameters: {'n_layers': 1, 'embedding_dim': 64, 'lr': 0.0008898908888948833, 'lambda_val': 0.0008182561614619953, 'batch_size': 1050, 'optimizer': 'Adam'}. Best is trial 63 with value: 0.06737458571860842.
2026-05-18 16:30:21,891 - experiment_functions - INFO - Early stopping at epoch 3250. Best Recall: 0.0636
2026-05-18 16:30:21,995 - optuna.study.study - INFO - Trial 64 finished with value: 0.06358795462609203 and parameters: {'n_layers': 1, 'embedding_dim': 64, 'lr': 0.0006653273512426162, 'lambda_val': 0.0009842964881119549, 'batch_size': 717, 'optimizer': 'Adam'}. Best is trial 63 with value: 0.06737458571860842.
2026-05-18 16:30:41,585 - experiment_functions - INFO - Early stopping at epoch 1400. Best Recall: 0.0698
2026-05-18 16:30:41,679 - optuna.study.study - INFO - Trial 65 finished with value: 0.06978780283330527 and parameters: {'n_layers': 1, 'embedding_dim': 64, 'lr': 0.0010028191800569625, 'lambda_val': 0.0009742935340646076, 'batch_size': 680, 'optimizer': 'Adam'}. Best is trial 65 with value: 0.06978780283330527.
2026-05-18 16:30:54,899 - experiment_functions - INFO - Early stopping at epoch 950. Best Recall: 0.0613
2026-05-18 16:30:55,004 - optuna.study.study - INFO - Trial 66 finished with value: 0.061272930583924565 and parameters: {'n_layers': 1, 'embedding_dim': 64, 'lr': 0.0011174708214178274, 'lambda_val': 0.002992401884577541, 'batch_size': 1277, 'optimizer': 'Adam'}. Best is trial 65 with value: 0.06978780283330527.
2026-05-18 16:31:13,226 - experiment_functions - INFO - Early stopping at epoch 1150. Best Recall: 0.0601
2026-05-18 16:31:13,330 - optuna.study.study - INFO - Trial 67 finished with value: 0.06009476665000659 and parameters: {'n_layers': 1, 'embedding_dim': 64, 'lr': 0.0009605754388849017, 'lambda_val': 0.0009793583145814085, 'batch_size': 1024, 'optimizer': 'Adam'}. Best is trial 65 with value: 0.06978780283330527.
2026-05-18 16:31:26,838 - optuna.study._optimize - INFO - Trial 68 pruned. 
2026-05-18 16:31:41,129 - optuna.study._optimize - INFO - Trial 69 pruned. 
2026-05-18 16:31:50,221 - experiment_functions - INFO - Early stopping at epoch 650. Best Recall: 0.0609
2026-05-18 16:31:50,313 - optuna.study.study - INFO - Trial 70 finished with value: 0.06089318272897577 and parameters: {'n_layers': 1, 'embedding_dim': 64, 'lr': 0.002999562943409543, 'lambda_val': 0.0005704902600795243, 'batch_size': 1190, 'optimizer': 'Adam'}. Best is trial 65 with value: 0.06978780283330527.
2026-05-18 16:32:14,899 - experiment_functions - INFO - Early stopping at epoch 1800. Best Recall: 0.0632
2026-05-18 16:32:14,985 - optuna.study.study - INFO - Trial 71 finished with value: 0.06315809499086009 and parameters: {'n_layers': 1, 'embedding_dim': 64, 'lr': 0.000779328102798587, 'lambda_val': 0.0008896730311669336, 'batch_size': 716, 'optimizer': 'Adam'}. Best is trial 65 with value: 0.06978780283330527.
2026-05-18 16:33:07,582 - optuna.study.study - INFO - Trial 72 finished with value: 0.06726605711094971 and parameters: {'n_layers': 1, 'embedding_dim': 64, 'lr': 0.0006280347445858137, 'lambda_val': 0.0015767679778533087, 'batch_size': 658, 'optimizer': 'Adam'}. Best is trial 65 with value: 0.06978780283330527.
2026-05-18 16:33:20,908 - experiment_functions - INFO - Early stopping at epoch 950. Best Recall: 0.0635
