2026-05-17 23:45:55,495 - optuna.study._optimize - INFO - Trial 127 pruned. 
2026-05-17 23:46:05,313 - experiment_functions - INFO - Early stopping at epoch 650. Best Recall: 0.0717
2026-05-17 23:46:05,404 - optuna.study.study - INFO - Trial 128 finished with value: 0.07170414232103195 and parameters: {'n_layers': 1, 'embedding_dim': 96, 'lr': 0.0018292503608318613, 'lambda_val': 3.897805752720104e-05, 'batch_size': 2949, 'optimizer': 'Adam'}. Best is trial 51 with value: 0.08533224549370667.
2026-05-17 23:46:21,110 - optuna.study._optimize - INFO - Trial 129 pruned. 
2026-05-17 23:47:00,334 - experiment_functions - INFO - Early stopping at epoch 2600. Best Recall: 0.0856
2026-05-17 23:47:00,474 - optuna.study.study - INFO - Trial 130 finished with value: 0.085599439291358 and parameters: {'n_layers': 1, 'embedding_dim': 256, 'lr': 0.001500991325998816, 'lambda_val': 2.099440877367073e-06, 'batch_size': 2747, 'optimizer': 'Adam'}. Best is trial 130 with value: 0.085599439291358.
2026-05-17 23:47:10,701 - experiment_functions - INFO - Early stopping at epoch 650. Best Recall: 0.0713
2026-05-17 23:47:10,791 - optuna.study.study - INFO - Trial 131 finished with value: 0.07128120679178845 and parameters: {'n_layers': 1, 'embedding_dim': 256, 'lr': 0.0014456082665724975, 'lambda_val': 1.2696895349924836e-06, 'batch_size': 2823, 'optimizer': 'Adam'}. Best is trial 130 with value: 0.085599439291358.
2026-05-17 23:47:50,314 - experiment_functions - INFO - Early stopping at epoch 2700. Best Recall: 0.0841
2026-05-17 23:47:50,458 - optuna.study.study - INFO - Trial 132 finished with value: 0.0840651088581711 and parameters: {'n_layers': 1, 'embedding_dim': 256, 'lr': 0.0018996348634819486, 'lambda_val': 2.095666554960113e-06, 'batch_size': 2874, 'optimizer': 'Adam'}. Best is trial 130 with value: 0.085599439291358.
2026-05-17 23:48:05,925 - optuna.study._optimize - INFO - Trial 133 pruned. 
2026-05-17 23:48:21,575 - optuna.study._optimize - INFO - Trial 134 pruned. 
2026-05-17 23:49:20,144 - optuna.study.study - INFO - Trial 135 finished with value: 0.08639900718181048 and parameters: {'n_layers': 1, 'embedding_dim': 256, 'lr': 0.0014781370878632516, 'lambda_val': 3.176892806454222e-06, 'batch_size': 2991, 'optimizer': 'Adam'}. Best is trial 135 with value: 0.08639900718181048.
2026-05-17 23:49:28,439 - experiment_functions - INFO - Early stopping at epoch 500. Best Recall: 0.0053
2026-05-17 23:49:28,529 - optuna.study.study - INFO - Trial 136 finished with value: 0.0052777222211797216 and parameters: {'n_layers': 1, 'embedding_dim': 256, 'lr': 0.0009715474644597424, 'lambda_val': 1.0056285142641636e-06, 'batch_size': 3003, 'optimizer': 'SGD'}. Best is trial 135 with value: 0.08639900718181048.
2026-05-17 23:49:44,551 - optuna.study._optimize - INFO - Trial 137 pruned. 
2026-05-17 23:49:54,144 - experiment_functions - INFO - Early stopping at epoch 650. Best Recall: 0.0637
2026-05-17 23:49:54,234 - optuna.study.study - INFO - Trial 138 finished with value: 0.06374288823593888 and parameters: {'n_layers': 1, 'embedding_dim': 64, 'lr': 0.0024323253770950773, 'lambda_val': 2.063969272964853e-06, 'batch_size': 3169, 'optimizer': 'Adam'}. Best is trial 135 with value: 0.08639900718181048.
2026-05-17 23:50:10,072 - optuna.study._optimize - INFO - Trial 139 pruned. 
2026-05-17 23:50:37,923 - experiment_functions - INFO - Early stopping at epoch 1850. Best Recall: 0.0834
2026-05-17 23:50:38,021 - optuna.study.study - INFO - Trial 140 finished with value: 0.08337898546452463 and parameters: {'n_layers': 1, 'embedding_dim': 256, 'lr': 0.0029171805354870797, 'lambda_val': 3.261260399356765e-06, 'batch_size': 2957, 'optimizer': 'Adam'}. Best is trial 135 with value: 0.08639900718181048.
2026-05-17 23:50:55,802 - optuna.study._optimize - INFO - Trial 141 pruned. 
2026-05-17 23:51:36,976 - experiment_functions - INFO - Early stopping at epoch 2750. Best Recall: 0.0846
2026-05-17 23:51:37,075 - optuna.study.study - INFO - Trial 142 finished with value: 0.08461592836697598 and parameters: {'n_layers': 1, 'embedding_dim': 256, 'lr': 0.0020119699116906004, 'lambda_val': 3.4216985956652917e-06, 'batch_size': 2790, 'optimizer': 'Adam'}. Best is trial 135 with value: 0.08639900718181048.
2026-05-17 23:51:57,204 - optuna.study._optimize - INFO - Trial 143 pruned. 
2026-05-17 23:52:11,766 - optuna.study._optimize - INFO - Trial 144 pruned. 
2026-05-17 23:52:49,265 - experiment_functions - INFO - Early stopping at epoch 2650. Best Recall: 0.0842
2026-05-17 23:52:49,335 - optuna.study.study - INFO - Trial 145 finished with value: 0.08419000086334458 and parameters: {'n_layers': 1, 'embedding_dim': 256, 'lr': 0.0011694418145737245, 'lambda_val': 3.935850015781802e-06, 'batch_size': 3069, 'optimizer': 'Adam'}. Best is trial 135 with value: 0.08639900718181048.
2026-05-17 23:53:04,158 - optuna.study._optimize - INFO - Trial 146 pruned. 
2026-05-17 23:53:19,457 - optuna.study._optimize - INFO - Trial 147 pruned. 
2026-05-17 23:53:35,826 - optuna.study._optimize - INFO - Trial 148 pruned. 
2026-05-17 23:53:50,637 - optuna.study._optimize - INFO - Trial 149 pruned. 
2026-05-17 23:54:08,631 - optuna.study._optimize - INFO - Trial 150 pruned. 
2026-05-17 23:54:24,134 - optuna.study._optimize - INFO - Trial 151 pruned. 
2026-05-17 23:54:39,677 - optuna.study._optimize - INFO - Trial 152 pruned. 
2026-05-17 23:55:09,150 - experiment_functions - INFO - Early stopping at epoch 1950. Best Recall: 0.0836
2026-05-17 23:55:09,241 - optuna.study.study - INFO - Trial 153 finished with value: 0.08355372794702388 and parameters: {'n_layers': 1, 'embedding_dim': 256, 'lr': 0.002231802793231492, 'lambda_val': 5.338660869882077e-06, 'batch_size': 2858, 'optimizer': 'Adam'}. Best is trial 135 with value: 0.08639900718181048.
2026-05-17 23:55:30,897 - optuna.study._optimize - INFO - Trial 154 pruned. 
2026-05-17 23:55:50,945 - optuna.study._optimize - INFO - Trial 155 pruned. 
2026-05-17 23:56:07,394 - optuna.study._optimize - INFO - Trial 156 pruned. 
2026-05-17 23:56:43,002 - optuna.study._optimize - INFO - Trial 157 pruned. 
2026-05-17 23:56:52,883 - experiment_functions - INFO - Early stopping at epoch 600. Best Recall: 0.0708
2026-05-17 23:56:53,051 - optuna.study.study - INFO - Trial 158 finished with value: 0.07075191730790456 and parameters: {'n_layers': 1, 'embedding_dim': 128, 'lr': 0.0034991323232755043, 'lambda_val': 9.624697991767493e-06, 'batch_size': 1576, 'optimizer': 'Adam'}. Best is trial 135 with value: 0.08639900718181048.
2026-05-17 23:57:03,087 - experiment_functions - INFO - Early stopping at epoch 650. Best Recall: 0.0683
2026-05-17 23:57:03,187 - optuna.study.study - INFO - Trial 159 finished with value: 0.06831153716954282 and parameters: {'n_layers': 1, 'embedding_dim': 96, 'lr': 0.0016027561451190304, 'lambda_val': 5.7821590986113375e-06, 'batch_size': 3253, 'optimizer': 'Adam'}. Best is trial 135 with value: 0.08639900718181048.
2026-05-17 23:57:11,260 - experiment_functions - INFO - Early stopping at epoch 500. Best Recall: 0.0046
2026-05-17 23:57:11,358 - optuna.study.study - INFO - Trial 160 finished with value: 0.004589100082114945 and parameters: {'n_layers': 1, 'embedding_dim': 256, 'lr': 0.00103286942977317, 'lambda_val': 2.7853007236638744e-06, 'batch_size': 2812, 'optimizer': 'SGD'}. Best is trial 135 with value: 0.08639900718181048.
2026-05-17 23:57:31,431 - optuna.study._optimize - INFO - Trial 161 pruned. 
2026-05-17 23:58:10,666 - experiment_functions - INFO - Early stopping at epoch 2600. Best Recall: 0.0853
2026-05-17 23:58:10,800 - optuna.study.study - INFO - Trial 162 finished with value: 0.08525441773446439 and parameters: {'n_layers': 1, 'embedding_dim': 256, 'lr': 0.0017725777815270844, 'lambda_val': 5.1024554011962645e-06, 'batch_size': 2689, 'optimizer': 'Adam'}. Best is trial 135 with value: 0.08639900718181048.
2026-05-17 23:58:37,982 - experiment_functions - INFO - Early stopping at epoch 1750. Best Recall: 0.0855
2026-05-17 23:58:38,070 - optuna.study.study - INFO - Trial 163 finished with value: 0.08551878404338942 and parameters: {'n_layers': 1, 'embedding_dim': 256, 'lr': 0.0018000066304348623, 'lambda_val': 3.862800589215942e-06, 'batch_size': 3171, 'optimizer': 'Adam'}. Best is trial 135 with value: 0.08639900718181048.
2026-05-17 23:58:50,988 - experiment_functions - INFO - Early stopping at epoch 800. Best Recall: 0.0770
2026-05-17 23:58:51,135 - optuna.study.study - INFO - Trial 164 finished with value: 0.07704665045677095 and parameters: {'n_layers': 1, 'embedding_dim': 256, 'lr': 0.0014148323481514467, 'lambda_val': 3.914084544287588e-06, 'batch_size': 2701, 'optimizer': 'Adam'}. Best is trial 135 with value: 0.08639900718181048.
2026-05-17 23:59:01,346 - experiment_functions - INFO - Early stopping at epoch 600. Best Recall: 0.0731
2026-05-17 23:59:01,447 - optuna.study.study - INFO - Trial 165 finished with value: 0.07307005184314141 and parameters: {'n_layers': 1, 'embedding_dim': 256, 'lr': 0.0024596900695098905, 'lambda_val': 0.0014327518474979942, 'batch_size': 3162, 'optimizer': 'Adam'}. Best is trial 135 with value: 0.08639900718181048.
2026-05-17 23:59:11,602 - experiment_functions - INFO - Early stopping at epoch 700. Best Recall: 0.0681
2026-05-17 23:59:11,701 - optuna.study.study - INFO - Trial 166 finished with value: 0.0680765918431565 and parameters: {'n_layers': 1, 'embedding_dim': 32, 'lr': 0.0016669537893664022, 'lambda_val': 5.142638131817837e-06, 'batch_size': 3404, 'optimizer': 'Adam'}. Best is trial 135 with value: 0.08639900718181048.
2026-05-17 23:59:30,881 - optuna.study._optimize - INFO - Trial 167 pruned. 
2026-05-18 00:00:09,965 - experiment_functions - INFO - Early stopping at epoch 2650. Best Recall: 0.0841
2026-05-18 00:00:10,055 - optuna.study.study - INFO - Trial 168 finished with value: 0.08405263992371328 and parameters: {'n_layers': 1, 'embedding_dim': 256, 'lr': 0.0013253712174657194, 'lambda_val': 3.1092790141122784e-06, 'batch_size': 3110, 'optimizer': 'Adam'}. Best is trial 135 with value: 0.08639900718181048.
2026-05-18 00:00:26,783 - optuna.study._optimize - INFO - Trial 169 pruned. 
2026-05-18 00:00:37,707 - experiment_functions - INFO - Early stopping at epoch 700. Best Recall: 0.0667
2026-05-18 00:00:37,810 - optuna.study.study - INFO - Trial 170 finished with value: 0.06672758735413299 and parameters: {'n_layers': 1, 'embedding_dim': 64, 'lr': 0.0013297879502764199, 'lambda_val': 1.302863557167454e-06, 'batch_size': 3216, 'optimizer': 'Adam'}. Best is trial 135 with value: 0.08639900718181048.
2026-05-18 00:01:18,426 - optuna.study._optimize - INFO - Trial 171 pruned. 
2026-05-18 00:01:37,040 - optuna.study._optimize - INFO - Trial 172 pruned. 
2026-05-18 00:01:52,535 - optuna.study._optimize - INFO - Trial 173 pruned. 
2026-05-18 00:02:09,370 - experiment_functions - INFO - Early stopping at epoch 1150. Best Recall: 0.0829
2026-05-18 00:02:09,439 - optuna.study.study - INFO - Trial 174 finished with value: 0.08285383523076598 and parameters: {'n_layers': 1, 'embedding_dim': 256, 'lr': 0.0027098884712188306, 'lambda_val': 3.053671812276427e-06, 'batch_size': 3091, 'optimizer': 'Adam'}. Best is trial 135 with value: 0.08639900718181048.
2026-05-18 00:02:24,755 - optuna.study._optimize - INFO - Trial 175 pruned. 
2026-05-18 00:02:37,537 - experiment_functions - INFO - Early stopping at epoch 850. Best Recall: 0.0751
2026-05-18 00:02:37,607 - optuna.study.study - INFO - Trial 176 finished with value: 0.07506245900545068 and parameters: {'n_layers': 1, 'embedding_dim': 256, 'lr': 0.0010498827773545317, 'lambda_val': 4.931336509198229e-06, 'batch_size': 3159, 'optimizer': 'Adam'}. Best is trial 135 with value: 0.08639900718181048.
2026-05-18 00:02:52,754 - optuna.study._optimize - INFO - Trial 177 pruned. 
2026-05-18 00:03:08,306 - optuna.study._optimize - INFO - Trial 178 pruned. 
2026-05-18 00:03:30,345 - optuna.study._optimize - INFO - Trial 179 pruned. 
2026-05-18 00:03:51,112 - optuna.study._optimize - INFO - Trial 180 pruned. 
2026-05-18 00:04:07,110 - optuna.study._optimize - INFO - Trial 181 pruned. 
2026-05-18 00:04:32,900 - optuna.study._optimize - INFO - Trial 182 pruned. 
2026-05-18 00:04:48,625 - optuna.study._optimize - INFO - Trial 183 pruned. 
2026-05-18 00:05:37,870 - experiment_functions - INFO - Early stopping at epoch 3350. Best Recall: 0.0838
2026-05-18 00:05:37,960 - optuna.study.study - INFO - Trial 184 finished with value: 0.08384781398054388 and parameters: {'n_layers': 1, 'embedding_dim': 256, 'lr': 0.0021748158531303768, 'lambda_val': 4.258241314735038e-06, 'batch_size': 2955, 'optimizer': 'Adam'}. Best is trial 135 with value: 0.08639900718181048.
2026-05-18 00:05:48,573 - experiment_functions - INFO - Early stopping at epoch 650. Best Recall: 0.0777
2026-05-18 00:05:48,673 - optuna.study.study - INFO - Trial 185 finished with value: 0.0777069022132595 and parameters: {'n_layers': 1, 'embedding_dim': 256, 'lr': 0.002346585096951363, 'lambda_val': 4.5344649815860895e-06, 'batch_size': 2968, 'optimizer': 'Adam'}. Best is trial 135 with value: 0.08639900718181048.
2026-05-18 00:06:21,034 - optuna.study._optimize - INFO - Trial 186 pruned. 
2026-05-18 00:06:51,450 - experiment_functions - INFO - Early stopping at epoch 1650. Best Recall: 0.0824
2026-05-18 00:06:52,213 - optuna.study.study - INFO - Trial 187 finished with value: 0.08243922434309521 and parameters: {'n_layers': 1, 'embedding_dim': 256, 'lr': 0.002625646507788992, 'lambda_val': 2.9736340397941545e-06, 'batch_size': 3169, 'optimizer': 'Adam'}. Best is trial 135 with value: 0.08639900718181048.
2026-05-18 00:07:36,365 - experiment_functions - INFO - Early stopping at epoch 2800. Best Recall: 0.0852
2026-05-18 00:07:36,454 - optuna.study.study - INFO - Trial 188 finished with value: 0.08520992446154974 and parameters: {'n_layers': 1, 'embedding_dim': 256, 'lr': 0.0015521877490141907, 'lambda_val': 6.343191741258266e-06, 'batch_size': 3327, 'optimizer': 'Adam'}. Best is trial 135 with value: 0.08639900718181048.
2026-05-18 00:07:52,200 - optuna.study._optimize - INFO - Trial 189 pruned. 
2026-05-18 00:08:07,856 - optuna.study._optimize - INFO - Trial 190 pruned. 
2026-05-18 00:08:23,382 - optuna.study._optimize - INFO - Trial 191 pruned. 
2026-05-18 00:08:39,322 - optuna.study._optimize - INFO - Trial 192 pruned. 
2026-05-18 00:08:49,814 - experiment_functions - INFO - Early stopping at epoch 650. Best Recall: 0.0729
2026-05-18 00:08:49,903 - optuna.study.study - INFO - Trial 193 finished with value: 0.07287233323502763 and parameters: {'n_layers': 1, 'embedding_dim': 256, 'lr': 0.0019390331178229475, 'lambda_val': 0.0008102825731595919, 'batch_size': 3113, 'optimizer': 'Adam'}. Best is trial 135 with value: 0.08639900718181048.
2026-05-18 00:09:05,472 - optuna.study._optimize - INFO - Trial 194 pruned. 
2026-05-18 00:09:21,385 - optuna.study._optimize - INFO - Trial 195 pruned. 
2026-05-18 00:09:37,276 - optuna.study._optimize - INFO - Trial 196 pruned. 
2026-05-18 00:09:44,572 - experiment_functions - INFO - Early stopping at epoch 500. Best Recall: 0.0056
2026-05-18 00:09:44,661 - optuna.study.study - INFO - Trial 197 finished with value: 0.005637001093803497 and parameters: {'n_layers': 1, 'embedding_dim': 96, 'lr': 0.001150320482153389, 'lambda_val': 2.9936962804457632e-06, 'batch_size': 2991, 'optimizer': 'SGD'}. Best is trial 135 with value: 0.08639900718181048.
2026-05-18 00:09:54,006 - experiment_functions - INFO - Early stopping at epoch 600. Best Recall: 0.0658
2026-05-18 00:09:54,107 - optuna.study.study - INFO - Trial 198 finished with value: 0.06580140174049849 and parameters: {'n_layers': 1, 'embedding_dim': 128, 'lr': 0.002151714891570311, 'lambda_val': 0.0036858287791434216, 'batch_size': 3350, 'optimizer': 'Adam'}. Best is trial 135 with value: 0.08639900718181048.
2026-05-18 00:10:04,220 - experiment_functions - INFO - Early stopping at epoch 700. Best Recall: 0.0604
2026-05-18 00:10:04,308 - optuna.study.study - INFO - Trial 199 finished with value: 0.06043046678169316 and parameters: {'n_layers': 1, 'embedding_dim': 32, 'lr': 0.001309222397898134, 'lambda_val': 1.1733173050712362e-05, 'batch_size': 3215, 'optimizer': 'Adam'}. Best is trial 135 with value: 0.08639900718181048.
2026-05-18 00:10:47,394 - experiment_functions - INFO - Early stopping at epoch 2900. Best Recall: 0.0850
2026-05-18 00:10:47,495 - optuna.study.study - INFO - Trial 200 finished with value: 0.08495729092390601 and parameters: {'n_layers': 1, 'embedding_dim': 256, 'lr': 0.0017482029584308632, 'lambda_val': 9.060438611678422e-06, 'batch_size': 2899, 'optimizer': 'Adam'}. Best is trial 135 with value: 0.08639900718181048.
2026-05-18 00:11:27,272 - experiment_functions - INFO - Early stopping at epoch 2700. Best Recall: 0.0838
2026-05-18 00:11:27,362 - optuna.study.study - INFO - Trial 201 finished with value: 0.08376335196977544 and parameters: {'n_layers': 1, 'embedding_dim': 256, 'lr': 0.0018204531269518983, 'lambda_val': 8.710665866618836e-06, 'batch_size': 2912, 'optimizer': 'Adam'}. Best is trial 135 with value: 0.08639900718181048.
2026-05-18 00:11:53,373 - optuna.study._optimize - INFO - Trial 202 pruned. 
2026-05-18 00:12:33,229 - experiment_functions - INFO - Early stopping at epoch 2700. Best Recall: 0.0847
2026-05-18 00:12:33,319 - optuna.study.study - INFO - Trial 203 finished with value: 0.08470873510051617 and parameters: {'n_layers': 1, 'embedding_dim': 256, 'lr': 0.001434227031101051, 'lambda_val': 8.223299052945433e-06, 'batch_size': 2707, 'optimizer': 'Adam'}. Best is trial 135 with value: 0.08639900718181048.
2026-05-18 00:13:18,495 - experiment_functions - INFO - Early stopping at epoch 3050. Best Recall: 0.0854
2026-05-18 00:13:18,609 - optuna.study.study - INFO - Trial 204 finished with value: 0.08544662929945594 and parameters: {'n_layers': 1, 'embedding_dim': 256, 'lr': 0.0014910861933563463, 'lambda_val': 7.700620465652256e-06, 'batch_size': 2720, 'optimizer': 'Adam'}. Best is trial 135 with value: 0.08639900718181048.
2026-05-18 00:13:34,703 - optuna.study._optimize - INFO - Trial 205 pruned. 
2026-05-18 00:13:51,180 - optuna.study._optimize - INFO - Trial 206 pruned. 
2026-05-18 00:14:03,737 - experiment_functions - INFO - Early stopping at epoch 800. Best Recall: 0.0755
2026-05-18 00:14:03,827 - optuna.study.study - INFO - Trial 207 finished with value: 0.07552091727831885 and parameters: {'n_layers': 1, 'embedding_dim': 256, 'lr': 0.0014844850227882394, 'lambda_val': 1.0229727624519908e-05, 'batch_size': 2571, 'optimizer': 'Adam'}. Best is trial 135 with value: 0.08639900718181048.
2026-05-18 00:14:33,289 - optuna.study._optimize - INFO - Trial 208 pruned. 
2026-05-18 00:14:49,995 - optuna.study._optimize - INFO - Trial 209 pruned. 
2026-05-18 00:15:05,677 - optuna.study._optimize - INFO - Trial 210 pruned. 
2026-05-18 00:15:29,993 - optuna.study._optimize - INFO - Trial 211 pruned. 
2026-05-18 00:15:48,322 - optuna.study._optimize - INFO - Trial 212 pruned. 
2026-05-18 00:16:00,228 - experiment_functions - INFO - Early stopping at epoch 800. Best Recall: 0.0053
2026-05-18 00:16:00,329 - optuna.study.study - INFO - Trial 213 finished with value: 0.005278310930956963 and parameters: {'n_layers': 1, 'embedding_dim': 256, 'lr': 5.3477926687059855e-05, 'lambda_val': 3.917521196297542e-06, 'batch_size': 2724, 'optimizer': 'Adam'}. Best is trial 135 with value: 0.08639900718181048.
2026-05-18 00:16:29,623 - optuna.study._optimize - INFO - Trial 214 pruned. 
2026-05-18 00:16:40,370 - experiment_functions - INFO - Early stopping at epoch 700. Best Recall: 0.0621
2026-05-18 00:16:40,462 - optuna.study.study - INFO - Trial 215 finished with value: 0.062084346552653345 and parameters: {'n_layers': 1, 'embedding_dim': 64, 'lr': 0.0014905857808302978, 'lambda_val': 4.359092569593549e-06, 'batch_size': 2865, 'optimizer': 'Adam'}. Best is trial 135 with value: 0.08639900718181048.
2026-05-18 00:16:55,409 - optuna.study._optimize - INFO - Trial 216 pruned. 
2026-05-18 00:17:12,663 - optuna.study._optimize - INFO - Trial 217 pruned. 
2026-05-18 00:17:28,488 - optuna.study._optimize - INFO - Trial 218 pruned. 
2026-05-18 00:17:57,556 - experiment_functions - INFO - Early stopping at epoch 1900. Best Recall: 0.0831
2026-05-18 00:17:57,702 - optuna.study.study - INFO - Trial 219 finished with value: 0.08309575480911968 and parameters: {'n_layers': 1, 'embedding_dim': 256, 'lr': 0.001613316023844604, 'lambda_val': 8.139686168948935e-06, 'batch_size': 2911, 'optimizer': 'Adam'}. Best is trial 135 with value: 0.08639900718181048.
2026-05-18 00:18:22,371 - optuna.study._optimize - INFO - Trial 220 pruned. 
2026-05-18 00:18:37,430 - experiment_functions - INFO - Early stopping at epoch 950. Best Recall: 0.0749
2026-05-18 00:18:37,518 - optuna.study.study - INFO - Trial 221 finished with value: 0.0749194738319764 and parameters: {'n_layers': 1, 'embedding_dim': 256, 'lr': 0.0010406788911590486, 'lambda_val': 1.5649716499689734e-05, 'batch_size': 2979, 'optimizer': 'Adam'}. Best is trial 135 with value: 0.08639900718181048.
2026-05-18 00:18:53,735 - optuna.study._optimize - INFO - Trial 222 pruned. 
2026-05-18 00:19:09,771 - optuna.study._optimize - INFO - Trial 223 pruned. 
2026-05-18 00:19:25,863 - optuna.study._optimize - INFO - Trial 224 pruned. 
2026-05-18 00:19:42,011 - optuna.study._optimize - INFO - Trial 225 pruned. 
2026-05-18 00:20:08,170 - optuna.study._optimize - INFO - Trial 226 pruned. 
2026-05-18 00:20:24,343 - optuna.study._optimize - INFO - Trial 227 pruned. 
2026-05-18 00:20:41,806 - optuna.study._optimize - INFO - Trial 228 pruned. 
2026-05-18 00:21:12,332 - experiment_functions - INFO - Early stopping at epoch 2000. Best Recall: 0.0843
