2026-05-18 16:33:21,012 - optuna.study.study - INFO - Trial 73 finished with value: 0.06347822574097127 and parameters: {'n_layers': 1, 'embedding_dim': 64, 'lr': 0.0013662894240056714, 'lambda_val': 0.00128975034670962, 'batch_size': 866, 'optimizer': 'Adam'}. Best is trial 65 with value: 0.06978780283330527.
2026-05-18 16:33:40,370 - experiment_functions - INFO - Early stopping at epoch 1400. Best Recall: 0.0673
2026-05-18 16:33:40,485 - optuna.study.study - INFO - Trial 74 finished with value: 0.06726599554664683 and parameters: {'n_layers': 1, 'embedding_dim': 64, 'lr': 0.0009937126796449442, 'lambda_val': 0.0001021594028508441, 'batch_size': 684, 'optimizer': 'Adam'}. Best is trial 65 with value: 0.06978780283330527.
2026-05-18 16:33:54,061 - optuna.study._optimize - INFO - Trial 75 pruned. 
2026-05-18 16:34:16,648 - experiment_functions - INFO - Early stopping at epoch 1500. Best Recall: 0.0699
2026-05-18 16:34:16,743 - optuna.study.study - INFO - Trial 76 finished with value: 0.06986108774395815 and parameters: {'n_layers': 1, 'embedding_dim': 64, 'lr': 0.0008965264730423245, 'lambda_val': 0.00182960365341061, 'batch_size': 655, 'optimizer': 'Adam'}. Best is trial 76 with value: 0.06986108774395815.
2026-05-18 16:34:29,060 - experiment_functions - INFO - Early stopping at epoch 900. Best Recall: 0.0639
2026-05-18 16:34:29,153 - optuna.study.study - INFO - Trial 77 finished with value: 0.06386413482095445 and parameters: {'n_layers': 1, 'embedding_dim': 64, 'lr': 0.0016655009171239704, 'lambda_val': 0.0015332602872912184, 'batch_size': 650, 'optimizer': 'Adam'}. Best is trial 76 with value: 0.06986108774395815.
2026-05-18 16:34:46,395 - experiment_functions - INFO - Early stopping at epoch 1250. Best Recall: 0.0629
2026-05-18 16:34:46,485 - optuna.study.study - INFO - Trial 78 finished with value: 0.0628658557184145 and parameters: {'n_layers': 1, 'embedding_dim': 128, 'lr': 0.000991263761872042, 'lambda_val': 0.0034229938684540643, 'batch_size': 513, 'optimizer': 'Adam'}. Best is trial 76 with value: 0.06986108774395815.
2026-05-18 16:35:00,079 - optuna.study._optimize - INFO - Trial 79 pruned. 
2026-05-18 16:35:13,028 - experiment_functions - INFO - Early stopping at epoch 900. Best Recall: 0.0377
2026-05-18 16:35:13,121 - optuna.study.study - INFO - Trial 80 finished with value: 0.03772266290600953 and parameters: {'n_layers': 4, 'embedding_dim': 32, 'lr': 0.0006179268558488043, 'lambda_val': 0.00208945214121534, 'batch_size': 1111, 'optimizer': 'Adam'}. Best is trial 76 with value: 0.06986108774395815.
2026-05-18 16:35:33,936 - experiment_functions - INFO - Early stopping at epoch 1500. Best Recall: 0.0632
2026-05-18 16:35:34,027 - optuna.study.study - INFO - Trial 81 finished with value: 0.06322622835869325 and parameters: {'n_layers': 1, 'embedding_dim': 64, 'lr': 0.0008047623683983949, 'lambda_val': 0.00011623280008454567, 'batch_size': 995, 'optimizer': 'Adam'}. Best is trial 76 with value: 0.06986108774395815.
2026-05-18 16:35:47,244 - optuna.study._optimize - INFO - Trial 82 pruned. 
2026-05-18 16:36:02,025 - experiment_functions - INFO - Early stopping at epoch 950. Best Recall: 0.0663
2026-05-18 16:36:02,130 - optuna.study.study - INFO - Trial 83 finished with value: 0.06625610760978964 and parameters: {'n_layers': 1, 'embedding_dim': 64, 'lr': 0.001446785513900184, 'lambda_val': 9.234859044180275e-05, 'batch_size': 653, 'optimizer': 'Adam'}. Best is trial 76 with value: 0.06986108774395815.
2026-05-18 16:36:16,471 - experiment_functions - INFO - Early stopping at epoch 1000. Best Recall: 0.0613
2026-05-18 16:36:16,608 - optuna.study.study - INFO - Trial 84 finished with value: 0.06132240562815631 and parameters: {'n_layers': 1, 'embedding_dim': 64, 'lr': 0.0014670052011244465, 'lambda_val': 0.00022842043245443626, 'batch_size': 685, 'optimizer': 'Adam'}. Best is trial 76 with value: 0.06986108774395815.
2026-05-18 16:36:27,233 - experiment_functions - INFO - Early stopping at epoch 750. Best Recall: 0.0622
2026-05-18 16:36:27,334 - optuna.study.study - INFO - Trial 85 finished with value: 0.06223060898806041 and parameters: {'n_layers': 1, 'embedding_dim': 64, 'lr': 0.0027332758932188655, 'lambda_val': 8.701642038916016e-05, 'batch_size': 599, 'optimizer': 'Adam'}. Best is trial 76 with value: 0.06986108774395815.
2026-05-18 16:36:42,937 - experiment_functions - INFO - Early stopping at epoch 1100. Best Recall: 0.0654
2026-05-18 16:36:43,028 - optuna.study.study - INFO - Trial 86 finished with value: 0.06543916544849256 and parameters: {'n_layers': 1, 'embedding_dim': 64, 'lr': 0.001093925652097596, 'lambda_val': 0.0007615212712936134, 'batch_size': 909, 'optimizer': 'Adam'}. Best is trial 76 with value: 0.06986108774395815.
2026-05-18 16:36:52,238 - experiment_functions - INFO - Early stopping at epoch 650. Best Recall: 0.0582
2026-05-18 16:36:52,330 - optuna.study.study - INFO - Trial 87 finished with value: 0.05822339966994461 and parameters: {'n_layers': 1, 'embedding_dim': 64, 'lr': 0.004299284081173354, 'lambda_val': 0.005240769887723477, 'batch_size': 512, 'optimizer': 'Adam'}. Best is trial 76 with value: 0.06986108774395815.
2026-05-18 16:36:59,324 - experiment_functions - INFO - Early stopping at epoch 500. Best Recall: 0.0051
2026-05-18 16:36:59,417 - optuna.study.study - INFO - Trial 88 finished with value: 0.005094772500184717 and parameters: {'n_layers': 1, 'embedding_dim': 64, 'lr': 0.0011227965423418692, 'lambda_val': 0.0025442877619430595, 'batch_size': 868, 'optimizer': 'SGD'}. Best is trial 76 with value: 0.06986108774395815.
2026-05-18 16:37:09,253 - experiment_functions - INFO - Early stopping at epoch 700. Best Recall: 0.0573
2026-05-18 16:37:09,336 - optuna.study.study - INFO - Trial 89 finished with value: 0.05725666602632151 and parameters: {'n_layers': 1, 'embedding_dim': 64, 'lr': 0.0034454699758724823, 'lambda_val': 0.0007811017638400205, 'batch_size': 720, 'optimizer': 'Adam'}. Best is trial 76 with value: 0.06986108774395815.
2026-05-18 16:37:21,078 - experiment_functions - INFO - Early stopping at epoch 750. Best Recall: 0.0596
2026-05-18 16:37:22,052 - optuna.study.study - INFO - Trial 90 finished with value: 0.05962655898344265 and parameters: {'n_layers': 1, 'embedding_dim': 96, 'lr': 0.0018976254825967681, 'lambda_val': 0.0015036457916253788, 'batch_size': 1069, 'optimizer': 'Adam'}. Best is trial 76 with value: 0.06986108774395815.
2026-05-18 16:37:40,682 - experiment_functions - INFO - Early stopping at epoch 1350. Best Recall: 0.0650
2026-05-18 16:37:40,852 - optuna.study.study - INFO - Trial 91 finished with value: 0.06500761756117296 and parameters: {'n_layers': 1, 'embedding_dim': 64, 'lr': 0.0009351487234958392, 'lambda_val': 0.00018502074386447058, 'batch_size': 777, 'optimizer': 'Adam'}. Best is trial 76 with value: 0.06986108774395815.
2026-05-18 16:37:59,300 - experiment_functions - INFO - Early stopping at epoch 1350. Best Recall: 0.0668
2026-05-18 16:37:59,392 - optuna.study.study - INFO - Trial 92 finished with value: 0.06677990679428483 and parameters: {'n_layers': 1, 'embedding_dim': 64, 'lr': 0.0009549242586312828, 'lambda_val': 0.00018430698806052808, 'batch_size': 797, 'optimizer': 'Adam'}. Best is trial 76 with value: 0.06986108774395815.
2026-05-18 16:38:10,478 - experiment_functions - INFO - Early stopping at epoch 750. Best Recall: 0.0656
2026-05-18 16:38:10,581 - optuna.study.study - INFO - Trial 93 finished with value: 0.06560670228955237 and parameters: {'n_layers': 1, 'embedding_dim': 64, 'lr': 0.0023553013893522017, 'lambda_val': 0.000510009448559322, 'batch_size': 918, 'optimizer': 'Adam'}. Best is trial 76 with value: 0.06986108774395815.
2026-05-18 16:38:19,758 - experiment_functions - INFO - Early stopping at epoch 600. Best Recall: 0.0561
2026-05-18 16:38:19,862 - optuna.study.study - INFO - Trial 94 finished with value: 0.05606629460535022 and parameters: {'n_layers': 1, 'embedding_dim': 128, 'lr': 0.005986069246657432, 'lambda_val': 9.68560629740811e-05, 'batch_size': 649, 'optimizer': 'Adam'}. Best is trial 76 with value: 0.06986108774395815.
2026-05-18 16:38:30,131 - experiment_functions - INFO - Early stopping at epoch 700. Best Recall: 0.0647
2026-05-18 16:38:30,247 - optuna.study.study - INFO - Trial 95 finished with value: 0.06465468772622926 and parameters: {'n_layers': 1, 'embedding_dim': 64, 'lr': 0.0023722203938728826, 'lambda_val': 5.4057709273197386e-05, 'batch_size': 1214, 'optimizer': 'Adam'}. Best is trial 76 with value: 0.06986108774395815.
2026-05-18 16:38:44,574 - experiment_functions - INFO - Early stopping at epoch 1000. Best Recall: 0.0631
2026-05-18 16:38:44,666 - optuna.study.study - INFO - Trial 96 finished with value: 0.06313341436644607 and parameters: {'n_layers': 1, 'embedding_dim': 32, 'lr': 0.0015204915141584488, 'lambda_val': 0.0012786863713853283, 'batch_size': 759, 'optimizer': 'Adam'}. Best is trial 76 with value: 0.06986108774395815.
2026-05-18 16:38:55,390 - experiment_functions - INFO - Early stopping at epoch 750. Best Recall: 0.0539
2026-05-18 16:38:55,492 - optuna.study.study - INFO - Trial 97 finished with value: 0.053887942427735404 and parameters: {'n_layers': 1, 'embedding_dim': 64, 'lr': 0.0012710755861517881, 'lambda_val': 0.00045481924925429816, 'batch_size': 4058, 'optimizer': 'Adam'}. Best is trial 76 with value: 0.06986108774395815.
2026-05-18 16:39:05,544 - experiment_functions - INFO - Early stopping at epoch 700. Best Recall: 0.0607
2026-05-18 16:39:05,649 - optuna.study.study - INFO - Trial 98 finished with value: 0.06068976845155133 and parameters: {'n_layers': 1, 'embedding_dim': 64, 'lr': 0.0026443592265139263, 'lambda_val': 0.00011315799612248074, 'batch_size': 926, 'optimizer': 'Adam'}. Best is trial 76 with value: 0.06986108774395815.
2026-05-18 16:39:16,048 - experiment_functions - INFO - Early stopping at epoch 650. Best Recall: 0.0587
2026-05-18 16:39:16,150 - optuna.study.study - INFO - Trial 99 finished with value: 0.05870427632203331 and parameters: {'n_layers': 1, 'embedding_dim': 64, 'lr': 0.004217790468540918, 'lambda_val': 0.0018423746309164776, 'batch_size': 599, 'optimizer': 'Adam'}. Best is trial 76 with value: 0.06986108774395815.
2026-05-18 16:39:23,894 - experiment_functions - INFO - Early stopping at epoch 500. Best Recall: 0.0054
2026-05-18 16:39:24,009 - optuna.study.study - INFO - Trial 100 finished with value: 0.005391221252105322 and parameters: {'n_layers': 1, 'embedding_dim': 64, 'lr': 0.008082625910623193, 'lambda_val': 0.0006468472220779937, 'batch_size': 1158, 'optimizer': 'SGD'}. Best is trial 76 with value: 0.06986108774395815.
2026-05-18 16:39:35,604 - experiment_functions - INFO - Early stopping at epoch 800. Best Recall: 0.0629
2026-05-18 16:39:35,707 - optuna.study.study - INFO - Trial 101 finished with value: 0.06287977834862185 and parameters: {'n_layers': 1, 'embedding_dim': 64, 'lr': 0.0018330269832960526, 'lambda_val': 0.0007384981170142493, 'batch_size': 886, 'optimizer': 'Adam'}. Best is trial 76 with value: 0.06986108774395815.
2026-05-18 16:39:48,881 - optuna.study._optimize - INFO - Trial 102 pruned. 
2026-05-18 16:40:09,171 - experiment_functions - INFO - Early stopping at epoch 1500. Best Recall: 0.0655
2026-05-18 16:40:09,265 - optuna.study.study - INFO - Trial 103 finished with value: 0.06552527446376238 and parameters: {'n_layers': 1, 'embedding_dim': 64, 'lr': 0.0008561728350647473, 'lambda_val': 0.0037629150703904083, 'batch_size': 803, 'optimizer': 'Adam'}. Best is trial 76 with value: 0.06986108774395815.
2026-05-18 16:40:27,199 - experiment_functions - INFO - Early stopping at epoch 1200. Best Recall: 0.0627
2026-05-18 16:40:27,304 - optuna.study.study - INFO - Trial 104 finished with value: 0.06271579208437292 and parameters: {'n_layers': 1, 'embedding_dim': 64, 'lr': 0.000854055376065864, 'lambda_val': 0.008727097418784146, 'batch_size': 795, 'optimizer': 'Adam'}. Best is trial 76 with value: 0.06986108774395815.
2026-05-18 16:40:41,028 - optuna.study._optimize - INFO - Trial 105 pruned. 
2026-05-18 16:40:53,480 - experiment_functions - INFO - Early stopping at epoch 900. Best Recall: 0.0643
2026-05-18 16:40:53,583 - optuna.study.study - INFO - Trial 106 finished with value: 0.06430204078345339 and parameters: {'n_layers': 1, 'embedding_dim': 64, 'lr': 0.001539872277324691, 'lambda_val': 0.0039581206196610385, 'batch_size': 810, 'optimizer': 'Adam'}. Best is trial 76 with value: 0.06986108774395815.
2026-05-18 16:41:00,650 - experiment_functions - INFO - Early stopping at epoch 500. Best Recall: 0.0057
2026-05-18 16:41:00,754 - optuna.study.study - INFO - Trial 107 finished with value: 0.005734618852245231 and parameters: {'n_layers': 1, 'embedding_dim': 64, 'lr': 0.0003146693650919708, 'lambda_val': 0.0026360433087631177, 'batch_size': 574, 'optimizer': 'Adam'}. Best is trial 76 with value: 0.06986108774395815.
2026-05-18 16:41:12,835 - experiment_functions - INFO - Early stopping at epoch 800. Best Recall: 0.0630
2026-05-18 16:41:12,951 - optuna.study.study - INFO - Trial 108 finished with value: 0.06295331422002975 and parameters: {'n_layers': 1, 'embedding_dim': 64, 'lr': 0.0022004521376583304, 'lambda_val': 0.00047991426927811057, 'batch_size': 692, 'optimizer': 'Adam'}. Best is trial 76 with value: 0.06986108774395815.
2026-05-18 16:41:28,211 - optuna.study._optimize - INFO - Trial 109 pruned. 
2026-05-18 16:41:40,822 - experiment_functions - INFO - Early stopping at epoch 900. Best Recall: 0.0604
2026-05-18 16:41:40,924 - optuna.study.study - INFO - Trial 110 finished with value: 0.0604002889266961 and parameters: {'n_layers': 1, 'embedding_dim': 128, 'lr': 0.0011926704140704334, 'lambda_val': 0.00642764092986653, 'batch_size': 933, 'optimizer': 'Adam'}. Best is trial 76 with value: 0.06986108774395815.
2026-05-18 16:41:59,354 - experiment_functions - INFO - Early stopping at epoch 1300. Best Recall: 0.0653
2026-05-18 16:41:59,447 - optuna.study.study - INFO - Trial 111 finished with value: 0.06526933315591421 and parameters: {'n_layers': 1, 'embedding_dim': 64, 'lr': 0.0009843154253445106, 'lambda_val': 0.001136765566726193, 'batch_size': 875, 'optimizer': 'Adam'}. Best is trial 76 with value: 0.06986108774395815.
2026-05-18 16:42:31,148 - experiment_functions - INFO - Early stopping at epoch 2400. Best Recall: 0.0693
2026-05-18 16:42:31,240 - optuna.study.study - INFO - Trial 112 finished with value: 0.06926225662314807 and parameters: {'n_layers': 1, 'embedding_dim': 64, 'lr': 0.0007349395307381482, 'lambda_val': 0.0003024634059567493, 'batch_size': 755, 'optimizer': 'Adam'}. Best is trial 76 with value: 0.06986108774395815.
2026-05-18 16:43:03,161 - experiment_functions - INFO - Early stopping at epoch 2200. Best Recall: 0.0645
2026-05-18 16:43:03,730 - optuna.study.study - INFO - Trial 113 finished with value: 0.06445145677228542 and parameters: {'n_layers': 1, 'embedding_dim': 64, 'lr': 0.0007351596234257906, 'lambda_val': 0.00022266111035368162, 'batch_size': 745, 'optimizer': 'Adam'}. Best is trial 76 with value: 0.06986108774395815.
2026-05-18 16:43:29,977 - experiment_functions - INFO - Early stopping at epoch 1800. Best Recall: 0.0665
2026-05-18 16:43:30,070 - optuna.study.study - INFO - Trial 114 finished with value: 0.0664934930628781 and parameters: {'n_layers': 1, 'embedding_dim': 64, 'lr': 0.0008684327904011858, 'lambda_val': 0.00032615457250588574, 'batch_size': 623, 'optimizer': 'Adam'}. Best is trial 76 with value: 0.06986108774395815.
2026-05-18 16:43:44,358 - experiment_functions - INFO - Early stopping at epoch 1000. Best Recall: 0.0637
2026-05-18 16:43:44,450 - optuna.study.study - INFO - Trial 115 finished with value: 0.06367116115928484 and parameters: {'n_layers': 1, 'embedding_dim': 64, 'lr': 0.0013658589104311514, 'lambda_val': 0.00036315173461044954, 'batch_size': 561, 'optimizer': 'Adam'}. Best is trial 76 with value: 0.06986108774395815.
2026-05-18 16:43:57,949 - optuna.study._optimize - INFO - Trial 116 pruned. 
2026-05-18 16:44:14,873 - experiment_functions - INFO - Early stopping at epoch 1100. Best Recall: 0.0666
2026-05-18 16:44:14,965 - optuna.study.study - INFO - Trial 117 finished with value: 0.06661665360240542 and parameters: {'n_layers': 1, 'embedding_dim': 32, 'lr': 0.0017308609614149221, 'lambda_val': 0.000187175742852702, 'batch_size': 518, 'optimizer': 'Adam'}. Best is trial 76 with value: 0.06986108774395815.
2026-05-18 16:44:22,257 - experiment_functions - INFO - Early stopping at epoch 500. Best Recall: 0.0047
2026-05-18 16:44:22,341 - optuna.study.study - INFO - Trial 118 finished with value: 0.004685788864532707 and parameters: {'n_layers': 1, 'embedding_dim': 32, 'lr': 0.0005991443455772604, 'lambda_val': 0.0001390048485222479, 'batch_size': 551, 'optimizer': 'SGD'}. Best is trial 76 with value: 0.06986108774395815.
2026-05-18 16:44:38,422 - experiment_functions - INFO - Early stopping at epoch 1150. Best Recall: 0.0682
2026-05-18 16:44:38,526 - optuna.study.study - INFO - Trial 119 finished with value: 0.06815468186949106 and parameters: {'n_layers': 1, 'embedding_dim': 32, 'lr': 0.0016461097914343818, 'lambda_val': 0.00018013284667899935, 'batch_size': 514, 'optimizer': 'Adam'}. Best is trial 76 with value: 0.06986108774395815.
2026-05-18 16:44:52,368 - optuna.study._optimize - INFO - Trial 120 pruned. 
2026-05-18 16:45:06,958 - experiment_functions - INFO - Early stopping at epoch 1000. Best Recall: 0.0693
2026-05-18 16:45:07,061 - optuna.study.study - INFO - Trial 121 finished with value: 0.06927696210232645 and parameters: {'n_layers': 1, 'embedding_dim': 32, 'lr': 0.0017383566965873342, 'lambda_val': 0.00010166779301392703, 'batch_size': 646, 'optimizer': 'Adam'}. Best is trial 76 with value: 0.06986108774395815.
2026-05-18 16:45:20,611 - experiment_functions - INFO - Early stopping at epoch 1000. Best Recall: 0.0688
2026-05-18 16:45:20,692 - optuna.study.study - INFO - Trial 122 finished with value: 0.06877319108452803 and parameters: {'n_layers': 1, 'embedding_dim': 32, 'lr': 0.001773534122691275, 'lambda_val': 0.00010891502010442139, 'batch_size': 633, 'optimizer': 'Adam'}. Best is trial 76 with value: 0.06986108774395815.
2026-05-18 16:45:35,651 - experiment_functions - INFO - Early stopping at epoch 1000. Best Recall: 0.0651
2026-05-18 16:45:35,795 - optuna.study.study - INFO - Trial 123 finished with value: 0.06507038432051543 and parameters: {'n_layers': 1, 'embedding_dim': 32, 'lr': 0.0016421655544138361, 'lambda_val': 0.00010606072423084054, 'batch_size': 628, 'optimizer': 'Adam'}. Best is trial 76 with value: 0.06986108774395815.
2026-05-18 16:45:55,209 - experiment_functions - INFO - Early stopping at epoch 1350. Best Recall: 0.0679
2026-05-18 16:45:55,299 - optuna.study.study - INFO - Trial 124 finished with value: 0.06789333188586344 and parameters: {'n_layers': 1, 'embedding_dim': 32, 'lr': 0.00118222497638822, 'lambda_val': 7.139879400603415e-05, 'batch_size': 691, 'optimizer': 'Adam'}. Best is trial 76 with value: 0.06986108774395815.
2026-05-18 16:46:15,356 - experiment_functions - INFO - Early stopping at epoch 1500. Best Recall: 0.0687
2026-05-18 16:46:15,445 - optuna.study.study - INFO - Trial 125 finished with value: 0.06868786519855932 and parameters: {'n_layers': 1, 'embedding_dim': 32, 'lr': 0.0010483994214101307, 'lambda_val': 6.082476573004088e-05, 'batch_size': 710, 'optimizer': 'Adam'}. Best is trial 76 with value: 0.06986108774395815.
2026-05-18 16:46:32,033 - experiment_functions - INFO - Early stopping at epoch 1250. Best Recall: 0.0689
2026-05-18 16:46:32,124 - optuna.study.study - INFO - Trial 126 finished with value: 0.06893154015782924 and parameters: {'n_layers': 1, 'embedding_dim': 32, 'lr': 0.0012957630889362866, 'lambda_val': 6.556153195895906e-05, 'batch_size': 746, 'optimizer': 'Adam'}. Best is trial 76 with value: 0.06986108774395815.
2026-05-18 16:46:49,497 - experiment_functions - INFO - Early stopping at epoch 1300. Best Recall: 0.0652
2026-05-18 16:46:49,589 - optuna.study.study - INFO - Trial 127 finished with value: 0.06524585184634171 and parameters: {'n_layers': 1, 'embedding_dim': 32, 'lr': 0.0010616081756677235, 'lambda_val': 6.571438265871064e-05, 'batch_size': 720, 'optimizer': 'Adam'}. Best is trial 76 with value: 0.06986108774395815.
2026-05-18 16:47:05,371 - experiment_functions - INFO - Early stopping at epoch 1200. Best Recall: 0.0696
2026-05-18 16:47:05,462 - optuna.study.study - INFO - Trial 128 finished with value: 0.06964591023244557 and parameters: {'n_layers': 1, 'embedding_dim': 32, 'lr': 0.0012326629482622702, 'lambda_val': 4.455906688204145e-05, 'batch_size': 728, 'optimizer': 'Adam'}. Best is trial 76 with value: 0.06986108774395815.
2026-05-18 16:47:22,391 - experiment_functions - INFO - Early stopping at epoch 1250. Best Recall: 0.0671
2026-05-18 16:47:22,492 - optuna.study.study - INFO - Trial 129 finished with value: 0.06711005832965368 and parameters: {'n_layers': 1, 'embedding_dim': 32, 'lr': 0.001226023505252709, 'lambda_val': 4.5681530253721816e-05, 'batch_size': 704, 'optimizer': 'Adam'}. Best is trial 76 with value: 0.06986108774395815.
2026-05-18 16:47:35,810 - optuna.study._optimize - INFO - Trial 130 pruned. 
2026-05-18 16:47:53,787 - experiment_functions - INFO - Early stopping at epoch 1300. Best Recall: 0.0676
2026-05-18 16:47:53,907 - optuna.study.study - INFO - Trial 131 finished with value: 0.06759018390974961 and parameters: {'n_layers': 1, 'embedding_dim': 32, 'lr': 0.001134442991142047, 'lambda_val': 3.898439049948039e-05, 'batch_size': 713, 'optimizer': 'Adam'}. Best is trial 76 with value: 0.06986108774395815.
2026-05-18 16:48:14,359 - experiment_functions - INFO - Early stopping at epoch 1450. Best Recall: 0.0693
