2026-05-18 21:34:00,218 - optuna.study.study - INFO - Trial 149 finished with value: 0.0857410374822191 and parameters: {'n_layers': 1, 'embedding_dim': 64, 'lr': 0.000467993122051943, 'lambda_val': 0.011324142236301092, 'batch_size': 2156, 'optimizer': 'RMSprop'}. Best is trial 132 with value: 0.09765203524228237.
2026-05-18 21:34:17,032 - experiment_functions - INFO - Early stopping at epoch 1100. Best Recall: 0.0941
2026-05-18 21:34:17,165 - optuna.study.study - INFO - Trial 150 finished with value: 0.09413925321805126 and parameters: {'n_layers': 1, 'embedding_dim': 64, 'lr': 0.0007903620325823132, 'lambda_val': 9.447307216329738e-05, 'batch_size': 642, 'optimizer': 'RMSprop'}. Best is trial 132 with value: 0.09765203524228237.
2026-05-18 21:34:34,095 - optuna.study._optimize - INFO - Trial 151 pruned. 
2026-05-18 21:34:47,550 - experiment_functions - INFO - Early stopping at epoch 900. Best Recall: 0.0895
2026-05-18 21:34:48,109 - optuna.study.study - INFO - Trial 152 finished with value: 0.08954695659337418 and parameters: {'n_layers': 1, 'embedding_dim': 64, 'lr': 0.0008813094235380877, 'lambda_val': 0.00017512435053577722, 'batch_size': 592, 'optimizer': 'RMSprop'}. Best is trial 132 with value: 0.09765203524228237.
2026-05-18 21:34:58,154 - experiment_functions - INFO - Early stopping at epoch 650. Best Recall: 0.0815
2026-05-18 21:34:58,232 - optuna.study.study - INFO - Trial 153 finished with value: 0.08148610045319807 and parameters: {'n_layers': 1, 'embedding_dim': 64, 'lr': 0.001381645833283339, 'lambda_val': 0.00028665592767490236, 'batch_size': 735, 'optimizer': 'RMSprop'}. Best is trial 132 with value: 0.09765203524228237.
2026-05-18 21:35:43,222 - experiment_functions - INFO - Early stopping at epoch 3100. Best Recall: 0.0966
2026-05-18 21:35:43,321 - optuna.study.study - INFO - Trial 154 finished with value: 0.09657687419323802 and parameters: {'n_layers': 1, 'embedding_dim': 96, 'lr': 0.00043191032360563814, 'lambda_val': 8.981517383049239e-05, 'batch_size': 665, 'optimizer': 'RMSprop'}. Best is trial 132 with value: 0.09765203524228237.
2026-05-18 21:36:24,832 - optuna.study._optimize - INFO - Trial 155 pruned. 
2026-05-18 21:36:45,410 - optuna.study._optimize - INFO - Trial 156 pruned. 
2026-05-18 21:36:58,152 - experiment_functions - INFO - Early stopping at epoch 700. Best Recall: 0.0434
2026-05-18 21:36:58,231 - optuna.study.study - INFO - Trial 157 finished with value: 0.043416840864346974 and parameters: {'n_layers': 4, 'embedding_dim': 96, 'lr': 0.00036014972683113145, 'lambda_val': 0.00011550906553424105, 'batch_size': 3926, 'optimizer': 'RMSprop'}. Best is trial 132 with value: 0.09765203524228237.
2026-05-18 21:37:05,454 - experiment_functions - INFO - Early stopping at epoch 500. Best Recall: 0.0049
2026-05-18 21:37:05,587 - optuna.study.study - INFO - Trial 158 finished with value: 0.004865667685313971 and parameters: {'n_layers': 1, 'embedding_dim': 96, 'lr': 0.0004517714387081998, 'lambda_val': 0.00034629177251047744, 'batch_size': 699, 'optimizer': 'SGD'}. Best is trial 132 with value: 0.09765203524228237.
2026-05-18 21:37:20,503 - optuna.study._optimize - INFO - Trial 159 pruned. 
2026-05-18 21:37:38,594 - optuna.study._optimize - INFO - Trial 160 pruned. 
2026-05-18 21:37:59,631 - experiment_functions - INFO - Early stopping at epoch 1400. Best Recall: 0.0940
2026-05-18 21:37:59,730 - optuna.study.study - INFO - Trial 161 finished with value: 0.09396760317937228 and parameters: {'n_layers': 1, 'embedding_dim': 64, 'lr': 0.000665454236695689, 'lambda_val': 0.0001647225687557024, 'batch_size': 519, 'optimizer': 'RMSprop'}. Best is trial 132 with value: 0.09765203524228237.
2026-05-18 21:38:12,029 - experiment_functions - INFO - Early stopping at epoch 800. Best Recall: 0.0895
2026-05-18 21:38:12,163 - optuna.study.study - INFO - Trial 162 finished with value: 0.08952581369356469 and parameters: {'n_layers': 1, 'embedding_dim': 64, 'lr': 0.0010628316638019713, 'lambda_val': 0.0001380931392451149, 'batch_size': 609, 'optimizer': 'RMSprop'}. Best is trial 132 with value: 0.09765203524228237.
2026-05-18 21:38:33,392 - optuna.study._optimize - INFO - Trial 163 pruned. 
2026-05-18 21:38:47,733 - experiment_functions - INFO - Early stopping at epoch 950. Best Recall: 0.0883
2026-05-18 21:38:47,877 - optuna.study.study - INFO - Trial 164 finished with value: 0.08828966476762586 and parameters: {'n_layers': 1, 'embedding_dim': 96, 'lr': 0.0008160744598005592, 'lambda_val': 0.00026671871389942915, 'batch_size': 682, 'optimizer': 'RMSprop'}. Best is trial 132 with value: 0.09765203524228237.
2026-05-18 21:39:02,561 - optuna.study._optimize - INFO - Trial 165 pruned. 
2026-05-18 21:39:17,860 - optuna.study._optimize - INFO - Trial 166 pruned. 
2026-05-18 21:39:28,414 - experiment_functions - INFO - Early stopping at epoch 650. Best Recall: 0.0795
2026-05-18 21:39:28,495 - optuna.study.study - INFO - Trial 167 finished with value: 0.0794715118969698 and parameters: {'n_layers': 1, 'embedding_dim': 128, 'lr': 0.0006481037390554769, 'lambda_val': 0.0004895196621868405, 'batch_size': 3302, 'optimizer': 'RMSprop'}. Best is trial 132 with value: 0.09765203524228237.
2026-05-18 21:39:40,194 - experiment_functions - INFO - Early stopping at epoch 750. Best Recall: 0.0845
2026-05-18 21:39:40,285 - optuna.study.study - INFO - Trial 168 finished with value: 0.08447078174264867 and parameters: {'n_layers': 1, 'embedding_dim': 64, 'lr': 0.0007302833291176364, 'lambda_val': 0.00016843483884450693, 'batch_size': 1879, 'optimizer': 'RMSprop'}. Best is trial 132 with value: 0.09765203524228237.
2026-05-18 21:40:07,258 - optuna.study._optimize - INFO - Trial 169 pruned. 
2026-05-18 21:40:19,466 - experiment_functions - INFO - Early stopping at epoch 800. Best Recall: 0.0888
2026-05-18 21:40:19,556 - optuna.study.study - INFO - Trial 170 finished with value: 0.08882194782852743 and parameters: {'n_layers': 1, 'embedding_dim': 64, 'lr': 0.0011496671002525138, 'lambda_val': 0.0002958951916841507, 'batch_size': 585, 'optimizer': 'RMSprop'}. Best is trial 132 with value: 0.09765203524228237.
2026-05-18 21:40:35,156 - optuna.study._optimize - INFO - Trial 171 pruned. 
2026-05-18 21:40:51,532 - experiment_functions - INFO - Early stopping at epoch 1100. Best Recall: 0.0918
2026-05-18 21:40:52,297 - optuna.study.study - INFO - Trial 172 finished with value: 0.09180299629736928 and parameters: {'n_layers': 1, 'embedding_dim': 64, 'lr': 0.0009054314531662073, 'lambda_val': 0.00018074026478560385, 'batch_size': 512, 'optimizer': 'RMSprop'}. Best is trial 132 with value: 0.09765203524228237.
2026-05-18 21:41:17,164 - optuna.study._optimize - INFO - Trial 173 pruned. 
2026-05-18 21:41:35,658 - experiment_functions - INFO - Early stopping at epoch 1250. Best Recall: 0.0946
2026-05-18 21:41:35,792 - optuna.study.study - INFO - Trial 174 finished with value: 0.09458543902228876 and parameters: {'n_layers': 1, 'embedding_dim': 64, 'lr': 0.0007630762410101549, 'lambda_val': 8.898631125540248e-05, 'batch_size': 644, 'optimizer': 'RMSprop'}. Best is trial 132 with value: 0.09765203524228237.
2026-05-18 21:41:49,990 - optuna.study._optimize - INFO - Trial 175 pruned. 
2026-05-18 21:42:09,727 - optuna.study._optimize - INFO - Trial 176 pruned. 
2026-05-18 21:42:25,965 - experiment_functions - INFO - Early stopping at epoch 1050. Best Recall: 0.0935
2026-05-18 21:42:26,066 - optuna.study.study - INFO - Trial 177 finished with value: 0.09345084681416449 and parameters: {'n_layers': 1, 'embedding_dim': 64, 'lr': 0.0008088170727010168, 'lambda_val': 0.0002240440718531516, 'batch_size': 582, 'optimizer': 'RMSprop'}. Best is trial 132 with value: 0.09765203524228237.
2026-05-18 21:42:52,425 - experiment_functions - INFO - Early stopping at epoch 1850. Best Recall: 0.0942
2026-05-18 21:42:52,513 - optuna.study.study - INFO - Trial 178 finished with value: 0.09424096120267049 and parameters: {'n_layers': 1, 'embedding_dim': 96, 'lr': 0.00048276570591884976, 'lambda_val': 0.00039851090812242196, 'batch_size': 743, 'optimizer': 'RMSprop'}. Best is trial 132 with value: 0.09765203524228237.
2026-05-18 21:43:00,367 - experiment_functions - INFO - Early stopping at epoch 500. Best Recall: 0.0056
2026-05-18 21:43:00,469 - optuna.study.study - INFO - Trial 179 finished with value: 0.0055761447357872045 and parameters: {'n_layers': 1, 'embedding_dim': 96, 'lr': 0.0002993280860447929, 'lambda_val': 0.0006378628088591173, 'batch_size': 764, 'optimizer': 'SGD'}. Best is trial 132 with value: 0.09765203524228237.
2026-05-18 21:43:27,011 - optuna.study._optimize - INFO - Trial 180 pruned. 
2026-05-18 21:43:52,639 - experiment_functions - INFO - Early stopping at epoch 1750. Best Recall: 0.0957
2026-05-18 21:43:52,729 - optuna.study.study - INFO - Trial 181 finished with value: 0.0957108840669559 and parameters: {'n_layers': 1, 'embedding_dim': 96, 'lr': 0.0005014087086022204, 'lambda_val': 0.0003034630328753742, 'batch_size': 684, 'optimizer': 'RMSprop'}. Best is trial 132 with value: 0.09765203524228237.
2026-05-18 21:44:09,047 - experiment_functions - INFO - Early stopping at epoch 900. Best Recall: 0.0845
2026-05-18 21:44:09,813 - optuna.study.study - INFO - Trial 182 finished with value: 0.08454646785092725 and parameters: {'n_layers': 1, 'embedding_dim': 96, 'lr': 0.0005084208604208049, 'lambda_val': 0.00028664440970735817, 'batch_size': 2427, 'optimizer': 'RMSprop'}. Best is trial 132 with value: 0.09765203524228237.
2026-05-18 21:44:24,901 - optuna.study._optimize - INFO - Trial 183 pruned. 
2026-05-18 21:44:54,617 - experiment_functions - INFO - Early stopping at epoch 2050. Best Recall: 0.0942
2026-05-18 21:44:54,762 - optuna.study.study - INFO - Trial 184 finished with value: 0.09424884477854044 and parameters: {'n_layers': 1, 'embedding_dim': 96, 'lr': 0.0004919740424858215, 'lambda_val': 0.00033635700839933073, 'batch_size': 648, 'optimizer': 'RMSprop'}. Best is trial 132 with value: 0.09765203524228237.
2026-05-18 21:45:28,531 - experiment_functions - INFO - Early stopping at epoch 1700. Best Recall: 0.0934
2026-05-18 21:45:28,893 - optuna.study.study - INFO - Trial 185 finished with value: 0.09344266295396318 and parameters: {'n_layers': 1, 'embedding_dim': 96, 'lr': 0.0005066428463852859, 'lambda_val': 0.00032833243398949026, 'batch_size': 753, 'optimizer': 'RMSprop'}. Best is trial 132 with value: 0.09765203524228237.
2026-05-18 21:45:43,860 - optuna.study._optimize - INFO - Trial 186 pruned. 
2026-05-18 21:46:02,367 - experiment_functions - INFO - Early stopping at epoch 1250. Best Recall: 0.0942
2026-05-18 21:46:02,468 - optuna.study.study - INFO - Trial 187 finished with value: 0.09415226490851812 and parameters: {'n_layers': 1, 'embedding_dim': 96, 'lr': 0.0005773070366952917, 'lambda_val': 0.00024079365735022525, 'batch_size': 707, 'optimizer': 'RMSprop'}. Best is trial 132 with value: 0.09765203524228237.
2026-05-18 21:46:17,866 - optuna.study._optimize - INFO - Trial 188 pruned. 
2026-05-18 21:46:33,351 - optuna.study._optimize - INFO - Trial 189 pruned. 
2026-05-18 21:46:57,172 - experiment_functions - INFO - Early stopping at epoch 1600. Best Recall: 0.0939
2026-05-18 21:46:57,284 - optuna.study.study - INFO - Trial 190 finished with value: 0.09390480338575895 and parameters: {'n_layers': 1, 'embedding_dim': 96, 'lr': 0.0004854510430961599, 'lambda_val': 0.00020919305221725901, 'batch_size': 882, 'optimizer': 'RMSprop'}. Best is trial 132 with value: 0.09765203524228237.
2026-05-18 21:47:18,142 - experiment_functions - INFO - Early stopping at epoch 1450. Best Recall: 0.0950
2026-05-18 21:47:18,287 - optuna.study.study - INFO - Trial 191 finished with value: 0.09497289992625042 and parameters: {'n_layers': 1, 'embedding_dim': 96, 'lr': 0.0005733794489609282, 'lambda_val': 0.0002307814825879034, 'batch_size': 718, 'optimizer': 'RMSprop'}. Best is trial 132 with value: 0.09765203524228237.
2026-05-18 21:47:26,824 - experiment_functions - INFO - Early stopping at epoch 600. Best Recall: 0.0059
2026-05-18 21:47:26,937 - optuna.study.study - INFO - Trial 192 finished with value: 0.005891408148333028 and parameters: {'n_layers': 1, 'embedding_dim': 96, 'lr': 1.3216164361798496e-05, 'lambda_val': 0.000276655987587557, 'batch_size': 782, 'optimizer': 'RMSprop'}. Best is trial 132 with value: 0.09765203524228237.
2026-05-18 21:47:43,784 - optuna.study._optimize - INFO - Trial 193 pruned. 
2026-05-18 21:47:58,166 - optuna.study._optimize - INFO - Trial 194 pruned. 
2026-05-18 21:48:11,734 - optuna.study._optimize - INFO - Trial 195 pruned. 
2026-05-18 21:48:49,784 - experiment_functions - INFO - Early stopping at epoch 2000. Best Recall: 0.0960
2026-05-18 21:48:49,873 - optuna.study.study - INFO - Trial 196 finished with value: 0.09599724851394552 and parameters: {'n_layers': 1, 'embedding_dim': 96, 'lr': 0.0004950653231343021, 'lambda_val': 0.00020000346038340236, 'batch_size': 680, 'optimizer': 'RMSprop'}. Best is trial 132 with value: 0.09765203524228237.
2026-05-18 21:49:00,815 - experiment_functions - INFO - Early stopping at epoch 700. Best Recall: 0.0848
2026-05-18 21:49:00,906 - optuna.study.study - INFO - Trial 197 finished with value: 0.08480179120966791 and parameters: {'n_layers': 1, 'embedding_dim': 128, 'lr': 0.000952294274907429, 'lambda_val': 0.0001955552636354973, 'batch_size': 806, 'optimizer': 'RMSprop'}. Best is trial 132 with value: 0.09765203524228237.
2026-05-18 21:49:24,161 - experiment_functions - INFO - Early stopping at epoch 1550. Best Recall: 0.0938
2026-05-18 21:49:24,250 - optuna.study.study - INFO - Trial 198 finished with value: 0.0938334172527089 and parameters: {'n_layers': 1, 'embedding_dim': 96, 'lr': 0.0005425969676055871, 'lambda_val': 0.00012126403137324882, 'batch_size': 572, 'optimizer': 'RMSprop'}. Best is trial 132 with value: 0.09765203524228237.
2026-05-18 21:49:38,142 - experiment_functions - INFO - Early stopping at epoch 950. Best Recall: 0.0910
2026-05-18 21:49:38,277 - optuna.study.study - INFO - Trial 199 finished with value: 0.09096524468825874 and parameters: {'n_layers': 1, 'embedding_dim': 64, 'lr': 0.00079549462967396, 'lambda_val': 0.00020276056557320322, 'batch_size': 717, 'optimizer': 'RMSprop'}. Best is trial 132 with value: 0.09765203524228237.
2026-05-18 21:49:55,927 - optuna.study._optimize - INFO - Trial 200 pruned. 
2026-05-18 21:50:27,376 - optuna.study._optimize - INFO - Trial 201 pruned. 
2026-05-18 21:50:42,214 - optuna.study._optimize - INFO - Trial 202 pruned. 
2026-05-18 21:51:00,195 - experiment_functions - INFO - Early stopping at epoch 1150. Best Recall: 0.0946
2026-05-18 21:51:00,295 - optuna.study.study - INFO - Trial 203 finished with value: 0.09455044153621822 and parameters: {'n_layers': 1, 'embedding_dim': 96, 'lr': 0.0006512825085685084, 'lambda_val': 0.0003886570315687331, 'batch_size': 641, 'optimizer': 'RMSprop'}. Best is trial 132 with value: 0.09765203524228237.
2026-05-18 21:51:20,161 - experiment_functions - INFO - Early stopping at epoch 1350. Best Recall: 0.0933
2026-05-18 21:51:20,304 - optuna.study.study - INFO - Trial 204 finished with value: 0.09333829568231018 and parameters: {'n_layers': 1, 'embedding_dim': 96, 'lr': 0.0006352591353727494, 'lambda_val': 0.0007203368045304789, 'batch_size': 513, 'optimizer': 'RMSprop'}. Best is trial 132 with value: 0.09765203524228237.
2026-05-18 21:51:44,495 - experiment_functions - INFO - Early stopping at epoch 1050. Best Recall: 0.0911
2026-05-18 21:51:44,629 - optuna.study.study - INFO - Trial 205 finished with value: 0.09111961575054896 and parameters: {'n_layers': 1, 'embedding_dim': 64, 'lr': 0.0006922503680615842, 'lambda_val': 0.0004546161205938006, 'batch_size': 748, 'optimizer': 'RMSprop'}. Best is trial 132 with value: 0.09765203524228237.
2026-05-18 21:52:13,052 - experiment_functions - INFO - Early stopping at epoch 2000. Best Recall: 0.0973
2026-05-18 21:52:13,132 - optuna.study.study - INFO - Trial 206 finished with value: 0.09733758028792674 and parameters: {'n_layers': 1, 'embedding_dim': 64, 'lr': 0.0005602605180674646, 'lambda_val': 0.00017410981440344047, 'batch_size': 617, 'optimizer': 'RMSprop'}. Best is trial 132 with value: 0.09765203524228237.
2026-05-18 21:52:27,740 - optuna.study._optimize - INFO - Trial 207 pruned. 
2026-05-18 21:52:34,930 - experiment_functions - INFO - Early stopping at epoch 500. Best Recall: 0.0060
2026-05-18 21:52:35,002 - optuna.study.study - INFO - Trial 208 finished with value: 0.006009846307980652 and parameters: {'n_layers': 1, 'embedding_dim': 64, 'lr': 0.0007002329653341574, 'lambda_val': 0.00019304772634536724, 'batch_size': 629, 'optimizer': 'SGD'}. Best is trial 132 with value: 0.09765203524228237.
2026-05-18 21:53:06,460 - experiment_functions - INFO - Early stopping at epoch 2250. Best Recall: 0.0956
2026-05-18 21:53:06,593 - optuna.study.study - INFO - Trial 209 finished with value: 0.0955989324562307 and parameters: {'n_layers': 1, 'embedding_dim': 64, 'lr': 0.0006097671268766062, 'lambda_val': 0.00012428839466489014, 'batch_size': 564, 'optimizer': 'RMSprop'}. Best is trial 132 with value: 0.09765203524228237.
2026-05-18 21:53:20,101 - experiment_functions - INFO - Early stopping at epoch 900. Best Recall: 0.0905
2026-05-18 21:53:20,200 - optuna.study.study - INFO - Trial 210 finished with value: 0.09054365458512113 and parameters: {'n_layers': 1, 'embedding_dim': 64, 'lr': 0.0010030824969778731, 'lambda_val': 0.00011336222742076987, 'batch_size': 513, 'optimizer': 'RMSprop'}. Best is trial 132 with value: 0.09765203524228237.
2026-05-18 21:53:34,604 - experiment_functions - INFO - Early stopping at epoch 850. Best Recall: 0.0690
2026-05-18 21:53:34,703 - optuna.study.study - INFO - Trial 211 finished with value: 0.06901514759900707 and parameters: {'n_layers': 3, 'embedding_dim': 64, 'lr': 0.0005755511192828729, 'lambda_val': 0.0001619462964293182, 'batch_size': 571, 'optimizer': 'RMSprop'}. Best is trial 132 with value: 0.09765203524228237.
2026-05-18 21:53:56,034 - optuna.study._optimize - INFO - Trial 212 pruned. 
2026-05-18 21:54:14,526 - experiment_functions - INFO - Early stopping at epoch 1300. Best Recall: 0.0954
2026-05-18 21:54:14,617 - optuna.study.study - INFO - Trial 213 finished with value: 0.09544198611639103 and parameters: {'n_layers': 1, 'embedding_dim': 64, 'lr': 0.0007553304361421485, 'lambda_val': 0.00023754496974642215, 'batch_size': 584, 'optimizer': 'RMSprop'}. Best is trial 132 with value: 0.09765203524228237.
2026-05-18 21:54:39,705 - optuna.study._optimize - INFO - Trial 214 pruned. 
2026-05-18 21:54:54,072 - experiment_functions - INFO - Early stopping at epoch 950. Best Recall: 0.0913
2026-05-18 21:54:54,172 - optuna.study.study - INFO - Trial 215 finished with value: 0.09133252160825889 and parameters: {'n_layers': 1, 'embedding_dim': 64, 'lr': 0.000883069404626411, 'lambda_val': 0.0002222091664052571, 'batch_size': 587, 'optimizer': 'RMSprop'}. Best is trial 132 with value: 0.09765203524228237.
2026-05-18 21:55:15,865 - optuna.study._optimize - INFO - Trial 216 pruned. 
2026-05-18 21:55:26,237 - experiment_functions - INFO - Early stopping at epoch 650. Best Recall: 0.0880
2026-05-18 21:55:26,372 - optuna.study.study - INFO - Trial 217 finished with value: 0.0879529319211918 and parameters: {'n_layers': 1, 'embedding_dim': 64, 'lr': 0.0012307033875863986, 'lambda_val': 0.00017734748110190144, 'batch_size': 821, 'optimizer': 'RMSprop'}. Best is trial 132 with value: 0.09765203524228237.
2026-05-18 21:55:44,459 - experiment_functions - INFO - Early stopping at epoch 1250. Best Recall: 0.0955
2026-05-18 21:55:44,538 - optuna.study.study - INFO - Trial 218 finished with value: 0.09546151785634807 and parameters: {'n_layers': 1, 'embedding_dim': 64, 'lr': 0.0007716584989397486, 'lambda_val': 0.00023789733085811306, 'batch_size': 519, 'optimizer': 'RMSprop'}. Best is trial 132 with value: 0.09765203524228237.
2026-05-18 21:56:02,477 - experiment_functions - INFO - Early stopping at epoch 1200. Best Recall: 0.0949
2026-05-18 21:56:02,580 - optuna.study.study - INFO - Trial 219 finished with value: 0.09485796382006742 and parameters: {'n_layers': 1, 'embedding_dim': 64, 'lr': 0.000784816807050942, 'lambda_val': 0.00012506746387161132, 'batch_size': 524, 'optimizer': 'RMSprop'}. Best is trial 132 with value: 0.09765203524228237.
2026-05-18 21:56:12,505 - experiment_functions - INFO - Early stopping at epoch 600. Best Recall: 0.0696
2026-05-18 21:56:13,791 - optuna.study.study - INFO - Trial 220 finished with value: 0.06961483271470702 and parameters: {'n_layers': 2, 'embedding_dim': 64, 'lr': 0.000975359044422038, 'lambda_val': 0.0001325505019545174, 'batch_size': 515, 'optimizer': 'RMSprop'}. Best is trial 132 with value: 0.09765203524228237.
2026-05-18 21:56:40,676 - experiment_functions - INFO - Early stopping at epoch 1200. Best Recall: 0.0928
2026-05-18 21:56:40,789 - optuna.study.study - INFO - Trial 221 finished with value: 0.09275514651633823 and parameters: {'n_layers': 1, 'embedding_dim': 64, 'lr': 0.0007382747389936236, 'lambda_val': 0.00010268588727047516, 'batch_size': 579, 'optimizer': 'RMSprop'}. Best is trial 132 with value: 0.09765203524228237.
2026-05-18 21:56:57,833 - optuna.study._optimize - INFO - Trial 222 pruned. 
2026-05-18 21:57:15,468 - experiment_functions - INFO - Early stopping at epoch 1200. Best Recall: 0.0927
2026-05-18 21:57:15,567 - optuna.study.study - INFO - Trial 223 finished with value: 0.09268437616021367 and parameters: {'n_layers': 1, 'embedding_dim': 64, 'lr': 0.000746114945765517, 'lambda_val': 0.00017150933550946716, 'batch_size': 621, 'optimizer': 'RMSprop'}. Best is trial 132 with value: 0.09765203524228237.
2026-05-18 21:57:50,871 - optuna.study._optimize - INFO - Trial 224 pruned. 
2026-05-18 21:58:03,755 - experiment_functions - INFO - Early stopping at epoch 850. Best Recall: 0.0888
