2026-05-18 19:42:04,079 - optuna.study.study - INFO - Trial 25 finished with value: 0.006722433330720577 and parameters: {'n_layers': 3, 'embedding_dim': 256, 'lr': 0.0021476825967266435, 'lambda_val': 1.446620606667556e-06, 'batch_size': 3312, 'optimizer': 'RMSprop'}. Best is trial 16 with value: 0.05306898419999916.
2026-05-18 19:42:12,330 - experiment_functions - INFO - Early stopping at epoch 550. Best Recall: 0.0268
2026-05-18 19:42:12,438 - optuna.study.study - INFO - Trial 26 finished with value: 0.026770185704792226 and parameters: {'n_layers': 2, 'embedding_dim': 128, 'lr': 0.0005950416960666366, 'lambda_val': 0.0001710731690280643, 'batch_size': 3821, 'optimizer': 'RMSprop'}. Best is trial 16 with value: 0.05306898419999916.
2026-05-18 19:42:48,195 - experiment_functions - INFO - Early stopping at epoch 2750. Best Recall: 0.0594
2026-05-18 19:42:48,287 - optuna.study.study - INFO - Trial 27 finished with value: 0.05941431359795208 and parameters: {'n_layers': 1, 'embedding_dim': 128, 'lr': 0.00016081112903895234, 'lambda_val': 4.6746739238205456e-05, 'batch_size': 1068, 'optimizer': 'RMSprop'}. Best is trial 27 with value: 0.05941431359795208.
2026-05-18 19:42:55,744 - experiment_functions - INFO - Early stopping at epoch 500. Best Recall: 0.0049
2026-05-18 19:42:55,831 - optuna.study.study - INFO - Trial 28 finished with value: 0.004906826581275229 and parameters: {'n_layers': 1, 'embedding_dim': 128, 'lr': 0.0001309258731531399, 'lambda_val': 0.0007770975315090128, 'batch_size': 1167, 'optimizer': 'SGD'}. Best is trial 27 with value: 0.05941431359795208.
2026-05-18 19:43:03,204 - experiment_functions - INFO - Early stopping at epoch 500. Best Recall: 0.0047
2026-05-18 19:43:03,294 - optuna.study.study - INFO - Trial 29 finished with value: 0.004653973341779105 and parameters: {'n_layers': 1, 'embedding_dim': 96, 'lr': 3.235168371097074e-05, 'lambda_val': 0.008257659426392283, 'batch_size': 2698, 'optimizer': 'Adam'}. Best is trial 27 with value: 0.05941431359795208.
2026-05-18 19:43:10,761 - experiment_functions - INFO - Early stopping at epoch 500. Best Recall: 0.0048
2026-05-18 19:43:10,850 - optuna.study.study - INFO - Trial 30 finished with value: 0.00480500833683509 and parameters: {'n_layers': 1, 'embedding_dim': 32, 'lr': 0.00676844947569936, 'lambda_val': 3.450690191309775e-06, 'batch_size': 1200, 'optimizer': 'SGD'}. Best is trial 27 with value: 0.05941431359795208.
2026-05-18 19:43:36,043 - experiment_functions - INFO - Early stopping at epoch 1850. Best Recall: 0.0527
2026-05-18 19:43:36,145 - optuna.study.study - INFO - Trial 31 finished with value: 0.05272256271432032 and parameters: {'n_layers': 2, 'embedding_dim': 128, 'lr': 0.0001664077789360799, 'lambda_val': 4.391545275170329e-05, 'batch_size': 2662, 'optimizer': 'RMSprop'}. Best is trial 27 with value: 0.05941431359795208.
2026-05-18 19:43:56,622 - optuna.study._optimize - INFO - Trial 32 pruned. 
2026-05-18 19:44:09,480 - optuna.study._optimize - INFO - Trial 33 pruned. 
2026-05-18 19:44:19,344 - experiment_functions - INFO - Early stopping at epoch 700. Best Recall: 0.0520
2026-05-18 19:44:19,432 - optuna.study.study - INFO - Trial 34 finished with value: 0.05200619197081301 and parameters: {'n_layers': 1, 'embedding_dim': 128, 'lr': 0.00047441311990227146, 'lambda_val': 3.870767071417204e-05, 'batch_size': 2819, 'optimizer': 'RMSprop'}. Best is trial 27 with value: 0.05941431359795208.
2026-05-18 19:44:32,028 - experiment_functions - INFO - Early stopping at epoch 900. Best Recall: 0.0499
2026-05-18 19:44:32,136 - optuna.study.study - INFO - Trial 35 finished with value: 0.049887653562726106 and parameters: {'n_layers': 1, 'embedding_dim': 64, 'lr': 0.00048115267899596806, 'lambda_val': 9.761732898840841e-05, 'batch_size': 2854, 'optimizer': 'RMSprop'}. Best is trial 27 with value: 0.05941431359795208.
2026-05-18 19:44:40,887 - experiment_functions - INFO - Early stopping at epoch 600. Best Recall: 0.0527
2026-05-18 19:44:41,004 - optuna.study.study - INFO - Trial 36 finished with value: 0.052718987550717855 and parameters: {'n_layers': 1, 'embedding_dim': 128, 'lr': 0.0013209983445422668, 'lambda_val': 3.447237225587333e-05, 'batch_size': 2327, 'optimizer': 'Adam'}. Best is trial 27 with value: 0.05941431359795208.
2026-05-18 19:44:50,064 - experiment_functions - INFO - Early stopping at epoch 600. Best Recall: 0.0563
2026-05-18 19:44:50,172 - optuna.study.study - INFO - Trial 37 finished with value: 0.05633729146780756 and parameters: {'n_layers': 1, 'embedding_dim': 256, 'lr': 0.0014346606071396451, 'lambda_val': 1.2060575688976851e-05, 'batch_size': 1981, 'optimizer': 'Adam'}. Best is trial 27 with value: 0.05941431359795208.
2026-05-18 19:44:58,409 - experiment_functions - INFO - Early stopping at epoch 550. Best Recall: 0.0578
2026-05-18 19:44:58,569 - optuna.study.study - INFO - Trial 38 finished with value: 0.05783843513063368 and parameters: {'n_layers': 1, 'embedding_dim': 256, 'lr': 0.005889171251907284, 'lambda_val': 1.0941883109647037e-05, 'batch_size': 2051, 'optimizer': 'Adam'}. Best is trial 27 with value: 0.05941431359795208.
2026-05-18 19:45:07,322 - experiment_functions - INFO - Early stopping at epoch 550. Best Recall: 0.0539
2026-05-18 19:45:07,466 - optuna.study.study - INFO - Trial 39 finished with value: 0.05386320552724001 and parameters: {'n_layers': 1, 'embedding_dim': 256, 'lr': 0.005284000172988118, 'lambda_val': 7.74937132915996e-06, 'batch_size': 1942, 'optimizer': 'Adam'}. Best is trial 27 with value: 0.05941431359795208.
2026-05-18 19:45:15,826 - experiment_functions - INFO - Early stopping at epoch 550. Best Recall: 0.0529
2026-05-18 19:45:15,940 - optuna.study.study - INFO - Trial 40 finished with value: 0.05293831199634181 and parameters: {'n_layers': 1, 'embedding_dim': 256, 'lr': 0.005849315772229806, 'lambda_val': 2.260056968277317e-06, 'batch_size': 1904, 'optimizer': 'Adam'}. Best is trial 27 with value: 0.05941431359795208.
2026-05-18 19:45:24,284 - experiment_functions - INFO - Early stopping at epoch 550. Best Recall: 0.0346
2026-05-18 19:45:24,409 - optuna.study.study - INFO - Trial 41 finished with value: 0.03461154922640302 and parameters: {'n_layers': 1, 'embedding_dim': 256, 'lr': 0.014239622829514128, 'lambda_val': 7.3487205674086724e-06, 'batch_size': 1600, 'optimizer': 'Adam'}. Best is trial 27 with value: 0.05941431359795208.
2026-05-18 19:45:32,907 - experiment_functions - INFO - Early stopping at epoch 550. Best Recall: 0.0569
2026-05-18 19:45:33,032 - optuna.study.study - INFO - Trial 42 finished with value: 0.0568725627800294 and parameters: {'n_layers': 1, 'embedding_dim': 256, 'lr': 0.0026347705082378587, 'lambda_val': 1.2795710962328583e-05, 'batch_size': 2130, 'optimizer': 'Adam'}. Best is trial 27 with value: 0.05941431359795208.
2026-05-18 19:45:42,051 - experiment_functions - INFO - Early stopping at epoch 550. Best Recall: 0.0588
2026-05-18 19:45:42,176 - optuna.study.study - INFO - Trial 43 finished with value: 0.058761058278029916 and parameters: {'n_layers': 1, 'embedding_dim': 256, 'lr': 0.003017750428891241, 'lambda_val': 3.23845307272809e-06, 'batch_size': 2159, 'optimizer': 'Adam'}. Best is trial 27 with value: 0.05941431359795208.
2026-05-18 19:45:50,699 - experiment_functions - INFO - Early stopping at epoch 550. Best Recall: 0.0581
2026-05-18 19:45:50,823 - optuna.study.study - INFO - Trial 44 finished with value: 0.05806822878272276 and parameters: {'n_layers': 1, 'embedding_dim': 256, 'lr': 0.003322661299891169, 'lambda_val': 1.4524514557644894e-05, 'batch_size': 2127, 'optimizer': 'Adam'}. Best is trial 27 with value: 0.05941431359795208.
2026-05-18 19:45:59,273 - experiment_functions - INFO - Early stopping at epoch 550. Best Recall: 0.0434
2026-05-18 19:45:59,397 - optuna.study.study - INFO - Trial 45 finished with value: 0.043379172142581836 and parameters: {'n_layers': 1, 'embedding_dim': 256, 'lr': 0.011318099074808229, 'lambda_val': 2.8904887334240258e-06, 'batch_size': 2214, 'optimizer': 'Adam'}. Best is trial 27 with value: 0.05941431359795208.
2026-05-18 19:46:07,830 - experiment_functions - INFO - Early stopping at epoch 550. Best Recall: 0.0572
2026-05-18 19:46:07,955 - optuna.study.study - INFO - Trial 46 finished with value: 0.057223733279213596 and parameters: {'n_layers': 1, 'embedding_dim': 256, 'lr': 0.002687351849032078, 'lambda_val': 4.429688341372685e-06, 'batch_size': 1684, 'optimizer': 'Adam'}. Best is trial 27 with value: 0.05941431359795208.
2026-05-18 19:46:16,907 - experiment_functions - INFO - Early stopping at epoch 550. Best Recall: 0.0570
2026-05-18 19:46:17,078 - optuna.study.study - INFO - Trial 47 finished with value: 0.056987279994639435 and parameters: {'n_layers': 1, 'embedding_dim': 256, 'lr': 0.003773473958391185, 'lambda_val': 2.004245129763881e-06, 'batch_size': 1729, 'optimizer': 'Adam'}. Best is trial 27 with value: 0.05941431359795208.
2026-05-18 19:46:25,498 - experiment_functions - INFO - Early stopping at epoch 550. Best Recall: 0.0540
2026-05-18 19:46:25,622 - optuna.study.study - INFO - Trial 48 finished with value: 0.05404959228780918 and parameters: {'n_layers': 1, 'embedding_dim': 256, 'lr': 0.008579972371694123, 'lambda_val': 1.1678073318141993e-06, 'batch_size': 1283, 'optimizer': 'Adam'}. Best is trial 27 with value: 0.05941431359795208.
2026-05-18 19:46:33,798 - experiment_functions - INFO - Early stopping at epoch 500. Best Recall: 0.0076
2026-05-18 19:46:33,886 - optuna.study.study - INFO - Trial 49 finished with value: 0.007577082161436873 and parameters: {'n_layers': 4, 'embedding_dim': 256, 'lr': 0.03911513746335263, 'lambda_val': 4.814180899067456e-06, 'batch_size': 895, 'optimizer': 'Adam'}. Best is trial 27 with value: 0.05941431359795208.
2026-05-18 19:46:41,800 - experiment_functions - INFO - Early stopping at epoch 550. Best Recall: 0.0549
2026-05-18 19:46:41,889 - optuna.study.study - INFO - Trial 50 finished with value: 0.05492519958001738 and parameters: {'n_layers': 1, 'embedding_dim': 256, 'lr': 0.002237193285336155, 'lambda_val': 1.8653699463904402e-05, 'batch_size': 2494, 'optimizer': 'Adam'}. Best is trial 27 with value: 0.05941431359795208.
2026-05-18 19:46:50,179 - experiment_functions - INFO - Early stopping at epoch 550. Best Recall: 0.0581
2026-05-18 19:46:50,280 - optuna.study.study - INFO - Trial 51 finished with value: 0.05814086972442268 and parameters: {'n_layers': 1, 'embedding_dim': 256, 'lr': 0.0034135053542126313, 'lambda_val': 2.2391955384743526e-06, 'batch_size': 1773, 'optimizer': 'Adam'}. Best is trial 27 with value: 0.05941431359795208.
2026-05-18 19:46:58,099 - experiment_functions - INFO - Early stopping at epoch 550. Best Recall: 0.0567
2026-05-18 19:46:58,192 - optuna.study.study - INFO - Trial 52 finished with value: 0.056734490136870236 and parameters: {'n_layers': 1, 'embedding_dim': 256, 'lr': 0.003436394547619578, 'lambda_val': 5.1830723692854175e-06, 'batch_size': 1419, 'optimizer': 'Adam'}. Best is trial 27 with value: 0.05941431359795208.
2026-05-18 19:47:06,074 - experiment_functions - INFO - Early stopping at epoch 550. Best Recall: 0.0250
2026-05-18 19:47:06,173 - optuna.study.study - INFO - Trial 53 finished with value: 0.025038423262179293 and parameters: {'n_layers': 1, 'embedding_dim': 256, 'lr': 0.019884027891314483, 'lambda_val': 2.2367996014812367e-06, 'batch_size': 1742, 'optimizer': 'Adam'}. Best is trial 27 with value: 0.05941431359795208.
2026-05-18 19:47:14,064 - experiment_functions - INFO - Early stopping at epoch 550. Best Recall: 0.0559
2026-05-18 19:47:14,164 - optuna.study.study - INFO - Trial 54 finished with value: 0.05588102874266752 and parameters: {'n_layers': 1, 'embedding_dim': 256, 'lr': 0.004167145511561091, 'lambda_val': 1.0369198767411204e-06, 'batch_size': 2422, 'optimizer': 'Adam'}. Best is trial 27 with value: 0.05941431359795208.
2026-05-18 19:47:23,309 - experiment_functions - INFO - Early stopping at epoch 600. Best Recall: 0.0517
2026-05-18 19:47:23,397 - optuna.study.study - INFO - Trial 55 finished with value: 0.0517137003303169 and parameters: {'n_layers': 1, 'embedding_dim': 256, 'lr': 0.0018565596527504722, 'lambda_val': 3.4035666578011767e-06, 'batch_size': 2215, 'optimizer': 'Adam'}. Best is trial 27 with value: 0.05941431359795208.
2026-05-18 19:47:30,851 - experiment_functions - INFO - Early stopping at epoch 550. Best Recall: 0.0422
2026-05-18 19:47:30,941 - optuna.study.study - INFO - Trial 56 finished with value: 0.042197343819437017 and parameters: {'n_layers': 1, 'embedding_dim': 96, 'lr': 0.009527639692031561, 'lambda_val': 2.232991380452989e-05, 'batch_size': 895, 'optimizer': 'Adam'}. Best is trial 27 with value: 0.05941431359795208.
2026-05-18 19:47:38,828 - experiment_functions - INFO - Early stopping at epoch 550. Best Recall: 0.0541
2026-05-18 19:47:38,925 - optuna.study.study - INFO - Trial 57 finished with value: 0.05410884689078573 and parameters: {'n_layers': 1, 'embedding_dim': 256, 'lr': 0.002942715363539895, 'lambda_val': 6.170999746047705e-06, 'batch_size': 1836, 'optimizer': 'Adam'}. Best is trial 27 with value: 0.05941431359795208.
2026-05-18 19:47:45,789 - experiment_functions - INFO - Early stopping at epoch 500. Best Recall: 0.0051
2026-05-18 19:47:45,886 - optuna.study.study - INFO - Trial 58 finished with value: 0.005125748800975056 and parameters: {'n_layers': 1, 'embedding_dim': 32, 'lr': 0.0009084193780861651, 'lambda_val': 1.9399316274562284e-06, 'batch_size': 1613, 'optimizer': 'SGD'}. Best is trial 27 with value: 0.05941431359795208.
2026-05-18 19:47:54,210 - experiment_functions - INFO - Early stopping at epoch 550. Best Recall: 0.0162
2026-05-18 19:47:54,319 - optuna.study.study - INFO - Trial 59 finished with value: 0.0161542137758027 and parameters: {'n_layers': 1, 'embedding_dim': 256, 'lr': 0.027210205019669153, 'lambda_val': 3.884136880196778e-06, 'batch_size': 2023, 'optimizer': 'Adam'}. Best is trial 27 with value: 0.05941431359795208.
2026-05-18 19:48:03,232 - experiment_functions - INFO - Early stopping at epoch 600. Best Recall: 0.0569
2026-05-18 19:48:03,350 - optuna.study.study - INFO - Trial 60 finished with value: 0.05689962347429144 and parameters: {'n_layers': 1, 'embedding_dim': 256, 'lr': 0.0018479121704366398, 'lambda_val': 1.436554246291945e-05, 'batch_size': 1013, 'optimizer': 'Adam'}. Best is trial 27 with value: 0.05941431359795208.
2026-05-18 19:48:11,368 - experiment_functions - INFO - Early stopping at epoch 550. Best Recall: 0.0585
2026-05-18 19:48:11,446 - optuna.study.study - INFO - Trial 61 finished with value: 0.0585342930763913 and parameters: {'n_layers': 1, 'embedding_dim': 256, 'lr': 0.0034170982510880574, 'lambda_val': 2.352227254010993e-06, 'batch_size': 1737, 'optimizer': 'Adam'}. Best is trial 27 with value: 0.05941431359795208.
2026-05-18 19:48:19,007 - experiment_functions - INFO - Early stopping at epoch 550. Best Recall: 0.0570
2026-05-18 19:48:19,139 - optuna.study.study - INFO - Trial 62 finished with value: 0.05700697604003953 and parameters: {'n_layers': 1, 'embedding_dim': 256, 'lr': 0.004205104992811205, 'lambda_val': 1.4424667626066184e-06, 'batch_size': 1485, 'optimizer': 'Adam'}. Best is trial 27 with value: 0.05941431359795208.
2026-05-18 19:48:27,383 - experiment_functions - INFO - Early stopping at epoch 550. Best Recall: 0.0530
2026-05-18 19:48:27,484 - optuna.study.study - INFO - Trial 63 finished with value: 0.05296638847525739 and parameters: {'n_layers': 1, 'embedding_dim': 256, 'lr': 0.006827580766024642, 'lambda_val': 4.848049006731596e-06, 'batch_size': 2123, 'optimizer': 'Adam'}. Best is trial 27 with value: 0.05941431359795208.
2026-05-18 19:48:35,476 - experiment_functions - INFO - Early stopping at epoch 550. Best Recall: 0.0571
2026-05-18 19:48:35,619 - optuna.study.study - INFO - Trial 64 finished with value: 0.057091530589459094 and parameters: {'n_layers': 1, 'embedding_dim': 256, 'lr': 0.004665409080598881, 'lambda_val': 9.307967510366493e-06, 'batch_size': 1821, 'optimizer': 'Adam'}. Best is trial 27 with value: 0.05941431359795208.
2026-05-18 19:48:44,604 - experiment_functions - INFO - Early stopping at epoch 650. Best Recall: 0.0545
2026-05-18 19:48:44,692 - optuna.study.study - INFO - Trial 65 finished with value: 0.054498420229964234 and parameters: {'n_layers': 1, 'embedding_dim': 64, 'lr': 0.0011783033084751782, 'lambda_val': 2.8336148711007636e-06, 'batch_size': 2245, 'optimizer': 'Adam'}. Best is trial 27 with value: 0.05941431359795208.
2026-05-18 19:48:51,785 - experiment_functions - INFO - Early stopping at epoch 500. Best Recall: 0.0052
2026-05-18 19:48:51,910 - optuna.study.study - INFO - Trial 66 finished with value: 0.005205640277614766 and parameters: {'n_layers': 1, 'embedding_dim': 96, 'lr': 0.0027928202796100683, 'lambda_val': 1.7005286435010415e-06, 'batch_size': 2062, 'optimizer': 'SGD'}. Best is trial 27 with value: 0.05941431359795208.
2026-05-18 19:49:00,355 - experiment_functions - INFO - Early stopping at epoch 550. Best Recall: 0.0519
2026-05-18 19:49:00,446 - optuna.study.study - INFO - Trial 67 finished with value: 0.05189218900281321 and parameters: {'n_layers': 1, 'embedding_dim': 256, 'lr': 0.007234600630047038, 'lambda_val': 2.59441294154343e-05, 'batch_size': 603, 'optimizer': 'Adam'}. Best is trial 27 with value: 0.05941431359795208.
2026-05-18 19:49:07,230 - experiment_functions - INFO - Early stopping at epoch 500. Best Recall: 0.0057
2026-05-18 19:49:07,325 - optuna.study.study - INFO - Trial 68 finished with value: 0.005678171100905604 and parameters: {'n_layers': 1, 'embedding_dim': 32, 'lr': 0.013238456998544172, 'lambda_val': 0.04796742305143864, 'batch_size': 1336, 'optimizer': 'Adam'}. Best is trial 27 with value: 0.05941431359795208.
2026-05-18 19:49:15,660 - experiment_functions - INFO - Early stopping at epoch 550. Best Recall: 0.0464
2026-05-18 19:49:15,754 - optuna.study.study - INFO - Trial 69 finished with value: 0.04640229078215991 and parameters: {'n_layers': 2, 'embedding_dim': 256, 'lr': 0.001619434135325288, 'lambda_val': 6.369889791843316e-06, 'batch_size': 1689, 'optimizer': 'Adam'}. Best is trial 27 with value: 0.05941431359795208.
2026-05-18 19:49:25,594 - experiment_functions - INFO - Early stopping at epoch 700. Best Recall: 0.0570
2026-05-18 19:49:25,708 - optuna.study.study - INFO - Trial 70 finished with value: 0.057014220770380354 and parameters: {'n_layers': 1, 'embedding_dim': 256, 'lr': 0.000693956234119165, 'lambda_val': 0.00029386542600018595, 'batch_size': 1555, 'optimizer': 'Adam'}. Best is trial 27 with value: 0.05941431359795208.
2026-05-18 19:49:33,996 - experiment_functions - INFO - Early stopping at epoch 550. Best Recall: 0.0574
2026-05-18 19:49:34,099 - optuna.study.study - INFO - Trial 71 finished with value: 0.05735394323718836 and parameters: {'n_layers': 1, 'embedding_dim': 256, 'lr': 0.005035237881304908, 'lambda_val': 9.574150149910153e-06, 'batch_size': 1817, 'optimizer': 'Adam'}. Best is trial 27 with value: 0.05941431359795208.
2026-05-18 19:49:42,297 - experiment_functions - INFO - Early stopping at epoch 550. Best Recall: 0.0573
2026-05-18 19:49:42,411 - optuna.study.study - INFO - Trial 72 finished with value: 0.05726017260192956 and parameters: {'n_layers': 1, 'embedding_dim': 256, 'lr': 0.00311765510630671, 'lambda_val': 4.1924482261087685e-06, 'batch_size': 1874, 'optimizer': 'Adam'}. Best is trial 27 with value: 0.05941431359795208.
2026-05-18 19:49:50,668 - experiment_functions - INFO - Early stopping at epoch 550. Best Recall: 0.0569
2026-05-18 19:49:50,773 - optuna.study.study - INFO - Trial 73 finished with value: 0.056949432248620355 and parameters: {'n_layers': 1, 'embedding_dim': 256, 'lr': 0.004771504317751982, 'lambda_val': 1.0273651675714935e-05, 'batch_size': 1832, 'optimizer': 'Adam'}. Best is trial 27 with value: 0.05941431359795208.
2026-05-18 19:50:05,702 - optuna.study._optimize - INFO - Trial 74 pruned. 
2026-05-18 19:50:13,218 - experiment_functions - INFO - Early stopping at epoch 500. Best Recall: 0.0046
2026-05-18 19:50:13,310 - optuna.study.study - INFO - Trial 75 finished with value: 0.004565326931654156 and parameters: {'n_layers': 1, 'embedding_dim': 256, 'lr': 0.0033159131289508333, 'lambda_val': 3.1628576924437467e-06, 'batch_size': 2124, 'optimizer': 'SGD'}. Best is trial 27 with value: 0.05941431359795208.
2026-05-18 19:50:20,498 - experiment_functions - INFO - Early stopping at epoch 550. Best Recall: 0.0440
2026-05-18 19:50:20,589 - optuna.study.study - INFO - Trial 76 finished with value: 0.0440068725203146 and parameters: {'n_layers': 1, 'embedding_dim': 64, 'lr': 0.0087579104722172, 'lambda_val': 1.5093335328575928e-05, 'batch_size': 2400, 'optimizer': 'Adam'}. Best is trial 27 with value: 0.05941431359795208.
2026-05-18 19:50:29,251 - experiment_functions - INFO - Early stopping at epoch 600. Best Recall: 0.0561
2026-05-18 19:50:29,343 - optuna.study.study - INFO - Trial 77 finished with value: 0.056134038240760846 and parameters: {'n_layers': 1, 'embedding_dim': 256, 'lr': 0.001040958532934986, 'lambda_val': 3.176708632278007e-05, 'batch_size': 2000, 'optimizer': 'Adam'}. Best is trial 27 with value: 0.05941431359795208.
2026-05-18 19:50:36,908 - experiment_functions - INFO - Early stopping at epoch 550. Best Recall: 0.0086
2026-05-18 19:50:37,001 - optuna.study.study - INFO - Trial 78 finished with value: 0.008618570989544418 and parameters: {'n_layers': 2, 'embedding_dim': 96, 'lr': 0.006321661337331055, 'lambda_val': 7.594088611654471e-06, 'batch_size': 2278, 'optimizer': 'Adam'}. Best is trial 27 with value: 0.05941431359795208.
2026-05-18 19:50:45,678 - experiment_functions - INFO - Early stopping at epoch 550. Best Recall: 0.0533
