2026-05-18 09:11:35,579 - optuna.study.study - INFO - Trial 51 finished with value: 0.046538553156601443 and parameters: {'n_layers': 1, 'embedding_dim': 32, 'lr': 0.00036896439540072236, 'lambda_val': 2.4487353548237256e-06, 'batch_size': 873, 'optimizer': 'Adam'}. Best is trial 46 with value: 0.04748435995661139.
2026-05-18 09:11:49,994 - experiment_functions - INFO - Early stopping at epoch 1050. Best Recall: 0.0466
2026-05-18 09:11:50,094 - optuna.study.study - INFO - Trial 52 finished with value: 0.04662474524609034 and parameters: {'n_layers': 1, 'embedding_dim': 32, 'lr': 0.0010318615467437538, 'lambda_val': 2.4989503600365847e-06, 'batch_size': 513, 'optimizer': 'Adam'}. Best is trial 46 with value: 0.04748435995661139.
2026-05-18 09:12:02,771 - experiment_functions - INFO - Early stopping at epoch 900. Best Recall: 0.0464
2026-05-18 09:12:02,870 - optuna.study.study - INFO - Trial 53 finished with value: 0.046377314674448715 and parameters: {'n_layers': 1, 'embedding_dim': 32, 'lr': 0.0011683559993969075, 'lambda_val': 2.027236628829624e-06, 'batch_size': 642, 'optimizer': 'Adam'}. Best is trial 46 with value: 0.04748435995661139.
2026-05-18 09:12:14,785 - experiment_functions - INFO - Early stopping at epoch 800. Best Recall: 0.0459
2026-05-18 09:12:14,885 - optuna.study.study - INFO - Trial 54 finished with value: 0.04591178719544069 and parameters: {'n_layers': 1, 'embedding_dim': 32, 'lr': 0.0011783221442139813, 'lambda_val': 3.954970908536823e-06, 'batch_size': 646, 'optimizer': 'Adam'}. Best is trial 46 with value: 0.04748435995661139.
2026-05-18 09:12:25,734 - experiment_functions - INFO - Early stopping at epoch 750. Best Recall: 0.0464
2026-05-18 09:12:25,869 - optuna.study.study - INFO - Trial 55 finished with value: 0.04640733636905672 and parameters: {'n_layers': 1, 'embedding_dim': 32, 'lr': 0.0017648157112183183, 'lambda_val': 1.7670631935778276e-06, 'batch_size': 536, 'optimizer': 'Adam'}. Best is trial 46 with value: 0.04748435995661139.
2026-05-18 09:12:34,548 - experiment_functions - INFO - Early stopping at epoch 600. Best Recall: 0.0447
2026-05-18 09:12:34,659 - optuna.study.study - INFO - Trial 56 finished with value: 0.04472472962043161 and parameters: {'n_layers': 1, 'embedding_dim': 32, 'lr': 0.005053010793541475, 'lambda_val': 1.0559740813868981e-05, 'batch_size': 558, 'optimizer': 'Adam'}. Best is trial 46 with value: 0.04748435995661139.
2026-05-18 09:12:43,557 - experiment_functions - INFO - Early stopping at epoch 600. Best Recall: 0.0417
2026-05-18 09:12:43,657 - optuna.study.study - INFO - Trial 57 finished with value: 0.041669469224107046 and parameters: {'n_layers': 1, 'embedding_dim': 32, 'lr': 0.0023188401652216068, 'lambda_val': 6.510675092251111e-06, 'batch_size': 1243, 'optimizer': 'Adam'}. Best is trial 46 with value: 0.04748435995661139.
2026-05-18 09:13:02,155 - experiment_functions - INFO - Early stopping at epoch 1300. Best Recall: 0.0467
2026-05-18 09:13:02,262 - optuna.study.study - INFO - Trial 58 finished with value: 0.04665961146311814 and parameters: {'n_layers': 1, 'embedding_dim': 32, 'lr': 0.000733161339262263, 'lambda_val': 1.6062862689935054e-06, 'batch_size': 515, 'optimizer': 'Adam'}. Best is trial 46 with value: 0.04748435995661139.
2026-05-18 09:13:13,620 - experiment_functions - INFO - Early stopping at epoch 750. Best Recall: 0.0419
2026-05-18 09:13:13,710 - optuna.study.study - INFO - Trial 59 finished with value: 0.04193778578620117 and parameters: {'n_layers': 1, 'embedding_dim': 128, 'lr': 0.0006030181793314933, 'lambda_val': 3.3982016005098594e-06, 'batch_size': 2719, 'optimizer': 'Adam'}. Best is trial 46 with value: 0.04748435995661139.
2026-05-18 09:13:20,981 - experiment_functions - INFO - Early stopping at epoch 500. Best Recall: 0.0055
2026-05-18 09:13:21,083 - optuna.study.study - INFO - Trial 60 finished with value: 0.0055454626255252186 and parameters: {'n_layers': 2, 'embedding_dim': 32, 'lr': 0.0007521686115312908, 'lambda_val': 0.003978188569093047, 'batch_size': 802, 'optimizer': 'SGD'}. Best is trial 46 with value: 0.04748435995661139.
2026-05-18 09:13:33,155 - experiment_functions - INFO - Early stopping at epoch 850. Best Recall: 0.0462
2026-05-18 09:13:33,254 - optuna.study.study - INFO - Trial 61 finished with value: 0.04620176817739055 and parameters: {'n_layers': 1, 'embedding_dim': 32, 'lr': 0.0014493975762998191, 'lambda_val': 1.5324944498175128e-06, 'batch_size': 536, 'optimizer': 'Adam'}. Best is trial 46 with value: 0.04748435995661139.
2026-05-18 09:13:47,781 - experiment_functions - INFO - Early stopping at epoch 1050. Best Recall: 0.0460
2026-05-18 09:13:47,879 - optuna.study.study - INFO - Trial 62 finished with value: 0.04597083677900159 and parameters: {'n_layers': 1, 'embedding_dim': 32, 'lr': 0.001016966442232123, 'lambda_val': 2.566302702730631e-06, 'batch_size': 646, 'optimizer': 'Adam'}. Best is trial 46 with value: 0.04748435995661139.
2026-05-18 09:14:36,509 - experiment_functions - INFO - Early stopping at epoch 3650. Best Recall: 0.0471
2026-05-18 09:14:36,598 - optuna.study.study - INFO - Trial 63 finished with value: 0.04713592654860243 and parameters: {'n_layers': 1, 'embedding_dim': 32, 'lr': 0.00044615213011627914, 'lambda_val': 1.569665309374662e-06, 'batch_size': 685, 'optimizer': 'Adam'}. Best is trial 46 with value: 0.04748435995661139.
2026-05-18 09:15:12,660 - experiment_functions - INFO - Early stopping at epoch 2700. Best Recall: 0.0462
2026-05-18 09:15:12,826 - optuna.study.study - INFO - Trial 64 finished with value: 0.04624877874498335 and parameters: {'n_layers': 1, 'embedding_dim': 32, 'lr': 0.0004443334812244503, 'lambda_val': 1.0321818476371815e-06, 'batch_size': 1139, 'optimizer': 'Adam'}. Best is trial 46 with value: 0.04748435995661139.
2026-05-18 09:15:27,222 - optuna.study._optimize - INFO - Trial 65 pruned. 
2026-05-18 09:16:14,195 - experiment_functions - INFO - Early stopping at epoch 3600. Best Recall: 0.0467
2026-05-18 09:16:14,292 - optuna.study.study - INFO - Trial 66 finished with value: 0.046692513253341325 and parameters: {'n_layers': 1, 'embedding_dim': 32, 'lr': 0.00035583899397316265, 'lambda_val': 1.485826773315467e-06, 'batch_size': 671, 'optimizer': 'Adam'}. Best is trial 46 with value: 0.04748435995661139.
2026-05-18 09:16:28,908 - optuna.study._optimize - INFO - Trial 67 pruned. 
2026-05-18 09:16:42,834 - optuna.study._optimize - INFO - Trial 68 pruned. 
2026-05-18 09:16:56,458 - optuna.study._optimize - INFO - Trial 69 pruned. 
2026-05-18 09:17:11,770 - optuna.study._optimize - INFO - Trial 70 pruned. 
2026-05-18 09:17:34,341 - optuna.study._optimize - INFO - Trial 71 pruned. 
2026-05-18 09:18:02,015 - experiment_functions - INFO - Early stopping at epoch 2050. Best Recall: 0.0467
2026-05-18 09:18:02,114 - optuna.study.study - INFO - Trial 72 finished with value: 0.0467459657830671 and parameters: {'n_layers': 1, 'embedding_dim': 32, 'lr': 0.0004911600659839327, 'lambda_val': 1.613753255347181e-06, 'batch_size': 735, 'optimizer': 'Adam'}. Best is trial 46 with value: 0.04748435995661139.
2026-05-18 09:18:15,947 - optuna.study._optimize - INFO - Trial 73 pruned. 
2026-05-18 09:18:54,576 - experiment_functions - INFO - Early stopping at epoch 2100. Best Recall: 0.0463
2026-05-18 09:18:54,719 - optuna.study.study - INFO - Trial 74 finished with value: 0.046280655455762584 and parameters: {'n_layers': 1, 'embedding_dim': 32, 'lr': 0.0006752228885826283, 'lambda_val': 1.4152145156653834e-06, 'batch_size': 732, 'optimizer': 'Adam'}. Best is trial 46 with value: 0.04748435995661139.
2026-05-18 09:19:01,998 - experiment_functions - INFO - Early stopping at epoch 500. Best Recall: 0.0056
2026-05-18 09:19:02,098 - optuna.study.study - INFO - Trial 75 finished with value: 0.005597834124268628 and parameters: {'n_layers': 1, 'embedding_dim': 32, 'lr': 0.00019899451713944634, 'lambda_val': 0.0895626307912817, 'batch_size': 1159, 'optimizer': 'Adam'}. Best is trial 46 with value: 0.04748435995661139.
2026-05-18 09:19:13,855 - experiment_functions - INFO - Early stopping at epoch 800. Best Recall: 0.0450
2026-05-18 09:19:14,007 - optuna.study.study - INFO - Trial 76 finished with value: 0.04502663133383694 and parameters: {'n_layers': 1, 'embedding_dim': 64, 'lr': 0.0009175185207038448, 'lambda_val': 3.1409170994159725e-06, 'batch_size': 829, 'optimizer': 'Adam'}. Best is trial 46 with value: 0.04748435995661139.
2026-05-18 09:19:28,700 - optuna.study._optimize - INFO - Trial 77 pruned. 
2026-05-18 09:19:35,873 - experiment_functions - INFO - Early stopping at epoch 500. Best Recall: 0.0051
2026-05-18 09:19:35,963 - optuna.study.study - INFO - Trial 78 finished with value: 0.005100416509313928 and parameters: {'n_layers': 1, 'embedding_dim': 32, 'lr': 0.00017925014277454305, 'lambda_val': 2.172827153906647e-05, 'batch_size': 648, 'optimizer': 'SGD'}. Best is trial 46 with value: 0.04748435995661139.
2026-05-18 09:19:46,103 - experiment_functions - INFO - Early stopping at epoch 700. Best Recall: 0.0440
2026-05-18 09:19:46,202 - optuna.study.study - INFO - Trial 79 finished with value: 0.04404297137427023 and parameters: {'n_layers': 1, 'embedding_dim': 32, 'lr': 0.0015829578888066247, 'lambda_val': 1.4341119956578659e-06, 'batch_size': 1051, 'optimizer': 'Adam'}. Best is trial 46 with value: 0.04748435995661139.
2026-05-18 09:20:00,615 - optuna.study._optimize - INFO - Trial 80 pruned. 
2026-05-18 09:20:14,385 - optuna.study._optimize - INFO - Trial 81 pruned. 
2026-05-18 09:20:30,276 - experiment_functions - INFO - Early stopping at epoch 1150. Best Recall: 0.0466
2026-05-18 09:20:30,376 - optuna.study.study - INFO - Trial 82 finished with value: 0.04660147535359409 and parameters: {'n_layers': 1, 'embedding_dim': 32, 'lr': 0.0007270276528736808, 'lambda_val': 2.3198014618615557e-06, 'batch_size': 752, 'optimizer': 'Adam'}. Best is trial 46 with value: 0.04748435995661139.
2026-05-18 09:20:50,317 - experiment_functions - INFO - Early stopping at epoch 1450. Best Recall: 0.0464
2026-05-18 09:20:50,407 - optuna.study.study - INFO - Trial 83 finished with value: 0.04640566507930877 and parameters: {'n_layers': 1, 'embedding_dim': 32, 'lr': 0.0007597538581069723, 'lambda_val': 3.137520346763876e-06, 'batch_size': 752, 'optimizer': 'Adam'}. Best is trial 46 with value: 0.04748435995661139.
2026-05-18 09:20:59,964 - experiment_functions - INFO - Early stopping at epoch 650. Best Recall: 0.0454
2026-05-18 09:21:00,064 - optuna.study.study - INFO - Trial 84 finished with value: 0.04538424350728722 and parameters: {'n_layers': 1, 'embedding_dim': 32, 'lr': 0.002578439251789915, 'lambda_val': 7.305470949841654e-06, 'batch_size': 722, 'optimizer': 'Adam'}. Best is trial 46 with value: 0.04748435995661139.
2026-05-18 09:21:10,192 - experiment_functions - INFO - Early stopping at epoch 700. Best Recall: 0.0432
2026-05-18 09:21:10,288 - optuna.study.study - INFO - Trial 85 finished with value: 0.043203685189269356 and parameters: {'n_layers': 1, 'embedding_dim': 32, 'lr': 0.0013742779837073158, 'lambda_val': 2.0896684348218254e-06, 'batch_size': 855, 'optimizer': 'Adam'}. Best is trial 46 with value: 0.04748435995661139.
2026-05-18 09:21:25,130 - optuna.study._optimize - INFO - Trial 86 pruned. 
2026-05-18 09:21:34,780 - experiment_functions - INFO - Early stopping at epoch 700. Best Recall: 0.0414
2026-05-18 09:21:34,881 - optuna.study.study - INFO - Trial 87 finished with value: 0.0414184854630277 and parameters: {'n_layers': 1, 'embedding_dim': 32, 'lr': 0.0010919315221271037, 'lambda_val': 5.322239512206364e-06, 'batch_size': 2127, 'optimizer': 'Adam'}. Best is trial 46 with value: 0.04748435995661139.
2026-05-18 09:21:48,982 - optuna.study._optimize - INFO - Trial 88 pruned. 
2026-05-18 09:22:01,959 - experiment_functions - INFO - Early stopping at epoch 900. Best Recall: 0.0452
2026-05-18 09:22:02,037 - optuna.study.study - INFO - Trial 89 finished with value: 0.04516308366730536 and parameters: {'n_layers': 1, 'embedding_dim': 64, 'lr': 0.0007842197247024102, 'lambda_val': 0.0010026487824593958, 'batch_size': 599, 'optimizer': 'Adam'}. Best is trial 46 with value: 0.04748435995661139.
2026-05-18 09:22:15,579 - optuna.study._optimize - INFO - Trial 90 pruned. 
2026-05-18 09:22:29,471 - optuna.study._optimize - INFO - Trial 91 pruned. 
2026-05-18 09:22:57,787 - experiment_functions - INFO - Early stopping at epoch 2100. Best Recall: 0.0470
2026-05-18 09:22:57,898 - optuna.study.study - INFO - Trial 92 finished with value: 0.046990843562756374 and parameters: {'n_layers': 1, 'embedding_dim': 32, 'lr': 0.0004596758359589848, 'lambda_val': 1.8526184233199655e-06, 'batch_size': 535, 'optimizer': 'Adam'}. Best is trial 46 with value: 0.04748435995661139.
2026-05-18 09:23:11,985 - optuna.study._optimize - INFO - Trial 93 pruned. 
2026-05-18 09:23:37,719 - experiment_functions - INFO - Early stopping at epoch 1850. Best Recall: 0.0462
2026-05-18 09:23:37,808 - optuna.study.study - INFO - Trial 94 finished with value: 0.04615585128893172 and parameters: {'n_layers': 1, 'embedding_dim': 32, 'lr': 0.0004728529927622415, 'lambda_val': 1.7804095195542777e-06, 'batch_size': 783, 'optimizer': 'Adam'}. Best is trial 46 with value: 0.04748435995661139.
2026-05-18 09:23:50,476 - experiment_functions - INFO - Early stopping at epoch 900. Best Recall: 0.0360
2026-05-18 09:23:50,566 - optuna.study.study - INFO - Trial 95 finished with value: 0.03598665745683322 and parameters: {'n_layers': 1, 'embedding_dim': 32, 'lr': 0.0006680515479672687, 'lambda_val': 1.0351502049398687e-06, 'batch_size': 2491, 'optimizer': 'Adam'}. Best is trial 46 with value: 0.04748435995661139.
2026-05-18 09:23:58,579 - experiment_functions - INFO - Early stopping at epoch 500. Best Recall: 0.0053
2026-05-18 09:23:58,678 - optuna.study.study - INFO - Trial 96 finished with value: 0.005271577086656086 and parameters: {'n_layers': 1, 'embedding_dim': 32, 'lr': 0.0009316896849350554, 'lambda_val': 3.3259231244292397e-06, 'batch_size': 3174, 'optimizer': 'SGD'}. Best is trial 46 with value: 0.04748435995661139.
2026-05-18 09:24:12,643 - optuna.study._optimize - INFO - Trial 97 pruned. 
2026-05-18 09:24:26,180 - optuna.study._optimize - INFO - Trial 98 pruned. 
2026-05-18 09:24:39,291 - optuna.study._optimize - INFO - Trial 99 pruned. 
2026-05-18 09:24:53,628 - optuna.study._optimize - INFO - Trial 100 pruned. 
2026-05-18 09:25:07,233 - optuna.study._optimize - INFO - Trial 101 pruned. 
2026-05-18 09:25:45,930 - experiment_functions - INFO - Early stopping at epoch 2900. Best Recall: 0.0470
2026-05-18 09:25:46,022 - optuna.study.study - INFO - Trial 102 finished with value: 0.04700085410251201 and parameters: {'n_layers': 1, 'embedding_dim': 32, 'lr': 0.00035609128062868967, 'lambda_val': 2.238800118773462e-06, 'batch_size': 523, 'optimizer': 'Adam'}. Best is trial 46 with value: 0.04748435995661139.
2026-05-18 09:26:28,333 - experiment_functions - INFO - Early stopping at epoch 3200. Best Recall: 0.0469
2026-05-18 09:26:28,433 - optuna.study.study - INFO - Trial 103 finished with value: 0.046940165237061626 and parameters: {'n_layers': 1, 'embedding_dim': 32, 'lr': 0.0004011713335872036, 'lambda_val': 1.216152260182366e-06, 'batch_size': 693, 'optimizer': 'Adam'}. Best is trial 46 with value: 0.04748435995661139.
2026-05-18 09:26:42,454 - optuna.study._optimize - INFO - Trial 104 pruned. 
2026-05-18 09:26:54,189 - experiment_functions - INFO - Early stopping at epoch 800. Best Recall: 0.0467
2026-05-18 09:26:54,279 - optuna.study.study - INFO - Trial 105 finished with value: 0.046690461330771725 and parameters: {'n_layers': 1, 'embedding_dim': 32, 'lr': 0.0020615648673540767, 'lambda_val': 1.7442181708467933e-06, 'batch_size': 516, 'optimizer': 'Adam'}. Best is trial 46 with value: 0.04748435995661139.
2026-05-18 09:27:06,923 - experiment_functions - INFO - Early stopping at epoch 900. Best Recall: 0.0466
2026-05-18 09:27:07,068 - optuna.study.study - INFO - Trial 106 finished with value: 0.04660874239441393 and parameters: {'n_layers': 1, 'embedding_dim': 32, 'lr': 0.0012709986904705097, 'lambda_val': 1.415588255038256e-06, 'batch_size': 531, 'optimizer': 'Adam'}. Best is trial 46 with value: 0.04748435995661139.
2026-05-18 09:27:15,333 - experiment_functions - INFO - Early stopping at epoch 550. Best Recall: 0.0437
2026-05-18 09:27:15,445 - optuna.study.study - INFO - Trial 107 finished with value: 0.043674074548480116 and parameters: {'n_layers': 1, 'embedding_dim': 128, 'lr': 0.003905065917489258, 'lambda_val': 1.0250683874759e-06, 'batch_size': 573, 'optimizer': 'Adam'}. Best is trial 46 with value: 0.04748435995661139.
2026-05-18 09:27:24,231 - experiment_functions - INFO - Early stopping at epoch 600. Best Recall: 0.0248
2026-05-18 09:27:24,332 - optuna.study.study - INFO - Trial 108 finished with value: 0.024785102021892817 and parameters: {'n_layers': 3, 'embedding_dim': 32, 'lr': 0.0017429733499517567, 'lambda_val': 1.8108795966414254e-06, 'batch_size': 687, 'optimizer': 'Adam'}. Best is trial 46 with value: 0.04748435995661139.
2026-05-18 09:27:34,309 - experiment_functions - INFO - Early stopping at epoch 650. Best Recall: 0.0456
2026-05-18 09:27:34,411 - optuna.study.study - INFO - Trial 109 finished with value: 0.04558304707162444 and parameters: {'n_layers': 1, 'embedding_dim': 32, 'lr': 0.002113373785141758, 'lambda_val': 3.735607169160657e-06, 'batch_size': 822, 'optimizer': 'Adam'}. Best is trial 46 with value: 0.04748435995661139.
2026-05-18 09:27:43,146 - experiment_functions - INFO - Early stopping at epoch 600. Best Recall: 0.0456
2026-05-18 09:27:43,236 - optuna.study.study - INFO - Trial 110 finished with value: 0.04556338487302737 and parameters: {'n_layers': 1, 'embedding_dim': 32, 'lr': 0.0031631009191839306, 'lambda_val': 5.944851999234097e-06, 'batch_size': 596, 'optimizer': 'Adam'}. Best is trial 46 with value: 0.04748435995661139.
2026-05-18 09:27:58,083 - experiment_functions - INFO - Early stopping at epoch 950. Best Recall: 0.0460
2026-05-18 09:27:58,183 - optuna.study.study - INFO - Trial 111 finished with value: 0.04598446857945114 and parameters: {'n_layers': 1, 'embedding_dim': 32, 'lr': 0.00133126148196248, 'lambda_val': 1.470305542078336e-06, 'batch_size': 516, 'optimizer': 'Adam'}. Best is trial 46 with value: 0.04748435995661139.
2026-05-18 09:28:14,941 - experiment_functions - INFO - Early stopping at epoch 1200. Best Recall: 0.0459
2026-05-18 09:28:15,040 - optuna.study.study - INFO - Trial 112 finished with value: 0.04589862052071104 and parameters: {'n_layers': 1, 'embedding_dim': 32, 'lr': 0.0009794939606350673, 'lambda_val': 1.2533790513502145e-06, 'batch_size': 514, 'optimizer': 'Adam'}. Best is trial 46 with value: 0.04748435995661139.
2026-05-18 09:28:57,473 - experiment_functions - INFO - Early stopping at epoch 2850. Best Recall: 0.0473
2026-05-18 09:28:57,571 - optuna.study.study - INFO - Trial 113 finished with value: 0.04728832502178935 and parameters: {'n_layers': 1, 'embedding_dim': 32, 'lr': 0.00041593685884683403, 'lambda_val': 1.6297855535216474e-06, 'batch_size': 669, 'optimizer': 'Adam'}. Best is trial 46 with value: 0.04748435995661139.
2026-05-18 09:29:05,600 - experiment_functions - INFO - Early stopping at epoch 550. Best Recall: 0.0427
2026-05-18 09:29:05,700 - optuna.study.study - INFO - Trial 114 finished with value: 0.04269554798829019 and parameters: {'n_layers': 1, 'embedding_dim': 32, 'lr': 0.008357899026547546, 'lambda_val': 1.9030932438382075e-06, 'batch_size': 684, 'optimizer': 'Adam'}. Best is trial 46 with value: 0.04748435995661139.
2026-05-18 09:30:01,704 - optuna.study.study - INFO - Trial 115 finished with value: 0.04679000298330374 and parameters: {'n_layers': 1, 'embedding_dim': 32, 'lr': 0.00037894694763762306, 'lambda_val': 3.0970976135549117e-06, 'batch_size': 758, 'optimizer': 'Adam'}. Best is trial 46 with value: 0.04748435995661139.
2026-05-18 09:30:17,590 - optuna.study._optimize - INFO - Trial 116 pruned. 
2026-05-18 09:30:24,962 - experiment_functions - INFO - Early stopping at epoch 500. Best Recall: 0.0049
2026-05-18 09:30:26,334 - optuna.study.study - INFO - Trial 117 finished with value: 0.004897264423229394 and parameters: {'n_layers': 1, 'embedding_dim': 32, 'lr': 0.00033363295700234645, 'lambda_val': 3.3489066489682745e-06, 'batch_size': 905, 'optimizer': 'SGD'}. Best is trial 46 with value: 0.04748435995661139.
2026-05-18 09:30:40,454 - optuna.study._optimize - INFO - Trial 118 pruned. 
2026-05-18 09:30:54,538 - optuna.study._optimize - INFO - Trial 119 pruned. 
2026-05-18 09:31:08,671 - optuna.study._optimize - INFO - Trial 120 pruned. 
2026-05-18 09:31:24,715 - optuna.study._optimize - INFO - Trial 121 pruned. 
2026-05-18 09:31:48,567 - experiment_functions - INFO - Early stopping at epoch 1600. Best Recall: 0.0471
2026-05-18 09:31:48,686 - optuna.study.study - INFO - Trial 122 finished with value: 0.047102136769534474 and parameters: {'n_layers': 1, 'embedding_dim': 32, 'lr': 0.0006019421719947311, 'lambda_val': 2.4400189244538923e-06, 'batch_size': 592, 'optimizer': 'Adam'}. Best is trial 46 with value: 0.04748435995661139.
2026-05-18 09:32:31,010 - experiment_functions - INFO - Early stopping at epoch 3150. Best Recall: 0.0469
2026-05-18 09:32:31,109 - optuna.study.study - INFO - Trial 123 finished with value: 0.04687203787036736 and parameters: {'n_layers': 1, 'embedding_dim': 32, 'lr': 0.0005791077475344463, 'lambda_val': 4.337898723425588e-06, 'batch_size': 590, 'optimizer': 'Adam'}. Best is trial 46 with value: 0.04748435995661139.
2026-05-18 09:32:46,945 - optuna.study._optimize - INFO - Trial 124 pruned. 
2026-05-18 09:33:01,313 - optuna.study._optimize - INFO - Trial 125 pruned. 
2026-05-18 09:33:17,536 - optuna.study._optimize - INFO - Trial 126 pruned. 
2026-05-18 09:33:32,105 - optuna.study._optimize - INFO - Trial 127 pruned. 
2026-05-18 09:33:48,144 - optuna.study._optimize - INFO - Trial 128 pruned. 
