2026-05-19 05:49:20,943 - optuna.study.study - INFO - Trial 232 finished with value: 0.00770766189625747 and parameters: {'n_layers': 1, 'embedding_dim': 32, 'lr': 0.0922659402648647, 'lambda_val': 0.0015653533255346826, 'batch_size': 513, 'optimizer': 'RMSprop'}. Best is trial 206 with value: 0.07695563236837606.
2026-05-19 05:49:36,661 - experiment_functions - INFO - Early stopping at epoch 1050. Best Recall: 0.0696
2026-05-19 05:49:36,806 - optuna.study.study - INFO - Trial 233 finished with value: 0.06959444807119135 and parameters: {'n_layers': 1, 'embedding_dim': 32, 'lr': 0.0011786957447080123, 'lambda_val': 0.0013789073951316806, 'batch_size': 667, 'optimizer': 'RMSprop'}. Best is trial 206 with value: 0.07695563236837606.
2026-05-19 05:50:10,004 - experiment_functions - INFO - Early stopping at epoch 2350. Best Recall: 0.0740
2026-05-19 05:50:10,103 - optuna.study.study - INFO - Trial 234 finished with value: 0.07397748750958605 and parameters: {'n_layers': 1, 'embedding_dim': 32, 'lr': 0.0008119870385900431, 'lambda_val': 0.0019134393200295836, 'batch_size': 596, 'optimizer': 'RMSprop'}. Best is trial 206 with value: 0.07695563236837606.
2026-05-19 05:50:24,294 - optuna.study._optimize - INFO - Trial 235 pruned. 
2026-05-19 05:50:49,245 - optuna.study._optimize - INFO - Trial 236 pruned. 
2026-05-19 05:51:07,822 - optuna.study._optimize - INFO - Trial 237 pruned. 
2026-05-19 05:51:28,577 - experiment_functions - INFO - Early stopping at epoch 1400. Best Recall: 0.0730
2026-05-19 05:51:29,948 - optuna.study.study - INFO - Trial 238 finished with value: 0.07304275843924482 and parameters: {'n_layers': 1, 'embedding_dim': 32, 'lr': 0.0009737526277780809, 'lambda_val': 0.0021792850182810546, 'batch_size': 639, 'optimizer': 'RMSprop'}. Best is trial 206 with value: 0.07695563236837606.
2026-05-19 05:51:48,566 - optuna.study._optimize - INFO - Trial 239 pruned. 
2026-05-19 05:51:56,359 - experiment_functions - INFO - Early stopping at epoch 500. Best Recall: 0.0059
2026-05-19 05:51:56,461 - optuna.study.study - INFO - Trial 240 finished with value: 0.005912195836847807 and parameters: {'n_layers': 1, 'embedding_dim': 256, 'lr': 0.000967854977604296, 'lambda_val': 0.0024418038705299344, 'batch_size': 588, 'optimizer': 'SGD'}. Best is trial 206 with value: 0.07695563236837606.
2026-05-19 05:52:14,827 - optuna.study._optimize - INFO - Trial 241 pruned. 
2026-05-19 05:52:45,522 - experiment_functions - INFO - Early stopping at epoch 1950. Best Recall: 0.0736
2026-05-19 05:52:45,654 - optuna.study.study - INFO - Trial 242 finished with value: 0.07356605791017433 and parameters: {'n_layers': 1, 'embedding_dim': 32, 'lr': 0.0007337274323066277, 'lambda_val': 0.004095556416803281, 'batch_size': 752, 'optimizer': 'RMSprop'}. Best is trial 206 with value: 0.07695563236837606.
2026-05-19 05:53:18,014 - experiment_functions - INFO - Early stopping at epoch 2100. Best Recall: 0.0738
2026-05-19 05:53:18,116 - optuna.study.study - INFO - Trial 243 finished with value: 0.07384340035614412 and parameters: {'n_layers': 1, 'embedding_dim': 32, 'lr': 0.0007179187726397459, 'lambda_val': 0.004173946689088997, 'batch_size': 728, 'optimizer': 'RMSprop'}. Best is trial 206 with value: 0.07695563236837606.
2026-05-19 05:53:32,722 - optuna.study._optimize - INFO - Trial 244 pruned. 
2026-05-19 05:53:49,969 - optuna.study._optimize - INFO - Trial 245 pruned. 
2026-05-19 05:54:14,061 - experiment_functions - INFO - Early stopping at epoch 950. Best Recall: 0.0655
2026-05-19 05:54:14,152 - optuna.study.study - INFO - Trial 246 finished with value: 0.0655395366190931 and parameters: {'n_layers': 1, 'embedding_dim': 32, 'lr': 0.0010432080795987552, 'lambda_val': 0.0038393345474687776, 'batch_size': 793, 'optimizer': 'RMSprop'}. Best is trial 206 with value: 0.07695563236837606.
2026-05-19 05:54:43,942 - experiment_functions - INFO - Early stopping at epoch 2100. Best Recall: 0.0752
2026-05-19 05:54:44,042 - optuna.study.study - INFO - Trial 247 finished with value: 0.07516507119913243 and parameters: {'n_layers': 1, 'embedding_dim': 32, 'lr': 0.0007426699171331657, 'lambda_val': 0.002970928856693915, 'batch_size': 651, 'optimizer': 'RMSprop'}. Best is trial 206 with value: 0.07695563236837606.
2026-05-19 05:54:58,026 - optuna.study._optimize - INFO - Trial 248 pruned. 
2026-05-19 05:55:17,537 - optuna.study._optimize - INFO - Trial 249 pruned. 
2026-05-19 05:55:31,401 - optuna.study._optimize - INFO - Trial 250 pruned. 
2026-05-19 05:55:47,354 - optuna.study._optimize - INFO - Trial 251 pruned. 
2026-05-19 05:56:06,901 - experiment_functions - INFO - Early stopping at epoch 1150. Best Recall: 0.0675
2026-05-19 05:56:07,002 - optuna.study.study - INFO - Trial 252 finished with value: 0.0675132990741527 and parameters: {'n_layers': 1, 'embedding_dim': 96, 'lr': 0.0007683713409793538, 'lambda_val': 0.0016244100653996197, 'batch_size': 790, 'optimizer': 'RMSprop'}. Best is trial 206 with value: 0.07695563236837606.
2026-05-19 05:56:26,096 - optuna.study._optimize - INFO - Trial 253 pruned. 
2026-05-19 05:56:47,338 - experiment_functions - INFO - Early stopping at epoch 900. Best Recall: 0.0465
2026-05-19 05:56:48,105 - optuna.study.study - INFO - Trial 254 finished with value: 0.0464750688418325 and parameters: {'n_layers': 3, 'embedding_dim': 32, 'lr': 0.0007194970917819767, 'lambda_val': 0.0027333672160069935, 'batch_size': 583, 'optimizer': 'RMSprop'}. Best is trial 206 with value: 0.07695563236837606.
2026-05-19 05:57:03,544 - optuna.study._optimize - INFO - Trial 255 pruned. 
2026-05-19 05:57:14,880 - experiment_functions - INFO - Early stopping at epoch 750. Best Recall: 0.0484
2026-05-19 05:57:15,015 - optuna.study.study - INFO - Trial 256 finished with value: 0.048428979411252106 and parameters: {'n_layers': 1, 'embedding_dim': 32, 'lr': 0.0009762001845373127, 'lambda_val': 0.001936444799756043, 'batch_size': 3763, 'optimizer': 'RMSprop'}. Best is trial 206 with value: 0.07695563236837606.
2026-05-19 05:57:32,036 - optuna.study._optimize - INFO - Trial 257 pruned. 
2026-05-19 05:57:50,315 - optuna.study._optimize - INFO - Trial 258 pruned. 
2026-05-19 05:58:05,769 - optuna.study._optimize - INFO - Trial 259 pruned. 
2026-05-19 05:58:22,827 - optuna.study._optimize - INFO - Trial 260 pruned. 
2026-05-19 05:58:39,551 - experiment_functions - INFO - Early stopping at epoch 1200. Best Recall: 0.0697
2026-05-19 05:58:39,640 - optuna.study.study - INFO - Trial 261 finished with value: 0.0697391137766514 and parameters: {'n_layers': 1, 'embedding_dim': 32, 'lr': 0.0010551802336715935, 'lambda_val': 0.0005465286983053259, 'batch_size': 809, 'optimizer': 'RMSprop'}. Best is trial 206 with value: 0.07695563236837606.
2026-05-19 05:58:53,603 - optuna.study._optimize - INFO - Trial 262 pruned. 
2026-05-19 05:59:11,709 - optuna.study._optimize - INFO - Trial 263 pruned. 
2026-05-19 05:59:24,438 - experiment_functions - INFO - Early stopping at epoch 700. Best Recall: 0.0363
2026-05-19 05:59:24,528 - optuna.study.study - INFO - Trial 264 finished with value: 0.03632468471480555 and parameters: {'n_layers': 4, 'embedding_dim': 128, 'lr': 0.0004876108924951759, 'lambda_val': 0.0010335587482831496, 'batch_size': 517, 'optimizer': 'RMSprop'}. Best is trial 206 with value: 0.07695563236837606.
2026-05-19 05:59:39,105 - optuna.study._optimize - INFO - Trial 265 pruned. 
2026-05-19 05:59:56,427 - experiment_functions - INFO - Early stopping at epoch 1200. Best Recall: 0.0705
2026-05-19 05:59:56,516 - optuna.study.study - INFO - Trial 266 finished with value: 0.07054098305859706 and parameters: {'n_layers': 1, 'embedding_dim': 32, 'lr': 0.0009984388088291542, 'lambda_val': 0.00256048611303635, 'batch_size': 607, 'optimizer': 'RMSprop'}. Best is trial 206 with value: 0.07695563236837606.
2026-05-19 06:00:04,905 - experiment_functions - INFO - Early stopping at epoch 500. Best Recall: 0.0051
2026-05-19 06:00:04,996 - optuna.study.study - INFO - Trial 267 finished with value: 0.005137689078236772 and parameters: {'n_layers': 1, 'embedding_dim': 32, 'lr': 0.0005898817655759692, 'lambda_val': 0.001824790857373743, 'batch_size': 819, 'optimizer': 'SGD'}. Best is trial 206 with value: 0.07695563236837606.
2026-05-19 06:00:21,022 - optuna.study._optimize - INFO - Trial 268 pruned. 
2026-05-19 06:00:39,466 - experiment_functions - INFO - Early stopping at epoch 1200. Best Recall: 0.0692
2026-05-19 06:00:39,585 - optuna.study.study - INFO - Trial 269 finished with value: 0.0691872347846492 and parameters: {'n_layers': 1, 'embedding_dim': 32, 'lr': 0.0011496035568284702, 'lambda_val': 0.0008485580166073622, 'batch_size': 662, 'optimizer': 'RMSprop'}. Best is trial 206 with value: 0.07695563236837606.
2026-05-19 06:01:00,985 - optuna.study._optimize - INFO - Trial 270 pruned. 
2026-05-19 06:01:19,392 - optuna.study._optimize - INFO - Trial 271 pruned. 
2026-05-19 06:01:33,220 - experiment_functions - INFO - Early stopping at epoch 850. Best Recall: 0.0590
2026-05-19 06:01:33,311 - optuna.study.study - INFO - Trial 272 finished with value: 0.05895479399014151 and parameters: {'n_layers': 1, 'embedding_dim': 256, 'lr': 0.0009735173245340963, 'lambda_val': 0.003076956602941292, 'batch_size': 689, 'optimizer': 'RMSprop'}. Best is trial 206 with value: 0.07695563236837606.
2026-05-19 06:01:48,355 - optuna.study._optimize - INFO - Trial 273 pruned. 
2026-05-19 06:01:59,277 - experiment_functions - INFO - Early stopping at epoch 750. Best Recall: 0.0457
2026-05-19 06:01:59,379 - optuna.study.study - INFO - Trial 274 finished with value: 0.04570885583332828 and parameters: {'n_layers': 1, 'embedding_dim': 32, 'lr': 0.001342567571074136, 'lambda_val': 0.09713505190993905, 'batch_size': 841, 'optimizer': 'RMSprop'}. Best is trial 206 with value: 0.07695563236837606.
2026-05-19 06:02:07,498 - experiment_functions - INFO - Early stopping at epoch 550. Best Recall: 0.0055
2026-05-19 06:02:07,590 - optuna.study.study - INFO - Trial 275 finished with value: 0.0055498851234437215 and parameters: {'n_layers': 1, 'embedding_dim': 32, 'lr': 4.008648475600332e-05, 'lambda_val': 0.0006932785449232417, 'batch_size': 753, 'optimizer': 'RMSprop'}. Best is trial 206 with value: 0.07695563236837606.
2026-05-19 06:02:41,317 - experiment_functions - INFO - Early stopping at epoch 2400. Best Recall: 0.0743
2026-05-19 06:02:41,460 - optuna.study.study - INFO - Trial 276 finished with value: 0.07433989115883523 and parameters: {'n_layers': 1, 'embedding_dim': 32, 'lr': 0.0007758870706422448, 'lambda_val': 0.0017142858710506182, 'batch_size': 636, 'optimizer': 'RMSprop'}. Best is trial 206 with value: 0.07695563236837606.
2026-05-19 06:02:57,835 - optuna.study._optimize - INFO - Trial 277 pruned. 
2026-05-19 06:03:12,063 - optuna.study._optimize - INFO - Trial 278 pruned. 
2026-05-19 06:03:27,612 - optuna.study._optimize - INFO - Trial 279 pruned. 
2026-05-19 06:03:44,157 - optuna.study._optimize - INFO - Trial 280 pruned. 
2026-05-19 06:04:02,138 - optuna.study._optimize - INFO - Trial 281 pruned. 
2026-05-19 06:04:17,422 - optuna.study._optimize - INFO - Trial 282 pruned. 
2026-05-19 06:04:29,034 - experiment_functions - INFO - Early stopping at epoch 750. Best Recall: 0.0577
2026-05-19 06:04:29,126 - optuna.study.study - INFO - Trial 283 finished with value: 0.0576930492087188 and parameters: {'n_layers': 1, 'embedding_dim': 32, 'lr': 0.0010746482960401567, 'lambda_val': 0.0020600247744233004, 'batch_size': 2014, 'optimizer': 'RMSprop'}. Best is trial 206 with value: 0.07695563236837606.
2026-05-19 06:04:42,129 - experiment_functions - INFO - Early stopping at epoch 800. Best Recall: 0.0585
2026-05-19 06:04:42,274 - optuna.study.study - INFO - Trial 284 finished with value: 0.0584594125177478 and parameters: {'n_layers': 2, 'embedding_dim': 32, 'lr': 0.0008542941440553069, 'lambda_val': 0.005204381230253105, 'batch_size': 711, 'optimizer': 'RMSprop'}. Best is trial 206 with value: 0.07695563236837606.
2026-05-19 06:04:56,751 - optuna.study._optimize - INFO - Trial 285 pruned. 
2026-05-19 06:05:11,504 - optuna.study._optimize - INFO - Trial 286 pruned. 
2026-05-19 06:05:31,190 - optuna.study._optimize - INFO - Trial 287 pruned. 
2026-05-19 06:05:47,139 - optuna.study._optimize - INFO - Trial 288 pruned. 
2026-05-19 06:05:54,098 - experiment_functions - INFO - Early stopping at epoch 500. Best Recall: 0.0060
2026-05-19 06:05:54,223 - optuna.study.study - INFO - Trial 289 finished with value: 0.005976642216794607 and parameters: {'n_layers': 1, 'embedding_dim': 32, 'lr': 0.0016080387575515738, 'lambda_val': 0.002864593277575174, 'batch_size': 515, 'optimizer': 'SGD'}. Best is trial 206 with value: 0.07695563236837606.
2026-05-19 06:06:11,478 - experiment_functions - INFO - Early stopping at epoch 950. Best Recall: 0.0665
2026-05-19 06:06:11,567 - optuna.study.study - INFO - Trial 290 finished with value: 0.06650094549497028 and parameters: {'n_layers': 1, 'embedding_dim': 32, 'lr': 0.0012266624600769916, 'lambda_val': 0.0014152060265627286, 'batch_size': 772, 'optimizer': 'RMSprop'}. Best is trial 206 with value: 0.07695563236837606.
2026-05-19 06:06:25,406 - experiment_functions - INFO - Early stopping at epoch 950. Best Recall: 0.0621
2026-05-19 06:06:25,486 - optuna.study.study - INFO - Trial 291 finished with value: 0.06208434820278567 and parameters: {'n_layers': 1, 'embedding_dim': 128, 'lr': 0.0008973579694968271, 'lambda_val': 0.004144923248797883, 'batch_size': 688, 'optimizer': 'RMSprop'}. Best is trial 206 with value: 0.07695563236837606.
2026-05-19 06:06:41,004 - optuna.study._optimize - INFO - Trial 292 pruned. 
2026-05-19 06:07:16,262 - optuna.study._optimize - INFO - Trial 293 pruned. 
2026-05-19 06:07:40,052 - experiment_functions - INFO - Early stopping at epoch 1100. Best Recall: 0.0702
2026-05-19 06:07:40,143 - optuna.study.study - INFO - Trial 294 finished with value: 0.07021180925747636 and parameters: {'n_layers': 1, 'embedding_dim': 32, 'lr': 0.0010461698874313853, 'lambda_val': 0.001577834232417314, 'batch_size': 845, 'optimizer': 'RMSprop'}. Best is trial 206 with value: 0.07695563236837606.
2026-05-19 06:07:54,831 - optuna.study._optimize - INFO - Trial 295 pruned. 
2026-05-19 06:08:09,865 - optuna.study._optimize - INFO - Trial 296 pruned. 
2026-05-19 06:08:21,625 - experiment_functions - INFO - Early stopping at epoch 750. Best Recall: 0.0563
2026-05-19 06:08:21,725 - optuna.study.study - INFO - Trial 297 finished with value: 0.05628316698800071 and parameters: {'n_layers': 1, 'embedding_dim': 256, 'lr': 0.0011646340489429939, 'lambda_val': 0.0012095680768071763, 'batch_size': 638, 'optimizer': 'RMSprop'}. Best is trial 206 with value: 0.07695563236837606.
