2026-05-17 22:25:58,171 - optuna.study.study - INFO - Trial 204 finished with value: 0.02863653620409779 and parameters: {'n_layers': 2, 'embedding_dim': 64, 'lr': 0.0003031187907152738, 'lambda_val': 2.184507582736865e-06, 'batch_size': 922, 'optimizer': 'RMSprop'}. Best is trial 194 with value: 0.029582844951066566.
2026-05-17 22:26:27,740 - experiment_functions - INFO - Early stopping at epoch 2300. Best Recall: 0.0295
2026-05-17 22:26:27,882 - optuna.study.study - INFO - Trial 205 finished with value: 0.029491973554340026 and parameters: {'n_layers': 2, 'embedding_dim': 64, 'lr': 0.00028595308963444996, 'lambda_val': 3.0078625181940716e-06, 'batch_size': 819, 'optimizer': 'RMSprop'}. Best is trial 194 with value: 0.029582844951066566.
2026-05-17 22:26:59,049 - experiment_functions - INFO - Early stopping at epoch 2450. Best Recall: 0.0292
2026-05-17 22:26:59,137 - optuna.study.study - INFO - Trial 206 finished with value: 0.029205892863190634 and parameters: {'n_layers': 2, 'embedding_dim': 64, 'lr': 0.00027234236970664465, 'lambda_val': 3.0475504862429197e-06, 'batch_size': 830, 'optimizer': 'RMSprop'}. Best is trial 194 with value: 0.029582844951066566.
2026-05-17 22:27:13,625 - optuna.study._optimize - INFO - Trial 207 pruned. 
2026-05-17 22:27:40,919 - experiment_functions - INFO - Early stopping at epoch 2100. Best Recall: 0.0301
2026-05-17 22:27:41,017 - optuna.study.study - INFO - Trial 208 finished with value: 0.03007255447074017 and parameters: {'n_layers': 2, 'embedding_dim': 64, 'lr': 0.00023027403783081274, 'lambda_val': 2.1773233709169697e-06, 'batch_size': 813, 'optimizer': 'RMSprop'}. Best is trial 208 with value: 0.03007255447074017.
2026-05-17 22:28:17,857 - experiment_functions - INFO - Early stopping at epoch 2200. Best Recall: 0.0296
2026-05-17 22:28:17,947 - optuna.study.study - INFO - Trial 209 finished with value: 0.029584264089575037 and parameters: {'n_layers': 2, 'embedding_dim': 64, 'lr': 0.00023343128143760627, 'lambda_val': 2.2511850114793064e-06, 'batch_size': 856, 'optimizer': 'RMSprop'}. Best is trial 208 with value: 0.03007255447074017.
2026-05-17 22:28:48,067 - experiment_functions - INFO - Early stopping at epoch 2300. Best Recall: 0.0299
2026-05-17 22:28:48,157 - optuna.study.study - INFO - Trial 210 finished with value: 0.02991611208817014 and parameters: {'n_layers': 2, 'embedding_dim': 64, 'lr': 0.00022823755830429193, 'lambda_val': 2.158984562085605e-06, 'batch_size': 845, 'optimizer': 'RMSprop'}. Best is trial 208 with value: 0.03007255447074017.
2026-05-17 22:29:33,209 - experiment_functions - INFO - Early stopping at epoch 3500. Best Recall: 0.0297
2026-05-17 22:29:33,297 - optuna.study.study - INFO - Trial 211 finished with value: 0.029693709574194115 and parameters: {'n_layers': 2, 'embedding_dim': 64, 'lr': 0.00022962018447137507, 'lambda_val': 2.257496937775105e-06, 'batch_size': 854, 'optimizer': 'RMSprop'}. Best is trial 208 with value: 0.03007255447074017.
2026-05-17 22:29:46,978 - optuna.study._optimize - INFO - Trial 212 pruned. 
2026-05-17 22:30:09,606 - experiment_functions - INFO - Early stopping at epoch 1700. Best Recall: 0.0288
2026-05-17 22:30:09,727 - optuna.study.study - INFO - Trial 213 finished with value: 0.028849762431394144 and parameters: {'n_layers': 2, 'embedding_dim': 64, 'lr': 0.00027351635042194283, 'lambda_val': 2.9388069744574594e-06, 'batch_size': 926, 'optimizer': 'RMSprop'}. Best is trial 208 with value: 0.03007255447074017.
2026-05-17 22:30:33,424 - experiment_functions - INFO - Early stopping at epoch 1800. Best Recall: 0.0295
2026-05-17 22:30:33,521 - optuna.study.study - INFO - Trial 214 finished with value: 0.029532153920875687 and parameters: {'n_layers': 2, 'embedding_dim': 64, 'lr': 0.00023086463509148334, 'lambda_val': 1.7844602540461737e-06, 'batch_size': 812, 'optimizer': 'RMSprop'}. Best is trial 208 with value: 0.03007255447074017.
2026-05-17 22:31:10,929 - experiment_functions - INFO - Early stopping at epoch 2150. Best Recall: 0.0296
2026-05-17 22:31:11,017 - optuna.study.study - INFO - Trial 215 finished with value: 0.029567247791800533 and parameters: {'n_layers': 2, 'embedding_dim': 64, 'lr': 0.00028529338228156865, 'lambda_val': 1.9146302339315445e-06, 'batch_size': 808, 'optimizer': 'RMSprop'}. Best is trial 208 with value: 0.03007255447074017.
2026-05-17 22:31:38,443 - experiment_functions - INFO - Early stopping at epoch 2100. Best Recall: 0.0298
2026-05-17 22:31:38,575 - optuna.study.study - INFO - Trial 216 finished with value: 0.02983522677749969 and parameters: {'n_layers': 2, 'embedding_dim': 64, 'lr': 0.0002969902020460837, 'lambda_val': 1.7082288132329932e-06, 'batch_size': 804, 'optimizer': 'RMSprop'}. Best is trial 208 with value: 0.03007255447074017.
2026-05-17 22:32:05,641 - experiment_functions - INFO - Early stopping at epoch 2050. Best Recall: 0.0295
2026-05-17 22:32:05,809 - optuna.study.study - INFO - Trial 217 finished with value: 0.029476474755115938 and parameters: {'n_layers': 2, 'embedding_dim': 64, 'lr': 0.0003025685419831304, 'lambda_val': 1.7221237228916903e-06, 'batch_size': 801, 'optimizer': 'RMSprop'}. Best is trial 208 with value: 0.03007255447074017.
2026-05-17 22:32:33,712 - experiment_functions - INFO - Early stopping at epoch 2100. Best Recall: 0.0303
2026-05-17 22:32:33,857 - optuna.study.study - INFO - Trial 218 finished with value: 0.03029369158766931 and parameters: {'n_layers': 2, 'embedding_dim': 64, 'lr': 0.00027709581585292465, 'lambda_val': 1.7841735878282157e-06, 'batch_size': 905, 'optimizer': 'RMSprop'}. Best is trial 218 with value: 0.03029369158766931.
2026-05-17 22:32:56,868 - experiment_functions - INFO - Early stopping at epoch 1750. Best Recall: 0.0291
2026-05-17 22:32:57,012 - optuna.study.study - INFO - Trial 219 finished with value: 0.02914234091207739 and parameters: {'n_layers': 2, 'embedding_dim': 64, 'lr': 0.00029284717682033203, 'lambda_val': 1.726068018402491e-06, 'batch_size': 936, 'optimizer': 'RMSprop'}. Best is trial 218 with value: 0.03029369158766931.
2026-05-17 22:33:10,839 - optuna.study._optimize - INFO - Trial 220 pruned. 
2026-05-17 22:33:30,945 - experiment_functions - INFO - Early stopping at epoch 1550. Best Recall: 0.0299
2026-05-17 22:33:31,046 - optuna.study.study - INFO - Trial 221 finished with value: 0.029887241269739087 and parameters: {'n_layers': 2, 'embedding_dim': 64, 'lr': 0.00027462642248468887, 'lambda_val': 1.8890877327064312e-06, 'batch_size': 882, 'optimizer': 'RMSprop'}. Best is trial 218 with value: 0.03029369158766931.
2026-05-17 22:34:04,799 - experiment_functions - INFO - Early stopping at epoch 2150. Best Recall: 0.0301
2026-05-17 22:34:04,943 - optuna.study.study - INFO - Trial 222 finished with value: 0.03009609211167111 and parameters: {'n_layers': 2, 'embedding_dim': 64, 'lr': 0.00026831046350195514, 'lambda_val': 1.7530360747381513e-06, 'batch_size': 887, 'optimizer': 'RMSprop'}. Best is trial 218 with value: 0.03029369158766931.
2026-05-17 22:34:26,702 - experiment_functions - INFO - Early stopping at epoch 1700. Best Recall: 0.0292
2026-05-17 22:34:26,835 - optuna.study.study - INFO - Trial 223 finished with value: 0.02922248080015266 and parameters: {'n_layers': 2, 'embedding_dim': 64, 'lr': 0.00029823454484372903, 'lambda_val': 1.7862290880612043e-06, 'batch_size': 899, 'optimizer': 'RMSprop'}. Best is trial 218 with value: 0.03029369158766931.
2026-05-17 22:35:04,952 - experiment_functions - INFO - Early stopping at epoch 2300. Best Recall: 0.0296
2026-05-17 22:35:05,031 - optuna.study.study - INFO - Trial 224 finished with value: 0.029646317927254133 and parameters: {'n_layers': 2, 'embedding_dim': 64, 'lr': 0.0002380905992667792, 'lambda_val': 1.6894617478835834e-06, 'batch_size': 998, 'optimizer': 'RMSprop'}. Best is trial 218 with value: 0.03029369158766931.
2026-05-17 22:35:38,084 - experiment_functions - INFO - Early stopping at epoch 2500. Best Recall: 0.0297
2026-05-17 22:35:38,228 - optuna.study.study - INFO - Trial 225 finished with value: 0.0297376522808204 and parameters: {'n_layers': 2, 'embedding_dim': 64, 'lr': 0.00023045705447442748, 'lambda_val': 1.5040514840079457e-06, 'batch_size': 971, 'optimizer': 'RMSprop'}. Best is trial 218 with value: 0.03029369158766931.
2026-05-17 22:35:52,207 - optuna.study._optimize - INFO - Trial 226 pruned. 
2026-05-17 22:36:23,097 - experiment_functions - INFO - Early stopping at epoch 2400. Best Recall: 0.0296
2026-05-17 22:36:23,230 - optuna.study.study - INFO - Trial 227 finished with value: 0.02958584227356804 and parameters: {'n_layers': 2, 'embedding_dim': 64, 'lr': 0.0002251022513001561, 'lambda_val': 1.1460033803546966e-06, 'batch_size': 1005, 'optimizer': 'RMSprop'}. Best is trial 218 with value: 0.03029369158766931.
2026-05-17 22:36:50,284 - experiment_functions - INFO - Early stopping at epoch 2100. Best Recall: 0.0297
2026-05-17 22:36:50,384 - optuna.study.study - INFO - Trial 228 finished with value: 0.02968910953196047 and parameters: {'n_layers': 2, 'embedding_dim': 64, 'lr': 0.00023656915052035275, 'lambda_val': 1.2253780831417458e-06, 'batch_size': 1043, 'optimizer': 'RMSprop'}. Best is trial 218 with value: 0.03029369158766931.
2026-05-17 22:37:27,009 - experiment_functions - INFO - Early stopping at epoch 2350. Best Recall: 0.0294
2026-05-17 22:37:27,086 - optuna.study.study - INFO - Trial 229 finished with value: 0.0293522861578781 and parameters: {'n_layers': 2, 'embedding_dim': 64, 'lr': 0.00024154984305695527, 'lambda_val': 1.1855251064729454e-06, 'batch_size': 1017, 'optimizer': 'RMSprop'}. Best is trial 218 with value: 0.03029369158766931.
2026-05-17 22:37:47,881 - optuna.study._optimize - INFO - Trial 230 pruned. 
2026-05-17 22:38:18,385 - experiment_functions - INFO - Early stopping at epoch 2350. Best Recall: 0.0292
2026-05-17 22:38:18,519 - optuna.study.study - INFO - Trial 231 finished with value: 0.029153196528528713 and parameters: {'n_layers': 2, 'embedding_dim': 64, 'lr': 0.00024511597142370695, 'lambda_val': 1.2855621275745064e-06, 'batch_size': 1009, 'optimizer': 'RMSprop'}. Best is trial 218 with value: 0.03029369158766931.
2026-05-17 22:38:32,575 - optuna.study._optimize - INFO - Trial 232 pruned. 
2026-05-17 22:38:46,477 - optuna.study._optimize - INFO - Trial 233 pruned. 
2026-05-17 22:39:10,537 - experiment_functions - INFO - Early stopping at epoch 1850. Best Recall: 0.0288
2026-05-17 22:39:10,642 - optuna.study.study - INFO - Trial 234 finished with value: 0.028816309022111325 and parameters: {'n_layers': 2, 'embedding_dim': 64, 'lr': 0.0002742942724025538, 'lambda_val': 1.0543154162514814e-06, 'batch_size': 1058, 'optimizer': 'RMSprop'}. Best is trial 218 with value: 0.03029369158766931.
2026-05-17 22:39:30,824 - optuna.study._optimize - INFO - Trial 235 pruned. 
2026-05-17 22:39:44,626 - optuna.study._optimize - INFO - Trial 236 pruned. 
2026-05-17 22:40:08,756 - experiment_functions - INFO - Early stopping at epoch 1850. Best Recall: 0.0290
2026-05-17 22:40:08,879 - optuna.study.study - INFO - Trial 237 finished with value: 0.029041188422504194 and parameters: {'n_layers': 2, 'embedding_dim': 64, 'lr': 0.00028551866307894284, 'lambda_val': 1.8961027663235113e-06, 'batch_size': 901, 'optimizer': 'RMSprop'}. Best is trial 218 with value: 0.03029369158766931.
2026-05-17 22:40:22,067 - optuna.study._optimize - INFO - Trial 238 pruned. 
2026-05-17 22:40:35,651 - optuna.study._optimize - INFO - Trial 239 pruned. 
2026-05-17 22:40:48,952 - optuna.study._optimize - INFO - Trial 240 pruned. 
2026-05-17 22:41:23,741 - experiment_functions - INFO - Early stopping at epoch 2750. Best Recall: 0.0294
2026-05-17 22:41:23,833 - optuna.study.study - INFO - Trial 241 finished with value: 0.029362918260410164 and parameters: {'n_layers': 2, 'embedding_dim': 64, 'lr': 0.00022925056944343697, 'lambda_val': 1.0005441339630213e-06, 'batch_size': 874, 'optimizer': 'RMSprop'}. Best is trial 218 with value: 0.03029369158766931.
2026-05-17 22:41:36,971 - optuna.study._optimize - INFO - Trial 242 pruned. 
2026-05-17 22:41:50,351 - optuna.study._optimize - INFO - Trial 243 pruned. 
2026-05-17 22:42:20,487 - experiment_functions - INFO - Early stopping at epoch 2400. Best Recall: 0.0294
2026-05-17 22:42:20,590 - optuna.study.study - INFO - Trial 244 finished with value: 0.029358676131091294 and parameters: {'n_layers': 2, 'embedding_dim': 64, 'lr': 0.00025558300286353995, 'lambda_val': 1.6754016436030004e-06, 'batch_size': 778, 'optimizer': 'RMSprop'}. Best is trial 218 with value: 0.03029369158766931.
2026-05-17 22:42:34,117 - optuna.study._optimize - INFO - Trial 245 pruned. 
2026-05-17 22:42:58,780 - experiment_functions - INFO - Early stopping at epoch 1950. Best Recall: 0.0296
2026-05-17 22:42:58,893 - optuna.study.study - INFO - Trial 246 finished with value: 0.029640426390159038 and parameters: {'n_layers': 2, 'embedding_dim': 64, 'lr': 0.0002706071619532301, 'lambda_val': 1.690379569872881e-06, 'batch_size': 777, 'optimizer': 'RMSprop'}. Best is trial 218 with value: 0.03029369158766931.
2026-05-17 22:43:29,422 - experiment_functions - INFO - Early stopping at epoch 2400. Best Recall: 0.0299
2026-05-17 22:43:29,515 - optuna.study.study - INFO - Trial 247 finished with value: 0.029897850508850098 and parameters: {'n_layers': 2, 'embedding_dim': 64, 'lr': 0.00027327570688265356, 'lambda_val': 1.7441251520365062e-06, 'batch_size': 805, 'optimizer': 'RMSprop'}. Best is trial 218 with value: 0.03029369158766931.
2026-05-17 22:43:54,648 - experiment_functions - INFO - Early stopping at epoch 2000. Best Recall: 0.0294
2026-05-17 22:43:54,750 - optuna.study.study - INFO - Trial 248 finished with value: 0.029417850143420864 and parameters: {'n_layers': 2, 'embedding_dim': 64, 'lr': 0.0002816621557874544, 'lambda_val': 1.7438466705571455e-06, 'batch_size': 771, 'optimizer': 'RMSprop'}. Best is trial 218 with value: 0.03029369158766931.
2026-05-17 22:44:35,786 - experiment_functions - INFO - Early stopping at epoch 3250. Best Recall: 0.0300
2026-05-17 22:44:36,085 - optuna.study.study - INFO - Trial 249 finished with value: 0.029968878028312287 and parameters: {'n_layers': 2, 'embedding_dim': 64, 'lr': 0.00020071888918552625, 'lambda_val': 1.9267876559725075e-06, 'batch_size': 872, 'optimizer': 'RMSprop'}. Best is trial 218 with value: 0.03029369158766931.
2026-05-17 22:44:49,211 - optuna.study._optimize - INFO - Trial 250 pruned. 
2026-05-17 22:45:07,116 - experiment_functions - INFO - Early stopping at epoch 1400. Best Recall: 0.0295
2026-05-17 22:45:07,220 - optuna.study.study - INFO - Trial 251 finished with value: 0.029548337880409566 and parameters: {'n_layers': 2, 'embedding_dim': 64, 'lr': 0.00029303922816643956, 'lambda_val': 1.8235974738438642e-06, 'batch_size': 770, 'optimizer': 'RMSprop'}. Best is trial 218 with value: 0.03029369158766931.
2026-05-17 22:45:21,251 - optuna.study._optimize - INFO - Trial 252 pruned. 
2026-05-17 22:45:45,620 - experiment_functions - INFO - Early stopping at epoch 1950. Best Recall: 0.0297
2026-05-17 22:45:45,712 - optuna.study.study - INFO - Trial 253 finished with value: 0.029738140354262133 and parameters: {'n_layers': 2, 'embedding_dim': 64, 'lr': 0.0002789291359547349, 'lambda_val': 1.5612143730360194e-06, 'batch_size': 922, 'optimizer': 'RMSprop'}. Best is trial 218 with value: 0.03029369158766931.
2026-05-17 22:46:00,034 - optuna.study._optimize - INFO - Trial 254 pruned. 
2026-05-17 22:46:12,999 - optuna.study._optimize - INFO - Trial 255 pruned. 
2026-05-17 22:46:26,162 - optuna.study._optimize - INFO - Trial 256 pruned. 
2026-05-17 22:46:39,635 - optuna.study._optimize - INFO - Trial 257 pruned. 
2026-05-17 22:47:08,183 - experiment_functions - INFO - Early stopping at epoch 1650. Best Recall: 0.0299
2026-05-17 22:47:08,287 - optuna.study.study - INFO - Trial 258 finished with value: 0.02990908451139564 and parameters: {'n_layers': 2, 'embedding_dim': 64, 'lr': 0.00028241858123548514, 'lambda_val': 2.4914745898908375e-06, 'batch_size': 938, 'optimizer': 'RMSprop'}. Best is trial 218 with value: 0.03029369158766931.
2026-05-17 22:47:21,678 - optuna.study._optimize - INFO - Trial 259 pruned. 
2026-05-17 22:47:34,909 - optuna.study._optimize - INFO - Trial 260 pruned. 
2026-05-17 22:48:10,109 - experiment_functions - INFO - Early stopping at epoch 2800. Best Recall: 0.0297
2026-05-17 22:48:10,212 - optuna.study.study - INFO - Trial 261 finished with value: 0.029668712760219415 and parameters: {'n_layers': 2, 'embedding_dim': 64, 'lr': 0.0002573410119515303, 'lambda_val': 2.2360630582743096e-06, 'batch_size': 893, 'optimizer': 'RMSprop'}. Best is trial 218 with value: 0.03029369158766931.
2026-05-17 22:48:44,412 - experiment_functions - INFO - Early stopping at epoch 2800. Best Recall: 0.0293
2026-05-17 22:48:44,504 - optuna.study.study - INFO - Trial 262 finished with value: 0.029291249429491573 and parameters: {'n_layers': 2, 'embedding_dim': 64, 'lr': 0.0002520093164064923, 'lambda_val': 2.374200207074421e-06, 'batch_size': 892, 'optimizer': 'RMSprop'}. Best is trial 218 with value: 0.03029369158766931.
2026-05-17 22:49:18,344 - experiment_functions - INFO - Early stopping at epoch 2750. Best Recall: 0.0300
2026-05-17 22:49:18,447 - optuna.study.study - INFO - Trial 263 finished with value: 0.029963041702633256 and parameters: {'n_layers': 2, 'embedding_dim': 32, 'lr': 0.0003709736443387969, 'lambda_val': 2.0122592981109017e-06, 'batch_size': 957, 'optimizer': 'RMSprop'}. Best is trial 218 with value: 0.03029369158766931.
2026-05-17 22:49:43,875 - experiment_functions - INFO - Early stopping at epoch 2000. Best Recall: 0.0293
2026-05-17 22:49:43,999 - optuna.study.study - INFO - Trial 264 finished with value: 0.02927380712950317 and parameters: {'n_layers': 2, 'embedding_dim': 32, 'lr': 0.0003735308703430297, 'lambda_val': 2.035914833649999e-06, 'batch_size': 979, 'optimizer': 'RMSprop'}. Best is trial 218 with value: 0.03029369158766931.
2026-05-17 22:49:57,507 - optuna.study._optimize - INFO - Trial 265 pruned. 
2026-05-17 22:50:10,549 - optuna.study._optimize - INFO - Trial 266 pruned. 
2026-05-17 22:50:23,819 - optuna.study._optimize - INFO - Trial 267 pruned. 
2026-05-17 22:50:37,686 - optuna.study._optimize - INFO - Trial 268 pruned. 
2026-05-17 22:51:00,887 - experiment_functions - INFO - Early stopping at epoch 1700. Best Recall: 0.0293
2026-05-17 22:51:00,979 - optuna.study.study - INFO - Trial 269 finished with value: 0.02934163687795899 and parameters: {'n_layers': 2, 'embedding_dim': 64, 'lr': 0.000313948450586415, 'lambda_val': 1.2840264344475276e-06, 'batch_size': 883, 'optimizer': 'RMSprop'}. Best is trial 218 with value: 0.03029369158766931.
2026-05-17 22:51:25,320 - experiment_functions - INFO - Early stopping at epoch 1900. Best Recall: 0.0298
2026-05-17 22:51:25,435 - optuna.study.study - INFO - Trial 270 finished with value: 0.029841119718428854 and parameters: {'n_layers': 2, 'embedding_dim': 64, 'lr': 0.0002599136943854414, 'lambda_val': 2.5945209434554015e-06, 'batch_size': 775, 'optimizer': 'RMSprop'}. Best is trial 218 with value: 0.03029369158766931.
2026-05-17 22:51:46,705 - optuna.study._optimize - INFO - Trial 271 pruned. 
2026-05-17 22:52:15,340 - experiment_functions - INFO - Early stopping at epoch 2250. Best Recall: 0.0299
2026-05-17 22:52:15,430 - optuna.study.study - INFO - Trial 272 finished with value: 0.029938677567291044 and parameters: {'n_layers': 2, 'embedding_dim': 64, 'lr': 0.00024580250244121417, 'lambda_val': 1.3444288957023973e-06, 'batch_size': 950, 'optimizer': 'RMSprop'}. Best is trial 218 with value: 0.03029369158766931.
2026-05-17 22:52:47,380 - experiment_functions - INFO - Early stopping at epoch 2550. Best Recall: 0.0296
2026-05-17 22:52:47,505 - optuna.study.study - INFO - Trial 273 finished with value: 0.029596472897426656 and parameters: {'n_layers': 2, 'embedding_dim': 64, 'lr': 0.00022923967046848233, 'lambda_val': 1.3863195501491578e-06, 'batch_size': 997, 'optimizer': 'RMSprop'}. Best is trial 218 with value: 0.03029369158766931.
2026-05-17 22:53:01,227 - optuna.study._optimize - INFO - Trial 274 pruned. 
2026-05-17 22:53:14,368 - optuna.study._optimize - INFO - Trial 275 pruned. 
2026-05-17 22:53:28,144 - optuna.study._optimize - INFO - Trial 276 pruned. 
2026-05-17 22:54:26,107 - optuna.study.study - INFO - Trial 277 finished with value: 0.03049967928078329 and parameters: {'n_layers': 2, 'embedding_dim': 32, 'lr': 0.00024500215932300127, 'lambda_val': 1.246797803725286e-06, 'batch_size': 933, 'optimizer': 'RMSprop'}. Best is trial 277 with value: 0.03049967928078329.
2026-05-17 22:54:39,113 - optuna.study._optimize - INFO - Trial 278 pruned. 
2026-05-17 22:54:52,285 - optuna.study._optimize - INFO - Trial 279 pruned. 
2026-05-17 22:55:05,851 - optuna.study._optimize - INFO - Trial 280 pruned. 
2026-05-17 22:55:19,391 - optuna.study._optimize - INFO - Trial 281 pruned. 
2026-05-17 22:55:32,544 - optuna.study._optimize - INFO - Trial 282 pruned. 
2026-05-17 22:55:46,227 - optuna.study._optimize - INFO - Trial 283 pruned. 
2026-05-17 22:56:01,219 - optuna.study._optimize - INFO - Trial 284 pruned. 
2026-05-17 22:56:14,879 - optuna.study._optimize - INFO - Trial 285 pruned. 
2026-05-17 22:56:48,795 - experiment_functions - INFO - Early stopping at epoch 2500. Best Recall: 0.0303
2026-05-17 22:56:48,887 - optuna.study.study - INFO - Trial 286 finished with value: 0.03025379940486146 and parameters: {'n_layers': 2, 'embedding_dim': 64, 'lr': 0.00025354192683832563, 'lambda_val': 1.008871918557294e-06, 'batch_size': 953, 'optimizer': 'RMSprop'}. Best is trial 277 with value: 0.03049967928078329.
2026-05-17 22:57:03,265 - optuna.study._optimize - INFO - Trial 287 pruned. 
2026-05-17 22:57:17,614 - optuna.study._optimize - INFO - Trial 288 pruned. 
2026-05-17 22:57:42,350 - optuna.study._optimize - INFO - Trial 289 pruned. 
2026-05-17 22:57:57,334 - optuna.study._optimize - INFO - Trial 290 pruned. 
2026-05-17 22:58:11,718 - optuna.study._optimize - INFO - Trial 291 pruned. 
