2026-05-19 04:06:01,966 - optuna.study.study - INFO - Trial 179 finished with value: 0.005192148626256798 and parameters: {'n_layers': 1, 'embedding_dim': 32, 'lr': 0.0006324637040483261, 'lambda_val': 0.002010826922448217, 'batch_size': 587, 'optimizer': 'SGD'}. Best is trial 133 with value: 0.07401608033989727.
2026-05-19 04:06:17,686 - experiment_functions - INFO - Early stopping at epoch 1100. Best Recall: 0.0635
2026-05-19 04:06:17,776 - optuna.study.study - INFO - Trial 180 finished with value: 0.06354672224878508 and parameters: {'n_layers': 1, 'embedding_dim': 96, 'lr': 0.0010835488002995434, 'lambda_val': 0.00106158811000418, 'batch_size': 798, 'optimizer': 'Adam'}. Best is trial 133 with value: 0.07401608033989727.
2026-05-19 04:06:34,052 - optuna.study._optimize - INFO - Trial 181 pruned. 
2026-05-19 04:06:48,445 - experiment_functions - INFO - Early stopping at epoch 950. Best Recall: 0.0571
2026-05-19 04:06:48,536 - optuna.study.study - INFO - Trial 182 finished with value: 0.05708625771892356 and parameters: {'n_layers': 1, 'embedding_dim': 32, 'lr': 0.0013894046049190692, 'lambda_val': 0.05254947574949057, 'batch_size': 668, 'optimizer': 'Adam'}. Best is trial 133 with value: 0.07401608033989727.
2026-05-19 04:07:02,687 - optuna.study._optimize - INFO - Trial 183 pruned. 
2026-05-19 04:07:27,431 - experiment_functions - INFO - Early stopping at epoch 1850. Best Recall: 0.0701
2026-05-19 04:07:27,520 - optuna.study.study - INFO - Trial 184 finished with value: 0.07014626706716164 and parameters: {'n_layers': 1, 'embedding_dim': 32, 'lr': 0.0008889246903856567, 'lambda_val': 0.0009228742314695781, 'batch_size': 852, 'optimizer': 'Adam'}. Best is trial 133 with value: 0.07401608033989727.
2026-05-19 04:07:43,614 - optuna.study._optimize - INFO - Trial 185 pruned. 
2026-05-19 04:07:59,421 - optuna.study._optimize - INFO - Trial 186 pruned. 
2026-05-19 04:08:12,995 - optuna.study._optimize - INFO - Trial 187 pruned. 
2026-05-19 04:08:30,561 - experiment_functions - INFO - Early stopping at epoch 1250. Best Recall: 0.0689
2026-05-19 04:08:30,639 - optuna.study.study - INFO - Trial 188 finished with value: 0.06894936913648603 and parameters: {'n_layers': 1, 'embedding_dim': 32, 'lr': 0.0012634594986299468, 'lambda_val': 0.00108139030106249, 'batch_size': 516, 'optimizer': 'RMSprop'}. Best is trial 133 with value: 0.07401608033989727.
2026-05-19 04:08:46,231 - experiment_functions - INFO - Early stopping at epoch 1050. Best Recall: 0.0715
2026-05-19 04:08:46,377 - optuna.study.study - INFO - Trial 189 finished with value: 0.07147324256606231 and parameters: {'n_layers': 1, 'embedding_dim': 32, 'lr': 0.0015068446848332134, 'lambda_val': 0.0005725302236752427, 'batch_size': 668, 'optimizer': 'Adam'}. Best is trial 133 with value: 0.07401608033989727.
2026-05-19 04:09:00,187 - experiment_functions - INFO - Early stopping at epoch 950. Best Recall: 0.0653
2026-05-19 04:09:00,296 - optuna.study.study - INFO - Trial 190 finished with value: 0.06525292406652834 and parameters: {'n_layers': 1, 'embedding_dim': 32, 'lr': 0.0016159082756583144, 'lambda_val': 0.000510901194549243, 'batch_size': 1009, 'optimizer': 'Adam'}. Best is trial 133 with value: 0.07401608033989727.
2026-05-19 04:09:13,447 - experiment_functions - INFO - Early stopping at epoch 850. Best Recall: 0.0643
2026-05-19 04:09:13,567 - optuna.study.study - INFO - Trial 191 finished with value: 0.06427903225179905 and parameters: {'n_layers': 1, 'embedding_dim': 32, 'lr': 0.002006123136160698, 'lambda_val': 0.0007149300348841077, 'batch_size': 654, 'optimizer': 'Adam'}. Best is trial 133 with value: 0.07401608033989727.
2026-05-19 04:09:32,973 - experiment_functions - INFO - Early stopping at epoch 1300. Best Recall: 0.0699
2026-05-19 04:09:33,063 - optuna.study.study - INFO - Trial 192 finished with value: 0.06990125850982706 and parameters: {'n_layers': 1, 'embedding_dim': 32, 'lr': 0.0012425061821362958, 'lambda_val': 0.0006072616866834674, 'batch_size': 755, 'optimizer': 'Adam'}. Best is trial 133 with value: 0.07401608033989727.
2026-05-19 04:09:56,802 - experiment_functions - INFO - Early stopping at epoch 1750. Best Recall: 0.0697
2026-05-19 04:09:56,880 - optuna.study.study - INFO - Trial 193 finished with value: 0.06967000371527626 and parameters: {'n_layers': 1, 'embedding_dim': 32, 'lr': 0.0009685303215464716, 'lambda_val': 0.0005543045194925762, 'batch_size': 741, 'optimizer': 'Adam'}. Best is trial 133 with value: 0.07401608033989727.
2026-05-19 04:10:10,745 - optuna.study._optimize - INFO - Trial 194 pruned. 
2026-05-19 04:10:33,974 - experiment_functions - INFO - Early stopping at epoch 1650. Best Recall: 0.0719
2026-05-19 04:10:34,073 - optuna.study.study - INFO - Trial 195 finished with value: 0.07186043423333449 and parameters: {'n_layers': 1, 'embedding_dim': 32, 'lr': 0.0009198119426111005, 'lambda_val': 0.0006206440392431951, 'batch_size': 748, 'optimizer': 'Adam'}. Best is trial 133 with value: 0.07401608033989727.
2026-05-19 04:10:53,110 - experiment_functions - INFO - Early stopping at epoch 1150. Best Recall: 0.0683
2026-05-19 04:10:53,200 - optuna.study.study - INFO - Trial 196 finished with value: 0.06833595594336382 and parameters: {'n_layers': 1, 'embedding_dim': 32, 'lr': 0.0012628654715902852, 'lambda_val': 0.00044987897784426787, 'batch_size': 730, 'optimizer': 'Adam'}. Best is trial 133 with value: 0.07401608033989727.
2026-05-19 04:11:16,508 - experiment_functions - INFO - Early stopping at epoch 1750. Best Recall: 0.0685
2026-05-19 04:11:16,596 - optuna.study.study - INFO - Trial 197 finished with value: 0.06853918842026119 and parameters: {'n_layers': 1, 'embedding_dim': 32, 'lr': 0.0009235412321844188, 'lambda_val': 0.0006380538154911834, 'batch_size': 787, 'optimizer': 'Adam'}. Best is trial 133 with value: 0.07401608033989727.
2026-05-19 04:11:31,511 - experiment_functions - INFO - Early stopping at epoch 1050. Best Recall: 0.0657
2026-05-19 04:11:31,610 - optuna.study.study - INFO - Trial 198 finished with value: 0.06566786784819094 and parameters: {'n_layers': 1, 'embedding_dim': 32, 'lr': 0.0013581974176888187, 'lambda_val': 0.0007954751522495807, 'batch_size': 707, 'optimizer': 'Adam'}. Best is trial 133 with value: 0.07401608033989727.
2026-05-19 04:11:46,121 - experiment_functions - INFO - Early stopping at epoch 900. Best Recall: 0.0602
2026-05-19 04:11:46,220 - optuna.study.study - INFO - Trial 199 finished with value: 0.06015721570204816 and parameters: {'n_layers': 1, 'embedding_dim': 128, 'lr': 0.0015623680569902966, 'lambda_val': 0.0005110579364332307, 'batch_size': 615, 'optimizer': 'Adam'}. Best is trial 133 with value: 0.07401608033989727.
2026-05-19 04:12:02,927 - experiment_functions - INFO - Early stopping at epoch 1200. Best Recall: 0.0689
2026-05-19 04:12:03,115 - optuna.study.study - INFO - Trial 200 finished with value: 0.06894586645770086 and parameters: {'n_layers': 1, 'embedding_dim': 32, 'lr': 0.0011352262426019635, 'lambda_val': 5.436263808937266e-06, 'batch_size': 765, 'optimizer': 'Adam'}. Best is trial 133 with value: 0.07401608033989727.
2026-05-19 04:12:17,326 - optuna.study._optimize - INFO - Trial 201 pruned. 
2026-05-19 04:12:40,311 - experiment_functions - INFO - Early stopping at epoch 1550. Best Recall: 0.0698
2026-05-19 04:12:40,421 - optuna.study.study - INFO - Trial 202 finished with value: 0.06976976328275304 and parameters: {'n_layers': 1, 'embedding_dim': 32, 'lr': 0.0008999528143330328, 'lambda_val': 0.0006580583507805685, 'batch_size': 842, 'optimizer': 'Adam'}. Best is trial 133 with value: 0.07401608033989727.
2026-05-19 04:13:01,713 - optuna.study._optimize - INFO - Trial 203 pruned. 
2026-05-19 04:13:14,507 - experiment_functions - INFO - Early stopping at epoch 900. Best Recall: 0.0651
2026-05-19 04:13:14,616 - optuna.study.study - INFO - Trial 204 finished with value: 0.0651420810364267 and parameters: {'n_layers': 1, 'embedding_dim': 32, 'lr': 0.0018292770145730483, 'lambda_val': 0.0004129703798671428, 'batch_size': 689, 'optimizer': 'Adam'}. Best is trial 133 with value: 0.07401608033989727.
2026-05-19 04:13:34,939 - experiment_functions - INFO - Early stopping at epoch 1300. Best Recall: 0.0669
2026-05-19 04:13:35,041 - optuna.study.study - INFO - Trial 205 finished with value: 0.06693072728391455 and parameters: {'n_layers': 1, 'embedding_dim': 32, 'lr': 0.0010967647927031055, 'lambda_val': 0.0005904672771543783, 'batch_size': 606, 'optimizer': 'Adam'}. Best is trial 133 with value: 0.07401608033989727.
2026-05-19 04:14:01,570 - experiment_functions - INFO - Early stopping at epoch 1850. Best Recall: 0.0696
2026-05-19 04:14:01,660 - optuna.study.study - INFO - Trial 206 finished with value: 0.06961662263801 and parameters: {'n_layers': 1, 'embedding_dim': 32, 'lr': 0.0008643459612788199, 'lambda_val': 0.0008468437243131911, 'batch_size': 748, 'optimizer': 'Adam'}. Best is trial 133 with value: 0.07401608033989727.
2026-05-19 04:14:11,625 - experiment_functions - INFO - Early stopping at epoch 700. Best Recall: 0.0443
2026-05-19 04:14:11,715 - optuna.study.study - INFO - Trial 207 finished with value: 0.044288389242601915 and parameters: {'n_layers': 3, 'embedding_dim': 32, 'lr': 0.001542312549327036, 'lambda_val': 0.0008301397407014442, 'batch_size': 850, 'optimizer': 'Adam'}. Best is trial 133 with value: 0.07401608033989727.
2026-05-19 04:14:27,513 - optuna.study._optimize - INFO - Trial 208 pruned. 
2026-05-19 04:14:45,206 - experiment_functions - INFO - Early stopping at epoch 1300. Best Recall: 0.0695
2026-05-19 04:14:45,340 - optuna.study.study - INFO - Trial 209 finished with value: 0.06954066579318052 and parameters: {'n_layers': 1, 'embedding_dim': 32, 'lr': 0.0012066164043445457, 'lambda_val': 0.0006443109995282514, 'batch_size': 658, 'optimizer': 'Adam'}. Best is trial 133 with value: 0.07401608033989727.
2026-05-19 04:14:57,497 - experiment_functions - INFO - Early stopping at epoch 850. Best Recall: 0.0624
2026-05-19 04:14:57,598 - optuna.study.study - INFO - Trial 210 finished with value: 0.06236783279506881 and parameters: {'n_layers': 1, 'embedding_dim': 32, 'lr': 0.0021324642811725216, 'lambda_val': 0.0004298462693059174, 'batch_size': 569, 'optimizer': 'Adam'}. Best is trial 133 with value: 0.07401608033989727.
2026-05-19 04:15:14,499 - experiment_functions - INFO - Early stopping at epoch 1250. Best Recall: 0.0675
2026-05-19 04:15:14,589 - optuna.study.study - INFO - Trial 211 finished with value: 0.06754741171439435 and parameters: {'n_layers': 1, 'embedding_dim': 32, 'lr': 0.0011768848163800293, 'lambda_val': 0.00068697180993085, 'batch_size': 658, 'optimizer': 'Adam'}. Best is trial 133 with value: 0.07401608033989727.
2026-05-19 04:15:43,970 - experiment_functions - INFO - Early stopping at epoch 2100. Best Recall: 0.0736
2026-05-19 04:15:44,086 - optuna.study.study - INFO - Trial 212 finished with value: 0.0736143730969919 and parameters: {'n_layers': 1, 'embedding_dim': 32, 'lr': 0.001038396208066681, 'lambda_val': 0.0009484261933733151, 'batch_size': 512, 'optimizer': 'Adam'}. Best is trial 133 with value: 0.07401608033989727.
2026-05-19 04:15:57,709 - optuna.study._optimize - INFO - Trial 213 pruned. 
2026-05-19 04:16:14,835 - experiment_functions - INFO - Early stopping at epoch 1150. Best Recall: 0.0702
2026-05-19 04:16:14,925 - optuna.study.study - INFO - Trial 214 finished with value: 0.07022472480173933 and parameters: {'n_layers': 1, 'embedding_dim': 32, 'lr': 0.0013578383092743903, 'lambda_val': 0.0011833089483841005, 'batch_size': 649, 'optimizer': 'Adam'}. Best is trial 133 with value: 0.07401608033989727.
2026-05-19 04:16:30,013 - experiment_functions - INFO - Early stopping at epoch 1050. Best Recall: 0.0648
2026-05-19 04:16:30,103 - optuna.study.study - INFO - Trial 215 finished with value: 0.06484543736560579 and parameters: {'n_layers': 1, 'embedding_dim': 32, 'lr': 0.0015212031725777989, 'lambda_val': 0.0011850535039544905, 'batch_size': 594, 'optimizer': 'Adam'}. Best is trial 133 with value: 0.07401608033989727.
2026-05-19 04:16:45,387 - experiment_functions - INFO - Early stopping at epoch 950. Best Recall: 0.0602
2026-05-19 04:16:45,520 - optuna.study.study - INFO - Trial 216 finished with value: 0.060151093813292617 and parameters: {'n_layers': 1, 'embedding_dim': 32, 'lr': 0.0018182911197124436, 'lambda_val': 0.0009753373466644728, 'batch_size': 522, 'optimizer': 'Adam'}. Best is trial 133 with value: 0.07401608033989727.
2026-05-19 04:17:04,989 - optuna.study._optimize - INFO - Trial 217 pruned. 
2026-05-19 04:17:12,744 - experiment_functions - INFO - Early stopping at epoch 500. Best Recall: 0.0055
2026-05-19 04:17:12,834 - optuna.study.study - INFO - Trial 218 finished with value: 0.005490511722086931 and parameters: {'n_layers': 1, 'embedding_dim': 256, 'lr': 0.0014077988760108344, 'lambda_val': 0.0008743799533546582, 'batch_size': 628, 'optimizer': 'SGD'}. Best is trial 133 with value: 0.07401608033989727.
2026-05-19 04:17:27,203 - experiment_functions - INFO - Early stopping at epoch 850. Best Recall: 0.0657
2026-05-19 04:17:27,282 - optuna.study.study - INFO - Trial 219 finished with value: 0.06570475086632938 and parameters: {'n_layers': 1, 'embedding_dim': 32, 'lr': 0.0024381796757701937, 'lambda_val': 0.00046013097469704985, 'batch_size': 515, 'optimizer': 'Adam'}. Best is trial 133 with value: 0.07401608033989727.
2026-05-19 04:17:48,283 - optuna.study._optimize - INFO - Trial 220 pruned. 
2026-05-19 04:18:07,933 - experiment_functions - INFO - Early stopping at epoch 1250. Best Recall: 0.0679
2026-05-19 04:18:08,054 - optuna.study.study - INFO - Trial 221 finished with value: 0.06792740439597933 and parameters: {'n_layers': 1, 'embedding_dim': 32, 'lr': 0.001228158783588847, 'lambda_val': 0.0005784945859152653, 'batch_size': 650, 'optimizer': 'Adam'}. Best is trial 133 with value: 0.07401608033989727.
2026-05-19 04:18:27,247 - experiment_functions - INFO - Early stopping at epoch 1350. Best Recall: 0.0681
2026-05-19 04:18:27,356 - optuna.study.study - INFO - Trial 222 finished with value: 0.06808913831737938 and parameters: {'n_layers': 1, 'embedding_dim': 32, 'lr': 0.0012706528586867963, 'lambda_val': 0.0007031498118575545, 'batch_size': 618, 'optimizer': 'Adam'}. Best is trial 133 with value: 0.07401608033989727.
2026-05-19 04:19:17,106 - experiment_functions - INFO - Early stopping at epoch 2700. Best Recall: 0.0708
2026-05-19 04:19:17,185 - optuna.study.study - INFO - Trial 223 finished with value: 0.07081867077438705 and parameters: {'n_layers': 1, 'embedding_dim': 32, 'lr': 0.0008100696198643074, 'lambda_val': 0.0007936360699641739, 'batch_size': 696, 'optimizer': 'Adam'}. Best is trial 133 with value: 0.07401608033989727.
2026-05-19 04:19:32,161 - optuna.study._optimize - INFO - Trial 224 pruned. 
2026-05-19 04:19:53,175 - optuna.study._optimize - INFO - Trial 225 pruned. 
2026-05-19 04:20:08,018 - optuna.study._optimize - INFO - Trial 226 pruned. 
2026-05-19 04:20:20,435 - experiment_functions - INFO - Early stopping at epoch 850. Best Recall: 0.0669
2026-05-19 04:20:20,572 - optuna.study.study - INFO - Trial 227 finished with value: 0.06687981510420704 and parameters: {'n_layers': 1, 'embedding_dim': 32, 'lr': 0.0017018839391122283, 'lambda_val': 0.0005372498559698445, 'batch_size': 889, 'optimizer': 'Adam'}. Best is trial 133 with value: 0.07401608033989727.
2026-05-19 04:20:39,051 - experiment_functions - INFO - Early stopping at epoch 1200. Best Recall: 0.0675
2026-05-19 04:20:39,936 - optuna.study.study - INFO - Trial 228 finished with value: 0.06752451875070445 and parameters: {'n_layers': 2, 'embedding_dim': 32, 'lr': 0.0007422816102862339, 'lambda_val': 0.000794571034485439, 'batch_size': 579, 'optimizer': 'Adam'}. Best is trial 133 with value: 0.07401608033989727.
2026-05-19 04:20:57,428 - experiment_functions - INFO - Early stopping at epoch 1200. Best Recall: 0.0663
2026-05-19 04:20:57,517 - optuna.study.study - INFO - Trial 229 finished with value: 0.06633411017725116 and parameters: {'n_layers': 1, 'embedding_dim': 32, 'lr': 0.0010372065352610964, 'lambda_val': 0.0003742091012394955, 'batch_size': 798, 'optimizer': 'RMSprop'}. Best is trial 133 with value: 0.07401608033989727.
2026-05-19 04:21:10,419 - experiment_functions - INFO - Early stopping at epoch 850. Best Recall: 0.0609
2026-05-19 04:21:10,520 - optuna.study.study - INFO - Trial 230 finished with value: 0.06093534361034492 and parameters: {'n_layers': 1, 'embedding_dim': 32, 'lr': 0.002067225391529199, 'lambda_val': 1.292714330152525e-05, 'batch_size': 710, 'optimizer': 'Adam'}. Best is trial 133 with value: 0.07401608033989727.
2026-05-19 04:21:28,634 - experiment_functions - INFO - Early stopping at epoch 1250. Best Recall: 0.0696
2026-05-19 04:21:28,788 - optuna.study.study - INFO - Trial 231 finished with value: 0.06964404236024033 and parameters: {'n_layers': 1, 'embedding_dim': 32, 'lr': 0.0012020377652738163, 'lambda_val': 0.0006238211134294244, 'batch_size': 649, 'optimizer': 'Adam'}. Best is trial 133 with value: 0.07401608033989727.
2026-05-19 04:21:43,751 - optuna.study._optimize - INFO - Trial 232 pruned. 
2026-05-19 04:22:01,429 - optuna.study._optimize - INFO - Trial 233 pruned. 
2026-05-19 04:22:25,496 - experiment_functions - INFO - Early stopping at epoch 1700. Best Recall: 0.0689
2026-05-19 04:22:25,643 - optuna.study.study - INFO - Trial 234 finished with value: 0.0689127483696933 and parameters: {'n_layers': 1, 'embedding_dim': 32, 'lr': 0.0010628832769221822, 'lambda_val': 0.0007721226894372013, 'batch_size': 519, 'optimizer': 'Adam'}. Best is trial 133 with value: 0.07401608033989727.
2026-05-19 04:22:36,280 - experiment_functions - INFO - Early stopping at epoch 700. Best Recall: 0.0517
2026-05-19 04:22:36,380 - optuna.study.study - INFO - Trial 235 finished with value: 0.05171842204322939 and parameters: {'n_layers': 1, 'embedding_dim': 32, 'lr': 0.0015226875754247048, 'lambda_val': 0.0006584143344429173, 'batch_size': 3651, 'optimizer': 'Adam'}. Best is trial 133 with value: 0.07401608033989727.
2026-05-19 04:22:53,145 - optuna.study._optimize - INFO - Trial 236 pruned. 
2026-05-19 04:23:15,469 - experiment_functions - INFO - Early stopping at epoch 950. Best Recall: 0.0607
2026-05-19 04:23:15,578 - optuna.study.study - INFO - Trial 237 finished with value: 0.06071830740824569 and parameters: {'n_layers': 1, 'embedding_dim': 32, 'lr': 0.0017699932312515631, 'lambda_val': 0.0011832857053177567, 'batch_size': 664, 'optimizer': 'Adam'}. Best is trial 133 with value: 0.07401608033989727.
2026-05-19 04:23:33,321 - experiment_functions - INFO - Early stopping at epoch 1200. Best Recall: 0.0676
2026-05-19 04:23:33,412 - optuna.study.study - INFO - Trial 238 finished with value: 0.06758665055033376 and parameters: {'n_layers': 1, 'embedding_dim': 32, 'lr': 0.0011488657126330747, 'lambda_val': 0.0009027002747093216, 'batch_size': 828, 'optimizer': 'Adam'}. Best is trial 133 with value: 0.07401608033989727.
2026-05-19 04:23:47,526 - optuna.study._optimize - INFO - Trial 239 pruned. 
2026-05-19 04:24:14,144 - experiment_functions - INFO - Early stopping at epoch 1200. Best Recall: 0.0684
2026-05-19 04:24:14,243 - optuna.study.study - INFO - Trial 240 finished with value: 0.06842857835039767 and parameters: {'n_layers': 1, 'embedding_dim': 32, 'lr': 0.0014302340693006829, 'lambda_val': 0.0006097501129405734, 'batch_size': 702, 'optimizer': 'Adam'}. Best is trial 133 with value: 0.07401608033989727.
2026-05-19 04:24:35,376 - optuna.study._optimize - INFO - Trial 241 pruned. 
2026-05-19 04:24:52,555 - experiment_functions - INFO - Early stopping at epoch 1200. Best Recall: 0.0657
2026-05-19 04:24:52,656 - optuna.study.study - INFO - Trial 242 finished with value: 0.0657173737977879 and parameters: {'n_layers': 1, 'embedding_dim': 32, 'lr': 0.0012988731062648872, 'lambda_val': 0.0005727197052707556, 'batch_size': 663, 'optimizer': 'Adam'}. Best is trial 133 with value: 0.07401608033989727.
2026-05-19 04:25:27,347 - experiment_functions - INFO - Early stopping at epoch 1650. Best Recall: 0.0685
2026-05-19 04:25:28,120 - optuna.study.study - INFO - Trial 243 finished with value: 0.06852009588314655 and parameters: {'n_layers': 1, 'embedding_dim': 32, 'lr': 0.0009608020578671984, 'lambda_val': 0.0007808504392285306, 'batch_size': 766, 'optimizer': 'Adam'}. Best is trial 133 with value: 0.07401608033989727.
2026-05-19 04:25:52,304 - experiment_functions - INFO - Early stopping at epoch 1500. Best Recall: 0.0722
2026-05-19 04:25:52,399 - optuna.study.study - INFO - Trial 244 finished with value: 0.0722119732697272 and parameters: {'n_layers': 1, 'embedding_dim': 32, 'lr': 0.0012041598420971043, 'lambda_val': 0.0003760192045820295, 'batch_size': 577, 'optimizer': 'Adam'}. Best is trial 133 with value: 0.07401608033989727.
2026-05-19 04:26:07,663 - experiment_functions - INFO - Early stopping at epoch 1050. Best Recall: 0.0675
2026-05-19 04:26:07,731 - optuna.study.study - INFO - Trial 245 finished with value: 0.06750324287080535 and parameters: {'n_layers': 1, 'embedding_dim': 32, 'lr': 0.001574752529429455, 'lambda_val': 0.000386438266597952, 'batch_size': 574, 'optimizer': 'Adam'}. Best is trial 133 with value: 0.07401608033989727.
2026-05-19 04:26:21,382 - optuna.study._optimize - INFO - Trial 246 pruned. 
2026-05-19 04:26:34,066 - experiment_functions - INFO - Early stopping at epoch 900. Best Recall: 0.0651
2026-05-19 04:26:34,136 - optuna.study.study - INFO - Trial 247 finished with value: 0.06510315526358791 and parameters: {'n_layers': 1, 'embedding_dim': 32, 'lr': 0.001959398848194611, 'lambda_val': 0.0014902842296309806, 'batch_size': 585, 'optimizer': 'Adam'}. Best is trial 133 with value: 0.07401608033989727.
2026-05-19 04:26:45,479 - experiment_functions - INFO - Early stopping at epoch 700. Best Recall: 0.0570
