2026-05-18 01:53:18,266 - optuna.study._optimize - INFO - Trial 219 pruned. 
2026-05-18 01:53:32,290 - experiment_functions - INFO - Early stopping at epoch 1000. Best Recall: 0.0663
2026-05-18 01:53:32,393 - optuna.study.study - INFO - Trial 220 finished with value: 0.06633737715430012 and parameters: {'n_layers': 1, 'embedding_dim': 64, 'lr': 0.0011830052754286588, 'lambda_val': 1.2084545221367848e-05, 'batch_size': 590, 'optimizer': 'RMSprop'}. Best is trial 161 with value: 0.0732140772759469.
2026-05-18 01:53:57,909 - experiment_functions - INFO - Early stopping at epoch 1850. Best Recall: 0.0699
2026-05-18 01:53:58,015 - optuna.study.study - INFO - Trial 221 finished with value: 0.0699373439207124 and parameters: {'n_layers': 1, 'embedding_dim': 64, 'lr': 0.0007732097706867302, 'lambda_val': 1.2675626145988097e-05, 'batch_size': 570, 'optimizer': 'RMSprop'}. Best is trial 161 with value: 0.0732140772759469.
2026-05-18 01:54:29,590 - experiment_functions - INFO - Early stopping at epoch 2350. Best Recall: 0.0701
2026-05-18 01:54:29,683 - optuna.study.study - INFO - Trial 222 finished with value: 0.07008454902681761 and parameters: {'n_layers': 1, 'embedding_dim': 64, 'lr': 0.0006864438525101847, 'lambda_val': 1.67737231571094e-05, 'batch_size': 575, 'optimizer': 'RMSprop'}. Best is trial 161 with value: 0.0732140772759469.
2026-05-18 01:54:43,343 - optuna.study._optimize - INFO - Trial 223 pruned. 
2026-05-18 01:54:58,255 - experiment_functions - INFO - Early stopping at epoch 950. Best Recall: 0.0604
2026-05-18 01:54:58,347 - optuna.study.study - INFO - Trial 224 finished with value: 0.06035273637720096 and parameters: {'n_layers': 1, 'embedding_dim': 128, 'lr': 0.0009306505752851496, 'lambda_val': 8.682960716386488e-06, 'batch_size': 690, 'optimizer': 'RMSprop'}. Best is trial 161 with value: 0.0732140772759469.
2026-05-18 01:55:12,505 - optuna.study._optimize - INFO - Trial 225 pruned. 
2026-05-18 01:55:28,752 - optuna.study._optimize - INFO - Trial 226 pruned. 
2026-05-18 01:55:47,883 - optuna.study._optimize - INFO - Trial 227 pruned. 
2026-05-18 01:56:01,280 - optuna.study._optimize - INFO - Trial 228 pruned. 
2026-05-18 01:56:15,239 - optuna.study._optimize - INFO - Trial 229 pruned. 
2026-05-18 01:56:25,323 - experiment_functions - INFO - Early stopping at epoch 750. Best Recall: 0.0085
2026-05-18 01:56:25,417 - optuna.study.study - INFO - Trial 230 finished with value: 0.008491983057027044 and parameters: {'n_layers': 1, 'embedding_dim': 64, 'lr': 0.06451925215622187, 'lambda_val': 1.784262205975393e-05, 'batch_size': 691, 'optimizer': 'RMSprop'}. Best is trial 161 with value: 0.0732140772759469.
2026-05-18 01:56:44,805 - optuna.study._optimize - INFO - Trial 231 pruned. 
2026-05-18 01:57:11,488 - experiment_functions - INFO - Early stopping at epoch 2050. Best Recall: 0.0707
2026-05-18 01:57:11,637 - optuna.study.study - INFO - Trial 232 finished with value: 0.07071293568395723 and parameters: {'n_layers': 1, 'embedding_dim': 64, 'lr': 0.0007417846345620608, 'lambda_val': 1.1926490318535452e-05, 'batch_size': 644, 'optimizer': 'RMSprop'}. Best is trial 161 with value: 0.0732140772759469.
2026-05-18 01:57:27,196 - optuna.study._optimize - INFO - Trial 233 pruned. 
2026-05-18 01:57:53,659 - experiment_functions - INFO - Early stopping at epoch 1650. Best Recall: 0.0733
2026-05-18 01:57:53,769 - optuna.study.study - INFO - Trial 234 finished with value: 0.07325291163305202 and parameters: {'n_layers': 1, 'embedding_dim': 64, 'lr': 0.0007326462634849051, 'lambda_val': 7.801833317110955e-06, 'batch_size': 720, 'optimizer': 'RMSprop'}. Best is trial 234 with value: 0.07325291163305202.
2026-05-18 01:58:07,811 - optuna.study._optimize - INFO - Trial 235 pruned. 
2026-05-18 01:58:23,209 - optuna.study._optimize - INFO - Trial 236 pruned. 
2026-05-18 01:58:37,213 - optuna.study._optimize - INFO - Trial 237 pruned. 
2026-05-18 01:58:50,643 - experiment_functions - INFO - Early stopping at epoch 850. Best Recall: 0.0557
2026-05-18 01:58:50,792 - optuna.study.study - INFO - Trial 238 finished with value: 0.05574841492886089 and parameters: {'n_layers': 1, 'embedding_dim': 64, 'lr': 0.0006973287345346746, 'lambda_val': 1.4209635270986336e-05, 'batch_size': 3787, 'optimizer': 'RMSprop'}. Best is trial 234 with value: 0.07325291163305202.
2026-05-18 01:58:57,924 - experiment_functions - INFO - Early stopping at epoch 500. Best Recall: 0.0054
2026-05-18 01:58:58,029 - optuna.study.study - INFO - Trial 239 finished with value: 0.0053739678546869145 and parameters: {'n_layers': 1, 'embedding_dim': 64, 'lr': 0.0005355487617481102, 'lambda_val': 2.09487615097219e-05, 'batch_size': 708, 'optimizer': 'SGD'}. Best is trial 234 with value: 0.07325291163305202.
2026-05-18 01:59:20,223 - optuna.study._optimize - INFO - Trial 240 pruned. 
2026-05-18 01:59:33,762 - optuna.study._optimize - INFO - Trial 241 pruned. 
2026-05-18 01:59:47,402 - optuna.study._optimize - INFO - Trial 242 pruned. 
2026-05-18 02:00:00,211 - optuna.study._optimize - INFO - Trial 243 pruned. 
2026-05-18 02:00:20,556 - experiment_functions - INFO - Early stopping at epoch 1550. Best Recall: 0.0676
2026-05-18 02:00:20,649 - optuna.study.study - INFO - Trial 244 finished with value: 0.06759085907161841 and parameters: {'n_layers': 1, 'embedding_dim': 64, 'lr': 0.0008344053516077379, 'lambda_val': 1.0262938799514889e-05, 'batch_size': 723, 'optimizer': 'RMSprop'}. Best is trial 234 with value: 0.07325291163305202.
2026-05-18 02:00:36,259 - optuna.study._optimize - INFO - Trial 245 pruned. 
2026-05-18 02:00:49,977 - experiment_functions - INFO - Early stopping at epoch 1000. Best Recall: 0.0681
2026-05-18 02:00:50,092 - optuna.study.study - INFO - Trial 246 finished with value: 0.06810782787548972 and parameters: {'n_layers': 1, 'embedding_dim': 64, 'lr': 0.0010393026617843614, 'lambda_val': 1.3003388375423034e-05, 'batch_size': 804, 'optimizer': 'RMSprop'}. Best is trial 234 with value: 0.07325291163305202.
2026-05-18 02:01:03,814 - optuna.study._optimize - INFO - Trial 247 pruned. 
2026-05-18 02:01:20,314 - experiment_functions - INFO - Early stopping at epoch 1200. Best Recall: 0.0679
2026-05-18 02:01:20,417 - optuna.study.study - INFO - Trial 248 finished with value: 0.06793237181177701 and parameters: {'n_layers': 1, 'embedding_dim': 64, 'lr': 0.0009210831365038558, 'lambda_val': 9.413225455828389e-06, 'batch_size': 579, 'optimizer': 'RMSprop'}. Best is trial 234 with value: 0.07325291163305202.
2026-05-18 02:01:34,047 - optuna.study._optimize - INFO - Trial 249 pruned. 
2026-05-18 02:01:47,399 - optuna.study._optimize - INFO - Trial 250 pruned. 
2026-05-18 02:02:01,479 - optuna.study._optimize - INFO - Trial 251 pruned. 
2026-05-18 02:02:24,153 - experiment_functions - INFO - Early stopping at epoch 1550. Best Recall: 0.0681
2026-05-18 02:02:24,256 - optuna.study.study - INFO - Trial 252 finished with value: 0.06806974266738411 and parameters: {'n_layers': 1, 'embedding_dim': 64, 'lr': 0.000810405602114982, 'lambda_val': 1.813169889355784e-05, 'batch_size': 636, 'optimizer': 'RMSprop'}. Best is trial 234 with value: 0.07325291163305202.
2026-05-18 02:02:36,417 - experiment_functions - INFO - Early stopping at epoch 850. Best Recall: 0.0634
2026-05-18 02:02:36,533 - optuna.study.study - INFO - Trial 253 finished with value: 0.06335870828104746 and parameters: {'n_layers': 1, 'embedding_dim': 64, 'lr': 0.0012377672716672198, 'lambda_val': 1.0313358341031154e-05, 'batch_size': 850, 'optimizer': 'RMSprop'}. Best is trial 234 with value: 0.07325291163305202.
2026-05-18 02:02:45,802 - experiment_functions - INFO - Early stopping at epoch 600. Best Recall: 0.0333
2026-05-18 02:02:45,894 - optuna.study.study - INFO - Trial 254 finished with value: 0.03328752388573111 and parameters: {'n_layers': 4, 'embedding_dim': 64, 'lr': 0.000983188750814467, 'lambda_val': 5.023721922935851e-06, 'batch_size': 572, 'optimizer': 'RMSprop'}. Best is trial 234 with value: 0.07325291163305202.
2026-05-18 02:02:59,702 - optuna.study._optimize - INFO - Trial 255 pruned. 
2026-05-18 02:03:12,927 - optuna.study._optimize - INFO - Trial 256 pruned. 
2026-05-18 02:03:27,102 - optuna.study._optimize - INFO - Trial 257 pruned. 
2026-05-18 02:03:40,532 - optuna.study._optimize - INFO - Trial 258 pruned. 
2026-05-18 02:03:54,166 - optuna.study._optimize - INFO - Trial 259 pruned. 
2026-05-18 02:04:08,535 - optuna.study._optimize - INFO - Trial 260 pruned. 
2026-05-18 02:04:23,312 - optuna.study._optimize - INFO - Trial 261 pruned. 
2026-05-18 02:04:43,052 - experiment_functions - INFO - Early stopping at epoch 1350. Best Recall: 0.0713
2026-05-18 02:04:43,166 - optuna.study.study - INFO - Trial 262 finished with value: 0.07133319460144003 and parameters: {'n_layers': 1, 'embedding_dim': 64, 'lr': 0.0009106277132339947, 'lambda_val': 1.0703124804817215e-05, 'batch_size': 621, 'optimizer': 'RMSprop'}. Best is trial 234 with value: 0.07325291163305202.
2026-05-18 02:04:56,078 - experiment_functions - INFO - Early stopping at epoch 850. Best Recall: 0.0638
2026-05-18 02:04:56,172 - optuna.study.study - INFO - Trial 263 finished with value: 0.06380055186977732 and parameters: {'n_layers': 1, 'embedding_dim': 64, 'lr': 0.0013769725790158294, 'lambda_val': 1.064187601728886e-05, 'batch_size': 627, 'optimizer': 'RMSprop'}. Best is trial 234 with value: 0.07325291163305202.
2026-05-18 02:05:10,851 - experiment_functions - INFO - Early stopping at epoch 1050. Best Recall: 0.0664
2026-05-18 02:05:10,943 - optuna.study.study - INFO - Trial 264 finished with value: 0.06636189289264377 and parameters: {'n_layers': 1, 'embedding_dim': 64, 'lr': 0.0009438519120364549, 'lambda_val': 1.4545431031647798e-05, 'batch_size': 765, 'optimizer': 'RMSprop'}. Best is trial 234 with value: 0.07325291163305202.
2026-05-18 02:05:35,275 - experiment_functions - INFO - Early stopping at epoch 1700. Best Recall: 0.0676
2026-05-18 02:05:35,367 - optuna.study.study - INFO - Trial 265 finished with value: 0.0676428782997063 and parameters: {'n_layers': 1, 'embedding_dim': 64, 'lr': 0.0008545878299190921, 'lambda_val': 1.133772706327927e-05, 'batch_size': 512, 'optimizer': 'RMSprop'}. Best is trial 234 with value: 0.07325291163305202.
2026-05-18 02:05:51,703 - optuna.study._optimize - INFO - Trial 266 pruned. 
2026-05-18 02:05:59,148 - experiment_functions - INFO - Early stopping at epoch 500. Best Recall: 0.0053
2026-05-18 02:05:59,240 - optuna.study.study - INFO - Trial 267 finished with value: 0.005265136390530233 and parameters: {'n_layers': 1, 'embedding_dim': 64, 'lr': 0.0007250673752574294, 'lambda_val': 1.501056755243992e-05, 'batch_size': 691, 'optimizer': 'SGD'}. Best is trial 234 with value: 0.07325291163305202.
2026-05-18 02:06:22,553 - optuna.study._optimize - INFO - Trial 268 pruned. 
2026-05-18 02:06:37,172 - optuna.study._optimize - INFO - Trial 269 pruned. 
2026-05-18 02:06:59,262 - experiment_functions - INFO - Early stopping at epoch 1500. Best Recall: 0.0677
2026-05-18 02:06:59,409 - optuna.study.study - INFO - Trial 270 finished with value: 0.06766895403236371 and parameters: {'n_layers': 1, 'embedding_dim': 64, 'lr': 0.0007703845309911071, 'lambda_val': 2.6044813477720308e-05, 'batch_size': 725, 'optimizer': 'RMSprop'}. Best is trial 234 with value: 0.07325291163305202.
2026-05-18 02:07:14,266 - optuna.study._optimize - INFO - Trial 271 pruned. 
2026-05-18 02:07:28,928 - optuna.study._optimize - INFO - Trial 272 pruned. 
2026-05-18 02:07:43,338 - optuna.study._optimize - INFO - Trial 273 pruned. 
2026-05-18 02:08:02,769 - experiment_functions - INFO - Early stopping at epoch 1300. Best Recall: 0.0688
2026-05-18 02:08:02,926 - optuna.study.study - INFO - Trial 274 finished with value: 0.06879971862336705 and parameters: {'n_layers': 1, 'embedding_dim': 64, 'lr': 0.000973522269908494, 'lambda_val': 1.9890084007194926e-05, 'batch_size': 574, 'optimizer': 'RMSprop'}. Best is trial 234 with value: 0.07325291163305202.
2026-05-18 02:08:39,374 - experiment_functions - INFO - Early stopping at epoch 2500. Best Recall: 0.0691
2026-05-18 02:08:39,464 - optuna.study.study - INFO - Trial 275 finished with value: 0.06908763596869838 and parameters: {'n_layers': 1, 'embedding_dim': 64, 'lr': 0.0006951252431550984, 'lambda_val': 0.000392622518988363, 'batch_size': 640, 'optimizer': 'RMSprop'}. Best is trial 234 with value: 0.07325291163305202.
2026-05-18 02:08:53,944 - optuna.study._optimize - INFO - Trial 276 pruned. 
2026-05-18 02:09:10,127 - optuna.study._optimize - INFO - Trial 277 pruned. 
2026-05-18 02:09:24,360 - optuna.study._optimize - INFO - Trial 278 pruned. 
2026-05-18 02:09:40,506 - optuna.study._optimize - INFO - Trial 279 pruned. 
2026-05-18 02:09:54,925 - optuna.study._optimize - INFO - Trial 280 pruned. 
2026-05-18 02:10:06,520 - experiment_functions - INFO - Early stopping at epoch 800. Best Recall: 0.0052
2026-05-18 02:10:06,631 - optuna.study.study - INFO - Trial 281 finished with value: 0.005223585380742632 and parameters: {'n_layers': 1, 'embedding_dim': 64, 'lr': 1.011466571458319e-05, 'lambda_val': 3.805689313917201e-06, 'batch_size': 765, 'optimizer': 'Adam'}. Best is trial 234 with value: 0.07325291163305202.
2026-05-18 02:10:27,235 - experiment_functions - INFO - Early stopping at epoch 1400. Best Recall: 0.0678
2026-05-18 02:10:27,325 - optuna.study.study - INFO - Trial 282 finished with value: 0.06782538628556394 and parameters: {'n_layers': 1, 'embedding_dim': 64, 'lr': 0.0008213827069015499, 'lambda_val': 2.211710051898858e-05, 'batch_size': 697, 'optimizer': 'RMSprop'}. Best is trial 234 with value: 0.07325291163305202.
2026-05-18 02:10:43,385 - optuna.study._optimize - INFO - Trial 283 pruned. 
2026-05-18 02:10:58,374 - optuna.study._optimize - INFO - Trial 284 pruned. 
2026-05-18 02:11:11,859 - optuna.study._optimize - INFO - Trial 285 pruned. 
2026-05-18 02:11:23,069 - experiment_functions - INFO - Early stopping at epoch 800. Best Recall: 0.0637
2026-05-18 02:11:23,160 - optuna.study.study - INFO - Trial 286 finished with value: 0.0637334175672825 and parameters: {'n_layers': 1, 'embedding_dim': 64, 'lr': 0.0011126600531495526, 'lambda_val': 0.0072576230037810835, 'batch_size': 714, 'optimizer': 'RMSprop'}. Best is trial 234 with value: 0.07325291163305202.
2026-05-18 02:11:38,069 - optuna.study._optimize - INFO - Trial 287 pruned. 
2026-05-18 02:11:45,436 - experiment_functions - INFO - Early stopping at epoch 500. Best Recall: 0.0054
2026-05-18 02:11:45,526 - optuna.study.study - INFO - Trial 288 finished with value: 0.0053512809854315505 and parameters: {'n_layers': 2, 'embedding_dim': 96, 'lr': 0.0008466494650542925, 'lambda_val': 6.9268509789349e-06, 'batch_size': 659, 'optimizer': 'SGD'}. Best is trial 234 with value: 0.07325291163305202.
2026-05-18 02:11:59,394 - optuna.study._optimize - INFO - Trial 289 pruned. 
2026-05-18 02:12:23,265 - experiment_functions - INFO - Early stopping at epoch 1800. Best Recall: 0.0691
2026-05-18 02:12:23,356 - optuna.study.study - INFO - Trial 290 finished with value: 0.06914692282145289 and parameters: {'n_layers': 1, 'embedding_dim': 64, 'lr': 0.0006787998431004318, 'lambda_val': 0.0005600067109824429, 'batch_size': 760, 'optimizer': 'RMSprop'}. Best is trial 234 with value: 0.07325291163305202.
2026-05-18 02:12:40,159 - experiment_functions - INFO - Early stopping at epoch 1200. Best Recall: 0.0662
2026-05-18 02:12:40,257 - optuna.study.study - INFO - Trial 291 finished with value: 0.06617211221798672 and parameters: {'n_layers': 1, 'embedding_dim': 64, 'lr': 0.0008830192559104895, 'lambda_val': 1.3300206803840052e-05, 'batch_size': 911, 'optimizer': 'RMSprop'}. Best is trial 234 with value: 0.07325291163305202.
2026-05-18 02:12:49,073 - experiment_functions - INFO - Early stopping at epoch 550. Best Recall: 0.0267
2026-05-18 02:12:49,174 - optuna.study.study - INFO - Trial 292 finished with value: 0.026712553037794216 and parameters: {'n_layers': 3, 'embedding_dim': 64, 'lr': 0.001338863718703801, 'lambda_val': 0.0006112832171654417, 'batch_size': 769, 'optimizer': 'RMSprop'}. Best is trial 234 with value: 0.07325291163305202.
2026-05-18 02:13:03,775 - experiment_functions - INFO - Early stopping at epoch 950. Best Recall: 0.0655
2026-05-18 02:13:03,883 - optuna.study.study - INFO - Trial 293 finished with value: 0.06547041549836706 and parameters: {'n_layers': 1, 'embedding_dim': 64, 'lr': 0.0010067536098665826, 'lambda_val': 4.69244738065952e-06, 'batch_size': 849, 'optimizer': 'RMSprop'}. Best is trial 234 with value: 0.07325291163305202.
2026-05-18 02:13:21,496 - optuna.study._optimize - INFO - Trial 294 pruned. 
2026-05-18 02:13:44,726 - experiment_functions - INFO - Early stopping at epoch 1500. Best Recall: 0.0694
2026-05-18 02:13:44,873 - optuna.study.study - INFO - Trial 295 finished with value: 0.06940274740459093 and parameters: {'n_layers': 1, 'embedding_dim': 64, 'lr': 0.0007604867769715417, 'lambda_val': 0.0008052131454432568, 'batch_size': 718, 'optimizer': 'RMSprop'}. Best is trial 234 with value: 0.07325291163305202.
2026-05-18 02:14:06,747 - optuna.study._optimize - INFO - Trial 296 pruned. 
2026-05-18 02:14:21,454 - optuna.study._optimize - INFO - Trial 297 pruned. 
2026-05-18 02:14:34,671 - optuna.study._optimize - INFO - Trial 298 pruned. 
2026-05-18 02:14:58,883 - experiment_functions - INFO - Early stopping at epoch 1800. Best Recall: 0.0703
2026-05-18 02:14:59,020 - optuna.study.study - INFO - Trial 299 finished with value: 0.07029673921560707 and parameters: {'n_layers': 1, 'embedding_dim': 64, 'lr': 0.0007589308106003083, 'lambda_val': 8.149028917756684e-06, 'batch_size': 514, 'optimizer': 'RMSprop'}. Best is trial 234 with value: 0.07325291163305202.
2026-05-18 02:15:21,084 - experiment_functions - INFO - Early stopping at epoch 2050. Best Recall: 0.0663
2026-05-18 02:15:21,988 - root - INFO -   **** Training e_1M_1c1dcs_rand2
2026-05-18 02:15:22,044 - root - INFO -   **** Getting 190231/805443 random edges
2026-05-18 02:15:23,194 - optuna.storages._rdb.storage - INFO - A new study created in RDB with name: Study_e_1M_1c1dcs_rand2
2026-05-18 02:16:08,763 - experiment_functions - INFO - Early stopping at epoch 2250. Best Recall: 0.0060
2026-05-18 02:16:08,916 - optuna.study.study - INFO - Trial 0 finished with value: 0.0060462950587892045 and parameters: {'n_layers': 4, 'embedding_dim': 96, 'lr': 1.0793048418891873e-05, 'lambda_val': 2.6938254276200103e-06, 'batch_size': 2255, 'optimizer': 'Adam'}. Best is trial 0 with value: 0.0060462950587892045.
2026-05-18 02:16:30,439 - experiment_functions - INFO - Early stopping at epoch 1500. Best Recall: 0.0208
2026-05-18 02:16:30,578 - optuna.study.study - INFO - Trial 1 finished with value: 0.020786391252667527 and parameters: {'n_layers': 1, 'embedding_dim': 256, 'lr': 0.015920262955760475, 'lambda_val': 0.021390283558857515, 'batch_size': 1613, 'optimizer': 'RMSprop'}. Best is trial 1 with value: 0.020786391252667527.
2026-05-18 02:17:41,915 - optuna.study.study - INFO - Trial 2 finished with value: 0.010402118093205405 and parameters: {'n_layers': 1, 'embedding_dim': 32, 'lr': 0.00012281576112047046, 'lambda_val': 4.9006712407031795e-05, 'batch_size': 3961, 'optimizer': 'Adam'}. Best is trial 1 with value: 0.020786391252667527.
2026-05-18 02:18:53,328 - optuna.study.study - INFO - Trial 3 finished with value: 0.01121856055402817 and parameters: {'n_layers': 4, 'embedding_dim': 256, 'lr': 4.9524872458442875e-05, 'lambda_val': 2.4989472400366526e-06, 'batch_size': 515, 'optimizer': 'RMSprop'}. Best is trial 1 with value: 0.020786391252667527.
2026-05-18 02:19:10,679 - experiment_functions - INFO - Early stopping at epoch 500. Best Recall: 0.0039
2026-05-18 02:19:10,770 - optuna.study.study - INFO - Trial 4 finished with value: 0.003928599022308642 and parameters: {'n_layers': 3, 'embedding_dim': 128, 'lr': 0.013400026604698908, 'lambda_val': 1.0623220129497744e-06, 'batch_size': 921, 'optimizer': 'SGD'}. Best is trial 1 with value: 0.020786391252667527.
2026-05-18 02:20:05,850 - optuna.study.study - INFO - Trial 5 finished with value: 0.016924065755484375 and parameters: {'n_layers': 2, 'embedding_dim': 96, 'lr': 0.00012608805164674496, 'lambda_val': 4.4549876689137006e-05, 'batch_size': 682, 'optimizer': 'RMSprop'}. Best is trial 1 with value: 0.020786391252667527.
2026-05-18 02:20:15,383 - experiment_functions - INFO - Early stopping at epoch 500. Best Recall: 0.0054
2026-05-18 02:20:15,474 - optuna.study.study - INFO - Trial 6 finished with value: 0.005380861126236853 and parameters: {'n_layers': 3, 'embedding_dim': 256, 'lr': 0.007301191393433696, 'lambda_val': 0.018374596844710003, 'batch_size': 3343, 'optimizer': 'SGD'}. Best is trial 1 with value: 0.020786391252667527.
2026-05-18 02:20:22,849 - experiment_functions - INFO - Early stopping at epoch 500. Best Recall: 0.0050
2026-05-18 02:20:22,985 - optuna.study.study - INFO - Trial 7 finished with value: 0.004958993021487272 and parameters: {'n_layers': 1, 'embedding_dim': 64, 'lr': 0.002236597721448199, 'lambda_val': 8.200408351670989e-05, 'batch_size': 3817, 'optimizer': 'SGD'}. Best is trial 1 with value: 0.020786391252667527.
2026-05-18 02:20:33,302 - experiment_functions - INFO - Early stopping at epoch 650. Best Recall: 0.0316
2026-05-18 02:20:33,395 - optuna.study.study - INFO - Trial 8 finished with value: 0.031625216728020815 and parameters: {'n_layers': 4, 'embedding_dim': 32, 'lr': 0.000728305004454743, 'lambda_val': 7.185003867525426e-06, 'batch_size': 2018, 'optimizer': 'RMSprop'}. Best is trial 8 with value: 0.031625216728020815.
2026-05-18 02:21:58,242 - optuna.study.study - INFO - Trial 9 finished with value: 0.03439506216236266 and parameters: {'n_layers': 4, 'embedding_dim': 256, 'lr': 8.224620188879725e-05, 'lambda_val': 0.000213616487667139, 'batch_size': 2641, 'optimizer': 'Adam'}. Best is trial 9 with value: 0.03439506216236266.
2026-05-18 02:22:24,320 - experiment_functions - INFO - Early stopping at epoch 1800. Best Recall: 0.0222
