2026-05-18 00:21:12,422 - optuna.study.study - INFO - Trial 229 finished with value: 0.08432268917649621 and parameters: {'n_layers': 1, 'embedding_dim': 256, 'lr': 0.001928783311027447, 'lambda_val': 2.0394306679703132e-05, 'batch_size': 3296, 'optimizer': 'Adam'}. Best is trial 135 with value: 0.08639900718181048.
2026-05-18 00:21:28,363 - optuna.study._optimize - INFO - Trial 230 pruned. 
2026-05-18 00:22:19,736 - experiment_functions - INFO - Early stopping at epoch 2750. Best Recall: 0.0845
2026-05-18 00:22:19,901 - optuna.study.study - INFO - Trial 231 finished with value: 0.08446126512764882 and parameters: {'n_layers': 1, 'embedding_dim': 256, 'lr': 0.0017706146257179, 'lambda_val': 1.7147602194791873e-05, 'batch_size': 3349, 'optimizer': 'Adam'}. Best is trial 135 with value: 0.08639900718181048.
2026-05-18 00:22:55,085 - experiment_functions - INFO - Early stopping at epoch 2300. Best Recall: 0.0850
2026-05-18 00:22:55,219 - optuna.study.study - INFO - Trial 232 finished with value: 0.08500438492019728 and parameters: {'n_layers': 1, 'embedding_dim': 256, 'lr': 0.001796079171254198, 'lambda_val': 1.4760645663291874e-05, 'batch_size': 3331, 'optimizer': 'Adam'}. Best is trial 135 with value: 0.08639900718181048.
2026-05-18 00:23:11,060 - optuna.study._optimize - INFO - Trial 233 pruned. 
2026-05-18 00:23:27,091 - optuna.study._optimize - INFO - Trial 234 pruned. 
2026-05-18 00:24:11,037 - experiment_functions - INFO - Early stopping at epoch 2900. Best Recall: 0.0843
2026-05-18 00:24:11,137 - optuna.study.study - INFO - Trial 235 finished with value: 0.08426316276383794 and parameters: {'n_layers': 1, 'embedding_dim': 256, 'lr': 0.0017891315675335477, 'lambda_val': 1.7274596263975793e-05, 'batch_size': 3242, 'optimizer': 'Adam'}. Best is trial 135 with value: 0.08639900718181048.
2026-05-18 00:24:29,498 - optuna.study._optimize - INFO - Trial 236 pruned. 
2026-05-18 00:24:37,683 - experiment_functions - INFO - Early stopping at epoch 500. Best Recall: 0.0050
2026-05-18 00:24:37,836 - optuna.study.study - INFO - Trial 237 finished with value: 0.0050459061310167315 and parameters: {'n_layers': 1, 'embedding_dim': 256, 'lr': 0.0024955344354382764, 'lambda_val': 2.683754238980104e-05, 'batch_size': 3285, 'optimizer': 'SGD'}. Best is trial 135 with value: 0.08639900718181048.
2026-05-18 00:24:54,722 - optuna.study._optimize - INFO - Trial 238 pruned. 
2026-05-18 00:25:22,530 - optuna.study._optimize - INFO - Trial 239 pruned. 
2026-05-18 00:25:39,982 - experiment_functions - INFO - Early stopping at epoch 650. Best Recall: 0.0653
2026-05-18 00:25:40,071 - optuna.study.study - INFO - Trial 240 finished with value: 0.06525513841596149 and parameters: {'n_layers': 1, 'embedding_dim': 96, 'lr': 0.001719186949569742, 'lambda_val': 2.003138056870989e-05, 'batch_size': 3372, 'optimizer': 'Adam'}. Best is trial 135 with value: 0.08639900718181048.
2026-05-18 00:25:56,077 - optuna.study._optimize - INFO - Trial 241 pruned. 
2026-05-18 00:26:12,329 - optuna.study._optimize - INFO - Trial 242 pruned. 
2026-05-18 00:26:28,657 - optuna.study._optimize - INFO - Trial 243 pruned. 
2026-05-18 00:26:46,444 - optuna.study._optimize - INFO - Trial 244 pruned. 
2026-05-18 00:27:02,432 - optuna.study._optimize - INFO - Trial 245 pruned. 
2026-05-18 00:27:18,017 - optuna.study._optimize - INFO - Trial 246 pruned. 
2026-05-18 00:27:31,969 - experiment_functions - INFO - Early stopping at epoch 850. Best Recall: 0.0631
2026-05-18 00:27:32,059 - optuna.study.study - INFO - Trial 247 finished with value: 0.06306088831737038 and parameters: {'n_layers': 1, 'embedding_dim': 32, 'lr': 0.0011984265764184007, 'lambda_val': 1.0375078011015306e-05, 'batch_size': 3061, 'optimizer': 'Adam'}. Best is trial 135 with value: 0.08639900718181048.
2026-05-18 00:27:47,624 - optuna.study._optimize - INFO - Trial 248 pruned. 
2026-05-18 00:28:08,605 - optuna.study._optimize - INFO - Trial 249 pruned. 
2026-05-18 00:28:50,986 - optuna.study._optimize - INFO - Trial 250 pruned. 
2026-05-18 00:29:01,620 - experiment_functions - INFO - Early stopping at epoch 550. Best Recall: 0.0385
2026-05-18 00:29:01,720 - optuna.study.study - INFO - Trial 251 finished with value: 0.038477810923968285 and parameters: {'n_layers': 3, 'embedding_dim': 256, 'lr': 0.0017866700420083466, 'lambda_val': 6.7658230653115495e-06, 'batch_size': 3226, 'optimizer': 'Adam'}. Best is trial 135 with value: 0.08639900718181048.
2026-05-18 00:29:18,129 - optuna.study._optimize - INFO - Trial 252 pruned. 
2026-05-18 00:29:31,754 - experiment_functions - INFO - Early stopping at epoch 850. Best Recall: 0.0795
2026-05-18 00:29:31,845 - optuna.study.study - INFO - Trial 253 finished with value: 0.0794727417062859 and parameters: {'n_layers': 1, 'embedding_dim': 256, 'lr': 0.0014020523572917491, 'lambda_val': 1.500562918738667e-06, 'batch_size': 3172, 'optimizer': 'Adam'}. Best is trial 135 with value: 0.08639900718181048.
2026-05-18 00:29:41,875 - experiment_functions - INFO - Early stopping at epoch 650. Best Recall: 0.0681
2026-05-18 00:29:41,964 - optuna.study.study - INFO - Trial 254 finished with value: 0.06813799200871604 and parameters: {'n_layers': 1, 'embedding_dim': 64, 'lr': 0.00217559401410578, 'lambda_val': 0.00038507831047389216, 'batch_size': 2596, 'optimizer': 'Adam'}. Best is trial 135 with value: 0.08639900718181048.
2026-05-18 00:30:06,403 - experiment_functions - INFO - Early stopping at epoch 1550. Best Recall: 0.0829
2026-05-18 00:30:06,549 - optuna.study.study - INFO - Trial 255 finished with value: 0.08288702973426897 and parameters: {'n_layers': 1, 'embedding_dim': 256, 'lr': 0.0015834392412119528, 'lambda_val': 7.775119988042615e-06, 'batch_size': 3054, 'optimizer': 'Adam'}. Best is trial 135 with value: 0.08639900718181048.
2026-05-18 00:30:24,124 - optuna.study._optimize - INFO - Trial 256 pruned. 
2026-05-18 00:31:22,841 - experiment_functions - INFO - Early stopping at epoch 3700. Best Recall: 0.0858
2026-05-18 00:31:22,964 - optuna.study.study - INFO - Trial 257 finished with value: 0.08575890665601438 and parameters: {'n_layers': 1, 'embedding_dim': 256, 'lr': 0.0018294010400256727, 'lambda_val': 2.4430007201453206e-06, 'batch_size': 2907, 'optimizer': 'Adam'}. Best is trial 135 with value: 0.08639900718181048.
2026-05-18 00:31:39,543 - optuna.study._optimize - INFO - Trial 258 pruned. 
2026-05-18 00:32:09,350 - optuna.study._optimize - INFO - Trial 259 pruned. 
2026-05-18 00:32:24,885 - optuna.study._optimize - INFO - Trial 260 pruned. 
2026-05-18 00:32:48,103 - experiment_functions - INFO - Early stopping at epoch 1500. Best Recall: 0.0835
2026-05-18 00:32:48,246 - optuna.study.study - INFO - Trial 261 finished with value: 0.08354449174616065 and parameters: {'n_layers': 1, 'embedding_dim': 256, 'lr': 0.002608740236569298, 'lambda_val': 3.482959813825913e-06, 'batch_size': 3114, 'optimizer': 'Adam'}. Best is trial 135 with value: 0.08639900718181048.
2026-05-18 00:33:04,748 - optuna.study._optimize - INFO - Trial 262 pruned. 
2026-05-18 00:33:20,216 - optuna.study._optimize - INFO - Trial 263 pruned. 
2026-05-18 00:33:28,437 - experiment_functions - INFO - Early stopping at epoch 500. Best Recall: 0.0049
2026-05-18 00:33:28,528 - optuna.study.study - INFO - Trial 264 finished with value: 0.004911221008254815 and parameters: {'n_layers': 1, 'embedding_dim': 256, 'lr': 0.021785395340586586, 'lambda_val': 2.581599154815676e-06, 'batch_size': 2907, 'optimizer': 'SGD'}. Best is trial 135 with value: 0.08639900718181048.
2026-05-18 00:33:55,748 - optuna.study._optimize - INFO - Trial 265 pruned. 
2026-05-18 00:34:26,531 - experiment_functions - INFO - Early stopping at epoch 1850. Best Recall: 0.0833
2026-05-18 00:34:26,640 - optuna.study.study - INFO - Trial 266 finished with value: 0.08326737566971418 and parameters: {'n_layers': 1, 'embedding_dim': 256, 'lr': 0.002332709292639088, 'lambda_val': 3.0717732918418713e-06, 'batch_size': 2520, 'optimizer': 'Adam'}. Best is trial 135 with value: 0.08639900718181048.
2026-05-18 00:34:44,638 - optuna.study._optimize - INFO - Trial 267 pruned. 
2026-05-18 00:35:04,173 - optuna.study._optimize - INFO - Trial 268 pruned. 
2026-05-18 00:35:28,672 - optuna.study._optimize - INFO - Trial 269 pruned. 
2026-05-18 00:35:43,938 - experiment_functions - INFO - Early stopping at epoch 650. Best Recall: 0.0567
2026-05-18 00:35:44,047 - optuna.study.study - INFO - Trial 270 finished with value: 0.05672904896168136 and parameters: {'n_layers': 1, 'embedding_dim': 256, 'lr': 0.001401428317768374, 'lambda_val': 0.024905730300325866, 'batch_size': 3050, 'optimizer': 'Adam'}. Best is trial 135 with value: 0.08639900718181048.
2026-05-18 00:35:54,219 - experiment_functions - INFO - Early stopping at epoch 650. Best Recall: 0.0661
2026-05-18 00:35:54,308 - optuna.study.study - INFO - Trial 271 finished with value: 0.06610620023798934 and parameters: {'n_layers': 1, 'embedding_dim': 96, 'lr': 0.0018075747990669497, 'lambda_val': 5.108008603453951e-06, 'batch_size': 2718, 'optimizer': 'Adam'}. Best is trial 135 with value: 0.08639900718181048.
2026-05-18 00:36:23,603 - optuna.study._optimize - INFO - Trial 272 pruned. 
2026-05-18 00:36:39,775 - optuna.study._optimize - INFO - Trial 273 pruned. 
2026-05-18 00:36:49,633 - experiment_functions - INFO - Early stopping at epoch 650. Best Recall: 0.0619
2026-05-18 00:36:49,734 - optuna.study.study - INFO - Trial 274 finished with value: 0.06193531044361751 and parameters: {'n_layers': 1, 'embedding_dim': 32, 'lr': 0.0016264956019008976, 'lambda_val': 3.5766547667392213e-05, 'batch_size': 2861, 'optimizer': 'RMSprop'}. Best is trial 135 with value: 0.08639900718181048.
2026-05-18 00:37:05,351 - optuna.study._optimize - INFO - Trial 275 pruned. 
2026-05-18 00:37:21,915 - optuna.study._optimize - INFO - Trial 276 pruned. 
2026-05-18 00:37:39,680 - optuna.study._optimize - INFO - Trial 277 pruned. 
2026-05-18 00:37:55,126 - optuna.study._optimize - INFO - Trial 278 pruned. 
2026-05-18 00:38:12,648 - optuna.study._optimize - INFO - Trial 279 pruned. 
2026-05-18 00:38:23,726 - experiment_functions - INFO - Early stopping at epoch 700. Best Recall: 0.0680
2026-05-18 00:38:23,826 - optuna.study.study - INFO - Trial 280 finished with value: 0.06801290423922002 and parameters: {'n_layers': 1, 'embedding_dim': 64, 'lr': 0.0012993768342853343, 'lambda_val': 1.9585014523664304e-06, 'batch_size': 2824, 'optimizer': 'Adam'}. Best is trial 135 with value: 0.08639900718181048.
2026-05-18 00:38:37,096 - experiment_functions - INFO - Early stopping at epoch 650. Best Recall: 0.0728
2026-05-18 00:38:37,281 - optuna.study.study - INFO - Trial 281 finished with value: 0.07275692746720266 and parameters: {'n_layers': 1, 'embedding_dim': 256, 'lr': 0.0024494680881504832, 'lambda_val': 4.7536846024721715e-06, 'batch_size': 1043, 'optimizer': 'Adam'}. Best is trial 135 with value: 0.08639900718181048.
2026-05-18 00:38:55,956 - optuna.study._optimize - INFO - Trial 282 pruned. 
2026-05-18 00:39:17,395 - optuna.study._optimize - INFO - Trial 283 pruned. 
2026-05-18 00:39:34,610 - optuna.study._optimize - INFO - Trial 284 pruned. 
2026-05-18 00:39:47,938 - experiment_functions - INFO - Early stopping at epoch 600. Best Recall: 0.0356
2026-05-18 00:39:48,047 - optuna.study.study - INFO - Trial 285 finished with value: 0.035622717887155195 and parameters: {'n_layers': 4, 'embedding_dim': 256, 'lr': 0.0011720064777793848, 'lambda_val': 6.312086408258518e-06, 'batch_size': 1696, 'optimizer': 'Adam'}. Best is trial 135 with value: 0.08639900718181048.
2026-05-18 00:39:55,805 - experiment_functions - INFO - Early stopping at epoch 500. Best Recall: 0.0056
2026-05-18 00:39:55,895 - optuna.study.study - INFO - Trial 286 finished with value: 0.005575584222027225 and parameters: {'n_layers': 1, 'embedding_dim': 256, 'lr': 0.0026801005390976744, 'lambda_val': 0.0005194640879530356, 'batch_size': 2664, 'optimizer': 'SGD'}. Best is trial 135 with value: 0.08639900718181048.
2026-05-18 00:40:09,118 - experiment_functions - INFO - Early stopping at epoch 600. Best Recall: 0.0543
2026-05-18 00:40:09,207 - optuna.study.study - INFO - Trial 287 finished with value: 0.05433466140535868 and parameters: {'n_layers': 2, 'embedding_dim': 256, 'lr': 0.0017407758878746733, 'lambda_val': 6.367289638824336e-05, 'batch_size': 2983, 'optimizer': 'Adam'}. Best is trial 135 with value: 0.08639900718181048.
2026-05-18 00:40:25,485 - optuna.study._optimize - INFO - Trial 288 pruned. 
2026-05-18 00:40:45,023 - optuna.study._optimize - INFO - Trial 289 pruned. 
2026-05-18 00:41:00,601 - optuna.study._optimize - INFO - Trial 290 pruned. 
2026-05-18 00:41:21,703 - optuna.study._optimize - INFO - Trial 291 pruned. 
2026-05-18 00:41:38,389 - experiment_functions - INFO - Early stopping at epoch 950. Best Recall: 0.0772
2026-05-18 00:41:38,524 - optuna.study.study - INFO - Trial 292 finished with value: 0.07721163471385993 and parameters: {'n_layers': 1, 'embedding_dim': 256, 'lr': 0.0010236108257183068, 'lambda_val': 3.4603584985023112e-06, 'batch_size': 3032, 'optimizer': 'Adam'}. Best is trial 135 with value: 0.08639900718181048.
2026-05-18 00:41:57,077 - optuna.study._optimize - INFO - Trial 293 pruned. 
2026-05-18 00:42:22,149 - experiment_functions - INFO - Early stopping at epoch 1500. Best Recall: 0.0836
2026-05-18 00:42:22,304 - optuna.study.study - INFO - Trial 294 finished with value: 0.08359992609541161 and parameters: {'n_layers': 1, 'embedding_dim': 256, 'lr': 0.0021271736382873934, 'lambda_val': 2.431595407466139e-06, 'batch_size': 3323, 'optimizer': 'Adam'}. Best is trial 135 with value: 0.08639900718181048.
2026-05-18 00:42:38,416 - optuna.study._optimize - INFO - Trial 295 pruned. 
2026-05-18 00:42:49,861 - experiment_functions - INFO - Early stopping at epoch 700. Best Recall: 0.0625
2026-05-18 00:42:50,020 - optuna.study.study - INFO - Trial 296 finished with value: 0.062487987710744805 and parameters: {'n_layers': 1, 'embedding_dim': 96, 'lr': 0.0012812459218495603, 'lambda_val': 7.980493463795814e-06, 'batch_size': 3226, 'optimizer': 'RMSprop'}. Best is trial 135 with value: 0.08639900718181048.
2026-05-18 00:43:15,700 - optuna.study._optimize - INFO - Trial 297 pruned. 
2026-05-18 00:43:26,994 - experiment_functions - INFO - Early stopping at epoch 750. Best Recall: 0.0718
2026-05-18 00:43:27,093 - optuna.study.study - INFO - Trial 298 finished with value: 0.07178336376048566 and parameters: {'n_layers': 1, 'embedding_dim': 128, 'lr': 0.0015443881113944588, 'lambda_val': 1.7576322419318768e-05, 'batch_size': 2563, 'optimizer': 'Adam'}. Best is trial 135 with value: 0.08639900718181048.
2026-05-18 00:43:45,881 - optuna.study._optimize - INFO - Trial 299 pruned. 
2026-05-18 00:44:27,199 - experiment_functions - INFO - Early stopping at epoch 3250. Best Recall: 0.0839
2026-05-18 00:44:28,046 - root - INFO -   **** Training e_1M_1c1dcs_rand1
2026-05-18 00:44:28,099 - root - INFO -   **** Getting 190231/805443 random edges
2026-05-18 00:44:29,246 - optuna.storages._rdb.storage - INFO - A new study created in RDB with name: Study_e_1M_1c1dcs_rand1
2026-05-18 00:44:41,716 - experiment_functions - INFO - Early stopping at epoch 500. Best Recall: 0.0051
2026-05-18 00:44:41,808 - optuna.study.study - INFO - Trial 0 finished with value: 0.005088314160803712 and parameters: {'n_layers': 4, 'embedding_dim': 128, 'lr': 2.4119954107830608e-05, 'lambda_val': 0.08136746031949013, 'batch_size': 3641, 'optimizer': 'SGD'}. Best is trial 0 with value: 0.005088314160803712.
2026-05-18 00:44:54,549 - experiment_functions - INFO - Early stopping at epoch 500. Best Recall: 0.0051
2026-05-18 00:44:54,653 - optuna.study.study - INFO - Trial 1 finished with value: 0.0051416160716374676 and parameters: {'n_layers': 1, 'embedding_dim': 256, 'lr': 0.013818764825828856, 'lambda_val': 0.0007706396781012831, 'batch_size': 1442, 'optimizer': 'SGD'}. Best is trial 1 with value: 0.0051416160716374676.
2026-05-18 00:45:12,461 - experiment_functions - INFO - Early stopping at epoch 750. Best Recall: 0.0320
2026-05-18 00:45:12,599 - optuna.study.study - INFO - Trial 2 finished with value: 0.032023570751354896 and parameters: {'n_layers': 4, 'embedding_dim': 96, 'lr': 0.0004719093709905488, 'lambda_val': 2.1122725022284737e-06, 'batch_size': 2620, 'optimizer': 'Adam'}. Best is trial 2 with value: 0.032023570751354896.
2026-05-18 00:45:30,671 - experiment_functions - INFO - Early stopping at epoch 650. Best Recall: 0.0503
2026-05-18 00:45:30,776 - optuna.study.study - INFO - Trial 3 finished with value: 0.0502813907443151 and parameters: {'n_layers': 1, 'embedding_dim': 64, 'lr': 0.0027759504923801047, 'lambda_val': 6.616680273068691e-05, 'batch_size': 3456, 'optimizer': 'Adam'}. Best is trial 3 with value: 0.0502813907443151.
2026-05-18 00:45:49,003 - experiment_functions - INFO - Early stopping at epoch 750. Best Recall: 0.0321
2026-05-18 00:45:49,103 - optuna.study.study - INFO - Trial 4 finished with value: 0.032079703716990954 and parameters: {'n_layers': 4, 'embedding_dim': 64, 'lr': 0.0004361900955896729, 'lambda_val': 0.026605670392720427, 'batch_size': 764, 'optimizer': 'RMSprop'}. Best is trial 3 with value: 0.0502813907443151.
2026-05-18 00:46:09,987 - experiment_functions - INFO - Early stopping at epoch 1300. Best Recall: 0.0051
2026-05-18 00:46:10,076 - optuna.study.study - INFO - Trial 5 finished with value: 0.005107004232862692 and parameters: {'n_layers': 1, 'embedding_dim': 32, 'lr': 1.3408007489465668e-05, 'lambda_val': 0.00017572066828478903, 'batch_size': 2443, 'optimizer': 'RMSprop'}. Best is trial 3 with value: 0.0502813907443151.
2026-05-18 00:47:06,398 - optuna.study.study - INFO - Trial 6 finished with value: 0.009855638197074454 and parameters: {'n_layers': 2, 'embedding_dim': 64, 'lr': 5.6069399670100476e-05, 'lambda_val': 0.0018116566256795377, 'batch_size': 3912, 'optimizer': 'RMSprop'}. Best is trial 3 with value: 0.0502813907443151.
2026-05-18 00:47:17,528 - experiment_functions - INFO - Early stopping at epoch 700. Best Recall: 0.0091
2026-05-18 00:47:17,616 - optuna.study.study - INFO - Trial 7 finished with value: 0.009132750146430087 and parameters: {'n_layers': 3, 'embedding_dim': 128, 'lr': 0.03077497460671969, 'lambda_val': 0.016606463827150923, 'batch_size': 2821, 'optimizer': 'RMSprop'}. Best is trial 3 with value: 0.0502813907443151.
2026-05-18 00:47:25,729 - experiment_functions - INFO - Early stopping at epoch 500. Best Recall: 0.0049
2026-05-18 00:47:26,116 - optuna.study.study - INFO - Trial 8 finished with value: 0.004886564067163621 and parameters: {'n_layers': 3, 'embedding_dim': 64, 'lr': 1.0435409492174269e-05, 'lambda_val': 0.0026144901327903596, 'batch_size': 2080, 'optimizer': 'SGD'}. Best is trial 3 with value: 0.0502813907443151.
2026-05-18 00:47:35,704 - experiment_functions - INFO - Early stopping at epoch 500. Best Recall: 0.0052
2026-05-18 00:47:35,793 - optuna.study.study - INFO - Trial 9 finished with value: 0.005245234300763325 and parameters: {'n_layers': 2, 'embedding_dim': 128, 'lr': 0.07816540065156036, 'lambda_val': 7.078975721481361e-06, 'batch_size': 3987, 'optimizer': 'SGD'}. Best is trial 3 with value: 0.0502813907443151.
2026-05-18 00:47:45,436 - experiment_functions - INFO - Early stopping at epoch 650. Best Recall: 0.0553
2026-05-18 00:47:45,538 - optuna.study.study - INFO - Trial 10 finished with value: 0.05534347802916179 and parameters: {'n_layers': 1, 'embedding_dim': 32, 'lr': 0.0027223240415421264, 'lambda_val': 4.2137363690133964e-05, 'batch_size': 3235, 'optimizer': 'Adam'}. Best is trial 10 with value: 0.05534347802916179.
2026-05-18 00:47:54,477 - experiment_functions - INFO - Early stopping at epoch 600. Best Recall: 0.0465
2026-05-18 00:47:54,611 - optuna.study.study - INFO - Trial 11 finished with value: 0.04648580378499159 and parameters: {'n_layers': 1, 'embedding_dim': 32, 'lr': 0.006016134751399217, 'lambda_val': 5.055464790758825e-05, 'batch_size': 3226, 'optimizer': 'Adam'}. Best is trial 10 with value: 0.05534347802916179.
2026-05-18 00:48:05,027 - experiment_functions - INFO - Early stopping at epoch 600. Best Recall: 0.0477
2026-05-18 00:48:05,105 - optuna.study.study - INFO - Trial 12 finished with value: 0.04774690540070443 and parameters: {'n_layers': 2, 'embedding_dim': 32, 'lr': 0.0028824126676356616, 'lambda_val': 3.009967880488319e-05, 'batch_size': 3273, 'optimizer': 'Adam'}. Best is trial 10 with value: 0.05534347802916179.
2026-05-18 00:48:15,376 - experiment_functions - INFO - Early stopping at epoch 700. Best Recall: 0.0537
2026-05-18 00:48:15,466 - optuna.study.study - INFO - Trial 13 finished with value: 0.053665406474437634 and parameters: {'n_layers': 1, 'embedding_dim': 96, 'lr': 0.0018100660479059788, 'lambda_val': 6.447213494316277e-05, 'batch_size': 3205, 'optimizer': 'Adam'}. Best is trial 10 with value: 0.05534347802916179.
2026-05-18 00:49:14,164 - optuna.study.study - INFO - Trial 14 finished with value: 0.0402458610465473 and parameters: {'n_layers': 2, 'embedding_dim': 96, 'lr': 0.00014040940509102046, 'lambda_val': 7.25400802386289e-06, 'batch_size': 1896, 'optimizer': 'Adam'}. Best is trial 10 with value: 0.05534347802916179.
2026-05-18 00:49:25,283 - experiment_functions - INFO - Early stopping at epoch 750. Best Recall: 0.0549
2026-05-18 00:49:25,402 - optuna.study.study - INFO - Trial 15 finished with value: 0.05490758845708376 and parameters: {'n_layers': 1, 'embedding_dim': 96, 'lr': 0.00139419313238755, 'lambda_val': 0.00019885363848420396, 'batch_size': 3013, 'optimizer': 'Adam'}. Best is trial 10 with value: 0.05534347802916179.
2026-05-18 00:49:42,115 - experiment_functions - INFO - Early stopping at epoch 1050. Best Recall: 0.0548
