2026-05-22 22:47:24,410 - optuna.study.study - INFO - Trial 2 finished with values: [0.002143558690076605, 0.0014754098360655738, 0.0017956040943853486] and parameters: {'n_layers': 1, 'embedding_dim': 96, 'lr': 3.9611035775812e-05, 'lambda_val': 0.012977296033486492, 'batch_size': 946, 'optimizer': 'SGD'}.
2026-05-22 22:47:24,413 - root - INFO - Selected Trial 1 based on Max NDCG: 0.0416
2026-05-22 22:47:24,413 - root - INFO - Associated Recall: 0.0525
2026-05-22 22:47:24,413 - experiment_functions - INFO - Training the best model ... for e_100K_1c2dcs_rand1
2026-05-22 22:47:28,175 - root - INFO - **** Training e_100K_1c3dcs
2026-05-22 22:47:28,175 - root - INFO -   ** 3-Dominant stats:
2026-05-22 22:47:28,175 - root - INFO -   ** Finding the dominant set:
2026-05-22 22:47:55,393 - root - INFO -   ** Getting the trainable edges:
2026-05-22 22:47:55,398 - helper_functions - INFO -      Number of nodes: 5324
2026-05-22 22:47:55,398 - helper_functions - INFO -      Ratio: 0.515192568221405
2026-05-22 22:47:55,398 - helper_functions - INFO -      Number of unique users: 333
2026-05-22 22:47:55,398 - helper_functions - INFO -      Number of unique items: 4991
2026-05-22 22:47:55,398 - helper_functions - INFO -      Total dominant set edge: 17514
2026-05-22 22:47:55,398 - helper_functions - INFO -      Trainable edges: 14011.2
2026-05-22 22:47:55,401 - root - INFO -   **** Getting 17514 dominant set edges
2026-05-22 22:47:55,575 - optuna.storages._rdb.storage - INFO - A new study created in RDB with name: Study_e_100K_1c3dcs_strict
2026-05-22 22:47:58,447 - experiment_functions - INFO - Early stopping at epoch 500. Best Metrics: (0.002871418308342638, 0.0017213114754098362, 0.0022707817594841946)
2026-05-22 22:47:58,595 - optuna.study.study - INFO - Trial 0 finished with values: [0.002871418308342638, 0.0017213114754098362, 0.0022707817594841946] and parameters: {'n_layers': 2, 'embedding_dim': 256, 'lr': 6.149808591268575e-05, 'lambda_val': 0.02800937505125418, 'batch_size': 3212, 'optimizer': 'RMSprop'}.
2026-05-22 22:48:01,128 - experiment_functions - INFO - Early stopping at epoch 550. Best Metrics: (0.00836149696385556, 0.010983606557377049, 0.012820287971935842)
2026-05-22 22:48:01,282 - optuna.study.study - INFO - Trial 1 finished with values: [0.00836149696385556, 0.010983606557377049, 0.012820287971935842] and parameters: {'n_layers': 1, 'embedding_dim': 96, 'lr': 0.01578962735186189, 'lambda_val': 0.0005259113611857964, 'batch_size': 3710, 'optimizer': 'RMSprop'}.
2026-05-22 22:48:03,826 - experiment_functions - INFO - Early stopping at epoch 500. Best Metrics: (0.0018325588219876721, 0.0018032786885245904, 0.002004250372390253)
2026-05-22 22:48:04,022 - optuna.study.study - INFO - Trial 2 finished with values: [0.0018325588219876721, 0.0018032786885245904, 0.002004250372390253] and parameters: {'n_layers': 4, 'embedding_dim': 96, 'lr': 0.004608159530401271, 'lambda_val': 0.0009522267796255085, 'batch_size': 1855, 'optimizer': 'SGD'}.
2026-05-22 22:48:04,025 - root - INFO - Selected Trial 1 based on Max NDCG: 0.0128
2026-05-22 22:48:04,025 - root - INFO - Associated Recall: 0.0084
2026-05-22 22:48:04,025 - experiment_functions - INFO - Training the best model ... for e_100K_1c3dcs_strict
2026-05-22 22:48:07,036 - root - INFO -   **** Training e_100K_1c3dcs_strict_rand1
2026-05-22 22:48:07,041 - root - INFO -   **** Getting 14186/81200 random edges
2026-05-22 22:48:07,176 - optuna.storages._rdb.storage - INFO - A new study created in RDB with name: Study_e_100K_1c3dcs_strict_rand1
2026-05-22 22:48:09,492 - experiment_functions - INFO - Early stopping at epoch 500. Best Metrics: (0.0013428305201546645, 0.0014754098360655738, 0.0015252446414044383)
2026-05-22 22:48:09,652 - optuna.study.study - INFO - Trial 0 finished with values: [0.0013428305201546645, 0.0014754098360655738, 0.0015252446414044383] and parameters: {'n_layers': 1, 'embedding_dim': 32, 'lr': 4.483898181007765e-05, 'lambda_val': 4.7945307721469375e-05, 'batch_size': 3559, 'optimizer': 'SGD'}.
2026-05-22 22:48:13,719 - optuna.study.study - INFO - Trial 1 finished with values: [0.030154564086590924, 0.017950819672131146, 0.027517840087459812] and parameters: {'n_layers': 1, 'embedding_dim': 256, 'lr': 0.00021723471481045113, 'lambda_val': 0.0021431689383362533, 'batch_size': 1205, 'optimizer': 'Adam'}.
2026-05-22 22:48:16,328 - experiment_functions - INFO - Early stopping at epoch 500. Best Metrics: (0.0036820096632050525, 0.0027049180327868854, 0.0037374934813301647)
2026-05-22 22:48:16,467 - optuna.study.study - INFO - Trial 2 finished with values: [0.0036820096632050525, 0.0027049180327868854, 0.0037374934813301647] and parameters: {'n_layers': 4, 'embedding_dim': 128, 'lr': 0.04252890474093234, 'lambda_val': 0.07941289739983981, 'batch_size': 1313, 'optimizer': 'RMSprop'}.
2026-05-22 22:48:16,470 - root - INFO - Selected Trial 1 based on Max NDCG: 0.0275
2026-05-22 22:48:16,470 - root - INFO - Associated Recall: 0.0302
2026-05-22 22:48:16,470 - experiment_functions - INFO - Training the best model ... for e_100K_1c3dcs_strict_rand1
2026-05-22 22:48:19,541 - root - INFO -   ** Getting the trainable edges:
2026-05-22 22:48:19,547 - helper_functions - INFO -      Number of nodes: 5324
2026-05-22 22:48:19,547 - helper_functions - INFO -      Ratio: 0.515192568221405
2026-05-22 22:48:19,547 - helper_functions - INFO -      Number of unique users: 333
2026-05-22 22:48:19,547 - helper_functions - INFO -      Number of unique items: 4991
2026-05-22 22:48:19,547 - helper_functions - INFO -      Total dominant set edge: 87527
2026-05-22 22:48:19,547 - helper_functions - INFO -      Trainable edges: 70021.6
2026-05-22 22:48:19,558 - root - INFO -   **** Getting 87527 dominant set edges
2026-05-22 22:48:21,606 - optuna.storages._rdb.storage - INFO - A new study created in RDB with name: Study_e_100K_1c3dcs
2026-05-22 22:48:28,843 - optuna.study.study - INFO - Trial 0 finished with values: [0.0023544651629786085, 0.0018852459016393446, 0.002796381736711801] and parameters: {'n_layers': 1, 'embedding_dim': 96, 'lr': 3.3874334474979094e-05, 'lambda_val': 0.0019413801655605394, 'batch_size': 3360, 'optimizer': 'Adam'}.
2026-05-22 22:48:34,104 - experiment_functions - INFO - Early stopping at epoch 800. Best Metrics: (0.014943727170857297, 0.00778688524590164, 0.010841810329098698)
2026-05-22 22:48:34,992 - optuna.study.study - INFO - Trial 1 finished with values: [0.014943727170857297, 0.00778688524590164, 0.010841810329098698] and parameters: {'n_layers': 4, 'embedding_dim': 128, 'lr': 0.02377690766630657, 'lambda_val': 8.409266931914761e-05, 'batch_size': 3827, 'optimizer': 'Adam'}.
2026-05-22 22:48:37,826 - experiment_functions - INFO - Early stopping at epoch 550. Best Metrics: (0.04636520472404788, 0.0269672131147541, 0.039849037274871324)
2026-05-22 22:48:37,922 - optuna.study.study - INFO - Trial 2 finished with values: [0.04636520472404788, 0.0269672131147541, 0.039849037274871324] and parameters: {'n_layers': 2, 'embedding_dim': 64, 'lr': 0.007357774016215564, 'lambda_val': 0.000643589889112405, 'batch_size': 3719, 'optimizer': 'Adam'}.
2026-05-22 22:48:37,925 - root - INFO - Selected Trial 2 based on Max NDCG: 0.0398
2026-05-22 22:48:37,925 - root - INFO - Associated Recall: 0.0464
2026-05-22 22:48:37,925 - experiment_functions - INFO - Training the best model ... for e_100K_1c3dcs
2026-05-22 22:48:39,874 - experiment_functions - INFO - Early stopping at epoch 550. Best Metrics: (0.031731652671406284, 0.02163934426229508, 0.028417683084617527)
2026-05-22 22:48:39,973 - root - INFO -   **** Training e_100K_1c3dcs_rand1
2026-05-22 22:48:39,986 - root - INFO -   **** Getting 70319/81200 random edges
2026-05-22 22:48:40,218 - optuna.storages._rdb.storage - INFO - A new study created in RDB with name: Study_e_100K_1c3dcs_rand1
2026-05-22 22:48:42,807 - experiment_functions - INFO - Early stopping at epoch 500. Best Metrics: (0.0015295397689439173, 0.0013114754098360656, 0.0013392055698959369)
2026-05-22 22:48:42,984 - optuna.study.study - INFO - Trial 0 finished with values: [0.0015295397689439173, 0.0013114754098360656, 0.0013392055698959369] and parameters: {'n_layers': 3, 'embedding_dim': 64, 'lr': 0.00013180495975728435, 'lambda_val': 5.8467603757703854e-05, 'batch_size': 2255, 'optimizer': 'SGD'}.
2026-05-22 22:48:46,975 - experiment_functions - INFO - Early stopping at epoch 500. Best Metrics: (0.0009543574392925445, 0.001639344262295082, 0.0017487433476427252)
2026-05-22 22:48:47,118 - optuna.study.study - INFO - Trial 1 finished with values: [0.0009543574392925445, 0.001639344262295082, 0.0017487433476427252] and parameters: {'n_layers': 3, 'embedding_dim': 32, 'lr': 1.205248733760666e-05, 'lambda_val': 0.010882688939896395, 'batch_size': 3803, 'optimizer': 'RMSprop'}.
2026-05-22 22:48:50,298 - experiment_functions - INFO - Early stopping at epoch 600. Best Metrics: (0.045163533243058815, 0.027622950819672133, 0.038845651167615486)
2026-05-22 22:48:51,019 - optuna.study.study - INFO - Trial 2 finished with values: [0.045163533243058815, 0.027622950819672133, 0.038845651167615486] and parameters: {'n_layers': 2, 'embedding_dim': 96, 'lr': 0.0012340362033827629, 'lambda_val': 0.002641572809419233, 'batch_size': 3298, 'optimizer': 'RMSprop'}.
2026-05-22 22:48:51,022 - root - INFO - Selected Trial 2 based on Max NDCG: 0.0388
2026-05-22 22:48:51,022 - root - INFO - Associated Recall: 0.0452
2026-05-22 22:48:51,022 - experiment_functions - INFO - Training the best model ... for e_100K_1c3dcs_rand1
2026-05-22 22:48:53,028 - experiment_functions - INFO - Early stopping at epoch 550. Best Metrics: (0.04374416097767019, 0.027868852459016394, 0.03967254313090281)
