2026-05-15 08:32:53,653 - optuna.study.study - INFO - Trial 24 finished with value: 0.057615082269845894 and parameters: {'n_layers': 1, 'embedding_dim': 96, 'lr': 0.000714456754093743, 'lambda_val': 0.01975205959557207, 'batch_size': 1125, 'optimizer': 'Adam'}. Best is trial 20 with value: 0.05899843684477314.
2026-05-15 08:32:57,104 - optuna.study._optimize - INFO - Trial 25 pruned. 
2026-05-15 08:33:12,223 - optuna.study._optimize - INFO - Trial 26 pruned. 
2026-05-15 08:33:40,314 - optuna.study.study - INFO - Trial 27 finished with value: 0.05530663319142915 and parameters: {'n_layers': 1, 'embedding_dim': 96, 'lr': 0.0007459580243808423, 'lambda_val': 0.01307006817739222, 'batch_size': 515, 'optimizer': 'Adam'}. Best is trial 20 with value: 0.05899843684477314.
2026-05-15 08:34:12,307 - optuna.study.study - INFO - Trial 28 finished with value: 0.03273715222315185 and parameters: {'n_layers': 2, 'embedding_dim': 96, 'lr': 0.00023691133054425692, 'lambda_val': 0.0022392446737595625, 'batch_size': 987, 'optimizer': 'Adam'}. Best is trial 20 with value: 0.05899843684477314.
2026-05-15 08:34:21,696 - optuna.study._optimize - INFO - Trial 29 pruned. 
2026-05-15 08:34:30,812 - optuna.study._optimize - INFO - Trial 30 pruned. 
2026-05-15 08:34:58,357 - optuna.study.study - INFO - Trial 31 finished with value: 0.056681780949230064 and parameters: {'n_layers': 1, 'embedding_dim': 96, 'lr': 0.0022053420478998008, 'lambda_val': 0.039219735397715956, 'batch_size': 1180, 'optimizer': 'Adam'}. Best is trial 20 with value: 0.05899843684477314.
2026-05-15 08:35:26,256 - optuna.study.study - INFO - Trial 32 finished with value: 0.05955453186651269 and parameters: {'n_layers': 1, 'embedding_dim': 96, 'lr': 0.002900217844630624, 'lambda_val': 0.010462652973621306, 'batch_size': 1308, 'optimizer': 'Adam'}. Best is trial 32 with value: 0.05955453186651269.
2026-05-15 08:35:30,036 - optuna.study._optimize - INFO - Trial 33 pruned. 
2026-05-15 08:35:57,702 - optuna.study.study - INFO - Trial 34 finished with value: 0.05740733525579752 and parameters: {'n_layers': 1, 'embedding_dim': 96, 'lr': 0.0031629197507654057, 'lambda_val': 0.0029913014306440014, 'batch_size': 1365, 'optimizer': 'Adam'}. Best is trial 32 with value: 0.05955453186651269.
2026-05-15 08:36:32,215 - optuna.study.study - INFO - Trial 35 finished with value: 0.06643112234007878 and parameters: {'n_layers': 1, 'embedding_dim': 256, 'lr': 0.0034746942191311017, 'lambda_val': 0.0026158045777708266, 'batch_size': 1352, 'optimizer': 'Adam'}. Best is trial 35 with value: 0.06643112234007878.
2026-05-15 08:36:38,196 - optuna.study._optimize - INFO - Trial 36 pruned. 
2026-05-15 08:37:12,276 - optuna.study.study - INFO - Trial 37 finished with value: 0.06618566473548491 and parameters: {'n_layers': 1, 'embedding_dim': 256, 'lr': 0.00036576716005929787, 'lambda_val': 0.005726539325445217, 'batch_size': 1897, 'optimizer': 'Adam'}. Best is trial 35 with value: 0.06643112234007878.
2026-05-15 08:37:17,618 - optuna.study._optimize - INFO - Trial 38 pruned. 
2026-05-15 08:37:21,767 - optuna.study._optimize - INFO - Trial 39 pruned. 
2026-05-15 08:37:26,535 - optuna.study._optimize - INFO - Trial 40 pruned. 
2026-05-15 08:38:00,520 - optuna.study.study - INFO - Trial 41 finished with value: 0.06296481937569536 and parameters: {'n_layers': 1, 'embedding_dim': 256, 'lr': 0.0008637711285508425, 'lambda_val': 0.01198874226874456, 'batch_size': 1339, 'optimizer': 'Adam'}. Best is trial 35 with value: 0.06643112234007878.
2026-05-15 08:38:34,578 - optuna.study.study - INFO - Trial 42 finished with value: 0.05891863870658871 and parameters: {'n_layers': 1, 'embedding_dim': 256, 'lr': 0.0010576358860249306, 'lambda_val': 0.0035026663301912235, 'batch_size': 1900, 'optimizer': 'Adam'}. Best is trial 35 with value: 0.06643112234007878.
2026-05-15 08:38:39,123 - optuna.study._optimize - INFO - Trial 43 pruned. 
2026-05-15 08:39:13,344 - optuna.study.study - INFO - Trial 44 finished with value: 0.059778868995354256 and parameters: {'n_layers': 1, 'embedding_dim': 256, 'lr': 0.005414378828783008, 'lambda_val': 8.444597101020106e-05, 'batch_size': 1311, 'optimizer': 'Adam'}. Best is trial 35 with value: 0.06643112234007878.
2026-05-15 08:39:49,341 - optuna.study.study - INFO - Trial 45 finished with value: 0.0656489085925127 and parameters: {'n_layers': 1, 'embedding_dim': 256, 'lr': 0.005331357910093011, 'lambda_val': 0.00013351793078320717, 'batch_size': 3657, 'optimizer': 'RMSprop'}. Best is trial 35 with value: 0.06643112234007878.
2026-05-15 08:40:24,882 - optuna.study.study - INFO - Trial 46 finished with value: 0.05379124756004672 and parameters: {'n_layers': 1, 'embedding_dim': 256, 'lr': 0.005108020364629967, 'lambda_val': 6.933184124732494e-05, 'batch_size': 3566, 'optimizer': 'RMSprop'}. Best is trial 35 with value: 0.06643112234007878.
2026-05-15 08:41:00,171 - optuna.study.study - INFO - Trial 47 finished with value: 0.060027808108857494 and parameters: {'n_layers': 1, 'embedding_dim': 256, 'lr': 0.013297071372168064, 'lambda_val': 0.0001138664693168566, 'batch_size': 3202, 'optimizer': 'RMSprop'}. Best is trial 35 with value: 0.06643112234007878.
2026-05-15 08:41:35,640 - optuna.study.study - INFO - Trial 48 finished with value: 0.06431013713977676 and parameters: {'n_layers': 1, 'embedding_dim': 256, 'lr': 0.011209299717006634, 'lambda_val': 0.00016098487565058202, 'batch_size': 3467, 'optimizer': 'RMSprop'}. Best is trial 35 with value: 0.06643112234007878.
2026-05-15 08:41:41,424 - optuna.study._optimize - INFO - Trial 49 pruned. 
2026-05-15 08:41:45,500 - optuna.study._optimize - INFO - Trial 50 pruned. 
2026-05-15 08:41:49,520 - optuna.study._optimize - INFO - Trial 51 pruned. 
2026-05-15 08:42:23,552 - optuna.study.study - INFO - Trial 52 finished with value: 0.07154134574337437 and parameters: {'n_layers': 1, 'embedding_dim': 256, 'lr': 0.01403111555785316, 'lambda_val': 0.0005967438968569646, 'batch_size': 3352, 'optimizer': 'RMSprop'}. Best is trial 52 with value: 0.07154134574337437.
2026-05-15 08:42:27,797 - optuna.study._optimize - INFO - Trial 53 pruned. 
2026-05-15 08:43:01,183 - optuna.study.study - INFO - Trial 54 finished with value: 0.07034579781045008 and parameters: {'n_layers': 1, 'embedding_dim': 256, 'lr': 0.008666439391991748, 'lambda_val': 0.0003907834424700405, 'batch_size': 2994, 'optimizer': 'RMSprop'}. Best is trial 52 with value: 0.07154134574337437.
2026-05-15 08:43:36,348 - optuna.study.study - INFO - Trial 55 finished with value: 0.0674874657164172 and parameters: {'n_layers': 1, 'embedding_dim': 256, 'lr': 0.00789291625476325, 'lambda_val': 0.00039084411476488, 'batch_size': 2942, 'optimizer': 'RMSprop'}. Best is trial 52 with value: 0.07154134574337437.
2026-05-15 08:43:44,433 - optuna.study._optimize - INFO - Trial 56 pruned. 
2026-05-15 08:43:49,328 - optuna.study._optimize - INFO - Trial 57 pruned. 
2026-05-15 08:43:53,632 - optuna.study._optimize - INFO - Trial 58 pruned. 
2026-05-15 08:43:57,493 - optuna.study._optimize - INFO - Trial 59 pruned. 
2026-05-15 08:44:02,593 - optuna.study._optimize - INFO - Trial 60 pruned. 
2026-05-15 08:44:13,744 - optuna.study._optimize - INFO - Trial 61 pruned. 
2026-05-15 08:44:22,338 - optuna.study._optimize - INFO - Trial 62 pruned. 
2026-05-15 08:44:57,152 - optuna.study.study - INFO - Trial 63 finished with value: 0.0614499334352799 and parameters: {'n_layers': 1, 'embedding_dim': 256, 'lr': 0.004558758791834335, 'lambda_val': 0.00039940843234899804, 'batch_size': 3004, 'optimizer': 'RMSprop'}. Best is trial 52 with value: 0.07154134574337437.
2026-05-15 08:45:31,730 - optuna.study.study - INFO - Trial 64 finished with value: 0.07055364766152837 and parameters: {'n_layers': 1, 'embedding_dim': 256, 'lr': 0.013858995059506695, 'lambda_val': 0.0002540074893657222, 'batch_size': 2787, 'optimizer': 'RMSprop'}. Best is trial 52 with value: 0.07154134574337437.
2026-05-15 08:45:35,927 - optuna.study._optimize - INFO - Trial 65 pruned. 
2026-05-15 08:45:40,043 - optuna.study._optimize - INFO - Trial 66 pruned. 
2026-05-15 08:45:43,627 - optuna.study._optimize - INFO - Trial 67 pruned. 
2026-05-15 08:45:47,920 - optuna.study._optimize - INFO - Trial 68 pruned. 
2026-05-15 08:46:07,618 - optuna.study._optimize - INFO - Trial 69 pruned. 
2026-05-15 08:46:36,266 - optuna.study.study - INFO - Trial 70 finished with value: 0.03575468365275521 and parameters: {'n_layers': 1, 'embedding_dim': 64, 'lr': 0.0025119880866644336, 'lambda_val': 0.00046237984622004544, 'batch_size': 3792, 'optimizer': 'RMSprop'}. Best is trial 52 with value: 0.07154134574337437.
2026-05-15 08:47:11,267 - optuna.study.study - INFO - Trial 71 finished with value: 0.06610749627249203 and parameters: {'n_layers': 1, 'embedding_dim': 256, 'lr': 0.011098717853755602, 'lambda_val': 0.0001482440503619902, 'batch_size': 3510, 'optimizer': 'RMSprop'}. Best is trial 52 with value: 0.07154134574337437.
2026-05-15 08:47:17,997 - optuna.study._optimize - INFO - Trial 72 pruned. 
2026-05-15 08:47:24,355 - optuna.study._optimize - INFO - Trial 73 pruned. 
2026-05-15 08:47:59,621 - optuna.study.study - INFO - Trial 74 finished with value: 0.06886591377690582 and parameters: {'n_layers': 1, 'embedding_dim': 256, 'lr': 0.018351334099900498, 'lambda_val': 0.0006228135007454861, 'batch_size': 3092, 'optimizer': 'RMSprop'}. Best is trial 52 with value: 0.07154134574337437.
2026-05-15 08:48:03,724 - optuna.study._optimize - INFO - Trial 75 pruned. 
2026-05-15 08:48:07,972 - optuna.study._optimize - INFO - Trial 76 pruned. 
2026-05-15 08:48:14,890 - optuna.study._optimize - INFO - Trial 77 pruned. 
2026-05-15 08:48:43,543 - optuna.study.study - INFO - Trial 78 finished with value: 0.06750506828815063 and parameters: {'n_layers': 1, 'embedding_dim': 128, 'lr': 0.01603046688536346, 'lambda_val': 0.0011046555780369262, 'batch_size': 2158, 'optimizer': 'RMSprop'}. Best is trial 52 with value: 0.07154134574337437.
2026-05-15 08:48:47,679 - optuna.study._optimize - INFO - Trial 79 pruned. 
2026-05-15 08:48:51,276 - optuna.study._optimize - INFO - Trial 80 pruned. 
2026-05-15 08:48:55,060 - optuna.study._optimize - INFO - Trial 81 pruned. 
2026-05-15 08:49:01,058 - optuna.study._optimize - INFO - Trial 82 pruned. 
2026-05-15 08:49:33,925 - optuna.study.study - INFO - Trial 83 finished with value: 0.06885601697840132 and parameters: {'n_layers': 1, 'embedding_dim': 256, 'lr': 0.008559998380138498, 'lambda_val': 0.0006121178298652499, 'batch_size': 1992, 'optimizer': 'RMSprop'}. Best is trial 52 with value: 0.07154134574337437.
2026-05-15 08:50:07,556 - optuna.study.study - INFO - Trial 84 finished with value: 0.07268277184987448 and parameters: {'n_layers': 1, 'embedding_dim': 256, 'lr': 0.008751723326315606, 'lambda_val': 0.0009846465028376427, 'batch_size': 1956, 'optimizer': 'RMSprop'}. Best is trial 84 with value: 0.07268277184987448.
2026-05-15 08:50:11,994 - optuna.study._optimize - INFO - Trial 85 pruned. 
2026-05-15 08:50:16,121 - optuna.study._optimize - INFO - Trial 86 pruned. 
2026-05-15 08:50:50,925 - optuna.study.study - INFO - Trial 87 finished with value: 0.07335822865275944 and parameters: {'n_layers': 1, 'embedding_dim': 256, 'lr': 0.007978722152944996, 'lambda_val': 0.0004295508525865246, 'batch_size': 2512, 'optimizer': 'RMSprop'}. Best is trial 87 with value: 0.07335822865275944.
2026-05-15 08:50:54,917 - optuna.study._optimize - INFO - Trial 88 pruned. 
2026-05-15 08:50:59,696 - optuna.study._optimize - INFO - Trial 89 pruned. 
2026-05-15 08:51:04,703 - optuna.study._optimize - INFO - Trial 90 pruned. 
2026-05-15 08:51:39,696 - optuna.study.study - INFO - Trial 91 finished with value: 0.06556085124723311 and parameters: {'n_layers': 1, 'embedding_dim': 256, 'lr': 0.009783912973914562, 'lambda_val': 0.0010688841563497554, 'batch_size': 2674, 'optimizer': 'RMSprop'}. Best is trial 87 with value: 0.07335822865275944.
2026-05-15 08:51:44,638 - optuna.study._optimize - INFO - Trial 92 pruned. 
2026-05-15 08:52:19,182 - optuna.study.study - INFO - Trial 93 finished with value: 0.0709220322932446 and parameters: {'n_layers': 1, 'embedding_dim': 256, 'lr': 0.011314901446093524, 'lambda_val': 0.0003801546940896274, 'batch_size': 2912, 'optimizer': 'RMSprop'}. Best is trial 87 with value: 0.07335822865275944.
2026-05-15 08:52:54,083 - optuna.study.study - INFO - Trial 94 finished with value: 0.07186309915383504 and parameters: {'n_layers': 1, 'embedding_dim': 256, 'lr': 0.01162410699852633, 'lambda_val': 0.00041688973931183494, 'batch_size': 2798, 'optimizer': 'RMSprop'}. Best is trial 87 with value: 0.07335822865275944.
2026-05-15 08:52:58,516 - optuna.study._optimize - INFO - Trial 95 pruned. 
2026-05-15 08:53:02,477 - optuna.study._optimize - INFO - Trial 96 pruned. 
2026-05-15 08:53:35,773 - optuna.study.study - INFO - Trial 97 finished with value: 0.06768162185280913 and parameters: {'n_layers': 1, 'embedding_dim': 256, 'lr': 0.004324950036219833, 'lambda_val': 0.0007173961474984642, 'batch_size': 2028, 'optimizer': 'RMSprop'}. Best is trial 87 with value: 0.07335822865275944.
2026-05-15 08:53:52,297 - optuna.study._optimize - INFO - Trial 98 pruned. 
2026-05-15 08:53:58,336 - optuna.study._optimize - INFO - Trial 99 pruned. 
2026-05-15 08:54:32,663 - optuna.study.study - INFO - Trial 100 finished with value: 0.03738655447480015 and parameters: {'n_layers': 1, 'embedding_dim': 256, 'lr': 0.002757421438706075, 'lambda_val': 9.039730321309552e-05, 'batch_size': 2762, 'optimizer': 'RMSprop'}. Best is trial 87 with value: 0.07335822865275944.
2026-05-15 08:55:06,990 - optuna.study.study - INFO - Trial 101 finished with value: 0.0635787959006666 and parameters: {'n_layers': 1, 'embedding_dim': 256, 'lr': 0.008936002141690911, 'lambda_val': 0.001181061962729326, 'batch_size': 2185, 'optimizer': 'RMSprop'}. Best is trial 87 with value: 0.07335822865275944.
2026-05-15 08:55:40,772 - optuna.study.study - INFO - Trial 102 finished with value: 0.07185077577200202 and parameters: {'n_layers': 1, 'embedding_dim': 256, 'lr': 0.011401003556756795, 'lambda_val': 0.0008061007768067832, 'batch_size': 2289, 'optimizer': 'RMSprop'}. Best is trial 87 with value: 0.07335822865275944.
2026-05-15 08:56:14,187 - optuna.study.study - INFO - Trial 103 finished with value: 0.0690885119162894 and parameters: {'n_layers': 1, 'embedding_dim': 256, 'lr': 0.010440866928990863, 'lambda_val': 0.0004384962057978653, 'batch_size': 2296, 'optimizer': 'RMSprop'}. Best is trial 87 with value: 0.07335822865275944.
2026-05-15 08:56:18,284 - optuna.study._optimize - INFO - Trial 104 pruned. 
2026-05-15 08:56:22,715 - optuna.study._optimize - INFO - Trial 105 pruned. 
2026-05-15 08:56:57,602 - optuna.study.study - INFO - Trial 106 finished with value: 0.06595104714177713 and parameters: {'n_layers': 1, 'embedding_dim': 256, 'lr': 0.01427842634514014, 'lambda_val': 0.00019396870991295992, 'batch_size': 2591, 'optimizer': 'RMSprop'}. Best is trial 87 with value: 0.07335822865275944.
2026-05-15 08:57:37,113 - optuna.study.study - INFO - Trial 107 finished with value: 0.06580664127250556 and parameters: {'n_layers': 1, 'embedding_dim': 256, 'lr': 0.010034813173659278, 'lambda_val': 0.0017214082912610157, 'batch_size': 3125, 'optimizer': 'RMSprop'}. Best is trial 87 with value: 0.07335822865275944.
2026-05-15 08:58:17,500 - optuna.study.study - INFO - Trial 108 finished with value: 0.0682649579028632 and parameters: {'n_layers': 1, 'embedding_dim': 256, 'lr': 0.0067897049986317595, 'lambda_val': 0.00033550318339689816, 'batch_size': 3246, 'optimizer': 'RMSprop'}. Best is trial 87 with value: 0.07335822865275944.
2026-05-15 08:58:21,703 - optuna.study._optimize - INFO - Trial 109 pruned. 
2026-05-15 08:58:25,903 - optuna.study._optimize - INFO - Trial 110 pruned. 
2026-05-15 08:59:01,197 - optuna.study.study - INFO - Trial 111 finished with value: 0.07472210114927892 and parameters: {'n_layers': 1, 'embedding_dim': 256, 'lr': 0.007765105877867583, 'lambda_val': 0.00030726097667072786, 'batch_size': 3051, 'optimizer': 'RMSprop'}. Best is trial 111 with value: 0.07472210114927892.
2026-05-15 08:59:05,454 - optuna.study._optimize - INFO - Trial 112 pruned. 
2026-05-15 08:59:40,923 - optuna.study.study - INFO - Trial 113 finished with value: 0.07444579814053238 and parameters: {'n_layers': 1, 'embedding_dim': 256, 'lr': 0.008223383946890532, 'lambda_val': 0.0006056777751769507, 'batch_size': 2950, 'optimizer': 'RMSprop'}. Best is trial 111 with value: 0.07472210114927892.
2026-05-15 08:59:45,493 - optuna.study._optimize - INFO - Trial 114 pruned. 
2026-05-15 08:59:49,631 - optuna.study._optimize - INFO - Trial 115 pruned. 
2026-05-15 08:59:54,034 - optuna.study._optimize - INFO - Trial 116 pruned. 
2026-05-15 09:00:28,370 - optuna.study.study - INFO - Trial 117 finished with value: 0.06454947044092654 and parameters: {'n_layers': 1, 'embedding_dim': 256, 'lr': 0.007389396121397702, 'lambda_val': 0.0013951824703868495, 'batch_size': 3187, 'optimizer': 'RMSprop'}. Best is trial 111 with value: 0.07472210114927892.
2026-05-15 09:00:32,659 - optuna.study._optimize - INFO - Trial 118 pruned. 
2026-05-15 09:01:07,165 - optuna.study.study - INFO - Trial 119 finished with value: 0.06832640002638721 and parameters: {'n_layers': 1, 'embedding_dim': 256, 'lr': 0.010513977591895847, 'lambda_val': 0.00031425009647216936, 'batch_size': 3387, 'optimizer': 'RMSprop'}. Best is trial 111 with value: 0.07472210114927892.
2026-05-15 09:01:36,085 - optuna.study.study - INFO - Trial 120 finished with value: 0.04930963352088778 and parameters: {'n_layers': 1, 'embedding_dim': 64, 'lr': 0.003897081592690103, 'lambda_val': 0.0005426472328218477, 'batch_size': 2766, 'optimizer': 'RMSprop'}. Best is trial 111 with value: 0.07472210114927892.
2026-05-15 09:02:11,306 - optuna.study.study - INFO - Trial 121 finished with value: 0.06975395278135707 and parameters: {'n_layers': 1, 'embedding_dim': 256, 'lr': 0.008560710652567055, 'lambda_val': 0.0009063867217037586, 'batch_size': 3264, 'optimizer': 'RMSprop'}. Best is trial 111 with value: 0.07472210114927892.
2026-05-15 09:02:46,696 - optuna.study.study - INFO - Trial 122 finished with value: 0.07272126400634324 and parameters: {'n_layers': 1, 'embedding_dim': 256, 'lr': 0.008450375888999252, 'lambda_val': 0.0008589713418966785, 'batch_size': 2971, 'optimizer': 'RMSprop'}. Best is trial 111 with value: 0.07472210114927892.
2026-05-15 09:03:21,656 - optuna.study.study - INFO - Trial 123 finished with value: 0.07416980007591022 and parameters: {'n_layers': 1, 'embedding_dim': 256, 'lr': 0.007867129317867394, 'lambda_val': 0.0008844757680786149, 'batch_size': 2911, 'optimizer': 'RMSprop'}. Best is trial 111 with value: 0.07472210114927892.
2026-05-15 09:03:57,192 - optuna.study.study - INFO - Trial 124 finished with value: 0.06506493500645028 and parameters: {'n_layers': 1, 'embedding_dim': 256, 'lr': 0.0076258345695106085, 'lambda_val': 0.0018739821557252723, 'batch_size': 3016, 'optimizer': 'RMSprop'}. Best is trial 111 with value: 0.07472210114927892.
2026-05-15 09:04:31,818 - optuna.study.study - INFO - Trial 125 finished with value: 0.06690253545710957 and parameters: {'n_layers': 1, 'embedding_dim': 256, 'lr': 0.005060350830141759, 'lambda_val': 0.0009016297846188888, 'batch_size': 2954, 'optimizer': 'RMSprop'}. Best is trial 111 with value: 0.07472210114927892.
2026-05-15 09:05:06,722 - optuna.study.study - INFO - Trial 126 finished with value: 0.06656394637650516 and parameters: {'n_layers': 1, 'embedding_dim': 256, 'lr': 0.008767141520427955, 'lambda_val': 0.0012971410888824762, 'batch_size': 3238, 'optimizer': 'RMSprop'}. Best is trial 111 with value: 0.07472210114927892.
2026-05-15 09:05:41,562 - optuna.study.study - INFO - Trial 127 finished with value: 0.07541528397874628 and parameters: {'n_layers': 1, 'embedding_dim': 256, 'lr': 0.006314179000766532, 'lambda_val': 0.0007757876047773694, 'batch_size': 2897, 'optimizer': 'RMSprop'}. Best is trial 127 with value: 0.07541528397874628.
2026-05-15 09:06:16,241 - optuna.study.study - INFO - Trial 128 finished with value: 0.06497225066381254 and parameters: {'n_layers': 1, 'embedding_dim': 256, 'lr': 0.006924355732092859, 'lambda_val': 0.0003780837061238437, 'batch_size': 2863, 'optimizer': 'RMSprop'}. Best is trial 127 with value: 0.07541528397874628.
2026-05-15 09:06:20,957 - optuna.study._optimize - INFO - Trial 129 pruned. 
2026-05-15 09:06:55,977 - optuna.study.study - INFO - Trial 130 finished with value: 0.06501031040142617 and parameters: {'n_layers': 1, 'embedding_dim': 256, 'lr': 0.012522444442569877, 'lambda_val': 0.00217978166235789, 'batch_size': 2943, 'optimizer': 'RMSprop'}. Best is trial 127 with value: 0.07541528397874628.
2026-05-15 09:07:30,781 - optuna.study.study - INFO - Trial 131 finished with value: 0.06804855223708141 and parameters: {'n_layers': 1, 'embedding_dim': 256, 'lr': 0.008311796561271673, 'lambda_val': 0.0009525229018675877, 'batch_size': 3099, 'optimizer': 'RMSprop'}. Best is trial 127 with value: 0.07541528397874628.
2026-05-15 09:08:05,685 - optuna.study.study - INFO - Trial 132 finished with value: 0.06862009496460211 and parameters: {'n_layers': 1, 'embedding_dim': 256, 'lr': 0.013880824717720426, 'lambda_val': 0.0007397497759493806, 'batch_size': 3165, 'optimizer': 'RMSprop'}. Best is trial 127 with value: 0.07541528397874628.
2026-05-15 09:08:40,683 - optuna.study.study - INFO - Trial 133 finished with value: 0.07302232701471208 and parameters: {'n_layers': 1, 'embedding_dim': 256, 'lr': 0.009644155251043755, 'lambda_val': 0.000552305269874838, 'batch_size': 2814, 'optimizer': 'RMSprop'}. Best is trial 127 with value: 0.07541528397874628.
2026-05-15 09:08:45,068 - optuna.study._optimize - INFO - Trial 134 pruned. 
