2026-05-15 09:44:42,384 - optuna.study.study - INFO - Trial 36 finished with value: 0.010278456001887249 and parameters: {'n_layers': 1, 'embedding_dim': 32, 'lr': 0.00036700276729289107, 'lambda_val': 3.1742023927703297e-06, 'batch_size': 2188, 'optimizer': 'RMSprop'}. Best is trial 33 with value: 0.030986598774959583.
2026-05-15 09:44:45,958 - optuna.study._optimize - INFO - Trial 37 pruned. 
2026-05-15 09:45:13,061 - optuna.study.study - INFO - Trial 38 finished with value: 0.011474309410777607 and parameters: {'n_layers': 1, 'embedding_dim': 96, 'lr': 0.001118463443992664, 'lambda_val': 4.071835411357335e-05, 'batch_size': 2760, 'optimizer': 'Adam'}. Best is trial 33 with value: 0.030986598774959583.
2026-05-15 09:45:16,509 - optuna.study._optimize - INFO - Trial 39 pruned. 
2026-05-15 09:45:20,111 - optuna.study._optimize - INFO - Trial 40 pruned. 
2026-05-15 09:45:23,867 - optuna.study._optimize - INFO - Trial 41 pruned. 
2026-05-15 09:45:53,281 - optuna.study.study - INFO - Trial 42 finished with value: 0.005696211695190574 and parameters: {'n_layers': 3, 'embedding_dim': 96, 'lr': 0.00017740173455866782, 'lambda_val': 2.8097800952030013e-06, 'batch_size': 1819, 'optimizer': 'RMSprop'}. Best is trial 33 with value: 0.030986598774959583.
2026-05-15 09:45:56,757 - optuna.study._optimize - INFO - Trial 43 pruned. 
2026-05-15 09:46:23,606 - optuna.study.study - INFO - Trial 44 finished with value: 0.00952869363203775 and parameters: {'n_layers': 1, 'embedding_dim': 96, 'lr': 0.00024435522499834485, 'lambda_val': 8.515744852128881e-06, 'batch_size': 1518, 'optimizer': 'RMSprop'}. Best is trial 33 with value: 0.030986598774959583.
2026-05-15 09:46:27,115 - optuna.study._optimize - INFO - Trial 45 pruned. 
2026-05-15 09:46:56,119 - optuna.study.study - INFO - Trial 46 finished with value: 0.02313837571768997 and parameters: {'n_layers': 3, 'embedding_dim': 64, 'lr': 0.00010563807913832006, 'lambda_val': 7.379234869813988e-05, 'batch_size': 1270, 'optimizer': 'RMSprop'}. Best is trial 33 with value: 0.030986598774959583.
2026-05-15 09:47:21,689 - optuna.study.study - INFO - Trial 47 finished with value: 0.0258606038064109 and parameters: {'n_layers': 1, 'embedding_dim': 64, 'lr': 0.0001267349955459613, 'lambda_val': 5.510739587382975e-05, 'batch_size': 1195, 'optimizer': 'RMSprop'}. Best is trial 33 with value: 0.030986598774959583.
2026-05-15 09:47:25,747 - optuna.study._optimize - INFO - Trial 48 pruned. 
2026-05-15 09:47:54,606 - optuna.study.study - INFO - Trial 49 finished with value: 0.006187554212738183 and parameters: {'n_layers': 3, 'embedding_dim': 64, 'lr': 0.0002280354395409157, 'lambda_val': 5.69528841444833e-06, 'batch_size': 926, 'optimizer': 'RMSprop'}. Best is trial 33 with value: 0.030986598774959583.
2026-05-15 09:48:21,221 - optuna.study.study - INFO - Trial 50 finished with value: 0.021968147209548965 and parameters: {'n_layers': 1, 'embedding_dim': 64, 'lr': 0.00014726476739325328, 'lambda_val': 1.68820956467163e-05, 'batch_size': 1185, 'optimizer': 'RMSprop'}. Best is trial 33 with value: 0.030986598774959583.
2026-05-15 09:48:47,362 - optuna.study.study - INFO - Trial 51 finished with value: 0.02707024017990186 and parameters: {'n_layers': 1, 'embedding_dim': 64, 'lr': 0.00014074763077784913, 'lambda_val': 1.943399915917444e-05, 'batch_size': 1163, 'optimizer': 'RMSprop'}. Best is trial 33 with value: 0.030986598774959583.
2026-05-15 09:48:50,917 - optuna.study._optimize - INFO - Trial 52 pruned. 
2026-05-15 09:48:54,186 - optuna.study._optimize - INFO - Trial 53 pruned. 
2026-05-15 09:48:57,797 - optuna.study._optimize - INFO - Trial 54 pruned. 
2026-05-15 09:49:22,753 - optuna.study.study - INFO - Trial 55 finished with value: 0.015540876622138544 and parameters: {'n_layers': 2, 'embedding_dim': 64, 'lr': 0.00012079263930544569, 'lambda_val': 6.690891072851322e-05, 'batch_size': 683, 'optimizer': 'RMSprop'}. Best is trial 33 with value: 0.030986598774959583.
2026-05-15 09:49:49,091 - optuna.study.study - INFO - Trial 56 finished with value: 0.008414130026675879 and parameters: {'n_layers': 1, 'embedding_dim': 64, 'lr': 0.00025100631203389586, 'lambda_val': 4.082281050344104e-06, 'batch_size': 1571, 'optimizer': 'RMSprop'}. Best is trial 33 with value: 0.030986598774959583.
2026-05-15 09:50:15,467 - optuna.study.study - INFO - Trial 57 finished with value: 0.006374619302523661 and parameters: {'n_layers': 1, 'embedding_dim': 64, 'lr': 0.000394891100103604, 'lambda_val': 3.7751750107727287e-05, 'batch_size': 1623, 'optimizer': 'RMSprop'}. Best is trial 33 with value: 0.030986598774959583.
2026-05-15 09:50:18,768 - optuna.study._optimize - INFO - Trial 58 pruned. 
2026-05-15 09:50:22,547 - optuna.study._optimize - INFO - Trial 59 pruned. 
2026-05-15 09:50:26,313 - optuna.study._optimize - INFO - Trial 60 pruned. 
2026-05-15 09:50:53,112 - optuna.study.study - INFO - Trial 61 finished with value: 0.025237241377793346 and parameters: {'n_layers': 1, 'embedding_dim': 64, 'lr': 0.00013850285833286896, 'lambda_val': 2.0056198413752353e-05, 'batch_size': 1198, 'optimizer': 'RMSprop'}. Best is trial 33 with value: 0.030986598774959583.
2026-05-15 09:50:56,771 - optuna.study._optimize - INFO - Trial 62 pruned. 
2026-05-15 09:51:23,181 - optuna.study.study - INFO - Trial 63 finished with value: 0.012295235286980776 and parameters: {'n_layers': 1, 'embedding_dim': 64, 'lr': 0.00017220439549531653, 'lambda_val': 2.941493152773361e-05, 'batch_size': 1373, 'optimizer': 'RMSprop'}. Best is trial 33 with value: 0.030986598774959583.
2026-05-15 09:51:48,929 - optuna.study.study - INFO - Trial 64 finished with value: 0.029943946612282512 and parameters: {'n_layers': 1, 'embedding_dim': 64, 'lr': 0.0001255874596948841, 'lambda_val': 6.877647967408725e-05, 'batch_size': 1176, 'optimizer': 'RMSprop'}. Best is trial 33 with value: 0.030986598774959583.
2026-05-15 09:51:53,144 - optuna.study._optimize - INFO - Trial 65 pruned. 
2026-05-15 09:52:18,990 - optuna.study.study - INFO - Trial 66 finished with value: 0.03379145443536389 and parameters: {'n_layers': 1, 'embedding_dim': 64, 'lr': 0.00014324207150033213, 'lambda_val': 1.2432680349382486e-05, 'batch_size': 951, 'optimizer': 'RMSprop'}. Best is trial 66 with value: 0.03379145443536389.
2026-05-15 09:52:45,002 - optuna.study.study - INFO - Trial 67 finished with value: 0.009744504175823683 and parameters: {'n_layers': 1, 'embedding_dim': 64, 'lr': 0.0005256688560687385, 'lambda_val': 1.3293877312488781e-05, 'batch_size': 918, 'optimizer': 'RMSprop'}. Best is trial 66 with value: 0.03379145443536389.
2026-05-15 09:52:48,499 - optuna.study._optimize - INFO - Trial 68 pruned. 
2026-05-15 09:53:14,421 - optuna.study.study - INFO - Trial 69 finished with value: 0.02765087709351254 and parameters: {'n_layers': 1, 'embedding_dim': 64, 'lr': 0.00014590935597554895, 'lambda_val': 0.0001657001590032838, 'batch_size': 1104, 'optimizer': 'RMSprop'}. Best is trial 66 with value: 0.03379145443536389.
2026-05-15 09:53:40,993 - optuna.study.study - INFO - Trial 70 finished with value: 0.00914450089146457 and parameters: {'n_layers': 1, 'embedding_dim': 64, 'lr': 0.0002965058854036888, 'lambda_val': 0.0001466948785856444, 'batch_size': 1060, 'optimizer': 'Adam'}. Best is trial 66 with value: 0.03379145443536389.
2026-05-15 09:54:07,454 - optuna.study.study - INFO - Trial 71 finished with value: 0.029941162490507055 and parameters: {'n_layers': 1, 'embedding_dim': 64, 'lr': 0.00013831429797922374, 'lambda_val': 5.073663010714293e-05, 'batch_size': 1166, 'optimizer': 'RMSprop'}. Best is trial 66 with value: 0.03379145443536389.
2026-05-15 09:54:28,617 - optuna.study.study - INFO - Trial 72 finished with value: 0.018637895827731323 and parameters: {'n_layers': 1, 'embedding_dim': 64, 'lr': 0.00018184967462557273, 'lambda_val': 0.0004276463753375671, 'batch_size': 974, 'optimizer': 'RMSprop'}. Best is trial 66 with value: 0.03379145443536389.
2026-05-15 09:54:51,890 - optuna.study.study - INFO - Trial 73 finished with value: 0.007899016479521981 and parameters: {'n_layers': 1, 'embedding_dim': 64, 'lr': 0.00042424213746474675, 'lambda_val': 8.246350188735001e-05, 'batch_size': 679, 'optimizer': 'RMSprop'}. Best is trial 66 with value: 0.03379145443536389.
2026-05-15 09:55:20,741 - optuna.study.study - INFO - Trial 74 finished with value: 0.01813178233544274 and parameters: {'n_layers': 1, 'embedding_dim': 256, 'lr': 8.853869608623252e-05, 'lambda_val': 4.5491324254459934e-05, 'batch_size': 1132, 'optimizer': 'RMSprop'}. Best is trial 66 with value: 0.03379145443536389.
2026-05-15 09:55:46,444 - optuna.study.study - INFO - Trial 75 finished with value: 0.021363755407731885 and parameters: {'n_layers': 1, 'embedding_dim': 64, 'lr': 0.00013351645902954002, 'lambda_val': 0.00014912899627220937, 'batch_size': 1388, 'optimizer': 'RMSprop'}. Best is trial 66 with value: 0.03379145443536389.
2026-05-15 09:56:11,823 - optuna.study.study - INFO - Trial 76 finished with value: 0.012194872061180709 and parameters: {'n_layers': 1, 'embedding_dim': 96, 'lr': 0.0007412151780419667, 'lambda_val': 0.0002241640048867275, 'batch_size': 1031, 'optimizer': 'RMSprop'}. Best is trial 66 with value: 0.03379145443536389.
2026-05-15 09:56:15,732 - optuna.study._optimize - INFO - Trial 77 pruned. 
2026-05-15 09:56:19,309 - optuna.study._optimize - INFO - Trial 78 pruned. 
2026-05-15 09:56:23,456 - optuna.study._optimize - INFO - Trial 79 pruned. 
2026-05-15 09:56:26,766 - optuna.study._optimize - INFO - Trial 80 pruned. 
2026-05-15 09:56:52,887 - optuna.study.study - INFO - Trial 81 finished with value: 0.01822297455173134 and parameters: {'n_layers': 1, 'embedding_dim': 64, 'lr': 0.0001657974921579051, 'lambda_val': 3.549505439282252e-05, 'batch_size': 1248, 'optimizer': 'RMSprop'}. Best is trial 66 with value: 0.03379145443536389.
2026-05-15 09:57:20,137 - optuna.study.study - INFO - Trial 82 finished with value: 0.005725553493366991 and parameters: {'n_layers': 1, 'embedding_dim': 64, 'lr': 0.0003058198719272366, 'lambda_val': 0.00010571846657724568, 'batch_size': 1178, 'optimizer': 'RMSprop'}. Best is trial 66 with value: 0.03379145443536389.
2026-05-15 09:57:45,535 - optuna.study.study - INFO - Trial 83 finished with value: 0.0325988168074725 and parameters: {'n_layers': 1, 'embedding_dim': 64, 'lr': 0.0001340742688411766, 'lambda_val': 1.5703926654996407e-05, 'batch_size': 912, 'optimizer': 'RMSprop'}. Best is trial 66 with value: 0.03379145443536389.
2026-05-15 09:58:11,029 - optuna.study.study - INFO - Trial 84 finished with value: 0.01840609743902576 and parameters: {'n_layers': 1, 'embedding_dim': 64, 'lr': 0.00019401466324355445, 'lambda_val': 1.4196989412695155e-05, 'batch_size': 878, 'optimizer': 'RMSprop'}. Best is trial 66 with value: 0.03379145443536389.
2026-05-15 09:58:14,151 - optuna.study._optimize - INFO - Trial 85 pruned. 
2026-05-15 09:58:37,886 - optuna.study.study - INFO - Trial 86 finished with value: 0.03310475649634704 and parameters: {'n_layers': 1, 'embedding_dim': 64, 'lr': 0.00012270839778764206, 'lambda_val': 5.6161706088750585e-05, 'batch_size': 978, 'optimizer': 'RMSprop'}. Best is trial 66 with value: 0.03379145443536389.
2026-05-15 09:59:07,134 - optuna.study.study - INFO - Trial 87 finished with value: 0.013114945890581972 and parameters: {'n_layers': 1, 'embedding_dim': 256, 'lr': 0.00027729236277398934, 'lambda_val': 7.764385090312601e-06, 'batch_size': 976, 'optimizer': 'Adam'}. Best is trial 66 with value: 0.03379145443536389.
2026-05-15 09:59:10,842 - optuna.study._optimize - INFO - Trial 88 pruned. 
2026-05-15 09:59:14,620 - optuna.study._optimize - INFO - Trial 89 pruned. 
2026-05-15 09:59:41,808 - optuna.study.study - INFO - Trial 90 finished with value: 0.03619690984232906 and parameters: {'n_layers': 1, 'embedding_dim': 64, 'lr': 0.0001557529481421456, 'lambda_val': 0.00017882133318776277, 'batch_size': 516, 'optimizer': 'RMSprop'}. Best is trial 90 with value: 0.03619690984232906.
2026-05-15 09:59:45,594 - optuna.study._optimize - INFO - Trial 91 pruned. 
2026-05-15 10:00:11,780 - optuna.study.study - INFO - Trial 92 finished with value: 0.028667737668801326 and parameters: {'n_layers': 1, 'embedding_dim': 64, 'lr': 0.00020731390409816825, 'lambda_val': 0.00018604661704918645, 'batch_size': 665, 'optimizer': 'RMSprop'}. Best is trial 90 with value: 0.03619690984232906.
2026-05-15 10:00:36,790 - optuna.study.study - INFO - Trial 93 finished with value: 0.01841106642505266 and parameters: {'n_layers': 1, 'embedding_dim': 64, 'lr': 0.00020470188300285923, 'lambda_val': 0.00017666084920626285, 'batch_size': 620, 'optimizer': 'RMSprop'}. Best is trial 90 with value: 0.03619690984232906.
2026-05-15 10:01:02,511 - optuna.study.study - INFO - Trial 94 finished with value: 0.007371153192782608 and parameters: {'n_layers': 1, 'embedding_dim': 64, 'lr': 0.0004723936766499971, 'lambda_val': 0.00012446030256431476, 'batch_size': 700, 'optimizer': 'RMSprop'}. Best is trial 90 with value: 0.03619690984232906.
2026-05-15 10:01:05,839 - optuna.study._optimize - INFO - Trial 95 pruned. 
2026-05-15 10:01:32,268 - optuna.study.study - INFO - Trial 96 finished with value: 0.0268003867341559 and parameters: {'n_layers': 1, 'embedding_dim': 96, 'lr': 0.00015695896305157657, 'lambda_val': 6.297724946571994e-05, 'batch_size': 607, 'optimizer': 'RMSprop'}. Best is trial 90 with value: 0.03619690984232906.
2026-05-15 10:01:35,503 - optuna.study._optimize - INFO - Trial 97 pruned. 
2026-05-15 10:01:39,037 - optuna.study._optimize - INFO - Trial 98 pruned. 
2026-05-15 10:01:42,339 - optuna.study._optimize - INFO - Trial 99 pruned. 
2026-05-15 10:02:09,192 - optuna.study.study - INFO - Trial 100 finished with value: 0.00860462757765234 and parameters: {'n_layers': 1, 'embedding_dim': 64, 'lr': 0.0002353944317834117, 'lambda_val': 0.00016587654759921548, 'batch_size': 2172, 'optimizer': 'RMSprop'}. Best is trial 90 with value: 0.03619690984232906.
2026-05-15 10:02:35,794 - optuna.study.study - INFO - Trial 101 finished with value: 0.02834048509032661 and parameters: {'n_layers': 1, 'embedding_dim': 64, 'lr': 0.0001500878572741467, 'lambda_val': 1.7773600162864695e-05, 'batch_size': 1085, 'optimizer': 'RMSprop'}. Best is trial 90 with value: 0.03619690984232906.
2026-05-15 10:02:39,472 - optuna.study._optimize - INFO - Trial 102 pruned. 
2026-05-15 10:02:42,818 - optuna.study._optimize - INFO - Trial 103 pruned. 
2026-05-15 10:02:46,100 - optuna.study._optimize - INFO - Trial 104 pruned. 
2026-05-15 10:03:13,032 - optuna.study.study - INFO - Trial 105 finished with value: 0.00899347075620293 and parameters: {'n_layers': 1, 'embedding_dim': 96, 'lr': 0.00020085447264695956, 'lambda_val': 0.0001224538856802062, 'batch_size': 999, 'optimizer': 'RMSprop'}. Best is trial 90 with value: 0.03619690984232906.
2026-05-15 10:03:39,563 - optuna.study.study - INFO - Trial 106 finished with value: 0.010371160632233057 and parameters: {'n_layers': 1, 'embedding_dim': 64, 'lr': 0.0014242045118110112, 'lambda_val': 3.527361906950804e-05, 'batch_size': 636, 'optimizer': 'RMSprop'}. Best is trial 90 with value: 0.03619690984232906.
2026-05-15 10:03:43,324 - optuna.study._optimize - INFO - Trial 107 pruned. 
2026-05-15 10:04:12,684 - optuna.study.study - INFO - Trial 108 finished with value: 0.011969343600328579 and parameters: {'n_layers': 1, 'embedding_dim': 256, 'lr': 0.0002584368229075221, 'lambda_val': 2.3320007971806534e-05, 'batch_size': 1589, 'optimizer': 'RMSprop'}. Best is trial 90 with value: 0.03619690984232906.
2026-05-15 10:04:16,064 - optuna.study._optimize - INFO - Trial 109 pruned. 
2026-05-15 10:04:40,187 - optuna.study.study - INFO - Trial 110 finished with value: 0.010991220345766533 and parameters: {'n_layers': 1, 'embedding_dim': 96, 'lr': 0.0007203635754466002, 'lambda_val': 4.2575164909767745e-06, 'batch_size': 782, 'optimizer': 'RMSprop'}. Best is trial 90 with value: 0.03619690984232906.
2026-05-15 10:04:43,951 - optuna.study._optimize - INFO - Trial 111 pruned. 
2026-05-15 10:04:47,657 - optuna.study._optimize - INFO - Trial 112 pruned. 
2026-05-15 10:04:51,386 - optuna.study._optimize - INFO - Trial 113 pruned. 
2026-05-15 10:04:54,665 - optuna.study._optimize - INFO - Trial 114 pruned. 
2026-05-15 10:05:20,016 - optuna.study.study - INFO - Trial 115 finished with value: 0.014493224514494484 and parameters: {'n_layers': 1, 'embedding_dim': 64, 'lr': 0.00015590139831081056, 'lambda_val': 8.880636862019665e-06, 'batch_size': 1900, 'optimizer': 'RMSprop'}. Best is trial 90 with value: 0.03619690984232906.
2026-05-15 10:05:47,425 - optuna.study.study - INFO - Trial 116 finished with value: 0.006280341318948275 and parameters: {'n_layers': 1, 'embedding_dim': 64, 'lr': 0.00018967805626680286, 'lambda_val': 2.2429256062221125e-05, 'batch_size': 2639, 'optimizer': 'RMSprop'}. Best is trial 90 with value: 0.03619690984232906.
2026-05-15 10:06:13,363 - optuna.study.study - INFO - Trial 117 finished with value: 0.009291204783724302 and parameters: {'n_layers': 1, 'embedding_dim': 128, 'lr': 0.00013270467845434127, 'lambda_val': 0.00042724167471944186, 'batch_size': 1193, 'optimizer': 'RMSprop'}. Best is trial 90 with value: 0.03619690984232906.
2026-05-15 10:06:16,695 - optuna.study._optimize - INFO - Trial 118 pruned. 
2026-05-15 10:06:20,748 - optuna.study._optimize - INFO - Trial 119 pruned. 
2026-05-15 10:06:24,159 - optuna.study._optimize - INFO - Trial 120 pruned. 
2026-05-15 10:06:56,845 - optuna.study.study - INFO - Trial 121 finished with value: 0.02790210018671755 and parameters: {'n_layers': 1, 'embedding_dim': 96, 'lr': 0.00016545484028303208, 'lambda_val': 7.826051883886355e-05, 'batch_size': 566, 'optimizer': 'RMSprop'}. Best is trial 90 with value: 0.03619690984232906.
2026-05-15 10:07:02,124 - optuna.study._optimize - INFO - Trial 122 pruned. 
2026-05-15 10:07:41,841 - optuna.study.study - INFO - Trial 123 finished with value: 0.02143922254570948 and parameters: {'n_layers': 1, 'embedding_dim': 96, 'lr': 0.00017117147996307204, 'lambda_val': 5.490644802035283e-06, 'batch_size': 688, 'optimizer': 'RMSprop'}. Best is trial 90 with value: 0.03619690984232906.
2026-05-15 10:08:13,299 - optuna.study.study - INFO - Trial 124 finished with value: 0.007799521029263246 and parameters: {'n_layers': 1, 'embedding_dim': 96, 'lr': 0.00027254069138853935, 'lambda_val': 0.00020283570075947113, 'batch_size': 523, 'optimizer': 'RMSprop'}. Best is trial 90 with value: 0.03619690984232906.
2026-05-15 10:08:16,881 - optuna.study._optimize - INFO - Trial 125 pruned. 
2026-05-15 10:08:43,455 - optuna.study.study - INFO - Trial 126 finished with value: 0.011476670464994005 and parameters: {'n_layers': 1, 'embedding_dim': 96, 'lr': 0.00014316290683855416, 'lambda_val': 7.040063262434788e-05, 'batch_size': 1234, 'optimizer': 'RMSprop'}. Best is trial 90 with value: 0.03619690984232906.
2026-05-15 10:08:47,076 - optuna.study._optimize - INFO - Trial 127 pruned. 
2026-05-15 10:09:13,577 - optuna.study.study - INFO - Trial 128 finished with value: 0.015374460997609541 and parameters: {'n_layers': 1, 'embedding_dim': 64, 'lr': 0.00019152489577345941, 'lambda_val': 5.557130661532529e-05, 'batch_size': 751, 'optimizer': 'Adam'}. Best is trial 90 with value: 0.03619690984232906.
2026-05-15 10:09:38,342 - optuna.study.study - INFO - Trial 129 finished with value: 0.009031001087533309 and parameters: {'n_layers': 1, 'embedding_dim': 64, 'lr': 0.0003773440711404713, 'lambda_val': 1.3082626705458638e-05, 'batch_size': 980, 'optimizer': 'RMSprop'}. Best is trial 90 with value: 0.03619690984232906.
2026-05-15 10:09:42,376 - optuna.study._optimize - INFO - Trial 130 pruned. 
2026-05-15 10:10:08,072 - optuna.study.study - INFO - Trial 131 finished with value: 0.033450259993646765 and parameters: {'n_layers': 1, 'embedding_dim': 96, 'lr': 0.00014765660805838551, 'lambda_val': 6.250805345656682e-05, 'batch_size': 583, 'optimizer': 'RMSprop'}. Best is trial 90 with value: 0.03619690984232906.
2026-05-15 10:10:11,500 - optuna.study._optimize - INFO - Trial 132 pruned. 
2026-05-15 10:10:37,577 - optuna.study.study - INFO - Trial 133 finished with value: 0.022099291874146068 and parameters: {'n_layers': 1, 'embedding_dim': 96, 'lr': 0.0001572266556418901, 'lambda_val': 4.34785803892118e-05, 'batch_size': 862, 'optimizer': 'RMSprop'}. Best is trial 90 with value: 0.03619690984232906.
2026-05-15 10:10:40,987 - optuna.study._optimize - INFO - Trial 134 pruned. 
2026-05-15 10:11:07,082 - optuna.study.study - INFO - Trial 135 finished with value: 0.008866659849455854 and parameters: {'n_layers': 1, 'embedding_dim': 64, 'lr': 0.0002135457325103524, 'lambda_val': 0.00011659954162552217, 'batch_size': 1051, 'optimizer': 'RMSprop'}. Best is trial 90 with value: 0.03619690984232906.
2026-05-15 10:11:10,747 - optuna.study._optimize - INFO - Trial 136 pruned. 
2026-05-15 10:11:36,566 - optuna.study.study - INFO - Trial 137 finished with value: 0.00884929987621306 and parameters: {'n_layers': 1, 'embedding_dim': 96, 'lr': 0.0003127199597206355, 'lambda_val': 9.381716488466066e-06, 'batch_size': 640, 'optimizer': 'RMSprop'}. Best is trial 90 with value: 0.03619690984232906.
2026-05-15 10:11:40,209 - optuna.study._optimize - INFO - Trial 138 pruned. 
2026-05-15 10:11:43,487 - optuna.study._optimize - INFO - Trial 139 pruned. 
2026-05-15 10:11:47,713 - optuna.study._optimize - INFO - Trial 140 pruned. 
2026-05-15 10:12:13,589 - optuna.study.study - INFO - Trial 141 finished with value: 0.02752452132689727 and parameters: {'n_layers': 1, 'embedding_dim': 96, 'lr': 0.00015145174030632653, 'lambda_val': 6.47733586314606e-05, 'batch_size': 700, 'optimizer': 'RMSprop'}. Best is trial 90 with value: 0.03619690984232906.
