2026-05-15 06:37:52,631 - optuna.study._optimize - INFO - Trial 165 pruned. 
2026-05-15 06:37:56,530 - optuna.study._optimize - INFO - Trial 166 pruned. 
2026-05-15 06:39:10,838 - optuna.study.study - INFO - Trial 167 finished with value: 0.07560991507991643 and parameters: {'n_layers': 1, 'embedding_dim': 256, 'lr': 0.00043981479768979124, 'lambda_val': 1.1908625537531706e-06, 'batch_size': 1279, 'optimizer': 'RMSprop'}. Best is trial 43 with value: 0.0847902001530553.
2026-05-15 06:39:21,220 - optuna.study._optimize - INFO - Trial 168 pruned. 
2026-05-15 06:39:31,341 - optuna.study._optimize - INFO - Trial 169 pruned. 
2026-05-15 06:40:24,175 - optuna.study.study - INFO - Trial 170 finished with value: 0.08332828343979931 and parameters: {'n_layers': 1, 'embedding_dim': 256, 'lr': 0.0002065794674338114, 'lambda_val': 2.0889619752616393e-05, 'batch_size': 2207, 'optimizer': 'RMSprop'}. Best is trial 43 with value: 0.0847902001530553.
2026-05-15 06:40:32,491 - optuna.study._optimize - INFO - Trial 171 pruned. 
2026-05-15 06:40:42,822 - optuna.study._optimize - INFO - Trial 172 pruned. 
2026-05-15 06:40:53,866 - optuna.study._optimize - INFO - Trial 173 pruned. 
2026-05-15 06:41:39,806 - optuna.study.study - INFO - Trial 174 finished with value: 0.08235217291548408 and parameters: {'n_layers': 1, 'embedding_dim': 256, 'lr': 0.0002557235842647935, 'lambda_val': 3.346448474821262e-05, 'batch_size': 2520, 'optimizer': 'RMSprop'}. Best is trial 43 with value: 0.0847902001530553.
2026-05-15 06:41:46,496 - optuna.study._optimize - INFO - Trial 175 pruned. 
2026-05-15 06:42:46,188 - optuna.study.study - INFO - Trial 176 finished with value: 0.09667886028792533 and parameters: {'n_layers': 1, 'embedding_dim': 256, 'lr': 0.00015307634158511117, 'lambda_val': 2.1353196343566097e-05, 'batch_size': 2414, 'optimizer': 'RMSprop'}. Best is trial 176 with value: 0.09667886028792533.
2026-05-15 06:42:55,847 - optuna.study._optimize - INFO - Trial 177 pruned. 
2026-05-15 06:43:02,319 - optuna.study._optimize - INFO - Trial 178 pruned. 
2026-05-15 06:43:07,397 - optuna.study._optimize - INFO - Trial 179 pruned. 
2026-05-15 06:44:23,474 - optuna.study.study - INFO - Trial 180 finished with value: 0.0896507319558193 and parameters: {'n_layers': 1, 'embedding_dim': 256, 'lr': 0.00013838060005636783, 'lambda_val': 1.1801069397416312e-05, 'batch_size': 2501, 'optimizer': 'RMSprop'}. Best is trial 176 with value: 0.09667886028792533.
2026-05-15 06:44:28,147 - optuna.study._optimize - INFO - Trial 181 pruned. 
2026-05-15 06:45:40,078 - optuna.study.study - INFO - Trial 182 finished with value: 0.08054785554447053 and parameters: {'n_layers': 1, 'embedding_dim': 256, 'lr': 0.00017846379964222143, 'lambda_val': 1.2245247138507464e-05, 'batch_size': 2704, 'optimizer': 'RMSprop'}. Best is trial 176 with value: 0.09667886028792533.
2026-05-15 06:45:44,363 - optuna.study._optimize - INFO - Trial 183 pruned. 
2026-05-15 06:45:51,893 - optuna.study._optimize - INFO - Trial 184 pruned. 
2026-05-15 06:45:59,181 - optuna.study._optimize - INFO - Trial 185 pruned. 
2026-05-15 06:46:05,447 - optuna.study._optimize - INFO - Trial 186 pruned. 
2026-05-15 06:46:11,622 - optuna.study._optimize - INFO - Trial 187 pruned. 
2026-05-15 06:46:20,522 - optuna.study._optimize - INFO - Trial 188 pruned. 
2026-05-15 06:47:17,927 - optuna.study.study - INFO - Trial 189 finished with value: 0.07742077843672543 and parameters: {'n_layers': 1, 'embedding_dim': 256, 'lr': 0.0002683052137647997, 'lambda_val': 1.722264391308501e-05, 'batch_size': 2746, 'optimizer': 'RMSprop'}. Best is trial 176 with value: 0.09667886028792533.
2026-05-15 06:47:24,744 - optuna.study._optimize - INFO - Trial 190 pruned. 
2026-05-15 06:48:09,997 - optuna.study.study - INFO - Trial 191 finished with value: 0.07529173026500179 and parameters: {'n_layers': 1, 'embedding_dim': 256, 'lr': 0.00020397508030564558, 'lambda_val': 2.04952993565545e-05, 'batch_size': 2879, 'optimizer': 'RMSprop'}. Best is trial 176 with value: 0.09667886028792533.
2026-05-15 06:48:56,993 - optuna.study.study - INFO - Trial 192 finished with value: 0.07092429232533597 and parameters: {'n_layers': 1, 'embedding_dim': 256, 'lr': 0.0002480372373179926, 'lambda_val': 2.6405799641587546e-05, 'batch_size': 2944, 'optimizer': 'RMSprop'}. Best is trial 176 with value: 0.09667886028792533.
2026-05-15 06:49:05,767 - optuna.study._optimize - INFO - Trial 193 pruned. 
2026-05-15 06:49:13,331 - optuna.study._optimize - INFO - Trial 194 pruned. 
2026-05-15 06:50:14,447 - optuna.study.study - INFO - Trial 195 finished with value: 0.0773567435983175 and parameters: {'n_layers': 1, 'embedding_dim': 256, 'lr': 0.0003113694929193965, 'lambda_val': 4.873218507937935e-05, 'batch_size': 2789, 'optimizer': 'RMSprop'}. Best is trial 176 with value: 0.09667886028792533.
2026-05-15 06:50:18,858 - optuna.study._optimize - INFO - Trial 196 pruned. 
2026-05-15 06:50:27,682 - optuna.study._optimize - INFO - Trial 197 pruned. 
2026-05-15 06:50:47,216 - optuna.study._optimize - INFO - Trial 198 pruned. 
2026-05-15 06:50:54,830 - optuna.study._optimize - INFO - Trial 199 pruned. 
2026-05-15 06:51:23,980 - root - INFO - **** Training e_100K_1c2dcs
2026-05-15 06:51:23,980 - root - INFO -   ** 2-Dominant stats:
2026-05-15 06:51:23,980 - root - INFO -   ** Finding the dominant set:
2026-05-15 06:51:42,940 - root - INFO -   ** Getting the trainable edges:
2026-05-15 06:51:42,945 - helper_functions - INFO -      Number of nodes: 3657
2026-05-15 06:51:42,945 - helper_functions - INFO -      Ratio: 0.4035978368833462
2026-05-15 06:51:42,945 - helper_functions - INFO -      Number of unique users: 325
2026-05-15 06:51:42,945 - helper_functions - INFO -      Number of unique items: 3332
2026-05-15 06:51:42,945 - helper_functions - INFO -      Total dominant set edge: 11366
2026-05-15 06:51:42,945 - helper_functions - INFO -      Trainable edges: 9092.800000000001
2026-05-15 06:51:42,948 - root - INFO -   **** Getting 11366 dominant set edges
2026-05-15 06:51:43,070 - optuna.storages._rdb.storage - INFO - A new study created in RDB with name: Study_e_100K_1c2dcs_strict
2026-05-15 06:52:24,296 - optuna.study.study - INFO - Trial 0 finished with value: 0.00931398352205282 and parameters: {'n_layers': 1, 'embedding_dim': 32, 'lr': 0.006359231814093954, 'lambda_val': 0.002187077553055139, 'batch_size': 1182, 'optimizer': 'RMSprop'}. Best is trial 0 with value: 0.00931398352205282.
2026-05-15 06:53:29,120 - optuna.study.study - INFO - Trial 1 finished with value: 0.008829888105659319 and parameters: {'n_layers': 3, 'embedding_dim': 256, 'lr': 4.002883750829943e-05, 'lambda_val': 5.735424795088957e-05, 'batch_size': 2710, 'optimizer': 'Adam'}. Best is trial 0 with value: 0.00931398352205282.
2026-05-15 06:54:15,927 - optuna.study.study - INFO - Trial 2 finished with value: 0.0027252395413516093 and parameters: {'n_layers': 1, 'embedding_dim': 32, 'lr': 0.0004126871082415558, 'lambda_val': 0.05847426569359775, 'batch_size': 3356, 'optimizer': 'SGD'}. Best is trial 0 with value: 0.00931398352205282.
2026-05-15 06:55:07,274 - optuna.study.study - INFO - Trial 3 finished with value: 0.000831992941476446 and parameters: {'n_layers': 4, 'embedding_dim': 128, 'lr': 0.0019699257815028277, 'lambda_val': 0.0001253598370986951, 'batch_size': 2573, 'optimizer': 'SGD'}. Best is trial 0 with value: 0.00931398352205282.
2026-05-15 06:55:34,797 - optuna.study.study - INFO - Trial 4 finished with value: 0.002518115276078732 and parameters: {'n_layers': 2, 'embedding_dim': 32, 'lr': 0.0006071596106002913, 'lambda_val': 0.010151258644202747, 'batch_size': 3836, 'optimizer': 'SGD'}. Best is trial 0 with value: 0.00931398352205282.
2026-05-15 06:55:39,004 - optuna.study._optimize - INFO - Trial 5 pruned. 
2026-05-15 06:55:43,047 - optuna.study._optimize - INFO - Trial 6 pruned. 
2026-05-15 06:56:10,638 - optuna.study.study - INFO - Trial 7 finished with value: 1.6586223482775207e-05 and parameters: {'n_layers': 4, 'embedding_dim': 32, 'lr': 0.000418934096766058, 'lambda_val': 0.01279514283428722, 'batch_size': 1094, 'optimizer': 'Adam'}. Best is trial 0 with value: 0.00931398352205282.
2026-05-15 06:56:50,307 - optuna.study.study - INFO - Trial 8 finished with value: 0.004834863966545037 and parameters: {'n_layers': 2, 'embedding_dim': 256, 'lr': 0.000614190425753399, 'lambda_val': 2.441598746324862e-06, 'batch_size': 2965, 'optimizer': 'Adam'}. Best is trial 0 with value: 0.00931398352205282.
2026-05-15 06:57:31,330 - optuna.study.study - INFO - Trial 9 finished with value: 0.009120401016216358 and parameters: {'n_layers': 2, 'embedding_dim': 96, 'lr': 2.479188041007646e-05, 'lambda_val': 0.00020761634978687192, 'batch_size': 2722, 'optimizer': 'RMSprop'}. Best is trial 0 with value: 0.00931398352205282.
2026-05-15 06:58:27,349 - optuna.study.study - INFO - Trial 10 finished with value: 0.010559909649696136 and parameters: {'n_layers': 1, 'embedding_dim': 64, 'lr': 0.025304825600796315, 'lambda_val': 0.001835163529525667, 'batch_size': 1381, 'optimizer': 'RMSprop'}. Best is trial 10 with value: 0.010559909649696136.
2026-05-15 06:59:07,898 - optuna.study.study - INFO - Trial 11 finished with value: 0.010362005794774524 and parameters: {'n_layers': 1, 'embedding_dim': 64, 'lr': 0.03538945583440119, 'lambda_val': 0.0023991545671310914, 'batch_size': 1287, 'optimizer': 'RMSprop'}. Best is trial 10 with value: 0.010559909649696136.
2026-05-15 06:59:40,873 - optuna.study.study - INFO - Trial 12 finished with value: 0.010474174000672508 and parameters: {'n_layers': 1, 'embedding_dim': 64, 'lr': 0.09066039364101645, 'lambda_val': 0.0014326008415542644, 'batch_size': 1764, 'optimizer': 'RMSprop'}. Best is trial 10 with value: 0.010559909649696136.
2026-05-15 07:00:23,434 - optuna.study.study - INFO - Trial 13 finished with value: 0.010609171023198494 and parameters: {'n_layers': 1, 'embedding_dim': 64, 'lr': 0.09777026212257425, 'lambda_val': 0.0012347246896610216, 'batch_size': 1946, 'optimizer': 'RMSprop'}. Best is trial 13 with value: 0.010609171023198494.
2026-05-15 07:00:37,373 - optuna.study._optimize - INFO - Trial 14 pruned. 
2026-05-15 07:00:42,717 - optuna.study._optimize - INFO - Trial 15 pruned. 
2026-05-15 07:00:58,231 - optuna.study._optimize - INFO - Trial 16 pruned. 
2026-05-15 07:01:36,396 - optuna.study.study - INFO - Trial 17 finished with value: 0.011527973944983826 and parameters: {'n_layers': 1, 'embedding_dim': 96, 'lr': 0.013939034252203138, 'lambda_val': 0.0004175351229535752, 'batch_size': 1635, 'optimizer': 'RMSprop'}. Best is trial 17 with value: 0.011527973944983826.
2026-05-15 07:01:42,220 - optuna.study._optimize - INFO - Trial 18 pruned. 
2026-05-15 07:02:33,421 - optuna.study.study - INFO - Trial 19 finished with value: 0.007218655238165728 and parameters: {'n_layers': 2, 'embedding_dim': 96, 'lr': 0.043180395872877024, 'lambda_val': 1.4403470741321052e-05, 'batch_size': 1600, 'optimizer': 'RMSprop'}. Best is trial 17 with value: 0.011527973944983826.
2026-05-15 07:02:37,606 - optuna.study._optimize - INFO - Trial 20 pruned. 
2026-05-15 07:03:20,577 - optuna.study.study - INFO - Trial 21 finished with value: 0.010929989811467778 and parameters: {'n_layers': 1, 'embedding_dim': 64, 'lr': 0.02021615226624062, 'lambda_val': 0.00041593453661860363, 'batch_size': 1609, 'optimizer': 'RMSprop'}. Best is trial 17 with value: 0.011527973944983826.
2026-05-15 07:04:02,197 - optuna.study.study - INFO - Trial 22 finished with value: 0.01080417165598072 and parameters: {'n_layers': 1, 'embedding_dim': 64, 'lr': 0.013134428699576857, 'lambda_val': 0.0003757022049269492, 'batch_size': 2305, 'optimizer': 'RMSprop'}. Best is trial 17 with value: 0.011527973944983826.
2026-05-15 07:04:17,666 - optuna.study._optimize - INFO - Trial 23 pruned. 
2026-05-15 07:04:59,009 - optuna.study.study - INFO - Trial 24 finished with value: 0.010439563484960302 and parameters: {'n_layers': 1, 'embedding_dim': 64, 'lr': 0.0013356040481504975, 'lambda_val': 0.00014697974884525083, 'batch_size': 1571, 'optimizer': 'RMSprop'}. Best is trial 17 with value: 0.011527973944983826.
2026-05-15 07:05:43,605 - optuna.study.study - INFO - Trial 25 finished with value: 0.012002857631825513 and parameters: {'n_layers': 1, 'embedding_dim': 256, 'lr': 0.003878207826071564, 'lambda_val': 0.0006206893010627479, 'batch_size': 2362, 'optimizer': 'RMSprop'}. Best is trial 25 with value: 0.012002857631825513.
2026-05-15 07:05:50,011 - optuna.study._optimize - INFO - Trial 26 pruned. 
2026-05-15 07:06:43,060 - optuna.study.study - INFO - Trial 27 finished with value: 0.010502717980965179 and parameters: {'n_layers': 1, 'embedding_dim': 256, 'lr': 0.006508816528273843, 'lambda_val': 2.2119108859663047e-05, 'batch_size': 1580, 'optimizer': 'RMSprop'}. Best is trial 25 with value: 0.012002857631825513.
2026-05-15 07:06:59,901 - optuna.study._optimize - INFO - Trial 28 pruned. 
2026-05-15 07:07:22,207 - optuna.study.study - INFO - Trial 29 finished with value: 0.009667898782389144 and parameters: {'n_layers': 1, 'embedding_dim': 96, 'lr': 0.006786701038155347, 'lambda_val': 0.0029812789441431634, 'batch_size': 919, 'optimizer': 'Adam'}. Best is trial 25 with value: 0.012002857631825513.
2026-05-15 07:07:25,195 - optuna.study._optimize - INFO - Trial 30 pruned. 
2026-05-15 07:07:52,338 - optuna.study.study - INFO - Trial 31 finished with value: 0.010688064262200047 and parameters: {'n_layers': 1, 'embedding_dim': 256, 'lr': 0.01258292700583214, 'lambda_val': 0.00026888472672367445, 'batch_size': 2348, 'optimizer': 'RMSprop'}. Best is trial 25 with value: 0.012002857631825513.
2026-05-15 07:08:18,503 - optuna.study.study - INFO - Trial 32 finished with value: 0.010273635397158766 and parameters: {'n_layers': 1, 'embedding_dim': 64, 'lr': 0.003430779675351842, 'lambda_val': 8.872084853828521e-05, 'batch_size': 2528, 'optimizer': 'RMSprop'}. Best is trial 25 with value: 0.012002857631825513.
2026-05-15 07:08:46,860 - optuna.study.study - INFO - Trial 33 finished with value: 0.011458494596732401 and parameters: {'n_layers': 1, 'embedding_dim': 256, 'lr': 0.020451138426665415, 'lambda_val': 0.0004996961618637099, 'batch_size': 1773, 'optimizer': 'RMSprop'}. Best is trial 25 with value: 0.012002857631825513.
2026-05-15 07:09:26,602 - optuna.study.study - INFO - Trial 34 finished with value: 0.011246579821928587 and parameters: {'n_layers': 1, 'embedding_dim': 256, 'lr': 0.0015690558773767346, 'lambda_val': 0.0007777955253110003, 'batch_size': 1823, 'optimizer': 'RMSprop'}. Best is trial 25 with value: 0.012002857631825513.
2026-05-15 07:09:31,121 - optuna.study._optimize - INFO - Trial 35 pruned. 
2026-05-15 07:09:58,041 - optuna.study.study - INFO - Trial 36 finished with value: 0.007348448748307244 and parameters: {'n_layers': 1, 'embedding_dim': 256, 'lr': 7.991203831691605e-05, 'lambda_val': 0.005118611299699784, 'batch_size': 1827, 'optimizer': 'RMSprop'}. Best is trial 25 with value: 0.012002857631825513.
2026-05-15 07:10:04,580 - optuna.study._optimize - INFO - Trial 37 pruned. 
2026-05-15 07:10:16,769 - optuna.study._optimize - INFO - Trial 38 pruned. 
2026-05-15 07:10:20,484 - optuna.study._optimize - INFO - Trial 39 pruned. 
2026-05-15 07:10:24,779 - optuna.study._optimize - INFO - Trial 40 pruned. 
2026-05-15 07:10:50,093 - optuna.study.study - INFO - Trial 41 finished with value: 0.011411172241977475 and parameters: {'n_layers': 1, 'embedding_dim': 32, 'lr': 0.007940532366598254, 'lambda_val': 0.0005415432883407605, 'batch_size': 1727, 'optimizer': 'RMSprop'}. Best is trial 25 with value: 0.012002857631825513.
2026-05-15 07:10:55,251 - optuna.study._optimize - INFO - Trial 42 pruned. 
2026-05-15 07:11:25,597 - optuna.study.study - INFO - Trial 43 finished with value: 0.009300657903296776 and parameters: {'n_layers': 1, 'embedding_dim': 32, 'lr': 0.00915420340092007, 'lambda_val': 0.0006027577938860602, 'batch_size': 1124, 'optimizer': 'RMSprop'}. Best is trial 25 with value: 0.012002857631825513.
2026-05-15 07:11:51,946 - optuna.study.study - INFO - Trial 44 finished with value: 0.0060062239578786815 and parameters: {'n_layers': 1, 'embedding_dim': 32, 'lr': 0.00029716091154841805, 'lambda_val': 0.002133425604451176, 'batch_size': 1385, 'optimizer': 'RMSprop'}. Best is trial 25 with value: 0.012002857631825513.
2026-05-15 07:11:56,442 - optuna.study._optimize - INFO - Trial 45 pruned. 
2026-05-15 07:12:00,635 - optuna.study._optimize - INFO - Trial 46 pruned. 
2026-05-15 07:12:05,026 - optuna.study._optimize - INFO - Trial 47 pruned. 
2026-05-15 07:12:08,596 - optuna.study._optimize - INFO - Trial 48 pruned. 
2026-05-15 07:12:39,445 - optuna.study.study - INFO - Trial 49 finished with value: 0.002803573463247696 and parameters: {'n_layers': 3, 'embedding_dim': 128, 'lr': 0.030365956781672438, 'lambda_val': 0.00010175298857679632, 'batch_size': 2148, 'optimizer': 'RMSprop'}. Best is trial 25 with value: 0.012002857631825513.
2026-05-15 07:12:43,290 - optuna.study._optimize - INFO - Trial 50 pruned. 
2026-05-15 07:13:09,313 - optuna.study.study - INFO - Trial 51 finished with value: 0.011488071238262575 and parameters: {'n_layers': 1, 'embedding_dim': 256, 'lr': 0.01930535275486278, 'lambda_val': 0.0005542000069707294, 'batch_size': 1853, 'optimizer': 'RMSprop'}. Best is trial 25 with value: 0.012002857631825513.
2026-05-15 07:13:37,716 - optuna.study.study - INFO - Trial 52 finished with value: 0.010737204877530427 and parameters: {'n_layers': 1, 'embedding_dim': 256, 'lr': 0.019744512771587307, 'lambda_val': 0.000680313276142998, 'batch_size': 1876, 'optimizer': 'RMSprop'}. Best is trial 25 with value: 0.012002857631825513.
2026-05-15 07:14:05,282 - optuna.study.study - INFO - Trial 53 finished with value: 0.010972978348928098 and parameters: {'n_layers': 1, 'embedding_dim': 256, 'lr': 0.009916239087724547, 'lambda_val': 0.0010963128632936266, 'batch_size': 1752, 'optimizer': 'RMSprop'}. Best is trial 25 with value: 0.012002857631825513.
2026-05-15 07:14:42,361 - optuna.study.study - INFO - Trial 54 finished with value: 0.011497367003813928 and parameters: {'n_layers': 1, 'embedding_dim': 256, 'lr': 0.0005336650970725389, 'lambda_val': 0.0002970406063440669, 'batch_size': 1891, 'optimizer': 'RMSprop'}. Best is trial 25 with value: 0.012002857631825513.
2026-05-15 07:14:46,504 - optuna.study._optimize - INFO - Trial 55 pruned. 
2026-05-15 07:15:12,801 - optuna.study.study - INFO - Trial 56 finished with value: 0.005828102944000419 and parameters: {'n_layers': 1, 'embedding_dim': 96, 'lr': 0.00014943501789174685, 'lambda_val': 0.00042769116248018654, 'batch_size': 2161, 'optimizer': 'RMSprop'}. Best is trial 25 with value: 0.012002857631825513.
2026-05-15 07:15:39,543 - optuna.study.study - INFO - Trial 57 finished with value: 0.006550593499947594 and parameters: {'n_layers': 1, 'embedding_dim': 32, 'lr': 0.0005400014388119544, 'lambda_val': 0.0016318227756643702, 'batch_size': 2473, 'optimizer': 'RMSprop'}. Best is trial 25 with value: 0.012002857631825513.
2026-05-15 07:15:43,672 - optuna.study._optimize - INFO - Trial 58 pruned. 
2026-05-15 07:15:51,382 - optuna.study._optimize - INFO - Trial 59 pruned. 
2026-05-15 07:16:20,713 - optuna.study.study - INFO - Trial 60 finished with value: 0.01157481632628001 and parameters: {'n_layers': 1, 'embedding_dim': 256, 'lr': 0.006204259300427923, 'lambda_val': 0.00048324104151642076, 'batch_size': 1933, 'optimizer': 'RMSprop'}. Best is trial 25 with value: 0.012002857631825513.
2026-05-15 07:16:49,114 - optuna.study.study - INFO - Trial 61 finished with value: 0.011498645540175045 and parameters: {'n_layers': 1, 'embedding_dim': 256, 'lr': 0.005697462852515707, 'lambda_val': 0.0005623335645538933, 'batch_size': 1943, 'optimizer': 'RMSprop'}. Best is trial 25 with value: 0.012002857631825513.
2026-05-15 07:17:18,556 - optuna.study.study - INFO - Trial 62 finished with value: 0.010907370339167076 and parameters: {'n_layers': 1, 'embedding_dim': 256, 'lr': 0.005868234650002794, 'lambda_val': 0.0003586482469827837, 'batch_size': 1937, 'optimizer': 'RMSprop'}. Best is trial 25 with value: 0.012002857631825513.
2026-05-15 07:17:22,175 - optuna.study._optimize - INFO - Trial 63 pruned. 
2026-05-15 07:17:52,301 - optuna.study.study - INFO - Trial 64 finished with value: 0.010405178108245004 and parameters: {'n_layers': 1, 'embedding_dim': 256, 'lr': 0.002827743523770108, 'lambda_val': 0.000153304223802975, 'batch_size': 2418, 'optimizer': 'RMSprop'}. Best is trial 25 with value: 0.012002857631825513.
2026-05-15 07:18:26,197 - optuna.study.study - INFO - Trial 65 finished with value: 0.011012389255832207 and parameters: {'n_layers': 1, 'embedding_dim': 256, 'lr': 0.011074397410286835, 'lambda_val': 0.000533837829576178, 'batch_size': 1602, 'optimizer': 'RMSprop'}. Best is trial 25 with value: 0.012002857631825513.
2026-05-15 07:18:51,595 - optuna.study.study - INFO - Trial 66 finished with value: 0.011687810228932645 and parameters: {'n_layers': 1, 'embedding_dim': 256, 'lr': 0.0006732558572323754, 'lambda_val': 0.00027046927804757614, 'batch_size': 1995, 'optimizer': 'RMSprop'}. Best is trial 25 with value: 0.012002857631825513.
2026-05-15 07:18:55,750 - optuna.study._optimize - INFO - Trial 67 pruned. 
2026-05-15 07:19:21,581 - optuna.study.study - INFO - Trial 68 finished with value: 0.011369208532671921 and parameters: {'n_layers': 1, 'embedding_dim': 256, 'lr': 0.00038099114748449083, 'lambda_val': 0.0011523413734397653, 'batch_size': 2212, 'optimizer': 'RMSprop'}. Best is trial 25 with value: 0.012002857631825513.
2026-05-15 07:19:24,815 - optuna.study._optimize - INFO - Trial 69 pruned. 
2026-05-15 07:19:46,995 - optuna.study.study - INFO - Trial 70 finished with value: 0.005611439233822415 and parameters: {'n_layers': 1, 'embedding_dim': 96, 'lr': 0.00018320299599316548, 'lambda_val': 0.000250707854489605, 'batch_size': 2627, 'optimizer': 'RMSprop'}. Best is trial 25 with value: 0.012002857631825513.
