2026-05-15 11:17:26,424 - optuna.study.study - INFO - Trial 152 finished with value: 0.09150758164880456 and parameters: {'n_layers': 1, 'embedding_dim': 256, 'lr': 0.0002755849977305638, 'lambda_val': 0.00027523035427668135, 'batch_size': 1624, 'optimizer': 'Adam'}. Best is trial 148 with value: 0.10034987973370264.
2026-05-15 11:17:58,946 - optuna.study.study - INFO - Trial 153 finished with value: 0.09574577816015742 and parameters: {'n_layers': 1, 'embedding_dim': 256, 'lr': 0.0002878754850464985, 'lambda_val': 0.00012060086205439589, 'batch_size': 1629, 'optimizer': 'Adam'}. Best is trial 148 with value: 0.10034987973370264.
2026-05-15 11:18:41,247 - optuna.study.study - INFO - Trial 154 finished with value: 0.0909127338976029 and parameters: {'n_layers': 1, 'embedding_dim': 256, 'lr': 0.00030163097230820855, 'lambda_val': 0.00011533133649521374, 'batch_size': 1623, 'optimizer': 'Adam'}. Best is trial 148 with value: 0.10034987973370264.
2026-05-15 11:19:13,526 - optuna.study.study - INFO - Trial 155 finished with value: 0.08984747633159287 and parameters: {'n_layers': 1, 'embedding_dim': 256, 'lr': 0.00029888979494216856, 'lambda_val': 0.00013059993361506505, 'batch_size': 1646, 'optimizer': 'Adam'}. Best is trial 148 with value: 0.10034987973370264.
2026-05-15 11:19:47,036 - optuna.study.study - INFO - Trial 156 finished with value: 0.08941691561979447 and parameters: {'n_layers': 1, 'embedding_dim': 256, 'lr': 0.00028963558948396625, 'lambda_val': 0.0001585708668677342, 'batch_size': 1624, 'optimizer': 'Adam'}. Best is trial 148 with value: 0.10034987973370264.
2026-05-15 11:20:22,241 - optuna.study.study - INFO - Trial 157 finished with value: 0.09517666083417105 and parameters: {'n_layers': 1, 'embedding_dim': 256, 'lr': 0.00027580595203985077, 'lambda_val': 0.00011181072361469957, 'batch_size': 1449, 'optimizer': 'Adam'}. Best is trial 148 with value: 0.10034987973370264.
2026-05-15 11:20:26,455 - optuna.study._optimize - INFO - Trial 158 pruned. 
2026-05-15 11:21:00,442 - optuna.study.study - INFO - Trial 159 finished with value: 0.09413428974755082 and parameters: {'n_layers': 1, 'embedding_dim': 256, 'lr': 0.00028460641356950635, 'lambda_val': 0.00027124483859850115, 'batch_size': 1426, 'optimizer': 'Adam'}. Best is trial 148 with value: 0.10034987973370264.
2026-05-15 11:21:34,539 - optuna.study.study - INFO - Trial 160 finished with value: 0.09811078448685623 and parameters: {'n_layers': 1, 'embedding_dim': 256, 'lr': 0.00029579131835796017, 'lambda_val': 0.00026648921262469884, 'batch_size': 1458, 'optimizer': 'Adam'}. Best is trial 148 with value: 0.10034987973370264.
2026-05-15 11:22:11,385 - optuna.study.study - INFO - Trial 161 finished with value: 0.09254585748364103 and parameters: {'n_layers': 1, 'embedding_dim': 256, 'lr': 0.00028866802853351177, 'lambda_val': 0.00026633181193380586, 'batch_size': 1427, 'optimizer': 'Adam'}. Best is trial 148 with value: 0.10034987973370264.
2026-05-15 11:22:49,054 - optuna.study.study - INFO - Trial 162 finished with value: 0.0938763887196467 and parameters: {'n_layers': 1, 'embedding_dim': 256, 'lr': 0.0003208781768264317, 'lambda_val': 0.00026924655603028443, 'batch_size': 1414, 'optimizer': 'Adam'}. Best is trial 148 with value: 0.10034987973370264.
2026-05-15 11:23:22,874 - optuna.study.study - INFO - Trial 163 finished with value: 0.09305443350268351 and parameters: {'n_layers': 1, 'embedding_dim': 256, 'lr': 0.0003044313713323977, 'lambda_val': 0.0002521811318813136, 'batch_size': 1452, 'optimizer': 'Adam'}. Best is trial 148 with value: 0.10034987973370264.
2026-05-15 11:23:56,350 - optuna.study.study - INFO - Trial 164 finished with value: 0.10146118367350325 and parameters: {'n_layers': 1, 'embedding_dim': 256, 'lr': 0.00022509712920875443, 'lambda_val': 0.00027105881487774923, 'batch_size': 1428, 'optimizer': 'Adam'}. Best is trial 164 with value: 0.10146118367350325.
2026-05-15 11:24:00,944 - optuna.study._optimize - INFO - Trial 165 pruned. 
2026-05-15 11:24:05,342 - optuna.study._optimize - INFO - Trial 166 pruned. 
2026-05-15 11:24:39,966 - optuna.study.study - INFO - Trial 167 finished with value: 0.09802534960437108 and parameters: {'n_layers': 1, 'embedding_dim': 256, 'lr': 0.00023036295288407055, 'lambda_val': 0.0002092639387056477, 'batch_size': 1517, 'optimizer': 'Adam'}. Best is trial 164 with value: 0.10146118367350325.
2026-05-15 11:25:15,160 - optuna.study.study - INFO - Trial 168 finished with value: 0.1025988193364468 and parameters: {'n_layers': 1, 'embedding_dim': 256, 'lr': 0.00022702242674719046, 'lambda_val': 0.00021823341488413017, 'batch_size': 1292, 'optimizer': 'Adam'}. Best is trial 168 with value: 0.1025988193364468.
2026-05-15 11:25:51,036 - optuna.study.study - INFO - Trial 169 finished with value: 0.0983255132304271 and parameters: {'n_layers': 1, 'embedding_dim': 256, 'lr': 0.0001971737981961996, 'lambda_val': 0.00021838738616589145, 'batch_size': 1277, 'optimizer': 'Adam'}. Best is trial 168 with value: 0.1025988193364468.
2026-05-15 11:25:55,821 - optuna.study._optimize - INFO - Trial 170 pruned. 
2026-05-15 11:26:31,035 - optuna.study.study - INFO - Trial 171 finished with value: 0.09616935368016974 and parameters: {'n_layers': 1, 'embedding_dim': 256, 'lr': 0.00023681149744483648, 'lambda_val': 0.0002527925715150149, 'batch_size': 1259, 'optimizer': 'Adam'}. Best is trial 168 with value: 0.1025988193364468.
2026-05-15 11:27:04,642 - optuna.study.study - INFO - Trial 172 finished with value: 0.09498632263676243 and parameters: {'n_layers': 1, 'embedding_dim': 256, 'lr': 0.00023220195419719554, 'lambda_val': 0.0003911385460628974, 'batch_size': 1252, 'optimizer': 'Adam'}. Best is trial 168 with value: 0.1025988193364468.
2026-05-15 11:27:08,844 - optuna.study._optimize - INFO - Trial 173 pruned. 
2026-05-15 11:27:42,297 - optuna.study.study - INFO - Trial 174 finished with value: 0.09029379997812205 and parameters: {'n_layers': 1, 'embedding_dim': 256, 'lr': 0.00020224183689930173, 'lambda_val': 0.0006271606514156464, 'batch_size': 1235, 'optimizer': 'Adam'}. Best is trial 168 with value: 0.1025988193364468.
2026-05-15 11:27:46,876 - optuna.study._optimize - INFO - Trial 175 pruned. 
2026-05-15 11:27:51,002 - optuna.study._optimize - INFO - Trial 176 pruned. 
2026-05-15 11:27:55,357 - optuna.study._optimize - INFO - Trial 177 pruned. 
2026-05-15 11:28:28,961 - optuna.study.study - INFO - Trial 178 finished with value: 0.09402640735620121 and parameters: {'n_layers': 1, 'embedding_dim': 256, 'lr': 0.00021580650589256173, 'lambda_val': 0.0001002141779135732, 'batch_size': 1360, 'optimizer': 'Adam'}. Best is trial 168 with value: 0.1025988193364468.
2026-05-15 11:28:33,201 - optuna.study._optimize - INFO - Trial 179 pruned. 
2026-05-15 11:29:07,263 - optuna.study.study - INFO - Trial 180 finished with value: 0.10271806287116927 and parameters: {'n_layers': 1, 'embedding_dim': 256, 'lr': 0.00022351400280457083, 'lambda_val': 0.0004336169477086758, 'batch_size': 1225, 'optimizer': 'Adam'}. Best is trial 180 with value: 0.10271806287116927.
2026-05-15 11:29:11,364 - optuna.study._optimize - INFO - Trial 181 pruned. 
2026-05-15 11:29:15,535 - optuna.study._optimize - INFO - Trial 182 pruned. 
2026-05-15 11:29:19,684 - optuna.study._optimize - INFO - Trial 183 pruned. 
2026-05-15 11:29:53,829 - optuna.study.study - INFO - Trial 184 finished with value: 0.10038907576216943 and parameters: {'n_layers': 1, 'embedding_dim': 256, 'lr': 0.0001923505914637116, 'lambda_val': 0.0001426366416177081, 'batch_size': 1087, 'optimizer': 'Adam'}. Best is trial 180 with value: 0.10271806287116927.
2026-05-15 11:29:57,988 - optuna.study._optimize - INFO - Trial 185 pruned. 
2026-05-15 11:30:29,956 - optuna.study.study - INFO - Trial 186 finished with value: 0.09861262971128447 and parameters: {'n_layers': 1, 'embedding_dim': 256, 'lr': 0.00021457673616223717, 'lambda_val': 0.00017728996998788888, 'batch_size': 1154, 'optimizer': 'Adam'}. Best is trial 180 with value: 0.10271806287116927.
2026-05-15 11:30:33,947 - optuna.study._optimize - INFO - Trial 187 pruned. 
2026-05-15 11:30:39,874 - optuna.study._optimize - INFO - Trial 188 pruned. 
2026-05-15 11:30:44,162 - optuna.study._optimize - INFO - Trial 189 pruned. 
2026-05-15 11:30:48,410 - optuna.study._optimize - INFO - Trial 190 pruned. 
2026-05-15 11:30:53,066 - optuna.study._optimize - INFO - Trial 191 pruned. 
2026-05-15 11:30:57,316 - optuna.study._optimize - INFO - Trial 192 pruned. 
2026-05-15 11:31:31,463 - optuna.study.study - INFO - Trial 193 finished with value: 0.09603270877944485 and parameters: {'n_layers': 1, 'embedding_dim': 256, 'lr': 0.0002303250408892948, 'lambda_val': 0.00023456843425733422, 'batch_size': 1529, 'optimizer': 'Adam'}. Best is trial 180 with value: 0.10271806287116927.
2026-05-15 11:31:35,668 - optuna.study._optimize - INFO - Trial 194 pruned. 
2026-05-15 11:32:16,877 - optuna.study.study - INFO - Trial 195 finished with value: 0.09172631985965342 and parameters: {'n_layers': 1, 'embedding_dim': 256, 'lr': 0.0003541602329741133, 'lambda_val': 0.00019940293318501025, 'batch_size': 1129, 'optimizer': 'Adam'}. Best is trial 180 with value: 0.10271806287116927.
2026-05-15 11:32:23,544 - optuna.study._optimize - INFO - Trial 196 pruned. 
2026-05-15 11:32:27,361 - optuna.study._optimize - INFO - Trial 197 pruned. 
2026-05-15 11:32:31,190 - optuna.study._optimize - INFO - Trial 198 pruned. 
2026-05-15 11:33:01,919 - optuna.study.study - INFO - Trial 199 finished with value: 0.09147260295357494 and parameters: {'n_layers': 1, 'embedding_dim': 256, 'lr': 0.00034710041562849335, 'lambda_val': 0.00010099245354019434, 'batch_size': 1512, 'optimizer': 'Adam'}. Best is trial 180 with value: 0.10271806287116927.
