2026-05-15 06:01:53,775 - optuna.study.study - INFO - Trial 30 finished with value: 0.08207126678584323 and parameters: {'n_layers': 1, 'embedding_dim': 256, 'lr': 0.00020198489865766385, 'lambda_val': 8.039022700398173e-05, 'batch_size': 3345, 'optimizer': 'RMSprop'}. Best is trial 30 with value: 0.08207126678584323.
2026-05-15 06:02:29,862 - optuna.study.study - INFO - Trial 31 finished with value: 0.07692328347105239 and parameters: {'n_layers': 1, 'embedding_dim': 256, 'lr': 0.0002110164292401318, 'lambda_val': 8.815183458826227e-05, 'batch_size': 2840, 'optimizer': 'RMSprop'}. Best is trial 30 with value: 0.08207126678584323.
2026-05-15 06:02:33,849 - optuna.study._optimize - INFO - Trial 32 pruned. 
2026-05-15 06:03:19,966 - optuna.study.study - INFO - Trial 33 finished with value: 0.07050960176341628 and parameters: {'n_layers': 1, 'embedding_dim': 256, 'lr': 0.00019825608103065385, 'lambda_val': 2.1094518935023057e-05, 'batch_size': 3355, 'optimizer': 'RMSprop'}. Best is trial 30 with value: 0.08207126678584323.
2026-05-15 06:03:28,057 - optuna.study._optimize - INFO - Trial 34 pruned. 
2026-05-15 06:04:03,144 - optuna.study.study - INFO - Trial 35 finished with value: 0.060618130684535934 and parameters: {'n_layers': 1, 'embedding_dim': 256, 'lr': 0.0006900224935918826, 'lambda_val': 0.00011730885527686999, 'batch_size': 2956, 'optimizer': 'RMSprop'}. Best is trial 30 with value: 0.08207126678584323.
2026-05-15 06:04:06,989 - optuna.study._optimize - INFO - Trial 36 pruned. 
2026-05-15 06:04:11,057 - optuna.study._optimize - INFO - Trial 37 pruned. 
2026-05-15 06:04:18,153 - optuna.study._optimize - INFO - Trial 38 pruned. 
2026-05-15 06:04:23,301 - optuna.study._optimize - INFO - Trial 39 pruned. 
2026-05-15 06:04:28,159 - optuna.study._optimize - INFO - Trial 40 pruned. 
2026-05-15 06:05:05,433 - optuna.study.study - INFO - Trial 41 finished with value: 0.07534962855543069 and parameters: {'n_layers': 1, 'embedding_dim': 256, 'lr': 0.00019515244841341394, 'lambda_val': 1.8537840356808543e-05, 'batch_size': 3428, 'optimizer': 'RMSprop'}. Best is trial 30 with value: 0.08207126678584323.
2026-05-15 06:05:41,564 - optuna.study.study - INFO - Trial 42 finished with value: 0.08364836549281252 and parameters: {'n_layers': 1, 'embedding_dim': 256, 'lr': 0.00017854774138153996, 'lambda_val': 4.350422691559574e-05, 'batch_size': 3310, 'optimizer': 'RMSprop'}. Best is trial 42 with value: 0.08364836549281252.
2026-05-15 06:06:28,802 - optuna.study.study - INFO - Trial 43 finished with value: 0.0847902001530553 and parameters: {'n_layers': 1, 'embedding_dim': 256, 'lr': 0.00020421210116026092, 'lambda_val': 1.3366607538651176e-05, 'batch_size': 3293, 'optimizer': 'RMSprop'}. Best is trial 43 with value: 0.0847902001530553.
2026-05-15 06:06:32,758 - optuna.study._optimize - INFO - Trial 44 pruned. 
2026-05-15 06:06:36,194 - optuna.study._optimize - INFO - Trial 45 pruned. 
2026-05-15 06:07:04,784 - optuna.study.study - INFO - Trial 46 finished with value: 0.060059450085419144 and parameters: {'n_layers': 1, 'embedding_dim': 96, 'lr': 0.0008026292012493686, 'lambda_val': 4.1093170145440856e-05, 'batch_size': 2704, 'optimizer': 'Adam'}. Best is trial 43 with value: 0.0847902001530553.
2026-05-15 06:07:32,256 - optuna.study.study - INFO - Trial 47 finished with value: 0.05426518528035046 and parameters: {'n_layers': 1, 'embedding_dim': 128, 'lr': 0.0005317579654192262, 'lambda_val': 2.8757765963160973e-06, 'batch_size': 2138, 'optimizer': 'RMSprop'}. Best is trial 43 with value: 0.0847902001530553.
2026-05-15 06:08:15,421 - optuna.study.study - INFO - Trial 48 finished with value: 0.078651637941843 and parameters: {'n_layers': 1, 'embedding_dim': 256, 'lr': 0.00022533175949999767, 'lambda_val': 6.184285624886536e-05, 'batch_size': 2904, 'optimizer': 'RMSprop'}. Best is trial 43 with value: 0.0847902001530553.
2026-05-15 06:08:20,523 - optuna.study._optimize - INFO - Trial 49 pruned. 
2026-05-15 06:08:24,809 - optuna.study._optimize - INFO - Trial 50 pruned. 
2026-05-15 06:09:08,612 - optuna.study.study - INFO - Trial 51 finished with value: 0.07175882165098371 and parameters: {'n_layers': 1, 'embedding_dim': 256, 'lr': 0.0002151849731347845, 'lambda_val': 6.628917580245883e-05, 'batch_size': 2975, 'optimizer': 'RMSprop'}. Best is trial 43 with value: 0.0847902001530553.
2026-05-15 06:09:13,135 - optuna.study._optimize - INFO - Trial 52 pruned. 
2026-05-15 06:09:48,738 - optuna.study.study - INFO - Trial 53 finished with value: 0.07038353242881386 and parameters: {'n_layers': 1, 'embedding_dim': 256, 'lr': 0.0003096410928718706, 'lambda_val': 0.00033099509592017924, 'batch_size': 3040, 'optimizer': 'RMSprop'}. Best is trial 43 with value: 0.0847902001530553.
2026-05-15 06:10:34,979 - optuna.study.study - INFO - Trial 54 finished with value: 0.08250696626578312 and parameters: {'n_layers': 1, 'embedding_dim': 256, 'lr': 0.00014443302925353, 'lambda_val': 5.1514269418298545e-05, 'batch_size': 3328, 'optimizer': 'RMSprop'}. Best is trial 43 with value: 0.0847902001530553.
2026-05-15 06:10:39,357 - optuna.study._optimize - INFO - Trial 55 pruned. 
2026-05-15 06:11:14,853 - optuna.study.study - INFO - Trial 56 finished with value: 0.05977512440922904 and parameters: {'n_layers': 1, 'embedding_dim': 256, 'lr': 0.00042148383825928415, 'lambda_val': 2.9116208494394177e-05, 'batch_size': 3328, 'optimizer': 'RMSprop'}. Best is trial 43 with value: 0.0847902001530553.
2026-05-15 06:11:18,849 - optuna.study._optimize - INFO - Trial 57 pruned. 
2026-05-15 06:11:23,155 - optuna.study._optimize - INFO - Trial 58 pruned. 
2026-05-15 06:11:28,380 - optuna.study._optimize - INFO - Trial 59 pruned. 
2026-05-15 06:11:34,976 - optuna.study._optimize - INFO - Trial 60 pruned. 
2026-05-15 06:12:16,675 - optuna.study.study - INFO - Trial 61 finished with value: 0.0762499029728458 and parameters: {'n_layers': 1, 'embedding_dim': 256, 'lr': 0.00023864124100419614, 'lambda_val': 9.423648887431174e-05, 'batch_size': 2712, 'optimizer': 'RMSprop'}. Best is trial 43 with value: 0.0847902001530553.
2026-05-15 06:12:21,018 - optuna.study._optimize - INFO - Trial 62 pruned. 
2026-05-15 06:12:55,471 - optuna.study.study - INFO - Trial 63 finished with value: 0.08346920359336499 and parameters: {'n_layers': 1, 'embedding_dim': 256, 'lr': 0.00015749678959939167, 'lambda_val': 7.451831048814879e-05, 'batch_size': 2385, 'optimizer': 'RMSprop'}. Best is trial 43 with value: 0.0847902001530553.
2026-05-15 06:12:59,489 - optuna.study._optimize - INFO - Trial 64 pruned. 
2026-05-15 06:13:34,473 - optuna.study.study - INFO - Trial 65 finished with value: 0.08464718901489063 and parameters: {'n_layers': 1, 'embedding_dim': 256, 'lr': 0.00012289400027998761, 'lambda_val': 0.0007874906257827884, 'batch_size': 2450, 'optimizer': 'RMSprop'}. Best is trial 43 with value: 0.0847902001530553.
2026-05-15 06:13:38,898 - optuna.study._optimize - INFO - Trial 66 pruned. 
2026-05-15 06:13:43,223 - optuna.study._optimize - INFO - Trial 67 pruned. 
2026-05-15 06:14:30,018 - optuna.study.study - INFO - Trial 68 finished with value: 0.07028345268317972 and parameters: {'n_layers': 1, 'embedding_dim': 256, 'lr': 0.0003807811151417334, 'lambda_val': 0.0007156533220415905, 'batch_size': 2458, 'optimizer': 'RMSprop'}. Best is trial 43 with value: 0.0847902001530553.
2026-05-15 06:14:34,467 - optuna.study._optimize - INFO - Trial 69 pruned. 
2026-05-15 06:14:38,598 - optuna.study._optimize - INFO - Trial 70 pruned. 
2026-05-15 06:15:14,137 - optuna.study.study - INFO - Trial 71 finished with value: 0.0790295725891447 and parameters: {'n_layers': 1, 'embedding_dim': 256, 'lr': 0.00016868270199238975, 'lambda_val': 2.8448112092032934e-05, 'batch_size': 3109, 'optimizer': 'RMSprop'}. Best is trial 43 with value: 0.0847902001530553.
2026-05-15 06:16:01,993 - optuna.study.study - INFO - Trial 72 finished with value: 0.07542898849386442 and parameters: {'n_layers': 1, 'embedding_dim': 256, 'lr': 0.00017199111635379672, 'lambda_val': 2.6304786765638425e-05, 'batch_size': 3102, 'optimizer': 'RMSprop'}. Best is trial 43 with value: 0.0847902001530553.
2026-05-15 06:16:06,310 - optuna.study._optimize - INFO - Trial 73 pruned. 
2026-05-15 06:16:10,540 - optuna.study._optimize - INFO - Trial 74 pruned. 
2026-05-15 06:16:14,869 - optuna.study._optimize - INFO - Trial 75 pruned. 
2026-05-15 06:16:18,987 - optuna.study._optimize - INFO - Trial 76 pruned. 
2026-05-15 06:16:49,519 - optuna.study.study - INFO - Trial 77 finished with value: 0.07077371069406589 and parameters: {'n_layers': 1, 'embedding_dim': 128, 'lr': 0.0002740577722116477, 'lambda_val': 0.00014880717330404428, 'batch_size': 3477, 'optimizer': 'RMSprop'}. Best is trial 43 with value: 0.0847902001530553.
2026-05-15 06:16:54,586 - optuna.study._optimize - INFO - Trial 78 pruned. 
2026-05-15 06:16:59,225 - optuna.study._optimize - INFO - Trial 79 pruned. 
2026-05-15 06:17:03,013 - optuna.study._optimize - INFO - Trial 80 pruned. 
2026-05-15 06:17:38,890 - optuna.study.study - INFO - Trial 81 finished with value: 0.07471082212711407 and parameters: {'n_layers': 1, 'embedding_dim': 256, 'lr': 0.0002631102514410725, 'lambda_val': 7.27731852432406e-05, 'batch_size': 2903, 'optimizer': 'RMSprop'}. Best is trial 43 with value: 0.0847902001530553.
2026-05-15 06:17:43,770 - optuna.study._optimize - INFO - Trial 82 pruned. 
2026-05-15 06:18:18,555 - optuna.study.study - INFO - Trial 83 finished with value: 0.06948111782722509 and parameters: {'n_layers': 1, 'embedding_dim': 256, 'lr': 0.0003497492627679653, 'lambda_val': 0.00011587408186929025, 'batch_size': 3175, 'optimizer': 'RMSprop'}. Best is trial 43 with value: 0.0847902001530553.
2026-05-15 06:18:25,691 - optuna.study._optimize - INFO - Trial 84 pruned. 
2026-05-15 06:18:30,059 - optuna.study._optimize - INFO - Trial 85 pruned. 
2026-05-15 06:19:14,535 - optuna.study.study - INFO - Trial 86 finished with value: 0.06848062152764384 and parameters: {'n_layers': 1, 'embedding_dim': 256, 'lr': 0.00023158256567380717, 'lambda_val': 6.082724619002523e-05, 'batch_size': 2911, 'optimizer': 'RMSprop'}. Best is trial 43 with value: 0.0847902001530553.
2026-05-15 06:19:19,898 - optuna.study._optimize - INFO - Trial 87 pruned. 
2026-05-15 06:19:24,305 - optuna.study._optimize - INFO - Trial 88 pruned. 
2026-05-15 06:19:29,236 - optuna.study._optimize - INFO - Trial 89 pruned. 
2026-05-15 06:19:33,631 - optuna.study._optimize - INFO - Trial 90 pruned. 
2026-05-15 06:20:08,211 - optuna.study.study - INFO - Trial 91 finished with value: 0.08259379081256943 and parameters: {'n_layers': 1, 'embedding_dim': 256, 'lr': 0.00018492096409321307, 'lambda_val': 0.0003013374483977809, 'batch_size': 2866, 'optimizer': 'RMSprop'}. Best is trial 43 with value: 0.0847902001530553.
2026-05-15 06:20:12,582 - optuna.study._optimize - INFO - Trial 92 pruned. 
2026-05-15 06:20:16,933 - optuna.study._optimize - INFO - Trial 93 pruned. 
2026-05-15 06:20:50,913 - optuna.study.study - INFO - Trial 94 finished with value: 0.06542754566277682 and parameters: {'n_layers': 1, 'embedding_dim': 256, 'lr': 0.0003126306466077138, 'lambda_val': 0.0012245650448814355, 'batch_size': 2927, 'optimizer': 'RMSprop'}. Best is trial 43 with value: 0.0847902001530553.
2026-05-15 06:20:54,522 - optuna.study._optimize - INFO - Trial 95 pruned. 
2026-05-15 06:20:58,795 - optuna.study._optimize - INFO - Trial 96 pruned. 
2026-05-15 06:21:28,697 - optuna.study.study - INFO - Trial 97 finished with value: 0.07572009801310091 and parameters: {'n_layers': 1, 'embedding_dim': 128, 'lr': 0.0002648447781528165, 'lambda_val': 0.00013684965309153374, 'batch_size': 2306, 'optimizer': 'RMSprop'}. Best is trial 43 with value: 0.0847902001530553.
2026-05-15 06:21:32,814 - optuna.study._optimize - INFO - Trial 98 pruned. 
2026-05-15 06:22:07,341 - optuna.study.study - INFO - Trial 99 finished with value: 0.0676994474701036 and parameters: {'n_layers': 1, 'embedding_dim': 256, 'lr': 0.0005614908216470888, 'lambda_val': 3.379120496072189e-05, 'batch_size': 3322, 'optimizer': 'Adam'}. Best is trial 43 with value: 0.0847902001530553.
2026-05-15 06:22:10,998 - optuna.study._optimize - INFO - Trial 100 pruned. 
2026-05-15 06:22:15,372 - optuna.study._optimize - INFO - Trial 101 pruned. 
2026-05-15 06:22:50,718 - optuna.study.study - INFO - Trial 102 finished with value: 0.06826724097471909 and parameters: {'n_layers': 1, 'embedding_dim': 256, 'lr': 0.0003889645842048444, 'lambda_val': 7.738411746737887e-05, 'batch_size': 2902, 'optimizer': 'RMSprop'}. Best is trial 43 with value: 0.0847902001530553.
2026-05-15 06:22:55,079 - optuna.study._optimize - INFO - Trial 103 pruned. 
2026-05-15 06:22:59,486 - optuna.study._optimize - INFO - Trial 104 pruned. 
2026-05-15 06:23:03,627 - optuna.study._optimize - INFO - Trial 105 pruned. 
2026-05-15 06:23:07,957 - optuna.study._optimize - INFO - Trial 106 pruned. 
2026-05-15 06:23:14,164 - optuna.study._optimize - INFO - Trial 107 pruned. 
2026-05-15 06:23:19,035 - optuna.study._optimize - INFO - Trial 108 pruned. 
2026-05-15 06:23:27,153 - optuna.study._optimize - INFO - Trial 109 pruned. 
2026-05-15 06:23:31,416 - optuna.study._optimize - INFO - Trial 110 pruned. 
2026-05-15 06:24:07,098 - optuna.study.study - INFO - Trial 111 finished with value: 0.07533027507165187 and parameters: {'n_layers': 1, 'embedding_dim': 256, 'lr': 0.00022360154600178155, 'lambda_val': 9.017570718971007e-05, 'batch_size': 2863, 'optimizer': 'RMSprop'}. Best is trial 43 with value: 0.0847902001530553.
2026-05-15 06:24:42,586 - optuna.study.study - INFO - Trial 112 finished with value: 0.07632095756540676 and parameters: {'n_layers': 1, 'embedding_dim': 256, 'lr': 0.00024376137092779537, 'lambda_val': 0.00012401008149226405, 'batch_size': 2357, 'optimizer': 'RMSprop'}. Best is trial 43 with value: 0.0847902001530553.
2026-05-15 06:25:19,272 - optuna.study.study - INFO - Trial 113 finished with value: 0.07762214133636383 and parameters: {'n_layers': 1, 'embedding_dim': 256, 'lr': 0.0002862648747339718, 'lambda_val': 0.0001511023756993812, 'batch_size': 3401, 'optimizer': 'RMSprop'}. Best is trial 43 with value: 0.0847902001530553.
2026-05-15 06:25:23,751 - optuna.study._optimize - INFO - Trial 114 pruned. 
2026-05-15 06:25:28,707 - optuna.study._optimize - INFO - Trial 115 pruned. 
2026-05-15 06:25:33,041 - optuna.study._optimize - INFO - Trial 116 pruned. 
2026-05-15 06:26:10,446 - optuna.study.study - INFO - Trial 117 finished with value: 0.07175195447906185 and parameters: {'n_layers': 1, 'embedding_dim': 256, 'lr': 0.0006678497136740864, 'lambda_val': 0.00025285426967182524, 'batch_size': 2065, 'optimizer': 'RMSprop'}. Best is trial 43 with value: 0.0847902001530553.
2026-05-15 06:26:20,923 - optuna.study._optimize - INFO - Trial 118 pruned. 
2026-05-15 06:26:55,956 - optuna.study.study - INFO - Trial 119 finished with value: 0.07019768112200662 and parameters: {'n_layers': 1, 'embedding_dim': 256, 'lr': 0.00045791168983348957, 'lambda_val': 1.5835434745863116e-05, 'batch_size': 2985, 'optimizer': 'Adam'}. Best is trial 43 with value: 0.0847902001530553.
2026-05-15 06:27:01,976 - optuna.study._optimize - INFO - Trial 120 pruned. 
2026-05-15 06:27:36,407 - optuna.study.study - INFO - Trial 121 finished with value: 0.07470056207942001 and parameters: {'n_layers': 1, 'embedding_dim': 256, 'lr': 0.0002599156394252319, 'lambda_val': 0.0001249415639842903, 'batch_size': 2355, 'optimizer': 'RMSprop'}. Best is trial 43 with value: 0.0847902001530553.
2026-05-15 06:27:41,196 - optuna.study._optimize - INFO - Trial 122 pruned. 
2026-05-15 06:27:45,744 - optuna.study._optimize - INFO - Trial 123 pruned. 
2026-05-15 06:28:21,055 - optuna.study.study - INFO - Trial 124 finished with value: 0.07988415089642582 and parameters: {'n_layers': 1, 'embedding_dim': 256, 'lr': 0.0002534638129910689, 'lambda_val': 0.00019472652090597278, 'batch_size': 3173, 'optimizer': 'RMSprop'}. Best is trial 43 with value: 0.0847902001530553.
2026-05-15 06:28:25,776 - optuna.study._optimize - INFO - Trial 125 pruned. 
2026-05-15 06:29:02,504 - optuna.study.study - INFO - Trial 126 finished with value: 0.0654633711962896 and parameters: {'n_layers': 1, 'embedding_dim': 256, 'lr': 0.0003922181927363662, 'lambda_val': 0.00021821646077792843, 'batch_size': 3137, 'optimizer': 'RMSprop'}. Best is trial 43 with value: 0.0847902001530553.
2026-05-15 06:29:06,766 - optuna.study._optimize - INFO - Trial 127 pruned. 
2026-05-15 06:29:11,150 - optuna.study._optimize - INFO - Trial 128 pruned. 
2026-05-15 06:29:15,446 - optuna.study._optimize - INFO - Trial 129 pruned. 
2026-05-15 06:29:19,797 - optuna.study._optimize - INFO - Trial 130 pruned. 
2026-05-15 06:29:57,076 - optuna.study.study - INFO - Trial 131 finished with value: 0.07785231611115909 and parameters: {'n_layers': 1, 'embedding_dim': 256, 'lr': 0.000239430126579234, 'lambda_val': 0.00017616776859890343, 'batch_size': 2167, 'optimizer': 'RMSprop'}. Best is trial 43 with value: 0.0847902001530553.
2026-05-15 06:30:31,185 - optuna.study.study - INFO - Trial 132 finished with value: 0.08120610173175696 and parameters: {'n_layers': 1, 'embedding_dim': 256, 'lr': 0.00026838622893871923, 'lambda_val': 0.000280247729675973, 'batch_size': 2146, 'optimizer': 'RMSprop'}. Best is trial 43 with value: 0.0847902001530553.
2026-05-15 06:30:43,601 - optuna.study._optimize - INFO - Trial 133 pruned. 
2026-05-15 06:30:51,029 - optuna.study._optimize - INFO - Trial 134 pruned. 
2026-05-15 06:30:55,311 - optuna.study._optimize - INFO - Trial 135 pruned. 
2026-05-15 06:31:29,812 - optuna.study.study - INFO - Trial 136 finished with value: 0.07221074758986903 and parameters: {'n_layers': 1, 'embedding_dim': 256, 'lr': 0.00030333565023821414, 'lambda_val': 0.0001740978904145901, 'batch_size': 2164, 'optimizer': 'RMSprop'}. Best is trial 43 with value: 0.0847902001530553.
2026-05-15 06:32:03,838 - optuna.study.study - INFO - Trial 137 finished with value: 0.07751529773780418 and parameters: {'n_layers': 1, 'embedding_dim': 256, 'lr': 0.0002340299948686309, 'lambda_val': 0.0007023642461942275, 'batch_size': 1762, 'optimizer': 'RMSprop'}. Best is trial 43 with value: 0.0847902001530553.
2026-05-15 06:32:07,745 - optuna.study._optimize - INFO - Trial 138 pruned. 
2026-05-15 06:32:14,793 - optuna.study._optimize - INFO - Trial 139 pruned. 
2026-05-15 06:32:50,897 - optuna.study.study - INFO - Trial 140 finished with value: 0.07120751362592542 and parameters: {'n_layers': 1, 'embedding_dim': 256, 'lr': 0.0003737311185136975, 'lambda_val': 0.0001876981227924336, 'batch_size': 3498, 'optimizer': 'RMSprop'}. Best is trial 43 with value: 0.0847902001530553.
2026-05-15 06:32:55,003 - optuna.study._optimize - INFO - Trial 141 pruned. 
2026-05-15 06:32:59,321 - optuna.study._optimize - INFO - Trial 142 pruned. 
2026-05-15 06:33:03,594 - optuna.study._optimize - INFO - Trial 143 pruned. 
2026-05-15 06:33:37,233 - optuna.study.study - INFO - Trial 144 finished with value: 0.07788631391991956 and parameters: {'n_layers': 1, 'embedding_dim': 256, 'lr': 0.00022769174683283274, 'lambda_val': 0.0005313559845213063, 'batch_size': 2132, 'optimizer': 'RMSprop'}. Best is trial 43 with value: 0.0847902001530553.
2026-05-15 06:33:41,405 - optuna.study._optimize - INFO - Trial 145 pruned. 
2026-05-15 06:33:44,932 - optuna.study._optimize - INFO - Trial 146 pruned. 
2026-05-15 06:33:49,333 - optuna.study._optimize - INFO - Trial 147 pruned. 
2026-05-15 06:33:54,088 - optuna.study._optimize - INFO - Trial 148 pruned. 
2026-05-15 06:33:57,851 - optuna.study._optimize - INFO - Trial 149 pruned. 
2026-05-15 06:34:02,782 - optuna.study._optimize - INFO - Trial 150 pruned. 
2026-05-15 06:34:35,924 - optuna.study.study - INFO - Trial 151 finished with value: 0.08081268413839417 and parameters: {'n_layers': 1, 'embedding_dim': 256, 'lr': 0.00022878174839832872, 'lambda_val': 0.0008747054813370368, 'batch_size': 1433, 'optimizer': 'RMSprop'}. Best is trial 43 with value: 0.0847902001530553.
2026-05-15 06:34:40,037 - optuna.study._optimize - INFO - Trial 152 pruned. 
2026-05-15 06:34:44,274 - optuna.study._optimize - INFO - Trial 153 pruned. 
2026-05-15 06:34:48,764 - optuna.study._optimize - INFO - Trial 154 pruned. 
2026-05-15 06:34:53,203 - optuna.study._optimize - INFO - Trial 155 pruned. 
2026-05-15 06:34:57,500 - optuna.study._optimize - INFO - Trial 156 pruned. 
2026-05-15 06:35:01,006 - optuna.study._optimize - INFO - Trial 157 pruned. 
2026-05-15 06:35:34,139 - optuna.study.study - INFO - Trial 158 finished with value: 0.07776559625930765 and parameters: {'n_layers': 1, 'embedding_dim': 256, 'lr': 0.0002685882358745811, 'lambda_val': 0.0007720202802451382, 'batch_size': 1190, 'optimizer': 'RMSprop'}. Best is trial 43 with value: 0.0847902001530553.
2026-05-15 06:35:38,705 - optuna.study._optimize - INFO - Trial 159 pruned. 
2026-05-15 06:35:42,798 - optuna.study._optimize - INFO - Trial 160 pruned. 
2026-05-15 06:36:23,050 - optuna.study.study - INFO - Trial 161 finished with value: 0.08123136897088148 and parameters: {'n_layers': 1, 'embedding_dim': 256, 'lr': 0.0002756658112784762, 'lambda_val': 0.0005078497974038198, 'batch_size': 1578, 'optimizer': 'RMSprop'}. Best is trial 43 with value: 0.0847902001530553.
2026-05-15 06:36:31,303 - optuna.study._optimize - INFO - Trial 162 pruned. 
2026-05-15 06:37:07,020 - optuna.study.study - INFO - Trial 163 finished with value: 0.07996207996856985 and parameters: {'n_layers': 1, 'embedding_dim': 256, 'lr': 0.00027776965216035694, 'lambda_val': 0.0004951663239582549, 'batch_size': 1342, 'optimizer': 'RMSprop'}. Best is trial 43 with value: 0.0847902001530553.
2026-05-15 06:37:43,148 - optuna.study.study - INFO - Trial 164 finished with value: 0.06587623556927508 and parameters: {'n_layers': 1, 'embedding_dim': 256, 'lr': 0.00033943588140849715, 'lambda_val': 0.00043906201385214815, 'batch_size': 1567, 'optimizer': 'RMSprop'}. Best is trial 43 with value: 0.0847902001530553.
