2026-05-15 10:12:39,110 - optuna.study.study - INFO - Trial 142 finished with value: 0.027136795231109005 and parameters: {'n_layers': 1, 'embedding_dim': 96, 'lr': 0.00013934229035269483, 'lambda_val': 6.775965120947628e-05, 'batch_size': 700, 'optimizer': 'RMSprop'}. Best is trial 90 with value: 0.03619690984232906.
2026-05-15 10:12:42,918 - optuna.study._optimize - INFO - Trial 143 pruned. 
2026-05-15 10:12:46,241 - optuna.study._optimize - INFO - Trial 144 pruned. 
2026-05-15 10:12:50,153 - optuna.study._optimize - INFO - Trial 145 pruned. 
2026-05-15 10:12:53,749 - optuna.study._optimize - INFO - Trial 146 pruned. 
2026-05-15 10:12:57,256 - optuna.study._optimize - INFO - Trial 147 pruned. 
2026-05-15 10:13:23,852 - optuna.study.study - INFO - Trial 148 finished with value: 0.011191103784281073 and parameters: {'n_layers': 1, 'embedding_dim': 96, 'lr': 0.00026278613941578977, 'lambda_val': 3.181750466174159e-05, 'batch_size': 708, 'optimizer': 'RMSprop'}. Best is trial 90 with value: 0.03619690984232906.
2026-05-15 10:13:27,164 - optuna.study._optimize - INFO - Trial 149 pruned. 
2026-05-15 10:13:30,487 - optuna.study._optimize - INFO - Trial 150 pruned. 
2026-05-15 10:13:34,218 - optuna.study._optimize - INFO - Trial 151 pruned. 
2026-05-15 10:13:37,992 - optuna.study._optimize - INFO - Trial 152 pruned. 
2026-05-15 10:13:41,599 - optuna.study._optimize - INFO - Trial 153 pruned. 
2026-05-15 10:14:07,727 - optuna.study.study - INFO - Trial 154 finished with value: 0.012060329256811783 and parameters: {'n_layers': 1, 'embedding_dim': 64, 'lr': 0.0001914780403566284, 'lambda_val': 2.6263455507322043e-05, 'batch_size': 1025, 'optimizer': 'RMSprop'}. Best is trial 90 with value: 0.03619690984232906.
2026-05-15 10:14:10,611 - optuna.study._optimize - INFO - Trial 155 pruned. 
2026-05-15 10:14:13,814 - optuna.study._optimize - INFO - Trial 156 pruned. 
2026-05-15 10:14:34,140 - optuna.study.study - INFO - Trial 157 finished with value: 0.009977987609770029 and parameters: {'n_layers': 1, 'embedding_dim': 64, 'lr': 0.0002214011838638088, 'lambda_val': 1.2045379712954014e-05, 'batch_size': 1227, 'optimizer': 'Adam'}. Best is trial 90 with value: 0.03619690984232906.
2026-05-15 10:14:58,205 - optuna.study.study - INFO - Trial 158 finished with value: 0.009312871146643134 and parameters: {'n_layers': 1, 'embedding_dim': 96, 'lr': 0.00014405184832587192, 'lambda_val': 0.003917336358541864, 'batch_size': 513, 'optimizer': 'RMSprop'}. Best is trial 90 with value: 0.03619690984232906.
2026-05-15 10:15:01,759 - optuna.study._optimize - INFO - Trial 159 pruned. 
2026-05-15 10:15:05,347 - optuna.study._optimize - INFO - Trial 160 pruned. 
2026-05-15 10:15:31,705 - optuna.study.study - INFO - Trial 161 finished with value: 0.02058962372460044 and parameters: {'n_layers': 1, 'embedding_dim': 96, 'lr': 0.00017261647149448953, 'lambda_val': 6.119040377889307e-05, 'batch_size': 698, 'optimizer': 'RMSprop'}. Best is trial 90 with value: 0.03619690984232906.
2026-05-15 10:15:35,128 - optuna.study._optimize - INFO - Trial 162 pruned. 
2026-05-15 10:16:01,161 - optuna.study.study - INFO - Trial 163 finished with value: 0.03704138011102343 and parameters: {'n_layers': 1, 'embedding_dim': 96, 'lr': 0.0001091264419597173, 'lambda_val': 6.392230367277012e-05, 'batch_size': 829, 'optimizer': 'RMSprop'}. Best is trial 163 with value: 0.03704138011102343.
2026-05-15 10:16:04,861 - optuna.study._optimize - INFO - Trial 164 pruned. 
2026-05-15 10:16:08,295 - optuna.study._optimize - INFO - Trial 165 pruned. 
2026-05-15 10:16:12,401 - optuna.study._optimize - INFO - Trial 166 pruned. 
2026-05-15 10:16:17,250 - optuna.study._optimize - INFO - Trial 167 pruned. 
2026-05-15 10:17:04,745 - optuna.study.study - INFO - Trial 168 finished with value: 0.008632034048224602 and parameters: {'n_layers': 1, 'embedding_dim': 64, 'lr': 0.00019239179215830985, 'lambda_val': 9.764833527776772e-06, 'batch_size': 1142, 'optimizer': 'RMSprop'}. Best is trial 163 with value: 0.03704138011102343.
2026-05-15 10:17:43,618 - optuna.study.study - INFO - Trial 169 finished with value: 0.0063677679692364 and parameters: {'n_layers': 1, 'embedding_dim': 64, 'lr': 0.0002717559402822145, 'lambda_val': 6.625823710347431e-05, 'batch_size': 1041, 'optimizer': 'RMSprop'}. Best is trial 163 with value: 0.03704138011102343.
2026-05-15 10:18:36,735 - optuna.study.study - INFO - Trial 170 finished with value: 0.028154271209493983 and parameters: {'n_layers': 1, 'embedding_dim': 96, 'lr': 0.00016298703699771573, 'lambda_val': 2.4832635502648737e-05, 'batch_size': 667, 'optimizer': 'RMSprop'}. Best is trial 163 with value: 0.03704138011102343.
2026-05-15 10:19:05,274 - optuna.study.study - INFO - Trial 171 finished with value: 0.02731587141567882 and parameters: {'n_layers': 1, 'embedding_dim': 96, 'lr': 0.00015618448940562022, 'lambda_val': 2.2616013002127947e-05, 'batch_size': 768, 'optimizer': 'RMSprop'}. Best is trial 163 with value: 0.03704138011102343.
2026-05-15 10:19:31,163 - optuna.study.study - INFO - Trial 172 finished with value: 0.006911125165415931 and parameters: {'n_layers': 1, 'embedding_dim': 96, 'lr': 0.0002310908305634235, 'lambda_val': 2.221622697561349e-05, 'batch_size': 669, 'optimizer': 'RMSprop'}. Best is trial 163 with value: 0.03704138011102343.
2026-05-15 10:20:09,170 - optuna.study.study - INFO - Trial 173 finished with value: 0.023600566503518286 and parameters: {'n_layers': 1, 'embedding_dim': 96, 'lr': 0.00015871411627734996, 'lambda_val': 3.62516908121897e-05, 'batch_size': 801, 'optimizer': 'RMSprop'}. Best is trial 163 with value: 0.03704138011102343.
2026-05-15 10:20:12,050 - optuna.study._optimize - INFO - Trial 174 pruned. 
2026-05-15 10:20:32,442 - optuna.study.study - INFO - Trial 175 finished with value: 0.014957689261883806 and parameters: {'n_layers': 1, 'embedding_dim': 96, 'lr': 0.00019955519883459202, 'lambda_val': 1.4210801369626158e-05, 'batch_size': 870, 'optimizer': 'RMSprop'}. Best is trial 163 with value: 0.03704138011102343.
2026-05-15 10:20:35,296 - optuna.study._optimize - INFO - Trial 176 pruned. 
2026-05-15 10:20:56,182 - optuna.study.study - INFO - Trial 177 finished with value: 0.03310327332067253 and parameters: {'n_layers': 1, 'embedding_dim': 96, 'lr': 0.00016546978258766444, 'lambda_val': 0.00012938389064958612, 'batch_size': 559, 'optimizer': 'RMSprop'}. Best is trial 163 with value: 0.03704138011102343.
2026-05-15 10:20:58,884 - optuna.study._optimize - INFO - Trial 178 pruned. 
2026-05-15 10:21:21,380 - optuna.study.study - INFO - Trial 179 finished with value: 0.044044571354761315 and parameters: {'n_layers': 1, 'embedding_dim': 96, 'lr': 0.0001158705045876225, 'lambda_val': 0.00024854533712462317, 'batch_size': 609, 'optimizer': 'RMSprop'}. Best is trial 179 with value: 0.044044571354761315.
2026-05-15 10:21:24,418 - optuna.study._optimize - INFO - Trial 180 pruned. 
2026-05-15 10:21:27,225 - optuna.study._optimize - INFO - Trial 181 pruned. 
2026-05-15 10:21:49,611 - optuna.study.study - INFO - Trial 182 finished with value: 0.031452189012210106 and parameters: {'n_layers': 1, 'embedding_dim': 96, 'lr': 0.00015522239638766065, 'lambda_val': 0.00010826127320533218, 'batch_size': 579, 'optimizer': 'RMSprop'}. Best is trial 179 with value: 0.044044571354761315.
2026-05-15 10:21:54,992 - optuna.study._optimize - INFO - Trial 183 pruned. 
2026-05-15 10:21:59,622 - optuna.study._optimize - INFO - Trial 184 pruned. 
2026-05-15 10:22:24,801 - optuna.study.study - INFO - Trial 185 finished with value: 0.009355667543907223 and parameters: {'n_layers': 1, 'embedding_dim': 96, 'lr': 0.0002418360143730503, 'lambda_val': 0.00012204102592858284, 'batch_size': 653, 'optimizer': 'RMSprop'}. Best is trial 179 with value: 0.044044571354761315.
2026-05-15 10:22:29,069 - optuna.study._optimize - INFO - Trial 186 pruned. 
2026-05-15 10:22:54,956 - optuna.study.study - INFO - Trial 187 finished with value: 0.020932198473126648 and parameters: {'n_layers': 1, 'embedding_dim': 128, 'lr': 0.00017717875999537894, 'lambda_val': 8.807085283338532e-05, 'batch_size': 566, 'optimizer': 'RMSprop'}. Best is trial 179 with value: 0.044044571354761315.
2026-05-15 10:22:58,026 - optuna.study._optimize - INFO - Trial 188 pruned. 
2026-05-15 10:23:22,939 - optuna.study.study - INFO - Trial 189 finished with value: 0.008499679779335327 and parameters: {'n_layers': 1, 'embedding_dim': 96, 'lr': 0.00020149144249573565, 'lambda_val': 0.00013255203977420154, 'batch_size': 731, 'optimizer': 'Adam'}. Best is trial 179 with value: 0.044044571354761315.
2026-05-15 10:23:48,243 - optuna.study.study - INFO - Trial 190 finished with value: 0.01020109634359666 and parameters: {'n_layers': 1, 'embedding_dim': 96, 'lr': 0.00015206393127706788, 'lambda_val': 0.00030147648688836877, 'batch_size': 1798, 'optimizer': 'RMSprop'}. Best is trial 179 with value: 0.044044571354761315.
2026-05-15 10:24:13,894 - optuna.study.study - INFO - Trial 191 finished with value: 0.01908248940840505 and parameters: {'n_layers': 1, 'embedding_dim': 96, 'lr': 0.0001646940637986107, 'lambda_val': 1.2580057993974796e-05, 'batch_size': 797, 'optimizer': 'RMSprop'}. Best is trial 179 with value: 0.044044571354761315.
2026-05-15 10:24:17,956 - optuna.study._optimize - INFO - Trial 192 pruned. 
2026-05-15 10:24:21,337 - optuna.study._optimize - INFO - Trial 193 pruned. 
2026-05-15 10:24:25,032 - optuna.study._optimize - INFO - Trial 194 pruned. 
2026-05-15 10:24:28,693 - optuna.study._optimize - INFO - Trial 195 pruned. 
2026-05-15 10:24:32,138 - optuna.study._optimize - INFO - Trial 196 pruned. 
2026-05-15 10:24:58,746 - optuna.study.study - INFO - Trial 197 finished with value: 0.01754312801964077 and parameters: {'n_layers': 1, 'embedding_dim': 96, 'lr': 0.00019754646128914257, 'lambda_val': 0.00010327516056617275, 'batch_size': 718, 'optimizer': 'RMSprop'}. Best is trial 179 with value: 0.044044571354761315.
2026-05-15 10:25:02,574 - optuna.study._optimize - INFO - Trial 198 pruned. 
2026-05-15 10:25:29,909 - optuna.study.study - INFO - Trial 199 finished with value: 0.008812723983245816 and parameters: {'n_layers': 1, 'embedding_dim': 96, 'lr': 0.0003070684707449671, 'lambda_val': 1.5122133784239956e-05, 'batch_size': 607, 'optimizer': 'RMSprop'}. Best is trial 179 with value: 0.044044571354761315.
2026-05-15 10:25:49,884 - root - INFO -   ** Getting the trainable edges:
2026-05-15 10:25:49,890 - helper_functions - INFO -      Number of nodes: 4883
2026-05-15 10:25:49,890 - helper_functions - INFO -      Ratio: 0.5389029908398631
2026-05-15 10:25:49,890 - helper_functions - INFO -      Number of unique users: 343
2026-05-15 10:25:49,890 - helper_functions - INFO -      Number of unique items: 4540
2026-05-15 10:25:49,890 - helper_functions - INFO -      Total dominant set edge: 70473
2026-05-15 10:25:49,890 - helper_functions - INFO -      Trainable edges: 56378.4
2026-05-15 10:25:49,898 - root - INFO -   **** Getting 70473 dominant set edges
2026-05-15 10:25:50,448 - optuna.storages._rdb.storage - INFO - A new study created in RDB with name: Study_e_100K_1c3dcs
2026-05-15 10:26:34,023 - optuna.study.study - INFO - Trial 0 finished with value: 0.0016042509573673258 and parameters: {'n_layers': 1, 'embedding_dim': 128, 'lr': 0.010630598403599647, 'lambda_val': 0.0014732595749095154, 'batch_size': 1706, 'optimizer': 'SGD'}. Best is trial 0 with value: 0.0016042509573673258.
2026-05-15 10:27:28,245 - optuna.study.study - INFO - Trial 1 finished with value: 0.0008717232853110189 and parameters: {'n_layers': 4, 'embedding_dim': 96, 'lr': 0.00738500452231347, 'lambda_val': 0.00011593398574042417, 'batch_size': 3105, 'optimizer': 'SGD'}. Best is trial 0 with value: 0.0016042509573673258.
2026-05-15 10:28:21,031 - optuna.study.study - INFO - Trial 2 finished with value: 0.006524169668080244 and parameters: {'n_layers': 3, 'embedding_dim': 64, 'lr': 1.126393465318375e-05, 'lambda_val': 0.006115591935949764, 'batch_size': 716, 'optimizer': 'RMSprop'}. Best is trial 2 with value: 0.006524169668080244.
2026-05-15 10:28:54,282 - optuna.study.study - INFO - Trial 3 finished with value: 0.0016647525367311771 and parameters: {'n_layers': 3, 'embedding_dim': 32, 'lr': 0.0031463641161153665, 'lambda_val': 0.0005062008982935692, 'batch_size': 2356, 'optimizer': 'SGD'}. Best is trial 2 with value: 0.006524169668080244.
2026-05-15 10:30:02,203 - optuna.study.study - INFO - Trial 4 finished with value: 0.014154511114015805 and parameters: {'n_layers': 4, 'embedding_dim': 256, 'lr': 1.2525550932890933e-05, 'lambda_val': 1.0447006728783514e-05, 'batch_size': 3154, 'optimizer': 'Adam'}. Best is trial 4 with value: 0.014154511114015805.
2026-05-15 10:30:34,394 - optuna.study.study - INFO - Trial 5 finished with value: 0.026512332679899952 and parameters: {'n_layers': 2, 'embedding_dim': 64, 'lr': 0.0001588609351274701, 'lambda_val': 0.0015358001534570953, 'batch_size': 2762, 'optimizer': 'Adam'}. Best is trial 5 with value: 0.026512332679899952.
2026-05-15 10:31:09,503 - optuna.study.study - INFO - Trial 6 finished with value: 0.028447139482824946 and parameters: {'n_layers': 3, 'embedding_dim': 64, 'lr': 0.06044881988526905, 'lambda_val': 0.0002366856771391181, 'batch_size': 2353, 'optimizer': 'Adam'}. Best is trial 6 with value: 0.028447139482824946.
2026-05-15 10:31:14,300 - optuna.study._optimize - INFO - Trial 7 pruned. 
2026-05-15 10:31:48,720 - optuna.study.study - INFO - Trial 8 finished with value: 0.024017455194146223 and parameters: {'n_layers': 4, 'embedding_dim': 32, 'lr': 4.8611063056835306e-05, 'lambda_val': 1.2966117319414087e-05, 'batch_size': 1939, 'optimizer': 'Adam'}. Best is trial 6 with value: 0.028447139482824946.
2026-05-15 10:32:18,184 - optuna.study.study - INFO - Trial 9 finished with value: 0.028675703062081823 and parameters: {'n_layers': 2, 'embedding_dim': 32, 'lr': 0.07303898704267235, 'lambda_val': 5.9936516860333704e-05, 'batch_size': 2139, 'optimizer': 'Adam'}. Best is trial 9 with value: 0.028675703062081823.
2026-05-15 10:32:46,300 - optuna.study.study - INFO - Trial 10 finished with value: 0.021303740076999447 and parameters: {'n_layers': 1, 'embedding_dim': 32, 'lr': 0.09144904854829164, 'lambda_val': 2.182594742421885e-06, 'batch_size': 4021, 'optimizer': 'Adam'}. Best is trial 9 with value: 0.028675703062081823.
2026-05-15 10:33:15,904 - optuna.study.study - INFO - Trial 11 finished with value: 0.03478070067803037 and parameters: {'n_layers': 2, 'embedding_dim': 64, 'lr': 0.03662413213086298, 'lambda_val': 4.564326679462568e-05, 'batch_size': 1177, 'optimizer': 'Adam'}. Best is trial 11 with value: 0.03478070067803037.
2026-05-15 10:33:47,815 - optuna.study.study - INFO - Trial 12 finished with value: 0.03848501402082327 and parameters: {'n_layers': 2, 'embedding_dim': 96, 'lr': 0.02329252140208096, 'lambda_val': 2.764432686158109e-05, 'batch_size': 1045, 'optimizer': 'Adam'}. Best is trial 12 with value: 0.03848501402082327.
2026-05-15 10:34:19,784 - optuna.study.study - INFO - Trial 13 finished with value: 0.025295742651513332 and parameters: {'n_layers': 2, 'embedding_dim': 96, 'lr': 0.0006502706849638725, 'lambda_val': 1.4651131440979871e-05, 'batch_size': 969, 'optimizer': 'Adam'}. Best is trial 12 with value: 0.03848501402082327.
2026-05-15 10:34:23,237 - optuna.study._optimize - INFO - Trial 14 pruned. 
2026-05-15 10:35:04,219 - optuna.study.study - INFO - Trial 15 finished with value: 0.032852880713674794 and parameters: {'n_layers': 2, 'embedding_dim': 256, 'lr': 0.0016188366334945559, 'lambda_val': 1.5418307412839034e-06, 'batch_size': 517, 'optimizer': 'RMSprop'}. Best is trial 12 with value: 0.03848501402082327.
2026-05-15 10:35:08,730 - optuna.study._optimize - INFO - Trial 16 pruned. 
2026-05-15 10:35:35,787 - optuna.study.study - INFO - Trial 17 finished with value: 0.030019463118265158 and parameters: {'n_layers': 1, 'embedding_dim': 64, 'lr': 0.004731293217734138, 'lambda_val': 5.1605226504402324e-06, 'batch_size': 1416, 'optimizer': 'Adam'}. Best is trial 12 with value: 0.03848501402082327.
2026-05-15 10:35:39,781 - optuna.study._optimize - INFO - Trial 18 pruned. 
2026-05-15 10:35:46,689 - optuna.study._optimize - INFO - Trial 19 pruned. 
2026-05-15 10:36:21,342 - optuna.study.study - INFO - Trial 20 finished with value: 0.06610463738890332 and parameters: {'n_layers': 1, 'embedding_dim': 256, 'lr': 0.001941316553247658, 'lambda_val': 0.012022746478201377, 'batch_size': 920, 'optimizer': 'Adam'}. Best is trial 20 with value: 0.06610463738890332.
2026-05-15 10:36:25,435 - optuna.study._optimize - INFO - Trial 21 pruned. 
2026-05-15 10:36:58,534 - optuna.study.study - INFO - Trial 22 finished with value: 0.06266170713757165 and parameters: {'n_layers': 1, 'embedding_dim': 256, 'lr': 0.011011257790073427, 'lambda_val': 0.013601504078022226, 'batch_size': 575, 'optimizer': 'Adam'}. Best is trial 20 with value: 0.06610463738890332.
2026-05-15 10:37:30,726 - optuna.study.study - INFO - Trial 23 finished with value: 0.0688799498331916 and parameters: {'n_layers': 1, 'embedding_dim': 256, 'lr': 0.011808282341780314, 'lambda_val': 0.012479019005535484, 'batch_size': 544, 'optimizer': 'Adam'}. Best is trial 23 with value: 0.0688799498331916.
2026-05-15 10:38:04,142 - optuna.study.study - INFO - Trial 24 finished with value: 0.0570836758715597 and parameters: {'n_layers': 1, 'embedding_dim': 256, 'lr': 0.009691308754441413, 'lambda_val': 0.017051599886644682, 'batch_size': 560, 'optimizer': 'Adam'}. Best is trial 23 with value: 0.0688799498331916.
2026-05-15 10:38:37,647 - optuna.study.study - INFO - Trial 25 finished with value: 0.0706783691692522 and parameters: {'n_layers': 1, 'embedding_dim': 256, 'lr': 0.0012686162745392116, 'lambda_val': 0.009463361299489525, 'batch_size': 732, 'optimizer': 'Adam'}. Best is trial 25 with value: 0.0706783691692522.
2026-05-15 10:39:10,845 - optuna.study.study - INFO - Trial 26 finished with value: 0.079552923493468 and parameters: {'n_layers': 1, 'embedding_dim': 256, 'lr': 0.00024254619694813684, 'lambda_val': 0.005241411401583643, 'batch_size': 792, 'optimizer': 'Adam'}. Best is trial 26 with value: 0.079552923493468.
2026-05-15 10:39:44,689 - optuna.study.study - INFO - Trial 27 finished with value: 0.07530969972196698 and parameters: {'n_layers': 1, 'embedding_dim': 256, 'lr': 0.00023600803391208541, 'lambda_val': 0.004077375300455986, 'batch_size': 1490, 'optimizer': 'Adam'}. Best is trial 26 with value: 0.079552923493468.
2026-05-15 10:40:17,797 - optuna.study.study - INFO - Trial 28 finished with value: 0.08689335864554718 and parameters: {'n_layers': 1, 'embedding_dim': 256, 'lr': 0.00021103800693925834, 'lambda_val': 0.00215054322801173, 'batch_size': 1554, 'optimizer': 'RMSprop'}. Best is trial 28 with value: 0.08689335864554718.
2026-05-15 10:40:51,115 - optuna.study.study - INFO - Trial 29 finished with value: 0.07432348357280016 and parameters: {'n_layers': 1, 'embedding_dim': 128, 'lr': 0.00017022636831437048, 'lambda_val': 0.0027507909708128914, 'batch_size': 1533, 'optimizer': 'RMSprop'}. Best is trial 28 with value: 0.08689335864554718.
2026-05-15 10:41:23,654 - optuna.study.study - INFO - Trial 30 finished with value: 0.06512942263326739 and parameters: {'n_layers': 1, 'embedding_dim': 256, 'lr': 0.00021914266345782722, 'lambda_val': 0.0038000272957195705, 'batch_size': 1816, 'optimizer': 'RMSprop'}. Best is trial 28 with value: 0.08689335864554718.
2026-05-15 10:41:27,185 - optuna.study._optimize - INFO - Trial 31 pruned. 
2026-05-15 10:41:55,790 - optuna.study.study - INFO - Trial 32 finished with value: 0.058062517673715654 and parameters: {'n_layers': 1, 'embedding_dim': 128, 'lr': 0.0003301517155217137, 'lambda_val': 0.003327044124743575, 'batch_size': 1485, 'optimizer': 'RMSprop'}. Best is trial 28 with value: 0.08689335864554718.
2026-05-15 10:41:59,428 - optuna.study._optimize - INFO - Trial 33 pruned. 
2026-05-15 10:42:02,551 - optuna.study._optimize - INFO - Trial 34 pruned. 
2026-05-15 10:42:37,153 - optuna.study.study - INFO - Trial 35 finished with value: 0.06720327635994043 and parameters: {'n_layers': 1, 'embedding_dim': 256, 'lr': 0.0007156395996857943, 'lambda_val': 0.003350155845223131, 'batch_size': 1243, 'optimizer': 'RMSprop'}. Best is trial 28 with value: 0.08689335864554718.
2026-05-15 10:42:41,237 - optuna.study._optimize - INFO - Trial 36 pruned. 
2026-05-15 10:42:46,206 - optuna.study._optimize - INFO - Trial 37 pruned. 
2026-05-15 10:43:16,858 - optuna.study.study - INFO - Trial 38 finished with value: 0.06154800780828524 and parameters: {'n_layers': 1, 'embedding_dim': 128, 'lr': 0.00030342312489068925, 'lambda_val': 0.03273482329881403, 'batch_size': 3312, 'optimizer': 'RMSprop'}. Best is trial 28 with value: 0.08689335864554718.
2026-05-15 10:43:59,326 - optuna.study.study - INFO - Trial 39 finished with value: 0.032684857451028615 and parameters: {'n_layers': 2, 'embedding_dim': 256, 'lr': 0.00011362704547751919, 'lambda_val': 0.0010659805103458368, 'batch_size': 1983, 'optimizer': 'RMSprop'}. Best is trial 28 with value: 0.08689335864554718.
2026-05-15 10:44:04,438 - optuna.study._optimize - INFO - Trial 40 pruned. 
2026-05-15 10:44:37,538 - optuna.study.study - INFO - Trial 41 finished with value: 0.0685233676555733 and parameters: {'n_layers': 1, 'embedding_dim': 256, 'lr': 0.0010796893724939795, 'lambda_val': 0.006047598631292251, 'batch_size': 783, 'optimizer': 'RMSprop'}. Best is trial 28 with value: 0.08689335864554718.
2026-05-15 10:45:11,472 - optuna.study.study - INFO - Trial 42 finished with value: 0.07028080106299528 and parameters: {'n_layers': 1, 'embedding_dim': 256, 'lr': 0.0002658666014632497, 'lambda_val': 0.007798485882562161, 'batch_size': 1102, 'optimizer': 'Adam'}. Best is trial 28 with value: 0.08689335864554718.
