2026-05-15 03:31:28,247 - root - INFO - **** Training e_100K_full
2026-05-15 03:31:28,271 - helper_functions - INFO - Users: 610, Items: 9742
2026-05-15 03:31:28,403 - helper_functions - INFO - Edge index: torch.Size([2, 81763])
2026-05-15 03:31:28,403 - root - INFO - **** Generating the graph:
2026-05-15 03:31:28,471 - helper_functions - INFO - Number of unique users: 609
2026-05-15 03:31:28,472 - helper_functions - INFO - Number of unique items: 8452
2026-05-15 03:31:28,472 - helper_functions - INFO - Number of nodes: 9061
2026-05-15 03:31:28,473 - helper_functions - INFO - Number of edges: 81763
2026-05-15 03:31:30,971 - optuna.storages._rdb.storage - INFO - A new study created in RDB with name: Study_e_100K_full
2026-05-15 03:32:06,380 - optuna.study.study - INFO - Trial 0 finished with value: 0.018886449961176697 and parameters: {'n_layers': 3, 'embedding_dim': 64, 'lr': 0.001063222443437715, 'lambda_val': 3.110566352396817e-05, 'batch_size': 3576, 'optimizer': 'RMSprop'}. Best is trial 0 with value: 0.018886449961176697.
2026-05-15 03:32:40,161 - optuna.study.study - INFO - Trial 1 finished with value: 0.028488419778737218 and parameters: {'n_layers': 2, 'embedding_dim': 128, 'lr': 0.0026938753944455705, 'lambda_val': 0.00822795468883455, 'batch_size': 1655, 'optimizer': 'Adam'}. Best is trial 1 with value: 0.028488419778737218.
2026-05-15 03:33:22,638 - optuna.study.study - INFO - Trial 2 finished with value: 0.015734674003765436 and parameters: {'n_layers': 3, 'embedding_dim': 64, 'lr': 1.6555678820254026e-05, 'lambda_val': 5.4074576689841095e-05, 'batch_size': 659, 'optimizer': 'Adam'}. Best is trial 1 with value: 0.028488419778737218.
2026-05-15 03:34:00,947 - optuna.study.study - INFO - Trial 3 finished with value: 0.0014843015341929504 and parameters: {'n_layers': 3, 'embedding_dim': 128, 'lr': 0.05140182443791963, 'lambda_val': 0.07167173347962412, 'batch_size': 1221, 'optimizer': 'SGD'}. Best is trial 1 with value: 0.028488419778737218.
2026-05-15 03:34:27,411 - optuna.study.study - INFO - Trial 4 finished with value: 0.0010902506129310816 and parameters: {'n_layers': 1, 'embedding_dim': 32, 'lr': 0.00016433378868331163, 'lambda_val': 0.015544553376731003, 'batch_size': 2495, 'optimizer': 'SGD'}. Best is trial 1 with value: 0.028488419778737218.
2026-05-15 03:35:00,623 - optuna.study.study - INFO - Trial 5 finished with value: 0.015391752390497842 and parameters: {'n_layers': 3, 'embedding_dim': 32, 'lr': 0.010873425964050767, 'lambda_val': 4.28325887355215e-06, 'batch_size': 2938, 'optimizer': 'Adam'}. Best is trial 1 with value: 0.028488419778737218.
2026-05-15 03:35:04,064 - optuna.study._optimize - INFO - Trial 6 pruned. 
2026-05-15 03:35:09,329 - optuna.study._optimize - INFO - Trial 7 pruned. 
2026-05-15 03:35:53,258 - optuna.study.study - INFO - Trial 8 finished with value: 0.009415274790651618 and parameters: {'n_layers': 2, 'embedding_dim': 96, 'lr': 0.0002734107174396403, 'lambda_val': 0.04639315585182183, 'batch_size': 3688, 'optimizer': 'RMSprop'}. Best is trial 1 with value: 0.028488419778737218.
2026-05-15 03:36:35,896 - optuna.study.study - INFO - Trial 9 finished with value: 0.033351970320483704 and parameters: {'n_layers': 4, 'embedding_dim': 96, 'lr': 0.038871950270611265, 'lambda_val': 0.0003465580719424528, 'batch_size': 2324, 'optimizer': 'Adam'}. Best is trial 9 with value: 0.033351970320483704.
2026-05-15 03:37:36,943 - optuna.study.study - INFO - Trial 10 finished with value: 0.020597873065659012 and parameters: {'n_layers': 4, 'embedding_dim': 256, 'lr': 0.07221601205311659, 'lambda_val': 0.001085572920983762, 'batch_size': 1888, 'optimizer': 'Adam'}. Best is trial 9 with value: 0.033351970320483704.
2026-05-15 03:38:08,283 - optuna.study.study - INFO - Trial 11 finished with value: 0.04316358470088882 and parameters: {'n_layers': 2, 'embedding_dim': 96, 'lr': 0.014687019114474308, 'lambda_val': 0.002303801657639055, 'batch_size': 1853, 'optimizer': 'Adam'}. Best is trial 11 with value: 0.04316358470088882.
2026-05-15 03:38:37,700 - optuna.study.study - INFO - Trial 12 finished with value: 0.04667176207616858 and parameters: {'n_layers': 2, 'embedding_dim': 96, 'lr': 0.021382970373128925, 'lambda_val': 0.001170217195955813, 'batch_size': 2430, 'optimizer': 'Adam'}. Best is trial 12 with value: 0.04667176207616858.
2026-05-15 03:39:07,519 - optuna.study.study - INFO - Trial 13 finished with value: 0.033431801436243455 and parameters: {'n_layers': 2, 'embedding_dim': 96, 'lr': 0.012788456008554744, 'lambda_val': 0.004310886564256234, 'batch_size': 2884, 'optimizer': 'Adam'}. Best is trial 12 with value: 0.04667176207616858.
2026-05-15 03:39:33,778 - optuna.study.study - INFO - Trial 14 finished with value: 0.07843567354898687 and parameters: {'n_layers': 1, 'embedding_dim': 96, 'lr': 0.02539644820479049, 'lambda_val': 0.0013419292951122512, 'batch_size': 1812, 'optimizer': 'Adam'}. Best is trial 14 with value: 0.07843567354898687.
2026-05-15 03:39:37,354 - optuna.study._optimize - INFO - Trial 15 pruned. 
2026-05-15 03:40:11,728 - optuna.study.study - INFO - Trial 16 finished with value: 0.06440275965398048 and parameters: {'n_layers': 1, 'embedding_dim': 256, 'lr': 0.0037030789667506056, 'lambda_val': 0.00010584073866379355, 'batch_size': 2027, 'optimizer': 'Adam'}. Best is trial 14 with value: 0.07843567354898687.
2026-05-15 03:40:45,813 - optuna.study.study - INFO - Trial 17 finished with value: 0.053184919007919274 and parameters: {'n_layers': 1, 'embedding_dim': 256, 'lr': 0.00348278793020982, 'lambda_val': 1.0719073208367527e-06, 'batch_size': 1452, 'optimizer': 'Adam'}. Best is trial 14 with value: 0.07843567354898687.
2026-05-15 03:41:18,639 - optuna.study.study - INFO - Trial 18 finished with value: 0.06018248445404973 and parameters: {'n_layers': 1, 'embedding_dim': 256, 'lr': 0.0006535919013044153, 'lambda_val': 9.286518197514066e-05, 'batch_size': 2110, 'optimizer': 'Adam'}. Best is trial 14 with value: 0.07843567354898687.
2026-05-15 03:41:22,735 - optuna.study._optimize - INFO - Trial 19 pruned. 
2026-05-15 03:41:57,237 - optuna.study.study - INFO - Trial 20 finished with value: 0.07273535874073157 and parameters: {'n_layers': 1, 'embedding_dim': 256, 'lr': 0.005073647071127899, 'lambda_val': 0.0002087361638369453, 'batch_size': 1346, 'optimizer': 'Adam'}. Best is trial 14 with value: 0.07843567354898687.
2026-05-15 03:42:30,725 - optuna.study.study - INFO - Trial 21 finished with value: 0.06443782712011344 and parameters: {'n_layers': 1, 'embedding_dim': 256, 'lr': 0.006958753068808745, 'lambda_val': 0.00010901152707006057, 'batch_size': 1275, 'optimizer': 'Adam'}. Best is trial 14 with value: 0.07843567354898687.
2026-05-15 03:42:36,233 - optuna.study._optimize - INFO - Trial 22 pruned. 
2026-05-15 03:43:18,795 - optuna.study.study - INFO - Trial 23 finished with value: 0.035066469754353416 and parameters: {'n_layers': 2, 'embedding_dim': 256, 'lr': 0.001419601957545796, 'lambda_val': 0.00023331979835382799, 'batch_size': 1433, 'optimizer': 'Adam'}. Best is trial 14 with value: 0.07843567354898687.
2026-05-15 03:43:53,174 - optuna.study.study - INFO - Trial 24 finished with value: 0.09042587070425814 and parameters: {'n_layers': 1, 'embedding_dim': 256, 'lr': 0.0063238370498018125, 'lambda_val': 0.0013054477304789232, 'batch_size': 1563, 'optimizer': 'Adam'}. Best is trial 24 with value: 0.09042587070425814.
2026-05-15 03:44:29,521 - optuna.study.study - INFO - Trial 25 finished with value: 0.07459014630666516 and parameters: {'n_layers': 1, 'embedding_dim': 64, 'lr': 0.005706758880770508, 'lambda_val': 0.002015450351013243, 'batch_size': 1678, 'optimizer': 'Adam'}. Best is trial 24 with value: 0.09042587070425814.
2026-05-15 03:44:36,171 - optuna.study._optimize - INFO - Trial 26 pruned. 
2026-05-15 03:45:02,502 - optuna.study.study - INFO - Trial 27 finished with value: 0.04241837395251374 and parameters: {'n_layers': 1, 'embedding_dim': 64, 'lr': 0.00047788963339734657, 'lambda_val': 0.020889422076793836, 'batch_size': 1662, 'optimizer': 'Adam'}. Best is trial 24 with value: 0.09042587070425814.
2026-05-15 03:45:06,157 - optuna.study._optimize - INFO - Trial 28 pruned. 
2026-05-15 03:45:33,212 - optuna.study.study - INFO - Trial 29 finished with value: 0.06638786848452298 and parameters: {'n_layers': 1, 'embedding_dim': 64, 'lr': 0.007926392363744376, 'lambda_val': 0.008157374001180311, 'batch_size': 839, 'optimizer': 'RMSprop'}. Best is trial 24 with value: 0.09042587070425814.
2026-05-15 03:45:37,435 - optuna.study._optimize - INFO - Trial 30 pruned. 
2026-05-15 03:46:10,511 - optuna.study.study - INFO - Trial 31 finished with value: 0.07499950587285803 and parameters: {'n_layers': 1, 'embedding_dim': 256, 'lr': 0.004653897682631148, 'lambda_val': 0.0005498346288420034, 'batch_size': 1444, 'optimizer': 'Adam'}. Best is trial 24 with value: 0.09042587070425814.
2026-05-15 03:46:35,464 - optuna.study.study - INFO - Trial 32 finished with value: 0.060078012747031395 and parameters: {'n_layers': 1, 'embedding_dim': 128, 'lr': 0.0016734999927148152, 'lambda_val': 0.004732455857387431, 'batch_size': 1629, 'optimizer': 'Adam'}. Best is trial 24 with value: 0.09042587070425814.
2026-05-15 03:46:58,200 - optuna.study.study - INFO - Trial 33 finished with value: 0.05916172170917949 and parameters: {'n_layers': 1, 'embedding_dim': 64, 'lr': 0.0050735969572445055, 'lambda_val': 0.000648129628907156, 'batch_size': 2194, 'optimizer': 'Adam'}. Best is trial 24 with value: 0.09042587070425814.
2026-05-15 03:47:03,001 - optuna.study._optimize - INFO - Trial 34 pruned. 
2026-05-15 03:47:06,157 - optuna.study._optimize - INFO - Trial 35 pruned. 
2026-05-15 03:47:09,492 - optuna.study._optimize - INFO - Trial 36 pruned. 
2026-05-15 03:47:13,226 - optuna.study._optimize - INFO - Trial 37 pruned. 
2026-05-15 03:47:16,120 - optuna.study._optimize - INFO - Trial 38 pruned. 
2026-05-15 03:47:19,844 - optuna.study._optimize - INFO - Trial 39 pruned. 
2026-05-15 03:47:24,135 - optuna.study._optimize - INFO - Trial 40 pruned. 
2026-05-15 03:47:55,687 - optuna.study.study - INFO - Trial 41 finished with value: 0.0673458053916145 and parameters: {'n_layers': 1, 'embedding_dim': 256, 'lr': 0.006733861547634994, 'lambda_val': 0.00028540022255364554, 'batch_size': 1142, 'optimizer': 'Adam'}. Best is trial 24 with value: 0.09042587070425814.
2026-05-15 03:48:30,026 - optuna.study.study - INFO - Trial 42 finished with value: 0.07920804942272462 and parameters: {'n_layers': 1, 'embedding_dim': 256, 'lr': 0.002395234184696886, 'lambda_val': 0.00198445433045713, 'batch_size': 1415, 'optimizer': 'Adam'}. Best is trial 24 with value: 0.09042587070425814.
2026-05-15 03:49:03,991 - optuna.study.study - INFO - Trial 43 finished with value: 0.07624925594393565 and parameters: {'n_layers': 1, 'embedding_dim': 256, 'lr': 0.0020594532720113554, 'lambda_val': 0.0018081615159785476, 'batch_size': 1804, 'optimizer': 'Adam'}. Best is trial 24 with value: 0.09042587070425814.
2026-05-15 03:49:38,735 - optuna.study.study - INFO - Trial 44 finished with value: 0.07413277107744869 and parameters: {'n_layers': 1, 'embedding_dim': 256, 'lr': 0.0018756444961309058, 'lambda_val': 0.0038089608147795335, 'batch_size': 1875, 'optimizer': 'Adam'}. Best is trial 24 with value: 0.09042587070425814.
2026-05-15 03:50:13,435 - optuna.study.study - INFO - Trial 45 finished with value: 0.06901648141629807 and parameters: {'n_layers': 1, 'embedding_dim': 256, 'lr': 0.0009254609561924657, 'lambda_val': 0.0008437659737763065, 'batch_size': 2258, 'optimizer': 'Adam'}. Best is trial 24 with value: 0.09042587070425814.
2026-05-15 03:50:19,603 - optuna.study._optimize - INFO - Trial 46 pruned. 
2026-05-15 03:50:23,138 - optuna.study._optimize - INFO - Trial 47 pruned. 
2026-05-15 03:50:55,053 - optuna.study.study - INFO - Trial 48 finished with value: 0.06653286590540973 and parameters: {'n_layers': 1, 'embedding_dim': 256, 'lr': 0.0002857761891191457, 'lambda_val': 0.005156819412674447, 'batch_size': 854, 'optimizer': 'Adam'}. Best is trial 24 with value: 0.09042587070425814.
2026-05-15 03:50:59,139 - optuna.study._optimize - INFO - Trial 49 pruned. 
2026-05-15 03:51:04,045 - optuna.study._optimize - INFO - Trial 50 pruned. 
2026-05-15 03:51:48,095 - optuna.study.study - INFO - Trial 51 finished with value: 0.08309736843010164 and parameters: {'n_layers': 1, 'embedding_dim': 256, 'lr': 0.0029353872857309803, 'lambda_val': 0.0021771502839461293, 'batch_size': 1682, 'optimizer': 'Adam'}. Best is trial 24 with value: 0.09042587070425814.
2026-05-15 03:52:22,405 - optuna.study.study - INFO - Trial 52 finished with value: 0.06360979028764653 and parameters: {'n_layers': 1, 'embedding_dim': 256, 'lr': 0.0010256768299368151, 'lambda_val': 0.0018381227969378286, 'batch_size': 1354, 'optimizer': 'Adam'}. Best is trial 24 with value: 0.09042587070425814.
2026-05-15 03:52:58,231 - optuna.study.study - INFO - Trial 53 finished with value: 0.07351958026470759 and parameters: {'n_layers': 1, 'embedding_dim': 256, 'lr': 0.003693563361847663, 'lambda_val': 0.0005196741128007296, 'batch_size': 2093, 'optimizer': 'Adam'}. Best is trial 24 with value: 0.09042587070425814.
2026-05-15 03:53:34,144 - optuna.study.study - INFO - Trial 54 finished with value: 0.07038739600730377 and parameters: {'n_layers': 1, 'embedding_dim': 256, 'lr': 0.0025578364504618986, 'lambda_val': 0.0057632363136047825, 'batch_size': 1755, 'optimizer': 'Adam'}. Best is trial 24 with value: 0.09042587070425814.
2026-05-15 03:54:13,609 - optuna.study.study - INFO - Trial 55 finished with value: 0.07833413888655852 and parameters: {'n_layers': 1, 'embedding_dim': 256, 'lr': 0.008972018273608166, 'lambda_val': 0.003051915289751343, 'batch_size': 1178, 'optimizer': 'Adam'}. Best is trial 24 with value: 0.09042587070425814.
2026-05-15 03:54:18,060 - optuna.study._optimize - INFO - Trial 56 pruned. 
2026-05-15 03:54:22,151 - optuna.study._optimize - INFO - Trial 57 pruned. 
2026-05-15 03:54:26,571 - optuna.study._optimize - INFO - Trial 58 pruned. 
2026-05-15 03:54:31,581 - optuna.study._optimize - INFO - Trial 59 pruned. 
2026-05-15 03:54:36,264 - optuna.study._optimize - INFO - Trial 60 pruned. 
2026-05-15 03:55:10,460 - optuna.study.study - INFO - Trial 61 finished with value: 0.06014792887117463 and parameters: {'n_layers': 1, 'embedding_dim': 256, 'lr': 0.0034927407166651606, 'lambda_val': 0.00013147331829664418, 'batch_size': 1424, 'optimizer': 'Adam'}. Best is trial 24 with value: 0.09042587070425814.
2026-05-15 03:55:16,430 - optuna.study._optimize - INFO - Trial 62 pruned. 
2026-05-15 03:55:20,428 - optuna.study._optimize - INFO - Trial 63 pruned. 
2026-05-15 03:55:56,383 - optuna.study.study - INFO - Trial 64 finished with value: 0.07792013763682426 and parameters: {'n_layers': 1, 'embedding_dim': 256, 'lr': 0.004393461202352581, 'lambda_val': 0.0008969151916205984, 'batch_size': 1752, 'optimizer': 'Adam'}. Best is trial 24 with value: 0.09042587070425814.
2026-05-15 03:56:35,034 - optuna.study.study - INFO - Trial 65 finished with value: 0.08693890453666657 and parameters: {'n_layers': 1, 'embedding_dim': 256, 'lr': 0.006264041943775466, 'lambda_val': 0.0008367500548143908, 'batch_size': 2144, 'optimizer': 'Adam'}. Best is trial 24 with value: 0.09042587070425814.
2026-05-15 03:56:46,179 - optuna.study._optimize - INFO - Trial 66 pruned. 
2026-05-15 03:57:24,512 - optuna.study.study - INFO - Trial 67 finished with value: 0.09359820031111127 and parameters: {'n_layers': 1, 'embedding_dim': 256, 'lr': 0.00570992882643075, 'lambda_val': 0.001244274070479235, 'batch_size': 2096, 'optimizer': 'Adam'}. Best is trial 67 with value: 0.09359820031111127.
2026-05-15 03:57:28,699 - optuna.study._optimize - INFO - Trial 68 pruned. 
2026-05-15 03:57:32,575 - optuna.study._optimize - INFO - Trial 69 pruned. 
2026-05-15 03:57:41,748 - optuna.study._optimize - INFO - Trial 70 pruned. 
2026-05-15 03:58:19,548 - optuna.study.study - INFO - Trial 71 finished with value: 0.08558808953184657 and parameters: {'n_layers': 1, 'embedding_dim': 256, 'lr': 0.004353378552916469, 'lambda_val': 0.0014097010557961919, 'batch_size': 1658, 'optimizer': 'Adam'}. Best is trial 67 with value: 0.09359820031111127.
2026-05-15 03:58:56,736 - optuna.study.study - INFO - Trial 72 finished with value: 0.09402790817430869 and parameters: {'n_layers': 1, 'embedding_dim': 256, 'lr': 0.012827523841046082, 'lambda_val': 0.0013781320492717245, 'batch_size': 3136, 'optimizer': 'Adam'}. Best is trial 72 with value: 0.09402790817430869.
2026-05-15 03:59:35,688 - optuna.study.study - INFO - Trial 73 finished with value: 0.08914567724675519 and parameters: {'n_layers': 1, 'embedding_dim': 256, 'lr': 0.0203994042341365, 'lambda_val': 0.0012524161760936467, 'batch_size': 2963, 'optimizer': 'Adam'}. Best is trial 72 with value: 0.09402790817430869.
2026-05-15 04:00:11,435 - optuna.study.study - INFO - Trial 74 finished with value: 0.08002536612044918 and parameters: {'n_layers': 1, 'embedding_dim': 256, 'lr': 0.012833547374956915, 'lambda_val': 0.0001560276292406822, 'batch_size': 3453, 'optimizer': 'Adam'}. Best is trial 72 with value: 0.09402790817430869.
2026-05-15 04:00:26,969 - optuna.study._optimize - INFO - Trial 75 pruned. 
2026-05-15 04:00:31,369 - optuna.study._optimize - INFO - Trial 76 pruned. 
2026-05-15 04:00:39,674 - optuna.study._optimize - INFO - Trial 77 pruned. 
2026-05-15 04:00:49,381 - optuna.study._optimize - INFO - Trial 78 pruned. 
2026-05-15 04:00:56,582 - optuna.study._optimize - INFO - Trial 79 pruned. 
2026-05-15 04:01:01,165 - optuna.study._optimize - INFO - Trial 80 pruned. 
2026-05-15 04:01:45,840 - optuna.study.study - INFO - Trial 81 finished with value: 0.08730934768431065 and parameters: {'n_layers': 1, 'embedding_dim': 256, 'lr': 0.003931977534164029, 'lambda_val': 0.001293126185364291, 'batch_size': 2860, 'optimizer': 'Adam'}. Best is trial 72 with value: 0.09402790817430869.
2026-05-15 04:02:30,919 - optuna.study.study - INFO - Trial 82 finished with value: 0.08402915880226887 and parameters: {'n_layers': 1, 'embedding_dim': 256, 'lr': 0.004104786224148428, 'lambda_val': 0.0013667250537261195, 'batch_size': 2781, 'optimizer': 'Adam'}. Best is trial 72 with value: 0.09402790817430869.
2026-05-15 04:03:09,769 - optuna.study.study - INFO - Trial 83 finished with value: 0.08491560519434434 and parameters: {'n_layers': 1, 'embedding_dim': 256, 'lr': 0.003247824018709822, 'lambda_val': 0.00132731054618093, 'batch_size': 2897, 'optimizer': 'Adam'}. Best is trial 72 with value: 0.09402790817430869.
2026-05-15 04:03:47,822 - optuna.study.study - INFO - Trial 84 finished with value: 0.08783405079174855 and parameters: {'n_layers': 1, 'embedding_dim': 256, 'lr': 0.004105904988253733, 'lambda_val': 0.0011795952891047476, 'batch_size': 2779, 'optimizer': 'Adam'}. Best is trial 72 with value: 0.09402790817430869.
2026-05-15 04:03:51,987 - optuna.study._optimize - INFO - Trial 85 pruned. 
2026-05-15 04:04:32,679 - optuna.study.study - INFO - Trial 86 finished with value: 0.08010087685716759 and parameters: {'n_layers': 1, 'embedding_dim': 256, 'lr': 0.003120823875210829, 'lambda_val': 0.000695870770921587, 'batch_size': 3082, 'optimizer': 'Adam'}. Best is trial 72 with value: 0.09402790817430869.
2026-05-15 04:05:09,634 - optuna.study.study - INFO - Trial 87 finished with value: 0.08837963205150857 and parameters: {'n_layers': 1, 'embedding_dim': 256, 'lr': 0.007764377956337987, 'lambda_val': 0.0014580191354871131, 'batch_size': 2803, 'optimizer': 'Adam'}. Best is trial 72 with value: 0.09402790817430869.
2026-05-15 04:05:47,033 - optuna.study.study - INFO - Trial 88 finished with value: 0.07425215110783212 and parameters: {'n_layers': 1, 'embedding_dim': 256, 'lr': 0.010411808261354617, 'lambda_val': 0.003926719826313587, 'batch_size': 2740, 'optimizer': 'Adam'}. Best is trial 72 with value: 0.09402790817430869.
2026-05-15 04:06:25,225 - optuna.study.study - INFO - Trial 89 finished with value: 0.08950835700837365 and parameters: {'n_layers': 1, 'embedding_dim': 256, 'lr': 0.0071782875967707875, 'lambda_val': 0.0004167090470055552, 'batch_size': 2512, 'optimizer': 'Adam'}. Best is trial 72 with value: 0.09402790817430869.
2026-05-15 04:07:05,002 - optuna.study.study - INFO - Trial 90 finished with value: 0.09222469693571535 and parameters: {'n_layers': 1, 'embedding_dim': 256, 'lr': 0.007688526039267997, 'lambda_val': 0.0004842499975243946, 'batch_size': 2541, 'optimizer': 'RMSprop'}. Best is trial 72 with value: 0.09402790817430869.
2026-05-15 04:07:42,827 - optuna.study.study - INFO - Trial 91 finished with value: 0.08842378227723473 and parameters: {'n_layers': 1, 'embedding_dim': 256, 'lr': 0.007181848608945622, 'lambda_val': 0.000292710367936054, 'batch_size': 2568, 'optimizer': 'RMSprop'}. Best is trial 72 with value: 0.09402790817430869.
2026-05-15 04:07:47,219 - optuna.study._optimize - INFO - Trial 92 pruned. 
2026-05-15 04:07:50,632 - optuna.study._optimize - INFO - Trial 93 pruned. 
2026-05-15 04:08:28,306 - optuna.study.study - INFO - Trial 94 finished with value: 0.08736070829159023 and parameters: {'n_layers': 1, 'embedding_dim': 256, 'lr': 0.005244740743841478, 'lambda_val': 0.0005461991753988989, 'batch_size': 2523, 'optimizer': 'RMSprop'}. Best is trial 72 with value: 0.09402790817430869.
2026-05-15 04:09:08,944 - optuna.study.study - INFO - Trial 95 finished with value: 0.07790400617168294 and parameters: {'n_layers': 1, 'embedding_dim': 256, 'lr': 0.007548174034917323, 'lambda_val': 0.00023555495167906334, 'batch_size': 2514, 'optimizer': 'RMSprop'}. Best is trial 72 with value: 0.09402790817430869.
2026-05-15 04:09:48,345 - optuna.study.study - INFO - Trial 96 finished with value: 0.08651624080014707 and parameters: {'n_layers': 1, 'embedding_dim': 256, 'lr': 0.005184167029194967, 'lambda_val': 0.00041132091439693476, 'batch_size': 2425, 'optimizer': 'RMSprop'}. Best is trial 72 with value: 0.09402790817430869.
