2026-05-15 05:27:55,135 - optuna.study.study - INFO - Trial 108 finished with value: 0.023646072889363753 and parameters: {'n_layers': 4, 'embedding_dim': 96, 'lr': 0.018881390144251022, 'lambda_val': 5.794659220316092e-05, 'batch_size': 3933, 'optimizer': 'Adam'}. Best is trial 42 with value: 0.0287930838515238.
2026-05-15 05:27:58,868 - optuna.study._optimize - INFO - Trial 109 pruned. 
2026-05-15 05:28:03,707 - optuna.study._optimize - INFO - Trial 110 pruned. 
2026-05-15 05:28:34,334 - optuna.study.study - INFO - Trial 111 finished with value: 0.025658944981356218 and parameters: {'n_layers': 4, 'embedding_dim': 96, 'lr': 0.01061260145470511, 'lambda_val': 4.530471410004115e-05, 'batch_size': 3738, 'optimizer': 'RMSprop'}. Best is trial 42 with value: 0.0287930838515238.
2026-05-15 05:28:38,280 - optuna.study._optimize - INFO - Trial 112 pruned. 
2026-05-15 05:29:09,464 - optuna.study.study - INFO - Trial 113 finished with value: 0.024390018166640597 and parameters: {'n_layers': 4, 'embedding_dim': 96, 'lr': 0.012317679108875294, 'lambda_val': 8.011292395100321e-05, 'batch_size': 3744, 'optimizer': 'RMSprop'}. Best is trial 42 with value: 0.0287930838515238.
2026-05-15 05:29:13,264 - optuna.study._optimize - INFO - Trial 114 pruned. 
2026-05-15 05:29:18,296 - optuna.study._optimize - INFO - Trial 115 pruned. 
2026-05-15 05:29:25,002 - optuna.study._optimize - INFO - Trial 116 pruned. 
2026-05-15 05:29:28,819 - optuna.study._optimize - INFO - Trial 117 pruned. 
2026-05-15 05:29:32,780 - optuna.study._optimize - INFO - Trial 118 pruned. 
2026-05-15 05:29:36,155 - optuna.study._optimize - INFO - Trial 119 pruned. 
2026-05-15 05:30:09,972 - optuna.study.study - INFO - Trial 120 finished with value: 0.026881367280804275 and parameters: {'n_layers': 4, 'embedding_dim': 96, 'lr': 0.007835004249309918, 'lambda_val': 5.880961594483667e-05, 'batch_size': 4051, 'optimizer': 'RMSprop'}. Best is trial 42 with value: 0.0287930838515238.
2026-05-15 05:30:13,733 - optuna.study._optimize - INFO - Trial 121 pruned. 
2026-05-15 05:30:17,543 - optuna.study._optimize - INFO - Trial 122 pruned. 
2026-05-15 05:30:48,048 - optuna.study.study - INFO - Trial 123 finished with value: 0.02568909620605708 and parameters: {'n_layers': 4, 'embedding_dim': 96, 'lr': 0.014869639024855202, 'lambda_val': 4.318196997096127e-05, 'batch_size': 3977, 'optimizer': 'RMSprop'}. Best is trial 42 with value: 0.0287930838515238.
2026-05-15 05:31:15,184 - optuna.study.study - INFO - Trial 124 finished with value: 0.023066574131532194 and parameters: {'n_layers': 4, 'embedding_dim': 96, 'lr': 0.01463586436966802, 'lambda_val': 4.46732799872993e-05, 'batch_size': 3940, 'optimizer': 'RMSprop'}. Best is trial 42 with value: 0.0287930838515238.
2026-05-15 05:31:44,587 - optuna.study.study - INFO - Trial 125 finished with value: 0.025815996774750938 and parameters: {'n_layers': 4, 'embedding_dim': 96, 'lr': 0.012873230886671676, 'lambda_val': 0.00011470459783837319, 'batch_size': 4009, 'optimizer': 'RMSprop'}. Best is trial 42 with value: 0.0287930838515238.
2026-05-15 05:31:49,026 - optuna.study._optimize - INFO - Trial 126 pruned. 
2026-05-15 05:32:19,275 - optuna.study.study - INFO - Trial 127 finished with value: 0.025608960148000025 and parameters: {'n_layers': 4, 'embedding_dim': 96, 'lr': 0.017564331184151988, 'lambda_val': 8.517933083081933e-05, 'batch_size': 4009, 'optimizer': 'RMSprop'}. Best is trial 42 with value: 0.0287930838515238.
2026-05-15 05:32:22,987 - optuna.study._optimize - INFO - Trial 128 pruned. 
2026-05-15 05:32:26,859 - optuna.study._optimize - INFO - Trial 129 pruned. 
2026-05-15 05:32:30,853 - optuna.study._optimize - INFO - Trial 130 pruned. 
2026-05-15 05:33:00,642 - optuna.study.study - INFO - Trial 131 finished with value: 0.025439846851130276 and parameters: {'n_layers': 4, 'embedding_dim': 96, 'lr': 0.018508484814592857, 'lambda_val': 9.226374119918073e-05, 'batch_size': 4085, 'optimizer': 'RMSprop'}. Best is trial 42 with value: 0.0287930838515238.
2026-05-15 05:33:30,492 - optuna.study.study - INFO - Trial 132 finished with value: 0.027619712186544507 and parameters: {'n_layers': 4, 'embedding_dim': 96, 'lr': 0.013334875121048325, 'lambda_val': 8.208090338139512e-05, 'batch_size': 3909, 'optimizer': 'RMSprop'}. Best is trial 42 with value: 0.0287930838515238.
2026-05-15 05:33:58,985 - optuna.study.study - INFO - Trial 133 finished with value: 0.026452998886850602 and parameters: {'n_layers': 4, 'embedding_dim': 96, 'lr': 0.013042233192174976, 'lambda_val': 0.00012502758861515493, 'batch_size': 3888, 'optimizer': 'RMSprop'}. Best is trial 42 with value: 0.0287930838515238.
2026-05-15 05:34:26,995 - optuna.study.study - INFO - Trial 134 finished with value: 0.026105410810151542 and parameters: {'n_layers': 4, 'embedding_dim': 96, 'lr': 0.013148209474994283, 'lambda_val': 0.0001252169095170049, 'batch_size': 3818, 'optimizer': 'RMSprop'}. Best is trial 42 with value: 0.0287930838515238.
2026-05-15 05:34:31,309 - optuna.study._optimize - INFO - Trial 135 pruned. 
2026-05-15 05:34:35,027 - optuna.study._optimize - INFO - Trial 136 pruned. 
2026-05-15 05:34:38,998 - optuna.study._optimize - INFO - Trial 137 pruned. 
2026-05-15 05:34:43,071 - optuna.study._optimize - INFO - Trial 138 pruned. 
2026-05-15 05:34:46,893 - optuna.study._optimize - INFO - Trial 139 pruned. 
2026-05-15 05:35:25,791 - optuna.study.study - INFO - Trial 140 finished with value: 0.02432229551766303 and parameters: {'n_layers': 4, 'embedding_dim': 256, 'lr': 0.00931853812696229, 'lambda_val': 6.303369332301317e-05, 'batch_size': 3905, 'optimizer': 'RMSprop'}. Best is trial 42 with value: 0.0287930838515238.
2026-05-15 05:35:55,709 - optuna.study.study - INFO - Trial 141 finished with value: 0.020953318287491404 and parameters: {'n_layers': 4, 'embedding_dim': 96, 'lr': 0.010498954498615199, 'lambda_val': 2.8948968769789142e-05, 'batch_size': 3801, 'optimizer': 'RMSprop'}. Best is trial 42 with value: 0.0287930838515238.
2026-05-15 05:36:25,615 - optuna.study.study - INFO - Trial 142 finished with value: 0.023764687883619087 and parameters: {'n_layers': 4, 'embedding_dim': 96, 'lr': 0.01156914121035496, 'lambda_val': 4.921764017717612e-05, 'batch_size': 3674, 'optimizer': 'RMSprop'}. Best is trial 42 with value: 0.0287930838515238.
2026-05-15 05:36:29,894 - optuna.study._optimize - INFO - Trial 143 pruned. 
2026-05-15 05:37:00,362 - optuna.study.study - INFO - Trial 144 finished with value: 0.02672253334270575 and parameters: {'n_layers': 4, 'embedding_dim': 96, 'lr': 0.016030159172628723, 'lambda_val': 0.00010787084662674956, 'batch_size': 3972, 'optimizer': 'RMSprop'}. Best is trial 42 with value: 0.0287930838515238.
2026-05-15 05:37:32,442 - optuna.study.study - INFO - Trial 145 finished with value: 0.025560325025905092 and parameters: {'n_layers': 4, 'embedding_dim': 96, 'lr': 0.014393978710516741, 'lambda_val': 0.00012058189937125331, 'batch_size': 3996, 'optimizer': 'RMSprop'}. Best is trial 42 with value: 0.0287930838515238.
2026-05-15 05:37:36,318 - optuna.study._optimize - INFO - Trial 146 pruned. 
2026-05-15 05:37:40,765 - optuna.study._optimize - INFO - Trial 147 pruned. 
2026-05-15 05:37:44,991 - optuna.study._optimize - INFO - Trial 148 pruned. 
2026-05-15 05:37:49,637 - optuna.study._optimize - INFO - Trial 149 pruned. 
2026-05-15 05:37:53,746 - optuna.study._optimize - INFO - Trial 150 pruned. 
2026-05-15 05:38:24,311 - optuna.study.study - INFO - Trial 151 finished with value: 0.025830765255556852 and parameters: {'n_layers': 4, 'embedding_dim': 96, 'lr': 0.009956554291477718, 'lambda_val': 3.983552017605752e-05, 'batch_size': 3592, 'optimizer': 'RMSprop'}. Best is trial 42 with value: 0.0287930838515238.
2026-05-15 05:38:28,268 - optuna.study._optimize - INFO - Trial 152 pruned. 
2026-05-15 05:39:00,517 - optuna.study.study - INFO - Trial 153 finished with value: 0.027912958931581293 and parameters: {'n_layers': 4, 'embedding_dim': 96, 'lr': 0.00933142308209736, 'lambda_val': 6.761755420567838e-05, 'batch_size': 3574, 'optimizer': 'RMSprop'}. Best is trial 42 with value: 0.0287930838515238.
2026-05-15 05:39:04,342 - optuna.study._optimize - INFO - Trial 154 pruned. 
2026-05-15 05:39:34,848 - optuna.study.study - INFO - Trial 155 finished with value: 0.025845823136607243 and parameters: {'n_layers': 4, 'embedding_dim': 96, 'lr': 0.010389581609879905, 'lambda_val': 7.102131095066098e-05, 'batch_size': 3620, 'optimizer': 'RMSprop'}. Best is trial 42 with value: 0.0287930838515238.
2026-05-15 05:39:39,636 - optuna.study._optimize - INFO - Trial 156 pruned. 
2026-05-15 05:39:44,204 - optuna.study._optimize - INFO - Trial 157 pruned. 
2026-05-15 05:40:16,865 - optuna.study.study - INFO - Trial 158 finished with value: 0.022330086222684946 and parameters: {'n_layers': 4, 'embedding_dim': 96, 'lr': 0.01035223984055608, 'lambda_val': 2.800956167440212e-05, 'batch_size': 3436, 'optimizer': 'RMSprop'}. Best is trial 42 with value: 0.0287930838515238.
2026-05-15 05:40:21,045 - optuna.study._optimize - INFO - Trial 159 pruned. 
2026-05-15 05:40:24,829 - optuna.study._optimize - INFO - Trial 160 pruned. 
2026-05-15 05:40:28,691 - optuna.study._optimize - INFO - Trial 161 pruned. 
2026-05-15 05:40:33,021 - optuna.study._optimize - INFO - Trial 162 pruned. 
2026-05-15 05:40:36,830 - optuna.study._optimize - INFO - Trial 163 pruned. 
2026-05-15 05:40:41,279 - optuna.study._optimize - INFO - Trial 164 pruned. 
2026-05-15 05:40:45,985 - optuna.study._optimize - INFO - Trial 165 pruned. 
2026-05-15 05:41:17,663 - optuna.study.study - INFO - Trial 166 finished with value: 0.02419629533726047 and parameters: {'n_layers': 4, 'embedding_dim': 96, 'lr': 0.010746382181625552, 'lambda_val': 3.6940877096187335e-05, 'batch_size': 3498, 'optimizer': 'RMSprop'}. Best is trial 42 with value: 0.0287930838515238.
2026-05-15 05:41:21,726 - optuna.study._optimize - INFO - Trial 167 pruned. 
2026-05-15 05:41:25,665 - optuna.study._optimize - INFO - Trial 168 pruned. 
2026-05-15 05:41:30,393 - optuna.study._optimize - INFO - Trial 169 pruned. 
2026-05-15 05:42:04,711 - optuna.study.study - INFO - Trial 170 finished with value: 0.02642237851876493 and parameters: {'n_layers': 4, 'embedding_dim': 96, 'lr': 0.029600379259852583, 'lambda_val': 9.453206558733283e-05, 'batch_size': 3396, 'optimizer': 'RMSprop'}. Best is trial 42 with value: 0.0287930838515238.
2026-05-15 05:42:36,566 - optuna.study.study - INFO - Trial 171 finished with value: 0.026506496893601565 and parameters: {'n_layers': 4, 'embedding_dim': 96, 'lr': 0.030668950388861374, 'lambda_val': 0.00010460539665005234, 'batch_size': 3398, 'optimizer': 'RMSprop'}. Best is trial 42 with value: 0.0287930838515238.
2026-05-15 05:42:40,806 - optuna.study._optimize - INFO - Trial 172 pruned. 
2026-05-15 05:42:45,325 - optuna.study._optimize - INFO - Trial 173 pruned. 
2026-05-15 05:42:51,203 - optuna.study._optimize - INFO - Trial 174 pruned. 
2026-05-15 05:42:59,270 - optuna.study._optimize - INFO - Trial 175 pruned. 
2026-05-15 05:43:03,888 - optuna.study._optimize - INFO - Trial 176 pruned. 
2026-05-15 05:43:08,307 - optuna.study._optimize - INFO - Trial 177 pruned. 
2026-05-15 05:43:12,168 - optuna.study._optimize - INFO - Trial 178 pruned. 
2026-05-15 05:43:16,169 - optuna.study._optimize - INFO - Trial 179 pruned. 
2026-05-15 05:43:47,729 - optuna.study.study - INFO - Trial 180 finished with value: 0.021368848451172307 and parameters: {'n_layers': 4, 'embedding_dim': 96, 'lr': 0.01760264496739415, 'lambda_val': 3.0243775753016307e-05, 'batch_size': 3125, 'optimizer': 'RMSprop'}. Best is trial 42 with value: 0.0287930838515238.
2026-05-15 05:43:54,743 - optuna.study._optimize - INFO - Trial 181 pruned. 
2026-05-15 05:44:27,408 - optuna.study.study - INFO - Trial 182 finished with value: 0.026348048253118102 and parameters: {'n_layers': 4, 'embedding_dim': 96, 'lr': 0.010971369796859445, 'lambda_val': 7.765673860046122e-05, 'batch_size': 3704, 'optimizer': 'RMSprop'}. Best is trial 42 with value: 0.0287930838515238.
2026-05-15 05:44:31,802 - optuna.study._optimize - INFO - Trial 183 pruned. 
2026-05-15 05:44:35,745 - optuna.study._optimize - INFO - Trial 184 pruned. 
2026-05-15 05:44:48,545 - optuna.study._optimize - INFO - Trial 185 pruned. 
2026-05-15 05:44:54,833 - optuna.study._optimize - INFO - Trial 186 pruned. 
2026-05-15 05:44:59,111 - optuna.study._optimize - INFO - Trial 187 pruned. 
2026-05-15 05:45:02,965 - optuna.study._optimize - INFO - Trial 188 pruned. 
2026-05-15 05:45:09,788 - optuna.study._optimize - INFO - Trial 189 pruned. 
2026-05-15 05:45:13,887 - optuna.study._optimize - INFO - Trial 190 pruned. 
2026-05-15 05:45:46,554 - optuna.study.study - INFO - Trial 191 finished with value: 0.027875311728327263 and parameters: {'n_layers': 4, 'embedding_dim': 96, 'lr': 0.012760111130139062, 'lambda_val': 9.998667071784201e-05, 'batch_size': 4013, 'optimizer': 'RMSprop'}. Best is trial 42 with value: 0.0287930838515238.
2026-05-15 05:45:50,396 - optuna.study._optimize - INFO - Trial 192 pruned. 
2026-05-15 05:45:54,675 - optuna.study._optimize - INFO - Trial 193 pruned. 
2026-05-15 05:46:26,410 - optuna.study.study - INFO - Trial 194 finished with value: 0.024814563724532553 and parameters: {'n_layers': 4, 'embedding_dim': 96, 'lr': 0.019904038361654178, 'lambda_val': 7.963455140120213e-05, 'batch_size': 4050, 'optimizer': 'RMSprop'}. Best is trial 42 with value: 0.0287930838515238.
2026-05-15 05:46:30,012 - optuna.study._optimize - INFO - Trial 195 pruned. 
2026-05-15 05:46:34,327 - optuna.study._optimize - INFO - Trial 196 pruned. 
2026-05-15 05:46:38,636 - optuna.study._optimize - INFO - Trial 197 pruned. 
2026-05-15 05:46:43,511 - optuna.study._optimize - INFO - Trial 198 pruned. 
2026-05-15 05:47:19,670 - optuna.study.study - INFO - Trial 199 finished with value: 0.025762083709056045 and parameters: {'n_layers': 4, 'embedding_dim': 96, 'lr': 0.015348821127687186, 'lambda_val': 8.888308912308326e-05, 'batch_size': 3841, 'optimizer': 'RMSprop'}. Best is trial 42 with value: 0.0287930838515238.
2026-05-15 05:47:51,590 - root - INFO -   ** Getting the trainable edges:
2026-05-15 05:47:51,595 - helper_functions - INFO -      Number of nodes: 547
2026-05-15 05:47:51,595 - helper_functions - INFO -      Ratio: 0.06036861273590111
2026-05-15 05:47:51,595 - helper_functions - INFO -      Number of unique users: 320
2026-05-15 05:47:51,595 - helper_functions - INFO -      Number of unique items: 227
2026-05-15 05:47:51,595 - helper_functions - INFO -      Total dominant set edge: 66391
2026-05-15 05:47:51,595 - helper_functions - INFO -      Trainable edges: 53112.8
2026-05-15 05:47:51,603 - root - INFO -   **** Getting 66391 dominant set edges
2026-05-15 05:47:52,755 - optuna.storages._rdb.storage - INFO - A new study created in RDB with name: Study_e_100K_1c1dcs
2026-05-15 05:48:51,507 - optuna.study.study - INFO - Trial 0 finished with value: 0.01504731794470007 and parameters: {'n_layers': 4, 'embedding_dim': 128, 'lr': 8.117862054025959e-05, 'lambda_val': 1.1253869971658308e-06, 'batch_size': 2088, 'optimizer': 'RMSprop'}. Best is trial 0 with value: 0.01504731794470007.
2026-05-15 05:49:44,209 - optuna.study.study - INFO - Trial 1 finished with value: 0.00493960781083622 and parameters: {'n_layers': 3, 'embedding_dim': 96, 'lr': 1.079667121439353e-05, 'lambda_val': 1.4383520123270266e-06, 'batch_size': 1061, 'optimizer': 'Adam'}. Best is trial 0 with value: 0.01504731794470007.
2026-05-15 05:50:19,432 - optuna.study.study - INFO - Trial 2 finished with value: 0.00122213797732412 and parameters: {'n_layers': 2, 'embedding_dim': 128, 'lr': 0.00017064629599367287, 'lambda_val': 0.03895097899605371, 'batch_size': 1746, 'optimizer': 'SGD'}. Best is trial 0 with value: 0.01504731794470007.
2026-05-15 05:50:45,874 - optuna.study.study - INFO - Trial 3 finished with value: 0.001715546560676835 and parameters: {'n_layers': 1, 'embedding_dim': 128, 'lr': 0.0005187345121617017, 'lambda_val': 3.580810594986037e-05, 'batch_size': 3126, 'optimizer': 'SGD'}. Best is trial 0 with value: 0.01504731794470007.
2026-05-15 05:51:45,388 - optuna.study.study - INFO - Trial 4 finished with value: 0.010009099685643752 and parameters: {'n_layers': 4, 'embedding_dim': 256, 'lr': 0.0022597935920765557, 'lambda_val': 0.01767084705080306, 'batch_size': 1417, 'optimizer': 'RMSprop'}. Best is trial 0 with value: 0.01504731794470007.
2026-05-15 05:52:01,954 - optuna.study._optimize - INFO - Trial 5 pruned. 
2026-05-15 05:52:09,793 - optuna.study._optimize - INFO - Trial 6 pruned. 
2026-05-15 05:53:02,172 - optuna.study.study - INFO - Trial 7 finished with value: 0.051708280072714656 and parameters: {'n_layers': 1, 'embedding_dim': 64, 'lr': 0.00033934968380389314, 'lambda_val': 3.348790017251595e-05, 'batch_size': 2669, 'optimizer': 'RMSprop'}. Best is trial 7 with value: 0.051708280072714656.
2026-05-15 05:53:10,839 - optuna.study._optimize - INFO - Trial 8 pruned. 
2026-05-15 05:53:54,674 - optuna.study.study - INFO - Trial 9 finished with value: 0.037673119610006016 and parameters: {'n_layers': 1, 'embedding_dim': 64, 'lr': 0.04552014118187994, 'lambda_val': 7.307470437828412e-05, 'batch_size': 1254, 'optimizer': 'Adam'}. Best is trial 7 with value: 0.051708280072714656.
2026-05-15 05:54:29,487 - optuna.study.study - INFO - Trial 10 finished with value: 0.020667219115389233 and parameters: {'n_layers': 1, 'embedding_dim': 32, 'lr': 0.004107062588873061, 'lambda_val': 1.158438777422905e-05, 'batch_size': 2988, 'optimizer': 'RMSprop'}. Best is trial 7 with value: 0.051708280072714656.
2026-05-15 05:54:56,830 - optuna.study.study - INFO - Trial 11 finished with value: 0.04019993088620903 and parameters: {'n_layers': 1, 'embedding_dim': 64, 'lr': 0.02206230426956253, 'lambda_val': 5.6652779030288573e-05, 'batch_size': 592, 'optimizer': 'Adam'}. Best is trial 7 with value: 0.051708280072714656.
2026-05-15 05:55:00,692 - optuna.study._optimize - INFO - Trial 12 pruned. 
2026-05-15 05:55:30,841 - optuna.study.study - INFO - Trial 13 finished with value: 0.048371322537615724 and parameters: {'n_layers': 1, 'embedding_dim': 64, 'lr': 0.0007418611039227121, 'lambda_val': 0.00293593101555426, 'batch_size': 3873, 'optimizer': 'Adam'}. Best is trial 7 with value: 0.051708280072714656.
2026-05-15 05:56:00,947 - optuna.study.study - INFO - Trial 14 finished with value: 0.05007503743657962 and parameters: {'n_layers': 1, 'embedding_dim': 64, 'lr': 0.0004426125075563598, 'lambda_val': 0.002438529461058461, 'batch_size': 3951, 'optimizer': 'RMSprop'}. Best is trial 7 with value: 0.051708280072714656.
2026-05-15 05:56:49,013 - optuna.study.study - INFO - Trial 15 finished with value: 0.02905194925124002 and parameters: {'n_layers': 2, 'embedding_dim': 256, 'lr': 0.00022541926211006236, 'lambda_val': 0.0030262898209564362, 'batch_size': 3997, 'optimizer': 'RMSprop'}. Best is trial 7 with value: 0.051708280072714656.
2026-05-15 05:57:19,411 - optuna.study.study - INFO - Trial 16 finished with value: 0.035516483245908184 and parameters: {'n_layers': 1, 'embedding_dim': 32, 'lr': 0.0015404396382163645, 'lambda_val': 0.0001933392044921589, 'batch_size': 2792, 'optimizer': 'RMSprop'}. Best is trial 7 with value: 0.051708280072714656.
2026-05-15 05:57:23,608 - optuna.study._optimize - INFO - Trial 17 pruned. 
2026-05-15 05:57:52,570 - optuna.study.study - INFO - Trial 18 finished with value: 0.049795513828061445 and parameters: {'n_layers': 1, 'embedding_dim': 64, 'lr': 0.0003409716041629152, 'lambda_val': 0.0002075307226159012, 'batch_size': 3551, 'optimizer': 'RMSprop'}. Best is trial 7 with value: 0.051708280072714656.
2026-05-15 05:57:56,594 - optuna.study._optimize - INFO - Trial 19 pruned. 
2026-05-15 05:58:26,088 - optuna.study.study - INFO - Trial 20 finished with value: 0.05033889438223414 and parameters: {'n_layers': 1, 'embedding_dim': 64, 'lr': 0.00015076878256939952, 'lambda_val': 0.009264031062766954, 'batch_size': 2512, 'optimizer': 'RMSprop'}. Best is trial 7 with value: 0.051708280072714656.
2026-05-15 05:58:29,680 - optuna.study._optimize - INFO - Trial 21 pruned. 
2026-05-15 05:59:02,203 - optuna.study.study - INFO - Trial 22 finished with value: 0.0601172269488754 and parameters: {'n_layers': 1, 'embedding_dim': 64, 'lr': 0.000133257859425539, 'lambda_val': 0.0014407469119998217, 'batch_size': 3184, 'optimizer': 'RMSprop'}. Best is trial 22 with value: 0.0601172269488754.
2026-05-15 05:59:34,130 - optuna.study.study - INFO - Trial 23 finished with value: 0.057790056354347974 and parameters: {'n_layers': 1, 'embedding_dim': 64, 'lr': 0.00011033277362056594, 'lambda_val': 0.0005583802228702515, 'batch_size': 3151, 'optimizer': 'RMSprop'}. Best is trial 22 with value: 0.0601172269488754.
2026-05-15 05:59:38,969 - optuna.study._optimize - INFO - Trial 24 pruned. 
2026-05-15 06:00:16,704 - optuna.study.study - INFO - Trial 25 finished with value: 0.08080075086879152 and parameters: {'n_layers': 1, 'embedding_dim': 256, 'lr': 0.00011006559219945043, 'lambda_val': 0.00015909509291681088, 'batch_size': 2904, 'optimizer': 'RMSprop'}. Best is trial 25 with value: 0.08080075086879152.
2026-05-15 06:00:22,280 - optuna.study._optimize - INFO - Trial 26 pruned. 
2026-05-15 06:00:57,401 - optuna.study.study - INFO - Trial 27 finished with value: 0.07378262339003949 and parameters: {'n_layers': 1, 'embedding_dim': 256, 'lr': 0.0001230850357180827, 'lambda_val': 0.0001356631755655665, 'batch_size': 3605, 'optimizer': 'RMSprop'}. Best is trial 25 with value: 0.08080075086879152.
2026-05-15 06:01:09,318 - optuna.study._optimize - INFO - Trial 28 pruned. 
2026-05-15 06:01:19,034 - optuna.study._optimize - INFO - Trial 29 pruned. 
