2026-05-15 09:09:19,762 - optuna.study.study - INFO - Trial 135 finished with value: 0.0678023082157062 and parameters: {'n_layers': 1, 'embedding_dim': 256, 'lr': 0.010170400924706936, 'lambda_val': 0.0002822110328052698, 'batch_size': 2607, 'optimizer': 'RMSprop'}. Best is trial 127 with value: 0.07541528397874628.
2026-05-15 09:09:24,300 - optuna.study._optimize - INFO - Trial 136 pruned. 
2026-05-15 09:09:28,066 - optuna.study._optimize - INFO - Trial 137 pruned. 
2026-05-15 09:10:02,751 - optuna.study.study - INFO - Trial 138 finished with value: 0.07635289840784933 and parameters: {'n_layers': 1, 'embedding_dim': 256, 'lr': 0.011993639455528905, 'lambda_val': 0.0005273274752567814, 'batch_size': 2983, 'optimizer': 'RMSprop'}. Best is trial 138 with value: 0.07635289840784933.
2026-05-15 09:10:06,748 - optuna.study._optimize - INFO - Trial 139 pruned. 
2026-05-15 09:10:10,757 - optuna.study._optimize - INFO - Trial 140 pruned. 
2026-05-15 09:10:44,853 - optuna.study.study - INFO - Trial 141 finished with value: 0.06778859765653693 and parameters: {'n_layers': 1, 'embedding_dim': 256, 'lr': 0.010078630436126917, 'lambda_val': 0.0005289833957117619, 'batch_size': 2994, 'optimizer': 'RMSprop'}. Best is trial 138 with value: 0.07635289840784933.
2026-05-15 09:11:19,259 - optuna.study.study - INFO - Trial 142 finished with value: 0.0680770684609599 and parameters: {'n_layers': 1, 'embedding_dim': 256, 'lr': 0.005743500934229247, 'lambda_val': 0.00033098006282288137, 'batch_size': 2813, 'optimizer': 'RMSprop'}. Best is trial 138 with value: 0.07635289840784933.
2026-05-15 09:11:23,543 - optuna.study._optimize - INFO - Trial 143 pruned. 
2026-05-15 09:11:58,998 - optuna.study.study - INFO - Trial 144 finished with value: 0.07127769034224304 and parameters: {'n_layers': 1, 'embedding_dim': 256, 'lr': 0.007569119545769129, 'lambda_val': 0.000713826177968776, 'batch_size': 3090, 'optimizer': 'RMSprop'}. Best is trial 138 with value: 0.07635289840784933.
2026-05-15 09:12:34,806 - optuna.study.study - INFO - Trial 145 finished with value: 0.06914615668261286 and parameters: {'n_layers': 1, 'embedding_dim': 256, 'lr': 0.007222337083418334, 'lambda_val': 0.0006756292768090902, 'batch_size': 3061, 'optimizer': 'RMSprop'}. Best is trial 138 with value: 0.07635289840784933.
2026-05-15 09:13:10,093 - optuna.study.study - INFO - Trial 146 finished with value: 0.06854438862772659 and parameters: {'n_layers': 1, 'embedding_dim': 256, 'lr': 0.014434350863313886, 'lambda_val': 0.0008039462147168385, 'batch_size': 3127, 'optimizer': 'RMSprop'}. Best is trial 138 with value: 0.07635289840784933.
2026-05-15 09:13:13,685 - optuna.study._optimize - INFO - Trial 147 pruned. 
2026-05-15 09:13:48,734 - optuna.study.study - INFO - Trial 148 finished with value: 0.06373644548772323 and parameters: {'n_layers': 1, 'embedding_dim': 256, 'lr': 0.004257201642920393, 'lambda_val': 0.001533101895414928, 'batch_size': 2712, 'optimizer': 'RMSprop'}. Best is trial 138 with value: 0.07635289840784933.
2026-05-15 09:13:54,845 - optuna.study._optimize - INFO - Trial 149 pruned. 
2026-05-15 09:14:40,731 - optuna.study.study - INFO - Trial 150 finished with value: 0.06609043667979027 and parameters: {'n_layers': 1, 'embedding_dim': 256, 'lr': 0.0032790157839991635, 'lambda_val': 0.0005690142047779474, 'batch_size': 2659, 'optimizer': 'RMSprop'}. Best is trial 138 with value: 0.07635289840784933.
2026-05-15 09:14:45,446 - optuna.study._optimize - INFO - Trial 151 pruned. 
2026-05-15 09:15:19,710 - optuna.study.study - INFO - Trial 152 finished with value: 0.07063968804585595 and parameters: {'n_layers': 1, 'embedding_dim': 256, 'lr': 0.008056006268553191, 'lambda_val': 0.0011539926182857496, 'batch_size': 2838, 'optimizer': 'RMSprop'}. Best is trial 138 with value: 0.07635289840784933.
2026-05-15 09:15:54,696 - optuna.study.study - INFO - Trial 153 finished with value: 0.07055996909121702 and parameters: {'n_layers': 1, 'embedding_dim': 256, 'lr': 0.006351266643956989, 'lambda_val': 0.0012055927255144718, 'batch_size': 2863, 'optimizer': 'RMSprop'}. Best is trial 138 with value: 0.07635289840784933.
2026-05-15 09:16:29,516 - optuna.study.study - INFO - Trial 154 finished with value: 0.0690362495241523 and parameters: {'n_layers': 1, 'embedding_dim': 256, 'lr': 0.006004788074247307, 'lambda_val': 0.0010948209301943335, 'batch_size': 2923, 'optimizer': 'RMSprop'}. Best is trial 138 with value: 0.07635289840784933.
2026-05-15 09:17:04,135 - optuna.study.study - INFO - Trial 155 finished with value: 0.06913515433539097 and parameters: {'n_layers': 1, 'embedding_dim': 256, 'lr': 0.006979088825755725, 'lambda_val': 0.0008330450729495606, 'batch_size': 2851, 'optimizer': 'RMSprop'}. Best is trial 138 with value: 0.07635289840784933.
2026-05-15 09:17:31,134 - optuna.study._optimize - INFO - Trial 156 pruned. 
2026-05-15 09:18:06,115 - optuna.study.study - INFO - Trial 157 finished with value: 0.0689933011206212 and parameters: {'n_layers': 1, 'embedding_dim': 256, 'lr': 0.00789671918633075, 'lambda_val': 0.0012705771892025013, 'batch_size': 3084, 'optimizer': 'RMSprop'}. Best is trial 138 with value: 0.07635289840784933.
2026-05-15 09:18:17,896 - optuna.study._optimize - INFO - Trial 158 pruned. 
2026-05-15 09:18:24,885 - optuna.study._optimize - INFO - Trial 159 pruned. 
2026-05-15 09:18:29,271 - optuna.study._optimize - INFO - Trial 160 pruned. 
2026-05-15 09:18:34,123 - optuna.study._optimize - INFO - Trial 161 pruned. 
2026-05-15 09:19:08,343 - optuna.study.study - INFO - Trial 162 finished with value: 0.07493865452349091 and parameters: {'n_layers': 1, 'embedding_dim': 256, 'lr': 0.01159872626752958, 'lambda_val': 0.0006235806546014209, 'batch_size': 2795, 'optimizer': 'RMSprop'}. Best is trial 138 with value: 0.07635289840784933.
2026-05-15 09:19:43,400 - optuna.study.study - INFO - Trial 163 finished with value: 0.07024955728030252 and parameters: {'n_layers': 1, 'embedding_dim': 256, 'lr': 0.009897029487369109, 'lambda_val': 0.0006074183566510483, 'batch_size': 2617, 'optimizer': 'RMSprop'}. Best is trial 138 with value: 0.07635289840784933.
2026-05-15 09:20:18,716 - optuna.study.study - INFO - Trial 164 finished with value: 0.07271434472323286 and parameters: {'n_layers': 1, 'embedding_dim': 256, 'lr': 0.01184721623679432, 'lambda_val': 0.0008120813888544422, 'batch_size': 2915, 'optimizer': 'RMSprop'}. Best is trial 138 with value: 0.07635289840784933.
2026-05-15 09:20:25,784 - optuna.study._optimize - INFO - Trial 165 pruned. 
2026-05-15 09:20:30,103 - optuna.study._optimize - INFO - Trial 166 pruned. 
2026-05-15 09:21:07,444 - optuna.study.study - INFO - Trial 167 finished with value: 0.07013644925935891 and parameters: {'n_layers': 1, 'embedding_dim': 256, 'lr': 0.007943659219247163, 'lambda_val': 0.0005918858051902889, 'batch_size': 2741, 'optimizer': 'RMSprop'}. Best is trial 138 with value: 0.07635289840784933.
2026-05-15 09:21:11,673 - optuna.study._optimize - INFO - Trial 168 pruned. 
2026-05-15 09:21:15,815 - optuna.study._optimize - INFO - Trial 169 pruned. 
2026-05-15 09:21:51,222 - optuna.study.study - INFO - Trial 170 finished with value: 0.07691083293442355 and parameters: {'n_layers': 1, 'embedding_dim': 256, 'lr': 0.008806098197844902, 'lambda_val': 0.0003109121965881589, 'batch_size': 2984, 'optimizer': 'RMSprop'}. Best is trial 170 with value: 0.07691083293442355.
2026-05-15 09:21:55,297 - optuna.study._optimize - INFO - Trial 171 pruned. 
2026-05-15 09:22:29,174 - optuna.study.study - INFO - Trial 172 finished with value: 0.0765519021741374 and parameters: {'n_layers': 1, 'embedding_dim': 256, 'lr': 0.007963336866120161, 'lambda_val': 0.0005403618163119506, 'batch_size': 3070, 'optimizer': 'RMSprop'}. Best is trial 170 with value: 0.07691083293442355.
2026-05-15 09:23:04,560 - optuna.study.study - INFO - Trial 173 finished with value: 0.07189640730154309 and parameters: {'n_layers': 1, 'embedding_dim': 256, 'lr': 0.013660507887391142, 'lambda_val': 0.00047196487846364174, 'batch_size': 3190, 'optimizer': 'RMSprop'}. Best is trial 170 with value: 0.07691083293442355.
2026-05-15 09:23:39,663 - optuna.study.study - INFO - Trial 174 finished with value: 0.06795856844177674 and parameters: {'n_layers': 1, 'embedding_dim': 256, 'lr': 0.013909426860648864, 'lambda_val': 0.0005098307833523991, 'batch_size': 3193, 'optimizer': 'RMSprop'}. Best is trial 170 with value: 0.07691083293442355.
2026-05-15 09:23:45,804 - optuna.study._optimize - INFO - Trial 175 pruned. 
2026-05-15 09:24:21,712 - optuna.study.study - INFO - Trial 176 finished with value: 0.0705758583144185 and parameters: {'n_layers': 1, 'embedding_dim': 256, 'lr': 0.0069952803103225806, 'lambda_val': 0.0007984952736303179, 'batch_size': 3241, 'optimizer': 'RMSprop'}. Best is trial 170 with value: 0.07691083293442355.
2026-05-15 09:24:32,790 - optuna.study._optimize - INFO - Trial 177 pruned. 
2026-05-15 09:25:07,794 - optuna.study.study - INFO - Trial 178 finished with value: 0.07437900993667769 and parameters: {'n_layers': 1, 'embedding_dim': 256, 'lr': 0.008746606533579495, 'lambda_val': 0.00040952190416855636, 'batch_size': 3060, 'optimizer': 'RMSprop'}. Best is trial 170 with value: 0.07691083293442355.
2026-05-15 09:25:12,285 - optuna.study._optimize - INFO - Trial 179 pruned. 
2026-05-15 09:25:16,854 - optuna.study._optimize - INFO - Trial 180 pruned. 
2026-05-15 09:25:21,564 - optuna.study._optimize - INFO - Trial 181 pruned. 
2026-05-15 09:25:57,249 - optuna.study.study - INFO - Trial 182 finished with value: 0.07152597713245389 and parameters: {'n_layers': 1, 'embedding_dim': 256, 'lr': 0.010992860656866334, 'lambda_val': 0.0006189829772188553, 'batch_size': 3013, 'optimizer': 'RMSprop'}. Best is trial 170 with value: 0.07691083293442355.
2026-05-15 09:26:01,587 - optuna.study._optimize - INFO - Trial 183 pruned. 
2026-05-15 09:26:36,701 - optuna.study.study - INFO - Trial 184 finished with value: 0.07466253377217393 and parameters: {'n_layers': 1, 'embedding_dim': 256, 'lr': 0.014674117864440213, 'lambda_val': 0.0005521127417798524, 'batch_size': 3480, 'optimizer': 'RMSprop'}. Best is trial 170 with value: 0.07691083293442355.
2026-05-15 09:26:41,471 - optuna.study._optimize - INFO - Trial 185 pruned. 
2026-05-15 09:26:45,845 - optuna.study._optimize - INFO - Trial 186 pruned. 
2026-05-15 09:26:59,799 - optuna.study._optimize - INFO - Trial 187 pruned. 
2026-05-15 09:27:35,651 - optuna.study.study - INFO - Trial 188 finished with value: 0.07656971680255314 and parameters: {'n_layers': 1, 'embedding_dim': 256, 'lr': 0.009389815057415561, 'lambda_val': 0.0005686927472661669, 'batch_size': 3192, 'optimizer': 'RMSprop'}. Best is trial 170 with value: 0.07691083293442355.
2026-05-15 09:27:39,999 - optuna.study._optimize - INFO - Trial 189 pruned. 
2026-05-15 09:27:44,350 - optuna.study._optimize - INFO - Trial 190 pruned. 
2026-05-15 09:28:19,607 - optuna.study.study - INFO - Trial 191 finished with value: 0.04557808753976549 and parameters: {'n_layers': 1, 'embedding_dim': 256, 'lr': 0.0005340048520053919, 'lambda_val': 0.0005868789991548307, 'batch_size': 3220, 'optimizer': 'RMSprop'}. Best is trial 170 with value: 0.07691083293442355.
2026-05-15 09:28:55,571 - optuna.study.study - INFO - Trial 192 finished with value: 0.07740376136571693 and parameters: {'n_layers': 1, 'embedding_dim': 256, 'lr': 0.013836294474971499, 'lambda_val': 0.0004531339956068042, 'batch_size': 3476, 'optimizer': 'RMSprop'}. Best is trial 192 with value: 0.07740376136571693.
2026-05-15 09:28:59,975 - optuna.study._optimize - INFO - Trial 193 pruned. 
2026-05-15 09:29:35,854 - optuna.study.study - INFO - Trial 194 finished with value: 0.0747284973762219 and parameters: {'n_layers': 1, 'embedding_dim': 256, 'lr': 0.009774729066230118, 'lambda_val': 0.000791780003022177, 'batch_size': 2965, 'optimizer': 'RMSprop'}. Best is trial 192 with value: 0.07740376136571693.
2026-05-15 09:29:40,333 - optuna.study._optimize - INFO - Trial 195 pruned. 
2026-05-15 09:29:44,859 - optuna.study._optimize - INFO - Trial 196 pruned. 
2026-05-15 09:29:49,122 - optuna.study._optimize - INFO - Trial 197 pruned. 
2026-05-15 09:29:53,440 - optuna.study._optimize - INFO - Trial 198 pruned. 
2026-05-15 09:30:00,479 - optuna.study._optimize - INFO - Trial 199 pruned. 
2026-05-15 09:30:30,098 - root - INFO - **** Training e_100K_1c3dcs
2026-05-15 09:30:30,098 - root - INFO -   ** 3-Dominant stats:
2026-05-15 09:30:30,098 - root - INFO -   ** Finding the dominant set:
2026-05-15 09:30:50,146 - root - INFO -   ** Getting the trainable edges:
2026-05-15 09:30:50,152 - helper_functions - INFO -      Number of nodes: 4883
2026-05-15 09:30:50,152 - helper_functions - INFO -      Ratio: 0.5389029908398631
2026-05-15 09:30:50,152 - helper_functions - INFO -      Number of unique users: 343
2026-05-15 09:30:50,152 - helper_functions - INFO -      Number of unique items: 4540
2026-05-15 09:30:50,152 - helper_functions - INFO -      Total dominant set edge: 15830
2026-05-15 09:30:50,152 - helper_functions - INFO -      Trainable edges: 12664.0
2026-05-15 09:30:50,155 - root - INFO -   **** Getting 15830 dominant set edges
2026-05-15 09:30:51,168 - optuna.storages._rdb.storage - INFO - A new study created in RDB with name: Study_e_100K_1c3dcs_strict
2026-05-15 09:31:38,014 - optuna.study.study - INFO - Trial 0 finished with value: 0.006342825421923408 and parameters: {'n_layers': 3, 'embedding_dim': 96, 'lr': 0.026250588475002442, 'lambda_val': 5.446257482603423e-05, 'batch_size': 1458, 'optimizer': 'Adam'}. Best is trial 0 with value: 0.006342825421923408.
2026-05-15 09:32:29,572 - optuna.study.study - INFO - Trial 1 finished with value: 0.004983481383375753 and parameters: {'n_layers': 4, 'embedding_dim': 96, 'lr': 0.03268913924335081, 'lambda_val': 1.021680185435239e-06, 'batch_size': 3749, 'optimizer': 'Adam'}. Best is trial 0 with value: 0.006342825421923408.
2026-05-15 09:32:57,210 - optuna.study.study - INFO - Trial 2 finished with value: 0.0014833414758829314 and parameters: {'n_layers': 1, 'embedding_dim': 32, 'lr': 1.4586473030622365e-05, 'lambda_val': 0.06065435028251536, 'batch_size': 4022, 'optimizer': 'RMSprop'}. Best is trial 0 with value: 0.006342825421923408.
2026-05-15 09:33:25,163 - optuna.study.study - INFO - Trial 3 finished with value: 0.002346761072464143 and parameters: {'n_layers': 3, 'embedding_dim': 64, 'lr': 0.002374369779673477, 'lambda_val': 0.00020621855804954886, 'batch_size': 957, 'optimizer': 'SGD'}. Best is trial 0 with value: 0.006342825421923408.
2026-05-15 09:34:09,867 - optuna.study.study - INFO - Trial 4 finished with value: 0.005322459777306927 and parameters: {'n_layers': 3, 'embedding_dim': 128, 'lr': 0.009654376934631923, 'lambda_val': 6.147252060644959e-05, 'batch_size': 1665, 'optimizer': 'RMSprop'}. Best is trial 0 with value: 0.006342825421923408.
2026-05-15 09:34:13,510 - optuna.study._optimize - INFO - Trial 5 pruned. 
2026-05-15 09:34:17,883 - optuna.study._optimize - INFO - Trial 6 pruned. 
2026-05-15 09:34:22,699 - optuna.study._optimize - INFO - Trial 7 pruned. 
2026-05-15 09:34:26,672 - optuna.study._optimize - INFO - Trial 8 pruned. 
2026-05-15 09:34:56,658 - optuna.study.study - INFO - Trial 9 finished with value: 0.019661945647404273 and parameters: {'n_layers': 3, 'embedding_dim': 96, 'lr': 7.119536139926732e-05, 'lambda_val': 0.0002905210808736128, 'batch_size': 1811, 'optimizer': 'RMSprop'}. Best is trial 9 with value: 0.019661945647404273.
2026-05-15 09:35:24,632 - optuna.study.study - INFO - Trial 10 finished with value: 0.006489755596794031 and parameters: {'n_layers': 1, 'embedding_dim': 96, 'lr': 0.00017971136979907717, 'lambda_val': 0.005353986928723986, 'batch_size': 2517, 'optimizer': 'RMSprop'}. Best is trial 9 with value: 0.019661945647404273.
2026-05-15 09:35:52,541 - optuna.study.study - INFO - Trial 11 finished with value: 0.007472681857877953 and parameters: {'n_layers': 1, 'embedding_dim': 96, 'lr': 0.00023527441045302473, 'lambda_val': 0.0023310205189949564, 'batch_size': 2617, 'optimizer': 'RMSprop'}. Best is trial 9 with value: 0.019661945647404273.
2026-05-15 09:36:21,831 - optuna.study.study - INFO - Trial 12 finished with value: 0.003549489039042224 and parameters: {'n_layers': 2, 'embedding_dim': 96, 'lr': 0.00034708577182834436, 'lambda_val': 0.002723139703855603, 'batch_size': 2590, 'optimizer': 'RMSprop'}. Best is trial 9 with value: 0.019661945647404273.
2026-05-15 09:36:25,606 - optuna.study._optimize - INFO - Trial 13 pruned. 
2026-05-15 09:36:57,220 - optuna.study.study - INFO - Trial 14 finished with value: 0.017222407361254972 and parameters: {'n_layers': 1, 'embedding_dim': 256, 'lr': 3.976340785320041e-05, 'lambda_val': 0.006096725098169076, 'batch_size': 3125, 'optimizer': 'RMSprop'}. Best is trial 9 with value: 0.019661945647404273.
2026-05-15 09:37:33,963 - optuna.study.study - INFO - Trial 15 finished with value: 0.004450195235809358 and parameters: {'n_layers': 2, 'embedding_dim': 256, 'lr': 4.139738141010479e-05, 'lambda_val': 0.013543043709417116, 'batch_size': 3205, 'optimizer': 'Adam'}. Best is trial 9 with value: 0.019661945647404273.
2026-05-15 09:37:39,794 - optuna.study._optimize - INFO - Trial 16 pruned. 
2026-05-15 09:38:07,098 - optuna.study.study - INFO - Trial 17 finished with value: 0.011170463810881878 and parameters: {'n_layers': 1, 'embedding_dim': 128, 'lr': 0.0006012930243752423, 'lambda_val': 0.000928804829232145, 'batch_size': 3080, 'optimizer': 'RMSprop'}. Best is trial 9 with value: 0.019661945647404273.
2026-05-15 09:38:41,523 - optuna.study.study - INFO - Trial 18 finished with value: 0.006855658762954261 and parameters: {'n_layers': 2, 'embedding_dim': 256, 'lr': 6.697927527298272e-05, 'lambda_val': 0.00910439925618589, 'batch_size': 2106, 'optimizer': 'RMSprop'}. Best is trial 9 with value: 0.019661945647404273.
2026-05-15 09:38:46,825 - optuna.study._optimize - INFO - Trial 19 pruned. 
2026-05-15 09:39:14,526 - optuna.study.study - INFO - Trial 20 finished with value: 0.008862657272440786 and parameters: {'n_layers': 1, 'embedding_dim': 64, 'lr': 0.0001401634173126274, 'lambda_val': 0.0014535608673251494, 'batch_size': 2888, 'optimizer': 'RMSprop'}. Best is trial 9 with value: 0.019661945647404273.
2026-05-15 09:39:42,711 - optuna.study.study - INFO - Trial 21 finished with value: 0.010368502688004742 and parameters: {'n_layers': 1, 'embedding_dim': 128, 'lr': 0.0007185490833475131, 'lambda_val': 0.0005087063489776453, 'batch_size': 3089, 'optimizer': 'RMSprop'}. Best is trial 9 with value: 0.019661945647404273.
2026-05-15 09:40:09,714 - optuna.study.study - INFO - Trial 22 finished with value: 0.010955758737043944 and parameters: {'n_layers': 1, 'embedding_dim': 128, 'lr': 0.0005596935216421601, 'lambda_val': 0.0011411148092122564, 'batch_size': 3476, 'optimizer': 'RMSprop'}. Best is trial 9 with value: 0.019661945647404273.
2026-05-15 09:40:13,964 - optuna.study._optimize - INFO - Trial 23 pruned. 
2026-05-15 09:40:41,398 - optuna.study.study - INFO - Trial 24 finished with value: 0.021206044591707683 and parameters: {'n_layers': 1, 'embedding_dim': 128, 'lr': 8.362115207924443e-05, 'lambda_val': 0.00011043677453435291, 'batch_size': 2347, 'optimizer': 'RMSprop'}. Best is trial 24 with value: 0.021206044591707683.
2026-05-15 09:40:45,227 - optuna.study._optimize - INFO - Trial 25 pruned. 
2026-05-15 09:41:23,640 - optuna.study.study - INFO - Trial 26 finished with value: 0.005565895925592352 and parameters: {'n_layers': 3, 'embedding_dim': 256, 'lr': 0.00010434096295033322, 'lambda_val': 0.00010226898929581404, 'batch_size': 1676, 'optimizer': 'RMSprop'}. Best is trial 24 with value: 0.021206044591707683.
2026-05-15 09:41:49,616 - optuna.study.study - INFO - Trial 27 finished with value: 0.02385444583663265 and parameters: {'n_layers': 1, 'embedding_dim': 128, 'lr': 7.521040635419154e-05, 'lambda_val': 6.35266491119149e-06, 'batch_size': 1898, 'optimizer': 'RMSprop'}. Best is trial 27 with value: 0.02385444583663265.
2026-05-15 09:42:18,391 - optuna.study.study - INFO - Trial 28 finished with value: 0.007164225911482757 and parameters: {'n_layers': 2, 'embedding_dim': 128, 'lr': 9.127796248922034e-05, 'lambda_val': 6.109500000817519e-06, 'batch_size': 1321, 'optimizer': 'Adam'}. Best is trial 27 with value: 0.02385444583663265.
2026-05-15 09:42:22,498 - optuna.study._optimize - INFO - Trial 29 pruned. 
2026-05-15 09:42:48,683 - optuna.study.study - INFO - Trial 30 finished with value: 0.00822051588854057 and parameters: {'n_layers': 1, 'embedding_dim': 96, 'lr': 0.00032809200849147785, 'lambda_val': 1.9699021597626565e-06, 'batch_size': 1437, 'optimizer': 'Adam'}. Best is trial 27 with value: 0.02385444583663265.
2026-05-15 09:42:52,160 - optuna.study._optimize - INFO - Trial 31 pruned. 
2026-05-15 09:43:18,796 - optuna.study.study - INFO - Trial 32 finished with value: 0.030183700725021665 and parameters: {'n_layers': 1, 'embedding_dim': 96, 'lr': 7.275759371782818e-05, 'lambda_val': 1.4342378233360572e-05, 'batch_size': 2019, 'optimizer': 'RMSprop'}. Best is trial 32 with value: 0.030183700725021665.
2026-05-15 09:43:44,932 - optuna.study.study - INFO - Trial 33 finished with value: 0.030986598774959583 and parameters: {'n_layers': 1, 'embedding_dim': 96, 'lr': 7.873998647023453e-05, 'lambda_val': 1.1713347226808103e-05, 'batch_size': 1955, 'optimizer': 'RMSprop'}. Best is trial 33 with value: 0.030986598774959583.
2026-05-15 09:43:48,858 - optuna.study._optimize - INFO - Trial 34 pruned. 
2026-05-15 09:44:15,997 - optuna.study.study - INFO - Trial 35 finished with value: 0.01852898182167942 and parameters: {'n_layers': 1, 'embedding_dim': 96, 'lr': 0.00011647029740562648, 'lambda_val': 1.2606139198766114e-06, 'batch_size': 1981, 'optimizer': 'RMSprop'}. Best is trial 33 with value: 0.030986598774959583.
