2026-05-15 07:20:14,970 - optuna.study.study - INFO - Trial 71 finished with value: 0.01105443810911333 and parameters: {'n_layers': 1, 'embedding_dim': 256, 'lr': 0.005784721472596675, 'lambda_val': 0.000447309455323711, 'batch_size': 1655, 'optimizer': 'RMSprop'}. Best is trial 25 with value: 0.012002857631825513.
2026-05-15 07:20:44,018 - optuna.study.study - INFO - Trial 72 finished with value: 0.011049274841082465 and parameters: {'n_layers': 1, 'embedding_dim': 256, 'lr': 0.0005087184335477747, 'lambda_val': 0.0008127770379191223, 'batch_size': 2134, 'optimizer': 'RMSprop'}. Best is trial 25 with value: 0.012002857631825513.
2026-05-15 07:20:47,715 - optuna.study._optimize - INFO - Trial 73 pruned. 
2026-05-15 07:20:51,382 - optuna.study._optimize - INFO - Trial 74 pruned. 
2026-05-15 07:20:54,859 - optuna.study._optimize - INFO - Trial 75 pruned. 
2026-05-15 07:21:24,079 - optuna.study.study - INFO - Trial 76 finished with value: 0.011746485038487521 and parameters: {'n_layers': 1, 'embedding_dim': 256, 'lr': 0.0002974226844355777, 'lambda_val': 0.0009327648081774448, 'batch_size': 1503, 'optimizer': 'Adam'}. Best is trial 25 with value: 0.012002857631825513.
2026-05-15 07:21:53,883 - optuna.study.study - INFO - Trial 77 finished with value: 0.009255947908535312 and parameters: {'n_layers': 1, 'embedding_dim': 256, 'lr': 0.0003573912969334173, 'lambda_val': 0.0013153107534351338, 'batch_size': 1493, 'optimizer': 'Adam'}. Best is trial 25 with value: 0.012002857631825513.
2026-05-15 07:22:22,882 - optuna.study.study - INFO - Trial 78 finished with value: 0.00948699367887562 and parameters: {'n_layers': 1, 'embedding_dim': 256, 'lr': 0.0006798828047017385, 'lambda_val': 0.002214564251206407, 'batch_size': 1677, 'optimizer': 'Adam'}. Best is trial 25 with value: 0.012002857631825513.
2026-05-15 07:22:50,358 - optuna.study.study - INFO - Trial 79 finished with value: 0.0048535886531343225 and parameters: {'n_layers': 2, 'embedding_dim': 96, 'lr': 0.00014257335920352741, 'lambda_val': 0.0009444624781013782, 'batch_size': 1192, 'optimizer': 'Adam'}. Best is trial 25 with value: 0.012002857631825513.
2026-05-15 07:23:19,372 - optuna.study.study - INFO - Trial 80 finished with value: 0.010266232689988516 and parameters: {'n_layers': 1, 'embedding_dim': 256, 'lr': 0.00027998937965085634, 'lambda_val': 0.0007075359079027777, 'batch_size': 1352, 'optimizer': 'Adam'}. Best is trial 25 with value: 0.012002857631825513.
2026-05-15 07:23:51,797 - optuna.study.study - INFO - Trial 81 finished with value: 0.011037562336822033 and parameters: {'n_layers': 1, 'embedding_dim': 256, 'lr': 0.00022749467055333827, 'lambda_val': 0.0005199403048401674, 'batch_size': 1812, 'optimizer': 'Adam'}. Best is trial 25 with value: 0.012002857631825513.
2026-05-15 07:23:57,275 - optuna.study._optimize - INFO - Trial 82 pruned. 
2026-05-15 07:24:31,353 - optuna.study.study - INFO - Trial 83 finished with value: 0.01140915443743913 and parameters: {'n_layers': 1, 'embedding_dim': 256, 'lr': 0.003995168176619826, 'lambda_val': 0.000585738797410105, 'batch_size': 1563, 'optimizer': 'RMSprop'}. Best is trial 25 with value: 0.012002857631825513.
2026-05-15 07:25:00,175 - optuna.study.study - INFO - Trial 84 finished with value: 0.011206950119288467 and parameters: {'n_layers': 1, 'embedding_dim': 256, 'lr': 0.007353079113910168, 'lambda_val': 0.0002260718427927929, 'batch_size': 1931, 'optimizer': 'RMSprop'}. Best is trial 25 with value: 0.012002857631825513.
2026-05-15 07:25:03,730 - optuna.study._optimize - INFO - Trial 85 pruned. 
2026-05-15 07:25:07,396 - optuna.study._optimize - INFO - Trial 86 pruned. 
2026-05-15 07:25:34,407 - optuna.study.study - INFO - Trial 87 finished with value: 0.011169924320097023 and parameters: {'n_layers': 1, 'embedding_dim': 128, 'lr': 0.011413580367620456, 'lambda_val': 0.0009099951179012732, 'batch_size': 2277, 'optimizer': 'RMSprop'}. Best is trial 25 with value: 0.012002857631825513.
2026-05-15 07:26:03,735 - optuna.study.study - INFO - Trial 88 finished with value: 0.01205308773745135 and parameters: {'n_layers': 1, 'embedding_dim': 256, 'lr': 0.002782505603994606, 'lambda_val': 0.000486190625481531, 'batch_size': 1312, 'optimizer': 'Adam'}. Best is trial 88 with value: 0.01205308773745135.
2026-05-15 07:26:07,023 - optuna.study._optimize - INFO - Trial 89 pruned. 
2026-05-15 07:26:50,616 - optuna.study.study - INFO - Trial 90 finished with value: 0.010817011194329687 and parameters: {'n_layers': 1, 'embedding_dim': 256, 'lr': 0.0024572054199394617, 'lambda_val': 0.0011855523017857933, 'batch_size': 957, 'optimizer': 'Adam'}. Best is trial 88 with value: 0.01205308773745135.
2026-05-15 07:27:19,007 - optuna.study.study - INFO - Trial 91 finished with value: 0.01238839070890167 and parameters: {'n_layers': 1, 'embedding_dim': 256, 'lr': 0.005643152425914126, 'lambda_val': 0.0004607402886585242, 'batch_size': 1515, 'optimizer': 'Adam'}. Best is trial 91 with value: 0.01238839070890167.
2026-05-15 07:27:49,196 - optuna.study.study - INFO - Trial 92 finished with value: 0.01155353209170308 and parameters: {'n_layers': 1, 'embedding_dim': 256, 'lr': 0.005173045752623921, 'lambda_val': 0.000657452259607896, 'batch_size': 1456, 'optimizer': 'Adam'}. Best is trial 91 with value: 0.01238839070890167.
2026-05-15 07:28:18,716 - optuna.study.study - INFO - Trial 93 finished with value: 0.011538560324089444 and parameters: {'n_layers': 1, 'embedding_dim': 256, 'lr': 0.0051758154444795, 'lambda_val': 0.0007029398036843195, 'batch_size': 1065, 'optimizer': 'Adam'}. Best is trial 91 with value: 0.01238839070890167.
2026-05-15 07:28:45,472 - optuna.study.study - INFO - Trial 94 finished with value: 0.011193108722268044 and parameters: {'n_layers': 1, 'embedding_dim': 256, 'lr': 0.005290650436449978, 'lambda_val': 0.0006833627707939872, 'batch_size': 1304, 'optimizer': 'Adam'}. Best is trial 91 with value: 0.01238839070890167.
2026-05-15 07:28:48,772 - optuna.study._optimize - INFO - Trial 95 pruned. 
2026-05-15 07:29:17,571 - optuna.study.study - INFO - Trial 96 finished with value: 0.011030068097154679 and parameters: {'n_layers': 1, 'embedding_dim': 256, 'lr': 0.007632605134851345, 'lambda_val': 0.00043927691292606417, 'batch_size': 1056, 'optimizer': 'Adam'}. Best is trial 91 with value: 0.01238839070890167.
2026-05-15 07:29:25,231 - optuna.study._optimize - INFO - Trial 97 pruned. 
2026-05-15 07:29:31,467 - optuna.study._optimize - INFO - Trial 98 pruned. 
2026-05-15 07:30:00,222 - optuna.study.study - INFO - Trial 99 finished with value: 0.01029377405879548 and parameters: {'n_layers': 1, 'embedding_dim': 256, 'lr': 0.005025495898411814, 'lambda_val': 0.001999572102070915, 'batch_size': 1452, 'optimizer': 'Adam'}. Best is trial 91 with value: 0.01238839070890167.
2026-05-15 07:30:29,831 - optuna.study.study - INFO - Trial 100 finished with value: 0.011211971583388656 and parameters: {'n_layers': 1, 'embedding_dim': 96, 'lr': 0.002485670971065756, 'lambda_val': 6.614580122439588e-06, 'batch_size': 1246, 'optimizer': 'Adam'}. Best is trial 91 with value: 0.01238839070890167.
2026-05-15 07:30:59,527 - optuna.study.study - INFO - Trial 101 finished with value: 0.012396203807607354 and parameters: {'n_layers': 1, 'embedding_dim': 256, 'lr': 0.0036006716372118967, 'lambda_val': 0.00025051817030978426, 'batch_size': 1515, 'optimizer': 'Adam'}. Best is trial 101 with value: 0.012396203807607354.
2026-05-15 07:31:28,928 - optuna.study.study - INFO - Trial 102 finished with value: 0.011221057608677707 and parameters: {'n_layers': 1, 'embedding_dim': 256, 'lr': 0.003516712987129052, 'lambda_val': 0.0004047926342643526, 'batch_size': 1520, 'optimizer': 'Adam'}. Best is trial 101 with value: 0.012396203807607354.
2026-05-15 07:31:58,607 - optuna.study.study - INFO - Trial 103 finished with value: 0.009301700123574756 and parameters: {'n_layers': 1, 'embedding_dim': 256, 'lr': 0.004175002869209557, 'lambda_val': 0.00022110408161025102, 'batch_size': 1665, 'optimizer': 'Adam'}. Best is trial 101 with value: 0.012396203807607354.
2026-05-15 07:32:27,676 - optuna.study.study - INFO - Trial 104 finished with value: 0.011977240420504236 and parameters: {'n_layers': 1, 'embedding_dim': 256, 'lr': 0.0028474610807741126, 'lambda_val': 0.000644367861920653, 'batch_size': 1413, 'optimizer': 'Adam'}. Best is trial 101 with value: 0.012396203807607354.
2026-05-15 07:33:03,069 - optuna.study.study - INFO - Trial 105 finished with value: 0.011704180307654702 and parameters: {'n_layers': 1, 'embedding_dim': 256, 'lr': 0.002751820564516123, 'lambda_val': 0.000700450255603479, 'batch_size': 1429, 'optimizer': 'Adam'}. Best is trial 101 with value: 0.012396203807607354.
2026-05-15 07:33:33,082 - optuna.study.study - INFO - Trial 106 finished with value: 0.011589242007370378 and parameters: {'n_layers': 1, 'embedding_dim': 256, 'lr': 0.0013824221798770984, 'lambda_val': 0.0007168977540128116, 'batch_size': 1020, 'optimizer': 'Adam'}. Best is trial 101 with value: 0.012396203807607354.
2026-05-15 07:34:02,368 - optuna.study.study - INFO - Trial 107 finished with value: 0.012328116923997767 and parameters: {'n_layers': 1, 'embedding_dim': 256, 'lr': 0.0014590267948567045, 'lambda_val': 0.0010012891252252855, 'batch_size': 1435, 'optimizer': 'Adam'}. Best is trial 101 with value: 0.012396203807607354.
2026-05-15 07:34:31,019 - optuna.study.study - INFO - Trial 108 finished with value: 0.011490543309530152 and parameters: {'n_layers': 1, 'embedding_dim': 256, 'lr': 0.002026337250749898, 'lambda_val': 0.0010200520281461497, 'batch_size': 1225, 'optimizer': 'Adam'}. Best is trial 101 with value: 0.012396203807607354.
2026-05-15 07:34:59,968 - optuna.study.study - INFO - Trial 109 finished with value: 0.012701001715824094 and parameters: {'n_layers': 1, 'embedding_dim': 256, 'lr': 0.0012691856410374453, 'lambda_val': 0.00017369525829138307, 'batch_size': 1270, 'optimizer': 'Adam'}. Best is trial 109 with value: 0.012701001715824094.
2026-05-15 07:35:37,134 - optuna.study.study - INFO - Trial 110 finished with value: 0.011367300012283981 and parameters: {'n_layers': 1, 'embedding_dim': 256, 'lr': 0.00149951687504863, 'lambda_val': 0.0001661953006131619, 'batch_size': 1295, 'optimizer': 'Adam'}. Best is trial 109 with value: 0.012701001715824094.
2026-05-15 07:36:08,939 - optuna.study.study - INFO - Trial 111 finished with value: 0.011714514476618922 and parameters: {'n_layers': 1, 'embedding_dim': 256, 'lr': 0.0012842217494064784, 'lambda_val': 8.464890301698385e-05, 'batch_size': 1405, 'optimizer': 'Adam'}. Best is trial 109 with value: 0.012701001715824094.
2026-05-15 07:36:41,743 - optuna.study.study - INFO - Trial 112 finished with value: 0.01063098473515196 and parameters: {'n_layers': 1, 'embedding_dim': 256, 'lr': 0.0011933727629213533, 'lambda_val': 0.0001040056497074707, 'batch_size': 1151, 'optimizer': 'Adam'}. Best is trial 109 with value: 0.012701001715824094.
2026-05-15 07:37:17,846 - optuna.study.study - INFO - Trial 113 finished with value: 0.011890023379224035 and parameters: {'n_layers': 1, 'embedding_dim': 256, 'lr': 0.001404579829253537, 'lambda_val': 4.847704935590297e-05, 'batch_size': 993, 'optimizer': 'Adam'}. Best is trial 109 with value: 0.012701001715824094.
2026-05-15 07:37:52,434 - optuna.study.study - INFO - Trial 114 finished with value: 0.013515416473770097 and parameters: {'n_layers': 1, 'embedding_dim': 256, 'lr': 0.0027816926346878163, 'lambda_val': 2.8721672822381886e-05, 'batch_size': 1407, 'optimizer': 'Adam'}. Best is trial 114 with value: 0.013515416473770097.
2026-05-15 07:38:28,121 - optuna.study.study - INFO - Trial 115 finished with value: 0.012718914549941628 and parameters: {'n_layers': 1, 'embedding_dim': 256, 'lr': 0.0008927192954389007, 'lambda_val': 3.1223580476898986e-05, 'batch_size': 841, 'optimizer': 'Adam'}. Best is trial 114 with value: 0.013515416473770097.
2026-05-15 07:39:01,924 - optuna.study.study - INFO - Trial 116 finished with value: 0.010354505793106717 and parameters: {'n_layers': 1, 'embedding_dim': 256, 'lr': 0.0009174692260235458, 'lambda_val': 3.188038196432786e-05, 'batch_size': 769, 'optimizer': 'Adam'}. Best is trial 114 with value: 0.013515416473770097.
2026-05-15 07:39:42,061 - optuna.study.study - INFO - Trial 117 finished with value: 0.011641049558827424 and parameters: {'n_layers': 1, 'embedding_dim': 256, 'lr': 0.0019621833116499434, 'lambda_val': 1.6921328032473187e-05, 'batch_size': 895, 'optimizer': 'Adam'}. Best is trial 114 with value: 0.013515416473770097.
2026-05-15 07:40:11,281 - optuna.study.study - INFO - Trial 118 finished with value: 0.008972498775862854 and parameters: {'n_layers': 1, 'embedding_dim': 128, 'lr': 0.0010888437699808594, 'lambda_val': 2.772113900556831e-05, 'batch_size': 687, 'optimizer': 'Adam'}. Best is trial 114 with value: 0.013515416473770097.
2026-05-15 07:40:45,128 - optuna.study.study - INFO - Trial 119 finished with value: 0.009998122135485456 and parameters: {'n_layers': 1, 'embedding_dim': 64, 'lr': 0.0016734570088226012, 'lambda_val': 7.876692379016505e-05, 'batch_size': 846, 'optimizer': 'Adam'}. Best is trial 114 with value: 0.013515416473770097.
2026-05-15 07:41:16,190 - optuna.study.study - INFO - Trial 120 finished with value: 0.010595890686817723 and parameters: {'n_layers': 1, 'embedding_dim': 256, 'lr': 0.002978728034376637, 'lambda_val': 1.1209501968452484e-05, 'batch_size': 1334, 'optimizer': 'Adam'}. Best is trial 114 with value: 0.013515416473770097.
2026-05-15 07:41:45,541 - optuna.study.study - INFO - Trial 121 finished with value: 0.011373705048325149 and parameters: {'n_layers': 1, 'embedding_dim': 256, 'lr': 0.0024556729731620383, 'lambda_val': 2.237380396823868e-05, 'batch_size': 1402, 'optimizer': 'Adam'}. Best is trial 114 with value: 0.013515416473770097.
2026-05-15 07:42:11,917 - optuna.study.study - INFO - Trial 122 finished with value: 0.012331189246877311 and parameters: {'n_layers': 1, 'embedding_dim': 256, 'lr': 0.002714270956095733, 'lambda_val': 5.400454877355221e-05, 'batch_size': 1401, 'optimizer': 'Adam'}. Best is trial 114 with value: 0.013515416473770097.
2026-05-15 07:42:40,225 - optuna.study.study - INFO - Trial 123 finished with value: 0.01065099764665748 and parameters: {'n_layers': 1, 'embedding_dim': 256, 'lr': 0.0008005400832600812, 'lambda_val': 4.366377936493568e-05, 'batch_size': 1547, 'optimizer': 'Adam'}. Best is trial 114 with value: 0.013515416473770097.
2026-05-15 07:43:18,418 - optuna.study.study - INFO - Trial 124 finished with value: 0.012842539034241677 and parameters: {'n_layers': 1, 'embedding_dim': 256, 'lr': 0.0020443136958223935, 'lambda_val': 3.661919763520588e-05, 'batch_size': 1001, 'optimizer': 'Adam'}. Best is trial 114 with value: 0.013515416473770097.
2026-05-15 07:43:48,251 - optuna.study.study - INFO - Trial 125 finished with value: 0.011523129443293341 and parameters: {'n_layers': 1, 'embedding_dim': 256, 'lr': 0.0022164579204578716, 'lambda_val': 1.5688133203498415e-05, 'batch_size': 981, 'optimizer': 'Adam'}. Best is trial 114 with value: 0.013515416473770097.
2026-05-15 07:44:17,338 - optuna.study.study - INFO - Trial 126 finished with value: 0.011172334037222162 and parameters: {'n_layers': 1, 'embedding_dim': 256, 'lr': 0.0019832956383824814, 'lambda_val': 6.0160281877324406e-05, 'batch_size': 1199, 'optimizer': 'Adam'}. Best is trial 114 with value: 0.013515416473770097.
2026-05-15 07:44:57,434 - optuna.study.study - INFO - Trial 127 finished with value: 0.010372006280490132 and parameters: {'n_layers': 1, 'embedding_dim': 256, 'lr': 0.0038496759485358283, 'lambda_val': 4.456010470266349e-05, 'batch_size': 1117, 'optimizer': 'Adam'}. Best is trial 114 with value: 0.013515416473770097.
2026-05-15 07:45:25,811 - optuna.study.study - INFO - Trial 128 finished with value: 0.010438997950373658 and parameters: {'n_layers': 1, 'embedding_dim': 256, 'lr': 0.0030820360245446873, 'lambda_val': 2.8561930393698275e-05, 'batch_size': 687, 'optimizer': 'Adam'}. Best is trial 114 with value: 0.013515416473770097.
2026-05-15 07:45:55,067 - optuna.study.study - INFO - Trial 129 finished with value: 0.01168201116074195 and parameters: {'n_layers': 1, 'embedding_dim': 256, 'lr': 0.0016332609445013923, 'lambda_val': 5.544079632553093e-05, 'batch_size': 1269, 'optimizer': 'Adam'}. Best is trial 114 with value: 0.013515416473770097.
2026-05-15 07:46:24,815 - optuna.study.study - INFO - Trial 130 finished with value: 0.012157590818583934 and parameters: {'n_layers': 1, 'embedding_dim': 256, 'lr': 0.0009542739862748556, 'lambda_val': 1.9628583216463136e-05, 'batch_size': 902, 'optimizer': 'Adam'}. Best is trial 114 with value: 0.013515416473770097.
2026-05-15 07:46:58,903 - optuna.study.study - INFO - Trial 131 finished with value: 0.012800762330522382 and parameters: {'n_layers': 1, 'embedding_dim': 256, 'lr': 0.0009028714610047324, 'lambda_val': 1.0682722313869245e-05, 'batch_size': 896, 'optimizer': 'Adam'}. Best is trial 114 with value: 0.013515416473770097.
2026-05-15 07:47:27,474 - optuna.study.study - INFO - Trial 132 finished with value: 0.010135714297245154 and parameters: {'n_layers': 1, 'embedding_dim': 256, 'lr': 0.0008906912644426737, 'lambda_val': 5.86219885132252e-06, 'batch_size': 551, 'optimizer': 'Adam'}. Best is trial 114 with value: 0.013515416473770097.
2026-05-15 07:47:56,353 - optuna.study.study - INFO - Trial 133 finished with value: 0.011755101217891351 and parameters: {'n_layers': 1, 'embedding_dim': 256, 'lr': 0.0013777657788620846, 'lambda_val': 2.099585855535792e-05, 'batch_size': 906, 'optimizer': 'Adam'}. Best is trial 114 with value: 0.013515416473770097.
2026-05-15 07:48:25,015 - optuna.study.study - INFO - Trial 134 finished with value: 0.010463032134079666 and parameters: {'n_layers': 1, 'embedding_dim': 256, 'lr': 0.0006038722191782445, 'lambda_val': 1.2701148073931655e-05, 'batch_size': 825, 'optimizer': 'Adam'}. Best is trial 114 with value: 0.013515416473770097.
2026-05-15 07:48:49,812 - optuna.study.study - INFO - Trial 135 finished with value: 0.007660573405969847 and parameters: {'n_layers': 1, 'embedding_dim': 32, 'lr': 0.0007638267632054856, 'lambda_val': 4.377734786499578e-06, 'batch_size': 968, 'optimizer': 'Adam'}. Best is trial 114 with value: 0.013515416473770097.
2026-05-15 07:49:18,615 - optuna.study.study - INFO - Trial 136 finished with value: 0.011476322071831444 and parameters: {'n_layers': 1, 'embedding_dim': 256, 'lr': 0.0011412178710682444, 'lambda_val': 3.3816499149688016e-05, 'batch_size': 717, 'optimizer': 'Adam'}. Best is trial 114 with value: 0.013515416473770097.
2026-05-15 07:49:48,104 - optuna.study.study - INFO - Trial 137 finished with value: 0.013255984389985154 and parameters: {'n_layers': 1, 'embedding_dim': 256, 'lr': 0.0010128730712067723, 'lambda_val': 9.330525584452795e-06, 'batch_size': 1171, 'optimizer': 'Adam'}. Best is trial 114 with value: 0.013515416473770097.
2026-05-15 07:50:17,543 - optuna.study.study - INFO - Trial 138 finished with value: 0.012599059155748722 and parameters: {'n_layers': 1, 'embedding_dim': 256, 'lr': 0.0009633776090359847, 'lambda_val': 1.1000208645238568e-05, 'batch_size': 1072, 'optimizer': 'Adam'}. Best is trial 114 with value: 0.013515416473770097.
2026-05-15 07:50:46,390 - optuna.study.study - INFO - Trial 139 finished with value: 0.010724828215917496 and parameters: {'n_layers': 1, 'embedding_dim': 256, 'lr': 0.00044625287392246766, 'lambda_val': 1.027870382827191e-05, 'batch_size': 1163, 'optimizer': 'Adam'}. Best is trial 114 with value: 0.013515416473770097.
2026-05-15 07:51:15,626 - optuna.study.study - INFO - Trial 140 finished with value: 0.012090262757139177 and parameters: {'n_layers': 1, 'embedding_dim': 256, 'lr': 0.0010321955055092255, 'lambda_val': 3.621948063836569e-06, 'batch_size': 882, 'optimizer': 'Adam'}. Best is trial 114 with value: 0.013515416473770097.
2026-05-15 07:51:44,484 - optuna.study.study - INFO - Trial 141 finished with value: 0.010137399830674354 and parameters: {'n_layers': 1, 'embedding_dim': 256, 'lr': 0.0009717816622095151, 'lambda_val': 3.0826096549566754e-06, 'batch_size': 874, 'optimizer': 'Adam'}. Best is trial 114 with value: 0.013515416473770097.
2026-05-15 07:52:13,773 - optuna.study.study - INFO - Trial 142 finished with value: 0.013192938733650794 and parameters: {'n_layers': 1, 'embedding_dim': 256, 'lr': 0.0008579968768944076, 'lambda_val': 8.190167526997792e-06, 'batch_size': 1053, 'optimizer': 'Adam'}. Best is trial 114 with value: 0.013515416473770097.
2026-05-15 07:52:42,725 - optuna.study.study - INFO - Trial 143 finished with value: 0.012776286482019387 and parameters: {'n_layers': 1, 'embedding_dim': 256, 'lr': 0.0007732483245615563, 'lambda_val': 9.041530366391693e-06, 'batch_size': 1073, 'optimizer': 'Adam'}. Best is trial 114 with value: 0.013515416473770097.
2026-05-15 07:53:11,717 - optuna.study.study - INFO - Trial 144 finished with value: 0.010833267148927527 and parameters: {'n_layers': 1, 'embedding_dim': 256, 'lr': 0.0006508269560119536, 'lambda_val': 8.767907625749563e-06, 'batch_size': 1073, 'optimizer': 'Adam'}. Best is trial 114 with value: 0.013515416473770097.
2026-05-15 07:53:48,622 - optuna.study.study - INFO - Trial 145 finished with value: 0.012378996227797928 and parameters: {'n_layers': 1, 'embedding_dim': 256, 'lr': 0.0008165497656449225, 'lambda_val': 6.961736217952219e-06, 'batch_size': 922, 'optimizer': 'Adam'}. Best is trial 114 with value: 0.013515416473770097.
2026-05-15 07:54:35,314 - optuna.study.study - INFO - Trial 146 finished with value: 0.009102753024058005 and parameters: {'n_layers': 1, 'embedding_dim': 256, 'lr': 0.000530356269779638, 'lambda_val': 6.495064223842877e-06, 'batch_size': 1018, 'optimizer': 'Adam'}. Best is trial 114 with value: 0.013515416473770097.
2026-05-15 07:54:40,304 - optuna.study._optimize - INFO - Trial 147 pruned. 
2026-05-15 07:54:44,000 - optuna.study._optimize - INFO - Trial 148 pruned. 
