2026-05-15 07:55:31,653 - optuna.study.study - INFO - Trial 149 finished with value: 0.009985490518921964 and parameters: {'n_layers': 1, 'embedding_dim': 256, 'lr': 0.0004590230943073221, 'lambda_val': 1.3156649443035356e-05, 'batch_size': 1079, 'optimizer': 'Adam'}. Best is trial 114 with value: 0.013515416473770097.
2026-05-15 07:56:06,560 - optuna.study.study - INFO - Trial 150 finished with value: 0.012402922665582447 and parameters: {'n_layers': 1, 'embedding_dim': 256, 'lr': 0.0009521277435417936, 'lambda_val': 5.411727275814325e-06, 'batch_size': 795, 'optimizer': 'Adam'}. Best is trial 114 with value: 0.013515416473770097.
2026-05-15 07:56:46,437 - optuna.study.study - INFO - Trial 151 finished with value: 0.009638850661717413 and parameters: {'n_layers': 1, 'embedding_dim': 256, 'lr': 0.0009163087065514515, 'lambda_val': 7.437587736806182e-06, 'batch_size': 763, 'optimizer': 'Adam'}. Best is trial 114 with value: 0.013515416473770097.
2026-05-15 07:57:25,434 - optuna.study.study - INFO - Trial 152 finished with value: 0.011092631077937476 and parameters: {'n_layers': 1, 'embedding_dim': 256, 'lr': 0.0005796911163371439, 'lambda_val': 5.000179618006895e-06, 'batch_size': 946, 'optimizer': 'Adam'}. Best is trial 114 with value: 0.013515416473770097.
2026-05-15 07:58:00,734 - optuna.study.study - INFO - Trial 153 finished with value: 0.010605763301334508 and parameters: {'n_layers': 1, 'embedding_dim': 256, 'lr': 0.001092868994494378, 'lambda_val': 2.3533814952658826e-05, 'batch_size': 806, 'optimizer': 'Adam'}. Best is trial 114 with value: 0.013515416473770097.
2026-05-15 07:58:37,784 - optuna.study.study - INFO - Trial 154 finished with value: 0.011840946893334703 and parameters: {'n_layers': 1, 'embedding_dim': 256, 'lr': 0.001359943357062487, 'lambda_val': 1.004504410120892e-06, 'batch_size': 1242, 'optimizer': 'Adam'}. Best is trial 114 with value: 0.013515416473770097.
2026-05-15 07:59:12,802 - optuna.study.study - INFO - Trial 155 finished with value: 0.01114921355131915 and parameters: {'n_layers': 1, 'embedding_dim': 256, 'lr': 0.0006671304210132407, 'lambda_val': 8.086440671313823e-06, 'batch_size': 1047, 'optimizer': 'Adam'}. Best is trial 114 with value: 0.013515416473770097.
2026-05-15 07:59:51,515 - optuna.study.study - INFO - Trial 156 finished with value: 0.012175309950263663 and parameters: {'n_layers': 1, 'embedding_dim': 256, 'lr': 0.001789433612254924, 'lambda_val': 1.2198921153916514e-05, 'batch_size': 947, 'optimizer': 'Adam'}. Best is trial 114 with value: 0.013515416473770097.
2026-05-15 08:00:24,774 - optuna.study.study - INFO - Trial 157 finished with value: 0.012136185343018442 and parameters: {'n_layers': 1, 'embedding_dim': 256, 'lr': 0.001654247330655721, 'lambda_val': 5.135688809239e-06, 'batch_size': 1116, 'optimizer': 'Adam'}. Best is trial 114 with value: 0.013515416473770097.
2026-05-15 08:00:59,647 - optuna.study.study - INFO - Trial 158 finished with value: 0.011949165103719257 and parameters: {'n_layers': 1, 'embedding_dim': 256, 'lr': 0.001948319948828741, 'lambda_val': 1.1232451228100856e-05, 'batch_size': 1008, 'optimizer': 'Adam'}. Best is trial 114 with value: 0.013515416473770097.
2026-05-15 08:01:29,100 - optuna.study.study - INFO - Trial 159 finished with value: 0.011917129099476328 and parameters: {'n_layers': 1, 'embedding_dim': 256, 'lr': 0.0012240302788684345, 'lambda_val': 4.316889204326931e-06, 'batch_size': 1203, 'optimizer': 'Adam'}. Best is trial 114 with value: 0.013515416473770097.
2026-05-15 08:01:56,232 - optuna.study.study - INFO - Trial 160 finished with value: 0.010184958234607192 and parameters: {'n_layers': 1, 'embedding_dim': 256, 'lr': 0.0008137269597579285, 'lambda_val': 1.4996193312203325e-05, 'batch_size': 634, 'optimizer': 'Adam'}. Best is trial 114 with value: 0.013515416473770097.
2026-05-15 08:02:25,068 - optuna.study.study - INFO - Trial 161 finished with value: 0.012115485775871017 and parameters: {'n_layers': 1, 'embedding_dim': 256, 'lr': 0.001016767642350845, 'lambda_val': 1.7645225093563497e-05, 'batch_size': 868, 'optimizer': 'Adam'}. Best is trial 114 with value: 0.013515416473770097.
2026-05-15 08:02:54,557 - optuna.study.study - INFO - Trial 162 finished with value: 0.010656173448179497 and parameters: {'n_layers': 1, 'embedding_dim': 256, 'lr': 0.0014916837069683807, 'lambda_val': 9.149901767409863e-06, 'batch_size': 922, 'optimizer': 'Adam'}. Best is trial 114 with value: 0.013515416473770097.
2026-05-15 08:03:23,562 - optuna.study.study - INFO - Trial 163 finished with value: 0.011884608446206216 and parameters: {'n_layers': 1, 'embedding_dim': 256, 'lr': 0.000905213637706437, 'lambda_val': 1.3716189897992763e-05, 'batch_size': 795, 'optimizer': 'Adam'}. Best is trial 114 with value: 0.013515416473770097.
2026-05-15 08:03:52,819 - optuna.study.study - INFO - Trial 164 finished with value: 0.011495209470356718 and parameters: {'n_layers': 1, 'embedding_dim': 256, 'lr': 0.0011956401770619178, 'lambda_val': 6.781149609426714e-06, 'batch_size': 923, 'optimizer': 'Adam'}. Best is trial 114 with value: 0.013515416473770097.
2026-05-15 08:04:22,159 - optuna.study.study - INFO - Trial 165 finished with value: 0.012724260069565622 and parameters: {'n_layers': 1, 'embedding_dim': 256, 'lr': 0.0022099588084930188, 'lambda_val': 2.444475516997632e-05, 'batch_size': 743, 'optimizer': 'Adam'}. Best is trial 114 with value: 0.013515416473770097.
2026-05-15 08:04:48,046 - optuna.study.study - INFO - Trial 166 finished with value: 0.01143008754255519 and parameters: {'n_layers': 1, 'embedding_dim': 256, 'lr': 0.002210651911153898, 'lambda_val': 2.6116458196604555e-05, 'batch_size': 728, 'optimizer': 'Adam'}. Best is trial 114 with value: 0.013515416473770097.
2026-05-15 08:05:18,432 - optuna.study.study - INFO - Trial 167 finished with value: 0.01195928202295492 and parameters: {'n_layers': 1, 'embedding_dim': 256, 'lr': 0.0017720888141386372, 'lambda_val': 1.1603082969463304e-05, 'batch_size': 1324, 'optimizer': 'Adam'}. Best is trial 114 with value: 0.013515416473770097.
2026-05-15 08:05:22,581 - optuna.study._optimize - INFO - Trial 168 pruned. 
2026-05-15 08:05:26,045 - optuna.study._optimize - INFO - Trial 169 pruned. 
2026-05-15 08:05:54,559 - optuna.study.study - INFO - Trial 170 finished with value: 0.011433728472082596 and parameters: {'n_layers': 1, 'embedding_dim': 256, 'lr': 0.0015678043927694057, 'lambda_val': 2.568395985938245e-06, 'batch_size': 663, 'optimizer': 'Adam'}. Best is trial 114 with value: 0.013515416473770097.
2026-05-15 08:06:22,678 - optuna.study.study - INFO - Trial 171 finished with value: 0.01034216836743484 and parameters: {'n_layers': 1, 'embedding_dim': 256, 'lr': 0.000729572027187155, 'lambda_val': 2.167681036519254e-05, 'batch_size': 838, 'optimizer': 'Adam'}. Best is trial 114 with value: 0.013515416473770097.
2026-05-15 08:06:51,980 - optuna.study.study - INFO - Trial 172 finished with value: 0.01107910019021881 and parameters: {'n_layers': 1, 'embedding_dim': 256, 'lr': 0.001030225904981113, 'lambda_val': 1.7661356490730587e-05, 'batch_size': 525, 'optimizer': 'Adam'}. Best is trial 114 with value: 0.013515416473770097.
2026-05-15 08:07:20,373 - optuna.study.study - INFO - Trial 173 finished with value: 0.012958347574924495 and parameters: {'n_layers': 1, 'embedding_dim': 256, 'lr': 0.0012422496377351645, 'lambda_val': 3.49948804250901e-05, 'batch_size': 754, 'optimizer': 'Adam'}. Best is trial 114 with value: 0.013515416473770097.
2026-05-15 08:07:48,794 - optuna.study.study - INFO - Trial 174 finished with value: 0.011476581585347959 and parameters: {'n_layers': 1, 'embedding_dim': 256, 'lr': 0.001957254819898379, 'lambda_val': 5.9414290375359964e-05, 'batch_size': 744, 'optimizer': 'Adam'}. Best is trial 114 with value: 0.013515416473770097.
2026-05-15 08:08:17,783 - optuna.study.study - INFO - Trial 175 finished with value: 0.0108613213018941 and parameters: {'n_layers': 1, 'embedding_dim': 256, 'lr': 0.0012933250698594133, 'lambda_val': 3.7655312993904216e-05, 'batch_size': 979, 'optimizer': 'Adam'}. Best is trial 114 with value: 0.013515416473770097.
2026-05-15 08:08:44,783 - optuna.study.study - INFO - Trial 176 finished with value: 0.013188476058319645 and parameters: {'n_layers': 1, 'embedding_dim': 256, 'lr': 0.0014054401333505721, 'lambda_val': 7.651020351648254e-06, 'batch_size': 1266, 'optimizer': 'Adam'}. Best is trial 114 with value: 0.013515416473770097.
2026-05-15 08:09:10,991 - optuna.study.study - INFO - Trial 177 finished with value: 0.010814517076841432 and parameters: {'n_layers': 1, 'embedding_dim': 256, 'lr': 0.0008381313683280581, 'lambda_val': 7.87490264202996e-06, 'batch_size': 1264, 'optimizer': 'Adam'}. Best is trial 114 with value: 0.013515416473770097.
2026-05-15 08:09:37,630 - optuna.study.study - INFO - Trial 178 finished with value: 0.01124875461263053 and parameters: {'n_layers': 1, 'embedding_dim': 256, 'lr': 0.0011532954616754296, 'lambda_val': 3.870536852458153e-06, 'batch_size': 1578, 'optimizer': 'Adam'}. Best is trial 114 with value: 0.013515416473770097.
2026-05-15 08:10:05,092 - optuna.study.study - INFO - Trial 179 finished with value: 0.012497797571200873 and parameters: {'n_layers': 1, 'embedding_dim': 256, 'lr': 0.0006387373163884702, 'lambda_val': 9.48110238625882e-06, 'batch_size': 1372, 'optimizer': 'Adam'}. Best is trial 114 with value: 0.013515416473770097.
2026-05-15 08:10:31,064 - optuna.study.study - INFO - Trial 180 finished with value: 0.009531867728480373 and parameters: {'n_layers': 1, 'embedding_dim': 64, 'lr': 0.0005858899704565922, 'lambda_val': 1.0419763671656233e-05, 'batch_size': 1369, 'optimizer': 'Adam'}. Best is trial 114 with value: 0.013515416473770097.
2026-05-15 08:11:00,241 - optuna.study.study - INFO - Trial 181 finished with value: 0.009601665685392582 and parameters: {'n_layers': 1, 'embedding_dim': 256, 'lr': 0.0006771025494870771, 'lambda_val': 5.891904056560761e-06, 'batch_size': 1488, 'optimizer': 'Adam'}. Best is trial 114 with value: 0.013515416473770097.
2026-05-15 08:11:27,642 - optuna.study.study - INFO - Trial 182 finished with value: 0.011660778127687415 and parameters: {'n_layers': 1, 'embedding_dim': 256, 'lr': 0.0004606718460253486, 'lambda_val': 2.6395305657519786e-05, 'batch_size': 1320, 'optimizer': 'Adam'}. Best is trial 114 with value: 0.013515416473770097.
2026-05-15 08:12:05,822 - optuna.study.study - INFO - Trial 183 finished with value: 0.01252020672981197 and parameters: {'n_layers': 1, 'embedding_dim': 256, 'lr': 0.0014028190428089615, 'lambda_val': 7.5915189721833105e-06, 'batch_size': 1201, 'optimizer': 'Adam'}. Best is trial 114 with value: 0.013515416473770097.
2026-05-15 08:12:34,105 - optuna.study.study - INFO - Trial 184 finished with value: 0.011755415223960123 and parameters: {'n_layers': 1, 'embedding_dim': 256, 'lr': 0.0008325821147748663, 'lambda_val': 8.08954052894968e-06, 'batch_size': 1206, 'optimizer': 'Adam'}. Best is trial 114 with value: 0.013515416473770097.
2026-05-15 08:12:58,811 - optuna.study.study - INFO - Trial 185 finished with value: 0.009741977552436477 and parameters: {'n_layers': 1, 'embedding_dim': 128, 'lr': 0.0010611779218217563, 'lambda_val': 6.978448698702208e-06, 'batch_size': 1090, 'optimizer': 'Adam'}. Best is trial 114 with value: 0.013515416473770097.
2026-05-15 08:13:38,332 - optuna.study.study - INFO - Trial 186 finished with value: 0.01117547559062419 and parameters: {'n_layers': 1, 'embedding_dim': 256, 'lr': 0.0013401901912789196, 'lambda_val': 1.4189935674528276e-05, 'batch_size': 1139, 'optimizer': 'Adam'}. Best is trial 114 with value: 0.013515416473770097.
2026-05-15 08:13:43,289 - optuna.study._optimize - INFO - Trial 187 pruned. 
2026-05-15 08:14:12,464 - optuna.study.study - INFO - Trial 188 finished with value: 0.011700587950017521 and parameters: {'n_layers': 1, 'embedding_dim': 256, 'lr': 0.002197600255885864, 'lambda_val': 4.910042982147894e-06, 'batch_size': 1366, 'optimizer': 'Adam'}. Best is trial 114 with value: 0.013515416473770097.
2026-05-15 08:14:40,090 - optuna.study.study - INFO - Trial 189 finished with value: 0.012175061346526636 and parameters: {'n_layers': 1, 'embedding_dim': 256, 'lr': 0.0007236348428964415, 'lambda_val': 3.151823335925245e-06, 'batch_size': 1277, 'optimizer': 'Adam'}. Best is trial 114 with value: 0.013515416473770097.
2026-05-15 08:15:10,047 - optuna.study.study - INFO - Trial 190 finished with value: 0.011181155426517844 and parameters: {'n_layers': 1, 'embedding_dim': 256, 'lr': 0.0009912675472964426, 'lambda_val': 4.4132898821897184e-05, 'batch_size': 3128, 'optimizer': 'Adam'}. Best is trial 114 with value: 0.013515416473770097.
2026-05-15 08:15:38,721 - optuna.study.study - INFO - Trial 191 finished with value: 0.00945957843313824 and parameters: {'n_layers': 1, 'embedding_dim': 256, 'lr': 0.0015153084247813246, 'lambda_val': 1.0027197488479585e-05, 'batch_size': 1418, 'optimizer': 'Adam'}. Best is trial 114 with value: 0.013515416473770097.
2026-05-15 08:16:07,443 - optuna.study.study - INFO - Trial 192 finished with value: 0.01103309355643799 and parameters: {'n_layers': 1, 'embedding_dim': 256, 'lr': 0.0012629891405922294, 'lambda_val': 6.322937542236127e-06, 'batch_size': 1449, 'optimizer': 'Adam'}. Best is trial 114 with value: 0.013515416473770097.
2026-05-15 08:16:36,151 - optuna.study.study - INFO - Trial 193 finished with value: 0.011942314047938404 and parameters: {'n_layers': 1, 'embedding_dim': 256, 'lr': 0.00035642071321418447, 'lambda_val': 0.0001329176558942357, 'batch_size': 1525, 'optimizer': 'Adam'}. Best is trial 114 with value: 0.013515416473770097.
2026-05-15 08:17:15,540 - optuna.study.study - INFO - Trial 194 finished with value: 0.011242400452752885 and parameters: {'n_layers': 1, 'embedding_dim': 256, 'lr': 0.001549823893715531, 'lambda_val': 3.490572553487075e-05, 'batch_size': 1058, 'optimizer': 'Adam'}. Best is trial 114 with value: 0.013515416473770097.
2026-05-15 08:17:43,953 - optuna.study.study - INFO - Trial 195 finished with value: 0.008561732014432305 and parameters: {'n_layers': 1, 'embedding_dim': 256, 'lr': 0.0043493019775059085, 'lambda_val': 7.62065082197514e-06, 'batch_size': 788, 'optimizer': 'Adam'}. Best is trial 114 with value: 0.013515416473770097.
2026-05-15 08:18:25,465 - optuna.study.study - INFO - Trial 196 finished with value: 0.011535218349073713 and parameters: {'n_layers': 1, 'embedding_dim': 256, 'lr': 0.0024418736549339797, 'lambda_val': 2.9278291851517075e-05, 'batch_size': 1194, 'optimizer': 'Adam'}. Best is trial 114 with value: 0.013515416473770097.
2026-05-15 08:18:29,270 - optuna.study._optimize - INFO - Trial 197 pruned. 
2026-05-15 08:18:57,877 - optuna.study.study - INFO - Trial 198 finished with value: 0.011722605930587451 and parameters: {'n_layers': 1, 'embedding_dim': 256, 'lr': 0.0008849628100810095, 'lambda_val': 1.0119315224420503e-05, 'batch_size': 1140, 'optimizer': 'Adam'}. Best is trial 114 with value: 0.013515416473770097.
2026-05-15 08:19:26,645 - optuna.study.study - INFO - Trial 199 finished with value: 0.012623398223515658 and parameters: {'n_layers': 1, 'embedding_dim': 256, 'lr': 0.0017819738146687492, 'lambda_val': 6.521461653494907e-05, 'batch_size': 844, 'optimizer': 'Adam'}. Best is trial 114 with value: 0.013515416473770097.
2026-05-15 08:19:49,691 - root - INFO -   ** Getting the trainable edges:
2026-05-15 08:19:49,699 - helper_functions - INFO -      Number of nodes: 3657
2026-05-15 08:19:49,699 - helper_functions - INFO -      Ratio: 0.4035978368833462
2026-05-15 08:19:49,699 - helper_functions - INFO -      Number of unique users: 325
2026-05-15 08:19:49,699 - helper_functions - INFO -      Number of unique items: 3332
2026-05-15 08:19:49,699 - helper_functions - INFO -      Total dominant set edge: 67989
2026-05-15 08:19:49,699 - helper_functions - INFO -      Trainable edges: 54391.200000000004
2026-05-15 08:19:49,707 - root - INFO -   **** Getting 67989 dominant set edges
2026-05-15 08:19:49,816 - optuna.storages._rdb.storage - INFO - A new study created in RDB with name: Study_e_100K_1c2dcs
2026-05-15 08:20:39,724 - optuna.study.study - INFO - Trial 0 finished with value: 0.03913033297555629 and parameters: {'n_layers': 2, 'embedding_dim': 128, 'lr': 0.06652006913120358, 'lambda_val': 0.0001365142215091956, 'batch_size': 2946, 'optimizer': 'Adam'}. Best is trial 0 with value: 0.03913033297555629.
2026-05-15 08:21:33,696 - optuna.study.study - INFO - Trial 1 finished with value: 0.020837281183338913 and parameters: {'n_layers': 1, 'embedding_dim': 64, 'lr': 2.502995114742546e-05, 'lambda_val': 0.00014628149954826772, 'batch_size': 2600, 'optimizer': 'RMSprop'}. Best is trial 0 with value: 0.03913033297555629.
2026-05-15 08:22:34,876 - optuna.study.study - INFO - Trial 2 finished with value: 0.0037674188070777035 and parameters: {'n_layers': 3, 'embedding_dim': 256, 'lr': 0.09160475975357203, 'lambda_val': 9.512283782188633e-05, 'batch_size': 3185, 'optimizer': 'SGD'}. Best is trial 0 with value: 0.03913033297555629.
2026-05-15 08:23:22,356 - optuna.study.study - INFO - Trial 3 finished with value: 0.002503564330638805 and parameters: {'n_layers': 2, 'embedding_dim': 32, 'lr': 0.00018522933692892554, 'lambda_val': 0.016733275814555897, 'batch_size': 1825, 'optimizer': 'SGD'}. Best is trial 0 with value: 0.03913033297555629.
2026-05-15 08:24:29,712 - optuna.study.study - INFO - Trial 4 finished with value: 0.01837096255423876 and parameters: {'n_layers': 4, 'embedding_dim': 256, 'lr': 0.00025069901786832385, 'lambda_val': 4.616953126998941e-06, 'batch_size': 2887, 'optimizer': 'RMSprop'}. Best is trial 0 with value: 0.03913033297555629.
2026-05-15 08:24:38,160 - optuna.study._optimize - INFO - Trial 5 pruned. 
2026-05-15 08:24:43,304 - optuna.study._optimize - INFO - Trial 6 pruned. 
2026-05-15 08:24:49,277 - optuna.study._optimize - INFO - Trial 7 pruned. 
2026-05-15 08:24:58,612 - optuna.study._optimize - INFO - Trial 8 pruned. 
2026-05-15 08:25:47,987 - optuna.study.study - INFO - Trial 9 finished with value: 0.01716471420056421 and parameters: {'n_layers': 4, 'embedding_dim': 64, 'lr': 0.00041820350540802426, 'lambda_val': 1.1399295614670064e-06, 'batch_size': 2745, 'optimizer': 'RMSprop'}. Best is trial 0 with value: 0.03913033297555629.
2026-05-15 08:26:21,935 - optuna.study._optimize - INFO - Trial 10 pruned. 
2026-05-15 08:26:26,680 - optuna.study._optimize - INFO - Trial 11 pruned. 
2026-05-15 08:27:08,158 - optuna.study.study - INFO - Trial 12 finished with value: 0.032154436164664964 and parameters: {'n_layers': 1, 'embedding_dim': 128, 'lr': 0.003314283140363573, 'lambda_val': 1.8698483504142352e-05, 'batch_size': 1447, 'optimizer': 'Adam'}. Best is trial 0 with value: 0.03913033297555629.
2026-05-15 08:27:56,083 - optuna.study.study - INFO - Trial 13 finished with value: 0.03136736183843773 and parameters: {'n_layers': 2, 'embedding_dim': 128, 'lr': 0.009289868674132775, 'lambda_val': 1.6017327103461412e-05, 'batch_size': 1293, 'optimizer': 'Adam'}. Best is trial 0 with value: 0.03913033297555629.
2026-05-15 08:28:40,063 - optuna.study.study - INFO - Trial 14 finished with value: 0.04240548515734444 and parameters: {'n_layers': 1, 'embedding_dim': 128, 'lr': 0.01930366061355305, 'lambda_val': 9.311810018556949e-06, 'batch_size': 1467, 'optimizer': 'Adam'}. Best is trial 14 with value: 0.04240548515734444.
2026-05-15 08:29:16,347 - optuna.study.study - INFO - Trial 15 finished with value: 0.03359826738098336 and parameters: {'n_layers': 2, 'embedding_dim': 128, 'lr': 0.02126878647575869, 'lambda_val': 0.0011150233784695185, 'batch_size': 686, 'optimizer': 'Adam'}. Best is trial 14 with value: 0.04240548515734444.
2026-05-15 08:29:24,660 - optuna.study._optimize - INFO - Trial 16 pruned. 
2026-05-15 08:29:52,610 - optuna.study.study - INFO - Trial 17 finished with value: 0.04199869873667099 and parameters: {'n_layers': 1, 'embedding_dim': 96, 'lr': 0.001274560726771871, 'lambda_val': 0.0008692738409644293, 'batch_size': 2134, 'optimizer': 'Adam'}. Best is trial 14 with value: 0.04240548515734444.
2026-05-15 08:30:20,026 - optuna.study.study - INFO - Trial 18 finished with value: 0.04655163741880719 and parameters: {'n_layers': 1, 'embedding_dim': 96, 'lr': 0.0016830976776140195, 'lambda_val': 0.0006204993595497764, 'batch_size': 2252, 'optimizer': 'Adam'}. Best is trial 18 with value: 0.04655163741880719.
2026-05-15 08:30:47,871 - optuna.study.study - INFO - Trial 19 finished with value: 0.05625355965483205 and parameters: {'n_layers': 1, 'embedding_dim': 96, 'lr': 0.001525850035224581, 'lambda_val': 0.009279840520751887, 'batch_size': 1125, 'optimizer': 'Adam'}. Best is trial 19 with value: 0.05625355965483205.
2026-05-15 08:31:15,295 - optuna.study.study - INFO - Trial 20 finished with value: 0.05899843684477314 and parameters: {'n_layers': 1, 'embedding_dim': 96, 'lr': 0.00126807846644336, 'lambda_val': 0.01863207679545606, 'batch_size': 1125, 'optimizer': 'Adam'}. Best is trial 20 with value: 0.05899843684477314.
2026-05-15 08:31:54,256 - optuna.study.study - INFO - Trial 21 finished with value: 0.05620062850157364 and parameters: {'n_layers': 1, 'embedding_dim': 96, 'lr': 0.0018818343655134363, 'lambda_val': 0.03133035811095324, 'batch_size': 1066, 'optimizer': 'Adam'}. Best is trial 20 with value: 0.05899843684477314.
2026-05-15 08:32:21,574 - optuna.study.study - INFO - Trial 22 finished with value: 0.04259040926924702 and parameters: {'n_layers': 1, 'embedding_dim': 96, 'lr': 0.0006245306178444715, 'lambda_val': 0.058618236634731265, 'batch_size': 1044, 'optimizer': 'Adam'}. Best is trial 20 with value: 0.05899843684477314.
2026-05-15 08:32:25,539 - optuna.study._optimize - INFO - Trial 23 pruned. 
