2026-05-15 04:51:56,913 - optuna.study.study - INFO - Trial 193 finished with value: 0.09118883013031531 and parameters: {'n_layers': 1, 'embedding_dim': 256, 'lr': 0.01237998711576506, 'lambda_val': 0.0008283243556393812, 'batch_size': 2735, 'optimizer': 'RMSprop'}. Best is trial 179 with value: 0.10340409334543613.
2026-05-15 04:52:35,110 - optuna.study.study - INFO - Trial 194 finished with value: 0.09238890612497733 and parameters: {'n_layers': 1, 'embedding_dim': 256, 'lr': 0.0071054322318037455, 'lambda_val': 0.0015535513019047922, 'batch_size': 2635, 'optimizer': 'RMSprop'}. Best is trial 179 with value: 0.10340409334543613.
2026-05-15 04:53:13,743 - optuna.study.study - INFO - Trial 195 finished with value: 0.08869249870776998 and parameters: {'n_layers': 1, 'embedding_dim': 256, 'lr': 0.009777230185569391, 'lambda_val': 0.0007275804925806088, 'batch_size': 2396, 'optimizer': 'RMSprop'}. Best is trial 179 with value: 0.10340409334543613.
2026-05-15 04:53:26,379 - optuna.study._optimize - INFO - Trial 196 pruned. 
2026-05-15 04:54:03,105 - optuna.study.study - INFO - Trial 197 finished with value: 0.09033287464487426 and parameters: {'n_layers': 1, 'embedding_dim': 256, 'lr': 0.005614769308214624, 'lambda_val': 0.0005777532986405819, 'batch_size': 2771, 'optimizer': 'RMSprop'}. Best is trial 179 with value: 0.10340409334543613.
2026-05-15 04:54:38,425 - optuna.study.study - INFO - Trial 198 finished with value: 0.09484381612694952 and parameters: {'n_layers': 1, 'embedding_dim': 256, 'lr': 0.003996588968368429, 'lambda_val': 0.0018837774665689145, 'batch_size': 2538, 'optimizer': 'RMSprop'}. Best is trial 179 with value: 0.10340409334543613.
2026-05-15 04:54:42,043 - optuna.study._optimize - INFO - Trial 199 pruned. 
2026-05-15 04:55:09,886 - root - INFO - **** Training e_100K_1c1dcs
2026-05-15 04:55:09,886 - root - INFO -   ** 1-Dominant stats:
2026-05-15 04:55:09,886 - root - INFO -   ** Finding the dominant set:
2026-05-15 04:55:24,026 - root - INFO -   ** Getting the trainable edges:
2026-05-15 04:55:24,030 - helper_functions - INFO -      Number of nodes: 547
2026-05-15 04:55:24,030 - helper_functions - INFO -      Ratio: 0.06036861273590111
2026-05-15 04:55:24,030 - helper_functions - INFO -      Number of unique users: 320
2026-05-15 04:55:24,030 - helper_functions - INFO -      Number of unique items: 227
2026-05-15 04:55:24,030 - helper_functions - INFO -      Total dominant set edge: 8057
2026-05-15 04:55:24,030 - helper_functions - INFO -      Trainable edges: 6445.6
2026-05-15 04:55:24,033 - root - INFO -   **** Getting 8057 dominant set edges
2026-05-15 04:55:24,419 - optuna.storages._rdb.storage - INFO - A new study created in RDB with name: Study_e_100K_1c1dcs_strict
2026-05-15 04:56:16,613 - optuna.study.study - INFO - Trial 0 finished with value: 0.00472823503088515 and parameters: {'n_layers': 3, 'embedding_dim': 32, 'lr': 0.00044052994267849917, 'lambda_val': 2.4420379915843637e-05, 'batch_size': 3116, 'optimizer': 'Adam'}. Best is trial 0 with value: 0.00472823503088515.
2026-05-15 04:57:10,793 - optuna.study.study - INFO - Trial 1 finished with value: 0.006155805301258569 and parameters: {'n_layers': 3, 'embedding_dim': 32, 'lr': 0.0009279045276106335, 'lambda_val': 1.8575299586131904e-05, 'batch_size': 4091, 'optimizer': 'RMSprop'}. Best is trial 1 with value: 0.006155805301258569.
2026-05-15 04:57:41,450 - optuna.study.study - INFO - Trial 2 finished with value: 0.022437956501262804 and parameters: {'n_layers': 3, 'embedding_dim': 128, 'lr': 0.0031303055691325877, 'lambda_val': 1.6052583144572633e-05, 'batch_size': 3768, 'optimizer': 'RMSprop'}. Best is trial 2 with value: 0.022437956501262804.
2026-05-15 04:58:10,226 - optuna.study.study - INFO - Trial 3 finished with value: 0.016098530342140517 and parameters: {'n_layers': 1, 'embedding_dim': 64, 'lr': 0.006133795284114148, 'lambda_val': 1.8416039931681865e-06, 'batch_size': 1926, 'optimizer': 'Adam'}. Best is trial 2 with value: 0.022437956501262804.
2026-05-15 04:58:33,367 - optuna.study.study - INFO - Trial 4 finished with value: 0.01069806279264645 and parameters: {'n_layers': 1, 'embedding_dim': 32, 'lr': 0.0638651541337745, 'lambda_val': 2.7461882198625516e-06, 'batch_size': 2588, 'optimizer': 'RMSprop'}. Best is trial 2 with value: 0.022437956501262804.
2026-05-15 04:58:54,878 - optuna.study._optimize - INFO - Trial 5 pruned. 
2026-05-15 04:58:59,477 - optuna.study._optimize - INFO - Trial 6 pruned. 
2026-05-15 04:59:03,905 - optuna.study._optimize - INFO - Trial 7 pruned. 
2026-05-15 04:59:07,646 - optuna.study._optimize - INFO - Trial 8 pruned. 
2026-05-15 04:59:10,763 - optuna.study._optimize - INFO - Trial 9 pruned. 
2026-05-15 04:59:14,231 - optuna.study._optimize - INFO - Trial 10 pruned. 
2026-05-15 04:59:41,737 - optuna.study.study - INFO - Trial 11 finished with value: 0.01637434414264552 and parameters: {'n_layers': 2, 'embedding_dim': 128, 'lr': 0.006114603810644637, 'lambda_val': 1.1351398627992634e-06, 'batch_size': 1261, 'optimizer': 'Adam'}. Best is trial 2 with value: 0.022437956501262804.
2026-05-15 05:00:10,643 - optuna.study.study - INFO - Trial 12 finished with value: 0.010868991856273328 and parameters: {'n_layers': 2, 'embedding_dim': 128, 'lr': 0.010432462779634196, 'lambda_val': 1.2628356606867277e-06, 'batch_size': 1123, 'optimizer': 'RMSprop'}. Best is trial 2 with value: 0.022437956501262804.
2026-05-15 05:00:15,375 - optuna.study._optimize - INFO - Trial 13 pruned. 
2026-05-15 05:00:19,037 - optuna.study._optimize - INFO - Trial 14 pruned. 
2026-05-15 05:00:22,600 - optuna.study._optimize - INFO - Trial 15 pruned. 
2026-05-15 05:00:26,152 - optuna.study._optimize - INFO - Trial 16 pruned. 
2026-05-15 05:00:30,913 - optuna.study._optimize - INFO - Trial 17 pruned. 
2026-05-15 05:00:42,227 - optuna.study._optimize - INFO - Trial 18 pruned. 
2026-05-15 05:00:45,773 - optuna.study._optimize - INFO - Trial 19 pruned. 
2026-05-15 05:00:49,391 - optuna.study._optimize - INFO - Trial 20 pruned. 
2026-05-15 05:01:16,567 - optuna.study.study - INFO - Trial 21 finished with value: 0.015024733449982966 and parameters: {'n_layers': 1, 'embedding_dim': 64, 'lr': 0.009641074970433115, 'lambda_val': 1.1380987684183832e-06, 'batch_size': 1920, 'optimizer': 'Adam'}. Best is trial 2 with value: 0.022437956501262804.
2026-05-15 05:01:44,254 - optuna.study.study - INFO - Trial 22 finished with value: 0.014614222230716989 and parameters: {'n_layers': 1, 'embedding_dim': 64, 'lr': 0.0067881097160854735, 'lambda_val': 3.215398129913672e-06, 'batch_size': 1978, 'optimizer': 'Adam'}. Best is trial 2 with value: 0.022437956501262804.
2026-05-15 05:01:51,132 - optuna.study._optimize - INFO - Trial 23 pruned. 
2026-05-15 05:01:55,155 - optuna.study._optimize - INFO - Trial 24 pruned. 
2026-05-15 05:02:32,159 - optuna.study.study - INFO - Trial 25 finished with value: 0.023670213947484524 and parameters: {'n_layers': 3, 'embedding_dim': 256, 'lr': 0.002863006152874357, 'lambda_val': 4.6895336003695554e-05, 'batch_size': 2552, 'optimizer': 'RMSprop'}. Best is trial 25 with value: 0.023670213947484524.
2026-05-15 05:02:36,504 - optuna.study._optimize - INFO - Trial 26 pruned. 
2026-05-15 05:02:41,095 - optuna.study._optimize - INFO - Trial 27 pruned. 
2026-05-15 05:03:21,082 - optuna.study.study - INFO - Trial 28 finished with value: 0.018896790928257152 and parameters: {'n_layers': 3, 'embedding_dim': 256, 'lr': 0.0034734703792818557, 'lambda_val': 0.00020331858077244063, 'batch_size': 2879, 'optimizer': 'RMSprop'}. Best is trial 25 with value: 0.023670213947484524.
2026-05-15 05:03:27,709 - optuna.study._optimize - INFO - Trial 29 pruned. 
2026-05-15 05:03:32,119 - optuna.study._optimize - INFO - Trial 30 pruned. 
2026-05-15 05:04:09,428 - optuna.study.study - INFO - Trial 31 finished with value: 0.02410528988360573 and parameters: {'n_layers': 3, 'embedding_dim': 256, 'lr': 0.0033598457932940895, 'lambda_val': 3.260277050261481e-05, 'batch_size': 3109, 'optimizer': 'RMSprop'}. Best is trial 31 with value: 0.02410528988360573.
2026-05-15 05:04:46,075 - optuna.study.study - INFO - Trial 32 finished with value: 0.020785375242948934 and parameters: {'n_layers': 3, 'embedding_dim': 256, 'lr': 0.0028080761241610955, 'lambda_val': 4.1265238376208243e-05, 'batch_size': 3094, 'optimizer': 'RMSprop'}. Best is trial 31 with value: 0.02410528988360573.
2026-05-15 05:04:50,204 - optuna.study._optimize - INFO - Trial 33 pruned. 
2026-05-15 05:04:56,353 - optuna.study._optimize - INFO - Trial 34 pruned. 
2026-05-15 05:05:37,579 - optuna.study.study - INFO - Trial 35 finished with value: 0.023353104506018785 and parameters: {'n_layers': 4, 'embedding_dim': 256, 'lr': 0.010939290913670085, 'lambda_val': 2.6985211756926674e-05, 'batch_size': 2353, 'optimizer': 'RMSprop'}. Best is trial 31 with value: 0.02410528988360573.
2026-05-15 05:06:11,166 - optuna.study.study - INFO - Trial 36 finished with value: 0.01995053776243503 and parameters: {'n_layers': 4, 'embedding_dim': 32, 'lr': 0.034709865979355534, 'lambda_val': 2.1219099721101712e-05, 'batch_size': 2333, 'optimizer': 'RMSprop'}. Best is trial 31 with value: 0.02410528988360573.
2026-05-15 05:06:54,528 - optuna.study.study - INFO - Trial 37 finished with value: 0.02211990678496727 and parameters: {'n_layers': 4, 'embedding_dim': 256, 'lr': 0.013666172865335996, 'lambda_val': 0.000140659326010103, 'batch_size': 2617, 'optimizer': 'RMSprop'}. Best is trial 31 with value: 0.02410528988360573.
2026-05-15 05:07:01,898 - optuna.study._optimize - INFO - Trial 38 pruned. 
2026-05-15 05:07:06,967 - optuna.study._optimize - INFO - Trial 39 pruned. 
2026-05-15 05:07:11,454 - optuna.study._optimize - INFO - Trial 40 pruned. 
2026-05-15 05:07:50,081 - optuna.study.study - INFO - Trial 41 finished with value: 0.02323343412512281 and parameters: {'n_layers': 4, 'embedding_dim': 256, 'lr': 0.011602144910811529, 'lambda_val': 0.00011571604449004538, 'batch_size': 2636, 'optimizer': 'RMSprop'}. Best is trial 31 with value: 0.02410528988360573.
2026-05-15 05:08:28,502 - optuna.study.study - INFO - Trial 42 finished with value: 0.0287930838515238 and parameters: {'n_layers': 4, 'embedding_dim': 256, 'lr': 0.004550984368885091, 'lambda_val': 2.5579304554057094e-05, 'batch_size': 2480, 'optimizer': 'RMSprop'}. Best is trial 42 with value: 0.0287930838515238.
2026-05-15 05:08:34,246 - optuna.study._optimize - INFO - Trial 43 pruned. 
2026-05-15 05:09:11,544 - optuna.study.study - INFO - Trial 44 finished with value: 0.02639869474827844 and parameters: {'n_layers': 4, 'embedding_dim': 256, 'lr': 0.010087588392394832, 'lambda_val': 0.00012302918363772002, 'batch_size': 2207, 'optimizer': 'RMSprop'}. Best is trial 42 with value: 0.0287930838515238.
2026-05-15 05:09:16,012 - optuna.study._optimize - INFO - Trial 45 pruned. 
2026-05-15 05:09:20,878 - optuna.study._optimize - INFO - Trial 46 pruned. 
2026-05-15 05:09:51,435 - optuna.study.study - INFO - Trial 47 finished with value: 0.02758810748471293 and parameters: {'n_layers': 4, 'embedding_dim': 96, 'lr': 0.007524398329584805, 'lambda_val': 5.084135906242332e-05, 'batch_size': 2470, 'optimizer': 'RMSprop'}. Best is trial 42 with value: 0.0287930838515238.
2026-05-15 05:09:57,301 - optuna.study._optimize - INFO - Trial 48 pruned. 
2026-05-15 05:10:01,986 - optuna.study._optimize - INFO - Trial 49 pruned. 
2026-05-15 05:10:05,931 - optuna.study._optimize - INFO - Trial 50 pruned. 
2026-05-15 05:10:44,096 - optuna.study.study - INFO - Trial 51 finished with value: 0.025108234612187766 and parameters: {'n_layers': 4, 'embedding_dim': 96, 'lr': 0.010652105215881185, 'lambda_val': 3.4033382336310247e-05, 'batch_size': 2503, 'optimizer': 'RMSprop'}. Best is trial 42 with value: 0.0287930838515238.
2026-05-15 05:11:18,896 - optuna.study.study - INFO - Trial 52 finished with value: 0.022553584333915078 and parameters: {'n_layers': 4, 'embedding_dim': 96, 'lr': 0.007553616147534293, 'lambda_val': 9.39455530880583e-06, 'batch_size': 2512, 'optimizer': 'RMSprop'}. Best is trial 42 with value: 0.0287930838515238.
2026-05-15 05:11:24,333 - optuna.study._optimize - INFO - Trial 53 pruned. 
2026-05-15 05:11:28,448 - optuna.study._optimize - INFO - Trial 54 pruned. 
2026-05-15 05:11:38,268 - optuna.study._optimize - INFO - Trial 55 pruned. 
2026-05-15 05:11:42,473 - optuna.study._optimize - INFO - Trial 56 pruned. 
2026-05-15 05:12:16,840 - optuna.study.study - INFO - Trial 57 finished with value: 0.02336259873013177 and parameters: {'n_layers': 4, 'embedding_dim': 96, 'lr': 0.014545652247239044, 'lambda_val': 0.00011000124556020596, 'batch_size': 2734, 'optimizer': 'RMSprop'}. Best is trial 42 with value: 0.0287930838515238.
2026-05-15 05:12:21,317 - optuna.study._optimize - INFO - Trial 58 pruned. 
2026-05-15 05:12:25,311 - optuna.study._optimize - INFO - Trial 59 pruned. 
2026-05-15 05:12:29,940 - optuna.study._optimize - INFO - Trial 60 pruned. 
2026-05-15 05:13:05,070 - optuna.study.study - INFO - Trial 61 finished with value: 0.024079146997971215 and parameters: {'n_layers': 4, 'embedding_dim': 96, 'lr': 0.014720001704248899, 'lambda_val': 0.00010987530240667364, 'batch_size': 2673, 'optimizer': 'RMSprop'}. Best is trial 42 with value: 0.0287930838515238.
2026-05-15 05:13:11,538 - optuna.study._optimize - INFO - Trial 62 pruned. 
2026-05-15 05:13:16,939 - optuna.study._optimize - INFO - Trial 63 pruned. 
2026-05-15 05:13:21,873 - optuna.study._optimize - INFO - Trial 64 pruned. 
2026-05-15 05:13:56,982 - optuna.study.study - INFO - Trial 65 finished with value: 0.02484244619102876 and parameters: {'n_layers': 4, 'embedding_dim': 96, 'lr': 0.015927281665189825, 'lambda_val': 0.00014737495313215564, 'batch_size': 3380, 'optimizer': 'RMSprop'}. Best is trial 42 with value: 0.0287930838515238.
2026-05-15 05:14:31,688 - optuna.study.study - INFO - Trial 66 finished with value: 0.02370960905678784 and parameters: {'n_layers': 4, 'embedding_dim': 96, 'lr': 0.05152299551878087, 'lambda_val': 0.00016248159840022699, 'batch_size': 3496, 'optimizer': 'RMSprop'}. Best is trial 42 with value: 0.0287930838515238.
2026-05-15 05:15:06,408 - optuna.study.study - INFO - Trial 67 finished with value: 0.026361280242406082 and parameters: {'n_layers': 4, 'embedding_dim': 96, 'lr': 0.014267728735345696, 'lambda_val': 9.962521623352517e-05, 'batch_size': 3442, 'optimizer': 'RMSprop'}. Best is trial 42 with value: 0.0287930838515238.
2026-05-15 05:15:37,828 - optuna.study.study - INFO - Trial 68 finished with value: 0.026946114690020142 and parameters: {'n_layers': 4, 'embedding_dim': 96, 'lr': 0.022067600192088057, 'lambda_val': 7.731680625827597e-05, 'batch_size': 3376, 'optimizer': 'RMSprop'}. Best is trial 42 with value: 0.0287930838515238.
2026-05-15 05:15:41,734 - optuna.study._optimize - INFO - Trial 69 pruned. 
2026-05-15 05:15:46,624 - optuna.study._optimize - INFO - Trial 70 pruned. 
2026-05-15 05:15:54,984 - optuna.study._optimize - INFO - Trial 71 pruned. 
2026-05-15 05:16:25,379 - optuna.study.study - INFO - Trial 72 finished with value: 0.024943374559789275 and parameters: {'n_layers': 4, 'embedding_dim': 96, 'lr': 0.011630765632644133, 'lambda_val': 4.674769529860245e-05, 'batch_size': 3777, 'optimizer': 'RMSprop'}. Best is trial 42 with value: 0.0287930838515238.
2026-05-15 05:16:56,845 - optuna.study.study - INFO - Trial 73 finished with value: 0.027889074471638697 and parameters: {'n_layers': 4, 'embedding_dim': 96, 'lr': 0.013428397715597208, 'lambda_val': 9.824809603066677e-05, 'batch_size': 3760, 'optimizer': 'RMSprop'}. Best is trial 42 with value: 0.0287930838515238.
2026-05-15 05:17:37,923 - optuna.study.study - INFO - Trial 74 finished with value: 0.02429899566000094 and parameters: {'n_layers': 4, 'embedding_dim': 96, 'lr': 0.02764840502351574, 'lambda_val': 9.039643507221229e-05, 'batch_size': 3792, 'optimizer': 'RMSprop'}. Best is trial 42 with value: 0.0287930838515238.
2026-05-15 05:18:08,265 - optuna.study.study - INFO - Trial 75 finished with value: 0.02525117177864304 and parameters: {'n_layers': 4, 'embedding_dim': 96, 'lr': 0.011984569435873015, 'lambda_val': 4.666260717648619e-05, 'batch_size': 3727, 'optimizer': 'RMSprop'}. Best is trial 42 with value: 0.0287930838515238.
2026-05-15 05:18:42,080 - optuna.study.study - INFO - Trial 76 finished with value: 0.02138644876301645 and parameters: {'n_layers': 4, 'embedding_dim': 96, 'lr': 0.009160739382396508, 'lambda_val': 2.0559429503247503e-05, 'batch_size': 3974, 'optimizer': 'RMSprop'}. Best is trial 42 with value: 0.0287930838515238.
2026-05-15 05:18:48,976 - optuna.study._optimize - INFO - Trial 77 pruned. 
2026-05-15 05:19:00,100 - optuna.study._optimize - INFO - Trial 78 pruned. 
2026-05-15 05:19:03,665 - optuna.study._optimize - INFO - Trial 79 pruned. 
2026-05-15 05:19:35,142 - optuna.study.study - INFO - Trial 80 finished with value: 0.02525792964158337 and parameters: {'n_layers': 4, 'embedding_dim': 128, 'lr': 0.01872222267932317, 'lambda_val': 9.432514939678131e-05, 'batch_size': 4089, 'optimizer': 'RMSprop'}. Best is trial 42 with value: 0.0287930838515238.
2026-05-15 05:19:45,607 - optuna.study._optimize - INFO - Trial 81 pruned. 
2026-05-15 05:20:29,100 - optuna.study.study - INFO - Trial 82 finished with value: 0.024103347833279123 and parameters: {'n_layers': 4, 'embedding_dim': 128, 'lr': 0.029525987277897597, 'lambda_val': 7.37728331906545e-05, 'batch_size': 4095, 'optimizer': 'RMSprop'}. Best is trial 42 with value: 0.0287930838515238.
2026-05-15 05:20:33,086 - optuna.study._optimize - INFO - Trial 83 pruned. 
2026-05-15 05:20:37,091 - optuna.study._optimize - INFO - Trial 84 pruned. 
2026-05-15 05:20:40,725 - optuna.study._optimize - INFO - Trial 85 pruned. 
2026-05-15 05:20:45,106 - optuna.study._optimize - INFO - Trial 86 pruned. 
2026-05-15 05:21:16,742 - optuna.study.study - INFO - Trial 87 finished with value: 0.023723790213359058 and parameters: {'n_layers': 4, 'embedding_dim': 128, 'lr': 0.01848954270782695, 'lambda_val': 6.0642600011984724e-05, 'batch_size': 3601, 'optimizer': 'RMSprop'}. Best is trial 42 with value: 0.0287930838515238.
2026-05-15 05:21:20,829 - optuna.study._optimize - INFO - Trial 88 pruned. 
2026-05-15 05:21:24,484 - optuna.study._optimize - INFO - Trial 89 pruned. 
2026-05-15 05:21:28,398 - optuna.study._optimize - INFO - Trial 90 pruned. 
2026-05-15 05:22:04,401 - optuna.study.study - INFO - Trial 91 finished with value: 0.026164726054069592 and parameters: {'n_layers': 4, 'embedding_dim': 96, 'lr': 0.012078371964121992, 'lambda_val': 4.1554770492967634e-05, 'batch_size': 3724, 'optimizer': 'RMSprop'}. Best is trial 42 with value: 0.0287930838515238.
2026-05-15 05:22:31,504 - optuna.study.study - INFO - Trial 92 finished with value: 0.024080983943328593 and parameters: {'n_layers': 4, 'embedding_dim': 96, 'lr': 0.013748811733544579, 'lambda_val': 4.7270870000548e-05, 'batch_size': 3581, 'optimizer': 'RMSprop'}. Best is trial 42 with value: 0.0287930838515238.
2026-05-15 05:23:15,264 - optuna.study.study - INFO - Trial 93 finished with value: 0.02768178992486734 and parameters: {'n_layers': 4, 'embedding_dim': 96, 'lr': 0.010314439821396579, 'lambda_val': 3.5793915102046054e-05, 'batch_size': 3719, 'optimizer': 'RMSprop'}. Best is trial 42 with value: 0.0287930838515238.
2026-05-15 05:23:21,426 - optuna.study._optimize - INFO - Trial 94 pruned. 
2026-05-15 05:23:51,557 - optuna.study.study - INFO - Trial 95 finished with value: 0.024235573327445366 and parameters: {'n_layers': 4, 'embedding_dim': 96, 'lr': 0.03560195839502179, 'lambda_val': 6.818930990302136e-05, 'batch_size': 3422, 'optimizer': 'RMSprop'}. Best is trial 42 with value: 0.0287930838515238.
2026-05-15 05:23:55,785 - optuna.study._optimize - INFO - Trial 96 pruned. 
2026-05-15 05:24:03,053 - optuna.study._optimize - INFO - Trial 97 pruned. 
2026-05-15 05:24:41,482 - optuna.study.study - INFO - Trial 98 finished with value: 0.023515392928985482 and parameters: {'n_layers': 4, 'embedding_dim': 128, 'lr': 0.009364704132982982, 'lambda_val': 3.9589747190966654e-05, 'batch_size': 3554, 'optimizer': 'RMSprop'}. Best is trial 42 with value: 0.0287930838515238.
2026-05-15 05:24:45,253 - optuna.study._optimize - INFO - Trial 99 pruned. 
2026-05-15 05:24:49,833 - optuna.study._optimize - INFO - Trial 100 pruned. 
2026-05-15 05:24:53,544 - optuna.study._optimize - INFO - Trial 101 pruned. 
2026-05-15 05:25:24,160 - optuna.study.study - INFO - Trial 102 finished with value: 0.021675709788728674 and parameters: {'n_layers': 4, 'embedding_dim': 96, 'lr': 0.016018502518581116, 'lambda_val': 1.7354494378475976e-05, 'batch_size': 2215, 'optimizer': 'RMSprop'}. Best is trial 42 with value: 0.0287930838515238.
2026-05-15 05:25:53,761 - optuna.study.study - INFO - Trial 103 finished with value: 0.023565632509573255 and parameters: {'n_layers': 4, 'embedding_dim': 96, 'lr': 0.021521558490867183, 'lambda_val': 5.2549805166870644e-05, 'batch_size': 3872, 'optimizer': 'RMSprop'}. Best is trial 42 with value: 0.0287930838515238.
2026-05-15 05:26:10,645 - optuna.study._optimize - INFO - Trial 104 pruned. 
2026-05-15 05:26:42,173 - optuna.study.study - INFO - Trial 105 finished with value: 0.022009961502548657 and parameters: {'n_layers': 4, 'embedding_dim': 96, 'lr': 0.01368879779866716, 'lambda_val': 3.9504005009850316e-05, 'batch_size': 3463, 'optimizer': 'RMSprop'}. Best is trial 42 with value: 0.0287930838515238.
2026-05-15 05:26:46,485 - optuna.study._optimize - INFO - Trial 106 pruned. 
2026-05-15 05:27:24,654 - optuna.study.study - INFO - Trial 107 finished with value: 0.022427381531966918 and parameters: {'n_layers': 4, 'embedding_dim': 256, 'lr': 0.011502366190952407, 'lambda_val': 3.3774460636770344e-05, 'batch_size': 3313, 'optimizer': 'RMSprop'}. Best is trial 42 with value: 0.0287930838515238.
