2026-05-15 10:45:46,213 - optuna.study.study - INFO - Trial 43 finished with value: 0.0653321461912011 and parameters: {'n_layers': 1, 'embedding_dim': 256, 'lr': 0.00048335647107792986, 'lambda_val': 0.001999735953341566, 'batch_size': 1454, 'optimizer': 'Adam'}. Best is trial 28 with value: 0.08689335864554718.
2026-05-15 10:46:13,267 - optuna.study.study - INFO - Trial 44 finished with value: 0.09822568122403967 and parameters: {'n_layers': 1, 'embedding_dim': 32, 'lr': 0.0001927888272371531, 'lambda_val': 0.00011731131362415356, 'batch_size': 798, 'optimizer': 'RMSprop'}. Best is trial 44 with value: 0.09822568122403967.
2026-05-15 10:46:17,000 - optuna.study._optimize - INFO - Trial 45 pruned. 
2026-05-15 10:46:45,110 - optuna.study.study - INFO - Trial 46 finished with value: 0.07005410376114969 and parameters: {'n_layers': 1, 'embedding_dim': 32, 'lr': 0.00017935019673078143, 'lambda_val': 0.0005497492503512225, 'batch_size': 1551, 'optimizer': 'RMSprop'}. Best is trial 44 with value: 0.09822568122403967.
2026-05-15 10:47:11,490 - optuna.study.study - INFO - Trial 47 finished with value: 0.035771840061822886 and parameters: {'n_layers': 1, 'embedding_dim': 32, 'lr': 0.00042318642138874094, 'lambda_val': 0.00010628291818435744, 'batch_size': 2116, 'optimizer': 'RMSprop'}. Best is trial 44 with value: 0.09822568122403967.
2026-05-15 10:47:15,429 - optuna.study._optimize - INFO - Trial 48 pruned. 
2026-05-15 10:47:19,331 - optuna.study._optimize - INFO - Trial 49 pruned. 
2026-05-15 10:47:24,145 - optuna.study._optimize - INFO - Trial 50 pruned. 
2026-05-15 10:47:57,568 - optuna.study.study - INFO - Trial 51 finished with value: 0.0696059309049408 and parameters: {'n_layers': 1, 'embedding_dim': 256, 'lr': 0.0010822578673777212, 'lambda_val': 0.030685262419721502, 'batch_size': 721, 'optimizer': 'Adam'}. Best is trial 44 with value: 0.09822568122403967.
2026-05-15 10:48:31,300 - optuna.study.study - INFO - Trial 52 finished with value: 0.0738250465908086 and parameters: {'n_layers': 1, 'embedding_dim': 256, 'lr': 0.0007070118724480346, 'lambda_val': 0.007513829214159744, 'batch_size': 832, 'optimizer': 'Adam'}. Best is trial 44 with value: 0.09822568122403967.
2026-05-15 10:48:57,547 - optuna.study.study - INFO - Trial 53 finished with value: 0.06499342105166989 and parameters: {'n_layers': 1, 'embedding_dim': 64, 'lr': 0.0007009519660652572, 'lambda_val': 0.0014065620920631877, 'batch_size': 900, 'optimizer': 'Adam'}. Best is trial 44 with value: 0.09822568122403967.
2026-05-15 10:49:30,819 - optuna.study.study - INFO - Trial 54 finished with value: 0.08045652864426732 and parameters: {'n_layers': 1, 'embedding_dim': 256, 'lr': 0.00020531150662527335, 'lambda_val': 0.004382386380568259, 'batch_size': 1123, 'optimizer': 'Adam'}. Best is trial 44 with value: 0.09822568122403967.
2026-05-15 10:49:33,919 - optuna.study._optimize - INFO - Trial 55 pruned. 
2026-05-15 10:49:58,879 - optuna.study._optimize - INFO - Trial 56 pruned. 
2026-05-15 10:50:02,034 - optuna.study._optimize - INFO - Trial 57 pruned. 
2026-05-15 10:50:05,898 - optuna.study._optimize - INFO - Trial 58 pruned. 
2026-05-15 10:50:28,715 - optuna.study.study - INFO - Trial 59 finished with value: 0.07028479868063403 and parameters: {'n_layers': 1, 'embedding_dim': 64, 'lr': 0.0002209089420858481, 'lambda_val': 0.00020851334101597995, 'batch_size': 1227, 'optimizer': 'Adam'}. Best is trial 44 with value: 0.09822568122403967.
2026-05-15 10:50:32,577 - optuna.study._optimize - INFO - Trial 60 pruned. 
2026-05-15 10:51:05,272 - optuna.study.study - INFO - Trial 61 finished with value: 0.07450184472193515 and parameters: {'n_layers': 1, 'embedding_dim': 256, 'lr': 0.0005611073394981786, 'lambda_val': 0.0097967206121049, 'batch_size': 820, 'optimizer': 'Adam'}. Best is trial 44 with value: 0.09822568122403967.
2026-05-15 10:51:39,135 - optuna.study.study - INFO - Trial 62 finished with value: 0.07663114923122924 and parameters: {'n_layers': 1, 'embedding_dim': 256, 'lr': 0.0005616236759021986, 'lambda_val': 0.021002313264741414, 'batch_size': 923, 'optimizer': 'Adam'}. Best is trial 44 with value: 0.09822568122403967.
2026-05-15 10:52:12,129 - optuna.study.study - INFO - Trial 63 finished with value: 0.08074558607069075 and parameters: {'n_layers': 1, 'embedding_dim': 256, 'lr': 0.0005345002954786924, 'lambda_val': 0.015137939460581167, 'batch_size': 895, 'optimizer': 'Adam'}. Best is trial 44 with value: 0.09822568122403967.
2026-05-15 10:52:16,513 - optuna.study._optimize - INFO - Trial 64 pruned. 
2026-05-15 10:52:20,232 - optuna.study._optimize - INFO - Trial 65 pruned. 
2026-05-15 10:52:25,322 - optuna.study._optimize - INFO - Trial 66 pruned. 
2026-05-15 10:52:57,638 - optuna.study.study - INFO - Trial 67 finished with value: 0.06536281371559867 and parameters: {'n_layers': 1, 'embedding_dim': 256, 'lr': 0.001652285416074054, 'lambda_val': 0.00476314285216452, 'batch_size': 881, 'optimizer': 'Adam'}. Best is trial 44 with value: 0.09822568122403967.
2026-05-15 10:53:29,812 - optuna.study.study - INFO - Trial 68 finished with value: 0.07367689304836265 and parameters: {'n_layers': 1, 'embedding_dim': 256, 'lr': 0.0007987594433671758, 'lambda_val': 2.0792578345803113e-05, 'batch_size': 1316, 'optimizer': 'Adam'}. Best is trial 44 with value: 0.09822568122403967.
2026-05-15 10:53:34,229 - optuna.study._optimize - INFO - Trial 69 pruned. 
2026-05-15 10:53:37,704 - optuna.study._optimize - INFO - Trial 70 pruned. 
2026-05-15 10:54:08,444 - optuna.study.study - INFO - Trial 71 finished with value: 0.07090010603713803 and parameters: {'n_layers': 1, 'embedding_dim': 256, 'lr': 0.00048497852582544694, 'lambda_val': 0.012725599234652586, 'batch_size': 846, 'optimizer': 'Adam'}. Best is trial 44 with value: 0.09822568122403967.
2026-05-15 10:54:15,105 - optuna.study._optimize - INFO - Trial 72 pruned. 
2026-05-15 10:54:19,419 - optuna.study._optimize - INFO - Trial 73 pruned. 
2026-05-15 10:54:23,771 - optuna.study._optimize - INFO - Trial 74 pruned. 
2026-05-15 10:54:28,919 - optuna.study._optimize - INFO - Trial 75 pruned. 
2026-05-15 10:54:32,885 - optuna.study._optimize - INFO - Trial 76 pruned. 
2026-05-15 10:54:36,494 - optuna.study._optimize - INFO - Trial 77 pruned. 
2026-05-15 10:54:53,225 - optuna.study._optimize - INFO - Trial 78 pruned. 
2026-05-15 10:55:24,838 - optuna.study.study - INFO - Trial 79 finished with value: 0.07996038192835062 and parameters: {'n_layers': 1, 'embedding_dim': 256, 'lr': 0.0002671499490540698, 'lambda_val': 0.008939709025768745, 'batch_size': 952, 'optimizer': 'Adam'}. Best is trial 44 with value: 0.09822568122403967.
2026-05-15 10:55:27,869 - optuna.study._optimize - INFO - Trial 80 pruned. 
2026-05-15 10:55:59,981 - optuna.study.study - INFO - Trial 81 finished with value: 0.07291390748050486 and parameters: {'n_layers': 1, 'embedding_dim': 256, 'lr': 0.0002835766330176445, 'lambda_val': 0.008083885408605582, 'batch_size': 959, 'optimizer': 'Adam'}. Best is trial 44 with value: 0.09822568122403967.
2026-05-15 10:56:33,651 - optuna.study.study - INFO - Trial 82 finished with value: 0.06442109801427141 and parameters: {'n_layers': 1, 'embedding_dim': 256, 'lr': 0.00036640770647492556, 'lambda_val': 0.004174449454130985, 'batch_size': 1066, 'optimizer': 'Adam'}. Best is trial 44 with value: 0.09822568122403967.
2026-05-15 10:56:37,800 - optuna.study._optimize - INFO - Trial 83 pruned. 
2026-05-15 10:57:24,633 - optuna.study.study - INFO - Trial 84 finished with value: 0.07334563705640582 and parameters: {'n_layers': 1, 'embedding_dim': 256, 'lr': 0.0005211923580051175, 'lambda_val': 0.011609972763458959, 'batch_size': 808, 'optimizer': 'Adam'}. Best is trial 44 with value: 0.09822568122403967.
2026-05-15 10:57:31,906 - optuna.study._optimize - INFO - Trial 85 pruned. 
2026-05-15 10:57:36,044 - optuna.study._optimize - INFO - Trial 86 pruned. 
2026-05-15 10:57:41,138 - optuna.study._optimize - INFO - Trial 87 pruned. 
2026-05-15 10:58:27,870 - optuna.study.study - INFO - Trial 88 finished with value: 0.06970748357357524 and parameters: {'n_layers': 1, 'embedding_dim': 256, 'lr': 0.0009329720408769599, 'lambda_val': 0.003164148818457177, 'batch_size': 713, 'optimizer': 'RMSprop'}. Best is trial 44 with value: 0.09822568122403967.
2026-05-15 10:58:55,721 - optuna.study.study - INFO - Trial 89 finished with value: 0.07940935120496966 and parameters: {'n_layers': 1, 'embedding_dim': 96, 'lr': 0.0003913530145706442, 'lambda_val': 5.793562787752096e-05, 'batch_size': 1399, 'optimizer': 'Adam'}. Best is trial 44 with value: 0.09822568122403967.
2026-05-15 10:59:23,017 - optuna.study.study - INFO - Trial 90 finished with value: 0.07418927408061786 and parameters: {'n_layers': 1, 'embedding_dim': 96, 'lr': 0.00039496255661302775, 'lambda_val': 5.4866405960491344e-05, 'batch_size': 1514, 'optimizer': 'RMSprop'}. Best is trial 44 with value: 0.09822568122403967.
2026-05-15 10:59:50,645 - optuna.study.study - INFO - Trial 91 finished with value: 0.06770664464070052 and parameters: {'n_layers': 1, 'embedding_dim': 96, 'lr': 0.0002747978779905543, 'lambda_val': 0.0001371785508779341, 'batch_size': 1386, 'optimizer': 'Adam'}. Best is trial 44 with value: 0.09822568122403967.
2026-05-15 11:00:18,595 - optuna.study.study - INFO - Trial 92 finished with value: 0.0748086882141897 and parameters: {'n_layers': 1, 'embedding_dim': 96, 'lr': 0.00033983518094344716, 'lambda_val': 2.699594511284386e-05, 'batch_size': 1773, 'optimizer': 'Adam'}. Best is trial 44 with value: 0.09822568122403967.
2026-05-15 11:00:43,477 - optuna.study.study - INFO - Trial 93 finished with value: 0.0966801878563703 and parameters: {'n_layers': 1, 'embedding_dim': 96, 'lr': 0.00018261034413328056, 'lambda_val': 2.2340422536524673e-05, 'batch_size': 1748, 'optimizer': 'Adam'}. Best is trial 44 with value: 0.09822568122403967.
2026-05-15 11:00:47,109 - optuna.study._optimize - INFO - Trial 94 pruned. 
2026-05-15 11:01:12,803 - optuna.study.study - INFO - Trial 95 finished with value: 0.08318662112452868 and parameters: {'n_layers': 1, 'embedding_dim': 96, 'lr': 0.000149220172914232, 'lambda_val': 8.436045960037177e-05, 'batch_size': 1690, 'optimizer': 'Adam'}. Best is trial 44 with value: 0.09822568122403967.
2026-05-15 11:01:16,863 - optuna.study._optimize - INFO - Trial 96 pruned. 
2026-05-15 11:01:20,361 - optuna.study._optimize - INFO - Trial 97 pruned. 
2026-05-15 11:01:23,836 - optuna.study._optimize - INFO - Trial 98 pruned. 
2026-05-15 11:01:50,956 - optuna.study.study - INFO - Trial 99 finished with value: 0.07893101248439206 and parameters: {'n_layers': 1, 'embedding_dim': 96, 'lr': 0.00025112681182587585, 'lambda_val': 7.403336719100479e-05, 'batch_size': 1292, 'optimizer': 'RMSprop'}. Best is trial 44 with value: 0.09822568122403967.
2026-05-15 11:01:55,802 - optuna.study._optimize - INFO - Trial 100 pruned. 
2026-05-15 11:02:31,901 - optuna.study.study - INFO - Trial 101 finished with value: 0.061186326093875115 and parameters: {'n_layers': 1, 'embedding_dim': 96, 'lr': 0.00025892813583577396, 'lambda_val': 7.751895997774728e-05, 'batch_size': 2455, 'optimizer': 'RMSprop'}. Best is trial 44 with value: 0.09822568122403967.
2026-05-15 11:02:58,779 - optuna.study.study - INFO - Trial 102 finished with value: 0.07456205931618322 and parameters: {'n_layers': 1, 'embedding_dim': 96, 'lr': 0.0001679650025018517, 'lambda_val': 0.00010697701343037648, 'batch_size': 1279, 'optimizer': 'RMSprop'}. Best is trial 44 with value: 0.09822568122403967.
2026-05-15 11:03:27,502 - optuna.study.study - INFO - Trial 103 finished with value: 0.05285557155426868 and parameters: {'n_layers': 1, 'embedding_dim': 96, 'lr': 0.00041551920685958864, 'lambda_val': 1.7825962415380923e-05, 'batch_size': 2816, 'optimizer': 'RMSprop'}. Best is trial 44 with value: 0.09822568122403967.
2026-05-15 11:03:54,829 - optuna.study.study - INFO - Trial 104 finished with value: 0.07530994119794114 and parameters: {'n_layers': 1, 'embedding_dim': 96, 'lr': 0.0003153899867898039, 'lambda_val': 0.00015443285478998015, 'batch_size': 1441, 'optimizer': 'RMSprop'}. Best is trial 44 with value: 0.09822568122403967.
2026-05-15 11:04:21,387 - optuna.study.study - INFO - Trial 105 finished with value: 0.07826570446606619 and parameters: {'n_layers': 1, 'embedding_dim': 96, 'lr': 0.000241045255206085, 'lambda_val': 5.535038229611335e-05, 'batch_size': 1167, 'optimizer': 'Adam'}. Best is trial 44 with value: 0.09822568122403967.
2026-05-15 11:04:44,514 - optuna.study.study - INFO - Trial 106 finished with value: 0.078712417729575 and parameters: {'n_layers': 1, 'embedding_dim': 96, 'lr': 0.00020031691895302188, 'lambda_val': 5.313120307415809e-05, 'batch_size': 1339, 'optimizer': 'RMSprop'}. Best is trial 44 with value: 0.09822568122403967.
2026-05-15 11:05:08,097 - optuna.study.study - INFO - Trial 107 finished with value: 0.07572437493672814 and parameters: {'n_layers': 1, 'embedding_dim': 96, 'lr': 0.0002052341661421345, 'lambda_val': 2.8904716091039062e-05, 'batch_size': 1349, 'optimizer': 'RMSprop'}. Best is trial 44 with value: 0.09822568122403967.
2026-05-15 11:05:11,383 - optuna.study._optimize - INFO - Trial 108 pruned. 
2026-05-15 11:05:14,846 - optuna.study._optimize - INFO - Trial 109 pruned. 
2026-05-15 11:05:18,677 - optuna.study._optimize - INFO - Trial 110 pruned. 
2026-05-15 11:05:42,649 - optuna.study.study - INFO - Trial 111 finished with value: 0.07280607815754041 and parameters: {'n_layers': 1, 'embedding_dim': 96, 'lr': 0.0002462628987146347, 'lambda_val': 5.710393874911334e-05, 'batch_size': 1155, 'optimizer': 'RMSprop'}. Best is trial 44 with value: 0.09822568122403967.
2026-05-15 11:05:46,161 - optuna.study._optimize - INFO - Trial 112 pruned. 
2026-05-15 11:06:11,724 - optuna.study.study - INFO - Trial 113 finished with value: 0.10007790247808293 and parameters: {'n_layers': 1, 'embedding_dim': 96, 'lr': 0.00021424260915201137, 'lambda_val': 2.2426900612175306e-05, 'batch_size': 1331, 'optimizer': 'Adam'}. Best is trial 113 with value: 0.10007790247808293.
2026-05-15 11:06:14,531 - optuna.study._optimize - INFO - Trial 114 pruned. 
2026-05-15 11:06:38,720 - optuna.study.study - INFO - Trial 115 finished with value: 0.09150590070664008 and parameters: {'n_layers': 1, 'embedding_dim': 96, 'lr': 0.0003037422754162229, 'lambda_val': 2.9760861754150602e-06, 'batch_size': 1600, 'optimizer': 'RMSprop'}. Best is trial 113 with value: 0.10007790247808293.
2026-05-15 11:06:45,766 - optuna.study._optimize - INFO - Trial 116 pruned. 
2026-05-15 11:07:10,741 - optuna.study.study - INFO - Trial 117 finished with value: 0.08320715480224765 and parameters: {'n_layers': 1, 'embedding_dim': 96, 'lr': 0.00031553991216402014, 'lambda_val': 4.60105389579493e-06, 'batch_size': 1837, 'optimizer': 'Adam'}. Best is trial 113 with value: 0.10007790247808293.
2026-05-15 11:07:13,820 - optuna.study._optimize - INFO - Trial 118 pruned. 
2026-05-15 11:07:30,026 - optuna.study._optimize - INFO - Trial 119 pruned. 
2026-05-15 11:07:54,272 - optuna.study.study - INFO - Trial 120 finished with value: 0.04928875026352333 and parameters: {'n_layers': 1, 'embedding_dim': 96, 'lr': 0.0006651295769239163, 'lambda_val': 5.865889835676699e-06, 'batch_size': 1725, 'optimizer': 'Adam'}. Best is trial 113 with value: 0.10007790247808293.
2026-05-15 11:08:17,974 - optuna.study.study - INFO - Trial 121 finished with value: 0.08195974403590285 and parameters: {'n_layers': 1, 'embedding_dim': 96, 'lr': 0.00037931658242677097, 'lambda_val': 7.10022777781835e-06, 'batch_size': 1813, 'optimizer': 'Adam'}. Best is trial 113 with value: 0.10007790247808293.
2026-05-15 11:08:44,680 - optuna.study.study - INFO - Trial 122 finished with value: 0.06377922000892014 and parameters: {'n_layers': 1, 'embedding_dim': 96, 'lr': 0.00037639178336166694, 'lambda_val': 3.6888602434902e-06, 'batch_size': 2077, 'optimizer': 'Adam'}. Best is trial 113 with value: 0.10007790247808293.
2026-05-15 11:09:12,510 - optuna.study.study - INFO - Trial 123 finished with value: 0.07948887323300785 and parameters: {'n_layers': 1, 'embedding_dim': 96, 'lr': 0.0004504780958029545, 'lambda_val': 4.719090182174374e-06, 'batch_size': 1795, 'optimizer': 'Adam'}. Best is trial 113 with value: 0.10007790247808293.
2026-05-15 11:09:40,090 - optuna.study.study - INFO - Trial 124 finished with value: 0.07599679511385143 and parameters: {'n_layers': 1, 'embedding_dim': 96, 'lr': 0.00047296827288342835, 'lambda_val': 8.445262781975025e-06, 'batch_size': 1843, 'optimizer': 'Adam'}. Best is trial 113 with value: 0.10007790247808293.
2026-05-15 11:09:46,201 - optuna.study._optimize - INFO - Trial 125 pruned. 
2026-05-15 11:10:14,317 - optuna.study.study - INFO - Trial 126 finished with value: 0.07470470461273405 and parameters: {'n_layers': 1, 'embedding_dim': 96, 'lr': 0.0003301123998518437, 'lambda_val': 2.169398484304849e-06, 'batch_size': 2014, 'optimizer': 'Adam'}. Best is trial 113 with value: 0.10007790247808293.
2026-05-15 11:10:20,698 - optuna.study._optimize - INFO - Trial 127 pruned. 
2026-05-15 11:10:26,266 - optuna.study._optimize - INFO - Trial 128 pruned. 
2026-05-15 11:10:55,365 - optuna.study.study - INFO - Trial 129 finished with value: 0.03993079679558517 and parameters: {'n_layers': 1, 'embedding_dim': 96, 'lr': 0.0008062581467762251, 'lambda_val': 4.0439111050604895e-06, 'batch_size': 3877, 'optimizer': 'Adam'}. Best is trial 113 with value: 0.10007790247808293.
2026-05-15 11:10:59,136 - optuna.study._optimize - INFO - Trial 130 pruned. 
2026-05-15 11:11:26,677 - optuna.study.study - INFO - Trial 131 finished with value: 0.08729547336283272 and parameters: {'n_layers': 1, 'embedding_dim': 96, 'lr': 0.0003951785186777083, 'lambda_val': 5.398591859448597e-06, 'batch_size': 1759, 'optimizer': 'Adam'}. Best is trial 113 with value: 0.10007790247808293.
2026-05-15 11:11:53,660 - optuna.study.study - INFO - Trial 132 finished with value: 0.07811160352295471 and parameters: {'n_layers': 1, 'embedding_dim': 96, 'lr': 0.00022262117001930793, 'lambda_val': 9.293881068603915e-06, 'batch_size': 1786, 'optimizer': 'Adam'}. Best is trial 113 with value: 0.10007790247808293.
2026-05-15 11:12:21,299 - optuna.study.study - INFO - Trial 133 finished with value: 0.0683515410580269 and parameters: {'n_layers': 1, 'embedding_dim': 96, 'lr': 0.00028722217171257657, 'lambda_val': 6.035524671177945e-06, 'batch_size': 2029, 'optimizer': 'Adam'}. Best is trial 113 with value: 0.10007790247808293.
2026-05-15 11:12:48,525 - optuna.study.study - INFO - Trial 134 finished with value: 0.06882920064949974 and parameters: {'n_layers': 1, 'embedding_dim': 96, 'lr': 0.0004414161921523268, 'lambda_val': 4.56688164542054e-06, 'batch_size': 1894, 'optimizer': 'Adam'}. Best is trial 113 with value: 0.10007790247808293.
2026-05-15 11:12:51,986 - optuna.study._optimize - INFO - Trial 135 pruned. 
2026-05-15 11:13:19,611 - optuna.study.study - INFO - Trial 136 finished with value: 0.06319530846121112 and parameters: {'n_layers': 1, 'embedding_dim': 96, 'lr': 0.0006485214861033727, 'lambda_val': 3.011973488958922e-06, 'batch_size': 1594, 'optimizer': 'Adam'}. Best is trial 113 with value: 0.10007790247808293.
2026-05-15 11:13:23,875 - optuna.study._optimize - INFO - Trial 137 pruned. 
2026-05-15 11:13:27,877 - optuna.study._optimize - INFO - Trial 138 pruned. 
2026-05-15 11:13:31,672 - optuna.study._optimize - INFO - Trial 139 pruned. 
2026-05-15 11:14:00,138 - optuna.study.study - INFO - Trial 140 finished with value: 0.07515888196179267 and parameters: {'n_layers': 1, 'embedding_dim': 128, 'lr': 0.0003728134246526817, 'lambda_val': 1.2804483847958505e-05, 'batch_size': 1683, 'optimizer': 'Adam'}. Best is trial 113 with value: 0.10007790247808293.
2026-05-15 11:14:28,328 - optuna.study.study - INFO - Trial 141 finished with value: 0.09160975633505435 and parameters: {'n_layers': 1, 'embedding_dim': 96, 'lr': 0.00026129320050196394, 'lambda_val': 0.0001599010661793128, 'batch_size': 1448, 'optimizer': 'Adam'}. Best is trial 113 with value: 0.10007790247808293.
2026-05-15 11:14:55,442 - optuna.study.study - INFO - Trial 142 finished with value: 0.08712685336610257 and parameters: {'n_layers': 1, 'embedding_dim': 96, 'lr': 0.0002655885783346998, 'lambda_val': 0.00042054418631367094, 'batch_size': 1468, 'optimizer': 'Adam'}. Best is trial 113 with value: 0.10007790247808293.
2026-05-15 11:14:59,547 - optuna.study._optimize - INFO - Trial 143 pruned. 
2026-05-15 11:15:03,548 - optuna.study._optimize - INFO - Trial 144 pruned. 
2026-05-15 11:15:07,181 - optuna.study._optimize - INFO - Trial 145 pruned. 
2026-05-15 11:15:11,341 - optuna.study._optimize - INFO - Trial 146 pruned. 
2026-05-15 11:15:14,860 - optuna.study._optimize - INFO - Trial 147 pruned. 
2026-05-15 11:15:48,794 - optuna.study.study - INFO - Trial 148 finished with value: 0.10034987973370264 and parameters: {'n_layers': 1, 'embedding_dim': 256, 'lr': 0.000271634339589946, 'lambda_val': 0.0001310959506871398, 'batch_size': 1638, 'optimizer': 'Adam'}. Best is trial 148 with value: 0.10034987973370264.
2026-05-15 11:16:16,454 - optuna.study.study - INFO - Trial 149 finished with value: 0.07113302220544952 and parameters: {'n_layers': 1, 'embedding_dim': 96, 'lr': 0.0003637036331583545, 'lambda_val': 0.00017729606172426789, 'batch_size': 1718, 'optimizer': 'Adam'}. Best is trial 148 with value: 0.10034987973370264.
2026-05-15 11:16:20,727 - optuna.study._optimize - INFO - Trial 150 pruned. 
2026-05-15 11:16:54,445 - optuna.study.study - INFO - Trial 151 finished with value: 0.09346925588983085 and parameters: {'n_layers': 1, 'embedding_dim': 256, 'lr': 0.0002564629595363313, 'lambda_val': 0.000128425514568688, 'batch_size': 1656, 'optimizer': 'Adam'}. Best is trial 148 with value: 0.10034987973370264.
