2026-05-15 04:09:52,883 - optuna.study._optimize - INFO - Trial 97 pruned. 
2026-05-15 04:10:05,807 - optuna.study._optimize - INFO - Trial 98 pruned. 
2026-05-15 04:10:14,620 - optuna.study._optimize - INFO - Trial 99 pruned. 
2026-05-15 04:10:40,158 - optuna.study._optimize - INFO - Trial 100 pruned. 
2026-05-15 04:12:14,439 - optuna.study.study - INFO - Trial 101 finished with value: 0.09293036166173069 and parameters: {'n_layers': 1, 'embedding_dim': 256, 'lr': 0.006084763974404179, 'lambda_val': 0.0009942165959405656, 'batch_size': 2869, 'optimizer': 'RMSprop'}. Best is trial 72 with value: 0.09402790817430869.
2026-05-15 04:12:55,461 - optuna.study.study - INFO - Trial 102 finished with value: 0.09477490890899676 and parameters: {'n_layers': 1, 'embedding_dim': 256, 'lr': 0.00885181538324648, 'lambda_val': 0.0005499699154934166, 'batch_size': 3211, 'optimizer': 'RMSprop'}. Best is trial 102 with value: 0.09477490890899676.
2026-05-15 04:13:03,080 - optuna.study._optimize - INFO - Trial 103 pruned. 
2026-05-15 04:13:39,961 - optuna.study.study - INFO - Trial 104 finished with value: 0.08838222035889445 and parameters: {'n_layers': 1, 'embedding_dim': 256, 'lr': 0.006761497141783553, 'lambda_val': 0.0017581007395626358, 'batch_size': 3257, 'optimizer': 'RMSprop'}. Best is trial 102 with value: 0.09477490890899676.
2026-05-15 04:14:10,770 - optuna.study.study - INFO - Trial 105 finished with value: 0.0850365684433391 and parameters: {'n_layers': 1, 'embedding_dim': 64, 'lr': 0.014777795428194821, 'lambda_val': 0.0017684658012433595, 'batch_size': 3204, 'optimizer': 'RMSprop'}. Best is trial 102 with value: 0.09477490890899676.
2026-05-15 04:14:15,168 - optuna.study._optimize - INFO - Trial 106 pruned. 
2026-05-15 04:14:19,950 - optuna.study._optimize - INFO - Trial 107 pruned. 
2026-05-15 04:15:02,973 - optuna.study.study - INFO - Trial 108 finished with value: 0.08404697675947093 and parameters: {'n_layers': 1, 'embedding_dim': 256, 'lr': 0.006971649589121334, 'lambda_val': 0.0002613738543121771, 'batch_size': 3224, 'optimizer': 'RMSprop'}. Best is trial 102 with value: 0.09477490890899676.
2026-05-15 04:15:43,549 - optuna.study.study - INFO - Trial 109 finished with value: 0.08957774366936976 and parameters: {'n_layers': 1, 'embedding_dim': 256, 'lr': 0.011121061176947231, 'lambda_val': 0.002437959292165541, 'batch_size': 2966, 'optimizer': 'RMSprop'}. Best is trial 102 with value: 0.09477490890899676.
2026-05-15 04:16:17,746 - optuna.study.study - INFO - Trial 110 finished with value: 0.08717507012068193 and parameters: {'n_layers': 1, 'embedding_dim': 128, 'lr': 0.011875037460224409, 'lambda_val': 0.002648615763009257, 'batch_size': 3365, 'optimizer': 'RMSprop'}. Best is trial 102 with value: 0.09477490890899676.
2026-05-15 04:16:55,316 - optuna.study.study - INFO - Trial 111 finished with value: 0.09363728859096652 and parameters: {'n_layers': 1, 'embedding_dim': 256, 'lr': 0.009769348372803483, 'lambda_val': 0.001553251317088582, 'batch_size': 2979, 'optimizer': 'RMSprop'}. Best is trial 102 with value: 0.09477490890899676.
2026-05-15 04:17:33,897 - optuna.study.study - INFO - Trial 112 finished with value: 0.09003546042897942 and parameters: {'n_layers': 1, 'embedding_dim': 256, 'lr': 0.009701645642365432, 'lambda_val': 0.0018496527074712394, 'batch_size': 2970, 'optimizer': 'RMSprop'}. Best is trial 102 with value: 0.09477490890899676.
2026-05-15 04:17:38,301 - optuna.study._optimize - INFO - Trial 113 pruned. 
2026-05-15 04:18:17,285 - optuna.study.study - INFO - Trial 114 finished with value: 0.088057125495644 and parameters: {'n_layers': 1, 'embedding_dim': 256, 'lr': 0.01628522418581198, 'lambda_val': 0.002173430618739504, 'batch_size': 2870, 'optimizer': 'RMSprop'}. Best is trial 102 with value: 0.09477490890899676.
2026-05-15 04:18:56,209 - optuna.study.study - INFO - Trial 115 finished with value: 0.09441660436766781 and parameters: {'n_layers': 1, 'embedding_dim': 256, 'lr': 0.010652524091022377, 'lambda_val': 0.0010091783971044276, 'batch_size': 3130, 'optimizer': 'RMSprop'}. Best is trial 102 with value: 0.09477490890899676.
2026-05-15 04:19:00,462 - optuna.study._optimize - INFO - Trial 116 pruned. 
2026-05-15 04:19:04,810 - optuna.study._optimize - INFO - Trial 117 pruned. 
2026-05-15 04:19:41,473 - optuna.study.study - INFO - Trial 118 finished with value: 0.08235659108891974 and parameters: {'n_layers': 1, 'embedding_dim': 256, 'lr': 0.014222676777234355, 'lambda_val': 0.0030161838481198274, 'batch_size': 3190, 'optimizer': 'RMSprop'}. Best is trial 102 with value: 0.09477490890899676.
2026-05-15 04:19:45,503 - optuna.study._optimize - INFO - Trial 119 pruned. 
2026-05-15 04:19:50,544 - optuna.study._optimize - INFO - Trial 120 pruned. 
2026-05-15 04:20:29,106 - optuna.study.study - INFO - Trial 121 finished with value: 0.0940618176664224 and parameters: {'n_layers': 1, 'embedding_dim': 256, 'lr': 0.01094595131882439, 'lambda_val': 0.0016965338164870389, 'batch_size': 2720, 'optimizer': 'RMSprop'}. Best is trial 102 with value: 0.09477490890899676.
2026-05-15 04:21:08,417 - optuna.study.study - INFO - Trial 122 finished with value: 0.09335925957084236 and parameters: {'n_layers': 1, 'embedding_dim': 256, 'lr': 0.011350716676077365, 'lambda_val': 0.0017103183404079386, 'batch_size': 2706, 'optimizer': 'RMSprop'}. Best is trial 102 with value: 0.09477490890899676.
2026-05-15 04:21:45,945 - optuna.study.study - INFO - Trial 123 finished with value: 0.08672708675551007 and parameters: {'n_layers': 1, 'embedding_dim': 256, 'lr': 0.011129345931970685, 'lambda_val': 0.0024266138364454383, 'batch_size': 2688, 'optimizer': 'RMSprop'}. Best is trial 102 with value: 0.09477490890899676.
2026-05-15 04:22:23,129 - optuna.study.study - INFO - Trial 124 finished with value: 0.08769445992056772 and parameters: {'n_layers': 1, 'embedding_dim': 256, 'lr': 0.006135105292498531, 'lambda_val': 0.0018549313973924757, 'batch_size': 2426, 'optimizer': 'RMSprop'}. Best is trial 102 with value: 0.09477490890899676.
2026-05-15 04:23:03,104 - optuna.study.study - INFO - Trial 125 finished with value: 0.09997199297730874 and parameters: {'n_layers': 1, 'embedding_dim': 256, 'lr': 0.011556092770268096, 'lambda_val': 0.001533305893665387, 'batch_size': 2833, 'optimizer': 'RMSprop'}. Best is trial 125 with value: 0.09997199297730874.
2026-05-15 04:23:07,217 - optuna.study._optimize - INFO - Trial 126 pruned. 
2026-05-15 04:23:44,163 - optuna.study.study - INFO - Trial 127 finished with value: 0.09683147828699744 and parameters: {'n_layers': 1, 'embedding_dim': 256, 'lr': 0.010741749434044467, 'lambda_val': 0.0015697929817276325, 'batch_size': 2743, 'optimizer': 'RMSprop'}. Best is trial 125 with value: 0.09997199297730874.
2026-05-15 04:24:21,402 - optuna.study.study - INFO - Trial 128 finished with value: 0.0961780783629361 and parameters: {'n_layers': 1, 'embedding_dim': 256, 'lr': 0.008690952486468137, 'lambda_val': 0.0017067535466319702, 'batch_size': 2700, 'optimizer': 'RMSprop'}. Best is trial 125 with value: 0.09997199297730874.
2026-05-15 04:24:26,160 - optuna.study._optimize - INFO - Trial 129 pruned. 
2026-05-15 04:25:04,307 - optuna.study.study - INFO - Trial 130 finished with value: 0.09841560940170135 and parameters: {'n_layers': 1, 'embedding_dim': 256, 'lr': 0.005821857726159603, 'lambda_val': 0.0010114227357382324, 'batch_size': 2621, 'optimizer': 'RMSprop'}. Best is trial 125 with value: 0.09997199297730874.
2026-05-15 04:25:41,446 - optuna.study.study - INFO - Trial 131 finished with value: 0.09892480013449903 and parameters: {'n_layers': 1, 'embedding_dim': 256, 'lr': 0.008663527449271584, 'lambda_val': 0.0010236370174553902, 'batch_size': 2604, 'optimizer': 'RMSprop'}. Best is trial 125 with value: 0.09997199297730874.
2026-05-15 04:26:16,719 - optuna.study.study - INFO - Trial 132 finished with value: 0.09489363442471667 and parameters: {'n_layers': 1, 'embedding_dim': 256, 'lr': 0.008662993390415643, 'lambda_val': 0.000988401718182281, 'batch_size': 2248, 'optimizer': 'RMSprop'}. Best is trial 125 with value: 0.09997199297730874.
2026-05-15 04:26:51,807 - optuna.study.study - INFO - Trial 133 finished with value: 0.10010218432874743 and parameters: {'n_layers': 1, 'embedding_dim': 256, 'lr': 0.009185993726638498, 'lambda_val': 0.0010835633152350848, 'batch_size': 2204, 'optimizer': 'RMSprop'}. Best is trial 133 with value: 0.10010218432874743.
2026-05-15 04:27:28,118 - optuna.study.study - INFO - Trial 134 finished with value: 0.08919446835927128 and parameters: {'n_layers': 1, 'embedding_dim': 256, 'lr': 0.008726372736156139, 'lambda_val': 0.0015496912406286502, 'batch_size': 2276, 'optimizer': 'RMSprop'}. Best is trial 133 with value: 0.10010218432874743.
2026-05-15 04:28:04,715 - optuna.study.study - INFO - Trial 135 finished with value: 0.09406717381252179 and parameters: {'n_layers': 1, 'embedding_dim': 256, 'lr': 0.011548959454420096, 'lambda_val': 0.0007944945764778949, 'batch_size': 2205, 'optimizer': 'RMSprop'}. Best is trial 133 with value: 0.10010218432874743.
2026-05-15 04:28:13,863 - optuna.study._optimize - INFO - Trial 136 pruned. 
2026-05-15 04:28:48,137 - optuna.study.study - INFO - Trial 137 finished with value: 0.09613223472233973 and parameters: {'n_layers': 1, 'embedding_dim': 256, 'lr': 0.004970332589570776, 'lambda_val': 0.0011203647094553725, 'batch_size': 2184, 'optimizer': 'RMSprop'}. Best is trial 133 with value: 0.10010218432874743.
2026-05-15 04:29:29,790 - optuna.study.study - INFO - Trial 138 finished with value: 0.09692490764491522 and parameters: {'n_layers': 1, 'embedding_dim': 256, 'lr': 0.013846981330060392, 'lambda_val': 0.0008684227350985875, 'batch_size': 2368, 'optimizer': 'RMSprop'}. Best is trial 133 with value: 0.10010218432874743.
2026-05-15 04:30:08,913 - optuna.study.study - INFO - Trial 139 finished with value: 0.09735148254436363 and parameters: {'n_layers': 1, 'embedding_dim': 256, 'lr': 0.014481464997064812, 'lambda_val': 0.0006397227121075626, 'batch_size': 2360, 'optimizer': 'RMSprop'}. Best is trial 133 with value: 0.10010218432874743.
2026-05-15 04:30:13,206 - optuna.study._optimize - INFO - Trial 140 pruned. 
2026-05-15 04:30:17,814 - optuna.study._optimize - INFO - Trial 141 pruned. 
2026-05-15 04:30:26,038 - optuna.study._optimize - INFO - Trial 142 pruned. 
2026-05-15 04:30:30,653 - optuna.study._optimize - INFO - Trial 143 pruned. 
2026-05-15 04:31:06,889 - optuna.study.study - INFO - Trial 144 finished with value: 0.09353818576085238 and parameters: {'n_layers': 1, 'embedding_dim': 256, 'lr': 0.008651609559813981, 'lambda_val': 0.0011294452443209298, 'batch_size': 2246, 'optimizer': 'RMSprop'}. Best is trial 133 with value: 0.10010218432874743.
2026-05-15 04:31:44,172 - optuna.study.study - INFO - Trial 145 finished with value: 0.09415316941188394 and parameters: {'n_layers': 1, 'embedding_dim': 256, 'lr': 0.005004292395833443, 'lambda_val': 0.0008422355212068051, 'batch_size': 2475, 'optimizer': 'RMSprop'}. Best is trial 133 with value: 0.10010218432874743.
2026-05-15 04:31:47,946 - optuna.study._optimize - INFO - Trial 146 pruned. 
2026-05-15 04:32:32,950 - optuna.study.study - INFO - Trial 147 finished with value: 0.09757756547794989 and parameters: {'n_layers': 1, 'embedding_dim': 256, 'lr': 0.0047096143701706745, 'lambda_val': 0.0008871918474598691, 'batch_size': 2593, 'optimizer': 'RMSprop'}. Best is trial 133 with value: 0.10010218432874743.
2026-05-15 04:33:07,982 - optuna.study.study - INFO - Trial 148 finished with value: 0.09333782140225254 and parameters: {'n_layers': 1, 'embedding_dim': 256, 'lr': 0.004640535781122225, 'lambda_val': 0.0008380842587598696, 'batch_size': 2620, 'optimizer': 'RMSprop'}. Best is trial 133 with value: 0.10010218432874743.
2026-05-15 04:33:41,610 - optuna.study.study - INFO - Trial 149 finished with value: 0.08857618047341895 and parameters: {'n_layers': 1, 'embedding_dim': 256, 'lr': 0.004558650602315516, 'lambda_val': 0.0006414501315922597, 'batch_size': 2304, 'optimizer': 'RMSprop'}. Best is trial 133 with value: 0.10010218432874743.
2026-05-15 04:34:15,811 - optuna.study.study - INFO - Trial 150 finished with value: 0.09325954201937839 and parameters: {'n_layers': 1, 'embedding_dim': 256, 'lr': 0.008187536017588072, 'lambda_val': 0.000891755751608179, 'batch_size': 2207, 'optimizer': 'RMSprop'}. Best is trial 133 with value: 0.10010218432874743.
2026-05-15 04:35:02,409 - optuna.study.study - INFO - Trial 151 finished with value: 0.09693088763927017 and parameters: {'n_layers': 1, 'embedding_dim': 256, 'lr': 0.010649137482288087, 'lambda_val': 0.001168632267701977, 'batch_size': 2467, 'optimizer': 'RMSprop'}. Best is trial 133 with value: 0.10010218432874743.
2026-05-15 04:35:37,334 - optuna.study.study - INFO - Trial 152 finished with value: 0.09436914555340982 and parameters: {'n_layers': 1, 'embedding_dim': 256, 'lr': 0.005082207885368522, 'lambda_val': 0.0011691677876962455, 'batch_size': 2387, 'optimizer': 'RMSprop'}. Best is trial 133 with value: 0.10010218432874743.
2026-05-15 04:36:16,179 - optuna.study.study - INFO - Trial 153 finished with value: 0.09026095996634546 and parameters: {'n_layers': 1, 'embedding_dim': 256, 'lr': 0.0037810787905593985, 'lambda_val': 0.0011575931254793666, 'batch_size': 2474, 'optimizer': 'RMSprop'}. Best is trial 133 with value: 0.10010218432874743.
2026-05-15 04:36:53,014 - optuna.study.study - INFO - Trial 154 finished with value: 0.08789062046345275 and parameters: {'n_layers': 1, 'embedding_dim': 256, 'lr': 0.0062486576579532434, 'lambda_val': 0.001015329242849268, 'batch_size': 2376, 'optimizer': 'RMSprop'}. Best is trial 133 with value: 0.10010218432874743.
2026-05-15 04:36:57,538 - optuna.study._optimize - INFO - Trial 155 pruned. 
2026-05-15 04:37:05,650 - optuna.study._optimize - INFO - Trial 156 pruned. 
2026-05-15 04:37:42,713 - optuna.study.study - INFO - Trial 157 finished with value: 0.09538651035670856 and parameters: {'n_layers': 1, 'embedding_dim': 256, 'lr': 0.00487384579456447, 'lambda_val': 0.0012921256468141026, 'batch_size': 2620, 'optimizer': 'RMSprop'}. Best is trial 133 with value: 0.10010218432874743.
2026-05-15 04:38:20,846 - optuna.study.study - INFO - Trial 158 finished with value: 0.09412402428370742 and parameters: {'n_layers': 1, 'embedding_dim': 256, 'lr': 0.007661025894085785, 'lambda_val': 0.001301009534147162, 'batch_size': 2616, 'optimizer': 'RMSprop'}. Best is trial 133 with value: 0.10010218432874743.
2026-05-15 04:39:12,267 - optuna.study.study - INFO - Trial 159 finished with value: 0.09647180449390136 and parameters: {'n_layers': 1, 'embedding_dim': 256, 'lr': 0.005207898175607533, 'lambda_val': 0.0020599380787999924, 'batch_size': 2314, 'optimizer': 'RMSprop'}. Best is trial 133 with value: 0.10010218432874743.
2026-05-15 04:39:17,024 - optuna.study._optimize - INFO - Trial 160 pruned. 
2026-05-15 04:39:21,843 - optuna.study._optimize - INFO - Trial 161 pruned. 
2026-05-15 04:39:26,508 - optuna.study._optimize - INFO - Trial 162 pruned. 
2026-05-15 04:40:01,080 - optuna.study.study - INFO - Trial 163 finished with value: 0.0939724272344792 and parameters: {'n_layers': 1, 'embedding_dim': 256, 'lr': 0.007077635294128783, 'lambda_val': 0.0012877080849323633, 'batch_size': 2288, 'optimizer': 'RMSprop'}. Best is trial 133 with value: 0.10010218432874743.
2026-05-15 04:40:40,067 - optuna.study.study - INFO - Trial 164 finished with value: 0.09077743912550842 and parameters: {'n_layers': 1, 'embedding_dim': 256, 'lr': 0.0061507434490045655, 'lambda_val': 0.0010243190565872291, 'batch_size': 2767, 'optimizer': 'RMSprop'}. Best is trial 133 with value: 0.10010218432874743.
2026-05-15 04:41:16,849 - optuna.study.study - INFO - Trial 165 finished with value: 0.08979455029799485 and parameters: {'n_layers': 1, 'embedding_dim': 256, 'lr': 0.008264531538316423, 'lambda_val': 0.0006800259136789267, 'batch_size': 2545, 'optimizer': 'RMSprop'}. Best is trial 133 with value: 0.10010218432874743.
2026-05-15 04:41:20,735 - optuna.study._optimize - INFO - Trial 166 pruned. 
2026-05-15 04:41:27,887 - optuna.study._optimize - INFO - Trial 167 pruned. 
2026-05-15 04:41:32,307 - optuna.study._optimize - INFO - Trial 168 pruned. 
2026-05-15 04:42:07,941 - optuna.study.study - INFO - Trial 169 finished with value: 0.08759737906655496 and parameters: {'n_layers': 1, 'embedding_dim': 256, 'lr': 0.006781194565710825, 'lambda_val': 0.00040449314407633953, 'batch_size': 2473, 'optimizer': 'RMSprop'}. Best is trial 133 with value: 0.10010218432874743.
2026-05-15 04:42:14,068 - optuna.study._optimize - INFO - Trial 170 pruned. 
2026-05-15 04:42:50,810 - optuna.study.study - INFO - Trial 171 finished with value: 0.09226332279250958 and parameters: {'n_layers': 1, 'embedding_dim': 256, 'lr': 0.004544528753257444, 'lambda_val': 0.0008752182243603168, 'batch_size': 2429, 'optimizer': 'RMSprop'}. Best is trial 133 with value: 0.10010218432874743.
2026-05-15 04:43:24,811 - optuna.study.study - INFO - Trial 172 finished with value: 0.09182522643495064 and parameters: {'n_layers': 1, 'embedding_dim': 256, 'lr': 0.0033800956951328637, 'lambda_val': 0.00060925966295329, 'batch_size': 2484, 'optimizer': 'RMSprop'}. Best is trial 133 with value: 0.10010218432874743.
2026-05-15 04:44:02,403 - optuna.study.study - INFO - Trial 173 finished with value: 0.09080887365109898 and parameters: {'n_layers': 1, 'embedding_dim': 256, 'lr': 0.004924255443527264, 'lambda_val': 0.0014384965226168947, 'batch_size': 2580, 'optimizer': 'RMSprop'}. Best is trial 133 with value: 0.10010218432874743.
2026-05-15 04:44:39,987 - optuna.study.study - INFO - Trial 174 finished with value: 0.10057781758305853 and parameters: {'n_layers': 1, 'embedding_dim': 256, 'lr': 0.007911177222025742, 'lambda_val': 0.0007997026861349108, 'batch_size': 2381, 'optimizer': 'RMSprop'}. Best is trial 174 with value: 0.10057781758305853.
2026-05-15 04:45:15,449 - optuna.study.study - INFO - Trial 175 finished with value: 0.097935495275923 and parameters: {'n_layers': 1, 'embedding_dim': 256, 'lr': 0.008263526370080765, 'lambda_val': 0.0011533180982208706, 'batch_size': 2173, 'optimizer': 'RMSprop'}. Best is trial 174 with value: 0.10057781758305853.
2026-05-15 04:45:20,773 - optuna.study._optimize - INFO - Trial 176 pruned. 
2026-05-15 04:45:25,222 - optuna.study._optimize - INFO - Trial 177 pruned. 
2026-05-15 04:45:29,527 - optuna.study._optimize - INFO - Trial 178 pruned. 
2026-05-15 04:46:05,099 - optuna.study.study - INFO - Trial 179 finished with value: 0.10340409334543613 and parameters: {'n_layers': 1, 'embedding_dim': 256, 'lr': 0.00012374458262572993, 'lambda_val': 0.0010051274717894586, 'batch_size': 2211, 'optimizer': 'RMSprop'}. Best is trial 179 with value: 0.10340409334543613.
2026-05-15 04:46:40,011 - optuna.study.study - INFO - Trial 180 finished with value: 0.058280503254271726 and parameters: {'n_layers': 1, 'embedding_dim': 256, 'lr': 0.0004595339632306927, 'lambda_val': 0.0015278843192810256, 'batch_size': 2218, 'optimizer': 'RMSprop'}. Best is trial 179 with value: 0.10340409334543613.
2026-05-15 04:47:15,327 - optuna.study.study - INFO - Trial 181 finished with value: 0.06926349363127868 and parameters: {'n_layers': 1, 'embedding_dim': 256, 'lr': 0.0001848041276724904, 'lambda_val': 0.001003019129742452, 'batch_size': 2137, 'optimizer': 'RMSprop'}. Best is trial 179 with value: 0.10340409334543613.
2026-05-15 04:47:19,476 - optuna.study._optimize - INFO - Trial 182 pruned. 
2026-05-15 04:47:25,236 - optuna.study._optimize - INFO - Trial 183 pruned. 
2026-05-15 04:47:29,642 - optuna.study._optimize - INFO - Trial 184 pruned. 
2026-05-15 04:48:04,618 - optuna.study.study - INFO - Trial 185 finished with value: 0.08931444239300015 and parameters: {'n_layers': 1, 'embedding_dim': 256, 'lr': 0.007379216943288403, 'lambda_val': 0.000965633538265826, 'batch_size': 1927, 'optimizer': 'RMSprop'}. Best is trial 179 with value: 0.10340409334543613.
2026-05-15 04:48:41,601 - optuna.study.study - INFO - Trial 186 finished with value: 0.08811671769477718 and parameters: {'n_layers': 1, 'embedding_dim': 256, 'lr': 0.009191078906393774, 'lambda_val': 0.0019690503105761923, 'batch_size': 2668, 'optimizer': 'RMSprop'}. Best is trial 179 with value: 0.10340409334543613.
2026-05-15 04:49:19,337 - optuna.study.study - INFO - Trial 187 finished with value: 0.09696489167643052 and parameters: {'n_layers': 1, 'embedding_dim': 256, 'lr': 0.006485318327970468, 'lambda_val': 0.0005351274420058381, 'batch_size': 2774, 'optimizer': 'RMSprop'}. Best is trial 179 with value: 0.10340409334543613.
2026-05-15 04:49:23,630 - optuna.study._optimize - INFO - Trial 188 pruned. 
2026-05-15 04:49:59,738 - optuna.study.study - INFO - Trial 189 finished with value: 0.08033846697425781 and parameters: {'n_layers': 1, 'embedding_dim': 256, 'lr': 0.007612189306261236, 'lambda_val': 0.000357872799621528, 'batch_size': 2567, 'optimizer': 'RMSprop'}. Best is trial 179 with value: 0.10340409334543613.
2026-05-15 04:50:05,449 - optuna.study._optimize - INFO - Trial 190 pruned. 
2026-05-15 04:50:41,927 - optuna.study.study - INFO - Trial 191 finished with value: 0.0957405452814869 and parameters: {'n_layers': 1, 'embedding_dim': 256, 'lr': 0.010037605473549652, 'lambda_val': 0.0011626580385903514, 'batch_size': 2733, 'optimizer': 'RMSprop'}. Best is trial 179 with value: 0.10340409334543613.
2026-05-15 04:51:20,854 - optuna.study.study - INFO - Trial 192 finished with value: 0.09087429666825585 and parameters: {'n_layers': 1, 'embedding_dim': 256, 'lr': 0.008739958223727473, 'lambda_val': 0.0012633812270269164, 'batch_size': 2825, 'optimizer': 'RMSprop'}. Best is trial 179 with value: 0.10340409334543613.
