2026-05-15 22:25:35,100 - optuna.study._optimize - INFO - Trial 269 pruned. 
2026-05-15 22:25:41,781 - optuna.study._optimize - INFO - Trial 270 pruned. 
2026-05-15 22:25:48,777 - optuna.study._optimize - INFO - Trial 271 pruned. 
2026-05-15 22:26:03,555 - optuna.study._optimize - INFO - Trial 272 pruned. 
2026-05-15 22:26:11,229 - experiment_functions - INFO - Early stopping at epoch 1150. Best Recall: 0.1290
2026-05-15 22:26:11,329 - optuna.study.study - INFO - Trial 273 finished with value: 0.12896636058835775 and parameters: {'n_layers': 1, 'embedding_dim': 256, 'lr': 0.0006415095115334586, 'lambda_val': 1.3123025621348255e-06, 'batch_size': 1665, 'optimizer': 'Adam'}. Best is trial 112 with value: 0.13045097788925025.
2026-05-15 22:26:18,912 - optuna.study._optimize - INFO - Trial 274 pruned. 
2026-05-15 22:26:24,886 - experiment_functions - INFO - Early stopping at epoch 800. Best Recall: 0.0795
2026-05-15 22:26:24,965 - optuna.study.study - INFO - Trial 275 finished with value: 0.07951936881436718 and parameters: {'n_layers': 2, 'embedding_dim': 256, 'lr': 0.0005753814115680703, 'lambda_val': 2.327169441216431e-06, 'batch_size': 1678, 'optimizer': 'Adam'}. Best is trial 112 with value: 0.13045097788925025.
2026-05-15 22:26:31,528 - optuna.study._optimize - INFO - Trial 276 pruned. 
2026-05-15 22:26:42,053 - experiment_functions - INFO - Early stopping at epoch 1200. Best Recall: 0.1267
2026-05-15 22:26:42,189 - optuna.study.study - INFO - Trial 277 finished with value: 0.12666820428909564 and parameters: {'n_layers': 1, 'embedding_dim': 256, 'lr': 0.0006773330070483027, 'lambda_val': 1.2713545740314656e-06, 'batch_size': 1471, 'optimizer': 'RMSprop'}. Best is trial 112 with value: 0.13045097788925025.
2026-05-15 22:26:51,053 - optuna.study._optimize - INFO - Trial 278 pruned. 
2026-05-15 22:27:09,231 - experiment_functions - INFO - Early stopping at epoch 1750. Best Recall: 0.1260
2026-05-15 22:27:09,322 - optuna.study.study - INFO - Trial 279 finished with value: 0.1259992194835572 and parameters: {'n_layers': 1, 'embedding_dim': 256, 'lr': 0.000503732492053444, 'lambda_val': 3.3883778089299325e-06, 'batch_size': 1420, 'optimizer': 'RMSprop'}. Best is trial 112 with value: 0.13045097788925025.
2026-05-15 22:27:20,486 - experiment_functions - INFO - Early stopping at epoch 1850. Best Recall: 0.1222
2026-05-15 22:27:21,099 - optuna.study.study - INFO - Trial 280 finished with value: 0.12223345326631205 and parameters: {'n_layers': 1, 'embedding_dim': 256, 'lr': 0.00045846455662139156, 'lambda_val': 2.6431468088170553e-06, 'batch_size': 1402, 'optimizer': 'RMSprop'}. Best is trial 112 with value: 0.13045097788925025.
2026-05-15 22:27:27,813 - optuna.study._optimize - INFO - Trial 281 pruned. 
2026-05-15 22:27:31,464 - experiment_functions - INFO - Early stopping at epoch 500. Best Recall: 0.0032
2026-05-15 22:27:31,610 - optuna.study.study - INFO - Trial 282 finished with value: 0.0032036305266034187 and parameters: {'n_layers': 1, 'embedding_dim': 256, 'lr': 0.0005541197413568666, 'lambda_val': 1.2407260421766278e-06, 'batch_size': 1344, 'optimizer': 'SGD'}. Best is trial 112 with value: 0.13045097788925025.
2026-05-15 22:27:41,278 - optuna.study._optimize - INFO - Trial 283 pruned. 
2026-05-15 22:27:47,909 - optuna.study._optimize - INFO - Trial 284 pruned. 
2026-05-15 22:27:54,821 - optuna.study._optimize - INFO - Trial 285 pruned. 
2026-05-15 22:28:02,105 - optuna.study._optimize - INFO - Trial 286 pruned. 
2026-05-15 22:28:08,558 - optuna.study._optimize - INFO - Trial 287 pruned. 
2026-05-15 22:28:17,067 - optuna.study._optimize - INFO - Trial 288 pruned. 
2026-05-15 22:28:32,385 - optuna.study._optimize - INFO - Trial 289 pruned. 
2026-05-15 22:28:39,119 - optuna.study._optimize - INFO - Trial 290 pruned. 
2026-05-15 22:28:45,948 - optuna.study._optimize - INFO - Trial 291 pruned. 
2026-05-15 22:28:52,245 - optuna.study._optimize - INFO - Trial 292 pruned. 
2026-05-15 22:28:59,581 - optuna.study._optimize - INFO - Trial 293 pruned. 
2026-05-15 22:29:06,325 - optuna.study._optimize - INFO - Trial 294 pruned. 
2026-05-15 22:29:17,617 - optuna.study._optimize - INFO - Trial 295 pruned. 
2026-05-15 22:29:26,848 - optuna.study._optimize - INFO - Trial 296 pruned. 
2026-05-15 22:29:38,858 - optuna.study._optimize - INFO - Trial 297 pruned. 
2026-05-15 22:29:45,385 - optuna.study._optimize - INFO - Trial 298 pruned. 
2026-05-15 22:29:53,720 - experiment_functions - INFO - Early stopping at epoch 1250. Best Recall: 0.1260
2026-05-15 22:29:53,823 - optuna.study.study - INFO - Trial 299 finished with value: 0.12596295814144498 and parameters: {'n_layers': 1, 'embedding_dim': 256, 'lr': 0.0007364562709065469, 'lambda_val': 3.337421748896966e-06, 'batch_size': 1813, 'optimizer': 'Adam'}. Best is trial 112 with value: 0.13045097788925025.
2026-05-15 22:30:03,143 - experiment_functions - INFO - Early stopping at epoch 2650. Best Recall: 0.1211
2026-05-15 22:30:03,251 - root - INFO -   **** Training e_100K_1c1dcs_rand3
2026-05-15 22:30:03,265 - root - INFO -   **** Getting 65267/81200 random edges
2026-05-15 22:30:03,386 - optuna.storages._rdb.storage - INFO - A new study created in RDB with name: Study_e_100K_1c1dcs_rand3
2026-05-15 22:30:06,986 - experiment_functions - INFO - Early stopping at epoch 550. Best Recall: 0.0293
2026-05-15 22:30:07,078 - optuna.study.study - INFO - Trial 0 finished with value: 0.029326796010823653 and parameters: {'n_layers': 1, 'embedding_dim': 128, 'lr': 0.04178833780896776, 'lambda_val': 4.265933392594478e-06, 'batch_size': 1208, 'optimizer': 'Adam'}. Best is trial 0 with value: 0.029326796010823653.
2026-05-15 22:30:27,403 - experiment_functions - INFO - Early stopping at epoch 2000. Best Recall: 0.0656
2026-05-15 22:30:27,489 - optuna.study.study - INFO - Trial 1 finished with value: 0.06558122884228691 and parameters: {'n_layers': 2, 'embedding_dim': 64, 'lr': 0.0004248456189948351, 'lambda_val': 0.00010878012170975158, 'batch_size': 1377, 'optimizer': 'Adam'}. Best is trial 1 with value: 0.06558122884228691.
2026-05-15 22:30:31,659 - experiment_functions - INFO - Early stopping at epoch 500. Best Recall: 0.0033
2026-05-15 22:30:31,760 - optuna.study.study - INFO - Trial 2 finished with value: 0.0032600303944892418 and parameters: {'n_layers': 3, 'embedding_dim': 96, 'lr': 6.129256553009481e-05, 'lambda_val': 0.008999318618115391, 'batch_size': 3813, 'optimizer': 'SGD'}. Best is trial 1 with value: 0.06558122884228691.
2026-05-15 22:31:09,463 - experiment_functions - INFO - Early stopping at epoch 3950. Best Recall: 0.0358
2026-05-15 22:31:09,553 - optuna.study.study - INFO - Trial 3 finished with value: 0.03575309947234718 and parameters: {'n_layers': 4, 'embedding_dim': 128, 'lr': 0.00011424485138986918, 'lambda_val': 0.0003430420187274095, 'batch_size': 3306, 'optimizer': 'Adam'}. Best is trial 1 with value: 0.06558122884228691.
2026-05-15 22:31:47,963 - optuna.study.study - INFO - Trial 4 finished with value: 0.032578633137109216 and parameters: {'n_layers': 2, 'embedding_dim': 256, 'lr': 5.732926362526374e-05, 'lambda_val': 0.00119974437056072, 'batch_size': 2883, 'optimizer': 'Adam'}. Best is trial 1 with value: 0.06558122884228691.
2026-05-15 22:31:54,804 - experiment_functions - INFO - Early stopping at epoch 1100. Best Recall: 0.0404
2026-05-15 22:31:54,961 - optuna.study.study - INFO - Trial 5 finished with value: 0.04043730725157375 and parameters: {'n_layers': 1, 'embedding_dim': 32, 'lr': 0.02015447212011295, 'lambda_val': 0.0018816000455085344, 'batch_size': 664, 'optimizer': 'RMSprop'}. Best is trial 1 with value: 0.06558122884228691.
2026-05-15 22:31:58,355 - experiment_functions - INFO - Early stopping at epoch 500. Best Recall: 0.0032
2026-05-15 22:31:58,457 - optuna.study.study - INFO - Trial 6 finished with value: 0.0031657968945542564 and parameters: {'n_layers': 2, 'embedding_dim': 64, 'lr': 0.0004119979538990949, 'lambda_val': 2.798396481388209e-06, 'batch_size': 718, 'optimizer': 'SGD'}. Best is trial 1 with value: 0.06558122884228691.
2026-05-15 22:32:03,417 - experiment_functions - INFO - Early stopping at epoch 550. Best Recall: 0.0295
2026-05-15 22:32:03,519 - optuna.study.study - INFO - Trial 7 finished with value: 0.02950372665992245 and parameters: {'n_layers': 4, 'embedding_dim': 128, 'lr': 0.0034800362565845324, 'lambda_val': 9.423033240787078e-05, 'batch_size': 2470, 'optimizer': 'Adam'}. Best is trial 1 with value: 0.06558122884228691.
2026-05-15 22:32:10,018 - experiment_functions - INFO - Early stopping at epoch 950. Best Recall: 0.0816
2026-05-15 22:32:10,157 - optuna.study.study - INFO - Trial 8 finished with value: 0.0815537402062509 and parameters: {'n_layers': 1, 'embedding_dim': 96, 'lr': 0.0011249194155169714, 'lambda_val': 4.222546883842132e-06, 'batch_size': 2538, 'optimizer': 'RMSprop'}. Best is trial 8 with value: 0.0815537402062509.
2026-05-15 22:32:13,796 - experiment_functions - INFO - Early stopping at epoch 500. Best Recall: 0.0018
2026-05-15 22:32:13,899 - optuna.study.study - INFO - Trial 9 finished with value: 0.001811427037161616 and parameters: {'n_layers': 2, 'embedding_dim': 128, 'lr': 0.0017913806749320742, 'lambda_val': 0.02966938365458314, 'batch_size': 3516, 'optimizer': 'SGD'}. Best is trial 8 with value: 0.0815537402062509.
2026-05-15 22:32:18,804 - experiment_functions - INFO - Early stopping at epoch 750. Best Recall: 0.0530
2026-05-15 22:32:18,939 - optuna.study.study - INFO - Trial 10 finished with value: 0.05298690983972763 and parameters: {'n_layers': 1, 'embedding_dim': 96, 'lr': 0.005396387772794641, 'lambda_val': 1.5712739025307416e-05, 'batch_size': 1949, 'optimizer': 'RMSprop'}. Best is trial 8 with value: 0.0815537402062509.
2026-05-15 22:32:22,337 - experiment_functions - INFO - Early stopping at epoch 500. Best Recall: 0.0023
2026-05-15 22:32:22,428 - optuna.study.study - INFO - Trial 11 finished with value: 0.002272343737163428 and parameters: {'n_layers': 3, 'embedding_dim': 64, 'lr': 1.0257665563779225e-05, 'lambda_val': 3.56905795576458e-05, 'batch_size': 1781, 'optimizer': 'RMSprop'}. Best is trial 8 with value: 0.0815537402062509.
2026-05-15 22:32:34,758 - experiment_functions - INFO - Early stopping at epoch 2000. Best Recall: 0.1044
2026-05-15 22:32:35,522 - optuna.study.study - INFO - Trial 12 finished with value: 0.10440296662661855 and parameters: {'n_layers': 1, 'embedding_dim': 96, 'lr': 0.0005145475276620423, 'lambda_val': 1.1771163143254976e-06, 'batch_size': 2359, 'optimizer': 'RMSprop'}. Best is trial 12 with value: 0.10440296662661855.
2026-05-15 22:32:49,964 - experiment_functions - INFO - Early stopping at epoch 1150. Best Recall: 0.1053
2026-05-15 22:32:50,070 - optuna.study.study - INFO - Trial 13 finished with value: 0.10528381980659383 and parameters: {'n_layers': 1, 'embedding_dim': 96, 'lr': 0.0006801155722951971, 'lambda_val': 1.1202111618528665e-06, 'batch_size': 2583, 'optimizer': 'RMSprop'}. Best is trial 13 with value: 0.10528381980659383.
2026-05-15 22:33:12,690 - experiment_functions - INFO - Early stopping at epoch 3300. Best Recall: 0.1043
2026-05-15 22:33:12,781 - optuna.study.study - INFO - Trial 14 finished with value: 0.1043253683203713 and parameters: {'n_layers': 1, 'embedding_dim': 96, 'lr': 0.0003009615776197101, 'lambda_val': 1.1238638213675927e-06, 'batch_size': 2935, 'optimizer': 'RMSprop'}. Best is trial 13 with value: 0.10528381980659383.
2026-05-15 22:33:16,935 - experiment_functions - INFO - Early stopping at epoch 600. Best Recall: 0.0520
2026-05-15 22:33:17,104 - optuna.study.study - INFO - Trial 15 finished with value: 0.051983915575879 and parameters: {'n_layers': 1, 'embedding_dim': 96, 'lr': 0.010322554230734301, 'lambda_val': 1.1820591966505152e-06, 'batch_size': 2109, 'optimizer': 'RMSprop'}. Best is trial 13 with value: 0.10528381980659383.
2026-05-15 22:33:23,743 - optuna.study._optimize - INFO - Trial 16 pruned. 
2026-05-15 22:33:39,437 - optuna.study._optimize - INFO - Trial 17 pruned. 
2026-05-15 22:33:43,190 - experiment_functions - INFO - Early stopping at epoch 600. Best Recall: 0.0275
2026-05-15 22:33:43,281 - optuna.study.study - INFO - Trial 18 finished with value: 0.02745324399674684 and parameters: {'n_layers': 1, 'embedding_dim': 96, 'lr': 0.0008564359367770059, 'lambda_val': 0.08216636134466099, 'batch_size': 2315, 'optimizer': 'RMSprop'}. Best is trial 13 with value: 0.10528381980659383.
2026-05-15 22:33:47,265 - experiment_functions - INFO - Early stopping at epoch 550. Best Recall: 0.0406
2026-05-15 22:33:47,439 - optuna.study.study - INFO - Trial 19 finished with value: 0.04055667339600989 and parameters: {'n_layers': 2, 'embedding_dim': 96, 'lr': 0.0026483328957283966, 'lambda_val': 7.553543670283522e-05, 'batch_size': 3363, 'optimizer': 'RMSprop'}. Best is trial 13 with value: 0.10528381980659383.
2026-05-15 22:33:50,830 - experiment_functions - INFO - Early stopping at epoch 500. Best Recall: 0.0021
2026-05-15 22:33:50,920 - optuna.study.study - INFO - Trial 20 finished with value: 0.0020967563695067546 and parameters: {'n_layers': 1, 'embedding_dim': 96, 'lr': 4.3363297235740556e-05, 'lambda_val': 7.38974378476319e-06, 'batch_size': 3986, 'optimizer': 'SGD'}. Best is trial 13 with value: 0.10528381980659383.
2026-05-15 22:33:59,932 - experiment_functions - INFO - Early stopping at epoch 1500. Best Recall: 0.0996
2026-05-15 22:34:00,055 - optuna.study.study - INFO - Trial 21 finished with value: 0.09963428918353934 and parameters: {'n_layers': 1, 'embedding_dim': 96, 'lr': 0.0003706322735909497, 'lambda_val': 1.0869210249636789e-06, 'batch_size': 2883, 'optimizer': 'RMSprop'}. Best is trial 13 with value: 0.10528381980659383.
2026-05-15 22:34:06,548 - optuna.study._optimize - INFO - Trial 22 pruned. 
2026-05-15 22:34:13,952 - optuna.study._optimize - INFO - Trial 23 pruned. 
2026-05-15 22:34:22,906 - optuna.study._optimize - INFO - Trial 24 pruned. 
2026-05-15 22:34:30,930 - experiment_functions - INFO - Early stopping at epoch 850. Best Recall: 0.0726
2026-05-15 22:34:31,021 - optuna.study.study - INFO - Trial 25 finished with value: 0.07263198786367331 and parameters: {'n_layers': 1, 'embedding_dim': 32, 'lr': 0.0010276013648177168, 'lambda_val': 7.173919481765952e-06, 'batch_size': 3024, 'optimizer': 'RMSprop'}. Best is trial 13 with value: 0.10528381980659383.
2026-05-15 22:34:45,087 - optuna.study._optimize - INFO - Trial 26 pruned. 
2026-05-15 22:34:54,245 - experiment_functions - INFO - Early stopping at epoch 650. Best Recall: 0.0512
2026-05-15 22:34:54,345 - optuna.study.study - INFO - Trial 27 finished with value: 0.051166636627991646 and parameters: {'n_layers': 1, 'embedding_dim': 96, 'lr': 0.006922800242300068, 'lambda_val': 2.586838992769338e-06, 'batch_size': 2160, 'optimizer': 'RMSprop'}. Best is trial 13 with value: 0.10528381980659383.
2026-05-15 22:35:01,625 - optuna.study._optimize - INFO - Trial 28 pruned. 
2026-05-15 22:35:04,969 - experiment_functions - INFO - Early stopping at epoch 500. Best Recall: 0.0037
2026-05-15 22:35:05,062 - optuna.study.study - INFO - Trial 29 finished with value: 0.0037048485867757558 and parameters: {'n_layers': 1, 'embedding_dim': 96, 'lr': 0.05382758754525024, 'lambda_val': 5.914594214649009e-06, 'batch_size': 1530, 'optimizer': 'SGD'}. Best is trial 13 with value: 0.10528381980659383.
2026-05-15 22:35:09,425 - experiment_functions - INFO - Early stopping at epoch 750. Best Recall: 0.0999
2026-05-15 22:35:09,517 - optuna.study.study - INFO - Trial 30 finished with value: 0.09992267270192774 and parameters: {'n_layers': 1, 'embedding_dim': 32, 'lr': 0.0018672238257951856, 'lambda_val': 2.436041510791824e-06, 'batch_size': 1016, 'optimizer': 'Adam'}. Best is trial 13 with value: 0.10528381980659383.
2026-05-15 22:35:18,263 - optuna.study._optimize - INFO - Trial 31 pruned. 
2026-05-15 22:35:24,934 - experiment_functions - INFO - Early stopping at epoch 900. Best Recall: 0.0879
2026-05-15 22:35:25,037 - optuna.study.study - INFO - Trial 32 finished with value: 0.0878613619090985 and parameters: {'n_layers': 1, 'embedding_dim': 32, 'lr': 0.001740969950818351, 'lambda_val': 2.0501413519140267e-06, 'batch_size': 1993, 'optimizer': 'Adam'}. Best is trial 13 with value: 0.10528381980659383.
2026-05-15 22:35:31,088 - optuna.study._optimize - INFO - Trial 33 pruned. 
2026-05-15 22:35:50,301 - experiment_functions - INFO - Early stopping at epoch 3550. Best Recall: 0.1066
2026-05-15 22:35:50,458 - optuna.study.study - INFO - Trial 34 finished with value: 0.10659628064488981 and parameters: {'n_layers': 1, 'embedding_dim': 64, 'lr': 0.0005629833760397971, 'lambda_val': 4.242784434592071e-06, 'batch_size': 1326, 'optimizer': 'Adam'}. Best is trial 34 with value: 0.10659628064488981.
2026-05-15 22:35:57,026 - optuna.study._optimize - INFO - Trial 35 pruned. 
2026-05-15 22:36:04,175 - optuna.study._optimize - INFO - Trial 36 pruned. 
2026-05-15 22:36:08,318 - experiment_functions - INFO - Early stopping at epoch 500. Best Recall: 0.0032
2026-05-15 22:36:08,407 - optuna.study.study - INFO - Trial 37 finished with value: 0.0032115413515010583 and parameters: {'n_layers': 4, 'embedding_dim': 64, 'lr': 9.250945078407191e-05, 'lambda_val': 5.673765883247794e-05, 'batch_size': 2670, 'optimizer': 'SGD'}. Best is trial 34 with value: 0.10659628064488981.
2026-05-15 22:36:14,094 - optuna.study._optimize - INFO - Trial 38 pruned. 
2026-05-15 22:36:24,041 - experiment_functions - INFO - Early stopping at epoch 1700. Best Recall: 0.1149
2026-05-15 22:36:24,181 - optuna.study.study - INFO - Trial 39 finished with value: 0.11493505390206264 and parameters: {'n_layers': 1, 'embedding_dim': 128, 'lr': 0.0005691725516094062, 'lambda_val': 1.0554827032272813e-06, 'batch_size': 1750, 'optimizer': 'RMSprop'}. Best is trial 39 with value: 0.11493505390206264.
2026-05-15 22:36:33,568 - optuna.study._optimize - INFO - Trial 40 pruned. 
2026-05-15 22:36:39,752 - optuna.study._optimize - INFO - Trial 41 pruned. 
2026-05-15 22:36:43,787 - experiment_functions - INFO - Early stopping at epoch 600. Best Recall: 0.0690
2026-05-15 22:36:43,877 - optuna.study.study - INFO - Trial 42 finished with value: 0.06897952765088514 and parameters: {'n_layers': 1, 'embedding_dim': 128, 'lr': 0.0013009815061665031, 'lambda_val': 0.005309162912690934, 'batch_size': 1880, 'optimizer': 'RMSprop'}. Best is trial 39 with value: 0.11493505390206264.
2026-05-15 22:36:50,385 - optuna.study._optimize - INFO - Trial 43 pruned. 
2026-05-15 22:36:56,913 - experiment_functions - INFO - Early stopping at epoch 900. Best Recall: 0.0955
2026-05-15 22:36:57,055 - optuna.study.study - INFO - Trial 44 finished with value: 0.09552240333389289 and parameters: {'n_layers': 1, 'embedding_dim': 256, 'lr': 0.0007000196413834394, 'lambda_val': 1.6989717877046982e-06, 'batch_size': 2168, 'optimizer': 'RMSprop'}. Best is trial 39 with value: 0.11493505390206264.
2026-05-15 22:37:05,249 - optuna.study._optimize - INFO - Trial 45 pruned. 
2026-05-15 22:37:25,075 - experiment_functions - INFO - Early stopping at epoch 3550. Best Recall: 0.1122
2026-05-15 22:37:25,222 - optuna.study.study - INFO - Trial 46 finished with value: 0.11222108949375283 and parameters: {'n_layers': 1, 'embedding_dim': 128, 'lr': 0.0004294847922671243, 'lambda_val': 1.681275446968987e-06, 'batch_size': 1179, 'optimizer': 'RMSprop'}. Best is trial 39 with value: 0.11493505390206264.
2026-05-15 22:37:31,303 - experiment_functions - INFO - Early stopping at epoch 500. Best Recall: 0.0020
2026-05-15 22:37:32,066 - optuna.study.study - INFO - Trial 47 finished with value: 0.0019935905126599813 and parameters: {'n_layers': 2, 'embedding_dim': 128, 'lr': 0.0003754879250647305, 'lambda_val': 9.114816621336075e-06, 'batch_size': 1142, 'optimizer': 'SGD'}. Best is trial 39 with value: 0.11493505390206264.
2026-05-15 22:37:45,248 - experiment_functions - INFO - Early stopping at epoch 850. Best Recall: 0.0978
2026-05-15 22:37:45,328 - optuna.study.study - INFO - Trial 48 finished with value: 0.09779417980355305 and parameters: {'n_layers': 1, 'embedding_dim': 128, 'lr': 0.0014008051406632902, 'lambda_val': 1.953736677986908e-06, 'batch_size': 846, 'optimizer': 'RMSprop'}. Best is trial 39 with value: 0.11493505390206264.
2026-05-15 22:37:49,658 - experiment_functions - INFO - Early stopping at epoch 700. Best Recall: 0.0844
2026-05-15 22:37:49,760 - optuna.study.study - INFO - Trial 49 finished with value: 0.0843684103571788 and parameters: {'n_layers': 1, 'embedding_dim': 128, 'lr': 0.0024614613811233007, 'lambda_val': 1.8393475208323695e-05, 'batch_size': 1312, 'optimizer': 'RMSprop'}. Best is trial 39 with value: 0.11493505390206264.
2026-05-15 22:37:54,191 - experiment_functions - INFO - Early stopping at epoch 600. Best Recall: 0.0301
2026-05-15 22:37:54,270 - optuna.study.study - INFO - Trial 50 finished with value: 0.030084905370336843 and parameters: {'n_layers': 3, 'embedding_dim': 128, 'lr': 0.004376671621304229, 'lambda_val': 1.5352316782744802e-06, 'batch_size': 1493, 'optimizer': 'RMSprop'}. Best is trial 39 with value: 0.11493505390206264.
2026-05-15 22:38:03,356 - optuna.study._optimize - INFO - Trial 51 pruned. 
2026-05-15 22:38:08,494 - experiment_functions - INFO - Early stopping at epoch 800. Best Recall: 0.0976
2026-05-15 22:38:08,592 - optuna.study.study - INFO - Trial 52 finished with value: 0.09762751697737564 and parameters: {'n_layers': 1, 'embedding_dim': 96, 'lr': 0.0008134762242876464, 'lambda_val': 1.0340551080588942e-06, 'batch_size': 2830, 'optimizer': 'RMSprop'}. Best is trial 39 with value: 0.11493505390206264.
2026-05-15 22:38:14,702 - optuna.study._optimize - INFO - Trial 53 pruned. 
2026-05-15 22:38:20,534 - optuna.study._optimize - INFO - Trial 54 pruned. 
2026-05-15 22:38:36,554 - experiment_functions - INFO - Early stopping at epoch 2600. Best Recall: 0.1226
