2026-05-16 02:05:11,496 - optuna.study.study - INFO - Trial 107 finished with value: 0.0025013871056460625 and parameters: {'n_layers': 1, 'embedding_dim': 32, 'lr': 0.0011953819660919596, 'lambda_val': 1.915151553449873e-06, 'batch_size': 2101, 'optimizer': 'SGD'}. Best is trial 44 with value: 0.11618346489857198.
2026-05-16 02:05:16,460 - experiment_functions - INFO - Early stopping at epoch 700. Best Recall: 0.0996
2026-05-16 02:05:17,145 - optuna.study.study - INFO - Trial 108 finished with value: 0.09964128226336094 and parameters: {'n_layers': 1, 'embedding_dim': 128, 'lr': 0.002091197182925012, 'lambda_val': 2.518371149175675e-06, 'batch_size': 3721, 'optimizer': 'Adam'}. Best is trial 44 with value: 0.11618346489857198.
2026-05-16 02:05:24,976 - optuna.study._optimize - INFO - Trial 109 pruned. 
2026-05-16 02:05:34,152 - optuna.study._optimize - INFO - Trial 110 pruned. 
2026-05-16 02:05:40,460 - optuna.study._optimize - INFO - Trial 111 pruned. 
2026-05-16 02:05:48,923 - optuna.study._optimize - INFO - Trial 112 pruned. 
2026-05-16 02:05:55,153 - experiment_functions - INFO - Early stopping at epoch 750. Best Recall: 0.0986
2026-05-16 02:05:55,268 - optuna.study.study - INFO - Trial 113 finished with value: 0.09858278072089365 and parameters: {'n_layers': 1, 'embedding_dim': 128, 'lr': 0.0006913536253842487, 'lambda_val': 4.886578043991515e-06, 'batch_size': 3819, 'optimizer': 'RMSprop'}. Best is trial 44 with value: 0.11618346489857198.
2026-05-16 02:06:04,854 - experiment_functions - INFO - Early stopping at epoch 1450. Best Recall: 0.1092
2026-05-16 02:06:04,946 - optuna.study.study - INFO - Trial 114 finished with value: 0.10916575326189416 and parameters: {'n_layers': 1, 'embedding_dim': 128, 'lr': 0.0003430786575199593, 'lambda_val': 0.0002861153065382521, 'batch_size': 3972, 'optimizer': 'RMSprop'}. Best is trial 44 with value: 0.11618346489857198.
2026-05-16 02:06:14,151 - experiment_functions - INFO - Early stopping at epoch 1200. Best Recall: 0.1054
2026-05-16 02:06:14,254 - optuna.study.study - INFO - Trial 115 finished with value: 0.10540427836597666 and parameters: {'n_layers': 1, 'embedding_dim': 128, 'lr': 0.0005134162270102694, 'lambda_val': 0.0002658115894358616, 'batch_size': 3988, 'optimizer': 'RMSprop'}. Best is trial 44 with value: 0.11618346489857198.
2026-05-16 02:06:21,089 - experiment_functions - INFO - Early stopping at epoch 1200. Best Recall: 0.1090
2026-05-16 02:06:21,194 - optuna.study.study - INFO - Trial 116 finished with value: 0.10903599727570708 and parameters: {'n_layers': 1, 'embedding_dim': 32, 'lr': 0.0008513694264268122, 'lambda_val': 0.0003314153035001088, 'batch_size': 3965, 'optimizer': 'RMSprop'}. Best is trial 44 with value: 0.11618346489857198.
2026-05-16 02:06:28,426 - optuna.study._optimize - INFO - Trial 117 pruned. 
2026-05-16 02:06:33,485 - experiment_functions - INFO - Early stopping at epoch 750. Best Recall: 0.1050
2026-05-16 02:06:33,566 - optuna.study.study - INFO - Trial 118 finished with value: 0.10498361839813446 and parameters: {'n_layers': 1, 'embedding_dim': 32, 'lr': 0.0014557404716706761, 'lambda_val': 0.00037181591337713874, 'batch_size': 3645, 'optimizer': 'RMSprop'}. Best is trial 44 with value: 0.11618346489857198.
2026-05-16 02:06:39,232 - optuna.study._optimize - INFO - Trial 119 pruned. 
2026-05-16 02:06:46,219 - optuna.study._optimize - INFO - Trial 120 pruned. 
2026-05-16 02:06:50,814 - experiment_functions - INFO - Early stopping at epoch 700. Best Recall: 0.0870
2026-05-16 02:06:50,906 - optuna.study.study - INFO - Trial 121 finished with value: 0.08704607247856642 and parameters: {'n_layers': 1, 'embedding_dim': 32, 'lr': 0.001556284129083198, 'lambda_val': 0.0003951219918786864, 'batch_size': 3638, 'optimizer': 'RMSprop'}. Best is trial 44 with value: 0.11618346489857198.
2026-05-16 02:06:56,568 - experiment_functions - INFO - Early stopping at epoch 550. Best Recall: 0.0726
2026-05-16 02:06:56,672 - optuna.study.study - INFO - Trial 122 finished with value: 0.0725817487105986 and parameters: {'n_layers': 1, 'embedding_dim': 32, 'lr': 0.002100451002163478, 'lambda_val': 0.00026086032185243383, 'batch_size': 4088, 'optimizer': 'RMSprop'}. Best is trial 44 with value: 0.11618346489857198.
2026-05-16 02:07:00,660 - experiment_functions - INFO - Early stopping at epoch 600. Best Recall: 0.0733
2026-05-16 02:07:00,741 - optuna.study.study - INFO - Trial 123 finished with value: 0.07333060671315739 and parameters: {'n_layers': 1, 'embedding_dim': 32, 'lr': 0.0013517735901700018, 'lambda_val': 0.0014088108773897534, 'batch_size': 1762, 'optimizer': 'RMSprop'}. Best is trial 44 with value: 0.11618346489857198.
2026-05-16 02:07:07,300 - experiment_functions - INFO - Early stopping at epoch 900. Best Recall: 0.0914
2026-05-16 02:07:07,382 - optuna.study.study - INFO - Trial 124 finished with value: 0.09136193981779074 and parameters: {'n_layers': 1, 'embedding_dim': 32, 'lr': 0.001072089687186082, 'lambda_val': 0.0003846163549046061, 'batch_size': 3504, 'optimizer': 'RMSprop'}. Best is trial 44 with value: 0.11618346489857198.
2026-05-16 02:07:15,419 - optuna.study._optimize - INFO - Trial 125 pruned. 
2026-05-16 02:07:22,152 - optuna.study._optimize - INFO - Trial 126 pruned. 
2026-05-16 02:07:30,200 - experiment_functions - INFO - Early stopping at epoch 800. Best Recall: 0.0892
2026-05-16 02:07:30,314 - optuna.study.study - INFO - Trial 127 finished with value: 0.08920789676893624 and parameters: {'n_layers': 1, 'embedding_dim': 64, 'lr': 0.0008461493066832867, 'lambda_val': 0.00021154123877200142, 'batch_size': 3796, 'optimizer': 'RMSprop'}. Best is trial 44 with value: 0.11618346489857198.
2026-05-16 02:07:34,092 - experiment_functions - INFO - Early stopping at epoch 550. Best Recall: 0.0720
2026-05-16 02:07:34,174 - optuna.study.study - INFO - Trial 128 finished with value: 0.07204504735023123 and parameters: {'n_layers': 1, 'embedding_dim': 96, 'lr': 0.003936173817457182, 'lambda_val': 0.0003216599023818761, 'batch_size': 3571, 'optimizer': 'RMSprop'}. Best is trial 44 with value: 0.11618346489857198.
2026-05-16 02:07:37,639 - experiment_functions - INFO - Early stopping at epoch 500. Best Recall: 0.0020
2026-05-16 02:07:37,734 - optuna.study.study - INFO - Trial 129 finished with value: 0.001969143971069321 and parameters: {'n_layers': 1, 'embedding_dim': 32, 'lr': 0.0017488622824335621, 'lambda_val': 0.00041727259662698447, 'batch_size': 3960, 'optimizer': 'SGD'}. Best is trial 44 with value: 0.11618346489857198.
2026-05-16 02:07:45,345 - optuna.study._optimize - INFO - Trial 130 pruned. 
2026-05-16 02:07:52,179 - optuna.study._optimize - INFO - Trial 131 pruned. 
2026-05-16 02:08:02,540 - experiment_functions - INFO - Early stopping at epoch 1200. Best Recall: 0.0999
2026-05-16 02:08:02,622 - optuna.study.study - INFO - Trial 132 finished with value: 0.09988190850739166 and parameters: {'n_layers': 1, 'embedding_dim': 128, 'lr': 0.00043739791652927046, 'lambda_val': 0.0007910401483698874, 'batch_size': 3843, 'optimizer': 'RMSprop'}. Best is trial 44 with value: 0.11618346489857198.
2026-05-16 02:08:19,144 - experiment_functions - INFO - Early stopping at epoch 2150. Best Recall: 0.1173
2026-05-16 02:08:19,252 - optuna.study.study - INFO - Trial 133 finished with value: 0.11726125669213665 and parameters: {'n_layers': 1, 'embedding_dim': 128, 'lr': 0.000248323512192206, 'lambda_val': 0.00017369151498785514, 'batch_size': 3915, 'optimizer': 'RMSprop'}. Best is trial 133 with value: 0.11726125669213665.
2026-05-16 02:08:30,488 - optuna.study._optimize - INFO - Trial 134 pruned. 
2026-05-16 02:08:36,696 - optuna.study._optimize - INFO - Trial 135 pruned. 
2026-05-16 02:08:45,690 - optuna.study._optimize - INFO - Trial 136 pruned. 
2026-05-16 02:08:51,775 - optuna.study._optimize - INFO - Trial 137 pruned. 
2026-05-16 02:09:00,232 - optuna.study._optimize - INFO - Trial 138 pruned. 
2026-05-16 02:09:08,335 - optuna.study._optimize - INFO - Trial 139 pruned. 
2026-05-16 02:09:20,387 - experiment_functions - INFO - Early stopping at epoch 1750. Best Recall: 0.1099
2026-05-16 02:09:20,480 - optuna.study.study - INFO - Trial 140 finished with value: 0.10989329194462523 and parameters: {'n_layers': 1, 'embedding_dim': 256, 'lr': 0.00033682625968714503, 'lambda_val': 0.00019271926964949622, 'batch_size': 3814, 'optimizer': 'RMSprop'}. Best is trial 133 with value: 0.11726125669213665.
2026-05-16 02:09:31,123 - optuna.study._optimize - INFO - Trial 141 pruned. 
2026-05-16 02:09:38,629 - experiment_functions - INFO - Early stopping at epoch 1050. Best Recall: 0.1128
2026-05-16 02:09:38,723 - optuna.study.study - INFO - Trial 142 finished with value: 0.1127557363977109 and parameters: {'n_layers': 1, 'embedding_dim': 256, 'lr': 0.0005110701256177648, 'lambda_val': 5.160394927846787e-05, 'batch_size': 4027, 'optimizer': 'RMSprop'}. Best is trial 133 with value: 0.11726125669213665.
2026-05-16 02:09:46,965 - experiment_functions - INFO - Early stopping at epoch 900. Best Recall: 0.1084
2026-05-16 02:09:47,060 - optuna.study.study - INFO - Trial 143 finished with value: 0.10841504133356161 and parameters: {'n_layers': 1, 'embedding_dim': 256, 'lr': 0.0005069213564752138, 'lambda_val': 3.9820548794701016e-05, 'batch_size': 4033, 'optimizer': 'RMSprop'}. Best is trial 133 with value: 0.11726125669213665.
2026-05-16 02:09:52,943 - experiment_functions - INFO - Early stopping at epoch 800. Best Recall: 0.1099
2026-05-16 02:09:53,080 - optuna.study.study - INFO - Trial 144 finished with value: 0.10991525308797616 and parameters: {'n_layers': 1, 'embedding_dim': 256, 'lr': 0.0006669410933981639, 'lambda_val': 5.2246041035870564e-05, 'batch_size': 4047, 'optimizer': 'RMSprop'}. Best is trial 133 with value: 0.11726125669213665.
2026-05-16 02:09:59,826 - experiment_functions - INFO - Early stopping at epoch 750. Best Recall: 0.1089
2026-05-16 02:09:59,919 - optuna.study.study - INFO - Trial 145 finished with value: 0.10886916442691803 and parameters: {'n_layers': 1, 'embedding_dim': 256, 'lr': 0.0006551199403496138, 'lambda_val': 4.7118617488833935e-05, 'batch_size': 4037, 'optimizer': 'RMSprop'}. Best is trial 133 with value: 0.11726125669213665.
2026-05-16 02:10:07,185 - experiment_functions - INFO - Early stopping at epoch 850. Best Recall: 0.1008
2026-05-16 02:10:07,277 - optuna.study.study - INFO - Trial 146 finished with value: 0.10081833275599761 and parameters: {'n_layers': 1, 'embedding_dim': 256, 'lr': 0.0006775844435388776, 'lambda_val': 7.780290635649814e-05, 'batch_size': 4054, 'optimizer': 'RMSprop'}. Best is trial 133 with value: 0.11726125669213665.
2026-05-16 02:10:21,391 - experiment_functions - INFO - Early stopping at epoch 1700. Best Recall: 0.1113
2026-05-16 02:10:21,472 - optuna.study.study - INFO - Trial 147 finished with value: 0.11129311849546306 and parameters: {'n_layers': 1, 'embedding_dim': 256, 'lr': 0.0004009785524515182, 'lambda_val': 4.236094965505118e-05, 'batch_size': 4040, 'optimizer': 'RMSprop'}. Best is trial 133 with value: 0.11726125669213665.
2026-05-16 02:10:27,774 - experiment_functions - INFO - Early stopping at epoch 750. Best Recall: 0.0941
2026-05-16 02:10:27,865 - optuna.study.study - INFO - Trial 148 finished with value: 0.09414343768602454 and parameters: {'n_layers': 1, 'embedding_dim': 256, 'lr': 0.0009110321450970988, 'lambda_val': 4.871643908910066e-05, 'batch_size': 4030, 'optimizer': 'RMSprop'}. Best is trial 133 with value: 0.11726125669213665.
2026-05-16 02:10:37,842 - experiment_functions - INFO - Early stopping at epoch 1000. Best Recall: 0.1032
2026-05-16 02:10:37,936 - optuna.study.study - INFO - Trial 149 finished with value: 0.10323222496535665 and parameters: {'n_layers': 1, 'embedding_dim': 256, 'lr': 0.0005998624180486954, 'lambda_val': 3.9908517983439335e-05, 'batch_size': 3889, 'optimizer': 'RMSprop'}. Best is trial 133 with value: 0.11726125669213665.
2026-05-16 02:10:44,980 - optuna.study._optimize - INFO - Trial 150 pruned. 
2026-05-16 02:10:55,581 - experiment_functions - INFO - Early stopping at epoch 1150. Best Recall: 0.1131
2026-05-16 02:10:55,672 - optuna.study.study - INFO - Trial 151 finished with value: 0.11307773717465978 and parameters: {'n_layers': 1, 'embedding_dim': 256, 'lr': 0.00040717929340223244, 'lambda_val': 2.2345637774893926e-05, 'batch_size': 3955, 'optimizer': 'RMSprop'}. Best is trial 133 with value: 0.11726125669213665.
2026-05-16 02:11:02,704 - experiment_functions - INFO - Early stopping at epoch 1000. Best Recall: 0.1066
2026-05-16 02:11:02,849 - optuna.study.study - INFO - Trial 152 finished with value: 0.1066227926804782 and parameters: {'n_layers': 1, 'embedding_dim': 256, 'lr': 0.0004473229365785387, 'lambda_val': 1.9475048998376417e-05, 'batch_size': 3967, 'optimizer': 'RMSprop'}. Best is trial 133 with value: 0.11726125669213665.
2026-05-16 02:11:18,180 - experiment_functions - INFO - Early stopping at epoch 1850. Best Recall: 0.1134
2026-05-16 02:11:18,290 - optuna.study.study - INFO - Trial 153 finished with value: 0.11339887381107229 and parameters: {'n_layers': 1, 'embedding_dim': 256, 'lr': 0.00033764238097627595, 'lambda_val': 3.480118568338621e-05, 'batch_size': 3924, 'optimizer': 'RMSprop'}. Best is trial 133 with value: 0.11726125669213665.
2026-05-16 02:11:26,425 - experiment_functions - INFO - Early stopping at epoch 1200. Best Recall: 0.1138
2026-05-16 02:11:26,517 - optuna.study.study - INFO - Trial 154 finished with value: 0.11379252249417426 and parameters: {'n_layers': 1, 'embedding_dim': 256, 'lr': 0.00034673648022495886, 'lambda_val': 2.814213177243957e-05, 'batch_size': 3907, 'optimizer': 'RMSprop'}. Best is trial 133 with value: 0.11726125669213665.
2026-05-16 02:11:36,219 - optuna.study._optimize - INFO - Trial 155 pruned. 
2026-05-16 02:11:47,375 - experiment_functions - INFO - Early stopping at epoch 1500. Best Recall: 0.1122
2026-05-16 02:11:47,493 - optuna.study.study - INFO - Trial 156 finished with value: 0.1122129460987639 and parameters: {'n_layers': 1, 'embedding_dim': 256, 'lr': 0.0003725213509200424, 'lambda_val': 3.126383343536773e-05, 'batch_size': 3957, 'optimizer': 'RMSprop'}. Best is trial 133 with value: 0.11726125669213665.
2026-05-16 02:11:57,262 - experiment_functions - INFO - Early stopping at epoch 1050. Best Recall: 0.1123
2026-05-16 02:11:57,586 - optuna.study.study - INFO - Trial 157 finished with value: 0.11234899350263564 and parameters: {'n_layers': 1, 'embedding_dim': 256, 'lr': 0.00037252304913045, 'lambda_val': 2.975414685725594e-05, 'batch_size': 3930, 'optimizer': 'RMSprop'}. Best is trial 133 with value: 0.11726125669213665.
2026-05-16 02:12:09,974 - experiment_functions - INFO - Early stopping at epoch 1600. Best Recall: 0.1071
2026-05-16 02:12:10,065 - optuna.study.study - INFO - Trial 158 finished with value: 0.10705821866850503 and parameters: {'n_layers': 1, 'embedding_dim': 256, 'lr': 0.000361977203114026, 'lambda_val': 2.9582196494002095e-05, 'batch_size': 3810, 'optimizer': 'RMSprop'}. Best is trial 133 with value: 0.11726125669213665.
2026-05-16 02:12:26,044 - experiment_functions - INFO - Early stopping at epoch 1950. Best Recall: 0.1176
2026-05-16 02:12:26,128 - optuna.study.study - INFO - Trial 159 finished with value: 0.11763752372819956 and parameters: {'n_layers': 1, 'embedding_dim': 256, 'lr': 0.00027643643514937456, 'lambda_val': 3.1873654401692595e-05, 'batch_size': 3895, 'optimizer': 'RMSprop'}. Best is trial 159 with value: 0.11763752372819956.
2026-05-16 02:12:31,032 - experiment_functions - INFO - Early stopping at epoch 500. Best Recall: 0.0021
2026-05-16 02:12:31,169 - optuna.study.study - INFO - Trial 160 finished with value: 0.0021410561147895252 and parameters: {'n_layers': 1, 'embedding_dim': 256, 'lr': 0.00015504106071267525, 'lambda_val': 3.116679505046101e-05, 'batch_size': 3895, 'optimizer': 'SGD'}. Best is trial 159 with value: 0.11763752372819956.
2026-05-16 02:12:45,213 - experiment_functions - INFO - Early stopping at epoch 1650. Best Recall: 0.1232
2026-05-16 02:12:45,314 - optuna.study.study - INFO - Trial 161 finished with value: 0.12315039993592182 and parameters: {'n_layers': 1, 'embedding_dim': 256, 'lr': 0.0002796621670540535, 'lambda_val': 6.145179268419279e-05, 'batch_size': 3926, 'optimizer': 'RMSprop'}. Best is trial 161 with value: 0.12315039993592182.
2026-05-16 02:13:02,618 - experiment_functions - INFO - Early stopping at epoch 2300. Best Recall: 0.1116
2026-05-16 02:13:02,709 - optuna.study.study - INFO - Trial 162 finished with value: 0.11157417509812721 and parameters: {'n_layers': 1, 'embedding_dim': 256, 'lr': 0.00025465717976923583, 'lambda_val': 5.659560241116339e-05, 'batch_size': 3755, 'optimizer': 'RMSprop'}. Best is trial 161 with value: 0.12315039993592182.
2026-05-16 02:13:13,747 - optuna.study._optimize - INFO - Trial 163 pruned. 
2026-05-16 02:13:21,853 - optuna.study._optimize - INFO - Trial 164 pruned. 
2026-05-16 02:13:31,790 - optuna.study._optimize - INFO - Trial 165 pruned. 
2026-05-16 02:13:40,233 - experiment_functions - INFO - Early stopping at epoch 1150. Best Recall: 0.1076
2026-05-16 02:13:40,336 - optuna.study.study - INFO - Trial 166 finished with value: 0.10758540601151355 and parameters: {'n_layers': 1, 'embedding_dim': 256, 'lr': 0.0004107170571686966, 'lambda_val': 3.2824873005913514e-05, 'batch_size': 4093, 'optimizer': 'RMSprop'}. Best is trial 161 with value: 0.12315039993592182.
2026-05-16 02:13:55,475 - experiment_functions - INFO - Early stopping at epoch 1550. Best Recall: 0.1074
2026-05-16 02:13:55,565 - optuna.study.study - INFO - Trial 167 finished with value: 0.10735434427611634 and parameters: {'n_layers': 1, 'embedding_dim': 256, 'lr': 0.0003118421238545934, 'lambda_val': 0.00010040721930395187, 'batch_size': 3921, 'optimizer': 'RMSprop'}. Best is trial 161 with value: 0.12315039993592182.
2026-05-16 02:14:02,941 - optuna.study._optimize - INFO - Trial 168 pruned. 
2026-05-16 02:14:19,864 - experiment_functions - INFO - Early stopping at epoch 1900. Best Recall: 0.1142
2026-05-16 02:14:21,404 - optuna.study.study - INFO - Trial 169 finished with value: 0.11417305319274619 and parameters: {'n_layers': 1, 'embedding_dim': 256, 'lr': 0.00038626012019834865, 'lambda_val': 1.8418487888336037e-05, 'batch_size': 2635, 'optimizer': 'RMSprop'}. Best is trial 161 with value: 0.12315039993592182.
2026-05-16 02:14:32,737 - optuna.study._optimize - INFO - Trial 170 pruned. 
2026-05-16 02:14:41,268 - experiment_functions - INFO - Early stopping at epoch 1100. Best Recall: 0.1077
2026-05-16 02:14:41,393 - optuna.study.study - INFO - Trial 171 finished with value: 0.10772690989215432 and parameters: {'n_layers': 1, 'embedding_dim': 256, 'lr': 0.0003616383866379369, 'lambda_val': 2.11861347091942e-05, 'batch_size': 3990, 'optimizer': 'RMSprop'}. Best is trial 161 with value: 0.12315039993592182.
2026-05-16 02:14:56,338 - experiment_functions - INFO - Early stopping at epoch 2100. Best Recall: 0.1175
2026-05-16 02:14:56,429 - optuna.study.study - INFO - Trial 172 finished with value: 0.11753184080272064 and parameters: {'n_layers': 1, 'embedding_dim': 256, 'lr': 0.0002810189844955432, 'lambda_val': 2.4552505560523307e-05, 'batch_size': 3078, 'optimizer': 'RMSprop'}. Best is trial 161 with value: 0.12315039993592182.
2026-05-16 02:15:19,154 - experiment_functions - INFO - Early stopping at epoch 3000. Best Recall: 0.1151
2026-05-16 02:15:19,253 - optuna.study.study - INFO - Trial 173 finished with value: 0.11509883476437247 and parameters: {'n_layers': 1, 'embedding_dim': 256, 'lr': 0.00026467900833247184, 'lambda_val': 2.546994446410697e-05, 'batch_size': 3129, 'optimizer': 'RMSprop'}. Best is trial 161 with value: 0.12315039993592182.
2026-05-16 02:15:27,064 - optuna.study._optimize - INFO - Trial 174 pruned. 
2026-05-16 02:15:37,194 - optuna.study._optimize - INFO - Trial 175 pruned. 
2026-05-16 02:15:46,619 - experiment_functions - INFO - Early stopping at epoch 1400. Best Recall: 0.1153
2026-05-16 02:15:46,720 - optuna.study.study - INFO - Trial 176 finished with value: 0.11530808688006855 and parameters: {'n_layers': 1, 'embedding_dim': 256, 'lr': 0.00046625141884509407, 'lambda_val': 3.1989688881982696e-05, 'batch_size': 2821, 'optimizer': 'RMSprop'}. Best is trial 161 with value: 0.12315039993592182.
2026-05-16 02:15:55,147 - optuna.study._optimize - INFO - Trial 177 pruned. 
2026-05-16 02:16:02,647 - optuna.study._optimize - INFO - Trial 178 pruned. 
2026-05-16 02:16:10,494 - experiment_functions - INFO - Early stopping at epoch 1050. Best Recall: 0.1049
2026-05-16 02:16:10,596 - optuna.study.study - INFO - Trial 179 finished with value: 0.10487616631660862 and parameters: {'n_layers': 1, 'embedding_dim': 256, 'lr': 0.00047357938830478396, 'lambda_val': 2.5756020122197696e-05, 'batch_size': 2898, 'optimizer': 'RMSprop'}. Best is trial 161 with value: 0.12315039993592182.
2026-05-16 02:16:35,451 - experiment_functions - INFO - Early stopping at epoch 3450. Best Recall: 0.1146
2026-05-16 02:16:35,584 - optuna.study.study - INFO - Trial 180 finished with value: 0.1145730823976127 and parameters: {'n_layers': 1, 'embedding_dim': 256, 'lr': 0.00028351580256642014, 'lambda_val': 4.1308625263708775e-05, 'batch_size': 3123, 'optimizer': 'RMSprop'}. Best is trial 161 with value: 0.12315039993592182.
2026-05-16 02:16:43,357 - optuna.study._optimize - INFO - Trial 181 pruned. 
2026-05-16 02:16:57,184 - experiment_functions - INFO - Early stopping at epoch 2150. Best Recall: 0.1118
2026-05-16 02:16:57,321 - optuna.study.study - INFO - Trial 182 finished with value: 0.11179134634991142 and parameters: {'n_layers': 1, 'embedding_dim': 256, 'lr': 0.0002977261697541082, 'lambda_val': 3.8899821554613925e-05, 'batch_size': 3274, 'optimizer': 'RMSprop'}. Best is trial 161 with value: 0.12315039993592182.
2026-05-16 02:17:16,042 - experiment_functions - INFO - Early stopping at epoch 2650. Best Recall: 0.1191
