2026-05-15 19:32:34,758 - optuna.study._optimize - INFO - Trial 299 pruned. 
2026-05-15 19:32:44,546 - experiment_functions - INFO - Early stopping at epoch 2650. Best Recall: 0.1328
2026-05-15 19:32:44,653 - root - INFO - **** Training e_100K_1c1dcs
2026-05-15 19:32:44,654 - root - INFO -   ** 1-Dominant stats:
2026-05-15 19:32:44,654 - root - INFO -   ** Finding the dominant set:
2026-05-15 19:33:05,402 - root - INFO -   ** Getting the trainable edges:
2026-05-15 19:33:05,406 - helper_functions - INFO -      Number of nodes: 535
2026-05-15 19:33:05,406 - helper_functions - INFO -      Ratio: 0.05177085349332301
2026-05-15 19:33:05,406 - helper_functions - INFO -      Number of unique users: 303
2026-05-15 19:33:05,406 - helper_functions - INFO -      Number of unique items: 232
2026-05-15 19:33:05,406 - helper_functions - INFO -      Total dominant set edge: 8849
2026-05-15 19:33:05,406 - helper_functions - INFO -      Trainable edges: 7079.200000000001
2026-05-15 19:33:05,409 - root - INFO -   **** Getting 8849 dominant set edges
2026-05-15 19:33:05,977 - optuna.storages._rdb.storage - INFO - A new study created in RDB with name: Study_e_100K_1c1dcs_strict
2026-05-15 19:33:09,524 - experiment_functions - INFO - Early stopping at epoch 500. Best Recall: 0.0016
2026-05-15 19:33:09,658 - optuna.study.study - INFO - Trial 0 finished with value: 0.0016397632210015027 and parameters: {'n_layers': 1, 'embedding_dim': 128, 'lr': 0.08239679807828673, 'lambda_val': 7.997502371598436e-06, 'batch_size': 3629, 'optimizer': 'SGD'}. Best is trial 0 with value: 0.0016397632210015027.
2026-05-15 19:33:13,785 - experiment_functions - INFO - Early stopping at epoch 550. Best Recall: 0.0120
2026-05-15 19:33:13,919 - optuna.study.study - INFO - Trial 1 finished with value: 0.01202602275116901 and parameters: {'n_layers': 3, 'embedding_dim': 256, 'lr': 0.021146086921959104, 'lambda_val': 2.6540833199482503e-06, 'batch_size': 3559, 'optimizer': 'RMSprop'}. Best is trial 1 with value: 0.01202602275116901.
2026-05-15 19:33:17,518 - experiment_functions - INFO - Early stopping at epoch 500. Best Recall: 0.0017
2026-05-15 19:33:17,646 - optuna.study.study - INFO - Trial 2 finished with value: 0.0017411263420122557 and parameters: {'n_layers': 1, 'embedding_dim': 96, 'lr': 0.0022755220636781876, 'lambda_val': 0.00013992489215793662, 'batch_size': 3866, 'optimizer': 'SGD'}. Best is trial 1 with value: 0.01202602275116901.
2026-05-15 19:33:21,964 - experiment_functions - INFO - Early stopping at epoch 550. Best Recall: 0.0068
2026-05-15 19:33:22,096 - optuna.study.study - INFO - Trial 3 finished with value: 0.006760413195518546 and parameters: {'n_layers': 2, 'embedding_dim': 256, 'lr': 0.004396348801443794, 'lambda_val': 3.0473415616997105e-06, 'batch_size': 996, 'optimizer': 'Adam'}. Best is trial 1 with value: 0.01202602275116901.
2026-05-15 19:33:49,395 - experiment_functions - INFO - Early stopping at epoch 2700. Best Recall: 0.0047
2026-05-15 19:33:49,518 - optuna.study.study - INFO - Trial 4 finished with value: 0.004701254044821434 and parameters: {'n_layers': 3, 'embedding_dim': 128, 'lr': 2.6095904013484188e-05, 'lambda_val': 0.011122617631250815, 'batch_size': 3225, 'optimizer': 'Adam'}. Best is trial 1 with value: 0.01202602275116901.
2026-05-15 19:33:57,615 - experiment_functions - INFO - Early stopping at epoch 1200. Best Recall: 0.0051
2026-05-15 19:33:57,755 - optuna.study.study - INFO - Trial 5 finished with value: 0.005138983506423416 and parameters: {'n_layers': 4, 'embedding_dim': 64, 'lr': 8.356347785635553e-05, 'lambda_val': 4.2249123466685695e-06, 'batch_size': 3541, 'optimizer': 'Adam'}. Best is trial 1 with value: 0.01202602275116901.
2026-05-15 19:34:01,501 - experiment_functions - INFO - Early stopping at epoch 500. Best Recall: 0.0019
2026-05-15 19:34:01,625 - optuna.study.study - INFO - Trial 6 finished with value: 0.0018666311998225104 and parameters: {'n_layers': 1, 'embedding_dim': 256, 'lr': 0.002230962032560999, 'lambda_val': 0.0031323308023316755, 'batch_size': 3031, 'optimizer': 'SGD'}. Best is trial 1 with value: 0.01202602275116901.
2026-05-15 19:34:10,420 - experiment_functions - INFO - Early stopping at epoch 1350. Best Recall: 0.0061
2026-05-15 19:34:10,559 - optuna.study.study - INFO - Trial 7 finished with value: 0.006098747736050625 and parameters: {'n_layers': 4, 'embedding_dim': 64, 'lr': 8.370729303256802e-05, 'lambda_val': 0.00031120389987829923, 'batch_size': 3928, 'optimizer': 'Adam'}. Best is trial 1 with value: 0.01202602275116901.
2026-05-15 19:34:24,305 - experiment_functions - INFO - Early stopping at epoch 2400. Best Recall: 0.0106
2026-05-15 19:34:24,446 - optuna.study.study - INFO - Trial 8 finished with value: 0.010640647521021186 and parameters: {'n_layers': 1, 'embedding_dim': 64, 'lr': 0.02563704835727136, 'lambda_val': 0.00043764157073800667, 'batch_size': 3854, 'optimizer': 'Adam'}. Best is trial 1 with value: 0.01202602275116901.
2026-05-15 19:34:28,337 - experiment_functions - INFO - Early stopping at epoch 550. Best Recall: 0.0046
2026-05-15 19:34:28,471 - optuna.study.study - INFO - Trial 9 finished with value: 0.004618419727553017 and parameters: {'n_layers': 1, 'embedding_dim': 256, 'lr': 0.0006752776965839662, 'lambda_val': 0.006386034617690093, 'batch_size': 2224, 'optimizer': 'RMSprop'}. Best is trial 1 with value: 0.01202602275116901.
2026-05-15 19:34:34,555 - experiment_functions - INFO - Early stopping at epoch 850. Best Recall: 0.0040
2026-05-15 19:34:34,685 - optuna.study.study - INFO - Trial 10 finished with value: 0.004030581397808854 and parameters: {'n_layers': 3, 'embedding_dim': 32, 'lr': 0.01755233611287581, 'lambda_val': 0.09219540191487116, 'batch_size': 1959, 'optimizer': 'RMSprop'}. Best is trial 1 with value: 0.01202602275116901.
2026-05-15 19:34:38,325 - experiment_functions - INFO - Early stopping at epoch 500. Best Recall: 0.0105
2026-05-15 19:34:38,462 - optuna.study.study - INFO - Trial 11 finished with value: 0.010535161821745765 and parameters: {'n_layers': 2, 'embedding_dim': 64, 'lr': 0.08451162011720659, 'lambda_val': 4.7913323975321254e-05, 'batch_size': 2760, 'optimizer': 'RMSprop'}. Best is trial 1 with value: 0.01202602275116901.
2026-05-15 19:34:56,086 - experiment_functions - INFO - Early stopping at epoch 3000. Best Recall: 0.0160
2026-05-15 19:34:56,218 - optuna.study.study - INFO - Trial 12 finished with value: 0.01604701392630094 and parameters: {'n_layers': 3, 'embedding_dim': 32, 'lr': 0.016235571706510934, 'lambda_val': 2.885320143898879e-05, 'batch_size': 1584, 'optimizer': 'RMSprop'}. Best is trial 12 with value: 0.01604701392630094.
2026-05-15 19:35:04,899 - experiment_functions - INFO - Early stopping at epoch 1450. Best Recall: 0.0115
2026-05-15 19:35:05,048 - optuna.study.study - INFO - Trial 13 finished with value: 0.01148677432518375 and parameters: {'n_layers': 3, 'embedding_dim': 32, 'lr': 0.013844988825452733, 'lambda_val': 1.0627901277596688e-06, 'batch_size': 1432, 'optimizer': 'RMSprop'}. Best is trial 12 with value: 0.01604701392630094.
2026-05-15 19:35:11,940 - optuna.study._optimize - INFO - Trial 14 pruned. 
2026-05-15 19:35:15,914 - experiment_functions - INFO - Early stopping at epoch 500. Best Recall: 0.0097
2026-05-15 19:35:16,096 - optuna.study.study - INFO - Trial 15 finished with value: 0.009708490770513185 and parameters: {'n_layers': 4, 'embedding_dim': 96, 'lr': 0.0075557814700028085, 'lambda_val': 2.109702020158542e-05, 'batch_size': 901, 'optimizer': 'RMSprop'}. Best is trial 12 with value: 0.01604701392630094.
2026-05-15 19:35:22,432 - experiment_functions - INFO - Early stopping at epoch 950. Best Recall: 0.0102
2026-05-15 19:35:22,570 - optuna.study.study - INFO - Trial 16 finished with value: 0.010150760074603166 and parameters: {'n_layers': 2, 'embedding_dim': 32, 'lr': 0.029704124446228004, 'lambda_val': 1.114605427257463e-06, 'batch_size': 2585, 'optimizer': 'RMSprop'}. Best is trial 12 with value: 0.01604701392630094.
2026-05-15 19:35:33,095 - optuna.study._optimize - INFO - Trial 17 pruned. 
2026-05-15 19:35:37,275 - experiment_functions - INFO - Early stopping at epoch 550. Best Recall: 0.0099
2026-05-15 19:35:37,369 - optuna.study.study - INFO - Trial 18 finished with value: 0.009936981992919595 and parameters: {'n_layers': 2, 'embedding_dim': 256, 'lr': 0.05234479889533041, 'lambda_val': 9.94820427644188e-06, 'batch_size': 596, 'optimizer': 'RMSprop'}. Best is trial 12 with value: 0.01604701392630094.
2026-05-15 19:35:41,592 - experiment_functions - INFO - Early stopping at epoch 550. Best Recall: 0.0072
2026-05-15 19:35:41,709 - optuna.study.study - INFO - Trial 19 finished with value: 0.007180919503526265 and parameters: {'n_layers': 4, 'embedding_dim': 32, 'lr': 0.0013924731447428015, 'lambda_val': 2.828973204747638e-06, 'batch_size': 2268, 'optimizer': 'RMSprop'}. Best is trial 12 with value: 0.01604701392630094.
2026-05-15 19:35:45,615 - experiment_functions - INFO - Early stopping at epoch 500. Best Recall: 0.0038
2026-05-15 19:35:45,742 - optuna.study.study - INFO - Trial 20 finished with value: 0.0037818076511078207 and parameters: {'n_layers': 3, 'embedding_dim': 96, 'lr': 0.008356380927190802, 'lambda_val': 0.0013606891657003714, 'batch_size': 1900, 'optimizer': 'SGD'}. Best is trial 12 with value: 0.01604701392630094.
2026-05-15 19:35:49,993 - experiment_functions - INFO - Early stopping at epoch 500. Best Recall: 0.0080
2026-05-15 19:35:50,099 - optuna.study.study - INFO - Trial 21 finished with value: 0.00796810315927885 and parameters: {'n_layers': 3, 'embedding_dim': 32, 'lr': 0.014749441735806995, 'lambda_val': 1.2896726421439526e-06, 'batch_size': 1342, 'optimizer': 'RMSprop'}. Best is trial 12 with value: 0.01604701392630094.
2026-05-15 19:35:54,911 - experiment_functions - INFO - Early stopping at epoch 600. Best Recall: 0.0131
2026-05-15 19:35:55,073 - optuna.study.study - INFO - Trial 22 finished with value: 0.01312552681531926 and parameters: {'n_layers': 3, 'embedding_dim': 32, 'lr': 0.03677198618805417, 'lambda_val': 9.47129757043891e-06, 'batch_size': 1391, 'optimizer': 'RMSprop'}. Best is trial 12 with value: 0.01604701392630094.
2026-05-15 19:35:59,563 - experiment_functions - INFO - Early stopping at epoch 600. Best Recall: 0.0118
2026-05-15 19:35:59,688 - optuna.study.study - INFO - Trial 23 finished with value: 0.011830962804771847 and parameters: {'n_layers': 3, 'embedding_dim': 32, 'lr': 0.04645993075159784, 'lambda_val': 1.3775604002852092e-05, 'batch_size': 1115, 'optimizer': 'RMSprop'}. Best is trial 12 with value: 0.01604701392630094.
2026-05-15 19:36:11,590 - experiment_functions - INFO - Early stopping at epoch 2000. Best Recall: 0.0115
2026-05-15 19:36:11,761 - optuna.study.study - INFO - Trial 24 finished with value: 0.011535965451806606 and parameters: {'n_layers': 2, 'embedding_dim': 32, 'lr': 0.0383317817353745, 'lambda_val': 6.0808259991240286e-05, 'batch_size': 1764, 'optimizer': 'RMSprop'}. Best is trial 12 with value: 0.01604701392630094.
2026-05-15 19:36:15,879 - experiment_functions - INFO - Early stopping at epoch 500. Best Recall: 0.0070
2026-05-15 19:36:16,006 - optuna.study.study - INFO - Trial 25 finished with value: 0.007028965402061106 and parameters: {'n_layers': 4, 'embedding_dim': 128, 'lr': 0.006039181648086775, 'lambda_val': 5.333044649773886e-06, 'batch_size': 518, 'optimizer': 'RMSprop'}. Best is trial 12 with value: 0.01604701392630094.
2026-05-15 19:36:19,980 - experiment_functions - INFO - Early stopping at epoch 500. Best Recall: 0.0103
2026-05-15 19:36:20,096 - optuna.study.study - INFO - Trial 26 finished with value: 0.010251766476071907 and parameters: {'n_layers': 3, 'embedding_dim': 256, 'lr': 0.09678871427928529, 'lambda_val': 3.641844859888699e-05, 'batch_size': 2553, 'optimizer': 'RMSprop'}. Best is trial 12 with value: 0.01604701392630094.
2026-05-15 19:36:33,490 - experiment_functions - INFO - Early stopping at epoch 2300. Best Recall: 0.0124
2026-05-15 19:36:33,618 - optuna.study.study - INFO - Trial 27 finished with value: 0.012422839079650597 and parameters: {'n_layers': 2, 'embedding_dim': 32, 'lr': 0.01192108865166046, 'lambda_val': 0.00015276447580821724, 'batch_size': 2052, 'optimizer': 'RMSprop'}. Best is trial 12 with value: 0.01604701392630094.
2026-05-15 19:36:42,722 - experiment_functions - INFO - Early stopping at epoch 500. Best Recall: 0.0028
2026-05-15 19:36:42,989 - optuna.study.study - INFO - Trial 28 finished with value: 0.0028237159225510604 and parameters: {'n_layers': 2, 'embedding_dim': 32, 'lr': 0.00047067455913924925, 'lambda_val': 0.00014724656346361785, 'batch_size': 2026, 'optimizer': 'SGD'}. Best is trial 12 with value: 0.01604701392630094.
2026-05-15 19:36:53,197 - optuna.study._optimize - INFO - Trial 29 pruned. 
2026-05-15 19:36:58,469 - experiment_functions - INFO - Early stopping at epoch 850. Best Recall: 0.0008
2026-05-15 19:36:58,584 - optuna.study.study - INFO - Trial 30 finished with value: 0.0008172261793617471 and parameters: {'n_layers': 2, 'embedding_dim': 32, 'lr': 0.04386315068074983, 'lambda_val': 0.00014375366537564132, 'batch_size': 2182, 'optimizer': 'SGD'}. Best is trial 12 with value: 0.01604701392630094.
2026-05-15 19:37:03,227 - experiment_functions - INFO - Early stopping at epoch 600. Best Recall: 0.0124
2026-05-15 19:37:03,376 - optuna.study.study - INFO - Trial 31 finished with value: 0.01238295011049333 and parameters: {'n_layers': 3, 'embedding_dim': 128, 'lr': 0.022713904364387676, 'lambda_val': 8.804449030915194e-06, 'batch_size': 1129, 'optimizer': 'RMSprop'}. Best is trial 12 with value: 0.01604701392630094.
2026-05-15 19:37:07,290 - experiment_functions - INFO - Early stopping at epoch 500. Best Recall: 0.0134
2026-05-15 19:37:07,406 - optuna.study.study - INFO - Trial 32 finished with value: 0.01335574871713223 and parameters: {'n_layers': 3, 'embedding_dim': 128, 'lr': 0.024703987771698133, 'lambda_val': 9.651949003838278e-06, 'batch_size': 1176, 'optimizer': 'RMSprop'}. Best is trial 12 with value: 0.01604701392630094.
2026-05-15 19:37:12,486 - experiment_functions - INFO - Early stopping at epoch 600. Best Recall: 0.0052
2026-05-15 19:37:12,624 - optuna.study.study - INFO - Trial 33 finished with value: 0.00516146931060825 and parameters: {'n_layers': 3, 'embedding_dim': 128, 'lr': 0.0030938900687909796, 'lambda_val': 1.6496125917792133e-05, 'batch_size': 774, 'optimizer': 'RMSprop'}. Best is trial 12 with value: 0.01604701392630094.
2026-05-15 19:37:20,151 - experiment_functions - INFO - Early stopping at epoch 1100. Best Recall: 0.0143
2026-05-15 19:37:20,277 - optuna.study.study - INFO - Trial 34 finished with value: 0.014311655613135698 and parameters: {'n_layers': 3, 'embedding_dim': 32, 'lr': 0.0634818989323917, 'lambda_val': 9.57985731527459e-05, 'batch_size': 1299, 'optimizer': 'RMSprop'}. Best is trial 12 with value: 0.01604701392630094.
2026-05-15 19:37:27,333 - optuna.study._optimize - INFO - Trial 35 pruned. 
2026-05-15 19:37:43,935 - experiment_functions - INFO - Early stopping at epoch 2750. Best Recall: 0.0178
2026-05-15 19:37:44,136 - optuna.study.study - INFO - Trial 36 finished with value: 0.017814573044778376 and parameters: {'n_layers': 4, 'embedding_dim': 128, 'lr': 0.025969455068691916, 'lambda_val': 8.612469120799253e-05, 'batch_size': 780, 'optimizer': 'Adam'}. Best is trial 36 with value: 0.017814573044778376.
2026-05-15 19:37:48,480 - experiment_functions - INFO - Early stopping at epoch 550. Best Recall: 0.0109
2026-05-15 19:37:48,642 - optuna.study.study - INFO - Trial 37 finished with value: 0.010864413143777438 and parameters: {'n_layers': 4, 'embedding_dim': 128, 'lr': 0.09514402002330227, 'lambda_val': 7.52581247012925e-05, 'batch_size': 820, 'optimizer': 'Adam'}. Best is trial 36 with value: 0.017814573044778376.
2026-05-15 19:37:56,749 - optuna.study._optimize - INFO - Trial 38 pruned. 
2026-05-15 19:38:00,765 - experiment_functions - INFO - Early stopping at epoch 550. Best Recall: 0.0051
2026-05-15 19:38:00,881 - optuna.study.study - INFO - Trial 39 finished with value: 0.005096053526513285 and parameters: {'n_layers': 4, 'embedding_dim': 128, 'lr': 0.001626409136902328, 'lambda_val': 3.066228489301121e-05, 'batch_size': 971, 'optimizer': 'Adam'}. Best is trial 36 with value: 0.017814573044778376.
2026-05-15 19:38:07,351 - optuna.study._optimize - INFO - Trial 40 pruned. 
2026-05-15 19:38:20,198 - experiment_functions - INFO - Early stopping at epoch 2200. Best Recall: 0.0159
2026-05-15 19:38:20,325 - optuna.study.study - INFO - Trial 41 finished with value: 0.015873671320095522 and parameters: {'n_layers': 3, 'embedding_dim': 96, 'lr': 0.029548780947893025, 'lambda_val': 1.0743264716514266e-05, 'batch_size': 1253, 'optimizer': 'Adam'}. Best is trial 36 with value: 0.017814573044778376.
2026-05-15 19:38:30,805 - experiment_functions - INFO - Early stopping at epoch 1600. Best Recall: 0.0157
2026-05-15 19:38:30,921 - optuna.study.study - INFO - Trial 42 finished with value: 0.015666972233894544 and parameters: {'n_layers': 3, 'embedding_dim': 96, 'lr': 0.05490110206255247, 'lambda_val': 0.00023388457818781814, 'batch_size': 1211, 'optimizer': 'Adam'}. Best is trial 36 with value: 0.017814573044778376.
2026-05-15 19:38:34,755 - experiment_functions - INFO - Early stopping at epoch 550. Best Recall: 0.0093
2026-05-15 19:38:34,872 - optuna.study.study - INFO - Trial 43 finished with value: 0.009281685011823816 and parameters: {'n_layers': 3, 'embedding_dim': 96, 'lr': 0.06293283512661686, 'lambda_val': 0.00024840915046841166, 'batch_size': 1015, 'optimizer': 'Adam'}. Best is trial 36 with value: 0.017814573044778376.
2026-05-15 19:38:41,308 - optuna.study._optimize - INFO - Trial 44 pruned. 
2026-05-15 19:38:45,859 - experiment_functions - INFO - Early stopping at epoch 650. Best Recall: 0.0051
2026-05-15 19:38:46,446 - optuna.study.study - INFO - Trial 45 finished with value: 0.005108400504849342 and parameters: {'n_layers': 4, 'embedding_dim': 96, 'lr': 0.01717801794405051, 'lambda_val': 0.0011048974462151075, 'batch_size': 719, 'optimizer': 'Adam'}. Best is trial 36 with value: 0.017814573044778376.
2026-05-15 19:38:50,241 - experiment_functions - INFO - Early stopping at epoch 500. Best Recall: 0.0053
2026-05-15 19:38:50,346 - optuna.study.study - INFO - Trial 46 finished with value: 0.005345811224897856 and parameters: {'n_layers': 3, 'embedding_dim': 96, 'lr': 0.07520557388474838, 'lambda_val': 0.002718857612478659, 'batch_size': 1760, 'optimizer': 'Adam'}. Best is trial 36 with value: 0.017814573044778376.
2026-05-15 19:38:57,146 - experiment_functions - INFO - Early stopping at epoch 1050. Best Recall: 0.0131
2026-05-15 19:38:57,262 - optuna.study.study - INFO - Trial 47 finished with value: 0.013081344128683581 and parameters: {'n_layers': 3, 'embedding_dim': 96, 'lr': 0.03274984224727311, 'lambda_val': 9.396276254462462e-05, 'batch_size': 1505, 'optimizer': 'Adam'}. Best is trial 36 with value: 0.017814573044778376.
2026-05-15 19:39:18,828 - experiment_functions - INFO - Early stopping at epoch 3600. Best Recall: 0.0182
2026-05-15 19:39:18,949 - optuna.study.study - INFO - Trial 48 finished with value: 0.01816511259310743 and parameters: {'n_layers': 4, 'embedding_dim': 64, 'lr': 0.05683096486811185, 'lambda_val': 4.4741524317958487e-05, 'batch_size': 989, 'optimizer': 'Adam'}. Best is trial 48 with value: 0.01816511259310743.
2026-05-15 19:39:23,718 - experiment_functions - INFO - Early stopping at epoch 550. Best Recall: 0.0079
2026-05-15 19:39:23,846 - optuna.study.study - INFO - Trial 49 finished with value: 0.00791876890861899 and parameters: {'n_layers': 4, 'embedding_dim': 64, 'lr': 0.0046635897022374645, 'lambda_val': 4.103317258941549e-05, 'batch_size': 912, 'optimizer': 'Adam'}. Best is trial 48 with value: 0.01816511259310743.
2026-05-15 19:39:30,805 - experiment_functions - INFO - Early stopping at epoch 850. Best Recall: 0.0046
2026-05-15 19:39:30,954 - optuna.study.study - INFO - Trial 50 finished with value: 0.004618535155064805 and parameters: {'n_layers': 4, 'embedding_dim': 64, 'lr': 0.01757741016799102, 'lambda_val': 0.02916438558019771, 'batch_size': 1061, 'optimizer': 'Adam'}. Best is trial 48 with value: 0.01816511259310743.
2026-05-15 19:39:58,597 - experiment_functions - INFO - Early stopping at epoch 3600. Best Recall: 0.0192
2026-05-15 19:39:58,728 - optuna.study.study - INFO - Trial 51 finished with value: 0.019165088372729407 and parameters: {'n_layers': 4, 'embedding_dim': 64, 'lr': 0.06772203795351059, 'lambda_val': 0.00019679342948984203, 'batch_size': 1261, 'optimizer': 'Adam'}. Best is trial 51 with value: 0.019165088372729407.
2026-05-15 19:40:20,727 - experiment_functions - INFO - Early stopping at epoch 3000. Best Recall: 0.0187
2026-05-15 19:40:20,840 - optuna.study.study - INFO - Trial 52 finished with value: 0.018742115127317965 and parameters: {'n_layers': 4, 'embedding_dim': 64, 'lr': 0.03769967591261265, 'lambda_val': 0.0001833974984004364, 'batch_size': 847, 'optimizer': 'Adam'}. Best is trial 51 with value: 0.019165088372729407.
2026-05-15 19:40:28,572 - optuna.study._optimize - INFO - Trial 53 pruned. 
2026-05-15 19:40:36,371 - optuna.study._optimize - INFO - Trial 54 pruned. 
2026-05-15 19:40:44,950 - experiment_functions - INFO - Early stopping at epoch 1050. Best Recall: 0.0147
2026-05-15 19:40:45,087 - optuna.study.study - INFO - Trial 55 finished with value: 0.014668109363386354 and parameters: {'n_layers': 4, 'embedding_dim': 64, 'lr': 0.03325242487638415, 'lambda_val': 5.4548197913543274e-05, 'batch_size': 566, 'optimizer': 'Adam'}. Best is trial 51 with value: 0.019165088372729407.
2026-05-15 19:40:49,741 - experiment_functions - INFO - Early stopping at epoch 550. Best Recall: 0.0057
