2026-05-15 20:05:06,185 - optuna.study._optimize - INFO - Trial 191 pruned. 
2026-05-15 20:05:23,888 - experiment_functions - INFO - Early stopping at epoch 2900. Best Recall: 0.0225
2026-05-15 20:05:24,002 - optuna.study.study - INFO - Trial 192 finished with value: 0.02246331657331573 and parameters: {'n_layers': 4, 'embedding_dim': 64, 'lr': 0.034241870727862354, 'lambda_val': 7.502527367038192e-05, 'batch_size': 3482, 'optimizer': 'Adam'}. Best is trial 119 with value: 0.025263757590283552.
2026-05-15 20:05:34,899 - experiment_functions - INFO - Early stopping at epoch 1500. Best Recall: 0.0197
2026-05-15 20:05:35,055 - optuna.study.study - INFO - Trial 193 finished with value: 0.0196729075907076 and parameters: {'n_layers': 4, 'embedding_dim': 64, 'lr': 0.03430951966193051, 'lambda_val': 8.087723388707184e-05, 'batch_size': 3487, 'optimizer': 'Adam'}. Best is trial 119 with value: 0.025263757590283552.
2026-05-15 20:05:43,615 - optuna.study._optimize - INFO - Trial 194 pruned. 
2026-05-15 20:06:07,007 - experiment_functions - INFO - Early stopping at epoch 2650. Best Recall: 0.0212
2026-05-15 20:06:07,119 - optuna.study.study - INFO - Trial 195 finished with value: 0.021227942630295427 and parameters: {'n_layers': 4, 'embedding_dim': 64, 'lr': 0.018109230181751222, 'lambda_val': 9.041171267891823e-05, 'batch_size': 3519, 'optimizer': 'Adam'}. Best is trial 119 with value: 0.025263757590283552.
2026-05-15 20:06:20,867 - optuna.study._optimize - INFO - Trial 196 pruned. 
2026-05-15 20:06:32,913 - experiment_functions - INFO - Early stopping at epoch 1950. Best Recall: 0.0189
2026-05-15 20:06:33,069 - optuna.study.study - INFO - Trial 197 finished with value: 0.01885528002891784 and parameters: {'n_layers': 4, 'embedding_dim': 64, 'lr': 0.027158245447253777, 'lambda_val': 6.919259512194758e-05, 'batch_size': 3712, 'optimizer': 'Adam'}. Best is trial 119 with value: 0.025263757590283552.
2026-05-15 20:06:40,368 - optuna.study._optimize - INFO - Trial 198 pruned. 
2026-05-15 20:06:46,550 - optuna.study._optimize - INFO - Trial 199 pruned. 
2026-05-15 20:06:50,387 - experiment_functions - INFO - Early stopping at epoch 550. Best Recall: 0.0079
2026-05-15 20:06:50,533 - optuna.study.study - INFO - Trial 200 finished with value: 0.00785192133906637 and parameters: {'n_layers': 4, 'embedding_dim': 64, 'lr': 0.013276824636129388, 'lambda_val': 5.585644062736869e-05, 'batch_size': 3539, 'optimizer': 'Adam'}. Best is trial 119 with value: 0.025263757590283552.
2026-05-15 20:06:57,602 - optuna.study._optimize - INFO - Trial 201 pruned. 
2026-05-15 20:07:04,238 - optuna.study._optimize - INFO - Trial 202 pruned. 
2026-05-15 20:07:11,685 - experiment_functions - INFO - Early stopping at epoch 1200. Best Recall: 0.0188
2026-05-15 20:07:11,839 - optuna.study.study - INFO - Trial 203 finished with value: 0.01883935625685038 and parameters: {'n_layers': 4, 'embedding_dim': 64, 'lr': 0.03045904921690854, 'lambda_val': 3.0403588402098733e-05, 'batch_size': 3462, 'optimizer': 'Adam'}. Best is trial 119 with value: 0.025263757590283552.
2026-05-15 20:07:35,701 - experiment_functions - INFO - Early stopping at epoch 3000. Best Recall: 0.0239
2026-05-15 20:07:35,846 - optuna.study.study - INFO - Trial 204 finished with value: 0.023945590747086198 and parameters: {'n_layers': 4, 'embedding_dim': 64, 'lr': 0.039650856444017765, 'lambda_val': 4.778166937265324e-05, 'batch_size': 3604, 'optimizer': 'Adam'}. Best is trial 119 with value: 0.025263757590283552.
2026-05-15 20:07:46,709 - experiment_functions - INFO - Early stopping at epoch 1700. Best Recall: 0.0185
2026-05-15 20:07:46,843 - optuna.study.study - INFO - Trial 205 finished with value: 0.01845285714050067 and parameters: {'n_layers': 4, 'embedding_dim': 64, 'lr': 0.022895117069999738, 'lambda_val': 6.463274441505202e-05, 'batch_size': 3638, 'optimizer': 'Adam'}. Best is trial 119 with value: 0.025263757590283552.
2026-05-15 20:07:59,365 - experiment_functions - INFO - Early stopping at epoch 2100. Best Recall: 0.0223
2026-05-15 20:07:59,520 - optuna.study.study - INFO - Trial 206 finished with value: 0.022263287014859856 and parameters: {'n_layers': 4, 'embedding_dim': 64, 'lr': 0.0371325861453343, 'lambda_val': 5.3648350306990154e-05, 'batch_size': 3557, 'optimizer': 'Adam'}. Best is trial 119 with value: 0.025263757590283552.
2026-05-15 20:08:11,627 - experiment_functions - INFO - Early stopping at epoch 2000. Best Recall: 0.0233
2026-05-15 20:08:11,780 - optuna.study.study - INFO - Trial 207 finished with value: 0.02327563912295148 and parameters: {'n_layers': 4, 'embedding_dim': 64, 'lr': 0.034552962358672994, 'lambda_val': 4.636526534284193e-05, 'batch_size': 3778, 'optimizer': 'Adam'}. Best is trial 119 with value: 0.025263757590283552.
2026-05-15 20:08:25,099 - experiment_functions - INFO - Early stopping at epoch 1850. Best Recall: 0.0209
2026-05-15 20:08:25,201 - optuna.study.study - INFO - Trial 208 finished with value: 0.020924425746625334 and parameters: {'n_layers': 4, 'embedding_dim': 64, 'lr': 0.035540335114807926, 'lambda_val': 4.445212724532348e-05, 'batch_size': 3793, 'optimizer': 'Adam'}. Best is trial 119 with value: 0.025263757590283552.
2026-05-15 20:08:31,652 - optuna.study._optimize - INFO - Trial 209 pruned. 
2026-05-15 20:08:56,627 - experiment_functions - INFO - Early stopping at epoch 2800. Best Recall: 0.0205
2026-05-15 20:08:56,750 - optuna.study.study - INFO - Trial 210 finished with value: 0.020496191574806005 and parameters: {'n_layers': 4, 'embedding_dim': 64, 'lr': 0.03133519989146959, 'lambda_val': 4.051574143432386e-05, 'batch_size': 3591, 'optimizer': 'Adam'}. Best is trial 119 with value: 0.025263757590283552.
2026-05-15 20:09:13,034 - experiment_functions - INFO - Early stopping at epoch 2700. Best Recall: 0.0249
2026-05-15 20:09:13,135 - optuna.study.study - INFO - Trial 211 finished with value: 0.024906428284970583 and parameters: {'n_layers': 4, 'embedding_dim': 64, 'lr': 0.04484645229808437, 'lambda_val': 7.141462870111739e-05, 'batch_size': 3696, 'optimizer': 'Adam'}. Best is trial 119 with value: 0.025263757590283552.
2026-05-15 20:09:25,900 - experiment_functions - INFO - Early stopping at epoch 2100. Best Recall: 0.0213
2026-05-15 20:09:26,066 - optuna.study.study - INFO - Trial 212 finished with value: 0.02131863428594524 and parameters: {'n_layers': 4, 'embedding_dim': 64, 'lr': 0.03877500638397984, 'lambda_val': 6.752461170132502e-05, 'batch_size': 3676, 'optimizer': 'Adam'}. Best is trial 119 with value: 0.025263757590283552.
2026-05-15 20:09:41,610 - experiment_functions - INFO - Early stopping at epoch 2400. Best Recall: 0.0233
2026-05-15 20:09:41,766 - optuna.study.study - INFO - Trial 213 finished with value: 0.023339682119898966 and parameters: {'n_layers': 4, 'embedding_dim': 64, 'lr': 0.04450630387238272, 'lambda_val': 6.669981423704889e-05, 'batch_size': 3689, 'optimizer': 'Adam'}. Best is trial 119 with value: 0.025263757590283552.
2026-05-15 20:09:47,511 - experiment_functions - INFO - Early stopping at epoch 850. Best Recall: 0.0185
2026-05-15 20:09:47,635 - optuna.study.study - INFO - Trial 214 finished with value: 0.018468478275663846 and parameters: {'n_layers': 4, 'embedding_dim': 64, 'lr': 0.04505125304279826, 'lambda_val': 5.011761911889138e-05, 'batch_size': 3676, 'optimizer': 'Adam'}. Best is trial 119 with value: 0.025263757590283552.
2026-05-15 20:10:05,405 - experiment_functions - INFO - Early stopping at epoch 2600. Best Recall: 0.0222
2026-05-15 20:10:05,561 - optuna.study.study - INFO - Trial 215 finished with value: 0.022248881789257467 and parameters: {'n_layers': 4, 'embedding_dim': 64, 'lr': 0.038565958836716006, 'lambda_val': 6.90424816031188e-05, 'batch_size': 3887, 'optimizer': 'Adam'}. Best is trial 119 with value: 0.025263757590283552.
2026-05-15 20:10:10,678 - experiment_functions - INFO - Early stopping at epoch 800. Best Recall: 0.0126
2026-05-15 20:10:10,800 - optuna.study.study - INFO - Trial 216 finished with value: 0.012560031704039479 and parameters: {'n_layers': 2, 'embedding_dim': 64, 'lr': 0.048383607896704144, 'lambda_val': 3.2485134133672355e-05, 'batch_size': 3951, 'optimizer': 'Adam'}. Best is trial 119 with value: 0.025263757590283552.
2026-05-15 20:10:18,531 - optuna.study._optimize - INFO - Trial 217 pruned. 
2026-05-15 20:10:22,429 - experiment_functions - INFO - Early stopping at epoch 500. Best Recall: 0.0026
2026-05-15 20:10:22,587 - optuna.study.study - INFO - Trial 218 finished with value: 0.0025634128745891703 and parameters: {'n_layers': 4, 'embedding_dim': 256, 'lr': 0.043434469610118404, 'lambda_val': 7.744120532807824e-05, 'batch_size': 3752, 'optimizer': 'SGD'}. Best is trial 119 with value: 0.025263757590283552.
2026-05-15 20:10:38,403 - experiment_functions - INFO - Early stopping at epoch 1450. Best Recall: 0.0183
2026-05-15 20:10:38,558 - optuna.study.study - INFO - Trial 219 finished with value: 0.018282735863246035 and parameters: {'n_layers': 4, 'embedding_dim': 64, 'lr': 0.05145799730335567, 'lambda_val': 4.2274251207200626e-05, 'batch_size': 3817, 'optimizer': 'Adam'}. Best is trial 119 with value: 0.025263757590283552.
2026-05-15 20:10:45,572 - experiment_functions - INFO - Early stopping at epoch 700. Best Recall: 0.0045
2026-05-15 20:10:45,683 - optuna.study.study - INFO - Trial 220 finished with value: 0.004458515271292034 and parameters: {'n_layers': 4, 'embedding_dim': 64, 'lr': 0.031010219416931953, 'lambda_val': 0.006306706085125581, 'batch_size': 3608, 'optimizer': 'Adam'}. Best is trial 119 with value: 0.025263757590283552.
2026-05-15 20:11:07,009 - experiment_functions - INFO - Early stopping at epoch 3000. Best Recall: 0.0210
2026-05-15 20:11:07,110 - optuna.study.study - INFO - Trial 221 finished with value: 0.020978921369807377 and parameters: {'n_layers': 4, 'embedding_dim': 64, 'lr': 0.038261603502792195, 'lambda_val': 5.820505310255217e-05, 'batch_size': 3722, 'optimizer': 'Adam'}. Best is trial 119 with value: 0.025263757590283552.
2026-05-15 20:11:18,017 - experiment_functions - INFO - Early stopping at epoch 1850. Best Recall: 0.0222
2026-05-15 20:11:18,087 - optuna.study.study - INFO - Trial 222 finished with value: 0.022192222463861613 and parameters: {'n_layers': 4, 'embedding_dim': 64, 'lr': 0.039119272872681715, 'lambda_val': 6.774480791460899e-05, 'batch_size': 3671, 'optimizer': 'Adam'}. Best is trial 119 with value: 0.025263757590283552.
2026-05-15 20:11:23,818 - optuna.study._optimize - INFO - Trial 223 pruned. 
2026-05-15 20:11:27,977 - experiment_functions - INFO - Early stopping at epoch 600. Best Recall: 0.0077
2026-05-15 20:11:28,566 - optuna.study.study - INFO - Trial 224 finished with value: 0.00772696932021987 and parameters: {'n_layers': 4, 'embedding_dim': 64, 'lr': 0.0010832996449783763, 'lambda_val': 4.148031923071603e-05, 'batch_size': 3597, 'optimizer': 'Adam'}. Best is trial 119 with value: 0.025263757590283552.
2026-05-15 20:11:43,345 - experiment_functions - INFO - Early stopping at epoch 1200. Best Recall: 0.0204
2026-05-15 20:11:43,426 - optuna.study.study - INFO - Trial 225 finished with value: 0.02037438863242773 and parameters: {'n_layers': 4, 'embedding_dim': 64, 'lr': 0.04731290102325227, 'lambda_val': 6.535500840213436e-05, 'batch_size': 3707, 'optimizer': 'Adam'}. Best is trial 119 with value: 0.025263757590283552.
2026-05-15 20:11:47,796 - experiment_functions - INFO - Early stopping at epoch 700. Best Recall: 0.0166
2026-05-15 20:11:47,899 - optuna.study.study - INFO - Trial 226 finished with value: 0.01657730978854615 and parameters: {'n_layers': 4, 'embedding_dim': 96, 'lr': 0.0344639924685345, 'lambda_val': 5.041973025242508e-05, 'batch_size': 3808, 'optimizer': 'RMSprop'}. Best is trial 119 with value: 0.025263757590283552.
2026-05-15 20:11:54,098 - experiment_functions - INFO - Early stopping at epoch 1050. Best Recall: 0.0185
2026-05-15 20:11:54,177 - optuna.study.study - INFO - Trial 227 finished with value: 0.018474567541571948 and parameters: {'n_layers': 4, 'embedding_dim': 64, 'lr': 0.054856065538181405, 'lambda_val': 8.344128967000954e-05, 'batch_size': 3569, 'optimizer': 'Adam'}. Best is trial 119 with value: 0.025263757590283552.
2026-05-15 20:12:02,030 - experiment_functions - INFO - Early stopping at epoch 1350. Best Recall: 0.0189
2026-05-15 20:12:02,134 - optuna.study.study - INFO - Trial 228 finished with value: 0.01892785517663756 and parameters: {'n_layers': 4, 'embedding_dim': 128, 'lr': 0.04186469417188587, 'lambda_val': 3.379972965621089e-05, 'batch_size': 3641, 'optimizer': 'Adam'}. Best is trial 119 with value: 0.025263757590283552.
2026-05-15 20:12:18,073 - experiment_functions - INFO - Early stopping at epoch 2200. Best Recall: 0.0201
2026-05-15 20:12:18,174 - optuna.study.study - INFO - Trial 229 finished with value: 0.020118857648290363 and parameters: {'n_layers': 4, 'embedding_dim': 64, 'lr': 0.029797875128498442, 'lambda_val': 0.00010104318975678104, 'batch_size': 4030, 'optimizer': 'Adam'}. Best is trial 119 with value: 0.025263757590283552.
2026-05-15 20:12:24,779 - optuna.study._optimize - INFO - Trial 230 pruned. 
2026-05-15 20:12:31,946 - optuna.study._optimize - INFO - Trial 231 pruned. 
2026-05-15 20:12:46,823 - experiment_functions - INFO - Early stopping at epoch 2450. Best Recall: 0.0221
2026-05-15 20:12:46,981 - optuna.study.study - INFO - Trial 232 finished with value: 0.022136064028763922 and parameters: {'n_layers': 4, 'embedding_dim': 64, 'lr': 0.03874479292748409, 'lambda_val': 6.933096340335112e-05, 'batch_size': 3703, 'optimizer': 'Adam'}. Best is trial 119 with value: 0.025263757590283552.
2026-05-15 20:12:57,583 - experiment_functions - INFO - Early stopping at epoch 1700. Best Recall: 0.0201
2026-05-15 20:12:57,706 - optuna.study.study - INFO - Trial 233 finished with value: 0.020144084153459273 and parameters: {'n_layers': 4, 'embedding_dim': 64, 'lr': 0.04822336660614428, 'lambda_val': 7.486870378208064e-05, 'batch_size': 3737, 'optimizer': 'Adam'}. Best is trial 119 with value: 0.025263757590283552.
2026-05-15 20:13:10,497 - experiment_functions - INFO - Early stopping at epoch 1950. Best Recall: 0.0205
2026-05-15 20:13:10,600 - optuna.study.study - INFO - Trial 234 finished with value: 0.020472004260267254 and parameters: {'n_layers': 4, 'embedding_dim': 64, 'lr': 0.02620202032564467, 'lambda_val': 4.428929811563593e-05, 'batch_size': 3609, 'optimizer': 'Adam'}. Best is trial 119 with value: 0.025263757590283552.
2026-05-15 20:13:14,353 - experiment_functions - INFO - Early stopping at epoch 550. Best Recall: 0.0099
2026-05-15 20:13:14,509 - optuna.study.study - INFO - Trial 235 finished with value: 0.009861497285976274 and parameters: {'n_layers': 4, 'embedding_dim': 64, 'lr': 0.005027046366014739, 'lambda_val': 0.0001130877497606251, 'batch_size': 3505, 'optimizer': 'Adam'}. Best is trial 119 with value: 0.025263757590283552.
2026-05-15 20:13:23,958 - experiment_functions - INFO - Early stopping at epoch 1550. Best Recall: 0.0219
2026-05-15 20:13:24,138 - optuna.study.study - INFO - Trial 236 finished with value: 0.02186204797311924 and parameters: {'n_layers': 4, 'embedding_dim': 64, 'lr': 0.03402809486508273, 'lambda_val': 5.989025445886329e-05, 'batch_size': 3812, 'optimizer': 'Adam'}. Best is trial 119 with value: 0.025263757590283552.
2026-05-15 20:13:46,352 - experiment_functions - INFO - Early stopping at epoch 2100. Best Recall: 0.0207
2026-05-15 20:13:46,475 - optuna.study.study - INFO - Trial 237 finished with value: 0.020748770309011906 and parameters: {'n_layers': 4, 'embedding_dim': 64, 'lr': 0.055598593736504866, 'lambda_val': 6.199065615959292e-05, 'batch_size': 3928, 'optimizer': 'Adam'}. Best is trial 119 with value: 0.025263757590283552.
2026-05-15 20:13:53,744 - optuna.study._optimize - INFO - Trial 238 pruned. 
2026-05-15 20:13:58,932 - experiment_functions - INFO - Early stopping at epoch 800. Best Recall: 0.0108
2026-05-15 20:13:59,032 - optuna.study.study - INFO - Trial 239 finished with value: 0.010802262812481278 and parameters: {'n_layers': 1, 'embedding_dim': 64, 'lr': 0.03303406095979754, 'lambda_val': 5.406199190174448e-05, 'batch_size': 4089, 'optimizer': 'Adam'}. Best is trial 119 with value: 0.025263757590283552.
2026-05-15 20:14:05,275 - experiment_functions - INFO - Early stopping at epoch 1000. Best Recall: 0.0192
2026-05-15 20:14:05,432 - optuna.study.study - INFO - Trial 240 finished with value: 0.019209328706590145 and parameters: {'n_layers': 4, 'embedding_dim': 64, 'lr': 0.04599227692544706, 'lambda_val': 7.211730729809378e-05, 'batch_size': 3770, 'optimizer': 'Adam'}. Best is trial 119 with value: 0.025263757590283552.
2026-05-15 20:14:23,660 - experiment_functions - INFO - Early stopping at epoch 1450. Best Recall: 0.0198
2026-05-15 20:14:23,818 - optuna.study.study - INFO - Trial 241 finished with value: 0.019776506378100862 and parameters: {'n_layers': 4, 'embedding_dim': 64, 'lr': 0.02913573102148516, 'lambda_val': 3.719774395002016e-05, 'batch_size': 3561, 'optimizer': 'Adam'}. Best is trial 119 with value: 0.025263757590283552.
2026-05-15 20:14:32,972 - experiment_functions - INFO - Early stopping at epoch 1100. Best Recall: 0.0177
2026-05-15 20:14:33,093 - optuna.study.study - INFO - Trial 242 finished with value: 0.017713529512483193 and parameters: {'n_layers': 4, 'embedding_dim': 64, 'lr': 0.03543887168040738, 'lambda_val': 4.794741895651627e-05, 'batch_size': 3629, 'optimizer': 'Adam'}. Best is trial 119 with value: 0.025263757590283552.
2026-05-15 20:14:45,334 - experiment_functions - INFO - Early stopping at epoch 2100. Best Recall: 0.0198
2026-05-15 20:14:45,492 - optuna.study.study - INFO - Trial 243 finished with value: 0.01978685871942554 and parameters: {'n_layers': 4, 'embedding_dim': 64, 'lr': 0.04184169835439038, 'lambda_val': 5.963614071972258e-05, 'batch_size': 3851, 'optimizer': 'Adam'}. Best is trial 119 with value: 0.025263757590283552.
2026-05-15 20:14:53,605 - optuna.study._optimize - INFO - Trial 244 pruned. 
2026-05-15 20:15:08,662 - optuna.study._optimize - INFO - Trial 245 pruned. 
2026-05-15 20:15:14,922 - optuna.study._optimize - INFO - Trial 246 pruned. 
2026-05-15 20:15:30,057 - experiment_functions - INFO - Early stopping at epoch 2050. Best Recall: 0.0199
2026-05-15 20:15:30,212 - optuna.study.study - INFO - Trial 247 finished with value: 0.01989952392090683 and parameters: {'n_layers': 4, 'embedding_dim': 64, 'lr': 0.04638076740590113, 'lambda_val': 3.184438858576226e-05, 'batch_size': 3646, 'optimizer': 'Adam'}. Best is trial 119 with value: 0.025263757590283552.
2026-05-15 20:15:54,957 - experiment_functions - INFO - Early stopping at epoch 2600. Best Recall: 0.0214
2026-05-15 20:15:55,113 - optuna.study.study - INFO - Trial 248 finished with value: 0.021379461054379052 and parameters: {'n_layers': 4, 'embedding_dim': 64, 'lr': 0.037537582955109616, 'lambda_val': 6.926640541759327e-05, 'batch_size': 3760, 'optimizer': 'Adam'}. Best is trial 119 with value: 0.025263757590283552.
2026-05-15 20:16:03,845 - experiment_functions - INFO - Early stopping at epoch 1350. Best Recall: 0.0201
2026-05-15 20:16:04,017 - optuna.study.study - INFO - Trial 249 finished with value: 0.020106702050907428 and parameters: {'n_layers': 4, 'embedding_dim': 64, 'lr': 0.04105977920703188, 'lambda_val': 7.172755647700422e-05, 'batch_size': 3722, 'optimizer': 'Adam'}. Best is trial 119 with value: 0.025263757590283552.
2026-05-15 20:16:17,845 - experiment_functions - INFO - Early stopping at epoch 1300. Best Recall: 0.0190
2026-05-15 20:16:17,970 - optuna.study.study - INFO - Trial 250 finished with value: 0.018969495921329394 and parameters: {'n_layers': 4, 'embedding_dim': 64, 'lr': 0.052059433389257226, 'lambda_val': 0.00010611846345950197, 'batch_size': 3953, 'optimizer': 'Adam'}. Best is trial 119 with value: 0.025263757590283552.
2026-05-15 20:16:26,904 - experiment_functions - INFO - Early stopping at epoch 1350. Best Recall: 0.0224
2026-05-15 20:16:26,994 - optuna.study.study - INFO - Trial 251 finished with value: 0.022375128089079894 and parameters: {'n_layers': 4, 'embedding_dim': 64, 'lr': 0.03596657361542544, 'lambda_val': 6.585675394960694e-05, 'batch_size': 3858, 'optimizer': 'Adam'}. Best is trial 119 with value: 0.025263757590283552.
2026-05-15 20:16:40,644 - experiment_functions - INFO - Early stopping at epoch 2150. Best Recall: 0.0222
2026-05-15 20:16:41,216 - optuna.study.study - INFO - Trial 252 finished with value: 0.022171352332724294 and parameters: {'n_layers': 4, 'embedding_dim': 64, 'lr': 0.059817426282513, 'lambda_val': 7.891027151631268e-05, 'batch_size': 3869, 'optimizer': 'Adam'}. Best is trial 119 with value: 0.025263757590283552.
2026-05-15 20:16:58,405 - optuna.study._optimize - INFO - Trial 253 pruned. 
2026-05-15 20:17:02,141 - experiment_functions - INFO - Early stopping at epoch 500. Best Recall: 0.0013
2026-05-15 20:17:02,296 - optuna.study.study - INFO - Trial 254 finished with value: 0.0012696340932485913 and parameters: {'n_layers': 4, 'embedding_dim': 64, 'lr': 0.07269954728639791, 'lambda_val': 5.963118212222013e-05, 'batch_size': 3972, 'optimizer': 'SGD'}. Best is trial 119 with value: 0.025263757590283552.
2026-05-15 20:17:09,806 - optuna.study._optimize - INFO - Trial 255 pruned. 
2026-05-15 20:17:21,012 - optuna.study._optimize - INFO - Trial 256 pruned. 
2026-05-15 20:17:28,083 - optuna.study._optimize - INFO - Trial 257 pruned. 
2026-05-15 20:17:38,042 - experiment_functions - INFO - Early stopping at epoch 1150. Best Recall: 0.0188
2026-05-15 20:17:38,613 - optuna.study.study - INFO - Trial 258 finished with value: 0.018784112746135773 and parameters: {'n_layers': 4, 'embedding_dim': 96, 'lr': 0.038086678443589574, 'lambda_val': 6.203353568939992e-05, 'batch_size': 3481, 'optimizer': 'RMSprop'}. Best is trial 119 with value: 0.025263757590283552.
2026-05-15 20:17:54,353 - experiment_functions - INFO - Early stopping at epoch 1350. Best Recall: 0.0192
