2026-05-16 08:38:33,177 - optuna.study.study - INFO - Trial 147 finished with value: 0.12272145630812388 and parameters: {'n_layers': 1, 'embedding_dim': 256, 'lr': 0.0007298471499227209, 'lambda_val': 2.056222176560635e-05, 'batch_size': 4027, 'optimizer': 'Adam'}. Best is trial 76 with value: 0.12535340186495275.
2026-05-16 08:38:40,797 - experiment_functions - INFO - Early stopping at epoch 1100. Best Recall: 0.1132
2026-05-16 08:38:40,895 - optuna.study.study - INFO - Trial 148 finished with value: 0.11318490210680213 and parameters: {'n_layers': 1, 'embedding_dim': 256, 'lr': 0.0007508079903545048, 'lambda_val': 2.113700542147549e-05, 'batch_size': 3817, 'optimizer': 'Adam'}. Best is trial 76 with value: 0.12535340186495275.
2026-05-16 08:38:48,717 - optuna.study._optimize - INFO - Trial 149 pruned. 
2026-05-16 08:38:55,654 - optuna.study._optimize - INFO - Trial 150 pruned. 
2026-05-16 08:39:04,815 - optuna.study._optimize - INFO - Trial 151 pruned. 
2026-05-16 08:39:11,046 - experiment_functions - INFO - Early stopping at epoch 800. Best Recall: 0.1164
2026-05-16 08:39:11,157 - optuna.study.study - INFO - Trial 152 finished with value: 0.1163608260943823 and parameters: {'n_layers': 1, 'embedding_dim': 256, 'lr': 0.0010295134366539974, 'lambda_val': 1.5923174367991884e-05, 'batch_size': 4027, 'optimizer': 'Adam'}. Best is trial 76 with value: 0.12535340186495275.
2026-05-16 08:39:18,425 - experiment_functions - INFO - Early stopping at epoch 1000. Best Recall: 0.1155
2026-05-16 08:39:18,544 - optuna.study.study - INFO - Trial 153 finished with value: 0.11547170139566788 and parameters: {'n_layers': 1, 'embedding_dim': 256, 'lr': 0.0006794927897127089, 'lambda_val': 1.0136849452929867e-05, 'batch_size': 3881, 'optimizer': 'Adam'}. Best is trial 76 with value: 0.12535340186495275.
2026-05-16 08:39:26,525 - optuna.study._optimize - INFO - Trial 154 pruned. 
2026-05-16 08:39:32,773 - experiment_functions - INFO - Early stopping at epoch 900. Best Recall: 0.1123
2026-05-16 08:39:32,884 - optuna.study.study - INFO - Trial 155 finished with value: 0.11230506169042637 and parameters: {'n_layers': 1, 'embedding_dim': 256, 'lr': 0.0008154998094574024, 'lambda_val': 2.244274434646326e-05, 'batch_size': 3784, 'optimizer': 'Adam'}. Best is trial 76 with value: 0.12535340186495275.
2026-05-16 08:39:39,699 - experiment_functions - INFO - Early stopping at epoch 950. Best Recall: 0.1078
2026-05-16 08:39:39,809 - optuna.study.study - INFO - Trial 156 finished with value: 0.10776005806494181 and parameters: {'n_layers': 1, 'embedding_dim': 256, 'lr': 0.0005788664799477173, 'lambda_val': 8.727245122479322e-06, 'batch_size': 3926, 'optimizer': 'RMSprop'}. Best is trial 76 with value: 0.12535340186495275.
2026-05-16 08:39:48,200 - experiment_functions - INFO - Early stopping at epoch 850. Best Recall: 0.1122
2026-05-16 08:39:48,308 - optuna.study.study - INFO - Trial 157 finished with value: 0.11224420335593449 and parameters: {'n_layers': 1, 'embedding_dim': 256, 'lr': 0.0011459336024259763, 'lambda_val': 1.82190958777124e-05, 'batch_size': 4067, 'optimizer': 'Adam'}. Best is trial 76 with value: 0.12535340186495275.
2026-05-16 08:39:59,399 - optuna.study._optimize - INFO - Trial 158 pruned. 
2026-05-16 08:40:02,953 - experiment_functions - INFO - Early stopping at epoch 500. Best Recall: 0.0024
2026-05-16 08:40:03,122 - optuna.study.study - INFO - Trial 159 finished with value: 0.0024267802244062075 and parameters: {'n_layers': 1, 'embedding_dim': 256, 'lr': 0.020956462166010256, 'lambda_val': 1.7448372579055603e-06, 'batch_size': 3827, 'optimizer': 'SGD'}. Best is trial 76 with value: 0.12535340186495275.
2026-05-16 08:40:10,116 - optuna.study._optimize - INFO - Trial 160 pruned. 
2026-05-16 08:40:26,177 - experiment_functions - INFO - Early stopping at epoch 900. Best Recall: 0.1251
2026-05-16 08:40:26,276 - optuna.study.study - INFO - Trial 161 finished with value: 0.12510173075852146 and parameters: {'n_layers': 1, 'embedding_dim': 256, 'lr': 0.0008832970003838524, 'lambda_val': 7.684573700966663e-06, 'batch_size': 3640, 'optimizer': 'Adam'}. Best is trial 76 with value: 0.12535340186495275.
2026-05-16 08:40:32,844 - experiment_functions - INFO - Early stopping at epoch 900. Best Recall: 0.1085
2026-05-16 08:40:33,167 - optuna.study.study - INFO - Trial 162 finished with value: 0.10854762449504264 and parameters: {'n_layers': 1, 'embedding_dim': 256, 'lr': 0.0008749388806830175, 'lambda_val': 1.4526663635642614e-05, 'batch_size': 3703, 'optimizer': 'Adam'}. Best is trial 76 with value: 0.12535340186495275.
2026-05-16 08:40:45,868 - experiment_functions - INFO - Early stopping at epoch 1900. Best Recall: 0.1223
2026-05-16 08:40:45,958 - optuna.study.study - INFO - Trial 163 finished with value: 0.12233843527872985 and parameters: {'n_layers': 1, 'embedding_dim': 256, 'lr': 0.0004848109046028806, 'lambda_val': 3.286389490871703e-06, 'batch_size': 3601, 'optimizer': 'Adam'}. Best is trial 76 with value: 0.12535340186495275.
2026-05-16 08:40:52,957 - optuna.study._optimize - INFO - Trial 164 pruned. 
2026-05-16 08:41:01,502 - experiment_functions - INFO - Early stopping at epoch 1150. Best Recall: 0.1161
2026-05-16 08:41:01,629 - optuna.study.study - INFO - Trial 165 finished with value: 0.11608028902155736 and parameters: {'n_layers': 1, 'embedding_dim': 256, 'lr': 0.0005961297956052058, 'lambda_val': 7.963042216286912e-06, 'batch_size': 3749, 'optimizer': 'Adam'}. Best is trial 76 with value: 0.12535340186495275.
2026-05-16 08:41:16,424 - experiment_functions - INFO - Early stopping at epoch 2250. Best Recall: 0.1234
2026-05-16 08:41:16,516 - optuna.study.study - INFO - Trial 166 finished with value: 0.12337054214092008 and parameters: {'n_layers': 1, 'embedding_dim': 256, 'lr': 0.0003233583660071199, 'lambda_val': 2.527138234538341e-06, 'batch_size': 3666, 'optimizer': 'Adam'}. Best is trial 76 with value: 0.12535340186495275.
2026-05-16 08:41:23,399 - optuna.study._optimize - INFO - Trial 167 pruned. 
2026-05-16 08:41:29,254 - optuna.study._optimize - INFO - Trial 168 pruned. 
2026-05-16 08:41:35,679 - optuna.study._optimize - INFO - Trial 169 pruned. 
2026-05-16 08:41:40,912 - experiment_functions - INFO - Early stopping at epoch 700. Best Recall: 0.1097
2026-05-16 08:41:41,004 - optuna.study.study - INFO - Trial 170 finished with value: 0.10969365445883403 and parameters: {'n_layers': 1, 'embedding_dim': 256, 'lr': 0.0016041448024771252, 'lambda_val': 4.049815281542333e-06, 'batch_size': 3290, 'optimizer': 'Adam'}. Best is trial 76 with value: 0.12535340186495275.
2026-05-16 08:41:50,826 - optuna.study._optimize - INFO - Trial 171 pruned. 
2026-05-16 08:42:03,052 - experiment_functions - INFO - Early stopping at epoch 1800. Best Recall: 0.1258
2026-05-16 08:42:03,156 - optuna.study.study - INFO - Trial 172 finished with value: 0.12576808932126662 and parameters: {'n_layers': 1, 'embedding_dim': 256, 'lr': 0.0004201196179227823, 'lambda_val': 1.110205358581639e-05, 'batch_size': 2883, 'optimizer': 'Adam'}. Best is trial 172 with value: 0.12576808932126662.
2026-05-16 08:42:09,727 - experiment_functions - INFO - Early stopping at epoch 1000. Best Recall: 0.1233
2026-05-16 08:42:09,832 - optuna.study.study - INFO - Trial 173 finished with value: 0.1232880023197083 and parameters: {'n_layers': 1, 'embedding_dim': 256, 'lr': 0.00075523850038849, 'lambda_val': 2.7137293399799788e-06, 'batch_size': 2794, 'optimizer': 'Adam'}. Best is trial 172 with value: 0.12576808932126662.
2026-05-16 08:42:17,643 - experiment_functions - INFO - Early stopping at epoch 850. Best Recall: 0.0524
2026-05-16 08:42:17,736 - optuna.study.study - INFO - Trial 174 finished with value: 0.052357915280331305 and parameters: {'n_layers': 3, 'embedding_dim': 256, 'lr': 0.0006002082669928739, 'lambda_val': 2.7657835772241743e-06, 'batch_size': 2880, 'optimizer': 'Adam'}. Best is trial 172 with value: 0.12576808932126662.
2026-05-16 08:42:25,598 - experiment_functions - INFO - Early stopping at epoch 1200. Best Recall: 0.1199
2026-05-16 08:42:25,702 - optuna.study.study - INFO - Trial 175 finished with value: 0.11987610588877004 and parameters: {'n_layers': 1, 'embedding_dim': 256, 'lr': 0.0007603440827356383, 'lambda_val': 2.2539638173353512e-06, 'batch_size': 2777, 'optimizer': 'Adam'}. Best is trial 172 with value: 0.12576808932126662.
2026-05-16 08:42:38,294 - experiment_functions - INFO - Early stopping at epoch 2100. Best Recall: 0.1240
2026-05-16 08:42:38,386 - optuna.study.study - INFO - Trial 176 finished with value: 0.12400148267441899 and parameters: {'n_layers': 1, 'embedding_dim': 128, 'lr': 0.0004724950276440549, 'lambda_val': 1.8615025081906793e-06, 'batch_size': 2563, 'optimizer': 'Adam'}. Best is trial 172 with value: 0.12576808932126662.
2026-05-16 08:42:44,482 - optuna.study._optimize - INFO - Trial 177 pruned. 
2026-05-16 08:42:52,418 - optuna.study._optimize - INFO - Trial 178 pruned. 
2026-05-16 08:42:59,324 - optuna.study._optimize - INFO - Trial 179 pruned. 
2026-05-16 08:43:06,885 - optuna.study._optimize - INFO - Trial 180 pruned. 
2026-05-16 08:43:14,296 - experiment_functions - INFO - Early stopping at epoch 1150. Best Recall: 0.1157
2026-05-16 08:43:14,400 - optuna.study.study - INFO - Trial 181 finished with value: 0.1157318753614722 and parameters: {'n_layers': 1, 'embedding_dim': 256, 'lr': 0.0006732573095617356, 'lambda_val': 1.4590998983865913e-06, 'batch_size': 2909, 'optimizer': 'Adam'}. Best is trial 172 with value: 0.12576808932126662.
2026-05-16 08:43:23,448 - optuna.study._optimize - INFO - Trial 182 pruned. 
2026-05-16 08:43:33,426 - optuna.study._optimize - INFO - Trial 183 pruned. 
2026-05-16 08:43:40,694 - optuna.study._optimize - INFO - Trial 184 pruned. 
2026-05-16 08:43:56,140 - optuna.study._optimize - INFO - Trial 185 pruned. 
2026-05-16 08:44:03,610 - experiment_functions - INFO - Early stopping at epoch 1150. Best Recall: 0.1133
2026-05-16 08:44:03,715 - optuna.study.study - INFO - Trial 186 finished with value: 0.11333509911906012 and parameters: {'n_layers': 1, 'embedding_dim': 256, 'lr': 0.0007666417780154128, 'lambda_val': 7.0354204682291865e-06, 'batch_size': 2843, 'optimizer': 'Adam'}. Best is trial 172 with value: 0.12576808932126662.
2026-05-16 08:44:11,088 - experiment_functions - INFO - Early stopping at epoch 1000. Best Recall: 0.1242
2026-05-16 08:44:11,201 - optuna.study.study - INFO - Trial 187 finished with value: 0.1242279266673033 and parameters: {'n_layers': 1, 'embedding_dim': 256, 'lr': 0.0009369015524350124, 'lambda_val': 1.59984338295723e-05, 'batch_size': 3090, 'optimizer': 'Adam'}. Best is trial 172 with value: 0.12576808932126662.
2026-05-16 08:44:16,003 - experiment_functions - INFO - Early stopping at epoch 700. Best Recall: 0.0899
2026-05-16 08:44:16,117 - optuna.study.study - INFO - Trial 188 finished with value: 0.08988849391057553 and parameters: {'n_layers': 1, 'embedding_dim': 96, 'lr': 0.0011419953743170897, 'lambda_val': 1.7065892771559286e-05, 'batch_size': 2707, 'optimizer': 'RMSprop'}. Best is trial 172 with value: 0.12576808932126662.
2026-05-16 08:44:23,038 - experiment_functions - INFO - Early stopping at epoch 950. Best Recall: 0.1134
2026-05-16 08:44:23,132 - optuna.study.study - INFO - Trial 189 finished with value: 0.11336998800336613 and parameters: {'n_layers': 1, 'embedding_dim': 256, 'lr': 0.0009865351853947009, 'lambda_val': 9.376574317501989e-06, 'batch_size': 2553, 'optimizer': 'Adam'}. Best is trial 172 with value: 0.12576808932126662.
2026-05-16 08:44:29,112 - experiment_functions - INFO - Early stopping at epoch 800. Best Recall: 0.1192
2026-05-16 08:44:29,226 - optuna.study.study - INFO - Trial 190 finished with value: 0.11923197322325017 and parameters: {'n_layers': 1, 'embedding_dim': 256, 'lr': 0.0013395533938226573, 'lambda_val': 2.3220180752675846e-05, 'batch_size': 2915, 'optimizer': 'Adam'}. Best is trial 172 with value: 0.12576808932126662.
2026-05-16 08:44:36,781 - experiment_functions - INFO - Early stopping at epoch 1100. Best Recall: 0.1178
2026-05-16 08:44:36,883 - optuna.study.study - INFO - Trial 191 finished with value: 0.117804992440719 and parameters: {'n_layers': 1, 'embedding_dim': 256, 'lr': 0.0006734153061148799, 'lambda_val': 1.5630492021053936e-05, 'batch_size': 3172, 'optimizer': 'Adam'}. Best is trial 172 with value: 0.12576808932126662.
2026-05-16 08:44:45,955 - optuna.study._optimize - INFO - Trial 192 pruned. 
2026-05-16 08:44:56,224 - experiment_functions - INFO - Early stopping at epoch 1100. Best Recall: 0.1136
2026-05-16 08:44:56,328 - optuna.study.study - INFO - Trial 193 finished with value: 0.11356358638545894 and parameters: {'n_layers': 1, 'embedding_dim': 256, 'lr': 0.0008524247119516833, 'lambda_val': 2.80071121055418e-05, 'batch_size': 2647, 'optimizer': 'Adam'}. Best is trial 172 with value: 0.12576808932126662.
2026-05-16 08:45:03,155 - optuna.study._optimize - INFO - Trial 194 pruned. 
2026-05-16 08:45:15,261 - experiment_functions - INFO - Early stopping at epoch 1600. Best Recall: 0.1227
2026-05-16 08:45:15,410 - optuna.study.study - INFO - Trial 195 finished with value: 0.12271309536724934 and parameters: {'n_layers': 1, 'embedding_dim': 128, 'lr': 0.0005388573212943274, 'lambda_val': 1.0838768743249124e-05, 'batch_size': 3524, 'optimizer': 'Adam'}. Best is trial 172 with value: 0.12576808932126662.
2026-05-16 08:45:21,909 - optuna.study._optimize - INFO - Trial 196 pruned. 
2026-05-16 08:45:29,742 - optuna.study._optimize - INFO - Trial 197 pruned. 
2026-05-16 08:45:33,520 - experiment_functions - INFO - Early stopping at epoch 500. Best Recall: 0.0019
2026-05-16 08:45:33,644 - optuna.study.study - INFO - Trial 198 finished with value: 0.001910207080966234 and parameters: {'n_layers': 1, 'embedding_dim': 128, 'lr': 0.0009649508263205753, 'lambda_val': 7.562815562431081e-06, 'batch_size': 3506, 'optimizer': 'SGD'}. Best is trial 172 with value: 0.12576808932126662.
2026-05-16 08:45:39,929 - optuna.study._optimize - INFO - Trial 199 pruned. 
2026-05-16 08:45:47,594 - optuna.study._optimize - INFO - Trial 200 pruned. 
2026-05-16 08:45:55,855 - experiment_functions - INFO - Early stopping at epoch 1100. Best Recall: 0.1242
2026-05-16 08:45:55,970 - optuna.study.study - INFO - Trial 201 finished with value: 0.1241966609442547 and parameters: {'n_layers': 1, 'embedding_dim': 256, 'lr': 0.0005732562389686988, 'lambda_val': 1.2700967888617048e-05, 'batch_size': 3695, 'optimizer': 'Adam'}. Best is trial 172 with value: 0.12576808932126662.
2026-05-16 08:46:04,140 - experiment_functions - INFO - Early stopping at epoch 1200. Best Recall: 0.1171
2026-05-16 08:46:04,233 - optuna.study.study - INFO - Trial 202 finished with value: 0.11711638995423716 and parameters: {'n_layers': 1, 'embedding_dim': 256, 'lr': 0.000530258800446932, 'lambda_val': 1.1379735137537588e-05, 'batch_size': 3675, 'optimizer': 'Adam'}. Best is trial 172 with value: 0.12576808932126662.
2026-05-16 08:46:43,627 - experiment_functions - INFO - Early stopping at epoch 1250. Best Recall: 0.1185
2026-05-16 08:46:43,796 - optuna.study.study - INFO - Trial 203 finished with value: 0.11853294482088686 and parameters: {'n_layers': 1, 'embedding_dim': 256, 'lr': 0.0006126845786521941, 'lambda_val': 1.4696774012658145e-05, 'batch_size': 3016, 'optimizer': 'Adam'}. Best is trial 172 with value: 0.12576808932126662.
2026-05-16 08:46:50,768 - optuna.study._optimize - INFO - Trial 204 pruned. 
2026-05-16 08:46:57,844 - optuna.study._optimize - INFO - Trial 205 pruned. 
2026-05-16 08:47:07,599 - optuna.study._optimize - INFO - Trial 206 pruned. 
2026-05-16 08:47:14,003 - optuna.study._optimize - INFO - Trial 207 pruned. 
2026-05-16 08:47:21,491 - optuna.study._optimize - INFO - Trial 208 pruned. 
2026-05-16 08:47:31,504 - experiment_functions - INFO - Early stopping at epoch 1350. Best Recall: 0.1185
2026-05-16 08:47:31,608 - optuna.study.study - INFO - Trial 209 finished with value: 0.11845414638799018 and parameters: {'n_layers': 1, 'embedding_dim': 256, 'lr': 0.0006210103015978342, 'lambda_val': 2.787018895023368e-05, 'batch_size': 2449, 'optimizer': 'Adam'}. Best is trial 172 with value: 0.12576808932126662.
2026-05-16 08:47:38,347 - experiment_functions - INFO - Early stopping at epoch 1050. Best Recall: 0.1116
2026-05-16 08:47:38,441 - optuna.study.study - INFO - Trial 210 finished with value: 0.11157084992421383 and parameters: {'n_layers': 1, 'embedding_dim': 96, 'lr': 0.0009331797112799335, 'lambda_val': 1.2584980153799241e-05, 'batch_size': 2372, 'optimizer': 'Adam'}. Best is trial 172 with value: 0.12576808932126662.
2026-05-16 08:47:48,287 - experiment_functions - INFO - Early stopping at epoch 1150. Best Recall: 0.1155
2026-05-16 08:47:48,389 - optuna.study.study - INFO - Trial 211 finished with value: 0.11554455993959471 and parameters: {'n_layers': 1, 'embedding_dim': 256, 'lr': 0.000535954090158992, 'lambda_val': 1.760546282590366e-06, 'batch_size': 3747, 'optimizer': 'Adam'}. Best is trial 172 with value: 0.12576808932126662.
2026-05-16 08:47:55,565 - experiment_functions - INFO - Early stopping at epoch 1000. Best Recall: 0.1222
2026-05-16 08:47:55,669 - optuna.study.study - INFO - Trial 212 finished with value: 0.12216422506969975 and parameters: {'n_layers': 1, 'embedding_dim': 256, 'lr': 0.000682408684020335, 'lambda_val': 2.8037882741322085e-06, 'batch_size': 3870, 'optimizer': 'Adam'}. Best is trial 172 with value: 0.12576808932126662.
2026-05-16 08:48:03,201 - optuna.study._optimize - INFO - Trial 213 pruned. 
2026-05-16 08:48:15,654 - experiment_functions - INFO - Early stopping at epoch 1850. Best Recall: 0.1231
2026-05-16 08:48:15,758 - optuna.study.study - INFO - Trial 214 finished with value: 0.12305079444740082 and parameters: {'n_layers': 1, 'embedding_dim': 256, 'lr': 0.00033983999931255744, 'lambda_val': 6.1254997608455905e-06, 'batch_size': 2664, 'optimizer': 'Adam'}. Best is trial 172 with value: 0.12576808932126662.
2026-05-16 08:48:24,309 - optuna.study._optimize - INFO - Trial 215 pruned. 
2026-05-16 08:48:38,818 - experiment_functions - INFO - Early stopping at epoch 2200. Best Recall: 0.1311
2026-05-16 08:48:38,911 - optuna.study.study - INFO - Trial 216 finished with value: 0.13105332615342377 and parameters: {'n_layers': 1, 'embedding_dim': 256, 'lr': 0.00040217153027358383, 'lambda_val': 5.787702920396696e-06, 'batch_size': 2577, 'optimizer': 'Adam'}. Best is trial 216 with value: 0.13105332615342377.
2026-05-16 08:48:45,312 - optuna.study._optimize - INFO - Trial 217 pruned. 
2026-05-16 08:48:52,483 - optuna.study._optimize - INFO - Trial 218 pruned. 
2026-05-16 08:49:02,065 - optuna.study._optimize - INFO - Trial 219 pruned. 
2026-05-16 08:49:07,896 - experiment_functions - INFO - Early stopping at epoch 550. Best Recall: 0.1075
2026-05-16 08:49:08,001 - optuna.study.study - INFO - Trial 220 finished with value: 0.10750975068784456 and parameters: {'n_layers': 1, 'embedding_dim': 256, 'lr': 0.006569786715633415, 'lambda_val': 7.441661370462899e-06, 'batch_size': 2550, 'optimizer': 'Adam'}. Best is trial 216 with value: 0.13105332615342377.
2026-05-16 08:49:17,049 - experiment_functions - INFO - Early stopping at epoch 1350. Best Recall: 0.1224
2026-05-16 08:49:17,153 - optuna.study.study - INFO - Trial 221 finished with value: 0.1224151589303342 and parameters: {'n_layers': 1, 'embedding_dim': 256, 'lr': 0.0005740116115175816, 'lambda_val': 5.663029832782655e-06, 'batch_size': 2811, 'optimizer': 'Adam'}. Best is trial 216 with value: 0.13105332615342377.
2026-05-16 08:49:24,230 - optuna.study._optimize - INFO - Trial 222 pruned. 
2026-05-16 08:49:33,903 - experiment_functions - INFO - Early stopping at epoch 1350. Best Recall: 0.1184
2026-05-16 08:49:34,060 - optuna.study.study - INFO - Trial 223 finished with value: 0.11835069615456331 and parameters: {'n_layers': 1, 'embedding_dim': 256, 'lr': 0.0005094809458910344, 'lambda_val': 5.018893252825515e-06, 'batch_size': 2663, 'optimizer': 'Adam'}. Best is trial 216 with value: 0.13105332615342377.
2026-05-16 08:49:48,121 - experiment_functions - INFO - Early stopping at epoch 2200. Best Recall: 0.1288
2026-05-16 08:49:48,213 - optuna.study.study - INFO - Trial 224 finished with value: 0.1287737046777438 and parameters: {'n_layers': 1, 'embedding_dim': 256, 'lr': 0.00035011473354772495, 'lambda_val': 8.471699009471202e-06, 'batch_size': 2749, 'optimizer': 'Adam'}. Best is trial 216 with value: 0.13105332615342377.
2026-05-16 08:49:58,166 - optuna.study._optimize - INFO - Trial 225 pruned. 
2026-05-16 08:50:05,175 - optuna.study._optimize - INFO - Trial 226 pruned. 
2026-05-16 08:50:12,528 - optuna.study._optimize - INFO - Trial 227 pruned. 
2026-05-16 08:50:22,019 - optuna.study._optimize - INFO - Trial 228 pruned. 
2026-05-16 08:50:29,499 - optuna.study._optimize - INFO - Trial 229 pruned. 
2026-05-16 08:50:36,543 - experiment_functions - INFO - Early stopping at epoch 750. Best Recall: 0.0965
2026-05-16 08:50:36,635 - optuna.study.study - INFO - Trial 230 finished with value: 0.09653084153297216 and parameters: {'n_layers': 1, 'embedding_dim': 256, 'lr': 0.0008236860365879719, 'lambda_val': 1.244177162917375e-05, 'batch_size': 2968, 'optimizer': 'RMSprop'}. Best is trial 216 with value: 0.13105332615342377.
2026-05-16 08:50:45,952 - optuna.study._optimize - INFO - Trial 231 pruned. 
2026-05-16 08:50:54,280 - experiment_functions - INFO - Early stopping at epoch 1300. Best Recall: 0.1184
2026-05-16 08:50:54,384 - optuna.study.study - INFO - Trial 232 finished with value: 0.11839968918625844 and parameters: {'n_layers': 1, 'embedding_dim': 256, 'lr': 0.0006093392695283819, 'lambda_val': 1.039021621550389e-05, 'batch_size': 2752, 'optimizer': 'Adam'}. Best is trial 216 with value: 0.13105332615342377.
2026-05-16 08:51:01,923 - optuna.study._optimize - INFO - Trial 233 pruned. 
