2026-05-16 01:41:34,538 - optuna.study.study - INFO - Trial 241 finished with value: 0.09635829586155732 and parameters: {'n_layers': 1, 'embedding_dim': 256, 'lr': 0.0012607176699378055, 'lambda_val': 6.3619673278435194e-06, 'batch_size': 1955, 'optimizer': 'Adam'}. Best is trial 218 with value: 0.10292852157757772.
2026-05-16 01:41:41,203 - optuna.study._optimize - INFO - Trial 242 pruned. 
2026-05-16 01:41:49,324 - optuna.study._optimize - INFO - Trial 243 pruned. 
2026-05-16 01:42:00,148 - experiment_functions - INFO - Early stopping at epoch 1750. Best Recall: 0.0932
2026-05-16 01:42:00,256 - optuna.study.study - INFO - Trial 244 finished with value: 0.09315273653882271 and parameters: {'n_layers': 1, 'embedding_dim': 256, 'lr': 0.0012028017469737024, 'lambda_val': 6.815278490544469e-06, 'batch_size': 1932, 'optimizer': 'Adam'}. Best is trial 218 with value: 0.10292852157757772.
2026-05-16 01:42:08,674 - optuna.study._optimize - INFO - Trial 245 pruned. 
2026-05-16 01:42:12,162 - experiment_functions - INFO - Early stopping at epoch 500. Best Recall: 0.0031
2026-05-16 01:42:12,252 - optuna.study.study - INFO - Trial 246 finished with value: 0.0031107611036833125 and parameters: {'n_layers': 1, 'embedding_dim': 256, 'lr': 0.0014538871800635494, 'lambda_val': 8.684392323214265e-06, 'batch_size': 1829, 'optimizer': 'SGD'}. Best is trial 218 with value: 0.10292852157757772.
2026-05-16 01:42:21,235 - optuna.study._optimize - INFO - Trial 247 pruned. 
2026-05-16 01:42:27,297 - experiment_functions - INFO - Early stopping at epoch 650. Best Recall: 0.0392
2026-05-16 01:42:27,397 - optuna.study.study - INFO - Trial 248 finished with value: 0.039233639862324976 and parameters: {'n_layers': 3, 'embedding_dim': 256, 'lr': 0.001303612212890821, 'lambda_val': 6.784133596766183e-06, 'batch_size': 1945, 'optimizer': 'Adam'}. Best is trial 218 with value: 0.10292852157757772.
2026-05-16 01:42:34,054 - optuna.study._optimize - INFO - Trial 249 pruned. 
2026-05-16 01:42:41,027 - optuna.study._optimize - INFO - Trial 250 pruned. 
2026-05-16 01:42:46,940 - optuna.study._optimize - INFO - Trial 251 pruned. 
2026-05-16 01:42:52,995 - experiment_functions - INFO - Early stopping at epoch 950. Best Recall: 0.0841
2026-05-16 01:42:53,084 - optuna.study.study - INFO - Trial 252 finished with value: 0.08414264777385622 and parameters: {'n_layers': 1, 'embedding_dim': 256, 'lr': 0.001183883369906831, 'lambda_val': 7.1140332620431705e-06, 'batch_size': 1811, 'optimizer': 'Adam'}. Best is trial 218 with value: 0.10292852157757772.
2026-05-16 01:42:59,883 - optuna.study._optimize - INFO - Trial 253 pruned. 
2026-05-16 01:43:14,129 - experiment_functions - INFO - Early stopping at epoch 2000. Best Recall: 0.0907
2026-05-16 01:43:14,218 - optuna.study.study - INFO - Trial 254 finished with value: 0.09073627952263455 and parameters: {'n_layers': 1, 'embedding_dim': 256, 'lr': 0.0010231259255758028, 'lambda_val': 1.1052346316931438e-05, 'batch_size': 2057, 'optimizer': 'Adam'}. Best is trial 218 with value: 0.10292852157757772.
2026-05-16 01:43:20,682 - optuna.study._optimize - INFO - Trial 255 pruned. 
2026-05-16 01:43:27,314 - optuna.study._optimize - INFO - Trial 256 pruned. 
2026-05-16 01:43:42,596 - optuna.study._optimize - INFO - Trial 257 pruned. 
2026-05-16 01:43:49,224 - experiment_functions - INFO - Early stopping at epoch 950. Best Recall: 0.0672
2026-05-16 01:43:49,315 - optuna.study.study - INFO - Trial 258 finished with value: 0.0671910840172798 and parameters: {'n_layers': 1, 'embedding_dim': 256, 'lr': 0.0006489151035599443, 'lambda_val': 3.2583024690877015e-06, 'batch_size': 2019, 'optimizer': 'Adam'}. Best is trial 218 with value: 0.10292852157757772.
2026-05-16 01:43:56,230 - optuna.study._optimize - INFO - Trial 259 pruned. 
2026-05-16 01:44:09,421 - experiment_functions - INFO - Early stopping at epoch 2200. Best Recall: 0.0899
2026-05-16 01:44:09,511 - optuna.study.study - INFO - Trial 260 finished with value: 0.08993594221333194 and parameters: {'n_layers': 1, 'embedding_dim': 256, 'lr': 0.0011297834990168533, 'lambda_val': 4.470543178929352e-06, 'batch_size': 2093, 'optimizer': 'Adam'}. Best is trial 218 with value: 0.10292852157757772.
2026-05-16 01:44:17,997 - experiment_functions - INFO - Early stopping at epoch 1200. Best Recall: 0.0895
2026-05-16 01:44:18,087 - optuna.study.study - INFO - Trial 261 finished with value: 0.08948043745723991 and parameters: {'n_layers': 1, 'embedding_dim': 256, 'lr': 0.0015687668819130943, 'lambda_val': 3.858125271833957e-06, 'batch_size': 2224, 'optimizer': 'Adam'}. Best is trial 218 with value: 0.10292852157757772.
2026-05-16 01:44:33,744 - experiment_functions - INFO - Early stopping at epoch 2550. Best Recall: 0.0960
2026-05-16 01:44:33,833 - optuna.study.study - INFO - Trial 262 finished with value: 0.09595138541417714 and parameters: {'n_layers': 1, 'embedding_dim': 256, 'lr': 0.0008278404345240411, 'lambda_val': 5.8981313238658495e-06, 'batch_size': 1977, 'optimizer': 'Adam'}. Best is trial 218 with value: 0.10292852157757772.
2026-05-16 01:44:44,191 - optuna.study._optimize - INFO - Trial 263 pruned. 
2026-05-16 01:44:56,127 - optuna.study._optimize - INFO - Trial 264 pruned. 
2026-05-16 01:45:03,450 - optuna.study._optimize - INFO - Trial 265 pruned. 
2026-05-16 01:45:10,710 - optuna.study._optimize - INFO - Trial 266 pruned. 
2026-05-16 01:45:25,335 - optuna.study._optimize - INFO - Trial 267 pruned. 
2026-05-16 01:45:29,176 - experiment_functions - INFO - Early stopping at epoch 500. Best Recall: 0.0016
2026-05-16 01:45:29,267 - optuna.study.study - INFO - Trial 268 finished with value: 0.0016117577937905029 and parameters: {'n_layers': 1, 'embedding_dim': 256, 'lr': 0.0010132616996496933, 'lambda_val': 3.497324497183104e-06, 'batch_size': 2076, 'optimizer': 'SGD'}. Best is trial 218 with value: 0.10292852157757772.
2026-05-16 01:45:36,053 - optuna.study._optimize - INFO - Trial 269 pruned. 
2026-05-16 01:45:40,878 - experiment_functions - INFO - Early stopping at epoch 600. Best Recall: 0.0471
2026-05-16 01:45:40,970 - optuna.study.study - INFO - Trial 270 finished with value: 0.04709682945539772 and parameters: {'n_layers': 2, 'embedding_dim': 256, 'lr': 0.0013822213561430405, 'lambda_val': 2.6162010274686795e-06, 'batch_size': 1881, 'optimizer': 'Adam'}. Best is trial 218 with value: 0.10292852157757772.
2026-05-16 01:45:46,099 - experiment_functions - INFO - Early stopping at epoch 800. Best Recall: 0.0619
2026-05-16 01:45:46,218 - optuna.study.study - INFO - Trial 271 finished with value: 0.061857996190497616 and parameters: {'n_layers': 1, 'embedding_dim': 32, 'lr': 0.001845694811353595, 'lambda_val': 1.7073336138808766e-06, 'batch_size': 2051, 'optimizer': 'Adam'}. Best is trial 218 with value: 0.10292852157757772.
2026-05-16 01:46:02,648 - experiment_functions - INFO - Early stopping at epoch 2400. Best Recall: 0.0944
2026-05-16 01:46:02,748 - optuna.study.study - INFO - Trial 272 finished with value: 0.09435423955783741 and parameters: {'n_layers': 1, 'embedding_dim': 256, 'lr': 0.0008595721787902165, 'lambda_val': 6.899970805039124e-06, 'batch_size': 2182, 'optimizer': 'Adam'}. Best is trial 218 with value: 0.10292852157757772.
2026-05-16 01:46:21,956 - experiment_functions - INFO - Early stopping at epoch 3000. Best Recall: 0.1058
2026-05-16 01:46:22,077 - optuna.study.study - INFO - Trial 273 finished with value: 0.10576936145335868 and parameters: {'n_layers': 1, 'embedding_dim': 256, 'lr': 0.0008459778417611302, 'lambda_val': 4.4125269017062575e-06, 'batch_size': 2393, 'optimizer': 'Adam'}. Best is trial 273 with value: 0.10576936145335868.
2026-05-16 01:46:36,310 - experiment_functions - INFO - Early stopping at epoch 2200. Best Recall: 0.0944
2026-05-16 01:46:36,399 - optuna.study.study - INFO - Trial 274 finished with value: 0.09440522418859248 and parameters: {'n_layers': 1, 'embedding_dim': 256, 'lr': 0.0005678974986529925, 'lambda_val': 4.967203743842627e-06, 'batch_size': 2379, 'optimizer': 'Adam'}. Best is trial 273 with value: 0.10576936145335868.
2026-05-16 01:46:43,316 - optuna.study._optimize - INFO - Trial 275 pruned. 
2026-05-16 01:46:50,435 - optuna.study._optimize - INFO - Trial 276 pruned. 
2026-05-16 01:46:57,274 - optuna.study._optimize - INFO - Trial 277 pruned. 
2026-05-16 01:47:03,345 - optuna.study._optimize - INFO - Trial 278 pruned. 
2026-05-16 01:47:18,068 - experiment_functions - INFO - Early stopping at epoch 800. Best Recall: 0.0664
2026-05-16 01:47:18,168 - optuna.study.study - INFO - Trial 279 finished with value: 0.06642206269345424 and parameters: {'n_layers': 1, 'embedding_dim': 128, 'lr': 0.0007983099998327235, 'lambda_val': 3.471884679986135e-06, 'batch_size': 2504, 'optimizer': 'Adam'}. Best is trial 273 with value: 0.10576936145335868.
2026-05-16 01:47:30,473 - experiment_functions - INFO - Early stopping at epoch 1750. Best Recall: 0.0904
2026-05-16 01:47:30,642 - optuna.study.study - INFO - Trial 280 finished with value: 0.09042021145410764 and parameters: {'n_layers': 1, 'embedding_dim': 256, 'lr': 0.0010928530977555148, 'lambda_val': 4.557957279570638e-06, 'batch_size': 2296, 'optimizer': 'Adam'}. Best is trial 273 with value: 0.10576936145335868.
2026-05-16 01:47:37,043 - experiment_functions - INFO - Early stopping at epoch 650. Best Recall: 0.0244
2026-05-16 01:47:37,121 - optuna.study.study - INFO - Trial 281 finished with value: 0.024424468046982128 and parameters: {'n_layers': 4, 'embedding_dim': 256, 'lr': 0.0008420970910552586, 'lambda_val': 7.373174004868275e-06, 'batch_size': 2255, 'optimizer': 'Adam'}. Best is trial 273 with value: 0.10576936145335868.
2026-05-16 01:47:44,056 - optuna.study._optimize - INFO - Trial 282 pruned. 
2026-05-16 01:47:54,521 - experiment_functions - INFO - Early stopping at epoch 1550. Best Recall: 0.0920
2026-05-16 01:47:54,721 - optuna.study.study - INFO - Trial 283 finished with value: 0.09199653800036615 and parameters: {'n_layers': 1, 'embedding_dim': 256, 'lr': 0.0005777583489537354, 'lambda_val': 3.6813262729086828e-06, 'batch_size': 3466, 'optimizer': 'Adam'}. Best is trial 273 with value: 0.10576936145335868.
2026-05-16 01:48:00,719 - optuna.study._optimize - INFO - Trial 284 pruned. 
2026-05-16 01:48:07,681 - optuna.study._optimize - INFO - Trial 285 pruned. 
2026-05-16 01:48:27,942 - experiment_functions - INFO - Early stopping at epoch 2800. Best Recall: 0.0926
2026-05-16 01:48:28,702 - optuna.study.study - INFO - Trial 286 finished with value: 0.09263863086901028 and parameters: {'n_layers': 1, 'embedding_dim': 256, 'lr': 0.0011943286250183172, 'lambda_val': 7.700697106367591e-06, 'batch_size': 2126, 'optimizer': 'Adam'}. Best is trial 273 with value: 0.10576936145335868.
2026-05-16 01:48:40,966 - optuna.study._optimize - INFO - Trial 287 pruned. 
2026-05-16 01:48:50,920 - experiment_functions - INFO - Early stopping at epoch 1600. Best Recall: 0.0937
2026-05-16 01:48:50,998 - optuna.study.study - INFO - Trial 288 finished with value: 0.09368998376331295 and parameters: {'n_layers': 1, 'embedding_dim': 256, 'lr': 0.0007443064667221663, 'lambda_val': 7.120876775175302e-06, 'batch_size': 2112, 'optimizer': 'RMSprop'}. Best is trial 273 with value: 0.10576936145335868.
2026-05-16 01:48:57,884 - optuna.study._optimize - INFO - Trial 289 pruned. 
2026-05-16 01:49:04,356 - optuna.study._optimize - INFO - Trial 290 pruned. 
2026-05-16 01:49:09,238 - experiment_functions - INFO - Early stopping at epoch 750. Best Recall: 0.0018
2026-05-16 01:49:09,318 - optuna.study.study - INFO - Trial 291 finished with value: 0.001823577174532039 and parameters: {'n_layers': 1, 'embedding_dim': 256, 'lr': 1.5470604963086268e-05, 'lambda_val': 6.344551827279667e-06, 'batch_size': 2131, 'optimizer': 'RMSprop'}. Best is trial 273 with value: 0.10576936145335868.
2026-05-16 01:49:16,338 - optuna.study._optimize - INFO - Trial 292 pruned. 
2026-05-16 01:49:23,015 - optuna.study._optimize - INFO - Trial 293 pruned. 
2026-05-16 01:49:29,495 - optuna.study._optimize - INFO - Trial 294 pruned. 
2026-05-16 01:49:40,471 - experiment_functions - INFO - Early stopping at epoch 500. Best Recall: 0.0017
2026-05-16 01:49:41,233 - optuna.study.study - INFO - Trial 295 finished with value: 0.0017345105115323118 and parameters: {'n_layers': 1, 'embedding_dim': 256, 'lr': 0.0007669775981755647, 'lambda_val': 2.8683572942904847e-06, 'batch_size': 2447, 'optimizer': 'SGD'}. Best is trial 273 with value: 0.10576936145335868.
2026-05-16 01:49:48,362 - optuna.study._optimize - INFO - Trial 296 pruned. 
2026-05-16 01:49:55,415 - optuna.study._optimize - INFO - Trial 297 pruned. 
2026-05-16 01:50:04,419 - optuna.study._optimize - INFO - Trial 298 pruned. 
2026-05-16 01:50:10,841 - optuna.study._optimize - INFO - Trial 299 pruned. 
2026-05-16 01:50:17,198 - experiment_functions - INFO - Early stopping at epoch 1650. Best Recall: 0.0811
2026-05-16 01:50:17,304 - root - INFO -   **** Training e_100K_1c2dcs_rand1
2026-05-16 01:50:17,317 - root - INFO -   **** Getting 67885/81200 random edges
2026-05-16 01:50:17,498 - optuna.storages._rdb.storage - INFO - A new study created in RDB with name: Study_e_100K_1c2dcs_rand1
2026-05-16 01:50:22,039 - experiment_functions - INFO - Early stopping at epoch 500. Best Recall: 0.0046
2026-05-16 01:50:22,127 - optuna.study.study - INFO - Trial 0 finished with value: 0.004571858303053442 and parameters: {'n_layers': 3, 'embedding_dim': 256, 'lr': 4.396304684475708e-05, 'lambda_val': 0.014080030144278886, 'batch_size': 2554, 'optimizer': 'RMSprop'}. Best is trial 0 with value: 0.004571858303053442.
2026-05-16 01:50:46,853 - optuna.study.study - INFO - Trial 1 finished with value: 0.03870698109169154 and parameters: {'n_layers': 4, 'embedding_dim': 32, 'lr': 0.0002061879330028551, 'lambda_val': 0.001124736484156408, 'batch_size': 1482, 'optimizer': 'Adam'}. Best is trial 1 with value: 0.03870698109169154.
2026-05-16 01:51:04,796 - experiment_functions - INFO - Early stopping at epoch 1450. Best Recall: 0.0166
2026-05-16 01:51:04,897 - optuna.study.study - INFO - Trial 2 finished with value: 0.016551749913138722 and parameters: {'n_layers': 4, 'embedding_dim': 96, 'lr': 0.06668195859005513, 'lambda_val': 0.0020649956424185606, 'batch_size': 1870, 'optimizer': 'Adam'}. Best is trial 1 with value: 0.03870698109169154.
2026-05-16 01:51:07,996 - experiment_functions - INFO - Early stopping at epoch 500. Best Recall: 0.0021
2026-05-16 01:51:08,086 - optuna.study.study - INFO - Trial 3 finished with value: 0.0021065986419419383 and parameters: {'n_layers': 1, 'embedding_dim': 32, 'lr': 4.7701644129565396e-05, 'lambda_val': 0.01404197179806447, 'batch_size': 697, 'optimizer': 'RMSprop'}. Best is trial 1 with value: 0.03870698109169154.
2026-05-16 01:51:12,671 - experiment_functions - INFO - Early stopping at epoch 750. Best Recall: 0.0185
2026-05-16 01:51:12,765 - optuna.study.study - INFO - Trial 4 finished with value: 0.018496942722505436 and parameters: {'n_layers': 2, 'embedding_dim': 96, 'lr': 0.0005394881027624477, 'lambda_val': 0.08282327479936559, 'batch_size': 1509, 'optimizer': 'RMSprop'}. Best is trial 1 with value: 0.03870698109169154.
2026-05-16 01:51:16,927 - experiment_functions - INFO - Early stopping at epoch 550. Best Recall: 0.0303
2026-05-16 01:51:17,005 - optuna.study.study - INFO - Trial 5 finished with value: 0.030286695175304218 and parameters: {'n_layers': 3, 'embedding_dim': 96, 'lr': 0.02362864536357498, 'lambda_val': 0.00010072968816225256, 'batch_size': 1415, 'optimizer': 'RMSprop'}. Best is trial 1 with value: 0.03870698109169154.
2026-05-16 01:51:21,162 - experiment_functions - INFO - Early stopping at epoch 650. Best Recall: 0.0275
2026-05-16 01:51:21,261 - optuna.study.study - INFO - Trial 6 finished with value: 0.02750651509366902 and parameters: {'n_layers': 3, 'embedding_dim': 64, 'lr': 0.000831595931611452, 'lambda_val': 0.019783038657458268, 'batch_size': 1498, 'optimizer': 'Adam'}. Best is trial 1 with value: 0.03870698109169154.
2026-05-16 01:51:25,293 - experiment_functions - INFO - Early stopping at epoch 550. Best Recall: 0.0279
2026-05-16 01:51:25,391 - optuna.study.study - INFO - Trial 7 finished with value: 0.027926498155957814 and parameters: {'n_layers': 3, 'embedding_dim': 128, 'lr': 0.007595346372811967, 'lambda_val': 3.873866758187704e-05, 'batch_size': 1316, 'optimizer': 'Adam'}. Best is trial 1 with value: 0.03870698109169154.
2026-05-16 01:51:32,181 - optuna.study._optimize - INFO - Trial 8 pruned. 
2026-05-16 01:51:39,163 - experiment_functions - INFO - Early stopping at epoch 500. Best Recall: 0.0023
2026-05-16 01:51:39,242 - optuna.study.study - INFO - Trial 9 finished with value: 0.0022632070210161985 and parameters: {'n_layers': 3, 'embedding_dim': 96, 'lr': 0.000368575141689858, 'lambda_val': 0.0087373184843795, 'batch_size': 3670, 'optimizer': 'SGD'}. Best is trial 1 with value: 0.03870698109169154.
2026-05-16 01:51:42,556 - experiment_functions - INFO - Early stopping at epoch 500. Best Recall: 0.0021
2026-05-16 01:51:42,657 - optuna.study.study - INFO - Trial 10 finished with value: 0.002134424090710647 and parameters: {'n_layers': 4, 'embedding_dim': 32, 'lr': 0.004040726280058411, 'lambda_val': 0.0010727545293655282, 'batch_size': 2618, 'optimizer': 'SGD'}. Best is trial 1 with value: 0.03870698109169154.
2026-05-16 01:51:49,663 - optuna.study._optimize - INFO - Trial 11 pruned. 
2026-05-16 01:51:55,159 - experiment_functions - INFO - Early stopping at epoch 650. Best Recall: 0.0385
2026-05-16 01:51:55,249 - optuna.study.study - INFO - Trial 12 finished with value: 0.03846990283241427 and parameters: {'n_layers': 2, 'embedding_dim': 256, 'lr': 0.006699418323634075, 'lambda_val': 4.633952179526432e-05, 'batch_size': 3079, 'optimizer': 'RMSprop'}. Best is trial 1 with value: 0.03870698109169154.
2026-05-16 01:51:59,002 - experiment_functions - INFO - Early stopping at epoch 500. Best Recall: 0.0010
2026-05-16 01:51:59,092 - optuna.study.study - INFO - Trial 13 finished with value: 0.0009842758170585987 and parameters: {'n_layers': 1, 'embedding_dim': 256, 'lr': 1.1537701820818156e-05, 'lambda_val': 1.311388403828538e-05, 'batch_size': 3342, 'optimizer': 'Adam'}. Best is trial 1 with value: 0.03870698109169154.
2026-05-16 01:52:04,152 - experiment_functions - INFO - Early stopping at epoch 500. Best Recall: 0.0025
2026-05-16 01:52:04,252 - optuna.study.study - INFO - Trial 14 finished with value: 0.0024639538030447176 and parameters: {'n_layers': 2, 'embedding_dim': 256, 'lr': 0.003053909597253977, 'lambda_val': 0.0004967680454752483, 'batch_size': 3053, 'optimizer': 'SGD'}. Best is trial 1 with value: 0.03870698109169154.
2026-05-16 01:52:23,541 - experiment_functions - INFO - Early stopping at epoch 3300. Best Recall: 0.0725
2026-05-16 01:52:23,689 - optuna.study.study - INFO - Trial 15 finished with value: 0.072460106789948 and parameters: {'n_layers': 2, 'embedding_dim': 64, 'lr': 0.00021565221888215967, 'lambda_val': 1.2464454777044664e-06, 'batch_size': 3980, 'optimizer': 'RMSprop'}. Best is trial 15 with value: 0.072460106789948.
2026-05-16 01:52:33,343 - optuna.study._optimize - INFO - Trial 16 pruned. 
2026-05-16 01:52:36,870 - experiment_functions - INFO - Early stopping at epoch 500. Best Recall: 0.0024
2026-05-16 01:52:36,962 - optuna.study.study - INFO - Trial 17 finished with value: 0.002416834673833346 and parameters: {'n_layers': 1, 'embedding_dim': 64, 'lr': 1.0588943812649243e-05, 'lambda_val': 8.731809860414726e-06, 'batch_size': 1049, 'optimizer': 'RMSprop'}. Best is trial 15 with value: 0.072460106789948.
2026-05-16 01:52:45,570 - optuna.study._optimize - INFO - Trial 18 pruned. 
2026-05-16 01:52:55,246 - experiment_functions - INFO - Early stopping at epoch 500. Best Recall: 0.0029
2026-05-16 01:52:55,346 - optuna.study.study - INFO - Trial 19 finished with value: 0.0028991430456496063 and parameters: {'n_layers': 2, 'embedding_dim': 64, 'lr': 0.0017206990328740663, 'lambda_val': 0.00032796250835004083, 'batch_size': 4094, 'optimizer': 'SGD'}. Best is trial 15 with value: 0.072460106789948.
2026-05-16 01:53:01,720 - experiment_functions - INFO - Early stopping at epoch 650. Best Recall: 0.0012
2026-05-16 01:53:01,868 - optuna.study.study - INFO - Trial 20 finished with value: 0.0011868260704987817 and parameters: {'n_layers': 1, 'embedding_dim': 64, 'lr': 4.4437466255793646e-05, 'lambda_val': 1.5146059664495972e-06, 'batch_size': 2538, 'optimizer': 'RMSprop'}. Best is trial 15 with value: 0.072460106789948.
2026-05-16 01:53:06,788 - experiment_functions - INFO - Early stopping at epoch 600. Best Recall: 0.0408
2026-05-16 01:53:06,887 - optuna.study.study - INFO - Trial 21 finished with value: 0.04076057761368351 and parameters: {'n_layers': 2, 'embedding_dim': 256, 'lr': 0.008488905071707412, 'lambda_val': 4.7883618775424876e-05, 'batch_size': 3037, 'optimizer': 'RMSprop'}. Best is trial 15 with value: 0.072460106789948.
2026-05-16 01:53:12,688 - experiment_functions - INFO - Early stopping at epoch 750. Best Recall: 0.0442
2026-05-16 01:53:12,807 - optuna.study.study - INFO - Trial 22 finished with value: 0.04416027458313421 and parameters: {'n_layers': 2, 'embedding_dim': 32, 'lr': 0.001212024392667538, 'lambda_val': 1.5328718523722003e-05, 'batch_size': 2960, 'optimizer': 'RMSprop'}. Best is trial 15 with value: 0.072460106789948.
2026-05-16 01:53:23,358 - experiment_functions - INFO - Early stopping at epoch 900. Best Recall: 0.0345
2026-05-16 01:53:24,207 - optuna.study.study - INFO - Trial 23 finished with value: 0.03452646088489004 and parameters: {'n_layers': 2, 'embedding_dim': 256, 'lr': 0.015688328261418517, 'lambda_val': 1.7411083614094903e-05, 'batch_size': 2991, 'optimizer': 'RMSprop'}. Best is trial 15 with value: 0.072460106789948.
2026-05-16 01:53:30,316 - experiment_functions - INFO - Early stopping at epoch 550. Best Recall: 0.0421
