2026-05-15 21:58:34,027 - optuna.study.study - INFO - Trial 93 finished with value: 0.12170003633795068 and parameters: {'n_layers': 1, 'embedding_dim': 256, 'lr': 0.0005243745044136322, 'lambda_val': 1.3778196480608454e-06, 'batch_size': 1890, 'optimizer': 'Adam'}. Best is trial 93 with value: 0.12170003633795068.
2026-05-15 21:58:56,355 - experiment_functions - INFO - Early stopping at epoch 2250. Best Recall: 0.1159
2026-05-15 21:58:56,442 - optuna.study.study - INFO - Trial 94 finished with value: 0.11594620908758779 and parameters: {'n_layers': 1, 'embedding_dim': 256, 'lr': 0.0005259448557089739, 'lambda_val': 1.215303736458967e-06, 'batch_size': 1868, 'optimizer': 'Adam'}. Best is trial 93 with value: 0.12170003633795068.
2026-05-15 21:59:01,908 - experiment_functions - INFO - Early stopping at epoch 800. Best Recall: 0.1150
2026-05-15 21:59:02,007 - optuna.study.study - INFO - Trial 95 finished with value: 0.1150408955541289 and parameters: {'n_layers': 1, 'embedding_dim': 256, 'lr': 0.0014828707024282205, 'lambda_val': 1.1266839090616156e-06, 'batch_size': 1779, 'optimizer': 'Adam'}. Best is trial 93 with value: 0.12170003633795068.
2026-05-15 21:59:06,564 - experiment_functions - INFO - Early stopping at epoch 650. Best Recall: 0.1009
2026-05-15 21:59:06,671 - optuna.study.study - INFO - Trial 96 finished with value: 0.10094859093772 and parameters: {'n_layers': 1, 'embedding_dim': 256, 'lr': 0.002996354162365336, 'lambda_val': 1.0163107506562516e-06, 'batch_size': 1513, 'optimizer': 'Adam'}. Best is trial 93 with value: 0.12170003633795068.
2026-05-15 21:59:12,942 - experiment_functions - INFO - Early stopping at epoch 850. Best Recall: 0.1136
2026-05-15 21:59:13,031 - optuna.study.study - INFO - Trial 97 finished with value: 0.11361648401796767 and parameters: {'n_layers': 1, 'embedding_dim': 256, 'lr': 0.0015365278196784408, 'lambda_val': 1.40479088109699e-06, 'batch_size': 1929, 'optimizer': 'Adam'}. Best is trial 93 with value: 0.12170003633795068.
2026-05-15 21:59:17,644 - experiment_functions - INFO - Early stopping at epoch 700. Best Recall: 0.1076
2026-05-15 21:59:17,733 - optuna.study.study - INFO - Trial 98 finished with value: 0.10760435605578288 and parameters: {'n_layers': 1, 'embedding_dim': 256, 'lr': 0.0016127787155371684, 'lambda_val': 1.3301052235864341e-06, 'batch_size': 1883, 'optimizer': 'Adam'}. Best is trial 93 with value: 0.12170003633795068.
2026-05-15 21:59:23,263 - experiment_functions - INFO - Early stopping at epoch 850. Best Recall: 0.1052
2026-05-15 21:59:23,408 - optuna.study.study - INFO - Trial 99 finished with value: 0.10519629076870923 and parameters: {'n_layers': 1, 'embedding_dim': 256, 'lr': 0.001484827279480694, 'lambda_val': 1.5286622043056766e-06, 'batch_size': 1987, 'optimizer': 'Adam'}. Best is trial 93 with value: 0.12170003633795068.
2026-05-15 21:59:28,583 - experiment_functions - INFO - Early stopping at epoch 650. Best Recall: 0.1015
2026-05-15 21:59:28,683 - optuna.study.study - INFO - Trial 100 finished with value: 0.10154452624891969 and parameters: {'n_layers': 1, 'embedding_dim': 256, 'lr': 0.00220674277874275, 'lambda_val': 2.3097660830480316e-06, 'batch_size': 1746, 'optimizer': 'Adam'}. Best is trial 93 with value: 0.12170003633795068.
2026-05-15 21:59:38,209 - experiment_functions - INFO - Early stopping at epoch 1450. Best Recall: 0.1229
2026-05-15 21:59:38,311 - optuna.study.study - INFO - Trial 101 finished with value: 0.1229151241706406 and parameters: {'n_layers': 1, 'embedding_dim': 256, 'lr': 0.0008103110504990731, 'lambda_val': 1.2774072997661368e-06, 'batch_size': 1814, 'optimizer': 'Adam'}. Best is trial 101 with value: 0.1229151241706406.
2026-05-15 21:59:45,681 - experiment_functions - INFO - Early stopping at epoch 1150. Best Recall: 0.1155
2026-05-15 21:59:46,224 - optuna.study.study - INFO - Trial 102 finished with value: 0.115513213805829 and parameters: {'n_layers': 1, 'embedding_dim': 256, 'lr': 0.0008501699542812579, 'lambda_val': 1.2440375306822372e-06, 'batch_size': 1813, 'optimizer': 'Adam'}. Best is trial 101 with value: 0.1229151241706406.
2026-05-15 21:59:53,096 - experiment_functions - INFO - Early stopping at epoch 1100. Best Recall: 0.1222
2026-05-15 21:59:53,240 - optuna.study.study - INFO - Trial 103 finished with value: 0.12217187261362011 and parameters: {'n_layers': 1, 'embedding_dim': 256, 'lr': 0.0008664069484676444, 'lambda_val': 1.1667636630108352e-06, 'batch_size': 1611, 'optimizer': 'Adam'}. Best is trial 101 with value: 0.1229151241706406.
2026-05-15 22:00:03,406 - optuna.study._optimize - INFO - Trial 104 pruned. 
2026-05-15 22:00:11,613 - experiment_functions - INFO - Early stopping at epoch 1250. Best Recall: 0.1259
2026-05-15 22:00:11,759 - optuna.study.study - INFO - Trial 105 finished with value: 0.12588273256701743 and parameters: {'n_layers': 1, 'embedding_dim': 256, 'lr': 0.0006792164772974934, 'lambda_val': 1.9740643533454256e-06, 'batch_size': 1653, 'optimizer': 'Adam'}. Best is trial 105 with value: 0.12588273256701743.
2026-05-15 22:00:19,902 - experiment_functions - INFO - Early stopping at epoch 1250. Best Recall: 0.1183
2026-05-15 22:00:19,982 - optuna.study.study - INFO - Trial 106 finished with value: 0.11832998421759057 and parameters: {'n_layers': 1, 'embedding_dim': 256, 'lr': 0.0007066198227683199, 'lambda_val': 1.8189078118761473e-06, 'batch_size': 1657, 'optimizer': 'Adam'}. Best is trial 105 with value: 0.12588273256701743.
2026-05-15 22:00:30,172 - experiment_functions - INFO - Early stopping at epoch 1650. Best Recall: 0.1215
2026-05-15 22:00:30,316 - optuna.study.study - INFO - Trial 107 finished with value: 0.12154559962789664 and parameters: {'n_layers': 1, 'embedding_dim': 256, 'lr': 0.0006797119702975947, 'lambda_val': 1.9366081050061743e-06, 'batch_size': 1287, 'optimizer': 'Adam'}. Best is trial 105 with value: 0.12588273256701743.
2026-05-15 22:00:39,965 - experiment_functions - INFO - Early stopping at epoch 1450. Best Recall: 0.1140
2026-05-15 22:00:40,062 - optuna.study.study - INFO - Trial 108 finished with value: 0.11395588628702838 and parameters: {'n_layers': 1, 'embedding_dim': 256, 'lr': 0.000720752045380365, 'lambda_val': 1.962966926734244e-06, 'batch_size': 1281, 'optimizer': 'Adam'}. Best is trial 105 with value: 0.12588273256701743.
2026-05-15 22:00:44,361 - experiment_functions - INFO - Early stopping at epoch 500. Best Recall: 0.0029
2026-05-15 22:00:44,469 - optuna.study.study - INFO - Trial 109 finished with value: 0.002868656905546538 and parameters: {'n_layers': 2, 'embedding_dim': 256, 'lr': 0.0005631307788315068, 'lambda_val': 2.304281429886071e-06, 'batch_size': 1340, 'optimizer': 'SGD'}. Best is trial 105 with value: 0.12588273256701743.
2026-05-15 22:01:02,869 - experiment_functions - INFO - Early stopping at epoch 2550. Best Recall: 0.1270
2026-05-15 22:01:02,992 - optuna.study.study - INFO - Trial 110 finished with value: 0.1270196653619504 and parameters: {'n_layers': 1, 'embedding_dim': 256, 'lr': 0.0004440190320821761, 'lambda_val': 1.7062365348618967e-06, 'batch_size': 1623, 'optimizer': 'Adam'}. Best is trial 110 with value: 0.1270196653619504.
2026-05-15 22:01:12,523 - experiment_functions - INFO - Early stopping at epoch 1450. Best Recall: 0.1173
2026-05-15 22:01:12,614 - optuna.study.study - INFO - Trial 111 finished with value: 0.11734974652655131 and parameters: {'n_layers': 1, 'embedding_dim': 256, 'lr': 0.0006612685757915849, 'lambda_val': 1.6939336158100804e-06, 'batch_size': 1657, 'optimizer': 'Adam'}. Best is trial 110 with value: 0.1270196653619504.
2026-05-15 22:01:29,363 - experiment_functions - INFO - Early stopping at epoch 2750. Best Recall: 0.1305
2026-05-15 22:01:29,458 - optuna.study.study - INFO - Trial 112 finished with value: 0.13045097788925025 and parameters: {'n_layers': 1, 'embedding_dim': 256, 'lr': 0.00043981783101158914, 'lambda_val': 1.7151330569823479e-06, 'batch_size': 1658, 'optimizer': 'Adam'}. Best is trial 112 with value: 0.13045097788925025.
2026-05-15 22:01:44,116 - optuna.study._optimize - INFO - Trial 113 pruned. 
2026-05-15 22:01:51,243 - optuna.study._optimize - INFO - Trial 114 pruned. 
2026-05-15 22:02:02,592 - experiment_functions - INFO - Early stopping at epoch 1800. Best Recall: 0.1170
2026-05-15 22:02:02,682 - optuna.study.study - INFO - Trial 115 finished with value: 0.11697650762213103 and parameters: {'n_layers': 1, 'embedding_dim': 256, 'lr': 0.0006543193615349521, 'lambda_val': 1.7095214967469015e-06, 'batch_size': 1418, 'optimizer': 'Adam'}. Best is trial 112 with value: 0.13045097788925025.
2026-05-15 22:02:13,258 - experiment_functions - INFO - Early stopping at epoch 1650. Best Recall: 0.1253
2026-05-15 22:02:13,358 - optuna.study.study - INFO - Trial 116 finished with value: 0.12530258995353696 and parameters: {'n_layers': 1, 'embedding_dim': 256, 'lr': 0.0006231360253145293, 'lambda_val': 1.697255913910195e-06, 'batch_size': 1462, 'optimizer': 'Adam'}. Best is trial 112 with value: 0.13045097788925025.
2026-05-15 22:02:21,885 - optuna.study._optimize - INFO - Trial 117 pruned. 
2026-05-15 22:02:28,345 - optuna.study._optimize - INFO - Trial 118 pruned. 
2026-05-15 22:02:37,644 - experiment_functions - INFO - Early stopping at epoch 1450. Best Recall: 0.1224
2026-05-15 22:02:37,743 - optuna.study.study - INFO - Trial 119 finished with value: 0.12238320134795175 and parameters: {'n_layers': 1, 'embedding_dim': 256, 'lr': 0.0008024618817294734, 'lambda_val': 2.9965519234216204e-06, 'batch_size': 1462, 'optimizer': 'Adam'}. Best is trial 112 with value: 0.13045097788925025.
2026-05-15 22:02:45,510 - optuna.study._optimize - INFO - Trial 120 pruned. 
2026-05-15 22:02:55,059 - experiment_functions - INFO - Early stopping at epoch 1400. Best Recall: 0.1166
2026-05-15 22:02:55,162 - optuna.study.study - INFO - Trial 121 finished with value: 0.11660801574732756 and parameters: {'n_layers': 1, 'embedding_dim': 256, 'lr': 0.0007167654665085084, 'lambda_val': 3.0865598825271965e-06, 'batch_size': 1645, 'optimizer': 'Adam'}. Best is trial 112 with value: 0.13045097788925025.
2026-05-15 22:03:07,682 - experiment_functions - INFO - Early stopping at epoch 2150. Best Recall: 0.1202
2026-05-15 22:03:07,781 - optuna.study.study - INFO - Trial 122 finished with value: 0.12023917090826856 and parameters: {'n_layers': 1, 'embedding_dim': 256, 'lr': 0.0006270472332976507, 'lambda_val': 2.3894467286030396e-06, 'batch_size': 1163, 'optimizer': 'Adam'}. Best is trial 112 with value: 0.13045097788925025.
2026-05-15 22:03:14,781 - optuna.study._optimize - INFO - Trial 123 pruned. 
2026-05-15 22:03:21,806 - optuna.study._optimize - INFO - Trial 124 pruned. 
2026-05-15 22:03:31,068 - experiment_functions - INFO - Early stopping at epoch 1500. Best Recall: 0.1275
2026-05-15 22:03:31,630 - optuna.study.study - INFO - Trial 125 finished with value: 0.12749319549894145 and parameters: {'n_layers': 1, 'embedding_dim': 256, 'lr': 0.0006005678973699568, 'lambda_val': 1.6885233458132326e-06, 'batch_size': 1391, 'optimizer': 'Adam'}. Best is trial 112 with value: 0.13045097788925025.
2026-05-15 22:03:42,677 - experiment_functions - INFO - Early stopping at epoch 1850. Best Recall: 0.1185
2026-05-15 22:03:42,776 - optuna.study.study - INFO - Trial 126 finished with value: 0.11847123034447915 and parameters: {'n_layers': 1, 'embedding_dim': 256, 'lr': 0.0005640483691713372, 'lambda_val': 1.6122205776560143e-06, 'batch_size': 1476, 'optimizer': 'Adam'}. Best is trial 112 with value: 0.13045097788925025.
2026-05-15 22:03:49,407 - optuna.study._optimize - INFO - Trial 127 pruned. 
2026-05-15 22:03:55,986 - optuna.study._optimize - INFO - Trial 128 pruned. 
2026-05-15 22:04:01,001 - experiment_functions - INFO - Early stopping at epoch 850. Best Recall: 0.0829
2026-05-15 22:04:01,156 - optuna.study.study - INFO - Trial 129 finished with value: 0.08286962563254653 and parameters: {'n_layers': 1, 'embedding_dim': 128, 'lr': 0.0008643119097760853, 'lambda_val': 0.005902218169862063, 'batch_size': 1065, 'optimizer': 'Adam'}. Best is trial 112 with value: 0.13045097788925025.
2026-05-15 22:04:04,549 - experiment_functions - INFO - Early stopping at epoch 500. Best Recall: 0.0013
2026-05-15 22:04:04,638 - optuna.study.study - INFO - Trial 130 finished with value: 0.0012692690008321342 and parameters: {'n_layers': 1, 'embedding_dim': 256, 'lr': 0.0002619445521407569, 'lambda_val': 1.523414021352758e-06, 'batch_size': 1555, 'optimizer': 'SGD'}. Best is trial 112 with value: 0.13045097788925025.
2026-05-15 22:04:13,279 - experiment_functions - INFO - Early stopping at epoch 1350. Best Recall: 0.1176
2026-05-15 22:04:13,389 - optuna.study.study - INFO - Trial 131 finished with value: 0.11756026993972409 and parameters: {'n_layers': 1, 'embedding_dim': 256, 'lr': 0.0005944125514122906, 'lambda_val': 1.8473445522335347e-06, 'batch_size': 1277, 'optimizer': 'Adam'}. Best is trial 112 with value: 0.13045097788925025.
2026-05-15 22:04:19,671 - optuna.study._optimize - INFO - Trial 132 pruned. 
2026-05-15 22:04:29,095 - experiment_functions - INFO - Early stopping at epoch 1550. Best Recall: 0.1173
2026-05-15 22:04:29,194 - optuna.study.study - INFO - Trial 133 finished with value: 0.11733931110526762 and parameters: {'n_layers': 1, 'embedding_dim': 256, 'lr': 0.0006979174172200976, 'lambda_val': 1.9556290507675365e-06, 'batch_size': 992, 'optimizer': 'Adam'}. Best is trial 112 with value: 0.13045097788925025.
2026-05-15 22:04:35,467 - optuna.study._optimize - INFO - Trial 134 pruned. 
2026-05-15 22:04:41,206 - optuna.study._optimize - INFO - Trial 135 pruned. 
2026-05-15 22:04:57,822 - experiment_functions - INFO - Early stopping at epoch 1200. Best Recall: 0.1222
2026-05-15 22:04:57,969 - optuna.study.study - INFO - Trial 136 finished with value: 0.12221064694709782 and parameters: {'n_layers': 1, 'embedding_dim': 256, 'lr': 0.0008225090386431276, 'lambda_val': 3.330396403321872e-06, 'batch_size': 1577, 'optimizer': 'Adam'}. Best is trial 112 with value: 0.13045097788925025.
2026-05-15 22:05:05,469 - optuna.study._optimize - INFO - Trial 137 pruned. 
2026-05-15 22:05:09,907 - experiment_functions - INFO - Early stopping at epoch 650. Best Recall: 0.0021
2026-05-15 22:05:09,995 - optuna.study.study - INFO - Trial 138 finished with value: 0.0021027304516670208 and parameters: {'n_layers': 1, 'embedding_dim': 256, 'lr': 1.1730984578354423e-05, 'lambda_val': 3.04789427774904e-06, 'batch_size': 1513, 'optimizer': 'Adam'}. Best is trial 112 with value: 0.13045097788925025.
2026-05-15 22:05:16,813 - optuna.study._optimize - INFO - Trial 139 pruned. 
2026-05-15 22:05:24,294 - optuna.study._optimize - INFO - Trial 140 pruned. 
2026-05-15 22:05:36,488 - experiment_functions - INFO - Early stopping at epoch 1550. Best Recall: 0.1228
2026-05-15 22:05:36,638 - optuna.study.study - INFO - Trial 141 finished with value: 0.12278069751123402 and parameters: {'n_layers': 1, 'embedding_dim': 256, 'lr': 0.0004781880191254654, 'lambda_val': 2.072443985011016e-06, 'batch_size': 1706, 'optimizer': 'Adam'}. Best is trial 112 with value: 0.13045097788925025.
2026-05-15 22:05:46,771 - optuna.study._optimize - INFO - Trial 142 pruned. 
2026-05-15 22:05:54,754 - optuna.study._optimize - INFO - Trial 143 pruned. 
2026-05-15 22:06:03,080 - experiment_functions - INFO - Early stopping at epoch 1450. Best Recall: 0.1176
2026-05-15 22:06:03,169 - optuna.study.study - INFO - Trial 144 finished with value: 0.1175501254002308 and parameters: {'n_layers': 1, 'embedding_dim': 256, 'lr': 0.0005986795657833263, 'lambda_val': 1.4731356154340153e-06, 'batch_size': 1495, 'optimizer': 'Adam'}. Best is trial 112 with value: 0.13045097788925025.
2026-05-15 22:06:11,668 - experiment_functions - INFO - Early stopping at epoch 1350. Best Recall: 0.1177
2026-05-15 22:06:11,767 - optuna.study.study - INFO - Trial 145 finished with value: 0.1177144010789744 and parameters: {'n_layers': 1, 'embedding_dim': 256, 'lr': 0.0008310462146852752, 'lambda_val': 2.7657163138954856e-06, 'batch_size': 1316, 'optimizer': 'Adam'}. Best is trial 112 with value: 0.13045097788925025.
2026-05-15 22:06:18,816 - optuna.study._optimize - INFO - Trial 146 pruned. 
2026-05-15 22:06:28,696 - experiment_functions - INFO - Early stopping at epoch 1650. Best Recall: 0.1172
2026-05-15 22:06:28,796 - optuna.study.study - INFO - Trial 147 finished with value: 0.11716585407730315 and parameters: {'n_layers': 1, 'embedding_dim': 256, 'lr': 0.0004606190820814095, 'lambda_val': 2.1249856886665753e-06, 'batch_size': 1570, 'optimizer': 'Adam'}. Best is trial 112 with value: 0.13045097788925025.
2026-05-15 22:06:43,557 - optuna.study._optimize - INFO - Trial 148 pruned. 
2026-05-15 22:06:52,326 - experiment_functions - INFO - Early stopping at epoch 1450. Best Recall: 0.1181
2026-05-15 22:06:52,417 - optuna.study.study - INFO - Trial 149 finished with value: 0.11809781720480779 and parameters: {'n_layers': 1, 'embedding_dim': 256, 'lr': 0.0006501284679373257, 'lambda_val': 1.7851912860171188e-06, 'batch_size': 1239, 'optimizer': 'Adam'}. Best is trial 112 with value: 0.13045097788925025.
2026-05-15 22:06:58,340 - experiment_functions - INFO - Early stopping at epoch 600. Best Recall: 0.0387
2026-05-15 22:06:58,419 - optuna.study.study - INFO - Trial 150 finished with value: 0.03865701816690492 and parameters: {'n_layers': 4, 'embedding_dim': 256, 'lr': 0.0012764111914354054, 'lambda_val': 2.7337558918336534e-06, 'batch_size': 1404, 'optimizer': 'Adam'}. Best is trial 112 with value: 0.13045097788925025.
2026-05-15 22:07:06,172 - experiment_functions - INFO - Early stopping at epoch 1250. Best Recall: 0.1158
2026-05-15 22:07:06,308 - optuna.study.study - INFO - Trial 151 finished with value: 0.11581728545023875 and parameters: {'n_layers': 1, 'embedding_dim': 256, 'lr': 0.0006985936171098783, 'lambda_val': 1.6422708004431387e-06, 'batch_size': 1680, 'optimizer': 'Adam'}. Best is trial 112 with value: 0.13045097788925025.
2026-05-15 22:07:12,706 - optuna.study._optimize - INFO - Trial 152 pruned. 
2026-05-15 22:07:22,725 - experiment_functions - INFO - Early stopping at epoch 1500. Best Recall: 0.1161
2026-05-15 22:07:22,813 - optuna.study.study - INFO - Trial 153 finished with value: 0.11611817436320206 and parameters: {'n_layers': 1, 'embedding_dim': 256, 'lr': 0.0007347463347182869, 'lambda_val': 1.2143883993244673e-06, 'batch_size': 1650, 'optimizer': 'Adam'}. Best is trial 112 with value: 0.13045097788925025.
2026-05-15 22:07:40,153 - optuna.study._optimize - INFO - Trial 154 pruned. 
2026-05-15 22:07:46,386 - optuna.study._optimize - INFO - Trial 155 pruned. 
2026-05-15 22:07:53,940 - experiment_functions - INFO - Early stopping at epoch 950. Best Recall: 0.1079
2026-05-15 22:07:54,020 - optuna.study.study - INFO - Trial 156 finished with value: 0.10785449217070162 and parameters: {'n_layers': 1, 'embedding_dim': 256, 'lr': 0.0009566455943311734, 'lambda_val': 4.205710440462863e-06, 'batch_size': 1923, 'optimizer': 'Adam'}. Best is trial 112 with value: 0.13045097788925025.
2026-05-15 22:08:01,902 - experiment_functions - INFO - Early stopping at epoch 1150. Best Recall: 0.1160
2026-05-15 22:08:01,991 - optuna.study.study - INFO - Trial 157 finished with value: 0.11599334156925314 and parameters: {'n_layers': 1, 'embedding_dim': 256, 'lr': 0.0007782171981085778, 'lambda_val': 3.1231159236511905e-06, 'batch_size': 1621, 'optimizer': 'Adam'}. Best is trial 112 with value: 0.13045097788925025.
2026-05-15 22:08:05,260 - experiment_functions - INFO - Early stopping at epoch 500. Best Recall: 0.0028
2026-05-15 22:08:05,359 - optuna.study.study - INFO - Trial 158 finished with value: 0.002798935071136518 and parameters: {'n_layers': 1, 'embedding_dim': 96, 'lr': 0.0006141516250095124, 'lambda_val': 1.370868194241508e-06, 'batch_size': 1416, 'optimizer': 'SGD'}. Best is trial 112 with value: 0.13045097788925025.
2026-05-15 22:08:11,994 - optuna.study._optimize - INFO - Trial 159 pruned. 
2026-05-15 22:08:18,998 - optuna.study._optimize - INFO - Trial 160 pruned. 
2026-05-15 22:08:32,055 - experiment_functions - INFO - Early stopping at epoch 1800. Best Recall: 0.1187
2026-05-15 22:08:32,145 - optuna.study.study - INFO - Trial 161 finished with value: 0.11870887942831572 and parameters: {'n_layers': 1, 'embedding_dim': 256, 'lr': 0.0006524394687834794, 'lambda_val': 1.743875048593003e-06, 'batch_size': 1214, 'optimizer': 'Adam'}. Best is trial 112 with value: 0.13045097788925025.
2026-05-15 22:08:38,991 - optuna.study._optimize - INFO - Trial 162 pruned. 
2026-05-15 22:08:45,430 - optuna.study._optimize - INFO - Trial 163 pruned. 
2026-05-15 22:08:54,377 - optuna.study._optimize - INFO - Trial 164 pruned. 
2026-05-15 22:09:03,008 - experiment_functions - INFO - Early stopping at epoch 1300. Best Recall: 0.1154
2026-05-15 22:09:03,107 - optuna.study.study - INFO - Trial 165 finished with value: 0.11539661406604705 and parameters: {'n_layers': 1, 'embedding_dim': 256, 'lr': 0.0008011887077597267, 'lambda_val': 1.043372054071104e-06, 'batch_size': 1718, 'optimizer': 'Adam'}. Best is trial 112 with value: 0.13045097788925025.
2026-05-15 22:09:12,598 - experiment_functions - INFO - Early stopping at epoch 1100. Best Recall: 0.1200
2026-05-15 22:09:12,688 - optuna.study.study - INFO - Trial 166 finished with value: 0.11997553075592582 and parameters: {'n_layers': 1, 'embedding_dim': 256, 'lr': 0.0010063404273671812, 'lambda_val': 2.076752064934639e-06, 'batch_size': 1251, 'optimizer': 'Adam'}. Best is trial 112 with value: 0.13045097788925025.
2026-05-15 22:09:17,810 - experiment_functions - INFO - Early stopping at epoch 750. Best Recall: 0.0026
