2026-05-15 18:53:21,347 - root - INFO - **** Training e_100K_full
2026-05-15 18:53:21,371 - helper_functions - INFO - Users: 610, Items: 9742
2026-05-15 18:53:21,504 - helper_functions - INFO - Edge index: torch.Size([2, 100836])
2026-05-15 18:53:21,504 - root - INFO - **** Generating the graph:
2026-05-15 18:53:21,588 - helper_functions - INFO - Number of unique users: 610
2026-05-15 18:53:21,589 - helper_functions - INFO - Number of unique items: 9724
2026-05-15 18:53:21,589 - helper_functions - INFO - Number of nodes: 10334
2026-05-15 18:53:21,590 - helper_functions - INFO - Number of edges: 100836
2026-05-15 18:53:25,114 - optuna.storages._rdb.storage - INFO - A new study created in RDB with name: Study_e_100K_full
2026-05-15 18:53:29,404 - experiment_functions - INFO - Early stopping at epoch 600. Best Recall: 0.0027
2026-05-15 18:53:29,508 - optuna.study.study - INFO - Trial 0 finished with value: 0.002727224729691203 and parameters: {'n_layers': 1, 'embedding_dim': 64, 'lr': 2.3933041292266243e-05, 'lambda_val': 0.021030166285784257, 'batch_size': 563, 'optimizer': 'RMSprop'}. Best is trial 0 with value: 0.002727224729691203.
2026-05-15 18:53:33,336 - experiment_functions - INFO - Early stopping at epoch 500. Best Recall: 0.0024
2026-05-15 18:53:33,442 - optuna.study.study - INFO - Trial 1 finished with value: 0.0023824162931930523 and parameters: {'n_layers': 3, 'embedding_dim': 64, 'lr': 0.001106114142688178, 'lambda_val': 1.2285553318243533e-06, 'batch_size': 3037, 'optimizer': 'SGD'}. Best is trial 0 with value: 0.002727224729691203.
2026-05-15 18:53:37,338 - experiment_functions - INFO - Early stopping at epoch 500. Best Recall: 0.0022
2026-05-15 18:53:37,440 - optuna.study.study - INFO - Trial 2 finished with value: 0.0022220131458842466 and parameters: {'n_layers': 4, 'embedding_dim': 32, 'lr': 3.837574093628921e-05, 'lambda_val': 0.005234838656283362, 'batch_size': 743, 'optimizer': 'SGD'}. Best is trial 0 with value: 0.002727224729691203.
2026-05-15 18:53:41,489 - experiment_functions - INFO - Early stopping at epoch 500. Best Recall: 0.0039
2026-05-15 18:53:41,656 - optuna.study.study - INFO - Trial 3 finished with value: 0.0039015875634432593 and parameters: {'n_layers': 1, 'embedding_dim': 32, 'lr': 1.4343358565093822e-05, 'lambda_val': 7.810840300412454e-05, 'batch_size': 3963, 'optimizer': 'Adam'}. Best is trial 3 with value: 0.0039015875634432593.
2026-05-15 18:53:58,236 - experiment_functions - INFO - Early stopping at epoch 2400. Best Recall: 0.0503
2026-05-15 18:53:58,341 - optuna.study.study - INFO - Trial 4 finished with value: 0.05032799637907775 and parameters: {'n_layers': 3, 'embedding_dim': 128, 'lr': 0.00017224860905669764, 'lambda_val': 0.0026778141459660797, 'batch_size': 4043, 'optimizer': 'Adam'}. Best is trial 4 with value: 0.05032799637907775.
2026-05-15 18:54:02,793 - experiment_functions - INFO - Early stopping at epoch 500. Best Recall: 0.0013
2026-05-15 18:54:02,904 - optuna.study.study - INFO - Trial 5 finished with value: 0.0013220625069993556 and parameters: {'n_layers': 3, 'embedding_dim': 128, 'lr': 0.00022543691312803334, 'lambda_val': 2.4782620637369654e-06, 'batch_size': 1912, 'optimizer': 'SGD'}. Best is trial 4 with value: 0.05032799637907775.
2026-05-15 18:54:06,797 - experiment_functions - INFO - Early stopping at epoch 500. Best Recall: 0.0016
2026-05-15 18:54:06,909 - optuna.study.study - INFO - Trial 6 finished with value: 0.0015962190027970235 and parameters: {'n_layers': 3, 'embedding_dim': 96, 'lr': 0.0002799609699777567, 'lambda_val': 2.0591109165375093e-05, 'batch_size': 2976, 'optimizer': 'SGD'}. Best is trial 4 with value: 0.05032799637907775.
2026-05-15 18:54:12,042 - experiment_functions - INFO - Early stopping at epoch 500. Best Recall: 0.0020
2026-05-15 18:54:12,154 - optuna.study.study - INFO - Trial 7 finished with value: 0.0019975303103687047 and parameters: {'n_layers': 4, 'embedding_dim': 256, 'lr': 0.0013393915505215057, 'lambda_val': 0.0004614818529019189, 'batch_size': 798, 'optimizer': 'SGD'}. Best is trial 4 with value: 0.05032799637907775.
2026-05-15 18:54:22,474 - optuna.study._optimize - INFO - Trial 8 pruned. 
2026-05-15 18:54:33,762 - optuna.study._optimize - INFO - Trial 9 pruned. 
2026-05-15 18:54:37,895 - experiment_functions - INFO - Early stopping at epoch 550. Best Recall: 0.0302
2026-05-15 18:54:38,008 - optuna.study.study - INFO - Trial 10 finished with value: 0.03017486557348893 and parameters: {'n_layers': 2, 'embedding_dim': 128, 'lr': 0.006675461992695265, 'lambda_val': 0.0037357493815327555, 'batch_size': 3974, 'optimizer': 'Adam'}. Best is trial 4 with value: 0.05032799637907775.
2026-05-15 18:54:45,074 - optuna.study._optimize - INFO - Trial 11 pruned. 
2026-05-15 18:54:49,812 - experiment_functions - INFO - Early stopping at epoch 550. Best Recall: 0.0442
2026-05-15 18:54:49,922 - optuna.study.study - INFO - Trial 12 finished with value: 0.0442229697390321 and parameters: {'n_layers': 2, 'embedding_dim': 128, 'lr': 0.005163797631166271, 'lambda_val': 0.0024907369620442354, 'batch_size': 3559, 'optimizer': 'Adam'}. Best is trial 4 with value: 0.05032799637907775.
2026-05-15 18:55:12,055 - experiment_functions - INFO - Early stopping at epoch 1900. Best Recall: 0.0664
2026-05-15 18:55:12,172 - optuna.study.study - INFO - Trial 13 finished with value: 0.06640237480341062 and parameters: {'n_layers': 2, 'embedding_dim': 128, 'lr': 0.00023341912709671175, 'lambda_val': 0.0004547576669811464, 'batch_size': 3509, 'optimizer': 'Adam'}. Best is trial 13 with value: 0.06640237480341062.
2026-05-15 18:55:20,136 - optuna.study._optimize - INFO - Trial 14 pruned. 
2026-05-15 18:55:45,942 - optuna.study.study - INFO - Trial 15 finished with value: 0.09265288915184866 and parameters: {'n_layers': 1, 'embedding_dim': 256, 'lr': 0.0001456746417664764, 'lambda_val': 0.0005436946479812901, 'batch_size': 3517, 'optimizer': 'Adam'}. Best is trial 15 with value: 0.09265288915184866.
2026-05-15 18:55:52,816 - optuna.study._optimize - INFO - Trial 16 pruned. 
2026-05-15 18:56:04,903 - experiment_functions - INFO - Early stopping at epoch 1750. Best Recall: 0.1372
2026-05-15 18:56:05,016 - optuna.study.study - INFO - Trial 17 finished with value: 0.13723068490208287 and parameters: {'n_layers': 1, 'embedding_dim': 256, 'lr': 0.0004988634635494724, 'lambda_val': 0.0005109717573958912, 'batch_size': 1605, 'optimizer': 'Adam'}. Best is trial 17 with value: 0.13723068490208287.
2026-05-15 18:56:16,110 - experiment_functions - INFO - Early stopping at epoch 1650. Best Recall: 0.1248
2026-05-15 18:56:16,232 - optuna.study.study - INFO - Trial 18 finished with value: 0.12475599539470564 and parameters: {'n_layers': 1, 'embedding_dim': 256, 'lr': 0.0005795673410241809, 'lambda_val': 4.7418483303988456e-05, 'batch_size': 1535, 'optimizer': 'Adam'}. Best is trial 17 with value: 0.13723068490208287.
2026-05-15 18:56:30,419 - experiment_functions - INFO - Early stopping at epoch 2100. Best Recall: 0.1385
2026-05-15 18:56:30,514 - optuna.study.study - INFO - Trial 19 finished with value: 0.13854049410834207 and parameters: {'n_layers': 1, 'embedding_dim': 256, 'lr': 0.0005388551990780892, 'lambda_val': 7.228837035185416e-06, 'batch_size': 1558, 'optimizer': 'Adam'}. Best is trial 19 with value: 0.13854049410834207.
2026-05-15 18:56:34,908 - experiment_functions - INFO - Early stopping at epoch 600. Best Recall: 0.0791
2026-05-15 18:56:35,010 - optuna.study.study - INFO - Trial 20 finished with value: 0.07905372354815468 and parameters: {'n_layers': 1, 'embedding_dim': 256, 'lr': 0.0022908068436036646, 'lambda_val': 8.264801286584979e-06, 'batch_size': 1442, 'optimizer': 'RMSprop'}. Best is trial 19 with value: 0.13854049410834207.
2026-05-15 18:56:46,724 - experiment_functions - INFO - Early stopping at epoch 1750. Best Recall: 0.1335
2026-05-15 18:56:46,837 - optuna.study.study - INFO - Trial 21 finished with value: 0.1334962210446461 and parameters: {'n_layers': 1, 'embedding_dim': 256, 'lr': 0.0005972203644157408, 'lambda_val': 3.8134285841160086e-05, 'batch_size': 1451, 'optimizer': 'Adam'}. Best is trial 19 with value: 0.13854049410834207.
2026-05-15 18:56:54,654 - optuna.study._optimize - INFO - Trial 22 pruned. 
2026-05-15 18:56:59,489 - experiment_functions - INFO - Early stopping at epoch 650. Best Recall: 0.1093
2026-05-15 18:56:59,635 - optuna.study.study - INFO - Trial 23 finished with value: 0.10933258363683467 and parameters: {'n_layers': 1, 'embedding_dim': 256, 'lr': 0.002438887106884192, 'lambda_val': 9.237832532313672e-06, 'batch_size': 1733, 'optimizer': 'Adam'}. Best is trial 19 with value: 0.13854049410834207.
2026-05-15 18:57:06,870 - optuna.study._optimize - INFO - Trial 24 pruned. 
2026-05-15 18:57:11,683 - experiment_functions - INFO - Early stopping at epoch 650. Best Recall: 0.1136
2026-05-15 18:57:11,785 - optuna.study.study - INFO - Trial 25 finished with value: 0.11358214213654683 and parameters: {'n_layers': 1, 'embedding_dim': 256, 'lr': 0.002007675307752395, 'lambda_val': 0.00018795158554324714, 'batch_size': 2411, 'optimizer': 'Adam'}. Best is trial 19 with value: 0.13854049410834207.
2026-05-15 18:57:15,919 - experiment_functions - INFO - Early stopping at epoch 550. Best Recall: 0.0515
2026-05-15 18:57:16,029 - optuna.study.study - INFO - Trial 26 finished with value: 0.05145712475339753 and parameters: {'n_layers': 1, 'embedding_dim': 256, 'lr': 0.02301832741167333, 'lambda_val': 2.101375029348099e-05, 'batch_size': 2494, 'optimizer': 'Adam'}. Best is trial 19 with value: 0.13854049410834207.
2026-05-15 18:57:24,662 - optuna.study._optimize - INFO - Trial 27 pruned. 
2026-05-15 18:57:31,285 - optuna.study._optimize - INFO - Trial 28 pruned. 
2026-05-15 18:57:35,023 - experiment_functions - INFO - Early stopping at epoch 600. Best Recall: 0.0018
2026-05-15 18:57:35,136 - optuna.study.study - INFO - Trial 29 finished with value: 0.0017879744551858188 and parameters: {'n_layers': 1, 'embedding_dim': 64, 'lr': 4.224218942063804e-05, 'lambda_val': 0.0117746342810674, 'batch_size': 1631, 'optimizer': 'RMSprop'}. Best is trial 19 with value: 0.13854049410834207.
2026-05-15 18:57:39,908 - experiment_functions - INFO - Early stopping at epoch 650. Best Recall: 0.0515
2026-05-15 18:57:40,009 - optuna.study.study - INFO - Trial 30 finished with value: 0.05146105440673409 and parameters: {'n_layers': 2, 'embedding_dim': 96, 'lr': 0.000909589986926627, 'lambda_val': 4.260089954027095e-05, 'batch_size': 1013, 'optimizer': 'RMSprop'}. Best is trial 19 with value: 0.13854049410834207.
2026-05-15 18:57:47,209 - optuna.study._optimize - INFO - Trial 31 pruned. 
2026-05-15 18:57:53,684 - experiment_functions - INFO - Early stopping at epoch 900. Best Recall: 0.1198
2026-05-15 18:57:53,816 - optuna.study.study - INFO - Trial 32 finished with value: 0.11978126931328383 and parameters: {'n_layers': 1, 'embedding_dim': 256, 'lr': 0.0009819450978256368, 'lambda_val': 1.553429609101081e-05, 'batch_size': 1785, 'optimizer': 'Adam'}. Best is trial 19 with value: 0.13854049410834207.
2026-05-15 18:58:00,250 - optuna.study._optimize - INFO - Trial 33 pruned. 
2026-05-15 18:58:06,117 - experiment_functions - INFO - Early stopping at epoch 850. Best Recall: 0.1306
2026-05-15 18:58:06,218 - optuna.study.study - INFO - Trial 34 finished with value: 0.1305803073124412 and parameters: {'n_layers': 1, 'embedding_dim': 256, 'lr': 0.0012665590276927522, 'lambda_val': 3.0188372891650777e-06, 'batch_size': 1454, 'optimizer': 'Adam'}. Best is trial 19 with value: 0.13854049410834207.
2026-05-15 18:58:09,802 - experiment_functions - INFO - Early stopping at epoch 500. Best Recall: 0.0015
2026-05-15 18:58:09,913 - optuna.study.study - INFO - Trial 35 finished with value: 0.001485024777477829 and parameters: {'n_layers': 1, 'embedding_dim': 256, 'lr': 0.0036736185307804053, 'lambda_val': 3.897118481618778e-06, 'batch_size': 582, 'optimizer': 'SGD'}. Best is trial 19 with value: 0.13854049410834207.
2026-05-15 18:58:16,162 - optuna.study._optimize - INFO - Trial 36 pruned. 
2026-05-15 18:58:20,915 - experiment_functions - INFO - Early stopping at epoch 500. Best Recall: 0.0029
2026-05-15 18:58:21,034 - optuna.study.study - INFO - Trial 37 finished with value: 0.0028875375152782965 and parameters: {'n_layers': 2, 'embedding_dim': 256, 'lr': 0.0003148499555737748, 'lambda_val': 2.6764182509288595e-06, 'batch_size': 819, 'optimizer': 'SGD'}. Best is trial 19 with value: 0.13854049410834207.
2026-05-15 18:58:24,995 - experiment_functions - INFO - Early stopping at epoch 500. Best Recall: 0.0009
2026-05-15 18:58:25,097 - optuna.study.study - INFO - Trial 38 finished with value: 0.0009157719496526121 and parameters: {'n_layers': 1, 'embedding_dim': 256, 'lr': 1.1029908256716365e-05, 'lambda_val': 1.1453964003395173e-05, 'batch_size': 1940, 'optimizer': 'Adam'}. Best is trial 19 with value: 0.13854049410834207.
2026-05-15 18:58:28,329 - experiment_functions - INFO - Early stopping at epoch 500. Best Recall: 0.0031
2026-05-15 18:58:28,443 - optuna.study.study - INFO - Trial 39 finished with value: 0.0030707966308797744 and parameters: {'n_layers': 1, 'embedding_dim': 32, 'lr': 2.0868425983113622e-05, 'lambda_val': 2.636951751702142e-06, 'batch_size': 2649, 'optimizer': 'Adam'}. Best is trial 19 with value: 0.13854049410834207.
2026-05-15 18:58:32,066 - experiment_functions - INFO - Early stopping at epoch 500. Best Recall: 0.0017
2026-05-15 18:58:32,157 - optuna.study.study - INFO - Trial 40 finished with value: 0.0016812308414093664 and parameters: {'n_layers': 2, 'embedding_dim': 96, 'lr': 0.0008280221663014844, 'lambda_val': 0.00011361069304973876, 'batch_size': 997, 'optimizer': 'SGD'}. Best is trial 19 with value: 0.13854049410834207.
2026-05-15 18:58:38,437 - experiment_functions - INFO - Early stopping at epoch 800. Best Recall: 0.1245
2026-05-15 18:58:38,547 - optuna.study.study - INFO - Trial 41 finished with value: 0.12449729473905208 and parameters: {'n_layers': 1, 'embedding_dim': 256, 'lr': 0.001469371205153032, 'lambda_val': 7.445829848152868e-05, 'batch_size': 1570, 'optimizer': 'Adam'}. Best is trial 19 with value: 0.13854049410834207.
2026-05-15 18:58:45,832 - optuna.study._optimize - INFO - Trial 42 pruned. 
2026-05-15 18:58:55,716 - experiment_functions - INFO - Early stopping at epoch 1400. Best Recall: 0.1347
2026-05-15 18:58:55,818 - optuna.study.study - INFO - Trial 43 finished with value: 0.1346559669826916 and parameters: {'n_layers': 1, 'embedding_dim': 256, 'lr': 0.0007503870316365889, 'lambda_val': 1.0462555183633998e-06, 'batch_size': 1385, 'optimizer': 'Adam'}. Best is trial 19 with value: 0.13854049410834207.
2026-05-15 18:59:02,947 - optuna.study._optimize - INFO - Trial 44 pruned. 
2026-05-15 18:59:07,915 - experiment_functions - INFO - Early stopping at epoch 550. Best Recall: 0.0355
2026-05-15 18:59:08,016 - optuna.study.study - INFO - Trial 45 finished with value: 0.03553842840691063 and parameters: {'n_layers': 4, 'embedding_dim': 32, 'lr': 0.003778807625294833, 'lambda_val': 1.126782695426831e-06, 'batch_size': 909, 'optimizer': 'Adam'}. Best is trial 19 with value: 0.13854049410834207.
2026-05-15 18:59:15,300 - optuna.study._optimize - INFO - Trial 46 pruned. 
2026-05-15 18:59:21,461 - experiment_functions - INFO - Early stopping at epoch 600. Best Recall: 0.0503
2026-05-15 18:59:21,596 - optuna.study.study - INFO - Trial 47 finished with value: 0.05031740818202089 and parameters: {'n_layers': 3, 'embedding_dim': 256, 'lr': 0.0014986336982070881, 'lambda_val': 2.245037603465346e-06, 'batch_size': 628, 'optimizer': 'Adam'}. Best is trial 19 with value: 0.13854049410834207.
2026-05-15 18:59:31,207 - experiment_functions - INFO - Early stopping at epoch 500. Best Recall: 0.0011
2026-05-15 18:59:31,321 - optuna.study.study - INFO - Trial 48 finished with value: 0.0011389908390203032 and parameters: {'n_layers': 2, 'embedding_dim': 64, 'lr': 0.0007377746124105833, 'lambda_val': 0.0008049880736751538, 'batch_size': 1932, 'optimizer': 'SGD'}. Best is trial 19 with value: 0.13854049410834207.
2026-05-15 18:59:38,718 - optuna.study._optimize - INFO - Trial 49 pruned. 
2026-05-15 18:59:44,005 - experiment_functions - INFO - Early stopping at epoch 600. Best Recall: 0.0809
2026-05-15 18:59:44,117 - optuna.study.study - INFO - Trial 50 finished with value: 0.0808867726775302 and parameters: {'n_layers': 1, 'embedding_dim': 32, 'lr': 0.00321646773862611, 'lambda_val': 6.444814905814857e-06, 'batch_size': 2150, 'optimizer': 'RMSprop'}. Best is trial 19 with value: 0.13854049410834207.
2026-05-15 18:59:53,176 - optuna.study._optimize - INFO - Trial 51 pruned. 
2026-05-15 19:00:06,968 - experiment_functions - INFO - Early stopping at epoch 950. Best Recall: 0.1241
2026-05-15 19:00:07,468 - optuna.study.study - INFO - Trial 52 finished with value: 0.12405008768818342 and parameters: {'n_layers': 1, 'embedding_dim': 256, 'lr': 0.0010763387802244825, 'lambda_val': 1.6998907747551292e-06, 'batch_size': 1809, 'optimizer': 'Adam'}. Best is trial 19 with value: 0.13854049410834207.
2026-05-15 19:00:17,194 - optuna.study._optimize - INFO - Trial 53 pruned. 
2026-05-15 19:00:22,555 - experiment_functions - INFO - Early stopping at epoch 650. Best Recall: 0.1092
2026-05-15 19:00:22,711 - optuna.study.study - INFO - Trial 54 finished with value: 0.10920152609960948 and parameters: {'n_layers': 1, 'embedding_dim': 256, 'lr': 0.001872284994262246, 'lambda_val': 1.1935144742635371e-05, 'batch_size': 1570, 'optimizer': 'Adam'}. Best is trial 19 with value: 0.13854049410834207.
2026-05-15 19:00:30,328 - optuna.study._optimize - INFO - Trial 55 pruned. 
2026-05-15 19:00:34,571 - experiment_functions - INFO - Early stopping at epoch 550. Best Recall: 0.0881
2026-05-15 19:00:34,753 - optuna.study.study - INFO - Trial 56 finished with value: 0.08813257129556905 and parameters: {'n_layers': 1, 'embedding_dim': 128, 'lr': 0.009286055451266753, 'lambda_val': 1.0107608047148253e-06, 'batch_size': 1383, 'optimizer': 'Adam'}. Best is trial 19 with value: 0.13854049410834207.
2026-05-15 19:00:42,113 - optuna.study._optimize - INFO - Trial 57 pruned. 
2026-05-15 19:00:48,741 - experiment_functions - INFO - Early stopping at epoch 700. Best Recall: 0.0417
2026-05-15 19:00:48,844 - optuna.study.study - INFO - Trial 58 finished with value: 0.04171436198426201 and parameters: {'n_layers': 3, 'embedding_dim': 256, 'lr': 0.0005955300759108138, 'lambda_val': 0.001773921850427187, 'batch_size': 1541, 'optimizer': 'Adam'}. Best is trial 19 with value: 0.13854049410834207.
2026-05-15 19:00:56,027 - optuna.study._optimize - INFO - Trial 59 pruned. 
2026-05-15 19:01:01,776 - experiment_functions - INFO - Early stopping at epoch 800. Best Recall: 0.1117
2026-05-15 19:01:01,934 - optuna.study.study - INFO - Trial 60 finished with value: 0.11173796212150283 and parameters: {'n_layers': 1, 'embedding_dim': 256, 'lr': 0.0012105815189324533, 'lambda_val': 0.0001262429770838926, 'batch_size': 1864, 'optimizer': 'Adam'}. Best is trial 19 with value: 0.13854049410834207.
2026-05-15 19:01:07,211 - experiment_functions - INFO - Early stopping at epoch 700. Best Recall: 0.1171
2026-05-15 19:01:07,313 - optuna.study.study - INFO - Trial 61 finished with value: 0.11712281290498196 and parameters: {'n_layers': 1, 'embedding_dim': 256, 'lr': 0.0015909364093341487, 'lambda_val': 8.146968600129559e-05, 'batch_size': 1502, 'optimizer': 'Adam'}. Best is trial 19 with value: 0.13854049410834207.
2026-05-15 19:01:13,854 - experiment_functions - INFO - Early stopping at epoch 850. Best Recall: 0.0901
2026-05-15 19:01:13,965 - optuna.study.study - INFO - Trial 62 finished with value: 0.09010326510077865 and parameters: {'n_layers': 1, 'embedding_dim': 256, 'lr': 0.0023163873392711065, 'lambda_val': 0.00024008475303132837, 'batch_size': 1249, 'optimizer': 'Adam'}. Best is trial 19 with value: 0.13854049410834207.
2026-05-15 19:01:21,857 - optuna.study._optimize - INFO - Trial 63 pruned. 
2026-05-15 19:01:27,056 - experiment_functions - INFO - Early stopping at epoch 650. Best Recall: 0.1080
2026-05-15 19:01:27,198 - optuna.study.study - INFO - Trial 64 finished with value: 0.10797717585019952 and parameters: {'n_layers': 1, 'embedding_dim': 256, 'lr': 0.002840320949014718, 'lambda_val': 6.31360481265745e-05, 'batch_size': 1590, 'optimizer': 'Adam'}. Best is trial 19 with value: 0.13854049410834207.
2026-05-15 19:01:49,658 - experiment_functions - INFO - Early stopping at epoch 3400. Best Recall: 0.1431
2026-05-15 19:01:49,772 - optuna.study.study - INFO - Trial 65 finished with value: 0.14314842153817933 and parameters: {'n_layers': 1, 'embedding_dim': 256, 'lr': 0.00042648726532589295, 'lambda_val': 3.0393554104040976e-05, 'batch_size': 1380, 'optimizer': 'Adam'}. Best is trial 65 with value: 0.14314842153817933.
2026-05-15 19:01:56,777 - optuna.study._optimize - INFO - Trial 66 pruned. 
2026-05-15 19:02:05,375 - optuna.study._optimize - INFO - Trial 67 pruned. 
2026-05-15 19:02:09,175 - experiment_functions - INFO - Early stopping at epoch 500. Best Recall: 0.0018
2026-05-15 19:02:09,277 - optuna.study.study - INFO - Trial 68 finished with value: 0.0018123516260082635 and parameters: {'n_layers': 1, 'embedding_dim': 256, 'lr': 0.0005055939118249426, 'lambda_val': 5.2217542516519976e-06, 'batch_size': 1149, 'optimizer': 'SGD'}. Best is trial 65 with value: 0.14314842153817933.
2026-05-15 19:02:16,001 - optuna.study._optimize - INFO - Trial 69 pruned. 
2026-05-15 19:02:22,871 - optuna.study._optimize - INFO - Trial 70 pruned. 
2026-05-15 19:02:29,371 - experiment_functions - INFO - Early stopping at epoch 900. Best Recall: 0.1330
