2026-05-16 09:11:34,741 - optuna.study.study - INFO - Trial 75 finished with value: 0.12284761117757774 and parameters: {'n_layers': 1, 'embedding_dim': 256, 'lr': 0.0004502503365622127, 'lambda_val': 0.0038553394573534864, 'batch_size': 1239, 'optimizer': 'Adam'}. Best is trial 73 with value: 0.12924957455686556.
2026-05-16 09:11:38,763 - experiment_functions - INFO - Early stopping at epoch 500. Best Recall: 0.0023
2026-05-16 09:11:38,864 - optuna.study.study - INFO - Trial 76 finished with value: 0.0022924822936454294 and parameters: {'n_layers': 1, 'embedding_dim': 256, 'lr': 0.0004124401261223265, 'lambda_val': 0.004469740894762555, 'batch_size': 580, 'optimizer': 'SGD'}. Best is trial 73 with value: 0.12924957455686556.
2026-05-16 09:11:55,221 - experiment_functions - INFO - Early stopping at epoch 2600. Best Recall: 0.1264
2026-05-16 09:11:55,322 - optuna.study.study - INFO - Trial 77 finished with value: 0.12640954239435973 and parameters: {'n_layers': 1, 'embedding_dim': 256, 'lr': 0.0006220101231391055, 'lambda_val': 0.0010511264133636663, 'batch_size': 549, 'optimizer': 'Adam'}. Best is trial 73 with value: 0.12924957455686556.
2026-05-16 09:12:02,332 - optuna.study._optimize - INFO - Trial 78 pruned. 
2026-05-16 09:12:09,043 - experiment_functions - INFO - Early stopping at epoch 900. Best Recall: 0.0827
2026-05-16 09:12:09,163 - optuna.study.study - INFO - Trial 79 finished with value: 0.08270114042807099 and parameters: {'n_layers': 2, 'embedding_dim': 256, 'lr': 0.0006135756718503372, 'lambda_val': 0.003198267764689798, 'batch_size': 524, 'optimizer': 'Adam'}. Best is trial 73 with value: 0.12924957455686556.
2026-05-16 09:12:15,583 - optuna.study._optimize - INFO - Trial 80 pruned. 
2026-05-16 09:12:21,876 - optuna.study._optimize - INFO - Trial 81 pruned. 
2026-05-16 09:12:28,227 - optuna.study._optimize - INFO - Trial 82 pruned. 
2026-05-16 09:12:35,074 - optuna.study._optimize - INFO - Trial 83 pruned. 
2026-05-16 09:12:41,640 - optuna.study._optimize - INFO - Trial 84 pruned. 
2026-05-16 09:12:50,210 - experiment_functions - INFO - Early stopping at epoch 1400. Best Recall: 0.1223
2026-05-16 09:12:50,311 - optuna.study.study - INFO - Trial 85 finished with value: 0.12228251689777778 and parameters: {'n_layers': 1, 'embedding_dim': 256, 'lr': 0.0005760769647626926, 'lambda_val': 0.0018701375487277594, 'batch_size': 1569, 'optimizer': 'Adam'}. Best is trial 73 with value: 0.12924957455686556.
2026-05-16 09:12:54,254 - experiment_functions - INFO - Early stopping at epoch 500. Best Recall: 0.0020
2026-05-16 09:12:54,357 - optuna.study.study - INFO - Trial 86 finished with value: 0.0020479756000837276 and parameters: {'n_layers': 1, 'embedding_dim': 256, 'lr': 0.0006269157016297187, 'lambda_val': 0.00532031713063083, 'batch_size': 1572, 'optimizer': 'SGD'}. Best is trial 73 with value: 0.12924957455686556.
2026-05-16 09:13:05,553 - experiment_functions - INFO - Early stopping at epoch 1800. Best Recall: 0.1183
2026-05-16 09:13:05,654 - optuna.study.study - INFO - Trial 87 finished with value: 0.11831855477746586 and parameters: {'n_layers': 1, 'embedding_dim': 256, 'lr': 0.0005486308421571267, 'lambda_val': 0.0015723884096103557, 'batch_size': 1524, 'optimizer': 'Adam'}. Best is trial 73 with value: 0.12924957455686556.
2026-05-16 09:13:19,170 - experiment_functions - INFO - Early stopping at epoch 700. Best Recall: 0.0953
2026-05-16 09:13:19,272 - optuna.study.study - INFO - Trial 88 finished with value: 0.09534107091569696 and parameters: {'n_layers': 1, 'embedding_dim': 256, 'lr': 0.0018393290006863715, 'lambda_val': 0.002085117098854313, 'batch_size': 1735, 'optimizer': 'Adam'}. Best is trial 73 with value: 0.12924957455686556.
2026-05-16 09:13:27,348 - optuna.study._optimize - INFO - Trial 89 pruned. 
2026-05-16 09:13:41,410 - experiment_functions - INFO - Early stopping at epoch 2250. Best Recall: 0.1188
2026-05-16 09:13:41,520 - optuna.study.study - INFO - Trial 90 finished with value: 0.11878677258411441 and parameters: {'n_layers': 1, 'embedding_dim': 256, 'lr': 0.0004651093364884168, 'lambda_val': 0.0010544809497332205, 'batch_size': 1390, 'optimizer': 'Adam'}. Best is trial 73 with value: 0.12924957455686556.
2026-05-16 09:14:02,557 - experiment_functions - INFO - Early stopping at epoch 3450. Best Recall: 0.1359
2026-05-16 09:14:02,674 - optuna.study.study - INFO - Trial 91 finished with value: 0.13592542901360083 and parameters: {'n_layers': 1, 'embedding_dim': 256, 'lr': 0.00045337206779367514, 'lambda_val': 0.0008674008211638881, 'batch_size': 1221, 'optimizer': 'Adam'}. Best is trial 91 with value: 0.13592542901360083.
2026-05-16 09:14:11,946 - optuna.study._optimize - INFO - Trial 92 pruned. 
2026-05-16 09:14:19,131 - experiment_functions - INFO - Early stopping at epoch 1050. Best Recall: 0.1083
2026-05-16 09:14:19,255 - optuna.study.study - INFO - Trial 93 finished with value: 0.10834570057355956 and parameters: {'n_layers': 1, 'embedding_dim': 256, 'lr': 0.0005718119994817, 'lambda_val': 0.0026150554108021547, 'batch_size': 1702, 'optimizer': 'Adam'}. Best is trial 91 with value: 0.13592542901360083.
2026-05-16 09:14:26,337 - experiment_functions - INFO - Early stopping at epoch 1100. Best Recall: 0.1071
2026-05-16 09:14:26,438 - optuna.study.study - INFO - Trial 94 finished with value: 0.10707635178064587 and parameters: {'n_layers': 1, 'embedding_dim': 256, 'lr': 0.0009212598553425232, 'lambda_val': 0.001743298567390948, 'batch_size': 981, 'optimizer': 'Adam'}. Best is trial 91 with value: 0.13592542901360083.
2026-05-16 09:14:33,472 - optuna.study._optimize - INFO - Trial 95 pruned. 
2026-05-16 09:14:39,598 - optuna.study._optimize - INFO - Trial 96 pruned. 
2026-05-16 09:14:49,231 - optuna.study._optimize - INFO - Trial 97 pruned. 
2026-05-16 09:14:58,103 - optuna.study._optimize - INFO - Trial 98 pruned. 
2026-05-16 09:15:04,148 - experiment_functions - INFO - Early stopping at epoch 700. Best Recall: 0.0516
2026-05-16 09:15:04,239 - optuna.study.study - INFO - Trial 99 finished with value: 0.051582848913841205 and parameters: {'n_layers': 3, 'embedding_dim': 256, 'lr': 0.0006338359829035588, 'lambda_val': 0.003319329259277673, 'batch_size': 1390, 'optimizer': 'Adam'}. Best is trial 91 with value: 0.13592542901360083.
2026-05-16 09:15:15,941 - experiment_functions - INFO - Early stopping at epoch 1800. Best Recall: 0.1155
2026-05-16 09:15:16,032 - optuna.study.study - INFO - Trial 100 finished with value: 0.11549306889271539 and parameters: {'n_layers': 1, 'embedding_dim': 256, 'lr': 0.00042237681235164675, 'lambda_val': 0.00217084438947046, 'batch_size': 1666, 'optimizer': 'Adam'}. Best is trial 91 with value: 0.13592542901360083.
2026-05-16 09:15:39,884 - experiment_functions - INFO - Early stopping at epoch 3600. Best Recall: 0.1351
2026-05-16 09:15:39,985 - optuna.study.study - INFO - Trial 101 finished with value: 0.13510858871769488 and parameters: {'n_layers': 1, 'embedding_dim': 256, 'lr': 0.0004386325230870486, 'lambda_val': 0.0003770167620302401, 'batch_size': 1215, 'optimizer': 'Adam'}. Best is trial 91 with value: 0.13592542901360083.
2026-05-16 09:15:46,990 - experiment_functions - INFO - Early stopping at epoch 1100. Best Recall: 0.1223
2026-05-16 09:15:47,079 - optuna.study.study - INFO - Trial 102 finished with value: 0.12230084024856201 and parameters: {'n_layers': 1, 'embedding_dim': 256, 'lr': 0.0008616894922769102, 'lambda_val': 0.0008302923808300655, 'batch_size': 1160, 'optimizer': 'Adam'}. Best is trial 91 with value: 0.13592542901360083.
2026-05-16 09:15:53,260 - experiment_functions - INFO - Early stopping at epoch 950. Best Recall: 0.1069
2026-05-16 09:15:53,350 - optuna.study.study - INFO - Trial 103 finished with value: 0.10688658536250682 and parameters: {'n_layers': 1, 'embedding_dim': 256, 'lr': 0.0008548703038025821, 'lambda_val': 0.0007544323843233437, 'batch_size': 1969, 'optimizer': 'Adam'}. Best is trial 91 with value: 0.13592542901360083.
2026-05-16 09:15:57,326 - experiment_functions - INFO - Early stopping at epoch 500. Best Recall: 0.0014
2026-05-16 09:15:57,428 - optuna.study.study - INFO - Trial 104 finished with value: 0.0013793958233587833 and parameters: {'n_layers': 1, 'embedding_dim': 256, 'lr': 0.0011658057797688146, 'lambda_val': 0.0003686254830073479, 'batch_size': 1146, 'optimizer': 'SGD'}. Best is trial 91 with value: 0.13592542901360083.
2026-05-16 09:16:02,850 - experiment_functions - INFO - Early stopping at epoch 750. Best Recall: 0.1006
2026-05-16 09:16:02,948 - optuna.study.study - INFO - Trial 105 finished with value: 0.10061714054858745 and parameters: {'n_layers': 1, 'embedding_dim': 256, 'lr': 0.0010857055565180035, 'lambda_val': 0.0058258508695595524, 'batch_size': 1277, 'optimizer': 'Adam'}. Best is trial 91 with value: 0.13592542901360083.
2026-05-16 09:16:12,732 - experiment_functions - INFO - Early stopping at epoch 1550. Best Recall: 0.1253
2026-05-16 09:16:13,070 - optuna.study.study - INFO - Trial 106 finished with value: 0.12532701001650692 and parameters: {'n_layers': 1, 'embedding_dim': 256, 'lr': 0.0006812092124634151, 'lambda_val': 0.0015857437979327146, 'batch_size': 1042, 'optimizer': 'Adam'}. Best is trial 91 with value: 0.13592542901360083.
2026-05-16 09:16:20,298 - optuna.study._optimize - INFO - Trial 107 pruned. 
2026-05-16 09:16:24,872 - experiment_functions - INFO - Early stopping at epoch 650. Best Recall: 0.1008
2026-05-16 09:16:24,975 - optuna.study.study - INFO - Trial 108 finished with value: 0.10080203586589243 and parameters: {'n_layers': 1, 'embedding_dim': 256, 'lr': 0.0021092796392030194, 'lambda_val': 0.0019235082063474031, 'batch_size': 2227, 'optimizer': 'Adam'}. Best is trial 91 with value: 0.13592542901360083.
2026-05-16 09:16:32,078 - optuna.study._optimize - INFO - Trial 109 pruned. 
2026-05-16 09:16:35,750 - experiment_functions - INFO - Early stopping at epoch 550. Best Recall: 0.0310
2026-05-16 09:16:35,841 - optuna.study.study - INFO - Trial 110 finished with value: 0.030987142606371462 and parameters: {'n_layers': 1, 'embedding_dim': 64, 'lr': 0.030266226672812063, 'lambda_val': 0.0006788828459940379, 'batch_size': 1019, 'optimizer': 'Adam'}. Best is trial 91 with value: 0.13592542901360083.
2026-05-16 09:16:46,724 - experiment_functions - INFO - Early stopping at epoch 1650. Best Recall: 0.1224
2026-05-16 09:16:46,825 - optuna.study.study - INFO - Trial 111 finished with value: 0.12243388504109351 and parameters: {'n_layers': 1, 'embedding_dim': 256, 'lr': 0.0006804313286914208, 'lambda_val': 0.0028026135496218574, 'batch_size': 886, 'optimizer': 'Adam'}. Best is trial 91 with value: 0.13592542901360083.
2026-05-16 09:16:52,517 - experiment_functions - INFO - Early stopping at epoch 750. Best Recall: 0.0904
2026-05-16 09:16:52,611 - optuna.study.study - INFO - Trial 112 finished with value: 0.09040690562216906 and parameters: {'n_layers': 1, 'embedding_dim': 256, 'lr': 0.001458421207007313, 'lambda_val': 0.002854949781424478, 'batch_size': 865, 'optimizer': 'Adam'}. Best is trial 91 with value: 0.13592542901360083.
2026-05-16 09:17:01,751 - experiment_functions - INFO - Early stopping at epoch 1450. Best Recall: 0.1205
2026-05-16 09:17:01,861 - optuna.study.study - INFO - Trial 113 finished with value: 0.12054022501737574 and parameters: {'n_layers': 1, 'embedding_dim': 256, 'lr': 0.0008410993497866212, 'lambda_val': 0.0012604946270950105, 'batch_size': 514, 'optimizer': 'Adam'}. Best is trial 91 with value: 0.13592542901360083.
2026-05-16 09:17:08,654 - experiment_functions - INFO - Early stopping at epoch 950. Best Recall: 0.0456
2026-05-16 09:17:08,765 - optuna.study.study - INFO - Trial 114 finished with value: 0.0456224343315777 and parameters: {'n_layers': 1, 'embedding_dim': 256, 'lr': 0.0005105009647844853, 'lambda_val': 0.04448310965796867, 'batch_size': 1169, 'optimizer': 'Adam'}. Best is trial 91 with value: 0.13592542901360083.
2026-05-16 09:17:17,072 - optuna.study._optimize - INFO - Trial 115 pruned. 
2026-05-16 09:17:23,641 - optuna.study._optimize - INFO - Trial 116 pruned. 
2026-05-16 09:17:34,239 - experiment_functions - INFO - Early stopping at epoch 1250. Best Recall: 0.1114
2026-05-16 09:17:34,339 - optuna.study.study - INFO - Trial 117 finished with value: 0.11144248937258941 and parameters: {'n_layers': 1, 'embedding_dim': 256, 'lr': 0.0010120319325248829, 'lambda_val': 0.0008466659009962231, 'batch_size': 908, 'optimizer': 'Adam'}. Best is trial 91 with value: 0.13592542901360083.
2026-05-16 09:17:43,609 - optuna.study._optimize - INFO - Trial 118 pruned. 
2026-05-16 09:17:47,324 - experiment_functions - INFO - Early stopping at epoch 500. Best Recall: 0.0011
2026-05-16 09:17:49,455 - optuna.study.study - INFO - Trial 119 finished with value: 0.0010734357988433053 and parameters: {'n_layers': 1, 'embedding_dim': 256, 'lr': 0.0004861470519820523, 'lambda_val': 0.004770211941521571, 'batch_size': 796, 'optimizer': 'SGD'}. Best is trial 91 with value: 0.13592542901360083.
2026-05-16 09:18:04,712 - optuna.study._optimize - INFO - Trial 120 pruned. 
2026-05-16 09:18:12,161 - experiment_functions - INFO - Early stopping at epoch 1150. Best Recall: 0.1144
2026-05-16 09:18:12,283 - optuna.study.study - INFO - Trial 121 finished with value: 0.11441842824229931 and parameters: {'n_layers': 1, 'embedding_dim': 256, 'lr': 0.0008389978591319961, 'lambda_val': 0.0013010266428355988, 'batch_size': 568, 'optimizer': 'Adam'}. Best is trial 91 with value: 0.13592542901360083.
2026-05-16 09:18:20,448 - optuna.study._optimize - INFO - Trial 122 pruned. 
2026-05-16 09:18:25,328 - experiment_functions - INFO - Early stopping at epoch 650. Best Recall: 0.0726
2026-05-16 09:18:25,449 - optuna.study.study - INFO - Trial 123 finished with value: 0.07255046440799323 and parameters: {'n_layers': 1, 'embedding_dim': 256, 'lr': 0.0013347068497954774, 'lambda_val': 0.011223070564457725, 'batch_size': 1128, 'optimizer': 'Adam'}. Best is trial 91 with value: 0.13592542901360083.
2026-05-16 09:18:35,197 - experiment_functions - INFO - Early stopping at epoch 1150. Best Recall: 0.1098
2026-05-16 09:18:35,298 - optuna.study.study - INFO - Trial 124 finished with value: 0.10977451636659519 and parameters: {'n_layers': 1, 'embedding_dim': 256, 'lr': 0.0008348023794060834, 'lambda_val': 0.001588082521402186, 'batch_size': 1323, 'optimizer': 'Adam'}. Best is trial 91 with value: 0.13592542901360083.
2026-05-16 09:18:54,278 - experiment_functions - INFO - Early stopping at epoch 2600. Best Recall: 0.1221
2026-05-16 09:18:54,390 - optuna.study.study - INFO - Trial 125 finished with value: 0.12214004513994409 and parameters: {'n_layers': 1, 'embedding_dim': 256, 'lr': 0.0005478402534831819, 'lambda_val': 0.00039127735448963745, 'batch_size': 512, 'optimizer': 'Adam'}. Best is trial 91 with value: 0.13592542901360083.
2026-05-16 09:19:01,464 - optuna.study._optimize - INFO - Trial 126 pruned. 
2026-05-16 09:19:22,813 - experiment_functions - INFO - Early stopping at epoch 2150. Best Recall: 0.1257
2026-05-16 09:19:22,906 - optuna.study.study - INFO - Trial 127 finished with value: 0.12565409390426469 and parameters: {'n_layers': 1, 'embedding_dim': 256, 'lr': 0.0005316919489171963, 'lambda_val': 0.00037846211660693, 'batch_size': 962, 'optimizer': 'Adam'}. Best is trial 91 with value: 0.13592542901360083.
2026-05-16 09:19:48,059 - optuna.study.study - INFO - Trial 128 finished with value: 0.12653035125661907 and parameters: {'n_layers': 1, 'embedding_dim': 256, 'lr': 0.0004230190928739709, 'lambda_val': 0.000865043456625388, 'batch_size': 957, 'optimizer': 'Adam'}. Best is trial 91 with value: 0.13592542901360083.
2026-05-16 09:19:54,778 - optuna.study._optimize - INFO - Trial 129 pruned. 
2026-05-16 09:20:02,748 - optuna.study._optimize - INFO - Trial 130 pruned. 
2026-05-16 09:20:12,826 - optuna.study._optimize - INFO - Trial 131 pruned. 
2026-05-16 09:20:29,652 - experiment_functions - INFO - Early stopping at epoch 2800. Best Recall: 0.1197
2026-05-16 09:20:29,753 - optuna.study.study - INFO - Trial 132 finished with value: 0.11965352904117697 and parameters: {'n_layers': 1, 'embedding_dim': 256, 'lr': 0.0006757171815531802, 'lambda_val': 0.0005618274246720229, 'batch_size': 1055, 'optimizer': 'Adam'}. Best is trial 91 with value: 0.13592542901360083.
2026-05-16 09:20:36,881 - optuna.study._optimize - INFO - Trial 133 pruned. 
2026-05-16 09:20:43,535 - optuna.study._optimize - INFO - Trial 134 pruned. 
2026-05-16 09:20:59,884 - experiment_functions - INFO - Early stopping at epoch 1650. Best Recall: 0.1251
2026-05-16 09:21:00,032 - optuna.study.study - INFO - Trial 135 finished with value: 0.12512575038373946 and parameters: {'n_layers': 1, 'embedding_dim': 256, 'lr': 0.000548022221964322, 'lambda_val': 0.000796472907754258, 'batch_size': 1485, 'optimizer': 'Adam'}. Best is trial 91 with value: 0.13592542901360083.
2026-05-16 09:21:05,675 - experiment_functions - INFO - Early stopping at epoch 850. Best Recall: 0.0018
2026-05-16 09:21:05,786 - optuna.study.study - INFO - Trial 136 finished with value: 0.0018064550641756672 and parameters: {'n_layers': 1, 'embedding_dim': 256, 'lr': 1.6435014533476186e-05, 'lambda_val': 0.000755603048393033, 'batch_size': 1246, 'optimizer': 'Adam'}. Best is trial 91 with value: 0.13592542901360083.
2026-05-16 09:21:12,673 - experiment_functions - INFO - Early stopping at epoch 1000. Best Recall: 0.1221
2026-05-16 09:21:12,764 - optuna.study.study - INFO - Trial 137 finished with value: 0.12211093782305464 and parameters: {'n_layers': 1, 'embedding_dim': 256, 'lr': 0.0009827889608668503, 'lambda_val': 0.0004408859356207021, 'batch_size': 989, 'optimizer': 'Adam'}. Best is trial 91 with value: 0.13592542901360083.
2026-05-16 09:21:34,629 - experiment_functions - INFO - Early stopping at epoch 3550. Best Recall: 0.1377
2026-05-16 09:21:34,748 - optuna.study.study - INFO - Trial 138 finished with value: 0.13771264499486957 and parameters: {'n_layers': 1, 'embedding_dim': 256, 'lr': 0.00045877006789086025, 'lambda_val': 0.0002805225432580762, 'batch_size': 1176, 'optimizer': 'Adam'}. Best is trial 138 with value: 0.13771264499486957.
2026-05-16 09:21:42,140 - optuna.study._optimize - INFO - Trial 139 pruned. 
2026-05-16 09:21:53,262 - experiment_functions - INFO - Early stopping at epoch 2000. Best Recall: 0.1227
2026-05-16 09:21:53,353 - optuna.study.study - INFO - Trial 140 finished with value: 0.1227060357708845 and parameters: {'n_layers': 1, 'embedding_dim': 128, 'lr': 0.0004868918689335405, 'lambda_val': 0.00037278221409245605, 'batch_size': 1319, 'optimizer': 'Adam'}. Best is trial 138 with value: 0.13771264499486957.
2026-05-16 09:21:59,732 - optuna.study._optimize - INFO - Trial 141 pruned. 
2026-05-16 09:22:05,869 - optuna.study._optimize - INFO - Trial 142 pruned. 
2026-05-16 09:22:12,716 - optuna.study._optimize - INFO - Trial 143 pruned. 
2026-05-16 09:22:21,660 - optuna.study._optimize - INFO - Trial 144 pruned. 
2026-05-16 09:22:33,537 - experiment_functions - INFO - Early stopping at epoch 2000. Best Recall: 0.1304
2026-05-16 09:22:33,638 - optuna.study.study - INFO - Trial 145 finished with value: 0.13042095815723298 and parameters: {'n_layers': 1, 'embedding_dim': 128, 'lr': 0.0007081897040398285, 'lambda_val': 0.00020033548724586315, 'batch_size': 1107, 'optimizer': 'Adam'}. Best is trial 138 with value: 0.13771264499486957.
2026-05-16 09:22:37,235 - experiment_functions - INFO - Early stopping at epoch 500. Best Recall: 0.0029
2026-05-16 09:22:37,342 - optuna.study.study - INFO - Trial 146 finished with value: 0.0029251081529009593 and parameters: {'n_layers': 1, 'embedding_dim': 128, 'lr': 0.0003420540795207215, 'lambda_val': 0.00018019993969622592, 'batch_size': 1097, 'optimizer': 'SGD'}. Best is trial 138 with value: 0.13771264499486957.
2026-05-16 09:22:43,409 - optuna.study._optimize - INFO - Trial 147 pruned. 
2026-05-16 09:22:49,940 - experiment_functions - INFO - Early stopping at epoch 900. Best Recall: 0.0613
2026-05-16 09:22:50,039 - optuna.study.study - INFO - Trial 148 finished with value: 0.061329732894614006 and parameters: {'n_layers': 3, 'embedding_dim': 128, 'lr': 0.0006856307185465539, 'lambda_val': 0.0002072468569142317, 'batch_size': 1396, 'optimizer': 'Adam'}. Best is trial 138 with value: 0.13771264499486957.
2026-05-16 09:22:56,680 - optuna.study._optimize - INFO - Trial 149 pruned. 
2026-05-16 09:23:04,219 - optuna.study._optimize - INFO - Trial 150 pruned. 
2026-05-16 09:23:17,116 - experiment_functions - INFO - Early stopping at epoch 2050. Best Recall: 0.1348
2026-05-16 09:23:17,207 - optuna.study.study - INFO - Trial 151 finished with value: 0.13484368157676985 and parameters: {'n_layers': 1, 'embedding_dim': 256, 'lr': 0.0006863239476414413, 'lambda_val': 0.00011643087006675024, 'batch_size': 852, 'optimizer': 'Adam'}. Best is trial 138 with value: 0.13771264499486957.
2026-05-16 09:23:23,764 - optuna.study._optimize - INFO - Trial 152 pruned. 
2026-05-16 09:23:41,064 - experiment_functions - INFO - Early stopping at epoch 2650. Best Recall: 0.1231
2026-05-16 09:23:41,183 - optuna.study.study - INFO - Trial 153 finished with value: 0.12305934867375777 and parameters: {'n_layers': 1, 'embedding_dim': 256, 'lr': 0.0005631901016100012, 'lambda_val': 0.00010770341396026374, 'batch_size': 995, 'optimizer': 'Adam'}. Best is trial 138 with value: 0.13771264499486957.
2026-05-16 09:23:54,729 - experiment_functions - INFO - Early stopping at epoch 1050. Best Recall: 0.1105
2026-05-16 09:23:54,831 - optuna.study.study - INFO - Trial 154 finished with value: 0.11047833021821057 and parameters: {'n_layers': 1, 'embedding_dim': 256, 'lr': 0.0011172028700306427, 'lambda_val': 0.00010913497716739357, 'batch_size': 971, 'optimizer': 'Adam'}. Best is trial 138 with value: 0.13771264499486957.
2026-05-16 09:24:16,196 - experiment_functions - INFO - Early stopping at epoch 2200. Best Recall: 0.1209
