2026-05-16 05:28:01,854 - optuna.study._optimize - INFO - Trial 72 pruned. 
2026-05-16 05:28:06,878 - experiment_functions - INFO - Early stopping at epoch 750. Best Recall: 0.0260
2026-05-16 05:28:06,977 - optuna.study.study - INFO - Trial 73 finished with value: 0.025961741245204947 and parameters: {'n_layers': 1, 'embedding_dim': 128, 'lr': 0.0006539925903187929, 'lambda_val': 2.619009771209706e-06, 'batch_size': 1180, 'optimizer': 'RMSprop'}. Best is trial 51 with value: 0.03241341748392861.
2026-05-16 05:28:13,100 - optuna.study._optimize - INFO - Trial 74 pruned. 
2026-05-16 05:28:19,056 - optuna.study._optimize - INFO - Trial 75 pruned. 
2026-05-16 05:28:24,743 - optuna.study._optimize - INFO - Trial 76 pruned. 
2026-05-16 05:28:27,944 - experiment_functions - INFO - Early stopping at epoch 500. Best Recall: 0.0036
2026-05-16 05:28:28,044 - optuna.study.study - INFO - Trial 77 finished with value: 0.003616035634694823 and parameters: {'n_layers': 1, 'embedding_dim': 128, 'lr': 0.000138209497666313, 'lambda_val': 0.008200067449178314, 'batch_size': 1224, 'optimizer': 'SGD'}. Best is trial 51 with value: 0.03241341748392861.
2026-05-16 05:28:35,514 - optuna.study._optimize - INFO - Trial 78 pruned. 
2026-05-16 05:28:41,872 - optuna.study._optimize - INFO - Trial 79 pruned. 
2026-05-16 05:28:47,903 - optuna.study._optimize - INFO - Trial 80 pruned. 
2026-05-16 05:28:57,266 - optuna.study._optimize - INFO - Trial 81 pruned. 
2026-05-16 05:29:03,315 - optuna.study._optimize - INFO - Trial 82 pruned. 
2026-05-16 05:29:09,645 - optuna.study._optimize - INFO - Trial 83 pruned. 
2026-05-16 05:29:15,723 - optuna.study._optimize - INFO - Trial 84 pruned. 
2026-05-16 05:29:21,208 - optuna.study._optimize - INFO - Trial 85 pruned. 
2026-05-16 05:29:25,518 - experiment_functions - INFO - Early stopping at epoch 650. Best Recall: 0.0244
2026-05-16 05:29:25,639 - optuna.study.study - INFO - Trial 86 finished with value: 0.024386193404471675 and parameters: {'n_layers': 1, 'embedding_dim': 256, 'lr': 0.0006092388303657583, 'lambda_val': 2.151779190941814e-05, 'batch_size': 1553, 'optimizer': 'RMSprop'}. Best is trial 51 with value: 0.03241341748392861.
2026-05-16 05:29:31,834 - optuna.study._optimize - INFO - Trial 87 pruned. 
2026-05-16 05:29:39,241 - optuna.study._optimize - INFO - Trial 88 pruned. 
2026-05-16 05:29:42,496 - experiment_functions - INFO - Early stopping at epoch 500. Best Recall: 0.0022
2026-05-16 05:29:42,632 - optuna.study.study - INFO - Trial 89 finished with value: 0.002200312954328306 and parameters: {'n_layers': 4, 'embedding_dim': 32, 'lr': 0.00013480529764252228, 'lambda_val': 9.195656337252411e-06, 'batch_size': 1744, 'optimizer': 'SGD'}. Best is trial 51 with value: 0.03241341748392861.
2026-05-16 05:29:49,747 - experiment_functions - INFO - Early stopping at epoch 1250. Best Recall: 0.0302
2026-05-16 05:29:49,838 - optuna.study.study - INFO - Trial 90 finished with value: 0.0302276173996073 and parameters: {'n_layers': 1, 'embedding_dim': 96, 'lr': 0.0004291337768684413, 'lambda_val': 5.305367332462309e-06, 'batch_size': 1124, 'optimizer': 'RMSprop'}. Best is trial 51 with value: 0.03241341748392861.
2026-05-16 05:29:56,070 - optuna.study._optimize - INFO - Trial 91 pruned. 
2026-05-16 05:30:03,825 - optuna.study._optimize - INFO - Trial 92 pruned. 
2026-05-16 05:30:07,854 - experiment_functions - INFO - Early stopping at epoch 700. Best Recall: 0.0202
2026-05-16 05:30:07,944 - optuna.study.study - INFO - Trial 93 finished with value: 0.020182643720232755 and parameters: {'n_layers': 1, 'embedding_dim': 96, 'lr': 0.0007699089735268003, 'lambda_val': 1.784834966491311e-06, 'batch_size': 940, 'optimizer': 'RMSprop'}. Best is trial 51 with value: 0.03241341748392861.
2026-05-16 05:30:13,312 - experiment_functions - INFO - Early stopping at epoch 950. Best Recall: 0.0051
2026-05-16 05:30:13,403 - optuna.study.study - INFO - Trial 94 finished with value: 0.005132289798016829 and parameters: {'n_layers': 1, 'embedding_dim': 96, 'lr': 0.05113184233164723, 'lambda_val': 4.97224225737047e-06, 'batch_size': 1509, 'optimizer': 'RMSprop'}. Best is trial 51 with value: 0.03241341748392861.
2026-05-16 05:30:21,208 - optuna.study._optimize - INFO - Trial 95 pruned. 
2026-05-16 05:30:27,655 - experiment_functions - INFO - Early stopping at epoch 950. Best Recall: 0.0256
2026-05-16 05:30:27,755 - optuna.study.study - INFO - Trial 96 finished with value: 0.025556942450333964 and parameters: {'n_layers': 1, 'embedding_dim': 96, 'lr': 0.00046276303862402833, 'lambda_val': 1.6826473626804772e-05, 'batch_size': 1443, 'optimizer': 'RMSprop'}. Best is trial 51 with value: 0.03241341748392861.
2026-05-16 05:30:34,745 - optuna.study._optimize - INFO - Trial 97 pruned. 
2026-05-16 05:30:42,150 - optuna.study._optimize - INFO - Trial 98 pruned. 
2026-05-16 05:30:45,722 - experiment_functions - INFO - Early stopping at epoch 550. Best Recall: 0.0216
2026-05-16 05:30:45,802 - optuna.study.study - INFO - Trial 99 finished with value: 0.021580606050698378 and parameters: {'n_layers': 1, 'embedding_dim': 128, 'lr': 0.0012602611383347015, 'lambda_val': 2.5274173225823492e-06, 'batch_size': 1631, 'optimizer': 'RMSprop'}. Best is trial 51 with value: 0.03241341748392861.
2026-05-16 05:30:53,109 - optuna.study._optimize - INFO - Trial 100 pruned. 
2026-05-16 05:30:57,897 - experiment_functions - INFO - Early stopping at epoch 850. Best Recall: 0.0239
2026-05-16 05:30:57,987 - optuna.study.study - INFO - Trial 101 finished with value: 0.023870801969314542 and parameters: {'n_layers': 1, 'embedding_dim': 128, 'lr': 0.0005578700543403862, 'lambda_val': 2.3125339545342013e-06, 'batch_size': 1197, 'optimizer': 'RMSprop'}. Best is trial 51 with value: 0.03241341748392861.
2026-05-16 05:31:01,883 - experiment_functions - INFO - Early stopping at epoch 650. Best Recall: 0.0231
2026-05-16 05:31:01,973 - optuna.study.study - INFO - Trial 102 finished with value: 0.023128559758099215 and parameters: {'n_layers': 1, 'embedding_dim': 128, 'lr': 0.0009301277896306253, 'lambda_val': 1.51888677505699e-06, 'batch_size': 1120, 'optimizer': 'RMSprop'}. Best is trial 51 with value: 0.03241341748392861.
2026-05-16 05:31:06,671 - experiment_functions - INFO - Early stopping at epoch 800. Best Recall: 0.0240
2026-05-16 05:31:06,771 - optuna.study.study - INFO - Trial 103 finished with value: 0.02397239291534389 and parameters: {'n_layers': 1, 'embedding_dim': 128, 'lr': 0.0006857391915077207, 'lambda_val': 6.8915034966180545e-06, 'batch_size': 1256, 'optimizer': 'RMSprop'}. Best is trial 51 with value: 0.03241341748392861.
2026-05-16 05:31:13,125 - optuna.study._optimize - INFO - Trial 104 pruned. 
2026-05-16 05:31:18,561 - experiment_functions - INFO - Early stopping at epoch 900. Best Recall: 0.0240
2026-05-16 05:31:18,669 - optuna.study.study - INFO - Trial 105 finished with value: 0.024027271434710815 and parameters: {'n_layers': 1, 'embedding_dim': 128, 'lr': 0.0005062172358330023, 'lambda_val': 1.0622524401580011e-06, 'batch_size': 1146, 'optimizer': 'RMSprop'}. Best is trial 51 with value: 0.03241341748392861.
2026-05-16 05:31:24,527 - optuna.study._optimize - INFO - Trial 106 pruned. 
2026-05-16 05:31:31,061 - experiment_functions - INFO - Early stopping at epoch 950. Best Recall: 0.0093
2026-05-16 05:31:31,151 - optuna.study.study - INFO - Trial 107 finished with value: 0.009329638756522545 and parameters: {'n_layers': 2, 'embedding_dim': 256, 'lr': 0.00039410616079941114, 'lambda_val': 3.41138796779033e-06, 'batch_size': 896, 'optimizer': 'RMSprop'}. Best is trial 51 with value: 0.03241341748392861.
2026-05-16 05:31:37,070 - optuna.study._optimize - INFO - Trial 108 pruned. 
2026-05-16 05:31:40,873 - experiment_functions - INFO - Early stopping at epoch 500. Best Recall: 0.0025
2026-05-16 05:31:40,963 - optuna.study.study - INFO - Trial 109 finished with value: 0.0024876060439532003 and parameters: {'n_layers': 1, 'embedding_dim': 128, 'lr': 0.00276975836792782, 'lambda_val': 2.6132829753373578e-06, 'batch_size': 1961, 'optimizer': 'SGD'}. Best is trial 51 with value: 0.03241341748392861.
2026-05-16 05:31:47,681 - optuna.study._optimize - INFO - Trial 110 pruned. 
2026-05-16 05:31:55,063 - experiment_functions - INFO - Early stopping at epoch 1200. Best Recall: 0.0282
2026-05-16 05:31:55,164 - optuna.study.study - INFO - Trial 111 finished with value: 0.028210726083916532 and parameters: {'n_layers': 1, 'embedding_dim': 96, 'lr': 0.0004468222173167189, 'lambda_val': 2.0281510364729855e-06, 'batch_size': 990, 'optimizer': 'RMSprop'}. Best is trial 51 with value: 0.03241341748392861.
2026-05-16 05:32:07,481 - experiment_functions - INFO - Early stopping at epoch 1700. Best Recall: 0.0301
2026-05-16 05:32:07,581 - optuna.study.study - INFO - Trial 112 finished with value: 0.03013830112360795 and parameters: {'n_layers': 1, 'embedding_dim': 96, 'lr': 0.0003121629528196219, 'lambda_val': 2.2269888695522424e-06, 'batch_size': 985, 'optimizer': 'RMSprop'}. Best is trial 51 with value: 0.03241341748392861.
2026-05-16 05:32:14,527 - optuna.study._optimize - INFO - Trial 113 pruned. 
2026-05-16 05:32:21,771 - optuna.study._optimize - INFO - Trial 114 pruned. 
2026-05-16 05:32:47,619 - optuna.study.study - INFO - Trial 115 finished with value: 0.034544821179490925 and parameters: {'n_layers': 1, 'embedding_dim': 96, 'lr': 0.00023309681768559043, 'lambda_val': 4.451674995529571e-06, 'batch_size': 633, 'optimizer': 'RMSprop'}. Best is trial 115 with value: 0.034544821179490925.
2026-05-16 05:32:54,175 - optuna.study._optimize - INFO - Trial 116 pruned. 
2026-05-16 05:33:03,023 - experiment_functions - INFO - Early stopping at epoch 1400. Best Recall: 0.0294
2026-05-16 05:33:03,148 - optuna.study.study - INFO - Trial 117 finished with value: 0.029388095412318526 and parameters: {'n_layers': 1, 'embedding_dim': 96, 'lr': 0.0004173548444136933, 'lambda_val': 1.553337360314762e-06, 'batch_size': 860, 'optimizer': 'RMSprop'}. Best is trial 115 with value: 0.034544821179490925.
2026-05-16 05:33:10,094 - optuna.study._optimize - INFO - Trial 118 pruned. 
2026-05-16 05:33:16,714 - optuna.study._optimize - INFO - Trial 119 pruned. 
2026-05-16 05:33:22,085 - experiment_functions - INFO - Early stopping at epoch 800. Best Recall: 0.0111
2026-05-16 05:33:22,220 - optuna.study.study - INFO - Trial 120 finished with value: 0.011085281799330032 and parameters: {'n_layers': 3, 'embedding_dim': 96, 'lr': 0.0005828920492068401, 'lambda_val': 1.5432413617550908e-06, 'batch_size': 954, 'optimizer': 'RMSprop'}. Best is trial 115 with value: 0.034544821179490925.
2026-05-16 05:33:29,102 - optuna.study._optimize - INFO - Trial 121 pruned. 
2026-05-16 05:33:35,529 - optuna.study._optimize - INFO - Trial 122 pruned. 
2026-05-16 05:33:42,025 - optuna.study._optimize - INFO - Trial 123 pruned. 
2026-05-16 05:33:47,808 - optuna.study._optimize - INFO - Trial 124 pruned. 
2026-05-16 05:33:53,610 - optuna.study._optimize - INFO - Trial 125 pruned. 
2026-05-16 05:34:03,261 - optuna.study._optimize - INFO - Trial 126 pruned. 
2026-05-16 05:34:09,770 - experiment_functions - INFO - Early stopping at epoch 1200. Best Recall: 0.0312
2026-05-16 05:34:09,861 - optuna.study.study - INFO - Trial 127 finished with value: 0.031214324025641862 and parameters: {'n_layers': 1, 'embedding_dim': 96, 'lr': 0.00048352530927003016, 'lambda_val': 5.454378916679326e-06, 'batch_size': 838, 'optimizer': 'RMSprop'}. Best is trial 115 with value: 0.034544821179490925.
2026-05-16 05:34:13,985 - experiment_functions - INFO - Early stopping at epoch 700. Best Recall: 0.0094
2026-05-16 05:34:14,065 - optuna.study.study - INFO - Trial 128 finished with value: 0.00941882342531065 and parameters: {'n_layers': 1, 'embedding_dim': 96, 'lr': 0.012335623103208836, 'lambda_val': 5.0903830108591815e-06, 'batch_size': 859, 'optimizer': 'RMSprop'}. Best is trial 115 with value: 0.034544821179490925.
2026-05-16 05:34:19,671 - experiment_functions - INFO - Early stopping at epoch 900. Best Recall: 0.0225
2026-05-16 05:34:19,772 - optuna.study.study - INFO - Trial 129 finished with value: 0.02248930361333572 and parameters: {'n_layers': 1, 'embedding_dim': 96, 'lr': 0.0007100434134438175, 'lambda_val': 1.2751867810205644e-06, 'batch_size': 610, 'optimizer': 'RMSprop'}. Best is trial 115 with value: 0.034544821179490925.
2026-05-16 05:34:36,005 - experiment_functions - INFO - Early stopping at epoch 1500. Best Recall: 0.0329
2026-05-16 05:34:36,103 - optuna.study.study - INFO - Trial 130 finished with value: 0.032921679231905705 and parameters: {'n_layers': 1, 'embedding_dim': 96, 'lr': 0.0004589115794438062, 'lambda_val': 2.970705544045482e-06, 'batch_size': 721, 'optimizer': 'RMSprop'}. Best is trial 115 with value: 0.034544821179490925.
2026-05-16 05:34:42,769 - optuna.study._optimize - INFO - Trial 131 pruned. 
2026-05-16 05:34:49,095 - experiment_functions - INFO - Early stopping at epoch 1200. Best Recall: 0.0345
2026-05-16 05:34:49,184 - optuna.study.study - INFO - Trial 132 finished with value: 0.03446550908922613 and parameters: {'n_layers': 1, 'embedding_dim': 96, 'lr': 0.00037046993631410416, 'lambda_val': 1.7960051404208698e-06, 'batch_size': 710, 'optimizer': 'RMSprop'}. Best is trial 115 with value: 0.034544821179490925.
2026-05-16 05:35:02,774 - experiment_functions - INFO - Early stopping at epoch 2200. Best Recall: 0.0312
2026-05-16 05:35:02,872 - optuna.study.study - INFO - Trial 133 finished with value: 0.031197624384142933 and parameters: {'n_layers': 1, 'embedding_dim': 96, 'lr': 0.00030317863377671246, 'lambda_val': 3.907250231607253e-06, 'batch_size': 727, 'optimizer': 'RMSprop'}. Best is trial 115 with value: 0.034544821179490925.
2026-05-16 05:35:13,919 - experiment_functions - INFO - Early stopping at epoch 1700. Best Recall: 0.0338
2026-05-16 05:35:14,008 - optuna.study.study - INFO - Trial 134 finished with value: 0.03375733713458994 and parameters: {'n_layers': 1, 'embedding_dim': 96, 'lr': 0.0003508591303894227, 'lambda_val': 3.0974752359736814e-06, 'batch_size': 750, 'optimizer': 'RMSprop'}. Best is trial 115 with value: 0.034544821179490925.
2026-05-16 05:35:25,379 - experiment_functions - INFO - Early stopping at epoch 2200. Best Recall: 0.0373
2026-05-16 05:35:25,471 - optuna.study.study - INFO - Trial 135 finished with value: 0.03726094533609576 and parameters: {'n_layers': 1, 'embedding_dim': 96, 'lr': 0.0003557379463342817, 'lambda_val': 1.64563374498149e-06, 'batch_size': 724, 'optimizer': 'RMSprop'}. Best is trial 135 with value: 0.03726094533609576.
2026-05-16 05:35:33,504 - experiment_functions - INFO - Early stopping at epoch 1400. Best Recall: 0.0357
2026-05-16 05:35:33,596 - optuna.study.study - INFO - Trial 136 finished with value: 0.03569405866227861 and parameters: {'n_layers': 1, 'embedding_dim': 96, 'lr': 0.0003826724691078398, 'lambda_val': 4.175667673904531e-06, 'batch_size': 747, 'optimizer': 'RMSprop'}. Best is trial 135 with value: 0.03726094533609576.
2026-05-16 05:35:41,582 - experiment_functions - INFO - Early stopping at epoch 1450. Best Recall: 0.0300
2026-05-16 05:35:41,726 - optuna.study.study - INFO - Trial 137 finished with value: 0.03003548321456237 and parameters: {'n_layers': 1, 'embedding_dim': 96, 'lr': 0.0003536305670840866, 'lambda_val': 4.024751019214e-06, 'batch_size': 700, 'optimizer': 'RMSprop'}. Best is trial 135 with value: 0.03726094533609576.
2026-05-16 05:35:48,349 - experiment_functions - INFO - Early stopping at epoch 1050. Best Recall: 0.0302
2026-05-16 05:35:48,502 - optuna.study.study - INFO - Trial 138 finished with value: 0.030201035301577465 and parameters: {'n_layers': 1, 'embedding_dim': 96, 'lr': 0.0005413720574943786, 'lambda_val': 3.8688150628308384e-06, 'batch_size': 712, 'optimizer': 'RMSprop'}. Best is trial 135 with value: 0.03726094533609576.
2026-05-16 05:35:53,468 - experiment_functions - INFO - Early stopping at epoch 800. Best Recall: 0.0277
2026-05-16 05:35:53,559 - optuna.study.study - INFO - Trial 139 finished with value: 0.027701124271272394 and parameters: {'n_layers': 1, 'embedding_dim': 96, 'lr': 0.0006102653315194275, 'lambda_val': 3.001450269137306e-06, 'batch_size': 773, 'optimizer': 'RMSprop'}. Best is trial 135 with value: 0.03726094533609576.
2026-05-16 05:35:57,175 - experiment_functions - INFO - Early stopping at epoch 500. Best Recall: 0.0031
2026-05-16 05:35:57,264 - optuna.study.study - INFO - Trial 140 finished with value: 0.003055627570460998 and parameters: {'n_layers': 1, 'embedding_dim': 96, 'lr': 0.0005634260444513522, 'lambda_val': 6.1553525031455225e-06, 'batch_size': 620, 'optimizer': 'SGD'}. Best is trial 135 with value: 0.03726094533609576.
2026-05-16 05:36:01,786 - experiment_functions - INFO - Early stopping at epoch 650. Best Recall: 0.0307
2026-05-16 05:36:01,922 - optuna.study.study - INFO - Trial 141 finished with value: 0.030654378800257728 and parameters: {'n_layers': 1, 'embedding_dim': 96, 'lr': 0.0008493558900043343, 'lambda_val': 4.356996443376169e-06, 'batch_size': 693, 'optimizer': 'RMSprop'}. Best is trial 135 with value: 0.03726094533609576.
2026-05-16 05:36:06,564 - experiment_functions - INFO - Early stopping at epoch 650. Best Recall: 0.0254
2026-05-16 05:36:06,654 - optuna.study.study - INFO - Trial 142 finished with value: 0.025435744556432736 and parameters: {'n_layers': 1, 'embedding_dim': 96, 'lr': 0.00098600022568631, 'lambda_val': 4.681424454669433e-06, 'batch_size': 571, 'optimizer': 'RMSprop'}. Best is trial 135 with value: 0.03726094533609576.
2026-05-16 05:36:10,885 - experiment_functions - INFO - Early stopping at epoch 600. Best Recall: 0.0251
2026-05-16 05:36:10,977 - optuna.study.study - INFO - Trial 143 finished with value: 0.025086348181174986 and parameters: {'n_layers': 1, 'embedding_dim': 96, 'lr': 0.0008167335523740673, 'lambda_val': 3.0458625193344184e-06, 'batch_size': 735, 'optimizer': 'RMSprop'}. Best is trial 135 with value: 0.03726094533609576.
2026-05-16 05:36:14,862 - experiment_functions - INFO - Early stopping at epoch 550. Best Recall: 0.0230
2026-05-16 05:36:14,961 - optuna.study.study - INFO - Trial 144 finished with value: 0.023031623176082656 and parameters: {'n_layers': 1, 'embedding_dim': 96, 'lr': 0.0012043122464066387, 'lambda_val': 3.886216119193617e-06, 'batch_size': 783, 'optimizer': 'RMSprop'}. Best is trial 135 with value: 0.03726094533609576.
2026-05-16 05:36:21,840 - experiment_functions - INFO - Early stopping at epoch 1100. Best Recall: 0.0304
2026-05-16 05:36:21,939 - optuna.study.study - INFO - Trial 145 finished with value: 0.03039514054997233 and parameters: {'n_layers': 1, 'embedding_dim': 96, 'lr': 0.00046976624563206985, 'lambda_val': 5.85423890117209e-06, 'batch_size': 686, 'optimizer': 'RMSprop'}. Best is trial 135 with value: 0.03726094533609576.
2026-05-16 05:36:28,989 - optuna.study._optimize - INFO - Trial 146 pruned. 
2026-05-16 05:36:32,451 - experiment_functions - INFO - Early stopping at epoch 550. Best Recall: 0.0142
2026-05-16 05:36:32,553 - optuna.study.study - INFO - Trial 147 finished with value: 0.014221566963523653 and parameters: {'n_layers': 1, 'embedding_dim': 96, 'lr': 0.0018532116434677212, 'lambda_val': 5.401490287668257e-06, 'batch_size': 521, 'optimizer': 'RMSprop'}. Best is trial 135 with value: 0.03726094533609576.
2026-05-16 05:36:42,903 - experiment_functions - INFO - Early stopping at epoch 1700. Best Recall: 0.0345
2026-05-16 05:36:42,994 - optuna.study.study - INFO - Trial 148 finished with value: 0.034512548874894716 and parameters: {'n_layers': 1, 'embedding_dim': 96, 'lr': 0.00039126018421844724, 'lambda_val': 6.705487704855403e-06, 'batch_size': 719, 'optimizer': 'RMSprop'}. Best is trial 135 with value: 0.03726094533609576.
2026-05-16 05:36:47,770 - experiment_functions - INFO - Early stopping at epoch 650. Best Recall: 0.0284
2026-05-16 05:36:47,871 - optuna.study.study - INFO - Trial 149 finished with value: 0.02843993225939508 and parameters: {'n_layers': 1, 'embedding_dim': 256, 'lr': 0.0007020925359450906, 'lambda_val': 9.808223114874757e-06, 'batch_size': 590, 'optimizer': 'RMSprop'}. Best is trial 135 with value: 0.03726094533609576.
2026-05-16 05:36:54,315 - experiment_functions - INFO - Early stopping at epoch 1100. Best Recall: 0.0286
2026-05-16 05:36:54,415 - optuna.study.study - INFO - Trial 150 finished with value: 0.02863329643005924 and parameters: {'n_layers': 1, 'embedding_dim': 96, 'lr': 0.00043092454085011487, 'lambda_val': 6.564955154168531e-06, 'batch_size': 807, 'optimizer': 'Adam'}. Best is trial 135 with value: 0.03726094533609576.
2026-05-16 05:37:03,738 - experiment_functions - INFO - Early stopping at epoch 1150. Best Recall: 0.0300
2026-05-16 05:37:03,840 - optuna.study.study - INFO - Trial 151 finished with value: 0.03002134981494278 and parameters: {'n_layers': 1, 'embedding_dim': 96, 'lr': 0.00048030478754527186, 'lambda_val': 0.0010259611231283156, 'batch_size': 723, 'optimizer': 'RMSprop'}. Best is trial 135 with value: 0.03726094533609576.
2026-05-16 05:37:14,519 - experiment_functions - INFO - Early stopping at epoch 1950. Best Recall: 0.0308
2026-05-16 05:37:14,617 - optuna.study.study - INFO - Trial 152 finished with value: 0.03082110171159737 and parameters: {'n_layers': 1, 'embedding_dim': 96, 'lr': 0.0003628395723815571, 'lambda_val': 4.766167116581654e-06, 'batch_size': 705, 'optimizer': 'RMSprop'}. Best is trial 135 with value: 0.03726094533609576.
2026-05-16 05:37:24,575 - experiment_functions - INFO - Early stopping at epoch 1800. Best Recall: 0.0301
2026-05-16 05:37:24,695 - optuna.study.study - INFO - Trial 153 finished with value: 0.03009247221601625 and parameters: {'n_layers': 1, 'embedding_dim': 96, 'lr': 0.0003793094099686435, 'lambda_val': 5.310605648951646e-06, 'batch_size': 644, 'optimizer': 'RMSprop'}. Best is trial 135 with value: 0.03726094533609576.
2026-05-16 05:37:43,612 - experiment_functions - INFO - Early stopping at epoch 3000. Best Recall: 0.0367
