2026-05-16 08:00:45,405 - optuna.study.study - INFO - Trial 190 finished with value: 0.124621799811026 and parameters: {'n_layers': 1, 'embedding_dim': 256, 'lr': 0.0007900358609581218, 'lambda_val': 0.00047516418343060564, 'batch_size': 776, 'optimizer': 'Adam'}. Best is trial 96 with value: 0.1292701130387624.
2026-05-16 08:00:52,488 - experiment_functions - INFO - Early stopping at epoch 700. Best Recall: 0.0597
2026-05-16 08:00:52,579 - optuna.study.study - INFO - Trial 191 finished with value: 0.0597360403269779 and parameters: {'n_layers': 3, 'embedding_dim': 256, 'lr': 0.0007609663280329162, 'lambda_val': 0.00042735034302009676, 'batch_size': 741, 'optimizer': 'Adam'}. Best is trial 96 with value: 0.1292701130387624.
2026-05-16 08:01:05,544 - experiment_functions - INFO - Early stopping at epoch 1950. Best Recall: 0.1282
2026-05-16 08:01:05,712 - optuna.study.study - INFO - Trial 192 finished with value: 0.12822545935152438 and parameters: {'n_layers': 1, 'embedding_dim': 256, 'lr': 0.0006427488488340883, 'lambda_val': 2.5398413653225805e-06, 'batch_size': 817, 'optimizer': 'Adam'}. Best is trial 96 with value: 0.1292701130387624.
2026-05-16 08:01:15,603 - optuna.study._optimize - INFO - Trial 193 pruned. 
2026-05-16 08:01:31,356 - experiment_functions - INFO - Early stopping at epoch 2150. Best Recall: 0.1246
2026-05-16 08:01:31,479 - optuna.study.study - INFO - Trial 194 finished with value: 0.12456056337969673 and parameters: {'n_layers': 1, 'embedding_dim': 256, 'lr': 0.0009003229779001844, 'lambda_val': 2.993688517174999e-06, 'batch_size': 678, 'optimizer': 'Adam'}. Best is trial 96 with value: 0.1292701130387624.
2026-05-16 08:01:51,154 - experiment_functions - INFO - Early stopping at epoch 2200. Best Recall: 0.1247
2026-05-16 08:01:51,274 - optuna.study.study - INFO - Trial 195 finished with value: 0.12466343308071307 and parameters: {'n_layers': 1, 'embedding_dim': 256, 'lr': 0.0005809405690797136, 'lambda_val': 2.4487896470416317e-06, 'batch_size': 913, 'optimizer': 'Adam'}. Best is trial 96 with value: 0.1292701130387624.
2026-05-16 08:02:00,874 - optuna.study._optimize - INFO - Trial 196 pruned. 
2026-05-16 08:02:16,070 - experiment_functions - INFO - Early stopping at epoch 2100. Best Recall: 0.1261
2026-05-16 08:02:16,169 - optuna.study.study - INFO - Trial 197 finished with value: 0.12609229729149826 and parameters: {'n_layers': 1, 'embedding_dim': 256, 'lr': 0.0006367861210415172, 'lambda_val': 2.435357137488076e-06, 'batch_size': 851, 'optimizer': 'Adam'}. Best is trial 96 with value: 0.1292701130387624.
2026-05-16 08:02:23,785 - optuna.study._optimize - INFO - Trial 198 pruned. 
2026-05-16 08:02:35,202 - optuna.study._optimize - INFO - Trial 199 pruned. 
2026-05-16 08:02:41,852 - optuna.study._optimize - INFO - Trial 200 pruned. 
2026-05-16 08:02:52,293 - optuna.study._optimize - INFO - Trial 201 pruned. 
2026-05-16 08:03:00,132 - optuna.study._optimize - INFO - Trial 202 pruned. 
2026-05-16 08:03:10,150 - optuna.study._optimize - INFO - Trial 203 pruned. 
2026-05-16 08:03:21,594 - optuna.study._optimize - INFO - Trial 204 pruned. 
2026-05-16 08:03:40,339 - experiment_functions - INFO - Early stopping at epoch 2250. Best Recall: 0.1276
2026-05-16 08:03:40,508 - optuna.study.study - INFO - Trial 205 finished with value: 0.1275884641156368 and parameters: {'n_layers': 1, 'embedding_dim': 256, 'lr': 0.0005988315487049686, 'lambda_val': 2.255259105591104e-06, 'batch_size': 860, 'optimizer': 'Adam'}. Best is trial 96 with value: 0.1292701130387624.
2026-05-16 08:03:44,803 - experiment_functions - INFO - Early stopping at epoch 500. Best Recall: 0.0012
2026-05-16 08:03:44,894 - optuna.study.study - INFO - Trial 206 finished with value: 0.001231971212738301 and parameters: {'n_layers': 1, 'embedding_dim': 256, 'lr': 3.357280517766002e-05, 'lambda_val': 2.294162805384984e-06, 'batch_size': 870, 'optimizer': 'Adam'}. Best is trial 96 with value: 0.1292701130387624.
2026-05-16 08:03:48,636 - experiment_functions - INFO - Early stopping at epoch 500. Best Recall: 0.0023
2026-05-16 08:03:49,562 - optuna.study.study - INFO - Trial 207 finished with value: 0.0022794313063258975 and parameters: {'n_layers': 1, 'embedding_dim': 256, 'lr': 2.234273988469722e-05, 'lambda_val': 1.0013913701605103e-06, 'batch_size': 2521, 'optimizer': 'Adam'}. Best is trial 96 with value: 0.1292701130387624.
2026-05-16 08:04:08,744 - experiment_functions - INFO - Early stopping at epoch 2600. Best Recall: 0.1271
2026-05-16 08:04:08,865 - optuna.study.study - INFO - Trial 208 finished with value: 0.1270661128842868 and parameters: {'n_layers': 1, 'embedding_dim': 256, 'lr': 0.0005552586375796976, 'lambda_val': 2.0286864297779095e-06, 'batch_size': 855, 'optimizer': 'Adam'}. Best is trial 96 with value: 0.1292701130387624.
2026-05-16 08:04:15,957 - optuna.study._optimize - INFO - Trial 209 pruned. 
2026-05-16 08:04:25,166 - optuna.study._optimize - INFO - Trial 210 pruned. 
2026-05-16 08:04:43,047 - optuna.study._optimize - INFO - Trial 211 pruned. 
2026-05-16 08:04:58,195 - optuna.study._optimize - INFO - Trial 212 pruned. 
2026-05-16 08:05:06,146 - optuna.study._optimize - INFO - Trial 213 pruned. 
2026-05-16 08:05:18,702 - experiment_functions - INFO - Early stopping at epoch 1650. Best Recall: 0.1238
2026-05-16 08:05:18,792 - optuna.study.study - INFO - Trial 214 finished with value: 0.12384041904038257 and parameters: {'n_layers': 1, 'embedding_dim': 256, 'lr': 0.0007587070478705884, 'lambda_val': 4.451434504145033e-06, 'batch_size': 901, 'optimizer': 'Adam'}. Best is trial 96 with value: 0.1292701130387624.
2026-05-16 08:05:30,477 - optuna.study._optimize - INFO - Trial 215 pruned. 
2026-05-16 08:05:36,966 - optuna.study._optimize - INFO - Trial 216 pruned. 
2026-05-16 08:05:42,312 - experiment_functions - INFO - Early stopping at epoch 500. Best Recall: 0.0024
2026-05-16 08:05:42,463 - optuna.study.study - INFO - Trial 217 finished with value: 0.0024413438231647663 and parameters: {'n_layers': 1, 'embedding_dim': 256, 'lr': 0.0007082696587995759, 'lambda_val': 4.6539735088522726e-06, 'batch_size': 906, 'optimizer': 'SGD'}. Best is trial 96 with value: 0.1292701130387624.
2026-05-16 08:05:59,466 - experiment_functions - INFO - Early stopping at epoch 2050. Best Recall: 0.1241
2026-05-16 08:05:59,556 - optuna.study.study - INFO - Trial 218 finished with value: 0.1240608921587476 and parameters: {'n_layers': 1, 'embedding_dim': 256, 'lr': 0.0008442838500776507, 'lambda_val': 3.4584307310292014e-06, 'batch_size': 713, 'optimizer': 'Adam'}. Best is trial 96 with value: 0.1292701130387624.
2026-05-16 08:06:07,569 - optuna.study._optimize - INFO - Trial 219 pruned. 
2026-05-16 08:06:15,908 - optuna.study._optimize - INFO - Trial 220 pruned. 
2026-05-16 08:06:28,815 - optuna.study._optimize - INFO - Trial 221 pruned. 
2026-05-16 08:06:41,028 - experiment_functions - INFO - Early stopping at epoch 1650. Best Recall: 0.1246
2026-05-16 08:06:41,119 - optuna.study.study - INFO - Trial 222 finished with value: 0.12463972024239947 and parameters: {'n_layers': 1, 'embedding_dim': 256, 'lr': 0.0008140737526443195, 'lambda_val': 3.6830404650896833e-06, 'batch_size': 730, 'optimizer': 'Adam'}. Best is trial 96 with value: 0.1292701130387624.
2026-05-16 08:06:55,376 - experiment_functions - INFO - Early stopping at epoch 1850. Best Recall: 0.1280
2026-05-16 08:06:55,479 - optuna.study.study - INFO - Trial 223 finished with value: 0.1279642983279703 and parameters: {'n_layers': 1, 'embedding_dim': 256, 'lr': 0.0006762576071820714, 'lambda_val': 2.4197247412611205e-06, 'batch_size': 726, 'optimizer': 'Adam'}. Best is trial 96 with value: 0.1292701130387624.
2026-05-16 08:07:04,284 - optuna.study._optimize - INFO - Trial 224 pruned. 
2026-05-16 08:07:12,494 - experiment_functions - INFO - Early stopping at epoch 1150. Best Recall: 0.1195
2026-05-16 08:07:12,615 - optuna.study.study - INFO - Trial 225 finished with value: 0.11952779163930101 and parameters: {'n_layers': 1, 'embedding_dim': 256, 'lr': 0.0011209501543353437, 'lambda_val': 6.666059202836663e-06, 'batch_size': 751, 'optimizer': 'Adam'}. Best is trial 96 with value: 0.1292701130387624.
2026-05-16 08:07:26,044 - optuna.study._optimize - INFO - Trial 226 pruned. 
2026-05-16 08:07:35,240 - optuna.study._optimize - INFO - Trial 227 pruned. 
2026-05-16 08:07:42,993 - optuna.study._optimize - INFO - Trial 228 pruned. 
2026-05-16 08:07:50,693 - optuna.study._optimize - INFO - Trial 229 pruned. 
2026-05-16 08:07:59,965 - optuna.study._optimize - INFO - Trial 230 pruned. 
2026-05-16 08:08:25,039 - experiment_functions - INFO - Early stopping at epoch 3200. Best Recall: 0.1303
2026-05-16 08:08:27,251 - optuna.study.study - INFO - Trial 231 finished with value: 0.1303146734276208 and parameters: {'n_layers': 1, 'embedding_dim': 256, 'lr': 0.0006148893416616961, 'lambda_val': 2.31126647294671e-06, 'batch_size': 800, 'optimizer': 'Adam'}. Best is trial 231 with value: 0.1303146734276208.
2026-05-16 08:08:34,888 - experiment_functions - INFO - Early stopping at epoch 1050. Best Recall: 0.1188
2026-05-16 08:08:34,987 - optuna.study.study - INFO - Trial 232 finished with value: 0.11879241064196515 and parameters: {'n_layers': 1, 'embedding_dim': 256, 'lr': 0.0006485622509033627, 'lambda_val': 2.200451212835821e-06, 'batch_size': 2136, 'optimizer': 'Adam'}. Best is trial 231 with value: 0.1303146734276208.
2026-05-16 08:08:47,349 - experiment_functions - INFO - Early stopping at epoch 1650. Best Recall: 0.1288
2026-05-16 08:08:47,441 - optuna.study.study - INFO - Trial 233 finished with value: 0.12884795890908587 and parameters: {'n_layers': 1, 'embedding_dim': 256, 'lr': 0.0007350682313561985, 'lambda_val': 1.6609028482895898e-06, 'batch_size': 802, 'optimizer': 'Adam'}. Best is trial 231 with value: 0.1303146734276208.
2026-05-16 08:08:55,184 - optuna.study._optimize - INFO - Trial 234 pruned. 
2026-05-16 08:09:12,086 - optuna.study._optimize - INFO - Trial 235 pruned. 
2026-05-16 08:09:22,222 - optuna.study._optimize - INFO - Trial 236 pruned. 
2026-05-16 08:09:38,224 - experiment_functions - INFO - Early stopping at epoch 2200. Best Recall: 0.1313
2026-05-16 08:09:38,327 - optuna.study.study - INFO - Trial 237 finished with value: 0.1313271486628359 and parameters: {'n_layers': 1, 'embedding_dim': 256, 'lr': 0.000581111043852938, 'lambda_val': 3.1046552258619037e-06, 'batch_size': 721, 'optimizer': 'Adam'}. Best is trial 237 with value: 0.1313271486628359.
2026-05-16 08:09:47,243 - optuna.study._optimize - INFO - Trial 238 pruned. 
2026-05-16 08:09:59,468 - optuna.study._optimize - INFO - Trial 239 pruned. 
2026-05-16 08:10:06,643 - optuna.study._optimize - INFO - Trial 240 pruned. 
2026-05-16 08:10:19,514 - experiment_functions - INFO - Early stopping at epoch 1700. Best Recall: 0.1262
2026-05-16 08:10:19,614 - optuna.study.study - INFO - Trial 241 finished with value: 0.12624825406309761 and parameters: {'n_layers': 1, 'embedding_dim': 256, 'lr': 0.0007581378220005716, 'lambda_val': 2.739805576355348e-06, 'batch_size': 781, 'optimizer': 'Adam'}. Best is trial 237 with value: 0.1313271486628359.
2026-05-16 08:10:30,599 - optuna.study._optimize - INFO - Trial 242 pruned. 
2026-05-16 08:10:36,489 - experiment_functions - INFO - Early stopping at epoch 800. Best Recall: 0.1146
2026-05-16 08:10:36,625 - optuna.study.study - INFO - Trial 243 finished with value: 0.11456602250522688 and parameters: {'n_layers': 1, 'embedding_dim': 256, 'lr': 0.000941557758569827, 'lambda_val': 2.835286100905863e-06, 'batch_size': 2826, 'optimizer': 'Adam'}. Best is trial 237 with value: 0.1313271486628359.
2026-05-16 08:10:49,913 - experiment_functions - INFO - Early stopping at epoch 2050. Best Recall: 0.1294
2026-05-16 08:10:50,004 - optuna.study.study - INFO - Trial 244 finished with value: 0.12936047985000898 and parameters: {'n_layers': 1, 'embedding_dim': 256, 'lr': 0.0006792899838337897, 'lambda_val': 3.6541035854917137e-06, 'batch_size': 727, 'optimizer': 'Adam'}. Best is trial 237 with value: 0.1313271486628359.
2026-05-16 08:10:57,869 - optuna.study._optimize - INFO - Trial 245 pruned. 
2026-05-16 08:11:04,459 - optuna.study._optimize - INFO - Trial 246 pruned. 
2026-05-16 08:11:11,627 - optuna.study._optimize - INFO - Trial 247 pruned. 
2026-05-16 08:11:25,208 - experiment_functions - INFO - Early stopping at epoch 2000. Best Recall: 0.1348
2026-05-16 08:11:25,300 - optuna.study.study - INFO - Trial 248 finished with value: 0.13475058348840938 and parameters: {'n_layers': 1, 'embedding_dim': 256, 'lr': 0.0006617492520389148, 'lambda_val': 2.530736700643169e-06, 'batch_size': 947, 'optimizer': 'Adam'}. Best is trial 248 with value: 0.13475058348840938.
2026-05-16 08:11:37,389 - experiment_functions - INFO - Early stopping at epoch 1600. Best Recall: 0.1261
2026-05-16 08:11:37,490 - optuna.study.study - INFO - Trial 249 finished with value: 0.12613747763507577 and parameters: {'n_layers': 1, 'embedding_dim': 256, 'lr': 0.0007704049986140025, 'lambda_val': 2.586631724933775e-06, 'batch_size': 955, 'optimizer': 'Adam'}. Best is trial 248 with value: 0.13475058348840938.
2026-05-16 08:11:44,103 - optuna.study._optimize - INFO - Trial 250 pruned. 
2026-05-16 08:11:55,661 - experiment_functions - INFO - Early stopping at epoch 1450. Best Recall: 0.1232
2026-05-16 08:11:55,760 - optuna.study.study - INFO - Trial 251 finished with value: 0.12316016542749032 and parameters: {'n_layers': 1, 'embedding_dim': 256, 'lr': 0.000767479476476886, 'lambda_val': 2.750068751430899e-06, 'batch_size': 977, 'optimizer': 'Adam'}. Best is trial 248 with value: 0.13475058348840938.
2026-05-16 08:12:05,599 - optuna.study._optimize - INFO - Trial 252 pruned. 
2026-05-16 08:12:12,576 - optuna.study._optimize - INFO - Trial 253 pruned. 
2026-05-16 08:12:26,368 - experiment_functions - INFO - Early stopping at epoch 2000. Best Recall: 0.1304
2026-05-16 08:12:26,457 - optuna.study.study - INFO - Trial 254 finished with value: 0.13037003837220876 and parameters: {'n_layers': 1, 'embedding_dim': 256, 'lr': 0.0006319643947751596, 'lambda_val': 3.174173944573286e-06, 'batch_size': 871, 'optimizer': 'Adam'}. Best is trial 248 with value: 0.13475058348840938.
2026-05-16 08:12:36,386 - optuna.study._optimize - INFO - Trial 255 pruned. 
2026-05-16 08:12:40,204 - experiment_functions - INFO - Early stopping at epoch 500. Best Recall: 0.0019
2026-05-16 08:12:40,315 - optuna.study.study - INFO - Trial 256 finished with value: 0.0019024098049134773 and parameters: {'n_layers': 1, 'embedding_dim': 256, 'lr': 0.00042926666868026684, 'lambda_val': 2.1061955804100104e-06, 'batch_size': 1014, 'optimizer': 'SGD'}. Best is trial 248 with value: 0.13475058348840938.
2026-05-16 08:12:47,361 - optuna.study._optimize - INFO - Trial 257 pruned. 
2026-05-16 08:13:04,464 - experiment_functions - INFO - Early stopping at epoch 700. Best Recall: 0.0437
2026-05-16 08:13:04,574 - optuna.study.study - INFO - Trial 258 finished with value: 0.04369773347759323 and parameters: {'n_layers': 4, 'embedding_dim': 256, 'lr': 0.000699887290397775, 'lambda_val': 1.5787703005610152e-06, 'batch_size': 834, 'optimizer': 'Adam'}. Best is trial 248 with value: 0.13475058348840938.
2026-05-16 08:13:10,619 - optuna.study._optimize - INFO - Trial 259 pruned. 
2026-05-16 08:13:19,909 - optuna.study._optimize - INFO - Trial 260 pruned. 
2026-05-16 08:13:32,503 - experiment_functions - INFO - Early stopping at epoch 1600. Best Recall: 0.1235
2026-05-16 08:13:32,606 - optuna.study.study - INFO - Trial 261 finished with value: 0.12351354478804032 and parameters: {'n_layers': 1, 'embedding_dim': 256, 'lr': 0.0005329327433157818, 'lambda_val': 3.0894570192764905e-06, 'batch_size': 1099, 'optimizer': 'RMSprop'}. Best is trial 248 with value: 0.13475058348840938.
2026-05-16 08:13:42,293 - optuna.study._optimize - INFO - Trial 262 pruned. 
2026-05-16 08:13:49,200 - optuna.study._optimize - INFO - Trial 263 pruned. 
2026-05-16 08:13:57,603 - optuna.study._optimize - INFO - Trial 264 pruned. 
2026-05-16 08:14:05,847 - optuna.study._optimize - INFO - Trial 265 pruned. 
2026-05-16 08:14:13,372 - optuna.study._optimize - INFO - Trial 266 pruned. 
2026-05-16 08:14:20,497 - optuna.study._optimize - INFO - Trial 267 pruned. 
2026-05-16 08:14:27,890 - optuna.study._optimize - INFO - Trial 268 pruned. 
2026-05-16 08:14:35,087 - optuna.study._optimize - INFO - Trial 269 pruned. 
2026-05-16 08:14:42,740 - optuna.study._optimize - INFO - Trial 270 pruned. 
2026-05-16 08:14:59,309 - experiment_functions - INFO - Early stopping at epoch 2350. Best Recall: 0.1339
2026-05-16 08:14:59,399 - optuna.study.study - INFO - Trial 271 finished with value: 0.13391716416353316 and parameters: {'n_layers': 1, 'embedding_dim': 256, 'lr': 0.000616766991767466, 'lambda_val': 1.2474186125849515e-06, 'batch_size': 773, 'optimizer': 'Adam'}. Best is trial 248 with value: 0.13475058348840938.
2026-05-16 08:15:05,938 - optuna.study._optimize - INFO - Trial 272 pruned. 
2026-05-16 08:15:13,893 - optuna.study._optimize - INFO - Trial 273 pruned. 
2026-05-16 08:15:24,109 - optuna.study._optimize - INFO - Trial 274 pruned. 
2026-05-16 08:15:30,816 - optuna.study._optimize - INFO - Trial 275 pruned. 
2026-05-16 08:15:39,872 - experiment_functions - INFO - Early stopping at epoch 900. Best Recall: 0.0846
2026-05-16 08:15:39,971 - optuna.study.study - INFO - Trial 276 finished with value: 0.08457737202100475 and parameters: {'n_layers': 2, 'embedding_dim': 256, 'lr': 0.0009333299976369569, 'lambda_val': 2.025436429332447e-06, 'batch_size': 707, 'optimizer': 'Adam'}. Best is trial 248 with value: 0.13475058348840938.
2026-05-16 08:15:48,541 - optuna.study._optimize - INFO - Trial 277 pruned. 
2026-05-16 08:15:53,778 - experiment_functions - INFO - Early stopping at epoch 500. Best Recall: 0.0029
2026-05-16 08:15:53,880 - optuna.study.study - INFO - Trial 278 finished with value: 0.0029032455455378593 and parameters: {'n_layers': 1, 'embedding_dim': 256, 'lr': 0.0006723126209235655, 'lambda_val': 1.0894032799947945e-06, 'batch_size': 755, 'optimizer': 'SGD'}. Best is trial 248 with value: 0.13475058348840938.
2026-05-16 08:15:57,645 - experiment_functions - INFO - Early stopping at epoch 500. Best Recall: 0.0023
2026-05-16 08:15:57,746 - optuna.study.study - INFO - Trial 279 finished with value: 0.0023132819478054825 and parameters: {'n_layers': 1, 'embedding_dim': 256, 'lr': 1.0628210920148044e-05, 'lambda_val': 1.6499969811173111e-06, 'batch_size': 842, 'optimizer': 'Adam'}. Best is trial 248 with value: 0.13475058348840938.
2026-05-16 08:16:09,691 - experiment_functions - INFO - Early stopping at epoch 1600. Best Recall: 0.1233
2026-05-16 08:16:09,792 - optuna.study.study - INFO - Trial 280 finished with value: 0.1233292695640848 and parameters: {'n_layers': 1, 'embedding_dim': 256, 'lr': 0.0008519832928559183, 'lambda_val': 2.214850336383626e-06, 'batch_size': 661, 'optimizer': 'Adam'}. Best is trial 248 with value: 0.13475058348840938.
2026-05-16 08:16:16,502 - optuna.study._optimize - INFO - Trial 281 pruned. 
2026-05-16 08:16:24,985 - optuna.study._optimize - INFO - Trial 282 pruned. 
2026-05-16 08:16:29,769 - experiment_functions - INFO - Early stopping at epoch 600. Best Recall: 0.0642
2026-05-16 08:16:29,871 - optuna.study.study - INFO - Trial 283 finished with value: 0.06415522897993443 and parameters: {'n_layers': 1, 'embedding_dim': 256, 'lr': 0.001061020499145257, 'lambda_val': 0.00997097786176766, 'batch_size': 613, 'optimizer': 'RMSprop'}. Best is trial 248 with value: 0.13475058348840938.
2026-05-16 08:16:36,077 - optuna.study._optimize - INFO - Trial 284 pruned. 
2026-05-16 08:16:43,597 - optuna.study._optimize - INFO - Trial 285 pruned. 
2026-05-16 08:16:50,926 - optuna.study._optimize - INFO - Trial 286 pruned. 
2026-05-16 08:16:59,916 - optuna.study._optimize - INFO - Trial 287 pruned. 
2026-05-16 08:17:14,245 - experiment_functions - INFO - Early stopping at epoch 2250. Best Recall: 0.1289
2026-05-16 08:17:14,424 - optuna.study.study - INFO - Trial 288 finished with value: 0.12888348468492022 and parameters: {'n_layers': 1, 'embedding_dim': 256, 'lr': 0.0007141733235891402, 'lambda_val': 3.302292586534754e-06, 'batch_size': 780, 'optimizer': 'Adam'}. Best is trial 248 with value: 0.13475058348840938.
2026-05-16 08:17:22,647 - optuna.study._optimize - INFO - Trial 289 pruned. 
2026-05-16 08:17:29,019 - experiment_functions - INFO - Early stopping at epoch 700. Best Recall: 0.0656
2026-05-16 08:17:29,119 - optuna.study.study - INFO - Trial 290 finished with value: 0.06556775077057238 and parameters: {'n_layers': 3, 'embedding_dim': 256, 'lr': 0.000696988488635913, 'lambda_val': 1.7708285553485932e-06, 'batch_size': 797, 'optimizer': 'Adam'}. Best is trial 248 with value: 0.13475058348840938.
2026-05-16 08:17:44,446 - optuna.study._optimize - INFO - Trial 291 pruned. 
2026-05-16 08:18:05,644 - experiment_functions - INFO - Early stopping at epoch 3450. Best Recall: 0.1351
2026-05-16 08:18:05,738 - optuna.study.study - INFO - Trial 292 finished with value: 0.1351310345871218 and parameters: {'n_layers': 1, 'embedding_dim': 256, 'lr': 0.0005957318599957794, 'lambda_val': 5.309674317257067e-06, 'batch_size': 518, 'optimizer': 'Adam'}. Best is trial 292 with value: 0.1351310345871218.
2026-05-16 08:18:12,102 - optuna.study._optimize - INFO - Trial 293 pruned. 
2026-05-16 08:18:18,723 - optuna.study._optimize - INFO - Trial 294 pruned. 
2026-05-16 08:18:36,433 - optuna.study._optimize - INFO - Trial 295 pruned. 
2026-05-16 08:18:43,174 - optuna.study._optimize - INFO - Trial 296 pruned. 
2026-05-16 08:18:50,178 - optuna.study._optimize - INFO - Trial 297 pruned. 
2026-05-16 08:18:57,608 - optuna.study._optimize - INFO - Trial 298 pruned. 
2026-05-16 08:19:02,140 - experiment_functions - INFO - Early stopping at epoch 550. Best Recall: 0.0373
