2026-05-16 03:50:53,645 - optuna.study.study - INFO - Trial 244 finished with value: 0.13061624289185467 and parameters: {'n_layers': 1, 'embedding_dim': 256, 'lr': 0.0005320869752741008, 'lambda_val': 2.557363357627086e-06, 'batch_size': 1949, 'optimizer': 'Adam'}. Best is trial 232 with value: 0.13331929040634422.
2026-05-16 03:51:02,408 - experiment_functions - INFO - Early stopping at epoch 1450. Best Recall: 0.1244
2026-05-16 03:51:02,508 - optuna.study.study - INFO - Trial 245 finished with value: 0.1244203879831475 and parameters: {'n_layers': 1, 'embedding_dim': 256, 'lr': 0.0005220064614850842, 'lambda_val': 2.592136337642815e-06, 'batch_size': 2026, 'optimizer': 'Adam'}. Best is trial 232 with value: 0.13331929040634422.
2026-05-16 03:51:10,492 - optuna.study._optimize - INFO - Trial 246 pruned. 
2026-05-16 03:51:20,750 - optuna.study._optimize - INFO - Trial 247 pruned. 
2026-05-16 03:51:27,251 - optuna.study._optimize - INFO - Trial 248 pruned. 
2026-05-16 03:51:36,587 - experiment_functions - INFO - Early stopping at epoch 1450. Best Recall: 0.1179
2026-05-16 03:51:36,723 - optuna.study.study - INFO - Trial 249 finished with value: 0.11793304559051927 and parameters: {'n_layers': 1, 'embedding_dim': 256, 'lr': 0.0005197415276119499, 'lambda_val': 2.18009043569615e-06, 'batch_size': 1815, 'optimizer': 'Adam'}. Best is trial 232 with value: 0.13331929040634422.
2026-05-16 03:51:43,190 - optuna.study._optimize - INFO - Trial 250 pruned. 
2026-05-16 03:51:51,175 - optuna.study._optimize - INFO - Trial 251 pruned. 
2026-05-16 03:51:57,634 - optuna.study._optimize - INFO - Trial 252 pruned. 
2026-05-16 03:52:07,232 - experiment_functions - INFO - Early stopping at epoch 1450. Best Recall: 0.1259
2026-05-16 03:52:07,333 - optuna.study.study - INFO - Trial 253 finished with value: 0.1258663607755041 and parameters: {'n_layers': 1, 'embedding_dim': 256, 'lr': 0.0005595122319128292, 'lambda_val': 3.573423262602698e-06, 'batch_size': 1915, 'optimizer': 'Adam'}. Best is trial 232 with value: 0.13331929040634422.
2026-05-16 03:52:16,686 - experiment_functions - INFO - Early stopping at epoch 1450. Best Recall: 0.1221
2026-05-16 03:52:16,800 - optuna.study.study - INFO - Trial 254 finished with value: 0.12207269447035259 and parameters: {'n_layers': 1, 'embedding_dim': 256, 'lr': 0.0005432748191523547, 'lambda_val': 3.7894363405131116e-06, 'batch_size': 1889, 'optimizer': 'Adam'}. Best is trial 232 with value: 0.13331929040634422.
2026-05-16 03:52:23,378 - optuna.study._optimize - INFO - Trial 255 pruned. 
2026-05-16 03:52:36,192 - experiment_functions - INFO - Early stopping at epoch 2100. Best Recall: 0.1260
2026-05-16 03:52:36,291 - optuna.study.study - INFO - Trial 256 finished with value: 0.12603571636529692 and parameters: {'n_layers': 1, 'embedding_dim': 256, 'lr': 0.0004947757268892035, 'lambda_val': 3.5689950841306735e-06, 'batch_size': 1944, 'optimizer': 'Adam'}. Best is trial 232 with value: 0.13331929040634422.
2026-05-16 03:52:44,443 - optuna.study._optimize - INFO - Trial 257 pruned. 
2026-05-16 03:52:51,416 - optuna.study._optimize - INFO - Trial 258 pruned. 
2026-05-16 03:53:02,455 - optuna.study._optimize - INFO - Trial 259 pruned. 
2026-05-16 03:53:08,469 - optuna.study._optimize - INFO - Trial 260 pruned. 
2026-05-16 03:53:12,093 - experiment_functions - INFO - Early stopping at epoch 500. Best Recall: 0.0017
2026-05-16 03:53:12,181 - optuna.study.study - INFO - Trial 261 finished with value: 0.0017311187445121046 and parameters: {'n_layers': 1, 'embedding_dim': 256, 'lr': 0.00038358529549903494, 'lambda_val': 5.117128424539067e-06, 'batch_size': 1957, 'optimizer': 'SGD'}. Best is trial 232 with value: 0.13331929040634422.
2026-05-16 03:53:20,307 - experiment_functions - INFO - Early stopping at epoch 1150. Best Recall: 0.1265
2026-05-16 03:53:20,396 - optuna.study.study - INFO - Trial 262 finished with value: 0.12649917676778424 and parameters: {'n_layers': 1, 'embedding_dim': 256, 'lr': 0.0006180089957778864, 'lambda_val': 3.5873736029556115e-06, 'batch_size': 1561, 'optimizer': 'Adam'}. Best is trial 232 with value: 0.13331929040634422.
2026-05-16 03:53:26,069 - optuna.study._optimize - INFO - Trial 263 pruned. 
2026-05-16 03:53:32,558 - optuna.study._optimize - INFO - Trial 264 pruned. 
2026-05-16 03:53:39,749 - optuna.study._optimize - INFO - Trial 265 pruned. 
2026-05-16 03:53:46,295 - optuna.study._optimize - INFO - Trial 266 pruned. 
2026-05-16 03:53:52,426 - experiment_functions - INFO - Early stopping at epoch 850. Best Recall: 0.1123
2026-05-16 03:53:52,507 - optuna.study.study - INFO - Trial 267 finished with value: 0.11227055532668642 and parameters: {'n_layers': 1, 'embedding_dim': 256, 'lr': 0.001072812515958037, 'lambda_val': 2.4982633288971106e-06, 'batch_size': 1549, 'optimizer': 'Adam'}. Best is trial 232 with value: 0.13331929040634422.
2026-05-16 03:54:03,061 - experiment_functions - INFO - Early stopping at epoch 1700. Best Recall: 0.1306
2026-05-16 03:54:03,139 - optuna.study.study - INFO - Trial 268 finished with value: 0.13056424428893668 and parameters: {'n_layers': 1, 'embedding_dim': 256, 'lr': 0.0004896320298769294, 'lambda_val': 1.380507462956241e-06, 'batch_size': 1843, 'optimizer': 'Adam'}. Best is trial 232 with value: 0.13331929040634422.
2026-05-16 03:54:12,273 - optuna.study._optimize - INFO - Trial 269 pruned. 
2026-05-16 03:54:19,401 - optuna.study._optimize - INFO - Trial 270 pruned. 
2026-05-16 03:54:26,162 - optuna.study._optimize - INFO - Trial 271 pruned. 
2026-05-16 03:54:33,454 - optuna.study._optimize - INFO - Trial 272 pruned. 
2026-05-16 03:54:39,858 - optuna.study._optimize - INFO - Trial 273 pruned. 
2026-05-16 03:54:46,403 - optuna.study._optimize - INFO - Trial 274 pruned. 
2026-05-16 03:54:53,361 - optuna.study._optimize - INFO - Trial 275 pruned. 
2026-05-16 03:55:02,077 - optuna.study._optimize - INFO - Trial 276 pruned. 
2026-05-16 03:55:08,459 - optuna.study._optimize - INFO - Trial 277 pruned. 
2026-05-16 03:55:19,279 - optuna.study._optimize - INFO - Trial 278 pruned. 
2026-05-16 03:55:26,052 - optuna.study._optimize - INFO - Trial 279 pruned. 
2026-05-16 03:55:32,853 - optuna.study._optimize - INFO - Trial 280 pruned. 
2026-05-16 03:55:36,510 - experiment_functions - INFO - Early stopping at epoch 500. Best Recall: 0.0021
2026-05-16 03:55:36,601 - optuna.study.study - INFO - Trial 281 finished with value: 0.0020683348180336163 and parameters: {'n_layers': 1, 'embedding_dim': 256, 'lr': 0.0004978238792844285, 'lambda_val': 1.6700151371553595e-06, 'batch_size': 2063, 'optimizer': 'SGD'}. Best is trial 232 with value: 0.13331929040634422.
2026-05-16 03:55:41,896 - experiment_functions - INFO - Early stopping at epoch 800. Best Recall: 0.0399
2026-05-16 03:55:42,042 - optuna.study.study - INFO - Trial 282 finished with value: 0.03987553771661049 and parameters: {'n_layers': 1, 'embedding_dim': 256, 'lr': 0.0006436501648824957, 'lambda_val': 0.04246892298830112, 'batch_size': 1599, 'optimizer': 'Adam'}. Best is trial 232 with value: 0.13331929040634422.
2026-05-16 03:55:48,747 - optuna.study._optimize - INFO - Trial 283 pruned. 
2026-05-16 03:55:55,439 - optuna.study._optimize - INFO - Trial 284 pruned. 
2026-05-16 03:56:04,325 - experiment_functions - INFO - Early stopping at epoch 1350. Best Recall: 0.1200
2026-05-16 03:56:04,415 - optuna.study.study - INFO - Trial 285 finished with value: 0.11995834449121148 and parameters: {'n_layers': 1, 'embedding_dim': 256, 'lr': 0.00044343705682452884, 'lambda_val': 1.3448276810702344e-06, 'batch_size': 3602, 'optimizer': 'Adam'}. Best is trial 232 with value: 0.13331929040634422.
2026-05-16 03:56:16,835 - experiment_functions - INFO - Early stopping at epoch 1800. Best Recall: 0.1377
2026-05-16 03:56:16,928 - optuna.study.study - INFO - Trial 286 finished with value: 0.1377312731480455 and parameters: {'n_layers': 1, 'embedding_dim': 256, 'lr': 0.0007098378587192096, 'lambda_val': 5.569107039541386e-06, 'batch_size': 777, 'optimizer': 'Adam'}. Best is trial 286 with value: 0.1377312731480455.
2026-05-16 03:56:23,322 - experiment_functions - INFO - Early stopping at epoch 950. Best Recall: 0.1162
2026-05-16 03:56:23,421 - optuna.study.study - INFO - Trial 287 finished with value: 0.11619778733077672 and parameters: {'n_layers': 1, 'embedding_dim': 256, 'lr': 0.0009061293763909431, 'lambda_val': 4.72809958743451e-06, 'batch_size': 2296, 'optimizer': 'Adam'}. Best is trial 286 with value: 0.1377312731480455.
2026-05-16 03:56:38,007 - experiment_functions - INFO - Early stopping at epoch 2700. Best Recall: 0.1280
2026-05-16 03:56:38,086 - optuna.study.study - INFO - Trial 288 finished with value: 0.12803826299095106 and parameters: {'n_layers': 1, 'embedding_dim': 64, 'lr': 0.0007131328034966725, 'lambda_val': 2.4923950295839967e-06, 'batch_size': 760, 'optimizer': 'Adam'}. Best is trial 286 with value: 0.1377312731480455.
2026-05-16 03:56:47,460 - experiment_functions - INFO - Early stopping at epoch 1200. Best Recall: 0.1204
2026-05-16 03:56:47,550 - optuna.study.study - INFO - Trial 289 finished with value: 0.12037335282672679 and parameters: {'n_layers': 1, 'embedding_dim': 256, 'lr': 0.00104680270590796, 'lambda_val': 2.5367885257095296e-06, 'batch_size': 1031, 'optimizer': 'Adam'}. Best is trial 286 with value: 0.1377312731480455.
2026-05-16 03:56:53,041 - optuna.study._optimize - INFO - Trial 290 pruned. 
2026-05-16 03:56:59,121 - optuna.study._optimize - INFO - Trial 291 pruned. 
2026-05-16 03:57:06,167 - optuna.study._optimize - INFO - Trial 292 pruned. 
2026-05-16 03:57:12,087 - optuna.study._optimize - INFO - Trial 293 pruned. 
2026-05-16 03:57:17,937 - optuna.study._optimize - INFO - Trial 294 pruned. 
2026-05-16 03:57:24,165 - optuna.study._optimize - INFO - Trial 295 pruned. 
2026-05-16 03:57:30,370 - experiment_functions - INFO - Early stopping at epoch 900. Best Recall: 0.1202
2026-05-16 03:57:30,471 - optuna.study.study - INFO - Trial 296 finished with value: 0.12020856056046689 and parameters: {'n_layers': 1, 'embedding_dim': 256, 'lr': 0.0009355565937939576, 'lambda_val': 5.639871194389793e-06, 'batch_size': 3673, 'optimizer': 'Adam'}. Best is trial 286 with value: 0.1377312731480455.
2026-05-16 03:57:38,519 - experiment_functions - INFO - Early stopping at epoch 750. Best Recall: 0.0644
2026-05-16 03:57:38,620 - optuna.study.study - INFO - Trial 297 finished with value: 0.06441425137175597 and parameters: {'n_layers': 3, 'embedding_dim': 256, 'lr': 0.0006203228409037838, 'lambda_val': 2.3482409143838417e-06, 'batch_size': 2028, 'optimizer': 'Adam'}. Best is trial 286 with value: 0.1377312731480455.
2026-05-16 03:57:49,144 - experiment_functions - INFO - Early stopping at epoch 1600. Best Recall: 0.1204
2026-05-16 03:57:49,254 - optuna.study.study - INFO - Trial 298 finished with value: 0.12035212183253459 and parameters: {'n_layers': 1, 'embedding_dim': 256, 'lr': 0.0007154800552710475, 'lambda_val': 1.8322500813832092e-06, 'batch_size': 1781, 'optimizer': 'Adam'}. Best is trial 286 with value: 0.1377312731480455.
2026-05-16 03:57:58,029 - optuna.study._optimize - INFO - Trial 299 pruned. 
2026-05-16 03:58:04,400 - experiment_functions - INFO - Early stopping at epoch 1750. Best Recall: 0.1244
2026-05-16 03:58:04,512 - root - INFO -   **** Training e_100K_1c2dcs_rand4
2026-05-16 03:58:04,525 - root - INFO -   **** Getting 67885/81200 random edges
2026-05-16 03:58:04,637 - optuna.storages._rdb.storage - INFO - A new study created in RDB with name: Study_e_100K_1c2dcs_rand4
2026-05-16 03:58:26,468 - experiment_functions - INFO - Early stopping at epoch 3600. Best Recall: 0.0095
2026-05-16 03:58:26,576 - optuna.study.study - INFO - Trial 0 finished with value: 0.009461863504070344 and parameters: {'n_layers': 4, 'embedding_dim': 32, 'lr': 6.716065804525461e-05, 'lambda_val': 0.004045122710519638, 'batch_size': 2175, 'optimizer': 'RMSprop'}. Best is trial 0 with value: 0.009461863504070344.
2026-05-16 03:58:46,137 - experiment_functions - INFO - Early stopping at epoch 1750. Best Recall: 0.0846
2026-05-16 03:58:47,327 - optuna.study.study - INFO - Trial 1 finished with value: 0.08464998568496254 and parameters: {'n_layers': 2, 'embedding_dim': 128, 'lr': 0.00031711396610845983, 'lambda_val': 2.0738459712568367e-05, 'batch_size': 1180, 'optimizer': 'RMSprop'}. Best is trial 1 with value: 0.08464998568496254.
2026-05-16 03:58:53,401 - experiment_functions - INFO - Early stopping at epoch 500. Best Recall: 0.0023
2026-05-16 03:58:53,490 - optuna.study.study - INFO - Trial 2 finished with value: 0.0022795537028195588 and parameters: {'n_layers': 1, 'embedding_dim': 256, 'lr': 0.00024235667105788937, 'lambda_val': 0.04725079554349389, 'batch_size': 3731, 'optimizer': 'SGD'}. Best is trial 1 with value: 0.08464998568496254.
2026-05-16 03:58:59,624 - experiment_functions - INFO - Early stopping at epoch 950. Best Recall: 0.0080
2026-05-16 03:58:59,725 - optuna.study.study - INFO - Trial 3 finished with value: 0.00802231885689736 and parameters: {'n_layers': 3, 'embedding_dim': 32, 'lr': 0.04531271990575994, 'lambda_val': 0.05025942316775025, 'batch_size': 3047, 'optimizer': 'RMSprop'}. Best is trial 1 with value: 0.08464998568496254.
2026-05-16 03:59:07,922 - experiment_functions - INFO - Early stopping at epoch 1150. Best Recall: 0.0235
2026-05-16 03:59:08,019 - optuna.study.study - INFO - Trial 4 finished with value: 0.023470739998574186 and parameters: {'n_layers': 3, 'embedding_dim': 96, 'lr': 0.026567198003944376, 'lambda_val': 0.0034810230065828772, 'batch_size': 3688, 'optimizer': 'RMSprop'}. Best is trial 1 with value: 0.08464998568496254.
2026-05-16 03:59:15,917 - optuna.study._optimize - INFO - Trial 5 pruned. 
2026-05-16 03:59:19,950 - experiment_functions - INFO - Early stopping at epoch 550. Best Recall: 0.0352
2026-05-16 03:59:20,041 - optuna.study.study - INFO - Trial 6 finished with value: 0.03521299066109233 and parameters: {'n_layers': 3, 'embedding_dim': 128, 'lr': 0.00526848324948071, 'lambda_val': 0.0005481521128425066, 'batch_size': 1114, 'optimizer': 'RMSprop'}. Best is trial 1 with value: 0.08464998568496254.
2026-05-16 03:59:23,803 - experiment_functions - INFO - Early stopping at epoch 550. Best Recall: 0.0229
2026-05-16 03:59:23,891 - optuna.study.study - INFO - Trial 7 finished with value: 0.022899626717007814 and parameters: {'n_layers': 1, 'embedding_dim': 128, 'lr': 0.0797335463591642, 'lambda_val': 0.00014729988886271093, 'batch_size': 1959, 'optimizer': 'Adam'}. Best is trial 1 with value: 0.08464998568496254.
2026-05-16 03:59:33,475 - experiment_functions - INFO - Early stopping at epoch 1300. Best Recall: 0.0485
2026-05-16 03:59:33,565 - optuna.study.study - INFO - Trial 8 finished with value: 0.04851860152324141 and parameters: {'n_layers': 3, 'embedding_dim': 128, 'lr': 0.00037671269792013533, 'lambda_val': 0.00012393791021687162, 'batch_size': 4034, 'optimizer': 'Adam'}. Best is trial 1 with value: 0.08464998568496254.
2026-05-16 03:59:39,511 - optuna.study._optimize - INFO - Trial 9 pruned. 
2026-05-16 03:59:42,963 - experiment_functions - INFO - Early stopping at epoch 500. Best Recall: 0.0026
2026-05-16 03:59:43,064 - optuna.study.study - INFO - Trial 10 finished with value: 0.0025631229816082753 and parameters: {'n_layers': 2, 'embedding_dim': 64, 'lr': 2.4140235473282948e-05, 'lambda_val': 2.840780451637651e-06, 'batch_size': 515, 'optimizer': 'SGD'}. Best is trial 1 with value: 0.08464998568496254.
2026-05-16 03:59:48,110 - experiment_functions - INFO - Early stopping at epoch 650. Best Recall: 0.0680
2026-05-16 03:59:48,210 - optuna.study.study - INFO - Trial 11 finished with value: 0.06801062817103869 and parameters: {'n_layers': 2, 'embedding_dim': 128, 'lr': 0.0016111205461785227, 'lambda_val': 1.237772040682735e-05, 'batch_size': 2853, 'optimizer': 'Adam'}. Best is trial 1 with value: 0.08464998568496254.
2026-05-16 03:59:52,642 - experiment_functions - INFO - Early stopping at epoch 600. Best Recall: 0.0625
2026-05-16 03:59:52,796 - optuna.study.study - INFO - Trial 12 finished with value: 0.06252493112838023 and parameters: {'n_layers': 2, 'embedding_dim': 128, 'lr': 0.0020308498456093325, 'lambda_val': 6.6242871436415435e-06, 'batch_size': 3026, 'optimizer': 'Adam'}. Best is trial 1 with value: 0.08464998568496254.
2026-05-16 03:59:57,082 - experiment_functions - INFO - Early stopping at epoch 600. Best Recall: 0.0593
2026-05-16 03:59:57,184 - optuna.study.study - INFO - Trial 13 finished with value: 0.05934245891569422 and parameters: {'n_layers': 2, 'embedding_dim': 128, 'lr': 0.0018549469253126248, 'lambda_val': 2.8882799588280433e-05, 'batch_size': 2900, 'optimizer': 'Adam'}. Best is trial 1 with value: 0.08464998568496254.
2026-05-16 04:00:00,806 - experiment_functions - INFO - Early stopping at epoch 550. Best Recall: 0.0470
2026-05-16 04:00:01,149 - optuna.study.study - INFO - Trial 14 finished with value: 0.04696213134665609 and parameters: {'n_layers': 2, 'embedding_dim': 96, 'lr': 0.006910741793346876, 'lambda_val': 1.0710231223098449e-06, 'batch_size': 1100, 'optimizer': 'Adam'}. Best is trial 1 with value: 0.08464998568496254.
2026-05-16 04:00:05,172 - experiment_functions - INFO - Early stopping at epoch 500. Best Recall: 0.0024
2026-05-16 04:00:05,272 - optuna.study.study - INFO - Trial 15 finished with value: 0.002360889713071063 and parameters: {'n_layers': 4, 'embedding_dim': 64, 'lr': 0.0007237721342055676, 'lambda_val': 1.5847720756750913e-05, 'batch_size': 2682, 'optimizer': 'SGD'}. Best is trial 1 with value: 0.08464998568496254.
2026-05-16 04:00:11,748 - optuna.study._optimize - INFO - Trial 16 pruned. 
2026-05-16 04:00:15,411 - experiment_functions - INFO - Early stopping at epoch 550. Best Recall: 0.0708
2026-05-16 04:00:15,520 - optuna.study.study - INFO - Trial 17 finished with value: 0.07080774649365633 and parameters: {'n_layers': 1, 'embedding_dim': 128, 'lr': 0.006407385298622873, 'lambda_val': 6.171533899865166e-06, 'batch_size': 562, 'optimizer': 'Adam'}. Best is trial 1 with value: 0.08464998568496254.
2026-05-16 04:00:21,294 - experiment_functions - INFO - Early stopping at epoch 850. Best Recall: 0.0575
2026-05-16 04:00:21,385 - optuna.study.study - INFO - Trial 18 finished with value: 0.057489163360488024 and parameters: {'n_layers': 1, 'embedding_dim': 128, 'lr': 0.006354784452798529, 'lambda_val': 2.799432290740248e-06, 'batch_size': 691, 'optimizer': 'RMSprop'}. Best is trial 1 with value: 0.08464998568496254.
2026-05-16 04:00:24,467 - experiment_functions - INFO - Early stopping at epoch 500. Best Recall: 0.0010
2026-05-16 04:00:24,567 - optuna.study.study - INFO - Trial 19 finished with value: 0.0010467559336710941 and parameters: {'n_layers': 1, 'embedding_dim': 64, 'lr': 7.665501165407468e-05, 'lambda_val': 0.0005167259833150584, 'batch_size': 1021, 'optimizer': 'SGD'}. Best is trial 1 with value: 0.08464998568496254.
2026-05-16 04:00:40,221 - experiment_functions - INFO - Early stopping at epoch 2700. Best Recall: 0.0545
2026-05-16 04:00:40,312 - optuna.study.study - INFO - Trial 20 finished with value: 0.05451031159653719 and parameters: {'n_layers': 1, 'embedding_dim': 256, 'lr': 0.01296756401594671, 'lambda_val': 7.791768955822452e-05, 'batch_size': 1374, 'optimizer': 'RMSprop'}. Best is trial 1 with value: 0.08464998568496254.
2026-05-16 04:00:44,907 - experiment_functions - INFO - Early stopping at epoch 650. Best Recall: 0.0736
2026-05-16 04:00:45,007 - optuna.study.study - INFO - Trial 21 finished with value: 0.07361541068493453 and parameters: {'n_layers': 2, 'embedding_dim': 128, 'lr': 0.0012456008280676196, 'lambda_val': 1.1740350176799285e-05, 'batch_size': 789, 'optimizer': 'Adam'}. Best is trial 1 with value: 0.08464998568496254.
2026-05-16 04:00:51,539 - experiment_functions - INFO - Early stopping at epoch 1000. Best Recall: 0.0847
2026-05-16 04:00:51,640 - optuna.study.study - INFO - Trial 22 finished with value: 0.08469801185213185 and parameters: {'n_layers': 2, 'embedding_dim': 128, 'lr': 0.0006617010404096648, 'lambda_val': 3.8726542622813146e-06, 'batch_size': 769, 'optimizer': 'Adam'}. Best is trial 22 with value: 0.08469801185213185.
2026-05-16 04:00:57,693 - experiment_functions - INFO - Early stopping at epoch 800. Best Recall: 0.0829
2026-05-16 04:00:57,812 - optuna.study.study - INFO - Trial 23 finished with value: 0.08293326247079279 and parameters: {'n_layers': 2, 'embedding_dim': 128, 'lr': 0.0007838089590463637, 'lambda_val': 1.0259032688900398e-06, 'batch_size': 916, 'optimizer': 'Adam'}. Best is trial 22 with value: 0.08469801185213185.
2026-05-16 04:01:03,632 - experiment_functions - INFO - Early stopping at epoch 900. Best Recall: 0.0724
2026-05-16 04:01:03,711 - optuna.study.study - INFO - Trial 24 finished with value: 0.07236673370507064 and parameters: {'n_layers': 2, 'embedding_dim': 128, 'lr': 0.0006507983972308415, 'lambda_val': 1.085179670302176e-06, 'batch_size': 1381, 'optimizer': 'Adam'}. Best is trial 22 with value: 0.08469801185213185.
2026-05-16 04:01:09,825 - optuna.study._optimize - INFO - Trial 25 pruned. 
2026-05-16 04:01:17,825 - experiment_functions - INFO - Early stopping at epoch 1100. Best Recall: 0.0469
2026-05-16 04:01:17,925 - optuna.study.study - INFO - Trial 26 finished with value: 0.046911207800364174 and parameters: {'n_layers': 3, 'embedding_dim': 128, 'lr': 0.00041047179149096406, 'lambda_val': 4.673737409660335e-06, 'batch_size': 1818, 'optimizer': 'Adam'}. Best is trial 22 with value: 0.08469801185213185.
2026-05-16 04:01:22,270 - experiment_functions - INFO - Early stopping at epoch 600. Best Recall: 0.0631
