2026-05-16 05:20:13,494 - optuna.study.study - INFO - Trial 0 finished with value: 0.0029262067307789185 and parameters: {'n_layers': 4, 'embedding_dim': 32, 'lr': 6.972371827637997e-05, 'lambda_val': 0.0014315107632881705, 'batch_size': 3129, 'optimizer': 'SGD'}. Best is trial 0 with value: 0.0029262067307789185.
2026-05-16 05:20:28,759 - experiment_functions - INFO - Early stopping at epoch 2700. Best Recall: 0.0220
2026-05-16 05:20:28,960 - optuna.study.study - INFO - Trial 1 finished with value: 0.021967240598872742 and parameters: {'n_layers': 1, 'embedding_dim': 96, 'lr': 0.00014499191772270558, 'lambda_val': 1.8027070281645533e-06, 'batch_size': 1078, 'optimizer': 'RMSprop'}. Best is trial 1 with value: 0.021967240598872742.
2026-05-16 05:20:42,287 - experiment_functions - INFO - Early stopping at epoch 500. Best Recall: 0.0073
2026-05-16 05:20:42,434 - optuna.study.study - INFO - Trial 2 finished with value: 0.007260121428170406 and parameters: {'n_layers': 3, 'embedding_dim': 32, 'lr': 0.07962342254616717, 'lambda_val': 6.604373432342384e-05, 'batch_size': 2407, 'optimizer': 'RMSprop'}. Best is trial 1 with value: 0.021967240598872742.
2026-05-16 05:20:46,915 - experiment_functions - INFO - Early stopping at epoch 500. Best Recall: 0.0026
2026-05-16 05:20:47,017 - optuna.study.study - INFO - Trial 3 finished with value: 0.0026488734712690034 and parameters: {'n_layers': 4, 'embedding_dim': 256, 'lr': 2.9596744107127805e-05, 'lambda_val': 1.1749182569998111e-05, 'batch_size': 3851, 'optimizer': 'SGD'}. Best is trial 1 with value: 0.021967240598872742.
2026-05-16 05:20:51,009 - experiment_functions - INFO - Early stopping at epoch 650. Best Recall: 0.0036
2026-05-16 05:20:51,099 - optuna.study.study - INFO - Trial 4 finished with value: 0.0036231209461923598 and parameters: {'n_layers': 3, 'embedding_dim': 64, 'lr': 7.816342876088826e-05, 'lambda_val': 0.004753809157537051, 'batch_size': 1070, 'optimizer': 'Adam'}. Best is trial 1 with value: 0.021967240598872742.
2026-05-16 05:20:57,034 - optuna.study._optimize - INFO - Trial 5 pruned. 
2026-05-16 05:21:03,245 - optuna.study._optimize - INFO - Trial 6 pruned. 
2026-05-16 05:21:06,667 - experiment_functions - INFO - Early stopping at epoch 500. Best Recall: 0.0026
2026-05-16 05:21:06,802 - optuna.study.study - INFO - Trial 7 finished with value: 0.0025854107337515246 and parameters: {'n_layers': 3, 'embedding_dim': 96, 'lr': 0.04211479801204114, 'lambda_val': 0.000859408837853243, 'batch_size': 1551, 'optimizer': 'Adam'}. Best is trial 1 with value: 0.021967240598872742.
2026-05-16 05:21:12,339 - experiment_functions - INFO - Early stopping at epoch 800. Best Recall: 0.0061
2026-05-16 05:21:12,419 - optuna.study.study - INFO - Trial 8 finished with value: 0.006098453636820128 and parameters: {'n_layers': 4, 'embedding_dim': 128, 'lr': 0.0003432518504330979, 'lambda_val': 0.0023737218721792074, 'batch_size': 3897, 'optimizer': 'Adam'}. Best is trial 1 with value: 0.021967240598872742.
2026-05-16 05:21:29,759 - experiment_functions - INFO - Early stopping at epoch 650. Best Recall: 0.0093
2026-05-16 05:21:29,850 - optuna.study.study - INFO - Trial 9 finished with value: 0.009340721422999977 and parameters: {'n_layers': 3, 'embedding_dim': 256, 'lr': 0.0004443046286446304, 'lambda_val': 5.8035031465036125e-06, 'batch_size': 3593, 'optimizer': 'Adam'}. Best is trial 1 with value: 0.021967240598872742.
2026-05-16 05:21:32,811 - experiment_functions - INFO - Early stopping at epoch 500. Best Recall: 0.0036
2026-05-16 05:21:32,903 - optuna.study.study - INFO - Trial 10 finished with value: 0.0036296094100516586 and parameters: {'n_layers': 1, 'embedding_dim': 96, 'lr': 0.004972226602912647, 'lambda_val': 0.0940978411002032, 'batch_size': 541, 'optimizer': 'RMSprop'}. Best is trial 1 with value: 0.021967240598872742.
2026-05-16 05:21:36,685 - experiment_functions - INFO - Early stopping at epoch 600. Best Recall: 0.0194
2026-05-16 05:21:36,776 - optuna.study.study - INFO - Trial 11 finished with value: 0.019416355450065887 and parameters: {'n_layers': 1, 'embedding_dim': 256, 'lr': 0.0008060496461336771, 'lambda_val': 1.5681783666566656e-06, 'batch_size': 3006, 'optimizer': 'RMSprop'}. Best is trial 1 with value: 0.021967240598872742.
2026-05-16 05:21:40,455 - experiment_functions - INFO - Early stopping at epoch 550. Best Recall: 0.0147
2026-05-16 05:21:40,556 - optuna.study.study - INFO - Trial 12 finished with value: 0.01471984578074407 and parameters: {'n_layers': 1, 'embedding_dim': 256, 'lr': 0.0016217503810205534, 'lambda_val': 1.082352735788572e-06, 'batch_size': 2677, 'optimizer': 'RMSprop'}. Best is trial 1 with value: 0.021967240598872742.
2026-05-16 05:21:44,318 - experiment_functions - INFO - Early stopping at epoch 550. Best Recall: 0.0093
2026-05-16 05:21:44,485 - optuna.study.study - INFO - Trial 13 finished with value: 0.009277101626428605 and parameters: {'n_layers': 1, 'embedding_dim': 96, 'lr': 0.004639750490843319, 'lambda_val': 1.197258671587235e-06, 'batch_size': 1704, 'optimizer': 'RMSprop'}. Best is trial 1 with value: 0.021967240598872742.
2026-05-16 05:21:50,236 - optuna.study._optimize - INFO - Trial 14 pruned. 
2026-05-16 05:21:56,073 - optuna.study._optimize - INFO - Trial 15 pruned. 
2026-05-16 05:21:59,992 - experiment_functions - INFO - Early stopping at epoch 550. Best Recall: 0.0228
2026-05-16 05:22:00,097 - optuna.study.study - INFO - Trial 16 finished with value: 0.022843936127358803 and parameters: {'n_layers': 1, 'embedding_dim': 96, 'lr': 0.0011109433670162942, 'lambda_val': 8.839647428272345e-05, 'batch_size': 1197, 'optimizer': 'RMSprop'}. Best is trial 16 with value: 0.022843936127358803.
2026-05-16 05:22:03,262 - experiment_functions - INFO - Early stopping at epoch 500. Best Recall: 0.0023
2026-05-16 05:22:03,362 - optuna.study.study - INFO - Trial 17 finished with value: 0.0022617044755727247 and parameters: {'n_layers': 2, 'embedding_dim': 96, 'lr': 0.0028229281225173827, 'lambda_val': 5.264836059654445e-05, 'batch_size': 1114, 'optimizer': 'SGD'}. Best is trial 16 with value: 0.022843936127358803.
2026-05-16 05:22:08,640 - optuna.study._optimize - INFO - Trial 18 pruned. 
2026-05-16 05:22:14,274 - optuna.study._optimize - INFO - Trial 19 pruned. 
2026-05-16 05:22:17,500 - experiment_functions - INFO - Early stopping at epoch 550. Best Recall: 0.0069
2026-05-16 05:22:17,601 - optuna.study.study - INFO - Trial 20 finished with value: 0.006944625802558916 and parameters: {'n_layers': 2, 'embedding_dim': 96, 'lr': 0.0010733844971588526, 'lambda_val': 0.008757117499888011, 'batch_size': 753, 'optimizer': 'RMSprop'}. Best is trial 16 with value: 0.022843936127358803.
2026-05-16 05:22:21,467 - experiment_functions - INFO - Early stopping at epoch 600. Best Recall: 0.0195
2026-05-16 05:22:21,568 - optuna.study.study - INFO - Trial 21 finished with value: 0.019485745507566696 and parameters: {'n_layers': 1, 'embedding_dim': 256, 'lr': 0.0006675367314431057, 'lambda_val': 2.871923479472429e-06, 'batch_size': 2616, 'optimizer': 'RMSprop'}. Best is trial 16 with value: 0.022843936127358803.
2026-05-16 05:22:27,982 - experiment_functions - INFO - Early stopping at epoch 1150. Best Recall: 0.0201
2026-05-16 05:22:28,098 - optuna.study.study - INFO - Trial 22 finished with value: 0.020107972351666625 and parameters: {'n_layers': 1, 'embedding_dim': 96, 'lr': 0.0004995125853790036, 'lambda_val': 1.7030856898364238e-05, 'batch_size': 2432, 'optimizer': 'RMSprop'}. Best is trial 16 with value: 0.022843936127358803.
2026-05-16 05:22:48,025 - optuna.study.study - INFO - Trial 23 finished with value: 0.028677848234730227 and parameters: {'n_layers': 1, 'embedding_dim': 96, 'lr': 0.00017572572653617297, 'lambda_val': 1.789893857282705e-05, 'batch_size': 1376, 'optimizer': 'RMSprop'}. Best is trial 23 with value: 0.028677848234730227.
2026-05-16 05:22:55,199 - optuna.study._optimize - INFO - Trial 24 pruned. 
2026-05-16 05:22:58,199 - experiment_functions - INFO - Early stopping at epoch 500. Best Recall: 0.0021
2026-05-16 05:22:58,290 - optuna.study.study - INFO - Trial 25 finished with value: 0.0021207904669753113 and parameters: {'n_layers': 1, 'embedding_dim': 96, 'lr': 0.00013832286813660784, 'lambda_val': 2.161783119392645e-05, 'batch_size': 1057, 'optimizer': 'SGD'}. Best is trial 23 with value: 0.028677848234730227.
2026-05-16 05:23:01,697 - experiment_functions - INFO - Early stopping at epoch 500. Best Recall: 0.0028
2026-05-16 05:23:01,788 - optuna.study.study - INFO - Trial 26 finished with value: 0.002812801820734506 and parameters: {'n_layers': 1, 'embedding_dim': 32, 'lr': 1.081273617165931e-05, 'lambda_val': 5.599715962312187e-06, 'batch_size': 1219, 'optimizer': 'RMSprop'}. Best is trial 23 with value: 0.028677848234730227.
2026-05-16 05:23:05,286 - experiment_functions - INFO - Early stopping at epoch 550. Best Recall: 0.0063
2026-05-16 05:23:05,432 - optuna.study.study - INFO - Trial 27 finished with value: 0.006275487490244423 and parameters: {'n_layers': 2, 'embedding_dim': 96, 'lr': 0.0018217824884560706, 'lambda_val': 0.00011443263906032066, 'batch_size': 826, 'optimizer': 'RMSprop'}. Best is trial 23 with value: 0.028677848234730227.
2026-05-16 05:23:10,676 - experiment_functions - INFO - Early stopping at epoch 950. Best Recall: 0.0064
2026-05-16 05:23:10,767 - optuna.study.study - INFO - Trial 28 finished with value: 0.006447553404312162 and parameters: {'n_layers': 1, 'embedding_dim': 128, 'lr': 0.016237040967356342, 'lambda_val': 2.3650960635288238e-05, 'batch_size': 530, 'optimizer': 'RMSprop'}. Best is trial 23 with value: 0.028677848234730227.
2026-05-16 05:23:14,011 - experiment_functions - INFO - Early stopping at epoch 500. Best Recall: 0.0011
2026-05-16 05:23:14,114 - optuna.study.study - INFO - Trial 29 finished with value: 0.0010824708878244599 and parameters: {'n_layers': 2, 'embedding_dim': 32, 'lr': 6.417963117787892e-05, 'lambda_val': 2.961002658829979e-06, 'batch_size': 1546, 'optimizer': 'SGD'}. Best is trial 23 with value: 0.028677848234730227.
2026-05-16 05:23:19,983 - optuna.study._optimize - INFO - Trial 30 pruned. 
2026-05-16 05:23:26,952 - experiment_functions - INFO - Early stopping at epoch 1100. Best Recall: 0.0256
2026-05-16 05:23:27,052 - optuna.study.study - INFO - Trial 31 finished with value: 0.025626118890264237 and parameters: {'n_layers': 1, 'embedding_dim': 96, 'lr': 0.00038570556512167143, 'lambda_val': 1.433611165575293e-05, 'batch_size': 2319, 'optimizer': 'RMSprop'}. Best is trial 23 with value: 0.028677848234730227.
2026-05-16 05:23:36,730 - experiment_functions - INFO - Early stopping at epoch 1700. Best Recall: 0.0238
2026-05-16 05:23:36,838 - optuna.study.study - INFO - Trial 32 finished with value: 0.023764384936075304 and parameters: {'n_layers': 1, 'embedding_dim': 96, 'lr': 0.000302158806199408, 'lambda_val': 7.799376707309794e-06, 'batch_size': 1687, 'optimizer': 'RMSprop'}. Best is trial 23 with value: 0.028677848234730227.
2026-05-16 05:23:50,246 - experiment_functions - INFO - Early stopping at epoch 2600. Best Recall: 0.0268
2026-05-16 05:23:50,325 - optuna.study.study - INFO - Trial 33 finished with value: 0.026831380844599895 and parameters: {'n_layers': 1, 'embedding_dim': 96, 'lr': 0.0002262626188285922, 'lambda_val': 9.563571260750169e-06, 'batch_size': 1760, 'optimizer': 'RMSprop'}. Best is trial 23 with value: 0.028677848234730227.
2026-05-16 05:24:00,201 - experiment_functions - INFO - Early stopping at epoch 1800. Best Recall: 0.0278
2026-05-16 05:24:00,304 - optuna.study.study - INFO - Trial 34 finished with value: 0.027805435954505662 and parameters: {'n_layers': 1, 'embedding_dim': 96, 'lr': 0.0002525516141786393, 'lambda_val': 1.1574658364276764e-05, 'batch_size': 1822, 'optimizer': 'RMSprop'}. Best is trial 23 with value: 0.028677848234730227.
2026-05-16 05:24:03,434 - experiment_functions - INFO - Early stopping at epoch 500. Best Recall: 0.0033
2026-05-16 05:24:03,536 - optuna.study.study - INFO - Trial 35 finished with value: 0.0033493678131959136 and parameters: {'n_layers': 1, 'embedding_dim': 96, 'lr': 0.000256283579458928, 'lambda_val': 3.4154128659279884e-05, 'batch_size': 2197, 'optimizer': 'SGD'}. Best is trial 23 with value: 0.028677848234730227.
2026-05-16 05:24:08,673 - experiment_functions - INFO - Early stopping at epoch 900. Best Recall: 0.0023
2026-05-16 05:24:08,817 - optuna.study.study - INFO - Trial 36 finished with value: 0.0023410186179674236 and parameters: {'n_layers': 1, 'embedding_dim': 32, 'lr': 2.3254699051893653e-05, 'lambda_val': 1.4056655809768384e-05, 'batch_size': 1891, 'optimizer': 'RMSprop'}. Best is trial 23 with value: 0.028677848234730227.
2026-05-16 05:24:16,543 - optuna.study._optimize - INFO - Trial 37 pruned. 
2026-05-16 05:24:22,997 - optuna.study._optimize - INFO - Trial 38 pruned. 
2026-05-16 05:24:27,777 - experiment_functions - INFO - Early stopping at epoch 500. Best Recall: 0.0025
2026-05-16 05:24:27,904 - optuna.study.study - INFO - Trial 39 finished with value: 0.002479591223402155 and parameters: {'n_layers': 2, 'embedding_dim': 64, 'lr': 0.0004969589735301452, 'lambda_val': 1.118542680655091e-05, 'batch_size': 2258, 'optimizer': 'SGD'}. Best is trial 23 with value: 0.028677848234730227.
2026-05-16 05:24:33,977 - optuna.study._optimize - INFO - Trial 40 pruned. 
2026-05-16 05:24:42,811 - experiment_functions - INFO - Early stopping at epoch 1600. Best Recall: 0.0296
2026-05-16 05:24:42,901 - optuna.study.study - INFO - Trial 41 finished with value: 0.029587951208086827 and parameters: {'n_layers': 1, 'embedding_dim': 96, 'lr': 0.0003391446720494036, 'lambda_val': 7.525366170704012e-06, 'batch_size': 1649, 'optimizer': 'RMSprop'}. Best is trial 41 with value: 0.029587951208086827.
2026-05-16 05:24:49,471 - optuna.study._optimize - INFO - Trial 42 pruned. 
2026-05-16 05:24:54,507 - experiment_functions - INFO - Early stopping at epoch 850. Best Recall: 0.0230
2026-05-16 05:24:54,597 - optuna.study.study - INFO - Trial 43 finished with value: 0.02295801432662009 and parameters: {'n_layers': 1, 'embedding_dim': 96, 'lr': 0.0006786160771315859, 'lambda_val': 6.678605020377378e-05, 'batch_size': 1420, 'optimizer': 'RMSprop'}. Best is trial 41 with value: 0.029587951208086827.
2026-05-16 05:25:01,134 - optuna.study._optimize - INFO - Trial 44 pruned. 
2026-05-16 05:25:07,141 - optuna.study._optimize - INFO - Trial 45 pruned. 
2026-05-16 05:25:12,747 - experiment_functions - INFO - Early stopping at epoch 1000. Best Recall: 0.0220
2026-05-16 05:25:12,826 - optuna.study.study - INFO - Trial 46 finished with value: 0.02196656019365091 and parameters: {'n_layers': 1, 'embedding_dim': 96, 'lr': 0.00038277934025107924, 'lambda_val': 2.10022359530743e-06, 'batch_size': 2315, 'optimizer': 'RMSprop'}. Best is trial 41 with value: 0.029587951208086827.
2026-05-16 05:25:18,785 - experiment_functions - INFO - Early stopping at epoch 800. Best Recall: 0.0019
2026-05-16 05:25:18,886 - optuna.study.study - INFO - Trial 47 finished with value: 0.0018958743116382405 and parameters: {'n_layers': 4, 'embedding_dim': 64, 'lr': 3.174944824368746e-05, 'lambda_val': 4.796697946439222e-06, 'batch_size': 1621, 'optimizer': 'RMSprop'}. Best is trial 41 with value: 0.029587951208086827.
2026-05-16 05:25:22,514 - experiment_functions - INFO - Early stopping at epoch 550. Best Recall: 0.0205
2026-05-16 05:25:22,622 - optuna.study.study - INFO - Trial 48 finished with value: 0.02049855420461863 and parameters: {'n_layers': 1, 'embedding_dim': 96, 'lr': 0.0015449902569880858, 'lambda_val': 1.9687704102417124e-06, 'batch_size': 1460, 'optimizer': 'RMSprop'}. Best is trial 41 with value: 0.029587951208086827.
2026-05-16 05:25:28,395 - optuna.study._optimize - INFO - Trial 49 pruned. 
2026-05-16 05:25:33,359 - experiment_functions - INFO - Early stopping at epoch 700. Best Recall: 0.0208
2026-05-16 05:25:33,440 - optuna.study.study - INFO - Trial 50 finished with value: 0.020808426897430066 and parameters: {'n_layers': 1, 'embedding_dim': 96, 'lr': 0.0008013132298753836, 'lambda_val': 3.23803626754859e-05, 'batch_size': 1901, 'optimizer': 'RMSprop'}. Best is trial 41 with value: 0.029587951208086827.
2026-05-16 05:25:46,096 - experiment_functions - INFO - Early stopping at epoch 2500. Best Recall: 0.0324
2026-05-16 05:25:46,210 - optuna.study.study - INFO - Trial 51 finished with value: 0.03241341748392861 and parameters: {'n_layers': 1, 'embedding_dim': 96, 'lr': 0.00026681132946253195, 'lambda_val': 8.202504681215645e-06, 'batch_size': 1719, 'optimizer': 'RMSprop'}. Best is trial 51 with value: 0.03241341748392861.
2026-05-16 05:25:55,792 - optuna.study._optimize - INFO - Trial 52 pruned. 
2026-05-16 05:25:59,862 - experiment_functions - INFO - Early stopping at epoch 750. Best Recall: 0.0222
2026-05-16 05:25:59,953 - optuna.study.study - INFO - Trial 53 finished with value: 0.022197697913817194 and parameters: {'n_layers': 1, 'embedding_dim': 96, 'lr': 0.0005276349803749257, 'lambda_val': 1.63577507953563e-05, 'batch_size': 2124, 'optimizer': 'RMSprop'}. Best is trial 51 with value: 0.03241341748392861.
2026-05-16 05:26:06,657 - optuna.study._optimize - INFO - Trial 54 pruned. 
2026-05-16 05:26:12,445 - optuna.study._optimize - INFO - Trial 55 pruned. 
2026-05-16 05:26:18,600 - optuna.study._optimize - INFO - Trial 56 pruned. 
2026-05-16 05:26:21,456 - experiment_functions - INFO - Early stopping at epoch 500. Best Recall: 0.0049
2026-05-16 05:26:21,569 - optuna.study.study - INFO - Trial 57 finished with value: 0.004919994210869064 and parameters: {'n_layers': 1, 'embedding_dim': 96, 'lr': 0.08929010031751626, 'lambda_val': 1.0240366310706966e-06, 'batch_size': 1501, 'optimizer': 'RMSprop'}. Best is trial 51 with value: 0.03241341748392861.
2026-05-16 05:26:25,014 - experiment_functions - INFO - Early stopping at epoch 550. Best Recall: 0.0228
2026-05-16 05:26:25,319 - optuna.study.study - INFO - Trial 58 finished with value: 0.022831772319481858 and parameters: {'n_layers': 1, 'embedding_dim': 96, 'lr': 0.0010579327284899083, 'lambda_val': 1.7780157499081843e-05, 'batch_size': 2570, 'optimizer': 'RMSprop'}. Best is trial 51 with value: 0.03241341748392861.
2026-05-16 05:26:30,706 - optuna.study._optimize - INFO - Trial 59 pruned. 
2026-05-16 05:26:36,265 - optuna.study._optimize - INFO - Trial 60 pruned. 
2026-05-16 05:26:42,311 - optuna.study._optimize - INFO - Trial 61 pruned. 
2026-05-16 05:26:47,474 - experiment_functions - INFO - Early stopping at epoch 900. Best Recall: 0.0187
2026-05-16 05:26:47,576 - optuna.study.study - INFO - Trial 62 finished with value: 0.01865461861133684 and parameters: {'n_layers': 1, 'embedding_dim': 96, 'lr': 0.0005644740992751735, 'lambda_val': 6.8593677508277215e-06, 'batch_size': 1666, 'optimizer': 'RMSprop'}. Best is trial 51 with value: 0.03241341748392861.
2026-05-16 05:26:55,885 - experiment_functions - INFO - Early stopping at epoch 1800. Best Recall: 0.0293
2026-05-16 05:26:56,460 - optuna.study.study - INFO - Trial 63 finished with value: 0.02927515810151634 and parameters: {'n_layers': 1, 'embedding_dim': 96, 'lr': 0.0002863609976005209, 'lambda_val': 1.6928998665037265e-06, 'batch_size': 1367, 'optimizer': 'RMSprop'}. Best is trial 51 with value: 0.03241341748392861.
2026-05-16 05:27:02,193 - experiment_functions - INFO - Early stopping at epoch 1150. Best Recall: 0.0258
2026-05-16 05:27:02,293 - optuna.study.study - INFO - Trial 64 finished with value: 0.02575826516788819 and parameters: {'n_layers': 1, 'embedding_dim': 96, 'lr': 0.0004514962111946348, 'lambda_val': 1.9490766410901874e-06, 'batch_size': 995, 'optimizer': 'RMSprop'}. Best is trial 51 with value: 0.03241341748392861.
2026-05-16 05:27:07,780 - optuna.study._optimize - INFO - Trial 65 pruned. 
2026-05-16 05:27:10,928 - experiment_functions - INFO - Early stopping at epoch 500. Best Recall: 0.0022
2026-05-16 05:27:11,484 - optuna.study.study - INFO - Trial 66 finished with value: 0.0021896053828390828 and parameters: {'n_layers': 1, 'embedding_dim': 256, 'lr': 0.0008617269019177082, 'lambda_val': 1.4798591021607775e-06, 'batch_size': 898, 'optimizer': 'SGD'}. Best is trial 51 with value: 0.03241341748392861.
2026-05-16 05:27:23,343 - experiment_functions - INFO - Early stopping at epoch 2600. Best Recall: 0.0316
2026-05-16 05:27:23,453 - optuna.study.study - INFO - Trial 67 finished with value: 0.031589428406666974 and parameters: {'n_layers': 1, 'embedding_dim': 96, 'lr': 0.00025323368883030893, 'lambda_val': 2.71567117139714e-06, 'batch_size': 1131, 'optimizer': 'RMSprop'}. Best is trial 51 with value: 0.03241341748392861.
2026-05-16 05:27:34,841 - experiment_functions - INFO - Early stopping at epoch 1850. Best Recall: 0.0290
2026-05-16 05:27:34,943 - optuna.study.study - INFO - Trial 68 finished with value: 0.029004272039254222 and parameters: {'n_layers': 1, 'embedding_dim': 128, 'lr': 0.00026076515499534234, 'lambda_val': 2.3796785845287663e-06, 'batch_size': 1336, 'optimizer': 'RMSprop'}. Best is trial 51 with value: 0.03241341748392861.
2026-05-16 05:27:40,849 - optuna.study._optimize - INFO - Trial 69 pruned. 
2026-05-16 05:27:44,241 - experiment_functions - INFO - Early stopping at epoch 550. Best Recall: 0.0211
2026-05-16 05:27:44,342 - optuna.study.study - INFO - Trial 70 finished with value: 0.02105778218401497 and parameters: {'n_layers': 1, 'embedding_dim': 128, 'lr': 0.0014528120603167973, 'lambda_val': 4.2574882614437775e-06, 'batch_size': 1114, 'optimizer': 'RMSprop'}. Best is trial 51 with value: 0.03241341748392861.
2026-05-16 05:27:55,248 - experiment_functions - INFO - Early stopping at epoch 2050. Best Recall: 0.0303
2026-05-16 05:27:55,338 - optuna.study.study - INFO - Trial 71 finished with value: 0.030271334295601006 and parameters: {'n_layers': 1, 'embedding_dim': 128, 'lr': 0.00025114850489451295, 'lambda_val': 1.3393803731418686e-06, 'batch_size': 1309, 'optimizer': 'RMSprop'}. Best is trial 51 with value: 0.03241341748392861.
