2026-05-16 06:36:46,478 - optuna.study.study - INFO - Trial 266 finished with value: 0.1035615027239694 and parameters: {'n_layers': 1, 'embedding_dim': 256, 'lr': 0.0013765139008138705, 'lambda_val': 5.186214964823705e-06, 'batch_size': 3228, 'optimizer': 'Adam'}. Best is trial 193 with value: 0.10774609486080013.
2026-05-16 06:36:54,047 - experiment_functions - INFO - Early stopping at epoch 1150. Best Recall: 0.0935
2026-05-16 06:36:54,147 - optuna.study.study - INFO - Trial 267 finished with value: 0.09350646403487718 and parameters: {'n_layers': 1, 'embedding_dim': 256, 'lr': 0.001551289770914966, 'lambda_val': 5.0239531911452465e-06, 'batch_size': 3257, 'optimizer': 'Adam'}. Best is trial 193 with value: 0.10774609486080013.
2026-05-16 06:36:57,916 - experiment_functions - INFO - Early stopping at epoch 500. Best Recall: 0.0015
2026-05-16 06:36:58,007 - optuna.study.study - INFO - Trial 268 finished with value: 0.0014868590048246972 and parameters: {'n_layers': 1, 'embedding_dim': 256, 'lr': 0.0008223919750708693, 'lambda_val': 4.895549027940494e-06, 'batch_size': 3222, 'optimizer': 'SGD'}. Best is trial 193 with value: 0.10774609486080013.
2026-05-16 06:37:04,613 - optuna.study._optimize - INFO - Trial 269 pruned. 
2026-05-16 06:37:12,252 - optuna.study._optimize - INFO - Trial 270 pruned. 
2026-05-16 06:37:17,554 - experiment_functions - INFO - Early stopping at epoch 650. Best Recall: 0.0412
2026-05-16 06:37:17,654 - optuna.study.study - INFO - Trial 271 finished with value: 0.0411599892334197 and parameters: {'n_layers': 2, 'embedding_dim': 256, 'lr': 0.0009363309898363398, 'lambda_val': 4.160136153718335e-06, 'batch_size': 3085, 'optimizer': 'Adam'}. Best is trial 193 with value: 0.10774609486080013.
2026-05-16 06:37:24,518 - optuna.study._optimize - INFO - Trial 272 pruned. 
2026-05-16 06:37:34,668 - optuna.study._optimize - INFO - Trial 273 pruned. 
2026-05-16 06:37:44,323 - experiment_functions - INFO - Early stopping at epoch 1450. Best Recall: 0.1005
2026-05-16 06:37:44,413 - optuna.study.study - INFO - Trial 274 finished with value: 0.10051475473459714 and parameters: {'n_layers': 1, 'embedding_dim': 256, 'lr': 0.001094457373018151, 'lambda_val': 2.7200248234884442e-06, 'batch_size': 3195, 'optimizer': 'Adam'}. Best is trial 193 with value: 0.10774609486080013.
2026-05-16 06:37:51,155 - optuna.study._optimize - INFO - Trial 275 pruned. 
2026-05-16 06:38:09,369 - experiment_functions - INFO - Early stopping at epoch 2350. Best Recall: 0.1104
2026-05-16 06:38:09,494 - optuna.study.study - INFO - Trial 276 finished with value: 0.11040731882960032 and parameters: {'n_layers': 1, 'embedding_dim': 256, 'lr': 0.0008283085567603626, 'lambda_val': 2.772286388168918e-06, 'batch_size': 3216, 'optimizer': 'Adam'}. Best is trial 276 with value: 0.11040731882960032.
2026-05-16 06:38:16,432 - optuna.study._optimize - INFO - Trial 277 pruned. 
2026-05-16 06:38:36,683 - experiment_functions - INFO - Early stopping at epoch 2800. Best Recall: 0.1019
2026-05-16 06:38:36,772 - optuna.study.study - INFO - Trial 278 finished with value: 0.10186943237932396 and parameters: {'n_layers': 1, 'embedding_dim': 256, 'lr': 0.0007597967160441422, 'lambda_val': 3.002625220462146e-06, 'batch_size': 3182, 'optimizer': 'Adam'}. Best is trial 276 with value: 0.11040731882960032.
2026-05-16 06:38:43,834 - optuna.study._optimize - INFO - Trial 279 pruned. 
2026-05-16 06:38:51,327 - optuna.study._optimize - INFO - Trial 280 pruned. 
2026-05-16 06:38:59,344 - optuna.study._optimize - INFO - Trial 281 pruned. 
2026-05-16 06:39:09,427 - optuna.study._optimize - INFO - Trial 282 pruned. 
2026-05-16 06:39:18,893 - optuna.study._optimize - INFO - Trial 283 pruned. 
2026-05-16 06:39:27,550 - optuna.study._optimize - INFO - Trial 284 pruned. 
2026-05-16 06:39:34,541 - optuna.study._optimize - INFO - Trial 285 pruned. 
2026-05-16 06:39:43,565 - optuna.study._optimize - INFO - Trial 286 pruned. 
2026-05-16 06:39:50,541 - optuna.study._optimize - INFO - Trial 287 pruned. 
2026-05-16 06:39:57,997 - optuna.study._optimize - INFO - Trial 288 pruned. 
2026-05-16 06:40:20,392 - experiment_functions - INFO - Early stopping at epoch 1800. Best Recall: 0.0956
2026-05-16 06:40:20,492 - optuna.study.study - INFO - Trial 289 finished with value: 0.09559777975045355 and parameters: {'n_layers': 1, 'embedding_dim': 256, 'lr': 0.0010033940586432004, 'lambda_val': 6.280390969344907e-06, 'batch_size': 3226, 'optimizer': 'Adam'}. Best is trial 276 with value: 0.11040731882960032.
2026-05-16 06:40:28,348 - experiment_functions - INFO - Early stopping at epoch 1150. Best Recall: 0.0923
2026-05-16 06:40:28,439 - optuna.study.study - INFO - Trial 290 finished with value: 0.09226838802641538 and parameters: {'n_layers': 1, 'embedding_dim': 256, 'lr': 0.0012404046774866016, 'lambda_val': 2.1750337050083023e-06, 'batch_size': 3784, 'optimizer': 'Adam'}. Best is trial 276 with value: 0.11040731882960032.
2026-05-16 06:40:35,765 - optuna.study._optimize - INFO - Trial 291 pruned. 
2026-05-16 06:40:39,413 - experiment_functions - INFO - Early stopping at epoch 500. Best Recall: 0.0020
2026-05-16 06:40:39,504 - optuna.study.study - INFO - Trial 292 finished with value: 0.0019778970750537837 and parameters: {'n_layers': 1, 'embedding_dim': 256, 'lr': 0.000726268894813465, 'lambda_val': 5.217208369388622e-06, 'batch_size': 3068, 'optimizer': 'SGD'}. Best is trial 276 with value: 0.11040731882960032.
2026-05-16 06:40:57,421 - optuna.study._optimize - INFO - Trial 293 pruned. 
2026-05-16 06:41:06,791 - optuna.study._optimize - INFO - Trial 294 pruned. 
2026-05-16 06:41:13,977 - optuna.study._optimize - INFO - Trial 295 pruned. 
2026-05-16 06:41:31,775 - experiment_functions - INFO - Early stopping at epoch 2150. Best Recall: 0.1003
2026-05-16 06:41:32,538 - optuna.study.study - INFO - Trial 296 finished with value: 0.10034493807672683 and parameters: {'n_layers': 1, 'embedding_dim': 256, 'lr': 0.0008539344494501183, 'lambda_val': 4.237747092817256e-06, 'batch_size': 2919, 'optimizer': 'Adam'}. Best is trial 276 with value: 0.11040731882960032.
2026-05-16 06:41:44,235 - optuna.study._optimize - INFO - Trial 297 pruned. 
2026-05-16 06:41:50,580 - optuna.study._optimize - INFO - Trial 298 pruned. 
2026-05-16 06:42:00,808 - experiment_functions - INFO - Early stopping at epoch 1600. Best Recall: 0.0945
2026-05-16 06:42:00,941 - optuna.study.study - INFO - Trial 299 finished with value: 0.09452546966535989 and parameters: {'n_layers': 1, 'embedding_dim': 256, 'lr': 0.0010747477811282448, 'lambda_val': 3.623396843260583e-06, 'batch_size': 2873, 'optimizer': 'Adam'}. Best is trial 276 with value: 0.11040731882960032.
2026-05-16 06:42:11,972 - experiment_functions - INFO - Early stopping at epoch 2850. Best Recall: 0.0836
2026-05-16 06:42:12,083 - root - INFO -   **** Training e_100K_1c3dcs_rand1
2026-05-16 06:42:12,097 - root - INFO -   **** Getting 70319/81200 random edges
2026-05-16 06:42:12,208 - optuna.storages._rdb.storage - INFO - A new study created in RDB with name: Study_e_100K_1c3dcs_rand1
2026-05-16 06:42:18,798 - experiment_functions - INFO - Early stopping at epoch 850. Best Recall: 0.0460
2026-05-16 06:42:18,900 - optuna.study.study - INFO - Trial 0 finished with value: 0.04595085884269535 and parameters: {'n_layers': 4, 'embedding_dim': 128, 'lr': 0.000488842797226929, 'lambda_val': 0.00039826936744980835, 'batch_size': 1494, 'optimizer': 'RMSprop'}. Best is trial 0 with value: 0.04595085884269535.
2026-05-16 06:42:22,794 - experiment_functions - INFO - Early stopping at epoch 500. Best Recall: 0.0018
2026-05-16 06:42:22,894 - optuna.study.study - INFO - Trial 1 finished with value: 0.001806545519863328 and parameters: {'n_layers': 2, 'embedding_dim': 32, 'lr': 0.00012942386896150392, 'lambda_val': 0.0019980410674990206, 'batch_size': 3913, 'optimizer': 'SGD'}. Best is trial 0 with value: 0.04595085884269535.
2026-05-16 06:42:26,594 - experiment_functions - INFO - Early stopping at epoch 500. Best Recall: 0.0020
2026-05-16 06:42:26,675 - optuna.study.study - INFO - Trial 2 finished with value: 0.0020291322781379956 and parameters: {'n_layers': 3, 'embedding_dim': 64, 'lr': 0.03757942368049186, 'lambda_val': 1.4558445662504676e-06, 'batch_size': 2133, 'optimizer': 'SGD'}. Best is trial 0 with value: 0.04595085884269535.
2026-05-16 06:42:30,192 - experiment_functions - INFO - Early stopping at epoch 500. Best Recall: 0.0011
2026-05-16 06:42:30,282 - optuna.study.study - INFO - Trial 3 finished with value: 0.001149530951608493 and parameters: {'n_layers': 2, 'embedding_dim': 96, 'lr': 1.1905624104689465e-05, 'lambda_val': 0.008323339674442024, 'batch_size': 3281, 'optimizer': 'RMSprop'}. Best is trial 0 with value: 0.04595085884269535.
2026-05-16 06:42:35,583 - experiment_functions - INFO - Early stopping at epoch 550. Best Recall: 0.0751
2026-05-16 06:42:35,677 - optuna.study.study - INFO - Trial 4 finished with value: 0.07509369443610227 and parameters: {'n_layers': 1, 'embedding_dim': 96, 'lr': 0.0034853586750341736, 'lambda_val': 0.0002916198490949721, 'batch_size': 1679, 'optimizer': 'RMSprop'}. Best is trial 4 with value: 0.07509369443610227.
2026-05-16 06:42:42,224 - experiment_functions - INFO - Early stopping at epoch 950. Best Recall: 0.0483
2026-05-16 06:42:42,324 - optuna.study.study - INFO - Trial 5 finished with value: 0.048342898189693145 and parameters: {'n_layers': 3, 'embedding_dim': 96, 'lr': 0.00047929159380162307, 'lambda_val': 3.866200150428718e-05, 'batch_size': 1899, 'optimizer': 'Adam'}. Best is trial 4 with value: 0.07509369443610227.
2026-05-16 06:42:45,818 - experiment_functions - INFO - Early stopping at epoch 500. Best Recall: 0.0015
2026-05-16 06:42:45,916 - optuna.study.study - INFO - Trial 6 finished with value: 0.0014828527698655671 and parameters: {'n_layers': 1, 'embedding_dim': 128, 'lr': 0.010201680553379344, 'lambda_val': 0.0021304308489865603, 'batch_size': 1775, 'optimizer': 'SGD'}. Best is trial 4 with value: 0.07509369443610227.
2026-05-16 06:42:49,788 - experiment_functions - INFO - Early stopping at epoch 500. Best Recall: 0.0018
2026-05-16 06:42:49,954 - optuna.study.study - INFO - Trial 7 finished with value: 0.001768055934060586 and parameters: {'n_layers': 1, 'embedding_dim': 96, 'lr': 0.0014199667140056649, 'lambda_val': 0.0037844486267065857, 'batch_size': 2200, 'optimizer': 'SGD'}. Best is trial 4 with value: 0.07509369443610227.
2026-05-16 06:42:57,253 - experiment_functions - INFO - Early stopping at epoch 950. Best Recall: 0.0111
2026-05-16 06:42:57,343 - optuna.study.study - INFO - Trial 8 finished with value: 0.011054716244481783 and parameters: {'n_layers': 4, 'embedding_dim': 96, 'lr': 0.009818935756183629, 'lambda_val': 0.012766741721817122, 'batch_size': 1894, 'optimizer': 'Adam'}. Best is trial 4 with value: 0.07509369443610227.
2026-05-16 06:43:00,966 - experiment_functions - INFO - Early stopping at epoch 500. Best Recall: 0.0024
2026-05-16 06:43:01,731 - optuna.study.study - INFO - Trial 9 finished with value: 0.002432492505999246 and parameters: {'n_layers': 3, 'embedding_dim': 64, 'lr': 0.005364152030321296, 'lambda_val': 5.5558552108378336e-05, 'batch_size': 955, 'optimizer': 'SGD'}. Best is trial 4 with value: 0.07509369443610227.
2026-05-16 06:43:29,057 - experiment_functions - INFO - Early stopping at epoch 3100. Best Recall: 0.0148
2026-05-16 06:43:29,146 - optuna.study.study - INFO - Trial 10 finished with value: 0.014758646595075937 and parameters: {'n_layers': 1, 'embedding_dim': 256, 'lr': 0.09110394754910099, 'lambda_val': 0.09694238606221907, 'batch_size': 516, 'optimizer': 'RMSprop'}. Best is trial 4 with value: 0.07509369443610227.
2026-05-16 06:43:46,137 - experiment_functions - INFO - Early stopping at epoch 2600. Best Recall: 0.0459
2026-05-16 06:43:46,239 - optuna.study.study - INFO - Trial 11 finished with value: 0.04588224349270624 and parameters: {'n_layers': 3, 'embedding_dim': 96, 'lr': 0.00024725489513743464, 'lambda_val': 2.3814121053685304e-05, 'batch_size': 2847, 'optimizer': 'Adam'}. Best is trial 4 with value: 0.07509369443610227.
2026-05-16 06:43:52,530 - optuna.study._optimize - INFO - Trial 12 pruned. 
2026-05-16 06:43:58,808 - experiment_functions - INFO - Early stopping at epoch 650. Best Recall: 0.0507
2026-05-16 06:43:58,908 - optuna.study.study - INFO - Trial 13 finished with value: 0.050720470945065196 and parameters: {'n_layers': 3, 'embedding_dim': 256, 'lr': 0.0013176977338593186, 'lambda_val': 0.00020365481381376944, 'batch_size': 2732, 'optimizer': 'Adam'}. Best is trial 4 with value: 0.07509369443610227.
2026-05-16 06:44:09,660 - experiment_functions - INFO - Early stopping at epoch 600. Best Recall: 0.0488
2026-05-16 06:44:10,419 - optuna.study.study - INFO - Trial 14 finished with value: 0.048758393724488244 and parameters: {'n_layers': 2, 'embedding_dim': 256, 'lr': 0.0021570212950579567, 'lambda_val': 0.00023829940810115292, 'batch_size': 2702, 'optimizer': 'RMSprop'}. Best is trial 4 with value: 0.07509369443610227.
2026-05-16 06:44:19,910 - experiment_functions - INFO - Early stopping at epoch 550. Best Recall: 0.0261
2026-05-16 06:44:20,000 - optuna.study.study - INFO - Trial 15 finished with value: 0.026057681403687052 and parameters: {'n_layers': 4, 'embedding_dim': 256, 'lr': 0.0031973421426675446, 'lambda_val': 3.006988444611269e-06, 'batch_size': 2728, 'optimizer': 'Adam'}. Best is trial 4 with value: 0.07509369443610227.
2026-05-16 06:44:23,601 - experiment_functions - INFO - Early stopping at epoch 600. Best Recall: 0.0311
2026-05-16 06:44:23,682 - optuna.study.study - INFO - Trial 16 finished with value: 0.03110441736172444 and parameters: {'n_layers': 1, 'embedding_dim': 32, 'lr': 0.023365399518291075, 'lambda_val': 0.0003980908259320465, 'batch_size': 3414, 'optimizer': 'RMSprop'}. Best is trial 4 with value: 0.07509369443610227.
2026-05-16 06:44:29,665 - experiment_functions - INFO - Early stopping at epoch 700. Best Recall: 0.0558
2026-05-16 06:44:29,820 - optuna.study.study - INFO - Trial 17 finished with value: 0.055772097534745275 and parameters: {'n_layers': 2, 'embedding_dim': 256, 'lr': 0.0005475107913873655, 'lambda_val': 0.00015250751436755392, 'batch_size': 2475, 'optimizer': 'RMSprop'}. Best is trial 4 with value: 0.07509369443610227.
2026-05-16 06:44:36,227 - optuna.study._optimize - INFO - Trial 18 pruned. 
2026-05-16 06:44:42,858 - experiment_functions - INFO - Early stopping at epoch 1050. Best Recall: 0.0723
2026-05-16 06:44:42,949 - optuna.study.study - INFO - Trial 19 finished with value: 0.07227164838560496 and parameters: {'n_layers': 2, 'embedding_dim': 128, 'lr': 0.00046405408943055935, 'lambda_val': 9.362870486115002e-05, 'batch_size': 898, 'optimizer': 'RMSprop'}. Best is trial 4 with value: 0.07509369443610227.
2026-05-16 06:44:46,716 - experiment_functions - INFO - Early stopping at epoch 550. Best Recall: 0.0031
2026-05-16 06:44:46,820 - optuna.study.study - INFO - Trial 20 finished with value: 0.0030740391286321776 and parameters: {'n_layers': 1, 'embedding_dim': 128, 'lr': 3.2660223994442714e-05, 'lambda_val': 0.0007950084354355399, 'batch_size': 889, 'optimizer': 'RMSprop'}. Best is trial 4 with value: 0.07509369443610227.
2026-05-16 06:45:01,343 - experiment_functions - INFO - Early stopping at epoch 700. Best Recall: 0.0501
2026-05-16 06:45:01,444 - optuna.study.study - INFO - Trial 21 finished with value: 0.050088526838883825 and parameters: {'n_layers': 2, 'embedding_dim': 128, 'lr': 0.0006766940999549453, 'lambda_val': 9.288924683480124e-05, 'batch_size': 962, 'optimizer': 'RMSprop'}. Best is trial 4 with value: 0.07509369443610227.
2026-05-16 06:45:28,446 - experiment_functions - INFO - Early stopping at epoch 2650. Best Recall: 0.0775
2026-05-16 06:45:28,542 - optuna.study.study - INFO - Trial 22 finished with value: 0.0775375924134849 and parameters: {'n_layers': 2, 'embedding_dim': 128, 'lr': 0.00023665465185662124, 'lambda_val': 1.2267684899360607e-05, 'batch_size': 567, 'optimizer': 'RMSprop'}. Best is trial 22 with value: 0.0775375924134849.
2026-05-16 06:45:51,939 - experiment_functions - INFO - Early stopping at epoch 3950. Best Recall: 0.0843
2026-05-16 06:45:52,044 - optuna.study.study - INFO - Trial 23 finished with value: 0.08434287878275087 and parameters: {'n_layers': 2, 'embedding_dim': 128, 'lr': 0.00019744008221324303, 'lambda_val': 7.5704944388729345e-06, 'batch_size': 515, 'optimizer': 'RMSprop'}. Best is trial 23 with value: 0.08434287878275087.
2026-05-16 06:46:13,205 - experiment_functions - INFO - Early stopping at epoch 3600. Best Recall: 0.0885
2026-05-16 06:46:13,312 - optuna.study.study - INFO - Trial 24 finished with value: 0.08854392912793761 and parameters: {'n_layers': 2, 'embedding_dim': 128, 'lr': 0.0001782466456846483, 'lambda_val': 6.631512620798539e-06, 'batch_size': 647, 'optimizer': 'RMSprop'}. Best is trial 24 with value: 0.08854392912793761.
2026-05-16 06:46:30,362 - optuna.study._optimize - INFO - Trial 25 pruned. 
2026-05-16 06:46:42,626 - optuna.study._optimize - INFO - Trial 26 pruned. 
2026-05-16 06:46:48,120 - experiment_functions - INFO - Early stopping at epoch 750. Best Recall: 0.0024
2026-05-16 06:46:48,222 - optuna.study.study - INFO - Trial 27 finished with value: 0.002414906603585856 and parameters: {'n_layers': 3, 'embedding_dim': 128, 'lr': 1.9979210170648994e-05, 'lambda_val': 1.0436163245506754e-06, 'batch_size': 653, 'optimizer': 'RMSprop'}. Best is trial 24 with value: 0.08854392912793761.
2026-05-16 06:47:11,538 - optuna.study.study - INFO - Trial 28 finished with value: 0.08806739359645177 and parameters: {'n_layers': 2, 'embedding_dim': 128, 'lr': 0.00017470230702368642, 'lambda_val': 2.76438760385927e-06, 'batch_size': 724, 'optimizer': 'RMSprop'}. Best is trial 24 with value: 0.08854392912793761.
2026-05-16 06:47:18,553 - optuna.study._optimize - INFO - Trial 29 pruned. 
2026-05-16 06:47:25,883 - optuna.study._optimize - INFO - Trial 30 pruned. 
2026-05-16 06:47:39,314 - experiment_functions - INFO - Early stopping at epoch 2100. Best Recall: 0.0931
2026-05-16 06:47:39,404 - optuna.study.study - INFO - Trial 31 finished with value: 0.09309563781684714 and parameters: {'n_layers': 2, 'embedding_dim': 128, 'lr': 0.0002596627162088738, 'lambda_val': 1.6050237296237788e-05, 'batch_size': 712, 'optimizer': 'RMSprop'}. Best is trial 31 with value: 0.09309563781684714.
2026-05-16 06:47:55,773 - experiment_functions - INFO - Early stopping at epoch 2650. Best Recall: 0.0866
2026-05-16 06:47:55,873 - optuna.study.study - INFO - Trial 32 finished with value: 0.08657390014813057 and parameters: {'n_layers': 2, 'embedding_dim': 128, 'lr': 0.00024920882091760354, 'lambda_val': 1.5772825411602746e-05, 'batch_size': 783, 'optimizer': 'RMSprop'}. Best is trial 31 with value: 0.09309563781684714.
2026-05-16 06:48:09,756 - experiment_functions - INFO - Early stopping at epoch 2300. Best Recall: 0.0817
2026-05-16 06:48:09,847 - optuna.study.study - INFO - Trial 33 finished with value: 0.08167560321892961 and parameters: {'n_layers': 2, 'embedding_dim': 32, 'lr': 0.00033394030433722, 'lambda_val': 1.8836593488027817e-05, 'batch_size': 1165, 'optimizer': 'RMSprop'}. Best is trial 31 with value: 0.09309563781684714.
2026-05-16 06:48:15,005 - experiment_functions - INFO - Early stopping at epoch 750. Best Recall: 0.0559
2026-05-16 06:48:15,094 - optuna.study.study - INFO - Trial 34 finished with value: 0.05592682027974987 and parameters: {'n_layers': 2, 'embedding_dim': 64, 'lr': 0.0009054488564483106, 'lambda_val': 3.6280745242430247e-06, 'batch_size': 849, 'optimizer': 'RMSprop'}. Best is trial 31 with value: 0.09309563781684714.
2026-05-16 06:48:18,589 - experiment_functions - INFO - Early stopping at epoch 500. Best Recall: 0.0023
2026-05-16 06:48:18,689 - optuna.study.study - INFO - Trial 35 finished with value: 0.002297113273449055 and parameters: {'n_layers': 2, 'embedding_dim': 128, 'lr': 0.00012816460427776265, 'lambda_val': 1.6592439291993057e-06, 'batch_size': 734, 'optimizer': 'SGD'}. Best is trial 31 with value: 0.09309563781684714.
2026-05-16 06:48:31,097 - optuna.study._optimize - INFO - Trial 36 pruned. 
2026-05-16 06:48:42,617 - optuna.study._optimize - INFO - Trial 37 pruned. 
2026-05-16 06:48:46,634 - experiment_functions - INFO - Early stopping at epoch 500. Best Recall: 0.0009
2026-05-16 06:48:46,725 - optuna.study.study - INFO - Trial 38 finished with value: 0.0008776979127951978 and parameters: {'n_layers': 1, 'embedding_dim': 32, 'lr': 0.0003563816472280401, 'lambda_val': 4.983683809820953e-05, 'batch_size': 3972, 'optimizer': 'SGD'}. Best is trial 31 with value: 0.09309563781684714.
2026-05-16 06:48:52,700 - optuna.study._optimize - INFO - Trial 39 pruned. 
2026-05-16 06:49:00,270 - optuna.study._optimize - INFO - Trial 40 pruned. 
2026-05-16 06:49:10,055 - optuna.study._optimize - INFO - Trial 41 pruned. 
2026-05-16 06:49:33,055 - experiment_functions - INFO - Early stopping at epoch 2250. Best Recall: 0.0997
2026-05-16 06:49:33,164 - optuna.study.study - INFO - Trial 42 finished with value: 0.09973645473931977 and parameters: {'n_layers': 2, 'embedding_dim': 128, 'lr': 0.00029870490295141547, 'lambda_val': 2.0083582421583863e-06, 'batch_size': 517, 'optimizer': 'RMSprop'}. Best is trial 42 with value: 0.09973645473931977.
2026-05-16 06:49:38,782 - experiment_functions - INFO - Early stopping at epoch 850. Best Recall: 0.0761
2026-05-16 06:49:38,920 - optuna.study.study - INFO - Trial 43 finished with value: 0.07608446033275824 and parameters: {'n_layers': 2, 'embedding_dim': 128, 'lr': 0.0008590340423750323, 'lambda_val': 1.7327112202536108e-06, 'batch_size': 1304, 'optimizer': 'RMSprop'}. Best is trial 42 with value: 0.09973645473931977.
2026-05-16 06:49:42,424 - experiment_functions - INFO - Early stopping at epoch 500. Best Recall: 0.0021
