2026-05-16 09:55:18,680 - optuna.study.study - INFO - Trial 42 finished with value: 0.09625412875212967 and parameters: {'n_layers': 1, 'embedding_dim': 128, 'lr': 0.0007345091147935462, 'lambda_val': 4.3076276104730685e-05, 'batch_size': 2456, 'optimizer': 'RMSprop'}. Best is trial 34 with value: 0.11621697710160639.
2026-05-16 09:55:34,848 - experiment_functions - INFO - Early stopping at epoch 2900. Best Recall: 0.1182
2026-05-16 09:55:34,947 - optuna.study.study - INFO - Trial 43 finished with value: 0.11815182381348771 and parameters: {'n_layers': 1, 'embedding_dim': 128, 'lr': 0.0003167879303501676, 'lambda_val': 2.4968007380119484e-05, 'batch_size': 1830, 'optimizer': 'RMSprop'}. Best is trial 43 with value: 0.11815182381348771.
2026-05-16 09:55:42,484 - optuna.study._optimize - INFO - Trial 44 pruned. 
2026-05-16 09:55:46,280 - experiment_functions - INFO - Early stopping at epoch 500. Best Recall: 0.0023
2026-05-16 09:55:46,379 - optuna.study.study - INFO - Trial 45 finished with value: 0.0023384428547181054 and parameters: {'n_layers': 1, 'embedding_dim': 32, 'lr': 5.8916642442938105e-05, 'lambda_val': 0.07177266023865078, 'batch_size': 2248, 'optimizer': 'SGD'}. Best is trial 43 with value: 0.11815182381348771.
2026-05-16 09:55:52,657 - optuna.study._optimize - INFO - Trial 46 pruned. 
2026-05-16 09:55:57,710 - experiment_functions - INFO - Early stopping at epoch 800. Best Recall: 0.0944
2026-05-16 09:55:57,822 - optuna.study.study - INFO - Trial 47 finished with value: 0.09440110005421741 and parameters: {'n_layers': 1, 'embedding_dim': 96, 'lr': 0.0009514231992938026, 'lambda_val': 1.6304503984098584e-06, 'batch_size': 2507, 'optimizer': 'RMSprop'}. Best is trial 43 with value: 0.11815182381348771.
2026-05-16 09:56:05,403 - optuna.study._optimize - INFO - Trial 48 pruned. 
2026-05-16 09:56:10,606 - experiment_functions - INFO - Early stopping at epoch 650. Best Recall: 0.0004
2026-05-16 09:56:10,706 - optuna.study.study - INFO - Trial 49 finished with value: 0.00035780066622730436 and parameters: {'n_layers': 4, 'embedding_dim': 128, 'lr': 0.0026745991722859166, 'lambda_val': 2.175435711336119e-05, 'batch_size': 1833, 'optimizer': 'SGD'}. Best is trial 43 with value: 0.11815182381348771.
2026-05-16 09:56:16,580 - optuna.study._optimize - INFO - Trial 50 pruned. 
2026-05-16 09:56:27,857 - experiment_functions - INFO - Early stopping at epoch 1600. Best Recall: 0.1136
2026-05-16 09:56:28,027 - optuna.study.study - INFO - Trial 51 finished with value: 0.113605003631479 and parameters: {'n_layers': 1, 'embedding_dim': 128, 'lr': 0.0005883149684877011, 'lambda_val': 2.7877000118599213e-05, 'batch_size': 1991, 'optimizer': 'RMSprop'}. Best is trial 43 with value: 0.11815182381348771.
2026-05-16 09:56:47,718 - experiment_functions - INFO - Early stopping at epoch 1800. Best Recall: 0.1174
2026-05-16 09:56:47,846 - optuna.study.study - INFO - Trial 52 finished with value: 0.11741016887556331 and parameters: {'n_layers': 1, 'embedding_dim': 128, 'lr': 0.00038061684933082845, 'lambda_val': 9.56815811728149e-06, 'batch_size': 2701, 'optimizer': 'RMSprop'}. Best is trial 43 with value: 0.11815182381348771.
2026-05-16 09:56:54,303 - experiment_functions - INFO - Early stopping at epoch 950. Best Recall: 0.1023
2026-05-16 09:56:54,416 - optuna.study.study - INFO - Trial 53 finished with value: 0.10228998405386823 and parameters: {'n_layers': 1, 'embedding_dim': 128, 'lr': 0.0008553324891450927, 'lambda_val': 5.1280770059123764e-05, 'batch_size': 2780, 'optimizer': 'RMSprop'}. Best is trial 43 with value: 0.11815182381348771.
2026-05-16 09:57:00,355 - optuna.study._optimize - INFO - Trial 54 pruned. 
2026-05-16 09:57:05,242 - experiment_functions - INFO - Early stopping at epoch 700. Best Recall: 0.1111
2026-05-16 09:57:05,385 - optuna.study.study - INFO - Trial 55 finished with value: 0.1111029489243145 and parameters: {'n_layers': 1, 'embedding_dim': 128, 'lr': 0.0012800648794459091, 'lambda_val': 0.00011743265754288559, 'batch_size': 2295, 'optimizer': 'RMSprop'}. Best is trial 43 with value: 0.11815182381348771.
2026-05-16 09:57:10,079 - experiment_functions - INFO - Early stopping at epoch 700. Best Recall: 0.0260
2026-05-16 09:57:10,222 - optuna.study.study - INFO - Trial 56 finished with value: 0.025997173067586844 and parameters: {'n_layers': 3, 'embedding_dim': 32, 'lr': 0.00467746192952185, 'lambda_val': 0.00010293723491644352, 'batch_size': 2191, 'optimizer': 'RMSprop'}. Best is trial 43 with value: 0.11815182381348771.
2026-05-16 09:57:15,668 - experiment_functions - INFO - Early stopping at epoch 550. Best Recall: 0.0882
2026-05-16 09:57:15,788 - optuna.study.study - INFO - Trial 57 finished with value: 0.08816423616404546 and parameters: {'n_layers': 1, 'embedding_dim': 128, 'lr': 0.0021514226602359137, 'lambda_val': 0.00032648883782716956, 'batch_size': 1595, 'optimizer': 'RMSprop'}. Best is trial 43 with value: 0.11815182381348771.
2026-05-16 09:57:20,385 - experiment_functions - INFO - Early stopping at epoch 550. Best Recall: 0.0545
2026-05-16 09:57:20,978 - optuna.study.study - INFO - Trial 58 finished with value: 0.05446972901620635 and parameters: {'n_layers': 1, 'embedding_dim': 128, 'lr': 0.0013254372568791393, 'lambda_val': 0.028804573021892096, 'batch_size': 2316, 'optimizer': 'RMSprop'}. Best is trial 43 with value: 0.11815182381348771.
2026-05-16 09:57:26,895 - optuna.study._optimize - INFO - Trial 59 pruned. 
2026-05-16 09:57:36,124 - optuna.study._optimize - INFO - Trial 60 pruned. 
2026-05-16 09:57:46,799 - experiment_functions - INFO - Early stopping at epoch 1100. Best Recall: 0.1279
2026-05-16 09:57:46,969 - optuna.study.study - INFO - Trial 61 finished with value: 0.1279353865891376 and parameters: {'n_layers': 1, 'embedding_dim': 128, 'lr': 0.0005732928724870422, 'lambda_val': 3.0323828032912315e-05, 'batch_size': 1914, 'optimizer': 'RMSprop'}. Best is trial 61 with value: 0.1279353865891376.
2026-05-16 09:57:52,506 - experiment_functions - INFO - Early stopping at epoch 950. Best Recall: 0.1064
2026-05-16 09:57:52,608 - optuna.study.study - INFO - Trial 62 finished with value: 0.10640345491627014 and parameters: {'n_layers': 1, 'embedding_dim': 128, 'lr': 0.0011264413149973793, 'lambda_val': 3.231076425014592e-05, 'batch_size': 1881, 'optimizer': 'RMSprop'}. Best is trial 61 with value: 0.1279353865891376.
2026-05-16 09:58:00,371 - optuna.study._optimize - INFO - Trial 63 pruned. 
2026-05-16 09:58:06,379 - optuna.study._optimize - INFO - Trial 64 pruned. 
2026-05-16 09:58:22,863 - optuna.study._optimize - INFO - Trial 65 pruned. 
2026-05-16 09:58:33,092 - optuna.study._optimize - INFO - Trial 66 pruned. 
2026-05-16 09:58:37,318 - experiment_functions - INFO - Early stopping at epoch 500. Best Recall: 0.0026
2026-05-16 09:58:37,420 - optuna.study.study - INFO - Trial 67 finished with value: 0.0026066632624323098 and parameters: {'n_layers': 1, 'embedding_dim': 32, 'lr': 0.0004010174863551337, 'lambda_val': 1.0675914743392991e-05, 'batch_size': 1745, 'optimizer': 'SGD'}. Best is trial 61 with value: 0.1279353865891376.
2026-05-16 09:58:49,962 - experiment_functions - INFO - Early stopping at epoch 1500. Best Recall: 0.1285
2026-05-16 09:58:50,388 - optuna.study.study - INFO - Trial 68 finished with value: 0.12849050624888234 and parameters: {'n_layers': 1, 'embedding_dim': 128, 'lr': 0.000825513658588203, 'lambda_val': 4.066399867127709e-06, 'batch_size': 1599, 'optimizer': 'Adam'}. Best is trial 68 with value: 0.12849050624888234.
2026-05-16 09:59:02,613 - experiment_functions - INFO - Early stopping at epoch 1700. Best Recall: 0.1209
2026-05-16 09:59:02,747 - optuna.study.study - INFO - Trial 69 finished with value: 0.12087680513050233 and parameters: {'n_layers': 1, 'embedding_dim': 96, 'lr': 0.0008746971259297429, 'lambda_val': 4.84639718787864e-06, 'batch_size': 956, 'optimizer': 'Adam'}. Best is trial 68 with value: 0.12849050624888234.
2026-05-16 09:59:16,908 - experiment_functions - INFO - Early stopping at epoch 1600. Best Recall: 0.1209
2026-05-16 09:59:17,018 - optuna.study.study - INFO - Trial 70 finished with value: 0.1208515150537706 and parameters: {'n_layers': 1, 'embedding_dim': 96, 'lr': 0.0008643132447458335, 'lambda_val': 4.132493188528558e-06, 'batch_size': 815, 'optimizer': 'Adam'}. Best is trial 68 with value: 0.12849050624888234.
2026-05-16 09:59:28,979 - experiment_functions - INFO - Early stopping at epoch 1650. Best Recall: 0.1209
2026-05-16 09:59:29,070 - optuna.study.study - INFO - Trial 71 finished with value: 0.12088368875622447 and parameters: {'n_layers': 1, 'embedding_dim': 96, 'lr': 0.0009675229032585097, 'lambda_val': 5.010956875108509e-06, 'batch_size': 883, 'optimizer': 'Adam'}. Best is trial 68 with value: 0.12849050624888234.
2026-05-16 09:59:45,901 - experiment_functions - INFO - Early stopping at epoch 2350. Best Recall: 0.1313
2026-05-16 09:59:46,013 - optuna.study.study - INFO - Trial 72 finished with value: 0.13128566716531792 and parameters: {'n_layers': 1, 'embedding_dim': 96, 'lr': 0.000801558870420209, 'lambda_val': 2.0456308271381486e-06, 'batch_size': 796, 'optimizer': 'Adam'}. Best is trial 72 with value: 0.13128566716531792.
2026-05-16 09:59:59,238 - experiment_functions - INFO - Early stopping at epoch 1350. Best Recall: 0.1178
2026-05-16 09:59:59,339 - optuna.study.study - INFO - Trial 73 finished with value: 0.11776093602770023 and parameters: {'n_layers': 1, 'embedding_dim': 96, 'lr': 0.0009159466524812544, 'lambda_val': 2.197708379627131e-06, 'batch_size': 859, 'optimizer': 'Adam'}. Best is trial 72 with value: 0.13128566716531792.
2026-05-16 10:00:07,131 - optuna.study._optimize - INFO - Trial 74 pruned. 
2026-05-16 10:00:21,343 - experiment_functions - INFO - Early stopping at epoch 2000. Best Recall: 0.1199
2026-05-16 10:00:21,443 - optuna.study.study - INFO - Trial 75 finished with value: 0.11986553303822751 and parameters: {'n_layers': 1, 'embedding_dim': 96, 'lr': 0.0008249182739881643, 'lambda_val': 2.096193270862416e-06, 'batch_size': 617, 'optimizer': 'Adam'}. Best is trial 72 with value: 0.13128566716531792.
2026-05-16 10:00:28,666 - optuna.study._optimize - INFO - Trial 76 pruned. 
2026-05-16 10:00:46,594 - experiment_functions - INFO - Early stopping at epoch 2600. Best Recall: 0.1185
2026-05-16 10:00:46,694 - optuna.study.study - INFO - Trial 77 finished with value: 0.11854213864198694 and parameters: {'n_layers': 1, 'embedding_dim': 96, 'lr': 0.0007950117013111557, 'lambda_val': 1.5610677331974734e-06, 'batch_size': 1030, 'optimizer': 'Adam'}. Best is trial 72 with value: 0.13128566716531792.
2026-05-16 10:00:54,279 - experiment_functions - INFO - Early stopping at epoch 550. Best Recall: 0.0555
2026-05-16 10:00:54,369 - optuna.study.study - INFO - Trial 78 finished with value: 0.055461175537468266 and parameters: {'n_layers': 2, 'embedding_dim': 96, 'lr': 0.00406487803178986, 'lambda_val': 2.429963993653327e-06, 'batch_size': 772, 'optimizer': 'Adam'}. Best is trial 72 with value: 0.13128566716531792.
2026-05-16 10:01:01,190 - optuna.study._optimize - INFO - Trial 79 pruned. 
2026-05-16 10:01:07,286 - experiment_functions - INFO - Early stopping at epoch 600. Best Recall: 0.0334
2026-05-16 10:01:07,419 - optuna.study.study - INFO - Trial 80 finished with value: 0.033431310190693606 and parameters: {'n_layers': 4, 'embedding_dim': 96, 'lr': 0.001584277559174327, 'lambda_val': 5.054083730820667e-06, 'batch_size': 1012, 'optimizer': 'Adam'}. Best is trial 72 with value: 0.13128566716531792.
2026-05-16 10:01:16,530 - experiment_functions - INFO - Early stopping at epoch 1300. Best Recall: 0.1241
2026-05-16 10:01:16,620 - optuna.study.study - INFO - Trial 81 finished with value: 0.12410891417191476 and parameters: {'n_layers': 1, 'embedding_dim': 96, 'lr': 0.0010981646987828948, 'lambda_val': 1.655481992033855e-06, 'batch_size': 636, 'optimizer': 'Adam'}. Best is trial 72 with value: 0.13128566716531792.
2026-05-16 10:01:30,851 - experiment_functions - INFO - Early stopping at epoch 2150. Best Recall: 0.1249
2026-05-16 10:01:30,941 - optuna.study.study - INFO - Trial 82 finished with value: 0.12492098017751638 and parameters: {'n_layers': 1, 'embedding_dim': 96, 'lr': 0.0010726329192606836, 'lambda_val': 1.569554619975215e-06, 'batch_size': 620, 'optimizer': 'Adam'}. Best is trial 72 with value: 0.13128566716531792.
2026-05-16 10:01:37,117 - optuna.study._optimize - INFO - Trial 83 pruned. 
2026-05-16 10:01:44,931 - optuna.study._optimize - INFO - Trial 84 pruned. 
2026-05-16 10:01:54,155 - optuna.study._optimize - INFO - Trial 85 pruned. 
2026-05-16 10:02:00,017 - experiment_functions - INFO - Early stopping at epoch 600. Best Recall: 0.0428
2026-05-16 10:02:00,122 - optuna.study.study - INFO - Trial 86 finished with value: 0.04280956642896784 and parameters: {'n_layers': 3, 'embedding_dim': 96, 'lr': 0.002329867500245834, 'lambda_val': 1.3871045072588274e-06, 'batch_size': 1213, 'optimizer': 'Adam'}. Best is trial 72 with value: 0.13128566716531792.
2026-05-16 10:02:27,564 - experiment_functions - INFO - Early stopping at epoch 3800. Best Recall: 0.1279
2026-05-16 10:02:27,656 - optuna.study.study - INFO - Trial 87 finished with value: 0.12787389886831824 and parameters: {'n_layers': 1, 'embedding_dim': 96, 'lr': 0.0007076595004956409, 'lambda_val': 3.939372686118759e-06, 'batch_size': 673, 'optimizer': 'Adam'}. Best is trial 72 with value: 0.13128566716531792.
2026-05-16 10:02:32,768 - experiment_functions - INFO - Early stopping at epoch 600. Best Recall: 0.0875
2026-05-16 10:02:32,850 - optuna.study.study - INFO - Trial 88 finished with value: 0.08749450161708872 and parameters: {'n_layers': 1, 'embedding_dim': 96, 'lr': 0.003187397047329723, 'lambda_val': 3.757361569134815e-06, 'batch_size': 755, 'optimizer': 'Adam'}. Best is trial 72 with value: 0.13128566716531792.
2026-05-16 10:02:54,913 - experiment_functions - INFO - Early stopping at epoch 2000. Best Recall: 0.1316
2026-05-16 10:02:55,849 - optuna.study.study - INFO - Trial 89 finished with value: 0.13164335105783234 and parameters: {'n_layers': 1, 'embedding_dim': 96, 'lr': 0.0006583598795393327, 'lambda_val': 2.6927414427612004e-06, 'batch_size': 948, 'optimizer': 'Adam'}. Best is trial 89 with value: 0.13164335105783234.
2026-05-16 10:03:12,186 - experiment_functions - INFO - Early stopping at epoch 2250. Best Recall: 0.1264
2026-05-16 10:03:13,316 - optuna.study.study - INFO - Trial 90 finished with value: 0.12637860131578052 and parameters: {'n_layers': 1, 'embedding_dim': 96, 'lr': 0.0006556259555421557, 'lambda_val': 6.330920998582858e-06, 'batch_size': 1318, 'optimizer': 'Adam'}. Best is trial 89 with value: 0.13164335105783234.
2026-05-16 10:03:23,091 - optuna.study._optimize - INFO - Trial 91 pruned. 
2026-05-16 10:03:32,582 - optuna.study._optimize - INFO - Trial 92 pruned. 
2026-05-16 10:03:42,346 - optuna.study._optimize - INFO - Trial 93 pruned. 
2026-05-16 10:03:51,163 - optuna.study._optimize - INFO - Trial 94 pruned. 
2026-05-16 10:04:00,967 - optuna.study._optimize - INFO - Trial 95 pruned. 
2026-05-16 10:04:07,449 - optuna.study._optimize - INFO - Trial 96 pruned. 
2026-05-16 10:04:13,610 - experiment_functions - INFO - Early stopping at epoch 900. Best Recall: 0.0947
2026-05-16 10:04:13,715 - optuna.study.study - INFO - Trial 97 finished with value: 0.09466708753312615 and parameters: {'n_layers': 1, 'embedding_dim': 96, 'lr': 0.001549745874131998, 'lambda_val': 1.2554919534976395e-05, 'batch_size': 1419, 'optimizer': 'Adam'}. Best is trial 89 with value: 0.13164335105783234.
2026-05-16 10:04:21,838 - experiment_functions - INFO - Early stopping at epoch 550. Best Recall: 0.0402
2026-05-16 10:04:21,933 - optuna.study.study - INFO - Trial 98 finished with value: 0.040199587310386184 and parameters: {'n_layers': 1, 'embedding_dim': 96, 'lr': 0.031983666233689576, 'lambda_val': 4.695281406050363e-06, 'batch_size': 922, 'optimizer': 'Adam'}. Best is trial 89 with value: 0.13164335105783234.
2026-05-16 10:04:41,359 - experiment_functions - INFO - Early stopping at epoch 2200. Best Recall: 0.1297
2026-05-16 10:04:41,508 - optuna.study.study - INFO - Trial 99 finished with value: 0.12972368422974084 and parameters: {'n_layers': 1, 'embedding_dim': 256, 'lr': 0.000691442152093072, 'lambda_val': 8.500442472042406e-06, 'batch_size': 703, 'optimizer': 'Adam'}. Best is trial 89 with value: 0.13164335105783234.
2026-05-16 10:04:51,091 - optuna.study._optimize - INFO - Trial 100 pruned. 
2026-05-16 10:05:14,783 - experiment_functions - INFO - Early stopping at epoch 1850. Best Recall: 0.1263
2026-05-16 10:05:14,931 - optuna.study.study - INFO - Trial 101 finished with value: 0.12633452459633257 and parameters: {'n_layers': 1, 'embedding_dim': 256, 'lr': 0.0007107166161243229, 'lambda_val': 7.882084541230536e-06, 'batch_size': 689, 'optimizer': 'Adam'}. Best is trial 89 with value: 0.13164335105783234.
2026-05-16 10:05:28,432 - experiment_functions - INFO - Early stopping at epoch 1600. Best Recall: 0.1244
2026-05-16 10:05:28,568 - optuna.study.study - INFO - Trial 102 finished with value: 0.1243872044964773 and parameters: {'n_layers': 1, 'embedding_dim': 256, 'lr': 0.000695565345062336, 'lambda_val': 7.98603271963431e-06, 'batch_size': 703, 'optimizer': 'Adam'}. Best is trial 89 with value: 0.13164335105783234.
2026-05-16 10:05:44,480 - experiment_functions - INFO - Early stopping at epoch 1800. Best Recall: 0.1263
2026-05-16 10:05:44,574 - optuna.study.study - INFO - Trial 103 finished with value: 0.12633210598198968 and parameters: {'n_layers': 1, 'embedding_dim': 256, 'lr': 0.0006591600891038932, 'lambda_val': 8.251598044919333e-06, 'batch_size': 689, 'optimizer': 'Adam'}. Best is trial 89 with value: 0.13164335105783234.
2026-05-16 10:06:11,080 - experiment_functions - INFO - Early stopping at epoch 2850. Best Recall: 0.1330
2026-05-16 10:06:11,234 - optuna.study.study - INFO - Trial 104 finished with value: 0.1329929546883895 and parameters: {'n_layers': 1, 'embedding_dim': 256, 'lr': 0.000565035841344454, 'lambda_val': 7.523515324520463e-06, 'batch_size': 695, 'optimizer': 'Adam'}. Best is trial 104 with value: 0.1329929546883895.
2026-05-16 10:06:19,026 - optuna.study._optimize - INFO - Trial 105 pruned. 
2026-05-16 10:06:34,090 - optuna.study._optimize - INFO - Trial 106 pruned. 
2026-05-16 10:06:42,349 - optuna.study._optimize - INFO - Trial 107 pruned. 
2026-05-16 10:06:53,856 - optuna.study._optimize - INFO - Trial 108 pruned. 
2026-05-16 10:07:01,745 - experiment_functions - INFO - Early stopping at epoch 750. Best Recall: 0.1049
2026-05-16 10:07:02,343 - optuna.study.study - INFO - Trial 109 finished with value: 0.10490852125939107 and parameters: {'n_layers': 1, 'embedding_dim': 256, 'lr': 0.001402461083681188, 'lambda_val': 7.975500375036618e-06, 'batch_size': 1590, 'optimizer': 'Adam'}. Best is trial 104 with value: 0.1329929546883895.
2026-05-16 10:07:11,316 - optuna.study._optimize - INFO - Trial 110 pruned. 
2026-05-16 10:07:21,442 - optuna.study._optimize - INFO - Trial 111 pruned. 
2026-05-16 10:07:27,889 - optuna.study._optimize - INFO - Trial 112 pruned. 
2026-05-16 10:07:40,352 - experiment_functions - INFO - Early stopping at epoch 1900. Best Recall: 0.1287
2026-05-16 10:07:40,468 - optuna.study.study - INFO - Trial 113 finished with value: 0.12870317808421275 and parameters: {'n_layers': 1, 'embedding_dim': 256, 'lr': 0.0007232133725884603, 'lambda_val': 7.150668529767809e-06, 'batch_size': 866, 'optimizer': 'Adam'}. Best is trial 104 with value: 0.1329929546883895.
2026-05-16 10:07:55,897 - optuna.study._optimize - INFO - Trial 114 pruned. 
2026-05-16 10:08:08,466 - experiment_functions - INFO - Early stopping at epoch 1900. Best Recall: 0.1354
2026-05-16 10:08:08,564 - optuna.study.study - INFO - Trial 115 finished with value: 0.13538651527349915 and parameters: {'n_layers': 1, 'embedding_dim': 256, 'lr': 0.0005172385264710566, 'lambda_val': 2.4319059061145947e-06, 'batch_size': 1101, 'optimizer': 'Adam'}. Best is trial 115 with value: 0.13538651527349915.
2026-05-16 10:08:12,081 - experiment_functions - INFO - Early stopping at epoch 500. Best Recall: 0.0025
2026-05-16 10:08:12,180 - optuna.study.study - INFO - Trial 116 finished with value: 0.0024913526937422096 and parameters: {'n_layers': 1, 'embedding_dim': 256, 'lr': 0.0002655542107561569, 'lambda_val': 2.3306514040115704e-06, 'batch_size': 1247, 'optimizer': 'SGD'}. Best is trial 115 with value: 0.13538651527349915.
2026-05-16 10:08:31,373 - experiment_functions - INFO - Early stopping at epoch 2700. Best Recall: 0.1334
2026-05-16 10:08:31,489 - optuna.study.study - INFO - Trial 117 finished with value: 0.13340161037249373 and parameters: {'n_layers': 1, 'embedding_dim': 256, 'lr': 0.0005265484855803297, 'lambda_val': 6.326654555622983e-06, 'batch_size': 952, 'optimizer': 'Adam'}. Best is trial 115 with value: 0.13538651527349915.
2026-05-16 10:08:38,676 - optuna.study._optimize - INFO - Trial 118 pruned. 
2026-05-16 10:08:45,685 - optuna.study._optimize - INFO - Trial 119 pruned. 
2026-05-16 10:08:54,236 - optuna.study._optimize - INFO - Trial 120 pruned. 
2026-05-16 10:09:03,499 - experiment_functions - INFO - Early stopping at epoch 1300. Best Recall: 0.1260
2026-05-16 10:09:03,624 - optuna.study.study - INFO - Trial 121 finished with value: 0.12604458918306422 and parameters: {'n_layers': 1, 'embedding_dim': 256, 'lr': 0.0006946792405739789, 'lambda_val': 3.7671561471412796e-06, 'batch_size': 1440, 'optimizer': 'Adam'}. Best is trial 115 with value: 0.13538651527349915.
2026-05-16 10:09:10,875 - optuna.study._optimize - INFO - Trial 122 pruned. 
2026-05-16 10:09:20,267 - experiment_functions - INFO - Early stopping at epoch 1200. Best Recall: 0.1234
