2026-05-16 02:17:16,143 - optuna.study.study - INFO - Trial 183 finished with value: 0.11911968227667874 and parameters: {'n_layers': 1, 'embedding_dim': 256, 'lr': 0.0002972106175735567, 'lambda_val': 4.000007835478762e-05, 'batch_size': 3248, 'optimizer': 'RMSprop'}. Best is trial 161 with value: 0.12315039993592182.
2026-05-16 02:17:24,200 - optuna.study._optimize - INFO - Trial 184 pruned. 
2026-05-16 02:17:56,665 - optuna.study._optimize - INFO - Trial 185 pruned. 
2026-05-16 02:18:07,659 - optuna.study._optimize - INFO - Trial 186 pruned. 
2026-05-16 02:18:15,265 - optuna.study._optimize - INFO - Trial 187 pruned. 
2026-05-16 02:18:21,895 - optuna.study._optimize - INFO - Trial 188 pruned. 
2026-05-16 02:18:30,760 - optuna.study._optimize - INFO - Trial 189 pruned. 
2026-05-16 02:18:42,697 - experiment_functions - INFO - Early stopping at epoch 1750. Best Recall: 0.1188
2026-05-16 02:18:42,799 - optuna.study.study - INFO - Trial 190 finished with value: 0.11883622028977023 and parameters: {'n_layers': 1, 'embedding_dim': 256, 'lr': 0.00033313904584844926, 'lambda_val': 2.780401639723777e-05, 'batch_size': 2782, 'optimizer': 'RMSprop'}. Best is trial 161 with value: 0.12315039993592182.
2026-05-16 02:18:55,836 - experiment_functions - INFO - Early stopping at epoch 1600. Best Recall: 0.1135
2026-05-16 02:18:55,935 - optuna.study.study - INFO - Trial 191 finished with value: 0.11353845853300039 and parameters: {'n_layers': 1, 'embedding_dim': 256, 'lr': 0.00035597679463082396, 'lambda_val': 2.656528927264516e-05, 'batch_size': 2831, 'optimizer': 'RMSprop'}. Best is trial 161 with value: 0.12315039993592182.
2026-05-16 02:19:07,908 - experiment_functions - INFO - Early stopping at epoch 1750. Best Recall: 0.1181
2026-05-16 02:19:08,000 - optuna.study.study - INFO - Trial 192 finished with value: 0.11808147044217632 and parameters: {'n_layers': 1, 'embedding_dim': 256, 'lr': 0.0003349128687217272, 'lambda_val': 1.7258313057284736e-05, 'batch_size': 2706, 'optimizer': 'RMSprop'}. Best is trial 161 with value: 0.12315039993592182.
2026-05-16 02:19:17,468 - experiment_functions - INFO - Early stopping at epoch 1400. Best Recall: 0.1118
2026-05-16 02:19:17,571 - optuna.study.study - INFO - Trial 193 finished with value: 0.11176419114263987 and parameters: {'n_layers': 1, 'embedding_dim': 256, 'lr': 0.00038024455889299467, 'lambda_val': 1.2284814833023823e-05, 'batch_size': 2803, 'optimizer': 'RMSprop'}. Best is trial 161 with value: 0.12315039993592182.
2026-05-16 02:19:29,225 - experiment_functions - INFO - Early stopping at epoch 1650. Best Recall: 0.1105
2026-05-16 02:19:29,370 - optuna.study.study - INFO - Trial 194 finished with value: 0.11047258255097006 and parameters: {'n_layers': 1, 'embedding_dim': 256, 'lr': 0.0003355049477694138, 'lambda_val': 1.9883962712840212e-05, 'batch_size': 2679, 'optimizer': 'RMSprop'}. Best is trial 161 with value: 0.12315039993592182.
2026-05-16 02:19:38,634 - optuna.study._optimize - INFO - Trial 195 pruned. 
2026-05-16 02:19:47,597 - experiment_functions - INFO - Early stopping at epoch 1100. Best Recall: 0.1107
2026-05-16 02:19:47,719 - optuna.study.study - INFO - Trial 196 finished with value: 0.11071506667873658 and parameters: {'n_layers': 1, 'embedding_dim': 256, 'lr': 0.0005368929362170629, 'lambda_val': 1.555488136302528e-05, 'batch_size': 2721, 'optimizer': 'RMSprop'}. Best is trial 161 with value: 0.12315039993592182.
2026-05-16 02:19:54,645 - optuna.study._optimize - INFO - Trial 197 pruned. 
2026-05-16 02:20:04,330 - experiment_functions - INFO - Early stopping at epoch 1250. Best Recall: 0.1082
2026-05-16 02:20:04,430 - optuna.study.study - INFO - Trial 198 finished with value: 0.10817862197822033 and parameters: {'n_layers': 1, 'embedding_dim': 256, 'lr': 0.0004436132364805423, 'lambda_val': 1.7994274904523537e-05, 'batch_size': 2941, 'optimizer': 'RMSprop'}. Best is trial 161 with value: 0.12315039993592182.
2026-05-16 02:20:11,182 - optuna.study._optimize - INFO - Trial 199 pruned. 
2026-05-16 02:20:18,656 - optuna.study._optimize - INFO - Trial 200 pruned. 
2026-05-16 02:20:26,465 - optuna.study._optimize - INFO - Trial 201 pruned. 
2026-05-16 02:20:37,946 - experiment_functions - INFO - Early stopping at epoch 1750. Best Recall: 0.1135
2026-05-16 02:20:38,027 - optuna.study.study - INFO - Trial 202 finished with value: 0.11352427885332386 and parameters: {'n_layers': 1, 'embedding_dim': 256, 'lr': 0.0003744462709140046, 'lambda_val': 3.621181791464168e-05, 'batch_size': 2992, 'optimizer': 'RMSprop'}. Best is trial 161 with value: 0.12315039993592182.
2026-05-16 02:20:46,505 - experiment_functions - INFO - Early stopping at epoch 1200. Best Recall: 0.1116
2026-05-16 02:20:46,608 - optuna.study.study - INFO - Trial 203 finished with value: 0.11157803470073954 and parameters: {'n_layers': 1, 'embedding_dim': 256, 'lr': 0.0003795413056877235, 'lambda_val': 2.880986587880202e-05, 'batch_size': 3022, 'optimizer': 'RMSprop'}. Best is trial 161 with value: 0.12315039993592182.
2026-05-16 02:20:57,197 - experiment_functions - INFO - Early stopping at epoch 1500. Best Recall: 0.1108
2026-05-16 02:20:57,367 - optuna.study.study - INFO - Trial 204 finished with value: 0.1108252862805245 and parameters: {'n_layers': 1, 'embedding_dim': 256, 'lr': 0.0005087288516235708, 'lambda_val': 1.0734112868419864e-05, 'batch_size': 2935, 'optimizer': 'RMSprop'}. Best is trial 161 with value: 0.12315039993592182.
2026-05-16 02:21:10,013 - experiment_functions - INFO - Early stopping at epoch 1200. Best Recall: 0.1177
2026-05-16 02:21:10,116 - optuna.study.study - INFO - Trial 205 finished with value: 0.11767555223410442 and parameters: {'n_layers': 1, 'embedding_dim': 256, 'lr': 0.0003960837221295805, 'lambda_val': 2.246773161833045e-05, 'batch_size': 2983, 'optimizer': 'RMSprop'}. Best is trial 161 with value: 0.12315039993592182.
2026-05-16 02:21:14,910 - experiment_functions - INFO - Early stopping at epoch 500. Best Recall: 0.0010
2026-05-16 02:21:15,012 - optuna.study.study - INFO - Trial 206 finished with value: 0.0010056453912435726 and parameters: {'n_layers': 1, 'embedding_dim': 256, 'lr': 0.0003498377438220571, 'lambda_val': 2.1663688962569628e-05, 'batch_size': 2967, 'optimizer': 'SGD'}. Best is trial 161 with value: 0.12315039993592182.
2026-05-16 02:21:23,453 - optuna.study._optimize - INFO - Trial 207 pruned. 
2026-05-16 02:21:34,363 - experiment_functions - INFO - Early stopping at epoch 1750. Best Recall: 0.1138
2026-05-16 02:21:34,463 - optuna.study.study - INFO - Trial 208 finished with value: 0.1137693894573831 and parameters: {'n_layers': 1, 'embedding_dim': 256, 'lr': 0.00041304389523090653, 'lambda_val': 2.1865263148987997e-05, 'batch_size': 2300, 'optimizer': 'RMSprop'}. Best is trial 161 with value: 0.12315039993592182.
2026-05-16 02:21:46,981 - optuna.study._optimize - INFO - Trial 209 pruned. 
2026-05-16 02:22:08,302 - experiment_functions - INFO - Early stopping at epoch 2500. Best Recall: 0.1266
2026-05-16 02:22:08,422 - optuna.study.study - INFO - Trial 210 finished with value: 0.12664341461242476 and parameters: {'n_layers': 1, 'embedding_dim': 256, 'lr': 0.00027081174318157334, 'lambda_val': 2.2446810031099198e-05, 'batch_size': 2840, 'optimizer': 'RMSprop'}. Best is trial 210 with value: 0.12664341461242476.
2026-05-16 02:22:18,167 - optuna.study._optimize - INFO - Trial 211 pruned. 
2026-05-16 02:22:33,624 - experiment_functions - INFO - Early stopping at epoch 1800. Best Recall: 0.1207
2026-05-16 02:22:33,714 - optuna.study.study - INFO - Trial 212 finished with value: 0.12071064874433224 and parameters: {'n_layers': 1, 'embedding_dim': 256, 'lr': 0.00032025810278333644, 'lambda_val': 1.698316376310048e-05, 'batch_size': 2835, 'optimizer': 'RMSprop'}. Best is trial 210 with value: 0.12664341461242476.
2026-05-16 02:22:48,429 - experiment_functions - INFO - Early stopping at epoch 2200. Best Recall: 0.1158
2026-05-16 02:22:48,530 - optuna.study.study - INFO - Trial 213 finished with value: 0.11583302277818475 and parameters: {'n_layers': 1, 'embedding_dim': 256, 'lr': 0.00031242210082775166, 'lambda_val': 1.79672750409947e-05, 'batch_size': 2810, 'optimizer': 'RMSprop'}. Best is trial 210 with value: 0.12664341461242476.
2026-05-16 02:22:55,312 - optuna.study._optimize - INFO - Trial 214 pruned. 
2026-05-16 02:23:08,208 - optuna.study._optimize - INFO - Trial 215 pruned. 
2026-05-16 02:23:23,040 - optuna.study._optimize - INFO - Trial 216 pruned. 
2026-05-16 02:23:29,412 - optuna.study._optimize - INFO - Trial 217 pruned. 
2026-05-16 02:23:40,085 - experiment_functions - INFO - Early stopping at epoch 1700. Best Recall: 0.1144
2026-05-16 02:23:40,184 - optuna.study.study - INFO - Trial 218 finished with value: 0.1143772857441857 and parameters: {'n_layers': 1, 'embedding_dim': 256, 'lr': 0.0003176957716655998, 'lambda_val': 1.1232609875419386e-05, 'batch_size': 2568, 'optimizer': 'RMSprop'}. Best is trial 210 with value: 0.12664341461242476.
2026-05-16 02:23:54,056 - experiment_functions - INFO - Early stopping at epoch 2350. Best Recall: 0.1199
2026-05-16 02:23:54,137 - optuna.study.study - INFO - Trial 219 finished with value: 0.11988491072477306 and parameters: {'n_layers': 1, 'embedding_dim': 256, 'lr': 0.000327133212179376, 'lambda_val': 9.501208914028019e-06, 'batch_size': 2564, 'optimizer': 'RMSprop'}. Best is trial 210 with value: 0.12664341461242476.
2026-05-16 02:24:11,592 - optuna.study._optimize - INFO - Trial 220 pruned. 
2026-05-16 02:24:18,305 - optuna.study._optimize - INFO - Trial 221 pruned. 
2026-05-16 02:24:24,799 - optuna.study._optimize - INFO - Trial 222 pruned. 
2026-05-16 02:24:33,148 - optuna.study._optimize - INFO - Trial 223 pruned. 
2026-05-16 02:24:40,198 - optuna.study._optimize - INFO - Trial 224 pruned. 
2026-05-16 02:24:47,225 - optuna.study._optimize - INFO - Trial 225 pruned. 
2026-05-16 02:25:00,368 - experiment_functions - INFO - Early stopping at epoch 2200. Best Recall: 0.1163
2026-05-16 02:25:00,468 - optuna.study.study - INFO - Trial 226 finished with value: 0.1162712866144735 and parameters: {'n_layers': 1, 'embedding_dim': 256, 'lr': 0.0003245699001657022, 'lambda_val': 2.777316960032757e-05, 'batch_size': 2571, 'optimizer': 'RMSprop'}. Best is trial 210 with value: 0.12664341461242476.
2026-05-16 02:25:07,081 - optuna.study._optimize - INFO - Trial 227 pruned. 
2026-05-16 02:25:13,777 - optuna.study._optimize - INFO - Trial 228 pruned. 
2026-05-16 02:25:19,499 - optuna.study._optimize - INFO - Trial 229 pruned. 
2026-05-16 02:25:27,824 - experiment_functions - INFO - Early stopping at epoch 1300. Best Recall: 0.1126
2026-05-16 02:25:27,957 - optuna.study.study - INFO - Trial 230 finished with value: 0.11255424288232169 and parameters: {'n_layers': 1, 'embedding_dim': 256, 'lr': 0.00038104203064894085, 'lambda_val': 2.8295507692945446e-05, 'batch_size': 3050, 'optimizer': 'RMSprop'}. Best is trial 210 with value: 0.12664341461242476.
2026-05-16 02:25:49,890 - experiment_functions - INFO - Early stopping at epoch 2200. Best Recall: 0.1221
2026-05-16 02:25:50,026 - optuna.study.study - INFO - Trial 231 finished with value: 0.12209263770422309 and parameters: {'n_layers': 1, 'embedding_dim': 256, 'lr': 0.0003349473711981583, 'lambda_val': 4.2650708317474864e-05, 'batch_size': 2375, 'optimizer': 'RMSprop'}. Best is trial 210 with value: 0.12664341461242476.
2026-05-16 02:25:56,605 - optuna.study._optimize - INFO - Trial 232 pruned. 
2026-05-16 02:26:03,125 - optuna.study._optimize - INFO - Trial 233 pruned. 
2026-05-16 02:26:09,578 - optuna.study._optimize - INFO - Trial 234 pruned. 
2026-05-16 02:26:22,138 - experiment_functions - INFO - Early stopping at epoch 1550. Best Recall: 0.1231
2026-05-16 02:26:22,239 - optuna.study.study - INFO - Trial 235 finished with value: 0.12305003584333242 and parameters: {'n_layers': 1, 'embedding_dim': 256, 'lr': 0.0004075912491204909, 'lambda_val': 1.7876713851492826e-05, 'batch_size': 2489, 'optimizer': 'RMSprop'}. Best is trial 210 with value: 0.12664341461242476.
2026-05-16 02:26:28,267 - experiment_functions - INFO - Early stopping at epoch 800. Best Recall: 0.0717
2026-05-16 02:26:28,358 - optuna.study.study - INFO - Trial 236 finished with value: 0.07169031642540728 and parameters: {'n_layers': 2, 'embedding_dim': 256, 'lr': 0.00044941696152848136, 'lambda_val': 1.626950857608246e-05, 'batch_size': 2576, 'optimizer': 'RMSprop'}. Best is trial 210 with value: 0.12664341461242476.
2026-05-16 02:26:35,417 - optuna.study._optimize - INFO - Trial 237 pruned. 
2026-05-16 02:26:50,385 - optuna.study._optimize - INFO - Trial 238 pruned. 
2026-05-16 02:26:57,469 - optuna.study._optimize - INFO - Trial 239 pruned. 
2026-05-16 02:27:04,633 - optuna.study._optimize - INFO - Trial 240 pruned. 
2026-05-16 02:27:15,351 - experiment_functions - INFO - Early stopping at epoch 1600. Best Recall: 0.1180
2026-05-16 02:27:15,472 - optuna.study.study - INFO - Trial 241 finished with value: 0.11798399602338638 and parameters: {'n_layers': 1, 'embedding_dim': 256, 'lr': 0.0003943070263709276, 'lambda_val': 1.8715508087661546e-05, 'batch_size': 2879, 'optimizer': 'RMSprop'}. Best is trial 210 with value: 0.12664341461242476.
2026-05-16 02:27:27,015 - experiment_functions - INFO - Early stopping at epoch 1850. Best Recall: 0.1184
2026-05-16 02:27:27,115 - optuna.study.study - INFO - Trial 242 finished with value: 0.11841449679415222 and parameters: {'n_layers': 1, 'embedding_dim': 256, 'lr': 0.00041112460092547536, 'lambda_val': 1.9746920565328058e-05, 'batch_size': 2862, 'optimizer': 'RMSprop'}. Best is trial 210 with value: 0.12664341461242476.
2026-05-16 02:27:46,098 - experiment_functions - INFO - Early stopping at epoch 1350. Best Recall: 0.1165
2026-05-16 02:27:46,198 - optuna.study.study - INFO - Trial 243 finished with value: 0.11648361769239571 and parameters: {'n_layers': 1, 'embedding_dim': 256, 'lr': 0.0005226771778319227, 'lambda_val': 1.7890897523862678e-05, 'batch_size': 2364, 'optimizer': 'RMSprop'}. Best is trial 210 with value: 0.12664341461242476.
2026-05-16 02:27:54,605 - experiment_functions - INFO - Early stopping at epoch 1150. Best Recall: 0.1136
2026-05-16 02:27:54,715 - optuna.study.study - INFO - Trial 244 finished with value: 0.11359141959086583 and parameters: {'n_layers': 1, 'embedding_dim': 256, 'lr': 0.0005238559182855305, 'lambda_val': 1.5323941620443905e-05, 'batch_size': 2367, 'optimizer': 'RMSprop'}. Best is trial 210 with value: 0.12664341461242476.
2026-05-16 02:28:05,557 - experiment_functions - INFO - Early stopping at epoch 1750. Best Recall: 0.1128
2026-05-16 02:28:05,673 - optuna.study.study - INFO - Trial 245 finished with value: 0.11283235502356592 and parameters: {'n_layers': 1, 'embedding_dim': 256, 'lr': 0.0004653911100365788, 'lambda_val': 1.734933161107335e-05, 'batch_size': 2901, 'optimizer': 'RMSprop'}. Best is trial 210 with value: 0.12664341461242476.
2026-05-16 02:28:09,528 - experiment_functions - INFO - Early stopping at epoch 500. Best Recall: 0.0048
2026-05-16 02:28:09,620 - optuna.study.study - INFO - Trial 246 finished with value: 0.004757640602327821 and parameters: {'n_layers': 1, 'embedding_dim': 256, 'lr': 0.0002764527449764458, 'lambda_val': 1.2080591006787925e-05, 'batch_size': 2659, 'optimizer': 'SGD'}. Best is trial 210 with value: 0.12664341461242476.
2026-05-16 02:28:16,276 - optuna.study._optimize - INFO - Trial 247 pruned. 
2026-05-16 02:28:27,399 - experiment_functions - INFO - Early stopping at epoch 1800. Best Recall: 0.1162
2026-05-16 02:28:27,489 - optuna.study.study - INFO - Trial 248 finished with value: 0.1161814363203354 and parameters: {'n_layers': 1, 'embedding_dim': 256, 'lr': 0.0003203898075196014, 'lambda_val': 1.9157141157416996e-05, 'batch_size': 2774, 'optimizer': 'RMSprop'}. Best is trial 210 with value: 0.12664341461242476.
2026-05-16 02:28:36,874 - optuna.study._optimize - INFO - Trial 249 pruned. 
2026-05-16 02:28:43,931 - optuna.study._optimize - INFO - Trial 250 pruned. 
2026-05-16 02:29:08,929 - experiment_functions - INFO - Early stopping at epoch 2400. Best Recall: 0.1264
2026-05-16 02:29:09,020 - optuna.study.study - INFO - Trial 251 finished with value: 0.1264332658617755 and parameters: {'n_layers': 1, 'embedding_dim': 256, 'lr': 0.0003032211689845562, 'lambda_val': 1.9647703665267866e-05, 'batch_size': 2888, 'optimizer': 'RMSprop'}. Best is trial 210 with value: 0.12664341461242476.
2026-05-16 02:29:15,451 - optuna.study._optimize - INFO - Trial 252 pruned. 
2026-05-16 02:29:22,821 - optuna.study._optimize - INFO - Trial 253 pruned. 
2026-05-16 02:29:32,039 - optuna.study._optimize - INFO - Trial 254 pruned. 
2026-05-16 02:29:39,045 - optuna.study._optimize - INFO - Trial 255 pruned. 
2026-05-16 02:29:49,279 - experiment_functions - INFO - Early stopping at epoch 1600. Best Recall: 0.1174
2026-05-16 02:29:49,370 - optuna.study.study - INFO - Trial 256 finished with value: 0.11737803594589653 and parameters: {'n_layers': 1, 'embedding_dim': 256, 'lr': 0.0003252836653582919, 'lambda_val': 3.0510155265242738e-05, 'batch_size': 2771, 'optimizer': 'RMSprop'}. Best is trial 210 with value: 0.12664341461242476.
2026-05-16 02:30:07,333 - experiment_functions - INFO - Early stopping at epoch 1200. Best Recall: 0.1116
2026-05-16 02:30:07,433 - optuna.study.study - INFO - Trial 257 finished with value: 0.11161931339408183 and parameters: {'n_layers': 1, 'embedding_dim': 256, 'lr': 0.0004544588166674833, 'lambda_val': 3.162389159913933e-05, 'batch_size': 2735, 'optimizer': 'RMSprop'}. Best is trial 210 with value: 0.12664341461242476.
2026-05-16 02:30:17,266 - optuna.study._optimize - INFO - Trial 258 pruned. 
2026-05-16 02:30:24,002 - optuna.study._optimize - INFO - Trial 259 pruned. 
2026-05-16 02:30:30,672 - optuna.study._optimize - INFO - Trial 260 pruned. 
2026-05-16 02:30:43,649 - experiment_functions - INFO - Early stopping at epoch 1000. Best Recall: 0.1096
2026-05-16 02:30:44,412 - optuna.study.study - INFO - Trial 261 finished with value: 0.10961455349774914 and parameters: {'n_layers': 1, 'embedding_dim': 256, 'lr': 0.000562647781847888, 'lambda_val': 7.036843749735004e-05, 'batch_size': 2732, 'optimizer': 'RMSprop'}. Best is trial 210 with value: 0.12664341461242476.
2026-05-16 02:30:54,220 - optuna.study._optimize - INFO - Trial 262 pruned. 
2026-05-16 02:31:03,486 - experiment_functions - INFO - Early stopping at epoch 1500. Best Recall: 0.1126
2026-05-16 02:31:04,061 - optuna.study.study - INFO - Trial 263 finished with value: 0.1126022758451165 and parameters: {'n_layers': 1, 'embedding_dim': 256, 'lr': 0.0004228180342570002, 'lambda_val': 3.0648675320303884e-05, 'batch_size': 2950, 'optimizer': 'RMSprop'}. Best is trial 210 with value: 0.12664341461242476.
2026-05-16 02:31:10,810 - optuna.study._optimize - INFO - Trial 264 pruned. 
2026-05-16 02:31:20,035 - optuna.study._optimize - INFO - Trial 265 pruned. 
2026-05-16 02:31:34,295 - experiment_functions - INFO - Early stopping at epoch 2350. Best Recall: 0.1238
2026-05-16 02:31:34,396 - optuna.study.study - INFO - Trial 266 finished with value: 0.12383338253275561 and parameters: {'n_layers': 1, 'embedding_dim': 256, 'lr': 0.00034013691945808974, 'lambda_val': 0.0001347141702726671, 'batch_size': 2687, 'optimizer': 'RMSprop'}. Best is trial 210 with value: 0.12664341461242476.
2026-05-16 02:31:41,700 - optuna.study._optimize - INFO - Trial 267 pruned. 
2026-05-16 02:31:50,094 - experiment_functions - INFO - Early stopping at epoch 1300. Best Recall: 0.1105
2026-05-16 02:31:50,180 - optuna.study.study - INFO - Trial 268 finished with value: 0.11048716383064457 and parameters: {'n_layers': 1, 'embedding_dim': 256, 'lr': 0.00045029436517940896, 'lambda_val': 0.00013939664186140852, 'batch_size': 2829, 'optimizer': 'RMSprop'}. Best is trial 210 with value: 0.12664341461242476.
2026-05-16 02:32:00,298 - experiment_functions - INFO - Early stopping at epoch 1600. Best Recall: 0.1223
2026-05-16 02:32:00,377 - optuna.study.study - INFO - Trial 269 finished with value: 0.12233963791308655 and parameters: {'n_layers': 1, 'embedding_dim': 256, 'lr': 0.00035753130943981493, 'lambda_val': 1.4732491016661127e-05, 'batch_size': 2710, 'optimizer': 'RMSprop'}. Best is trial 210 with value: 0.12664341461242476.
2026-05-16 02:32:18,544 - experiment_functions - INFO - Early stopping at epoch 1300. Best Recall: 0.1160
2026-05-16 02:32:18,660 - optuna.study.study - INFO - Trial 270 finished with value: 0.1159879858937299 and parameters: {'n_layers': 1, 'embedding_dim': 256, 'lr': 0.0005581039177455093, 'lambda_val': 1.453258257363554e-05, 'batch_size': 2690, 'optimizer': 'RMSprop'}. Best is trial 210 with value: 0.12664341461242476.
2026-05-16 02:32:22,369 - experiment_functions - INFO - Early stopping at epoch 500. Best Recall: 0.0014
2026-05-16 02:32:22,480 - optuna.study.study - INFO - Trial 271 finished with value: 0.0013878826658107338 and parameters: {'n_layers': 1, 'embedding_dim': 256, 'lr': 0.0006184004045125271, 'lambda_val': 0.00010851463697633928, 'batch_size': 2604, 'optimizer': 'SGD'}. Best is trial 210 with value: 0.12664341461242476.
2026-05-16 02:32:32,464 - optuna.study._optimize - INFO - Trial 272 pruned. 
2026-05-16 02:32:39,206 - optuna.study._optimize - INFO - Trial 273 pruned. 
2026-05-16 02:32:48,347 - experiment_functions - INFO - Early stopping at epoch 1400. Best Recall: 0.1128
2026-05-16 02:32:48,438 - optuna.study.study - INFO - Trial 274 finished with value: 0.1127781773583107 and parameters: {'n_layers': 1, 'embedding_dim': 256, 'lr': 0.00040460827972822375, 'lambda_val': 1.6551478836922825e-05, 'batch_size': 2759, 'optimizer': 'RMSprop'}. Best is trial 210 with value: 0.12664341461242476.
2026-05-16 02:33:00,033 - experiment_functions - INFO - Early stopping at epoch 1950. Best Recall: 0.1179
