2026-05-16 08:19:02,287 - optuna.study.study - INFO - Trial 299 finished with value: 0.03725859215893024 and parameters: {'n_layers': 1, 'embedding_dim': 256, 'lr': 0.029699495639193694, 'lambda_val': 3.441719860984705e-06, 'batch_size': 1003, 'optimizer': 'Adam'}. Best is trial 292 with value: 0.1351310345871218.
2026-05-16 08:19:13,222 - experiment_functions - INFO - Early stopping at epoch 3000. Best Recall: 0.1256
2026-05-16 08:19:13,338 - root - INFO -   **** Training e_100K_1c3dcs_rand3
2026-05-16 08:19:13,353 - root - INFO -   **** Getting 70319/81200 random edges
2026-05-16 08:19:13,513 - optuna.storages._rdb.storage - INFO - A new study created in RDB with name: Study_e_100K_1c3dcs_rand3
2026-05-16 08:19:17,545 - experiment_functions - INFO - Early stopping at epoch 500. Best Recall: 0.0017
2026-05-16 08:19:17,665 - optuna.study.study - INFO - Trial 0 finished with value: 0.0016621124375807298 and parameters: {'n_layers': 3, 'embedding_dim': 128, 'lr': 0.08673794805275913, 'lambda_val': 1.3493941830303417e-06, 'batch_size': 523, 'optimizer': 'SGD'}. Best is trial 0 with value: 0.0016621124375807298.
2026-05-16 08:19:24,222 - experiment_functions - INFO - Early stopping at epoch 900. Best Recall: 0.0629
2026-05-16 08:19:24,333 - optuna.study.study - INFO - Trial 1 finished with value: 0.0628537860411022 and parameters: {'n_layers': 2, 'embedding_dim': 96, 'lr': 0.0008091441950342631, 'lambda_val': 1.9194605396899262e-06, 'batch_size': 3864, 'optimizer': 'Adam'}. Best is trial 1 with value: 0.0628537860411022.
2026-05-16 08:19:47,440 - experiment_functions - INFO - Early stopping at epoch 3750. Best Recall: 0.1161
2026-05-16 08:19:47,576 - optuna.study.study - INFO - Trial 2 finished with value: 0.11614329531806798 and parameters: {'n_layers': 1, 'embedding_dim': 96, 'lr': 0.0004210782705671681, 'lambda_val': 2.834933046981033e-05, 'batch_size': 1196, 'optimizer': 'Adam'}. Best is trial 2 with value: 0.11614329531806798.
2026-05-16 08:19:52,522 - experiment_functions - INFO - Early stopping at epoch 650. Best Recall: 0.0335
2026-05-16 08:19:52,677 - optuna.study.study - INFO - Trial 3 finished with value: 0.033481919365606606 and parameters: {'n_layers': 2, 'embedding_dim': 96, 'lr': 0.00844764464742273, 'lambda_val': 1.9458744754193096e-05, 'batch_size': 3856, 'optimizer': 'RMSprop'}. Best is trial 2 with value: 0.11614329531806798.
2026-05-16 08:19:58,421 - experiment_functions - INFO - Early stopping at epoch 950. Best Recall: 0.0571
2026-05-16 08:19:58,522 - optuna.study.study - INFO - Trial 4 finished with value: 0.057058954001743115 and parameters: {'n_layers': 2, 'embedding_dim': 64, 'lr': 0.0006508122940657035, 'lambda_val': 7.021361505464347e-05, 'batch_size': 2168, 'optimizer': 'RMSprop'}. Best is trial 2 with value: 0.11614329531806798.
2026-05-16 08:20:05,210 - optuna.study._optimize - INFO - Trial 5 pruned. 
2026-05-16 08:20:10,440 - experiment_functions - INFO - Early stopping at epoch 600. Best Recall: 0.1065
2026-05-16 08:20:10,550 - optuna.study.study - INFO - Trial 6 finished with value: 0.10648336339171498 and parameters: {'n_layers': 1, 'embedding_dim': 256, 'lr': 0.002634760507816718, 'lambda_val': 1.278363819201523e-05, 'batch_size': 3042, 'optimizer': 'Adam'}. Best is trial 2 with value: 0.11614329531806798.
2026-05-16 08:20:25,721 - experiment_functions - INFO - Early stopping at epoch 600. Best Recall: 0.0264
2026-05-16 08:20:25,831 - optuna.study.study - INFO - Trial 7 finished with value: 0.02637138403263944 and parameters: {'n_layers': 3, 'embedding_dim': 256, 'lr': 0.00753337783075469, 'lambda_val': 0.001087228133116825, 'batch_size': 1616, 'optimizer': 'RMSprop'}. Best is trial 2 with value: 0.11614329531806798.
2026-05-16 08:20:30,361 - experiment_functions - INFO - Early stopping at epoch 500. Best Recall: 0.0023
2026-05-16 08:20:30,525 - optuna.study.study - INFO - Trial 8 finished with value: 0.0023120354055171798 and parameters: {'n_layers': 4, 'embedding_dim': 128, 'lr': 1.575714936466936e-05, 'lambda_val': 0.021791511711840884, 'batch_size': 537, 'optimizer': 'SGD'}. Best is trial 2 with value: 0.11614329531806798.
2026-05-16 08:20:37,666 - optuna.study._optimize - INFO - Trial 9 pruned. 
2026-05-16 08:20:41,020 - experiment_functions - INFO - Early stopping at epoch 500. Best Recall: 0.0021
2026-05-16 08:20:41,121 - optuna.study.study - INFO - Trial 10 finished with value: 0.0020967878840321523 and parameters: {'n_layers': 1, 'embedding_dim': 96, 'lr': 0.00013561803124643312, 'lambda_val': 0.050537302282312284, 'batch_size': 1450, 'optimizer': 'Adam'}. Best is trial 2 with value: 0.11614329531806798.
2026-05-16 08:20:53,284 - experiment_functions - INFO - Early stopping at epoch 550. Best Recall: 0.0779
2026-05-16 08:20:54,045 - optuna.study.study - INFO - Trial 11 finished with value: 0.07788570049245279 and parameters: {'n_layers': 1, 'embedding_dim': 256, 'lr': 0.010127206765560419, 'lambda_val': 9.625268295201628e-06, 'batch_size': 3061, 'optimizer': 'Adam'}. Best is trial 2 with value: 0.11614329531806798.
2026-05-16 08:20:59,710 - experiment_functions - INFO - Early stopping at epoch 600. Best Recall: 0.1253
2026-05-16 08:20:59,812 - optuna.study.study - INFO - Trial 12 finished with value: 0.12527215514243084 and parameters: {'n_layers': 1, 'embedding_dim': 256, 'lr': 0.002930565935550571, 'lambda_val': 1.679352433556278e-05, 'batch_size': 2656, 'optimizer': 'Adam'}. Best is trial 12 with value: 0.12527215514243084.
2026-05-16 08:21:06,422 - optuna.study._optimize - INFO - Trial 13 pruned. 
2026-05-16 08:21:09,927 - experiment_functions - INFO - Early stopping at epoch 500. Best Recall: 0.0020
2026-05-16 08:21:10,113 - optuna.study.study - INFO - Trial 14 finished with value: 0.0020426855340954413 and parameters: {'n_layers': 1, 'embedding_dim': 32, 'lr': 0.0017935334515796432, 'lambda_val': 4.009801403796377e-05, 'batch_size': 1657, 'optimizer': 'SGD'}. Best is trial 12 with value: 0.12527215514243084.
2026-05-16 08:21:18,344 - optuna.study._optimize - INFO - Trial 15 pruned. 
2026-05-16 08:21:26,775 - optuna.study._optimize - INFO - Trial 16 pruned. 
2026-05-16 08:21:34,180 - optuna.study._optimize - INFO - Trial 17 pruned. 
2026-05-16 08:21:40,411 - optuna.study._optimize - INFO - Trial 18 pruned. 
2026-05-16 08:21:44,426 - experiment_functions - INFO - Early stopping at epoch 500. Best Recall: 0.0011
2026-05-16 08:21:44,581 - optuna.study.study - INFO - Trial 19 finished with value: 0.0010581938292285335 and parameters: {'n_layers': 2, 'embedding_dim': 32, 'lr': 0.002851041669827364, 'lambda_val': 2.969211309446192e-05, 'batch_size': 2657, 'optimizer': 'SGD'}. Best is trial 12 with value: 0.12527215514243084.
2026-05-16 08:22:01,132 - optuna.study._optimize - INFO - Trial 20 pruned. 
2026-05-16 08:22:05,754 - experiment_functions - INFO - Early stopping at epoch 650. Best Recall: 0.1077
2026-05-16 08:22:05,845 - optuna.study.study - INFO - Trial 21 finished with value: 0.10774881653626286 and parameters: {'n_layers': 1, 'embedding_dim': 256, 'lr': 0.0021709045862917807, 'lambda_val': 1.189724220742987e-05, 'batch_size': 3135, 'optimizer': 'Adam'}. Best is trial 12 with value: 0.12527215514243084.
2026-05-16 08:22:10,987 - experiment_functions - INFO - Early stopping at epoch 700. Best Recall: 0.1062
2026-05-16 08:22:11,089 - optuna.study.study - INFO - Trial 22 finished with value: 0.10619137303349382 and parameters: {'n_layers': 1, 'embedding_dim': 256, 'lr': 0.0014863668368716525, 'lambda_val': 5.586971612090298e-06, 'batch_size': 3253, 'optimizer': 'Adam'}. Best is trial 12 with value: 0.12527215514243084.
2026-05-16 08:22:15,270 - experiment_functions - INFO - Early stopping at epoch 550. Best Recall: 0.0972
2026-05-16 08:22:15,370 - optuna.study.study - INFO - Trial 23 finished with value: 0.09716550531536257 and parameters: {'n_layers': 1, 'embedding_dim': 256, 'lr': 0.004362701017436002, 'lambda_val': 5.06604658251874e-05, 'batch_size': 1953, 'optimizer': 'Adam'}. Best is trial 12 with value: 0.12527215514243084.
2026-05-16 08:22:23,013 - optuna.study._optimize - INFO - Trial 24 pruned. 
2026-05-16 08:22:30,911 - optuna.study._optimize - INFO - Trial 25 pruned. 
2026-05-16 08:22:35,879 - experiment_functions - INFO - Early stopping at epoch 600. Best Recall: 0.0653
2026-05-16 08:22:35,969 - optuna.study.study - INFO - Trial 26 finished with value: 0.06531962715917178 and parameters: {'n_layers': 2, 'embedding_dim': 256, 'lr': 0.0013456167187592548, 'lambda_val': 0.0005895105789704464, 'batch_size': 2960, 'optimizer': 'Adam'}. Best is trial 12 with value: 0.12527215514243084.
2026-05-16 08:22:42,868 - experiment_functions - INFO - Early stopping at epoch 1000. Best Recall: 0.1164
2026-05-16 08:22:42,959 - optuna.study.study - INFO - Trial 27 finished with value: 0.11639557790036269 and parameters: {'n_layers': 1, 'embedding_dim': 256, 'lr': 0.0006496086421720181, 'lambda_val': 8.455434087218388e-05, 'batch_size': 4061, 'optimizer': 'Adam'}. Best is trial 12 with value: 0.12527215514243084.
2026-05-16 08:22:46,835 - experiment_functions - INFO - Early stopping at epoch 500. Best Recall: 0.0020
2026-05-16 08:22:46,935 - optuna.study.study - INFO - Trial 28 finished with value: 0.0019588641883735015 and parameters: {'n_layers': 3, 'embedding_dim': 96, 'lr': 0.0006737714831044878, 'lambda_val': 0.00017346855600833903, 'batch_size': 4011, 'optimizer': 'SGD'}. Best is trial 12 with value: 0.12527215514243084.
2026-05-16 08:22:53,432 - optuna.study._optimize - INFO - Trial 29 pruned. 
2026-05-16 08:22:56,892 - experiment_functions - INFO - Early stopping at epoch 500. Best Recall: 0.0019
2026-05-16 08:22:56,983 - optuna.study.study - INFO - Trial 30 finished with value: 0.0018712501118436627 and parameters: {'n_layers': 2, 'embedding_dim': 32, 'lr': 6.054191758390525e-05, 'lambda_val': 0.0003256266935140896, 'batch_size': 3611, 'optimizer': 'SGD'}. Best is trial 12 with value: 0.12527215514243084.
2026-05-16 08:23:05,430 - experiment_functions - INFO - Early stopping at epoch 550. Best Recall: 0.1003
2026-05-16 08:23:05,742 - optuna.study.study - INFO - Trial 31 finished with value: 0.10034560610650972 and parameters: {'n_layers': 1, 'embedding_dim': 256, 'lr': 0.003910989101792553, 'lambda_val': 8.442153023620778e-06, 'batch_size': 3563, 'optimizer': 'Adam'}. Best is trial 12 with value: 0.12527215514243084.
2026-05-16 08:23:12,821 - experiment_functions - INFO - Early stopping at epoch 1050. Best Recall: 0.1145
2026-05-16 08:23:12,922 - optuna.study.study - INFO - Trial 32 finished with value: 0.11449017431804279 and parameters: {'n_layers': 1, 'embedding_dim': 256, 'lr': 0.0007107130827926138, 'lambda_val': 1.6229573235265126e-06, 'batch_size': 4075, 'optimizer': 'Adam'}. Best is trial 12 with value: 0.12527215514243084.
2026-05-16 08:23:20,241 - experiment_functions - INFO - Early stopping at epoch 1050. Best Recall: 0.1198
2026-05-16 08:23:20,364 - optuna.study.study - INFO - Trial 33 finished with value: 0.11977174143879465 and parameters: {'n_layers': 1, 'embedding_dim': 256, 'lr': 0.0006830179159841372, 'lambda_val': 1.1141021086167205e-06, 'batch_size': 4038, 'optimizer': 'Adam'}. Best is trial 12 with value: 0.12527215514243084.
2026-05-16 08:23:27,829 - optuna.study._optimize - INFO - Trial 34 pruned. 
2026-05-16 08:23:38,868 - experiment_functions - INFO - Early stopping at epoch 750. Best Recall: 0.0840
2026-05-16 08:23:39,642 - optuna.study.study - INFO - Trial 35 finished with value: 0.08399293771430486 and parameters: {'n_layers': 2, 'embedding_dim': 96, 'lr': 0.001114231191882423, 'lambda_val': 2.5378981437523634e-05, 'batch_size': 1007, 'optimizer': 'Adam'}. Best is trial 12 with value: 0.12527215514243084.
2026-05-16 08:23:49,365 - optuna.study._optimize - INFO - Trial 36 pruned. 
2026-05-16 08:23:54,712 - experiment_functions - INFO - Early stopping at epoch 750. Best Recall: 0.0582
2026-05-16 08:23:54,815 - optuna.study.study - INFO - Trial 37 finished with value: 0.05822724793332876 and parameters: {'n_layers': 2, 'embedding_dim': 128, 'lr': 0.0009421652626969188, 'lambda_val': 9.06782582653189e-05, 'batch_size': 3864, 'optimizer': 'Adam'}. Best is trial 12 with value: 0.12527215514243084.
2026-05-16 08:23:59,728 - experiment_functions - INFO - Early stopping at epoch 550. Best Recall: 0.0317
2026-05-16 08:23:59,829 - optuna.study.study - INFO - Trial 38 finished with value: 0.03170494446667833 and parameters: {'n_layers': 3, 'embedding_dim': 256, 'lr': 0.005975775912636667, 'lambda_val': 4.944917781019145e-05, 'batch_size': 2068, 'optimizer': 'Adam'}. Best is trial 12 with value: 0.12527215514243084.
2026-05-16 08:24:04,310 - experiment_functions - INFO - Early stopping at epoch 700. Best Recall: 0.0427
2026-05-16 08:24:04,411 - optuna.study.study - INFO - Trial 39 finished with value: 0.04273848401631825 and parameters: {'n_layers': 1, 'embedding_dim': 96, 'lr': 0.013826607999812354, 'lambda_val': 2.4794819746623812e-05, 'batch_size': 1418, 'optimizer': 'RMSprop'}. Best is trial 12 with value: 0.12527215514243084.
2026-05-16 08:24:14,950 - optuna.study._optimize - INFO - Trial 40 pruned. 
2026-05-16 08:24:22,483 - experiment_functions - INFO - Early stopping at epoch 1050. Best Recall: 0.1092
2026-05-16 08:24:22,602 - optuna.study.study - INFO - Trial 41 finished with value: 0.10916961913160987 and parameters: {'n_layers': 1, 'embedding_dim': 256, 'lr': 0.0006414603736177582, 'lambda_val': 1.5090075841394626e-06, 'batch_size': 4064, 'optimizer': 'Adam'}. Best is trial 12 with value: 0.12527215514243084.
2026-05-16 08:24:28,923 - experiment_functions - INFO - Early stopping at epoch 900. Best Recall: 0.1081
2026-05-16 08:24:29,013 - optuna.study.study - INFO - Trial 42 finished with value: 0.10807589982357596 and parameters: {'n_layers': 1, 'embedding_dim': 256, 'lr': 0.0010795496942812997, 'lambda_val': 1.0721376842773071e-06, 'batch_size': 4055, 'optimizer': 'Adam'}. Best is trial 12 with value: 0.12527215514243084.
2026-05-16 08:24:39,731 - experiment_functions - INFO - Early stopping at epoch 1350. Best Recall: 0.1211
2026-05-16 08:24:39,830 - optuna.study.study - INFO - Trial 43 finished with value: 0.12110002813188672 and parameters: {'n_layers': 1, 'embedding_dim': 256, 'lr': 0.0005882556109635399, 'lambda_val': 2.771606494475512e-06, 'batch_size': 3734, 'optimizer': 'Adam'}. Best is trial 12 with value: 0.12527215514243084.
2026-05-16 08:24:44,598 - experiment_functions - INFO - Early stopping at epoch 600. Best Recall: 0.1035
2026-05-16 08:24:44,709 - optuna.study.study - INFO - Trial 44 finished with value: 0.1034942106177358 and parameters: {'n_layers': 1, 'embedding_dim': 256, 'lr': 0.0029295505490733622, 'lambda_val': 2.907475344551391e-06, 'batch_size': 3855, 'optimizer': 'Adam'}. Best is trial 12 with value: 0.12527215514243084.
2026-05-16 08:24:48,290 - experiment_functions - INFO - Early stopping at epoch 550. Best Recall: 0.0029
2026-05-16 08:24:48,410 - optuna.study.study - INFO - Trial 45 finished with value: 0.0029262733959046785 and parameters: {'n_layers': 1, 'embedding_dim': 128, 'lr': 9.524906403759667e-05, 'lambda_val': 1.451140437069067e-05, 'batch_size': 607, 'optimizer': 'Adam'}. Best is trial 12 with value: 0.12527215514243084.
2026-05-16 08:24:55,858 - optuna.study._optimize - INFO - Trial 46 pruned. 
2026-05-16 08:24:59,908 - experiment_functions - INFO - Early stopping at epoch 500. Best Recall: 0.0027
2026-05-16 08:25:00,064 - optuna.study.study - INFO - Trial 47 finished with value: 0.002721954213776901 and parameters: {'n_layers': 2, 'embedding_dim': 256, 'lr': 0.0002068459327332807, 'lambda_val': 0.00013858174904964767, 'batch_size': 2367, 'optimizer': 'SGD'}. Best is trial 12 with value: 0.12527215514243084.
2026-05-16 08:25:03,607 - experiment_functions - INFO - Early stopping at epoch 500. Best Recall: 0.0013
2026-05-16 08:25:03,776 - optuna.study.study - INFO - Trial 48 finished with value: 0.001311527556671265 and parameters: {'n_layers': 1, 'embedding_dim': 96, 'lr': 4.1389040912613297e-05, 'lambda_val': 9.285746204952404e-06, 'batch_size': 3395, 'optimizer': 'Adam'}. Best is trial 12 with value: 0.12527215514243084.
2026-05-16 08:25:10,610 - experiment_functions - INFO - Early stopping at epoch 1000. Best Recall: 0.1119
2026-05-16 08:25:10,711 - optuna.study.study - INFO - Trial 49 finished with value: 0.11185994761224213 and parameters: {'n_layers': 1, 'embedding_dim': 32, 'lr': 0.0018214864368575182, 'lambda_val': 4.308991932012685e-05, 'batch_size': 1726, 'optimizer': 'Adam'}. Best is trial 12 with value: 0.12527215514243084.
2026-05-16 08:25:21,652 - experiment_functions - INFO - Early stopping at epoch 750. Best Recall: 0.0493
2026-05-16 08:25:22,411 - optuna.study.study - INFO - Trial 50 finished with value: 0.04927924160372722 and parameters: {'n_layers': 2, 'embedding_dim': 256, 'lr': 0.00030504746327896724, 'lambda_val': 0.008539260430457333, 'batch_size': 3944, 'optimizer': 'RMSprop'}. Best is trial 12 with value: 0.12527215514243084.
2026-05-16 08:25:32,809 - experiment_functions - INFO - Early stopping at epoch 800. Best Recall: 0.1139
2026-05-16 08:25:32,930 - optuna.study.study - INFO - Trial 51 finished with value: 0.11386667136187838 and parameters: {'n_layers': 1, 'embedding_dim': 256, 'lr': 0.0008625216050361466, 'lambda_val': 1.9151371633460235e-06, 'batch_size': 3741, 'optimizer': 'Adam'}. Best is trial 12 with value: 0.12527215514243084.
2026-05-16 08:25:43,324 - experiment_functions - INFO - Early stopping at epoch 1350. Best Recall: 0.1216
2026-05-16 08:25:43,424 - optuna.study.study - INFO - Trial 52 finished with value: 0.12158105503984427 and parameters: {'n_layers': 1, 'embedding_dim': 256, 'lr': 0.00046557804396201943, 'lambda_val': 1.8066523788101856e-06, 'batch_size': 4090, 'optimizer': 'Adam'}. Best is trial 12 with value: 0.12527215514243084.
2026-05-16 08:25:50,897 - optuna.study._optimize - INFO - Trial 53 pruned. 
2026-05-16 08:26:08,094 - experiment_functions - INFO - Early stopping at epoch 2300. Best Recall: 0.1166
2026-05-16 08:26:08,214 - optuna.study.study - INFO - Trial 54 finished with value: 0.11657107854842275 and parameters: {'n_layers': 1, 'embedding_dim': 256, 'lr': 0.00042240993620115826, 'lambda_val': 2.0430048337419312e-06, 'batch_size': 3225, 'optimizer': 'Adam'}. Best is trial 12 with value: 0.12527215514243084.
2026-05-16 08:26:15,048 - optuna.study._optimize - INFO - Trial 55 pruned. 
2026-05-16 08:26:20,469 - experiment_functions - INFO - Early stopping at epoch 700. Best Recall: 0.1083
2026-05-16 08:26:20,572 - optuna.study.study - INFO - Trial 56 finished with value: 0.10829986776690323 and parameters: {'n_layers': 1, 'embedding_dim': 256, 'lr': 0.0014654603972505344, 'lambda_val': 4.921900757142928e-06, 'batch_size': 3233, 'optimizer': 'Adam'}. Best is trial 12 with value: 0.12527215514243084.
2026-05-16 08:26:28,895 - optuna.study._optimize - INFO - Trial 57 pruned. 
2026-05-16 08:26:35,905 - optuna.study._optimize - INFO - Trial 58 pruned. 
2026-05-16 08:26:39,902 - experiment_functions - INFO - Early stopping at epoch 500. Best Recall: 0.0035
2026-05-16 08:26:40,048 - optuna.study.study - INFO - Trial 59 finished with value: 0.0034949174577082564 and parameters: {'n_layers': 1, 'embedding_dim': 256, 'lr': 0.0023673498278903356, 'lambda_val': 2.149034946997496e-06, 'batch_size': 3190, 'optimizer': 'SGD'}. Best is trial 12 with value: 0.12527215514243084.
2026-05-16 08:26:46,723 - experiment_functions - INFO - Early stopping at epoch 850. Best Recall: 0.0140
2026-05-16 08:26:46,813 - optuna.study.study - INFO - Trial 60 finished with value: 0.014015575692189234 and parameters: {'n_layers': 2, 'embedding_dim': 256, 'lr': 0.000436923867894761, 'lambda_val': 0.09062211403173544, 'batch_size': 3794, 'optimizer': 'Adam'}. Best is trial 12 with value: 0.12527215514243084.
2026-05-16 08:26:53,853 - experiment_functions - INFO - Early stopping at epoch 1000. Best Recall: 0.1226
2026-05-16 08:26:53,943 - optuna.study.study - INFO - Trial 61 finished with value: 0.12259283518054796 and parameters: {'n_layers': 1, 'embedding_dim': 96, 'lr': 0.0008829529635510312, 'lambda_val': 1.5603584379254168e-05, 'batch_size': 2429, 'optimizer': 'Adam'}. Best is trial 12 with value: 0.12527215514243084.
2026-05-16 08:27:01,248 - optuna.study._optimize - INFO - Trial 62 pruned. 
2026-05-16 08:27:07,645 - experiment_functions - INFO - Early stopping at epoch 900. Best Recall: 0.1138
2026-05-16 08:27:07,735 - optuna.study.study - INFO - Trial 63 finished with value: 0.1138042662050885 and parameters: {'n_layers': 1, 'embedding_dim': 256, 'lr': 0.0012375875304212185, 'lambda_val': 3.6440801328908922e-06, 'batch_size': 2403, 'optimizer': 'Adam'}. Best is trial 12 with value: 0.12527215514243084.
2026-05-16 08:27:14,235 - optuna.study._optimize - INFO - Trial 64 pruned. 
2026-05-16 08:27:18,131 - experiment_functions - INFO - Early stopping at epoch 600. Best Recall: 0.1062
2026-05-16 08:27:18,233 - optuna.study.study - INFO - Trial 65 finished with value: 0.10619221783304815 and parameters: {'n_layers': 1, 'embedding_dim': 32, 'lr': 0.003837757928905006, 'lambda_val': 1.789752189262694e-05, 'batch_size': 2804, 'optimizer': 'Adam'}. Best is trial 12 with value: 0.12527215514243084.
2026-05-16 08:27:23,179 - experiment_functions - INFO - Early stopping at epoch 700. Best Recall: 0.1094
2026-05-16 08:27:23,282 - optuna.study.study - INFO - Trial 66 finished with value: 0.10935550433654856 and parameters: {'n_layers': 1, 'embedding_dim': 256, 'lr': 0.0015796592392642278, 'lambda_val': 4.8371375128404985e-06, 'batch_size': 3086, 'optimizer': 'Adam'}. Best is trial 12 with value: 0.12527215514243084.
2026-05-16 08:27:29,610 - optuna.study._optimize - INFO - Trial 67 pruned. 
2026-05-16 08:27:36,180 - optuna.study._optimize - INFO - Trial 68 pruned. 
2026-05-16 08:27:43,228 - optuna.study._optimize - INFO - Trial 69 pruned. 
2026-05-16 08:27:47,903 - experiment_functions - INFO - Early stopping at epoch 500. Best Recall: 0.0007
