2026-05-16 06:57:24,747 - optuna.study.study - INFO - Trial 103 finished with value: 0.11110330610085653 and parameters: {'n_layers': 1, 'embedding_dim': 256, 'lr': 0.0013217837389072472, 'lambda_val': 5.534658420001115e-05, 'batch_size': 3704, 'optimizer': 'Adam'}. Best is trial 59 with value: 0.11901431530212041.
2026-05-16 06:57:32,838 - experiment_functions - INFO - Early stopping at epoch 850. Best Recall: 0.1149
2026-05-16 06:57:32,939 - optuna.study.study - INFO - Trial 104 finished with value: 0.11489864107518823 and parameters: {'n_layers': 1, 'embedding_dim': 256, 'lr': 0.000908438955988271, 'lambda_val': 0.00011684816172480322, 'batch_size': 3764, 'optimizer': 'Adam'}. Best is trial 59 with value: 0.11901431530212041.
2026-05-16 06:57:39,163 - experiment_functions - INFO - Early stopping at epoch 550. Best Recall: 0.0311
2026-05-16 06:57:39,253 - optuna.study.study - INFO - Trial 105 finished with value: 0.031144686871224268 and parameters: {'n_layers': 4, 'embedding_dim': 256, 'lr': 0.0019444991580293263, 'lambda_val': 0.00011772441651145696, 'batch_size': 3582, 'optimizer': 'Adam'}. Best is trial 59 with value: 0.11901431530212041.
2026-05-16 06:57:49,939 - experiment_functions - INFO - Early stopping at epoch 1500. Best Recall: 0.1221
2026-05-16 06:57:50,030 - optuna.study.study - INFO - Trial 106 finished with value: 0.12206499063112633 and parameters: {'n_layers': 1, 'embedding_dim': 256, 'lr': 0.0003948284508728486, 'lambda_val': 8.480407849327636e-05, 'batch_size': 3760, 'optimizer': 'Adam'}. Best is trial 106 with value: 0.12206499063112633.
2026-05-16 06:57:57,660 - optuna.study._optimize - INFO - Trial 107 pruned. 
2026-05-16 06:58:08,267 - experiment_functions - INFO - Early stopping at epoch 1450. Best Recall: 0.1143
2026-05-16 06:58:08,377 - optuna.study.study - INFO - Trial 108 finished with value: 0.11426946236558302 and parameters: {'n_layers': 1, 'embedding_dim': 256, 'lr': 0.0005295252430393228, 'lambda_val': 0.0001473883933653728, 'batch_size': 3324, 'optimizer': 'Adam'}. Best is trial 106 with value: 0.12206499063112633.
2026-05-16 06:58:21,331 - experiment_functions - INFO - Early stopping at epoch 1250. Best Recall: 0.1000
2026-05-16 06:58:22,091 - optuna.study.study - INFO - Trial 109 finished with value: 0.09999391252204089 and parameters: {'n_layers': 1, 'embedding_dim': 256, 'lr': 0.0009107862995621624, 'lambda_val': 0.00014617394172936995, 'batch_size': 3342, 'optimizer': 'Adam'}. Best is trial 106 with value: 0.12206499063112633.
2026-05-16 06:58:29,241 - experiment_functions - INFO - Early stopping at epoch 500. Best Recall: 0.0015
2026-05-16 06:58:29,332 - optuna.study.study - INFO - Trial 110 finished with value: 0.0015002002025477112 and parameters: {'n_layers': 1, 'embedding_dim': 96, 'lr': 0.0004015492786936309, 'lambda_val': 0.00013706390462266748, 'batch_size': 3532, 'optimizer': 'SGD'}. Best is trial 106 with value: 0.12206499063112633.
2026-05-16 06:58:34,734 - experiment_functions - INFO - Early stopping at epoch 700. Best Recall: 0.1204
2026-05-16 06:58:34,823 - optuna.study.study - INFO - Trial 111 finished with value: 0.1203641403312696 and parameters: {'n_layers': 1, 'embedding_dim': 256, 'lr': 0.0012826222432795367, 'lambda_val': 7.813613680843711e-05, 'batch_size': 3798, 'optimizer': 'Adam'}. Best is trial 106 with value: 0.12206499063112633.
2026-05-16 06:58:41,816 - experiment_functions - INFO - Early stopping at epoch 800. Best Recall: 0.1069
2026-05-16 06:58:41,951 - optuna.study.study - INFO - Trial 112 finished with value: 0.10691478433211346 and parameters: {'n_layers': 1, 'embedding_dim': 256, 'lr': 0.0012762844848785997, 'lambda_val': 6.928231926960527e-05, 'batch_size': 3598, 'optimizer': 'Adam'}. Best is trial 106 with value: 0.12206499063112633.
2026-05-16 06:58:49,809 - experiment_functions - INFO - Early stopping at epoch 950. Best Recall: 0.1250
2026-05-16 06:58:49,943 - optuna.study.study - INFO - Trial 113 finished with value: 0.12500651633583074 and parameters: {'n_layers': 1, 'embedding_dim': 256, 'lr': 0.0009234112073026278, 'lambda_val': 8.363448947186975e-05, 'batch_size': 3488, 'optimizer': 'Adam'}. Best is trial 113 with value: 0.12500651633583074.
2026-05-16 06:58:56,423 - experiment_functions - INFO - Early stopping at epoch 900. Best Recall: 0.1112
2026-05-16 06:58:56,524 - optuna.study.study - INFO - Trial 114 finished with value: 0.11118316911487926 and parameters: {'n_layers': 1, 'embedding_dim': 256, 'lr': 0.0009084871553386544, 'lambda_val': 0.0001275296704035282, 'batch_size': 3497, 'optimizer': 'Adam'}. Best is trial 113 with value: 0.12500651633583074.
2026-05-16 06:59:06,811 - experiment_functions - INFO - Early stopping at epoch 1600. Best Recall: 0.1116
2026-05-16 06:59:06,980 - optuna.study.study - INFO - Trial 115 finished with value: 0.11157237816625357 and parameters: {'n_layers': 1, 'embedding_dim': 256, 'lr': 0.0005244704305126059, 'lambda_val': 2.1059900794692323e-05, 'batch_size': 3343, 'optimizer': 'Adam'}. Best is trial 113 with value: 0.12500651633583074.
2026-05-16 06:59:17,823 - experiment_functions - INFO - Early stopping at epoch 1050. Best Recall: 0.1073
2026-05-16 06:59:17,966 - optuna.study.study - INFO - Trial 116 finished with value: 0.1073255941562775 and parameters: {'n_layers': 1, 'embedding_dim': 256, 'lr': 0.000635318632145299, 'lambda_val': 0.00022146038544599637, 'batch_size': 3959, 'optimizer': 'Adam'}. Best is trial 113 with value: 0.12500651633583074.
2026-05-16 06:59:24,691 - optuna.study._optimize - INFO - Trial 117 pruned. 
2026-05-16 06:59:29,986 - experiment_functions - INFO - Early stopping at epoch 650. Best Recall: 0.1156
2026-05-16 06:59:30,172 - optuna.study.study - INFO - Trial 118 finished with value: 0.11563311992108631 and parameters: {'n_layers': 1, 'embedding_dim': 256, 'lr': 0.0021706526809298974, 'lambda_val': 3.010327842216362e-05, 'batch_size': 3767, 'optimizer': 'Adam'}. Best is trial 113 with value: 0.12500651633583074.
2026-05-16 06:59:35,600 - experiment_functions - INFO - Early stopping at epoch 650. Best Recall: 0.1122
2026-05-16 06:59:35,690 - optuna.study.study - INFO - Trial 119 finished with value: 0.11222123010270288 and parameters: {'n_layers': 1, 'embedding_dim': 256, 'lr': 0.002099245717862247, 'lambda_val': 2.8234250956242394e-05, 'batch_size': 3797, 'optimizer': 'Adam'}. Best is trial 113 with value: 0.12500651633583074.
2026-05-16 06:59:42,549 - experiment_functions - INFO - Early stopping at epoch 950. Best Recall: 0.1152
2026-05-16 06:59:42,640 - optuna.study.study - INFO - Trial 120 finished with value: 0.11517056723828635 and parameters: {'n_layers': 1, 'embedding_dim': 256, 'lr': 0.000899796461297715, 'lambda_val': 6.587358241660106e-05, 'batch_size': 3927, 'optimizer': 'Adam'}. Best is trial 113 with value: 0.12500651633583074.
2026-05-16 06:59:48,809 - experiment_functions - INFO - Early stopping at epoch 900. Best Recall: 0.1187
2026-05-16 06:59:48,944 - optuna.study.study - INFO - Trial 121 finished with value: 0.1186983835288982 and parameters: {'n_layers': 1, 'embedding_dim': 256, 'lr': 0.0007831922536434229, 'lambda_val': 6.168210116291618e-05, 'batch_size': 3899, 'optimizer': 'Adam'}. Best is trial 113 with value: 0.12500651633583074.
2026-05-16 06:59:56,675 - experiment_functions - INFO - Early stopping at epoch 900. Best Recall: 0.1152
2026-05-16 06:59:56,796 - optuna.study.study - INFO - Trial 122 finished with value: 0.11521774205668299 and parameters: {'n_layers': 1, 'embedding_dim': 256, 'lr': 0.000977015176218197, 'lambda_val': 6.341436501779736e-05, 'batch_size': 3913, 'optimizer': 'Adam'}. Best is trial 113 with value: 0.12500651633583074.
2026-05-16 07:00:02,984 - experiment_functions - INFO - Early stopping at epoch 800. Best Recall: 0.1183
2026-05-16 07:00:03,106 - optuna.study.study - INFO - Trial 123 finished with value: 0.11825189736837069 and parameters: {'n_layers': 1, 'embedding_dim': 256, 'lr': 0.000944834944200873, 'lambda_val': 6.156759041749852e-05, 'batch_size': 4005, 'optimizer': 'Adam'}. Best is trial 113 with value: 0.12500651633583074.
2026-05-16 07:00:12,618 - experiment_functions - INFO - Early stopping at epoch 800. Best Recall: 0.1185
2026-05-16 07:00:12,737 - optuna.study.study - INFO - Trial 124 finished with value: 0.11846844254329766 and parameters: {'n_layers': 1, 'embedding_dim': 256, 'lr': 0.0009743713553927296, 'lambda_val': 6.327922614243543e-05, 'batch_size': 4006, 'optimizer': 'Adam'}. Best is trial 113 with value: 0.12500651633583074.
2026-05-16 07:00:18,269 - experiment_functions - INFO - Early stopping at epoch 750. Best Recall: 0.1044
2026-05-16 07:00:18,370 - optuna.study.study - INFO - Trial 125 finished with value: 0.10437545108879875 and parameters: {'n_layers': 1, 'embedding_dim': 256, 'lr': 0.0014181656062835293, 'lambda_val': 7.021655971408093e-05, 'batch_size': 3995, 'optimizer': 'Adam'}. Best is trial 113 with value: 0.12500651633583074.
2026-05-16 07:00:23,114 - experiment_functions - INFO - Early stopping at epoch 650. Best Recall: 0.1086
2026-05-16 07:00:23,249 - optuna.study.study - INFO - Trial 126 finished with value: 0.10863174721873836 and parameters: {'n_layers': 1, 'embedding_dim': 256, 'lr': 0.002641561792795647, 'lambda_val': 5.963868114810808e-05, 'batch_size': 3910, 'optimizer': 'Adam'}. Best is trial 113 with value: 0.12500651633583074.
2026-05-16 07:00:29,078 - experiment_functions - INFO - Early stopping at epoch 700. Best Recall: 0.1077
2026-05-16 07:00:29,169 - optuna.study.study - INFO - Trial 127 finished with value: 0.10771162863545579 and parameters: {'n_layers': 1, 'embedding_dim': 256, 'lr': 0.0012806534862085412, 'lambda_val': 5.5133836049751316e-05, 'batch_size': 3913, 'optimizer': 'Adam'}. Best is trial 113 with value: 0.12500651633583074.
2026-05-16 07:00:36,077 - experiment_functions - INFO - Early stopping at epoch 1000. Best Recall: 0.1173
2026-05-16 07:00:36,167 - optuna.study.study - INFO - Trial 128 finished with value: 0.11727132862341853 and parameters: {'n_layers': 1, 'embedding_dim': 256, 'lr': 0.0009741311654566292, 'lambda_val': 2.8900092811473494e-05, 'batch_size': 3991, 'optimizer': 'Adam'}. Best is trial 113 with value: 0.12500651633583074.
2026-05-16 07:00:41,879 - experiment_functions - INFO - Early stopping at epoch 650. Best Recall: 0.1135
2026-05-16 07:00:43,552 - optuna.study.study - INFO - Trial 129 finished with value: 0.11351740073491498 and parameters: {'n_layers': 1, 'embedding_dim': 256, 'lr': 0.0019394546337539152, 'lambda_val': 2.004194702607269e-05, 'batch_size': 3974, 'optimizer': 'Adam'}. Best is trial 113 with value: 0.12500651633583074.
2026-05-16 07:00:47,212 - experiment_functions - INFO - Early stopping at epoch 500. Best Recall: 0.0021
2026-05-16 07:00:47,312 - optuna.study.study - INFO - Trial 130 finished with value: 0.002135039542504637 and parameters: {'n_layers': 1, 'embedding_dim': 256, 'lr': 0.0010052437718852723, 'lambda_val': 2.534348917958692e-05, 'batch_size': 4007, 'optimizer': 'SGD'}. Best is trial 113 with value: 0.12500651633583074.
2026-05-16 07:00:58,867 - experiment_functions - INFO - Early stopping at epoch 1100. Best Recall: 0.1147
2026-05-16 07:00:58,967 - optuna.study.study - INFO - Trial 131 finished with value: 0.11466771649892965 and parameters: {'n_layers': 1, 'embedding_dim': 256, 'lr': 0.0007743882367639481, 'lambda_val': 3.1911343494990033e-05, 'batch_size': 3824, 'optimizer': 'Adam'}. Best is trial 113 with value: 0.12500651633583074.
2026-05-16 07:01:03,712 - experiment_functions - INFO - Early stopping at epoch 600. Best Recall: 0.1124
2026-05-16 07:01:03,820 - optuna.study.study - INFO - Trial 132 finished with value: 0.11237794751025008 and parameters: {'n_layers': 1, 'embedding_dim': 256, 'lr': 0.003255622198601994, 'lambda_val': 4.621009232730227e-05, 'batch_size': 3669, 'optimizer': 'Adam'}. Best is trial 113 with value: 0.12500651633583074.
2026-05-16 07:01:10,323 - experiment_functions - INFO - Early stopping at epoch 700. Best Recall: 0.1095
2026-05-16 07:01:10,413 - optuna.study.study - INFO - Trial 133 finished with value: 0.1095298002697003 and parameters: {'n_layers': 1, 'embedding_dim': 256, 'lr': 0.0014409425092454236, 'lambda_val': 6.49041861368603e-05, 'batch_size': 3910, 'optimizer': 'Adam'}. Best is trial 113 with value: 0.12500651633583074.
2026-05-16 07:01:17,711 - experiment_functions - INFO - Early stopping at epoch 800. Best Recall: 0.1132
2026-05-16 07:01:17,812 - optuna.study.study - INFO - Trial 134 finished with value: 0.11319274960516848 and parameters: {'n_layers': 1, 'embedding_dim': 256, 'lr': 0.001003194542800978, 'lambda_val': 8.36490550457071e-05, 'batch_size': 4033, 'optimizer': 'Adam'}. Best is trial 113 with value: 0.12500651633583074.
2026-05-16 07:01:24,365 - experiment_functions - INFO - Early stopping at epoch 900. Best Recall: 0.1139
2026-05-16 07:01:24,464 - optuna.study.study - INFO - Trial 135 finished with value: 0.11393613487628168 and parameters: {'n_layers': 1, 'embedding_dim': 256, 'lr': 0.0008252278653450193, 'lambda_val': 2.9033697878598187e-05, 'batch_size': 3715, 'optimizer': 'Adam'}. Best is trial 113 with value: 0.12500651633583074.
2026-05-16 07:01:38,151 - experiment_functions - INFO - Early stopping at epoch 750. Best Recall: 0.1003
2026-05-16 07:01:39,687 - optuna.study.study - INFO - Trial 136 finished with value: 0.10029570511062463 and parameters: {'n_layers': 1, 'embedding_dim': 256, 'lr': 0.001199933954745024, 'lambda_val': 4.769993555373677e-05, 'batch_size': 3918, 'optimizer': 'Adam'}. Best is trial 113 with value: 0.12500651633583074.
2026-05-16 07:02:03,457 - experiment_functions - INFO - Early stopping at epoch 1250. Best Recall: 0.0960
2026-05-16 07:02:03,558 - optuna.study.study - INFO - Trial 137 finished with value: 0.09600453224845013 and parameters: {'n_layers': 1, 'embedding_dim': 32, 'lr': 0.0009845133037261582, 'lambda_val': 1.0585007297278412e-05, 'batch_size': 3778, 'optimizer': 'Adam'}. Best is trial 113 with value: 0.12500651633583074.
2026-05-16 07:02:08,570 - experiment_functions - INFO - Early stopping at epoch 650. Best Recall: 0.1144
2026-05-16 07:02:08,681 - optuna.study.study - INFO - Trial 138 finished with value: 0.11436781615662324 and parameters: {'n_layers': 1, 'embedding_dim': 256, 'lr': 0.001659167185428921, 'lambda_val': 3.866864883433862e-05, 'batch_size': 4081, 'optimizer': 'Adam'}. Best is trial 113 with value: 0.12500651633583074.
2026-05-16 07:02:17,640 - experiment_functions - INFO - Early stopping at epoch 1100. Best Recall: 0.1056
2026-05-16 07:02:17,763 - optuna.study.study - INFO - Trial 139 finished with value: 0.10562405653989429 and parameters: {'n_layers': 1, 'embedding_dim': 256, 'lr': 0.0007099140038715416, 'lambda_val': 8.833592513823115e-05, 'batch_size': 3847, 'optimizer': 'Adam'}. Best is trial 113 with value: 0.12500651633583074.
2026-05-16 07:02:32,456 - experiment_functions - INFO - Early stopping at epoch 1900. Best Recall: 0.1260
2026-05-16 07:02:32,945 - optuna.study.study - INFO - Trial 140 finished with value: 0.12599909761257422 and parameters: {'n_layers': 1, 'embedding_dim': 256, 'lr': 0.00037388154139491605, 'lambda_val': 1.4314656669606731e-05, 'batch_size': 3640, 'optimizer': 'Adam'}. Best is trial 140 with value: 0.12599909761257422.
2026-05-16 07:02:51,868 - experiment_functions - INFO - Early stopping at epoch 2700. Best Recall: 0.1132
2026-05-16 07:02:52,044 - optuna.study.study - INFO - Trial 141 finished with value: 0.1132031768962719 and parameters: {'n_layers': 1, 'embedding_dim': 256, 'lr': 0.00030859265193520716, 'lambda_val': 5.992845182647738e-05, 'batch_size': 3620, 'optimizer': 'Adam'}. Best is trial 140 with value: 0.12599909761257422.
2026-05-16 07:03:03,390 - experiment_functions - INFO - Early stopping at epoch 1650. Best Recall: 0.1092
2026-05-16 07:03:03,490 - optuna.study.study - INFO - Trial 142 finished with value: 0.10920057766932528 and parameters: {'n_layers': 1, 'embedding_dim': 256, 'lr': 0.0003847727682703379, 'lambda_val': 1.3625471502759671e-05, 'batch_size': 3697, 'optimizer': 'Adam'}. Best is trial 140 with value: 0.12599909761257422.
2026-05-16 07:03:12,323 - experiment_functions - INFO - Early stopping at epoch 1050. Best Recall: 0.1163
2026-05-16 07:03:12,425 - optuna.study.study - INFO - Trial 143 finished with value: 0.1162621357786556 and parameters: {'n_layers': 1, 'embedding_dim': 256, 'lr': 0.0006303153862851828, 'lambda_val': 1.7795936776181693e-05, 'batch_size': 4011, 'optimizer': 'Adam'}. Best is trial 140 with value: 0.12599909761257422.
2026-05-16 07:03:20,665 - experiment_functions - INFO - Early stopping at epoch 1150. Best Recall: 0.1111
2026-05-16 07:03:20,755 - optuna.study.study - INFO - Trial 144 finished with value: 0.1111025309566046 and parameters: {'n_layers': 1, 'embedding_dim': 256, 'lr': 0.0005941521159581819, 'lambda_val': 8.139820239655014e-06, 'batch_size': 4009, 'optimizer': 'Adam'}. Best is trial 140 with value: 0.12599909761257422.
2026-05-16 07:03:31,067 - experiment_functions - INFO - Early stopping at epoch 1750. Best Recall: 0.1060
2026-05-16 07:03:31,175 - optuna.study.study - INFO - Trial 145 finished with value: 0.10604962844698247 and parameters: {'n_layers': 1, 'embedding_dim': 96, 'lr': 0.0004735555924166214, 'lambda_val': 2.0685782717512365e-05, 'batch_size': 3783, 'optimizer': 'Adam'}. Best is trial 140 with value: 0.12599909761257422.
2026-05-16 07:03:39,639 - experiment_functions - INFO - Early stopping at epoch 950. Best Recall: 0.1221
2026-05-16 07:03:39,737 - optuna.study.study - INFO - Trial 146 finished with value: 0.12206402237165413 and parameters: {'n_layers': 1, 'embedding_dim': 256, 'lr': 0.0006910767137280428, 'lambda_val': 1.5725855629582132e-05, 'batch_size': 4094, 'optimizer': 'Adam'}. Best is trial 140 with value: 0.12599909761257422.
2026-05-16 07:03:51,261 - experiment_functions - INFO - Early stopping at epoch 900. Best Recall: 0.1120
2026-05-16 07:03:52,038 - optuna.study.study - INFO - Trial 147 finished with value: 0.11196196282953239 and parameters: {'n_layers': 1, 'embedding_dim': 256, 'lr': 0.0007359090970325596, 'lambda_val': 8.946748881293143e-06, 'batch_size': 4080, 'optimizer': 'Adam'}. Best is trial 140 with value: 0.12599909761257422.
2026-05-16 07:04:02,811 - optuna.study._optimize - INFO - Trial 148 pruned. 
2026-05-16 07:04:09,631 - optuna.study._optimize - INFO - Trial 149 pruned. 
2026-05-16 07:04:25,376 - experiment_functions - INFO - Early stopping at epoch 1450. Best Recall: 0.1123
2026-05-16 07:04:26,260 - optuna.study.study - INFO - Trial 150 finished with value: 0.11234973908702077 and parameters: {'n_layers': 1, 'embedding_dim': 256, 'lr': 0.0003519325351633786, 'lambda_val': 2.4680931328255043e-05, 'batch_size': 3836, 'optimizer': 'Adam'}. Best is trial 140 with value: 0.12599909761257422.
2026-05-16 07:04:32,760 - experiment_functions - INFO - Early stopping at epoch 800. Best Recall: 0.1202
2026-05-16 07:04:32,860 - optuna.study.study - INFO - Trial 151 finished with value: 0.12017165835937216 and parameters: {'n_layers': 1, 'embedding_dim': 256, 'lr': 0.0010999823420110254, 'lambda_val': 1.1806141647550645e-05, 'batch_size': 3946, 'optimizer': 'Adam'}. Best is trial 140 with value: 0.12599909761257422.
2026-05-16 07:04:41,800 - experiment_functions - INFO - Early stopping at epoch 1250. Best Recall: 0.1159
2026-05-16 07:04:41,902 - optuna.study.study - INFO - Trial 152 finished with value: 0.11592332808154997 and parameters: {'n_layers': 1, 'embedding_dim': 256, 'lr': 0.0006292765880092287, 'lambda_val': 1.1562782362362754e-05, 'batch_size': 4094, 'optimizer': 'Adam'}. Best is trial 140 with value: 0.12599909761257422.
2026-05-16 07:04:48,825 - experiment_functions - INFO - Early stopping at epoch 950. Best Recall: 0.1139
2026-05-16 07:04:49,001 - optuna.study.study - INFO - Trial 153 finished with value: 0.11390377688271525 and parameters: {'n_layers': 1, 'embedding_dim': 256, 'lr': 0.0006255679018395827, 'lambda_val': 1.1492337946645212e-05, 'batch_size': 3977, 'optimizer': 'Adam'}. Best is trial 140 with value: 0.12599909761257422.
2026-05-16 07:04:55,773 - experiment_functions - INFO - Early stopping at epoch 950. Best Recall: 0.1125
2026-05-16 07:04:55,870 - optuna.study.study - INFO - Trial 154 finished with value: 0.1124815938912509 and parameters: {'n_layers': 1, 'embedding_dim': 256, 'lr': 0.0008047568773714288, 'lambda_val': 1.3296676070451806e-05, 'batch_size': 4052, 'optimizer': 'Adam'}. Best is trial 140 with value: 0.12599909761257422.
2026-05-16 07:05:07,210 - experiment_functions - INFO - Early stopping at epoch 750. Best Recall: 0.1113
2026-05-16 07:05:07,310 - optuna.study.study - INFO - Trial 155 finished with value: 0.11127299301447242 and parameters: {'n_layers': 1, 'embedding_dim': 256, 'lr': 0.0012227741285454083, 'lambda_val': 9.322001038042881e-06, 'batch_size': 3757, 'optimizer': 'Adam'}. Best is trial 140 with value: 0.12599909761257422.
2026-05-16 07:05:15,906 - experiment_functions - INFO - Early stopping at epoch 1300. Best Recall: 0.1144
2026-05-16 07:05:16,006 - optuna.study.study - INFO - Trial 156 finished with value: 0.114390950654901 and parameters: {'n_layers': 1, 'embedding_dim': 256, 'lr': 0.0005708432436294181, 'lambda_val': 1.734417355394733e-05, 'batch_size': 3975, 'optimizer': 'Adam'}. Best is trial 140 with value: 0.12599909761257422.
2026-05-16 07:05:22,020 - experiment_functions - INFO - Early stopping at epoch 850. Best Recall: 0.1157
2026-05-16 07:05:22,332 - optuna.study.study - INFO - Trial 157 finished with value: 0.11569643771043697 and parameters: {'n_layers': 1, 'embedding_dim': 256, 'lr': 0.0006920449360510687, 'lambda_val': 0.00044966332581072106, 'batch_size': 4087, 'optimizer': 'Adam'}. Best is trial 140 with value: 0.12599909761257422.
2026-05-16 07:05:32,798 - experiment_functions - INFO - Early stopping at epoch 500. Best Recall: 0.0022
