2026-05-16 03:30:11,089 - optuna.study.study - INFO - Trial 90 finished with value: 0.0027728433981907287 and parameters: {'n_layers': 1, 'embedding_dim': 128, 'lr': 0.0015855789945063998, 'lambda_val': 0.002067238618145203, 'batch_size': 3515, 'optimizer': 'SGD'}. Best is trial 27 with value: 0.12382585735682568.
2026-05-16 03:30:15,393 - experiment_functions - INFO - Early stopping at epoch 650. Best Recall: 0.1004
2026-05-16 03:30:15,539 - optuna.study.study - INFO - Trial 91 finished with value: 0.10039230497303482 and parameters: {'n_layers': 1, 'embedding_dim': 128, 'lr': 0.002225958396843037, 'lambda_val': 2.0157739915959313e-06, 'batch_size': 3903, 'optimizer': 'Adam'}. Best is trial 27 with value: 0.12382585735682568.
2026-05-16 03:30:20,222 - experiment_functions - INFO - Early stopping at epoch 650. Best Recall: 0.1049
2026-05-16 03:30:20,319 - optuna.study.study - INFO - Trial 92 finished with value: 0.1048571253537729 and parameters: {'n_layers': 1, 'embedding_dim': 128, 'lr': 0.0017504396243512184, 'lambda_val': 3.540455068042636e-06, 'batch_size': 3704, 'optimizer': 'Adam'}. Best is trial 27 with value: 0.12382585735682568.
2026-05-16 03:30:24,060 - experiment_functions - INFO - Early stopping at epoch 550. Best Recall: 0.1009
2026-05-16 03:30:24,161 - optuna.study.study - INFO - Trial 93 finished with value: 0.1008581057788 and parameters: {'n_layers': 1, 'embedding_dim': 96, 'lr': 0.00611939963519281, 'lambda_val': 2.613537928104259e-06, 'batch_size': 3632, 'optimizer': 'Adam'}. Best is trial 27 with value: 0.12382585735682568.
2026-05-16 03:30:29,779 - experiment_functions - INFO - Early stopping at epoch 600. Best Recall: 0.0847
2026-05-16 03:30:29,861 - optuna.study.study - INFO - Trial 94 finished with value: 0.08465944619372068 and parameters: {'n_layers': 1, 'embedding_dim': 128, 'lr': 0.003104243645056904, 'lambda_val': 1.8166673818261085e-06, 'batch_size': 3956, 'optimizer': 'Adam'}. Best is trial 27 with value: 0.12382585735682568.
2026-05-16 03:30:34,689 - experiment_functions - INFO - Early stopping at epoch 750. Best Recall: 0.0980
2026-05-16 03:30:34,791 - optuna.study.study - INFO - Trial 95 finished with value: 0.09801241034547087 and parameters: {'n_layers': 1, 'embedding_dim': 128, 'lr': 0.001260005452881918, 'lambda_val': 1.322194364343454e-06, 'batch_size': 4088, 'optimizer': 'Adam'}. Best is trial 27 with value: 0.12382585735682568.
2026-05-16 03:30:38,842 - experiment_functions - INFO - Early stopping at epoch 550. Best Recall: 0.0931
2026-05-16 03:30:38,977 - optuna.study.study - INFO - Trial 96 finished with value: 0.09312284365202675 and parameters: {'n_layers': 1, 'embedding_dim': 128, 'lr': 0.004251235143635467, 'lambda_val': 2.8578840862873228e-06, 'batch_size': 3433, 'optimizer': 'Adam'}. Best is trial 27 with value: 0.12382585735682568.
2026-05-16 03:30:43,997 - experiment_functions - INFO - Early stopping at epoch 750. Best Recall: 0.0943
2026-05-16 03:30:44,184 - optuna.study.study - INFO - Trial 97 finished with value: 0.09431773863580897 and parameters: {'n_layers': 1, 'embedding_dim': 128, 'lr': 0.0010496277447510525, 'lambda_val': 4.290933174467974e-06, 'batch_size': 3307, 'optimizer': 'RMSprop'}. Best is trial 27 with value: 0.12382585735682568.
2026-05-16 03:30:48,080 - experiment_functions - INFO - Early stopping at epoch 550. Best Recall: 0.0831
2026-05-16 03:30:48,240 - optuna.study.study - INFO - Trial 98 finished with value: 0.08314555997239195 and parameters: {'n_layers': 1, 'embedding_dim': 128, 'lr': 0.010795365165885333, 'lambda_val': 0.00026561005336555763, 'batch_size': 2892, 'optimizer': 'Adam'}. Best is trial 27 with value: 0.12382585735682568.
2026-05-16 03:30:52,666 - experiment_functions - INFO - Early stopping at epoch 700. Best Recall: 0.1074
2026-05-16 03:30:52,769 - optuna.study.study - INFO - Trial 99 finished with value: 0.10742615433473733 and parameters: {'n_layers': 1, 'embedding_dim': 128, 'lr': 0.0018548742977658056, 'lambda_val': 7.700112272742878e-06, 'batch_size': 3726, 'optimizer': 'Adam'}. Best is trial 27 with value: 0.12382585735682568.
2026-05-16 03:30:59,956 - experiment_functions - INFO - Early stopping at epoch 850. Best Recall: 0.0287
2026-05-16 03:31:00,047 - optuna.study.study - INFO - Trial 100 finished with value: 0.028718123801063953 and parameters: {'n_layers': 4, 'embedding_dim': 128, 'lr': 0.0005944304721509469, 'lambda_val': 7.225461250494348e-06, 'batch_size': 3764, 'optimizer': 'Adam'}. Best is trial 27 with value: 0.12382585735682568.
2026-05-16 03:31:07,693 - experiment_functions - INFO - Early stopping at epoch 650. Best Recall: 0.1232
2026-05-16 03:31:08,278 - optuna.study.study - INFO - Trial 101 finished with value: 0.12322244081899107 and parameters: {'n_layers': 1, 'embedding_dim': 128, 'lr': 0.002378247911201017, 'lambda_val': 3.6658935353884504e-06, 'batch_size': 3565, 'optimizer': 'Adam'}. Best is trial 27 with value: 0.12382585735682568.
2026-05-16 03:31:18,680 - experiment_functions - INFO - Early stopping at epoch 650. Best Recall: 0.1087
2026-05-16 03:31:18,840 - optuna.study.study - INFO - Trial 102 finished with value: 0.10866493197172072 and parameters: {'n_layers': 1, 'embedding_dim': 128, 'lr': 0.0022946534111942065, 'lambda_val': 5.44070238775907e-06, 'batch_size': 2410, 'optimizer': 'Adam'}. Best is trial 27 with value: 0.12382585735682568.
2026-05-16 03:31:24,131 - experiment_functions - INFO - Early stopping at epoch 700. Best Recall: 0.1074
2026-05-16 03:31:24,223 - optuna.study.study - INFO - Trial 103 finished with value: 0.10738815933748365 and parameters: {'n_layers': 1, 'embedding_dim': 128, 'lr': 0.002206298771572537, 'lambda_val': 1.34391869465606e-05, 'batch_size': 2448, 'optimizer': 'Adam'}. Best is trial 27 with value: 0.12382585735682568.
2026-05-16 03:31:30,748 - experiment_functions - INFO - Early stopping at epoch 650. Best Recall: 0.1078
2026-05-16 03:31:31,258 - optuna.study.study - INFO - Trial 104 finished with value: 0.10784045835886354 and parameters: {'n_layers': 1, 'embedding_dim': 128, 'lr': 0.002422605551654672, 'lambda_val': 1.4185243828157967e-05, 'batch_size': 2579, 'optimizer': 'Adam'}. Best is trial 27 with value: 0.12382585735682568.
2026-05-16 03:31:42,555 - experiment_functions - INFO - Early stopping at epoch 650. Best Recall: 0.1062
2026-05-16 03:31:42,655 - optuna.study.study - INFO - Trial 105 finished with value: 0.10622859275667323 and parameters: {'n_layers': 1, 'embedding_dim': 128, 'lr': 0.002929091322388984, 'lambda_val': 3.8491032965805874e-05, 'batch_size': 2439, 'optimizer': 'Adam'}. Best is trial 27 with value: 0.12382585735682568.
2026-05-16 03:31:48,084 - experiment_functions - INFO - Early stopping at epoch 700. Best Recall: 0.0864
2026-05-16 03:31:48,264 - optuna.study.study - INFO - Trial 106 finished with value: 0.0864048082368118 and parameters: {'n_layers': 1, 'embedding_dim': 256, 'lr': 0.001405175056109084, 'lambda_val': 1.2990177720792046e-05, 'batch_size': 2652, 'optimizer': 'RMSprop'}. Best is trial 27 with value: 0.12382585735682568.
2026-05-16 03:31:54,525 - optuna.study._optimize - INFO - Trial 107 pruned. 
2026-05-16 03:32:00,566 - experiment_functions - INFO - Early stopping at epoch 900. Best Recall: 0.1079
2026-05-16 03:32:00,657 - optuna.study.study - INFO - Trial 108 finished with value: 0.1079209267976337 and parameters: {'n_layers': 1, 'embedding_dim': 128, 'lr': 0.0009934900585181281, 'lambda_val': 1.0213319858244019e-05, 'batch_size': 2673, 'optimizer': 'Adam'}. Best is trial 27 with value: 0.12382585735682568.
2026-05-16 03:32:03,886 - experiment_functions - INFO - Early stopping at epoch 500. Best Recall: 0.0017
2026-05-16 03:32:03,968 - optuna.study.study - INFO - Trial 109 finished with value: 0.0017220253888775364 and parameters: {'n_layers': 1, 'embedding_dim': 128, 'lr': 0.0009892774565786952, 'lambda_val': 9.291076707353837e-06, 'batch_size': 2295, 'optimizer': 'SGD'}. Best is trial 27 with value: 0.12382585735682568.
2026-05-16 03:32:10,383 - optuna.study._optimize - INFO - Trial 110 pruned. 
2026-05-16 03:32:18,336 - experiment_functions - INFO - Early stopping at epoch 850. Best Recall: 0.0985
2026-05-16 03:32:18,437 - optuna.study.study - INFO - Trial 111 finished with value: 0.09849987788954194 and parameters: {'n_layers': 1, 'embedding_dim': 128, 'lr': 0.0016697319471472446, 'lambda_val': 1.6613514371740027e-05, 'batch_size': 2592, 'optimizer': 'Adam'}. Best is trial 27 with value: 0.12382585735682568.
2026-05-16 03:32:22,570 - experiment_functions - INFO - Early stopping at epoch 600. Best Recall: 0.1043
2026-05-16 03:32:22,682 - optuna.study.study - INFO - Trial 112 finished with value: 0.10425546341725456 and parameters: {'n_layers': 1, 'embedding_dim': 128, 'lr': 0.002561685917582589, 'lambda_val': 1.2146768253052073e-05, 'batch_size': 2376, 'optimizer': 'Adam'}. Best is trial 27 with value: 0.12382585735682568.
2026-05-16 03:32:26,592 - experiment_functions - INFO - Early stopping at epoch 600. Best Recall: 0.0935
2026-05-16 03:32:26,694 - optuna.study.study - INFO - Trial 113 finished with value: 0.09348392995217318 and parameters: {'n_layers': 1, 'embedding_dim': 128, 'lr': 0.002113409332487447, 'lambda_val': 7.597108846318057e-06, 'batch_size': 2727, 'optimizer': 'Adam'}. Best is trial 27 with value: 0.12382585735682568.
2026-05-16 03:32:33,764 - optuna.study._optimize - INFO - Trial 114 pruned. 
2026-05-16 03:32:38,897 - experiment_functions - INFO - Early stopping at epoch 750. Best Recall: 0.0972
2026-05-16 03:32:38,988 - optuna.study.study - INFO - Trial 115 finished with value: 0.09724283676877424 and parameters: {'n_layers': 1, 'embedding_dim': 128, 'lr': 0.0011759660721295119, 'lambda_val': 3.377614867879216e-05, 'batch_size': 2622, 'optimizer': 'RMSprop'}. Best is trial 27 with value: 0.12382585735682568.
2026-05-16 03:32:42,819 - experiment_functions - INFO - Early stopping at epoch 550. Best Recall: 0.0970
2026-05-16 03:32:42,922 - optuna.study.study - INFO - Trial 116 finished with value: 0.09703618406170698 and parameters: {'n_layers': 1, 'embedding_dim': 128, 'lr': 0.004355666672064932, 'lambda_val': 1.0571601203147603e-05, 'batch_size': 2827, 'optimizer': 'Adam'}. Best is trial 27 with value: 0.12382585735682568.
2026-05-16 03:32:48,827 - experiment_functions - INFO - Early stopping at epoch 900. Best Recall: 0.1105
2026-05-16 03:32:48,918 - optuna.study.study - INFO - Trial 117 finished with value: 0.11045240136617433 and parameters: {'n_layers': 1, 'embedding_dim': 128, 'lr': 0.0013488251429432253, 'lambda_val': 5.578579359479165e-06, 'batch_size': 2682, 'optimizer': 'Adam'}. Best is trial 27 with value: 0.12382585735682568.
2026-05-16 03:33:04,216 - experiment_functions - INFO - Early stopping at epoch 950. Best Recall: 0.1060
2026-05-16 03:33:04,362 - optuna.study.study - INFO - Trial 118 finished with value: 0.10602755609913199 and parameters: {'n_layers': 1, 'embedding_dim': 128, 'lr': 0.0006905878826447203, 'lambda_val': 0.0003955851684559733, 'batch_size': 3049, 'optimizer': 'Adam'}. Best is trial 27 with value: 0.12382585735682568.
2026-05-16 03:33:09,047 - experiment_functions - INFO - Early stopping at epoch 700. Best Recall: 0.1093
2026-05-16 03:33:09,148 - optuna.study.study - INFO - Trial 119 finished with value: 0.10929654238939716 and parameters: {'n_layers': 1, 'embedding_dim': 128, 'lr': 0.0014550577070053462, 'lambda_val': 4.804174023264687e-06, 'batch_size': 2773, 'optimizer': 'Adam'}. Best is trial 27 with value: 0.12382585735682568.
2026-05-16 03:33:16,031 - optuna.study._optimize - INFO - Trial 120 pruned. 
2026-05-16 03:33:21,440 - experiment_functions - INFO - Early stopping at epoch 850. Best Recall: 0.1077
2026-05-16 03:33:21,578 - optuna.study.study - INFO - Trial 121 finished with value: 0.10769745264087546 and parameters: {'n_layers': 1, 'embedding_dim': 128, 'lr': 0.0013591957119246244, 'lambda_val': 6.770042883731019e-06, 'batch_size': 2687, 'optimizer': 'Adam'}. Best is trial 27 with value: 0.12382585735682568.
2026-05-16 03:33:26,178 - experiment_functions - INFO - Early stopping at epoch 750. Best Recall: 0.0971
2026-05-16 03:33:26,268 - optuna.study.study - INFO - Trial 122 finished with value: 0.09706944255621444 and parameters: {'n_layers': 1, 'embedding_dim': 128, 'lr': 0.0014144351939697122, 'lambda_val': 3.6988591214858108e-06, 'batch_size': 2744, 'optimizer': 'Adam'}. Best is trial 27 with value: 0.12382585735682568.
2026-05-16 03:33:44,988 - experiment_functions - INFO - Early stopping at epoch 1600. Best Recall: 0.1169
2026-05-16 03:33:45,091 - optuna.study.study - INFO - Trial 123 finished with value: 0.1169436291130374 and parameters: {'n_layers': 1, 'embedding_dim': 128, 'lr': 0.0005309014546739434, 'lambda_val': 5.90193477704428e-06, 'batch_size': 2675, 'optimizer': 'Adam'}. Best is trial 27 with value: 0.12382585735682568.
2026-05-16 03:33:51,763 - optuna.study._optimize - INFO - Trial 124 pruned. 
2026-05-16 03:33:59,409 - optuna.study._optimize - INFO - Trial 125 pruned. 
2026-05-16 03:34:05,956 - optuna.study._optimize - INFO - Trial 126 pruned. 
2026-05-16 03:34:13,268 - optuna.study._optimize - INFO - Trial 127 pruned. 
2026-05-16 03:34:20,874 - experiment_functions - INFO - Early stopping at epoch 950. Best Recall: 0.1130
2026-05-16 03:34:20,977 - optuna.study.study - INFO - Trial 128 finished with value: 0.11300448861292833 and parameters: {'n_layers': 1, 'embedding_dim': 256, 'lr': 0.000961521358530698, 'lambda_val': 9.732725214548166e-06, 'batch_size': 2892, 'optimizer': 'Adam'}. Best is trial 27 with value: 0.12382585735682568.
2026-05-16 03:34:27,937 - experiment_functions - INFO - Early stopping at epoch 950. Best Recall: 0.1015
2026-05-16 03:34:28,028 - optuna.study.study - INFO - Trial 129 finished with value: 0.10145428014122498 and parameters: {'n_layers': 1, 'embedding_dim': 256, 'lr': 0.0009592556127886132, 'lambda_val': 1.013996708667967e-05, 'batch_size': 3078, 'optimizer': 'RMSprop'}. Best is trial 27 with value: 0.12382585735682568.
2026-05-16 03:34:46,777 - experiment_functions - INFO - Early stopping at epoch 1400. Best Recall: 0.1145
2026-05-16 03:34:46,868 - optuna.study.study - INFO - Trial 130 finished with value: 0.11447690668788338 and parameters: {'n_layers': 1, 'embedding_dim': 256, 'lr': 0.0005764237935512063, 'lambda_val': 5.947853883194378e-06, 'batch_size': 2922, 'optimizer': 'Adam'}. Best is trial 27 with value: 0.12382585735682568.
2026-05-16 03:34:56,604 - experiment_functions - INFO - Early stopping at epoch 1250. Best Recall: 0.1153
2026-05-16 03:34:56,718 - optuna.study.study - INFO - Trial 131 finished with value: 0.11526899360196838 and parameters: {'n_layers': 1, 'embedding_dim': 256, 'lr': 0.0005225329144782854, 'lambda_val': 5.830394029589331e-06, 'batch_size': 2942, 'optimizer': 'Adam'}. Best is trial 27 with value: 0.12382585735682568.
2026-05-16 03:35:06,182 - experiment_functions - INFO - Early stopping at epoch 1400. Best Recall: 0.1230
2026-05-16 03:35:06,285 - optuna.study.study - INFO - Trial 132 finished with value: 0.12296233482033644 and parameters: {'n_layers': 1, 'embedding_dim': 256, 'lr': 0.0005113357537666017, 'lambda_val': 5.642031547811087e-06, 'batch_size': 2991, 'optimizer': 'Adam'}. Best is trial 27 with value: 0.12382585735682568.
2026-05-16 03:35:21,431 - experiment_functions - INFO - Early stopping at epoch 2200. Best Recall: 0.1264
2026-05-16 03:35:21,535 - optuna.study.study - INFO - Trial 133 finished with value: 0.126434760649906 and parameters: {'n_layers': 1, 'embedding_dim': 256, 'lr': 0.0003771687338064391, 'lambda_val': 3.5491148288464257e-06, 'batch_size': 2953, 'optimizer': 'Adam'}. Best is trial 133 with value: 0.126434760649906.
2026-05-16 03:35:42,997 - optuna.study._optimize - INFO - Trial 134 pruned. 
2026-05-16 03:35:53,278 - experiment_functions - INFO - Early stopping at epoch 1500. Best Recall: 0.1171
2026-05-16 03:35:53,369 - optuna.study.study - INFO - Trial 135 finished with value: 0.1170815877803613 and parameters: {'n_layers': 1, 'embedding_dim': 256, 'lr': 0.0004528030326949378, 'lambda_val': 6.9116072035958055e-06, 'batch_size': 3192, 'optimizer': 'Adam'}. Best is trial 133 with value: 0.126434760649906.
2026-05-16 03:36:01,363 - experiment_functions - INFO - Early stopping at epoch 1250. Best Recall: 0.1213
2026-05-16 03:36:01,467 - optuna.study.study - INFO - Trial 136 finished with value: 0.12127306660349967 and parameters: {'n_layers': 1, 'embedding_dim': 256, 'lr': 0.0005438034713569825, 'lambda_val': 6.678307387136506e-06, 'batch_size': 2905, 'optimizer': 'Adam'}. Best is trial 133 with value: 0.126434760649906.
2026-05-16 03:36:05,154 - experiment_functions - INFO - Early stopping at epoch 500. Best Recall: 0.0037
2026-05-16 03:36:05,256 - optuna.study.study - INFO - Trial 137 finished with value: 0.0037482673539443634 and parameters: {'n_layers': 1, 'embedding_dim': 256, 'lr': 0.0005453795288876904, 'lambda_val': 8.284832836175567e-06, 'batch_size': 3173, 'optimizer': 'SGD'}. Best is trial 133 with value: 0.126434760649906.
2026-05-16 03:36:12,600 - optuna.study._optimize - INFO - Trial 138 pruned. 
2026-05-16 03:36:19,826 - optuna.study._optimize - INFO - Trial 139 pruned. 
2026-05-16 03:36:26,849 - optuna.study._optimize - INFO - Trial 140 pruned. 
2026-05-16 03:36:33,629 - optuna.study._optimize - INFO - Trial 141 pruned. 
2026-05-16 03:36:43,267 - experiment_functions - INFO - Early stopping at epoch 1450. Best Recall: 0.1192
2026-05-16 03:36:43,358 - optuna.study.study - INFO - Trial 142 finished with value: 0.11916109787779487 and parameters: {'n_layers': 1, 'embedding_dim': 256, 'lr': 0.0004737868018318905, 'lambda_val': 3.914731479641626e-06, 'batch_size': 3022, 'optimizer': 'Adam'}. Best is trial 133 with value: 0.126434760649906.
2026-05-16 03:36:50,455 - optuna.study._optimize - INFO - Trial 143 pruned. 
2026-05-16 03:37:08,993 - optuna.study._optimize - INFO - Trial 144 pruned. 
2026-05-16 03:37:15,844 - experiment_functions - INFO - Early stopping at epoch 1050. Best Recall: 0.1197
2026-05-16 03:37:15,943 - optuna.study.study - INFO - Trial 145 finished with value: 0.11972370636747597 and parameters: {'n_layers': 1, 'embedding_dim': 256, 'lr': 0.00068027173439648, 'lambda_val': 8.678201722144275e-06, 'batch_size': 3285, 'optimizer': 'Adam'}. Best is trial 133 with value: 0.126434760649906.
2026-05-16 03:37:22,639 - experiment_functions - INFO - Early stopping at epoch 950. Best Recall: 0.1119
2026-05-16 03:37:22,750 - optuna.study.study - INFO - Trial 146 finished with value: 0.11194362986448164 and parameters: {'n_layers': 1, 'embedding_dim': 256, 'lr': 0.000679285805215446, 'lambda_val': 8.585281886004164e-06, 'batch_size': 3201, 'optimizer': 'Adam'}. Best is trial 133 with value: 0.126434760649906.
2026-05-16 03:37:29,649 - optuna.study._optimize - INFO - Trial 147 pruned. 
2026-05-16 03:37:36,264 - optuna.study._optimize - INFO - Trial 148 pruned. 
2026-05-16 03:37:45,092 - experiment_functions - INFO - Early stopping at epoch 1400. Best Recall: 0.1184
2026-05-16 03:37:45,193 - optuna.study.study - INFO - Trial 149 finished with value: 0.11841591025017209 and parameters: {'n_layers': 1, 'embedding_dim': 256, 'lr': 0.0005619411190802807, 'lambda_val': 3.260972042220478e-06, 'batch_size': 2963, 'optimizer': 'Adam'}. Best is trial 133 with value: 0.126434760649906.
2026-05-16 03:37:51,823 - experiment_functions - INFO - Early stopping at epoch 1050. Best Recall: 0.1140
2026-05-16 03:37:52,102 - optuna.study.study - INFO - Trial 150 finished with value: 0.1140086013028179 and parameters: {'n_layers': 1, 'embedding_dim': 256, 'lr': 0.0005978106923845604, 'lambda_val': 3.46106637184143e-06, 'batch_size': 2954, 'optimizer': 'RMSprop'}. Best is trial 133 with value: 0.126434760649906.
2026-05-16 03:38:09,630 - optuna.study._optimize - INFO - Trial 151 pruned. 
2026-05-16 03:38:16,326 - optuna.study._optimize - INFO - Trial 152 pruned. 
2026-05-16 03:38:22,648 - experiment_functions - INFO - Early stopping at epoch 950. Best Recall: 0.0957
2026-05-16 03:38:22,739 - optuna.study.study - INFO - Trial 153 finished with value: 0.09574487169487793 and parameters: {'n_layers': 1, 'embedding_dim': 256, 'lr': 0.0004104471336987089, 'lambda_val': 3.282231918879618e-06, 'batch_size': 2976, 'optimizer': 'RMSprop'}. Best is trial 133 with value: 0.126434760649906.
2026-05-16 03:38:28,959 - experiment_functions - INFO - Early stopping at epoch 900. Best Recall: 0.1034
2026-05-16 03:38:29,050 - optuna.study.study - INFO - Trial 154 finished with value: 0.10338450947193291 and parameters: {'n_layers': 1, 'embedding_dim': 256, 'lr': 0.0006985123780971901, 'lambda_val': 2.5559795940961006e-06, 'batch_size': 3108, 'optimizer': 'RMSprop'}. Best is trial 133 with value: 0.126434760649906.
2026-05-16 03:38:35,763 - optuna.study._optimize - INFO - Trial 155 pruned. 
2026-05-16 03:38:48,867 - experiment_functions - INFO - Early stopping at epoch 2050. Best Recall: 0.1229
2026-05-16 03:38:48,958 - optuna.study.study - INFO - Trial 156 finished with value: 0.1229272637715722 and parameters: {'n_layers': 1, 'embedding_dim': 256, 'lr': 0.00034960380629589066, 'lambda_val': 6.399479592502791e-06, 'batch_size': 2995, 'optimizer': 'Adam'}. Best is trial 133 with value: 0.126434760649906.
2026-05-16 03:38:55,316 - optuna.study._optimize - INFO - Trial 157 pruned. 
2026-05-16 03:39:01,759 - experiment_functions - INFO - Early stopping at epoch 950. Best Recall: 0.0852
2026-05-16 03:39:01,859 - optuna.study.study - INFO - Trial 158 finished with value: 0.08517861469132089 and parameters: {'n_layers': 1, 'embedding_dim': 256, 'lr': 0.0004338526007148992, 'lambda_val': 0.009496919895108738, 'batch_size': 3024, 'optimizer': 'Adam'}. Best is trial 133 with value: 0.126434760649906.
2026-05-16 03:39:10,796 - optuna.study._optimize - INFO - Trial 159 pruned. 
2026-05-16 03:39:16,847 - experiment_functions - INFO - Early stopping at epoch 950. Best Recall: 0.1162
