2026-05-16 02:51:45,643 - optuna.study.study - INFO - Trial 110 finished with value: 0.0009124195007114541 and parameters: {'n_layers': 1, 'embedding_dim': 256, 'lr': 0.0006892965535285928, 'lambda_val': 2.000265506179618e-06, 'batch_size': 664, 'optimizer': 'SGD'}. Best is trial 97 with value: 0.12940330855701818.
2026-05-16 02:51:52,563 - optuna.study._optimize - INFO - Trial 111 pruned. 
2026-05-16 02:51:59,158 - optuna.study._optimize - INFO - Trial 112 pruned. 
2026-05-16 02:52:14,517 - experiment_functions - INFO - Early stopping at epoch 2600. Best Recall: 0.1249
2026-05-16 02:52:14,607 - optuna.study.study - INFO - Trial 113 finished with value: 0.12494600637222404 and parameters: {'n_layers': 1, 'embedding_dim': 256, 'lr': 0.0005006413310398508, 'lambda_val': 6.812598314989168e-06, 'batch_size': 1104, 'optimizer': 'Adam'}. Best is trial 97 with value: 0.12940330855701818.
2026-05-16 02:52:28,740 - experiment_functions - INFO - Early stopping at epoch 2150. Best Recall: 0.1308
2026-05-16 02:52:28,844 - optuna.study.study - INFO - Trial 114 finished with value: 0.1307772515623784 and parameters: {'n_layers': 1, 'embedding_dim': 256, 'lr': 0.0005085602866187688, 'lambda_val': 6.531786550535526e-06, 'batch_size': 1098, 'optimizer': 'Adam'}. Best is trial 114 with value: 0.1307772515623784.
2026-05-16 02:52:35,182 - optuna.study._optimize - INFO - Trial 115 pruned. 
2026-05-16 02:52:41,601 - optuna.study._optimize - INFO - Trial 116 pruned. 
2026-05-16 02:52:48,548 - experiment_functions - INFO - Early stopping at epoch 1100. Best Recall: 0.1197
2026-05-16 02:52:48,640 - optuna.study.study - INFO - Trial 117 finished with value: 0.11969263590837036 and parameters: {'n_layers': 1, 'embedding_dim': 256, 'lr': 0.0009321173454696662, 'lambda_val': 1.2320126071795637e-06, 'batch_size': 1092, 'optimizer': 'Adam'}. Best is trial 114 with value: 0.1307772515623784.
2026-05-16 02:52:55,129 - optuna.study._optimize - INFO - Trial 118 pruned. 
2026-05-16 02:53:03,475 - optuna.study._optimize - INFO - Trial 119 pruned. 
2026-05-16 02:53:08,147 - experiment_functions - INFO - Early stopping at epoch 650. Best Recall: 0.0034
2026-05-16 02:53:08,261 - optuna.study.study - INFO - Trial 120 finished with value: 0.003360645702014331 and parameters: {'n_layers': 1, 'embedding_dim': 256, 'lr': 1.744739472005911e-05, 'lambda_val': 1.5054912045516201e-06, 'batch_size': 1184, 'optimizer': 'Adam'}. Best is trial 114 with value: 0.1307772515623784.
2026-05-16 02:53:20,310 - experiment_functions - INFO - Early stopping at epoch 1850. Best Recall: 0.1279
2026-05-16 02:53:20,453 - optuna.study.study - INFO - Trial 121 finished with value: 0.12793407634773335 and parameters: {'n_layers': 1, 'embedding_dim': 256, 'lr': 0.0006584975054562052, 'lambda_val': 1.0721093758425915e-05, 'batch_size': 1067, 'optimizer': 'Adam'}. Best is trial 114 with value: 0.1307772515623784.
2026-05-16 02:53:27,057 - optuna.study._optimize - INFO - Trial 122 pruned. 
2026-05-16 02:53:38,093 - experiment_functions - INFO - Early stopping at epoch 1500. Best Recall: 0.1255
2026-05-16 02:53:38,247 - optuna.study.study - INFO - Trial 123 finished with value: 0.12553134798383786 and parameters: {'n_layers': 1, 'embedding_dim': 256, 'lr': 0.0007459395897901638, 'lambda_val': 1.135009454118927e-05, 'batch_size': 1098, 'optimizer': 'Adam'}. Best is trial 114 with value: 0.1307772515623784.
2026-05-16 02:53:51,914 - experiment_functions - INFO - Early stopping at epoch 2250. Best Recall: 0.1289
2026-05-16 02:53:51,993 - optuna.study.study - INFO - Trial 124 finished with value: 0.1289235111785976 and parameters: {'n_layers': 1, 'embedding_dim': 256, 'lr': 0.000798997236356103, 'lambda_val': 8.026725087902957e-06, 'batch_size': 837, 'optimizer': 'Adam'}. Best is trial 114 with value: 0.1307772515623784.
2026-05-16 02:54:07,137 - optuna.study._optimize - INFO - Trial 125 pruned. 
2026-05-16 02:54:13,953 - optuna.study._optimize - INFO - Trial 126 pruned. 
2026-05-16 02:54:41,524 - experiment_functions - INFO - Early stopping at epoch 3650. Best Recall: 0.1418
2026-05-16 02:54:41,640 - optuna.study.study - INFO - Trial 127 finished with value: 0.14175544438329954 and parameters: {'n_layers': 1, 'embedding_dim': 256, 'lr': 0.000496369406330372, 'lambda_val': 5.611617533250996e-06, 'batch_size': 993, 'optimizer': 'Adam'}. Best is trial 127 with value: 0.14175544438329954.
2026-05-16 02:54:48,449 - optuna.study._optimize - INFO - Trial 128 pruned. 
2026-05-16 02:54:54,633 - experiment_functions - INFO - Early stopping at epoch 900. Best Recall: 0.1111
2026-05-16 02:54:54,742 - optuna.study.study - INFO - Trial 129 finished with value: 0.1111034363957542 and parameters: {'n_layers': 1, 'embedding_dim': 256, 'lr': 0.0012356304515531045, 'lambda_val': 5.151998444427893e-06, 'batch_size': 1240, 'optimizer': 'Adam'}. Best is trial 127 with value: 0.14175544438329954.
2026-05-16 02:55:04,538 - optuna.study._optimize - INFO - Trial 130 pruned. 
2026-05-16 02:55:23,804 - experiment_functions - INFO - Early stopping at epoch 3200. Best Recall: 0.1353
2026-05-16 02:55:23,903 - optuna.study.study - INFO - Trial 131 finished with value: 0.1353321640881774 and parameters: {'n_layers': 1, 'embedding_dim': 256, 'lr': 0.0005021631650496598, 'lambda_val': 6.379186850466883e-06, 'batch_size': 1164, 'optimizer': 'Adam'}. Best is trial 127 with value: 0.14175544438329954.
2026-05-16 02:55:35,571 - optuna.study._optimize - INFO - Trial 132 pruned. 
2026-05-16 02:55:42,223 - optuna.study._optimize - INFO - Trial 133 pruned. 
2026-05-16 02:55:55,770 - experiment_functions - INFO - Early stopping at epoch 2300. Best Recall: 0.1350
2026-05-16 02:55:55,860 - optuna.study.study - INFO - Trial 134 finished with value: 0.13504155101375492 and parameters: {'n_layers': 1, 'embedding_dim': 256, 'lr': 0.0005750011895515125, 'lambda_val': 5.779403958490115e-06, 'batch_size': 902, 'optimizer': 'Adam'}. Best is trial 127 with value: 0.14175544438329954.
2026-05-16 02:56:02,389 - optuna.study._optimize - INFO - Trial 135 pruned. 
2026-05-16 02:56:10,453 - optuna.study._optimize - INFO - Trial 136 pruned. 
2026-05-16 02:56:22,305 - experiment_functions - INFO - Early stopping at epoch 1850. Best Recall: 0.1275
2026-05-16 02:56:22,425 - optuna.study.study - INFO - Trial 137 finished with value: 0.1275219578465732 and parameters: {'n_layers': 1, 'embedding_dim': 256, 'lr': 0.0006292354888516954, 'lambda_val': 4.495817318130881e-06, 'batch_size': 988, 'optimizer': 'Adam'}. Best is trial 127 with value: 0.14175544438329954.
2026-05-16 02:56:29,584 - optuna.study._optimize - INFO - Trial 138 pruned. 
2026-05-16 02:56:32,986 - experiment_functions - INFO - Early stopping at epoch 500. Best Recall: 0.0036
2026-05-16 02:56:33,077 - optuna.study.study - INFO - Trial 139 finished with value: 0.0035630642527310187 and parameters: {'n_layers': 1, 'embedding_dim': 256, 'lr': 0.0008676370480450197, 'lambda_val': 7.890641170764172e-06, 'batch_size': 728, 'optimizer': 'SGD'}. Best is trial 127 with value: 0.14175544438329954.
2026-05-16 02:56:38,933 - optuna.study._optimize - INFO - Trial 140 pruned. 
2026-05-16 02:57:05,770 - experiment_functions - INFO - Early stopping at epoch 3100. Best Recall: 0.1345
2026-05-16 02:57:05,871 - optuna.study.study - INFO - Trial 141 finished with value: 0.13452868364375237 and parameters: {'n_layers': 1, 'embedding_dim': 256, 'lr': 0.0004911091607330174, 'lambda_val': 6.260326704417139e-06, 'batch_size': 1092, 'optimizer': 'Adam'}. Best is trial 127 with value: 0.14175544438329954.
2026-05-16 02:57:12,655 - optuna.study._optimize - INFO - Trial 142 pruned. 
2026-05-16 02:57:18,931 - optuna.study._optimize - INFO - Trial 143 pruned. 
2026-05-16 02:57:25,542 - optuna.study._optimize - INFO - Trial 144 pruned. 
2026-05-16 02:57:34,883 - optuna.study._optimize - INFO - Trial 145 pruned. 
2026-05-16 02:57:40,937 - optuna.study._optimize - INFO - Trial 146 pruned. 
2026-05-16 02:57:47,324 - optuna.study._optimize - INFO - Trial 147 pruned. 
2026-05-16 02:57:54,283 - optuna.study._optimize - INFO - Trial 148 pruned. 
2026-05-16 02:58:16,587 - experiment_functions - INFO - Early stopping at epoch 3750. Best Recall: 0.1359
2026-05-16 02:58:16,665 - optuna.study.study - INFO - Trial 149 finished with value: 0.13585118116876838 and parameters: {'n_layers': 1, 'embedding_dim': 256, 'lr': 0.0005246307132871445, 'lambda_val': 8.477912470454896e-06, 'batch_size': 911, 'optimizer': 'Adam'}. Best is trial 127 with value: 0.14175544438329954.
2026-05-16 02:58:22,774 - optuna.study._optimize - INFO - Trial 150 pruned. 
2026-05-16 02:58:31,271 - optuna.study._optimize - INFO - Trial 151 pruned. 
2026-05-16 02:58:37,629 - optuna.study._optimize - INFO - Trial 152 pruned. 
2026-05-16 02:58:44,434 - optuna.study._optimize - INFO - Trial 153 pruned. 
2026-05-16 02:58:51,672 - optuna.study._optimize - INFO - Trial 154 pruned. 
2026-05-16 02:59:04,038 - experiment_functions - INFO - Early stopping at epoch 2000. Best Recall: 0.1281
2026-05-16 02:59:04,140 - optuna.study.study - INFO - Trial 155 finished with value: 0.12806781290990457 and parameters: {'n_layers': 1, 'embedding_dim': 256, 'lr': 0.0005498838372086786, 'lambda_val': 2.4957084856260377e-05, 'batch_size': 963, 'optimizer': 'Adam'}. Best is trial 127 with value: 0.14175544438329954.
2026-05-16 02:59:11,401 - optuna.study._optimize - INFO - Trial 156 pruned. 
2026-05-16 02:59:18,126 - optuna.study._optimize - INFO - Trial 157 pruned. 
2026-05-16 02:59:25,236 - optuna.study._optimize - INFO - Trial 158 pruned. 
2026-05-16 02:59:40,256 - experiment_functions - INFO - Early stopping at epoch 2550. Best Recall: 0.1285
2026-05-16 02:59:43,020 - optuna.study.study - INFO - Trial 159 finished with value: 0.12847713553508902 and parameters: {'n_layers': 1, 'embedding_dim': 256, 'lr': 0.0005962483462756206, 'lambda_val': 2.811248520366877e-05, 'batch_size': 1314, 'optimizer': 'Adam'}. Best is trial 127 with value: 0.14175544438329954.
2026-05-16 02:59:54,861 - experiment_functions - INFO - Early stopping at epoch 1700. Best Recall: 0.1276
2026-05-16 02:59:54,970 - optuna.study.study - INFO - Trial 160 finished with value: 0.1276379230781531 and parameters: {'n_layers': 1, 'embedding_dim': 256, 'lr': 0.0006233450281894226, 'lambda_val': 2.8686041808097013e-05, 'batch_size': 1295, 'optimizer': 'Adam'}. Best is trial 127 with value: 0.14175544438329954.
2026-05-16 03:00:02,656 - optuna.study._optimize - INFO - Trial 161 pruned. 
2026-05-16 03:00:09,623 - optuna.study._optimize - INFO - Trial 162 pruned. 
2026-05-16 03:00:15,387 - experiment_functions - INFO - Early stopping at epoch 800. Best Recall: 0.1113
2026-05-16 03:00:15,488 - optuna.study.study - INFO - Trial 163 finished with value: 0.11131496732544476 and parameters: {'n_layers': 1, 'embedding_dim': 256, 'lr': 0.000909861894623323, 'lambda_val': 0.0070708916220128025, 'batch_size': 1314, 'optimizer': 'Adam'}. Best is trial 127 with value: 0.14175544438329954.
2026-05-16 03:00:27,496 - experiment_functions - INFO - Early stopping at epoch 1950. Best Recall: 0.1327
2026-05-16 03:00:27,615 - optuna.study.study - INFO - Trial 164 finished with value: 0.1327087705194834 and parameters: {'n_layers': 1, 'embedding_dim': 256, 'lr': 0.0005463033919718926, 'lambda_val': 4.0643120396249384e-05, 'batch_size': 1197, 'optimizer': 'Adam'}. Best is trial 127 with value: 0.14175544438329954.
2026-05-16 03:00:37,968 - experiment_functions - INFO - Early stopping at epoch 1550. Best Recall: 0.1211
2026-05-16 03:00:38,087 - optuna.study.study - INFO - Trial 165 finished with value: 0.1211460560902899 and parameters: {'n_layers': 1, 'embedding_dim': 256, 'lr': 0.0007841210489926499, 'lambda_val': 5.533828795436579e-05, 'batch_size': 1061, 'optimizer': 'Adam'}. Best is trial 127 with value: 0.14175544438329954.
2026-05-16 03:00:46,083 - optuna.study._optimize - INFO - Trial 166 pruned. 
2026-05-16 03:01:00,806 - experiment_functions - INFO - Early stopping at epoch 2350. Best Recall: 0.1361
2026-05-16 03:01:00,908 - optuna.study.study - INFO - Trial 167 finished with value: 0.13612572795768685 and parameters: {'n_layers': 1, 'embedding_dim': 256, 'lr': 0.00046413363643581636, 'lambda_val': 6.636194410307993e-06, 'batch_size': 1203, 'optimizer': 'Adam'}. Best is trial 127 with value: 0.14175544438329954.
2026-05-16 03:01:08,729 - optuna.study._optimize - INFO - Trial 168 pruned. 
2026-05-16 03:01:12,058 - experiment_functions - INFO - Early stopping at epoch 500. Best Recall: 0.0035
2026-05-16 03:01:12,158 - optuna.study.study - INFO - Trial 169 finished with value: 0.0035375268511547418 and parameters: {'n_layers': 1, 'embedding_dim': 32, 'lr': 0.0009964466673743906, 'lambda_val': 9.3619667292696e-06, 'batch_size': 1275, 'optimizer': 'SGD'}. Best is trial 127 with value: 0.14175544438329954.
2026-05-16 03:01:19,294 - optuna.study._optimize - INFO - Trial 170 pruned. 
2026-05-16 03:01:29,791 - experiment_functions - INFO - Early stopping at epoch 1700. Best Recall: 0.1272
2026-05-16 03:01:29,882 - optuna.study.study - INFO - Trial 171 finished with value: 0.12721579893896412 and parameters: {'n_layers': 1, 'embedding_dim': 256, 'lr': 0.0005898853563999275, 'lambda_val': 6.113645791613289e-06, 'batch_size': 1047, 'optimizer': 'Adam'}. Best is trial 127 with value: 0.14175544438329954.
2026-05-16 03:01:36,487 - optuna.study._optimize - INFO - Trial 172 pruned. 
2026-05-16 03:01:45,002 - optuna.study._optimize - INFO - Trial 173 pruned. 
2026-05-16 03:01:53,059 - experiment_functions - INFO - Early stopping at epoch 1200. Best Recall: 0.1227
2026-05-16 03:01:53,167 - optuna.study.study - INFO - Trial 174 finished with value: 0.12269546788114256 and parameters: {'n_layers': 1, 'embedding_dim': 256, 'lr': 0.0005466637017030946, 'lambda_val': 4.8390162731646935e-06, 'batch_size': 4096, 'optimizer': 'Adam'}. Best is trial 127 with value: 0.14175544438329954.
2026-05-16 03:01:59,530 - optuna.study._optimize - INFO - Trial 175 pruned. 
2026-05-16 03:02:07,988 - optuna.study._optimize - INFO - Trial 176 pruned. 
2026-05-16 03:02:14,089 - experiment_functions - INFO - Early stopping at epoch 1000. Best Recall: 0.1170
2026-05-16 03:02:14,180 - optuna.study.study - INFO - Trial 177 finished with value: 0.11697470878180002 and parameters: {'n_layers': 1, 'embedding_dim': 256, 'lr': 0.0011064316835970231, 'lambda_val': 7.380383849794849e-06, 'batch_size': 1187, 'optimizer': 'Adam'}. Best is trial 127 with value: 0.14175544438329954.
2026-05-16 03:02:24,334 - experiment_functions - INFO - Early stopping at epoch 1650. Best Recall: 0.1232
2026-05-16 03:02:24,424 - optuna.study.study - INFO - Trial 178 finished with value: 0.123153651674099 and parameters: {'n_layers': 1, 'embedding_dim': 256, 'lr': 0.0004916129627246776, 'lambda_val': 1.4098158830595697e-05, 'batch_size': 1088, 'optimizer': 'RMSprop'}. Best is trial 127 with value: 0.14175544438329954.
2026-05-16 03:02:30,732 - optuna.study._optimize - INFO - Trial 179 pruned. 
2026-05-16 03:02:37,394 - optuna.study._optimize - INFO - Trial 180 pruned. 
2026-05-16 03:02:44,570 - optuna.study._optimize - INFO - Trial 181 pruned. 
2026-05-16 03:02:51,404 - optuna.study._optimize - INFO - Trial 182 pruned. 
2026-05-16 03:02:58,142 - optuna.study._optimize - INFO - Trial 183 pruned. 
2026-05-16 03:03:05,424 - optuna.study._optimize - INFO - Trial 184 pruned. 
2026-05-16 03:03:11,833 - optuna.study._optimize - INFO - Trial 185 pruned. 
2026-05-16 03:03:22,346 - optuna.study._optimize - INFO - Trial 186 pruned. 
2026-05-16 03:03:30,396 - optuna.study._optimize - INFO - Trial 187 pruned. 
2026-05-16 03:03:37,657 - optuna.study._optimize - INFO - Trial 188 pruned. 
2026-05-16 03:03:44,550 - optuna.study._optimize - INFO - Trial 189 pruned. 
2026-05-16 03:03:56,615 - experiment_functions - INFO - Early stopping at epoch 1950. Best Recall: 0.1273
2026-05-16 03:03:56,717 - optuna.study.study - INFO - Trial 190 finished with value: 0.12731693694536061 and parameters: {'n_layers': 1, 'embedding_dim': 256, 'lr': 0.000847508235718668, 'lambda_val': 1.2606787969899868e-05, 'batch_size': 920, 'optimizer': 'Adam'}. Best is trial 127 with value: 0.14175544438329954.
2026-05-16 03:04:03,101 - optuna.study._optimize - INFO - Trial 191 pruned. 
2026-05-16 03:04:14,597 - optuna.study._optimize - INFO - Trial 192 pruned. 
2026-05-16 03:04:21,593 - experiment_functions - INFO - Early stopping at epoch 1050. Best Recall: 0.1244
2026-05-16 03:04:21,691 - optuna.study.study - INFO - Trial 193 finished with value: 0.12438355813465377 and parameters: {'n_layers': 1, 'embedding_dim': 256, 'lr': 0.0008883613826533869, 'lambda_val': 1.5440004098234835e-05, 'batch_size': 1136, 'optimizer': 'Adam'}. Best is trial 127 with value: 0.14175544438329954.
2026-05-16 03:04:28,622 - optuna.study._optimize - INFO - Trial 194 pruned. 
2026-05-16 03:04:35,368 - optuna.study._optimize - INFO - Trial 195 pruned. 
2026-05-16 03:04:45,175 - experiment_functions - INFO - Early stopping at epoch 1550. Best Recall: 0.1277
2026-05-16 03:04:45,319 - optuna.study.study - INFO - Trial 196 finished with value: 0.12774530156818098 and parameters: {'n_layers': 1, 'embedding_dim': 256, 'lr': 0.0007519105017957801, 'lambda_val': 5.358403786222648e-06, 'batch_size': 1077, 'optimizer': 'Adam'}. Best is trial 127 with value: 0.14175544438329954.
2026-05-16 03:04:51,297 - experiment_functions - INFO - Early stopping at epoch 900. Best Recall: 0.1095
2026-05-16 03:04:51,397 - optuna.study.study - INFO - Trial 197 finished with value: 0.10950361827166956 and parameters: {'n_layers': 1, 'embedding_dim': 256, 'lr': 0.001358389895767716, 'lambda_val': 5.7397682883058075e-06, 'batch_size': 1284, 'optimizer': 'Adam'}. Best is trial 127 with value: 0.14175544438329954.
2026-05-16 03:04:57,400 - optuna.study._optimize - INFO - Trial 198 pruned. 
2026-05-16 03:05:04,196 - optuna.study._optimize - INFO - Trial 199 pruned. 
2026-05-16 03:05:07,673 - experiment_functions - INFO - Early stopping at epoch 500. Best Recall: 0.0034
2026-05-16 03:05:07,764 - optuna.study.study - INFO - Trial 200 finished with value: 0.0033656737159682695 and parameters: {'n_layers': 1, 'embedding_dim': 256, 'lr': 0.0004706564964454609, 'lambda_val': 5.410903033621365e-06, 'batch_size': 1479, 'optimizer': 'SGD'}. Best is trial 127 with value: 0.14175544438329954.
2026-05-16 03:05:15,811 - optuna.study._optimize - INFO - Trial 201 pruned. 
2026-05-16 03:05:22,640 - optuna.study._optimize - INFO - Trial 202 pruned. 
2026-05-16 03:05:31,748 - experiment_functions - INFO - Early stopping at epoch 1050. Best Recall: 0.1284
2026-05-16 03:05:31,849 - optuna.study.study - INFO - Trial 203 finished with value: 0.12839741686818207 and parameters: {'n_layers': 1, 'embedding_dim': 256, 'lr': 0.0008389748147051506, 'lambda_val': 8.849301089796898e-06, 'batch_size': 1233, 'optimizer': 'Adam'}. Best is trial 127 with value: 0.14175544438329954.
2026-05-16 03:05:40,970 - experiment_functions - INFO - Early stopping at epoch 1450. Best Recall: 0.1295
2026-05-16 03:05:41,070 - optuna.study.study - INFO - Trial 204 finished with value: 0.12947767207916736 and parameters: {'n_layers': 1, 'embedding_dim': 256, 'lr': 0.0006964215659109496, 'lambda_val': 6.6679544788818864e-06, 'batch_size': 1227, 'optimizer': 'Adam'}. Best is trial 127 with value: 0.14175544438329954.
2026-05-16 03:05:47,424 - optuna.study._optimize - INFO - Trial 205 pruned. 
2026-05-16 03:05:53,630 - experiment_functions - INFO - Early stopping at epoch 900. Best Recall: 0.1243
2026-05-16 03:05:53,731 - optuna.study.study - INFO - Trial 206 finished with value: 0.1242777739829082 and parameters: {'n_layers': 1, 'embedding_dim': 256, 'lr': 0.0011475589514882833, 'lambda_val': 8.711735195403871e-06, 'batch_size': 1320, 'optimizer': 'Adam'}. Best is trial 127 with value: 0.14175544438329954.
2026-05-16 03:06:01,973 - optuna.study._optimize - INFO - Trial 207 pruned. 
2026-05-16 03:06:08,101 - optuna.study._optimize - INFO - Trial 208 pruned. 
2026-05-16 03:06:14,990 - optuna.study._optimize - INFO - Trial 209 pruned. 
2026-05-16 03:06:24,741 - optuna.study._optimize - INFO - Trial 210 pruned. 
2026-05-16 03:06:31,106 - optuna.study._optimize - INFO - Trial 211 pruned. 
2026-05-16 03:06:37,759 - optuna.study._optimize - INFO - Trial 212 pruned. 
2026-05-16 03:06:46,423 - experiment_functions - INFO - Early stopping at epoch 1400. Best Recall: 0.1325
2026-05-16 03:06:46,514 - optuna.study.study - INFO - Trial 213 finished with value: 0.13247046557501418 and parameters: {'n_layers': 1, 'embedding_dim': 256, 'lr': 0.0006302140600333247, 'lambda_val': 2.798980889500804e-05, 'batch_size': 1145, 'optimizer': 'Adam'}. Best is trial 127 with value: 0.14175544438329954.
2026-05-16 03:06:55,650 - optuna.study._optimize - INFO - Trial 214 pruned. 
2026-05-16 03:07:01,850 - experiment_functions - INFO - Early stopping at epoch 1000. Best Recall: 0.1217
2026-05-16 03:07:01,940 - optuna.study.study - INFO - Trial 215 finished with value: 0.12168730849267699 and parameters: {'n_layers': 1, 'embedding_dim': 256, 'lr': 0.0009144653932107911, 'lambda_val': 2.075049549258954e-05, 'batch_size': 1231, 'optimizer': 'Adam'}. Best is trial 127 with value: 0.14175544438329954.
2026-05-16 03:07:10,331 - optuna.study._optimize - INFO - Trial 216 pruned. 
2026-05-16 03:07:19,090 - experiment_functions - INFO - Early stopping at epoch 1350. Best Recall: 0.1235
2026-05-16 03:07:19,186 - optuna.study.study - INFO - Trial 217 finished with value: 0.12349105351355721 and parameters: {'n_layers': 1, 'embedding_dim': 256, 'lr': 0.0007463517694287042, 'lambda_val': 4.042172363428019e-05, 'batch_size': 1015, 'optimizer': 'Adam'}. Best is trial 127 with value: 0.14175544438329954.
2026-05-16 03:07:26,370 - optuna.study._optimize - INFO - Trial 218 pruned. 
2026-05-16 03:07:38,452 - experiment_functions - INFO - Early stopping at epoch 2100. Best Recall: 0.1365
