2026-05-15 21:10:27,786 - optuna.study.study - INFO - Trial 6 finished with value: 0.001426082936138748 and parameters: {'n_layers': 4, 'embedding_dim': 96, 'lr': 0.004271377053230462, 'lambda_val': 5.6856796579572336e-05, 'batch_size': 1604, 'optimizer': 'SGD'}. Best is trial 1 with value: 0.1140356243916405.
2026-05-15 21:10:32,493 - experiment_functions - INFO - Early stopping at epoch 700. Best Recall: 0.0424
2026-05-15 21:10:32,595 - optuna.study.study - INFO - Trial 7 finished with value: 0.04235706784253129 and parameters: {'n_layers': 3, 'embedding_dim': 64, 'lr': 0.0027550191192317205, 'lambda_val': 1.5671969531183208e-05, 'batch_size': 1829, 'optimizer': 'Adam'}. Best is trial 1 with value: 0.1140356243916405.
2026-05-15 21:10:45,512 - experiment_functions - INFO - Early stopping at epoch 500. Best Recall: 0.0176
2026-05-15 21:10:46,275 - optuna.study.study - INFO - Trial 8 finished with value: 0.01761791482711481 and parameters: {'n_layers': 2, 'embedding_dim': 256, 'lr': 0.0795544099255304, 'lambda_val': 9.585707389713497e-06, 'batch_size': 1631, 'optimizer': 'RMSprop'}. Best is trial 1 with value: 0.1140356243916405.
2026-05-15 21:10:51,338 - experiment_functions - INFO - Early stopping at epoch 500. Best Recall: 0.0019
2026-05-15 21:10:51,507 - optuna.study.study - INFO - Trial 9 finished with value: 0.0018765246605033418 and parameters: {'n_layers': 4, 'embedding_dim': 256, 'lr': 0.0007029018792731155, 'lambda_val': 0.002180418815775293, 'batch_size': 3316, 'optimizer': 'SGD'}. Best is trial 1 with value: 0.1140356243916405.
2026-05-15 21:10:58,266 - experiment_functions - INFO - Early stopping at epoch 550. Best Recall: 0.0017
2026-05-15 21:10:58,412 - optuna.study.study - INFO - Trial 10 finished with value: 0.001749369065284198 and parameters: {'n_layers': 1, 'embedding_dim': 128, 'lr': 4.075589223046498e-05, 'lambda_val': 0.09311839194807967, 'batch_size': 2901, 'optimizer': 'Adam'}. Best is trial 1 with value: 0.1140356243916405.
2026-05-15 21:11:04,875 - optuna.study._optimize - INFO - Trial 11 pruned. 
2026-05-15 21:11:10,831 - optuna.study._optimize - INFO - Trial 12 pruned. 
2026-05-15 21:11:18,082 - optuna.study._optimize - INFO - Trial 13 pruned. 
2026-05-15 21:11:23,700 - experiment_functions - INFO - Early stopping at epoch 900. Best Recall: 0.1050
2026-05-15 21:11:23,802 - optuna.study.study - INFO - Trial 14 finished with value: 0.1049691485187679 and parameters: {'n_layers': 1, 'embedding_dim': 128, 'lr': 0.0011975245697092675, 'lambda_val': 9.218811279622492e-06, 'batch_size': 3288, 'optimizer': 'Adam'}. Best is trial 1 with value: 0.1140356243916405.
2026-05-15 21:11:29,952 - experiment_functions - INFO - Early stopping at epoch 500. Best Recall: 0.0030
2026-05-15 21:11:30,103 - optuna.study.study - INFO - Trial 15 finished with value: 0.003047259301265695 and parameters: {'n_layers': 1, 'embedding_dim': 128, 'lr': 1.3086721890523824e-05, 'lambda_val': 3.7021654985543006e-05, 'batch_size': 3041, 'optimizer': 'Adam'}. Best is trial 1 with value: 0.1140356243916405.
2026-05-15 21:11:36,443 - optuna.study._optimize - INFO - Trial 16 pruned. 
2026-05-15 21:11:42,410 - optuna.study._optimize - INFO - Trial 17 pruned. 
2026-05-15 21:11:57,754 - optuna.study._optimize - INFO - Trial 18 pruned. 
2026-05-15 21:12:02,872 - experiment_functions - INFO - Early stopping at epoch 750. Best Recall: 0.1099
2026-05-15 21:12:02,976 - optuna.study.study - INFO - Trial 19 finished with value: 0.10986491694245089 and parameters: {'n_layers': 1, 'embedding_dim': 128, 'lr': 0.001420575748782157, 'lambda_val': 4.159377925212192e-06, 'batch_size': 2287, 'optimizer': 'Adam'}. Best is trial 1 with value: 0.1140356243916405.
2026-05-15 21:12:16,585 - optuna.study._optimize - INFO - Trial 20 pruned. 
2026-05-15 21:12:21,626 - experiment_functions - INFO - Early stopping at epoch 800. Best Recall: 0.1019
2026-05-15 21:12:21,727 - optuna.study.study - INFO - Trial 21 finished with value: 0.101945978938624 and parameters: {'n_layers': 1, 'embedding_dim': 128, 'lr': 0.0014155297214841587, 'lambda_val': 4.204293513200201e-06, 'batch_size': 3064, 'optimizer': 'Adam'}. Best is trial 1 with value: 0.1140356243916405.
2026-05-15 21:12:29,149 - optuna.study._optimize - INFO - Trial 22 pruned. 
2026-05-15 21:12:43,156 - experiment_functions - INFO - Early stopping at epoch 650. Best Recall: 0.0978
2026-05-15 21:12:43,918 - optuna.study.study - INFO - Trial 23 finished with value: 0.09782180792250655 and parameters: {'n_layers': 1, 'embedding_dim': 128, 'lr': 0.0017395462929832414, 'lambda_val': 1.1770741591089387e-05, 'batch_size': 2615, 'optimizer': 'Adam'}. Best is trial 1 with value: 0.1140356243916405.
2026-05-15 21:12:50,723 - optuna.study._optimize - INFO - Trial 24 pruned. 
2026-05-15 21:12:56,350 - experiment_functions - INFO - Early stopping at epoch 900. Best Recall: 0.0667
2026-05-15 21:12:56,442 - optuna.study.study - INFO - Trial 25 finished with value: 0.06668426801069695 and parameters: {'n_layers': 2, 'embedding_dim': 64, 'lr': 0.0008063773138575511, 'lambda_val': 1.821374089296004e-05, 'batch_size': 2831, 'optimizer': 'Adam'}. Best is trial 1 with value: 0.1140356243916405.
2026-05-15 21:13:01,390 - experiment_functions - INFO - Early stopping at epoch 700. Best Recall: 0.0904
2026-05-15 21:13:01,492 - optuna.study.study - INFO - Trial 26 finished with value: 0.09036156754263466 and parameters: {'n_layers': 1, 'embedding_dim': 128, 'lr': 0.002518664307909441, 'lambda_val': 3.876490375851445e-06, 'batch_size': 1234, 'optimizer': 'Adam'}. Best is trial 1 with value: 0.1140356243916405.
2026-05-15 21:13:08,238 - optuna.study._optimize - INFO - Trial 27 pruned. 
2026-05-15 21:13:11,948 - experiment_functions - INFO - Early stopping at epoch 550. Best Recall: 0.0775
2026-05-15 21:13:12,050 - optuna.study.study - INFO - Trial 28 finished with value: 0.07754252265800622 and parameters: {'n_layers': 1, 'embedding_dim': 128, 'lr': 0.009344407774339026, 'lambda_val': 5.7892438778656865e-06, 'batch_size': 3218, 'optimizer': 'Adam'}. Best is trial 1 with value: 0.1140356243916405.
2026-05-15 21:13:16,207 - experiment_functions - INFO - Early stopping at epoch 500. Best Recall: 0.0024
2026-05-15 21:13:16,332 - optuna.study.study - INFO - Trial 29 finished with value: 0.002352676656206836 and parameters: {'n_layers': 3, 'embedding_dim': 128, 'lr': 0.005001587827784135, 'lambda_val': 0.0006942305237454353, 'batch_size': 3584, 'optimizer': 'SGD'}. Best is trial 1 with value: 0.1140356243916405.
2026-05-15 21:13:20,069 - experiment_functions - INFO - Early stopping at epoch 500. Best Recall: 0.0024
2026-05-15 21:13:20,151 - optuna.study.study - INFO - Trial 30 finished with value: 0.002434809172563166 and parameters: {'n_layers': 1, 'embedding_dim': 32, 'lr': 9.075173524609633e-05, 'lambda_val': 2.51540148885448e-05, 'batch_size': 2448, 'optimizer': 'SGD'}. Best is trial 1 with value: 0.1140356243916405.
2026-05-15 21:13:24,846 - experiment_functions - INFO - Early stopping at epoch 750. Best Recall: 0.0973
2026-05-15 21:13:24,949 - optuna.study.study - INFO - Trial 31 finished with value: 0.09726463551385758 and parameters: {'n_layers': 1, 'embedding_dim': 128, 'lr': 0.00138723578931066, 'lambda_val': 3.2806467640827164e-06, 'batch_size': 3200, 'optimizer': 'Adam'}. Best is trial 1 with value: 0.1140356243916405.
2026-05-15 21:13:31,451 - optuna.study._optimize - INFO - Trial 32 pruned. 
2026-05-15 21:13:39,925 - optuna.study._optimize - INFO - Trial 33 pruned. 
2026-05-15 21:13:44,393 - experiment_functions - INFO - Early stopping at epoch 600. Best Recall: 0.0594
2026-05-15 21:13:44,495 - optuna.study.study - INFO - Trial 34 finished with value: 0.059417108825251724 and parameters: {'n_layers': 2, 'embedding_dim': 96, 'lr': 0.002573981514396623, 'lambda_val': 1.924725129396678e-06, 'batch_size': 2062, 'optimizer': 'Adam'}. Best is trial 1 with value: 0.1140356243916405.
2026-05-15 21:13:50,145 - experiment_functions - INFO - Early stopping at epoch 750. Best Recall: 0.0996
2026-05-15 21:13:50,252 - optuna.study.study - INFO - Trial 35 finished with value: 0.09959918267336143 and parameters: {'n_layers': 1, 'embedding_dim': 256, 'lr': 0.0010975581369847913, 'lambda_val': 7.601282431956479e-06, 'batch_size': 2966, 'optimizer': 'RMSprop'}. Best is trial 1 with value: 0.1140356243916405.
2026-05-15 21:13:56,386 - experiment_functions - INFO - Early stopping at epoch 700. Best Recall: 0.0903
2026-05-15 21:13:56,478 - optuna.study.study - INFO - Trial 36 finished with value: 0.09032935149356874 and parameters: {'n_layers': 1, 'embedding_dim': 64, 'lr': 0.0031302656877240636, 'lambda_val': 2.9485918848226607e-06, 'batch_size': 2707, 'optimizer': 'Adam'}. Best is trial 1 with value: 0.1140356243916405.
2026-05-15 21:13:59,894 - experiment_functions - INFO - Early stopping at epoch 500. Best Recall: 0.0028
2026-05-15 21:13:59,975 - optuna.study.study - INFO - Trial 37 finished with value: 0.002827587031946619 and parameters: {'n_layers': 1, 'embedding_dim': 128, 'lr': 0.007773468559252909, 'lambda_val': 1.5870088512664475e-05, 'batch_size': 3424, 'optimizer': 'SGD'}. Best is trial 1 with value: 0.1140356243916405.
2026-05-15 21:14:06,876 - optuna.study._optimize - INFO - Trial 38 pruned. 
2026-05-15 21:14:14,065 - experiment_functions - INFO - Early stopping at epoch 550. Best Recall: 0.0456
2026-05-15 21:14:14,167 - optuna.study.study - INFO - Trial 39 finished with value: 0.04559191896121393 and parameters: {'n_layers': 2, 'embedding_dim': 256, 'lr': 0.0017797127656916448, 'lambda_val': 4.84009092600661e-05, 'batch_size': 2485, 'optimizer': 'RMSprop'}. Best is trial 1 with value: 0.1140356243916405.
2026-05-15 21:14:19,446 - experiment_functions - INFO - Early stopping at epoch 700. Best Recall: 0.0239
2026-05-15 21:14:19,602 - optuna.study.study - INFO - Trial 40 finished with value: 0.02389518943656296 and parameters: {'n_layers': 4, 'embedding_dim': 64, 'lr': 0.0007256908988076981, 'lambda_val': 0.0075047991005136915, 'batch_size': 1864, 'optimizer': 'Adam'}. Best is trial 1 with value: 0.1140356243916405.
2026-05-15 21:14:25,975 - experiment_functions - INFO - Early stopping at epoch 650. Best Recall: 0.1065
2026-05-15 21:14:26,078 - optuna.study.study - INFO - Trial 41 finished with value: 0.10654246700131322 and parameters: {'n_layers': 1, 'embedding_dim': 256, 'lr': 0.0011559731520585164, 'lambda_val': 9.969585962960796e-06, 'batch_size': 3096, 'optimizer': 'RMSprop'}. Best is trial 1 with value: 0.1140356243916405.
2026-05-15 21:14:32,861 - experiment_functions - INFO - Early stopping at epoch 900. Best Recall: 0.1070
2026-05-15 21:14:33,703 - optuna.study.study - INFO - Trial 42 finished with value: 0.10700574862018573 and parameters: {'n_layers': 1, 'embedding_dim': 256, 'lr': 0.0006052614299021574, 'lambda_val': 9.843079965698048e-06, 'batch_size': 3221, 'optimizer': 'RMSprop'}. Best is trial 1 with value: 0.1140356243916405.
2026-05-15 21:14:47,819 - experiment_functions - INFO - Early stopping at epoch 850. Best Recall: 0.0969
2026-05-15 21:14:47,911 - optuna.study.study - INFO - Trial 43 finished with value: 0.09692341186869015 and parameters: {'n_layers': 1, 'embedding_dim': 256, 'lr': 0.0006152470679118611, 'lambda_val': 1.0518954265733007e-05, 'batch_size': 3704, 'optimizer': 'RMSprop'}. Best is trial 1 with value: 0.1140356243916405.
2026-05-15 21:14:55,058 - optuna.study._optimize - INFO - Trial 44 pruned. 
2026-05-15 21:15:02,422 - optuna.study._optimize - INFO - Trial 45 pruned. 
2026-05-15 21:15:08,959 - experiment_functions - INFO - Early stopping at epoch 650. Best Recall: 0.0706
2026-05-15 21:15:09,072 - optuna.study.study - INFO - Trial 46 finished with value: 0.07060120655605591 and parameters: {'n_layers': 1, 'embedding_dim': 256, 'lr': 0.0035313938769464506, 'lambda_val': 1.8779765165542094e-06, 'batch_size': 1469, 'optimizer': 'RMSprop'}. Best is trial 1 with value: 0.1140356243916405.
2026-05-15 21:15:15,967 - experiment_functions - INFO - Early stopping at epoch 850. Best Recall: 0.0088
2026-05-15 21:15:16,090 - optuna.study.study - INFO - Trial 47 finished with value: 0.008808703573567368 and parameters: {'n_layers': 2, 'embedding_dim': 256, 'lr': 0.006208054911282259, 'lambda_val': 0.07658585220688617, 'batch_size': 3896, 'optimizer': 'RMSprop'}. Best is trial 1 with value: 0.1140356243916405.
2026-05-15 21:15:20,434 - experiment_functions - INFO - Early stopping at epoch 600. Best Recall: 0.0429
2026-05-15 21:15:20,536 - optuna.study.study - INFO - Trial 48 finished with value: 0.04291020694716 and parameters: {'n_layers': 1, 'embedding_dim': 32, 'lr': 0.015476662863278066, 'lambda_val': 8.208082178420236e-06, 'batch_size': 3398, 'optimizer': 'RMSprop'}. Best is trial 1 with value: 0.1140356243916405.
2026-05-15 21:15:25,807 - experiment_functions - INFO - Early stopping at epoch 600. Best Recall: 0.0338
2026-05-15 21:15:25,888 - optuna.study.study - INFO - Trial 49 finished with value: 0.03381636425521118 and parameters: {'n_layers': 3, 'embedding_dim': 256, 'lr': 0.0020654654114341696, 'lambda_val': 7.851825722014056e-05, 'batch_size': 3143, 'optimizer': 'RMSprop'}. Best is trial 1 with value: 0.1140356243916405.
2026-05-15 21:15:30,864 - experiment_functions - INFO - Early stopping at epoch 700. Best Recall: 0.1009
2026-05-15 21:15:30,965 - optuna.study.study - INFO - Trial 50 finished with value: 0.10090729998524259 and parameters: {'n_layers': 1, 'embedding_dim': 256, 'lr': 0.0010446787072152465, 'lambda_val': 1.5156695080351156e-05, 'batch_size': 2891, 'optimizer': 'RMSprop'}. Best is trial 1 with value: 0.1140356243916405.
2026-05-15 21:15:34,632 - experiment_functions - INFO - Early stopping at epoch 500. Best Recall: 0.0007
2026-05-15 21:15:34,711 - optuna.study.study - INFO - Trial 51 finished with value: 0.0007085139628444445 and parameters: {'n_layers': 1, 'embedding_dim': 128, 'lr': 0.0011285656325924552, 'lambda_val': 5.507581922778917e-06, 'batch_size': 3073, 'optimizer': 'SGD'}. Best is trial 1 with value: 0.1140356243916405.
2026-05-15 21:15:41,614 - optuna.study._optimize - INFO - Trial 52 pruned. 
2026-05-15 21:15:48,361 - optuna.study._optimize - INFO - Trial 53 pruned. 
2026-05-15 21:15:54,143 - experiment_functions - INFO - Early stopping at epoch 800. Best Recall: 0.0730
2026-05-15 21:15:54,246 - optuna.study.study - INFO - Trial 54 finished with value: 0.07296432979649985 and parameters: {'n_layers': 1, 'embedding_dim': 32, 'lr': 0.0013671557479075205, 'lambda_val': 2.750054163472471e-05, 'batch_size': 3332, 'optimizer': 'Adam'}. Best is trial 1 with value: 0.1140356243916405.
2026-05-15 21:15:58,891 - experiment_functions - INFO - Early stopping at epoch 650. Best Recall: 0.1178
2026-05-15 21:15:58,993 - optuna.study.study - INFO - Trial 55 finished with value: 0.11778071562711744 and parameters: {'n_layers': 1, 'embedding_dim': 256, 'lr': 0.0019885211038941633, 'lambda_val': 1.2232025558270258e-05, 'batch_size': 2950, 'optimizer': 'Adam'}. Best is trial 55 with value: 0.11778071562711744.
2026-05-15 21:16:05,595 - optuna.study._optimize - INFO - Trial 56 pruned. 
2026-05-15 21:16:10,798 - experiment_functions - INFO - Early stopping at epoch 550. Best Recall: 0.0659
2026-05-15 21:16:10,900 - optuna.study.study - INFO - Trial 57 finished with value: 0.06594053937065358 and parameters: {'n_layers': 2, 'embedding_dim': 256, 'lr': 0.003883263630671943, 'lambda_val': 9.806407495104851e-06, 'batch_size': 2904, 'optimizer': 'Adam'}. Best is trial 55 with value: 0.11778071562711744.
2026-05-15 21:16:17,725 - optuna.study._optimize - INFO - Trial 58 pruned. 
2026-05-15 21:16:22,557 - experiment_functions - INFO - Early stopping at epoch 650. Best Recall: 0.1066
2026-05-15 21:16:22,713 - optuna.study.study - INFO - Trial 59 finished with value: 0.10658757416733303 and parameters: {'n_layers': 1, 'embedding_dim': 256, 'lr': 0.0020389904583486256, 'lambda_val': 1.3251159530000779e-05, 'batch_size': 2844, 'optimizer': 'Adam'}. Best is trial 55 with value: 0.11778071562711744.
2026-05-15 21:16:26,779 - experiment_functions - INFO - Early stopping at epoch 500. Best Recall: 0.0045
2026-05-15 21:16:26,870 - optuna.study.study - INFO - Trial 60 finished with value: 0.004480044460791961 and parameters: {'n_layers': 2, 'embedding_dim': 256, 'lr': 0.0008268135961965553, 'lambda_val': 0.00016430521039786114, 'batch_size': 2503, 'optimizer': 'SGD'}. Best is trial 55 with value: 0.11778071562711744.
2026-05-15 21:16:31,935 - experiment_functions - INFO - Early stopping at epoch 650. Best Recall: 0.1140
2026-05-15 21:16:32,016 - optuna.study.study - INFO - Trial 61 finished with value: 0.11397686321818183 and parameters: {'n_layers': 1, 'embedding_dim': 256, 'lr': 0.0018080701259548097, 'lambda_val': 1.2649573128019456e-05, 'batch_size': 2393, 'optimizer': 'Adam'}. Best is trial 55 with value: 0.11778071562711744.
2026-05-15 21:16:36,505 - experiment_functions - INFO - Early stopping at epoch 650. Best Recall: 0.0978
2026-05-15 21:16:36,642 - optuna.study.study - INFO - Trial 62 finished with value: 0.09775042915862112 and parameters: {'n_layers': 1, 'embedding_dim': 256, 'lr': 0.002122598845808453, 'lambda_val': 1.4005075673660029e-05, 'batch_size': 2405, 'optimizer': 'Adam'}. Best is trial 55 with value: 0.11778071562711744.
2026-05-15 21:16:43,598 - optuna.study._optimize - INFO - Trial 63 pruned. 
2026-05-15 21:16:50,102 - experiment_functions - INFO - Early stopping at epoch 750. Best Recall: 0.0971
2026-05-15 21:16:50,265 - optuna.study.study - INFO - Trial 64 finished with value: 0.0970782130565185 and parameters: {'n_layers': 1, 'embedding_dim': 256, 'lr': 0.0017241735015450785, 'lambda_val': 5.900614898786272e-06, 'batch_size': 2622, 'optimizer': 'Adam'}. Best is trial 55 with value: 0.11778071562711744.
2026-05-15 21:16:56,642 - experiment_functions - INFO - Early stopping at epoch 600. Best Recall: 0.0776
2026-05-15 21:16:56,729 - optuna.study.study - INFO - Trial 65 finished with value: 0.07761711142982192 and parameters: {'n_layers': 1, 'embedding_dim': 256, 'lr': 0.00546549280026191, 'lambda_val': 4.348157545221388e-05, 'batch_size': 643, 'optimizer': 'Adam'}. Best is trial 55 with value: 0.11778071562711744.
2026-05-15 21:17:02,758 - experiment_functions - INFO - Early stopping at epoch 650. Best Recall: 0.1016
2026-05-15 21:17:02,859 - optuna.study.study - INFO - Trial 66 finished with value: 0.10157109297855008 and parameters: {'n_layers': 1, 'embedding_dim': 256, 'lr': 0.0026259402661473067, 'lambda_val': 0.0006665074014460143, 'batch_size': 2801, 'optimizer': 'Adam'}. Best is trial 55 with value: 0.11778071562711744.
2026-05-15 21:17:11,154 - optuna.study._optimize - INFO - Trial 67 pruned. 
2026-05-15 21:17:15,557 - experiment_functions - INFO - Early stopping at epoch 550. Best Recall: 0.1037
2026-05-15 21:17:15,667 - optuna.study.study - INFO - Trial 68 finished with value: 0.10370147690769027 and parameters: {'n_layers': 1, 'embedding_dim': 256, 'lr': 0.004490866926748403, 'lambda_val': 2.7244070964557067e-06, 'batch_size': 2981, 'optimizer': 'Adam'}. Best is trial 55 with value: 0.11778071562711744.
2026-05-15 21:17:20,196 - experiment_functions - INFO - Early stopping at epoch 600. Best Recall: 0.0428
2026-05-15 21:17:20,287 - optuna.study.study - INFO - Trial 69 finished with value: 0.04275680680538229 and parameters: {'n_layers': 2, 'embedding_dim': 64, 'lr': 0.002290937984359975, 'lambda_val': 4.285808930931741e-06, 'batch_size': 3149, 'optimizer': 'RMSprop'}. Best is trial 55 with value: 0.11778071562711744.
2026-05-15 21:17:26,890 - optuna.study._optimize - INFO - Trial 70 pruned. 
2026-05-15 21:17:41,313 - experiment_functions - INFO - Early stopping at epoch 950. Best Recall: 0.1049
2026-05-15 21:17:42,075 - optuna.study.study - INFO - Trial 71 finished with value: 0.1049145501548543 and parameters: {'n_layers': 1, 'embedding_dim': 128, 'lr': 0.0012662557458801478, 'lambda_val': 7.4348754918696e-06, 'batch_size': 2810, 'optimizer': 'Adam'}. Best is trial 55 with value: 0.11778071562711744.
2026-05-15 21:17:48,346 - experiment_functions - INFO - Early stopping at epoch 700. Best Recall: 0.1082
2026-05-15 21:17:48,493 - optuna.study.study - INFO - Trial 72 finished with value: 0.10816824306508728 and parameters: {'n_layers': 1, 'embedding_dim': 256, 'lr': 0.0016241220723604627, 'lambda_val': 1.306834577880609e-05, 'batch_size': 3415, 'optimizer': 'Adam'}. Best is trial 55 with value: 0.11778071562711744.
2026-05-15 21:17:53,547 - experiment_functions - INFO - Early stopping at epoch 700. Best Recall: 0.1055
2026-05-15 21:17:53,702 - optuna.study.study - INFO - Trial 73 finished with value: 0.10552579324506718 and parameters: {'n_layers': 1, 'embedding_dim': 256, 'lr': 0.0015900476736865393, 'lambda_val': 1.3661697844870393e-05, 'batch_size': 2182, 'optimizer': 'Adam'}. Best is trial 55 with value: 0.11778071562711744.
2026-05-15 21:17:58,867 - experiment_functions - INFO - Early stopping at epoch 650. Best Recall: 0.1087
2026-05-15 21:17:58,959 - optuna.study.study - INFO - Trial 74 finished with value: 0.10874162805381926 and parameters: {'n_layers': 1, 'embedding_dim': 256, 'lr': 0.002904887962953871, 'lambda_val': 6.026357160460062e-06, 'batch_size': 2358, 'optimizer': 'Adam'}. Best is trial 55 with value: 0.11778071562711744.
2026-05-15 21:18:06,254 - experiment_functions - INFO - Early stopping at epoch 600. Best Recall: 0.0882
2026-05-15 21:18:06,356 - optuna.study.study - INFO - Trial 75 finished with value: 0.08818502980565568 and parameters: {'n_layers': 1, 'embedding_dim': 256, 'lr': 0.0031473127785621945, 'lambda_val': 6.1616182811308456e-06, 'batch_size': 2151, 'optimizer': 'Adam'}. Best is trial 55 with value: 0.11778071562711744.
2026-05-15 21:18:11,918 - experiment_functions - INFO - Early stopping at epoch 550. Best Recall: 0.0934
