2026-05-16 03:22:17,823 - optuna.study.study - INFO - Trial 17 finished with value: 0.051540187899889844 and parameters: {'n_layers': 2, 'embedding_dim': 32, 'lr': 0.000984506677380569, 'lambda_val': 2.6510617512325286e-05, 'batch_size': 2484, 'optimizer': 'Adam'}. Best is trial 2 with value: 0.09747864969654978.
2026-05-16 03:22:23,194 - experiment_functions - INFO - Early stopping at epoch 900. Best Recall: 0.0015
2026-05-16 03:22:23,297 - optuna.study.study - INFO - Trial 18 finished with value: 0.0014939290996652179 and parameters: {'n_layers': 1, 'embedding_dim': 32, 'lr': 1.1300540614048665e-05, 'lambda_val': 6.332077451529906e-05, 'batch_size': 2397, 'optimizer': 'Adam'}. Best is trial 2 with value: 0.09747864969654978.
2026-05-16 03:22:32,990 - experiment_functions - INFO - Early stopping at epoch 1700. Best Recall: 0.0947
2026-05-16 03:22:33,094 - optuna.study.study - INFO - Trial 19 finished with value: 0.09466138194443131 and parameters: {'n_layers': 2, 'embedding_dim': 32, 'lr': 0.0007196653935733152, 'lambda_val': 2.338438230302449e-05, 'batch_size': 1093, 'optimizer': 'Adam'}. Best is trial 2 with value: 0.09747864969654978.
2026-05-16 03:22:38,838 - optuna.study._optimize - INFO - Trial 20 pruned. 
2026-05-16 03:22:45,247 - optuna.study._optimize - INFO - Trial 21 pruned. 
2026-05-16 03:22:50,877 - experiment_functions - INFO - Early stopping at epoch 900. Best Recall: 0.0521
2026-05-16 03:22:50,981 - optuna.study.study - INFO - Trial 22 finished with value: 0.052078837022459065 and parameters: {'n_layers': 2, 'embedding_dim': 32, 'lr': 0.0008436244807002597, 'lambda_val': 2.1438055004241776e-05, 'batch_size': 1834, 'optimizer': 'Adam'}. Best is trial 2 with value: 0.09747864969654978.
2026-05-16 03:22:55,363 - experiment_functions - INFO - Early stopping at epoch 600. Best Recall: 0.0437
2026-05-16 03:22:55,454 - optuna.study.study - INFO - Trial 23 finished with value: 0.04372186429256066 and parameters: {'n_layers': 2, 'embedding_dim': 32, 'lr': 0.004151362526142825, 'lambda_val': 9.414448792114913e-05, 'batch_size': 2068, 'optimizer': 'Adam'}. Best is trial 2 with value: 0.09747864969654978.
2026-05-16 03:23:02,481 - optuna.study._optimize - INFO - Trial 24 pruned. 
2026-05-16 03:23:06,020 - experiment_functions - INFO - Early stopping at epoch 500. Best Recall: 0.0017
2026-05-16 03:23:06,159 - optuna.study.study - INFO - Trial 25 finished with value: 0.0016683889931479448 and parameters: {'n_layers': 1, 'embedding_dim': 32, 'lr': 5.155981323483278e-05, 'lambda_val': 0.001210607661044576, 'batch_size': 1664, 'optimizer': 'Adam'}. Best is trial 2 with value: 0.09747864969654978.
2026-05-16 03:23:12,910 - experiment_functions - INFO - Early stopping at epoch 950. Best Recall: 0.0768
2026-05-16 03:23:13,002 - optuna.study.study - INFO - Trial 26 finished with value: 0.07677100782932156 and parameters: {'n_layers': 2, 'embedding_dim': 128, 'lr': 0.0006364389416713419, 'lambda_val': 2.5449507989564842e-06, 'batch_size': 1660, 'optimizer': 'Adam'}. Best is trial 2 with value: 0.09747864969654978.
2026-05-16 03:23:33,750 - experiment_functions - INFO - Early stopping at epoch 3300. Best Recall: 0.1238
2026-05-16 03:23:33,832 - optuna.study.study - INFO - Trial 27 finished with value: 0.12382585735682568 and parameters: {'n_layers': 1, 'embedding_dim': 128, 'lr': 0.000524239697535482, 'lambda_val': 2.520490633663836e-06, 'batch_size': 967, 'optimizer': 'Adam'}. Best is trial 27 with value: 0.12382585735682568.
2026-05-16 03:23:39,478 - experiment_functions - INFO - Early stopping at epoch 850. Best Recall: 0.0183
2026-05-16 03:23:39,573 - optuna.study.study - INFO - Trial 28 finished with value: 0.018331811701358336 and parameters: {'n_layers': 1, 'embedding_dim': 128, 'lr': 0.07622963328385983, 'lambda_val': 2.2874534524904984e-06, 'batch_size': 916, 'optimizer': 'Adam'}. Best is trial 27 with value: 0.12382585735682568.
2026-05-16 03:23:54,377 - experiment_functions - INFO - Early stopping at epoch 1900. Best Recall: 0.1165
2026-05-16 03:23:54,459 - optuna.study.study - INFO - Trial 29 finished with value: 0.11646530068099185 and parameters: {'n_layers': 1, 'embedding_dim': 128, 'lr': 0.00039141981922234236, 'lambda_val': 7.228974412633848e-06, 'batch_size': 2171, 'optimizer': 'RMSprop'}. Best is trial 27 with value: 0.12382585735682568.
2026-05-16 03:24:00,755 - experiment_functions - INFO - Early stopping at epoch 500. Best Recall: 0.0015
2026-05-16 03:24:00,848 - optuna.study.study - INFO - Trial 30 finished with value: 0.0015293244715883117 and parameters: {'n_layers': 1, 'embedding_dim': 128, 'lr': 3.547465016801815e-05, 'lambda_val': 1.1170080730662566e-06, 'batch_size': 2060, 'optimizer': 'RMSprop'}. Best is trial 27 with value: 0.12382585735682568.
2026-05-16 03:24:11,134 - experiment_functions - INFO - Early stopping at epoch 1600. Best Recall: 0.1132
2026-05-16 03:24:11,238 - optuna.study.study - INFO - Trial 31 finished with value: 0.11319890840813983 and parameters: {'n_layers': 1, 'embedding_dim': 128, 'lr': 0.000422292219046484, 'lambda_val': 7.714760422739883e-06, 'batch_size': 1333, 'optimizer': 'RMSprop'}. Best is trial 27 with value: 0.12382585735682568.
2026-05-16 03:24:18,662 - optuna.study._optimize - INFO - Trial 32 pruned. 
2026-05-16 03:24:25,577 - optuna.study._optimize - INFO - Trial 33 pruned. 
2026-05-16 03:24:34,208 - optuna.study._optimize - INFO - Trial 34 pruned. 
2026-05-16 03:24:40,981 - optuna.study._optimize - INFO - Trial 35 pruned. 
2026-05-16 03:24:47,950 - optuna.study._optimize - INFO - Trial 36 pruned. 
2026-05-16 03:24:54,822 - optuna.study._optimize - INFO - Trial 37 pruned. 
2026-05-16 03:25:02,623 - optuna.study._optimize - INFO - Trial 38 pruned. 
2026-05-16 03:25:06,486 - experiment_functions - INFO - Early stopping at epoch 500. Best Recall: 0.0033
2026-05-16 03:25:06,591 - optuna.study.study - INFO - Trial 39 finished with value: 0.0032998611564252073 and parameters: {'n_layers': 1, 'embedding_dim': 128, 'lr': 2.824717559833643e-05, 'lambda_val': 0.0005419140590299862, 'batch_size': 2958, 'optimizer': 'SGD'}. Best is trial 27 with value: 0.12382585735682568.
2026-05-16 03:25:13,338 - experiment_functions - INFO - Early stopping at epoch 800. Best Recall: 0.0193
2026-05-16 03:25:13,476 - optuna.study.study - INFO - Trial 40 finished with value: 0.019269008874456938 and parameters: {'n_layers': 4, 'embedding_dim': 128, 'lr': 0.0033368393090069393, 'lambda_val': 0.0036607472624107375, 'batch_size': 3598, 'optimizer': 'RMSprop'}. Best is trial 27 with value: 0.12382585735682568.
2026-05-16 03:25:20,579 - optuna.study._optimize - INFO - Trial 41 pruned. 
2026-05-16 03:25:26,479 - experiment_functions - INFO - Early stopping at epoch 500. Best Recall: 0.0022
2026-05-16 03:25:26,573 - optuna.study.study - INFO - Trial 42 finished with value: 0.002152414644253834 and parameters: {'n_layers': 1, 'embedding_dim': 256, 'lr': 0.001144497690323849, 'lambda_val': 3.6694291247983445e-05, 'batch_size': 811, 'optimizer': 'SGD'}. Best is trial 27 with value: 0.12382585735682568.
2026-05-16 03:25:33,603 - optuna.study._optimize - INFO - Trial 43 pruned. 
2026-05-16 03:25:40,488 - optuna.study._optimize - INFO - Trial 44 pruned. 
2026-05-16 03:25:44,354 - experiment_functions - INFO - Early stopping at epoch 500. Best Recall: 0.0012
2026-05-16 03:25:44,481 - optuna.study.study - INFO - Trial 45 finished with value: 0.0011551450964283091 and parameters: {'n_layers': 1, 'embedding_dim': 256, 'lr': 0.00022653024504050212, 'lambda_val': 3.951367004902111e-06, 'batch_size': 1827, 'optimizer': 'SGD'}. Best is trial 27 with value: 0.12382585735682568.
2026-05-16 03:25:51,165 - optuna.study._optimize - INFO - Trial 46 pruned. 
2026-05-16 03:25:57,118 - experiment_functions - INFO - Early stopping at epoch 750. Best Recall: 0.0648
2026-05-16 03:25:57,224 - optuna.study.study - INFO - Trial 47 finished with value: 0.06478079695598896 and parameters: {'n_layers': 2, 'embedding_dim': 128, 'lr': 0.0015018237113629616, 'lambda_val': 1.2337653214133248e-05, 'batch_size': 996, 'optimizer': 'Adam'}. Best is trial 27 with value: 0.12382585735682568.
2026-05-16 03:26:04,956 - optuna.study._optimize - INFO - Trial 48 pruned. 
2026-05-16 03:26:12,976 - optuna.study._optimize - INFO - Trial 49 pruned. 
2026-05-16 03:26:16,471 - experiment_functions - INFO - Early stopping at epoch 500. Best Recall: 0.0028
2026-05-16 03:26:16,552 - optuna.study.study - INFO - Trial 50 finished with value: 0.0027501415751933675 and parameters: {'n_layers': 1, 'embedding_dim': 64, 'lr': 0.0021452059969110236, 'lambda_val': 9.881373923774989e-05, 'batch_size': 721, 'optimizer': 'SGD'}. Best is trial 27 with value: 0.12382585735682568.
2026-05-16 03:26:24,047 - optuna.study._optimize - INFO - Trial 51 pruned. 
2026-05-16 03:26:29,790 - experiment_functions - INFO - Early stopping at epoch 750. Best Recall: 0.0761
2026-05-16 03:26:29,895 - optuna.study.study - INFO - Trial 52 finished with value: 0.07605632020866207 and parameters: {'n_layers': 2, 'embedding_dim': 128, 'lr': 0.0007746005511512267, 'lambda_val': 3.0530163568426503e-06, 'batch_size': 1490, 'optimizer': 'Adam'}. Best is trial 27 with value: 0.12382585735682568.
2026-05-16 03:26:35,465 - experiment_functions - INFO - Early stopping at epoch 700. Best Recall: 0.0619
2026-05-16 03:26:35,570 - optuna.study.study - INFO - Trial 53 finished with value: 0.06188520239846783 and parameters: {'n_layers': 2, 'embedding_dim': 128, 'lr': 0.0011080708966085707, 'lambda_val': 1.702978762205891e-06, 'batch_size': 1935, 'optimizer': 'Adam'}. Best is trial 27 with value: 0.12382585735682568.
2026-05-16 03:26:43,688 - optuna.study._optimize - INFO - Trial 54 pruned. 
2026-05-16 03:26:52,264 - optuna.study._optimize - INFO - Trial 55 pruned. 
2026-05-16 03:26:58,963 - optuna.study._optimize - INFO - Trial 56 pruned. 
2026-05-16 03:27:04,883 - experiment_functions - INFO - Early stopping at epoch 700. Best Recall: 0.0728
2026-05-16 03:27:05,029 - optuna.study.study - INFO - Trial 57 finished with value: 0.07282686036474674 and parameters: {'n_layers': 1, 'embedding_dim': 32, 'lr': 0.002592298188325519, 'lambda_val': 6.197868211972297e-06, 'batch_size': 3256, 'optimizer': 'Adam'}. Best is trial 27 with value: 0.12382585735682568.
2026-05-16 03:27:11,831 - experiment_functions - INFO - Early stopping at epoch 600. Best Recall: 0.0361
2026-05-16 03:27:11,933 - optuna.study.study - INFO - Trial 58 finished with value: 0.036082368886966046 and parameters: {'n_layers': 3, 'embedding_dim': 96, 'lr': 0.005065805820227798, 'lambda_val': 1.0103082245205325e-06, 'batch_size': 1329, 'optimizer': 'RMSprop'}. Best is trial 27 with value: 0.12382585735682568.
2026-05-16 03:27:18,631 - experiment_functions - INFO - Early stopping at epoch 900. Best Recall: 0.0447
2026-05-16 03:27:18,746 - optuna.study.study - INFO - Trial 59 finished with value: 0.04473922968768022 and parameters: {'n_layers': 2, 'embedding_dim': 64, 'lr': 0.0014167621207174777, 'lambda_val': 3.0924054943017026e-06, 'batch_size': 2238, 'optimizer': 'Adam'}. Best is trial 27 with value: 0.12382585735682568.
2026-05-16 03:27:31,930 - optuna.study._optimize - INFO - Trial 60 pruned. 
2026-05-16 03:27:38,010 - experiment_functions - INFO - Early stopping at epoch 850. Best Recall: 0.0780
2026-05-16 03:27:38,114 - optuna.study.study - INFO - Trial 61 finished with value: 0.077995327987358 and parameters: {'n_layers': 2, 'embedding_dim': 128, 'lr': 0.0007823042901568718, 'lambda_val': 2.898442549770856e-06, 'batch_size': 1475, 'optimizer': 'Adam'}. Best is trial 27 with value: 0.12382585735682568.
2026-05-16 03:27:47,271 - experiment_functions - INFO - Early stopping at epoch 800. Best Recall: 0.0739
2026-05-16 03:27:47,373 - optuna.study.study - INFO - Trial 62 finished with value: 0.07389956631623384 and parameters: {'n_layers': 2, 'embedding_dim': 128, 'lr': 0.0008677610487298863, 'lambda_val': 1.7180965341484377e-06, 'batch_size': 984, 'optimizer': 'Adam'}. Best is trial 27 with value: 0.12382585735682568.
2026-05-16 03:27:53,562 - experiment_functions - INFO - Early stopping at epoch 950. Best Recall: 0.0822
2026-05-16 03:27:53,655 - optuna.study.study - INFO - Trial 63 finished with value: 0.08222931585152927 and parameters: {'n_layers': 2, 'embedding_dim': 128, 'lr': 0.0007909827075153182, 'lambda_val': 9.360127676585623e-06, 'batch_size': 1423, 'optimizer': 'Adam'}. Best is trial 27 with value: 0.12382585735682568.
2026-05-16 03:28:00,313 - optuna.study._optimize - INFO - Trial 64 pruned. 
2026-05-16 03:28:06,969 - optuna.study._optimize - INFO - Trial 65 pruned. 
2026-05-16 03:28:12,848 - optuna.study._optimize - INFO - Trial 66 pruned. 
2026-05-16 03:28:17,948 - experiment_functions - INFO - Early stopping at epoch 750. Best Recall: 0.0597
2026-05-16 03:28:18,029 - optuna.study.study - INFO - Trial 67 finished with value: 0.059668018797395916 and parameters: {'n_layers': 3, 'embedding_dim': 32, 'lr': 0.001221857847394436, 'lambda_val': 1.1938495187834344e-05, 'batch_size': 790, 'optimizer': 'Adam'}. Best is trial 27 with value: 0.12382585735682568.
2026-05-16 03:28:28,030 - experiment_functions - INFO - Early stopping at epoch 1700. Best Recall: 0.1130
2026-05-16 03:28:28,132 - optuna.study.study - INFO - Trial 68 finished with value: 0.11300468142693401 and parameters: {'n_layers': 1, 'embedding_dim': 128, 'lr': 0.0005235196797561941, 'lambda_val': 3.5021225616115907e-06, 'batch_size': 2980, 'optimizer': 'Adam'}. Best is trial 27 with value: 0.12382585735682568.
2026-05-16 03:28:34,404 - optuna.study._optimize - INFO - Trial 69 pruned. 
2026-05-16 03:28:39,522 - experiment_functions - INFO - Early stopping at epoch 800. Best Recall: 0.0466
2026-05-16 03:28:39,667 - optuna.study.study - INFO - Trial 70 finished with value: 0.046620450411255066 and parameters: {'n_layers': 1, 'embedding_dim': 128, 'lr': 0.0004959995765242053, 'lambda_val': 0.03633085484988407, 'batch_size': 3855, 'optimizer': 'Adam'}. Best is trial 27 with value: 0.12382585735682568.
2026-05-16 03:28:46,626 - optuna.study._optimize - INFO - Trial 71 pruned. 
2026-05-16 03:28:51,522 - experiment_functions - INFO - Early stopping at epoch 750. Best Recall: 0.1089
2026-05-16 03:28:51,615 - optuna.study.study - INFO - Trial 72 finished with value: 0.10886332621953718 and parameters: {'n_layers': 1, 'embedding_dim': 128, 'lr': 0.001841326441468993, 'lambda_val': 2.0332918398034936e-06, 'batch_size': 3377, 'optimizer': 'Adam'}. Best is trial 27 with value: 0.12382585735682568.
2026-05-16 03:28:55,808 - experiment_functions - INFO - Early stopping at epoch 650. Best Recall: 0.1065
2026-05-16 03:28:55,910 - optuna.study.study - INFO - Trial 73 finished with value: 0.10646735695025826 and parameters: {'n_layers': 1, 'embedding_dim': 128, 'lr': 0.002290341437311788, 'lambda_val': 2.0782737333870657e-06, 'batch_size': 3417, 'optimizer': 'Adam'}. Best is trial 27 with value: 0.12382585735682568.
2026-05-16 03:29:00,114 - experiment_functions - INFO - Early stopping at epoch 550. Best Recall: 0.1017
2026-05-16 03:29:00,217 - optuna.study.study - INFO - Trial 74 finished with value: 0.10166304771112344 and parameters: {'n_layers': 1, 'embedding_dim': 128, 'lr': 0.007512795005546071, 'lambda_val': 1.4509081319534964e-06, 'batch_size': 3399, 'optimizer': 'Adam'}. Best is trial 27 with value: 0.12382585735682568.
2026-05-16 03:29:04,032 - experiment_functions - INFO - Early stopping at epoch 550. Best Recall: 0.0921
2026-05-16 03:29:04,179 - optuna.study.study - INFO - Trial 75 finished with value: 0.09207504773633962 and parameters: {'n_layers': 1, 'embedding_dim': 128, 'lr': 0.010118717556107968, 'lambda_val': 1.24590603875497e-06, 'batch_size': 3398, 'optimizer': 'Adam'}. Best is trial 27 with value: 0.12382585735682568.
2026-05-16 03:29:07,892 - experiment_functions - INFO - Early stopping at epoch 500. Best Recall: 0.0027
2026-05-16 03:29:07,994 - optuna.study.study - INFO - Trial 76 finished with value: 0.002708523220864213 and parameters: {'n_layers': 1, 'embedding_dim': 128, 'lr': 0.018522642304895875, 'lambda_val': 2.0643305668402194e-06, 'batch_size': 3156, 'optimizer': 'SGD'}. Best is trial 27 with value: 0.12382585735682568.
2026-05-16 03:29:12,488 - experiment_functions - INFO - Early stopping at epoch 700. Best Recall: 0.0516
2026-05-16 03:29:12,568 - optuna.study.study - INFO - Trial 77 finished with value: 0.05162203371294768 and parameters: {'n_layers': 1, 'embedding_dim': 128, 'lr': 0.008891732560095473, 'lambda_val': 1.3461687519498883e-06, 'batch_size': 3649, 'optimizer': 'RMSprop'}. Best is trial 27 with value: 0.12382585735682568.
2026-05-16 03:29:16,877 - experiment_functions - INFO - Early stopping at epoch 600. Best Recall: 0.1060
2026-05-16 03:29:16,981 - optuna.study.study - INFO - Trial 78 finished with value: 0.10603095132016764 and parameters: {'n_layers': 1, 'embedding_dim': 128, 'lr': 0.0035051365345965526, 'lambda_val': 2.284725273325824e-06, 'batch_size': 3464, 'optimizer': 'Adam'}. Best is trial 27 with value: 0.12382585735682568.
2026-05-16 03:29:20,969 - experiment_functions - INFO - Early stopping at epoch 600. Best Recall: 0.1105
2026-05-16 03:29:21,116 - optuna.study.study - INFO - Trial 79 finished with value: 0.11048744445775643 and parameters: {'n_layers': 1, 'embedding_dim': 128, 'lr': 0.003576415977338355, 'lambda_val': 5.164165791762904e-06, 'batch_size': 3457, 'optimizer': 'Adam'}. Best is trial 27 with value: 0.12382585735682568.
2026-05-16 03:29:25,960 - experiment_functions - INFO - Early stopping at epoch 550. Best Recall: 0.0749
2026-05-16 03:29:26,096 - optuna.study.study - INFO - Trial 80 finished with value: 0.07493628876713775 and parameters: {'n_layers': 1, 'embedding_dim': 128, 'lr': 0.004775687532814283, 'lambda_val': 4.33245121764367e-06, 'batch_size': 3482, 'optimizer': 'RMSprop'}. Best is trial 27 with value: 0.12382585735682568.
2026-05-16 03:29:30,966 - experiment_functions - INFO - Early stopping at epoch 650. Best Recall: 0.0953
2026-05-16 03:29:31,079 - optuna.study.study - INFO - Trial 81 finished with value: 0.0953054437946527 and parameters: {'n_layers': 1, 'embedding_dim': 128, 'lr': 0.0037133196734575697, 'lambda_val': 2.3551084241076987e-06, 'batch_size': 3138, 'optimizer': 'Adam'}. Best is trial 27 with value: 0.12382585735682568.
2026-05-16 03:29:35,580 - experiment_functions - INFO - Early stopping at epoch 600. Best Recall: 0.1012
2026-05-16 03:29:35,680 - optuna.study.study - INFO - Trial 82 finished with value: 0.10117768239531161 and parameters: {'n_layers': 1, 'embedding_dim': 128, 'lr': 0.002515126467875544, 'lambda_val': 1.0047229234077266e-06, 'batch_size': 3332, 'optimizer': 'Adam'}. Best is trial 27 with value: 0.12382585735682568.
2026-05-16 03:29:39,612 - experiment_functions - INFO - Early stopping at epoch 550. Best Recall: 0.1057
2026-05-16 03:29:39,716 - optuna.study.study - INFO - Trial 83 finished with value: 0.10566022165559953 and parameters: {'n_layers': 1, 'embedding_dim': 128, 'lr': 0.006159926222344147, 'lambda_val': 1.9953953789504903e-06, 'batch_size': 3807, 'optimizer': 'Adam'}. Best is trial 27 with value: 0.12382585735682568.
2026-05-16 03:29:44,075 - experiment_functions - INFO - Early stopping at epoch 700. Best Recall: 0.0979
2026-05-16 03:29:44,167 - optuna.study.study - INFO - Trial 84 finished with value: 0.0978537317217196 and parameters: {'n_layers': 1, 'embedding_dim': 128, 'lr': 0.002013018561120421, 'lambda_val': 4.856676549148382e-06, 'batch_size': 3802, 'optimizer': 'Adam'}. Best is trial 27 with value: 0.12382585735682568.
2026-05-16 03:29:48,176 - experiment_functions - INFO - Early stopping at epoch 550. Best Recall: 0.0906
2026-05-16 03:29:48,266 - optuna.study.study - INFO - Trial 85 finished with value: 0.09060003819320542 and parameters: {'n_layers': 1, 'embedding_dim': 128, 'lr': 0.005429915375491107, 'lambda_val': 2.0072088657766105e-06, 'batch_size': 4033, 'optimizer': 'Adam'}. Best is trial 27 with value: 0.12382585735682568.
2026-05-16 03:29:53,275 - experiment_functions - INFO - Early stopping at epoch 800. Best Recall: 0.0818
2026-05-16 03:29:53,377 - optuna.study.study - INFO - Trial 86 finished with value: 0.08184525664639002 and parameters: {'n_layers': 1, 'embedding_dim': 128, 'lr': 0.0028566560958985946, 'lambda_val': 3.47006477841761e-06, 'batch_size': 3548, 'optimizer': 'Adam'}. Best is trial 27 with value: 0.12382585735682568.
2026-05-16 03:29:57,390 - experiment_functions - INFO - Early stopping at epoch 550. Best Recall: 0.0593
2026-05-16 03:29:57,559 - optuna.study.study - INFO - Trial 87 finished with value: 0.059266344714721954 and parameters: {'n_layers': 1, 'embedding_dim': 128, 'lr': 0.019353982476646686, 'lambda_val': 5.40317890606313e-06, 'batch_size': 3749, 'optimizer': 'Adam'}. Best is trial 27 with value: 0.12382585735682568.
2026-05-16 03:30:02,262 - experiment_functions - INFO - Early stopping at epoch 600. Best Recall: 0.0681
2026-05-16 03:30:02,363 - optuna.study.study - INFO - Trial 88 finished with value: 0.06813866135634002 and parameters: {'n_layers': 1, 'embedding_dim': 256, 'lr': 0.003727444728749132, 'lambda_val': 8.044805292185636e-06, 'batch_size': 3118, 'optimizer': 'RMSprop'}. Best is trial 27 with value: 0.12382585735682568.
2026-05-16 03:30:07,388 - experiment_functions - INFO - Early stopping at epoch 650. Best Recall: 0.1055
2026-05-16 03:30:07,543 - optuna.study.study - INFO - Trial 89 finished with value: 0.10552742244847163 and parameters: {'n_layers': 1, 'embedding_dim': 128, 'lr': 0.0018132835643613783, 'lambda_val': 1.955925704640978e-06, 'batch_size': 3915, 'optimizer': 'Adam'}. Best is trial 27 with value: 0.12382585735682568.
2026-05-16 03:30:10,987 - experiment_functions - INFO - Early stopping at epoch 500. Best Recall: 0.0028
