2026-05-15 20:46:27,796 - optuna.study._optimize - INFO - Trial 157 pruned. 
2026-05-15 20:46:33,169 - experiment_functions - INFO - Early stopping at epoch 900. Best Recall: 0.0696
2026-05-15 20:46:33,290 - optuna.study.study - INFO - Trial 158 finished with value: 0.06963018106714369 and parameters: {'n_layers': 1, 'embedding_dim': 128, 'lr': 0.0008365433568310708, 'lambda_val': 0.00016203815359937986, 'batch_size': 1417, 'optimizer': 'Adam'}. Best is trial 91 with value: 0.0811670044012248.
2026-05-15 20:46:36,739 - experiment_functions - INFO - Early stopping at epoch 500. Best Recall: 0.0019
2026-05-15 20:46:36,849 - optuna.study.study - INFO - Trial 159 finished with value: 0.0018654774727045172 and parameters: {'n_layers': 1, 'embedding_dim': 128, 'lr': 0.0012922275783516732, 'lambda_val': 3.390291596544912e-05, 'batch_size': 1269, 'optimizer': 'SGD'}. Best is trial 91 with value: 0.0811670044012248.
2026-05-15 20:46:41,579 - experiment_functions - INFO - Early stopping at epoch 750. Best Recall: 0.0700
2026-05-15 20:46:41,691 - optuna.study.study - INFO - Trial 160 finished with value: 0.06997799339308242 and parameters: {'n_layers': 1, 'embedding_dim': 32, 'lr': 0.0017218704251865536, 'lambda_val': 6.03899331597709e-05, 'batch_size': 1010, 'optimizer': 'Adam'}. Best is trial 91 with value: 0.0811670044012248.
2026-05-15 20:46:49,551 - experiment_functions - INFO - Early stopping at epoch 1300. Best Recall: 0.0728
2026-05-15 20:46:49,674 - optuna.study.study - INFO - Trial 161 finished with value: 0.07280333675104385 and parameters: {'n_layers': 1, 'embedding_dim': 128, 'lr': 0.0008377907260942441, 'lambda_val': 1.4849069417040216e-05, 'batch_size': 1131, 'optimizer': 'Adam'}. Best is trial 91 with value: 0.0811670044012248.
2026-05-15 20:47:04,307 - experiment_functions - INFO - Early stopping at epoch 2650. Best Recall: 0.0742
2026-05-15 20:47:04,416 - optuna.study.study - INFO - Trial 162 finished with value: 0.07415082572695199 and parameters: {'n_layers': 1, 'embedding_dim': 128, 'lr': 0.0009157371522017839, 'lambda_val': 2.2754483964720994e-06, 'batch_size': 1100, 'optimizer': 'Adam'}. Best is trial 91 with value: 0.0811670044012248.
2026-05-15 20:47:10,345 - optuna.study._optimize - INFO - Trial 163 pruned. 
2026-05-15 20:47:16,399 - optuna.study._optimize - INFO - Trial 164 pruned. 
2026-05-15 20:47:22,916 - optuna.study._optimize - INFO - Trial 165 pruned. 
2026-05-15 20:47:34,073 - experiment_functions - INFO - Early stopping at epoch 1800. Best Recall: 0.0761
2026-05-15 20:47:34,255 - optuna.study.study - INFO - Trial 166 finished with value: 0.07613094516649405 and parameters: {'n_layers': 1, 'embedding_dim': 256, 'lr': 0.0005365207509824583, 'lambda_val': 0.00010480458876813904, 'batch_size': 993, 'optimizer': 'Adam'}. Best is trial 91 with value: 0.0811670044012248.
2026-05-15 20:47:44,472 - experiment_functions - INFO - Early stopping at epoch 1600. Best Recall: 0.0735
2026-05-15 20:47:44,561 - optuna.study.study - INFO - Trial 167 finished with value: 0.073532409959081 and parameters: {'n_layers': 1, 'embedding_dim': 256, 'lr': 0.00047378656598329915, 'lambda_val': 1.3583551882961293e-06, 'batch_size': 904, 'optimizer': 'Adam'}. Best is trial 91 with value: 0.0811670044012248.
2026-05-15 20:47:50,887 - optuna.study._optimize - INFO - Trial 168 pruned. 
2026-05-15 20:47:59,419 - optuna.study._optimize - INFO - Trial 169 pruned. 
2026-05-15 20:48:14,822 - experiment_functions - INFO - Early stopping at epoch 2650. Best Recall: 0.0773
2026-05-15 20:48:14,919 - optuna.study.study - INFO - Trial 170 finished with value: 0.07727412314831184 and parameters: {'n_layers': 1, 'embedding_dim': 256, 'lr': 0.0006915378672846466, 'lambda_val': 0.00011375897093309886, 'batch_size': 1004, 'optimizer': 'Adam'}. Best is trial 91 with value: 0.0811670044012248.
2026-05-15 20:48:22,032 - optuna.study._optimize - INFO - Trial 171 pruned. 
2026-05-15 20:48:32,815 - experiment_functions - INFO - Early stopping at epoch 1750. Best Recall: 0.0766
2026-05-15 20:48:32,904 - optuna.study.study - INFO - Trial 172 finished with value: 0.07663884409296258 and parameters: {'n_layers': 1, 'embedding_dim': 256, 'lr': 0.0009225372581723906, 'lambda_val': 9.467652018990843e-05, 'batch_size': 877, 'optimizer': 'Adam'}. Best is trial 91 with value: 0.0811670044012248.
2026-05-15 20:48:45,900 - experiment_functions - INFO - Early stopping at epoch 2100. Best Recall: 0.0782
2026-05-15 20:48:45,978 - optuna.study.study - INFO - Trial 173 finished with value: 0.07824202918046247 and parameters: {'n_layers': 1, 'embedding_dim': 256, 'lr': 0.00042232334281896815, 'lambda_val': 0.00011200848957710294, 'batch_size': 850, 'optimizer': 'Adam'}. Best is trial 91 with value: 0.0811670044012248.
2026-05-15 20:48:52,381 - optuna.study._optimize - INFO - Trial 174 pruned. 
2026-05-15 20:49:05,133 - experiment_functions - INFO - Early stopping at epoch 1900. Best Recall: 0.0743
2026-05-15 20:49:05,268 - optuna.study.study - INFO - Trial 175 finished with value: 0.07433632812862448 and parameters: {'n_layers': 1, 'embedding_dim': 256, 'lr': 0.0005906026052299864, 'lambda_val': 0.00019680031531446157, 'batch_size': 831, 'optimizer': 'Adam'}. Best is trial 91 with value: 0.0811670044012248.
2026-05-15 20:49:12,239 - optuna.study._optimize - INFO - Trial 176 pruned. 
2026-05-15 20:49:19,176 - optuna.study._optimize - INFO - Trial 177 pruned. 
2026-05-15 20:49:25,661 - optuna.study._optimize - INFO - Trial 178 pruned. 
2026-05-15 20:49:39,804 - experiment_functions - INFO - Early stopping at epoch 2400. Best Recall: 0.0766
2026-05-15 20:49:39,894 - optuna.study.study - INFO - Trial 179 finished with value: 0.07659628054578105 and parameters: {'n_layers': 1, 'embedding_dim': 256, 'lr': 0.0005383591195680454, 'lambda_val': 0.00011325201360146217, 'batch_size': 1082, 'optimizer': 'Adam'}. Best is trial 91 with value: 0.0811670044012248.
2026-05-15 20:49:46,287 - optuna.study._optimize - INFO - Trial 180 pruned. 
2026-05-15 20:49:53,732 - optuna.study._optimize - INFO - Trial 181 pruned. 
2026-05-15 20:50:08,397 - experiment_functions - INFO - Early stopping at epoch 2400. Best Recall: 0.0772
2026-05-15 20:50:08,485 - optuna.study.study - INFO - Trial 182 finished with value: 0.07720444909600536 and parameters: {'n_layers': 1, 'embedding_dim': 256, 'lr': 0.0005529644307029539, 'lambda_val': 0.00029314728459881137, 'batch_size': 968, 'optimizer': 'Adam'}. Best is trial 91 with value: 0.0811670044012248.
2026-05-15 20:50:20,128 - experiment_functions - INFO - Early stopping at epoch 2000. Best Recall: 0.0785
2026-05-15 20:50:20,218 - optuna.study.study - INFO - Trial 183 finished with value: 0.07854947759714856 and parameters: {'n_layers': 1, 'embedding_dim': 256, 'lr': 0.0005468979663454016, 'lambda_val': 0.00037211561665347244, 'batch_size': 963, 'optimizer': 'Adam'}. Best is trial 91 with value: 0.0811670044012248.
2026-05-15 20:50:26,478 - optuna.study._optimize - INFO - Trial 184 pruned. 
2026-05-15 20:50:33,043 - optuna.study._optimize - INFO - Trial 185 pruned. 
2026-05-15 20:50:45,871 - experiment_functions - INFO - Early stopping at epoch 2150. Best Recall: 0.0764
2026-05-15 20:50:46,006 - optuna.study.study - INFO - Trial 186 finished with value: 0.07638337983571425 and parameters: {'n_layers': 1, 'embedding_dim': 256, 'lr': 0.0005496506016384456, 'lambda_val': 0.00021372845979576914, 'batch_size': 869, 'optimizer': 'Adam'}. Best is trial 91 with value: 0.0811670044012248.
2026-05-15 20:50:54,511 - experiment_functions - INFO - Early stopping at epoch 1300. Best Recall: 0.0706
2026-05-15 20:50:54,611 - optuna.study.study - INFO - Trial 187 finished with value: 0.07057643495971543 and parameters: {'n_layers': 1, 'embedding_dim': 256, 'lr': 0.0007912430927653902, 'lambda_val': 0.0004316895777023526, 'batch_size': 3202, 'optimizer': 'Adam'}. Best is trial 91 with value: 0.0811670044012248.
2026-05-15 20:51:09,166 - experiment_functions - INFO - Early stopping at epoch 2200. Best Recall: 0.0777
2026-05-15 20:51:09,285 - optuna.study.study - INFO - Trial 188 finished with value: 0.07773160617447422 and parameters: {'n_layers': 1, 'embedding_dim': 256, 'lr': 0.00043453808518544414, 'lambda_val': 0.00027262847987117336, 'batch_size': 696, 'optimizer': 'Adam'}. Best is trial 91 with value: 0.0811670044012248.
2026-05-15 20:51:15,794 - optuna.study._optimize - INFO - Trial 189 pruned. 
2026-05-15 20:51:36,662 - experiment_functions - INFO - Early stopping at epoch 3100. Best Recall: 0.0796
2026-05-15 20:51:36,763 - optuna.study.study - INFO - Trial 190 finished with value: 0.079611278439829 and parameters: {'n_layers': 1, 'embedding_dim': 256, 'lr': 0.00041588569781699354, 'lambda_val': 0.00018195163541908724, 'batch_size': 590, 'optimizer': 'Adam'}. Best is trial 91 with value: 0.0811670044012248.
2026-05-15 20:51:52,751 - experiment_functions - INFO - Early stopping at epoch 2650. Best Recall: 0.0816
2026-05-15 20:51:53,334 - optuna.study.study - INFO - Trial 191 finished with value: 0.08164446855030871 and parameters: {'n_layers': 1, 'embedding_dim': 256, 'lr': 0.0004120596956638922, 'lambda_val': 0.0003457012332885547, 'batch_size': 590, 'optimizer': 'Adam'}. Best is trial 191 with value: 0.08164446855030871.
2026-05-15 20:51:59,761 - optuna.study._optimize - INFO - Trial 192 pruned. 
2026-05-15 20:52:06,167 - optuna.study._optimize - INFO - Trial 193 pruned. 
2026-05-15 20:52:19,699 - experiment_functions - INFO - Early stopping at epoch 2200. Best Recall: 0.0772
2026-05-15 20:52:19,797 - optuna.study.study - INFO - Trial 194 finished with value: 0.07722775452329843 and parameters: {'n_layers': 1, 'embedding_dim': 256, 'lr': 0.000382306337068645, 'lambda_val': 0.00017799409788953795, 'batch_size': 565, 'optimizer': 'Adam'}. Best is trial 191 with value: 0.08164446855030871.
2026-05-15 20:52:26,543 - optuna.study._optimize - INFO - Trial 195 pruned. 
2026-05-15 20:52:33,715 - optuna.study._optimize - INFO - Trial 196 pruned. 
2026-05-15 20:52:37,180 - experiment_functions - INFO - Early stopping at epoch 500. Best Recall: 0.0019
2026-05-15 20:52:37,259 - optuna.study.study - INFO - Trial 197 finished with value: 0.0018900159575199011 and parameters: {'n_layers': 1, 'embedding_dim': 256, 'lr': 0.00023661048103250357, 'lambda_val': 0.00037940798650837077, 'batch_size': 601, 'optimizer': 'SGD'}. Best is trial 191 with value: 0.08164446855030871.
2026-05-15 20:52:43,707 - optuna.study._optimize - INFO - Trial 198 pruned. 
2026-05-15 20:52:50,531 - optuna.study._optimize - INFO - Trial 199 pruned. 
2026-05-15 20:52:57,207 - optuna.study._optimize - INFO - Trial 200 pruned. 
2026-05-15 20:53:04,774 - optuna.study._optimize - INFO - Trial 201 pruned. 
2026-05-15 20:53:19,589 - experiment_functions - INFO - Early stopping at epoch 2400. Best Recall: 0.0776
2026-05-15 20:53:19,679 - optuna.study.study - INFO - Trial 202 finished with value: 0.07760068584225124 and parameters: {'n_layers': 1, 'embedding_dim': 256, 'lr': 0.00047114418036232577, 'lambda_val': 0.0001653062597057242, 'batch_size': 757, 'optimizer': 'Adam'}. Best is trial 191 with value: 0.08164446855030871.
2026-05-15 20:53:26,396 - optuna.study._optimize - INFO - Trial 203 pruned. 
2026-05-15 20:53:41,060 - optuna.study._optimize - INFO - Trial 204 pruned. 
2026-05-15 20:53:47,909 - optuna.study._optimize - INFO - Trial 205 pruned. 
2026-05-15 20:53:57,779 - experiment_functions - INFO - Early stopping at epoch 1500. Best Recall: 0.0707
2026-05-15 20:53:57,868 - optuna.study.study - INFO - Trial 206 finished with value: 0.07074824601012197 and parameters: {'n_layers': 1, 'embedding_dim': 256, 'lr': 0.0006078818204814079, 'lambda_val': 0.00017261885232956503, 'batch_size': 667, 'optimizer': 'Adam'}. Best is trial 191 with value: 0.08164446855030871.
2026-05-15 20:54:06,867 - experiment_functions - INFO - Early stopping at epoch 1650. Best Recall: 0.0738
2026-05-15 20:54:06,945 - optuna.study.study - INFO - Trial 207 finished with value: 0.07383018925356884 and parameters: {'n_layers': 1, 'embedding_dim': 64, 'lr': 0.0007789605388283585, 'lambda_val': 0.000277883668249948, 'batch_size': 745, 'optimizer': 'Adam'}. Best is trial 191 with value: 0.08164446855030871.
2026-05-15 20:54:15,483 - optuna.study._optimize - INFO - Trial 208 pruned. 
2026-05-15 20:54:25,509 - experiment_functions - INFO - Early stopping at epoch 1650. Best Recall: 0.0725
2026-05-15 20:54:25,599 - optuna.study.study - INFO - Trial 209 finished with value: 0.07245149662381263 and parameters: {'n_layers': 1, 'embedding_dim': 256, 'lr': 0.0006294270105843624, 'lambda_val': 0.0001846804304265309, 'batch_size': 581, 'optimizer': 'Adam'}. Best is trial 191 with value: 0.08164446855030871.
2026-05-15 20:54:31,627 - optuna.study._optimize - INFO - Trial 210 pruned. 
2026-05-15 20:54:40,372 - experiment_functions - INFO - Early stopping at epoch 1300. Best Recall: 0.0700
2026-05-15 20:54:40,516 - optuna.study.study - INFO - Trial 211 finished with value: 0.06995781533639288 and parameters: {'n_layers': 1, 'embedding_dim': 256, 'lr': 0.0010039664813879753, 'lambda_val': 7.213279711657075e-05, 'batch_size': 831, 'optimizer': 'Adam'}. Best is trial 191 with value: 0.08164446855030871.
2026-05-15 20:54:49,901 - experiment_functions - INFO - Early stopping at epoch 1500. Best Recall: 0.0810
2026-05-15 20:54:49,991 - optuna.study.study - INFO - Trial 212 finished with value: 0.08104456493642097 and parameters: {'n_layers': 1, 'embedding_dim': 256, 'lr': 0.0008265356974124293, 'lambda_val': 0.00023806923876935692, 'batch_size': 901, 'optimizer': 'Adam'}. Best is trial 191 with value: 0.08164446855030871.
2026-05-15 20:54:59,408 - experiment_functions - INFO - Early stopping at epoch 1250. Best Recall: 0.0743
2026-05-15 20:54:59,509 - optuna.study.study - INFO - Trial 213 finished with value: 0.07432903064093144 and parameters: {'n_layers': 1, 'embedding_dim': 256, 'lr': 0.0008562757194122013, 'lambda_val': 0.00025270989378115027, 'batch_size': 955, 'optimizer': 'Adam'}. Best is trial 191 with value: 0.08164446855030871.
2026-05-15 20:55:06,000 - optuna.study._optimize - INFO - Trial 214 pruned. 
2026-05-15 20:55:19,474 - experiment_functions - INFO - Early stopping at epoch 2100. Best Recall: 0.0741
2026-05-15 20:55:19,573 - optuna.study.study - INFO - Trial 215 finished with value: 0.07405260672246844 and parameters: {'n_layers': 1, 'embedding_dim': 256, 'lr': 0.0005360969903229495, 'lambda_val': 0.00033202797703795974, 'batch_size': 912, 'optimizer': 'Adam'}. Best is trial 191 with value: 0.08164446855030871.
2026-05-15 20:55:26,774 - optuna.study._optimize - INFO - Trial 216 pruned. 
2026-05-15 20:55:38,813 - optuna.study._optimize - INFO - Trial 217 pruned. 
2026-05-15 20:55:45,277 - optuna.study._optimize - INFO - Trial 218 pruned. 
2026-05-15 20:55:52,309 - optuna.study._optimize - INFO - Trial 219 pruned. 
2026-05-15 20:55:59,341 - optuna.study._optimize - INFO - Trial 220 pruned. 
2026-05-15 20:56:11,437 - experiment_functions - INFO - Early stopping at epoch 1900. Best Recall: 0.0808
2026-05-15 20:56:11,586 - optuna.study.study - INFO - Trial 221 finished with value: 0.08082347425495491 and parameters: {'n_layers': 1, 'embedding_dim': 256, 'lr': 0.0009858163272365075, 'lambda_val': 9.120118262084642e-05, 'batch_size': 945, 'optimizer': 'Adam'}. Best is trial 191 with value: 0.08164446855030871.
2026-05-15 20:56:19,097 - optuna.study._optimize - INFO - Trial 222 pruned. 
2026-05-15 20:56:27,003 - experiment_functions - INFO - Early stopping at epoch 1100. Best Recall: 0.0741
2026-05-15 20:56:27,105 - optuna.study.study - INFO - Trial 223 finished with value: 0.07410064566704401 and parameters: {'n_layers': 1, 'embedding_dim': 256, 'lr': 0.0008494491699781155, 'lambda_val': 0.0003425388780918254, 'batch_size': 1018, 'optimizer': 'Adam'}. Best is trial 191 with value: 0.08164446855030871.
2026-05-15 20:56:34,705 - optuna.study._optimize - INFO - Trial 224 pruned. 
2026-05-15 20:56:45,296 - experiment_functions - INFO - Early stopping at epoch 1700. Best Recall: 0.0760
2026-05-15 20:56:45,544 - optuna.study.study - INFO - Trial 225 finished with value: 0.07595657206112093 and parameters: {'n_layers': 1, 'embedding_dim': 256, 'lr': 0.000706329612279779, 'lambda_val': 0.0001459308718750873, 'batch_size': 1126, 'optimizer': 'Adam'}. Best is trial 191 with value: 0.08164446855030871.
2026-05-15 20:56:49,787 - experiment_functions - INFO - Early stopping at epoch 500. Best Recall: 0.0027
2026-05-15 20:56:49,881 - optuna.study.study - INFO - Trial 226 finished with value: 0.002706029314050928 and parameters: {'n_layers': 1, 'embedding_dim': 256, 'lr': 1.735685865384518e-05, 'lambda_val': 6.223326494188222e-05, 'batch_size': 2660, 'optimizer': 'Adam'}. Best is trial 191 with value: 0.08164446855030871.
2026-05-15 20:57:02,462 - experiment_functions - INFO - Early stopping at epoch 2000. Best Recall: 0.0833
2026-05-15 20:57:02,621 - optuna.study.study - INFO - Trial 227 finished with value: 0.0832944286583251 and parameters: {'n_layers': 1, 'embedding_dim': 256, 'lr': 0.0013043766808732535, 'lambda_val': 4.370027356519789e-05, 'batch_size': 961, 'optimizer': 'Adam'}. Best is trial 227 with value: 0.0832944286583251.
2026-05-15 20:57:16,642 - experiment_functions - INFO - Early stopping at epoch 2050. Best Recall: 0.0805
2026-05-15 20:57:16,736 - optuna.study.study - INFO - Trial 228 finished with value: 0.08045108849368436 and parameters: {'n_layers': 1, 'embedding_dim': 256, 'lr': 0.0012452479949279784, 'lambda_val': 4.4294137762682595e-05, 'batch_size': 910, 'optimizer': 'Adam'}. Best is trial 227 with value: 0.0832944286583251.
2026-05-15 20:57:23,582 - optuna.study._optimize - INFO - Trial 229 pruned. 
2026-05-15 20:57:30,183 - optuna.study._optimize - INFO - Trial 230 pruned. 
2026-05-15 20:57:36,037 - experiment_functions - INFO - Early stopping at epoch 800. Best Recall: 0.0780
2026-05-15 20:57:36,132 - optuna.study.study - INFO - Trial 231 finished with value: 0.07803743069161874 and parameters: {'n_layers': 1, 'embedding_dim': 256, 'lr': 0.0011506843449433045, 'lambda_val': 3.683796334137848e-05, 'batch_size': 969, 'optimizer': 'Adam'}. Best is trial 227 with value: 0.0832944286583251.
2026-05-15 20:57:52,679 - experiment_functions - INFO - Early stopping at epoch 2700. Best Recall: 0.0808
2026-05-15 20:57:52,783 - optuna.study.study - INFO - Trial 232 finished with value: 0.0808234727575556 and parameters: {'n_layers': 1, 'embedding_dim': 256, 'lr': 0.0011527866923275712, 'lambda_val': 3.441732549296346e-05, 'batch_size': 944, 'optimizer': 'Adam'}. Best is trial 227 with value: 0.0832944286583251.
2026-05-15 20:58:05,001 - experiment_functions - INFO - Early stopping at epoch 1850. Best Recall: 0.0749
2026-05-15 20:58:05,093 - optuna.study.study - INFO - Trial 233 finished with value: 0.07486748425728755 and parameters: {'n_layers': 1, 'embedding_dim': 256, 'lr': 0.0013184811133412242, 'lambda_val': 3.7648607831188176e-05, 'batch_size': 929, 'optimizer': 'Adam'}. Best is trial 227 with value: 0.0832944286583251.
2026-05-15 20:58:18,334 - experiment_functions - INFO - Early stopping at epoch 2200. Best Recall: 0.0843
2026-05-15 20:58:18,440 - optuna.study.study - INFO - Trial 234 finished with value: 0.08433565617451873 and parameters: {'n_layers': 1, 'embedding_dim': 256, 'lr': 0.00117514234944102, 'lambda_val': 4.5955997864779247e-05, 'batch_size': 877, 'optimizer': 'Adam'}. Best is trial 234 with value: 0.08433565617451873.
2026-05-15 20:58:34,451 - experiment_functions - INFO - Early stopping at epoch 2650. Best Recall: 0.0813
2026-05-15 20:58:34,544 - optuna.study.study - INFO - Trial 235 finished with value: 0.081282173499474 and parameters: {'n_layers': 1, 'embedding_dim': 256, 'lr': 0.0015765609362946428, 'lambda_val': 4.995077914978097e-05, 'batch_size': 858, 'optimizer': 'Adam'}. Best is trial 234 with value: 0.08433565617451873.
2026-05-15 20:58:43,329 - experiment_functions - INFO - Early stopping at epoch 1350. Best Recall: 0.0744
2026-05-15 20:58:43,409 - optuna.study.study - INFO - Trial 236 finished with value: 0.07438528839555708 and parameters: {'n_layers': 1, 'embedding_dim': 256, 'lr': 0.002017341632443094, 'lambda_val': 3.318885175903707e-05, 'batch_size': 842, 'optimizer': 'Adam'}. Best is trial 234 with value: 0.08433565617451873.
2026-05-15 20:58:47,978 - experiment_functions - INFO - Early stopping at epoch 500. Best Recall: 0.0038
2026-05-15 20:58:48,071 - optuna.study.study - INFO - Trial 237 finished with value: 0.0037584774645405454 and parameters: {'n_layers': 1, 'embedding_dim': 256, 'lr': 0.0017080354039599082, 'lambda_val': 4.5981842061861495e-05, 'batch_size': 845, 'optimizer': 'SGD'}. Best is trial 234 with value: 0.08433565617451873.
2026-05-15 20:58:55,931 - optuna.study._optimize - INFO - Trial 238 pruned. 
2026-05-15 20:59:02,293 - experiment_functions - INFO - Early stopping at epoch 1000. Best Recall: 0.0704
2026-05-15 20:59:02,374 - optuna.study.study - INFO - Trial 239 finished with value: 0.07044279310714709 and parameters: {'n_layers': 1, 'embedding_dim': 256, 'lr': 0.0010276936545552653, 'lambda_val': 3.104610597260239e-05, 'batch_size': 786, 'optimizer': 'Adam'}. Best is trial 234 with value: 0.08433565617451873.
2026-05-15 20:59:09,396 - optuna.study._optimize - INFO - Trial 240 pruned. 
2026-05-15 20:59:15,757 - experiment_functions - INFO - Early stopping at epoch 900. Best Recall: 0.0702
2026-05-15 20:59:15,861 - optuna.study.study - INFO - Trial 241 finished with value: 0.07016973748609034 and parameters: {'n_layers': 1, 'embedding_dim': 256, 'lr': 0.0011791136350033445, 'lambda_val': 6.530772382287106e-05, 'batch_size': 1050, 'optimizer': 'Adam'}. Best is trial 234 with value: 0.08433565617451873.
2026-05-15 20:59:30,640 - experiment_functions - INFO - Early stopping at epoch 2350. Best Recall: 0.0814
