2026-05-15 20:28:26,403 - optuna.study.study - INFO - Trial 26 finished with value: 0.05126649958073714 and parameters: {'n_layers': 2, 'embedding_dim': 96, 'lr': 0.00028409269658629885, 'lambda_val': 0.0041194799595281025, 'batch_size': 2092, 'optimizer': 'Adam'}. Best is trial 22 with value: 0.06835236426952564.
2026-05-15 20:28:30,458 - experiment_functions - INFO - Early stopping at epoch 550. Best Recall: 0.0638
2026-05-15 20:28:30,604 - optuna.study.study - INFO - Trial 27 finished with value: 0.06384145464353982 and parameters: {'n_layers': 1, 'embedding_dim': 96, 'lr': 0.00571146422042449, 'lambda_val': 4.251827130978647e-06, 'batch_size': 1736, 'optimizer': 'Adam'}. Best is trial 22 with value: 0.06835236426952564.
2026-05-15 20:28:36,478 - experiment_functions - INFO - Early stopping at epoch 950. Best Recall: 0.0179
2026-05-15 20:28:36,601 - optuna.study.study - INFO - Trial 28 finished with value: 0.017930015341894093 and parameters: {'n_layers': 2, 'embedding_dim': 32, 'lr': 0.01313287758802322, 'lambda_val': 8.477774202997387e-05, 'batch_size': 520, 'optimizer': 'Adam'}. Best is trial 22 with value: 0.06835236426952564.
2026-05-15 20:28:47,520 - experiment_functions - INFO - Early stopping at epoch 500. Best Recall: 0.0025
2026-05-15 20:28:47,646 - optuna.study.study - INFO - Trial 29 finished with value: 0.002489879730459369 and parameters: {'n_layers': 4, 'embedding_dim': 256, 'lr': 0.0005236423466028505, 'lambda_val': 2.652482853725781e-06, 'batch_size': 2237, 'optimizer': 'SGD'}. Best is trial 22 with value: 0.06835236426952564.
2026-05-15 20:28:55,412 - optuna.study._optimize - INFO - Trial 30 pruned. 
2026-05-15 20:29:02,467 - experiment_functions - INFO - Early stopping at epoch 1000. Best Recall: 0.0638
2026-05-15 20:29:02,569 - optuna.study.study - INFO - Trial 31 finished with value: 0.06376660144690251 and parameters: {'n_layers': 1, 'embedding_dim': 96, 'lr': 0.004313513011972332, 'lambda_val': 3.279487446928628e-06, 'batch_size': 1598, 'optimizer': 'Adam'}. Best is trial 22 with value: 0.06835236426952564.
2026-05-15 20:29:10,721 - experiment_functions - INFO - Early stopping at epoch 1450. Best Recall: 0.0645
2026-05-15 20:29:10,833 - optuna.study.study - INFO - Trial 32 finished with value: 0.06445620993683776 and parameters: {'n_layers': 1, 'embedding_dim': 96, 'lr': 0.0014206215315257648, 'lambda_val': 1.0502063858251949e-05, 'batch_size': 1837, 'optimizer': 'Adam'}. Best is trial 22 with value: 0.06835236426952564.
2026-05-15 20:29:18,672 - experiment_functions - INFO - Early stopping at epoch 700. Best Recall: 0.0668
2026-05-15 20:29:18,850 - optuna.study.study - INFO - Trial 33 finished with value: 0.06675284343188695 and parameters: {'n_layers': 1, 'embedding_dim': 96, 'lr': 0.0015942083366045458, 'lambda_val': 3.83417101562185e-05, 'batch_size': 1266, 'optimizer': 'Adam'}. Best is trial 22 with value: 0.06835236426952564.
2026-05-15 20:29:25,851 - experiment_functions - INFO - Early stopping at epoch 1050. Best Recall: 0.0631
2026-05-15 20:29:25,981 - optuna.study.study - INFO - Trial 34 finished with value: 0.0631277567157775 and parameters: {'n_layers': 1, 'embedding_dim': 64, 'lr': 0.0009041154816659836, 'lambda_val': 4.948372922519104e-05, 'batch_size': 1275, 'optimizer': 'Adam'}. Best is trial 22 with value: 0.06835236426952564.
2026-05-15 20:29:30,924 - experiment_functions - INFO - Early stopping at epoch 700. Best Recall: 0.0414
2026-05-15 20:29:31,027 - optuna.study.study - INFO - Trial 35 finished with value: 0.04136518790013745 and parameters: {'n_layers': 2, 'embedding_dim': 96, 'lr': 0.001776204621734819, 'lambda_val': 3.0364296492572822e-05, 'batch_size': 784, 'optimizer': 'Adam'}. Best is trial 22 with value: 0.06835236426952564.
2026-05-15 20:29:34,940 - experiment_functions - INFO - Early stopping at epoch 550. Best Recall: 0.0494
2026-05-15 20:29:35,052 - optuna.study.study - INFO - Trial 36 finished with value: 0.04937438825841913 and parameters: {'n_layers': 1, 'embedding_dim': 256, 'lr': 0.009331227448227114, 'lambda_val': 9.615311855182825e-05, 'batch_size': 1150, 'optimizer': 'Adam'}. Best is trial 22 with value: 0.06835236426952564.
2026-05-15 20:29:42,121 - experiment_functions - INFO - Early stopping at epoch 800. Best Recall: 0.0380
2026-05-15 20:29:42,233 - optuna.study.study - INFO - Trial 37 finished with value: 0.03802303228713324 and parameters: {'n_layers': 4, 'embedding_dim': 128, 'lr': 0.0003985122094485875, 'lambda_val': 1.52614920428191e-05, 'batch_size': 1476, 'optimizer': 'RMSprop'}. Best is trial 22 with value: 0.06835236426952564.
2026-05-15 20:29:48,459 - experiment_functions - INFO - Early stopping at epoch 650. Best Recall: 0.0202
2026-05-15 20:29:48,582 - optuna.study.study - INFO - Trial 38 finished with value: 0.020174293155704615 and parameters: {'n_layers': 2, 'embedding_dim': 96, 'lr': 0.03228489594682634, 'lambda_val': 0.00038370288421785885, 'batch_size': 928, 'optimizer': 'Adam'}. Best is trial 22 with value: 0.06835236426952564.
2026-05-15 20:29:55,831 - optuna.study._optimize - INFO - Trial 39 pruned. 
2026-05-15 20:30:03,962 - experiment_functions - INFO - Early stopping at epoch 1100. Best Recall: 0.0610
2026-05-15 20:30:04,065 - optuna.study.study - INFO - Trial 40 finished with value: 0.06096667535977239 and parameters: {'n_layers': 1, 'embedding_dim': 64, 'lr': 0.0008756009098667753, 'lambda_val': 1.479707264604993e-06, 'batch_size': 1642, 'optimizer': 'RMSprop'}. Best is trial 22 with value: 0.06835236426952564.
2026-05-15 20:30:14,362 - experiment_functions - INFO - Early stopping at epoch 1350. Best Recall: 0.0677
2026-05-15 20:30:14,462 - optuna.study.study - INFO - Trial 41 finished with value: 0.06774373188920155 and parameters: {'n_layers': 1, 'embedding_dim': 96, 'lr': 0.0016294325009501363, 'lambda_val': 4.32116063579169e-05, 'batch_size': 1882, 'optimizer': 'Adam'}. Best is trial 22 with value: 0.06835236426952564.
2026-05-15 20:30:20,110 - experiment_functions - INFO - Early stopping at epoch 750. Best Recall: 0.0627
2026-05-15 20:30:20,200 - optuna.study.study - INFO - Trial 42 finished with value: 0.06271088248850583 and parameters: {'n_layers': 1, 'embedding_dim': 96, 'lr': 0.0020976774742034725, 'lambda_val': 3.849050481934563e-05, 'batch_size': 1962, 'optimizer': 'Adam'}. Best is trial 22 with value: 0.06835236426952564.
2026-05-15 20:30:24,523 - experiment_functions - INFO - Early stopping at epoch 550. Best Recall: 0.0538
2026-05-15 20:30:24,716 - optuna.study.study - INFO - Trial 43 finished with value: 0.05382199947422057 and parameters: {'n_layers': 1, 'embedding_dim': 96, 'lr': 0.004490595638209933, 'lambda_val': 0.0001189589525650937, 'batch_size': 1337, 'optimizer': 'Adam'}. Best is trial 22 with value: 0.06835236426952564.
2026-05-15 20:30:30,225 - experiment_functions - INFO - Early stopping at epoch 700. Best Recall: 0.0026
2026-05-15 20:30:30,316 - optuna.study.study - INFO - Trial 44 finished with value: 0.0026084872042114893 and parameters: {'n_layers': 1, 'embedding_dim': 96, 'lr': 1.0423585130660912e-05, 'lambda_val': 0.00026680695364612883, 'batch_size': 1988, 'optimizer': 'Adam'}. Best is trial 22 with value: 0.06835236426952564.
2026-05-15 20:30:36,491 - experiment_functions - INFO - Early stopping at epoch 900. Best Recall: 0.0681
2026-05-15 20:30:36,603 - optuna.study.study - INFO - Trial 45 finished with value: 0.06813104319960903 and parameters: {'n_layers': 1, 'embedding_dim': 32, 'lr': 0.0012841646382790151, 'lambda_val': 5.2683172674421227e-05, 'batch_size': 748, 'optimizer': 'Adam'}. Best is trial 22 with value: 0.06835236426952564.
2026-05-15 20:30:39,916 - experiment_functions - INFO - Early stopping at epoch 500. Best Recall: 0.0029
2026-05-15 20:30:40,538 - optuna.study.study - INFO - Trial 46 finished with value: 0.0028613687875537826 and parameters: {'n_layers': 2, 'embedding_dim': 32, 'lr': 0.0011360409277991188, 'lambda_val': 5.871842026914253e-05, 'batch_size': 764, 'optimizer': 'SGD'}. Best is trial 22 with value: 0.06835236426952564.
2026-05-15 20:30:46,267 - experiment_functions - INFO - Early stopping at epoch 550. Best Recall: 0.0026
2026-05-15 20:30:46,933 - optuna.study.study - INFO - Trial 47 finished with value: 0.0026122273234938155 and parameters: {'n_layers': 1, 'embedding_dim': 32, 'lr': 2.847502504278653e-05, 'lambda_val': 2.6662504936305258e-05, 'batch_size': 1033, 'optimizer': 'RMSprop'}. Best is trial 22 with value: 0.06835236426952564.
2026-05-15 20:30:58,313 - experiment_functions - INFO - Early stopping at epoch 1350. Best Recall: 0.0679
2026-05-15 20:30:58,468 - optuna.study.study - INFO - Trial 48 finished with value: 0.06793846500167357 and parameters: {'n_layers': 2, 'embedding_dim': 32, 'lr': 0.0005996071623120018, 'lambda_val': 0.0006647558755933236, 'batch_size': 675, 'optimizer': 'Adam'}. Best is trial 22 with value: 0.06835236426952564.
2026-05-15 20:31:10,043 - experiment_functions - INFO - Early stopping at epoch 950. Best Recall: 0.0370
2026-05-15 20:31:10,174 - optuna.study.study - INFO - Trial 49 finished with value: 0.03702646446402298 and parameters: {'n_layers': 3, 'embedding_dim': 32, 'lr': 0.0005886889773320503, 'lambda_val': 0.006356065793834251, 'batch_size': 666, 'optimizer': 'Adam'}. Best is trial 22 with value: 0.06835236426952564.
2026-05-15 20:31:20,288 - optuna.study._optimize - INFO - Trial 50 pruned. 
2026-05-15 20:31:42,223 - experiment_functions - INFO - Early stopping at epoch 3800. Best Recall: 0.0596
2026-05-15 20:31:42,330 - optuna.study.study - INFO - Trial 51 finished with value: 0.05963690214533566 and parameters: {'n_layers': 1, 'embedding_dim': 32, 'lr': 0.00034940451727498195, 'lambda_val': 0.00022577506239879322, 'batch_size': 635, 'optimizer': 'Adam'}. Best is trial 22 with value: 0.06835236426952564.
2026-05-15 20:31:47,519 - experiment_functions - INFO - Early stopping at epoch 600. Best Recall: 0.0336
2026-05-15 20:31:47,629 - optuna.study.study - INFO - Trial 52 finished with value: 0.03361384039392974 and parameters: {'n_layers': 3, 'embedding_dim': 32, 'lr': 0.003344486368036938, 'lambda_val': 0.00013886372709138558, 'batch_size': 1525, 'optimizer': 'Adam'}. Best is trial 22 with value: 0.06835236426952564.
2026-05-15 20:31:59,256 - experiment_functions - INFO - Early stopping at epoch 1700. Best Recall: 0.0747
2026-05-15 20:31:59,363 - optuna.study.study - INFO - Trial 53 finished with value: 0.07473404081168325 and parameters: {'n_layers': 1, 'embedding_dim': 32, 'lr': 0.0007300586390840266, 'lambda_val': 5.4593358049571726e-05, 'batch_size': 1077, 'optimizer': 'Adam'}. Best is trial 53 with value: 0.07473404081168325.
2026-05-15 20:32:09,482 - experiment_functions - INFO - Early stopping at epoch 1250. Best Recall: 0.0683
2026-05-15 20:32:09,603 - optuna.study.study - INFO - Trial 54 finished with value: 0.06831963416810033 and parameters: {'n_layers': 1, 'embedding_dim': 32, 'lr': 0.0007249600900345858, 'lambda_val': 0.0005639707026972738, 'batch_size': 1062, 'optimizer': 'Adam'}. Best is trial 53 with value: 0.07473404081168325.
2026-05-15 20:32:17,881 - optuna.study._optimize - INFO - Trial 55 pruned. 
2026-05-15 20:32:32,035 - experiment_functions - INFO - Early stopping at epoch 2100. Best Recall: 0.0714
2026-05-15 20:32:32,137 - optuna.study.study - INFO - Trial 56 finished with value: 0.07138606166359307 and parameters: {'n_layers': 1, 'embedding_dim': 32, 'lr': 0.0005074575957604934, 'lambda_val': 0.0021225031369641644, 'batch_size': 1061, 'optimizer': 'Adam'}. Best is trial 53 with value: 0.07473404081168325.
2026-05-15 20:32:53,485 - experiment_functions - INFO - Early stopping at epoch 3750. Best Recall: 0.0636
2026-05-15 20:32:53,607 - optuna.study.study - INFO - Trial 57 finished with value: 0.06357077999756978 and parameters: {'n_layers': 1, 'embedding_dim': 32, 'lr': 0.00042302622331172616, 'lambda_val': 0.001954266840151475, 'batch_size': 1054, 'optimizer': 'RMSprop'}. Best is trial 53 with value: 0.07473404081168325.
2026-05-15 20:32:58,604 - experiment_functions - INFO - Early stopping at epoch 500. Best Recall: 0.0017
2026-05-15 20:32:58,767 - optuna.study.study - INFO - Trial 58 finished with value: 0.0016853943567655106 and parameters: {'n_layers': 3, 'embedding_dim': 32, 'lr': 0.0006775819235072628, 'lambda_val': 0.013210255183407342, 'batch_size': 852, 'optimizer': 'SGD'}. Best is trial 53 with value: 0.07473404081168325.
2026-05-15 20:33:06,102 - optuna.study._optimize - INFO - Trial 59 pruned. 
2026-05-15 20:33:12,278 - experiment_functions - INFO - Early stopping at epoch 900. Best Recall: 0.0551
2026-05-15 20:33:12,367 - optuna.study.study - INFO - Trial 60 finished with value: 0.05512429647463443 and parameters: {'n_layers': 2, 'embedding_dim': 32, 'lr': 0.0007878665170065407, 'lambda_val': 0.003099965338040363, 'batch_size': 604, 'optimizer': 'Adam'}. Best is trial 53 with value: 0.07473404081168325.
2026-05-15 20:33:24,708 - experiment_functions - INFO - Early stopping at epoch 900. Best Recall: 0.0613
2026-05-15 20:33:24,876 - optuna.study.study - INFO - Trial 61 finished with value: 0.0612842108868255 and parameters: {'n_layers': 1, 'embedding_dim': 32, 'lr': 0.0012691258512304345, 'lambda_val': 0.0005004070347841693, 'batch_size': 1182, 'optimizer': 'Adam'}. Best is trial 53 with value: 0.07473404081168325.
2026-05-15 20:33:44,057 - experiment_functions - INFO - Early stopping at epoch 2750. Best Recall: 0.0627
2026-05-15 20:33:44,295 - optuna.study.study - INFO - Trial 62 finished with value: 0.06271535464626794 and parameters: {'n_layers': 1, 'embedding_dim': 32, 'lr': 0.0005252847636813907, 'lambda_val': 0.002034724629262667, 'batch_size': 940, 'optimizer': 'Adam'}. Best is trial 53 with value: 0.07473404081168325.
2026-05-15 20:33:52,375 - optuna.study._optimize - INFO - Trial 63 pruned. 
2026-05-15 20:33:58,739 - optuna.study._optimize - INFO - Trial 64 pruned. 
2026-05-15 20:34:05,233 - experiment_functions - INFO - Early stopping at epoch 850. Best Recall: 0.0630
2026-05-15 20:34:05,357 - optuna.study.study - INFO - Trial 65 finished with value: 0.06298170940200899 and parameters: {'n_layers': 1, 'embedding_dim': 256, 'lr': 0.001049541927223648, 'lambda_val': 8.174446955875097e-05, 'batch_size': 781, 'optimizer': 'Adam'}. Best is trial 53 with value: 0.07473404081168325.
2026-05-15 20:34:11,174 - experiment_functions - INFO - Early stopping at epoch 600. Best Recall: 0.0580
2026-05-15 20:34:11,296 - optuna.study.study - INFO - Trial 66 finished with value: 0.05800318851715233 and parameters: {'n_layers': 1, 'embedding_dim': 32, 'lr': 0.002635378507642948, 'lambda_val': 0.00031633529116790077, 'batch_size': 2491, 'optimizer': 'Adam'}. Best is trial 53 with value: 0.07473404081168325.
2026-05-15 20:34:26,895 - experiment_functions - INFO - Early stopping at epoch 2250. Best Recall: 0.0670
2026-05-15 20:34:27,015 - optuna.study.study - INFO - Trial 67 finished with value: 0.06699912887591915 and parameters: {'n_layers': 1, 'embedding_dim': 64, 'lr': 0.0004241718074784407, 'lambda_val': 0.007191884393384267, 'batch_size': 1200, 'optimizer': 'Adam'}. Best is trial 53 with value: 0.07473404081168325.
2026-05-15 20:34:34,366 - experiment_functions - INFO - Early stopping at epoch 500. Best Recall: 0.0021
2026-05-15 20:34:34,488 - optuna.study.study - INFO - Trial 68 finished with value: 0.0020673415322236964 and parameters: {'n_layers': 1, 'embedding_dim': 32, 'lr': 0.0006646001936642342, 'lambda_val': 0.0004996530994719288, 'batch_size': 526, 'optimizer': 'SGD'}. Best is trial 53 with value: 0.07473404081168325.
2026-05-15 20:34:40,987 - optuna.study._optimize - INFO - Trial 69 pruned. 
2026-05-15 20:34:45,558 - experiment_functions - INFO - Early stopping at epoch 550. Best Recall: 0.0430
2026-05-15 20:34:46,436 - optuna.study.study - INFO - Trial 70 finished with value: 0.043022034742787624 and parameters: {'n_layers': 1, 'embedding_dim': 128, 'lr': 0.0119949480488472, 'lambda_val': 1.604860417227224e-05, 'batch_size': 983, 'optimizer': 'Adam'}. Best is trial 53 with value: 0.07473404081168325.
2026-05-15 20:34:52,255 - experiment_functions - INFO - Early stopping at epoch 800. Best Recall: 0.0701
2026-05-15 20:34:52,356 - optuna.study.study - INFO - Trial 71 finished with value: 0.07006611470358186 and parameters: {'n_layers': 1, 'embedding_dim': 32, 'lr': 0.0022315270607379425, 'lambda_val': 2.2862085679555473e-05, 'batch_size': 1425, 'optimizer': 'Adam'}. Best is trial 53 with value: 0.07473404081168325.
2026-05-15 20:34:58,366 - experiment_functions - INFO - Early stopping at epoch 700. Best Recall: 0.0590
2026-05-15 20:34:58,542 - optuna.study.study - INFO - Trial 72 finished with value: 0.05896569211807094 and parameters: {'n_layers': 1, 'embedding_dim': 32, 'lr': 0.00446921052815721, 'lambda_val': 2.2733569343555385e-05, 'batch_size': 1823, 'optimizer': 'Adam'}. Best is trial 53 with value: 0.07473404081168325.
2026-05-15 20:35:03,969 - experiment_functions - INFO - Early stopping at epoch 700. Best Recall: 0.0578
2026-05-15 20:35:04,072 - optuna.study.study - INFO - Trial 73 finished with value: 0.057812352580448846 and parameters: {'n_layers': 1, 'embedding_dim': 32, 'lr': 0.0015308992680541293, 'lambda_val': 0.0010715326149397318, 'batch_size': 1418, 'optimizer': 'Adam'}. Best is trial 53 with value: 0.07473404081168325.
2026-05-15 20:35:19,394 - experiment_functions - INFO - Early stopping at epoch 2750. Best Recall: 0.0700
2026-05-15 20:35:19,484 - optuna.study.study - INFO - Trial 74 finished with value: 0.0699794721905645 and parameters: {'n_layers': 1, 'embedding_dim': 32, 'lr': 0.0008268281788150045, 'lambda_val': 0.00012178196053105402, 'batch_size': 860, 'optimizer': 'Adam'}. Best is trial 53 with value: 0.07473404081168325.
2026-05-15 20:35:26,081 - optuna.study._optimize - INFO - Trial 75 pruned. 
2026-05-15 20:35:40,789 - experiment_functions - INFO - Early stopping at epoch 2500. Best Recall: 0.0777
2026-05-15 20:35:40,916 - optuna.study.study - INFO - Trial 76 finished with value: 0.07765620853201886 and parameters: {'n_layers': 1, 'embedding_dim': 32, 'lr': 0.000484916645706719, 'lambda_val': 7.123916948991715e-05, 'batch_size': 1084, 'optimizer': 'Adam'}. Best is trial 76 with value: 0.07765620853201886.
2026-05-15 20:35:58,944 - experiment_functions - INFO - Early stopping at epoch 3050. Best Recall: 0.0795
2026-05-15 20:35:59,056 - optuna.study.study - INFO - Trial 77 finished with value: 0.0794652188316307 and parameters: {'n_layers': 1, 'embedding_dim': 32, 'lr': 0.0004686665259682081, 'lambda_val': 0.0001859260163587526, 'batch_size': 1169, 'optimizer': 'Adam'}. Best is trial 77 with value: 0.0794652188316307.
2026-05-15 20:36:05,784 - optuna.study._optimize - INFO - Trial 78 pruned. 
2026-05-15 20:36:13,949 - experiment_functions - INFO - Early stopping at epoch 750. Best Recall: 0.0291
2026-05-15 20:36:14,071 - optuna.study.study - INFO - Trial 79 finished with value: 0.029124218106014715 and parameters: {'n_layers': 4, 'embedding_dim': 256, 'lr': 0.0004507550638358685, 'lambda_val': 0.00017685632518529398, 'batch_size': 1596, 'optimizer': 'Adam'}. Best is trial 77 with value: 0.0794652188316307.
2026-05-15 20:36:21,531 - optuna.study._optimize - INFO - Trial 80 pruned. 
2026-05-15 20:36:32,976 - optuna.study._optimize - INFO - Trial 81 pruned. 
2026-05-15 20:36:37,808 - experiment_functions - INFO - Early stopping at epoch 550. Best Recall: 0.0369
2026-05-15 20:36:37,921 - optuna.study.study - INFO - Trial 82 finished with value: 0.0368776348969967 and parameters: {'n_layers': 1, 'embedding_dim': 32, 'lr': 0.021796088396024847, 'lambda_val': 6.696795545887936e-05, 'batch_size': 1190, 'optimizer': 'Adam'}. Best is trial 77 with value: 0.0794652188316307.
2026-05-15 20:36:42,433 - experiment_functions - INFO - Early stopping at epoch 750. Best Recall: 0.0574
2026-05-15 20:36:42,534 - optuna.study.study - INFO - Trial 83 finished with value: 0.057409451407815365 and parameters: {'n_layers': 1, 'embedding_dim': 32, 'lr': 0.002130403189423061, 'lambda_val': 2.3170868689564177e-05, 'batch_size': 1294, 'optimizer': 'Adam'}. Best is trial 77 with value: 0.0794652188316307.
2026-05-15 20:36:49,402 - experiment_functions - INFO - Early stopping at epoch 850. Best Recall: 0.0742
2026-05-15 20:36:49,714 - optuna.study.study - INFO - Trial 84 finished with value: 0.07419687484726152 and parameters: {'n_layers': 1, 'embedding_dim': 32, 'lr': 0.0011668670171034728, 'lambda_val': 0.0001581285137007559, 'batch_size': 873, 'optimizer': 'Adam'}. Best is trial 77 with value: 0.0794652188316307.
2026-05-15 20:36:57,329 - optuna.study._optimize - INFO - Trial 85 pruned. 
2026-05-15 20:37:04,414 - experiment_functions - INFO - Early stopping at epoch 900. Best Recall: 0.0212
2026-05-15 20:37:04,515 - optuna.study.study - INFO - Trial 86 finished with value: 0.021188049667939912 and parameters: {'n_layers': 1, 'embedding_dim': 64, 'lr': 0.09327019259011786, 'lambda_val': 0.0002278393695192651, 'batch_size': 1080, 'optimizer': 'Adam'}. Best is trial 77 with value: 0.0794652188316307.
2026-05-15 20:37:12,048 - optuna.study._optimize - INFO - Trial 87 pruned. 
2026-05-15 20:37:15,148 - experiment_functions - INFO - Early stopping at epoch 500. Best Recall: 0.0018
2026-05-15 20:37:15,260 - optuna.study.study - INFO - Trial 88 finished with value: 0.0017831604646574687 and parameters: {'n_layers': 1, 'embedding_dim': 32, 'lr': 0.00018547654220741472, 'lambda_val': 9.161318743186142e-05, 'batch_size': 876, 'optimizer': 'SGD'}. Best is trial 77 with value: 0.0794652188316307.
2026-05-15 20:37:29,366 - experiment_functions - INFO - Early stopping at epoch 2500. Best Recall: 0.0713
