2026-05-16 09:01:40,691 - optuna.study.study - INFO - Trial 11 finished with value: 0.049368366679004926 and parameters: {'n_layers': 1, 'embedding_dim': 128, 'lr': 0.0025705988502247546, 'lambda_val': 0.02329428531694885, 'batch_size': 4070, 'optimizer': 'RMSprop'}. Best is trial 2 with value: 0.05248247993087025.
2026-05-16 09:01:44,961 - experiment_functions - INFO - Early stopping at epoch 550. Best Recall: 0.0349
2026-05-16 09:01:45,063 - optuna.study.study - INFO - Trial 12 finished with value: 0.03494468989765485 and parameters: {'n_layers': 2, 'embedding_dim': 128, 'lr': 0.0009530642642268203, 'lambda_val': 0.009364789565156965, 'batch_size': 3376, 'optimizer': 'RMSprop'}. Best is trial 2 with value: 0.05248247993087025.
2026-05-16 09:01:48,677 - experiment_functions - INFO - Early stopping at epoch 550. Best Recall: 0.0649
2026-05-16 09:01:48,781 - optuna.study.study - INFO - Trial 13 finished with value: 0.06494179997801999 and parameters: {'n_layers': 1, 'embedding_dim': 128, 'lr': 0.0036804577069747494, 'lambda_val': 0.0021218611150529143, 'batch_size': 3506, 'optimizer': 'RMSprop'}. Best is trial 13 with value: 0.06494179997801999.
2026-05-16 09:01:54,898 - experiment_functions - INFO - Early stopping at epoch 900. Best Recall: 0.0556
2026-05-16 09:01:55,010 - optuna.study.study - INFO - Trial 14 finished with value: 0.05564594568066795 and parameters: {'n_layers': 2, 'embedding_dim': 128, 'lr': 0.0004001733792294498, 'lambda_val': 0.002662213116209207, 'batch_size': 3139, 'optimizer': 'RMSprop'}. Best is trial 13 with value: 0.06494179997801999.
2026-05-16 09:01:59,174 - experiment_functions - INFO - Early stopping at epoch 550. Best Recall: 0.0573
2026-05-16 09:01:59,275 - optuna.study.study - INFO - Trial 15 finished with value: 0.05729167303131584 and parameters: {'n_layers': 1, 'embedding_dim': 96, 'lr': 0.004595291834247997, 'lambda_val': 0.0023379155632476316, 'batch_size': 2850, 'optimizer': 'RMSprop'}. Best is trial 13 with value: 0.06494179997801999.
2026-05-16 09:02:02,678 - experiment_functions - INFO - Early stopping at epoch 500. Best Recall: 0.0014
2026-05-16 09:02:02,789 - optuna.study.study - INFO - Trial 16 finished with value: 0.0013919166343277548 and parameters: {'n_layers': 1, 'embedding_dim': 96, 'lr': 0.007671933875922824, 'lambda_val': 0.0012751543359824774, 'batch_size': 2301, 'optimizer': 'SGD'}. Best is trial 13 with value: 0.06494179997801999.
2026-05-16 09:02:09,348 - optuna.study._optimize - INFO - Trial 17 pruned. 
2026-05-16 09:02:14,043 - experiment_functions - INFO - Early stopping at epoch 650. Best Recall: 0.0644
2026-05-16 09:02:14,135 - optuna.study.study - INFO - Trial 18 finished with value: 0.06441983855947757 and parameters: {'n_layers': 1, 'embedding_dim': 96, 'lr': 0.0029704371398119205, 'lambda_val': 0.0012770809459447196, 'batch_size': 3352, 'optimizer': 'RMSprop'}. Best is trial 13 with value: 0.06494179997801999.
2026-05-16 09:02:17,645 - experiment_functions - INFO - Early stopping at epoch 500. Best Recall: 0.0038
2026-05-16 09:02:17,737 - optuna.study.study - INFO - Trial 19 finished with value: 0.0037621967593223595 and parameters: {'n_layers': 2, 'embedding_dim': 96, 'lr': 0.01566994272701249, 'lambda_val': 0.0007136095101328337, 'batch_size': 3376, 'optimizer': 'SGD'}. Best is trial 13 with value: 0.06494179997801999.
2026-05-16 09:02:24,642 - optuna.study._optimize - INFO - Trial 20 pruned. 
2026-05-16 09:02:28,560 - experiment_functions - INFO - Early stopping at epoch 550. Best Recall: 0.0527
2026-05-16 09:02:28,660 - optuna.study.study - INFO - Trial 21 finished with value: 0.052730857749189966 and parameters: {'n_layers': 1, 'embedding_dim': 96, 'lr': 0.0059643098345832455, 'lambda_val': 0.0025284087250137185, 'batch_size': 2792, 'optimizer': 'RMSprop'}. Best is trial 13 with value: 0.06494179997801999.
2026-05-16 09:02:33,225 - experiment_functions - INFO - Early stopping at epoch 600. Best Recall: 0.0883
2026-05-16 09:02:33,372 - optuna.study.study - INFO - Trial 22 finished with value: 0.08834635977030823 and parameters: {'n_layers': 1, 'embedding_dim': 96, 'lr': 0.001751964629900218, 'lambda_val': 0.0007062732901464137, 'batch_size': 2556, 'optimizer': 'RMSprop'}. Best is trial 22 with value: 0.08834635977030823.
2026-05-16 09:02:37,977 - experiment_functions - INFO - Early stopping at epoch 650. Best Recall: 0.0850
2026-05-16 09:02:38,111 - optuna.study.study - INFO - Trial 23 finished with value: 0.08502753963521685 and parameters: {'n_layers': 1, 'embedding_dim': 96, 'lr': 0.0018632066196658434, 'lambda_val': 0.0007810222821238363, 'batch_size': 3540, 'optimizer': 'RMSprop'}. Best is trial 22 with value: 0.08834635977030823.
2026-05-16 09:02:45,030 - experiment_functions - INFO - Early stopping at epoch 1100. Best Recall: 0.0825
2026-05-16 09:02:45,121 - optuna.study.study - INFO - Trial 24 finished with value: 0.0825109649044158 and parameters: {'n_layers': 2, 'embedding_dim': 96, 'lr': 0.000352401945253291, 'lambda_val': 0.0005393637213585367, 'batch_size': 2508, 'optimizer': 'RMSprop'}. Best is trial 22 with value: 0.08834635977030823.
2026-05-16 09:02:59,698 - experiment_functions - INFO - Early stopping at epoch 2200. Best Recall: 0.0761
2026-05-16 09:02:59,798 - optuna.study.study - INFO - Trial 25 finished with value: 0.07613093623410176 and parameters: {'n_layers': 2, 'embedding_dim': 96, 'lr': 0.00025862913491883985, 'lambda_val': 1.872685327735773e-05, 'batch_size': 1992, 'optimizer': 'RMSprop'}. Best is trial 22 with value: 0.08834635977030823.
2026-05-16 09:03:04,094 - experiment_functions - INFO - Early stopping at epoch 550. Best Recall: 0.0398
2026-05-16 09:03:04,236 - optuna.study.study - INFO - Trial 26 finished with value: 0.039798862897484445 and parameters: {'n_layers': 2, 'embedding_dim': 96, 'lr': 0.0011577748473886715, 'lambda_val': 0.0005141915852935887, 'batch_size': 2524, 'optimizer': 'RMSprop'}. Best is trial 22 with value: 0.08834635977030823.
2026-05-16 09:03:11,217 - optuna.study._optimize - INFO - Trial 27 pruned. 
2026-05-16 09:03:16,622 - experiment_functions - INFO - Early stopping at epoch 600. Best Recall: 0.0724
2026-05-16 09:03:16,724 - optuna.study.study - INFO - Trial 28 finished with value: 0.07238337323644382 and parameters: {'n_layers': 2, 'embedding_dim': 256, 'lr': 0.0015370561000635013, 'lambda_val': 1.922559763338482e-05, 'batch_size': 2485, 'optimizer': 'Adam'}. Best is trial 22 with value: 0.08834635977030823.
2026-05-16 09:03:20,136 - experiment_functions - INFO - Early stopping at epoch 500. Best Recall: 0.0013
2026-05-16 09:03:20,282 - optuna.study.study - INFO - Trial 29 finished with value: 0.0012593053667870194 and parameters: {'n_layers': 2, 'embedding_dim': 96, 'lr': 0.00019442177049988282, 'lambda_val': 0.007724778644071677, 'batch_size': 3085, 'optimizer': 'SGD'}. Best is trial 22 with value: 0.08834635977030823.
2026-05-16 09:03:23,517 - experiment_functions - INFO - Early stopping at epoch 500. Best Recall: 0.0011
2026-05-16 09:03:23,619 - optuna.study.study - INFO - Trial 30 finished with value: 0.0011284294747779021 and parameters: {'n_layers': 1, 'embedding_dim': 64, 'lr': 0.0005747319126678492, 'lambda_val': 0.0007644252596642618, 'batch_size': 2405, 'optimizer': 'SGD'}. Best is trial 22 with value: 0.08834635977030823.
2026-05-16 09:03:40,207 - experiment_functions - INFO - Early stopping at epoch 3050. Best Recall: 0.0905
2026-05-16 09:03:40,310 - optuna.study.study - INFO - Trial 31 finished with value: 0.09046017977488822 and parameters: {'n_layers': 2, 'embedding_dim': 96, 'lr': 0.00022384146707253005, 'lambda_val': 3.516084216863403e-05, 'batch_size': 2033, 'optimizer': 'RMSprop'}. Best is trial 31 with value: 0.09046017977488822.
2026-05-16 09:03:49,723 - optuna.study._optimize - INFO - Trial 32 pruned. 
2026-05-16 09:03:59,417 - experiment_functions - INFO - Early stopping at epoch 550. Best Recall: 0.0494
2026-05-16 09:03:59,526 - optuna.study.study - INFO - Trial 33 finished with value: 0.04939994256613075 and parameters: {'n_layers': 2, 'embedding_dim': 96, 'lr': 0.0015479275774487884, 'lambda_val': 7.895254531350664e-06, 'batch_size': 2113, 'optimizer': 'RMSprop'}. Best is trial 31 with value: 0.09046017977488822.
2026-05-16 09:04:05,980 - optuna.study._optimize - INFO - Trial 34 pruned. 
2026-05-16 09:04:12,734 - experiment_functions - INFO - Early stopping at epoch 1100. Best Recall: 0.0721
2026-05-16 09:04:12,870 - optuna.study.study - INFO - Trial 35 finished with value: 0.07209896699115734 and parameters: {'n_layers': 2, 'embedding_dim': 96, 'lr': 0.0005632474642672613, 'lambda_val': 3.271964531592443e-05, 'batch_size': 1630, 'optimizer': 'RMSprop'}. Best is trial 31 with value: 0.09046017977488822.
2026-05-16 09:04:19,119 - optuna.study._optimize - INFO - Trial 36 pruned. 
2026-05-16 09:04:28,011 - optuna.study._optimize - INFO - Trial 37 pruned. 
2026-05-16 09:04:51,441 - optuna.study.study - INFO - Trial 38 finished with value: 0.09760672907784455 and parameters: {'n_layers': 1, 'embedding_dim': 32, 'lr': 0.00036422772651843, 'lambda_val': 0.00019538566475027676, 'batch_size': 2648, 'optimizer': 'RMSprop'}. Best is trial 38 with value: 0.09760672907784455.
2026-05-16 09:04:55,029 - experiment_functions - INFO - Early stopping at epoch 500. Best Recall: 0.0018
2026-05-16 09:04:55,141 - optuna.study.study - INFO - Trial 39 finished with value: 0.001820626752355802 and parameters: {'n_layers': 1, 'embedding_dim': 32, 'lr': 0.000702483251815725, 'lambda_val': 0.0001405858908222001, 'batch_size': 861, 'optimizer': 'SGD'}. Best is trial 38 with value: 0.09760672907784455.
2026-05-16 09:05:01,221 - experiment_functions - INFO - Early stopping at epoch 1000. Best Recall: 0.1240
2026-05-16 09:05:01,333 - optuna.study.study - INFO - Trial 40 finished with value: 0.12403423764393041 and parameters: {'n_layers': 1, 'embedding_dim': 32, 'lr': 0.001603408409785646, 'lambda_val': 0.00010483069562667009, 'batch_size': 1851, 'optimizer': 'Adam'}. Best is trial 40 with value: 0.12403423764393041.
2026-05-16 09:05:07,626 - experiment_functions - INFO - Early stopping at epoch 900. Best Recall: 0.0862
2026-05-16 09:05:07,717 - optuna.study.study - INFO - Trial 41 finished with value: 0.08620259440876864 and parameters: {'n_layers': 1, 'embedding_dim': 32, 'lr': 0.001618264190849869, 'lambda_val': 3.199257834799275e-05, 'batch_size': 1876, 'optimizer': 'Adam'}. Best is trial 40 with value: 0.12403423764393041.
2026-05-16 09:05:13,265 - experiment_functions - INFO - Early stopping at epoch 950. Best Recall: 0.1105
2026-05-16 09:05:13,367 - optuna.study.study - INFO - Trial 42 finished with value: 0.11052382335122932 and parameters: {'n_layers': 1, 'embedding_dim': 32, 'lr': 0.0012062089476281633, 'lambda_val': 2.9691835304398774e-05, 'batch_size': 1875, 'optimizer': 'Adam'}. Best is trial 40 with value: 0.12403423764393041.
2026-05-16 09:05:20,191 - experiment_functions - INFO - Early stopping at epoch 1200. Best Recall: 0.0926
2026-05-16 09:05:20,302 - optuna.study.study - INFO - Trial 43 finished with value: 0.09256474408209141 and parameters: {'n_layers': 1, 'embedding_dim': 32, 'lr': 0.0010242384842183132, 'lambda_val': 9.184193665613174e-05, 'batch_size': 2054, 'optimizer': 'Adam'}. Best is trial 40 with value: 0.12403423764393041.
2026-05-16 09:05:26,884 - optuna.study._optimize - INFO - Trial 44 pruned. 
2026-05-16 09:05:34,151 - experiment_functions - INFO - Early stopping at epoch 1250. Best Recall: 0.0904
2026-05-16 09:05:34,241 - optuna.study.study - INFO - Trial 45 finished with value: 0.09043164480056116 and parameters: {'n_layers': 1, 'embedding_dim': 32, 'lr': 0.0009350776182666866, 'lambda_val': 1.6402580933592267e-05, 'batch_size': 2041, 'optimizer': 'Adam'}. Best is trial 40 with value: 0.12403423764393041.
2026-05-16 09:05:40,225 - optuna.study._optimize - INFO - Trial 46 pruned. 
2026-05-16 09:06:05,017 - optuna.study.study - INFO - Trial 47 finished with value: 0.11396751068883423 and parameters: {'n_layers': 1, 'embedding_dim': 32, 'lr': 0.000507805386175197, 'lambda_val': 0.00010608652254924929, 'batch_size': 1182, 'optimizer': 'Adam'}. Best is trial 40 with value: 0.12403423764393041.
2026-05-16 09:06:22,532 - experiment_functions - INFO - Early stopping at epoch 3450. Best Recall: 0.1020
2026-05-16 09:06:22,633 - optuna.study.study - INFO - Trial 48 finished with value: 0.10199348747194979 and parameters: {'n_layers': 1, 'embedding_dim': 32, 'lr': 0.0004853712394857225, 'lambda_val': 9.976312621086267e-05, 'batch_size': 911, 'optimizer': 'Adam'}. Best is trial 40 with value: 0.12403423764393041.
2026-05-16 09:06:37,093 - optuna.study._optimize - INFO - Trial 49 pruned. 
2026-05-16 09:06:43,572 - optuna.study._optimize - INFO - Trial 50 pruned. 
2026-05-16 09:06:56,403 - experiment_functions - INFO - Early stopping at epoch 1950. Best Recall: 0.1122
2026-05-16 09:06:56,493 - optuna.study.study - INFO - Trial 51 finished with value: 0.11219140830928942 and parameters: {'n_layers': 1, 'embedding_dim': 32, 'lr': 0.0007614972685555851, 'lambda_val': 8.698450936288657e-05, 'batch_size': 1077, 'optimizer': 'Adam'}. Best is trial 40 with value: 0.12403423764393041.
2026-05-16 09:07:14,189 - experiment_functions - INFO - Early stopping at epoch 3350. Best Recall: 0.1193
2026-05-16 09:07:14,300 - optuna.study.study - INFO - Trial 52 finished with value: 0.11930035460489127 and parameters: {'n_layers': 1, 'embedding_dim': 32, 'lr': 0.0007237345480274844, 'lambda_val': 8.921180955699517e-05, 'batch_size': 1063, 'optimizer': 'Adam'}. Best is trial 40 with value: 0.12403423764393041.
2026-05-16 09:07:22,599 - experiment_functions - INFO - Early stopping at epoch 1500. Best Recall: 0.1043
2026-05-16 09:07:22,691 - optuna.study.study - INFO - Trial 53 finished with value: 0.1042560955211765 and parameters: {'n_layers': 1, 'embedding_dim': 32, 'lr': 0.0007794826713031877, 'lambda_val': 8.588871569175665e-05, 'batch_size': 1028, 'optimizer': 'Adam'}. Best is trial 40 with value: 0.12403423764393041.
2026-05-16 09:07:36,224 - experiment_functions - INFO - Early stopping at epoch 2450. Best Recall: 0.1055
2026-05-16 09:07:36,336 - optuna.study.study - INFO - Trial 54 finished with value: 0.1055280459497301 and parameters: {'n_layers': 1, 'embedding_dim': 32, 'lr': 0.000740529273248232, 'lambda_val': 5.239541716047864e-05, 'batch_size': 1102, 'optimizer': 'Adam'}. Best is trial 40 with value: 0.12403423764393041.
2026-05-16 09:07:47,180 - experiment_functions - INFO - Early stopping at epoch 1350. Best Recall: 0.1081
2026-05-16 09:07:47,290 - optuna.study.study - INFO - Trial 55 finished with value: 0.108119170384209 and parameters: {'n_layers': 1, 'embedding_dim': 32, 'lr': 0.0012728530778713138, 'lambda_val': 4.9356718439179004e-05, 'batch_size': 1335, 'optimizer': 'Adam'}. Best is trial 40 with value: 0.12403423764393041.
2026-05-16 09:07:51,375 - experiment_functions - INFO - Early stopping at epoch 600. Best Recall: 0.0723
2026-05-16 09:07:51,466 - optuna.study.study - INFO - Trial 56 finished with value: 0.07233626662995213 and parameters: {'n_layers': 1, 'embedding_dim': 32, 'lr': 0.004076427403547035, 'lambda_val': 4.987437304968972e-06, 'batch_size': 1467, 'optimizer': 'Adam'}. Best is trial 40 with value: 0.12403423764393041.
2026-05-16 09:07:56,181 - experiment_functions - INFO - Early stopping at epoch 800. Best Recall: 0.0915
2026-05-16 09:07:56,272 - optuna.study.study - INFO - Trial 57 finished with value: 0.09146925382395384 and parameters: {'n_layers': 1, 'embedding_dim': 32, 'lr': 0.0022394658097781724, 'lambda_val': 1.381340598133632e-05, 'batch_size': 1279, 'optimizer': 'Adam'}. Best is trial 40 with value: 0.12403423764393041.
2026-05-16 09:08:01,698 - experiment_functions - INFO - Early stopping at epoch 850. Best Recall: 0.0943
2026-05-16 09:08:01,788 - optuna.study.study - INFO - Trial 58 finished with value: 0.09428595551495249 and parameters: {'n_layers': 1, 'embedding_dim': 32, 'lr': 0.0023757862380799173, 'lambda_val': 4.7184200137615344e-05, 'batch_size': 1309, 'optimizer': 'Adam'}. Best is trial 40 with value: 0.12403423764393041.
2026-05-16 09:08:05,488 - experiment_functions - INFO - Early stopping at epoch 550. Best Recall: 0.0734
2026-05-16 09:08:05,579 - optuna.study.study - INFO - Trial 59 finished with value: 0.07344913099278438 and parameters: {'n_layers': 1, 'embedding_dim': 64, 'lr': 0.012475479405266188, 'lambda_val': 2.0635180117924093e-05, 'batch_size': 678, 'optimizer': 'Adam'}. Best is trial 40 with value: 0.12403423764393041.
2026-05-16 09:08:10,745 - experiment_functions - INFO - Early stopping at epoch 750. Best Recall: 0.0457
2026-05-16 09:08:10,836 - optuna.study.study - INFO - Trial 60 finished with value: 0.04569243998595992 and parameters: {'n_layers': 4, 'embedding_dim': 32, 'lr': 0.0012315433844664828, 'lambda_val': 1.1734004708608601e-05, 'batch_size': 842, 'optimizer': 'Adam'}. Best is trial 40 with value: 0.12403423764393041.
2026-05-16 09:08:35,553 - optuna.study.study - INFO - Trial 61 finished with value: 0.1139743439462839 and parameters: {'n_layers': 1, 'embedding_dim': 32, 'lr': 0.0007716650795112964, 'lambda_val': 6.081935493848929e-05, 'batch_size': 1083, 'optimizer': 'Adam'}. Best is trial 40 with value: 0.12403423764393041.
2026-05-16 09:08:42,041 - experiment_functions - INFO - Early stopping at epoch 1100. Best Recall: 0.1016
2026-05-16 09:08:42,132 - optuna.study.study - INFO - Trial 62 finished with value: 0.10157266300632789 and parameters: {'n_layers': 1, 'embedding_dim': 32, 'lr': 0.00127892345443504, 'lambda_val': 2.458871360140153e-05, 'batch_size': 1014, 'optimizer': 'Adam'}. Best is trial 40 with value: 0.12403423764393041.
2026-05-16 09:08:57,755 - experiment_functions - INFO - Early stopping at epoch 2500. Best Recall: 0.1061
2026-05-16 09:08:57,855 - optuna.study.study - INFO - Trial 63 finished with value: 0.10606325309539312 and parameters: {'n_layers': 1, 'embedding_dim': 32, 'lr': 0.0007020551192266796, 'lambda_val': 5.5616485025229375e-05, 'batch_size': 1350, 'optimizer': 'Adam'}. Best is trial 40 with value: 0.12403423764393041.
2026-05-16 09:09:01,824 - experiment_functions - INFO - Early stopping at epoch 600. Best Recall: 0.0898
2026-05-16 09:09:01,934 - optuna.study.study - INFO - Trial 64 finished with value: 0.08982717988178231 and parameters: {'n_layers': 1, 'embedding_dim': 32, 'lr': 0.005613544214666997, 'lambda_val': 0.00012785992700428602, 'batch_size': 1138, 'optimizer': 'Adam'}. Best is trial 40 with value: 0.12403423764393041.
2026-05-16 09:09:06,926 - experiment_functions - INFO - Early stopping at epoch 800. Best Recall: 0.0813
2026-05-16 09:09:07,017 - optuna.study.study - INFO - Trial 65 finished with value: 0.08134099614565432 and parameters: {'n_layers': 1, 'embedding_dim': 32, 'lr': 0.0027748791191920335, 'lambda_val': 7.087465896739114e-05, 'batch_size': 1607, 'optimizer': 'Adam'}. Best is trial 40 with value: 0.12403423764393041.
2026-05-16 09:09:17,666 - experiment_functions - INFO - Early stopping at epoch 1900. Best Recall: 0.1125
2026-05-16 09:09:17,766 - optuna.study.study - INFO - Trial 66 finished with value: 0.1124931823388261 and parameters: {'n_layers': 1, 'embedding_dim': 128, 'lr': 0.0009546446533160126, 'lambda_val': 0.0002159039319107036, 'batch_size': 724, 'optimizer': 'Adam'}. Best is trial 40 with value: 0.12403423764393041.
2026-05-16 09:09:28,761 - experiment_functions - INFO - Early stopping at epoch 1500. Best Recall: 0.1101
2026-05-16 09:09:28,939 - optuna.study.study - INFO - Trial 67 finished with value: 0.1101105908527479 and parameters: {'n_layers': 1, 'embedding_dim': 128, 'lr': 0.0009416354090344111, 'lambda_val': 0.00023611473816317237, 'batch_size': 763, 'optimizer': 'Adam'}. Best is trial 40 with value: 0.12403423764393041.
2026-05-16 09:09:35,650 - optuna.study._optimize - INFO - Trial 68 pruned. 
2026-05-16 09:09:39,418 - experiment_functions - INFO - Early stopping at epoch 550. Best Recall: 0.0151
2026-05-16 09:09:39,508 - optuna.study.study - INFO - Trial 69 finished with value: 0.015118997196313344 and parameters: {'n_layers': 1, 'embedding_dim': 128, 'lr': 0.0935234549737631, 'lambda_val': 0.00013499669094712638, 'batch_size': 638, 'optimizer': 'Adam'}. Best is trial 40 with value: 0.12403423764393041.
2026-05-16 09:10:05,149 - experiment_functions - INFO - Early stopping at epoch 3800. Best Recall: 0.1187
2026-05-16 09:10:05,258 - optuna.study.study - INFO - Trial 70 finished with value: 0.11871052673262344 and parameters: {'n_layers': 1, 'embedding_dim': 256, 'lr': 0.0004553639653227462, 'lambda_val': 0.0003391211203438224, 'batch_size': 1194, 'optimizer': 'Adam'}. Best is trial 40 with value: 0.12403423764393041.
2026-05-16 09:10:25,219 - experiment_functions - INFO - Early stopping at epoch 2400. Best Recall: 0.1281
2026-05-16 09:10:25,312 - optuna.study.study - INFO - Trial 71 finished with value: 0.12805617639171865 and parameters: {'n_layers': 1, 'embedding_dim': 256, 'lr': 0.00047989527841790607, 'lambda_val': 0.0012251179439050242, 'batch_size': 1176, 'optimizer': 'Adam'}. Best is trial 71 with value: 0.12805617639171865.
2026-05-16 09:10:31,993 - optuna.study._optimize - INFO - Trial 72 pruned. 
2026-05-16 09:10:56,768 - optuna.study.study - INFO - Trial 73 finished with value: 0.12924957455686556 and parameters: {'n_layers': 1, 'embedding_dim': 256, 'lr': 0.0005199397986025746, 'lambda_val': 0.0013257050974701857, 'batch_size': 525, 'optimizer': 'Adam'}. Best is trial 73 with value: 0.12924957455686556.
2026-05-16 09:11:20,829 - optuna.study.study - INFO - Trial 74 finished with value: 0.12611165559232174 and parameters: {'n_layers': 1, 'embedding_dim': 256, 'lr': 0.0005436780631537433, 'lambda_val': 0.001258039681937043, 'batch_size': 597, 'optimizer': 'Adam'}. Best is trial 73 with value: 0.12924957455686556.
2026-05-16 09:11:34,620 - experiment_functions - INFO - Early stopping at epoch 2250. Best Recall: 0.1228
