2026-05-16 05:04:48,304 - optuna.study._optimize - INFO - Trial 184 pruned. 
2026-05-16 05:05:01,634 - optuna.study._optimize - INFO - Trial 185 pruned. 
2026-05-16 05:05:11,320 - experiment_functions - INFO - Early stopping at epoch 1500. Best Recall: 0.1223
2026-05-16 05:05:11,431 - optuna.study.study - INFO - Trial 186 finished with value: 0.1223371098963409 and parameters: {'n_layers': 1, 'embedding_dim': 256, 'lr': 0.0005652178882802593, 'lambda_val': 3.765783620065766e-05, 'batch_size': 691, 'optimizer': 'RMSprop'}. Best is trial 183 with value: 0.13724864888274418.
2026-05-16 05:05:19,688 - optuna.study._optimize - INFO - Trial 187 pruned. 
2026-05-16 05:05:29,904 - experiment_functions - INFO - Early stopping at epoch 1250. Best Recall: 0.1226
2026-05-16 05:05:30,038 - optuna.study.study - INFO - Trial 188 finished with value: 0.12263546212726648 and parameters: {'n_layers': 1, 'embedding_dim': 256, 'lr': 0.0004811525651085167, 'lambda_val': 3.796405043644943e-05, 'batch_size': 3260, 'optimizer': 'RMSprop'}. Best is trial 183 with value: 0.13724864888274418.
2026-05-16 05:05:39,978 - experiment_functions - INFO - Early stopping at epoch 1550. Best Recall: 0.1255
2026-05-16 05:05:40,099 - optuna.study.study - INFO - Trial 189 finished with value: 0.12547756637803126 and parameters: {'n_layers': 1, 'embedding_dim': 256, 'lr': 0.00046144987194611775, 'lambda_val': 1.8662256286687194e-05, 'batch_size': 2562, 'optimizer': 'RMSprop'}. Best is trial 183 with value: 0.13724864888274418.
2026-05-16 05:05:48,217 - optuna.study._optimize - INFO - Trial 190 pruned. 
2026-05-16 05:05:56,116 - optuna.study._optimize - INFO - Trial 191 pruned. 
2026-05-16 05:06:03,677 - optuna.study._optimize - INFO - Trial 192 pruned. 
2026-05-16 05:06:11,035 - experiment_functions - INFO - Early stopping at epoch 1100. Best Recall: 0.1231
2026-05-16 05:06:11,125 - optuna.study.study - INFO - Trial 193 finished with value: 0.12310647074203612 and parameters: {'n_layers': 1, 'embedding_dim': 256, 'lr': 0.0005028785968799409, 'lambda_val': 2.7929275469994214e-05, 'batch_size': 3371, 'optimizer': 'RMSprop'}. Best is trial 183 with value: 0.13724864888274418.
2026-05-16 05:06:18,063 - experiment_functions - INFO - Early stopping at epoch 1100. Best Recall: 0.1254
2026-05-16 05:06:18,154 - optuna.study.study - INFO - Trial 194 finished with value: 0.1254396256049911 and parameters: {'n_layers': 1, 'embedding_dim': 256, 'lr': 0.0005053638228023462, 'lambda_val': 2.52071242365321e-05, 'batch_size': 3312, 'optimizer': 'RMSprop'}. Best is trial 183 with value: 0.13724864888274418.
2026-05-16 05:06:27,173 - experiment_functions - INFO - Early stopping at epoch 950. Best Recall: 0.1018
2026-05-16 05:06:27,274 - optuna.study.study - INFO - Trial 195 finished with value: 0.10179747720642757 and parameters: {'n_layers': 1, 'embedding_dim': 256, 'lr': 0.0004736195174916614, 'lambda_val': 2.484899323959235e-05, 'batch_size': 3383, 'optimizer': 'RMSprop'}. Best is trial 183 with value: 0.13724864888274418.
2026-05-16 05:06:33,844 - optuna.study._optimize - INFO - Trial 196 pruned. 
2026-05-16 05:06:41,305 - optuna.study._optimize - INFO - Trial 197 pruned. 
2026-05-16 05:06:48,085 - optuna.study._optimize - INFO - Trial 198 pruned. 
2026-05-16 05:06:54,943 - optuna.study._optimize - INFO - Trial 199 pruned. 
2026-05-16 05:07:01,051 - experiment_functions - INFO - Early stopping at epoch 600. Best Recall: 0.0443
2026-05-16 05:07:01,141 - optuna.study.study - INFO - Trial 200 finished with value: 0.044269600589577573 and parameters: {'n_layers': 3, 'embedding_dim': 256, 'lr': 0.0007018180065804313, 'lambda_val': 1.5316840312326467e-05, 'batch_size': 2510, 'optimizer': 'RMSprop'}. Best is trial 183 with value: 0.13724864888274418.
2026-05-16 05:07:07,312 - experiment_functions - INFO - Early stopping at epoch 900. Best Recall: 0.1179
2026-05-16 05:07:07,413 - optuna.study.study - INFO - Trial 201 finished with value: 0.11785384392418057 and parameters: {'n_layers': 1, 'embedding_dim': 256, 'lr': 0.0005502482488700593, 'lambda_val': 3.9579223897953836e-05, 'batch_size': 3139, 'optimizer': 'RMSprop'}. Best is trial 183 with value: 0.13724864888274418.
2026-05-16 05:07:14,103 - optuna.study._optimize - INFO - Trial 202 pruned. 
2026-05-16 05:07:21,539 - optuna.study._optimize - INFO - Trial 203 pruned. 
2026-05-16 05:07:26,881 - experiment_functions - INFO - Early stopping at epoch 800. Best Recall: 0.1097
2026-05-16 05:07:26,972 - optuna.study.study - INFO - Trial 204 finished with value: 0.10972009822314106 and parameters: {'n_layers': 1, 'embedding_dim': 256, 'lr': 0.0007852473491208888, 'lambda_val': 2.6602606293302053e-05, 'batch_size': 2926, 'optimizer': 'RMSprop'}. Best is trial 183 with value: 0.13724864888274418.
2026-05-16 05:07:34,115 - optuna.study._optimize - INFO - Trial 205 pruned. 
2026-05-16 05:07:41,138 - optuna.study._optimize - INFO - Trial 206 pruned. 
2026-05-16 05:07:47,720 - optuna.study._optimize - INFO - Trial 207 pruned. 
2026-05-16 05:07:57,082 - optuna.study._optimize - INFO - Trial 208 pruned. 
2026-05-16 05:08:03,039 - experiment_functions - INFO - Early stopping at epoch 850. Best Recall: 0.1050
2026-05-16 05:08:03,130 - optuna.study.study - INFO - Trial 209 finished with value: 0.10500622981571718 and parameters: {'n_layers': 1, 'embedding_dim': 256, 'lr': 0.0006424173288078261, 'lambda_val': 6.234145855628033e-05, 'batch_size': 3186, 'optimizer': 'RMSprop'}. Best is trial 183 with value: 0.13724864888274418.
2026-05-16 05:08:07,956 - experiment_functions - INFO - Early stopping at epoch 700. Best Recall: 0.1046
2026-05-16 05:08:08,058 - optuna.study.study - INFO - Trial 210 finished with value: 0.10462106341131486 and parameters: {'n_layers': 1, 'embedding_dim': 256, 'lr': 0.0008979494886116984, 'lambda_val': 0.0002919454845689592, 'batch_size': 3232, 'optimizer': 'RMSprop'}. Best is trial 183 with value: 0.13724864888274418.
2026-05-16 05:08:14,471 - optuna.study._optimize - INFO - Trial 211 pruned. 
2026-05-16 05:08:21,078 - optuna.study._optimize - INFO - Trial 212 pruned. 
2026-05-16 05:08:26,900 - optuna.study._optimize - INFO - Trial 213 pruned. 
2026-05-16 05:08:32,351 - experiment_functions - INFO - Early stopping at epoch 750. Best Recall: 0.1047
2026-05-16 05:08:32,441 - optuna.study.study - INFO - Trial 214 finished with value: 0.10473438434954005 and parameters: {'n_layers': 1, 'embedding_dim': 256, 'lr': 0.0009525439531606995, 'lambda_val': 8.08931080980237e-06, 'batch_size': 2271, 'optimizer': 'RMSprop'}. Best is trial 183 with value: 0.13724864888274418.
2026-05-16 05:08:35,630 - experiment_functions - INFO - Early stopping at epoch 500. Best Recall: 0.0022
2026-05-16 05:08:35,733 - optuna.study.study - INFO - Trial 215 finished with value: 0.002223180941619226 and parameters: {'n_layers': 1, 'embedding_dim': 128, 'lr': 0.0007568730920561394, 'lambda_val': 5.957672562803371e-06, 'batch_size': 591, 'optimizer': 'SGD'}. Best is trial 183 with value: 0.13724864888274418.
2026-05-16 05:08:53,964 - experiment_functions - INFO - Early stopping at epoch 3050. Best Recall: 0.1344
2026-05-16 05:08:54,042 - optuna.study.study - INFO - Trial 216 finished with value: 0.13435623903340674 and parameters: {'n_layers': 1, 'embedding_dim': 256, 'lr': 0.000510720827366744, 'lambda_val': 2.126393021326242e-05, 'batch_size': 764, 'optimizer': 'RMSprop'}. Best is trial 183 with value: 0.13724864888274418.
2026-05-16 05:09:00,457 - optuna.study._optimize - INFO - Trial 217 pruned. 
2026-05-16 05:09:15,682 - optuna.study._optimize - INFO - Trial 218 pruned. 
2026-05-16 05:09:22,594 - optuna.study._optimize - INFO - Trial 219 pruned. 
2026-05-16 05:09:28,829 - experiment_functions - INFO - Early stopping at epoch 950. Best Recall: 0.1176
2026-05-16 05:09:28,909 - optuna.study.study - INFO - Trial 220 finished with value: 0.11763805081686166 and parameters: {'n_layers': 1, 'embedding_dim': 256, 'lr': 0.0006017645446153774, 'lambda_val': 3.3600473902819e-05, 'batch_size': 3373, 'optimizer': 'RMSprop'}. Best is trial 183 with value: 0.13724864888274418.
2026-05-16 05:09:35,421 - optuna.study._optimize - INFO - Trial 221 pruned. 
2026-05-16 05:09:40,171 - experiment_functions - INFO - Early stopping at epoch 700. Best Recall: 0.0767
2026-05-16 05:09:40,307 - optuna.study.study - INFO - Trial 222 finished with value: 0.07669894583662759 and parameters: {'n_layers': 1, 'embedding_dim': 128, 'lr': 0.0009462684525041317, 'lambda_val': 0.01044715844850434, 'batch_size': 710, 'optimizer': 'RMSprop'}. Best is trial 183 with value: 0.13724864888274418.
2026-05-16 05:09:47,894 - optuna.study._optimize - INFO - Trial 223 pruned. 
2026-05-16 05:09:54,154 - optuna.study._optimize - INFO - Trial 224 pruned. 
2026-05-16 05:09:59,810 - experiment_functions - INFO - Early stopping at epoch 800. Best Recall: 0.1070
2026-05-16 05:09:59,921 - optuna.study.study - INFO - Trial 225 finished with value: 0.10696849488586613 and parameters: {'n_layers': 1, 'embedding_dim': 256, 'lr': 0.0011192505417461566, 'lambda_val': 2.7423937446014493e-05, 'batch_size': 3560, 'optimizer': 'Adam'}. Best is trial 183 with value: 0.13724864888274418.
2026-05-16 05:10:06,455 - optuna.study._optimize - INFO - Trial 226 pruned. 
2026-05-16 05:10:13,257 - optuna.study._optimize - INFO - Trial 227 pruned. 
2026-05-16 05:10:30,420 - experiment_functions - INFO - Early stopping at epoch 2900. Best Recall: 0.1310
2026-05-16 05:10:30,510 - optuna.study.study - INFO - Trial 228 finished with value: 0.13098400171771835 and parameters: {'n_layers': 1, 'embedding_dim': 256, 'lr': 0.0004845062493624259, 'lambda_val': 6.464897094839299e-06, 'batch_size': 805, 'optimizer': 'RMSprop'}. Best is trial 183 with value: 0.13724864888274418.
2026-05-16 05:10:40,897 - optuna.study._optimize - INFO - Trial 229 pruned. 
2026-05-16 05:10:47,479 - optuna.study._optimize - INFO - Trial 230 pruned. 
2026-05-16 05:10:56,065 - optuna.study._optimize - INFO - Trial 231 pruned. 
2026-05-16 05:11:02,469 - optuna.study._optimize - INFO - Trial 232 pruned. 
2026-05-16 05:11:08,829 - optuna.study._optimize - INFO - Trial 233 pruned. 
2026-05-16 05:11:14,934 - optuna.study._optimize - INFO - Trial 234 pruned. 
2026-05-16 05:11:21,485 - optuna.study._optimize - INFO - Trial 235 pruned. 
2026-05-16 05:11:30,067 - optuna.study._optimize - INFO - Trial 236 pruned. 
2026-05-16 05:11:35,988 - optuna.study._optimize - INFO - Trial 237 pruned. 
2026-05-16 05:11:47,337 - optuna.study._optimize - INFO - Trial 238 pruned. 
2026-05-16 05:11:50,938 - experiment_functions - INFO - Early stopping at epoch 500. Best Recall: 0.0014
2026-05-16 05:11:51,018 - optuna.study.study - INFO - Trial 239 finished with value: 0.0013741118630701578 and parameters: {'n_layers': 1, 'embedding_dim': 256, 'lr': 1.0332679319053987e-05, 'lambda_val': 1.5339020885203533e-05, 'batch_size': 811, 'optimizer': 'Adam'}. Best is trial 183 with value: 0.13724864888274418.
2026-05-16 05:11:55,838 - experiment_functions - INFO - Early stopping at epoch 800. Best Recall: 0.0949
2026-05-16 05:11:55,930 - optuna.study.study - INFO - Trial 240 finished with value: 0.09486218007869546 and parameters: {'n_layers': 1, 'embedding_dim': 64, 'lr': 0.0010641588910156932, 'lambda_val': 2.955458873753012e-05, 'batch_size': 3277, 'optimizer': 'RMSprop'}. Best is trial 183 with value: 0.13724864888274418.
2026-05-16 05:12:02,246 - optuna.study._optimize - INFO - Trial 241 pruned. 
2026-05-16 05:12:08,883 - optuna.study._optimize - INFO - Trial 242 pruned. 
2026-05-16 05:12:14,968 - optuna.study._optimize - INFO - Trial 243 pruned. 
2026-05-16 05:12:21,524 - optuna.study._optimize - INFO - Trial 244 pruned. 
2026-05-16 05:12:35,699 - experiment_functions - INFO - Early stopping at epoch 2350. Best Recall: 0.1327
2026-05-16 05:12:35,779 - optuna.study.study - INFO - Trial 245 finished with value: 0.13267627712782296 and parameters: {'n_layers': 1, 'embedding_dim': 256, 'lr': 0.0004950598094157474, 'lambda_val': 3.068138074591549e-05, 'batch_size': 911, 'optimizer': 'Adam'}. Best is trial 183 with value: 0.13724864888274418.
2026-05-16 05:12:39,631 - experiment_functions - INFO - Early stopping at epoch 500. Best Recall: 0.0016
2026-05-16 05:12:39,720 - optuna.study.study - INFO - Trial 246 finished with value: 0.0015516447237648506 and parameters: {'n_layers': 1, 'embedding_dim': 256, 'lr': 0.0004611038714953714, 'lambda_val': 2.54367208743106e-05, 'batch_size': 975, 'optimizer': 'SGD'}. Best is trial 183 with value: 0.13724864888274418.
2026-05-16 05:12:46,215 - optuna.study._optimize - INFO - Trial 247 pruned. 
2026-05-16 05:12:56,115 - optuna.study._optimize - INFO - Trial 248 pruned. 
2026-05-16 05:13:03,050 - optuna.study._optimize - INFO - Trial 249 pruned. 
2026-05-16 05:13:13,415 - optuna.study._optimize - INFO - Trial 250 pruned. 
2026-05-16 05:13:24,471 - optuna.study._optimize - INFO - Trial 251 pruned. 
2026-05-16 05:13:30,657 - optuna.study._optimize - INFO - Trial 252 pruned. 
2026-05-16 05:13:37,382 - optuna.study._optimize - INFO - Trial 253 pruned. 
2026-05-16 05:13:43,486 - optuna.study._optimize - INFO - Trial 254 pruned. 
2026-05-16 05:13:52,401 - optuna.study._optimize - INFO - Trial 255 pruned. 
2026-05-16 05:13:58,525 - optuna.study._optimize - INFO - Trial 256 pruned. 
2026-05-16 05:14:05,116 - experiment_functions - INFO - Early stopping at epoch 650. Best Recall: 0.0236
2026-05-16 05:14:05,237 - optuna.study.study - INFO - Trial 257 finished with value: 0.02358494048774452 and parameters: {'n_layers': 4, 'embedding_dim': 256, 'lr': 0.001059168217969865, 'lambda_val': 0.0004656108433522238, 'batch_size': 2645, 'optimizer': 'RMSprop'}. Best is trial 183 with value: 0.13724864888274418.
2026-05-16 05:14:14,274 - optuna.study._optimize - INFO - Trial 258 pruned. 
2026-05-16 05:14:21,493 - optuna.study._optimize - INFO - Trial 259 pruned. 
2026-05-16 05:14:27,791 - optuna.study._optimize - INFO - Trial 260 pruned. 
2026-05-16 05:14:34,569 - optuna.study._optimize - INFO - Trial 261 pruned. 
2026-05-16 05:14:41,036 - optuna.study._optimize - INFO - Trial 262 pruned. 
2026-05-16 05:14:47,815 - optuna.study._optimize - INFO - Trial 263 pruned. 
2026-05-16 05:14:53,652 - experiment_functions - INFO - Early stopping at epoch 900. Best Recall: 0.1156
2026-05-16 05:14:53,775 - optuna.study.study - INFO - Trial 264 finished with value: 0.1156242077190122 and parameters: {'n_layers': 1, 'embedding_dim': 128, 'lr': 0.0011673935059170024, 'lambda_val': 2.546752439477375e-05, 'batch_size': 2818, 'optimizer': 'Adam'}. Best is trial 183 with value: 0.13724864888274418.
2026-05-16 05:15:00,419 - optuna.study._optimize - INFO - Trial 265 pruned. 
2026-05-16 05:15:07,663 - optuna.study._optimize - INFO - Trial 266 pruned. 
2026-05-16 05:15:14,093 - optuna.study._optimize - INFO - Trial 267 pruned. 
2026-05-16 05:15:17,276 - experiment_functions - INFO - Early stopping at epoch 500. Best Recall: 0.0011
2026-05-16 05:15:17,378 - optuna.study.study - INFO - Trial 268 finished with value: 0.0011265604730273425 and parameters: {'n_layers': 1, 'embedding_dim': 64, 'lr': 0.00071678700357523, 'lambda_val': 3.1535330873230956e-05, 'batch_size': 800, 'optimizer': 'SGD'}. Best is trial 183 with value: 0.13724864888274418.
2026-05-16 05:15:23,623 - optuna.study._optimize - INFO - Trial 269 pruned. 
2026-05-16 05:15:33,095 - optuna.study._optimize - INFO - Trial 270 pruned. 
2026-05-16 05:15:39,463 - optuna.study._optimize - INFO - Trial 271 pruned. 
2026-05-16 05:15:45,372 - optuna.study._optimize - INFO - Trial 272 pruned. 
2026-05-16 05:15:52,711 - experiment_functions - INFO - Early stopping at epoch 1100. Best Recall: 0.1186
2026-05-16 05:15:52,835 - optuna.study.study - INFO - Trial 273 finished with value: 0.11857069147369799 and parameters: {'n_layers': 1, 'embedding_dim': 256, 'lr': 0.0012651323093154367, 'lambda_val': 4.231727397085716e-06, 'batch_size': 756, 'optimizer': 'Adam'}. Best is trial 183 with value: 0.13724864888274418.
2026-05-16 05:15:57,698 - experiment_functions - INFO - Early stopping at epoch 800. Best Recall: 0.0601
2026-05-16 05:15:57,799 - optuna.study.study - INFO - Trial 274 finished with value: 0.06005781177183999 and parameters: {'n_layers': 1, 'embedding_dim': 128, 'lr': 0.005525953664216702, 'lambda_val': 2.760962876951216e-05, 'batch_size': 686, 'optimizer': 'RMSprop'}. Best is trial 183 with value: 0.13724864888274418.
2026-05-16 05:16:05,108 - optuna.study._optimize - INFO - Trial 275 pruned. 
2026-05-16 05:16:12,215 - optuna.study._optimize - INFO - Trial 276 pruned. 
2026-05-16 05:16:20,825 - optuna.study._optimize - INFO - Trial 277 pruned. 
2026-05-16 05:16:28,077 - optuna.study._optimize - INFO - Trial 278 pruned. 
2026-05-16 05:16:33,609 - optuna.study._optimize - INFO - Trial 279 pruned. 
2026-05-16 05:16:40,300 - optuna.study._optimize - INFO - Trial 280 pruned. 
2026-05-16 05:16:46,485 - optuna.study._optimize - INFO - Trial 281 pruned. 
2026-05-16 05:16:54,894 - optuna.study._optimize - INFO - Trial 282 pruned. 
2026-05-16 05:16:59,839 - experiment_functions - INFO - Early stopping at epoch 650. Best Recall: 0.0515
2026-05-16 05:16:59,918 - optuna.study.study - INFO - Trial 283 finished with value: 0.051495245371224185 and parameters: {'n_layers': 2, 'embedding_dim': 256, 'lr': 0.0010391688870651067, 'lambda_val': 2.209400707993738e-05, 'batch_size': 912, 'optimizer': 'RMSprop'}. Best is trial 183 with value: 0.13724864888274418.
2026-05-16 05:17:05,914 - optuna.study._optimize - INFO - Trial 284 pruned. 
2026-05-16 05:17:14,748 - optuna.study._optimize - INFO - Trial 285 pruned. 
2026-05-16 05:17:21,697 - optuna.study._optimize - INFO - Trial 286 pruned. 
2026-05-16 05:17:27,039 - experiment_functions - INFO - Early stopping at epoch 750. Best Recall: 0.0961
2026-05-16 05:17:27,384 - optuna.study.study - INFO - Trial 287 finished with value: 0.09608781185922358 and parameters: {'n_layers': 1, 'embedding_dim': 256, 'lr': 0.0015314037967963149, 'lambda_val': 2.6118837671068445e-05, 'batch_size': 1244, 'optimizer': 'RMSprop'}. Best is trial 183 with value: 0.13724864888274418.
2026-05-16 05:17:46,826 - experiment_functions - INFO - Early stopping at epoch 2000. Best Recall: 0.1278
2026-05-16 05:17:46,917 - optuna.study.study - INFO - Trial 288 finished with value: 0.12779128866928735 and parameters: {'n_layers': 1, 'embedding_dim': 256, 'lr': 0.0006231315904441103, 'lambda_val': 8.49880561395085e-06, 'batch_size': 777, 'optimizer': 'Adam'}. Best is trial 183 with value: 0.13724864888274418.
2026-05-16 05:18:04,697 - experiment_functions - INFO - Early stopping at epoch 2600. Best Recall: 0.1319
2026-05-16 05:18:04,786 - optuna.study.study - INFO - Trial 289 finished with value: 0.1319431067451311 and parameters: {'n_layers': 1, 'embedding_dim': 256, 'lr': 0.0006014645639624569, 'lambda_val': 7.834767576460618e-06, 'batch_size': 796, 'optimizer': 'Adam'}. Best is trial 183 with value: 0.13724864888274418.
2026-05-16 05:18:11,694 - optuna.study._optimize - INFO - Trial 290 pruned. 
2026-05-16 05:18:20,308 - optuna.study._optimize - INFO - Trial 291 pruned. 
2026-05-16 05:18:40,843 - experiment_functions - INFO - Early stopping at epoch 3100. Best Recall: 0.1349
2026-05-16 05:18:40,943 - optuna.study.study - INFO - Trial 292 finished with value: 0.1349436407947564 and parameters: {'n_layers': 1, 'embedding_dim': 256, 'lr': 0.0006789476801425358, 'lambda_val': 7.918456068575887e-06, 'batch_size': 788, 'optimizer': 'Adam'}. Best is trial 183 with value: 0.13724864888274418.
2026-05-16 05:18:47,896 - optuna.study._optimize - INFO - Trial 293 pruned. 
2026-05-16 05:18:55,225 - optuna.study._optimize - INFO - Trial 294 pruned. 
2026-05-16 05:19:05,343 - experiment_functions - INFO - Early stopping at epoch 1350. Best Recall: 0.1302
2026-05-16 05:19:05,453 - optuna.study.study - INFO - Trial 295 finished with value: 0.13018880162911706 and parameters: {'n_layers': 1, 'embedding_dim': 256, 'lr': 0.0009534980853109943, 'lambda_val': 6.7951661853781056e-06, 'batch_size': 762, 'optimizer': 'Adam'}. Best is trial 183 with value: 0.13724864888274418.
2026-05-16 05:19:15,066 - optuna.study._optimize - INFO - Trial 296 pruned. 
2026-05-16 05:19:21,567 - optuna.study._optimize - INFO - Trial 297 pruned. 
2026-05-16 05:19:28,824 - optuna.study._optimize - INFO - Trial 298 pruned. 
2026-05-16 05:19:34,769 - experiment_functions - INFO - Early stopping at epoch 900. Best Recall: 0.1147
2026-05-16 05:19:34,849 - optuna.study.study - INFO - Trial 299 finished with value: 0.11470393558156586 and parameters: {'n_layers': 1, 'embedding_dim': 256, 'lr': 0.0011233516032587826, 'lambda_val': 0.001733482601311763, 'batch_size': 870, 'optimizer': 'Adam'}. Best is trial 183 with value: 0.13724864888274418.
2026-05-16 05:19:42,631 - experiment_functions - INFO - Early stopping at epoch 2150. Best Recall: 0.1298
2026-05-16 05:19:42,743 - root - INFO - **** Training e_100K_1c3dcs
2026-05-16 05:19:42,743 - root - INFO -   ** 3-Dominant stats:
2026-05-16 05:19:42,743 - root - INFO -   ** Finding the dominant set:
2026-05-16 05:20:10,011 - root - INFO -   ** Getting the trainable edges:
2026-05-16 05:20:10,016 - helper_functions - INFO -      Number of nodes: 5324
2026-05-16 05:20:10,016 - helper_functions - INFO -      Ratio: 0.515192568221405
2026-05-16 05:20:10,016 - helper_functions - INFO -      Number of unique users: 333
2026-05-16 05:20:10,016 - helper_functions - INFO -      Number of unique items: 4991
2026-05-16 05:20:10,016 - helper_functions - INFO -      Total dominant set edge: 17514
2026-05-16 05:20:10,016 - helper_functions - INFO -      Trainable edges: 14011.2
2026-05-16 05:20:10,021 - root - INFO -   **** Getting 17514 dominant set edges
2026-05-16 05:20:10,139 - optuna.storages._rdb.storage - INFO - A new study created in RDB with name: Study_e_100K_1c3dcs_strict
2026-05-16 05:20:13,395 - experiment_functions - INFO - Early stopping at epoch 500. Best Recall: 0.0029
