2026-05-16 06:23:41,057 - optuna.study._optimize - INFO - Trial 177 pruned. 
2026-05-16 06:23:44,531 - experiment_functions - INFO - Early stopping at epoch 500. Best Recall: 0.0009
2026-05-16 06:23:44,630 - optuna.study.study - INFO - Trial 178 finished with value: 0.0008630368943135459 and parameters: {'n_layers': 1, 'embedding_dim': 128, 'lr': 1.5606142108167203e-05, 'lambda_val': 8.076550116131087e-06, 'batch_size': 2825, 'optimizer': 'Adam'}. Best is trial 91 with value: 0.104993146553119.
2026-05-16 06:23:55,706 - experiment_functions - INFO - Early stopping at epoch 1650. Best Recall: 0.0911
2026-05-16 06:23:55,808 - optuna.study.study - INFO - Trial 179 finished with value: 0.0910574751466639 and parameters: {'n_layers': 1, 'embedding_dim': 256, 'lr': 0.00112342532844684, 'lambda_val': 0.00012481712933027023, 'batch_size': 2994, 'optimizer': 'Adam'}. Best is trial 91 with value: 0.104993146553119.
2026-05-16 06:24:06,559 - experiment_functions - INFO - Early stopping at epoch 1600. Best Recall: 0.0974
2026-05-16 06:24:06,660 - optuna.study.study - INFO - Trial 180 finished with value: 0.09742459890238131 and parameters: {'n_layers': 1, 'embedding_dim': 256, 'lr': 0.0005582712241995706, 'lambda_val': 6.594898177869916e-06, 'batch_size': 3050, 'optimizer': 'Adam'}. Best is trial 91 with value: 0.104993146553119.
2026-05-16 06:24:13,736 - optuna.study._optimize - INFO - Trial 181 pruned. 
2026-05-16 06:24:22,401 - optuna.study._optimize - INFO - Trial 182 pruned. 
2026-05-16 06:24:29,697 - optuna.study._optimize - INFO - Trial 183 pruned. 
2026-05-16 06:24:37,622 - optuna.study._optimize - INFO - Trial 184 pruned. 
2026-05-16 06:24:45,022 - optuna.study._optimize - INFO - Trial 185 pruned. 
2026-05-16 06:24:56,190 - experiment_functions - INFO - Early stopping at epoch 1600. Best Recall: 0.0942
2026-05-16 06:24:56,291 - optuna.study.study - INFO - Trial 186 finished with value: 0.09424277774482348 and parameters: {'n_layers': 1, 'embedding_dim': 256, 'lr': 0.0014194341636038362, 'lambda_val': 2.91252425401458e-06, 'batch_size': 3380, 'optimizer': 'Adam'}. Best is trial 91 with value: 0.104993146553119.
2026-05-16 06:25:07,083 - experiment_functions - INFO - Early stopping at epoch 1400. Best Recall: 0.0928
2026-05-16 06:25:07,174 - optuna.study.study - INFO - Trial 187 finished with value: 0.09278570732071699 and parameters: {'n_layers': 1, 'embedding_dim': 256, 'lr': 0.000951125213050927, 'lambda_val': 2.550234077855973e-06, 'batch_size': 3671, 'optimizer': 'Adam'}. Best is trial 91 with value: 0.104993146553119.
2026-05-16 06:25:14,913 - optuna.study._optimize - INFO - Trial 188 pruned. 
2026-05-16 06:25:22,227 - optuna.study._optimize - INFO - Trial 189 pruned. 
2026-05-16 06:25:29,314 - optuna.study._optimize - INFO - Trial 190 pruned. 
2026-05-16 06:25:43,432 - optuna.study._optimize - INFO - Trial 191 pruned. 
2026-05-16 06:25:56,680 - experiment_functions - INFO - Early stopping at epoch 1900. Best Recall: 0.0953
2026-05-16 06:25:56,805 - optuna.study.study - INFO - Trial 192 finished with value: 0.09526926377707316 and parameters: {'n_layers': 1, 'embedding_dim': 256, 'lr': 0.0010719946630203588, 'lambda_val': 3.7391808446997963e-06, 'batch_size': 2377, 'optimizer': 'Adam'}. Best is trial 91 with value: 0.104993146553119.
2026-05-16 06:26:17,134 - experiment_functions - INFO - Early stopping at epoch 2650. Best Recall: 0.1077
2026-05-16 06:26:17,228 - optuna.study.study - INFO - Trial 193 finished with value: 0.10774609486080013 and parameters: {'n_layers': 1, 'embedding_dim': 256, 'lr': 0.0006477042569199829, 'lambda_val': 5.293576735160948e-06, 'batch_size': 2427, 'optimizer': 'Adam'}. Best is trial 193 with value: 0.10774609486080013.
2026-05-16 06:26:34,672 - optuna.study._optimize - INFO - Trial 194 pruned. 
2026-05-16 06:26:41,913 - optuna.study._optimize - INFO - Trial 195 pruned. 
2026-05-16 06:26:48,273 - optuna.study._optimize - INFO - Trial 196 pruned. 
2026-05-16 06:26:55,114 - optuna.study._optimize - INFO - Trial 197 pruned. 
2026-05-16 06:27:06,112 - experiment_functions - INFO - Early stopping at epoch 1700. Best Recall: 0.0962
2026-05-16 06:27:06,203 - optuna.study.study - INFO - Trial 198 finished with value: 0.09615354748873149 and parameters: {'n_layers': 1, 'embedding_dim': 256, 'lr': 0.001202745481254423, 'lambda_val': 1.6939122837431943e-06, 'batch_size': 3459, 'optimizer': 'Adam'}. Best is trial 193 with value: 0.10774609486080013.
2026-05-16 06:27:17,312 - experiment_functions - INFO - Early stopping at epoch 1750. Best Recall: 0.0925
2026-05-16 06:27:17,404 - optuna.study.study - INFO - Trial 199 finished with value: 0.09246864852114063 and parameters: {'n_layers': 1, 'embedding_dim': 256, 'lr': 0.0008253153310445952, 'lambda_val': 1.7486657028440156e-06, 'batch_size': 3495, 'optimizer': 'Adam'}. Best is trial 193 with value: 0.10774609486080013.
2026-05-16 06:27:24,744 - optuna.study._optimize - INFO - Trial 200 pruned. 
2026-05-16 06:27:37,031 - experiment_functions - INFO - Early stopping at epoch 1850. Best Recall: 0.0925
2026-05-16 06:27:37,131 - optuna.study.study - INFO - Trial 201 finished with value: 0.0925327302411337 and parameters: {'n_layers': 1, 'embedding_dim': 256, 'lr': 0.001187163102831152, 'lambda_val': 2.2645142222218695e-06, 'batch_size': 3413, 'optimizer': 'Adam'}. Best is trial 193 with value: 0.10774609486080013.
2026-05-16 06:27:44,121 - optuna.study._optimize - INFO - Trial 202 pruned. 
2026-05-16 06:27:56,095 - experiment_functions - INFO - Early stopping at epoch 1700. Best Recall: 0.1002
2026-05-16 06:27:56,185 - optuna.study.study - INFO - Trial 203 finished with value: 0.10021707457521917 and parameters: {'n_layers': 1, 'embedding_dim': 256, 'lr': 0.0010088692863949305, 'lambda_val': 2.7532175990028835e-06, 'batch_size': 3684, 'optimizer': 'Adam'}. Best is trial 193 with value: 0.10774609486080013.
2026-05-16 06:28:09,823 - experiment_functions - INFO - Early stopping at epoch 1800. Best Recall: 0.1018
2026-05-16 06:28:09,914 - optuna.study.study - INFO - Trial 204 finished with value: 0.10180427288636255 and parameters: {'n_layers': 1, 'embedding_dim': 256, 'lr': 0.000980919770154682, 'lambda_val': 2.6532107737301838e-06, 'batch_size': 3649, 'optimizer': 'Adam'}. Best is trial 193 with value: 0.10774609486080013.
2026-05-16 06:28:18,880 - experiment_functions - INFO - Early stopping at epoch 1250. Best Recall: 0.0925
2026-05-16 06:28:18,980 - optuna.study.study - INFO - Trial 205 finished with value: 0.09250606307279417 and parameters: {'n_layers': 1, 'embedding_dim': 256, 'lr': 0.0010323061291935287, 'lambda_val': 2.7959489004691564e-06, 'batch_size': 3816, 'optimizer': 'Adam'}. Best is trial 193 with value: 0.10774609486080013.
2026-05-16 06:28:22,838 - experiment_functions - INFO - Early stopping at epoch 500. Best Recall: 0.0003
2026-05-16 06:28:22,937 - optuna.study.study - INFO - Trial 206 finished with value: 0.0002655377006763383 and parameters: {'n_layers': 1, 'embedding_dim': 256, 'lr': 0.001732675053029981, 'lambda_val': 1.0320983967143615e-06, 'batch_size': 3656, 'optimizer': 'SGD'}. Best is trial 193 with value: 0.10774609486080013.
2026-05-16 06:28:30,422 - optuna.study._optimize - INFO - Trial 207 pruned. 
2026-05-16 06:28:37,680 - optuna.study._optimize - INFO - Trial 208 pruned. 
2026-05-16 06:28:50,844 - experiment_functions - INFO - Early stopping at epoch 900. Best Recall: 0.0897
2026-05-16 06:28:51,607 - optuna.study.study - INFO - Trial 209 finished with value: 0.08965853869307255 and parameters: {'n_layers': 1, 'embedding_dim': 256, 'lr': 0.0011318811505052523, 'lambda_val': 4.493446697877648e-06, 'batch_size': 3680, 'optimizer': 'RMSprop'}. Best is trial 193 with value: 0.10774609486080013.
2026-05-16 06:28:59,974 - experiment_functions - INFO - Early stopping at epoch 750. Best Recall: 0.0454
2026-05-16 06:29:00,065 - optuna.study.study - INFO - Trial 210 finished with value: 0.04544071204618322 and parameters: {'n_layers': 1, 'embedding_dim': 256, 'lr': 0.0007809364405008091, 'lambda_val': 0.02989848894642352, 'batch_size': 3252, 'optimizer': 'Adam'}. Best is trial 193 with value: 0.10774609486080013.
2026-05-16 06:29:09,846 - experiment_functions - INFO - Early stopping at epoch 1550. Best Recall: 0.0943
2026-05-16 06:29:09,945 - optuna.study.study - INFO - Trial 211 finished with value: 0.09434334154259952 and parameters: {'n_layers': 1, 'embedding_dim': 256, 'lr': 0.0009385719295554379, 'lambda_val': 2.645001520736855e-06, 'batch_size': 3535, 'optimizer': 'Adam'}. Best is trial 193 with value: 0.10774609486080013.
2026-05-16 06:29:17,034 - optuna.study._optimize - INFO - Trial 212 pruned. 
2026-05-16 06:29:24,597 - optuna.study._optimize - INFO - Trial 213 pruned. 
2026-05-16 06:29:31,781 - optuna.study._optimize - INFO - Trial 214 pruned. 
2026-05-16 06:29:39,073 - optuna.study._optimize - INFO - Trial 215 pruned. 
2026-05-16 06:29:45,002 - optuna.study._optimize - INFO - Trial 216 pruned. 
2026-05-16 06:29:55,229 - experiment_functions - INFO - Early stopping at epoch 1450. Best Recall: 0.0959
2026-05-16 06:29:55,353 - optuna.study.study - INFO - Trial 217 finished with value: 0.09588981748803117 and parameters: {'n_layers': 1, 'embedding_dim': 256, 'lr': 0.0013896064559919595, 'lambda_val': 1.2903332843414178e-06, 'batch_size': 3696, 'optimizer': 'Adam'}. Best is trial 193 with value: 0.10774609486080013.
2026-05-16 06:30:04,468 - experiment_functions - INFO - Early stopping at epoch 900. Best Recall: 0.0684
2026-05-16 06:30:04,571 - optuna.study.study - INFO - Trial 218 finished with value: 0.06842868565494276 and parameters: {'n_layers': 1, 'embedding_dim': 128, 'lr': 0.0006378461612722342, 'lambda_val': 2.4134178360487408e-06, 'batch_size': 3186, 'optimizer': 'Adam'}. Best is trial 193 with value: 0.10774609486080013.
2026-05-16 06:30:13,431 - experiment_functions - INFO - Early stopping at epoch 1250. Best Recall: 0.0913
2026-05-16 06:30:13,529 - optuna.study.study - INFO - Trial 219 finished with value: 0.09133553289548801 and parameters: {'n_layers': 1, 'embedding_dim': 256, 'lr': 0.001775393087940034, 'lambda_val': 1.735156386778609e-06, 'batch_size': 3113, 'optimizer': 'Adam'}. Best is trial 193 with value: 0.10774609486080013.
2026-05-16 06:30:21,566 - optuna.study._optimize - INFO - Trial 220 pruned. 
2026-05-16 06:30:32,514 - experiment_functions - INFO - Early stopping at epoch 1600. Best Recall: 0.0993
2026-05-16 06:30:32,605 - optuna.study.study - INFO - Trial 221 finished with value: 0.09929170012258687 and parameters: {'n_layers': 1, 'embedding_dim': 256, 'lr': 0.001417386306594063, 'lambda_val': 1.2922700239752482e-06, 'batch_size': 3678, 'optimizer': 'Adam'}. Best is trial 193 with value: 0.10774609486080013.
2026-05-16 06:30:39,702 - experiment_functions - INFO - Early stopping at epoch 1050. Best Recall: 0.0909
2026-05-16 06:30:39,793 - optuna.study.study - INFO - Trial 222 finished with value: 0.09094970499684692 and parameters: {'n_layers': 1, 'embedding_dim': 256, 'lr': 0.0015183963579820125, 'lambda_val': 1.2098703173888655e-06, 'batch_size': 3610, 'optimizer': 'Adam'}. Best is trial 193 with value: 0.10774609486080013.
2026-05-16 06:30:47,931 - optuna.study._optimize - INFO - Trial 223 pruned. 
2026-05-16 06:30:53,360 - experiment_functions - INFO - Early stopping at epoch 800. Best Recall: 0.0869
2026-05-16 06:30:53,607 - optuna.study.study - INFO - Trial 224 finished with value: 0.0868759971307837 and parameters: {'n_layers': 1, 'embedding_dim': 256, 'lr': 0.0023042029757273323, 'lambda_val': 2.268062908264646e-06, 'batch_size': 3540, 'optimizer': 'Adam'}. Best is trial 193 with value: 0.10774609486080013.
2026-05-16 06:31:11,187 - optuna.study._optimize - INFO - Trial 225 pruned. 
2026-05-16 06:31:17,975 - optuna.study._optimize - INFO - Trial 226 pruned. 
2026-05-16 06:31:24,602 - optuna.study._optimize - INFO - Trial 227 pruned. 
2026-05-16 06:31:33,394 - experiment_functions - INFO - Early stopping at epoch 1300. Best Recall: 0.0958
2026-05-16 06:31:33,494 - optuna.study.study - INFO - Trial 228 finished with value: 0.09579087158193608 and parameters: {'n_layers': 1, 'embedding_dim': 256, 'lr': 0.0013582697844270013, 'lambda_val': 1.924935136869658e-06, 'batch_size': 3721, 'optimizer': 'Adam'}. Best is trial 193 with value: 0.10774609486080013.
2026-05-16 06:31:40,433 - optuna.study._optimize - INFO - Trial 229 pruned. 
2026-05-16 06:31:44,836 - experiment_functions - INFO - Early stopping at epoch 550. Best Recall: 0.0578
2026-05-16 06:31:44,945 - optuna.study.study - INFO - Trial 230 finished with value: 0.057758368296500155 and parameters: {'n_layers': 1, 'embedding_dim': 256, 'lr': 0.012534606252494015, 'lambda_val': 1.3942850786804243e-06, 'batch_size': 3338, 'optimizer': 'Adam'}. Best is trial 193 with value: 0.10774609486080013.
2026-05-16 06:31:52,252 - optuna.study._optimize - INFO - Trial 231 pruned. 
2026-05-16 06:31:58,936 - optuna.study._optimize - INFO - Trial 232 pruned. 
2026-05-16 06:32:10,346 - experiment_functions - INFO - Early stopping at epoch 1400. Best Recall: 0.0946
2026-05-16 06:32:10,447 - optuna.study.study - INFO - Trial 233 finished with value: 0.09461383803928532 and parameters: {'n_layers': 1, 'embedding_dim': 256, 'lr': 0.0009493704192478326, 'lambda_val': 1.9481881797005473e-06, 'batch_size': 3817, 'optimizer': 'Adam'}. Best is trial 193 with value: 0.10774609486080013.
2026-05-16 06:32:19,125 - experiment_functions - INFO - Early stopping at epoch 950. Best Recall: 0.0236
2026-05-16 06:32:19,234 - optuna.study.study - INFO - Trial 234 finished with value: 0.023596874632078758 and parameters: {'n_layers': 3, 'embedding_dim': 256, 'lr': 0.030806609390522287, 'lambda_val': 1.2831473826717945e-06, 'batch_size': 3726, 'optimizer': 'Adam'}. Best is trial 193 with value: 0.10774609486080013.
2026-05-16 06:32:26,095 - optuna.study._optimize - INFO - Trial 235 pruned. 
2026-05-16 06:32:32,894 - optuna.study._optimize - INFO - Trial 236 pruned. 
2026-05-16 06:32:40,379 - experiment_functions - INFO - Early stopping at epoch 1100. Best Recall: 0.0907
2026-05-16 06:32:40,479 - optuna.study.study - INFO - Trial 237 finished with value: 0.09074172074840942 and parameters: {'n_layers': 1, 'embedding_dim': 256, 'lr': 0.0016172966236679802, 'lambda_val': 2.4032444420466717e-06, 'batch_size': 3668, 'optimizer': 'Adam'}. Best is trial 193 with value: 0.10774609486080013.
2026-05-16 06:32:50,748 - experiment_functions - INFO - Early stopping at epoch 1500. Best Recall: 0.0927
2026-05-16 06:32:50,849 - optuna.study.study - INFO - Trial 238 finished with value: 0.09269218888896835 and parameters: {'n_layers': 1, 'embedding_dim': 256, 'lr': 0.0010644277652219923, 'lambda_val': 1.6595164086556935e-06, 'batch_size': 3505, 'optimizer': 'Adam'}. Best is trial 193 with value: 0.10774609486080013.
2026-05-16 06:32:56,811 - optuna.study._optimize - INFO - Trial 239 pruned. 
2026-05-16 06:33:06,880 - experiment_functions - INFO - Early stopping at epoch 1550. Best Recall: 0.0974
2026-05-16 06:33:06,970 - optuna.study.study - INFO - Trial 240 finished with value: 0.0974453205233632 and parameters: {'n_layers': 1, 'embedding_dim': 256, 'lr': 0.0012860419793990815, 'lambda_val': 3.302325198256933e-06, 'batch_size': 2997, 'optimizer': 'Adam'}. Best is trial 193 with value: 0.10774609486080013.
2026-05-16 06:33:17,219 - experiment_functions - INFO - Early stopping at epoch 1100. Best Recall: 0.0914
2026-05-16 06:33:17,318 - optuna.study.study - INFO - Trial 241 finished with value: 0.09135853075570649 and parameters: {'n_layers': 1, 'embedding_dim': 256, 'lr': 0.0013597922503070271, 'lambda_val': 3.554547871169432e-06, 'batch_size': 2968, 'optimizer': 'Adam'}. Best is trial 193 with value: 0.10774609486080013.
2026-05-16 06:33:24,691 - optuna.study._optimize - INFO - Trial 242 pruned. 
2026-05-16 06:33:32,624 - experiment_functions - INFO - Early stopping at epoch 700. Best Recall: 0.0479
2026-05-16 06:33:32,726 - optuna.study.study - INFO - Trial 243 finished with value: 0.047861032359584055 and parameters: {'n_layers': 2, 'embedding_dim': 256, 'lr': 0.0009558641902359671, 'lambda_val': 2.906946385843781e-06, 'batch_size': 3073, 'optimizer': 'Adam'}. Best is trial 193 with value: 0.10774609486080013.
2026-05-16 06:33:38,316 - experiment_functions - INFO - Early stopping at epoch 550. Best Recall: 0.0232
2026-05-16 06:33:38,429 - optuna.study.study - INFO - Trial 244 finished with value: 0.02315967069351743 and parameters: {'n_layers': 4, 'embedding_dim': 256, 'lr': 0.0018059214103916426, 'lambda_val': 5.933373682480571e-06, 'batch_size': 3017, 'optimizer': 'Adam'}. Best is trial 193 with value: 0.10774609486080013.
2026-05-16 06:33:45,155 - optuna.study._optimize - INFO - Trial 245 pruned. 
2026-05-16 06:33:49,023 - experiment_functions - INFO - Early stopping at epoch 500. Best Recall: 0.0016
2026-05-16 06:33:49,134 - optuna.study.study - INFO - Trial 246 finished with value: 0.001573468017938989 and parameters: {'n_layers': 1, 'embedding_dim': 256, 'lr': 0.0013735282695395755, 'lambda_val': 1.5325961562336244e-06, 'batch_size': 3590, 'optimizer': 'SGD'}. Best is trial 193 with value: 0.10774609486080013.
2026-05-16 06:33:57,875 - experiment_functions - INFO - Early stopping at epoch 1250. Best Recall: 0.0909
2026-05-16 06:33:57,965 - optuna.study.study - INFO - Trial 247 finished with value: 0.09087161555692758 and parameters: {'n_layers': 1, 'embedding_dim': 256, 'lr': 0.001090514823552409, 'lambda_val': 8.732845774322357e-06, 'batch_size': 3189, 'optimizer': 'Adam'}. Best is trial 193 with value: 0.10774609486080013.
2026-05-16 06:34:05,831 - experiment_functions - INFO - Early stopping at epoch 1150. Best Recall: 0.0966
2026-05-16 06:34:05,944 - optuna.study.study - INFO - Trial 248 finished with value: 0.09661249593714372 and parameters: {'n_layers': 1, 'embedding_dim': 256, 'lr': 0.0016331133326260633, 'lambda_val': 3.7679648118769113e-06, 'batch_size': 3401, 'optimizer': 'Adam'}. Best is trial 193 with value: 0.10774609486080013.
2026-05-16 06:34:12,430 - experiment_functions - INFO - Early stopping at epoch 900. Best Recall: 0.0946
2026-05-16 06:34:12,520 - optuna.study.study - INFO - Trial 249 finished with value: 0.09461428802596347 and parameters: {'n_layers': 1, 'embedding_dim': 256, 'lr': 0.002265927970573994, 'lambda_val': 5.292033317565932e-06, 'batch_size': 3435, 'optimizer': 'Adam'}. Best is trial 193 with value: 0.10774609486080013.
2026-05-16 06:34:19,472 - optuna.study._optimize - INFO - Trial 250 pruned. 
2026-05-16 06:34:25,762 - experiment_functions - INFO - Early stopping at epoch 900. Best Recall: 0.0848
2026-05-16 06:34:25,895 - optuna.study.study - INFO - Trial 251 finished with value: 0.0847621663021003 and parameters: {'n_layers': 1, 'embedding_dim': 256, 'lr': 0.0016518265368897997, 'lambda_val': 3.783534351831589e-06, 'batch_size': 3360, 'optimizer': 'RMSprop'}. Best is trial 193 with value: 0.10774609486080013.
2026-05-16 06:34:33,025 - optuna.study._optimize - INFO - Trial 252 pruned. 
2026-05-16 06:34:41,626 - experiment_functions - INFO - Early stopping at epoch 1300. Best Recall: 0.0952
2026-05-16 06:34:41,725 - optuna.study.study - INFO - Trial 253 finished with value: 0.09523922005624105 and parameters: {'n_layers': 1, 'embedding_dim': 256, 'lr': 0.0009998180006197894, 'lambda_val': 6.864125695612481e-06, 'batch_size': 3188, 'optimizer': 'Adam'}. Best is trial 193 with value: 0.10774609486080013.
2026-05-16 06:34:57,590 - experiment_functions - INFO - Early stopping at epoch 1700. Best Recall: 0.0964
2026-05-16 06:34:58,353 - optuna.study.study - INFO - Trial 254 finished with value: 0.09641144520218418 and parameters: {'n_layers': 1, 'embedding_dim': 256, 'lr': 0.0012369698734149726, 'lambda_val': 6.840157181517057e-05, 'batch_size': 3491, 'optimizer': 'Adam'}. Best is trial 193 with value: 0.10774609486080013.
2026-05-16 06:35:09,189 - optuna.study._optimize - INFO - Trial 255 pruned. 
2026-05-16 06:35:16,385 - optuna.study._optimize - INFO - Trial 256 pruned. 
2026-05-16 06:35:24,479 - optuna.study._optimize - INFO - Trial 257 pruned. 
2026-05-16 06:35:29,739 - experiment_functions - INFO - Early stopping at epoch 750. Best Recall: 0.0829
2026-05-16 06:35:29,830 - optuna.study.study - INFO - Trial 258 finished with value: 0.0829291320955089 and parameters: {'n_layers': 1, 'embedding_dim': 256, 'lr': 0.0012792440054177402, 'lambda_val': 0.00045924464738335687, 'batch_size': 3012, 'optimizer': 'Adam'}. Best is trial 193 with value: 0.10774609486080013.
2026-05-16 06:35:36,725 - optuna.study._optimize - INFO - Trial 259 pruned. 
2026-05-16 06:35:54,482 - experiment_functions - INFO - Early stopping at epoch 1400. Best Recall: 0.0966
2026-05-16 06:35:55,254 - optuna.study.study - INFO - Trial 260 finished with value: 0.09662907865331287 and parameters: {'n_layers': 1, 'embedding_dim': 256, 'lr': 0.0011145916665831381, 'lambda_val': 1.662142170850313e-05, 'batch_size': 3503, 'optimizer': 'Adam'}. Best is trial 193 with value: 0.10774609486080013.
2026-05-16 06:36:03,334 - optuna.study._optimize - INFO - Trial 261 pruned. 
2026-05-16 06:36:10,553 - optuna.study._optimize - INFO - Trial 262 pruned. 
2026-05-16 06:36:17,270 - optuna.study._optimize - INFO - Trial 263 pruned. 
2026-05-16 06:36:27,464 - optuna.study._optimize - INFO - Trial 264 pruned. 
2026-05-16 06:36:37,948 - experiment_functions - INFO - Early stopping at epoch 1600. Best Recall: 0.0961
2026-05-16 06:36:38,038 - optuna.study.study - INFO - Trial 265 finished with value: 0.09612363656651234 and parameters: {'n_layers': 1, 'embedding_dim': 256, 'lr': 0.0010607202989706644, 'lambda_val': 7.738209931626507e-06, 'batch_size': 2822, 'optimizer': 'Adam'}. Best is trial 193 with value: 0.10774609486080013.
2026-05-16 06:36:46,376 - experiment_functions - INFO - Early stopping at epoch 1250. Best Recall: 0.1036
