2026-05-15 23:26:09,615 - optuna.study.study - INFO - Trial 108 finished with value: 0.12004216101600602 and parameters: {'n_layers': 1, 'embedding_dim': 64, 'lr': 0.0005365808074518672, 'lambda_val': 0.0001333908845679008, 'batch_size': 903, 'optimizer': 'Adam'}. Best is trial 78 with value: 0.12184530070472399.
2026-05-15 23:26:15,705 - optuna.study._optimize - INFO - Trial 109 pruned. 
2026-05-15 23:26:19,330 - experiment_functions - INFO - Early stopping at epoch 500. Best Recall: 0.0048
2026-05-15 23:26:19,429 - optuna.study.study - INFO - Trial 110 finished with value: 0.00483443635666277 and parameters: {'n_layers': 1, 'embedding_dim': 64, 'lr': 0.0013369338346084793, 'lambda_val': 0.00010462665356716334, 'batch_size': 753, 'optimizer': 'SGD'}. Best is trial 78 with value: 0.12184530070472399.
2026-05-15 23:26:25,758 - optuna.study._optimize - INFO - Trial 111 pruned. 
2026-05-15 23:26:37,080 - experiment_functions - INFO - Early stopping at epoch 2000. Best Recall: 0.1277
2026-05-15 23:26:37,175 - optuna.study.study - INFO - Trial 112 finished with value: 0.12770302963020452 and parameters: {'n_layers': 1, 'embedding_dim': 96, 'lr': 0.0008335280548111668, 'lambda_val': 7.726991918784205e-05, 'batch_size': 875, 'optimizer': 'Adam'}. Best is trial 112 with value: 0.12770302963020452.
2026-05-15 23:26:43,150 - optuna.study._optimize - INFO - Trial 113 pruned. 
2026-05-15 23:26:55,807 - optuna.study._optimize - INFO - Trial 114 pruned. 
2026-05-15 23:27:03,389 - experiment_functions - INFO - Early stopping at epoch 700. Best Recall: 0.1026
2026-05-15 23:27:03,490 - optuna.study.study - INFO - Trial 115 finished with value: 0.10261737765370714 and parameters: {'n_layers': 1, 'embedding_dim': 256, 'lr': 0.001919574391533075, 'lambda_val': 0.00029551292338854087, 'batch_size': 860, 'optimizer': 'Adam'}. Best is trial 112 with value: 0.12770302963020452.
2026-05-15 23:27:09,564 - optuna.study._optimize - INFO - Trial 116 pruned. 
2026-05-15 23:27:16,747 - experiment_functions - INFO - Early stopping at epoch 1200. Best Recall: 0.1070
2026-05-15 23:27:16,846 - optuna.study.study - INFO - Trial 117 finished with value: 0.10697011135393862 and parameters: {'n_layers': 1, 'embedding_dim': 96, 'lr': 0.0010049053277069264, 'lambda_val': 0.0001198403448648635, 'batch_size': 1303, 'optimizer': 'Adam'}. Best is trial 112 with value: 0.12770302963020452.
2026-05-15 23:27:23,253 - optuna.study._optimize - INFO - Trial 118 pruned. 
2026-05-15 23:27:28,595 - experiment_functions - INFO - Early stopping at epoch 900. Best Recall: 0.0948
2026-05-15 23:27:28,685 - optuna.study.study - INFO - Trial 119 finished with value: 0.09479613711486808 and parameters: {'n_layers': 1, 'embedding_dim': 32, 'lr': 0.0015662885789176554, 'lambda_val': 0.00018023640426020974, 'batch_size': 1069, 'optimizer': 'Adam'}. Best is trial 112 with value: 0.12770302963020452.
2026-05-15 23:27:51,654 - experiment_functions - INFO - Early stopping at epoch 2350. Best Recall: 0.1165
2026-05-15 23:27:51,754 - optuna.study.study - INFO - Trial 120 finished with value: 0.11652466496542434 and parameters: {'n_layers': 1, 'embedding_dim': 96, 'lr': 0.0007638200994036212, 'lambda_val': 4.422250399193852e-05, 'batch_size': 983, 'optimizer': 'Adam'}. Best is trial 112 with value: 0.12770302963020452.
2026-05-15 23:28:00,742 - experiment_functions - INFO - Early stopping at epoch 1550. Best Recall: 0.1099
2026-05-15 23:28:00,841 - optuna.study.study - INFO - Trial 121 finished with value: 0.10993269301686649 and parameters: {'n_layers': 1, 'embedding_dim': 96, 'lr': 0.0007750002166344889, 'lambda_val': 4.85106274364346e-05, 'batch_size': 1175, 'optimizer': 'Adam'}. Best is trial 112 with value: 0.12770302963020452.
2026-05-15 23:28:08,749 - optuna.study._optimize - INFO - Trial 122 pruned. 
2026-05-15 23:28:20,084 - experiment_functions - INFO - Early stopping at epoch 2050. Best Recall: 0.1132
2026-05-15 23:28:20,228 - optuna.study.study - INFO - Trial 123 finished with value: 0.11322775585541583 and parameters: {'n_layers': 1, 'embedding_dim': 96, 'lr': 0.0006891688899173308, 'lambda_val': 0.00012830642108611364, 'batch_size': 941, 'optimizer': 'Adam'}. Best is trial 112 with value: 0.12770302963020452.
2026-05-15 23:28:27,607 - optuna.study._optimize - INFO - Trial 124 pruned. 
2026-05-15 23:28:37,405 - optuna.study._optimize - INFO - Trial 125 pruned. 
2026-05-15 23:28:44,265 - optuna.study._optimize - INFO - Trial 126 pruned. 
2026-05-15 23:28:50,267 - optuna.study._optimize - INFO - Trial 127 pruned. 
2026-05-15 23:28:56,098 - optuna.study._optimize - INFO - Trial 128 pruned. 
2026-05-15 23:29:06,113 - experiment_functions - INFO - Early stopping at epoch 1750. Best Recall: 0.1152
2026-05-15 23:29:06,271 - optuna.study.study - INFO - Trial 129 finished with value: 0.11521383220224514 and parameters: {'n_layers': 1, 'embedding_dim': 64, 'lr': 0.0008352039102438016, 'lambda_val': 0.00026299488269981066, 'batch_size': 1229, 'optimizer': 'Adam'}. Best is trial 112 with value: 0.12770302963020452.
2026-05-15 23:29:14,475 - experiment_functions - INFO - Early stopping at epoch 1150. Best Recall: 0.1065
2026-05-15 23:29:14,608 - optuna.study.study - INFO - Trial 130 finished with value: 0.10654249094642769 and parameters: {'n_layers': 1, 'embedding_dim': 96, 'lr': 0.0011072378869647472, 'lambda_val': 0.00011495706057016751, 'batch_size': 965, 'optimizer': 'Adam'}. Best is trial 112 with value: 0.12770302963020452.
2026-05-15 23:29:21,175 - optuna.study._optimize - INFO - Trial 131 pruned. 
2026-05-15 23:29:27,109 - optuna.study._optimize - INFO - Trial 132 pruned. 
2026-05-15 23:29:33,019 - optuna.study._optimize - INFO - Trial 133 pruned. 
2026-05-15 23:29:44,489 - experiment_functions - INFO - Early stopping at epoch 2000. Best Recall: 0.1145
2026-05-15 23:29:44,581 - optuna.study.study - INFO - Trial 134 finished with value: 0.11451313754844435 and parameters: {'n_layers': 1, 'embedding_dim': 64, 'lr': 0.0008983411326266863, 'lambda_val': 7.584439143120418e-05, 'batch_size': 1447, 'optimizer': 'Adam'}. Best is trial 112 with value: 0.12770302963020452.
2026-05-15 23:29:58,794 - experiment_functions - INFO - Early stopping at epoch 2500. Best Recall: 0.1231
2026-05-15 23:29:58,899 - optuna.study.study - INFO - Trial 135 finished with value: 0.12307570097395575 and parameters: {'n_layers': 1, 'embedding_dim': 96, 'lr': 0.0005430175214704591, 'lambda_val': 7.364092287033437e-05, 'batch_size': 1484, 'optimizer': 'Adam'}. Best is trial 112 with value: 0.12770302963020452.
2026-05-15 23:30:05,254 - optuna.study._optimize - INFO - Trial 136 pruned. 
2026-05-15 23:30:08,989 - experiment_functions - INFO - Early stopping at epoch 500. Best Recall: 0.0035
2026-05-15 23:30:09,083 - optuna.study.study - INFO - Trial 137 finished with value: 0.0034622471115864674 and parameters: {'n_layers': 1, 'embedding_dim': 96, 'lr': 0.00034612837958298404, 'lambda_val': 6.624523937262648e-05, 'batch_size': 1480, 'optimizer': 'SGD'}. Best is trial 112 with value: 0.12770302963020452.
2026-05-15 23:30:33,496 - experiment_functions - INFO - Early stopping at epoch 2550. Best Recall: 0.1184
2026-05-15 23:30:33,618 - optuna.study.study - INFO - Trial 138 finished with value: 0.11836754494776854 and parameters: {'n_layers': 1, 'embedding_dim': 96, 'lr': 0.0006001656567429739, 'lambda_val': 9.784409846374298e-05, 'batch_size': 1356, 'optimizer': 'Adam'}. Best is trial 112 with value: 0.12770302963020452.
2026-05-15 23:30:46,360 - experiment_functions - INFO - Early stopping at epoch 1700. Best Recall: 0.1258
2026-05-15 23:30:46,520 - optuna.study.study - INFO - Trial 139 finished with value: 0.12578069697454375 and parameters: {'n_layers': 1, 'embedding_dim': 256, 'lr': 0.0006439550503782596, 'lambda_val': 0.00010354279728360156, 'batch_size': 1343, 'optimizer': 'Adam'}. Best is trial 112 with value: 0.12770302963020452.
2026-05-15 23:30:54,752 - experiment_functions - INFO - Early stopping at epoch 1300. Best Recall: 0.1186
2026-05-15 23:30:54,844 - optuna.study.study - INFO - Trial 140 finished with value: 0.11856092146803489 and parameters: {'n_layers': 1, 'embedding_dim': 256, 'lr': 0.0007241208223035113, 'lambda_val': 0.00010108717215499836, 'batch_size': 1518, 'optimizer': 'Adam'}. Best is trial 112 with value: 0.12770302963020452.
2026-05-15 23:31:03,923 - experiment_functions - INFO - Early stopping at epoch 1400. Best Recall: 0.1190
2026-05-15 23:31:04,028 - optuna.study.study - INFO - Trial 141 finished with value: 0.11903576233083397 and parameters: {'n_layers': 1, 'embedding_dim': 256, 'lr': 0.0007239619933682705, 'lambda_val': 0.00010217135338845284, 'batch_size': 1538, 'optimizer': 'Adam'}. Best is trial 112 with value: 0.12770302963020452.
2026-05-15 23:31:11,600 - experiment_functions - INFO - Early stopping at epoch 1150. Best Recall: 0.1131
2026-05-15 23:31:11,737 - optuna.study.study - INFO - Trial 142 finished with value: 0.11305680471653974 and parameters: {'n_layers': 1, 'embedding_dim': 256, 'lr': 0.0008113956980880472, 'lambda_val': 0.0001031407933922434, 'batch_size': 1512, 'optimizer': 'Adam'}. Best is trial 112 with value: 0.12770302963020452.
2026-05-15 23:31:24,527 - experiment_functions - INFO - Early stopping at epoch 800. Best Recall: 0.0474
2026-05-15 23:31:25,202 - optuna.study.study - INFO - Trial 143 finished with value: 0.04736555942075664 and parameters: {'n_layers': 3, 'embedding_dim': 256, 'lr': 0.0013328844375045822, 'lambda_val': 4.577403919563981e-05, 'batch_size': 1356, 'optimizer': 'Adam'}. Best is trial 112 with value: 0.12770302963020452.
2026-05-15 23:31:38,952 - experiment_functions - INFO - Early stopping at epoch 1700. Best Recall: 0.1242
2026-05-15 23:31:39,055 - optuna.study.study - INFO - Trial 144 finished with value: 0.12422635796233893 and parameters: {'n_layers': 1, 'embedding_dim': 256, 'lr': 0.0005762221278520052, 'lambda_val': 0.00010250698277232717, 'batch_size': 1721, 'optimizer': 'Adam'}. Best is trial 112 with value: 0.12770302963020452.
2026-05-15 23:31:51,070 - experiment_functions - INFO - Early stopping at epoch 1500. Best Recall: 0.1149
2026-05-15 23:31:51,163 - optuna.study.study - INFO - Trial 145 finished with value: 0.11487454164251229 and parameters: {'n_layers': 1, 'embedding_dim': 256, 'lr': 0.000612402515623657, 'lambda_val': 0.00017955739383858506, 'batch_size': 1759, 'optimizer': 'Adam'}. Best is trial 112 with value: 0.12770302963020452.
2026-05-15 23:32:17,612 - experiment_functions - INFO - Early stopping at epoch 3050. Best Recall: 0.1194
2026-05-15 23:32:17,716 - optuna.study.study - INFO - Trial 146 finished with value: 0.11941833596823946 and parameters: {'n_layers': 1, 'embedding_dim': 256, 'lr': 0.00043118668333051675, 'lambda_val': 0.00010164023065865302, 'batch_size': 1553, 'optimizer': 'Adam'}. Best is trial 112 with value: 0.12770302963020452.
2026-05-15 23:32:34,227 - experiment_functions - INFO - Early stopping at epoch 2750. Best Recall: 0.1265
2026-05-15 23:32:34,318 - optuna.study.study - INFO - Trial 147 finished with value: 0.1264890722070419 and parameters: {'n_layers': 1, 'embedding_dim': 256, 'lr': 0.00041708493315400553, 'lambda_val': 0.00010088163039971124, 'batch_size': 1538, 'optimizer': 'Adam'}. Best is trial 112 with value: 0.12770302963020452.
2026-05-15 23:32:43,268 - optuna.study._optimize - INFO - Trial 148 pruned. 
2026-05-15 23:32:49,676 - optuna.study._optimize - INFO - Trial 149 pruned. 
2026-05-15 23:32:56,490 - optuna.study._optimize - INFO - Trial 150 pruned. 
2026-05-15 23:33:13,880 - experiment_functions - INFO - Early stopping at epoch 2850. Best Recall: 0.1198
2026-05-15 23:33:13,983 - optuna.study.study - INFO - Trial 151 finished with value: 0.11976218699130654 and parameters: {'n_layers': 1, 'embedding_dim': 256, 'lr': 0.00046087668571921826, 'lambda_val': 0.0001311416754537484, 'batch_size': 1524, 'optimizer': 'Adam'}. Best is trial 112 with value: 0.12770302963020452.
2026-05-15 23:33:28,217 - experiment_functions - INFO - Early stopping at epoch 2050. Best Recall: 0.1203
2026-05-15 23:33:28,331 - optuna.study.study - INFO - Trial 152 finished with value: 0.12025988225390113 and parameters: {'n_layers': 1, 'embedding_dim': 256, 'lr': 0.0004955615811906032, 'lambda_val': 9.781369996746605e-05, 'batch_size': 1522, 'optimizer': 'Adam'}. Best is trial 112 with value: 0.12770302963020452.
2026-05-15 23:33:42,237 - experiment_functions - INFO - Early stopping at epoch 2150. Best Recall: 0.1227
2026-05-15 23:33:42,374 - optuna.study.study - INFO - Trial 153 finished with value: 0.12273161151667436 and parameters: {'n_layers': 1, 'embedding_dim': 256, 'lr': 0.00045572942281476176, 'lambda_val': 0.00011172856514875048, 'batch_size': 1538, 'optimizer': 'Adam'}. Best is trial 112 with value: 0.12770302963020452.
2026-05-15 23:33:49,449 - experiment_functions - INFO - Early stopping at epoch 750. Best Recall: 0.0428
2026-05-15 23:33:49,597 - optuna.study.study - INFO - Trial 154 finished with value: 0.04278472899030193 and parameters: {'n_layers': 4, 'embedding_dim': 256, 'lr': 0.00044725722133705405, 'lambda_val': 0.00011276155243248233, 'batch_size': 1757, 'optimizer': 'Adam'}. Best is trial 112 with value: 0.12770302963020452.
2026-05-15 23:33:56,336 - optuna.study._optimize - INFO - Trial 155 pruned. 
2026-05-15 23:34:14,363 - experiment_functions - INFO - Early stopping at epoch 2850. Best Recall: 0.1206
2026-05-15 23:34:14,522 - optuna.study.study - INFO - Trial 156 finished with value: 0.12056680499710272 and parameters: {'n_layers': 1, 'embedding_dim': 256, 'lr': 0.00035238457604739063, 'lambda_val': 0.00012224664333082238, 'batch_size': 1829, 'optimizer': 'Adam'}. Best is trial 112 with value: 0.12770302963020452.
2026-05-15 23:34:21,491 - optuna.study._optimize - INFO - Trial 157 pruned. 
2026-05-15 23:34:36,690 - experiment_functions - INFO - Early stopping at epoch 2400. Best Recall: 0.1273
2026-05-15 23:34:36,817 - optuna.study.study - INFO - Trial 158 finished with value: 0.12729009067663596 and parameters: {'n_layers': 1, 'embedding_dim': 256, 'lr': 0.0004143697272606816, 'lambda_val': 0.00010144766457326868, 'batch_size': 1573, 'optimizer': 'Adam'}. Best is trial 112 with value: 0.12770302963020452.
2026-05-15 23:34:45,526 - optuna.study._optimize - INFO - Trial 159 pruned. 
2026-05-15 23:34:52,458 - optuna.study._optimize - INFO - Trial 160 pruned. 
2026-05-15 23:34:59,364 - optuna.study._optimize - INFO - Trial 161 pruned. 
2026-05-15 23:35:15,256 - experiment_functions - INFO - Early stopping at epoch 1800. Best Recall: 0.1217
2026-05-15 23:35:15,349 - optuna.study.study - INFO - Trial 162 finished with value: 0.12170341785290088 and parameters: {'n_layers': 1, 'embedding_dim': 256, 'lr': 0.0005718659119135105, 'lambda_val': 0.00014906339329792887, 'batch_size': 1552, 'optimizer': 'Adam'}. Best is trial 112 with value: 0.12770302963020452.
2026-05-15 23:35:23,846 - optuna.study._optimize - INFO - Trial 163 pruned. 
2026-05-15 23:35:31,517 - optuna.study._optimize - INFO - Trial 164 pruned. 
2026-05-15 23:35:44,685 - experiment_functions - INFO - Early stopping at epoch 1750. Best Recall: 0.1198
2026-05-15 23:35:44,845 - optuna.study.study - INFO - Trial 165 finished with value: 0.11977583699186106 and parameters: {'n_layers': 1, 'embedding_dim': 256, 'lr': 0.0005267148944673752, 'lambda_val': 6.048050739513128e-05, 'batch_size': 1778, 'optimizer': 'Adam'}. Best is trial 112 with value: 0.12770302963020452.
2026-05-15 23:35:49,418 - experiment_functions - INFO - Early stopping at epoch 500. Best Recall: 0.0014
2026-05-15 23:35:49,578 - optuna.study.study - INFO - Trial 166 finished with value: 0.0014140049785263333 and parameters: {'n_layers': 1, 'embedding_dim': 256, 'lr': 0.0005287292486952597, 'lambda_val': 5.681467866788124e-05, 'batch_size': 1828, 'optimizer': 'SGD'}. Best is trial 112 with value: 0.12770302963020452.
2026-05-15 23:36:01,331 - experiment_functions - INFO - Early stopping at epoch 1850. Best Recall: 0.1243
2026-05-15 23:36:01,425 - optuna.study.study - INFO - Trial 167 finished with value: 0.12429763759043691 and parameters: {'n_layers': 1, 'embedding_dim': 256, 'lr': 0.0004286337397354323, 'lambda_val': 7.440720852770477e-05, 'batch_size': 1708, 'optimizer': 'Adam'}. Best is trial 112 with value: 0.12770302963020452.
2026-05-15 23:36:17,332 - optuna.study._optimize - INFO - Trial 168 pruned. 
2026-05-15 23:36:24,633 - optuna.study._optimize - INFO - Trial 169 pruned. 
2026-05-15 23:36:33,221 - optuna.study._optimize - INFO - Trial 170 pruned. 
2026-05-15 23:36:43,964 - optuna.study._optimize - INFO - Trial 171 pruned. 
2026-05-15 23:36:58,288 - optuna.study._optimize - INFO - Trial 172 pruned. 
2026-05-15 23:37:12,433 - experiment_functions - INFO - Early stopping at epoch 1750. Best Recall: 0.1191
2026-05-15 23:37:12,549 - optuna.study.study - INFO - Trial 173 finished with value: 0.11912104674192163 and parameters: {'n_layers': 1, 'embedding_dim': 256, 'lr': 0.0005990511350642975, 'lambda_val': 5.399426919624693e-05, 'batch_size': 1438, 'optimizer': 'Adam'}. Best is trial 112 with value: 0.12770302963020452.
2026-05-15 23:37:24,786 - experiment_functions - INFO - Early stopping at epoch 1500. Best Recall: 0.1205
2026-05-15 23:37:24,880 - optuna.study.study - INFO - Trial 174 finished with value: 0.12045915474359203 and parameters: {'n_layers': 1, 'embedding_dim': 256, 'lr': 0.0005761269938804787, 'lambda_val': 5.5488526757450614e-05, 'batch_size': 2182, 'optimizer': 'Adam'}. Best is trial 112 with value: 0.12770302963020452.
2026-05-15 23:37:32,231 - optuna.study._optimize - INFO - Trial 175 pruned. 
2026-05-15 23:37:39,539 - optuna.study._optimize - INFO - Trial 176 pruned. 
2026-05-15 23:38:00,352 - experiment_functions - INFO - Early stopping at epoch 1750. Best Recall: 0.1202
2026-05-15 23:38:00,446 - optuna.study.study - INFO - Trial 177 finished with value: 0.1202178807737341 and parameters: {'n_layers': 1, 'embedding_dim': 256, 'lr': 0.0005040019911271197, 'lambda_val': 0.0001539447682330626, 'batch_size': 1678, 'optimizer': 'Adam'}. Best is trial 112 with value: 0.12770302963020452.
2026-05-15 23:38:15,865 - experiment_functions - INFO - Early stopping at epoch 2050. Best Recall: 0.1190
2026-05-15 23:38:16,002 - optuna.study.study - INFO - Trial 178 finished with value: 0.1189971238933382 and parameters: {'n_layers': 1, 'embedding_dim': 256, 'lr': 0.0005492116078833513, 'lambda_val': 0.00020019307162020826, 'batch_size': 1874, 'optimizer': 'Adam'}. Best is trial 112 with value: 0.12770302963020452.
2026-05-15 23:38:23,711 - optuna.study._optimize - INFO - Trial 179 pruned. 
2026-05-15 23:38:32,131 - experiment_functions - INFO - Early stopping at epoch 1150. Best Recall: 0.1198
2026-05-15 23:38:32,223 - optuna.study.study - INFO - Trial 180 finished with value: 0.11983130293553142 and parameters: {'n_layers': 1, 'embedding_dim': 256, 'lr': 0.0006631910849839227, 'lambda_val': 0.000159483737705653, 'batch_size': 1768, 'optimizer': 'Adam'}. Best is trial 112 with value: 0.12770302963020452.
2026-05-15 23:38:43,660 - experiment_functions - INFO - Early stopping at epoch 1750. Best Recall: 0.1228
2026-05-15 23:38:43,752 - optuna.study.study - INFO - Trial 181 finished with value: 0.12284621946047058 and parameters: {'n_layers': 1, 'embedding_dim': 256, 'lr': 0.0006546798504043599, 'lambda_val': 0.0001564637529235861, 'batch_size': 1787, 'optimizer': 'Adam'}. Best is trial 112 with value: 0.12770302963020452.
2026-05-15 23:38:54,613 - optuna.study._optimize - INFO - Trial 182 pruned. 
2026-05-15 23:39:03,066 - optuna.study._optimize - INFO - Trial 183 pruned. 
2026-05-15 23:39:10,521 - experiment_functions - INFO - Early stopping at epoch 1000. Best Recall: 0.1099
2026-05-15 23:39:10,613 - optuna.study.study - INFO - Trial 184 finished with value: 0.10993512274822569 and parameters: {'n_layers': 1, 'embedding_dim': 256, 'lr': 0.0006966451449801955, 'lambda_val': 0.0001955994410048618, 'batch_size': 2075, 'optimizer': 'Adam'}. Best is trial 112 with value: 0.12770302963020452.
2026-05-15 23:39:25,283 - experiment_functions - INFO - Early stopping at epoch 1450. Best Recall: 0.1290
2026-05-15 23:39:25,392 - optuna.study.study - INFO - Trial 185 finished with value: 0.12903275879492856 and parameters: {'n_layers': 1, 'embedding_dim': 256, 'lr': 0.0005218849741619088, 'lambda_val': 0.00015108606265669294, 'batch_size': 1744, 'optimizer': 'Adam'}. Best is trial 185 with value: 0.12903275879492856.
2026-05-15 23:39:44,026 - experiment_functions - INFO - Early stopping at epoch 2750. Best Recall: 0.1246
2026-05-15 23:39:44,118 - optuna.study.study - INFO - Trial 186 finished with value: 0.12462234262431945 and parameters: {'n_layers': 1, 'embedding_dim': 256, 'lr': 0.00035233292677945506, 'lambda_val': 0.00015512633928463135, 'batch_size': 2166, 'optimizer': 'Adam'}. Best is trial 185 with value: 0.12903275879492856.
2026-05-15 23:39:55,456 - optuna.study._optimize - INFO - Trial 187 pruned. 
2026-05-15 23:40:02,069 - optuna.study._optimize - INFO - Trial 188 pruned. 
2026-05-15 23:40:09,078 - optuna.study._optimize - INFO - Trial 189 pruned. 
2026-05-15 23:40:16,126 - optuna.study._optimize - INFO - Trial 190 pruned. 
2026-05-15 23:40:33,744 - experiment_functions - INFO - Early stopping at epoch 1250. Best Recall: 0.1175
2026-05-15 23:40:33,842 - optuna.study.study - INFO - Trial 191 finished with value: 0.11747145144501911 and parameters: {'n_layers': 1, 'embedding_dim': 256, 'lr': 0.0006023980625770314, 'lambda_val': 0.00017367126647951125, 'batch_size': 1723, 'optimizer': 'Adam'}. Best is trial 185 with value: 0.12903275879492856.
2026-05-15 23:40:41,135 - experiment_functions - INFO - Early stopping at epoch 1050. Best Recall: 0.1182
