2026-05-16 00:04:45,521 - optuna.study.study - INFO - Trial 58 finished with value: 0.08522843195052987 and parameters: {'n_layers': 1, 'embedding_dim': 64, 'lr': 0.0010197181817643297, 'lambda_val': 0.010213600682259509, 'batch_size': 693, 'optimizer': 'Adam'}. Best is trial 53 with value: 0.11640511090978119.
2026-05-16 00:04:51,321 - experiment_functions - INFO - Early stopping at epoch 850. Best Recall: 0.0910
2026-05-16 00:04:51,430 - optuna.study.study - INFO - Trial 59 finished with value: 0.0910108508946473 and parameters: {'n_layers': 1, 'embedding_dim': 64, 'lr': 0.0012445639175680291, 'lambda_val': 0.010145706835007645, 'batch_size': 652, 'optimizer': 'Adam'}. Best is trial 53 with value: 0.11640511090978119.
2026-05-16 00:05:05,114 - experiment_functions - INFO - Early stopping at epoch 750. Best Recall: 0.1018
2026-05-16 00:05:05,205 - optuna.study.study - INFO - Trial 60 finished with value: 0.10175052700922144 and parameters: {'n_layers': 1, 'embedding_dim': 64, 'lr': 0.002231057880196153, 'lambda_val': 0.002993599737630352, 'batch_size': 831, 'optimizer': 'Adam'}. Best is trial 53 with value: 0.11640511090978119.
2026-05-16 00:05:09,979 - experiment_functions - INFO - Early stopping at epoch 750. Best Recall: 0.0981
2026-05-16 00:05:10,070 - optuna.study.study - INFO - Trial 61 finished with value: 0.0980942041721819 and parameters: {'n_layers': 1, 'embedding_dim': 64, 'lr': 0.002291377342089445, 'lambda_val': 0.0022281714097340546, 'batch_size': 853, 'optimizer': 'Adam'}. Best is trial 53 with value: 0.11640511090978119.
2026-05-16 00:05:14,017 - experiment_functions - INFO - Early stopping at epoch 600. Best Recall: 0.0714
2026-05-16 00:05:14,106 - optuna.study.study - INFO - Trial 62 finished with value: 0.0714015261508875 and parameters: {'n_layers': 1, 'embedding_dim': 64, 'lr': 0.004934539581592265, 'lambda_val': 0.003966801262966679, 'batch_size': 801, 'optimizer': 'Adam'}. Best is trial 53 with value: 0.11640511090978119.
2026-05-16 00:05:18,850 - experiment_functions - INFO - Early stopping at epoch 650. Best Recall: 0.0685
2026-05-16 00:05:18,995 - optuna.study.study - INFO - Trial 63 finished with value: 0.06849179672373162 and parameters: {'n_layers': 1, 'embedding_dim': 64, 'lr': 0.0024393569351991115, 'lambda_val': 0.02117760344544689, 'batch_size': 596, 'optimizer': 'Adam'}. Best is trial 53 with value: 0.11640511090978119.
2026-05-16 00:05:24,070 - experiment_functions - INFO - Early stopping at epoch 800. Best Recall: 0.0888
2026-05-16 00:05:24,213 - optuna.study.study - INFO - Trial 64 finished with value: 0.08879578004084519 and parameters: {'n_layers': 1, 'embedding_dim': 64, 'lr': 0.001572229561577476, 'lambda_val': 0.003114024463774226, 'batch_size': 1043, 'optimizer': 'Adam'}. Best is trial 53 with value: 0.11640511090978119.
2026-05-16 00:05:28,320 - experiment_functions - INFO - Early stopping at epoch 550. Best Recall: 0.0710
2026-05-16 00:05:28,431 - optuna.study.study - INFO - Trial 65 finished with value: 0.0710112173973438 and parameters: {'n_layers': 1, 'embedding_dim': 64, 'lr': 0.010173439396043517, 'lambda_val': 0.008112880976355728, 'batch_size': 721, 'optimizer': 'Adam'}. Best is trial 53 with value: 0.11640511090978119.
2026-05-16 00:05:37,710 - experiment_functions - INFO - Early stopping at epoch 1650. Best Recall: 0.1080
2026-05-16 00:05:37,800 - optuna.study.study - INFO - Trial 66 finished with value: 0.10804152071572823 and parameters: {'n_layers': 1, 'embedding_dim': 64, 'lr': 0.001373188170352358, 'lambda_val': 0.0003996754578554599, 'batch_size': 845, 'optimizer': 'Adam'}. Best is trial 53 with value: 0.11640511090978119.
2026-05-16 00:05:42,890 - experiment_functions - INFO - Early stopping at epoch 900. Best Recall: 0.1037
2026-05-16 00:05:43,045 - optuna.study.study - INFO - Trial 67 finished with value: 0.10367083229959154 and parameters: {'n_layers': 1, 'embedding_dim': 64, 'lr': 0.0019153599110745853, 'lambda_val': 0.0002316111486764175, 'batch_size': 879, 'optimizer': 'Adam'}. Best is trial 53 with value: 0.11640511090978119.
2026-05-16 00:05:48,066 - experiment_functions - INFO - Early stopping at epoch 850. Best Recall: 0.0941
2026-05-16 00:05:48,588 - optuna.study.study - INFO - Trial 68 finished with value: 0.09414374138586333 and parameters: {'n_layers': 1, 'embedding_dim': 64, 'lr': 0.0019566516114773733, 'lambda_val': 0.00022637270412144186, 'batch_size': 535, 'optimizer': 'Adam'}. Best is trial 53 with value: 0.11640511090978119.
2026-05-16 00:05:52,427 - experiment_functions - INFO - Early stopping at epoch 650. Best Recall: 0.0910
2026-05-16 00:05:52,518 - optuna.study.study - INFO - Trial 69 finished with value: 0.09102304078967043 and parameters: {'n_layers': 1, 'embedding_dim': 64, 'lr': 0.00467153045434583, 'lambda_val': 0.0005479434613939095, 'batch_size': 836, 'optimizer': 'Adam'}. Best is trial 53 with value: 0.11640511090978119.
2026-05-16 00:05:57,275 - experiment_functions - INFO - Early stopping at epoch 550. Best Recall: 0.0796
2026-05-16 00:05:57,375 - optuna.study.study - INFO - Trial 70 finished with value: 0.07955092554548396 and parameters: {'n_layers': 1, 'embedding_dim': 64, 'lr': 0.014522153748994977, 'lambda_val': 0.0003965841097846291, 'batch_size': 1112, 'optimizer': 'Adam'}. Best is trial 53 with value: 0.11640511090978119.
2026-05-16 00:06:01,829 - experiment_functions - INFO - Early stopping at epoch 750. Best Recall: 0.0903
2026-05-16 00:06:01,929 - optuna.study.study - INFO - Trial 71 finished with value: 0.09030578344938975 and parameters: {'n_layers': 1, 'embedding_dim': 64, 'lr': 0.0032474671610753917, 'lambda_val': 0.0008835865644187121, 'batch_size': 996, 'optimizer': 'Adam'}. Best is trial 53 with value: 0.11640511090978119.
2026-05-16 00:06:09,303 - experiment_functions - INFO - Early stopping at epoch 1200. Best Recall: 0.1071
2026-05-16 00:06:09,413 - optuna.study.study - INFO - Trial 72 finished with value: 0.10713669823676782 and parameters: {'n_layers': 1, 'embedding_dim': 64, 'lr': 0.001541727940246275, 'lambda_val': 0.00027892334744006997, 'batch_size': 887, 'optimizer': 'Adam'}. Best is trial 53 with value: 0.11640511090978119.
2026-05-16 00:06:14,934 - experiment_functions - INFO - Early stopping at epoch 950. Best Recall: 0.1044
2026-05-16 00:06:15,046 - optuna.study.study - INFO - Trial 73 finished with value: 0.10438874259265676 and parameters: {'n_layers': 1, 'embedding_dim': 64, 'lr': 0.001736989070310811, 'lambda_val': 0.00015760801302667165, 'batch_size': 819, 'optimizer': 'Adam'}. Best is trial 53 with value: 0.11640511090978119.
2026-05-16 00:06:20,492 - experiment_functions - INFO - Early stopping at epoch 1000. Best Recall: 0.0902
2026-05-16 00:06:20,605 - optuna.study.study - INFO - Trial 74 finished with value: 0.0901971074982375 and parameters: {'n_layers': 1, 'embedding_dim': 64, 'lr': 0.0024390938361567695, 'lambda_val': 0.00014396470068389446, 'batch_size': 785, 'optimizer': 'Adam'}. Best is trial 53 with value: 0.11640511090978119.
2026-05-16 00:06:27,616 - experiment_functions - INFO - Early stopping at epoch 1250. Best Recall: 0.1005
2026-05-16 00:06:27,760 - optuna.study.study - INFO - Trial 75 finished with value: 0.10047975442771089 and parameters: {'n_layers': 1, 'embedding_dim': 64, 'lr': 0.0016487465446637078, 'lambda_val': 0.000217446191694621, 'batch_size': 867, 'optimizer': 'Adam'}. Best is trial 53 with value: 0.11640511090978119.
2026-05-16 00:06:33,199 - experiment_functions - INFO - Early stopping at epoch 950. Best Recall: 0.0813
2026-05-16 00:06:33,299 - optuna.study.study - INFO - Trial 76 finished with value: 0.08132988443197027 and parameters: {'n_layers': 1, 'embedding_dim': 64, 'lr': 0.0016922883913969733, 'lambda_val': 0.0002721857508017254, 'batch_size': 1181, 'optimizer': 'Adam'}. Best is trial 53 with value: 0.11640511090978119.
2026-05-16 00:06:42,277 - experiment_functions - INFO - Early stopping at epoch 1550. Best Recall: 0.0872
2026-05-16 00:06:42,412 - optuna.study.study - INFO - Trial 77 finished with value: 0.08721356086309083 and parameters: {'n_layers': 1, 'embedding_dim': 64, 'lr': 0.0006691594496410937, 'lambda_val': 0.00010789080791841835, 'batch_size': 3036, 'optimizer': 'Adam'}. Best is trial 53 with value: 0.11640511090978119.
2026-05-16 00:06:48,376 - experiment_functions - INFO - Early stopping at epoch 1050. Best Recall: 0.1190
2026-05-16 00:06:48,482 - optuna.study.study - INFO - Trial 78 finished with value: 0.11897276065240035 and parameters: {'n_layers': 1, 'embedding_dim': 64, 'lr': 0.0013986460320594518, 'lambda_val': 0.0003613389677122673, 'batch_size': 1077, 'optimizer': 'Adam'}. Best is trial 78 with value: 0.11897276065240035.
2026-05-16 00:06:52,761 - experiment_functions - INFO - Early stopping at epoch 550. Best Recall: 0.0263
2026-05-16 00:06:52,861 - optuna.study.study - INFO - Trial 79 finished with value: 0.026314327955139678 and parameters: {'n_layers': 4, 'embedding_dim': 64, 'lr': 0.003992857331371377, 'lambda_val': 0.00031660804919102583, 'batch_size': 1017, 'optimizer': 'Adam'}. Best is trial 78 with value: 0.11897276065240035.
2026-05-16 00:06:57,047 - experiment_functions - INFO - Early stopping at epoch 550. Best Recall: 0.1039
2026-05-16 00:06:57,147 - optuna.study.study - INFO - Trial 80 finished with value: 0.10387213474161827 and parameters: {'n_layers': 1, 'embedding_dim': 64, 'lr': 0.006055876994152806, 'lambda_val': 0.0006196598333879754, 'batch_size': 3541, 'optimizer': 'Adam'}. Best is trial 78 with value: 0.11897276065240035.
2026-05-16 00:07:00,897 - experiment_functions - INFO - Early stopping at epoch 550. Best Recall: 0.0871
2026-05-16 00:07:01,019 - optuna.study.study - INFO - Trial 81 finished with value: 0.08710093828251093 and parameters: {'n_layers': 1, 'embedding_dim': 64, 'lr': 0.0067045805788940975, 'lambda_val': 0.0006367657930487442, 'batch_size': 3463, 'optimizer': 'Adam'}. Best is trial 78 with value: 0.11897276065240035.
2026-05-16 00:07:05,063 - experiment_functions - INFO - Early stopping at epoch 650. Best Recall: 0.1081
2026-05-16 00:07:05,156 - optuna.study.study - INFO - Trial 82 finished with value: 0.10808121044938501 and parameters: {'n_layers': 1, 'embedding_dim': 64, 'lr': 0.0026250550522439685, 'lambda_val': 0.00016645765996193185, 'batch_size': 2644, 'optimizer': 'Adam'}. Best is trial 78 with value: 0.11897276065240035.
2026-05-16 00:07:09,521 - experiment_functions - INFO - Early stopping at epoch 600. Best Recall: 0.0676
2026-05-16 00:07:09,624 - optuna.study.study - INFO - Trial 83 finished with value: 0.06757296915203699 and parameters: {'n_layers': 1, 'embedding_dim': 256, 'lr': 0.01642971624938716, 'lambda_val': 0.00015425036757516045, 'batch_size': 3698, 'optimizer': 'Adam'}. Best is trial 78 with value: 0.11897276065240035.
2026-05-16 00:07:16,579 - experiment_functions - INFO - Early stopping at epoch 850. Best Recall: 0.0969
2026-05-16 00:07:16,669 - optuna.study.study - INFO - Trial 84 finished with value: 0.09685798879009433 and parameters: {'n_layers': 1, 'embedding_dim': 64, 'lr': 0.0013407419111569295, 'lambda_val': 0.00033755581929128923, 'batch_size': 2888, 'optimizer': 'Adam'}. Best is trial 78 with value: 0.11897276065240035.
2026-05-16 00:07:20,666 - experiment_functions - INFO - Early stopping at epoch 600. Best Recall: 0.0828
2026-05-16 00:07:20,766 - optuna.study.study - INFO - Trial 85 finished with value: 0.0827524541182868 and parameters: {'n_layers': 1, 'embedding_dim': 64, 'lr': 0.002989437480685089, 'lambda_val': 0.0004480538623613352, 'batch_size': 2564, 'optimizer': 'Adam'}. Best is trial 78 with value: 0.11897276065240035.
2026-05-16 00:07:24,342 - experiment_functions - INFO - Early stopping at epoch 500. Best Recall: 0.0025
2026-05-16 00:07:24,451 - optuna.study.study - INFO - Trial 86 finished with value: 0.0024640895481588113 and parameters: {'n_layers': 1, 'embedding_dim': 96, 'lr': 0.006806560495243442, 'lambda_val': 6.336406647874132e-05, 'batch_size': 2418, 'optimizer': 'SGD'}. Best is trial 78 with value: 0.11897276065240035.
2026-05-16 00:07:28,394 - experiment_functions - INFO - Early stopping at epoch 550. Best Recall: 0.1009
2026-05-16 00:07:28,682 - optuna.study.study - INFO - Trial 87 finished with value: 0.10090418410852629 and parameters: {'n_layers': 1, 'embedding_dim': 64, 'lr': 0.005520976812921119, 'lambda_val': 0.0009980848966217527, 'batch_size': 4009, 'optimizer': 'Adam'}. Best is trial 78 with value: 0.11897276065240035.
2026-05-16 00:07:33,327 - experiment_functions - INFO - Early stopping at epoch 700. Best Recall: 0.0814
2026-05-16 00:07:33,407 - optuna.study.study - INFO - Trial 88 finished with value: 0.08137866485217704 and parameters: {'n_layers': 1, 'embedding_dim': 64, 'lr': 0.0028742444548114404, 'lambda_val': 0.00010226335923834883, 'batch_size': 3258, 'optimizer': 'Adam'}. Best is trial 78 with value: 0.11897276065240035.
2026-05-16 00:07:40,494 - optuna.study._optimize - INFO - Trial 89 pruned. 
2026-05-16 00:07:47,838 - experiment_functions - INFO - Early stopping at epoch 1050. Best Recall: 0.1073
2026-05-16 00:07:47,938 - optuna.study.study - INFO - Trial 90 finished with value: 0.10734880426265032 and parameters: {'n_layers': 1, 'embedding_dim': 128, 'lr': 0.0013453196194557484, 'lambda_val': 0.0006728140760453049, 'batch_size': 1183, 'optimizer': 'Adam'}. Best is trial 78 with value: 0.11897276065240035.
2026-05-16 00:07:53,887 - experiment_functions - INFO - Early stopping at epoch 950. Best Recall: 0.1101
2026-05-16 00:07:54,064 - optuna.study.study - INFO - Trial 91 finished with value: 0.11014954263233863 and parameters: {'n_layers': 1, 'embedding_dim': 128, 'lr': 0.0013845427029278636, 'lambda_val': 0.0006194243480718886, 'batch_size': 1171, 'optimizer': 'Adam'}. Best is trial 78 with value: 0.11897276065240035.
2026-05-16 00:08:00,625 - experiment_functions - INFO - Early stopping at epoch 1100. Best Recall: 0.0890
2026-05-16 00:08:00,760 - optuna.study.study - INFO - Trial 92 finished with value: 0.08903126899064093 and parameters: {'n_layers': 1, 'embedding_dim': 128, 'lr': 0.0018129316191505345, 'lambda_val': 0.00017473424640914356, 'batch_size': 1217, 'optimizer': 'Adam'}. Best is trial 78 with value: 0.11897276065240035.
2026-05-16 00:08:08,396 - experiment_functions - INFO - Early stopping at epoch 1250. Best Recall: 0.1225
2026-05-16 00:08:08,501 - optuna.study.study - INFO - Trial 93 finished with value: 0.1224843370048252 and parameters: {'n_layers': 1, 'embedding_dim': 128, 'lr': 0.0008798671168166045, 'lambda_val': 0.000644535778753092, 'batch_size': 1105, 'optimizer': 'Adam'}. Best is trial 93 with value: 0.1224843370048252.
2026-05-16 00:08:14,003 - experiment_functions - INFO - Early stopping at epoch 850. Best Recall: 0.1022
2026-05-16 00:08:14,159 - optuna.study.study - INFO - Trial 94 finished with value: 0.10215864832506082 and parameters: {'n_layers': 1, 'embedding_dim': 128, 'lr': 0.0014279525561976835, 'lambda_val': 0.0006554234110344559, 'batch_size': 1355, 'optimizer': 'Adam'}. Best is trial 93 with value: 0.1224843370048252.
2026-05-16 00:08:21,518 - experiment_functions - INFO - Early stopping at epoch 1150. Best Recall: 0.1044
2026-05-16 00:08:21,628 - optuna.study.study - INFO - Trial 95 finished with value: 0.10443194458400609 and parameters: {'n_layers': 1, 'embedding_dim': 128, 'lr': 0.0008590894367622911, 'lambda_val': 0.0003794405254941314, 'batch_size': 3712, 'optimizer': 'Adam'}. Best is trial 93 with value: 0.1224843370048252.
2026-05-16 00:08:25,456 - experiment_functions - INFO - Early stopping at epoch 500. Best Recall: 0.0027
2026-05-16 00:08:25,547 - optuna.study.study - INFO - Trial 96 finished with value: 0.002718021137329708 and parameters: {'n_layers': 1, 'embedding_dim': 128, 'lr': 0.0009016035788674821, 'lambda_val': 0.0004007724302247132, 'batch_size': 1089, 'optimizer': 'SGD'}. Best is trial 93 with value: 0.1224843370048252.
2026-05-16 00:08:41,843 - experiment_functions - INFO - Early stopping at epoch 2950. Best Recall: 0.1099
2026-05-16 00:08:41,944 - optuna.study.study - INFO - Trial 97 finished with value: 0.10991786107516856 and parameters: {'n_layers': 1, 'embedding_dim': 128, 'lr': 0.0005474017784102729, 'lambda_val': 0.00012504617643128063, 'batch_size': 1140, 'optimizer': 'Adam'}. Best is trial 93 with value: 0.1224843370048252.
2026-05-16 00:09:03,748 - experiment_functions - INFO - Early stopping at epoch 3550. Best Recall: 0.1195
2026-05-16 00:09:03,839 - optuna.study.study - INFO - Trial 98 finished with value: 0.11951843301615356 and parameters: {'n_layers': 1, 'embedding_dim': 128, 'lr': 0.0004843387039040761, 'lambda_val': 0.0007702694862723821, 'batch_size': 1155, 'optimizer': 'Adam'}. Best is trial 93 with value: 0.1224843370048252.
2026-05-16 00:09:14,929 - experiment_functions - INFO - Early stopping at epoch 2000. Best Recall: 0.1037
2026-05-16 00:09:15,019 - optuna.study.study - INFO - Trial 99 finished with value: 0.1037069684828859 and parameters: {'n_layers': 1, 'embedding_dim': 128, 'lr': 0.00047712375103036266, 'lambda_val': 0.0008297630128529485, 'batch_size': 1273, 'optimizer': 'Adam'}. Best is trial 93 with value: 0.1224843370048252.
2026-05-16 00:09:28,762 - experiment_functions - INFO - Early stopping at epoch 2450. Best Recall: 0.1183
2026-05-16 00:09:28,860 - optuna.study.study - INFO - Trial 100 finished with value: 0.11826108496770482 and parameters: {'n_layers': 1, 'embedding_dim': 128, 'lr': 0.0005967189405900316, 'lambda_val': 0.0002809942299284858, 'batch_size': 1400, 'optimizer': 'Adam'}. Best is trial 93 with value: 0.1224843370048252.
2026-05-16 00:09:44,747 - experiment_functions - INFO - Early stopping at epoch 3150. Best Recall: 0.0983
2026-05-16 00:09:44,817 - optuna.study.study - INFO - Trial 101 finished with value: 0.09826089894121869 and parameters: {'n_layers': 1, 'embedding_dim': 128, 'lr': 0.0004142037668803203, 'lambda_val': 0.0004951708031083252, 'batch_size': 1158, 'optimizer': 'Adam'}. Best is trial 93 with value: 0.1224843370048252.
2026-05-16 00:09:54,591 - experiment_functions - INFO - Early stopping at epoch 1900. Best Recall: 0.1194
2026-05-16 00:09:54,673 - optuna.study.study - INFO - Trial 102 finished with value: 0.11938790899475983 and parameters: {'n_layers': 1, 'embedding_dim': 128, 'lr': 0.0005835834081341186, 'lambda_val': 0.00026204860146716207, 'batch_size': 1401, 'optimizer': 'Adam'}. Best is trial 93 with value: 0.1224843370048252.
2026-05-16 00:10:06,773 - experiment_functions - INFO - Early stopping at epoch 2300. Best Recall: 0.1161
2026-05-16 00:10:06,874 - optuna.study.study - INFO - Trial 103 finished with value: 0.11614155988678902 and parameters: {'n_layers': 1, 'embedding_dim': 128, 'lr': 0.0005950582717240345, 'lambda_val': 0.00011793560341872983, 'batch_size': 1393, 'optimizer': 'Adam'}. Best is trial 93 with value: 0.1224843370048252.
2026-05-16 00:10:17,279 - experiment_functions - INFO - Early stopping at epoch 1750. Best Recall: 0.1156
2026-05-16 00:10:17,377 - optuna.study.study - INFO - Trial 104 finished with value: 0.11557315010981938 and parameters: {'n_layers': 1, 'embedding_dim': 128, 'lr': 0.0005748063294211963, 'lambda_val': 5.092845428695448e-05, 'batch_size': 1396, 'optimizer': 'Adam'}. Best is trial 93 with value: 0.1224843370048252.
2026-05-16 00:10:30,779 - experiment_functions - INFO - Early stopping at epoch 2150. Best Recall: 0.1086
2026-05-16 00:10:30,882 - optuna.study.study - INFO - Trial 105 finished with value: 0.10863574772932548 and parameters: {'n_layers': 1, 'embedding_dim': 128, 'lr': 0.0005731249322304283, 'lambda_val': 4.389143679785179e-05, 'batch_size': 1494, 'optimizer': 'Adam'}. Best is trial 93 with value: 0.1224843370048252.
2026-05-16 00:10:43,052 - experiment_functions - INFO - Early stopping at epoch 2150. Best Recall: 0.1059
2026-05-16 00:10:43,224 - optuna.study.study - INFO - Trial 106 finished with value: 0.10591212732845096 and parameters: {'n_layers': 1, 'embedding_dim': 128, 'lr': 0.0005806064958124173, 'lambda_val': 4.8352753530554984e-05, 'batch_size': 1593, 'optimizer': 'Adam'}. Best is trial 93 with value: 0.1224843370048252.
2026-05-16 00:11:01,465 - experiment_functions - INFO - Early stopping at epoch 3300. Best Recall: 0.1268
2026-05-16 00:11:01,556 - optuna.study.study - INFO - Trial 107 finished with value: 0.126837902146722 and parameters: {'n_layers': 1, 'embedding_dim': 128, 'lr': 0.0005020809665969207, 'lambda_val': 7.852232288383267e-05, 'batch_size': 1393, 'optimizer': 'Adam'}. Best is trial 107 with value: 0.126837902146722.
2026-05-16 00:11:09,892 - optuna.study._optimize - INFO - Trial 108 pruned. 
2026-05-16 00:11:26,584 - optuna.study._optimize - INFO - Trial 109 pruned. 
2026-05-16 00:11:30,326 - experiment_functions - INFO - Early stopping at epoch 500. Best Recall: 0.0031
2026-05-16 00:11:30,435 - optuna.study.study - INFO - Trial 110 finished with value: 0.003084748928474431 and parameters: {'n_layers': 1, 'embedding_dim': 128, 'lr': 0.0004758252018236347, 'lambda_val': 7.935379312698638e-05, 'batch_size': 1356, 'optimizer': 'SGD'}. Best is trial 107 with value: 0.126837902146722.
2026-05-16 00:11:41,502 - experiment_functions - INFO - Early stopping at epoch 2000. Best Recall: 0.1117
2026-05-16 00:11:41,593 - optuna.study.study - INFO - Trial 111 finished with value: 0.11169573087945504 and parameters: {'n_layers': 1, 'embedding_dim': 128, 'lr': 0.0006004550322854249, 'lambda_val': 3.9218969302959264e-05, 'batch_size': 1467, 'optimizer': 'Adam'}. Best is trial 107 with value: 0.126837902146722.
2026-05-16 00:11:48,029 - optuna.study._optimize - INFO - Trial 112 pruned. 
2026-05-16 00:12:00,404 - experiment_functions - INFO - Early stopping at epoch 1900. Best Recall: 0.1044
