2026-05-15 19:15:55,985 - optuna.study.study - INFO - Trial 171 finished with value: 0.13831907738264312 and parameters: {'n_layers': 1, 'embedding_dim': 256, 'lr': 0.0006801735662329323, 'lambda_val': 1.002533373704713e-06, 'batch_size': 1870, 'optimizer': 'Adam'}. Best is trial 65 with value: 0.14314842153817933.
2026-05-15 19:16:11,423 - optuna.study._optimize - INFO - Trial 172 pruned. 
2026-05-15 19:16:19,532 - optuna.study._optimize - INFO - Trial 173 pruned. 
2026-05-15 19:16:26,997 - optuna.study._optimize - INFO - Trial 174 pruned. 
2026-05-15 19:16:34,613 - optuna.study._optimize - INFO - Trial 175 pruned. 
2026-05-15 19:16:41,849 - optuna.study._optimize - INFO - Trial 176 pruned. 
2026-05-15 19:16:45,724 - experiment_functions - INFO - Early stopping at epoch 500. Best Recall: 0.0007
2026-05-15 19:16:45,837 - optuna.study.study - INFO - Trial 177 finished with value: 0.0007473181206629477 and parameters: {'n_layers': 1, 'embedding_dim': 256, 'lr': 0.0007728521856744084, 'lambda_val': 3.518359724646682e-06, 'batch_size': 2103, 'optimizer': 'SGD'}. Best is trial 65 with value: 0.14314842153817933.
2026-05-15 19:16:53,222 - optuna.study._optimize - INFO - Trial 178 pruned. 
2026-05-15 19:17:00,425 - optuna.study._optimize - INFO - Trial 179 pruned. 
2026-05-15 19:17:04,502 - experiment_functions - INFO - Early stopping at epoch 550. Best Recall: 0.0201
2026-05-15 19:17:04,614 - optuna.study.study - INFO - Trial 180 finished with value: 0.02013338372511561 and parameters: {'n_layers': 1, 'embedding_dim': 96, 'lr': 0.09348746901441987, 'lambda_val': 1.7505136010737828e-06, 'batch_size': 1714, 'optimizer': 'Adam'}. Best is trial 65 with value: 0.14314842153817933.
2026-05-15 19:17:15,618 - experiment_functions - INFO - Early stopping at epoch 1550. Best Recall: 0.1359
2026-05-15 19:17:15,775 - optuna.study.study - INFO - Trial 181 finished with value: 0.13585215255549038 and parameters: {'n_layers': 1, 'embedding_dim': 256, 'lr': 0.0006630218413696707, 'lambda_val': 8.25527560205238e-06, 'batch_size': 1499, 'optimizer': 'Adam'}. Best is trial 65 with value: 0.14314842153817933.
2026-05-15 19:17:23,954 - optuna.study._optimize - INFO - Trial 182 pruned. 
2026-05-15 19:17:32,048 - optuna.study._optimize - INFO - Trial 183 pruned. 
2026-05-15 19:17:48,722 - optuna.study._optimize - INFO - Trial 184 pruned. 
2026-05-15 19:17:55,975 - optuna.study._optimize - INFO - Trial 185 pruned. 
2026-05-15 19:18:08,119 - optuna.study._optimize - INFO - Trial 186 pruned. 
2026-05-15 19:18:20,378 - optuna.study._optimize - INFO - Trial 187 pruned. 
2026-05-15 19:18:27,421 - optuna.study._optimize - INFO - Trial 188 pruned. 
2026-05-15 19:18:35,784 - optuna.study._optimize - INFO - Trial 189 pruned. 
2026-05-15 19:18:41,700 - experiment_functions - INFO - Early stopping at epoch 850. Best Recall: 0.1138
2026-05-15 19:18:41,853 - optuna.study.study - INFO - Trial 190 finished with value: 0.11377178966617617 and parameters: {'n_layers': 1, 'embedding_dim': 256, 'lr': 0.0013121490433787156, 'lambda_val': 0.000830155561028389, 'batch_size': 1488, 'optimizer': 'Adam'}. Best is trial 65 with value: 0.14314842153817933.
2026-05-15 19:18:49,291 - optuna.study._optimize - INFO - Trial 191 pruned. 
2026-05-15 19:19:06,961 - experiment_functions - INFO - Early stopping at epoch 1600. Best Recall: 0.1357
2026-05-15 19:19:07,500 - optuna.study.study - INFO - Trial 192 finished with value: 0.13566808413154338 and parameters: {'n_layers': 1, 'embedding_dim': 256, 'lr': 0.000546690365132212, 'lambda_val': 1.2785443505634055e-05, 'batch_size': 1918, 'optimizer': 'Adam'}. Best is trial 65 with value: 0.14314842153817933.
2026-05-15 19:19:15,544 - optuna.study._optimize - INFO - Trial 193 pruned. 
2026-05-15 19:19:22,982 - optuna.study._optimize - INFO - Trial 194 pruned. 
2026-05-15 19:19:29,848 - optuna.study._optimize - INFO - Trial 195 pruned. 
2026-05-15 19:19:38,055 - optuna.study._optimize - INFO - Trial 196 pruned. 
2026-05-15 19:19:48,743 - experiment_functions - INFO - Early stopping at epoch 550. Best Recall: 0.0435
2026-05-15 19:19:49,262 - optuna.study.study - INFO - Trial 197 finished with value: 0.043455970087629886 and parameters: {'n_layers': 1, 'embedding_dim': 256, 'lr': 0.02216297505067829, 'lambda_val': 0.00039463418414056693, 'batch_size': 1934, 'optimizer': 'Adam'}. Best is trial 65 with value: 0.14314842153817933.
2026-05-15 19:19:57,743 - experiment_functions - INFO - Early stopping at epoch 900. Best Recall: 0.1030
2026-05-15 19:19:57,869 - optuna.study.study - INFO - Trial 198 finished with value: 0.10299499545391393 and parameters: {'n_layers': 1, 'embedding_dim': 256, 'lr': 0.00103061702803613, 'lambda_val': 6.34719977630627e-06, 'batch_size': 1804, 'optimizer': 'RMSprop'}. Best is trial 65 with value: 0.14314842153817933.
2026-05-15 19:20:04,848 - optuna.study._optimize - INFO - Trial 199 pruned. 
2026-05-15 19:20:11,796 - optuna.study._optimize - INFO - Trial 200 pruned. 
2026-05-15 19:20:18,744 - optuna.study._optimize - INFO - Trial 201 pruned. 
2026-05-15 19:20:25,374 - experiment_functions - INFO - Early stopping at epoch 900. Best Recall: 0.1213
2026-05-15 19:20:25,487 - optuna.study.study - INFO - Trial 202 finished with value: 0.1213104765535805 and parameters: {'n_layers': 1, 'embedding_dim': 256, 'lr': 0.0008782526371770186, 'lambda_val': 2.4477255923369675e-05, 'batch_size': 2146, 'optimizer': 'Adam'}. Best is trial 65 with value: 0.14314842153817933.
2026-05-15 19:20:32,121 - optuna.study._optimize - INFO - Trial 203 pruned. 
2026-05-15 19:20:38,850 - optuna.study._optimize - INFO - Trial 204 pruned. 
2026-05-15 19:20:45,865 - optuna.study._optimize - INFO - Trial 205 pruned. 
2026-05-15 19:20:59,735 - optuna.study._optimize - INFO - Trial 206 pruned. 
2026-05-15 19:21:08,803 - optuna.study._optimize - INFO - Trial 207 pruned. 
2026-05-15 19:21:15,975 - optuna.study._optimize - INFO - Trial 208 pruned. 
2026-05-15 19:21:22,970 - optuna.study._optimize - INFO - Trial 209 pruned. 
2026-05-15 19:21:26,689 - experiment_functions - INFO - Early stopping at epoch 500. Best Recall: 0.0010
2026-05-15 19:21:26,799 - optuna.study.study - INFO - Trial 210 finished with value: 0.0009993206250370715 and parameters: {'n_layers': 1, 'embedding_dim': 64, 'lr': 0.0006002791269649558, 'lambda_val': 1.472777845645421e-05, 'batch_size': 1301, 'optimizer': 'SGD'}. Best is trial 65 with value: 0.14314842153817933.
2026-05-15 19:21:33,875 - experiment_functions - INFO - Early stopping at epoch 900. Best Recall: 0.1366
2026-05-15 19:21:34,009 - optuna.study.study - INFO - Trial 211 finished with value: 0.1365626604858218 and parameters: {'n_layers': 1, 'embedding_dim': 256, 'lr': 0.0010159455954364526, 'lambda_val': 1.0131350793192717e-06, 'batch_size': 1683, 'optimizer': 'Adam'}. Best is trial 65 with value: 0.14314842153817933.
2026-05-15 19:21:40,415 - experiment_functions - INFO - Early stopping at epoch 850. Best Recall: 0.1250
2026-05-15 19:21:40,544 - optuna.study.study - INFO - Trial 212 finished with value: 0.1250466244800589 and parameters: {'n_layers': 1, 'embedding_dim': 256, 'lr': 0.0013241631660556204, 'lambda_val': 1.507679996448089e-06, 'batch_size': 1686, 'optimizer': 'Adam'}. Best is trial 65 with value: 0.14314842153817933.
2026-05-15 19:21:46,453 - experiment_functions - INFO - Early stopping at epoch 800. Best Recall: 0.1182
2026-05-15 19:21:46,565 - optuna.study.study - INFO - Trial 213 finished with value: 0.11816032898982012 and parameters: {'n_layers': 1, 'embedding_dim': 256, 'lr': 0.000980443824725684, 'lambda_val': 1.2968828167475446e-06, 'batch_size': 3116, 'optimizer': 'Adam'}. Best is trial 65 with value: 0.14314842153817933.
2026-05-15 19:21:53,978 - optuna.study._optimize - INFO - Trial 214 pruned. 
2026-05-15 19:22:00,877 - optuna.study._optimize - INFO - Trial 215 pruned. 
2026-05-15 19:22:07,243 - experiment_functions - INFO - Early stopping at epoch 950. Best Recall: 0.1290
2026-05-15 19:22:07,344 - optuna.study.study - INFO - Trial 216 finished with value: 0.12899353999629878 and parameters: {'n_layers': 1, 'embedding_dim': 256, 'lr': 0.0008591588652267973, 'lambda_val': 2.2749501620493287e-06, 'batch_size': 1807, 'optimizer': 'Adam'}. Best is trial 65 with value: 0.14314842153817933.
2026-05-15 19:22:13,076 - experiment_functions - INFO - Early stopping at epoch 750. Best Recall: 0.1220
2026-05-15 19:22:13,177 - optuna.study.study - INFO - Trial 217 finished with value: 0.12201154064815246 and parameters: {'n_layers': 1, 'embedding_dim': 256, 'lr': 0.0015243654099312569, 'lambda_val': 2.20150273552912e-06, 'batch_size': 1818, 'optimizer': 'Adam'}. Best is trial 65 with value: 0.14314842153817933.
2026-05-15 19:22:20,502 - optuna.study._optimize - INFO - Trial 218 pruned. 
2026-05-15 19:22:26,661 - experiment_functions - INFO - Early stopping at epoch 850. Best Recall: 0.1097
2026-05-15 19:22:26,795 - optuna.study.study - INFO - Trial 219 finished with value: 0.10968721925842888 and parameters: {'n_layers': 1, 'embedding_dim': 256, 'lr': 0.0011269051740435982, 'lambda_val': 3.1255961090239045e-06, 'batch_size': 1752, 'optimizer': 'Adam'}. Best is trial 65 with value: 0.14314842153817933.
2026-05-15 19:22:35,892 - optuna.study._optimize - INFO - Trial 220 pruned. 
2026-05-15 19:22:50,272 - optuna.study._optimize - INFO - Trial 221 pruned. 
2026-05-15 19:22:57,741 - optuna.study._optimize - INFO - Trial 222 pruned. 
2026-05-15 19:23:05,491 - optuna.study._optimize - INFO - Trial 223 pruned. 
2026-05-15 19:23:13,021 - optuna.study._optimize - INFO - Trial 224 pruned. 
2026-05-15 19:23:20,070 - optuna.study._optimize - INFO - Trial 225 pruned. 
2026-05-15 19:23:27,704 - optuna.study._optimize - INFO - Trial 226 pruned. 
2026-05-15 19:23:35,640 - optuna.study._optimize - INFO - Trial 227 pruned. 
2026-05-15 19:23:43,360 - optuna.study._optimize - INFO - Trial 228 pruned. 
2026-05-15 19:23:50,614 - optuna.study._optimize - INFO - Trial 229 pruned. 
2026-05-15 19:23:57,288 - optuna.study._optimize - INFO - Trial 230 pruned. 
2026-05-15 19:24:04,658 - experiment_functions - INFO - Early stopping at epoch 1050. Best Recall: 0.1383
2026-05-15 19:24:04,767 - optuna.study.study - INFO - Trial 231 finished with value: 0.13827257822159333 and parameters: {'n_layers': 1, 'embedding_dim': 256, 'lr': 0.0009347696523636994, 'lambda_val': 1.2239045861462593e-06, 'batch_size': 1715, 'optimizer': 'Adam'}. Best is trial 65 with value: 0.14314842153817933.
2026-05-15 19:24:11,765 - optuna.study._optimize - INFO - Trial 232 pruned. 
2026-05-15 19:24:18,731 - optuna.study._optimize - INFO - Trial 233 pruned. 
2026-05-15 19:24:26,085 - optuna.study._optimize - INFO - Trial 234 pruned. 
2026-05-15 19:24:33,038 - optuna.study._optimize - INFO - Trial 235 pruned. 
2026-05-15 19:24:41,427 - experiment_functions - INFO - Early stopping at epoch 1150. Best Recall: 0.1401
2026-05-15 19:24:41,544 - optuna.study.study - INFO - Trial 236 finished with value: 0.14005843077366203 and parameters: {'n_layers': 1, 'embedding_dim': 256, 'lr': 0.0008111453408083162, 'lambda_val': 1.9926415686902533e-06, 'batch_size': 1617, 'optimizer': 'Adam'}. Best is trial 65 with value: 0.14314842153817933.
2026-05-15 19:24:48,065 - experiment_functions - INFO - Early stopping at epoch 900. Best Recall: 0.1048
2026-05-15 19:24:48,205 - optuna.study.study - INFO - Trial 237 finished with value: 0.1047634728613228 and parameters: {'n_layers': 1, 'embedding_dim': 256, 'lr': 0.0012469742713648116, 'lambda_val': 2.2616404182340538e-06, 'batch_size': 1620, 'optimizer': 'Adam'}. Best is trial 65 with value: 0.14314842153817933.
2026-05-15 19:24:55,571 - optuna.study._optimize - INFO - Trial 238 pruned. 
2026-05-15 19:25:03,463 - optuna.study._optimize - INFO - Trial 239 pruned. 
2026-05-15 19:25:08,296 - experiment_functions - INFO - Early stopping at epoch 650. Best Recall: 0.0887
2026-05-15 19:25:08,406 - optuna.study.study - INFO - Trial 240 finished with value: 0.08872616324928854 and parameters: {'n_layers': 1, 'embedding_dim': 256, 'lr': 0.0017417889255969643, 'lambda_val': 1.0097187092749586e-06, 'batch_size': 1576, 'optimizer': 'RMSprop'}. Best is trial 65 with value: 0.14314842153817933.
2026-05-15 19:25:15,660 - optuna.study._optimize - INFO - Trial 241 pruned. 
2026-05-15 19:25:25,107 - optuna.study._optimize - INFO - Trial 242 pruned. 
2026-05-15 19:25:33,569 - optuna.study._optimize - INFO - Trial 243 pruned. 
2026-05-15 19:25:41,139 - optuna.study._optimize - INFO - Trial 244 pruned. 
2026-05-15 19:25:49,068 - optuna.study._optimize - INFO - Trial 245 pruned. 
2026-05-15 19:26:03,840 - experiment_functions - INFO - Early stopping at epoch 2100. Best Recall: 0.1405
2026-05-15 19:26:04,008 - optuna.study.study - INFO - Trial 246 finished with value: 0.1405317016964043 and parameters: {'n_layers': 1, 'embedding_dim': 256, 'lr': 0.0004490279857861611, 'lambda_val': 1.055480837590763e-05, 'batch_size': 2365, 'optimizer': 'Adam'}. Best is trial 65 with value: 0.14314842153817933.
2026-05-15 19:26:11,591 - optuna.study._optimize - INFO - Trial 247 pruned. 
2026-05-15 19:26:18,482 - optuna.study._optimize - INFO - Trial 248 pruned. 
2026-05-15 19:26:26,850 - optuna.study._optimize - INFO - Trial 249 pruned. 
2026-05-15 19:26:30,694 - experiment_functions - INFO - Early stopping at epoch 500. Best Recall: 0.0014
2026-05-15 19:26:30,795 - optuna.study.study - INFO - Trial 250 finished with value: 0.001392443487501019 and parameters: {'n_layers': 1, 'embedding_dim': 256, 'lr': 0.0004263817819010555, 'lambda_val': 1.551507704075257e-06, 'batch_size': 1830, 'optimizer': 'SGD'}. Best is trial 65 with value: 0.14314842153817933.
2026-05-15 19:26:37,752 - optuna.study._optimize - INFO - Trial 251 pruned. 
2026-05-15 19:26:45,107 - experiment_functions - INFO - Early stopping at epoch 1000. Best Recall: 0.1294
2026-05-15 19:26:45,208 - optuna.study.study - INFO - Trial 252 finished with value: 0.12938452653831276 and parameters: {'n_layers': 1, 'embedding_dim': 256, 'lr': 0.0009428921356793065, 'lambda_val': 5.991323190698037e-06, 'batch_size': 1479, 'optimizer': 'Adam'}. Best is trial 65 with value: 0.14314842153817933.
2026-05-15 19:26:51,544 - optuna.study._optimize - INFO - Trial 253 pruned. 
2026-05-15 19:26:58,241 - experiment_functions - INFO - Early stopping at epoch 900. Best Recall: 0.1235
2026-05-15 19:26:58,341 - optuna.study.study - INFO - Trial 254 finished with value: 0.123474528284405 and parameters: {'n_layers': 1, 'embedding_dim': 256, 'lr': 0.0013103614824793942, 'lambda_val': 5.87993877224495e-06, 'batch_size': 1379, 'optimizer': 'Adam'}. Best is trial 65 with value: 0.14314842153817933.
2026-05-15 19:27:05,752 - optuna.study._optimize - INFO - Trial 255 pruned. 
2026-05-15 19:27:14,547 - experiment_functions - INFO - Early stopping at epoch 1300. Best Recall: 0.1339
2026-05-15 19:27:14,649 - optuna.study.study - INFO - Trial 256 finished with value: 0.13387908475426083 and parameters: {'n_layers': 1, 'embedding_dim': 256, 'lr': 0.0006643970983443902, 'lambda_val': 5.418807622178439e-06, 'batch_size': 1441, 'optimizer': 'Adam'}. Best is trial 65 with value: 0.14314842153817933.
2026-05-15 19:27:24,776 - optuna.study._optimize - INFO - Trial 257 pruned. 
2026-05-15 19:27:32,366 - optuna.study._optimize - INFO - Trial 258 pruned. 
2026-05-15 19:27:39,567 - optuna.study._optimize - INFO - Trial 259 pruned. 
2026-05-15 19:27:47,200 - optuna.study._optimize - INFO - Trial 260 pruned. 
2026-05-15 19:27:53,827 - optuna.study._optimize - INFO - Trial 261 pruned. 
2026-05-15 19:28:01,084 - optuna.study._optimize - INFO - Trial 262 pruned. 
2026-05-15 19:28:08,684 - optuna.study._optimize - INFO - Trial 263 pruned. 
2026-05-15 19:28:17,644 - optuna.study._optimize - INFO - Trial 264 pruned. 
2026-05-15 19:28:24,094 - experiment_functions - INFO - Early stopping at epoch 850. Best Recall: 0.1310
2026-05-15 19:28:24,243 - optuna.study.study - INFO - Trial 265 finished with value: 0.1309702532302406 and parameters: {'n_layers': 1, 'embedding_dim': 256, 'lr': 0.001031731260788306, 'lambda_val': 4.196732158130029e-05, 'batch_size': 1519, 'optimizer': 'Adam'}. Best is trial 65 with value: 0.14314842153817933.
2026-05-15 19:28:32,214 - optuna.study._optimize - INFO - Trial 266 pruned. 
2026-05-15 19:28:39,577 - optuna.study._optimize - INFO - Trial 267 pruned. 
2026-05-15 19:28:47,344 - optuna.study._optimize - INFO - Trial 268 pruned. 
2026-05-15 19:28:54,869 - optuna.study._optimize - INFO - Trial 269 pruned. 
2026-05-15 19:29:00,603 - experiment_functions - INFO - Early stopping at epoch 750. Best Recall: 0.1168
2026-05-15 19:29:00,726 - optuna.study.study - INFO - Trial 270 finished with value: 0.11676907430276824 and parameters: {'n_layers': 1, 'embedding_dim': 256, 'lr': 0.0013918032530118444, 'lambda_val': 4.861129330659438e-05, 'batch_size': 1617, 'optimizer': 'Adam'}. Best is trial 65 with value: 0.14314842153817933.
2026-05-15 19:29:07,946 - optuna.study._optimize - INFO - Trial 271 pruned. 
2026-05-15 19:29:15,589 - optuna.study._optimize - INFO - Trial 272 pruned. 
2026-05-15 19:29:19,655 - experiment_functions - INFO - Early stopping at epoch 500. Best Recall: 0.0022
2026-05-15 19:29:19,779 - optuna.study.study - INFO - Trial 273 finished with value: 0.002208736712864252 and parameters: {'n_layers': 1, 'embedding_dim': 256, 'lr': 0.000578739657125493, 'lambda_val': 3.8518409770552464e-05, 'batch_size': 3687, 'optimizer': 'SGD'}. Best is trial 65 with value: 0.14314842153817933.
2026-05-15 19:29:26,978 - optuna.study._optimize - INFO - Trial 274 pruned. 
2026-05-15 19:29:34,363 - optuna.study._optimize - INFO - Trial 275 pruned. 
2026-05-15 19:29:42,402 - optuna.study._optimize - INFO - Trial 276 pruned. 
2026-05-15 19:29:55,267 - experiment_functions - INFO - Early stopping at epoch 1700. Best Recall: 0.1375
2026-05-15 19:29:55,441 - optuna.study.study - INFO - Trial 277 finished with value: 0.137514708972908 and parameters: {'n_layers': 1, 'embedding_dim': 256, 'lr': 0.00045855080939054597, 'lambda_val': 3.2904888199808355e-05, 'batch_size': 2775, 'optimizer': 'Adam'}. Best is trial 65 with value: 0.14314842153817933.
2026-05-15 19:30:03,503 - optuna.study._optimize - INFO - Trial 278 pruned. 
2026-05-15 19:30:11,488 - optuna.study._optimize - INFO - Trial 279 pruned. 
2026-05-15 19:30:20,011 - optuna.study._optimize - INFO - Trial 280 pruned. 
2026-05-15 19:30:28,749 - optuna.study._optimize - INFO - Trial 281 pruned. 
2026-05-15 19:30:37,221 - optuna.study._optimize - INFO - Trial 282 pruned. 
2026-05-15 19:30:44,668 - experiment_functions - INFO - Early stopping at epoch 950. Best Recall: 0.1168
2026-05-15 19:30:44,811 - optuna.study.study - INFO - Trial 283 finished with value: 0.11681932313391404 and parameters: {'n_layers': 1, 'embedding_dim': 256, 'lr': 0.0011616010596830213, 'lambda_val': 5.866354850785519e-05, 'batch_size': 2291, 'optimizer': 'Adam'}. Best is trial 65 with value: 0.14314842153817933.
2026-05-15 19:30:50,974 - experiment_functions - INFO - Early stopping at epoch 750. Best Recall: 0.1249
2026-05-15 19:30:51,103 - optuna.study.study - INFO - Trial 284 finished with value: 0.12487293774509135 and parameters: {'n_layers': 1, 'embedding_dim': 256, 'lr': 0.0017158614333236167, 'lambda_val': 1.0064611076694653e-06, 'batch_size': 1678, 'optimizer': 'Adam'}. Best is trial 65 with value: 0.14314842153817933.
2026-05-15 19:30:58,806 - optuna.study._optimize - INFO - Trial 285 pruned. 
2026-05-15 19:31:05,749 - optuna.study._optimize - INFO - Trial 286 pruned. 
2026-05-15 19:31:13,014 - optuna.study._optimize - INFO - Trial 287 pruned. 
2026-05-15 19:31:20,116 - optuna.study._optimize - INFO - Trial 288 pruned. 
2026-05-15 19:31:27,874 - optuna.study._optimize - INFO - Trial 289 pruned. 
2026-05-15 19:31:35,157 - optuna.study._optimize - INFO - Trial 290 pruned. 
2026-05-15 19:31:42,779 - optuna.study._optimize - INFO - Trial 291 pruned. 
2026-05-15 19:31:48,666 - experiment_functions - INFO - Early stopping at epoch 800. Best Recall: 0.1198
2026-05-15 19:31:48,783 - optuna.study.study - INFO - Trial 292 finished with value: 0.1197562962058986 and parameters: {'n_layers': 1, 'embedding_dim': 256, 'lr': 0.001452770108829083, 'lambda_val': 4.554868700996437e-05, 'batch_size': 1978, 'optimizer': 'Adam'}. Best is trial 65 with value: 0.14314842153817933.
2026-05-15 19:31:56,037 - optuna.study._optimize - INFO - Trial 293 pruned. 
2026-05-15 19:32:04,009 - optuna.study._optimize - INFO - Trial 294 pruned. 
2026-05-15 19:32:12,162 - optuna.study._optimize - INFO - Trial 295 pruned. 
2026-05-15 19:32:16,239 - experiment_functions - INFO - Early stopping at epoch 500. Best Recall: 0.0023
2026-05-15 19:32:16,362 - optuna.study.study - INFO - Trial 296 finished with value: 0.0023077716231725107 and parameters: {'n_layers': 1, 'embedding_dim': 256, 'lr': 1.6019520506953145e-05, 'lambda_val': 1.0942454733332882e-05, 'batch_size': 2378, 'optimizer': 'Adam'}. Best is trial 65 with value: 0.14314842153817933.
2026-05-15 19:32:20,572 - experiment_functions - INFO - Early stopping at epoch 500. Best Recall: 0.0017
2026-05-15 19:32:20,707 - optuna.study.study - INFO - Trial 297 finished with value: 0.001743296200585433 and parameters: {'n_layers': 1, 'embedding_dim': 256, 'lr': 0.0006212536864694375, 'lambda_val': 1.0064928550285955e-06, 'batch_size': 1507, 'optimizer': 'SGD'}. Best is trial 65 with value: 0.14314842153817933.
2026-05-15 19:32:27,699 - optuna.study._optimize - INFO - Trial 298 pruned. 
