2026-05-16 06:00:31,222 - optuna.study.study - INFO - Trial 30 finished with value: 0.03988800691879971 and parameters: {'n_layers': 3, 'embedding_dim': 128, 'lr': 0.0013487441561487472, 'lambda_val': 2.5903200759614574e-06, 'batch_size': 2609, 'optimizer': 'RMSprop'}. Best is trial 12 with value: 0.08007474723898018.
2026-05-16 06:00:37,165 - optuna.study._optimize - INFO - Trial 31 pruned. 
2026-05-16 06:00:57,594 - experiment_functions - INFO - Early stopping at epoch 3600. Best Recall: 0.0793
2026-05-16 06:00:57,685 - optuna.study.study - INFO - Trial 32 finished with value: 0.0792866631432732 and parameters: {'n_layers': 1, 'embedding_dim': 128, 'lr': 0.00019836738008984333, 'lambda_val': 3.2174805357350186e-05, 'batch_size': 2319, 'optimizer': 'Adam'}. Best is trial 12 with value: 0.08007474723898018.
2026-05-16 06:01:03,567 - optuna.study._optimize - INFO - Trial 33 pruned. 
2026-05-16 06:01:07,325 - experiment_functions - INFO - Early stopping at epoch 500. Best Recall: 0.0027
2026-05-16 06:01:07,426 - optuna.study.study - INFO - Trial 34 finished with value: 0.0026540566336517887 and parameters: {'n_layers': 1, 'embedding_dim': 96, 'lr': 0.0005271338777613317, 'lambda_val': 3.264718188099706e-05, 'batch_size': 2190, 'optimizer': 'SGD'}. Best is trial 12 with value: 0.08007474723898018.
2026-05-16 06:01:11,395 - experiment_functions - INFO - Early stopping at epoch 600. Best Recall: 0.0338
2026-05-16 06:01:11,488 - optuna.study.study - INFO - Trial 35 finished with value: 0.03379156389244592 and parameters: {'n_layers': 1, 'embedding_dim': 64, 'lr': 0.029476896977989782, 'lambda_val': 6.514866598849788e-05, 'batch_size': 2458, 'optimizer': 'Adam'}. Best is trial 12 with value: 0.08007474723898018.
2026-05-16 06:01:15,291 - experiment_functions - INFO - Early stopping at epoch 500. Best Recall: 0.0026
2026-05-16 06:01:15,382 - optuna.study.study - INFO - Trial 36 finished with value: 0.0026133221791035935 and parameters: {'n_layers': 2, 'embedding_dim': 32, 'lr': 0.0032652679408003643, 'lambda_val': 0.0029297715036670064, 'batch_size': 912, 'optimizer': 'SGD'}. Best is trial 12 with value: 0.08007474723898018.
2026-05-16 06:01:21,911 - optuna.study._optimize - INFO - Trial 37 pruned. 
2026-05-16 06:01:29,442 - optuna.study._optimize - INFO - Trial 38 pruned. 
2026-05-16 06:01:32,761 - experiment_functions - INFO - Early stopping at epoch 500. Best Recall: 0.0016
2026-05-16 06:01:32,841 - optuna.study.study - INFO - Trial 39 finished with value: 0.0016241873868549 and parameters: {'n_layers': 1, 'embedding_dim': 64, 'lr': 4.359218053326383e-05, 'lambda_val': 9.470706272854008e-05, 'batch_size': 2406, 'optimizer': 'SGD'}. Best is trial 12 with value: 0.08007474723898018.
2026-05-16 06:01:37,940 - experiment_functions - INFO - Early stopping at epoch 700. Best Recall: 0.0153
2026-05-16 06:01:38,031 - optuna.study.study - INFO - Trial 40 finished with value: 0.015304990701445191 and parameters: {'n_layers': 4, 'embedding_dim': 32, 'lr': 0.014836409102981413, 'lambda_val': 0.00042337684564359014, 'batch_size': 1505, 'optimizer': 'Adam'}. Best is trial 12 with value: 0.08007474723898018.
2026-05-16 06:01:44,441 - optuna.study._optimize - INFO - Trial 41 pruned. 
2026-05-16 06:01:58,682 - optuna.study._optimize - INFO - Trial 42 pruned. 
2026-05-16 06:02:04,870 - optuna.study._optimize - INFO - Trial 43 pruned. 
2026-05-16 06:02:16,592 - experiment_functions - INFO - Early stopping at epoch 1850. Best Recall: 0.0885
2026-05-16 06:02:16,687 - optuna.study.study - INFO - Trial 44 finished with value: 0.08850950989300069 and parameters: {'n_layers': 1, 'embedding_dim': 256, 'lr': 0.0009120564273208463, 'lambda_val': 4.001633317070938e-05, 'batch_size': 2065, 'optimizer': 'Adam'}. Best is trial 44 with value: 0.08850950989300069.
2026-05-16 06:02:25,920 - experiment_functions - INFO - Early stopping at epoch 1450. Best Recall: 0.0889
2026-05-16 06:02:26,067 - optuna.study.study - INFO - Trial 45 finished with value: 0.0889285103656999 and parameters: {'n_layers': 1, 'embedding_dim': 256, 'lr': 0.001399127657001393, 'lambda_val': 3.3090395105136044e-05, 'batch_size': 2078, 'optimizer': 'Adam'}. Best is trial 45 with value: 0.0889285103656999.
2026-05-16 06:02:31,857 - experiment_functions - INFO - Early stopping at epoch 650. Best Recall: 0.0515
2026-05-16 06:02:31,948 - optuna.study.study - INFO - Trial 46 finished with value: 0.051516736630912933 and parameters: {'n_layers': 2, 'embedding_dim': 256, 'lr': 0.0011278613379373306, 'lambda_val': 3.15069309598087e-05, 'batch_size': 3001, 'optimizer': 'Adam'}. Best is trial 45 with value: 0.0889285103656999.
2026-05-16 06:02:40,173 - experiment_functions - INFO - Early stopping at epoch 1000. Best Recall: 0.0923
2026-05-16 06:02:40,268 - optuna.study.study - INFO - Trial 47 finished with value: 0.09229262645266004 and parameters: {'n_layers': 1, 'embedding_dim': 256, 'lr': 0.002005518578964526, 'lambda_val': 1.7963101365723922e-06, 'batch_size': 2064, 'optimizer': 'Adam'}. Best is trial 47 with value: 0.09229262645266004.
2026-05-16 06:02:45,212 - experiment_functions - INFO - Early stopping at epoch 600. Best Recall: 0.0466
2026-05-16 06:02:45,306 - optuna.study.study - INFO - Trial 48 finished with value: 0.04662274079123351 and parameters: {'n_layers': 2, 'embedding_dim': 256, 'lr': 0.0019483531153318878, 'lambda_val': 1.3760734241865366e-06, 'batch_size': 2590, 'optimizer': 'Adam'}. Best is trial 47 with value: 0.09229262645266004.
2026-05-16 06:02:54,461 - experiment_functions - INFO - Early stopping at epoch 1150. Best Recall: 0.0727
2026-05-16 06:02:54,562 - optuna.study.study - INFO - Trial 49 finished with value: 0.07274500468395574 and parameters: {'n_layers': 1, 'embedding_dim': 256, 'lr': 0.0022796811219594052, 'lambda_val': 1.6577437458897808e-06, 'batch_size': 2106, 'optimizer': 'RMSprop'}. Best is trial 47 with value: 0.09229262645266004.
2026-05-16 06:03:10,954 - experiment_functions - INFO - Early stopping at epoch 2350. Best Recall: 0.0847
2026-05-16 06:03:11,045 - optuna.study.study - INFO - Trial 50 finished with value: 0.08465100969954495 and parameters: {'n_layers': 1, 'embedding_dim': 256, 'lr': 0.0007191318041376081, 'lambda_val': 1.7900792472521425e-06, 'batch_size': 2249, 'optimizer': 'Adam'}. Best is trial 47 with value: 0.09229262645266004.
2026-05-16 06:03:33,229 - experiment_functions - INFO - Early stopping at epoch 3200. Best Recall: 0.0839
2026-05-16 06:03:33,398 - optuna.study.study - INFO - Trial 51 finished with value: 0.08392893760904314 and parameters: {'n_layers': 1, 'embedding_dim': 256, 'lr': 0.0006031623312471862, 'lambda_val': 1.8199098198894681e-06, 'batch_size': 2061, 'optimizer': 'Adam'}. Best is trial 47 with value: 0.09229262645266004.
2026-05-16 06:03:48,505 - experiment_functions - INFO - Early stopping at epoch 2300. Best Recall: 0.0896
2026-05-16 06:03:48,596 - optuna.study.study - INFO - Trial 52 finished with value: 0.08962512296021218 and parameters: {'n_layers': 1, 'embedding_dim': 256, 'lr': 0.0005984269678359955, 'lambda_val': 1.986517817020942e-06, 'batch_size': 2219, 'optimizer': 'Adam'}. Best is trial 47 with value: 0.09229262645266004.
2026-05-16 06:04:09,917 - experiment_functions - INFO - Early stopping at epoch 2250. Best Recall: 0.0888
2026-05-16 06:04:10,007 - optuna.study.study - INFO - Trial 53 finished with value: 0.08883020312872998 and parameters: {'n_layers': 1, 'embedding_dim': 256, 'lr': 0.0006162548275465988, 'lambda_val': 1.9159536281218354e-06, 'batch_size': 2083, 'optimizer': 'Adam'}. Best is trial 47 with value: 0.09229262645266004.
2026-05-16 06:04:22,951 - experiment_functions - INFO - Early stopping at epoch 2000. Best Recall: 0.0978
2026-05-16 06:04:23,045 - optuna.study.study - INFO - Trial 54 finished with value: 0.09783447602846981 and parameters: {'n_layers': 1, 'embedding_dim': 256, 'lr': 0.0010276145681506704, 'lambda_val': 2.1481931124017795e-06, 'batch_size': 2557, 'optimizer': 'Adam'}. Best is trial 54 with value: 0.09783447602846981.
2026-05-16 06:04:31,993 - experiment_functions - INFO - Early stopping at epoch 1350. Best Recall: 0.0923
2026-05-16 06:04:32,095 - optuna.study.study - INFO - Trial 55 finished with value: 0.09231281484070644 and parameters: {'n_layers': 1, 'embedding_dim': 256, 'lr': 0.0011681899338240476, 'lambda_val': 5.65105649757239e-06, 'batch_size': 2563, 'optimizer': 'Adam'}. Best is trial 54 with value: 0.09783447602846981.
2026-05-16 06:04:43,585 - experiment_functions - INFO - Early stopping at epoch 1350. Best Recall: 0.0959
2026-05-16 06:04:43,734 - optuna.study.study - INFO - Trial 56 finished with value: 0.09588128577872632 and parameters: {'n_layers': 1, 'embedding_dim': 256, 'lr': 0.0012490491813765363, 'lambda_val': 5.48340365233577e-06, 'batch_size': 2757, 'optimizer': 'Adam'}. Best is trial 54 with value: 0.09783447602846981.
2026-05-16 06:04:52,494 - optuna.study._optimize - INFO - Trial 57 pruned. 
2026-05-16 06:04:56,855 - experiment_functions - INFO - Early stopping at epoch 550. Best Recall: 0.0707
2026-05-16 06:04:57,171 - optuna.study.study - INFO - Trial 58 finished with value: 0.07065377303141492 and parameters: {'n_layers': 1, 'embedding_dim': 256, 'lr': 0.005879736707002074, 'lambda_val': 6.919716794843467e-06, 'batch_size': 3150, 'optimizer': 'Adam'}. Best is trial 54 with value: 0.09783447602846981.
2026-05-16 06:05:03,301 - experiment_functions - INFO - Early stopping at epoch 700. Best Recall: 0.0513
2026-05-16 06:05:03,436 - optuna.study.study - INFO - Trial 59 finished with value: 0.05127191175926283 and parameters: {'n_layers': 2, 'embedding_dim': 256, 'lr': 0.0011353883432005365, 'lambda_val': 6.442639363033261e-06, 'batch_size': 2765, 'optimizer': 'Adam'}. Best is trial 54 with value: 0.09783447602846981.
2026-05-16 06:05:12,797 - experiment_functions - INFO - Early stopping at epoch 500. Best Recall: 0.0012
2026-05-16 06:05:13,559 - optuna.study.study - INFO - Trial 60 finished with value: 0.0011580354791926794 and parameters: {'n_layers': 1, 'embedding_dim': 256, 'lr': 0.00038822328340557785, 'lambda_val': 3.059504207962397e-06, 'batch_size': 2604, 'optimizer': 'SGD'}. Best is trial 54 with value: 0.09783447602846981.
2026-05-16 06:05:23,747 - experiment_functions - INFO - Early stopping at epoch 1150. Best Recall: 0.0870
2026-05-16 06:05:23,850 - optuna.study.study - INFO - Trial 61 finished with value: 0.08699086358039201 and parameters: {'n_layers': 1, 'embedding_dim': 256, 'lr': 0.0025425647800970974, 'lambda_val': 1.915996358182319e-06, 'batch_size': 2381, 'optimizer': 'Adam'}. Best is trial 54 with value: 0.09783447602846981.
2026-05-16 06:05:41,603 - experiment_functions - INFO - Early stopping at epoch 2650. Best Recall: 0.0981
2026-05-16 06:05:41,707 - optuna.study.study - INFO - Trial 62 finished with value: 0.0981109570693363 and parameters: {'n_layers': 1, 'embedding_dim': 256, 'lr': 0.0011716129453754557, 'lambda_val': 1.0266308728354839e-06, 'batch_size': 2513, 'optimizer': 'Adam'}. Best is trial 62 with value: 0.0981109570693363.
2026-05-16 06:05:52,997 - experiment_functions - INFO - Early stopping at epoch 1650. Best Recall: 0.0913
2026-05-16 06:05:53,099 - optuna.study.study - INFO - Trial 63 finished with value: 0.09126673510285901 and parameters: {'n_layers': 1, 'embedding_dim': 256, 'lr': 0.00163921763508012, 'lambda_val': 1.0899353390874743e-06, 'batch_size': 2796, 'optimizer': 'Adam'}. Best is trial 62 with value: 0.0981109570693363.
2026-05-16 06:06:09,610 - experiment_functions - INFO - Early stopping at epoch 950. Best Recall: 0.0919
2026-05-16 06:06:09,701 - optuna.study.study - INFO - Trial 64 finished with value: 0.09185032228389653 and parameters: {'n_layers': 1, 'embedding_dim': 256, 'lr': 0.0017267813475461775, 'lambda_val': 1.0283733878430878e-06, 'batch_size': 2869, 'optimizer': 'Adam'}. Best is trial 62 with value: 0.0981109570693363.
2026-05-16 06:06:14,291 - experiment_functions - INFO - Early stopping at epoch 650. Best Recall: 0.0731
2026-05-16 06:06:14,372 - optuna.study.study - INFO - Trial 65 finished with value: 0.0731304758627471 and parameters: {'n_layers': 1, 'embedding_dim': 256, 'lr': 0.003221126770362503, 'lambda_val': 1.1083777434527392e-06, 'batch_size': 3565, 'optimizer': 'RMSprop'}. Best is trial 62 with value: 0.0981109570693363.
2026-05-16 06:06:23,163 - experiment_functions - INFO - Early stopping at epoch 1250. Best Recall: 0.0942
2026-05-16 06:06:23,254 - optuna.study.study - INFO - Trial 66 finished with value: 0.0941791166298087 and parameters: {'n_layers': 1, 'embedding_dim': 256, 'lr': 0.00173125687401318, 'lambda_val': 1.0698300896213974e-06, 'batch_size': 2871, 'optimizer': 'Adam'}. Best is trial 62 with value: 0.0981109570693363.
2026-05-16 06:06:28,907 - experiment_functions - INFO - Early stopping at epoch 750. Best Recall: 0.0801
2026-05-16 06:06:29,009 - optuna.study.study - INFO - Trial 67 finished with value: 0.08012456964096006 and parameters: {'n_layers': 1, 'embedding_dim': 256, 'lr': 0.005068564528134652, 'lambda_val': 2.748033562445905e-06, 'batch_size': 3194, 'optimizer': 'Adam'}. Best is trial 62 with value: 0.0981109570693363.
2026-05-16 06:06:38,917 - experiment_functions - INFO - Early stopping at epoch 650. Best Recall: 0.0344
2026-05-16 06:06:39,667 - optuna.study.study - INFO - Trial 68 finished with value: 0.034414286678525655 and parameters: {'n_layers': 2, 'embedding_dim': 256, 'lr': 0.007900560245055309, 'lambda_val': 5.402845172130493e-06, 'batch_size': 2886, 'optimizer': 'Adam'}. Best is trial 62 with value: 0.0981109570693363.
2026-05-16 06:06:56,892 - experiment_functions - INFO - Early stopping at epoch 2000. Best Recall: 0.0902
2026-05-16 06:06:56,994 - optuna.study.study - INFO - Trial 69 finished with value: 0.09015927396080362 and parameters: {'n_layers': 1, 'embedding_dim': 256, 'lr': 0.0010553143110838899, 'lambda_val': 3.744406262187857e-06, 'batch_size': 2515, 'optimizer': 'Adam'}. Best is trial 62 with value: 0.0981109570693363.
2026-05-16 06:07:03,992 - experiment_functions - INFO - Early stopping at epoch 850. Best Recall: 0.0832
2026-05-16 06:07:04,096 - optuna.study.study - INFO - Trial 70 finished with value: 0.08316743903010948 and parameters: {'n_layers': 1, 'embedding_dim': 256, 'lr': 0.0030053762233828362, 'lambda_val': 1.0143872866853746e-06, 'batch_size': 2668, 'optimizer': 'Adam'}. Best is trial 62 with value: 0.0981109570693363.
2026-05-16 06:07:12,595 - experiment_functions - INFO - Early stopping at epoch 950. Best Recall: 0.0946
2026-05-16 06:07:12,697 - optuna.study.study - INFO - Trial 71 finished with value: 0.09457117258115179 and parameters: {'n_layers': 1, 'embedding_dim': 256, 'lr': 0.0019034549594901602, 'lambda_val': 1.4537836554186078e-06, 'batch_size': 2809, 'optimizer': 'Adam'}. Best is trial 62 with value: 0.0981109570693363.
2026-05-16 06:07:18,864 - experiment_functions - INFO - Early stopping at epoch 550. Best Recall: 0.0247
2026-05-16 06:07:18,971 - optuna.study.study - INFO - Trial 72 finished with value: 0.0247336786329853 and parameters: {'n_layers': 4, 'embedding_dim': 256, 'lr': 0.002100349134550524, 'lambda_val': 2.3848132638505815e-06, 'batch_size': 3416, 'optimizer': 'Adam'}. Best is trial 62 with value: 0.0981109570693363.
2026-05-16 06:07:27,467 - experiment_functions - INFO - Early stopping at epoch 1250. Best Recall: 0.0934
2026-05-16 06:07:28,034 - optuna.study.study - INFO - Trial 73 finished with value: 0.09342833706972195 and parameters: {'n_layers': 1, 'embedding_dim': 256, 'lr': 0.00181559517867947, 'lambda_val': 1.4501425973418082e-06, 'batch_size': 3102, 'optimizer': 'Adam'}. Best is trial 62 with value: 0.0981109570693363.
2026-05-16 06:07:34,514 - optuna.study._optimize - INFO - Trial 74 pruned. 
2026-05-16 06:08:00,744 - experiment_functions - INFO - Early stopping at epoch 2750. Best Recall: 0.0957
2026-05-16 06:08:00,834 - optuna.study.study - INFO - Trial 75 finished with value: 0.09569478125757888 and parameters: {'n_layers': 1, 'embedding_dim': 256, 'lr': 0.0008033525174656676, 'lambda_val': 3.290899335845632e-06, 'batch_size': 2510, 'optimizer': 'Adam'}. Best is trial 62 with value: 0.0981109570693363.
2026-05-16 06:08:07,530 - optuna.study._optimize - INFO - Trial 76 pruned. 
2026-05-16 06:08:20,170 - experiment_functions - INFO - Early stopping at epoch 1900. Best Recall: 0.0992
2026-05-16 06:08:20,286 - optuna.study.study - INFO - Trial 77 finished with value: 0.0991795500358978 and parameters: {'n_layers': 1, 'embedding_dim': 256, 'lr': 0.0008201646142608431, 'lambda_val': 1.579140414574858e-05, 'batch_size': 3352, 'optimizer': 'Adam'}. Best is trial 77 with value: 0.0991795500358978.
2026-05-16 06:08:23,661 - experiment_functions - INFO - Early stopping at epoch 500. Best Recall: 0.0009
2026-05-16 06:08:23,762 - optuna.study.study - INFO - Trial 78 finished with value: 0.0008794196118648059 and parameters: {'n_layers': 1, 'embedding_dim': 32, 'lr': 0.0007569226083524688, 'lambda_val': 9.118490460675562e-06, 'batch_size': 3269, 'optimizer': 'SGD'}. Best is trial 77 with value: 0.0991795500358978.
2026-05-16 06:08:30,817 - optuna.study._optimize - INFO - Trial 79 pruned. 
2026-05-16 06:08:38,835 - optuna.study._optimize - INFO - Trial 80 pruned. 
2026-05-16 06:08:46,535 - optuna.study._optimize - INFO - Trial 81 pruned. 
2026-05-16 06:08:51,441 - experiment_functions - INFO - Early stopping at epoch 700. Best Recall: 0.0847
2026-05-16 06:08:51,531 - optuna.study.study - INFO - Trial 82 finished with value: 0.08472796452451335 and parameters: {'n_layers': 1, 'embedding_dim': 256, 'lr': 0.004361839229019773, 'lambda_val': 4.154519892979454e-06, 'batch_size': 2530, 'optimizer': 'Adam'}. Best is trial 77 with value: 0.0991795500358978.
2026-05-16 06:08:57,719 - experiment_functions - INFO - Early stopping at epoch 850. Best Recall: 0.0911
2026-05-16 06:08:57,798 - optuna.study.study - INFO - Trial 83 finished with value: 0.09108717639182469 and parameters: {'n_layers': 1, 'embedding_dim': 256, 'lr': 0.002644492408107271, 'lambda_val': 2.3630394565044645e-06, 'batch_size': 2836, 'optimizer': 'Adam'}. Best is trial 77 with value: 0.0991795500358978.
2026-05-16 06:09:05,151 - optuna.study._optimize - INFO - Trial 84 pruned. 
2026-05-16 06:09:17,592 - experiment_functions - INFO - Early stopping at epoch 1750. Best Recall: 0.0908
2026-05-16 06:09:17,713 - optuna.study.study - INFO - Trial 85 finished with value: 0.0907851512564542 and parameters: {'n_layers': 1, 'embedding_dim': 256, 'lr': 0.0009654153984096493, 'lambda_val': 1.377608195930116e-06, 'batch_size': 3524, 'optimizer': 'Adam'}. Best is trial 77 with value: 0.0991795500358978.
2026-05-16 06:09:24,565 - optuna.study._optimize - INFO - Trial 86 pruned. 
2026-05-16 06:09:31,300 - experiment_functions - INFO - Early stopping at epoch 950. Best Recall: 0.0947
2026-05-16 06:09:31,436 - optuna.study.study - INFO - Trial 87 finished with value: 0.09466665868742243 and parameters: {'n_layers': 1, 'embedding_dim': 256, 'lr': 0.001757433649736569, 'lambda_val': 2.3767994735760103e-06, 'batch_size': 3083, 'optimizer': 'Adam'}. Best is trial 77 with value: 0.0991795500358978.
2026-05-16 06:09:38,611 - experiment_functions - INFO - Early stopping at epoch 1000. Best Recall: 0.0883
2026-05-16 06:09:38,712 - optuna.study.study - INFO - Trial 88 finished with value: 0.08831890937720493 and parameters: {'n_layers': 1, 'embedding_dim': 256, 'lr': 0.0017381885707312686, 'lambda_val': 2.489958666205698e-06, 'batch_size': 3310, 'optimizer': 'Adam'}. Best is trial 77 with value: 0.0991795500358978.
2026-05-16 06:09:46,028 - optuna.study._optimize - INFO - Trial 89 pruned. 
2026-05-16 06:09:49,576 - experiment_functions - INFO - Early stopping at epoch 500. Best Recall: 0.0028
2026-05-16 06:09:49,686 - optuna.study.study - INFO - Trial 90 finished with value: 0.0027727844950676873 and parameters: {'n_layers': 1, 'embedding_dim': 32, 'lr': 0.003383281369559825, 'lambda_val': 1.3613838813286709e-06, 'batch_size': 2981, 'optimizer': 'SGD'}. Best is trial 77 with value: 0.0991795500358978.
2026-05-16 06:10:04,829 - experiment_functions - INFO - Early stopping at epoch 1550. Best Recall: 0.1050
2026-05-16 06:10:04,943 - optuna.study.study - INFO - Trial 91 finished with value: 0.104993146553119 and parameters: {'n_layers': 1, 'embedding_dim': 256, 'lr': 0.0013397890048051678, 'lambda_val': 4.295534757562807e-06, 'batch_size': 3225, 'optimizer': 'Adam'}. Best is trial 91 with value: 0.104993146553119.
2026-05-16 06:10:10,773 - experiment_functions - INFO - Early stopping at epoch 850. Best Recall: 0.0948
2026-05-16 06:10:10,862 - optuna.study.study - INFO - Trial 92 finished with value: 0.09483165702825633 and parameters: {'n_layers': 1, 'embedding_dim': 256, 'lr': 0.002344701127785852, 'lambda_val': 2.2248710012893145e-06, 'batch_size': 3731, 'optimizer': 'Adam'}. Best is trial 91 with value: 0.104993146553119.
2026-05-16 06:10:17,117 - experiment_functions - INFO - Early stopping at epoch 900. Best Recall: 0.0875
2026-05-16 06:10:17,197 - optuna.study.study - INFO - Trial 93 finished with value: 0.08750970473828468 and parameters: {'n_layers': 1, 'embedding_dim': 256, 'lr': 0.00249480550762745, 'lambda_val': 4.017329454544863e-06, 'batch_size': 3713, 'optimizer': 'Adam'}. Best is trial 91 with value: 0.104993146553119.
2026-05-16 06:10:29,104 - experiment_functions - INFO - Early stopping at epoch 1750. Best Recall: 0.0974
2026-05-16 06:10:29,214 - optuna.study.study - INFO - Trial 94 finished with value: 0.0974362284776507 and parameters: {'n_layers': 1, 'embedding_dim': 256, 'lr': 0.0009240717962523438, 'lambda_val': 1.055294674519827e-05, 'batch_size': 3733, 'optimizer': 'Adam'}. Best is trial 91 with value: 0.104993146553119.
2026-05-16 06:10:36,817 - optuna.study._optimize - INFO - Trial 95 pruned. 
2026-05-16 06:10:48,700 - experiment_functions - INFO - Early stopping at epoch 1800. Best Recall: 0.0886
