2026-05-15 19:51:47,146 - optuna.study.study - INFO - Trial 120 finished with value: 0.0015159962241815899 and parameters: {'n_layers': 1, 'embedding_dim': 64, 'lr': 0.006662938106199206, 'lambda_val': 6.33663677182713e-05, 'batch_size': 3475, 'optimizer': 'SGD'}. Best is trial 119 with value: 0.025263757590283552.
2026-05-15 19:51:56,210 - optuna.study._optimize - INFO - Trial 121 pruned. 
2026-05-15 19:52:10,011 - optuna.study._optimize - INFO - Trial 122 pruned. 
2026-05-15 19:52:20,678 - experiment_functions - INFO - Early stopping at epoch 1500. Best Recall: 0.0180
2026-05-15 19:52:20,798 - optuna.study.study - INFO - Trial 123 finished with value: 0.01802505245621254 and parameters: {'n_layers': 4, 'embedding_dim': 64, 'lr': 0.038191675528592595, 'lambda_val': 9.385892387766298e-05, 'batch_size': 3506, 'optimizer': 'Adam'}. Best is trial 119 with value: 0.025263757590283552.
2026-05-15 19:52:25,156 - experiment_functions - INFO - Early stopping at epoch 550. Best Recall: 0.0072
2026-05-15 19:52:25,321 - optuna.study.study - INFO - Trial 124 finished with value: 0.007217035923589677 and parameters: {'n_layers': 4, 'embedding_dim': 64, 'lr': 0.002883575192890724, 'lambda_val': 3.7786121703170335e-05, 'batch_size': 3672, 'optimizer': 'Adam'}. Best is trial 119 with value: 0.025263757590283552.
2026-05-15 19:52:36,123 - experiment_functions - INFO - Early stopping at epoch 1600. Best Recall: 0.0209
2026-05-15 19:52:36,236 - optuna.study.study - INFO - Trial 125 finished with value: 0.020905318081632585 and parameters: {'n_layers': 4, 'embedding_dim': 64, 'lr': 0.06881916400779517, 'lambda_val': 5.9501805548271634e-05, 'batch_size': 3199, 'optimizer': 'Adam'}. Best is trial 119 with value: 0.025263757590283552.
2026-05-15 19:52:56,776 - experiment_functions - INFO - Early stopping at epoch 2300. Best Recall: 0.0212
2026-05-15 19:52:56,901 - optuna.study.study - INFO - Trial 126 finished with value: 0.021170607763928432 and parameters: {'n_layers': 4, 'embedding_dim': 64, 'lr': 0.055948626152971366, 'lambda_val': 5.633673658766335e-05, 'batch_size': 3219, 'optimizer': 'Adam'}. Best is trial 119 with value: 0.025263757590283552.
2026-05-15 19:53:05,381 - experiment_functions - INFO - Early stopping at epoch 1150. Best Recall: 0.0180
2026-05-15 19:53:05,484 - optuna.study.study - INFO - Trial 127 finished with value: 0.017977322839178526 and parameters: {'n_layers': 4, 'embedding_dim': 256, 'lr': 0.030676732610981788, 'lambda_val': 5.625081859914603e-05, 'batch_size': 3168, 'optimizer': 'Adam'}. Best is trial 119 with value: 0.025263757590283552.
2026-05-15 19:53:35,824 - optuna.study.study - INFO - Trial 128 finished with value: 0.021123739543131567 and parameters: {'n_layers': 4, 'embedding_dim': 32, 'lr': 0.04138028972443982, 'lambda_val': 2.6148062550086785e-05, 'batch_size': 3396, 'optimizer': 'Adam'}. Best is trial 119 with value: 0.025263757590283552.
2026-05-15 19:53:40,796 - experiment_functions - INFO - Early stopping at epoch 550. Best Recall: 0.0055
2026-05-15 19:53:40,929 - optuna.study.study - INFO - Trial 129 finished with value: 0.005462845445805526 and parameters: {'n_layers': 4, 'embedding_dim': 32, 'lr': 0.012238275532603343, 'lambda_val': 2.1208696824305134e-05, 'batch_size': 3346, 'optimizer': 'Adam'}. Best is trial 119 with value: 0.025263757590283552.
2026-05-15 19:53:45,684 - experiment_functions - INFO - Early stopping at epoch 550. Best Recall: 0.0064
2026-05-15 19:53:45,799 - optuna.study.study - INFO - Trial 130 finished with value: 0.006423998611131162 and parameters: {'n_layers': 4, 'embedding_dim': 32, 'lr': 0.019389421653743945, 'lambda_val': 2.595755319003527e-05, 'batch_size': 3241, 'optimizer': 'Adam'}. Best is trial 119 with value: 0.025263757590283552.
2026-05-15 19:53:56,979 - experiment_functions - INFO - Early stopping at epoch 1450. Best Recall: 0.0202
2026-05-15 19:53:57,071 - optuna.study.study - INFO - Trial 131 finished with value: 0.020222755553755814 and parameters: {'n_layers': 4, 'embedding_dim': 32, 'lr': 0.04158713135170554, 'lambda_val': 5.54307518006746e-05, 'batch_size': 3388, 'optimizer': 'Adam'}. Best is trial 119 with value: 0.025263757590283552.
2026-05-15 19:54:03,517 - experiment_functions - INFO - Early stopping at epoch 950. Best Recall: 0.0176
2026-05-15 19:54:03,631 - optuna.study.study - INFO - Trial 132 finished with value: 0.017624498892704506 and parameters: {'n_layers': 4, 'embedding_dim': 32, 'lr': 0.042473109151682724, 'lambda_val': 7.119312641188742e-05, 'batch_size': 3592, 'optimizer': 'Adam'}. Best is trial 119 with value: 0.025263757590283552.
2026-05-15 19:54:13,850 - experiment_functions - INFO - Early stopping at epoch 1400. Best Recall: 0.0192
2026-05-15 19:54:13,997 - optuna.study.study - INFO - Trial 133 finished with value: 0.019219790740330586 and parameters: {'n_layers': 4, 'embedding_dim': 32, 'lr': 0.06932244185445482, 'lambda_val': 5.4486544465831876e-05, 'batch_size': 3420, 'optimizer': 'Adam'}. Best is trial 119 with value: 0.025263757590283552.
2026-05-15 19:54:22,752 - optuna.study._optimize - INFO - Trial 134 pruned. 
2026-05-15 19:54:34,937 - experiment_functions - INFO - Early stopping at epoch 1400. Best Recall: 0.0230
2026-05-15 19:54:35,047 - optuna.study.study - INFO - Trial 135 finished with value: 0.022956920592406258 and parameters: {'n_layers': 4, 'embedding_dim': 32, 'lr': 0.039017321443430716, 'lambda_val': 8.277545774384477e-05, 'batch_size': 3411, 'optimizer': 'Adam'}. Best is trial 119 with value: 0.025263757590283552.
2026-05-15 19:54:41,994 - optuna.study._optimize - INFO - Trial 136 pruned. 
2026-05-15 19:54:50,975 - optuna.study._optimize - INFO - Trial 137 pruned. 
2026-05-15 19:55:04,313 - optuna.study._optimize - INFO - Trial 138 pruned. 
2026-05-15 19:55:26,364 - experiment_functions - INFO - Early stopping at epoch 2800. Best Recall: 0.0209
2026-05-15 19:55:26,494 - optuna.study.study - INFO - Trial 139 finished with value: 0.020918271443638177 and parameters: {'n_layers': 4, 'embedding_dim': 32, 'lr': 0.06759035849249623, 'lambda_val': 0.0001251413124234873, 'batch_size': 3160, 'optimizer': 'Adam'}. Best is trial 119 with value: 0.025263757590283552.
2026-05-15 19:55:49,955 - experiment_functions - INFO - Early stopping at epoch 2450. Best Recall: 0.0212
2026-05-15 19:55:50,449 - optuna.study.study - INFO - Trial 140 finished with value: 0.021218615696279024 and parameters: {'n_layers': 4, 'embedding_dim': 32, 'lr': 0.08353922241570724, 'lambda_val': 0.0001371028920268766, 'batch_size': 3178, 'optimizer': 'Adam'}. Best is trial 119 with value: 0.025263757590283552.
2026-05-15 19:56:05,782 - experiment_functions - INFO - Early stopping at epoch 2100. Best Recall: 0.0194
2026-05-15 19:56:05,884 - optuna.study.study - INFO - Trial 141 finished with value: 0.01936469779195723 and parameters: {'n_layers': 4, 'embedding_dim': 32, 'lr': 0.06916092526418277, 'lambda_val': 0.0001513443762853337, 'batch_size': 3093, 'optimizer': 'Adam'}. Best is trial 119 with value: 0.025263757590283552.
2026-05-15 19:56:23,211 - experiment_functions - INFO - Early stopping at epoch 2600. Best Recall: 0.0245
2026-05-15 19:56:23,369 - optuna.study.study - INFO - Trial 142 finished with value: 0.024490695868203773 and parameters: {'n_layers': 4, 'embedding_dim': 32, 'lr': 0.07981276142507525, 'lambda_val': 0.0001164049103629636, 'batch_size': 3143, 'optimizer': 'Adam'}. Best is trial 119 with value: 0.025263757590283552.
2026-05-15 19:56:28,955 - experiment_functions - INFO - Early stopping at epoch 800. Best Recall: 0.0144
2026-05-15 19:56:29,057 - optuna.study.study - INFO - Trial 143 finished with value: 0.014352905170446075 and parameters: {'n_layers': 4, 'embedding_dim': 32, 'lr': 0.07742528228439759, 'lambda_val': 0.00012174162095439452, 'batch_size': 3181, 'optimizer': 'Adam'}. Best is trial 119 with value: 0.025263757590283552.
2026-05-15 19:56:36,572 - optuna.study._optimize - INFO - Trial 144 pruned. 
2026-05-15 19:56:44,187 - optuna.study._optimize - INFO - Trial 145 pruned. 
2026-05-15 19:56:53,236 - optuna.study._optimize - INFO - Trial 146 pruned. 
2026-05-15 19:57:02,108 - experiment_functions - INFO - Early stopping at epoch 1200. Best Recall: 0.0165
2026-05-15 19:57:02,233 - optuna.study.study - INFO - Trial 147 finished with value: 0.01651607052661736 and parameters: {'n_layers': 4, 'embedding_dim': 32, 'lr': 0.06655090996085294, 'lambda_val': 0.00010501683400842573, 'batch_size': 3155, 'optimizer': 'Adam'}. Best is trial 119 with value: 0.025263757590283552.
2026-05-15 19:57:06,163 - experiment_functions - INFO - Early stopping at epoch 500. Best Recall: 0.0023
2026-05-15 19:57:06,266 - optuna.study.study - INFO - Trial 148 finished with value: 0.0023146483947959957 and parameters: {'n_layers': 4, 'embedding_dim': 32, 'lr': 0.001447564483622903, 'lambda_val': 0.09662871922634765, 'batch_size': 3444, 'optimizer': 'SGD'}. Best is trial 119 with value: 0.025263757590283552.
2026-05-15 19:57:12,634 - optuna.study._optimize - INFO - Trial 149 pruned. 
2026-05-15 19:57:22,478 - optuna.study._optimize - INFO - Trial 150 pruned. 
2026-05-15 19:57:35,777 - experiment_functions - INFO - Early stopping at epoch 900. Best Recall: 0.0161
2026-05-15 19:57:35,888 - optuna.study.study - INFO - Trial 151 finished with value: 0.016084500955856534 and parameters: {'n_layers': 4, 'embedding_dim': 32, 'lr': 0.0627455368847067, 'lambda_val': 7.209101032763077e-05, 'batch_size': 2133, 'optimizer': 'Adam'}. Best is trial 119 with value: 0.025263757590283552.
2026-05-15 19:57:50,927 - experiment_functions - INFO - Early stopping at epoch 2150. Best Recall: 0.0228
2026-05-15 19:57:51,046 - optuna.study.study - INFO - Trial 152 finished with value: 0.022826261023483924 and parameters: {'n_layers': 4, 'embedding_dim': 32, 'lr': 0.05174186174619173, 'lambda_val': 5.10417546589484e-05, 'batch_size': 3639, 'optimizer': 'Adam'}. Best is trial 119 with value: 0.025263757590283552.
2026-05-15 19:58:01,870 - experiment_functions - INFO - Early stopping at epoch 1600. Best Recall: 0.0180
2026-05-15 19:58:02,047 - optuna.study.study - INFO - Trial 153 finished with value: 0.01803168972247314 and parameters: {'n_layers': 4, 'embedding_dim': 32, 'lr': 0.048676045657883873, 'lambda_val': 4.7215784232665076e-05, 'batch_size': 3697, 'optimizer': 'Adam'}. Best is trial 119 with value: 0.025263757590283552.
2026-05-15 19:58:08,867 - optuna.study._optimize - INFO - Trial 154 pruned. 
2026-05-15 19:58:17,007 - optuna.study._optimize - INFO - Trial 155 pruned. 
2026-05-15 19:58:23,459 - experiment_functions - INFO - Early stopping at epoch 500. Best Recall: 0.0141
2026-05-15 19:58:23,920 - optuna.study.study - INFO - Trial 156 finished with value: 0.014054282579860664 and parameters: {'n_layers': 4, 'embedding_dim': 128, 'lr': 0.04341736910340441, 'lambda_val': 4.70146528785992e-05, 'batch_size': 3201, 'optimizer': 'RMSprop'}. Best is trial 119 with value: 0.025263757590283552.
2026-05-15 19:58:36,087 - experiment_functions - INFO - Early stopping at epoch 700. Best Recall: 0.0043
2026-05-15 19:58:36,242 - optuna.study.study - INFO - Trial 157 finished with value: 0.004264274090642824 and parameters: {'n_layers': 4, 'embedding_dim': 32, 'lr': 0.03414099412428023, 'lambda_val': 0.020759360305425373, 'batch_size': 3326, 'optimizer': 'Adam'}. Best is trial 119 with value: 0.025263757590283552.
2026-05-15 19:58:40,172 - experiment_functions - INFO - Early stopping at epoch 550. Best Recall: 0.0064
2026-05-15 19:58:40,254 - optuna.study.study - INFO - Trial 158 finished with value: 0.006441285988951159 and parameters: {'n_layers': 4, 'embedding_dim': 32, 'lr': 0.01691565147490706, 'lambda_val': 8.661110080924607e-05, 'batch_size': 2937, 'optimizer': 'Adam'}. Best is trial 119 with value: 0.025263757590283552.
2026-05-15 19:58:50,399 - experiment_functions - INFO - Early stopping at epoch 1600. Best Recall: 0.0179
2026-05-15 19:58:50,528 - optuna.study.study - INFO - Trial 159 finished with value: 0.017850849639535912 and parameters: {'n_layers': 4, 'embedding_dim': 32, 'lr': 0.08544859234346666, 'lambda_val': 3.329592434171605e-05, 'batch_size': 3503, 'optimizer': 'Adam'}. Best is trial 119 with value: 0.025263757590283552.
2026-05-15 19:59:01,216 - optuna.study._optimize - INFO - Trial 160 pruned. 
2026-05-15 19:59:13,810 - experiment_functions - INFO - Early stopping at epoch 1750. Best Recall: 0.0211
2026-05-15 19:59:13,952 - optuna.study.study - INFO - Trial 161 finished with value: 0.021106465403900643 and parameters: {'n_layers': 4, 'embedding_dim': 64, 'lr': 0.054850482604741006, 'lambda_val': 5.932137239939439e-05, 'batch_size': 3581, 'optimizer': 'Adam'}. Best is trial 119 with value: 0.025263757590283552.
2026-05-15 19:59:31,121 - experiment_functions - INFO - Early stopping at epoch 3000. Best Recall: 0.0205
2026-05-15 19:59:31,317 - optuna.study.study - INFO - Trial 162 finished with value: 0.02051843377430404 and parameters: {'n_layers': 4, 'embedding_dim': 64, 'lr': 0.053584670419792195, 'lambda_val': 5.898773678273716e-05, 'batch_size': 3728, 'optimizer': 'Adam'}. Best is trial 119 with value: 0.025263757590283552.
2026-05-15 19:59:40,785 - experiment_functions - INFO - Early stopping at epoch 1400. Best Recall: 0.0189
2026-05-15 19:59:40,887 - optuna.study.study - INFO - Trial 163 finished with value: 0.018880328302365548 and parameters: {'n_layers': 4, 'embedding_dim': 64, 'lr': 0.04430492526853025, 'lambda_val': 4.570428777383633e-05, 'batch_size': 3412, 'optimizer': 'Adam'}. Best is trial 119 with value: 0.025263757590283552.
2026-05-15 19:59:52,884 - experiment_functions - INFO - Early stopping at epoch 1600. Best Recall: 0.0189
2026-05-15 19:59:53,007 - optuna.study.study - INFO - Trial 164 finished with value: 0.018858745637386 and parameters: {'n_layers': 4, 'embedding_dim': 256, 'lr': 0.027876770685976993, 'lambda_val': 7.399970389557665e-05, 'batch_size': 3828, 'optimizer': 'Adam'}. Best is trial 119 with value: 0.025263757590283552.
2026-05-15 19:59:57,384 - experiment_functions - INFO - Early stopping at epoch 600. Best Recall: 0.0137
2026-05-15 19:59:57,551 - optuna.study.study - INFO - Trial 165 finished with value: 0.013723846041207199 and parameters: {'n_layers': 4, 'embedding_dim': 96, 'lr': 0.07344908666108343, 'lambda_val': 2.8937729579949885e-05, 'batch_size': 2283, 'optimizer': 'Adam'}. Best is trial 119 with value: 0.025263757590283552.
2026-05-15 20:00:03,823 - experiment_functions - INFO - Early stopping at epoch 750. Best Recall: 0.0061
2026-05-15 20:00:03,937 - optuna.study.study - INFO - Trial 166 finished with value: 0.006071112886565792 and parameters: {'n_layers': 4, 'embedding_dim': 64, 'lr': 0.0005436302670562344, 'lambda_val': 9.930244687420507e-05, 'batch_size': 3060, 'optimizer': 'Adam'}. Best is trial 119 with value: 0.025263757590283552.
2026-05-15 20:00:11,026 - optuna.study._optimize - INFO - Trial 167 pruned. 
2026-05-15 20:00:28,845 - experiment_functions - INFO - Early stopping at epoch 2900. Best Recall: 0.0221
2026-05-15 20:00:28,947 - optuna.study.study - INFO - Trial 168 finished with value: 0.022066070440394762 and parameters: {'n_layers': 4, 'embedding_dim': 64, 'lr': 0.03646009782645039, 'lambda_val': 4.1511590306118795e-05, 'batch_size': 3640, 'optimizer': 'Adam'}. Best is trial 119 with value: 0.025263757590283552.
2026-05-15 20:00:36,433 - optuna.study._optimize - INFO - Trial 169 pruned. 
2026-05-15 20:00:43,659 - optuna.study._optimize - INFO - Trial 170 pruned. 
2026-05-15 20:00:56,591 - experiment_functions - INFO - Early stopping at epoch 1950. Best Recall: 0.0186
2026-05-15 20:00:56,690 - optuna.study.study - INFO - Trial 171 finished with value: 0.01863899740710517 and parameters: {'n_layers': 4, 'embedding_dim': 64, 'lr': 0.05976984522012495, 'lambda_val': 5.234886971288082e-05, 'batch_size': 3240, 'optimizer': 'Adam'}. Best is trial 119 with value: 0.025263757590283552.
2026-05-15 20:01:23,829 - experiment_functions - INFO - Early stopping at epoch 2850. Best Recall: 0.0225
2026-05-15 20:01:23,941 - optuna.study.study - INFO - Trial 172 finished with value: 0.02252105722978474 and parameters: {'n_layers': 4, 'embedding_dim': 64, 'lr': 0.039133616047765746, 'lambda_val': 7.054369279888466e-05, 'batch_size': 3474, 'optimizer': 'Adam'}. Best is trial 119 with value: 0.025263757590283552.
2026-05-15 20:01:32,578 - experiment_functions - INFO - Early stopping at epoch 1400. Best Recall: 0.0190
2026-05-15 20:01:32,757 - optuna.study.study - INFO - Trial 173 finished with value: 0.018968793257371296 and parameters: {'n_layers': 4, 'embedding_dim': 64, 'lr': 0.040458252966559784, 'lambda_val': 8.15418907310532e-05, 'batch_size': 3485, 'optimizer': 'Adam'}. Best is trial 119 with value: 0.025263757590283552.
2026-05-15 20:01:46,210 - experiment_functions - INFO - Early stopping at epoch 2150. Best Recall: 0.0213
2026-05-15 20:01:46,343 - optuna.study.study - INFO - Trial 174 finished with value: 0.021323114593963577 and parameters: {'n_layers': 4, 'embedding_dim': 64, 'lr': 0.031085822125669144, 'lambda_val': 4.0235282494947306e-05, 'batch_size': 3636, 'optimizer': 'Adam'}. Best is trial 119 with value: 0.025263757590283552.
2026-05-15 20:02:01,447 - experiment_functions - INFO - Early stopping at epoch 2600. Best Recall: 0.0210
2026-05-15 20:02:01,625 - optuna.study.study - INFO - Trial 175 finished with value: 0.021034866432727648 and parameters: {'n_layers': 4, 'embedding_dim': 64, 'lr': 0.02964366354806799, 'lambda_val': 4.7455447805244e-05, 'batch_size': 3752, 'optimizer': 'Adam'}. Best is trial 119 with value: 0.025263757590283552.
2026-05-15 20:02:08,375 - optuna.study._optimize - INFO - Trial 176 pruned. 
2026-05-15 20:02:23,348 - experiment_functions - INFO - Early stopping at epoch 2350. Best Recall: 0.0222
2026-05-15 20:02:23,461 - optuna.study.study - INFO - Trial 177 finished with value: 0.022177959053705107 and parameters: {'n_layers': 4, 'embedding_dim': 64, 'lr': 0.03329825096695985, 'lambda_val': 2.670872770017073e-05, 'batch_size': 3652, 'optimizer': 'Adam'}. Best is trial 119 with value: 0.025263757590283552.
2026-05-15 20:02:41,736 - optuna.study._optimize - INFO - Trial 178 pruned. 
2026-05-15 20:02:45,461 - experiment_functions - INFO - Early stopping at epoch 500. Best Recall: 0.0006
2026-05-15 20:02:45,617 - optuna.study.study - INFO - Trial 179 finished with value: 0.0006025174093868199 and parameters: {'n_layers': 4, 'embedding_dim': 64, 'lr': 0.025791189971395612, 'lambda_val': 3.5730512345157367e-05, 'batch_size': 3833, 'optimizer': 'SGD'}. Best is trial 119 with value: 0.025263757590283552.
2026-05-15 20:02:51,732 - experiment_functions - INFO - Early stopping at epoch 900. Best Recall: 0.0178
2026-05-15 20:02:51,875 - optuna.study.study - INFO - Trial 180 finished with value: 0.017757020283076748 and parameters: {'n_layers': 4, 'embedding_dim': 64, 'lr': 0.03746957663780843, 'lambda_val': 7.240416264182407e-05, 'batch_size': 3384, 'optimizer': 'Adam'}. Best is trial 119 with value: 0.025263757590283552.
2026-05-15 20:03:05,467 - optuna.study._optimize - INFO - Trial 181 pruned. 
2026-05-15 20:03:16,047 - experiment_functions - INFO - Early stopping at epoch 1900. Best Recall: 0.0192
2026-05-15 20:03:16,170 - optuna.study.study - INFO - Trial 182 finished with value: 0.01916650144430806 and parameters: {'n_layers': 4, 'embedding_dim': 64, 'lr': 0.03432962099378744, 'lambda_val': 5.699993698229675e-05, 'batch_size': 3627, 'optimizer': 'Adam'}. Best is trial 119 with value: 0.025263757590283552.
2026-05-15 20:03:36,857 - experiment_functions - INFO - Early stopping at epoch 1600. Best Recall: 0.0189
2026-05-15 20:03:37,407 - optuna.study.study - INFO - Trial 183 finished with value: 0.018883124680766892 and parameters: {'n_layers': 4, 'embedding_dim': 64, 'lr': 0.042710800750319855, 'lambda_val': 2.2663470837207045e-05, 'batch_size': 3473, 'optimizer': 'Adam'}. Best is trial 119 with value: 0.025263757590283552.
2026-05-15 20:03:43,598 - optuna.study._optimize - INFO - Trial 184 pruned. 
2026-05-15 20:03:56,523 - experiment_functions - INFO - Early stopping at epoch 1400. Best Recall: 0.0176
2026-05-15 20:03:56,680 - optuna.study.study - INFO - Trial 185 finished with value: 0.017636531432769904 and parameters: {'n_layers': 4, 'embedding_dim': 64, 'lr': 0.02776087575413101, 'lambda_val': 6.654214174541701e-05, 'batch_size': 3753, 'optimizer': 'Adam'}. Best is trial 119 with value: 0.025263757590283552.
2026-05-15 20:04:07,987 - optuna.study._optimize - INFO - Trial 186 pruned. 
2026-05-15 20:04:14,657 - optuna.study._optimize - INFO - Trial 187 pruned. 
2026-05-15 20:04:31,444 - experiment_functions - INFO - Early stopping at epoch 2900. Best Recall: 0.0248
2026-05-15 20:04:31,609 - optuna.study.study - INFO - Trial 188 finished with value: 0.024836842368983755 and parameters: {'n_layers': 4, 'embedding_dim': 64, 'lr': 0.03832928034663297, 'lambda_val': 3.770593662379596e-05, 'batch_size': 3445, 'optimizer': 'Adam'}. Best is trial 119 with value: 0.025263757590283552.
2026-05-15 20:04:46,126 - experiment_functions - INFO - Early stopping at epoch 2400. Best Recall: 0.0211
2026-05-15 20:04:46,250 - optuna.study.study - INFO - Trial 189 finished with value: 0.02106935904281224 and parameters: {'n_layers': 4, 'embedding_dim': 64, 'lr': 0.03006492682870158, 'lambda_val': 3.5916531209269755e-05, 'batch_size': 3416, 'optimizer': 'Adam'}. Best is trial 119 with value: 0.025263757590283552.
2026-05-15 20:04:54,837 - experiment_functions - INFO - Early stopping at epoch 1000. Best Recall: 0.0191
2026-05-15 20:04:54,949 - optuna.study.study - INFO - Trial 190 finished with value: 0.019093122820135477 and parameters: {'n_layers': 4, 'embedding_dim': 64, 'lr': 0.038970480180562435, 'lambda_val': 2.5398282362684134e-05, 'batch_size': 3333, 'optimizer': 'Adam'}. Best is trial 119 with value: 0.025263757590283552.
