2026-05-15 20:37:29,497 - optuna.study.study - INFO - Trial 89 finished with value: 0.07126733195405362 and parameters: {'n_layers': 1, 'embedding_dim': 32, 'lr': 0.0005510097761999833, 'lambda_val': 3.233722748780406e-05, 'batch_size': 1379, 'optimizer': 'Adam'}. Best is trial 77 with value: 0.0794652188316307.
2026-05-15 20:37:34,343 - experiment_functions - INFO - Early stopping at epoch 800. Best Recall: 0.0503
2026-05-15 20:37:34,486 - optuna.study.study - INFO - Trial 90 finished with value: 0.05027217016038045 and parameters: {'n_layers': 1, 'embedding_dim': 32, 'lr': 0.001116161601564507, 'lambda_val': 0.05613178327093757, 'batch_size': 1381, 'optimizer': 'Adam'}. Best is trial 77 with value: 0.0794652188316307.
2026-05-15 20:37:50,348 - experiment_functions - INFO - Early stopping at epoch 2200. Best Recall: 0.0812
2026-05-15 20:37:50,453 - optuna.study.study - INFO - Trial 91 finished with value: 0.0811670044012248 and parameters: {'n_layers': 1, 'embedding_dim': 32, 'lr': 0.0005239782113284214, 'lambda_val': 3.11830522327175e-05, 'batch_size': 1490, 'optimizer': 'Adam'}. Best is trial 91 with value: 0.0811670044012248.
2026-05-15 20:38:00,876 - experiment_functions - INFO - Early stopping at epoch 2200. Best Recall: 0.0686
2026-05-15 20:38:00,977 - optuna.study.study - INFO - Trial 92 finished with value: 0.06864928514091972 and parameters: {'n_layers': 1, 'embedding_dim': 32, 'lr': 0.0004882411750989749, 'lambda_val': 3.122538934812642e-05, 'batch_size': 1506, 'optimizer': 'Adam'}. Best is trial 91 with value: 0.0811670044012248.
2026-05-15 20:38:07,049 - optuna.study._optimize - INFO - Trial 93 pruned. 
2026-05-15 20:38:12,519 - optuna.study._optimize - INFO - Trial 94 pruned. 
2026-05-15 20:38:18,991 - optuna.study._optimize - INFO - Trial 95 pruned. 
2026-05-15 20:38:26,344 - experiment_functions - INFO - Early stopping at epoch 1400. Best Recall: 0.0782
2026-05-15 20:38:26,466 - optuna.study.study - INFO - Trial 96 finished with value: 0.07824971390241386 and parameters: {'n_layers': 1, 'embedding_dim': 32, 'lr': 0.0006207448094551546, 'lambda_val': 4.609455348945428e-05, 'batch_size': 1130, 'optimizer': 'Adam'}. Best is trial 91 with value: 0.0811670044012248.
2026-05-15 20:38:42,026 - optuna.study._optimize - INFO - Trial 97 pruned. 
2026-05-15 20:38:49,165 - experiment_functions - INFO - Early stopping at epoch 1100. Best Recall: 0.0645
2026-05-15 20:38:49,266 - optuna.study.study - INFO - Trial 98 finished with value: 0.06448244930219675 and parameters: {'n_layers': 1, 'embedding_dim': 32, 'lr': 0.0009470048527196759, 'lambda_val': 7.056483290646407e-05, 'batch_size': 1144, 'optimizer': 'Adam'}. Best is trial 91 with value: 0.0811670044012248.
2026-05-15 20:38:54,921 - optuna.study._optimize - INFO - Trial 99 pruned. 
2026-05-15 20:39:08,181 - experiment_functions - INFO - Early stopping at epoch 2300. Best Recall: 0.0736
2026-05-15 20:39:08,291 - optuna.study.study - INFO - Trial 100 finished with value: 0.07358315851183254 and parameters: {'n_layers': 1, 'embedding_dim': 128, 'lr': 0.0012732306009926217, 'lambda_val': 4.613381770643569e-05, 'batch_size': 1247, 'optimizer': 'Adam'}. Best is trial 91 with value: 0.0811670044012248.
2026-05-15 20:39:26,523 - experiment_functions - INFO - Early stopping at epoch 1600. Best Recall: 0.0808
2026-05-15 20:39:26,721 - optuna.study.study - INFO - Trial 101 finished with value: 0.08081572236892298 and parameters: {'n_layers': 1, 'embedding_dim': 128, 'lr': 0.0011875505460502472, 'lambda_val': 4.116882305827893e-05, 'batch_size': 1235, 'optimizer': 'Adam'}. Best is trial 91 with value: 0.0811670044012248.
2026-05-15 20:39:36,311 - optuna.study._optimize - INFO - Trial 102 pruned. 
2026-05-15 20:39:44,546 - experiment_functions - INFO - Early stopping at epoch 1150. Best Recall: 0.0786
2026-05-15 20:39:44,657 - optuna.study.study - INFO - Trial 103 finished with value: 0.07857451277722932 and parameters: {'n_layers': 1, 'embedding_dim': 128, 'lr': 0.0012241306135049991, 'lambda_val': 4.245343630429124e-05, 'batch_size': 1236, 'optimizer': 'Adam'}. Best is trial 91 with value: 0.0811670044012248.
2026-05-15 20:39:51,233 - experiment_functions - INFO - Early stopping at epoch 1050. Best Recall: 0.0666
2026-05-15 20:39:51,334 - optuna.study.study - INFO - Trial 104 finished with value: 0.0665862434886429 and parameters: {'n_layers': 1, 'embedding_dim': 128, 'lr': 0.0012556417975853565, 'lambda_val': 4.314040780992648e-05, 'batch_size': 1023, 'optimizer': 'Adam'}. Best is trial 91 with value: 0.0811670044012248.
2026-05-15 20:40:01,004 - experiment_functions - INFO - Early stopping at epoch 1750. Best Recall: 0.0707
2026-05-15 20:40:01,125 - optuna.study.study - INFO - Trial 105 finished with value: 0.07069320691238654 and parameters: {'n_layers': 1, 'embedding_dim': 128, 'lr': 0.0007059401771790405, 'lambda_val': 2.930303923529461e-05, 'batch_size': 1105, 'optimizer': 'Adam'}. Best is trial 91 with value: 0.0811670044012248.
2026-05-15 20:40:07,384 - optuna.study._optimize - INFO - Trial 106 pruned. 
2026-05-15 20:40:16,944 - experiment_functions - INFO - Early stopping at epoch 1650. Best Recall: 0.0748
2026-05-15 20:40:17,066 - optuna.study.study - INFO - Trial 107 finished with value: 0.07484270671882375 and parameters: {'n_layers': 1, 'embedding_dim': 128, 'lr': 0.0006272718552642435, 'lambda_val': 3.7516935236094234e-05, 'batch_size': 1201, 'optimizer': 'Adam'}. Best is trial 91 with value: 0.0811670044012248.
2026-05-15 20:40:20,674 - experiment_functions - INFO - Early stopping at epoch 500. Best Recall: 0.0015
2026-05-15 20:40:20,785 - optuna.study.study - INFO - Trial 108 finished with value: 0.0015281902063946486 and parameters: {'n_layers': 1, 'embedding_dim': 128, 'lr': 0.001383651589110543, 'lambda_val': 9.060055909374737e-05, 'batch_size': 1224, 'optimizer': 'SGD'}. Best is trial 91 with value: 0.0811670044012248.
2026-05-15 20:40:27,629 - experiment_functions - INFO - Early stopping at epoch 1050. Best Recall: 0.0636
2026-05-15 20:40:27,761 - optuna.study.study - INFO - Trial 109 finished with value: 0.063605769215584 and parameters: {'n_layers': 1, 'embedding_dim': 128, 'lr': 0.0009657394878392953, 'lambda_val': 4.023130386840325e-05, 'batch_size': 936, 'optimizer': 'Adam'}. Best is trial 91 with value: 0.0811670044012248.
2026-05-15 20:40:35,287 - optuna.study._optimize - INFO - Trial 110 pruned. 
2026-05-15 20:40:41,670 - experiment_functions - INFO - Early stopping at epoch 1100. Best Recall: 0.0668
2026-05-15 20:40:41,837 - optuna.study.study - INFO - Trial 111 finished with value: 0.06678480975727236 and parameters: {'n_layers': 1, 'embedding_dim': 128, 'lr': 0.0006143964795847102, 'lambda_val': 5.0834175879089404e-05, 'batch_size': 1365, 'optimizer': 'Adam'}. Best is trial 91 with value: 0.0811670044012248.
2026-05-15 20:40:51,425 - experiment_functions - INFO - Early stopping at epoch 1700. Best Recall: 0.0723
2026-05-15 20:40:51,516 - optuna.study.study - INFO - Trial 112 finished with value: 0.07225213681070455 and parameters: {'n_layers': 1, 'embedding_dim': 128, 'lr': 0.0007144783862889378, 'lambda_val': 1.7797772068893026e-05, 'batch_size': 1037, 'optimizer': 'Adam'}. Best is trial 91 with value: 0.0811670044012248.
2026-05-15 20:40:58,703 - experiment_functions - INFO - Early stopping at epoch 1250. Best Recall: 0.0772
2026-05-15 20:40:58,805 - optuna.study.study - INFO - Trial 113 finished with value: 0.07715274233449063 and parameters: {'n_layers': 1, 'embedding_dim': 128, 'lr': 0.0010747030165361537, 'lambda_val': 1.7217175987729257e-05, 'batch_size': 1022, 'optimizer': 'Adam'}. Best is trial 91 with value: 0.0811670044012248.
2026-05-15 20:41:02,945 - experiment_functions - INFO - Early stopping at epoch 650. Best Recall: 0.0573
2026-05-15 20:41:03,047 - optuna.study.study - INFO - Trial 114 finished with value: 0.05732253875847713 and parameters: {'n_layers': 1, 'embedding_dim': 128, 'lr': 0.002772030452533657, 'lambda_val': 1.6273170195636106e-05, 'batch_size': 1025, 'optimizer': 'Adam'}. Best is trial 91 with value: 0.0811670044012248.
2026-05-15 20:41:08,795 - experiment_functions - INFO - Early stopping at epoch 900. Best Recall: 0.0613
2026-05-15 20:41:08,951 - optuna.study.study - INFO - Trial 115 finished with value: 0.06127105057508779 and parameters: {'n_layers': 1, 'embedding_dim': 128, 'lr': 0.0011248124484659673, 'lambda_val': 2.7226568389518154e-05, 'batch_size': 1220, 'optimizer': 'Adam'}. Best is trial 91 with value: 0.0811670044012248.
2026-05-15 20:41:15,046 - optuna.study._optimize - INFO - Trial 116 pruned. 
2026-05-15 20:41:20,671 - experiment_functions - INFO - Early stopping at epoch 1000. Best Recall: 0.0709
2026-05-15 20:41:20,760 - optuna.study.study - INFO - Trial 117 finished with value: 0.07086004723631277 and parameters: {'n_layers': 1, 'embedding_dim': 128, 'lr': 0.0015448325433317202, 'lambda_val': 8.001845764344571e-06, 'batch_size': 792, 'optimizer': 'Adam'}. Best is trial 91 with value: 0.0811670044012248.
2026-05-15 20:41:27,160 - experiment_functions - INFO - Early stopping at epoch 1050. Best Recall: 0.0652
2026-05-15 20:41:27,272 - optuna.study.study - INFO - Trial 118 finished with value: 0.06521322188106807 and parameters: {'n_layers': 1, 'embedding_dim': 128, 'lr': 0.0007044169553391764, 'lambda_val': 1.9064177294267062e-05, 'batch_size': 1138, 'optimizer': 'RMSprop'}. Best is trial 91 with value: 0.0811670044012248.
2026-05-15 20:41:34,685 - optuna.study._optimize - INFO - Trial 119 pruned. 
2026-05-15 20:41:42,456 - optuna.study._optimize - INFO - Trial 120 pruned. 
2026-05-15 20:41:51,885 - optuna.study._optimize - INFO - Trial 121 pruned. 
2026-05-15 20:42:01,543 - experiment_functions - INFO - Early stopping at epoch 1700. Best Recall: 0.0699
2026-05-15 20:42:01,710 - optuna.study.study - INFO - Trial 122 finished with value: 0.06988314125238801 and parameters: {'n_layers': 1, 'embedding_dim': 128, 'lr': 0.0006422392867737622, 'lambda_val': 2.715878540688556e-05, 'batch_size': 996, 'optimizer': 'Adam'}. Best is trial 91 with value: 0.0811670044012248.
2026-05-15 20:42:07,661 - optuna.study._optimize - INFO - Trial 123 pruned. 
2026-05-15 20:42:17,353 - experiment_functions - INFO - Early stopping at epoch 1600. Best Recall: 0.0715
2026-05-15 20:42:17,462 - optuna.study.study - INFO - Trial 124 finished with value: 0.07153641785893113 and parameters: {'n_layers': 1, 'embedding_dim': 128, 'lr': 0.0007723083871520955, 'lambda_val': 1.928973440528996e-05, 'batch_size': 1092, 'optimizer': 'Adam'}. Best is trial 91 with value: 0.0811670044012248.
2026-05-15 20:42:27,984 - experiment_functions - INFO - Early stopping at epoch 1750. Best Recall: 0.0731
2026-05-15 20:42:28,125 - optuna.study.study - INFO - Trial 125 finished with value: 0.07309879522449617 and parameters: {'n_layers': 1, 'embedding_dim': 128, 'lr': 0.0008541917383638777, 'lambda_val': 9.574234733708267e-06, 'batch_size': 1119, 'optimizer': 'Adam'}. Best is trial 91 with value: 0.0811670044012248.
2026-05-15 20:42:37,327 - experiment_functions - INFO - Early stopping at epoch 1150. Best Recall: 0.0700
2026-05-15 20:42:37,466 - optuna.study.study - INFO - Trial 126 finished with value: 0.07004844767573808 and parameters: {'n_layers': 1, 'embedding_dim': 128, 'lr': 0.0014639834842495392, 'lambda_val': 1.3969003074705004e-05, 'batch_size': 1215, 'optimizer': 'Adam'}. Best is trial 91 with value: 0.0811670044012248.
2026-05-15 20:42:49,833 - experiment_functions - INFO - Early stopping at epoch 1700. Best Recall: 0.0775
2026-05-15 20:42:50,017 - optuna.study.study - INFO - Trial 127 finished with value: 0.07747117147051806 and parameters: {'n_layers': 1, 'embedding_dim': 128, 'lr': 0.0009167286005065177, 'lambda_val': 9.300085428900655e-06, 'batch_size': 920, 'optimizer': 'Adam'}. Best is trial 91 with value: 0.0811670044012248.
2026-05-15 20:43:00,251 - experiment_functions - INFO - Early stopping at epoch 1600. Best Recall: 0.0692
2026-05-15 20:43:00,400 - optuna.study.study - INFO - Trial 128 finished with value: 0.06921843862282721 and parameters: {'n_layers': 1, 'embedding_dim': 128, 'lr': 0.0009488687706566315, 'lambda_val': 4.8421258311118736e-06, 'batch_size': 891, 'optimizer': 'Adam'}. Best is trial 91 with value: 0.0811670044012248.
2026-05-15 20:43:18,793 - experiment_functions - INFO - Early stopping at epoch 2650. Best Recall: 0.0716
2026-05-15 20:43:18,931 - optuna.study.study - INFO - Trial 129 finished with value: 0.07160523335327248 and parameters: {'n_layers': 1, 'embedding_dim': 256, 'lr': 0.001804364701558382, 'lambda_val': 1.0379696565160442e-05, 'batch_size': 623, 'optimizer': 'Adam'}. Best is trial 91 with value: 0.0811670044012248.
2026-05-15 20:43:22,793 - experiment_functions - INFO - Early stopping at epoch 500. Best Recall: 0.0034
2026-05-15 20:43:22,907 - optuna.study.study - INFO - Trial 130 finished with value: 0.0033581592320305886 and parameters: {'n_layers': 1, 'embedding_dim': 64, 'lr': 0.0004275365687897685, 'lambda_val': 9.06436305520707e-06, 'batch_size': 1110, 'optimizer': 'SGD'}. Best is trial 91 with value: 0.0811670044012248.
2026-05-15 20:43:28,512 - experiment_functions - INFO - Early stopping at epoch 950. Best Recall: 0.0634
2026-05-15 20:43:28,814 - optuna.study.study - INFO - Trial 131 finished with value: 0.0633876991798742 and parameters: {'n_layers': 1, 'embedding_dim': 128, 'lr': 0.0011868156526590303, 'lambda_val': 5.911634360089577e-06, 'batch_size': 1172, 'optimizer': 'Adam'}. Best is trial 91 with value: 0.0811670044012248.
2026-05-15 20:43:38,513 - experiment_functions - INFO - Early stopping at epoch 1750. Best Recall: 0.0709
2026-05-15 20:43:38,615 - optuna.study.study - INFO - Trial 132 finished with value: 0.07088229180326748 and parameters: {'n_layers': 1, 'embedding_dim': 128, 'lr': 0.0005809758408652547, 'lambda_val': 3.545613092509316e-05, 'batch_size': 973, 'optimizer': 'Adam'}. Best is trial 91 with value: 0.0811670044012248.
2026-05-15 20:43:48,867 - experiment_functions - INFO - Early stopping at epoch 1750. Best Recall: 0.0768
2026-05-15 20:43:48,990 - optuna.study.study - INFO - Trial 133 finished with value: 0.07675331408796075 and parameters: {'n_layers': 1, 'embedding_dim': 128, 'lr': 0.0007145023686777581, 'lambda_val': 2.367723365146163e-05, 'batch_size': 1252, 'optimizer': 'Adam'}. Best is trial 91 with value: 0.0811670044012248.
2026-05-15 20:43:56,491 - experiment_functions - INFO - Early stopping at epoch 1100. Best Recall: 0.0774
2026-05-15 20:43:56,611 - optuna.study.study - INFO - Trial 134 finished with value: 0.07737228047358471 and parameters: {'n_layers': 1, 'embedding_dim': 128, 'lr': 0.0008969924903965095, 'lambda_val': 7.843491878073693e-05, 'batch_size': 1270, 'optimizer': 'Adam'}. Best is trial 91 with value: 0.0811670044012248.
2026-05-15 20:44:02,091 - experiment_functions - INFO - Early stopping at epoch 850. Best Recall: 0.0613
2026-05-15 20:44:02,212 - optuna.study.study - INFO - Trial 135 finished with value: 0.061331797406452684 and parameters: {'n_layers': 1, 'embedding_dim': 128, 'lr': 0.0011099376303804985, 'lambda_val': 0.00010208303289060543, 'batch_size': 1330, 'optimizer': 'Adam'}. Best is trial 91 with value: 0.0811670044012248.
2026-05-15 20:44:11,217 - experiment_functions - INFO - Early stopping at epoch 1400. Best Recall: 0.0712
2026-05-15 20:44:11,329 - optuna.study.study - INFO - Trial 136 finished with value: 0.07116547341976029 and parameters: {'n_layers': 1, 'embedding_dim': 128, 'lr': 0.0013936550621698037, 'lambda_val': 8.031197310103197e-05, 'batch_size': 1474, 'optimizer': 'Adam'}. Best is trial 91 with value: 0.0811670044012248.
2026-05-15 20:44:15,194 - experiment_functions - INFO - Early stopping at epoch 600. Best Recall: 0.0783
2026-05-15 20:44:15,296 - optuna.study.study - INFO - Trial 137 finished with value: 0.07833464110985833 and parameters: {'n_layers': 1, 'embedding_dim': 128, 'lr': 0.002428666861934826, 'lambda_val': 5.573612426801438e-05, 'batch_size': 1566, 'optimizer': 'Adam'}. Best is trial 91 with value: 0.0811670044012248.
2026-05-15 20:44:19,096 - experiment_functions - INFO - Early stopping at epoch 600. Best Recall: 0.0609
2026-05-15 20:44:19,197 - optuna.study.study - INFO - Trial 138 finished with value: 0.06089657496287422 and parameters: {'n_layers': 1, 'embedding_dim': 128, 'lr': 0.003732523942236554, 'lambda_val': 6.938215220613674e-05, 'batch_size': 1464, 'optimizer': 'Adam'}. Best is trial 91 with value: 0.0811670044012248.
2026-05-15 20:44:24,288 - experiment_functions - INFO - Early stopping at epoch 550. Best Recall: 0.0235
2026-05-15 20:44:24,390 - optuna.study.study - INFO - Trial 139 finished with value: 0.0235015036145974 and parameters: {'n_layers': 4, 'embedding_dim': 128, 'lr': 0.0023150450276112696, 'lambda_val': 2.3504365544676726e-05, 'batch_size': 1608, 'optimizer': 'Adam'}. Best is trial 91 with value: 0.0811670044012248.
2026-05-15 20:44:31,756 - experiment_functions - INFO - Early stopping at epoch 850. Best Recall: 0.0387
2026-05-15 20:44:31,846 - optuna.study.study - INFO - Trial 140 finished with value: 0.03874378439279504 and parameters: {'n_layers': 3, 'embedding_dim': 256, 'lr': 0.0005041185017644547, 'lambda_val': 0.0002365968929501884, 'batch_size': 2088, 'optimizer': 'Adam'}. Best is trial 91 with value: 0.0811670044012248.
2026-05-15 20:44:41,566 - experiment_functions - INFO - Early stopping at epoch 1750. Best Recall: 0.0717
2026-05-15 20:44:41,668 - optuna.study.study - INFO - Trial 141 finished with value: 0.07170532981894952 and parameters: {'n_layers': 1, 'embedding_dim': 128, 'lr': 0.0009345390150217798, 'lambda_val': 4.6596871788129966e-05, 'batch_size': 1404, 'optimizer': 'Adam'}. Best is trial 91 with value: 0.0811670044012248.
2026-05-15 20:44:50,461 - experiment_functions - INFO - Early stopping at epoch 1500. Best Recall: 0.0681
2026-05-15 20:44:50,563 - optuna.study.study - INFO - Trial 142 finished with value: 0.0681294214758602 and parameters: {'n_layers': 1, 'embedding_dim': 128, 'lr': 0.0006636405875289441, 'lambda_val': 5.8793802065104496e-05, 'batch_size': 1241, 'optimizer': 'Adam'}. Best is trial 91 with value: 0.0811670044012248.
2026-05-15 20:44:55,092 - experiment_functions - INFO - Early stopping at epoch 700. Best Recall: 0.0677
2026-05-15 20:44:55,203 - optuna.study.study - INFO - Trial 143 finished with value: 0.0677132552577537 and parameters: {'n_layers': 1, 'embedding_dim': 128, 'lr': 0.0015112965935468196, 'lambda_val': 0.00012145123572668259, 'batch_size': 1554, 'optimizer': 'Adam'}. Best is trial 91 with value: 0.0811670044012248.
2026-05-15 20:45:01,318 - experiment_functions - INFO - Early stopping at epoch 950. Best Recall: 0.0718
2026-05-15 20:45:01,431 - optuna.study.study - INFO - Trial 144 finished with value: 0.07181069356738265 and parameters: {'n_layers': 1, 'embedding_dim': 128, 'lr': 0.0007855000313528388, 'lambda_val': 4.345566426616844e-05, 'batch_size': 1286, 'optimizer': 'Adam'}. Best is trial 91 with value: 0.0811670044012248.
2026-05-15 20:45:05,688 - experiment_functions - INFO - Early stopping at epoch 700. Best Recall: 0.0699
2026-05-15 20:45:05,802 - optuna.study.study - INFO - Trial 145 finished with value: 0.06994746831129188 and parameters: {'n_layers': 1, 'embedding_dim': 128, 'lr': 0.0018356212201791964, 'lambda_val': 3.172900944074484e-05, 'batch_size': 1200, 'optimizer': 'Adam'}. Best is trial 91 with value: 0.0811670044012248.
2026-05-15 20:45:11,597 - optuna.study._optimize - INFO - Trial 146 pruned. 
2026-05-15 20:45:18,358 - optuna.study._optimize - INFO - Trial 147 pruned. 
2026-05-15 20:45:24,205 - optuna.study._optimize - INFO - Trial 148 pruned. 
2026-05-15 20:45:30,133 - optuna.study._optimize - INFO - Trial 149 pruned. 
2026-05-15 20:45:40,472 - experiment_functions - INFO - Early stopping at epoch 1850. Best Recall: 0.0701
2026-05-15 20:45:40,563 - optuna.study.study - INFO - Trial 150 finished with value: 0.0701061535637363 and parameters: {'n_layers': 1, 'embedding_dim': 128, 'lr': 0.0012561209421578338, 'lambda_val': 2.417534974459377e-05, 'batch_size': 1258, 'optimizer': 'Adam'}. Best is trial 91 with value: 0.0811670044012248.
2026-05-15 20:45:46,249 - experiment_functions - INFO - Early stopping at epoch 950. Best Recall: 0.0700
2026-05-15 20:45:46,396 - optuna.study.study - INFO - Trial 151 finished with value: 0.06997199207968419 and parameters: {'n_layers': 1, 'embedding_dim': 128, 'lr': 0.0009924686660281337, 'lambda_val': 2.9207901139596635e-05, 'batch_size': 1709, 'optimizer': 'Adam'}. Best is trial 91 with value: 0.0811670044012248.
2026-05-15 20:45:55,275 - experiment_functions - INFO - Early stopping at epoch 1450. Best Recall: 0.0783
2026-05-15 20:45:55,396 - optuna.study.study - INFO - Trial 152 finished with value: 0.07827511026514157 and parameters: {'n_layers': 1, 'embedding_dim': 128, 'lr': 0.0008474379813620098, 'lambda_val': 2.9135594037546692e-06, 'batch_size': 1096, 'optimizer': 'Adam'}. Best is trial 91 with value: 0.0811670044012248.
2026-05-15 20:46:01,575 - optuna.study._optimize - INFO - Trial 153 pruned. 
2026-05-15 20:46:10,152 - experiment_functions - INFO - Early stopping at epoch 1450. Best Recall: 0.0700
2026-05-15 20:46:10,333 - optuna.study.study - INFO - Trial 154 finished with value: 0.06999499822186395 and parameters: {'n_layers': 1, 'embedding_dim': 128, 'lr': 0.000615420095032318, 'lambda_val': 4.010657088287383e-06, 'batch_size': 1076, 'optimizer': 'Adam'}. Best is trial 91 with value: 0.0811670044012248.
2026-05-15 20:46:17,091 - optuna.study._optimize - INFO - Trial 155 pruned. 
2026-05-15 20:46:21,376 - experiment_functions - INFO - Early stopping at epoch 650. Best Recall: 0.0603
2026-05-15 20:46:21,486 - optuna.study.study - INFO - Trial 156 finished with value: 0.06033057034312078 and parameters: {'n_layers': 1, 'embedding_dim': 128, 'lr': 0.0025717502348079034, 'lambda_val': 1.9458892068326536e-06, 'batch_size': 1157, 'optimizer': 'Adam'}. Best is trial 91 with value: 0.0811670044012248.
