2026-05-15 19:02:29,515 - optuna.study.study - INFO - Trial 71 finished with value: 0.13301571571525522 and parameters: {'n_layers': 1, 'embedding_dim': 256, 'lr': 0.0011814818349589224, 'lambda_val': 3.948512353644223e-05, 'batch_size': 1672, 'optimizer': 'Adam'}. Best is trial 65 with value: 0.14314842153817933.
2026-05-15 19:02:34,179 - experiment_functions - INFO - Early stopping at epoch 550. Best Recall: 0.0270
2026-05-15 19:02:34,311 - optuna.study.study - INFO - Trial 72 finished with value: 0.026993818277359086 and parameters: {'n_layers': 1, 'embedding_dim': 256, 'lr': 0.0488869725528204, 'lambda_val': 3.70726735901364e-05, 'batch_size': 1677, 'optimizer': 'Adam'}. Best is trial 65 with value: 0.14314842153817933.
2026-05-15 19:02:42,488 - experiment_functions - INFO - Early stopping at epoch 1200. Best Recall: 0.1300
2026-05-15 19:02:42,590 - optuna.study.study - INFO - Trial 73 finished with value: 0.1299866338553776 and parameters: {'n_layers': 1, 'embedding_dim': 256, 'lr': 0.0006670358278376969, 'lambda_val': 0.0005892294767632011, 'batch_size': 1450, 'optimizer': 'Adam'}. Best is trial 65 with value: 0.14314842153817933.
2026-05-15 19:02:49,593 - optuna.study._optimize - INFO - Trial 74 pruned. 
2026-05-15 19:02:56,929 - optuna.study._optimize - INFO - Trial 75 pruned. 
2026-05-15 19:03:04,055 - experiment_functions - INFO - Early stopping at epoch 950. Best Recall: 0.1266
2026-05-15 19:03:04,186 - optuna.study.study - INFO - Trial 76 finished with value: 0.12664777427067384 and parameters: {'n_layers': 1, 'embedding_dim': 256, 'lr': 0.001043868877278439, 'lambda_val': 0.0014824355446039286, 'batch_size': 1693, 'optimizer': 'Adam'}. Best is trial 65 with value: 0.14314842153817933.
2026-05-15 19:03:08,266 - experiment_functions - INFO - Early stopping at epoch 600. Best Recall: 0.0789
2026-05-15 19:03:08,380 - optuna.study.study - INFO - Trial 77 finished with value: 0.07886303042555774 and parameters: {'n_layers': 1, 'embedding_dim': 32, 'lr': 0.005088457293438916, 'lambda_val': 0.00015128494222270254, 'batch_size': 2035, 'optimizer': 'Adam'}. Best is trial 65 with value: 0.14314842153817933.
2026-05-15 19:03:13,778 - experiment_functions - INFO - Early stopping at epoch 700. Best Recall: 0.1149
2026-05-15 19:03:13,879 - optuna.study.study - INFO - Trial 78 finished with value: 0.1149257340739843 and parameters: {'n_layers': 1, 'embedding_dim': 256, 'lr': 0.0018266573923854058, 'lambda_val': 0.0004816433100004147, 'batch_size': 1302, 'optimizer': 'Adam'}. Best is trial 65 with value: 0.14314842153817933.
2026-05-15 19:03:21,008 - optuna.study._optimize - INFO - Trial 79 pruned. 
2026-05-15 19:03:24,839 - experiment_functions - INFO - Early stopping at epoch 500. Best Recall: 0.0030
2026-05-15 19:03:24,940 - optuna.study.study - INFO - Trial 80 finished with value: 0.003005621137975114 and parameters: {'n_layers': 1, 'embedding_dim': 256, 'lr': 0.00026471019692532124, 'lambda_val': 0.0002672535612059714, 'batch_size': 2808, 'optimizer': 'SGD'}. Best is trial 65 with value: 0.14314842153817933.
2026-05-15 19:03:31,623 - experiment_functions - INFO - Early stopping at epoch 850. Best Recall: 0.1110
2026-05-15 19:03:31,732 - optuna.study.study - INFO - Trial 81 finished with value: 0.11097011633414113 and parameters: {'n_layers': 1, 'embedding_dim': 256, 'lr': 0.001050252726426271, 'lambda_val': 0.002719782704000954, 'batch_size': 1655, 'optimizer': 'Adam'}. Best is trial 65 with value: 0.14314842153817933.
2026-05-15 19:03:38,254 - experiment_functions - INFO - Early stopping at epoch 600. Best Recall: 0.0381
2026-05-15 19:03:38,357 - optuna.study.study - INFO - Trial 82 finished with value: 0.03806582757248873 and parameters: {'n_layers': 4, 'embedding_dim': 256, 'lr': 0.0013012390445131805, 'lambda_val': 0.0012766856490399262, 'batch_size': 1911, 'optimizer': 'Adam'}. Best is trial 65 with value: 0.14314842153817933.
2026-05-15 19:03:45,081 - experiment_functions - INFO - Early stopping at epoch 950. Best Recall: 0.1233
2026-05-15 19:03:45,172 - optuna.study.study - INFO - Trial 83 finished with value: 0.12331437183651901 and parameters: {'n_layers': 1, 'embedding_dim': 256, 'lr': 0.0008310298180191903, 'lambda_val': 0.0007212159747634089, 'batch_size': 3792, 'optimizer': 'Adam'}. Best is trial 65 with value: 0.14314842153817933.
2026-05-15 19:03:54,233 - optuna.study._optimize - INFO - Trial 84 pruned. 
2026-05-15 19:04:00,729 - optuna.study._optimize - INFO - Trial 85 pruned. 
2026-05-15 19:04:07,798 - experiment_functions - INFO - Early stopping at epoch 950. Best Recall: 0.1205
2026-05-15 19:04:07,900 - optuna.study.study - INFO - Trial 86 finished with value: 0.12052574379987782 and parameters: {'n_layers': 1, 'embedding_dim': 256, 'lr': 0.0011108099428170102, 'lambda_val': 0.0005311431995639577, 'batch_size': 1225, 'optimizer': 'Adam'}. Best is trial 65 with value: 0.14314842153817933.
2026-05-15 19:04:16,717 - experiment_functions - INFO - Early stopping at epoch 1200. Best Recall: 0.1268
2026-05-15 19:04:16,831 - optuna.study.study - INFO - Trial 87 finished with value: 0.126751784445216 and parameters: {'n_layers': 1, 'embedding_dim': 256, 'lr': 0.0007356755190531281, 'lambda_val': 1.3455347260547043e-05, 'batch_size': 2338, 'optimizer': 'Adam'}. Best is trial 65 with value: 0.14314842153817933.
2026-05-15 19:04:23,131 - optuna.study._optimize - INFO - Trial 88 pruned. 
2026-05-15 19:04:30,533 - optuna.study._optimize - INFO - Trial 89 pruned. 
2026-05-15 19:04:37,614 - optuna.study._optimize - INFO - Trial 90 pruned. 
2026-05-15 19:04:45,197 - optuna.study._optimize - INFO - Trial 91 pruned. 
2026-05-15 19:04:49,956 - experiment_functions - INFO - Early stopping at epoch 650. Best Recall: 0.0895
2026-05-15 19:04:50,114 - optuna.study.study - INFO - Trial 92 finished with value: 0.08950482603178003 and parameters: {'n_layers': 1, 'embedding_dim': 256, 'lr': 0.0016964044527673883, 'lambda_val': 0.008101407191723626, 'batch_size': 1811, 'optimizer': 'Adam'}. Best is trial 65 with value: 0.14314842153817933.
2026-05-15 19:05:04,039 - experiment_functions - INFO - Early stopping at epoch 2050. Best Recall: 0.1380
2026-05-15 19:05:04,150 - optuna.study.study - INFO - Trial 93 finished with value: 0.13796571508844932 and parameters: {'n_layers': 1, 'embedding_dim': 256, 'lr': 0.0005169608680740039, 'lambda_val': 1.2752369072481607e-05, 'batch_size': 2143, 'optimizer': 'Adam'}. Best is trial 65 with value: 0.14314842153817933.
2026-05-15 19:05:11,539 - optuna.study._optimize - INFO - Trial 94 pruned. 
2026-05-15 19:05:29,256 - experiment_functions - INFO - Early stopping at epoch 2600. Best Recall: 0.1412
2026-05-15 19:05:29,378 - optuna.study.study - INFO - Trial 95 finished with value: 0.14119264201998485 and parameters: {'n_layers': 1, 'embedding_dim': 256, 'lr': 0.0003723670486070939, 'lambda_val': 6.896695900492858e-06, 'batch_size': 2666, 'optimizer': 'Adam'}. Best is trial 65 with value: 0.14314842153817933.
2026-05-15 19:05:36,269 - optuna.study._optimize - INFO - Trial 96 pruned. 
2026-05-15 19:05:43,628 - optuna.study._optimize - INFO - Trial 97 pruned. 
2026-05-15 19:05:51,721 - optuna.study._optimize - INFO - Trial 98 pruned. 
2026-05-15 19:06:01,708 - experiment_functions - INFO - Early stopping at epoch 500. Best Recall: 0.0016
2026-05-15 19:06:01,944 - optuna.study.study - INFO - Trial 99 finished with value: 0.0016262997158747784 and parameters: {'n_layers': 1, 'embedding_dim': 256, 'lr': 0.0005952377137532067, 'lambda_val': 2.0692692862857594e-05, 'batch_size': 1595, 'optimizer': 'SGD'}. Best is trial 65 with value: 0.14314842153817933.
2026-05-15 19:06:09,411 - optuna.study._optimize - INFO - Trial 100 pruned. 
2026-05-15 19:06:16,380 - optuna.study._optimize - INFO - Trial 101 pruned. 
2026-05-15 19:06:22,344 - experiment_functions - INFO - Early stopping at epoch 750. Best Recall: 0.1197
2026-05-15 19:06:22,456 - optuna.study.study - INFO - Trial 102 finished with value: 0.11971015685003719 and parameters: {'n_layers': 1, 'embedding_dim': 256, 'lr': 0.0013657715569284528, 'lambda_val': 1.5385915864469028e-05, 'batch_size': 3020, 'optimizer': 'Adam'}. Best is trial 65 with value: 0.14314842153817933.
2026-05-15 19:06:29,890 - experiment_functions - INFO - Early stopping at epoch 900. Best Recall: 0.1234
2026-05-15 19:06:30,411 - optuna.study.study - INFO - Trial 103 finished with value: 0.12339126191784568 and parameters: {'n_layers': 1, 'embedding_dim': 256, 'lr': 0.0008150834677076894, 'lambda_val': 4.7400418879303524e-05, 'batch_size': 3318, 'optimizer': 'Adam'}. Best is trial 65 with value: 0.14314842153817933.
2026-05-15 19:06:43,307 - optuna.study._optimize - INFO - Trial 104 pruned. 
2026-05-15 19:06:51,068 - optuna.study._optimize - INFO - Trial 105 pruned. 
2026-05-15 19:06:58,033 - optuna.study._optimize - INFO - Trial 106 pruned. 
2026-05-15 19:07:05,613 - optuna.study._optimize - INFO - Trial 107 pruned. 
2026-05-15 19:07:10,747 - experiment_functions - INFO - Early stopping at epoch 650. Best Recall: 0.1193
2026-05-15 19:07:10,857 - optuna.study.study - INFO - Trial 108 finished with value: 0.11926784155662697 and parameters: {'n_layers': 1, 'embedding_dim': 256, 'lr': 0.002134040935703162, 'lambda_val': 8.37716463031624e-05, 'batch_size': 2056, 'optimizer': 'Adam'}. Best is trial 65 with value: 0.14314842153817933.
2026-05-15 19:07:16,496 - experiment_functions - INFO - Early stopping at epoch 800. Best Recall: 0.1033
2026-05-15 19:07:16,619 - optuna.study.study - INFO - Trial 109 finished with value: 0.10329028689514645 and parameters: {'n_layers': 1, 'embedding_dim': 256, 'lr': 0.0011910036349349464, 'lambda_val': 5.409568055303949e-06, 'batch_size': 1189, 'optimizer': 'RMSprop'}. Best is trial 65 with value: 0.14314842153817933.
2026-05-15 19:07:23,785 - optuna.study._optimize - INFO - Trial 110 pruned. 
2026-05-15 19:07:37,932 - experiment_functions - INFO - Early stopping at epoch 2150. Best Recall: 0.1368
2026-05-15 19:07:38,056 - optuna.study.study - INFO - Trial 111 finished with value: 0.13681517621165218 and parameters: {'n_layers': 1, 'embedding_dim': 256, 'lr': 0.0005164658068880907, 'lambda_val': 2.8243372936722398e-05, 'batch_size': 1704, 'optimizer': 'Adam'}. Best is trial 65 with value: 0.14314842153817933.
2026-05-15 19:07:49,853 - optuna.study._optimize - INFO - Trial 112 pruned. 
2026-05-15 19:08:01,125 - optuna.study._optimize - INFO - Trial 113 pruned. 
2026-05-15 19:08:08,058 - optuna.study._optimize - INFO - Trial 114 pruned. 
2026-05-15 19:08:15,322 - experiment_functions - INFO - Early stopping at epoch 1050. Best Recall: 0.1269
2026-05-15 19:08:15,444 - optuna.study.study - INFO - Trial 115 finished with value: 0.1268968922431518 and parameters: {'n_layers': 1, 'embedding_dim': 256, 'lr': 0.0009400314945596499, 'lambda_val': 1.6426445357141287e-05, 'batch_size': 1620, 'optimizer': 'Adam'}. Best is trial 65 with value: 0.14314842153817933.
2026-05-15 19:08:28,790 - optuna.study._optimize - INFO - Trial 116 pruned. 
2026-05-15 19:08:35,819 - optuna.study._optimize - INFO - Trial 117 pruned. 
2026-05-15 19:08:41,277 - experiment_functions - INFO - Early stopping at epoch 850. Best Recall: 0.1094
2026-05-15 19:08:41,388 - optuna.study.study - INFO - Trial 118 finished with value: 0.10944549042948248 and parameters: {'n_layers': 1, 'embedding_dim': 32, 'lr': 0.0015944473448670702, 'lambda_val': 3.966164875145915e-06, 'batch_size': 1461, 'optimizer': 'Adam'}. Best is trial 65 with value: 0.14314842153817933.
2026-05-15 19:08:45,283 - experiment_functions - INFO - Early stopping at epoch 500. Best Recall: 0.0015
2026-05-15 19:08:45,406 - optuna.study.study - INFO - Trial 119 finished with value: 0.0014793157804844396 and parameters: {'n_layers': 1, 'embedding_dim': 256, 'lr': 0.0003633462330876985, 'lambda_val': 0.0003159011869324165, 'batch_size': 1725, 'optimizer': 'SGD'}. Best is trial 65 with value: 0.14314842153817933.
2026-05-15 19:08:56,063 - optuna.study._optimize - INFO - Trial 120 pruned. 
2026-05-15 19:09:03,393 - optuna.study._optimize - INFO - Trial 121 pruned. 
2026-05-15 19:09:09,932 - experiment_functions - INFO - Early stopping at epoch 950. Best Recall: 0.1174
2026-05-15 19:09:10,035 - optuna.study.study - INFO - Trial 122 finished with value: 0.11744769640604975 and parameters: {'n_layers': 1, 'embedding_dim': 256, 'lr': 0.0013008576218940437, 'lambda_val': 2.2475544247452333e-05, 'batch_size': 1411, 'optimizer': 'Adam'}. Best is trial 65 with value: 0.14314842153817933.
2026-05-15 19:09:17,178 - optuna.study._optimize - INFO - Trial 123 pruned. 
2026-05-15 19:09:24,955 - optuna.study._optimize - INFO - Trial 124 pruned. 
2026-05-15 19:09:31,696 - optuna.study._optimize - INFO - Trial 125 pruned. 
2026-05-15 19:09:39,087 - optuna.study._optimize - INFO - Trial 126 pruned. 
2026-05-15 19:09:45,937 - optuna.study._optimize - INFO - Trial 127 pruned. 
2026-05-15 19:10:00,052 - optuna.study._optimize - INFO - Trial 128 pruned. 
2026-05-15 19:10:09,044 - optuna.study._optimize - INFO - Trial 129 pruned. 
2026-05-15 19:10:24,125 - optuna.study._optimize - INFO - Trial 130 pruned. 
2026-05-15 19:10:32,707 - experiment_functions - INFO - Early stopping at epoch 900. Best Recall: 0.1159
2026-05-15 19:10:32,820 - optuna.study.study - INFO - Trial 131 finished with value: 0.11586668133328523 and parameters: {'n_layers': 1, 'embedding_dim': 256, 'lr': 0.0011250101836888916, 'lambda_val': 0.0013945669143558752, 'batch_size': 1607, 'optimizer': 'Adam'}. Best is trial 65 with value: 0.14314842153817933.
2026-05-15 19:10:39,680 - experiment_functions - INFO - Early stopping at epoch 900. Best Recall: 0.1224
2026-05-15 19:10:39,858 - optuna.study.study - INFO - Trial 132 finished with value: 0.12240500607447097 and parameters: {'n_layers': 1, 'embedding_dim': 256, 'lr': 0.000991855386195686, 'lambda_val': 1.3676861806879697e-05, 'batch_size': 1719, 'optimizer': 'Adam'}. Best is trial 65 with value: 0.14314842153817933.
2026-05-15 19:10:44,831 - experiment_functions - INFO - Early stopping at epoch 700. Best Recall: 0.1027
2026-05-15 19:10:44,945 - optuna.study.study - INFO - Trial 133 finished with value: 0.10274325097404126 and parameters: {'n_layers': 1, 'embedding_dim': 256, 'lr': 0.0014960341117958044, 'lambda_val': 0.003199065732234822, 'batch_size': 1518, 'optimizer': 'Adam'}. Best is trial 65 with value: 0.14314842153817933.
2026-05-15 19:10:52,004 - optuna.study._optimize - INFO - Trial 134 pruned. 
2026-05-15 19:10:59,537 - optuna.study._optimize - INFO - Trial 135 pruned. 
2026-05-15 19:11:04,971 - experiment_functions - INFO - Early stopping at epoch 750. Best Recall: 0.1090
2026-05-15 19:11:05,095 - optuna.study.study - INFO - Trial 136 finished with value: 0.10902209237504089 and parameters: {'n_layers': 1, 'embedding_dim': 256, 'lr': 0.0019371777785060554, 'lambda_val': 0.0001825137387457934, 'batch_size': 1478, 'optimizer': 'Adam'}. Best is trial 65 with value: 0.14314842153817933.
2026-05-15 19:11:11,421 - experiment_functions - INFO - Early stopping at epoch 850. Best Recall: 0.1221
2026-05-15 19:11:11,532 - optuna.study.study - INFO - Trial 137 finished with value: 0.12206007824763673 and parameters: {'n_layers': 1, 'embedding_dim': 256, 'lr': 0.0009740771724194647, 'lambda_val': 2.1944355816580954e-05, 'batch_size': 1776, 'optimizer': 'Adam'}. Best is trial 65 with value: 0.14314842153817933.
2026-05-15 19:11:18,810 - optuna.study._optimize - INFO - Trial 138 pruned. 
2026-05-15 19:11:27,056 - optuna.study._optimize - INFO - Trial 139 pruned. 
2026-05-15 19:11:34,195 - optuna.study._optimize - INFO - Trial 140 pruned. 
2026-05-15 19:11:48,184 - optuna.study._optimize - INFO - Trial 141 pruned. 
2026-05-15 19:12:02,443 - experiment_functions - INFO - Early stopping at epoch 1900. Best Recall: 0.1427
2026-05-15 19:12:02,621 - optuna.study.study - INFO - Trial 142 finished with value: 0.14274795197220677 and parameters: {'n_layers': 1, 'embedding_dim': 256, 'lr': 0.0005744334851589603, 'lambda_val': 4.88211739207308e-05, 'batch_size': 1575, 'optimizer': 'Adam'}. Best is trial 65 with value: 0.14314842153817933.
2026-05-15 19:12:12,245 - optuna.study._optimize - INFO - Trial 143 pruned. 
2026-05-15 19:12:18,498 - experiment_functions - INFO - Early stopping at epoch 850. Best Recall: 0.1260
2026-05-15 19:12:18,611 - optuna.study.study - INFO - Trial 144 finished with value: 0.12602250120062913 and parameters: {'n_layers': 1, 'embedding_dim': 256, 'lr': 0.0011741607371474946, 'lambda_val': 5.3884081174012805e-05, 'batch_size': 1692, 'optimizer': 'Adam'}. Best is trial 65 with value: 0.14314842153817933.
2026-05-15 19:12:26,134 - optuna.study._optimize - INFO - Trial 145 pruned. 
2026-05-15 19:12:41,212 - optuna.study._optimize - INFO - Trial 146 pruned. 
2026-05-15 19:12:47,549 - optuna.study._optimize - INFO - Trial 147 pruned. 
2026-05-15 19:12:52,699 - experiment_functions - INFO - Early stopping at epoch 500. Best Recall: 0.0021
2026-05-15 19:12:52,823 - optuna.study.study - INFO - Trial 148 finished with value: 0.0020594096727814502 and parameters: {'n_layers': 3, 'embedding_dim': 256, 'lr': 0.00033491663853646474, 'lambda_val': 1.5337979634915288e-05, 'batch_size': 2751, 'optimizer': 'SGD'}. Best is trial 65 with value: 0.14314842153817933.
2026-05-15 19:12:59,971 - optuna.study._optimize - INFO - Trial 149 pruned. 
2026-05-15 19:13:05,104 - experiment_functions - INFO - Early stopping at epoch 700. Best Recall: 0.1175
2026-05-15 19:13:05,207 - optuna.study.study - INFO - Trial 150 finished with value: 0.11746261188353634 and parameters: {'n_layers': 1, 'embedding_dim': 256, 'lr': 0.0013159157812722049, 'lambda_val': 2.5073079226444143e-05, 'batch_size': 2215, 'optimizer': 'Adam'}. Best is trial 65 with value: 0.14314842153817933.
2026-05-15 19:13:12,686 - optuna.study._optimize - INFO - Trial 151 pruned. 
2026-05-15 19:13:19,155 - experiment_functions - INFO - Early stopping at epoch 900. Best Recall: 0.1263
2026-05-15 19:13:19,322 - optuna.study.study - INFO - Trial 152 finished with value: 0.1263011656180761 and parameters: {'n_layers': 1, 'embedding_dim': 256, 'lr': 0.0011443750487870074, 'lambda_val': 6.045781304745204e-05, 'batch_size': 1705, 'optimizer': 'Adam'}. Best is trial 65 with value: 0.14314842153817933.
2026-05-15 19:13:30,384 - optuna.study._optimize - INFO - Trial 153 pruned. 
2026-05-15 19:13:38,322 - experiment_functions - INFO - Early stopping at epoch 1100. Best Recall: 0.1334
2026-05-15 19:13:38,677 - optuna.study.study - INFO - Trial 154 finished with value: 0.13341137640196168 and parameters: {'n_layers': 1, 'embedding_dim': 256, 'lr': 0.000932801589938682, 'lambda_val': 3.2073240805029904e-05, 'batch_size': 1744, 'optimizer': 'Adam'}. Best is trial 65 with value: 0.14314842153817933.
2026-05-15 19:13:53,818 - optuna.study._optimize - INFO - Trial 155 pruned. 
2026-05-15 19:14:01,641 - optuna.study._optimize - INFO - Trial 156 pruned. 
2026-05-15 19:14:07,206 - experiment_functions - INFO - Early stopping at epoch 700. Best Recall: 0.1113
2026-05-15 19:14:07,319 - optuna.study.study - INFO - Trial 157 finished with value: 0.1113460781479096 and parameters: {'n_layers': 1, 'embedding_dim': 256, 'lr': 0.0015694995030412632, 'lambda_val': 1.1382209572659886e-05, 'batch_size': 2598, 'optimizer': 'Adam'}. Best is trial 65 with value: 0.14314842153817933.
2026-05-15 19:14:15,418 - experiment_functions - INFO - Early stopping at epoch 1200. Best Recall: 0.1334
2026-05-15 19:14:15,519 - optuna.study.study - INFO - Trial 158 finished with value: 0.13339566616044418 and parameters: {'n_layers': 1, 'embedding_dim': 256, 'lr': 0.0007548374539243048, 'lambda_val': 1.0075406784708212e-06, 'batch_size': 1743, 'optimizer': 'Adam'}. Best is trial 65 with value: 0.14314842153817933.
2026-05-15 19:14:27,134 - experiment_functions - INFO - Early stopping at epoch 1750. Best Recall: 0.1361
2026-05-15 19:14:27,236 - optuna.study.study - INFO - Trial 159 finished with value: 0.13606318248706517 and parameters: {'n_layers': 1, 'embedding_dim': 256, 'lr': 0.00041524393886057374, 'lambda_val': 1.1140015354953049e-06, 'batch_size': 1756, 'optimizer': 'RMSprop'}. Best is trial 65 with value: 0.14314842153817933.
2026-05-15 19:14:34,121 - optuna.study._optimize - INFO - Trial 160 pruned. 
2026-05-15 19:14:41,754 - optuna.study._optimize - INFO - Trial 161 pruned. 
2026-05-15 19:14:48,215 - experiment_functions - INFO - Early stopping at epoch 900. Best Recall: 0.1239
2026-05-15 19:14:48,357 - optuna.study.study - INFO - Trial 162 finished with value: 0.12388329150223559 and parameters: {'n_layers': 1, 'embedding_dim': 256, 'lr': 0.0006600258753641438, 'lambda_val': 1.2665168233516582e-06, 'batch_size': 1988, 'optimizer': 'RMSprop'}. Best is trial 65 with value: 0.14314842153817933.
2026-05-15 19:14:56,686 - optuna.study._optimize - INFO - Trial 163 pruned. 
2026-05-15 19:15:04,865 - experiment_functions - INFO - Early stopping at epoch 1200. Best Recall: 0.1372
2026-05-15 19:15:04,967 - optuna.study.study - INFO - Trial 164 finished with value: 0.1372440700090343 and parameters: {'n_layers': 1, 'embedding_dim': 256, 'lr': 0.00060061707389523, 'lambda_val': 2.4497750846725633e-06, 'batch_size': 1548, 'optimizer': 'RMSprop'}. Best is trial 65 with value: 0.14314842153817933.
2026-05-15 19:15:12,711 - optuna.study._optimize - INFO - Trial 165 pruned. 
2026-05-15 19:15:19,859 - optuna.study._optimize - INFO - Trial 166 pruned. 
2026-05-15 19:15:27,113 - optuna.study._optimize - INFO - Trial 167 pruned. 
2026-05-15 19:15:33,931 - optuna.study._optimize - INFO - Trial 168 pruned. 
2026-05-15 19:15:41,120 - optuna.study._optimize - INFO - Trial 169 pruned. 
2026-05-15 19:15:47,209 - optuna.study._optimize - INFO - Trial 170 pruned. 
2026-05-15 19:15:55,862 - experiment_functions - INFO - Early stopping at epoch 1300. Best Recall: 0.1383
