2026-05-16 08:27:48,031 - optuna.study.study - INFO - Trial 70 finished with value: 0.0007265219469351068 and parameters: {'n_layers': 3, 'embedding_dim': 256, 'lr': 0.0008483774268197674, 'lambda_val': 1.5486963069154483e-06, 'batch_size': 3984, 'optimizer': 'SGD'}. Best is trial 12 with value: 0.12527215514243084.
2026-05-16 08:27:55,089 - optuna.study._optimize - INFO - Trial 71 pruned. 
2026-05-16 08:28:01,033 - optuna.study._optimize - INFO - Trial 72 pruned. 
2026-05-16 08:28:07,612 - optuna.study._optimize - INFO - Trial 73 pruned. 
2026-05-16 08:28:14,366 - experiment_functions - INFO - Early stopping at epoch 700. Best Recall: 0.0992
2026-05-16 08:28:14,467 - optuna.study.study - INFO - Trial 74 finished with value: 0.09917786458463845 and parameters: {'n_layers': 1, 'embedding_dim': 96, 'lr': 0.0020110589972394464, 'lambda_val': 0.0005012164439343222, 'batch_size': 1941, 'optimizer': 'Adam'}. Best is trial 12 with value: 0.12527215514243084.
2026-05-16 08:28:20,947 - experiment_functions - INFO - Early stopping at epoch 850. Best Recall: 0.0820
2026-05-16 08:28:21,048 - optuna.study.study - INFO - Trial 75 finished with value: 0.08198094671097539 and parameters: {'n_layers': 2, 'embedding_dim': 256, 'lr': 0.0009674842724816339, 'lambda_val': 6.124472569773275e-05, 'batch_size': 1745, 'optimizer': 'Adam'}. Best is trial 12 with value: 0.12527215514243084.
2026-05-16 08:28:33,480 - experiment_functions - INFO - Early stopping at epoch 1900. Best Recall: 0.1254
2026-05-16 08:28:33,625 - optuna.study.study - INFO - Trial 76 finished with value: 0.12535340186495275 and parameters: {'n_layers': 1, 'embedding_dim': 256, 'lr': 0.000532345345440074, 'lambda_val': 2.1688590760394308e-05, 'batch_size': 2723, 'optimizer': 'Adam'}. Best is trial 76 with value: 0.12535340186495275.
2026-05-16 08:28:40,464 - experiment_functions - INFO - Early stopping at epoch 750. Best Recall: 0.1176
2026-05-16 08:28:40,607 - optuna.study.study - INFO - Trial 77 finished with value: 0.117619246036476 and parameters: {'n_layers': 1, 'embedding_dim': 256, 'lr': 0.0011849682891719791, 'lambda_val': 3.7202764940401244e-05, 'batch_size': 2710, 'optimizer': 'Adam'}. Best is trial 76 with value: 0.12535340186495275.
2026-05-16 08:28:45,437 - experiment_functions - INFO - Early stopping at epoch 600. Best Recall: 0.1093
2026-05-16 08:28:45,584 - optuna.study.study - INFO - Trial 78 finished with value: 0.10926648620911357 and parameters: {'n_layers': 1, 'embedding_dim': 256, 'lr': 0.0030028142044827553, 'lambda_val': 3.5284751145268057e-06, 'batch_size': 2685, 'optimizer': 'Adam'}. Best is trial 76 with value: 0.12535340186495275.
2026-05-16 08:28:55,264 - optuna.study._optimize - INFO - Trial 79 pruned. 
2026-05-16 08:28:59,785 - experiment_functions - INFO - Early stopping at epoch 550. Best Recall: 0.1067
2026-05-16 08:28:59,886 - optuna.study.study - INFO - Trial 80 finished with value: 0.1067301857517585 and parameters: {'n_layers': 1, 'embedding_dim': 256, 'lr': 0.005028856629457082, 'lambda_val': 1.970207996064665e-05, 'batch_size': 2954, 'optimizer': 'Adam'}. Best is trial 76 with value: 0.12535340186495275.
2026-05-16 08:29:05,426 - experiment_functions - INFO - Early stopping at epoch 750. Best Recall: 0.1105
2026-05-16 08:29:05,527 - optuna.study.study - INFO - Trial 81 finished with value: 0.1105060603471647 and parameters: {'n_layers': 1, 'embedding_dim': 256, 'lr': 0.0011939147330417095, 'lambda_val': 3.982069989142502e-05, 'batch_size': 2791, 'optimizer': 'Adam'}. Best is trial 76 with value: 0.12535340186495275.
2026-05-16 08:29:21,829 - experiment_functions - INFO - Early stopping at epoch 1400. Best Recall: 0.1148
2026-05-16 08:29:22,587 - optuna.study.study - INFO - Trial 82 finished with value: 0.11481649911736995 and parameters: {'n_layers': 1, 'embedding_dim': 256, 'lr': 0.0005745861987807165, 'lambda_val': 0.0001085017661980624, 'batch_size': 2706, 'optimizer': 'Adam'}. Best is trial 76 with value: 0.12535340186495275.
2026-05-16 08:29:32,253 - optuna.study._optimize - INFO - Trial 83 pruned. 
2026-05-16 08:29:40,547 - experiment_functions - INFO - Early stopping at epoch 1300. Best Recall: 0.1189
2026-05-16 08:29:40,646 - optuna.study.study - INFO - Trial 84 finished with value: 0.11892730239760176 and parameters: {'n_layers': 1, 'embedding_dim': 256, 'lr': 0.0007421434242880769, 'lambda_val': 6.111067406786536e-05, 'batch_size': 2271, 'optimizer': 'Adam'}. Best is trial 76 with value: 0.12535340186495275.
2026-05-16 08:29:48,269 - optuna.study._optimize - INFO - Trial 85 pruned. 
2026-05-16 08:29:54,544 - experiment_functions - INFO - Early stopping at epoch 850. Best Recall: 0.1066
2026-05-16 08:29:54,654 - optuna.study.study - INFO - Trial 86 finished with value: 0.10664306216104225 and parameters: {'n_layers': 1, 'embedding_dim': 64, 'lr': 0.0010544106153609273, 'lambda_val': 2.1893586188378703e-05, 'batch_size': 2333, 'optimizer': 'RMSprop'}. Best is trial 76 with value: 0.12535340186495275.
2026-05-16 08:30:00,726 - optuna.study._optimize - INFO - Trial 87 pruned. 
2026-05-16 08:30:08,696 - experiment_functions - INFO - Early stopping at epoch 800. Best Recall: 0.1108
2026-05-16 08:30:08,786 - optuna.study.study - INFO - Trial 88 finished with value: 0.11075056418000118 and parameters: {'n_layers': 1, 'embedding_dim': 256, 'lr': 0.0016305779043434777, 'lambda_val': 8.156583638271204e-06, 'batch_size': 2107, 'optimizer': 'Adam'}. Best is trial 76 with value: 0.12535340186495275.
2026-05-16 08:30:18,467 - experiment_functions - INFO - Early stopping at epoch 500. Best Recall: 0.0021
2026-05-16 08:30:19,495 - optuna.study.study - INFO - Trial 89 finished with value: 0.002110719138392575 and parameters: {'n_layers': 1, 'embedding_dim': 128, 'lr': 0.07433028367810879, 'lambda_val': 5.979895002609365e-06, 'batch_size': 2272, 'optimizer': 'SGD'}. Best is trial 76 with value: 0.12535340186495275.
2026-05-16 08:30:28,864 - optuna.study._optimize - INFO - Trial 90 pruned. 
2026-05-16 08:30:37,523 - experiment_functions - INFO - Early stopping at epoch 1300. Best Recall: 0.1177
2026-05-16 08:30:38,056 - optuna.study.study - INFO - Trial 91 finished with value: 0.11774981389601627 and parameters: {'n_layers': 1, 'embedding_dim': 256, 'lr': 0.0006320779311481771, 'lambda_val': 7.150437680084303e-05, 'batch_size': 3457, 'optimizer': 'Adam'}. Best is trial 76 with value: 0.12535340186495275.
2026-05-16 08:30:45,486 - experiment_functions - INFO - Early stopping at epoch 1100. Best Recall: 0.1137
2026-05-16 08:30:45,631 - optuna.study.study - INFO - Trial 92 finished with value: 0.11368208416076346 and parameters: {'n_layers': 1, 'embedding_dim': 256, 'lr': 0.0005339785722429134, 'lambda_val': 0.00015685155288731086, 'batch_size': 3489, 'optimizer': 'Adam'}. Best is trial 76 with value: 0.12535340186495275.
2026-05-16 08:30:55,369 - experiment_functions - INFO - Early stopping at epoch 1150. Best Recall: 0.1175
2026-05-16 08:30:56,132 - optuna.study.study - INFO - Trial 93 finished with value: 0.11753026474384118 and parameters: {'n_layers': 1, 'embedding_dim': 256, 'lr': 0.0007037049154901753, 'lambda_val': 3.3494313814542936e-05, 'batch_size': 3654, 'optimizer': 'Adam'}. Best is trial 76 with value: 0.12535340186495275.
2026-05-16 08:31:10,720 - experiment_functions - INFO - Early stopping at epoch 750. Best Recall: 0.1073
2026-05-16 08:31:10,907 - optuna.study.study - INFO - Trial 94 finished with value: 0.10733264605344688 and parameters: {'n_layers': 1, 'embedding_dim': 256, 'lr': 0.0013524618113085107, 'lambda_val': 3.2171364997466165e-05, 'batch_size': 3816, 'optimizer': 'Adam'}. Best is trial 76 with value: 0.12535340186495275.
2026-05-16 08:31:18,106 - experiment_functions - INFO - Early stopping at epoch 1000. Best Recall: 0.1236
2026-05-16 08:31:18,197 - optuna.study.study - INFO - Trial 95 finished with value: 0.1236228808583245 and parameters: {'n_layers': 1, 'embedding_dim': 256, 'lr': 0.0007098112321954162, 'lambda_val': 1.5155375349671064e-05, 'batch_size': 3652, 'optimizer': 'Adam'}. Best is trial 76 with value: 0.12535340186495275.
2026-05-16 08:31:24,643 - experiment_functions - INFO - Early stopping at epoch 900. Best Recall: 0.1119
2026-05-16 08:31:24,733 - optuna.study.study - INFO - Trial 96 finished with value: 0.11192876960275602 and parameters: {'n_layers': 1, 'embedding_dim': 256, 'lr': 0.001021472719493161, 'lambda_val': 6.998961756174134e-05, 'batch_size': 2037, 'optimizer': 'Adam'}. Best is trial 76 with value: 0.12535340186495275.
2026-05-16 08:31:29,408 - experiment_functions - INFO - Early stopping at epoch 600. Best Recall: 0.1062
2026-05-16 08:31:29,509 - optuna.study.study - INFO - Trial 97 finished with value: 0.10624893158020648 and parameters: {'n_layers': 1, 'embedding_dim': 256, 'lr': 0.0021320420523145006, 'lambda_val': 1.7277677950999746e-05, 'batch_size': 3976, 'optimizer': 'Adam'}. Best is trial 76 with value: 0.12535340186495275.
2026-05-16 08:31:43,545 - experiment_functions - INFO - Early stopping at epoch 2100. Best Recall: 0.1225
2026-05-16 08:31:43,664 - optuna.study.study - INFO - Trial 98 finished with value: 0.12250742180029672 and parameters: {'n_layers': 1, 'embedding_dim': 256, 'lr': 0.000316938734762884, 'lambda_val': 2.3132482939833623e-05, 'batch_size': 3756, 'optimizer': 'Adam'}. Best is trial 76 with value: 0.12535340186495275.
2026-05-16 08:31:52,825 - optuna.study._optimize - INFO - Trial 99 pruned. 
2026-05-16 08:32:07,906 - experiment_functions - INFO - Early stopping at epoch 2350. Best Recall: 0.1232
2026-05-16 08:32:08,006 - optuna.study.study - INFO - Trial 100 finished with value: 0.12322884219795965 and parameters: {'n_layers': 1, 'embedding_dim': 256, 'lr': 0.00034814955401952174, 'lambda_val': 1.5855234929369198e-05, 'batch_size': 3706, 'optimizer': 'Adam'}. Best is trial 76 with value: 0.12535340186495275.
2026-05-16 08:32:14,732 - optuna.study._optimize - INFO - Trial 101 pruned. 
2026-05-16 08:32:31,041 - optuna.study._optimize - INFO - Trial 102 pruned. 
2026-05-16 08:32:38,846 - experiment_functions - INFO - Early stopping at epoch 1050. Best Recall: 0.1116
2026-05-16 08:32:38,964 - optuna.study.study - INFO - Trial 103 finished with value: 0.11157689437706612 and parameters: {'n_layers': 1, 'embedding_dim': 256, 'lr': 0.000768502881589612, 'lambda_val': 0.00020544858888182696, 'batch_size': 3707, 'optimizer': 'Adam'}. Best is trial 76 with value: 0.12535340186495275.
2026-05-16 08:32:47,393 - experiment_functions - INFO - Early stopping at epoch 1250. Best Recall: 0.1167
2026-05-16 08:32:47,482 - optuna.study.study - INFO - Trial 104 finished with value: 0.11669752537947357 and parameters: {'n_layers': 1, 'embedding_dim': 256, 'lr': 0.0004995922966424665, 'lambda_val': 9.6986912139024e-06, 'batch_size': 3589, 'optimizer': 'Adam'}. Best is trial 76 with value: 0.12535340186495275.
2026-05-16 08:32:53,841 - experiment_functions - INFO - Early stopping at epoch 950. Best Recall: 0.1180
2026-05-16 08:32:53,942 - optuna.study.study - INFO - Trial 105 finished with value: 0.11796093406583445 and parameters: {'n_layers': 1, 'embedding_dim': 256, 'lr': 0.000629749025549792, 'lambda_val': 0.001696407892883415, 'batch_size': 3857, 'optimizer': 'Adam'}. Best is trial 76 with value: 0.12535340186495275.
2026-05-16 08:33:00,746 - optuna.study._optimize - INFO - Trial 106 pruned. 
2026-05-16 08:33:07,026 - optuna.study._optimize - INFO - Trial 107 pruned. 
2026-05-16 08:33:14,445 - optuna.study._optimize - INFO - Trial 108 pruned. 
2026-05-16 08:33:17,957 - experiment_functions - INFO - Early stopping at epoch 500. Best Recall: 0.0018
2026-05-16 08:33:18,067 - optuna.study.study - INFO - Trial 109 finished with value: 0.0018095932834513982 and parameters: {'n_layers': 1, 'embedding_dim': 128, 'lr': 0.01077925766974726, 'lambda_val': 0.006312530661950764, 'batch_size': 3729, 'optimizer': 'SGD'}. Best is trial 76 with value: 0.12535340186495275.
2026-05-16 08:33:24,320 - experiment_functions - INFO - Early stopping at epoch 650. Best Recall: 0.0490
2026-05-16 08:33:24,430 - optuna.study.study - INFO - Trial 110 finished with value: 0.04897218745640677 and parameters: {'n_layers': 3, 'embedding_dim': 256, 'lr': 0.0008915012048759399, 'lambda_val': 4.158457451473283e-06, 'batch_size': 3903, 'optimizer': 'Adam'}. Best is trial 76 with value: 0.12535340186495275.
2026-05-16 08:33:32,981 - optuna.study._optimize - INFO - Trial 111 pruned. 
2026-05-16 08:33:42,718 - experiment_functions - INFO - Early stopping at epoch 1100. Best Recall: 0.1160
2026-05-16 08:33:43,484 - optuna.study.study - INFO - Trial 112 finished with value: 0.11602073561715268 and parameters: {'n_layers': 1, 'embedding_dim': 256, 'lr': 0.0006274328969096051, 'lambda_val': 0.00038958929775068194, 'batch_size': 3439, 'optimizer': 'Adam'}. Best is trial 76 with value: 0.12535340186495275.
2026-05-16 08:34:01,272 - optuna.study._optimize - INFO - Trial 113 pruned. 
2026-05-16 08:34:07,654 - experiment_functions - INFO - Early stopping at epoch 850. Best Recall: 0.1080
2026-05-16 08:34:07,753 - optuna.study.study - INFO - Trial 114 finished with value: 0.10801008320045972 and parameters: {'n_layers': 1, 'embedding_dim': 256, 'lr': 0.000737525142425806, 'lambda_val': 0.00011888652482055869, 'batch_size': 4022, 'optimizer': 'Adam'}. Best is trial 76 with value: 0.12535340186495275.
2026-05-16 08:34:14,254 - optuna.study._optimize - INFO - Trial 115 pruned. 
2026-05-16 08:34:21,925 - optuna.study._optimize - INFO - Trial 116 pruned. 
2026-05-16 08:34:31,410 - experiment_functions - INFO - Early stopping at epoch 850. Best Recall: 0.1190
2026-05-16 08:34:32,171 - optuna.study.study - INFO - Trial 117 finished with value: 0.11900827521350815 and parameters: {'n_layers': 1, 'embedding_dim': 256, 'lr': 0.0008558346124094202, 'lambda_val': 6.736323356672064e-06, 'batch_size': 3643, 'optimizer': 'Adam'}. Best is trial 76 with value: 0.12535340186495275.
2026-05-16 08:34:43,776 - experiment_functions - INFO - Early stopping at epoch 900. Best Recall: 0.1140
2026-05-16 08:34:43,885 - optuna.study.study - INFO - Trial 118 finished with value: 0.11402152850748301 and parameters: {'n_layers': 1, 'embedding_dim': 256, 'lr': 0.0009151905320128852, 'lambda_val': 7.259166625999967e-06, 'batch_size': 2449, 'optimizer': 'Adam'}. Best is trial 76 with value: 0.12535340186495275.
2026-05-16 08:34:50,515 - experiment_functions - INFO - Early stopping at epoch 950. Best Recall: 0.0951
2026-05-16 08:34:50,686 - optuna.study.study - INFO - Trial 119 finished with value: 0.09506616076937882 and parameters: {'n_layers': 1, 'embedding_dim': 96, 'lr': 0.0013941919100824223, 'lambda_val': 1.7423899687117161e-06, 'batch_size': 3625, 'optimizer': 'Adam'}. Best is trial 76 with value: 0.12535340186495275.
2026-05-16 08:34:58,374 - optuna.study._optimize - INFO - Trial 120 pruned. 
2026-05-16 08:35:06,101 - experiment_functions - INFO - Early stopping at epoch 1100. Best Recall: 0.1247
2026-05-16 08:35:06,229 - optuna.study.study - INFO - Trial 121 finished with value: 0.12466037244739318 and parameters: {'n_layers': 1, 'embedding_dim': 256, 'lr': 0.0006364234072973787, 'lambda_val': 1.2645172785295207e-05, 'batch_size': 3947, 'optimizer': 'Adam'}. Best is trial 76 with value: 0.12535340186495275.
2026-05-16 08:35:16,441 - experiment_functions - INFO - Early stopping at epoch 1450. Best Recall: 0.1201
2026-05-16 08:35:16,531 - optuna.study.study - INFO - Trial 122 finished with value: 0.12013636976057909 and parameters: {'n_layers': 1, 'embedding_dim': 256, 'lr': 0.00039718698624168234, 'lambda_val': 1.2391323422120647e-05, 'batch_size': 3955, 'optimizer': 'Adam'}. Best is trial 76 with value: 0.12535340186495275.
2026-05-16 08:35:26,231 - optuna.study._optimize - INFO - Trial 123 pruned. 
2026-05-16 08:35:33,882 - optuna.study._optimize - INFO - Trial 124 pruned. 
2026-05-16 08:35:42,111 - optuna.study._optimize - INFO - Trial 125 pruned. 
2026-05-16 08:35:48,717 - experiment_functions - INFO - Early stopping at epoch 900. Best Recall: 0.1146
2026-05-16 08:35:48,817 - optuna.study.study - INFO - Trial 126 finished with value: 0.11463880848487464 and parameters: {'n_layers': 1, 'embedding_dim': 256, 'lr': 0.0008238035690509125, 'lambda_val': 1.899174673378025e-05, 'batch_size': 3731, 'optimizer': 'Adam'}. Best is trial 76 with value: 0.12535340186495275.
2026-05-16 08:35:54,096 - experiment_functions - INFO - Early stopping at epoch 650. Best Recall: 0.0996
2026-05-16 08:35:54,187 - optuna.study.study - INFO - Trial 127 finished with value: 0.09955916913694565 and parameters: {'n_layers': 1, 'embedding_dim': 256, 'lr': 0.0010815996294373615, 'lambda_val': 1.3665662748701049e-06, 'batch_size': 3995, 'optimizer': 'RMSprop'}. Best is trial 76 with value: 0.12535340186495275.
2026-05-16 08:36:02,407 - optuna.study._optimize - INFO - Trial 128 pruned. 
2026-05-16 08:36:09,525 - optuna.study._optimize - INFO - Trial 129 pruned. 
2026-05-16 08:36:13,248 - experiment_functions - INFO - Early stopping at epoch 500. Best Recall: 0.0024
2026-05-16 08:36:13,368 - optuna.study.study - INFO - Trial 130 finished with value: 0.002379031660496373 and parameters: {'n_layers': 1, 'embedding_dim': 32, 'lr': 0.00032010780335309865, 'lambda_val': 6.4055364000319635e-06, 'batch_size': 1387, 'optimizer': 'SGD'}. Best is trial 76 with value: 0.12535340186495275.
2026-05-16 08:36:20,661 - optuna.study._optimize - INFO - Trial 131 pruned. 
2026-05-16 08:36:28,611 - experiment_functions - INFO - Early stopping at epoch 1150. Best Recall: 0.1223
2026-05-16 08:36:28,713 - optuna.study.study - INFO - Trial 132 finished with value: 0.12230220060653507 and parameters: {'n_layers': 1, 'embedding_dim': 256, 'lr': 0.0005666312366402465, 'lambda_val': 1.432602666258023e-05, 'batch_size': 3901, 'optimizer': 'Adam'}. Best is trial 76 with value: 0.12535340186495275.
2026-05-16 08:36:35,119 - experiment_functions - INFO - Early stopping at epoch 850. Best Recall: 0.1207
2026-05-16 08:36:35,217 - optuna.study.study - INFO - Trial 133 finished with value: 0.12065424277953775 and parameters: {'n_layers': 1, 'embedding_dim': 256, 'lr': 0.0009000829301630511, 'lambda_val': 1.3599647204027653e-05, 'batch_size': 4091, 'optimizer': 'Adam'}. Best is trial 76 with value: 0.12535340186495275.
2026-05-16 08:36:45,183 - experiment_functions - INFO - Early stopping at epoch 650. Best Recall: 0.1141
2026-05-16 08:36:45,316 - optuna.study.study - INFO - Trial 134 finished with value: 0.11406676854952007 and parameters: {'n_layers': 1, 'embedding_dim': 256, 'lr': 0.0018174558372809474, 'lambda_val': 1.4907772547042561e-05, 'batch_size': 4068, 'optimizer': 'Adam'}. Best is trial 76 with value: 0.12535340186495275.
2026-05-16 08:36:51,858 - experiment_functions - INFO - Early stopping at epoch 800. Best Recall: 0.1117
2026-05-16 08:36:51,959 - optuna.study.study - INFO - Trial 135 finished with value: 0.11169262619241789 and parameters: {'n_layers': 1, 'embedding_dim': 256, 'lr': 0.0009636196188443919, 'lambda_val': 4.668641951380631e-06, 'batch_size': 3915, 'optimizer': 'Adam'}. Best is trial 76 with value: 0.12535340186495275.
2026-05-16 08:37:01,170 - optuna.study._optimize - INFO - Trial 136 pruned. 
2026-05-16 08:37:09,820 - experiment_functions - INFO - Early stopping at epoch 800. Best Recall: 0.1113
2026-05-16 08:37:10,587 - optuna.study.study - INFO - Trial 137 finished with value: 0.11131156522764814 and parameters: {'n_layers': 1, 'embedding_dim': 256, 'lr': 0.0012644213535998527, 'lambda_val': 1.337380490629496e-05, 'batch_size': 3759, 'optimizer': 'Adam'}. Best is trial 76 with value: 0.12535340186495275.
2026-05-16 08:37:24,398 - experiment_functions - INFO - Early stopping at epoch 1250. Best Recall: 0.1233
2026-05-16 08:37:24,488 - optuna.study.study - INFO - Trial 138 finished with value: 0.12330449185427955 and parameters: {'n_layers': 1, 'embedding_dim': 256, 'lr': 0.0005122935238879936, 'lambda_val': 2.155337502811649e-05, 'batch_size': 3997, 'optimizer': 'Adam'}. Best is trial 76 with value: 0.12535340186495275.
2026-05-16 08:37:32,849 - experiment_functions - INFO - Early stopping at epoch 1300. Best Recall: 0.1226
2026-05-16 08:37:33,018 - optuna.study.study - INFO - Trial 139 finished with value: 0.12256839257393284 and parameters: {'n_layers': 1, 'embedding_dim': 128, 'lr': 0.0005392896817899469, 'lambda_val': 2.1885372736671834e-05, 'batch_size': 4020, 'optimizer': 'Adam'}. Best is trial 76 with value: 0.12535340186495275.
2026-05-16 08:37:39,367 - optuna.study._optimize - INFO - Trial 140 pruned. 
2026-05-16 08:37:46,022 - optuna.study._optimize - INFO - Trial 141 pruned. 
2026-05-16 08:37:52,496 - experiment_functions - INFO - Early stopping at epoch 750. Best Recall: 0.0348
2026-05-16 08:37:52,585 - optuna.study.study - INFO - Trial 142 finished with value: 0.0347681655767588 and parameters: {'n_layers': 4, 'embedding_dim': 128, 'lr': 0.000553136894063805, 'lambda_val': 2.043838269906182e-05, 'batch_size': 3874, 'optimizer': 'Adam'}. Best is trial 76 with value: 0.12535340186495275.
2026-05-16 08:37:59,349 - optuna.study._optimize - INFO - Trial 143 pruned. 
2026-05-16 08:38:06,274 - optuna.study._optimize - INFO - Trial 144 pruned. 
2026-05-16 08:38:15,053 - experiment_functions - INFO - Early stopping at epoch 1100. Best Recall: 0.1169
2026-05-16 08:38:15,172 - optuna.study.study - INFO - Trial 145 finished with value: 0.11690014056554601 and parameters: {'n_layers': 1, 'embedding_dim': 256, 'lr': 0.0006221628562318472, 'lambda_val': 1.0485711211927396e-05, 'batch_size': 3912, 'optimizer': 'Adam'}. Best is trial 76 with value: 0.12535340186495275.
2026-05-16 08:38:23,859 - optuna.study._optimize - INFO - Trial 146 pruned. 
2026-05-16 08:38:33,066 - experiment_functions - INFO - Early stopping at epoch 1100. Best Recall: 0.1227
