2026-05-16 01:07:01,414 - optuna.study._optimize - INFO - Trial 15 pruned. 
2026-05-16 01:07:10,416 - experiment_functions - INFO - Early stopping at epoch 1400. Best Recall: 0.0413
2026-05-16 01:07:10,548 - optuna.study.study - INFO - Trial 16 finished with value: 0.041258135941665434 and parameters: {'n_layers': 3, 'embedding_dim': 32, 'lr': 0.00047437441889874974, 'lambda_val': 0.000957224701284073, 'batch_size': 2052, 'optimizer': 'Adam'}. Best is trial 16 with value: 0.041258135941665434.
2026-05-16 01:07:24,831 - experiment_functions - INFO - Early stopping at epoch 2200. Best Recall: 0.0425
2026-05-16 01:07:24,934 - optuna.study.study - INFO - Trial 17 finished with value: 0.04251993444537551 and parameters: {'n_layers': 4, 'embedding_dim': 32, 'lr': 0.00038198715168758136, 'lambda_val': 3.12887582524219e-05, 'batch_size': 1303, 'optimizer': 'Adam'}. Best is trial 17 with value: 0.04251993444537551.
2026-05-16 01:07:31,130 - experiment_functions - INFO - Early stopping at epoch 500. Best Recall: 0.0020
2026-05-16 01:07:31,273 - optuna.study.study - INFO - Trial 18 finished with value: 0.002037754725266401 and parameters: {'n_layers': 3, 'embedding_dim': 32, 'lr': 1.1681759080610638e-05, 'lambda_val': 3.168843277321067e-05, 'batch_size': 1708, 'optimizer': 'Adam'}. Best is trial 17 with value: 0.04251993444537551.
2026-05-16 01:07:37,318 - experiment_functions - INFO - Early stopping at epoch 1000. Best Recall: 0.0443
2026-05-16 01:07:37,419 - optuna.study.study - INFO - Trial 19 finished with value: 0.04426258243464967 and parameters: {'n_layers': 2, 'embedding_dim': 32, 'lr': 0.0005031591413074891, 'lambda_val': 5.948654756805566e-05, 'batch_size': 2270, 'optimizer': 'Adam'}. Best is trial 19 with value: 0.04426258243464967.
2026-05-16 01:07:41,232 - experiment_functions - INFO - Early stopping at epoch 500. Best Recall: 0.0045
2026-05-16 01:07:41,295 - optuna.study.study - INFO - Trial 20 finished with value: 0.004480254967227872 and parameters: {'n_layers': 2, 'embedding_dim': 32, 'lr': 4.184402663118404e-05, 'lambda_val': 5.300611825006584e-05, 'batch_size': 1360, 'optimizer': 'Adam'}. Best is trial 19 with value: 0.04426258243464967.
2026-05-16 01:07:51,383 - experiment_functions - INFO - Early stopping at epoch 1800. Best Recall: 0.0450
2026-05-16 01:07:51,487 - optuna.study.study - INFO - Trial 21 finished with value: 0.044990917795442766 and parameters: {'n_layers': 2, 'embedding_dim': 32, 'lr': 0.000550630974256733, 'lambda_val': 0.00029572612102741103, 'batch_size': 2301, 'optimizer': 'Adam'}. Best is trial 21 with value: 0.044990917795442766.
2026-05-16 01:07:55,604 - experiment_functions - INFO - Early stopping at epoch 650. Best Recall: 0.0574
2026-05-16 01:07:55,709 - optuna.study.study - INFO - Trial 22 finished with value: 0.05743476565967229 and parameters: {'n_layers': 1, 'embedding_dim': 32, 'lr': 0.003069137918874938, 'lambda_val': 0.00016959230483094446, 'batch_size': 2449, 'optimizer': 'Adam'}. Best is trial 22 with value: 0.05743476565967229.
2026-05-16 01:07:59,437 - experiment_functions - INFO - Early stopping at epoch 600. Best Recall: 0.0547
2026-05-16 01:07:59,516 - optuna.study.study - INFO - Trial 23 finished with value: 0.05468410230384471 and parameters: {'n_layers': 1, 'embedding_dim': 32, 'lr': 0.0034444713084145935, 'lambda_val': 0.0002546953818324465, 'batch_size': 2540, 'optimizer': 'Adam'}. Best is trial 22 with value: 0.05743476565967229.
2026-05-16 01:08:03,597 - experiment_functions - INFO - Early stopping at epoch 600. Best Recall: 0.0560
2026-05-16 01:08:03,731 - optuna.study.study - INFO - Trial 24 finished with value: 0.0559734251334459 and parameters: {'n_layers': 1, 'embedding_dim': 64, 'lr': 0.0028915796309049273, 'lambda_val': 0.0003038398919825614, 'batch_size': 2559, 'optimizer': 'Adam'}. Best is trial 22 with value: 0.05743476565967229.
2026-05-16 01:08:07,415 - experiment_functions - INFO - Early stopping at epoch 600. Best Recall: 0.0597
2026-05-16 01:08:07,550 - optuna.study.study - INFO - Trial 25 finished with value: 0.05974338327607352 and parameters: {'n_layers': 1, 'embedding_dim': 64, 'lr': 0.002918093006362445, 'lambda_val': 0.00023244066183652744, 'batch_size': 2770, 'optimizer': 'Adam'}. Best is trial 25 with value: 0.05974338327607352.
2026-05-16 01:08:11,576 - experiment_functions - INFO - Early stopping at epoch 600. Best Recall: 0.0538
2026-05-16 01:08:11,675 - optuna.study.study - INFO - Trial 26 finished with value: 0.05381630755519588 and parameters: {'n_layers': 1, 'embedding_dim': 64, 'lr': 0.0029818043847779146, 'lambda_val': 0.002989866640906119, 'batch_size': 2796, 'optimizer': 'Adam'}. Best is trial 25 with value: 0.05974338327607352.
2026-05-16 01:08:15,365 - experiment_functions - INFO - Early stopping at epoch 550. Best Recall: 0.0652
2026-05-16 01:08:15,507 - optuna.study.study - INFO - Trial 27 finished with value: 0.06519158682636232 and parameters: {'n_layers': 1, 'embedding_dim': 64, 'lr': 0.008454427975609134, 'lambda_val': 0.000628016390825528, 'batch_size': 2883, 'optimizer': 'Adam'}. Best is trial 27 with value: 0.06519158682636232.
2026-05-16 01:08:19,480 - experiment_functions - INFO - Early stopping at epoch 550. Best Recall: 0.0640
2026-05-16 01:08:19,591 - optuna.study.study - INFO - Trial 28 finished with value: 0.06402422777416497 and parameters: {'n_layers': 1, 'embedding_dim': 64, 'lr': 0.009559734268386367, 'lambda_val': 0.0005852361867415023, 'batch_size': 3091, 'optimizer': 'Adam'}. Best is trial 27 with value: 0.06519158682636232.
2026-05-16 01:08:34,063 - experiment_functions - INFO - Early stopping at epoch 2700. Best Recall: 0.0501
2026-05-16 01:08:34,152 - optuna.study.study - INFO - Trial 29 finished with value: 0.05014619947579983 and parameters: {'n_layers': 1, 'embedding_dim': 64, 'lr': 0.04174730794222874, 'lambda_val': 0.000729309721558583, 'batch_size': 3165, 'optimizer': 'Adam'}. Best is trial 27 with value: 0.06519158682636232.
2026-05-16 01:08:37,882 - experiment_functions - INFO - Early stopping at epoch 550. Best Recall: 0.0464
2026-05-16 01:08:37,961 - optuna.study.study - INFO - Trial 30 finished with value: 0.04640290030749721 and parameters: {'n_layers': 1, 'embedding_dim': 64, 'lr': 0.008212814698835318, 'lambda_val': 0.005003585119421066, 'batch_size': 3083, 'optimizer': 'Adam'}. Best is trial 27 with value: 0.06519158682636232.
2026-05-16 01:08:41,432 - experiment_functions - INFO - Early stopping at epoch 550. Best Recall: 0.0580
2026-05-16 01:08:41,521 - optuna.study.study - INFO - Trial 31 finished with value: 0.058019322229903005 and parameters: {'n_layers': 1, 'embedding_dim': 64, 'lr': 0.012119540919866365, 'lambda_val': 0.00014081439043303886, 'batch_size': 2842, 'optimizer': 'Adam'}. Best is trial 27 with value: 0.06519158682636232.
2026-05-16 01:08:45,667 - experiment_functions - INFO - Early stopping at epoch 650. Best Recall: 0.0388
2026-05-16 01:08:45,746 - optuna.study.study - INFO - Trial 32 finished with value: 0.03877344501244417 and parameters: {'n_layers': 1, 'embedding_dim': 64, 'lr': 0.03218358469190781, 'lambda_val': 0.00047476207872566937, 'batch_size': 3385, 'optimizer': 'Adam'}. Best is trial 27 with value: 0.06519158682636232.
2026-05-16 01:08:49,349 - experiment_functions - INFO - Early stopping at epoch 550. Best Recall: 0.0710
2026-05-16 01:08:49,449 - optuna.study.study - INFO - Trial 33 finished with value: 0.07095661543987578 and parameters: {'n_layers': 1, 'embedding_dim': 64, 'lr': 0.01033401940340245, 'lambda_val': 0.0014544513640324884, 'batch_size': 2845, 'optimizer': 'Adam'}. Best is trial 33 with value: 0.07095661543987578.
2026-05-16 01:08:58,218 - experiment_functions - INFO - Early stopping at epoch 1500. Best Recall: 0.0547
2026-05-16 01:08:58,297 - optuna.study.study - INFO - Trial 34 finished with value: 0.05468057676494568 and parameters: {'n_layers': 1, 'embedding_dim': 64, 'lr': 0.03014419147302749, 'lambda_val': 0.0016342911279534937, 'batch_size': 3595, 'optimizer': 'Adam'}. Best is trial 33 with value: 0.07095661543987578.
2026-05-16 01:09:02,734 - experiment_functions - INFO - Early stopping at epoch 700. Best Recall: 0.0512
2026-05-16 01:09:02,856 - optuna.study.study - INFO - Trial 35 finished with value: 0.05121718293332731 and parameters: {'n_layers': 1, 'embedding_dim': 128, 'lr': 0.008074866441521547, 'lambda_val': 0.0011644585910846415, 'batch_size': 2964, 'optimizer': 'Adam'}. Best is trial 33 with value: 0.07095661543987578.
2026-05-16 01:09:06,588 - experiment_functions - INFO - Early stopping at epoch 500. Best Recall: 0.0035
2026-05-16 01:09:06,686 - optuna.study.study - INFO - Trial 36 finished with value: 0.003522474128025605 and parameters: {'n_layers': 2, 'embedding_dim': 96, 'lr': 0.08835354613309598, 'lambda_val': 0.005720885891243533, 'batch_size': 3270, 'optimizer': 'SGD'}. Best is trial 33 with value: 0.07095661543987578.
2026-05-16 01:09:11,394 - experiment_functions - INFO - Early stopping at epoch 650. Best Recall: 0.0660
2026-05-16 01:09:11,494 - optuna.study.study - INFO - Trial 37 finished with value: 0.06596292423352981 and parameters: {'n_layers': 1, 'embedding_dim': 64, 'lr': 0.0019743754497170683, 'lambda_val': 0.00046858872517432205, 'batch_size': 2626, 'optimizer': 'Adam'}. Best is trial 33 with value: 0.07095661543987578.
2026-05-16 01:09:16,589 - experiment_functions - INFO - Early stopping at epoch 500. Best Recall: 0.0035
2026-05-16 01:09:16,687 - optuna.study.study - INFO - Trial 38 finished with value: 0.0034698549828612577 and parameters: {'n_layers': 2, 'embedding_dim': 64, 'lr': 0.0018858286934198964, 'lambda_val': 0.03407459375748839, 'batch_size': 2974, 'optimizer': 'SGD'}. Best is trial 33 with value: 0.07095661543987578.
2026-05-16 01:09:20,928 - experiment_functions - INFO - Early stopping at epoch 650. Best Recall: 0.0474
2026-05-16 01:09:21,008 - optuna.study.study - INFO - Trial 39 finished with value: 0.047386582237615806 and parameters: {'n_layers': 1, 'embedding_dim': 64, 'lr': 0.009620459847798118, 'lambda_val': 0.0005526443231735576, 'batch_size': 3679, 'optimizer': 'Adam'}. Best is trial 33 with value: 0.07095661543987578.
2026-05-16 01:09:27,697 - optuna.study._optimize - INFO - Trial 40 pruned. 
2026-05-16 01:09:31,178 - experiment_functions - INFO - Early stopping at epoch 550. Best Recall: 0.0722
2026-05-16 01:09:31,326 - optuna.study.study - INFO - Trial 41 finished with value: 0.07221083222591822 and parameters: {'n_layers': 1, 'embedding_dim': 64, 'lr': 0.006027392606345383, 'lambda_val': 0.0012356247912998898, 'batch_size': 2707, 'optimizer': 'Adam'}. Best is trial 41 with value: 0.07221083222591822.
2026-05-16 01:09:35,243 - experiment_functions - INFO - Early stopping at epoch 600. Best Recall: 0.0540
2026-05-16 01:09:35,344 - optuna.study.study - INFO - Trial 42 finished with value: 0.05397975243955938 and parameters: {'n_layers': 1, 'embedding_dim': 64, 'lr': 0.0053857449023098575, 'lambda_val': 0.0012956858258369051, 'batch_size': 2660, 'optimizer': 'Adam'}. Best is trial 41 with value: 0.07221083222591822.
2026-05-16 01:09:41,120 - experiment_functions - INFO - Early stopping at epoch 950. Best Recall: 0.0734
2026-05-16 01:09:41,232 - optuna.study.study - INFO - Trial 43 finished with value: 0.07344446531101119 and parameters: {'n_layers': 1, 'embedding_dim': 64, 'lr': 0.0009143173156740993, 'lambda_val': 0.0040668448715032585, 'batch_size': 3302, 'optimizer': 'Adam'}. Best is trial 43 with value: 0.07344446531101119.
2026-05-16 01:09:45,374 - experiment_functions - INFO - Early stopping at epoch 500. Best Recall: 0.0013
2026-05-16 01:09:45,484 - optuna.study.study - INFO - Trial 44 finished with value: 0.0012886394685292426 and parameters: {'n_layers': 1, 'embedding_dim': 128, 'lr': 0.0007726636641351206, 'lambda_val': 0.004177137023625456, 'batch_size': 3358, 'optimizer': 'SGD'}. Best is trial 43 with value: 0.07344446531101119.
2026-05-16 01:09:49,585 - experiment_functions - INFO - Early stopping at epoch 650. Best Recall: 0.0573
2026-05-16 01:09:49,675 - optuna.study.study - INFO - Trial 45 finished with value: 0.05732105469286845 and parameters: {'n_layers': 1, 'embedding_dim': 64, 'lr': 0.0020698177451602107, 'lambda_val': 0.0071479753594501354, 'batch_size': 2881, 'optimizer': 'Adam'}. Best is trial 43 with value: 0.07344446531101119.
2026-05-16 01:09:56,546 - experiment_functions - INFO - Early stopping at epoch 1250. Best Recall: 0.0664
2026-05-16 01:09:56,634 - optuna.study.study - INFO - Trial 46 finished with value: 0.06644069691223435 and parameters: {'n_layers': 1, 'embedding_dim': 64, 'lr': 0.0008099146415352538, 'lambda_val': 0.0019386961126395454, 'batch_size': 2189, 'optimizer': 'Adam'}. Best is trial 43 with value: 0.07344446531101119.
2026-05-16 01:10:12,562 - experiment_functions - INFO - Early stopping at epoch 3000. Best Recall: 0.0576
2026-05-16 01:10:12,653 - optuna.study.study - INFO - Trial 47 finished with value: 0.05755159094494802 and parameters: {'n_layers': 1, 'embedding_dim': 64, 'lr': 0.0002000172452284744, 'lambda_val': 0.0020191588395667343, 'batch_size': 2085, 'optimizer': 'Adam'}. Best is trial 43 with value: 0.07344446531101119.
2026-05-16 01:10:18,022 - experiment_functions - INFO - Early stopping at epoch 750. Best Recall: 0.0336
2026-05-16 01:10:18,110 - optuna.study.study - INFO - Trial 48 finished with value: 0.03361239008769984 and parameters: {'n_layers': 2, 'embedding_dim': 64, 'lr': 0.0009199688875843661, 'lambda_val': 0.014164993178798801, 'batch_size': 1728, 'optimizer': 'Adam'}. Best is trial 43 with value: 0.07344446531101119.
2026-05-16 01:10:21,777 - experiment_functions - INFO - Early stopping at epoch 500. Best Recall: 0.0020
2026-05-16 01:10:21,877 - optuna.study.study - INFO - Trial 49 finished with value: 0.0020484694913353784 and parameters: {'n_layers': 1, 'embedding_dim': 256, 'lr': 0.00031583934919713583, 'lambda_val': 0.039373298445787554, 'batch_size': 2683, 'optimizer': 'SGD'}. Best is trial 43 with value: 0.07344446531101119.
2026-05-16 01:10:26,414 - experiment_functions - INFO - Early stopping at epoch 700. Best Recall: 0.0541
2026-05-16 01:10:26,505 - optuna.study.study - INFO - Trial 50 finished with value: 0.05411988486271408 and parameters: {'n_layers': 1, 'embedding_dim': 96, 'lr': 0.0009576009381813774, 'lambda_val': 0.0034555734777482147, 'batch_size': 2171, 'optimizer': 'RMSprop'}. Best is trial 43 with value: 0.07344446531101119.
2026-05-16 01:10:30,154 - experiment_functions - INFO - Early stopping at epoch 600. Best Recall: 0.0655
2026-05-16 01:10:30,243 - optuna.study.study - INFO - Trial 51 finished with value: 0.06551862716073038 and parameters: {'n_layers': 1, 'embedding_dim': 64, 'lr': 0.0053768544690181, 'lambda_val': 0.0008730426718071328, 'batch_size': 2392, 'optimizer': 'Adam'}. Best is trial 43 with value: 0.07344446531101119.
2026-05-16 01:10:36,046 - experiment_functions - INFO - Early stopping at epoch 950. Best Recall: 0.0648
2026-05-16 01:10:36,126 - optuna.study.study - INFO - Trial 52 finished with value: 0.06483280204005441 and parameters: {'n_layers': 1, 'embedding_dim': 64, 'lr': 0.004240972460733607, 'lambda_val': 0.0010643942374981366, 'batch_size': 2340, 'optimizer': 'Adam'}. Best is trial 43 with value: 0.07344446531101119.
2026-05-16 01:10:40,131 - experiment_functions - INFO - Early stopping at epoch 650. Best Recall: 0.0582
2026-05-16 01:10:40,232 - optuna.study.study - INFO - Trial 53 finished with value: 0.0581518210398282 and parameters: {'n_layers': 1, 'embedding_dim': 64, 'lr': 0.0014711337200951455, 'lambda_val': 0.009655081799389129, 'batch_size': 2566, 'optimizer': 'Adam'}. Best is trial 43 with value: 0.07344446531101119.
2026-05-16 01:10:44,800 - experiment_functions - INFO - Early stopping at epoch 800. Best Recall: 0.0656
2026-05-16 01:10:44,890 - optuna.study.study - INFO - Trial 54 finished with value: 0.06557988559943997 and parameters: {'n_layers': 1, 'embedding_dim': 64, 'lr': 0.002115214935326749, 'lambda_val': 0.0015853412176526182, 'batch_size': 1840, 'optimizer': 'Adam'}. Best is trial 43 with value: 0.07344446531101119.
2026-05-16 01:10:49,070 - experiment_functions - INFO - Early stopping at epoch 600. Best Recall: 0.0449
2026-05-16 01:10:49,171 - optuna.study.study - INFO - Trial 55 finished with value: 0.04489185337729335 and parameters: {'n_layers': 2, 'embedding_dim': 128, 'lr': 0.0020976245066001383, 'lambda_val': 0.0017205421653677816, 'batch_size': 1824, 'optimizer': 'Adam'}. Best is trial 43 with value: 0.07344446531101119.
2026-05-16 01:10:53,892 - experiment_functions - INFO - Early stopping at epoch 800. Best Recall: 0.0704
2026-05-16 01:10:53,961 - optuna.study.study - INFO - Trial 56 finished with value: 0.07037957279633454 and parameters: {'n_layers': 1, 'embedding_dim': 64, 'lr': 0.0012274550914696347, 'lambda_val': 2.0911040719829727e-06, 'batch_size': 1455, 'optimizer': 'Adam'}. Best is trial 43 with value: 0.07344446531101119.
2026-05-16 01:10:59,703 - optuna.study._optimize - INFO - Trial 57 pruned. 
2026-05-16 01:11:16,635 - experiment_functions - INFO - Early stopping at epoch 2800. Best Recall: 0.0867
2026-05-16 01:11:16,727 - optuna.study.study - INFO - Trial 58 finished with value: 0.08674599784067255 and parameters: {'n_layers': 1, 'embedding_dim': 256, 'lr': 0.0006850628252471508, 'lambda_val': 0.00040637837195906554, 'batch_size': 960, 'optimizer': 'Adam'}. Best is trial 58 with value: 0.08674599784067255.
2026-05-16 01:11:28,246 - experiment_functions - INFO - Early stopping at epoch 1600. Best Recall: 0.0601
2026-05-16 01:11:28,323 - optuna.study.study - INFO - Trial 59 finished with value: 0.060080080487682215 and parameters: {'n_layers': 2, 'embedding_dim': 256, 'lr': 0.000363514895693917, 'lambda_val': 7.069632443341334e-05, 'batch_size': 989, 'optimizer': 'Adam'}. Best is trial 58 with value: 0.08674599784067255.
2026-05-16 01:11:37,189 - experiment_functions - INFO - Early stopping at epoch 1450. Best Recall: 0.0779
2026-05-16 01:11:37,267 - optuna.study.study - INFO - Trial 60 finished with value: 0.07790429058034186 and parameters: {'n_layers': 1, 'embedding_dim': 256, 'lr': 0.0006898211570701764, 'lambda_val': 1.640833614210656e-05, 'batch_size': 1478, 'optimizer': 'Adam'}. Best is trial 58 with value: 0.08674599784067255.
2026-05-16 01:11:56,890 - experiment_functions - INFO - Early stopping at epoch 3350. Best Recall: 0.0845
2026-05-16 01:11:57,023 - optuna.study.study - INFO - Trial 61 finished with value: 0.08452728585625792 and parameters: {'n_layers': 1, 'embedding_dim': 256, 'lr': 0.0007266279540051565, 'lambda_val': 8.745469972802527e-06, 'batch_size': 1502, 'optimizer': 'Adam'}. Best is trial 58 with value: 0.08674599784067255.
2026-05-16 01:12:12,657 - experiment_functions - INFO - Early stopping at epoch 2500. Best Recall: 0.0849
2026-05-16 01:12:12,767 - optuna.study.study - INFO - Trial 62 finished with value: 0.08490366969057589 and parameters: {'n_layers': 1, 'embedding_dim': 256, 'lr': 0.0006466422553215378, 'lambda_val': 6.243360024853211e-06, 'batch_size': 1480, 'optimizer': 'Adam'}. Best is trial 58 with value: 0.08674599784067255.
2026-05-16 01:12:21,620 - experiment_functions - INFO - Early stopping at epoch 1250. Best Recall: 0.0712
2026-05-16 01:12:21,700 - optuna.study.study - INFO - Trial 63 finished with value: 0.071220308589319 and parameters: {'n_layers': 1, 'embedding_dim': 256, 'lr': 0.0006365483530384911, 'lambda_val': 9.965768459289502e-06, 'batch_size': 1117, 'optimizer': 'Adam'}. Best is trial 58 with value: 0.08674599784067255.
2026-05-16 01:12:34,186 - experiment_functions - INFO - Early stopping at epoch 1550. Best Recall: 0.0818
2026-05-16 01:12:34,295 - optuna.study.study - INFO - Trial 64 finished with value: 0.08175312747005242 and parameters: {'n_layers': 1, 'embedding_dim': 256, 'lr': 0.000636257741363635, 'lambda_val': 5.837379590709426e-06, 'batch_size': 1117, 'optimizer': 'Adam'}. Best is trial 58 with value: 0.08674599784067255.
2026-05-16 01:12:42,813 - optuna.study._optimize - INFO - Trial 65 pruned. 
2026-05-16 01:12:58,242 - experiment_functions - INFO - Early stopping at epoch 2500. Best Recall: 0.0852
2026-05-16 01:12:58,354 - optuna.study.study - INFO - Trial 66 finished with value: 0.08520919156316697 and parameters: {'n_layers': 1, 'embedding_dim': 256, 'lr': 0.0004451560485261682, 'lambda_val': 1.3505501792376263e-05, 'batch_size': 1185, 'optimizer': 'Adam'}. Best is trial 58 with value: 0.08674599784067255.
2026-05-16 01:13:15,555 - experiment_functions - INFO - Early stopping at epoch 2900. Best Recall: 0.0859
2026-05-16 01:13:15,655 - optuna.study.study - INFO - Trial 67 finished with value: 0.08592972475689097 and parameters: {'n_layers': 1, 'embedding_dim': 256, 'lr': 0.0004421498438341265, 'lambda_val': 1.2694695863954518e-05, 'batch_size': 1168, 'optimizer': 'Adam'}. Best is trial 58 with value: 0.08674599784067255.
2026-05-16 01:13:27,842 - optuna.study._optimize - INFO - Trial 68 pruned. 
2026-05-16 01:13:34,063 - optuna.study._optimize - INFO - Trial 69 pruned. 
2026-05-16 01:13:50,172 - optuna.study._optimize - INFO - Trial 70 pruned. 
2026-05-16 01:14:00,231 - experiment_functions - INFO - Early stopping at epoch 1500. Best Recall: 0.0892
2026-05-16 01:14:00,370 - optuna.study.study - INFO - Trial 71 finished with value: 0.0892213002587449 and parameters: {'n_layers': 1, 'embedding_dim': 256, 'lr': 0.000669121514215009, 'lambda_val': 8.762056395905917e-06, 'batch_size': 1535, 'optimizer': 'Adam'}. Best is trial 71 with value: 0.0892213002587449.
2026-05-16 01:14:10,976 - optuna.study._optimize - INFO - Trial 72 pruned. 
2026-05-16 01:14:24,385 - experiment_functions - INFO - Early stopping at epoch 2000. Best Recall: 0.0856
