2026-05-16 04:23:51,226 - optuna.study._optimize - INFO - Trial 178 pruned. 
2026-05-16 04:23:57,900 - experiment_functions - INFO - Early stopping at epoch 900. Best Recall: 0.0890
2026-05-16 04:23:57,979 - optuna.study.study - INFO - Trial 179 finished with value: 0.08900363486692625 and parameters: {'n_layers': 1, 'embedding_dim': 96, 'lr': 0.0007862052586257467, 'lambda_val': 0.0002169694205706964, 'batch_size': 2322, 'optimizer': 'RMSprop'}. Best is trial 168 with value: 0.1307238454685406.
2026-05-16 04:24:05,072 - optuna.study._optimize - INFO - Trial 180 pruned. 
2026-05-16 04:24:12,230 - optuna.study._optimize - INFO - Trial 181 pruned. 
2026-05-16 04:24:24,741 - experiment_functions - INFO - Early stopping at epoch 1800. Best Recall: 0.1183
2026-05-16 04:24:24,830 - optuna.study.study - INFO - Trial 182 finished with value: 0.11832226175433402 and parameters: {'n_layers': 1, 'embedding_dim': 256, 'lr': 0.00037471309559677923, 'lambda_val': 0.00037370686509323453, 'batch_size': 1956, 'optimizer': 'Adam'}. Best is trial 168 with value: 0.1307238454685406.
2026-05-16 04:24:31,980 - optuna.study._optimize - INFO - Trial 183 pruned. 
2026-05-16 04:24:42,356 - optuna.study._optimize - INFO - Trial 184 pruned. 
2026-05-16 04:24:45,910 - experiment_functions - INFO - Early stopping at epoch 500. Best Recall: 0.0022
2026-05-16 04:24:45,990 - optuna.study.study - INFO - Trial 185 finished with value: 0.002186251554745945 and parameters: {'n_layers': 1, 'embedding_dim': 256, 'lr': 0.0005580362764330981, 'lambda_val': 0.00011436061136685208, 'batch_size': 2054, 'optimizer': 'SGD'}. Best is trial 168 with value: 0.1307238454685406.
2026-05-16 04:24:54,034 - optuna.study._optimize - INFO - Trial 186 pruned. 
2026-05-16 04:24:59,993 - experiment_functions - INFO - Early stopping at epoch 800. Best Recall: 0.0368
2026-05-16 04:25:00,095 - optuna.study.study - INFO - Trial 187 finished with value: 0.03679691936751684 and parameters: {'n_layers': 1, 'embedding_dim': 256, 'lr': 0.027824433206174986, 'lambda_val': 0.00028370468910399513, 'batch_size': 1649, 'optimizer': 'Adam'}. Best is trial 168 with value: 0.1307238454685406.
2026-05-16 04:25:07,068 - optuna.study._optimize - INFO - Trial 188 pruned. 
2026-05-16 04:25:15,220 - optuna.study._optimize - INFO - Trial 189 pruned. 
2026-05-16 04:25:23,077 - optuna.study._optimize - INFO - Trial 190 pruned. 
2026-05-16 04:25:30,308 - optuna.study._optimize - INFO - Trial 191 pruned. 
2026-05-16 04:25:42,823 - experiment_functions - INFO - Early stopping at epoch 1850. Best Recall: 0.1278
2026-05-16 04:25:42,913 - optuna.study.study - INFO - Trial 192 finished with value: 0.12775597462669183 and parameters: {'n_layers': 1, 'embedding_dim': 256, 'lr': 0.0004251982308660284, 'lambda_val': 5.36796549803116e-05, 'batch_size': 2316, 'optimizer': 'Adam'}. Best is trial 168 with value: 0.1307238454685406.
2026-05-16 04:25:55,439 - experiment_functions - INFO - Early stopping at epoch 2150. Best Recall: 0.1240
2026-05-16 04:25:55,530 - optuna.study.study - INFO - Trial 193 finished with value: 0.12400347912552855 and parameters: {'n_layers': 1, 'embedding_dim': 256, 'lr': 0.0003873890194030814, 'lambda_val': 5.837014104238496e-05, 'batch_size': 2159, 'optimizer': 'Adam'}. Best is trial 168 with value: 0.1307238454685406.
2026-05-16 04:26:02,553 - optuna.study._optimize - INFO - Trial 194 pruned. 
2026-05-16 04:26:09,338 - optuna.study._optimize - INFO - Trial 195 pruned. 
2026-05-16 04:26:27,642 - experiment_functions - INFO - Early stopping at epoch 2350. Best Recall: 0.1264
2026-05-16 04:26:27,732 - optuna.study.study - INFO - Trial 196 finished with value: 0.126440877139149 and parameters: {'n_layers': 1, 'embedding_dim': 256, 'lr': 0.0004010741205799854, 'lambda_val': 6.561407821612552e-05, 'batch_size': 2522, 'optimizer': 'Adam'}. Best is trial 168 with value: 0.1307238454685406.
2026-05-16 04:26:34,180 - optuna.study._optimize - INFO - Trial 197 pruned. 
2026-05-16 04:26:42,410 - experiment_functions - INFO - Early stopping at epoch 1200. Best Recall: 0.1148
2026-05-16 04:26:42,501 - optuna.study.study - INFO - Trial 198 finished with value: 0.11476538812308036 and parameters: {'n_layers': 1, 'embedding_dim': 256, 'lr': 0.0006348145326712852, 'lambda_val': 2.683985457625832e-05, 'batch_size': 2471, 'optimizer': 'Adam'}. Best is trial 168 with value: 0.1307238454685406.
2026-05-16 04:26:48,153 - optuna.study._optimize - INFO - Trial 199 pruned. 
2026-05-16 04:27:01,044 - experiment_functions - INFO - Early stopping at epoch 2050. Best Recall: 0.1256
2026-05-16 04:27:01,144 - optuna.study.study - INFO - Trial 200 finished with value: 0.12561344793668242 and parameters: {'n_layers': 1, 'embedding_dim': 256, 'lr': 0.00038366398346032394, 'lambda_val': 6.69259797146961e-05, 'batch_size': 2523, 'optimizer': 'Adam'}. Best is trial 168 with value: 0.1307238454685406.
2026-05-16 04:27:07,626 - optuna.study._optimize - INFO - Trial 201 pruned. 
2026-05-16 04:27:20,430 - experiment_functions - INFO - Early stopping at epoch 1750. Best Recall: 0.1220
2026-05-16 04:27:20,759 - optuna.study.study - INFO - Trial 202 finished with value: 0.12204926797447699 and parameters: {'n_layers': 1, 'embedding_dim': 256, 'lr': 0.00037281927868625163, 'lambda_val': 5.9142429190275005e-05, 'batch_size': 2515, 'optimizer': 'Adam'}. Best is trial 168 with value: 0.1307238454685406.
2026-05-16 04:27:27,552 - optuna.study._optimize - INFO - Trial 203 pruned. 
2026-05-16 04:27:34,024 - optuna.study._optimize - INFO - Trial 204 pruned. 
2026-05-16 04:27:43,131 - experiment_functions - INFO - Early stopping at epoch 1400. Best Recall: 0.1208
2026-05-16 04:27:43,229 - optuna.study.study - INFO - Trial 205 finished with value: 0.1207726482815589 and parameters: {'n_layers': 1, 'embedding_dim': 256, 'lr': 0.000544825738241814, 'lambda_val': 6.376868968071807e-05, 'batch_size': 2710, 'optimizer': 'Adam'}. Best is trial 168 with value: 0.1307238454685406.
2026-05-16 04:27:50,010 - optuna.study._optimize - INFO - Trial 206 pruned. 
2026-05-16 04:28:04,313 - experiment_functions - INFO - Early stopping at epoch 2350. Best Recall: 0.1231
2026-05-16 04:28:04,403 - optuna.study.study - INFO - Trial 207 finished with value: 0.12307260978030422 and parameters: {'n_layers': 1, 'embedding_dim': 256, 'lr': 0.0004706535671208511, 'lambda_val': 0.00010091353469554305, 'batch_size': 2515, 'optimizer': 'Adam'}. Best is trial 168 with value: 0.1307238454685406.
2026-05-16 04:28:10,918 - optuna.study._optimize - INFO - Trial 208 pruned. 
2026-05-16 04:28:16,997 - optuna.study._optimize - INFO - Trial 209 pruned. 
2026-05-16 04:28:24,928 - optuna.study._optimize - INFO - Trial 210 pruned. 
2026-05-16 04:28:31,588 - experiment_functions - INFO - Early stopping at epoch 700. Best Recall: 0.0426
2026-05-16 04:28:31,689 - optuna.study.study - INFO - Trial 211 finished with value: 0.0425622380945208 and parameters: {'n_layers': 4, 'embedding_dim': 256, 'lr': 0.0004750499631043218, 'lambda_val': 5.132669786023811e-05, 'batch_size': 2524, 'optimizer': 'Adam'}. Best is trial 168 with value: 0.1307238454685406.
2026-05-16 04:28:38,778 - optuna.study._optimize - INFO - Trial 212 pruned. 
2026-05-16 04:28:53,319 - experiment_functions - INFO - Early stopping at epoch 2400. Best Recall: 0.1231
2026-05-16 04:28:53,409 - optuna.study.study - INFO - Trial 213 finished with value: 0.12312913300915167 and parameters: {'n_layers': 1, 'embedding_dim': 256, 'lr': 0.00037480757275776093, 'lambda_val': 7.451291003304596e-05, 'batch_size': 2398, 'optimizer': 'Adam'}. Best is trial 168 with value: 0.1307238454685406.
2026-05-16 04:29:01,028 - optuna.study._optimize - INFO - Trial 214 pruned. 
2026-05-16 04:29:08,174 - optuna.study._optimize - INFO - Trial 215 pruned. 
2026-05-16 04:29:27,541 - optuna.study._optimize - INFO - Trial 216 pruned. 
2026-05-16 04:29:35,159 - optuna.study._optimize - INFO - Trial 217 pruned. 
2026-05-16 04:29:43,649 - experiment_functions - INFO - Early stopping at epoch 1400. Best Recall: 0.1278
2026-05-16 04:29:44,206 - optuna.study.study - INFO - Trial 218 finished with value: 0.12783242705516684 and parameters: {'n_layers': 1, 'embedding_dim': 256, 'lr': 0.0005376132746182864, 'lambda_val': 0.00013207825239214363, 'batch_size': 2384, 'optimizer': 'Adam'}. Best is trial 168 with value: 0.1307238454685406.
2026-05-16 04:29:53,509 - optuna.study._optimize - INFO - Trial 219 pruned. 
2026-05-16 04:30:00,247 - optuna.study._optimize - INFO - Trial 220 pruned. 
2026-05-16 04:30:07,046 - optuna.study._optimize - INFO - Trial 221 pruned. 
2026-05-16 04:30:13,770 - optuna.study._optimize - INFO - Trial 222 pruned. 
2026-05-16 04:30:22,933 - experiment_functions - INFO - Early stopping at epoch 1500. Best Recall: 0.1212
2026-05-16 04:30:23,023 - optuna.study.study - INFO - Trial 223 finished with value: 0.12117398196670336 and parameters: {'n_layers': 1, 'embedding_dim': 256, 'lr': 0.0004947270718349621, 'lambda_val': 9.257520305713968e-05, 'batch_size': 2391, 'optimizer': 'Adam'}. Best is trial 168 with value: 0.1307238454685406.
2026-05-16 04:30:29,942 - optuna.study._optimize - INFO - Trial 224 pruned. 
2026-05-16 04:30:36,326 - optuna.study._optimize - INFO - Trial 225 pruned. 
2026-05-16 04:30:39,782 - experiment_functions - INFO - Early stopping at epoch 500. Best Recall: 0.0023
2026-05-16 04:30:39,883 - optuna.study.study - INFO - Trial 226 finished with value: 0.002349318459719982 and parameters: {'n_layers': 1, 'embedding_dim': 256, 'lr': 0.0007318308039338655, 'lambda_val': 5.539504190223811e-05, 'batch_size': 2450, 'optimizer': 'SGD'}. Best is trial 168 with value: 0.1307238454685406.
2026-05-16 04:30:46,059 - optuna.study._optimize - INFO - Trial 227 pruned. 
2026-05-16 04:30:53,117 - optuna.study._optimize - INFO - Trial 228 pruned. 
2026-05-16 04:31:04,034 - experiment_functions - INFO - Early stopping at epoch 1750. Best Recall: 0.1214
2026-05-16 04:31:04,134 - optuna.study.study - INFO - Trial 229 finished with value: 0.12140088327510662 and parameters: {'n_layers': 1, 'embedding_dim': 256, 'lr': 0.0005151012769827075, 'lambda_val': 6.879813258825555e-05, 'batch_size': 2545, 'optimizer': 'Adam'}. Best is trial 168 with value: 0.1307238454685406.
2026-05-16 04:31:16,248 - optuna.study._optimize - INFO - Trial 230 pruned. 
2026-05-16 04:31:24,496 - optuna.study._optimize - INFO - Trial 231 pruned. 
2026-05-16 04:31:34,646 - experiment_functions - INFO - Early stopping at epoch 1550. Best Recall: 0.1359
2026-05-16 04:31:34,748 - optuna.study.study - INFO - Trial 232 finished with value: 0.13586757760358253 and parameters: {'n_layers': 1, 'embedding_dim': 256, 'lr': 0.0005040720816317802, 'lambda_val': 4.615765419662563e-05, 'batch_size': 2477, 'optimizer': 'Adam'}. Best is trial 232 with value: 0.13586757760358253.
2026-05-16 04:31:45,240 - optuna.study._optimize - INFO - Trial 233 pruned. 
2026-05-16 04:31:52,666 - optuna.study._optimize - INFO - Trial 234 pruned. 
2026-05-16 04:31:58,863 - optuna.study._optimize - INFO - Trial 235 pruned. 
2026-05-16 04:32:07,359 - optuna.study._optimize - INFO - Trial 236 pruned. 
2026-05-16 04:32:14,640 - optuna.study._optimize - INFO - Trial 237 pruned. 
2026-05-16 04:32:21,757 - optuna.study._optimize - INFO - Trial 238 pruned. 
2026-05-16 04:32:26,456 - experiment_functions - INFO - Early stopping at epoch 600. Best Recall: 0.0536
2026-05-16 04:32:26,545 - optuna.study.study - INFO - Trial 239 finished with value: 0.05357688096181839 and parameters: {'n_layers': 1, 'embedding_dim': 256, 'lr': 0.017513369878040218, 'lambda_val': 0.00018823230219181067, 'batch_size': 2360, 'optimizer': 'Adam'}. Best is trial 232 with value: 0.13586757760358253.
2026-05-16 04:32:40,186 - experiment_functions - INFO - Early stopping at epoch 1900. Best Recall: 0.1274
2026-05-16 04:32:40,276 - optuna.study.study - INFO - Trial 240 finished with value: 0.1273901437637378 and parameters: {'n_layers': 1, 'embedding_dim': 256, 'lr': 0.00045687247326379077, 'lambda_val': 8.415509311181407e-05, 'batch_size': 2412, 'optimizer': 'Adam'}. Best is trial 232 with value: 0.13586757760358253.
2026-05-16 04:32:47,066 - optuna.study._optimize - INFO - Trial 241 pruned. 
2026-05-16 04:32:54,344 - optuna.study._optimize - INFO - Trial 242 pruned. 
2026-05-16 04:33:03,105 - experiment_functions - INFO - Early stopping at epoch 1400. Best Recall: 0.1162
2026-05-16 04:33:03,182 - optuna.study.study - INFO - Trial 243 finished with value: 0.11623368112643577 and parameters: {'n_layers': 1, 'embedding_dim': 256, 'lr': 0.0005791255163726107, 'lambda_val': 5.7128308047323976e-05, 'batch_size': 2336, 'optimizer': 'Adam'}. Best is trial 232 with value: 0.13586757760358253.
2026-05-16 04:33:17,625 - experiment_functions - INFO - Early stopping at epoch 2250. Best Recall: 0.1234
2026-05-16 04:33:17,720 - optuna.study.study - INFO - Trial 244 finished with value: 0.12338910371437313 and parameters: {'n_layers': 1, 'embedding_dim': 256, 'lr': 0.00042314468728034497, 'lambda_val': 0.00013269964478258527, 'batch_size': 2576, 'optimizer': 'Adam'}. Best is trial 232 with value: 0.13586757760358253.
2026-05-16 04:33:25,275 - optuna.study._optimize - INFO - Trial 245 pruned. 
2026-05-16 04:33:32,562 - optuna.study._optimize - INFO - Trial 246 pruned. 
2026-05-16 04:33:39,275 - optuna.study._optimize - INFO - Trial 247 pruned. 
2026-05-16 04:33:50,811 - experiment_functions - INFO - Early stopping at epoch 1750. Best Recall: 0.1191
2026-05-16 04:33:50,914 - optuna.study.study - INFO - Trial 248 finished with value: 0.11905728849714718 and parameters: {'n_layers': 1, 'embedding_dim': 256, 'lr': 0.00046442755210170507, 'lambda_val': 0.00010425976526070832, 'batch_size': 2554, 'optimizer': 'Adam'}. Best is trial 232 with value: 0.13586757760358253.
2026-05-16 04:33:58,083 - optuna.study._optimize - INFO - Trial 249 pruned. 
2026-05-16 04:34:04,832 - optuna.study._optimize - INFO - Trial 250 pruned. 
2026-05-16 04:34:11,891 - optuna.study._optimize - INFO - Trial 251 pruned. 
2026-05-16 04:34:21,352 - optuna.study._optimize - INFO - Trial 252 pruned. 
2026-05-16 04:34:28,165 - optuna.study._optimize - INFO - Trial 253 pruned. 
2026-05-16 04:34:43,306 - optuna.study._optimize - INFO - Trial 254 pruned. 
2026-05-16 04:35:07,673 - experiment_functions - INFO - Early stopping at epoch 2250. Best Recall: 0.1233
2026-05-16 04:35:07,787 - optuna.study.study - INFO - Trial 255 finished with value: 0.12331638484215038 and parameters: {'n_layers': 1, 'embedding_dim': 256, 'lr': 0.0003451983493531998, 'lambda_val': 6.169706562324527e-05, 'batch_size': 2572, 'optimizer': 'Adam'}. Best is trial 232 with value: 0.13586757760358253.
2026-05-16 04:35:16,788 - optuna.study._optimize - INFO - Trial 256 pruned. 
2026-05-16 04:35:20,765 - experiment_functions - INFO - Early stopping at epoch 500. Best Recall: 0.0016
2026-05-16 04:35:20,847 - optuna.study.study - INFO - Trial 257 finished with value: 0.0016492690877786317 and parameters: {'n_layers': 1, 'embedding_dim': 256, 'lr': 0.00031954666673859774, 'lambda_val': 7.57280792983837e-05, 'batch_size': 2599, 'optimizer': 'SGD'}. Best is trial 232 with value: 0.13586757760358253.
2026-05-16 04:35:32,996 - experiment_functions - INFO - Early stopping at epoch 1200. Best Recall: 0.1155
2026-05-16 04:35:33,100 - optuna.study.study - INFO - Trial 258 finished with value: 0.11550317129769604 and parameters: {'n_layers': 1, 'embedding_dim': 256, 'lr': 0.0006453898105193264, 'lambda_val': 4.265745083938308e-05, 'batch_size': 2224, 'optimizer': 'Adam'}. Best is trial 232 with value: 0.13586757760358253.
2026-05-16 04:35:45,140 - experiment_functions - INFO - Early stopping at epoch 1900. Best Recall: 0.1301
2026-05-16 04:35:45,232 - optuna.study.study - INFO - Trial 259 finished with value: 0.13014910160583512 and parameters: {'n_layers': 1, 'embedding_dim': 256, 'lr': 0.0004188713571917885, 'lambda_val': 0.00013810420946493778, 'batch_size': 2339, 'optimizer': 'Adam'}. Best is trial 232 with value: 0.13586757760358253.
2026-05-16 04:35:51,970 - optuna.study._optimize - INFO - Trial 260 pruned. 
2026-05-16 04:36:09,308 - experiment_functions - INFO - Early stopping at epoch 2400. Best Recall: 0.1263
2026-05-16 04:36:09,412 - optuna.study.study - INFO - Trial 261 finished with value: 0.12626420871603508 and parameters: {'n_layers': 1, 'embedding_dim': 256, 'lr': 0.0003355633117360243, 'lambda_val': 0.00014647911677333664, 'batch_size': 2715, 'optimizer': 'Adam'}. Best is trial 232 with value: 0.13586757760358253.
2026-05-16 04:36:16,213 - optuna.study._optimize - INFO - Trial 262 pruned. 
2026-05-16 04:36:23,966 - experiment_functions - INFO - Early stopping at epoch 1200. Best Recall: 0.1191
2026-05-16 04:36:24,094 - optuna.study.study - INFO - Trial 263 finished with value: 0.11909011013062672 and parameters: {'n_layers': 1, 'embedding_dim': 256, 'lr': 0.0005798794797839373, 'lambda_val': 0.0001815843994761311, 'batch_size': 3228, 'optimizer': 'Adam'}. Best is trial 232 with value: 0.13586757760358253.
2026-05-16 04:36:29,967 - optuna.study._optimize - INFO - Trial 264 pruned. 
2026-05-16 04:36:36,583 - optuna.study._optimize - INFO - Trial 265 pruned. 
2026-05-16 04:36:41,730 - experiment_functions - INFO - Early stopping at epoch 700. Best Recall: 0.1098
2026-05-16 04:36:41,857 - optuna.study.study - INFO - Trial 266 finished with value: 0.10975435875835067 and parameters: {'n_layers': 1, 'embedding_dim': 256, 'lr': 0.0017218202362642506, 'lambda_val': 0.0002557185202993698, 'batch_size': 2824, 'optimizer': 'Adam'}. Best is trial 232 with value: 0.13586757760358253.
2026-05-16 04:36:51,397 - experiment_functions - INFO - Early stopping at epoch 1550. Best Recall: 0.1223
2026-05-16 04:36:51,544 - optuna.study.study - INFO - Trial 267 finished with value: 0.12233018804234352 and parameters: {'n_layers': 1, 'embedding_dim': 256, 'lr': 0.00044669028098222156, 'lambda_val': 8.514765358313842e-05, 'batch_size': 2246, 'optimizer': 'Adam'}. Best is trial 232 with value: 0.13586757760358253.
2026-05-16 04:36:58,920 - optuna.study._optimize - INFO - Trial 268 pruned. 
2026-05-16 04:37:05,456 - optuna.study._optimize - INFO - Trial 269 pruned. 
2026-05-16 04:37:10,670 - optuna.study._optimize - INFO - Trial 270 pruned. 
2026-05-16 04:37:17,465 - optuna.study._optimize - INFO - Trial 271 pruned. 
2026-05-16 04:37:34,999 - optuna.study._optimize - INFO - Trial 272 pruned. 
2026-05-16 04:37:44,882 - optuna.study._optimize - INFO - Trial 273 pruned. 
2026-05-16 04:37:51,489 - optuna.study._optimize - INFO - Trial 274 pruned. 
2026-05-16 04:37:58,627 - optuna.study._optimize - INFO - Trial 275 pruned. 
2026-05-16 04:38:03,954 - experiment_functions - INFO - Early stopping at epoch 750. Best Recall: 0.1131
2026-05-16 04:38:04,092 - optuna.study.study - INFO - Trial 276 finished with value: 0.11305823867568891 and parameters: {'n_layers': 1, 'embedding_dim': 256, 'lr': 0.0013325191831592173, 'lambda_val': 3.867886123655387e-05, 'batch_size': 2171, 'optimizer': 'Adam'}. Best is trial 232 with value: 0.13586757760358253.
2026-05-16 04:38:10,761 - optuna.study._optimize - INFO - Trial 277 pruned. 
2026-05-16 04:38:21,617 - experiment_functions - INFO - Early stopping at epoch 1700. Best Recall: 0.1236
2026-05-16 04:38:21,711 - optuna.study.study - INFO - Trial 278 finished with value: 0.12356709477596164 and parameters: {'n_layers': 1, 'embedding_dim': 256, 'lr': 0.00045688653118368627, 'lambda_val': 0.0001386068119654463, 'batch_size': 2332, 'optimizer': 'Adam'}. Best is trial 232 with value: 0.13586757760358253.
2026-05-16 04:38:31,348 - optuna.study._optimize - INFO - Trial 279 pruned. 
2026-05-16 04:38:39,279 - optuna.study._optimize - INFO - Trial 280 pruned. 
2026-05-16 04:38:46,307 - optuna.study._optimize - INFO - Trial 281 pruned. 
2026-05-16 04:38:50,218 - experiment_functions - INFO - Early stopping at epoch 500. Best Recall: 0.0026
2026-05-16 04:38:50,311 - optuna.study.study - INFO - Trial 282 finished with value: 0.002572388743209525 and parameters: {'n_layers': 1, 'embedding_dim': 256, 'lr': 2.1511942931711e-05, 'lambda_val': 9.517655192849784e-05, 'batch_size': 2107, 'optimizer': 'Adam'}. Best is trial 232 with value: 0.13586757760358253.
2026-05-16 04:38:53,943 - experiment_functions - INFO - Early stopping at epoch 500. Best Recall: 0.0011
2026-05-16 04:38:54,115 - optuna.study.study - INFO - Trial 283 finished with value: 0.0010812493299679172 and parameters: {'n_layers': 1, 'embedding_dim': 128, 'lr': 0.00021797784917708212, 'lambda_val': 0.0001490574377561452, 'batch_size': 2431, 'optimizer': 'SGD'}. Best is trial 232 with value: 0.13586757760358253.
2026-05-16 04:39:00,520 - optuna.study._optimize - INFO - Trial 284 pruned. 
2026-05-16 04:39:08,215 - optuna.study._optimize - INFO - Trial 285 pruned. 
2026-05-16 04:39:17,011 - experiment_functions - INFO - Early stopping at epoch 1450. Best Recall: 0.1216
2026-05-16 04:39:17,105 - optuna.study.study - INFO - Trial 286 finished with value: 0.12155591667809533 and parameters: {'n_layers': 1, 'embedding_dim': 256, 'lr': 0.0005551491886818095, 'lambda_val': 5.1990318785752186e-05, 'batch_size': 2231, 'optimizer': 'Adam'}. Best is trial 232 with value: 0.13586757760358253.
2026-05-16 04:39:23,532 - optuna.study._optimize - INFO - Trial 287 pruned. 
2026-05-16 04:39:30,815 - optuna.study._optimize - INFO - Trial 288 pruned. 
2026-05-16 04:39:37,239 - optuna.study._optimize - INFO - Trial 289 pruned. 
2026-05-16 04:39:55,996 - optuna.study._optimize - INFO - Trial 290 pruned. 
2026-05-16 04:40:06,218 - experiment_functions - INFO - Early stopping at epoch 1550. Best Recall: 0.1242
