2026-05-16 09:24:16,295 - optuna.study.study - INFO - Trial 155 finished with value: 0.12094460413945676 and parameters: {'n_layers': 1, 'embedding_dim': 256, 'lr': 0.0006129861464611477, 'lambda_val': 0.00010685044975562159, 'batch_size': 1031, 'optimizer': 'Adam'}. Best is trial 138 with value: 0.13771264499486957.
2026-05-16 09:24:26,215 - experiment_functions - INFO - Early stopping at epoch 1600. Best Recall: 0.1262
2026-05-16 09:24:26,314 - optuna.study.study - INFO - Trial 156 finished with value: 0.12618376840173384 and parameters: {'n_layers': 1, 'embedding_dim': 256, 'lr': 0.0007637627224580675, 'lambda_val': 6.94199138609353e-05, 'batch_size': 798, 'optimizer': 'Adam'}. Best is trial 138 with value: 0.13771264499486957.
2026-05-16 09:24:37,432 - experiment_functions - INFO - Early stopping at epoch 1700. Best Recall: 0.1267
2026-05-16 09:24:37,534 - optuna.study.study - INFO - Trial 157 finished with value: 0.12671013672862724 and parameters: {'n_layers': 1, 'embedding_dim': 256, 'lr': 0.0007668954594480344, 'lambda_val': 7.136639182426296e-05, 'batch_size': 745, 'optimizer': 'Adam'}. Best is trial 138 with value: 0.13771264499486957.
2026-05-16 09:24:44,769 - optuna.study._optimize - INFO - Trial 158 pruned. 
2026-05-16 09:24:49,951 - experiment_functions - INFO - Early stopping at epoch 750. Best Recall: 0.1004
2026-05-16 09:24:50,119 - optuna.study.study - INFO - Trial 159 finished with value: 0.10037209970641023 and parameters: {'n_layers': 1, 'embedding_dim': 256, 'lr': 0.0017667040856934812, 'lambda_val': 7.915460031511901e-05, 'batch_size': 679, 'optimizer': 'Adam'}. Best is trial 138 with value: 0.13771264499486957.
2026-05-16 09:24:57,663 - optuna.study._optimize - INFO - Trial 160 pruned. 
2026-05-16 09:25:11,947 - optuna.study._optimize - INFO - Trial 161 pruned. 
2026-05-16 09:25:19,633 - optuna.study._optimize - INFO - Trial 162 pruned. 
2026-05-16 09:25:31,389 - experiment_functions - INFO - Early stopping at epoch 1850. Best Recall: 0.1234
2026-05-16 09:25:31,488 - optuna.study.study - INFO - Trial 163 finished with value: 0.12342773268669179 and parameters: {'n_layers': 1, 'embedding_dim': 256, 'lr': 0.0006480622554976919, 'lambda_val': 0.00013269201205830003, 'batch_size': 766, 'optimizer': 'Adam'}. Best is trial 138 with value: 0.13771264499486957.
2026-05-16 09:25:40,572 - experiment_functions - INFO - Early stopping at epoch 1400. Best Recall: 0.1173
2026-05-16 09:25:40,680 - optuna.study.study - INFO - Trial 164 finished with value: 0.11730670545258129 and parameters: {'n_layers': 1, 'embedding_dim': 256, 'lr': 0.0010816761775087626, 'lambda_val': 4.330966736288731e-05, 'batch_size': 743, 'optimizer': 'Adam'}. Best is trial 138 with value: 0.13771264499486957.
2026-05-16 09:26:00,531 - optuna.study.study - INFO - Trial 165 finished with value: 0.1269625785629064 and parameters: {'n_layers': 1, 'embedding_dim': 64, 'lr': 0.000810980771027186, 'lambda_val': 0.00018503906405918248, 'batch_size': 674, 'optimizer': 'Adam'}. Best is trial 138 with value: 0.13771264499486957.
2026-05-16 09:26:06,905 - optuna.study._optimize - INFO - Trial 166 pruned. 
2026-05-16 09:26:12,420 - optuna.study._optimize - INFO - Trial 167 pruned. 
2026-05-16 09:26:18,776 - optuna.study._optimize - INFO - Trial 168 pruned. 
2026-05-16 09:26:25,056 - optuna.study._optimize - INFO - Trial 169 pruned. 
2026-05-16 09:26:30,827 - optuna.study._optimize - INFO - Trial 170 pruned. 
2026-05-16 09:26:42,463 - experiment_functions - INFO - Early stopping at epoch 1850. Best Recall: 0.1312
2026-05-16 09:26:42,555 - optuna.study.study - INFO - Trial 171 finished with value: 0.1311778836254558 and parameters: {'n_layers': 1, 'embedding_dim': 256, 'lr': 0.0006542410090569834, 'lambda_val': 0.0001618972176784871, 'batch_size': 805, 'optimizer': 'Adam'}. Best is trial 138 with value: 0.13771264499486957.
2026-05-16 09:26:56,680 - experiment_functions - INFO - Early stopping at epoch 2200. Best Recall: 0.1266
2026-05-16 09:26:56,769 - optuna.study.study - INFO - Trial 172 finished with value: 0.12662690253231762 and parameters: {'n_layers': 1, 'embedding_dim': 256, 'lr': 0.000548074092634535, 'lambda_val': 0.00029034599761936983, 'batch_size': 811, 'optimizer': 'Adam'}. Best is trial 138 with value: 0.13771264499486957.
2026-05-16 09:27:16,746 - experiment_functions - INFO - Early stopping at epoch 3200. Best Recall: 0.1294
2026-05-16 09:27:16,836 - optuna.study.study - INFO - Trial 173 finished with value: 0.1294068265456581 and parameters: {'n_layers': 1, 'embedding_dim': 256, 'lr': 0.000534653655165123, 'lambda_val': 0.00027636675203811684, 'batch_size': 796, 'optimizer': 'Adam'}. Best is trial 138 with value: 0.13771264499486957.
2026-05-16 09:27:24,246 - optuna.study._optimize - INFO - Trial 174 pruned. 
2026-05-16 09:27:31,698 - optuna.study._optimize - INFO - Trial 175 pruned. 
2026-05-16 09:27:39,462 - optuna.study._optimize - INFO - Trial 176 pruned. 
2026-05-16 09:27:48,462 - optuna.study._optimize - INFO - Trial 177 pruned. 
2026-05-16 09:27:52,140 - experiment_functions - INFO - Early stopping at epoch 500. Best Recall: 0.0014
2026-05-16 09:27:52,252 - optuna.study.study - INFO - Trial 178 finished with value: 0.0014063720998755793 and parameters: {'n_layers': 1, 'embedding_dim': 256, 'lr': 0.0006939981427367455, 'lambda_val': 0.0004772933702345137, 'batch_size': 557, 'optimizer': 'SGD'}. Best is trial 138 with value: 0.13771264499486957.
2026-05-16 09:28:00,693 - experiment_functions - INFO - Early stopping at epoch 1150. Best Recall: 0.1278
2026-05-16 09:28:00,814 - optuna.study.study - INFO - Trial 179 finished with value: 0.12780100861249832 and parameters: {'n_layers': 1, 'embedding_dim': 256, 'lr': 0.0009543910751470291, 'lambda_val': 0.00015828452479787472, 'batch_size': 644, 'optimizer': 'Adam'}. Best is trial 138 with value: 0.13771264499486957.
2026-05-16 09:28:11,584 - experiment_functions - INFO - Early stopping at epoch 1500. Best Recall: 0.1197
2026-05-16 09:28:11,674 - optuna.study.study - INFO - Trial 180 finished with value: 0.11966070631307711 and parameters: {'n_layers': 1, 'embedding_dim': 256, 'lr': 0.0010259604350058066, 'lambda_val': 0.00016135241779614468, 'batch_size': 654, 'optimizer': 'Adam'}. Best is trial 138 with value: 0.13771264499486957.
2026-05-16 09:28:20,192 - experiment_functions - INFO - Early stopping at epoch 1250. Best Recall: 0.1160
2026-05-16 09:28:20,293 - optuna.study.study - INFO - Trial 181 finished with value: 0.11602761824619107 and parameters: {'n_layers': 1, 'embedding_dim': 256, 'lr': 0.000913853581928606, 'lambda_val': 0.00024352900590489285, 'batch_size': 931, 'optimizer': 'Adam'}. Best is trial 138 with value: 0.13771264499486957.
2026-05-16 09:28:27,766 - optuna.study._optimize - INFO - Trial 182 pruned. 
2026-05-16 09:28:54,596 - optuna.study.study - INFO - Trial 183 finished with value: 0.13125525522742953 and parameters: {'n_layers': 1, 'embedding_dim': 256, 'lr': 0.000601795016959956, 'lambda_val': 0.0003318004410061412, 'batch_size': 520, 'optimizer': 'Adam'}. Best is trial 138 with value: 0.13771264499486957.
2026-05-16 09:29:03,972 - optuna.study._optimize - INFO - Trial 184 pruned. 
2026-05-16 09:29:11,139 - optuna.study._optimize - INFO - Trial 185 pruned. 
2026-05-16 09:29:23,785 - experiment_functions - INFO - Early stopping at epoch 1800. Best Recall: 0.1206
2026-05-16 09:29:23,908 - optuna.study.study - INFO - Trial 186 finished with value: 0.12055029362405734 and parameters: {'n_layers': 1, 'embedding_dim': 256, 'lr': 0.0007761446623211359, 'lambda_val': 0.0003045664344084453, 'batch_size': 653, 'optimizer': 'Adam'}. Best is trial 138 with value: 0.13771264499486957.
2026-05-16 09:29:32,513 - optuna.study._optimize - INFO - Trial 187 pruned. 
2026-05-16 09:29:39,631 - optuna.study._optimize - INFO - Trial 188 pruned. 
2026-05-16 09:29:53,244 - experiment_functions - INFO - Early stopping at epoch 1950. Best Recall: 0.1279
2026-05-16 09:29:53,355 - optuna.study.study - INFO - Trial 189 finished with value: 0.12786108354898143 and parameters: {'n_layers': 1, 'embedding_dim': 256, 'lr': 0.0005601552678276634, 'lambda_val': 0.0005717274256182983, 'batch_size': 859, 'optimizer': 'Adam'}. Best is trial 138 with value: 0.13771264499486957.
2026-05-16 09:30:04,254 - optuna.study._optimize - INFO - Trial 190 pruned. 
2026-05-16 09:30:24,381 - experiment_functions - INFO - Early stopping at epoch 2800. Best Recall: 0.1347
2026-05-16 09:30:24,482 - optuna.study.study - INFO - Trial 191 finished with value: 0.13466839527942115 and parameters: {'n_layers': 1, 'embedding_dim': 256, 'lr': 0.0005432932288146645, 'lambda_val': 0.0002686107423810192, 'batch_size': 739, 'optimizer': 'Adam'}. Best is trial 138 with value: 0.13771264499486957.
2026-05-16 09:30:45,694 - experiment_functions - INFO - Early stopping at epoch 2800. Best Recall: 0.1271
2026-05-16 09:30:45,805 - optuna.study.study - INFO - Trial 192 finished with value: 0.12707399242807074 and parameters: {'n_layers': 1, 'embedding_dim': 256, 'lr': 0.000586838722377255, 'lambda_val': 0.00025612793221138413, 'batch_size': 712, 'optimizer': 'Adam'}. Best is trial 138 with value: 0.13771264499486957.
2026-05-16 09:30:57,027 - experiment_functions - INFO - Early stopping at epoch 1500. Best Recall: 0.1210
2026-05-16 09:30:57,129 - optuna.study.study - INFO - Trial 193 finished with value: 0.12095182651301607 and parameters: {'n_layers': 1, 'embedding_dim': 256, 'lr': 0.0007755193247708099, 'lambda_val': 0.00025187165572276366, 'batch_size': 787, 'optimizer': 'Adam'}. Best is trial 138 with value: 0.13771264499486957.
2026-05-16 09:31:06,098 - optuna.study._optimize - INFO - Trial 194 pruned. 
2026-05-16 09:31:18,014 - optuna.study._optimize - INFO - Trial 195 pruned. 
2026-05-16 09:31:25,400 - optuna.study._optimize - INFO - Trial 196 pruned. 
2026-05-16 09:31:39,390 - experiment_functions - INFO - Early stopping at epoch 2050. Best Recall: 0.1267
2026-05-16 09:31:39,499 - optuna.study.study - INFO - Trial 197 finished with value: 0.1267395776062645 and parameters: {'n_layers': 1, 'embedding_dim': 256, 'lr': 0.0005677006353373124, 'lambda_val': 0.0004833037341917147, 'batch_size': 656, 'optimizer': 'RMSprop'}. Best is trial 138 with value: 0.13771264499486957.
2026-05-16 09:31:47,212 - optuna.study._optimize - INFO - Trial 198 pruned. 
2026-05-16 09:32:06,650 - experiment_functions - INFO - Early stopping at epoch 3000. Best Recall: 0.1246
2026-05-16 09:32:06,750 - optuna.study.study - INFO - Trial 199 finished with value: 0.12459249173695057 and parameters: {'n_layers': 1, 'embedding_dim': 256, 'lr': 0.0005911967886049889, 'lambda_val': 0.0004428571746475402, 'batch_size': 519, 'optimizer': 'RMSprop'}. Best is trial 138 with value: 0.13771264499486957.
2026-05-16 09:32:14,261 - optuna.study._optimize - INFO - Trial 200 pruned. 
2026-05-16 09:32:24,823 - experiment_functions - INFO - Early stopping at epoch 1300. Best Recall: 0.1219
2026-05-16 09:32:24,966 - optuna.study.study - INFO - Trial 201 finished with value: 0.12186559812560788 and parameters: {'n_layers': 1, 'embedding_dim': 256, 'lr': 0.0007214924273165079, 'lambda_val': 0.00024598466257437344, 'batch_size': 877, 'optimizer': 'RMSprop'}. Best is trial 138 with value: 0.13771264499486957.
2026-05-16 09:32:33,121 - optuna.study._optimize - INFO - Trial 202 pruned. 
2026-05-16 09:32:39,260 - experiment_functions - INFO - Early stopping at epoch 900. Best Recall: 0.0991
2026-05-16 09:32:39,361 - optuna.study.study - INFO - Trial 203 finished with value: 0.09913961351559508 and parameters: {'n_layers': 1, 'embedding_dim': 256, 'lr': 0.001062454861693452, 'lambda_val': 0.00019797965719218797, 'batch_size': 597, 'optimizer': 'Adam'}. Best is trial 138 with value: 0.13771264499486957.
2026-05-16 09:32:46,488 - optuna.study._optimize - INFO - Trial 204 pruned. 
2026-05-16 09:33:01,579 - experiment_functions - INFO - Early stopping at epoch 2050. Best Recall: 0.1247
2026-05-16 09:33:01,668 - optuna.study.study - INFO - Trial 205 finished with value: 0.12472795333959819 and parameters: {'n_layers': 1, 'embedding_dim': 256, 'lr': 0.0006926074176111124, 'lambda_val': 0.0003108003812428114, 'batch_size': 795, 'optimizer': 'Adam'}. Best is trial 138 with value: 0.13771264499486957.
2026-05-16 09:33:22,002 - experiment_functions - INFO - Early stopping at epoch 2200. Best Recall: 0.1381
2026-05-16 09:33:22,101 - optuna.study.study - INFO - Trial 206 finished with value: 0.13806317890833394 and parameters: {'n_layers': 1, 'embedding_dim': 256, 'lr': 0.0005127067793349457, 'lambda_val': 7.360080816403816e-05, 'batch_size': 879, 'optimizer': 'Adam'}. Best is trial 206 with value: 0.13806317890833394.
2026-05-16 09:33:32,363 - optuna.study._optimize - INFO - Trial 207 pruned. 
2026-05-16 09:33:38,672 - optuna.study._optimize - INFO - Trial 208 pruned. 
2026-05-16 09:33:45,866 - optuna.study._optimize - INFO - Trial 209 pruned. 
2026-05-16 09:33:53,538 - optuna.study._optimize - INFO - Trial 210 pruned. 
2026-05-16 09:34:17,546 - experiment_functions - INFO - Early stopping at epoch 3450. Best Recall: 0.1315
2026-05-16 09:34:17,646 - optuna.study.study - INFO - Trial 211 finished with value: 0.131542373044276 and parameters: {'n_layers': 1, 'embedding_dim': 256, 'lr': 0.0005836219737370911, 'lambda_val': 5.780841831329872e-05, 'batch_size': 751, 'optimizer': 'Adam'}. Best is trial 206 with value: 0.13806317890833394.
2026-05-16 09:34:38,271 - experiment_functions - INFO - Early stopping at epoch 2900. Best Recall: 0.1328
2026-05-16 09:34:38,416 - optuna.study.study - INFO - Trial 212 finished with value: 0.13283660779400905 and parameters: {'n_layers': 1, 'embedding_dim': 256, 'lr': 0.0005633432837973364, 'lambda_val': 6.1010337040886906e-05, 'batch_size': 646, 'optimizer': 'Adam'}. Best is trial 206 with value: 0.13806317890833394.
2026-05-16 09:34:59,965 - experiment_functions - INFO - Early stopping at epoch 3200. Best Recall: 0.1322
2026-05-16 09:35:00,100 - optuna.study.study - INFO - Trial 213 finished with value: 0.1321698478397259 and parameters: {'n_layers': 1, 'embedding_dim': 256, 'lr': 0.0005849295097837118, 'lambda_val': 5.936275377130157e-05, 'batch_size': 755, 'optimizer': 'Adam'}. Best is trial 206 with value: 0.13806317890833394.
2026-05-16 09:35:09,969 - optuna.study._optimize - INFO - Trial 214 pruned. 
2026-05-16 09:35:17,230 - optuna.study._optimize - INFO - Trial 215 pruned. 
2026-05-16 09:35:28,806 - experiment_functions - INFO - Early stopping at epoch 1350. Best Recall: 0.1225
2026-05-16 09:35:28,929 - optuna.study.study - INFO - Trial 216 finished with value: 0.12254249996398242 and parameters: {'n_layers': 1, 'embedding_dim': 256, 'lr': 0.0009294483294868192, 'lambda_val': 8.311424774376961e-05, 'batch_size': 763, 'optimizer': 'Adam'}. Best is trial 206 with value: 0.13806317890833394.
2026-05-16 09:35:33,208 - experiment_functions - INFO - Early stopping at epoch 500. Best Recall: 0.0040
2026-05-16 09:35:33,311 - optuna.study.study - INFO - Trial 217 finished with value: 0.004011274612517603 and parameters: {'n_layers': 1, 'embedding_dim': 256, 'lr': 0.0006430618377178003, 'lambda_val': 6.15318117468688e-05, 'batch_size': 635, 'optimizer': 'SGD'}. Best is trial 206 with value: 0.13806317890833394.
2026-05-16 09:35:44,994 - optuna.study._optimize - INFO - Trial 218 pruned. 
2026-05-16 09:36:07,032 - experiment_functions - INFO - Early stopping at epoch 3250. Best Recall: 0.1324
2026-05-16 09:36:07,855 - optuna.study.study - INFO - Trial 219 finished with value: 0.1323707811892644 and parameters: {'n_layers': 1, 'embedding_dim': 256, 'lr': 0.0004917303295967866, 'lambda_val': 4.008296985371846e-05, 'batch_size': 697, 'optimizer': 'Adam'}. Best is trial 206 with value: 0.13806317890833394.
2026-05-16 09:36:15,276 - optuna.study._optimize - INFO - Trial 220 pruned. 
2026-05-16 09:36:22,468 - optuna.study._optimize - INFO - Trial 221 pruned. 
2026-05-16 09:36:36,140 - experiment_functions - INFO - Early stopping at epoch 2200. Best Recall: 0.1420
2026-05-16 09:36:36,776 - optuna.study.study - INFO - Trial 222 finished with value: 0.1420443293408257 and parameters: {'n_layers': 1, 'embedding_dim': 256, 'lr': 0.0006366501606897421, 'lambda_val': 2.2999842266603862e-05, 'batch_size': 629, 'optimizer': 'Adam'}. Best is trial 222 with value: 0.1420443293408257.
2026-05-16 09:36:45,753 - optuna.study._optimize - INFO - Trial 223 pruned. 
2026-05-16 09:36:55,128 - optuna.study._optimize - INFO - Trial 224 pruned. 
2026-05-16 09:37:03,948 - optuna.study._optimize - INFO - Trial 225 pruned. 
2026-05-16 09:37:12,125 - optuna.study._optimize - INFO - Trial 226 pruned. 
2026-05-16 09:37:19,276 - experiment_functions - INFO - Early stopping at epoch 950. Best Recall: 0.1145
2026-05-16 09:37:19,516 - optuna.study.study - INFO - Trial 227 finished with value: 0.11446893373162342 and parameters: {'n_layers': 1, 'embedding_dim': 256, 'lr': 0.0008835853228236894, 'lambda_val': 4.143607047434614e-05, 'batch_size': 3232, 'optimizer': 'Adam'}. Best is trial 222 with value: 0.1420443293408257.
2026-05-16 09:37:31,803 - optuna.study._optimize - INFO - Trial 228 pruned. 
2026-05-16 09:37:39,042 - optuna.study._optimize - INFO - Trial 229 pruned. 
2026-05-16 09:37:45,751 - optuna.study._optimize - INFO - Trial 230 pruned. 
2026-05-16 09:37:58,135 - experiment_functions - INFO - Early stopping at epoch 2150. Best Recall: 0.1291
2026-05-16 09:37:58,236 - optuna.study.study - INFO - Trial 231 finished with value: 0.12911060099347757 and parameters: {'n_layers': 1, 'embedding_dim': 256, 'lr': 0.0005493303537708944, 'lambda_val': 9.29397475777893e-05, 'batch_size': 830, 'optimizer': 'Adam'}. Best is trial 222 with value: 0.1420443293408257.
2026-05-16 09:38:16,778 - optuna.study._optimize - INFO - Trial 232 pruned. 
2026-05-16 09:38:34,277 - experiment_functions - INFO - Early stopping at epoch 2750. Best Recall: 0.1321
2026-05-16 09:38:34,378 - optuna.study.study - INFO - Trial 233 finished with value: 0.13211568939649537 and parameters: {'n_layers': 1, 'embedding_dim': 256, 'lr': 0.0005316395872228075, 'lambda_val': 8.501765156855699e-05, 'batch_size': 864, 'optimizer': 'Adam'}. Best is trial 222 with value: 0.1420443293408257.
2026-05-16 09:38:41,062 - optuna.study._optimize - INFO - Trial 234 pruned. 
2026-05-16 09:38:48,194 - optuna.study._optimize - INFO - Trial 235 pruned. 
2026-05-16 09:39:15,042 - optuna.study._optimize - INFO - Trial 236 pruned. 
2026-05-16 09:39:22,602 - optuna.study._optimize - INFO - Trial 237 pruned. 
2026-05-16 09:39:30,303 - optuna.study._optimize - INFO - Trial 238 pruned. 
2026-05-16 09:39:37,738 - optuna.study._optimize - INFO - Trial 239 pruned. 
2026-05-16 09:39:45,203 - optuna.study._optimize - INFO - Trial 240 pruned. 
2026-05-16 09:39:54,170 - optuna.study._optimize - INFO - Trial 241 pruned. 
2026-05-16 09:40:01,254 - optuna.study._optimize - INFO - Trial 242 pruned. 
2026-05-16 09:40:08,003 - optuna.study._optimize - INFO - Trial 243 pruned. 
2026-05-16 09:40:24,024 - optuna.study._optimize - INFO - Trial 244 pruned. 
2026-05-16 09:40:32,709 - optuna.study._optimize - INFO - Trial 245 pruned. 
2026-05-16 09:40:49,008 - experiment_functions - INFO - Early stopping at epoch 2600. Best Recall: 0.1285
2026-05-16 09:40:49,176 - optuna.study.study - INFO - Trial 246 finished with value: 0.12847772863382745 and parameters: {'n_layers': 1, 'embedding_dim': 256, 'lr': 0.0006712307102216037, 'lambda_val': 0.0002047896529056713, 'batch_size': 700, 'optimizer': 'Adam'}. Best is trial 222 with value: 0.1420443293408257.
2026-05-16 09:40:59,363 - experiment_functions - INFO - Early stopping at epoch 1650. Best Recall: 0.1282
2026-05-16 09:40:59,464 - optuna.study.study - INFO - Trial 247 finished with value: 0.1281661775315365 and parameters: {'n_layers': 1, 'embedding_dim': 256, 'lr': 0.0006164619141828989, 'lambda_val': 0.00017244173515195254, 'batch_size': 629, 'optimizer': 'Adam'}. Best is trial 222 with value: 0.1420443293408257.
2026-05-16 09:41:06,170 - optuna.study._optimize - INFO - Trial 248 pruned. 
2026-05-16 09:41:13,266 - optuna.study._optimize - INFO - Trial 249 pruned. 
2026-05-16 09:41:20,163 - optuna.study._optimize - INFO - Trial 250 pruned. 
2026-05-16 09:41:30,399 - optuna.study._optimize - INFO - Trial 251 pruned. 
2026-05-16 09:41:38,282 - optuna.study._optimize - INFO - Trial 252 pruned. 
2026-05-16 09:41:45,403 - optuna.study._optimize - INFO - Trial 253 pruned. 
2026-05-16 09:41:58,052 - optuna.study._optimize - INFO - Trial 254 pruned. 
2026-05-16 09:42:05,422 - optuna.study._optimize - INFO - Trial 255 pruned. 
2026-05-16 09:42:13,003 - optuna.study._optimize - INFO - Trial 256 pruned. 
2026-05-16 09:42:30,160 - experiment_functions - INFO - Early stopping at epoch 2500. Best Recall: 0.1306
2026-05-16 09:42:30,259 - optuna.study.study - INFO - Trial 257 finished with value: 0.13062052314701575 and parameters: {'n_layers': 1, 'embedding_dim': 256, 'lr': 0.0006757499923640703, 'lambda_val': 9.705347695995357e-05, 'batch_size': 635, 'optimizer': 'Adam'}. Best is trial 222 with value: 0.1420443293408257.
2026-05-16 09:42:35,216 - experiment_functions - INFO - Early stopping at epoch 500. Best Recall: 0.0029
2026-05-16 09:42:35,336 - optuna.study.study - INFO - Trial 258 finished with value: 0.0028755711084377366 and parameters: {'n_layers': 1, 'embedding_dim': 256, 'lr': 0.0005827401902885213, 'lambda_val': 9.801491283795743e-05, 'batch_size': 1156, 'optimizer': 'SGD'}. Best is trial 222 with value: 0.1420443293408257.
2026-05-16 09:42:42,914 - optuna.study._optimize - INFO - Trial 259 pruned. 
2026-05-16 09:42:50,760 - optuna.study._optimize - INFO - Trial 260 pruned. 
2026-05-16 09:42:59,306 - optuna.study._optimize - INFO - Trial 261 pruned. 
2026-05-16 09:43:06,390 - optuna.study._optimize - INFO - Trial 262 pruned. 
2026-05-16 09:43:12,827 - optuna.study._optimize - INFO - Trial 263 pruned. 
2026-05-16 09:43:21,844 - optuna.study._optimize - INFO - Trial 264 pruned. 
