2026-05-16 01:14:24,506 - optuna.study.study - INFO - Trial 73 finished with value: 0.08559613047723996 and parameters: {'n_layers': 1, 'embedding_dim': 256, 'lr': 0.0006726541147677454, 'lambda_val': 2.27583799286377e-05, 'batch_size': 1228, 'optimizer': 'Adam'}. Best is trial 71 with value: 0.0892213002587449.
2026-05-16 01:14:34,224 - experiment_functions - INFO - Early stopping at epoch 1350. Best Recall: 0.0862
2026-05-16 01:14:34,361 - optuna.study.study - INFO - Trial 74 finished with value: 0.08618331398880959 and parameters: {'n_layers': 1, 'embedding_dim': 256, 'lr': 0.0012505030177174144, 'lambda_val': 3.0070047190020783e-05, 'batch_size': 1228, 'optimizer': 'Adam'}. Best is trial 71 with value: 0.0892213002587449.
2026-05-16 01:14:40,168 - experiment_functions - INFO - Early stopping at epoch 800. Best Recall: 0.0752
2026-05-16 01:14:40,269 - optuna.study.study - INFO - Trial 75 finished with value: 0.07522609518069454 and parameters: {'n_layers': 1, 'embedding_dim': 256, 'lr': 0.0012448691853567566, 'lambda_val': 2.8562894509359794e-05, 'batch_size': 923, 'optimizer': 'Adam'}. Best is trial 71 with value: 0.0892213002587449.
2026-05-16 01:14:44,275 - experiment_functions - INFO - Early stopping at epoch 500. Best Recall: 0.0017
2026-05-16 01:14:44,376 - optuna.study.study - INFO - Trial 76 finished with value: 0.001661937548521638 and parameters: {'n_layers': 1, 'embedding_dim': 256, 'lr': 0.00046717418290634436, 'lambda_val': 2.2194337238541666e-05, 'batch_size': 1252, 'optimizer': 'SGD'}. Best is trial 71 with value: 0.0892213002587449.
2026-05-16 01:14:52,093 - optuna.study._optimize - INFO - Trial 77 pruned. 
2026-05-16 01:15:10,637 - optuna.study._optimize - INFO - Trial 78 pruned. 
2026-05-16 01:15:17,494 - optuna.study._optimize - INFO - Trial 79 pruned. 
2026-05-16 01:15:24,075 - experiment_functions - INFO - Early stopping at epoch 600. Best Recall: 0.0296
2026-05-16 01:15:24,154 - optuna.study.study - INFO - Trial 80 finished with value: 0.029630253609096952 and parameters: {'n_layers': 4, 'embedding_dim': 256, 'lr': 0.0011363077461007867, 'lambda_val': 1.1161195579486953e-05, 'batch_size': 1132, 'optimizer': 'Adam'}. Best is trial 71 with value: 0.0892213002587449.
2026-05-16 01:15:31,278 - optuna.study._optimize - INFO - Trial 81 pruned. 
2026-05-16 01:15:38,073 - optuna.study._optimize - INFO - Trial 82 pruned. 
2026-05-16 01:15:45,088 - optuna.study._optimize - INFO - Trial 83 pruned. 
2026-05-16 01:16:04,969 - experiment_functions - INFO - Early stopping at epoch 1850. Best Recall: 0.0889
2026-05-16 01:16:05,500 - optuna.study.study - INFO - Trial 84 finished with value: 0.08888236560994467 and parameters: {'n_layers': 1, 'embedding_dim': 256, 'lr': 0.0015285402357010612, 'lambda_val': 6.773121251935508e-06, 'batch_size': 1608, 'optimizer': 'Adam'}. Best is trial 71 with value: 0.0892213002587449.
2026-05-16 01:16:15,663 - experiment_functions - INFO - Early stopping at epoch 1600. Best Recall: 0.0868
2026-05-16 01:16:15,763 - optuna.study.study - INFO - Trial 85 finished with value: 0.0867665369178177 and parameters: {'n_layers': 1, 'embedding_dim': 256, 'lr': 0.0011185019168280217, 'lambda_val': 7.390352572883735e-06, 'batch_size': 1631, 'optimizer': 'Adam'}. Best is trial 71 with value: 0.0892213002587449.
2026-05-16 01:16:26,049 - experiment_functions - INFO - Early stopping at epoch 1600. Best Recall: 0.0798
2026-05-16 01:16:26,139 - optuna.study.study - INFO - Trial 86 finished with value: 0.07976757255811087 and parameters: {'n_layers': 1, 'embedding_dim': 256, 'lr': 0.0016575477224337542, 'lambda_val': 9.815377765617388e-05, 'batch_size': 1723, 'optimizer': 'Adam'}. Best is trial 71 with value: 0.0892213002587449.
2026-05-16 01:16:36,672 - experiment_functions - INFO - Early stopping at epoch 1700. Best Recall: 0.0830
2026-05-16 01:16:36,751 - optuna.study.study - INFO - Trial 87 finished with value: 0.08298750327425386 and parameters: {'n_layers': 1, 'embedding_dim': 256, 'lr': 0.0014677765708375479, 'lambda_val': 2.859573157354751e-06, 'batch_size': 1588, 'optimizer': 'Adam'}. Best is trial 71 with value: 0.0892213002587449.
2026-05-16 01:16:43,476 - optuna.study._optimize - INFO - Trial 88 pruned. 
2026-05-16 01:16:56,013 - experiment_functions - INFO - Early stopping at epoch 500. Best Recall: 0.0006
2026-05-16 01:16:56,116 - optuna.study.study - INFO - Trial 89 finished with value: 0.0005845813491681639 and parameters: {'n_layers': 1, 'embedding_dim': 256, 'lr': 0.0025216917354291407, 'lambda_val': 1.1538425269132984e-05, 'batch_size': 1662, 'optimizer': 'SGD'}. Best is trial 71 with value: 0.0892213002587449.
2026-05-16 01:17:02,870 - experiment_functions - INFO - Early stopping at epoch 850. Best Recall: 0.0497
2026-05-16 01:17:02,970 - optuna.study.study - INFO - Trial 90 finished with value: 0.0497115614751595 and parameters: {'n_layers': 2, 'embedding_dim': 256, 'lr': 0.0005315381714831164, 'lambda_val': 2.061967294801549e-05, 'batch_size': 875, 'optimizer': 'Adam'}. Best is trial 71 with value: 0.0892213002587449.
2026-05-16 01:17:20,280 - experiment_functions - INFO - Early stopping at epoch 2650. Best Recall: 0.0888
2026-05-16 01:17:20,380 - optuna.study.study - INFO - Trial 91 finished with value: 0.0887662990551068 and parameters: {'n_layers': 1, 'embedding_dim': 256, 'lr': 0.0007851285674753982, 'lambda_val': 8.962734575687595e-06, 'batch_size': 1475, 'optimizer': 'Adam'}. Best is trial 71 with value: 0.0892213002587449.
2026-05-16 01:17:33,418 - experiment_functions - INFO - Early stopping at epoch 2100. Best Recall: 0.0887
2026-05-16 01:17:33,528 - optuna.study.study - INFO - Trial 92 finished with value: 0.08869437941587442 and parameters: {'n_layers': 1, 'embedding_dim': 256, 'lr': 0.001173179470273104, 'lambda_val': 7.937086453053909e-06, 'batch_size': 1372, 'optimizer': 'Adam'}. Best is trial 71 with value: 0.0892213002587449.
2026-05-16 01:17:52,119 - experiment_functions - INFO - Early stopping at epoch 1700. Best Recall: 0.0925
2026-05-16 01:17:52,259 - optuna.study.study - INFO - Trial 93 finished with value: 0.0925247245148774 and parameters: {'n_layers': 1, 'embedding_dim': 256, 'lr': 0.0011043714981245224, 'lambda_val': 7.217419253190503e-06, 'batch_size': 1393, 'optimizer': 'Adam'}. Best is trial 93 with value: 0.0925247245148774.
2026-05-16 01:18:02,211 - experiment_functions - INFO - Early stopping at epoch 1550. Best Recall: 0.0957
2026-05-16 01:18:02,316 - optuna.study.study - INFO - Trial 94 finished with value: 0.09570118534276437 and parameters: {'n_layers': 1, 'embedding_dim': 256, 'lr': 0.0011521593698480552, 'lambda_val': 7.990470631520073e-06, 'batch_size': 1975, 'optimizer': 'Adam'}. Best is trial 94 with value: 0.09570118534276437.
2026-05-16 01:18:09,889 - experiment_functions - INFO - Early stopping at epoch 1050. Best Recall: 0.0825
2026-05-16 01:18:09,988 - optuna.study.study - INFO - Trial 95 finished with value: 0.08249808982647691 and parameters: {'n_layers': 1, 'embedding_dim': 96, 'lr': 0.0011416927079346737, 'lambda_val': 1.2037314534042044e-06, 'batch_size': 1981, 'optimizer': 'Adam'}. Best is trial 94 with value: 0.09570118534276437.
2026-05-16 01:18:17,040 - optuna.study._optimize - INFO - Trial 96 pruned. 
2026-05-16 01:18:21,852 - experiment_functions - INFO - Early stopping at epoch 800. Best Recall: 0.0754
2026-05-16 01:18:21,943 - optuna.study.study - INFO - Trial 97 finished with value: 0.07539924298072732 and parameters: {'n_layers': 1, 'embedding_dim': 128, 'lr': 0.0036096868962429683, 'lambda_val': 4.573608166188049e-06, 'batch_size': 1868, 'optimizer': 'Adam'}. Best is trial 94 with value: 0.09570118534276437.
2026-05-16 01:18:28,781 - experiment_functions - INFO - Early stopping at epoch 850. Best Recall: 0.0826
2026-05-16 01:18:29,544 - optuna.study.study - INFO - Trial 98 finished with value: 0.08257183884213065 and parameters: {'n_layers': 1, 'embedding_dim': 256, 'lr': 0.0024965582294353295, 'lambda_val': 7.165590853760022e-06, 'batch_size': 1771, 'optimizer': 'Adam'}. Best is trial 94 with value: 0.09570118534276437.
2026-05-16 01:18:43,698 - optuna.study._optimize - INFO - Trial 99 pruned. 
2026-05-16 01:18:52,493 - experiment_functions - INFO - Early stopping at epoch 1400. Best Recall: 0.0856
2026-05-16 01:18:52,595 - optuna.study.study - INFO - Trial 100 finished with value: 0.08562444329645885 and parameters: {'n_layers': 1, 'embedding_dim': 256, 'lr': 0.0017327621167999175, 'lambda_val': 1.675217098878086e-06, 'batch_size': 1964, 'optimizer': 'Adam'}. Best is trial 94 with value: 0.09570118534276437.
2026-05-16 01:19:01,137 - experiment_functions - INFO - Early stopping at epoch 1300. Best Recall: 0.0901
2026-05-16 01:19:01,239 - optuna.study.study - INFO - Trial 101 finished with value: 0.09009273998978336 and parameters: {'n_layers': 1, 'embedding_dim': 256, 'lr': 0.001668014782304439, 'lambda_val': 1.7888520660646556e-06, 'batch_size': 1992, 'optimizer': 'Adam'}. Best is trial 94 with value: 0.09570118534276437.
2026-05-16 01:19:07,925 - optuna.study._optimize - INFO - Trial 102 pruned. 
2026-05-16 01:19:22,442 - experiment_functions - INFO - Early stopping at epoch 2200. Best Recall: 0.0909
2026-05-16 01:19:22,552 - optuna.study.study - INFO - Trial 103 finished with value: 0.09092091033270863 and parameters: {'n_layers': 1, 'embedding_dim': 256, 'lr': 0.0011126958518549851, 'lambda_val': 1.3527040633729444e-06, 'batch_size': 1413, 'optimizer': 'Adam'}. Best is trial 94 with value: 0.09570118534276437.
2026-05-16 01:19:29,368 - optuna.study._optimize - INFO - Trial 104 pruned. 
2026-05-16 01:19:38,739 - experiment_functions - INFO - Early stopping at epoch 1450. Best Recall: 0.0838
2026-05-16 01:19:38,837 - optuna.study.study - INFO - Trial 105 finished with value: 0.0837560720201898 and parameters: {'n_layers': 1, 'embedding_dim': 256, 'lr': 0.002485444885908799, 'lambda_val': 3.4644241998031003e-06, 'batch_size': 1336, 'optimizer': 'Adam'}. Best is trial 94 with value: 0.09570118534276437.
2026-05-16 01:19:52,384 - experiment_functions - INFO - Early stopping at epoch 2150. Best Recall: 0.0874
2026-05-16 01:19:52,492 - optuna.study.study - INFO - Trial 106 finished with value: 0.08742416948387688 and parameters: {'n_layers': 1, 'embedding_dim': 256, 'lr': 0.0007672703752270351, 'lambda_val': 1.4468316231533747e-06, 'batch_size': 2109, 'optimizer': 'Adam'}. Best is trial 94 with value: 0.09570118534276437.
2026-05-16 01:20:08,302 - experiment_functions - INFO - Early stopping at epoch 650. Best Recall: 0.0462
2026-05-16 01:20:08,416 - optuna.study.study - INFO - Trial 107 finished with value: 0.04619518711715713 and parameters: {'n_layers': 3, 'embedding_dim': 256, 'lr': 0.0007684787332810937, 'lambda_val': 2.1981187019621974e-06, 'batch_size': 2084, 'optimizer': 'Adam'}. Best is trial 94 with value: 0.09570118534276437.
2026-05-16 01:20:14,836 - optuna.study._optimize - INFO - Trial 108 pruned. 
2026-05-16 01:20:28,789 - optuna.study._optimize - INFO - Trial 109 pruned. 
2026-05-16 01:20:32,525 - experiment_functions - INFO - Early stopping at epoch 500. Best Recall: 0.0010
2026-05-16 01:20:32,617 - optuna.study.study - INFO - Trial 110 finished with value: 0.0009587374697481855 and parameters: {'n_layers': 1, 'embedding_dim': 32, 'lr': 0.0010421605840153995, 'lambda_val': 4.742042814450118e-06, 'batch_size': 2175, 'optimizer': 'SGD'}. Best is trial 94 with value: 0.09570118534276437.
2026-05-16 01:20:42,874 - experiment_functions - INFO - Early stopping at epoch 1650. Best Recall: 0.0919
2026-05-16 01:20:42,974 - optuna.study.study - INFO - Trial 111 finished with value: 0.09186585413141822 and parameters: {'n_layers': 1, 'embedding_dim': 256, 'lr': 0.0014816118498920503, 'lambda_val': 7.187121529415074e-06, 'batch_size': 1904, 'optimizer': 'Adam'}. Best is trial 94 with value: 0.09570118534276437.
2026-05-16 01:20:48,076 - experiment_functions - INFO - Early stopping at epoch 750. Best Recall: 0.0823
2026-05-16 01:20:48,166 - optuna.study.study - INFO - Trial 112 finished with value: 0.08231916555947114 and parameters: {'n_layers': 1, 'embedding_dim': 256, 'lr': 0.0013979274216390477, 'lambda_val': 7.1783364592514576e-06, 'batch_size': 1902, 'optimizer': 'Adam'}. Best is trial 94 with value: 0.09570118534276437.
2026-05-16 01:20:56,153 - experiment_functions - INFO - Early stopping at epoch 1200. Best Recall: 0.0836
2026-05-16 01:20:56,296 - optuna.study.study - INFO - Trial 113 finished with value: 0.08355210228651627 and parameters: {'n_layers': 1, 'embedding_dim': 256, 'lr': 0.002150626561754214, 'lambda_val': 0.00037718176448315, 'batch_size': 1758, 'optimizer': 'Adam'}. Best is trial 94 with value: 0.09570118534276437.
2026-05-16 01:21:05,493 - optuna.study._optimize - INFO - Trial 114 pruned. 
2026-05-16 01:21:14,736 - experiment_functions - INFO - Early stopping at epoch 1350. Best Recall: 0.0873
2026-05-16 01:21:14,844 - optuna.study.study - INFO - Trial 115 finished with value: 0.08726687131070143 and parameters: {'n_layers': 1, 'embedding_dim': 256, 'lr': 0.0008081718049148185, 'lambda_val': 1.431266694249151e-06, 'batch_size': 1827, 'optimizer': 'Adam'}. Best is trial 94 with value: 0.09570118534276437.
2026-05-16 01:21:20,840 - optuna.study._optimize - INFO - Trial 116 pruned. 
2026-05-16 01:21:31,549 - experiment_functions - INFO - Early stopping at epoch 1650. Best Recall: 0.0975
2026-05-16 01:21:31,653 - optuna.study.study - INFO - Trial 117 finished with value: 0.0974664928059682 and parameters: {'n_layers': 1, 'embedding_dim': 256, 'lr': 0.0008076124613075822, 'lambda_val': 2.404614969235348e-06, 'batch_size': 2060, 'optimizer': 'Adam'}. Best is trial 117 with value: 0.0974664928059682.
2026-05-16 01:21:51,403 - optuna.study._optimize - INFO - Trial 118 pruned. 
2026-05-16 01:21:58,062 - optuna.study._optimize - INFO - Trial 119 pruned. 
2026-05-16 01:22:04,514 - optuna.study._optimize - INFO - Trial 120 pruned. 
2026-05-16 01:22:21,831 - experiment_functions - INFO - Early stopping at epoch 2800. Best Recall: 0.0943
2026-05-16 01:22:21,933 - optuna.study.study - INFO - Trial 121 finished with value: 0.09426385131598684 and parameters: {'n_layers': 1, 'embedding_dim': 256, 'lr': 0.0009319915207387203, 'lambda_val': 6.691570063400503e-06, 'batch_size': 1847, 'optimizer': 'Adam'}. Best is trial 117 with value: 0.0974664928059682.
2026-05-16 01:22:30,163 - experiment_functions - INFO - Early stopping at epoch 1350. Best Recall: 0.0922
2026-05-16 01:22:30,686 - optuna.study.study - INFO - Trial 122 finished with value: 0.09215194305422139 and parameters: {'n_layers': 1, 'embedding_dim': 256, 'lr': 0.0018630792814958727, 'lambda_val': 3.792893167546666e-06, 'batch_size': 1955, 'optimizer': 'Adam'}. Best is trial 117 with value: 0.0974664928059682.
2026-05-16 01:22:39,435 - experiment_functions - INFO - Early stopping at epoch 1300. Best Recall: 0.0860
2026-05-16 01:22:39,533 - optuna.study.study - INFO - Trial 123 finished with value: 0.08598486041105878 and parameters: {'n_layers': 1, 'embedding_dim': 256, 'lr': 0.0017763982623339202, 'lambda_val': 3.615922983129508e-06, 'batch_size': 2270, 'optimizer': 'Adam'}. Best is trial 117 with value: 0.0974664928059682.
2026-05-16 01:22:46,561 - experiment_functions - INFO - Early stopping at epoch 1050. Best Recall: 0.0824
2026-05-16 01:22:46,652 - optuna.study.study - INFO - Trial 124 finished with value: 0.08241083834719126 and parameters: {'n_layers': 1, 'embedding_dim': 256, 'lr': 0.003174869750639688, 'lambda_val': 4.64876012944355e-06, 'batch_size': 2136, 'optimizer': 'Adam'}. Best is trial 117 with value: 0.0974664928059682.
2026-05-16 01:22:54,702 - experiment_functions - INFO - Early stopping at epoch 1200. Best Recall: 0.0875
2026-05-16 01:22:54,805 - optuna.study.study - INFO - Trial 125 finished with value: 0.0874980457838141 and parameters: {'n_layers': 1, 'embedding_dim': 256, 'lr': 0.001991401046658353, 'lambda_val': 5.7940969333552515e-06, 'batch_size': 1922, 'optimizer': 'Adam'}. Best is trial 117 with value: 0.0974664928059682.
2026-05-16 01:23:01,579 - optuna.study._optimize - INFO - Trial 126 pruned. 
2026-05-16 01:23:08,540 - experiment_functions - INFO - Early stopping at epoch 1050. Best Recall: 0.0879
2026-05-16 01:23:08,895 - optuna.study.study - INFO - Trial 127 finished with value: 0.08792092121482627 and parameters: {'n_layers': 1, 'embedding_dim': 256, 'lr': 0.0018613687126463963, 'lambda_val': 1.0484068440032775e-05, 'batch_size': 1916, 'optimizer': 'Adam'}. Best is trial 117 with value: 0.0974664928059682.
2026-05-16 01:23:28,401 - optuna.study._optimize - INFO - Trial 128 pruned. 
2026-05-16 01:23:38,235 - experiment_functions - INFO - Early stopping at epoch 1550. Best Recall: 0.0853
2026-05-16 01:23:38,335 - optuna.study.study - INFO - Trial 129 finished with value: 0.08527224324762091 and parameters: {'n_layers': 1, 'embedding_dim': 256, 'lr': 0.0017299097345300338, 'lambda_val': 1.78015281955199e-05, 'batch_size': 1708, 'optimizer': 'Adam'}. Best is trial 117 with value: 0.0974664928059682.
2026-05-16 01:23:42,152 - experiment_functions - INFO - Early stopping at epoch 600. Best Recall: 0.0483
2026-05-16 01:23:42,253 - optuna.study.study - INFO - Trial 130 finished with value: 0.04834986580311098 and parameters: {'n_layers': 1, 'embedding_dim': 32, 'lr': 0.00423676470578793, 'lambda_val': 1.2004129769864155e-05, 'batch_size': 1487, 'optimizer': 'RMSprop'}. Best is trial 117 with value: 0.0974664928059682.
2026-05-16 01:23:50,697 - experiment_functions - INFO - Early stopping at epoch 1250. Best Recall: 0.0810
2026-05-16 01:23:50,798 - optuna.study.study - INFO - Trial 131 finished with value: 0.0810374248091297 and parameters: {'n_layers': 1, 'embedding_dim': 256, 'lr': 0.0019691490360966, 'lambda_val': 8.620023024634891e-06, 'batch_size': 1926, 'optimizer': 'Adam'}. Best is trial 117 with value: 0.0974664928059682.
2026-05-16 01:24:06,869 - experiment_functions - INFO - Early stopping at epoch 2650. Best Recall: 0.0898
2026-05-16 01:24:06,967 - optuna.study.study - INFO - Trial 132 finished with value: 0.08980731074315718 and parameters: {'n_layers': 1, 'embedding_dim': 256, 'lr': 0.0009690884426270918, 'lambda_val': 5.856918775446196e-06, 'batch_size': 2024, 'optimizer': 'Adam'}. Best is trial 117 with value: 0.0974664928059682.
2026-05-16 01:24:18,935 - experiment_functions - INFO - Early stopping at epoch 1800. Best Recall: 0.0889
2026-05-16 01:24:19,044 - optuna.study.study - INFO - Trial 133 finished with value: 0.0889057737138715 and parameters: {'n_layers': 1, 'embedding_dim': 256, 'lr': 0.0009597689085869835, 'lambda_val': 4.0828079983294184e-06, 'batch_size': 2028, 'optimizer': 'Adam'}. Best is trial 117 with value: 0.0974664928059682.
2026-05-16 01:24:31,632 - experiment_functions - INFO - Early stopping at epoch 1900. Best Recall: 0.0874
2026-05-16 01:24:31,732 - optuna.study.study - INFO - Trial 134 finished with value: 0.08737492081511873 and parameters: {'n_layers': 1, 'embedding_dim': 256, 'lr': 0.001066354275224595, 'lambda_val': 2.8022331933861306e-06, 'batch_size': 2027, 'optimizer': 'Adam'}. Best is trial 117 with value: 0.0974664928059682.
2026-05-16 01:24:52,017 - experiment_functions - INFO - Early stopping at epoch 2000. Best Recall: 0.0913
2026-05-16 01:24:52,127 - optuna.study.study - INFO - Trial 135 finished with value: 0.09131652838276004 and parameters: {'n_layers': 1, 'embedding_dim': 256, 'lr': 0.000985027530819309, 'lambda_val': 3.967303342578262e-06, 'batch_size': 2208, 'optimizer': 'Adam'}. Best is trial 117 with value: 0.0974664928059682.
2026-05-16 01:24:59,535 - optuna.study._optimize - INFO - Trial 136 pruned. 
2026-05-16 01:25:05,297 - experiment_functions - INFO - Early stopping at epoch 950. Best Recall: 0.0754
2026-05-16 01:25:05,449 - optuna.study.study - INFO - Trial 137 finished with value: 0.0754185729779528 and parameters: {'n_layers': 1, 'embedding_dim': 96, 'lr': 0.000635339209355413, 'lambda_val': 3.7160795265522337e-06, 'batch_size': 2200, 'optimizer': 'Adam'}. Best is trial 117 with value: 0.0974664928059682.
2026-05-16 01:25:09,764 - experiment_functions - INFO - Early stopping at epoch 500. Best Recall: 0.0018
2026-05-16 01:25:09,866 - optuna.study.study - INFO - Trial 138 finished with value: 0.0018321134222056771 and parameters: {'n_layers': 1, 'embedding_dim': 256, 'lr': 0.000562875609254273, 'lambda_val': 5.051065067563693e-06, 'batch_size': 2356, 'optimizer': 'SGD'}. Best is trial 117 with value: 0.0974664928059682.
2026-05-16 01:25:15,165 - experiment_functions - INFO - Early stopping at epoch 900. Best Recall: 0.0770
2026-05-16 01:25:15,256 - optuna.study.study - INFO - Trial 139 finished with value: 0.07700509800267787 and parameters: {'n_layers': 1, 'embedding_dim': 128, 'lr': 0.0013190727795443205, 'lambda_val': 2.7310942573967433e-06, 'batch_size': 2006, 'optimizer': 'Adam'}. Best is trial 117 with value: 0.0974664928059682.
2026-05-16 01:25:32,463 - experiment_functions - INFO - Early stopping at epoch 2750. Best Recall: 0.0925
2026-05-16 01:25:32,563 - optuna.study.study - INFO - Trial 140 finished with value: 0.09249187244595361 and parameters: {'n_layers': 1, 'embedding_dim': 256, 'lr': 0.0009288598529078369, 'lambda_val': 6.06267856755933e-06, 'batch_size': 1857, 'optimizer': 'Adam'}. Best is trial 117 with value: 0.0974664928059682.
2026-05-16 01:25:42,004 - experiment_functions - INFO - Early stopping at epoch 1450. Best Recall: 0.0844
2026-05-16 01:25:42,104 - optuna.study.study - INFO - Trial 141 finished with value: 0.0843979106320672 and parameters: {'n_layers': 1, 'embedding_dim': 256, 'lr': 0.0009305646887157024, 'lambda_val': 6.086879600274172e-06, 'batch_size': 1835, 'optimizer': 'Adam'}. Best is trial 117 with value: 0.0974664928059682.
2026-05-16 01:25:50,934 - experiment_functions - INFO - Early stopping at epoch 1350. Best Recall: 0.0927
