2026-05-16 00:24:36,496 - optuna.study.study - INFO - Trial 184 finished with value: 0.10956808317179544 and parameters: {'n_layers': 1, 'embedding_dim': 128, 'lr': 0.0013605116024440439, 'lambda_val': 0.00015382632950560523, 'batch_size': 616, 'optimizer': 'Adam'}. Best is trial 181 with value: 0.130958975742103.
2026-05-16 00:24:51,478 - experiment_functions - INFO - Early stopping at epoch 2800. Best Recall: 0.1195
2026-05-16 00:24:51,577 - optuna.study.study - INFO - Trial 185 finished with value: 0.11948524224409221 and parameters: {'n_layers': 1, 'embedding_dim': 128, 'lr': 0.0007403979910548601, 'lambda_val': 0.00011283448481612126, 'batch_size': 787, 'optimizer': 'Adam'}. Best is trial 181 with value: 0.130958975742103.
2026-05-16 00:24:58,681 - optuna.study._optimize - INFO - Trial 186 pruned. 
2026-05-16 00:25:15,466 - experiment_functions - INFO - Early stopping at epoch 3050. Best Recall: 0.1335
2026-05-16 00:25:15,569 - optuna.study.study - INFO - Trial 187 finished with value: 0.13353835701662617 and parameters: {'n_layers': 1, 'embedding_dim': 128, 'lr': 0.0006857207074322398, 'lambda_val': 8.118374975856412e-05, 'batch_size': 700, 'optimizer': 'Adam'}. Best is trial 187 with value: 0.13353835701662617.
2026-05-16 00:25:29,904 - experiment_functions - INFO - Early stopping at epoch 2600. Best Recall: 0.1190
2026-05-16 00:25:29,995 - optuna.study.study - INFO - Trial 188 finished with value: 0.11900539073593137 and parameters: {'n_layers': 1, 'embedding_dim': 128, 'lr': 0.0006586343221578226, 'lambda_val': 8.226872361046696e-05, 'batch_size': 706, 'optimizer': 'Adam'}. Best is trial 187 with value: 0.13353835701662617.
2026-05-16 00:25:36,888 - optuna.study._optimize - INFO - Trial 189 pruned. 
2026-05-16 00:25:42,972 - experiment_functions - INFO - Early stopping at epoch 1000. Best Recall: 0.1088
2026-05-16 00:25:43,073 - optuna.study.study - INFO - Trial 190 finished with value: 0.10881413571354503 and parameters: {'n_layers': 1, 'embedding_dim': 128, 'lr': 0.0010843657194383168, 'lambda_val': 6.825546686169628e-05, 'batch_size': 676, 'optimizer': 'Adam'}. Best is trial 187 with value: 0.13353835701662617.
2026-05-16 00:25:56,671 - experiment_functions - INFO - Early stopping at epoch 2300. Best Recall: 0.1204
2026-05-16 00:25:56,821 - optuna.study.study - INFO - Trial 191 finished with value: 0.12044147628576858 and parameters: {'n_layers': 1, 'embedding_dim': 128, 'lr': 0.0008244496280281367, 'lambda_val': 0.00013560399712107295, 'batch_size': 905, 'optimizer': 'Adam'}. Best is trial 187 with value: 0.13353835701662617.
2026-05-16 00:26:05,322 - experiment_functions - INFO - Early stopping at epoch 1550. Best Recall: 0.1262
2026-05-16 00:26:05,423 - optuna.study.study - INFO - Trial 192 finished with value: 0.12615283406165373 and parameters: {'n_layers': 1, 'embedding_dim': 128, 'lr': 0.0008406987611486597, 'lambda_val': 0.0001257223627538259, 'batch_size': 887, 'optimizer': 'Adam'}. Best is trial 187 with value: 0.13353835701662617.
2026-05-16 00:26:15,838 - experiment_functions - INFO - Early stopping at epoch 1800. Best Recall: 0.1148
2026-05-16 00:26:15,983 - optuna.study.study - INFO - Trial 193 finished with value: 0.1148031255258713 and parameters: {'n_layers': 1, 'embedding_dim': 128, 'lr': 0.0006629724435837976, 'lambda_val': 9.561738976035777e-05, 'batch_size': 912, 'optimizer': 'Adam'}. Best is trial 187 with value: 0.13353835701662617.
2026-05-16 00:26:24,992 - experiment_functions - INFO - Early stopping at epoch 1600. Best Recall: 0.1210
2026-05-16 00:26:25,094 - optuna.study.study - INFO - Trial 194 finished with value: 0.12095817402130554 and parameters: {'n_layers': 1, 'embedding_dim': 128, 'lr': 0.0008191990301174924, 'lambda_val': 0.00011487590136241664, 'batch_size': 880, 'optimizer': 'Adam'}. Best is trial 187 with value: 0.13353835701662617.
2026-05-16 00:26:37,400 - experiment_functions - INFO - Early stopping at epoch 2200. Best Recall: 0.1222
2026-05-16 00:26:37,490 - optuna.study.study - INFO - Trial 195 finished with value: 0.1221670323778239 and parameters: {'n_layers': 1, 'embedding_dim': 128, 'lr': 0.000839569589249285, 'lambda_val': 0.00011112064413595838, 'batch_size': 609, 'optimizer': 'Adam'}. Best is trial 187 with value: 0.13353835701662617.
2026-05-16 00:26:43,578 - optuna.study._optimize - INFO - Trial 196 pruned. 
2026-05-16 00:26:47,862 - experiment_functions - INFO - Early stopping at epoch 500. Best Recall: 0.0015
2026-05-16 00:26:47,952 - optuna.study.study - INFO - Trial 197 finished with value: 0.0015024391077025738 and parameters: {'n_layers': 1, 'embedding_dim': 128, 'lr': 0.0008592920714716401, 'lambda_val': 5.87620949081278e-05, 'batch_size': 573, 'optimizer': 'SGD'}. Best is trial 187 with value: 0.13353835701662617.
2026-05-16 00:26:54,593 - optuna.study._optimize - INFO - Trial 198 pruned. 
2026-05-16 00:26:59,652 - experiment_functions - INFO - Early stopping at epoch 850. Best Recall: 0.0176
2026-05-16 00:26:59,752 - optuna.study.study - INFO - Trial 199 finished with value: 0.017553491052157887 and parameters: {'n_layers': 1, 'embedding_dim': 96, 'lr': 0.09127579326781189, 'lambda_val': 7.422206419063798e-05, 'batch_size': 648, 'optimizer': 'Adam'}. Best is trial 187 with value: 0.13353835701662617.
2026-05-16 00:27:07,252 - optuna.study._optimize - INFO - Trial 200 pruned. 
2026-05-16 00:27:14,946 - optuna.study._optimize - INFO - Trial 201 pruned. 
2026-05-16 00:27:22,233 - optuna.study._optimize - INFO - Trial 202 pruned. 
2026-05-16 00:27:41,419 - experiment_functions - INFO - Early stopping at epoch 3300. Best Recall: 0.1230
2026-05-16 00:27:41,518 - optuna.study.study - INFO - Trial 203 finished with value: 0.12297713202099676 and parameters: {'n_layers': 1, 'embedding_dim': 128, 'lr': 0.0007859623896200204, 'lambda_val': 0.00014162284552325159, 'batch_size': 536, 'optimizer': 'Adam'}. Best is trial 187 with value: 0.13353835701662617.
2026-05-16 00:28:05,538 - experiment_functions - INFO - Early stopping at epoch 3500. Best Recall: 0.1283
2026-05-16 00:28:05,657 - optuna.study.study - INFO - Trial 204 finished with value: 0.12831461299536603 and parameters: {'n_layers': 1, 'embedding_dim': 128, 'lr': 0.0007747367035653181, 'lambda_val': 0.00014828868146444369, 'batch_size': 570, 'optimizer': 'Adam'}. Best is trial 187 with value: 0.13353835701662617.
2026-05-16 00:28:12,185 - optuna.study._optimize - INFO - Trial 205 pruned. 
2026-05-16 00:28:30,802 - experiment_functions - INFO - Early stopping at epoch 3050. Best Recall: 0.1221
2026-05-16 00:28:30,962 - optuna.study.study - INFO - Trial 206 finished with value: 0.12206052777416444 and parameters: {'n_layers': 1, 'embedding_dim': 128, 'lr': 0.0009139211776214339, 'lambda_val': 6.68405142270555e-05, 'batch_size': 531, 'optimizer': 'Adam'}. Best is trial 187 with value: 0.13353835701662617.
2026-05-16 00:28:46,803 - experiment_functions - INFO - Early stopping at epoch 2050. Best Recall: 0.1250
2026-05-16 00:28:46,974 - optuna.study.study - INFO - Trial 207 finished with value: 0.12498458399236465 and parameters: {'n_layers': 1, 'embedding_dim': 128, 'lr': 0.0009787638314550315, 'lambda_val': 4.5581585502353635e-05, 'batch_size': 561, 'optimizer': 'Adam'}. Best is trial 187 with value: 0.13353835701662617.
2026-05-16 00:28:54,415 - optuna.study._optimize - INFO - Trial 208 pruned. 
2026-05-16 00:29:00,283 - experiment_functions - INFO - Early stopping at epoch 900. Best Recall: 0.1068
2026-05-16 00:29:00,363 - optuna.study.study - INFO - Trial 209 finished with value: 0.10677629766998412 and parameters: {'n_layers': 1, 'embedding_dim': 128, 'lr': 0.0015876541080415113, 'lambda_val': 5.2461283180486315e-05, 'batch_size': 515, 'optimizer': 'Adam'}. Best is trial 187 with value: 0.13353835701662617.
2026-05-16 00:29:03,687 - experiment_functions - INFO - Early stopping at epoch 500. Best Recall: 0.0035
2026-05-16 00:29:03,788 - optuna.study.study - INFO - Trial 210 finished with value: 0.003479899277807238 and parameters: {'n_layers': 1, 'embedding_dim': 128, 'lr': 1.8726238724181946e-05, 'lambda_val': 2.407170638970073e-05, 'batch_size': 639, 'optimizer': 'Adam'}. Best is trial 187 with value: 0.13353835701662617.
2026-05-16 00:29:10,858 - optuna.study._optimize - INFO - Trial 211 pruned. 
2026-05-16 00:29:25,248 - experiment_functions - INFO - Early stopping at epoch 2600. Best Recall: 0.1253
2026-05-16 00:29:25,350 - optuna.study.study - INFO - Trial 212 finished with value: 0.12530669705655736 and parameters: {'n_layers': 1, 'embedding_dim': 128, 'lr': 0.0007344749002737236, 'lambda_val': 0.00010547571818560265, 'batch_size': 696, 'optimizer': 'Adam'}. Best is trial 187 with value: 0.13353835701662617.
2026-05-16 00:29:32,045 - optuna.study._optimize - INFO - Trial 213 pruned. 
2026-05-16 00:29:42,361 - optuna.study._optimize - INFO - Trial 214 pruned. 
2026-05-16 00:29:51,774 - experiment_functions - INFO - Early stopping at epoch 1600. Best Recall: 0.1221
2026-05-16 00:29:51,853 - optuna.study.study - INFO - Trial 215 finished with value: 0.1221340052691381 and parameters: {'n_layers': 1, 'embedding_dim': 128, 'lr': 0.000983890083418717, 'lambda_val': 7.205487148214091e-05, 'batch_size': 689, 'optimizer': 'Adam'}. Best is trial 187 with value: 0.13353835701662617.
2026-05-16 00:30:00,424 - optuna.study._optimize - INFO - Trial 216 pruned. 
2026-05-16 00:30:10,537 - experiment_functions - INFO - Early stopping at epoch 1800. Best Recall: 0.1154
2026-05-16 00:30:10,645 - optuna.study.study - INFO - Trial 217 finished with value: 0.1154250381265979 and parameters: {'n_layers': 1, 'embedding_dim': 128, 'lr': 0.0012091344321542847, 'lambda_val': 6.652908661697341e-05, 'batch_size': 658, 'optimizer': 'Adam'}. Best is trial 187 with value: 0.13353835701662617.
2026-05-16 00:30:17,841 - experiment_functions - INFO - Early stopping at epoch 1150. Best Recall: 0.1116
2026-05-16 00:30:17,931 - optuna.study.study - INFO - Trial 218 finished with value: 0.11155142276554547 and parameters: {'n_layers': 1, 'embedding_dim': 128, 'lr': 0.0009332675861470235, 'lambda_val': 7.690814734890393e-05, 'batch_size': 583, 'optimizer': 'Adam'}. Best is trial 187 with value: 0.13353835701662617.
2026-05-16 00:30:38,337 - experiment_functions - INFO - Early stopping at epoch 3650. Best Recall: 0.1273
2026-05-16 00:30:38,437 - optuna.study.study - INFO - Trial 219 finished with value: 0.12732772716408358 and parameters: {'n_layers': 1, 'embedding_dim': 128, 'lr': 0.0007745725010978829, 'lambda_val': 1.3815583685011854e-05, 'batch_size': 666, 'optimizer': 'Adam'}. Best is trial 187 with value: 0.13353835701662617.
2026-05-16 00:30:51,473 - experiment_functions - INFO - Early stopping at epoch 2350. Best Recall: 0.1208
2026-05-16 00:30:51,552 - optuna.study.study - INFO - Trial 220 finished with value: 0.12083265650927016 and parameters: {'n_layers': 1, 'embedding_dim': 128, 'lr': 0.0007896823518963212, 'lambda_val': 1.0631417369867986e-05, 'batch_size': 685, 'optimizer': 'Adam'}. Best is trial 187 with value: 0.13353835701662617.
2026-05-16 00:30:59,801 - optuna.study._optimize - INFO - Trial 221 pruned. 
2026-05-16 00:31:11,454 - optuna.study._optimize - INFO - Trial 222 pruned. 
2026-05-16 00:31:18,439 - optuna.study._optimize - INFO - Trial 223 pruned. 
2026-05-16 00:31:36,143 - experiment_functions - INFO - Early stopping at epoch 3150. Best Recall: 0.1306
2026-05-16 00:31:36,242 - optuna.study.study - INFO - Trial 224 finished with value: 0.13062015030681454 and parameters: {'n_layers': 1, 'embedding_dim': 128, 'lr': 0.0008916573852717539, 'lambda_val': 1.0250833464831943e-05, 'batch_size': 589, 'optimizer': 'Adam'}. Best is trial 187 with value: 0.13353835701662617.
2026-05-16 00:31:43,452 - optuna.study._optimize - INFO - Trial 225 pruned. 
2026-05-16 00:31:50,149 - optuna.study._optimize - INFO - Trial 226 pruned. 
2026-05-16 00:31:58,395 - experiment_functions - INFO - Early stopping at epoch 1350. Best Recall: 0.1150
2026-05-16 00:31:58,493 - optuna.study.study - INFO - Trial 227 finished with value: 0.11501323645861122 and parameters: {'n_layers': 1, 'embedding_dim': 256, 'lr': 0.0009392964199119944, 'lambda_val': 1.4908480220995814e-05, 'batch_size': 521, 'optimizer': 'Adam'}. Best is trial 187 with value: 0.13353835701662617.
2026-05-16 00:32:09,719 - experiment_functions - INFO - Early stopping at epoch 1950. Best Recall: 0.1166
2026-05-16 00:32:09,810 - optuna.study.study - INFO - Trial 228 finished with value: 0.11659073079127283 and parameters: {'n_layers': 1, 'embedding_dim': 128, 'lr': 0.0010486567166827843, 'lambda_val': 8.811251411585021e-06, 'batch_size': 736, 'optimizer': 'Adam'}. Best is trial 187 with value: 0.13353835701662617.
2026-05-16 00:32:16,703 - experiment_functions - INFO - Early stopping at epoch 1200. Best Recall: 0.1110
2026-05-16 00:32:16,793 - optuna.study.study - INFO - Trial 229 finished with value: 0.11103366586997955 and parameters: {'n_layers': 1, 'embedding_dim': 128, 'lr': 0.0012622389903263803, 'lambda_val': 1.1140853749137958e-05, 'batch_size': 621, 'optimizer': 'Adam'}. Best is trial 187 with value: 0.13353835701662617.
2026-05-16 00:32:22,954 - optuna.study._optimize - INFO - Trial 230 pruned. 
2026-05-16 00:32:33,039 - optuna.study._optimize - INFO - Trial 231 pruned. 
2026-05-16 00:32:39,542 - optuna.study._optimize - INFO - Trial 232 pruned. 
2026-05-16 00:32:45,593 - optuna.study._optimize - INFO - Trial 233 pruned. 
2026-05-16 00:32:52,425 - optuna.study._optimize - INFO - Trial 234 pruned. 
2026-05-16 00:32:59,340 - optuna.study._optimize - INFO - Trial 235 pruned. 
2026-05-16 00:33:07,018 - experiment_functions - INFO - Early stopping at epoch 500. Best Recall: 0.0014
2026-05-16 00:33:07,109 - optuna.study.study - INFO - Trial 236 finished with value: 0.0014397775644131076 and parameters: {'n_layers': 1, 'embedding_dim': 128, 'lr': 0.0007133094289363907, 'lambda_val': 2.038994733966079e-05, 'batch_size': 593, 'optimizer': 'SGD'}. Best is trial 187 with value: 0.13353835701662617.
2026-05-16 00:33:13,802 - optuna.study._optimize - INFO - Trial 237 pruned. 
2026-05-16 00:33:19,919 - optuna.study._optimize - INFO - Trial 238 pruned. 
2026-05-16 00:33:26,666 - optuna.study._optimize - INFO - Trial 239 pruned. 
2026-05-16 00:33:33,779 - optuna.study._optimize - INFO - Trial 240 pruned. 
2026-05-16 00:33:42,547 - optuna.study._optimize - INFO - Trial 241 pruned. 
2026-05-16 00:33:48,646 - optuna.study._optimize - INFO - Trial 242 pruned. 
2026-05-16 00:34:04,661 - optuna.study._optimize - INFO - Trial 243 pruned. 
2026-05-16 00:34:29,867 - optuna.study._optimize - INFO - Trial 244 pruned. 
2026-05-16 00:34:41,694 - experiment_functions - INFO - Early stopping at epoch 1050. Best Recall: 0.1111
2026-05-16 00:34:41,791 - optuna.study.study - INFO - Trial 245 finished with value: 0.1110538164595969 and parameters: {'n_layers': 1, 'embedding_dim': 128, 'lr': 0.0009111210023444818, 'lambda_val': 6.376505538866204e-05, 'batch_size': 740, 'optimizer': 'Adam'}. Best is trial 187 with value: 0.13353835701662617.
2026-05-16 00:35:15,348 - optuna.study._optimize - INFO - Trial 246 pruned. 
2026-05-16 00:35:33,006 - optuna.study._optimize - INFO - Trial 247 pruned. 
2026-05-16 00:35:41,009 - optuna.study._optimize - INFO - Trial 248 pruned. 
2026-05-16 00:35:45,615 - experiment_functions - INFO - Early stopping at epoch 750. Best Recall: 0.1112
2026-05-16 00:35:45,706 - optuna.study.study - INFO - Trial 249 finished with value: 0.11122559254003156 and parameters: {'n_layers': 1, 'embedding_dim': 128, 'lr': 0.0009577037645461903, 'lambda_val': 9.730454601287604e-05, 'batch_size': 581, 'optimizer': 'RMSprop'}. Best is trial 187 with value: 0.13353835701662617.
2026-05-16 00:35:53,126 - optuna.study._optimize - INFO - Trial 250 pruned. 
2026-05-16 00:35:59,228 - optuna.study._optimize - INFO - Trial 251 pruned. 
2026-05-16 00:36:21,323 - experiment_functions - INFO - Early stopping at epoch 3950. Best Recall: 0.1295
2026-05-16 00:36:21,404 - optuna.study.study - INFO - Trial 252 finished with value: 0.12945711039071878 and parameters: {'n_layers': 1, 'embedding_dim': 128, 'lr': 0.0006695803524142679, 'lambda_val': 4.604520273312124e-05, 'batch_size': 768, 'optimizer': 'Adam'}. Best is trial 187 with value: 0.13353835701662617.
2026-05-16 00:36:28,002 - optuna.study._optimize - INFO - Trial 253 pruned. 
2026-05-16 00:36:34,430 - optuna.study._optimize - INFO - Trial 254 pruned. 
2026-05-16 00:36:51,122 - experiment_functions - INFO - Early stopping at epoch 2200. Best Recall: 0.1221
2026-05-16 00:36:51,891 - optuna.study.study - INFO - Trial 255 finished with value: 0.12207296588553175 and parameters: {'n_layers': 1, 'embedding_dim': 128, 'lr': 0.0006820158817304971, 'lambda_val': 5.5890233205601174e-05, 'batch_size': 849, 'optimizer': 'Adam'}. Best is trial 187 with value: 0.13353835701662617.
2026-05-16 00:37:01,590 - optuna.study._optimize - INFO - Trial 256 pruned. 
2026-05-16 00:37:09,906 - experiment_functions - INFO - Early stopping at epoch 1050. Best Recall: 0.1062
2026-05-16 00:37:10,005 - optuna.study.study - INFO - Trial 257 finished with value: 0.1061636806434051 and parameters: {'n_layers': 1, 'embedding_dim': 128, 'lr': 0.0012378824622617812, 'lambda_val': 4.55543305581216e-05, 'batch_size': 856, 'optimizer': 'Adam'}. Best is trial 187 with value: 0.13353835701662617.
2026-05-16 00:37:16,175 - optuna.study._optimize - INFO - Trial 258 pruned. 
2026-05-16 00:37:22,367 - optuna.study._optimize - INFO - Trial 259 pruned. 
2026-05-16 00:37:34,185 - experiment_functions - INFO - Early stopping at epoch 2000. Best Recall: 0.1204
2026-05-16 00:37:34,321 - optuna.study.study - INFO - Trial 260 finished with value: 0.12042131559574215 and parameters: {'n_layers': 1, 'embedding_dim': 256, 'lr': 0.0006897389934050192, 'lambda_val': 6.403837400630776e-05, 'batch_size': 640, 'optimizer': 'Adam'}. Best is trial 187 with value: 0.13353835701662617.
2026-05-16 00:37:39,684 - experiment_functions - INFO - Early stopping at epoch 700. Best Recall: 0.0373
2026-05-16 00:37:39,783 - optuna.study.study - INFO - Trial 261 finished with value: 0.037283554195831854 and parameters: {'n_layers': 4, 'embedding_dim': 128, 'lr': 0.0008302735411262478, 'lambda_val': 7.84519134138563e-05, 'batch_size': 899, 'optimizer': 'Adam'}. Best is trial 187 with value: 0.13353835701662617.
2026-05-16 00:37:46,111 - optuna.study._optimize - INFO - Trial 262 pruned. 
2026-05-16 00:37:52,395 - experiment_functions - INFO - Early stopping at epoch 500. Best Recall: 0.0007
2026-05-16 00:37:53,154 - optuna.study.study - INFO - Trial 263 finished with value: 0.0007493297553813228 and parameters: {'n_layers': 1, 'embedding_dim': 128, 'lr': 0.001127675809346434, 'lambda_val': 2.535403096006991e-05, 'batch_size': 690, 'optimizer': 'SGD'}. Best is trial 187 with value: 0.13353835701662617.
2026-05-16 00:38:05,716 - optuna.study._optimize - INFO - Trial 264 pruned. 
2026-05-16 00:38:12,011 - optuna.study._optimize - INFO - Trial 265 pruned. 
2026-05-16 00:38:21,528 - experiment_functions - INFO - Early stopping at epoch 1750. Best Recall: 0.1214
2026-05-16 00:38:21,618 - optuna.study.study - INFO - Trial 266 finished with value: 0.1214112664267893 and parameters: {'n_layers': 1, 'embedding_dim': 128, 'lr': 0.0006684135732914861, 'lambda_val': 2.007236305747875e-05, 'batch_size': 713, 'optimizer': 'Adam'}. Best is trial 187 with value: 0.13353835701662617.
2026-05-16 00:38:27,901 - optuna.study._optimize - INFO - Trial 267 pruned. 
2026-05-16 00:38:36,039 - optuna.study._optimize - INFO - Trial 268 pruned. 
2026-05-16 00:38:57,990 - optuna.study._optimize - INFO - Trial 269 pruned. 
2026-05-16 00:39:13,646 - optuna.study._optimize - INFO - Trial 270 pruned. 
2026-05-16 00:39:21,054 - optuna.study._optimize - INFO - Trial 271 pruned. 
2026-05-16 00:39:30,948 - experiment_functions - INFO - Early stopping at epoch 1650. Best Recall: 0.1168
2026-05-16 00:39:31,044 - optuna.study.study - INFO - Trial 272 finished with value: 0.1167690098173289 and parameters: {'n_layers': 1, 'embedding_dim': 128, 'lr': 0.0010480585745698441, 'lambda_val': 9.805471328446485e-05, 'batch_size': 910, 'optimizer': 'Adam'}. Best is trial 187 with value: 0.13353835701662617.
2026-05-16 00:39:41,587 - optuna.study._optimize - INFO - Trial 273 pruned. 
2026-05-16 00:39:47,965 - optuna.study._optimize - INFO - Trial 274 pruned. 
2026-05-16 00:39:51,611 - experiment_functions - INFO - Early stopping at epoch 550. Best Recall: 0.0308
2026-05-16 00:39:51,721 - optuna.study.study - INFO - Trial 275 finished with value: 0.030809461484866733 and parameters: {'n_layers': 1, 'embedding_dim': 128, 'lr': 0.03730580026694438, 'lambda_val': 7.134831244934248e-05, 'batch_size': 779, 'optimizer': 'Adam'}. Best is trial 187 with value: 0.13353835701662617.
2026-05-16 00:40:12,051 - experiment_functions - INFO - Early stopping at epoch 3100. Best Recall: 0.1344
2026-05-16 00:40:12,135 - optuna.study.study - INFO - Trial 276 finished with value: 0.1344438146287192 and parameters: {'n_layers': 1, 'embedding_dim': 128, 'lr': 0.0006716325894771549, 'lambda_val': 0.000107234036297724, 'batch_size': 606, 'optimizer': 'Adam'}. Best is trial 276 with value: 0.1344438146287192.
2026-05-16 00:40:18,162 - optuna.study._optimize - INFO - Trial 277 pruned. 
2026-05-16 00:40:24,595 - optuna.study._optimize - INFO - Trial 278 pruned. 
2026-05-16 00:40:30,393 - optuna.study._optimize - INFO - Trial 279 pruned. 
2026-05-16 00:40:38,235 - optuna.study._optimize - INFO - Trial 280 pruned. 
2026-05-16 00:40:44,522 - optuna.study._optimize - INFO - Trial 281 pruned. 
2026-05-16 00:40:50,719 - optuna.study._optimize - INFO - Trial 282 pruned. 
2026-05-16 00:40:57,114 - optuna.study._optimize - INFO - Trial 283 pruned. 
2026-05-16 00:41:06,041 - optuna.study._optimize - INFO - Trial 284 pruned. 
2026-05-16 00:41:12,226 - optuna.study._optimize - INFO - Trial 285 pruned. 
