2026-05-16 05:37:43,779 - optuna.study.study - INFO - Trial 154 finished with value: 0.036673346296488 and parameters: {'n_layers': 1, 'embedding_dim': 96, 'lr': 0.0003000929052773737, 'lambda_val': 3.333971764292847e-06, 'batch_size': 816, 'optimizer': 'RMSprop'}. Best is trial 135 with value: 0.03726094533609576.
2026-05-16 05:37:53,539 - experiment_functions - INFO - Early stopping at epoch 1800. Best Recall: 0.0334
2026-05-16 05:37:53,650 - optuna.study.study - INFO - Trial 155 finished with value: 0.033432535235475014 and parameters: {'n_layers': 1, 'embedding_dim': 96, 'lr': 0.00030777398755452916, 'lambda_val': 3.1269414813952612e-06, 'batch_size': 817, 'optimizer': 'RMSprop'}. Best is trial 135 with value: 0.03726094533609576.
2026-05-16 05:38:05,794 - experiment_functions - INFO - Early stopping at epoch 2150. Best Recall: 0.0320
2026-05-16 05:38:05,940 - optuna.study.study - INFO - Trial 156 finished with value: 0.03196132733081111 and parameters: {'n_layers': 1, 'embedding_dim': 96, 'lr': 0.00030643228395461046, 'lambda_val': 3.3620029932887712e-06, 'batch_size': 823, 'optimizer': 'RMSprop'}. Best is trial 135 with value: 0.03726094533609576.
2026-05-16 05:38:22,308 - optuna.study._optimize - INFO - Trial 157 pruned. 
2026-05-16 05:38:41,724 - optuna.study._optimize - INFO - Trial 158 pruned. 
2026-05-16 05:38:53,893 - experiment_functions - INFO - Early stopping at epoch 2350. Best Recall: 0.0318
2026-05-16 05:38:53,994 - optuna.study.study - INFO - Trial 159 finished with value: 0.031819743254447086 and parameters: {'n_layers': 1, 'embedding_dim': 96, 'lr': 0.00029797651393191713, 'lambda_val': 4.253845844804352e-06, 'batch_size': 808, 'optimizer': 'RMSprop'}. Best is trial 135 with value: 0.03726094533609576.
2026-05-16 05:39:03,573 - experiment_functions - INFO - Early stopping at epoch 1700. Best Recall: 0.0326
2026-05-16 05:39:03,664 - optuna.study.study - INFO - Trial 160 finished with value: 0.03262245058891379 and parameters: {'n_layers': 1, 'embedding_dim': 96, 'lr': 0.0003060360763237129, 'lambda_val': 3.3334149389922655e-06, 'batch_size': 906, 'optimizer': 'RMSprop'}. Best is trial 135 with value: 0.03726094533609576.
2026-05-16 05:39:12,830 - experiment_functions - INFO - Early stopping at epoch 1700. Best Recall: 0.0368
2026-05-16 05:39:12,941 - optuna.study.study - INFO - Trial 161 finished with value: 0.03676815212841481 and parameters: {'n_layers': 1, 'embedding_dim': 96, 'lr': 0.0003450050224945283, 'lambda_val': 3.0854127456462956e-06, 'batch_size': 828, 'optimizer': 'RMSprop'}. Best is trial 135 with value: 0.03726094533609576.
2026-05-16 05:39:19,565 - optuna.study._optimize - INFO - Trial 162 pruned. 
2026-05-16 05:39:25,154 - optuna.study._optimize - INFO - Trial 163 pruned. 
2026-05-16 05:39:30,910 - optuna.study._optimize - INFO - Trial 164 pruned. 
2026-05-16 05:39:38,465 - optuna.study._optimize - INFO - Trial 165 pruned. 
2026-05-16 05:39:46,571 - optuna.study._optimize - INFO - Trial 166 pruned. 
2026-05-16 05:39:52,981 - optuna.study._optimize - INFO - Trial 167 pruned. 
2026-05-16 05:40:16,581 - experiment_functions - INFO - Early stopping at epoch 3500. Best Recall: 0.0368
2026-05-16 05:40:16,680 - optuna.study.study - INFO - Trial 168 finished with value: 0.03676908808374935 and parameters: {'n_layers': 1, 'embedding_dim': 96, 'lr': 0.0002378378138577656, 'lambda_val': 6.893750261123155e-06, 'batch_size': 748, 'optimizer': 'RMSprop'}. Best is trial 135 with value: 0.03726094533609576.
2026-05-16 05:40:20,649 - experiment_functions - INFO - Early stopping at epoch 500. Best Recall: 0.0025
2026-05-16 05:40:20,793 - optuna.study.study - INFO - Trial 169 finished with value: 0.0025466455938747356 and parameters: {'n_layers': 1, 'embedding_dim': 32, 'lr': 0.00020500780615504953, 'lambda_val': 6.214102083075499e-06, 'batch_size': 3338, 'optimizer': 'SGD'}. Best is trial 135 with value: 0.03726094533609576.
2026-05-16 05:40:26,204 - optuna.study._optimize - INFO - Trial 170 pruned. 
2026-05-16 05:40:35,118 - experiment_functions - INFO - Early stopping at epoch 1700. Best Recall: 0.0359
2026-05-16 05:40:35,215 - optuna.study.study - INFO - Trial 171 finished with value: 0.035938926731845185 and parameters: {'n_layers': 1, 'embedding_dim': 96, 'lr': 0.0003175378112949455, 'lambda_val': 3.99047257457046e-06, 'batch_size': 754, 'optimizer': 'RMSprop'}. Best is trial 135 with value: 0.03726094533609576.
2026-05-16 05:40:43,825 - experiment_functions - INFO - Early stopping at epoch 1550. Best Recall: 0.0324
2026-05-16 05:40:43,914 - optuna.study.study - INFO - Trial 172 finished with value: 0.03243309160050269 and parameters: {'n_layers': 1, 'embedding_dim': 96, 'lr': 0.00035981428327067934, 'lambda_val': 4.69323858252988e-06, 'batch_size': 764, 'optimizer': 'RMSprop'}. Best is trial 135 with value: 0.03726094533609576.
2026-05-16 05:40:50,955 - optuna.study._optimize - INFO - Trial 173 pruned. 
2026-05-16 05:40:57,144 - optuna.study._optimize - INFO - Trial 174 pruned. 
2026-05-16 05:41:04,215 - optuna.study._optimize - INFO - Trial 175 pruned. 
2026-05-16 05:41:10,157 - optuna.study._optimize - INFO - Trial 176 pruned. 
2026-05-16 05:41:16,039 - optuna.study._optimize - INFO - Trial 177 pruned. 
2026-05-16 05:41:24,075 - experiment_functions - INFO - Early stopping at epoch 1350. Best Recall: 0.0328
2026-05-16 05:41:24,154 - optuna.study.study - INFO - Trial 178 finished with value: 0.032826842263250305 and parameters: {'n_layers': 1, 'embedding_dim': 96, 'lr': 0.00040198486381554126, 'lambda_val': 7.087327757868798e-06, 'batch_size': 883, 'optimizer': 'RMSprop'}. Best is trial 135 with value: 0.03726094533609576.
2026-05-16 05:41:29,886 - optuna.study._optimize - INFO - Trial 179 pruned. 
2026-05-16 05:41:40,609 - experiment_functions - INFO - Early stopping at epoch 1900. Best Recall: 0.0317
2026-05-16 05:41:40,708 - optuna.study.study - INFO - Trial 180 finished with value: 0.03168956251945932 and parameters: {'n_layers': 1, 'embedding_dim': 96, 'lr': 0.000409025015326009, 'lambda_val': 1.3075129349109554e-05, 'batch_size': 520, 'optimizer': 'RMSprop'}. Best is trial 135 with value: 0.03726094533609576.
2026-05-16 05:41:57,610 - experiment_functions - INFO - Early stopping at epoch 1250. Best Recall: 0.0330
2026-05-16 05:41:57,710 - optuna.study.study - INFO - Trial 181 finished with value: 0.032954412144872706 and parameters: {'n_layers': 1, 'embedding_dim': 96, 'lr': 0.00039905869851951945, 'lambda_val': 9.403352244849294e-06, 'batch_size': 517, 'optimizer': 'RMSprop'}. Best is trial 135 with value: 0.03726094533609576.
2026-05-16 05:42:03,445 - optuna.study._optimize - INFO - Trial 182 pruned. 
2026-05-16 05:42:19,095 - experiment_functions - INFO - Early stopping at epoch 2850. Best Recall: 0.0374
2026-05-16 05:42:19,198 - optuna.study.study - INFO - Trial 183 finished with value: 0.03741398210074335 and parameters: {'n_layers': 1, 'embedding_dim': 96, 'lr': 0.00023440679872628123, 'lambda_val': 7.417376344832896e-06, 'batch_size': 580, 'optimizer': 'RMSprop'}. Best is trial 183 with value: 0.03741398210074335.
2026-05-16 05:42:25,385 - optuna.study._optimize - INFO - Trial 184 pruned. 
2026-05-16 05:42:50,764 - optuna.study._optimize - INFO - Trial 185 pruned. 
2026-05-16 05:42:58,600 - experiment_functions - INFO - Early stopping at epoch 1500. Best Recall: 0.0368
2026-05-16 05:42:58,691 - optuna.study.study - INFO - Trial 186 finished with value: 0.03677634787234485 and parameters: {'n_layers': 1, 'embedding_dim': 96, 'lr': 0.0003490476381021915, 'lambda_val': 1.120240758846423e-05, 'batch_size': 660, 'optimizer': 'RMSprop'}. Best is trial 183 with value: 0.03741398210074335.
2026-05-16 05:43:05,046 - experiment_functions - INFO - Early stopping at epoch 1050. Best Recall: 0.0308
2026-05-16 05:43:05,147 - optuna.study.study - INFO - Trial 187 finished with value: 0.030778056572957933 and parameters: {'n_layers': 1, 'embedding_dim': 96, 'lr': 0.0005914423316339246, 'lambda_val': 1.0881426406068896e-05, 'batch_size': 635, 'optimizer': 'Adam'}. Best is trial 183 with value: 0.03741398210074335.
2026-05-16 05:43:11,020 - optuna.study._optimize - INFO - Trial 188 pruned. 
2026-05-16 05:43:18,289 - experiment_functions - INFO - Early stopping at epoch 1350. Best Recall: 0.0322
2026-05-16 05:43:18,399 - optuna.study.study - INFO - Trial 189 finished with value: 0.03220963745710926 and parameters: {'n_layers': 1, 'embedding_dim': 96, 'lr': 0.0003625684837546796, 'lambda_val': 0.0004255655034315375, 'batch_size': 691, 'optimizer': 'RMSprop'}. Best is trial 183 with value: 0.03741398210074335.
2026-05-16 05:43:26,850 - experiment_functions - INFO - Early stopping at epoch 900. Best Recall: 0.0295
2026-05-16 05:43:27,014 - optuna.study.study - INFO - Trial 190 finished with value: 0.029465847594397545 and parameters: {'n_layers': 1, 'embedding_dim': 256, 'lr': 0.00046928544170438363, 'lambda_val': 1.1443377879884878e-05, 'batch_size': 734, 'optimizer': 'RMSprop'}. Best is trial 183 with value: 0.03741398210074335.
2026-05-16 05:43:33,478 - optuna.study._optimize - INFO - Trial 191 pruned. 
2026-05-16 05:43:39,065 - optuna.study._optimize - INFO - Trial 192 pruned. 
2026-05-16 05:43:45,310 - optuna.study._optimize - INFO - Trial 193 pruned. 
2026-05-16 05:43:53,595 - experiment_functions - INFO - Early stopping at epoch 1250. Best Recall: 0.0319
2026-05-16 05:43:53,675 - optuna.study.study - INFO - Trial 194 finished with value: 0.03192919557000506 and parameters: {'n_layers': 1, 'embedding_dim': 96, 'lr': 0.00041726666224311713, 'lambda_val': 0.0008781700482080846, 'batch_size': 589, 'optimizer': 'RMSprop'}. Best is trial 183 with value: 0.03741398210074335.
2026-05-16 05:43:59,291 - experiment_functions - INFO - Early stopping at epoch 950. Best Recall: 0.0258
2026-05-16 05:43:59,391 - optuna.study.study - INFO - Trial 195 finished with value: 0.025806353264958226 and parameters: {'n_layers': 1, 'embedding_dim': 96, 'lr': 0.0005129521791862546, 'lambda_val': 0.0006885422597976947, 'batch_size': 882, 'optimizer': 'RMSprop'}. Best is trial 183 with value: 0.03741398210074335.
2026-05-16 05:44:04,890 - optuna.study._optimize - INFO - Trial 196 pruned. 
2026-05-16 05:44:10,611 - optuna.study._optimize - INFO - Trial 197 pruned. 
2026-05-16 05:44:23,528 - experiment_functions - INFO - Early stopping at epoch 2550. Best Recall: 0.0389
2026-05-16 05:44:23,621 - optuna.study.study - INFO - Trial 198 finished with value: 0.03886184033340142 and parameters: {'n_layers': 1, 'embedding_dim': 96, 'lr': 0.00027150175543069136, 'lambda_val': 6.821433691853726e-06, 'batch_size': 517, 'optimizer': 'RMSprop'}. Best is trial 198 with value: 0.03886184033340142.
2026-05-16 05:44:29,192 - optuna.study._optimize - INFO - Trial 199 pruned. 
2026-05-16 05:44:35,256 - optuna.study._optimize - INFO - Trial 200 pruned. 
2026-05-16 05:44:44,151 - experiment_functions - INFO - Early stopping at epoch 1500. Best Recall: 0.0318
2026-05-16 05:44:44,251 - optuna.study.study - INFO - Trial 201 finished with value: 0.03177001899534675 and parameters: {'n_layers': 1, 'embedding_dim': 96, 'lr': 0.00034293405501044377, 'lambda_val': 6.127754101102425e-06, 'batch_size': 517, 'optimizer': 'RMSprop'}. Best is trial 198 with value: 0.03886184033340142.
2026-05-16 05:44:50,189 - optuna.study._optimize - INFO - Trial 202 pruned. 
2026-05-16 05:45:00,787 - optuna.study._optimize - INFO - Trial 203 pruned. 
2026-05-16 05:45:07,614 - optuna.study._optimize - INFO - Trial 204 pruned. 
2026-05-16 05:45:13,703 - optuna.study._optimize - INFO - Trial 205 pruned. 
2026-05-16 05:45:23,214 - experiment_functions - INFO - Early stopping at epoch 1350. Best Recall: 0.0349
2026-05-16 05:45:23,332 - optuna.study.study - INFO - Trial 206 finished with value: 0.03488491781402267 and parameters: {'n_layers': 1, 'embedding_dim': 96, 'lr': 0.00033682301711333314, 'lambda_val': 6.364028336120979e-06, 'batch_size': 623, 'optimizer': 'RMSprop'}. Best is trial 198 with value: 0.03886184033340142.
2026-05-16 05:45:29,231 - optuna.study._optimize - INFO - Trial 207 pruned. 
2026-05-16 05:45:38,448 - experiment_functions - INFO - Early stopping at epoch 1050. Best Recall: 0.0304
2026-05-16 05:45:38,538 - optuna.study.study - INFO - Trial 208 finished with value: 0.030391937802320728 and parameters: {'n_layers': 1, 'embedding_dim': 96, 'lr': 0.0004819510329978533, 'lambda_val': 4.69340478829109e-06, 'batch_size': 962, 'optimizer': 'RMSprop'}. Best is trial 198 with value: 0.03886184033340142.
2026-05-16 05:45:42,085 - experiment_functions - INFO - Early stopping at epoch 500. Best Recall: 0.0011
2026-05-16 05:45:42,207 - optuna.study.study - INFO - Trial 209 finished with value: 0.0011120328006079328 and parameters: {'n_layers': 1, 'embedding_dim': 96, 'lr': 0.0006007219878053704, 'lambda_val': 6.8102778538663545e-06, 'batch_size': 2508, 'optimizer': 'SGD'}. Best is trial 198 with value: 0.03886184033340142.
2026-05-16 05:45:55,637 - optuna.study._optimize - INFO - Trial 210 pruned. 
2026-05-16 05:46:04,138 - experiment_functions - INFO - Early stopping at epoch 1750. Best Recall: 0.0354
2026-05-16 05:46:04,237 - optuna.study.study - INFO - Trial 211 finished with value: 0.03537168795642195 and parameters: {'n_layers': 1, 'embedding_dim': 96, 'lr': 0.00034413583657264457, 'lambda_val': 3.854982931552874e-06, 'batch_size': 704, 'optimizer': 'RMSprop'}. Best is trial 198 with value: 0.03886184033340142.
2026-05-16 05:46:13,743 - experiment_functions - INFO - Early stopping at epoch 2000. Best Recall: 0.0387
2026-05-16 05:46:13,843 - optuna.study.study - INFO - Trial 212 finished with value: 0.03865292550459696 and parameters: {'n_layers': 1, 'embedding_dim': 96, 'lr': 0.00032921389084548746, 'lambda_val': 3.580676010433096e-06, 'batch_size': 657, 'optimizer': 'RMSprop'}. Best is trial 198 with value: 0.03886184033340142.
2026-05-16 05:46:19,664 - optuna.study._optimize - INFO - Trial 213 pruned. 
2026-05-16 05:46:26,647 - experiment_functions - INFO - Early stopping at epoch 1250. Best Recall: 0.0336
2026-05-16 05:46:26,755 - optuna.study.study - INFO - Trial 214 finished with value: 0.03360564531851237 and parameters: {'n_layers': 1, 'embedding_dim': 96, 'lr': 0.0004345888469253099, 'lambda_val': 4.426730265550032e-06, 'batch_size': 734, 'optimizer': 'RMSprop'}. Best is trial 198 with value: 0.03886184033340142.
2026-05-16 05:46:33,911 - experiment_functions - INFO - Early stopping at epoch 1500. Best Recall: 0.0350
2026-05-16 05:46:34,001 - optuna.study.study - INFO - Trial 215 finished with value: 0.03504528974002078 and parameters: {'n_layers': 1, 'embedding_dim': 96, 'lr': 0.00043339705221922165, 'lambda_val': 3.485451069126629e-06, 'batch_size': 512, 'optimizer': 'RMSprop'}. Best is trial 198 with value: 0.03886184033340142.
2026-05-16 05:46:40,948 - experiment_functions - INFO - Early stopping at epoch 1350. Best Recall: 0.0322
2026-05-16 05:46:41,037 - optuna.study.study - INFO - Trial 216 finished with value: 0.03222199472266429 and parameters: {'n_layers': 1, 'embedding_dim': 96, 'lr': 0.0004484896439871301, 'lambda_val': 4.010611715572897e-06, 'batch_size': 514, 'optimizer': 'RMSprop'}. Best is trial 198 with value: 0.03886184033340142.
2026-05-16 05:46:46,518 - experiment_functions - INFO - Early stopping at epoch 1100. Best Recall: 0.0331
2026-05-16 05:46:46,641 - optuna.study.study - INFO - Trial 217 finished with value: 0.03306838685947192 and parameters: {'n_layers': 1, 'embedding_dim': 96, 'lr': 0.0005241040674716477, 'lambda_val': 2.8960359336750155e-06, 'batch_size': 600, 'optimizer': 'RMSprop'}. Best is trial 198 with value: 0.03886184033340142.
2026-05-16 05:46:52,296 - optuna.study._optimize - INFO - Trial 218 pruned. 
2026-05-16 05:46:58,153 - optuna.study._optimize - INFO - Trial 219 pruned. 
2026-05-16 05:47:03,996 - optuna.study._optimize - INFO - Trial 220 pruned. 
2026-05-16 05:47:12,716 - optuna.study._optimize - INFO - Trial 221 pruned. 
2026-05-16 05:47:23,167 - optuna.study._optimize - INFO - Trial 222 pruned. 
2026-05-16 05:47:28,951 - experiment_functions - INFO - Early stopping at epoch 950. Best Recall: 0.0271
2026-05-16 05:47:29,066 - optuna.study.study - INFO - Trial 223 finished with value: 0.027093783735781602 and parameters: {'n_layers': 1, 'embedding_dim': 96, 'lr': 0.0005368772288263953, 'lambda_val': 5.360939727359547e-06, 'batch_size': 700, 'optimizer': 'RMSprop'}. Best is trial 198 with value: 0.03886184033340142.
2026-05-16 05:47:37,556 - experiment_functions - INFO - Early stopping at epoch 1500. Best Recall: 0.0345
2026-05-16 05:47:37,671 - optuna.study.study - INFO - Trial 224 finished with value: 0.034549120236975206 and parameters: {'n_layers': 1, 'embedding_dim': 96, 'lr': 0.0003438304212366546, 'lambda_val': 2.3856378591602636e-06, 'batch_size': 518, 'optimizer': 'RMSprop'}. Best is trial 198 with value: 0.03886184033340142.
2026-05-16 05:47:48,477 - experiment_functions - INFO - Early stopping at epoch 2050. Best Recall: 0.0372
2026-05-16 05:47:48,637 - optuna.study.study - INFO - Trial 225 finished with value: 0.037216283141513894 and parameters: {'n_layers': 1, 'embedding_dim': 96, 'lr': 0.0003153224368555836, 'lambda_val': 2.3046426166811796e-06, 'batch_size': 516, 'optimizer': 'RMSprop'}. Best is trial 198 with value: 0.03886184033340142.
2026-05-16 05:47:55,166 - optuna.study._optimize - INFO - Trial 226 pruned. 
2026-05-16 05:48:01,411 - optuna.study._optimize - INFO - Trial 227 pruned. 
2026-05-16 05:48:07,024 - optuna.study._optimize - INFO - Trial 228 pruned. 
2026-05-16 05:48:14,952 - experiment_functions - INFO - Early stopping at epoch 1350. Best Recall: 0.0343
2026-05-16 05:48:15,056 - optuna.study.study - INFO - Trial 229 finished with value: 0.0343162145479857 and parameters: {'n_layers': 1, 'embedding_dim': 96, 'lr': 0.0003504439764552397, 'lambda_val': 2.328511070138543e-06, 'batch_size': 602, 'optimizer': 'RMSprop'}. Best is trial 198 with value: 0.03886184033340142.
2026-05-16 05:48:21,033 - optuna.study._optimize - INFO - Trial 230 pruned. 
2026-05-16 05:48:27,201 - optuna.study._optimize - INFO - Trial 231 pruned. 
2026-05-16 05:48:33,321 - optuna.study._optimize - INFO - Trial 232 pruned. 
2026-05-16 05:48:39,994 - optuna.study._optimize - INFO - Trial 233 pruned. 
2026-05-16 05:48:46,301 - optuna.study._optimize - INFO - Trial 234 pruned. 
2026-05-16 05:48:53,637 - optuna.study._optimize - INFO - Trial 235 pruned. 
2026-05-16 05:48:59,554 - optuna.study._optimize - INFO - Trial 236 pruned. 
2026-05-16 05:49:08,274 - optuna.study._optimize - INFO - Trial 237 pruned. 
2026-05-16 05:49:16,159 - experiment_functions - INFO - Early stopping at epoch 1400. Best Recall: 0.0332
2026-05-16 05:49:16,274 - optuna.study.study - INFO - Trial 238 finished with value: 0.03323034806307944 and parameters: {'n_layers': 1, 'embedding_dim': 96, 'lr': 0.00037267566775794154, 'lambda_val': 2.4105330480049586e-06, 'batch_size': 785, 'optimizer': 'RMSprop'}. Best is trial 198 with value: 0.03886184033340142.
2026-05-16 05:49:22,449 - optuna.study._optimize - INFO - Trial 239 pruned. 
2026-05-16 05:49:28,769 - optuna.study._optimize - INFO - Trial 240 pruned. 
2026-05-16 05:49:36,213 - experiment_functions - INFO - Early stopping at epoch 1350. Best Recall: 0.0347
2026-05-16 05:49:36,318 - optuna.study.study - INFO - Trial 241 finished with value: 0.03470227035477238 and parameters: {'n_layers': 1, 'embedding_dim': 96, 'lr': 0.0004018390314682386, 'lambda_val': 2.953893734574694e-06, 'batch_size': 512, 'optimizer': 'RMSprop'}. Best is trial 198 with value: 0.03886184033340142.
2026-05-16 05:49:43,398 - experiment_functions - INFO - Early stopping at epoch 1100. Best Recall: 0.0336
2026-05-16 05:49:43,513 - optuna.study.study - INFO - Trial 242 finished with value: 0.03362917184198667 and parameters: {'n_layers': 1, 'embedding_dim': 96, 'lr': 0.0004719988526348175, 'lambda_val': 3.055152140085461e-06, 'batch_size': 716, 'optimizer': 'RMSprop'}. Best is trial 198 with value: 0.03886184033340142.
2026-05-16 05:49:49,776 - optuna.study._optimize - INFO - Trial 243 pruned. 
2026-05-16 05:49:57,171 - experiment_functions - INFO - Early stopping at epoch 1400. Best Recall: 0.0322
2026-05-16 05:49:57,256 - optuna.study.study - INFO - Trial 244 finished with value: 0.03218692754719422 and parameters: {'n_layers': 1, 'embedding_dim': 96, 'lr': 0.00039042096327418675, 'lambda_val': 3.542594611992044e-06, 'batch_size': 706, 'optimizer': 'RMSprop'}. Best is trial 198 with value: 0.03886184033340142.
2026-05-16 05:50:03,231 - optuna.study._optimize - INFO - Trial 245 pruned. 
2026-05-16 05:50:09,275 - optuna.study._optimize - INFO - Trial 246 pruned. 
2026-05-16 05:50:15,698 - optuna.study._optimize - INFO - Trial 247 pruned. 
2026-05-16 05:50:24,754 - optuna.study._optimize - INFO - Trial 248 pruned. 
2026-05-16 05:50:30,433 - optuna.study._optimize - INFO - Trial 249 pruned. 
2026-05-16 05:50:33,680 - experiment_functions - INFO - Early stopping at epoch 500. Best Recall: 0.0026
2026-05-16 05:50:33,763 - optuna.study.study - INFO - Trial 250 finished with value: 0.002589186417676354 and parameters: {'n_layers': 1, 'embedding_dim': 96, 'lr': 0.0004445227358040957, 'lambda_val': 3.701988741788039e-06, 'batch_size': 666, 'optimizer': 'SGD'}. Best is trial 198 with value: 0.03886184033340142.
2026-05-16 05:50:40,129 - optuna.study._optimize - INFO - Trial 251 pruned. 
2026-05-16 05:50:46,159 - optuna.study._optimize - INFO - Trial 252 pruned. 
2026-05-16 05:50:50,460 - experiment_functions - INFO - Early stopping at epoch 700. Best Recall: 0.0054
2026-05-16 05:50:50,575 - optuna.study.study - INFO - Trial 253 finished with value: 0.005422237096136125 and parameters: {'n_layers': 1, 'embedding_dim': 96, 'lr': 0.0006136835918248562, 'lambda_val': 0.07595729592837944, 'batch_size': 589, 'optimizer': 'RMSprop'}. Best is trial 198 with value: 0.03886184033340142.
2026-05-16 05:50:56,670 - optuna.study._optimize - INFO - Trial 254 pruned. 
