2026-05-15 22:38:36,655 - optuna.study.study - INFO - Trial 55 finished with value: 0.12263116115631187 and parameters: {'n_layers': 1, 'embedding_dim': 256, 'lr': 0.00037489894362961344, 'lambda_val': 2.8102189292092355e-06, 'batch_size': 1829, 'optimizer': 'RMSprop'}. Best is trial 55 with value: 0.12263116115631187.
2026-05-15 22:38:42,594 - experiment_functions - INFO - Early stopping at epoch 750. Best Recall: 0.1043
2026-05-15 22:38:42,686 - optuna.study.study - INFO - Trial 56 finished with value: 0.10432592509724545 and parameters: {'n_layers': 1, 'embedding_dim': 256, 'lr': 0.0011457358244800792, 'lambda_val': 1.3690678780550484e-05, 'batch_size': 1881, 'optimizer': 'RMSprop'}. Best is trial 55 with value: 0.12263116115631187.
2026-05-15 22:38:54,725 - experiment_functions - INFO - Early stopping at epoch 2050. Best Recall: 0.1168
2026-05-15 22:38:54,837 - optuna.study.study - INFO - Trial 57 finished with value: 0.11679753127108002 and parameters: {'n_layers': 1, 'embedding_dim': 256, 'lr': 0.00040975381107885925, 'lambda_val': 2.938335201155607e-06, 'batch_size': 1701, 'optimizer': 'RMSprop'}. Best is trial 55 with value: 0.12263116115631187.
2026-05-15 22:38:59,633 - experiment_functions - INFO - Early stopping at epoch 500. Best Recall: 0.0031
2026-05-15 22:38:59,732 - optuna.study.study - INFO - Trial 58 finished with value: 0.003146848273835934 and parameters: {'n_layers': 2, 'embedding_dim': 256, 'lr': 5.847339937776876e-05, 'lambda_val': 3.078631727103132e-06, 'batch_size': 1691, 'optimizer': 'SGD'}. Best is trial 55 with value: 0.12263116115631187.
2026-05-15 22:39:18,789 - experiment_functions - INFO - Early stopping at epoch 1850. Best Recall: 0.1173
2026-05-15 22:39:18,880 - optuna.study.study - INFO - Trial 59 finished with value: 0.1172947351226662 and parameters: {'n_layers': 1, 'embedding_dim': 256, 'lr': 0.00038497105032437966, 'lambda_val': 2.6151750848999415e-05, 'batch_size': 1623, 'optimizer': 'RMSprop'}. Best is trial 55 with value: 0.12263116115631187.
2026-05-15 22:39:34,817 - experiment_functions - INFO - Early stopping at epoch 2600. Best Recall: 0.1134
2026-05-15 22:39:34,897 - optuna.study.study - INFO - Trial 60 finished with value: 0.1133815653945233 and parameters: {'n_layers': 1, 'embedding_dim': 256, 'lr': 0.00039991010118998723, 'lambda_val': 2.88619109705212e-05, 'batch_size': 2041, 'optimizer': 'Adam'}. Best is trial 55 with value: 0.12263116115631187.
2026-05-15 22:39:48,719 - experiment_functions - INFO - Early stopping at epoch 2250. Best Recall: 0.1260
2026-05-15 22:39:48,802 - optuna.study.study - INFO - Trial 61 finished with value: 0.12598870726276729 and parameters: {'n_layers': 1, 'embedding_dim': 256, 'lr': 0.00040280462761482533, 'lambda_val': 8.997818352490926e-06, 'batch_size': 2027, 'optimizer': 'Adam'}. Best is trial 61 with value: 0.12598870726276729.
2026-05-15 22:40:03,744 - optuna.study._optimize - INFO - Trial 62 pruned. 
2026-05-15 22:40:20,549 - experiment_functions - INFO - Early stopping at epoch 2650. Best Recall: 0.1149
2026-05-15 22:40:20,649 - optuna.study.study - INFO - Trial 63 finished with value: 0.11490674318882732 and parameters: {'n_layers': 1, 'embedding_dim': 256, 'lr': 0.0003717922844387229, 'lambda_val': 2.604511311244148e-05, 'batch_size': 1783, 'optimizer': 'Adam'}. Best is trial 61 with value: 0.12598870726276729.
2026-05-15 22:40:29,309 - optuna.study._optimize - INFO - Trial 64 pruned. 
2026-05-15 22:40:35,461 - optuna.study._optimize - INFO - Trial 65 pruned. 
2026-05-15 22:40:41,955 - optuna.study._optimize - INFO - Trial 66 pruned. 
2026-05-15 22:40:49,247 - optuna.study._optimize - INFO - Trial 67 pruned. 
2026-05-15 22:40:56,383 - experiment_functions - INFO - Early stopping at epoch 1000. Best Recall: 0.1148
2026-05-15 22:40:56,489 - optuna.study.study - INFO - Trial 68 finished with value: 0.11475167089942313 and parameters: {'n_layers': 1, 'embedding_dim': 256, 'lr': 0.0007775185507230665, 'lambda_val': 9.642811726631453e-06, 'batch_size': 2196, 'optimizer': 'Adam'}. Best is trial 61 with value: 0.12598870726276729.
2026-05-15 22:41:06,161 - experiment_functions - INFO - Early stopping at epoch 1500. Best Recall: 0.1199
2026-05-15 22:41:06,296 - optuna.study.study - INFO - Trial 69 finished with value: 0.11988565589614412 and parameters: {'n_layers': 1, 'embedding_dim': 256, 'lr': 0.0007230988709257003, 'lambda_val': 1.0031934210997597e-05, 'batch_size': 1471, 'optimizer': 'Adam'}. Best is trial 61 with value: 0.12598870726276729.
2026-05-15 22:41:14,458 - experiment_functions - INFO - Early stopping at epoch 800. Best Recall: 0.0619
2026-05-15 22:41:14,558 - optuna.study.study - INFO - Trial 70 finished with value: 0.06187832139567532 and parameters: {'n_layers': 3, 'embedding_dim': 256, 'lr': 0.0009710723160393339, 'lambda_val': 0.00019858795418700682, 'batch_size': 1438, 'optimizer': 'Adam'}. Best is trial 61 with value: 0.12598870726276729.
2026-05-15 22:41:22,375 - experiment_functions - INFO - Early stopping at epoch 1100. Best Recall: 0.1116
2026-05-15 22:41:22,455 - optuna.study.study - INFO - Trial 71 finished with value: 0.11163470611022906 and parameters: {'n_layers': 1, 'embedding_dim': 256, 'lr': 0.0007083605285559204, 'lambda_val': 8.31775252901854e-06, 'batch_size': 2249, 'optimizer': 'Adam'}. Best is trial 61 with value: 0.12598870726276729.
2026-05-15 22:41:28,775 - optuna.study._optimize - INFO - Trial 72 pruned. 
2026-05-15 22:41:34,533 - experiment_functions - INFO - Early stopping at epoch 800. Best Recall: 0.1120
2026-05-15 22:41:34,634 - optuna.study.study - INFO - Trial 73 finished with value: 0.11203680858090605 and parameters: {'n_layers': 1, 'embedding_dim': 256, 'lr': 0.0015408330035329876, 'lambda_val': 1.829246588571035e-05, 'batch_size': 2227, 'optimizer': 'Adam'}. Best is trial 61 with value: 0.12598870726276729.
2026-05-15 22:41:40,286 - experiment_functions - INFO - Early stopping at epoch 600. Best Recall: 0.0321
2026-05-15 22:41:40,377 - optuna.study.study - INFO - Trial 74 finished with value: 0.032083712962415224 and parameters: {'n_layers': 4, 'embedding_dim': 256, 'lr': 0.0009675919933158298, 'lambda_val': 6.0156195479846355e-06, 'batch_size': 1904, 'optimizer': 'Adam'}. Best is trial 61 with value: 0.12598870726276729.
2026-05-15 22:41:52,117 - experiment_functions - INFO - Early stopping at epoch 1950. Best Recall: 0.1192
2026-05-15 22:41:52,284 - optuna.study.study - INFO - Trial 75 finished with value: 0.11916669548003284 and parameters: {'n_layers': 1, 'embedding_dim': 256, 'lr': 0.00048643584751240494, 'lambda_val': 8.279106121168271e-06, 'batch_size': 1611, 'optimizer': 'Adam'}. Best is trial 61 with value: 0.12598870726276729.
2026-05-15 22:42:04,060 - experiment_functions - INFO - Early stopping at epoch 1650. Best Recall: 0.1239
2026-05-15 22:42:04,161 - optuna.study.study - INFO - Trial 76 finished with value: 0.12388513044863411 and parameters: {'n_layers': 1, 'embedding_dim': 256, 'lr': 0.0005634776784794457, 'lambda_val': 5.445539371478892e-06, 'batch_size': 1755, 'optimizer': 'Adam'}. Best is trial 61 with value: 0.12598870726276729.
2026-05-15 22:42:16,576 - experiment_functions - INFO - Early stopping at epoch 1950. Best Recall: 0.1179
2026-05-15 22:42:16,666 - optuna.study.study - INFO - Trial 77 finished with value: 0.11789847768966559 and parameters: {'n_layers': 1, 'embedding_dim': 256, 'lr': 0.0005668703843382659, 'lambda_val': 7.484176959939079e-06, 'batch_size': 1577, 'optimizer': 'Adam'}. Best is trial 61 with value: 0.12598870726276729.
2026-05-15 22:42:26,449 - experiment_functions - INFO - Early stopping at epoch 1650. Best Recall: 0.1143
2026-05-15 22:42:26,539 - optuna.study.study - INFO - Trial 78 finished with value: 0.11433949548402357 and parameters: {'n_layers': 1, 'embedding_dim': 256, 'lr': 0.0005050936863487678, 'lambda_val': 6.22457946133469e-06, 'batch_size': 1621, 'optimizer': 'Adam'}. Best is trial 61 with value: 0.12598870726276729.
2026-05-15 22:42:34,471 - optuna.study._optimize - INFO - Trial 79 pruned. 
2026-05-15 22:42:39,395 - experiment_functions - INFO - Early stopping at epoch 750. Best Recall: 0.0952
2026-05-15 22:42:39,485 - optuna.study.study - INFO - Trial 80 finished with value: 0.09520602529167815 and parameters: {'n_layers': 1, 'embedding_dim': 256, 'lr': 0.002001771802036646, 'lambda_val': 4.077426817248504e-05, 'batch_size': 1582, 'optimizer': 'Adam'}. Best is trial 61 with value: 0.12598870726276729.
2026-05-15 22:42:50,049 - experiment_functions - INFO - Early stopping at epoch 1650. Best Recall: 0.1132
2026-05-15 22:42:50,151 - optuna.study.study - INFO - Trial 81 finished with value: 0.11321277477896025 and parameters: {'n_layers': 1, 'embedding_dim': 256, 'lr': 0.000571306369442646, 'lambda_val': 6.955132425246687e-06, 'batch_size': 1687, 'optimizer': 'Adam'}. Best is trial 61 with value: 0.12598870726276729.
2026-05-15 22:42:53,602 - experiment_functions - INFO - Early stopping at epoch 500. Best Recall: 0.0022
2026-05-15 22:42:53,704 - optuna.study.study - INFO - Trial 82 finished with value: 0.002163654696104582 and parameters: {'n_layers': 1, 'embedding_dim': 256, 'lr': 0.0002935580613628344, 'lambda_val': 2.823632964974488e-06, 'batch_size': 1952, 'optimizer': 'SGD'}. Best is trial 61 with value: 0.12598870726276729.
2026-05-15 22:43:04,101 - experiment_functions - INFO - Early stopping at epoch 1700. Best Recall: 0.1223
2026-05-15 22:43:04,180 - optuna.study.study - INFO - Trial 83 finished with value: 0.12232928548341872 and parameters: {'n_layers': 1, 'embedding_dim': 256, 'lr': 0.0004630675060461967, 'lambda_val': 4.724989061243957e-06, 'batch_size': 1365, 'optimizer': 'Adam'}. Best is trial 61 with value: 0.12598870726276729.
2026-05-15 22:43:11,125 - experiment_functions - INFO - Early stopping at epoch 700. Best Recall: 0.0730
2026-05-15 22:43:11,226 - optuna.study.study - INFO - Trial 84 finished with value: 0.0730432712820998 and parameters: {'n_layers': 2, 'embedding_dim': 256, 'lr': 0.0011382989623260479, 'lambda_val': 5.095956181150125e-06, 'batch_size': 1396, 'optimizer': 'Adam'}. Best is trial 61 with value: 0.12598870726276729.
2026-05-15 22:43:22,093 - experiment_functions - INFO - Early stopping at epoch 1300. Best Recall: 0.1196
2026-05-15 22:43:22,192 - optuna.study.study - INFO - Trial 85 finished with value: 0.11955640534806573 and parameters: {'n_layers': 1, 'embedding_dim': 256, 'lr': 0.0006721521561408924, 'lambda_val': 1.501521265925248e-05, 'batch_size': 1262, 'optimizer': 'Adam'}. Best is trial 61 with value: 0.12598870726276729.
2026-05-15 22:43:32,326 - experiment_functions - INFO - Early stopping at epoch 1550. Best Recall: 0.1202
2026-05-15 22:43:32,418 - optuna.study.study - INFO - Trial 86 finished with value: 0.12016411687477063 and parameters: {'n_layers': 1, 'embedding_dim': 256, 'lr': 0.0006405145879275927, 'lambda_val': 1.5619353721267297e-05, 'batch_size': 1126, 'optimizer': 'Adam'}. Best is trial 61 with value: 0.12598870726276729.
2026-05-15 22:43:42,634 - experiment_functions - INFO - Early stopping at epoch 1650. Best Recall: 0.1191
2026-05-15 22:43:42,713 - optuna.study.study - INFO - Trial 87 finished with value: 0.11911097401225465 and parameters: {'n_layers': 1, 'embedding_dim': 256, 'lr': 0.0007054866512637568, 'lambda_val': 1.4252154003256596e-05, 'batch_size': 1058, 'optimizer': 'Adam'}. Best is trial 61 with value: 0.12598870726276729.
2026-05-15 22:43:51,575 - experiment_functions - INFO - Early stopping at epoch 1450. Best Recall: 0.1266
2026-05-15 22:43:51,657 - optuna.study.study - INFO - Trial 88 finished with value: 0.12655947719428828 and parameters: {'n_layers': 1, 'embedding_dim': 256, 'lr': 0.0007287763579763896, 'lambda_val': 1.3858483968210726e-05, 'batch_size': 1110, 'optimizer': 'Adam'}. Best is trial 88 with value: 0.12655947719428828.
2026-05-15 22:43:56,341 - experiment_functions - INFO - Early stopping at epoch 700. Best Recall: 0.1056
2026-05-15 22:43:56,440 - optuna.study.study - INFO - Trial 89 finished with value: 0.10561935118630046 and parameters: {'n_layers': 1, 'embedding_dim': 256, 'lr': 0.002199052399501346, 'lambda_val': 1.0158680377349045e-05, 'batch_size': 909, 'optimizer': 'Adam'}. Best is trial 88 with value: 0.12655947719428828.
2026-05-15 22:44:03,779 - optuna.study._optimize - INFO - Trial 90 pruned. 
2026-05-15 22:44:10,893 - optuna.study._optimize - INFO - Trial 91 pruned. 
2026-05-15 22:44:17,267 - optuna.study._optimize - INFO - Trial 92 pruned. 
2026-05-15 22:44:23,156 - experiment_functions - INFO - Early stopping at epoch 850. Best Recall: 0.1000
2026-05-15 22:44:23,235 - optuna.study.study - INFO - Trial 93 finished with value: 0.10003506427370218 and parameters: {'n_layers': 1, 'embedding_dim': 256, 'lr': 0.0015320187534692627, 'lambda_val': 4.758979881308781e-06, 'batch_size': 732, 'optimizer': 'Adam'}. Best is trial 88 with value: 0.12655947719428828.
2026-05-15 22:44:41,303 - experiment_functions - INFO - Early stopping at epoch 2950. Best Recall: 0.1281
2026-05-15 22:44:41,404 - optuna.study.study - INFO - Trial 94 finished with value: 0.12806706548609825 and parameters: {'n_layers': 1, 'embedding_dim': 256, 'lr': 0.0004832561897384038, 'lambda_val': 8.194529833888546e-06, 'batch_size': 1254, 'optimizer': 'Adam'}. Best is trial 94 with value: 0.12806706548609825.
2026-05-15 22:44:47,834 - optuna.study._optimize - INFO - Trial 95 pruned. 
2026-05-15 22:44:54,097 - optuna.study._optimize - INFO - Trial 96 pruned. 
2026-05-15 22:45:00,901 - optuna.study._optimize - INFO - Trial 97 pruned. 
2026-05-15 22:45:06,747 - optuna.study._optimize - INFO - Trial 98 pruned. 
2026-05-15 22:45:17,594 - experiment_functions - INFO - Early stopping at epoch 1200. Best Recall: 0.1189
2026-05-15 22:45:17,683 - optuna.study.study - INFO - Trial 99 finished with value: 0.11890096944960936 and parameters: {'n_layers': 1, 'embedding_dim': 256, 'lr': 0.0009478286033260752, 'lambda_val': 5.715575456532863e-06, 'batch_size': 1267, 'optimizer': 'Adam'}. Best is trial 94 with value: 0.12806706548609825.
2026-05-15 22:45:25,147 - optuna.study._optimize - INFO - Trial 100 pruned. 
2026-05-15 22:45:35,793 - experiment_functions - INFO - Early stopping at epoch 1350. Best Recall: 0.1197
2026-05-15 22:45:35,892 - optuna.study.study - INFO - Trial 101 finished with value: 0.11967797746882343 and parameters: {'n_layers': 1, 'embedding_dim': 256, 'lr': 0.0006208236352482111, 'lambda_val': 1.172143402353605e-05, 'batch_size': 1376, 'optimizer': 'Adam'}. Best is trial 94 with value: 0.12806706548609825.
2026-05-15 22:45:43,130 - optuna.study._optimize - INFO - Trial 102 pruned. 
2026-05-15 22:45:58,561 - experiment_functions - INFO - Early stopping at epoch 2500. Best Recall: 0.1294
2026-05-15 22:45:58,712 - optuna.study.study - INFO - Trial 103 finished with value: 0.12944834487623208 and parameters: {'n_layers': 1, 'embedding_dim': 256, 'lr': 0.0004892312830039837, 'lambda_val': 2.0441698238061787e-05, 'batch_size': 1512, 'optimizer': 'Adam'}. Best is trial 103 with value: 0.12944834487623208.
2026-05-15 22:46:10,018 - experiment_functions - INFO - Early stopping at epoch 1700. Best Recall: 0.1147
2026-05-15 22:46:10,117 - optuna.study.study - INFO - Trial 104 finished with value: 0.11471527136443903 and parameters: {'n_layers': 1, 'embedding_dim': 256, 'lr': 0.0008522468406251721, 'lambda_val': 2.0705811192745953e-05, 'batch_size': 1273, 'optimizer': 'Adam'}. Best is trial 103 with value: 0.12944834487623208.
2026-05-15 22:46:17,327 - optuna.study._optimize - INFO - Trial 105 pruned. 
2026-05-15 22:46:23,788 - optuna.study._optimize - INFO - Trial 106 pruned. 
2026-05-15 22:46:27,877 - experiment_functions - INFO - Early stopping at epoch 550. Best Recall: 0.0365
2026-05-15 22:46:28,005 - optuna.study.study - INFO - Trial 107 finished with value: 0.03652143662547905 and parameters: {'n_layers': 1, 'embedding_dim': 256, 'lr': 0.028136505857913705, 'lambda_val': 5.0709687820546055e-05, 'batch_size': 992, 'optimizer': 'Adam'}. Best is trial 103 with value: 0.12944834487623208.
2026-05-15 22:46:35,055 - optuna.study._optimize - INFO - Trial 108 pruned. 
2026-05-15 22:46:38,965 - experiment_functions - INFO - Early stopping at epoch 500. Best Recall: 0.0030
2026-05-15 22:46:39,065 - optuna.study.study - INFO - Trial 109 finished with value: 0.0029623070861813663 and parameters: {'n_layers': 1, 'embedding_dim': 256, 'lr': 0.00014560750936895258, 'lambda_val': 0.0004765973504623137, 'batch_size': 1231, 'optimizer': 'SGD'}. Best is trial 103 with value: 0.12944834487623208.
2026-05-15 22:46:45,832 - optuna.study._optimize - INFO - Trial 110 pruned. 
2026-05-15 22:46:52,670 - optuna.study._optimize - INFO - Trial 111 pruned. 
2026-05-15 22:47:07,341 - experiment_functions - INFO - Early stopping at epoch 2400. Best Recall: 0.1268
2026-05-15 22:47:07,432 - optuna.study.study - INFO - Trial 112 finished with value: 0.12679347909736763 and parameters: {'n_layers': 1, 'embedding_dim': 256, 'lr': 0.000452556030342495, 'lambda_val': 7.369091085905567e-06, 'batch_size': 1770, 'optimizer': 'Adam'}. Best is trial 103 with value: 0.12944834487623208.
2026-05-15 22:47:14,761 - optuna.study._optimize - INFO - Trial 113 pruned. 
2026-05-15 22:47:21,273 - optuna.study._optimize - INFO - Trial 114 pruned. 
2026-05-15 22:47:28,075 - optuna.study._optimize - INFO - Trial 115 pruned. 
2026-05-15 22:47:34,418 - optuna.study._optimize - INFO - Trial 116 pruned. 
2026-05-15 22:47:44,104 - experiment_functions - INFO - Early stopping at epoch 1550. Best Recall: 0.1163
2026-05-15 22:47:44,182 - optuna.study.study - INFO - Trial 117 finished with value: 0.11625776293338737 and parameters: {'n_layers': 1, 'embedding_dim': 256, 'lr': 0.0005278494982113195, 'lambda_val': 1.1254673316820816e-05, 'batch_size': 1921, 'optimizer': 'Adam'}. Best is trial 103 with value: 0.12944834487623208.
2026-05-15 22:47:52,135 - experiment_functions - INFO - Early stopping at epoch 1250. Best Recall: 0.1171
2026-05-15 22:47:52,226 - optuna.study.study - INFO - Trial 118 finished with value: 0.11714939690452111 and parameters: {'n_layers': 1, 'embedding_dim': 256, 'lr': 0.000733741137670602, 'lambda_val': 8.60082402390772e-06, 'batch_size': 1751, 'optimizer': 'Adam'}. Best is trial 103 with value: 0.12944834487623208.
2026-05-15 22:47:58,571 - optuna.study._optimize - INFO - Trial 119 pruned. 
2026-05-15 22:48:05,563 - optuna.study._optimize - INFO - Trial 120 pruned. 
2026-05-15 22:48:12,510 - optuna.study._optimize - INFO - Trial 121 pruned. 
2026-05-15 22:48:18,958 - optuna.study._optimize - INFO - Trial 122 pruned. 
2026-05-15 22:48:31,506 - experiment_functions - INFO - Early stopping at epoch 1800. Best Recall: 0.1184
2026-05-15 22:48:31,622 - optuna.study.study - INFO - Trial 123 finished with value: 0.11837308785428285 and parameters: {'n_layers': 1, 'embedding_dim': 256, 'lr': 0.0005731569358244042, 'lambda_val': 1.273542672961075e-05, 'batch_size': 1753, 'optimizer': 'Adam'}. Best is trial 103 with value: 0.12944834487623208.
2026-05-15 22:48:38,273 - optuna.study._optimize - INFO - Trial 124 pruned. 
2026-05-15 22:48:46,567 - optuna.study._optimize - INFO - Trial 125 pruned. 
2026-05-15 22:48:53,611 - optuna.study._optimize - INFO - Trial 126 pruned. 
2026-05-15 22:48:59,535 - experiment_functions - INFO - Early stopping at epoch 500. Best Recall: 0.0017
2026-05-15 22:48:59,654 - optuna.study.study - INFO - Trial 127 finished with value: 0.0016926115263220618 and parameters: {'n_layers': 4, 'embedding_dim': 64, 'lr': 0.0010764950910628554, 'lambda_val': 6.536922265540961e-06, 'batch_size': 1438, 'optimizer': 'SGD'}. Best is trial 103 with value: 0.12944834487623208.
2026-05-15 22:49:07,508 - optuna.study._optimize - INFO - Trial 128 pruned. 
2026-05-15 22:49:12,019 - experiment_functions - INFO - Early stopping at epoch 550. Best Recall: 0.0666
2026-05-15 22:49:12,148 - optuna.study.study - INFO - Trial 129 finished with value: 0.0666146586526169 and parameters: {'n_layers': 1, 'embedding_dim': 256, 'lr': 0.01307214161900138, 'lambda_val': 9.50125425915231e-06, 'batch_size': 1529, 'optimizer': 'Adam'}. Best is trial 103 with value: 0.12944834487623208.
2026-05-15 22:49:16,996 - experiment_functions - INFO - Early stopping at epoch 600. Best Recall: 0.0018
2026-05-15 22:49:17,124 - optuna.study.study - INFO - Trial 130 finished with value: 0.0017926035829723894 and parameters: {'n_layers': 1, 'embedding_dim': 256, 'lr': 1.8471807647757907e-05, 'lambda_val': 7.387043651165048e-06, 'batch_size': 1327, 'optimizer': 'Adam'}. Best is trial 103 with value: 0.12944834487623208.
2026-05-15 22:49:28,236 - experiment_functions - INFO - Early stopping at epoch 1500. Best Recall: 0.1206
2026-05-15 22:49:28,353 - optuna.study.study - INFO - Trial 131 finished with value: 0.12057808531768868 and parameters: {'n_layers': 1, 'embedding_dim': 256, 'lr': 0.0006895188555259918, 'lambda_val': 1.3640374773211849e-05, 'batch_size': 1258, 'optimizer': 'Adam'}. Best is trial 103 with value: 0.12944834487623208.
2026-05-15 22:49:47,681 - experiment_functions - INFO - Early stopping at epoch 2950. Best Recall: 0.1303
2026-05-15 22:49:47,771 - optuna.study.study - INFO - Trial 132 finished with value: 0.13034017436135367 and parameters: {'n_layers': 1, 'embedding_dim': 256, 'lr': 0.0004162484128479486, 'lambda_val': 1.1568888090940738e-05, 'batch_size': 1097, 'optimizer': 'Adam'}. Best is trial 132 with value: 0.13034017436135367.
2026-05-15 22:49:54,138 - optuna.study._optimize - INFO - Trial 133 pruned. 
2026-05-15 22:50:01,361 - experiment_functions - INFO - Early stopping at epoch 850. Best Recall: 0.0587
