2026-05-16 02:33:00,169 - optuna.study.study - INFO - Trial 275 finished with value: 0.11793167352311897 and parameters: {'n_layers': 1, 'embedding_dim': 256, 'lr': 0.0003222781817221047, 'lambda_val': 7.606578250947095e-06, 'batch_size': 2656, 'optimizer': 'RMSprop'}. Best is trial 210 with value: 0.12664341461242476.
2026-05-16 02:33:15,187 - experiment_functions - INFO - Early stopping at epoch 2500. Best Recall: 0.1216
2026-05-16 02:33:15,279 - optuna.study.study - INFO - Trial 276 finished with value: 0.12159863681067258 and parameters: {'n_layers': 1, 'embedding_dim': 256, 'lr': 0.0003599788983420082, 'lambda_val': 9.333910325072864e-06, 'batch_size': 2584, 'optimizer': 'RMSprop'}. Best is trial 210 with value: 0.12664341461242476.
2026-05-16 02:33:24,028 - experiment_functions - INFO - Early stopping at epoch 1500. Best Recall: 0.1128
2026-05-16 02:33:24,119 - optuna.study.study - INFO - Trial 277 finished with value: 0.11281238365870591 and parameters: {'n_layers': 1, 'embedding_dim': 256, 'lr': 0.00033591106130813233, 'lambda_val': 6.470339104733276e-06, 'batch_size': 2609, 'optimizer': 'RMSprop'}. Best is trial 210 with value: 0.12664341461242476.
2026-05-16 02:33:29,942 - optuna.study._optimize - INFO - Trial 278 pruned. 
2026-05-16 02:33:35,773 - optuna.study._optimize - INFO - Trial 279 pruned. 
2026-05-16 02:33:43,037 - optuna.study._optimize - INFO - Trial 280 pruned. 
2026-05-16 02:33:59,145 - experiment_functions - INFO - Early stopping at epoch 2750. Best Recall: 0.1308
2026-05-16 02:33:59,246 - optuna.study.study - INFO - Trial 281 finished with value: 0.13076275554193675 and parameters: {'n_layers': 1, 'embedding_dim': 256, 'lr': 0.00035533086955233183, 'lambda_val': 0.00014882824845730347, 'batch_size': 1158, 'optimizer': 'RMSprop'}. Best is trial 281 with value: 0.13076275554193675.
2026-05-16 02:34:17,964 - experiment_functions - INFO - Early stopping at epoch 3100. Best Recall: 0.1303
2026-05-16 02:34:18,076 - optuna.study.study - INFO - Trial 282 finished with value: 0.1302851638080986 and parameters: {'n_layers': 1, 'embedding_dim': 256, 'lr': 0.00044445360000590356, 'lambda_val': 0.00014312923999140186, 'batch_size': 1048, 'optimizer': 'RMSprop'}. Best is trial 281 with value: 0.13076275554193675.
2026-05-16 02:34:24,163 - experiment_functions - INFO - Early stopping at epoch 900. Best Recall: 0.0572
2026-05-16 02:34:24,718 - optuna.study.study - INFO - Trial 283 finished with value: 0.05722491731600524 and parameters: {'n_layers': 1, 'embedding_dim': 256, 'lr': 0.009517625955279798, 'lambda_val': 0.00011084661061661337, 'batch_size': 2632, 'optimizer': 'RMSprop'}. Best is trial 281 with value: 0.13076275554193675.
2026-05-16 02:34:35,535 - experiment_functions - INFO - Early stopping at epoch 1800. Best Recall: 0.1201
2026-05-16 02:34:35,634 - optuna.study.study - INFO - Trial 284 finished with value: 0.12009021329671282 and parameters: {'n_layers': 1, 'embedding_dim': 256, 'lr': 0.00046124683580739796, 'lambda_val': 9.562183874537991e-05, 'batch_size': 1042, 'optimizer': 'RMSprop'}. Best is trial 281 with value: 0.13076275554193675.
2026-05-16 02:34:49,426 - optuna.study._optimize - INFO - Trial 285 pruned. 
2026-05-16 02:34:53,121 - experiment_functions - INFO - Early stopping at epoch 600. Best Recall: 0.0020
2026-05-16 02:34:53,201 - optuna.study.study - INFO - Trial 286 finished with value: 0.002014293471546313 and parameters: {'n_layers': 1, 'embedding_dim': 256, 'lr': 2.7048869492663507e-05, 'lambda_val': 0.00013501338063105536, 'batch_size': 802, 'optimizer': 'RMSprop'}. Best is trial 281 with value: 0.13076275554193675.
2026-05-16 02:35:05,776 - experiment_functions - INFO - Early stopping at epoch 2250. Best Recall: 0.1359
2026-05-16 02:35:05,876 - optuna.study.study - INFO - Trial 287 finished with value: 0.13590123424928302 and parameters: {'n_layers': 1, 'embedding_dim': 256, 'lr': 0.00047087288064635673, 'lambda_val': 0.00015121929539992554, 'batch_size': 1123, 'optimizer': 'RMSprop'}. Best is trial 287 with value: 0.13590123424928302.
2026-05-16 02:35:13,595 - optuna.study._optimize - INFO - Trial 288 pruned. 
2026-05-16 02:35:23,801 - experiment_functions - INFO - Early stopping at epoch 1800. Best Recall: 0.1194
2026-05-16 02:35:23,892 - optuna.study.study - INFO - Trial 289 finished with value: 0.11942361750432032 and parameters: {'n_layers': 1, 'embedding_dim': 256, 'lr': 0.00040874436541295613, 'lambda_val': 0.0001278939410084702, 'batch_size': 1228, 'optimizer': 'RMSprop'}. Best is trial 287 with value: 0.13590123424928302.
2026-05-16 02:35:31,122 - experiment_functions - INFO - Early stopping at epoch 1250. Best Recall: 0.1200
2026-05-16 02:35:31,221 - optuna.study.study - INFO - Trial 290 finished with value: 0.12002630553849586 and parameters: {'n_layers': 1, 'embedding_dim': 256, 'lr': 0.00047870699084411614, 'lambda_val': 0.00013079390794285074, 'batch_size': 1181, 'optimizer': 'RMSprop'}. Best is trial 287 with value: 0.13590123424928302.
2026-05-16 02:35:37,849 - experiment_functions - INFO - Early stopping at epoch 1100. Best Recall: 0.1230
2026-05-16 02:35:37,948 - optuna.study.study - INFO - Trial 291 finished with value: 0.12304569636765483 and parameters: {'n_layers': 1, 'embedding_dim': 256, 'lr': 0.0007437434160754751, 'lambda_val': 0.00011903318682332528, 'batch_size': 1157, 'optimizer': 'RMSprop'}. Best is trial 287 with value: 0.13590123424928302.
2026-05-16 02:35:44,846 - experiment_functions - INFO - Early stopping at epoch 500. Best Recall: 0.0027
2026-05-16 02:35:44,954 - optuna.study.study - INFO - Trial 292 finished with value: 0.0027029448152370464 and parameters: {'n_layers': 1, 'embedding_dim': 256, 'lr': 0.0007314258731757774, 'lambda_val': 0.00013889196383252205, 'batch_size': 1186, 'optimizer': 'SGD'}. Best is trial 287 with value: 0.13590123424928302.
2026-05-16 02:35:51,075 - experiment_functions - INFO - Early stopping at epoch 1000. Best Recall: 0.1183
2026-05-16 02:35:51,175 - optuna.study.study - INFO - Trial 293 finished with value: 0.11831899479496813 and parameters: {'n_layers': 1, 'embedding_dim': 256, 'lr': 0.0006163632474341087, 'lambda_val': 0.0001209831722513399, 'batch_size': 1193, 'optimizer': 'RMSprop'}. Best is trial 287 with value: 0.13590123424928302.
2026-05-16 02:35:57,243 - optuna.study._optimize - INFO - Trial 294 pruned. 
2026-05-16 02:36:05,074 - experiment_functions - INFO - Early stopping at epoch 1250. Best Recall: 0.1151
2026-05-16 02:36:05,175 - optuna.study.study - INFO - Trial 295 finished with value: 0.11513591718143346 and parameters: {'n_layers': 1, 'embedding_dim': 256, 'lr': 0.0006601897505949968, 'lambda_val': 8.839296375639032e-05, 'batch_size': 1199, 'optimizer': 'RMSprop'}. Best is trial 287 with value: 0.13590123424928302.
2026-05-16 02:36:11,345 - experiment_functions - INFO - Early stopping at epoch 950. Best Recall: 0.1100
2026-05-16 02:36:11,454 - optuna.study.study - INFO - Trial 296 finished with value: 0.10999480215798611 and parameters: {'n_layers': 1, 'embedding_dim': 256, 'lr': 0.0005763990788257913, 'lambda_val': 0.00016142265562877638, 'batch_size': 1286, 'optimizer': 'RMSprop'}. Best is trial 287 with value: 0.13590123424928302.
2026-05-16 02:36:17,665 - optuna.study._optimize - INFO - Trial 297 pruned. 
2026-05-16 02:36:24,964 - optuna.study._optimize - INFO - Trial 298 pruned. 
2026-05-16 02:36:34,060 - optuna.study._optimize - INFO - Trial 299 pruned. 
2026-05-16 02:36:39,362 - experiment_functions - INFO - Early stopping at epoch 1650. Best Recall: 0.1060
2026-05-16 02:36:39,471 - root - INFO -   **** Training e_100K_1c2dcs_rand2
2026-05-16 02:36:39,485 - root - INFO -   **** Getting 67885/81200 random edges
2026-05-16 02:36:39,589 - optuna.storages._rdb.storage - INFO - A new study created in RDB with name: Study_e_100K_1c2dcs_rand2
2026-05-16 02:36:49,448 - experiment_functions - INFO - Early stopping at epoch 1800. Best Recall: 0.0206
2026-05-16 02:36:49,557 - optuna.study.study - INFO - Trial 0 finished with value: 0.020605668856602567 and parameters: {'n_layers': 2, 'embedding_dim': 32, 'lr': 0.04112474322144519, 'lambda_val': 0.02266354773378018, 'batch_size': 2557, 'optimizer': 'RMSprop'}. Best is trial 0 with value: 0.020605668856602567.
2026-05-16 02:36:53,214 - experiment_functions - INFO - Early stopping at epoch 500. Best Recall: 0.0019
2026-05-16 02:36:53,293 - optuna.study.study - INFO - Trial 1 finished with value: 0.0018738443937465754 and parameters: {'n_layers': 3, 'embedding_dim': 64, 'lr': 0.0026320069225145805, 'lambda_val': 1.8538636089513074e-06, 'batch_size': 3486, 'optimizer': 'SGD'}. Best is trial 0 with value: 0.020605668856602567.
2026-05-16 02:37:11,781 - experiment_functions - INFO - Early stopping at epoch 1650. Best Recall: 0.0474
2026-05-16 02:37:11,883 - optuna.study.study - INFO - Trial 2 finished with value: 0.04735523272693289 and parameters: {'n_layers': 1, 'embedding_dim': 32, 'lr': 0.028462426449608245, 'lambda_val': 0.014121149824925324, 'batch_size': 2833, 'optimizer': 'Adam'}. Best is trial 2 with value: 0.04735523272693289.
2026-05-16 02:37:15,700 - experiment_functions - INFO - Early stopping at epoch 500. Best Recall: 0.0010
2026-05-16 02:37:15,790 - optuna.study.study - INFO - Trial 3 finished with value: 0.0009795570555863602 and parameters: {'n_layers': 3, 'embedding_dim': 128, 'lr': 0.05810964765695071, 'lambda_val': 0.016730922633660553, 'batch_size': 3672, 'optimizer': 'SGD'}. Best is trial 2 with value: 0.04735523272693289.
2026-05-16 02:37:23,720 - experiment_functions - INFO - Early stopping at epoch 750. Best Recall: 0.0425
2026-05-16 02:37:23,799 - optuna.study.study - INFO - Trial 4 finished with value: 0.04249725315825369 and parameters: {'n_layers': 3, 'embedding_dim': 64, 'lr': 0.0008370660828925619, 'lambda_val': 1.9634045922579645e-05, 'batch_size': 3874, 'optimizer': 'RMSprop'}. Best is trial 2 with value: 0.04735523272693289.
2026-05-16 02:37:31,244 - experiment_functions - INFO - Early stopping at epoch 1200. Best Recall: 0.0590
2026-05-16 02:37:31,335 - optuna.study.study - INFO - Trial 5 finished with value: 0.05902052595919349 and parameters: {'n_layers': 3, 'embedding_dim': 64, 'lr': 0.0004381536115614206, 'lambda_val': 3.409031241411918e-05, 'batch_size': 1099, 'optimizer': 'RMSprop'}. Best is trial 5 with value: 0.05902052595919349.
2026-05-16 02:37:35,093 - experiment_functions - INFO - Early stopping at epoch 600. Best Recall: 0.0297
2026-05-16 02:37:35,183 - optuna.study.study - INFO - Trial 6 finished with value: 0.02965834656323231 and parameters: {'n_layers': 2, 'embedding_dim': 64, 'lr': 0.01449237493382825, 'lambda_val': 1.3221295776915048e-06, 'batch_size': 1776, 'optimizer': 'RMSprop'}. Best is trial 5 with value: 0.05902052595919349.
2026-05-16 02:37:41,285 - optuna.study._optimize - INFO - Trial 7 pruned. 
2026-05-16 02:37:44,929 - experiment_functions - INFO - Early stopping at epoch 500. Best Recall: 0.0021
2026-05-16 02:37:45,062 - optuna.study.study - INFO - Trial 8 finished with value: 0.00206074895701714 and parameters: {'n_layers': 3, 'embedding_dim': 64, 'lr': 1.1417061072523065e-05, 'lambda_val': 3.1901704967711385e-06, 'batch_size': 1197, 'optimizer': 'Adam'}. Best is trial 5 with value: 0.05902052595919349.
2026-05-16 02:37:58,133 - experiment_functions - INFO - Early stopping at epoch 500. Best Recall: 0.0017
2026-05-16 02:37:58,894 - optuna.study.study - INFO - Trial 9 finished with value: 0.0016528797680623122 and parameters: {'n_layers': 4, 'embedding_dim': 64, 'lr': 0.00022927706027551584, 'lambda_val': 1.8093176385728293e-05, 'batch_size': 1169, 'optimizer': 'SGD'}. Best is trial 5 with value: 0.05902052595919349.
2026-05-16 02:38:11,598 - optuna.study._optimize - INFO - Trial 10 pruned. 
2026-05-16 02:38:15,937 - experiment_functions - INFO - Early stopping at epoch 650. Best Recall: 0.1003
2026-05-16 02:38:16,118 - optuna.study.study - INFO - Trial 11 finished with value: 0.10025654537544637 and parameters: {'n_layers': 1, 'embedding_dim': 96, 'lr': 0.0021313622797928247, 'lambda_val': 0.0007171066506993099, 'batch_size': 2758, 'optimizer': 'Adam'}. Best is trial 11 with value: 0.10025654537544637.
2026-05-16 02:38:29,463 - experiment_functions - INFO - Early stopping at epoch 2150. Best Recall: 0.0640
2026-05-16 02:38:29,759 - optuna.study.study - INFO - Trial 12 finished with value: 0.0639661187844224 and parameters: {'n_layers': 2, 'embedding_dim': 96, 'lr': 0.0002630852336340577, 'lambda_val': 0.0005611064722949939, 'batch_size': 2988, 'optimizer': 'Adam'}. Best is trial 11 with value: 0.10025654537544637.
2026-05-16 02:38:33,606 - experiment_functions - INFO - Early stopping at epoch 600. Best Recall: 0.1054
2026-05-16 02:38:33,712 - optuna.study.study - INFO - Trial 13 finished with value: 0.10543757063985837 and parameters: {'n_layers': 1, 'embedding_dim': 96, 'lr': 0.0030594437514712297, 'lambda_val': 0.0009579856988492008, 'batch_size': 3017, 'optimizer': 'Adam'}. Best is trial 13 with value: 0.10543757063985837.
2026-05-16 02:38:37,398 - experiment_functions - INFO - Early stopping at epoch 550. Best Recall: 0.1035
2026-05-16 02:38:37,478 - optuna.study.study - INFO - Trial 14 finished with value: 0.10350617466146508 and parameters: {'n_layers': 1, 'embedding_dim': 96, 'lr': 0.004583993376305554, 'lambda_val': 0.0022558011879001785, 'batch_size': 3275, 'optimizer': 'Adam'}. Best is trial 13 with value: 0.10543757063985837.
2026-05-16 02:38:41,090 - experiment_functions - INFO - Early stopping at epoch 550. Best Recall: 0.1076
2026-05-16 02:38:41,195 - optuna.study.study - INFO - Trial 15 finished with value: 0.10757527455852292 and parameters: {'n_layers': 1, 'embedding_dim': 96, 'lr': 0.005146919618639058, 'lambda_val': 0.0024519481817759617, 'batch_size': 3271, 'optimizer': 'Adam'}. Best is trial 15 with value: 0.10757527455852292.
2026-05-16 02:38:45,172 - experiment_functions - INFO - Early stopping at epoch 550. Best Recall: 0.0227
2026-05-16 02:38:45,273 - optuna.study.study - INFO - Trial 16 finished with value: 0.02265671610045995 and parameters: {'n_layers': 1, 'embedding_dim': 96, 'lr': 0.0061579493438238455, 'lambda_val': 0.08148688025036792, 'batch_size': 2229, 'optimizer': 'Adam'}. Best is trial 15 with value: 0.10757527455852292.
2026-05-16 02:38:49,347 - experiment_functions - INFO - Early stopping at epoch 550. Best Recall: 0.0328
2026-05-16 02:38:49,459 - optuna.study.study - INFO - Trial 17 finished with value: 0.03279176011449185 and parameters: {'n_layers': 2, 'embedding_dim': 96, 'lr': 0.009299998373832689, 'lambda_val': 8.923553297814656e-05, 'batch_size': 4090, 'optimizer': 'Adam'}. Best is trial 15 with value: 0.10757527455852292.
2026-05-16 02:38:55,917 - experiment_functions - INFO - Early stopping at epoch 750. Best Recall: 0.1055
2026-05-16 02:38:56,028 - optuna.study.study - INFO - Trial 18 finished with value: 0.10553138397935598 and parameters: {'n_layers': 1, 'embedding_dim': 256, 'lr': 0.0011900427530289492, 'lambda_val': 0.002545030475282388, 'batch_size': 3212, 'optimizer': 'Adam'}. Best is trial 15 with value: 0.10757527455852292.
2026-05-16 02:39:13,684 - optuna.study._optimize - INFO - Trial 19 pruned. 
2026-05-16 02:39:19,305 - experiment_functions - INFO - Early stopping at epoch 850. Best Recall: 0.1249
2026-05-16 02:39:19,385 - optuna.study.study - INFO - Trial 20 finished with value: 0.12490369978282755 and parameters: {'n_layers': 1, 'embedding_dim': 256, 'lr': 0.001152451606760092, 'lambda_val': 0.00015527820002064267, 'batch_size': 2477, 'optimizer': 'Adam'}. Best is trial 20 with value: 0.12490369978282755.
2026-05-16 02:39:29,383 - experiment_functions - INFO - Early stopping at epoch 900. Best Recall: 0.1173
2026-05-16 02:39:30,155 - optuna.study.study - INFO - Trial 21 finished with value: 0.11732619660673362 and parameters: {'n_layers': 1, 'embedding_dim': 256, 'lr': 0.0009572639460141228, 'lambda_val': 0.00018740817771290347, 'batch_size': 2484, 'optimizer': 'Adam'}. Best is trial 20 with value: 0.12490369978282755.
2026-05-16 02:39:41,244 - experiment_functions - INFO - Early stopping at epoch 850. Best Recall: 0.1031
2026-05-16 02:39:41,333 - optuna.study.study - INFO - Trial 22 finished with value: 0.10312636564041548 and parameters: {'n_layers': 1, 'embedding_dim': 256, 'lr': 0.0010265445704784083, 'lambda_val': 0.00016681657017560372, 'batch_size': 2417, 'optimizer': 'Adam'}. Best is trial 20 with value: 0.12490369978282755.
2026-05-16 02:40:09,096 - optuna.study.study - INFO - Trial 23 finished with value: 0.08277423127053375 and parameters: {'n_layers': 2, 'embedding_dim': 256, 'lr': 0.0001366112851754174, 'lambda_val': 0.00013987893052256419, 'batch_size': 2049, 'optimizer': 'Adam'}. Best is trial 20 with value: 0.12490369978282755.
2026-05-16 02:40:24,229 - experiment_functions - INFO - Early stopping at epoch 2800. Best Recall: 0.1161
2026-05-16 02:40:24,328 - optuna.study.study - INFO - Trial 24 finished with value: 0.11605107033057924 and parameters: {'n_layers': 1, 'embedding_dim': 128, 'lr': 0.00048609432503666166, 'lambda_val': 5.251126103727542e-05, 'batch_size': 1462, 'optimizer': 'Adam'}. Best is trial 20 with value: 0.12490369978282755.
2026-05-16 02:40:27,754 - experiment_functions - INFO - Early stopping at epoch 500. Best Recall: 0.0023
2026-05-16 02:40:27,855 - optuna.study.study - INFO - Trial 25 finished with value: 0.00227529424518359 and parameters: {'n_layers': 1, 'embedding_dim': 128, 'lr': 0.0005478765247151438, 'lambda_val': 6.502983675747771e-06, 'batch_size': 1629, 'optimizer': 'SGD'}. Best is trial 20 with value: 0.12490369978282755.
2026-05-16 02:40:37,228 - optuna.study._optimize - INFO - Trial 26 pruned. 
2026-05-16 02:40:42,104 - experiment_functions - INFO - Early stopping at epoch 750. Best Recall: 0.1094
2026-05-16 02:40:42,206 - optuna.study.study - INFO - Trial 27 finished with value: 0.10936763396940653 and parameters: {'n_layers': 1, 'embedding_dim': 128, 'lr': 0.0016334377093125889, 'lambda_val': 0.0002469944865755223, 'batch_size': 2527, 'optimizer': 'Adam'}. Best is trial 20 with value: 0.12490369978282755.
2026-05-16 02:40:56,159 - experiment_functions - INFO - Early stopping at epoch 2000. Best Recall: 0.0825
2026-05-16 02:40:56,258 - optuna.study.study - INFO - Trial 28 finished with value: 0.08249285401384701 and parameters: {'n_layers': 2, 'embedding_dim': 256, 'lr': 0.0003403701865599707, 'lambda_val': 7.818635628015524e-06, 'batch_size': 536, 'optimizer': 'Adam'}. Best is trial 20 with value: 0.12490369978282755.
2026-05-16 02:40:59,839 - experiment_functions - INFO - Early stopping at epoch 500. Best Recall: 0.0012
2026-05-16 02:40:59,939 - optuna.study.study - INFO - Trial 29 finished with value: 0.0011771877247118594 and parameters: {'n_layers': 1, 'embedding_dim': 256, 'lr': 3.972109414265276e-05, 'lambda_val': 6.410366539718201e-05, 'batch_size': 2236, 'optimizer': 'SGD'}. Best is trial 20 with value: 0.12490369978282755.
2026-05-16 02:41:06,738 - experiment_functions - INFO - Early stopping at epoch 950. Best Recall: 0.0760
2026-05-16 02:41:06,858 - optuna.study.study - INFO - Trial 30 finished with value: 0.0759895859205203 and parameters: {'n_layers': 2, 'embedding_dim': 128, 'lr': 0.0006266139644357687, 'lambda_val': 0.000315836669837138, 'batch_size': 2656, 'optimizer': 'Adam'}. Best is trial 20 with value: 0.12490369978282755.
2026-05-16 02:41:11,460 - experiment_functions - INFO - Early stopping at epoch 700. Best Recall: 0.1044
2026-05-16 02:41:11,586 - optuna.study.study - INFO - Trial 31 finished with value: 0.10443402115486994 and parameters: {'n_layers': 1, 'embedding_dim': 128, 'lr': 0.0016048215530509418, 'lambda_val': 0.0002485111111449426, 'batch_size': 2479, 'optimizer': 'Adam'}. Best is trial 20 with value: 0.12490369978282755.
2026-05-16 02:41:16,338 - experiment_functions - INFO - Early stopping at epoch 700. Best Recall: 0.1112
2026-05-16 02:41:16,429 - optuna.study.study - INFO - Trial 32 finished with value: 0.11115247850910304 and parameters: {'n_layers': 1, 'embedding_dim': 128, 'lr': 0.0020036717524173075, 'lambda_val': 9.349658331024205e-05, 'batch_size': 2032, 'optimizer': 'Adam'}. Best is trial 20 with value: 0.12490369978282755.
2026-05-16 02:41:25,663 - experiment_functions - INFO - Early stopping at epoch 1650. Best Recall: 0.1096
2026-05-16 02:41:25,807 - optuna.study.study - INFO - Trial 33 finished with value: 0.10962727815602402 and parameters: {'n_layers': 1, 'embedding_dim': 128, 'lr': 0.0007619381581278601, 'lambda_val': 0.00012116198889428879, 'batch_size': 1389, 'optimizer': 'Adam'}. Best is trial 20 with value: 0.12490369978282755.
2026-05-16 02:41:30,867 - experiment_functions - INFO - Early stopping at epoch 700. Best Recall: 0.1059
2026-05-16 02:41:30,966 - optuna.study.study - INFO - Trial 34 finished with value: 0.10585656704606881 and parameters: {'n_layers': 1, 'embedding_dim': 32, 'lr': 0.0034734439493163947, 'lambda_val': 7.849330111649229e-05, 'batch_size': 1934, 'optimizer': 'Adam'}. Best is trial 20 with value: 0.12490369978282755.
2026-05-16 02:41:34,594 - experiment_functions - INFO - Early stopping at epoch 500. Best Recall: 0.0007
2026-05-16 02:41:34,747 - optuna.study.study - INFO - Trial 35 finished with value: 0.000734280566772071 and parameters: {'n_layers': 1, 'embedding_dim': 128, 'lr': 0.0001668970454528283, 'lambda_val': 2.1994951395276976e-05, 'batch_size': 2156, 'optimizer': 'SGD'}. Best is trial 20 with value: 0.12490369978282755.
2026-05-16 02:41:39,511 - experiment_functions - INFO - Early stopping at epoch 700. Best Recall: 0.1043
2026-05-16 02:41:39,591 - optuna.study.study - INFO - Trial 36 finished with value: 0.10428141838130507 and parameters: {'n_layers': 1, 'embedding_dim': 256, 'lr': 0.0019745865663382918, 'lambda_val': 1.049854556417464e-05, 'batch_size': 1788, 'optimizer': 'Adam'}. Best is trial 20 with value: 0.12490369978282755.
2026-05-16 02:41:43,605 - experiment_functions - INFO - Early stopping at epoch 650. Best Recall: 0.0184
