2026-05-16 10:26:48,087 - optuna.study.study - INFO - Trial 236 finished with value: 0.12541718797572557 and parameters: {'n_layers': 1, 'embedding_dim': 128, 'lr': 0.0007206230583504112, 'lambda_val': 1.6322286056789423e-06, 'batch_size': 1178, 'optimizer': 'Adam'}. Best is trial 115 with value: 0.13538651527349915.
2026-05-16 10:26:55,266 - optuna.study._optimize - INFO - Trial 237 pruned. 
2026-05-16 10:27:02,979 - optuna.study._optimize - INFO - Trial 238 pruned. 
2026-05-16 10:27:09,584 - optuna.study._optimize - INFO - Trial 239 pruned. 
2026-05-16 10:27:15,847 - optuna.study._optimize - INFO - Trial 240 pruned. 
2026-05-16 10:27:22,407 - optuna.study._optimize - INFO - Trial 241 pruned. 
2026-05-16 10:27:39,414 - experiment_functions - INFO - Early stopping at epoch 2600. Best Recall: 0.1356
2026-05-16 10:27:39,528 - optuna.study.study - INFO - Trial 242 finished with value: 0.13560395196759886 and parameters: {'n_layers': 1, 'embedding_dim': 256, 'lr': 0.0006933288297782673, 'lambda_val': 5.244992909226082e-06, 'batch_size': 604, 'optimizer': 'Adam'}. Best is trial 242 with value: 0.13560395196759886.
2026-05-16 10:27:46,821 - optuna.study._optimize - INFO - Trial 243 pruned. 
2026-05-16 10:27:53,523 - optuna.study._optimize - INFO - Trial 244 pruned. 
2026-05-16 10:28:00,509 - optuna.study._optimize - INFO - Trial 245 pruned. 
2026-05-16 10:28:06,531 - optuna.study._optimize - INFO - Trial 246 pruned. 
2026-05-16 10:28:09,988 - experiment_functions - INFO - Early stopping at epoch 500. Best Recall: 0.0024
2026-05-16 10:28:10,099 - optuna.study.study - INFO - Trial 247 finished with value: 0.0024443828743943596 and parameters: {'n_layers': 1, 'embedding_dim': 256, 'lr': 0.0008698590255109565, 'lambda_val': 3.872047717932471e-06, 'batch_size': 643, 'optimizer': 'SGD'}. Best is trial 242 with value: 0.13560395196759886.
2026-05-16 10:28:16,971 - optuna.study._optimize - INFO - Trial 248 pruned. 
2026-05-16 10:28:23,091 - optuna.study._optimize - INFO - Trial 249 pruned. 
2026-05-16 10:28:30,074 - optuna.study._optimize - INFO - Trial 250 pruned. 
2026-05-16 10:28:35,959 - optuna.study._optimize - INFO - Trial 251 pruned. 
2026-05-16 10:28:43,804 - optuna.study._optimize - INFO - Trial 252 pruned. 
2026-05-16 10:28:50,205 - optuna.study._optimize - INFO - Trial 253 pruned. 
2026-05-16 10:28:54,447 - experiment_functions - INFO - Early stopping at epoch 550. Best Recall: 0.0776
2026-05-16 10:28:54,549 - optuna.study.study - INFO - Trial 254 finished with value: 0.07757297764863112 and parameters: {'n_layers': 1, 'embedding_dim': 256, 'lr': 0.00843541213844671, 'lambda_val': 3.4271382741876075e-06, 'batch_size': 806, 'optimizer': 'Adam'}. Best is trial 242 with value: 0.13560395196759886.
2026-05-16 10:29:01,605 - optuna.study._optimize - INFO - Trial 255 pruned. 
2026-05-16 10:29:08,225 - optuna.study._optimize - INFO - Trial 256 pruned. 
2026-05-16 10:29:14,714 - optuna.study._optimize - INFO - Trial 257 pruned. 
2026-05-16 10:29:23,014 - optuna.study._optimize - INFO - Trial 258 pruned. 
2026-05-16 10:29:29,517 - optuna.study._optimize - INFO - Trial 259 pruned. 
2026-05-16 10:29:36,691 - optuna.study._optimize - INFO - Trial 260 pruned. 
2026-05-16 10:29:42,621 - optuna.study._optimize - INFO - Trial 261 pruned. 
2026-05-16 10:29:49,609 - optuna.study._optimize - INFO - Trial 262 pruned. 
2026-05-16 10:30:03,864 - experiment_functions - INFO - Early stopping at epoch 1900. Best Recall: 0.1279
2026-05-16 10:30:04,029 - optuna.study.study - INFO - Trial 263 finished with value: 0.12792318762242866 and parameters: {'n_layers': 1, 'embedding_dim': 256, 'lr': 0.00045045690641551275, 'lambda_val': 6.1859443539845705e-06, 'batch_size': 1493, 'optimizer': 'Adam'}. Best is trial 242 with value: 0.13560395196759886.
2026-05-16 10:30:10,598 - optuna.study._optimize - INFO - Trial 264 pruned. 
2026-05-16 10:30:16,939 - optuna.study._optimize - INFO - Trial 265 pruned. 
2026-05-16 10:30:23,654 - optuna.study._optimize - INFO - Trial 266 pruned. 
2026-05-16 10:30:30,390 - optuna.study._optimize - INFO - Trial 267 pruned. 
2026-05-16 10:30:47,397 - experiment_functions - INFO - Early stopping at epoch 3100. Best Recall: 0.1359
2026-05-16 10:30:47,537 - optuna.study.study - INFO - Trial 268 finished with value: 0.1358914620391795 and parameters: {'n_layers': 1, 'embedding_dim': 128, 'lr': 0.0005955221165103676, 'lambda_val': 6.5736573661276995e-06, 'batch_size': 1286, 'optimizer': 'Adam'}. Best is trial 268 with value: 0.1358914620391795.
2026-05-16 10:30:54,329 - optuna.study._optimize - INFO - Trial 269 pruned. 
2026-05-16 10:31:04,824 - experiment_functions - INFO - Early stopping at epoch 1800. Best Recall: 0.1273
2026-05-16 10:31:04,925 - optuna.study.study - INFO - Trial 270 finished with value: 0.12730462558511896 and parameters: {'n_layers': 1, 'embedding_dim': 128, 'lr': 0.0006216779847324903, 'lambda_val': 1.3322666747865772e-06, 'batch_size': 1624, 'optimizer': 'Adam'}. Best is trial 268 with value: 0.1358914620391795.
2026-05-16 10:31:08,283 - experiment_functions - INFO - Early stopping at epoch 500. Best Recall: 0.0016
2026-05-16 10:31:08,375 - optuna.study.study - INFO - Trial 271 finished with value: 0.0016477353181670222 and parameters: {'n_layers': 1, 'embedding_dim': 128, 'lr': 0.0004000091675270559, 'lambda_val': 1.2939708997118675e-06, 'batch_size': 1669, 'optimizer': 'SGD'}. Best is trial 268 with value: 0.1358914620391795.
2026-05-16 10:31:15,991 - experiment_functions - INFO - Early stopping at epoch 850. Best Recall: 0.0583
2026-05-16 10:31:16,093 - optuna.study.study - INFO - Trial 272 finished with value: 0.058318141102480035 and parameters: {'n_layers': 3, 'embedding_dim': 256, 'lr': 0.0007524574106935706, 'lambda_val': 1.1956100844968509e-06, 'batch_size': 1550, 'optimizer': 'Adam'}. Best is trial 268 with value: 0.1358914620391795.
2026-05-16 10:31:22,155 - optuna.study._optimize - INFO - Trial 273 pruned. 
2026-05-16 10:31:28,118 - optuna.study._optimize - INFO - Trial 274 pruned. 
2026-05-16 10:31:34,763 - optuna.study._optimize - INFO - Trial 275 pruned. 
2026-05-16 10:31:41,700 - experiment_functions - INFO - Early stopping at epoch 850. Best Recall: 0.0301
2026-05-16 10:31:41,878 - optuna.study.study - INFO - Trial 276 finished with value: 0.03009750391349502 and parameters: {'n_layers': 4, 'embedding_dim': 128, 'lr': 0.0006492756006030563, 'lambda_val': 1.752254925207558e-06, 'batch_size': 1606, 'optimizer': 'Adam'}. Best is trial 268 with value: 0.1358914620391795.
2026-05-16 10:31:48,960 - optuna.study._optimize - INFO - Trial 277 pruned. 
2026-05-16 10:31:55,953 - optuna.study._optimize - INFO - Trial 278 pruned. 
2026-05-16 10:32:02,790 - optuna.study._optimize - INFO - Trial 279 pruned. 
2026-05-16 10:32:10,070 - optuna.study._optimize - INFO - Trial 280 pruned. 
2026-05-16 10:32:16,909 - optuna.study._optimize - INFO - Trial 281 pruned. 
2026-05-16 10:32:23,922 - optuna.study._optimize - INFO - Trial 282 pruned. 
2026-05-16 10:32:31,329 - optuna.study._optimize - INFO - Trial 283 pruned. 
2026-05-16 10:32:38,652 - experiment_functions - INFO - Early stopping at epoch 900. Best Recall: 0.0791
2026-05-16 10:32:38,772 - optuna.study.study - INFO - Trial 284 finished with value: 0.07914894268232846 and parameters: {'n_layers': 2, 'embedding_dim': 256, 'lr': 0.000704988431960775, 'lambda_val': 1.4723108191005981e-06, 'batch_size': 1852, 'optimizer': 'Adam'}. Best is trial 268 with value: 0.1358914620391795.
2026-05-16 10:32:45,724 - optuna.study._optimize - INFO - Trial 285 pruned. 
2026-05-16 10:32:53,187 - experiment_functions - INFO - Early stopping at epoch 1100. Best Recall: 0.1214
2026-05-16 10:32:53,289 - optuna.study.study - INFO - Trial 286 finished with value: 0.12139342720269897 and parameters: {'n_layers': 1, 'embedding_dim': 256, 'lr': 0.0007809570963433454, 'lambda_val': 2.161341397887886e-06, 'batch_size': 1389, 'optimizer': 'RMSprop'}. Best is trial 268 with value: 0.1358914620391795.
2026-05-16 10:33:01,707 - optuna.study._optimize - INFO - Trial 287 pruned. 
2026-05-16 10:33:08,523 - optuna.study._optimize - INFO - Trial 288 pruned. 
2026-05-16 10:33:15,092 - optuna.study._optimize - INFO - Trial 289 pruned. 
2026-05-16 10:33:22,287 - optuna.study._optimize - INFO - Trial 290 pruned. 
2026-05-16 10:33:29,276 - optuna.study._optimize - INFO - Trial 291 pruned. 
2026-05-16 10:33:44,421 - experiment_functions - INFO - Early stopping at epoch 2400. Best Recall: 0.1344
2026-05-16 10:33:44,576 - optuna.study.study - INFO - Trial 292 finished with value: 0.1344325488558827 and parameters: {'n_layers': 1, 'embedding_dim': 128, 'lr': 0.0005135014314874501, 'lambda_val': 1.6876718645309175e-06, 'batch_size': 913, 'optimizer': 'Adam'}. Best is trial 268 with value: 0.1358914620391795.
2026-05-16 10:33:52,134 - optuna.study._optimize - INFO - Trial 293 pruned. 
2026-05-16 10:33:55,393 - experiment_functions - INFO - Early stopping at epoch 500. Best Recall: 0.0021
2026-05-16 10:33:55,529 - optuna.study.study - INFO - Trial 294 finished with value: 0.0021272165242614597 and parameters: {'n_layers': 1, 'embedding_dim': 128, 'lr': 0.000508647970952999, 'lambda_val': 5.715060431836924e-06, 'batch_size': 851, 'optimizer': 'SGD'}. Best is trial 268 with value: 0.1358914620391795.
2026-05-16 10:34:04,669 - experiment_functions - INFO - Early stopping at epoch 1550. Best Recall: 0.1273
2026-05-16 10:34:04,780 - optuna.study.study - INFO - Trial 295 finished with value: 0.12732094550905626 and parameters: {'n_layers': 1, 'embedding_dim': 128, 'lr': 0.0007484835379176618, 'lambda_val': 7.558024560821412e-06, 'batch_size': 982, 'optimizer': 'Adam'}. Best is trial 268 with value: 0.1358914620391795.
2026-05-16 10:34:11,112 - optuna.study._optimize - INFO - Trial 296 pruned. 
2026-05-16 10:34:17,173 - optuna.study._optimize - INFO - Trial 297 pruned. 
2026-05-16 10:34:24,173 - optuna.study._optimize - INFO - Trial 298 pruned. 
2026-05-16 10:34:30,452 - optuna.study._optimize - INFO - Trial 299 pruned. 
2026-05-16 10:34:37,022 - experiment_functions - INFO - Early stopping at epoch 2100. Best Recall: 0.1261
