2026-05-16 04:11:43,435 - optuna.study.study - INFO - Trial 98 finished with value: 0.10530739861164753 and parameters: {'n_layers': 1, 'embedding_dim': 256, 'lr': 0.0007331932002265681, 'lambda_val': 0.001511570674432652, 'batch_size': 2407, 'optimizer': 'RMSprop'}. Best is trial 61 with value: 0.12881201604315629.
2026-05-16 04:11:47,287 - experiment_functions - INFO - Early stopping at epoch 500. Best Recall: 0.0025
2026-05-16 04:11:47,386 - optuna.study.study - INFO - Trial 99 finished with value: 0.0024997733421148315 and parameters: {'n_layers': 1, 'embedding_dim': 256, 'lr': 1.3444930425930334e-05, 'lambda_val': 0.00027085434558702027, 'batch_size': 3000, 'optimizer': 'Adam'}. Best is trial 61 with value: 0.12881201604315629.
2026-05-16 04:11:51,161 - experiment_functions - INFO - Early stopping at epoch 500. Best Recall: 0.0027
2026-05-16 04:11:51,251 - optuna.study.study - INFO - Trial 100 finished with value: 0.002654465935951028 and parameters: {'n_layers': 3, 'embedding_dim': 96, 'lr': 0.0005950893362967571, 'lambda_val': 0.002129163503291527, 'batch_size': 3132, 'optimizer': 'SGD'}. Best is trial 61 with value: 0.12881201604315629.
2026-05-16 04:11:58,692 - optuna.study._optimize - INFO - Trial 101 pruned. 
2026-05-16 04:12:09,873 - experiment_functions - INFO - Early stopping at epoch 1850. Best Recall: 0.1156
2026-05-16 04:12:09,973 - optuna.study.study - INFO - Trial 102 finished with value: 0.11561145170895341 and parameters: {'n_layers': 1, 'embedding_dim': 256, 'lr': 0.0003862342236074833, 'lambda_val': 0.0005812061991167398, 'batch_size': 2858, 'optimizer': 'Adam'}. Best is trial 61 with value: 0.12881201604315629.
2026-05-16 04:12:17,034 - optuna.study._optimize - INFO - Trial 103 pruned. 
2026-05-16 04:12:22,252 - experiment_functions - INFO - Early stopping at epoch 750. Best Recall: 0.1057
2026-05-16 04:12:22,394 - optuna.study.study - INFO - Trial 104 finished with value: 0.1056629806330192 and parameters: {'n_layers': 1, 'embedding_dim': 256, 'lr': 0.001385207441969533, 'lambda_val': 0.00040331530363900474, 'batch_size': 2851, 'optimizer': 'Adam'}. Best is trial 61 with value: 0.12881201604315629.
2026-05-16 04:12:31,549 - optuna.study._optimize - INFO - Trial 105 pruned. 
2026-05-16 04:12:37,533 - experiment_functions - INFO - Early stopping at epoch 900. Best Recall: 0.1195
2026-05-16 04:12:37,634 - optuna.study.study - INFO - Trial 106 finished with value: 0.11953036499528878 and parameters: {'n_layers': 1, 'embedding_dim': 256, 'lr': 0.0008996730056341399, 'lambda_val': 2.174229378669496e-05, 'batch_size': 3089, 'optimizer': 'Adam'}. Best is trial 61 with value: 0.12881201604315629.
2026-05-16 04:12:43,057 - experiment_functions - INFO - Early stopping at epoch 800. Best Recall: 0.1126
2026-05-16 04:12:43,158 - optuna.study.study - INFO - Trial 107 finished with value: 0.11257598585275846 and parameters: {'n_layers': 1, 'embedding_dim': 256, 'lr': 0.0009828101854878132, 'lambda_val': 2.315931742118222e-05, 'batch_size': 3116, 'optimizer': 'Adam'}. Best is trial 61 with value: 0.12881201604315629.
2026-05-16 04:12:49,972 - experiment_functions - INFO - Early stopping at epoch 950. Best Recall: 0.1033
2026-05-16 04:12:50,071 - optuna.study.study - INFO - Trial 108 finished with value: 0.10327014324191364 and parameters: {'n_layers': 1, 'embedding_dim': 256, 'lr': 0.0007638174465240573, 'lambda_val': 3.579027874690687e-05, 'batch_size': 3329, 'optimizer': 'Adam'}. Best is trial 61 with value: 0.12881201604315629.
2026-05-16 04:12:57,636 - optuna.study._optimize - INFO - Trial 109 pruned. 
2026-05-16 04:13:03,957 - optuna.study._optimize - INFO - Trial 110 pruned. 
2026-05-16 04:13:09,757 - experiment_functions - INFO - Early stopping at epoch 750. Best Recall: 0.1152
2026-05-16 04:13:09,911 - optuna.study.study - INFO - Trial 111 finished with value: 0.11523460306986881 and parameters: {'n_layers': 1, 'embedding_dim': 256, 'lr': 0.001160650336406789, 'lambda_val': 1.830974975298614e-05, 'batch_size': 2914, 'optimizer': 'Adam'}. Best is trial 61 with value: 0.12881201604315629.
2026-05-16 04:13:29,268 - experiment_functions - INFO - Early stopping at epoch 1600. Best Recall: 0.1210
2026-05-16 04:13:29,391 - optuna.study.study - INFO - Trial 112 finished with value: 0.12100058431118257 and parameters: {'n_layers': 1, 'embedding_dim': 256, 'lr': 0.0004545014025203697, 'lambda_val': 0.000300641123957262, 'batch_size': 2772, 'optimizer': 'Adam'}. Best is trial 61 with value: 0.12881201604315629.
2026-05-16 04:13:39,729 - experiment_functions - INFO - Early stopping at epoch 1600. Best Recall: 0.1200
2026-05-16 04:13:39,819 - optuna.study.study - INFO - Trial 113 finished with value: 0.12002923687512529 and parameters: {'n_layers': 1, 'embedding_dim': 256, 'lr': 0.0005608977440392502, 'lambda_val': 8.572847976122741e-05, 'batch_size': 2525, 'optimizer': 'Adam'}. Best is trial 61 with value: 0.12881201604315629.
2026-05-16 04:13:50,972 - experiment_functions - INFO - Early stopping at epoch 1300. Best Recall: 0.1175
2026-05-16 04:13:51,072 - optuna.study.study - INFO - Trial 114 finished with value: 0.11752524881047688 and parameters: {'n_layers': 1, 'embedding_dim': 256, 'lr': 0.000547374792971529, 'lambda_val': 0.0001658492418781459, 'batch_size': 2590, 'optimizer': 'Adam'}. Best is trial 61 with value: 0.12881201604315629.
2026-05-16 04:14:01,837 - experiment_functions - INFO - Early stopping at epoch 1700. Best Recall: 0.1200
2026-05-16 04:14:01,956 - optuna.study.study - INFO - Trial 115 finished with value: 0.12002295792744712 and parameters: {'n_layers': 1, 'embedding_dim': 256, 'lr': 0.00047115394770035583, 'lambda_val': 0.00030998182268785303, 'batch_size': 2771, 'optimizer': 'Adam'}. Best is trial 61 with value: 0.12881201604315629.
2026-05-16 04:14:07,469 - experiment_functions - INFO - Early stopping at epoch 800. Best Recall: 0.1016
2026-05-16 04:14:07,558 - optuna.study.study - INFO - Trial 116 finished with value: 0.10163620951831226 and parameters: {'n_layers': 1, 'embedding_dim': 64, 'lr': 0.0020533717577973258, 'lambda_val': 0.0002977074429381006, 'batch_size': 2535, 'optimizer': 'Adam'}. Best is trial 61 with value: 0.12881201604315629.
2026-05-16 04:14:14,780 - experiment_functions - INFO - Early stopping at epoch 1150. Best Recall: 0.1071
2026-05-16 04:14:14,950 - optuna.study.study - INFO - Trial 117 finished with value: 0.10708171141712344 and parameters: {'n_layers': 1, 'embedding_dim': 256, 'lr': 0.0008844906563162128, 'lambda_val': 8.480521237625743e-05, 'batch_size': 2365, 'optimizer': 'Adam'}. Best is trial 61 with value: 0.12881201604315629.
2026-05-16 04:14:23,702 - experiment_functions - INFO - Early stopping at epoch 1350. Best Recall: 0.1187
2026-05-16 04:14:23,800 - optuna.study.study - INFO - Trial 118 finished with value: 0.1186922715990494 and parameters: {'n_layers': 1, 'embedding_dim': 256, 'lr': 0.00047705262387616676, 'lambda_val': 0.0001162597782658304, 'batch_size': 2685, 'optimizer': 'Adam'}. Best is trial 61 with value: 0.12881201604315629.
2026-05-16 04:14:31,352 - optuna.study._optimize - INFO - Trial 119 pruned. 
2026-05-16 04:14:38,756 - experiment_functions - INFO - Early stopping at epoch 1100. Best Recall: 0.1199
2026-05-16 04:14:38,890 - optuna.study.study - INFO - Trial 120 finished with value: 0.11992194196936232 and parameters: {'n_layers': 1, 'embedding_dim': 256, 'lr': 0.0006635324008708153, 'lambda_val': 0.00023489332186352562, 'batch_size': 2642, 'optimizer': 'Adam'}. Best is trial 61 with value: 0.12881201604315629.
2026-05-16 04:14:45,599 - experiment_functions - INFO - Early stopping at epoch 1050. Best Recall: 0.1173
2026-05-16 04:14:45,700 - optuna.study.study - INFO - Trial 121 finished with value: 0.11726425762012435 and parameters: {'n_layers': 1, 'embedding_dim': 256, 'lr': 0.0006548964337126152, 'lambda_val': 0.00024658201613927093, 'batch_size': 2760, 'optimizer': 'Adam'}. Best is trial 61 with value: 0.12881201604315629.
2026-05-16 04:14:54,644 - optuna.study._optimize - INFO - Trial 122 pruned. 
2026-05-16 04:15:01,176 - optuna.study._optimize - INFO - Trial 123 pruned. 
2026-05-16 04:15:07,683 - experiment_functions - INFO - Early stopping at epoch 1000. Best Recall: 0.1109
2026-05-16 04:15:07,781 - optuna.study.study - INFO - Trial 124 finished with value: 0.11090307712856448 and parameters: {'n_layers': 1, 'embedding_dim': 256, 'lr': 0.0007098066784782593, 'lambda_val': 0.00032728089418876936, 'batch_size': 2621, 'optimizer': 'Adam'}. Best is trial 61 with value: 0.12881201604315629.
2026-05-16 04:15:20,150 - experiment_functions - INFO - Early stopping at epoch 1950. Best Recall: 0.1259
2026-05-16 04:15:20,240 - optuna.study.study - INFO - Trial 125 finished with value: 0.12586477994480297 and parameters: {'n_layers': 1, 'embedding_dim': 256, 'lr': 0.00045350712288803424, 'lambda_val': 0.00020464982079215226, 'batch_size': 2355, 'optimizer': 'Adam'}. Best is trial 61 with value: 0.12881201604315629.
2026-05-16 04:15:25,098 - experiment_functions - INFO - Early stopping at epoch 500. Best Recall: 0.0016
2026-05-16 04:15:25,232 - optuna.study.study - INFO - Trial 126 finished with value: 0.0015652357033012917 and parameters: {'n_layers': 4, 'embedding_dim': 256, 'lr': 0.0008967868908853786, 'lambda_val': 0.00023211741620279613, 'batch_size': 2336, 'optimizer': 'SGD'}. Best is trial 61 with value: 0.12881201604315629.
2026-05-16 04:15:34,426 - experiment_functions - INFO - Early stopping at epoch 1550. Best Recall: 0.1218
2026-05-16 04:15:34,507 - optuna.study.study - INFO - Trial 127 finished with value: 0.12182519993633595 and parameters: {'n_layers': 1, 'embedding_dim': 96, 'lr': 0.0005546556259587104, 'lambda_val': 0.00043441304916423586, 'batch_size': 2150, 'optimizer': 'Adam'}. Best is trial 61 with value: 0.12881201604315629.
2026-05-16 04:15:40,531 - optuna.study._optimize - INFO - Trial 128 pruned. 
2026-05-16 04:15:46,764 - optuna.study._optimize - INFO - Trial 129 pruned. 
2026-05-16 04:15:52,911 - optuna.study._optimize - INFO - Trial 130 pruned. 
2026-05-16 04:16:02,733 - experiment_functions - INFO - Early stopping at epoch 1700. Best Recall: 0.1131
2026-05-16 04:16:02,842 - optuna.study.study - INFO - Trial 131 finished with value: 0.11313070223159416 and parameters: {'n_layers': 1, 'embedding_dim': 96, 'lr': 0.0006120416722785536, 'lambda_val': 7.975869088967534e-05, 'batch_size': 1997, 'optimizer': 'Adam'}. Best is trial 61 with value: 0.12881201604315629.
2026-05-16 04:16:22,812 - experiment_functions - INFO - Early stopping at epoch 3300. Best Recall: 0.1224
2026-05-16 04:16:22,911 - optuna.study.study - INFO - Trial 132 finished with value: 0.1223955228679355 and parameters: {'n_layers': 1, 'embedding_dim': 256, 'lr': 0.00031214041932785453, 'lambda_val': 0.00015098130164219192, 'batch_size': 2494, 'optimizer': 'Adam'}. Best is trial 61 with value: 0.12881201604315629.
2026-05-16 04:16:30,949 - optuna.study._optimize - INFO - Trial 133 pruned. 
2026-05-16 04:16:37,353 - optuna.study._optimize - INFO - Trial 134 pruned. 
2026-05-16 04:16:43,917 - optuna.study._optimize - INFO - Trial 135 pruned. 
2026-05-16 04:16:53,947 - experiment_functions - INFO - Early stopping at epoch 1650. Best Recall: 0.1126
2026-05-16 04:16:54,047 - optuna.study.study - INFO - Trial 136 finished with value: 0.11264002461525124 and parameters: {'n_layers': 1, 'embedding_dim': 256, 'lr': 0.00040472899635283474, 'lambda_val': 0.0004116931559470267, 'batch_size': 2548, 'optimizer': 'Adam'}. Best is trial 61 with value: 0.12881201604315629.
2026-05-16 04:17:04,919 - experiment_functions - INFO - Early stopping at epoch 1900. Best Recall: 0.1188
2026-05-16 04:17:05,009 - optuna.study.study - INFO - Trial 137 finished with value: 0.11875362502593652 and parameters: {'n_layers': 1, 'embedding_dim': 128, 'lr': 0.0005473443893517076, 'lambda_val': 0.0009589900483217894, 'batch_size': 2154, 'optimizer': 'Adam'}. Best is trial 61 with value: 0.12881201604315629.
2026-05-16 04:17:11,642 - experiment_functions - INFO - Early stopping at epoch 1050. Best Recall: 0.1166
2026-05-16 04:17:11,742 - optuna.study.study - INFO - Trial 138 finished with value: 0.11663017599341832 and parameters: {'n_layers': 1, 'embedding_dim': 256, 'lr': 0.000721759659889772, 'lambda_val': 7.048773803843296e-06, 'batch_size': 1851, 'optimizer': 'Adam'}. Best is trial 61 with value: 0.12881201604315629.
2026-05-16 04:17:16,969 - experiment_functions - INFO - Early stopping at epoch 750. Best Recall: 0.1128
2026-05-16 04:17:17,080 - optuna.study.study - INFO - Trial 139 finished with value: 0.11276961822280884 and parameters: {'n_layers': 1, 'embedding_dim': 256, 'lr': 0.0014941299107836287, 'lambda_val': 0.00017247794512695647, 'batch_size': 3790, 'optimizer': 'Adam'}. Best is trial 61 with value: 0.12881201604315629.
2026-05-16 04:17:23,762 - experiment_functions - INFO - Early stopping at epoch 900. Best Recall: 0.1109
2026-05-16 04:17:23,861 - optuna.study.study - INFO - Trial 140 finished with value: 0.11088958869192858 and parameters: {'n_layers': 1, 'embedding_dim': 256, 'lr': 0.0010499636124451605, 'lambda_val': 1.3336252960186048e-05, 'batch_size': 2803, 'optimizer': 'Adam'}. Best is trial 61 with value: 0.12881201604315629.
2026-05-16 04:17:51,649 - experiment_functions - INFO - Early stopping at epoch 2250. Best Recall: 0.1192
2026-05-16 04:17:51,739 - optuna.study.study - INFO - Trial 141 finished with value: 0.1192249119731691 and parameters: {'n_layers': 1, 'embedding_dim': 256, 'lr': 0.00043982239916433053, 'lambda_val': 4.554927397787172e-05, 'batch_size': 2288, 'optimizer': 'Adam'}. Best is trial 61 with value: 0.12881201604315629.
2026-05-16 04:18:01,635 - experiment_functions - INFO - Early stopping at epoch 1650. Best Recall: 0.1201
2026-05-16 04:18:01,725 - optuna.study.study - INFO - Trial 142 finished with value: 0.12009774371438565 and parameters: {'n_layers': 1, 'embedding_dim': 256, 'lr': 0.0004330370240959703, 'lambda_val': 9.234311789423874e-05, 'batch_size': 2286, 'optimizer': 'Adam'}. Best is trial 61 with value: 0.12881201604315629.
2026-05-16 04:18:08,948 - optuna.study._optimize - INFO - Trial 143 pruned. 
2026-05-16 04:18:17,027 - optuna.study._optimize - INFO - Trial 144 pruned. 
2026-05-16 04:18:26,825 - experiment_functions - INFO - Early stopping at epoch 1450. Best Recall: 0.1135
2026-05-16 04:18:26,914 - optuna.study.study - INFO - Trial 145 finished with value: 0.11351229714068194 and parameters: {'n_layers': 1, 'embedding_dim': 256, 'lr': 0.0006210559545117917, 'lambda_val': 0.0002515110067637431, 'batch_size': 2556, 'optimizer': 'Adam'}. Best is trial 61 with value: 0.12881201604315629.
2026-05-16 04:18:32,570 - optuna.study._optimize - INFO - Trial 146 pruned. 
2026-05-16 04:18:39,344 - optuna.study._optimize - INFO - Trial 147 pruned. 
2026-05-16 04:18:56,956 - experiment_functions - INFO - Early stopping at epoch 2700. Best Recall: 0.1255
2026-05-16 04:18:57,058 - optuna.study.study - INFO - Trial 148 finished with value: 0.12547071489319925 and parameters: {'n_layers': 1, 'embedding_dim': 256, 'lr': 0.00034793293446984, 'lambda_val': 7.563041415081581e-05, 'batch_size': 2624, 'optimizer': 'Adam'}. Best is trial 61 with value: 0.12881201604315629.
2026-05-16 04:19:00,188 - experiment_functions - INFO - Early stopping at epoch 500. Best Recall: 0.0035
2026-05-16 04:19:00,279 - optuna.study.study - INFO - Trial 149 finished with value: 0.0034767170691460676 and parameters: {'n_layers': 1, 'embedding_dim': 32, 'lr': 0.00034667001798029633, 'lambda_val': 6.80432368128533e-05, 'batch_size': 2603, 'optimizer': 'SGD'}. Best is trial 61 with value: 0.12881201604315629.
2026-05-16 04:19:14,396 - experiment_functions - INFO - Early stopping at epoch 2100. Best Recall: 0.1221
2026-05-16 04:19:14,494 - optuna.study.study - INFO - Trial 150 finished with value: 0.12205060039155942 and parameters: {'n_layers': 1, 'embedding_dim': 256, 'lr': 0.0004200285351474649, 'lambda_val': 0.00010020665999406493, 'batch_size': 2434, 'optimizer': 'Adam'}. Best is trial 61 with value: 0.12881201604315629.
2026-05-16 04:19:24,155 - experiment_functions - INFO - Early stopping at epoch 1450. Best Recall: 0.1196
2026-05-16 04:19:24,262 - optuna.study.study - INFO - Trial 151 finished with value: 0.11961997770261001 and parameters: {'n_layers': 1, 'embedding_dim': 256, 'lr': 0.00043378322006309744, 'lambda_val': 9.511388237644002e-05, 'batch_size': 2452, 'optimizer': 'Adam'}. Best is trial 61 with value: 0.12881201604315629.
2026-05-16 04:19:34,951 - experiment_functions - INFO - Early stopping at epoch 1750. Best Recall: 0.1181
2026-05-16 04:19:35,097 - optuna.study.study - INFO - Trial 152 finished with value: 0.11811620914195366 and parameters: {'n_layers': 1, 'embedding_dim': 256, 'lr': 0.0005215915412065076, 'lambda_val': 0.0001440581968469306, 'batch_size': 2304, 'optimizer': 'Adam'}. Best is trial 61 with value: 0.12881201604315629.
2026-05-16 04:19:59,499 - optuna.study.study - INFO - Trial 153 finished with value: 0.1258547602143321 and parameters: {'n_layers': 1, 'embedding_dim': 256, 'lr': 0.00032815688477212825, 'lambda_val': 0.00021746232724632615, 'batch_size': 2396, 'optimizer': 'Adam'}. Best is trial 61 with value: 0.12881201604315629.
2026-05-16 04:20:07,656 - optuna.study._optimize - INFO - Trial 154 pruned. 
2026-05-16 04:20:14,095 - optuna.study._optimize - INFO - Trial 155 pruned. 
2026-05-16 04:20:25,755 - experiment_functions - INFO - Early stopping at epoch 1500. Best Recall: 0.1204
2026-05-16 04:20:25,844 - optuna.study.study - INFO - Trial 156 finished with value: 0.1203767376857257 and parameters: {'n_layers': 1, 'embedding_dim': 256, 'lr': 0.00042773033847843536, 'lambda_val': 0.00019065487205685157, 'batch_size': 2362, 'optimizer': 'Adam'}. Best is trial 61 with value: 0.12881201604315629.
2026-05-16 04:20:33,336 - experiment_functions - INFO - Early stopping at epoch 900. Best Recall: 0.0615
2026-05-16 04:20:33,446 - optuna.study.study - INFO - Trial 157 finished with value: 0.06152637735095111 and parameters: {'n_layers': 3, 'embedding_dim': 256, 'lr': 0.000370875424661705, 'lambda_val': 0.0001649329653312657, 'batch_size': 2375, 'optimizer': 'Adam'}. Best is trial 61 with value: 0.12881201604315629.
2026-05-16 04:20:39,619 - optuna.study._optimize - INFO - Trial 158 pruned. 
2026-05-16 04:20:46,617 - optuna.study._optimize - INFO - Trial 159 pruned. 
2026-05-16 04:20:53,053 - optuna.study._optimize - INFO - Trial 160 pruned. 
2026-05-16 04:21:03,794 - experiment_functions - INFO - Early stopping at epoch 1700. Best Recall: 0.1225
2026-05-16 04:21:03,891 - optuna.study.study - INFO - Trial 161 finished with value: 0.12252227799008787 and parameters: {'n_layers': 1, 'embedding_dim': 256, 'lr': 0.0004497765598117611, 'lambda_val': 0.00030729654962777773, 'batch_size': 2555, 'optimizer': 'Adam'}. Best is trial 61 with value: 0.12881201604315629.
2026-05-16 04:21:11,151 - optuna.study._optimize - INFO - Trial 162 pruned. 
2026-05-16 04:21:28,806 - experiment_functions - INFO - Early stopping at epoch 2950. Best Recall: 0.1230
2026-05-16 04:21:28,950 - optuna.study.study - INFO - Trial 163 finished with value: 0.12299026180971905 and parameters: {'n_layers': 1, 'embedding_dim': 256, 'lr': 0.00044107846068181726, 'lambda_val': 0.00013625456294952767, 'batch_size': 2214, 'optimizer': 'Adam'}. Best is trial 61 with value: 0.12881201604315629.
2026-05-16 04:21:45,676 - experiment_functions - INFO - Early stopping at epoch 2650. Best Recall: 0.1225
2026-05-16 04:21:45,766 - optuna.study.study - INFO - Trial 164 finished with value: 0.1225391172359558 and parameters: {'n_layers': 1, 'embedding_dim': 256, 'lr': 0.0004148980183416182, 'lambda_val': 0.000124573667496924, 'batch_size': 2332, 'optimizer': 'Adam'}. Best is trial 61 with value: 0.12881201604315629.
2026-05-16 04:21:52,505 - optuna.study._optimize - INFO - Trial 165 pruned. 
2026-05-16 04:21:58,860 - optuna.study._optimize - INFO - Trial 166 pruned. 
2026-05-16 04:22:05,387 - optuna.study._optimize - INFO - Trial 167 pruned. 
2026-05-16 04:22:26,783 - experiment_functions - INFO - Early stopping at epoch 3250. Best Recall: 0.1307
2026-05-16 04:22:27,075 - optuna.study.study - INFO - Trial 168 finished with value: 0.1307238454685406 and parameters: {'n_layers': 1, 'embedding_dim': 256, 'lr': 0.00042560124892413245, 'lambda_val': 0.00047749327622703214, 'batch_size': 2338, 'optimizer': 'Adam'}. Best is trial 168 with value: 0.1307238454685406.
2026-05-16 04:22:41,761 - experiment_functions - INFO - Early stopping at epoch 2050. Best Recall: 0.1203
2026-05-16 04:22:41,862 - optuna.study.study - INFO - Trial 169 finished with value: 0.12028070000592998 and parameters: {'n_layers': 1, 'embedding_dim': 256, 'lr': 0.000491014485836867, 'lambda_val': 0.0005131787677353245, 'batch_size': 2030, 'optimizer': 'Adam'}. Best is trial 168 with value: 0.1307238454685406.
2026-05-16 04:22:48,797 - optuna.study._optimize - INFO - Trial 170 pruned. 
2026-05-16 04:22:55,956 - optuna.study._optimize - INFO - Trial 171 pruned. 
2026-05-16 04:23:03,276 - optuna.study._optimize - INFO - Trial 172 pruned. 
2026-05-16 04:23:12,911 - optuna.study._optimize - INFO - Trial 173 pruned. 
2026-05-16 04:23:22,074 - optuna.study._optimize - INFO - Trial 174 pruned. 
2026-05-16 04:23:28,766 - optuna.study._optimize - INFO - Trial 175 pruned. 
2026-05-16 04:23:35,397 - optuna.study._optimize - INFO - Trial 176 pruned. 
2026-05-16 04:23:44,000 - experiment_functions - INFO - Early stopping at epoch 1200. Best Recall: 0.1143
2026-05-16 04:23:44,079 - optuna.study.study - INFO - Trial 177 finished with value: 0.11434784161401454 and parameters: {'n_layers': 1, 'embedding_dim': 256, 'lr': 0.000630779631593642, 'lambda_val': 0.00015170605771290709, 'batch_size': 2653, 'optimizer': 'Adam'}. Best is trial 168 with value: 0.1307238454685406.
