2026-05-16 01:25:51,024 - optuna.study.study - INFO - Trial 142 finished with value: 0.09267296412622138 and parameters: {'n_layers': 1, 'embedding_dim': 256, 'lr': 0.0015692156626199633, 'lambda_val': 1.8023575568135763e-06, 'batch_size': 2069, 'optimizer': 'Adam'}. Best is trial 117 with value: 0.0974664928059682.
2026-05-16 01:25:57,768 - experiment_functions - INFO - Early stopping at epoch 1050. Best Recall: 0.0847
2026-05-16 01:25:57,903 - optuna.study.study - INFO - Trial 143 finished with value: 0.08466389783112 and parameters: {'n_layers': 1, 'embedding_dim': 256, 'lr': 0.0014690805286606725, 'lambda_val': 1.9655826724084724e-06, 'batch_size': 2219, 'optimizer': 'Adam'}. Best is trial 117 with value: 0.0974664928059682.
2026-05-16 01:26:09,770 - experiment_functions - INFO - Early stopping at epoch 1800. Best Recall: 0.0869
2026-05-16 01:26:09,869 - optuna.study.study - INFO - Trial 144 finished with value: 0.08688609139607359 and parameters: {'n_layers': 1, 'embedding_dim': 256, 'lr': 0.0012730933738187226, 'lambda_val': 3.316271148382134e-06, 'batch_size': 2031, 'optimizer': 'Adam'}. Best is trial 117 with value: 0.0974664928059682.
2026-05-16 01:26:15,814 - experiment_functions - INFO - Early stopping at epoch 850. Best Recall: 0.0755
2026-05-16 01:26:15,913 - optuna.study.study - INFO - Trial 145 finished with value: 0.07552295264026485 and parameters: {'n_layers': 1, 'embedding_dim': 256, 'lr': 0.002834138270166797, 'lambda_val': 4.704728079293504e-06, 'batch_size': 2088, 'optimizer': 'Adam'}. Best is trial 117 with value: 0.0974664928059682.
2026-05-16 01:26:22,997 - optuna.study._optimize - INFO - Trial 146 pruned. 
2026-05-16 01:26:30,142 - optuna.study._optimize - INFO - Trial 147 pruned. 
2026-05-16 01:26:50,002 - experiment_functions - INFO - Early stopping at epoch 3350. Best Recall: 0.0915
2026-05-16 01:26:50,092 - optuna.study.study - INFO - Trial 148 finished with value: 0.09154378326501497 and parameters: {'n_layers': 1, 'embedding_dim': 256, 'lr': 0.0008979193667853047, 'lambda_val': 3.9486226315131785e-06, 'batch_size': 2125, 'optimizer': 'Adam'}. Best is trial 117 with value: 0.0974664928059682.
2026-05-16 01:26:56,712 - optuna.study._optimize - INFO - Trial 149 pruned. 
2026-05-16 01:27:05,837 - experiment_functions - INFO - Early stopping at epoch 1400. Best Recall: 0.0929
2026-05-16 01:27:05,926 - optuna.study.study - INFO - Trial 150 finished with value: 0.0928754023970203 and parameters: {'n_layers': 1, 'embedding_dim': 256, 'lr': 0.0009238574685382816, 'lambda_val': 4.100338432840701e-06, 'batch_size': 2284, 'optimizer': 'Adam'}. Best is trial 117 with value: 0.0974664928059682.
2026-05-16 01:27:12,804 - optuna.study._optimize - INFO - Trial 151 pruned. 
2026-05-16 01:27:19,572 - optuna.study._optimize - INFO - Trial 152 pruned. 
2026-05-16 01:27:35,257 - optuna.study._optimize - INFO - Trial 153 pruned. 
2026-05-16 01:27:45,276 - experiment_functions - INFO - Early stopping at epoch 1650. Best Recall: 0.0874
2026-05-16 01:27:45,366 - optuna.study.study - INFO - Trial 154 finished with value: 0.08738347256697966 and parameters: {'n_layers': 1, 'embedding_dim': 256, 'lr': 0.001170014149475072, 'lambda_val': 2.249119980794329e-06, 'batch_size': 2152, 'optimizer': 'Adam'}. Best is trial 117 with value: 0.0974664928059682.
2026-05-16 01:27:52,254 - optuna.study._optimize - INFO - Trial 155 pruned. 
2026-05-16 01:27:58,845 - optuna.study._optimize - INFO - Trial 156 pruned. 
2026-05-16 01:28:05,870 - optuna.study._optimize - INFO - Trial 157 pruned. 
2026-05-16 01:28:16,210 - optuna.study._optimize - INFO - Trial 158 pruned. 
2026-05-16 01:28:23,198 - optuna.study._optimize - INFO - Trial 159 pruned. 
2026-05-16 01:28:29,974 - optuna.study._optimize - INFO - Trial 160 pruned. 
2026-05-16 01:28:41,306 - experiment_functions - INFO - Early stopping at epoch 1300. Best Recall: 0.0829
2026-05-16 01:28:42,069 - optuna.study.study - INFO - Trial 161 finished with value: 0.08294756210077657 and parameters: {'n_layers': 1, 'embedding_dim': 256, 'lr': 0.0014830096313723376, 'lambda_val': 8.167092597179215e-06, 'batch_size': 1714, 'optimizer': 'Adam'}. Best is trial 117 with value: 0.0974664928059682.
2026-05-16 01:28:57,550 - experiment_functions - INFO - Early stopping at epoch 1350. Best Recall: 0.0890
2026-05-16 01:28:57,628 - optuna.study.study - INFO - Trial 162 finished with value: 0.08897154796300245 and parameters: {'n_layers': 1, 'embedding_dim': 256, 'lr': 0.0016522912542295824, 'lambda_val': 6.839972298201446e-06, 'batch_size': 1868, 'optimizer': 'Adam'}. Best is trial 117 with value: 0.0974664928059682.
2026-05-16 01:29:03,936 - experiment_functions - INFO - Early stopping at epoch 850. Best Recall: 0.0845
2026-05-16 01:29:04,014 - optuna.study.study - INFO - Trial 163 finished with value: 0.0845088930620437 and parameters: {'n_layers': 1, 'embedding_dim': 256, 'lr': 0.002334162642714357, 'lambda_val': 1.3265003091778411e-05, 'batch_size': 1882, 'optimizer': 'Adam'}. Best is trial 117 with value: 0.0974664928059682.
2026-05-16 01:29:15,767 - experiment_functions - INFO - Early stopping at epoch 1750. Best Recall: 0.0947
2026-05-16 01:29:15,866 - optuna.study.study - INFO - Trial 164 finished with value: 0.09466674142270082 and parameters: {'n_layers': 1, 'embedding_dim': 256, 'lr': 0.0008775184346790116, 'lambda_val': 6.734696032165347e-06, 'batch_size': 1995, 'optimizer': 'Adam'}. Best is trial 117 with value: 0.0974664928059682.
2026-05-16 01:29:21,850 - experiment_functions - INFO - Early stopping at epoch 850. Best Recall: 0.0609
2026-05-16 01:29:21,970 - optuna.study.study - INFO - Trial 165 finished with value: 0.060904088300547665 and parameters: {'n_layers': 1, 'embedding_dim': 32, 'lr': 0.001652154967356766, 'lambda_val': 6.881087157426139e-06, 'batch_size': 1949, 'optimizer': 'Adam'}. Best is trial 117 with value: 0.0974664928059682.
2026-05-16 01:29:30,553 - optuna.study._optimize - INFO - Trial 166 pruned. 
2026-05-16 01:29:34,318 - experiment_functions - INFO - Early stopping at epoch 500. Best Recall: 0.0020
2026-05-16 01:29:34,397 - optuna.study.study - INFO - Trial 167 finished with value: 0.0019545868599124107 and parameters: {'n_layers': 1, 'embedding_dim': 256, 'lr': 0.00035870259472918834, 'lambda_val': 5.648465500291287e-06, 'batch_size': 2232, 'optimizer': 'SGD'}. Best is trial 117 with value: 0.0974664928059682.
2026-05-16 01:29:46,914 - optuna.study._optimize - INFO - Trial 168 pruned. 
2026-05-16 01:29:56,400 - optuna.study._optimize - INFO - Trial 169 pruned. 
2026-05-16 01:30:03,199 - optuna.study._optimize - INFO - Trial 170 pruned. 
2026-05-16 01:30:16,051 - experiment_functions - INFO - Early stopping at epoch 2000. Best Recall: 0.0923
2026-05-16 01:30:16,140 - optuna.study.study - INFO - Trial 171 finished with value: 0.0923419820369663 and parameters: {'n_layers': 1, 'embedding_dim': 256, 'lr': 0.0009270945134019213, 'lambda_val': 3.77874817524977e-06, 'batch_size': 2021, 'optimizer': 'Adam'}. Best is trial 117 with value: 0.0974664928059682.
2026-05-16 01:30:24,945 - experiment_functions - INFO - Early stopping at epoch 1400. Best Recall: 0.0877
2026-05-16 01:30:26,990 - optuna.study.study - INFO - Trial 172 finished with value: 0.08774520613166853 and parameters: {'n_layers': 1, 'embedding_dim': 256, 'lr': 0.0010609587498089119, 'lambda_val': 3.6866236241942735e-06, 'batch_size': 1967, 'optimizer': 'Adam'}. Best is trial 117 with value: 0.0974664928059682.
2026-05-16 01:30:33,675 - optuna.study._optimize - INFO - Trial 173 pruned. 
2026-05-16 01:30:39,727 - experiment_functions - INFO - Early stopping at epoch 700. Best Recall: 0.0454
2026-05-16 01:30:39,806 - optuna.study.study - INFO - Trial 174 finished with value: 0.04538442637029368 and parameters: {'n_layers': 3, 'embedding_dim': 256, 'lr': 0.0014125169048048495, 'lambda_val': 2.3690939710392538e-06, 'batch_size': 2126, 'optimizer': 'Adam'}. Best is trial 117 with value: 0.0974664928059682.
2026-05-16 01:30:45,040 - experiment_functions - INFO - Early stopping at epoch 600. Best Recall: 0.0288
2026-05-16 01:30:45,138 - optuna.study.study - INFO - Trial 175 finished with value: 0.028832560854115008 and parameters: {'n_layers': 4, 'embedding_dim': 128, 'lr': 0.0011951267452316588, 'lambda_val': 1.0593076962000898e-05, 'batch_size': 2267, 'optimizer': 'Adam'}. Best is trial 117 with value: 0.0974664928059682.
2026-05-16 01:30:55,592 - optuna.study._optimize - INFO - Trial 176 pruned. 
2026-05-16 01:31:07,657 - optuna.study._optimize - INFO - Trial 177 pruned. 
2026-05-16 01:31:14,683 - optuna.study._optimize - INFO - Trial 178 pruned. 
2026-05-16 01:31:21,343 - optuna.study._optimize - INFO - Trial 179 pruned. 
2026-05-16 01:31:27,969 - optuna.study._optimize - INFO - Trial 180 pruned. 
2026-05-16 01:31:40,637 - experiment_functions - INFO - Early stopping at epoch 2050. Best Recall: 0.0920
2026-05-16 01:31:40,748 - optuna.study.study - INFO - Trial 181 finished with value: 0.09199540783000501 and parameters: {'n_layers': 1, 'embedding_dim': 256, 'lr': 0.0009467920607860175, 'lambda_val': 4.2027923959362055e-06, 'batch_size': 2046, 'optimizer': 'Adam'}. Best is trial 117 with value: 0.0974664928059682.
2026-05-16 01:31:47,585 - optuna.study._optimize - INFO - Trial 182 pruned. 
2026-05-16 01:31:54,458 - optuna.study._optimize - INFO - Trial 183 pruned. 
2026-05-16 01:32:01,056 - optuna.study._optimize - INFO - Trial 184 pruned. 
2026-05-16 01:32:09,488 - optuna.study._optimize - INFO - Trial 185 pruned. 
2026-05-16 01:32:16,386 - optuna.study._optimize - INFO - Trial 186 pruned. 
2026-05-16 01:32:24,883 - experiment_functions - INFO - Early stopping at epoch 1300. Best Recall: 0.0883
2026-05-16 01:32:24,961 - optuna.study.study - INFO - Trial 187 finished with value: 0.0883432193257395 and parameters: {'n_layers': 1, 'embedding_dim': 256, 'lr': 0.001233733162622733, 'lambda_val': 1.2498196560481826e-06, 'batch_size': 1993, 'optimizer': 'Adam'}. Best is trial 117 with value: 0.0974664928059682.
2026-05-16 01:32:32,414 - experiment_functions - INFO - Early stopping at epoch 1200. Best Recall: 0.0894
2026-05-16 01:32:32,549 - optuna.study.study - INFO - Trial 188 finished with value: 0.08941645779763092 and parameters: {'n_layers': 1, 'embedding_dim': 256, 'lr': 0.0015567840856961783, 'lambda_val': 4.326330586015574e-06, 'batch_size': 1814, 'optimizer': 'Adam'}. Best is trial 117 with value: 0.0974664928059682.
2026-05-16 01:32:58,567 - experiment_functions - INFO - Early stopping at epoch 2600. Best Recall: 0.0925
2026-05-16 01:32:58,656 - optuna.study.study - INFO - Trial 189 finished with value: 0.09248784953502262 and parameters: {'n_layers': 1, 'embedding_dim': 256, 'lr': 0.0008414426678331792, 'lambda_val': 4.616093084631849e-06, 'batch_size': 1679, 'optimizer': 'Adam'}. Best is trial 117 with value: 0.0974664928059682.
2026-05-16 01:33:11,428 - experiment_functions - INFO - Early stopping at epoch 2050. Best Recall: 0.0942
2026-05-16 01:33:11,526 - optuna.study.study - INFO - Trial 190 finished with value: 0.09418013198386681 and parameters: {'n_layers': 1, 'embedding_dim': 256, 'lr': 0.0008941119349533599, 'lambda_val': 4.254186499799547e-06, 'batch_size': 1692, 'optimizer': 'Adam'}. Best is trial 117 with value: 0.0974664928059682.
2026-05-16 01:33:22,656 - experiment_functions - INFO - Early stopping at epoch 1650. Best Recall: 0.0899
2026-05-16 01:33:22,734 - optuna.study.study - INFO - Trial 191 finished with value: 0.08991814841619153 and parameters: {'n_layers': 1, 'embedding_dim': 256, 'lr': 0.0008241156644570215, 'lambda_val': 4.28892606220151e-06, 'batch_size': 1757, 'optimizer': 'Adam'}. Best is trial 117 with value: 0.0974664928059682.
2026-05-16 01:33:29,286 - optuna.study._optimize - INFO - Trial 192 pruned. 
2026-05-16 01:33:36,413 - optuna.study._optimize - INFO - Trial 193 pruned. 
2026-05-16 01:33:45,336 - experiment_functions - INFO - Early stopping at epoch 1350. Best Recall: 0.0862
2026-05-16 01:33:45,433 - optuna.study.study - INFO - Trial 194 finished with value: 0.08616865264522136 and parameters: {'n_layers': 1, 'embedding_dim': 256, 'lr': 0.0011208009974605002, 'lambda_val': 5.14589632499317e-06, 'batch_size': 1781, 'optimizer': 'Adam'}. Best is trial 117 with value: 0.0974664928059682.
2026-05-16 01:33:51,956 - optuna.study._optimize - INFO - Trial 195 pruned. 
2026-05-16 01:34:11,965 - experiment_functions - INFO - Early stopping at epoch 2000. Best Recall: 0.0933
2026-05-16 01:34:12,065 - optuna.study.study - INFO - Trial 196 finished with value: 0.09327407940002046 and parameters: {'n_layers': 1, 'embedding_dim': 256, 'lr': 0.0009545875546674929, 'lambda_val': 3.2924592785893665e-06, 'batch_size': 2084, 'optimizer': 'Adam'}. Best is trial 117 with value: 0.0974664928059682.
2026-05-16 01:34:25,258 - optuna.study._optimize - INFO - Trial 197 pruned. 
2026-05-16 01:34:31,277 - optuna.study._optimize - INFO - Trial 198 pruned. 
2026-05-16 01:34:37,797 - optuna.study._optimize - INFO - Trial 199 pruned. 
2026-05-16 01:34:41,638 - experiment_functions - INFO - Early stopping at epoch 500. Best Recall: 0.0027
2026-05-16 01:34:41,751 - optuna.study.study - INFO - Trial 200 finished with value: 0.002740610788259672 and parameters: {'n_layers': 1, 'embedding_dim': 256, 'lr': 0.001151726428344977, 'lambda_val': 2.6185401020028863e-06, 'batch_size': 1572, 'optimizer': 'SGD'}. Best is trial 117 with value: 0.0974664928059682.
2026-05-16 01:34:59,899 - experiment_functions - INFO - Early stopping at epoch 1750. Best Recall: 0.0875
2026-05-16 01:34:59,998 - optuna.study.study - INFO - Trial 201 finished with value: 0.0875126335540626 and parameters: {'n_layers': 1, 'embedding_dim': 256, 'lr': 0.00096858264375223, 'lambda_val': 5.012755143424459e-06, 'batch_size': 2049, 'optimizer': 'Adam'}. Best is trial 117 with value: 0.0974664928059682.
2026-05-16 01:35:08,046 - optuna.study._optimize - INFO - Trial 202 pruned. 
2026-05-16 01:35:30,154 - experiment_functions - INFO - Early stopping at epoch 2250. Best Recall: 0.0930
2026-05-16 01:35:30,254 - optuna.study.study - INFO - Trial 203 finished with value: 0.09297148743343187 and parameters: {'n_layers': 1, 'embedding_dim': 256, 'lr': 0.0009647412335891802, 'lambda_val': 3.359216079230953e-06, 'batch_size': 2122, 'optimizer': 'Adam'}. Best is trial 117 with value: 0.0974664928059682.
2026-05-16 01:35:37,288 - optuna.study._optimize - INFO - Trial 204 pruned. 
2026-05-16 01:35:44,713 - optuna.study._optimize - INFO - Trial 205 pruned. 
2026-05-16 01:35:58,693 - optuna.study._optimize - INFO - Trial 206 pruned. 
2026-05-16 01:36:04,148 - experiment_functions - INFO - Early stopping at epoch 700. Best Recall: 0.0464
2026-05-16 01:36:04,249 - optuna.study.study - INFO - Trial 207 finished with value: 0.046428615618670024 and parameters: {'n_layers': 2, 'embedding_dim': 256, 'lr': 0.0009212121744209209, 'lambda_val': 2.7384056180619975e-06, 'batch_size': 2254, 'optimizer': 'Adam'}. Best is trial 117 with value: 0.0974664928059682.
2026-05-16 01:36:11,351 - optuna.study._optimize - INFO - Trial 208 pruned. 
2026-05-16 01:36:28,002 - experiment_functions - INFO - Early stopping at epoch 2400. Best Recall: 0.0942
2026-05-16 01:36:28,100 - optuna.study.study - INFO - Trial 209 finished with value: 0.09416839202830449 and parameters: {'n_layers': 1, 'embedding_dim': 256, 'lr': 0.0008731502594880406, 'lambda_val': 6.220985268576523e-06, 'batch_size': 2409, 'optimizer': 'Adam'}. Best is trial 117 with value: 0.0974664928059682.
2026-05-16 01:36:34,433 - optuna.study._optimize - INFO - Trial 210 pruned. 
2026-05-16 01:36:42,050 - optuna.study._optimize - INFO - Trial 211 pruned. 
2026-05-16 01:36:50,012 - optuna.study._optimize - INFO - Trial 212 pruned. 
2026-05-16 01:36:57,244 - optuna.study._optimize - INFO - Trial 213 pruned. 
2026-05-16 01:37:04,556 - optuna.study._optimize - INFO - Trial 214 pruned. 
2026-05-16 01:37:14,024 - experiment_functions - INFO - Early stopping at epoch 1550. Best Recall: 0.0920
2026-05-16 01:37:14,103 - optuna.study.study - INFO - Trial 215 finished with value: 0.09195686177895275 and parameters: {'n_layers': 1, 'embedding_dim': 256, 'lr': 0.0008516935805908689, 'lambda_val': 2.1237146920600657e-06, 'batch_size': 2202, 'optimizer': 'Adam'}. Best is trial 117 with value: 0.0974664928059682.
2026-05-16 01:37:23,115 - experiment_functions - INFO - Early stopping at epoch 750. Best Recall: 0.0690
2026-05-16 01:37:23,878 - optuna.study.study - INFO - Trial 216 finished with value: 0.0690425943769288 and parameters: {'n_layers': 1, 'embedding_dim': 256, 'lr': 0.0010567924014779073, 'lambda_val': 1.6260019839139937e-06, 'batch_size': 2197, 'optimizer': 'Adam'}. Best is trial 117 with value: 0.0974664928059682.
2026-05-16 01:37:38,357 - optuna.study._optimize - INFO - Trial 217 pruned. 
2026-05-16 01:37:52,640 - experiment_functions - INFO - Early stopping at epoch 1700. Best Recall: 0.1029
2026-05-16 01:37:52,733 - optuna.study.study - INFO - Trial 218 finished with value: 0.10292852157757772 and parameters: {'n_layers': 1, 'embedding_dim': 256, 'lr': 0.0008566312941509713, 'lambda_val': 2.2398086268249617e-06, 'batch_size': 2109, 'optimizer': 'Adam'}. Best is trial 218 with value: 0.10292852157757772.
2026-05-16 01:38:02,990 - experiment_functions - INFO - Early stopping at epoch 1650. Best Recall: 0.0910
2026-05-16 01:38:03,088 - optuna.study.study - INFO - Trial 219 finished with value: 0.09101837047864844 and parameters: {'n_layers': 1, 'embedding_dim': 256, 'lr': 0.0007627552133211903, 'lambda_val': 2.226770492468602e-06, 'batch_size': 2609, 'optimizer': 'Adam'}. Best is trial 218 with value: 0.10292852157757772.
2026-05-16 01:38:12,391 - optuna.study._optimize - INFO - Trial 220 pruned. 
2026-05-16 01:38:23,687 - optuna.study._optimize - INFO - Trial 221 pruned. 
2026-05-16 01:38:30,267 - optuna.study._optimize - INFO - Trial 222 pruned. 
2026-05-16 01:38:37,306 - optuna.study._optimize - INFO - Trial 223 pruned. 
2026-05-16 01:38:48,089 - experiment_functions - INFO - Early stopping at epoch 1750. Best Recall: 0.0934
2026-05-16 01:38:48,180 - optuna.study.study - INFO - Trial 224 finished with value: 0.09335066930805798 and parameters: {'n_layers': 1, 'embedding_dim': 256, 'lr': 0.0010040873375260734, 'lambda_val': 2.262687302905134e-06, 'batch_size': 2063, 'optimizer': 'Adam'}. Best is trial 218 with value: 0.10292852157757772.
2026-05-16 01:38:55,165 - optuna.study._optimize - INFO - Trial 225 pruned. 
2026-05-16 01:39:12,665 - optuna.study._optimize - INFO - Trial 226 pruned. 
2026-05-16 01:39:19,642 - optuna.study._optimize - INFO - Trial 227 pruned. 
2026-05-16 01:39:26,770 - optuna.study._optimize - INFO - Trial 228 pruned. 
2026-05-16 01:39:33,224 - optuna.study._optimize - INFO - Trial 229 pruned. 
2026-05-16 01:39:43,329 - experiment_functions - INFO - Early stopping at epoch 1550. Best Recall: 0.0914
2026-05-16 01:39:43,429 - optuna.study.study - INFO - Trial 230 finished with value: 0.0913917903221337 and parameters: {'n_layers': 1, 'embedding_dim': 256, 'lr': 0.0012441703363517819, 'lambda_val': 8.01784299706387e-06, 'batch_size': 1936, 'optimizer': 'Adam'}. Best is trial 218 with value: 0.10292852157757772.
2026-05-16 01:39:53,566 - experiment_functions - INFO - Early stopping at epoch 1550. Best Recall: 0.0920
2026-05-16 01:39:53,687 - optuna.study.study - INFO - Trial 231 finished with value: 0.09201120858320488 and parameters: {'n_layers': 1, 'embedding_dim': 256, 'lr': 0.0012364161254755596, 'lambda_val': 9.06108965883749e-06, 'batch_size': 1971, 'optimizer': 'Adam'}. Best is trial 218 with value: 0.10292852157757772.
2026-05-16 01:40:03,865 - optuna.study._optimize - INFO - Trial 232 pruned. 
2026-05-16 01:40:20,019 - experiment_functions - INFO - Early stopping at epoch 2650. Best Recall: 0.0917
2026-05-16 01:40:20,538 - optuna.study.study - INFO - Trial 233 finished with value: 0.09172944713428847 and parameters: {'n_layers': 1, 'embedding_dim': 256, 'lr': 0.0011969328530604222, 'lambda_val': 8.529515173006708e-06, 'batch_size': 2004, 'optimizer': 'Adam'}. Best is trial 218 with value: 0.10292852157757772.
2026-05-16 01:40:27,594 - optuna.study._optimize - INFO - Trial 234 pruned. 
2026-05-16 01:40:44,574 - experiment_functions - INFO - Early stopping at epoch 1450. Best Recall: 0.0927
2026-05-16 01:40:44,720 - optuna.study.study - INFO - Trial 235 finished with value: 0.09273159155313457 and parameters: {'n_layers': 1, 'embedding_dim': 256, 'lr': 0.0012500883258616804, 'lambda_val': 8.257491314787219e-06, 'batch_size': 2012, 'optimizer': 'Adam'}. Best is trial 218 with value: 0.10292852157757772.
2026-05-16 01:40:56,221 - experiment_functions - INFO - Early stopping at epoch 1800. Best Recall: 0.0879
2026-05-16 01:40:56,321 - optuna.study.study - INFO - Trial 236 finished with value: 0.08794894738842773 and parameters: {'n_layers': 1, 'embedding_dim': 256, 'lr': 0.0011578806832298423, 'lambda_val': 1.0488647886707715e-05, 'batch_size': 2023, 'optimizer': 'Adam'}. Best is trial 218 with value: 0.10292852157757772.
2026-05-16 01:41:03,274 - optuna.study._optimize - INFO - Trial 237 pruned. 
2026-05-16 01:41:13,190 - experiment_functions - INFO - Early stopping at epoch 1500. Best Recall: 0.0868
2026-05-16 01:41:13,271 - optuna.study.study - INFO - Trial 238 finished with value: 0.0867891188549234 and parameters: {'n_layers': 1, 'embedding_dim': 256, 'lr': 0.0009478035654802225, 'lambda_val': 6.525882178930938e-06, 'batch_size': 1988, 'optimizer': 'Adam'}. Best is trial 218 with value: 0.10292852157757772.
2026-05-16 01:41:19,729 - optuna.study._optimize - INFO - Trial 239 pruned. 
2026-05-16 01:41:25,638 - optuna.study._optimize - INFO - Trial 240 pruned. 
2026-05-16 01:41:34,402 - experiment_functions - INFO - Early stopping at epoch 1200. Best Recall: 0.0964
