2026-05-16 07:44:53,378 - optuna.study.study - INFO - Trial 92 finished with value: 0.09250551035335376 and parameters: {'n_layers': 1, 'embedding_dim': 256, 'lr': 0.002171553726293299, 'lambda_val': 9.428185258511945e-05, 'batch_size': 953, 'optimizer': 'Adam'}. Best is trial 86 with value: 0.12653279645273968.
2026-05-16 07:45:03,963 - experiment_functions - INFO - Early stopping at epoch 1650. Best Recall: 0.1168
2026-05-16 07:45:04,063 - optuna.study.study - INFO - Trial 93 finished with value: 0.11680871186269542 and parameters: {'n_layers': 1, 'embedding_dim': 256, 'lr': 0.0007799043594368153, 'lambda_val': 0.0004612398287393752, 'batch_size': 1123, 'optimizer': 'Adam'}. Best is trial 86 with value: 0.12653279645273968.
2026-05-16 07:45:12,767 - optuna.study._optimize - INFO - Trial 94 pruned. 
2026-05-16 07:45:30,795 - experiment_functions - INFO - Early stopping at epoch 2250. Best Recall: 0.1218
2026-05-16 07:45:30,895 - optuna.study.study - INFO - Trial 95 finished with value: 0.12181593729201771 and parameters: {'n_layers': 1, 'embedding_dim': 256, 'lr': 0.0004185729730909396, 'lambda_val': 0.0002495623779938085, 'batch_size': 1625, 'optimizer': 'Adam'}. Best is trial 86 with value: 0.12653279645273968.
2026-05-16 07:45:58,702 - optuna.study.study - INFO - Trial 96 finished with value: 0.1292701130387624 and parameters: {'n_layers': 1, 'embedding_dim': 256, 'lr': 0.0003868788277001474, 'lambda_val': 0.0002719138492528692, 'batch_size': 1554, 'optimizer': 'Adam'}. Best is trial 96 with value: 0.1292701130387624.
2026-05-16 07:46:06,699 - optuna.study._optimize - INFO - Trial 97 pruned. 
2026-05-16 07:46:10,773 - experiment_functions - INFO - Early stopping at epoch 500. Best Recall: 0.0025
2026-05-16 07:46:10,864 - optuna.study.study - INFO - Trial 98 finished with value: 0.002537404422737918 and parameters: {'n_layers': 1, 'embedding_dim': 256, 'lr': 0.000299046608098619, 'lambda_val': 0.0001460226843029656, 'batch_size': 1569, 'optimizer': 'SGD'}. Best is trial 96 with value: 0.1292701130387624.
2026-05-16 07:46:17,024 - optuna.study._optimize - INFO - Trial 99 pruned. 
2026-05-16 07:46:27,823 - optuna.study._optimize - INFO - Trial 100 pruned. 
2026-05-16 07:46:39,499 - experiment_functions - INFO - Early stopping at epoch 1550. Best Recall: 0.1173
2026-05-16 07:46:39,587 - optuna.study.study - INFO - Trial 101 finished with value: 0.11730793268707557 and parameters: {'n_layers': 1, 'embedding_dim': 256, 'lr': 0.0007596633560820024, 'lambda_val': 0.0006934094924687237, 'batch_size': 718, 'optimizer': 'Adam'}. Best is trial 96 with value: 0.1292701130387624.
2026-05-16 07:46:46,863 - optuna.study._optimize - INFO - Trial 102 pruned. 
2026-05-16 07:47:04,130 - experiment_functions - INFO - Early stopping at epoch 2500. Best Recall: 0.1257
2026-05-16 07:47:04,230 - optuna.study.study - INFO - Trial 103 finished with value: 0.12565133760973773 and parameters: {'n_layers': 1, 'embedding_dim': 256, 'lr': 0.0005993265245589484, 'lambda_val': 0.0008843268054315863, 'batch_size': 1025, 'optimizer': 'Adam'}. Best is trial 96 with value: 0.1292701130387624.
2026-05-16 07:47:16,333 - experiment_functions - INFO - Early stopping at epoch 1550. Best Recall: 0.1168
2026-05-16 07:47:16,461 - optuna.study.study - INFO - Trial 104 finished with value: 0.1167851042632413 and parameters: {'n_layers': 1, 'embedding_dim': 256, 'lr': 0.000552751830158599, 'lambda_val': 0.0009998608086227772, 'batch_size': 1291, 'optimizer': 'Adam'}. Best is trial 96 with value: 0.1292701130387624.
2026-05-16 07:47:25,918 - optuna.study._optimize - INFO - Trial 105 pruned. 
2026-05-16 07:47:35,006 - optuna.study._optimize - INFO - Trial 106 pruned. 
2026-05-16 07:47:43,002 - experiment_functions - INFO - Early stopping at epoch 750. Best Recall: 0.1062
2026-05-16 07:47:43,092 - optuna.study.study - INFO - Trial 107 finished with value: 0.10621169993320231 and parameters: {'n_layers': 1, 'embedding_dim': 256, 'lr': 0.0014532808778932823, 'lambda_val': 6.927272872770964e-05, 'batch_size': 1206, 'optimizer': 'Adam'}. Best is trial 96 with value: 0.1292701130387624.
2026-05-16 07:48:02,453 - optuna.study._optimize - INFO - Trial 108 pruned. 
2026-05-16 07:48:10,318 - optuna.study._optimize - INFO - Trial 109 pruned. 
2026-05-16 07:48:16,478 - experiment_functions - INFO - Early stopping at epoch 900. Best Recall: 0.0015
2026-05-16 07:48:16,581 - optuna.study.study - INFO - Trial 110 finished with value: 0.0015468560342222061 and parameters: {'n_layers': 1, 'embedding_dim': 256, 'lr': 7.671551451072203e-05, 'lambda_val': 0.00028912862339092475, 'batch_size': 592, 'optimizer': 'Adam'}. Best is trial 96 with value: 0.1292701130387624.
2026-05-16 07:48:32,403 - experiment_functions - INFO - Early stopping at epoch 1900. Best Recall: 0.1200
2026-05-16 07:48:32,492 - optuna.study.study - INFO - Trial 111 finished with value: 0.12002782952318337 and parameters: {'n_layers': 1, 'embedding_dim': 256, 'lr': 0.0007799112762674277, 'lambda_val': 0.000734110795956814, 'batch_size': 734, 'optimizer': 'Adam'}. Best is trial 96 with value: 0.1292701130387624.
2026-05-16 07:48:43,443 - optuna.study._optimize - INFO - Trial 112 pruned. 
2026-05-16 07:48:50,405 - optuna.study._optimize - INFO - Trial 113 pruned. 
2026-05-16 07:49:00,304 - experiment_functions - INFO - Early stopping at epoch 1300. Best Recall: 0.1204
2026-05-16 07:49:00,460 - optuna.study.study - INFO - Trial 114 finished with value: 0.12039557401015835 and parameters: {'n_layers': 1, 'embedding_dim': 256, 'lr': 0.0008580901043450429, 'lambda_val': 0.000399197160508611, 'batch_size': 831, 'optimizer': 'Adam'}. Best is trial 96 with value: 0.1292701130387624.
2026-05-16 07:49:09,070 - optuna.study._optimize - INFO - Trial 115 pruned. 
2026-05-16 07:49:20,743 - experiment_functions - INFO - Early stopping at epoch 1500. Best Recall: 0.1197
2026-05-16 07:49:20,833 - optuna.study.study - INFO - Trial 116 finished with value: 0.11965627250805419 and parameters: {'n_layers': 1, 'embedding_dim': 256, 'lr': 0.0008476072382339364, 'lambda_val': 0.000928965319996129, 'batch_size': 654, 'optimizer': 'Adam'}. Best is trial 96 with value: 0.1292701130387624.
2026-05-16 07:49:28,553 - optuna.study._optimize - INFO - Trial 117 pruned. 
2026-05-16 07:49:35,144 - optuna.study._optimize - INFO - Trial 118 pruned. 
2026-05-16 07:49:43,118 - optuna.study._optimize - INFO - Trial 119 pruned. 
2026-05-16 07:49:46,676 - experiment_functions - INFO - Early stopping at epoch 500. Best Recall: 0.0028
2026-05-16 07:49:46,776 - optuna.study.study - INFO - Trial 120 finished with value: 0.0028381916102088174 and parameters: {'n_layers': 1, 'embedding_dim': 256, 'lr': 0.0009705000782193878, 'lambda_val': 0.0004147538677934444, 'batch_size': 804, 'optimizer': 'SGD'}. Best is trial 96 with value: 0.1292701130387624.
2026-05-16 07:49:55,413 - experiment_functions - INFO - Early stopping at epoch 1250. Best Recall: 0.1155
2026-05-16 07:49:55,503 - optuna.study.study - INFO - Trial 121 finished with value: 0.11551181331913604 and parameters: {'n_layers': 1, 'embedding_dim': 256, 'lr': 0.000839133126150589, 'lambda_val': 0.0009736213116950794, 'batch_size': 895, 'optimizer': 'Adam'}. Best is trial 96 with value: 0.1292701130387624.
2026-05-16 07:50:04,843 - optuna.study._optimize - INFO - Trial 122 pruned. 
2026-05-16 07:50:12,382 - experiment_functions - INFO - Early stopping at epoch 850. Best Recall: 0.1097
2026-05-16 07:50:12,684 - optuna.study.study - INFO - Trial 123 finished with value: 0.1097400902403281 and parameters: {'n_layers': 1, 'embedding_dim': 256, 'lr': 0.0013188774510502182, 'lambda_val': 0.0006815901618887762, 'batch_size': 969, 'optimizer': 'Adam'}. Best is trial 96 with value: 0.1292701130387624.
2026-05-16 07:50:19,584 - optuna.study._optimize - INFO - Trial 124 pruned. 
2026-05-16 07:50:27,214 - experiment_functions - INFO - Early stopping at epoch 950. Best Recall: 0.0979
2026-05-16 07:50:27,325 - optuna.study.study - INFO - Trial 125 finished with value: 0.0979423491136524 and parameters: {'n_layers': 1, 'embedding_dim': 64, 'lr': 0.0010538355307388694, 'lambda_val': 0.00034154641728030945, 'batch_size': 1144, 'optimizer': 'Adam'}. Best is trial 96 with value: 0.1292701130387624.
2026-05-16 07:50:37,007 - experiment_functions - INFO - Early stopping at epoch 1200. Best Recall: 0.1142
2026-05-16 07:50:37,098 - optuna.study.study - INFO - Trial 126 finished with value: 0.1141633103042849 and parameters: {'n_layers': 1, 'embedding_dim': 256, 'lr': 0.0005360726350011694, 'lambda_val': 0.0026088865122869164, 'batch_size': 1069, 'optimizer': 'RMSprop'}. Best is trial 96 with value: 0.1292701130387624.
2026-05-16 07:50:46,484 - experiment_functions - INFO - Early stopping at epoch 850. Best Recall: 0.0962
2026-05-16 07:50:46,586 - optuna.study.study - INFO - Trial 127 finished with value: 0.09617613944462844 and parameters: {'n_layers': 1, 'embedding_dim': 256, 'lr': 0.0016623703419751295, 'lambda_val': 0.0004946888447722794, 'batch_size': 1562, 'optimizer': 'Adam'}. Best is trial 96 with value: 0.1292701130387624.
2026-05-16 07:50:57,188 - optuna.study._optimize - INFO - Trial 128 pruned. 
2026-05-16 07:51:05,410 - optuna.study._optimize - INFO - Trial 129 pruned. 
2026-05-16 07:51:16,101 - optuna.study._optimize - INFO - Trial 130 pruned. 
2026-05-16 07:51:25,171 - optuna.study._optimize - INFO - Trial 131 pruned. 
2026-05-16 07:51:38,694 - optuna.study._optimize - INFO - Trial 132 pruned. 
2026-05-16 07:51:47,415 - optuna.study._optimize - INFO - Trial 133 pruned. 
2026-05-16 07:52:01,377 - experiment_functions - INFO - Early stopping at epoch 2050. Best Recall: 0.1217
2026-05-16 07:52:01,498 - optuna.study.study - INFO - Trial 134 finished with value: 0.1217234353425695 and parameters: {'n_layers': 1, 'embedding_dim': 256, 'lr': 0.0005911218932301622, 'lambda_val': 0.0005886833034881589, 'batch_size': 1319, 'optimizer': 'Adam'}. Best is trial 96 with value: 0.1292701130387624.
2026-05-16 07:52:14,959 - optuna.study._optimize - INFO - Trial 135 pruned. 
2026-05-16 07:52:26,988 - experiment_functions - INFO - Early stopping at epoch 1150. Best Recall: 0.1148
2026-05-16 07:52:27,079 - optuna.study.study - INFO - Trial 136 finished with value: 0.11481935516529268 and parameters: {'n_layers': 1, 'embedding_dim': 256, 'lr': 0.000723446270559666, 'lambda_val': 0.0002990148781436438, 'batch_size': 1725, 'optimizer': 'Adam'}. Best is trial 96 with value: 0.1292701130387624.
2026-05-16 07:52:35,121 - optuna.study._optimize - INFO - Trial 137 pruned. 
2026-05-16 07:52:45,566 - optuna.study._optimize - INFO - Trial 138 pruned. 
2026-05-16 07:52:49,589 - experiment_functions - INFO - Early stopping at epoch 550. Best Recall: 0.0497
2026-05-16 07:52:49,670 - optuna.study.study - INFO - Trial 139 finished with value: 0.04967701462543904 and parameters: {'n_layers': 1, 'embedding_dim': 256, 'lr': 0.02227048231611749, 'lambda_val': 0.00013744058614774393, 'batch_size': 994, 'optimizer': 'Adam'}. Best is trial 96 with value: 0.1292701130387624.
2026-05-16 07:52:57,350 - optuna.study._optimize - INFO - Trial 140 pruned. 
2026-05-16 07:53:03,452 - experiment_functions - INFO - Early stopping at epoch 850. Best Recall: 0.1160
2026-05-16 07:53:03,552 - optuna.study.study - INFO - Trial 141 finished with value: 0.11600056055102255 and parameters: {'n_layers': 1, 'embedding_dim': 256, 'lr': 0.0011046869196060752, 'lambda_val': 0.0003401933987064894, 'batch_size': 1262, 'optimizer': 'Adam'}. Best is trial 96 with value: 0.1292701130387624.
2026-05-16 07:53:11,059 - optuna.study._optimize - INFO - Trial 142 pruned. 
2026-05-16 07:53:17,499 - experiment_functions - INFO - Early stopping at epoch 750. Best Recall: 0.1112
2026-05-16 07:53:17,598 - optuna.study.study - INFO - Trial 143 finished with value: 0.11122958664219554 and parameters: {'n_layers': 1, 'embedding_dim': 256, 'lr': 0.0019791893353474574, 'lambda_val': 0.0002453535733408669, 'batch_size': 1048, 'optimizer': 'Adam'}. Best is trial 96 with value: 0.1292701130387624.
2026-05-16 07:53:24,442 - experiment_functions - INFO - Early stopping at epoch 850. Best Recall: 0.0990
2026-05-16 07:53:24,553 - optuna.study.study - INFO - Trial 144 finished with value: 0.09902807260671381 and parameters: {'n_layers': 1, 'embedding_dim': 256, 'lr': 0.0014708823569261878, 'lambda_val': 0.0008302864690219394, 'batch_size': 940, 'optimizer': 'Adam'}. Best is trial 96 with value: 0.1292701130387624.
2026-05-16 07:53:37,099 - experiment_functions - INFO - Early stopping at epoch 1750. Best Recall: 0.1218
2026-05-16 07:53:37,189 - optuna.study.study - INFO - Trial 145 finished with value: 0.12182257498234979 and parameters: {'n_layers': 1, 'embedding_dim': 256, 'lr': 0.0007137620460041141, 'lambda_val': 0.0003791434532598917, 'batch_size': 774, 'optimizer': 'Adam'}. Best is trial 96 with value: 0.1292701130387624.
2026-05-16 07:53:40,886 - experiment_functions - INFO - Early stopping at epoch 500. Best Recall: 0.0025
2026-05-16 07:53:40,985 - optuna.study.study - INFO - Trial 146 finished with value: 0.0024515175937831718 and parameters: {'n_layers': 1, 'embedding_dim': 256, 'lr': 0.0007300247436928195, 'lambda_val': 0.07686314878947952, 'batch_size': 744, 'optimizer': 'SGD'}. Best is trial 96 with value: 0.1292701130387624.
2026-05-16 07:53:49,383 - optuna.study._optimize - INFO - Trial 147 pruned. 
2026-05-16 07:53:57,503 - optuna.study._optimize - INFO - Trial 148 pruned. 
2026-05-16 07:54:06,310 - optuna.study._optimize - INFO - Trial 149 pruned. 
2026-05-16 07:54:13,892 - optuna.study._optimize - INFO - Trial 150 pruned. 
2026-05-16 07:54:26,032 - optuna.study._optimize - INFO - Trial 151 pruned. 
2026-05-16 07:54:36,895 - experiment_functions - INFO - Early stopping at epoch 1400. Best Recall: 0.1244
2026-05-16 07:54:36,987 - optuna.study.study - INFO - Trial 152 finished with value: 0.12436739034800905 and parameters: {'n_layers': 1, 'embedding_dim': 256, 'lr': 0.0006914278456578689, 'lambda_val': 0.0004757074457158058, 'batch_size': 793, 'optimizer': 'Adam'}. Best is trial 96 with value: 0.1292701130387624.
2026-05-16 07:54:50,666 - experiment_functions - INFO - Early stopping at epoch 1650. Best Recall: 0.1194
2026-05-16 07:54:50,766 - optuna.study.study - INFO - Trial 153 finished with value: 0.11943156345300558 and parameters: {'n_layers': 1, 'embedding_dim': 256, 'lr': 0.0007002863122861889, 'lambda_val': 0.0007698646895715662, 'batch_size': 791, 'optimizer': 'Adam'}. Best is trial 96 with value: 0.1292701130387624.
2026-05-16 07:54:58,583 - optuna.study._optimize - INFO - Trial 154 pruned. 
2026-05-16 07:55:07,483 - optuna.study._optimize - INFO - Trial 155 pruned. 
2026-05-16 07:55:16,539 - optuna.study._optimize - INFO - Trial 156 pruned. 
2026-05-16 07:55:31,402 - experiment_functions - INFO - Early stopping at epoch 1350. Best Recall: 0.1219
2026-05-16 07:55:31,491 - optuna.study.study - INFO - Trial 157 finished with value: 0.12192586155817461 and parameters: {'n_layers': 1, 'embedding_dim': 256, 'lr': 0.0009611694016515088, 'lambda_val': 1.753696405279631e-06, 'batch_size': 728, 'optimizer': 'Adam'}. Best is trial 96 with value: 0.1292701130387624.
2026-05-16 07:55:39,481 - optuna.study._optimize - INFO - Trial 158 pruned. 
2026-05-16 07:55:52,896 - optuna.study._optimize - INFO - Trial 159 pruned. 
2026-05-16 07:56:00,091 - experiment_functions - INFO - Early stopping at epoch 650. Best Recall: 0.0510
2026-05-16 07:56:00,235 - optuna.study.study - INFO - Trial 160 finished with value: 0.05104506465812965 and parameters: {'n_layers': 4, 'embedding_dim': 256, 'lr': 0.0008039724001896201, 'lambda_val': 2.671786038906729e-05, 'batch_size': 716, 'optimizer': 'Adam'}. Best is trial 96 with value: 0.1292701130387624.
2026-05-16 07:56:09,427 - experiment_functions - INFO - Early stopping at epoch 750. Best Recall: 0.1107
2026-05-16 07:56:09,538 - optuna.study.study - INFO - Trial 161 finished with value: 0.11066597638052957 and parameters: {'n_layers': 1, 'embedding_dim': 256, 'lr': 0.0012543453089941226, 'lambda_val': 1.6431372547232683e-06, 'batch_size': 4091, 'optimizer': 'Adam'}. Best is trial 96 with value: 0.1292701130387624.
2026-05-16 07:56:16,729 - experiment_functions - INFO - Early stopping at epoch 900. Best Recall: 0.1161
2026-05-16 07:56:16,820 - optuna.study.study - INFO - Trial 162 finished with value: 0.11612931651896395 and parameters: {'n_layers': 1, 'embedding_dim': 256, 'lr': 0.001053956019752442, 'lambda_val': 1.4027334257474075e-05, 'batch_size': 895, 'optimizer': 'Adam'}. Best is trial 96 with value: 0.1292701130387624.
2026-05-16 07:56:23,214 - experiment_functions - INFO - Early stopping at epoch 800. Best Recall: 0.0729
2026-05-16 07:56:23,347 - optuna.study.study - INFO - Trial 163 finished with value: 0.07293756234265572 and parameters: {'n_layers': 1, 'embedding_dim': 256, 'lr': 0.0007175574288469029, 'lambda_val': 0.0308301770392607, 'batch_size': 950, 'optimizer': 'Adam'}. Best is trial 96 with value: 0.1292701130387624.
2026-05-16 07:56:37,746 - experiment_functions - INFO - Early stopping at epoch 2050. Best Recall: 0.1221
2026-05-16 07:56:37,870 - optuna.study.study - INFO - Trial 164 finished with value: 0.12208122576430888 and parameters: {'n_layers': 1, 'embedding_dim': 256, 'lr': 0.0005974671638033649, 'lambda_val': 0.0006106341567866934, 'batch_size': 768, 'optimizer': 'Adam'}. Best is trial 96 with value: 0.1292701130387624.
2026-05-16 07:56:44,780 - optuna.study._optimize - INFO - Trial 165 pruned. 
2026-05-16 07:56:52,497 - optuna.study._optimize - INFO - Trial 166 pruned. 
2026-05-16 07:57:00,280 - optuna.study._optimize - INFO - Trial 167 pruned. 
2026-05-16 07:57:08,467 - optuna.study._optimize - INFO - Trial 168 pruned. 
2026-05-16 07:57:16,139 - optuna.study._optimize - INFO - Trial 169 pruned. 
2026-05-16 07:57:24,384 - optuna.study._optimize - INFO - Trial 170 pruned. 
2026-05-16 07:57:34,915 - experiment_functions - INFO - Early stopping at epoch 1250. Best Recall: 0.1161
2026-05-16 07:57:35,082 - optuna.study.study - INFO - Trial 171 finished with value: 0.11605945348372733 and parameters: {'n_layers': 1, 'embedding_dim': 256, 'lr': 0.001114074215912056, 'lambda_val': 0.0002744411305814973, 'batch_size': 664, 'optimizer': 'Adam'}. Best is trial 96 with value: 0.1292701130387624.
2026-05-16 07:57:44,743 - experiment_functions - INFO - Early stopping at epoch 1450. Best Recall: 0.1199
2026-05-16 07:57:44,846 - optuna.study.study - INFO - Trial 172 finished with value: 0.11994563748762224 and parameters: {'n_layers': 1, 'embedding_dim': 256, 'lr': 0.0008103068236486992, 'lambda_val': 0.0005652238084625259, 'batch_size': 925, 'optimizer': 'Adam'}. Best is trial 96 with value: 0.1292701130387624.
2026-05-16 07:57:59,679 - experiment_functions - INFO - Early stopping at epoch 1950. Best Recall: 0.1247
2026-05-16 07:57:59,779 - optuna.study.study - INFO - Trial 173 finished with value: 0.1247423517301607 and parameters: {'n_layers': 1, 'embedding_dim': 256, 'lr': 0.0005986177417846032, 'lambda_val': 0.0006212161352979137, 'batch_size': 917, 'optimizer': 'Adam'}. Best is trial 96 with value: 0.1292701130387624.
2026-05-16 07:58:14,361 - experiment_functions - INFO - Early stopping at epoch 1950. Best Recall: 0.1202
2026-05-16 07:58:14,452 - optuna.study.study - INFO - Trial 174 finished with value: 0.12017749314860841 and parameters: {'n_layers': 1, 'embedding_dim': 256, 'lr': 0.0005757959665496139, 'lambda_val': 0.0006137886523880198, 'batch_size': 782, 'optimizer': 'Adam'}. Best is trial 96 with value: 0.1292701130387624.
2026-05-16 07:58:23,430 - optuna.study._optimize - INFO - Trial 175 pruned. 
2026-05-16 07:58:31,399 - optuna.study._optimize - INFO - Trial 176 pruned. 
2026-05-16 07:58:45,711 - experiment_functions - INFO - Early stopping at epoch 1750. Best Recall: 0.1235
2026-05-16 07:58:45,812 - optuna.study.study - INFO - Trial 177 finished with value: 0.12352670342696569 and parameters: {'n_layers': 1, 'embedding_dim': 256, 'lr': 0.0007864155820955389, 'lambda_val': 4.201066924217417e-06, 'batch_size': 827, 'optimizer': 'Adam'}. Best is trial 96 with value: 0.1292701130387624.
2026-05-16 07:58:53,901 - optuna.study._optimize - INFO - Trial 178 pruned. 
2026-05-16 07:58:57,797 - experiment_functions - INFO - Early stopping at epoch 500. Best Recall: 0.0020
2026-05-16 07:58:57,888 - optuna.study.study - INFO - Trial 179 finished with value: 0.0020115767369066314 and parameters: {'n_layers': 1, 'embedding_dim': 256, 'lr': 0.0006125094928082108, 'lambda_val': 1.6618956154272612e-06, 'batch_size': 681, 'optimizer': 'SGD'}. Best is trial 96 with value: 0.1292701130387624.
2026-05-16 07:59:07,279 - optuna.study._optimize - INFO - Trial 180 pruned. 
2026-05-16 07:59:25,143 - optuna.study._optimize - INFO - Trial 181 pruned. 
2026-05-16 07:59:37,534 - optuna.study._optimize - INFO - Trial 182 pruned. 
2026-05-16 07:59:45,731 - optuna.study._optimize - INFO - Trial 183 pruned. 
2026-05-16 07:59:55,829 - optuna.study._optimize - INFO - Trial 184 pruned. 
2026-05-16 08:00:02,801 - optuna.study._optimize - INFO - Trial 185 pruned. 
2026-05-16 08:00:10,308 - optuna.study._optimize - INFO - Trial 186 pruned. 
2026-05-16 08:00:16,412 - experiment_functions - INFO - Early stopping at epoch 950. Best Recall: 0.0127
2026-05-16 08:00:16,525 - optuna.study.study - INFO - Trial 187 finished with value: 0.012740256160843302 and parameters: {'n_layers': 1, 'embedding_dim': 256, 'lr': 0.09718277901110309, 'lambda_val': 0.0008459641015081988, 'batch_size': 611, 'optimizer': 'RMSprop'}. Best is trial 96 with value: 0.1292701130387624.
2026-05-16 08:00:24,311 - optuna.study._optimize - INFO - Trial 188 pruned. 
2026-05-16 08:00:32,421 - optuna.study._optimize - INFO - Trial 189 pruned. 
2026-05-16 08:00:45,070 - experiment_functions - INFO - Early stopping at epoch 1900. Best Recall: 0.1246
