2026-05-15 21:18:12,009 - optuna.study.study - INFO - Trial 76 finished with value: 0.09341140571390467 and parameters: {'n_layers': 1, 'embedding_dim': 256, 'lr': 0.006243131874779628, 'lambda_val': 2.306154374787191e-06, 'batch_size': 2014, 'optimizer': 'Adam'}. Best is trial 55 with value: 0.11778071562711744.
2026-05-15 21:18:16,697 - experiment_functions - INFO - Early stopping at epoch 750. Best Recall: 0.0875
2026-05-15 21:18:16,798 - optuna.study.study - INFO - Trial 77 finished with value: 0.08748838448063029 and parameters: {'n_layers': 1, 'embedding_dim': 32, 'lr': 0.0019842443536665136, 'lambda_val': 4.261728183330631e-06, 'batch_size': 2392, 'optimizer': 'Adam'}. Best is trial 55 with value: 0.11778071562711744.
2026-05-15 21:18:21,272 - experiment_functions - INFO - Early stopping at epoch 600. Best Recall: 0.0942
2026-05-15 21:18:21,374 - optuna.study.study - INFO - Trial 78 finished with value: 0.09422471212681661 and parameters: {'n_layers': 1, 'embedding_dim': 256, 'lr': 0.0030413374557196142, 'lambda_val': 1.92910473028735e-05, 'batch_size': 1680, 'optimizer': 'Adam'}. Best is trial 55 with value: 0.11778071562711744.
2026-05-15 21:18:29,382 - optuna.study._optimize - INFO - Trial 79 pruned. 
2026-05-15 21:18:32,953 - experiment_functions - INFO - Early stopping at epoch 550. Best Recall: 0.0811
2026-05-15 21:18:33,044 - optuna.study.study - INFO - Trial 80 finished with value: 0.08114741887301834 and parameters: {'n_layers': 1, 'embedding_dim': 64, 'lr': 0.013908908275279755, 'lambda_val': 5.5127110290456654e-05, 'batch_size': 2333, 'optimizer': 'Adam'}. Best is trial 55 with value: 0.11778071562711744.
2026-05-15 21:18:44,648 - experiment_functions - INFO - Early stopping at epoch 1050. Best Recall: 0.1150
2026-05-15 21:18:45,410 - optuna.study.study - INFO - Trial 81 finished with value: 0.1150218890728565 and parameters: {'n_layers': 1, 'embedding_dim': 256, 'lr': 0.0009254935939810065, 'lambda_val': 8.852676972780796e-06, 'batch_size': 3456, 'optimizer': 'Adam'}. Best is trial 55 with value: 0.11778071562711744.
2026-05-15 21:18:58,239 - optuna.study._optimize - INFO - Trial 82 pruned. 
2026-05-15 21:19:04,402 - experiment_functions - INFO - Early stopping at epoch 900. Best Recall: 0.1123
2026-05-15 21:19:04,502 - optuna.study.study - INFO - Trial 83 finished with value: 0.11228752176060433 and parameters: {'n_layers': 1, 'embedding_dim': 256, 'lr': 0.0008581905520343417, 'lambda_val': 1.240493694138733e-05, 'batch_size': 3463, 'optimizer': 'Adam'}. Best is trial 55 with value: 0.11778071562711744.
2026-05-15 21:19:13,885 - experiment_functions - INFO - Early stopping at epoch 900. Best Recall: 0.1155
2026-05-15 21:19:14,007 - optuna.study.study - INFO - Trial 84 finished with value: 0.11553474222885968 and parameters: {'n_layers': 1, 'embedding_dim': 256, 'lr': 0.0008845901594602512, 'lambda_val': 3.608887141714647e-06, 'batch_size': 3467, 'optimizer': 'Adam'}. Best is trial 55 with value: 0.11778071562711744.
2026-05-15 21:19:19,409 - experiment_functions - INFO - Early stopping at epoch 800. Best Recall: 0.1081
2026-05-15 21:19:19,500 - optuna.study.study - INFO - Trial 85 finished with value: 0.10812728106037135 and parameters: {'n_layers': 1, 'embedding_dim': 256, 'lr': 0.0009423202063532811, 'lambda_val': 3.5818080735028976e-06, 'batch_size': 3425, 'optimizer': 'Adam'}. Best is trial 55 with value: 0.11778071562711744.
2026-05-15 21:19:28,328 - experiment_functions - INFO - Early stopping at epoch 1050. Best Recall: 0.1219
2026-05-15 21:19:28,452 - optuna.study.study - INFO - Trial 86 finished with value: 0.12194182347933137 and parameters: {'n_layers': 1, 'embedding_dim': 256, 'lr': 0.0007341198476660056, 'lambda_val': 5.1096372902622775e-06, 'batch_size': 3840, 'optimizer': 'Adam'}. Best is trial 86 with value: 0.12194182347933137.
2026-05-15 21:19:36,549 - experiment_functions - INFO - Early stopping at epoch 950. Best Recall: 0.1088
2026-05-15 21:19:36,694 - optuna.study.study - INFO - Trial 87 finished with value: 0.10879601134394982 and parameters: {'n_layers': 1, 'embedding_dim': 256, 'lr': 0.0007434305328372287, 'lambda_val': 2.3194911671032108e-06, 'batch_size': 3985, 'optimizer': 'Adam'}. Best is trial 86 with value: 0.12194182347933137.
2026-05-15 21:19:46,363 - experiment_functions - INFO - Early stopping at epoch 1050. Best Recall: 0.1164
2026-05-15 21:19:46,461 - optuna.study.study - INFO - Trial 88 finished with value: 0.11638175497152813 and parameters: {'n_layers': 1, 'embedding_dim': 256, 'lr': 0.0006820399076526851, 'lambda_val': 2.354221875265762e-06, 'batch_size': 3867, 'optimizer': 'Adam'}. Best is trial 86 with value: 0.12194182347933137.
2026-05-15 21:19:56,846 - experiment_functions - INFO - Early stopping at epoch 1550. Best Recall: 0.1141
2026-05-15 21:19:56,937 - optuna.study.study - INFO - Trial 89 finished with value: 0.11406656024580657 and parameters: {'n_layers': 1, 'embedding_dim': 256, 'lr': 0.0003437409728115123, 'lambda_val': 3.2144932246278287e-06, 'batch_size': 3836, 'optimizer': 'Adam'}. Best is trial 86 with value: 0.12194182347933137.
2026-05-15 21:20:05,646 - optuna.study._optimize - INFO - Trial 90 pruned. 
2026-05-15 21:20:17,524 - optuna.study._optimize - INFO - Trial 91 pruned. 
2026-05-15 21:20:24,788 - optuna.study._optimize - INFO - Trial 92 pruned. 
2026-05-15 21:20:32,350 - experiment_functions - INFO - Early stopping at epoch 1150. Best Recall: 0.1207
2026-05-15 21:20:32,451 - optuna.study.study - INFO - Trial 93 finished with value: 0.12067517538218542 and parameters: {'n_layers': 1, 'embedding_dim': 256, 'lr': 0.0006705229825672595, 'lambda_val': 1.019115701900146e-06, 'batch_size': 3910, 'optimizer': 'Adam'}. Best is trial 86 with value: 0.12194182347933137.
2026-05-15 21:20:39,847 - optuna.study._optimize - INFO - Trial 94 pruned. 
2026-05-15 21:20:43,535 - experiment_functions - INFO - Early stopping at epoch 500. Best Recall: 0.0020
2026-05-15 21:20:43,718 - optuna.study.study - INFO - Trial 95 finished with value: 0.0019629825674727817 and parameters: {'n_layers': 1, 'embedding_dim': 256, 'lr': 0.00036319927964876153, 'lambda_val': 1.6585052194986806e-06, 'batch_size': 3634, 'optimizer': 'SGD'}. Best is trial 86 with value: 0.12194182347933137.
2026-05-15 21:20:51,414 - experiment_functions - INFO - Early stopping at epoch 1050. Best Recall: 0.1027
2026-05-15 21:20:51,505 - optuna.study.study - INFO - Trial 96 finished with value: 0.10271127169108513 and parameters: {'n_layers': 1, 'embedding_dim': 256, 'lr': 0.0006790835418197333, 'lambda_val': 2.3428783223692487e-06, 'batch_size': 3518, 'optimizer': 'Adam'}. Best is trial 86 with value: 0.12194182347933137.
2026-05-15 21:20:57,889 - experiment_functions - INFO - Early stopping at epoch 850. Best Recall: 0.1040
2026-05-15 21:20:57,981 - optuna.study.study - INFO - Trial 97 finished with value: 0.10397561205857583 and parameters: {'n_layers': 1, 'embedding_dim': 256, 'lr': 0.0010109090978624273, 'lambda_val': 1.6862478018861507e-06, 'batch_size': 3768, 'optimizer': 'Adam'}. Best is trial 86 with value: 0.12194182347933137.
2026-05-15 21:21:05,293 - experiment_functions - INFO - Early stopping at epoch 1100. Best Recall: 0.1117
2026-05-15 21:21:05,393 - optuna.study.study - INFO - Trial 98 finished with value: 0.11169624688398422 and parameters: {'n_layers': 1, 'embedding_dim': 256, 'lr': 0.0005160015538009283, 'lambda_val': 3.7597314607532062e-06, 'batch_size': 3896, 'optimizer': 'Adam'}. Best is trial 86 with value: 0.12194182347933137.
2026-05-15 21:21:09,482 - experiment_functions - INFO - Early stopping at epoch 650. Best Recall: 0.0343
2026-05-15 21:21:09,583 - optuna.study.study - INFO - Trial 99 finished with value: 0.03428056589072792 and parameters: {'n_layers': 1, 'embedding_dim': 32, 'lr': 0.03610655089721741, 'lambda_val': 2.8405812845034872e-06, 'batch_size': 4065, 'optimizer': 'Adam'}. Best is trial 86 with value: 0.12194182347933137.
2026-05-15 21:21:17,115 - optuna.study._optimize - INFO - Trial 100 pruned. 
2026-05-15 21:21:25,162 - optuna.study._optimize - INFO - Trial 101 pruned. 
2026-05-15 21:21:38,039 - experiment_functions - INFO - Early stopping at epoch 1500. Best Recall: 0.1164
2026-05-15 21:21:38,202 - optuna.study.study - INFO - Trial 102 finished with value: 0.11640611062569226 and parameters: {'n_layers': 1, 'embedding_dim': 256, 'lr': 0.00042236722781069527, 'lambda_val': 3.527859549891501e-06, 'batch_size': 3824, 'optimizer': 'Adam'}. Best is trial 86 with value: 0.12194182347933137.
2026-05-15 21:21:45,362 - experiment_functions - INFO - Early stopping at epoch 900. Best Recall: 0.1183
2026-05-15 21:21:45,535 - optuna.study.study - INFO - Trial 103 finished with value: 0.11830605053073133 and parameters: {'n_layers': 1, 'embedding_dim': 256, 'lr': 0.0008190513049945558, 'lambda_val': 5.104372545192209e-06, 'batch_size': 3532, 'optimizer': 'Adam'}. Best is trial 86 with value: 0.12194182347933137.
2026-05-15 21:21:54,174 - optuna.study._optimize - INFO - Trial 104 pruned. 
2026-05-15 21:22:02,749 - experiment_functions - INFO - Early stopping at epoch 1050. Best Recall: 0.1144
2026-05-15 21:22:02,876 - optuna.study.study - INFO - Trial 105 finished with value: 0.11441763308122875 and parameters: {'n_layers': 1, 'embedding_dim': 256, 'lr': 0.00062011814938262, 'lambda_val': 4.828920461483851e-06, 'batch_size': 3558, 'optimizer': 'Adam'}. Best is trial 86 with value: 0.12194182347933137.
2026-05-15 21:22:11,423 - experiment_functions - INFO - Early stopping at epoch 1100. Best Recall: 0.1122
2026-05-15 21:22:11,551 - optuna.study.study - INFO - Trial 106 finished with value: 0.11217077958461859 and parameters: {'n_layers': 1, 'embedding_dim': 256, 'lr': 0.0006313942558016246, 'lambda_val': 5.35213450894173e-06, 'batch_size': 3322, 'optimizer': 'Adam'}. Best is trial 86 with value: 0.12194182347933137.
2026-05-15 21:22:19,497 - optuna.study._optimize - INFO - Trial 107 pruned. 
2026-05-15 21:22:23,499 - experiment_functions - INFO - Early stopping at epoch 500. Best Recall: 0.0018
2026-05-15 21:22:23,627 - optuna.study.study - INFO - Trial 108 finished with value: 0.0017786555897215915 and parameters: {'n_layers': 1, 'embedding_dim': 64, 'lr': 0.00039602212636547554, 'lambda_val': 2.338549596841117e-06, 'batch_size': 3796, 'optimizer': 'SGD'}. Best is trial 86 with value: 0.12194182347933137.
2026-05-15 21:22:29,056 - experiment_functions - INFO - Early stopping at epoch 650. Best Recall: 0.0623
2026-05-15 21:22:29,134 - optuna.study.study - INFO - Trial 109 finished with value: 0.062292178621871246 and parameters: {'n_layers': 2, 'embedding_dim': 256, 'lr': 0.0011434804843718975, 'lambda_val': 7.2499492372097826e-06, 'batch_size': 3572, 'optimizer': 'Adam'}. Best is trial 86 with value: 0.12194182347933137.
2026-05-15 21:22:35,296 - experiment_functions - INFO - Early stopping at epoch 950. Best Recall: 0.1164
2026-05-15 21:22:35,432 - optuna.study.study - INFO - Trial 110 finished with value: 0.1163559031480887 and parameters: {'n_layers': 1, 'embedding_dim': 256, 'lr': 0.0007479771531457818, 'lambda_val': 1.2731261348993454e-06, 'batch_size': 3986, 'optimizer': 'Adam'}. Best is trial 86 with value: 0.12194182347933137.
2026-05-15 21:22:41,348 - experiment_functions - INFO - Early stopping at epoch 800. Best Recall: 0.1123
2026-05-15 21:22:41,438 - optuna.study.study - INFO - Trial 111 finished with value: 0.112305959424575 and parameters: {'n_layers': 1, 'embedding_dim': 256, 'lr': 0.0008244097890477058, 'lambda_val': 1.5587830295425148e-06, 'batch_size': 4032, 'optimizer': 'Adam'}. Best is trial 86 with value: 0.12194182347933137.
2026-05-15 21:22:48,324 - experiment_functions - INFO - Early stopping at epoch 1050. Best Recall: 0.1223
2026-05-15 21:22:48,415 - optuna.study.study - INFO - Trial 112 finished with value: 0.12229405542881594 and parameters: {'n_layers': 1, 'embedding_dim': 256, 'lr': 0.0006450112402620747, 'lambda_val': 1.3639673026777455e-06, 'batch_size': 3939, 'optimizer': 'Adam'}. Best is trial 112 with value: 0.12229405542881594.
2026-05-15 21:23:00,832 - experiment_functions - INFO - Early stopping at epoch 1900. Best Recall: 0.1163
2026-05-15 21:23:00,922 - optuna.study.study - INFO - Trial 113 finished with value: 0.11634815906577713 and parameters: {'n_layers': 1, 'embedding_dim': 256, 'lr': 0.0003214648006455569, 'lambda_val': 2.708515388989015e-06, 'batch_size': 3938, 'optimizer': 'Adam'}. Best is trial 112 with value: 0.12229405542881594.
2026-05-15 21:23:08,910 - optuna.study._optimize - INFO - Trial 114 pruned. 
2026-05-15 21:23:14,182 - experiment_functions - INFO - Early stopping at epoch 750. Best Recall: 0.1095
2026-05-15 21:23:14,283 - optuna.study.study - INFO - Trial 115 finished with value: 0.109534578875088 and parameters: {'n_layers': 1, 'embedding_dim': 256, 'lr': 0.0013334839154879668, 'lambda_val': 1.3104906351029065e-06, 'batch_size': 3736, 'optimizer': 'Adam'}. Best is trial 112 with value: 0.12229405542881594.
2026-05-15 21:23:21,508 - experiment_functions - INFO - Early stopping at epoch 950. Best Recall: 0.1078
2026-05-15 21:23:21,608 - optuna.study.study - INFO - Trial 116 finished with value: 0.10775361243553092 and parameters: {'n_layers': 1, 'embedding_dim': 256, 'lr': 0.0006570549630391778, 'lambda_val': 1.855996668303692e-06, 'batch_size': 3950, 'optimizer': 'Adam'}. Best is trial 112 with value: 0.12229405542881594.
2026-05-15 21:23:35,301 - experiment_functions - INFO - Early stopping at epoch 800. Best Recall: 0.1043
2026-05-15 21:23:36,077 - optuna.study.study - INFO - Trial 117 finished with value: 0.10431416280816493 and parameters: {'n_layers': 1, 'embedding_dim': 256, 'lr': 0.0009657653733722216, 'lambda_val': 2.0547917699354864e-06, 'batch_size': 3679, 'optimizer': 'Adam'}. Best is trial 112 with value: 0.12229405542881594.
2026-05-15 21:23:43,832 - optuna.study._optimize - INFO - Trial 118 pruned. 
2026-05-15 21:23:53,876 - experiment_functions - INFO - Early stopping at epoch 1200. Best Recall: 0.1170
2026-05-15 21:23:53,965 - optuna.study.study - INFO - Trial 119 finished with value: 0.11704486658389118 and parameters: {'n_layers': 1, 'embedding_dim': 256, 'lr': 0.0004783583001387425, 'lambda_val': 1.0126296959386037e-06, 'batch_size': 4029, 'optimizer': 'Adam'}. Best is trial 112 with value: 0.12229405542881594.
2026-05-15 21:24:01,147 - experiment_functions - INFO - Early stopping at epoch 1050. Best Recall: 0.1157
2026-05-15 21:24:01,226 - optuna.study.study - INFO - Trial 120 finished with value: 0.11566788646575914 and parameters: {'n_layers': 1, 'embedding_dim': 256, 'lr': 0.000742586082589777, 'lambda_val': 1.187659593488803e-06, 'batch_size': 4014, 'optimizer': 'Adam'}. Best is trial 112 with value: 0.12229405542881594.
2026-05-15 21:24:10,016 - experiment_functions - INFO - Early stopping at epoch 1400. Best Recall: 0.1179
2026-05-15 21:24:10,116 - optuna.study.study - INFO - Trial 121 finished with value: 0.1178563074411382 and parameters: {'n_layers': 1, 'embedding_dim': 256, 'lr': 0.00046637834487801367, 'lambda_val': 1.0868241863337553e-06, 'batch_size': 4033, 'optimizer': 'Adam'}. Best is trial 112 with value: 0.12229405542881594.
2026-05-15 21:24:17,422 - optuna.study._optimize - INFO - Trial 122 pruned. 
2026-05-15 21:24:23,736 - experiment_functions - INFO - Early stopping at epoch 950. Best Recall: 0.1025
2026-05-15 21:24:23,862 - optuna.study.study - INFO - Trial 123 finished with value: 0.10252108257365046 and parameters: {'n_layers': 1, 'embedding_dim': 256, 'lr': 0.000751047461542722, 'lambda_val': 1.0626372977291148e-06, 'batch_size': 4017, 'optimizer': 'Adam'}. Best is trial 112 with value: 0.12229405542881594.
2026-05-15 21:24:31,283 - optuna.study._optimize - INFO - Trial 124 pruned. 
2026-05-15 21:24:42,258 - optuna.study._optimize - INFO - Trial 125 pruned. 
2026-05-15 21:24:48,864 - experiment_functions - INFO - Early stopping at epoch 1000. Best Recall: 0.1099
2026-05-15 21:24:48,965 - optuna.study.study - INFO - Trial 126 finished with value: 0.10987951448851457 and parameters: {'n_layers': 1, 'embedding_dim': 256, 'lr': 0.0007381789472236324, 'lambda_val': 2.322980989096814e-06, 'batch_size': 4074, 'optimizer': 'Adam'}. Best is trial 112 with value: 0.12229405542881594.
2026-05-15 21:24:57,024 - experiment_functions - INFO - Early stopping at epoch 1150. Best Recall: 0.1122
2026-05-15 21:24:57,113 - optuna.study.study - INFO - Trial 127 finished with value: 0.11216502136303289 and parameters: {'n_layers': 1, 'embedding_dim': 256, 'lr': 0.0005360107828675197, 'lambda_val': 1.4919750297774937e-06, 'batch_size': 3760, 'optimizer': 'Adam'}. Best is trial 112 with value: 0.12229405542881594.
2026-05-15 21:25:02,051 - experiment_functions - INFO - Early stopping at epoch 700. Best Recall: 0.1024
2026-05-15 21:25:02,152 - optuna.study.study - INFO - Trial 128 finished with value: 0.1023799376181965 and parameters: {'n_layers': 1, 'embedding_dim': 256, 'lr': 0.001151006741679268, 'lambda_val': 1.985216605792753e-06, 'batch_size': 3936, 'optimizer': 'Adam'}. Best is trial 112 with value: 0.12229405542881594.
2026-05-15 21:25:08,046 - optuna.study._optimize - INFO - Trial 129 pruned. 
2026-05-15 21:25:15,028 - optuna.study._optimize - INFO - Trial 130 pruned. 
2026-05-15 21:25:21,602 - optuna.study._optimize - INFO - Trial 131 pruned. 
2026-05-15 21:25:27,099 - experiment_functions - INFO - Early stopping at epoch 800. Best Recall: 0.1239
2026-05-15 21:25:27,191 - optuna.study.study - INFO - Trial 132 finished with value: 0.12389539488164372 and parameters: {'n_layers': 1, 'embedding_dim': 256, 'lr': 0.0008922576403356437, 'lambda_val': 2.5823085892674434e-06, 'batch_size': 4091, 'optimizer': 'Adam'}. Best is trial 132 with value: 0.12389539488164372.
2026-05-15 21:25:35,233 - experiment_functions - INFO - Early stopping at epoch 900. Best Recall: 0.1135
2026-05-15 21:25:35,325 - optuna.study.study - INFO - Trial 133 finished with value: 0.113512600821548 and parameters: {'n_layers': 1, 'embedding_dim': 256, 'lr': 0.000743132476927731, 'lambda_val': 2.4957274204010714e-06, 'batch_size': 4076, 'optimizer': 'Adam'}. Best is trial 132 with value: 0.12389539488164372.
2026-05-15 21:25:38,988 - experiment_functions - INFO - Early stopping at epoch 500. Best Recall: 0.0017
2026-05-15 21:25:39,111 - optuna.study.study - INFO - Trial 134 finished with value: 0.0016757221732767304 and parameters: {'n_layers': 1, 'embedding_dim': 256, 'lr': 0.0009078755621575489, 'lambda_val': 3.845919878910971e-06, 'batch_size': 4009, 'optimizer': 'SGD'}. Best is trial 132 with value: 0.12389539488164372.
2026-05-15 21:25:44,196 - experiment_functions - INFO - Early stopping at epoch 750. Best Recall: 0.1053
2026-05-15 21:25:44,296 - optuna.study.study - INFO - Trial 135 finished with value: 0.10530816490494967 and parameters: {'n_layers': 1, 'embedding_dim': 256, 'lr': 0.001356749222436009, 'lambda_val': 1.8430138232437683e-06, 'batch_size': 3724, 'optimizer': 'Adam'}. Best is trial 132 with value: 0.12389539488164372.
2026-05-15 21:25:51,712 - experiment_functions - INFO - Early stopping at epoch 1150. Best Recall: 0.1115
2026-05-15 21:25:52,014 - optuna.study.study - INFO - Trial 136 finished with value: 0.11150477739271936 and parameters: {'n_layers': 1, 'embedding_dim': 256, 'lr': 0.0005693093397804422, 'lambda_val': 2.990949414175522e-06, 'batch_size': 3875, 'optimizer': 'Adam'}. Best is trial 132 with value: 0.12389539488164372.
2026-05-15 21:25:58,284 - optuna.study._optimize - INFO - Trial 137 pruned. 
2026-05-15 21:26:05,040 - optuna.study._optimize - INFO - Trial 138 pruned. 
2026-05-15 21:26:09,732 - experiment_functions - INFO - Early stopping at epoch 700. Best Recall: 0.0305
2026-05-15 21:26:09,833 - optuna.study.study - INFO - Trial 139 finished with value: 0.030501247195870183 and parameters: {'n_layers': 1, 'embedding_dim': 64, 'lr': 0.001081763742696007, 'lambda_val': 0.062272213368621814, 'batch_size': 4079, 'optimizer': 'Adam'}. Best is trial 132 with value: 0.12389539488164372.
2026-05-15 21:26:19,286 - optuna.study._optimize - INFO - Trial 140 pruned. 
2026-05-15 21:26:25,342 - experiment_functions - INFO - Early stopping at epoch 900. Best Recall: 0.1125
2026-05-15 21:26:25,434 - optuna.study.study - INFO - Trial 141 finished with value: 0.11251353204589586 and parameters: {'n_layers': 1, 'embedding_dim': 256, 'lr': 0.0008692751862142031, 'lambda_val': 4.1878169595082386e-06, 'batch_size': 3629, 'optimizer': 'Adam'}. Best is trial 132 with value: 0.12389539488164372.
2026-05-15 21:26:33,175 - experiment_functions - INFO - Early stopping at epoch 1100. Best Recall: 0.1101
2026-05-15 21:26:33,274 - optuna.study.study - INFO - Trial 142 finished with value: 0.11009486675161963 and parameters: {'n_layers': 1, 'embedding_dim': 256, 'lr': 0.0006875951647097025, 'lambda_val': 5.890949552044095e-06, 'batch_size': 4092, 'optimizer': 'Adam'}. Best is trial 132 with value: 0.12389539488164372.
2026-05-15 21:26:40,444 - optuna.study._optimize - INFO - Trial 143 pruned. 
2026-05-15 21:26:52,551 - experiment_functions - INFO - Early stopping at epoch 1550. Best Recall: 0.1167
2026-05-15 21:26:52,641 - optuna.study.study - INFO - Trial 144 finished with value: 0.11667022501971638 and parameters: {'n_layers': 1, 'embedding_dim': 256, 'lr': 0.000455383199140524, 'lambda_val': 2.9145802444454745e-06, 'batch_size': 3722, 'optimizer': 'Adam'}. Best is trial 132 with value: 0.12389539488164372.
2026-05-15 21:27:02,189 - experiment_functions - INFO - Early stopping at epoch 1500. Best Recall: 0.1221
2026-05-15 21:27:02,280 - optuna.study.study - INFO - Trial 145 finished with value: 0.12210736484645436 and parameters: {'n_layers': 1, 'embedding_dim': 256, 'lr': 0.00046546811746985673, 'lambda_val': 3.210590913352992e-06, 'batch_size': 3718, 'optimizer': 'Adam'}. Best is trial 132 with value: 0.12389539488164372.
2026-05-15 21:27:11,925 - experiment_functions - INFO - Early stopping at epoch 1450. Best Recall: 0.1219
