2026-05-16 03:07:38,541 - optuna.study.study - INFO - Trial 219 finished with value: 0.13645094175523273 and parameters: {'n_layers': 1, 'embedding_dim': 256, 'lr': 0.0006338711090638953, 'lambda_val': 7.237122888541012e-06, 'batch_size': 1149, 'optimizer': 'Adam'}. Best is trial 127 with value: 0.14175544438329954.
2026-05-16 03:07:47,802 - experiment_functions - INFO - Early stopping at epoch 1200. Best Recall: 0.1210
2026-05-16 03:07:47,902 - optuna.study.study - INFO - Trial 220 finished with value: 0.12098981085700637 and parameters: {'n_layers': 1, 'embedding_dim': 256, 'lr': 0.0007926403577881735, 'lambda_val': 7.716860397868751e-06, 'batch_size': 1171, 'optimizer': 'Adam'}. Best is trial 127 with value: 0.14175544438329954.
2026-05-16 03:08:01,914 - experiment_functions - INFO - Early stopping at epoch 2450. Best Recall: 0.1310
2026-05-16 03:08:02,003 - optuna.study.study - INFO - Trial 221 finished with value: 0.13099805054517213 and parameters: {'n_layers': 1, 'embedding_dim': 256, 'lr': 0.0006083501436308879, 'lambda_val': 5.459337425288874e-06, 'batch_size': 1054, 'optimizer': 'Adam'}. Best is trial 127 with value: 0.14175544438329954.
2026-05-16 03:08:14,439 - experiment_functions - INFO - Early stopping at epoch 2200. Best Recall: 0.1312
2026-05-16 03:08:14,537 - optuna.study.study - INFO - Trial 222 finished with value: 0.13118538430091792 and parameters: {'n_layers': 1, 'embedding_dim': 256, 'lr': 0.0006155004683991429, 'lambda_val': 6.20581983748992e-06, 'batch_size': 1072, 'optimizer': 'Adam'}. Best is trial 127 with value: 0.14175544438329954.
2026-05-16 03:08:20,745 - optuna.study._optimize - INFO - Trial 223 pruned. 
2026-05-16 03:08:27,450 - optuna.study._optimize - INFO - Trial 224 pruned. 
2026-05-16 03:08:36,720 - optuna.study._optimize - INFO - Trial 225 pruned. 
2026-05-16 03:08:43,466 - optuna.study._optimize - INFO - Trial 226 pruned. 
2026-05-16 03:08:57,533 - experiment_functions - INFO - Early stopping at epoch 2150. Best Recall: 0.1305
2026-05-16 03:08:57,686 - optuna.study.study - INFO - Trial 227 finished with value: 0.13054047489117168 and parameters: {'n_layers': 1, 'embedding_dim': 256, 'lr': 0.00057489149381442, 'lambda_val': 1.0912001747487319e-05, 'batch_size': 1183, 'optimizer': 'Adam'}. Best is trial 127 with value: 0.14175544438329954.
2026-05-16 03:09:04,277 - optuna.study._optimize - INFO - Trial 228 pruned. 
2026-05-16 03:09:10,228 - optuna.study._optimize - INFO - Trial 229 pruned. 
2026-05-16 03:09:16,523 - optuna.study._optimize - INFO - Trial 230 pruned. 
2026-05-16 03:09:26,277 - optuna.study._optimize - INFO - Trial 231 pruned. 
2026-05-16 03:09:32,578 - optuna.study._optimize - INFO - Trial 232 pruned. 
2026-05-16 03:09:36,147 - experiment_functions - INFO - Early stopping at epoch 550. Best Recall: 0.0190
2026-05-16 03:09:36,237 - optuna.study.study - INFO - Trial 233 finished with value: 0.019043464741056573 and parameters: {'n_layers': 1, 'embedding_dim': 256, 'lr': 0.05688468701793603, 'lambda_val': 9.395778591524663e-06, 'batch_size': 1031, 'optimizer': 'Adam'}. Best is trial 127 with value: 0.14175544438329954.
2026-05-16 03:09:44,737 - optuna.study._optimize - INFO - Trial 234 pruned. 
2026-05-16 03:10:03,889 - experiment_functions - INFO - Early stopping at epoch 2300. Best Recall: 0.1315
2026-05-16 03:10:03,979 - optuna.study.study - INFO - Trial 235 finished with value: 0.13152832921788796 and parameters: {'n_layers': 1, 'embedding_dim': 256, 'lr': 0.0005621579770385888, 'lambda_val': 5.55567670697534e-06, 'batch_size': 971, 'optimizer': 'Adam'}. Best is trial 127 with value: 0.14175544438329954.
2026-05-16 03:10:10,717 - optuna.study._optimize - INFO - Trial 236 pruned. 
2026-05-16 03:10:17,598 - optuna.study._optimize - INFO - Trial 237 pruned. 
2026-05-16 03:10:24,353 - optuna.study._optimize - INFO - Trial 238 pruned. 
2026-05-16 03:10:30,881 - optuna.study._optimize - INFO - Trial 239 pruned. 
2026-05-16 03:10:45,936 - optuna.study._optimize - INFO - Trial 240 pruned. 
2026-05-16 03:10:52,431 - optuna.study._optimize - INFO - Trial 241 pruned. 
2026-05-16 03:11:17,539 - optuna.study._optimize - INFO - Trial 242 pruned. 
2026-05-16 03:11:25,805 - experiment_functions - INFO - Early stopping at epoch 1300. Best Recall: 0.1247
2026-05-16 03:11:25,882 - optuna.study.study - INFO - Trial 243 finished with value: 0.12467763412852678 and parameters: {'n_layers': 1, 'embedding_dim': 256, 'lr': 0.0007963663613338677, 'lambda_val': 7.866777067209462e-06, 'batch_size': 972, 'optimizer': 'Adam'}. Best is trial 127 with value: 0.14175544438329954.
2026-05-16 03:11:37,443 - experiment_functions - INFO - Early stopping at epoch 1700. Best Recall: 0.1284
2026-05-16 03:11:37,541 - optuna.study.study - INFO - Trial 244 finished with value: 0.12838858420604057 and parameters: {'n_layers': 1, 'embedding_dim': 256, 'lr': 0.0005773457508018401, 'lambda_val': 6.628189368709641e-06, 'batch_size': 1250, 'optimizer': 'Adam'}. Best is trial 127 with value: 0.14175544438329954.
2026-05-16 03:11:44,777 - optuna.study._optimize - INFO - Trial 245 pruned. 
2026-05-16 03:11:48,690 - experiment_functions - INFO - Early stopping at epoch 500. Best Recall: 0.0013
2026-05-16 03:11:48,799 - optuna.study.study - INFO - Trial 246 finished with value: 0.001342707232242736 and parameters: {'n_layers': 1, 'embedding_dim': 256, 'lr': 0.0006221050866268732, 'lambda_val': 6.963961697221753e-06, 'batch_size': 1310, 'optimizer': 'SGD'}. Best is trial 127 with value: 0.14175544438329954.
2026-05-16 03:11:56,391 - optuna.study._optimize - INFO - Trial 247 pruned. 
2026-05-16 03:12:02,741 - optuna.study._optimize - INFO - Trial 248 pruned. 
2026-05-16 03:12:11,735 - optuna.study._optimize - INFO - Trial 249 pruned. 
2026-05-16 03:12:20,027 - experiment_functions - INFO - Early stopping at epoch 1200. Best Recall: 0.1288
2026-05-16 03:12:20,124 - optuna.study.study - INFO - Trial 250 finished with value: 0.12880469990166815 and parameters: {'n_layers': 1, 'embedding_dim': 256, 'lr': 0.0010358946644358695, 'lambda_val': 6.091263499925902e-06, 'batch_size': 1031, 'optimizer': 'Adam'}. Best is trial 127 with value: 0.14175544438329954.
2026-05-16 03:12:27,391 - optuna.study._optimize - INFO - Trial 251 pruned. 
2026-05-16 03:12:34,370 - experiment_functions - INFO - Early stopping at epoch 650. Best Recall: 0.0480
2026-05-16 03:12:34,470 - optuna.study.study - INFO - Trial 252 finished with value: 0.04804053882004215 and parameters: {'n_layers': 4, 'embedding_dim': 256, 'lr': 0.0010568324488307323, 'lambda_val': 6.382801742141952e-06, 'batch_size': 921, 'optimizer': 'Adam'}. Best is trial 127 with value: 0.14175544438329954.
2026-05-16 03:12:41,185 - optuna.study._optimize - INFO - Trial 253 pruned. 
2026-05-16 03:12:50,166 - experiment_functions - INFO - Early stopping at epoch 1450. Best Recall: 0.1275
2026-05-16 03:12:50,264 - optuna.study.study - INFO - Trial 254 finished with value: 0.127541849743018 and parameters: {'n_layers': 1, 'embedding_dim': 256, 'lr': 0.0007316398838491292, 'lambda_val': 5.401334507360174e-06, 'batch_size': 1140, 'optimizer': 'Adam'}. Best is trial 127 with value: 0.14175544438329954.
2026-05-16 03:13:11,737 - experiment_functions - INFO - Early stopping at epoch 3600. Best Recall: 0.1419
2026-05-16 03:13:11,830 - optuna.study.study - INFO - Trial 255 finished with value: 0.14188708879956208 and parameters: {'n_layers': 1, 'embedding_dim': 256, 'lr': 0.0005071976992947786, 'lambda_val': 7.631932841246353e-06, 'batch_size': 726, 'optimizer': 'Adam'}. Best is trial 255 with value: 0.14188708879956208.
2026-05-16 03:13:18,606 - optuna.study._optimize - INFO - Trial 256 pruned. 
2026-05-16 03:13:25,174 - optuna.study._optimize - INFO - Trial 257 pruned. 
2026-05-16 03:13:34,087 - optuna.study._optimize - INFO - Trial 258 pruned. 
2026-05-16 03:13:40,540 - optuna.study._optimize - INFO - Trial 259 pruned. 
2026-05-16 03:13:44,508 - experiment_functions - INFO - Early stopping at epoch 550. Best Recall: 0.0659
2026-05-16 03:13:44,685 - optuna.study.study - INFO - Trial 260 finished with value: 0.06591324483482965 and parameters: {'n_layers': 1, 'embedding_dim': 256, 'lr': 0.012185159697277893, 'lambda_val': 2.634559935614491e-06, 'batch_size': 855, 'optimizer': 'Adam'}. Best is trial 255 with value: 0.14188708879956208.
2026-05-16 03:13:51,860 - optuna.study._optimize - INFO - Trial 261 pruned. 
2026-05-16 03:14:09,101 - optuna.study._optimize - INFO - Trial 262 pruned. 
2026-05-16 03:14:15,498 - optuna.study._optimize - INFO - Trial 263 pruned. 
2026-05-16 03:14:23,302 - optuna.study._optimize - INFO - Trial 264 pruned. 
2026-05-16 03:14:30,072 - optuna.study._optimize - INFO - Trial 265 pruned. 
2026-05-16 03:14:36,914 - experiment_functions - INFO - Early stopping at epoch 1100. Best Recall: 0.1205
2026-05-16 03:14:39,626 - optuna.study.study - INFO - Trial 266 finished with value: 0.12047283834489486 and parameters: {'n_layers': 1, 'embedding_dim': 256, 'lr': 0.0007959696433592519, 'lambda_val': 8.99320631178279e-06, 'batch_size': 1181, 'optimizer': 'Adam'}. Best is trial 255 with value: 0.14188708879956208.
2026-05-16 03:14:46,227 - optuna.study._optimize - INFO - Trial 267 pruned. 
2026-05-16 03:14:52,865 - optuna.study._optimize - INFO - Trial 268 pruned. 
2026-05-16 03:15:00,232 - optuna.study._optimize - INFO - Trial 269 pruned. 
2026-05-16 03:15:03,711 - experiment_functions - INFO - Early stopping at epoch 500. Best Recall: 0.0057
2026-05-16 03:15:03,802 - optuna.study.study - INFO - Trial 270 finished with value: 0.0056536864838050895 and parameters: {'n_layers': 1, 'embedding_dim': 256, 'lr': 0.0009649112640507446, 'lambda_val': 5.672210451319622e-06, 'batch_size': 1231, 'optimizer': 'SGD'}. Best is trial 255 with value: 0.14188708879956208.
2026-05-16 03:15:20,051 - experiment_functions - INFO - Early stopping at epoch 2300. Best Recall: 0.1293
2026-05-16 03:15:20,149 - optuna.study.study - INFO - Trial 271 finished with value: 0.1293314127103644 and parameters: {'n_layers': 1, 'embedding_dim': 256, 'lr': 0.0005722217127503329, 'lambda_val': 9.426627477431892e-06, 'batch_size': 955, 'optimizer': 'Adam'}. Best is trial 255 with value: 0.14188708879956208.
2026-05-16 03:15:27,345 - optuna.study._optimize - INFO - Trial 272 pruned. 
2026-05-16 03:15:34,228 - optuna.study._optimize - INFO - Trial 273 pruned. 
2026-05-16 03:15:49,490 - optuna.study._optimize - INFO - Trial 274 pruned. 
2026-05-16 03:15:55,303 - experiment_functions - INFO - Early stopping at epoch 850. Best Recall: 0.1119
2026-05-16 03:15:55,402 - optuna.study.study - INFO - Trial 275 finished with value: 0.11190265334011863 and parameters: {'n_layers': 1, 'embedding_dim': 256, 'lr': 0.000814750767642992, 'lambda_val': 9.427824799880428e-06, 'batch_size': 3145, 'optimizer': 'RMSprop'}. Best is trial 255 with value: 0.14188708879956208.
2026-05-16 03:16:01,551 - optuna.study._optimize - INFO - Trial 276 pruned. 
2026-05-16 03:16:19,788 - experiment_functions - INFO - Early stopping at epoch 3000. Best Recall: 0.1382
2026-05-16 03:16:19,877 - optuna.study.study - INFO - Trial 277 finished with value: 0.1382159861913557 and parameters: {'n_layers': 1, 'embedding_dim': 256, 'lr': 0.0005466713036375406, 'lambda_val': 8.091763380865995e-06, 'batch_size': 933, 'optimizer': 'Adam'}. Best is trial 255 with value: 0.14188708879956208.
2026-05-16 03:16:26,424 - optuna.study._optimize - INFO - Trial 278 pruned. 
2026-05-16 03:16:32,489 - experiment_functions - INFO - Early stopping at epoch 950. Best Recall: 0.0024
2026-05-16 03:16:32,656 - optuna.study.study - INFO - Trial 279 finished with value: 0.0023652261306922775 and parameters: {'n_layers': 1, 'embedding_dim': 256, 'lr': 5.333682999296612e-05, 'lambda_val': 8.160171395783957e-06, 'batch_size': 783, 'optimizer': 'Adam'}. Best is trial 255 with value: 0.14188708879956208.
2026-05-16 03:16:41,072 - optuna.study._optimize - INFO - Trial 280 pruned. 
2026-05-16 03:16:48,243 - optuna.study._optimize - INFO - Trial 281 pruned. 
2026-05-16 03:17:01,302 - experiment_functions - INFO - Early stopping at epoch 2150. Best Recall: 0.1283
2026-05-16 03:17:01,395 - optuna.study.study - INFO - Trial 282 finished with value: 0.12830048516014378 and parameters: {'n_layers': 1, 'embedding_dim': 256, 'lr': 0.000585339078859232, 'lambda_val': 3.990681544855935e-06, 'batch_size': 1046, 'optimizer': 'Adam'}. Best is trial 255 with value: 0.14188708879956208.
2026-05-16 03:17:09,411 - experiment_functions - INFO - Early stopping at epoch 1300. Best Recall: 0.1221
2026-05-16 03:17:09,504 - optuna.study.study - INFO - Trial 283 finished with value: 0.12212299041880857 and parameters: {'n_layers': 1, 'embedding_dim': 256, 'lr': 0.000910862579439534, 'lambda_val': 1.4657403530976516e-05, 'batch_size': 937, 'optimizer': 'Adam'}. Best is trial 255 with value: 0.14188708879956208.
2026-05-16 03:17:16,438 - optuna.study._optimize - INFO - Trial 284 pruned. 
2026-05-16 03:17:37,638 - optuna.study._optimize - INFO - Trial 285 pruned. 
2026-05-16 03:17:44,243 - optuna.study._optimize - INFO - Trial 286 pruned. 
2026-05-16 03:18:02,879 - experiment_functions - INFO - Early stopping at epoch 1650. Best Recall: 0.1300
2026-05-16 03:18:02,972 - optuna.study.study - INFO - Trial 287 finished with value: 0.12997430800369564 and parameters: {'n_layers': 1, 'embedding_dim': 256, 'lr': 0.0006586003977189193, 'lambda_val': 3.0134065684825474e-06, 'batch_size': 888, 'optimizer': 'Adam'}. Best is trial 255 with value: 0.14188708879956208.
2026-05-16 03:18:09,333 - optuna.study._optimize - INFO - Trial 288 pruned. 
2026-05-16 03:18:16,087 - experiment_functions - INFO - Early stopping at epoch 900. Best Recall: 0.0818
2026-05-16 03:18:16,237 - optuna.study.study - INFO - Trial 289 finished with value: 0.08180762856418643 and parameters: {'n_layers': 2, 'embedding_dim': 256, 'lr': 0.0006790434067861971, 'lambda_val': 3.797458861629422e-06, 'batch_size': 740, 'optimizer': 'Adam'}. Best is trial 255 with value: 0.14188708879956208.
2026-05-16 03:18:27,456 - optuna.study._optimize - INFO - Trial 290 pruned. 
2026-05-16 03:18:33,886 - optuna.study._optimize - INFO - Trial 291 pruned. 
2026-05-16 03:18:44,261 - experiment_functions - INFO - Early stopping at epoch 1700. Best Recall: 0.1248
2026-05-16 03:18:44,366 - optuna.study.study - INFO - Trial 292 finished with value: 0.12478420820137488 and parameters: {'n_layers': 1, 'embedding_dim': 256, 'lr': 0.0006354148348391457, 'lambda_val': 1.5533893461354428e-06, 'batch_size': 817, 'optimizer': 'Adam'}. Best is trial 255 with value: 0.14188708879956208.
2026-05-16 03:18:51,537 - optuna.study._optimize - INFO - Trial 293 pruned. 
2026-05-16 03:18:57,009 - experiment_functions - INFO - Early stopping at epoch 500. Best Recall: 0.0021
2026-05-16 03:18:57,135 - optuna.study.study - INFO - Trial 294 finished with value: 0.0021341688831419295 and parameters: {'n_layers': 1, 'embedding_dim': 256, 'lr': 0.0007400718147810959, 'lambda_val': 2.9552341475349017e-06, 'batch_size': 1070, 'optimizer': 'SGD'}. Best is trial 255 with value: 0.14188708879956208.
2026-05-16 03:19:04,899 - optuna.study._optimize - INFO - Trial 295 pruned. 
2026-05-16 03:19:11,690 - optuna.study._optimize - INFO - Trial 296 pruned. 
2026-05-16 03:19:28,059 - experiment_functions - INFO - Early stopping at epoch 1750. Best Recall: 0.1310
2026-05-16 03:19:28,163 - optuna.study.study - INFO - Trial 297 finished with value: 0.1310382084017847 and parameters: {'n_layers': 1, 'embedding_dim': 256, 'lr': 0.0005255460435180621, 'lambda_val': 1.5575326489841397e-05, 'batch_size': 1045, 'optimizer': 'Adam'}. Best is trial 255 with value: 0.14188708879956208.
2026-05-16 03:19:35,229 - optuna.study._optimize - INFO - Trial 298 pruned. 
2026-05-16 03:19:44,618 - experiment_functions - INFO - Early stopping at epoch 1500. Best Recall: 0.1289
2026-05-16 03:19:44,710 - optuna.study.study - INFO - Trial 299 finished with value: 0.12891413864076837 and parameters: {'n_layers': 1, 'embedding_dim': 256, 'lr': 0.0005152018206544961, 'lambda_val': 1.5579556566106957e-05, 'batch_size': 1039, 'optimizer': 'RMSprop'}. Best is trial 255 with value: 0.14188708879956208.
2026-05-16 03:19:53,308 - experiment_functions - INFO - Early stopping at epoch 2400. Best Recall: 0.1250
2026-05-16 03:19:53,419 - root - INFO -   **** Training e_100K_1c2dcs_rand3
2026-05-16 03:19:53,432 - root - INFO -   **** Getting 67885/81200 random edges
2026-05-16 03:19:53,542 - optuna.storages._rdb.storage - INFO - A new study created in RDB with name: Study_e_100K_1c2dcs_rand3
2026-05-16 03:19:57,856 - experiment_functions - INFO - Early stopping at epoch 500. Best Recall: 0.0027
2026-05-16 03:19:57,953 - optuna.study.study - INFO - Trial 0 finished with value: 0.002747622974896469 and parameters: {'n_layers': 4, 'embedding_dim': 96, 'lr': 1.9049465311289174e-05, 'lambda_val': 0.01974273838041031, 'batch_size': 1995, 'optimizer': 'Adam'}. Best is trial 0 with value: 0.002747622974896469.
2026-05-16 03:20:01,238 - experiment_functions - INFO - Early stopping at epoch 500. Best Recall: 0.0014
2026-05-16 03:20:01,332 - optuna.study.study - INFO - Trial 1 finished with value: 0.0013961377920947273 and parameters: {'n_layers': 1, 'embedding_dim': 96, 'lr': 0.006343587374509814, 'lambda_val': 0.00023710047285797705, 'batch_size': 2643, 'optimizer': 'SGD'}. Best is trial 0 with value: 0.002747622974896469.
2026-05-16 03:20:35,478 - experiment_functions - INFO - Early stopping at epoch 3850. Best Recall: 0.0975
2026-05-16 03:20:35,576 - optuna.study.study - INFO - Trial 2 finished with value: 0.09747864969654978 and parameters: {'n_layers': 1, 'embedding_dim': 64, 'lr': 0.0003026132840761996, 'lambda_val': 3.034215872820626e-06, 'batch_size': 3720, 'optimizer': 'Adam'}. Best is trial 2 with value: 0.09747864969654978.
2026-05-16 03:20:40,573 - experiment_functions - INFO - Early stopping at epoch 500. Best Recall: 0.0024
2026-05-16 03:20:40,655 - optuna.study.study - INFO - Trial 3 finished with value: 0.002442708430583427 and parameters: {'n_layers': 4, 'embedding_dim': 256, 'lr': 0.012932959321743258, 'lambda_val': 5.5619033325590846e-05, 'batch_size': 3665, 'optimizer': 'SGD'}. Best is trial 2 with value: 0.09747864969654978.
2026-05-16 03:20:44,863 - experiment_functions - INFO - Early stopping at epoch 650. Best Recall: 0.0018
2026-05-16 03:20:44,965 - optuna.study.study - INFO - Trial 4 finished with value: 0.0018206477280931512 and parameters: {'n_layers': 1, 'embedding_dim': 96, 'lr': 4.205005008220493e-05, 'lambda_val': 0.005825605523375583, 'batch_size': 1370, 'optimizer': 'RMSprop'}. Best is trial 2 with value: 0.09747864969654978.
2026-05-16 03:20:51,835 - optuna.study._optimize - INFO - Trial 5 pruned. 
2026-05-16 03:20:57,812 - optuna.study._optimize - INFO - Trial 6 pruned. 
2026-05-16 03:21:07,256 - optuna.study._optimize - INFO - Trial 7 pruned. 
2026-05-16 03:21:18,603 - experiment_functions - INFO - Early stopping at epoch 500. Best Recall: 0.0024
2026-05-16 03:21:19,171 - optuna.study.study - INFO - Trial 8 finished with value: 0.0023768810880282843 and parameters: {'n_layers': 1, 'embedding_dim': 256, 'lr': 0.012890984817465199, 'lambda_val': 0.0009753134615171812, 'batch_size': 1907, 'optimizer': 'SGD'}. Best is trial 2 with value: 0.09747864969654978.
2026-05-16 03:21:25,375 - experiment_functions - INFO - Early stopping at epoch 500. Best Recall: 0.0036
2026-05-16 03:21:25,490 - optuna.study.study - INFO - Trial 9 finished with value: 0.003572979794011965 and parameters: {'n_layers': 2, 'embedding_dim': 256, 'lr': 0.027450027217636435, 'lambda_val': 6.077401971313283e-05, 'batch_size': 668, 'optimizer': 'SGD'}. Best is trial 2 with value: 0.09747864969654978.
2026-05-16 03:21:31,917 - optuna.study._optimize - INFO - Trial 10 pruned. 
2026-05-16 03:21:35,164 - experiment_functions - INFO - Early stopping at epoch 500. Best Recall: 0.0019
2026-05-16 03:21:35,245 - optuna.study.study - INFO - Trial 11 finished with value: 0.001923474272215538 and parameters: {'n_layers': 2, 'embedding_dim': 64, 'lr': 0.0010006241535272858, 'lambda_val': 4.721452838643129e-06, 'batch_size': 538, 'optimizer': 'SGD'}. Best is trial 2 with value: 0.09747864969654978.
2026-05-16 03:21:40,122 - experiment_functions - INFO - Early stopping at epoch 650. Best Recall: 0.0422
2026-05-16 03:21:40,214 - optuna.study.study - INFO - Trial 12 finished with value: 0.0421778771621425 and parameters: {'n_layers': 3, 'embedding_dim': 64, 'lr': 0.0018497973951940932, 'lambda_val': 1.8046231464974174e-05, 'batch_size': 3226, 'optimizer': 'Adam'}. Best is trial 2 with value: 0.09747864969654978.
2026-05-16 03:21:52,433 - experiment_functions - INFO - Early stopping at epoch 600. Best Recall: 0.0459
2026-05-16 03:21:52,967 - optuna.study.study - INFO - Trial 13 finished with value: 0.04586929869825581 and parameters: {'n_layers': 3, 'embedding_dim': 64, 'lr': 0.0019159713961032223, 'lambda_val': 8.103423287017308e-06, 'batch_size': 3248, 'optimizer': 'Adam'}. Best is trial 2 with value: 0.09747864969654978.
2026-05-16 03:21:57,621 - experiment_functions - INFO - Early stopping at epoch 600. Best Recall: 0.0382
2026-05-16 03:21:57,735 - optuna.study.study - INFO - Trial 14 finished with value: 0.03815804441502784 and parameters: {'n_layers': 3, 'embedding_dim': 64, 'lr': 0.0030119168546136835, 'lambda_val': 1.1708880205189634e-06, 'batch_size': 3490, 'optimizer': 'Adam'}. Best is trial 2 with value: 0.09747864969654978.
2026-05-16 03:22:04,644 - optuna.study._optimize - INFO - Trial 15 pruned. 
2026-05-16 03:22:12,446 - optuna.study._optimize - INFO - Trial 16 pruned. 
2026-05-16 03:22:17,709 - experiment_functions - INFO - Early stopping at epoch 800. Best Recall: 0.0515
