2026-05-15 23:54:53,044 - optuna.study.study - INFO - Trial 286 finished with value: 0.07475699747905161 and parameters: {'n_layers': 2, 'embedding_dim': 256, 'lr': 0.0006801814358217868, 'lambda_val': 2.3509385557515424e-05, 'batch_size': 1723, 'optimizer': 'Adam'}. Best is trial 247 with value: 0.13052294839490056.
2026-05-15 23:55:04,640 - experiment_functions - INFO - Early stopping at epoch 1750. Best Recall: 0.1303
2026-05-15 23:55:04,731 - optuna.study.study - INFO - Trial 287 finished with value: 0.13027725656480962 and parameters: {'n_layers': 1, 'embedding_dim': 256, 'lr': 0.0005390807477105016, 'lambda_val': 4.132646966396597e-05, 'batch_size': 1451, 'optimizer': 'Adam'}. Best is trial 247 with value: 0.13052294839490056.
2026-05-15 23:55:11,664 - optuna.study._optimize - INFO - Trial 288 pruned. 
2026-05-15 23:55:22,205 - experiment_functions - INFO - Early stopping at epoch 1650. Best Recall: 0.1193
2026-05-15 23:55:22,297 - optuna.study.study - INFO - Trial 289 finished with value: 0.11926283878881634 and parameters: {'n_layers': 1, 'embedding_dim': 256, 'lr': 0.0005087473499306061, 'lambda_val': 2.6950139341188606e-05, 'batch_size': 1424, 'optimizer': 'Adam'}. Best is trial 247 with value: 0.13052294839490056.
2026-05-15 23:55:29,026 - optuna.study._optimize - INFO - Trial 290 pruned. 
2026-05-15 23:55:32,734 - experiment_functions - INFO - Early stopping at epoch 500. Best Recall: 0.0015
2026-05-15 23:55:32,835 - optuna.study.study - INFO - Trial 291 finished with value: 0.001535460708703668 and parameters: {'n_layers': 1, 'embedding_dim': 256, 'lr': 0.00037616977254852676, 'lambda_val': 0.00013456227360336462, 'batch_size': 2572, 'optimizer': 'SGD'}. Best is trial 247 with value: 0.13052294839490056.
2026-05-15 23:55:40,087 - experiment_functions - INFO - Early stopping at epoch 700. Best Recall: 0.0343
2026-05-15 23:55:40,186 - optuna.study.study - INFO - Trial 292 finished with value: 0.034345148149328215 and parameters: {'n_layers': 4, 'embedding_dim': 256, 'lr': 0.000761262054133097, 'lambda_val': 3.44708933950105e-05, 'batch_size': 4018, 'optimizer': 'Adam'}. Best is trial 247 with value: 0.13052294839490056.
2026-05-15 23:55:47,195 - optuna.study._optimize - INFO - Trial 293 pruned. 
2026-05-15 23:55:54,076 - optuna.study._optimize - INFO - Trial 294 pruned. 
2026-05-15 23:56:00,547 - optuna.study._optimize - INFO - Trial 295 pruned. 
2026-05-15 23:56:10,830 - experiment_functions - INFO - Early stopping at epoch 1600. Best Recall: 0.1180
2026-05-15 23:56:10,920 - optuna.study.study - INFO - Trial 296 finished with value: 0.1179941279830548 and parameters: {'n_layers': 1, 'embedding_dim': 256, 'lr': 0.0005378409044683413, 'lambda_val': 7.787622703960306e-05, 'batch_size': 1704, 'optimizer': 'Adam'}. Best is trial 247 with value: 0.13052294839490056.
2026-05-15 23:56:18,674 - optuna.study._optimize - INFO - Trial 297 pruned. 
2026-05-15 23:56:25,328 - optuna.study._optimize - INFO - Trial 298 pruned. 
2026-05-15 23:56:32,071 - optuna.study._optimize - INFO - Trial 299 pruned. 
2026-05-15 23:56:44,515 - experiment_functions - INFO - Early stopping at epoch 3450. Best Recall: 0.1166
2026-05-15 23:56:44,623 - root - INFO -   **** Training e_100K_1c1dcs_rand5
2026-05-15 23:56:44,637 - root - INFO -   **** Getting 65267/81200 random edges
2026-05-15 23:56:44,773 - optuna.storages._rdb.storage - INFO - A new study created in RDB with name: Study_e_100K_1c1dcs_rand5
2026-05-15 23:57:03,267 - experiment_functions - INFO - Early stopping at epoch 2800. Best Recall: 0.0178
2026-05-15 23:57:03,384 - optuna.study.study - INFO - Trial 0 finished with value: 0.017784817633103963 and parameters: {'n_layers': 3, 'embedding_dim': 96, 'lr': 6.054740290159182e-05, 'lambda_val': 1.8771275335972245e-06, 'batch_size': 3551, 'optimizer': 'RMSprop'}. Best is trial 0 with value: 0.017784817633103963.
2026-05-15 23:57:07,860 - experiment_functions - INFO - Early stopping at epoch 500. Best Recall: 0.0043
2026-05-15 23:57:07,985 - optuna.study.study - INFO - Trial 1 finished with value: 0.004304378910550169 and parameters: {'n_layers': 3, 'embedding_dim': 256, 'lr': 1.1815229710329134e-05, 'lambda_val': 0.0915078984131637, 'batch_size': 2255, 'optimizer': 'SGD'}. Best is trial 0 with value: 0.017784817633103963.
2026-05-15 23:57:13,694 - experiment_functions - INFO - Early stopping at epoch 600. Best Recall: 0.0312
2026-05-15 23:57:13,790 - optuna.study.study - INFO - Trial 2 finished with value: 0.031215928027666172 and parameters: {'n_layers': 1, 'embedding_dim': 32, 'lr': 0.03488475725827617, 'lambda_val': 7.751361499012325e-05, 'batch_size': 3352, 'optimizer': 'Adam'}. Best is trial 2 with value: 0.031215928027666172.
2026-05-15 23:57:23,152 - experiment_functions - INFO - Early stopping at epoch 500. Best Recall: 0.0026
2026-05-15 23:57:23,914 - optuna.study.study - INFO - Trial 3 finished with value: 0.0025724103202084013 and parameters: {'n_layers': 1, 'embedding_dim': 256, 'lr': 3.669556102658846e-05, 'lambda_val': 0.0003312390399477563, 'batch_size': 2853, 'optimizer': 'Adam'}. Best is trial 2 with value: 0.031215928027666172.
2026-05-15 23:57:31,458 - experiment_functions - INFO - Early stopping at epoch 500. Best Recall: 0.0024
2026-05-15 23:57:31,639 - optuna.study.study - INFO - Trial 4 finished with value: 0.0024128794042538705 and parameters: {'n_layers': 3, 'embedding_dim': 128, 'lr': 0.0014446139500369707, 'lambda_val': 0.0007026352637087583, 'batch_size': 3529, 'optimizer': 'SGD'}. Best is trial 2 with value: 0.031215928027666172.
2026-05-15 23:57:53,256 - optuna.study.study - INFO - Trial 5 finished with value: 0.05258048562733628 and parameters: {'n_layers': 1, 'embedding_dim': 96, 'lr': 0.0001219419051432774, 'lambda_val': 2.4251863233104386e-06, 'batch_size': 4060, 'optimizer': 'Adam'}. Best is trial 5 with value: 0.05258048562733628.
2026-05-15 23:57:59,336 - experiment_functions - INFO - Early stopping at epoch 900. Best Recall: 0.0674
2026-05-15 23:57:59,432 - optuna.study.study - INFO - Trial 6 finished with value: 0.06737644414150007 and parameters: {'n_layers': 1, 'embedding_dim': 32, 'lr': 0.003295103506812094, 'lambda_val': 1.2880607617942091e-05, 'batch_size': 1085, 'optimizer': 'RMSprop'}. Best is trial 6 with value: 0.06737644414150007.
2026-05-15 23:58:06,720 - optuna.study._optimize - INFO - Trial 7 pruned. 
2026-05-15 23:58:15,779 - optuna.study._optimize - INFO - Trial 8 pruned. 
2026-05-15 23:58:20,244 - experiment_functions - INFO - Early stopping at epoch 500. Best Recall: 0.0024
2026-05-15 23:58:20,335 - optuna.study.study - INFO - Trial 9 finished with value: 0.0024403051151768054 and parameters: {'n_layers': 3, 'embedding_dim': 128, 'lr': 1.1787333402841828e-05, 'lambda_val': 1.8415241000986104e-05, 'batch_size': 3863, 'optimizer': 'SGD'}. Best is trial 6 with value: 0.06737644414150007.
2026-05-15 23:58:27,741 - experiment_functions - INFO - Early stopping at epoch 1300. Best Recall: 0.0291
2026-05-15 23:58:27,854 - optuna.study.study - INFO - Trial 10 finished with value: 0.029074270819056905 and parameters: {'n_layers': 2, 'embedding_dim': 64, 'lr': 0.00441584778219329, 'lambda_val': 0.002208267116649806, 'batch_size': 637, 'optimizer': 'RMSprop'}. Best is trial 6 with value: 0.06737644414150007.
2026-05-15 23:58:43,709 - experiment_functions - INFO - Early stopping at epoch 2950. Best Recall: 0.0705
2026-05-15 23:58:43,814 - optuna.study.study - INFO - Trial 11 finished with value: 0.07049500357256157 and parameters: {'n_layers': 1, 'embedding_dim': 32, 'lr': 0.00029789964815017965, 'lambda_val': 1.2894563463659635e-06, 'batch_size': 1500, 'optimizer': 'RMSprop'}. Best is trial 11 with value: 0.07049500357256157.
2026-05-15 23:58:55,757 - experiment_functions - INFO - Early stopping at epoch 1950. Best Recall: 0.0696
2026-05-15 23:58:55,866 - optuna.study.study - INFO - Trial 12 finished with value: 0.06955044891800673 and parameters: {'n_layers': 2, 'embedding_dim': 32, 'lr': 0.0003901706950761829, 'lambda_val': 8.925508108767822e-06, 'batch_size': 1473, 'optimizer': 'RMSprop'}. Best is trial 11 with value: 0.07049500357256157.
2026-05-15 23:59:11,372 - experiment_functions - INFO - Early stopping at epoch 2800. Best Recall: 0.0803
2026-05-15 23:59:11,496 - optuna.study.study - INFO - Trial 13 finished with value: 0.08027980223578896 and parameters: {'n_layers': 2, 'embedding_dim': 32, 'lr': 0.0003457409113261316, 'lambda_val': 1.1887923499063503e-06, 'batch_size': 1649, 'optimizer': 'RMSprop'}. Best is trial 13 with value: 0.08027980223578896.
2026-05-15 23:59:20,215 - optuna.study._optimize - INFO - Trial 14 pruned. 
2026-05-15 23:59:33,108 - experiment_functions - INFO - Early stopping at epoch 1300. Best Recall: 0.0483
2026-05-15 23:59:33,876 - optuna.study.study - INFO - Trial 15 finished with value: 0.04825851817553792 and parameters: {'n_layers': 2, 'embedding_dim': 32, 'lr': 0.00042390675496990754, 'lambda_val': 0.00681394515220982, 'batch_size': 1703, 'optimizer': 'RMSprop'}. Best is trial 13 with value: 0.08027980223578896.
2026-05-15 23:59:40,766 - experiment_functions - INFO - Early stopping at epoch 550. Best Recall: 0.0545
2026-05-15 23:59:40,945 - optuna.study.study - INFO - Trial 16 finished with value: 0.054473486128847406 and parameters: {'n_layers': 1, 'embedding_dim': 64, 'lr': 0.008308186581201766, 'lambda_val': 4.8020707962897095e-06, 'batch_size': 2528, 'optimizer': 'RMSprop'}. Best is trial 13 with value: 0.08027980223578896.
2026-05-15 23:59:45,761 - experiment_functions - INFO - Early stopping at epoch 700. Best Recall: 0.0588
2026-05-15 23:59:45,909 - optuna.study.study - INFO - Trial 17 finished with value: 0.05878451815592309 and parameters: {'n_layers': 2, 'embedding_dim': 32, 'lr': 0.0010295925167357718, 'lambda_val': 4.5677305054092064e-05, 'batch_size': 1270, 'optimizer': 'RMSprop'}. Best is trial 13 with value: 0.08027980223578896.
2026-05-15 23:59:58,215 - optuna.study._optimize - INFO - Trial 18 pruned. 
2026-05-16 00:00:07,405 - optuna.study._optimize - INFO - Trial 19 pruned. 
2026-05-16 00:00:11,571 - experiment_functions - INFO - Early stopping at epoch 500. Best Recall: 0.0017
2026-05-16 00:00:11,726 - optuna.study.study - INFO - Trial 20 finished with value: 0.0017078920396231458 and parameters: {'n_layers': 1, 'embedding_dim': 64, 'lr': 0.0009017390135311925, 'lambda_val': 0.03427857949376993, 'batch_size': 2639, 'optimizer': 'SGD'}. Best is trial 13 with value: 0.08027980223578896.
2026-05-16 00:00:21,102 - experiment_functions - INFO - Early stopping at epoch 1700. Best Recall: 0.0746
2026-05-16 00:00:21,204 - optuna.study.study - INFO - Trial 21 finished with value: 0.07460922183952667 and parameters: {'n_layers': 2, 'embedding_dim': 32, 'lr': 0.000482928916320012, 'lambda_val': 6.544594664104134e-06, 'batch_size': 1411, 'optimizer': 'RMSprop'}. Best is trial 13 with value: 0.08027980223578896.
2026-05-16 00:00:30,193 - experiment_functions - INFO - Early stopping at epoch 1100. Best Recall: 0.0674
2026-05-16 00:00:30,307 - optuna.study.study - INFO - Trial 22 finished with value: 0.0673724527640007 and parameters: {'n_layers': 2, 'embedding_dim': 32, 'lr': 0.0006553219986712425, 'lambda_val': 3.7056658693400796e-06, 'batch_size': 1489, 'optimizer': 'RMSprop'}. Best is trial 13 with value: 0.08027980223578896.
2026-05-16 00:00:34,598 - experiment_functions - INFO - Early stopping at epoch 650. Best Recall: 0.0398
2026-05-16 00:00:34,791 - optuna.study.study - INFO - Trial 23 finished with value: 0.03979466504019772 and parameters: {'n_layers': 2, 'embedding_dim': 32, 'lr': 0.0019364791148666822, 'lambda_val': 2.752348014842192e-06, 'batch_size': 1127, 'optimizer': 'RMSprop'}. Best is trial 13 with value: 0.08027980223578896.
2026-05-16 00:00:41,150 - optuna.study._optimize - INFO - Trial 24 pruned. 
2026-05-16 00:00:46,617 - experiment_functions - INFO - Early stopping at epoch 650. Best Recall: 0.0381
2026-05-16 00:00:46,753 - optuna.study.study - INFO - Trial 25 finished with value: 0.03812561451577118 and parameters: {'n_layers': 2, 'embedding_dim': 256, 'lr': 0.011079722450618007, 'lambda_val': 1.1206257118446398e-06, 'batch_size': 858, 'optimizer': 'RMSprop'}. Best is trial 13 with value: 0.08027980223578896.
2026-05-16 00:00:52,571 - optuna.study._optimize - INFO - Trial 26 pruned. 
2026-05-16 00:00:56,487 - experiment_functions - INFO - Early stopping at epoch 550. Best Recall: 0.0411
2026-05-16 00:00:56,587 - optuna.study.study - INFO - Trial 27 finished with value: 0.0410664891518129 and parameters: {'n_layers': 2, 'embedding_dim': 32, 'lr': 0.0021990147903582532, 'lambda_val': 7.291614466368866e-06, 'batch_size': 1619, 'optimizer': 'RMSprop'}. Best is trial 13 with value: 0.08027980223578896.
2026-05-16 00:01:14,980 - experiment_functions - INFO - Early stopping at epoch 1350. Best Recall: 0.0635
2026-05-16 00:01:15,090 - optuna.study.study - INFO - Trial 28 finished with value: 0.06348652307234283 and parameters: {'n_layers': 3, 'embedding_dim': 32, 'lr': 0.0005448237468687712, 'lambda_val': 9.748725594843109e-05, 'batch_size': 899, 'optimizer': 'RMSprop'}. Best is trial 13 with value: 0.08027980223578896.
2026-05-16 00:01:19,049 - experiment_functions - INFO - Early stopping at epoch 500. Best Recall: 0.0014
2026-05-16 00:01:19,140 - optuna.study.study - INFO - Trial 29 finished with value: 0.0013503577895485437 and parameters: {'n_layers': 3, 'embedding_dim': 96, 'lr': 6.599127720275879e-05, 'lambda_val': 2.136659815173018e-06, 'batch_size': 2043, 'optimizer': 'SGD'}. Best is trial 13 with value: 0.08027980223578896.
2026-05-16 00:01:25,177 - optuna.study._optimize - INFO - Trial 30 pruned. 
2026-05-16 00:01:49,210 - optuna.study.study - INFO - Trial 31 finished with value: 0.07676729495816738 and parameters: {'n_layers': 2, 'embedding_dim': 32, 'lr': 0.00031811032377551684, 'lambda_val': 9.849573176127251e-06, 'batch_size': 1268, 'optimizer': 'RMSprop'}. Best is trial 13 with value: 0.08027980223578896.
2026-05-16 00:01:55,701 - optuna.study._optimize - INFO - Trial 32 pruned. 
2026-05-16 00:02:01,972 - optuna.study._optimize - INFO - Trial 33 pruned. 
2026-05-16 00:02:09,350 - experiment_functions - INFO - Early stopping at epoch 650. Best Recall: 0.0558
2026-05-16 00:02:09,451 - optuna.study.study - INFO - Trial 34 finished with value: 0.05583238043717229 and parameters: {'n_layers': 3, 'embedding_dim': 256, 'lr': 0.0006010759596064176, 'lambda_val': 5.053842211939295e-06, 'batch_size': 2293, 'optimizer': 'RMSprop'}. Best is trial 13 with value: 0.08027980223578896.
2026-05-16 00:02:13,204 - experiment_functions - INFO - Early stopping at epoch 500. Best Recall: 0.0012
2026-05-16 00:02:13,314 - optuna.study.study - INFO - Trial 35 finished with value: 0.0012248250268722665 and parameters: {'n_layers': 1, 'embedding_dim': 32, 'lr': 0.0012402410111323578, 'lambda_val': 1.0348321220827745e-06, 'batch_size': 785, 'optimizer': 'SGD'}. Best is trial 13 with value: 0.08027980223578896.
2026-05-16 00:02:20,283 - optuna.study._optimize - INFO - Trial 36 pruned. 
2026-05-16 00:02:26,842 - optuna.study._optimize - INFO - Trial 37 pruned. 
2026-05-16 00:02:35,846 - optuna.study._optimize - INFO - Trial 38 pruned. 
2026-05-16 00:02:42,970 - optuna.study._optimize - INFO - Trial 39 pruned. 
2026-05-16 00:02:46,486 - experiment_functions - INFO - Early stopping at epoch 500. Best Recall: 0.0028
2026-05-16 00:02:46,596 - optuna.study.study - INFO - Trial 40 finished with value: 0.0027689648327335723 and parameters: {'n_layers': 1, 'embedding_dim': 32, 'lr': 0.00013541607933374624, 'lambda_val': 1.915569310358405e-06, 'batch_size': 2122, 'optimizer': 'SGD'}. Best is trial 13 with value: 0.08027980223578896.
2026-05-16 00:02:56,948 - experiment_functions - INFO - Early stopping at epoch 1850. Best Recall: 0.0797
2026-05-16 00:02:57,038 - optuna.study.study - INFO - Trial 41 finished with value: 0.07967449129421471 and parameters: {'n_layers': 2, 'embedding_dim': 32, 'lr': 0.00042866916139171354, 'lambda_val': 7.814289081046115e-06, 'batch_size': 1460, 'optimizer': 'RMSprop'}. Best is trial 13 with value: 0.08027980223578896.
2026-05-16 00:03:02,449 - experiment_functions - INFO - Early stopping at epoch 950. Best Recall: 0.0579
2026-05-16 00:03:02,560 - optuna.study.study - INFO - Trial 42 finished with value: 0.05786749685988878 and parameters: {'n_layers': 2, 'embedding_dim': 32, 'lr': 0.0007744675284206108, 'lambda_val': 3.565047291594019e-06, 'batch_size': 1516, 'optimizer': 'RMSprop'}. Best is trial 13 with value: 0.08027980223578896.
2026-05-16 00:03:10,262 - experiment_functions - INFO - Early stopping at epoch 1350. Best Recall: 0.0681
2026-05-16 00:03:10,353 - optuna.study.study - INFO - Trial 43 finished with value: 0.06805559065607905 and parameters: {'n_layers': 2, 'embedding_dim': 32, 'lr': 0.0005192006594287918, 'lambda_val': 6.592637608836669e-05, 'batch_size': 1308, 'optimizer': 'RMSprop'}. Best is trial 13 with value: 0.08027980223578896.
2026-05-16 00:03:14,544 - experiment_functions - INFO - Early stopping at epoch 650. Best Recall: 0.0458
2026-05-16 00:03:14,667 - optuna.study.study - INFO - Trial 44 finished with value: 0.0457529139599806 and parameters: {'n_layers': 2, 'embedding_dim': 128, 'lr': 0.0015736966321231104, 'lambda_val': 6.085077274564899e-06, 'batch_size': 1120, 'optimizer': 'RMSprop'}. Best is trial 13 with value: 0.08027980223578896.
2026-05-16 00:03:19,781 - experiment_functions - INFO - Early stopping at epoch 600. Best Recall: 0.0347
2026-05-16 00:03:19,881 - optuna.study.study - INFO - Trial 45 finished with value: 0.034739655499165564 and parameters: {'n_layers': 3, 'embedding_dim': 32, 'lr': 0.0029110103679806376, 'lambda_val': 1.400374788751009e-05, 'batch_size': 1819, 'optimizer': 'Adam'}. Best is trial 13 with value: 0.08027980223578896.
2026-05-16 00:03:29,881 - optuna.study._optimize - INFO - Trial 46 pruned. 
2026-05-16 00:03:35,912 - optuna.study._optimize - INFO - Trial 47 pruned. 
2026-05-16 00:03:41,055 - optuna.study._optimize - INFO - Trial 48 pruned. 
2026-05-16 00:03:46,001 - experiment_functions - INFO - Early stopping at epoch 650. Best Recall: 0.0425
2026-05-16 00:03:46,101 - optuna.study.study - INFO - Trial 49 finished with value: 0.0425076842286966 and parameters: {'n_layers': 2, 'embedding_dim': 128, 'lr': 0.0064422614968520754, 'lambda_val': 8.759598025291832e-06, 'batch_size': 718, 'optimizer': 'RMSprop'}. Best is trial 13 with value: 0.08027980223578896.
2026-05-16 00:03:53,202 - experiment_functions - INFO - Early stopping at epoch 1250. Best Recall: 0.0904
2026-05-16 00:03:53,375 - optuna.study.study - INFO - Trial 50 finished with value: 0.09041355757855983 and parameters: {'n_layers': 1, 'embedding_dim': 64, 'lr': 0.0007936068774484367, 'lambda_val': 0.0019013871131914432, 'batch_size': 947, 'optimizer': 'Adam'}. Best is trial 50 with value: 0.09041355757855983.
2026-05-16 00:03:56,949 - experiment_functions - INFO - Early stopping at epoch 550. Best Recall: 0.0151
2026-05-16 00:03:57,041 - optuna.study.study - INFO - Trial 51 finished with value: 0.015101049280611796 and parameters: {'n_layers': 1, 'embedding_dim': 64, 'lr': 0.07141291796802172, 'lambda_val': 0.0040599562340633884, 'batch_size': 513, 'optimizer': 'Adam'}. Best is trial 50 with value: 0.09041355757855983.
2026-05-16 00:04:04,777 - experiment_functions - INFO - Early stopping at epoch 1250. Best Recall: 0.0851
2026-05-16 00:04:04,922 - optuna.study.study - INFO - Trial 52 finished with value: 0.0850906210365342 and parameters: {'n_layers': 1, 'embedding_dim': 64, 'lr': 0.0009145747579554245, 'lambda_val': 0.0011490273007414228, 'batch_size': 1183, 'optimizer': 'Adam'}. Best is trial 50 with value: 0.09041355757855983.
2026-05-16 00:04:13,581 - experiment_functions - INFO - Early stopping at epoch 1450. Best Recall: 0.1164
2026-05-16 00:04:13,719 - optuna.study.study - INFO - Trial 53 finished with value: 0.11640511090978119 and parameters: {'n_layers': 1, 'embedding_dim': 64, 'lr': 0.0010049912634965278, 'lambda_val': 0.0015143345024870951, 'batch_size': 980, 'optimizer': 'Adam'}. Best is trial 53 with value: 0.11640511090978119.
2026-05-16 00:04:20,328 - experiment_functions - INFO - Early stopping at epoch 950. Best Recall: 0.0943
2026-05-16 00:04:20,417 - optuna.study.study - INFO - Trial 54 finished with value: 0.09426746493711041 and parameters: {'n_layers': 1, 'embedding_dim': 64, 'lr': 0.0010396507191060144, 'lambda_val': 0.001267042499240921, 'batch_size': 956, 'optimizer': 'Adam'}. Best is trial 53 with value: 0.11640511090978119.
2026-05-16 00:04:29,325 - experiment_functions - INFO - Early stopping at epoch 1450. Best Recall: 0.1023
2026-05-16 00:04:29,416 - optuna.study.study - INFO - Trial 55 finished with value: 0.10231436131229517 and parameters: {'n_layers': 1, 'embedding_dim': 64, 'lr': 0.0011923504035910484, 'lambda_val': 0.0012792213920643706, 'batch_size': 1015, 'optimizer': 'Adam'}. Best is trial 53 with value: 0.11640511090978119.
2026-05-16 00:04:33,750 - experiment_functions - INFO - Early stopping at epoch 600. Best Recall: 0.0758
2026-05-16 00:04:33,840 - optuna.study.study - INFO - Trial 56 finished with value: 0.07575580505218295 and parameters: {'n_layers': 1, 'embedding_dim': 64, 'lr': 0.0036072182437612956, 'lambda_val': 0.001295065920268983, 'batch_size': 939, 'optimizer': 'Adam'}. Best is trial 53 with value: 0.11640511090978119.
2026-05-16 00:04:39,002 - experiment_functions - INFO - Early stopping at epoch 850. Best Recall: 0.0954
2026-05-16 00:04:39,102 - optuna.study.study - INFO - Trial 57 finished with value: 0.0953659381830977 and parameters: {'n_layers': 1, 'embedding_dim': 64, 'lr': 0.0011417731100945812, 'lambda_val': 0.0026105596286981727, 'batch_size': 685, 'optimizer': 'Adam'}. Best is trial 53 with value: 0.11640511090978119.
2026-05-16 00:04:45,420 - experiment_functions - INFO - Early stopping at epoch 950. Best Recall: 0.0852
