2026-05-15 20:17:54,453 - optuna.study.study - INFO - Trial 259 finished with value: 0.01917535223345929 and parameters: {'n_layers': 4, 'embedding_dim': 128, 'lr': 0.04880211890300189, 'lambda_val': 5.067632048373006e-05, 'batch_size': 3909, 'optimizer': 'Adam'}. Best is trial 119 with value: 0.025263757590283552.
2026-05-15 20:18:04,204 - experiment_functions - INFO - Early stopping at epoch 1600. Best Recall: 0.0230
2026-05-15 20:18:04,363 - optuna.study.study - INFO - Trial 260 finished with value: 0.023013436885022526 and parameters: {'n_layers': 4, 'embedding_dim': 64, 'lr': 0.03412407686196694, 'lambda_val': 7.81714406373136e-05, 'batch_size': 3692, 'optimizer': 'Adam'}. Best is trial 119 with value: 0.025263757590283552.
2026-05-15 20:18:14,037 - optuna.study._optimize - INFO - Trial 261 pruned. 
2026-05-15 20:18:20,674 - optuna.study._optimize - INFO - Trial 262 pruned. 
2026-05-15 20:18:39,500 - experiment_functions - INFO - Early stopping at epoch 2150. Best Recall: 0.0199
2026-05-15 20:18:39,646 - optuna.study.study - INFO - Trial 263 finished with value: 0.019851448848569757 and parameters: {'n_layers': 4, 'embedding_dim': 64, 'lr': 0.0631965935194766, 'lambda_val': 7.487457723284236e-05, 'batch_size': 3710, 'optimizer': 'Adam'}. Best is trial 119 with value: 0.025263757590283552.
2026-05-15 20:19:00,489 - experiment_functions - INFO - Early stopping at epoch 1850. Best Recall: 0.0198
2026-05-15 20:19:00,613 - optuna.study.study - INFO - Trial 264 finished with value: 0.01980968598064662 and parameters: {'n_layers': 4, 'embedding_dim': 64, 'lr': 0.05164532370393271, 'lambda_val': 7.977801149212003e-05, 'batch_size': 3435, 'optimizer': 'Adam'}. Best is trial 119 with value: 0.025263757590283552.
2026-05-15 20:19:08,741 - experiment_functions - INFO - Early stopping at epoch 1300. Best Recall: 0.0205
2026-05-15 20:19:08,886 - optuna.study.study - INFO - Trial 265 finished with value: 0.020481253616428528 and parameters: {'n_layers': 4, 'embedding_dim': 64, 'lr': 0.037936348277407994, 'lambda_val': 4.643213137594512e-05, 'batch_size': 3562, 'optimizer': 'Adam'}. Best is trial 119 with value: 0.025263757590283552.
2026-05-15 20:19:15,496 - optuna.study._optimize - INFO - Trial 266 pruned. 
2026-05-15 20:19:23,112 - optuna.study._optimize - INFO - Trial 267 pruned. 
2026-05-15 20:19:39,288 - experiment_functions - INFO - Early stopping at epoch 2800. Best Recall: 0.0228
2026-05-15 20:19:39,446 - optuna.study.study - INFO - Trial 268 finished with value: 0.02281750602052227 and parameters: {'n_layers': 4, 'embedding_dim': 64, 'lr': 0.04380540401695123, 'lambda_val': 6.181896395084992e-05, 'batch_size': 3759, 'optimizer': 'Adam'}. Best is trial 119 with value: 0.025263757590283552.
2026-05-15 20:19:46,384 - optuna.study._optimize - INFO - Trial 269 pruned. 
2026-05-15 20:19:59,034 - optuna.study._optimize - INFO - Trial 270 pruned. 
2026-05-15 20:20:03,983 - experiment_functions - INFO - Early stopping at epoch 700. Best Recall: 0.0155
2026-05-15 20:20:04,104 - optuna.study.study - INFO - Trial 271 finished with value: 0.015510621010858198 and parameters: {'n_layers': 4, 'embedding_dim': 64, 'lr': 0.07192654613788176, 'lambda_val': 0.0001252515769219702, 'batch_size': 4013, 'optimizer': 'Adam'}. Best is trial 119 with value: 0.025263757590283552.
2026-05-15 20:20:10,524 - optuna.study._optimize - INFO - Trial 272 pruned. 
2026-05-15 20:20:27,429 - optuna.study._optimize - INFO - Trial 273 pruned. 
2026-05-15 20:20:34,356 - optuna.study._optimize - INFO - Trial 274 pruned. 
2026-05-15 20:20:41,019 - optuna.study._optimize - INFO - Trial 275 pruned. 
2026-05-15 20:20:45,005 - experiment_functions - INFO - Early stopping at epoch 550. Best Recall: 0.0096
2026-05-15 20:20:45,140 - optuna.study.study - INFO - Trial 276 finished with value: 0.009640436037605116 and parameters: {'n_layers': 4, 'embedding_dim': 64, 'lr': 0.0019109557191166167, 'lambda_val': 4.947294041143459e-05, 'batch_size': 3685, 'optimizer': 'Adam'}. Best is trial 119 with value: 0.025263757590283552.
2026-05-15 20:20:49,288 - experiment_functions - INFO - Early stopping at epoch 500. Best Recall: 0.0010
2026-05-15 20:20:49,453 - optuna.study.study - INFO - Trial 277 finished with value: 0.0010324765731377114 and parameters: {'n_layers': 4, 'embedding_dim': 256, 'lr': 0.039926075330244754, 'lambda_val': 7.302725569342531e-05, 'batch_size': 3768, 'optimizer': 'SGD'}. Best is trial 119 with value: 0.025263757590283552.
2026-05-15 20:21:02,498 - experiment_functions - INFO - Early stopping at epoch 2050. Best Recall: 0.0240
2026-05-15 20:21:02,600 - optuna.study.study - INFO - Trial 278 finished with value: 0.02404898439149197 and parameters: {'n_layers': 4, 'embedding_dim': 64, 'lr': 0.060763009936328466, 'lambda_val': 5.455032775866301e-05, 'batch_size': 3605, 'optimizer': 'Adam'}. Best is trial 119 with value: 0.025263757590283552.
2026-05-15 20:21:08,724 - optuna.study._optimize - INFO - Trial 279 pruned. 
2026-05-15 20:21:15,848 - optuna.study._optimize - INFO - Trial 280 pruned. 
2026-05-15 20:21:22,110 - optuna.study._optimize - INFO - Trial 281 pruned. 
2026-05-15 20:21:25,814 - experiment_functions - INFO - Early stopping at epoch 550. Best Recall: 0.0093
2026-05-15 20:21:25,926 - optuna.study.study - INFO - Trial 282 finished with value: 0.009250983673202193 and parameters: {'n_layers': 3, 'embedding_dim': 128, 'lr': 0.07155304690428786, 'lambda_val': 0.0006123675511896035, 'batch_size': 3397, 'optimizer': 'Adam'}. Best is trial 119 with value: 0.025263757590283552.
2026-05-15 20:21:38,405 - experiment_functions - INFO - Early stopping at epoch 2050. Best Recall: 0.0203
2026-05-15 20:21:38,517 - optuna.study.study - INFO - Trial 283 finished with value: 0.020318246574493916 and parameters: {'n_layers': 4, 'embedding_dim': 32, 'lr': 0.05245851945672605, 'lambda_val': 3.677657781454299e-05, 'batch_size': 3625, 'optimizer': 'Adam'}. Best is trial 119 with value: 0.025263757590283552.
2026-05-15 20:21:51,699 - experiment_functions - INFO - Early stopping at epoch 2100. Best Recall: 0.0219
2026-05-15 20:21:51,820 - optuna.study.study - INFO - Trial 284 finished with value: 0.02189166987498493 and parameters: {'n_layers': 4, 'embedding_dim': 64, 'lr': 0.03206183314138045, 'lambda_val': 5.7925648949748185e-05, 'batch_size': 3459, 'optimizer': 'Adam'}. Best is trial 119 with value: 0.025263757590283552.
2026-05-15 20:21:58,190 - optuna.study._optimize - INFO - Trial 285 pruned. 
2026-05-15 20:22:04,425 - optuna.study._optimize - INFO - Trial 286 pruned. 
2026-05-15 20:22:08,450 - experiment_functions - INFO - Early stopping at epoch 550. Best Recall: 0.0106
2026-05-15 20:22:08,540 - optuna.study.study - INFO - Trial 287 finished with value: 0.010590229617154188 and parameters: {'n_layers': 4, 'embedding_dim': 64, 'lr': 0.009724835481302685, 'lambda_val': 0.00013605340307572007, 'batch_size': 3539, 'optimizer': 'Adam'}. Best is trial 119 with value: 0.025263757590283552.
2026-05-15 20:22:21,400 - experiment_functions - INFO - Early stopping at epoch 2350. Best Recall: 0.0214
2026-05-15 20:22:21,534 - optuna.study.study - INFO - Trial 288 finished with value: 0.02139713674359395 and parameters: {'n_layers': 4, 'embedding_dim': 64, 'lr': 0.062234875739381176, 'lambda_val': 6.310294175204751e-05, 'batch_size': 3632, 'optimizer': 'Adam'}. Best is trial 119 with value: 0.025263757590283552.
2026-05-15 20:22:25,893 - experiment_functions - INFO - Early stopping at epoch 600. Best Recall: 0.0040
2026-05-15 20:22:26,005 - optuna.study.study - INFO - Trial 289 finished with value: 0.003999477893915689 and parameters: {'n_layers': 4, 'embedding_dim': 32, 'lr': 0.02674701121824204, 'lambda_val': 0.0020527985165659447, 'batch_size': 3934, 'optimizer': 'Adam'}. Best is trial 119 with value: 0.025263757590283552.
2026-05-15 20:22:55,755 - experiment_functions - INFO - Early stopping at epoch 2100. Best Recall: 0.0224
2026-05-15 20:22:55,858 - optuna.study.study - INFO - Trial 290 finished with value: 0.022440729048229482 and parameters: {'n_layers': 4, 'embedding_dim': 64, 'lr': 0.03317276040916742, 'lambda_val': 4.345126912888912e-05, 'batch_size': 3738, 'optimizer': 'Adam'}. Best is trial 119 with value: 0.025263757590283552.
2026-05-15 20:23:06,914 - optuna.study._optimize - INFO - Trial 291 pruned. 
2026-05-15 20:23:19,574 - optuna.study._optimize - INFO - Trial 292 pruned. 
2026-05-15 20:23:26,467 - experiment_functions - INFO - Early stopping at epoch 1100. Best Recall: 0.0202
2026-05-15 20:23:26,590 - optuna.study.study - INFO - Trial 293 finished with value: 0.020174540656125343 and parameters: {'n_layers': 4, 'embedding_dim': 64, 'lr': 0.039754469329573855, 'lambda_val': 2.4094447055143433e-05, 'batch_size': 3674, 'optimizer': 'Adam'}. Best is trial 119 with value: 0.025263757590283552.
2026-05-15 20:23:33,348 - optuna.study._optimize - INFO - Trial 294 pruned. 
2026-05-15 20:23:39,615 - optuna.study._optimize - INFO - Trial 295 pruned. 
2026-05-15 20:23:47,165 - optuna.study._optimize - INFO - Trial 296 pruned. 
2026-05-15 20:24:02,273 - experiment_functions - INFO - Early stopping at epoch 1700. Best Recall: 0.0198
2026-05-15 20:24:02,452 - optuna.study.study - INFO - Trial 297 finished with value: 0.019819363759212647 and parameters: {'n_layers': 4, 'embedding_dim': 64, 'lr': 0.04516799284370235, 'lambda_val': 4.329332484076401e-05, 'batch_size': 3756, 'optimizer': 'Adam'}. Best is trial 119 with value: 0.025263757590283552.
2026-05-15 20:24:10,064 - optuna.study._optimize - INFO - Trial 298 pruned. 
2026-05-15 20:24:14,518 - experiment_functions - INFO - Early stopping at epoch 500. Best Recall: 0.0013
2026-05-15 20:24:14,641 - optuna.study.study - INFO - Trial 299 finished with value: 0.0013482261361512393 and parameters: {'n_layers': 4, 'embedding_dim': 64, 'lr': 0.04015134916669607, 'lambda_val': 0.00010753917734232803, 'batch_size': 3542, 'optimizer': 'SGD'}. Best is trial 119 with value: 0.025263757590283552.
2026-05-15 20:24:25,912 - experiment_functions - INFO - Early stopping at epoch 2750. Best Recall: 0.0200
2026-05-15 20:24:26,001 - root - INFO -   ** Getting the trainable edges:
2026-05-15 20:24:26,006 - helper_functions - INFO -      Number of nodes: 535
2026-05-15 20:24:26,006 - helper_functions - INFO -      Ratio: 0.05177085349332301
2026-05-15 20:24:26,006 - helper_functions - INFO -      Number of unique users: 303
2026-05-15 20:24:26,006 - helper_functions - INFO -      Number of unique items: 232
2026-05-15 20:24:26,006 - helper_functions - INFO -      Total dominant set edge: 81241
2026-05-15 20:24:26,006 - helper_functions - INFO -      Trainable edges: 64992.8
2026-05-15 20:24:26,015 - root - INFO -   **** Getting 81241 dominant set edges
2026-05-15 20:24:26,143 - optuna.storages._rdb.storage - INFO - A new study created in RDB with name: Study_e_100K_1c1dcs
2026-05-15 20:25:03,698 - experiment_functions - INFO - Early stopping at epoch 3850. Best Recall: 0.0052
2026-05-15 20:25:04,290 - optuna.study.study - INFO - Trial 0 finished with value: 0.005200624660748914 and parameters: {'n_layers': 4, 'embedding_dim': 256, 'lr': 2.1908719494332658e-05, 'lambda_val': 1.1564531619688391e-06, 'batch_size': 1998, 'optimizer': 'RMSprop'}. Best is trial 0 with value: 0.005200624660748914.
2026-05-15 20:25:34,515 - experiment_functions - INFO - Early stopping at epoch 3150. Best Recall: 0.0112
2026-05-15 20:25:34,721 - optuna.study.study - INFO - Trial 1 finished with value: 0.011192327410145881 and parameters: {'n_layers': 4, 'embedding_dim': 64, 'lr': 7.10359598264503e-05, 'lambda_val': 6.053191653947612e-05, 'batch_size': 3595, 'optimizer': 'Adam'}. Best is trial 1 with value: 0.011192327410145881.
2026-05-15 20:25:42,602 - experiment_functions - INFO - Early stopping at epoch 900. Best Recall: 0.0373
2026-05-15 20:25:42,738 - optuna.study.study - INFO - Trial 2 finished with value: 0.03728945367840997 and parameters: {'n_layers': 3, 'embedding_dim': 128, 'lr': 0.0006719005071467805, 'lambda_val': 1.1374066620106001e-06, 'batch_size': 3068, 'optimizer': 'Adam'}. Best is trial 2 with value: 0.03728945367840997.
2026-05-15 20:25:54,805 - experiment_functions - INFO - Early stopping at epoch 1350. Best Recall: 0.0026
2026-05-15 20:25:54,919 - optuna.study.study - INFO - Trial 3 finished with value: 0.002575621427897965 and parameters: {'n_layers': 3, 'embedding_dim': 256, 'lr': 1.495097923489337e-05, 'lambda_val': 0.0012488569518790352, 'batch_size': 915, 'optimizer': 'RMSprop'}. Best is trial 2 with value: 0.03728945367840997.
2026-05-15 20:26:15,160 - experiment_functions - INFO - Early stopping at epoch 1450. Best Recall: 0.0190
2026-05-15 20:26:15,316 - optuna.study.study - INFO - Trial 4 finished with value: 0.018960416778401303 and parameters: {'n_layers': 2, 'embedding_dim': 128, 'lr': 0.00019839918706321047, 'lambda_val': 0.0617990299746322, 'batch_size': 3478, 'optimizer': 'Adam'}. Best is trial 2 with value: 0.03728945367840997.
2026-05-15 20:26:31,933 - experiment_functions - INFO - Early stopping at epoch 2600. Best Recall: 0.0397
2026-05-15 20:26:32,017 - optuna.study.study - INFO - Trial 5 finished with value: 0.0397212719085295 and parameters: {'n_layers': 2, 'embedding_dim': 32, 'lr': 0.0002745986237066694, 'lambda_val': 0.0014116290004013957, 'batch_size': 2977, 'optimizer': 'RMSprop'}. Best is trial 5 with value: 0.0397212719085295.
2026-05-15 20:26:37,657 - experiment_functions - INFO - Early stopping at epoch 950. Best Recall: 0.0248
2026-05-15 20:26:37,804 - optuna.study.study - INFO - Trial 6 finished with value: 0.02480850514273924 and parameters: {'n_layers': 1, 'embedding_dim': 96, 'lr': 0.025373491366429857, 'lambda_val': 1.0147596485897577e-06, 'batch_size': 807, 'optimizer': 'RMSprop'}. Best is trial 5 with value: 0.0397212719085295.
2026-05-15 20:26:42,152 - experiment_functions - INFO - Early stopping at epoch 500. Best Recall: 0.0013
2026-05-15 20:26:42,310 - optuna.study.study - INFO - Trial 7 finished with value: 0.0012755413392900074 and parameters: {'n_layers': 3, 'embedding_dim': 64, 'lr': 0.018775193212920583, 'lambda_val': 9.72083292396186e-06, 'batch_size': 2732, 'optimizer': 'SGD'}. Best is trial 5 with value: 0.0397212719085295.
2026-05-15 20:26:46,297 - experiment_functions - INFO - Early stopping at epoch 550. Best Recall: 0.0021
2026-05-15 20:26:46,455 - optuna.study.study - INFO - Trial 8 finished with value: 0.0021214351395851144 and parameters: {'n_layers': 3, 'embedding_dim': 32, 'lr': 4.275422429385144e-05, 'lambda_val': 2.125186882471867e-06, 'batch_size': 3501, 'optimizer': 'RMSprop'}. Best is trial 5 with value: 0.0397212719085295.
2026-05-15 20:26:53,804 - experiment_functions - INFO - Early stopping at epoch 1000. Best Recall: 0.0104
2026-05-15 20:26:53,984 - optuna.study.study - INFO - Trial 9 finished with value: 0.010368247165674459 and parameters: {'n_layers': 3, 'embedding_dim': 128, 'lr': 0.0830171353478206, 'lambda_val': 0.040021023561798694, 'batch_size': 3354, 'optimizer': 'RMSprop'}. Best is trial 5 with value: 0.0397212719085295.
2026-05-15 20:26:57,303 - experiment_functions - INFO - Early stopping at epoch 500. Best Recall: 0.0038
2026-05-15 20:26:57,418 - optuna.study.study - INFO - Trial 10 finished with value: 0.0037622958262536373 and parameters: {'n_layers': 1, 'embedding_dim': 32, 'lr': 0.0031509469208195673, 'lambda_val': 0.0018902711249964498, 'batch_size': 1999, 'optimizer': 'SGD'}. Best is trial 5 with value: 0.0397212719085295.
2026-05-15 20:27:05,693 - experiment_functions - INFO - Early stopping at epoch 1200. Best Recall: 0.0473
2026-05-15 20:27:05,821 - optuna.study.study - INFO - Trial 11 finished with value: 0.04727512803652508 and parameters: {'n_layers': 2, 'embedding_dim': 32, 'lr': 0.0005814483648500505, 'lambda_val': 0.00017947371697771432, 'batch_size': 2676, 'optimizer': 'Adam'}. Best is trial 11 with value: 0.04727512803652508.
2026-05-15 20:27:12,592 - experiment_functions - INFO - Early stopping at epoch 1050. Best Recall: 0.0480
2026-05-15 20:27:12,729 - optuna.study.study - INFO - Trial 12 finished with value: 0.04803658878633638 and parameters: {'n_layers': 2, 'embedding_dim': 32, 'lr': 0.0009435605255502552, 'lambda_val': 0.00019944419870644736, 'batch_size': 2511, 'optimizer': 'Adam'}. Best is trial 12 with value: 0.04803658878633638.
2026-05-15 20:27:17,771 - experiment_functions - INFO - Early stopping at epoch 600. Best Recall: 0.0431
2026-05-15 20:27:17,893 - optuna.study.study - INFO - Trial 13 finished with value: 0.04311558338844315 and parameters: {'n_layers': 2, 'embedding_dim': 32, 'lr': 0.0024713386639586216, 'lambda_val': 0.00014928742752238044, 'batch_size': 2436, 'optimizer': 'Adam'}. Best is trial 12 with value: 0.04803658878633638.
2026-05-15 20:27:22,140 - experiment_functions - INFO - Early stopping at epoch 700. Best Recall: 0.0671
2026-05-15 20:27:22,247 - optuna.study.study - INFO - Trial 14 finished with value: 0.06710294513473519 and parameters: {'n_layers': 1, 'embedding_dim': 32, 'lr': 0.0021979804075437357, 'lambda_val': 3.234895952747755e-05, 'batch_size': 1484, 'optimizer': 'Adam'}. Best is trial 14 with value: 0.06710294513473519.
2026-05-15 20:27:26,227 - experiment_functions - INFO - Early stopping at epoch 600. Best Recall: 0.0604
2026-05-15 20:27:26,339 - optuna.study.study - INFO - Trial 15 finished with value: 0.06036390294708777 and parameters: {'n_layers': 1, 'embedding_dim': 96, 'lr': 0.0036062881876754963, 'lambda_val': 2.4541434494935203e-05, 'batch_size': 1529, 'optimizer': 'Adam'}. Best is trial 14 with value: 0.06710294513473519.
2026-05-15 20:27:30,614 - experiment_functions - INFO - Early stopping at epoch 600. Best Recall: 0.0635
2026-05-15 20:27:30,781 - optuna.study.study - INFO - Trial 16 finished with value: 0.06346748933603112 and parameters: {'n_layers': 1, 'embedding_dim': 96, 'lr': 0.0029505068085336904, 'lambda_val': 1.8143183178235647e-05, 'batch_size': 1449, 'optimizer': 'Adam'}. Best is trial 14 with value: 0.06710294513473519.
2026-05-15 20:27:38,627 - experiment_functions - INFO - Early stopping at epoch 550. Best Recall: 0.0372
2026-05-15 20:27:38,738 - optuna.study.study - INFO - Trial 17 finished with value: 0.037187977405555434 and parameters: {'n_layers': 1, 'embedding_dim': 96, 'lr': 0.012785814435118467, 'lambda_val': 6.209594398605838e-06, 'batch_size': 1350, 'optimizer': 'Adam'}. Best is trial 14 with value: 0.06710294513473519.
2026-05-15 20:27:42,208 - experiment_functions - INFO - Early stopping at epoch 500. Best Recall: 0.0016
2026-05-15 20:27:42,486 - optuna.study.study - INFO - Trial 18 finished with value: 0.0015839240876899814 and parameters: {'n_layers': 1, 'embedding_dim': 96, 'lr': 0.007588486247293995, 'lambda_val': 3.800029270876134e-05, 'batch_size': 4048, 'optimizer': 'SGD'}. Best is trial 14 with value: 0.06710294513473519.
2026-05-15 20:27:47,586 - experiment_functions - INFO - Early stopping at epoch 750. Best Recall: 0.0662
2026-05-15 20:27:47,689 - optuna.study.study - INFO - Trial 19 finished with value: 0.06620992445630987 and parameters: {'n_layers': 1, 'embedding_dim': 96, 'lr': 0.002155540394996498, 'lambda_val': 5.6174240941449e-06, 'batch_size': 1335, 'optimizer': 'Adam'}. Best is trial 14 with value: 0.06710294513473519.
2026-05-15 20:27:52,249 - experiment_functions - INFO - Early stopping at epoch 550. Best Recall: 0.0240
2026-05-15 20:27:52,362 - optuna.study.study - INFO - Trial 20 finished with value: 0.024018250350412648 and parameters: {'n_layers': 1, 'embedding_dim': 64, 'lr': 0.04496237404531877, 'lambda_val': 4.524716712693167e-06, 'batch_size': 1123, 'optimizer': 'Adam'}. Best is trial 14 with value: 0.06710294513473519.
2026-05-15 20:27:57,343 - experiment_functions - INFO - Early stopping at epoch 750. Best Recall: 0.0623
2026-05-15 20:27:57,454 - optuna.study.study - INFO - Trial 21 finished with value: 0.062323877717164494 and parameters: {'n_layers': 1, 'embedding_dim': 96, 'lr': 0.001814267362965612, 'lambda_val': 1.757003958971765e-05, 'batch_size': 540, 'optimizer': 'Adam'}. Best is trial 14 with value: 0.06710294513473519.
2026-05-15 20:28:01,055 - experiment_functions - INFO - Early stopping at epoch 550. Best Recall: 0.0684
2026-05-15 20:28:01,205 - optuna.study.study - INFO - Trial 22 finished with value: 0.06835236426952564 and parameters: {'n_layers': 1, 'embedding_dim': 96, 'lr': 0.0067641699695417555, 'lambda_val': 5.8880964949295786e-05, 'batch_size': 1622, 'optimizer': 'Adam'}. Best is trial 22 with value: 0.06835236426952564.
2026-05-15 20:28:06,103 - experiment_functions - INFO - Early stopping at epoch 550. Best Recall: 0.0319
2026-05-15 20:28:06,259 - optuna.study.study - INFO - Trial 23 finished with value: 0.03186100532123449 and parameters: {'n_layers': 2, 'embedding_dim': 96, 'lr': 0.006717952826388645, 'lambda_val': 6.868377517293197e-05, 'batch_size': 1824, 'optimizer': 'Adam'}. Best is trial 22 with value: 0.06835236426952564.
2026-05-15 20:28:10,163 - experiment_functions - INFO - Early stopping at epoch 550. Best Recall: 0.0585
2026-05-15 20:28:10,276 - optuna.study.study - INFO - Trial 24 finished with value: 0.058503831942507724 and parameters: {'n_layers': 1, 'embedding_dim': 96, 'lr': 0.006999451191638459, 'lambda_val': 0.0008095660387226696, 'batch_size': 1741, 'optimizer': 'Adam'}. Best is trial 22 with value: 0.06835236426952564.
2026-05-15 20:28:14,577 - experiment_functions - INFO - Early stopping at epoch 500. Best Recall: 0.0015
2026-05-15 20:28:14,866 - optuna.study.study - INFO - Trial 25 finished with value: 0.0015001544981077801 and parameters: {'n_layers': 1, 'embedding_dim': 256, 'lr': 0.0013582579748899226, 'lambda_val': 0.00040962158350467474, 'batch_size': 1178, 'optimizer': 'SGD'}. Best is trial 22 with value: 0.06835236426952564.
2026-05-15 20:28:26,286 - experiment_functions - INFO - Early stopping at epoch 1950. Best Recall: 0.0513
