2026-05-16 06:10:48,791 - optuna.study.study - INFO - Trial 96 finished with value: 0.08856110208079386 and parameters: {'n_layers': 1, 'embedding_dim': 256, 'lr': 0.0009555153471160444, 'lambda_val': 1.560076195705089e-05, 'batch_size': 3942, 'optimizer': 'Adam'}. Best is trial 91 with value: 0.104993146553119.
2026-05-16 06:10:55,818 - optuna.study._optimize - INFO - Trial 97 pruned. 
2026-05-16 06:11:04,455 - experiment_functions - INFO - Early stopping at epoch 1200. Best Recall: 0.0901
2026-05-16 06:11:04,576 - optuna.study.study - INFO - Trial 98 finished with value: 0.09013130066620365 and parameters: {'n_layers': 1, 'embedding_dim': 256, 'lr': 0.0014168999035439956, 'lambda_val': 1.1392021532788265e-05, 'batch_size': 3480, 'optimizer': 'Adam'}. Best is trial 91 with value: 0.104993146553119.
2026-05-16 06:11:14,176 - optuna.study._optimize - INFO - Trial 99 pruned. 
2026-05-16 06:11:31,982 - experiment_functions - INFO - Early stopping at epoch 2800. Best Recall: 0.0954
2026-05-16 06:11:32,071 - optuna.study.study - INFO - Trial 100 finished with value: 0.09537390191869019 and parameters: {'n_layers': 1, 'embedding_dim': 256, 'lr': 0.0006292361474471223, 'lambda_val': 2.302613760237343e-06, 'batch_size': 3648, 'optimizer': 'Adam'}. Best is trial 91 with value: 0.104993146553119.
2026-05-16 06:11:39,040 - optuna.study._optimize - INFO - Trial 101 pruned. 
2026-05-16 06:11:42,962 - experiment_functions - INFO - Early stopping at epoch 500. Best Recall: 0.0007
2026-05-16 06:11:43,053 - optuna.study.study - INFO - Trial 102 finished with value: 0.0006869391524279425 and parameters: {'n_layers': 1, 'embedding_dim': 256, 'lr': 1.0978224110060978e-05, 'lambda_val': 7.496424635246652e-06, 'batch_size': 3766, 'optimizer': 'Adam'}. Best is trial 91 with value: 0.104993146553119.
2026-05-16 06:11:58,557 - experiment_functions - INFO - Early stopping at epoch 2250. Best Recall: 0.1016
2026-05-16 06:11:58,657 - optuna.study.study - INFO - Trial 103 finished with value: 0.10161214535633291 and parameters: {'n_layers': 1, 'embedding_dim': 256, 'lr': 0.0006176947917328001, 'lambda_val': 3.1318139561712693e-06, 'batch_size': 3221, 'optimizer': 'Adam'}. Best is trial 91 with value: 0.104993146553119.
2026-05-16 06:12:05,570 - optuna.study._optimize - INFO - Trial 104 pruned. 
2026-05-16 06:12:12,142 - optuna.study._optimize - INFO - Trial 105 pruned. 
2026-05-16 06:12:19,213 - optuna.study._optimize - INFO - Trial 106 pruned. 
2026-05-16 06:12:26,353 - optuna.study._optimize - INFO - Trial 107 pruned. 
2026-05-16 06:12:35,370 - optuna.study._optimize - INFO - Trial 108 pruned. 
2026-05-16 06:12:49,058 - experiment_functions - INFO - Early stopping at epoch 2200. Best Recall: 0.0955
2026-05-16 06:12:49,159 - optuna.study.study - INFO - Trial 109 finished with value: 0.0955389857920433 and parameters: {'n_layers': 1, 'embedding_dim': 256, 'lr': 0.0010979864489795838, 'lambda_val': 2.100694875798664e-06, 'batch_size': 3724, 'optimizer': 'Adam'}. Best is trial 91 with value: 0.104993146553119.
2026-05-16 06:13:02,062 - experiment_functions - INFO - Early stopping at epoch 1750. Best Recall: 0.0903
2026-05-16 06:13:02,162 - optuna.study.study - INFO - Trial 110 finished with value: 0.09032498388931873 and parameters: {'n_layers': 1, 'embedding_dim': 256, 'lr': 0.0011079232557308079, 'lambda_val': 2.8494446510331834e-06, 'batch_size': 4080, 'optimizer': 'Adam'}. Best is trial 91 with value: 0.104993146553119.
2026-05-16 06:13:12,033 - experiment_functions - INFO - Early stopping at epoch 1300. Best Recall: 0.0976
2026-05-16 06:13:12,134 - optuna.study.study - INFO - Trial 111 finished with value: 0.0975721641085303 and parameters: {'n_layers': 1, 'embedding_dim': 256, 'lr': 0.0012739529983690587, 'lambda_val': 2.0665317016594776e-06, 'batch_size': 3727, 'optimizer': 'Adam'}. Best is trial 91 with value: 0.104993146553119.
2026-05-16 06:13:23,516 - experiment_functions - INFO - Early stopping at epoch 1750. Best Recall: 0.0947
2026-05-16 06:13:23,630 - optuna.study.study - INFO - Trial 112 finished with value: 0.09467613380941614 and parameters: {'n_layers': 1, 'embedding_dim': 256, 'lr': 0.0008356440078722261, 'lambda_val': 2.1488825757382382e-06, 'batch_size': 3869, 'optimizer': 'Adam'}. Best is trial 91 with value: 0.104993146553119.
2026-05-16 06:13:35,635 - experiment_functions - INFO - Early stopping at epoch 1900. Best Recall: 0.0924
2026-05-16 06:13:35,736 - optuna.study.study - INFO - Trial 113 finished with value: 0.09244458427768243 and parameters: {'n_layers': 1, 'embedding_dim': 256, 'lr': 0.0012828180738151383, 'lambda_val': 1.7645233092090068e-06, 'batch_size': 3754, 'optimizer': 'Adam'}. Best is trial 91 with value: 0.104993146553119.
2026-05-16 06:13:47,051 - experiment_functions - INFO - Early stopping at epoch 1650. Best Recall: 0.0939
2026-05-16 06:13:47,150 - optuna.study.study - INFO - Trial 114 finished with value: 0.09393386609922319 and parameters: {'n_layers': 1, 'embedding_dim': 256, 'lr': 0.0010199532754506574, 'lambda_val': 3.1864117129364265e-06, 'batch_size': 3679, 'optimizer': 'Adam'}. Best is trial 91 with value: 0.104993146553119.
2026-05-16 06:13:53,476 - optuna.study._optimize - INFO - Trial 115 pruned. 
2026-05-16 06:13:57,646 - experiment_functions - INFO - Early stopping at epoch 500. Best Recall: 0.0013
2026-05-16 06:13:57,737 - optuna.study.study - INFO - Trial 116 finished with value: 0.001300068580890535 and parameters: {'n_layers': 1, 'embedding_dim': 256, 'lr': 0.0005065262151542151, 'lambda_val': 6.472585268321319e-06, 'batch_size': 3986, 'optimizer': 'SGD'}. Best is trial 91 with value: 0.104993146553119.
2026-05-16 06:14:15,122 - experiment_functions - INFO - Early stopping at epoch 2550. Best Recall: 0.0930
2026-05-16 06:14:15,223 - optuna.study.study - INFO - Trial 117 finished with value: 0.09301188474704825 and parameters: {'n_layers': 1, 'embedding_dim': 256, 'lr': 0.0007174764812967876, 'lambda_val': 3.6384232632165e-06, 'batch_size': 3832, 'optimizer': 'Adam'}. Best is trial 91 with value: 0.104993146553119.
2026-05-16 06:14:24,673 - experiment_functions - INFO - Early stopping at epoch 850. Best Recall: 0.0841
2026-05-16 06:14:24,765 - optuna.study.study - INFO - Trial 118 finished with value: 0.08414805092099915 and parameters: {'n_layers': 1, 'embedding_dim': 256, 'lr': 0.0012402740174587202, 'lambda_val': 1.341994675746307e-05, 'batch_size': 3547, 'optimizer': 'RMSprop'}. Best is trial 91 with value: 0.104993146553119.
2026-05-16 06:14:32,174 - optuna.study._optimize - INFO - Trial 119 pruned. 
2026-05-16 06:14:39,487 - optuna.study._optimize - INFO - Trial 120 pruned. 
2026-05-16 06:14:51,118 - experiment_functions - INFO - Early stopping at epoch 1600. Best Recall: 0.0884
2026-05-16 06:14:51,209 - optuna.study.study - INFO - Trial 121 finished with value: 0.08838960583374138 and parameters: {'n_layers': 1, 'embedding_dim': 256, 'lr': 0.0008181865176457403, 'lambda_val': 2.3457506780181507e-06, 'batch_size': 3916, 'optimizer': 'Adam'}. Best is trial 91 with value: 0.104993146553119.
2026-05-16 06:15:04,039 - optuna.study._optimize - INFO - Trial 122 pruned. 
2026-05-16 06:15:15,335 - optuna.study._optimize - INFO - Trial 123 pruned. 
2026-05-16 06:15:24,116 - optuna.study._optimize - INFO - Trial 124 pruned. 
2026-05-16 06:15:31,256 - optuna.study._optimize - INFO - Trial 125 pruned. 
2026-05-16 06:15:38,582 - optuna.study._optimize - INFO - Trial 126 pruned. 
2026-05-16 06:15:55,007 - experiment_functions - INFO - Early stopping at epoch 2550. Best Recall: 0.0936
2026-05-16 06:15:55,108 - optuna.study.study - INFO - Trial 127 finished with value: 0.09364789030063018 and parameters: {'n_layers': 1, 'embedding_dim': 256, 'lr': 0.0008193887270409252, 'lambda_val': 5.399489016800472e-06, 'batch_size': 3230, 'optimizer': 'Adam'}. Best is trial 91 with value: 0.104993146553119.
2026-05-16 06:16:03,148 - optuna.study._optimize - INFO - Trial 128 pruned. 
2026-05-16 06:16:08,968 - experiment_functions - INFO - Early stopping at epoch 550. Best Recall: 0.0204
2026-05-16 06:16:09,069 - optuna.study.study - INFO - Trial 129 finished with value: 0.02044995615824813 and parameters: {'n_layers': 4, 'embedding_dim': 256, 'lr': 0.0022926822549334328, 'lambda_val': 2.5318103515924466e-06, 'batch_size': 3730, 'optimizer': 'Adam'}. Best is trial 91 with value: 0.104993146553119.
2026-05-16 06:16:18,615 - optuna.study._optimize - INFO - Trial 130 pruned. 
2026-05-16 06:16:26,912 - experiment_functions - INFO - Early stopping at epoch 1200. Best Recall: 0.0976
2026-05-16 06:16:26,992 - optuna.study.study - INFO - Trial 131 finished with value: 0.09763715814379947 and parameters: {'n_layers': 1, 'embedding_dim': 256, 'lr': 0.0014458997565394089, 'lambda_val': 2.606510484837718e-06, 'batch_size': 3144, 'optimizer': 'Adam'}. Best is trial 91 with value: 0.104993146553119.
2026-05-16 06:16:34,609 - experiment_functions - INFO - Early stopping at epoch 1150. Best Recall: 0.0954
2026-05-16 06:16:34,710 - optuna.study.study - INFO - Trial 132 finished with value: 0.09538861308948798 and parameters: {'n_layers': 1, 'embedding_dim': 256, 'lr': 0.0015219603314378842, 'lambda_val': 1.216910326277428e-06, 'batch_size': 2637, 'optimizer': 'Adam'}. Best is trial 91 with value: 0.104993146553119.
2026-05-16 06:16:53,213 - experiment_functions - INFO - Early stopping at epoch 1650. Best Recall: 0.0943
2026-05-16 06:16:53,975 - optuna.study.study - INFO - Trial 133 finished with value: 0.09432930372230318 and parameters: {'n_layers': 1, 'embedding_dim': 256, 'lr': 0.0015626939267206507, 'lambda_val': 1.2600478262325172e-06, 'batch_size': 2602, 'optimizer': 'Adam'}. Best is trial 91 with value: 0.104993146553119.
2026-05-16 06:17:05,758 - experiment_functions - INFO - Early stopping at epoch 1550. Best Recall: 0.0934
2026-05-16 06:17:05,858 - optuna.study.study - INFO - Trial 134 finished with value: 0.09340176644200582 and parameters: {'n_layers': 1, 'embedding_dim': 256, 'lr': 0.0012178502659750169, 'lambda_val': 1.0298043085467308e-06, 'batch_size': 2759, 'optimizer': 'Adam'}. Best is trial 91 with value: 0.104993146553119.
2026-05-16 06:17:15,126 - experiment_functions - INFO - Early stopping at epoch 800. Best Recall: 0.0826
2026-05-16 06:17:15,226 - optuna.study.study - INFO - Trial 135 finished with value: 0.08257894212177119 and parameters: {'n_layers': 1, 'embedding_dim': 256, 'lr': 0.0026837918014397336, 'lambda_val': 1.6610452467699986e-06, 'batch_size': 3183, 'optimizer': 'Adam'}. Best is trial 91 with value: 0.104993146553119.
2026-05-16 06:17:22,938 - optuna.study._optimize - INFO - Trial 136 pruned. 
2026-05-16 06:17:32,264 - optuna.study._optimize - INFO - Trial 137 pruned. 
2026-05-16 06:17:43,180 - experiment_functions - INFO - Early stopping at epoch 500. Best Recall: 0.0022
2026-05-16 06:17:43,952 - optuna.study.study - INFO - Trial 138 finished with value: 0.002247661673474234 and parameters: {'n_layers': 1, 'embedding_dim': 256, 'lr': 0.0020341573011151736, 'lambda_val': 2.8558525470414084e-06, 'batch_size': 3497, 'optimizer': 'SGD'}. Best is trial 91 with value: 0.104993146553119.
2026-05-16 06:17:52,240 - optuna.study._optimize - INFO - Trial 139 pruned. 
2026-05-16 06:17:57,672 - experiment_functions - INFO - Early stopping at epoch 750. Best Recall: 0.0788
2026-05-16 06:17:57,771 - optuna.study.study - INFO - Trial 140 finished with value: 0.07881205263824194 and parameters: {'n_layers': 1, 'embedding_dim': 256, 'lr': 0.003311806525821547, 'lambda_val': 3.572838395673198e-06, 'batch_size': 3400, 'optimizer': 'RMSprop'}. Best is trial 91 with value: 0.104993146553119.
2026-05-16 06:18:10,880 - experiment_functions - INFO - Early stopping at epoch 1550. Best Recall: 0.0961
2026-05-16 06:18:10,979 - optuna.study.study - INFO - Trial 141 finished with value: 0.09609516845061931 and parameters: {'n_layers': 1, 'embedding_dim': 256, 'lr': 0.0008677853371389155, 'lambda_val': 2.207457879544333e-06, 'batch_size': 3580, 'optimizer': 'Adam'}. Best is trial 91 with value: 0.104993146553119.
2026-05-16 06:18:31,562 - experiment_functions - INFO - Early stopping at epoch 1650. Best Recall: 0.0930
2026-05-16 06:18:31,652 - optuna.study.study - INFO - Trial 142 finished with value: 0.09303538155319838 and parameters: {'n_layers': 1, 'embedding_dim': 256, 'lr': 0.000894008726208662, 'lambda_val': 1.2493243365732393e-06, 'batch_size': 3626, 'optimizer': 'Adam'}. Best is trial 91 with value: 0.104993146553119.
2026-05-16 06:18:40,321 - experiment_functions - INFO - Early stopping at epoch 1250. Best Recall: 0.0972
2026-05-16 06:18:40,422 - optuna.study.study - INFO - Trial 143 finished with value: 0.0971927716097361 and parameters: {'n_layers': 1, 'embedding_dim': 256, 'lr': 0.0015637903612209956, 'lambda_val': 1.624894565304728e-06, 'batch_size': 3552, 'optimizer': 'Adam'}. Best is trial 91 with value: 0.104993146553119.
2026-05-16 06:18:53,893 - experiment_functions - INFO - Early stopping at epoch 1700. Best Recall: 0.1003
2026-05-16 06:18:53,983 - optuna.study.study - INFO - Trial 144 finished with value: 0.10032252863105205 and parameters: {'n_layers': 1, 'embedding_dim': 256, 'lr': 0.0010289310590468647, 'lambda_val': 1.7105780944764737e-06, 'batch_size': 3582, 'optimizer': 'Adam'}. Best is trial 91 with value: 0.104993146553119.
2026-05-16 06:19:02,738 - experiment_functions - INFO - Early stopping at epoch 1350. Best Recall: 0.0929
2026-05-16 06:19:02,839 - optuna.study.study - INFO - Trial 145 finished with value: 0.09292337174798165 and parameters: {'n_layers': 1, 'embedding_dim': 256, 'lr': 0.0015870052742813947, 'lambda_val': 1.5596904362437434e-06, 'batch_size': 3512, 'optimizer': 'Adam'}. Best is trial 91 with value: 0.104993146553119.
2026-05-16 06:19:13,550 - experiment_functions - INFO - Early stopping at epoch 1550. Best Recall: 0.1021
2026-05-16 06:19:13,653 - optuna.study.study - INFO - Trial 146 finished with value: 0.10212823947568335 and parameters: {'n_layers': 1, 'embedding_dim': 256, 'lr': 0.001105556134385628, 'lambda_val': 1.2468644310462795e-06, 'batch_size': 3584, 'optimizer': 'Adam'}. Best is trial 91 with value: 0.104993146553119.
2026-05-16 06:19:21,402 - optuna.study._optimize - INFO - Trial 147 pruned. 
2026-05-16 06:19:28,100 - optuna.study._optimize - INFO - Trial 148 pruned. 
2026-05-16 06:19:37,183 - experiment_functions - INFO - Early stopping at epoch 1450. Best Recall: 0.1006
2026-05-16 06:19:37,264 - optuna.study.study - INFO - Trial 149 finished with value: 0.10059760055438699 and parameters: {'n_layers': 1, 'embedding_dim': 256, 'lr': 0.0009588620812698902, 'lambda_val': 2.7704294789638563e-06, 'batch_size': 3283, 'optimizer': 'Adam'}. Best is trial 91 with value: 0.104993146553119.
2026-05-16 06:19:48,157 - experiment_functions - INFO - Early stopping at epoch 1850. Best Recall: 0.0925
2026-05-16 06:19:48,228 - optuna.study.study - INFO - Trial 150 finished with value: 0.09251005801499625 and parameters: {'n_layers': 1, 'embedding_dim': 256, 'lr': 0.0009126194317009625, 'lambda_val': 5.001064614700818e-06, 'batch_size': 3280, 'optimizer': 'Adam'}. Best is trial 91 with value: 0.104993146553119.
2026-05-16 06:19:58,626 - experiment_functions - INFO - Early stopping at epoch 1400. Best Recall: 0.0941
2026-05-16 06:19:58,728 - optuna.study.study - INFO - Trial 151 finished with value: 0.09410433348806913 and parameters: {'n_layers': 1, 'embedding_dim': 256, 'lr': 0.0011743669843970015, 'lambda_val': 2.7920382689383626e-06, 'batch_size': 3337, 'optimizer': 'Adam'}. Best is trial 91 with value: 0.104993146553119.
2026-05-16 06:20:05,484 - optuna.study._optimize - INFO - Trial 152 pruned. 
2026-05-16 06:20:12,104 - experiment_functions - INFO - Early stopping at epoch 950. Best Recall: 0.0882
2026-05-16 06:20:12,185 - optuna.study.study - INFO - Trial 153 finished with value: 0.08824857704473948 and parameters: {'n_layers': 1, 'embedding_dim': 256, 'lr': 0.0012901019598844884, 'lambda_val': 1.8987097253888791e-06, 'batch_size': 3443, 'optimizer': 'Adam'}. Best is trial 91 with value: 0.104993146553119.
2026-05-16 06:20:19,426 - optuna.study._optimize - INFO - Trial 154 pruned. 
2026-05-16 06:20:24,748 - experiment_functions - INFO - Early stopping at epoch 850. Best Recall: 0.0534
2026-05-16 06:20:24,848 - optuna.study.study - INFO - Trial 155 finished with value: 0.053354554443597435 and parameters: {'n_layers': 1, 'embedding_dim': 64, 'lr': 0.0017725768023420386, 'lambda_val': 3.386817866765842e-06, 'batch_size': 3550, 'optimizer': 'Adam'}. Best is trial 91 with value: 0.104993146553119.
2026-05-16 06:20:31,755 - optuna.study._optimize - INFO - Trial 156 pruned. 
2026-05-16 06:20:38,155 - optuna.study._optimize - INFO - Trial 157 pruned. 
2026-05-16 06:20:45,270 - optuna.study._optimize - INFO - Trial 158 pruned. 
2026-05-16 06:20:57,581 - experiment_functions - INFO - Early stopping at epoch 1850. Best Recall: 0.0954
2026-05-16 06:20:57,681 - optuna.study.study - INFO - Trial 159 finished with value: 0.0954225259224362 and parameters: {'n_layers': 1, 'embedding_dim': 256, 'lr': 0.0013110733804599618, 'lambda_val': 4.43777621083238e-06, 'batch_size': 3172, 'optimizer': 'Adam'}. Best is trial 91 with value: 0.104993146553119.
2026-05-16 06:21:06,568 - optuna.study._optimize - INFO - Trial 160 pruned. 
2026-05-16 06:21:23,316 - optuna.study._optimize - INFO - Trial 161 pruned. 
2026-05-16 06:21:33,298 - experiment_functions - INFO - Early stopping at epoch 1300. Best Recall: 0.0979
2026-05-16 06:21:33,388 - optuna.study.study - INFO - Trial 162 finished with value: 0.09789866757589978 and parameters: {'n_layers': 1, 'embedding_dim': 256, 'lr': 0.0008845066215888897, 'lambda_val': 6.958335451624374e-06, 'batch_size': 3044, 'optimizer': 'Adam'}. Best is trial 91 with value: 0.104993146553119.
2026-05-16 06:21:45,425 - experiment_functions - INFO - Early stopping at epoch 1950. Best Recall: 0.1012
2026-05-16 06:21:45,561 - optuna.study.study - INFO - Trial 163 finished with value: 0.1012001599788254 and parameters: {'n_layers': 1, 'embedding_dim': 256, 'lr': 0.000850001015158762, 'lambda_val': 6.580911991584974e-06, 'batch_size': 2925, 'optimizer': 'Adam'}. Best is trial 91 with value: 0.104993146553119.
2026-05-16 06:21:53,016 - optuna.study._optimize - INFO - Trial 164 pruned. 
2026-05-16 06:22:05,227 - experiment_functions - INFO - Early stopping at epoch 1900. Best Recall: 0.1011
2026-05-16 06:22:05,307 - optuna.study.study - INFO - Trial 165 finished with value: 0.10108707303050521 and parameters: {'n_layers': 1, 'embedding_dim': 256, 'lr': 0.000966187334267591, 'lambda_val': 1.0422451279168425e-05, 'batch_size': 2899, 'optimizer': 'Adam'}. Best is trial 91 with value: 0.104993146553119.
2026-05-16 06:22:15,445 - experiment_functions - INFO - Early stopping at epoch 1500. Best Recall: 0.0954
2026-05-16 06:22:15,591 - optuna.study.study - INFO - Trial 166 finished with value: 0.09535783954216424 and parameters: {'n_layers': 1, 'embedding_dim': 256, 'lr': 0.000957076045901995, 'lambda_val': 1.080836155900248e-05, 'batch_size': 2866, 'optimizer': 'Adam'}. Best is trial 91 with value: 0.104993146553119.
2026-05-16 06:22:23,436 - experiment_functions - INFO - Early stopping at epoch 1150. Best Recall: 0.0977
2026-05-16 06:22:23,572 - optuna.study.study - INFO - Trial 167 finished with value: 0.09771248175364297 and parameters: {'n_layers': 1, 'embedding_dim': 256, 'lr': 0.0017023227089989462, 'lambda_val': 7.1080978044857385e-06, 'batch_size': 2932, 'optimizer': 'Adam'}. Best is trial 91 with value: 0.104993146553119.
2026-05-16 06:22:31,040 - experiment_functions - INFO - Early stopping at epoch 1100. Best Recall: 0.0942
2026-05-16 06:22:31,130 - optuna.study.study - INFO - Trial 168 finished with value: 0.0942153249779884 and parameters: {'n_layers': 1, 'embedding_dim': 256, 'lr': 0.0015086593128661933, 'lambda_val': 1.2283142669112627e-05, 'batch_size': 2926, 'optimizer': 'Adam'}. Best is trial 91 with value: 0.104993146553119.
2026-05-16 06:22:35,260 - experiment_functions - INFO - Early stopping at epoch 500. Best Recall: 0.0035
2026-05-16 06:22:35,362 - optuna.study.study - INFO - Trial 169 finished with value: 0.003520591814421927 and parameters: {'n_layers': 1, 'embedding_dim': 256, 'lr': 0.00046318243309449486, 'lambda_val': 7.808326070325053e-06, 'batch_size': 2965, 'optimizer': 'SGD'}. Best is trial 91 with value: 0.104993146553119.
2026-05-16 06:22:42,355 - experiment_functions - INFO - Early stopping at epoch 1000. Best Recall: 0.0947
2026-05-16 06:22:42,457 - optuna.study.study - INFO - Trial 170 finished with value: 0.09465392728514237 and parameters: {'n_layers': 1, 'embedding_dim': 256, 'lr': 0.0019588186473382383, 'lambda_val': 8.75550786945355e-06, 'batch_size': 3050, 'optimizer': 'Adam'}. Best is trial 91 with value: 0.104993146553119.
2026-05-16 06:22:49,605 - optuna.study._optimize - INFO - Trial 171 pruned. 
2026-05-16 06:23:04,563 - experiment_functions - INFO - Early stopping at epoch 1100. Best Recall: 0.0904
2026-05-16 06:23:05,335 - optuna.study.study - INFO - Trial 172 finished with value: 0.09038620160996645 and parameters: {'n_layers': 1, 'embedding_dim': 256, 'lr': 0.0016907930346942417, 'lambda_val': 1.4431351549941292e-05, 'batch_size': 2925, 'optimizer': 'Adam'}. Best is trial 91 with value: 0.104993146553119.
2026-05-16 06:23:14,224 - optuna.study._optimize - INFO - Trial 173 pruned. 
2026-05-16 06:23:21,578 - optuna.study._optimize - INFO - Trial 174 pruned. 
2026-05-16 06:23:27,732 - optuna.study._optimize - INFO - Trial 175 pruned. 
2026-05-16 06:23:33,757 - experiment_functions - INFO - Early stopping at epoch 900. Best Recall: 0.0864
2026-05-16 06:23:33,858 - optuna.study.study - INFO - Trial 176 finished with value: 0.0863592781305874 and parameters: {'n_layers': 1, 'embedding_dim': 256, 'lr': 0.0013792102521988495, 'lambda_val': 2.1895326151172065e-05, 'batch_size': 3252, 'optimizer': 'RMSprop'}. Best is trial 91 with value: 0.104993146553119.
