2026-05-15 21:51:30,293 - optuna.study._optimize - INFO - Trial 26 pruned. 
2026-05-15 21:51:36,602 - experiment_functions - INFO - Early stopping at epoch 1050. Best Recall: 0.0844
2026-05-15 21:51:36,702 - optuna.study.study - INFO - Trial 27 finished with value: 0.08435084144379501 and parameters: {'n_layers': 1, 'embedding_dim': 96, 'lr': 0.0004883175628200488, 'lambda_val': 8.53632818083491e-05, 'batch_size': 3829, 'optimizer': 'RMSprop'}. Best is trial 15 with value: 0.11044462058672783.
2026-05-15 21:51:40,077 - experiment_functions - INFO - Early stopping at epoch 500. Best Recall: 0.0033
2026-05-15 21:51:40,157 - optuna.study.study - INFO - Trial 28 finished with value: 0.0033225336447395733 and parameters: {'n_layers': 1, 'embedding_dim': 96, 'lr': 0.0018115952523191723, 'lambda_val': 3.250021557760682e-05, 'batch_size': 3361, 'optimizer': 'SGD'}. Best is trial 15 with value: 0.11044462058672783.
2026-05-15 21:51:46,519 - optuna.study._optimize - INFO - Trial 29 pruned. 
2026-05-15 21:51:50,040 - experiment_functions - INFO - Early stopping at epoch 500. Best Recall: 0.0036
2026-05-15 21:51:50,119 - optuna.study.study - INFO - Trial 30 finished with value: 0.0036196683655839047 and parameters: {'n_layers': 3, 'embedding_dim': 64, 'lr': 2.68144931615636e-05, 'lambda_val': 5.967458636420704e-05, 'batch_size': 2975, 'optimizer': 'SGD'}. Best is trial 15 with value: 0.11044462058672783.
2026-05-15 21:51:57,317 - optuna.study._optimize - INFO - Trial 31 pruned. 
2026-05-15 21:52:04,348 - optuna.study._optimize - INFO - Trial 32 pruned. 
2026-05-15 21:52:11,103 - optuna.study._optimize - INFO - Trial 33 pruned. 
2026-05-15 21:52:16,720 - experiment_functions - INFO - Early stopping at epoch 950. Best Recall: 0.0942
2026-05-15 21:52:16,811 - optuna.study.study - INFO - Trial 34 finished with value: 0.09415364751361203 and parameters: {'n_layers': 1, 'embedding_dim': 96, 'lr': 0.000540085467948164, 'lambda_val': 5.761538547925734e-05, 'batch_size': 3142, 'optimizer': 'RMSprop'}. Best is trial 15 with value: 0.11044462058672783.
2026-05-15 21:52:20,997 - experiment_functions - INFO - Early stopping at epoch 600. Best Recall: 0.0888
2026-05-15 21:52:21,141 - optuna.study.study - INFO - Trial 35 finished with value: 0.08883181090284871 and parameters: {'n_layers': 1, 'embedding_dim': 32, 'lr': 0.0023731898336809497, 'lambda_val': 1.536528052221727e-05, 'batch_size': 3123, 'optimizer': 'RMSprop'}. Best is trial 15 with value: 0.11044462058672783.
2026-05-15 21:52:24,759 - experiment_functions - INFO - Early stopping at epoch 550. Best Recall: 0.0916
2026-05-15 21:52:24,859 - optuna.study.study - INFO - Trial 36 finished with value: 0.09158407613992874 and parameters: {'n_layers': 1, 'embedding_dim': 32, 'lr': 0.011591152920708149, 'lambda_val': 1.2092712365209683e-05, 'batch_size': 2889, 'optimizer': 'Adam'}. Best is trial 15 with value: 0.11044462058672783.
2026-05-15 21:52:28,651 - experiment_functions - INFO - Early stopping at epoch 550. Best Recall: 0.0549
2026-05-15 21:52:28,750 - optuna.study.study - INFO - Trial 37 finished with value: 0.054944514780593035 and parameters: {'n_layers': 1, 'embedding_dim': 32, 'lr': 0.01976990182533574, 'lambda_val': 4.399910092677595e-05, 'batch_size': 2408, 'optimizer': 'Adam'}. Best is trial 15 with value: 0.11044462058672783.
2026-05-15 21:52:34,440 - optuna.study._optimize - INFO - Trial 38 pruned. 
2026-05-15 21:52:38,509 - experiment_functions - INFO - Early stopping at epoch 550. Best Recall: 0.0769
2026-05-15 21:52:38,611 - optuna.study.study - INFO - Trial 39 finished with value: 0.07687565407555697 and parameters: {'n_layers': 1, 'embedding_dim': 32, 'lr': 0.00876029908992326, 'lambda_val': 3.2479058493277672e-06, 'batch_size': 2045, 'optimizer': 'Adam'}. Best is trial 15 with value: 0.11044462058672783.
2026-05-15 21:52:45,167 - optuna.study._optimize - INFO - Trial 40 pruned. 
2026-05-15 21:52:48,988 - experiment_functions - INFO - Early stopping at epoch 550. Best Recall: 0.0787
2026-05-15 21:52:49,112 - optuna.study.study - INFO - Trial 41 finished with value: 0.07871711983762032 and parameters: {'n_layers': 1, 'embedding_dim': 32, 'lr': 0.007936247941261222, 'lambda_val': 1.524198942240685e-05, 'batch_size': 3106, 'optimizer': 'Adam'}. Best is trial 15 with value: 0.11044462058672783.
2026-05-15 21:52:52,752 - experiment_functions - INFO - Early stopping at epoch 500. Best Recall: 0.0027
2026-05-15 21:52:52,830 - optuna.study.study - INFO - Trial 42 finished with value: 0.0027272825302916887 and parameters: {'n_layers': 1, 'embedding_dim': 32, 'lr': 0.0024720973139381063, 'lambda_val': 1.9858608339868773e-06, 'batch_size': 2841, 'optimizer': 'SGD'}. Best is trial 15 with value: 0.11044462058672783.
2026-05-15 21:52:56,634 - experiment_functions - INFO - Early stopping at epoch 550. Best Recall: 0.0486
2026-05-15 21:52:56,755 - optuna.study.study - INFO - Trial 43 finished with value: 0.04860052073284132 and parameters: {'n_layers': 1, 'embedding_dim': 32, 'lr': 0.020093984556305473, 'lambda_val': 5.011804665376729e-06, 'batch_size': 3171, 'optimizer': 'Adam'}. Best is trial 15 with value: 0.11044462058672783.
2026-05-15 21:53:01,413 - experiment_functions - INFO - Early stopping at epoch 650. Best Recall: 0.0188
2026-05-15 21:53:01,491 - optuna.study.study - INFO - Trial 44 finished with value: 0.018839455461057877 and parameters: {'n_layers': 1, 'embedding_dim': 256, 'lr': 0.04567478147641582, 'lambda_val': 1.4876722687100196e-05, 'batch_size': 3450, 'optimizer': 'RMSprop'}. Best is trial 15 with value: 0.11044462058672783.
2026-05-15 21:53:05,679 - experiment_functions - INFO - Early stopping at epoch 600. Best Recall: 0.0212
2026-05-15 21:53:05,770 - optuna.study.study - INFO - Trial 45 finished with value: 0.021160314738349516 and parameters: {'n_layers': 4, 'embedding_dim': 32, 'lr': 0.005431303434820237, 'lambda_val': 4.613712688587803e-05, 'batch_size': 2157, 'optimizer': 'RMSprop'}. Best is trial 15 with value: 0.11044462058672783.
2026-05-15 21:53:09,525 - experiment_functions - INFO - Early stopping at epoch 500. Best Recall: 0.0014
2026-05-15 21:53:09,604 - optuna.study.study - INFO - Trial 46 finished with value: 0.001381092291847378 and parameters: {'n_layers': 1, 'embedding_dim': 32, 'lr': 0.013411878819692788, 'lambda_val': 0.0009399237780258301, 'batch_size': 2416, 'optimizer': 'SGD'}. Best is trial 15 with value: 0.11044462058672783.
2026-05-15 21:53:13,246 - experiment_functions - INFO - Early stopping at epoch 550. Best Recall: 0.0176
2026-05-15 21:53:13,379 - optuna.study.study - INFO - Trial 47 finished with value: 0.017554364443622725 and parameters: {'n_layers': 1, 'embedding_dim': 64, 'lr': 0.002582170424703149, 'lambda_val': 0.09780086616936462, 'batch_size': 2943, 'optimizer': 'RMSprop'}. Best is trial 15 with value: 0.11044462058672783.
2026-05-15 21:53:20,350 - experiment_functions - INFO - Early stopping at epoch 1050. Best Recall: 0.1075
2026-05-15 21:53:20,449 - optuna.study.study - INFO - Trial 48 finished with value: 0.10752845669288687 and parameters: {'n_layers': 1, 'embedding_dim': 256, 'lr': 0.0007105621429305313, 'lambda_val': 1.2982413802619181e-05, 'batch_size': 3206, 'optimizer': 'Adam'}. Best is trial 15 with value: 0.11044462058672783.
2026-05-15 21:53:27,509 - experiment_functions - INFO - Early stopping at epoch 800. Best Recall: 0.0725
2026-05-15 21:53:27,608 - optuna.study.study - INFO - Trial 49 finished with value: 0.07245817789026156 and parameters: {'n_layers': 2, 'embedding_dim': 256, 'lr': 0.0007332708503718133, 'lambda_val': 4.963791171561077e-06, 'batch_size': 3235, 'optimizer': 'Adam'}. Best is trial 15 with value: 0.11044462058672783.
2026-05-15 21:53:34,629 - optuna.study._optimize - INFO - Trial 50 pruned. 
2026-05-15 21:53:41,178 - optuna.study._optimize - INFO - Trial 51 pruned. 
2026-05-15 21:53:46,367 - experiment_functions - INFO - Early stopping at epoch 700. Best Recall: 0.1060
2026-05-15 21:53:46,458 - optuna.study.study - INFO - Trial 52 finished with value: 0.10601619391117463 and parameters: {'n_layers': 1, 'embedding_dim': 256, 'lr': 0.0017166548454406077, 'lambda_val': 8.374049767457116e-06, 'batch_size': 3111, 'optimizer': 'Adam'}. Best is trial 15 with value: 0.11044462058672783.
2026-05-15 21:53:53,353 - experiment_functions - INFO - Early stopping at epoch 1000. Best Recall: 0.1061
2026-05-15 21:53:53,452 - optuna.study.study - INFO - Trial 53 finished with value: 0.10605527039511724 and parameters: {'n_layers': 1, 'embedding_dim': 256, 'lr': 0.0008424064410815005, 'lambda_val': 2.298026557212184e-06, 'batch_size': 2667, 'optimizer': 'Adam'}. Best is trial 15 with value: 0.11044462058672783.
2026-05-15 21:53:59,676 - experiment_functions - INFO - Early stopping at epoch 900. Best Recall: 0.1150
2026-05-15 21:53:59,777 - optuna.study.study - INFO - Trial 54 finished with value: 0.11496951562110704 and parameters: {'n_layers': 1, 'embedding_dim': 256, 'lr': 0.0009571907016544434, 'lambda_val': 1.1513238279088247e-06, 'batch_size': 2675, 'optimizer': 'Adam'}. Best is trial 54 with value: 0.11496951562110704.
2026-05-15 21:54:06,256 - experiment_functions - INFO - Early stopping at epoch 700. Best Recall: 0.0770
2026-05-15 21:54:06,391 - optuna.study.study - INFO - Trial 55 finished with value: 0.0769885667274475 and parameters: {'n_layers': 2, 'embedding_dim': 256, 'lr': 0.0009499031700177298, 'lambda_val': 1.0187761680713033e-06, 'batch_size': 2699, 'optimizer': 'Adam'}. Best is trial 54 with value: 0.11496951562110704.
2026-05-15 21:54:11,757 - experiment_functions - INFO - Early stopping at epoch 750. Best Recall: 0.1010
2026-05-15 21:54:11,847 - optuna.study.study - INFO - Trial 56 finished with value: 0.10102177912803596 and parameters: {'n_layers': 1, 'embedding_dim': 256, 'lr': 0.0016983294244904486, 'lambda_val': 1.97417814974407e-06, 'batch_size': 2283, 'optimizer': 'Adam'}. Best is trial 54 with value: 0.11496951562110704.
2026-05-15 21:54:16,377 - experiment_functions - INFO - Early stopping at epoch 600. Best Recall: 0.1057
2026-05-15 21:54:16,512 - optuna.study.study - INFO - Trial 57 finished with value: 0.10569911791580697 and parameters: {'n_layers': 1, 'embedding_dim': 256, 'lr': 0.004013174463530638, 'lambda_val': 1.8553247263663248e-06, 'batch_size': 2531, 'optimizer': 'Adam'}. Best is trial 54 with value: 0.11496951562110704.
2026-05-15 21:54:20,530 - experiment_functions - INFO - Early stopping at epoch 550. Best Recall: 0.0966
2026-05-15 21:54:20,654 - optuna.study.study - INFO - Trial 58 finished with value: 0.09655454543628895 and parameters: {'n_layers': 1, 'embedding_dim': 256, 'lr': 0.004864878158614985, 'lambda_val': 1.7753354795784939e-06, 'batch_size': 2533, 'optimizer': 'Adam'}. Best is trial 54 with value: 0.11496951562110704.
2026-05-15 21:54:25,910 - experiment_functions - INFO - Early stopping at epoch 550. Best Recall: 0.0710
2026-05-15 21:54:26,075 - optuna.study.study - INFO - Trial 59 finished with value: 0.07095607179488608 and parameters: {'n_layers': 2, 'embedding_dim': 256, 'lr': 0.0036493762503662184, 'lambda_val': 2.862976322223875e-06, 'batch_size': 2617, 'optimizer': 'Adam'}. Best is trial 54 with value: 0.11496951562110704.
2026-05-15 21:54:33,985 - experiment_functions - INFO - Early stopping at epoch 800. Best Recall: 0.1117
2026-05-15 21:54:34,095 - optuna.study.study - INFO - Trial 60 finished with value: 0.11166010217205907 and parameters: {'n_layers': 1, 'embedding_dim': 256, 'lr': 0.0011994144675626782, 'lambda_val': 1.4774605349249244e-06, 'batch_size': 2716, 'optimizer': 'Adam'}. Best is trial 54 with value: 0.11496951562110704.
2026-05-15 21:54:39,874 - experiment_functions - INFO - Early stopping at epoch 850. Best Recall: 0.1152
2026-05-15 21:54:39,964 - optuna.study.study - INFO - Trial 61 finished with value: 0.11524332901050958 and parameters: {'n_layers': 1, 'embedding_dim': 256, 'lr': 0.0011312102905152782, 'lambda_val': 1.4021527982667849e-06, 'batch_size': 2745, 'optimizer': 'Adam'}. Best is trial 61 with value: 0.11524332901050958.
2026-05-15 21:54:46,772 - experiment_functions - INFO - Early stopping at epoch 1050. Best Recall: 0.1194
2026-05-15 21:54:46,863 - optuna.study.study - INFO - Trial 62 finished with value: 0.11936993072483862 and parameters: {'n_layers': 1, 'embedding_dim': 256, 'lr': 0.0007440721681768869, 'lambda_val': 6.444064565808409e-06, 'batch_size': 2721, 'optimizer': 'Adam'}. Best is trial 62 with value: 0.11936993072483862.
2026-05-15 21:54:53,654 - experiment_functions - INFO - Early stopping at epoch 900. Best Recall: 0.1060
2026-05-15 21:54:53,754 - optuna.study.study - INFO - Trial 63 finished with value: 0.10603296603827754 and parameters: {'n_layers': 1, 'embedding_dim': 256, 'lr': 0.0007716308910633792, 'lambda_val': 1.2620846593585923e-06, 'batch_size': 2725, 'optimizer': 'Adam'}. Best is trial 62 with value: 0.11936993072483862.
2026-05-15 21:54:59,905 - experiment_functions - INFO - Early stopping at epoch 900. Best Recall: 0.1180
2026-05-15 21:55:00,006 - optuna.study.study - INFO - Trial 64 finished with value: 0.11804910493022215 and parameters: {'n_layers': 1, 'embedding_dim': 256, 'lr': 0.001103720428484085, 'lambda_val': 4.710815880003321e-06, 'batch_size': 2430, 'optimizer': 'Adam'}. Best is trial 62 with value: 0.11936993072483862.
2026-05-15 21:55:05,860 - experiment_functions - INFO - Early stopping at epoch 800. Best Recall: 0.1094
2026-05-15 21:55:06,047 - optuna.study.study - INFO - Trial 65 finished with value: 0.10942095277518438 and parameters: {'n_layers': 1, 'embedding_dim': 256, 'lr': 0.0011080751363116387, 'lambda_val': 4.770888318217313e-06, 'batch_size': 2197, 'optimizer': 'Adam'}. Best is trial 62 with value: 0.11936993072483862.
2026-05-15 21:55:12,505 - experiment_functions - INFO - Early stopping at epoch 950. Best Recall: 0.1133
2026-05-15 21:55:12,586 - optuna.study.study - INFO - Trial 66 finished with value: 0.1133356167085797 and parameters: {'n_layers': 1, 'embedding_dim': 256, 'lr': 0.0010154823856747173, 'lambda_val': 4.803301960261624e-06, 'batch_size': 2167, 'optimizer': 'Adam'}. Best is trial 62 with value: 0.11936993072483862.
2026-05-15 21:55:17,786 - experiment_functions - INFO - Early stopping at epoch 750. Best Recall: 0.1029
2026-05-15 21:55:17,886 - optuna.study.study - INFO - Trial 67 finished with value: 0.10286187976068493 and parameters: {'n_layers': 1, 'embedding_dim': 256, 'lr': 0.001255965156295264, 'lambda_val': 1.3804404307019528e-06, 'batch_size': 2394, 'optimizer': 'Adam'}. Best is trial 62 with value: 0.11936993072483862.
2026-05-15 21:55:36,713 - experiment_functions - INFO - Early stopping at epoch 3450. Best Recall: 0.1098
2026-05-15 21:55:36,792 - optuna.study.study - INFO - Trial 68 finished with value: 0.10977668966276871 and parameters: {'n_layers': 1, 'embedding_dim': 64, 'lr': 0.0003798531081432098, 'lambda_val': 4.213010395678004e-06, 'batch_size': 2086, 'optimizer': 'Adam'}. Best is trial 62 with value: 0.11936993072483862.
2026-05-15 21:55:43,113 - experiment_functions - INFO - Early stopping at epoch 600. Best Recall: 0.0670
2026-05-15 21:55:43,257 - optuna.study.study - INFO - Trial 69 finished with value: 0.06699261567853468 and parameters: {'n_layers': 2, 'embedding_dim': 256, 'lr': 0.0018887517486901465, 'lambda_val': 2.950522242456704e-06, 'batch_size': 1717, 'optimizer': 'Adam'}. Best is trial 62 with value: 0.11936993072483862.
2026-05-15 21:55:51,684 - optuna.study._optimize - INFO - Trial 70 pruned. 
2026-05-15 21:56:03,438 - optuna.study._optimize - INFO - Trial 71 pruned. 
2026-05-15 21:56:09,618 - optuna.study._optimize - INFO - Trial 72 pruned. 
2026-05-15 21:56:16,997 - optuna.study._optimize - INFO - Trial 73 pruned. 
2026-05-15 21:56:24,494 - optuna.study._optimize - INFO - Trial 74 pruned. 
2026-05-15 21:56:43,657 - experiment_functions - INFO - Early stopping at epoch 1350. Best Recall: 0.1086
2026-05-15 21:56:43,747 - optuna.study.study - INFO - Trial 75 finished with value: 0.10862700229752997 and parameters: {'n_layers': 1, 'embedding_dim': 256, 'lr': 0.00043517911450849926, 'lambda_val': 2.7349664811073067e-06, 'batch_size': 2778, 'optimizer': 'Adam'}. Best is trial 62 with value: 0.11936993072483862.
2026-05-15 21:56:50,387 - experiment_functions - INFO - Early stopping at epoch 1150. Best Recall: 0.1113
2026-05-15 21:56:50,485 - optuna.study.study - INFO - Trial 76 finished with value: 0.11129927258238413 and parameters: {'n_layers': 1, 'embedding_dim': 64, 'lr': 0.0011070537030338189, 'lambda_val': 3.892549704459719e-06, 'batch_size': 2482, 'optimizer': 'Adam'}. Best is trial 62 with value: 0.11936993072483862.
2026-05-15 21:56:54,048 - experiment_functions - INFO - Early stopping at epoch 500. Best Recall: 0.0029
2026-05-15 21:56:54,149 - optuna.study.study - INFO - Trial 77 finished with value: 0.0028683693387562964 and parameters: {'n_layers': 1, 'embedding_dim': 256, 'lr': 0.0009244605900479827, 'lambda_val': 7.130579028064449e-06, 'batch_size': 2496, 'optimizer': 'SGD'}. Best is trial 62 with value: 0.11936993072483862.
2026-05-15 21:56:58,637 - experiment_functions - INFO - Early stopping at epoch 650. Best Recall: 0.0972
2026-05-15 21:56:58,728 - optuna.study.study - INFO - Trial 78 finished with value: 0.0971618927790665 and parameters: {'n_layers': 1, 'embedding_dim': 128, 'lr': 0.002184477948879748, 'lambda_val': 2.1143832181070565e-05, 'batch_size': 2234, 'optimizer': 'Adam'}. Best is trial 62 with value: 0.11936993072483862.
2026-05-15 21:57:04,159 - experiment_functions - INFO - Early stopping at epoch 750. Best Recall: 0.1090
2026-05-15 21:57:04,295 - optuna.study.study - INFO - Trial 79 finished with value: 0.10902026244396687 and parameters: {'n_layers': 1, 'embedding_dim': 256, 'lr': 0.0012329869218238615, 'lambda_val': 2.2061913596245507e-06, 'batch_size': 2928, 'optimizer': 'Adam'}. Best is trial 62 with value: 0.11936993072483862.
2026-05-15 21:57:08,562 - experiment_functions - INFO - Early stopping at epoch 650. Best Recall: 0.0467
2026-05-15 21:57:08,663 - optuna.study.study - INFO - Trial 80 finished with value: 0.04673131471915507 and parameters: {'n_layers': 1, 'embedding_dim': 64, 'lr': 0.0015253181469161475, 'lambda_val': 0.0394246059650158, 'batch_size': 2461, 'optimizer': 'Adam'}. Best is trial 62 with value: 0.11936993072483862.
2026-05-15 21:57:16,391 - optuna.study._optimize - INFO - Trial 81 pruned. 
2026-05-15 21:57:22,546 - experiment_functions - INFO - Early stopping at epoch 1100. Best Recall: 0.1063
2026-05-15 21:57:22,645 - optuna.study.study - INFO - Trial 82 finished with value: 0.10627459520203329 and parameters: {'n_layers': 1, 'embedding_dim': 64, 'lr': 0.0009860348351691452, 'lambda_val': 9.749067024842476e-06, 'batch_size': 1570, 'optimizer': 'Adam'}. Best is trial 62 with value: 0.11936993072483862.
2026-05-15 21:57:27,179 - experiment_functions - INFO - Early stopping at epoch 700. Best Recall: 0.1070
2026-05-15 21:57:27,325 - optuna.study.study - INFO - Trial 83 finished with value: 0.1069847681416529 and parameters: {'n_layers': 1, 'embedding_dim': 64, 'lr': 0.003198318650770008, 'lambda_val': 1.512119289176072e-06, 'batch_size': 2309, 'optimizer': 'Adam'}. Best is trial 62 with value: 0.11936993072483862.
2026-05-15 21:57:33,500 - optuna.study._optimize - INFO - Trial 84 pruned. 
2026-05-15 21:57:40,339 - optuna.study._optimize - INFO - Trial 85 pruned. 
2026-05-15 21:57:48,660 - experiment_functions - INFO - Early stopping at epoch 1250. Best Recall: 0.1053
2026-05-15 21:57:48,751 - optuna.study.study - INFO - Trial 86 finished with value: 0.10527423767490889 and parameters: {'n_layers': 1, 'embedding_dim': 256, 'lr': 0.0005852978110651913, 'lambda_val': 2.4776045461810524e-06, 'batch_size': 3011, 'optimizer': 'Adam'}. Best is trial 62 with value: 0.11936993072483862.
2026-05-15 21:57:52,563 - experiment_functions - INFO - Early stopping at epoch 500. Best Recall: 0.0016
2026-05-15 21:57:52,653 - optuna.study.study - INFO - Trial 87 finished with value: 0.0016262679879153524 and parameters: {'n_layers': 4, 'embedding_dim': 64, 'lr': 0.00028225214885805184, 'lambda_val': 6.306798443762417e-06, 'batch_size': 2351, 'optimizer': 'SGD'}. Best is trial 62 with value: 0.11936993072483862.
2026-05-15 21:57:57,977 - experiment_functions - INFO - Early stopping at epoch 650. Best Recall: 0.1028
2026-05-15 21:57:58,067 - optuna.study.study - INFO - Trial 88 finished with value: 0.10275340399457615 and parameters: {'n_layers': 1, 'embedding_dim': 256, 'lr': 0.001998654168087316, 'lambda_val': 9.381021236819282e-06, 'batch_size': 2082, 'optimizer': 'Adam'}. Best is trial 62 with value: 0.11936993072483862.
2026-05-15 21:58:04,562 - optuna.study._optimize - INFO - Trial 89 pruned. 
2026-05-15 21:58:10,902 - optuna.study._optimize - INFO - Trial 90 pruned. 
2026-05-15 21:58:17,446 - experiment_functions - INFO - Early stopping at epoch 1050. Best Recall: 0.1067
2026-05-15 21:58:17,544 - optuna.study.study - INFO - Trial 91 finished with value: 0.10674123981148374 and parameters: {'n_layers': 1, 'embedding_dim': 256, 'lr': 0.0011210529474023282, 'lambda_val': 4.35811891637608e-06, 'batch_size': 2240, 'optimizer': 'Adam'}. Best is trial 62 with value: 0.11936993072483862.
2026-05-15 21:58:23,344 - experiment_functions - INFO - Early stopping at epoch 800. Best Recall: 0.1046
2026-05-15 21:58:23,422 - optuna.study.study - INFO - Trial 92 finished with value: 0.10456957378106821 and parameters: {'n_layers': 1, 'embedding_dim': 256, 'lr': 0.001102503457150298, 'lambda_val': 3.012361297299081e-06, 'batch_size': 2194, 'optimizer': 'Adam'}. Best is trial 62 with value: 0.11936993072483862.
2026-05-15 21:58:33,892 - experiment_functions - INFO - Early stopping at epoch 1750. Best Recall: 0.1217
