2026-05-16 07:21:48,370 - optuna.study.study - INFO - Trial 240 finished with value: 0.11347014312282339 and parameters: {'n_layers': 1, 'embedding_dim': 256, 'lr': 0.0005636922903297672, 'lambda_val': 2.162852772254664e-06, 'batch_size': 2376, 'optimizer': 'Adam'}. Best is trial 235 with value: 0.13444998959533183.
2026-05-16 07:22:07,731 - experiment_functions - INFO - Early stopping at epoch 2600. Best Recall: 0.1382
2026-05-16 07:22:07,838 - optuna.study.study - INFO - Trial 241 finished with value: 0.1382007692365605 and parameters: {'n_layers': 1, 'embedding_dim': 256, 'lr': 0.0003986155654671252, 'lambda_val': 4.934342262420792e-06, 'batch_size': 2071, 'optimizer': 'Adam'}. Best is trial 241 with value: 0.1382007692365605.
2026-05-16 07:22:19,841 - experiment_functions - INFO - Early stopping at epoch 1850. Best Recall: 0.1237
2026-05-16 07:22:19,945 - optuna.study.study - INFO - Trial 242 finished with value: 0.1236684501739802 and parameters: {'n_layers': 1, 'embedding_dim': 256, 'lr': 0.0004645242810588959, 'lambda_val': 4.971612466270053e-06, 'batch_size': 2028, 'optimizer': 'Adam'}. Best is trial 241 with value: 0.1382007692365605.
2026-05-16 07:22:46,838 - experiment_functions - INFO - Early stopping at epoch 3300. Best Recall: 0.1265
2026-05-16 07:22:46,953 - optuna.study.study - INFO - Trial 243 finished with value: 0.1265184353763938 and parameters: {'n_layers': 1, 'embedding_dim': 256, 'lr': 0.0003686142949621036, 'lambda_val': 4.677407986344838e-06, 'batch_size': 2083, 'optimizer': 'Adam'}. Best is trial 241 with value: 0.1382007692365605.
2026-05-16 07:22:54,116 - optuna.study._optimize - INFO - Trial 244 pruned. 
2026-05-16 07:23:02,754 - optuna.study._optimize - INFO - Trial 245 pruned. 
2026-05-16 07:23:10,125 - optuna.study._optimize - INFO - Trial 246 pruned. 
2026-05-16 07:23:19,622 - optuna.study._optimize - INFO - Trial 247 pruned. 
2026-05-16 07:23:47,014 - experiment_functions - INFO - Early stopping at epoch 3300. Best Recall: 0.1328
2026-05-16 07:23:47,117 - optuna.study.study - INFO - Trial 248 finished with value: 0.13281944789663272 and parameters: {'n_layers': 1, 'embedding_dim': 256, 'lr': 0.0003219624601977714, 'lambda_val': 8.022585309740901e-06, 'batch_size': 2073, 'optimizer': 'Adam'}. Best is trial 241 with value: 0.1382007692365605.
2026-05-16 07:23:56,147 - optuna.study._optimize - INFO - Trial 249 pruned. 
2026-05-16 07:24:01,947 - optuna.study._optimize - INFO - Trial 250 pruned. 
2026-05-16 07:24:11,549 - optuna.study._optimize - INFO - Trial 251 pruned. 
2026-05-16 07:24:18,658 - optuna.study._optimize - INFO - Trial 252 pruned. 
2026-05-16 07:24:29,912 - experiment_functions - INFO - Early stopping at epoch 1550. Best Recall: 0.1159
2026-05-16 07:24:30,017 - optuna.study.study - INFO - Trial 253 finished with value: 0.11592363770970401 and parameters: {'n_layers': 1, 'embedding_dim': 256, 'lr': 0.0006468878000751576, 'lambda_val': 6.51231337679909e-06, 'batch_size': 2071, 'optimizer': 'Adam'}. Best is trial 241 with value: 0.1382007692365605.
2026-05-16 07:24:39,997 - optuna.study._optimize - INFO - Trial 254 pruned. 
2026-05-16 07:24:48,978 - optuna.study._optimize - INFO - Trial 255 pruned. 
2026-05-16 07:24:59,382 - optuna.study._optimize - INFO - Trial 256 pruned. 
2026-05-16 07:25:09,489 - optuna.study._optimize - INFO - Trial 257 pruned. 
2026-05-16 07:25:16,401 - optuna.study._optimize - INFO - Trial 258 pruned. 
2026-05-16 07:25:24,142 - optuna.study._optimize - INFO - Trial 259 pruned. 
2026-05-16 07:25:28,036 - experiment_functions - INFO - Early stopping at epoch 500. Best Recall: 0.0021
2026-05-16 07:25:28,153 - optuna.study.study - INFO - Trial 260 finished with value: 0.00211055461800222 and parameters: {'n_layers': 1, 'embedding_dim': 256, 'lr': 0.00027416977701941615, 'lambda_val': 5.832277114428442e-06, 'batch_size': 3770, 'optimizer': 'SGD'}. Best is trial 241 with value: 0.1382007692365605.
2026-05-16 07:25:34,945 - optuna.study._optimize - INFO - Trial 261 pruned. 
2026-05-16 07:25:48,274 - experiment_functions - INFO - Early stopping at epoch 1700. Best Recall: 0.1204
2026-05-16 07:25:48,378 - optuna.study.study - INFO - Trial 262 finished with value: 0.12036419791887117 and parameters: {'n_layers': 1, 'embedding_dim': 256, 'lr': 0.00041305681001133586, 'lambda_val': 6.870350777616004e-06, 'batch_size': 3696, 'optimizer': 'Adam'}. Best is trial 241 with value: 0.1382007692365605.
2026-05-16 07:25:58,499 - experiment_functions - INFO - Early stopping at epoch 1300. Best Recall: 0.1221
2026-05-16 07:25:58,601 - optuna.study.study - INFO - Trial 263 finished with value: 0.1220808215551166 and parameters: {'n_layers': 1, 'embedding_dim': 256, 'lr': 0.0004425063352042019, 'lambda_val': 6.817324152835753e-06, 'batch_size': 3717, 'optimizer': 'Adam'}. Best is trial 241 with value: 0.1382007692365605.
2026-05-16 07:26:09,659 - optuna.study._optimize - INFO - Trial 264 pruned. 
2026-05-16 07:26:18,176 - optuna.study._optimize - INFO - Trial 265 pruned. 
2026-05-16 07:26:24,719 - optuna.study._optimize - INFO - Trial 266 pruned. 
2026-05-16 07:26:37,885 - experiment_functions - INFO - Early stopping at epoch 1850. Best Recall: 0.1343
2026-05-16 07:26:37,987 - optuna.study.study - INFO - Trial 267 finished with value: 0.13434717056837 and parameters: {'n_layers': 1, 'embedding_dim': 256, 'lr': 0.0004393058341840451, 'lambda_val': 3.748413488553405e-06, 'batch_size': 2215, 'optimizer': 'Adam'}. Best is trial 241 with value: 0.1382007692365605.
2026-05-16 07:26:52,041 - experiment_functions - INFO - Early stopping at epoch 1400. Best Recall: 0.1164
2026-05-16 07:26:52,132 - optuna.study.study - INFO - Trial 268 finished with value: 0.11637825012276125 and parameters: {'n_layers': 1, 'embedding_dim': 256, 'lr': 0.00058353769569206, 'lambda_val': 4.7021202317340596e-06, 'batch_size': 2173, 'optimizer': 'Adam'}. Best is trial 241 with value: 0.1382007692365605.
2026-05-16 07:27:01,706 - experiment_functions - INFO - Early stopping at epoch 1550. Best Recall: 0.1227
2026-05-16 07:27:01,798 - optuna.study.study - INFO - Trial 269 finished with value: 0.12270857849362216 and parameters: {'n_layers': 1, 'embedding_dim': 256, 'lr': 0.0004566437692535971, 'lambda_val': 7.540098157345929e-06, 'batch_size': 2233, 'optimizer': 'Adam'}. Best is trial 241 with value: 0.1382007692365605.
2026-05-16 07:27:15,296 - experiment_functions - INFO - Early stopping at epoch 1700. Best Recall: 0.1178
2026-05-16 07:27:15,409 - optuna.study.study - INFO - Trial 270 finished with value: 0.11784741757182504 and parameters: {'n_layers': 1, 'embedding_dim': 256, 'lr': 0.0004820046131014253, 'lambda_val': 7.557555334527166e-06, 'batch_size': 2273, 'optimizer': 'Adam'}. Best is trial 241 with value: 0.1382007692365605.
2026-05-16 07:27:27,710 - experiment_functions - INFO - Early stopping at epoch 1550. Best Recall: 0.1179
2026-05-16 07:27:27,801 - optuna.study.study - INFO - Trial 271 finished with value: 0.11787976176867403 and parameters: {'n_layers': 1, 'embedding_dim': 256, 'lr': 0.000656931622214288, 'lambda_val': 1.1469567760109775e-05, 'batch_size': 2214, 'optimizer': 'Adam'}. Best is trial 241 with value: 0.1382007692365605.
2026-05-16 07:27:45,416 - experiment_functions - INFO - Early stopping at epoch 2450. Best Recall: 0.1304
2026-05-16 07:27:45,529 - optuna.study.study - INFO - Trial 272 finished with value: 0.13042700655479206 and parameters: {'n_layers': 1, 'embedding_dim': 256, 'lr': 0.00042959244068768525, 'lambda_val': 1.0175203432968266e-05, 'batch_size': 1995, 'optimizer': 'Adam'}. Best is trial 241 with value: 0.1382007692365605.
2026-05-16 07:27:53,964 - optuna.study._optimize - INFO - Trial 273 pruned. 
2026-05-16 07:28:01,836 - optuna.study._optimize - INFO - Trial 274 pruned. 
2026-05-16 07:28:09,179 - optuna.study._optimize - INFO - Trial 275 pruned. 
2026-05-16 07:28:16,877 - optuna.study._optimize - INFO - Trial 276 pruned. 
2026-05-16 07:28:24,463 - optuna.study._optimize - INFO - Trial 277 pruned. 
2026-05-16 07:28:37,200 - experiment_functions - INFO - Early stopping at epoch 1750. Best Recall: 0.1180
2026-05-16 07:28:37,728 - optuna.study.study - INFO - Trial 278 finished with value: 0.11799629065289717 and parameters: {'n_layers': 1, 'embedding_dim': 256, 'lr': 0.0005270206510623787, 'lambda_val': 9.050179927329395e-06, 'batch_size': 2011, 'optimizer': 'Adam'}. Best is trial 241 with value: 0.1382007692365605.
2026-05-16 07:28:44,266 - optuna.study._optimize - INFO - Trial 279 pruned. 
2026-05-16 07:28:51,983 - optuna.study._optimize - INFO - Trial 280 pruned. 
2026-05-16 07:29:00,883 - optuna.study._optimize - INFO - Trial 281 pruned. 
2026-05-16 07:29:19,072 - experiment_functions - INFO - Early stopping at epoch 2000. Best Recall: 0.1218
2026-05-16 07:29:19,164 - optuna.study.study - INFO - Trial 282 finished with value: 0.12183057894058043 and parameters: {'n_layers': 1, 'embedding_dim': 256, 'lr': 0.00045319941950777866, 'lambda_val': 4.8764727843175046e-06, 'batch_size': 2068, 'optimizer': 'Adam'}. Best is trial 241 with value: 0.1382007692365605.
2026-05-16 07:29:25,752 - optuna.study._optimize - INFO - Trial 283 pruned. 
2026-05-16 07:29:38,761 - experiment_functions - INFO - Early stopping at epoch 1650. Best Recall: 0.1189
2026-05-16 07:29:38,873 - optuna.study.study - INFO - Trial 284 finished with value: 0.118940645974958 and parameters: {'n_layers': 1, 'embedding_dim': 256, 'lr': 0.0003875290057276794, 'lambda_val': 3.5147704833850383e-06, 'batch_size': 2524, 'optimizer': 'RMSprop'}. Best is trial 241 with value: 0.1382007692365605.
2026-05-16 07:29:53,896 - experiment_functions - INFO - Early stopping at epoch 1700. Best Recall: 0.1289
2026-05-16 07:29:53,987 - optuna.study.study - INFO - Trial 285 finished with value: 0.1288513673581015 and parameters: {'n_layers': 1, 'embedding_dim': 256, 'lr': 0.0005355731345156721, 'lambda_val': 8.102697607586355e-06, 'batch_size': 2096, 'optimizer': 'Adam'}. Best is trial 241 with value: 0.1382007692365605.
2026-05-16 07:30:04,050 - experiment_functions - INFO - Early stopping at epoch 1450. Best Recall: 0.1164
2026-05-16 07:30:04,220 - optuna.study.study - INFO - Trial 286 finished with value: 0.11638092075036599 and parameters: {'n_layers': 1, 'embedding_dim': 256, 'lr': 0.0005420025431296826, 'lambda_val': 7.3545733384559675e-06, 'batch_size': 2162, 'optimizer': 'Adam'}. Best is trial 241 with value: 0.1382007692365605.
2026-05-16 07:30:12,611 - experiment_functions - INFO - Early stopping at epoch 800. Best Recall: 0.0413
2026-05-16 07:30:12,733 - optuna.study.study - INFO - Trial 287 finished with value: 0.04130098580312828 and parameters: {'n_layers': 4, 'embedding_dim': 256, 'lr': 0.0004509497424272449, 'lambda_val': 5.918387715753795e-06, 'batch_size': 2002, 'optimizer': 'Adam'}. Best is trial 241 with value: 0.1382007692365605.
2026-05-16 07:30:16,965 - experiment_functions - INFO - Early stopping at epoch 500. Best Recall: 0.0024
2026-05-16 07:30:17,067 - optuna.study.study - INFO - Trial 288 finished with value: 0.0024109620250086657 and parameters: {'n_layers': 1, 'embedding_dim': 64, 'lr': 0.0005740532443250409, 'lambda_val': 9.850087161809973e-06, 'batch_size': 2223, 'optimizer': 'SGD'}. Best is trial 241 with value: 0.1382007692365605.
2026-05-16 07:30:24,741 - optuna.study._optimize - INFO - Trial 289 pruned. 
2026-05-16 07:30:34,627 - optuna.study._optimize - INFO - Trial 290 pruned. 
2026-05-16 07:30:46,203 - experiment_functions - INFO - Early stopping at epoch 1900. Best Recall: 0.1346
2026-05-16 07:30:46,295 - optuna.study.study - INFO - Trial 291 finished with value: 0.13459231178097925 and parameters: {'n_layers': 1, 'embedding_dim': 256, 'lr': 0.0004766548321549708, 'lambda_val': 2.2707482490243e-06, 'batch_size': 2287, 'optimizer': 'Adam'}. Best is trial 241 with value: 0.1382007692365605.
2026-05-16 07:30:53,812 - optuna.study._optimize - INFO - Trial 292 pruned. 
2026-05-16 07:31:01,071 - optuna.study._optimize - INFO - Trial 293 pruned. 
2026-05-16 07:31:08,364 - optuna.study._optimize - INFO - Trial 294 pruned. 
2026-05-16 07:31:25,599 - optuna.study._optimize - INFO - Trial 295 pruned. 
2026-05-16 07:31:46,924 - experiment_functions - INFO - Early stopping at epoch 3200. Best Recall: 0.1299
2026-05-16 07:31:47,015 - optuna.study.study - INFO - Trial 296 finished with value: 0.1298669128464897 and parameters: {'n_layers': 1, 'embedding_dim': 256, 'lr': 0.00039725813188981124, 'lambda_val': 3.132900292046407e-06, 'batch_size': 1897, 'optimizer': 'Adam'}. Best is trial 241 with value: 0.1382007692365605.
2026-05-16 07:31:56,312 - optuna.study._optimize - INFO - Trial 297 pruned. 
2026-05-16 07:32:03,367 - optuna.study._optimize - INFO - Trial 298 pruned. 
2026-05-16 07:32:11,576 - experiment_functions - INFO - Early stopping at epoch 1150. Best Recall: 0.1276
2026-05-16 07:32:11,689 - optuna.study.study - INFO - Trial 299 finished with value: 0.12762525285929954 and parameters: {'n_layers': 1, 'embedding_dim': 256, 'lr': 0.0007422129719687342, 'lambda_val': 2.913155506295045e-06, 'batch_size': 1955, 'optimizer': 'Adam'}. Best is trial 241 with value: 0.1382007692365605.
2026-05-16 07:32:21,734 - experiment_functions - INFO - Early stopping at epoch 2450. Best Recall: 0.1259
2026-05-16 07:32:21,846 - root - INFO -   **** Training e_100K_1c3dcs_rand2
2026-05-16 07:32:21,860 - root - INFO -   **** Getting 70319/81200 random edges
2026-05-16 07:32:23,172 - optuna.storages._rdb.storage - INFO - A new study created in RDB with name: Study_e_100K_1c3dcs_rand2
2026-05-16 07:32:27,461 - experiment_functions - INFO - Early stopping at epoch 500. Best Recall: 0.0022
2026-05-16 07:32:27,554 - optuna.study.study - INFO - Trial 0 finished with value: 0.002218901512078404 and parameters: {'n_layers': 1, 'embedding_dim': 128, 'lr': 1.1071834807513305e-05, 'lambda_val': 0.0969744975357526, 'batch_size': 2621, 'optimizer': 'RMSprop'}. Best is trial 0 with value: 0.002218901512078404.
2026-05-16 07:32:31,656 - experiment_functions - INFO - Early stopping at epoch 500. Best Recall: 0.0043
2026-05-16 07:32:31,747 - optuna.study.study - INFO - Trial 1 finished with value: 0.004328205701201518 and parameters: {'n_layers': 4, 'embedding_dim': 32, 'lr': 3.4957358154917064e-05, 'lambda_val': 3.4118781928455884e-05, 'batch_size': 3584, 'optimizer': 'SGD'}. Best is trial 1 with value: 0.004328205701201518.
2026-05-16 07:32:36,256 - experiment_functions - INFO - Early stopping at epoch 550. Best Recall: 0.0135
2026-05-16 07:32:36,359 - optuna.study.study - INFO - Trial 2 finished with value: 0.01354045479636152 and parameters: {'n_layers': 3, 'embedding_dim': 64, 'lr': 0.003154753362134212, 'lambda_val': 0.06047122134124385, 'batch_size': 3962, 'optimizer': 'Adam'}. Best is trial 2 with value: 0.01354045479636152.
2026-05-16 07:32:40,417 - experiment_functions - INFO - Early stopping at epoch 500. Best Recall: 0.0028
2026-05-16 07:32:40,520 - optuna.study.study - INFO - Trial 3 finished with value: 0.002828244128772194 and parameters: {'n_layers': 2, 'embedding_dim': 128, 'lr': 1.0469011257693715e-05, 'lambda_val': 0.02071672500041054, 'batch_size': 3237, 'optimizer': 'RMSprop'}. Best is trial 2 with value: 0.01354045479636152.
2026-05-16 07:32:45,944 - experiment_functions - INFO - Early stopping at epoch 600. Best Recall: 0.0018
2026-05-16 07:32:46,058 - optuna.study.study - INFO - Trial 4 finished with value: 0.0018066742433918267 and parameters: {'n_layers': 4, 'embedding_dim': 96, 'lr': 3.3172348000726706e-05, 'lambda_val': 0.09476266483844151, 'batch_size': 3745, 'optimizer': 'Adam'}. Best is trial 2 with value: 0.01354045479636152.
2026-05-16 07:32:56,616 - experiment_functions - INFO - Early stopping at epoch 850. Best Recall: 0.0548
2026-05-16 07:32:57,381 - optuna.study.study - INFO - Trial 5 finished with value: 0.054838187472921046 and parameters: {'n_layers': 3, 'embedding_dim': 96, 'lr': 0.0004648843421599468, 'lambda_val': 1.7086374438097978e-05, 'batch_size': 3166, 'optimizer': 'RMSprop'}. Best is trial 5 with value: 0.054838187472921046.
2026-05-16 07:33:07,537 - experiment_functions - INFO - Early stopping at epoch 500. Best Recall: 0.0019
2026-05-16 07:33:07,650 - optuna.study.study - INFO - Trial 6 finished with value: 0.001892075921765991 and parameters: {'n_layers': 3, 'embedding_dim': 64, 'lr': 1.2677022574730108e-05, 'lambda_val': 3.4058301726773833e-05, 'batch_size': 4003, 'optimizer': 'SGD'}. Best is trial 5 with value: 0.054838187472921046.
2026-05-16 07:33:12,532 - experiment_functions - INFO - Early stopping at epoch 500. Best Recall: 0.0024
2026-05-16 07:33:12,645 - optuna.study.study - INFO - Trial 7 finished with value: 0.0024038807253439175 and parameters: {'n_layers': 4, 'embedding_dim': 64, 'lr': 0.006088360819493956, 'lambda_val': 3.512934455885979e-05, 'batch_size': 2466, 'optimizer': 'SGD'}. Best is trial 5 with value: 0.054838187472921046.
2026-05-16 07:33:18,117 - experiment_functions - INFO - Early stopping at epoch 500. Best Recall: 0.0025
2026-05-16 07:33:18,209 - optuna.study.study - INFO - Trial 8 finished with value: 0.002450599756815599 and parameters: {'n_layers': 4, 'embedding_dim': 256, 'lr': 0.040708197109991545, 'lambda_val': 0.0003232754294414763, 'batch_size': 1751, 'optimizer': 'SGD'}. Best is trial 5 with value: 0.054838187472921046.
2026-05-16 07:33:21,891 - experiment_functions - INFO - Early stopping at epoch 500. Best Recall: 0.0023
2026-05-16 07:33:21,983 - optuna.study.study - INFO - Trial 9 finished with value: 0.002328675136436318 and parameters: {'n_layers': 1, 'embedding_dim': 32, 'lr': 0.021752436166010258, 'lambda_val': 0.0016368916388818694, 'batch_size': 3365, 'optimizer': 'SGD'}. Best is trial 5 with value: 0.054838187472921046.
2026-05-16 07:33:38,757 - experiment_functions - INFO - Early stopping at epoch 2100. Best Recall: 0.0833
2026-05-16 07:33:38,874 - optuna.study.study - INFO - Trial 10 finished with value: 0.08325136348712356 and parameters: {'n_layers': 2, 'embedding_dim': 96, 'lr': 0.00031304002688963044, 'lambda_val': 3.909120128165403e-06, 'batch_size': 525, 'optimizer': 'RMSprop'}. Best is trial 10 with value: 0.08325136348712356.
2026-05-16 07:33:46,264 - optuna.study._optimize - INFO - Trial 11 pruned. 
2026-05-16 07:34:00,449 - experiment_functions - INFO - Early stopping at epoch 2050. Best Recall: 0.0977
2026-05-16 07:34:00,556 - optuna.study.study - INFO - Trial 12 finished with value: 0.09767333065758095 and parameters: {'n_layers': 2, 'embedding_dim': 96, 'lr': 0.00028954993734076447, 'lambda_val': 1.1811936750662675e-06, 'batch_size': 940, 'optimizer': 'RMSprop'}. Best is trial 12 with value: 0.09767333065758095.
2026-05-16 07:34:07,531 - optuna.study._optimize - INFO - Trial 13 pruned. 
2026-05-16 07:34:12,216 - experiment_functions - INFO - Early stopping at epoch 600. Best Recall: 0.0557
2026-05-16 07:34:12,318 - optuna.study.study - INFO - Trial 14 finished with value: 0.055679392945971413 and parameters: {'n_layers': 2, 'embedding_dim': 96, 'lr': 0.0012875629491324917, 'lambda_val': 2.9553328458391597e-06, 'batch_size': 1288, 'optimizer': 'RMSprop'}. Best is trial 12 with value: 0.09767333065758095.
2026-05-16 07:34:19,588 - optuna.study._optimize - INFO - Trial 15 pruned. 
2026-05-16 07:34:24,200 - experiment_functions - INFO - Early stopping at epoch 650. Best Recall: 0.0643
2026-05-16 07:34:24,294 - optuna.study.study - INFO - Trial 16 finished with value: 0.06425561337398523 and parameters: {'n_layers': 2, 'embedding_dim': 96, 'lr': 0.0012479148871502963, 'lambda_val': 0.00027923998154901603, 'batch_size': 1668, 'optimizer': 'Adam'}. Best is trial 12 with value: 0.09767333065758095.
2026-05-16 07:34:34,212 - optuna.study._optimize - INFO - Trial 17 pruned. 
2026-05-16 07:34:43,409 - optuna.study._optimize - INFO - Trial 18 pruned. 
2026-05-16 07:34:49,896 - optuna.study._optimize - INFO - Trial 19 pruned. 
2026-05-16 07:34:59,625 - optuna.study._optimize - INFO - Trial 20 pruned. 
2026-05-16 07:35:11,570 - experiment_functions - INFO - Early stopping at epoch 800. Best Recall: 0.0658
2026-05-16 07:35:11,672 - optuna.study.study - INFO - Trial 21 finished with value: 0.0658007376005477 and parameters: {'n_layers': 2, 'embedding_dim': 96, 'lr': 0.0014335225471096922, 'lambda_val': 0.00018913598633183977, 'batch_size': 1649, 'optimizer': 'Adam'}. Best is trial 12 with value: 0.09767333065758095.
2026-05-16 07:35:15,839 - experiment_functions - INFO - Early stopping at epoch 600. Best Recall: 0.0521
2026-05-16 07:35:15,974 - optuna.study.study - INFO - Trial 22 finished with value: 0.052083382937580844 and parameters: {'n_layers': 2, 'embedding_dim': 96, 'lr': 0.002554114091498213, 'lambda_val': 1.0700145616033258e-06, 'batch_size': 1573, 'optimizer': 'Adam'}. Best is trial 12 with value: 0.09767333065758095.
2026-05-16 07:35:22,783 - optuna.study._optimize - INFO - Trial 23 pruned. 
2026-05-16 07:35:31,023 - experiment_functions - INFO - Early stopping at epoch 1500. Best Recall: 0.0978
2026-05-16 07:35:31,128 - optuna.study.study - INFO - Trial 24 finished with value: 0.09782595878325379 and parameters: {'n_layers': 1, 'embedding_dim': 96, 'lr': 0.0007551317508222684, 'lambda_val': 0.0009751834781438963, 'batch_size': 1449, 'optimizer': 'Adam'}. Best is trial 24 with value: 0.09782595878325379.
2026-05-16 07:35:43,796 - experiment_functions - INFO - Early stopping at epoch 2100. Best Recall: 0.1110
2026-05-16 07:35:43,912 - optuna.study.study - INFO - Trial 25 finished with value: 0.11096912571126988 and parameters: {'n_layers': 1, 'embedding_dim': 256, 'lr': 0.00040424869476193555, 'lambda_val': 0.0015100999391500682, 'batch_size': 958, 'optimizer': 'RMSprop'}. Best is trial 25 with value: 0.11096912571126988.
2026-05-16 07:35:54,482 - experiment_functions - INFO - Early stopping at epoch 1450. Best Recall: 0.1034
