2026-05-16 00:12:00,502 - optuna.study.study - INFO - Trial 113 finished with value: 0.10436477212419056 and parameters: {'n_layers': 1, 'embedding_dim': 128, 'lr': 0.0007307421978775606, 'lambda_val': 6.129928103417236e-05, 'batch_size': 1293, 'optimizer': 'Adam'}. Best is trial 107 with value: 0.126837902146722.
2026-05-16 00:12:11,807 - experiment_functions - INFO - Early stopping at epoch 1750. Best Recall: 0.1227
2026-05-16 00:12:11,895 - optuna.study.study - INFO - Trial 114 finished with value: 0.12269890337238394 and parameters: {'n_layers': 1, 'embedding_dim': 128, 'lr': 0.0006795727984947593, 'lambda_val': 2.317725866758834e-05, 'batch_size': 1580, 'optimizer': 'Adam'}. Best is trial 107 with value: 0.126837902146722.
2026-05-16 00:12:27,800 - experiment_functions - INFO - Early stopping at epoch 1300. Best Recall: 0.1161
2026-05-16 00:12:27,880 - optuna.study.study - INFO - Trial 115 finished with value: 0.11605727319807028 and parameters: {'n_layers': 1, 'embedding_dim': 128, 'lr': 0.0006572351609026154, 'lambda_val': 0.001610543307233803, 'batch_size': 1560, 'optimizer': 'Adam'}. Best is trial 107 with value: 0.126837902146722.
2026-05-16 00:12:34,600 - optuna.study._optimize - INFO - Trial 116 pruned. 
2026-05-16 00:12:40,775 - experiment_functions - INFO - Early stopping at epoch 950. Best Recall: 0.1166
2026-05-16 00:12:40,866 - optuna.study.study - INFO - Trial 117 finished with value: 0.11658960210793039 and parameters: {'n_layers': 1, 'embedding_dim': 128, 'lr': 0.0009855242533033303, 'lambda_val': 0.0017042221215066845, 'batch_size': 1866, 'optimizer': 'Adam'}. Best is trial 107 with value: 0.126837902146722.
2026-05-16 00:12:47,806 - experiment_functions - INFO - Early stopping at epoch 1200. Best Recall: 0.1145
2026-05-16 00:12:47,908 - optuna.study.study - INFO - Trial 118 finished with value: 0.1145189532261455 and parameters: {'n_layers': 1, 'embedding_dim': 128, 'lr': 0.000834618843261219, 'lambda_val': 0.0016512482363365665, 'batch_size': 1895, 'optimizer': 'Adam'}. Best is trial 107 with value: 0.126837902146722.
2026-05-16 00:12:54,529 - experiment_functions - INFO - Early stopping at epoch 1150. Best Recall: 0.1007
2026-05-16 00:12:54,619 - optuna.study.study - INFO - Trial 119 finished with value: 0.10065905862130908 and parameters: {'n_layers': 1, 'embedding_dim': 128, 'lr': 0.0006946760225547668, 'lambda_val': 0.0010242007774183505, 'batch_size': 1670, 'optimizer': 'Adam'}. Best is trial 107 with value: 0.126837902146722.
2026-05-16 00:13:01,001 - experiment_functions - INFO - Early stopping at epoch 1000. Best Recall: 0.1113
2026-05-16 00:13:01,102 - optuna.study.study - INFO - Trial 120 finished with value: 0.1113255368403035 and parameters: {'n_layers': 1, 'embedding_dim': 128, 'lr': 0.0009731856567229637, 'lambda_val': 1.7293184594222658e-05, 'batch_size': 1771, 'optimizer': 'Adam'}. Best is trial 107 with value: 0.126837902146722.
2026-05-16 00:13:08,044 - experiment_functions - INFO - Early stopping at epoch 1200. Best Recall: 0.1099
2026-05-16 00:13:08,134 - optuna.study.study - INFO - Trial 121 finished with value: 0.10990434531747947 and parameters: {'n_layers': 1, 'embedding_dim': 128, 'lr': 0.0008211042719901346, 'lambda_val': 0.0016315069485909862, 'batch_size': 1925, 'optimizer': 'Adam'}. Best is trial 107 with value: 0.126837902146722.
2026-05-16 00:13:16,152 - optuna.study._optimize - INFO - Trial 122 pruned. 
2026-05-16 00:13:22,028 - experiment_functions - INFO - Early stopping at epoch 950. Best Recall: 0.1073
2026-05-16 00:13:22,108 - optuna.study.study - INFO - Trial 123 finished with value: 0.10727109491687559 and parameters: {'n_layers': 1, 'embedding_dim': 128, 'lr': 0.0010525028180607568, 'lambda_val': 0.0014089392844812332, 'batch_size': 2010, 'optimizer': 'Adam'}. Best is trial 107 with value: 0.126837902146722.
2026-05-16 00:13:28,146 - optuna.study._optimize - INFO - Trial 124 pruned. 
2026-05-16 00:13:35,606 - experiment_functions - INFO - Early stopping at epoch 1250. Best Recall: 0.0991
2026-05-16 00:13:35,696 - optuna.study.study - INFO - Trial 125 finished with value: 0.09909105225587547 and parameters: {'n_layers': 1, 'embedding_dim': 128, 'lr': 0.0006930483420044719, 'lambda_val': 0.002739629816859233, 'batch_size': 2186, 'optimizer': 'Adam'}. Best is trial 107 with value: 0.126837902146722.
2026-05-16 00:13:41,783 - optuna.study._optimize - INFO - Trial 126 pruned. 
2026-05-16 00:13:50,135 - experiment_functions - INFO - Early stopping at epoch 1050. Best Recall: 0.1200
2026-05-16 00:13:50,288 - optuna.study.study - INFO - Trial 127 finished with value: 0.12002802527640448 and parameters: {'n_layers': 1, 'embedding_dim': 128, 'lr': 0.0011551821193424947, 'lambda_val': 0.0002688285552054688, 'batch_size': 1403, 'optimizer': 'Adam'}. Best is trial 107 with value: 0.126837902146722.
2026-05-16 00:13:57,718 - experiment_functions - INFO - Early stopping at epoch 1150. Best Recall: 0.1084
2026-05-16 00:13:57,819 - optuna.study.study - INFO - Trial 128 finished with value: 0.10842571803096074 and parameters: {'n_layers': 1, 'embedding_dim': 256, 'lr': 0.0010455586798066698, 'lambda_val': 0.0002686558506419358, 'batch_size': 1412, 'optimizer': 'Adam'}. Best is trial 107 with value: 0.126837902146722.
2026-05-16 00:14:09,382 - experiment_functions - INFO - Early stopping at epoch 2050. Best Recall: 0.1119
2026-05-16 00:14:09,481 - optuna.study.study - INFO - Trial 129 finished with value: 0.11185538665569475 and parameters: {'n_layers': 1, 'embedding_dim': 128, 'lr': 0.0005153996756681109, 'lambda_val': 0.00020137698451567224, 'batch_size': 1309, 'optimizer': 'Adam'}. Best is trial 107 with value: 0.126837902146722.
2026-05-16 00:14:27,055 - experiment_functions - INFO - Early stopping at epoch 3150. Best Recall: 0.1204
2026-05-16 00:14:27,132 - optuna.study.study - INFO - Trial 130 finished with value: 0.12044068717656309 and parameters: {'n_layers': 1, 'embedding_dim': 128, 'lr': 0.00039522383503476003, 'lambda_val': 8.624358146636172e-05, 'batch_size': 1228, 'optimizer': 'Adam'}. Best is trial 107 with value: 0.126837902146722.
2026-05-16 00:14:35,209 - experiment_functions - INFO - Early stopping at epoch 1450. Best Recall: 0.1061
2026-05-16 00:14:35,353 - optuna.study.study - INFO - Trial 131 finished with value: 0.10608031812679326 and parameters: {'n_layers': 1, 'embedding_dim': 128, 'lr': 0.0006316370240110851, 'lambda_val': 0.002045262288253137, 'batch_size': 1067, 'optimizer': 'Adam'}. Best is trial 107 with value: 0.126837902146722.
2026-05-16 00:14:42,039 - optuna.study._optimize - INFO - Trial 132 pruned. 
2026-05-16 00:14:48,725 - experiment_functions - INFO - Early stopping at epoch 1100. Best Recall: 0.1140
2026-05-16 00:14:48,834 - optuna.study.study - INFO - Trial 133 finished with value: 0.11401121307549168 and parameters: {'n_layers': 1, 'embedding_dim': 128, 'lr': 0.0011574936364767067, 'lambda_val': 9.787104882923983e-05, 'batch_size': 1516, 'optimizer': 'Adam'}. Best is trial 107 with value: 0.126837902146722.
2026-05-16 00:14:54,931 - optuna.study._optimize - INFO - Trial 134 pruned. 
2026-05-16 00:15:10,372 - experiment_functions - INFO - Early stopping at epoch 2750. Best Recall: 0.1151
2026-05-16 00:15:10,472 - optuna.study.study - INFO - Trial 135 finished with value: 0.11509320306718869 and parameters: {'n_layers': 1, 'embedding_dim': 128, 'lr': 0.0004499587973547577, 'lambda_val': 0.00019907063485809763, 'batch_size': 1235, 'optimizer': 'Adam'}. Best is trial 107 with value: 0.126837902146722.
2026-05-16 00:15:16,222 - experiment_functions - INFO - Early stopping at epoch 700. Best Recall: 0.0420
2026-05-16 00:15:16,363 - optuna.study.study - INFO - Trial 136 finished with value: 0.04198706629865047 and parameters: {'n_layers': 4, 'embedding_dim': 128, 'lr': 0.0008305509624166758, 'lambda_val': 0.0003269443474712109, 'batch_size': 1615, 'optimizer': 'Adam'}. Best is trial 107 with value: 0.126837902146722.
2026-05-16 00:15:20,412 - experiment_functions - INFO - Early stopping at epoch 500. Best Recall: 0.0013
2026-05-16 00:15:20,532 - optuna.study.study - INFO - Trial 137 finished with value: 0.0012511274776968646 and parameters: {'n_layers': 1, 'embedding_dim': 128, 'lr': 0.00018042485025309126, 'lambda_val': 5.297278319709716e-05, 'batch_size': 1439, 'optimizer': 'SGD'}. Best is trial 107 with value: 0.126837902146722.
2026-05-16 00:15:31,812 - optuna.study._optimize - INFO - Trial 138 pruned. 
2026-05-16 00:15:56,065 - optuna.study.study - INFO - Trial 139 finished with value: 0.12059623397465771 and parameters: {'n_layers': 1, 'embedding_dim': 128, 'lr': 0.0005311972118634453, 'lambda_val': 0.00012118987076757047, 'batch_size': 1082, 'optimizer': 'Adam'}. Best is trial 107 with value: 0.126837902146722.
2026-05-16 00:16:11,526 - experiment_functions - INFO - Early stopping at epoch 2200. Best Recall: 0.1195
2026-05-16 00:16:11,653 - optuna.study.study - INFO - Trial 140 finished with value: 0.1195108794386393 and parameters: {'n_layers': 1, 'embedding_dim': 128, 'lr': 0.0009277546225920824, 'lambda_val': 0.0002596455227104191, 'batch_size': 959, 'optimizer': 'Adam'}. Best is trial 107 with value: 0.126837902146722.
2026-05-16 00:16:23,246 - optuna.study._optimize - INFO - Trial 141 pruned. 
2026-05-16 00:16:31,731 - experiment_functions - INFO - Early stopping at epoch 1500. Best Recall: 0.1170
2026-05-16 00:16:31,821 - optuna.study.study - INFO - Trial 142 finished with value: 0.11702170129236536 and parameters: {'n_layers': 1, 'embedding_dim': 128, 'lr': 0.0007390691695583545, 'lambda_val': 0.0001238941057941331, 'batch_size': 991, 'optimizer': 'Adam'}. Best is trial 107 with value: 0.126837902146722.
2026-05-16 00:16:38,546 - experiment_functions - INFO - Early stopping at epoch 1100. Best Recall: 0.1041
2026-05-16 00:16:39,102 - optuna.study.study - INFO - Trial 143 finished with value: 0.10410730542742268 and parameters: {'n_layers': 1, 'embedding_dim': 128, 'lr': 0.0011385605071849475, 'lambda_val': 0.00012819870853273066, 'batch_size': 1117, 'optimizer': 'Adam'}. Best is trial 107 with value: 0.126837902146722.
2026-05-16 00:16:53,435 - experiment_functions - INFO - Early stopping at epoch 2350. Best Recall: 0.1196
2026-05-16 00:16:53,525 - optuna.study.study - INFO - Trial 144 finished with value: 0.11957630408095057 and parameters: {'n_layers': 1, 'embedding_dim': 128, 'lr': 0.0007978958462753191, 'lambda_val': 0.00018735457671103758, 'batch_size': 958, 'optimizer': 'Adam'}. Best is trial 107 with value: 0.126837902146722.
2026-05-16 00:17:05,295 - experiment_functions - INFO - Early stopping at epoch 1800. Best Recall: 0.1137
2026-05-16 00:17:05,429 - optuna.study.study - INFO - Trial 145 finished with value: 0.11371043754074815 and parameters: {'n_layers': 1, 'embedding_dim': 128, 'lr': 0.0008793206948762997, 'lambda_val': 0.000296266978933704, 'batch_size': 930, 'optimizer': 'Adam'}. Best is trial 107 with value: 0.126837902146722.
2026-05-16 00:17:19,840 - experiment_functions - INFO - Early stopping at epoch 2350. Best Recall: 0.1169
2026-05-16 00:17:19,920 - optuna.study.study - INFO - Trial 146 finished with value: 0.11687334983434777 and parameters: {'n_layers': 1, 'embedding_dim': 128, 'lr': 0.0004771414965055458, 'lambda_val': 0.00018987404010211876, 'batch_size': 939, 'optimizer': 'Adam'}. Best is trial 107 with value: 0.126837902146722.
2026-05-16 00:17:32,094 - optuna.study._optimize - INFO - Trial 147 pruned. 
2026-05-16 00:17:47,877 - experiment_functions - INFO - Early stopping at epoch 2100. Best Recall: 0.1202
2026-05-16 00:17:47,977 - optuna.study.study - INFO - Trial 148 finished with value: 0.12020086637745872 and parameters: {'n_layers': 1, 'embedding_dim': 128, 'lr': 0.0004979636213237664, 'lambda_val': 0.00021117622612523847, 'batch_size': 928, 'optimizer': 'Adam'}. Best is trial 107 with value: 0.126837902146722.
2026-05-16 00:17:54,868 - optuna.study._optimize - INFO - Trial 149 pruned. 
2026-05-16 00:18:27,567 - optuna.study.study - INFO - Trial 150 finished with value: 0.12059021757400944 and parameters: {'n_layers': 1, 'embedding_dim': 128, 'lr': 0.0005033208534959839, 'lambda_val': 0.00014678175496963161, 'batch_size': 737, 'optimizer': 'Adam'}. Best is trial 107 with value: 0.126837902146722.
2026-05-16 00:18:34,139 - optuna.study._optimize - INFO - Trial 151 pruned. 
2026-05-16 00:18:44,957 - optuna.study._optimize - INFO - Trial 152 pruned. 
2026-05-16 00:18:51,908 - optuna.study._optimize - INFO - Trial 153 pruned. 
2026-05-16 00:19:05,861 - experiment_functions - INFO - Early stopping at epoch 2100. Best Recall: 0.1156
2026-05-16 00:19:05,948 - optuna.study.study - INFO - Trial 154 finished with value: 0.11556036836862783 and parameters: {'n_layers': 1, 'embedding_dim': 256, 'lr': 0.00041678761587678583, 'lambda_val': 0.00020255420232898012, 'batch_size': 1057, 'optimizer': 'Adam'}. Best is trial 107 with value: 0.126837902146722.
2026-05-16 00:19:12,537 - optuna.study._optimize - INFO - Trial 155 pruned. 
2026-05-16 00:19:26,497 - experiment_functions - INFO - Early stopping at epoch 2150. Best Recall: 0.1293
2026-05-16 00:19:26,596 - optuna.study.study - INFO - Trial 156 finished with value: 0.12928933385838873 and parameters: {'n_layers': 1, 'embedding_dim': 128, 'lr': 0.0007698098539240115, 'lambda_val': 0.0001659421953950244, 'batch_size': 716, 'optimizer': 'Adam'}. Best is trial 156 with value: 0.12928933385838873.
2026-05-16 00:19:44,645 - experiment_functions - INFO - Early stopping at epoch 2950. Best Recall: 0.1195
2026-05-16 00:19:44,735 - optuna.study.study - INFO - Trial 157 finished with value: 0.11945928642472026 and parameters: {'n_layers': 1, 'embedding_dim': 128, 'lr': 0.0007351844698705044, 'lambda_val': 0.00026289375091695713, 'batch_size': 755, 'optimizer': 'Adam'}. Best is trial 156 with value: 0.12928933385838873.
2026-05-16 00:20:02,282 - experiment_functions - INFO - Early stopping at epoch 2300. Best Recall: 0.1169
2026-05-16 00:20:02,379 - optuna.study.study - INFO - Trial 158 finished with value: 0.1169289580717988 and parameters: {'n_layers': 1, 'embedding_dim': 128, 'lr': 0.0007729155083253422, 'lambda_val': 0.00028004351528876197, 'batch_size': 756, 'optimizer': 'Adam'}. Best is trial 156 with value: 0.12928933385838873.
2026-05-16 00:20:06,132 - experiment_functions - INFO - Early stopping at epoch 500. Best Recall: 0.0031
2026-05-16 00:20:06,230 - optuna.study.study - INFO - Trial 159 finished with value: 0.0031228958376410963 and parameters: {'n_layers': 1, 'embedding_dim': 96, 'lr': 0.0005757318119063298, 'lambda_val': 0.0004145429203092819, 'batch_size': 665, 'optimizer': 'SGD'}. Best is trial 156 with value: 0.12928933385838873.
2026-05-16 00:20:10,414 - experiment_functions - INFO - Early stopping at epoch 550. Best Recall: 0.0012
2026-05-16 00:20:10,981 - optuna.study.study - INFO - Trial 160 finished with value: 0.0012151960711336833 and parameters: {'n_layers': 1, 'embedding_dim': 128, 'lr': 0.00025562255756799785, 'lambda_val': 0.09031245581510257, 'batch_size': 730, 'optimizer': 'Adam'}. Best is trial 156 with value: 0.12928933385838873.
2026-05-16 00:20:24,599 - experiment_functions - INFO - Early stopping at epoch 2300. Best Recall: 0.1200
2026-05-16 00:20:24,697 - optuna.study.study - INFO - Trial 161 finished with value: 0.12002532016721285 and parameters: {'n_layers': 1, 'embedding_dim': 128, 'lr': 0.0006934131828460086, 'lambda_val': 0.00014084339201223588, 'batch_size': 874, 'optimizer': 'Adam'}. Best is trial 156 with value: 0.12928933385838873.
2026-05-16 00:20:32,909 - experiment_functions - INFO - Early stopping at epoch 1100. Best Recall: 0.1147
2026-05-16 00:20:33,009 - optuna.study.study - INFO - Trial 162 finished with value: 0.11471298515478555 and parameters: {'n_layers': 1, 'embedding_dim': 128, 'lr': 0.0012280432195741452, 'lambda_val': 0.00015511663099078651, 'batch_size': 871, 'optimizer': 'Adam'}. Best is trial 156 with value: 0.12928933385838873.
2026-05-16 00:20:42,129 - optuna.study._optimize - INFO - Trial 163 pruned. 
2026-05-16 00:20:52,622 - experiment_functions - INFO - Early stopping at epoch 1600. Best Recall: 0.1234
2026-05-16 00:20:52,721 - optuna.study.study - INFO - Trial 164 finished with value: 0.12340353594598619 and parameters: {'n_layers': 1, 'embedding_dim': 128, 'lr': 0.000883601678076962, 'lambda_val': 0.0003534883071627399, 'batch_size': 818, 'optimizer': 'Adam'}. Best is trial 156 with value: 0.12928933385838873.
2026-05-16 00:20:59,376 - optuna.study._optimize - INFO - Trial 165 pruned. 
2026-05-16 00:21:14,194 - experiment_functions - INFO - Early stopping at epoch 2400. Best Recall: 0.1209
2026-05-16 00:21:14,328 - optuna.study.study - INFO - Trial 166 finished with value: 0.12091274691591263 and parameters: {'n_layers': 1, 'embedding_dim': 128, 'lr': 0.0009244899186674243, 'lambda_val': 9.617367820345199e-05, 'batch_size': 589, 'optimizer': 'Adam'}. Best is trial 156 with value: 0.12928933385838873.
2026-05-16 00:21:27,249 - experiment_functions - INFO - Early stopping at epoch 1950. Best Recall: 0.1306
2026-05-16 00:21:27,354 - optuna.study.study - INFO - Trial 167 finished with value: 0.1306017749594772 and parameters: {'n_layers': 1, 'embedding_dim': 128, 'lr': 0.0009080228431673363, 'lambda_val': 6.379737425062044e-05, 'batch_size': 544, 'optimizer': 'Adam'}. Best is trial 167 with value: 0.1306017749594772.
2026-05-16 00:21:38,669 - optuna.study._optimize - INFO - Trial 168 pruned. 
2026-05-16 00:21:45,466 - experiment_functions - INFO - Early stopping at epoch 1000. Best Recall: 0.1055
2026-05-16 00:21:45,635 - optuna.study.study - INFO - Trial 169 finished with value: 0.1054751398615335 and parameters: {'n_layers': 1, 'embedding_dim': 128, 'lr': 0.0011099426307009201, 'lambda_val': 9.521154245876957e-05, 'batch_size': 631, 'optimizer': 'Adam'}. Best is trial 167 with value: 0.1306017749594772.
2026-05-16 00:21:53,262 - optuna.study._optimize - INFO - Trial 170 pruned. 
2026-05-16 00:22:15,441 - experiment_functions - INFO - Early stopping at epoch 2300. Best Recall: 0.1171
2026-05-16 00:22:15,544 - optuna.study.study - INFO - Trial 171 finished with value: 0.11705180237621515 and parameters: {'n_layers': 1, 'embedding_dim': 128, 'lr': 0.0008125617976394402, 'lambda_val': 0.00013398240192383912, 'batch_size': 588, 'optimizer': 'Adam'}. Best is trial 167 with value: 0.1306017749594772.
2026-05-16 00:22:25,176 - experiment_functions - INFO - Early stopping at epoch 1800. Best Recall: 0.1207
2026-05-16 00:22:25,265 - optuna.study.study - INFO - Trial 172 finished with value: 0.1206678480764582 and parameters: {'n_layers': 1, 'embedding_dim': 128, 'lr': 0.0006702792932989511, 'lambda_val': 0.00015511775294667197, 'batch_size': 569, 'optimizer': 'Adam'}. Best is trial 167 with value: 0.1306017749594772.
2026-05-16 00:22:31,567 - optuna.study._optimize - INFO - Trial 173 pruned. 
2026-05-16 00:22:37,554 - optuna.study._optimize - INFO - Trial 174 pruned. 
2026-05-16 00:22:59,150 - optuna.study.study - INFO - Trial 175 finished with value: 0.12562543674770818 and parameters: {'n_layers': 1, 'embedding_dim': 128, 'lr': 0.0006899156590795435, 'lambda_val': 0.00010305650091665712, 'batch_size': 522, 'optimizer': 'Adam'}. Best is trial 167 with value: 0.1306017749594772.
2026-05-16 00:23:16,592 - experiment_functions - INFO - Early stopping at epoch 1450. Best Recall: 0.1167
2026-05-16 00:23:16,691 - optuna.study.study - INFO - Trial 176 finished with value: 0.11672868260883172 and parameters: {'n_layers': 1, 'embedding_dim': 128, 'lr': 0.0011718581871811816, 'lambda_val': 0.00010763838324502144, 'batch_size': 528, 'optimizer': 'Adam'}. Best is trial 167 with value: 0.1306017749594772.
2026-05-16 00:23:24,553 - optuna.study._optimize - INFO - Trial 177 pruned. 
2026-05-16 00:23:31,200 - optuna.study._optimize - INFO - Trial 178 pruned. 
2026-05-16 00:23:39,327 - experiment_functions - INFO - Early stopping at epoch 1400. Best Recall: 0.1186
2026-05-16 00:23:39,436 - optuna.study.study - INFO - Trial 179 finished with value: 0.1185792227788427 and parameters: {'n_layers': 1, 'embedding_dim': 128, 'lr': 0.0009195679257767245, 'lambda_val': 7.624830814373621e-05, 'batch_size': 847, 'optimizer': 'Adam'}. Best is trial 167 with value: 0.1306017749594772.
2026-05-16 00:23:45,731 - optuna.study._optimize - INFO - Trial 180 pruned. 
2026-05-16 00:23:56,649 - experiment_functions - INFO - Early stopping at epoch 1800. Best Recall: 0.1310
2026-05-16 00:23:56,742 - optuna.study.study - INFO - Trial 181 finished with value: 0.130958975742103 and parameters: {'n_layers': 1, 'embedding_dim': 128, 'lr': 0.0007596322166470337, 'lambda_val': 0.00015810351629340613, 'batch_size': 782, 'optimizer': 'Adam'}. Best is trial 181 with value: 0.130958975742103.
2026-05-16 00:24:13,728 - experiment_functions - INFO - Early stopping at epoch 1650. Best Recall: 0.1200
2026-05-16 00:24:13,819 - optuna.study.study - INFO - Trial 182 finished with value: 0.11995356745881325 and parameters: {'n_layers': 1, 'embedding_dim': 128, 'lr': 0.001001443657549053, 'lambda_val': 0.00015282913399128698, 'batch_size': 788, 'optimizer': 'Adam'}. Best is trial 181 with value: 0.130958975742103.
2026-05-16 00:24:27,645 - experiment_functions - INFO - Early stopping at epoch 2350. Best Recall: 0.1230
2026-05-16 00:24:27,753 - optuna.study.study - INFO - Trial 183 finished with value: 0.12300850633206127 and parameters: {'n_layers': 1, 'embedding_dim': 128, 'lr': 0.0007067731710164618, 'lambda_val': 0.0001293641089677522, 'batch_size': 773, 'optimizer': 'Adam'}. Best is trial 181 with value: 0.130958975742103.
2026-05-16 00:24:36,417 - experiment_functions - INFO - Early stopping at epoch 1050. Best Recall: 0.1096
