2026-05-16 08:51:12,288 - optuna.study._optimize - INFO - Trial 234 pruned. 
2026-05-16 08:51:17,072 - experiment_functions - INFO - Early stopping at epoch 600. Best Recall: 0.1040
2026-05-16 08:51:17,163 - optuna.study.study - INFO - Trial 235 finished with value: 0.10398476121739887 and parameters: {'n_layers': 1, 'embedding_dim': 256, 'lr': 0.0034719485300407525, 'lambda_val': 8.89163585976417e-06, 'batch_size': 2789, 'optimizer': 'Adam'}. Best is trial 216 with value: 0.13105332615342377.
2026-05-16 08:51:23,890 - optuna.study._optimize - INFO - Trial 236 pruned. 
2026-05-16 08:51:30,559 - optuna.study._optimize - INFO - Trial 237 pruned. 
2026-05-16 08:51:34,437 - experiment_functions - INFO - Early stopping at epoch 500. Best Recall: 0.0030
2026-05-16 08:51:35,026 - optuna.study.study - INFO - Trial 238 finished with value: 0.002969061524374276 and parameters: {'n_layers': 1, 'embedding_dim': 256, 'lr': 0.0007657806698662627, 'lambda_val': 2.408939945859013e-05, 'batch_size': 3089, 'optimizer': 'SGD'}. Best is trial 216 with value: 0.13105332615342377.
2026-05-16 08:51:44,365 - optuna.study._optimize - INFO - Trial 239 pruned. 
2026-05-16 08:51:51,188 - optuna.study._optimize - INFO - Trial 240 pruned. 
2026-05-16 08:51:58,452 - experiment_functions - INFO - Early stopping at epoch 1050. Best Recall: 0.1269
2026-05-16 08:51:58,544 - optuna.study.study - INFO - Trial 241 finished with value: 0.12691741778645046 and parameters: {'n_layers': 1, 'embedding_dim': 256, 'lr': 0.000652555460952329, 'lambda_val': 2.343337788432611e-06, 'batch_size': 3797, 'optimizer': 'Adam'}. Best is trial 216 with value: 0.13105332615342377.
2026-05-16 08:52:04,432 - experiment_functions - INFO - Early stopping at epoch 800. Best Recall: 0.1115
2026-05-16 08:52:04,535 - optuna.study.study - INFO - Trial 242 finished with value: 0.11149349321809329 and parameters: {'n_layers': 1, 'embedding_dim': 256, 'lr': 0.001003704182470025, 'lambda_val': 2.3050197634774146e-06, 'batch_size': 3778, 'optimizer': 'Adam'}. Best is trial 216 with value: 0.13105332615342377.
2026-05-16 08:52:11,784 - optuna.study._optimize - INFO - Trial 243 pruned. 
2026-05-16 08:52:18,805 - experiment_functions - INFO - Early stopping at epoch 900. Best Recall: 0.1129
2026-05-16 08:52:18,918 - optuna.study.study - INFO - Trial 244 finished with value: 0.11289404334573869 and parameters: {'n_layers': 1, 'embedding_dim': 256, 'lr': 0.000830847453722815, 'lambda_val': 1.7037296850913388e-05, 'batch_size': 3696, 'optimizer': 'Adam'}. Best is trial 216 with value: 0.13105332615342377.
2026-05-16 08:52:25,091 - experiment_functions - INFO - Early stopping at epoch 550. Best Recall: 0.0306
2026-05-16 08:52:25,182 - optuna.study.study - INFO - Trial 245 finished with value: 0.03062024555297972 and parameters: {'n_layers': 1, 'embedding_dim': 256, 'lr': 0.04769357353708259, 'lambda_val': 2.8717791694333902e-06, 'batch_size': 3789, 'optimizer': 'Adam'}. Best is trial 216 with value: 0.13105332615342377.
2026-05-16 08:52:33,871 - experiment_functions - INFO - Early stopping at epoch 1350. Best Recall: 0.1250
2026-05-16 08:52:33,973 - optuna.study.study - INFO - Trial 246 finished with value: 0.12496722091985506 and parameters: {'n_layers': 1, 'embedding_dim': 256, 'lr': 0.0005436396818921111, 'lambda_val': 1.2045608457047127e-05, 'batch_size': 2611, 'optimizer': 'Adam'}. Best is trial 216 with value: 0.13105332615342377.
2026-05-16 08:52:46,622 - experiment_functions - INFO - Early stopping at epoch 1850. Best Recall: 0.1287
2026-05-16 08:52:46,723 - optuna.study.study - INFO - Trial 247 finished with value: 0.12870081250455184 and parameters: {'n_layers': 1, 'embedding_dim': 256, 'lr': 0.0003770649670947698, 'lambda_val': 3.3461549393001156e-06, 'batch_size': 2591, 'optimizer': 'Adam'}. Best is trial 216 with value: 0.13105332615342377.
2026-05-16 08:52:55,851 - experiment_functions - INFO - Early stopping at epoch 900. Best Recall: 0.0357
2026-05-16 08:52:55,963 - optuna.study.study - INFO - Trial 248 finished with value: 0.03569457937978944 and parameters: {'n_layers': 4, 'embedding_dim': 256, 'lr': 0.000388172313025127, 'lambda_val': 1.1801353967860202e-05, 'batch_size': 2587, 'optimizer': 'Adam'}. Best is trial 216 with value: 0.13105332615342377.
2026-05-16 08:53:04,283 - optuna.study._optimize - INFO - Trial 249 pruned. 
2026-05-16 08:53:10,244 - optuna.study._optimize - INFO - Trial 250 pruned. 
2026-05-16 08:53:16,389 - experiment_functions - INFO - Early stopping at epoch 1000. Best Recall: 0.1116
2026-05-16 08:53:16,492 - optuna.study.study - INFO - Trial 251 finished with value: 0.11162834982588174 and parameters: {'n_layers': 1, 'embedding_dim': 64, 'lr': 0.0011675551857199603, 'lambda_val': 2.3253122907494487e-05, 'batch_size': 2447, 'optimizer': 'Adam'}. Best is trial 216 with value: 0.13105332615342377.
2026-05-16 08:53:25,279 - experiment_functions - INFO - Early stopping at epoch 1200. Best Recall: 0.1207
2026-05-16 08:53:25,391 - optuna.study.study - INFO - Trial 252 finished with value: 0.12071161632055293 and parameters: {'n_layers': 1, 'embedding_dim': 256, 'lr': 0.000707076433313382, 'lambda_val': 5.791116237204111e-06, 'batch_size': 2707, 'optimizer': 'Adam'}. Best is trial 216 with value: 0.13105332615342377.
2026-05-16 08:53:33,614 - optuna.study._optimize - INFO - Trial 253 pruned. 
2026-05-16 08:53:40,255 - optuna.study._optimize - INFO - Trial 254 pruned. 
2026-05-16 08:53:48,406 - experiment_functions - INFO - Early stopping at epoch 1000. Best Recall: 0.1208
2026-05-16 08:53:48,508 - optuna.study.study - INFO - Trial 255 finished with value: 0.12076176824915247 and parameters: {'n_layers': 1, 'embedding_dim': 256, 'lr': 0.0008587032221839714, 'lambda_val': 1.9636794614993996e-05, 'batch_size': 2630, 'optimizer': 'Adam'}. Best is trial 216 with value: 0.13105332615342377.
2026-05-16 08:53:55,509 - optuna.study._optimize - INFO - Trial 256 pruned. 
2026-05-16 08:54:03,272 - optuna.study._optimize - INFO - Trial 257 pruned. 
2026-05-16 08:54:10,405 - optuna.study._optimize - INFO - Trial 258 pruned. 
2026-05-16 08:54:17,704 - experiment_functions - INFO - Early stopping at epoch 1100. Best Recall: 0.1183
2026-05-16 08:54:17,796 - optuna.study.study - INFO - Trial 259 finished with value: 0.11828853124114992 and parameters: {'n_layers': 1, 'embedding_dim': 256, 'lr': 0.0005496503852246151, 'lambda_val': 9.028119744980894e-06, 'batch_size': 2673, 'optimizer': 'Adam'}. Best is trial 216 with value: 0.13105332615342377.
2026-05-16 08:54:25,428 - experiment_functions - INFO - Early stopping at epoch 1050. Best Recall: 0.1139
2026-05-16 08:54:25,540 - optuna.study.study - INFO - Trial 260 finished with value: 0.11385762637297638 and parameters: {'n_layers': 1, 'embedding_dim': 256, 'lr': 0.0006665846710943462, 'lambda_val': 3.2952259769768437e-06, 'batch_size': 2946, 'optimizer': 'RMSprop'}. Best is trial 216 with value: 0.13105332615342377.
2026-05-16 08:54:32,222 - optuna.study._optimize - INFO - Trial 261 pruned. 
2026-05-16 08:54:42,178 - experiment_functions - INFO - Early stopping at epoch 1200. Best Recall: 0.1284
2026-05-16 08:54:42,281 - optuna.study.study - INFO - Trial 262 finished with value: 0.12844364647516962 and parameters: {'n_layers': 1, 'embedding_dim': 256, 'lr': 0.0007505326823703777, 'lambda_val': 1.6371943837791332e-05, 'batch_size': 2837, 'optimizer': 'Adam'}. Best is trial 216 with value: 0.13105332615342377.
2026-05-16 08:54:48,101 - experiment_functions - INFO - Early stopping at epoch 850. Best Recall: 0.1030
2026-05-16 08:54:48,204 - optuna.study.study - INFO - Trial 263 finished with value: 0.10302259297341455 and parameters: {'n_layers': 1, 'embedding_dim': 256, 'lr': 0.001043604510011426, 'lambda_val': 1.6530968954169456e-05, 'batch_size': 2715, 'optimizer': 'Adam'}. Best is trial 216 with value: 0.13105332615342377.
2026-05-16 08:54:54,880 - experiment_functions - INFO - Early stopping at epoch 950. Best Recall: 0.1178
2026-05-16 08:54:54,993 - optuna.study.study - INFO - Trial 264 finished with value: 0.11784145262654727 and parameters: {'n_layers': 1, 'embedding_dim': 256, 'lr': 0.000769070731842105, 'lambda_val': 2.1944658757419967e-05, 'batch_size': 2878, 'optimizer': 'Adam'}. Best is trial 216 with value: 0.13105332615342377.
2026-05-16 08:54:59,061 - experiment_functions - INFO - Early stopping at epoch 500. Best Recall: 0.0018
2026-05-16 08:54:59,163 - optuna.study.study - INFO - Trial 265 finished with value: 0.0017539199583436913 and parameters: {'n_layers': 1, 'embedding_dim': 256, 'lr': 0.0009976172938380727, 'lambda_val': 1.335431362655904e-05, 'batch_size': 3991, 'optimizer': 'SGD'}. Best is trial 216 with value: 0.13105332615342377.
2026-05-16 08:55:07,363 - experiment_functions - INFO - Early stopping at epoch 1100. Best Recall: 0.1154
2026-05-16 08:55:07,476 - optuna.study.study - INFO - Trial 266 finished with value: 0.11542939101221732 and parameters: {'n_layers': 1, 'embedding_dim': 256, 'lr': 0.0008628206742975866, 'lambda_val': 2.7050566988315507e-05, 'batch_size': 2520, 'optimizer': 'Adam'}. Best is trial 216 with value: 0.13105332615342377.
2026-05-16 08:55:13,870 - optuna.study._optimize - INFO - Trial 267 pruned. 
2026-05-16 08:55:19,854 - experiment_functions - INFO - Early stopping at epoch 800. Best Recall: 0.1106
2026-05-16 08:55:19,957 - optuna.study.study - INFO - Trial 268 finished with value: 0.1106059706603297 and parameters: {'n_layers': 1, 'embedding_dim': 256, 'lr': 0.0013115265244401017, 'lambda_val': 2.360860352843141e-06, 'batch_size': 2409, 'optimizer': 'Adam'}. Best is trial 216 with value: 0.13105332615342377.
2026-05-16 08:55:27,444 - experiment_functions - INFO - Early stopping at epoch 1100. Best Recall: 0.1169
2026-05-16 08:55:27,536 - optuna.study.study - INFO - Trial 269 finished with value: 0.11688504744829814 and parameters: {'n_layers': 1, 'embedding_dim': 256, 'lr': 0.0006503622620120598, 'lambda_val': 1.3518012408012636e-05, 'batch_size': 2598, 'optimizer': 'Adam'}. Best is trial 216 with value: 0.13105332615342377.
2026-05-16 08:55:36,336 - optuna.study._optimize - INFO - Trial 270 pruned. 
2026-05-16 08:55:42,889 - optuna.study._optimize - INFO - Trial 271 pruned. 
2026-05-16 08:55:49,585 - optuna.study._optimize - INFO - Trial 272 pruned. 
2026-05-16 08:55:58,290 - experiment_functions - INFO - Early stopping at epoch 1050. Best Recall: 0.1230
2026-05-16 08:55:58,393 - optuna.study.study - INFO - Trial 273 finished with value: 0.12297965927406977 and parameters: {'n_layers': 1, 'embedding_dim': 256, 'lr': 0.0006997447800876469, 'lambda_val': 1.3860499798209004e-06, 'batch_size': 3921, 'optimizer': 'Adam'}. Best is trial 216 with value: 0.13105332615342377.
2026-05-16 08:56:02,670 - experiment_functions - INFO - Early stopping at epoch 550. Best Recall: 0.0753
2026-05-16 08:56:02,807 - optuna.study.study - INFO - Trial 274 finished with value: 0.07532636433654676 and parameters: {'n_layers': 1, 'embedding_dim': 256, 'lr': 0.01048057607660527, 'lambda_val': 1.5719818053945913e-06, 'batch_size': 3975, 'optimizer': 'Adam'}. Best is trial 216 with value: 0.13105332615342377.
2026-05-16 08:56:08,826 - experiment_functions - INFO - Early stopping at epoch 800. Best Recall: 0.0381
2026-05-16 08:56:08,919 - optuna.study.study - INFO - Trial 275 finished with value: 0.038053377412931695 and parameters: {'n_layers': 3, 'embedding_dim': 128, 'lr': 0.0006955405556522298, 'lambda_val': 1.294947646912672e-06, 'batch_size': 3867, 'optimizer': 'Adam'}. Best is trial 216 with value: 0.13105332615342377.
2026-05-16 08:56:20,896 - optuna.study._optimize - INFO - Trial 276 pruned. 
2026-05-16 08:56:33,250 - optuna.study._optimize - INFO - Trial 277 pruned. 
2026-05-16 08:56:42,600 - experiment_functions - INFO - Early stopping at epoch 950. Best Recall: 0.1145
2026-05-16 08:56:42,693 - optuna.study.study - INFO - Trial 278 finished with value: 0.11452194342544705 and parameters: {'n_layers': 1, 'embedding_dim': 256, 'lr': 0.0007393121857833598, 'lambda_val': 2.5072086171299252e-06, 'batch_size': 4021, 'optimizer': 'Adam'}. Best is trial 216 with value: 0.13105332615342377.
2026-05-16 08:56:48,977 - optuna.study._optimize - INFO - Trial 279 pruned. 
2026-05-16 08:56:53,545 - experiment_functions - INFO - Early stopping at epoch 650. Best Recall: 0.1094
2026-05-16 08:56:53,638 - optuna.study.study - INFO - Trial 280 finished with value: 0.109400493660026 and parameters: {'n_layers': 1, 'embedding_dim': 256, 'lr': 0.0025441669591636643, 'lambda_val': 1.03261997556602e-05, 'batch_size': 2736, 'optimizer': 'Adam'}. Best is trial 216 with value: 0.13105332615342377.
2026-05-16 08:57:02,248 - experiment_functions - INFO - Early stopping at epoch 1250. Best Recall: 0.1186
2026-05-16 08:57:02,586 - optuna.study.study - INFO - Trial 281 finished with value: 0.11860917401080072 and parameters: {'n_layers': 1, 'embedding_dim': 256, 'lr': 0.0005384670747454914, 'lambda_val': 1.0131294786531125e-06, 'batch_size': 3831, 'optimizer': 'Adam'}. Best is trial 216 with value: 0.13105332615342377.
2026-05-16 08:57:08,025 - experiment_functions - INFO - Early stopping at epoch 700. Best Recall: 0.1034
2026-05-16 08:57:08,216 - optuna.study.study - INFO - Trial 282 finished with value: 0.10335711810817186 and parameters: {'n_layers': 1, 'embedding_dim': 256, 'lr': 0.0011232691146293035, 'lambda_val': 8.567933444459556e-06, 'batch_size': 2476, 'optimizer': 'RMSprop'}. Best is trial 216 with value: 0.13105332615342377.
2026-05-16 08:57:15,324 - optuna.study._optimize - INFO - Trial 283 pruned. 
2026-05-16 08:57:28,827 - experiment_functions - INFO - Early stopping at epoch 1050. Best Recall: 0.1265
2026-05-16 08:57:28,919 - optuna.study.study - INFO - Trial 284 finished with value: 0.12647124009997493 and parameters: {'n_layers': 1, 'embedding_dim': 256, 'lr': 0.0008530244337945287, 'lambda_val': 1.5684836265431088e-06, 'batch_size': 2548, 'optimizer': 'Adam'}. Best is trial 216 with value: 0.13105332615342377.
2026-05-16 08:57:37,472 - optuna.study._optimize - INFO - Trial 285 pruned. 
2026-05-16 08:57:44,606 - experiment_functions - INFO - Early stopping at epoch 950. Best Recall: 0.1199
2026-05-16 08:57:44,720 - optuna.study.study - INFO - Trial 286 finished with value: 0.11993342463923189 and parameters: {'n_layers': 1, 'embedding_dim': 256, 'lr': 0.000991473883668964, 'lambda_val': 1.941227800234641e-06, 'batch_size': 2313, 'optimizer': 'Adam'}. Best is trial 216 with value: 0.13105332615342377.
2026-05-16 08:57:52,875 - experiment_functions - INFO - Early stopping at epoch 1100. Best Recall: 0.1181
2026-05-16 08:57:52,987 - optuna.study.study - INFO - Trial 287 finished with value: 0.11810434529635135 and parameters: {'n_layers': 1, 'embedding_dim': 256, 'lr': 0.000844532326674931, 'lambda_val': 2.5379825269469308e-06, 'batch_size': 2657, 'optimizer': 'Adam'}. Best is trial 216 with value: 0.13105332615342377.
2026-05-16 08:57:56,758 - experiment_functions - INFO - Early stopping at epoch 500. Best Recall: 0.0027
2026-05-16 08:57:56,852 - optuna.study.study - INFO - Trial 288 finished with value: 0.0027438608052875557 and parameters: {'n_layers': 1, 'embedding_dim': 256, 'lr': 0.0014500058586822797, 'lambda_val': 4.129129855711162e-06, 'batch_size': 2590, 'optimizer': 'SGD'}. Best is trial 216 with value: 0.13105332615342377.
2026-05-16 08:58:03,467 - experiment_functions - INFO - Early stopping at epoch 950. Best Recall: 0.1121
2026-05-16 08:58:03,560 - optuna.study.study - INFO - Trial 289 finished with value: 0.11214849798209045 and parameters: {'n_layers': 1, 'embedding_dim': 256, 'lr': 0.0011496684432615758, 'lambda_val': 1.2704187897703252e-06, 'batch_size': 2397, 'optimizer': 'Adam'}. Best is trial 216 with value: 0.13105332615342377.
2026-05-16 08:58:18,460 - experiment_functions - INFO - Early stopping at epoch 2300. Best Recall: 0.1289
2026-05-16 08:58:18,552 - optuna.study.study - INFO - Trial 290 finished with value: 0.12893706516729572 and parameters: {'n_layers': 1, 'embedding_dim': 256, 'lr': 0.00039314765476051625, 'lambda_val': 1.4993620871890065e-06, 'batch_size': 2582, 'optimizer': 'Adam'}. Best is trial 216 with value: 0.13105332615342377.
2026-05-16 08:58:27,696 - optuna.study._optimize - INFO - Trial 291 pruned. 
2026-05-16 08:58:36,244 - optuna.study._optimize - INFO - Trial 292 pruned. 
2026-05-16 08:58:49,065 - experiment_functions - INFO - Early stopping at epoch 1900. Best Recall: 0.1248
2026-05-16 08:58:49,188 - optuna.study.study - INFO - Trial 293 finished with value: 0.12481436170249488 and parameters: {'n_layers': 1, 'embedding_dim': 256, 'lr': 0.0004924948648255576, 'lambda_val': 1.7489163536572406e-06, 'batch_size': 2730, 'optimizer': 'Adam'}. Best is trial 216 with value: 0.13105332615342377.
2026-05-16 08:58:58,272 - optuna.study._optimize - INFO - Trial 294 pruned. 
2026-05-16 08:59:07,603 - optuna.study._optimize - INFO - Trial 295 pruned. 
2026-05-16 08:59:14,510 - optuna.study._optimize - INFO - Trial 296 pruned. 
2026-05-16 08:59:21,366 - optuna.study._optimize - INFO - Trial 297 pruned. 
2026-05-16 08:59:28,659 - optuna.study._optimize - INFO - Trial 298 pruned. 
2026-05-16 08:59:36,646 - experiment_functions - INFO - Early stopping at epoch 1200. Best Recall: 0.1191
2026-05-16 08:59:36,747 - optuna.study.study - INFO - Trial 299 finished with value: 0.11906404107501366 and parameters: {'n_layers': 1, 'embedding_dim': 256, 'lr': 0.0006643588561213986, 'lambda_val': 1.5541124405654052e-06, 'batch_size': 2579, 'optimizer': 'Adam'}. Best is trial 216 with value: 0.13105332615342377.
2026-05-16 08:59:43,132 - experiment_functions - INFO - Early stopping at epoch 1700. Best Recall: 0.1252
2026-05-16 08:59:43,243 - root - INFO -   **** Training e_100K_1c3dcs_rand4
2026-05-16 08:59:43,258 - root - INFO -   **** Getting 70319/81200 random edges
2026-05-16 08:59:43,375 - optuna.storages._rdb.storage - INFO - A new study created in RDB with name: Study_e_100K_1c3dcs_rand4
2026-05-16 08:59:46,950 - experiment_functions - INFO - Early stopping at epoch 500. Best Recall: 0.0029
2026-05-16 08:59:47,046 - optuna.study.study - INFO - Trial 0 finished with value: 0.0029484515277686018 and parameters: {'n_layers': 2, 'embedding_dim': 64, 'lr': 5.439166192851035e-05, 'lambda_val': 8.797090514853353e-06, 'batch_size': 2993, 'optimizer': 'SGD'}. Best is trial 0 with value: 0.0029484515277686018.
2026-05-16 08:59:51,707 - experiment_functions - INFO - Early stopping at epoch 500. Best Recall: 0.0015
2026-05-16 08:59:51,843 - optuna.study.study - INFO - Trial 1 finished with value: 0.001465590503753412 and parameters: {'n_layers': 4, 'embedding_dim': 96, 'lr': 2.3457899728659525e-05, 'lambda_val': 1.4998107553084343e-06, 'batch_size': 2747, 'optimizer': 'Adam'}. Best is trial 0 with value: 0.0029484515277686018.
2026-05-16 08:59:56,318 - experiment_functions - INFO - Early stopping at epoch 600. Best Recall: 0.0525
2026-05-16 08:59:56,425 - optuna.study.study - INFO - Trial 2 finished with value: 0.05248247993087025 and parameters: {'n_layers': 2, 'embedding_dim': 128, 'lr': 0.0007952124314809599, 'lambda_val': 2.462436567599015e-06, 'batch_size': 3693, 'optimizer': 'RMSprop'}. Best is trial 2 with value: 0.05248247993087025.
2026-05-16 09:00:00,876 - experiment_functions - INFO - Early stopping at epoch 500. Best Recall: 0.0020
2026-05-16 09:00:00,969 - optuna.study.study - INFO - Trial 3 finished with value: 0.001969104702955183 and parameters: {'n_layers': 3, 'embedding_dim': 256, 'lr': 0.062315378903391005, 'lambda_val': 0.000262386775650533, 'batch_size': 1889, 'optimizer': 'SGD'}. Best is trial 2 with value: 0.05248247993087025.
2026-05-16 09:00:40,164 - optuna.study.study - INFO - Trial 4 finished with value: 0.02575964680401153 and parameters: {'n_layers': 4, 'embedding_dim': 32, 'lr': 0.00011985856530760326, 'lambda_val': 5.352190003761564e-05, 'batch_size': 3873, 'optimizer': 'RMSprop'}. Best is trial 2 with value: 0.05248247993087025.
2026-05-16 09:00:44,027 - experiment_functions - INFO - Early stopping at epoch 550. Best Recall: 0.0309
2026-05-16 09:00:44,197 - optuna.study.study - INFO - Trial 5 finished with value: 0.030884949437200528 and parameters: {'n_layers': 3, 'embedding_dim': 64, 'lr': 0.009186791786754052, 'lambda_val': 0.00013250614522692964, 'batch_size': 1859, 'optimizer': 'Adam'}. Best is trial 2 with value: 0.05248247993087025.
2026-05-16 09:00:51,334 - optuna.study._optimize - INFO - Trial 6 pruned. 
2026-05-16 09:00:55,388 - experiment_functions - INFO - Early stopping at epoch 600. Best Recall: 0.0485
2026-05-16 09:00:55,501 - optuna.study.study - INFO - Trial 7 finished with value: 0.04848631702074381 and parameters: {'n_layers': 1, 'embedding_dim': 128, 'lr': 0.019381313302656022, 'lambda_val': 0.00019861520896920153, 'batch_size': 2156, 'optimizer': 'Adam'}. Best is trial 2 with value: 0.05248247993087025.
2026-05-16 09:01:02,897 - experiment_functions - INFO - Early stopping at epoch 750. Best Recall: 0.0381
2026-05-16 09:01:03,026 - optuna.study.study - INFO - Trial 8 finished with value: 0.038138523255570496 and parameters: {'n_layers': 4, 'embedding_dim': 256, 'lr': 0.000400910205981069, 'lambda_val': 7.583368527543308e-05, 'batch_size': 1224, 'optimizer': 'RMSprop'}. Best is trial 2 with value: 0.05248247993087025.
2026-05-16 09:01:10,969 - optuna.study._optimize - INFO - Trial 9 pruned. 
2026-05-16 09:01:21,657 - experiment_functions - INFO - Early stopping at epoch 1900. Best Recall: 0.0498
2026-05-16 09:01:21,804 - optuna.study.study - INFO - Trial 10 finished with value: 0.04978530421042461 and parameters: {'n_layers': 1, 'embedding_dim': 128, 'lr': 0.0023650950381200494, 'lambda_val': 0.018704559713162264, 'batch_size': 3628, 'optimizer': 'RMSprop'}. Best is trial 2 with value: 0.05248247993087025.
2026-05-16 09:01:40,571 - experiment_functions - INFO - Early stopping at epoch 2550. Best Recall: 0.0494
