2026-05-16 01:53:30,405 - optuna.study.study - INFO - Trial 24 finished with value: 0.04214460113955775 and parameters: {'n_layers': 2, 'embedding_dim': 128, 'lr': 0.0017172216581282764, 'lambda_val': 3.815582799564883e-06, 'batch_size': 3412, 'optimizer': 'RMSprop'}. Best is trial 15 with value: 0.072460106789948.
2026-05-16 01:53:34,286 - experiment_functions - INFO - Early stopping at epoch 550. Best Recall: 0.0496
2026-05-16 01:53:34,388 - optuna.study.study - INFO - Trial 25 finished with value: 0.049632794955869274 and parameters: {'n_layers': 2, 'embedding_dim': 128, 'lr': 0.001325183238347815, 'lambda_val': 4.995698693428881e-06, 'batch_size': 3498, 'optimizer': 'RMSprop'}. Best is trial 15 with value: 0.072460106789948.
2026-05-16 01:53:39,580 - experiment_functions - INFO - Early stopping at epoch 800. Best Recall: 0.0787
2026-05-16 01:53:39,702 - optuna.study.study - INFO - Trial 26 finished with value: 0.07870041117439995 and parameters: {'n_layers': 1, 'embedding_dim': 128, 'lr': 0.0014853463954273194, 'lambda_val': 3.572723913620291e-06, 'batch_size': 4042, 'optimizer': 'RMSprop'}. Best is trial 26 with value: 0.07870041117439995.
2026-05-16 01:53:47,786 - experiment_functions - INFO - Early stopping at epoch 1250. Best Recall: 0.0972
2026-05-16 01:53:47,889 - optuna.study.study - INFO - Trial 27 finished with value: 0.09715075540849134 and parameters: {'n_layers': 1, 'embedding_dim': 128, 'lr': 0.0005348656590781149, 'lambda_val': 3.208387645980086e-06, 'batch_size': 4047, 'optimizer': 'RMSprop'}. Best is trial 27 with value: 0.09715075540849134.
2026-05-16 01:54:03,662 - experiment_functions - INFO - Early stopping at epoch 1150. Best Recall: 0.1056
2026-05-16 01:54:03,742 - optuna.study.study - INFO - Trial 28 finished with value: 0.10560870410651821 and parameters: {'n_layers': 1, 'embedding_dim': 128, 'lr': 0.0005539870009023927, 'lambda_val': 1.1771662994832327e-06, 'batch_size': 4064, 'optimizer': 'RMSprop'}. Best is trial 28 with value: 0.10560870410651821.
2026-05-16 01:54:10,336 - experiment_functions - INFO - Early stopping at epoch 1050. Best Recall: 0.0979
2026-05-16 01:54:10,551 - optuna.study.study - INFO - Trial 29 finished with value: 0.09786814045594719 and parameters: {'n_layers': 1, 'embedding_dim': 128, 'lr': 0.0005570616468922099, 'lambda_val': 2.5788011018480823e-06, 'batch_size': 3833, 'optimizer': 'RMSprop'}. Best is trial 28 with value: 0.10560870410651821.
2026-05-16 01:54:17,169 - experiment_functions - INFO - Early stopping at epoch 1050. Best Recall: 0.0954
2026-05-16 01:54:17,259 - optuna.study.study - INFO - Trial 30 finished with value: 0.0953866494200367 and parameters: {'n_layers': 1, 'embedding_dim': 128, 'lr': 0.000575544133683773, 'lambda_val': 2.0512878718920814e-06, 'batch_size': 3706, 'optimizer': 'RMSprop'}. Best is trial 28 with value: 0.10560870410651821.
2026-05-16 01:54:34,264 - experiment_functions - INFO - Early stopping at epoch 1050. Best Recall: 0.0987
2026-05-16 01:54:34,786 - optuna.study.study - INFO - Trial 31 finished with value: 0.09865778675357574 and parameters: {'n_layers': 1, 'embedding_dim': 128, 'lr': 0.0006296932967390784, 'lambda_val': 1.8663089592747993e-06, 'batch_size': 3780, 'optimizer': 'RMSprop'}. Best is trial 28 with value: 0.10560870410651821.
2026-05-16 01:54:40,791 - optuna.study._optimize - INFO - Trial 32 pruned. 
2026-05-16 01:54:47,153 - experiment_functions - INFO - Early stopping at epoch 1050. Best Recall: 0.0956
2026-05-16 01:54:47,297 - optuna.study.study - INFO - Trial 33 finished with value: 0.09562190775498398 and parameters: {'n_layers': 1, 'embedding_dim': 128, 'lr': 0.0004967410565398108, 'lambda_val': 2.455936681293194e-06, 'batch_size': 3544, 'optimizer': 'RMSprop'}. Best is trial 28 with value: 0.10560870410651821.
2026-05-16 01:54:53,851 - optuna.study._optimize - INFO - Trial 34 pruned. 
2026-05-16 01:55:05,074 - experiment_functions - INFO - Early stopping at epoch 1450. Best Recall: 0.0994
2026-05-16 01:55:05,176 - optuna.study.study - INFO - Trial 35 finished with value: 0.0993825875707388 and parameters: {'n_layers': 1, 'embedding_dim': 128, 'lr': 0.0003506320811323283, 'lambda_val': 2.6037275459264788e-05, 'batch_size': 3886, 'optimizer': 'RMSprop'}. Best is trial 28 with value: 0.10560870410651821.
2026-05-16 01:55:16,329 - experiment_functions - INFO - Early stopping at epoch 1950. Best Recall: 0.0975
2026-05-16 01:55:16,408 - optuna.study.study - INFO - Trial 36 finished with value: 0.09745038691479876 and parameters: {'n_layers': 1, 'embedding_dim': 128, 'lr': 0.0003116261106707619, 'lambda_val': 2.800640310913493e-05, 'batch_size': 3844, 'optimizer': 'RMSprop'}. Best is trial 28 with value: 0.10560870410651821.
2026-05-16 01:55:22,324 - optuna.study._optimize - INFO - Trial 37 pruned. 
2026-05-16 01:55:35,690 - experiment_functions - INFO - Early stopping at epoch 750. Best Recall: 0.0984
2026-05-16 01:55:35,929 - optuna.study.study - INFO - Trial 38 finished with value: 0.0983924507532759 and parameters: {'n_layers': 1, 'embedding_dim': 128, 'lr': 0.0007592710660542431, 'lambda_val': 7.942040300910026e-05, 'batch_size': 3202, 'optimizer': 'RMSprop'}. Best is trial 28 with value: 0.10560870410651821.
2026-05-16 01:55:39,632 - experiment_functions - INFO - Early stopping at epoch 500. Best Recall: 0.0024
2026-05-16 01:55:39,755 - optuna.study.study - INFO - Trial 39 finished with value: 0.0024444719879542836 and parameters: {'n_layers': 1, 'embedding_dim': 128, 'lr': 0.0008162494993782134, 'lambda_val': 0.0001273268990160519, 'batch_size': 2779, 'optimizer': 'SGD'}. Best is trial 28 with value: 0.10560870410651821.
2026-05-16 01:55:43,233 - experiment_functions - INFO - Early stopping at epoch 550. Best Recall: 0.0663
2026-05-16 01:55:43,335 - optuna.study.study - INFO - Trial 40 finished with value: 0.06628031308180812 and parameters: {'n_layers': 1, 'embedding_dim': 96, 'lr': 0.00305297935853929, 'lambda_val': 9.211362428433575e-05, 'batch_size': 3258, 'optimizer': 'RMSprop'}. Best is trial 28 with value: 0.10560870410651821.
2026-05-16 01:55:49,714 - optuna.study._optimize - INFO - Trial 41 pruned. 
2026-05-16 01:55:55,866 - experiment_functions - INFO - Early stopping at epoch 900. Best Recall: 0.1002
2026-05-16 01:55:55,965 - optuna.study.study - INFO - Trial 42 finished with value: 0.10017420429778438 and parameters: {'n_layers': 1, 'embedding_dim': 128, 'lr': 0.0008289204411229852, 'lambda_val': 2.1206628928975656e-06, 'batch_size': 3672, 'optimizer': 'RMSprop'}. Best is trial 28 with value: 0.10560870410651821.
2026-05-16 01:56:09,891 - experiment_functions - INFO - Early stopping at epoch 900. Best Recall: 0.0903
2026-05-16 01:56:10,048 - optuna.study.study - INFO - Trial 43 finished with value: 0.09025647494719082 and parameters: {'n_layers': 1, 'embedding_dim': 128, 'lr': 0.000895000583819399, 'lambda_val': 6.325174694740041e-05, 'batch_size': 3647, 'optimizer': 'RMSprop'}. Best is trial 28 with value: 0.10560870410651821.
2026-05-16 01:56:18,206 - experiment_functions - INFO - Early stopping at epoch 1250. Best Recall: 0.1162
2026-05-16 01:56:18,299 - optuna.study.study - INFO - Trial 44 finished with value: 0.11618346489857198 and parameters: {'n_layers': 1, 'embedding_dim': 128, 'lr': 0.0003828015011676744, 'lambda_val': 0.00020543351010699913, 'batch_size': 3218, 'optimizer': 'RMSprop'}. Best is trial 44 with value: 0.11618346489857198.
2026-05-16 01:56:26,386 - optuna.study._optimize - INFO - Trial 45 pruned. 
2026-05-16 01:56:34,415 - optuna.study._optimize - INFO - Trial 46 pruned. 
2026-05-16 01:56:38,250 - experiment_functions - INFO - Early stopping at epoch 500. Best Recall: 0.0028
2026-05-16 01:56:38,927 - optuna.study.study - INFO - Trial 47 finished with value: 0.0027861852162896082 and parameters: {'n_layers': 1, 'embedding_dim': 128, 'lr': 0.003029615929997619, 'lambda_val': 0.0002905764385686361, 'batch_size': 2366, 'optimizer': 'SGD'}. Best is trial 44 with value: 0.11618346489857198.
2026-05-16 01:56:49,601 - experiment_functions - INFO - Early stopping at epoch 1850. Best Recall: 0.1060
2026-05-16 01:56:49,701 - optuna.study.study - INFO - Trial 48 finished with value: 0.10604943013923925 and parameters: {'n_layers': 1, 'embedding_dim': 128, 'lr': 0.00037303227858588746, 'lambda_val': 1.1139228280374235e-05, 'batch_size': 3931, 'optimizer': 'RMSprop'}. Best is trial 44 with value: 0.11618346489857198.
2026-05-16 01:56:56,350 - optuna.study._optimize - INFO - Trial 49 pruned. 
2026-05-16 01:57:11,411 - optuna.study._optimize - INFO - Trial 50 pruned. 
2026-05-16 01:57:20,555 - experiment_functions - INFO - Early stopping at epoch 1550. Best Recall: 0.1065
2026-05-16 01:57:20,654 - optuna.study.study - INFO - Trial 51 finished with value: 0.10651255967424055 and parameters: {'n_layers': 1, 'embedding_dim': 128, 'lr': 0.00039355436160988706, 'lambda_val': 1.992001846711699e-06, 'batch_size': 3769, 'optimizer': 'RMSprop'}. Best is trial 44 with value: 0.11618346489857198.
2026-05-16 01:57:27,453 - optuna.study._optimize - INFO - Trial 52 pruned. 
2026-05-16 01:57:43,128 - optuna.study._optimize - INFO - Trial 53 pruned. 
2026-05-16 01:57:49,030 - optuna.study._optimize - INFO - Trial 54 pruned. 
2026-05-16 01:57:52,806 - experiment_functions - INFO - Early stopping at epoch 500. Best Recall: 0.0016
2026-05-16 01:57:52,886 - optuna.study.study - INFO - Trial 55 finished with value: 0.0016292419408852833 and parameters: {'n_layers': 1, 'embedding_dim': 32, 'lr': 0.001033325097129753, 'lambda_val': 0.0001782800055786368, 'batch_size': 3361, 'optimizer': 'SGD'}. Best is trial 44 with value: 0.11618346489857198.
2026-05-16 01:57:59,092 - optuna.study._optimize - INFO - Trial 56 pruned. 
2026-05-16 01:58:05,757 - optuna.study._optimize - INFO - Trial 57 pruned. 
2026-05-16 01:58:11,124 - experiment_functions - INFO - Early stopping at epoch 550. Best Recall: 0.0912
2026-05-16 01:58:11,204 - optuna.study.study - INFO - Trial 58 finished with value: 0.09115156111094666 and parameters: {'n_layers': 1, 'embedding_dim': 256, 'lr': 0.0024554070511242448, 'lambda_val': 9.304336644789101e-06, 'batch_size': 3921, 'optimizer': 'RMSprop'}. Best is trial 44 with value: 0.11618346489857198.
2026-05-16 01:58:18,548 - optuna.study._optimize - INFO - Trial 59 pruned. 
2026-05-16 01:58:25,581 - optuna.study._optimize - INFO - Trial 60 pruned. 
2026-05-16 01:58:31,209 - experiment_functions - INFO - Early stopping at epoch 850. Best Recall: 0.0922
2026-05-16 01:58:31,322 - optuna.study.study - INFO - Trial 61 finished with value: 0.0922438975234375 and parameters: {'n_layers': 1, 'embedding_dim': 128, 'lr': 0.000689161536589766, 'lambda_val': 1.759517031967582e-06, 'batch_size': 3760, 'optimizer': 'RMSprop'}. Best is trial 44 with value: 0.11618346489857198.
2026-05-16 01:58:47,536 - experiment_functions - INFO - Early stopping at epoch 1400. Best Recall: 0.1043
2026-05-16 01:58:47,635 - optuna.study.study - INFO - Trial 62 finished with value: 0.10425857628650789 and parameters: {'n_layers': 1, 'embedding_dim': 128, 'lr': 0.0003664443106395039, 'lambda_val': 3.7990287169778186e-06, 'batch_size': 3804, 'optimizer': 'RMSprop'}. Best is trial 44 with value: 0.11618346489857198.
2026-05-16 01:58:57,165 - experiment_functions - INFO - Early stopping at epoch 1350. Best Recall: 0.0998
2026-05-16 01:58:58,232 - optuna.study.study - INFO - Trial 63 finished with value: 0.0998346090393222 and parameters: {'n_layers': 1, 'embedding_dim': 128, 'lr': 0.00041467553590159045, 'lambda_val': 4.101249940684245e-06, 'batch_size': 3462, 'optimizer': 'RMSprop'}. Best is trial 44 with value: 0.11618346489857198.
2026-05-16 01:59:02,082 - experiment_functions - INFO - Early stopping at epoch 550. Best Recall: 0.0923
2026-05-16 01:59:02,152 - optuna.study.study - INFO - Trial 64 finished with value: 0.09231746259006642 and parameters: {'n_layers': 1, 'embedding_dim': 128, 'lr': 0.002082320163819959, 'lambda_val': 4.2999112389915245e-06, 'batch_size': 3494, 'optimizer': 'RMSprop'}. Best is trial 44 with value: 0.11618346489857198.
2026-05-16 01:59:25,569 - experiment_functions - INFO - Early stopping at epoch 2800. Best Recall: 0.1119
2026-05-16 01:59:25,670 - optuna.study.study - INFO - Trial 65 finished with value: 0.11193081367256137 and parameters: {'n_layers': 1, 'embedding_dim': 32, 'lr': 0.0004380039033330451, 'lambda_val': 2.6238793034657165e-06, 'batch_size': 3403, 'optimizer': 'RMSprop'}. Best is trial 44 with value: 0.11618346489857198.
2026-05-16 01:59:32,242 - experiment_functions - INFO - Early stopping at epoch 1150. Best Recall: 0.1094
2026-05-16 01:59:32,340 - optuna.study.study - INFO - Trial 66 finished with value: 0.10936411277754449 and parameters: {'n_layers': 1, 'embedding_dim': 32, 'lr': 0.0012268272333156997, 'lambda_val': 2.8290637461803415e-06, 'batch_size': 3628, 'optimizer': 'Adam'}. Best is trial 44 with value: 0.11618346489857198.
2026-05-16 01:59:38,155 - experiment_functions - INFO - Early stopping at epoch 950. Best Recall: 0.0953
2026-05-16 01:59:38,262 - optuna.study.study - INFO - Trial 67 finished with value: 0.09534450418272061 and parameters: {'n_layers': 1, 'embedding_dim': 32, 'lr': 0.0011403000393604755, 'lambda_val': 2.7772110672077982e-06, 'batch_size': 3126, 'optimizer': 'Adam'}. Best is trial 44 with value: 0.11618346489857198.
2026-05-16 01:59:52,834 - optuna.study._optimize - INFO - Trial 68 pruned. 
2026-05-16 01:59:56,616 - experiment_functions - INFO - Early stopping at epoch 550. Best Recall: 0.0355
2026-05-16 01:59:56,740 - optuna.study.study - INFO - Trial 69 finished with value: 0.035451984753393534 and parameters: {'n_layers': 3, 'embedding_dim': 32, 'lr': 0.0044865669990767475, 'lambda_val': 5.048669246750592e-06, 'batch_size': 3606, 'optimizer': 'Adam'}. Best is trial 44 with value: 0.11618346489857198.
2026-05-16 02:00:04,860 - optuna.study._optimize - INFO - Trial 70 pruned. 
2026-05-16 02:00:11,645 - optuna.study._optimize - INFO - Trial 71 pruned. 
2026-05-16 02:00:19,279 - optuna.study._optimize - INFO - Trial 72 pruned. 
2026-05-16 02:00:25,136 - experiment_functions - INFO - Early stopping at epoch 850. Best Recall: 0.0809
2026-05-16 02:00:25,230 - optuna.study.study - INFO - Trial 73 finished with value: 0.08090514753571684 and parameters: {'n_layers': 1, 'embedding_dim': 32, 'lr': 0.001563694567110955, 'lambda_val': 1.2166743358897439e-05, 'batch_size': 2882, 'optimizer': 'RMSprop'}. Best is trial 44 with value: 0.11618346489857198.
2026-05-16 02:00:28,463 - experiment_functions - INFO - Early stopping at epoch 500. Best Recall: 0.0010
2026-05-16 02:00:28,545 - optuna.study.study - INFO - Trial 74 finished with value: 0.0010199548914828524 and parameters: {'n_layers': 1, 'embedding_dim': 32, 'lr': 0.00041955171515766285, 'lambda_val': 1.0607607670730337e-06, 'batch_size': 3607, 'optimizer': 'SGD'}. Best is trial 44 with value: 0.11618346489857198.
2026-05-16 02:00:34,580 - optuna.study._optimize - INFO - Trial 75 pruned. 
2026-05-16 02:00:42,812 - experiment_functions - INFO - Early stopping at epoch 850. Best Recall: 0.0875
2026-05-16 02:00:43,578 - optuna.study.study - INFO - Trial 76 finished with value: 0.08747056419835188 and parameters: {'n_layers': 1, 'embedding_dim': 64, 'lr': 0.0008475720279554946, 'lambda_val': 7.713286873423619e-06, 'batch_size': 3312, 'optimizer': 'RMSprop'}. Best is trial 44 with value: 0.11618346489857198.
2026-05-16 02:00:54,354 - optuna.study._optimize - INFO - Trial 77 pruned. 
2026-05-16 02:01:00,153 - optuna.study._optimize - INFO - Trial 78 pruned. 
2026-05-16 02:01:06,807 - optuna.study._optimize - INFO - Trial 79 pruned. 
2026-05-16 02:01:27,189 - experiment_functions - INFO - Early stopping at epoch 1550. Best Recall: 0.1087
2026-05-16 02:01:27,304 - optuna.study.study - INFO - Trial 80 finished with value: 0.10868534258671332 and parameters: {'n_layers': 1, 'embedding_dim': 128, 'lr': 0.0003153061335144697, 'lambda_val': 2.1317973675510952e-06, 'batch_size': 3892, 'optimizer': 'RMSprop'}. Best is trial 44 with value: 0.11618346489857198.
2026-05-16 02:01:31,662 - experiment_functions - INFO - Early stopping at epoch 600. Best Recall: 0.0895
2026-05-16 02:01:31,972 - optuna.study.study - INFO - Trial 81 finished with value: 0.08948762197364728 and parameters: {'n_layers': 1, 'embedding_dim': 128, 'lr': 0.00131559450953793, 'lambda_val': 2.3986893987304455e-06, 'batch_size': 3862, 'optimizer': 'RMSprop'}. Best is trial 44 with value: 0.11618346489857198.
2026-05-16 02:01:44,013 - experiment_functions - INFO - Early stopping at epoch 1750. Best Recall: 0.1096
2026-05-16 02:01:44,146 - optuna.study.study - INFO - Trial 82 finished with value: 0.1096356564851163 and parameters: {'n_layers': 1, 'embedding_dim': 128, 'lr': 0.000337140616221499, 'lambda_val': 1.3754115614841195e-06, 'batch_size': 3981, 'optimizer': 'RMSprop'}. Best is trial 44 with value: 0.11618346489857198.
2026-05-16 02:01:50,689 - optuna.study._optimize - INFO - Trial 83 pruned. 
2026-05-16 02:01:58,537 - optuna.study._optimize - INFO - Trial 84 pruned. 
2026-05-16 02:02:05,342 - optuna.study._optimize - INFO - Trial 85 pruned. 
2026-05-16 02:02:11,606 - optuna.study._optimize - INFO - Trial 86 pruned. 
2026-05-16 02:02:22,048 - optuna.study._optimize - INFO - Trial 87 pruned. 
2026-05-16 02:02:29,784 - experiment_functions - INFO - Early stopping at epoch 500. Best Recall: 0.0025
2026-05-16 02:02:29,910 - optuna.study.study - INFO - Trial 88 finished with value: 0.0024754536993337305 and parameters: {'n_layers': 1, 'embedding_dim': 128, 'lr': 0.0003150119904606976, 'lambda_val': 6.699708538868656e-06, 'batch_size': 3596, 'optimizer': 'SGD'}. Best is trial 44 with value: 0.11618346489857198.
2026-05-16 02:02:37,484 - experiment_functions - INFO - Early stopping at epoch 900. Best Recall: 0.0636
2026-05-16 02:02:37,565 - optuna.study.study - INFO - Trial 89 finished with value: 0.0635742697837352 and parameters: {'n_layers': 2, 'embedding_dim': 256, 'lr': 0.00045216574530826365, 'lambda_val': 1.1030274390772341e-06, 'batch_size': 3426, 'optimizer': 'RMSprop'}. Best is trial 44 with value: 0.11618346489857198.
2026-05-16 02:02:42,873 - optuna.study._optimize - INFO - Trial 90 pruned. 
2026-05-16 02:02:57,946 - experiment_functions - INFO - Early stopping at epoch 900. Best Recall: 0.0947
2026-05-16 02:02:58,479 - optuna.study.study - INFO - Trial 91 finished with value: 0.0947327484221336 and parameters: {'n_layers': 1, 'embedding_dim': 128, 'lr': 0.000749909614833972, 'lambda_val': 2.034297369996993e-06, 'batch_size': 3698, 'optimizer': 'RMSprop'}. Best is trial 44 with value: 0.11618346489857198.
2026-05-16 02:03:05,611 - experiment_functions - INFO - Early stopping at epoch 700. Best Recall: 0.0998
2026-05-16 02:03:05,771 - optuna.study.study - INFO - Trial 92 finished with value: 0.09980492193983327 and parameters: {'n_layers': 1, 'embedding_dim': 128, 'lr': 0.0009618798237230649, 'lambda_val': 3.914445989769754e-06, 'batch_size': 3754, 'optimizer': 'RMSprop'}. Best is trial 44 with value: 0.11618346489857198.
2026-05-16 02:03:12,394 - experiment_functions - INFO - Early stopping at epoch 1050. Best Recall: 0.1020
2026-05-16 02:03:12,509 - optuna.study.study - INFO - Trial 93 finished with value: 0.10202565154257272 and parameters: {'n_layers': 1, 'embedding_dim': 128, 'lr': 0.0005781134889980367, 'lambda_val': 2.387043742503882e-06, 'batch_size': 3958, 'optimizer': 'RMSprop'}. Best is trial 44 with value: 0.11618346489857198.
2026-05-16 02:03:19,217 - optuna.study._optimize - INFO - Trial 94 pruned. 
2026-05-16 02:03:25,052 - experiment_functions - INFO - Early stopping at epoch 900. Best Recall: 0.0997
2026-05-16 02:03:25,228 - optuna.study.study - INFO - Trial 95 finished with value: 0.09965806316922955 and parameters: {'n_layers': 1, 'embedding_dim': 128, 'lr': 0.0005792655007547657, 'lambda_val': 2.5898844226303217e-06, 'batch_size': 3961, 'optimizer': 'RMSprop'}. Best is trial 44 with value: 0.11618346489857198.
2026-05-16 02:03:36,358 - experiment_functions - INFO - Early stopping at epoch 1750. Best Recall: 0.1037
2026-05-16 02:03:36,439 - optuna.study.study - INFO - Trial 96 finished with value: 0.1036706965036009 and parameters: {'n_layers': 1, 'embedding_dim': 128, 'lr': 0.00036273341238774186, 'lambda_val': 4.946620400088803e-06, 'batch_size': 3886, 'optimizer': 'RMSprop'}. Best is trial 44 with value: 0.11618346489857198.
2026-05-16 02:03:42,226 - optuna.study._optimize - INFO - Trial 97 pruned. 
2026-05-16 02:03:48,441 - optuna.study._optimize - INFO - Trial 98 pruned. 
2026-05-16 02:04:02,724 - optuna.study._optimize - INFO - Trial 99 pruned. 
2026-05-16 02:04:11,640 - optuna.study._optimize - INFO - Trial 100 pruned. 
2026-05-16 02:04:19,813 - experiment_functions - INFO - Early stopping at epoch 1300. Best Recall: 0.1049
2026-05-16 02:04:19,906 - optuna.study.study - INFO - Trial 101 finished with value: 0.10494253602618993 and parameters: {'n_layers': 1, 'embedding_dim': 128, 'lr': 0.000488344993649468, 'lambda_val': 1.2407730102148287e-06, 'batch_size': 4016, 'optimizer': 'RMSprop'}. Best is trial 44 with value: 0.11618346489857198.
2026-05-16 02:04:26,878 - experiment_functions - INFO - Early stopping at epoch 1100. Best Recall: 0.1102
2026-05-16 02:04:26,992 - optuna.study.study - INFO - Trial 102 finished with value: 0.11019653104558741 and parameters: {'n_layers': 1, 'embedding_dim': 128, 'lr': 0.0004791221228471662, 'lambda_val': 1.2448269787942176e-06, 'batch_size': 4034, 'optimizer': 'RMSprop'}. Best is trial 44 with value: 0.11618346489857198.
2026-05-16 02:04:41,051 - optuna.study._optimize - INFO - Trial 103 pruned. 
2026-05-16 02:04:47,989 - optuna.study._optimize - INFO - Trial 104 pruned. 
2026-05-16 02:04:55,930 - optuna.study._optimize - INFO - Trial 105 pruned. 
2026-05-16 02:05:04,948 - optuna.study._optimize - INFO - Trial 106 pruned. 
2026-05-16 02:05:11,403 - experiment_functions - INFO - Early stopping at epoch 500. Best Recall: 0.0025
