2026-05-16 06:49:42,503 - optuna.study.study - INFO - Trial 44 finished with value: 0.0021456377353045396 and parameters: {'n_layers': 2, 'embedding_dim': 128, 'lr': 0.00034220657646048233, 'lambda_val': 2.7837545304127934e-05, 'batch_size': 798, 'optimizer': 'SGD'}. Best is trial 42 with value: 0.09973645473931977.
2026-05-16 06:49:46,581 - experiment_functions - INFO - Early stopping at epoch 600. Best Recall: 0.0032
2026-05-16 06:49:46,725 - optuna.study.study - INFO - Trial 45 finished with value: 0.0032421674494981702 and parameters: {'n_layers': 1, 'embedding_dim': 128, 'lr': 6.462765067942586e-05, 'lambda_val': 2.048549514365093e-06, 'batch_size': 1038, 'optimizer': 'RMSprop'}. Best is trial 42 with value: 0.09973645473931977.
2026-05-16 06:49:51,226 - experiment_functions - INFO - Early stopping at epoch 550. Best Recall: 0.0542
2026-05-16 06:49:51,317 - optuna.study.study - INFO - Trial 46 finished with value: 0.054194608572579905 and parameters: {'n_layers': 2, 'embedding_dim': 128, 'lr': 0.0013502062627828181, 'lambda_val': 1.0085037082250906e-06, 'batch_size': 1665, 'optimizer': 'RMSprop'}. Best is trial 42 with value: 0.09973645473931977.
2026-05-16 06:50:10,910 - experiment_functions - INFO - Early stopping at epoch 3500. Best Recall: 0.0953
2026-05-16 06:50:11,010 - optuna.study.study - INFO - Trial 47 finished with value: 0.09529068192301639 and parameters: {'n_layers': 2, 'embedding_dim': 64, 'lr': 0.00032183862844873654, 'lambda_val': 1.4220235569489475e-05, 'batch_size': 522, 'optimizer': 'Adam'}. Best is trial 42 with value: 0.09973645473931977.
2026-05-16 06:50:17,385 - optuna.study._optimize - INFO - Trial 48 pruned. 
2026-05-16 06:50:22,987 - optuna.study._optimize - INFO - Trial 49 pruned. 
2026-05-16 06:50:27,759 - experiment_functions - INFO - Early stopping at epoch 600. Best Recall: 0.0388
2026-05-16 06:50:27,859 - optuna.study.study - INFO - Trial 50 finished with value: 0.038754517024986286 and parameters: {'n_layers': 4, 'embedding_dim': 64, 'lr': 0.0020305612770448777, 'lambda_val': 4.838138706198774e-06, 'batch_size': 665, 'optimizer': 'Adam'}. Best is trial 42 with value: 0.09973645473931977.
2026-05-16 06:50:34,097 - optuna.study._optimize - INFO - Trial 51 pruned. 
2026-05-16 06:50:48,114 - optuna.study._optimize - INFO - Trial 52 pruned. 
2026-05-16 06:50:54,059 - optuna.study._optimize - INFO - Trial 53 pruned. 
2026-05-16 06:51:01,042 - experiment_functions - INFO - Early stopping at epoch 1000. Best Recall: 0.0802
2026-05-16 06:51:01,142 - optuna.study.study - INFO - Trial 54 finished with value: 0.0802038764087097 and parameters: {'n_layers': 2, 'embedding_dim': 128, 'lr': 0.0007161537721042527, 'lambda_val': 1.625209328443836e-05, 'batch_size': 657, 'optimizer': 'Adam'}. Best is trial 42 with value: 0.09973645473931977.
2026-05-16 06:51:04,801 - experiment_functions - INFO - Early stopping at epoch 500. Best Recall: 0.0025
2026-05-16 06:51:04,900 - optuna.study.study - INFO - Trial 55 finished with value: 0.002523026357886753 and parameters: {'n_layers': 2, 'embedding_dim': 128, 'lr': 4.183931415088672e-05, 'lambda_val': 2.5193121350241856e-06, 'batch_size': 1329, 'optimizer': 'SGD'}. Best is trial 42 with value: 0.09973645473931977.
2026-05-16 06:51:11,302 - optuna.study._optimize - INFO - Trial 56 pruned. 
2026-05-16 06:51:23,794 - optuna.study._optimize - INFO - Trial 57 pruned. 
2026-05-16 06:51:42,866 - experiment_functions - INFO - Early stopping at epoch 3450. Best Recall: 0.1144
2026-05-16 06:51:42,959 - optuna.study.study - INFO - Trial 58 finished with value: 0.11436717521696815 and parameters: {'n_layers': 1, 'embedding_dim': 128, 'lr': 0.0004753042278221995, 'lambda_val': 0.0001415378293611652, 'batch_size': 2416, 'optimizer': 'Adam'}. Best is trial 58 with value: 0.11436717521696815.
2026-05-16 06:51:54,120 - experiment_functions - INFO - Early stopping at epoch 1800. Best Recall: 0.1190
2026-05-16 06:51:54,234 - optuna.study.study - INFO - Trial 59 finished with value: 0.11901431530212041 and parameters: {'n_layers': 1, 'embedding_dim': 256, 'lr': 0.0005070375479548727, 'lambda_val': 5.6933654629954375e-05, 'batch_size': 2495, 'optimizer': 'Adam'}. Best is trial 59 with value: 0.11901431530212041.
2026-05-16 06:52:00,739 - experiment_functions - INFO - Early stopping at epoch 600. Best Recall: 0.1061
2026-05-16 06:52:00,873 - optuna.study.study - INFO - Trial 60 finished with value: 0.10606876146007532 and parameters: {'n_layers': 1, 'embedding_dim': 256, 'lr': 0.002342950456787574, 'lambda_val': 0.00013985639126682943, 'batch_size': 2508, 'optimizer': 'Adam'}. Best is trial 59 with value: 0.11901431530212041.
2026-05-16 06:52:05,126 - experiment_functions - INFO - Early stopping at epoch 600. Best Recall: 0.0976
2026-05-16 06:52:05,226 - optuna.study.study - INFO - Trial 61 finished with value: 0.09763017736074042 and parameters: {'n_layers': 1, 'embedding_dim': 256, 'lr': 0.0029852365441475634, 'lambda_val': 0.00016981033912233742, 'batch_size': 2430, 'optimizer': 'Adam'}. Best is trial 59 with value: 0.11901431530212041.
2026-05-16 06:52:09,235 - experiment_functions - INFO - Early stopping at epoch 550. Best Recall: 0.0998
2026-05-16 06:52:09,402 - optuna.study.study - INFO - Trial 62 finished with value: 0.09982220558310881 and parameters: {'n_layers': 1, 'embedding_dim': 256, 'lr': 0.006247983383442224, 'lambda_val': 0.000408838814216034, 'batch_size': 2469, 'optimizer': 'Adam'}. Best is trial 59 with value: 0.11901431530212041.
2026-05-16 06:52:13,464 - experiment_functions - INFO - Early stopping at epoch 550. Best Recall: 0.0981
2026-05-16 06:52:15,741 - optuna.study.study - INFO - Trial 63 finished with value: 0.09809202738404602 and parameters: {'n_layers': 1, 'embedding_dim': 256, 'lr': 0.005614660952932921, 'lambda_val': 0.00015077158097157595, 'batch_size': 2401, 'optimizer': 'Adam'}. Best is trial 59 with value: 0.11901431530212041.
2026-05-16 06:52:20,064 - experiment_functions - INFO - Early stopping at epoch 550. Best Recall: 0.1077
2026-05-16 06:52:20,165 - optuna.study.study - INFO - Trial 64 finished with value: 0.10766938277700532 and parameters: {'n_layers': 1, 'embedding_dim': 256, 'lr': 0.006190493222352995, 'lambda_val': 0.0006331586675842518, 'batch_size': 2453, 'optimizer': 'Adam'}. Best is trial 59 with value: 0.11901431530212041.
2026-05-16 06:52:24,084 - experiment_functions - INFO - Early stopping at epoch 550. Best Recall: 0.0998
2026-05-16 06:52:24,175 - optuna.study.study - INFO - Trial 65 finished with value: 0.0998119986615381 and parameters: {'n_layers': 1, 'embedding_dim': 256, 'lr': 0.007191953702834311, 'lambda_val': 0.0006580280523058942, 'batch_size': 2947, 'optimizer': 'Adam'}. Best is trial 59 with value: 0.11901431530212041.
2026-05-16 06:52:30,648 - optuna.study._optimize - INFO - Trial 66 pruned. 
2026-05-16 06:52:36,194 - experiment_functions - INFO - Early stopping at epoch 550. Best Recall: 0.1019
2026-05-16 06:52:36,293 - optuna.study.study - INFO - Trial 67 finished with value: 0.10187961744015961 and parameters: {'n_layers': 1, 'embedding_dim': 256, 'lr': 0.0057133379811098095, 'lambda_val': 0.0005648718901789033, 'batch_size': 2140, 'optimizer': 'Adam'}. Best is trial 59 with value: 0.11901431530212041.
2026-05-16 06:52:40,757 - experiment_functions - INFO - Early stopping at epoch 550. Best Recall: 0.0796
2026-05-16 06:52:40,926 - optuna.study.study - INFO - Trial 68 finished with value: 0.07957692472082434 and parameters: {'n_layers': 1, 'embedding_dim': 256, 'lr': 0.007879352782929488, 'lambda_val': 0.0005420668353039234, 'batch_size': 2198, 'optimizer': 'Adam'}. Best is trial 59 with value: 0.11901431530212041.
2026-05-16 06:52:45,089 - experiment_functions - INFO - Early stopping at epoch 600. Best Recall: 0.0521
2026-05-16 06:52:45,179 - optuna.study.study - INFO - Trial 69 finished with value: 0.052061428175761856 and parameters: {'n_layers': 1, 'embedding_dim': 256, 'lr': 0.017049621888937955, 'lambda_val': 0.0012209789694497266, 'batch_size': 2590, 'optimizer': 'Adam'}. Best is trial 59 with value: 0.11901431530212041.
2026-05-16 06:52:50,165 - experiment_functions - INFO - Early stopping at epoch 550. Best Recall: 0.1057
2026-05-16 06:52:50,256 - optuna.study.study - INFO - Trial 70 finished with value: 0.10569053463994278 and parameters: {'n_layers': 1, 'embedding_dim': 256, 'lr': 0.0046974784029504895, 'lambda_val': 0.00031158353156607, 'batch_size': 3022, 'optimizer': 'Adam'}. Best is trial 59 with value: 0.11901431530212041.
2026-05-16 06:52:54,662 - experiment_functions - INFO - Early stopping at epoch 550. Best Recall: 0.1168
2026-05-16 06:52:54,765 - optuna.study.study - INFO - Trial 71 finished with value: 0.11683384378431955 and parameters: {'n_layers': 1, 'embedding_dim': 256, 'lr': 0.005165538817502945, 'lambda_val': 0.0003448989213076539, 'batch_size': 3029, 'optimizer': 'Adam'}. Best is trial 59 with value: 0.11901431530212041.
2026-05-16 06:52:59,272 - experiment_functions - INFO - Early stopping at epoch 550. Best Recall: 0.1048
2026-05-16 06:52:59,373 - optuna.study.study - INFO - Trial 72 finished with value: 0.10482564639064053 and parameters: {'n_layers': 1, 'embedding_dim': 256, 'lr': 0.003965520556629626, 'lambda_val': 0.0003590418750867919, 'batch_size': 3143, 'optimizer': 'Adam'}. Best is trial 59 with value: 0.11901431530212041.
2026-05-16 06:53:05,526 - experiment_functions - INFO - Early stopping at epoch 550. Best Recall: 0.1122
2026-05-16 06:53:05,625 - optuna.study.study - INFO - Trial 73 finished with value: 0.1122336944110608 and parameters: {'n_layers': 1, 'embedding_dim': 256, 'lr': 0.0040124745841622345, 'lambda_val': 0.00034602386518620473, 'batch_size': 3206, 'optimizer': 'Adam'}. Best is trial 59 with value: 0.11901431530212041.
2026-05-16 06:53:09,914 - experiment_functions - INFO - Early stopping at epoch 550. Best Recall: 0.1017
2026-05-16 06:53:10,024 - optuna.study.study - INFO - Trial 74 finished with value: 0.10172556785864854 and parameters: {'n_layers': 1, 'embedding_dim': 256, 'lr': 0.004403351180416972, 'lambda_val': 0.0002621349073808644, 'batch_size': 3670, 'optimizer': 'Adam'}. Best is trial 59 with value: 0.11901431530212041.
2026-05-16 06:53:15,253 - experiment_functions - INFO - Early stopping at epoch 600. Best Recall: 0.0976
2026-05-16 06:53:15,399 - optuna.study.study - INFO - Trial 75 finished with value: 0.09755931949754679 and parameters: {'n_layers': 1, 'embedding_dim': 256, 'lr': 0.0024554900348372584, 'lambda_val': 0.0033402478707774087, 'batch_size': 3238, 'optimizer': 'Adam'}. Best is trial 59 with value: 0.11901431530212041.
2026-05-16 06:53:19,539 - experiment_functions - INFO - Early stopping at epoch 550. Best Recall: 0.1022
2026-05-16 06:53:19,640 - optuna.study.study - INFO - Trial 76 finished with value: 0.10223004378163116 and parameters: {'n_layers': 1, 'embedding_dim': 256, 'lr': 0.003942529688692575, 'lambda_val': 0.00011711122157018201, 'batch_size': 3142, 'optimizer': 'Adam'}. Best is trial 59 with value: 0.11901431530212041.
2026-05-16 06:53:27,599 - experiment_functions - INFO - Early stopping at epoch 550. Best Recall: 0.0716
2026-05-16 06:53:27,689 - optuna.study.study - INFO - Trial 77 finished with value: 0.07156404578154911 and parameters: {'n_layers': 1, 'embedding_dim': 256, 'lr': 0.011510440576498745, 'lambda_val': 0.00035447150577256134, 'batch_size': 2801, 'optimizer': 'Adam'}. Best is trial 59 with value: 0.11901431530212041.
2026-05-16 06:53:34,904 - experiment_functions - INFO - Early stopping at epoch 650. Best Recall: 0.1111
2026-05-16 06:53:35,040 - optuna.study.study - INFO - Trial 78 finished with value: 0.11111453770230495 and parameters: {'n_layers': 1, 'embedding_dim': 256, 'lr': 0.0015647253401744482, 'lambda_val': 0.00019779195373484731, 'batch_size': 3051, 'optimizer': 'Adam'}. Best is trial 59 with value: 0.11901431530212041.
2026-05-16 06:53:39,649 - experiment_functions - INFO - Early stopping at epoch 650. Best Recall: 0.0990
2026-05-16 06:53:39,738 - optuna.study.study - INFO - Trial 79 finished with value: 0.09899612559952324 and parameters: {'n_layers': 1, 'embedding_dim': 256, 'lr': 0.0016823548867477384, 'lambda_val': 0.00022644763277091464, 'batch_size': 2334, 'optimizer': 'Adam'}. Best is trial 59 with value: 0.11901431530212041.
2026-05-16 06:53:43,981 - experiment_functions - INFO - Early stopping at epoch 600. Best Recall: 0.1035
2026-05-16 06:53:44,060 - optuna.study.study - INFO - Trial 80 finished with value: 0.10354637493567467 and parameters: {'n_layers': 1, 'embedding_dim': 256, 'lr': 0.0027992583649260575, 'lambda_val': 0.0009527372063639088, 'batch_size': 2613, 'optimizer': 'Adam'}. Best is trial 59 with value: 0.11901431530212041.
2026-05-16 06:53:50,026 - experiment_functions - INFO - Early stopping at epoch 800. Best Recall: 0.1108
2026-05-16 06:53:50,791 - optuna.study.study - INFO - Trial 81 finished with value: 0.11075744499669066 and parameters: {'n_layers': 1, 'embedding_dim': 256, 'lr': 0.0010745681285240563, 'lambda_val': 7.280655796432308e-05, 'batch_size': 3025, 'optimizer': 'Adam'}. Best is trial 59 with value: 0.11901431530212041.
2026-05-16 06:54:08,351 - experiment_functions - INFO - Early stopping at epoch 850. Best Recall: 0.1130
2026-05-16 06:54:08,441 - optuna.study.study - INFO - Trial 82 finished with value: 0.11303890551332332 and parameters: {'n_layers': 1, 'embedding_dim': 256, 'lr': 0.0011447422917661141, 'lambda_val': 8.091629420671647e-05, 'batch_size': 2916, 'optimizer': 'Adam'}. Best is trial 59 with value: 0.11901431530212041.
2026-05-16 06:54:13,567 - experiment_functions - INFO - Early stopping at epoch 750. Best Recall: 0.1104
2026-05-16 06:54:13,719 - optuna.study.study - INFO - Trial 83 finished with value: 0.11044516995737358 and parameters: {'n_layers': 1, 'embedding_dim': 256, 'lr': 0.0011213404016493184, 'lambda_val': 7.05897601505017e-05, 'batch_size': 2845, 'optimizer': 'Adam'}. Best is trial 59 with value: 0.11901431530212041.
2026-05-16 06:54:20,138 - experiment_functions - INFO - Early stopping at epoch 900. Best Recall: 0.1048
2026-05-16 06:54:20,282 - optuna.study.study - INFO - Trial 84 finished with value: 0.10480991596924413 and parameters: {'n_layers': 1, 'embedding_dim': 256, 'lr': 0.0011053703268066645, 'lambda_val': 6.392723293281426e-05, 'batch_size': 2831, 'optimizer': 'Adam'}. Best is trial 59 with value: 0.11901431530212041.
2026-05-16 06:54:28,485 - experiment_functions - INFO - Early stopping at epoch 700. Best Recall: 0.1136
2026-05-16 06:54:29,244 - optuna.study.study - INFO - Trial 85 finished with value: 0.11363732882258328 and parameters: {'n_layers': 1, 'embedding_dim': 256, 'lr': 0.0016990376059249255, 'lambda_val': 8.981868529202293e-05, 'batch_size': 3613, 'optimizer': 'Adam'}. Best is trial 59 with value: 0.11901431530212041.
2026-05-16 06:54:40,567 - experiment_functions - INFO - Early stopping at epoch 700. Best Recall: 0.1055
2026-05-16 06:54:40,676 - optuna.study.study - INFO - Trial 86 finished with value: 0.10552742167964628 and parameters: {'n_layers': 1, 'embedding_dim': 256, 'lr': 0.0017461575410912167, 'lambda_val': 4.397788844276913e-05, 'batch_size': 3647, 'optimizer': 'Adam'}. Best is trial 59 with value: 0.11901431530212041.
2026-05-16 06:54:48,780 - experiment_functions - INFO - Early stopping at epoch 800. Best Recall: 0.1105
2026-05-16 06:54:48,948 - optuna.study.study - INFO - Trial 87 finished with value: 0.11049064337361038 and parameters: {'n_layers': 1, 'embedding_dim': 256, 'lr': 0.0010816502059058006, 'lambda_val': 9.88104653269616e-05, 'batch_size': 3438, 'optimizer': 'Adam'}. Best is trial 59 with value: 0.11901431530212041.
2026-05-16 06:54:56,180 - experiment_functions - INFO - Early stopping at epoch 1100. Best Recall: 0.1070
2026-05-16 06:54:56,291 - optuna.study.study - INFO - Trial 88 finished with value: 0.10696524660306186 and parameters: {'n_layers': 1, 'embedding_dim': 256, 'lr': 0.0008383903515640083, 'lambda_val': 9.027441419760071e-05, 'batch_size': 3462, 'optimizer': 'Adam'}. Best is trial 59 with value: 0.11901431530212041.
2026-05-16 06:55:06,427 - experiment_functions - INFO - Early stopping at epoch 750. Best Recall: 0.0905
2026-05-16 06:55:07,467 - optuna.study.study - INFO - Trial 89 finished with value: 0.09048028787740296 and parameters: {'n_layers': 1, 'embedding_dim': 256, 'lr': 0.0015433388963948962, 'lambda_val': 0.00011012217880462261, 'batch_size': 3554, 'optimizer': 'Adam'}. Best is trial 59 with value: 0.11901431530212041.
2026-05-16 06:55:20,188 - experiment_functions - INFO - Early stopping at epoch 1450. Best Recall: 0.1038
2026-05-16 06:55:20,278 - optuna.study.study - INFO - Trial 90 finished with value: 0.1037799519302008 and parameters: {'n_layers': 1, 'embedding_dim': 256, 'lr': 0.0004588642289914787, 'lambda_val': 0.0001879599849295034, 'batch_size': 3297, 'optimizer': 'Adam'}. Best is trial 59 with value: 0.11901431530212041.
2026-05-16 06:55:26,676 - experiment_functions - INFO - Early stopping at epoch 900. Best Recall: 0.1152
2026-05-16 06:55:26,767 - optuna.study.study - INFO - Trial 91 finished with value: 0.11520148843716088 and parameters: {'n_layers': 1, 'embedding_dim': 256, 'lr': 0.0010873902694601176, 'lambda_val': 6.614570227151202e-05, 'batch_size': 3087, 'optimizer': 'Adam'}. Best is trial 59 with value: 0.11901431530212041.
2026-05-16 06:55:41,271 - experiment_functions - INFO - Early stopping at epoch 1050. Best Recall: 0.1138
2026-05-16 06:55:41,373 - optuna.study.study - INFO - Trial 92 finished with value: 0.11381116371156756 and parameters: {'n_layers': 1, 'embedding_dim': 256, 'lr': 0.0006742886132388272, 'lambda_val': 3.601495868014007e-05, 'batch_size': 3854, 'optimizer': 'Adam'}. Best is trial 59 with value: 0.11901431530212041.
2026-05-16 06:55:47,783 - experiment_functions - INFO - Early stopping at epoch 950. Best Recall: 0.1124
2026-05-16 06:55:47,927 - optuna.study.study - INFO - Trial 93 finished with value: 0.11240951032550532 and parameters: {'n_layers': 1, 'embedding_dim': 256, 'lr': 0.0006563977198091858, 'lambda_val': 3.4948587794462875e-05, 'batch_size': 3744, 'optimizer': 'Adam'}. Best is trial 59 with value: 0.11901431530212041.
2026-05-16 06:55:56,961 - experiment_functions - INFO - Early stopping at epoch 1600. Best Recall: 0.0971
2026-05-16 06:55:57,488 - optuna.study.study - INFO - Trial 94 finished with value: 0.09708042169116805 and parameters: {'n_layers': 1, 'embedding_dim': 32, 'lr': 0.0006771486179401566, 'lambda_val': 3.182308308084184e-05, 'batch_size': 3845, 'optimizer': 'Adam'}. Best is trial 59 with value: 0.11901431530212041.
2026-05-16 06:56:10,006 - experiment_functions - INFO - Early stopping at epoch 1250. Best Recall: 0.1036
2026-05-16 06:56:11,018 - optuna.study.study - INFO - Trial 95 finished with value: 0.10364941811199987 and parameters: {'n_layers': 1, 'embedding_dim': 256, 'lr': 0.0005556541873751764, 'lambda_val': 5.5368922196150345e-05, 'batch_size': 3849, 'optimizer': 'Adam'}. Best is trial 59 with value: 0.11901431530212041.
2026-05-16 06:56:20,346 - experiment_functions - INFO - Early stopping at epoch 900. Best Recall: 0.1118
2026-05-16 06:56:20,446 - optuna.study.study - INFO - Trial 96 finished with value: 0.11181080932604129 and parameters: {'n_layers': 1, 'embedding_dim': 256, 'lr': 0.0007661067649599472, 'lambda_val': 4.3091605884102016e-05, 'batch_size': 4075, 'optimizer': 'Adam'}. Best is trial 59 with value: 0.11901431530212041.
2026-05-16 06:56:24,219 - experiment_functions - INFO - Early stopping at epoch 500. Best Recall: 0.0043
2026-05-16 06:56:24,321 - optuna.study.study - INFO - Trial 97 finished with value: 0.004257507678783706 and parameters: {'n_layers': 1, 'embedding_dim': 96, 'lr': 0.0007588255687223348, 'lambda_val': 4.0691216431095716e-05, 'batch_size': 4039, 'optimizer': 'SGD'}. Best is trial 59 with value: 0.11901431530212041.
2026-05-16 06:56:33,336 - experiment_functions - INFO - Early stopping at epoch 1400. Best Recall: 0.1072
2026-05-16 06:56:33,416 - optuna.study.study - INFO - Trial 98 finished with value: 0.10724260173257623 and parameters: {'n_layers': 1, 'embedding_dim': 256, 'lr': 0.0004400838283357113, 'lambda_val': 2.459752268585487e-05, 'batch_size': 4091, 'optimizer': 'Adam'}. Best is trial 59 with value: 0.11901431530212041.
2026-05-16 06:56:40,421 - optuna.study._optimize - INFO - Trial 99 pruned. 
2026-05-16 06:56:56,309 - experiment_functions - INFO - Early stopping at epoch 1350. Best Recall: 0.1129
2026-05-16 06:56:56,399 - optuna.study.study - INFO - Trial 100 finished with value: 0.1129187829661974 and parameters: {'n_layers': 1, 'embedding_dim': 256, 'lr': 0.000575106401487962, 'lambda_val': 5.2823871863371726e-05, 'batch_size': 3731, 'optimizer': 'Adam'}. Best is trial 59 with value: 0.11901431530212041.
2026-05-16 06:57:04,345 - experiment_functions - INFO - Early stopping at epoch 1250. Best Recall: 0.1077
2026-05-16 06:57:04,446 - optuna.study.study - INFO - Trial 101 finished with value: 0.10768235894764343 and parameters: {'n_layers': 1, 'embedding_dim': 256, 'lr': 0.0005477458455882015, 'lambda_val': 4.599487351569195e-05, 'batch_size': 3951, 'optimizer': 'Adam'}. Best is trial 59 with value: 0.11901431530212041.
2026-05-16 06:57:09,931 - experiment_functions - INFO - Early stopping at epoch 700. Best Recall: 0.1169
2026-05-16 06:57:10,021 - optuna.study.study - INFO - Trial 102 finished with value: 0.11691222883523467 and parameters: {'n_layers': 1, 'embedding_dim': 256, 'lr': 0.0012575686807698864, 'lambda_val': 5.6898468794683475e-05, 'batch_size': 3737, 'optimizer': 'Adam'}. Best is trial 59 with value: 0.11901431530212041.
2026-05-16 06:57:24,646 - experiment_functions - INFO - Early stopping at epoch 800. Best Recall: 0.1111
