2026-05-16 04:01:22,369 - optuna.study.study - INFO - Trial 27 finished with value: 0.06309404333957842 and parameters: {'n_layers': 2, 'embedding_dim': 128, 'lr': 0.002924078916290603, 'lambda_val': 1.0817336078065842e-06, 'batch_size': 1307, 'optimizer': 'Adam'}. Best is trial 22 with value: 0.08469801185213185.
2026-05-16 04:01:26,066 - experiment_functions - INFO - Early stopping at epoch 500. Best Recall: 0.0023
2026-05-16 04:01:26,176 - optuna.study.study - INFO - Trial 28 finished with value: 0.0023471395759177087 and parameters: {'n_layers': 2, 'embedding_dim': 128, 'lr': 0.00015735255289505058, 'lambda_val': 3.77412397068559e-05, 'batch_size': 938, 'optimizer': 'SGD'}. Best is trial 22 with value: 0.08469801185213185.
2026-05-16 04:01:32,730 - optuna.study._optimize - INFO - Trial 29 pruned. 
2026-05-16 04:01:41,599 - experiment_functions - INFO - Early stopping at epoch 1450. Best Recall: 0.0584
2026-05-16 04:01:41,699 - optuna.study.study - INFO - Trial 30 finished with value: 0.05841657758124848 and parameters: {'n_layers': 3, 'embedding_dim': 64, 'lr': 0.00040158034099458946, 'lambda_val': 1.8393906975030925e-05, 'batch_size': 1579, 'optimizer': 'RMSprop'}. Best is trial 22 with value: 0.08469801185213185.
2026-05-16 04:01:48,835 - experiment_functions - INFO - Early stopping at epoch 1100. Best Recall: 0.0629
2026-05-16 04:01:49,365 - optuna.study.study - INFO - Trial 31 finished with value: 0.06287630213842678 and parameters: {'n_layers': 2, 'embedding_dim': 128, 'lr': 0.0010326642012123603, 'lambda_val': 9.895152288322236e-06, 'batch_size': 828, 'optimizer': 'Adam'}. Best is trial 22 with value: 0.08469801185213185.
2026-05-16 04:01:54,606 - experiment_functions - INFO - Early stopping at epoch 750. Best Recall: 0.0745
2026-05-16 04:01:54,741 - optuna.study.study - INFO - Trial 32 finished with value: 0.07446697964903391 and parameters: {'n_layers': 2, 'embedding_dim': 128, 'lr': 0.0010627493232235187, 'lambda_val': 4.559930578315862e-06, 'batch_size': 742, 'optimizer': 'Adam'}. Best is trial 22 with value: 0.08469801185213185.
2026-05-16 04:02:10,557 - experiment_functions - INFO - Early stopping at epoch 2350. Best Recall: 0.0856
2026-05-16 04:02:11,093 - optuna.study.study - INFO - Trial 33 finished with value: 0.08555708711855788 and parameters: {'n_layers': 2, 'embedding_dim': 256, 'lr': 0.00024070576996569403, 'lambda_val': 4.6879095760393655e-06, 'batch_size': 1234, 'optimizer': 'Adam'}. Best is trial 33 with value: 0.08555708711855788.
2026-05-16 04:02:22,633 - experiment_functions - INFO - Early stopping at epoch 1650. Best Recall: 0.0954
2026-05-16 04:02:22,750 - optuna.study.study - INFO - Trial 34 finished with value: 0.09543609102533222 and parameters: {'n_layers': 2, 'embedding_dim': 256, 'lr': 0.00028710117633469256, 'lambda_val': 1.690564259560175e-06, 'batch_size': 1228, 'optimizer': 'Adam'}. Best is trial 34 with value: 0.09543609102533222.
2026-05-16 04:02:30,735 - optuna.study._optimize - INFO - Trial 35 pruned. 
2026-05-16 04:02:53,504 - experiment_functions - INFO - Early stopping at epoch 3350. Best Recall: 0.1095
2026-05-16 04:02:53,600 - optuna.study.study - INFO - Trial 36 finished with value: 0.1095403465816569 and parameters: {'n_layers': 1, 'embedding_dim': 256, 'lr': 0.00026692523638018913, 'lambda_val': 7.081718881301241e-05, 'batch_size': 2439, 'optimizer': 'Adam'}. Best is trial 36 with value: 0.1095403465816569.
2026-05-16 04:03:02,421 - optuna.study._optimize - INFO - Trial 37 pruned. 
2026-05-16 04:03:09,207 - optuna.study._optimize - INFO - Trial 38 pruned. 
2026-05-16 04:03:26,678 - experiment_functions - INFO - Early stopping at epoch 2700. Best Recall: 0.1274
2026-05-16 04:03:26,818 - optuna.study.study - INFO - Trial 39 finished with value: 0.12736851993270942 and parameters: {'n_layers': 1, 'embedding_dim': 256, 'lr': 0.00029216429501053784, 'lambda_val': 6.673796054130869e-05, 'batch_size': 3272, 'optimizer': 'Adam'}. Best is trial 39 with value: 0.12736851993270942.
2026-05-16 04:03:46,829 - experiment_functions - INFO - Early stopping at epoch 3200. Best Recall: 0.1233
2026-05-16 04:03:46,909 - optuna.study.study - INFO - Trial 40 finished with value: 0.12329706843962805 and parameters: {'n_layers': 1, 'embedding_dim': 256, 'lr': 0.000258905232295874, 'lambda_val': 0.00029082367334012, 'batch_size': 3542, 'optimizer': 'Adam'}. Best is trial 39 with value: 0.12736851993270942.
2026-05-16 04:04:20,397 - optuna.study.study - INFO - Trial 41 finished with value: 0.11456455073615796 and parameters: {'n_layers': 1, 'embedding_dim': 256, 'lr': 0.00027615318827381636, 'lambda_val': 0.000306968495312238, 'batch_size': 3426, 'optimizer': 'Adam'}. Best is trial 39 with value: 0.12736851993270942.
2026-05-16 04:04:36,042 - experiment_functions - INFO - Early stopping at epoch 2500. Best Recall: 0.1137
2026-05-16 04:04:36,132 - optuna.study.study - INFO - Trial 42 finished with value: 0.11373051124864236 and parameters: {'n_layers': 1, 'embedding_dim': 256, 'lr': 0.00029525219698237445, 'lambda_val': 0.00019277511516679568, 'batch_size': 3379, 'optimizer': 'Adam'}. Best is trial 39 with value: 0.12736851993270942.
2026-05-16 04:04:42,599 - optuna.study._optimize - INFO - Trial 43 pruned. 
2026-05-16 04:04:49,859 - optuna.study._optimize - INFO - Trial 44 pruned. 
2026-05-16 04:04:58,564 - experiment_functions - INFO - Early stopping at epoch 1250. Best Recall: 0.1041
2026-05-16 04:04:58,644 - optuna.study.study - INFO - Trial 45 finished with value: 0.10412069472499313 and parameters: {'n_layers': 1, 'embedding_dim': 256, 'lr': 0.00047600723841011703, 'lambda_val': 0.0005584029651253056, 'batch_size': 3962, 'optimizer': 'Adam'}. Best is trial 39 with value: 0.12736851993270942.
2026-05-16 04:05:21,143 - experiment_functions - INFO - Early stopping at epoch 3300. Best Recall: 0.1152
2026-05-16 04:05:21,235 - optuna.study.study - INFO - Trial 46 finished with value: 0.11520958989529849 and parameters: {'n_layers': 1, 'embedding_dim': 256, 'lr': 0.00027037561798635556, 'lambda_val': 0.0003448844875800546, 'batch_size': 3276, 'optimizer': 'Adam'}. Best is trial 39 with value: 0.12736851993270942.
2026-05-16 04:05:24,754 - experiment_functions - INFO - Early stopping at epoch 500. Best Recall: 0.0012
2026-05-16 04:05:24,857 - optuna.study.study - INFO - Trial 47 finished with value: 0.0012084884835034096 and parameters: {'n_layers': 1, 'embedding_dim': 256, 'lr': 7.930762785459227e-05, 'lambda_val': 0.0012826121330880985, 'batch_size': 3288, 'optimizer': 'SGD'}. Best is trial 39 with value: 0.12736851993270942.
2026-05-16 04:05:31,273 - optuna.study._optimize - INFO - Trial 48 pruned. 
2026-05-16 04:05:39,764 - experiment_functions - INFO - Early stopping at epoch 1300. Best Recall: 0.1041
2026-05-16 04:05:39,863 - optuna.study.study - INFO - Trial 49 finished with value: 0.10408712608287826 and parameters: {'n_layers': 1, 'embedding_dim': 256, 'lr': 0.0005377164710782202, 'lambda_val': 0.0008207595645421805, 'batch_size': 3541, 'optimizer': 'Adam'}. Best is trial 39 with value: 0.12736851993270942.
2026-05-16 04:05:46,742 - optuna.study._optimize - INFO - Trial 50 pruned. 
2026-05-16 04:06:03,391 - experiment_functions - INFO - Early stopping at epoch 2650. Best Recall: 0.1139
2026-05-16 04:06:03,489 - optuna.study.study - INFO - Trial 51 finished with value: 0.11392751938161615 and parameters: {'n_layers': 1, 'embedding_dim': 256, 'lr': 0.00029384120960976567, 'lambda_val': 9.283065161711213e-05, 'batch_size': 3205, 'optimizer': 'Adam'}. Best is trial 39 with value: 0.12736851993270942.
2026-05-16 04:06:09,856 - optuna.study._optimize - INFO - Trial 52 pruned. 
2026-05-16 04:06:16,922 - optuna.study._optimize - INFO - Trial 53 pruned. 
2026-05-16 04:06:34,014 - experiment_functions - INFO - Early stopping at epoch 3050. Best Recall: 0.1160
2026-05-16 04:06:34,131 - optuna.study.study - INFO - Trial 54 finished with value: 0.11602841140257264 and parameters: {'n_layers': 1, 'embedding_dim': 256, 'lr': 0.00031699699479422166, 'lambda_val': 5.8736292797204364e-05, 'batch_size': 3056, 'optimizer': 'Adam'}. Best is trial 39 with value: 0.12736851993270942.
2026-05-16 04:06:37,882 - experiment_functions - INFO - Early stopping at epoch 500. Best Recall: 0.0016
2026-05-16 04:06:37,971 - optuna.study.study - INFO - Trial 55 finished with value: 0.0016021617700789812 and parameters: {'n_layers': 1, 'embedding_dim': 96, 'lr': 0.0004621453462585471, 'lambda_val': 6.235259749966257e-05, 'batch_size': 3085, 'optimizer': 'SGD'}. Best is trial 39 with value: 0.12736851993270942.
2026-05-16 04:06:41,691 - experiment_functions - INFO - Early stopping at epoch 500. Best Recall: 0.0030
2026-05-16 04:06:41,782 - optuna.study.study - INFO - Trial 56 finished with value: 0.002979932629636664 and parameters: {'n_layers': 1, 'embedding_dim': 256, 'lr': 5.5550169558723414e-05, 'lambda_val': 9.750312741822895e-05, 'batch_size': 2877, 'optimizer': 'Adam'}. Best is trial 39 with value: 0.12736851993270942.
2026-05-16 04:06:45,961 - experiment_functions - INFO - Early stopping at epoch 600. Best Recall: 0.0889
2026-05-16 04:06:46,051 - optuna.study.study - INFO - Trial 57 finished with value: 0.08885986029407227 and parameters: {'n_layers': 1, 'embedding_dim': 256, 'lr': 0.0029261679513745025, 'lambda_val': 0.00033952545599966454, 'batch_size': 3846, 'optimizer': 'Adam'}. Best is trial 39 with value: 0.12736851993270942.
2026-05-16 04:06:52,504 - optuna.study._optimize - INFO - Trial 58 pruned. 
2026-05-16 04:06:58,509 - experiment_functions - INFO - Early stopping at epoch 950. Best Recall: 0.1191
2026-05-16 04:06:58,609 - optuna.study.study - INFO - Trial 59 finished with value: 0.11905434593316132 and parameters: {'n_layers': 1, 'embedding_dim': 256, 'lr': 0.0008026170598608763, 'lambda_val': 5.2950383746278155e-05, 'batch_size': 2703, 'optimizer': 'Adam'}. Best is trial 39 with value: 0.12736851993270942.
2026-05-16 04:07:05,194 - optuna.study._optimize - INFO - Trial 60 pruned. 
2026-05-16 04:07:13,260 - experiment_functions - INFO - Early stopping at epoch 1200. Best Recall: 0.1288
2026-05-16 04:07:13,368 - optuna.study.study - INFO - Trial 61 finished with value: 0.12881201604315629 and parameters: {'n_layers': 1, 'embedding_dim': 256, 'lr': 0.0005645066087350816, 'lambda_val': 0.00011495579921205091, 'batch_size': 3165, 'optimizer': 'Adam'}. Best is trial 61 with value: 0.12881201604315629.
2026-05-16 04:07:18,544 - experiment_functions - INFO - Early stopping at epoch 750. Best Recall: 0.1240
2026-05-16 04:07:18,689 - optuna.study.study - INFO - Trial 62 finished with value: 0.12395852764731281 and parameters: {'n_layers': 1, 'embedding_dim': 256, 'lr': 0.0012842575158957036, 'lambda_val': 2.5274466118744733e-05, 'batch_size': 2697, 'optimizer': 'Adam'}. Best is trial 61 with value: 0.12881201604315629.
2026-05-16 04:07:22,986 - experiment_functions - INFO - Early stopping at epoch 650. Best Recall: 0.1134
2026-05-16 04:07:23,075 - optuna.study.study - INFO - Trial 63 finished with value: 0.11340304020383385 and parameters: {'n_layers': 1, 'embedding_dim': 256, 'lr': 0.001494020483936966, 'lambda_val': 2.208093390566194e-05, 'batch_size': 2678, 'optimizer': 'Adam'}. Best is trial 61 with value: 0.12881201604315629.
2026-05-16 04:07:27,267 - experiment_functions - INFO - Early stopping at epoch 600. Best Recall: 0.1024
2026-05-16 04:07:27,357 - optuna.study.study - INFO - Trial 64 finished with value: 0.1024362279935499 and parameters: {'n_layers': 1, 'embedding_dim': 256, 'lr': 0.0033595502855276417, 'lambda_val': 0.00011253833116788891, 'batch_size': 2295, 'optimizer': 'Adam'}. Best is trial 61 with value: 0.12881201604315629.
2026-05-16 04:07:34,023 - experiment_functions - INFO - Early stopping at epoch 750. Best Recall: 0.0987
2026-05-16 04:07:34,134 - optuna.study.study - INFO - Trial 65 finished with value: 0.09874028180196953 and parameters: {'n_layers': 1, 'embedding_dim': 64, 'lr': 0.0018557404240656082, 'lambda_val': 4.952406245306249e-05, 'batch_size': 2964, 'optimizer': 'Adam'}. Best is trial 61 with value: 0.12881201604315629.
2026-05-16 04:07:37,406 - experiment_functions - INFO - Early stopping at epoch 500. Best Recall: 0.0017
2026-05-16 04:07:37,507 - optuna.study.study - INFO - Trial 66 finished with value: 0.0017330562279615413 and parameters: {'n_layers': 1, 'embedding_dim': 96, 'lr': 0.000609263382511427, 'lambda_val': 2.555988243141996e-05, 'batch_size': 3155, 'optimizer': 'SGD'}. Best is trial 61 with value: 0.12881201604315629.
2026-05-16 04:07:45,130 - experiment_functions - INFO - Early stopping at epoch 1150. Best Recall: 0.1153
2026-05-16 04:07:45,264 - optuna.study.study - INFO - Trial 67 finished with value: 0.115283439705429 and parameters: {'n_layers': 1, 'embedding_dim': 256, 'lr': 0.0008130749951903813, 'lambda_val': 0.00014645996252728643, 'batch_size': 2770, 'optimizer': 'Adam'}. Best is trial 61 with value: 0.12881201604315629.
2026-05-16 04:07:50,752 - experiment_functions - INFO - Early stopping at epoch 750. Best Recall: 0.1047
2026-05-16 04:07:50,832 - optuna.study.study - INFO - Trial 68 finished with value: 0.10469664528102017 and parameters: {'n_layers': 1, 'embedding_dim': 256, 'lr': 0.001317800820077808, 'lambda_val': 5.6091478660977996e-05, 'batch_size': 2721, 'optimizer': 'Adam'}. Best is trial 61 with value: 0.12881201604315629.
2026-05-16 04:07:56,213 - experiment_functions - INFO - Early stopping at epoch 550. Best Recall: 0.0213
2026-05-16 04:07:56,313 - optuna.study.study - INFO - Trial 69 finished with value: 0.02131369998805083 and parameters: {'n_layers': 4, 'embedding_dim': 256, 'lr': 0.0009146118249811633, 'lambda_val': 8.696929894026902e-06, 'batch_size': 2595, 'optimizer': 'RMSprop'}. Best is trial 61 with value: 0.12881201604315629.
2026-05-16 04:08:00,482 - experiment_functions - INFO - Early stopping at epoch 550. Best Recall: 0.1114
2026-05-16 04:08:00,582 - optuna.study.study - INFO - Trial 70 finished with value: 0.1114321779643385 and parameters: {'n_layers': 1, 'embedding_dim': 256, 'lr': 0.004145582790226478, 'lambda_val': 1.6281636019133683e-05, 'batch_size': 2404, 'optimizer': 'Adam'}. Best is trial 61 with value: 0.12881201604315629.
2026-05-16 04:08:05,215 - experiment_functions - INFO - Early stopping at epoch 650. Best Recall: 0.1115
2026-05-16 04:08:05,326 - optuna.study.study - INFO - Trial 71 finished with value: 0.11146127415617586 and parameters: {'n_layers': 1, 'embedding_dim': 256, 'lr': 0.00242808199244232, 'lambda_val': 0.0001276574678481717, 'batch_size': 3639, 'optimizer': 'Adam'}. Best is trial 61 with value: 0.12881201604315629.
2026-05-16 04:08:18,503 - experiment_functions - INFO - Early stopping at epoch 1950. Best Recall: 0.1156
2026-05-16 04:08:18,593 - optuna.study.study - INFO - Trial 72 finished with value: 0.115559793960215 and parameters: {'n_layers': 1, 'embedding_dim': 256, 'lr': 0.00040653429440172317, 'lambda_val': 0.0005355169337866586, 'batch_size': 2912, 'optimizer': 'Adam'}. Best is trial 61 with value: 0.12881201604315629.
2026-05-16 04:08:33,932 - experiment_functions - INFO - Early stopping at epoch 2150. Best Recall: 0.1204
2026-05-16 04:08:34,022 - optuna.study.study - INFO - Trial 73 finished with value: 0.12042549489627738 and parameters: {'n_layers': 1, 'embedding_dim': 256, 'lr': 0.00038313026067018734, 'lambda_val': 0.0005983887798418024, 'batch_size': 2934, 'optimizer': 'Adam'}. Best is trial 61 with value: 0.12881201604315629.
2026-05-16 04:08:42,528 - optuna.study._optimize - INFO - Trial 74 pruned. 
2026-05-16 04:08:48,705 - optuna.study._optimize - INFO - Trial 75 pruned. 
2026-05-16 04:08:54,419 - experiment_functions - INFO - Early stopping at epoch 850. Best Recall: 0.1183
2026-05-16 04:08:54,510 - optuna.study.study - INFO - Trial 76 finished with value: 0.11834646772420891 and parameters: {'n_layers': 1, 'embedding_dim': 256, 'lr': 0.001206450467169071, 'lambda_val': 0.0007102049838476797, 'batch_size': 2871, 'optimizer': 'Adam'}. Best is trial 61 with value: 0.12881201604315629.
2026-05-16 04:08:59,999 - optuna.study._optimize - INFO - Trial 77 pruned. 
2026-05-16 04:09:04,590 - experiment_functions - INFO - Early stopping at epoch 650. Best Recall: 0.0209
2026-05-16 04:09:04,689 - optuna.study.study - INFO - Trial 78 finished with value: 0.020881850189220633 and parameters: {'n_layers': 1, 'embedding_dim': 96, 'lr': 0.08561760915590307, 'lambda_val': 3.463738083571055e-05, 'batch_size': 2830, 'optimizer': 'Adam'}. Best is trial 61 with value: 0.12881201604315629.
2026-05-16 04:09:09,239 - experiment_functions - INFO - Early stopping at epoch 600. Best Recall: 0.0833
2026-05-16 04:09:09,334 - optuna.study.study - INFO - Trial 79 finished with value: 0.08329555648859197 and parameters: {'n_layers': 1, 'embedding_dim': 256, 'lr': 0.0016617576930077244, 'lambda_val': 0.0017519481637417085, 'batch_size': 2650, 'optimizer': 'RMSprop'}. Best is trial 61 with value: 0.12881201604315629.
2026-05-16 04:09:13,018 - experiment_functions - INFO - Early stopping at epoch 500. Best Recall: 0.0031
2026-05-16 04:09:13,116 - optuna.study.study - INFO - Trial 80 finished with value: 0.003143467189412379 and parameters: {'n_layers': 1, 'embedding_dim': 256, 'lr': 0.0005279682763329669, 'lambda_val': 0.0007905853756394164, 'batch_size': 3127, 'optimizer': 'SGD'}. Best is trial 61 with value: 0.12881201604315629.
2026-05-16 04:09:25,885 - experiment_functions - INFO - Early stopping at epoch 2000. Best Recall: 0.1232
2026-05-16 04:09:25,975 - optuna.study.study - INFO - Trial 81 finished with value: 0.12315476562126101 and parameters: {'n_layers': 1, 'embedding_dim': 256, 'lr': 0.0003540980645230124, 'lambda_val': 0.0004611395078313107, 'batch_size': 2941, 'optimizer': 'Adam'}. Best is trial 61 with value: 0.12881201604315629.
2026-05-16 04:09:32,354 - optuna.study._optimize - INFO - Trial 82 pruned. 
2026-05-16 04:09:38,463 - experiment_functions - INFO - Early stopping at epoch 850. Best Recall: 0.1137
2026-05-16 04:09:38,564 - optuna.study.study - INFO - Trial 83 finished with value: 0.11370791184735177 and parameters: {'n_layers': 1, 'embedding_dim': 256, 'lr': 0.0011924290730659258, 'lambda_val': 0.00023973930159692643, 'batch_size': 3230, 'optimizer': 'Adam'}. Best is trial 61 with value: 0.12881201604315629.
2026-05-16 04:09:45,560 - optuna.study._optimize - INFO - Trial 84 pruned. 
2026-05-16 04:10:04,559 - experiment_functions - INFO - Early stopping at epoch 3000. Best Recall: 0.1144
2026-05-16 04:10:04,661 - optuna.study.study - INFO - Trial 85 finished with value: 0.11440330788915772 and parameters: {'n_layers': 1, 'embedding_dim': 256, 'lr': 0.0003347812758796185, 'lambda_val': 4.349171919255777e-05, 'batch_size': 3464, 'optimizer': 'Adam'}. Best is trial 61 with value: 0.12881201604315629.
2026-05-16 04:10:10,879 - experiment_functions - INFO - Early stopping at epoch 950. Best Recall: 0.1119
2026-05-16 04:10:11,022 - optuna.study.study - INFO - Trial 86 finished with value: 0.11192874844668264 and parameters: {'n_layers': 1, 'embedding_dim': 256, 'lr': 0.0008968290404048464, 'lambda_val': 0.00020720965965316141, 'batch_size': 2489, 'optimizer': 'Adam'}. Best is trial 61 with value: 0.12881201604315629.
2026-05-16 04:10:17,703 - optuna.study._optimize - INFO - Trial 87 pruned. 
2026-05-16 04:10:24,360 - experiment_functions - INFO - Early stopping at epoch 1000. Best Recall: 0.1085
2026-05-16 04:10:24,440 - optuna.study.study - INFO - Trial 88 finished with value: 0.10845553553827737 and parameters: {'n_layers': 1, 'embedding_dim': 256, 'lr': 0.0006626865641189804, 'lambda_val': 0.004370222651361497, 'batch_size': 2604, 'optimizer': 'Adam'}. Best is trial 61 with value: 0.12881201604315629.
2026-05-16 04:10:29,021 - experiment_functions - INFO - Early stopping at epoch 750. Best Recall: 0.0990
2026-05-16 04:10:29,099 - optuna.study.study - INFO - Trial 89 finished with value: 0.09899483038321392 and parameters: {'n_layers': 1, 'embedding_dim': 64, 'lr': 0.0023848421740004146, 'lambda_val': 7.004565030906391e-05, 'batch_size': 2065, 'optimizer': 'Adam'}. Best is trial 61 with value: 0.12881201604315629.
2026-05-16 04:10:35,961 - optuna.study._optimize - INFO - Trial 90 pruned. 
2026-05-16 04:10:53,796 - experiment_functions - INFO - Early stopping at epoch 2850. Best Recall: 0.1179
2026-05-16 04:10:53,916 - optuna.study.study - INFO - Trial 91 finished with value: 0.11792407181308825 and parameters: {'n_layers': 1, 'embedding_dim': 256, 'lr': 0.0003650366515925024, 'lambda_val': 0.0006514016765189587, 'batch_size': 2929, 'optimizer': 'Adam'}. Best is trial 61 with value: 0.12881201604315629.
2026-05-16 04:11:05,316 - optuna.study._optimize - INFO - Trial 92 pruned. 
2026-05-16 04:11:09,351 - experiment_functions - INFO - Early stopping at epoch 550. Best Recall: 0.0618
2026-05-16 04:11:09,452 - optuna.study.study - INFO - Trial 93 finished with value: 0.06180663033793937 and parameters: {'n_layers': 1, 'embedding_dim': 256, 'lr': 0.011665481859090113, 'lambda_val': 0.0004184651927768499, 'batch_size': 3065, 'optimizer': 'Adam'}. Best is trial 61 with value: 0.12881201604315629.
2026-05-16 04:11:16,785 - optuna.study._optimize - INFO - Trial 94 pruned. 
2026-05-16 04:11:25,203 - experiment_functions - INFO - Early stopping at epoch 1350. Best Recall: 0.1098
2026-05-16 04:11:25,293 - optuna.study.study - INFO - Trial 95 finished with value: 0.10983585426759336 and parameters: {'n_layers': 1, 'embedding_dim': 256, 'lr': 0.00045938256943604865, 'lambda_val': 0.0011741132875200799, 'batch_size': 3568, 'optimizer': 'Adam'}. Best is trial 61 with value: 0.12881201604315629.
2026-05-16 04:11:31,900 - optuna.study._optimize - INFO - Trial 96 pruned. 
2026-05-16 04:11:37,724 - optuna.study._optimize - INFO - Trial 97 pruned. 
2026-05-16 04:11:43,336 - experiment_functions - INFO - Early stopping at epoch 850. Best Recall: 0.1053
