2026-05-16 00:59:36,419 - optuna.study.study - INFO - Trial 211 finished with value: 0.020282727372062832 and parameters: {'n_layers': 1, 'embedding_dim': 64, 'lr': 0.004349890461356063, 'lambda_val': 8.687147015693952e-05, 'batch_size': 863, 'optimizer': 'Adam'}. Best is trial 75 with value: 0.02482134338591816.
2026-05-16 00:59:39,850 - experiment_functions - INFO - Early stopping at epoch 550. Best Recall: 0.0247
2026-05-16 00:59:39,954 - optuna.study.study - INFO - Trial 212 finished with value: 0.024722551426909656 and parameters: {'n_layers': 1, 'embedding_dim': 64, 'lr': 0.005646059122224134, 'lambda_val': 0.0001008383889528656, 'batch_size': 806, 'optimizer': 'Adam'}. Best is trial 75 with value: 0.02482134338591816.
2026-05-16 00:59:43,307 - experiment_functions - INFO - Early stopping at epoch 550. Best Recall: 0.0181
2026-05-16 00:59:43,398 - optuna.study.study - INFO - Trial 213 finished with value: 0.018105845900329914 and parameters: {'n_layers': 1, 'embedding_dim': 64, 'lr': 0.003683460966225264, 'lambda_val': 0.00015319334953661738, 'batch_size': 977, 'optimizer': 'Adam'}. Best is trial 75 with value: 0.02482134338591816.
2026-05-16 00:59:47,615 - experiment_functions - INFO - Early stopping at epoch 550. Best Recall: 0.0195
2026-05-16 00:59:47,716 - optuna.study.study - INFO - Trial 214 finished with value: 0.019536771655527328 and parameters: {'n_layers': 1, 'embedding_dim': 64, 'lr': 0.004817257816848814, 'lambda_val': 0.00010347244401713778, 'batch_size': 791, 'optimizer': 'Adam'}. Best is trial 75 with value: 0.02482134338591816.
2026-05-16 00:59:51,525 - experiment_functions - INFO - Early stopping at epoch 600. Best Recall: 0.0166
2026-05-16 00:59:51,605 - optuna.study.study - INFO - Trial 215 finished with value: 0.01662539130511705 and parameters: {'n_layers': 1, 'embedding_dim': 64, 'lr': 0.0030235788070543932, 'lambda_val': 0.0001329102269567263, 'batch_size': 867, 'optimizer': 'Adam'}. Best is trial 75 with value: 0.02482134338591816.
2026-05-16 00:59:54,936 - experiment_functions - INFO - Early stopping at epoch 550. Best Recall: 0.0184
2026-05-16 00:59:55,015 - optuna.study.study - INFO - Trial 216 finished with value: 0.018352504483479543 and parameters: {'n_layers': 1, 'embedding_dim': 96, 'lr': 0.007777392918500933, 'lambda_val': 5.0438773394171094e-05, 'batch_size': 751, 'optimizer': 'Adam'}. Best is trial 75 with value: 0.02482134338591816.
2026-05-16 00:59:58,340 - experiment_functions - INFO - Early stopping at epoch 550. Best Recall: 0.0187
2026-05-16 00:59:58,441 - optuna.study.study - INFO - Trial 217 finished with value: 0.01870203514553114 and parameters: {'n_layers': 1, 'embedding_dim': 32, 'lr': 0.005667177866140712, 'lambda_val': 9.83070917080996e-05, 'batch_size': 699, 'optimizer': 'Adam'}. Best is trial 75 with value: 0.02482134338591816.
2026-05-16 01:00:04,461 - experiment_functions - INFO - Early stopping at epoch 1000. Best Recall: 0.0149
2026-05-16 01:00:04,562 - optuna.study.study - INFO - Trial 218 finished with value: 0.014867841072778998 and parameters: {'n_layers': 1, 'embedding_dim': 256, 'lr': 0.00038220586825938186, 'lambda_val': 6.56512650397317e-05, 'batch_size': 933, 'optimizer': 'RMSprop'}. Best is trial 75 with value: 0.02482134338591816.
2026-05-16 01:00:07,538 - experiment_functions - INFO - Early stopping at epoch 500. Best Recall: 0.0030
2026-05-16 01:00:07,639 - optuna.study.study - INFO - Trial 219 finished with value: 0.0029695930235724933 and parameters: {'n_layers': 1, 'embedding_dim': 64, 'lr': 0.002521644729925963, 'lambda_val': 3.819305270536723e-05, 'batch_size': 577, 'optimizer': 'SGD'}. Best is trial 75 with value: 0.02482134338591816.
2026-05-16 01:00:11,160 - experiment_functions - INFO - Early stopping at epoch 550. Best Recall: 0.0173
2026-05-16 01:00:11,260 - optuna.study.study - INFO - Trial 220 finished with value: 0.017347799319648357 and parameters: {'n_layers': 1, 'embedding_dim': 64, 'lr': 0.004200947492930228, 'lambda_val': 2.561700366749981e-05, 'batch_size': 789, 'optimizer': 'Adam'}. Best is trial 75 with value: 0.02482134338591816.
2026-05-16 01:00:14,813 - experiment_functions - INFO - Early stopping at epoch 550. Best Recall: 0.0179
2026-05-16 01:00:14,914 - optuna.study.study - INFO - Trial 221 finished with value: 0.017853502817253872 and parameters: {'n_layers': 1, 'embedding_dim': 64, 'lr': 0.006372649115598855, 'lambda_val': 8.173511078626345e-05, 'batch_size': 647, 'optimizer': 'Adam'}. Best is trial 75 with value: 0.02482134338591816.
2026-05-16 01:00:18,987 - experiment_functions - INFO - Early stopping at epoch 550. Best Recall: 0.0226
2026-05-16 01:00:19,108 - optuna.study.study - INFO - Trial 222 finished with value: 0.02260638201313641 and parameters: {'n_layers': 1, 'embedding_dim': 64, 'lr': 0.007310927939445623, 'lambda_val': 6.987436872146222e-05, 'batch_size': 582, 'optimizer': 'Adam'}. Best is trial 75 with value: 0.02482134338591816.
2026-05-16 01:00:22,583 - experiment_functions - INFO - Early stopping at epoch 550. Best Recall: 0.0170
2026-05-16 01:00:22,686 - optuna.study.study - INFO - Trial 223 finished with value: 0.016961003220574332 and parameters: {'n_layers': 1, 'embedding_dim': 64, 'lr': 0.009127410836372517, 'lambda_val': 4.790317351742701e-05, 'batch_size': 563, 'optimizer': 'Adam'}. Best is trial 75 with value: 0.02482134338591816.
2026-05-16 01:00:25,675 - experiment_functions - INFO - Early stopping at epoch 550. Best Recall: 0.0138
2026-05-16 01:00:25,766 - optuna.study.study - INFO - Trial 224 finished with value: 0.013831807276616273 and parameters: {'n_layers': 1, 'embedding_dim': 64, 'lr': 0.0055064642717186025, 'lambda_val': 0.0001079762506215399, 'batch_size': 518, 'optimizer': 'Adam'}. Best is trial 75 with value: 0.02482134338591816.
2026-05-16 01:00:28,749 - experiment_functions - INFO - Early stopping at epoch 550. Best Recall: 0.0142
2026-05-16 01:00:28,849 - optuna.study.study - INFO - Trial 225 finished with value: 0.014180657629360313 and parameters: {'n_layers': 1, 'embedding_dim': 64, 'lr': 0.007337594949570848, 'lambda_val': 6.351220167086078e-05, 'batch_size': 720, 'optimizer': 'Adam'}. Best is trial 75 with value: 0.02482134338591816.
2026-05-16 01:00:33,606 - experiment_functions - INFO - Early stopping at epoch 600. Best Recall: 0.0201
2026-05-16 01:00:33,706 - optuna.study.study - INFO - Trial 226 finished with value: 0.020114461465907996 and parameters: {'n_layers': 1, 'embedding_dim': 64, 'lr': 0.0035917720732008395, 'lambda_val': 7.192203874609784e-05, 'batch_size': 602, 'optimizer': 'Adam'}. Best is trial 75 with value: 0.02482134338591816.
2026-05-16 01:00:37,214 - experiment_functions - INFO - Early stopping at epoch 550. Best Recall: 0.0228
2026-05-16 01:00:37,327 - optuna.study.study - INFO - Trial 227 finished with value: 0.022783454894182157 and parameters: {'n_layers': 1, 'embedding_dim': 256, 'lr': 0.004888392441171877, 'lambda_val': 4.813010896709735e-05, 'batch_size': 670, 'optimizer': 'Adam'}. Best is trial 75 with value: 0.02482134338591816.
2026-05-16 01:00:40,970 - experiment_functions - INFO - Early stopping at epoch 550. Best Recall: 0.0216
2026-05-16 01:00:41,081 - optuna.study.study - INFO - Trial 228 finished with value: 0.021554072323455752 and parameters: {'n_layers': 1, 'embedding_dim': 256, 'lr': 0.004687819837329644, 'lambda_val': 5.1302630007351813e-05, 'batch_size': 693, 'optimizer': 'Adam'}. Best is trial 75 with value: 0.02482134338591816.
2026-05-16 01:00:44,725 - experiment_functions - INFO - Early stopping at epoch 550. Best Recall: 0.0220
2026-05-16 01:00:44,829 - optuna.study.study - INFO - Trial 229 finished with value: 0.02204023104662829 and parameters: {'n_layers': 1, 'embedding_dim': 256, 'lr': 0.004644858554596214, 'lambda_val': 0.00016987326177789517, 'batch_size': 828, 'optimizer': 'Adam'}. Best is trial 75 with value: 0.02482134338591816.
2026-05-16 01:00:48,868 - experiment_functions - INFO - Early stopping at epoch 550. Best Recall: 0.0212
2026-05-16 01:00:48,972 - optuna.study.study - INFO - Trial 230 finished with value: 0.021157334269098212 and parameters: {'n_layers': 1, 'embedding_dim': 256, 'lr': 0.004116974926631441, 'lambda_val': 0.000142810200493605, 'batch_size': 839, 'optimizer': 'Adam'}. Best is trial 75 with value: 0.02482134338591816.
2026-05-16 01:00:52,722 - experiment_functions - INFO - Early stopping at epoch 550. Best Recall: 0.0178
2026-05-16 01:00:52,824 - optuna.study.study - INFO - Trial 231 finished with value: 0.017823709300751354 and parameters: {'n_layers': 1, 'embedding_dim': 256, 'lr': 0.0040019358199246515, 'lambda_val': 0.00018684845155891763, 'batch_size': 840, 'optimizer': 'Adam'}. Best is trial 75 with value: 0.02482134338591816.
2026-05-16 01:00:56,517 - experiment_functions - INFO - Early stopping at epoch 550. Best Recall: 0.0166
2026-05-16 01:00:56,620 - optuna.study.study - INFO - Trial 232 finished with value: 0.01664750843067531 and parameters: {'n_layers': 1, 'embedding_dim': 256, 'lr': 0.003294598555232423, 'lambda_val': 0.00014728516910957707, 'batch_size': 936, 'optimizer': 'Adam'}. Best is trial 75 with value: 0.02482134338591816.
2026-05-16 01:01:00,260 - experiment_functions - INFO - Early stopping at epoch 550. Best Recall: 0.0171
2026-05-16 01:01:00,351 - optuna.study.study - INFO - Trial 233 finished with value: 0.017063867373306035 and parameters: {'n_layers': 1, 'embedding_dim': 256, 'lr': 0.0044768408648247415, 'lambda_val': 0.00022177774367620752, 'batch_size': 826, 'optimizer': 'Adam'}. Best is trial 75 with value: 0.02482134338591816.
2026-05-16 01:01:04,247 - experiment_functions - INFO - Early stopping at epoch 550. Best Recall: 0.0199
2026-05-16 01:01:04,339 - optuna.study.study - INFO - Trial 234 finished with value: 0.01994632921199311 and parameters: {'n_layers': 1, 'embedding_dim': 256, 'lr': 0.0049863419884656, 'lambda_val': 0.00011249590789347217, 'batch_size': 762, 'optimizer': 'Adam'}. Best is trial 75 with value: 0.02482134338591816.
2026-05-16 01:01:08,035 - experiment_functions - INFO - Early stopping at epoch 550. Best Recall: 0.0154
2026-05-16 01:01:08,134 - optuna.study.study - INFO - Trial 235 finished with value: 0.015383490456941939 and parameters: {'n_layers': 1, 'embedding_dim': 256, 'lr': 0.005562634239560532, 'lambda_val': 0.00016665582996476592, 'batch_size': 886, 'optimizer': 'Adam'}. Best is trial 75 with value: 0.02482134338591816.
2026-05-16 01:01:11,952 - experiment_functions - INFO - Early stopping at epoch 550. Best Recall: 0.0209
2026-05-16 01:01:12,032 - optuna.study.study - INFO - Trial 236 finished with value: 0.020856217320101896 and parameters: {'n_layers': 1, 'embedding_dim': 256, 'lr': 0.003650479616848385, 'lambda_val': 9.404300051651014e-05, 'batch_size': 719, 'optimizer': 'Adam'}. Best is trial 75 with value: 0.02482134338591816.
2026-05-16 01:01:16,221 - experiment_functions - INFO - Early stopping at epoch 550. Best Recall: 0.0115
2026-05-16 01:01:16,311 - optuna.study.study - INFO - Trial 237 finished with value: 0.011451811486376032 and parameters: {'n_layers': 1, 'embedding_dim': 256, 'lr': 0.007049994026820433, 'lambda_val': 0.00013135849235405137, 'batch_size': 3187, 'optimizer': 'Adam'}. Best is trial 75 with value: 0.02482134338591816.
2026-05-16 01:01:20,283 - experiment_functions - INFO - Early stopping at epoch 550. Best Recall: 0.0178
2026-05-16 01:01:20,386 - optuna.study.study - INFO - Trial 238 finished with value: 0.0178002812260835 and parameters: {'n_layers': 1, 'embedding_dim': 256, 'lr': 0.0027903867422420436, 'lambda_val': 7.922050661037285e-05, 'batch_size': 786, 'optimizer': 'Adam'}. Best is trial 75 with value: 0.02482134338591816.
2026-05-16 01:01:23,984 - experiment_functions - INFO - Early stopping at epoch 550. Best Recall: 0.0174
2026-05-16 01:01:24,084 - optuna.study.study - INFO - Trial 239 finished with value: 0.01736665144599783 and parameters: {'n_layers': 1, 'embedding_dim': 256, 'lr': 0.004347221986612993, 'lambda_val': 0.00011787379763304983, 'batch_size': 683, 'optimizer': 'Adam'}. Best is trial 75 with value: 0.02482134338591816.
2026-05-16 01:01:27,708 - experiment_functions - INFO - Early stopping at epoch 550. Best Recall: 0.0189
2026-05-16 01:01:27,808 - optuna.study.study - INFO - Trial 240 finished with value: 0.01885853635156136 and parameters: {'n_layers': 1, 'embedding_dim': 256, 'lr': 0.005636757243093504, 'lambda_val': 4.802071807986146e-05, 'batch_size': 828, 'optimizer': 'Adam'}. Best is trial 75 with value: 0.02482134338591816.
2026-05-16 01:01:31,401 - experiment_functions - INFO - Early stopping at epoch 550. Best Recall: 0.0208
2026-05-16 01:01:31,491 - optuna.study.study - INFO - Trial 241 finished with value: 0.020800230248745114 and parameters: {'n_layers': 1, 'embedding_dim': 256, 'lr': 0.003522059782397087, 'lambda_val': 9.526623836058101e-05, 'batch_size': 730, 'optimizer': 'Adam'}. Best is trial 75 with value: 0.02482134338591816.
2026-05-16 01:01:35,557 - experiment_functions - INFO - Early stopping at epoch 550. Best Recall: 0.0133
2026-05-16 01:01:35,680 - optuna.study.study - INFO - Trial 242 finished with value: 0.013304357009775237 and parameters: {'n_layers': 2, 'embedding_dim': 256, 'lr': 0.0037167323075765067, 'lambda_val': 7.150597112102256e-05, 'batch_size': 716, 'optimizer': 'Adam'}. Best is trial 75 with value: 0.02482134338591816.
2026-05-16 01:01:41,360 - experiment_functions - INFO - Early stopping at epoch 550. Best Recall: 0.0134
2026-05-16 01:01:41,461 - optuna.study.study - INFO - Trial 243 finished with value: 0.013389024776945396 and parameters: {'n_layers': 1, 'embedding_dim': 256, 'lr': 0.004760024727956431, 'lambda_val': 9.192707431919159e-05, 'batch_size': 681, 'optimizer': 'Adam'}. Best is trial 75 with value: 0.02482134338591816.
2026-05-16 01:01:45,934 - experiment_functions - INFO - Early stopping at epoch 550. Best Recall: 0.0093
2026-05-16 01:01:46,034 - optuna.study.study - INFO - Trial 244 finished with value: 0.00928752663742629 and parameters: {'n_layers': 4, 'embedding_dim': 256, 'lr': 0.00315858256561982, 'lambda_val': 6.0306357765549365e-05, 'batch_size': 780, 'optimizer': 'Adam'}. Best is trial 75 with value: 0.02482134338591816.
2026-05-16 01:01:49,770 - experiment_functions - INFO - Early stopping at epoch 550. Best Recall: 0.0207
2026-05-16 01:01:49,859 - optuna.study.study - INFO - Trial 245 finished with value: 0.020736821371382327 and parameters: {'n_layers': 1, 'embedding_dim': 256, 'lr': 0.004074546899257373, 'lambda_val': 0.0001542709420099763, 'batch_size': 639, 'optimizer': 'Adam'}. Best is trial 75 with value: 0.02482134338591816.
2026-05-16 01:01:53,691 - experiment_functions - INFO - Early stopping at epoch 550. Best Recall: 0.0173
2026-05-16 01:01:54,002 - optuna.study.study - INFO - Trial 246 finished with value: 0.01726812453266669 and parameters: {'n_layers': 1, 'embedding_dim': 256, 'lr': 0.0061990849553985395, 'lambda_val': 8.870160884494628e-05, 'batch_size': 722, 'optimizer': 'Adam'}. Best is trial 75 with value: 0.02482134338591816.
2026-05-16 01:01:57,639 - experiment_functions - INFO - Early stopping at epoch 550. Best Recall: 0.0115
2026-05-16 01:01:57,731 - optuna.study.study - INFO - Trial 247 finished with value: 0.011450769544470506 and parameters: {'n_layers': 1, 'embedding_dim': 256, 'lr': 0.007895910430799827, 'lambda_val': 0.00011406637389229023, 'batch_size': 851, 'optimizer': 'Adam'}. Best is trial 75 with value: 0.02482134338591816.
2026-05-16 01:02:01,286 - experiment_functions - INFO - Early stopping at epoch 550. Best Recall: 0.0189
2026-05-16 01:02:01,387 - optuna.study.study - INFO - Trial 248 finished with value: 0.018884517191553176 and parameters: {'n_layers': 1, 'embedding_dim': 256, 'lr': 0.004831318050173974, 'lambda_val': 5.8465518554424766e-05, 'batch_size': 1014, 'optimizer': 'Adam'}. Best is trial 75 with value: 0.02482134338591816.
2026-05-16 01:02:04,916 - experiment_functions - INFO - Early stopping at epoch 550. Best Recall: 0.0216
2026-05-16 01:02:04,997 - optuna.study.study - INFO - Trial 249 finished with value: 0.021637637511017358 and parameters: {'n_layers': 1, 'embedding_dim': 256, 'lr': 0.005384969183189254, 'lambda_val': 4.2343819931236816e-05, 'batch_size': 632, 'optimizer': 'Adam'}. Best is trial 75 with value: 0.02482134338591816.
2026-05-16 01:02:11,484 - experiment_functions - INFO - Early stopping at epoch 550. Best Recall: 0.0203
2026-05-16 01:02:11,575 - optuna.study.study - INFO - Trial 250 finished with value: 0.02033517302144647 and parameters: {'n_layers': 1, 'embedding_dim': 256, 'lr': 0.006025793219075133, 'lambda_val': 3.75024946367942e-05, 'batch_size': 614, 'optimizer': 'Adam'}. Best is trial 75 with value: 0.02482134338591816.
2026-05-16 01:02:15,085 - experiment_functions - INFO - Early stopping at epoch 550. Best Recall: 0.0135
2026-05-16 01:02:15,253 - optuna.study.study - INFO - Trial 251 finished with value: 0.013476640900119215 and parameters: {'n_layers': 1, 'embedding_dim': 256, 'lr': 0.010181145130321355, 'lambda_val': 4.090795373597849e-05, 'batch_size': 657, 'optimizer': 'Adam'}. Best is trial 75 with value: 0.02482134338591816.
2026-05-16 01:02:18,955 - experiment_functions - INFO - Early stopping at epoch 550. Best Recall: 0.0119
2026-05-16 01:02:19,076 - optuna.study.study - INFO - Trial 252 finished with value: 0.01185976831684493 and parameters: {'n_layers': 1, 'embedding_dim': 256, 'lr': 0.007810902885849744, 'lambda_val': 5.705931357456157e-05, 'batch_size': 599, 'optimizer': 'Adam'}. Best is trial 75 with value: 0.02482134338591816.
2026-05-16 01:02:22,765 - experiment_functions - INFO - Early stopping at epoch 550. Best Recall: 0.0191
2026-05-16 01:02:22,866 - optuna.study.study - INFO - Trial 253 finished with value: 0.019137991405936382 and parameters: {'n_layers': 1, 'embedding_dim': 256, 'lr': 0.005088954320451953, 'lambda_val': 4.275308074757597e-05, 'batch_size': 766, 'optimizer': 'Adam'}. Best is trial 75 with value: 0.02482134338591816.
2026-05-16 01:02:27,035 - experiment_functions - INFO - Early stopping at epoch 550. Best Recall: 0.0170
2026-05-16 01:02:27,146 - optuna.study.study - INFO - Trial 254 finished with value: 0.0170140354073141 and parameters: {'n_layers': 1, 'embedding_dim': 64, 'lr': 0.00704096782286125, 'lambda_val': 4.8329105220073856e-05, 'batch_size': 927, 'optimizer': 'Adam'}. Best is trial 75 with value: 0.02482134338591816.
2026-05-16 01:02:30,968 - experiment_functions - INFO - Early stopping at epoch 550. Best Recall: 0.0142
2026-05-16 01:02:31,060 - optuna.study.study - INFO - Trial 255 finished with value: 0.014182112406009792 and parameters: {'n_layers': 1, 'embedding_dim': 256, 'lr': 0.005597600275120293, 'lambda_val': 7.250637385185289e-05, 'batch_size': 680, 'optimizer': 'Adam'}. Best is trial 75 with value: 0.02482134338591816.
2026-05-16 01:02:33,962 - experiment_functions - INFO - Early stopping at epoch 500. Best Recall: 0.0015
2026-05-16 01:02:34,042 - optuna.study.study - INFO - Trial 256 finished with value: 0.0014876695845501841 and parameters: {'n_layers': 1, 'embedding_dim': 64, 'lr': 0.00409004448227145, 'lambda_val': 0.00018791882497476634, 'batch_size': 801, 'optimizer': 'SGD'}. Best is trial 75 with value: 0.02482134338591816.
2026-05-16 01:02:38,920 - experiment_functions - INFO - Early stopping at epoch 800. Best Recall: 0.0067
2026-05-16 01:02:39,021 - optuna.study.study - INFO - Trial 257 finished with value: 0.006704043216457376 and parameters: {'n_layers': 1, 'embedding_dim': 64, 'lr': 0.008811974533471016, 'lambda_val': 0.00025732032320134916, 'batch_size': 2774, 'optimizer': 'RMSprop'}. Best is trial 75 with value: 0.02482134338591816.
2026-05-16 01:02:42,719 - experiment_functions - INFO - Early stopping at epoch 550. Best Recall: 0.0175
2026-05-16 01:02:42,808 - optuna.study.study - INFO - Trial 258 finished with value: 0.017472913149929378 and parameters: {'n_layers': 1, 'embedding_dim': 256, 'lr': 0.00488313939311567, 'lambda_val': 7.074477648514109e-05, 'batch_size': 594, 'optimizer': 'Adam'}. Best is trial 75 with value: 0.02482134338591816.
2026-05-16 01:02:46,386 - experiment_functions - INFO - Early stopping at epoch 550. Best Recall: 0.0219
2026-05-16 01:02:46,487 - optuna.study.study - INFO - Trial 259 finished with value: 0.021878769470864586 and parameters: {'n_layers': 1, 'embedding_dim': 64, 'lr': 0.006451415843072109, 'lambda_val': 3.2619831585137143e-05, 'batch_size': 880, 'optimizer': 'Adam'}. Best is trial 75 with value: 0.02482134338591816.
2026-05-16 01:02:50,177 - experiment_functions - INFO - Early stopping at epoch 550. Best Recall: 0.0150
2026-05-16 01:02:50,287 - optuna.study.study - INFO - Trial 260 finished with value: 0.014971056081871935 and parameters: {'n_layers': 1, 'embedding_dim': 64, 'lr': 0.006639409568885178, 'lambda_val': 3.418710955442986e-05, 'batch_size': 2398, 'optimizer': 'Adam'}. Best is trial 75 with value: 0.02482134338591816.
2026-05-16 01:02:55,587 - experiment_functions - INFO - Early stopping at epoch 550. Best Recall: 0.0134
2026-05-16 01:02:55,678 - optuna.study.study - INFO - Trial 261 finished with value: 0.013391571049964267 and parameters: {'n_layers': 1, 'embedding_dim': 64, 'lr': 0.011309611853037254, 'lambda_val': 2.6596941340603215e-05, 'batch_size': 679, 'optimizer': 'Adam'}. Best is trial 75 with value: 0.02482134338591816.
2026-05-16 01:02:59,006 - experiment_functions - INFO - Early stopping at epoch 550. Best Recall: 0.0165
2026-05-16 01:02:59,108 - optuna.study.study - INFO - Trial 262 finished with value: 0.016527556757135253 and parameters: {'n_layers': 1, 'embedding_dim': 64, 'lr': 0.006173333681305769, 'lambda_val': 1.9744172008654867e-05, 'batch_size': 517, 'optimizer': 'Adam'}. Best is trial 75 with value: 0.02482134338591816.
2026-05-16 01:03:02,464 - experiment_functions - INFO - Early stopping at epoch 550. Best Recall: 0.0201
