2026-05-16 02:41:43,685 - optuna.study.study - INFO - Trial 37 finished with value: 0.018407369285812138 and parameters: {'n_layers': 1, 'embedding_dim': 128, 'lr': 0.09415074956539017, 'lambda_val': 3.960606902388531e-05, 'batch_size': 2350, 'optimizer': 'Adam'}. Best is trial 20 with value: 0.12490369978282755.
2026-05-16 02:41:51,342 - optuna.study._optimize - INFO - Trial 38 pruned. 
2026-05-16 02:41:56,578 - experiment_functions - INFO - Early stopping at epoch 600. Best Recall: 0.0400
2026-05-16 02:41:56,678 - optuna.study.study - INFO - Trial 39 finished with value: 0.040036266566865146 and parameters: {'n_layers': 3, 'embedding_dim': 256, 'lr': 0.0011038080425978258, 'lambda_val': 0.00498331549770691, 'batch_size': 893, 'optimizer': 'Adam'}. Best is trial 20 with value: 0.12490369978282755.
2026-05-16 02:42:02,847 - optuna.study._optimize - INFO - Trial 40 pruned. 
2026-05-16 02:42:11,867 - experiment_functions - INFO - Early stopping at epoch 1600. Best Recall: 0.1253
2026-05-16 02:42:11,971 - optuna.study.study - INFO - Trial 41 finished with value: 0.1253201202063875 and parameters: {'n_layers': 1, 'embedding_dim': 128, 'lr': 0.0006803450828652616, 'lambda_val': 0.00013164987163205133, 'batch_size': 1515, 'optimizer': 'Adam'}. Best is trial 41 with value: 0.1253201202063875.
2026-05-16 02:42:23,849 - experiment_functions - INFO - Early stopping at epoch 2100. Best Recall: 0.1205
2026-05-16 02:42:23,949 - optuna.study.study - INFO - Trial 42 finished with value: 0.12052028181792342 and parameters: {'n_layers': 1, 'embedding_dim': 128, 'lr': 0.0005991559181736174, 'lambda_val': 2.2806587549030087e-05, 'batch_size': 1571, 'optimizer': 'Adam'}. Best is trial 41 with value: 0.1253201202063875.
2026-05-16 02:42:45,432 - optuna.study.study - INFO - Trial 43 finished with value: 0.12211530245317684 and parameters: {'n_layers': 1, 'embedding_dim': 128, 'lr': 0.0005725537909954115, 'lambda_val': 2.6337450661968964e-05, 'batch_size': 982, 'optimizer': 'Adam'}. Best is trial 41 with value: 0.1253201202063875.
2026-05-16 02:42:51,312 - optuna.study._optimize - INFO - Trial 44 pruned. 
2026-05-16 02:42:55,378 - experiment_functions - INFO - Early stopping at epoch 500. Best Recall: 0.0018
2026-05-16 02:42:55,500 - optuna.study.study - INFO - Trial 45 finished with value: 0.001842797560662072 and parameters: {'n_layers': 4, 'embedding_dim': 64, 'lr': 0.0008025957904706255, 'lambda_val': 1.402348121032425e-05, 'batch_size': 940, 'optimizer': 'SGD'}. Best is trial 41 with value: 0.1253201202063875.
2026-05-16 02:43:02,463 - experiment_functions - INFO - Early stopping at epoch 950. Best Recall: 0.1082
2026-05-16 02:43:02,570 - optuna.study.study - INFO - Trial 46 finished with value: 0.10817203712770354 and parameters: {'n_layers': 1, 'embedding_dim': 256, 'lr': 0.0013590963095079995, 'lambda_val': 3.0763815078521294e-06, 'batch_size': 758, 'optimizer': 'Adam'}. Best is trial 41 with value: 0.1253201202063875.
2026-05-16 02:43:08,316 - optuna.study._optimize - INFO - Trial 47 pruned. 
2026-05-16 02:43:13,720 - experiment_functions - INFO - Early stopping at epoch 750. Best Recall: 0.0547
2026-05-16 02:43:13,819 - optuna.study.study - INFO - Trial 48 finished with value: 0.05469630952370623 and parameters: {'n_layers': 3, 'embedding_dim': 128, 'lr': 0.0006518072076871579, 'lambda_val': 2.682352833579225e-05, 'batch_size': 1602, 'optimizer': 'Adam'}. Best is trial 41 with value: 0.1253201202063875.
2026-05-16 02:43:18,125 - experiment_functions - INFO - Early stopping at epoch 600. Best Recall: 0.0612
2026-05-16 02:43:18,225 - optuna.study.study - INFO - Trial 49 finished with value: 0.061214828967478555 and parameters: {'n_layers': 2, 'embedding_dim': 64, 'lr': 0.0034861484710984113, 'lambda_val': 0.00039469949799821996, 'batch_size': 1700, 'optimizer': 'Adam'}. Best is trial 41 with value: 0.1253201202063875.
2026-05-16 02:43:22,173 - experiment_functions - INFO - Early stopping at epoch 550. Best Recall: 0.1023
2026-05-16 02:43:22,251 - optuna.study.study - INFO - Trial 50 finished with value: 0.10229918682889808 and parameters: {'n_layers': 1, 'embedding_dim': 256, 'lr': 0.007723155168998495, 'lambda_val': 2.532881751199616e-06, 'batch_size': 2727, 'optimizer': 'Adam'}. Best is trial 41 with value: 0.1253201202063875.
2026-05-16 02:43:33,499 - optuna.study._optimize - INFO - Trial 51 pruned. 
2026-05-16 02:43:48,474 - experiment_functions - INFO - Early stopping at epoch 2600. Best Recall: 0.1200
2026-05-16 02:43:48,587 - optuna.study.study - INFO - Trial 52 finished with value: 0.11995965951389918 and parameters: {'n_layers': 1, 'embedding_dim': 128, 'lr': 0.0005051975931412268, 'lambda_val': 3.660381338543651e-05, 'batch_size': 1448, 'optimizer': 'Adam'}. Best is trial 41 with value: 0.1253201202063875.
2026-05-16 02:43:55,795 - experiment_functions - INFO - Early stopping at epoch 1250. Best Recall: 0.1125
2026-05-16 02:43:55,875 - optuna.study.study - INFO - Trial 53 finished with value: 0.11246071020208058 and parameters: {'n_layers': 1, 'embedding_dim': 128, 'lr': 0.000902550298947978, 'lambda_val': 6.963111590129827e-06, 'batch_size': 1135, 'optimizer': 'Adam'}. Best is trial 41 with value: 0.1253201202063875.
2026-05-16 02:44:02,021 - optuna.study._optimize - INFO - Trial 54 pruned. 
2026-05-16 02:44:08,169 - optuna.study._optimize - INFO - Trial 55 pruned. 
2026-05-16 02:44:15,156 - optuna.study._optimize - INFO - Trial 56 pruned. 
2026-05-16 02:44:18,858 - experiment_functions - INFO - Early stopping at epoch 550. Best Recall: 0.0873
2026-05-16 02:44:18,949 - optuna.study.study - INFO - Trial 57 finished with value: 0.08732076734085566 and parameters: {'n_layers': 1, 'embedding_dim': 128, 'lr': 0.0027798809622423767, 'lambda_val': 3.529702623680385e-05, 'batch_size': 2616, 'optimizer': 'RMSprop'}. Best is trial 41 with value: 0.1253201202063875.
2026-05-16 02:44:26,263 - optuna.study._optimize - INFO - Trial 58 pruned. 
2026-05-16 02:44:30,878 - experiment_functions - INFO - Early stopping at epoch 500. Best Recall: 0.0027
2026-05-16 02:44:30,979 - optuna.study.study - INFO - Trial 59 finished with value: 0.0026587321010510794 and parameters: {'n_layers': 1, 'embedding_dim': 64, 'lr': 0.0006028101260220706, 'lambda_val': 0.0007855434841384769, 'batch_size': 696, 'optimizer': 'SGD'}. Best is trial 41 with value: 0.1253201202063875.
2026-05-16 02:44:36,126 - experiment_functions - INFO - Early stopping at epoch 700. Best Recall: 0.0680
2026-05-16 02:44:36,238 - optuna.study.study - INFO - Trial 60 finished with value: 0.0680218082625376 and parameters: {'n_layers': 2, 'embedding_dim': 128, 'lr': 0.0010956477784458683, 'lambda_val': 1.212600403384946e-05, 'batch_size': 1036, 'optimizer': 'Adam'}. Best is trial 41 with value: 0.1253201202063875.
2026-05-16 02:44:46,883 - experiment_functions - INFO - Early stopping at epoch 1800. Best Recall: 0.1125
2026-05-16 02:44:46,974 - optuna.study.study - INFO - Trial 61 finished with value: 0.11245043431256013 and parameters: {'n_layers': 1, 'embedding_dim': 128, 'lr': 0.0004973774794431059, 'lambda_val': 5.896092518115525e-05, 'batch_size': 1513, 'optimizer': 'Adam'}. Best is trial 41 with value: 0.1253201202063875.
2026-05-16 02:44:59,147 - experiment_functions - INFO - Early stopping at epoch 2300. Best Recall: 0.1189
2026-05-16 02:44:59,237 - optuna.study.study - INFO - Trial 62 finished with value: 0.11889600456139475 and parameters: {'n_layers': 1, 'embedding_dim': 128, 'lr': 0.0004180419913880581, 'lambda_val': 0.00020459463661228752, 'batch_size': 2115, 'optimizer': 'Adam'}. Best is trial 41 with value: 0.1253201202063875.
2026-05-16 02:45:05,492 - optuna.study._optimize - INFO - Trial 63 pruned. 
2026-05-16 02:45:10,412 - experiment_functions - INFO - Early stopping at epoch 800. Best Recall: 0.0972
2026-05-16 02:45:10,512 - optuna.study.study - INFO - Trial 64 finished with value: 0.09724245620602603 and parameters: {'n_layers': 1, 'embedding_dim': 128, 'lr': 0.0013757918876358716, 'lambda_val': 0.0002416041966403604, 'batch_size': 2319, 'optimizer': 'Adam'}. Best is trial 41 with value: 0.1253201202063875.
2026-05-16 02:45:19,882 - experiment_functions - INFO - Early stopping at epoch 1100. Best Recall: 0.1211
2026-05-16 02:45:19,971 - optuna.study.study - INFO - Trial 65 finished with value: 0.12111651530447211 and parameters: {'n_layers': 1, 'embedding_dim': 96, 'lr': 0.00085371669100634, 'lambda_val': 0.0001538434676977149, 'batch_size': 2086, 'optimizer': 'Adam'}. Best is trial 41 with value: 0.1253201202063875.
2026-05-16 02:45:25,378 - experiment_functions - INFO - Early stopping at epoch 950. Best Recall: 0.0028
2026-05-16 02:45:25,477 - optuna.study.study - INFO - Trial 66 finished with value: 0.002795818262041553 and parameters: {'n_layers': 1, 'embedding_dim': 96, 'lr': 1.06819405637168e-05, 'lambda_val': 8.35148003034898e-05, 'batch_size': 1678, 'optimizer': 'Adam'}. Best is trial 41 with value: 0.1253201202063875.
2026-05-16 02:45:34,673 - experiment_functions - INFO - Early stopping at epoch 1600. Best Recall: 0.1114
2026-05-16 02:45:34,764 - optuna.study.study - INFO - Trial 67 finished with value: 0.11139413666176651 and parameters: {'n_layers': 1, 'embedding_dim': 96, 'lr': 0.0007146616932533049, 'lambda_val': 0.00014561721747736818, 'batch_size': 2002, 'optimizer': 'Adam'}. Best is trial 41 with value: 0.1253201202063875.
2026-05-16 02:45:41,279 - optuna.study._optimize - INFO - Trial 68 pruned. 
2026-05-16 02:45:47,514 - optuna.study._optimize - INFO - Trial 69 pruned. 
2026-05-16 02:45:55,242 - optuna.study._optimize - INFO - Trial 70 pruned. 
2026-05-16 02:46:03,328 - experiment_functions - INFO - Early stopping at epoch 1000. Best Recall: 0.1187
2026-05-16 02:46:03,419 - optuna.study.study - INFO - Trial 71 finished with value: 0.11867533714530543 and parameters: {'n_layers': 1, 'embedding_dim': 256, 'lr': 0.000989041628187898, 'lambda_val': 0.00017489795191948687, 'batch_size': 2362, 'optimizer': 'Adam'}. Best is trial 41 with value: 0.1253201202063875.
2026-05-16 02:46:07,688 - experiment_functions - INFO - Early stopping at epoch 700. Best Recall: 0.1077
2026-05-16 02:46:07,789 - optuna.study.study - INFO - Trial 72 finished with value: 0.10771335675240758 and parameters: {'n_layers': 1, 'embedding_dim': 32, 'lr': 0.0020882801636050896, 'lambda_val': 0.00033071524264500395, 'batch_size': 2264, 'optimizer': 'Adam'}. Best is trial 41 with value: 0.1253201202063875.
2026-05-16 02:46:14,789 - experiment_functions - INFO - Early stopping at epoch 1150. Best Recall: 0.1098
2026-05-16 02:46:14,889 - optuna.study.study - INFO - Trial 73 finished with value: 0.10982503162738903 and parameters: {'n_layers': 1, 'embedding_dim': 96, 'lr': 0.000844556433060868, 'lambda_val': 0.00019513750401210816, 'batch_size': 2393, 'optimizer': 'Adam'}. Best is trial 41 with value: 0.1253201202063875.
2026-05-16 02:46:20,854 - experiment_functions - INFO - Early stopping at epoch 550. Best Recall: 0.0267
2026-05-16 02:46:20,952 - optuna.study.study - INFO - Trial 74 finished with value: 0.02670461584801294 and parameters: {'n_layers': 4, 'embedding_dim': 256, 'lr': 0.0016422075164875393, 'lambda_val': 6.797186858177533e-05, 'batch_size': 2136, 'optimizer': 'Adam'}. Best is trial 41 with value: 0.1253201202063875.
2026-05-16 02:46:27,498 - optuna.study._optimize - INFO - Trial 75 pruned. 
2026-05-16 02:46:30,667 - experiment_functions - INFO - Early stopping at epoch 500. Best Recall: 0.0013
2026-05-16 02:46:30,758 - optuna.study.study - INFO - Trial 76 finished with value: 0.0013425860046280193 and parameters: {'n_layers': 1, 'embedding_dim': 128, 'lr': 0.0011667363431207825, 'lambda_val': 4.0377833280816896e-05, 'batch_size': 1361, 'optimizer': 'SGD'}. Best is trial 41 with value: 0.1253201202063875.
2026-05-16 02:46:40,683 - experiment_functions - INFO - Early stopping at epoch 1500. Best Recall: 0.1110
2026-05-16 02:46:40,912 - optuna.study.study - INFO - Trial 77 finished with value: 0.11095884104718655 and parameters: {'n_layers': 1, 'embedding_dim': 256, 'lr': 0.00042171338799804856, 'lambda_val': 0.00032130772274504595, 'batch_size': 2770, 'optimizer': 'Adam'}. Best is trial 41 with value: 0.1253201202063875.
2026-05-16 02:46:47,744 - experiment_functions - INFO - Early stopping at epoch 1150. Best Recall: 0.1138
2026-05-16 02:46:47,835 - optuna.study.study - INFO - Trial 78 finished with value: 0.11378206481430866 and parameters: {'n_layers': 1, 'embedding_dim': 128, 'lr': 0.0006981124950770972, 'lambda_val': 2.0216013981783356e-05, 'batch_size': 2560, 'optimizer': 'RMSprop'}. Best is trial 41 with value: 0.1253201202063875.
2026-05-16 02:46:52,006 - experiment_functions - INFO - Early stopping at epoch 600. Best Recall: 0.0561
2026-05-16 02:46:52,582 - optuna.study.study - INFO - Trial 79 finished with value: 0.05613095037795711 and parameters: {'n_layers': 2, 'embedding_dim': 96, 'lr': 0.002421383151178675, 'lambda_val': 7.530929806684438e-05, 'batch_size': 1726, 'optimizer': 'Adam'}. Best is trial 41 with value: 0.1253201202063875.
2026-05-16 02:47:04,393 - optuna.study._optimize - INFO - Trial 80 pruned. 
2026-05-16 02:47:10,012 - experiment_functions - INFO - Early stopping at epoch 850. Best Recall: 0.1109
2026-05-16 02:47:10,148 - optuna.study.study - INFO - Trial 81 finished with value: 0.11090017235560293 and parameters: {'n_layers': 1, 'embedding_dim': 256, 'lr': 0.0008862387911272179, 'lambda_val': 0.00018021631520989513, 'batch_size': 2534, 'optimizer': 'Adam'}. Best is trial 41 with value: 0.1253201202063875.
2026-05-16 02:47:14,971 - experiment_functions - INFO - Early stopping at epoch 700. Best Recall: 0.1040
2026-05-16 02:47:15,050 - optuna.study.study - INFO - Trial 82 finished with value: 0.10404089415375158 and parameters: {'n_layers': 1, 'embedding_dim': 256, 'lr': 0.0014459524177616147, 'lambda_val': 0.0002467897982456425, 'batch_size': 2474, 'optimizer': 'Adam'}. Best is trial 41 with value: 0.1253201202063875.
2026-05-16 02:47:21,003 - experiment_functions - INFO - Early stopping at epoch 900. Best Recall: 0.1134
2026-05-16 02:47:21,579 - optuna.study.study - INFO - Trial 83 finished with value: 0.11335085434542855 and parameters: {'n_layers': 1, 'embedding_dim': 256, 'lr': 0.0010060603075480693, 'lambda_val': 0.0006480800459171303, 'batch_size': 2649, 'optimizer': 'Adam'}. Best is trial 41 with value: 0.1253201202063875.
2026-05-16 02:47:30,752 - optuna.study._optimize - INFO - Trial 84 pruned. 
2026-05-16 02:47:38,477 - experiment_functions - INFO - Early stopping at epoch 1200. Best Recall: 0.1117
2026-05-16 02:47:38,585 - optuna.study.study - INFO - Trial 85 finished with value: 0.11173195572657006 and parameters: {'n_layers': 1, 'embedding_dim': 256, 'lr': 0.0005747463858518908, 'lambda_val': 5.159857103757348e-05, 'batch_size': 2236, 'optimizer': 'Adam'}. Best is trial 41 with value: 0.1253201202063875.
2026-05-16 02:47:43,813 - experiment_functions - INFO - Early stopping at epoch 750. Best Recall: 0.0867
2026-05-16 02:47:43,893 - optuna.study.study - INFO - Trial 86 finished with value: 0.08669091448066846 and parameters: {'n_layers': 1, 'embedding_dim': 64, 'lr': 0.0017911240619076525, 'lambda_val': 0.0001479976777583515, 'batch_size': 3556, 'optimizer': 'Adam'}. Best is trial 41 with value: 0.1253201202063875.
2026-05-16 02:47:49,675 - optuna.study._optimize - INFO - Trial 87 pruned. 
2026-05-16 02:47:52,945 - experiment_functions - INFO - Early stopping at epoch 500. Best Recall: 0.0021
2026-05-16 02:47:53,045 - optuna.study.study - INFO - Trial 88 finished with value: 0.0020739609301113618 and parameters: {'n_layers': 1, 'embedding_dim': 128, 'lr': 0.003943002871641711, 'lambda_val': 0.05911481044376068, 'batch_size': 542, 'optimizer': 'SGD'}. Best is trial 41 with value: 0.1253201202063875.
2026-05-16 02:48:10,937 - experiment_functions - INFO - Early stopping at epoch 2900. Best Recall: 0.1275
2026-05-16 02:48:11,061 - optuna.study.study - INFO - Trial 89 finished with value: 0.1275013532343666 and parameters: {'n_layers': 1, 'embedding_dim': 256, 'lr': 0.0003657066772981834, 'lambda_val': 2.751876862314208e-05, 'batch_size': 1179, 'optimizer': 'Adam'}. Best is trial 89 with value: 0.1275013532343666.
2026-05-16 02:48:16,996 - optuna.study._optimize - INFO - Trial 90 pruned. 
2026-05-16 02:48:34,195 - experiment_functions - INFO - Early stopping at epoch 2450. Best Recall: 0.1266
2026-05-16 02:48:34,340 - optuna.study.study - INFO - Trial 91 finished with value: 0.1266040454911096 and parameters: {'n_layers': 1, 'embedding_dim': 256, 'lr': 0.00048616686383058845, 'lambda_val': 1.7571688765924688e-05, 'batch_size': 1131, 'optimizer': 'Adam'}. Best is trial 89 with value: 0.1275013532343666.
2026-05-16 02:48:52,720 - experiment_functions - INFO - Early stopping at epoch 3050. Best Recall: 0.1288
2026-05-16 02:48:52,811 - optuna.study.study - INFO - Trial 92 finished with value: 0.12883252214037635 and parameters: {'n_layers': 1, 'embedding_dim': 256, 'lr': 0.0004516976285657871, 'lambda_val': 1.6195855319326402e-05, 'batch_size': 1058, 'optimizer': 'Adam'}. Best is trial 92 with value: 0.12883252214037635.
2026-05-16 02:48:59,187 - optuna.study._optimize - INFO - Trial 93 pruned. 
2026-05-16 02:49:08,287 - optuna.study._optimize - INFO - Trial 94 pruned. 
2026-05-16 02:49:15,198 - optuna.study._optimize - INFO - Trial 95 pruned. 
2026-05-16 02:49:22,008 - optuna.study._optimize - INFO - Trial 96 pruned. 
2026-05-16 02:49:37,863 - experiment_functions - INFO - Early stopping at epoch 2250. Best Recall: 0.1294
2026-05-16 02:49:37,965 - optuna.study.study - INFO - Trial 97 finished with value: 0.12940330855701818 and parameters: {'n_layers': 1, 'embedding_dim': 256, 'lr': 0.0005559586347740771, 'lambda_val': 4.22592601380042e-05, 'batch_size': 1108, 'optimizer': 'Adam'}. Best is trial 97 with value: 0.12940330855701818.
2026-05-16 02:49:45,048 - optuna.study._optimize - INFO - Trial 98 pruned. 
2026-05-16 02:49:52,812 - experiment_functions - INFO - Early stopping at epoch 1150. Best Recall: 0.1165
2026-05-16 02:49:52,891 - optuna.study.study - INFO - Trial 99 finished with value: 0.11652534811950971 and parameters: {'n_layers': 1, 'embedding_dim': 256, 'lr': 0.0013044931583504565, 'lambda_val': 4.072253753887917e-05, 'batch_size': 784, 'optimizer': 'Adam'}. Best is trial 97 with value: 0.12940330855701818.
2026-05-16 02:50:04,125 - experiment_functions - INFO - Early stopping at epoch 1900. Best Recall: 0.1278
2026-05-16 02:50:04,236 - optuna.study.study - INFO - Trial 100 finished with value: 0.12777474898271152 and parameters: {'n_layers': 1, 'embedding_dim': 256, 'lr': 0.0006267867349279402, 'lambda_val': 1.089060958845751e-05, 'batch_size': 1060, 'optimizer': 'Adam'}. Best is trial 97 with value: 0.12940330855701818.
2026-05-16 02:50:14,949 - experiment_functions - INFO - Early stopping at epoch 1700. Best Recall: 0.1236
2026-05-16 02:50:15,057 - optuna.study.study - INFO - Trial 101 finished with value: 0.12364987944265979 and parameters: {'n_layers': 1, 'embedding_dim': 256, 'lr': 0.0006415146693413337, 'lambda_val': 3.397460443944427e-05, 'batch_size': 1105, 'optimizer': 'Adam'}. Best is trial 97 with value: 0.12940330855701818.
2026-05-16 02:50:27,793 - experiment_functions - INFO - Early stopping at epoch 2050. Best Recall: 0.1293
2026-05-16 02:50:27,885 - optuna.study.study - INFO - Trial 102 finished with value: 0.12931302340428294 and parameters: {'n_layers': 1, 'embedding_dim': 256, 'lr': 0.000678044365576207, 'lambda_val': 1.1095734609052472e-05, 'batch_size': 1127, 'optimizer': 'Adam'}. Best is trial 97 with value: 0.12940330855701818.
2026-05-16 02:50:42,732 - experiment_functions - INFO - Early stopping at epoch 2500. Best Recall: 0.1242
2026-05-16 02:50:42,831 - optuna.study.study - INFO - Trial 103 finished with value: 0.12419338422030474 and parameters: {'n_layers': 1, 'embedding_dim': 256, 'lr': 0.0006282253314000002, 'lambda_val': 1.0205122771658243e-05, 'batch_size': 1102, 'optimizer': 'Adam'}. Best is trial 97 with value: 0.12940330855701818.
2026-05-16 02:50:56,656 - experiment_functions - INFO - Early stopping at epoch 2250. Best Recall: 0.1208
2026-05-16 02:50:56,745 - optuna.study.study - INFO - Trial 104 finished with value: 0.1208231227907806 and parameters: {'n_layers': 1, 'embedding_dim': 256, 'lr': 0.0006447082357276641, 'lambda_val': 5.338706139857786e-06, 'batch_size': 1124, 'optimizer': 'Adam'}. Best is trial 97 with value: 0.12940330855701818.
2026-05-16 02:51:03,289 - optuna.study._optimize - INFO - Trial 105 pruned. 
2026-05-16 02:51:08,368 - experiment_functions - INFO - Early stopping at epoch 650. Best Recall: 0.0444
2026-05-16 02:51:08,467 - optuna.study.study - INFO - Trial 106 finished with value: 0.044391280468592934 and parameters: {'n_layers': 1, 'embedding_dim': 256, 'lr': 0.020396587220955113, 'lambda_val': 8.990466988815702e-06, 'batch_size': 1048, 'optimizer': 'Adam'}. Best is trial 97 with value: 0.12940330855701818.
2026-05-16 02:51:14,817 - optuna.study._optimize - INFO - Trial 107 pruned. 
2026-05-16 02:51:30,066 - experiment_functions - INFO - Early stopping at epoch 2350. Best Recall: 0.1254
2026-05-16 02:51:30,210 - optuna.study.study - INFO - Trial 108 finished with value: 0.1253569269416297 and parameters: {'n_layers': 1, 'embedding_dim': 256, 'lr': 0.0007238600048788593, 'lambda_val': 1.9438948106966653e-06, 'batch_size': 1198, 'optimizer': 'Adam'}. Best is trial 97 with value: 0.12940330855701818.
2026-05-16 02:51:41,625 - experiment_functions - INFO - Early stopping at epoch 1850. Best Recall: 0.1207
2026-05-16 02:51:41,705 - optuna.study.study - INFO - Trial 109 finished with value: 0.12070023502141351 and parameters: {'n_layers': 1, 'embedding_dim': 256, 'lr': 0.0007962342641168295, 'lambda_val': 4.546723196803587e-06, 'batch_size': 1191, 'optimizer': 'Adam'}. Best is trial 97 with value: 0.12940330855701818.
2026-05-16 02:51:45,564 - experiment_functions - INFO - Early stopping at epoch 500. Best Recall: 0.0009
