2026-05-16 03:39:16,938 - optuna.study.study - INFO - Trial 160 finished with value: 0.11620858037825472 and parameters: {'n_layers': 1, 'embedding_dim': 256, 'lr': 0.0007766650165931633, 'lambda_val': 4.735641314293958e-06, 'batch_size': 2906, 'optimizer': 'Adam'}. Best is trial 133 with value: 0.126434760649906.
2026-05-16 03:39:23,764 - optuna.study._optimize - INFO - Trial 161 pruned. 
2026-05-16 03:39:30,917 - optuna.study._optimize - INFO - Trial 162 pruned. 
2026-05-16 03:39:40,922 - experiment_functions - INFO - Early stopping at epoch 1550. Best Recall: 0.1241
2026-05-16 03:39:41,011 - optuna.study.study - INFO - Trial 163 finished with value: 0.12414288057031145 and parameters: {'n_layers': 1, 'embedding_dim': 256, 'lr': 0.0004814942683015828, 'lambda_val': 8.831094660271247e-06, 'batch_size': 3113, 'optimizer': 'Adam'}. Best is trial 133 with value: 0.126434760649906.
2026-05-16 03:39:48,550 - experiment_functions - INFO - Early stopping at epoch 1100. Best Recall: 0.1218
2026-05-16 03:39:48,641 - optuna.study.study - INFO - Trial 164 finished with value: 0.12181864289248118 and parameters: {'n_layers': 1, 'embedding_dim': 256, 'lr': 0.0005245877677326113, 'lambda_val': 8.102053456051966e-06, 'batch_size': 3076, 'optimizer': 'Adam'}. Best is trial 133 with value: 0.126434760649906.
2026-05-16 03:39:58,045 - optuna.study._optimize - INFO - Trial 165 pruned. 
2026-05-16 03:40:04,774 - optuna.study._optimize - INFO - Trial 166 pruned. 
2026-05-16 03:40:11,646 - optuna.study._optimize - INFO - Trial 167 pruned. 
2026-05-16 03:40:18,263 - experiment_functions - INFO - Early stopping at epoch 1000. Best Recall: 0.1194
2026-05-16 03:40:18,343 - optuna.study.study - INFO - Trial 168 finished with value: 0.11935723653638206 and parameters: {'n_layers': 1, 'embedding_dim': 256, 'lr': 0.0007591421617902442, 'lambda_val': 9.05594029999474e-06, 'batch_size': 3035, 'optimizer': 'Adam'}. Best is trial 133 with value: 0.126434760649906.
2026-05-16 03:40:24,766 - experiment_functions - INFO - Early stopping at epoch 950. Best Recall: 0.1121
2026-05-16 03:40:24,867 - optuna.study.study - INFO - Trial 169 finished with value: 0.11209199278823855 and parameters: {'n_layers': 1, 'embedding_dim': 256, 'lr': 0.0008312802169594477, 'lambda_val': 1.0774419438973429e-05, 'batch_size': 3040, 'optimizer': 'Adam'}. Best is trial 133 with value: 0.126434760649906.
2026-05-16 03:40:33,447 - experiment_functions - INFO - Early stopping at epoch 1200. Best Recall: 0.1151
2026-05-16 03:40:33,545 - optuna.study.study - INFO - Trial 170 finished with value: 0.11506109773310866 and parameters: {'n_layers': 1, 'embedding_dim': 256, 'lr': 0.0006805390572378055, 'lambda_val': 8.647455980808913e-06, 'batch_size': 3106, 'optimizer': 'Adam'}. Best is trial 133 with value: 0.126434760649906.
2026-05-16 03:40:40,766 - optuna.study._optimize - INFO - Trial 171 pruned. 
2026-05-16 03:41:02,383 - experiment_functions - INFO - Early stopping at epoch 1650. Best Recall: 0.1242
2026-05-16 03:41:02,485 - optuna.study.study - INFO - Trial 172 finished with value: 0.12424232493562154 and parameters: {'n_layers': 1, 'embedding_dim': 256, 'lr': 0.00045338618930722605, 'lambda_val': 7.185078999113901e-06, 'batch_size': 3014, 'optimizer': 'Adam'}. Best is trial 133 with value: 0.126434760649906.
2026-05-16 03:41:09,553 - optuna.study._optimize - INFO - Trial 173 pruned. 
2026-05-16 03:41:16,748 - optuna.study._optimize - INFO - Trial 174 pruned. 
2026-05-16 03:41:29,660 - optuna.study._optimize - INFO - Trial 175 pruned. 
2026-05-16 03:41:36,962 - optuna.study._optimize - INFO - Trial 176 pruned. 
2026-05-16 03:41:44,685 - experiment_functions - INFO - Early stopping at epoch 1050. Best Recall: 0.1154
2026-05-16 03:41:44,775 - optuna.study.study - INFO - Trial 177 finished with value: 0.11539020996066979 and parameters: {'n_layers': 1, 'embedding_dim': 256, 'lr': 0.0007842047728893439, 'lambda_val': 6.864127574948848e-06, 'batch_size': 3169, 'optimizer': 'Adam'}. Best is trial 133 with value: 0.126434760649906.
2026-05-16 03:41:52,979 - experiment_functions - INFO - Early stopping at epoch 1150. Best Recall: 0.1162
2026-05-16 03:41:53,069 - optuna.study.study - INFO - Trial 178 finished with value: 0.1161993669057683 and parameters: {'n_layers': 1, 'embedding_dim': 256, 'lr': 0.0007165566712051249, 'lambda_val': 7.338386967283922e-06, 'batch_size': 3184, 'optimizer': 'Adam'}. Best is trial 133 with value: 0.126434760649906.
2026-05-16 03:42:01,143 - optuna.study._optimize - INFO - Trial 179 pruned. 
2026-05-16 03:42:07,388 - experiment_functions - INFO - Early stopping at epoch 900. Best Recall: 0.1237
2026-05-16 03:42:07,491 - optuna.study.study - INFO - Trial 180 finished with value: 0.12368461345068187 and parameters: {'n_layers': 1, 'embedding_dim': 256, 'lr': 0.0008248028328539832, 'lambda_val': 4.961461137050229e-06, 'batch_size': 3023, 'optimizer': 'Adam'}. Best is trial 133 with value: 0.126434760649906.
2026-05-16 03:42:14,103 - experiment_functions - INFO - Early stopping at epoch 950. Best Recall: 0.1163
2026-05-16 03:42:14,203 - optuna.study.study - INFO - Trial 181 finished with value: 0.11633707791807636 and parameters: {'n_layers': 1, 'embedding_dim': 256, 'lr': 0.0008405121980579938, 'lambda_val': 4.816636359029046e-06, 'batch_size': 3024, 'optimizer': 'Adam'}. Best is trial 133 with value: 0.126434760649906.
2026-05-16 03:42:22,296 - experiment_functions - INFO - Early stopping at epoch 950. Best Recall: 0.1064
2026-05-16 03:42:22,399 - optuna.study.study - INFO - Trial 182 finished with value: 0.10642664125238677 and parameters: {'n_layers': 1, 'embedding_dim': 256, 'lr': 0.0008321681929625287, 'lambda_val': 4.7938784377179e-06, 'batch_size': 3015, 'optimizer': 'Adam'}. Best is trial 133 with value: 0.126434760649906.
2026-05-16 03:42:31,945 - experiment_functions - INFO - Early stopping at epoch 1500. Best Recall: 0.1166
2026-05-16 03:42:32,069 - optuna.study.study - INFO - Trial 183 finished with value: 0.11657906438706155 and parameters: {'n_layers': 1, 'embedding_dim': 256, 'lr': 0.0006058702032711047, 'lambda_val': 3.60571101008139e-06, 'batch_size': 3066, 'optimizer': 'Adam'}. Best is trial 133 with value: 0.126434760649906.
2026-05-16 03:42:39,072 - optuna.study._optimize - INFO - Trial 184 pruned. 
2026-05-16 03:42:47,131 - optuna.study._optimize - INFO - Trial 185 pruned. 
2026-05-16 03:42:53,084 - experiment_functions - INFO - Early stopping at epoch 850. Best Recall: 0.1126
2026-05-16 03:42:53,174 - optuna.study.study - INFO - Trial 186 finished with value: 0.112600535069952 and parameters: {'n_layers': 1, 'embedding_dim': 256, 'lr': 0.001088212101015179, 'lambda_val': 4.039920366542629e-06, 'batch_size': 3567, 'optimizer': 'Adam'}. Best is trial 133 with value: 0.126434760649906.
2026-05-16 03:42:56,798 - experiment_functions - INFO - Early stopping at epoch 500. Best Recall: 0.0021
2026-05-16 03:42:56,899 - optuna.study.study - INFO - Trial 187 finished with value: 0.0021200175160410403 and parameters: {'n_layers': 1, 'embedding_dim': 96, 'lr': 0.000265182285768646, 'lambda_val': 3.361697231983747e-06, 'batch_size': 3247, 'optimizer': 'SGD'}. Best is trial 133 with value: 0.126434760649906.
2026-05-16 03:43:06,415 - experiment_functions - INFO - Early stopping at epoch 1500. Best Recall: 0.1183
2026-05-16 03:43:06,515 - optuna.study.study - INFO - Trial 188 finished with value: 0.11825315005062634 and parameters: {'n_layers': 1, 'embedding_dim': 256, 'lr': 0.00047997360366767647, 'lambda_val': 2.4053363059810157e-06, 'batch_size': 2990, 'optimizer': 'Adam'}. Best is trial 133 with value: 0.126434760649906.
2026-05-16 03:43:16,979 - experiment_functions - INFO - Early stopping at epoch 1550. Best Recall: 0.1241
2026-05-16 03:43:17,088 - optuna.study.study - INFO - Trial 189 finished with value: 0.12405678068640014 and parameters: {'n_layers': 1, 'embedding_dim': 256, 'lr': 0.00047439262380469054, 'lambda_val': 2.231857059172962e-06, 'batch_size': 3150, 'optimizer': 'Adam'}. Best is trial 133 with value: 0.126434760649906.
2026-05-16 03:43:24,956 - optuna.study._optimize - INFO - Trial 190 pruned. 
2026-05-16 03:43:31,587 - optuna.study._optimize - INFO - Trial 191 pruned. 
2026-05-16 03:43:35,700 - experiment_functions - INFO - Early stopping at epoch 500. Best Recall: 0.0015
2026-05-16 03:43:35,791 - optuna.study.study - INFO - Trial 192 finished with value: 0.0015335317887140638 and parameters: {'n_layers': 1, 'embedding_dim': 256, 'lr': 1.1674725362528474e-05, 'lambda_val': 1.500659167704458e-06, 'batch_size': 3091, 'optimizer': 'Adam'}. Best is trial 133 with value: 0.126434760649906.
2026-05-16 03:43:39,245 - experiment_functions - INFO - Early stopping at epoch 550. Best Recall: 0.0263
2026-05-16 03:43:39,346 - optuna.study.study - INFO - Trial 193 finished with value: 0.026265878386314633 and parameters: {'n_layers': 1, 'embedding_dim': 64, 'lr': 0.08442296017339682, 'lambda_val': 2.1363479696427333e-06, 'batch_size': 2846, 'optimizer': 'Adam'}. Best is trial 133 with value: 0.126434760649906.
2026-05-16 03:43:45,335 - optuna.study._optimize - INFO - Trial 194 pruned. 
2026-05-16 03:43:52,936 - optuna.study._optimize - INFO - Trial 195 pruned. 
2026-05-16 03:43:59,629 - optuna.study._optimize - INFO - Trial 196 pruned. 
2026-05-16 03:44:09,394 - experiment_functions - INFO - Early stopping at epoch 1550. Best Recall: 0.1151
2026-05-16 03:44:09,488 - optuna.study.study - INFO - Trial 197 finished with value: 0.11509729437436389 and parameters: {'n_layers': 1, 'embedding_dim': 256, 'lr': 0.0005473517231461082, 'lambda_val': 5.791866760022849e-06, 'batch_size': 3051, 'optimizer': 'Adam'}. Best is trial 133 with value: 0.126434760649906.
2026-05-16 03:44:16,305 - optuna.study._optimize - INFO - Trial 198 pruned. 
2026-05-16 03:44:25,880 - experiment_functions - INFO - Early stopping at epoch 1550. Best Recall: 0.1188
2026-05-16 03:44:25,981 - optuna.study.study - INFO - Trial 199 finished with value: 0.11881690295556391 and parameters: {'n_layers': 1, 'embedding_dim': 256, 'lr': 0.00046019106816761883, 'lambda_val': 1.7627758856490466e-06, 'batch_size': 3222, 'optimizer': 'Adam'}. Best is trial 133 with value: 0.126434760649906.
2026-05-16 03:44:32,984 - experiment_functions - INFO - Early stopping at epoch 1050. Best Recall: 0.1233
2026-05-16 03:44:33,086 - optuna.study.study - INFO - Trial 200 finished with value: 0.12333182374579475 and parameters: {'n_layers': 1, 'embedding_dim': 256, 'lr': 0.0006155359445207395, 'lambda_val': 1.7642908795721102e-06, 'batch_size': 3337, 'optimizer': 'Adam'}. Best is trial 133 with value: 0.126434760649906.
2026-05-16 03:44:39,908 - optuna.study._optimize - INFO - Trial 201 pruned. 
2026-05-16 03:44:46,740 - optuna.study._optimize - INFO - Trial 202 pruned. 
2026-05-16 03:44:56,776 - optuna.study._optimize - INFO - Trial 203 pruned. 
2026-05-16 03:45:07,680 - experiment_functions - INFO - Early stopping at epoch 1800. Best Recall: 0.1220
2026-05-16 03:45:07,780 - optuna.study.study - INFO - Trial 204 finished with value: 0.12200968041673321 and parameters: {'n_layers': 1, 'embedding_dim': 256, 'lr': 0.00039445002089275077, 'lambda_val': 1.1249457663770262e-06, 'batch_size': 3172, 'optimizer': 'Adam'}. Best is trial 133 with value: 0.126434760649906.
2026-05-16 03:45:14,939 - optuna.study._optimize - INFO - Trial 205 pruned. 
2026-05-16 03:45:26,291 - experiment_functions - INFO - Early stopping at epoch 1700. Best Recall: 0.1239
2026-05-16 03:45:26,381 - optuna.study.study - INFO - Trial 206 finished with value: 0.12386316553764842 and parameters: {'n_layers': 1, 'embedding_dim': 256, 'lr': 0.0004132542715248265, 'lambda_val': 1.5484120011855128e-06, 'batch_size': 3337, 'optimizer': 'Adam'}. Best is trial 133 with value: 0.126434760649906.
2026-05-16 03:45:35,274 - optuna.study._optimize - INFO - Trial 207 pruned. 
2026-05-16 03:45:41,844 - optuna.study._optimize - INFO - Trial 208 pruned. 
2026-05-16 03:45:48,316 - optuna.study._optimize - INFO - Trial 209 pruned. 
2026-05-16 03:45:55,419 - optuna.study._optimize - INFO - Trial 210 pruned. 
2026-05-16 03:46:02,214 - optuna.study._optimize - INFO - Trial 211 pruned. 
2026-05-16 03:46:10,953 - optuna.study._optimize - INFO - Trial 212 pruned. 
2026-05-16 03:46:18,092 - experiment_functions - INFO - Early stopping at epoch 1000. Best Recall: 0.1177
2026-05-16 03:46:18,183 - optuna.study.study - INFO - Trial 213 finished with value: 0.11765224006883804 and parameters: {'n_layers': 1, 'embedding_dim': 256, 'lr': 0.0006864419687646165, 'lambda_val': 1.545312505893226e-06, 'batch_size': 3128, 'optimizer': 'Adam'}. Best is trial 133 with value: 0.126434760649906.
2026-05-16 03:46:24,764 - optuna.study._optimize - INFO - Trial 214 pruned. 
2026-05-16 03:46:36,190 - experiment_functions - INFO - Early stopping at epoch 1700. Best Recall: 0.1170
2026-05-16 03:46:36,289 - optuna.study.study - INFO - Trial 215 finished with value: 0.11696240916353427 and parameters: {'n_layers': 1, 'embedding_dim': 256, 'lr': 0.0004280431090547352, 'lambda_val': 1.9650925909027974e-06, 'batch_size': 2981, 'optimizer': 'Adam'}. Best is trial 133 with value: 0.126434760649906.
2026-05-16 03:46:42,293 - experiment_functions - INFO - Early stopping at epoch 850. Best Recall: 0.1114
2026-05-16 03:46:42,496 - optuna.study.study - INFO - Trial 216 finished with value: 0.11137880323739335 and parameters: {'n_layers': 1, 'embedding_dim': 256, 'lr': 0.000917423622366875, 'lambda_val': 1.3946911718501018e-06, 'batch_size': 3321, 'optimizer': 'Adam'}. Best is trial 133 with value: 0.126434760649906.
2026-05-16 03:46:55,791 - optuna.study._optimize - INFO - Trial 217 pruned. 
2026-05-16 03:47:02,916 - experiment_functions - INFO - Early stopping at epoch 1050. Best Recall: 0.1225
2026-05-16 03:47:03,006 - optuna.study.study - INFO - Trial 218 finished with value: 0.12251556926338206 and parameters: {'n_layers': 1, 'embedding_dim': 256, 'lr': 0.0006903073573108152, 'lambda_val': 1.87422306456448e-06, 'batch_size': 3066, 'optimizer': 'Adam'}. Best is trial 133 with value: 0.126434760649906.
2026-05-16 03:47:09,629 - optuna.study._optimize - INFO - Trial 219 pruned. 
2026-05-16 03:47:17,002 - experiment_functions - INFO - Early stopping at epoch 1050. Best Recall: 0.1193
2026-05-16 03:47:17,100 - optuna.study.study - INFO - Trial 220 finished with value: 0.11932980773710447 and parameters: {'n_layers': 1, 'embedding_dim': 256, 'lr': 0.0006807038501140779, 'lambda_val': 2.0678271633221303e-06, 'batch_size': 3069, 'optimizer': 'Adam'}. Best is trial 133 with value: 0.126434760649906.
2026-05-16 03:47:23,609 - experiment_functions - INFO - Early stopping at epoch 950. Best Recall: 0.1111
2026-05-16 03:47:23,798 - optuna.study.study - INFO - Trial 221 finished with value: 0.11107914514544874 and parameters: {'n_layers': 1, 'embedding_dim': 256, 'lr': 0.0006872095665252173, 'lambda_val': 1.938164814581081e-06, 'batch_size': 3083, 'optimizer': 'Adam'}. Best is trial 133 with value: 0.126434760649906.
2026-05-16 03:47:33,514 - optuna.study._optimize - INFO - Trial 222 pruned. 
2026-05-16 03:47:40,557 - experiment_functions - INFO - Early stopping at epoch 1100. Best Recall: 0.1241
2026-05-16 03:47:40,637 - optuna.study.study - INFO - Trial 223 finished with value: 0.12410862093295996 and parameters: {'n_layers': 1, 'embedding_dim': 256, 'lr': 0.0006252222196127391, 'lambda_val': 2.1527959482122305e-06, 'batch_size': 3040, 'optimizer': 'Adam'}. Best is trial 133 with value: 0.126434760649906.
2026-05-16 03:47:48,703 - experiment_functions - INFO - Early stopping at epoch 900. Best Recall: 0.1149
2026-05-16 03:47:48,802 - optuna.study.study - INFO - Trial 224 finished with value: 0.11491023554233477 and parameters: {'n_layers': 1, 'embedding_dim': 256, 'lr': 0.000984069456825152, 'lambda_val': 2.275107300915821e-06, 'batch_size': 2925, 'optimizer': 'Adam'}. Best is trial 133 with value: 0.126434760649906.
2026-05-16 03:47:57,305 - experiment_functions - INFO - Early stopping at epoch 1300. Best Recall: 0.1176
2026-05-16 03:47:57,405 - optuna.study.study - INFO - Trial 225 finished with value: 0.11760050966832176 and parameters: {'n_layers': 1, 'embedding_dim': 256, 'lr': 0.0005463508705603602, 'lambda_val': 2.835316491560888e-06, 'batch_size': 3022, 'optimizer': 'Adam'}. Best is trial 133 with value: 0.126434760649906.
2026-05-16 03:48:04,572 - optuna.study._optimize - INFO - Trial 226 pruned. 
2026-05-16 03:48:13,252 - experiment_functions - INFO - Early stopping at epoch 1300. Best Recall: 0.1210
2026-05-16 03:48:13,354 - optuna.study.study - INFO - Trial 227 finished with value: 0.1210239336041455 and parameters: {'n_layers': 1, 'embedding_dim': 256, 'lr': 0.0004745379486961623, 'lambda_val': 3.0821439725207486e-06, 'batch_size': 3252, 'optimizer': 'Adam'}. Best is trial 133 with value: 0.126434760649906.
2026-05-16 03:48:17,976 - experiment_functions - INFO - Early stopping at epoch 500. Best Recall: 0.0022
2026-05-16 03:48:18,121 - optuna.study.study - INFO - Trial 228 finished with value: 0.0021939625940855132 and parameters: {'n_layers': 1, 'embedding_dim': 96, 'lr': 0.000352114220163148, 'lambda_val': 2.9109356892982718e-06, 'batch_size': 3247, 'optimizer': 'SGD'}. Best is trial 133 with value: 0.126434760649906.
2026-05-16 03:48:24,469 - experiment_functions - INFO - Early stopping at epoch 950. Best Recall: 0.1099
2026-05-16 03:48:24,570 - optuna.study.study - INFO - Trial 229 finished with value: 0.10988864341887943 and parameters: {'n_layers': 1, 'embedding_dim': 256, 'lr': 0.0008550542488245552, 'lambda_val': 1.8469063748234142e-06, 'batch_size': 3204, 'optimizer': 'Adam'}. Best is trial 133 with value: 0.126434760649906.
2026-05-16 03:48:32,044 - optuna.study._optimize - INFO - Trial 230 pruned. 
2026-05-16 03:48:41,979 - experiment_functions - INFO - Early stopping at epoch 1600. Best Recall: 0.1256
2026-05-16 03:48:42,057 - optuna.study.study - INFO - Trial 231 finished with value: 0.12559006410717988 and parameters: {'n_layers': 1, 'embedding_dim': 256, 'lr': 0.0004726794144411819, 'lambda_val': 2.5194759537747633e-06, 'batch_size': 2043, 'optimizer': 'Adam'}. Best is trial 133 with value: 0.126434760649906.
2026-05-16 03:49:02,491 - experiment_functions - INFO - Early stopping at epoch 3050. Best Recall: 0.1333
2026-05-16 03:49:02,581 - optuna.study.study - INFO - Trial 232 finished with value: 0.13331929040634422 and parameters: {'n_layers': 1, 'embedding_dim': 256, 'lr': 0.0004485087490067557, 'lambda_val': 2.9377842288714474e-06, 'batch_size': 1822, 'optimizer': 'Adam'}. Best is trial 232 with value: 0.13331929040634422.
2026-05-16 03:49:12,990 - experiment_functions - INFO - Early stopping at epoch 1700. Best Recall: 0.1207
2026-05-16 03:49:13,080 - optuna.study.study - INFO - Trial 233 finished with value: 0.12071094717724831 and parameters: {'n_layers': 1, 'embedding_dim': 256, 'lr': 0.0004255264440614, 'lambda_val': 1.9817287118412393e-06, 'batch_size': 2100, 'optimizer': 'Adam'}. Best is trial 232 with value: 0.13331929040634422.
2026-05-16 03:49:19,703 - optuna.study._optimize - INFO - Trial 234 pruned. 
2026-05-16 03:49:25,638 - optuna.study._optimize - INFO - Trial 235 pruned. 
2026-05-16 03:49:33,627 - optuna.study._optimize - INFO - Trial 236 pruned. 
2026-05-16 03:49:50,888 - experiment_functions - INFO - Early stopping at epoch 1400. Best Recall: 0.1215
2026-05-16 03:49:50,978 - optuna.study.study - INFO - Trial 237 finished with value: 0.12146250544087248 and parameters: {'n_layers': 1, 'embedding_dim': 256, 'lr': 0.0006316104630807147, 'lambda_val': 2.0585297017330942e-06, 'batch_size': 1809, 'optimizer': 'Adam'}. Best is trial 232 with value: 0.13331929040634422.
2026-05-16 03:49:57,935 - optuna.study._optimize - INFO - Trial 238 pruned. 
2026-05-16 03:50:03,843 - optuna.study._optimize - INFO - Trial 239 pruned. 
2026-05-16 03:50:12,289 - experiment_functions - INFO - Early stopping at epoch 1250. Best Recall: 0.1202
2026-05-16 03:50:12,379 - optuna.study.study - INFO - Trial 240 finished with value: 0.12017236310033172 and parameters: {'n_layers': 1, 'embedding_dim': 256, 'lr': 0.0008752943266279543, 'lambda_val': 2.1624813482421016e-06, 'batch_size': 2030, 'optimizer': 'Adam'}. Best is trial 232 with value: 0.13331929040634422.
2026-05-16 03:50:19,740 - experiment_functions - INFO - Early stopping at epoch 1150. Best Recall: 0.1164
2026-05-16 03:50:19,820 - optuna.study.study - INFO - Trial 241 finished with value: 0.11641341920486974 and parameters: {'n_layers': 1, 'embedding_dim': 256, 'lr': 0.0007841004931000272, 'lambda_val': 2.0431284580557954e-06, 'batch_size': 2045, 'optimizer': 'Adam'}. Best is trial 232 with value: 0.13331929040634422.
2026-05-16 03:50:25,422 - experiment_functions - INFO - Early stopping at epoch 850. Best Recall: 0.1157
2026-05-16 03:50:25,522 - optuna.study.study - INFO - Trial 242 finished with value: 0.11573090869723035 and parameters: {'n_layers': 1, 'embedding_dim': 256, 'lr': 0.0011803538845511557, 'lambda_val': 2.8839582041476737e-06, 'batch_size': 2116, 'optimizer': 'Adam'}. Best is trial 232 with value: 0.13331929040634422.
2026-05-16 03:50:31,594 - experiment_functions - INFO - Early stopping at epoch 900. Best Recall: 0.1224
2026-05-16 03:50:31,750 - optuna.study.study - INFO - Trial 243 finished with value: 0.12235097506254347 and parameters: {'n_layers': 1, 'embedding_dim': 256, 'lr': 0.0009514182081775447, 'lambda_val': 2.39883040263937e-06, 'batch_size': 1886, 'optimizer': 'Adam'}. Best is trial 232 with value: 0.13331929040634422.
2026-05-16 03:50:53,565 - experiment_functions - INFO - Early stopping at epoch 2000. Best Recall: 0.1306
