2026-05-16 00:41:22,595 - optuna.study._optimize - INFO - Trial 286 pruned. 
2026-05-16 00:41:26,041 - experiment_functions - INFO - Early stopping at epoch 500. Best Recall: 0.0014
2026-05-16 00:41:26,131 - optuna.study.study - INFO - Trial 287 finished with value: 0.0014049140949658648 and parameters: {'n_layers': 1, 'embedding_dim': 256, 'lr': 0.0005671501452521089, 'lambda_val': 0.00011625343113847616, 'batch_size': 685, 'optimizer': 'SGD'}. Best is trial 276 with value: 0.1344438146287192.
2026-05-16 00:41:31,839 - experiment_functions - INFO - Early stopping at epoch 1000. Best Recall: 0.1113
2026-05-16 00:41:31,928 - optuna.study.study - INFO - Trial 288 finished with value: 0.11131516704117672 and parameters: {'n_layers': 1, 'embedding_dim': 128, 'lr': 0.0011233316890354474, 'lambda_val': 3.0591865794134444e-05, 'batch_size': 941, 'optimizer': 'Adam'}. Best is trial 276 with value: 0.1344438146287192.
2026-05-16 00:41:38,577 - optuna.study._optimize - INFO - Trial 289 pruned. 
2026-05-16 00:41:45,314 - optuna.study._optimize - INFO - Trial 290 pruned. 
2026-05-16 00:41:55,264 - optuna.study._optimize - INFO - Trial 291 pruned. 
2026-05-16 00:42:01,137 - optuna.study._optimize - INFO - Trial 292 pruned. 
2026-05-16 00:42:08,425 - optuna.study._optimize - INFO - Trial 293 pruned. 
2026-05-16 00:42:22,214 - experiment_functions - INFO - Early stopping at epoch 2500. Best Recall: 0.1190
2026-05-16 00:42:22,292 - optuna.study.study - INFO - Trial 294 finished with value: 0.11895106497873877 and parameters: {'n_layers': 1, 'embedding_dim': 128, 'lr': 0.0007752279080522648, 'lambda_val': 0.00011296546032164234, 'batch_size': 812, 'optimizer': 'RMSprop'}. Best is trial 276 with value: 0.1344438146287192.
2026-05-16 00:42:38,348 - experiment_functions - INFO - Early stopping at epoch 2850. Best Recall: 0.1274
2026-05-16 00:42:38,455 - optuna.study.study - INFO - Trial 295 finished with value: 0.12736512326759122 and parameters: {'n_layers': 1, 'embedding_dim': 128, 'lr': 0.0006630773027715029, 'lambda_val': 8.747859753259005e-05, 'batch_size': 513, 'optimizer': 'Adam'}. Best is trial 276 with value: 0.1344438146287192.
2026-05-16 00:42:45,870 - optuna.study._optimize - INFO - Trial 296 pruned. 
2026-05-16 00:42:52,133 - optuna.study._optimize - INFO - Trial 297 pruned. 
2026-05-16 00:42:59,742 - optuna.study._optimize - INFO - Trial 298 pruned. 
2026-05-16 00:43:05,916 - optuna.study._optimize - INFO - Trial 299 pruned. 
2026-05-16 00:43:14,942 - experiment_functions - INFO - Early stopping at epoch 2950. Best Recall: 0.1208
2026-05-16 00:43:15,053 - root - INFO - **** Training e_100K_1c2dcs
2026-05-16 00:43:15,053 - root - INFO -   ** 2-Dominant stats:
2026-05-16 00:43:15,053 - root - INFO -   ** Finding the dominant set:
2026-05-16 00:43:41,327 - root - INFO -   ** Getting the trainable edges:
2026-05-16 00:43:41,333 - helper_functions - INFO -      Number of nodes: 4003
2026-05-16 00:43:41,333 - helper_functions - INFO -      Ratio: 0.3873621056706019
2026-05-16 00:43:41,333 - helper_functions - INFO -      Number of unique users: 324
2026-05-16 00:43:41,333 - helper_functions - INFO -      Number of unique items: 3679
2026-05-16 00:43:41,333 - helper_functions - INFO -      Total dominant set edge: 13252
2026-05-16 00:43:41,333 - helper_functions - INFO -      Trainable edges: 10601.6
2026-05-16 00:43:41,336 - root - INFO -   **** Getting 13252 dominant set edges
2026-05-16 00:43:42,102 - optuna.storages._rdb.storage - INFO - A new study created in RDB with name: Study_e_100K_1c2dcs_strict
2026-05-16 00:43:48,122 - experiment_functions - INFO - Early stopping at epoch 750. Best Recall: 0.0028
2026-05-16 00:43:48,219 - optuna.study.study - INFO - Trial 0 finished with value: 0.0027621655338585017 and parameters: {'n_layers': 4, 'embedding_dim': 96, 'lr': 0.02205419133259371, 'lambda_val': 0.048165992363113, 'batch_size': 3604, 'optimizer': 'SGD'}. Best is trial 0 with value: 0.0027621655338585017.
2026-05-16 00:43:52,540 - experiment_functions - INFO - Early stopping at epoch 750. Best Recall: 0.0065
2026-05-16 00:43:52,631 - optuna.study.study - INFO - Trial 1 finished with value: 0.006482098177172012 and parameters: {'n_layers': 3, 'embedding_dim': 96, 'lr': 0.0006657560986297074, 'lambda_val': 0.0013991662486677692, 'batch_size': 1894, 'optimizer': 'Adam'}. Best is trial 1 with value: 0.006482098177172012.
2026-05-16 00:43:56,713 - experiment_functions - INFO - Early stopping at epoch 500. Best Recall: 0.0028
2026-05-16 00:43:56,803 - optuna.study.study - INFO - Trial 2 finished with value: 0.0028449779086138992 and parameters: {'n_layers': 4, 'embedding_dim': 256, 'lr': 0.0020246889507856596, 'lambda_val': 0.0002845985431893127, 'batch_size': 3816, 'optimizer': 'RMSprop'}. Best is trial 1 with value: 0.006482098177172012.
2026-05-16 00:44:01,508 - experiment_functions - INFO - Early stopping at epoch 550. Best Recall: 0.0064
2026-05-16 00:44:01,596 - optuna.study.study - INFO - Trial 3 finished with value: 0.006373296248851773 and parameters: {'n_layers': 4, 'embedding_dim': 256, 'lr': 0.0005924698457074006, 'lambda_val': 3.417246886565047e-05, 'batch_size': 2167, 'optimizer': 'RMSprop'}. Best is trial 1 with value: 0.006482098177172012.
2026-05-16 00:44:05,227 - experiment_functions - INFO - Early stopping at epoch 550. Best Recall: 0.0039
2026-05-16 00:44:05,307 - optuna.study.study - INFO - Trial 4 finished with value: 0.0038584620048032997 and parameters: {'n_layers': 4, 'embedding_dim': 32, 'lr': 0.003297196401740436, 'lambda_val': 0.00012919729996953373, 'batch_size': 1028, 'optimizer': 'Adam'}. Best is trial 1 with value: 0.006482098177172012.
2026-05-16 00:44:15,583 - experiment_functions - INFO - Early stopping at epoch 500. Best Recall: 0.0016
2026-05-16 00:44:16,350 - optuna.study.study - INFO - Trial 5 finished with value: 0.001636596013236793 and parameters: {'n_layers': 3, 'embedding_dim': 128, 'lr': 0.008444840544477488, 'lambda_val': 0.008085015888299173, 'batch_size': 517, 'optimizer': 'SGD'}. Best is trial 1 with value: 0.006482098177172012.
2026-05-16 00:44:26,563 - experiment_functions - INFO - Early stopping at epoch 1350. Best Recall: 0.0040
2026-05-16 00:44:26,652 - optuna.study.study - INFO - Trial 6 finished with value: 0.003953877042606234 and parameters: {'n_layers': 2, 'embedding_dim': 256, 'lr': 0.0035687367680612087, 'lambda_val': 5.0015078504352495e-05, 'batch_size': 2820, 'optimizer': 'RMSprop'}. Best is trial 1 with value: 0.006482098177172012.
2026-05-16 00:44:29,900 - experiment_functions - INFO - Early stopping at epoch 500. Best Recall: 0.0044
2026-05-16 00:44:29,991 - optuna.study.study - INFO - Trial 7 finished with value: 0.0043939698962281604 and parameters: {'n_layers': 2, 'embedding_dim': 32, 'lr': 0.02384789515457232, 'lambda_val': 0.0006266251974479499, 'batch_size': 3572, 'optimizer': 'RMSprop'}. Best is trial 1 with value: 0.006482098177172012.
2026-05-16 00:44:33,338 - experiment_functions - INFO - Early stopping at epoch 500. Best Recall: 0.0018
2026-05-16 00:44:33,438 - optuna.study.study - INFO - Trial 8 finished with value: 0.0017829218636208296 and parameters: {'n_layers': 3, 'embedding_dim': 64, 'lr': 2.6283716663397178e-05, 'lambda_val': 7.882830901487227e-06, 'batch_size': 1350, 'optimizer': 'RMSprop'}. Best is trial 1 with value: 0.006482098177172012.
2026-05-16 00:44:36,775 - experiment_functions - INFO - Early stopping at epoch 500. Best Recall: 0.0041
2026-05-16 00:44:36,887 - optuna.study.study - INFO - Trial 9 finished with value: 0.004090836700384776 and parameters: {'n_layers': 3, 'embedding_dim': 96, 'lr': 0.06970270399322948, 'lambda_val': 0.009677736034923362, 'batch_size': 2151, 'optimizer': 'RMSprop'}. Best is trial 1 with value: 0.006482098177172012.
2026-05-16 00:44:47,592 - experiment_functions - INFO - Early stopping at epoch 2050. Best Recall: 0.0146
2026-05-16 00:44:47,685 - optuna.study.study - INFO - Trial 10 finished with value: 0.014636288835140782 and parameters: {'n_layers': 1, 'embedding_dim': 96, 'lr': 0.0002125931902931, 'lambda_val': 2.0157187714169905e-06, 'batch_size': 1585, 'optimizer': 'Adam'}. Best is trial 10 with value: 0.014636288835140782.
2026-05-16 00:44:55,190 - optuna.study._optimize - INFO - Trial 11 pruned. 
2026-05-16 00:45:02,947 - optuna.study._optimize - INFO - Trial 12 pruned. 
2026-05-16 00:45:06,138 - experiment_functions - INFO - Early stopping at epoch 500. Best Recall: 0.0023
2026-05-16 00:45:06,229 - optuna.study.study - INFO - Trial 13 finished with value: 0.002279685854389339 and parameters: {'n_layers': 2, 'embedding_dim': 96, 'lr': 1.012250911713409e-05, 'lambda_val': 1.1860819568735736e-06, 'batch_size': 1766, 'optimizer': 'Adam'}. Best is trial 10 with value: 0.014636288835140782.
2026-05-16 00:45:11,773 - experiment_functions - INFO - Early stopping at epoch 950. Best Recall: 0.0118
2026-05-16 00:45:11,871 - optuna.study.study - INFO - Trial 14 finished with value: 0.011833616246779055 and parameters: {'n_layers': 1, 'embedding_dim': 64, 'lr': 0.0003660138770846222, 'lambda_val': 0.0022605628033370677, 'batch_size': 2713, 'optimizer': 'Adam'}. Best is trial 10 with value: 0.014636288835140782.
2026-05-16 00:45:19,311 - experiment_functions - INFO - Early stopping at epoch 1250. Best Recall: 0.0115
2026-05-16 00:45:19,410 - optuna.study.study - INFO - Trial 15 finished with value: 0.011455350910185158 and parameters: {'n_layers': 1, 'embedding_dim': 64, 'lr': 0.00015579873890791547, 'lambda_val': 7.34877498526396e-06, 'batch_size': 3025, 'optimizer': 'Adam'}. Best is trial 10 with value: 0.014636288835140782.
2026-05-16 00:45:23,391 - experiment_functions - INFO - Early stopping at epoch 650. Best Recall: 0.0032
2026-05-16 00:45:23,482 - optuna.study.study - INFO - Trial 16 finished with value: 0.0032066923442946095 and parameters: {'n_layers': 1, 'embedding_dim': 64, 'lr': 4.145759625951777e-05, 'lambda_val': 0.006397986438488097, 'batch_size': 2507, 'optimizer': 'Adam'}. Best is trial 10 with value: 0.014636288835140782.
2026-05-16 00:45:26,819 - experiment_functions - INFO - Early stopping at epoch 500. Best Recall: 0.0054
2026-05-16 00:45:26,912 - optuna.study.study - INFO - Trial 17 finished with value: 0.005397150268648776 and parameters: {'n_layers': 2, 'embedding_dim': 128, 'lr': 0.000433799181722234, 'lambda_val': 0.0771895151654733, 'batch_size': 3255, 'optimizer': 'Adam'}. Best is trial 10 with value: 0.014636288835140782.
2026-05-16 00:45:30,156 - experiment_functions - INFO - Early stopping at epoch 500. Best Recall: 0.0042
2026-05-16 00:45:30,239 - optuna.study.study - INFO - Trial 18 finished with value: 0.00419438219138185 and parameters: {'n_layers': 1, 'embedding_dim': 64, 'lr': 4.961621531233251e-05, 'lambda_val': 5.211557305373405e-06, 'batch_size': 1178, 'optimizer': 'SGD'}. Best is trial 10 with value: 0.014636288835140782.
2026-05-16 00:45:42,964 - experiment_functions - INFO - Early stopping at epoch 1950. Best Recall: 0.0206
2026-05-16 00:45:45,464 - optuna.study.study - INFO - Trial 19 finished with value: 0.020649880321361416 and parameters: {'n_layers': 1, 'embedding_dim': 32, 'lr': 0.00028946905498490437, 'lambda_val': 3.525711322848623e-05, 'batch_size': 516, 'optimizer': 'Adam'}. Best is trial 19 with value: 0.020649880321361416.
2026-05-16 00:45:53,099 - optuna.study._optimize - INFO - Trial 20 pruned. 
2026-05-16 00:46:03,624 - optuna.study._optimize - INFO - Trial 21 pruned. 
2026-05-16 00:46:07,599 - experiment_functions - INFO - Early stopping at epoch 700. Best Recall: 0.0166
2026-05-16 00:46:07,675 - optuna.study.study - INFO - Trial 22 finished with value: 0.016645337456625234 and parameters: {'n_layers': 1, 'embedding_dim': 32, 'lr': 0.0011558537960402594, 'lambda_val': 2.764982243536671e-06, 'batch_size': 1472, 'optimizer': 'Adam'}. Best is trial 19 with value: 0.020649880321361416.
2026-05-16 00:46:12,107 - experiment_functions - INFO - Early stopping at epoch 750. Best Recall: 0.0203
2026-05-16 00:46:12,201 - optuna.study.study - INFO - Trial 23 finished with value: 0.02026531894152947 and parameters: {'n_layers': 1, 'embedding_dim': 32, 'lr': 0.0011944105359452362, 'lambda_val': 2.4236677757958403e-06, 'batch_size': 1303, 'optimizer': 'Adam'}. Best is trial 19 with value: 0.020649880321361416.
2026-05-16 00:46:16,489 - experiment_functions - INFO - Early stopping at epoch 650. Best Recall: 0.0083
2026-05-16 00:46:16,582 - optuna.study.study - INFO - Trial 24 finished with value: 0.008326857483447145 and parameters: {'n_layers': 2, 'embedding_dim': 32, 'lr': 0.0011833936751124796, 'lambda_val': 3.006798544615699e-06, 'batch_size': 852, 'optimizer': 'Adam'}. Best is trial 19 with value: 0.020649880321361416.
2026-05-16 00:46:19,727 - experiment_functions - INFO - Early stopping at epoch 500. Best Recall: 0.0016
2026-05-16 00:46:19,867 - optuna.study.study - INFO - Trial 25 finished with value: 0.0016327962843258976 and parameters: {'n_layers': 1, 'embedding_dim': 32, 'lr': 0.0012714620511198823, 'lambda_val': 2.6556150235014436e-05, 'batch_size': 1346, 'optimizer': 'SGD'}. Best is trial 19 with value: 0.020649880321361416.
2026-05-16 00:46:24,015 - experiment_functions - INFO - Early stopping at epoch 550. Best Recall: 0.0169
2026-05-16 00:46:24,120 - optuna.study.study - INFO - Trial 26 finished with value: 0.016941285605555204 and parameters: {'n_layers': 1, 'embedding_dim': 32, 'lr': 0.007387544167563087, 'lambda_val': 1.3989592840473555e-05, 'batch_size': 855, 'optimizer': 'Adam'}. Best is trial 19 with value: 0.020649880321361416.
2026-05-16 00:46:27,820 - experiment_functions - INFO - Early stopping at epoch 550. Best Recall: 0.0115
2026-05-16 00:46:27,926 - optuna.study.study - INFO - Trial 27 finished with value: 0.011534580693856685 and parameters: {'n_layers': 2, 'embedding_dim': 32, 'lr': 0.007092604318694433, 'lambda_val': 1.3147037817985503e-05, 'batch_size': 849, 'optimizer': 'Adam'}. Best is trial 19 with value: 0.020649880321361416.
2026-05-16 00:46:32,110 - experiment_functions - INFO - Early stopping at epoch 550. Best Recall: 0.0137
2026-05-16 00:46:32,215 - optuna.study.study - INFO - Trial 28 finished with value: 0.01365011577427649 and parameters: {'n_layers': 1, 'embedding_dim': 32, 'lr': 0.010889867123897404, 'lambda_val': 5.3612761706398145e-05, 'batch_size': 1187, 'optimizer': 'Adam'}. Best is trial 19 with value: 0.020649880321361416.
2026-05-16 00:46:35,796 - experiment_functions - INFO - Early stopping at epoch 500. Best Recall: 0.0027
2026-05-16 00:46:35,923 - optuna.study.study - INFO - Trial 29 finished with value: 0.002716709909311413 and parameters: {'n_layers': 2, 'embedding_dim': 32, 'lr': 0.04579825804268328, 'lambda_val': 8.462139125079262e-05, 'batch_size': 740, 'optimizer': 'SGD'}. Best is trial 19 with value: 0.020649880321361416.
2026-05-16 00:46:39,648 - experiment_functions - INFO - Early stopping at epoch 550. Best Recall: 0.0065
2026-05-16 00:46:39,752 - optuna.study.study - INFO - Trial 30 finished with value: 0.00647842481997276 and parameters: {'n_layers': 1, 'embedding_dim': 128, 'lr': 0.021377642897888273, 'lambda_val': 4.451988473533949e-06, 'batch_size': 924, 'optimizer': 'Adam'}. Best is trial 19 with value: 0.020649880321361416.
2026-05-16 00:46:43,438 - experiment_functions - INFO - Early stopping at epoch 600. Best Recall: 0.0173
2026-05-16 00:46:43,741 - optuna.study.study - INFO - Trial 31 finished with value: 0.017305653002231497 and parameters: {'n_layers': 1, 'embedding_dim': 32, 'lr': 0.0024195399211897465, 'lambda_val': 1.2586029486567713e-05, 'batch_size': 1377, 'optimizer': 'Adam'}. Best is trial 19 with value: 0.020649880321361416.
2026-05-16 00:46:47,462 - experiment_functions - INFO - Early stopping at epoch 600. Best Recall: 0.0161
2026-05-16 00:46:47,554 - optuna.study.study - INFO - Trial 32 finished with value: 0.016070073178573785 and parameters: {'n_layers': 1, 'embedding_dim': 32, 'lr': 0.0035249472613047275, 'lambda_val': 1.4715993067001814e-05, 'batch_size': 1971, 'optimizer': 'Adam'}. Best is trial 19 with value: 0.020649880321361416.
2026-05-16 00:46:51,619 - experiment_functions - INFO - Early stopping at epoch 650. Best Recall: 0.0184
2026-05-16 00:46:51,724 - optuna.study.study - INFO - Trial 33 finished with value: 0.018369643523040668 and parameters: {'n_layers': 1, 'embedding_dim': 32, 'lr': 0.001830141230278393, 'lambda_val': 9.6040382139912e-06, 'batch_size': 1166, 'optimizer': 'Adam'}. Best is trial 19 with value: 0.020649880321361416.
2026-05-16 00:46:56,409 - experiment_functions - INFO - Early stopping at epoch 750. Best Recall: 0.0138
2026-05-16 00:46:56,559 - optuna.study.study - INFO - Trial 34 finished with value: 0.013789800486608305 and parameters: {'n_layers': 1, 'embedding_dim': 32, 'lr': 0.0007175789831406304, 'lambda_val': 3.286306500296313e-05, 'batch_size': 1178, 'optimizer': 'Adam'}. Best is trial 19 with value: 0.020649880321361416.
2026-05-16 00:47:00,602 - experiment_functions - INFO - Early stopping at epoch 550. Best Recall: 0.0192
2026-05-16 00:47:00,695 - optuna.study.study - INFO - Trial 35 finished with value: 0.019166048264843128 and parameters: {'n_layers': 1, 'embedding_dim': 256, 'lr': 0.0019676630944828574, 'lambda_val': 0.00036045746480251506, 'batch_size': 1795, 'optimizer': 'Adam'}. Best is trial 19 with value: 0.020649880321361416.
2026-05-16 00:47:04,036 - experiment_functions - INFO - Early stopping at epoch 500. Best Recall: 0.0014
2026-05-16 00:47:04,131 - optuna.study.study - INFO - Trial 36 finished with value: 0.001371766457132924 and parameters: {'n_layers': 2, 'embedding_dim': 256, 'lr': 0.001852519550332176, 'lambda_val': 0.0004456062100047533, 'batch_size': 2045, 'optimizer': 'SGD'}. Best is trial 19 with value: 0.020649880321361416.
2026-05-16 00:47:09,891 - experiment_functions - INFO - Early stopping at epoch 650. Best Recall: 0.0155
2026-05-16 00:47:09,996 - optuna.study.study - INFO - Trial 37 finished with value: 0.015501492021874182 and parameters: {'n_layers': 1, 'embedding_dim': 256, 'lr': 0.0007192004881855796, 'lambda_val': 0.00018751896314252755, 'batch_size': 1881, 'optimizer': 'Adam'}. Best is trial 19 with value: 0.020649880321361416.
2026-05-16 00:47:14,456 - experiment_functions - INFO - Early stopping at epoch 550. Best Recall: 0.0016
2026-05-16 00:47:14,559 - optuna.study.study - INFO - Trial 38 finished with value: 0.0015799475208645923 and parameters: {'n_layers': 4, 'embedding_dim': 256, 'lr': 0.0052176308996392815, 'lambda_val': 0.0008270092682577481, 'batch_size': 630, 'optimizer': 'Adam'}. Best is trial 19 with value: 0.020649880321361416.
2026-05-16 00:47:18,972 - experiment_functions - INFO - Early stopping at epoch 550. Best Recall: 0.0043
2026-05-16 00:47:19,109 - optuna.study.study - INFO - Trial 39 finished with value: 0.0043130137109558785 and parameters: {'n_layers': 2, 'embedding_dim': 256, 'lr': 0.001782192353687157, 'lambda_val': 6.765416202589929e-05, 'batch_size': 1056, 'optimizer': 'RMSprop'}. Best is trial 19 with value: 0.020649880321361416.
2026-05-16 00:47:22,740 - experiment_functions - INFO - Early stopping at epoch 500. Best Recall: 0.0020
2026-05-16 00:47:22,855 - optuna.study.study - INFO - Trial 40 finished with value: 0.0020287709482379305 and parameters: {'n_layers': 3, 'embedding_dim': 256, 'lr': 0.01692720339876435, 'lambda_val': 0.00034421809892173943, 'batch_size': 1740, 'optimizer': 'Adam'}. Best is trial 19 with value: 0.020649880321361416.
2026-05-16 00:47:26,623 - experiment_functions - INFO - Early stopping at epoch 600. Best Recall: 0.0146
2026-05-16 00:47:26,717 - optuna.study.study - INFO - Trial 41 finished with value: 0.014611959818595244 and parameters: {'n_layers': 1, 'embedding_dim': 32, 'lr': 0.00292387761172742, 'lambda_val': 2.511577421930709e-05, 'batch_size': 1449, 'optimizer': 'Adam'}. Best is trial 19 with value: 0.020649880321361416.
2026-05-16 00:47:32,336 - optuna.study._optimize - INFO - Trial 42 pruned. 
2026-05-16 00:47:36,478 - experiment_functions - INFO - Early stopping at epoch 600. Best Recall: 0.0103
2026-05-16 00:47:36,604 - optuna.study.study - INFO - Trial 43 finished with value: 0.010338792176602156 and parameters: {'n_layers': 1, 'embedding_dim': 32, 'lr': 0.0021001714247451653, 'lambda_val': 0.00011172241862317983, 'batch_size': 2315, 'optimizer': 'Adam'}. Best is trial 19 with value: 0.020649880321361416.
2026-05-16 00:47:40,473 - experiment_functions - INFO - Early stopping at epoch 650. Best Recall: 0.0188
2026-05-16 00:47:40,566 - optuna.study.study - INFO - Trial 44 finished with value: 0.018778174010499072 and parameters: {'n_layers': 1, 'embedding_dim': 128, 'lr': 0.0008334033535735109, 'lambda_val': 1.620650556179131e-06, 'batch_size': 1534, 'optimizer': 'RMSprop'}. Best is trial 19 with value: 0.020649880321361416.
2026-05-16 00:47:44,502 - experiment_functions - INFO - Early stopping at epoch 600. Best Recall: 0.0132
2026-05-16 00:47:44,618 - optuna.study.study - INFO - Trial 45 finished with value: 0.013152965175748044 and parameters: {'n_layers': 1, 'embedding_dim': 128, 'lr': 0.000930782291558919, 'lambda_val': 2.1276023242730056e-06, 'batch_size': 1611, 'optimizer': 'RMSprop'}. Best is trial 19 with value: 0.020649880321361416.
2026-05-16 00:47:51,204 - optuna.study._optimize - INFO - Trial 46 pruned. 
2026-05-16 00:47:57,733 - optuna.study._optimize - INFO - Trial 47 pruned. 
2026-05-16 00:48:02,124 - experiment_functions - INFO - Early stopping at epoch 700. Best Recall: 0.0073
2026-05-16 00:48:02,218 - optuna.study.study - INFO - Trial 48 finished with value: 0.007268534898477888 and parameters: {'n_layers': 3, 'embedding_dim': 128, 'lr': 0.0006209854943815453, 'lambda_val': 1.8425802758980316e-06, 'batch_size': 2301, 'optimizer': 'RMSprop'}. Best is trial 19 with value: 0.020649880321361416.
2026-05-16 00:48:06,915 - experiment_functions - INFO - Early stopping at epoch 750. Best Recall: 0.0115
