2026-05-15 21:41:05,745 - optuna.study.study - INFO - Trial 246 finished with value: 0.12107510534551935 and parameters: {'n_layers': 1, 'embedding_dim': 256, 'lr': 0.0005248983729547274, 'lambda_val': 1.8953074586258983e-06, 'batch_size': 1548, 'optimizer': 'Adam'}. Best is trial 217 with value: 0.12518349483867272.
2026-05-15 21:41:12,547 - optuna.study._optimize - INFO - Trial 247 pruned. 
2026-05-15 21:41:23,873 - experiment_functions - INFO - Early stopping at epoch 1600. Best Recall: 0.1262
2026-05-15 21:41:24,176 - optuna.study.study - INFO - Trial 248 finished with value: 0.126154116966993 and parameters: {'n_layers': 1, 'embedding_dim': 256, 'lr': 0.0005392972786599138, 'lambda_val': 2.358316464598226e-06, 'batch_size': 1358, 'optimizer': 'Adam'}. Best is trial 248 with value: 0.126154116966993.
2026-05-15 21:41:34,364 - optuna.study._optimize - INFO - Trial 249 pruned. 
2026-05-15 21:41:46,162 - experiment_functions - INFO - Early stopping at epoch 1750. Best Recall: 0.1187
2026-05-15 21:41:46,232 - optuna.study.study - INFO - Trial 250 finished with value: 0.1186849810701533 and parameters: {'n_layers': 1, 'embedding_dim': 256, 'lr': 0.0006188676286425144, 'lambda_val': 1.413023009862547e-06, 'batch_size': 1479, 'optimizer': 'Adam'}. Best is trial 248 with value: 0.126154116966993.
2026-05-15 21:41:54,389 - experiment_functions - INFO - Early stopping at epoch 1400. Best Recall: 0.1153
2026-05-15 21:41:54,459 - optuna.study.study - INFO - Trial 251 finished with value: 0.11534688160285243 and parameters: {'n_layers': 1, 'embedding_dim': 256, 'lr': 0.0006660461650680018, 'lambda_val': 1.420501699322051e-06, 'batch_size': 1364, 'optimizer': 'Adam'}. Best is trial 248 with value: 0.126154116966993.
2026-05-15 21:42:00,853 - experiment_functions - INFO - Early stopping at epoch 650. Best Recall: 0.0394
2026-05-15 21:42:00,944 - optuna.study.study - INFO - Trial 252 finished with value: 0.0393843621150559 and parameters: {'n_layers': 4, 'embedding_dim': 256, 'lr': 0.000809266483748906, 'lambda_val': 1.01284259638996e-06, 'batch_size': 1311, 'optimizer': 'Adam'}. Best is trial 248 with value: 0.126154116966993.
2026-05-15 21:42:11,402 - experiment_functions - INFO - Early stopping at epoch 1950. Best Recall: 0.1227
2026-05-15 21:42:11,502 - optuna.study.study - INFO - Trial 253 finished with value: 0.12269468262784027 and parameters: {'n_layers': 1, 'embedding_dim': 64, 'lr': 0.0005706358515261164, 'lambda_val': 1.836581442550213e-06, 'batch_size': 1559, 'optimizer': 'Adam'}. Best is trial 248 with value: 0.126154116966993.
2026-05-15 21:42:19,865 - optuna.study._optimize - INFO - Trial 254 pruned. 
2026-05-15 21:42:27,199 - optuna.study._optimize - INFO - Trial 255 pruned. 
2026-05-15 21:42:33,051 - optuna.study._optimize - INFO - Trial 256 pruned. 
2026-05-15 21:42:41,967 - optuna.study._optimize - INFO - Trial 257 pruned. 
2026-05-15 21:42:52,533 - experiment_functions - INFO - Early stopping at epoch 1400. Best Recall: 0.1175
2026-05-15 21:42:52,632 - optuna.study.study - INFO - Trial 258 finished with value: 0.11746768861990214 and parameters: {'n_layers': 1, 'embedding_dim': 256, 'lr': 0.0005524477727509036, 'lambda_val': 1.3831314180029906e-06, 'batch_size': 1557, 'optimizer': 'Adam'}. Best is trial 248 with value: 0.126154116966993.
2026-05-15 21:42:57,055 - experiment_functions - INFO - Early stopping at epoch 650. Best Recall: 0.0220
2026-05-15 21:42:57,164 - optuna.study.study - INFO - Trial 259 finished with value: 0.022018319692453717 and parameters: {'n_layers': 1, 'embedding_dim': 64, 'lr': 0.06367127953649412, 'lambda_val': 2.005216278541071e-06, 'batch_size': 1281, 'optimizer': 'Adam'}. Best is trial 248 with value: 0.126154116966993.
2026-05-15 21:43:05,126 - experiment_functions - INFO - Early stopping at epoch 1300. Best Recall: 0.1255
2026-05-15 21:43:05,217 - optuna.study.study - INFO - Trial 260 finished with value: 0.12550139946796351 and parameters: {'n_layers': 1, 'embedding_dim': 128, 'lr': 0.0007513593966856296, 'lambda_val': 1.7010171299141744e-06, 'batch_size': 1607, 'optimizer': 'Adam'}. Best is trial 248 with value: 0.126154116966993.
2026-05-15 21:43:11,300 - optuna.study._optimize - INFO - Trial 261 pruned. 
2026-05-15 21:43:23,679 - experiment_functions - INFO - Early stopping at epoch 500. Best Recall: 0.0024
2026-05-15 21:43:24,202 - optuna.study.study - INFO - Trial 262 finished with value: 0.002407052300929294 and parameters: {'n_layers': 1, 'embedding_dim': 128, 'lr': 0.0006473122968879454, 'lambda_val': 2.4323877735935323e-06, 'batch_size': 1728, 'optimizer': 'SGD'}. Best is trial 248 with value: 0.126154116966993.
2026-05-15 21:43:32,053 - experiment_functions - INFO - Early stopping at epoch 1200. Best Recall: 0.1156
2026-05-15 21:43:32,153 - optuna.study.study - INFO - Trial 263 finished with value: 0.11556492244166827 and parameters: {'n_layers': 1, 'embedding_dim': 256, 'lr': 0.0008848969795296122, 'lambda_val': 1.2929521888686187e-06, 'batch_size': 1587, 'optimizer': 'Adam'}. Best is trial 248 with value: 0.126154116966993.
2026-05-15 21:43:38,228 - optuna.study._optimize - INFO - Trial 264 pruned. 
2026-05-15 21:43:44,546 - optuna.study._optimize - INFO - Trial 265 pruned. 
2026-05-15 21:43:50,790 - optuna.study._optimize - INFO - Trial 266 pruned. 
2026-05-15 21:43:56,301 - optuna.study._optimize - INFO - Trial 267 pruned. 
2026-05-15 21:44:06,608 - experiment_functions - INFO - Early stopping at epoch 1700. Best Recall: 0.1220
2026-05-15 21:44:06,697 - optuna.study.study - INFO - Trial 268 finished with value: 0.12198422837673899 and parameters: {'n_layers': 1, 'embedding_dim': 256, 'lr': 0.0006028135033815605, 'lambda_val': 2.980235595789393e-06, 'batch_size': 1420, 'optimizer': 'Adam'}. Best is trial 248 with value: 0.126154116966993.
2026-05-15 21:44:12,538 - experiment_functions - INFO - Early stopping at epoch 900. Best Recall: 0.1185
2026-05-15 21:44:12,630 - optuna.study.study - INFO - Trial 269 finished with value: 0.11852278674506811 and parameters: {'n_layers': 1, 'embedding_dim': 256, 'lr': 0.001230605332808959, 'lambda_val': 2.9504173794412218e-06, 'batch_size': 1422, 'optimizer': 'Adam'}. Best is trial 248 with value: 0.126154116966993.
2026-05-15 21:44:18,705 - experiment_functions - INFO - Early stopping at epoch 950. Best Recall: 0.1120
2026-05-15 21:44:18,795 - optuna.study.study - INFO - Trial 270 finished with value: 0.1120141327704044 and parameters: {'n_layers': 1, 'embedding_dim': 256, 'lr': 0.0012412543697539616, 'lambda_val': 2.46858033392324e-06, 'batch_size': 1765, 'optimizer': 'Adam'}. Best is trial 248 with value: 0.126154116966993.
2026-05-15 21:44:27,532 - experiment_functions - INFO - Early stopping at epoch 1400. Best Recall: 0.1224
2026-05-15 21:44:27,624 - optuna.study.study - INFO - Trial 271 finished with value: 0.12236860474599509 and parameters: {'n_layers': 1, 'embedding_dim': 256, 'lr': 0.0006180076494773892, 'lambda_val': 2.770232658501612e-06, 'batch_size': 1452, 'optimizer': 'Adam'}. Best is trial 248 with value: 0.126154116966993.
2026-05-15 21:44:33,502 - optuna.study._optimize - INFO - Trial 272 pruned. 
2026-05-15 21:44:38,420 - experiment_functions - INFO - Early stopping at epoch 700. Best Recall: 0.1071
2026-05-15 21:44:38,499 - optuna.study.study - INFO - Trial 273 finished with value: 0.10705369420120615 and parameters: {'n_layers': 1, 'embedding_dim': 256, 'lr': 0.0015978556678111831, 'lambda_val': 3.1066688810080904e-06, 'batch_size': 1618, 'optimizer': 'Adam'}. Best is trial 248 with value: 0.126154116966993.
2026-05-15 21:44:47,921 - experiment_functions - INFO - Early stopping at epoch 1600. Best Recall: 0.1230
2026-05-15 21:44:48,020 - optuna.study.study - INFO - Trial 274 finished with value: 0.12299986637008638 and parameters: {'n_layers': 1, 'embedding_dim': 128, 'lr': 0.0007163527666103681, 'lambda_val': 2.049778477109998e-06, 'batch_size': 1351, 'optimizer': 'Adam'}. Best is trial 248 with value: 0.126154116966993.
2026-05-15 21:44:53,963 - optuna.study._optimize - INFO - Trial 275 pruned. 
2026-05-15 21:45:00,607 - optuna.study._optimize - INFO - Trial 276 pruned. 
2026-05-15 21:45:07,057 - optuna.study._optimize - INFO - Trial 277 pruned. 
2026-05-15 21:45:13,148 - optuna.study._optimize - INFO - Trial 278 pruned. 
2026-05-15 21:45:20,011 - optuna.study._optimize - INFO - Trial 279 pruned. 
2026-05-15 21:45:27,293 - optuna.study._optimize - INFO - Trial 280 pruned. 
2026-05-15 21:45:33,620 - optuna.study._optimize - INFO - Trial 281 pruned. 
2026-05-15 21:45:39,879 - experiment_functions - INFO - Early stopping at epoch 800. Best Recall: 0.0670
2026-05-15 21:45:39,977 - optuna.study.study - INFO - Trial 282 finished with value: 0.06698695299191926 and parameters: {'n_layers': 2, 'embedding_dim': 256, 'lr': 0.0006079071387614251, 'lambda_val': 0.004059245334525443, 'batch_size': 1401, 'optimizer': 'Adam'}. Best is trial 248 with value: 0.126154116966993.
2026-05-15 21:45:46,700 - optuna.study._optimize - INFO - Trial 283 pruned. 
2026-05-15 21:45:54,028 - optuna.study._optimize - INFO - Trial 284 pruned. 
2026-05-15 21:45:57,404 - experiment_functions - INFO - Early stopping at epoch 500. Best Recall: 0.0022
2026-05-15 21:45:57,496 - optuna.study.study - INFO - Trial 285 finished with value: 0.0022190860030555427 and parameters: {'n_layers': 1, 'embedding_dim': 256, 'lr': 0.0005496429966387627, 'lambda_val': 1.8080262688604824e-06, 'batch_size': 1292, 'optimizer': 'SGD'}. Best is trial 248 with value: 0.126154116966993.
2026-05-15 21:46:05,452 - experiment_functions - INFO - Early stopping at epoch 1300. Best Recall: 0.1200
2026-05-15 21:46:05,542 - optuna.study.study - INFO - Trial 286 finished with value: 0.12004459655756702 and parameters: {'n_layers': 1, 'embedding_dim': 256, 'lr': 0.0007594102271890473, 'lambda_val': 1.4358863906656106e-06, 'batch_size': 1428, 'optimizer': 'Adam'}. Best is trial 248 with value: 0.126154116966993.
2026-05-15 21:46:13,744 - optuna.study._optimize - INFO - Trial 287 pruned. 
2026-05-15 21:46:20,805 - optuna.study._optimize - INFO - Trial 288 pruned. 
2026-05-15 21:46:26,874 - optuna.study._optimize - INFO - Trial 289 pruned. 
2026-05-15 21:46:33,541 - experiment_functions - INFO - Early stopping at epoch 1000. Best Recall: 0.1163
2026-05-15 21:46:33,643 - optuna.study.study - INFO - Trial 290 finished with value: 0.11628445710443956 and parameters: {'n_layers': 1, 'embedding_dim': 256, 'lr': 0.0009805457474655192, 'lambda_val': 1.5349351493369946e-06, 'batch_size': 1683, 'optimizer': 'Adam'}. Best is trial 248 with value: 0.126154116966993.
2026-05-15 21:46:39,712 - experiment_functions - INFO - Early stopping at epoch 900. Best Recall: 0.0756
2026-05-15 21:46:39,854 - optuna.study.study - INFO - Trial 291 finished with value: 0.07555565029235566 and parameters: {'n_layers': 1, 'embedding_dim': 256, 'lr': 0.0003913385594743483, 'lambda_val': 0.015649747519444607, 'batch_size': 1261, 'optimizer': 'RMSprop'}. Best is trial 248 with value: 0.126154116966993.
2026-05-15 21:46:50,427 - experiment_functions - INFO - Early stopping at epoch 1600. Best Recall: 0.1182
2026-05-15 21:46:50,506 - optuna.study.study - INFO - Trial 292 finished with value: 0.11816048022700083 and parameters: {'n_layers': 1, 'embedding_dim': 256, 'lr': 0.0006438887515087525, 'lambda_val': 1.2163304384065474e-06, 'batch_size': 1431, 'optimizer': 'Adam'}. Best is trial 248 with value: 0.126154116966993.
2026-05-15 21:46:59,408 - experiment_functions - INFO - Early stopping at epoch 1350. Best Recall: 0.1175
2026-05-15 21:46:59,499 - optuna.study.study - INFO - Trial 293 finished with value: 0.11750580852807997 and parameters: {'n_layers': 1, 'embedding_dim': 256, 'lr': 0.0008270744441645184, 'lambda_val': 3.5699350719450234e-06, 'batch_size': 1335, 'optimizer': 'Adam'}. Best is trial 248 with value: 0.126154116966993.
2026-05-15 21:47:06,382 - optuna.study._optimize - INFO - Trial 294 pruned. 
2026-05-15 21:47:16,262 - experiment_functions - INFO - Early stopping at epoch 1300. Best Recall: 0.1174
2026-05-15 21:47:16,363 - optuna.study.study - INFO - Trial 295 finished with value: 0.11744632970951849 and parameters: {'n_layers': 1, 'embedding_dim': 256, 'lr': 0.0006849673794838038, 'lambda_val': 2.5356833687906806e-06, 'batch_size': 1558, 'optimizer': 'Adam'}. Best is trial 248 with value: 0.126154116966993.
2026-05-15 21:47:32,570 - experiment_functions - INFO - Early stopping at epoch 2500. Best Recall: 0.1283
2026-05-15 21:47:32,661 - optuna.study.study - INFO - Trial 296 finished with value: 0.12828228294473137 and parameters: {'n_layers': 1, 'embedding_dim': 256, 'lr': 0.0004057014252043598, 'lambda_val': 1.6137001592131801e-06, 'batch_size': 1509, 'optimizer': 'Adam'}. Best is trial 296 with value: 0.12828228294473137.
2026-05-15 21:47:40,484 - optuna.study._optimize - INFO - Trial 297 pruned. 
2026-05-15 21:47:52,573 - experiment_functions - INFO - Early stopping at epoch 1600. Best Recall: 0.1274
2026-05-15 21:47:52,671 - optuna.study.study - INFO - Trial 298 finished with value: 0.127429894393515 and parameters: {'n_layers': 1, 'embedding_dim': 256, 'lr': 0.0005248753341124897, 'lambda_val': 1.633436946779248e-06, 'batch_size': 1531, 'optimizer': 'Adam'}. Best is trial 296 with value: 0.12828228294473137.
2026-05-15 21:47:58,420 - optuna.study._optimize - INFO - Trial 299 pruned. 
2026-05-15 21:48:05,229 - experiment_functions - INFO - Early stopping at epoch 2000. Best Recall: 0.1222
2026-05-15 21:48:05,334 - root - INFO -   **** Training e_100K_1c1dcs_rand2
2026-05-15 21:48:05,347 - root - INFO -   **** Getting 65267/81200 random edges
2026-05-15 21:48:05,460 - optuna.storages._rdb.storage - INFO - A new study created in RDB with name: Study_e_100K_1c1dcs_rand2
2026-05-15 21:48:09,423 - experiment_functions - INFO - Early stopping at epoch 500. Best Recall: 0.0043
2026-05-15 21:48:09,514 - optuna.study.study - INFO - Trial 0 finished with value: 0.004330319965882896 and parameters: {'n_layers': 3, 'embedding_dim': 128, 'lr': 1.6864872789467658e-05, 'lambda_val': 0.08185568645426061, 'batch_size': 534, 'optimizer': 'SGD'}. Best is trial 0 with value: 0.004330319965882896.
2026-05-15 21:48:14,064 - experiment_functions - INFO - Early stopping at epoch 800. Best Recall: 0.0389
2026-05-15 21:48:14,386 - optuna.study.study - INFO - Trial 1 finished with value: 0.038854748100820874 and parameters: {'n_layers': 1, 'embedding_dim': 32, 'lr': 0.010283316273545368, 'lambda_val': 9.09365361945601e-06, 'batch_size': 1783, 'optimizer': 'RMSprop'}. Best is trial 1 with value: 0.038854748100820874.
2026-05-15 21:48:24,609 - experiment_functions - INFO - Early stopping at epoch 1500. Best Recall: 0.0238
2026-05-15 21:48:24,687 - optuna.study.study - INFO - Trial 2 finished with value: 0.02384684376407243 and parameters: {'n_layers': 3, 'embedding_dim': 96, 'lr': 0.0608232292558715, 'lambda_val': 6.404755260217924e-05, 'batch_size': 2998, 'optimizer': 'Adam'}. Best is trial 1 with value: 0.038854748100820874.
2026-05-15 21:48:28,609 - experiment_functions - INFO - Early stopping at epoch 550. Best Recall: 0.0221
2026-05-15 21:48:28,770 - optuna.study.study - INFO - Trial 3 finished with value: 0.022051836712571403 and parameters: {'n_layers': 1, 'embedding_dim': 256, 'lr': 0.047785324573861476, 'lambda_val': 6.278968439242968e-06, 'batch_size': 2255, 'optimizer': 'Adam'}. Best is trial 1 with value: 0.038854748100820874.
2026-05-15 21:48:32,798 - experiment_functions - INFO - Early stopping at epoch 500. Best Recall: 0.0023
2026-05-15 21:48:32,933 - optuna.study.study - INFO - Trial 4 finished with value: 0.002276558405218283 and parameters: {'n_layers': 3, 'embedding_dim': 32, 'lr': 0.0218916120744168, 'lambda_val': 0.001405359495696095, 'batch_size': 803, 'optimizer': 'SGD'}. Best is trial 1 with value: 0.038854748100820874.
2026-05-15 21:48:37,494 - experiment_functions - INFO - Early stopping at epoch 500. Best Recall: 0.0018
2026-05-15 21:48:37,573 - optuna.study.study - INFO - Trial 5 finished with value: 0.0017565366809115524 and parameters: {'n_layers': 3, 'embedding_dim': 256, 'lr': 1.4467251461559206e-05, 'lambda_val': 3.490233290932464e-06, 'batch_size': 1427, 'optimizer': 'SGD'}. Best is trial 1 with value: 0.038854748100820874.
2026-05-15 21:48:40,991 - experiment_functions - INFO - Early stopping at epoch 500. Best Recall: 0.0023
2026-05-15 21:48:41,078 - optuna.study.study - INFO - Trial 6 finished with value: 0.0022907377899920966 and parameters: {'n_layers': 1, 'embedding_dim': 32, 'lr': 3.905960527831915e-05, 'lambda_val': 9.432220639834396e-06, 'batch_size': 1408, 'optimizer': 'Adam'}. Best is trial 1 with value: 0.038854748100820874.
2026-05-15 21:48:58,795 - optuna.study._optimize - INFO - Trial 7 pruned. 
2026-05-15 21:49:02,475 - experiment_functions - INFO - Early stopping at epoch 500. Best Recall: 0.0021
2026-05-15 21:49:02,609 - optuna.study.study - INFO - Trial 8 finished with value: 0.002147548970403242 and parameters: {'n_layers': 2, 'embedding_dim': 64, 'lr': 0.0007724477094091668, 'lambda_val': 6.21166266725181e-06, 'batch_size': 2006, 'optimizer': 'SGD'}. Best is trial 1 with value: 0.038854748100820874.
2026-05-15 21:49:08,911 - optuna.study._optimize - INFO - Trial 9 pruned. 
2026-05-15 21:49:15,738 - experiment_functions - INFO - Early stopping at epoch 1200. Best Recall: 0.0265
2026-05-15 21:49:16,409 - optuna.study.study - INFO - Trial 10 finished with value: 0.026520514546161958 and parameters: {'n_layers': 2, 'embedding_dim': 32, 'lr': 0.003915003387792064, 'lambda_val': 0.0011651004021964002, 'batch_size': 4044, 'optimizer': 'RMSprop'}. Best is trial 1 with value: 0.038854748100820874.
2026-05-15 21:49:22,769 - experiment_functions - INFO - Early stopping at epoch 600. Best Recall: 0.0224
2026-05-15 21:49:22,856 - optuna.study.study - INFO - Trial 11 finished with value: 0.022434049867198477 and parameters: {'n_layers': 2, 'embedding_dim': 32, 'lr': 0.0027389399239370277, 'lambda_val': 0.002422822875283496, 'batch_size': 4058, 'optimizer': 'RMSprop'}. Best is trial 1 with value: 0.038854748100820874.
2026-05-15 21:49:27,380 - experiment_functions - INFO - Early stopping at epoch 700. Best Recall: 0.0228
2026-05-15 21:49:27,479 - optuna.study.study - INFO - Trial 12 finished with value: 0.022764419377924307 and parameters: {'n_layers': 2, 'embedding_dim': 32, 'lr': 0.004833910842019628, 'lambda_val': 0.011263405580145738, 'batch_size': 3210, 'optimizer': 'RMSprop'}. Best is trial 1 with value: 0.038854748100820874.
2026-05-15 21:49:41,186 - experiment_functions - INFO - Early stopping at epoch 2250. Best Recall: 0.1018
2026-05-15 21:49:41,276 - optuna.study.study - INFO - Trial 13 finished with value: 0.10181110254811987 and parameters: {'n_layers': 1, 'embedding_dim': 32, 'lr': 0.00047933648237938017, 'lambda_val': 0.00019205401751639422, 'batch_size': 3849, 'optimizer': 'RMSprop'}. Best is trial 13 with value: 0.10181110254811987.
2026-05-15 21:49:53,417 - optuna.study._optimize - INFO - Trial 14 pruned. 
2026-05-15 21:50:05,581 - experiment_functions - INFO - Early stopping at epoch 1700. Best Recall: 0.1104
2026-05-15 21:50:05,674 - optuna.study.study - INFO - Trial 15 finished with value: 0.11044462058672783 and parameters: {'n_layers': 1, 'embedding_dim': 64, 'lr': 0.0003460890410561514, 'lambda_val': 2.702099125876262e-05, 'batch_size': 2642, 'optimizer': 'RMSprop'}. Best is trial 15 with value: 0.11044462058672783.
2026-05-15 21:50:18,406 - optuna.study._optimize - INFO - Trial 16 pruned. 
2026-05-15 21:50:26,158 - optuna.study._optimize - INFO - Trial 17 pruned. 
2026-05-15 21:50:29,893 - experiment_functions - INFO - Early stopping at epoch 550. Best Recall: 0.0565
2026-05-15 21:50:30,039 - optuna.study.study - INFO - Trial 18 finished with value: 0.056467058939205 and parameters: {'n_layers': 2, 'embedding_dim': 128, 'lr': 0.0011111110384557728, 'lambda_val': 0.00042972468971886067, 'batch_size': 2652, 'optimizer': 'RMSprop'}. Best is trial 15 with value: 0.11044462058672783.
2026-05-15 21:50:36,176 - optuna.study._optimize - INFO - Trial 19 pruned. 
2026-05-15 21:50:51,221 - experiment_functions - INFO - Early stopping at epoch 750. Best Recall: 0.0459
2026-05-15 21:50:51,551 - optuna.study.study - INFO - Trial 20 finished with value: 0.04591479092397135 and parameters: {'n_layers': 2, 'embedding_dim': 64, 'lr': 0.0008891750336637172, 'lambda_val': 2.747638675740009e-05, 'batch_size': 2577, 'optimizer': 'RMSprop'}. Best is trial 15 with value: 0.11044462058672783.
2026-05-15 21:50:55,996 - experiment_functions - INFO - Early stopping at epoch 600. Best Recall: 0.0433
2026-05-15 21:50:56,105 - optuna.study.study - INFO - Trial 21 finished with value: 0.043291022194947806 and parameters: {'n_layers': 2, 'embedding_dim': 128, 'lr': 0.0013076401877262739, 'lambda_val': 0.0005398255397333633, 'batch_size': 2679, 'optimizer': 'RMSprop'}. Best is trial 15 with value: 0.11044462058672783.
2026-05-15 21:51:05,430 - optuna.study._optimize - INFO - Trial 22 pruned. 
2026-05-15 21:51:09,539 - experiment_functions - INFO - Early stopping at epoch 550. Best Recall: 0.0296
2026-05-15 21:51:09,630 - optuna.study.study - INFO - Trial 23 finished with value: 0.029597201374002215 and parameters: {'n_layers': 2, 'embedding_dim': 128, 'lr': 0.0014335945498841734, 'lambda_val': 0.009243673649293564, 'batch_size': 2493, 'optimizer': 'RMSprop'}. Best is trial 15 with value: 0.11044462058672783.
2026-05-15 21:51:15,552 - optuna.study._optimize - INFO - Trial 24 pruned. 
2026-05-15 21:51:21,455 - experiment_functions - INFO - Early stopping at epoch 850. Best Recall: 0.0651
2026-05-15 21:51:21,538 - optuna.study.study - INFO - Trial 25 finished with value: 0.06507157661845005 and parameters: {'n_layers': 2, 'embedding_dim': 96, 'lr': 0.0005445858199099683, 'lambda_val': 0.0001252509138017678, 'batch_size': 3686, 'optimizer': 'RMSprop'}. Best is trial 15 with value: 0.11044462058672783.
