2026-05-16 04:51:06,228 - optuna.study.study - INFO - Trial 68 finished with value: 0.07747607976171966 and parameters: {'n_layers': 1, 'embedding_dim': 32, 'lr': 0.0034218810164663243, 'lambda_val': 5.2940096557467904e-06, 'batch_size': 1292, 'optimizer': 'Adam'}. Best is trial 56 with value: 0.13182256400588102.
2026-05-16 04:51:11,926 - experiment_functions - INFO - Early stopping at epoch 700. Best Recall: 0.0352
2026-05-16 04:51:12,038 - optuna.study.study - INFO - Trial 69 finished with value: 0.035178482542477824 and parameters: {'n_layers': 2, 'embedding_dim': 256, 'lr': 0.011260382766550763, 'lambda_val': 3.7709139999538085e-06, 'batch_size': 1577, 'optimizer': 'Adam'}. Best is trial 56 with value: 0.13182256400588102.
2026-05-16 04:51:16,597 - experiment_functions - INFO - Early stopping at epoch 600. Best Recall: 0.0941
2026-05-16 04:51:16,751 - optuna.study.study - INFO - Trial 70 finished with value: 0.09405724539612481 and parameters: {'n_layers': 1, 'embedding_dim': 128, 'lr': 0.002151582332263173, 'lambda_val': 2.7055235960978568e-05, 'batch_size': 1960, 'optimizer': 'RMSprop'}. Best is trial 56 with value: 0.13182256400588102.
2026-05-16 04:51:22,769 - optuna.study._optimize - INFO - Trial 71 pruned. 
2026-05-16 04:51:30,764 - optuna.study._optimize - INFO - Trial 72 pruned. 
2026-05-16 04:51:43,472 - experiment_functions - INFO - Early stopping at epoch 2350. Best Recall: 0.1278
2026-05-16 04:51:43,573 - optuna.study.study - INFO - Trial 73 finished with value: 0.127753115434745 and parameters: {'n_layers': 1, 'embedding_dim': 96, 'lr': 0.0007019303565285227, 'lambda_val': 0.00024393500616841387, 'batch_size': 610, 'optimizer': 'Adam'}. Best is trial 56 with value: 0.13182256400588102.
2026-05-16 04:51:49,839 - optuna.study._optimize - INFO - Trial 74 pruned. 
2026-05-16 04:51:55,942 - optuna.study._optimize - INFO - Trial 75 pruned. 
2026-05-16 04:51:59,175 - experiment_functions - INFO - Early stopping at epoch 500. Best Recall: 0.0010
2026-05-16 04:51:59,265 - optuna.study.study - INFO - Trial 76 finished with value: 0.0009980855872085126 and parameters: {'n_layers': 1, 'embedding_dim': 96, 'lr': 0.00026693374491036285, 'lambda_val': 1.4634562210787965e-05, 'batch_size': 743, 'optimizer': 'SGD'}. Best is trial 56 with value: 0.13182256400588102.
2026-05-16 04:52:05,398 - optuna.study._optimize - INFO - Trial 77 pruned. 
2026-05-16 04:52:12,617 - optuna.study._optimize - INFO - Trial 78 pruned. 
2026-05-16 04:52:18,922 - experiment_functions - INFO - Early stopping at epoch 850. Best Recall: 0.0499
2026-05-16 04:52:19,034 - optuna.study.study - INFO - Trial 79 finished with value: 0.0499097326018526 and parameters: {'n_layers': 4, 'embedding_dim': 96, 'lr': 0.0006251511276838434, 'lambda_val': 0.0007321431501890381, 'batch_size': 1818, 'optimizer': 'Adam'}. Best is trial 56 with value: 0.13182256400588102.
2026-05-16 04:52:25,557 - optuna.study._optimize - INFO - Trial 80 pruned. 
2026-05-16 04:52:31,472 - experiment_functions - INFO - Early stopping at epoch 1050. Best Recall: 0.1176
2026-05-16 04:52:31,562 - optuna.study.study - INFO - Trial 81 finished with value: 0.11755590636510638 and parameters: {'n_layers': 1, 'embedding_dim': 96, 'lr': 0.0010232051662581734, 'lambda_val': 0.00015289602392668813, 'batch_size': 1147, 'optimizer': 'Adam'}. Best is trial 56 with value: 0.13182256400588102.
2026-05-16 04:52:38,681 - optuna.study._optimize - INFO - Trial 82 pruned. 
2026-05-16 04:52:46,278 - experiment_functions - INFO - Early stopping at epoch 800. Best Recall: 0.0975
2026-05-16 04:52:46,379 - optuna.study.study - INFO - Trial 83 finished with value: 0.09747979372649544 and parameters: {'n_layers': 1, 'embedding_dim': 96, 'lr': 0.0026326401190287126, 'lambda_val': 0.00013143922006139626, 'batch_size': 1325, 'optimizer': 'Adam'}. Best is trial 56 with value: 0.13182256400588102.
2026-05-16 04:52:51,631 - experiment_functions - INFO - Early stopping at epoch 850. Best Recall: 0.0964
2026-05-16 04:52:51,741 - optuna.study.study - INFO - Trial 84 finished with value: 0.09641825097976697 and parameters: {'n_layers': 1, 'embedding_dim': 96, 'lr': 0.00135980620489627, 'lambda_val': 7.648768000866456e-05, 'batch_size': 799, 'optimizer': 'Adam'}. Best is trial 56 with value: 0.13182256400588102.
2026-05-16 04:53:00,561 - optuna.study._optimize - INFO - Trial 85 pruned. 
2026-05-16 04:53:05,555 - experiment_functions - INFO - Early stopping at epoch 550. Best Recall: 0.0478
2026-05-16 04:53:05,656 - optuna.study.study - INFO - Trial 86 finished with value: 0.047812958267397454 and parameters: {'n_layers': 3, 'embedding_dim': 256, 'lr': 0.0017615454913180826, 'lambda_val': 6.3512144370681955e-06, 'batch_size': 3630, 'optimizer': 'Adam'}. Best is trial 56 with value: 0.13182256400588102.
2026-05-16 04:53:14,948 - experiment_functions - INFO - Early stopping at epoch 1200. Best Recall: 0.1202
2026-05-16 04:53:15,049 - optuna.study.study - INFO - Trial 87 finished with value: 0.12015794296878539 and parameters: {'n_layers': 1, 'embedding_dim': 96, 'lr': 0.0009073554950752311, 'lambda_val': 3.679045936116949e-05, 'batch_size': 1643, 'optimizer': 'Adam'}. Best is trial 56 with value: 0.13182256400588102.
2026-05-16 04:53:21,248 - optuna.study._optimize - INFO - Trial 88 pruned. 
2026-05-16 04:53:27,301 - optuna.study._optimize - INFO - Trial 89 pruned. 
2026-05-16 04:53:30,564 - experiment_functions - INFO - Early stopping at epoch 500. Best Recall: 0.0021
2026-05-16 04:53:30,655 - optuna.study.study - INFO - Trial 90 finished with value: 0.002114127250849033 and parameters: {'n_layers': 1, 'embedding_dim': 96, 'lr': 0.0008955217048467359, 'lambda_val': 4.7426982576831886e-05, 'batch_size': 667, 'optimizer': 'SGD'}. Best is trial 56 with value: 0.13182256400588102.
2026-05-16 04:53:37,204 - optuna.study._optimize - INFO - Trial 91 pruned. 
2026-05-16 04:53:45,336 - optuna.study._optimize - INFO - Trial 92 pruned. 
2026-05-16 04:53:50,234 - experiment_functions - INFO - Early stopping at epoch 700. Best Recall: 0.1042
2026-05-16 04:53:50,345 - optuna.study.study - INFO - Trial 93 finished with value: 0.10422573535662318 and parameters: {'n_layers': 1, 'embedding_dim': 96, 'lr': 0.0018306037662297549, 'lambda_val': 0.00020194894055680564, 'batch_size': 1525, 'optimizer': 'Adam'}. Best is trial 56 with value: 0.13182256400588102.
2026-05-16 04:53:56,544 - optuna.study._optimize - INFO - Trial 94 pruned. 
2026-05-16 04:54:03,336 - optuna.study._optimize - INFO - Trial 95 pruned. 
2026-05-16 04:54:09,286 - optuna.study._optimize - INFO - Trial 96 pruned. 
2026-05-16 04:54:15,228 - optuna.study._optimize - INFO - Trial 97 pruned. 
2026-05-16 04:54:19,247 - experiment_functions - INFO - Early stopping at epoch 550. Best Recall: 0.0516
2026-05-16 04:54:19,339 - optuna.study.study - INFO - Trial 98 finished with value: 0.05157499315119932 and parameters: {'n_layers': 1, 'embedding_dim': 96, 'lr': 0.025370465851838976, 'lambda_val': 0.0001486660319989633, 'batch_size': 1021, 'optimizer': 'Adam'}. Best is trial 56 with value: 0.13182256400588102.
2026-05-16 04:54:25,488 - optuna.study._optimize - INFO - Trial 99 pruned. 
2026-05-16 04:54:41,724 - experiment_functions - INFO - Early stopping at epoch 2700. Best Recall: 0.1280
2026-05-16 04:54:41,816 - optuna.study.study - INFO - Trial 100 finished with value: 0.1280182978286174 and parameters: {'n_layers': 1, 'embedding_dim': 96, 'lr': 0.0005838704151085081, 'lambda_val': 2.2671592124408132e-06, 'batch_size': 1151, 'optimizer': 'Adam'}. Best is trial 56 with value: 0.13182256400588102.
2026-05-16 04:54:47,466 - experiment_functions - INFO - Early stopping at epoch 900. Best Recall: 0.0038
2026-05-16 04:54:47,569 - optuna.study.study - INFO - Trial 101 finished with value: 0.003809344877632311 and parameters: {'n_layers': 1, 'embedding_dim': 96, 'lr': 2.06543515724219e-05, 'lambda_val': 4.069004242907543e-06, 'batch_size': 1124, 'optimizer': 'Adam'}. Best is trial 56 with value: 0.13182256400588102.
2026-05-16 04:54:53,543 - optuna.study._optimize - INFO - Trial 102 pruned. 
2026-05-16 04:54:59,575 - optuna.study._optimize - INFO - Trial 103 pruned. 
2026-05-16 04:55:06,109 - optuna.study._optimize - INFO - Trial 104 pruned. 
2026-05-16 04:55:12,682 - experiment_functions - INFO - Early stopping at epoch 1150. Best Recall: 0.1198
2026-05-16 04:55:12,773 - optuna.study.study - INFO - Trial 105 finished with value: 0.11983630337252442 and parameters: {'n_layers': 1, 'embedding_dim': 96, 'lr': 0.001121892614178768, 'lambda_val': 2.9041643580379697e-06, 'batch_size': 864, 'optimizer': 'Adam'}. Best is trial 56 with value: 0.13182256400588102.
2026-05-16 04:55:19,766 - optuna.study._optimize - INFO - Trial 106 pruned. 
2026-05-16 04:55:28,108 - optuna.study._optimize - INFO - Trial 107 pruned. 
2026-05-16 04:55:39,266 - experiment_functions - INFO - Early stopping at epoch 1800. Best Recall: 0.1258
2026-05-16 04:55:39,387 - optuna.study.study - INFO - Trial 108 finished with value: 0.1257804369164088 and parameters: {'n_layers': 1, 'embedding_dim': 256, 'lr': 0.0006594759600033327, 'lambda_val': 5.743203644982034e-06, 'batch_size': 681, 'optimizer': 'RMSprop'}. Best is trial 56 with value: 0.13182256400588102.
2026-05-16 04:55:45,831 - optuna.study._optimize - INFO - Trial 109 pruned. 
2026-05-16 04:55:55,355 - experiment_functions - INFO - Early stopping at epoch 1600. Best Recall: 0.1234
2026-05-16 04:55:55,456 - optuna.study.study - INFO - Trial 110 finished with value: 0.1233559625218826 and parameters: {'n_layers': 1, 'embedding_dim': 256, 'lr': 0.0006393385120449062, 'lambda_val': 1.7742184577747388e-05, 'batch_size': 667, 'optimizer': 'RMSprop'}. Best is trial 56 with value: 0.13182256400588102.
2026-05-16 04:56:02,281 - optuna.study._optimize - INFO - Trial 111 pruned. 
2026-05-16 04:56:16,207 - experiment_functions - INFO - Early stopping at epoch 2050. Best Recall: 0.1353
2026-05-16 04:56:16,311 - optuna.study.study - INFO - Trial 112 finished with value: 0.13529474700693775 and parameters: {'n_layers': 1, 'embedding_dim': 256, 'lr': 0.000661535823867454, 'lambda_val': 1.7821282737439314e-05, 'batch_size': 669, 'optimizer': 'RMSprop'}. Best is trial 112 with value: 0.13529474700693775.
2026-05-16 04:56:25,705 - experiment_functions - INFO - Early stopping at epoch 1550. Best Recall: 0.1247
2026-05-16 04:56:25,849 - optuna.study.study - INFO - Trial 113 finished with value: 0.12473068694658462 and parameters: {'n_layers': 1, 'embedding_dim': 256, 'lr': 0.0006524498967644938, 'lambda_val': 2.446703698137873e-05, 'batch_size': 660, 'optimizer': 'RMSprop'}. Best is trial 112 with value: 0.13529474700693775.
2026-05-16 04:56:32,842 - optuna.study._optimize - INFO - Trial 114 pruned. 
2026-05-16 04:56:40,684 - optuna.study._optimize - INFO - Trial 115 pruned. 
2026-05-16 04:56:47,941 - optuna.study._optimize - INFO - Trial 116 pruned. 
2026-05-16 04:56:54,250 - optuna.study._optimize - INFO - Trial 117 pruned. 
2026-05-16 04:57:00,677 - optuna.study._optimize - INFO - Trial 118 pruned. 
2026-05-16 04:57:07,539 - optuna.study._optimize - INFO - Trial 119 pruned. 
2026-05-16 04:57:14,470 - optuna.study._optimize - INFO - Trial 120 pruned. 
2026-05-16 04:57:22,584 - optuna.study._optimize - INFO - Trial 121 pruned. 
2026-05-16 04:57:39,633 - experiment_functions - INFO - Early stopping at epoch 3000. Best Recall: 0.1300
2026-05-16 04:57:39,733 - optuna.study.study - INFO - Trial 122 finished with value: 0.13000962961653406 and parameters: {'n_layers': 1, 'embedding_dim': 256, 'lr': 0.0004443454668058052, 'lambda_val': 2.7710220972306483e-05, 'batch_size': 797, 'optimizer': 'RMSprop'}. Best is trial 112 with value: 0.13529474700693775.
2026-05-16 04:57:46,247 - optuna.study._optimize - INFO - Trial 123 pruned. 
2026-05-16 04:57:52,571 - optuna.study._optimize - INFO - Trial 124 pruned. 
2026-05-16 04:57:59,024 - optuna.study._optimize - INFO - Trial 125 pruned. 
2026-05-16 04:58:05,900 - optuna.study._optimize - INFO - Trial 126 pruned. 
2026-05-16 04:58:13,229 - experiment_functions - INFO - Early stopping at epoch 900. Best Recall: 0.0463
2026-05-16 04:58:13,328 - optuna.study.study - INFO - Trial 127 finished with value: 0.046267027186856186 and parameters: {'n_layers': 3, 'embedding_dim': 256, 'lr': 0.0005600879097380016, 'lambda_val': 6.53940405069665e-06, 'batch_size': 1041, 'optimizer': 'RMSprop'}. Best is trial 112 with value: 0.13529474700693775.
2026-05-16 04:58:20,251 - optuna.study._optimize - INFO - Trial 128 pruned. 
2026-05-16 04:58:25,527 - experiment_functions - INFO - Early stopping at epoch 750. Best Recall: 0.0929
2026-05-16 04:58:25,636 - optuna.study.study - INFO - Trial 129 finished with value: 0.09286341078931029 and parameters: {'n_layers': 1, 'embedding_dim': 256, 'lr': 0.00154072334181612, 'lambda_val': 2.4891140992976184e-05, 'batch_size': 853, 'optimizer': 'RMSprop'}. Best is trial 112 with value: 0.13529474700693775.
2026-05-16 04:58:31,621 - optuna.study._optimize - INFO - Trial 130 pruned. 
2026-05-16 04:58:35,410 - experiment_functions - INFO - Early stopping at epoch 500. Best Recall: 0.0016
2026-05-16 04:58:35,501 - optuna.study.study - INFO - Trial 131 finished with value: 0.00158066796876559 and parameters: {'n_layers': 1, 'embedding_dim': 256, 'lr': 0.0006422012875823915, 'lambda_val': 4.407105522284378e-05, 'batch_size': 704, 'optimizer': 'SGD'}. Best is trial 112 with value: 0.13529474700693775.
2026-05-16 04:58:41,691 - optuna.study._optimize - INFO - Trial 132 pruned. 
2026-05-16 04:58:47,988 - optuna.study._optimize - INFO - Trial 133 pruned. 
2026-05-16 04:58:55,032 - optuna.study._optimize - INFO - Trial 134 pruned. 
2026-05-16 04:59:00,845 - optuna.study._optimize - INFO - Trial 135 pruned. 
2026-05-16 04:59:04,284 - experiment_functions - INFO - Early stopping at epoch 500. Best Recall: 0.0031
2026-05-16 04:59:04,388 - optuna.study.study - INFO - Trial 136 finished with value: 0.0031238169785108264 and parameters: {'n_layers': 1, 'embedding_dim': 256, 'lr': 0.0006013287316910882, 'lambda_val': 3.25687979116702e-05, 'batch_size': 1074, 'optimizer': 'SGD'}. Best is trial 112 with value: 0.13529474700693775.
2026-05-16 04:59:10,713 - optuna.study._optimize - INFO - Trial 137 pruned. 
2026-05-16 04:59:16,603 - optuna.study._optimize - INFO - Trial 138 pruned. 
2026-05-16 04:59:22,386 - experiment_functions - INFO - Early stopping at epoch 850. Best Recall: 0.1151
2026-05-16 04:59:22,486 - optuna.study.study - INFO - Trial 139 finished with value: 0.11506410108473299 and parameters: {'n_layers': 1, 'embedding_dim': 256, 'lr': 0.0013126055343905348, 'lambda_val': 1.5679973335746718e-05, 'batch_size': 1735, 'optimizer': 'Adam'}. Best is trial 112 with value: 0.13529474700693775.
2026-05-16 04:59:28,996 - optuna.study._optimize - INFO - Trial 140 pruned. 
2026-05-16 04:59:35,042 - optuna.study._optimize - INFO - Trial 141 pruned. 
2026-05-16 04:59:42,696 - optuna.study._optimize - INFO - Trial 142 pruned. 
2026-05-16 04:59:48,640 - optuna.study._optimize - INFO - Trial 143 pruned. 
2026-05-16 04:59:54,331 - optuna.study._optimize - INFO - Trial 144 pruned. 
2026-05-16 05:00:00,461 - optuna.study._optimize - INFO - Trial 145 pruned. 
2026-05-16 05:00:06,337 - optuna.study._optimize - INFO - Trial 146 pruned. 
2026-05-16 05:00:11,391 - experiment_functions - INFO - Early stopping at epoch 750. Best Recall: 0.1096
2026-05-16 05:00:11,472 - optuna.study.study - INFO - Trial 147 finished with value: 0.10963566668011838 and parameters: {'n_layers': 1, 'embedding_dim': 256, 'lr': 0.002011841033344144, 'lambda_val': 3.454255773484045e-05, 'batch_size': 1538, 'optimizer': 'Adam'}. Best is trial 112 with value: 0.13529474700693775.
2026-05-16 05:00:17,837 - optuna.study._optimize - INFO - Trial 148 pruned. 
2026-05-16 05:00:23,692 - optuna.study._optimize - INFO - Trial 149 pruned. 
2026-05-16 05:00:28,484 - experiment_functions - INFO - Early stopping at epoch 800. Best Recall: 0.0941
2026-05-16 05:00:28,564 - optuna.study.study - INFO - Trial 150 finished with value: 0.09411702243784288 and parameters: {'n_layers': 1, 'embedding_dim': 128, 'lr': 0.0007932774383679679, 'lambda_val': 0.0006479926002665527, 'batch_size': 1666, 'optimizer': 'RMSprop'}. Best is trial 112 with value: 0.13529474700693775.
2026-05-16 05:00:35,166 - optuna.study._optimize - INFO - Trial 151 pruned. 
2026-05-16 05:00:41,236 - optuna.study._optimize - INFO - Trial 152 pruned. 
2026-05-16 05:00:47,735 - optuna.study._optimize - INFO - Trial 153 pruned. 
2026-05-16 05:00:56,185 - optuna.study._optimize - INFO - Trial 154 pruned. 
2026-05-16 05:01:03,096 - optuna.study._optimize - INFO - Trial 155 pruned. 
2026-05-16 05:01:11,776 - optuna.study._optimize - INFO - Trial 156 pruned. 
2026-05-16 05:01:18,780 - optuna.study._optimize - INFO - Trial 157 pruned. 
2026-05-16 05:01:26,750 - optuna.study._optimize - INFO - Trial 158 pruned. 
2026-05-16 05:01:33,011 - optuna.study._optimize - INFO - Trial 159 pruned. 
2026-05-16 05:01:40,612 - experiment_functions - INFO - Early stopping at epoch 1300. Best Recall: 0.1246
2026-05-16 05:01:40,691 - optuna.study.study - INFO - Trial 160 finished with value: 0.12462363401649168 and parameters: {'n_layers': 1, 'embedding_dim': 128, 'lr': 0.0011284577901354708, 'lambda_val': 4.310899141861864e-06, 'batch_size': 858, 'optimizer': 'Adam'}. Best is trial 112 with value: 0.13529474700693775.
2026-05-16 05:01:48,636 - experiment_functions - INFO - Early stopping at epoch 1150. Best Recall: 0.1194
2026-05-16 05:01:48,763 - optuna.study.study - INFO - Trial 161 finished with value: 0.1194300848393341 and parameters: {'n_layers': 1, 'embedding_dim': 128, 'lr': 0.0011969886167586651, 'lambda_val': 3.7518749443716795e-06, 'batch_size': 829, 'optimizer': 'Adam'}. Best is trial 112 with value: 0.13529474700693775.
2026-05-16 05:02:00,357 - optuna.study._optimize - INFO - Trial 162 pruned. 
2026-05-16 05:02:06,979 - experiment_functions - INFO - Early stopping at epoch 550. Best Recall: 0.0165
2026-05-16 05:02:07,108 - optuna.study.study - INFO - Trial 163 finished with value: 0.016465186900753475 and parameters: {'n_layers': 1, 'embedding_dim': 128, 'lr': 0.09925847648446946, 'lambda_val': 4.6089544841327494e-06, 'batch_size': 637, 'optimizer': 'Adam'}. Best is trial 112 with value: 0.13529474700693775.
2026-05-16 05:02:13,031 - experiment_functions - INFO - Early stopping at epoch 700. Best Recall: 0.0358
2026-05-16 05:02:13,166 - optuna.study.study - INFO - Trial 164 finished with value: 0.035773981379466344 and parameters: {'n_layers': 4, 'embedding_dim': 128, 'lr': 0.0010402047318974895, 'lambda_val': 2.840258545664598e-06, 'batch_size': 974, 'optimizer': 'Adam'}. Best is trial 112 with value: 0.13529474700693775.
2026-05-16 05:02:20,190 - optuna.study._optimize - INFO - Trial 165 pruned. 
2026-05-16 05:02:27,456 - optuna.study._optimize - INFO - Trial 166 pruned. 
2026-05-16 05:02:34,426 - optuna.study._optimize - INFO - Trial 167 pruned. 
2026-05-16 05:02:38,171 - experiment_functions - INFO - Early stopping at epoch 500. Best Recall: 0.0025
2026-05-16 05:02:38,263 - optuna.study.study - INFO - Trial 168 finished with value: 0.0024863090237814507 and parameters: {'n_layers': 1, 'embedding_dim': 256, 'lr': 0.001403788129788347, 'lambda_val': 8.750613368306323e-06, 'batch_size': 767, 'optimizer': 'SGD'}. Best is trial 112 with value: 0.13529474700693775.
2026-05-16 05:02:45,479 - optuna.study._optimize - INFO - Trial 169 pruned. 
2026-05-16 05:02:53,442 - optuna.study._optimize - INFO - Trial 170 pruned. 
2026-05-16 05:02:59,906 - optuna.study._optimize - INFO - Trial 171 pruned. 
2026-05-16 05:03:06,193 - optuna.study._optimize - INFO - Trial 172 pruned. 
2026-05-16 05:03:12,654 - optuna.study._optimize - INFO - Trial 173 pruned. 
2026-05-16 05:03:21,445 - experiment_functions - INFO - Early stopping at epoch 1500. Best Recall: 0.1230
2026-05-16 05:03:21,545 - optuna.study.study - INFO - Trial 174 finished with value: 0.12302482513724643 and parameters: {'n_layers': 1, 'embedding_dim': 128, 'lr': 0.0011653236483322345, 'lambda_val': 6.021615441772886e-06, 'batch_size': 679, 'optimizer': 'Adam'}. Best is trial 112 with value: 0.13529474700693775.
2026-05-16 05:03:38,223 - experiment_functions - INFO - Early stopping at epoch 2700. Best Recall: 0.1325
2026-05-16 05:03:38,322 - optuna.study.study - INFO - Trial 175 finished with value: 0.13254648915030484 and parameters: {'n_layers': 1, 'embedding_dim': 256, 'lr': 0.0008849772386565812, 'lambda_val': 6.0374771323545306e-06, 'batch_size': 519, 'optimizer': 'Adam'}. Best is trial 112 with value: 0.13529474700693775.
2026-05-16 05:03:45,179 - optuna.study._optimize - INFO - Trial 176 pruned. 
2026-05-16 05:03:54,663 - optuna.study._optimize - INFO - Trial 177 pruned. 
2026-05-16 05:04:00,902 - optuna.study._optimize - INFO - Trial 178 pruned. 
2026-05-16 05:04:10,790 - optuna.study._optimize - INFO - Trial 179 pruned. 
2026-05-16 05:04:15,110 - experiment_functions - INFO - Early stopping at epoch 600. Best Recall: 0.0180
2026-05-16 05:04:15,200 - optuna.study.study - INFO - Trial 180 finished with value: 0.018013491285792008 and parameters: {'n_layers': 1, 'embedding_dim': 256, 'lr': 0.07228557621406191, 'lambda_val': 9.894969615443377e-06, 'batch_size': 517, 'optimizer': 'Adam'}. Best is trial 112 with value: 0.13529474700693775.
2026-05-16 05:04:21,412 - optuna.study._optimize - INFO - Trial 181 pruned. 
2026-05-16 05:04:27,893 - optuna.study._optimize - INFO - Trial 182 pruned. 
2026-05-16 05:04:40,894 - experiment_functions - INFO - Early stopping at epoch 2150. Best Recall: 0.1372
2026-05-16 05:04:41,032 - optuna.study.study - INFO - Trial 183 finished with value: 0.13724864888274418 and parameters: {'n_layers': 1, 'embedding_dim': 256, 'lr': 0.000718907337176727, 'lambda_val': 5.454007365366589e-05, 'batch_size': 648, 'optimizer': 'Adam'}. Best is trial 183 with value: 0.13724864888274418.
