2026-05-16 09:43:29,888 - optuna.study._optimize - INFO - Trial 265 pruned. 
2026-05-16 09:43:37,771 - optuna.study._optimize - INFO - Trial 266 pruned. 
2026-05-16 09:43:49,384 - optuna.study._optimize - INFO - Trial 267 pruned. 
2026-05-16 09:43:56,593 - optuna.study._optimize - INFO - Trial 268 pruned. 
2026-05-16 09:44:04,013 - optuna.study._optimize - INFO - Trial 269 pruned. 
2026-05-16 09:44:20,286 - optuna.study._optimize - INFO - Trial 270 pruned. 
2026-05-16 09:44:27,937 - optuna.study._optimize - INFO - Trial 271 pruned. 
2026-05-16 09:44:36,340 - optuna.study._optimize - INFO - Trial 272 pruned. 
2026-05-16 09:44:55,213 - experiment_functions - INFO - Early stopping at epoch 2400. Best Recall: 0.1286
2026-05-16 09:44:56,935 - optuna.study.study - INFO - Trial 273 finished with value: 0.12864112220990467 and parameters: {'n_layers': 1, 'embedding_dim': 256, 'lr': 0.0006243956061739594, 'lambda_val': 0.00012625417258835007, 'batch_size': 966, 'optimizer': 'Adam'}. Best is trial 222 with value: 0.1420443293408257.
2026-05-16 09:45:06,314 - experiment_functions - INFO - Early stopping at epoch 1450. Best Recall: 0.1194
2026-05-16 09:45:06,496 - optuna.study.study - INFO - Trial 274 finished with value: 0.11939213601387537 and parameters: {'n_layers': 1, 'embedding_dim': 256, 'lr': 0.0008132866381069919, 'lambda_val': 0.00011800239448696198, 'batch_size': 999, 'optimizer': 'Adam'}. Best is trial 222 with value: 0.1420443293408257.
2026-05-16 09:45:14,966 - experiment_functions - INFO - Early stopping at epoch 1250. Best Recall: 0.1174
2026-05-16 09:45:15,089 - optuna.study.study - INFO - Trial 275 finished with value: 0.1173820870572278 and parameters: {'n_layers': 1, 'embedding_dim': 256, 'lr': 0.0010654569322143355, 'lambda_val': 8.743806458911118e-05, 'batch_size': 972, 'optimizer': 'Adam'}. Best is trial 222 with value: 0.1420443293408257.
2026-05-16 09:45:22,706 - optuna.study._optimize - INFO - Trial 276 pruned. 
2026-05-16 09:45:30,406 - experiment_functions - INFO - Early stopping at epoch 800. Best Recall: 0.0823
2026-05-16 09:45:30,526 - optuna.study.study - INFO - Trial 277 finished with value: 0.08228540397553574 and parameters: {'n_layers': 2, 'embedding_dim': 256, 'lr': 0.0006446381252552828, 'lambda_val': 0.0001613490727612801, 'batch_size': 1186, 'optimizer': 'Adam'}. Best is trial 222 with value: 0.1420443293408257.
2026-05-16 09:45:41,502 - optuna.study._optimize - INFO - Trial 278 pruned. 
2026-05-16 09:45:45,394 - experiment_functions - INFO - Early stopping at epoch 500. Best Recall: 0.0032
2026-05-16 09:45:45,515 - optuna.study.study - INFO - Trial 279 finished with value: 0.003176418593511531 and parameters: {'n_layers': 1, 'embedding_dim': 256, 'lr': 0.0005105301851521525, 'lambda_val': 9.626667003995188e-05, 'batch_size': 1082, 'optimizer': 'SGD'}. Best is trial 222 with value: 0.1420443293408257.
2026-05-16 09:45:54,429 - optuna.study._optimize - INFO - Trial 280 pruned. 
2026-05-16 09:46:04,361 - experiment_functions - INFO - Early stopping at epoch 1450. Best Recall: 0.1206
2026-05-16 09:46:04,463 - optuna.study.study - INFO - Trial 281 finished with value: 0.12059711382077275 and parameters: {'n_layers': 1, 'embedding_dim': 256, 'lr': 0.0007754237827624944, 'lambda_val': 0.00014125849918573364, 'batch_size': 940, 'optimizer': 'Adam'}. Best is trial 222 with value: 0.1420443293408257.
2026-05-16 09:46:11,725 - optuna.study._optimize - INFO - Trial 282 pruned. 
2026-05-16 09:46:36,042 - experiment_functions - INFO - Early stopping at epoch 3050. Best Recall: 0.1414
2026-05-16 09:46:36,187 - optuna.study.study - INFO - Trial 283 finished with value: 0.14141938247920358 and parameters: {'n_layers': 1, 'embedding_dim': 256, 'lr': 0.0006278499882034224, 'lambda_val': 0.00011027343971116763, 'batch_size': 575, 'optimizer': 'Adam'}. Best is trial 222 with value: 0.1420443293408257.
2026-05-16 09:46:53,283 - experiment_functions - INFO - Early stopping at epoch 2300. Best Recall: 0.1333
2026-05-16 09:46:53,383 - optuna.study.study - INFO - Trial 284 finished with value: 0.13329831150030202 and parameters: {'n_layers': 1, 'embedding_dim': 256, 'lr': 0.0005775503151778055, 'lambda_val': 8.687706068618755e-05, 'batch_size': 519, 'optimizer': 'Adam'}. Best is trial 222 with value: 0.1420443293408257.
2026-05-16 09:47:11,529 - experiment_functions - INFO - Early stopping at epoch 2800. Best Recall: 0.1298
2026-05-16 09:47:11,850 - optuna.study.study - INFO - Trial 285 finished with value: 0.12982534003867943 and parameters: {'n_layers': 1, 'embedding_dim': 256, 'lr': 0.0006699862412387613, 'lambda_val': 7.506505130974359e-05, 'batch_size': 554, 'optimizer': 'Adam'}. Best is trial 222 with value: 0.1420443293408257.
2026-05-16 09:47:19,753 - optuna.study._optimize - INFO - Trial 286 pruned. 
2026-05-16 09:47:28,785 - optuna.study._optimize - INFO - Trial 287 pruned. 
2026-05-16 09:47:41,597 - optuna.study._optimize - INFO - Trial 288 pruned. 
2026-05-16 09:47:47,942 - optuna.study._optimize - INFO - Trial 289 pruned. 
2026-05-16 09:47:52,947 - experiment_functions - INFO - Early stopping at epoch 550. Best Recall: 0.0252
2026-05-16 09:47:53,049 - optuna.study.study - INFO - Trial 290 finished with value: 0.025215195186324216 and parameters: {'n_layers': 1, 'embedding_dim': 256, 'lr': 0.04771165590691591, 'lambda_val': 5.992516364518947e-05, 'batch_size': 589, 'optimizer': 'Adam'}. Best is trial 222 with value: 0.1420443293408257.
2026-05-16 09:48:01,944 - optuna.study._optimize - INFO - Trial 291 pruned. 
2026-05-16 09:48:09,025 - optuna.study._optimize - INFO - Trial 292 pruned. 
2026-05-16 09:48:18,105 - optuna.study._optimize - INFO - Trial 293 pruned. 
2026-05-16 09:48:24,701 - optuna.study._optimize - INFO - Trial 294 pruned. 
2026-05-16 09:48:37,810 - experiment_functions - INFO - Early stopping at epoch 1750. Best Recall: 0.1229
2026-05-16 09:48:37,909 - optuna.study.study - INFO - Trial 295 finished with value: 0.12293780690951164 and parameters: {'n_layers': 1, 'embedding_dim': 256, 'lr': 0.0008504003997552492, 'lambda_val': 7.34302130711952e-05, 'batch_size': 520, 'optimizer': 'Adam'}. Best is trial 222 with value: 0.1420443293408257.
2026-05-16 09:48:53,827 - experiment_functions - INFO - Early stopping at epoch 2400. Best Recall: 0.1257
2026-05-16 09:48:53,925 - optuna.study.study - INFO - Trial 296 finished with value: 0.1257265579454916 and parameters: {'n_layers': 1, 'embedding_dim': 256, 'lr': 0.0006281599445466623, 'lambda_val': 0.00012578631086797984, 'batch_size': 721, 'optimizer': 'Adam'}. Best is trial 222 with value: 0.1420443293408257.
2026-05-16 09:49:02,741 - optuna.study._optimize - INFO - Trial 297 pruned. 
2026-05-16 09:49:10,298 - optuna.study._optimize - INFO - Trial 298 pruned. 
2026-05-16 09:49:18,752 - optuna.study._optimize - INFO - Trial 299 pruned. 
2026-05-16 09:49:27,844 - experiment_functions - INFO - Early stopping at epoch 2200. Best Recall: 0.1228
2026-05-16 09:49:27,961 - root - INFO -   **** Training e_100K_1c3dcs_rand5
2026-05-16 09:49:27,974 - root - INFO -   **** Getting 70319/81200 random edges
2026-05-16 09:49:28,611 - optuna.storages._rdb.storage - INFO - A new study created in RDB with name: Study_e_100K_1c3dcs_rand5
2026-05-16 09:49:34,379 - experiment_functions - INFO - Early stopping at epoch 550. Best Recall: 0.0204
2026-05-16 09:49:35,157 - optuna.study.study - INFO - Trial 0 finished with value: 0.020444455601459542 and parameters: {'n_layers': 4, 'embedding_dim': 32, 'lr': 0.006708308840361669, 'lambda_val': 0.00035950985817214564, 'batch_size': 3928, 'optimizer': 'RMSprop'}. Best is trial 0 with value: 0.020444455601459542.
2026-05-16 09:49:45,767 - experiment_functions - INFO - Early stopping at epoch 950. Best Recall: 0.0338
2026-05-16 09:49:45,870 - optuna.study.study - INFO - Trial 1 finished with value: 0.03376420184809025 and parameters: {'n_layers': 4, 'embedding_dim': 256, 'lr': 0.00022365809781505, 'lambda_val': 5.226650195823501e-06, 'batch_size': 2393, 'optimizer': 'RMSprop'}. Best is trial 1 with value: 0.03376420184809025.
2026-05-16 09:49:50,890 - experiment_functions - INFO - Early stopping at epoch 500. Best Recall: 0.0023
2026-05-16 09:49:50,992 - optuna.study.study - INFO - Trial 2 finished with value: 0.002312987744062726 and parameters: {'n_layers': 4, 'embedding_dim': 256, 'lr': 0.002988557832039137, 'lambda_val': 1.4909653308668762e-06, 'batch_size': 959, 'optimizer': 'SGD'}. Best is trial 1 with value: 0.03376420184809025.
2026-05-16 09:49:54,842 - experiment_functions - INFO - Early stopping at epoch 500. Best Recall: 0.0034
2026-05-16 09:49:55,026 - optuna.study.study - INFO - Trial 3 finished with value: 0.003448531173579921 and parameters: {'n_layers': 2, 'embedding_dim': 96, 'lr': 0.0010916651302963678, 'lambda_val': 0.00022151126693203157, 'batch_size': 4070, 'optimizer': 'SGD'}. Best is trial 1 with value: 0.03376420184809025.
2026-05-16 09:49:59,971 - experiment_functions - INFO - Early stopping at epoch 500. Best Recall: 0.0039
2026-05-16 09:50:00,073 - optuna.study.study - INFO - Trial 4 finished with value: 0.003857735308005159 and parameters: {'n_layers': 4, 'embedding_dim': 128, 'lr': 0.0009696824137712113, 'lambda_val': 0.017093378753154826, 'batch_size': 2635, 'optimizer': 'SGD'}. Best is trial 1 with value: 0.03376420184809025.
2026-05-16 09:50:07,509 - experiment_functions - INFO - Early stopping at epoch 500. Best Recall: 0.0033
2026-05-16 09:50:07,611 - optuna.study.study - INFO - Trial 5 finished with value: 0.003298196618483324 and parameters: {'n_layers': 4, 'embedding_dim': 256, 'lr': 0.0017747921060669288, 'lambda_val': 0.059428775391804974, 'batch_size': 2259, 'optimizer': 'SGD'}. Best is trial 1 with value: 0.03376420184809025.
2026-05-16 09:50:11,587 - experiment_functions - INFO - Early stopping at epoch 600. Best Recall: 0.0822
2026-05-16 09:50:11,691 - optuna.study.study - INFO - Trial 6 finished with value: 0.08215222267514001 and parameters: {'n_layers': 1, 'embedding_dim': 64, 'lr': 0.004010432441997718, 'lambda_val': 1.2323578771149106e-06, 'batch_size': 2563, 'optimizer': 'Adam'}. Best is trial 6 with value: 0.08215222267514001.
2026-05-16 09:50:15,967 - experiment_functions - INFO - Early stopping at epoch 550. Best Recall: 0.0900
2026-05-16 09:50:16,069 - optuna.study.study - INFO - Trial 7 finished with value: 0.0900058074945854 and parameters: {'n_layers': 1, 'embedding_dim': 32, 'lr': 0.011264586035272023, 'lambda_val': 1.8448611376607296e-06, 'batch_size': 1344, 'optimizer': 'Adam'}. Best is trial 7 with value: 0.0900058074945854.
2026-05-16 09:50:41,786 - optuna.study.study - INFO - Trial 8 finished with value: 0.008135713531563251 and parameters: {'n_layers': 2, 'embedding_dim': 32, 'lr': 6.796255700090847e-05, 'lambda_val': 3.314345405219088e-05, 'batch_size': 1104, 'optimizer': 'RMSprop'}. Best is trial 7 with value: 0.0900058074945854.
2026-05-16 09:51:24,215 - optuna.study.study - INFO - Trial 9 finished with value: 0.03892536394794057 and parameters: {'n_layers': 4, 'embedding_dim': 256, 'lr': 0.0001035815372925289, 'lambda_val': 0.0005472608167287999, 'batch_size': 3538, 'optimizer': 'Adam'}. Best is trial 7 with value: 0.0900058074945854.
2026-05-16 09:51:27,730 - experiment_functions - INFO - Early stopping at epoch 550. Best Recall: 0.0264
2026-05-16 09:51:27,832 - optuna.study.study - INFO - Trial 10 finished with value: 0.02637691856352054 and parameters: {'n_layers': 1, 'embedding_dim': 32, 'lr': 0.07155875898877369, 'lambda_val': 2.643376113260456e-05, 'batch_size': 512, 'optimizer': 'Adam'}. Best is trial 7 with value: 0.0900058074945854.
2026-05-16 09:51:31,537 - experiment_functions - INFO - Early stopping at epoch 550. Best Recall: 0.0453
2026-05-16 09:51:31,647 - optuna.study.study - INFO - Trial 11 finished with value: 0.04530313697075713 and parameters: {'n_layers': 1, 'embedding_dim': 64, 'lr': 0.023356700813255343, 'lambda_val': 1.1853055337434524e-06, 'batch_size': 1835, 'optimizer': 'Adam'}. Best is trial 7 with value: 0.0900058074945854.
2026-05-16 09:51:37,067 - experiment_functions - INFO - Early stopping at epoch 550. Best Recall: 0.0773
2026-05-16 09:51:37,620 - optuna.study.study - INFO - Trial 12 finished with value: 0.07726916434695962 and parameters: {'n_layers': 1, 'embedding_dim': 64, 'lr': 0.012881710504214291, 'lambda_val': 1.0204869102183234e-05, 'batch_size': 2974, 'optimizer': 'Adam'}. Best is trial 7 with value: 0.0900058074945854.
2026-05-16 09:51:45,629 - experiment_functions - INFO - Early stopping at epoch 1050. Best Recall: 0.0263
2026-05-16 09:51:45,774 - optuna.study.study - INFO - Trial 13 finished with value: 0.026347562055925384 and parameters: {'n_layers': 2, 'embedding_dim': 64, 'lr': 0.04281416352556292, 'lambda_val': 1.0919023417253787e-06, 'batch_size': 1622, 'optimizer': 'Adam'}. Best is trial 7 with value: 0.0900058074945854.
2026-05-16 09:51:49,873 - experiment_functions - INFO - Early stopping at epoch 500. Best Recall: 0.0025
2026-05-16 09:51:50,018 - optuna.study.study - INFO - Trial 14 finished with value: 0.002507320828935998 and parameters: {'n_layers': 3, 'embedding_dim': 96, 'lr': 1.2855563123623827e-05, 'lambda_val': 0.003410941658585921, 'batch_size': 3142, 'optimizer': 'Adam'}. Best is trial 7 with value: 0.0900058074945854.
2026-05-16 09:51:54,597 - experiment_functions - INFO - Early stopping at epoch 550. Best Recall: 0.1010
2026-05-16 09:51:54,712 - optuna.study.study - INFO - Trial 15 finished with value: 0.10097455125668821 and parameters: {'n_layers': 1, 'embedding_dim': 128, 'lr': 0.006240211550209151, 'lambda_val': 6.712999393671166e-05, 'batch_size': 1712, 'optimizer': 'Adam'}. Best is trial 15 with value: 0.10097455125668821.
2026-05-16 09:52:01,729 - experiment_functions - INFO - Early stopping at epoch 600. Best Recall: 0.0248
2026-05-16 09:52:01,883 - optuna.study.study - INFO - Trial 16 finished with value: 0.024828047856810958 and parameters: {'n_layers': 3, 'embedding_dim': 128, 'lr': 0.011937504166914937, 'lambda_val': 8.496433231598482e-05, 'batch_size': 1682, 'optimizer': 'Adam'}. Best is trial 15 with value: 0.10097455125668821.
2026-05-16 09:52:10,397 - optuna.study._optimize - INFO - Trial 17 pruned. 
2026-05-16 09:52:29,496 - experiment_functions - INFO - Early stopping at epoch 3050. Best Recall: 0.1010
2026-05-16 09:52:29,607 - optuna.study.study - INFO - Trial 18 finished with value: 0.10100138232635499 and parameters: {'n_layers': 1, 'embedding_dim': 32, 'lr': 0.0004957254082716938, 'lambda_val': 5.912765345857088e-06, 'batch_size': 1992, 'optimizer': 'Adam'}. Best is trial 18 with value: 0.10100138232635499.
2026-05-16 09:52:40,883 - experiment_functions - INFO - Early stopping at epoch 1700. Best Recall: 0.1075
2026-05-16 09:52:41,008 - optuna.study.study - INFO - Trial 19 finished with value: 0.10751044115908433 and parameters: {'n_layers': 1, 'embedding_dim': 128, 'lr': 0.00040502261084960175, 'lambda_val': 7.32283970196233e-06, 'batch_size': 2013, 'optimizer': 'RMSprop'}. Best is trial 19 with value: 0.10751044115908433.
2026-05-16 09:52:49,267 - experiment_functions - INFO - Early stopping at epoch 1000. Best Recall: 0.0543
2026-05-16 09:52:49,368 - optuna.study.study - INFO - Trial 20 finished with value: 0.054322360476579436 and parameters: {'n_layers': 3, 'embedding_dim': 128, 'lr': 0.000387307867132394, 'lambda_val': 8.35652325725729e-06, 'batch_size': 2102, 'optimizer': 'RMSprop'}. Best is trial 19 with value: 0.10751044115908433.
2026-05-16 09:52:56,067 - experiment_functions - INFO - Early stopping at epoch 1150. Best Recall: 0.1039
2026-05-16 09:52:56,259 - optuna.study.study - INFO - Trial 21 finished with value: 0.10391780109985363 and parameters: {'n_layers': 1, 'embedding_dim': 128, 'lr': 0.0005565362980999731, 'lambda_val': 2.87130296029458e-05, 'batch_size': 1969, 'optimizer': 'RMSprop'}. Best is trial 19 with value: 0.10751044115908433.
2026-05-16 09:53:16,538 - experiment_functions - INFO - Early stopping at epoch 2000. Best Recall: 0.1151
2026-05-16 09:53:16,644 - optuna.study.study - INFO - Trial 22 finished with value: 0.11512030979721206 and parameters: {'n_layers': 1, 'embedding_dim': 128, 'lr': 0.000425239244947005, 'lambda_val': 4.651578801899618e-06, 'batch_size': 2070, 'optimizer': 'RMSprop'}. Best is trial 22 with value: 0.11512030979721206.
2026-05-16 09:53:24,867 - optuna.study._optimize - INFO - Trial 23 pruned. 
2026-05-16 09:53:29,327 - experiment_functions - INFO - Early stopping at epoch 700. Best Recall: 0.0026
2026-05-16 09:53:29,425 - optuna.study.study - INFO - Trial 24 finished with value: 0.002638914821660204 and parameters: {'n_layers': 1, 'embedding_dim': 128, 'lr': 3.937072167566408e-05, 'lambda_val': 3.7564220863340296e-06, 'batch_size': 1385, 'optimizer': 'RMSprop'}. Best is trial 22 with value: 0.11512030979721206.
2026-05-16 09:53:36,793 - optuna.study._optimize - INFO - Trial 25 pruned. 
2026-05-16 09:53:43,623 - experiment_functions - INFO - Early stopping at epoch 900. Best Recall: 0.1038
2026-05-16 09:53:43,891 - optuna.study.study - INFO - Trial 26 finished with value: 0.10381624610910085 and parameters: {'n_layers': 1, 'embedding_dim': 128, 'lr': 0.0006356072683472169, 'lambda_val': 1.5068571312387478e-05, 'batch_size': 2601, 'optimizer': 'RMSprop'}. Best is trial 22 with value: 0.11512030979721206.
2026-05-16 09:53:49,730 - optuna.study._optimize - INFO - Trial 27 pruned. 
2026-05-16 09:53:53,531 - experiment_functions - INFO - Early stopping at epoch 550. Best Recall: 0.0357
2026-05-16 09:53:53,632 - optuna.study.study - INFO - Trial 28 finished with value: 0.03570911969438639 and parameters: {'n_layers': 2, 'embedding_dim': 128, 'lr': 0.0019762963547588002, 'lambda_val': 3.550685143434313e-05, 'batch_size': 1937, 'optimizer': 'RMSprop'}. Best is trial 22 with value: 0.11512030979721206.
2026-05-16 09:53:59,677 - optuna.study._optimize - INFO - Trial 29 pruned. 
2026-05-16 09:54:04,639 - experiment_functions - INFO - Early stopping at epoch 700. Best Recall: 0.0609
2026-05-16 09:54:04,760 - optuna.study.study - INFO - Trial 30 finished with value: 0.06094787075999879 and parameters: {'n_layers': 2, 'embedding_dim': 128, 'lr': 0.0007372958495521545, 'lambda_val': 0.0012364202330080525, 'batch_size': 1501, 'optimizer': 'RMSprop'}. Best is trial 22 with value: 0.11512030979721206.
2026-05-16 09:54:13,040 - experiment_functions - INFO - Early stopping at epoch 1400. Best Recall: 0.1077
2026-05-16 09:54:13,192 - optuna.study.study - INFO - Trial 31 finished with value: 0.10767416497985517 and parameters: {'n_layers': 1, 'embedding_dim': 128, 'lr': 0.0004914126138019243, 'lambda_val': 1.457348195229778e-05, 'batch_size': 2663, 'optimizer': 'RMSprop'}. Best is trial 22 with value: 0.11512030979721206.
2026-05-16 09:54:19,846 - optuna.study._optimize - INFO - Trial 32 pruned. 
2026-05-16 09:54:24,243 - experiment_functions - INFO - Early stopping at epoch 700. Best Recall: 0.0949
2026-05-16 09:54:24,345 - optuna.study.study - INFO - Trial 33 finished with value: 0.09487741079685995 and parameters: {'n_layers': 1, 'embedding_dim': 128, 'lr': 0.0015826439031368619, 'lambda_val': 3.14133974496952e-06, 'batch_size': 2873, 'optimizer': 'RMSprop'}. Best is trial 22 with value: 0.11512030979721206.
2026-05-16 09:54:36,146 - experiment_functions - INFO - Early stopping at epoch 2100. Best Recall: 0.1162
2026-05-16 09:54:36,236 - optuna.study.study - INFO - Trial 34 finished with value: 0.11621697710160639 and parameters: {'n_layers': 1, 'embedding_dim': 128, 'lr': 0.0003891539335988926, 'lambda_val': 4.278605347461891e-05, 'batch_size': 2258, 'optimizer': 'RMSprop'}. Best is trial 34 with value: 0.11621697710160639.
2026-05-16 09:54:42,352 - optuna.study._optimize - INFO - Trial 35 pruned. 
2026-05-16 09:54:45,841 - experiment_functions - INFO - Early stopping at epoch 500. Best Recall: 0.0015
2026-05-16 09:54:45,942 - optuna.study.study - INFO - Trial 36 finished with value: 0.0014984531534212179 and parameters: {'n_layers': 1, 'embedding_dim': 256, 'lr': 0.0003299863416137651, 'lambda_val': 6.231973331244962e-06, 'batch_size': 2697, 'optimizer': 'SGD'}. Best is trial 34 with value: 0.11621697710160639.
2026-05-16 09:54:50,342 - experiment_functions - INFO - Early stopping at epoch 600. Best Recall: 0.0520
2026-05-16 09:54:50,453 - optuna.study.study - INFO - Trial 37 finished with value: 0.05202274923518639 and parameters: {'n_layers': 2, 'embedding_dim': 96, 'lr': 0.0010636619730288776, 'lambda_val': 4.989535259886847e-05, 'batch_size': 2387, 'optimizer': 'RMSprop'}. Best is trial 34 with value: 0.11621697710160639.
2026-05-16 09:54:53,824 - experiment_functions - INFO - Early stopping at epoch 500. Best Recall: 0.0022
2026-05-16 09:54:53,925 - optuna.study.study - INFO - Trial 38 finished with value: 0.002177267846088206 and parameters: {'n_layers': 1, 'embedding_dim': 128, 'lr': 0.003356534823531861, 'lambda_val': 2.7157991616543924e-06, 'batch_size': 3306, 'optimizer': 'SGD'}. Best is trial 34 with value: 0.11621697710160639.
2026-05-16 09:55:01,494 - optuna.study._optimize - INFO - Trial 39 pruned. 
2026-05-16 09:55:05,766 - experiment_functions - INFO - Early stopping at epoch 700. Best Recall: 0.0931
2026-05-16 09:55:06,092 - optuna.study.study - INFO - Trial 40 finished with value: 0.09310771932051819 and parameters: {'n_layers': 1, 'embedding_dim': 128, 'lr': 0.0014752610367570875, 'lambda_val': 1.613729758738625e-05, 'batch_size': 2802, 'optimizer': 'RMSprop'}. Best is trial 34 with value: 0.11621697710160639.
2026-05-16 09:55:12,886 - optuna.study._optimize - INFO - Trial 41 pruned. 
2026-05-16 09:55:18,577 - experiment_functions - INFO - Early stopping at epoch 900. Best Recall: 0.0963
