2026-05-16 01:03:02,556 - optuna.study.study - INFO - Trial 263 finished with value: 0.020127827083067217 and parameters: {'n_layers': 1, 'embedding_dim': 64, 'lr': 0.008820577654741112, 'lambda_val': 4.552905631564045e-05, 'batch_size': 750, 'optimizer': 'Adam'}. Best is trial 75 with value: 0.02482134338591816.
2026-05-16 01:03:06,066 - experiment_functions - INFO - Early stopping at epoch 550. Best Recall: 0.0157
2026-05-16 01:03:06,156 - optuna.study.study - INFO - Trial 264 finished with value: 0.015719916291102972 and parameters: {'n_layers': 1, 'embedding_dim': 64, 'lr': 0.007010361304418399, 'lambda_val': 3.243718746965072e-05, 'batch_size': 619, 'optimizer': 'Adam'}. Best is trial 75 with value: 0.02482134338591816.
2026-05-16 01:03:10,275 - experiment_functions - INFO - Early stopping at epoch 550. Best Recall: 0.0197
2026-05-16 01:03:10,431 - optuna.study.study - INFO - Trial 265 finished with value: 0.019680218484880715 and parameters: {'n_layers': 1, 'embedding_dim': 64, 'lr': 0.005596745729033281, 'lambda_val': 4.8475597628893495e-05, 'batch_size': 875, 'optimizer': 'Adam'}. Best is trial 75 with value: 0.02482134338591816.
2026-05-16 01:03:14,051 - experiment_functions - INFO - Early stopping at epoch 550. Best Recall: 0.0202
2026-05-16 01:03:14,155 - optuna.study.study - INFO - Trial 266 finished with value: 0.020223885800440048 and parameters: {'n_layers': 1, 'embedding_dim': 64, 'lr': 0.004946887889125787, 'lambda_val': 5.835952849943793e-05, 'batch_size': 573, 'optimizer': 'Adam'}. Best is trial 75 with value: 0.02482134338591816.
2026-05-16 01:03:18,011 - experiment_functions - INFO - Early stopping at epoch 550. Best Recall: 0.0142
2026-05-16 01:03:18,091 - optuna.study.study - INFO - Trial 267 finished with value: 0.014192154394876942 and parameters: {'n_layers': 1, 'embedding_dim': 96, 'lr': 0.007420889543547948, 'lambda_val': 3.668182504585611e-05, 'batch_size': 692, 'optimizer': 'Adam'}. Best is trial 75 with value: 0.02482134338591816.
2026-05-16 01:03:21,390 - experiment_functions - INFO - Early stopping at epoch 550. Best Recall: 0.0186
2026-05-16 01:03:21,482 - optuna.study.study - INFO - Trial 268 finished with value: 0.01860984787091479 and parameters: {'n_layers': 1, 'embedding_dim': 64, 'lr': 0.009353518077948961, 'lambda_val': 8.06093273590796e-05, 'batch_size': 757, 'optimizer': 'Adam'}. Best is trial 75 with value: 0.02482134338591816.
2026-05-16 01:03:25,484 - experiment_functions - INFO - Early stopping at epoch 600. Best Recall: 0.0213
2026-05-16 01:03:25,565 - optuna.study.study - INFO - Trial 269 finished with value: 0.021263090921391108 and parameters: {'n_layers': 1, 'embedding_dim': 64, 'lr': 0.0030818742962799893, 'lambda_val': 5.507258352700793e-05, 'batch_size': 642, 'optimizer': 'Adam'}. Best is trial 75 with value: 0.02482134338591816.
2026-05-16 01:03:29,069 - experiment_functions - INFO - Early stopping at epoch 550. Best Recall: 0.0198
2026-05-16 01:03:29,169 - optuna.study.study - INFO - Trial 270 finished with value: 0.019776260856745973 and parameters: {'n_layers': 1, 'embedding_dim': 64, 'lr': 0.005679545643724441, 'lambda_val': 2.1605500480632757e-05, 'batch_size': 936, 'optimizer': 'Adam'}. Best is trial 75 with value: 0.02482134338591816.
2026-05-16 01:03:32,543 - experiment_functions - INFO - Early stopping at epoch 550. Best Recall: 0.0196
2026-05-16 01:03:32,635 - optuna.study.study - INFO - Trial 271 finished with value: 0.019648190909785625 and parameters: {'n_layers': 1, 'embedding_dim': 64, 'lr': 0.004364644706930112, 'lambda_val': 1.3767648087250014e-05, 'batch_size': 585, 'optimizer': 'Adam'}. Best is trial 75 with value: 0.02482134338591816.
2026-05-16 01:03:35,919 - experiment_functions - INFO - Early stopping at epoch 550. Best Recall: 0.0171
2026-05-16 01:03:36,031 - optuna.study.study - INFO - Trial 272 finished with value: 0.017135092363333597 and parameters: {'n_layers': 1, 'embedding_dim': 64, 'lr': 0.006429114397913151, 'lambda_val': 6.48420010355391e-05, 'batch_size': 802, 'optimizer': 'Adam'}. Best is trial 75 with value: 0.02482134338591816.
2026-05-16 01:03:39,834 - experiment_functions - INFO - Early stopping at epoch 550. Best Recall: 0.0158
2026-05-16 01:03:39,935 - optuna.study.study - INFO - Trial 273 finished with value: 0.015847302345549066 and parameters: {'n_layers': 1, 'embedding_dim': 64, 'lr': 0.007827809834832163, 'lambda_val': 0.00010018298766087589, 'batch_size': 694, 'optimizer': 'Adam'}. Best is trial 75 with value: 0.02482134338591816.
2026-05-16 01:03:43,516 - experiment_functions - INFO - Early stopping at epoch 550. Best Recall: 0.0201
2026-05-16 01:03:43,617 - optuna.study.study - INFO - Trial 274 finished with value: 0.020125126764540043 and parameters: {'n_layers': 1, 'embedding_dim': 64, 'lr': 0.004893055349058323, 'lambda_val': 3.8772051236733105e-05, 'batch_size': 513, 'optimizer': 'Adam'}. Best is trial 75 with value: 0.02482134338591816.
2026-05-16 01:03:47,523 - experiment_functions - INFO - Early stopping at epoch 600. Best Recall: 0.0188
2026-05-16 01:03:47,668 - optuna.study.study - INFO - Trial 275 finished with value: 0.0187522326715481 and parameters: {'n_layers': 1, 'embedding_dim': 64, 'lr': 0.003564316062698387, 'lambda_val': 2.6550951568904014e-05, 'batch_size': 745, 'optimizer': 'Adam'}. Best is trial 75 with value: 0.02482134338591816.
2026-05-16 01:03:51,460 - experiment_functions - INFO - Early stopping at epoch 600. Best Recall: 0.0139
2026-05-16 01:03:51,550 - optuna.study.study - INFO - Trial 276 finished with value: 0.01390729942766804 and parameters: {'n_layers': 1, 'embedding_dim': 64, 'lr': 0.0023182232079309306, 'lambda_val': 5.102415882984224e-05, 'batch_size': 635, 'optimizer': 'Adam'}. Best is trial 75 with value: 0.02482134338591816.
2026-05-16 01:03:55,309 - experiment_functions - INFO - Early stopping at epoch 550. Best Recall: 0.0197
2026-05-16 01:03:55,388 - optuna.study.study - INFO - Trial 277 finished with value: 0.019689892094016805 and parameters: {'n_layers': 1, 'embedding_dim': 64, 'lr': 0.006128729350581576, 'lambda_val': 8.27447722751988e-05, 'batch_size': 876, 'optimizer': 'Adam'}. Best is trial 75 with value: 0.02482134338591816.
2026-05-16 01:04:01,169 - optuna.study._optimize - INFO - Trial 278 pruned. 
2026-05-16 01:04:04,851 - experiment_functions - INFO - Early stopping at epoch 550. Best Recall: 0.0055
2026-05-16 01:04:04,951 - optuna.study.study - INFO - Trial 279 finished with value: 0.005456822183307132 and parameters: {'n_layers': 1, 'embedding_dim': 64, 'lr': 0.0504365309676027, 'lambda_val': 3.189956628703228e-05, 'batch_size': 571, 'optimizer': 'Adam'}. Best is trial 75 with value: 0.02482134338591816.
2026-05-16 01:04:08,246 - experiment_functions - INFO - Early stopping at epoch 500. Best Recall: 0.0047
2026-05-16 01:04:08,368 - optuna.study.study - INFO - Trial 280 finished with value: 0.004744539619006837 and parameters: {'n_layers': 1, 'embedding_dim': 256, 'lr': 0.012274220641218667, 'lambda_val': 4.53687730399173e-05, 'batch_size': 800, 'optimizer': 'SGD'}. Best is trial 75 with value: 0.02482134338591816.
2026-05-16 01:04:12,971 - experiment_functions - INFO - Early stopping at epoch 600. Best Recall: 0.0158
2026-05-16 01:04:13,091 - optuna.study.study - INFO - Trial 281 finished with value: 0.015771988560738345 and parameters: {'n_layers': 1, 'embedding_dim': 64, 'lr': 0.002899107437705068, 'lambda_val': 9.851293414988044e-05, 'batch_size': 1015, 'optimizer': 'Adam'}. Best is trial 75 with value: 0.02482134338591816.
2026-05-16 01:04:16,521 - experiment_functions - INFO - Early stopping at epoch 550. Best Recall: 0.0153
2026-05-16 01:04:16,589 - optuna.study.study - INFO - Trial 282 finished with value: 0.01527448281008929 and parameters: {'n_layers': 1, 'embedding_dim': 64, 'lr': 0.005262288932165375, 'lambda_val': 0.00012225348389438806, 'batch_size': 2918, 'optimizer': 'Adam'}. Best is trial 75 with value: 0.02482134338591816.
2026-05-16 01:04:20,126 - experiment_functions - INFO - Early stopping at epoch 550. Best Recall: 0.0140
2026-05-16 01:04:20,261 - optuna.study.study - INFO - Trial 283 finished with value: 0.014002711994674216 and parameters: {'n_layers': 1, 'embedding_dim': 256, 'lr': 0.007736857737740928, 'lambda_val': 6.05835229821221e-05, 'batch_size': 654, 'optimizer': 'Adam'}. Best is trial 75 with value: 0.02482134338591816.
2026-05-16 01:04:23,927 - experiment_functions - INFO - Early stopping at epoch 550. Best Recall: 0.0040
2026-05-16 01:04:24,017 - optuna.study.study - INFO - Trial 284 finished with value: 0.004028010445049696 and parameters: {'n_layers': 3, 'embedding_dim': 64, 'lr': 0.0037346486433407463, 'lambda_val': 4.551335738315952e-05, 'batch_size': 2608, 'optimizer': 'Adam'}. Best is trial 75 with value: 0.02482134338591816.
2026-05-16 01:04:28,736 - experiment_functions - INFO - Early stopping at epoch 650. Best Recall: 0.0184
2026-05-16 01:04:28,836 - optuna.study.study - INFO - Trial 285 finished with value: 0.01844477112864982 and parameters: {'n_layers': 1, 'embedding_dim': 96, 'lr': 0.0019452872922173247, 'lambda_val': 6.832508735395487e-05, 'batch_size': 740, 'optimizer': 'Adam'}. Best is trial 75 with value: 0.02482134338591816.
2026-05-16 01:04:32,506 - experiment_functions - INFO - Early stopping at epoch 550. Best Recall: 0.0085
2026-05-16 01:04:32,616 - optuna.study.study - INFO - Trial 286 finished with value: 0.008546876525216986 and parameters: {'n_layers': 1, 'embedding_dim': 64, 'lr': 0.00990238529041727, 'lambda_val': 8.296360642183333e-05, 'batch_size': 1109, 'optimizer': 'Adam'}. Best is trial 75 with value: 0.02482134338591816.
2026-05-16 01:04:38,884 - experiment_functions - INFO - Early stopping at epoch 550. Best Recall: 0.0151
2026-05-16 01:04:38,994 - optuna.study.study - INFO - Trial 287 finished with value: 0.015145235357456587 and parameters: {'n_layers': 1, 'embedding_dim': 256, 'lr': 0.006460215857763621, 'lambda_val': 3.3144884929866825e-05, 'batch_size': 573, 'optimizer': 'Adam'}. Best is trial 75 with value: 0.02482134338591816.
2026-05-16 01:04:42,348 - experiment_functions - INFO - Early stopping at epoch 550. Best Recall: 0.0168
2026-05-16 01:04:42,449 - optuna.study.study - INFO - Trial 288 finished with value: 0.01677306974143268 and parameters: {'n_layers': 1, 'embedding_dim': 64, 'lr': 0.004859395189751705, 'lambda_val': 0.00012160543869541115, 'batch_size': 858, 'optimizer': 'Adam'}. Best is trial 75 with value: 0.02482134338591816.
2026-05-16 01:04:46,077 - experiment_functions - INFO - Early stopping at epoch 550. Best Recall: 0.0152
2026-05-16 01:04:46,166 - optuna.study.study - INFO - Trial 289 finished with value: 0.0151622699656001 and parameters: {'n_layers': 1, 'embedding_dim': 256, 'lr': 0.00565479175029775, 'lambda_val': 5.506467889954964e-05, 'batch_size': 635, 'optimizer': 'Adam'}. Best is trial 75 with value: 0.02482134338591816.
2026-05-16 01:04:49,476 - experiment_functions - INFO - Early stopping at epoch 550. Best Recall: 0.0192
2026-05-16 01:04:49,785 - optuna.study.study - INFO - Trial 290 finished with value: 0.019235835740954246 and parameters: {'n_layers': 1, 'embedding_dim': 64, 'lr': 0.004122529370142836, 'lambda_val': 4.006054371303347e-05, 'batch_size': 745, 'optimizer': 'Adam'}. Best is trial 75 with value: 0.02482134338591816.
2026-05-16 01:04:53,518 - experiment_functions - INFO - Early stopping at epoch 550. Best Recall: 0.0105
2026-05-16 01:04:53,618 - optuna.study.study - INFO - Trial 291 finished with value: 0.010463658790679547 and parameters: {'n_layers': 1, 'embedding_dim': 64, 'lr': 0.008422335220707587, 'lambda_val': 2.3054539964467436e-05, 'batch_size': 811, 'optimizer': 'Adam'}. Best is trial 75 with value: 0.02482134338591816.
2026-05-16 01:04:57,284 - experiment_functions - INFO - Early stopping at epoch 550. Best Recall: 0.0124
2026-05-16 01:04:57,386 - optuna.study.study - INFO - Trial 292 finished with value: 0.01238929382971904 and parameters: {'n_layers': 1, 'embedding_dim': 32, 'lr': 0.003486253476314711, 'lambda_val': 1.6701032625330187e-05, 'batch_size': 1988, 'optimizer': 'Adam'}. Best is trial 75 with value: 0.02482134338591816.
2026-05-16 01:05:01,094 - experiment_functions - INFO - Early stopping at epoch 550. Best Recall: 0.0203
2026-05-16 01:05:01,205 - optuna.study.study - INFO - Trial 293 finished with value: 0.020342507531774856 and parameters: {'n_layers': 1, 'embedding_dim': 256, 'lr': 0.006898326940767889, 'lambda_val': 9.638599520151891e-05, 'batch_size': 513, 'optimizer': 'Adam'}. Best is trial 75 with value: 0.02482134338591816.
2026-05-16 01:05:05,159 - experiment_functions - INFO - Early stopping at epoch 550. Best Recall: 0.0110
2026-05-16 01:05:05,531 - optuna.study.study - INFO - Trial 294 finished with value: 0.01101023090020575 and parameters: {'n_layers': 2, 'embedding_dim': 64, 'lr': 0.0027337489797158066, 'lambda_val': 7.579474073768388e-05, 'batch_size': 684, 'optimizer': 'Adam'}. Best is trial 75 with value: 0.02482134338591816.
2026-05-16 01:05:09,193 - experiment_functions - INFO - Early stopping at epoch 550. Best Recall: 0.0183
2026-05-16 01:05:09,283 - optuna.study.study - INFO - Trial 295 finished with value: 0.01833177262287851 and parameters: {'n_layers': 1, 'embedding_dim': 64, 'lr': 0.004980131854404547, 'lambda_val': 4.9739464035445105e-05, 'batch_size': 924, 'optimizer': 'Adam'}. Best is trial 75 with value: 0.02482134338591816.
2026-05-16 01:05:12,765 - experiment_functions - INFO - Early stopping at epoch 550. Best Recall: 0.0233
2026-05-16 01:05:12,856 - optuna.study.study - INFO - Trial 296 finished with value: 0.023265031501770148 and parameters: {'n_layers': 1, 'embedding_dim': 256, 'lr': 0.004341444540693686, 'lambda_val': 6.112410011888163e-05, 'batch_size': 612, 'optimizer': 'Adam'}. Best is trial 75 with value: 0.02482134338591816.
2026-05-16 01:05:16,439 - experiment_functions - INFO - Early stopping at epoch 550. Best Recall: 0.0165
2026-05-16 01:05:16,540 - optuna.study.study - INFO - Trial 297 finished with value: 0.0164818913089738 and parameters: {'n_layers': 1, 'embedding_dim': 256, 'lr': 0.005886229720431859, 'lambda_val': 3.189358901074529e-05, 'batch_size': 591, 'optimizer': 'Adam'}. Best is trial 75 with value: 0.02482134338591816.
2026-05-16 01:05:20,156 - experiment_functions - INFO - Early stopping at epoch 500. Best Recall: 0.0022
2026-05-16 01:05:20,301 - optuna.study.study - INFO - Trial 298 finished with value: 0.002202071242957985 and parameters: {'n_layers': 1, 'embedding_dim': 256, 'lr': 1.4266798362871096e-05, 'lambda_val': 0.00013543148094123227, 'batch_size': 626, 'optimizer': 'Adam'}. Best is trial 75 with value: 0.02482134338591816.
2026-05-16 01:05:24,421 - experiment_functions - INFO - Early stopping at epoch 550. Best Recall: 0.0128
2026-05-16 01:05:24,522 - optuna.study.study - INFO - Trial 299 finished with value: 0.01282240227128427 and parameters: {'n_layers': 1, 'embedding_dim': 256, 'lr': 0.00740734323953108, 'lambda_val': 4.044946682114457e-05, 'batch_size': 613, 'optimizer': 'Adam'}. Best is trial 75 with value: 0.02482134338591816.
2026-05-16 01:05:26,214 - experiment_functions - INFO - Early stopping at epoch 550. Best Recall: 0.0183
2026-05-16 01:05:26,305 - root - INFO -   ** Getting the trainable edges:
2026-05-16 01:05:26,311 - helper_functions - INFO -      Number of nodes: 4003
2026-05-16 01:05:26,311 - helper_functions - INFO -      Ratio: 0.3873621056706019
2026-05-16 01:05:26,311 - helper_functions - INFO -      Number of unique users: 324
2026-05-16 01:05:26,311 - helper_functions - INFO -      Number of unique items: 3679
2026-05-16 01:05:26,311 - helper_functions - INFO -      Total dominant set edge: 84485
2026-05-16 01:05:26,311 - helper_functions - INFO -      Trainable edges: 67588.0
2026-05-16 01:05:26,322 - root - INFO -   **** Getting 84485 dominant set edges
2026-05-16 01:05:26,434 - optuna.storages._rdb.storage - INFO - A new study created in RDB with name: Study_e_100K_1c2dcs
2026-05-16 01:05:30,656 - experiment_functions - INFO - Early stopping at epoch 500. Best Recall: 0.0031
2026-05-16 01:05:30,762 - optuna.study.study - INFO - Trial 0 finished with value: 0.0031136807312995033 and parameters: {'n_layers': 4, 'embedding_dim': 128, 'lr': 0.02067351989969151, 'lambda_val': 3.948681645047113e-06, 'batch_size': 3220, 'optimizer': 'SGD'}. Best is trial 0 with value: 0.0031136807312995033.
2026-05-16 01:05:49,421 - experiment_functions - INFO - Early stopping at epoch 2900. Best Recall: 0.0355
2026-05-16 01:05:49,570 - optuna.study.study - INFO - Trial 1 finished with value: 0.03549168133822807 and parameters: {'n_layers': 4, 'embedding_dim': 32, 'lr': 0.0002516360393785896, 'lambda_val': 0.023852866777923237, 'batch_size': 613, 'optimizer': 'RMSprop'}. Best is trial 1 with value: 0.03549168133822807.
2026-05-16 01:05:55,578 - experiment_functions - INFO - Early stopping at epoch 650. Best Recall: 0.0278
2026-05-16 01:05:55,667 - optuna.study.study - INFO - Trial 2 finished with value: 0.027819431870629883 and parameters: {'n_layers': 3, 'embedding_dim': 256, 'lr': 0.0014971198013314212, 'lambda_val': 0.0011558371396114674, 'batch_size': 3790, 'optimizer': 'RMSprop'}. Best is trial 1 with value: 0.03549168133822807.
2026-05-16 01:05:59,049 - experiment_functions - INFO - Early stopping at epoch 500. Best Recall: 0.0020
2026-05-16 01:05:59,140 - optuna.study.study - INFO - Trial 3 finished with value: 0.001958329757013095 and parameters: {'n_layers': 2, 'embedding_dim': 96, 'lr': 0.005188949796570795, 'lambda_val': 0.0024251409292711835, 'batch_size': 1357, 'optimizer': 'SGD'}. Best is trial 1 with value: 0.03549168133822807.
2026-05-16 01:06:03,140 - experiment_functions - INFO - Early stopping at epoch 500. Best Recall: 0.0016
2026-05-16 01:06:03,310 - optuna.study.study - INFO - Trial 4 finished with value: 0.0015506994309218418 and parameters: {'n_layers': 2, 'embedding_dim': 96, 'lr': 0.017901429575567594, 'lambda_val': 5.931237849668495e-06, 'batch_size': 2730, 'optimizer': 'SGD'}. Best is trial 1 with value: 0.03549168133822807.
2026-05-16 01:06:10,195 - experiment_functions - INFO - Early stopping at epoch 700. Best Recall: 0.0218
2026-05-16 01:06:10,373 - optuna.study.study - INFO - Trial 5 finished with value: 0.02175518227619255 and parameters: {'n_layers': 4, 'embedding_dim': 256, 'lr': 0.0005954609244173542, 'lambda_val': 0.0005561321704359937, 'batch_size': 2989, 'optimizer': 'RMSprop'}. Best is trial 1 with value: 0.03549168133822807.
2026-05-16 01:06:14,039 - experiment_functions - INFO - Early stopping at epoch 500. Best Recall: 0.0012
2026-05-16 01:06:14,141 - optuna.study.study - INFO - Trial 6 finished with value: 0.0012079842490441471 and parameters: {'n_layers': 1, 'embedding_dim': 256, 'lr': 0.0002512309560356243, 'lambda_val': 0.012114121900690465, 'batch_size': 3406, 'optimizer': 'SGD'}. Best is trial 1 with value: 0.03549168133822807.
2026-05-16 01:06:17,915 - experiment_functions - INFO - Early stopping at epoch 600. Best Recall: 0.0011
2026-05-16 01:06:18,016 - optuna.study.study - INFO - Trial 7 finished with value: 0.0011098834908296591 and parameters: {'n_layers': 1, 'embedding_dim': 64, 'lr': 1.6587410970597037e-05, 'lambda_val': 1.4892268503923406e-05, 'batch_size': 1933, 'optimizer': 'Adam'}. Best is trial 1 with value: 0.03549168133822807.
2026-05-16 01:06:23,134 - experiment_functions - INFO - Early stopping at epoch 550. Best Recall: 0.0217
2026-05-16 01:06:23,224 - optuna.study.study - INFO - Trial 8 finished with value: 0.02170763221916221 and parameters: {'n_layers': 4, 'embedding_dim': 128, 'lr': 0.01469830492518297, 'lambda_val': 1.1206434441431134e-06, 'batch_size': 4028, 'optimizer': 'RMSprop'}. Best is trial 1 with value: 0.03549168133822807.
2026-05-16 01:06:26,703 - experiment_functions - INFO - Early stopping at epoch 500. Best Recall: 0.0027
2026-05-16 01:06:26,805 - optuna.study.study - INFO - Trial 9 finished with value: 0.00273505085152968 and parameters: {'n_layers': 3, 'embedding_dim': 64, 'lr': 0.005766390234184603, 'lambda_val': 0.002616988245396962, 'batch_size': 874, 'optimizer': 'SGD'}. Best is trial 1 with value: 0.03549168133822807.
2026-05-16 01:06:30,319 - experiment_functions - INFO - Early stopping at epoch 500. Best Recall: 0.0015
2026-05-16 01:06:30,409 - optuna.study.study - INFO - Trial 10 finished with value: 0.0014596024767993072 and parameters: {'n_layers': 3, 'embedding_dim': 32, 'lr': 4.2756979549984645e-05, 'lambda_val': 0.08871890926704211, 'batch_size': 541, 'optimizer': 'Adam'}. Best is trial 1 with value: 0.03549168133822807.
2026-05-16 01:06:36,736 - optuna.study._optimize - INFO - Trial 11 pruned. 
2026-05-16 01:06:42,735 - experiment_functions - INFO - Early stopping at epoch 550. Best Recall: 0.0192
2026-05-16 01:06:42,825 - optuna.study.study - INFO - Trial 12 finished with value: 0.019236406173894466 and parameters: {'n_layers': 4, 'embedding_dim': 256, 'lr': 0.0015146279397737004, 'lambda_val': 0.00010326075115760848, 'batch_size': 4094, 'optimizer': 'RMSprop'}. Best is trial 1 with value: 0.03549168133822807.
2026-05-16 01:06:47,591 - experiment_functions - INFO - Early stopping at epoch 700. Best Recall: 0.0252
2026-05-16 01:06:47,691 - optuna.study.study - INFO - Trial 13 finished with value: 0.02515579236265932 and parameters: {'n_layers': 3, 'embedding_dim': 32, 'lr': 0.001220022783859886, 'lambda_val': 0.008791819266883714, 'batch_size': 2435, 'optimizer': 'RMSprop'}. Best is trial 1 with value: 0.03549168133822807.
2026-05-16 01:06:51,109 - experiment_functions - INFO - Early stopping at epoch 500. Best Recall: 0.0092
2026-05-16 01:06:51,178 - optuna.study.study - INFO - Trial 14 finished with value: 0.0091661083629046 and parameters: {'n_layers': 2, 'embedding_dim': 32, 'lr': 0.07616469391016178, 'lambda_val': 0.00017172146313162, 'batch_size': 1340, 'optimizer': 'RMSprop'}. Best is trial 1 with value: 0.03549168133822807.
