2026-05-15 19:40:49,869 - optuna.study.study - INFO - Trial 56 finished with value: 0.005722159301295314 and parameters: {'n_layers': 4, 'embedding_dim': 64, 'lr': 0.007816641960516558, 'lambda_val': 1.572859913068769e-05, 'batch_size': 1474, 'optimizer': 'Adam'}. Best is trial 51 with value: 0.019165088372729407.
2026-05-15 19:40:57,729 - optuna.study._optimize - INFO - Trial 57 pruned. 
2026-05-15 19:41:14,719 - experiment_functions - INFO - Early stopping at epoch 2350. Best Recall: 0.0180
2026-05-15 19:41:14,834 - optuna.study.study - INFO - Trial 58 finished with value: 0.018032076092703547 and parameters: {'n_layers': 4, 'embedding_dim': 64, 'lr': 0.04028646961108422, 'lambda_val': 3.7003425801241986e-06, 'batch_size': 1819, 'optimizer': 'Adam'}. Best is trial 51 with value: 0.019165088372729407.
2026-05-15 19:41:19,205 - experiment_functions - INFO - Early stopping at epoch 500. Best Recall: 0.0030
2026-05-15 19:41:19,311 - optuna.study.study - INFO - Trial 59 finished with value: 0.003032739100303671 and parameters: {'n_layers': 4, 'embedding_dim': 64, 'lr': 0.0419636304417753, 'lambda_val': 4.157364128758359e-06, 'batch_size': 1776, 'optimizer': 'SGD'}. Best is trial 51 with value: 0.019165088372729407.
2026-05-15 19:41:26,499 - experiment_functions - INFO - Early stopping at epoch 900. Best Recall: 0.0151
2026-05-15 19:41:26,615 - optuna.study.study - INFO - Trial 60 finished with value: 0.01510965256318802 and parameters: {'n_layers': 4, 'embedding_dim': 64, 'lr': 0.0784306246246012, 'lambda_val': 2.424643299432325e-06, 'batch_size': 1870, 'optimizer': 'Adam'}. Best is trial 51 with value: 0.019165088372729407.
2026-05-15 19:41:51,692 - experiment_functions - INFO - Early stopping at epoch 2550. Best Recall: 0.0188
2026-05-15 19:41:51,792 - optuna.study.study - INFO - Trial 61 finished with value: 0.018839735938568643 and parameters: {'n_layers': 4, 'embedding_dim': 64, 'lr': 0.02323750015499654, 'lambda_val': 4.108061184632333e-05, 'batch_size': 3437, 'optimizer': 'Adam'}. Best is trial 51 with value: 0.019165088372729407.
2026-05-15 19:41:59,630 - optuna.study._optimize - INFO - Trial 62 pruned. 
2026-05-15 19:42:13,053 - experiment_functions - INFO - Early stopping at epoch 2100. Best Recall: 0.0191
2026-05-15 19:42:13,178 - optuna.study.study - INFO - Trial 63 finished with value: 0.019147687564437205 and parameters: {'n_layers': 4, 'embedding_dim': 64, 'lr': 0.04398324526398968, 'lambda_val': 3.192527446527602e-05, 'batch_size': 2745, 'optimizer': 'Adam'}. Best is trial 51 with value: 0.019165088372729407.
2026-05-15 19:42:18,962 - experiment_functions - INFO - Early stopping at epoch 800. Best Recall: 0.0129
2026-05-15 19:42:19,085 - optuna.study.study - INFO - Trial 64 finished with value: 0.012925259513278466 and parameters: {'n_layers': 4, 'embedding_dim': 64, 'lr': 0.0625736251481207, 'lambda_val': 1.8763649597696901e-06, 'batch_size': 3391, 'optimizer': 'Adam'}. Best is trial 51 with value: 0.019165088372729407.
2026-05-15 19:42:34,545 - experiment_functions - INFO - Early stopping at epoch 2400. Best Recall: 0.0181
2026-05-15 19:42:34,646 - optuna.study.study - INFO - Trial 65 finished with value: 0.018060600664215585 and parameters: {'n_layers': 4, 'embedding_dim': 64, 'lr': 0.04583087260641249, 'lambda_val': 3.9495328164966196e-05, 'batch_size': 2718, 'optimizer': 'Adam'}. Best is trial 51 with value: 0.019165088372729407.
2026-05-15 19:42:43,887 - experiment_functions - INFO - Early stopping at epoch 1400. Best Recall: 0.0198
2026-05-15 19:42:44,015 - optuna.study.study - INFO - Trial 66 finished with value: 0.019806242402532648 and parameters: {'n_layers': 4, 'embedding_dim': 64, 'lr': 0.047642317609916926, 'lambda_val': 3.93863372320834e-05, 'batch_size': 2791, 'optimizer': 'Adam'}. Best is trial 66 with value: 0.019806242402532648.
2026-05-15 19:42:48,603 - experiment_functions - INFO - Early stopping at epoch 600. Best Recall: 0.0137
2026-05-15 19:42:48,743 - optuna.study.study - INFO - Trial 67 finished with value: 0.013732187629295246 and parameters: {'n_layers': 4, 'embedding_dim': 64, 'lr': 0.09816430583518342, 'lambda_val': 4.2107451923815246e-05, 'batch_size': 2967, 'optimizer': 'Adam'}. Best is trial 66 with value: 0.019806242402532648.
2026-05-15 19:43:00,710 - experiment_functions - INFO - Early stopping at epoch 1800. Best Recall: 0.0187
2026-05-15 19:43:00,826 - optuna.study.study - INFO - Trial 68 finished with value: 0.018681597857645803 and parameters: {'n_layers': 4, 'embedding_dim': 64, 'lr': 0.0480640749746397, 'lambda_val': 2.2838910587846246e-05, 'batch_size': 2511, 'optimizer': 'Adam'}. Best is trial 66 with value: 0.019806242402532648.
2026-05-15 19:43:05,844 - experiment_functions - INFO - Early stopping at epoch 800. Best Recall: 0.0084
2026-05-15 19:43:05,959 - optuna.study.study - INFO - Trial 69 finished with value: 0.008396348897567425 and parameters: {'n_layers': 1, 'embedding_dim': 64, 'lr': 0.07361935825198056, 'lambda_val': 2.1676388967803517e-05, 'batch_size': 3121, 'optimizer': 'Adam'}. Best is trial 66 with value: 0.019806242402532648.
2026-05-15 19:43:16,503 - experiment_functions - INFO - Early stopping at epoch 1950. Best Recall: 0.0188
2026-05-15 19:43:16,615 - optuna.study.study - INFO - Trial 70 finished with value: 0.018815173930850155 and parameters: {'n_layers': 4, 'embedding_dim': 64, 'lr': 0.04788092299355717, 'lambda_val': 2.8081550014498777e-05, 'batch_size': 2891, 'optimizer': 'Adam'}. Best is trial 66 with value: 0.019806242402532648.
2026-05-15 19:43:29,891 - experiment_functions - INFO - Early stopping at epoch 2450. Best Recall: 0.0189
2026-05-15 19:43:30,432 - optuna.study.study - INFO - Trial 71 finished with value: 0.018897519264818204 and parameters: {'n_layers': 4, 'embedding_dim': 64, 'lr': 0.05039942611185559, 'lambda_val': 0.00010943983447533171, 'batch_size': 2424, 'optimizer': 'Adam'}. Best is trial 66 with value: 0.019806242402532648.
2026-05-15 19:43:38,639 - experiment_functions - INFO - Early stopping at epoch 1350. Best Recall: 0.0190
2026-05-15 19:43:38,753 - optuna.study.study - INFO - Trial 72 finished with value: 0.019035525282345356 and parameters: {'n_layers': 4, 'embedding_dim': 64, 'lr': 0.049161128309746706, 'lambda_val': 2.8650194032799944e-05, 'batch_size': 2480, 'optimizer': 'Adam'}. Best is trial 66 with value: 0.019806242402532648.
2026-05-15 19:43:45,905 - optuna.study._optimize - INFO - Trial 73 pruned. 
2026-05-15 19:43:52,576 - experiment_functions - INFO - Early stopping at epoch 850. Best Recall: 0.0030
2026-05-15 19:43:52,701 - optuna.study.study - INFO - Trial 74 finished with value: 0.0029870799617704924 and parameters: {'n_layers': 4, 'embedding_dim': 64, 'lr': 0.03641525007769451, 'lambda_val': 6.056658149195416e-05, 'batch_size': 2779, 'optimizer': 'SGD'}. Best is trial 66 with value: 0.019806242402532648.
2026-05-15 19:44:00,108 - optuna.study._optimize - INFO - Trial 75 pruned. 
2026-05-15 19:44:11,974 - experiment_functions - INFO - Early stopping at epoch 1900. Best Recall: 0.0177
2026-05-15 19:44:12,099 - optuna.study.study - INFO - Trial 76 finished with value: 0.01767136962929278 and parameters: {'n_layers': 4, 'embedding_dim': 64, 'lr': 0.08379253479498891, 'lambda_val': 0.00012188038792212638, 'batch_size': 3714, 'optimizer': 'Adam'}. Best is trial 66 with value: 0.019806242402532648.
2026-05-15 19:44:19,922 - experiment_functions - INFO - Early stopping at epoch 1050. Best Recall: 0.0139
2026-05-15 19:44:20,067 - optuna.study.study - INFO - Trial 77 finished with value: 0.013944520282086046 and parameters: {'n_layers': 4, 'embedding_dim': 256, 'lr': 0.05053836624222255, 'lambda_val': 3.0001382933651344e-05, 'batch_size': 3258, 'optimizer': 'Adam'}. Best is trial 66 with value: 0.019806242402532648.
2026-05-15 19:44:28,187 - optuna.study._optimize - INFO - Trial 78 pruned. 
2026-05-15 19:44:42,756 - optuna.study._optimize - INFO - Trial 79 pruned. 
2026-05-15 19:44:48,945 - optuna.study._optimize - INFO - Trial 80 pruned. 
2026-05-15 19:45:00,369 - experiment_functions - INFO - Early stopping at epoch 1700. Best Recall: 0.0171
2026-05-15 19:45:00,494 - optuna.study.study - INFO - Trial 81 finished with value: 0.017076709573031153 and parameters: {'n_layers': 4, 'embedding_dim': 64, 'lr': 0.04253981683143742, 'lambda_val': 2.9579386373397685e-05, 'batch_size': 2618, 'optimizer': 'Adam'}. Best is trial 66 with value: 0.019806242402532648.
2026-05-15 19:45:07,297 - experiment_functions - INFO - Early stopping at epoch 950. Best Recall: 0.0162
2026-05-15 19:45:07,409 - optuna.study.study - INFO - Trial 82 finished with value: 0.01616727360849575 and parameters: {'n_layers': 4, 'embedding_dim': 64, 'lr': 0.05195040678765523, 'lambda_val': 1.8807122293523664e-05, 'batch_size': 2489, 'optimizer': 'Adam'}. Best is trial 66 with value: 0.019806242402532648.
2026-05-15 19:45:16,663 - experiment_functions - INFO - Early stopping at epoch 1300. Best Recall: 0.0189
2026-05-15 19:45:16,796 - optuna.study.study - INFO - Trial 83 finished with value: 0.01886604280097861 and parameters: {'n_layers': 4, 'embedding_dim': 64, 'lr': 0.033521544810941176, 'lambda_val': 6.64806079763016e-05, 'batch_size': 2853, 'optimizer': 'Adam'}. Best is trial 66 with value: 0.019806242402532648.
2026-05-15 19:45:23,633 - experiment_functions - INFO - Early stopping at epoch 1000. Best Recall: 0.0151
2026-05-15 19:45:23,777 - optuna.study.study - INFO - Trial 84 finished with value: 0.015128697542873631 and parameters: {'n_layers': 4, 'embedding_dim': 64, 'lr': 0.032238747241079356, 'lambda_val': 0.0001762183691730526, 'batch_size': 2911, 'optimizer': 'Adam'}. Best is trial 66 with value: 0.019806242402532648.
2026-05-15 19:45:28,609 - experiment_functions - INFO - Early stopping at epoch 500. Best Recall: 0.0008
2026-05-15 19:45:28,742 - optuna.study.study - INFO - Trial 85 finished with value: 0.0008061630132683575 and parameters: {'n_layers': 4, 'embedding_dim': 64, 'lr': 0.0264540185791862, 'lambda_val': 7.65830093361795e-05, 'batch_size': 3097, 'optimizer': 'SGD'}. Best is trial 66 with value: 0.019806242402532648.
2026-05-15 19:45:40,578 - experiment_functions - INFO - Early stopping at epoch 1800. Best Recall: 0.0182
2026-05-15 19:45:40,692 - optuna.study.study - INFO - Trial 86 finished with value: 0.01821293484550499 and parameters: {'n_layers': 4, 'embedding_dim': 64, 'lr': 0.09617593007567043, 'lambda_val': 0.00011996004916128248, 'batch_size': 2837, 'optimizer': 'Adam'}. Best is trial 66 with value: 0.019806242402532648.
2026-05-15 19:45:48,101 - optuna.study._optimize - INFO - Trial 87 pruned. 
2026-05-15 19:45:54,139 - experiment_functions - INFO - Early stopping at epoch 700. Best Recall: 0.0078
2026-05-15 19:45:54,264 - optuna.study.study - INFO - Trial 88 finished with value: 0.007790170256224776 and parameters: {'n_layers': 4, 'embedding_dim': 256, 'lr': 0.0008288290366795679, 'lambda_val': 3.328452756452337e-05, 'batch_size': 2334, 'optimizer': 'Adam'}. Best is trial 66 with value: 0.019806242402532648.
2026-05-15 19:46:07,226 - experiment_functions - INFO - Early stopping at epoch 2200. Best Recall: 0.0213
2026-05-15 19:46:07,345 - optuna.study.study - INFO - Trial 89 finished with value: 0.02126928764173481 and parameters: {'n_layers': 4, 'embedding_dim': 64, 'lr': 0.034224610219560116, 'lambda_val': 6.433235777770546e-05, 'batch_size': 2207, 'optimizer': 'Adam'}. Best is trial 89 with value: 0.02126928764173481.
2026-05-15 19:46:14,693 - optuna.study._optimize - INFO - Trial 90 pruned. 
2026-05-15 19:46:29,910 - experiment_functions - INFO - Early stopping at epoch 2450. Best Recall: 0.0232
2026-05-15 19:46:30,045 - optuna.study.study - INFO - Trial 91 finished with value: 0.023237056167017246 and parameters: {'n_layers': 4, 'embedding_dim': 64, 'lr': 0.03660594332910203, 'lambda_val': 7.46518484352349e-05, 'batch_size': 3003, 'optimizer': 'Adam'}. Best is trial 91 with value: 0.023237056167017246.
2026-05-15 19:46:36,587 - experiment_functions - INFO - Early stopping at epoch 800. Best Recall: 0.0181
2026-05-15 19:46:36,678 - optuna.study.study - INFO - Trial 92 finished with value: 0.018051890563460463 and parameters: {'n_layers': 4, 'embedding_dim': 64, 'lr': 0.06165112525802847, 'lambda_val': 6.955791036628808e-05, 'batch_size': 3023, 'optimizer': 'Adam'}. Best is trial 91 with value: 0.023237056167017246.
2026-05-15 19:46:50,306 - experiment_functions - INFO - Early stopping at epoch 2500. Best Recall: 0.0224
2026-05-15 19:46:50,421 - optuna.study.study - INFO - Trial 93 finished with value: 0.022448689945703707 and parameters: {'n_layers': 4, 'embedding_dim': 64, 'lr': 0.020283446215525566, 'lambda_val': 5.1930741174290825e-05, 'batch_size': 3246, 'optimizer': 'Adam'}. Best is trial 91 with value: 0.023237056167017246.
2026-05-15 19:46:56,108 - experiment_functions - INFO - Early stopping at epoch 950. Best Recall: 0.0048
2026-05-15 19:46:56,253 - optuna.study.study - INFO - Trial 94 finished with value: 0.004804473551513151 and parameters: {'n_layers': 4, 'embedding_dim': 64, 'lr': 0.009334359636072601, 'lambda_val': 5.077413719792022e-05, 'batch_size': 3261, 'optimizer': 'Adam'}. Best is trial 91 with value: 0.023237056167017246.
2026-05-15 19:47:04,365 - optuna.study._optimize - INFO - Trial 95 pruned. 
2026-05-15 19:47:13,524 - optuna.study._optimize - INFO - Trial 96 pruned. 
2026-05-15 19:47:23,924 - optuna.study._optimize - INFO - Trial 97 pruned. 
2026-05-15 19:47:43,166 - experiment_functions - INFO - Early stopping at epoch 2500. Best Recall: 0.0190
2026-05-15 19:47:43,257 - optuna.study.study - INFO - Trial 98 finished with value: 0.01899275111450869 and parameters: {'n_layers': 4, 'embedding_dim': 64, 'lr': 0.036030512713241675, 'lambda_val': 4.824727253482372e-05, 'batch_size': 3338, 'optimizer': 'Adam'}. Best is trial 91 with value: 0.023237056167017246.
2026-05-15 19:47:57,289 - experiment_functions - INFO - Early stopping at epoch 1850. Best Recall: 0.0173
2026-05-15 19:47:57,413 - optuna.study.study - INFO - Trial 99 finished with value: 0.017262259230183048 and parameters: {'n_layers': 4, 'embedding_dim': 64, 'lr': 0.07372537429723783, 'lambda_val': 6.621645817907564e-05, 'batch_size': 3190, 'optimizer': 'Adam'}. Best is trial 91 with value: 0.023237056167017246.
2026-05-15 19:48:07,784 - experiment_functions - INFO - Early stopping at epoch 1200. Best Recall: 0.0182
2026-05-15 19:48:07,909 - optuna.study.study - INFO - Trial 100 finished with value: 0.018204339793549133 and parameters: {'n_layers': 4, 'embedding_dim': 256, 'lr': 0.03442617959102296, 'lambda_val': 8.02255379305937e-05, 'batch_size': 3313, 'optimizer': 'Adam'}. Best is trial 91 with value: 0.023237056167017246.
2026-05-15 19:48:31,688 - experiment_functions - INFO - Early stopping at epoch 3050. Best Recall: 0.0202
2026-05-15 19:48:31,801 - optuna.study.study - INFO - Trial 101 finished with value: 0.020206425077530118 and parameters: {'n_layers': 4, 'embedding_dim': 64, 'lr': 0.03858333507890056, 'lambda_val': 3.791974452449836e-05, 'batch_size': 3557, 'optimizer': 'Adam'}. Best is trial 91 with value: 0.023237056167017246.
2026-05-15 19:48:47,554 - experiment_functions - INFO - Early stopping at epoch 2050. Best Recall: 0.0231
2026-05-15 19:48:47,668 - optuna.study.study - INFO - Trial 102 finished with value: 0.02306232379230521 and parameters: {'n_layers': 4, 'embedding_dim': 64, 'lr': 0.03725023450529246, 'lambda_val': 4.774723952390773e-05, 'batch_size': 3584, 'optimizer': 'Adam'}. Best is trial 91 with value: 0.023237056167017246.
2026-05-15 19:48:56,631 - experiment_functions - INFO - Early stopping at epoch 1050. Best Recall: 0.0204
2026-05-15 19:48:56,746 - optuna.study.study - INFO - Trial 103 finished with value: 0.020436732775760053 and parameters: {'n_layers': 4, 'embedding_dim': 64, 'lr': 0.05880701412661473, 'lambda_val': 1.8076592310190107e-05, 'batch_size': 3576, 'optimizer': 'Adam'}. Best is trial 91 with value: 0.023237056167017246.
2026-05-15 19:49:01,318 - experiment_functions - INFO - Early stopping at epoch 500. Best Recall: 0.0034
2026-05-15 19:49:01,434 - optuna.study.study - INFO - Trial 104 finished with value: 0.003409361367492644 and parameters: {'n_layers': 4, 'embedding_dim': 64, 'lr': 0.03842531834762265, 'lambda_val': 1.7094519617478286e-05, 'batch_size': 3831, 'optimizer': 'SGD'}. Best is trial 91 with value: 0.023237056167017246.
2026-05-15 19:49:15,828 - experiment_functions - INFO - Early stopping at epoch 1750. Best Recall: 0.0227
2026-05-15 19:49:15,962 - optuna.study.study - INFO - Trial 105 finished with value: 0.02269689846021111 and parameters: {'n_layers': 4, 'embedding_dim': 64, 'lr': 0.06056522237981958, 'lambda_val': 4.660711553889571e-05, 'batch_size': 3613, 'optimizer': 'Adam'}. Best is trial 91 with value: 0.023237056167017246.
2026-05-15 19:49:22,679 - experiment_functions - INFO - Early stopping at epoch 750. Best Recall: 0.0180
2026-05-15 19:49:22,803 - optuna.study.study - INFO - Trial 106 finished with value: 0.01796169834874286 and parameters: {'n_layers': 4, 'embedding_dim': 64, 'lr': 0.06436373544031863, 'lambda_val': 7.841838973658854e-06, 'batch_size': 3552, 'optimizer': 'Adam'}. Best is trial 91 with value: 0.023237056167017246.
2026-05-15 19:49:28,092 - experiment_functions - INFO - Early stopping at epoch 600. Best Recall: 0.0150
2026-05-15 19:49:28,195 - optuna.study.study - INFO - Trial 107 finished with value: 0.015037297608186687 and parameters: {'n_layers': 4, 'embedding_dim': 64, 'lr': 0.07956302778552836, 'lambda_val': 2.5280547817040803e-05, 'batch_size': 3772, 'optimizer': 'Adam'}. Best is trial 91 with value: 0.023237056167017246.
2026-05-15 19:49:41,528 - experiment_functions - INFO - Early stopping at epoch 1650. Best Recall: 0.0195
2026-05-15 19:49:41,643 - optuna.study.study - INFO - Trial 108 finished with value: 0.019481256708429477 and parameters: {'n_layers': 4, 'embedding_dim': 64, 'lr': 0.05523545154239045, 'lambda_val': 3.6345966593690754e-05, 'batch_size': 3511, 'optimizer': 'Adam'}. Best is trial 91 with value: 0.023237056167017246.
2026-05-15 19:49:52,318 - optuna.study._optimize - INFO - Trial 109 pruned. 
2026-05-15 19:49:58,117 - experiment_functions - INFO - Early stopping at epoch 800. Best Recall: 0.0152
2026-05-15 19:49:58,311 - optuna.study.study - INFO - Trial 110 finished with value: 0.0151790676838179 and parameters: {'n_layers': 4, 'embedding_dim': 64, 'lr': 0.08401199928594308, 'lambda_val': 1.777495024333504e-05, 'batch_size': 3902, 'optimizer': 'Adam'}. Best is trial 91 with value: 0.023237056167017246.
2026-05-15 19:50:07,807 - experiment_functions - INFO - Early stopping at epoch 1400. Best Recall: 0.0185
2026-05-15 19:50:07,942 - optuna.study.study - INFO - Trial 111 finished with value: 0.018502349400133265 and parameters: {'n_layers': 4, 'embedding_dim': 64, 'lr': 0.0448794022983049, 'lambda_val': 1.1673569707521879e-05, 'batch_size': 3612, 'optimizer': 'Adam'}. Best is trial 91 with value: 0.023237056167017246.
2026-05-15 19:50:18,075 - experiment_functions - INFO - Early stopping at epoch 1550. Best Recall: 0.0179
2026-05-15 19:50:18,233 - optuna.study.study - INFO - Trial 112 finished with value: 0.01785901914456845 and parameters: {'n_layers': 4, 'embedding_dim': 64, 'lr': 0.059238813084202084, 'lambda_val': 3.725191999714026e-05, 'batch_size': 3672, 'optimizer': 'Adam'}. Best is trial 91 with value: 0.023237056167017246.
2026-05-15 19:50:31,463 - experiment_functions - INFO - Early stopping at epoch 2000. Best Recall: 0.0236
2026-05-15 19:50:31,589 - optuna.study.study - INFO - Trial 113 finished with value: 0.023552085003485827 and parameters: {'n_layers': 4, 'embedding_dim': 64, 'lr': 0.04128112634797193, 'lambda_val': 5.436118969872995e-05, 'batch_size': 3567, 'optimizer': 'Adam'}. Best is trial 113 with value: 0.023552085003485827.
2026-05-15 19:50:53,272 - experiment_functions - INFO - Early stopping at epoch 3350. Best Recall: 0.0213
2026-05-15 19:50:53,386 - optuna.study.study - INFO - Trial 114 finished with value: 0.021333773490403565 and parameters: {'n_layers': 4, 'embedding_dim': 64, 'lr': 0.028661687632681312, 'lambda_val': 5.175651128294714e-05, 'batch_size': 3592, 'optimizer': 'Adam'}. Best is trial 113 with value: 0.023552085003485827.
2026-05-15 19:51:00,411 - optuna.study._optimize - INFO - Trial 115 pruned. 
2026-05-15 19:51:11,482 - optuna.study._optimize - INFO - Trial 116 pruned. 
2026-05-15 19:51:17,144 - experiment_functions - INFO - Early stopping at epoch 700. Best Recall: 0.0020
2026-05-15 19:51:17,322 - optuna.study.study - INFO - Trial 117 finished with value: 0.001959768760021731 and parameters: {'n_layers': 4, 'embedding_dim': 64, 'lr': 1.0429400856061492e-05, 'lambda_val': 8.252458855756626e-05, 'batch_size': 3347, 'optimizer': 'Adam'}. Best is trial 113 with value: 0.023552085003485827.
2026-05-15 19:51:22,379 - experiment_functions - INFO - Early stopping at epoch 650. Best Recall: 0.0165
2026-05-15 19:51:22,490 - optuna.study.study - INFO - Trial 118 finished with value: 0.016467837910190047 and parameters: {'n_layers': 4, 'embedding_dim': 64, 'lr': 0.09982204147605397, 'lambda_val': 2.3499719768014697e-05, 'batch_size': 3951, 'optimizer': 'Adam'}. Best is trial 113 with value: 0.023552085003485827.
2026-05-15 19:51:42,851 - experiment_functions - INFO - Early stopping at epoch 3150. Best Recall: 0.0253
2026-05-15 19:51:43,014 - optuna.study.study - INFO - Trial 119 finished with value: 0.025263757590283552 and parameters: {'n_layers': 4, 'embedding_dim': 64, 'lr': 0.02053983854681847, 'lambda_val': 6.170527870427863e-05, 'batch_size': 3484, 'optimizer': 'Adam'}. Best is trial 119 with value: 0.025263757590283552.
2026-05-15 19:51:47,013 - experiment_functions - INFO - Early stopping at epoch 500. Best Recall: 0.0015
