2026-05-16 07:05:32,907 - optuna.study.study - INFO - Trial 158 finished with value: 0.0022446529669048966 and parameters: {'n_layers': 1, 'embedding_dim': 256, 'lr': 0.03709277535268505, 'lambda_val': 0.0004721918342358847, 'batch_size': 4092, 'optimizer': 'SGD'}. Best is trial 140 with value: 0.12599909761257422.
2026-05-16 07:05:42,299 - experiment_functions - INFO - Early stopping at epoch 1350. Best Recall: 0.1189
2026-05-16 07:05:42,388 - optuna.study.study - INFO - Trial 159 finished with value: 0.11887389023646223 and parameters: {'n_layers': 1, 'embedding_dim': 256, 'lr': 0.0004109210863379617, 'lambda_val': 5.4676512351561315e-06, 'batch_size': 4092, 'optimizer': 'Adam'}. Best is trial 140 with value: 0.12599909761257422.
2026-05-16 07:06:08,741 - experiment_functions - INFO - Early stopping at epoch 2800. Best Recall: 0.1287
2026-05-16 07:06:08,850 - optuna.study.study - INFO - Trial 160 finished with value: 0.12869025333259268 and parameters: {'n_layers': 1, 'embedding_dim': 256, 'lr': 0.00034638596691579873, 'lambda_val': 5.9003287379808095e-06, 'batch_size': 3857, 'optimizer': 'Adam'}. Best is trial 160 with value: 0.12869025333259268.
2026-05-16 07:06:18,857 - experiment_functions - INFO - Early stopping at epoch 1450. Best Recall: 0.1208
2026-05-16 07:06:18,989 - optuna.study.study - INFO - Trial 161 finished with value: 0.1207976101184403 and parameters: {'n_layers': 1, 'embedding_dim': 256, 'lr': 0.00041859359167141394, 'lambda_val': 6.030434506845765e-06, 'batch_size': 3875, 'optimizer': 'Adam'}. Best is trial 160 with value: 0.12869025333259268.
2026-05-16 07:06:30,016 - optuna.study._optimize - INFO - Trial 162 pruned. 
2026-05-16 07:06:47,043 - experiment_functions - INFO - Early stopping at epoch 2000. Best Recall: 0.1173
2026-05-16 07:06:47,131 - optuna.study.study - INFO - Trial 163 finished with value: 0.11729031704765235 and parameters: {'n_layers': 1, 'embedding_dim': 256, 'lr': 0.0003750695484172582, 'lambda_val': 4.114939747644947e-06, 'batch_size': 3657, 'optimizer': 'Adam'}. Best is trial 160 with value: 0.12869025333259268.
2026-05-16 07:06:57,500 - experiment_functions - INFO - Early stopping at epoch 1600. Best Recall: 0.1189
2026-05-16 07:06:57,600 - optuna.study.study - INFO - Trial 164 finished with value: 0.11887098031714007 and parameters: {'n_layers': 1, 'embedding_dim': 256, 'lr': 0.0003800556788905159, 'lambda_val': 4.373497119311811e-06, 'batch_size': 3680, 'optimizer': 'Adam'}. Best is trial 160 with value: 0.12869025333259268.
2026-05-16 07:07:13,559 - experiment_functions - INFO - Early stopping at epoch 1800. Best Recall: 0.1240
2026-05-16 07:07:13,647 - optuna.study.study - INFO - Trial 165 finished with value: 0.12395017150136335 and parameters: {'n_layers': 1, 'embedding_dim': 256, 'lr': 0.000375287590467738, 'lambda_val': 3.9195125742470545e-06, 'batch_size': 3652, 'optimizer': 'Adam'}. Best is trial 160 with value: 0.12869025333259268.
2026-05-16 07:07:24,453 - experiment_functions - INFO - Early stopping at epoch 1650. Best Recall: 0.1205
2026-05-16 07:07:24,552 - optuna.study.study - INFO - Trial 166 finished with value: 0.12052226324444448 and parameters: {'n_layers': 1, 'embedding_dim': 256, 'lr': 0.00036852925364916605, 'lambda_val': 3.421898069339086e-06, 'batch_size': 3552, 'optimizer': 'Adam'}. Best is trial 160 with value: 0.12869025333259268.
2026-05-16 07:07:30,537 - optuna.study._optimize - INFO - Trial 167 pruned. 
2026-05-16 07:07:46,556 - experiment_functions - INFO - Early stopping at epoch 2200. Best Recall: 0.1188
2026-05-16 07:07:46,655 - optuna.study.study - INFO - Trial 168 finished with value: 0.118755532423173 and parameters: {'n_layers': 1, 'embedding_dim': 256, 'lr': 0.00037356991423319563, 'lambda_val': 3.0709487192139376e-06, 'batch_size': 3625, 'optimizer': 'Adam'}. Best is trial 160 with value: 0.12869025333259268.
2026-05-16 07:07:53,882 - optuna.study._optimize - INFO - Trial 169 pruned. 
2026-05-16 07:08:04,316 - experiment_functions - INFO - Early stopping at epoch 1700. Best Recall: 0.1321
2026-05-16 07:08:04,430 - optuna.study.study - INFO - Trial 170 finished with value: 0.13212942614027623 and parameters: {'n_layers': 1, 'embedding_dim': 256, 'lr': 0.00036379690866393186, 'lambda_val': 4.851587961678779e-06, 'batch_size': 3611, 'optimizer': 'Adam'}. Best is trial 170 with value: 0.13212942614027623.
2026-05-16 07:08:19,861 - experiment_functions - INFO - Early stopping at epoch 1700. Best Recall: 0.1149
2026-05-16 07:08:20,003 - optuna.study.study - INFO - Trial 171 finished with value: 0.11490402012417579 and parameters: {'n_layers': 1, 'embedding_dim': 256, 'lr': 0.0003457277120388221, 'lambda_val': 5.429299902146577e-06, 'batch_size': 3591, 'optimizer': 'Adam'}. Best is trial 170 with value: 0.13212942614027623.
2026-05-16 07:08:31,483 - experiment_functions - INFO - Early stopping at epoch 1700. Best Recall: 0.1106
2026-05-16 07:08:31,573 - optuna.study.study - INFO - Trial 172 finished with value: 0.11062165756275191 and parameters: {'n_layers': 1, 'embedding_dim': 256, 'lr': 0.0004265961624572481, 'lambda_val': 2.1934232695741817e-06, 'batch_size': 3520, 'optimizer': 'Adam'}. Best is trial 170 with value: 0.13212942614027623.
2026-05-16 07:08:38,840 - optuna.study._optimize - INFO - Trial 173 pruned. 
2026-05-16 07:08:50,032 - experiment_functions - INFO - Early stopping at epoch 1400. Best Recall: 0.1197
2026-05-16 07:08:50,122 - optuna.study.study - INFO - Trial 174 finished with value: 0.11969271894311918 and parameters: {'n_layers': 1, 'embedding_dim': 256, 'lr': 0.0004131893498169206, 'lambda_val': 4.781007323125079e-06, 'batch_size': 3466, 'optimizer': 'Adam'}. Best is trial 170 with value: 0.13212942614027623.
2026-05-16 07:08:59,243 - optuna.study._optimize - INFO - Trial 175 pruned. 
2026-05-16 07:09:18,605 - experiment_functions - INFO - Early stopping at epoch 2300. Best Recall: 0.1228
2026-05-16 07:09:18,705 - optuna.study.study - INFO - Trial 176 finished with value: 0.12283733866314987 and parameters: {'n_layers': 1, 'embedding_dim': 256, 'lr': 0.0003213314495873131, 'lambda_val': 6.824759991493782e-06, 'batch_size': 3557, 'optimizer': 'Adam'}. Best is trial 170 with value: 0.13212942614027623.
2026-05-16 07:09:25,829 - optuna.study._optimize - INFO - Trial 177 pruned. 
2026-05-16 07:09:32,725 - optuna.study._optimize - INFO - Trial 178 pruned. 
2026-05-16 07:09:54,627 - experiment_functions - INFO - Early stopping at epoch 1900. Best Recall: 0.1132
2026-05-16 07:09:54,729 - optuna.study.study - INFO - Trial 179 finished with value: 0.11318203545260701 and parameters: {'n_layers': 1, 'embedding_dim': 256, 'lr': 0.00046964524569983806, 'lambda_val': 7.3831853913786914e-06, 'batch_size': 3450, 'optimizer': 'Adam'}. Best is trial 170 with value: 0.13212942614027623.
2026-05-16 07:10:00,580 - optuna.study._optimize - INFO - Trial 180 pruned. 
2026-05-16 07:10:20,161 - experiment_functions - INFO - Early stopping at epoch 2450. Best Recall: 0.1192
2026-05-16 07:10:20,259 - optuna.study.study - INFO - Trial 181 finished with value: 0.11917236227840543 and parameters: {'n_layers': 1, 'embedding_dim': 256, 'lr': 0.0002692494362135049, 'lambda_val': 4.374429757073129e-06, 'batch_size': 3557, 'optimizer': 'Adam'}. Best is trial 170 with value: 0.13212942614027623.
2026-05-16 07:10:27,340 - optuna.study._optimize - INFO - Trial 182 pruned. 
2026-05-16 07:10:34,601 - optuna.study._optimize - INFO - Trial 183 pruned. 
2026-05-16 07:10:51,303 - optuna.study._optimize - INFO - Trial 184 pruned. 
2026-05-16 07:11:01,677 - experiment_functions - INFO - Early stopping at epoch 1550. Best Recall: 0.1231
2026-05-16 07:11:01,819 - optuna.study.study - INFO - Trial 185 finished with value: 0.12312700963084451 and parameters: {'n_layers': 1, 'embedding_dim': 256, 'lr': 0.000433010026496116, 'lambda_val': 1.3720576008772971e-06, 'batch_size': 3573, 'optimizer': 'Adam'}. Best is trial 170 with value: 0.13212942614027623.
2026-05-16 07:11:11,509 - experiment_functions - INFO - Early stopping at epoch 1200. Best Recall: 0.1141
2026-05-16 07:11:11,617 - optuna.study.study - INFO - Trial 186 finished with value: 0.11406875088801981 and parameters: {'n_layers': 1, 'embedding_dim': 256, 'lr': 0.00044597598106624705, 'lambda_val': 1.390633126295954e-06, 'batch_size': 3587, 'optimizer': 'Adam'}. Best is trial 170 with value: 0.13212942614027623.
2026-05-16 07:11:35,235 - experiment_functions - INFO - Early stopping at epoch 2650. Best Recall: 0.1227
2026-05-16 07:11:35,344 - optuna.study.study - INFO - Trial 187 finished with value: 0.12272943872956775 and parameters: {'n_layers': 1, 'embedding_dim': 256, 'lr': 0.0003261305023242932, 'lambda_val': 2.7113979672297784e-06, 'batch_size': 3412, 'optimizer': 'Adam'}. Best is trial 170 with value: 0.13212942614027623.
2026-05-16 07:11:39,465 - experiment_functions - INFO - Early stopping at epoch 500. Best Recall: 0.0013
2026-05-16 07:11:39,561 - optuna.study.study - INFO - Trial 188 finished with value: 0.0013140627304001056 and parameters: {'n_layers': 1, 'embedding_dim': 256, 'lr': 0.0003001487662773896, 'lambda_val': 1.6041764895497928e-06, 'batch_size': 3263, 'optimizer': 'SGD'}. Best is trial 170 with value: 0.13212942614027623.
2026-05-16 07:11:46,593 - optuna.study._optimize - INFO - Trial 189 pruned. 
2026-05-16 07:11:58,769 - experiment_functions - INFO - Early stopping at epoch 1700. Best Recall: 0.1252
2026-05-16 07:11:58,869 - optuna.study.study - INFO - Trial 190 finished with value: 0.12517274706281514 and parameters: {'n_layers': 1, 'embedding_dim': 256, 'lr': 0.0004983101949327385, 'lambda_val': 6.807552286294666e-06, 'batch_size': 3504, 'optimizer': 'Adam'}. Best is trial 170 with value: 0.13212942614027623.
2026-05-16 07:12:07,678 - experiment_functions - INFO - Early stopping at epoch 1350. Best Recall: 0.1149
2026-05-16 07:12:07,780 - optuna.study.study - INFO - Trial 191 finished with value: 0.11493306988541004 and parameters: {'n_layers': 1, 'embedding_dim': 256, 'lr': 0.0004895471037744696, 'lambda_val': 7.450334383981876e-06, 'batch_size': 3516, 'optimizer': 'Adam'}. Best is trial 170 with value: 0.13212942614027623.
2026-05-16 07:12:14,580 - optuna.study._optimize - INFO - Trial 192 pruned. 
2026-05-16 07:12:34,025 - experiment_functions - INFO - Early stopping at epoch 1900. Best Recall: 0.1250
2026-05-16 07:12:34,117 - optuna.study.study - INFO - Trial 193 finished with value: 0.12502816446215825 and parameters: {'n_layers': 1, 'embedding_dim': 256, 'lr': 0.0004080425484915391, 'lambda_val': 1.1813685594761418e-06, 'batch_size': 3692, 'optimizer': 'Adam'}. Best is trial 170 with value: 0.13212942614027623.
2026-05-16 07:12:45,634 - experiment_functions - INFO - Early stopping at epoch 1500. Best Recall: 0.1118
2026-05-16 07:12:45,774 - optuna.study.study - INFO - Trial 194 finished with value: 0.11179638797529977 and parameters: {'n_layers': 1, 'embedding_dim': 256, 'lr': 0.0004927983151304675, 'lambda_val': 1.2602794088445188e-06, 'batch_size': 3559, 'optimizer': 'Adam'}. Best is trial 170 with value: 0.13212942614027623.
2026-05-16 07:13:00,453 - experiment_functions - INFO - Early stopping at epoch 2150. Best Recall: 0.1202
2026-05-16 07:13:00,553 - optuna.study.study - INFO - Trial 195 finished with value: 0.12023350425388055 and parameters: {'n_layers': 1, 'embedding_dim': 256, 'lr': 0.0004103962549482846, 'lambda_val': 1.2057794613083773e-06, 'batch_size': 1651, 'optimizer': 'Adam'}. Best is trial 170 with value: 0.13212942614027623.
2026-05-16 07:13:14,055 - experiment_functions - INFO - Early stopping at epoch 2100. Best Recall: 0.1234
2026-05-16 07:13:14,152 - optuna.study.study - INFO - Trial 196 finished with value: 0.12340481730720838 and parameters: {'n_layers': 1, 'embedding_dim': 256, 'lr': 0.00031722695101877717, 'lambda_val': 1.1447453673517592e-06, 'batch_size': 3737, 'optimizer': 'Adam'}. Best is trial 170 with value: 0.13212942614027623.
2026-05-16 07:13:21,036 - optuna.study._optimize - INFO - Trial 197 pruned. 
2026-05-16 07:13:33,798 - optuna.study._optimize - INFO - Trial 198 pruned. 
2026-05-16 07:13:40,235 - optuna.study._optimize - INFO - Trial 199 pruned. 
2026-05-16 07:13:46,660 - optuna.study._optimize - INFO - Trial 200 pruned. 
2026-05-16 07:14:04,500 - experiment_functions - INFO - Early stopping at epoch 1250. Best Recall: 0.1199
2026-05-16 07:14:04,599 - optuna.study.study - INFO - Trial 201 finished with value: 0.11985862391411807 and parameters: {'n_layers': 1, 'embedding_dim': 256, 'lr': 0.0004887117785961137, 'lambda_val': 1.2057194315541072e-06, 'batch_size': 3496, 'optimizer': 'Adam'}. Best is trial 170 with value: 0.13212942614027623.
2026-05-16 07:14:16,729 - experiment_functions - INFO - Early stopping at epoch 1550. Best Recall: 0.1170
2026-05-16 07:14:16,829 - optuna.study.study - INFO - Trial 202 finished with value: 0.1170392463515625 and parameters: {'n_layers': 1, 'embedding_dim': 256, 'lr': 0.00040749694396330523, 'lambda_val': 1.2307594625510318e-06, 'batch_size': 3499, 'optimizer': 'Adam'}. Best is trial 170 with value: 0.13212942614027623.
2026-05-16 07:14:23,365 - optuna.study._optimize - INFO - Trial 203 pruned. 
2026-05-16 07:14:39,604 - optuna.study._optimize - INFO - Trial 204 pruned. 
2026-05-16 07:14:47,996 - experiment_functions - INFO - Early stopping at epoch 1250. Best Recall: 0.1175
2026-05-16 07:14:48,112 - optuna.study.study - INFO - Trial 205 finished with value: 0.11750173282612009 and parameters: {'n_layers': 1, 'embedding_dim': 256, 'lr': 0.000525884934993648, 'lambda_val': 1.6008088045435332e-06, 'batch_size': 3544, 'optimizer': 'Adam'}. Best is trial 170 with value: 0.13212942614027623.
2026-05-16 07:14:59,935 - optuna.study._optimize - INFO - Trial 206 pruned. 
2026-05-16 07:15:10,995 - optuna.study._optimize - INFO - Trial 207 pruned. 
2026-05-16 07:15:23,663 - experiment_functions - INFO - Early stopping at epoch 2000. Best Recall: 0.1181
2026-05-16 07:15:23,779 - optuna.study.study - INFO - Trial 208 finished with value: 0.11812131112730988 and parameters: {'n_layers': 1, 'embedding_dim': 256, 'lr': 0.0003280042084109797, 'lambda_val': 2.5810752761116384e-06, 'batch_size': 3724, 'optimizer': 'Adam'}. Best is trial 170 with value: 0.13212942614027623.
2026-05-16 07:15:34,288 - experiment_functions - INFO - Early stopping at epoch 1550. Best Recall: 0.1222
2026-05-16 07:15:34,391 - optuna.study.study - INFO - Trial 209 finished with value: 0.1222418085797713 and parameters: {'n_layers': 1, 'embedding_dim': 256, 'lr': 0.0004187992958560033, 'lambda_val': 6.751798436559034e-06, 'batch_size': 3608, 'optimizer': 'Adam'}. Best is trial 170 with value: 0.13212942614027623.
2026-05-16 07:15:46,914 - optuna.study._optimize - INFO - Trial 210 pruned. 
2026-05-16 07:15:54,353 - optuna.study._optimize - INFO - Trial 211 pruned. 
2026-05-16 07:16:10,604 - experiment_functions - INFO - Early stopping at epoch 1450. Best Recall: 0.1139
2026-05-16 07:16:10,706 - optuna.study.study - INFO - Trial 212 finished with value: 0.1138573963580514 and parameters: {'n_layers': 1, 'embedding_dim': 256, 'lr': 0.00040243509820624113, 'lambda_val': 6.66138567174196e-06, 'batch_size': 3562, 'optimizer': 'Adam'}. Best is trial 170 with value: 0.13212942614027623.
2026-05-16 07:16:23,885 - optuna.study._optimize - INFO - Trial 213 pruned. 
2026-05-16 07:16:41,927 - experiment_functions - INFO - Early stopping at epoch 1800. Best Recall: 0.1171
2026-05-16 07:16:42,023 - optuna.study.study - INFO - Trial 214 finished with value: 0.11706759972291518 and parameters: {'n_layers': 1, 'embedding_dim': 256, 'lr': 0.00033759946285055476, 'lambda_val': 1.944677163842985e-06, 'batch_size': 3498, 'optimizer': 'Adam'}. Best is trial 170 with value: 0.13212942614027623.
2026-05-16 07:16:49,421 - optuna.study._optimize - INFO - Trial 215 pruned. 
2026-05-16 07:16:59,304 - optuna.study._optimize - INFO - Trial 216 pruned. 
2026-05-16 07:17:06,486 - optuna.study._optimize - INFO - Trial 217 pruned. 
2026-05-16 07:17:17,072 - optuna.study._optimize - INFO - Trial 218 pruned. 
2026-05-16 07:17:24,089 - optuna.study._optimize - INFO - Trial 219 pruned. 
2026-05-16 07:17:30,760 - experiment_functions - INFO - Early stopping at epoch 950. Best Recall: 0.0506
2026-05-16 07:17:30,852 - optuna.study.study - INFO - Trial 220 finished with value: 0.05062876621267357 and parameters: {'n_layers': 1, 'embedding_dim': 256, 'lr': 0.00036073470623003537, 'lambda_val': 0.030367123517468158, 'batch_size': 3752, 'optimizer': 'Adam'}. Best is trial 170 with value: 0.13212942614027623.
2026-05-16 07:17:45,966 - optuna.study._optimize - INFO - Trial 221 pruned. 
2026-05-16 07:17:56,429 - experiment_functions - INFO - Early stopping at epoch 1500. Best Recall: 0.1194
2026-05-16 07:17:56,545 - optuna.study.study - INFO - Trial 222 finished with value: 0.11938054415073174 and parameters: {'n_layers': 1, 'embedding_dim': 256, 'lr': 0.0005222272203731734, 'lambda_val': 6.53330487290355e-06, 'batch_size': 2242, 'optimizer': 'Adam'}. Best is trial 170 with value: 0.13212942614027623.
2026-05-16 07:18:19,577 - experiment_functions - INFO - Early stopping at epoch 2100. Best Recall: 0.1179
2026-05-16 07:18:19,670 - optuna.study.study - INFO - Trial 223 finished with value: 0.11789416651390526 and parameters: {'n_layers': 1, 'embedding_dim': 256, 'lr': 0.0005498600561154431, 'lambda_val': 6.752801760189105e-06, 'batch_size': 1970, 'optimizer': 'Adam'}. Best is trial 170 with value: 0.13212942614027623.
2026-05-16 07:18:36,098 - experiment_functions - INFO - Early stopping at epoch 2100. Best Recall: 0.1227
2026-05-16 07:18:36,192 - optuna.study.study - INFO - Trial 224 finished with value: 0.1226917240300599 and parameters: {'n_layers': 1, 'embedding_dim': 256, 'lr': 0.0004116723981019872, 'lambda_val': 4.304289868400874e-06, 'batch_size': 2701, 'optimizer': 'Adam'}. Best is trial 170 with value: 0.13212942614027623.
2026-05-16 07:18:47,354 - experiment_functions - INFO - Early stopping at epoch 1700. Best Recall: 0.1226
2026-05-16 07:18:47,458 - optuna.study.study - INFO - Trial 225 finished with value: 0.1225605552220338 and parameters: {'n_layers': 1, 'embedding_dim': 256, 'lr': 0.0004355502058930918, 'lambda_val': 3.339904759678032e-06, 'batch_size': 2295, 'optimizer': 'Adam'}. Best is trial 170 with value: 0.13212942614027623.
2026-05-16 07:18:55,831 - optuna.study._optimize - INFO - Trial 226 pruned. 
2026-05-16 07:18:59,841 - experiment_functions - INFO - Early stopping at epoch 500. Best Recall: 0.0012
2026-05-16 07:18:59,946 - optuna.study.study - INFO - Trial 227 finished with value: 0.0011797141590148311 and parameters: {'n_layers': 1, 'embedding_dim': 64, 'lr': 0.0003474182169573618, 'lambda_val': 1.4907275982216324e-06, 'batch_size': 2571, 'optimizer': 'SGD'}. Best is trial 170 with value: 0.13212942614027623.
2026-05-16 07:19:21,839 - experiment_functions - INFO - Early stopping at epoch 1800. Best Recall: 0.1187
2026-05-16 07:19:22,021 - optuna.study.study - INFO - Trial 228 finished with value: 0.11865111962624714 and parameters: {'n_layers': 1, 'embedding_dim': 256, 'lr': 0.00042492313145647874, 'lambda_val': 2.531950639338529e-06, 'batch_size': 3192, 'optimizer': 'Adam'}. Best is trial 170 with value: 0.13212942614027623.
2026-05-16 07:19:34,442 - experiment_functions - INFO - Early stopping at epoch 1150. Best Recall: 0.1133
2026-05-16 07:19:34,559 - optuna.study.study - INFO - Trial 229 finished with value: 0.11333594846759804 and parameters: {'n_layers': 1, 'embedding_dim': 256, 'lr': 0.0006648227294113488, 'lambda_val': 4.083557622810685e-06, 'batch_size': 3297, 'optimizer': 'Adam'}. Best is trial 170 with value: 0.13212942614027623.
2026-05-16 07:19:41,460 - optuna.study._optimize - INFO - Trial 230 pruned. 
2026-05-16 07:19:58,926 - experiment_functions - INFO - Early stopping at epoch 2100. Best Recall: 0.1228
2026-05-16 07:19:59,031 - optuna.study.study - INFO - Trial 231 finished with value: 0.12277158467517295 and parameters: {'n_layers': 1, 'embedding_dim': 256, 'lr': 0.000544962825420292, 'lambda_val': 6.460278005314219e-06, 'batch_size': 2161, 'optimizer': 'Adam'}. Best is trial 170 with value: 0.13212942614027623.
2026-05-16 07:20:09,952 - optuna.study._optimize - INFO - Trial 232 pruned. 
2026-05-16 07:20:24,856 - experiment_functions - INFO - Early stopping at epoch 2100. Best Recall: 0.1152
2026-05-16 07:20:24,959 - optuna.study.study - INFO - Trial 233 finished with value: 0.11515894616445178 and parameters: {'n_layers': 1, 'embedding_dim': 256, 'lr': 0.000590411392434814, 'lambda_val': 1.078601245175994e-06, 'batch_size': 2127, 'optimizer': 'Adam'}. Best is trial 170 with value: 0.13212942614027623.
2026-05-16 07:20:32,553 - optuna.study._optimize - INFO - Trial 234 pruned. 
2026-05-16 07:20:59,270 - optuna.study.study - INFO - Trial 235 finished with value: 0.13444998959533183 and parameters: {'n_layers': 1, 'embedding_dim': 256, 'lr': 0.0003336045909465723, 'lambda_val': 4.802859581919778e-06, 'batch_size': 2313, 'optimizer': 'Adam'}. Best is trial 235 with value: 0.13444998959533183.
2026-05-16 07:21:06,498 - optuna.study._optimize - INFO - Trial 236 pruned. 
2026-05-16 07:21:20,007 - experiment_functions - INFO - Early stopping at epoch 1950. Best Recall: 0.1196
2026-05-16 07:21:20,133 - optuna.study.study - INFO - Trial 237 finished with value: 0.1196276351570919 and parameters: {'n_layers': 1, 'embedding_dim': 256, 'lr': 0.0005038632784577648, 'lambda_val': 1.285463307911789e-05, 'batch_size': 2321, 'optimizer': 'Adam'}. Best is trial 235 with value: 0.13444998959533183.
2026-05-16 07:21:29,631 - optuna.study._optimize - INFO - Trial 238 pruned. 
2026-05-16 07:21:36,399 - optuna.study._optimize - INFO - Trial 239 pruned. 
2026-05-16 07:21:48,277 - experiment_functions - INFO - Early stopping at epoch 1250. Best Recall: 0.1135
