2026-05-16 07:35:54,605 - optuna.study.study - INFO - Trial 26 finished with value: 0.10336659452205682 and parameters: {'n_layers': 1, 'embedding_dim': 256, 'lr': 0.0006594535940273048, 'lambda_val': 0.0011664063530587715, 'batch_size': 1331, 'optimizer': 'Adam'}. Best is trial 25 with value: 0.11096912571126988.
2026-05-16 07:36:05,044 - experiment_functions - INFO - Early stopping at epoch 1650. Best Recall: 0.1144
2026-05-16 07:36:05,139 - optuna.study.study - INFO - Trial 27 finished with value: 0.11438699320293012 and parameters: {'n_layers': 1, 'embedding_dim': 256, 'lr': 0.0006087517446664405, 'lambda_val': 0.0012740987211929393, 'batch_size': 1410, 'optimizer': 'Adam'}. Best is trial 27 with value: 0.11438699320293012.
2026-05-16 07:36:09,485 - experiment_functions - INFO - Early stopping at epoch 550. Best Recall: 0.0773
2026-05-16 07:36:09,576 - optuna.study.study - INFO - Trial 28 finished with value: 0.07725761710458248 and parameters: {'n_layers': 1, 'embedding_dim': 256, 'lr': 0.0029343505495437795, 'lambda_val': 0.0029504648930370665, 'batch_size': 2807, 'optimizer': 'Adam'}. Best is trial 27 with value: 0.11438699320293012.
2026-05-16 07:36:13,515 - experiment_functions - INFO - Early stopping at epoch 500. Best Recall: 0.0029
2026-05-16 07:36:13,628 - optuna.study.study - INFO - Trial 29 finished with value: 0.0028595784556253085 and parameters: {'n_layers': 1, 'embedding_dim': 256, 'lr': 5.302794474193574e-05, 'lambda_val': 0.011841654629615997, 'batch_size': 2044, 'optimizer': 'Adam'}. Best is trial 27 with value: 0.11438699320293012.
2026-05-16 07:36:20,612 - experiment_functions - INFO - Early stopping at epoch 550. Best Recall: 0.0565
2026-05-16 07:36:21,387 - optuna.study.study - INFO - Trial 30 finished with value: 0.05648168994815086 and parameters: {'n_layers': 1, 'embedding_dim': 256, 'lr': 0.010004809148020828, 'lambda_val': 0.0008333437420778147, 'batch_size': 1347, 'optimizer': 'Adam'}. Best is trial 27 with value: 0.11438699320293012.
2026-05-16 07:36:39,675 - experiment_functions - INFO - Early stopping at epoch 1650. Best Recall: 0.1157
2026-05-16 07:36:39,802 - optuna.study.study - INFO - Trial 31 finished with value: 0.11571983415563261 and parameters: {'n_layers': 1, 'embedding_dim': 256, 'lr': 0.0006757751679616451, 'lambda_val': 0.0009217096209021148, 'batch_size': 1510, 'optimizer': 'Adam'}. Best is trial 31 with value: 0.11571983415563261.
2026-05-16 07:36:52,609 - experiment_functions - INFO - Early stopping at epoch 2000. Best Recall: 0.1179
2026-05-16 07:36:52,714 - optuna.study.study - INFO - Trial 32 finished with value: 0.11785425073190167 and parameters: {'n_layers': 1, 'embedding_dim': 256, 'lr': 0.0007344962089530396, 'lambda_val': 0.00046696914310825313, 'batch_size': 934, 'optimizer': 'Adam'}. Best is trial 32 with value: 0.11785425073190167.
2026-05-16 07:37:05,716 - experiment_functions - INFO - Early stopping at epoch 850. Best Recall: 0.1026
2026-05-16 07:37:06,489 - optuna.study.study - INFO - Trial 33 finished with value: 0.10256013685950863 and parameters: {'n_layers': 1, 'embedding_dim': 256, 'lr': 0.0016286811959397025, 'lambda_val': 0.0004645266793794429, 'batch_size': 1005, 'optimizer': 'Adam'}. Best is trial 32 with value: 0.11785425073190167.
2026-05-16 07:37:16,343 - optuna.study._optimize - INFO - Trial 34 pruned. 
2026-05-16 07:37:30,410 - experiment_functions - INFO - Early stopping at epoch 2250. Best Recall: 0.1126
2026-05-16 07:37:30,546 - optuna.study.study - INFO - Trial 35 finished with value: 0.11255441646006974 and parameters: {'n_layers': 1, 'embedding_dim': 256, 'lr': 0.0004445831467991102, 'lambda_val': 0.002150930378953731, 'batch_size': 1846, 'optimizer': 'Adam'}. Best is trial 32 with value: 0.11785425073190167.
2026-05-16 07:37:34,810 - experiment_functions - INFO - Early stopping at epoch 600. Best Recall: 0.0899
2026-05-16 07:37:34,917 - optuna.study.study - INFO - Trial 36 finished with value: 0.08994235586205208 and parameters: {'n_layers': 1, 'embedding_dim': 256, 'lr': 0.0021124660835956776, 'lambda_val': 0.013840137990577931, 'batch_size': 1839, 'optimizer': 'Adam'}. Best is trial 32 with value: 0.11785425073190167.
2026-05-16 07:37:40,619 - experiment_functions - INFO - Early stopping at epoch 850. Best Recall: 0.1161
2026-05-16 07:37:40,699 - optuna.study.study - INFO - Trial 37 finished with value: 0.11607215431044636 and parameters: {'n_layers': 1, 'embedding_dim': 256, 'lr': 0.0009821517437089476, 'lambda_val': 0.0005408409653776977, 'batch_size': 2242, 'optimizer': 'Adam'}. Best is trial 32 with value: 0.11785425073190167.
2026-05-16 07:37:48,387 - experiment_functions - INFO - Early stopping at epoch 1250. Best Recall: 0.1067
2026-05-16 07:37:48,477 - optuna.study.study - INFO - Trial 38 finished with value: 0.10673349015858846 and parameters: {'n_layers': 1, 'embedding_dim': 128, 'lr': 0.000811191987702004, 'lambda_val': 0.0005426787614421424, 'batch_size': 2790, 'optimizer': 'Adam'}. Best is trial 32 with value: 0.11785425073190167.
2026-05-16 07:37:52,539 - experiment_functions - INFO - Early stopping at epoch 550. Best Recall: 0.0937
2026-05-16 07:37:52,629 - optuna.study.study - INFO - Trial 39 finished with value: 0.09367942025425754 and parameters: {'n_layers': 1, 'embedding_dim': 256, 'lr': 0.0049283390693491405, 'lambda_val': 7.015274864155425e-05, 'batch_size': 2425, 'optimizer': 'Adam'}. Best is trial 32 with value: 0.11785425073190167.
2026-05-16 07:38:03,128 - experiment_functions - INFO - Early stopping at epoch 500. Best Recall: 0.0013
2026-05-16 07:38:03,890 - optuna.study.study - INFO - Trial 40 finished with value: 0.0013137438134546008 and parameters: {'n_layers': 1, 'embedding_dim': 64, 'lr': 0.01163309632461889, 'lambda_val': 0.03890222451022352, 'batch_size': 1495, 'optimizer': 'SGD'}. Best is trial 32 with value: 0.11785425073190167.
2026-05-16 07:38:14,910 - experiment_functions - INFO - Early stopping at epoch 1400. Best Recall: 0.1122
2026-05-16 07:38:15,021 - optuna.study.study - INFO - Trial 41 finished with value: 0.11219444945391177 and parameters: {'n_layers': 1, 'embedding_dim': 256, 'lr': 0.0004983482397126087, 'lambda_val': 0.001992384709071601, 'batch_size': 2314, 'optimizer': 'Adam'}. Best is trial 32 with value: 0.11785425073190167.
2026-05-16 07:38:20,236 - experiment_functions - INFO - Early stopping at epoch 750. Best Recall: 0.0916
2026-05-16 07:38:20,339 - optuna.study.study - INFO - Trial 42 finished with value: 0.09156608087491325 and parameters: {'n_layers': 1, 'embedding_dim': 256, 'lr': 0.0009559951027685488, 'lambda_val': 0.00711693692042206, 'batch_size': 1879, 'optimizer': 'Adam'}. Best is trial 32 with value: 0.11785425073190167.
2026-05-16 07:38:29,280 - optuna.study._optimize - INFO - Trial 43 pruned. 
2026-05-16 07:38:37,842 - optuna.study._optimize - INFO - Trial 44 pruned. 
2026-05-16 07:38:47,668 - optuna.study._optimize - INFO - Trial 45 pruned. 
2026-05-16 07:38:51,789 - experiment_functions - INFO - Early stopping at epoch 550. Best Recall: 0.0967
2026-05-16 07:38:51,959 - optuna.study.study - INFO - Trial 46 finished with value: 0.09667730663756526 and parameters: {'n_layers': 1, 'embedding_dim': 256, 'lr': 0.004000174378332761, 'lambda_val': 0.0032953110825063017, 'batch_size': 2620, 'optimizer': 'Adam'}. Best is trial 32 with value: 0.11785425073190167.
2026-05-16 07:38:55,943 - experiment_functions - INFO - Early stopping at epoch 500. Best Recall: 0.0020
2026-05-16 07:38:56,033 - optuna.study.study - INFO - Trial 47 finished with value: 0.002002155636746459 and parameters: {'n_layers': 4, 'embedding_dim': 64, 'lr': 0.06836901630030853, 'lambda_val': 0.0001851603690188112, 'batch_size': 2167, 'optimizer': 'SGD'}. Best is trial 32 with value: 0.11785425073190167.
2026-05-16 07:39:02,692 - experiment_functions - INFO - Early stopping at epoch 800. Best Recall: 0.1017
2026-05-16 07:39:02,792 - optuna.study.study - INFO - Trial 48 finished with value: 0.10169923256835994 and parameters: {'n_layers': 1, 'embedding_dim': 256, 'lr': 0.0019445042612212362, 'lambda_val': 0.0008369902856833989, 'batch_size': 1453, 'optimizer': 'Adam'}. Best is trial 32 with value: 0.11785425073190167.
2026-05-16 07:39:06,780 - experiment_functions - INFO - Early stopping at epoch 500. Best Recall: 0.0030
2026-05-16 07:39:06,870 - optuna.study.study - INFO - Trial 49 finished with value: 0.002950413856050315 and parameters: {'n_layers': 2, 'embedding_dim': 128, 'lr': 0.0009007216216324631, 'lambda_val': 4.78509835971767e-05, 'batch_size': 1779, 'optimizer': 'SGD'}. Best is trial 32 with value: 0.11785425073190167.
2026-05-16 07:39:16,675 - experiment_functions - INFO - Early stopping at epoch 1150. Best Recall: 0.1170
2026-05-16 07:39:16,786 - optuna.study.study - INFO - Trial 50 finished with value: 0.11699637863017533 and parameters: {'n_layers': 1, 'embedding_dim': 256, 'lr': 0.0010888264470313462, 'lambda_val': 0.0015572523261790886, 'batch_size': 776, 'optimizer': 'Adam'}. Best is trial 32 with value: 0.11785425073190167.
2026-05-16 07:39:26,133 - optuna.study._optimize - INFO - Trial 51 pruned. 
2026-05-16 07:39:34,701 - experiment_functions - INFO - Early stopping at epoch 1200. Best Recall: 0.1173
2026-05-16 07:39:34,821 - optuna.study.study - INFO - Trial 52 finished with value: 0.11731184094145997 and parameters: {'n_layers': 1, 'embedding_dim': 256, 'lr': 0.0010890664496387827, 'lambda_val': 0.00034745056043006137, 'batch_size': 1058, 'optimizer': 'Adam'}. Best is trial 32 with value: 0.11785425073190167.
2026-05-16 07:39:41,451 - experiment_functions - INFO - Early stopping at epoch 1000. Best Recall: 0.1168
2026-05-16 07:39:41,618 - optuna.study.study - INFO - Trial 53 finished with value: 0.11678950758464154 and parameters: {'n_layers': 1, 'embedding_dim': 256, 'lr': 0.0011550963217186805, 'lambda_val': 0.0003441291366041016, 'batch_size': 1098, 'optimizer': 'Adam'}. Best is trial 32 with value: 0.11785425073190167.
2026-05-16 07:39:47,816 - experiment_functions - INFO - Early stopping at epoch 800. Best Recall: 0.1035
2026-05-16 07:39:47,906 - optuna.study.study - INFO - Trial 54 finished with value: 0.10354376410480264 and parameters: {'n_layers': 1, 'embedding_dim': 256, 'lr': 0.0012481534779361283, 'lambda_val': 0.0002493206269207788, 'batch_size': 1065, 'optimizer': 'Adam'}. Best is trial 32 with value: 0.11785425073190167.
2026-05-16 07:39:52,930 - experiment_functions - INFO - Early stopping at epoch 650. Best Recall: 0.0862
2026-05-16 07:39:53,021 - optuna.study.study - INFO - Trial 55 finished with value: 0.086151918944087 and parameters: {'n_layers': 1, 'embedding_dim': 32, 'lr': 0.003506155504888364, 'lambda_val': 0.0001123635960144267, 'batch_size': 795, 'optimizer': 'Adam'}. Best is trial 32 with value: 0.11785425073190167.
2026-05-16 07:40:01,152 - experiment_functions - INFO - Early stopping at epoch 650. Best Recall: 0.0560
2026-05-16 07:40:01,242 - optuna.study.study - INFO - Trial 56 finished with value: 0.05602415897592315 and parameters: {'n_layers': 3, 'embedding_dim': 256, 'lr': 0.0011661650968936615, 'lambda_val': 0.00041760163469182067, 'batch_size': 610, 'optimizer': 'Adam'}. Best is trial 32 with value: 0.11785425073190167.
2026-05-16 07:40:06,578 - experiment_functions - INFO - Early stopping at epoch 600. Best Recall: 0.0649
2026-05-16 07:40:06,714 - optuna.study.study - INFO - Trial 57 finished with value: 0.06494806044819545 and parameters: {'n_layers': 2, 'embedding_dim': 256, 'lr': 0.0016298754520299758, 'lambda_val': 0.0006136313101422769, 'batch_size': 1188, 'optimizer': 'Adam'}. Best is trial 32 with value: 0.11785425073190167.
2026-05-16 07:40:11,726 - experiment_functions - INFO - Early stopping at epoch 700. Best Recall: 0.0904
2026-05-16 07:40:11,829 - optuna.study.study - INFO - Trial 58 finished with value: 0.09037339701828984 and parameters: {'n_layers': 1, 'embedding_dim': 64, 'lr': 0.002366215253812776, 'lambda_val': 0.00022520489382793588, 'batch_size': 3834, 'optimizer': 'Adam'}. Best is trial 32 with value: 0.11785425073190167.
2026-05-16 07:40:16,029 - experiment_functions - INFO - Early stopping at epoch 500. Best Recall: 0.0016
2026-05-16 07:40:16,139 - optuna.study.study - INFO - Trial 59 finished with value: 0.0016121528249203735 and parameters: {'n_layers': 1, 'embedding_dim': 256, 'lr': 0.009121488139337988, 'lambda_val': 0.0001615380150367893, 'batch_size': 819, 'optimizer': 'SGD'}. Best is trial 32 with value: 0.11785425073190167.
2026-05-16 07:40:23,277 - optuna.study._optimize - INFO - Trial 60 pruned. 
2026-05-16 07:40:34,635 - experiment_functions - INFO - Early stopping at epoch 1700. Best Recall: 0.1182
2026-05-16 07:40:34,717 - optuna.study.study - INFO - Trial 61 finished with value: 0.11820508603892374 and parameters: {'n_layers': 1, 'embedding_dim': 256, 'lr': 0.000615573639752205, 'lambda_val': 0.0010771054692492036, 'batch_size': 1068, 'optimizer': 'Adam'}. Best is trial 61 with value: 0.11820508603892374.
2026-05-16 07:40:45,154 - experiment_functions - INFO - Early stopping at epoch 1500. Best Recall: 0.1176
2026-05-16 07:40:45,254 - optuna.study.study - INFO - Trial 62 finished with value: 0.11757431553124856 and parameters: {'n_layers': 1, 'embedding_dim': 256, 'lr': 0.0008212682576423259, 'lambda_val': 0.0008015395907330545, 'batch_size': 1029, 'optimizer': 'Adam'}. Best is trial 61 with value: 0.11820508603892374.
2026-05-16 07:40:56,433 - experiment_functions - INFO - Early stopping at epoch 1500. Best Recall: 0.1225
2026-05-16 07:40:56,555 - optuna.study.study - INFO - Trial 63 finished with value: 0.12246482395132097 and parameters: {'n_layers': 1, 'embedding_dim': 256, 'lr': 0.0009413013547352191, 'lambda_val': 0.00034298533541643884, 'batch_size': 679, 'optimizer': 'Adam'}. Best is trial 63 with value: 0.12246482395132097.
2026-05-16 07:41:05,648 - optuna.study._optimize - INFO - Trial 64 pruned. 
2026-05-16 07:41:13,073 - experiment_functions - INFO - Early stopping at epoch 950. Best Recall: 0.1010
2026-05-16 07:41:13,240 - optuna.study.study - INFO - Trial 65 finished with value: 0.10098834798819092 and parameters: {'n_layers': 1, 'embedding_dim': 256, 'lr': 0.0016513128757809248, 'lambda_val': 0.0007676186633246437, 'batch_size': 517, 'optimizer': 'Adam'}. Best is trial 63 with value: 0.12246482395132097.
2026-05-16 07:41:20,095 - optuna.study._optimize - INFO - Trial 66 pruned. 
2026-05-16 07:41:30,393 - experiment_functions - INFO - Early stopping at epoch 1050. Best Recall: 0.1088
2026-05-16 07:41:30,707 - optuna.study.study - INFO - Trial 67 finished with value: 0.10883994645468435 and parameters: {'n_layers': 1, 'embedding_dim': 256, 'lr': 0.0011063437902661883, 'lambda_val': 0.0003532690748790547, 'batch_size': 914, 'optimizer': 'Adam'}. Best is trial 63 with value: 0.12246482395132097.
2026-05-16 07:41:49,486 - experiment_functions - INFO - Early stopping at epoch 2650. Best Recall: 0.1263
2026-05-16 07:41:49,950 - optuna.study.study - INFO - Trial 68 finished with value: 0.12632720903481046 and parameters: {'n_layers': 1, 'embedding_dim': 256, 'lr': 0.0007515415151089992, 'lambda_val': 0.0001232900613409277, 'batch_size': 763, 'optimizer': 'Adam'}. Best is trial 68 with value: 0.12632720903481046.
2026-05-16 07:41:56,615 - experiment_functions - INFO - Early stopping at epoch 800. Best Recall: 0.0763
2026-05-16 07:41:56,706 - optuna.study.study - INFO - Trial 69 finished with value: 0.0762508384269288 and parameters: {'n_layers': 2, 'embedding_dim': 256, 'lr': 0.0007295913759855802, 'lambda_val': 8.628568940723267e-05, 'batch_size': 816, 'optimizer': 'Adam'}. Best is trial 68 with value: 0.12632720903481046.
2026-05-16 07:42:04,341 - optuna.study._optimize - INFO - Trial 70 pruned. 
2026-05-16 07:42:20,584 - optuna.study._optimize - INFO - Trial 71 pruned. 
2026-05-16 07:42:27,491 - optuna.study._optimize - INFO - Trial 72 pruned. 
2026-05-16 07:42:36,354 - experiment_functions - INFO - Early stopping at epoch 950. Best Recall: 0.1177
2026-05-16 07:42:36,466 - optuna.study.study - INFO - Trial 73 finished with value: 0.11767286527036046 and parameters: {'n_layers': 1, 'embedding_dim': 256, 'lr': 0.0013676606004825414, 'lambda_val': 0.00026502987725169816, 'batch_size': 1064, 'optimizer': 'Adam'}. Best is trial 68 with value: 0.12632720903481046.
2026-05-16 07:42:42,469 - experiment_functions - INFO - Early stopping at epoch 800. Best Recall: 0.0980
2026-05-16 07:42:42,568 - optuna.study.study - INFO - Trial 74 finished with value: 0.09803588480611367 and parameters: {'n_layers': 1, 'embedding_dim': 256, 'lr': 0.0019154232650627771, 'lambda_val': 0.0001275816292911738, 'batch_size': 1010, 'optimizer': 'Adam'}. Best is trial 68 with value: 0.12632720903481046.
2026-05-16 07:42:50,587 - optuna.study._optimize - INFO - Trial 75 pruned. 
2026-05-16 07:42:56,675 - experiment_functions - INFO - Early stopping at epoch 650. Best Recall: 0.0960
2026-05-16 07:42:56,776 - optuna.study.study - INFO - Trial 76 finished with value: 0.0960329954396993 and parameters: {'n_layers': 1, 'embedding_dim': 256, 'lr': 0.0026396050329549566, 'lambda_val': 0.0011646403221678406, 'batch_size': 1210, 'optimizer': 'Adam'}. Best is trial 68 with value: 0.12632720903481046.
2026-05-16 07:43:02,860 - optuna.study._optimize - INFO - Trial 77 pruned. 
2026-05-16 07:43:08,825 - experiment_functions - INFO - Early stopping at epoch 600. Best Recall: 0.0475
2026-05-16 07:43:08,915 - optuna.study.study - INFO - Trial 78 finished with value: 0.04748136850563809 and parameters: {'n_layers': 3, 'embedding_dim': 256, 'lr': 0.0014761586984177618, 'lambda_val': 0.000450714141321548, 'batch_size': 868, 'optimizer': 'Adam'}. Best is trial 68 with value: 0.12632720903481046.
2026-05-16 07:43:12,986 - experiment_functions - INFO - Early stopping at epoch 500. Best Recall: 0.0017
2026-05-16 07:43:13,089 - optuna.study.study - INFO - Trial 79 finished with value: 0.001745282038118222 and parameters: {'n_layers': 1, 'embedding_dim': 128, 'lr': 0.0008479355776213578, 'lambda_val': 0.0051053523387540765, 'batch_size': 1361, 'optimizer': 'SGD'}. Best is trial 68 with value: 0.12632720903481046.
2026-05-16 07:43:19,761 - experiment_functions - INFO - Early stopping at epoch 650. Best Recall: 0.0319
2026-05-16 07:43:19,851 - optuna.study.study - INFO - Trial 80 finished with value: 0.03194970743492601 and parameters: {'n_layers': 4, 'embedding_dim': 256, 'lr': 0.0006702647685584861, 'lambda_val': 0.0016063856547586255, 'batch_size': 1147, 'optimizer': 'Adam'}. Best is trial 68 with value: 0.12632720903481046.
2026-05-16 07:43:26,102 - experiment_functions - INFO - Early stopping at epoch 850. Best Recall: 0.1071
2026-05-16 07:43:26,192 - optuna.study.study - INFO - Trial 81 finished with value: 0.1070789202503342 and parameters: {'n_layers': 1, 'embedding_dim': 256, 'lr': 0.0012482296495928053, 'lambda_val': 0.0002913683309574232, 'batch_size': 1049, 'optimizer': 'Adam'}. Best is trial 68 with value: 0.12632720903481046.
2026-05-16 07:43:35,340 - experiment_functions - INFO - Early stopping at epoch 1100. Best Recall: 0.1137
2026-05-16 07:43:35,437 - optuna.study.study - INFO - Trial 82 finished with value: 0.11365376522614155 and parameters: {'n_layers': 1, 'embedding_dim': 256, 'lr': 0.0010859190657736622, 'lambda_val': 0.0003817084225860728, 'batch_size': 1111, 'optimizer': 'Adam'}. Best is trial 68 with value: 0.12632720903481046.
2026-05-16 07:43:39,931 - experiment_functions - INFO - Early stopping at epoch 600. Best Recall: 0.0914
2026-05-16 07:43:40,043 - optuna.study.study - INFO - Trial 83 finished with value: 0.0914320891822033 and parameters: {'n_layers': 1, 'embedding_dim': 256, 'lr': 0.003140355683263778, 'lambda_val': 0.0010738390990295648, 'batch_size': 890, 'optimizer': 'Adam'}. Best is trial 68 with value: 0.12632720903481046.
2026-05-16 07:43:49,091 - optuna.study._optimize - INFO - Trial 84 pruned. 
2026-05-16 07:43:53,879 - experiment_functions - INFO - Early stopping at epoch 600. Best Recall: 0.0821
2026-05-16 07:43:53,982 - optuna.study.study - INFO - Trial 85 finished with value: 0.08212351034016298 and parameters: {'n_layers': 1, 'embedding_dim': 256, 'lr': 0.0017860379625865425, 'lambda_val': 0.00012970028301309468, 'batch_size': 1277, 'optimizer': 'RMSprop'}. Best is trial 68 with value: 0.12632720903481046.
2026-05-16 07:44:08,276 - experiment_functions - INFO - Early stopping at epoch 2050. Best Recall: 0.1265
2026-05-16 07:44:08,378 - optuna.study.study - INFO - Trial 86 finished with value: 0.12653279645273968 and parameters: {'n_layers': 1, 'embedding_dim': 256, 'lr': 0.0007384939837500307, 'lambda_val': 0.0008217252518055011, 'batch_size': 701, 'optimizer': 'Adam'}. Best is trial 86 with value: 0.12653279645273968.
2026-05-16 07:44:15,344 - optuna.study._optimize - INFO - Trial 87 pruned. 
2026-05-16 07:44:22,921 - optuna.study._optimize - INFO - Trial 88 pruned. 
2026-05-16 07:44:30,284 - optuna.study._optimize - INFO - Trial 89 pruned. 
2026-05-16 07:44:37,862 - experiment_functions - INFO - Early stopping at epoch 800. Best Recall: 0.1023
2026-05-16 07:44:37,953 - optuna.study.study - INFO - Trial 90 finished with value: 0.10227193096326229 and parameters: {'n_layers': 1, 'embedding_dim': 256, 'lr': 0.0014006390222742497, 'lambda_val': 0.0021440401636014937, 'batch_size': 819, 'optimizer': 'Adam'}. Best is trial 86 with value: 0.12653279645273968.
2026-05-16 07:44:46,742 - experiment_functions - INFO - Early stopping at epoch 850. Best Recall: 0.1105
2026-05-16 07:44:46,964 - optuna.study.study - INFO - Trial 91 finished with value: 0.11053401192010229 and parameters: {'n_layers': 1, 'embedding_dim': 256, 'lr': 0.0009535078116032145, 'lambda_val': 0.00019077369269958282, 'batch_size': 3085, 'optimizer': 'Adam'}. Best is trial 86 with value: 0.12653279645273968.
2026-05-16 07:44:52,841 - experiment_functions - INFO - Early stopping at epoch 800. Best Recall: 0.0925
