2026-05-15 22:09:17,901 - optuna.study.study - INFO - Trial 167 finished with value: 0.00255919012034411 and parameters: {'n_layers': 1, 'embedding_dim': 256, 'lr': 2.4285019500888635e-05, 'lambda_val': 3.5401696366276683e-06, 'batch_size': 958, 'optimizer': 'Adam'}. Best is trial 112 with value: 0.13045097788925025.
2026-05-15 22:09:33,374 - experiment_functions - INFO - Early stopping at epoch 1850. Best Recall: 0.1223
2026-05-15 22:09:33,522 - optuna.study.study - INFO - Trial 168 finished with value: 0.12233186232928667 and parameters: {'n_layers': 1, 'embedding_dim': 256, 'lr': 0.0004707616287358384, 'lambda_val': 5.42592066731256e-06, 'batch_size': 1233, 'optimizer': 'Adam'}. Best is trial 112 with value: 0.13045097788925025.
2026-05-15 22:09:40,541 - optuna.study._optimize - INFO - Trial 169 pruned. 
2026-05-15 22:09:57,004 - experiment_functions - INFO - Early stopping at epoch 1200. Best Recall: 0.1153
2026-05-15 22:09:57,095 - optuna.study.study - INFO - Trial 170 finished with value: 0.11526091915315535 and parameters: {'n_layers': 1, 'embedding_dim': 256, 'lr': 0.0010801448509994108, 'lambda_val': 2.5347326734309635e-06, 'batch_size': 1252, 'optimizer': 'Adam'}. Best is trial 112 with value: 0.13045097788925025.
2026-05-15 22:10:04,754 - optuna.study._optimize - INFO - Trial 171 pruned. 
2026-05-15 22:10:10,606 - experiment_functions - INFO - Early stopping at epoch 850. Best Recall: 0.0656
2026-05-15 22:10:10,707 - optuna.study.study - INFO - Trial 172 finished with value: 0.06562684538837164 and parameters: {'n_layers': 1, 'embedding_dim': 256, 'lr': 0.0005522374243948292, 'lambda_val': 0.02430891122076117, 'batch_size': 1365, 'optimizer': 'Adam'}. Best is trial 112 with value: 0.13045097788925025.
2026-05-15 22:10:17,246 - optuna.study._optimize - INFO - Trial 173 pruned. 
2026-05-15 22:10:32,257 - experiment_functions - INFO - Early stopping at epoch 950. Best Recall: 0.1116
2026-05-15 22:10:32,348 - optuna.study.study - INFO - Trial 174 finished with value: 0.11163014872388821 and parameters: {'n_layers': 1, 'embedding_dim': 256, 'lr': 0.0010050942638588434, 'lambda_val': 1.479722670095441e-06, 'batch_size': 1301, 'optimizer': 'Adam'}. Best is trial 112 with value: 0.13045097788925025.
2026-05-15 22:10:41,280 - experiment_functions - INFO - Early stopping at epoch 1450. Best Recall: 0.1203
2026-05-15 22:10:41,423 - optuna.study.study - INFO - Trial 175 finished with value: 0.12032841767152694 and parameters: {'n_layers': 1, 'embedding_dim': 256, 'lr': 0.0006626910065359482, 'lambda_val': 0.0016110864749815195, 'batch_size': 1194, 'optimizer': 'Adam'}. Best is trial 112 with value: 0.13045097788925025.
2026-05-15 22:10:48,414 - optuna.study._optimize - INFO - Trial 176 pruned. 
2026-05-15 22:10:54,875 - optuna.study._optimize - INFO - Trial 177 pruned. 
2026-05-15 22:11:01,427 - optuna.study._optimize - INFO - Trial 178 pruned. 
2026-05-15 22:11:07,811 - optuna.study._optimize - INFO - Trial 179 pruned. 
2026-05-15 22:11:14,584 - optuna.study._optimize - INFO - Trial 180 pruned. 
2026-05-15 22:11:24,084 - optuna.study._optimize - INFO - Trial 181 pruned. 
2026-05-15 22:11:30,428 - optuna.study._optimize - INFO - Trial 182 pruned. 
2026-05-15 22:11:53,768 - experiment_functions - INFO - Early stopping at epoch 2800. Best Recall: 0.1292
2026-05-15 22:11:53,846 - optuna.study.study - INFO - Trial 183 finished with value: 0.1291528025952479 and parameters: {'n_layers': 1, 'embedding_dim': 256, 'lr': 0.0005167007012996155, 'lambda_val': 2.9351899271909617e-06, 'batch_size': 1255, 'optimizer': 'Adam'}. Best is trial 112 with value: 0.13045097788925025.
2026-05-15 22:12:00,151 - optuna.study._optimize - INFO - Trial 184 pruned. 
2026-05-15 22:12:06,936 - optuna.study._optimize - INFO - Trial 185 pruned. 
2026-05-15 22:12:12,672 - experiment_functions - INFO - Early stopping at epoch 600. Best Recall: 0.0598
2026-05-15 22:12:12,772 - optuna.study.study - INFO - Trial 186 finished with value: 0.05978852202059679 and parameters: {'n_layers': 3, 'embedding_dim': 256, 'lr': 0.0011823881863568383, 'lambda_val': 0.000429737627703068, 'batch_size': 1298, 'optimizer': 'Adam'}. Best is trial 112 with value: 0.13045097788925025.
2026-05-15 22:12:18,630 - experiment_functions - INFO - Early stopping at epoch 950. Best Recall: 0.1009
2026-05-15 22:12:18,737 - optuna.study.study - INFO - Trial 187 finished with value: 0.1009243111289093 and parameters: {'n_layers': 1, 'embedding_dim': 128, 'lr': 0.0008876159503844645, 'lambda_val': 0.0044430731520053324, 'batch_size': 1402, 'optimizer': 'Adam'}. Best is trial 112 with value: 0.13045097788925025.
2026-05-15 22:12:33,279 - experiment_functions - INFO - Early stopping at epoch 2350. Best Recall: 0.1284
2026-05-15 22:12:33,378 - optuna.study.study - INFO - Trial 188 finished with value: 0.12837134719595447 and parameters: {'n_layers': 1, 'embedding_dim': 256, 'lr': 0.0005031948384135636, 'lambda_val': 2.1219183386003573e-06, 'batch_size': 1219, 'optimizer': 'Adam'}. Best is trial 112 with value: 0.13045097788925025.
2026-05-15 22:12:37,246 - experiment_functions - INFO - Early stopping at epoch 500. Best Recall: 0.0045
2026-05-15 22:12:37,344 - optuna.study.study - INFO - Trial 189 finished with value: 0.004520776138975169 and parameters: {'n_layers': 1, 'embedding_dim': 256, 'lr': 0.0002422202005126199, 'lambda_val': 6.229430555216789e-06, 'batch_size': 1533, 'optimizer': 'SGD'}. Best is trial 112 with value: 0.13045097788925025.
2026-05-15 22:12:46,507 - optuna.study._optimize - INFO - Trial 190 pruned. 
2026-05-15 22:12:53,254 - optuna.study._optimize - INFO - Trial 191 pruned. 
2026-05-15 22:12:59,628 - optuna.study._optimize - INFO - Trial 192 pruned. 
2026-05-15 22:13:08,319 - experiment_functions - INFO - Early stopping at epoch 1450. Best Recall: 0.1235
2026-05-15 22:13:08,454 - optuna.study.study - INFO - Trial 193 finished with value: 0.1235428751694423 and parameters: {'n_layers': 1, 'embedding_dim': 256, 'lr': 0.0006868621304151043, 'lambda_val': 1.8356682292364705e-06, 'batch_size': 1123, 'optimizer': 'Adam'}. Best is trial 112 with value: 0.13045097788925025.
2026-05-15 22:13:25,988 - experiment_functions - INFO - Early stopping at epoch 1600. Best Recall: 0.1260
2026-05-15 22:13:26,077 - optuna.study.study - INFO - Trial 194 finished with value: 0.12596007308443857 and parameters: {'n_layers': 1, 'embedding_dim': 256, 'lr': 0.0007571685809800345, 'lambda_val': 0.00010754500675575747, 'batch_size': 1115, 'optimizer': 'Adam'}. Best is trial 112 with value: 0.13045097788925025.
2026-05-15 22:13:35,007 - experiment_functions - INFO - Early stopping at epoch 1300. Best Recall: 0.1163
2026-05-15 22:13:35,096 - optuna.study.study - INFO - Trial 195 finished with value: 0.11631422069158232 and parameters: {'n_layers': 1, 'embedding_dim': 256, 'lr': 0.0008396001797389634, 'lambda_val': 0.00015932997829597574, 'batch_size': 1058, 'optimizer': 'Adam'}. Best is trial 112 with value: 0.13045097788925025.
2026-05-15 22:13:48,914 - optuna.study._optimize - INFO - Trial 196 pruned. 
2026-05-15 22:13:55,763 - optuna.study._optimize - INFO - Trial 197 pruned. 
2026-05-15 22:14:10,596 - optuna.study._optimize - INFO - Trial 198 pruned. 
2026-05-15 22:14:17,610 - optuna.study._optimize - INFO - Trial 199 pruned. 
2026-05-15 22:14:26,504 - experiment_functions - INFO - Early stopping at epoch 1350. Best Recall: 0.1216
2026-05-15 22:14:26,591 - optuna.study.study - INFO - Trial 200 finished with value: 0.12159917741599606 and parameters: {'n_layers': 1, 'embedding_dim': 256, 'lr': 0.0007806042810530254, 'lambda_val': 2.9716487212064614e-06, 'batch_size': 890, 'optimizer': 'Adam'}. Best is trial 112 with value: 0.13045097788925025.
2026-05-15 22:14:43,248 - experiment_functions - INFO - Early stopping at epoch 2200. Best Recall: 0.1271
2026-05-15 22:14:43,340 - optuna.study.study - INFO - Trial 201 finished with value: 0.12713232056863663 and parameters: {'n_layers': 1, 'embedding_dim': 256, 'lr': 0.0007769442802737715, 'lambda_val': 3.1979307574526552e-06, 'batch_size': 784, 'optimizer': 'Adam'}. Best is trial 112 with value: 0.13045097788925025.
2026-05-15 22:14:49,525 - optuna.study._optimize - INFO - Trial 202 pruned. 
2026-05-15 22:14:56,164 - optuna.study._optimize - INFO - Trial 203 pruned. 
2026-05-15 22:15:18,237 - experiment_functions - INFO - Early stopping at epoch 1850. Best Recall: 0.1208
2026-05-15 22:15:18,330 - optuna.study.study - INFO - Trial 204 finished with value: 0.12079267411985353 and parameters: {'n_layers': 1, 'embedding_dim': 256, 'lr': 0.0004843010653309847, 'lambda_val': 3.664363158950712e-06, 'batch_size': 1785, 'optimizer': 'Adam'}. Best is trial 112 with value: 0.13045097788925025.
2026-05-15 22:15:24,647 - optuna.study._optimize - INFO - Trial 205 pruned. 
2026-05-15 22:15:35,610 - optuna.study._optimize - INFO - Trial 206 pruned. 
2026-05-15 22:15:42,446 - optuna.study._optimize - INFO - Trial 207 pruned. 
2026-05-15 22:15:50,612 - optuna.study._optimize - INFO - Trial 208 pruned. 
2026-05-15 22:15:56,400 - experiment_functions - INFO - Early stopping at epoch 850. Best Recall: 0.0683
2026-05-15 22:15:56,504 - optuna.study.study - INFO - Trial 209 finished with value: 0.06828627546474511 and parameters: {'n_layers': 1, 'embedding_dim': 256, 'lr': 0.0006731460087801805, 'lambda_val': 0.016553643651591312, 'batch_size': 1813, 'optimizer': 'Adam'}. Best is trial 112 with value: 0.13045097788925025.
2026-05-15 22:16:03,516 - optuna.study._optimize - INFO - Trial 210 pruned. 
2026-05-15 22:16:19,176 - optuna.study._optimize - INFO - Trial 211 pruned. 
2026-05-15 22:16:25,928 - optuna.study._optimize - INFO - Trial 212 pruned. 
2026-05-15 22:16:43,393 - optuna.study._optimize - INFO - Trial 213 pruned. 
2026-05-15 22:17:01,745 - experiment_functions - INFO - Early stopping at epoch 1850. Best Recall: 0.1213
2026-05-15 22:17:01,871 - optuna.study.study - INFO - Trial 214 finished with value: 0.12125687848628071 and parameters: {'n_layers': 1, 'embedding_dim': 256, 'lr': 0.0005047749537693742, 'lambda_val': 6.410022904999674e-05, 'batch_size': 1709, 'optimizer': 'Adam'}. Best is trial 112 with value: 0.13045097788925025.
2026-05-15 22:17:14,419 - optuna.study._optimize - INFO - Trial 215 pruned. 
2026-05-15 22:17:23,283 - experiment_functions - INFO - Early stopping at epoch 1250. Best Recall: 0.1177
2026-05-15 22:17:23,375 - optuna.study.study - INFO - Trial 216 finished with value: 0.11771193932528032 and parameters: {'n_layers': 1, 'embedding_dim': 256, 'lr': 0.0007007237311276721, 'lambda_val': 1.3297343921680187e-06, 'batch_size': 1786, 'optimizer': 'Adam'}. Best is trial 112 with value: 0.13045097788925025.
2026-05-15 22:17:29,986 - optuna.study._optimize - INFO - Trial 217 pruned. 
2026-05-15 22:17:37,438 - optuna.study._optimize - INFO - Trial 218 pruned. 
2026-05-15 22:17:45,115 - optuna.study._optimize - INFO - Trial 219 pruned. 
2026-05-15 22:18:10,122 - experiment_functions - INFO - Early stopping at epoch 2600. Best Recall: 0.1283
2026-05-15 22:18:10,215 - optuna.study.study - INFO - Trial 220 finished with value: 0.12834731562439447 and parameters: {'n_layers': 1, 'embedding_dim': 256, 'lr': 0.0005028359971046703, 'lambda_val': 1.0831543462428423e-06, 'batch_size': 1748, 'optimizer': 'Adam'}. Best is trial 112 with value: 0.13045097788925025.
2026-05-15 22:18:17,556 - optuna.study._optimize - INFO - Trial 221 pruned. 
2026-05-15 22:18:24,588 - optuna.study._optimize - INFO - Trial 222 pruned. 
2026-05-15 22:18:31,951 - optuna.study._optimize - INFO - Trial 223 pruned. 
2026-05-15 22:18:40,372 - experiment_functions - INFO - Early stopping at epoch 1300. Best Recall: 0.1162
2026-05-15 22:18:40,476 - optuna.study.study - INFO - Trial 224 finished with value: 0.1161954751256448 and parameters: {'n_layers': 1, 'embedding_dim': 256, 'lr': 0.0008055483727345899, 'lambda_val': 0.00024446336439618076, 'batch_size': 1602, 'optimizer': 'Adam'}. Best is trial 112 with value: 0.13045097788925025.
2026-05-15 22:18:47,374 - optuna.study._optimize - INFO - Trial 225 pruned. 
2026-05-15 22:19:03,541 - experiment_functions - INFO - Early stopping at epoch 1600. Best Recall: 0.1215
2026-05-15 22:19:04,305 - optuna.study.study - INFO - Trial 226 finished with value: 0.12149926462636752 and parameters: {'n_layers': 1, 'embedding_dim': 256, 'lr': 0.0004924078036377446, 'lambda_val': 1.85618923112361e-05, 'batch_size': 1737, 'optimizer': 'Adam'}. Best is trial 112 with value: 0.13045097788925025.
2026-05-15 22:19:19,739 - experiment_functions - INFO - Early stopping at epoch 1850. Best Recall: 0.1298
2026-05-15 22:19:20,375 - optuna.study.study - INFO - Trial 227 finished with value: 0.1297745255442593 and parameters: {'n_layers': 1, 'embedding_dim': 256, 'lr': 0.0004723408471641901, 'lambda_val': 3.2261685000462394e-05, 'batch_size': 1799, 'optimizer': 'Adam'}. Best is trial 112 with value: 0.13045097788925025.
2026-05-15 22:19:29,073 - optuna.study._optimize - INFO - Trial 228 pruned. 
2026-05-15 22:19:39,037 - optuna.study._optimize - INFO - Trial 229 pruned. 
2026-05-15 22:19:48,470 - optuna.study._optimize - INFO - Trial 230 pruned. 
2026-05-15 22:20:00,299 - experiment_functions - INFO - Early stopping at epoch 1600. Best Recall: 0.1272
2026-05-15 22:20:00,425 - optuna.study.study - INFO - Trial 231 finished with value: 0.12717584039754243 and parameters: {'n_layers': 1, 'embedding_dim': 256, 'lr': 0.0004670804395959157, 'lambda_val': 2.8698368401113505e-05, 'batch_size': 1807, 'optimizer': 'Adam'}. Best is trial 112 with value: 0.13045097788925025.
2026-05-15 22:20:07,321 - optuna.study._optimize - INFO - Trial 232 pruned. 
2026-05-15 22:20:16,123 - experiment_functions - INFO - Early stopping at epoch 1250. Best Recall: 0.1153
2026-05-15 22:20:16,492 - optuna.study.study - INFO - Trial 233 finished with value: 0.11529489665604845 and parameters: {'n_layers': 1, 'embedding_dim': 256, 'lr': 0.0006229835835591965, 'lambda_val': 4.199908135475303e-05, 'batch_size': 1986, 'optimizer': 'Adam'}. Best is trial 112 with value: 0.13045097788925025.
2026-05-15 22:20:20,144 - experiment_functions - INFO - Early stopping at epoch 500. Best Recall: 0.0021
2026-05-15 22:20:20,436 - optuna.study.study - INFO - Trial 234 finished with value: 0.002059468392241852 and parameters: {'n_layers': 1, 'embedding_dim': 256, 'lr': 0.0004915184352342199, 'lambda_val': 1.9197666854381803e-05, 'batch_size': 1747, 'optimizer': 'SGD'}. Best is trial 112 with value: 0.13045097788925025.
2026-05-15 22:20:36,893 - optuna.study._optimize - INFO - Trial 235 pruned. 
2026-05-15 22:20:43,770 - optuna.study._optimize - INFO - Trial 236 pruned. 
2026-05-15 22:20:51,259 - optuna.study._optimize - INFO - Trial 237 pruned. 
2026-05-15 22:21:03,334 - experiment_functions - INFO - Early stopping at epoch 1700. Best Recall: 0.1239
2026-05-15 22:21:03,426 - optuna.study.study - INFO - Trial 238 finished with value: 0.12387310338732185 and parameters: {'n_layers': 1, 'embedding_dim': 96, 'lr': 0.0007617561839602853, 'lambda_val': 1.6238453560208067e-05, 'batch_size': 1807, 'optimizer': 'Adam'}. Best is trial 112 with value: 0.13045097788925025.
2026-05-15 22:21:09,500 - optuna.study._optimize - INFO - Trial 239 pruned. 
2026-05-15 22:21:18,169 - optuna.study._optimize - INFO - Trial 240 pruned. 
2026-05-15 22:21:25,788 - optuna.study._optimize - INFO - Trial 241 pruned. 
2026-05-15 22:21:31,742 - optuna.study._optimize - INFO - Trial 242 pruned. 
2026-05-15 22:21:38,531 - optuna.study._optimize - INFO - Trial 243 pruned. 
2026-05-15 22:21:54,242 - optuna.study._optimize - INFO - Trial 244 pruned. 
2026-05-15 22:22:01,270 - optuna.study._optimize - INFO - Trial 245 pruned. 
2026-05-15 22:22:11,640 - experiment_functions - INFO - Early stopping at epoch 1700. Best Recall: 0.1254
2026-05-15 22:22:11,733 - optuna.study.study - INFO - Trial 246 finished with value: 0.1253542028400902 and parameters: {'n_layers': 1, 'embedding_dim': 256, 'lr': 0.00061682183223281, 'lambda_val': 2.681042987241552e-05, 'batch_size': 1813, 'optimizer': 'Adam'}. Best is trial 112 with value: 0.13045097788925025.
2026-05-15 22:22:19,862 - experiment_functions - INFO - Early stopping at epoch 900. Best Recall: 0.0547
2026-05-15 22:22:19,955 - optuna.study.study - INFO - Trial 247 finished with value: 0.05470691565187741 and parameters: {'n_layers': 3, 'embedding_dim': 256, 'lr': 0.0006221316447958467, 'lambda_val': 2.0240198199441362e-05, 'batch_size': 1806, 'optimizer': 'Adam'}. Best is trial 112 with value: 0.13045097788925025.
2026-05-15 22:22:26,648 - optuna.study._optimize - INFO - Trial 248 pruned. 
2026-05-15 22:22:34,826 - optuna.study._optimize - INFO - Trial 249 pruned. 
2026-05-15 22:22:41,212 - optuna.study._optimize - INFO - Trial 250 pruned. 
2026-05-15 22:22:47,562 - experiment_functions - INFO - Early stopping at epoch 1000. Best Recall: 0.1142
2026-05-15 22:22:47,656 - optuna.study.study - INFO - Trial 251 finished with value: 0.11417486891284603 and parameters: {'n_layers': 1, 'embedding_dim': 256, 'lr': 0.0009398916458553119, 'lambda_val': 3.438801544050123e-05, 'batch_size': 1539, 'optimizer': 'Adam'}. Best is trial 112 with value: 0.13045097788925025.
2026-05-15 22:23:04,721 - experiment_functions - INFO - Early stopping at epoch 2400. Best Recall: 0.1272
2026-05-15 22:23:04,842 - optuna.study.study - INFO - Trial 252 finished with value: 0.12719301098998534 and parameters: {'n_layers': 1, 'embedding_dim': 256, 'lr': 0.0004737390163459255, 'lambda_val': 1.8230295839020814e-06, 'batch_size': 1381, 'optimizer': 'Adam'}. Best is trial 112 with value: 0.13045097788925025.
2026-05-15 22:23:12,269 - optuna.study._optimize - INFO - Trial 253 pruned. 
2026-05-15 22:23:20,743 - experiment_functions - INFO - Early stopping at epoch 1150. Best Recall: 0.1192
2026-05-15 22:23:20,880 - optuna.study.study - INFO - Trial 254 finished with value: 0.11915765305386285 and parameters: {'n_layers': 1, 'embedding_dim': 256, 'lr': 0.0007278846513688297, 'lambda_val': 2.3663387707504648e-06, 'batch_size': 1422, 'optimizer': 'RMSprop'}. Best is trial 112 with value: 0.13045097788925025.
2026-05-15 22:23:41,673 - experiment_functions - INFO - Early stopping at epoch 1700. Best Recall: 0.1202
2026-05-15 22:23:41,798 - optuna.study.study - INFO - Trial 255 finished with value: 0.12019280514414954 and parameters: {'n_layers': 1, 'embedding_dim': 256, 'lr': 0.0005968526246801524, 'lambda_val': 1.3942564907690922e-06, 'batch_size': 921, 'optimizer': 'Adam'}. Best is trial 112 with value: 0.13045097788925025.
2026-05-15 22:23:46,750 - experiment_functions - INFO - Early stopping at epoch 550. Best Recall: 0.0341
2026-05-15 22:23:46,888 - optuna.study.study - INFO - Trial 256 finished with value: 0.03406034104878131 and parameters: {'n_layers': 1, 'embedding_dim': 32, 'lr': 0.04182042263414051, 'lambda_val': 1.9401367997425667e-06, 'batch_size': 1368, 'optimizer': 'Adam'}. Best is trial 112 with value: 0.13045097788925025.
2026-05-15 22:23:53,685 - experiment_functions - INFO - Early stopping at epoch 750. Best Recall: 0.0750
2026-05-15 22:23:53,835 - optuna.study.study - INFO - Trial 257 finished with value: 0.07499768922918498 and parameters: {'n_layers': 2, 'embedding_dim': 256, 'lr': 0.0009023771149804082, 'lambda_val': 2.7382397812042058e-06, 'batch_size': 634, 'optimizer': 'Adam'}. Best is trial 112 with value: 0.13045097788925025.
2026-05-15 22:24:01,118 - optuna.study._optimize - INFO - Trial 258 pruned. 
2026-05-15 22:24:07,697 - optuna.study._optimize - INFO - Trial 259 pruned. 
2026-05-15 22:24:20,174 - optuna.study._optimize - INFO - Trial 260 pruned. 
2026-05-15 22:24:24,751 - experiment_functions - INFO - Early stopping at epoch 500. Best Recall: 0.0007
2026-05-15 22:24:24,867 - optuna.study.study - INFO - Trial 261 finished with value: 0.0007375036769964305 and parameters: {'n_layers': 1, 'embedding_dim': 256, 'lr': 0.0010611657418581333, 'lambda_val': 1.2760524293620726e-06, 'batch_size': 834, 'optimizer': 'SGD'}. Best is trial 112 with value: 0.13045097788925025.
2026-05-15 22:24:33,453 - experiment_functions - INFO - Early stopping at epoch 1250. Best Recall: 0.1254
2026-05-15 22:24:33,547 - optuna.study.study - INFO - Trial 262 finished with value: 0.12535038491592101 and parameters: {'n_layers': 1, 'embedding_dim': 256, 'lr': 0.0006271334298498925, 'lambda_val': 1.7423994883348358e-06, 'batch_size': 2053, 'optimizer': 'Adam'}. Best is trial 112 with value: 0.13045097788925025.
2026-05-15 22:24:47,242 - optuna.study._optimize - INFO - Trial 263 pruned. 
2026-05-15 22:24:56,315 - optuna.study._optimize - INFO - Trial 264 pruned. 
2026-05-15 22:25:03,960 - optuna.study._optimize - INFO - Trial 265 pruned. 
2026-05-15 22:25:09,609 - experiment_functions - INFO - Early stopping at epoch 800. Best Recall: 0.1081
2026-05-15 22:25:09,745 - optuna.study.study - INFO - Trial 266 finished with value: 0.10813039418804098 and parameters: {'n_layers': 1, 'embedding_dim': 256, 'lr': 0.0012859562099565803, 'lambda_val': 1.0115530182147104e-06, 'batch_size': 1852, 'optimizer': 'Adam'}. Best is trial 112 with value: 0.13045097788925025.
2026-05-15 22:25:18,262 - experiment_functions - INFO - Early stopping at epoch 1100. Best Recall: 0.1184
2026-05-15 22:25:18,352 - optuna.study.study - INFO - Trial 267 finished with value: 0.11839636564832476 and parameters: {'n_layers': 1, 'embedding_dim': 256, 'lr': 0.00080507945966737, 'lambda_val': 1.4698149848102474e-06, 'batch_size': 1639, 'optimizer': 'Adam'}. Best is trial 112 with value: 0.13045097788925025.
2026-05-15 22:25:28,093 - experiment_functions - INFO - Early stopping at epoch 1600. Best Recall: 0.1282
2026-05-15 22:25:28,185 - optuna.study.study - INFO - Trial 268 finished with value: 0.12823558102816934 and parameters: {'n_layers': 1, 'embedding_dim': 256, 'lr': 0.0005522940062188873, 'lambda_val': 2.4104671421040072e-06, 'batch_size': 1550, 'optimizer': 'Adam'}. Best is trial 112 with value: 0.13045097788925025.
