2026-05-16 00:55:57,412 - optuna.study.study - INFO - Trial 158 finished with value: 0.01089978423338213 and parameters: {'n_layers': 1, 'embedding_dim': 32, 'lr': 0.013254328839422957, 'lambda_val': 0.00012918714316219643, 'batch_size': 663, 'optimizer': 'Adam'}. Best is trial 75 with value: 0.02482134338591816.
2026-05-16 00:56:01,255 - experiment_functions - INFO - Early stopping at epoch 550. Best Recall: 0.0178
2026-05-16 00:56:01,367 - optuna.study.study - INFO - Trial 159 finished with value: 0.01784621288485253 and parameters: {'n_layers': 1, 'embedding_dim': 64, 'lr': 0.0076080128708598035, 'lambda_val': 8.607511611430943e-05, 'batch_size': 843, 'optimizer': 'Adam'}. Best is trial 75 with value: 0.02482134338591816.
2026-05-16 00:56:05,445 - experiment_functions - INFO - Early stopping at epoch 550. Best Recall: 0.0170
2026-05-16 00:56:05,547 - optuna.study.study - INFO - Trial 160 finished with value: 0.016977830464663626 and parameters: {'n_layers': 1, 'embedding_dim': 64, 'lr': 0.00687946428586354, 'lambda_val': 7.303811172887172e-05, 'batch_size': 709, 'optimizer': 'Adam'}. Best is trial 75 with value: 0.02482134338591816.
2026-05-16 00:56:08,834 - experiment_functions - INFO - Early stopping at epoch 550. Best Recall: 0.0223
2026-05-16 00:56:08,927 - optuna.study.study - INFO - Trial 161 finished with value: 0.02227764545111654 and parameters: {'n_layers': 1, 'embedding_dim': 64, 'lr': 0.005191941228075868, 'lambda_val': 5.142222485218697e-05, 'batch_size': 618, 'optimizer': 'Adam'}. Best is trial 75 with value: 0.02482134338591816.
2026-05-16 00:56:12,280 - experiment_functions - INFO - Early stopping at epoch 550. Best Recall: 0.0174
2026-05-16 00:56:12,373 - optuna.study.study - INFO - Trial 162 finished with value: 0.017410907028195807 and parameters: {'n_layers': 1, 'embedding_dim': 64, 'lr': 0.004420111643912482, 'lambda_val': 5.4152370097751686e-05, 'batch_size': 637, 'optimizer': 'Adam'}. Best is trial 75 with value: 0.02482134338591816.
2026-05-16 00:56:15,782 - experiment_functions - INFO - Early stopping at epoch 550. Best Recall: 0.0131
2026-05-16 00:56:15,863 - optuna.study.study - INFO - Trial 163 finished with value: 0.013105379971200214 and parameters: {'n_layers': 1, 'embedding_dim': 64, 'lr': 0.008991414727577623, 'lambda_val': 0.00011005905763440961, 'batch_size': 780, 'optimizer': 'Adam'}. Best is trial 75 with value: 0.02482134338591816.
2026-05-16 00:56:19,759 - experiment_functions - INFO - Early stopping at epoch 550. Best Recall: 0.0198
2026-05-16 00:56:19,851 - optuna.study.study - INFO - Trial 164 finished with value: 0.01981056221929902 and parameters: {'n_layers': 1, 'embedding_dim': 64, 'lr': 0.006145924445799181, 'lambda_val': 4.963757417153826e-05, 'batch_size': 514, 'optimizer': 'Adam'}. Best is trial 75 with value: 0.02482134338591816.
2026-05-16 00:56:23,743 - experiment_functions - INFO - Early stopping at epoch 600. Best Recall: 0.0219
2026-05-16 00:56:23,843 - optuna.study.study - INFO - Trial 165 finished with value: 0.021866685716441504 and parameters: {'n_layers': 1, 'embedding_dim': 64, 'lr': 0.003666721282711606, 'lambda_val': 7.098691021836857e-05, 'batch_size': 613, 'optimizer': 'Adam'}. Best is trial 75 with value: 0.02482134338591816.
2026-05-16 00:56:28,426 - experiment_functions - INFO - Early stopping at epoch 550. Best Recall: 0.0215
2026-05-16 00:56:28,528 - optuna.study.study - INFO - Trial 166 finished with value: 0.021470993438736645 and parameters: {'n_layers': 1, 'embedding_dim': 64, 'lr': 0.003649513743331603, 'lambda_val': 6.410826011460373e-05, 'batch_size': 714, 'optimizer': 'Adam'}. Best is trial 75 with value: 0.02482134338591816.
2026-05-16 00:56:32,976 - experiment_functions - INFO - Early stopping at epoch 600. Best Recall: 0.0142
2026-05-16 00:56:33,100 - optuna.study.study - INFO - Trial 167 finished with value: 0.014233087891441733 and parameters: {'n_layers': 1, 'embedding_dim': 64, 'lr': 0.002994238417759916, 'lambda_val': 3.710187646044983e-05, 'batch_size': 944, 'optimizer': 'Adam'}. Best is trial 75 with value: 0.02482134338591816.
2026-05-16 00:56:40,273 - experiment_functions - INFO - Early stopping at epoch 550. Best Recall: 0.0195
2026-05-16 00:56:40,365 - optuna.study.study - INFO - Trial 168 finished with value: 0.0194705964021527 and parameters: {'n_layers': 1, 'embedding_dim': 64, 'lr': 0.003817957070495331, 'lambda_val': 5.837510102708555e-05, 'batch_size': 749, 'optimizer': 'Adam'}. Best is trial 75 with value: 0.02482134338591816.
2026-05-16 00:56:43,987 - experiment_functions - INFO - Early stopping at epoch 600. Best Recall: 0.0120
2026-05-16 00:56:44,090 - optuna.study.study - INFO - Trial 169 finished with value: 0.011957686020559542 and parameters: {'n_layers': 1, 'embedding_dim': 64, 'lr': 0.0035191849787165742, 'lambda_val': 9.741198926263274e-05, 'batch_size': 837, 'optimizer': 'Adam'}. Best is trial 75 with value: 0.02482134338591816.
2026-05-16 00:56:47,516 - experiment_functions - INFO - Early stopping at epoch 550. Best Recall: 0.0177
2026-05-16 00:56:47,586 - optuna.study.study - INFO - Trial 170 finished with value: 0.017747823968120496 and parameters: {'n_layers': 1, 'embedding_dim': 64, 'lr': 0.004733449412661436, 'lambda_val': 4.74497210405552e-05, 'batch_size': 699, 'optimizer': 'Adam'}. Best is trial 75 with value: 0.02482134338591816.
2026-05-16 00:56:51,020 - experiment_functions - INFO - Early stopping at epoch 550. Best Recall: 0.0185
2026-05-16 00:56:51,121 - optuna.study.study - INFO - Trial 171 finished with value: 0.018451471398449323 and parameters: {'n_layers': 1, 'embedding_dim': 64, 'lr': 0.005979229710240221, 'lambda_val': 7.350845557947196e-05, 'batch_size': 619, 'optimizer': 'Adam'}. Best is trial 75 with value: 0.02482134338591816.
2026-05-16 00:56:55,083 - experiment_functions - INFO - Early stopping at epoch 550. Best Recall: 0.0150
2026-05-16 00:56:55,234 - optuna.study.study - INFO - Trial 172 finished with value: 0.014970958487311364 and parameters: {'n_layers': 1, 'embedding_dim': 64, 'lr': 0.007042563072406778, 'lambda_val': 7.025075520515452e-05, 'batch_size': 632, 'optimizer': 'Adam'}. Best is trial 75 with value: 0.02482134338591816.
2026-05-16 00:56:59,511 - experiment_functions - INFO - Early stopping at epoch 550. Best Recall: 0.0203
2026-05-16 00:56:59,612 - optuna.study.study - INFO - Trial 173 finished with value: 0.02028266795931079 and parameters: {'n_layers': 1, 'embedding_dim': 64, 'lr': 0.00526096210077422, 'lambda_val': 3.465876001023115e-05, 'batch_size': 719, 'optimizer': 'Adam'}. Best is trial 75 with value: 0.02482134338591816.
2026-05-16 00:57:05,763 - experiment_functions - INFO - Early stopping at epoch 550. Best Recall: 0.0175
2026-05-16 00:57:05,920 - optuna.study.study - INFO - Trial 174 finished with value: 0.017543071871063423 and parameters: {'n_layers': 1, 'embedding_dim': 64, 'lr': 0.010156953639927033, 'lambda_val': 8.615994796101429e-05, 'batch_size': 573, 'optimizer': 'Adam'}. Best is trial 75 with value: 0.02482134338591816.
2026-05-16 00:57:09,810 - experiment_functions - INFO - Early stopping at epoch 600. Best Recall: 0.0215
2026-05-16 00:57:09,913 - optuna.study.study - INFO - Trial 175 finished with value: 0.021538564256766778 and parameters: {'n_layers': 1, 'embedding_dim': 64, 'lr': 0.002658069882980478, 'lambda_val': 0.0001453194627248599, 'batch_size': 805, 'optimizer': 'Adam'}. Best is trial 75 with value: 0.02482134338591816.
2026-05-16 00:57:13,508 - experiment_functions - INFO - Early stopping at epoch 600. Best Recall: 0.0143
2026-05-16 00:57:13,643 - optuna.study.study - INFO - Trial 176 finished with value: 0.014339804507657445 and parameters: {'n_layers': 1, 'embedding_dim': 64, 'lr': 0.003088234085304239, 'lambda_val': 0.00012722213808582524, 'batch_size': 869, 'optimizer': 'Adam'}. Best is trial 75 with value: 0.02482134338591816.
2026-05-16 00:57:16,831 - experiment_functions - INFO - Early stopping at epoch 550. Best Recall: 0.0166
2026-05-16 00:57:16,933 - optuna.study.study - INFO - Trial 177 finished with value: 0.016553541852006592 and parameters: {'n_layers': 1, 'embedding_dim': 32, 'lr': 0.004076750342109064, 'lambda_val': 0.00017786990117537368, 'batch_size': 1045, 'optimizer': 'Adam'}. Best is trial 75 with value: 0.02482134338591816.
2026-05-16 00:57:21,006 - experiment_functions - INFO - Early stopping at epoch 550. Best Recall: 0.0123
2026-05-16 00:57:21,108 - optuna.study.study - INFO - Trial 178 finished with value: 0.012316965607555491 and parameters: {'n_layers': 1, 'embedding_dim': 64, 'lr': 0.0025552862589566776, 'lambda_val': 2.619286607306419e-05, 'batch_size': 4081, 'optimizer': 'Adam'}. Best is trial 75 with value: 0.02482134338591816.
2026-05-16 00:57:24,970 - experiment_functions - INFO - Early stopping at epoch 600. Best Recall: 0.0191
2026-05-16 00:57:25,061 - optuna.study.study - INFO - Trial 179 finished with value: 0.019105203007924395 and parameters: {'n_layers': 1, 'embedding_dim': 96, 'lr': 0.0022902587239517235, 'lambda_val': 0.00014393115966895376, 'batch_size': 801, 'optimizer': 'Adam'}. Best is trial 75 with value: 0.02482134338591816.
2026-05-16 00:57:30,528 - optuna.study._optimize - INFO - Trial 180 pruned. 
2026-05-16 00:57:34,224 - experiment_functions - INFO - Early stopping at epoch 550. Best Recall: 0.0167
2026-05-16 00:57:34,326 - optuna.study.study - INFO - Trial 181 finished with value: 0.01674200708636039 and parameters: {'n_layers': 1, 'embedding_dim': 64, 'lr': 0.006137533913173305, 'lambda_val': 6.609561640695786e-05, 'batch_size': 672, 'optimizer': 'Adam'}. Best is trial 75 with value: 0.02482134338591816.
2026-05-16 00:57:38,342 - experiment_functions - INFO - Early stopping at epoch 550. Best Recall: 0.0186
2026-05-16 00:57:38,443 - optuna.study.study - INFO - Trial 182 finished with value: 0.018644762828833303 and parameters: {'n_layers': 1, 'embedding_dim': 64, 'lr': 0.004929136935783157, 'lambda_val': 0.00010985459891526379, 'batch_size': 595, 'optimizer': 'Adam'}. Best is trial 75 with value: 0.02482134338591816.
2026-05-16 00:57:44,730 - experiment_functions - INFO - Early stopping at epoch 550. Best Recall: 0.0183
2026-05-16 00:57:44,833 - optuna.study.study - INFO - Trial 183 finished with value: 0.018312356167089063 and parameters: {'n_layers': 1, 'embedding_dim': 64, 'lr': 0.003948085867978683, 'lambda_val': 8.864047898252074e-05, 'batch_size': 655, 'optimizer': 'Adam'}. Best is trial 75 with value: 0.02482134338591816.
2026-05-16 00:57:48,200 - experiment_functions - INFO - Early stopping at epoch 550. Best Recall: 0.0162
2026-05-16 00:57:48,281 - optuna.study.study - INFO - Trial 184 finished with value: 0.01615917353863841 and parameters: {'n_layers': 1, 'embedding_dim': 64, 'lr': 0.005562717000283235, 'lambda_val': 4.345940768697915e-05, 'batch_size': 762, 'optimizer': 'Adam'}. Best is trial 75 with value: 0.02482134338591816.
2026-05-16 00:57:51,801 - experiment_functions - INFO - Early stopping at epoch 550. Best Recall: 0.0185
2026-05-16 00:57:51,892 - optuna.study.study - INFO - Trial 185 finished with value: 0.01851668243108879 and parameters: {'n_layers': 1, 'embedding_dim': 64, 'lr': 0.006866323239362558, 'lambda_val': 5.252752185864386e-05, 'batch_size': 580, 'optimizer': 'Adam'}. Best is trial 75 with value: 0.02482134338591816.
2026-05-16 00:57:54,995 - experiment_functions - INFO - Early stopping at epoch 500. Best Recall: 0.0017
2026-05-16 00:57:55,108 - optuna.study.study - INFO - Trial 186 finished with value: 0.001712548629315983 and parameters: {'n_layers': 1, 'embedding_dim': 64, 'lr': 0.004513566475708256, 'lambda_val': 2.1334077804503786e-05, 'batch_size': 689, 'optimizer': 'SGD'}. Best is trial 75 with value: 0.02482134338591816.
2026-05-16 00:57:59,017 - experiment_functions - INFO - Early stopping at epoch 550. Best Recall: 0.0140
2026-05-16 00:57:59,109 - optuna.study.study - INFO - Trial 187 finished with value: 0.013961104619361689 and parameters: {'n_layers': 1, 'embedding_dim': 128, 'lr': 0.008481351182077941, 'lambda_val': 7.437822809516175e-05, 'batch_size': 814, 'optimizer': 'Adam'}. Best is trial 75 with value: 0.02482134338591816.
2026-05-16 00:58:02,742 - experiment_functions - INFO - Early stopping at epoch 600. Best Recall: 0.0182
2026-05-16 00:58:02,834 - optuna.study.study - INFO - Trial 188 finished with value: 0.018168803725169557 and parameters: {'n_layers': 1, 'embedding_dim': 64, 'lr': 0.003180519369375571, 'lambda_val': 0.0002191882928864147, 'batch_size': 569, 'optimizer': 'Adam'}. Best is trial 75 with value: 0.02482134338591816.
2026-05-16 00:58:06,119 - experiment_functions - INFO - Early stopping at epoch 500. Best Recall: 0.0019
2026-05-16 00:58:06,210 - optuna.study.study - INFO - Trial 189 finished with value: 0.0018571273796849403 and parameters: {'n_layers': 1, 'embedding_dim': 32, 'lr': 3.265498461385537e-05, 'lambda_val': 3.477155821325138e-05, 'batch_size': 898, 'optimizer': 'Adam'}. Best is trial 75 with value: 0.02482134338591816.
2026-05-16 00:58:09,708 - experiment_functions - INFO - Early stopping at epoch 550. Best Recall: 0.0154
2026-05-16 00:58:09,801 - optuna.study.study - INFO - Trial 190 finished with value: 0.015380884762884017 and parameters: {'n_layers': 1, 'embedding_dim': 64, 'lr': 0.006439029824932719, 'lambda_val': 0.00010336310694518783, 'batch_size': 632, 'optimizer': 'Adam'}. Best is trial 75 with value: 0.02482134338591816.
2026-05-16 00:58:15,462 - experiment_functions - INFO - Early stopping at epoch 550. Best Recall: 0.0218
2026-05-16 00:58:15,562 - optuna.study.study - INFO - Trial 191 finished with value: 0.02177687984847525 and parameters: {'n_layers': 1, 'embedding_dim': 256, 'lr': 0.004183120601302445, 'lambda_val': 6.273367212040695e-05, 'batch_size': 564, 'optimizer': 'Adam'}. Best is trial 75 with value: 0.02482134338591816.
2026-05-16 00:58:19,336 - experiment_functions - INFO - Early stopping at epoch 550. Best Recall: 0.0159
2026-05-16 00:58:19,438 - optuna.study.study - INFO - Trial 192 finished with value: 0.01588250215429591 and parameters: {'n_layers': 1, 'embedding_dim': 256, 'lr': 0.003940980615477705, 'lambda_val': 6.266675935610099e-05, 'batch_size': 512, 'optimizer': 'Adam'}. Best is trial 75 with value: 0.02482134338591816.
2026-05-16 00:58:23,222 - experiment_functions - INFO - Early stopping at epoch 550. Best Recall: 0.0177
2026-05-16 00:58:23,324 - optuna.study.study - INFO - Trial 193 finished with value: 0.017650418588414287 and parameters: {'n_layers': 1, 'embedding_dim': 256, 'lr': 0.005631068314132883, 'lambda_val': 4.3926944939164065e-05, 'batch_size': 704, 'optimizer': 'Adam'}. Best is trial 75 with value: 0.02482134338591816.
2026-05-16 00:58:27,128 - experiment_functions - INFO - Early stopping at epoch 550. Best Recall: 0.0033
2026-05-16 00:58:27,251 - optuna.study.study - INFO - Trial 194 finished with value: 0.003346276505928875 and parameters: {'n_layers': 1, 'embedding_dim': 256, 'lr': 0.0035368886347397666, 'lambda_val': 0.05397218987558736, 'batch_size': 622, 'optimizer': 'Adam'}. Best is trial 75 with value: 0.02482134338591816.
2026-05-16 00:58:31,390 - experiment_functions - INFO - Early stopping at epoch 550. Best Recall: 0.0146
2026-05-16 00:58:31,483 - optuna.study.study - INFO - Trial 195 finished with value: 0.014621589899785414 and parameters: {'n_layers': 1, 'embedding_dim': 64, 'lr': 0.0077898094199468915, 'lambda_val': 8.01361957063599e-05, 'batch_size': 777, 'optimizer': 'Adam'}. Best is trial 75 with value: 0.02482134338591816.
2026-05-16 00:58:34,826 - experiment_functions - INFO - Early stopping at epoch 550. Best Recall: 0.0208
2026-05-16 00:58:34,918 - optuna.study.study - INFO - Trial 196 finished with value: 0.020781265472418275 and parameters: {'n_layers': 1, 'embedding_dim': 64, 'lr': 0.004612912313117963, 'lambda_val': 2.9561821722122773e-05, 'batch_size': 575, 'optimizer': 'Adam'}. Best is trial 75 with value: 0.02482134338591816.
2026-05-16 00:58:39,216 - experiment_functions - INFO - Early stopping at epoch 550. Best Recall: 0.0128
2026-05-16 00:58:39,318 - optuna.study.study - INFO - Trial 197 finished with value: 0.012759376284830587 and parameters: {'n_layers': 3, 'embedding_dim': 256, 'lr': 0.002758434278625797, 'lambda_val': 2.9371226638873484e-05, 'batch_size': 579, 'optimizer': 'Adam'}. Best is trial 75 with value: 0.02482134338591816.
2026-05-16 00:58:43,519 - experiment_functions - INFO - Early stopping at epoch 600. Best Recall: 0.0174
2026-05-16 00:58:43,600 - optuna.study.study - INFO - Trial 198 finished with value: 0.017394066106133393 and parameters: {'n_layers': 1, 'embedding_dim': 32, 'lr': 0.0047470773151651185, 'lambda_val': 1.7604302014409415e-05, 'batch_size': 515, 'optimizer': 'Adam'}. Best is trial 75 with value: 0.02482134338591816.
2026-05-16 00:58:47,589 - experiment_functions - INFO - Early stopping at epoch 550. Best Recall: 0.0138
2026-05-16 00:58:47,691 - optuna.study.study - INFO - Trial 199 finished with value: 0.013797695635750817 and parameters: {'n_layers': 1, 'embedding_dim': 64, 'lr': 0.004489636541676968, 'lambda_val': 4.146666337787248e-05, 'batch_size': 710, 'optimizer': 'Adam'}. Best is trial 75 with value: 0.02482134338591816.
2026-05-16 00:58:52,373 - experiment_functions - INFO - Early stopping at epoch 550. Best Recall: 0.0178
2026-05-16 00:58:53,281 - optuna.study.study - INFO - Trial 200 finished with value: 0.017838868658584483 and parameters: {'n_layers': 1, 'embedding_dim': 128, 'lr': 0.003338769029895159, 'lambda_val': 2.377275253074123e-05, 'batch_size': 654, 'optimizer': 'Adam'}. Best is trial 75 with value: 0.02482134338591816.
2026-05-16 00:58:56,633 - experiment_functions - INFO - Early stopping at epoch 550. Best Recall: 0.0175
2026-05-16 00:58:56,725 - optuna.study.study - INFO - Trial 201 finished with value: 0.017511091322183148 and parameters: {'n_layers': 1, 'embedding_dim': 64, 'lr': 0.005219587826816802, 'lambda_val': 5.695906698117145e-05, 'batch_size': 637, 'optimizer': 'Adam'}. Best is trial 75 with value: 0.02482134338591816.
2026-05-16 00:59:00,356 - experiment_functions - INFO - Early stopping at epoch 550. Best Recall: 0.0204
2026-05-16 00:59:00,447 - optuna.study.study - INFO - Trial 202 finished with value: 0.02035338796065713 and parameters: {'n_layers': 1, 'embedding_dim': 64, 'lr': 0.006718995269553036, 'lambda_val': 3.383307616077827e-05, 'batch_size': 585, 'optimizer': 'Adam'}. Best is trial 75 with value: 0.02482134338591816.
2026-05-16 00:59:04,451 - experiment_functions - INFO - Early stopping at epoch 550. Best Recall: 0.0183
2026-05-16 00:59:04,554 - optuna.study.study - INFO - Trial 203 finished with value: 0.018305313425613166 and parameters: {'n_layers': 1, 'embedding_dim': 64, 'lr': 0.010461432979646084, 'lambda_val': 4.998007617593934e-05, 'batch_size': 727, 'optimizer': 'Adam'}. Best is trial 75 with value: 0.02482134338591816.
2026-05-16 00:59:10,360 - optuna.study._optimize - INFO - Trial 204 pruned. 
2026-05-16 00:59:13,966 - experiment_functions - INFO - Early stopping at epoch 550. Best Recall: 0.0149
2026-05-16 00:59:14,089 - optuna.study.study - INFO - Trial 205 finished with value: 0.014879834305889579 and parameters: {'n_layers': 1, 'embedding_dim': 64, 'lr': 0.00561152367982715, 'lambda_val': 8.443982729613443e-05, 'batch_size': 655, 'optimizer': 'Adam'}. Best is trial 75 with value: 0.02482134338591816.
2026-05-16 00:59:18,319 - experiment_functions - INFO - Early stopping at epoch 550. Best Recall: 0.0147
2026-05-16 00:59:18,410 - optuna.study.study - INFO - Trial 206 finished with value: 0.014673352489774293 and parameters: {'n_layers': 1, 'embedding_dim': 64, 'lr': 0.003954095402299673, 'lambda_val': 0.00012313518069502583, 'batch_size': 2146, 'optimizer': 'Adam'}. Best is trial 75 with value: 0.02482134338591816.
2026-05-16 00:59:21,971 - experiment_functions - INFO - Early stopping at epoch 550. Best Recall: 0.0159
2026-05-16 00:59:22,063 - optuna.study.study - INFO - Trial 207 finished with value: 0.015948309215346606 and parameters: {'n_layers': 1, 'embedding_dim': 256, 'lr': 0.008597135838052659, 'lambda_val': 3.999805572340793e-05, 'batch_size': 556, 'optimizer': 'Adam'}. Best is trial 75 with value: 0.02482134338591816.
2026-05-16 00:59:25,448 - experiment_functions - INFO - Early stopping at epoch 550. Best Recall: 0.0184
2026-05-16 00:59:25,550 - optuna.study.study - INFO - Trial 208 finished with value: 0.018376418676395084 and parameters: {'n_layers': 1, 'embedding_dim': 64, 'lr': 0.006698544641917867, 'lambda_val': 2.977774742305982e-05, 'batch_size': 728, 'optimizer': 'Adam'}. Best is trial 75 with value: 0.02482134338591816.
2026-05-16 00:59:29,022 - experiment_functions - INFO - Early stopping at epoch 550. Best Recall: 0.0195
2026-05-16 00:59:29,124 - optuna.study.study - INFO - Trial 209 finished with value: 0.019545189196088532 and parameters: {'n_layers': 1, 'embedding_dim': 64, 'lr': 0.005134793086357692, 'lambda_val': 5.805414538677648e-05, 'batch_size': 649, 'optimizer': 'Adam'}. Best is trial 75 with value: 0.02482134338591816.
2026-05-16 00:59:32,744 - experiment_functions - INFO - Early stopping at epoch 550. Best Recall: 0.0237
2026-05-16 00:59:32,835 - optuna.study.study - INFO - Trial 210 finished with value: 0.023716281903572382 and parameters: {'n_layers': 1, 'embedding_dim': 64, 'lr': 0.004364931620139968, 'lambda_val': 9.601811582454909e-05, 'batch_size': 853, 'optimizer': 'Adam'}. Best is trial 75 with value: 0.02482134338591816.
2026-05-16 00:59:36,316 - experiment_functions - INFO - Early stopping at epoch 550. Best Recall: 0.0203
