2026-05-16 10:09:20,360 - optuna.study.study - INFO - Trial 123 finished with value: 0.12339693204160714 and parameters: {'n_layers': 1, 'embedding_dim': 256, 'lr': 0.0008321082014691672, 'lambda_val': 6.654309137819182e-06, 'batch_size': 1076, 'optimizer': 'Adam'}. Best is trial 115 with value: 0.13538651527349915.
2026-05-16 10:09:28,798 - optuna.study._optimize - INFO - Trial 124 pruned. 
2026-05-16 10:09:39,777 - experiment_functions - INFO - Early stopping at epoch 1600. Best Recall: 0.1202
2026-05-16 10:09:39,880 - optuna.study.study - INFO - Trial 125 finished with value: 0.12019919438603259 and parameters: {'n_layers': 1, 'embedding_dim': 256, 'lr': 0.0007533193603562523, 'lambda_val': 1.2862384141057834e-05, 'batch_size': 777, 'optimizer': 'Adam'}. Best is trial 115 with value: 0.13538651527349915.
2026-05-16 10:09:45,971 - optuna.study._optimize - INFO - Trial 126 pruned. 
2026-05-16 10:09:56,667 - optuna.study._optimize - INFO - Trial 127 pruned. 
2026-05-16 10:10:09,147 - experiment_functions - INFO - Early stopping at epoch 900. Best Recall: 0.0951
2026-05-16 10:10:09,262 - optuna.study.study - INFO - Trial 128 finished with value: 0.09509417390783877 and parameters: {'n_layers': 1, 'embedding_dim': 256, 'lr': 0.0006033318295470809, 'lambda_val': 0.001562200153861084, 'batch_size': 3869, 'optimizer': 'Adam'}. Best is trial 115 with value: 0.13538651527349915.
2026-05-16 10:10:13,239 - experiment_functions - INFO - Early stopping at epoch 500. Best Recall: 0.0023
2026-05-16 10:10:13,333 - optuna.study.study - INFO - Trial 129 finished with value: 0.002304853245481418 and parameters: {'n_layers': 1, 'embedding_dim': 256, 'lr': 0.0012357934402863094, 'lambda_val': 4.065174042269755e-06, 'batch_size': 1006, 'optimizer': 'SGD'}. Best is trial 115 with value: 0.13538651527349915.
2026-05-16 10:10:21,861 - optuna.study._optimize - INFO - Trial 130 pruned. 
2026-05-16 10:10:28,791 - optuna.study._optimize - INFO - Trial 131 pruned. 
2026-05-16 10:10:41,691 - experiment_functions - INFO - Early stopping at epoch 1900. Best Recall: 0.1290
2026-05-16 10:10:41,806 - optuna.study.study - INFO - Trial 132 finished with value: 0.12900667033965524 and parameters: {'n_layers': 1, 'embedding_dim': 256, 'lr': 0.0006566897767248228, 'lambda_val': 5.586137034484301e-06, 'batch_size': 1276, 'optimizer': 'Adam'}. Best is trial 115 with value: 0.13538651527349915.
2026-05-16 10:10:48,791 - optuna.study._optimize - INFO - Trial 133 pruned. 
2026-05-16 10:10:53,209 - experiment_functions - INFO - Early stopping at epoch 650. Best Recall: 0.0030
2026-05-16 10:10:53,380 - optuna.study.study - INFO - Trial 134 finished with value: 0.0029979901503483404 and parameters: {'n_layers': 1, 'embedding_dim': 256, 'lr': 1.4622304332202325e-05, 'lambda_val': 8.873156239175526e-06, 'batch_size': 893, 'optimizer': 'Adam'}. Best is trial 115 with value: 0.13538651527349915.
2026-05-16 10:11:00,621 - optuna.study._optimize - INFO - Trial 135 pruned. 
2026-05-16 10:11:11,969 - experiment_functions - INFO - Early stopping at epoch 1750. Best Recall: 0.1267
2026-05-16 10:11:12,094 - optuna.study.study - INFO - Trial 136 finished with value: 0.12665015178100544 and parameters: {'n_layers': 1, 'embedding_dim': 256, 'lr': 0.000605528361619999, 'lambda_val': 4.4251021644955905e-06, 'batch_size': 1094, 'optimizer': 'Adam'}. Best is trial 115 with value: 0.13538651527349915.
2026-05-16 10:11:21,093 - optuna.study._optimize - INFO - Trial 137 pruned. 
2026-05-16 10:11:26,970 - optuna.study._optimize - INFO - Trial 138 pruned. 
2026-05-16 10:11:31,384 - experiment_functions - INFO - Early stopping at epoch 600. Best Recall: 0.0548
2026-05-16 10:11:31,535 - optuna.study.study - INFO - Trial 139 finished with value: 0.05476862172805071 and parameters: {'n_layers': 1, 'embedding_dim': 256, 'lr': 0.015306903310926285, 'lambda_val': 2.0551341107174694e-06, 'batch_size': 1145, 'optimizer': 'Adam'}. Best is trial 115 with value: 0.13538651527349915.
2026-05-16 10:11:38,102 - optuna.study._optimize - INFO - Trial 140 pruned. 
2026-05-16 10:11:54,027 - experiment_functions - INFO - Early stopping at epoch 2250. Best Recall: 0.1261
2026-05-16 10:11:54,181 - optuna.study.study - INFO - Trial 141 finished with value: 0.12609370590181573 and parameters: {'n_layers': 1, 'embedding_dim': 256, 'lr': 0.0006611843341560418, 'lambda_val': 1.0791809650256667e-05, 'batch_size': 746, 'optimizer': 'Adam'}. Best is trial 115 with value: 0.13538651527349915.
2026-05-16 10:12:01,555 - optuna.study._optimize - INFO - Trial 142 pruned. 
2026-05-16 10:12:08,465 - optuna.study._optimize - INFO - Trial 143 pruned. 
2026-05-16 10:12:21,754 - optuna.study._optimize - INFO - Trial 144 pruned. 
2026-05-16 10:12:29,128 - optuna.study._optimize - INFO - Trial 145 pruned. 
2026-05-16 10:12:37,117 - optuna.study._optimize - INFO - Trial 146 pruned. 
2026-05-16 10:12:46,143 - optuna.study._optimize - INFO - Trial 147 pruned. 
2026-05-16 10:12:59,951 - experiment_functions - INFO - Early stopping at epoch 1800. Best Recall: 0.1277
2026-05-16 10:13:00,052 - optuna.study.study - INFO - Trial 148 finished with value: 0.12772532613944784 and parameters: {'n_layers': 1, 'embedding_dim': 256, 'lr': 0.0007091443304139981, 'lambda_val': 6.0431126276851946e-06, 'batch_size': 920, 'optimizer': 'Adam'}. Best is trial 115 with value: 0.13538651527349915.
2026-05-16 10:13:08,276 - experiment_functions - INFO - Early stopping at epoch 1100. Best Recall: 0.1204
2026-05-16 10:13:08,901 - optuna.study.study - INFO - Trial 149 finished with value: 0.12042928985924592 and parameters: {'n_layers': 1, 'embedding_dim': 256, 'lr': 0.001356642565632862, 'lambda_val': 0.0004511280801889803, 'batch_size': 925, 'optimizer': 'Adam'}. Best is trial 115 with value: 0.13538651527349915.
2026-05-16 10:13:12,613 - experiment_functions - INFO - Early stopping at epoch 500. Best Recall: 0.0029
2026-05-16 10:13:12,707 - optuna.study.study - INFO - Trial 150 finished with value: 0.002882043542092703 and parameters: {'n_layers': 1, 'embedding_dim': 256, 'lr': 0.0009599828877778651, 'lambda_val': 6.160505244064498e-06, 'batch_size': 1240, 'optimizer': 'SGD'}. Best is trial 115 with value: 0.13538651527349915.
2026-05-16 10:13:22,636 - optuna.study._optimize - INFO - Trial 151 pruned. 
2026-05-16 10:13:33,639 - experiment_functions - INFO - Early stopping at epoch 1550. Best Recall: 0.1221
2026-05-16 10:13:33,739 - optuna.study.study - INFO - Trial 152 finished with value: 0.12214467790195899 and parameters: {'n_layers': 1, 'embedding_dim': 256, 'lr': 0.0007450602940419713, 'lambda_val': 1.178727882454074e-05, 'batch_size': 766, 'optimizer': 'Adam'}. Best is trial 115 with value: 0.13538651527349915.
2026-05-16 10:13:42,979 - optuna.study._optimize - INFO - Trial 153 pruned. 
2026-05-16 10:13:51,016 - optuna.study._optimize - INFO - Trial 154 pruned. 
2026-05-16 10:13:59,954 - optuna.study._optimize - INFO - Trial 155 pruned. 
2026-05-16 10:14:09,591 - optuna.study._optimize - INFO - Trial 156 pruned. 
2026-05-16 10:14:15,536 - optuna.study._optimize - INFO - Trial 157 pruned. 
2026-05-16 10:14:24,073 - optuna.study._optimize - INFO - Trial 158 pruned. 
2026-05-16 10:14:31,757 - optuna.study._optimize - INFO - Trial 159 pruned. 
2026-05-16 10:14:38,529 - experiment_functions - INFO - Early stopping at epoch 950. Best Recall: 0.1120
2026-05-16 10:14:38,856 - optuna.study.study - INFO - Trial 160 finished with value: 0.1119678864523021 and parameters: {'n_layers': 1, 'embedding_dim': 256, 'lr': 0.0016549313237282615, 'lambda_val': 4.718431012685216e-06, 'batch_size': 904, 'optimizer': 'Adam'}. Best is trial 115 with value: 0.13538651527349915.
2026-05-16 10:14:54,551 - experiment_functions - INFO - Early stopping at epoch 1950. Best Recall: 0.1289
2026-05-16 10:14:54,653 - optuna.study.study - INFO - Trial 161 finished with value: 0.128933464471684 and parameters: {'n_layers': 1, 'embedding_dim': 256, 'lr': 0.0006656158339789149, 'lambda_val': 1.0123004667861334e-05, 'batch_size': 769, 'optimizer': 'Adam'}. Best is trial 115 with value: 0.13538651527349915.
2026-05-16 10:15:04,773 - optuna.study._optimize - INFO - Trial 162 pruned. 
2026-05-16 10:15:12,325 - optuna.study._optimize - INFO - Trial 163 pruned. 
2026-05-16 10:15:19,538 - optuna.study._optimize - INFO - Trial 164 pruned. 
2026-05-16 10:15:28,446 - optuna.study._optimize - INFO - Trial 165 pruned. 
2026-05-16 10:15:36,954 - optuna.study._optimize - INFO - Trial 166 pruned. 
2026-05-16 10:15:49,111 - optuna.study._optimize - INFO - Trial 167 pruned. 
2026-05-16 10:15:58,404 - experiment_functions - INFO - Early stopping at epoch 1100. Best Recall: 0.1223
2026-05-16 10:15:58,496 - optuna.study.study - INFO - Trial 168 finished with value: 0.12230111413807698 and parameters: {'n_layers': 1, 'embedding_dim': 256, 'lr': 0.0011944065912314152, 'lambda_val': 3.585864247427987e-06, 'batch_size': 901, 'optimizer': 'Adam'}. Best is trial 115 with value: 0.13538651527349915.
2026-05-16 10:16:05,848 - optuna.study._optimize - INFO - Trial 169 pruned. 
2026-05-16 10:16:13,506 - optuna.study._optimize - INFO - Trial 170 pruned. 
2026-05-16 10:16:23,316 - optuna.study._optimize - INFO - Trial 171 pruned. 
2026-05-16 10:16:31,480 - optuna.study._optimize - INFO - Trial 172 pruned. 
2026-05-16 10:16:39,084 - optuna.study._optimize - INFO - Trial 173 pruned. 
2026-05-16 10:16:53,802 - optuna.study._optimize - INFO - Trial 174 pruned. 
2026-05-16 10:17:04,550 - experiment_functions - INFO - Early stopping at epoch 1300. Best Recall: 0.1228
2026-05-16 10:17:04,695 - optuna.study.study - INFO - Trial 175 finished with value: 0.12282656265625344 and parameters: {'n_layers': 1, 'embedding_dim': 256, 'lr': 0.0009060073513311372, 'lambda_val': 8.11814790476007e-06, 'batch_size': 865, 'optimizer': 'Adam'}. Best is trial 115 with value: 0.13538651527349915.
2026-05-16 10:17:14,865 - optuna.study._optimize - INFO - Trial 176 pruned. 
2026-05-16 10:17:32,789 - experiment_functions - INFO - Early stopping at epoch 2300. Best Recall: 0.1294
2026-05-16 10:17:32,892 - optuna.study.study - INFO - Trial 177 finished with value: 0.12938531156400995 and parameters: {'n_layers': 1, 'embedding_dim': 96, 'lr': 0.0006994950648833798, 'lambda_val': 5.597321147216623e-06, 'batch_size': 951, 'optimizer': 'Adam'}. Best is trial 115 with value: 0.13538651527349915.
2026-05-16 10:17:42,481 - optuna.study._optimize - INFO - Trial 178 pruned. 
2026-05-16 10:17:48,093 - experiment_functions - INFO - Early stopping at epoch 500. Best Recall: 0.0030
2026-05-16 10:17:48,208 - optuna.study.study - INFO - Trial 179 finished with value: 0.003035575684868532 and parameters: {'n_layers': 1, 'embedding_dim': 96, 'lr': 0.001052314198701543, 'lambda_val': 4.044099939101985e-06, 'batch_size': 1069, 'optimizer': 'SGD'}. Best is trial 115 with value: 0.13538651527349915.
2026-05-16 10:18:05,271 - experiment_functions - INFO - Early stopping at epoch 2100. Best Recall: 0.1270
2026-05-16 10:18:05,415 - optuna.study.study - INFO - Trial 180 finished with value: 0.1270344637785346 and parameters: {'n_layers': 1, 'embedding_dim': 96, 'lr': 0.0007680353962571771, 'lambda_val': 5.3710236679683445e-06, 'batch_size': 1193, 'optimizer': 'Adam'}. Best is trial 115 with value: 0.13538651527349915.
2026-05-16 10:18:13,444 - optuna.study._optimize - INFO - Trial 181 pruned. 
2026-05-16 10:18:20,565 - optuna.study._optimize - INFO - Trial 182 pruned. 
2026-05-16 10:18:27,176 - optuna.study._optimize - INFO - Trial 183 pruned. 
2026-05-16 10:18:36,051 - optuna.study._optimize - INFO - Trial 184 pruned. 
2026-05-16 10:18:44,101 - optuna.study._optimize - INFO - Trial 185 pruned. 
2026-05-16 10:18:56,089 - experiment_functions - INFO - Early stopping at epoch 1650. Best Recall: 0.1241
2026-05-16 10:18:56,285 - optuna.study.study - INFO - Trial 186 finished with value: 0.12412748204681387 and parameters: {'n_layers': 1, 'embedding_dim': 96, 'lr': 0.0009588285275107033, 'lambda_val': 5.4641991088565535e-06, 'batch_size': 1105, 'optimizer': 'Adam'}. Best is trial 115 with value: 0.13538651527349915.
2026-05-16 10:19:02,997 - optuna.study._optimize - INFO - Trial 187 pruned. 
2026-05-16 10:19:11,858 - optuna.study._optimize - INFO - Trial 188 pruned. 
2026-05-16 10:19:19,447 - optuna.study._optimize - INFO - Trial 189 pruned. 
2026-05-16 10:19:28,939 - optuna.study._optimize - INFO - Trial 190 pruned. 
2026-05-16 10:19:37,438 - optuna.study._optimize - INFO - Trial 191 pruned. 
2026-05-16 10:19:58,117 - experiment_functions - INFO - Early stopping at epoch 2400. Best Recall: 0.1335
2026-05-16 10:19:58,286 - optuna.study.study - INFO - Trial 192 finished with value: 0.13353832482815076 and parameters: {'n_layers': 1, 'embedding_dim': 256, 'lr': 0.0006499710074919149, 'lambda_val': 5.173466194883995e-06, 'batch_size': 634, 'optimizer': 'Adam'}. Best is trial 115 with value: 0.13538651527349915.
2026-05-16 10:20:06,555 - optuna.study._optimize - INFO - Trial 193 pruned. 
2026-05-16 10:20:13,848 - optuna.study._optimize - INFO - Trial 194 pruned. 
2026-05-16 10:20:24,307 - experiment_functions - INFO - Early stopping at epoch 1200. Best Recall: 0.1234
2026-05-16 10:20:24,655 - optuna.study.study - INFO - Trial 195 finished with value: 0.12336748838016327 and parameters: {'n_layers': 1, 'embedding_dim': 256, 'lr': 0.0006419713123844028, 'lambda_val': 4.438600278112715e-06, 'batch_size': 1906, 'optimizer': 'Adam'}. Best is trial 115 with value: 0.13538651527349915.
2026-05-16 10:20:32,528 - optuna.study._optimize - INFO - Trial 196 pruned. 
2026-05-16 10:20:41,134 - optuna.study._optimize - INFO - Trial 197 pruned. 
2026-05-16 10:20:51,195 - optuna.study._optimize - INFO - Trial 198 pruned. 
2026-05-16 10:20:59,461 - experiment_functions - INFO - Early stopping at epoch 750. Best Recall: 0.0478
2026-05-16 10:20:59,565 - optuna.study.study - INFO - Trial 199 finished with value: 0.04777628903110349 and parameters: {'n_layers': 4, 'embedding_dim': 256, 'lr': 0.0005402137920220473, 'lambda_val': 0.0002534933998253661, 'batch_size': 801, 'optimizer': 'Adam'}. Best is trial 115 with value: 0.13538651527349915.
2026-05-16 10:21:08,393 - optuna.study._optimize - INFO - Trial 200 pruned. 
2026-05-16 10:21:17,204 - optuna.study._optimize - INFO - Trial 201 pruned. 
2026-05-16 10:21:28,807 - optuna.study._optimize - INFO - Trial 202 pruned. 
2026-05-16 10:21:38,098 - optuna.study._optimize - INFO - Trial 203 pruned. 
2026-05-16 10:21:47,659 - optuna.study._optimize - INFO - Trial 204 pruned. 
2026-05-16 10:22:03,574 - optuna.study._optimize - INFO - Trial 205 pruned. 
2026-05-16 10:22:13,491 - optuna.study._optimize - INFO - Trial 206 pruned. 
2026-05-16 10:22:25,104 - optuna.study._optimize - INFO - Trial 207 pruned. 
2026-05-16 10:22:30,039 - experiment_functions - INFO - Early stopping at epoch 500. Best Recall: 0.0032
2026-05-16 10:22:30,209 - optuna.study.study - INFO - Trial 208 finished with value: 0.003195054027602126 and parameters: {'n_layers': 1, 'embedding_dim': 256, 'lr': 0.0007324749530574836, 'lambda_val': 5.764060216616615e-06, 'batch_size': 1115, 'optimizer': 'SGD'}. Best is trial 115 with value: 0.13538651527349915.
2026-05-16 10:22:40,103 - experiment_functions - INFO - Early stopping at epoch 600. Best Recall: 0.0239
2026-05-16 10:22:40,968 - optuna.study.study - INFO - Trial 209 finished with value: 0.02387940153171681 and parameters: {'n_layers': 1, 'embedding_dim': 96, 'lr': 0.06162872394437224, 'lambda_val': 1.0745649601747808e-05, 'batch_size': 663, 'optimizer': 'Adam'}. Best is trial 115 with value: 0.13538651527349915.
2026-05-16 10:22:50,732 - optuna.study._optimize - INFO - Trial 210 pruned. 
2026-05-16 10:23:00,843 - experiment_functions - INFO - Early stopping at epoch 1050. Best Recall: 0.1195
2026-05-16 10:23:00,946 - optuna.study.study - INFO - Trial 211 finished with value: 0.11951763350501467 and parameters: {'n_layers': 1, 'embedding_dim': 256, 'lr': 0.0007395192414324387, 'lambda_val': 3.937619624305025e-06, 'batch_size': 1418, 'optimizer': 'Adam'}. Best is trial 115 with value: 0.13538651527349915.
2026-05-16 10:23:08,814 - optuna.study._optimize - INFO - Trial 212 pruned. 
2026-05-16 10:23:16,387 - experiment_functions - INFO - Early stopping at epoch 1200. Best Recall: 0.1250
2026-05-16 10:23:16,477 - optuna.study.study - INFO - Trial 213 finished with value: 0.12502657150629942 and parameters: {'n_layers': 1, 'embedding_dim': 256, 'lr': 0.0009558175906543118, 'lambda_val': 5.9756286983780636e-06, 'batch_size': 1533, 'optimizer': 'Adam'}. Best is trial 115 with value: 0.13538651527349915.
2026-05-16 10:23:34,851 - experiment_functions - INFO - Early stopping at epoch 1600. Best Recall: 0.1270
2026-05-16 10:23:34,963 - optuna.study.study - INFO - Trial 214 finished with value: 0.12703109541563548 and parameters: {'n_layers': 1, 'embedding_dim': 256, 'lr': 0.0006725686391865035, 'lambda_val': 2.0737693227200795e-06, 'batch_size': 1457, 'optimizer': 'Adam'}. Best is trial 115 with value: 0.13538651527349915.
2026-05-16 10:23:43,491 - optuna.study._optimize - INFO - Trial 215 pruned. 
2026-05-16 10:23:53,903 - experiment_functions - INFO - Early stopping at epoch 1600. Best Recall: 0.1305
2026-05-16 10:23:54,216 - optuna.study.study - INFO - Trial 216 finished with value: 0.13045127381838137 and parameters: {'n_layers': 1, 'embedding_dim': 256, 'lr': 0.0006394438810113172, 'lambda_val': 2.2422292046888533e-06, 'batch_size': 1024, 'optimizer': 'Adam'}. Best is trial 115 with value: 0.13538651527349915.
2026-05-16 10:24:02,370 - optuna.study._optimize - INFO - Trial 217 pruned. 
2026-05-16 10:24:09,390 - experiment_functions - INFO - Early stopping at epoch 800. Best Recall: 0.0630
2026-05-16 10:24:09,502 - optuna.study.study - INFO - Trial 218 finished with value: 0.06302148333765618 and parameters: {'n_layers': 3, 'embedding_dim': 256, 'lr': 0.0006345751614579837, 'lambda_val': 2.312299145538361e-06, 'batch_size': 1209, 'optimizer': 'Adam'}. Best is trial 115 with value: 0.13538651527349915.
2026-05-16 10:24:17,015 - experiment_functions - INFO - Early stopping at epoch 1150. Best Recall: 0.1209
2026-05-16 10:24:17,169 - optuna.study.study - INFO - Trial 219 finished with value: 0.12085122810262207 and parameters: {'n_layers': 1, 'embedding_dim': 96, 'lr': 0.00127960534831032, 'lambda_val': 2.095373112028897e-06, 'batch_size': 962, 'optimizer': 'Adam'}. Best is trial 115 with value: 0.13538651527349915.
2026-05-16 10:24:34,804 - experiment_functions - INFO - Early stopping at epoch 2900. Best Recall: 0.1351
2026-05-16 10:24:34,903 - optuna.study.study - INFO - Trial 220 finished with value: 0.13512506084739206 and parameters: {'n_layers': 1, 'embedding_dim': 256, 'lr': 0.00047783655881984775, 'lambda_val': 1.4696446136765075e-06, 'batch_size': 1288, 'optimizer': 'Adam'}. Best is trial 115 with value: 0.13538651527349915.
2026-05-16 10:24:41,767 - optuna.study._optimize - INFO - Trial 221 pruned. 
2026-05-16 10:24:54,121 - experiment_functions - INFO - Early stopping at epoch 1950. Best Recall: 0.1269
2026-05-16 10:24:54,211 - optuna.study.study - INFO - Trial 222 finished with value: 0.12688098830010822 and parameters: {'n_layers': 1, 'embedding_dim': 256, 'lr': 0.0005906345578557405, 'lambda_val': 1.1558667773897492e-06, 'batch_size': 1284, 'optimizer': 'Adam'}. Best is trial 115 with value: 0.13538651527349915.
2026-05-16 10:25:04,749 - optuna.study._optimize - INFO - Trial 223 pruned. 
2026-05-16 10:25:15,807 - experiment_functions - INFO - Early stopping at epoch 1800. Best Recall: 0.1267
2026-05-16 10:25:15,907 - optuna.study.study - INFO - Trial 224 finished with value: 0.12671762841989437 and parameters: {'n_layers': 1, 'embedding_dim': 256, 'lr': 0.0005621675396529221, 'lambda_val': 1.5099656782174568e-06, 'batch_size': 1345, 'optimizer': 'Adam'}. Best is trial 115 with value: 0.13538651527349915.
2026-05-16 10:25:22,905 - optuna.study._optimize - INFO - Trial 225 pruned. 
2026-05-16 10:25:30,469 - optuna.study._optimize - INFO - Trial 226 pruned. 
2026-05-16 10:25:36,404 - optuna.study._optimize - INFO - Trial 227 pruned. 
2026-05-16 10:25:48,068 - experiment_functions - INFO - Early stopping at epoch 1850. Best Recall: 0.1259
2026-05-16 10:25:48,168 - optuna.study.study - INFO - Trial 228 finished with value: 0.12594373968523984 and parameters: {'n_layers': 1, 'embedding_dim': 256, 'lr': 0.0005718052033704834, 'lambda_val': 1.9422228064811975e-06, 'batch_size': 1256, 'optimizer': 'Adam'}. Best is trial 115 with value: 0.13538651527349915.
2026-05-16 10:25:54,705 - optuna.study._optimize - INFO - Trial 229 pruned. 
2026-05-16 10:26:01,119 - optuna.study._optimize - INFO - Trial 230 pruned. 
2026-05-16 10:26:10,280 - experiment_functions - INFO - Early stopping at epoch 1450. Best Recall: 0.1240
2026-05-16 10:26:10,392 - optuna.study.study - INFO - Trial 231 finished with value: 0.12397844035559175 and parameters: {'n_layers': 1, 'embedding_dim': 256, 'lr': 0.0006398177157498172, 'lambda_val': 2.5888362886641556e-06, 'batch_size': 1559, 'optimizer': 'Adam'}. Best is trial 115 with value: 0.13538651527349915.
2026-05-16 10:26:17,593 - optuna.study._optimize - INFO - Trial 232 pruned. 
2026-05-16 10:26:24,731 - optuna.study._optimize - INFO - Trial 233 pruned. 
2026-05-16 10:26:32,583 - experiment_functions - INFO - Early stopping at epoch 1250. Best Recall: 0.1224
2026-05-16 10:26:32,694 - optuna.study.study - INFO - Trial 234 finished with value: 0.1223901983663611 and parameters: {'n_layers': 1, 'embedding_dim': 256, 'lr': 0.0006848618471431389, 'lambda_val': 1.2262118836876762e-06, 'batch_size': 1237, 'optimizer': 'Adam'}. Best is trial 115 with value: 0.13538651527349915.
2026-05-16 10:26:39,376 - optuna.study._optimize - INFO - Trial 235 pruned. 
2026-05-16 10:26:47,996 - experiment_functions - INFO - Early stopping at epoch 1650. Best Recall: 0.1254
