2026-05-16 04:40:06,310 - optuna.study.study - INFO - Trial 291 finished with value: 0.12418256687898936 and parameters: {'n_layers': 1, 'embedding_dim': 256, 'lr': 0.0005099352842917971, 'lambda_val': 0.00019093568839224738, 'batch_size': 2378, 'optimizer': 'Adam'}. Best is trial 232 with value: 0.13586757760358253.
2026-05-16 04:40:14,720 - experiment_functions - INFO - Early stopping at epoch 1250. Best Recall: 0.1247
2026-05-16 04:40:14,813 - optuna.study.study - INFO - Trial 292 finished with value: 0.12465549264277252 and parameters: {'n_layers': 1, 'embedding_dim': 256, 'lr': 0.0005498286933875475, 'lambda_val': 0.0002144670624368601, 'batch_size': 3556, 'optimizer': 'Adam'}. Best is trial 232 with value: 0.13586757760358253.
2026-05-16 04:40:21,848 - experiment_functions - INFO - Early stopping at epoch 750. Best Recall: 0.1159
2026-05-16 04:40:21,942 - optuna.study.study - INFO - Trial 293 finished with value: 0.11593714137620802 and parameters: {'n_layers': 1, 'embedding_dim': 256, 'lr': 0.0011390202200310933, 'lambda_val': 0.000244235235040242, 'batch_size': 3676, 'optimizer': 'Adam'}. Best is trial 232 with value: 0.13586757760358253.
2026-05-16 04:40:28,799 - experiment_functions - INFO - Early stopping at epoch 950. Best Recall: 0.1111
2026-05-16 04:40:28,902 - optuna.study.study - INFO - Trial 294 finished with value: 0.11107220862090925 and parameters: {'n_layers': 1, 'embedding_dim': 256, 'lr': 0.0008723308855147496, 'lambda_val': 0.00020337595589403287, 'batch_size': 3342, 'optimizer': 'Adam'}. Best is trial 232 with value: 0.13586757760358253.
2026-05-16 04:40:37,056 - experiment_functions - INFO - Early stopping at epoch 1200. Best Recall: 0.1167
2026-05-16 04:40:37,148 - optuna.study.study - INFO - Trial 295 finished with value: 0.1166808272535417 and parameters: {'n_layers': 1, 'embedding_dim': 256, 'lr': 0.000562590779326018, 'lambda_val': 0.0002662850384978356, 'batch_size': 3453, 'optimizer': 'Adam'}. Best is trial 232 with value: 0.13586757760358253.
2026-05-16 04:40:43,488 - optuna.study._optimize - INFO - Trial 296 pruned. 
2026-05-16 04:40:52,851 - optuna.study._optimize - INFO - Trial 297 pruned. 
2026-05-16 04:41:04,267 - optuna.study._optimize - INFO - Trial 298 pruned. 
2026-05-16 04:41:14,024 - optuna.study._optimize - INFO - Trial 299 pruned. 
2026-05-16 04:41:20,059 - experiment_functions - INFO - Early stopping at epoch 1600. Best Recall: 0.1228
2026-05-16 04:41:20,171 - root - INFO -   **** Training e_100K_1c2dcs_rand5
2026-05-16 04:41:20,184 - root - INFO -   **** Getting 67885/81200 random edges
2026-05-16 04:41:20,304 - optuna.storages._rdb.storage - INFO - A new study created in RDB with name: Study_e_100K_1c2dcs_rand5
2026-05-16 04:41:24,667 - experiment_functions - INFO - Early stopping at epoch 650. Best Recall: 0.0324
2026-05-16 04:41:24,764 - optuna.study.study - INFO - Trial 0 finished with value: 0.03240207714284265 and parameters: {'n_layers': 3, 'embedding_dim': 64, 'lr': 0.0010770979110445852, 'lambda_val': 0.008273937618507247, 'batch_size': 2190, 'optimizer': 'RMSprop'}. Best is trial 0 with value: 0.03240207714284265.
2026-05-16 04:41:29,386 - experiment_functions - INFO - Early stopping at epoch 550. Best Recall: 0.0757
2026-05-16 04:41:29,494 - optuna.study.study - INFO - Trial 1 finished with value: 0.0757197455902926 and parameters: {'n_layers': 2, 'embedding_dim': 128, 'lr': 0.004102887461251083, 'lambda_val': 2.221737801190177e-05, 'batch_size': 1471, 'optimizer': 'Adam'}. Best is trial 1 with value: 0.0757197455902926.
2026-05-16 04:41:34,006 - experiment_functions - INFO - Early stopping at epoch 500. Best Recall: 0.0011
2026-05-16 04:41:34,143 - optuna.study.study - INFO - Trial 2 finished with value: 0.0011391587486249467 and parameters: {'n_layers': 3, 'embedding_dim': 256, 'lr': 0.00014606442355954868, 'lambda_val': 0.009144786945694174, 'batch_size': 3773, 'optimizer': 'SGD'}. Best is trial 1 with value: 0.0757197455902926.
2026-05-16 04:41:52,305 - experiment_functions - INFO - Early stopping at epoch 3150. Best Recall: 0.0724
2026-05-16 04:41:52,409 - optuna.study.study - INFO - Trial 3 finished with value: 0.07235352085740492 and parameters: {'n_layers': 1, 'embedding_dim': 96, 'lr': 0.0435286760151248, 'lambda_val': 0.0016006512246779787, 'batch_size': 1966, 'optimizer': 'RMSprop'}. Best is trial 1 with value: 0.0757197455902926.
2026-05-16 04:42:03,518 - experiment_functions - INFO - Early stopping at epoch 1800. Best Recall: 0.0371
2026-05-16 04:42:03,666 - optuna.study.study - INFO - Trial 4 finished with value: 0.03709454676737325 and parameters: {'n_layers': 2, 'embedding_dim': 96, 'lr': 0.03450284125331959, 'lambda_val': 0.00036476891059868886, 'batch_size': 3308, 'optimizer': 'RMSprop'}. Best is trial 1 with value: 0.0757197455902926.
2026-05-16 04:42:18,556 - optuna.study._optimize - INFO - Trial 5 pruned. 
2026-05-16 04:42:22,566 - experiment_functions - INFO - Early stopping at epoch 500. Best Recall: 0.0055
2026-05-16 04:42:22,647 - optuna.study.study - INFO - Trial 6 finished with value: 0.0055327349374862615 and parameters: {'n_layers': 2, 'embedding_dim': 96, 'lr': 0.002553533300670295, 'lambda_val': 0.0015823729976212478, 'batch_size': 2988, 'optimizer': 'SGD'}. Best is trial 1 with value: 0.0757197455902926.
2026-05-16 04:42:27,197 - experiment_functions - INFO - Early stopping at epoch 500. Best Recall: 0.0023
2026-05-16 04:42:27,302 - optuna.study.study - INFO - Trial 7 finished with value: 0.002309779606395551 and parameters: {'n_layers': 3, 'embedding_dim': 256, 'lr': 7.652349685993931e-05, 'lambda_val': 0.06579800785308768, 'batch_size': 2351, 'optimizer': 'Adam'}. Best is trial 1 with value: 0.0757197455902926.
2026-05-16 04:42:31,988 - experiment_functions - INFO - Early stopping at epoch 650. Best Recall: 0.0593
2026-05-16 04:42:32,125 - optuna.study.study - INFO - Trial 8 finished with value: 0.059265924625232856 and parameters: {'n_layers': 2, 'embedding_dim': 96, 'lr': 0.0009998666055443977, 'lambda_val': 0.000550191628046839, 'batch_size': 1882, 'optimizer': 'RMSprop'}. Best is trial 1 with value: 0.0757197455902926.
2026-05-16 04:42:50,955 - experiment_functions - INFO - Early stopping at epoch 2100. Best Recall: 0.1105
2026-05-16 04:42:51,027 - optuna.study.study - INFO - Trial 9 finished with value: 0.11054567300890619 and parameters: {'n_layers': 1, 'embedding_dim': 96, 'lr': 0.0005319509481717587, 'lambda_val': 1.431336934846891e-06, 'batch_size': 2207, 'optimizer': 'Adam'}. Best is trial 9 with value: 0.11054567300890619.
2026-05-16 04:42:54,622 - experiment_functions - INFO - Early stopping at epoch 500. Best Recall: 0.0027
2026-05-16 04:42:54,724 - optuna.study.study - INFO - Trial 10 finished with value: 0.0026728248763604207 and parameters: {'n_layers': 4, 'embedding_dim': 64, 'lr': 1.4879855109591074e-05, 'lambda_val': 1.6432247169906492e-06, 'batch_size': 568, 'optimizer': 'Adam'}. Best is trial 9 with value: 0.11054567300890619.
2026-05-16 04:42:58,860 - experiment_functions - INFO - Early stopping at epoch 650. Best Recall: 0.0896
2026-05-16 04:42:59,007 - optuna.study.study - INFO - Trial 11 finished with value: 0.0895945793629256 and parameters: {'n_layers': 1, 'embedding_dim': 128, 'lr': 0.004735035276464085, 'lambda_val': 3.3522780556203536e-06, 'batch_size': 1293, 'optimizer': 'Adam'}. Best is trial 9 with value: 0.11054567300890619.
2026-05-16 04:43:20,664 - optuna.study._optimize - INFO - Trial 12 pruned. 
2026-05-16 04:43:24,708 - experiment_functions - INFO - Early stopping at epoch 550. Best Recall: 0.0785
2026-05-16 04:43:24,801 - optuna.study.study - INFO - Trial 13 finished with value: 0.07847031779001729 and parameters: {'n_layers': 1, 'embedding_dim': 128, 'lr': 0.007697470596723073, 'lambda_val': 1.9287903016597286e-05, 'batch_size': 854, 'optimizer': 'Adam'}. Best is trial 9 with value: 0.11054567300890619.
2026-05-16 04:43:36,389 - experiment_functions - INFO - Early stopping at epoch 2050. Best Recall: 0.1290
2026-05-16 04:43:36,482 - optuna.study.study - INFO - Trial 14 finished with value: 0.129008592794559 and parameters: {'n_layers': 1, 'embedding_dim': 128, 'lr': 0.0006418097799838462, 'lambda_val': 1.9880857407223514e-05, 'batch_size': 1607, 'optimizer': 'Adam'}. Best is trial 14 with value: 0.129008592794559.
2026-05-16 04:43:39,643 - experiment_functions - INFO - Early stopping at epoch 500. Best Recall: 0.0021
2026-05-16 04:43:39,735 - optuna.study.study - INFO - Trial 15 finished with value: 0.002129146131931564 and parameters: {'n_layers': 1, 'embedding_dim': 32, 'lr': 0.0004143324576275433, 'lambda_val': 2.48656677411584e-05, 'batch_size': 1713, 'optimizer': 'SGD'}. Best is trial 14 with value: 0.129008592794559.
2026-05-16 04:43:52,040 - optuna.study._optimize - INFO - Trial 16 pruned. 
2026-05-16 04:43:58,134 - optuna.study._optimize - INFO - Trial 17 pruned. 
2026-05-16 04:44:05,260 - experiment_functions - INFO - Early stopping at epoch 1200. Best Recall: 0.1112
2026-05-16 04:44:05,363 - optuna.study.study - INFO - Trial 18 finished with value: 0.11124296375532225 and parameters: {'n_layers': 1, 'embedding_dim': 96, 'lr': 0.0009930957749565545, 'lambda_val': 9.523329067934392e-05, 'batch_size': 1050, 'optimizer': 'Adam'}. Best is trial 14 with value: 0.129008592794559.
2026-05-16 04:44:09,323 - experiment_functions - INFO - Early stopping at epoch 500. Best Recall: 0.0014
2026-05-16 04:44:09,481 - optuna.study.study - INFO - Trial 19 finished with value: 0.0014437869860349686 and parameters: {'n_layers': 2, 'embedding_dim': 32, 'lr': 0.001674978055131641, 'lambda_val': 0.00013088624665634705, 'batch_size': 920, 'optimizer': 'SGD'}. Best is trial 14 with value: 0.129008592794559.
2026-05-16 04:44:13,325 - experiment_functions - INFO - Early stopping at epoch 550. Best Recall: 0.0791
2026-05-16 04:44:13,427 - optuna.study.study - INFO - Trial 20 finished with value: 0.07912820103153369 and parameters: {'n_layers': 1, 'embedding_dim': 64, 'lr': 0.01521633117423018, 'lambda_val': 9.129635450750191e-05, 'batch_size': 1586, 'optimizer': 'Adam'}. Best is trial 14 with value: 0.129008592794559.
2026-05-16 04:44:24,079 - optuna.study._optimize - INFO - Trial 21 pruned. 
2026-05-16 04:44:40,495 - experiment_functions - INFO - Early stopping at epoch 2500. Best Recall: 0.1318
2026-05-16 04:44:40,599 - optuna.study.study - INFO - Trial 22 finished with value: 0.13176558549288317 and parameters: {'n_layers': 1, 'embedding_dim': 96, 'lr': 0.0007902672615654459, 'lambda_val': 6.088315619750865e-06, 'batch_size': 573, 'optimizer': 'Adam'}. Best is trial 22 with value: 0.13176558549288317.
2026-05-16 04:45:05,598 - experiment_functions - INFO - Early stopping at epoch 2750. Best Recall: 0.1255
2026-05-16 04:45:05,677 - optuna.study.study - INFO - Trial 23 finished with value: 0.12553876626046787 and parameters: {'n_layers': 1, 'embedding_dim': 96, 'lr': 0.0009428007917218293, 'lambda_val': 4.106011531016469e-05, 'batch_size': 522, 'optimizer': 'Adam'}. Best is trial 22 with value: 0.13176558549288317.
2026-05-16 04:45:12,274 - optuna.study._optimize - INFO - Trial 24 pruned. 
2026-05-16 04:45:18,864 - optuna.study._optimize - INFO - Trial 25 pruned. 
2026-05-16 04:45:29,559 - experiment_functions - INFO - Early stopping at epoch 600. Best Recall: 0.0699
2026-05-16 04:45:29,650 - optuna.study.study - INFO - Trial 26 finished with value: 0.06989393589141323 and parameters: {'n_layers': 2, 'embedding_dim': 96, 'lr': 0.0022671490899258935, 'lambda_val': 4.766959283685729e-06, 'batch_size': 527, 'optimizer': 'Adam'}. Best is trial 22 with value: 0.13176558549288317.
2026-05-16 04:45:40,668 - experiment_functions - INFO - Early stopping at epoch 2000. Best Recall: 0.1229
2026-05-16 04:45:40,780 - optuna.study.study - INFO - Trial 27 finished with value: 0.1228894647636789 and parameters: {'n_layers': 1, 'embedding_dim': 96, 'lr': 0.0006745418141285982, 'lambda_val': 0.00020392586072688065, 'batch_size': 1240, 'optimizer': 'Adam'}. Best is trial 22 with value: 0.13176558549288317.
2026-05-16 04:45:48,562 - optuna.study._optimize - INFO - Trial 28 pruned. 
2026-05-16 04:45:52,546 - experiment_functions - INFO - Early stopping at epoch 500. Best Recall: 0.0031
2026-05-16 04:45:52,671 - optuna.study.study - INFO - Trial 29 finished with value: 0.003089078522857643 and parameters: {'n_layers': 1, 'embedding_dim': 64, 'lr': 3.75225689058194e-05, 'lambda_val': 2.8321198924561053e-06, 'batch_size': 4073, 'optimizer': 'SGD'}. Best is trial 22 with value: 0.13176558549288317.
2026-05-16 04:46:03,655 - experiment_functions - INFO - Early stopping at epoch 750. Best Recall: 0.0116
2026-05-16 04:46:03,748 - optuna.study.study - INFO - Trial 30 finished with value: 0.011553796835781604 and parameters: {'n_layers': 2, 'embedding_dim': 32, 'lr': 0.09391711376091774, 'lambda_val': 1.2109074422620231e-05, 'batch_size': 850, 'optimizer': 'RMSprop'}. Best is trial 22 with value: 0.13176558549288317.
2026-05-16 04:46:10,828 - optuna.study._optimize - INFO - Trial 31 pruned. 
2026-05-16 04:46:17,174 - experiment_functions - INFO - Early stopping at epoch 950. Best Recall: 0.1097
2026-05-16 04:46:17,267 - optuna.study.study - INFO - Trial 32 finished with value: 0.10973028986071254 and parameters: {'n_layers': 1, 'embedding_dim': 96, 'lr': 0.0015448791824963894, 'lambda_val': 0.00020297034627237592, 'batch_size': 1803, 'optimizer': 'Adam'}. Best is trial 22 with value: 0.13176558549288317.
2026-05-16 04:46:26,399 - experiment_functions - INFO - Early stopping at epoch 1400. Best Recall: 0.1204
2026-05-16 04:46:26,478 - optuna.study.study - INFO - Trial 33 finished with value: 0.12043176328814728 and parameters: {'n_layers': 1, 'embedding_dim': 96, 'lr': 0.0006783521548634549, 'lambda_val': 4.607643298108777e-05, 'batch_size': 1479, 'optimizer': 'Adam'}. Best is trial 22 with value: 0.13176558549288317.
2026-05-16 04:46:33,380 - experiment_functions - INFO - Early stopping at epoch 600. Best Recall: 0.0945
2026-05-16 04:46:33,459 - optuna.study.study - INFO - Trial 34 finished with value: 0.09453922875016332 and parameters: {'n_layers': 1, 'embedding_dim': 256, 'lr': 0.0033210367813753436, 'lambda_val': 1.5924544762609492e-05, 'batch_size': 809, 'optimizer': 'Adam'}. Best is trial 22 with value: 0.13176558549288317.
2026-05-16 04:46:40,000 - optuna.study._optimize - INFO - Trial 35 pruned. 
2026-05-16 04:46:46,305 - experiment_functions - INFO - Early stopping at epoch 800. Best Recall: 0.0713
2026-05-16 04:46:46,397 - optuna.study.study - INFO - Trial 36 finished with value: 0.07128513491914865 and parameters: {'n_layers': 2, 'embedding_dim': 96, 'lr': 0.0010939500402413836, 'lambda_val': 0.00042130055664804135, 'batch_size': 1592, 'optimizer': 'Adam'}. Best is trial 22 with value: 0.13176558549288317.
2026-05-16 04:46:55,091 - optuna.study._optimize - INFO - Trial 37 pruned. 
2026-05-16 04:47:03,190 - experiment_functions - INFO - Early stopping at epoch 500. Best Recall: 0.0030
2026-05-16 04:47:04,127 - optuna.study.study - INFO - Trial 38 finished with value: 0.002983621215603103 and parameters: {'n_layers': 2, 'embedding_dim': 256, 'lr': 0.00612812813050354, 'lambda_val': 0.00023197972310343257, 'batch_size': 969, 'optimizer': 'SGD'}. Best is trial 22 with value: 0.13176558549288317.
2026-05-16 04:47:12,395 - optuna.study._optimize - INFO - Trial 39 pruned. 
2026-05-16 04:47:16,777 - experiment_functions - INFO - Early stopping at epoch 700. Best Recall: 0.1110
2026-05-16 04:47:16,879 - optuna.study.study - INFO - Trial 40 finished with value: 0.11100339896479183 and parameters: {'n_layers': 1, 'embedding_dim': 96, 'lr': 0.0017074125263185913, 'lambda_val': 1.2241449302478271e-05, 'batch_size': 2379, 'optimizer': 'Adam'}. Best is trial 22 with value: 0.13176558549288317.
2026-05-16 04:47:35,098 - optuna.study._optimize - INFO - Trial 41 pruned. 
2026-05-16 04:47:42,315 - optuna.study._optimize - INFO - Trial 42 pruned. 
2026-05-16 04:47:48,312 - optuna.study._optimize - INFO - Trial 43 pruned. 
2026-05-16 04:47:52,590 - experiment_functions - INFO - Early stopping at epoch 650. Best Recall: 0.1045
2026-05-16 04:47:52,692 - optuna.study.study - INFO - Trial 44 finished with value: 0.10445483880148218 and parameters: {'n_layers': 1, 'embedding_dim': 96, 'lr': 0.00286609966595647, 'lambda_val': 0.00029769572926202555, 'batch_size': 1711, 'optimizer': 'Adam'}. Best is trial 22 with value: 0.13176558549288317.
2026-05-16 04:48:09,400 - optuna.study._optimize - INFO - Trial 45 pruned. 
2026-05-16 04:48:15,554 - optuna.study._optimize - INFO - Trial 46 pruned. 
2026-05-16 04:48:25,943 - optuna.study._optimize - INFO - Trial 47 pruned. 
2026-05-16 04:48:29,970 - experiment_functions - INFO - Early stopping at epoch 500. Best Recall: 0.0024
2026-05-16 04:48:30,112 - optuna.study.study - INFO - Trial 48 finished with value: 0.0024175857897850194 and parameters: {'n_layers': 4, 'embedding_dim': 128, 'lr': 0.0005651128634768373, 'lambda_val': 7.482483968890585e-05, 'batch_size': 715, 'optimizer': 'SGD'}. Best is trial 22 with value: 0.13176558549288317.
2026-05-16 04:48:40,134 - optuna.study._optimize - INFO - Trial 49 pruned. 
2026-05-16 04:48:44,161 - experiment_functions - INFO - Early stopping at epoch 600. Best Recall: 0.0635
2026-05-16 04:48:44,244 - optuna.study.study - INFO - Trial 50 finished with value: 0.06348061426288709 and parameters: {'n_layers': 2, 'embedding_dim': 96, 'lr': 0.0019133645723511763, 'lambda_val': 1.1667029285370736e-05, 'batch_size': 992, 'optimizer': 'Adam'}. Best is trial 22 with value: 0.13176558549288317.
2026-05-16 04:48:50,967 - experiment_functions - INFO - Early stopping at epoch 1100. Best Recall: 0.1152
2026-05-16 04:48:51,058 - optuna.study.study - INFO - Trial 51 finished with value: 0.1151946180518445 and parameters: {'n_layers': 1, 'embedding_dim': 96, 'lr': 0.0011506615065010636, 'lambda_val': 0.00017441143071678363, 'batch_size': 1056, 'optimizer': 'Adam'}. Best is trial 22 with value: 0.13176558549288317.
2026-05-16 04:48:57,202 - experiment_functions - INFO - Early stopping at epoch 1050. Best Recall: 0.1137
2026-05-16 04:48:57,282 - optuna.study.study - INFO - Trial 52 finished with value: 0.11368043127660239 and parameters: {'n_layers': 1, 'embedding_dim': 96, 'lr': 0.001280282646249872, 'lambda_val': 0.00011033343123764079, 'batch_size': 1118, 'optimizer': 'Adam'}. Best is trial 22 with value: 0.13176558549288317.
2026-05-16 04:49:16,094 - optuna.study._optimize - INFO - Trial 53 pruned. 
2026-05-16 04:49:22,429 - optuna.study._optimize - INFO - Trial 54 pruned. 
2026-05-16 04:49:27,789 - experiment_functions - INFO - Early stopping at epoch 600. Best Recall: 0.0896
2026-05-16 04:49:27,870 - optuna.study.study - INFO - Trial 55 finished with value: 0.08959361957424393 and parameters: {'n_layers': 1, 'embedding_dim': 96, 'lr': 0.004320128985217122, 'lambda_val': 5.761340588678529e-05, 'batch_size': 842, 'optimizer': 'Adam'}. Best is trial 22 with value: 0.13176558549288317.
2026-05-16 04:49:36,173 - experiment_functions - INFO - Early stopping at epoch 1400. Best Recall: 0.1318
2026-05-16 04:49:36,270 - optuna.study.study - INFO - Trial 56 finished with value: 0.13182256400588102 and parameters: {'n_layers': 1, 'embedding_dim': 128, 'lr': 0.0008402313370224276, 'lambda_val': 4.905660595445642e-06, 'batch_size': 955, 'optimizer': 'Adam'}. Best is trial 56 with value: 0.13182256400588102.
2026-05-16 04:49:43,435 - experiment_functions - INFO - Early stopping at epoch 1250. Best Recall: 0.1223
2026-05-16 04:49:43,526 - optuna.study.study - INFO - Trial 57 finished with value: 0.12228923121987612 and parameters: {'n_layers': 1, 'embedding_dim': 128, 'lr': 0.0008452152387484781, 'lambda_val': 4.748590602337727e-06, 'batch_size': 1670, 'optimizer': 'Adam'}. Best is trial 56 with value: 0.13182256400588102.
2026-05-16 04:49:57,119 - experiment_functions - INFO - Early stopping at epoch 550. Best Recall: 0.0401
2026-05-16 04:49:57,210 - optuna.study.study - INFO - Trial 58 finished with value: 0.04005661627333632 and parameters: {'n_layers': 3, 'embedding_dim': 128, 'lr': 0.0022415518982883253, 'lambda_val': 4.852076392371897e-06, 'batch_size': 1709, 'optimizer': 'Adam'}. Best is trial 56 with value: 0.13182256400588102.
2026-05-16 04:50:00,517 - experiment_functions - INFO - Early stopping at epoch 500. Best Recall: 0.0024
2026-05-16 04:50:00,608 - optuna.study.study - INFO - Trial 59 finished with value: 0.002424824765265559 and parameters: {'n_layers': 1, 'embedding_dim': 128, 'lr': 0.0008276543125643317, 'lambda_val': 2.1226287924474363e-06, 'batch_size': 2501, 'optimizer': 'SGD'}. Best is trial 56 with value: 0.13182256400588102.
2026-05-16 04:50:07,237 - optuna.study._optimize - INFO - Trial 60 pruned. 
2026-05-16 04:50:15,945 - optuna.study._optimize - INFO - Trial 61 pruned. 
2026-05-16 04:50:21,801 - optuna.study._optimize - INFO - Trial 62 pruned. 
2026-05-16 04:50:28,011 - experiment_functions - INFO - Early stopping at epoch 1050. Best Recall: 0.1119
2026-05-16 04:50:28,124 - optuna.study.study - INFO - Trial 63 finished with value: 0.11185158882292077 and parameters: {'n_layers': 1, 'embedding_dim': 128, 'lr': 0.0014675700952219038, 'lambda_val': 1.5837419094279087e-05, 'batch_size': 1195, 'optimizer': 'Adam'}. Best is trial 56 with value: 0.13182256400588102.
2026-05-16 04:50:43,894 - optuna.study._optimize - INFO - Trial 64 pruned. 
2026-05-16 04:50:49,496 - optuna.study._optimize - INFO - Trial 65 pruned. 
2026-05-16 04:50:55,333 - optuna.study._optimize - INFO - Trial 66 pruned. 
2026-05-16 04:51:01,983 - optuna.study._optimize - INFO - Trial 67 pruned. 
2026-05-16 04:51:06,083 - experiment_functions - INFO - Early stopping at epoch 600. Best Recall: 0.0775
