2026-05-16 00:52:18,335 - optuna.study.study - INFO - Trial 105 finished with value: 0.0014975359227067868 and parameters: {'n_layers': 1, 'embedding_dim': 64, 'lr': 0.009497504279202786, 'lambda_val': 8.723881005121486e-05, 'batch_size': 611, 'optimizer': 'SGD'}. Best is trial 75 with value: 0.02482134338591816.
2026-05-16 00:52:22,533 - experiment_functions - INFO - Early stopping at epoch 550. Best Recall: 0.0234
2026-05-16 00:52:22,626 - optuna.study.study - INFO - Trial 106 finished with value: 0.023438371923382297 and parameters: {'n_layers': 1, 'embedding_dim': 64, 'lr': 0.007229693834419044, 'lambda_val': 2.5497354098816312e-05, 'batch_size': 701, 'optimizer': 'Adam'}. Best is trial 75 with value: 0.02482134338591816.
2026-05-16 00:52:26,511 - experiment_functions - INFO - Early stopping at epoch 550. Best Recall: 0.0236
2026-05-16 00:52:26,616 - optuna.study.study - INFO - Trial 107 finished with value: 0.02356181441440829 and parameters: {'n_layers': 1, 'embedding_dim': 64, 'lr': 0.007074663409965485, 'lambda_val': 3.363230371473112e-05, 'batch_size': 693, 'optimizer': 'Adam'}. Best is trial 75 with value: 0.02482134338591816.
2026-05-16 00:52:30,172 - experiment_functions - INFO - Early stopping at epoch 550. Best Recall: 0.0203
2026-05-16 00:52:30,266 - optuna.study.study - INFO - Trial 108 finished with value: 0.020301003632601462 and parameters: {'n_layers': 1, 'embedding_dim': 64, 'lr': 0.0051461080369601874, 'lambda_val': 2.859082085386052e-05, 'batch_size': 587, 'optimizer': 'Adam'}. Best is trial 75 with value: 0.02482134338591816.
2026-05-16 00:52:36,018 - optuna.study._optimize - INFO - Trial 109 pruned. 
2026-05-16 00:52:39,933 - experiment_functions - INFO - Early stopping at epoch 550. Best Recall: 0.0185
2026-05-16 00:52:40,038 - optuna.study.study - INFO - Trial 110 finished with value: 0.01845011661991465 and parameters: {'n_layers': 1, 'embedding_dim': 64, 'lr': 0.006888662158189562, 'lambda_val': 3.9989266346300144e-05, 'batch_size': 960, 'optimizer': 'Adam'}. Best is trial 75 with value: 0.02482134338591816.
2026-05-16 00:52:43,968 - experiment_functions - INFO - Early stopping at epoch 550. Best Recall: 0.0189
2026-05-16 00:52:44,084 - optuna.study.study - INFO - Trial 111 finished with value: 0.018918405780554735 and parameters: {'n_layers': 1, 'embedding_dim': 64, 'lr': 0.00536670016133413, 'lambda_val': 3.0352175328889272e-05, 'batch_size': 583, 'optimizer': 'Adam'}. Best is trial 75 with value: 0.02482134338591816.
2026-05-16 00:52:47,904 - experiment_functions - INFO - Early stopping at epoch 550. Best Recall: 0.0199
2026-05-16 00:52:48,052 - optuna.study.study - INFO - Trial 112 finished with value: 0.019879376892371042 and parameters: {'n_layers': 1, 'embedding_dim': 64, 'lr': 0.007472853736518463, 'lambda_val': 6.302571571405362e-05, 'batch_size': 715, 'optimizer': 'Adam'}. Best is trial 75 with value: 0.02482134338591816.
2026-05-16 00:52:51,991 - experiment_functions - INFO - Early stopping at epoch 550. Best Recall: 0.0221
2026-05-16 00:52:52,151 - optuna.study.study - INFO - Trial 113 finished with value: 0.022085989171920412 and parameters: {'n_layers': 1, 'embedding_dim': 64, 'lr': 0.00490741429901371, 'lambda_val': 5.204299044606298e-05, 'batch_size': 590, 'optimizer': 'Adam'}. Best is trial 75 with value: 0.02482134338591816.
2026-05-16 00:52:56,287 - experiment_functions - INFO - Early stopping at epoch 550. Best Recall: 0.0229
2026-05-16 00:52:56,380 - optuna.study.study - INFO - Trial 114 finished with value: 0.022903946345651724 and parameters: {'n_layers': 1, 'embedding_dim': 64, 'lr': 0.006909940917503702, 'lambda_val': 2.338465370281874e-05, 'batch_size': 722, 'optimizer': 'Adam'}. Best is trial 75 with value: 0.02482134338591816.
2026-05-16 00:53:00,017 - experiment_functions - INFO - Early stopping at epoch 550. Best Recall: 0.0156
2026-05-16 00:53:00,155 - optuna.study.study - INFO - Trial 115 finished with value: 0.015610954599914663 and parameters: {'n_layers': 1, 'embedding_dim': 64, 'lr': 0.01012137458855794, 'lambda_val': 1.158151541754909e-05, 'batch_size': 832, 'optimizer': 'Adam'}. Best is trial 75 with value: 0.02482134338591816.
2026-05-16 00:53:03,648 - experiment_functions - INFO - Early stopping at epoch 550. Best Recall: 0.0191
2026-05-16 00:53:03,741 - optuna.study.study - INFO - Trial 116 finished with value: 0.01908016625581814 and parameters: {'n_layers': 1, 'embedding_dim': 64, 'lr': 0.005950099499920021, 'lambda_val': 5.0810231871439444e-05, 'batch_size': 707, 'optimizer': 'Adam'}. Best is trial 75 with value: 0.02482134338591816.
2026-05-16 00:53:09,961 - experiment_functions - INFO - Early stopping at epoch 550. Best Recall: 0.0137
2026-05-16 00:53:10,065 - optuna.study.study - INFO - Trial 117 finished with value: 0.013659392784690236 and parameters: {'n_layers': 1, 'embedding_dim': 64, 'lr': 0.014960483777982373, 'lambda_val': 2.392383551090356e-05, 'batch_size': 567, 'optimizer': 'Adam'}. Best is trial 75 with value: 0.02482134338591816.
2026-05-16 00:53:13,730 - experiment_functions - INFO - Early stopping at epoch 550. Best Recall: 0.0221
2026-05-16 00:53:13,824 - optuna.study.study - INFO - Trial 118 finished with value: 0.02212001118777141 and parameters: {'n_layers': 1, 'embedding_dim': 64, 'lr': 0.007746327029316078, 'lambda_val': 3.748514535982862e-05, 'batch_size': 679, 'optimizer': 'Adam'}. Best is trial 75 with value: 0.02482134338591816.
2026-05-16 00:53:17,531 - experiment_functions - INFO - Early stopping at epoch 550. Best Recall: 0.0196
2026-05-16 00:53:17,646 - optuna.study.study - INFO - Trial 119 finished with value: 0.0196125220457751 and parameters: {'n_layers': 1, 'embedding_dim': 64, 'lr': 0.007460725987510972, 'lambda_val': 3.875235273401668e-05, 'batch_size': 915, 'optimizer': 'Adam'}. Best is trial 75 with value: 0.02482134338591816.
2026-05-16 00:53:21,541 - experiment_functions - INFO - Early stopping at epoch 550. Best Recall: 0.0178
2026-05-16 00:53:21,635 - optuna.study.study - INFO - Trial 120 finished with value: 0.017821237046587616 and parameters: {'n_layers': 1, 'embedding_dim': 64, 'lr': 0.011758291131744487, 'lambda_val': 1.4702305600573633e-05, 'batch_size': 764, 'optimizer': 'Adam'}. Best is trial 75 with value: 0.02482134338591816.
2026-05-16 00:53:25,940 - experiment_functions - INFO - Early stopping at epoch 550. Best Recall: 0.0147
2026-05-16 00:53:26,034 - optuna.study.study - INFO - Trial 121 finished with value: 0.014701959954193752 and parameters: {'n_layers': 1, 'embedding_dim': 64, 'lr': 0.008980893136538855, 'lambda_val': 2.729475808436779e-05, 'batch_size': 690, 'optimizer': 'Adam'}. Best is trial 75 with value: 0.02482134338591816.
2026-05-16 00:53:29,494 - experiment_functions - INFO - Early stopping at epoch 550. Best Recall: 0.0184
2026-05-16 00:53:29,597 - optuna.study.study - INFO - Trial 122 finished with value: 0.01844275206191602 and parameters: {'n_layers': 1, 'embedding_dim': 64, 'lr': 0.00430616924683496, 'lambda_val': 2.0727641751236692e-05, 'batch_size': 593, 'optimizer': 'Adam'}. Best is trial 75 with value: 0.02482134338591816.
2026-05-16 00:53:33,265 - experiment_functions - INFO - Early stopping at epoch 550. Best Recall: 0.0216
2026-05-16 00:53:33,368 - optuna.study.study - INFO - Trial 123 finished with value: 0.021633674271094135 and parameters: {'n_layers': 1, 'embedding_dim': 64, 'lr': 0.00667366099647289, 'lambda_val': 4.768532780462747e-05, 'batch_size': 666, 'optimizer': 'Adam'}. Best is trial 75 with value: 0.02482134338591816.
2026-05-16 00:53:36,986 - experiment_functions - INFO - Early stopping at epoch 550. Best Recall: 0.0182
2026-05-16 00:53:37,088 - optuna.study.study - INFO - Trial 124 finished with value: 0.01817682623357769 and parameters: {'n_layers': 1, 'embedding_dim': 64, 'lr': 0.00641025720255061, 'lambda_val': 4.9222949963273e-05, 'batch_size': 804, 'optimizer': 'Adam'}. Best is trial 75 with value: 0.02482134338591816.
2026-05-16 00:53:41,660 - experiment_functions - INFO - Early stopping at epoch 600. Best Recall: 0.0198
2026-05-16 00:53:41,782 - optuna.study.study - INFO - Trial 125 finished with value: 0.019798376712172102 and parameters: {'n_layers': 1, 'embedding_dim': 64, 'lr': 0.003204189234221328, 'lambda_val': 3.603795803399562e-05, 'batch_size': 647, 'optimizer': 'Adam'}. Best is trial 75 with value: 0.02482134338591816.
2026-05-16 00:53:45,553 - experiment_functions - INFO - Early stopping at epoch 550. Best Recall: 0.0083
2026-05-16 00:53:45,644 - optuna.study.study - INFO - Trial 126 finished with value: 0.008307878299138535 and parameters: {'n_layers': 1, 'embedding_dim': 64, 'lr': 0.01741765990156409, 'lambda_val': 5.586026245506988e-05, 'batch_size': 735, 'optimizer': 'Adam'}. Best is trial 75 with value: 0.02482134338591816.
2026-05-16 00:53:48,786 - experiment_functions - INFO - Early stopping at epoch 500. Best Recall: 0.0025
2026-05-16 00:53:48,898 - optuna.study.study - INFO - Trial 127 finished with value: 0.002491136991367005 and parameters: {'n_layers': 1, 'embedding_dim': 64, 'lr': 0.002735544741523723, 'lambda_val': 7.457849825339936e-05, 'batch_size': 850, 'optimizer': 'SGD'}. Best is trial 75 with value: 0.02482134338591816.
2026-05-16 00:53:52,606 - experiment_functions - INFO - Early stopping at epoch 550. Best Recall: 0.0185
2026-05-16 00:53:52,697 - optuna.study.study - INFO - Trial 128 finished with value: 0.018504023560320118 and parameters: {'n_layers': 1, 'embedding_dim': 64, 'lr': 0.008523945246274721, 'lambda_val': 3.4581092977151124e-05, 'batch_size': 660, 'optimizer': 'Adam'}. Best is trial 75 with value: 0.02482134338591816.
2026-05-16 00:53:56,448 - experiment_functions - INFO - Early stopping at epoch 550. Best Recall: 0.0035
2026-05-16 00:53:56,525 - optuna.study.study - INFO - Trial 129 finished with value: 0.0034819535453519115 and parameters: {'n_layers': 4, 'embedding_dim': 64, 'lr': 0.006647008336626322, 'lambda_val': 1.6969724232719948e-05, 'batch_size': 529, 'optimizer': 'Adam'}. Best is trial 75 with value: 0.02482134338591816.
2026-05-16 00:54:00,055 - experiment_functions - INFO - Early stopping at epoch 550. Best Recall: 0.0119
2026-05-16 00:54:00,181 - optuna.study.study - INFO - Trial 130 finished with value: 0.011851077287491662 and parameters: {'n_layers': 1, 'embedding_dim': 96, 'lr': 0.011976894019197928, 'lambda_val': 0.00016063910262956686, 'batch_size': 1002, 'optimizer': 'Adam'}. Best is trial 75 with value: 0.02482134338591816.
2026-05-16 00:54:03,703 - experiment_functions - INFO - Early stopping at epoch 550. Best Recall: 0.0172
2026-05-16 00:54:03,795 - optuna.study.study - INFO - Trial 131 finished with value: 0.017210815201220656 and parameters: {'n_layers': 1, 'embedding_dim': 64, 'lr': 0.005358526033274799, 'lambda_val': 2.9071099240277986e-05, 'batch_size': 586, 'optimizer': 'Adam'}. Best is trial 75 with value: 0.02482134338591816.
2026-05-16 00:54:07,078 - experiment_functions - INFO - Early stopping at epoch 550. Best Recall: 0.0198
2026-05-16 00:54:07,168 - optuna.study.study - INFO - Trial 132 finished with value: 0.019807986832537365 and parameters: {'n_layers': 1, 'embedding_dim': 64, 'lr': 0.004598962447890186, 'lambda_val': 4.5162933776523124e-05, 'batch_size': 513, 'optimizer': 'Adam'}. Best is trial 75 with value: 0.02482134338591816.
2026-05-16 00:54:10,921 - experiment_functions - INFO - Early stopping at epoch 550. Best Recall: 0.0144
2026-05-16 00:54:11,012 - optuna.study.study - INFO - Trial 133 finished with value: 0.014431201712399278 and parameters: {'n_layers': 1, 'embedding_dim': 64, 'lr': 0.00371707164044555, 'lambda_val': 0.00010046691578056095, 'batch_size': 683, 'optimizer': 'Adam'}. Best is trial 75 with value: 0.02482134338591816.
2026-05-16 00:54:14,332 - experiment_functions - INFO - Early stopping at epoch 550. Best Recall: 0.0188
2026-05-16 00:54:14,423 - optuna.study.study - INFO - Trial 134 finished with value: 0.018794783559481575 and parameters: {'n_layers': 1, 'embedding_dim': 64, 'lr': 0.005012005404666655, 'lambda_val': 1.0200812514974375e-05, 'batch_size': 778, 'optimizer': 'Adam'}. Best is trial 75 with value: 0.02482134338591816.
2026-05-16 00:54:19,397 - experiment_functions - INFO - Early stopping at epoch 550. Best Recall: 0.0117
2026-05-16 00:54:19,489 - optuna.study.study - INFO - Trial 135 finished with value: 0.011702863038662789 and parameters: {'n_layers': 1, 'embedding_dim': 64, 'lr': 0.007177956627233591, 'lambda_val': 2.3935748334459833e-05, 'batch_size': 2544, 'optimizer': 'Adam'}. Best is trial 75 with value: 0.02482134338591816.
2026-05-16 00:54:22,745 - experiment_functions - INFO - Early stopping at epoch 550. Best Recall: 0.0178
2026-05-16 00:54:22,847 - optuna.study.study - INFO - Trial 136 finished with value: 0.017780890742972816 and parameters: {'n_layers': 1, 'embedding_dim': 64, 'lr': 0.009549996662930684, 'lambda_val': 5.00776328316856e-05, 'batch_size': 900, 'optimizer': 'Adam'}. Best is trial 75 with value: 0.02482134338591816.
2026-05-16 00:54:26,448 - experiment_functions - INFO - Early stopping at epoch 550. Best Recall: 0.0190
2026-05-16 00:54:26,549 - optuna.study.study - INFO - Trial 137 finished with value: 0.019032007610165786 and parameters: {'n_layers': 1, 'embedding_dim': 64, 'lr': 0.004182485302139799, 'lambda_val': 7.894234617689239e-05, 'batch_size': 588, 'optimizer': 'Adam'}. Best is trial 75 with value: 0.02482134338591816.
2026-05-16 00:54:30,113 - experiment_functions - INFO - Early stopping at epoch 550. Best Recall: 0.0045
2026-05-16 00:54:30,207 - optuna.study.study - INFO - Trial 138 finished with value: 0.004526146061278603 and parameters: {'n_layers': 1, 'embedding_dim': 64, 'lr': 0.07735316935170466, 'lambda_val': 1.6547218775781165e-05, 'batch_size': 709, 'optimizer': 'Adam'}. Best is trial 75 with value: 0.02482134338591816.
2026-05-16 00:54:34,379 - experiment_functions - INFO - Early stopping at epoch 550. Best Recall: 0.0166
2026-05-16 00:54:34,473 - optuna.study.study - INFO - Trial 139 finished with value: 0.01661228155630383 and parameters: {'n_layers': 1, 'embedding_dim': 64, 'lr': 0.006131367478181531, 'lambda_val': 3.14824263962017e-05, 'batch_size': 835, 'optimizer': 'Adam'}. Best is trial 75 with value: 0.02482134338591816.
2026-05-16 00:54:38,073 - experiment_functions - INFO - Early stopping at epoch 600. Best Recall: 0.0154
2026-05-16 00:54:38,154 - optuna.study.study - INFO - Trial 140 finished with value: 0.015397167708407133 and parameters: {'n_layers': 1, 'embedding_dim': 64, 'lr': 0.0030162355283516085, 'lambda_val': 5.706396753444846e-05, 'batch_size': 640, 'optimizer': 'Adam'}. Best is trial 75 with value: 0.02482134338591816.
2026-05-16 00:54:51,244 - experiment_functions - INFO - Early stopping at epoch 2550. Best Recall: 0.0199
2026-05-16 00:54:51,334 - optuna.study.study - INFO - Trial 141 finished with value: 0.019944484171377275 and parameters: {'n_layers': 1, 'embedding_dim': 32, 'lr': 0.00025292530940561526, 'lambda_val': 6.064286763430343e-06, 'batch_size': 756, 'optimizer': 'Adam'}. Best is trial 75 with value: 0.02482134338591816.
2026-05-16 00:54:54,639 - experiment_functions - INFO - Early stopping at epoch 550. Best Recall: 0.0239
2026-05-16 00:54:54,730 - optuna.study.study - INFO - Trial 142 finished with value: 0.023944882817872153 and parameters: {'n_layers': 1, 'embedding_dim': 32, 'lr': 0.00787529370795469, 'lambda_val': 7.506896090734197e-05, 'batch_size': 593, 'optimizer': 'Adam'}. Best is trial 75 with value: 0.02482134338591816.
2026-05-16 00:54:58,074 - experiment_functions - INFO - Early stopping at epoch 550. Best Recall: 0.0183
2026-05-16 00:54:58,175 - optuna.study.study - INFO - Trial 143 finished with value: 0.018305754407341623 and parameters: {'n_layers': 1, 'embedding_dim': 32, 'lr': 0.005485767901720203, 'lambda_val': 4.0060250123424935e-05, 'batch_size': 513, 'optimizer': 'Adam'}. Best is trial 75 with value: 0.02482134338591816.
2026-05-16 00:55:01,425 - experiment_functions - INFO - Early stopping at epoch 500. Best Recall: 0.0020
2026-05-16 00:55:01,517 - optuna.study.study - INFO - Trial 144 finished with value: 0.001991545663117499 and parameters: {'n_layers': 3, 'embedding_dim': 32, 'lr': 0.008162817440891052, 'lambda_val': 7.60342916024173e-05, 'batch_size': 3714, 'optimizer': 'Adam'}. Best is trial 75 with value: 0.02482134338591816.
2026-05-16 00:55:05,225 - experiment_functions - INFO - Early stopping at epoch 550. Best Recall: 0.0126
2026-05-16 00:55:05,315 - optuna.study.study - INFO - Trial 145 finished with value: 0.01264962160771952 and parameters: {'n_layers': 1, 'embedding_dim': 32, 'lr': 0.011095258449611265, 'lambda_val': 0.00013411785352149914, 'batch_size': 591, 'optimizer': 'Adam'}. Best is trial 75 with value: 0.02482134338591816.
2026-05-16 00:55:08,494 - experiment_functions - INFO - Early stopping at epoch 550. Best Recall: 0.0181
2026-05-16 00:55:08,574 - optuna.study.study - INFO - Trial 146 finished with value: 0.018140621932459345 and parameters: {'n_layers': 1, 'embedding_dim': 96, 'lr': 0.007126835232694221, 'lambda_val': 0.00010759358411630906, 'batch_size': 663, 'optimizer': 'Adam'}. Best is trial 75 with value: 0.02482134338591816.
2026-05-16 00:55:11,881 - experiment_functions - INFO - Early stopping at epoch 550. Best Recall: 0.0150
2026-05-16 00:55:11,983 - optuna.study.study - INFO - Trial 147 finished with value: 0.015018424801368578 and parameters: {'n_layers': 1, 'embedding_dim': 32, 'lr': 0.0040264566188984285, 'lambda_val': 2.261653848563179e-05, 'batch_size': 741, 'optimizer': 'Adam'}. Best is trial 75 with value: 0.02482134338591816.
2026-05-16 00:55:15,404 - experiment_functions - INFO - Early stopping at epoch 550. Best Recall: 0.0196
2026-05-16 00:55:15,483 - optuna.study.study - INFO - Trial 148 finished with value: 0.019602650765461496 and parameters: {'n_layers': 1, 'embedding_dim': 64, 'lr': 0.004761375756946916, 'lambda_val': 0.0001735380244716339, 'batch_size': 584, 'optimizer': 'Adam'}. Best is trial 75 with value: 0.02482134338591816.
2026-05-16 00:55:18,977 - experiment_functions - INFO - Early stopping at epoch 500. Best Recall: 0.0011
2026-05-16 00:55:19,071 - optuna.study.study - INFO - Trial 149 finished with value: 0.0010925082521971016 and parameters: {'n_layers': 1, 'embedding_dim': 64, 'lr': 0.0023955524743814855, 'lambda_val': 2.919450888049125e-05, 'batch_size': 814, 'optimizer': 'SGD'}. Best is trial 75 with value: 0.02482134338591816.
2026-05-16 00:55:22,645 - experiment_functions - INFO - Early stopping at epoch 550. Best Recall: 0.0207
2026-05-16 00:55:22,726 - optuna.study.study - INFO - Trial 150 finished with value: 0.020696052349824523 and parameters: {'n_layers': 1, 'embedding_dim': 128, 'lr': 0.006090415419283146, 'lambda_val': 5.69267223456129e-05, 'batch_size': 650, 'optimizer': 'Adam'}. Best is trial 75 with value: 0.02482134338591816.
2026-05-16 00:55:26,322 - experiment_functions - INFO - Early stopping at epoch 550. Best Recall: 0.0196
2026-05-16 00:55:26,425 - optuna.study.study - INFO - Trial 151 finished with value: 0.019587070907199553 and parameters: {'n_layers': 1, 'embedding_dim': 64, 'lr': 0.006074528771826129, 'lambda_val': 4.5452209290995875e-05, 'batch_size': 655, 'optimizer': 'Adam'}. Best is trial 75 with value: 0.02482134338591816.
2026-05-16 00:55:31,832 - experiment_functions - INFO - Early stopping at epoch 550. Best Recall: 0.0151
2026-05-16 00:55:31,995 - optuna.study.study - INFO - Trial 152 finished with value: 0.015094760101922582 and parameters: {'n_layers': 1, 'embedding_dim': 128, 'lr': 0.008235184725287756, 'lambda_val': 6.605180507255048e-05, 'batch_size': 700, 'optimizer': 'Adam'}. Best is trial 75 with value: 0.02482134338591816.
2026-05-16 00:55:35,570 - experiment_functions - INFO - Early stopping at epoch 550. Best Recall: 0.0177
2026-05-16 00:55:35,662 - optuna.study.study - INFO - Trial 153 finished with value: 0.01769829673421714 and parameters: {'n_layers': 1, 'embedding_dim': 128, 'lr': 0.010005956740408316, 'lambda_val': 9.046605879474349e-05, 'batch_size': 588, 'optimizer': 'Adam'}. Best is trial 75 with value: 0.02482134338591816.
2026-05-16 00:55:38,943 - experiment_functions - INFO - Early stopping at epoch 550. Best Recall: 0.0189
2026-05-16 00:55:39,046 - optuna.study.study - INFO - Trial 154 finished with value: 0.018915385864831977 and parameters: {'n_layers': 1, 'embedding_dim': 128, 'lr': 0.005305137518906003, 'lambda_val': 3.539530936000193e-05, 'batch_size': 908, 'optimizer': 'Adam'}. Best is trial 75 with value: 0.02482134338591816.
2026-05-16 00:55:45,994 - optuna.study._optimize - INFO - Trial 155 pruned. 
2026-05-16 00:55:50,062 - experiment_functions - INFO - Early stopping at epoch 600. Best Recall: 0.0183
2026-05-16 00:55:50,200 - optuna.study.study - INFO - Trial 156 finished with value: 0.018335377158692566 and parameters: {'n_layers': 1, 'embedding_dim': 128, 'lr': 0.003461606207282774, 'lambda_val': 4.216933972528689e-05, 'batch_size': 520, 'optimizer': 'Adam'}. Best is trial 75 with value: 0.02482134338591816.
2026-05-16 00:55:53,689 - experiment_functions - INFO - Early stopping at epoch 550. Best Recall: 0.0206
2026-05-16 00:55:53,792 - optuna.study.study - INFO - Trial 157 finished with value: 0.020636985120662584 and parameters: {'n_layers': 1, 'embedding_dim': 64, 'lr': 0.006535551023477851, 'lambda_val': 7.281055012498084e-05, 'batch_size': 645, 'optimizer': 'Adam'}. Best is trial 75 with value: 0.02482134338591816.
2026-05-16 00:55:57,310 - experiment_functions - INFO - Early stopping at epoch 550. Best Recall: 0.0109
