2026-05-16 05:51:02,753 - optuna.study._optimize - INFO - Trial 255 pruned. 
2026-05-16 05:51:11,057 - experiment_functions - INFO - Early stopping at epoch 1400. Best Recall: 0.0333
2026-05-16 05:51:11,162 - optuna.study.study - INFO - Trial 256 finished with value: 0.03330211068091281 and parameters: {'n_layers': 1, 'embedding_dim': 96, 'lr': 0.0004900018870986424, 'lambda_val': 1.7003568175775878e-06, 'batch_size': 512, 'optimizer': 'RMSprop'}. Best is trial 198 with value: 0.03886184033340142.
2026-05-16 05:51:19,328 - experiment_functions - INFO - Early stopping at epoch 1000. Best Recall: 0.0325
2026-05-16 05:51:19,422 - optuna.study.study - INFO - Trial 257 finished with value: 0.03248221640699045 and parameters: {'n_layers': 1, 'embedding_dim': 96, 'lr': 0.0005054228028715542, 'lambda_val': 1.5986967119900634e-06, 'batch_size': 519, 'optimizer': 'RMSprop'}. Best is trial 198 with value: 0.03886184033340142.
2026-05-16 05:51:24,456 - optuna.study._optimize - INFO - Trial 258 pruned. 
2026-05-16 05:51:34,995 - experiment_functions - INFO - Early stopping at epoch 2150. Best Recall: 0.0346
2026-05-16 05:51:35,099 - optuna.study.study - INFO - Trial 259 finished with value: 0.03455416875592521 and parameters: {'n_layers': 1, 'embedding_dim': 96, 'lr': 0.00031375590780107306, 'lambda_val': 1.7080453558606059e-06, 'batch_size': 601, 'optimizer': 'RMSprop'}. Best is trial 198 with value: 0.03886184033340142.
2026-05-16 05:51:38,521 - experiment_functions - INFO - Early stopping at epoch 550. Best Recall: 0.0080
2026-05-16 05:51:38,686 - optuna.study.study - INFO - Trial 260 finished with value: 0.008034526938083666 and parameters: {'n_layers': 1, 'embedding_dim': 96, 'lr': 0.005293115290881124, 'lambda_val': 4.106027157276262e-06, 'batch_size': 635, 'optimizer': 'RMSprop'}. Best is trial 198 with value: 0.03886184033340142.
2026-05-16 05:51:44,585 - optuna.study._optimize - INFO - Trial 261 pruned. 
2026-05-16 05:51:50,481 - optuna.study._optimize - INFO - Trial 262 pruned. 
2026-05-16 05:51:55,671 - optuna.study._optimize - INFO - Trial 263 pruned. 
2026-05-16 05:52:01,050 - optuna.study._optimize - INFO - Trial 264 pruned. 
2026-05-16 05:52:07,697 - optuna.study._optimize - INFO - Trial 265 pruned. 
2026-05-16 05:52:18,789 - optuna.study._optimize - INFO - Trial 266 pruned. 
2026-05-16 05:52:24,954 - optuna.study._optimize - INFO - Trial 267 pruned. 
2026-05-16 05:52:30,787 - optuna.study._optimize - INFO - Trial 268 pruned. 
2026-05-16 05:52:36,963 - optuna.study._optimize - INFO - Trial 269 pruned. 
2026-05-16 05:52:44,309 - optuna.study._optimize - INFO - Trial 270 pruned. 
2026-05-16 05:52:50,485 - optuna.study._optimize - INFO - Trial 271 pruned. 
2026-05-16 05:52:53,679 - experiment_functions - INFO - Early stopping at epoch 500. Best Recall: 0.0026
2026-05-16 05:52:53,770 - optuna.study.study - INFO - Trial 272 finished with value: 0.0026481674478453926 and parameters: {'n_layers': 1, 'embedding_dim': 64, 'lr': 0.00035303258814124743, 'lambda_val': 1.0391666281702386e-06, 'batch_size': 576, 'optimizer': 'SGD'}. Best is trial 198 with value: 0.03886184033340142.
2026-05-16 05:52:58,505 - experiment_functions - INFO - Early stopping at epoch 650. Best Recall: 0.0092
2026-05-16 05:52:58,610 - optuna.study.study - INFO - Trial 273 finished with value: 0.009154429539035058 and parameters: {'n_layers': 4, 'embedding_dim': 96, 'lr': 0.0005846622025482663, 'lambda_val': 7.794334223541977e-05, 'batch_size': 648, 'optimizer': 'RMSprop'}. Best is trial 198 with value: 0.03886184033340142.
2026-05-16 05:53:04,198 - optuna.study._optimize - INFO - Trial 274 pruned. 
2026-05-16 05:53:12,136 - optuna.study._optimize - INFO - Trial 275 pruned. 
2026-05-16 05:53:18,327 - optuna.study._optimize - INFO - Trial 276 pruned. 
2026-05-16 05:53:24,914 - optuna.study._optimize - INFO - Trial 277 pruned. 
2026-05-16 05:53:33,386 - optuna.study._optimize - INFO - Trial 278 pruned. 
2026-05-16 05:53:38,909 - optuna.study._optimize - INFO - Trial 279 pruned. 
2026-05-16 05:53:45,035 - optuna.study._optimize - INFO - Trial 280 pruned. 
2026-05-16 05:53:50,958 - experiment_functions - INFO - Early stopping at epoch 950. Best Recall: 0.0226
2026-05-16 05:53:51,063 - optuna.study.study - INFO - Trial 281 finished with value: 0.02263685005118636 and parameters: {'n_layers': 1, 'embedding_dim': 96, 'lr': 0.0005235235131330107, 'lambda_val': 2.8174258175326468e-06, 'batch_size': 848, 'optimizer': 'RMSprop'}. Best is trial 198 with value: 0.03886184033340142.
2026-05-16 05:53:56,727 - optuna.study._optimize - INFO - Trial 282 pruned. 
2026-05-16 05:54:02,863 - optuna.study._optimize - INFO - Trial 283 pruned. 
2026-05-16 05:54:16,465 - experiment_functions - INFO - Early stopping at epoch 2600. Best Recall: 0.0364
2026-05-16 05:54:16,580 - optuna.study.study - INFO - Trial 284 finished with value: 0.03644725414906266 and parameters: {'n_layers': 1, 'embedding_dim': 96, 'lr': 0.0002983668376651095, 'lambda_val': 2.167621877766957e-06, 'batch_size': 769, 'optimizer': 'RMSprop'}. Best is trial 198 with value: 0.03886184033340142.
2026-05-16 05:54:23,199 - optuna.study._optimize - INFO - Trial 285 pruned. 
2026-05-16 05:54:32,110 - experiment_functions - INFO - Early stopping at epoch 1500. Best Recall: 0.0339
2026-05-16 05:54:32,224 - optuna.study.study - INFO - Trial 286 finished with value: 0.033855129691152966 and parameters: {'n_layers': 1, 'embedding_dim': 96, 'lr': 0.0004220440730908474, 'lambda_val': 1.8258932782713569e-06, 'batch_size': 571, 'optimizer': 'RMSprop'}. Best is trial 198 with value: 0.03886184033340142.
2026-05-16 05:54:38,164 - optuna.study._optimize - INFO - Trial 287 pruned. 
2026-05-16 05:54:46,509 - optuna.study._optimize - INFO - Trial 288 pruned. 
2026-05-16 05:54:51,928 - experiment_functions - INFO - Early stopping at epoch 950. Best Recall: 0.0283
2026-05-16 05:54:52,022 - optuna.study.study - INFO - Trial 289 finished with value: 0.028301165400830552 and parameters: {'n_layers': 1, 'embedding_dim': 96, 'lr': 0.0005459547615613479, 'lambda_val': 2.0006875417573544e-06, 'batch_size': 579, 'optimizer': 'RMSprop'}. Best is trial 198 with value: 0.03886184033340142.
2026-05-16 05:54:58,008 - optuna.study._optimize - INFO - Trial 290 pruned. 
2026-05-16 05:55:09,489 - optuna.study._optimize - INFO - Trial 291 pruned. 
2026-05-16 05:55:15,856 - experiment_functions - INFO - Early stopping at epoch 950. Best Recall: 0.0223
2026-05-16 05:55:15,983 - optuna.study.study - INFO - Trial 292 finished with value: 0.02227128315779933 and parameters: {'n_layers': 1, 'embedding_dim': 96, 'lr': 0.0006801922653654785, 'lambda_val': 1.89726476722431e-06, 'batch_size': 641, 'optimizer': 'RMSprop'}. Best is trial 198 with value: 0.03886184033340142.
2026-05-16 05:55:20,186 - experiment_functions - INFO - Early stopping at epoch 700. Best Recall: 0.0140
2026-05-16 05:55:20,280 - optuna.study.study - INFO - Trial 293 finished with value: 0.01396144991546597 and parameters: {'n_layers': 1, 'embedding_dim': 96, 'lr': 0.0004348378428256503, 'lambda_val': 1.2219869226212308e-06, 'batch_size': 3124, 'optimizer': 'RMSprop'}. Best is trial 198 with value: 0.03886184033340142.
2026-05-16 05:55:29,873 - experiment_functions - INFO - Early stopping at epoch 1450. Best Recall: 0.0336
2026-05-16 05:55:29,983 - optuna.study.study - INFO - Trial 294 finished with value: 0.033605034104670035 and parameters: {'n_layers': 1, 'embedding_dim': 96, 'lr': 0.00034627666343947677, 'lambda_val': 2.4012766678404963e-06, 'batch_size': 516, 'optimizer': 'RMSprop'}. Best is trial 198 with value: 0.03886184033340142.
2026-05-16 05:55:33,334 - experiment_functions - INFO - Early stopping at epoch 500. Best Recall: 0.0023
2026-05-16 05:55:33,436 - optuna.study.study - INFO - Trial 295 finished with value: 0.002263514476588873 and parameters: {'n_layers': 1, 'embedding_dim': 96, 'lr': 0.00019624172741724273, 'lambda_val': 2.8245098125238008e-06, 'batch_size': 776, 'optimizer': 'SGD'}. Best is trial 198 with value: 0.03886184033340142.
2026-05-16 05:55:39,345 - optuna.study._optimize - INFO - Trial 296 pruned. 
2026-05-16 05:55:50,829 - experiment_functions - INFO - Early stopping at epoch 2050. Best Recall: 0.0338
2026-05-16 05:55:50,922 - optuna.study.study - INFO - Trial 297 finished with value: 0.03377758823970389 and parameters: {'n_layers': 1, 'embedding_dim': 64, 'lr': 0.00039453136882916463, 'lambda_val': 2.2976113465063352e-06, 'batch_size': 688, 'optimizer': 'RMSprop'}. Best is trial 198 with value: 0.03886184033340142.
2026-05-16 05:56:02,243 - experiment_functions - INFO - Early stopping at epoch 2100. Best Recall: 0.0351
2026-05-16 05:56:02,333 - optuna.study.study - INFO - Trial 298 finished with value: 0.03509222025715382 and parameters: {'n_layers': 1, 'embedding_dim': 64, 'lr': 0.0003730828989450525, 'lambda_val': 1.4348146767107742e-06, 'batch_size': 573, 'optimizer': 'RMSprop'}. Best is trial 198 with value: 0.03886184033340142.
2026-05-16 05:56:08,359 - optuna.study._optimize - INFO - Trial 299 pruned. 
2026-05-16 05:56:14,459 - experiment_functions - INFO - Early stopping at epoch 2300. Best Recall: 0.0307
2026-05-16 05:56:14,558 - root - INFO -   ** Getting the trainable edges:
2026-05-16 05:56:14,565 - helper_functions - INFO -      Number of nodes: 5324
2026-05-16 05:56:14,565 - helper_functions - INFO -      Ratio: 0.515192568221405
2026-05-16 05:56:14,565 - helper_functions - INFO -      Number of unique users: 333
2026-05-16 05:56:14,565 - helper_functions - INFO -      Number of unique items: 4991
2026-05-16 05:56:14,565 - helper_functions - INFO -      Total dominant set edge: 87527
2026-05-16 05:56:14,565 - helper_functions - INFO -      Trainable edges: 70021.6
2026-05-16 05:56:14,575 - root - INFO -   **** Getting 87527 dominant set edges
2026-05-16 05:56:14,708 - optuna.storages._rdb.storage - INFO - A new study created in RDB with name: Study_e_100K_1c3dcs
2026-05-16 05:56:19,752 - experiment_functions - INFO - Early stopping at epoch 550. Best Recall: 0.0029
2026-05-16 05:56:19,848 - optuna.study.study - INFO - Trial 0 finished with value: 0.00293031509036231 and parameters: {'n_layers': 1, 'embedding_dim': 256, 'lr': 1.443934591074894e-05, 'lambda_val': 0.022820754785646657, 'batch_size': 2489, 'optimizer': 'RMSprop'}. Best is trial 0 with value: 0.00293031509036231.
2026-05-16 05:56:25,604 - experiment_functions - INFO - Early stopping at epoch 500. Best Recall: 0.0016
2026-05-16 05:56:25,695 - optuna.study.study - INFO - Trial 1 finished with value: 0.0015952636463761234 and parameters: {'n_layers': 4, 'embedding_dim': 256, 'lr': 0.027164832996463408, 'lambda_val': 0.0014392033748502734, 'batch_size': 2351, 'optimizer': 'SGD'}. Best is trial 0 with value: 0.00293031509036231.
2026-05-16 05:56:29,908 - experiment_functions - INFO - Early stopping at epoch 500. Best Recall: 0.0041
2026-05-16 05:56:30,041 - optuna.study.study - INFO - Trial 2 finished with value: 0.004050810672675028 and parameters: {'n_layers': 3, 'embedding_dim': 96, 'lr': 0.06627467166595305, 'lambda_val': 0.013188759380929607, 'batch_size': 3437, 'optimizer': 'SGD'}. Best is trial 2 with value: 0.004050810672675028.
2026-05-16 05:56:33,939 - experiment_functions - INFO - Early stopping at epoch 500. Best Recall: 0.0037
2026-05-16 05:56:34,042 - optuna.study.study - INFO - Trial 3 finished with value: 0.003746786152893161 and parameters: {'n_layers': 3, 'embedding_dim': 64, 'lr': 1.126865480480317e-05, 'lambda_val': 4.241709454219256e-05, 'batch_size': 782, 'optimizer': 'SGD'}. Best is trial 2 with value: 0.004050810672675028.
2026-05-16 05:57:10,004 - optuna.study.study - INFO - Trial 4 finished with value: 0.016395252999435252 and parameters: {'n_layers': 4, 'embedding_dim': 32, 'lr': 0.00010266793194537433, 'lambda_val': 5.664008115722332e-05, 'batch_size': 3684, 'optimizer': 'Adam'}. Best is trial 4 with value: 0.016395252999435252.
2026-05-16 05:57:13,276 - experiment_functions - INFO - Early stopping at epoch 500. Best Recall: 0.0010
2026-05-16 05:57:13,368 - optuna.study.study - INFO - Trial 5 finished with value: 0.0009662003387162064 and parameters: {'n_layers': 1, 'embedding_dim': 32, 'lr': 0.017970963942888805, 'lambda_val': 0.0073349891537789575, 'batch_size': 3287, 'optimizer': 'SGD'}. Best is trial 4 with value: 0.016395252999435252.
2026-05-16 05:57:20,011 - experiment_functions - INFO - Early stopping at epoch 600. Best Recall: 0.0231
2026-05-16 05:57:20,114 - optuna.study.study - INFO - Trial 6 finished with value: 0.023073358573371235 and parameters: {'n_layers': 4, 'embedding_dim': 256, 'lr': 0.0008469109843154827, 'lambda_val': 0.0011390074661993663, 'batch_size': 4042, 'optimizer': 'Adam'}. Best is trial 6 with value: 0.023073358573371235.
2026-05-16 05:57:24,436 - experiment_functions - INFO - Early stopping at epoch 500. Best Recall: 0.0014
2026-05-16 05:57:24,537 - optuna.study.study - INFO - Trial 7 finished with value: 0.0013635728582236616 and parameters: {'n_layers': 2, 'embedding_dim': 256, 'lr': 2.2999290552111133e-05, 'lambda_val': 0.017839508778943417, 'batch_size': 3283, 'optimizer': 'Adam'}. Best is trial 6 with value: 0.023073358573371235.
2026-05-16 05:57:30,182 - experiment_functions - INFO - Early stopping at epoch 800. Best Recall: 0.0620
2026-05-16 05:57:30,301 - optuna.study.study - INFO - Trial 8 finished with value: 0.06201117750705423 and parameters: {'n_layers': 1, 'embedding_dim': 256, 'lr': 0.006113265506626608, 'lambda_val': 1.129831891887493e-06, 'batch_size': 764, 'optimizer': 'Adam'}. Best is trial 8 with value: 0.06201117750705423.
2026-05-16 05:57:40,373 - experiment_functions - INFO - Early stopping at epoch 1100. Best Recall: 0.0190
2026-05-16 05:57:40,475 - optuna.study.study - INFO - Trial 9 finished with value: 0.01896904607338701 and parameters: {'n_layers': 3, 'embedding_dim': 256, 'lr': 0.007088944370261144, 'lambda_val': 0.010816620525010947, 'batch_size': 3651, 'optimizer': 'RMSprop'}. Best is trial 8 with value: 0.06201117750705423.
2026-05-16 05:57:45,197 - experiment_functions - INFO - Early stopping at epoch 650. Best Recall: 0.0561
2026-05-16 05:57:45,288 - optuna.study.study - INFO - Trial 10 finished with value: 0.056100288423860716 and parameters: {'n_layers': 2, 'embedding_dim': 128, 'lr': 0.0018732640842420475, 'lambda_val': 1.1216571185403489e-06, 'batch_size': 593, 'optimizer': 'Adam'}. Best is trial 8 with value: 0.06201117750705423.
2026-05-16 05:57:49,959 - experiment_functions - INFO - Early stopping at epoch 650. Best Recall: 0.0556
2026-05-16 05:57:50,062 - optuna.study.study - INFO - Trial 11 finished with value: 0.0556344316645444 and parameters: {'n_layers': 2, 'embedding_dim': 128, 'lr': 0.001551093408988387, 'lambda_val': 1.1249529754664043e-06, 'batch_size': 557, 'optimizer': 'Adam'}. Best is trial 8 with value: 0.06201117750705423.
2026-05-16 05:58:00,918 - experiment_functions - INFO - Early stopping at epoch 1000. Best Recall: 0.0801
2026-05-16 05:58:01,685 - optuna.study.study - INFO - Trial 12 finished with value: 0.08007474723898018 and parameters: {'n_layers': 1, 'embedding_dim': 128, 'lr': 0.0018881923561848803, 'lambda_val': 1.035259402477135e-06, 'batch_size': 1295, 'optimizer': 'Adam'}. Best is trial 12 with value: 0.08007474723898018.
2026-05-16 05:58:25,263 - experiment_functions - INFO - Early stopping at epoch 3050. Best Recall: 0.0641
2026-05-16 05:58:26,026 - optuna.study.study - INFO - Trial 13 finished with value: 0.06405150323420052 and parameters: {'n_layers': 1, 'embedding_dim': 128, 'lr': 0.0002473047005381994, 'lambda_val': 9.002873876554145e-06, 'batch_size': 1312, 'optimizer': 'Adam'}. Best is trial 12 with value: 0.08007474723898018.
2026-05-16 05:58:50,322 - experiment_functions - INFO - Early stopping at epoch 3600. Best Recall: 0.0748
2026-05-16 05:58:50,580 - optuna.study.study - INFO - Trial 14 finished with value: 0.07483529113635391 and parameters: {'n_layers': 1, 'embedding_dim': 128, 'lr': 0.00024576719281500336, 'lambda_val': 1.0882538122127106e-05, 'batch_size': 1347, 'optimizer': 'Adam'}. Best is trial 12 with value: 0.08007474723898018.
2026-05-16 05:59:00,905 - experiment_functions - INFO - Early stopping at epoch 1350. Best Recall: 0.0562
2026-05-16 05:59:01,007 - optuna.study.study - INFO - Trial 15 finished with value: 0.05622162860821183 and parameters: {'n_layers': 2, 'embedding_dim': 128, 'lr': 0.0003873918960577241, 'lambda_val': 8.898550434993185e-06, 'batch_size': 1490, 'optimizer': 'Adam'}. Best is trial 12 with value: 0.08007474723898018.
2026-05-16 05:59:07,100 - optuna.study._optimize - INFO - Trial 16 pruned. 
2026-05-16 05:59:10,749 - experiment_functions - INFO - Early stopping at epoch 550. Best Recall: 0.0667
2026-05-16 05:59:10,851 - optuna.study.study - INFO - Trial 17 finished with value: 0.06673560356933357 and parameters: {'n_layers': 1, 'embedding_dim': 64, 'lr': 0.0042064499901442445, 'lambda_val': 6.0611760714905706e-05, 'batch_size': 1925, 'optimizer': 'Adam'}. Best is trial 12 with value: 0.08007474723898018.
2026-05-16 05:59:19,840 - experiment_functions - INFO - Early stopping at epoch 1350. Best Recall: 0.0598
2026-05-16 05:59:19,950 - optuna.study.study - INFO - Trial 18 finished with value: 0.05984184479917905 and parameters: {'n_layers': 2, 'embedding_dim': 96, 'lr': 0.0003902708809274867, 'lambda_val': 4.503274486668232e-06, 'batch_size': 1170, 'optimizer': 'Adam'}. Best is trial 12 with value: 0.08007474723898018.
2026-05-16 05:59:26,143 - optuna.study._optimize - INFO - Trial 19 pruned. 
2026-05-16 05:59:31,538 - experiment_functions - INFO - Early stopping at epoch 700. Best Recall: 0.0577
2026-05-16 05:59:31,631 - optuna.study.study - INFO - Trial 20 finished with value: 0.05769121018796574 and parameters: {'n_layers': 2, 'embedding_dim': 128, 'lr': 0.0007935360354908953, 'lambda_val': 2.0250394596571334e-05, 'batch_size': 1960, 'optimizer': 'Adam'}. Best is trial 12 with value: 0.08007474723898018.
2026-05-16 05:59:35,497 - experiment_functions - INFO - Early stopping at epoch 600. Best Recall: 0.0568
2026-05-16 05:59:35,599 - optuna.study.study - INFO - Trial 21 finished with value: 0.05680209861154629 and parameters: {'n_layers': 1, 'embedding_dim': 64, 'lr': 0.004031365375630956, 'lambda_val': 8.664234076236842e-05, 'batch_size': 1869, 'optimizer': 'Adam'}. Best is trial 12 with value: 0.08007474723898018.
2026-05-16 05:59:40,442 - experiment_functions - INFO - Early stopping at epoch 800. Best Recall: 0.0617
2026-05-16 05:59:40,524 - optuna.study.study - INFO - Trial 22 finished with value: 0.06172413835760034 and parameters: {'n_layers': 1, 'embedding_dim': 64, 'lr': 0.0025950767384593544, 'lambda_val': 2.9092031685613585e-06, 'batch_size': 1078, 'optimizer': 'Adam'}. Best is trial 12 with value: 0.08007474723898018.
2026-05-16 05:59:43,954 - experiment_functions - INFO - Early stopping at epoch 550. Best Recall: 0.0458
2026-05-16 05:59:44,057 - optuna.study.study - INFO - Trial 23 finished with value: 0.045843536116934556 and parameters: {'n_layers': 1, 'embedding_dim': 64, 'lr': 0.016022085261063593, 'lambda_val': 1.9330656238693316e-05, 'batch_size': 1978, 'optimizer': 'Adam'}. Best is trial 12 with value: 0.08007474723898018.
2026-05-16 05:59:49,211 - experiment_functions - INFO - Early stopping at epoch 500. Best Recall: 0.0014
2026-05-16 05:59:49,314 - optuna.study.study - INFO - Trial 24 finished with value: 0.0013966576653984088 and parameters: {'n_layers': 1, 'embedding_dim': 64, 'lr': 0.00018221508150764837, 'lambda_val': 0.09339721646830604, 'batch_size': 1573, 'optimizer': 'Adam'}. Best is trial 12 with value: 0.08007474723898018.
2026-05-16 05:59:55,912 - experiment_functions - INFO - Early stopping at epoch 750. Best Recall: 0.0488
2026-05-16 05:59:56,024 - optuna.study.study - INFO - Trial 25 finished with value: 0.04882561371863172 and parameters: {'n_layers': 2, 'embedding_dim': 128, 'lr': 0.0008287686141604016, 'lambda_val': 0.0001837373202663581, 'batch_size': 2761, 'optimizer': 'Adam'}. Best is trial 12 with value: 0.08007474723898018.
2026-05-16 06:00:00,048 - experiment_functions - INFO - Early stopping at epoch 600. Best Recall: 0.0580
2026-05-16 06:00:00,150 - optuna.study.study - INFO - Trial 26 finished with value: 0.05804881662737446 and parameters: {'n_layers': 1, 'embedding_dim': 32, 'lr': 0.003939529363472702, 'lambda_val': 2.6872808964611745e-06, 'batch_size': 1024, 'optimizer': 'Adam'}. Best is trial 12 with value: 0.08007474723898018.
2026-05-16 06:00:04,110 - experiment_functions - INFO - Early stopping at epoch 550. Best Recall: 0.0358
2026-05-16 06:00:04,212 - optuna.study.study - INFO - Trial 27 finished with value: 0.0358086136352268 and parameters: {'n_layers': 2, 'embedding_dim': 96, 'lr': 0.008407135208059188, 'lambda_val': 0.0007235470964179606, 'batch_size': 2110, 'optimizer': 'Adam'}. Best is trial 12 with value: 0.08007474723898018.
2026-05-16 06:00:07,748 - experiment_functions - INFO - Early stopping at epoch 500. Best Recall: 0.0024
2026-05-16 06:00:07,847 - optuna.study.study - INFO - Trial 28 finished with value: 0.0023839050927534377 and parameters: {'n_layers': 1, 'embedding_dim': 64, 'lr': 0.0005211263138520749, 'lambda_val': 2.328817972620513e-05, 'batch_size': 1374, 'optimizer': 'SGD'}. Best is trial 12 with value: 0.08007474723898018.
2026-05-16 06:00:13,432 - experiment_functions - INFO - Early stopping at epoch 600. Best Recall: 0.0015
2026-05-16 06:00:14,199 - optuna.study.study - INFO - Trial 29 finished with value: 0.001523092990898493 and parameters: {'n_layers': 1, 'embedding_dim': 128, 'lr': 2.8030269206569056e-05, 'lambda_val': 0.0001292890000630707, 'batch_size': 1732, 'optimizer': 'RMSprop'}. Best is trial 12 with value: 0.08007474723898018.
2026-05-16 06:00:31,131 - experiment_functions - INFO - Early stopping at epoch 550. Best Recall: 0.0399
