2026-05-15 23:40:41,227 - optuna.study.study - INFO - Trial 192 finished with value: 0.11815214682456326 and parameters: {'n_layers': 1, 'embedding_dim': 256, 'lr': 0.0008053673359267211, 'lambda_val': 0.0001501195540476871, 'batch_size': 1845, 'optimizer': 'Adam'}. Best is trial 185 with value: 0.12903275879492856.
2026-05-15 23:40:49,521 - optuna.study._optimize - INFO - Trial 193 pruned. 
2026-05-15 23:40:59,632 - experiment_functions - INFO - Early stopping at epoch 1550. Best Recall: 0.1229
2026-05-15 23:40:59,743 - optuna.study.study - INFO - Trial 194 finished with value: 0.12292558507015987 and parameters: {'n_layers': 1, 'embedding_dim': 256, 'lr': 0.0006568132632138791, 'lambda_val': 7.916396883588375e-05, 'batch_size': 1408, 'optimizer': 'Adam'}. Best is trial 185 with value: 0.12903275879492856.
2026-05-15 23:41:07,095 - optuna.study._optimize - INFO - Trial 195 pruned. 
2026-05-15 23:41:15,186 - optuna.study._optimize - INFO - Trial 196 pruned. 
2026-05-15 23:41:22,302 - optuna.study._optimize - INFO - Trial 197 pruned. 
2026-05-15 23:41:28,563 - optuna.study._optimize - INFO - Trial 198 pruned. 
2026-05-15 23:41:33,236 - experiment_functions - INFO - Early stopping at epoch 500. Best Recall: 0.0025
2026-05-15 23:41:33,339 - optuna.study.study - INFO - Trial 199 finished with value: 0.0024722670081730918 and parameters: {'n_layers': 3, 'embedding_dim': 256, 'lr': 0.00031793602176996886, 'lambda_val': 4.346111096388859e-05, 'batch_size': 1588, 'optimizer': 'SGD'}. Best is trial 185 with value: 0.12903275879492856.
2026-05-15 23:41:42,619 - experiment_functions - INFO - Early stopping at epoch 1300. Best Recall: 0.1256
2026-05-15 23:41:42,710 - optuna.study.study - INFO - Trial 200 finished with value: 0.12564004639177734 and parameters: {'n_layers': 1, 'embedding_dim': 256, 'lr': 0.0007302173729548024, 'lambda_val': 0.0001148338703893387, 'batch_size': 1656, 'optimizer': 'Adam'}. Best is trial 185 with value: 0.12903275879492856.
2026-05-15 23:41:52,236 - optuna.study._optimize - INFO - Trial 201 pruned. 
2026-05-15 23:42:11,954 - experiment_functions - INFO - Early stopping at epoch 1800. Best Recall: 0.1248
2026-05-15 23:42:12,045 - optuna.study.study - INFO - Trial 202 finished with value: 0.1247592273404604 and parameters: {'n_layers': 1, 'embedding_dim': 256, 'lr': 0.000566145762780805, 'lambda_val': 0.00012797921243503757, 'batch_size': 1679, 'optimizer': 'Adam'}. Best is trial 185 with value: 0.12903275879492856.
2026-05-15 23:42:20,537 - experiment_functions - INFO - Early stopping at epoch 1250. Best Recall: 0.1170
2026-05-15 23:42:20,637 - optuna.study.study - INFO - Trial 203 finished with value: 0.11697439727899059 and parameters: {'n_layers': 1, 'embedding_dim': 256, 'lr': 0.0005430478510306486, 'lambda_val': 8.795105248598302e-05, 'batch_size': 2282, 'optimizer': 'Adam'}. Best is trial 185 with value: 0.12903275879492856.
2026-05-15 23:42:28,125 - optuna.study._optimize - INFO - Trial 204 pruned. 
2026-05-15 23:42:36,446 - optuna.study._optimize - INFO - Trial 205 pruned. 
2026-05-15 23:42:43,608 - optuna.study._optimize - INFO - Trial 206 pruned. 
2026-05-15 23:42:50,402 - optuna.study._optimize - INFO - Trial 207 pruned. 
2026-05-15 23:43:03,657 - experiment_functions - INFO - Early stopping at epoch 1600. Best Recall: 0.1203
2026-05-15 23:43:03,759 - optuna.study.study - INFO - Trial 208 finished with value: 0.12028070577776391 and parameters: {'n_layers': 1, 'embedding_dim': 256, 'lr': 0.0006103224017934442, 'lambda_val': 6.755794408536952e-05, 'batch_size': 1585, 'optimizer': 'Adam'}. Best is trial 185 with value: 0.12903275879492856.
2026-05-15 23:43:11,575 - optuna.study._optimize - INFO - Trial 209 pruned. 
2026-05-15 23:43:20,592 - experiment_functions - INFO - Early stopping at epoch 950. Best Recall: 0.1099
2026-05-15 23:43:20,683 - optuna.study.study - INFO - Trial 210 finished with value: 0.10988164341489962 and parameters: {'n_layers': 1, 'embedding_dim': 256, 'lr': 0.0009470651090423537, 'lambda_val': 6.738492855062726e-05, 'batch_size': 1665, 'optimizer': 'Adam'}. Best is trial 185 with value: 0.12903275879492856.
2026-05-15 23:43:31,152 - experiment_functions - INFO - Early stopping at epoch 1600. Best Recall: 0.1187
2026-05-15 23:43:31,275 - optuna.study.study - INFO - Trial 211 finished with value: 0.11865796650429392 and parameters: {'n_layers': 1, 'embedding_dim': 256, 'lr': 0.0006223350073279788, 'lambda_val': 8.159511030236569e-05, 'batch_size': 1571, 'optimizer': 'Adam'}. Best is trial 185 with value: 0.12903275879492856.
2026-05-15 23:43:40,696 - experiment_functions - INFO - Early stopping at epoch 1450. Best Recall: 0.1192
2026-05-15 23:43:40,897 - optuna.study.study - INFO - Trial 212 finished with value: 0.11923287547831282 and parameters: {'n_layers': 1, 'embedding_dim': 256, 'lr': 0.0005776182447631862, 'lambda_val': 0.00014040149130691213, 'batch_size': 1410, 'optimizer': 'Adam'}. Best is trial 185 with value: 0.12903275879492856.
2026-05-15 23:43:48,231 - optuna.study._optimize - INFO - Trial 213 pruned. 
2026-05-15 23:43:55,172 - optuna.study._optimize - INFO - Trial 214 pruned. 
2026-05-15 23:44:01,839 - optuna.study._optimize - INFO - Trial 215 pruned. 
2026-05-15 23:44:08,771 - optuna.study._optimize - INFO - Trial 216 pruned. 
2026-05-15 23:44:23,872 - experiment_functions - INFO - Early stopping at epoch 1900. Best Recall: 0.1281
2026-05-15 23:44:23,962 - optuna.study.study - INFO - Trial 217 finished with value: 0.1281123375479065 and parameters: {'n_layers': 1, 'embedding_dim': 256, 'lr': 0.0005793064346296659, 'lambda_val': 8.916754311392411e-05, 'batch_size': 1575, 'optimizer': 'Adam'}. Best is trial 185 with value: 0.12903275879492856.
2026-05-15 23:44:27,826 - experiment_functions - INFO - Early stopping at epoch 500. Best Recall: 0.0020
2026-05-15 23:44:27,918 - optuna.study.study - INFO - Trial 218 finished with value: 0.0019943555511338553 and parameters: {'n_layers': 1, 'embedding_dim': 256, 'lr': 1.0373092748383623e-05, 'lambda_val': 8.112062346820222e-05, 'batch_size': 1556, 'optimizer': 'Adam'}. Best is trial 185 with value: 0.12903275879492856.
2026-05-15 23:44:39,559 - experiment_functions - INFO - Early stopping at epoch 1750. Best Recall: 0.1256
2026-05-15 23:44:39,662 - optuna.study.study - INFO - Trial 219 finished with value: 0.1255987979705863 and parameters: {'n_layers': 1, 'embedding_dim': 256, 'lr': 0.0005853169484001901, 'lambda_val': 4.919380157335932e-05, 'batch_size': 1476, 'optimizer': 'Adam'}. Best is trial 185 with value: 0.12903275879492856.
2026-05-15 23:44:49,284 - experiment_functions - INFO - Early stopping at epoch 1400. Best Recall: 0.1233
2026-05-15 23:44:49,376 - optuna.study.study - INFO - Trial 220 finished with value: 0.12334222579405987 and parameters: {'n_layers': 1, 'embedding_dim': 256, 'lr': 0.0006260239827375027, 'lambda_val': 3.628959827995539e-05, 'batch_size': 1415, 'optimizer': 'Adam'}. Best is trial 185 with value: 0.12903275879492856.
2026-05-15 23:44:59,556 - optuna.study._optimize - INFO - Trial 221 pruned. 
2026-05-15 23:45:07,944 - experiment_functions - INFO - Early stopping at epoch 1350. Best Recall: 0.1217
2026-05-15 23:45:08,036 - optuna.study.study - INFO - Trial 222 finished with value: 0.12168448154534466 and parameters: {'n_layers': 1, 'embedding_dim': 256, 'lr': 0.0007789594170005084, 'lambda_val': 4.6284173176591224e-05, 'batch_size': 1367, 'optimizer': 'Adam'}. Best is trial 185 with value: 0.12903275879492856.
2026-05-15 23:45:16,269 - experiment_functions - INFO - Early stopping at epoch 1250. Best Recall: 0.1227
2026-05-15 23:45:16,371 - optuna.study.study - INFO - Trial 223 finished with value: 0.12267715716497091 and parameters: {'n_layers': 1, 'embedding_dim': 256, 'lr': 0.0007907268421961644, 'lambda_val': 4.277791005906141e-05, 'batch_size': 1334, 'optimizer': 'Adam'}. Best is trial 185 with value: 0.12903275879492856.
2026-05-15 23:45:32,915 - experiment_functions - INFO - Early stopping at epoch 1150. Best Recall: 0.1182
2026-05-15 23:45:33,016 - optuna.study.study - INFO - Trial 224 finished with value: 0.11815411848554501 and parameters: {'n_layers': 1, 'embedding_dim': 256, 'lr': 0.000858082766784777, 'lambda_val': 1.9162999790004387e-05, 'batch_size': 1386, 'optimizer': 'Adam'}. Best is trial 185 with value: 0.12903275879492856.
2026-05-15 23:45:39,182 - experiment_functions - INFO - Early stopping at epoch 750. Best Recall: 0.0685
2026-05-15 23:45:39,318 - optuna.study.study - INFO - Trial 225 finished with value: 0.06854032721283379 and parameters: {'n_layers': 2, 'embedding_dim': 256, 'lr': 0.001039193981366834, 'lambda_val': 2.467097631590094e-05, 'batch_size': 1329, 'optimizer': 'Adam'}. Best is trial 185 with value: 0.12903275879492856.
2026-05-15 23:45:49,158 - experiment_functions - INFO - Early stopping at epoch 1400. Best Recall: 0.1178
2026-05-15 23:45:49,259 - optuna.study.study - INFO - Trial 226 finished with value: 0.11783172948161244 and parameters: {'n_layers': 1, 'embedding_dim': 256, 'lr': 0.0007564648448013741, 'lambda_val': 4.477737687004783e-05, 'batch_size': 1304, 'optimizer': 'Adam'}. Best is trial 185 with value: 0.12903275879492856.
2026-05-15 23:45:57,830 - experiment_functions - INFO - Early stopping at epoch 1250. Best Recall: 0.1134
2026-05-15 23:45:57,922 - optuna.study.study - INFO - Trial 227 finished with value: 0.11336688212188895 and parameters: {'n_layers': 1, 'embedding_dim': 256, 'lr': 0.0007791642989962909, 'lambda_val': 3.2069515691658295e-05, 'batch_size': 1410, 'optimizer': 'Adam'}. Best is trial 185 with value: 0.12903275879492856.
2026-05-15 23:46:04,688 - experiment_functions - INFO - Early stopping at epoch 950. Best Recall: 0.1048
2026-05-15 23:46:04,778 - optuna.study.study - INFO - Trial 228 finished with value: 0.1048300033888443 and parameters: {'n_layers': 1, 'embedding_dim': 256, 'lr': 0.001190436384098716, 'lambda_val': 4.5032939113886426e-05, 'batch_size': 1485, 'optimizer': 'Adam'}. Best is trial 185 with value: 0.12903275879492856.
2026-05-15 23:46:14,197 - experiment_functions - INFO - Early stopping at epoch 1400. Best Recall: 0.1195
2026-05-15 23:46:14,300 - optuna.study.study - INFO - Trial 229 finished with value: 0.11952786040755499 and parameters: {'n_layers': 1, 'embedding_dim': 256, 'lr': 0.0006973459630042003, 'lambda_val': 5.6102412423169806e-05, 'batch_size': 1377, 'optimizer': 'Adam'}. Best is trial 185 with value: 0.12903275879492856.
2026-05-15 23:46:22,772 - experiment_functions - INFO - Early stopping at epoch 950. Best Recall: 0.1209
2026-05-15 23:46:22,864 - optuna.study.study - INFO - Trial 230 finished with value: 0.12088003870239829 and parameters: {'n_layers': 1, 'embedding_dim': 256, 'lr': 0.0009633571252534326, 'lambda_val': 5.113420743470389e-05, 'batch_size': 2126, 'optimizer': 'Adam'}. Best is trial 185 with value: 0.12903275879492856.
2026-05-15 23:46:30,200 - optuna.study._optimize - INFO - Trial 231 pruned. 
2026-05-15 23:46:45,215 - experiment_functions - INFO - Early stopping at epoch 900. Best Recall: 0.1039
2026-05-15 23:46:45,306 - optuna.study.study - INFO - Trial 232 finished with value: 0.10393931298521308 and parameters: {'n_layers': 1, 'embedding_dim': 256, 'lr': 0.0010797375014378737, 'lambda_val': 4.662661720869785e-05, 'batch_size': 2119, 'optimizer': 'Adam'}. Best is trial 185 with value: 0.12903275879492856.
2026-05-15 23:46:52,442 - optuna.study._optimize - INFO - Trial 233 pruned. 
2026-05-15 23:46:59,887 - optuna.study._optimize - INFO - Trial 234 pruned. 
2026-05-15 23:47:11,056 - optuna.study._optimize - INFO - Trial 235 pruned. 
2026-05-15 23:47:27,943 - experiment_functions - INFO - Early stopping at epoch 1300. Best Recall: 0.1171
2026-05-15 23:47:28,054 - optuna.study.study - INFO - Trial 236 finished with value: 0.11713580442209755 and parameters: {'n_layers': 1, 'embedding_dim': 256, 'lr': 0.0006778674807012876, 'lambda_val': 3.8663455033483e-05, 'batch_size': 1456, 'optimizer': 'RMSprop'}. Best is trial 185 with value: 0.12903275879492856.
2026-05-15 23:47:34,042 - optuna.study._optimize - INFO - Trial 237 pruned. 
2026-05-15 23:47:47,163 - experiment_functions - INFO - Early stopping at epoch 2050. Best Recall: 0.1238
2026-05-15 23:47:47,254 - optuna.study.study - INFO - Trial 238 finished with value: 0.12375964586604252 and parameters: {'n_layers': 1, 'embedding_dim': 256, 'lr': 0.0004471359867253643, 'lambda_val': 6.234217273539257e-05, 'batch_size': 1777, 'optimizer': 'Adam'}. Best is trial 185 with value: 0.12903275879492856.
2026-05-15 23:47:59,693 - experiment_functions - INFO - Early stopping at epoch 1950. Best Recall: 0.1187
2026-05-15 23:47:59,784 - optuna.study.study - INFO - Trial 239 finished with value: 0.11865157086663974 and parameters: {'n_layers': 1, 'embedding_dim': 256, 'lr': 0.00045724613785382104, 'lambda_val': 8.461836269262941e-05, 'batch_size': 1850, 'optimizer': 'Adam'}. Best is trial 185 with value: 0.12903275879492856.
2026-05-15 23:48:03,959 - experiment_functions - INFO - Early stopping at epoch 500. Best Recall: 0.0019
2026-05-15 23:48:04,061 - optuna.study.study - INFO - Trial 240 finished with value: 0.0018560207176383863 and parameters: {'n_layers': 1, 'embedding_dim': 256, 'lr': 0.02624039613863575, 'lambda_val': 6.605866644198635e-05, 'batch_size': 1759, 'optimizer': 'SGD'}. Best is trial 185 with value: 0.12903275879492856.
2026-05-15 23:48:17,918 - experiment_functions - INFO - Early stopping at epoch 2050. Best Recall: 0.1230
2026-05-15 23:48:18,030 - optuna.study.study - INFO - Trial 241 finished with value: 0.1229526548700763 and parameters: {'n_layers': 1, 'embedding_dim': 256, 'lr': 0.000543517395959842, 'lambda_val': 5.100979180320876e-05, 'batch_size': 1675, 'optimizer': 'Adam'}. Best is trial 185 with value: 0.12903275879492856.
2026-05-15 23:48:31,891 - experiment_functions - INFO - Early stopping at epoch 1950. Best Recall: 0.1229
2026-05-15 23:48:31,982 - optuna.study.study - INFO - Trial 242 finished with value: 0.12286171439005308 and parameters: {'n_layers': 1, 'embedding_dim': 256, 'lr': 0.00042440367854234184, 'lambda_val': 4.9000610118713694e-05, 'batch_size': 1714, 'optimizer': 'Adam'}. Best is trial 185 with value: 0.12903275879492856.
2026-05-15 23:48:39,063 - optuna.study._optimize - INFO - Trial 243 pruned. 
2026-05-15 23:48:51,934 - experiment_functions - INFO - Early stopping at epoch 2000. Best Recall: 0.1199
2026-05-15 23:48:52,026 - optuna.study.study - INFO - Trial 244 finished with value: 0.11986048533859518 and parameters: {'n_layers': 1, 'embedding_dim': 256, 'lr': 0.0005502112791890511, 'lambda_val': 6.303836527562339e-05, 'batch_size': 1637, 'optimizer': 'Adam'}. Best is trial 185 with value: 0.12903275879492856.
2026-05-15 23:49:00,445 - optuna.study._optimize - INFO - Trial 245 pruned. 
2026-05-15 23:49:07,827 - optuna.study._optimize - INFO - Trial 246 pruned. 
2026-05-15 23:49:25,229 - experiment_functions - INFO - Early stopping at epoch 2750. Best Recall: 0.1305
2026-05-15 23:49:25,325 - optuna.study.study - INFO - Trial 247 finished with value: 0.13052294839490056 and parameters: {'n_layers': 1, 'embedding_dim': 256, 'lr': 0.00040776594255363197, 'lambda_val': 4.685369182821533e-05, 'batch_size': 1485, 'optimizer': 'Adam'}. Best is trial 247 with value: 0.13052294839490056.
2026-05-15 23:49:47,912 - experiment_functions - INFO - Early stopping at epoch 2950. Best Recall: 0.1277
2026-05-15 23:49:48,244 - optuna.study.study - INFO - Trial 248 finished with value: 0.1277371678020591 and parameters: {'n_layers': 1, 'embedding_dim': 256, 'lr': 0.0004210719575562053, 'lambda_val': 8.635274834942308e-05, 'batch_size': 1473, 'optimizer': 'Adam'}. Best is trial 247 with value: 0.13052294839490056.
2026-05-15 23:49:59,612 - optuna.study._optimize - INFO - Trial 249 pruned. 
2026-05-15 23:50:06,770 - optuna.study._optimize - INFO - Trial 250 pruned. 
2026-05-15 23:50:14,059 - optuna.study._optimize - INFO - Trial 251 pruned. 
2026-05-15 23:50:21,448 - optuna.study._optimize - INFO - Trial 252 pruned. 
2026-05-15 23:50:28,354 - optuna.study._optimize - INFO - Trial 253 pruned. 
2026-05-15 23:50:35,060 - optuna.study._optimize - INFO - Trial 254 pruned. 
2026-05-15 23:50:42,362 - optuna.study._optimize - INFO - Trial 255 pruned. 
2026-05-15 23:50:57,767 - experiment_functions - INFO - Early stopping at epoch 2450. Best Recall: 0.1221
2026-05-15 23:50:57,857 - optuna.study.study - INFO - Trial 256 finished with value: 0.12214018645566521 and parameters: {'n_layers': 1, 'embedding_dim': 256, 'lr': 0.000583646411848694, 'lambda_val': 6.420842804406346e-05, 'batch_size': 1557, 'optimizer': 'Adam'}. Best is trial 247 with value: 0.13052294839490056.
2026-05-15 23:51:04,837 - optuna.study._optimize - INFO - Trial 257 pruned. 
2026-05-15 23:51:11,643 - optuna.study._optimize - INFO - Trial 258 pruned. 
2026-05-15 23:51:20,937 - experiment_functions - INFO - Early stopping at epoch 1350. Best Recall: 0.1166
2026-05-15 23:51:21,027 - optuna.study.study - INFO - Trial 259 finished with value: 0.11661432109474991 and parameters: {'n_layers': 1, 'embedding_dim': 256, 'lr': 0.0006147147824825152, 'lambda_val': 2.181891242135877e-05, 'batch_size': 1790, 'optimizer': 'Adam'}. Best is trial 247 with value: 0.13052294839490056.
2026-05-15 23:51:27,709 - optuna.study._optimize - INFO - Trial 260 pruned. 
2026-05-15 23:51:35,796 - optuna.study._optimize - INFO - Trial 261 pruned. 
2026-05-15 23:51:42,600 - optuna.study._optimize - INFO - Trial 262 pruned. 
2026-05-15 23:51:49,502 - optuna.study._optimize - INFO - Trial 263 pruned. 
2026-05-15 23:52:00,097 - optuna.study._optimize - INFO - Trial 264 pruned. 
2026-05-15 23:52:07,385 - optuna.study._optimize - INFO - Trial 265 pruned. 
2026-05-15 23:52:14,123 - optuna.study._optimize - INFO - Trial 266 pruned. 
2026-05-15 23:52:21,345 - optuna.study._optimize - INFO - Trial 267 pruned. 
2026-05-15 23:52:28,309 - optuna.study._optimize - INFO - Trial 268 pruned. 
2026-05-15 23:52:34,903 - optuna.study._optimize - INFO - Trial 269 pruned. 
2026-05-15 23:52:38,814 - experiment_functions - INFO - Early stopping at epoch 500. Best Recall: 0.0020
2026-05-15 23:52:38,903 - optuna.study.study - INFO - Trial 270 finished with value: 0.0019998305238577065 and parameters: {'n_layers': 1, 'embedding_dim': 256, 'lr': 0.00071282896678483, 'lambda_val': 8.360189484036598e-05, 'batch_size': 1820, 'optimizer': 'SGD'}. Best is trial 247 with value: 0.13052294839490056.
2026-05-15 23:52:45,556 - optuna.study._optimize - INFO - Trial 271 pruned. 
2026-05-15 23:52:52,370 - optuna.study._optimize - INFO - Trial 272 pruned. 
2026-05-15 23:53:00,538 - optuna.study._optimize - INFO - Trial 273 pruned. 
2026-05-15 23:53:07,065 - optuna.study._optimize - INFO - Trial 274 pruned. 
2026-05-15 23:53:14,718 - experiment_functions - INFO - Early stopping at epoch 1150. Best Recall: 0.1152
2026-05-15 23:53:14,807 - optuna.study.study - INFO - Trial 275 finished with value: 0.11524177156069956 and parameters: {'n_layers': 1, 'embedding_dim': 256, 'lr': 0.000844588066299662, 'lambda_val': 0.00010387911581267164, 'batch_size': 1756, 'optimizer': 'Adam'}. Best is trial 247 with value: 0.13052294839490056.
2026-05-15 23:53:26,258 - experiment_functions - INFO - Early stopping at epoch 1750. Best Recall: 0.1172
2026-05-15 23:53:26,358 - optuna.study.study - INFO - Trial 276 finished with value: 0.1171709012463308 and parameters: {'n_layers': 1, 'embedding_dim': 256, 'lr': 0.0005658806580621397, 'lambda_val': 6.41896240655e-05, 'batch_size': 1869, 'optimizer': 'Adam'}. Best is trial 247 with value: 0.13052294839490056.
2026-05-15 23:53:33,537 - optuna.study._optimize - INFO - Trial 277 pruned. 
2026-05-15 23:53:42,801 - optuna.study._optimize - INFO - Trial 278 pruned. 
2026-05-15 23:53:52,367 - experiment_functions - INFO - Early stopping at epoch 1550. Best Recall: 0.1175
2026-05-15 23:53:52,467 - optuna.study.study - INFO - Trial 279 finished with value: 0.11747740680022874 and parameters: {'n_layers': 1, 'embedding_dim': 256, 'lr': 0.0007144851378822517, 'lambda_val': 8.44728924745276e-05, 'batch_size': 1430, 'optimizer': 'Adam'}. Best is trial 247 with value: 0.13052294839490056.
2026-05-15 23:53:59,661 - optuna.study._optimize - INFO - Trial 280 pruned. 
2026-05-15 23:54:10,024 - experiment_functions - INFO - Early stopping at epoch 1550. Best Recall: 0.1249
2026-05-15 23:54:10,144 - optuna.study.study - INFO - Trial 281 finished with value: 0.1249064207687778 and parameters: {'n_layers': 1, 'embedding_dim': 256, 'lr': 0.0005356301528757529, 'lambda_val': 4.145250918516441e-05, 'batch_size': 1595, 'optimizer': 'Adam'}. Best is trial 247 with value: 0.13052294839490056.
2026-05-15 23:54:22,533 - experiment_functions - INFO - Early stopping at epoch 1950. Best Recall: 0.1212
2026-05-15 23:54:22,645 - optuna.study.study - INFO - Trial 282 finished with value: 0.12124823402987898 and parameters: {'n_layers': 1, 'embedding_dim': 256, 'lr': 0.0005704704814270834, 'lambda_val': 4.1118350884656334e-05, 'batch_size': 1563, 'optimizer': 'Adam'}. Best is trial 247 with value: 0.13052294839490056.
2026-05-15 23:54:29,536 - optuna.study._optimize - INFO - Trial 283 pruned. 
2026-05-15 23:54:36,800 - optuna.study._optimize - INFO - Trial 284 pruned. 
2026-05-15 23:54:46,659 - experiment_functions - INFO - Early stopping at epoch 1500. Best Recall: 0.1161
2026-05-15 23:54:46,748 - optuna.study.study - INFO - Trial 285 finished with value: 0.11614356263373728 and parameters: {'n_layers': 1, 'embedding_dim': 256, 'lr': 0.00046938486814381995, 'lambda_val': 5.889102846221552e-05, 'batch_size': 1606, 'optimizer': 'RMSprop'}. Best is trial 247 with value: 0.13052294839490056.
2026-05-15 23:54:52,953 - experiment_functions - INFO - Early stopping at epoch 800. Best Recall: 0.0748
