2026-05-16 00:48:07,009 - optuna.study.study - INFO - Trial 49 finished with value: 0.011462215980742764 and parameters: {'n_layers': 1, 'embedding_dim': 256, 'lr': 0.00023379554288634248, 'lambda_val': 0.02111002475759022, 'batch_size': 1767, 'optimizer': 'RMSprop'}. Best is trial 19 with value: 0.020649880321361416.
2026-05-16 00:48:15,453 - optuna.study._optimize - INFO - Trial 50 pruned. 
2026-05-16 00:48:19,369 - experiment_functions - INFO - Early stopping at epoch 600. Best Recall: 0.0111
2026-05-16 00:48:19,472 - optuna.study.study - INFO - Trial 51 finished with value: 0.011130315597032786 and parameters: {'n_layers': 1, 'embedding_dim': 32, 'lr': 0.0018846298188048298, 'lambda_val': 6.1094326832343295e-06, 'batch_size': 1518, 'optimizer': 'Adam'}. Best is trial 19 with value: 0.020649880321361416.
2026-05-16 00:48:23,610 - experiment_functions - INFO - Early stopping at epoch 600. Best Recall: 0.0084
2026-05-16 00:48:23,714 - optuna.study.study - INFO - Trial 52 finished with value: 0.00835333467410314 and parameters: {'n_layers': 1, 'embedding_dim': 32, 'lr': 0.0022141422355738175, 'lambda_val': 9.468898459629088e-06, 'batch_size': 1869, 'optimizer': 'Adam'}. Best is trial 19 with value: 0.020649880321361416.
2026-05-16 00:48:28,314 - experiment_functions - INFO - Early stopping at epoch 700. Best Recall: 0.0115
2026-05-16 00:48:28,397 - optuna.study.study - INFO - Trial 53 finished with value: 0.01149075772195814 and parameters: {'n_layers': 1, 'embedding_dim': 96, 'lr': 0.0008970040173036463, 'lambda_val': 3.4722054438453426e-06, 'batch_size': 1667, 'optimizer': 'Adam'}. Best is trial 19 with value: 0.020649880321361416.
2026-05-16 00:48:31,420 - experiment_functions - INFO - Early stopping at epoch 500. Best Recall: 0.0027
2026-05-16 00:48:31,513 - optuna.study.study - INFO - Trial 54 finished with value: 0.0027399661079074407 and parameters: {'n_layers': 1, 'embedding_dim': 32, 'lr': 0.0014518171199646985, 'lambda_val': 1.7033422717616143e-06, 'batch_size': 1242, 'optimizer': 'SGD'}. Best is trial 19 with value: 0.020649880321361416.
2026-05-16 00:48:35,137 - experiment_functions - INFO - Early stopping at epoch 550. Best Recall: 0.0176
2026-05-16 00:48:35,229 - optuna.study.study - INFO - Trial 55 finished with value: 0.017648485039985895 and parameters: {'n_layers': 1, 'embedding_dim': 256, 'lr': 0.0027190410262238826, 'lambda_val': 0.0008350146581753412, 'batch_size': 994, 'optimizer': 'Adam'}. Best is trial 19 with value: 0.020649880321361416.
2026-05-16 00:48:38,735 - experiment_functions - INFO - Early stopping at epoch 550. Best Recall: 0.0182
2026-05-16 00:48:38,827 - optuna.study.study - INFO - Trial 56 finished with value: 0.018225570878548324 and parameters: {'n_layers': 1, 'embedding_dim': 256, 'lr': 0.0048163379002705495, 'lambda_val': 0.0013701130860410968, 'batch_size': 1001, 'optimizer': 'Adam'}. Best is trial 19 with value: 0.020649880321361416.
2026-05-16 00:48:42,702 - experiment_functions - INFO - Early stopping at epoch 550. Best Recall: 0.0206
2026-05-16 00:48:42,999 - optuna.study.study - INFO - Trial 57 finished with value: 0.020624675981902253 and parameters: {'n_layers': 1, 'embedding_dim': 256, 'lr': 0.00437329239034135, 'lambda_val': 0.0014016110147634262, 'batch_size': 519, 'optimizer': 'Adam'}. Best is trial 19 with value: 0.020649880321361416.
2026-05-16 00:48:48,939 - optuna.study._optimize - INFO - Trial 58 pruned. 
2026-05-16 00:48:53,566 - experiment_functions - INFO - Early stopping at epoch 800. Best Recall: 0.0115
2026-05-16 00:48:53,648 - optuna.study.study - INFO - Trial 59 finished with value: 0.011488290216053373 and parameters: {'n_layers': 2, 'embedding_dim': 64, 'lr': 0.00042469213920445363, 'lambda_val': 0.003348613867472471, 'batch_size': 732, 'optimizer': 'Adam'}. Best is trial 19 with value: 0.020649880321361416.
2026-05-16 00:49:00,071 - optuna.study._optimize - INFO - Trial 60 pruned. 
2026-05-16 00:49:03,916 - experiment_functions - INFO - Early stopping at epoch 550. Best Recall: 0.0193
2026-05-16 00:49:04,009 - optuna.study.study - INFO - Trial 61 finished with value: 0.019326816963700928 and parameters: {'n_layers': 1, 'embedding_dim': 256, 'lr': 0.004613853268417439, 'lambda_val': 0.001235963287542556, 'batch_size': 513, 'optimizer': 'Adam'}. Best is trial 19 with value: 0.020649880321361416.
2026-05-16 00:49:07,780 - experiment_functions - INFO - Early stopping at epoch 550. Best Recall: 0.0175
2026-05-16 00:49:07,893 - optuna.study.study - INFO - Trial 62 finished with value: 0.017491402284041706 and parameters: {'n_layers': 1, 'embedding_dim': 256, 'lr': 0.00392343756721532, 'lambda_val': 0.0011321034900721525, 'batch_size': 587, 'optimizer': 'Adam'}. Best is trial 19 with value: 0.020649880321361416.
2026-05-16 00:49:12,224 - experiment_functions - INFO - Early stopping at epoch 650. Best Recall: 0.0182
2026-05-16 00:49:12,327 - optuna.study.study - INFO - Trial 63 finished with value: 0.018228413844168994 and parameters: {'n_layers': 1, 'embedding_dim': 256, 'lr': 0.0015038878764318526, 'lambda_val': 0.0004167552061150894, 'batch_size': 532, 'optimizer': 'Adam'}. Best is trial 19 with value: 0.020649880321361416.
2026-05-16 00:49:16,186 - experiment_functions - INFO - Early stopping at epoch 550. Best Recall: 0.0131
2026-05-16 00:49:16,268 - optuna.study.study - INFO - Trial 64 finished with value: 0.013071876445869811 and parameters: {'n_layers': 1, 'embedding_dim': 256, 'lr': 0.006670447845581296, 'lambda_val': 0.0017447317297935516, 'batch_size': 738, 'optimizer': 'Adam'}. Best is trial 19 with value: 0.020649880321361416.
2026-05-16 00:49:19,862 - experiment_functions - INFO - Early stopping at epoch 550. Best Recall: 0.0119
2026-05-16 00:49:19,954 - optuna.study.study - INFO - Trial 65 finished with value: 0.011930132129254636 and parameters: {'n_layers': 1, 'embedding_dim': 96, 'lr': 0.009218984976710832, 'lambda_val': 0.0007005928334937473, 'batch_size': 782, 'optimizer': 'Adam'}. Best is trial 19 with value: 0.020649880321361416.
2026-05-16 00:49:23,032 - experiment_functions - INFO - Early stopping at epoch 500. Best Recall: 0.0022
2026-05-16 00:49:23,126 - optuna.study.study - INFO - Trial 66 finished with value: 0.002226409967429134 and parameters: {'n_layers': 1, 'embedding_dim': 128, 'lr': 0.0010276466533420984, 'lambda_val': 0.008075400358160057, 'batch_size': 1080, 'optimizer': 'SGD'}. Best is trial 19 with value: 0.020649880321361416.
2026-05-16 00:49:26,726 - experiment_functions - INFO - Early stopping at epoch 550. Best Recall: 0.0146
2026-05-16 00:49:26,820 - optuna.study.study - INFO - Trial 67 finished with value: 0.014636268598701886 and parameters: {'n_layers': 2, 'embedding_dim': 64, 'lr': 0.003214340805148024, 'lambda_val': 0.0028423799391304053, 'batch_size': 913, 'optimizer': 'Adam'}. Best is trial 19 with value: 0.020649880321361416.
2026-05-16 00:49:31,544 - experiment_functions - INFO - Early stopping at epoch 650. Best Recall: 0.0091
2026-05-16 00:49:31,649 - optuna.study.study - INFO - Trial 68 finished with value: 0.009128859717042186 and parameters: {'n_layers': 1, 'embedding_dim': 256, 'lr': 0.0005232118706624929, 'lambda_val': 0.005062291959673022, 'batch_size': 3592, 'optimizer': 'Adam'}. Best is trial 19 with value: 0.020649880321361416.
2026-05-16 00:49:36,443 - experiment_functions - INFO - Early stopping at epoch 700. Best Recall: 0.0163
2026-05-16 00:49:36,559 - optuna.study.study - INFO - Trial 69 finished with value: 0.016314485879050558 and parameters: {'n_layers': 1, 'embedding_dim': 256, 'lr': 0.0008357937795919717, 'lambda_val': 0.000579433358591779, 'batch_size': 1181, 'optimizer': 'Adam'}. Best is trial 19 with value: 0.020649880321361416.
2026-05-16 00:49:42,343 - optuna.study._optimize - INFO - Trial 70 pruned. 
2026-05-16 00:49:46,832 - experiment_functions - INFO - Early stopping at epoch 650. Best Recall: 0.0190
2026-05-16 00:49:46,927 - optuna.study.study - INFO - Trial 71 finished with value: 0.018965863767256536 and parameters: {'n_layers': 1, 'embedding_dim': 256, 'lr': 0.0013848469118639872, 'lambda_val': 0.0003276320064614807, 'batch_size': 529, 'optimizer': 'Adam'}. Best is trial 19 with value: 0.020649880321361416.
2026-05-16 00:49:51,141 - experiment_functions - INFO - Early stopping at epoch 650. Best Recall: 0.0199
2026-05-16 00:49:51,245 - optuna.study.study - INFO - Trial 72 finished with value: 0.019877570753452575 and parameters: {'n_layers': 1, 'embedding_dim': 256, 'lr': 0.0013581556664534142, 'lambda_val': 0.0002852830609774418, 'batch_size': 663, 'optimizer': 'Adam'}. Best is trial 19 with value: 0.020649880321361416.
2026-05-16 00:49:55,745 - experiment_functions - INFO - Early stopping at epoch 550. Best Recall: 0.0071
2026-05-16 00:49:55,861 - optuna.study.study - INFO - Trial 73 finished with value: 0.007114419029978064 and parameters: {'n_layers': 4, 'embedding_dim': 256, 'lr': 0.0012535506168938773, 'lambda_val': 0.002024897720082787, 'batch_size': 527, 'optimizer': 'Adam'}. Best is trial 19 with value: 0.020649880321361416.
2026-05-16 00:49:59,352 - experiment_functions - INFO - Early stopping at epoch 550. Best Recall: 0.0188
2026-05-16 00:49:59,445 - optuna.study.study - INFO - Trial 74 finished with value: 0.018816203518961096 and parameters: {'n_layers': 1, 'embedding_dim': 256, 'lr': 0.005720714400486581, 'lambda_val': 0.000261346047651548, 'batch_size': 682, 'optimizer': 'Adam'}. Best is trial 19 with value: 0.020649880321361416.
2026-05-16 00:50:03,348 - experiment_functions - INFO - Early stopping at epoch 550. Best Recall: 0.0248
2026-05-16 00:50:03,434 - optuna.study.study - INFO - Trial 75 finished with value: 0.02482134338591816 and parameters: {'n_layers': 1, 'embedding_dim': 256, 'lr': 0.003946832339323269, 'lambda_val': 0.00011277326542059013, 'batch_size': 659, 'optimizer': 'Adam'}. Best is trial 75 with value: 0.02482134338591816.
2026-05-16 00:50:06,989 - experiment_functions - INFO - Early stopping at epoch 550. Best Recall: 0.0183
2026-05-16 00:50:07,138 - optuna.study.study - INFO - Trial 76 finished with value: 0.018291257102161826 and parameters: {'n_layers': 1, 'embedding_dim': 256, 'lr': 0.004151486430640758, 'lambda_val': 5.1412205692493727e-05, 'batch_size': 917, 'optimizer': 'Adam'}. Best is trial 75 with value: 0.02482134338591816.
2026-05-16 00:50:11,124 - experiment_functions - INFO - Early stopping at epoch 600. Best Recall: 0.0160
2026-05-16 00:50:11,206 - optuna.study.study - INFO - Trial 77 finished with value: 0.01599971097865876 and parameters: {'n_layers': 1, 'embedding_dim': 256, 'lr': 0.0026695130868362987, 'lambda_val': 0.00011694020966263293, 'batch_size': 513, 'optimizer': 'Adam'}. Best is trial 75 with value: 0.02482134338591816.
2026-05-16 00:50:14,865 - experiment_functions - INFO - Early stopping at epoch 550. Best Recall: 0.0141
2026-05-16 00:50:14,947 - optuna.study.study - INFO - Trial 78 finished with value: 0.014090650208599518 and parameters: {'n_layers': 1, 'embedding_dim': 256, 'lr': 0.00842914565480222, 'lambda_val': 0.0004615894510887348, 'batch_size': 645, 'optimizer': 'Adam'}. Best is trial 75 with value: 0.02482134338591816.
2026-05-16 00:50:19,369 - experiment_functions - INFO - Early stopping at epoch 650. Best Recall: 0.0198
2026-05-16 00:50:19,463 - optuna.study.study - INFO - Trial 79 finished with value: 0.019807545528884196 and parameters: {'n_layers': 1, 'embedding_dim': 256, 'lr': 0.0015598931680805771, 'lambda_val': 8.685206823393634e-05, 'batch_size': 793, 'optimizer': 'Adam'}. Best is trial 75 with value: 0.02482134338591816.
2026-05-16 00:50:22,977 - experiment_functions - INFO - Early stopping at epoch 550. Best Recall: 0.0182
2026-05-16 00:50:23,070 - optuna.study.study - INFO - Trial 80 finished with value: 0.018162941460541787 and parameters: {'n_layers': 1, 'embedding_dim': 256, 'lr': 0.0035212128311518094, 'lambda_val': 7.593568748228487e-05, 'batch_size': 813, 'optimizer': 'Adam'}. Best is trial 75 with value: 0.02482134338591816.
2026-05-16 00:50:27,196 - experiment_functions - INFO - Early stopping at epoch 650. Best Recall: 0.0157
2026-05-16 00:50:27,311 - optuna.study.study - INFO - Trial 81 finished with value: 0.015659709931478125 and parameters: {'n_layers': 1, 'embedding_dim': 256, 'lr': 0.0013798343842441076, 'lambda_val': 0.0010573690019373794, 'batch_size': 678, 'optimizer': 'Adam'}. Best is trial 75 with value: 0.02482134338591816.
2026-05-16 00:50:31,324 - experiment_functions - INFO - Early stopping at epoch 600. Best Recall: 0.0160
2026-05-16 00:50:31,440 - optuna.study.study - INFO - Trial 82 finished with value: 0.016023110759309168 and parameters: {'n_layers': 1, 'embedding_dim': 256, 'lr': 0.002311547919085387, 'lambda_val': 0.00015258675951375855, 'batch_size': 780, 'optimizer': 'Adam'}. Best is trial 75 with value: 0.02482134338591816.
2026-05-16 00:50:35,377 - experiment_functions - INFO - Early stopping at epoch 500. Best Recall: 0.0022
2026-05-16 00:50:35,493 - optuna.study.study - INFO - Trial 83 finished with value: 0.0021980010196784453 and parameters: {'n_layers': 1, 'embedding_dim': 256, 'lr': 1.41944918850895e-05, 'lambda_val': 9.159436757140626e-05, 'batch_size': 623, 'optimizer': 'Adam'}. Best is trial 75 with value: 0.02482134338591816.
2026-05-16 00:50:39,509 - experiment_functions - INFO - Early stopping at epoch 550. Best Recall: 0.0160
2026-05-16 00:50:39,625 - optuna.study.study - INFO - Trial 84 finished with value: 0.015957137059852855 and parameters: {'n_layers': 1, 'embedding_dim': 256, 'lr': 0.006114430627395419, 'lambda_val': 0.00031214427154965433, 'batch_size': 879, 'optimizer': 'Adam'}. Best is trial 75 with value: 0.02482134338591816.
2026-05-16 00:50:44,148 - experiment_functions - INFO - Early stopping at epoch 650. Best Recall: 0.0153
2026-05-16 00:50:44,254 - optuna.study.study - INFO - Trial 85 finished with value: 0.015252079551787834 and parameters: {'n_layers': 1, 'embedding_dim': 256, 'lr': 0.0011011273898776648, 'lambda_val': 0.00022974692959849708, 'batch_size': 962, 'optimizer': 'Adam'}. Best is trial 75 with value: 0.02482134338591816.
2026-05-16 00:50:48,575 - experiment_functions - INFO - Early stopping at epoch 650. Best Recall: 0.0148
2026-05-16 00:50:48,667 - optuna.study.study - INFO - Trial 86 finished with value: 0.014825650649768759 and parameters: {'n_layers': 1, 'embedding_dim': 256, 'lr': 0.0016077573590165702, 'lambda_val': 3.2319841060960216e-05, 'batch_size': 514, 'optimizer': 'Adam'}. Best is trial 75 with value: 0.02482134338591816.
2026-05-16 00:50:52,437 - experiment_functions - INFO - Early stopping at epoch 500. Best Recall: 0.0012
2026-05-16 00:50:52,518 - optuna.study.study - INFO - Trial 87 finished with value: 0.0011985614527007641 and parameters: {'n_layers': 1, 'embedding_dim': 256, 'lr': 0.0006686036345092854, 'lambda_val': 1.9044645932600148e-05, 'batch_size': 725, 'optimizer': 'SGD'}. Best is trial 75 with value: 0.02482134338591816.
2026-05-16 00:50:56,249 - experiment_functions - INFO - Early stopping at epoch 600. Best Recall: 0.0159
2026-05-16 00:50:56,354 - optuna.study.study - INFO - Trial 88 finished with value: 0.015914302204795176 and parameters: {'n_layers': 1, 'embedding_dim': 96, 'lr': 0.0029467349909356325, 'lambda_val': 0.00014426327840762088, 'batch_size': 1106, 'optimizer': 'Adam'}. Best is trial 75 with value: 0.02482134338591816.
2026-05-16 00:51:02,615 - optuna.study._optimize - INFO - Trial 89 pruned. 
2026-05-16 00:51:07,064 - experiment_functions - INFO - Early stopping at epoch 550. Best Recall: 0.0163
2026-05-16 00:51:07,168 - optuna.study.study - INFO - Trial 90 finished with value: 0.01634264179834102 and parameters: {'n_layers': 3, 'embedding_dim': 256, 'lr': 0.0020754970319356233, 'lambda_val': 6.349603044988616e-05, 'batch_size': 608, 'optimizer': 'Adam'}. Best is trial 75 with value: 0.02482134338591816.
2026-05-16 00:51:10,882 - experiment_functions - INFO - Early stopping at epoch 550. Best Recall: 0.0165
2026-05-16 00:51:10,975 - optuna.study.study - INFO - Trial 91 finished with value: 0.016529499994604208 and parameters: {'n_layers': 1, 'embedding_dim': 256, 'lr': 0.005658182913395868, 'lambda_val': 0.0003055391151288718, 'batch_size': 694, 'optimizer': 'Adam'}. Best is trial 75 with value: 0.02482134338591816.
2026-05-16 00:51:14,479 - experiment_functions - INFO - Early stopping at epoch 550. Best Recall: 0.0217
2026-05-16 00:51:14,572 - optuna.study.study - INFO - Trial 92 finished with value: 0.021663305217040185 and parameters: {'n_layers': 1, 'embedding_dim': 256, 'lr': 0.004418707003465877, 'lambda_val': 9.908977269289276e-05, 'batch_size': 822, 'optimizer': 'Adam'}. Best is trial 75 with value: 0.02482134338591816.
2026-05-16 00:51:18,454 - experiment_functions - INFO - Early stopping at epoch 550. Best Recall: 0.0243
2026-05-16 00:51:18,548 - optuna.study.study - INFO - Trial 93 finished with value: 0.024290612207092582 and parameters: {'n_layers': 1, 'embedding_dim': 256, 'lr': 0.004013408994339701, 'lambda_val': 0.00010035486177117248, 'batch_size': 836, 'optimizer': 'Adam'}. Best is trial 75 with value: 0.02482134338591816.
2026-05-16 00:51:22,610 - experiment_functions - INFO - Early stopping at epoch 550. Best Recall: 0.0182
2026-05-16 00:51:22,714 - optuna.study.study - INFO - Trial 94 finished with value: 0.01819717528310249 and parameters: {'n_layers': 1, 'embedding_dim': 256, 'lr': 0.004272588426713754, 'lambda_val': 4.2300614579119283e-05, 'batch_size': 778, 'optimizer': 'Adam'}. Best is trial 75 with value: 0.02482134338591816.
2026-05-16 00:51:26,483 - experiment_functions - INFO - Early stopping at epoch 550. Best Recall: 0.0193
2026-05-16 00:51:26,610 - optuna.study.study - INFO - Trial 95 finished with value: 0.01930318213272346 and parameters: {'n_layers': 1, 'embedding_dim': 64, 'lr': 0.003516457882799844, 'lambda_val': 0.00012242993992400114, 'batch_size': 863, 'optimizer': 'Adam'}. Best is trial 75 with value: 0.02482134338591816.
2026-05-16 00:51:30,146 - experiment_functions - INFO - Early stopping at epoch 550. Best Recall: 0.0123
2026-05-16 00:51:30,263 - optuna.study.study - INFO - Trial 96 finished with value: 0.012263983668018652 and parameters: {'n_layers': 1, 'embedding_dim': 64, 'lr': 0.01215441104103729, 'lambda_val': 9.846813637096009e-05, 'batch_size': 829, 'optimizer': 'Adam'}. Best is trial 75 with value: 0.02482134338591816.
2026-05-16 00:51:33,541 - experiment_functions - INFO - Early stopping at epoch 500. Best Recall: 0.0028
2026-05-16 00:51:33,633 - optuna.study.study - INFO - Trial 97 finished with value: 0.0027933081847782127 and parameters: {'n_layers': 1, 'embedding_dim': 64, 'lr': 5.6614730490871145e-05, 'lambda_val': 4.18490865107691e-05, 'batch_size': 986, 'optimizer': 'Adam'}. Best is trial 75 with value: 0.02482134338591816.
2026-05-16 00:51:37,883 - experiment_functions - INFO - Early stopping at epoch 550. Best Recall: 0.0066
2026-05-16 00:51:37,976 - optuna.study.study - INFO - Trial 98 finished with value: 0.006606820177476955 and parameters: {'n_layers': 2, 'embedding_dim': 64, 'lr': 0.008035074677628658, 'lambda_val': 0.00011656571497955112, 'batch_size': 885, 'optimizer': 'Adam'}. Best is trial 75 with value: 0.02482134338591816.
2026-05-16 00:51:43,969 - experiment_functions - INFO - Early stopping at epoch 550. Best Recall: 0.0164
2026-05-16 00:51:44,073 - optuna.study.study - INFO - Trial 99 finished with value: 0.016400974736583536 and parameters: {'n_layers': 1, 'embedding_dim': 64, 'lr': 0.0037080527377121634, 'lambda_val': 0.000201153232197829, 'batch_size': 1102, 'optimizer': 'Adam'}. Best is trial 75 with value: 0.02482134338591816.
2026-05-16 00:51:47,937 - experiment_functions - INFO - Early stopping at epoch 550. Best Recall: 0.0200
2026-05-16 00:51:48,053 - optuna.study.study - INFO - Trial 100 finished with value: 0.019993156123871363 and parameters: {'n_layers': 1, 'embedding_dim': 64, 'lr': 0.004878593541907939, 'lambda_val': 6.394343196825506e-05, 'batch_size': 625, 'optimizer': 'Adam'}. Best is trial 75 with value: 0.02482134338591816.
2026-05-16 00:52:00,702 - experiment_functions - INFO - Early stopping at epoch 550. Best Recall: 0.0228
2026-05-16 00:52:00,829 - optuna.study.study - INFO - Trial 101 finished with value: 0.022788864792683505 and parameters: {'n_layers': 1, 'embedding_dim': 64, 'lr': 0.004957065869717554, 'lambda_val': 6.257856621668294e-05, 'batch_size': 617, 'optimizer': 'Adam'}. Best is trial 75 with value: 0.02482134338591816.
2026-05-16 00:52:04,873 - experiment_functions - INFO - Early stopping at epoch 550. Best Recall: 0.0235
2026-05-16 00:52:04,956 - optuna.study.study - INFO - Trial 102 finished with value: 0.023469400768692077 and parameters: {'n_layers': 1, 'embedding_dim': 64, 'lr': 0.006784645307507915, 'lambda_val': 6.550198040114935e-05, 'batch_size': 609, 'optimizer': 'Adam'}. Best is trial 75 with value: 0.02482134338591816.
2026-05-16 00:52:08,282 - experiment_functions - INFO - Early stopping at epoch 550. Best Recall: 0.0137
2026-05-16 00:52:08,364 - optuna.study.study - INFO - Trial 103 finished with value: 0.013714811882521336 and parameters: {'n_layers': 1, 'embedding_dim': 64, 'lr': 0.014194156947705028, 'lambda_val': 6.506213104839485e-05, 'batch_size': 624, 'optimizer': 'Adam'}. Best is trial 75 with value: 0.02482134338591816.
2026-05-16 00:52:11,922 - experiment_functions - INFO - Early stopping at epoch 550. Best Recall: 0.0081
2026-05-16 00:52:12,026 - optuna.study.study - INFO - Trial 104 finished with value: 0.008082063938837888 and parameters: {'n_layers': 1, 'embedding_dim': 64, 'lr': 0.02001197399839487, 'lambda_val': 1.9204490094379082e-05, 'batch_size': 752, 'optimizer': 'Adam'}. Best is trial 75 with value: 0.02482134338591816.
2026-05-16 00:52:18,231 - experiment_functions - INFO - Early stopping at epoch 500. Best Recall: 0.0015
