2026-05-15 22:50:01,506 - optuna.study.study - INFO - Trial 134 finished with value: 0.05867682104168686 and parameters: {'n_layers': 3, 'embedding_dim': 256, 'lr': 0.0007853464492102889, 'lambda_val': 3.0090815600223577e-05, 'batch_size': 1100, 'optimizer': 'Adam'}. Best is trial 132 with value: 0.13034017436135367.
2026-05-15 22:50:20,541 - experiment_functions - INFO - Early stopping at epoch 2850. Best Recall: 0.1325
2026-05-15 22:50:20,647 - optuna.study.study - INFO - Trial 135 finished with value: 0.13254127356915424 and parameters: {'n_layers': 1, 'embedding_dim': 256, 'lr': 0.0004245232612354984, 'lambda_val': 2.3719761293694542e-05, 'batch_size': 1248, 'optimizer': 'Adam'}. Best is trial 135 with value: 0.13254127356915424.
2026-05-15 22:50:27,057 - optuna.study._optimize - INFO - Trial 136 pruned. 
2026-05-15 22:50:34,079 - optuna.study._optimize - INFO - Trial 137 pruned. 
2026-05-15 22:50:40,997 - optuna.study._optimize - INFO - Trial 138 pruned. 
2026-05-15 22:50:48,364 - optuna.study._optimize - INFO - Trial 139 pruned. 
2026-05-15 22:50:55,788 - optuna.study._optimize - INFO - Trial 140 pruned. 
2026-05-15 22:51:02,390 - optuna.study._optimize - INFO - Trial 141 pruned. 
2026-05-15 22:51:08,788 - optuna.study._optimize - INFO - Trial 142 pruned. 
2026-05-15 22:51:17,605 - optuna.study._optimize - INFO - Trial 143 pruned. 
2026-05-15 22:51:26,997 - experiment_functions - INFO - Early stopping at epoch 1500. Best Recall: 0.1283
2026-05-15 22:51:27,097 - optuna.study.study - INFO - Trial 144 finished with value: 0.12829937314017023 and parameters: {'n_layers': 1, 'embedding_dim': 256, 'lr': 0.0006754802491120515, 'lambda_val': 1.1281412174872686e-05, 'batch_size': 1480, 'optimizer': 'Adam'}. Best is trial 135 with value: 0.13254127356915424.
2026-05-15 22:51:34,407 - optuna.study._optimize - INFO - Trial 145 pruned. 
2026-05-15 22:51:41,353 - optuna.study._optimize - INFO - Trial 146 pruned. 
2026-05-15 22:51:49,732 - optuna.study._optimize - INFO - Trial 147 pruned. 
2026-05-15 22:51:52,967 - experiment_functions - INFO - Early stopping at epoch 500. Best Recall: 0.0031
2026-05-15 22:51:53,068 - optuna.study.study - INFO - Trial 148 finished with value: 0.0031390332645461275 and parameters: {'n_layers': 1, 'embedding_dim': 64, 'lr': 0.0002573411458482308, 'lambda_val': 6.299750633771032e-06, 'batch_size': 1660, 'optimizer': 'SGD'}. Best is trial 135 with value: 0.13254127356915424.
2026-05-15 22:52:00,568 - optuna.study._optimize - INFO - Trial 149 pruned. 
2026-05-15 22:52:08,169 - optuna.study._optimize - INFO - Trial 150 pruned. 
2026-05-15 22:52:15,380 - optuna.study._optimize - INFO - Trial 151 pruned. 
2026-05-15 22:52:29,286 - experiment_functions - INFO - Early stopping at epoch 2000. Best Recall: 0.1224
2026-05-15 22:52:29,415 - optuna.study.study - INFO - Trial 152 finished with value: 0.122419174541313 and parameters: {'n_layers': 1, 'embedding_dim': 256, 'lr': 0.0005214017013327039, 'lambda_val': 2.4444691490884828e-05, 'batch_size': 1329, 'optimizer': 'Adam'}. Best is trial 135 with value: 0.13254127356915424.
2026-05-15 22:52:39,452 - optuna.study._optimize - INFO - Trial 153 pruned. 
2026-05-15 22:52:47,082 - optuna.study._optimize - INFO - Trial 154 pruned. 
2026-05-15 22:52:54,852 - optuna.study._optimize - INFO - Trial 155 pruned. 
2026-05-15 22:53:04,541 - optuna.study._optimize - INFO - Trial 156 pruned. 
2026-05-15 22:53:14,080 - optuna.study._optimize - INFO - Trial 157 pruned. 
2026-05-15 22:53:20,904 - optuna.study._optimize - INFO - Trial 158 pruned. 
2026-05-15 22:53:26,935 - experiment_functions - INFO - Early stopping at epoch 900. Best Recall: 0.1129
2026-05-15 22:53:27,037 - optuna.study.study - INFO - Trial 159 finished with value: 0.11291842278161349 and parameters: {'n_layers': 1, 'embedding_dim': 256, 'lr': 0.0008690413460000765, 'lambda_val': 3.1556442996914014e-05, 'batch_size': 2404, 'optimizer': 'Adam'}. Best is trial 135 with value: 0.13254127356915424.
2026-05-15 22:53:36,468 - experiment_functions - INFO - Early stopping at epoch 1450. Best Recall: 0.1290
2026-05-15 22:53:36,558 - optuna.study.study - INFO - Trial 160 finished with value: 0.12901450169043532 and parameters: {'n_layers': 1, 'embedding_dim': 256, 'lr': 0.0006000149370212338, 'lambda_val': 7.239475151982422e-06, 'batch_size': 1709, 'optimizer': 'Adam'}. Best is trial 135 with value: 0.13254127356915424.
2026-05-15 22:53:42,879 - optuna.study._optimize - INFO - Trial 161 pruned. 
2026-05-15 22:53:51,205 - optuna.study._optimize - INFO - Trial 162 pruned. 
2026-05-15 22:53:58,740 - experiment_functions - INFO - Early stopping at epoch 1200. Best Recall: 0.1179
2026-05-15 22:53:58,819 - optuna.study.study - INFO - Trial 163 finished with value: 0.11793381894661246 and parameters: {'n_layers': 1, 'embedding_dim': 256, 'lr': 0.0006983646324372712, 'lambda_val': 5.47828444895367e-06, 'batch_size': 1808, 'optimizer': 'Adam'}. Best is trial 135 with value: 0.13254127356915424.
2026-05-15 22:54:11,352 - experiment_functions - INFO - Early stopping at epoch 2000. Best Recall: 0.1221
2026-05-15 22:54:11,454 - optuna.study.study - INFO - Trial 164 finished with value: 0.12213929122074423 and parameters: {'n_layers': 1, 'embedding_dim': 256, 'lr': 0.0005375694707386315, 'lambda_val': 1.2509429477206548e-05, 'batch_size': 1624, 'optimizer': 'Adam'}. Best is trial 135 with value: 0.13254127356915424.
2026-05-15 22:54:17,919 - optuna.study._optimize - INFO - Trial 165 pruned. 
2026-05-15 22:54:29,398 - experiment_functions - INFO - Early stopping at epoch 1200. Best Recall: 0.1202
2026-05-15 22:54:29,507 - optuna.study.study - INFO - Trial 166 finished with value: 0.12024893169422919 and parameters: {'n_layers': 1, 'embedding_dim': 256, 'lr': 0.0007810401566615871, 'lambda_val': 6.985808445578826e-06, 'batch_size': 1707, 'optimizer': 'Adam'}. Best is trial 135 with value: 0.13254127356915424.
2026-05-15 22:54:36,010 - optuna.study._optimize - INFO - Trial 167 pruned. 
2026-05-15 22:54:42,401 - optuna.study._optimize - INFO - Trial 168 pruned. 
2026-05-15 22:54:50,229 - optuna.study._optimize - INFO - Trial 169 pruned. 
2026-05-15 22:55:05,059 - optuna.study._optimize - INFO - Trial 170 pruned. 
2026-05-15 22:55:11,554 - optuna.study._optimize - INFO - Trial 171 pruned. 
2026-05-15 22:55:22,174 - experiment_functions - INFO - Early stopping at epoch 1700. Best Recall: 0.1237
2026-05-15 22:55:22,272 - optuna.study.study - INFO - Trial 172 finished with value: 0.12366971550367814 and parameters: {'n_layers': 1, 'embedding_dim': 256, 'lr': 0.0005711893941829179, 'lambda_val': 6.588314420319538e-06, 'batch_size': 1693, 'optimizer': 'Adam'}. Best is trial 135 with value: 0.13254127356915424.
2026-05-15 22:55:33,069 - experiment_functions - INFO - Early stopping at epoch 1800. Best Recall: 0.1319
2026-05-15 22:55:33,159 - optuna.study.study - INFO - Trial 173 finished with value: 0.1318732889989419 and parameters: {'n_layers': 1, 'embedding_dim': 256, 'lr': 0.0005653058518368143, 'lambda_val': 6.083123602437346e-06, 'batch_size': 1676, 'optimizer': 'Adam'}. Best is trial 135 with value: 0.13254127356915424.
2026-05-15 22:55:56,616 - experiment_functions - INFO - Early stopping at epoch 2100. Best Recall: 0.1247
2026-05-15 22:55:56,714 - optuna.study.study - INFO - Trial 174 finished with value: 0.12466792803585505 and parameters: {'n_layers': 1, 'embedding_dim': 256, 'lr': 0.0005161436246161433, 'lambda_val': 5.9947141386126985e-06, 'batch_size': 1722, 'optimizer': 'Adam'}. Best is trial 135 with value: 0.13254127356915424.
2026-05-15 22:56:03,506 - optuna.study._optimize - INFO - Trial 175 pruned. 
2026-05-15 22:56:10,946 - optuna.study._optimize - INFO - Trial 176 pruned. 
2026-05-15 22:56:18,914 - experiment_functions - INFO - Early stopping at epoch 950. Best Recall: 0.0603
2026-05-15 22:56:19,038 - optuna.study.study - INFO - Trial 177 finished with value: 0.060344987892112255 and parameters: {'n_layers': 3, 'embedding_dim': 256, 'lr': 0.00039517439505209963, 'lambda_val': 4.76186547497487e-06, 'batch_size': 1877, 'optimizer': 'RMSprop'}. Best is trial 135 with value: 0.13254127356915424.
2026-05-15 22:56:22,138 - experiment_functions - INFO - Early stopping at epoch 500. Best Recall: 0.0024
2026-05-15 22:56:22,228 - optuna.study.study - INFO - Trial 178 finished with value: 0.0024169268952064092 and parameters: {'n_layers': 1, 'embedding_dim': 128, 'lr': 0.0005489589532760643, 'lambda_val': 6.248348783373228e-06, 'batch_size': 1598, 'optimizer': 'SGD'}. Best is trial 135 with value: 0.13254127356915424.
2026-05-15 22:56:31,112 - optuna.study._optimize - INFO - Trial 179 pruned. 
2026-05-15 22:56:43,681 - experiment_functions - INFO - Early stopping at epoch 2050. Best Recall: 0.1245
2026-05-15 22:56:43,770 - optuna.study.study - INFO - Trial 180 finished with value: 0.12447586698068647 and parameters: {'n_layers': 1, 'embedding_dim': 256, 'lr': 0.000476622386107413, 'lambda_val': 8.785695120834379e-06, 'batch_size': 1638, 'optimizer': 'Adam'}. Best is trial 135 with value: 0.13254127356915424.
2026-05-15 22:56:50,568 - optuna.study._optimize - INFO - Trial 181 pruned. 
2026-05-15 22:57:01,515 - experiment_functions - INFO - Early stopping at epoch 1800. Best Recall: 0.1232
2026-05-15 22:57:01,614 - optuna.study.study - INFO - Trial 182 finished with value: 0.12322735437253046 and parameters: {'n_layers': 1, 'embedding_dim': 256, 'lr': 0.0005750485643357618, 'lambda_val': 1.2125763522761232e-05, 'batch_size': 1734, 'optimizer': 'Adam'}. Best is trial 135 with value: 0.13254127356915424.
2026-05-15 22:57:17,519 - experiment_functions - INFO - Early stopping at epoch 2200. Best Recall: 0.1265
2026-05-15 22:57:17,619 - optuna.study.study - INFO - Trial 183 finished with value: 0.12652472928806863 and parameters: {'n_layers': 1, 'embedding_dim': 256, 'lr': 0.0005586072808661859, 'lambda_val': 1.1023479641723182e-05, 'batch_size': 1558, 'optimizer': 'Adam'}. Best is trial 135 with value: 0.13254127356915424.
2026-05-15 22:57:23,965 - optuna.study._optimize - INFO - Trial 184 pruned. 
2026-05-15 22:57:31,519 - optuna.study._optimize - INFO - Trial 185 pruned. 
2026-05-15 22:57:38,462 - optuna.study._optimize - INFO - Trial 186 pruned. 
2026-05-15 22:57:45,151 - optuna.study._optimize - INFO - Trial 187 pruned. 
2026-05-15 22:57:51,146 - optuna.study._optimize - INFO - Trial 188 pruned. 
2026-05-15 22:57:59,715 - optuna.study._optimize - INFO - Trial 189 pruned. 
2026-05-15 22:58:06,189 - optuna.study._optimize - INFO - Trial 190 pruned. 
2026-05-15 22:58:12,690 - optuna.study._optimize - INFO - Trial 191 pruned. 
2026-05-15 22:58:24,982 - experiment_functions - INFO - Early stopping at epoch 1800. Best Recall: 0.1197
2026-05-15 22:58:25,080 - optuna.study.study - INFO - Trial 192 finished with value: 0.11969180203629141 and parameters: {'n_layers': 1, 'embedding_dim': 256, 'lr': 0.0005684331645397532, 'lambda_val': 1.1822993103348495e-05, 'batch_size': 1590, 'optimizer': 'Adam'}. Best is trial 135 with value: 0.13254127356915424.
2026-05-15 22:58:35,468 - experiment_functions - INFO - Early stopping at epoch 1550. Best Recall: 0.1257
2026-05-15 22:58:35,758 - optuna.study.study - INFO - Trial 193 finished with value: 0.12571132001046728 and parameters: {'n_layers': 1, 'embedding_dim': 256, 'lr': 0.0004994457857033569, 'lambda_val': 1.7281059642238115e-05, 'batch_size': 1668, 'optimizer': 'Adam'}. Best is trial 135 with value: 0.13254127356915424.
2026-05-15 22:58:42,080 - optuna.study._optimize - INFO - Trial 194 pruned. 
2026-05-15 22:58:48,778 - optuna.study._optimize - INFO - Trial 195 pruned. 
2026-05-15 22:58:55,925 - optuna.study._optimize - INFO - Trial 196 pruned. 
2026-05-15 22:59:02,690 - experiment_functions - INFO - Early stopping at epoch 950. Best Recall: 0.1235
2026-05-15 22:59:02,799 - optuna.study.study - INFO - Trial 197 finished with value: 0.12348153944256393 and parameters: {'n_layers': 1, 'embedding_dim': 256, 'lr': 0.0009652214487175539, 'lambda_val': 3.0795658923749604e-06, 'batch_size': 1778, 'optimizer': 'Adam'}. Best is trial 135 with value: 0.13254127356915424.
2026-05-15 22:59:08,802 - experiment_functions - INFO - Early stopping at epoch 900. Best Recall: 0.1126
2026-05-15 22:59:08,880 - optuna.study.study - INFO - Trial 198 finished with value: 0.11257952374246447 and parameters: {'n_layers': 1, 'embedding_dim': 256, 'lr': 0.0009753206609718288, 'lambda_val': 3.239195542034556e-06, 'batch_size': 1986, 'optimizer': 'Adam'}. Best is trial 135 with value: 0.13254127356915424.
2026-05-15 22:59:16,707 - experiment_functions - INFO - Early stopping at epoch 950. Best Recall: 0.1159
2026-05-15 22:59:16,806 - optuna.study.study - INFO - Trial 199 finished with value: 0.11585276178088179 and parameters: {'n_layers': 1, 'embedding_dim': 256, 'lr': 0.0011159711884163668, 'lambda_val': 2.377879451382299e-06, 'batch_size': 1814, 'optimizer': 'Adam'}. Best is trial 135 with value: 0.13254127356915424.
2026-05-15 22:59:24,464 - experiment_functions - INFO - Early stopping at epoch 1150. Best Recall: 0.1289
2026-05-15 22:59:24,564 - optuna.study.study - INFO - Trial 200 finished with value: 0.1288655957029397 and parameters: {'n_layers': 1, 'embedding_dim': 256, 'lr': 0.000819341986673722, 'lambda_val': 1.7798005407945662e-05, 'batch_size': 1727, 'optimizer': 'Adam'}. Best is trial 135 with value: 0.13254127356915424.
2026-05-15 22:59:32,109 - experiment_functions - INFO - Early stopping at epoch 1100. Best Recall: 0.1181
2026-05-15 22:59:32,206 - optuna.study.study - INFO - Trial 201 finished with value: 0.11805866365146107 and parameters: {'n_layers': 1, 'embedding_dim': 256, 'lr': 0.000818573796222394, 'lambda_val': 2.0944166994830048e-05, 'batch_size': 1747, 'optimizer': 'Adam'}. Best is trial 135 with value: 0.13254127356915424.
2026-05-15 22:59:40,464 - optuna.study._optimize - INFO - Trial 202 pruned. 
2026-05-15 22:59:46,995 - experiment_functions - INFO - Early stopping at epoch 1000. Best Recall: 0.1152
2026-05-15 22:59:47,127 - optuna.study.study - INFO - Trial 203 finished with value: 0.11521278910285192 and parameters: {'n_layers': 1, 'embedding_dim': 256, 'lr': 0.0009492381766836948, 'lambda_val': 1.457576632592897e-06, 'batch_size': 1839, 'optimizer': 'Adam'}. Best is trial 135 with value: 0.13254127356915424.
2026-05-15 23:00:04,538 - experiment_functions - INFO - Early stopping at epoch 1550. Best Recall: 0.1284
2026-05-15 23:00:04,682 - optuna.study.study - INFO - Trial 204 finished with value: 0.1284048106557213 and parameters: {'n_layers': 1, 'embedding_dim': 256, 'lr': 0.0005457999423404073, 'lambda_val': 1.217754429448566e-05, 'batch_size': 1696, 'optimizer': 'Adam'}. Best is trial 135 with value: 0.13254127356915424.
2026-05-15 23:00:11,670 - optuna.study._optimize - INFO - Trial 205 pruned. 
2026-05-15 23:00:20,252 - optuna.study._optimize - INFO - Trial 206 pruned. 
2026-05-15 23:00:26,674 - optuna.study._optimize - INFO - Trial 207 pruned. 
2026-05-15 23:00:33,069 - optuna.study._optimize - INFO - Trial 208 pruned. 
2026-05-15 23:00:40,004 - optuna.study._optimize - INFO - Trial 209 pruned. 
2026-05-15 23:00:45,188 - experiment_functions - INFO - Early stopping at epoch 750. Best Recall: 0.1087
2026-05-15 23:00:45,288 - optuna.study.study - INFO - Trial 210 finished with value: 0.1087012799153866 and parameters: {'n_layers': 1, 'embedding_dim': 256, 'lr': 0.0016282050449424445, 'lambda_val': 9.943548338173339e-06, 'batch_size': 1772, 'optimizer': 'Adam'}. Best is trial 135 with value: 0.13254127356915424.
2026-05-15 23:00:52,114 - optuna.study._optimize - INFO - Trial 211 pruned. 
2026-05-15 23:01:05,810 - experiment_functions - INFO - Early stopping at epoch 2250. Best Recall: 0.1238
2026-05-15 23:01:05,900 - optuna.study.study - INFO - Trial 212 finished with value: 0.1237522473536288 and parameters: {'n_layers': 1, 'embedding_dim': 256, 'lr': 0.0004628762932896729, 'lambda_val': 2.6526778330592336e-05, 'batch_size': 1696, 'optimizer': 'Adam'}. Best is trial 135 with value: 0.13254127356915424.
2026-05-15 23:01:12,306 - optuna.study._optimize - INFO - Trial 213 pruned. 
2026-05-15 23:01:18,607 - optuna.study._optimize - INFO - Trial 214 pruned. 
2026-05-15 23:01:27,520 - experiment_functions - INFO - Early stopping at epoch 1100. Best Recall: 0.1224
2026-05-15 23:01:27,620 - optuna.study.study - INFO - Trial 215 finished with value: 0.12244409737249787 and parameters: {'n_layers': 1, 'embedding_dim': 256, 'lr': 0.0007507166599213449, 'lambda_val': 2.0829800793934422e-05, 'batch_size': 1784, 'optimizer': 'Adam'}. Best is trial 135 with value: 0.13254127356915424.
2026-05-15 23:01:33,376 - experiment_functions - INFO - Early stopping at epoch 850. Best Recall: 0.0993
2026-05-15 23:01:33,475 - optuna.study.study - INFO - Trial 216 finished with value: 0.09931397352680323 and parameters: {'n_layers': 1, 'embedding_dim': 256, 'lr': 0.0006032210541632488, 'lambda_val': 6.179065865732075e-06, 'batch_size': 3514, 'optimizer': 'RMSprop'}. Best is trial 135 with value: 0.13254127356915424.
2026-05-15 23:01:37,051 - experiment_functions - INFO - Early stopping at epoch 500. Best Recall: 0.0031
2026-05-15 23:01:37,141 - optuna.study.study - INFO - Trial 217 finished with value: 0.0031475466092340328 and parameters: {'n_layers': 1, 'embedding_dim': 256, 'lr': 0.0004490354710407932, 'lambda_val': 7.611894186150167e-06, 'batch_size': 1581, 'optimizer': 'SGD'}. Best is trial 135 with value: 0.13254127356915424.
2026-05-15 23:01:43,966 - experiment_functions - INFO - Early stopping at epoch 1150. Best Recall: 0.1177
2026-05-15 23:01:44,259 - optuna.study.study - INFO - Trial 218 finished with value: 0.11772699171986951 and parameters: {'n_layers': 1, 'embedding_dim': 128, 'lr': 0.0008812362931489041, 'lambda_val': 1.3884327049133412e-05, 'batch_size': 1730, 'optimizer': 'Adam'}. Best is trial 135 with value: 0.13254127356915424.
2026-05-15 23:01:50,883 - optuna.study._optimize - INFO - Trial 219 pruned. 
2026-05-15 23:01:57,494 - optuna.study._optimize - INFO - Trial 220 pruned. 
2026-05-15 23:02:04,619 - optuna.study._optimize - INFO - Trial 221 pruned. 
2026-05-15 23:02:11,314 - optuna.study._optimize - INFO - Trial 222 pruned. 
2026-05-15 23:02:17,865 - optuna.study._optimize - INFO - Trial 223 pruned. 
2026-05-15 23:02:26,044 - experiment_functions - INFO - Early stopping at epoch 1250. Best Recall: 0.1175
2026-05-15 23:02:26,143 - optuna.study.study - INFO - Trial 224 finished with value: 0.11754194311928594 and parameters: {'n_layers': 1, 'embedding_dim': 256, 'lr': 0.0006145744905904792, 'lambda_val': 3.168587400019127e-05, 'batch_size': 1846, 'optimizer': 'Adam'}. Best is trial 135 with value: 0.13254127356915424.
2026-05-15 23:02:32,870 - optuna.study._optimize - INFO - Trial 225 pruned. 
2026-05-15 23:02:39,120 - experiment_functions - INFO - Early stopping at epoch 900. Best Recall: 0.1093
2026-05-15 23:02:39,264 - optuna.study.study - INFO - Trial 226 finished with value: 0.10931249146269045 and parameters: {'n_layers': 1, 'embedding_dim': 256, 'lr': 0.001276510671205282, 'lambda_val': 4.538786319594268e-05, 'batch_size': 1753, 'optimizer': 'Adam'}. Best is trial 135 with value: 0.13254127356915424.
2026-05-15 23:02:46,271 - optuna.study._optimize - INFO - Trial 227 pruned. 
2026-05-15 23:02:52,725 - optuna.study._optimize - INFO - Trial 228 pruned. 
2026-05-15 23:02:59,281 - optuna.study._optimize - INFO - Trial 229 pruned. 
2026-05-15 23:03:05,273 - optuna.study._optimize - INFO - Trial 230 pruned. 
2026-05-15 23:03:12,103 - optuna.study._optimize - INFO - Trial 231 pruned. 
2026-05-15 23:03:18,888 - optuna.study._optimize - INFO - Trial 232 pruned. 
2026-05-15 23:03:32,313 - experiment_functions - INFO - Early stopping at epoch 2200. Best Recall: 0.1227
2026-05-15 23:03:32,402 - optuna.study.study - INFO - Trial 233 finished with value: 0.12267854463965207 and parameters: {'n_layers': 1, 'embedding_dim': 256, 'lr': 0.0004971618679398097, 'lambda_val': 1.90774833594296e-05, 'batch_size': 1607, 'optimizer': 'Adam'}. Best is trial 135 with value: 0.13254127356915424.
2026-05-15 23:03:39,742 - optuna.study._optimize - INFO - Trial 234 pruned. 
2026-05-15 23:03:46,102 - optuna.study._optimize - INFO - Trial 235 pruned. 
2026-05-15 23:03:52,493 - optuna.study._optimize - INFO - Trial 236 pruned. 
2026-05-15 23:04:04,746 - experiment_functions - INFO - Early stopping at epoch 1550. Best Recall: 0.1329
2026-05-15 23:04:04,848 - optuna.study.study - INFO - Trial 237 finished with value: 0.1329494425209514 and parameters: {'n_layers': 1, 'embedding_dim': 256, 'lr': 0.0005426502819273801, 'lambda_val': 1.2450016424773526e-05, 'batch_size': 1778, 'optimizer': 'Adam'}. Best is trial 237 with value: 0.1329494425209514.
2026-05-15 23:04:11,454 - experiment_functions - INFO - Early stopping at epoch 650. Best Recall: 0.0403
2026-05-15 23:04:11,564 - optuna.study.study - INFO - Trial 238 finished with value: 0.0402819705947724 and parameters: {'n_layers': 4, 'embedding_dim': 256, 'lr': 0.00047248117145781097, 'lambda_val': 9.070673517100067e-06, 'batch_size': 1868, 'optimizer': 'RMSprop'}. Best is trial 237 with value: 0.1329494425209514.
2026-05-15 23:04:20,750 - experiment_functions - INFO - Early stopping at epoch 1500. Best Recall: 0.1216
2026-05-15 23:04:20,838 - optuna.study.study - INFO - Trial 239 finished with value: 0.12159561264682359 and parameters: {'n_layers': 1, 'embedding_dim': 256, 'lr': 0.0005658211274337864, 'lambda_val': 1.1838199547517866e-05, 'batch_size': 1617, 'optimizer': 'Adam'}. Best is trial 237 with value: 0.1329494425209514.
2026-05-15 23:04:27,719 - optuna.study._optimize - INFO - Trial 240 pruned. 
2026-05-15 23:04:34,502 - optuna.study._optimize - INFO - Trial 241 pruned. 
2026-05-15 23:04:41,955 - optuna.study._optimize - INFO - Trial 242 pruned. 
2026-05-15 23:04:50,025 - experiment_functions - INFO - Early stopping at epoch 1250. Best Recall: 0.1204
