2026-05-15 23:16:25,160 - optuna.study.study - INFO - Trial 34 finished with value: 0.0462384802056172 and parameters: {'n_layers': 1, 'embedding_dim': 128, 'lr': 0.014519127696121717, 'lambda_val': 2.3725341923779553e-05, 'batch_size': 2539, 'optimizer': 'RMSprop'}. Best is trial 28 with value: 0.10038378220045932.
2026-05-15 23:16:29,456 - experiment_functions - INFO - Early stopping at epoch 650. Best Recall: 0.0849
2026-05-15 23:16:29,578 - optuna.study.study - INFO - Trial 35 finished with value: 0.0849269028012923 and parameters: {'n_layers': 1, 'embedding_dim': 128, 'lr': 0.0015445072725134186, 'lambda_val': 4.4710983771761527e-05, 'batch_size': 3807, 'optimizer': 'RMSprop'}. Best is trial 28 with value: 0.10038378220045932.
2026-05-15 23:16:35,612 - experiment_functions - INFO - Early stopping at epoch 500. Best Recall: 0.0013
2026-05-15 23:16:35,712 - optuna.study.study - INFO - Trial 36 finished with value: 0.0012841340998490261 and parameters: {'n_layers': 1, 'embedding_dim': 128, 'lr': 0.0008252524911425892, 'lambda_val': 1.569198238178908e-05, 'batch_size': 3100, 'optimizer': 'SGD'}. Best is trial 28 with value: 0.10038378220045932.
2026-05-15 23:16:39,987 - experiment_functions - INFO - Early stopping at epoch 600. Best Recall: 0.0592
2026-05-15 23:16:40,108 - optuna.study.study - INFO - Trial 37 finished with value: 0.0591794806770301 and parameters: {'n_layers': 1, 'embedding_dim': 128, 'lr': 0.0055392903382624845, 'lambda_val': 8.411853238335796e-06, 'batch_size': 2609, 'optimizer': 'RMSprop'}. Best is trial 28 with value: 0.10038378220045932.
2026-05-15 23:16:43,599 - experiment_functions - INFO - Early stopping at epoch 500. Best Recall: 0.0019
2026-05-15 23:16:43,690 - optuna.study.study - INFO - Trial 38 finished with value: 0.0018804930335652155 and parameters: {'n_layers': 1, 'embedding_dim': 128, 'lr': 0.0017924756693500504, 'lambda_val': 0.07207915414413145, 'batch_size': 3643, 'optimizer': 'SGD'}. Best is trial 28 with value: 0.10038378220045932.
2026-05-15 23:16:50,367 - experiment_functions - INFO - Early stopping at epoch 600. Best Recall: 0.0811
2026-05-15 23:16:50,447 - optuna.study.study - INFO - Trial 39 finished with value: 0.08107252776211493 and parameters: {'n_layers': 1, 'embedding_dim': 32, 'lr': 0.005368385953951656, 'lambda_val': 2.3207617386752574e-06, 'batch_size': 2365, 'optimizer': 'Adam'}. Best is trial 28 with value: 0.10038378220045932.
2026-05-15 23:16:55,172 - experiment_functions - INFO - Early stopping at epoch 700. Best Recall: 0.0889
2026-05-15 23:16:55,262 - optuna.study.study - INFO - Trial 40 finished with value: 0.08892031254794627 and parameters: {'n_layers': 1, 'embedding_dim': 128, 'lr': 0.0011147282483387505, 'lambda_val': 0.0028483719331788312, 'batch_size': 2848, 'optimizer': 'RMSprop'}. Best is trial 28 with value: 0.10038378220045932.
2026-05-15 23:16:58,976 - experiment_functions - INFO - Early stopping at epoch 550. Best Recall: 0.0449
2026-05-15 23:16:59,076 - optuna.study.study - INFO - Trial 41 finished with value: 0.04489981275819919 and parameters: {'n_layers': 1, 'embedding_dim': 128, 'lr': 0.0011122494745128661, 'lambda_val': 0.02882810477643108, 'batch_size': 2836, 'optimizer': 'RMSprop'}. Best is trial 28 with value: 0.10038378220045932.
2026-05-15 23:17:04,659 - experiment_functions - INFO - Early stopping at epoch 850. Best Recall: 0.0933
2026-05-15 23:17:04,745 - optuna.study.study - INFO - Trial 42 finished with value: 0.09325416883168239 and parameters: {'n_layers': 1, 'embedding_dim': 128, 'lr': 0.0005893587195951681, 'lambda_val': 0.004728662548732905, 'batch_size': 3190, 'optimizer': 'RMSprop'}. Best is trial 28 with value: 0.10038378220045932.
2026-05-15 23:17:09,340 - experiment_functions - INFO - Early stopping at epoch 550. Best Recall: 0.0786
2026-05-15 23:17:09,448 - optuna.study.study - INFO - Trial 43 finished with value: 0.07861346087495816 and parameters: {'n_layers': 1, 'embedding_dim': 128, 'lr': 0.0019651783907605937, 'lambda_val': 0.004919260588482573, 'batch_size': 3161, 'optimizer': 'RMSprop'}. Best is trial 28 with value: 0.10038378220045932.
2026-05-15 23:17:13,615 - experiment_functions - INFO - Early stopping at epoch 650. Best Recall: 0.0457
2026-05-15 23:17:13,706 - optuna.study.study - INFO - Trial 44 finished with value: 0.04574186510364315 and parameters: {'n_layers': 1, 'embedding_dim': 128, 'lr': 0.0006036296899905858, 'lambda_val': 0.03070161243447633, 'batch_size': 3540, 'optimizer': 'RMSprop'}. Best is trial 28 with value: 0.10038378220045932.
2026-05-15 23:17:17,375 - experiment_functions - INFO - Early stopping at epoch 550. Best Recall: 0.0421
2026-05-15 23:17:17,466 - optuna.study.study - INFO - Trial 45 finished with value: 0.04214751451965615 and parameters: {'n_layers': 2, 'embedding_dim': 64, 'lr': 0.0042703558494730865, 'lambda_val': 0.0007774130576956736, 'batch_size': 4072, 'optimizer': 'Adam'}. Best is trial 28 with value: 0.10038378220045932.
2026-05-15 23:17:20,599 - experiment_functions - INFO - Early stopping at epoch 500. Best Recall: 0.0029
2026-05-15 23:17:20,686 - optuna.study.study - INFO - Trial 46 finished with value: 0.0028719393009039402 and parameters: {'n_layers': 1, 'embedding_dim': 32, 'lr': 0.012257773792148896, 'lambda_val': 0.00871545317672415, 'batch_size': 2088, 'optimizer': 'SGD'}. Best is trial 28 with value: 0.10038378220045932.
2026-05-15 23:17:25,353 - experiment_functions - INFO - Early stopping at epoch 650. Best Recall: 0.0467
2026-05-15 23:17:25,732 - optuna.study.study - INFO - Trial 47 finished with value: 0.04673883155096036 and parameters: {'n_layers': 1, 'embedding_dim': 128, 'lr': 0.02447626923090288, 'lambda_val': 5.069009182933961e-05, 'batch_size': 3142, 'optimizer': 'Adam'}. Best is trial 28 with value: 0.10038378220045932.
2026-05-15 23:17:36,470 - experiment_functions - INFO - Early stopping at epoch 550. Best Recall: 0.0297
2026-05-15 23:17:36,614 - optuna.study.study - INFO - Trial 48 finished with value: 0.02965249330210401 and parameters: {'n_layers': 2, 'embedding_dim': 128, 'lr': 0.0007007613529569969, 'lambda_val': 0.023461906048745765, 'batch_size': 2517, 'optimizer': 'RMSprop'}. Best is trial 28 with value: 0.10038378220045932.
2026-05-15 23:17:41,027 - experiment_functions - INFO - Early stopping at epoch 650. Best Recall: 0.0936
2026-05-15 23:17:41,126 - optuna.study.study - INFO - Trial 49 finished with value: 0.09357796796233382 and parameters: {'n_layers': 1, 'embedding_dim': 128, 'lr': 0.0015138645218355034, 'lambda_val': 0.002282269395214623, 'batch_size': 2704, 'optimizer': 'Adam'}. Best is trial 28 with value: 0.10038378220045932.
2026-05-15 23:17:46,461 - experiment_functions - INFO - Early stopping at epoch 750. Best Recall: 0.0608
2026-05-15 23:17:46,615 - optuna.study.study - INFO - Trial 50 finished with value: 0.0608207644643041 and parameters: {'n_layers': 2, 'embedding_dim': 64, 'lr': 0.001386512262342872, 'lambda_val': 0.0015534319186793469, 'batch_size': 2297, 'optimizer': 'Adam'}. Best is trial 28 with value: 0.10038378220045932.
2026-05-15 23:17:50,722 - experiment_functions - INFO - Early stopping at epoch 550. Best Recall: 0.0620
2026-05-15 23:17:50,803 - optuna.study.study - INFO - Trial 51 finished with value: 0.06203592969119709 and parameters: {'n_layers': 1, 'embedding_dim': 128, 'lr': 0.004059698768652812, 'lambda_val': 0.04464523652747755, 'batch_size': 2750, 'optimizer': 'Adam'}. Best is trial 28 with value: 0.10038378220045932.
2026-05-15 23:17:56,108 - experiment_functions - INFO - Early stopping at epoch 850. Best Recall: 0.0757
2026-05-15 23:17:56,177 - optuna.study.study - INFO - Trial 52 finished with value: 0.07568564928597749 and parameters: {'n_layers': 1, 'embedding_dim': 128, 'lr': 0.0005481828568574406, 'lambda_val': 0.013095236938947477, 'batch_size': 2996, 'optimizer': 'Adam'}. Best is trial 28 with value: 0.10038378220045932.
2026-05-15 23:18:10,259 - experiment_functions - INFO - Early stopping at epoch 600. Best Recall: 0.0896
2026-05-15 23:18:10,350 - optuna.study.study - INFO - Trial 53 finished with value: 0.08958591520258366 and parameters: {'n_layers': 1, 'embedding_dim': 128, 'lr': 0.0025196949533281133, 'lambda_val': 0.002662278136876984, 'batch_size': 3505, 'optimizer': 'Adam'}. Best is trial 28 with value: 0.10038378220045932.
2026-05-15 23:18:17,157 - optuna.study._optimize - INFO - Trial 54 pruned. 
2026-05-15 23:18:20,951 - experiment_functions - INFO - Early stopping at epoch 550. Best Recall: 0.0521
2026-05-15 23:18:21,051 - optuna.study.study - INFO - Trial 55 finished with value: 0.052121244984697085 and parameters: {'n_layers': 1, 'embedding_dim': 128, 'lr': 0.007230299397203254, 'lambda_val': 0.01677861333218367, 'batch_size': 2964, 'optimizer': 'Adam'}. Best is trial 28 with value: 0.10038378220045932.
2026-05-15 23:18:28,629 - experiment_functions - INFO - Early stopping at epoch 600. Best Recall: 0.0266
2026-05-15 23:18:28,748 - optuna.study.study - INFO - Trial 56 finished with value: 0.02661580843540692 and parameters: {'n_layers': 4, 'embedding_dim': 32, 'lr': 0.0011571628273806698, 'lambda_val': 2.3751671890715184e-05, 'batch_size': 2673, 'optimizer': 'RMSprop'}. Best is trial 28 with value: 0.10038378220045932.
2026-05-15 23:18:34,158 - experiment_functions - INFO - Early stopping at epoch 800. Best Recall: 0.0959
2026-05-15 23:18:34,294 - optuna.study.study - INFO - Trial 57 finished with value: 0.0959158530220577 and parameters: {'n_layers': 1, 'embedding_dim': 96, 'lr': 0.001710934759703824, 'lambda_val': 0.0014770296692589672, 'batch_size': 2358, 'optimizer': 'Adam'}. Best is trial 28 with value: 0.10038378220045932.
2026-05-15 23:18:51,750 - experiment_functions - INFO - Early stopping at epoch 3250. Best Recall: 0.1084
2026-05-15 23:18:51,853 - optuna.study.study - INFO - Trial 58 finished with value: 0.10835658758733971 and parameters: {'n_layers': 1, 'embedding_dim': 96, 'lr': 0.000283566956784337, 'lambda_val': 0.0019391743992966273, 'batch_size': 1956, 'optimizer': 'Adam'}. Best is trial 58 with value: 0.10835658758733971.
2026-05-15 23:18:58,234 - experiment_functions - INFO - Early stopping at epoch 950. Best Recall: 0.0905
2026-05-15 23:18:58,344 - optuna.study.study - INFO - Trial 59 finished with value: 0.09047116633838406 and parameters: {'n_layers': 1, 'embedding_dim': 96, 'lr': 0.0009009330015193797, 'lambda_val': 0.001636002255187307, 'batch_size': 1899, 'optimizer': 'Adam'}. Best is trial 58 with value: 0.10835658758733971.
2026-05-15 23:19:05,418 - optuna.study._optimize - INFO - Trial 60 pruned. 
2026-05-15 23:19:11,729 - optuna.study._optimize - INFO - Trial 61 pruned. 
2026-05-15 23:19:17,975 - experiment_functions - INFO - Early stopping at epoch 1050. Best Recall: 0.1014
2026-05-15 23:19:18,067 - optuna.study.study - INFO - Trial 62 finished with value: 0.10144206714154273 and parameters: {'n_layers': 1, 'embedding_dim': 96, 'lr': 0.0007917420011625671, 'lambda_val': 0.0005364201910366417, 'batch_size': 1643, 'optimizer': 'Adam'}. Best is trial 58 with value: 0.10835658758733971.
2026-05-15 23:19:30,017 - experiment_functions - INFO - Early stopping at epoch 2150. Best Recall: 0.1086
2026-05-15 23:19:30,120 - optuna.study.study - INFO - Trial 63 finished with value: 0.10861224908522031 and parameters: {'n_layers': 1, 'embedding_dim': 96, 'lr': 0.0004327984598493858, 'lambda_val': 0.00044424230972359017, 'batch_size': 1584, 'optimizer': 'Adam'}. Best is trial 63 with value: 0.10861224908522031.
2026-05-15 23:19:44,976 - experiment_functions - INFO - Early stopping at epoch 2100. Best Recall: 0.1033
2026-05-15 23:19:45,065 - optuna.study.study - INFO - Trial 64 finished with value: 0.10334031023931368 and parameters: {'n_layers': 1, 'embedding_dim': 96, 'lr': 0.00043269672926704204, 'lambda_val': 0.0004991016427382169, 'batch_size': 1571, 'optimizer': 'Adam'}. Best is trial 63 with value: 0.10861224908522031.
2026-05-15 23:19:59,488 - experiment_functions - INFO - Early stopping at epoch 2650. Best Recall: 0.1091
2026-05-15 23:19:59,623 - optuna.study.study - INFO - Trial 65 finished with value: 0.1091370790934292 and parameters: {'n_layers': 1, 'embedding_dim': 96, 'lr': 0.00041139098175134957, 'lambda_val': 0.00047890991293304987, 'batch_size': 1626, 'optimizer': 'Adam'}. Best is trial 65 with value: 0.1091370790934292.
2026-05-15 23:20:05,448 - optuna.study._optimize - INFO - Trial 66 pruned. 
2026-05-15 23:20:11,526 - optuna.study._optimize - INFO - Trial 67 pruned. 
2026-05-15 23:20:18,017 - optuna.study._optimize - INFO - Trial 68 pruned. 
2026-05-15 23:20:24,343 - optuna.study._optimize - INFO - Trial 69 pruned. 
2026-05-15 23:20:34,951 - optuna.study._optimize - INFO - Trial 70 pruned. 
2026-05-15 23:20:40,831 - optuna.study._optimize - INFO - Trial 71 pruned. 
2026-05-15 23:20:47,114 - optuna.study._optimize - INFO - Trial 72 pruned. 
2026-05-15 23:20:53,225 - optuna.study._optimize - INFO - Trial 73 pruned. 
2026-05-15 23:20:59,257 - optuna.study._optimize - INFO - Trial 74 pruned. 
2026-05-15 23:21:05,887 - experiment_functions - INFO - Early stopping at epoch 1150. Best Recall: 0.1105
2026-05-15 23:21:06,001 - optuna.study.study - INFO - Trial 75 finished with value: 0.11054663284613135 and parameters: {'n_layers': 1, 'embedding_dim': 96, 'lr': 0.0009597792238688501, 'lambda_val': 0.00043774338661185813, 'batch_size': 1682, 'optimizer': 'Adam'}. Best is trial 75 with value: 0.11054663284613135.
2026-05-15 23:21:18,206 - experiment_functions - INFO - Early stopping at epoch 2100. Best Recall: 0.1125
2026-05-15 23:21:18,309 - optuna.study.study - INFO - Trial 76 finished with value: 0.112497337802551 and parameters: {'n_layers': 1, 'embedding_dim': 96, 'lr': 0.0004706763703030069, 'lambda_val': 8.452827454853618e-05, 'batch_size': 1400, 'optimizer': 'Adam'}. Best is trial 76 with value: 0.112497337802551.
2026-05-15 23:21:26,809 - optuna.study._optimize - INFO - Trial 77 pruned. 
2026-05-15 23:21:40,983 - experiment_functions - INFO - Early stopping at epoch 2650. Best Recall: 0.1218
2026-05-15 23:21:41,087 - optuna.study.study - INFO - Trial 78 finished with value: 0.12184530070472399 and parameters: {'n_layers': 1, 'embedding_dim': 96, 'lr': 0.00047294550177624003, 'lambda_val': 9.625502593911654e-05, 'batch_size': 1655, 'optimizer': 'Adam'}. Best is trial 78 with value: 0.12184530070472399.
2026-05-15 23:21:58,114 - experiment_functions - INFO - Early stopping at epoch 3100. Best Recall: 0.1116
2026-05-15 23:21:58,203 - optuna.study.study - INFO - Trial 79 finished with value: 0.11161799105378697 and parameters: {'n_layers': 1, 'embedding_dim': 96, 'lr': 0.0005081171409917819, 'lambda_val': 7.587555672533178e-05, 'batch_size': 1127, 'optimizer': 'Adam'}. Best is trial 78 with value: 0.12184530070472399.
2026-05-15 23:22:05,817 - optuna.study._optimize - INFO - Trial 80 pruned. 
2026-05-15 23:22:11,461 - optuna.study._optimize - INFO - Trial 81 pruned. 
2026-05-15 23:22:21,968 - experiment_functions - INFO - Early stopping at epoch 1850. Best Recall: 0.1199
2026-05-15 23:22:22,058 - optuna.study.study - INFO - Trial 82 finished with value: 0.1198976749213461 and parameters: {'n_layers': 1, 'embedding_dim': 96, 'lr': 0.0006763719912874588, 'lambda_val': 0.00013223166032428566, 'batch_size': 1204, 'optimizer': 'Adam'}. Best is trial 78 with value: 0.12184530070472399.
2026-05-15 23:22:27,721 - optuna.study._optimize - INFO - Trial 83 pruned. 
2026-05-15 23:22:39,700 - experiment_functions - INFO - Early stopping at epoch 2050. Best Recall: 0.1156
2026-05-15 23:22:39,799 - optuna.study.study - INFO - Trial 84 finished with value: 0.11564425385117343 and parameters: {'n_layers': 1, 'embedding_dim': 96, 'lr': 0.0006150370774820357, 'lambda_val': 0.00013565462847986778, 'batch_size': 1464, 'optimizer': 'Adam'}. Best is trial 78 with value: 0.12184530070472399.
2026-05-15 23:22:43,167 - experiment_functions - INFO - Early stopping at epoch 500. Best Recall: 0.0021
2026-05-15 23:22:43,267 - optuna.study.study - INFO - Trial 85 finished with value: 0.0021366505957503916 and parameters: {'n_layers': 1, 'embedding_dim': 96, 'lr': 0.0006016410396420439, 'lambda_val': 0.00012897653974468625, 'batch_size': 1397, 'optimizer': 'SGD'}. Best is trial 78 with value: 0.12184530070472399.
2026-05-15 23:22:50,681 - experiment_functions - INFO - Early stopping at epoch 1300. Best Recall: 0.1053
2026-05-15 23:22:50,782 - optuna.study.study - INFO - Trial 86 finished with value: 0.10527852860504307 and parameters: {'n_layers': 1, 'embedding_dim': 96, 'lr': 0.0009614647358472575, 'lambda_val': 6.597814297737798e-05, 'batch_size': 1063, 'optimizer': 'Adam'}. Best is trial 78 with value: 0.12184530070472399.
2026-05-15 23:22:58,204 - experiment_functions - INFO - Early stopping at epoch 1250. Best Recall: 0.1072
2026-05-15 23:22:58,282 - optuna.study.study - INFO - Trial 87 finished with value: 0.1072153762687128 and parameters: {'n_layers': 1, 'embedding_dim': 96, 'lr': 0.0006251358375725122, 'lambda_val': 0.00010898347916975796, 'batch_size': 1495, 'optimizer': 'Adam'}. Best is trial 78 with value: 0.12184530070472399.
2026-05-15 23:23:04,250 - optuna.study._optimize - INFO - Trial 88 pruned. 
2026-05-15 23:23:13,091 - experiment_functions - INFO - Early stopping at epoch 1250. Best Recall: 0.1068
2026-05-15 23:23:13,187 - optuna.study.study - INFO - Trial 89 finished with value: 0.10683216767507561 and parameters: {'n_layers': 1, 'embedding_dim': 96, 'lr': 0.001131419607885925, 'lambda_val': 0.00014977468042947498, 'batch_size': 1272, 'optimizer': 'Adam'}. Best is trial 78 with value: 0.12184530070472399.
2026-05-15 23:23:19,373 - optuna.study._optimize - INFO - Trial 90 pruned. 
2026-05-15 23:23:27,264 - optuna.study._optimize - INFO - Trial 91 pruned. 
2026-05-15 23:23:35,506 - optuna.study._optimize - INFO - Trial 92 pruned. 
2026-05-15 23:23:50,691 - experiment_functions - INFO - Early stopping at epoch 2700. Best Recall: 0.1177
2026-05-15 23:23:50,781 - optuna.study.study - INFO - Trial 93 finished with value: 0.11772718713775414 and parameters: {'n_layers': 1, 'embedding_dim': 96, 'lr': 0.00048032928059118537, 'lambda_val': 0.00020893867372016837, 'batch_size': 1204, 'optimizer': 'Adam'}. Best is trial 78 with value: 0.12184530070472399.
2026-05-15 23:23:56,525 - optuna.study._optimize - INFO - Trial 94 pruned. 
2026-05-15 23:24:15,521 - experiment_functions - INFO - Early stopping at epoch 3550. Best Recall: 0.1170
2026-05-15 23:24:15,656 - optuna.study.study - INFO - Trial 95 finished with value: 0.11698392162374507 and parameters: {'n_layers': 1, 'embedding_dim': 64, 'lr': 0.0005148455926800513, 'lambda_val': 0.00017446775223306635, 'batch_size': 1009, 'optimizer': 'Adam'}. Best is trial 78 with value: 0.12184530070472399.
2026-05-15 23:24:18,829 - experiment_functions - INFO - Early stopping at epoch 500. Best Recall: 0.0020
2026-05-15 23:24:18,928 - optuna.study.study - INFO - Trial 96 finished with value: 0.0019871742400278153 and parameters: {'n_layers': 1, 'embedding_dim': 64, 'lr': 0.00047959828079765154, 'lambda_val': 0.00018486291727023464, 'batch_size': 1038, 'optimizer': 'SGD'}. Best is trial 78 with value: 0.12184530070472399.
2026-05-15 23:24:27,665 - optuna.study._optimize - INFO - Trial 97 pruned. 
2026-05-15 23:24:35,680 - experiment_functions - INFO - Early stopping at epoch 1450. Best Recall: 0.1107
2026-05-15 23:24:35,780 - optuna.study.study - INFO - Trial 98 finished with value: 0.11073905199510106 and parameters: {'n_layers': 1, 'embedding_dim': 64, 'lr': 0.0008792519432377448, 'lambda_val': 0.0002487282026483218, 'batch_size': 1268, 'optimizer': 'Adam'}. Best is trial 78 with value: 0.12184530070472399.
2026-05-15 23:24:41,279 - experiment_functions - INFO - Early stopping at epoch 850. Best Recall: 0.0753
2026-05-15 23:24:41,854 - optuna.study.study - INFO - Trial 99 finished with value: 0.07525597660867904 and parameters: {'n_layers': 2, 'embedding_dim': 64, 'lr': 0.0012872837360766438, 'lambda_val': 0.00024512974381891696, 'batch_size': 992, 'optimizer': 'Adam'}. Best is trial 78 with value: 0.12184530070472399.
2026-05-15 23:24:48,205 - optuna.study._optimize - INFO - Trial 100 pruned. 
2026-05-15 23:24:54,302 - optuna.study._optimize - INFO - Trial 101 pruned. 
2026-05-15 23:25:10,067 - optuna.study._optimize - INFO - Trial 102 pruned. 
2026-05-15 23:25:17,303 - experiment_functions - INFO - Early stopping at epoch 1100. Best Recall: 0.1042
2026-05-15 23:25:17,401 - optuna.study.study - INFO - Trial 103 finished with value: 0.10415355246614197 and parameters: {'n_layers': 1, 'embedding_dim': 256, 'lr': 0.0006847489744665346, 'lambda_val': 0.001073816584872698, 'batch_size': 1594, 'optimizer': 'Adam'}. Best is trial 78 with value: 0.12184530070472399.
2026-05-15 23:25:23,288 - optuna.study._optimize - INFO - Trial 104 pruned. 
2026-05-15 23:25:30,115 - optuna.study._optimize - INFO - Trial 105 pruned. 
2026-05-15 23:25:42,823 - experiment_functions - INFO - Early stopping at epoch 1500. Best Recall: 0.1114
2026-05-15 23:25:42,910 - optuna.study.study - INFO - Trial 106 finished with value: 0.11135025488192095 and parameters: {'n_layers': 1, 'embedding_dim': 96, 'lr': 0.0010360654038657367, 'lambda_val': 0.00036785365361025236, 'batch_size': 903, 'optimizer': 'Adam'}. Best is trial 78 with value: 0.12184530070472399.
2026-05-15 23:25:51,536 - experiment_functions - INFO - Early stopping at epoch 1500. Best Recall: 0.1066
2026-05-15 23:25:51,702 - optuna.study.study - INFO - Trial 107 finished with value: 0.10664556581445216 and parameters: {'n_layers': 1, 'embedding_dim': 96, 'lr': 0.0010206421536125027, 'lambda_val': 0.0002185272406645973, 'batch_size': 1003, 'optimizer': 'Adam'}. Best is trial 78 with value: 0.12184530070472399.
2026-05-15 23:26:09,515 - experiment_functions - INFO - Early stopping at epoch 3350. Best Recall: 0.1200
