2026-05-15 20:59:30,778 - optuna.study.study - INFO - Trial 242 finished with value: 0.08138693263599532 and parameters: {'n_layers': 1, 'embedding_dim': 256, 'lr': 0.001598225198818467, 'lambda_val': 3.8954883773688854e-05, 'batch_size': 985, 'optimizer': 'Adam'}. Best is trial 234 with value: 0.08433565617451873.
2026-05-15 20:59:36,900 - experiment_functions - INFO - Early stopping at epoch 950. Best Recall: 0.0734
2026-05-15 20:59:37,026 - optuna.study.study - INFO - Trial 243 finished with value: 0.07337589157424215 and parameters: {'n_layers': 1, 'embedding_dim': 256, 'lr': 0.0029867249002225793, 'lambda_val': 3.7586345058881644e-05, 'batch_size': 893, 'optimizer': 'Adam'}. Best is trial 234 with value: 0.08433565617451873.
2026-05-15 20:59:46,965 - experiment_functions - INFO - Early stopping at epoch 1500. Best Recall: 0.0760
2026-05-15 20:59:47,069 - optuna.study.study - INFO - Trial 244 finished with value: 0.07598241744678076 and parameters: {'n_layers': 1, 'embedding_dim': 256, 'lr': 0.00216389476810828, 'lambda_val': 4.141739538532872e-05, 'batch_size': 976, 'optimizer': 'Adam'}. Best is trial 234 with value: 0.08433565617451873.
2026-05-15 20:59:51,871 - experiment_functions - INFO - Early stopping at epoch 700. Best Recall: 0.0681
2026-05-15 20:59:51,965 - optuna.study.study - INFO - Trial 245 finished with value: 0.06809779148053641 and parameters: {'n_layers': 1, 'embedding_dim': 32, 'lr': 0.0017230920512454635, 'lambda_val': 5.0484114282593046e-05, 'batch_size': 1796, 'optimizer': 'Adam'}. Best is trial 234 with value: 0.08433565617451873.
2026-05-15 20:59:57,916 - experiment_functions - INFO - Early stopping at epoch 850. Best Recall: 0.0786
2026-05-15 20:59:58,010 - optuna.study.study - INFO - Trial 246 finished with value: 0.078588144139693 and parameters: {'n_layers': 1, 'embedding_dim': 256, 'lr': 0.0014491467646498026, 'lambda_val': 2.8170145384954736e-05, 'batch_size': 836, 'optimizer': 'Adam'}. Best is trial 234 with value: 0.08433565617451873.
2026-05-15 21:00:07,933 - experiment_functions - INFO - Early stopping at epoch 1350. Best Recall: 0.0783
2026-05-15 21:00:08,036 - optuna.study.study - INFO - Trial 247 finished with value: 0.07833620727812822 and parameters: {'n_layers': 1, 'embedding_dim': 256, 'lr': 0.0014721302778924784, 'lambda_val': 2.587776801340743e-05, 'batch_size': 815, 'optimizer': 'Adam'}. Best is trial 234 with value: 0.08433565617451873.
2026-05-15 21:00:21,421 - optuna.study._optimize - INFO - Trial 248 pruned. 
2026-05-15 21:00:27,996 - experiment_functions - INFO - Early stopping at epoch 950. Best Recall: 0.0682
2026-05-15 21:00:28,089 - optuna.study.study - INFO - Trial 249 finished with value: 0.06818918894769001 and parameters: {'n_layers': 1, 'embedding_dim': 256, 'lr': 0.0018430665390328617, 'lambda_val': 2.775908488130191e-05, 'batch_size': 793, 'optimizer': 'Adam'}. Best is trial 234 with value: 0.08433565617451873.
2026-05-15 21:00:40,750 - optuna.study._optimize - INFO - Trial 250 pruned. 
2026-05-15 21:00:51,368 - experiment_functions - INFO - Early stopping at epoch 1500. Best Recall: 0.0733
2026-05-15 21:00:51,462 - optuna.study.study - INFO - Trial 251 finished with value: 0.07331476172494568 and parameters: {'n_layers': 1, 'embedding_dim': 256, 'lr': 0.0022030370077184905, 'lambda_val': 2.5492356633980254e-05, 'batch_size': 740, 'optimizer': 'Adam'}. Best is trial 234 with value: 0.08433565617451873.
2026-05-15 21:00:58,023 - optuna.study._optimize - INFO - Trial 252 pruned. 
2026-05-15 21:01:05,008 - experiment_functions - INFO - Early stopping at epoch 850. Best Recall: 0.0648
2026-05-15 21:01:05,113 - optuna.study.study - INFO - Trial 253 finished with value: 0.06481655373665543 and parameters: {'n_layers': 1, 'embedding_dim': 256, 'lr': 0.0012770374625681949, 'lambda_val': 2.7394502846264345e-05, 'batch_size': 961, 'optimizer': 'Adam'}. Best is trial 234 with value: 0.08433565617451873.
2026-05-15 21:01:11,954 - optuna.study._optimize - INFO - Trial 254 pruned. 
2026-05-15 21:01:18,436 - experiment_functions - INFO - Early stopping at epoch 950. Best Recall: 0.0701
2026-05-15 21:01:18,530 - optuna.study.study - INFO - Trial 255 finished with value: 0.07008350769588668 and parameters: {'n_layers': 1, 'embedding_dim': 256, 'lr': 0.002532309848432892, 'lambda_val': 6.21498702871334e-05, 'batch_size': 817, 'optimizer': 'Adam'}. Best is trial 234 with value: 0.08433565617451873.
2026-05-15 21:01:24,019 - experiment_functions - INFO - Early stopping at epoch 600. Best Recall: 0.0436
2026-05-15 21:01:24,113 - optuna.study.study - INFO - Trial 256 finished with value: 0.04355933275240734 and parameters: {'n_layers': 2, 'embedding_dim': 256, 'lr': 0.00160689713372096, 'lambda_val': 4.095141672723156e-05, 'batch_size': 898, 'optimizer': 'Adam'}. Best is trial 234 with value: 0.08433565617451873.
2026-05-15 21:01:41,492 - experiment_functions - INFO - Early stopping at epoch 2600. Best Recall: 0.0791
2026-05-15 21:01:41,594 - optuna.study.study - INFO - Trial 257 finished with value: 0.07909191003177468 and parameters: {'n_layers': 1, 'embedding_dim': 256, 'lr': 0.0011113728127477942, 'lambda_val': 4.9945356271192436e-05, 'batch_size': 705, 'optimizer': 'Adam'}. Best is trial 234 with value: 0.08433565617451873.
2026-05-15 21:01:47,684 - optuna.study._optimize - INFO - Trial 258 pruned. 
2026-05-15 21:01:55,556 - experiment_functions - INFO - Early stopping at epoch 1050. Best Recall: 0.0793
2026-05-15 21:01:55,671 - optuna.study.study - INFO - Trial 259 finished with value: 0.07934529900027452 and parameters: {'n_layers': 1, 'embedding_dim': 256, 'lr': 0.0010721977555438913, 'lambda_val': 3.89095461958006e-05, 'batch_size': 1059, 'optimizer': 'Adam'}. Best is trial 234 with value: 0.08433565617451873.
2026-05-15 21:02:19,877 - experiment_functions - INFO - Early stopping at epoch 600. Best Recall: 0.0297
2026-05-15 21:02:19,970 - optuna.study.study - INFO - Trial 260 finished with value: 0.029724920524621442 and parameters: {'n_layers': 4, 'embedding_dim': 256, 'lr': 0.0013187289462744138, 'lambda_val': 2.970459595256672e-05, 'batch_size': 703, 'optimizer': 'Adam'}. Best is trial 234 with value: 0.08433565617451873.
2026-05-15 21:02:29,062 - experiment_functions - INFO - Early stopping at epoch 1450. Best Recall: 0.0786
2026-05-15 21:02:29,166 - optuna.study.study - INFO - Trial 261 finished with value: 0.07860167920187013 and parameters: {'n_layers': 1, 'embedding_dim': 256, 'lr': 0.0010544059155731238, 'lambda_val': 3.71228215526986e-05, 'batch_size': 991, 'optimizer': 'Adam'}. Best is trial 234 with value: 0.08433565617451873.
2026-05-15 21:02:34,531 - experiment_functions - INFO - Early stopping at epoch 750. Best Recall: 0.0668
2026-05-15 21:02:34,637 - optuna.study.study - INFO - Trial 262 finished with value: 0.06678956446609628 and parameters: {'n_layers': 1, 'embedding_dim': 256, 'lr': 0.001112800005768394, 'lambda_val': 2.1244609621842748e-05, 'batch_size': 1001, 'optimizer': 'Adam'}. Best is trial 234 with value: 0.08433565617451873.
2026-05-15 21:02:47,068 - optuna.study._optimize - INFO - Trial 263 pruned. 
2026-05-15 21:03:01,403 - experiment_functions - INFO - Early stopping at epoch 2300. Best Recall: 0.0795
2026-05-15 21:03:01,508 - optuna.study.study - INFO - Trial 264 finished with value: 0.07945450065865829 and parameters: {'n_layers': 1, 'embedding_dim': 256, 'lr': 0.0014828122712840816, 'lambda_val': 3.740777912389409e-05, 'batch_size': 979, 'optimizer': 'Adam'}. Best is trial 234 with value: 0.08433565617451873.
2026-05-15 21:03:05,188 - experiment_functions - INFO - Early stopping at epoch 500. Best Recall: 0.0014
2026-05-15 21:03:05,293 - optuna.study.study - INFO - Trial 265 finished with value: 0.001417568901154984 and parameters: {'n_layers': 1, 'embedding_dim': 256, 'lr': 0.0018155003596999396, 'lambda_val': 4.8324955424810976e-05, 'batch_size': 1084, 'optimizer': 'SGD'}. Best is trial 234 with value: 0.08433565617451873.
2026-05-15 21:03:12,107 - optuna.study._optimize - INFO - Trial 266 pruned. 
2026-05-15 21:03:21,115 - experiment_functions - INFO - Early stopping at epoch 1350. Best Recall: 0.0756
2026-05-15 21:03:21,219 - optuna.study.study - INFO - Trial 267 finished with value: 0.07559066501976097 and parameters: {'n_layers': 1, 'embedding_dim': 256, 'lr': 0.0019268550760441622, 'lambda_val': 3.4312930843454704e-05, 'batch_size': 1128, 'optimizer': 'Adam'}. Best is trial 234 with value: 0.08433565617451873.
2026-05-15 21:03:26,287 - experiment_functions - INFO - Early stopping at epoch 650. Best Recall: 0.0453
2026-05-15 21:03:26,392 - optuna.study.study - INFO - Trial 268 finished with value: 0.04531165038118469 and parameters: {'n_layers': 3, 'embedding_dim': 96, 'lr': 0.0013456461345442666, 'lambda_val': 4.9799600750032194e-05, 'batch_size': 972, 'optimizer': 'Adam'}. Best is trial 234 with value: 0.08433565617451873.
2026-05-15 21:03:38,491 - experiment_functions - INFO - Early stopping at epoch 1900. Best Recall: 0.0764
2026-05-15 21:03:38,583 - optuna.study.study - INFO - Trial 269 finished with value: 0.0763606952919239 and parameters: {'n_layers': 1, 'embedding_dim': 256, 'lr': 0.0009670603610888791, 'lambda_val': 2.5083976012084626e-05, 'batch_size': 824, 'optimizer': 'Adam'}. Best is trial 234 with value: 0.08433565617451873.
2026-05-15 21:03:48,269 - experiment_functions - INFO - Early stopping at epoch 1450. Best Recall: 0.0813
2026-05-15 21:03:48,359 - optuna.study.study - INFO - Trial 270 finished with value: 0.0812863274611373 and parameters: {'n_layers': 1, 'embedding_dim': 256, 'lr': 0.0015682845303040033, 'lambda_val': 4.061492798362406e-05, 'batch_size': 1042, 'optimizer': 'Adam'}. Best is trial 234 with value: 0.08433565617451873.
2026-05-15 21:04:03,838 - experiment_functions - INFO - Early stopping at epoch 2350. Best Recall: 0.0774
2026-05-15 21:04:03,976 - optuna.study.study - INFO - Trial 271 finished with value: 0.07742648789414901 and parameters: {'n_layers': 1, 'embedding_dim': 256, 'lr': 0.001621417258945434, 'lambda_val': 3.929183617705765e-05, 'batch_size': 1060, 'optimizer': 'Adam'}. Best is trial 234 with value: 0.08433565617451873.
2026-05-15 21:04:23,614 - experiment_functions - INFO - Early stopping at epoch 2200. Best Recall: 0.0776
2026-05-15 21:04:23,727 - optuna.study.study - INFO - Trial 272 finished with value: 0.0776316294966449 and parameters: {'n_layers': 1, 'embedding_dim': 256, 'lr': 0.002203748155426632, 'lambda_val': 3.149794658370109e-05, 'batch_size': 991, 'optimizer': 'Adam'}. Best is trial 234 with value: 0.08433565617451873.
2026-05-15 21:04:37,906 - optuna.study._optimize - INFO - Trial 273 pruned. 
2026-05-15 21:04:44,809 - experiment_functions - INFO - Early stopping at epoch 1100. Best Recall: 0.0730
2026-05-15 21:04:44,891 - optuna.study.study - INFO - Trial 274 finished with value: 0.0730096776117024 and parameters: {'n_layers': 1, 'embedding_dim': 256, 'lr': 0.003664781389298398, 'lambda_val': 6.266343124918136e-05, 'batch_size': 1082, 'optimizer': 'Adam'}. Best is trial 234 with value: 0.08433565617451873.
2026-05-15 21:04:50,711 - optuna.study._optimize - INFO - Trial 275 pruned. 
2026-05-15 21:04:57,516 - optuna.study._optimize - INFO - Trial 276 pruned. 
2026-05-15 21:05:09,113 - optuna.study._optimize - INFO - Trial 277 pruned. 
2026-05-15 21:05:29,005 - experiment_functions - INFO - Early stopping at epoch 3200. Best Recall: 0.0845
2026-05-15 21:05:29,092 - optuna.study.study - INFO - Trial 278 finished with value: 0.08447676249212614 and parameters: {'n_layers': 1, 'embedding_dim': 256, 'lr': 0.0009924795847626577, 'lambda_val': 2.8939538300863643e-05, 'batch_size': 903, 'optimizer': 'Adam'}. Best is trial 278 with value: 0.08447676249212614.
2026-05-15 21:05:39,358 - experiment_functions - INFO - Early stopping at epoch 1650. Best Recall: 0.0832
2026-05-15 21:05:39,484 - optuna.study.study - INFO - Trial 279 finished with value: 0.08318861627352546 and parameters: {'n_layers': 1, 'embedding_dim': 256, 'lr': 0.0009625439730424506, 'lambda_val': 1.765129089604647e-05, 'batch_size': 887, 'optimizer': 'Adam'}. Best is trial 278 with value: 0.08447676249212614.
2026-05-15 21:05:47,224 - experiment_functions - INFO - Early stopping at epoch 1000. Best Recall: 0.0752
2026-05-15 21:05:47,327 - optuna.study.study - INFO - Trial 280 finished with value: 0.07524437184280275 and parameters: {'n_layers': 1, 'embedding_dim': 256, 'lr': 0.001098558088111247, 'lambda_val': 1.896508936414913e-05, 'batch_size': 899, 'optimizer': 'Adam'}. Best is trial 278 with value: 0.08447676249212614.
2026-05-15 21:05:57,667 - experiment_functions - INFO - Early stopping at epoch 1500. Best Recall: 0.0919
2026-05-15 21:05:57,781 - optuna.study.study - INFO - Trial 281 finished with value: 0.09189053824090239 and parameters: {'n_layers': 1, 'embedding_dim': 256, 'lr': 0.0014561844735680957, 'lambda_val': 1.7403344698162353e-05, 'batch_size': 881, 'optimizer': 'Adam'}. Best is trial 281 with value: 0.09189053824090239.
2026-05-15 21:06:04,925 - optuna.study._optimize - INFO - Trial 282 pruned. 
2026-05-15 21:06:19,139 - experiment_functions - INFO - Early stopping at epoch 2100. Best Recall: 0.0825
2026-05-15 21:06:19,230 - optuna.study.study - INFO - Trial 283 finished with value: 0.08248521231899364 and parameters: {'n_layers': 1, 'embedding_dim': 256, 'lr': 0.0015451150277403516, 'lambda_val': 1.4569865613288508e-05, 'batch_size': 775, 'optimizer': 'Adam'}. Best is trial 281 with value: 0.09189053824090239.
2026-05-15 21:06:35,734 - experiment_functions - INFO - Early stopping at epoch 2300. Best Recall: 0.0786
2026-05-15 21:06:35,836 - optuna.study.study - INFO - Trial 284 finished with value: 0.0785682935011341 and parameters: {'n_layers': 1, 'embedding_dim': 256, 'lr': 0.0009704730881996288, 'lambda_val': 1.3895469700280669e-05, 'batch_size': 921, 'optimizer': 'Adam'}. Best is trial 281 with value: 0.09189053824090239.
2026-05-15 21:06:42,723 - experiment_functions - INFO - Early stopping at epoch 1000. Best Recall: 0.0693
2026-05-15 21:06:42,849 - optuna.study.study - INFO - Trial 285 finished with value: 0.06926399453585624 and parameters: {'n_layers': 1, 'embedding_dim': 256, 'lr': 0.0010472187879116133, 'lambda_val': 1.1736067949769313e-05, 'batch_size': 780, 'optimizer': 'Adam'}. Best is trial 281 with value: 0.09189053824090239.
2026-05-15 21:06:57,021 - experiment_functions - INFO - Early stopping at epoch 2250. Best Recall: 0.0780
2026-05-15 21:06:57,157 - optuna.study.study - INFO - Trial 286 finished with value: 0.0780301316712203 and parameters: {'n_layers': 1, 'embedding_dim': 256, 'lr': 0.0019247867554664955, 'lambda_val': 1.4685055771867631e-05, 'batch_size': 907, 'optimizer': 'Adam'}. Best is trial 281 with value: 0.09189053824090239.
2026-05-15 21:07:08,635 - optuna.study._optimize - INFO - Trial 287 pruned. 
2026-05-15 21:07:14,454 - experiment_functions - INFO - Early stopping at epoch 650. Best Recall: 0.0519
2026-05-15 21:07:14,534 - optuna.study.study - INFO - Trial 288 finished with value: 0.051943985284627125 and parameters: {'n_layers': 2, 'embedding_dim': 256, 'lr': 0.00124162568320735, 'lambda_val': 2.067525966014732e-05, 'batch_size': 765, 'optimizer': 'Adam'}. Best is trial 281 with value: 0.09189053824090239.
2026-05-15 21:07:18,506 - experiment_functions - INFO - Early stopping at epoch 500. Best Recall: 0.0023
2026-05-15 21:07:18,607 - optuna.study.study - INFO - Trial 289 finished with value: 0.0023276624488435716 and parameters: {'n_layers': 1, 'embedding_dim': 256, 'lr': 0.001678772199353136, 'lambda_val': 1.1810787615525378e-05, 'batch_size': 648, 'optimizer': 'SGD'}. Best is trial 281 with value: 0.09189053824090239.
2026-05-15 21:07:27,251 - optuna.study._optimize - INFO - Trial 290 pruned. 
2026-05-15 21:07:37,470 - experiment_functions - INFO - Early stopping at epoch 1500. Best Recall: 0.0793
2026-05-15 21:07:37,551 - optuna.study.study - INFO - Trial 291 finished with value: 0.07928643990522488 and parameters: {'n_layers': 1, 'embedding_dim': 256, 'lr': 0.001186850282095284, 'lambda_val': 2.3508440062704805e-05, 'batch_size': 948, 'optimizer': 'Adam'}. Best is trial 281 with value: 0.09189053824090239.
2026-05-15 21:07:50,739 - experiment_functions - INFO - Early stopping at epoch 750. Best Recall: 0.0678
2026-05-15 21:07:51,501 - optuna.study.study - INFO - Trial 292 finished with value: 0.0677614700464188 and parameters: {'n_layers': 1, 'embedding_dim': 256, 'lr': 0.0014617795211297145, 'lambda_val': 2.740155468998349e-05, 'batch_size': 989, 'optimizer': 'Adam'}. Best is trial 281 with value: 0.09189053824090239.
2026-05-15 21:08:13,637 - experiment_functions - INFO - Early stopping at epoch 1900. Best Recall: 0.0807
2026-05-15 21:08:13,736 - optuna.study.study - INFO - Trial 293 finished with value: 0.08068121699702553 and parameters: {'n_layers': 1, 'embedding_dim': 256, 'lr': 0.001217420774081531, 'lambda_val': 2.2195877976154852e-05, 'batch_size': 805, 'optimizer': 'Adam'}. Best is trial 281 with value: 0.09189053824090239.
2026-05-15 21:08:20,231 - optuna.study._optimize - INFO - Trial 294 pruned. 
2026-05-15 21:08:30,200 - experiment_functions - INFO - Early stopping at epoch 1500. Best Recall: 0.0756
2026-05-15 21:08:30,966 - optuna.study.study - INFO - Trial 295 finished with value: 0.07561209312866458 and parameters: {'n_layers': 1, 'embedding_dim': 256, 'lr': 0.0015730195549560745, 'lambda_val': 2.348166716240398e-05, 'batch_size': 837, 'optimizer': 'Adam'}. Best is trial 281 with value: 0.09189053824090239.
2026-05-15 21:08:46,561 - optuna.study._optimize - INFO - Trial 296 pruned. 
2026-05-15 21:08:55,162 - experiment_functions - INFO - Early stopping at epoch 1350. Best Recall: 0.0743
2026-05-15 21:08:55,254 - optuna.study.study - INFO - Trial 297 finished with value: 0.0743166484404889 and parameters: {'n_layers': 1, 'embedding_dim': 256, 'lr': 0.0011678991719116841, 'lambda_val': 1.8469602930149487e-05, 'batch_size': 730, 'optimizer': 'Adam'}. Best is trial 281 with value: 0.09189053824090239.
2026-05-15 21:09:15,293 - experiment_functions - INFO - Early stopping at epoch 3300. Best Recall: 0.0808
2026-05-15 21:09:15,383 - optuna.study.study - INFO - Trial 298 finished with value: 0.08075161205532351 and parameters: {'n_layers': 1, 'embedding_dim': 256, 'lr': 0.0014024287318840963, 'lambda_val': 2.5156222929660986e-05, 'batch_size': 830, 'optimizer': 'Adam'}. Best is trial 281 with value: 0.09189053824090239.
2026-05-15 21:09:30,801 - experiment_functions - INFO - Early stopping at epoch 2600. Best Recall: 0.0819
2026-05-15 21:09:30,893 - optuna.study.study - INFO - Trial 299 finished with value: 0.08186226765518362 and parameters: {'n_layers': 1, 'embedding_dim': 256, 'lr': 0.000870571430710147, 'lambda_val': 2.181075914253894e-05, 'batch_size': 962, 'optimizer': 'Adam'}. Best is trial 281 with value: 0.09189053824090239.
2026-05-15 21:09:34,935 - experiment_functions - INFO - Early stopping at epoch 1100. Best Recall: 0.0770
2026-05-15 21:09:35,037 - root - INFO -   **** Training e_100K_1c1dcs_rand1
2026-05-15 21:09:35,051 - root - INFO -   **** Getting 65267/81200 random edges
2026-05-15 21:09:35,156 - optuna.storages._rdb.storage - INFO - A new study created in RDB with name: Study_e_100K_1c1dcs_rand1
2026-05-15 21:09:39,941 - experiment_functions - INFO - Early stopping at epoch 500. Best Recall: 0.0012
2026-05-15 21:09:40,036 - optuna.study.study - INFO - Trial 0 finished with value: 0.0012445965158136359 and parameters: {'n_layers': 3, 'embedding_dim': 256, 'lr': 0.004755266625610567, 'lambda_val': 0.0002849233982006607, 'batch_size': 1107, 'optimizer': 'SGD'}. Best is trial 0 with value: 0.0012445965158136359.
2026-05-15 21:09:58,719 - experiment_functions - INFO - Early stopping at epoch 1550. Best Recall: 0.1140
2026-05-15 21:09:58,848 - optuna.study.study - INFO - Trial 1 finished with value: 0.1140356243916405 and parameters: {'n_layers': 1, 'embedding_dim': 128, 'lr': 0.0006386528148370458, 'lambda_val': 4.526801319725321e-06, 'batch_size': 2511, 'optimizer': 'Adam'}. Best is trial 1 with value: 0.1140356243916405.
2026-05-15 21:10:04,780 - experiment_functions - INFO - Early stopping at epoch 900. Best Recall: 0.0431
2026-05-15 21:10:04,952 - optuna.study.study - INFO - Trial 2 finished with value: 0.043113218032667176 and parameters: {'n_layers': 2, 'embedding_dim': 32, 'lr': 0.0007250012942583023, 'lambda_val': 1.6925962310276235e-06, 'batch_size': 3403, 'optimizer': 'RMSprop'}. Best is trial 1 with value: 0.1140356243916405.
2026-05-15 21:10:08,959 - experiment_functions - INFO - Early stopping at epoch 500. Best Recall: 0.0010
2026-05-15 21:10:09,049 - optuna.study.study - INFO - Trial 3 finished with value: 0.0009671920518866197 and parameters: {'n_layers': 1, 'embedding_dim': 96, 'lr': 4.709565971590524e-05, 'lambda_val': 0.009829662996603445, 'batch_size': 3731, 'optimizer': 'SGD'}. Best is trial 1 with value: 0.1140356243916405.
2026-05-15 21:10:16,773 - experiment_functions - INFO - Early stopping at epoch 800. Best Recall: 0.0240
2026-05-15 21:10:16,884 - optuna.study.study - INFO - Trial 4 finished with value: 0.023976296275433597 and parameters: {'n_layers': 4, 'embedding_dim': 256, 'lr': 0.005010340785405023, 'lambda_val': 9.82839666098885e-06, 'batch_size': 2044, 'optimizer': 'RMSprop'}. Best is trial 1 with value: 0.1140356243916405.
2026-05-15 21:10:23,290 - experiment_functions - INFO - Early stopping at epoch 950. Best Recall: 0.0270
2026-05-15 21:10:23,371 - optuna.study.study - INFO - Trial 5 finished with value: 0.027009806176715355 and parameters: {'n_layers': 3, 'embedding_dim': 64, 'lr': 0.009853744932127277, 'lambda_val': 1.7715678547366518e-06, 'batch_size': 1641, 'optimizer': 'Adam'}. Best is trial 1 with value: 0.1140356243916405.
2026-05-15 21:10:27,694 - experiment_functions - INFO - Early stopping at epoch 500. Best Recall: 0.0014
