2026-05-15 21:27:12,049 - optuna.study.study - INFO - Trial 146 finished with value: 0.12186018533361535 and parameters: {'n_layers': 1, 'embedding_dim': 256, 'lr': 0.00045383083972193474, 'lambda_val': 2.9960230883113563e-06, 'batch_size': 3724, 'optimizer': 'Adam'}. Best is trial 132 with value: 0.12389539488164372.
2026-05-15 21:27:19,739 - optuna.study._optimize - INFO - Trial 147 pruned. 
2026-05-15 21:27:28,299 - optuna.study._optimize - INFO - Trial 148 pruned. 
2026-05-15 21:27:36,723 - experiment_functions - INFO - Early stopping at epoch 1250. Best Recall: 0.1242
2026-05-15 21:27:36,827 - optuna.study.study - INFO - Trial 149 finished with value: 0.12418330317972764 and parameters: {'n_layers': 1, 'embedding_dim': 256, 'lr': 0.0005582032929850149, 'lambda_val': 3.269412041964491e-06, 'batch_size': 3680, 'optimizer': 'Adam'}. Best is trial 149 with value: 0.12418330317972764.
2026-05-15 21:27:43,655 - optuna.study._optimize - INFO - Trial 150 pruned. 
2026-05-15 21:27:51,255 - optuna.study._optimize - INFO - Trial 151 pruned. 
2026-05-15 21:28:01,015 - optuna.study._optimize - INFO - Trial 152 pruned. 
2026-05-15 21:28:21,193 - experiment_functions - INFO - Early stopping at epoch 1450. Best Recall: 0.1147
2026-05-15 21:28:21,292 - optuna.study.study - INFO - Trial 153 finished with value: 0.11468488842316353 and parameters: {'n_layers': 1, 'embedding_dim': 256, 'lr': 0.00045742775054128634, 'lambda_val': 1.7571724989145767e-06, 'batch_size': 3885, 'optimizer': 'Adam'}. Best is trial 149 with value: 0.12418330317972764.
2026-05-15 21:28:32,919 - experiment_functions - INFO - Early stopping at epoch 1050. Best Recall: 0.1146
2026-05-15 21:28:33,021 - optuna.study.study - INFO - Trial 154 finished with value: 0.11460762236392706 and parameters: {'n_layers': 1, 'embedding_dim': 256, 'lr': 0.0005989144470375952, 'lambda_val': 1.4886195105397267e-06, 'batch_size': 3917, 'optimizer': 'Adam'}. Best is trial 149 with value: 0.12418330317972764.
2026-05-15 21:28:41,497 - optuna.study._optimize - INFO - Trial 155 pruned. 
2026-05-15 21:28:52,245 - experiment_functions - INFO - Early stopping at epoch 1100. Best Recall: 0.1140
2026-05-15 21:28:52,346 - optuna.study.study - INFO - Trial 156 finished with value: 0.11397227774734016 and parameters: {'n_layers': 1, 'embedding_dim': 256, 'lr': 0.0005314073416026537, 'lambda_val': 6.267130422734308e-06, 'batch_size': 3819, 'optimizer': 'Adam'}. Best is trial 149 with value: 0.12418330317972764.
2026-05-15 21:28:56,412 - experiment_functions - INFO - Early stopping at epoch 500. Best Recall: 0.0015
2026-05-15 21:28:56,521 - optuna.study.study - INFO - Trial 157 finished with value: 0.001538707405707355 and parameters: {'n_layers': 1, 'embedding_dim': 256, 'lr': 0.000628660976328752, 'lambda_val': 4.7688328980855746e-06, 'batch_size': 3660, 'optimizer': 'SGD'}. Best is trial 149 with value: 0.12418330317972764.
2026-05-15 21:29:05,979 - optuna.study._optimize - INFO - Trial 158 pruned. 
2026-05-15 21:29:12,814 - optuna.study._optimize - INFO - Trial 159 pruned. 
2026-05-15 21:29:21,974 - experiment_functions - INFO - Early stopping at epoch 1250. Best Recall: 0.1211
2026-05-15 21:29:22,064 - optuna.study.study - INFO - Trial 160 finished with value: 0.12107923711534953 and parameters: {'n_layers': 1, 'embedding_dim': 256, 'lr': 0.0004992214424405576, 'lambda_val': 1.4225654495899704e-06, 'batch_size': 3840, 'optimizer': 'Adam'}. Best is trial 149 with value: 0.12418330317972764.
2026-05-15 21:29:30,196 - optuna.study._optimize - INFO - Trial 161 pruned. 
2026-05-15 21:29:52,211 - experiment_functions - INFO - Early stopping at epoch 2450. Best Recall: 0.1190
2026-05-15 21:29:52,313 - optuna.study.study - INFO - Trial 162 finished with value: 0.11900594752042222 and parameters: {'n_layers': 1, 'embedding_dim': 256, 'lr': 0.0003438890328632076, 'lambda_val': 2.0471689865496947e-06, 'batch_size': 3729, 'optimizer': 'Adam'}. Best is trial 149 with value: 0.12418330317972764.
2026-05-15 21:30:01,382 - experiment_functions - INFO - Early stopping at epoch 1000. Best Recall: 0.1164
2026-05-15 21:30:01,461 - optuna.study.study - INFO - Trial 163 finished with value: 0.1164439176359583 and parameters: {'n_layers': 1, 'embedding_dim': 256, 'lr': 0.0006906093234913413, 'lambda_val': 1.825060643930972e-06, 'batch_size': 3693, 'optimizer': 'Adam'}. Best is trial 149 with value: 0.12418330317972764.
2026-05-15 21:30:08,425 - optuna.study._optimize - INFO - Trial 164 pruned. 
2026-05-15 21:30:16,213 - optuna.study._optimize - INFO - Trial 165 pruned. 
2026-05-15 21:30:31,791 - experiment_functions - INFO - Early stopping at epoch 1750. Best Recall: 0.1169
2026-05-15 21:30:31,928 - optuna.study.study - INFO - Trial 166 finished with value: 0.116944326454802 and parameters: {'n_layers': 1, 'embedding_dim': 256, 'lr': 0.0003975871574028474, 'lambda_val': 3.4680440228880627e-06, 'batch_size': 3756, 'optimizer': 'Adam'}. Best is trial 149 with value: 0.12418330317972764.
2026-05-15 21:30:37,897 - optuna.study._optimize - INFO - Trial 167 pruned. 
2026-05-15 21:30:47,894 - optuna.study._optimize - INFO - Trial 168 pruned. 
2026-05-15 21:30:56,232 - optuna.study._optimize - INFO - Trial 169 pruned. 
2026-05-15 21:31:02,385 - optuna.study._optimize - INFO - Trial 170 pruned. 
2026-05-15 21:31:08,801 - experiment_functions - INFO - Early stopping at epoch 900. Best Recall: 0.1065
2026-05-15 21:31:08,902 - optuna.study.study - INFO - Trial 171 finished with value: 0.10647865274067415 and parameters: {'n_layers': 1, 'embedding_dim': 256, 'lr': 0.000667103176995555, 'lambda_val': 2.2756364296436444e-06, 'batch_size': 3797, 'optimizer': 'Adam'}. Best is trial 149 with value: 0.12418330317972764.
2026-05-15 21:31:16,282 - optuna.study._optimize - INFO - Trial 172 pruned. 
2026-05-15 21:31:25,118 - optuna.study._optimize - INFO - Trial 173 pruned. 
2026-05-15 21:31:39,192 - experiment_functions - INFO - Early stopping at epoch 950. Best Recall: 0.1195
2026-05-15 21:31:39,284 - optuna.study.study - INFO - Trial 174 finished with value: 0.11952359047163762 and parameters: {'n_layers': 1, 'embedding_dim': 256, 'lr': 0.0007593550992778611, 'lambda_val': 1.492542683175129e-06, 'batch_size': 3758, 'optimizer': 'Adam'}. Best is trial 149 with value: 0.12418330317972764.
2026-05-15 21:31:46,055 - optuna.study._optimize - INFO - Trial 175 pruned. 
2026-05-15 21:31:53,178 - experiment_functions - INFO - Early stopping at epoch 1100. Best Recall: 0.1155
2026-05-15 21:31:53,278 - optuna.study.study - INFO - Trial 176 finished with value: 0.11546748048381716 and parameters: {'n_layers': 1, 'embedding_dim': 256, 'lr': 0.0005715638625781636, 'lambda_val': 1.6358586566430943e-06, 'batch_size': 3678, 'optimizer': 'Adam'}. Best is trial 149 with value: 0.12418330317972764.
2026-05-15 21:31:58,761 - experiment_functions - INFO - Early stopping at epoch 700. Best Recall: 0.1125
2026-05-15 21:31:58,862 - optuna.study.study - INFO - Trial 177 finished with value: 0.11247281979778266 and parameters: {'n_layers': 1, 'embedding_dim': 256, 'lr': 0.001040301529809871, 'lambda_val': 3.092055972242947e-06, 'batch_size': 3789, 'optimizer': 'Adam'}. Best is trial 149 with value: 0.12418330317972764.
2026-05-15 21:32:05,280 - optuna.study._optimize - INFO - Trial 178 pruned. 
2026-05-15 21:32:16,211 - optuna.study._optimize - INFO - Trial 179 pruned. 
2026-05-15 21:32:21,880 - experiment_functions - INFO - Early stopping at epoch 800. Best Recall: 0.1065
2026-05-15 21:32:21,982 - optuna.study.study - INFO - Trial 180 finished with value: 0.10652746111407002 and parameters: {'n_layers': 1, 'embedding_dim': 256, 'lr': 0.0012716405060311387, 'lambda_val': 1.7874678820383782e-06, 'batch_size': 3917, 'optimizer': 'Adam'}. Best is trial 149 with value: 0.12418330317972764.
2026-05-15 21:32:30,611 - experiment_functions - INFO - Early stopping at epoch 1300. Best Recall: 0.1128
2026-05-15 21:32:30,702 - optuna.study.study - INFO - Trial 181 finished with value: 0.11282738735426373 and parameters: {'n_layers': 1, 'embedding_dim': 256, 'lr': 0.0006278149342321433, 'lambda_val': 2.590626043245697e-06, 'batch_size': 3855, 'optimizer': 'Adam'}. Best is trial 149 with value: 0.12418330317972764.
2026-05-15 21:32:39,964 - experiment_functions - INFO - Early stopping at epoch 1000. Best Recall: 0.1106
2026-05-15 21:32:40,062 - optuna.study.study - INFO - Trial 182 finished with value: 0.1106240867912285 and parameters: {'n_layers': 1, 'embedding_dim': 256, 'lr': 0.0007627759187839973, 'lambda_val': 1.0378368488118653e-06, 'batch_size': 3758, 'optimizer': 'Adam'}. Best is trial 149 with value: 0.12418330317972764.
2026-05-15 21:32:52,268 - experiment_functions - INFO - Early stopping at epoch 1850. Best Recall: 0.1185
2026-05-15 21:32:52,378 - optuna.study.study - INFO - Trial 183 finished with value: 0.11851839963981617 and parameters: {'n_layers': 1, 'embedding_dim': 256, 'lr': 0.0003504238645095002, 'lambda_val': 4.166729435475276e-06, 'batch_size': 3637, 'optimizer': 'Adam'}. Best is trial 149 with value: 0.12418330317972764.
2026-05-15 21:33:04,640 - experiment_functions - INFO - Early stopping at epoch 1900. Best Recall: 0.1190
2026-05-15 21:33:04,730 - optuna.study.study - INFO - Trial 184 finished with value: 0.11899519788387436 and parameters: {'n_layers': 1, 'embedding_dim': 256, 'lr': 0.0003322298220610262, 'lambda_val': 4.184443852987433e-06, 'batch_size': 3645, 'optimizer': 'Adam'}. Best is trial 149 with value: 0.12418330317972764.
2026-05-15 21:33:11,417 - optuna.study._optimize - INFO - Trial 185 pruned. 
2026-05-15 21:33:18,822 - optuna.study._optimize - INFO - Trial 186 pruned. 
2026-05-15 21:33:25,915 - optuna.study._optimize - INFO - Trial 187 pruned. 
2026-05-15 21:33:29,505 - experiment_functions - INFO - Early stopping at epoch 500. Best Recall: 0.0007
2026-05-15 21:33:29,596 - optuna.study.study - INFO - Trial 188 finished with value: 0.0007243740701872059 and parameters: {'n_layers': 1, 'embedding_dim': 256, 'lr': 0.00037218339661948524, 'lambda_val': 5.701583847694604e-06, 'batch_size': 3662, 'optimizer': 'SGD'}. Best is trial 149 with value: 0.12418330317972764.
2026-05-15 21:33:37,936 - experiment_functions - INFO - Early stopping at epoch 1250. Best Recall: 0.1204
2026-05-15 21:33:38,035 - optuna.study.study - INFO - Trial 189 finished with value: 0.12037822375849491 and parameters: {'n_layers': 1, 'embedding_dim': 256, 'lr': 0.0005429543810644603, 'lambda_val': 1.9303433404441477e-06, 'batch_size': 3511, 'optimizer': 'Adam'}. Best is trial 149 with value: 0.12418330317972764.
2026-05-15 21:33:44,904 - optuna.study._optimize - INFO - Trial 190 pruned. 
2026-05-15 21:33:57,874 - experiment_functions - INFO - Early stopping at epoch 1950. Best Recall: 0.1191
2026-05-15 21:33:57,954 - optuna.study.study - INFO - Trial 191 finished with value: 0.11910298793631524 and parameters: {'n_layers': 1, 'embedding_dim': 256, 'lr': 0.00048360350658646796, 'lambda_val': 2.023626386234493e-06, 'batch_size': 3706, 'optimizer': 'Adam'}. Best is trial 149 with value: 0.12418330317972764.
2026-05-15 21:34:06,262 - experiment_functions - INFO - Early stopping at epoch 1300. Best Recall: 0.1249
2026-05-15 21:34:06,357 - optuna.study.study - INFO - Trial 192 finished with value: 0.1249246012306143 and parameters: {'n_layers': 1, 'embedding_dim': 256, 'lr': 0.0005621136157376032, 'lambda_val': 1.3382975976885216e-06, 'batch_size': 3608, 'optimizer': 'Adam'}. Best is trial 192 with value: 0.1249246012306143.
2026-05-15 21:34:15,686 - optuna.study._optimize - INFO - Trial 193 pruned. 
2026-05-15 21:34:22,558 - optuna.study._optimize - INFO - Trial 194 pruned. 
2026-05-15 21:34:28,804 - optuna.study._optimize - INFO - Trial 195 pruned. 
2026-05-15 21:34:35,518 - optuna.study._optimize - INFO - Trial 196 pruned. 
2026-05-15 21:34:41,271 - optuna.study._optimize - INFO - Trial 197 pruned. 
2026-05-15 21:34:47,841 - optuna.study._optimize - INFO - Trial 198 pruned. 
2026-05-15 21:34:54,786 - optuna.study._optimize - INFO - Trial 199 pruned. 
2026-05-15 21:34:59,853 - experiment_functions - INFO - Early stopping at epoch 800. Best Recall: 0.1094
2026-05-15 21:34:59,932 - optuna.study.study - INFO - Trial 200 finished with value: 0.10936505389532106 and parameters: {'n_layers': 1, 'embedding_dim': 256, 'lr': 0.0008776627625714654, 'lambda_val': 3.51666287649284e-06, 'batch_size': 3941, 'optimizer': 'RMSprop'}. Best is trial 192 with value: 0.1249246012306143.
2026-05-15 21:35:07,411 - optuna.study._optimize - INFO - Trial 201 pruned. 
2026-05-15 21:35:15,202 - optuna.study._optimize - INFO - Trial 202 pruned. 
2026-05-15 21:35:22,193 - optuna.study._optimize - INFO - Trial 203 pruned. 
2026-05-15 21:35:29,044 - optuna.study._optimize - INFO - Trial 204 pruned. 
2026-05-15 21:35:36,186 - experiment_functions - INFO - Early stopping at epoch 1150. Best Recall: 0.1130
2026-05-15 21:35:36,333 - optuna.study.study - INFO - Trial 205 finished with value: 0.1129837142785871 and parameters: {'n_layers': 1, 'embedding_dim': 256, 'lr': 0.0004796153608091432, 'lambda_val': 1.249038913235379e-06, 'batch_size': 3467, 'optimizer': 'Adam'}. Best is trial 192 with value: 0.1249246012306143.
2026-05-15 21:35:41,978 - optuna.study._optimize - INFO - Trial 206 pruned. 
2026-05-15 21:35:48,905 - experiment_functions - INFO - Early stopping at epoch 1000. Best Recall: 0.1096
2026-05-15 21:35:49,005 - optuna.study.study - INFO - Trial 207 finished with value: 0.10956730916224362 and parameters: {'n_layers': 1, 'embedding_dim': 256, 'lr': 0.0007192797077243372, 'lambda_val': 1.0148763971785923e-06, 'batch_size': 3661, 'optimizer': 'Adam'}. Best is trial 192 with value: 0.1249246012306143.
2026-05-15 21:35:57,757 - experiment_functions - INFO - Early stopping at epoch 1350. Best Recall: 0.1150
2026-05-15 21:35:57,866 - optuna.study.study - INFO - Trial 208 finished with value: 0.11501490352472968 and parameters: {'n_layers': 1, 'embedding_dim': 256, 'lr': 0.000542396359228557, 'lambda_val': 2.924324157919837e-06, 'batch_size': 3796, 'optimizer': 'Adam'}. Best is trial 192 with value: 0.1249246012306143.
2026-05-15 21:36:04,484 - optuna.study._optimize - INFO - Trial 209 pruned. 
2026-05-15 21:36:09,817 - experiment_functions - INFO - Early stopping at epoch 750. Best Recall: 0.0982
2026-05-15 21:36:09,909 - optuna.study.study - INFO - Trial 210 finished with value: 0.09818341015403569 and parameters: {'n_layers': 1, 'embedding_dim': 256, 'lr': 0.0009952286157464047, 'lambda_val': 7.634288522554603e-06, 'batch_size': 3564, 'optimizer': 'Adam'}. Best is trial 192 with value: 0.1249246012306143.
2026-05-15 21:36:18,491 - optuna.study._optimize - INFO - Trial 211 pruned. 
2026-05-15 21:36:25,498 - optuna.study._optimize - INFO - Trial 212 pruned. 
2026-05-15 21:36:32,282 - optuna.study._optimize - INFO - Trial 213 pruned. 
2026-05-15 21:36:37,682 - optuna.study._optimize - INFO - Trial 214 pruned. 
2026-05-15 21:36:46,082 - experiment_functions - INFO - Early stopping at epoch 1300. Best Recall: 0.1146
2026-05-15 21:36:46,173 - optuna.study.study - INFO - Trial 215 finished with value: 0.11462163979930703 and parameters: {'n_layers': 1, 'embedding_dim': 256, 'lr': 0.0005656235333315529, 'lambda_val': 1.4068717009836349e-06, 'batch_size': 3642, 'optimizer': 'Adam'}. Best is trial 192 with value: 0.1249246012306143.
2026-05-15 21:36:52,537 - optuna.study._optimize - INFO - Trial 216 pruned. 
2026-05-15 21:36:58,961 - experiment_functions - INFO - Early stopping at epoch 1000. Best Recall: 0.1252
2026-05-15 21:36:59,043 - optuna.study.study - INFO - Trial 217 finished with value: 0.12518349483867272 and parameters: {'n_layers': 1, 'embedding_dim': 256, 'lr': 0.000844767054329912, 'lambda_val': 2.422669463051458e-06, 'batch_size': 3731, 'optimizer': 'Adam'}. Best is trial 217 with value: 0.12518349483867272.
2026-05-15 21:37:05,544 - experiment_functions - INFO - Early stopping at epoch 900. Best Recall: 0.1157
2026-05-15 21:37:05,635 - optuna.study.study - INFO - Trial 218 finished with value: 0.1156512022942038 and parameters: {'n_layers': 1, 'embedding_dim': 256, 'lr': 0.000867179229380122, 'lambda_val': 2.5954125896057882e-06, 'batch_size': 3921, 'optimizer': 'Adam'}. Best is trial 217 with value: 0.12518349483867272.
2026-05-15 21:37:11,185 - experiment_functions - INFO - Early stopping at epoch 800. Best Recall: 0.1125
2026-05-15 21:37:11,251 - optuna.study.study - INFO - Trial 219 finished with value: 0.11246108511532232 and parameters: {'n_layers': 1, 'embedding_dim': 256, 'lr': 0.0011291864585567287, 'lambda_val': 5.205862684122754e-06, 'batch_size': 3777, 'optimizer': 'Adam'}. Best is trial 217 with value: 0.12518349483867272.
2026-05-15 21:37:19,829 - optuna.study._optimize - INFO - Trial 220 pruned. 
2026-05-15 21:37:26,750 - experiment_functions - INFO - Early stopping at epoch 950. Best Recall: 0.1028
2026-05-15 21:37:26,849 - optuna.study.study - INFO - Trial 221 finished with value: 0.10279306490429341 and parameters: {'n_layers': 1, 'embedding_dim': 256, 'lr': 0.0006962672143442635, 'lambda_val': 1.9284480848799643e-06, 'batch_size': 3693, 'optimizer': 'Adam'}. Best is trial 217 with value: 0.12518349483867272.
2026-05-15 21:37:33,938 - optuna.study._optimize - INFO - Trial 222 pruned. 
2026-05-15 21:37:41,521 - optuna.study._optimize - INFO - Trial 223 pruned. 
2026-05-15 21:37:47,402 - experiment_functions - INFO - Early stopping at epoch 650. Best Recall: 0.0398
2026-05-15 21:37:47,493 - optuna.study.study - INFO - Trial 224 finished with value: 0.0398172573262011 and parameters: {'n_layers': 1, 'embedding_dim': 256, 'lr': 0.0008204084632348015, 'lambda_val': 0.03810690685648471, 'batch_size': 3829, 'optimizer': 'Adam'}. Best is trial 217 with value: 0.12518349483867272.
2026-05-15 21:37:53,564 - optuna.study._optimize - INFO - Trial 225 pruned. 
2026-05-15 21:38:01,589 - experiment_functions - INFO - Early stopping at epoch 950. Best Recall: 0.1148
2026-05-15 21:38:01,688 - optuna.study.study - INFO - Trial 226 finished with value: 0.11476779493935023 and parameters: {'n_layers': 1, 'embedding_dim': 256, 'lr': 0.0006381975064383662, 'lambda_val': 1.6880561247117582e-06, 'batch_size': 3690, 'optimizer': 'Adam'}. Best is trial 217 with value: 0.12518349483867272.
2026-05-15 21:38:05,343 - experiment_functions - INFO - Early stopping at epoch 500. Best Recall: 0.0017
2026-05-15 21:38:05,433 - optuna.study.study - INFO - Trial 227 finished with value: 0.001704326529877212 and parameters: {'n_layers': 1, 'embedding_dim': 256, 'lr': 0.00040953838478739827, 'lambda_val': 1.0048324125944572e-06, 'batch_size': 3901, 'optimizer': 'SGD'}. Best is trial 217 with value: 0.12518349483867272.
2026-05-15 21:38:12,328 - optuna.study._optimize - INFO - Trial 228 pruned. 
2026-05-15 21:38:23,582 - experiment_functions - INFO - Early stopping at epoch 1100. Best Recall: 0.1123
2026-05-15 21:38:23,673 - optuna.study.study - INFO - Trial 229 finished with value: 0.11234700590886923 and parameters: {'n_layers': 1, 'embedding_dim': 256, 'lr': 0.0007742253288224026, 'lambda_val': 1.4481418893360978e-06, 'batch_size': 3576, 'optimizer': 'Adam'}. Best is trial 217 with value: 0.12518349483867272.
2026-05-15 21:38:30,206 - optuna.study._optimize - INFO - Trial 230 pruned. 
2026-05-15 21:38:37,472 - optuna.study._optimize - INFO - Trial 231 pruned. 
2026-05-15 21:38:44,131 - optuna.study._optimize - INFO - Trial 232 pruned. 
2026-05-15 21:38:53,906 - experiment_functions - INFO - Early stopping at epoch 1500. Best Recall: 0.1154
2026-05-15 21:38:54,006 - optuna.study.study - INFO - Trial 233 finished with value: 0.11539988191876918 and parameters: {'n_layers': 1, 'embedding_dim': 256, 'lr': 0.0004746971149776542, 'lambda_val': 5.307335907024155e-06, 'batch_size': 3644, 'optimizer': 'Adam'}. Best is trial 217 with value: 0.12518349483867272.
2026-05-15 21:39:02,170 - experiment_functions - INFO - Early stopping at epoch 1100. Best Recall: 0.1151
2026-05-15 21:39:02,294 - optuna.study.study - INFO - Trial 234 finished with value: 0.11507236061646599 and parameters: {'n_layers': 1, 'embedding_dim': 256, 'lr': 0.0006011682971698644, 'lambda_val': 3.2965224249934377e-06, 'batch_size': 3933, 'optimizer': 'Adam'}. Best is trial 217 with value: 0.12518349483867272.
2026-05-15 21:39:12,849 - optuna.study._optimize - INFO - Trial 235 pruned. 
2026-05-15 21:39:20,223 - optuna.study._optimize - INFO - Trial 236 pruned. 
2026-05-15 21:39:28,576 - optuna.study._optimize - INFO - Trial 237 pruned. 
2026-05-15 21:39:35,735 - optuna.study._optimize - INFO - Trial 238 pruned. 
2026-05-15 21:39:53,114 - optuna.study._optimize - INFO - Trial 239 pruned. 
2026-05-15 21:40:03,244 - optuna.study._optimize - INFO - Trial 240 pruned. 
2026-05-15 21:40:12,450 - experiment_functions - INFO - Early stopping at epoch 1350. Best Recall: 0.1234
2026-05-15 21:40:12,551 - optuna.study.study - INFO - Trial 241 finished with value: 0.12343416325555151 and parameters: {'n_layers': 1, 'embedding_dim': 256, 'lr': 0.0007048243765074468, 'lambda_val': 2.190546251601422e-06, 'batch_size': 1321, 'optimizer': 'Adam'}. Best is trial 217 with value: 0.12518349483867272.
2026-05-15 21:40:19,695 - optuna.study._optimize - INFO - Trial 242 pruned. 
2026-05-15 21:40:27,268 - optuna.study._optimize - INFO - Trial 243 pruned. 
2026-05-15 21:40:34,369 - optuna.study._optimize - INFO - Trial 244 pruned. 
2026-05-15 21:40:51,145 - experiment_functions - INFO - Early stopping at epoch 1950. Best Recall: 0.1208
2026-05-15 21:40:51,253 - optuna.study.study - INFO - Trial 245 finished with value: 0.12082207379492076 and parameters: {'n_layers': 1, 'embedding_dim': 256, 'lr': 0.0004550899919925604, 'lambda_val': 1.979455977414246e-06, 'batch_size': 1409, 'optimizer': 'Adam'}. Best is trial 217 with value: 0.12518349483867272.
2026-05-15 21:41:05,665 - experiment_functions - INFO - Early stopping at epoch 2100. Best Recall: 0.1211
