2026-05-15 23:04:50,115 - optuna.study.study - INFO - Trial 243 finished with value: 0.12042546128127847 and parameters: {'n_layers': 1, 'embedding_dim': 256, 'lr': 0.000670620138300764, 'lambda_val': 7.802944440753325e-06, 'batch_size': 1806, 'optimizer': 'Adam'}. Best is trial 237 with value: 0.1329494425209514.
2026-05-15 23:04:56,660 - optuna.study._optimize - INFO - Trial 244 pruned. 
2026-05-15 23:05:05,793 - optuna.study._optimize - INFO - Trial 245 pruned. 
2026-05-15 23:05:12,808 - optuna.study._optimize - INFO - Trial 246 pruned. 
2026-05-15 23:05:19,585 - optuna.study._optimize - INFO - Trial 247 pruned. 
2026-05-15 23:05:26,381 - optuna.study._optimize - INFO - Trial 248 pruned. 
2026-05-15 23:05:32,773 - optuna.study._optimize - INFO - Trial 249 pruned. 
2026-05-15 23:05:39,943 - experiment_functions - INFO - Early stopping at epoch 1150. Best Recall: 0.1167
2026-05-15 23:05:40,029 - optuna.study.study - INFO - Trial 250 finished with value: 0.11670276527728983 and parameters: {'n_layers': 1, 'embedding_dim': 256, 'lr': 0.0007690340841616171, 'lambda_val': 2.8120081067210727e-06, 'batch_size': 1696, 'optimizer': 'Adam'}. Best is trial 237 with value: 0.1329494425209514.
2026-05-15 23:05:50,847 - experiment_functions - INFO - Early stopping at epoch 1700. Best Recall: 0.1336
2026-05-15 23:05:50,950 - optuna.study.study - INFO - Trial 251 finished with value: 0.13362848931190816 and parameters: {'n_layers': 1, 'embedding_dim': 256, 'lr': 0.0005764894104138241, 'lambda_val': 1.1739877236836903e-05, 'batch_size': 1826, 'optimizer': 'Adam'}. Best is trial 251 with value: 0.13362848931190816.
2026-05-15 23:05:58,116 - optuna.study._optimize - INFO - Trial 252 pruned. 
2026-05-15 23:06:01,600 - experiment_functions - INFO - Early stopping at epoch 500. Best Recall: 0.0036
2026-05-15 23:06:01,702 - optuna.study.study - INFO - Trial 253 finished with value: 0.00362408360829122 and parameters: {'n_layers': 1, 'embedding_dim': 32, 'lr': 0.0004001621350405124, 'lambda_val': 1.346211808107385e-05, 'batch_size': 1643, 'optimizer': 'SGD'}. Best is trial 251 with value: 0.13362848931190816.
2026-05-15 23:06:09,136 - optuna.study._optimize - INFO - Trial 254 pruned. 
2026-05-15 23:06:15,636 - optuna.study._optimize - INFO - Trial 255 pruned. 
2026-05-15 23:06:22,895 - optuna.study._optimize - INFO - Trial 256 pruned. 
2026-05-15 23:06:29,793 - optuna.study._optimize - INFO - Trial 257 pruned. 
2026-05-15 23:06:35,749 - optuna.study._optimize - INFO - Trial 258 pruned. 
2026-05-15 23:06:42,882 - optuna.study._optimize - INFO - Trial 259 pruned. 
2026-05-15 23:06:49,203 - optuna.study._optimize - INFO - Trial 260 pruned. 
2026-05-15 23:06:58,718 - experiment_functions - INFO - Early stopping at epoch 1500. Best Recall: 0.1210
2026-05-15 23:06:58,863 - optuna.study.study - INFO - Trial 261 finished with value: 0.12103682972661231 and parameters: {'n_layers': 1, 'embedding_dim': 256, 'lr': 0.0006536569534062251, 'lambda_val': 1.287649605324983e-05, 'batch_size': 1601, 'optimizer': 'Adam'}. Best is trial 251 with value: 0.13362848931190816.
2026-05-15 23:07:05,435 - optuna.study._optimize - INFO - Trial 262 pruned. 
2026-05-15 23:07:11,082 - optuna.study._optimize - INFO - Trial 263 pruned. 
2026-05-15 23:07:17,891 - optuna.study._optimize - INFO - Trial 264 pruned. 
2026-05-15 23:07:24,742 - optuna.study._optimize - INFO - Trial 265 pruned. 
2026-05-15 23:07:33,898 - experiment_functions - INFO - Early stopping at epoch 1450. Best Recall: 0.1210
2026-05-15 23:07:33,998 - optuna.study.study - INFO - Trial 266 finished with value: 0.12102844315607135 and parameters: {'n_layers': 1, 'embedding_dim': 256, 'lr': 0.0006611763624710265, 'lambda_val': 8.141248409291403e-06, 'batch_size': 1766, 'optimizer': 'Adam'}. Best is trial 251 with value: 0.13362848931190816.
2026-05-15 23:07:45,586 - experiment_functions - INFO - Early stopping at epoch 1550. Best Recall: 0.1211
2026-05-15 23:07:45,675 - optuna.study.study - INFO - Trial 267 finished with value: 0.12114998882360875 and parameters: {'n_layers': 1, 'embedding_dim': 256, 'lr': 0.000522726793163663, 'lambda_val': 4.1775372335284606e-06, 'batch_size': 1842, 'optimizer': 'RMSprop'}. Best is trial 251 with value: 0.13362848931190816.
2026-05-15 23:07:52,371 - optuna.study._optimize - INFO - Trial 268 pruned. 
2026-05-15 23:08:00,815 - optuna.study._optimize - INFO - Trial 269 pruned. 
2026-05-15 23:08:08,769 - optuna.study._optimize - INFO - Trial 270 pruned. 
2026-05-15 23:08:19,009 - experiment_functions - INFO - Early stopping at epoch 1600. Best Recall: 0.1248
2026-05-15 23:08:19,142 - optuna.study.study - INFO - Trial 271 finished with value: 0.12481744850042986 and parameters: {'n_layers': 1, 'embedding_dim': 256, 'lr': 0.0004869296352497667, 'lambda_val': 6.957811921209135e-06, 'batch_size': 1571, 'optimizer': 'Adam'}. Best is trial 251 with value: 0.13362848931190816.
2026-05-15 23:08:25,519 - optuna.study._optimize - INFO - Trial 272 pruned. 
2026-05-15 23:08:31,745 - optuna.study._optimize - INFO - Trial 273 pruned. 
2026-05-15 23:08:39,415 - optuna.study._optimize - INFO - Trial 274 pruned. 
2026-05-15 23:08:45,718 - optuna.study._optimize - INFO - Trial 275 pruned. 
2026-05-15 23:08:53,068 - optuna.study._optimize - INFO - Trial 276 pruned. 
2026-05-15 23:08:59,408 - optuna.study._optimize - INFO - Trial 277 pruned. 
2026-05-15 23:09:06,151 - experiment_functions - INFO - Early stopping at epoch 1050. Best Recall: 0.1186
2026-05-15 23:09:06,240 - optuna.study.study - INFO - Trial 278 finished with value: 0.11856046778623183 and parameters: {'n_layers': 1, 'embedding_dim': 256, 'lr': 0.0008428404226528765, 'lambda_val': 2.3669616188938646e-05, 'batch_size': 1661, 'optimizer': 'Adam'}. Best is trial 251 with value: 0.13362848931190816.
2026-05-15 23:09:12,717 - optuna.study._optimize - INFO - Trial 279 pruned. 
2026-05-15 23:09:18,308 - optuna.study._optimize - INFO - Trial 280 pruned. 
2026-05-15 23:09:21,817 - experiment_functions - INFO - Early stopping at epoch 500. Best Recall: 0.0032
2026-05-15 23:09:21,897 - optuna.study.study - INFO - Trial 281 finished with value: 0.0031975882546443125 and parameters: {'n_layers': 1, 'embedding_dim': 256, 'lr': 0.0005133673028550077, 'lambda_val': 3.191629622917544e-05, 'batch_size': 1505, 'optimizer': 'SGD'}. Best is trial 251 with value: 0.13362848931190816.
2026-05-15 23:09:28,801 - optuna.study._optimize - INFO - Trial 282 pruned. 
2026-05-15 23:09:36,224 - experiment_functions - INFO - Early stopping at epoch 1150. Best Recall: 0.1171
2026-05-15 23:09:36,315 - optuna.study.study - INFO - Trial 283 finished with value: 0.11713301133222062 and parameters: {'n_layers': 1, 'embedding_dim': 256, 'lr': 0.0007013129762709149, 'lambda_val': 8.344514840315215e-06, 'batch_size': 1632, 'optimizer': 'Adam'}. Best is trial 251 with value: 0.13362848931190816.
2026-05-15 23:09:42,179 - optuna.study._optimize - INFO - Trial 284 pruned. 
2026-05-15 23:09:48,963 - optuna.study._optimize - INFO - Trial 285 pruned. 
2026-05-15 23:09:57,294 - optuna.study._optimize - INFO - Trial 286 pruned. 
2026-05-15 23:10:04,275 - experiment_functions - INFO - Early stopping at epoch 900. Best Recall: 0.0743
2026-05-15 23:10:04,354 - optuna.study.study - INFO - Trial 287 finished with value: 0.07428250139347783 and parameters: {'n_layers': 2, 'embedding_dim': 256, 'lr': 0.0008146767973323925, 'lambda_val': 7.383203228327126e-06, 'batch_size': 1016, 'optimizer': 'Adam'}. Best is trial 251 with value: 0.13362848931190816.
2026-05-15 23:10:13,216 - experiment_functions - INFO - Early stopping at epoch 950. Best Recall: 0.1148
2026-05-15 23:10:13,348 - optuna.study.study - INFO - Trial 288 finished with value: 0.11475949083448886 and parameters: {'n_layers': 1, 'embedding_dim': 256, 'lr': 0.00115186546874139, 'lambda_val': 9.731615819687882e-06, 'batch_size': 1218, 'optimizer': 'Adam'}. Best is trial 251 with value: 0.13362848931190816.
2026-05-15 23:10:27,526 - experiment_functions - INFO - Early stopping at epoch 2150. Best Recall: 0.1283
2026-05-15 23:10:27,627 - optuna.study.study - INFO - Trial 289 finished with value: 0.1283458484688748 and parameters: {'n_layers': 1, 'embedding_dim': 256, 'lr': 0.0004050907025993858, 'lambda_val': 1.3378754122756933e-05, 'batch_size': 1871, 'optimizer': 'Adam'}. Best is trial 251 with value: 0.13362848931190816.
2026-05-15 23:10:34,493 - optuna.study._optimize - INFO - Trial 290 pruned. 
2026-05-15 23:10:40,064 - optuna.study._optimize - INFO - Trial 291 pruned. 
2026-05-15 23:10:47,354 - optuna.study._optimize - INFO - Trial 292 pruned. 
2026-05-15 23:10:53,634 - optuna.study._optimize - INFO - Trial 293 pruned. 
2026-05-15 23:11:03,743 - experiment_functions - INFO - Early stopping at epoch 1650. Best Recall: 0.1205
2026-05-15 23:11:03,841 - optuna.study.study - INFO - Trial 294 finished with value: 0.12046310558132362 and parameters: {'n_layers': 1, 'embedding_dim': 256, 'lr': 0.0005726113743851291, 'lambda_val': 1.1593917256984178e-05, 'batch_size': 1783, 'optimizer': 'Adam'}. Best is trial 251 with value: 0.13362848931190816.
2026-05-15 23:11:10,988 - optuna.study._optimize - INFO - Trial 295 pruned. 
2026-05-15 23:11:18,333 - optuna.study._optimize - INFO - Trial 296 pruned. 
2026-05-15 23:11:24,681 - optuna.study._optimize - INFO - Trial 297 pruned. 
2026-05-15 23:11:31,178 - optuna.study._optimize - INFO - Trial 298 pruned. 
2026-05-15 23:11:39,568 - optuna.study._optimize - INFO - Trial 299 pruned. 
2026-05-15 23:11:45,016 - experiment_functions - INFO - Early stopping at epoch 1500. Best Recall: 0.1127
2026-05-15 23:11:45,123 - root - INFO -   **** Training e_100K_1c1dcs_rand4
2026-05-15 23:11:45,137 - root - INFO -   **** Getting 65267/81200 random edges
2026-05-15 23:11:45,259 - optuna.storages._rdb.storage - INFO - A new study created in RDB with name: Study_e_100K_1c1dcs_rand4
2026-05-15 23:11:49,652 - experiment_functions - INFO - Early stopping at epoch 500. Best Recall: 0.0017
2026-05-15 23:11:49,743 - optuna.study.study - INFO - Trial 0 finished with value: 0.001654554400391248 and parameters: {'n_layers': 4, 'embedding_dim': 96, 'lr': 0.0015669102044153992, 'lambda_val': 0.004128945631981181, 'batch_size': 2718, 'optimizer': 'SGD'}. Best is trial 0 with value: 0.001654554400391248.
2026-05-15 23:11:57,556 - experiment_functions - INFO - Early stopping at epoch 1050. Best Recall: 0.0046
2026-05-15 23:11:57,707 - optuna.study.study - INFO - Trial 1 finished with value: 0.004594869296560024 and parameters: {'n_layers': 4, 'embedding_dim': 128, 'lr': 0.00600910697099656, 'lambda_val': 0.07865617570864611, 'batch_size': 2604, 'optimizer': 'RMSprop'}. Best is trial 1 with value: 0.004594869296560024.
2026-05-15 23:12:01,070 - experiment_functions - INFO - Early stopping at epoch 500. Best Recall: 0.0035
2026-05-15 23:12:01,150 - optuna.study.study - INFO - Trial 2 finished with value: 0.003462396356900551 and parameters: {'n_layers': 1, 'embedding_dim': 32, 'lr': 0.0013507283916768967, 'lambda_val': 4.112723389410421e-05, 'batch_size': 1657, 'optimizer': 'SGD'}. Best is trial 1 with value: 0.004594869296560024.
2026-05-15 23:12:08,155 - experiment_functions - INFO - Early stopping at epoch 500. Best Recall: 0.0029
2026-05-15 23:12:08,926 - optuna.study.study - INFO - Trial 3 finished with value: 0.0028673676462570605 and parameters: {'n_layers': 1, 'embedding_dim': 128, 'lr': 0.00700488650453319, 'lambda_val': 0.0013972806188832373, 'batch_size': 4082, 'optimizer': 'SGD'}. Best is trial 1 with value: 0.004594869296560024.
2026-05-15 23:12:17,672 - experiment_functions - INFO - Early stopping at epoch 500. Best Recall: 0.0013
2026-05-15 23:12:17,782 - optuna.study.study - INFO - Trial 4 finished with value: 0.001318321959628496 and parameters: {'n_layers': 4, 'embedding_dim': 32, 'lr': 0.00099818091889483, 'lambda_val': 0.0007664829141882636, 'batch_size': 2832, 'optimizer': 'SGD'}. Best is trial 1 with value: 0.004594869296560024.
2026-05-15 23:12:23,623 - experiment_functions - INFO - Early stopping at epoch 800. Best Recall: 0.0107
2026-05-15 23:12:23,737 - optuna.study.study - INFO - Trial 5 finished with value: 0.01073928531868452 and parameters: {'n_layers': 4, 'embedding_dim': 32, 'lr': 0.003498473376604193, 'lambda_val': 0.015410136777962338, 'batch_size': 3403, 'optimizer': 'RMSprop'}. Best is trial 5 with value: 0.01073928531868452.
2026-05-15 23:12:27,889 - experiment_functions - INFO - Early stopping at epoch 500. Best Recall: 0.0021
2026-05-15 23:12:28,400 - optuna.study.study - INFO - Trial 6 finished with value: 0.002084489504243882 and parameters: {'n_layers': 3, 'embedding_dim': 64, 'lr': 2.1317398157665732e-05, 'lambda_val': 0.019562900576744487, 'batch_size': 2129, 'optimizer': 'SGD'}. Best is trial 5 with value: 0.01073928531868452.
2026-05-15 23:12:42,053 - experiment_functions - INFO - Early stopping at epoch 650. Best Recall: 0.0899
2026-05-15 23:12:42,136 - optuna.study.study - INFO - Trial 7 finished with value: 0.08987481144295548 and parameters: {'n_layers': 1, 'embedding_dim': 128, 'lr': 0.001828332478445466, 'lambda_val': 0.014432897166774004, 'batch_size': 697, 'optimizer': 'Adam'}. Best is trial 7 with value: 0.08987481144295548.
2026-05-15 23:12:48,016 - experiment_functions - INFO - Early stopping at epoch 950. Best Recall: 0.0365
2026-05-15 23:12:48,106 - optuna.study.study - INFO - Trial 8 finished with value: 0.036460764136246104 and parameters: {'n_layers': 1, 'embedding_dim': 128, 'lr': 0.00044560293095188575, 'lambda_val': 0.0675009974499829, 'batch_size': 2104, 'optimizer': 'Adam'}. Best is trial 7 with value: 0.08987481144295548.
2026-05-15 23:12:59,595 - experiment_functions - INFO - Early stopping at epoch 1700. Best Recall: 0.0526
2026-05-15 23:12:59,696 - optuna.study.study - INFO - Trial 9 finished with value: 0.05263433606167325 and parameters: {'n_layers': 4, 'embedding_dim': 32, 'lr': 0.00044631820899204905, 'lambda_val': 0.00034131883001594444, 'batch_size': 645, 'optimizer': 'Adam'}. Best is trial 7 with value: 0.08987481144295548.
2026-05-15 23:13:04,511 - experiment_functions - INFO - Early stopping at epoch 550. Best Recall: 0.0264
2026-05-15 23:13:04,591 - optuna.study.study - INFO - Trial 10 finished with value: 0.026392892425721126 and parameters: {'n_layers': 2, 'embedding_dim': 256, 'lr': 0.05253272501933383, 'lambda_val': 2.5601013453701394e-06, 'batch_size': 530, 'optimizer': 'Adam'}. Best is trial 7 with value: 0.08987481144295548.
2026-05-15 23:13:10,489 - optuna.study._optimize - INFO - Trial 11 pruned. 
2026-05-15 23:13:37,198 - experiment_functions - INFO - Early stopping at epoch 3850. Best Recall: 0.0646
2026-05-15 23:13:37,278 - optuna.study.study - INFO - Trial 12 finished with value: 0.06461001638676349 and parameters: {'n_layers': 3, 'embedding_dim': 96, 'lr': 0.00018647096326471904, 'lambda_val': 1.0666817978230952e-05, 'batch_size': 1156, 'optimizer': 'Adam'}. Best is trial 7 with value: 0.08987481144295548.
2026-05-15 23:13:53,565 - optuna.study._optimize - INFO - Trial 13 pruned. 
2026-05-15 23:13:57,227 - experiment_functions - INFO - Early stopping at epoch 550. Best Recall: 0.0200
2026-05-15 23:13:57,328 - optuna.study.study - INFO - Trial 14 finished with value: 0.019968071843017573 and parameters: {'n_layers': 2, 'embedding_dim': 96, 'lr': 0.04313836428493949, 'lambda_val': 2.1272845244164783e-05, 'batch_size': 1218, 'optimizer': 'Adam'}. Best is trial 7 with value: 0.08987481144295548.
2026-05-15 23:14:05,723 - optuna.study._optimize - INFO - Trial 15 pruned. 
2026-05-15 23:14:11,282 - experiment_functions - INFO - Early stopping at epoch 750. Best Recall: 0.0337
2026-05-15 23:14:13,416 - optuna.study.study - INFO - Trial 16 finished with value: 0.0336974616000517 and parameters: {'n_layers': 2, 'embedding_dim': 128, 'lr': 0.014781052260360165, 'lambda_val': 1.5077038532023455e-06, 'batch_size': 1569, 'optimizer': 'RMSprop'}. Best is trial 7 with value: 0.08987481144295548.
2026-05-15 23:14:20,757 - optuna.study._optimize - INFO - Trial 17 pruned. 
2026-05-15 23:14:23,913 - experiment_functions - INFO - Early stopping at epoch 500. Best Recall: 0.0014
2026-05-15 23:14:24,004 - optuna.study.study - INFO - Trial 18 finished with value: 0.0014456142347351567 and parameters: {'n_layers': 1, 'embedding_dim': 96, 'lr': 1.2683760609413757e-05, 'lambda_val': 0.0026186380718869447, 'batch_size': 1760, 'optimizer': 'Adam'}. Best is trial 7 with value: 0.08987481144295548.
2026-05-15 23:14:27,516 - experiment_functions - INFO - Early stopping at epoch 500. Best Recall: 0.0020
2026-05-15 23:14:27,615 - optuna.study.study - INFO - Trial 19 finished with value: 0.002024472819341758 and parameters: {'n_layers': 2, 'embedding_dim': 128, 'lr': 4.4608058006016674e-05, 'lambda_val': 0.010341161552463618, 'batch_size': 942, 'optimizer': 'Adam'}. Best is trial 7 with value: 0.08987481144295548.
2026-05-15 23:14:35,209 - experiment_functions - INFO - Early stopping at epoch 850. Best Recall: 0.0636
2026-05-15 23:14:35,308 - optuna.study.study - INFO - Trial 20 finished with value: 0.06362949093016089 and parameters: {'n_layers': 3, 'embedding_dim': 256, 'lr': 0.0004039897156906655, 'lambda_val': 0.00029948459764784634, 'batch_size': 954, 'optimizer': 'RMSprop'}. Best is trial 7 with value: 0.08987481144295548.
2026-05-15 23:14:46,336 - experiment_functions - INFO - Early stopping at epoch 900. Best Recall: 0.0632
2026-05-15 23:14:46,477 - optuna.study.study - INFO - Trial 21 finished with value: 0.06316986687906705 and parameters: {'n_layers': 3, 'embedding_dim': 256, 'lr': 0.0003263136671776029, 'lambda_val': 0.0004241685318797913, 'batch_size': 942, 'optimizer': 'RMSprop'}. Best is trial 7 with value: 0.08987481144295548.
2026-05-15 23:14:52,903 - experiment_functions - INFO - Early stopping at epoch 700. Best Recall: 0.0406
2026-05-15 23:14:52,993 - optuna.study.study - INFO - Trial 22 finished with value: 0.04058474913230688 and parameters: {'n_layers': 3, 'embedding_dim': 256, 'lr': 0.0007903512034378516, 'lambda_val': 8.498365439122478e-05, 'batch_size': 843, 'optimizer': 'RMSprop'}. Best is trial 7 with value: 0.08987481144295548.
2026-05-15 23:14:58,586 - experiment_functions - INFO - Early stopping at epoch 650. Best Recall: 0.0341
2026-05-15 23:14:58,678 - optuna.study.study - INFO - Trial 23 finished with value: 0.03409822623436842 and parameters: {'n_layers': 3, 'embedding_dim': 256, 'lr': 0.0030918907812670557, 'lambda_val': 5.69989605063668e-06, 'batch_size': 1430, 'optimizer': 'RMSprop'}. Best is trial 7 with value: 0.08987481144295548.
2026-05-15 23:15:08,460 - optuna.study._optimize - INFO - Trial 24 pruned. 
2026-05-15 23:15:19,235 - optuna.study._optimize - INFO - Trial 25 pruned. 
2026-05-15 23:15:43,071 - optuna.study.study - INFO - Trial 26 finished with value: 0.08826286488043632 and parameters: {'n_layers': 2, 'embedding_dim': 128, 'lr': 0.00020013048763546103, 'lambda_val': 0.00018102580236925065, 'batch_size': 714, 'optimizer': 'RMSprop'}. Best is trial 7 with value: 0.08987481144295548.
2026-05-15 23:15:49,225 - optuna.study._optimize - INFO - Trial 27 pruned. 
2026-05-15 23:15:54,167 - experiment_functions - INFO - Early stopping at epoch 650. Best Recall: 0.1004
2026-05-15 23:15:54,324 - optuna.study.study - INFO - Trial 28 finished with value: 0.10038378220045932 and parameters: {'n_layers': 1, 'embedding_dim': 128, 'lr': 0.002173388903868478, 'lambda_val': 1.6874979431314902e-05, 'batch_size': 3119, 'optimizer': 'Adam'}. Best is trial 28 with value: 0.10038378220045932.
2026-05-15 23:16:03,049 - experiment_functions - INFO - Early stopping at epoch 550. Best Recall: 0.0896
2026-05-15 23:16:03,147 - optuna.study.study - INFO - Trial 29 finished with value: 0.08959039444713791 and parameters: {'n_layers': 1, 'embedding_dim': 128, 'lr': 0.0021312520274741047, 'lambda_val': 3.9774532117840136e-05, 'batch_size': 3233, 'optimizer': 'RMSprop'}. Best is trial 28 with value: 0.10038378220045932.
2026-05-15 23:16:06,566 - experiment_functions - INFO - Early stopping at epoch 500. Best Recall: 0.0016
2026-05-15 23:16:06,656 - optuna.study.study - INFO - Trial 30 finished with value: 0.001581830541087099 and parameters: {'n_layers': 1, 'embedding_dim': 128, 'lr': 0.0027792618351153106, 'lambda_val': 3.295087798274364e-05, 'batch_size': 3361, 'optimizer': 'SGD'}. Best is trial 28 with value: 0.10038378220045932.
2026-05-15 23:16:12,600 - experiment_functions - INFO - Early stopping at epoch 1000. Best Recall: 0.0508
2026-05-15 23:16:12,690 - optuna.study.study - INFO - Trial 31 finished with value: 0.05077095970379747 and parameters: {'n_layers': 1, 'embedding_dim': 128, 'lr': 0.00869857993021673, 'lambda_val': 6.196069272611864e-05, 'batch_size': 3302, 'optimizer': 'RMSprop'}. Best is trial 28 with value: 0.10038378220045932.
2026-05-15 23:16:17,076 - experiment_functions - INFO - Early stopping at epoch 600. Best Recall: 0.0798
2026-05-15 23:16:17,166 - optuna.study.study - INFO - Trial 32 finished with value: 0.07977132568386003 and parameters: {'n_layers': 1, 'embedding_dim': 128, 'lr': 0.0023954735391854376, 'lambda_val': 0.00017093042298591804, 'batch_size': 2974, 'optimizer': 'RMSprop'}. Best is trial 28 with value: 0.10038378220045932.
2026-05-15 23:16:21,326 - experiment_functions - INFO - Early stopping at epoch 650. Best Recall: 0.0984
2026-05-15 23:16:21,406 - optuna.study.study - INFO - Trial 33 finished with value: 0.09841805614708614 and parameters: {'n_layers': 1, 'embedding_dim': 128, 'lr': 0.0015545818023447312, 'lambda_val': 2.8127188550092613e-05, 'batch_size': 2530, 'optimizer': 'RMSprop'}. Best is trial 28 with value: 0.10038378220045932.
2026-05-15 23:16:25,070 - experiment_functions - INFO - Early stopping at epoch 550. Best Recall: 0.0462
