2026-05-15 18:04:10,934 - root - INFO - **** Training e_100K_full
2026-05-15 18:04:10,956 - helper_functions - INFO - Users: 610, Items: 9742
2026-05-15 18:04:11,086 - helper_functions - INFO - Edge index: torch.Size([2, 100836])
2026-05-15 18:04:11,086 - root - INFO - **** Generating the graph:
2026-05-15 18:04:11,170 - helper_functions - INFO - Number of unique users: 610
2026-05-15 18:04:11,171 - helper_functions - INFO - Number of unique items: 9724
2026-05-15 18:04:11,171 - helper_functions - INFO - Number of nodes: 10334
2026-05-15 18:04:11,173 - helper_functions - INFO - Number of edges: 100836
2026-05-15 18:04:14,001 - optuna.storages._rdb.storage - INFO - A new study created in RDB with name: Study_e_100K_full
2026-05-15 18:04:36,289 - experiment_functions - INFO - Early stopping at epoch 1500. Best Recall: 0.0527
2026-05-15 18:04:36,453 - optuna.study.study - INFO - Trial 0 finished with value: 0.05265644603692082 and parameters: {'n_layers': 3, 'embedding_dim': 256, 'lr': 0.00014681750460010602, 'lambda_val': 0.0010533768643054187, 'batch_size': 2793, 'optimizer': 'RMSprop'}. Best is trial 0 with value: 0.05265644603692082.
2026-05-15 18:04:55,545 - experiment_functions - INFO - Early stopping at epoch 3350. Best Recall: 0.0407
2026-05-15 18:04:55,648 - optuna.study.study - INFO - Trial 1 finished with value: 0.04068963063916404 and parameters: {'n_layers': 2, 'embedding_dim': 32, 'lr': 0.00011149362293271709, 'lambda_val': 8.688089493181251e-06, 'batch_size': 1522, 'optimizer': 'Adam'}. Best is trial 0 with value: 0.05265644603692082.
2026-05-15 18:04:59,660 - experiment_functions - INFO - Early stopping at epoch 500. Best Recall: 0.0020
2026-05-15 18:04:59,772 - optuna.study.study - INFO - Trial 2 finished with value: 0.0019669556976394742 and parameters: {'n_layers': 4, 'embedding_dim': 64, 'lr': 0.0006079863381512751, 'lambda_val': 1.1470868086938963e-05, 'batch_size': 1159, 'optimizer': 'SGD'}. Best is trial 0 with value: 0.05265644603692082.
2026-05-15 18:05:08,454 - experiment_functions - INFO - Early stopping at epoch 1100. Best Recall: 0.0487
2026-05-15 18:05:08,554 - optuna.study.study - INFO - Trial 3 finished with value: 0.04871481650512075 and parameters: {'n_layers': 3, 'embedding_dim': 96, 'lr': 0.0005412062142304239, 'lambda_val': 0.0005038053686349283, 'batch_size': 3007, 'optimizer': 'Adam'}. Best is trial 0 with value: 0.05265644603692082.
2026-05-15 18:05:12,539 - experiment_functions - INFO - Early stopping at epoch 500. Best Recall: 0.0024
2026-05-15 18:05:12,630 - optuna.study.study - INFO - Trial 4 finished with value: 0.0024058513195747986 and parameters: {'n_layers': 1, 'embedding_dim': 128, 'lr': 8.189533005532789e-05, 'lambda_val': 0.014193667057564655, 'batch_size': 4015, 'optimizer': 'SGD'}. Best is trial 0 with value: 0.05265644603692082.
2026-05-15 18:05:16,533 - experiment_functions - INFO - Early stopping at epoch 500. Best Recall: 0.0028
2026-05-15 18:05:16,636 - optuna.study.study - INFO - Trial 5 finished with value: 0.0027878996062709713 and parameters: {'n_layers': 3, 'embedding_dim': 64, 'lr': 0.00044379626015339345, 'lambda_val': 0.02465454477099039, 'batch_size': 914, 'optimizer': 'SGD'}. Best is trial 0 with value: 0.05265644603692082.
2026-05-15 18:05:20,728 - experiment_functions - INFO - Early stopping at epoch 500. Best Recall: 0.0022
2026-05-15 18:05:21,263 - optuna.study.study - INFO - Trial 6 finished with value: 0.0021542302773201183 and parameters: {'n_layers': 4, 'embedding_dim': 64, 'lr': 1.0036778400918165e-05, 'lambda_val': 0.008157296692530886, 'batch_size': 1203, 'optimizer': 'Adam'}. Best is trial 0 with value: 0.05265644603692082.
2026-05-15 18:05:29,752 - experiment_functions - INFO - Early stopping at epoch 1150. Best Recall: 0.0456
2026-05-15 18:05:29,869 - optuna.study.study - INFO - Trial 7 finished with value: 0.04555881158420233 and parameters: {'n_layers': 3, 'embedding_dim': 64, 'lr': 0.00042635088691794873, 'lambda_val': 1.064487743950471e-05, 'batch_size': 3336, 'optimizer': 'Adam'}. Best is trial 0 with value: 0.05265644603692082.
2026-05-15 18:05:40,792 - optuna.study._optimize - INFO - Trial 8 pruned. 
2026-05-15 18:05:49,742 - experiment_functions - INFO - Early stopping at epoch 500. Best Recall: 0.0029
2026-05-15 18:05:50,095 - optuna.study.study - INFO - Trial 9 finished with value: 0.002941364487161042 and parameters: {'n_layers': 4, 'embedding_dim': 128, 'lr': 0.001787166291842523, 'lambda_val': 0.040701733681020764, 'batch_size': 512, 'optimizer': 'RMSprop'}. Best is trial 0 with value: 0.05265644603692082.
2026-05-15 18:05:57,288 - optuna.study._optimize - INFO - Trial 10 pruned. 
2026-05-15 18:06:02,261 - experiment_functions - INFO - Early stopping at epoch 600. Best Recall: 0.0284
2026-05-15 18:06:02,364 - optuna.study.study - INFO - Trial 11 finished with value: 0.0284253692025639 and parameters: {'n_layers': 3, 'embedding_dim': 96, 'lr': 0.0035587302748719706, 'lambda_val': 0.0004913866630463639, 'batch_size': 2712, 'optimizer': 'RMSprop'}. Best is trial 0 with value: 0.05265644603692082.
2026-05-15 18:06:10,628 - optuna.study._optimize - INFO - Trial 12 pruned. 
2026-05-15 18:06:15,022 - experiment_functions - INFO - Early stopping at epoch 500. Best Recall: 0.0039
2026-05-15 18:06:15,125 - optuna.study.study - INFO - Trial 13 finished with value: 0.003862263710078716 and parameters: {'n_layers': 2, 'embedding_dim': 256, 'lr': 1.1669938013060908e-05, 'lambda_val': 0.00010696446696640263, 'batch_size': 3580, 'optimizer': 'Adam'}. Best is trial 0 with value: 0.05265644603692082.
2026-05-15 18:06:50,563 - optuna.study.study - INFO - Trial 14 finished with value: 0.06590855387989115 and parameters: {'n_layers': 3, 'embedding_dim': 96, 'lr': 0.0001436662979928142, 'lambda_val': 1.3890557254561403e-06, 'batch_size': 2059, 'optimizer': 'RMSprop'}. Best is trial 14 with value: 0.06590855387989115.
2026-05-15 18:06:58,346 - optuna.study._optimize - INFO - Trial 15 pruned. 
2026-05-15 18:07:05,623 - optuna.study._optimize - INFO - Trial 16 pruned. 
2026-05-15 18:07:14,881 - optuna.study._optimize - INFO - Trial 17 pruned. 
2026-05-15 18:07:19,841 - experiment_functions - INFO - Early stopping at epoch 650. Best Recall: 0.0338
2026-05-15 18:07:19,999 - optuna.study.study - INFO - Trial 18 finished with value: 0.033763578711546914 and parameters: {'n_layers': 2, 'embedding_dim': 96, 'lr': 0.003935476764073638, 'lambda_val': 5.518783275934888e-05, 'batch_size': 2588, 'optimizer': 'RMSprop'}. Best is trial 14 with value: 0.06590855387989115.
2026-05-15 18:07:31,422 - optuna.study._optimize - INFO - Trial 19 pruned. 
2026-05-15 18:07:38,431 - experiment_functions - INFO - Early stopping at epoch 750. Best Recall: 0.0077
2026-05-15 18:07:38,533 - optuna.study.study - INFO - Trial 20 finished with value: 0.007653738180961434 and parameters: {'n_layers': 3, 'embedding_dim': 256, 'lr': 0.0017677509029692868, 'lambda_val': 0.09117339270429964, 'batch_size': 2036, 'optimizer': 'RMSprop'}. Best is trial 14 with value: 0.06590855387989115.
2026-05-15 18:07:43,761 - experiment_functions - INFO - Early stopping at epoch 650. Best Recall: 0.0419
2026-05-15 18:07:43,884 - optuna.study.study - INFO - Trial 21 finished with value: 0.04185504160614762 and parameters: {'n_layers': 3, 'embedding_dim': 96, 'lr': 0.001103694267614594, 'lambda_val': 0.0014795031540072979, 'batch_size': 3408, 'optimizer': 'Adam'}. Best is trial 14 with value: 0.06590855387989115.
2026-05-15 18:07:53,551 - optuna.study._optimize - INFO - Trial 22 pruned. 
2026-05-15 18:07:57,727 - experiment_functions - INFO - Early stopping at epoch 500. Best Recall: 0.0024
2026-05-15 18:07:57,875 - optuna.study.study - INFO - Trial 23 finished with value: 0.002448602320965776 and parameters: {'n_layers': 3, 'embedding_dim': 96, 'lr': 2.8127932846456633e-05, 'lambda_val': 0.0010343775900636515, 'batch_size': 3791, 'optimizer': 'SGD'}. Best is trial 14 with value: 0.06590855387989115.
2026-05-15 18:08:11,900 - experiment_functions - INFO - Early stopping at epoch 750. Best Recall: 0.0556
2026-05-15 18:08:12,024 - optuna.study.study - INFO - Trial 24 finished with value: 0.05558666417968942 and parameters: {'n_layers': 2, 'embedding_dim': 96, 'lr': 0.0007362196634031987, 'lambda_val': 0.00017443204017329915, 'batch_size': 2762, 'optimizer': 'RMSprop'}. Best is trial 14 with value: 0.06590855387989115.
2026-05-15 18:08:16,254 - experiment_functions - INFO - Early stopping at epoch 600. Best Recall: 0.0296
2026-05-15 18:08:16,369 - optuna.study.study - INFO - Trial 25 finished with value: 0.029550359018904678 and parameters: {'n_layers': 2, 'embedding_dim': 32, 'lr': 0.013555908717590002, 'lambda_val': 0.00014899219383329596, 'batch_size': 2381, 'optimizer': 'RMSprop'}. Best is trial 14 with value: 0.06590855387989115.
2026-05-15 18:08:35,310 - experiment_functions - INFO - Early stopping at epoch 2000. Best Recall: 0.1049
2026-05-15 18:08:35,837 - optuna.study.study - INFO - Trial 26 finished with value: 0.10485831093058236 and parameters: {'n_layers': 1, 'embedding_dim': 128, 'lr': 0.00027091426808913176, 'lambda_val': 0.004702133138577381, 'batch_size': 2538, 'optimizer': 'RMSprop'}. Best is trial 26 with value: 0.10485831093058236.
2026-05-15 18:08:41,347 - experiment_functions - INFO - Early stopping at epoch 600. Best Recall: 0.0799
2026-05-15 18:08:41,461 - optuna.study.study - INFO - Trial 27 finished with value: 0.0798841456018233 and parameters: {'n_layers': 1, 'embedding_dim': 128, 'lr': 0.001123277610757837, 'lambda_val': 0.005047189931303364, 'batch_size': 1866, 'optimizer': 'RMSprop'}. Best is trial 26 with value: 0.10485831093058236.
2026-05-15 18:08:51,834 - experiment_functions - INFO - Early stopping at epoch 1650. Best Recall: 0.0576
2026-05-15 18:08:51,946 - optuna.study.study - INFO - Trial 28 finished with value: 0.05759206892484617 and parameters: {'n_layers': 1, 'embedding_dim': 128, 'lr': 0.005231495072251294, 'lambda_val': 0.005378546679910013, 'batch_size': 1791, 'optimizer': 'RMSprop'}. Best is trial 26 with value: 0.10485831093058236.
2026-05-15 18:09:08,725 - experiment_functions - INFO - Early stopping at epoch 2850. Best Recall: 0.1032
2026-05-15 18:09:08,827 - optuna.study.study - INFO - Trial 29 finished with value: 0.10319003501939303 and parameters: {'n_layers': 1, 'embedding_dim': 128, 'lr': 0.0002761104954520826, 'lambda_val': 0.009146029115242309, 'batch_size': 1449, 'optimizer': 'RMSprop'}. Best is trial 26 with value: 0.10485831093058236.
2026-05-15 18:09:17,451 - experiment_functions - INFO - Early stopping at epoch 1450. Best Recall: 0.0991
2026-05-15 18:09:17,541 - optuna.study.study - INFO - Trial 30 finished with value: 0.09914173820641355 and parameters: {'n_layers': 1, 'embedding_dim': 128, 'lr': 0.00034483596132742694, 'lambda_val': 0.009048730078602638, 'batch_size': 1377, 'optimizer': 'RMSprop'}. Best is trial 26 with value: 0.10485831093058236.
2026-05-15 18:09:21,773 - experiment_functions - INFO - Early stopping at epoch 600. Best Recall: 0.0763
2026-05-15 18:09:21,886 - optuna.study.study - INFO - Trial 31 finished with value: 0.07632655849362216 and parameters: {'n_layers': 1, 'embedding_dim': 128, 'lr': 0.0012332895830980753, 'lambda_val': 0.011308831913268385, 'batch_size': 1337, 'optimizer': 'RMSprop'}. Best is trial 26 with value: 0.10485831093058236.
2026-05-15 18:09:34,907 - experiment_functions - INFO - Early stopping at epoch 2250. Best Recall: 0.0973
2026-05-15 18:09:34,977 - optuna.study.study - INFO - Trial 32 finished with value: 0.0973465841949573 and parameters: {'n_layers': 1, 'embedding_dim': 128, 'lr': 0.0002969701005731511, 'lambda_val': 0.0048284070845790675, 'batch_size': 1549, 'optimizer': 'RMSprop'}. Best is trial 26 with value: 0.10485831093058236.
2026-05-15 18:09:41,520 - optuna.study._optimize - INFO - Trial 33 pruned. 
2026-05-15 18:09:47,090 - optuna.study._optimize - INFO - Trial 34 pruned. 
2026-05-15 18:09:50,465 - experiment_functions - INFO - Early stopping at epoch 500. Best Recall: 0.0018
2026-05-15 18:09:50,548 - optuna.study.study - INFO - Trial 35 finished with value: 0.0017603057496820061 and parameters: {'n_layers': 1, 'embedding_dim': 128, 'lr': 0.0003399534118634905, 'lambda_val': 0.06283064933895592, 'batch_size': 1492, 'optimizer': 'SGD'}. Best is trial 26 with value: 0.10485831093058236.
2026-05-15 18:09:56,480 - optuna.study._optimize - INFO - Trial 36 pruned. 
2026-05-15 18:10:00,341 - experiment_functions - INFO - Early stopping at epoch 500. Best Recall: 0.0013
2026-05-15 18:10:00,443 - optuna.study.study - INFO - Trial 37 finished with value: 0.0012500493462371837 and parameters: {'n_layers': 1, 'embedding_dim': 128, 'lr': 0.0005208010699787531, 'lambda_val': 0.00621789022529614, 'batch_size': 1073, 'optimizer': 'SGD'}. Best is trial 26 with value: 0.10485831093058236.
2026-05-15 18:10:07,005 - optuna.study._optimize - INFO - Trial 38 pruned. 
2026-05-15 18:10:23,623 - experiment_functions - INFO - Early stopping at epoch 2800. Best Recall: 0.1034
2026-05-15 18:10:23,746 - optuna.study.study - INFO - Trial 39 finished with value: 0.10338255847451366 and parameters: {'n_layers': 1, 'embedding_dim': 128, 'lr': 0.00030930658765199263, 'lambda_val': 0.012891031664526502, 'batch_size': 557, 'optimizer': 'RMSprop'}. Best is trial 26 with value: 0.10485831093058236.
2026-05-15 18:10:27,782 - experiment_functions - INFO - Early stopping at epoch 500. Best Recall: 0.0027
2026-05-15 18:10:27,905 - optuna.study.study - INFO - Trial 40 finished with value: 0.002746292078679277 and parameters: {'n_layers': 2, 'embedding_dim': 128, 'lr': 0.0007553876615284746, 'lambda_val': 0.013059516855426731, 'batch_size': 574, 'optimizer': 'SGD'}. Best is trial 26 with value: 0.10485831093058236.
2026-05-15 18:10:51,749 - optuna.study.study - INFO - Trial 41 finished with value: 0.11724153441012204 and parameters: {'n_layers': 1, 'embedding_dim': 128, 'lr': 0.00025134894376159663, 'lambda_val': 0.003176951220971831, 'batch_size': 1295, 'optimizer': 'RMSprop'}. Best is trial 41 with value: 0.11724153441012204.
2026-05-15 18:11:00,266 - optuna.study._optimize - INFO - Trial 42 pruned. 
2026-05-15 18:11:04,136 - experiment_functions - INFO - Early stopping at epoch 500. Best Recall: 0.0036
2026-05-15 18:11:04,270 - optuna.study.study - INFO - Trial 43 finished with value: 0.003614167042653855 and parameters: {'n_layers': 1, 'embedding_dim': 128, 'lr': 0.00020118565786437912, 'lambda_val': 0.04290646186329875, 'batch_size': 1252, 'optimizer': 'RMSprop'}. Best is trial 41 with value: 0.11724153441012204.
2026-05-15 18:11:10,050 - optuna.study._optimize - INFO - Trial 44 pruned. 
2026-05-15 18:11:13,684 - experiment_functions - INFO - Early stopping at epoch 600. Best Recall: 0.0404
2026-05-15 18:11:13,754 - optuna.study.study - INFO - Trial 45 finished with value: 0.04044942057317873 and parameters: {'n_layers': 1, 'embedding_dim': 128, 'lr': 0.002007296125357365, 'lambda_val': 0.019557766879864515, 'batch_size': 1086, 'optimizer': 'RMSprop'}. Best is trial 41 with value: 0.11724153441012204.
2026-05-15 18:11:24,924 - experiment_functions - INFO - Early stopping at epoch 2350. Best Recall: 0.1042
2026-05-15 18:11:25,006 - optuna.study.study - INFO - Trial 46 finished with value: 0.10417465415744841 and parameters: {'n_layers': 1, 'embedding_dim': 64, 'lr': 0.0003612548208151865, 'lambda_val': 0.002324187001627944, 'batch_size': 1293, 'optimizer': 'RMSprop'}. Best is trial 41 with value: 0.11724153441012204.
2026-05-15 18:11:30,950 - optuna.study._optimize - INFO - Trial 47 pruned. 
2026-05-15 18:11:52,230 - experiment_functions - INFO - Early stopping at epoch 3700. Best Recall: 0.1308
2026-05-15 18:11:52,348 - optuna.study.study - INFO - Trial 48 finished with value: 0.13078430493282794 and parameters: {'n_layers': 1, 'embedding_dim': 64, 'lr': 0.0006730173366231471, 'lambda_val': 0.0008708034434858406, 'batch_size': 760, 'optimizer': 'RMSprop'}. Best is trial 48 with value: 0.13078430493282794.
2026-05-15 18:12:03,344 - experiment_functions - INFO - Early stopping at epoch 1950. Best Recall: 0.1320
2026-05-15 18:12:03,485 - optuna.study.study - INFO - Trial 49 finished with value: 0.1319916789381706 and parameters: {'n_layers': 1, 'embedding_dim': 64, 'lr': 0.0007193302405916007, 'lambda_val': 0.0007084961555251328, 'batch_size': 779, 'optimizer': 'Adam'}. Best is trial 49 with value: 0.1319916789381706.
2026-05-15 18:12:18,834 - experiment_functions - INFO - Early stopping at epoch 2550. Best Recall: 0.1112
2026-05-15 18:12:18,968 - optuna.study.study - INFO - Trial 50 finished with value: 0.11118529891960856 and parameters: {'n_layers': 1, 'embedding_dim': 64, 'lr': 0.0006560093639261714, 'lambda_val': 0.0009651649396405663, 'batch_size': 718, 'optimizer': 'Adam'}. Best is trial 49 with value: 0.1319916789381706.
2026-05-15 18:12:31,481 - experiment_functions - INFO - Early stopping at epoch 2300. Best Recall: 0.1312
2026-05-15 18:12:31,552 - optuna.study.study - INFO - Trial 51 finished with value: 0.1312211635999051 and parameters: {'n_layers': 1, 'embedding_dim': 64, 'lr': 0.0005866431713384173, 'lambda_val': 0.0007523897843088942, 'batch_size': 763, 'optimizer': 'Adam'}. Best is trial 49 with value: 0.1319916789381706.
2026-05-15 18:12:40,712 - experiment_functions - INFO - Early stopping at epoch 1750. Best Recall: 0.1154
2026-05-15 18:12:40,827 - optuna.study.study - INFO - Trial 52 finished with value: 0.11543709765574767 and parameters: {'n_layers': 1, 'embedding_dim': 64, 'lr': 0.000735296685323868, 'lambda_val': 0.0007538620874934498, 'batch_size': 771, 'optimizer': 'Adam'}. Best is trial 49 with value: 0.1319916789381706.
2026-05-15 18:13:01,421 - optuna.study.study - INFO - Trial 53 finished with value: 0.13716782145755746 and parameters: {'n_layers': 1, 'embedding_dim': 64, 'lr': 0.0007830706291438342, 'lambda_val': 0.0007049574765137968, 'batch_size': 745, 'optimizer': 'Adam'}. Best is trial 53 with value: 0.13716782145755746.
2026-05-15 18:13:06,336 - experiment_functions - INFO - Early stopping at epoch 650. Best Recall: 0.0789
2026-05-15 18:13:06,506 - optuna.study.study - INFO - Trial 54 finished with value: 0.07888737114525828 and parameters: {'n_layers': 2, 'embedding_dim': 64, 'lr': 0.0022112852284860403, 'lambda_val': 0.00033705352113317765, 'batch_size': 852, 'optimizer': 'Adam'}. Best is trial 53 with value: 0.13716782145755746.
2026-05-15 18:13:17,104 - experiment_functions - INFO - Early stopping at epoch 1700. Best Recall: 0.1328
2026-05-15 18:13:17,239 - optuna.study.study - INFO - Trial 55 finished with value: 0.13281258506956284 and parameters: {'n_layers': 1, 'embedding_dim': 64, 'lr': 0.0008876670274743012, 'lambda_val': 0.0006593081366843087, 'batch_size': 969, 'optimizer': 'Adam'}. Best is trial 53 with value: 0.13716782145755746.
2026-05-15 18:13:21,521 - experiment_functions - INFO - Early stopping at epoch 600. Best Recall: 0.0889
2026-05-15 18:13:21,635 - optuna.study.study - INFO - Trial 56 finished with value: 0.08889319334334897 and parameters: {'n_layers': 1, 'embedding_dim': 64, 'lr': 0.002960119371784147, 'lambda_val': 0.0006327891139334605, 'batch_size': 988, 'optimizer': 'Adam'}. Best is trial 53 with value: 0.13716782145755746.
2026-05-15 18:13:26,000 - experiment_functions - INFO - Early stopping at epoch 550. Best Recall: 0.0642
2026-05-15 18:13:26,103 - optuna.study.study - INFO - Trial 57 finished with value: 0.06415193724206911 and parameters: {'n_layers': 2, 'embedding_dim': 64, 'lr': 0.0064220790435677725, 'lambda_val': 0.00024290619638083085, 'batch_size': 1179, 'optimizer': 'Adam'}. Best is trial 53 with value: 0.13716782145755746.
2026-05-15 18:13:34,250 - experiment_functions - INFO - Early stopping at epoch 1350. Best Recall: 0.1094
2026-05-15 18:13:34,364 - optuna.study.study - INFO - Trial 58 finished with value: 0.10935988264654417 and parameters: {'n_layers': 1, 'embedding_dim': 64, 'lr': 0.0016899464470911238, 'lambda_val': 5.4878978929379905e-05, 'batch_size': 627, 'optimizer': 'Adam'}. Best is trial 53 with value: 0.13716782145755746.
2026-05-15 18:13:52,301 - experiment_functions - INFO - Early stopping at epoch 3050. Best Recall: 0.1239
2026-05-15 18:13:52,414 - optuna.study.study - INFO - Trial 59 finished with value: 0.12393819901854271 and parameters: {'n_layers': 1, 'embedding_dim': 64, 'lr': 0.0008691806985484376, 'lambda_val': 0.0017838465403550545, 'batch_size': 516, 'optimizer': 'Adam'}. Best is trial 53 with value: 0.13716782145755746.
2026-05-15 18:13:58,550 - experiment_functions - INFO - Early stopping at epoch 900. Best Recall: 0.0992
2026-05-15 18:13:58,653 - optuna.study.study - INFO - Trial 60 finished with value: 0.09923091229569991 and parameters: {'n_layers': 2, 'embedding_dim': 64, 'lr': 0.0009199358370681434, 'lambda_val': 0.000470908540482374, 'batch_size': 530, 'optimizer': 'Adam'}. Best is trial 53 with value: 0.13716782145755746.
2026-05-15 18:14:05,135 - experiment_functions - INFO - Early stopping at epoch 1000. Best Recall: 0.1033
2026-05-15 18:14:05,251 - optuna.study.study - INFO - Trial 61 finished with value: 0.1033179466314644 and parameters: {'n_layers': 1, 'embedding_dim': 64, 'lr': 0.0013784161375098884, 'lambda_val': 0.0013932321516232505, 'batch_size': 843, 'optimizer': 'Adam'}. Best is trial 53 with value: 0.13716782145755746.
2026-05-15 18:14:11,623 - optuna.study._optimize - INFO - Trial 62 pruned. 
2026-05-15 18:14:22,289 - experiment_functions - INFO - Early stopping at epoch 1750. Best Recall: 0.1119
2026-05-15 18:14:22,392 - optuna.study.study - INFO - Trial 63 finished with value: 0.11188605543969464 and parameters: {'n_layers': 1, 'embedding_dim': 64, 'lr': 0.0008888629049003459, 'lambda_val': 0.0007484620693888922, 'batch_size': 988, 'optimizer': 'Adam'}. Best is trial 53 with value: 0.13716782145755746.
2026-05-15 18:14:26,671 - experiment_functions - INFO - Early stopping at epoch 650. Best Recall: 0.0889
