2026-05-15 18:27:24,083 - optuna.study.study - INFO - Trial 138 finished with value: 0.0027296823134515093 and parameters: {'n_layers': 1, 'embedding_dim': 256, 'lr': 1.4655554082405611e-05, 'lambda_val': 0.0008130550771998716, 'batch_size': 634, 'optimizer': 'Adam'}. Best is trial 117 with value: 0.14386181101190273.
2026-05-15 18:27:32,916 - optuna.study._optimize - INFO - Trial 139 pruned. 
2026-05-15 18:27:40,006 - optuna.study._optimize - INFO - Trial 140 pruned. 
2026-05-15 18:27:46,881 - optuna.study._optimize - INFO - Trial 141 pruned. 
2026-05-15 18:27:53,089 - optuna.study._optimize - INFO - Trial 142 pruned. 
2026-05-15 18:27:58,495 - optuna.study._optimize - INFO - Trial 143 pruned. 
2026-05-15 18:28:05,007 - optuna.study._optimize - INFO - Trial 144 pruned. 
2026-05-15 18:28:11,149 - optuna.study._optimize - INFO - Trial 145 pruned. 
2026-05-15 18:28:17,300 - optuna.study._optimize - INFO - Trial 146 pruned. 
2026-05-15 18:28:28,559 - experiment_functions - INFO - Early stopping at epoch 1750. Best Recall: 0.1357
2026-05-15 18:28:28,670 - optuna.study.study - INFO - Trial 147 finished with value: 0.13566843503384587 and parameters: {'n_layers': 1, 'embedding_dim': 256, 'lr': 0.0007556249262351241, 'lambda_val': 0.00034647935996340735, 'batch_size': 708, 'optimizer': 'Adam'}. Best is trial 117 with value: 0.14386181101190273.
2026-05-15 18:28:46,168 - experiment_functions - INFO - Early stopping at epoch 2600. Best Recall: 0.1357
2026-05-15 18:28:46,279 - optuna.study.study - INFO - Trial 148 finished with value: 0.13565134665927076 and parameters: {'n_layers': 1, 'embedding_dim': 256, 'lr': 0.0005219768568184553, 'lambda_val': 0.00034034392249962704, 'batch_size': 711, 'optimizer': 'Adam'}. Best is trial 117 with value: 0.14386181101190273.
2026-05-15 18:28:54,456 - optuna.study._optimize - INFO - Trial 149 pruned. 
2026-05-15 18:29:01,759 - optuna.study._optimize - INFO - Trial 150 pruned. 
2026-05-15 18:29:13,280 - experiment_functions - INFO - Early stopping at epoch 1650. Best Recall: 0.1386
2026-05-15 18:29:13,401 - optuna.study.study - INFO - Trial 151 finished with value: 0.13857482065797477 and parameters: {'n_layers': 1, 'embedding_dim': 256, 'lr': 0.0006375916840626806, 'lambda_val': 0.00018352541434425574, 'batch_size': 759, 'optimizer': 'Adam'}. Best is trial 117 with value: 0.14386181101190273.
2026-05-15 18:29:20,665 - optuna.study._optimize - INFO - Trial 152 pruned. 
2026-05-15 18:29:29,168 - experiment_functions - INFO - Early stopping at epoch 1250. Best Recall: 0.1230
2026-05-15 18:29:29,281 - optuna.study.study - INFO - Trial 153 finished with value: 0.12304426224557422 and parameters: {'n_layers': 1, 'embedding_dim': 256, 'lr': 0.0009758876186459788, 'lambda_val': 0.00021609689235991907, 'batch_size': 739, 'optimizer': 'Adam'}. Best is trial 117 with value: 0.14386181101190273.
2026-05-15 18:29:42,731 - optuna.study._optimize - INFO - Trial 154 pruned. 
2026-05-15 18:29:52,098 - optuna.study._optimize - INFO - Trial 155 pruned. 
2026-05-15 18:30:02,526 - experiment_functions - INFO - Early stopping at epoch 1450. Best Recall: 0.1234
2026-05-15 18:30:02,638 - optuna.study.study - INFO - Trial 156 finished with value: 0.12336624680433819 and parameters: {'n_layers': 1, 'embedding_dim': 256, 'lr': 0.0008195960423518574, 'lambda_val': 0.0004622662463895719, 'batch_size': 1047, 'optimizer': 'Adam'}. Best is trial 117 with value: 0.14386181101190273.
2026-05-15 18:30:09,526 - optuna.study._optimize - INFO - Trial 157 pruned. 
2026-05-15 18:30:16,970 - experiment_functions - INFO - Early stopping at epoch 1050. Best Recall: 0.1213
2026-05-15 18:30:17,093 - optuna.study.study - INFO - Trial 158 finished with value: 0.12132634436644524 and parameters: {'n_layers': 1, 'embedding_dim': 256, 'lr': 0.0012154838527908697, 'lambda_val': 0.00017738783458233772, 'batch_size': 838, 'optimizer': 'Adam'}. Best is trial 117 with value: 0.14386181101190273.
2026-05-15 18:30:20,967 - experiment_functions - INFO - Early stopping at epoch 500. Best Recall: 0.0022
2026-05-15 18:30:21,566 - optuna.study.study - INFO - Trial 159 finished with value: 0.002221558065309113 and parameters: {'n_layers': 1, 'embedding_dim': 256, 'lr': 0.0005546031881360685, 'lambda_val': 0.00010427310706304283, 'batch_size': 575, 'optimizer': 'SGD'}. Best is trial 117 with value: 0.14386181101190273.
2026-05-15 18:30:33,999 - experiment_functions - INFO - Early stopping at epoch 1000. Best Recall: 0.1256
2026-05-15 18:30:34,532 - optuna.study.study - INFO - Trial 160 finished with value: 0.12561026691961455 and parameters: {'n_layers': 1, 'embedding_dim': 256, 'lr': 0.0006367279529906739, 'lambda_val': 0.0003387535879555765, 'batch_size': 3599, 'optimizer': 'Adam'}. Best is trial 117 with value: 0.14386181101190273.
2026-05-15 18:30:43,836 - optuna.study._optimize - INFO - Trial 161 pruned. 
2026-05-15 18:30:51,874 - optuna.study._optimize - INFO - Trial 162 pruned. 
2026-05-15 18:30:59,752 - optuna.study._optimize - INFO - Trial 163 pruned. 
2026-05-15 18:31:06,746 - optuna.study._optimize - INFO - Trial 164 pruned. 
2026-05-15 18:31:15,248 - optuna.study._optimize - INFO - Trial 165 pruned. 
2026-05-15 18:31:32,135 - experiment_functions - INFO - Early stopping at epoch 1400. Best Recall: 0.1261
2026-05-15 18:31:32,235 - optuna.study.study - INFO - Trial 166 finished with value: 0.12609511961811604 and parameters: {'n_layers': 1, 'embedding_dim': 256, 'lr': 0.0007725384730520699, 'lambda_val': 0.0019091951892637308, 'batch_size': 681, 'optimizer': 'Adam'}. Best is trial 117 with value: 0.14386181101190273.
2026-05-15 18:31:42,754 - experiment_functions - INFO - Early stopping at epoch 1450. Best Recall: 0.1323
2026-05-15 18:31:42,878 - optuna.study.study - INFO - Trial 167 finished with value: 0.13232542225624666 and parameters: {'n_layers': 1, 'embedding_dim': 256, 'lr': 0.001140078452154465, 'lambda_val': 3.8213730398423045e-06, 'batch_size': 515, 'optimizer': 'Adam'}. Best is trial 117 with value: 0.14386181101190273.
2026-05-15 18:31:52,169 - experiment_functions - INFO - Early stopping at epoch 1300. Best Recall: 0.1280
2026-05-15 18:31:52,313 - optuna.study.study - INFO - Trial 168 finished with value: 0.1279838704669305 and parameters: {'n_layers': 1, 'embedding_dim': 256, 'lr': 0.0011454609905470767, 'lambda_val': 2.6200501674432624e-06, 'batch_size': 540, 'optimizer': 'Adam'}. Best is trial 117 with value: 0.14386181101190273.
2026-05-15 18:31:59,498 - optuna.study._optimize - INFO - Trial 169 pruned. 
2026-05-15 18:32:17,689 - experiment_functions - INFO - Early stopping at epoch 1300. Best Recall: 0.1259
2026-05-15 18:32:17,833 - optuna.study.study - INFO - Trial 170 finished with value: 0.12588458831743687 and parameters: {'n_layers': 1, 'embedding_dim': 256, 'lr': 0.0009921172830659822, 'lambda_val': 8.263789175048378e-06, 'batch_size': 733, 'optimizer': 'Adam'}. Best is trial 117 with value: 0.14386181101190273.
2026-05-15 18:32:34,429 - experiment_functions - INFO - Early stopping at epoch 1700. Best Recall: 0.1295
2026-05-15 18:32:35,466 - optuna.study.study - INFO - Trial 171 finished with value: 0.12946243464723525 and parameters: {'n_layers': 1, 'embedding_dim': 256, 'lr': 0.0005443291273497474, 'lambda_val': 0.0007230500537915061, 'batch_size': 868, 'optimizer': 'Adam'}. Best is trial 117 with value: 0.14386181101190273.
2026-05-15 18:32:45,351 - optuna.study._optimize - INFO - Trial 172 pruned. 
2026-05-15 18:32:53,567 - optuna.study._optimize - INFO - Trial 173 pruned. 
2026-05-15 18:33:19,035 - experiment_functions - INFO - Early stopping at epoch 3300. Best Recall: 0.1433
2026-05-15 18:33:19,536 - optuna.study.study - INFO - Trial 174 finished with value: 0.1433351777292274 and parameters: {'n_layers': 1, 'embedding_dim': 256, 'lr': 0.0005056313148986039, 'lambda_val': 0.0006083524952149313, 'batch_size': 946, 'optimizer': 'Adam'}. Best is trial 117 with value: 0.14386181101190273.
2026-05-15 18:33:34,621 - optuna.study._optimize - INFO - Trial 175 pruned. 
2026-05-15 18:33:43,920 - optuna.study._optimize - INFO - Trial 176 pruned. 
2026-05-15 18:33:51,417 - optuna.study._optimize - INFO - Trial 177 pruned. 
2026-05-15 18:34:07,485 - experiment_functions - INFO - Early stopping at epoch 2300. Best Recall: 0.1354
2026-05-15 18:34:07,689 - optuna.study.study - INFO - Trial 178 finished with value: 0.1353654235282718 and parameters: {'n_layers': 1, 'embedding_dim': 256, 'lr': 0.0006290070856303795, 'lambda_val': 4.027186976465841e-06, 'batch_size': 923, 'optimizer': 'Adam'}. Best is trial 117 with value: 0.14386181101190273.
2026-05-15 18:34:15,399 - optuna.study._optimize - INFO - Trial 179 pruned. 
2026-05-15 18:34:34,188 - experiment_functions - INFO - Early stopping at epoch 2900. Best Recall: 0.1471
2026-05-15 18:34:34,312 - optuna.study.study - INFO - Trial 180 finished with value: 0.14708089110431954 and parameters: {'n_layers': 1, 'embedding_dim': 256, 'lr': 0.0005916182557595356, 'lambda_val': 3.0408489001574788e-06, 'batch_size': 918, 'optimizer': 'Adam'}. Best is trial 180 with value: 0.14708089110431954.
2026-05-15 18:34:51,778 - experiment_functions - INFO - Early stopping at epoch 1550. Best Recall: 0.1270
2026-05-15 18:34:52,299 - optuna.study.study - INFO - Trial 181 finished with value: 0.12698208787536713 and parameters: {'n_layers': 1, 'embedding_dim': 256, 'lr': 0.0006723936668854473, 'lambda_val': 2.809649759630804e-06, 'batch_size': 911, 'optimizer': 'Adam'}. Best is trial 180 with value: 0.14708089110431954.
2026-05-15 18:35:12,671 - experiment_functions - INFO - Early stopping at epoch 2900. Best Recall: 0.1380
2026-05-15 18:35:12,808 - optuna.study.study - INFO - Trial 182 finished with value: 0.1379687453505298 and parameters: {'n_layers': 1, 'embedding_dim': 256, 'lr': 0.0005911263442588132, 'lambda_val': 1.7240325296591116e-06, 'batch_size': 945, 'optimizer': 'Adam'}. Best is trial 180 with value: 0.14708089110431954.
2026-05-15 18:35:26,333 - experiment_functions - INFO - Early stopping at epoch 2100. Best Recall: 0.1472
2026-05-15 18:35:26,431 - optuna.study.study - INFO - Trial 183 finished with value: 0.14715710990498074 and parameters: {'n_layers': 1, 'embedding_dim': 256, 'lr': 0.0005794911557127337, 'lambda_val': 1.3191317046246152e-06, 'batch_size': 955, 'optimizer': 'Adam'}. Best is trial 183 with value: 0.14715710990498074.
2026-05-15 18:35:43,860 - experiment_functions - INFO - Early stopping at epoch 2700. Best Recall: 0.1383
2026-05-15 18:35:43,972 - optuna.study.study - INFO - Trial 184 finished with value: 0.13825215038869046 and parameters: {'n_layers': 1, 'embedding_dim': 256, 'lr': 0.0005463795509870749, 'lambda_val': 1.222045206386871e-06, 'batch_size': 949, 'optimizer': 'Adam'}. Best is trial 183 with value: 0.14715710990498074.
2026-05-15 18:35:50,882 - optuna.study._optimize - INFO - Trial 185 pruned. 
2026-05-15 18:35:58,195 - optuna.study._optimize - INFO - Trial 186 pruned. 
2026-05-15 18:36:08,931 - optuna.study._optimize - INFO - Trial 187 pruned. 
2026-05-15 18:36:23,107 - experiment_functions - INFO - Early stopping at epoch 1300. Best Recall: 0.1298
2026-05-15 18:36:23,208 - optuna.study.study - INFO - Trial 188 finished with value: 0.12976271314374602 and parameters: {'n_layers': 1, 'embedding_dim': 256, 'lr': 0.0005663702132998011, 'lambda_val': 2.0597838459882332e-06, 'batch_size': 2886, 'optimizer': 'Adam'}. Best is trial 183 with value: 0.14715710990498074.
2026-05-15 18:36:30,194 - optuna.study._optimize - INFO - Trial 189 pruned. 
2026-05-15 18:36:33,809 - experiment_functions - INFO - Early stopping at epoch 500. Best Recall: 0.0022
2026-05-15 18:36:33,910 - optuna.study.study - INFO - Trial 190 finished with value: 0.002177582798831137 and parameters: {'n_layers': 1, 'embedding_dim': 256, 'lr': 0.0005281642743457979, 'lambda_val': 1.1664499484222958e-06, 'batch_size': 886, 'optimizer': 'SGD'}. Best is trial 183 with value: 0.14715710990498074.
2026-05-15 18:36:50,155 - experiment_functions - INFO - Early stopping at epoch 2450. Best Recall: 0.1440
2026-05-15 18:36:50,268 - optuna.study.study - INFO - Trial 191 finished with value: 0.1440419811678302 and parameters: {'n_layers': 1, 'embedding_dim': 256, 'lr': 0.0006205328789765246, 'lambda_val': 2.3524080215087863e-06, 'batch_size': 903, 'optimizer': 'Adam'}. Best is trial 183 with value: 0.14715710990498074.
2026-05-15 18:37:00,809 - experiment_functions - INFO - Early stopping at epoch 1550. Best Recall: 0.1312
2026-05-15 18:37:00,922 - optuna.study.study - INFO - Trial 192 finished with value: 0.1311679675732612 and parameters: {'n_layers': 1, 'embedding_dim': 256, 'lr': 0.0006377680652595507, 'lambda_val': 2.1951895861073414e-06, 'batch_size': 1171, 'optimizer': 'Adam'}. Best is trial 183 with value: 0.14715710990498074.
2026-05-15 18:37:16,512 - optuna.study._optimize - INFO - Trial 193 pruned. 
2026-05-15 18:37:26,291 - experiment_functions - INFO - Early stopping at epoch 1450. Best Recall: 0.1340
2026-05-15 18:37:26,402 - optuna.study.study - INFO - Trial 194 finished with value: 0.13401309892432647 and parameters: {'n_layers': 1, 'embedding_dim': 256, 'lr': 0.0007716757944015121, 'lambda_val': 2.628506716823963e-06, 'batch_size': 1025, 'optimizer': 'Adam'}. Best is trial 183 with value: 0.14715710990498074.
2026-05-15 18:37:46,122 - experiment_functions - INFO - Early stopping at epoch 3000. Best Recall: 0.1396
2026-05-15 18:37:46,246 - optuna.study.study - INFO - Trial 195 finished with value: 0.13959471699071668 and parameters: {'n_layers': 1, 'embedding_dim': 256, 'lr': 0.0005675691251413078, 'lambda_val': 1.2846074192148976e-06, 'batch_size': 858, 'optimizer': 'Adam'}. Best is trial 183 with value: 0.14715710990498074.
2026-05-15 18:38:03,315 - experiment_functions - INFO - Early stopping at epoch 2700. Best Recall: 0.1425
2026-05-15 18:38:03,436 - optuna.study.study - INFO - Trial 196 finished with value: 0.14251771009797498 and parameters: {'n_layers': 1, 'embedding_dim': 256, 'lr': 0.0005198136060371086, 'lambda_val': 1.2993044266704685e-06, 'batch_size': 914, 'optimizer': 'Adam'}. Best is trial 183 with value: 0.14715710990498074.
2026-05-15 18:38:09,569 - optuna.study._optimize - INFO - Trial 197 pruned. 
2026-05-15 18:38:17,152 - optuna.study._optimize - INFO - Trial 198 pruned. 
2026-05-15 18:38:23,992 - optuna.study._optimize - INFO - Trial 199 pruned. 
2026-05-15 18:38:32,421 - experiment_functions - INFO - Early stopping at epoch 2250. Best Recall: 0.1341
