2026-05-15 18:14:26,785 - optuna.study.study - INFO - Trial 64 finished with value: 0.08892864244114841 and parameters: {'n_layers': 1, 'embedding_dim': 32, 'lr': 0.0027367464851479873, 'lambda_val': 0.00034233970232332763, 'batch_size': 1143, 'optimizer': 'Adam'}. Best is trial 53 with value: 0.13716782145755746.
2026-05-15 18:14:32,982 - optuna.study._optimize - INFO - Trial 65 pruned. 
2026-05-15 18:14:38,125 - experiment_functions - INFO - Early stopping at epoch 800. Best Recall: 0.0959
2026-05-15 18:14:38,228 - optuna.study.study - INFO - Trial 66 finished with value: 0.09585440877394781 and parameters: {'n_layers': 1, 'embedding_dim': 64, 'lr': 0.0013704202389306667, 'lambda_val': 0.00021600320808682822, 'batch_size': 734, 'optimizer': 'Adam'}. Best is trial 53 with value: 0.13716782145755746.
2026-05-15 18:14:42,386 - experiment_functions - INFO - Early stopping at epoch 500. Best Recall: 0.0031
2026-05-15 18:14:42,510 - optuna.study.study - INFO - Trial 67 finished with value: 0.0030662022482214647 and parameters: {'n_layers': 1, 'embedding_dim': 64, 'lr': 0.00018883727465337423, 'lambda_val': 0.003724805083868048, 'batch_size': 621, 'optimizer': 'Adam'}. Best is trial 53 with value: 0.13716782145755746.
2026-05-15 18:15:03,198 - experiment_functions - INFO - Early stopping at epoch 3600. Best Recall: 0.1372
2026-05-15 18:15:03,313 - optuna.study.study - INFO - Trial 68 finished with value: 0.13719254912556791 and parameters: {'n_layers': 1, 'embedding_dim': 64, 'lr': 0.0006083225630227094, 'lambda_val': 0.0009739121534602995, 'batch_size': 870, 'optimizer': 'Adam'}. Best is trial 68 with value: 0.13719254912556791.
2026-05-15 18:15:16,072 - experiment_functions - INFO - Early stopping at epoch 2200. Best Recall: 0.1194
2026-05-15 18:15:16,248 - optuna.study.study - INFO - Trial 69 finished with value: 0.11938631379375964 and parameters: {'n_layers': 1, 'embedding_dim': 64, 'lr': 0.0006186081823809451, 'lambda_val': 0.0005951827031102688, 'batch_size': 839, 'optimizer': 'Adam'}. Best is trial 68 with value: 0.13719254912556791.
2026-05-15 18:15:20,609 - experiment_functions - INFO - Early stopping at epoch 550. Best Recall: 0.0206
2026-05-15 18:15:20,722 - optuna.study.study - INFO - Trial 70 finished with value: 0.020572656113636283 and parameters: {'n_layers': 1, 'embedding_dim': 64, 'lr': 0.07667657511582883, 'lambda_val': 0.0009373129162105207, 'batch_size': 525, 'optimizer': 'Adam'}. Best is trial 68 with value: 0.13719254912556791.
2026-05-15 18:15:36,632 - optuna.study._optimize - INFO - Trial 71 pruned. 
2026-05-15 18:15:49,066 - experiment_functions - INFO - Early stopping at epoch 2050. Best Recall: 0.1259
2026-05-15 18:15:49,168 - optuna.study.study - INFO - Trial 72 finished with value: 0.12593074787440997 and parameters: {'n_layers': 1, 'embedding_dim': 64, 'lr': 0.0010101370660381705, 'lambda_val': 0.00026027952384362135, 'batch_size': 670, 'optimizer': 'Adam'}. Best is trial 68 with value: 0.13719254912556791.
2026-05-15 18:15:55,308 - optuna.study._optimize - INFO - Trial 73 pruned. 
2026-05-15 18:16:01,313 - experiment_functions - INFO - Early stopping at epoch 850. Best Recall: 0.1062
2026-05-15 18:16:01,474 - optuna.study.study - INFO - Trial 74 finished with value: 0.10617960301975234 and parameters: {'n_layers': 1, 'embedding_dim': 64, 'lr': 0.0014447810548211335, 'lambda_val': 0.001772941205433685, 'batch_size': 938, 'optimizer': 'Adam'}. Best is trial 68 with value: 0.13719254912556791.
2026-05-15 18:16:11,140 - experiment_functions - INFO - Early stopping at epoch 1400. Best Recall: 0.1299
2026-05-15 18:16:11,263 - optuna.study.study - INFO - Trial 75 finished with value: 0.12993430102827025 and parameters: {'n_layers': 1, 'embedding_dim': 256, 'lr': 0.0009675420075285875, 'lambda_val': 0.00042344761130497986, 'batch_size': 1061, 'optimizer': 'Adam'}. Best is trial 68 with value: 0.13719254912556791.
2026-05-15 18:16:31,810 - experiment_functions - INFO - Early stopping at epoch 3150. Best Recall: 0.1423
2026-05-15 18:16:31,926 - optuna.study.study - INFO - Trial 76 finished with value: 0.14233964433499957 and parameters: {'n_layers': 1, 'embedding_dim': 256, 'lr': 0.00044968473431498734, 'lambda_val': 0.0002583407361721385, 'batch_size': 1121, 'optimizer': 'Adam'}. Best is trial 76 with value: 0.14233964433499957.
2026-05-15 18:16:47,272 - experiment_functions - INFO - Early stopping at epoch 2300. Best Recall: 0.1154
2026-05-15 18:16:47,360 - optuna.study.study - INFO - Trial 77 finished with value: 0.11541612384558406 and parameters: {'n_layers': 1, 'embedding_dim': 256, 'lr': 0.0004082626067966902, 'lambda_val': 0.00038888908074198266, 'batch_size': 1114, 'optimizer': 'Adam'}. Best is trial 76 with value: 0.14233964433499957.
2026-05-15 18:16:59,294 - experiment_functions - INFO - Early stopping at epoch 1850. Best Recall: 0.1225
2026-05-15 18:16:59,408 - optuna.study.study - INFO - Trial 78 finished with value: 0.12248107220139007 and parameters: {'n_layers': 1, 'embedding_dim': 256, 'lr': 0.0004522982914965757, 'lambda_val': 0.00045979891657831843, 'batch_size': 1691, 'optimizer': 'Adam'}. Best is trial 76 with value: 0.14233964433499957.
2026-05-15 18:17:06,325 - experiment_functions - INFO - Early stopping at epoch 600. Best Recall: 0.0366
2026-05-15 18:17:06,425 - optuna.study.study - INFO - Trial 79 finished with value: 0.03662339976537215 and parameters: {'n_layers': 4, 'embedding_dim': 256, 'lr': 0.0012106282659396902, 'lambda_val': 0.000990070167669693, 'batch_size': 1196, 'optimizer': 'Adam'}. Best is trial 76 with value: 0.14233964433499957.
2026-05-15 18:17:11,088 - experiment_functions - INFO - Early stopping at epoch 500. Best Recall: 0.0017
2026-05-15 18:17:11,199 - optuna.study.study - INFO - Trial 80 finished with value: 0.0017111909784760762 and parameters: {'n_layers': 2, 'embedding_dim': 256, 'lr': 0.0022655738335733964, 'lambda_val': 0.00016469655849787738, 'batch_size': 975, 'optimizer': 'SGD'}. Best is trial 76 with value: 0.14233964433499957.
2026-05-15 18:17:25,450 - experiment_functions - INFO - Early stopping at epoch 2050. Best Recall: 0.1365
2026-05-15 18:17:25,552 - optuna.study.study - INFO - Trial 81 finished with value: 0.13650032036994433 and parameters: {'n_layers': 1, 'embedding_dim': 256, 'lr': 0.0007610252484717947, 'lambda_val': 0.0002763617603493133, 'batch_size': 796, 'optimizer': 'Adam'}. Best is trial 76 with value: 0.14233964433499957.
2026-05-15 18:17:39,495 - experiment_functions - INFO - Early stopping at epoch 1600. Best Recall: 0.1325
2026-05-15 18:17:39,991 - optuna.study.study - INFO - Trial 82 finished with value: 0.13247303829688595 and parameters: {'n_layers': 1, 'embedding_dim': 256, 'lr': 0.0007695074102909868, 'lambda_val': 0.00021789148419883687, 'batch_size': 841, 'optimizer': 'Adam'}. Best is trial 76 with value: 0.14233964433499957.
2026-05-15 18:17:59,243 - experiment_functions - INFO - Early stopping at epoch 2150. Best Recall: 0.1379
2026-05-15 18:17:59,434 - optuna.study.study - INFO - Trial 83 finished with value: 0.13785889235705573 and parameters: {'n_layers': 1, 'embedding_dim': 256, 'lr': 0.0006168384413511547, 'lambda_val': 3.792411027567874e-06, 'batch_size': 767, 'optimizer': 'Adam'}. Best is trial 76 with value: 0.14233964433499957.
2026-05-15 18:18:20,137 - experiment_functions - INFO - Early stopping at epoch 3150. Best Recall: 0.1399
2026-05-15 18:18:20,269 - optuna.study.study - INFO - Trial 84 finished with value: 0.1399411761647795 and parameters: {'n_layers': 1, 'embedding_dim': 256, 'lr': 0.0005399718319815892, 'lambda_val': 2.429318178167362e-06, 'batch_size': 887, 'optimizer': 'Adam'}. Best is trial 76 with value: 0.14233964433499957.
2026-05-15 18:18:27,529 - optuna.study._optimize - INFO - Trial 85 pruned. 
2026-05-15 18:18:44,141 - experiment_functions - INFO - Early stopping at epoch 2550. Best Recall: 0.1279
2026-05-15 18:18:44,253 - optuna.study.study - INFO - Trial 86 finished with value: 0.12787431265141008 and parameters: {'n_layers': 1, 'embedding_dim': 256, 'lr': 0.00039789635290871545, 'lambda_val': 1.7798015402008497e-05, 'batch_size': 1418, 'optimizer': 'Adam'}. Best is trial 76 with value: 0.14233964433499957.
2026-05-15 18:18:50,834 - experiment_functions - INFO - Early stopping at epoch 900. Best Recall: 0.1087
2026-05-15 18:18:50,946 - optuna.study.study - INFO - Trial 87 finished with value: 0.10871492253283077 and parameters: {'n_layers': 1, 'embedding_dim': 256, 'lr': 0.0015455226174843379, 'lambda_val': 4.659169485356053e-06, 'batch_size': 1248, 'optimizer': 'Adam'}. Best is trial 76 with value: 0.14233964433499957.
2026-05-15 18:19:02,754 - experiment_functions - INFO - Early stopping at epoch 1700. Best Recall: 0.1312
2026-05-15 18:19:02,912 - optuna.study.study - INFO - Trial 88 finished with value: 0.13115674966166777 and parameters: {'n_layers': 1, 'embedding_dim': 256, 'lr': 0.000774343636249915, 'lambda_val': 1.894570210695291e-06, 'batch_size': 1046, 'optimizer': 'Adam'}. Best is trial 76 with value: 0.14233964433499957.
2026-05-15 18:19:07,183 - experiment_functions - INFO - Early stopping at epoch 550. Best Recall: 0.0356
2026-05-15 18:19:07,329 - optuna.study.study - INFO - Trial 89 finished with value: 0.03559993384655957 and parameters: {'n_layers': 1, 'embedding_dim': 256, 'lr': 0.03529634460387369, 'lambda_val': 2.1744598066979308e-06, 'batch_size': 817, 'optimizer': 'Adam'}. Best is trial 76 with value: 0.14233964433499957.
2026-05-15 18:19:16,853 - experiment_functions - INFO - Early stopping at epoch 1300. Best Recall: 0.1234
2026-05-15 18:19:16,964 - optuna.study.study - INFO - Trial 90 finished with value: 0.12344677459609067 and parameters: {'n_layers': 1, 'embedding_dim': 256, 'lr': 0.000516855043987949, 'lambda_val': 3.526684232337571e-05, 'batch_size': 1636, 'optimizer': 'Adam'}. Best is trial 76 with value: 0.14233964433499957.
2026-05-15 18:19:27,457 - experiment_functions - INFO - Early stopping at epoch 1350. Best Recall: 0.1233
2026-05-15 18:19:27,648 - optuna.study.study - INFO - Trial 91 finished with value: 0.12326281857179257 and parameters: {'n_layers': 1, 'embedding_dim': 256, 'lr': 0.000559740316832973, 'lambda_val': 3.3901799553646307e-06, 'batch_size': 4058, 'optimizer': 'Adam'}. Best is trial 76 with value: 0.14233964433499957.
2026-05-15 18:19:35,205 - experiment_functions - INFO - Early stopping at epoch 1100. Best Recall: 0.1175
2026-05-15 18:19:35,374 - optuna.study.study - INFO - Trial 92 finished with value: 0.11753409820353253 and parameters: {'n_layers': 1, 'embedding_dim': 256, 'lr': 0.0011409985479994681, 'lambda_val': 0.0002712391272536089, 'batch_size': 786, 'optimizer': 'Adam'}. Best is trial 76 with value: 0.14233964433499957.
2026-05-15 18:19:51,674 - experiment_functions - INFO - Early stopping at epoch 2800. Best Recall: 0.1315
2026-05-15 18:19:51,815 - optuna.study.study - INFO - Trial 93 finished with value: 0.13146692740697002 and parameters: {'n_layers': 1, 'embedding_dim': 32, 'lr': 0.000750047034388205, 'lambda_val': 1.1687598664363964e-05, 'batch_size': 903, 'optimizer': 'Adam'}. Best is trial 76 with value: 0.14233964433499957.
2026-05-15 18:20:09,670 - optuna.study._optimize - INFO - Trial 94 pruned. 
2026-05-15 18:20:16,054 - optuna.study._optimize - INFO - Trial 95 pruned. 
2026-05-15 18:20:22,879 - optuna.study._optimize - INFO - Trial 96 pruned. 
2026-05-15 18:20:26,776 - experiment_functions - INFO - Early stopping at epoch 500. Best Recall: 0.0023
2026-05-15 18:20:26,933 - optuna.study.study - INFO - Trial 97 finished with value: 0.0022640286534885284 and parameters: {'n_layers': 1, 'embedding_dim': 256, 'lr': 0.0018098427027519704, 'lambda_val': 1.051520813261084e-06, 'batch_size': 604, 'optimizer': 'SGD'}. Best is trial 76 with value: 0.14233964433499957.
2026-05-15 18:20:37,651 - experiment_functions - INFO - Early stopping at epoch 1650. Best Recall: 0.1280
2026-05-15 18:20:37,765 - optuna.study.study - INFO - Trial 98 finished with value: 0.1279613473023909 and parameters: {'n_layers': 1, 'embedding_dim': 256, 'lr': 0.0007950480237359779, 'lambda_val': 1.831283335173848e-05, 'batch_size': 1021, 'optimizer': 'Adam'}. Best is trial 76 with value: 0.14233964433499957.
2026-05-15 18:20:45,141 - optuna.study._optimize - INFO - Trial 99 pruned. 
2026-05-15 18:20:52,859 - optuna.study._optimize - INFO - Trial 100 pruned. 
2026-05-15 18:21:05,008 - experiment_functions - INFO - Early stopping at epoch 1750. Best Recall: 0.1346
2026-05-15 18:21:05,165 - optuna.study.study - INFO - Trial 101 finished with value: 0.13461874829806256 and parameters: {'n_layers': 1, 'embedding_dim': 256, 'lr': 0.0006054786663901256, 'lambda_val': 0.0012216369284385577, 'batch_size': 809, 'optimizer': 'Adam'}. Best is trial 76 with value: 0.14233964433499957.
2026-05-15 18:21:25,079 - experiment_functions - INFO - Early stopping at epoch 3000. Best Recall: 0.1350
2026-05-15 18:21:25,233 - optuna.study.study - INFO - Trial 102 finished with value: 0.13502907579604798 and parameters: {'n_layers': 1, 'embedding_dim': 256, 'lr': 0.0005856147361129989, 'lambda_val': 3.3025302435266023e-06, 'batch_size': 683, 'optimizer': 'Adam'}. Best is trial 76 with value: 0.14233964433499957.
2026-05-15 18:21:41,708 - experiment_functions - INFO - Early stopping at epoch 2400. Best Recall: 0.1349
2026-05-15 18:21:41,820 - optuna.study.study - INFO - Trial 103 finished with value: 0.13492868214231962 and parameters: {'n_layers': 1, 'embedding_dim': 256, 'lr': 0.0006250919553752794, 'lambda_val': 0.0012290591664906015, 'batch_size': 697, 'optimizer': 'Adam'}. Best is trial 76 with value: 0.14233964433499957.
2026-05-15 18:21:50,338 - optuna.study._optimize - INFO - Trial 104 pruned. 
2026-05-15 18:21:57,410 - optuna.study._optimize - INFO - Trial 105 pruned. 
2026-05-15 18:22:04,196 - optuna.study._optimize - INFO - Trial 106 pruned. 
2026-05-15 18:22:12,082 - optuna.study._optimize - INFO - Trial 107 pruned. 
2026-05-15 18:22:22,929 - experiment_functions - INFO - Early stopping at epoch 1500. Best Recall: 0.1227
2026-05-15 18:22:23,052 - optuna.study.study - INFO - Trial 108 finished with value: 0.12271005618784214 and parameters: {'n_layers': 1, 'embedding_dim': 256, 'lr': 0.0006323842084936535, 'lambda_val': 0.002458928828778275, 'batch_size': 963, 'optimizer': 'Adam'}. Best is trial 76 with value: 0.14233964433499957.
2026-05-15 18:22:30,227 - optuna.study._optimize - INFO - Trial 109 pruned. 
2026-05-15 18:22:42,148 - experiment_functions - INFO - Early stopping at epoch 1800. Best Recall: 0.1259
2026-05-15 18:22:42,269 - optuna.study.study - INFO - Trial 110 finished with value: 0.12586224081281894 and parameters: {'n_layers': 1, 'embedding_dim': 256, 'lr': 0.0009241538400401277, 'lambda_val': 0.00012403608546132668, 'batch_size': 875, 'optimizer': 'Adam'}. Best is trial 76 with value: 0.14233964433499957.
2026-05-15 18:22:52,176 - experiment_functions - INFO - Early stopping at epoch 1350. Best Recall: 0.1253
2026-05-15 18:22:52,313 - optuna.study.study - INFO - Trial 111 finished with value: 0.12529466973056133 and parameters: {'n_layers': 1, 'embedding_dim': 256, 'lr': 0.0006303395556544446, 'lambda_val': 0.0005497438473330444, 'batch_size': 1912, 'optimizer': 'Adam'}. Best is trial 76 with value: 0.14233964433499957.
2026-05-15 18:23:01,144 - optuna.study._optimize - INFO - Trial 112 pruned. 
2026-05-15 18:23:09,349 - optuna.study._optimize - INFO - Trial 113 pruned. 
2026-05-15 18:23:25,844 - optuna.study._optimize - INFO - Trial 114 pruned. 
2026-05-15 18:23:29,457 - experiment_functions - INFO - Early stopping at epoch 500. Best Recall: 0.0028
2026-05-15 18:23:29,548 - optuna.study.study - INFO - Trial 115 finished with value: 0.002843751502326634 and parameters: {'n_layers': 1, 'embedding_dim': 256, 'lr': 0.0010642953407295887, 'lambda_val': 0.0003567629297533563, 'batch_size': 1013, 'optimizer': 'SGD'}. Best is trial 76 with value: 0.14233964433499957.
2026-05-15 18:23:38,808 - experiment_functions - INFO - Early stopping at epoch 950. Best Recall: 0.1175
2026-05-15 18:23:39,075 - optuna.study.study - INFO - Trial 116 finished with value: 0.11746151319763935 and parameters: {'n_layers': 1, 'embedding_dim': 256, 'lr': 0.0013629730845551571, 'lambda_val': 0.0014874288931464486, 'batch_size': 664, 'optimizer': 'Adam'}. Best is trial 76 with value: 0.14233964433499957.
2026-05-15 18:24:03,427 - experiment_functions - INFO - Early stopping at epoch 2500. Best Recall: 0.1439
2026-05-15 18:24:03,903 - optuna.study.study - INFO - Trial 117 finished with value: 0.14386181101190273 and parameters: {'n_layers': 1, 'embedding_dim': 256, 'lr': 0.0004960873357802519, 'lambda_val': 0.00030884632601104936, 'batch_size': 1108, 'optimizer': 'Adam'}. Best is trial 117 with value: 0.14386181101190273.
2026-05-15 18:24:11,646 - optuna.study._optimize - INFO - Trial 118 pruned. 
2026-05-15 18:24:19,957 - experiment_functions - INFO - Early stopping at epoch 900. Best Recall: 0.0661
2026-05-15 18:24:20,124 - optuna.study.study - INFO - Trial 119 finished with value: 0.06607878122543853 and parameters: {'n_layers': 3, 'embedding_dim': 256, 'lr': 0.0005664327491272916, 'lambda_val': 5.8878866363774145e-05, 'batch_size': 1278, 'optimizer': 'Adam'}. Best is trial 117 with value: 0.14386181101190273.
2026-05-15 18:24:27,243 - optuna.study._optimize - INFO - Trial 120 pruned. 
2026-05-15 18:24:40,951 - experiment_functions - INFO - Early stopping at epoch 1900. Best Recall: 0.1266
2026-05-15 18:24:41,097 - optuna.study.study - INFO - Trial 121 finished with value: 0.12660050667083494 and parameters: {'n_layers': 1, 'embedding_dim': 256, 'lr': 0.0006803393507825088, 'lambda_val': 0.0004885998484063172, 'batch_size': 1082, 'optimizer': 'Adam'}. Best is trial 117 with value: 0.14386181101190273.
2026-05-15 18:24:51,477 - experiment_functions - INFO - Early stopping at epoch 1550. Best Recall: 0.1256
2026-05-15 18:24:51,599 - optuna.study.study - INFO - Trial 122 finished with value: 0.12564568759473302 and parameters: {'n_layers': 1, 'embedding_dim': 256, 'lr': 0.0005257608747830529, 'lambda_val': 0.0006596438082240307, 'batch_size': 2219, 'optimizer': 'Adam'}. Best is trial 117 with value: 0.14386181101190273.
2026-05-15 18:25:06,499 - optuna.study._optimize - INFO - Trial 123 pruned. 
2026-05-15 18:25:18,556 - experiment_functions - INFO - Early stopping at epoch 1900. Best Recall: 0.1268
2026-05-15 18:25:18,667 - optuna.study.study - INFO - Trial 124 finished with value: 0.12677577244917332 and parameters: {'n_layers': 1, 'embedding_dim': 256, 'lr': 0.0007104955955553686, 'lambda_val': 0.0008651382904112824, 'batch_size': 885, 'optimizer': 'Adam'}. Best is trial 117 with value: 0.14386181101190273.
2026-05-15 18:25:25,641 - optuna.study._optimize - INFO - Trial 125 pruned. 
2026-05-15 18:25:33,178 - optuna.study._optimize - INFO - Trial 126 pruned. 
2026-05-15 18:25:40,332 - optuna.study._optimize - INFO - Trial 127 pruned. 
2026-05-15 18:25:46,723 - experiment_functions - INFO - Early stopping at epoch 950. Best Recall: 0.1202
2026-05-15 18:25:46,882 - optuna.study.study - INFO - Trial 128 finished with value: 0.120246227244943 and parameters: {'n_layers': 1, 'embedding_dim': 64, 'lr': 0.0012509801983663262, 'lambda_val': 1.5415498151365046e-06, 'batch_size': 1128, 'optimizer': 'Adam'}. Best is trial 117 with value: 0.14386181101190273.
2026-05-15 18:25:54,092 - optuna.study._optimize - INFO - Trial 129 pruned. 
2026-05-15 18:25:59,272 - experiment_functions - INFO - Early stopping at epoch 750. Best Recall: 0.0939
2026-05-15 18:25:59,382 - optuna.study.study - INFO - Trial 130 finished with value: 0.09386686279944062 and parameters: {'n_layers': 1, 'embedding_dim': 64, 'lr': 0.0015786390646109756, 'lambda_val': 0.00029386537528760436, 'batch_size': 744, 'optimizer': 'Adam'}. Best is trial 117 with value: 0.14386181101190273.
2026-05-15 18:26:06,550 - optuna.study._optimize - INFO - Trial 131 pruned. 
2026-05-15 18:26:12,942 - optuna.study._optimize - INFO - Trial 132 pruned. 
2026-05-15 18:26:19,959 - optuna.study._optimize - INFO - Trial 133 pruned. 
2026-05-15 18:26:34,973 - experiment_functions - INFO - Early stopping at epoch 2400. Best Recall: 0.1309
2026-05-15 18:26:35,085 - optuna.study.study - INFO - Trial 134 finished with value: 0.13088973873099477 and parameters: {'n_layers': 1, 'embedding_dim': 256, 'lr': 0.0005479463612307728, 'lambda_val': 0.001646088480341081, 'batch_size': 1065, 'optimizer': 'Adam'}. Best is trial 117 with value: 0.14386181101190273.
2026-05-15 18:26:43,233 - experiment_functions - INFO - Early stopping at epoch 800. Best Recall: 0.0459
2026-05-15 18:26:43,335 - optuna.study.study - INFO - Trial 135 finished with value: 0.04587608892415402 and parameters: {'n_layers': 4, 'embedding_dim': 256, 'lr': 0.00046064725917204554, 'lambda_val': 0.000235449851615704, 'batch_size': 979, 'optimizer': 'Adam'}. Best is trial 117 with value: 0.14386181101190273.
2026-05-15 18:26:47,432 - experiment_functions - INFO - Early stopping at epoch 500. Best Recall: 0.0033
2026-05-15 18:26:47,557 - optuna.study.study - INFO - Trial 136 finished with value: 0.0032735565556957797 and parameters: {'n_layers': 1, 'embedding_dim': 64, 'lr': 0.001045001659814922, 'lambda_val': 0.0010945715089500665, 'batch_size': 772, 'optimizer': 'SGD'}. Best is trial 117 with value: 0.14386181101190273.
2026-05-15 18:27:13,038 - optuna.study.study - INFO - Trial 137 finished with value: 0.13622309613105413 and parameters: {'n_layers': 1, 'embedding_dim': 256, 'lr': 0.0003865687383968264, 'lambda_val': 0.0008388598742877076, 'batch_size': 934, 'optimizer': 'Adam'}. Best is trial 117 with value: 0.14386181101190273.
2026-05-15 18:27:23,563 - experiment_functions - INFO - Early stopping at epoch 500. Best Recall: 0.0027
