2026-05-15 17:31:44,304 - optuna.study.study - INFO - Trial 59 finished with value: 0.09901093760621049 and parameters: {'n_layers': 1, 'embedding_dim': 128, 'lr': 0.00405008890608957, 'lambda_val': 2.7189228599326067e-05, 'batch_size': 761, 'optimizer': 'Adam'}. Best is trial 28 with value: 0.1363001411639181.
2026-05-15 17:31:49,022 - experiment_functions - INFO - Early stopping at epoch 600. Best Recall: 0.0607
2026-05-15 17:31:49,123 - optuna.study.study - INFO - Trial 60 finished with value: 0.0607002485343112 and parameters: {'n_layers': 3, 'embedding_dim': 128, 'lr': 0.0014159915639477842, 'lambda_val': 5.335591007379775e-05, 'batch_size': 959, 'optimizer': 'Adam'}. Best is trial 28 with value: 0.1363001411639181.
2026-05-15 17:31:53,290 - experiment_functions - INFO - Early stopping at epoch 550. Best Recall: 0.0466
2026-05-15 17:31:53,456 - optuna.study.study - INFO - Trial 61 finished with value: 0.04658156550261517 and parameters: {'n_layers': 2, 'embedding_dim': 128, 'lr': 0.008655797852727517, 'lambda_val': 3.638321749405571e-05, 'batch_size': 1507, 'optimizer': 'Adam'}. Best is trial 28 with value: 0.1363001411639181.
2026-05-15 17:31:57,674 - experiment_functions - INFO - Early stopping at epoch 600. Best Recall: 0.1100
2026-05-15 17:31:57,785 - optuna.study.study - INFO - Trial 62 finished with value: 0.1099584159406628 and parameters: {'n_layers': 1, 'embedding_dim': 128, 'lr': 0.0024624574988234135, 'lambda_val': 5.93949228269108e-05, 'batch_size': 1381, 'optimizer': 'Adam'}. Best is trial 28 with value: 0.1363001411639181.
2026-05-15 17:32:02,268 - experiment_functions - INFO - Early stopping at epoch 600. Best Recall: 0.1062
2026-05-15 17:32:02,435 - optuna.study.study - INFO - Trial 63 finished with value: 0.10624837875305077 and parameters: {'n_layers': 1, 'embedding_dim': 128, 'lr': 0.003139158819910631, 'lambda_val': 6.74505593405738e-05, 'batch_size': 1332, 'optimizer': 'Adam'}. Best is trial 28 with value: 0.1363001411639181.
2026-05-15 17:32:06,827 - experiment_functions - INFO - Early stopping at epoch 650. Best Recall: 0.1066
2026-05-15 17:32:06,917 - optuna.study.study - INFO - Trial 64 finished with value: 0.10658169978103361 and parameters: {'n_layers': 1, 'embedding_dim': 128, 'lr': 0.0023289791604062227, 'lambda_val': 1.3630502094969849e-05, 'batch_size': 758, 'optimizer': 'Adam'}. Best is trial 28 with value: 0.1363001411639181.
2026-05-15 17:32:10,683 - experiment_functions - INFO - Early stopping at epoch 550. Best Recall: 0.1012
2026-05-15 17:32:10,818 - optuna.study.study - INFO - Trial 65 finished with value: 0.10122474670920151 and parameters: {'n_layers': 1, 'embedding_dim': 128, 'lr': 0.004935387904102245, 'lambda_val': 0.00011430504679348488, 'batch_size': 1199, 'optimizer': 'Adam'}. Best is trial 28 with value: 0.1363001411639181.
2026-05-15 17:32:17,430 - experiment_functions - INFO - Early stopping at epoch 950. Best Recall: 0.1076
2026-05-15 17:32:17,541 - optuna.study.study - INFO - Trial 66 finished with value: 0.10762454766828883 and parameters: {'n_layers': 1, 'embedding_dim': 128, 'lr': 0.001751823891613108, 'lambda_val': 3.020561225336264e-05, 'batch_size': 576, 'optimizer': 'Adam'}. Best is trial 28 with value: 0.1363001411639181.
2026-05-15 17:32:24,973 - experiment_functions - INFO - Early stopping at epoch 1200. Best Recall: 0.1168
2026-05-15 17:32:25,084 - optuna.study.study - INFO - Trial 67 finished with value: 0.11684637486646081 and parameters: {'n_layers': 1, 'embedding_dim': 128, 'lr': 0.0012312847653640987, 'lambda_val': 0.0002690598513031949, 'batch_size': 1008, 'optimizer': 'Adam'}. Best is trial 28 with value: 0.1363001411639181.
2026-05-15 17:32:31,449 - experiment_functions - INFO - Early stopping at epoch 1000. Best Recall: 0.1425
2026-05-15 17:32:31,565 - optuna.study.study - INFO - Trial 68 finished with value: 0.14253549118945177 and parameters: {'n_layers': 1, 'embedding_dim': 128, 'lr': 0.0012582333909106486, 'lambda_val': 0.00034195468801603114, 'batch_size': 1071, 'optimizer': 'Adam'}. Best is trial 68 with value: 0.14253549118945177.
2026-05-15 17:32:40,073 - experiment_functions - INFO - Early stopping at epoch 1450. Best Recall: 0.1171
2026-05-15 17:32:40,163 - optuna.study.study - INFO - Trial 69 finished with value: 0.11711965517113973 and parameters: {'n_layers': 1, 'embedding_dim': 128, 'lr': 0.001208271859897926, 'lambda_val': 0.00028895744626211407, 'batch_size': 952, 'optimizer': 'Adam'}. Best is trial 68 with value: 0.14253549118945177.
2026-05-15 17:32:46,446 - experiment_functions - INFO - Early stopping at epoch 1000. Best Recall: 0.1328
2026-05-15 17:32:46,567 - optuna.study.study - INFO - Trial 70 finished with value: 0.13282018995285552 and parameters: {'n_layers': 1, 'embedding_dim': 128, 'lr': 0.0011129538881001703, 'lambda_val': 0.00029031323583437416, 'batch_size': 951, 'optimizer': 'Adam'}. Best is trial 68 with value: 0.14253549118945177.
2026-05-15 17:32:51,061 - experiment_functions - INFO - Early stopping at epoch 650. Best Recall: 0.1087
2026-05-15 17:32:51,183 - optuna.study.study - INFO - Trial 71 finished with value: 0.10871257087661518 and parameters: {'n_layers': 1, 'embedding_dim': 128, 'lr': 0.0034960535307237044, 'lambda_val': 0.0003072850954580767, 'batch_size': 974, 'optimizer': 'Adam'}. Best is trial 68 with value: 0.14253549118945177.
2026-05-15 17:32:58,554 - experiment_functions - INFO - Early stopping at epoch 1150. Best Recall: 0.1253
2026-05-15 17:32:58,654 - optuna.study.study - INFO - Trial 72 finished with value: 0.12530705418345411 and parameters: {'n_layers': 1, 'embedding_dim': 128, 'lr': 0.001113118981632937, 'lambda_val': 0.00020013067471185005, 'batch_size': 710, 'optimizer': 'Adam'}. Best is trial 68 with value: 0.14253549118945177.
2026-05-15 17:33:06,054 - experiment_functions - INFO - Early stopping at epoch 1250. Best Recall: 0.1256
2026-05-15 17:33:06,166 - optuna.study.study - INFO - Trial 73 finished with value: 0.12563469763912097 and parameters: {'n_layers': 1, 'embedding_dim': 128, 'lr': 0.0012051595216236632, 'lambda_val': 0.0002586216694704129, 'batch_size': 737, 'optimizer': 'Adam'}. Best is trial 68 with value: 0.14253549118945177.
2026-05-15 17:33:14,348 - experiment_functions - INFO - Early stopping at epoch 1250. Best Recall: 0.1385
2026-05-15 17:33:14,463 - optuna.study.study - INFO - Trial 74 finished with value: 0.1384640106477036 and parameters: {'n_layers': 1, 'embedding_dim': 128, 'lr': 0.001243448885649737, 'lambda_val': 0.00022837493449926247, 'batch_size': 656, 'optimizer': 'Adam'}. Best is trial 68 with value: 0.14253549118945177.
2026-05-15 17:33:21,550 - experiment_functions - INFO - Early stopping at epoch 1300. Best Recall: 0.1283
2026-05-15 17:33:21,651 - optuna.study.study - INFO - Trial 75 finished with value: 0.1283213265833424 and parameters: {'n_layers': 1, 'embedding_dim': 128, 'lr': 0.0009580720134275503, 'lambda_val': 0.00037052941733235084, 'batch_size': 639, 'optimizer': 'Adam'}. Best is trial 68 with value: 0.14253549118945177.
2026-05-15 17:33:27,779 - optuna.study._optimize - INFO - Trial 76 pruned. 
2026-05-15 17:33:37,429 - experiment_functions - INFO - Early stopping at epoch 1650. Best Recall: 0.1398
2026-05-15 17:33:37,542 - optuna.study.study - INFO - Trial 77 finished with value: 0.1398094718539907 and parameters: {'n_layers': 1, 'embedding_dim': 128, 'lr': 0.0009471112511385877, 'lambda_val': 0.00021310771360990465, 'batch_size': 528, 'optimizer': 'Adam'}. Best is trial 68 with value: 0.14253549118945177.
2026-05-15 17:33:48,265 - experiment_functions - INFO - Early stopping at epoch 1850. Best Recall: 0.1356
2026-05-15 17:33:48,378 - optuna.study.study - INFO - Trial 78 finished with value: 0.13560913808049374 and parameters: {'n_layers': 1, 'embedding_dim': 128, 'lr': 0.0009150798646861901, 'lambda_val': 0.00040661849807742943, 'batch_size': 667, 'optimizer': 'Adam'}. Best is trial 68 with value: 0.14253549118945177.
2026-05-15 17:33:55,300 - optuna.study._optimize - INFO - Trial 79 pruned. 
2026-05-15 17:34:19,092 - experiment_functions - INFO - Early stopping at epoch 2600. Best Recall: 0.1355
2026-05-15 17:34:19,200 - optuna.study.study - INFO - Trial 80 finished with value: 0.1355078896947708 and parameters: {'n_layers': 1, 'embedding_dim': 128, 'lr': 0.0005962457063793629, 'lambda_val': 0.0008250028731349807, 'batch_size': 857, 'optimizer': 'Adam'}. Best is trial 68 with value: 0.14253549118945177.
2026-05-15 17:34:25,903 - experiment_functions - INFO - Early stopping at epoch 750. Best Recall: 0.0519
2026-05-15 17:34:26,012 - optuna.study.study - INFO - Trial 81 finished with value: 0.05187082041957317 and parameters: {'n_layers': 4, 'embedding_dim': 128, 'lr': 0.0006171265718726899, 'lambda_val': 0.0008456391293865172, 'batch_size': 890, 'optimizer': 'Adam'}. Best is trial 68 with value: 0.14253549118945177.
2026-05-15 17:34:44,890 - experiment_functions - INFO - Early stopping at epoch 3800. Best Recall: 0.1453
2026-05-15 17:34:44,949 - optuna.study.study - INFO - Trial 82 finished with value: 0.14531592107465247 and parameters: {'n_layers': 1, 'embedding_dim': 128, 'lr': 0.00043097804113326833, 'lambda_val': 0.00047742353384409766, 'batch_size': 622, 'optimizer': 'Adam'}. Best is trial 82 with value: 0.14531592107465247.
2026-05-15 17:34:50,385 - optuna.study._optimize - INFO - Trial 83 pruned. 
2026-05-15 17:34:55,965 - optuna.study._optimize - INFO - Trial 84 pruned. 
2026-05-15 17:35:09,799 - experiment_functions - INFO - Early stopping at epoch 2350. Best Recall: 0.1408
2026-05-15 17:35:09,909 - optuna.study.study - INFO - Trial 85 finished with value: 0.14083939787403704 and parameters: {'n_layers': 1, 'embedding_dim': 128, 'lr': 0.0005280405566125051, 'lambda_val': 9.249405053295765e-05, 'batch_size': 1107, 'optimizer': 'Adam'}. Best is trial 82 with value: 0.14531592107465247.
2026-05-15 17:35:16,416 - optuna.study._optimize - INFO - Trial 86 pruned. 
2026-05-15 17:35:22,410 - optuna.study._optimize - INFO - Trial 87 pruned. 
2026-05-15 17:35:28,710 - optuna.study._optimize - INFO - Trial 88 pruned. 
2026-05-15 17:35:35,209 - optuna.study._optimize - INFO - Trial 89 pruned. 
2026-05-15 17:35:38,893 - experiment_functions - INFO - Early stopping at epoch 500. Best Recall: 0.0030
2026-05-15 17:35:39,014 - optuna.study.study - INFO - Trial 90 finished with value: 0.002969932363256236 and parameters: {'n_layers': 2, 'embedding_dim': 64, 'lr': 0.00042480147281237225, 'lambda_val': 0.0001293306187079746, 'batch_size': 1223, 'optimizer': 'SGD'}. Best is trial 82 with value: 0.14531592107465247.
2026-05-15 17:35:49,382 - experiment_functions - INFO - Early stopping at epoch 1700. Best Recall: 0.1344
2026-05-15 17:35:49,522 - optuna.study.study - INFO - Trial 91 finished with value: 0.13438039034940835 and parameters: {'n_layers': 1, 'embedding_dim': 128, 'lr': 0.0007533625962032337, 'lambda_val': 0.00020270654657150592, 'batch_size': 900, 'optimizer': 'Adam'}. Best is trial 82 with value: 0.14531592107465247.
2026-05-15 17:35:56,109 - optuna.study._optimize - INFO - Trial 92 pruned. 
2026-05-15 17:36:09,928 - experiment_functions - INFO - Early stopping at epoch 2450. Best Recall: 0.1358
2026-05-15 17:36:10,040 - optuna.study.study - INFO - Trial 93 finished with value: 0.13583559247440408 and parameters: {'n_layers': 1, 'embedding_dim': 128, 'lr': 0.0007416053205170625, 'lambda_val': 0.00046480051972556057, 'batch_size': 603, 'optimizer': 'Adam'}. Best is trial 82 with value: 0.14531592107465247.
2026-05-15 17:36:17,021 - optuna.study._optimize - INFO - Trial 94 pruned. 
2026-05-15 17:36:25,636 - optuna.study._optimize - INFO - Trial 95 pruned. 
2026-05-15 17:36:32,218 - optuna.study._optimize - INFO - Trial 96 pruned. 
2026-05-15 17:36:37,327 - experiment_functions - INFO - Early stopping at epoch 700. Best Recall: 0.0699
2026-05-15 17:36:37,439 - optuna.study.study - INFO - Trial 97 finished with value: 0.06986697744974757 and parameters: {'n_layers': 3, 'embedding_dim': 128, 'lr': 0.0007508848815994381, 'lambda_val': 0.00048238582191307254, 'batch_size': 567, 'optimizer': 'Adam'}. Best is trial 82 with value: 0.14531592107465247.
2026-05-15 17:36:43,279 - optuna.study._optimize - INFO - Trial 98 pruned. 
2026-05-15 17:36:49,194 - optuna.study._optimize - INFO - Trial 99 pruned. 
2026-05-15 17:36:57,997 - experiment_functions - INFO - Early stopping at epoch 1400. Best Recall: 0.1387
2026-05-15 17:36:58,165 - optuna.study.study - INFO - Trial 100 finished with value: 0.13867886935926557 and parameters: {'n_layers': 1, 'embedding_dim': 128, 'lr': 0.0009053615871618338, 'lambda_val': 2.120836823792332e-05, 'batch_size': 1059, 'optimizer': 'Adam'}. Best is trial 82 with value: 0.14531592107465247.
2026-05-15 17:37:01,676 - experiment_functions - INFO - Early stopping at epoch 500. Best Recall: 0.0012
2026-05-15 17:37:01,787 - optuna.study.study - INFO - Trial 101 finished with value: 0.0012498957797279807 and parameters: {'n_layers': 1, 'embedding_dim': 32, 'lr': 0.0009262187460837657, 'lambda_val': 1.5218666313717005e-05, 'batch_size': 1065, 'optimizer': 'SGD'}. Best is trial 82 with value: 0.14531592107465247.
2026-05-15 17:37:08,215 - optuna.study._optimize - INFO - Trial 102 pruned. 
2026-05-15 17:37:19,357 - experiment_functions - INFO - Early stopping at epoch 1800. Best Recall: 0.1427
2026-05-15 17:37:19,479 - optuna.study.study - INFO - Trial 103 finished with value: 0.14273139442054567 and parameters: {'n_layers': 1, 'embedding_dim': 128, 'lr': 0.0008452443976052781, 'lambda_val': 0.0001467164539816112, 'batch_size': 1111, 'optimizer': 'Adam'}. Best is trial 82 with value: 0.14531592107465247.
2026-05-15 17:37:24,703 - experiment_functions - INFO - Early stopping at epoch 750. Best Recall: 0.1245
2026-05-15 17:37:24,833 - optuna.study.study - INFO - Trial 104 finished with value: 0.12447008532724103 and parameters: {'n_layers': 1, 'embedding_dim': 128, 'lr': 0.0021512471734322215, 'lambda_val': 0.00013645683173386705, 'batch_size': 1055, 'optimizer': 'Adam'}. Best is trial 82 with value: 0.14531592107465247.
2026-05-15 17:37:41,976 - experiment_functions - INFO - Early stopping at epoch 3100. Best Recall: 0.1471
2026-05-15 17:37:42,091 - optuna.study.study - INFO - Trial 105 finished with value: 0.14708966661398268 and parameters: {'n_layers': 1, 'embedding_dim': 128, 'lr': 0.0008933417674427597, 'lambda_val': 7.548893325323006e-05, 'batch_size': 525, 'optimizer': 'Adam'}. Best is trial 105 with value: 0.14708966661398268.
2026-05-15 17:37:52,980 - experiment_functions - INFO - Early stopping at epoch 1900. Best Recall: 0.1382
2026-05-15 17:37:53,103 - optuna.study.study - INFO - Trial 106 finished with value: 0.13817691673972785 and parameters: {'n_layers': 1, 'embedding_dim': 128, 'lr': 0.0009321434099876865, 'lambda_val': 7.602034188812901e-05, 'batch_size': 589, 'optimizer': 'Adam'}. Best is trial 105 with value: 0.14708966661398268.
2026-05-15 17:37:59,185 - optuna.study._optimize - INFO - Trial 107 pruned. 
2026-05-15 17:38:05,435 - optuna.study._optimize - INFO - Trial 108 pruned. 
2026-05-15 17:38:14,374 - experiment_functions - INFO - Early stopping at epoch 1250. Best Recall: 0.1343
2026-05-15 17:38:14,497 - optuna.study.study - INFO - Trial 109 finished with value: 0.1343022995851923 and parameters: {'n_layers': 1, 'embedding_dim': 256, 'lr': 0.0008790784325295607, 'lambda_val': 6.634647287305823e-05, 'batch_size': 1142, 'optimizer': 'Adam'}. Best is trial 105 with value: 0.14708966661398268.
2026-05-15 17:38:20,570 - optuna.study._optimize - INFO - Trial 110 pruned. 
2026-05-15 17:38:27,176 - optuna.study._optimize - INFO - Trial 111 pruned. 
2026-05-15 17:38:35,016 - optuna.study._optimize - INFO - Trial 112 pruned. 
2026-05-15 17:38:40,885 - experiment_functions - INFO - Early stopping at epoch 900. Best Recall: 0.1279
2026-05-15 17:38:40,999 - optuna.study.study - INFO - Trial 113 finished with value: 0.12785070000932253 and parameters: {'n_layers': 1, 'embedding_dim': 128, 'lr': 0.001388726053236655, 'lambda_val': 0.000172602406462471, 'batch_size': 564, 'optimizer': 'Adam'}. Best is trial 105 with value: 0.14708966661398268.
2026-05-15 17:38:48,996 - optuna.study._optimize - INFO - Trial 114 pruned. 
2026-05-15 17:38:54,929 - experiment_functions - INFO - Early stopping at epoch 950. Best Recall: 0.1174
2026-05-15 17:38:55,067 - optuna.study.study - INFO - Trial 115 finished with value: 0.11741126989314879 and parameters: {'n_layers': 1, 'embedding_dim': 128, 'lr': 0.0010098415157004743, 'lambda_val': 1.0570321464590987e-05, 'batch_size': 2650, 'optimizer': 'Adam'}. Best is trial 105 with value: 0.14708966661398268.
2026-05-15 17:39:01,442 - optuna.study._optimize - INFO - Trial 116 pruned. 
2026-05-15 17:39:05,196 - experiment_functions - INFO - Early stopping at epoch 500. Best Recall: 0.0014
2026-05-15 17:39:05,323 - optuna.study.study - INFO - Trial 117 finished with value: 0.0013757129824262806 and parameters: {'n_layers': 1, 'embedding_dim': 64, 'lr': 0.0005564932241872878, 'lambda_val': 7.633467525286171e-05, 'batch_size': 723, 'optimizer': 'SGD'}. Best is trial 105 with value: 0.14708966661398268.
2026-05-15 17:39:12,951 - experiment_functions - INFO - Early stopping at epoch 1300. Best Recall: 0.1308
2026-05-15 17:39:13,056 - optuna.study.study - INFO - Trial 118 finished with value: 0.13084137962454992 and parameters: {'n_layers': 1, 'embedding_dim': 128, 'lr': 0.0008596778862015154, 'lambda_val': 0.00013366131832792953, 'batch_size': 1021, 'optimizer': 'Adam'}. Best is trial 105 with value: 0.14708966661398268.
2026-05-15 17:39:20,835 - optuna.study._optimize - INFO - Trial 119 pruned. 
2026-05-15 17:39:27,088 - optuna.study._optimize - INFO - Trial 120 pruned. 
2026-05-15 17:39:33,084 - experiment_functions - INFO - Early stopping at epoch 1000. Best Recall: 0.1234
2026-05-15 17:39:33,231 - optuna.study.study - INFO - Trial 121 finished with value: 0.12337862557760636 and parameters: {'n_layers': 1, 'embedding_dim': 128, 'lr': 0.0012731663427617017, 'lambda_val': 0.00042786043500597293, 'batch_size': 797, 'optimizer': 'Adam'}. Best is trial 105 with value: 0.14708966661398268.
2026-05-15 17:39:49,967 - experiment_functions - INFO - Early stopping at epoch 2950. Best Recall: 0.1417
2026-05-15 17:39:50,125 - optuna.study.study - INFO - Trial 122 finished with value: 0.14170559815153352 and parameters: {'n_layers': 1, 'embedding_dim': 128, 'lr': 0.0006085541743066764, 'lambda_val': 0.000752645792665549, 'batch_size': 825, 'optimizer': 'Adam'}. Best is trial 105 with value: 0.14708966661398268.
2026-05-15 17:39:57,977 - optuna.study._optimize - INFO - Trial 123 pruned. 
2026-05-15 17:40:04,642 - optuna.study._optimize - INFO - Trial 124 pruned. 
2026-05-15 17:40:16,303 - experiment_functions - INFO - Early stopping at epoch 600. Best Recall: 0.0163
2026-05-15 17:40:16,508 - optuna.study.study - INFO - Trial 125 finished with value: 0.016278169156671705 and parameters: {'n_layers': 1, 'embedding_dim': 128, 'lr': 0.09148816631201195, 'lambda_val': 0.0006747763882536281, 'batch_size': 725, 'optimizer': 'Adam'}. Best is trial 105 with value: 0.14708966661398268.
2026-05-15 17:40:32,792 - experiment_functions - INFO - Early stopping at epoch 2550. Best Recall: 0.1426
2026-05-15 17:40:32,897 - optuna.study.study - INFO - Trial 126 finished with value: 0.1426098693227356 and parameters: {'n_layers': 1, 'embedding_dim': 128, 'lr': 0.0007213058699051408, 'lambda_val': 0.001044888257612721, 'batch_size': 833, 'optimizer': 'Adam'}. Best is trial 105 with value: 0.14708966661398268.
2026-05-15 17:40:39,319 - optuna.study._optimize - INFO - Trial 127 pruned. 
2026-05-15 17:40:46,269 - optuna.study._optimize - INFO - Trial 128 pruned. 
2026-05-15 17:40:52,764 - optuna.study._optimize - INFO - Trial 129 pruned. 
2026-05-15 17:40:56,883 - experiment_functions - INFO - Early stopping at epoch 600. Best Recall: 0.1097
2026-05-15 17:40:56,998 - optuna.study.study - INFO - Trial 130 finished with value: 0.10971386425150866 and parameters: {'n_layers': 1, 'embedding_dim': 128, 'lr': 0.0028763764002417455, 'lambda_val': 2.931412685081095e-05, 'batch_size': 1163, 'optimizer': 'Adam'}. Best is trial 105 with value: 0.14708966661398268.
2026-05-15 17:41:07,634 - optuna.study._optimize - INFO - Trial 131 pruned. 
2026-05-15 17:41:18,127 - experiment_functions - INFO - Early stopping at epoch 1450. Best Recall: 0.1333
2026-05-15 17:41:18,253 - optuna.study.study - INFO - Trial 132 finished with value: 0.13326077487479432 and parameters: {'n_layers': 1, 'embedding_dim': 128, 'lr': 0.0008419065786895167, 'lambda_val': 0.0005084501173490843, 'batch_size': 799, 'optimizer': 'Adam'}. Best is trial 105 with value: 0.14708966661398268.
2026-05-15 17:41:27,604 - optuna.study._optimize - INFO - Trial 133 pruned. 
2026-05-15 17:41:35,837 - optuna.study._optimize - INFO - Trial 134 pruned. 
2026-05-15 17:41:49,384 - optuna.study._optimize - INFO - Trial 135 pruned. 
2026-05-15 17:41:56,761 - experiment_functions - INFO - Early stopping at epoch 1250. Best Recall: 0.1272
2026-05-15 17:41:56,931 - optuna.study.study - INFO - Trial 136 finished with value: 0.12723966507922463 and parameters: {'n_layers': 1, 'embedding_dim': 128, 'lr': 0.001249942869176175, 'lambda_val': 0.0004498671797630298, 'batch_size': 734, 'optimizer': 'Adam'}. Best is trial 105 with value: 0.14708966661398268.
2026-05-15 17:42:03,403 - optuna.study._optimize - INFO - Trial 137 pruned. 
2026-05-15 17:42:07,457 - experiment_functions - INFO - Early stopping at epoch 500. Best Recall: 0.0026
2026-05-15 17:42:07,585 - optuna.study.study - INFO - Trial 138 finished with value: 0.0026098288988272563 and parameters: {'n_layers': 1, 'embedding_dim': 128, 'lr': 0.0008861135105123652, 'lambda_val': 0.09886731012697893, 'batch_size': 1068, 'optimizer': 'SGD'}. Best is trial 105 with value: 0.14708966661398268.
2026-05-15 17:42:14,640 - optuna.study._optimize - INFO - Trial 139 pruned. 
