2026-05-15 17:42:21,886 - optuna.study._optimize - INFO - Trial 140 pruned. 
2026-05-15 17:42:38,878 - experiment_functions - INFO - Early stopping at epoch 2900. Best Recall: 0.1472
2026-05-15 17:42:38,987 - optuna.study.study - INFO - Trial 141 finished with value: 0.14724858652379075 and parameters: {'n_layers': 1, 'embedding_dim': 128, 'lr': 0.0005284877894213279, 'lambda_val': 0.0006769044925113734, 'batch_size': 1280, 'optimizer': 'Adam'}. Best is trial 141 with value: 0.14724858652379075.
2026-05-15 17:42:45,675 - optuna.study._optimize - INFO - Trial 142 pruned. 
2026-05-15 17:42:52,100 - optuna.study._optimize - INFO - Trial 143 pruned. 
2026-05-15 17:42:57,192 - experiment_functions - INFO - Early stopping at epoch 750. Best Recall: 0.0539
2026-05-15 17:42:57,307 - optuna.study.study - INFO - Trial 144 finished with value: 0.05387271211048805 and parameters: {'n_layers': 3, 'embedding_dim': 128, 'lr': 0.0006206373660363706, 'lambda_val': 0.0013014486329443631, 'batch_size': 1118, 'optimizer': 'Adam'}. Best is trial 141 with value: 0.14724858652379075.
2026-05-15 17:43:03,754 - optuna.study._optimize - INFO - Trial 145 pruned. 
2026-05-15 17:43:13,266 - optuna.study._optimize - INFO - Trial 146 pruned. 
2026-05-15 17:43:19,833 - optuna.study._optimize - INFO - Trial 147 pruned. 
2026-05-15 17:43:25,060 - experiment_functions - INFO - Early stopping at epoch 600. Best Recall: 0.0325
2026-05-15 17:43:25,181 - optuna.study.study - INFO - Trial 148 finished with value: 0.032547939697733404 and parameters: {'n_layers': 4, 'embedding_dim': 128, 'lr': 0.0013748277040568485, 'lambda_val': 0.0010225174540560802, 'batch_size': 926, 'optimizer': 'Adam'}. Best is trial 141 with value: 0.14724858652379075.
2026-05-15 17:43:31,967 - optuna.study._optimize - INFO - Trial 149 pruned. 
2026-05-15 17:43:47,733 - experiment_functions - INFO - Early stopping at epoch 1100. Best Recall: 0.1281
2026-05-15 17:43:47,859 - optuna.study.study - INFO - Trial 150 finished with value: 0.12805426238451853 and parameters: {'n_layers': 1, 'embedding_dim': 128, 'lr': 0.0010379128002803363, 'lambda_val': 0.00013428982288795008, 'batch_size': 1257, 'optimizer': 'Adam'}. Best is trial 141 with value: 0.14724858652379075.
2026-05-15 17:43:54,671 - optuna.study._optimize - INFO - Trial 151 pruned. 
2026-05-15 17:44:03,696 - experiment_functions - INFO - Early stopping at epoch 1400. Best Recall: 0.1347
2026-05-15 17:44:03,822 - optuna.study.study - INFO - Trial 152 finished with value: 0.1346942132820313 and parameters: {'n_layers': 1, 'embedding_dim': 128, 'lr': 0.000657975075897588, 'lambda_val': 0.0008196772964722291, 'batch_size': 852, 'optimizer': 'Adam'}. Best is trial 141 with value: 0.14724858652379075.
2026-05-15 17:44:07,799 - experiment_functions - INFO - Early stopping at epoch 500. Best Recall: 0.0049
2026-05-15 17:44:07,982 - optuna.study.study - INFO - Trial 153 finished with value: 0.004858523255076303 and parameters: {'n_layers': 1, 'embedding_dim': 128, 'lr': 1.1722883910450766e-05, 'lambda_val': 0.0007458913595168224, 'batch_size': 617, 'optimizer': 'Adam'}. Best is trial 141 with value: 0.14724858652379075.
2026-05-15 17:44:14,892 - optuna.study._optimize - INFO - Trial 154 pruned. 
2026-05-15 17:44:21,178 - optuna.study._optimize - INFO - Trial 155 pruned. 
2026-05-15 17:44:27,983 - optuna.study._optimize - INFO - Trial 156 pruned. 
2026-05-15 17:44:35,438 - optuna.study._optimize - INFO - Trial 157 pruned. 
2026-05-15 17:44:41,231 - experiment_functions - INFO - Early stopping at epoch 850. Best Recall: 0.1169
2026-05-15 17:44:41,358 - optuna.study.study - INFO - Trial 158 finished with value: 0.11693265527993976 and parameters: {'n_layers': 1, 'embedding_dim': 128, 'lr': 0.0015796349322949085, 'lambda_val': 7.119169106397666e-05, 'batch_size': 1094, 'optimizer': 'Adam'}. Best is trial 141 with value: 0.14724858652379075.
2026-05-15 17:44:47,500 - experiment_functions - INFO - Early stopping at epoch 950. Best Recall: 0.1113
2026-05-15 17:44:47,616 - optuna.study.study - INFO - Trial 159 finished with value: 0.11132513152281023 and parameters: {'n_layers': 1, 'embedding_dim': 128, 'lr': 0.001076093994001969, 'lambda_val': 0.0015463853576750887, 'batch_size': 908, 'optimizer': 'Adam'}. Best is trial 141 with value: 0.14724858652379075.
2026-05-15 17:44:51,601 - experiment_functions - INFO - Early stopping at epoch 500. Best Recall: 0.0006
2026-05-15 17:44:51,739 - optuna.study.study - INFO - Trial 160 finished with value: 0.0005506523156880713 and parameters: {'n_layers': 1, 'embedding_dim': 128, 'lr': 0.0005815844661564008, 'lambda_val': 0.00020224242590865605, 'batch_size': 751, 'optimizer': 'SGD'}. Best is trial 141 with value: 0.14724858652379075.
2026-05-15 17:45:00,506 - experiment_functions - INFO - Early stopping at epoch 1400. Best Recall: 0.1364
2026-05-15 17:45:00,621 - optuna.study.study - INFO - Trial 161 finished with value: 0.13641434043229964 and parameters: {'n_layers': 1, 'embedding_dim': 128, 'lr': 0.0009050970287075126, 'lambda_val': 0.0002564615564633908, 'batch_size': 606, 'optimizer': 'Adam'}. Best is trial 141 with value: 0.14724858652379075.
2026-05-15 17:45:11,343 - experiment_functions - INFO - Early stopping at epoch 1700. Best Recall: 0.1395
2026-05-15 17:45:11,459 - optuna.study.study - INFO - Trial 162 finished with value: 0.13953398059580835 and parameters: {'n_layers': 1, 'embedding_dim': 128, 'lr': 0.0009003868058851056, 'lambda_val': 0.0002650843565826771, 'batch_size': 620, 'optimizer': 'Adam'}. Best is trial 141 with value: 0.14724858652379075.
2026-05-15 17:45:20,041 - optuna.study._optimize - INFO - Trial 163 pruned. 
2026-05-15 17:45:27,486 - experiment_functions - INFO - Early stopping at epoch 1100. Best Recall: 0.1373
2026-05-15 17:45:27,617 - optuna.study.study - INFO - Trial 164 finished with value: 0.13733890096102108 and parameters: {'n_layers': 1, 'embedding_dim': 128, 'lr': 0.0013075029544828498, 'lambda_val': 0.00033517116218966035, 'batch_size': 574, 'optimizer': 'Adam'}. Best is trial 141 with value: 0.14724858652379075.
2026-05-15 17:45:40,865 - experiment_functions - INFO - Early stopping at epoch 950. Best Recall: 0.1153
2026-05-15 17:45:41,394 - optuna.study.study - INFO - Trial 165 finished with value: 0.11528411588712997 and parameters: {'n_layers': 1, 'embedding_dim': 128, 'lr': 0.0018571227317501645, 'lambda_val': 0.0002737860112787791, 'batch_size': 607, 'optimizer': 'Adam'}. Best is trial 141 with value: 0.14724858652379075.
2026-05-15 17:45:48,883 - experiment_functions - INFO - Early stopping at epoch 850. Best Recall: 0.0433
2026-05-15 17:45:49,033 - optuna.study.study - INFO - Trial 166 finished with value: 0.043282752486492895 and parameters: {'n_layers': 1, 'embedding_dim': 128, 'lr': 0.0007808792996604496, 'lambda_val': 0.05948337514607836, 'batch_size': 587, 'optimizer': 'Adam'}. Best is trial 141 with value: 0.14724858652379075.
2026-05-15 17:45:56,079 - experiment_functions - INFO - Early stopping at epoch 900. Best Recall: 0.1281
2026-05-15 17:45:56,195 - optuna.study.study - INFO - Trial 167 finished with value: 0.12810742496020866 and parameters: {'n_layers': 1, 'embedding_dim': 256, 'lr': 0.001180460269855313, 'lambda_val': 0.00019412011799814594, 'batch_size': 1407, 'optimizer': 'Adam'}. Best is trial 141 with value: 0.14724858652379075.
2026-05-15 17:46:03,191 - optuna.study._optimize - INFO - Trial 168 pruned. 
2026-05-15 17:46:11,515 - optuna.study._optimize - INFO - Trial 169 pruned. 
2026-05-15 17:46:17,529 - experiment_functions - INFO - Early stopping at epoch 850. Best Recall: 0.0985
2026-05-15 17:46:17,650 - optuna.study.study - INFO - Trial 170 finished with value: 0.09846302082448494 and parameters: {'n_layers': 1, 'embedding_dim': 64, 'lr': 0.0023056976408219834, 'lambda_val': 0.0005063057564886695, 'batch_size': 789, 'optimizer': 'Adam'}. Best is trial 141 with value: 0.14724858652379075.
2026-05-15 17:46:21,287 - experiment_functions - INFO - Early stopping at epoch 500. Best Recall: 0.0017
2026-05-15 17:46:21,413 - optuna.study.study - INFO - Trial 171 finished with value: 0.0016538707203597016 and parameters: {'n_layers': 1, 'embedding_dim': 128, 'lr': 2.120961904213394e-05, 'lambda_val': 0.00033367146547909587, 'batch_size': 639, 'optimizer': 'Adam'}. Best is trial 141 with value: 0.14724858652379075.
2026-05-15 17:46:27,941 - optuna.study._optimize - INFO - Trial 172 pruned. 
2026-05-15 17:46:41,320 - experiment_functions - INFO - Early stopping at epoch 2100. Best Recall: 0.1424
2026-05-15 17:46:41,444 - optuna.study.study - INFO - Trial 173 finished with value: 0.1424468235630358 and parameters: {'n_layers': 1, 'embedding_dim': 128, 'lr': 0.0007374103993342436, 'lambda_val': 0.0002515445124079724, 'batch_size': 598, 'optimizer': 'Adam'}. Best is trial 141 with value: 0.14724858652379075.
2026-05-15 17:47:00,534 - experiment_functions - INFO - Early stopping at epoch 3250. Best Recall: 0.1488
2026-05-15 17:47:00,721 - optuna.study.study - INFO - Trial 174 finished with value: 0.14884231923741173 and parameters: {'n_layers': 1, 'embedding_dim': 128, 'lr': 0.0007214418572699334, 'lambda_val': 0.0002477717619671481, 'batch_size': 581, 'optimizer': 'Adam'}. Best is trial 174 with value: 0.14884231923741173.
2026-05-15 17:47:07,436 - optuna.study._optimize - INFO - Trial 175 pruned. 
2026-05-15 17:47:14,236 - optuna.study._optimize - INFO - Trial 176 pruned. 
2026-05-15 17:47:24,917 - experiment_functions - INFO - Early stopping at epoch 1650. Best Recall: 0.1379
2026-05-15 17:47:25,075 - optuna.study.study - INFO - Trial 177 finished with value: 0.1379085578481521 and parameters: {'n_layers': 1, 'embedding_dim': 128, 'lr': 0.0009868729840296084, 'lambda_val': 8.06555905866405e-05, 'batch_size': 734, 'optimizer': 'Adam'}. Best is trial 174 with value: 0.14884231923741173.
2026-05-15 17:47:32,656 - optuna.study._optimize - INFO - Trial 178 pruned. 
2026-05-15 17:47:40,005 - optuna.study._optimize - INFO - Trial 179 pruned. 
2026-05-15 17:47:45,483 - experiment_functions - INFO - Early stopping at epoch 850. Best Recall: 0.1148
2026-05-15 17:47:45,619 - optuna.study.study - INFO - Trial 180 finished with value: 0.11481899843224973 and parameters: {'n_layers': 1, 'embedding_dim': 128, 'lr': 0.0013387761252269372, 'lambda_val': 0.0001564668476513083, 'batch_size': 752, 'optimizer': 'Adam'}. Best is trial 174 with value: 0.14884231923741173.
2026-05-15 17:47:52,460 - optuna.study._optimize - INFO - Trial 181 pruned. 
2026-05-15 17:48:01,161 - experiment_functions - INFO - Early stopping at epoch 1250. Best Recall: 0.1334
2026-05-15 17:48:01,309 - optuna.study.study - INFO - Trial 182 finished with value: 0.13336526104823082 and parameters: {'n_layers': 1, 'embedding_dim': 128, 'lr': 0.0009424278128798473, 'lambda_val': 4.833503275896353e-05, 'batch_size': 578, 'optimizer': 'Adam'}. Best is trial 174 with value: 0.14884231923741173.
2026-05-15 17:48:17,750 - experiment_functions - INFO - Early stopping at epoch 2700. Best Recall: 0.1449
2026-05-15 17:48:17,872 - optuna.study.study - INFO - Trial 183 finished with value: 0.14494431564833427 and parameters: {'n_layers': 1, 'embedding_dim': 128, 'lr': 0.0006625980850203622, 'lambda_val': 6.419978092499134e-05, 'batch_size': 699, 'optimizer': 'Adam'}. Best is trial 174 with value: 0.14884231923741173.
2026-05-15 17:48:27,378 - optuna.study._optimize - INFO - Trial 184 pruned. 
2026-05-15 17:48:34,924 - optuna.study._optimize - INFO - Trial 185 pruned. 
2026-05-15 17:48:41,721 - experiment_functions - INFO - Early stopping at epoch 1200. Best Recall: 0.1339
2026-05-15 17:48:41,844 - optuna.study.study - INFO - Trial 186 finished with value: 0.1339230901912925 and parameters: {'n_layers': 1, 'embedding_dim': 128, 'lr': 0.001191520097935573, 'lambda_val': 0.00012778735109159596, 'batch_size': 709, 'optimizer': 'Adam'}. Best is trial 174 with value: 0.14884231923741173.
2026-05-15 17:48:47,939 - optuna.study._optimize - INFO - Trial 187 pruned. 
2026-05-15 17:48:55,109 - optuna.study._optimize - INFO - Trial 188 pruned. 
2026-05-15 17:49:01,843 - optuna.study._optimize - INFO - Trial 189 pruned. 
2026-05-15 17:49:08,422 - optuna.study._optimize - INFO - Trial 190 pruned. 
2026-05-15 17:49:15,466 - optuna.study._optimize - INFO - Trial 191 pruned. 
2026-05-15 17:49:22,320 - optuna.study._optimize - INFO - Trial 192 pruned. 
2026-05-15 17:49:29,396 - optuna.study._optimize - INFO - Trial 193 pruned. 
2026-05-15 17:49:35,666 - optuna.study._optimize - INFO - Trial 194 pruned. 
2026-05-15 17:49:40,760 - experiment_functions - INFO - Early stopping at epoch 900. Best Recall: 0.1294
2026-05-15 17:49:40,853 - optuna.study.study - INFO - Trial 195 finished with value: 0.12941090168214267 and parameters: {'n_layers': 1, 'embedding_dim': 128, 'lr': 0.0009761643349398841, 'lambda_val': 5.550309851564407e-05, 'batch_size': 2600, 'optimizer': 'Adam'}. Best is trial 174 with value: 0.14884231923741173.
2026-05-15 17:49:47,131 - experiment_functions - INFO - Early stopping at epoch 1050. Best Recall: 0.1253
2026-05-15 17:49:47,256 - optuna.study.study - INFO - Trial 196 finished with value: 0.12531462182475292 and parameters: {'n_layers': 1, 'embedding_dim': 128, 'lr': 0.0007375585229145416, 'lambda_val': 0.0001333652347341409, 'batch_size': 2476, 'optimizer': 'Adam'}. Best is trial 174 with value: 0.14884231923741173.
2026-05-15 17:49:50,723 - experiment_functions - INFO - Early stopping at epoch 500. Best Recall: 0.0022
2026-05-15 17:49:50,850 - optuna.study.study - INFO - Trial 197 finished with value: 0.0022312209162478106 and parameters: {'n_layers': 1, 'embedding_dim': 128, 'lr': 0.0011907947210686698, 'lambda_val': 1.2573044522209925e-05, 'batch_size': 512, 'optimizer': 'SGD'}. Best is trial 174 with value: 0.14884231923741173.
2026-05-15 17:49:58,381 - experiment_functions - INFO - Early stopping at epoch 1300. Best Recall: 0.1315
2026-05-15 17:49:58,507 - optuna.study.study - INFO - Trial 198 finished with value: 0.13151794342669126 and parameters: {'n_layers': 1, 'embedding_dim': 128, 'lr': 0.0008300789927375894, 'lambda_val': 4.495646531056793e-05, 'batch_size': 1111, 'optimizer': 'Adam'}. Best is trial 174 with value: 0.14884231923741173.
2026-05-15 17:50:06,537 - optuna.study._optimize - INFO - Trial 199 pruned. 
2026-05-15 17:50:11,239 - experiment_functions - INFO - Early stopping at epoch 600. Best Recall: 0.1038
2026-05-15 17:50:11,350 - optuna.study.study - INFO - Trial 200 finished with value: 0.10375405800682783 and parameters: {'n_layers': 1, 'embedding_dim': 256, 'lr': 0.0014308583338145484, 'lambda_val': 2.2452032526251774e-05, 'batch_size': 2210, 'optimizer': 'RMSprop'}. Best is trial 174 with value: 0.14884231923741173.
2026-05-15 17:50:17,600 - experiment_functions - INFO - Early stopping at epoch 2050. Best Recall: 0.1351
