2026-05-15 17:25:17,250 - root - INFO - **** Training e_100K_full
2026-05-15 17:25:17,275 - helper_functions - INFO - Users: 610, Items: 9742
2026-05-15 17:25:17,402 - helper_functions - INFO - Edge index: torch.Size([2, 81763])
2026-05-15 17:25:17,402 - root - INFO - **** Generating the graph:
2026-05-15 17:25:17,468 - helper_functions - INFO - Number of unique users: 609
2026-05-15 17:25:17,469 - helper_functions - INFO - Number of unique items: 8452
2026-05-15 17:25:17,469 - helper_functions - INFO - Number of nodes: 9061
2026-05-15 17:25:17,470 - helper_functions - INFO - Number of edges: 81763
2026-05-15 17:25:17,875 - optuna.study.study - INFO - Using an existing study with name 'Study_e_100K_full' instead of creating a new one.
2026-05-15 17:25:22,054 - experiment_functions - INFO - Early stopping at epoch 500. Best Recall: 0.0013
2026-05-15 17:25:22,160 - optuna.study.study - INFO - Trial 1 finished with value: 0.0012866368784303242 and parameters: {'n_layers': 4, 'embedding_dim': 64, 'lr': 3.043250503099227e-05, 'lambda_val': 0.0010811336010138248, 'batch_size': 2168, 'optimizer': 'SGD'}. Best is trial 1 with value: 0.0012866368784303242.
2026-05-15 17:25:25,407 - experiment_functions - INFO - Early stopping at epoch 500. Best Recall: 0.0010
2026-05-15 17:25:25,521 - optuna.study.study - INFO - Trial 2 finished with value: 0.0010030972654000258 and parameters: {'n_layers': 1, 'embedding_dim': 96, 'lr': 0.0007144690809777321, 'lambda_val': 0.0049317249208122175, 'batch_size': 1857, 'optimizer': 'SGD'}. Best is trial 1 with value: 0.0012866368784303242.
2026-05-15 17:25:30,487 - experiment_functions - INFO - Early stopping at epoch 500. Best Recall: 0.0022
2026-05-15 17:25:30,591 - optuna.study.study - INFO - Trial 3 finished with value: 0.0022064883145033187 and parameters: {'n_layers': 4, 'embedding_dim': 256, 'lr': 0.018021995760864547, 'lambda_val': 0.086918532528962, 'batch_size': 1440, 'optimizer': 'SGD'}. Best is trial 3 with value: 0.0022064883145033187.
2026-05-15 17:26:01,957 - optuna.study.study - INFO - Trial 4 finished with value: 0.03443596496435671 and parameters: {'n_layers': 3, 'embedding_dim': 256, 'lr': 6.318031328273199e-05, 'lambda_val': 0.006263336477502432, 'batch_size': 2226, 'optimizer': 'Adam'}. Best is trial 4 with value: 0.03443596496435671.
2026-05-15 17:26:13,982 - experiment_functions - INFO - Early stopping at epoch 500. Best Recall: 0.0037
2026-05-15 17:26:14,291 - optuna.study.study - INFO - Trial 5 finished with value: 0.003670977448572631 and parameters: {'n_layers': 2, 'embedding_dim': 256, 'lr': 0.00010226164003386612, 'lambda_val': 0.00029124342807865803, 'batch_size': 3695, 'optimizer': 'SGD'}. Best is trial 4 with value: 0.03443596496435671.
2026-05-15 17:26:18,465 - experiment_functions - INFO - Early stopping at epoch 500. Best Recall: 0.0016
2026-05-15 17:26:18,567 - optuna.study.study - INFO - Trial 6 finished with value: 0.0015527014291584506 and parameters: {'n_layers': 2, 'embedding_dim': 32, 'lr': 0.0004086138774142009, 'lambda_val': 1.4697541422352797e-06, 'batch_size': 869, 'optimizer': 'SGD'}. Best is trial 4 with value: 0.03443596496435671.
2026-05-15 17:26:25,893 - optuna.study._optimize - INFO - Trial 7 pruned. 
2026-05-15 17:26:32,100 - experiment_functions - INFO - Early stopping at epoch 900. Best Recall: 0.0349
2026-05-15 17:26:32,650 - optuna.study.study - INFO - Trial 8 finished with value: 0.03489745015631411 and parameters: {'n_layers': 2, 'embedding_dim': 96, 'lr': 0.050334326526697594, 'lambda_val': 3.414819800385652e-05, 'batch_size': 3485, 'optimizer': 'Adam'}. Best is trial 8 with value: 0.03489745015631411.
2026-05-15 17:26:42,206 - experiment_functions - INFO - Early stopping at epoch 1050. Best Recall: 0.0199
2026-05-15 17:26:42,324 - optuna.study.study - INFO - Trial 9 finished with value: 0.019884963720032033 and parameters: {'n_layers': 4, 'embedding_dim': 256, 'lr': 0.00024588617314771265, 'lambda_val': 0.0003619951427952594, 'batch_size': 3823, 'optimizer': 'Adam'}. Best is trial 8 with value: 0.03489745015631411.
2026-05-15 17:26:49,299 - optuna.study._optimize - INFO - Trial 10 pruned. 
2026-05-15 17:26:54,246 - experiment_functions - INFO - Early stopping at epoch 650. Best Recall: 0.0715
2026-05-15 17:26:54,357 - optuna.study.study - INFO - Trial 11 finished with value: 0.07146532546027441 and parameters: {'n_layers': 1, 'embedding_dim': 128, 'lr': 0.003946431775513915, 'lambda_val': 1.0340139977910953e-05, 'batch_size': 3043, 'optimizer': 'RMSprop'}. Best is trial 11 with value: 0.07146532546027441.
2026-05-15 17:26:58,859 - experiment_functions - INFO - Early stopping at epoch 650. Best Recall: 0.0159
2026-05-15 17:26:58,969 - optuna.study.study - INFO - Trial 12 finished with value: 0.01590488576438225 and parameters: {'n_layers': 1, 'embedding_dim': 128, 'lr': 0.097905199984571, 'lambda_val': 8.422596019607768e-06, 'batch_size': 3077, 'optimizer': 'RMSprop'}. Best is trial 11 with value: 0.07146532546027441.
2026-05-15 17:27:02,949 - experiment_functions - INFO - Early stopping at epoch 550. Best Recall: 0.0671
2026-05-15 17:27:03,040 - optuna.study.study - INFO - Trial 13 finished with value: 0.06707541921318388 and parameters: {'n_layers': 1, 'embedding_dim': 128, 'lr': 0.0052580993749905235, 'lambda_val': 1.8607366808893813e-05, 'batch_size': 3009, 'optimizer': 'RMSprop'}. Best is trial 11 with value: 0.07146532546027441.
2026-05-15 17:27:06,782 - experiment_functions - INFO - Early stopping at epoch 550. Best Recall: 0.0670
2026-05-15 17:27:06,895 - optuna.study.study - INFO - Trial 14 finished with value: 0.06704468959636965 and parameters: {'n_layers': 1, 'embedding_dim': 128, 'lr': 0.004581421437411382, 'lambda_val': 2.2746232625443436e-05, 'batch_size': 2824, 'optimizer': 'RMSprop'}. Best is trial 11 with value: 0.07146532546027441.
2026-05-15 17:27:11,068 - experiment_functions - INFO - Early stopping at epoch 550. Best Recall: 0.0804
2026-05-15 17:27:11,171 - optuna.study.study - INFO - Trial 15 finished with value: 0.08041065839092165 and parameters: {'n_layers': 1, 'embedding_dim': 128, 'lr': 0.0024463688377014087, 'lambda_val': 1.0611750854794048e-06, 'batch_size': 2639, 'optimizer': 'RMSprop'}. Best is trial 15 with value: 0.08041065839092165.
2026-05-15 17:27:16,554 - experiment_functions - INFO - Early stopping at epoch 650. Best Recall: 0.0365
2026-05-15 17:27:16,654 - optuna.study.study - INFO - Trial 16 finished with value: 0.036454362721198265 and parameters: {'n_layers': 3, 'embedding_dim': 128, 'lr': 0.0019636521684990595, 'lambda_val': 1.0879028150867357e-06, 'batch_size': 2521, 'optimizer': 'RMSprop'}. Best is trial 15 with value: 0.08041065839092165.
2026-05-15 17:27:20,888 - experiment_functions - INFO - Early stopping at epoch 600. Best Recall: 0.0787
2026-05-15 17:27:21,010 - optuna.study.study - INFO - Trial 17 finished with value: 0.07867595602599049 and parameters: {'n_layers': 1, 'embedding_dim': 128, 'lr': 0.002582548617271981, 'lambda_val': 4.33589577116349e-06, 'batch_size': 3341, 'optimizer': 'RMSprop'}. Best is trial 15 with value: 0.08041065839092165.
2026-05-15 17:27:25,597 - experiment_functions - INFO - Early stopping at epoch 650. Best Recall: 0.0871
2026-05-15 17:27:25,718 - optuna.study.study - INFO - Trial 18 finished with value: 0.08707153525237964 and parameters: {'n_layers': 1, 'embedding_dim': 64, 'lr': 0.0017843506726405872, 'lambda_val': 3.4847747761879427e-06, 'batch_size': 4075, 'optimizer': 'RMSprop'}. Best is trial 18 with value: 0.08707153525237964.
2026-05-15 17:27:31,304 - experiment_functions - INFO - Early stopping at epoch 750. Best Recall: 0.0007
2026-05-15 17:27:31,405 - optuna.study.study - INFO - Trial 19 finished with value: 0.0006965799136229256 and parameters: {'n_layers': 3, 'embedding_dim': 64, 'lr': 1.1772922903963033e-05, 'lambda_val': 7.412352983540006e-05, 'batch_size': 3996, 'optimizer': 'RMSprop'}. Best is trial 18 with value: 0.08707153525237964.
2026-05-15 17:27:35,280 - experiment_functions - INFO - Early stopping at epoch 550. Best Recall: 0.0528
2026-05-15 17:27:35,393 - optuna.study.study - INFO - Trial 20 finished with value: 0.052773027051261315 and parameters: {'n_layers': 2, 'embedding_dim': 64, 'lr': 0.0010982334391798564, 'lambda_val': 2.6425870944634993e-06, 'batch_size': 4061, 'optimizer': 'RMSprop'}. Best is trial 18 with value: 0.08707153525237964.
2026-05-15 17:27:41,979 - experiment_functions - INFO - Early stopping at epoch 1150. Best Recall: 0.0510
2026-05-15 17:27:42,090 - optuna.study.study - INFO - Trial 21 finished with value: 0.05096960069179723 and parameters: {'n_layers': 1, 'embedding_dim': 64, 'lr': 0.013763340895386686, 'lambda_val': 8.832843067816505e-05, 'batch_size': 583, 'optimizer': 'RMSprop'}. Best is trial 18 with value: 0.08707153525237964.
2026-05-15 17:27:46,956 - experiment_functions - INFO - Early stopping at epoch 650. Best Recall: 0.0964
2026-05-15 17:27:47,067 - optuna.study.study - INFO - Trial 22 finished with value: 0.09637181124695715 and parameters: {'n_layers': 1, 'embedding_dim': 128, 'lr': 0.0013605413458234613, 'lambda_val': 4.170599071543723e-06, 'batch_size': 3403, 'optimizer': 'RMSprop'}. Best is trial 22 with value: 0.09637181124695715.
2026-05-15 17:27:52,188 - experiment_functions - INFO - Early stopping at epoch 700. Best Recall: 0.1013
2026-05-15 17:27:52,308 - optuna.study.study - INFO - Trial 23 finished with value: 0.10134515977573055 and parameters: {'n_layers': 1, 'embedding_dim': 128, 'lr': 0.001180540780002195, 'lambda_val': 3.74433980320663e-06, 'batch_size': 3377, 'optimizer': 'RMSprop'}. Best is trial 23 with value: 0.10134515977573055.
2026-05-15 17:27:57,782 - experiment_functions - INFO - Early stopping at epoch 800. Best Recall: 0.0680
2026-05-15 17:27:57,884 - optuna.study.study - INFO - Trial 24 finished with value: 0.06795010536003218 and parameters: {'n_layers': 2, 'embedding_dim': 64, 'lr': 0.0008161866338026512, 'lambda_val': 3.977663286799041e-06, 'batch_size': 3536, 'optimizer': 'RMSprop'}. Best is trial 23 with value: 0.10134515977573055.
2026-05-15 17:28:21,530 - optuna.study.study - INFO - Trial 25 finished with value: 0.09535926417483098 and parameters: {'n_layers': 1, 'embedding_dim': 128, 'lr': 0.00015336519365961743, 'lambda_val': 7.560427252571401e-06, 'batch_size': 3371, 'optimizer': 'RMSprop'}. Best is trial 23 with value: 0.10134515977573055.
2026-05-15 17:28:28,123 - optuna.study._optimize - INFO - Trial 26 pruned. 
2026-05-15 17:28:41,713 - experiment_functions - INFO - Early stopping at epoch 2150. Best Recall: 0.0692
2026-05-15 17:28:41,825 - optuna.study.study - INFO - Trial 27 finished with value: 0.06919597099360095 and parameters: {'n_layers': 2, 'embedding_dim': 128, 'lr': 0.00019631329876287367, 'lambda_val': 9.973398816634275e-05, 'batch_size': 3684, 'optimizer': 'RMSprop'}. Best is trial 23 with value: 0.10134515977573055.
2026-05-15 17:28:50,356 - experiment_functions - INFO - Early stopping at epoch 1350. Best Recall: 0.1363
2026-05-15 17:28:50,515 - optuna.study.study - INFO - Trial 28 finished with value: 0.1363001411639181 and parameters: {'n_layers': 1, 'embedding_dim': 128, 'lr': 0.0005185293441638619, 'lambda_val': 4.702239181996941e-05, 'batch_size': 2572, 'optimizer': 'RMSprop'}. Best is trial 28 with value: 0.1363001411639181.
2026-05-15 17:28:55,842 - experiment_functions - INFO - Early stopping at epoch 750. Best Recall: 0.0690
2026-05-15 17:28:55,948 - optuna.study.study - INFO - Trial 29 finished with value: 0.06903087500171994 and parameters: {'n_layers': 2, 'embedding_dim': 128, 'lr': 0.0005372467806044973, 'lambda_val': 4.617035188336321e-05, 'batch_size': 2534, 'optimizer': 'RMSprop'}. Best is trial 28 with value: 0.1363001411639181.
2026-05-15 17:29:01,245 - experiment_functions - INFO - Early stopping at epoch 900. Best Recall: 0.0840
2026-05-15 17:29:01,357 - optuna.study.study - INFO - Trial 30 finished with value: 0.08403077096358269 and parameters: {'n_layers': 1, 'embedding_dim': 32, 'lr': 0.0011632547088043152, 'lambda_val': 0.00018841538448996365, 'batch_size': 1939, 'optimizer': 'RMSprop'}. Best is trial 28 with value: 0.1363001411639181.
2026-05-15 17:29:05,793 - experiment_functions - INFO - Early stopping at epoch 500. Best Recall: 0.0033
2026-05-15 17:29:05,895 - optuna.study.study - INFO - Trial 31 finished with value: 0.0032578983468518384 and parameters: {'n_layers': 3, 'embedding_dim': 128, 'lr': 0.007177250999068382, 'lambda_val': 1.5315753955423323e-05, 'batch_size': 2013, 'optimizer': 'SGD'}. Best is trial 28 with value: 0.1363001411639181.
2026-05-15 17:29:11,961 - optuna.study._optimize - INFO - Trial 32 pruned. 
2026-05-15 17:29:18,242 - optuna.study._optimize - INFO - Trial 33 pruned. 
2026-05-15 17:29:23,700 - experiment_functions - INFO - Early stopping at epoch 800. Best Recall: 0.1060
2026-05-15 17:29:23,800 - optuna.study.study - INFO - Trial 34 finished with value: 0.10595334590067422 and parameters: {'n_layers': 1, 'embedding_dim': 128, 'lr': 0.0006918310908696423, 'lambda_val': 0.001460595673847304, 'batch_size': 2792, 'optimizer': 'RMSprop'}. Best is trial 28 with value: 0.1363001411639181.
2026-05-15 17:29:31,551 - experiment_functions - INFO - Early stopping at epoch 1300. Best Recall: 0.1103
2026-05-15 17:29:31,719 - optuna.study.study - INFO - Trial 35 finished with value: 0.1102522160120288 and parameters: {'n_layers': 1, 'embedding_dim': 96, 'lr': 0.0005257972144244275, 'lambda_val': 0.0014047701590218934, 'batch_size': 2749, 'optimizer': 'RMSprop'}. Best is trial 28 with value: 0.1363001411639181.
2026-05-15 17:29:35,263 - experiment_functions - INFO - Early stopping at epoch 500. Best Recall: 0.0006
2026-05-15 17:29:35,377 - optuna.study.study - INFO - Trial 36 finished with value: 0.0006381670821802592 and parameters: {'n_layers': 1, 'embedding_dim': 96, 'lr': 0.0006107989133863412, 'lambda_val': 0.0012873529028115123, 'batch_size': 2339, 'optimizer': 'SGD'}. Best is trial 28 with value: 0.1363001411639181.
2026-05-15 17:29:42,925 - optuna.study._optimize - INFO - Trial 37 pruned. 
2026-05-15 17:29:46,301 - experiment_functions - INFO - Early stopping at epoch 500. Best Recall: 0.0030
2026-05-15 17:29:46,392 - optuna.study.study - INFO - Trial 38 finished with value: 0.003001341295537222 and parameters: {'n_layers': 1, 'embedding_dim': 96, 'lr': 7.141929056949646e-05, 'lambda_val': 0.0021254485140900733, 'batch_size': 2220, 'optimizer': 'SGD'}. Best is trial 28 with value: 0.1363001411639181.
2026-05-15 17:29:52,535 - experiment_functions - INFO - Early stopping at epoch 750. Best Recall: 0.0415
2026-05-15 17:29:52,634 - optuna.study.study - INFO - Trial 39 finished with value: 0.041518112673781256 and parameters: {'n_layers': 2, 'embedding_dim': 256, 'lr': 0.000454094148555657, 'lambda_val': 0.0135731323398372, 'batch_size': 2399, 'optimizer': 'Adam'}. Best is trial 28 with value: 0.1363001411639181.
2026-05-15 17:29:59,338 - experiment_functions - INFO - Early stopping at epoch 1050. Best Recall: 0.1032
2026-05-15 17:29:59,484 - optuna.study.study - INFO - Trial 40 finished with value: 0.10319690128000633 and parameters: {'n_layers': 1, 'embedding_dim': 96, 'lr': 0.0009000873457418432, 'lambda_val': 0.0005958120664814785, 'batch_size': 1767, 'optimizer': 'RMSprop'}. Best is trial 28 with value: 0.1363001411639181.
2026-05-15 17:30:02,782 - experiment_functions - INFO - Early stopping at epoch 500. Best Recall: 0.0019
2026-05-15 17:30:02,880 - optuna.study.study - INFO - Trial 41 finished with value: 0.0019242705973478139 and parameters: {'n_layers': 1, 'embedding_dim': 96, 'lr': 0.0006783042510449474, 'lambda_val': 0.0005322627926020709, 'batch_size': 1724, 'optimizer': 'SGD'}. Best is trial 28 with value: 0.1363001411639181.
2026-05-15 17:30:07,401 - experiment_functions - INFO - Early stopping at epoch 700. Best Recall: 0.1121
2026-05-15 17:30:07,512 - optuna.study.study - INFO - Trial 42 finished with value: 0.11207611408259899 and parameters: {'n_layers': 1, 'embedding_dim': 96, 'lr': 0.0010814892626648664, 'lambda_val': 0.0026719839727450123, 'batch_size': 1735, 'optimizer': 'RMSprop'}. Best is trial 28 with value: 0.1363001411639181.
2026-05-15 17:30:19,163 - experiment_functions - INFO - Early stopping at epoch 1900. Best Recall: 0.0967
2026-05-15 17:30:19,327 - optuna.study.study - INFO - Trial 43 finished with value: 0.09670857609074011 and parameters: {'n_layers': 1, 'embedding_dim': 96, 'lr': 0.0004033046555391241, 'lambda_val': 0.003054715182056192, 'batch_size': 1650, 'optimizer': 'RMSprop'}. Best is trial 28 with value: 0.1363001411639181.
2026-05-15 17:30:25,634 - optuna.study._optimize - INFO - Trial 44 pruned. 
2026-05-15 17:30:30,956 - experiment_functions - INFO - Early stopping at epoch 700. Best Recall: 0.0079
2026-05-15 17:30:31,057 - optuna.study.study - INFO - Trial 45 finished with value: 0.00790241241824763 and parameters: {'n_layers': 4, 'embedding_dim': 96, 'lr': 0.0008077525300582591, 'lambda_val': 0.030375830498658947, 'batch_size': 1198, 'optimizer': 'RMSprop'}. Best is trial 28 with value: 0.1363001411639181.
2026-05-15 17:30:35,555 - experiment_functions - INFO - Early stopping at epoch 550. Best Recall: 0.0594
2026-05-15 17:30:35,665 - optuna.study.study - INFO - Trial 46 finished with value: 0.05942136113912401 and parameters: {'n_layers': 1, 'embedding_dim': 96, 'lr': 0.003310140316059861, 'lambda_val': 0.0028245329580258473, 'batch_size': 2054, 'optimizer': 'RMSprop'}. Best is trial 28 with value: 0.1363001411639181.
2026-05-15 17:30:40,570 - experiment_functions - INFO - Early stopping at epoch 750. Best Recall: 0.0808
2026-05-15 17:30:40,683 - optuna.study.study - INFO - Trial 47 finished with value: 0.0808034982017293 and parameters: {'n_layers': 1, 'embedding_dim': 32, 'lr': 0.0016082995669145837, 'lambda_val': 0.0008526694575516045, 'batch_size': 1106, 'optimizer': 'RMSprop'}. Best is trial 28 with value: 0.1363001411639181.
2026-05-15 17:30:47,518 - optuna.study._optimize - INFO - Trial 48 pruned. 
2026-05-15 17:30:54,928 - optuna.study._optimize - INFO - Trial 49 pruned. 
2026-05-15 17:30:58,812 - experiment_functions - INFO - Early stopping at epoch 550. Best Recall: 0.0498
2026-05-15 17:30:58,969 - optuna.study.study - INFO - Trial 50 finished with value: 0.04980358665413563 and parameters: {'n_layers': 1, 'embedding_dim': 96, 'lr': 0.006620898060143443, 'lambda_val': 0.0015641708585305834, 'batch_size': 2107, 'optimizer': 'RMSprop'}. Best is trial 28 with value: 0.1363001411639181.
2026-05-15 17:31:04,358 - experiment_functions - INFO - Early stopping at epoch 800. Best Recall: 0.0586
2026-05-15 17:31:04,520 - optuna.study.study - INFO - Trial 51 finished with value: 0.058649659558867404 and parameters: {'n_layers': 2, 'embedding_dim': 96, 'lr': 0.0004966945728469322, 'lambda_val': 0.005121821706495309, 'batch_size': 2455, 'optimizer': 'RMSprop'}. Best is trial 28 with value: 0.1363001411639181.
2026-05-15 17:31:10,128 - experiment_functions - INFO - Early stopping at epoch 800. Best Recall: 0.0991
2026-05-15 17:31:10,217 - optuna.study.study - INFO - Trial 52 finished with value: 0.09911555242184489 and parameters: {'n_layers': 1, 'embedding_dim': 32, 'lr': 0.000985252957564486, 'lambda_val': 0.003450148416168086, 'batch_size': 2668, 'optimizer': 'RMSprop'}. Best is trial 28 with value: 0.1363001411639181.
2026-05-15 17:31:14,361 - experiment_functions - INFO - Early stopping at epoch 600. Best Recall: 0.0978
2026-05-15 17:31:14,506 - optuna.study.study - INFO - Trial 53 finished with value: 0.09777530006145976 and parameters: {'n_layers': 1, 'embedding_dim': 96, 'lr': 0.0025861725501616865, 'lambda_val': 0.00057287154378918, 'batch_size': 2904, 'optimizer': 'RMSprop'}. Best is trial 28 with value: 0.1363001411639181.
2026-05-15 17:31:18,900 - experiment_functions - INFO - Early stopping at epoch 650. Best Recall: 0.1233
2026-05-15 17:31:19,010 - optuna.study.study - INFO - Trial 54 finished with value: 0.12329264150635416 and parameters: {'n_layers': 1, 'embedding_dim': 128, 'lr': 0.0013658016216160607, 'lambda_val': 0.0001554448659794083, 'batch_size': 3117, 'optimizer': 'RMSprop'}. Best is trial 28 with value: 0.1363001411639181.
2026-05-15 17:31:23,278 - experiment_functions - INFO - Early stopping at epoch 550. Best Recall: 0.0927
2026-05-15 17:31:23,367 - optuna.study.study - INFO - Trial 55 finished with value: 0.09273316484830248 and parameters: {'n_layers': 1, 'embedding_dim': 256, 'lr': 0.002012999096900629, 'lambda_val': 0.00012748739715896982, 'batch_size': 3135, 'optimizer': 'RMSprop'}. Best is trial 28 with value: 0.1363001411639181.
2026-05-15 17:31:29,775 - experiment_functions - INFO - Early stopping at epoch 950. Best Recall: 0.0919
2026-05-15 17:31:29,864 - optuna.study.study - INFO - Trial 56 finished with value: 0.09193002292764342 and parameters: {'n_layers': 1, 'embedding_dim': 96, 'lr': 0.0007401692205339991, 'lambda_val': 0.00015807319003952476, 'batch_size': 2248, 'optimizer': 'RMSprop'}. Best is trial 28 with value: 0.1363001411639181.
2026-05-15 17:31:34,788 - experiment_functions - INFO - Early stopping at epoch 750. Best Recall: 0.1105
2026-05-15 17:31:34,889 - optuna.study.study - INFO - Trial 57 finished with value: 0.11053135754731462 and parameters: {'n_layers': 1, 'embedding_dim': 128, 'lr': 0.0014174521278272297, 'lambda_val': 5.373895907108901e-05, 'batch_size': 1351, 'optimizer': 'RMSprop'}. Best is trial 28 with value: 0.1363001411639181.
2026-05-15 17:31:38,920 - experiment_functions - INFO - Early stopping at epoch 600. Best Recall: 0.1124
2026-05-15 17:31:39,041 - optuna.study.study - INFO - Trial 58 finished with value: 0.11235257565072103 and parameters: {'n_layers': 1, 'embedding_dim': 128, 'lr': 0.0034481514480774102, 'lambda_val': 4.143870147805862e-05, 'batch_size': 815, 'optimizer': 'Adam'}. Best is trial 28 with value: 0.1363001411639181.
2026-05-15 17:31:44,179 - experiment_functions - INFO - Early stopping at epoch 700. Best Recall: 0.0990
