2026-06-13 22:32:42,529 - optuna.study.study - INFO - Trial 190 finished with values: [0.0005107098794556828, 7.703128139862013e-05, 0.00024353239105064992] and parameters: {'n_layers': 4, 'embedding_dim': 64, 'lr': 0.0009822401593291786, 'lambda_val': 3.354180877027492e-05, 'batch_size': 4095, 'optimizer': 'SGD'}.
2026-06-13 22:34:37,807 - experiment_functions - INFO - Early stopping at epoch 2750. Best Metrics: (0.0004113935395102035, 7.368209525085404e-05, 0.00019942211849174258)
2026-06-13 22:34:37,906 - optuna.study.study - INFO - Trial 191 finished with values: [0.0004113935395102035, 7.368209525085404e-05, 0.00019942211849174258] and parameters: {'n_layers': 3, 'embedding_dim': 128, 'lr': 5.5933167393578885e-05, 'lambda_val': 2.2173260300190405e-05, 'batch_size': 3306, 'optimizer': 'Adam'}.
2026-06-13 22:35:11,838 - experiment_functions - INFO - Early stopping at epoch 800. Best Metrics: (0.03979982363202087, 0.005618259762877622, 0.021126996388155482)
2026-06-13 22:35:12,076 - optuna.study.study - INFO - Trial 192 finished with values: [0.03979982363202087, 0.005618259762877622, 0.021126996388155482] and parameters: {'n_layers': 2, 'embedding_dim': 96, 'lr': 0.0016889361681909714, 'lambda_val': 0.00019652548319010554, 'batch_size': 3699, 'optimizer': 'RMSprop'}.
2026-06-13 22:35:36,249 - experiment_functions - INFO - Early stopping at epoch 550. Best Metrics: (0.008586540565316691, 0.0011270011387232905, 0.004442036172455519)
2026-06-13 22:35:36,320 - optuna.study.study - INFO - Trial 193 finished with values: [0.008586540565316691, 0.0011270011387232905, 0.004442036172455519] and parameters: {'n_layers': 3, 'embedding_dim': 96, 'lr': 0.050350823392089405, 'lambda_val': 0.00019652548319010554, 'batch_size': 1358, 'optimizer': 'RMSprop'}.
2026-06-13 22:36:17,837 - experiment_functions - INFO - Early stopping at epoch 1000. Best Metrics: (0.03780056388479472, 0.00516109585370755, 0.019401904503298345)
2026-06-13 22:36:18,234 - optuna.study.study - INFO - Trial 194 finished with values: [0.03780056388479472, 0.00516109585370755, 0.019401904503298345] and parameters: {'n_layers': 3, 'embedding_dim': 64, 'lr': 0.0016889361681909714, 'lambda_val': 0.0003920256863411047, 'batch_size': 3009, 'optimizer': 'RMSprop'}.
2026-06-13 22:36:56,531 - experiment_functions - INFO - Early stopping at epoch 850. Best Metrics: (0.039258321523020875, 0.0051259293991560055, 0.018894063054767467)
2026-06-13 22:36:56,625 - optuna.study.study - INFO - Trial 195 finished with values: [0.039258321523020875, 0.0051259293991560055, 0.018894063054767467] and parameters: {'n_layers': 4, 'embedding_dim': 96, 'lr': 0.0016889361681909714, 'lambda_val': 4.599419895012352e-06, 'batch_size': 3306, 'optimizer': 'RMSprop'}.
2026-06-13 22:39:13,475 - experiment_functions - INFO - Early stopping at epoch 3450. Best Metrics: (0.04504633248579994, 0.006244557572509879, 0.02375165619633006)
2026-06-13 22:39:13,568 - optuna.study.study - INFO - Trial 196 finished with values: [0.04504633248579994, 0.006244557572509879, 0.02375165619633006] and parameters: {'n_layers': 3, 'embedding_dim': 64, 'lr': 0.0006193224215073263, 'lambda_val': 0.00019652548319010554, 'batch_size': 4095, 'optimizer': 'Adam'}.
2026-06-13 22:40:05,093 - experiment_functions - INFO - Early stopping at epoch 1200. Best Metrics: (0.046242118229189985, 0.006412016879898185, 0.02427146933602583)
2026-06-13 22:40:05,170 - optuna.study.study - INFO - Trial 197 finished with values: [0.046242118229189985, 0.006412016879898185, 0.02427146933602583] and parameters: {'n_layers': 3, 'embedding_dim': 96, 'lr': 0.0009711234831697961, 'lambda_val': 0.0005195382127114068, 'batch_size': 2680, 'optimizer': 'RMSprop'}.
2026-06-13 22:40:48,404 - experiment_functions - INFO - Early stopping at epoch 1000. Best Metrics: (0.044092631653017, 0.00607374907897381, 0.02269318977138817)
2026-06-13 22:40:48,479 - optuna.study.study - INFO - Trial 198 finished with values: [0.044092631653017, 0.00607374907897381, 0.02269318977138817] and parameters: {'n_layers': 3, 'embedding_dim': 96, 'lr': 0.0016889361681909714, 'lambda_val': 0.00035318754870590177, 'batch_size': 1264, 'optimizer': 'RMSprop'}.
2026-06-13 22:41:23,276 - experiment_functions - INFO - Early stopping at epoch 700. Best Metrics: (0.03450254843171702, 0.004889811775738495, 0.018242701761056926)
2026-06-13 22:41:23,858 - optuna.study.study - INFO - Trial 199 finished with values: [0.03450254843171702, 0.004889811775738495, 0.018242701761056926] and parameters: {'n_layers': 2, 'embedding_dim': 256, 'lr': 0.0042802863633449924, 'lambda_val': 4.1509980625924543e-05, 'batch_size': 2830, 'optimizer': 'Adam'}.
2026-06-13 22:41:56,443 - experiment_functions - INFO - Early stopping at epoch 750. Best Metrics: (0.03921664864089007, 0.005274968182731596, 0.019976809100565623)
2026-06-13 22:41:56,521 - optuna.study.study - INFO - Trial 200 finished with values: [0.03921664864089007, 0.005274968182731596, 0.019976809100565623] and parameters: {'n_layers': 4, 'embedding_dim': 64, 'lr': 0.0027934085914899194, 'lambda_val': 4.1509980625924543e-05, 'batch_size': 3664, 'optimizer': 'Adam'}.
2026-06-13 22:42:20,134 - experiment_functions - INFO - Early stopping at epoch 550. Best Metrics: (0.015404105233955823, 0.0020999397146493405, 0.007731903747382671)
2026-06-13 22:42:20,232 - optuna.study.study - INFO - Trial 201 finished with values: [0.015404105233955823, 0.0020999397146493405, 0.007731903747382671] and parameters: {'n_layers': 3, 'embedding_dim': 64, 'lr': 0.017264647835539205, 'lambda_val': 0.0003920256863411047, 'batch_size': 3239, 'optimizer': 'RMSprop'}.
2026-06-13 22:44:06,358 - experiment_functions - INFO - Early stopping at epoch 2450. Best Metrics: (0.04911229419708126, 0.006576127001138724, 0.025710875261618058)
2026-06-13 22:44:06,437 - optuna.study.study - INFO - Trial 202 finished with values: [0.04911229419708126, 0.006576127001138724, 0.025710875261618058] and parameters: {'n_layers': 4, 'embedding_dim': 96, 'lr': 0.0009711234831697961, 'lambda_val': 3.6850667956484766e-06, 'batch_size': 1859, 'optimizer': 'Adam'}.
2026-06-13 22:44:56,370 - experiment_functions - INFO - Early stopping at epoch 1250. Best Metrics: (0.03897933450171992, 0.005400562663272825, 0.019667239500838374)
2026-06-13 22:44:56,457 - optuna.study.study - INFO - Trial 203 finished with values: [0.03897933450171992, 0.005400562663272825, 0.019667239500838374] and parameters: {'n_layers': 4, 'embedding_dim': 32, 'lr': 0.0009711234831697961, 'lambda_val': 0.0005195382127114068, 'batch_size': 3773, 'optimizer': 'RMSprop'}.
2026-06-13 22:45:22,774 - experiment_functions - INFO - Early stopping at epoch 600. Best Metrics: (0.031698635184366504, 0.004231696697702458, 0.015449151512730453)
2026-06-13 22:45:23,065 - optuna.study.study - INFO - Trial 204 finished with values: [0.031698635184366504, 0.004231696697702458, 0.015449151512730453] and parameters: {'n_layers': 4, 'embedding_dim': 64, 'lr': 0.007479853705659755, 'lambda_val': 4.1509980625924543e-05, 'batch_size': 2830, 'optimizer': 'Adam'}.
2026-06-13 22:46:05,196 - experiment_functions - INFO - Early stopping at epoch 1000. Best Metrics: (0.02733787489345024, 0.003878357559113136, 0.01400073407875716)
2026-06-13 22:46:05,279 - optuna.study.study - INFO - Trial 205 finished with values: [0.02733787489345024, 0.003878357559113136, 0.01400073407875716] and parameters: {'n_layers': 4, 'embedding_dim': 64, 'lr': 0.0009822401593291786, 'lambda_val': 0.004544214908485418, 'batch_size': 2725, 'optimizer': 'RMSprop'}.
2026-06-13 22:47:00,765 - experiment_functions - INFO - Early stopping at epoch 1300. Best Metrics: (0.04793680279414256, 0.006510817871257284, 0.024816242323327412)
2026-06-13 22:47:00,850 - optuna.study.study - INFO - Trial 206 finished with values: [0.04793680279414256, 0.006510817871257284, 0.024816242323327412] and parameters: {'n_layers': 3, 'embedding_dim': 96, 'lr': 0.0009822401593291786, 'lambda_val': 0.0005590603438440636, 'batch_size': 1677, 'optimizer': 'RMSprop'}.
2026-06-13 22:49:43,961 - optuna.study.study - INFO - Trial 207 finished with values: [0.05022918971036761, 0.0068574586375510765, 0.026530155889007725] and parameters: {'n_layers': 4, 'embedding_dim': 64, 'lr': 0.0006193224215073263, 'lambda_val': 0.00019652548319010554, 'batch_size': 1859, 'optimizer': 'Adam'}.
2026-06-13 22:50:07,147 - experiment_functions - INFO - Early stopping at epoch 550. Best Metrics: (0.015228646742032882, 0.002215486636747271, 0.007728482631302359)
2026-06-13 22:50:07,235 - optuna.study.study - INFO - Trial 208 finished with values: [0.015228646742032882, 0.002215486636747271, 0.007728482631302359] and parameters: {'n_layers': 3, 'embedding_dim': 64, 'lr': 0.03721253497018925, 'lambda_val': 0.00035318754870590177, 'batch_size': 821, 'optimizer': 'Adam'}.
2026-06-13 22:52:48,090 - optuna.study.study - INFO - Trial 209 finished with values: [0.054406026272179386, 0.007502176970996048, 0.03013814228454842] and parameters: {'n_layers': 2, 'embedding_dim': 96, 'lr': 0.0009822401593291786, 'lambda_val': 2.657146317841358e-05, 'batch_size': 1859, 'optimizer': 'RMSprop'}.
2026-06-13 22:53:35,507 - experiment_functions - INFO - Early stopping at epoch 1100. Best Metrics: (0.038975802686734985, 0.005346975684908567, 0.019637212356534168)
2026-06-13 22:53:35,627 - optuna.study.study - INFO - Trial 210 finished with values: [0.038975802686734985, 0.005346975684908567, 0.019637212356534168] and parameters: {'n_layers': 3, 'embedding_dim': 96, 'lr': 0.0016889361681909714, 'lambda_val': 0.0003920256863411047, 'batch_size': 1567, 'optimizer': 'RMSprop'}.
2026-06-13 22:54:18,131 - experiment_functions - INFO - Early stopping at epoch 1050. Best Metrics: (0.0381916469055598, 0.005422332373233304, 0.01983500406024164)
2026-06-13 22:54:18,224 - optuna.study.study - INFO - Trial 211 finished with values: [0.0381916469055598, 0.005422332373233304, 0.01983500406024164] and parameters: {'n_layers': 2, 'embedding_dim': 64, 'lr': 0.0016889361681909714, 'lambda_val': 0.00035318754870590177, 'batch_size': 3048, 'optimizer': 'RMSprop'}.
2026-06-13 22:57:03,578 - optuna.study.study - INFO - Trial 212 finished with values: [0.041172043120627264, 0.005953178377654231, 0.022692694106857342] and parameters: {'n_layers': 3, 'embedding_dim': 96, 'lr': 0.000495651360592853, 'lambda_val': 0.00035318754870590177, 'batch_size': 1358, 'optimizer': 'Adam'}.
2026-06-13 22:57:41,655 - experiment_functions - INFO - Early stopping at epoch 800. Best Metrics: (0.040104970059227696, 0.00539218969790341, 0.02023883203949589)
2026-06-13 22:57:41,944 - optuna.study.study - INFO - Trial 213 finished with values: [0.040104970059227696, 0.00539218969790341, 0.02023883203949589] and parameters: {'n_layers': 4, 'embedding_dim': 128, 'lr': 0.0009711234831697961, 'lambda_val': 0.00013735320939513843, 'batch_size': 3699, 'optimizer': 'RMSprop'}.
2026-06-13 22:58:48,697 - experiment_functions - INFO - Early stopping at epoch 1450. Best Metrics: (0.04846766387301993, 0.006435461182932548, 0.025590936826735435)
2026-06-13 22:58:48,770 - optuna.study.study - INFO - Trial 214 finished with values: [0.04846766387301993, 0.006435461182932548, 0.025590936826735435] and parameters: {'n_layers': 4, 'embedding_dim': 128, 'lr': 0.0006193224215073263, 'lambda_val': 2.3680453923050776e-05, 'batch_size': 4095, 'optimizer': 'RMSprop'}.
2026-06-13 22:59:46,514 - experiment_functions - INFO - Early stopping at epoch 1250. Best Metrics: (0.04144295295899199, 0.005640029472838101, 0.020659876423863646)
2026-06-13 22:59:46,595 - optuna.study.study - INFO - Trial 215 finished with values: [0.04144295295899199, 0.005640029472838101, 0.020659876423863646] and parameters: {'n_layers': 4, 'embedding_dim': 128, 'lr': 0.0009711234831697961, 'lambda_val': 0.0005195382127114068, 'batch_size': 1859, 'optimizer': 'RMSprop'}.
2026-06-13 23:00:40,032 - experiment_functions - INFO - Early stopping at epoch 1250. Best Metrics: (0.04357644671305642, 0.0059213611092504516, 0.02245929220361962)
2026-06-13 23:00:40,132 - optuna.study.study - INFO - Trial 216 finished with values: [0.04357644671305642, 0.0059213611092504516, 0.02245929220361962] and parameters: {'n_layers': 3, 'embedding_dim': 96, 'lr': 0.0009711234831697961, 'lambda_val': 0.0005195382127114068, 'batch_size': 3699, 'optimizer': 'RMSprop'}.
2026-06-13 23:01:40,768 - experiment_functions - INFO - Early stopping at epoch 1500. Best Metrics: (0.04138231091332969, 0.005869448723960079, 0.021059276950976927)
2026-06-13 23:01:40,867 - optuna.study.study - INFO - Trial 217 finished with values: [0.04138231091332969, 0.005869448723960079, 0.021059276950976927] and parameters: {'n_layers': 3, 'embedding_dim': 64, 'lr': 0.0009822401593291786, 'lambda_val': 0.0016643534908328272, 'batch_size': 1264, 'optimizer': 'RMSprop'}.
2026-06-13 23:04:27,195 - optuna.study.study - INFO - Trial 218 finished with values: [0.05306878832890755, 0.007271083126800189, 0.029314159734441077] and parameters: {'n_layers': 3, 'embedding_dim': 96, 'lr': 0.000495651360592853, 'lambda_val': 2.060634847155313e-06, 'batch_size': 3048, 'optimizer': 'RMSprop'}.
2026-06-13 23:05:05,736 - experiment_functions - INFO - Early stopping at epoch 950. Best Metrics: (0.03705230913540887, 0.005213008238997924, 0.019307044373497294)
2026-06-13 23:05:06,456 - optuna.study.study - INFO - Trial 219 finished with values: [0.03705230913540887, 0.005213008238997924, 0.019307044373497294] and parameters: {'n_layers': 2, 'embedding_dim': 64, 'lr': 0.0016889361681909714, 'lambda_val': 0.0016643534908328272, 'batch_size': 3009, 'optimizer': 'RMSprop'}.
2026-06-13 23:06:43,685 - experiment_functions - INFO - Early stopping at epoch 2150. Best Metrics: (0.03995529930380795, 0.0052398017281800515, 0.020007420712077093)
2026-06-13 23:06:43,776 - optuna.study.study - INFO - Trial 220 finished with values: [0.03995529930380795, 0.0052398017281800515, 0.020007420712077093] and parameters: {'n_layers': 4, 'embedding_dim': 128, 'lr': 0.0016889361681909714, 'lambda_val': 1.3767730265722935e-05, 'batch_size': 1246, 'optimizer': 'RMSprop'}.
2026-06-13 23:07:13,641 - experiment_functions - INFO - Early stopping at epoch 600. Best Metrics: (0.024264231263658113, 0.0033257418447317304, 0.01195053974991678)
2026-06-13 23:07:13,741 - optuna.study.study - INFO - Trial 221 finished with values: [0.024264231263658113, 0.0033257418447317304, 0.01195053974991678] and parameters: {'n_layers': 2, 'embedding_dim': 256, 'lr': 0.011155383866816252, 'lambda_val': 3.6850667956484766e-06, 'batch_size': 1602, 'optimizer': 'Adam'}.
2026-06-13 23:07:58,855 - experiment_functions - INFO - Early stopping at epoch 1000. Best Metrics: (0.04652403162617382, 0.006291446178578606, 0.02398722480848495)
2026-06-13 23:07:58,945 - optuna.study.study - INFO - Trial 222 finished with values: [0.04652403162617382, 0.006291446178578606, 0.02398722480848495] and parameters: {'n_layers': 3, 'embedding_dim': 128, 'lr': 0.0009711234831697961, 'lambda_val': 2.060634847155313e-06, 'batch_size': 3914, 'optimizer': 'RMSprop'}.
2026-06-13 23:10:28,997 - optuna.study.study - INFO - Trial 223 finished with values: [0.02879633443063763, 0.004404179784312412, 0.01591153360759886] and parameters: {'n_layers': 1, 'embedding_dim': 64, 'lr': 0.0009822401593291786, 'lambda_val': 0.00035318754870590177, 'batch_size': 3009, 'optimizer': 'Adam'}.
2026-06-13 23:11:24,528 - experiment_functions - INFO - Early stopping at epoch 1300. Best Metrics: (0.04593933955285298, 0.006072074485899926, 0.023622692445361394)
2026-06-13 23:11:24,663 - optuna.study.study - INFO - Trial 224 finished with values: [0.04593933955285298, 0.006072074485899926, 0.023622692445361394] and parameters: {'n_layers': 3, 'embedding_dim': 96, 'lr': 0.0016889361681909714, 'lambda_val': 2.330378236205022e-05, 'batch_size': 1496, 'optimizer': 'RMSprop'}.
2026-06-13 23:12:11,294 - experiment_functions - INFO - Early stopping at epoch 1050. Best Metrics: (0.04182672236091915, 0.005464197200080381, 0.02089491929278652)
2026-06-13 23:12:11,394 - optuna.study.study - INFO - Trial 225 finished with values: [0.04182672236091915, 0.005464197200080381, 0.02089491929278652] and parameters: {'n_layers': 4, 'embedding_dim': 96, 'lr': 0.0009711234831697961, 'lambda_val': 1.2390048556225255e-05, 'batch_size': 4095, 'optimizer': 'RMSprop'}.
2026-06-13 23:12:33,151 - experiment_functions - INFO - Early stopping at epoch 500. Best Metrics: (0.0007346926017069127, 0.00010382477058074888, 0.0003103042264114402)
2026-06-13 23:12:33,232 - optuna.study.study - INFO - Trial 226 finished with values: [0.0007346926017069127, 0.00010382477058074888, 0.0003103042264114402] and parameters: {'n_layers': 3, 'embedding_dim': 96, 'lr': 0.0016889361681909714, 'lambda_val': 0.00019652548319010554, 'batch_size': 589, 'optimizer': 'SGD'}.
2026-06-13 23:13:12,848 - experiment_functions - INFO - Early stopping at epoch 950. Best Metrics: (0.04271335871831714, 0.00605700314823498, 0.02278411290396408)
2026-06-13 23:13:12,936 - optuna.study.study - INFO - Trial 227 finished with values: [0.04271335871831714, 0.00605700314823498, 0.02278411290396408] and parameters: {'n_layers': 2, 'embedding_dim': 96, 'lr': 0.0016889361681909714, 'lambda_val': 0.00035318754870590177, 'batch_size': 1859, 'optimizer': 'RMSprop'}.
2026-06-13 23:14:14,482 - experiment_functions - INFO - Early stopping at epoch 1550. Best Metrics: (0.046673596006920934, 0.006617991827985799, 0.02509599983945316)
2026-06-13 23:14:14,566 - optuna.study.study - INFO - Trial 228 finished with values: [0.046673596006920934, 0.006617991827985799, 0.02509599983945316] and parameters: {'n_layers': 2, 'embedding_dim': 64, 'lr': 0.0016889361681909714, 'lambda_val': 0.00035318754870590177, 'batch_size': 1264, 'optimizer': 'RMSprop'}.
2026-06-13 23:15:34,196 - experiment_functions - INFO - Early stopping at epoch 1950. Best Metrics: (0.04873991627523205, 0.006658182061758993, 0.02617850064367236)
2026-06-13 23:15:34,290 - optuna.study.study - INFO - Trial 229 finished with values: [0.04873991627523205, 0.006658182061758993, 0.02617850064367236] and parameters: {'n_layers': 2, 'embedding_dim': 96, 'lr': 0.0009711234831697961, 'lambda_val': 2.1212701714385975e-05, 'batch_size': 3699, 'optimizer': 'RMSprop'}.
2026-06-13 23:15:57,888 - experiment_functions - INFO - Early stopping at epoch 550. Best Metrics: (0.01730099884853021, 0.0024365329224998325, 0.00886510916276277)
2026-06-13 23:15:57,976 - optuna.study.study - INFO - Trial 230 finished with values: [0.01730099884853021, 0.0024365329224998325, 0.00886510916276277] and parameters: {'n_layers': 2, 'embedding_dim': 96, 'lr': 0.01167085390004888, 'lambda_val': 0.0004033369882552061, 'batch_size': 3699, 'optimizer': 'RMSprop'}.
2026-06-13 23:16:51,608 - experiment_functions - INFO - Early stopping at epoch 1350. Best Metrics: (0.009432020998456882, 0.0013179047491459577, 0.0044546848661877565)
2026-06-13 23:16:51,680 - optuna.study.study - INFO - Trial 231 finished with values: [0.009432020998456882, 0.0013179047491459577, 0.0044546848661877565] and parameters: {'n_layers': 3, 'embedding_dim': 64, 'lr': 0.009383334930204235, 'lambda_val': 0.04045460864736869, 'batch_size': 1358, 'optimizer': 'Adam'}.
2026-06-13 23:19:34,785 - optuna.study.study - INFO - Trial 232 finished with values: [0.045810027255258866, 0.006105566347377587, 0.022801540284178905] and parameters: {'n_layers': 4, 'embedding_dim': 64, 'lr': 0.0006193224215073263, 'lambda_val': 0.00019652548319010554, 'batch_size': 4095, 'optimizer': 'Adam'}.
2026-06-13 23:20:36,556 - experiment_functions - INFO - Early stopping at epoch 1450. Best Metrics: (0.04600959555495516, 0.0062847478062830735, 0.024069040880565568)
2026-06-13 23:20:36,648 - optuna.study.study - INFO - Trial 233 finished with values: [0.04600959555495516, 0.0062847478062830735, 0.024069040880565568] and parameters: {'n_layers': 3, 'embedding_dim': 96, 'lr': 0.0009711234831697961, 'lambda_val': 0.00035318754870590177, 'batch_size': 3699, 'optimizer': 'Adam'}.
2026-06-13 23:21:19,089 - experiment_functions - INFO - Early stopping at epoch 1000. Best Metrics: (0.039718274076780115, 0.0054692209793020296, 0.02043672342756264)
2026-06-13 23:21:19,168 - optuna.study.study - INFO - Trial 234 finished with values: [0.039718274076780115, 0.0054692209793020296, 0.02043672342756264] and parameters: {'n_layers': 4, 'embedding_dim': 64, 'lr': 0.0013289886132312838, 'lambda_val': 0.0003920256863411047, 'batch_size': 2523, 'optimizer': 'Adam'}.
2026-06-13 23:22:23,721 - experiment_functions - INFO - Early stopping at epoch 1400. Best Metrics: (0.044107760752648696, 0.005964900529171412, 0.021790841824164672)
2026-06-13 23:22:23,823 - optuna.study.study - INFO - Trial 235 finished with values: [0.044107760752648696, 0.005964900529171412, 0.021790841824164672] and parameters: {'n_layers': 4, 'embedding_dim': 128, 'lr': 0.0009711234831697961, 'lambda_val': 0.0005195382127114068, 'batch_size': 1859, 'optimizer': 'Adam'}.
2026-06-13 23:25:01,162 - optuna.study.study - INFO - Trial 236 finished with values: [0.035306789981528905, 0.005065644048496215, 0.018954446074091347] and parameters: {'n_layers': 1, 'embedding_dim': 128, 'lr': 0.0009711234831697961, 'lambda_val': 0.00019652548319010554, 'batch_size': 3699, 'optimizer': 'RMSprop'}.
2026-06-13 23:27:30,728 - optuna.study.study - INFO - Trial 237 finished with values: [0.030019568965656707, 0.0044443700180856055, 0.01624963986501686] and parameters: {'n_layers': 1, 'embedding_dim': 64, 'lr': 0.0016889361681909714, 'lambda_val': 0.00035318754870590177, 'batch_size': 1358, 'optimizer': 'Adam'}.
2026-06-13 23:28:12,088 - experiment_functions - INFO - Early stopping at epoch 1000. Best Metrics: (0.04319448464034188, 0.005839306048630184, 0.021870866508753268)
