2026-06-14 00:43:50,629 - optuna.study.study - INFO - Trial 288 finished with values: [0.052710741003606044, 0.007269408533726305, 0.02869854550823591] and parameters: {'n_layers': 3, 'embedding_dim': 96, 'lr': 0.000495651360592853, 'lambda_val': 0.0005590603438440636, 'batch_size': 3048, 'optimizer': 'RMSprop'}.
2026-06-14 00:44:22,104 - experiment_functions - INFO - Early stopping at epoch 750. Best Metrics: (0.033835519165092476, 0.004745796771384554, 0.017092540242879203)
2026-06-14 00:44:22,180 - optuna.study.study - INFO - Trial 289 finished with values: [0.033835519165092476, 0.004745796771384554, 0.017092540242879203] and parameters: {'n_layers': 3, 'embedding_dim': 64, 'lr': 0.0016889361681909714, 'lambda_val': 0.0020181679696393345, 'batch_size': 2916, 'optimizer': 'RMSprop'}.
2026-06-14 00:47:05,442 - optuna.study.study - INFO - Trial 290 finished with values: [0.050464042780945295, 0.006954585035836291, 0.02702918445948982] and parameters: {'n_layers': 4, 'embedding_dim': 64, 'lr': 0.0006193224215073263, 'lambda_val': 2.3680453923050776e-05, 'batch_size': 1859, 'optimizer': 'Adam'}.
2026-06-14 00:47:53,498 - experiment_functions - INFO - Early stopping at epoch 850. Best Metrics: (0.04448393659972182, 0.005959876749949764, 0.022288203242427602)
2026-06-14 00:47:53,590 - optuna.study.study - INFO - Trial 291 finished with values: [0.04448393659972182, 0.005959876749949764, 0.022288203242427602] and parameters: {'n_layers': 4, 'embedding_dim': 256, 'lr': 0.0016889361681909714, 'lambda_val': 2.3680453923050776e-05, 'batch_size': 1859, 'optimizer': 'Adam'}.
2026-06-14 00:49:51,864 - experiment_functions - INFO - Early stopping at epoch 3000. Best Metrics: (0.034855977137728575, 0.0051476991091164844, 0.019047594157594955)
2026-06-14 00:49:51,955 - optuna.study.study - INFO - Trial 292 finished with values: [0.034855977137728575, 0.0051476991091164844, 0.019047594157594955] and parameters: {'n_layers': 1, 'embedding_dim': 128, 'lr': 0.0009711234831697961, 'lambda_val': 2.3680453923050776e-05, 'batch_size': 4095, 'optimizer': 'RMSprop'}.
2026-06-14 00:50:43,899 - experiment_functions - INFO - Early stopping at epoch 1300. Best Metrics: (0.047397753205738254, 0.006589523745729788, 0.02592228793581408)
2026-06-14 00:50:43,990 - optuna.study.study - INFO - Trial 293 finished with values: [0.047397753205738254, 0.006589523745729788, 0.02592228793581408] and parameters: {'n_layers': 2, 'embedding_dim': 64, 'lr': 0.0016889361681909714, 'lambda_val': 0.00035318754870590177, 'batch_size': 1264, 'optimizer': 'RMSprop'}.
2026-06-14 00:53:21,328 - optuna.study.study - INFO - Trial 294 finished with values: [0.02727568196683876, 0.004238395069997991, 0.01570772153107098] and parameters: {'n_layers': 2, 'embedding_dim': 96, 'lr': 0.0003660376013854816, 'lambda_val': 0.0005195382127114068, 'batch_size': 2680, 'optimizer': 'RMSprop'}.
2026-06-14 00:53:51,101 - experiment_functions - INFO - Early stopping at epoch 700. Best Metrics: (0.025775574103584824, 0.003530042199745462, 0.012886461864437076)
2026-06-14 00:53:51,461 - optuna.study.study - INFO - Trial 295 finished with values: [0.025775574103584824, 0.003530042199745462, 0.012886461864437076] and parameters: {'n_layers': 2, 'embedding_dim': 96, 'lr': 0.005084086391399634, 'lambda_val': 0.00019652548319010554, 'batch_size': 2916, 'optimizer': 'RMSprop'}.
2026-06-14 00:54:36,656 - experiment_functions - INFO - Early stopping at epoch 1000. Best Metrics: (0.04460647785792199, 0.0060385826244222654, 0.0231024069567214)
2026-06-14 00:54:36,997 - optuna.study.study - INFO - Trial 296 finished with values: [0.04460647785792199, 0.0060385826244222654, 0.0231024069567214] and parameters: {'n_layers': 3, 'embedding_dim': 128, 'lr': 0.0009711234831697961, 'lambda_val': 0.0005590603438440636, 'batch_size': 3914, 'optimizer': 'RMSprop'}.
2026-06-14 00:55:10,074 - experiment_functions - INFO - Early stopping at epoch 750. Best Metrics: (0.0372396486922965, 0.005290039520396543, 0.019749852651746332)
2026-06-14 00:55:10,149 - optuna.study.study - INFO - Trial 297 finished with values: [0.0372396486922965, 0.005290039520396543, 0.019749852651746332] and parameters: {'n_layers': 2, 'embedding_dim': 128, 'lr': 0.0016889361681909714, 'lambda_val': 0.0004269743835482925, 'batch_size': 3995, 'optimizer': 'RMSprop'}.
2026-06-14 00:56:46,628 - experiment_functions - INFO - Early stopping at epoch 2450. Best Metrics: (0.047544854123749085, 0.006589523745729789, 0.026195835038477253)
2026-06-14 00:56:46,709 - optuna.study.study - INFO - Trial 298 finished with values: [0.047544854123749085, 0.006589523745729789, 0.026195835038477253] and parameters: {'n_layers': 2, 'embedding_dim': 64, 'lr': 0.0009711234831697961, 'lambda_val': 4.1509980625924543e-05, 'batch_size': 3414, 'optimizer': 'RMSprop'}.
2026-06-14 00:59:14,680 - optuna.study.study - INFO - Trial 299 finished with values: [0.03128237943599633, 0.0047123049099068925, 0.01780787264598063] and parameters: {'n_layers': 2, 'embedding_dim': 32, 'lr': 0.0006193224215073263, 'lambda_val': 3.6850667956484766e-06, 'batch_size': 1859, 'optimizer': 'Adam'}.
2026-06-14 00:59:14,695 - root - INFO - Selected Trial 241 based on Max ndcg: 0.0305
2026-06-14 00:59:14,695 - root - INFO - Associated Recall: 0.0577
2026-06-14 00:59:14,695 - experiment_functions - INFO - Training the best model ... for e_gowalla_1c3dcs_strict_rand5
2026-06-14 01:01:09,237 - experiment_functions - INFO - Early stopping at epoch 2850. Best Metrics: (0.05452854059657785, 0.007167258356219439, 0.02859447129190895)
2026-06-14 01:01:13,128 - root - INFO - **** Training e_gowalla_1c3dcs
2026-06-14 01:01:13,128 - root - INFO -   ** 3-Dominant stats:
2026-06-14 01:01:13,128 - root - INFO -   ** Finding the dominant set:
2026-06-14 03:53:49,390 - root - INFO -   ** Getting the trainable edges:
2026-06-14 03:53:49,420 - helper_functions - INFO -      Number of nodes: 16568
2026-06-14 03:53:49,420 - helper_functions - INFO -      Ratio: 0.23388246587331837
2026-06-14 03:53:49,420 - helper_functions - INFO -      Number of unique users: 4930
2026-06-14 03:53:49,420 - helper_functions - INFO -      Number of unique items: 11638
2026-06-14 03:53:49,420 - helper_functions - INFO -      Total dominant set edge: 682633
2026-06-14 03:53:49,420 - helper_functions - INFO -      Trainable edges: 546106.4
2026-06-14 03:53:49,523 - root - INFO -   **** Getting 682633 dominant set edges
2026-06-14 03:53:49,683 - optuna.storages._rdb.storage - INFO - A new study created in RDB with name: Study_e_gowalla_1c3dcs
2026-06-14 03:54:12,406 - experiment_functions - INFO - Early stopping at epoch 500. Best Metrics: (0.0007997150207780523, 9.37772121374506e-05, 0.00034282915753772755)
2026-06-14 03:54:12,484 - optuna.study.study - INFO - Trial 0 finished with values: [0.0007997150207780523, 9.37772121374506e-05, 0.00034282915753772755] and parameters: {'n_layers': 2, 'embedding_dim': 96, 'lr': 0.0020064049740726496, 'lambda_val': 0.029603326437901343, 'batch_size': 1530, 'optimizer': 'SGD'}.
2026-06-14 03:54:46,114 - experiment_functions - INFO - Early stopping at epoch 500. Best Metrics: (0.00046109096368041345, 7.53566883247371e-05, 0.0002381037198386557)
2026-06-14 03:54:46,189 - optuna.study.study - INFO - Trial 1 finished with values: [0.00046109096368041345, 7.53566883247371e-05, 0.0002381037198386557] and parameters: {'n_layers': 4, 'embedding_dim': 256, 'lr': 0.0005870705319378093, 'lambda_val': 0.005143872389254517, 'batch_size': 3649, 'optimizer': 'SGD'}.
2026-06-14 03:57:23,769 - optuna.study.study - INFO - Trial 2 finished with values: [0.07157123598953505, 0.00932245964230692, 0.03782310654040184] and parameters: {'n_layers': 1, 'embedding_dim': 32, 'lr': 0.0008197571059817735, 'lambda_val': 0.0012360905541564393, 'batch_size': 2618, 'optimizer': 'Adam'}.
2026-06-14 03:57:46,894 - experiment_functions - INFO - Early stopping at epoch 550. Best Metrics: (0.007266625298791912, 0.001111929801058343, 0.0037087042594362313)
2026-06-14 03:57:46,982 - optuna.study.study - INFO - Trial 3 finished with values: [0.007266625298791912, 0.001111929801058343, 0.0037087042594362313] and parameters: {'n_layers': 1, 'embedding_dim': 64, 'lr': 0.08584314172294037, 'lambda_val': 0.004913946733537837, 'batch_size': 2271, 'optimizer': 'Adam'}.
2026-06-14 03:58:08,776 - experiment_functions - INFO - Early stopping at epoch 500. Best Metrics: (0.0003993107372903081, 5.693616451202358e-05, 0.0001651875129705804)
2026-06-14 03:58:08,869 - optuna.study.study - INFO - Trial 4 finished with values: [0.0003993107372903081, 5.693616451202358e-05, 0.0001651875129705804] and parameters: {'n_layers': 2, 'embedding_dim': 64, 'lr': 0.00022947090502809257, 'lambda_val': 0.060797214202312565, 'batch_size': 3478, 'optimizer': 'SGD'}.
2026-06-14 04:01:12,793 - optuna.study.study - INFO - Trial 5 finished with values: [0.07652952879207298, 0.009694219304708955, 0.042136230659743215] and parameters: {'n_layers': 2, 'embedding_dim': 128, 'lr': 0.00034081213821976773, 'lambda_val': 0.00017543678662275883, 'batch_size': 3268, 'optimizer': 'RMSprop'}.
2026-06-14 04:03:27,055 - experiment_functions - INFO - Early stopping at epoch 3450. Best Metrics: (0.029714128469988152, 0.0035250184205238132, 0.01322389370652007)
2026-06-14 04:03:27,188 - optuna.study.study - INFO - Trial 6 finished with values: [0.029714128469988152, 0.0035250184205238132, 0.01322389370652007] and parameters: {'n_layers': 2, 'embedding_dim': 32, 'lr': 0.009852934677495576, 'lambda_val': 5.308270759214878e-05, 'batch_size': 918, 'optimizer': 'Adam'}.
2026-06-14 04:03:48,872 - experiment_functions - INFO - Early stopping at epoch 500. Best Metrics: (0.00048102471392505984, 7.368209525085404e-05, 0.00022375653689801525)
2026-06-14 04:03:49,787 - optuna.study.study - INFO - Trial 7 finished with values: [0.00048102471392505984, 7.368209525085404e-05, 0.00022375653689801525] and parameters: {'n_layers': 1, 'embedding_dim': 96, 'lr': 0.02122039140499773, 'lambda_val': 6.112369066278103e-05, 'batch_size': 1131, 'optimizer': 'SGD'}.
2026-06-14 04:06:15,133 - experiment_functions - INFO - Early stopping at epoch 3550. Best Metrics: (0.03405519655860978, 0.003993904481211065, 0.015434423568373627)
2026-06-14 04:06:15,261 - optuna.study.study - INFO - Trial 8 finished with values: [0.03405519655860978, 0.003993904481211065, 0.015434423568373627] and parameters: {'n_layers': 2, 'embedding_dim': 64, 'lr': 0.013849452305144725, 'lambda_val': 9.92028588022513e-06, 'batch_size': 1930, 'optimizer': 'Adam'}.
2026-06-14 04:10:11,375 - optuna.study.study - INFO - Trial 9 finished with values: [0.058185711630042304, 0.0069663071873534745, 0.02795545260224247] and parameters: {'n_layers': 3, 'embedding_dim': 256, 'lr': 0.0007333136681919207, 'lambda_val': 4.898157643229756e-06, 'batch_size': 2132, 'optimizer': 'RMSprop'}.
2026-06-14 04:12:59,174 - optuna.study.study - INFO - Trial 10 finished with values: [0.0938102206036122, 0.01179080983321053, 0.05049943979523824] and parameters: {'n_layers': 1, 'embedding_dim': 96, 'lr': 0.0009554934943534302, 'lambda_val': 0.00014895795346764513, 'batch_size': 1995, 'optimizer': 'Adam'}.
2026-06-14 04:13:22,767 - experiment_functions - INFO - Early stopping at epoch 500. Best Metrics: (0.0005872549556784079, 8.707883984191842e-05, 0.0002627677276335456)
2026-06-14 04:13:22,826 - optuna.study.study - INFO - Trial 11 finished with values: [0.0005872549556784079, 8.707883984191842e-05, 0.0002627677276335456] and parameters: {'n_layers': 4, 'embedding_dim': 64, 'lr': 0.03663754818186511, 'lambda_val': 7.591557939184172e-06, 'batch_size': 899, 'optimizer': 'SGD'}.
2026-06-14 04:16:09,471 - optuna.study.study - INFO - Trial 12 finished with values: [0.0009211400096678962, 0.00015238796972335723, 0.0004494314656912984] and parameters: {'n_layers': 3, 'embedding_dim': 64, 'lr': 5.229696231324875e-05, 'lambda_val': 2.9659206357399652e-05, 'batch_size': 2564, 'optimizer': 'RMSprop'}.
2026-06-14 04:18:52,773 - optuna.study.study - INFO - Trial 13 finished with values: [0.02341161138474102, 0.003178377654230022, 0.011511782110944802] and parameters: {'n_layers': 2, 'embedding_dim': 64, 'lr': 0.0003780315395925949, 'lambda_val': 0.04161754134046976, 'batch_size': 3300, 'optimizer': 'Adam'}.
2026-06-14 04:19:18,555 - experiment_functions - INFO - Early stopping at epoch 500. Best Metrics: (0.0005367243107137896, 7.2007502176971e-05, 0.00020665674494210805)
2026-06-14 04:19:18,890 - optuna.study.study - INFO - Trial 14 finished with values: [0.0005367243107137896, 7.2007502176971e-05, 0.00020665674494210805] and parameters: {'n_layers': 4, 'embedding_dim': 96, 'lr': 1.0266968550011489e-05, 'lambda_val': 0.0012222105431406712, 'batch_size': 3763, 'optimizer': 'RMSprop'}.
2026-06-14 04:23:16,662 - optuna.study.study - INFO - Trial 15 finished with values: [0.06427830589214129, 0.008031348382343092, 0.03324770051337209] and parameters: {'n_layers': 3, 'embedding_dim': 256, 'lr': 0.0004553975451984739, 'lambda_val': 2.2885624961089243e-05, 'batch_size': 1912, 'optimizer': 'RMSprop'}.
2026-06-14 04:26:02,342 - optuna.study.study - INFO - Trial 16 finished with values: [0.0011905366607329695, 0.00014401500435394198, 0.0005250164948548578] and parameters: {'n_layers': 3, 'embedding_dim': 64, 'lr': 5.771126583454873e-05, 'lambda_val': 0.0001928067341566669, 'batch_size': 3623, 'optimizer': 'Adam'}.
2026-06-14 04:26:29,347 - experiment_functions - INFO - Early stopping at epoch 500. Best Metrics: (0.0007219341483273578, 8.372965369415234e-05, 0.00032133941070612115)
2026-06-14 04:26:29,433 - optuna.study.study - INFO - Trial 17 finished with values: [0.0007219341483273578, 8.372965369415234e-05, 0.00032133941070612115] and parameters: {'n_layers': 4, 'embedding_dim': 128, 'lr': 9.092673167049823e-05, 'lambda_val': 0.05049745047883414, 'batch_size': 2533, 'optimizer': 'RMSprop'}.
2026-06-14 04:26:51,972 - experiment_functions - INFO - Early stopping at epoch 500. Best Metrics: (0.0006179145048052812, 8.038046754638622e-05, 0.0002826356021734673)
2026-06-14 04:26:52,071 - optuna.study.study - INFO - Trial 18 finished with values: [0.0006179145048052812, 8.038046754638622e-05, 0.0002826356021734673] and parameters: {'n_layers': 2, 'embedding_dim': 96, 'lr': 0.00010067552704350233, 'lambda_val': 0.00603991706012345, 'batch_size': 2066, 'optimizer': 'RMSprop'}.
2026-06-14 04:27:13,285 - experiment_functions - INFO - Early stopping at epoch 500. Best Metrics: (0.0006021582484648012, 8.372965369415234e-05, 0.00029718459877259133)
2026-06-14 04:27:13,667 - optuna.study.study - INFO - Trial 19 finished with values: [0.0006021582484648012, 8.372965369415234e-05, 0.00029718459877259133] and parameters: {'n_layers': 1, 'embedding_dim': 96, 'lr': 0.021508799802187974, 'lambda_val': 1.4178492713838987e-06, 'batch_size': 1416, 'optimizer': 'SGD'}.
2026-06-14 04:27:55,552 - experiment_functions - INFO - Early stopping at epoch 1000. Best Metrics: (0.0006335115598356271, 9.545180521133365e-05, 0.00027085696631803284)
2026-06-14 04:27:56,649 - optuna.study.study - INFO - Trial 20 finished with values: [0.0006335115598356271, 9.545180521133365e-05, 0.00027085696631803284] and parameters: {'n_layers': 4, 'embedding_dim': 32, 'lr': 1.3178712483400947e-05, 'lambda_val': 0.0005404352244887764, 'batch_size': 1042, 'optimizer': 'Adam'}.
2026-06-14 04:28:26,908 - experiment_functions - INFO - Early stopping at epoch 500. Best Metrics: (0.0006199517807587671, 7.703128139862015e-05, 0.0003136207645048886)
2026-06-14 04:28:26,999 - optuna.study.study - INFO - Trial 21 finished with values: [0.0006199517807587671, 7.703128139862015e-05, 0.0003136207645048886] and parameters: {'n_layers': 3, 'embedding_dim': 256, 'lr': 0.002670622630663831, 'lambda_val': 1.6577722084002546e-06, 'batch_size': 939, 'optimizer': 'SGD'}.
2026-06-14 04:31:03,131 - optuna.study.study - INFO - Trial 22 finished with values: [0.035892602861342805, 0.005104159689195527, 0.020590730248164057] and parameters: {'n_layers': 1, 'embedding_dim': 64, 'lr': 0.0004540666822812583, 'lambda_val': 0.0006227487570839946, 'batch_size': 1326, 'optimizer': 'Adam'}.
2026-06-14 04:32:00,839 - experiment_functions - INFO - Early stopping at epoch 1150. Best Metrics: (0.054858428013362014, 0.006758657646191975, 0.02677065808144679)
2026-06-14 04:32:00,917 - optuna.study.study - INFO - Trial 23 finished with values: [0.054858428013362014, 0.006758657646191975, 0.02677065808144679] and parameters: {'n_layers': 3, 'embedding_dim': 128, 'lr': 0.0011116819593430245, 'lambda_val': 8.049701828088752e-06, 'batch_size': 3120, 'optimizer': 'Adam'}.
2026-06-14 04:32:29,853 - experiment_functions - INFO - Early stopping at epoch 650. Best Metrics: (0.08084073031100913, 0.010034161698707215, 0.04281631805021156)
2026-06-14 04:32:29,945 - optuna.study.study - INFO - Trial 24 finished with values: [0.08084073031100913, 0.010034161698707215, 0.04281631805021156] and parameters: {'n_layers': 1, 'embedding_dim': 96, 'lr': 0.00486276978616333, 'lambda_val': 0.0003071461412000055, 'batch_size': 3438, 'optimizer': 'Adam'}.
2026-06-14 04:32:55,472 - experiment_functions - INFO - Early stopping at epoch 500. Best Metrics: (0.0003703979867369956, 6.363453680755577e-05, 0.0001703897841922077)
2026-06-14 04:32:55,556 - optuna.study.study - INFO - Trial 25 finished with values: [0.0003703979867369956, 6.363453680755577e-05, 0.0001703897841922077] and parameters: {'n_layers': 3, 'embedding_dim': 128, 'lr': 0.013796116979423095, 'lambda_val': 0.01293317444088043, 'batch_size': 2804, 'optimizer': 'SGD'}.
2026-06-14 04:33:20,363 - experiment_functions - INFO - Early stopping at epoch 500. Best Metrics: (0.0004918592095977844, 6.865831602920491e-05, 0.00019177506995783077)
2026-06-14 04:33:20,441 - optuna.study.study - INFO - Trial 26 finished with values: [0.0004918592095977844, 6.865831602920491e-05, 0.00019177506995783077] and parameters: {'n_layers': 1, 'embedding_dim': 256, 'lr': 3.083948801533128e-05, 'lambda_val': 0.021162739120193855, 'batch_size': 1741, 'optimizer': 'RMSprop'}.
2026-06-14 04:34:10,586 - experiment_functions - INFO - Early stopping at epoch 1200. Best Metrics: (0.019184550801721118, 0.0023176368142541364, 0.008583988105634387)
2026-06-14 04:34:10,665 - optuna.study.study - INFO - Trial 27 finished with values: [0.019184550801721118, 0.0023176368142541364, 0.008583988105634387] and parameters: {'n_layers': 4, 'embedding_dim': 32, 'lr': 0.00352106387321726, 'lambda_val': 0.0010898222324540782, 'batch_size': 1088, 'optimizer': 'Adam'}.
2026-06-14 04:34:42,407 - experiment_functions - INFO - Early stopping at epoch 750. Best Metrics: (0.000618790005307758, 9.042802598968451e-05, 0.00026521281688312204)
2026-06-14 04:34:42,509 - optuna.study.study - INFO - Trial 28 finished with values: [0.000618790005307758, 9.042802598968451e-05, 0.00026521281688312204] and parameters: {'n_layers': 2, 'embedding_dim': 64, 'lr': 3.298311195843919e-05, 'lambda_val': 0.0026562784556607116, 'batch_size': 2326, 'optimizer': 'Adam'}.
2026-06-14 04:37:37,971 - experiment_functions - INFO - Early stopping at epoch 3750. Best Metrics: (0.0006514929666249843, 0.00010215017750686583, 0.00033145205872442765)
2026-06-14 04:37:38,078 - optuna.study.study - INFO - Trial 29 finished with values: [0.0006514929666249843, 0.00010215017750686583, 0.00033145205872442765] and parameters: {'n_layers': 4, 'embedding_dim': 96, 'lr': 4.686279768667576e-05, 'lambda_val': 1.910365266111311e-06, 'batch_size': 792, 'optimizer': 'Adam'}.
2026-06-14 04:38:03,370 - experiment_functions - INFO - Early stopping at epoch 500. Best Metrics: (0.0004225937520710651, 7.200750217697099e-05, 0.0002300192319014166)
2026-06-14 04:38:03,462 - optuna.study.study - INFO - Trial 30 finished with values: [0.0004225937520710651, 7.200750217697099e-05, 0.0002300192319014166] and parameters: {'n_layers': 3, 'embedding_dim': 128, 'lr': 0.000667971958075753, 'lambda_val': 0.00026875014666868924, 'batch_size': 2804, 'optimizer': 'SGD'}.
2026-06-14 04:38:46,832 - experiment_functions - INFO - Early stopping at epoch 1000. Best Metrics: (0.0003512322541027951, 6.0285350659789674e-05, 0.0001739794739775664)
2026-06-14 04:38:47,027 - optuna.study.study - INFO - Trial 31 finished with values: [0.0003512322541027951, 6.0285350659789674e-05, 0.0001739794739775664] and parameters: {'n_layers': 2, 'embedding_dim': 96, 'lr': 3.797419091403046e-05, 'lambda_val': 2.792702543301356e-06, 'batch_size': 778, 'optimizer': 'RMSprop'}.
2026-06-14 04:39:20,605 - experiment_functions - INFO - Early stopping at epoch 500. Best Metrics: (0.0005909384981947945, 8.875343291580147e-05, 0.00024118970485883143)
2026-06-14 04:39:20,674 - optuna.study.study - INFO - Trial 32 finished with values: [0.0005909384981947945, 8.875343291580147e-05, 0.00024118970485883143] and parameters: {'n_layers': 4, 'embedding_dim': 256, 'lr': 0.015258079819389626, 'lambda_val': 0.0023887581341625903, 'batch_size': 2376, 'optimizer': 'SGD'}.
2026-06-14 04:39:47,870 - experiment_functions - INFO - Early stopping at epoch 500. Best Metrics: (0.0003834202505973198, 6.028535065978968e-05, 0.0001773868439730116)
2026-06-14 04:39:47,941 - optuna.study.study - INFO - Trial 33 finished with values: [0.0003834202505973198, 6.028535065978968e-05, 0.0001773868439730116] and parameters: {'n_layers': 2, 'embedding_dim': 256, 'lr': 0.0008446382559011796, 'lambda_val': 0.00888478936360516, 'batch_size': 2595, 'optimizer': 'SGD'}.
2026-06-14 04:40:12,260 - experiment_functions - INFO - Early stopping at epoch 500. Best Metrics: (0.000494778089874044, 6.698372295532186e-05, 0.0002091527696444493)
