2026-06-15 12:50:14,967 - optuna.study.study - INFO - Trial 136 finished with values: [0.06024092279536786, 0.008377989148636883, 0.03512144181075982] and parameters: {'n_layers': 1, 'embedding_dim': 96, 'lr': 0.0008138925204745388, 'lambda_val': 4.566471731928917e-05, 'batch_size': 789, 'optimizer': 'RMSprop'}.
2026-06-15 12:50:54,554 - experiment_functions - INFO - Early stopping at epoch 800. Best Metrics: (0.0949143738784304, 0.011663540759595418, 0.050441823555637796)
2026-06-15 12:50:54,632 - optuna.study.study - INFO - Trial 137 finished with values: [0.0949143738784304, 0.011663540759595418, 0.050441823555637796] and parameters: {'n_layers': 1, 'embedding_dim': 256, 'lr': 0.0030096858286544014, 'lambda_val': 4.6804655463952444e-05, 'batch_size': 3812, 'optimizer': 'Adam'}.
2026-06-15 12:51:17,466 - experiment_functions - INFO - Early stopping at epoch 500. Best Metrics: (0.0006053398989796294, 7.53566883247371e-05, 0.000298525741342726)
2026-06-15 12:51:17,553 - optuna.study.study - INFO - Trial 138 finished with values: [0.0006053398989796294, 7.53566883247371e-05, 0.000298525741342726] and parameters: {'n_layers': 4, 'embedding_dim': 64, 'lr': 0.0016086229224309184, 'lambda_val': 3.1553787251817323e-06, 'batch_size': 2219, 'optimizer': 'SGD'}.
2026-06-15 12:51:45,015 - experiment_functions - INFO - Early stopping at epoch 550. Best Metrics: (0.016678606928946724, 0.0019040123250050236, 0.007447752858918406)
2026-06-15 12:51:45,107 - optuna.study.study - INFO - Trial 139 finished with values: [0.016678606928946724, 0.0019040123250050236, 0.007447752858918406] and parameters: {'n_layers': 3, 'embedding_dim': 128, 'lr': 0.02593878803168038, 'lambda_val': 0.00812460381578991, 'batch_size': 2445, 'optimizer': 'Adam'}.
2026-06-15 12:55:30,877 - optuna.study.study - INFO - Trial 140 finished with values: [0.038252600296940935, 0.0046034563601044945, 0.01763242004011169] and parameters: {'n_layers': 3, 'embedding_dim': 256, 'lr': 0.0016086229224309184, 'lambda_val': 3.1553787251817323e-06, 'batch_size': 558, 'optimizer': 'Adam'}.
2026-06-15 12:55:57,231 - experiment_functions - INFO - Early stopping at epoch 600. Best Metrics: (0.06564152212949301, 0.008389711300154064, 0.03383039023882165)
2026-06-15 12:55:57,315 - optuna.study.study - INFO - Trial 141 finished with values: [0.06564152212949301, 0.008389711300154064, 0.03383039023882165] and parameters: {'n_layers': 1, 'embedding_dim': 96, 'lr': 0.01036324135738448, 'lambda_val': 1.8499653768568122e-06, 'batch_size': 2285, 'optimizer': 'Adam'}.
2026-06-15 13:00:04,706 - optuna.study.study - INFO - Trial 142 finished with values: [0.04728791168140122, 0.005328555161095854, 0.021466189928561745] and parameters: {'n_layers': 4, 'embedding_dim': 256, 'lr': 0.0056865752581316785, 'lambda_val': 7.267949834674351e-06, 'batch_size': 2193, 'optimizer': 'RMSprop'}.
2026-06-15 13:03:04,021 - optuna.study.study - INFO - Trial 143 finished with values: [0.004290969767818866, 0.0006865831602920491, 0.0021530387577497053] and parameters: {'n_layers': 4, 'embedding_dim': 96, 'lr': 7.769424078877792e-05, 'lambda_val': 0.0014666767049690977, 'batch_size': 3981, 'optimizer': 'RMSprop'}.
2026-06-15 13:03:38,431 - experiment_functions - INFO - Early stopping at epoch 800. Best Metrics: (0.06503847361053942, 0.008185410945140331, 0.0334646273939011)
2026-06-15 13:03:38,528 - optuna.study.study - INFO - Trial 144 finished with values: [0.06503847361053942, 0.008185410945140331, 0.0334646273939011] and parameters: {'n_layers': 2, 'embedding_dim': 64, 'lr': 0.0015713090624126847, 'lambda_val': 0.0016396245708417134, 'batch_size': 3609, 'optimizer': 'Adam'}.
2026-06-15 13:05:52,005 - experiment_functions - INFO - Early stopping at epoch 3000. Best Metrics: (0.0536809092347786, 0.006552682698104361, 0.026405859999009768)
2026-06-15 13:05:52,083 - optuna.study.study - INFO - Trial 145 finished with values: [0.0536809092347786, 0.006552682698104361, 0.026405859999009768] and parameters: {'n_layers': 3, 'embedding_dim': 96, 'lr': 0.0009437548244297628, 'lambda_val': 1.509459220212265e-05, 'batch_size': 1942, 'optimizer': 'RMSprop'}.
2026-06-15 13:06:21,928 - experiment_functions - INFO - Early stopping at epoch 500. Best Metrics: (0.0005421530988408646, 7.53566883247371e-05, 0.00025066570271730986)
2026-06-15 13:06:22,015 - optuna.study.study - INFO - Trial 146 finished with values: [0.0005421530988408646, 7.53566883247371e-05, 0.00025066570271730986] and parameters: {'n_layers': 3, 'embedding_dim': 256, 'lr': 3.940958233429784e-05, 'lambda_val': 0.009773477044297768, 'batch_size': 3360, 'optimizer': 'Adam'}.
2026-06-15 13:06:54,322 - experiment_functions - INFO - Early stopping at epoch 650. Best Metrics: (0.07919037689491144, 0.0100257887333378, 0.04226024248890786)
2026-06-15 13:06:54,433 - optuna.study.study - INFO - Trial 147 finished with values: [0.07919037689491144, 0.0100257887333378, 0.04226024248890786] and parameters: {'n_layers': 1, 'embedding_dim': 256, 'lr': 0.005616296548051391, 'lambda_val': 2.5476071418262236e-05, 'batch_size': 2434, 'optimizer': 'Adam'}.
2026-06-15 13:08:19,701 - experiment_functions - INFO - Early stopping at epoch 1950. Best Metrics: (0.044540968440337066, 0.005665148368946347, 0.02217914397399958)
2026-06-15 13:08:19,796 - optuna.study.study - INFO - Trial 148 finished with values: [0.044540968440337066, 0.005665148368946347, 0.02217914397399958] and parameters: {'n_layers': 4, 'embedding_dim': 64, 'lr': 0.0006397931509825065, 'lambda_val': 0.0013236495906126266, 'batch_size': 1273, 'optimizer': 'Adam'}.
2026-06-15 13:09:08,686 - experiment_functions - INFO - Early stopping at epoch 1250. Best Metrics: (0.048979251169853986, 0.00606872529975216, 0.02244560104331386)
2026-06-15 13:09:08,777 - optuna.study.study - INFO - Trial 149 finished with values: [0.048979251169853986, 0.00606872529975216, 0.02244560104331386] and parameters: {'n_layers': 1, 'embedding_dim': 32, 'lr': 0.0056865752581316785, 'lambda_val': 0.0008862120104873705, 'batch_size': 2193, 'optimizer': 'RMSprop'}.
2026-06-15 13:10:08,031 - experiment_functions - INFO - Early stopping at epoch 1300. Best Metrics: (0.05365054933915395, 0.006683300957867238, 0.026248489213283887)
2026-06-15 13:10:08,187 - optuna.study.study - INFO - Trial 150 finished with values: [0.05365054933915395, 0.006683300957867238, 0.026248489213283887] and parameters: {'n_layers': 3, 'embedding_dim': 96, 'lr': 0.0009437548244297628, 'lambda_val': 2.5476071418262236e-05, 'batch_size': 2193, 'optimizer': 'RMSprop'}.
2026-06-15 13:10:40,742 - experiment_functions - INFO - Early stopping at epoch 650. Best Metrics: (0.08807895290335173, 0.010987005157746667, 0.0467848970694807)
2026-06-15 13:10:40,832 - optuna.study.study - INFO - Trial 151 finished with values: [0.08807895290335173, 0.010987005157746667, 0.0467848970694807] and parameters: {'n_layers': 1, 'embedding_dim': 256, 'lr': 0.0056865752581316785, 'lambda_val': 2.549475670628784e-06, 'batch_size': 3697, 'optimizer': 'Adam'}.
2026-06-15 13:11:05,544 - experiment_functions - INFO - Early stopping at epoch 550. Best Metrics: (0.022422718755258284, 0.0025219371692678677, 0.010130806454330026)
2026-06-15 13:11:05,633 - optuna.study.study - INFO - Trial 152 finished with values: [0.022422718755258284, 0.0025219371692678677, 0.010130806454330026] and parameters: {'n_layers': 3, 'embedding_dim': 64, 'lr': 0.07951536735588935, 'lambda_val': 0.0005951423236529834, 'batch_size': 3624, 'optimizer': 'Adam'}.
2026-06-15 13:11:49,952 - experiment_functions - INFO - Early stopping at epoch 1100. Best Metrics: (0.08152398531318854, 0.009901868845870453, 0.042063217748193146)
2026-06-15 13:11:50,037 - optuna.study.study - INFO - Trial 153 finished with values: [0.08152398531318854, 0.009901868845870453, 0.042063217748193146] and parameters: {'n_layers': 1, 'embedding_dim': 32, 'lr': 0.0026397990430783503, 'lambda_val': 1.0723270203484857e-05, 'batch_size': 2768, 'optimizer': 'RMSprop'}.
2026-06-15 13:12:41,077 - experiment_functions - INFO - Early stopping at epoch 950. Best Metrics: (0.06778895859110874, 0.008490186884587046, 0.03403836011027013)
2026-06-15 13:12:41,163 - optuna.study.study - INFO - Trial 154 finished with values: [0.06778895859110874, 0.008490186884587046, 0.03403836011027013] and parameters: {'n_layers': 2, 'embedding_dim': 256, 'lr': 0.0009437548244297628, 'lambda_val': 0.002872624371953763, 'batch_size': 3527, 'optimizer': 'Adam'}.
2026-06-15 13:13:02,255 - experiment_functions - INFO - Early stopping at epoch 500. Best Metrics: (0.0003934325307285118, 6.363453680755576e-05, 0.00021313004710508585)
2026-06-15 13:13:02,350 - optuna.study.study - INFO - Trial 155 finished with values: [0.0003934325307285118, 6.363453680755576e-05, 0.00021313004710508585] and parameters: {'n_layers': 1, 'embedding_dim': 96, 'lr': 1.1082859117068168e-05, 'lambda_val': 4.566471731928917e-05, 'batch_size': 3989, 'optimizer': 'SGD'}.
2026-06-15 13:13:27,438 - experiment_functions - INFO - Early stopping at epoch 550. Best Metrics: (0.04891501669471978, 0.005696965637350125, 0.02259438938098305)
2026-06-15 13:13:27,514 - optuna.study.study - INFO - Trial 156 finished with values: [0.04891501669471978, 0.005696965637350125, 0.02259438938098305] and parameters: {'n_layers': 2, 'embedding_dim': 96, 'lr': 0.012420189739661592, 'lambda_val': 2.9677369546189456e-06, 'batch_size': 3981, 'optimizer': 'Adam'}.
2026-06-15 13:13:52,514 - experiment_functions - INFO - Early stopping at epoch 500. Best Metrics: (0.0005025937343413957, 8.540424676803538e-05, 0.00022974888015368696)
2026-06-15 13:13:52,614 - optuna.study.study - INFO - Trial 157 finished with values: [0.0005025937343413957, 8.540424676803538e-05, 0.00022974888015368696] and parameters: {'n_layers': 3, 'embedding_dim': 128, 'lr': 1.17512903873573e-05, 'lambda_val': 1.509459220212265e-05, 'batch_size': 1942, 'optimizer': 'Adam'}.
2026-06-15 13:16:33,694 - optuna.study.study - INFO - Trial 158 finished with values: [0.06673820260203259, 0.007907428494875744, 0.03183570069282382] and parameters: {'n_layers': 1, 'embedding_dim': 96, 'lr': 0.004300628102170609, 'lambda_val': 4.566471731928917e-05, 'batch_size': 789, 'optimizer': 'RMSprop'}.
2026-06-15 13:19:12,890 - optuna.study.study - INFO - Trial 159 finished with values: [0.03707159220118079, 0.004424274901199009, 0.01700253180345193] and parameters: {'n_layers': 2, 'embedding_dim': 64, 'lr': 0.004300628102170609, 'lambda_val': 0.0005161282305904154, 'batch_size': 2285, 'optimizer': 'RMSprop'}.
2026-06-15 13:19:56,801 - experiment_functions - INFO - Early stopping at epoch 900. Best Metrics: (0.09165409905465333, 0.011209726036573114, 0.048150576687476104)
2026-06-15 13:19:56,884 - optuna.study.study - INFO - Trial 160 finished with values: [0.09165409905465333, 0.011209726036573114, 0.048150576687476104] and parameters: {'n_layers': 1, 'embedding_dim': 256, 'lr': 0.0030096858286544014, 'lambda_val': 4.6804655463952444e-05, 'batch_size': 2193, 'optimizer': 'Adam'}.
2026-06-15 13:23:00,650 - optuna.study.study - INFO - Trial 161 finished with values: [0.0720954707674348, 0.008356219438676402, 0.03482473172995065] and parameters: {'n_layers': 1, 'embedding_dim': 256, 'lr': 0.0056865752581316785, 'lambda_val': 1.0723270203484857e-05, 'batch_size': 2768, 'optimizer': 'RMSprop'}.
2026-06-15 13:23:31,520 - experiment_functions - INFO - Early stopping at epoch 750. Best Metrics: (0.07606176197151797, 0.009493268135842992, 0.04014898908244584)
2026-06-15 13:23:31,610 - optuna.study.study - INFO - Trial 162 finished with values: [0.07606176197151797, 0.009493268135842992, 0.04014898908244584] and parameters: {'n_layers': 1, 'embedding_dim': 32, 'lr': 0.005616296548051391, 'lambda_val': 2.0471988586907107e-05, 'batch_size': 2572, 'optimizer': 'Adam'}.
2026-06-15 13:26:01,057 - optuna.study.study - INFO - Trial 163 finished with values: [0.037918375853015725, 0.005579744122178311, 0.021937212041728722] and parameters: {'n_layers': 1, 'embedding_dim': 32, 'lr': 0.00043484715658888686, 'lambda_val': 1.0723270203484857e-05, 'batch_size': 3981, 'optimizer': 'RMSprop'}.
2026-06-15 13:28:41,393 - optuna.study.study - INFO - Trial 164 finished with values: [0.09639803900004668, 0.012025252863554159, 0.05317912276821798] and parameters: {'n_layers': 1, 'embedding_dim': 64, 'lr': 0.0009437548244297628, 'lambda_val': 2.5476071418262236e-05, 'batch_size': 3624, 'optimizer': 'Adam'}.
2026-06-15 13:29:03,497 - experiment_functions - INFO - Early stopping at epoch 500. Best Metrics: (0.0007459033636821141, 9.210261906356757e-05, 0.00027651205636017827)
2026-06-15 13:29:03,585 - optuna.study.study - INFO - Trial 165 finished with values: [0.0007459033636821141, 9.210261906356757e-05, 0.00027651205636017827] and parameters: {'n_layers': 3, 'embedding_dim': 64, 'lr': 0.002964969604418604, 'lambda_val': 1.509459220212265e-05, 'batch_size': 3360, 'optimizer': 'SGD'}.
2026-06-15 13:29:54,355 - experiment_functions - INFO - Early stopping at epoch 1300. Best Metrics: (0.05356704542782935, 0.006589523745729789, 0.025402142860128395)
2026-06-15 13:29:54,456 - optuna.study.study - INFO - Trial 166 finished with values: [0.05356704542782935, 0.006589523745729789, 0.025402142860128395] and parameters: {'n_layers': 1, 'embedding_dim': 32, 'lr': 0.005616296548051391, 'lambda_val': 0.0016396245708417134, 'batch_size': 558, 'optimizer': 'Adam'}.
2026-06-15 13:30:26,901 - experiment_functions - INFO - Early stopping at epoch 650. Best Metrics: (0.08601876907336965, 0.010655435729117825, 0.046189904788245535)
2026-06-15 13:30:26,991 - optuna.study.study - INFO - Trial 167 finished with values: [0.08601876907336965, 0.010655435729117825, 0.046189904788245535] and parameters: {'n_layers': 1, 'embedding_dim': 256, 'lr': 0.005616296548051391, 'lambda_val': 2.0471988586907107e-05, 'batch_size': 3981, 'optimizer': 'Adam'}.
2026-06-15 13:31:02,841 - experiment_functions - INFO - Early stopping at epoch 850. Best Metrics: (0.08285182447730798, 0.00999899524415567, 0.04319393397275351)
2026-06-15 13:31:03,633 - optuna.study.study - INFO - Trial 168 finished with values: [0.08285182447730798, 0.00999899524415567, 0.04319393397275351] and parameters: {'n_layers': 1, 'embedding_dim': 64, 'lr': 0.0026397990430783503, 'lambda_val': 1.0723270203484857e-05, 'batch_size': 3624, 'optimizer': 'RMSprop'}.
2026-06-15 13:34:02,847 - optuna.study.study - INFO - Trial 169 finished with values: [0.06734740893201635, 0.008237323330430707, 0.033988276540072804] and parameters: {'n_layers': 3, 'embedding_dim': 96, 'lr': 0.0008138925204745388, 'lambda_val': 4.566471731928917e-05, 'batch_size': 1438, 'optimizer': 'Adam'}.
2026-06-15 13:34:23,851 - experiment_functions - INFO - Early stopping at epoch 500. Best Metrics: (0.00046200418076465776, 7.703128139862015e-05, 0.0002186409369380209)
2026-06-15 13:34:23,939 - optuna.study.study - INFO - Trial 170 finished with values: [0.00046200418076465776, 7.703128139862015e-05, 0.0002186409369380209] and parameters: {'n_layers': 3, 'embedding_dim': 32, 'lr': 0.0026397990430783503, 'lambda_val': 0.002872624371953763, 'batch_size': 558, 'optimizer': 'SGD'}.
2026-06-15 13:35:27,170 - experiment_functions - INFO - Early stopping at epoch 1400. Best Metrics: (0.04607786611125675, 0.005641704065911983, 0.022338755671378066)
2026-06-15 13:35:27,253 - optuna.study.study - INFO - Trial 171 finished with values: [0.04607786611125675, 0.005641704065911983, 0.022338755671378066] and parameters: {'n_layers': 3, 'embedding_dim': 96, 'lr': 0.0009437548244297628, 'lambda_val': 0.0010727529637308995, 'batch_size': 1942, 'optimizer': 'RMSprop'}.
2026-06-15 13:36:57,999 - experiment_functions - INFO - Early stopping at epoch 2450. Best Metrics: (0.023882115925112416, 0.003168330095786724, 0.010629828067616169)
2026-06-15 13:36:58,102 - optuna.study.study - INFO - Trial 172 finished with values: [0.023882115925112416, 0.003168330095786724, 0.010629828067616169] and parameters: {'n_layers': 1, 'embedding_dim': 32, 'lr': 0.0018921194607502668, 'lambda_val': 0.0640995033203339, 'batch_size': 722, 'optimizer': 'Adam'}.
2026-06-15 13:37:51,251 - experiment_functions - INFO - Early stopping at epoch 1000. Best Metrics: (0.05784379254445726, 0.006802197066112936, 0.026981550777633364)
2026-06-15 13:37:51,340 - optuna.study.study - INFO - Trial 173 finished with values: [0.05784379254445726, 0.006802197066112936, 0.026981550777633364] and parameters: {'n_layers': 2, 'embedding_dim': 256, 'lr': 0.0016086229224309184, 'lambda_val': 5.226116427866932e-06, 'batch_size': 3609, 'optimizer': 'RMSprop'}.
2026-06-15 13:38:26,047 - experiment_functions - INFO - Early stopping at epoch 700. Best Metrics: (0.08210363382686268, 0.01004253466407663, 0.04240024942847412)
2026-06-15 13:38:26,893 - optuna.study.study - INFO - Trial 174 finished with values: [0.08210363382686268, 0.01004253466407663, 0.04240024942847412] and parameters: {'n_layers': 1, 'embedding_dim': 256, 'lr': 0.005616296548051391, 'lambda_val': 1.0723270203484857e-05, 'batch_size': 2285, 'optimizer': 'Adam'}.
2026-06-15 13:41:54,004 - optuna.study.study - INFO - Trial 175 finished with values: [0.08807986558561358, 0.010861410677205438, 0.047994430780661165] and parameters: {'n_layers': 2, 'embedding_dim': 256, 'lr': 0.00044819859318088583, 'lambda_val': 0.00013972282445432241, 'batch_size': 2285, 'optimizer': 'RMSprop'}.
2026-06-15 13:42:48,359 - experiment_functions - INFO - Early stopping at epoch 1150. Best Metrics: (0.06782459537359521, 0.007957666287092238, 0.03287975437397549)
2026-06-15 13:42:48,443 - optuna.study.study - INFO - Trial 176 finished with values: [0.06782459537359521, 0.007957666287092238, 0.03287975437397549] and parameters: {'n_layers': 1, 'embedding_dim': 256, 'lr': 0.0026397990430783503, 'lambda_val': 0.0009998560612439528, 'batch_size': 1654, 'optimizer': 'RMSprop'}.
2026-06-15 13:45:29,313 - optuna.study.study - INFO - Trial 177 finished with values: [0.06579503692756827, 0.0075524147632125395, 0.03133028089035148] and parameters: {'n_layers': 1, 'embedding_dim': 96, 'lr': 0.005616296548051391, 'lambda_val': 2.0471988586907107e-05, 'batch_size': 2285, 'optimizer': 'RMSprop'}.
2026-06-15 13:48:09,328 - experiment_functions - INFO - Early stopping at epoch 3900. Best Metrics: (0.05639549814540928, 0.00677205439078304, 0.02690263350178424)
2026-06-15 13:48:09,406 - optuna.study.study - INFO - Trial 178 finished with values: [0.05639549814540928, 0.00677205439078304, 0.02690263350178424] and parameters: {'n_layers': 1, 'embedding_dim': 128, 'lr': 0.007264999721759937, 'lambda_val': 0.0002014587319781766, 'batch_size': 558, 'optimizer': 'RMSprop'}.
2026-06-15 13:48:35,851 - experiment_functions - INFO - Early stopping at epoch 650. Best Metrics: (0.00046777623795704777, 6.86583160292049e-05, 0.00019482196549555977)
2026-06-15 13:48:35,932 - optuna.study.study - INFO - Trial 179 finished with values: [0.00046777623795704777, 6.86583160292049e-05, 0.00019482196549555977] and parameters: {'n_layers': 3, 'embedding_dim': 32, 'lr': 2.787394365795939e-05, 'lambda_val': 4.566471731928917e-05, 'batch_size': 789, 'optimizer': 'Adam'}.
2026-06-15 13:51:38,893 - optuna.study.study - INFO - Trial 180 finished with values: [0.07941160859442767, 0.010498023980172818, 0.04503842804462944] and parameters: {'n_layers': 1, 'embedding_dim': 256, 'lr': 0.0008138925204745388, 'lambda_val': 7.267949834674351e-06, 'batch_size': 789, 'optimizer': 'RMSprop'}.
2026-06-15 13:52:19,438 - experiment_functions - INFO - Early stopping at epoch 1000. Best Metrics: (0.07903796374522629, 0.009665751222452945, 0.04087153196036788)
2026-06-15 13:52:19,522 - optuna.study.study - INFO - Trial 181 finished with values: [0.07903796374522629, 0.009665751222452945, 0.04087153196036788] and parameters: {'n_layers': 1, 'embedding_dim': 32, 'lr': 0.0026397990430783503, 'lambda_val': 1.0723270203484857e-05, 'batch_size': 2768, 'optimizer': 'RMSprop'}.
2026-06-15 13:52:49,017 - experiment_functions - INFO - Early stopping at epoch 700. Best Metrics: (0.07653917877652096, 0.009705941456226138, 0.039291534986994905)
2026-06-15 13:52:49,099 - optuna.study.study - INFO - Trial 182 finished with values: [0.07653917877652096, 0.009705941456226138, 0.039291534986994905] and parameters: {'n_layers': 1, 'embedding_dim': 64, 'lr': 0.004300628102170609, 'lambda_val': 0.002872624371953763, 'batch_size': 3991, 'optimizer': 'Adam'}.
2026-06-15 13:53:21,717 - experiment_functions - INFO - Early stopping at epoch 650. Best Metrics: (0.08128167914142322, 0.01030712036975015, 0.04364563731743149)
2026-06-15 13:53:21,813 - optuna.study.study - INFO - Trial 183 finished with values: [0.08128167914142322, 0.01030712036975015, 0.04364563731743149] and parameters: {'n_layers': 1, 'embedding_dim': 256, 'lr': 0.005616296548051391, 'lambda_val': 2.5476071418262236e-05, 'batch_size': 2434, 'optimizer': 'Adam'}.
2026-06-15 13:54:03,143 - experiment_functions - INFO - Early stopping at epoch 950. Best Metrics: (0.049268035048862374, 0.006281398620135307, 0.024182651703906665)
2026-06-15 13:54:03,722 - optuna.study.study - INFO - Trial 184 finished with values: [0.049268035048862374, 0.006281398620135307, 0.024182651703906665] and parameters: {'n_layers': 3, 'embedding_dim': 64, 'lr': 0.0009437548244297628, 'lambda_val': 0.002872624371953763, 'batch_size': 3026, 'optimizer': 'Adam'}.
2026-06-15 13:57:27,789 - optuna.study.study - INFO - Trial 185 finished with values: [0.057594621355693355, 0.00659622211802532, 0.027078370997350287] and parameters: {'n_layers': 2, 'embedding_dim': 256, 'lr': 0.004300628102170609, 'lambda_val': 1.0723270203484857e-05, 'batch_size': 1590, 'optimizer': 'RMSprop'}.
2026-06-15 13:57:51,136 - experiment_functions - INFO - Early stopping at epoch 500. Best Metrics: (0.0004236835706229433, 7.53566883247371e-05, 0.00019880122965423996)
