2026-06-15 04:57:52,311 - optuna.study.study - INFO - Trial 93 finished with values: [0.0004841776491461732, 8.372965369415233e-05, 0.00022927103525192976] and parameters: {'n_layers': 1, 'embedding_dim': 256, 'lr': 1.9343927222008687e-05, 'lambda_val': 1.8315231601394665e-05, 'batch_size': 2018, 'optimizer': 'RMSprop'}.
2026-06-15 05:01:57,029 - optuna.study.study - INFO - Trial 94 finished with values: [0.015422402898224628, 0.0018420523812713511, 0.007112452859844867] and parameters: {'n_layers': 4, 'embedding_dim': 256, 'lr': 0.00042036659412149157, 'lambda_val': 0.01679036251486879, 'batch_size': 536, 'optimizer': 'RMSprop'}.
2026-06-15 05:02:22,504 - experiment_functions - INFO - Early stopping at epoch 550. Best Metrics: (0.006957445064072521, 0.0008038046754638622, 0.0032935788565047084)
2026-06-15 05:02:22,589 - optuna.study.study - INFO - Trial 95 finished with values: [0.006957445064072521, 0.0008038046754638622, 0.0032935788565047084] and parameters: {'n_layers': 4, 'embedding_dim': 64, 'lr': 0.04226961608248332, 'lambda_val': 0.031398699991095395, 'batch_size': 2815, 'optimizer': 'Adam'}.
2026-06-15 05:02:44,270 - experiment_functions - INFO - Early stopping at epoch 500. Best Metrics: (0.00025819381595460216, 6.865831602920491e-05, 0.00015709124444903964)
2026-06-15 05:02:44,361 - optuna.study.study - INFO - Trial 96 finished with values: [0.00025819381595460216, 6.865831602920491e-05, 0.00015709124444903964] and parameters: {'n_layers': 4, 'embedding_dim': 32, 'lr': 0.01930529051255257, 'lambda_val': 0.0022004607531230847, 'batch_size': 838, 'optimizer': 'SGD'}.
2026-06-15 05:06:01,651 - optuna.study.study - INFO - Trial 97 finished with values: [0.03594956594000532, 0.00366066045950834, 0.016045146887402547] and parameters: {'n_layers': 4, 'embedding_dim': 128, 'lr': 0.01996792465326568, 'lambda_val': 4.768107725372831e-05, 'batch_size': 2519, 'optimizer': 'Adam'}.
2026-06-15 05:06:23,818 - experiment_functions - INFO - Early stopping at epoch 500. Best Metrics: (0.0004411856361877358, 7.53566883247371e-05, 0.00022876353433965886)
2026-06-15 05:06:23,882 - optuna.study.study - INFO - Trial 98 finished with values: [0.0004411856361877358, 7.53566883247371e-05, 0.00022876353433965886] and parameters: {'n_layers': 2, 'embedding_dim': 96, 'lr': 0.008659240096051431, 'lambda_val': 2.1440662329192717e-05, 'batch_size': 3067, 'optimizer': 'SGD'}.
2026-06-15 05:07:02,758 - experiment_functions - INFO - Early stopping at epoch 900. Best Metrics: (0.09058982100839888, 0.011114274231361779, 0.04874325774707792)
2026-06-15 05:07:02,819 - optuna.study.study - INFO - Trial 99 finished with values: [0.09058982100839888, 0.011114274231361779, 0.04874325774707792] and parameters: {'n_layers': 1, 'embedding_dim': 96, 'lr': 0.0034561838290846068, 'lambda_val': 2.576804591367387e-06, 'batch_size': 2304, 'optimizer': 'Adam'}.
2026-06-15 05:07:47,317 - experiment_functions - INFO - Early stopping at epoch 950. Best Metrics: (0.07785870546220167, 0.009416236854444369, 0.040099603404919755)
2026-06-15 05:07:47,381 - optuna.study.study - INFO - Trial 100 finished with values: [0.07785870546220167, 0.009416236854444369, 0.040099603404919755] and parameters: {'n_layers': 2, 'embedding_dim': 128, 'lr': 0.0013791261484811378, 'lambda_val': 4.057584482779664e-06, 'batch_size': 3996, 'optimizer': 'Adam'}.
2026-06-15 05:08:33,943 - experiment_functions - INFO - Early stopping at epoch 1000. Best Metrics: (0.07334355068497807, 0.009067921495076696, 0.03801157038851934)
2026-06-15 05:08:34,014 - optuna.study.study - INFO - Trial 101 finished with values: [0.07334355068497807, 0.009067921495076696, 0.03801157038851934] and parameters: {'n_layers': 2, 'embedding_dim': 128, 'lr': 0.0016188619661959155, 'lambda_val': 2.1444803413213676e-05, 'batch_size': 1383, 'optimizer': 'Adam'}.
2026-06-15 05:10:27,472 - experiment_functions - INFO - Early stopping at epoch 2650. Best Metrics: (0.09682118001265577, 0.011926451872195055, 0.051501075639692286)
2026-06-15 05:10:27,622 - optuna.study.study - INFO - Trial 102 finished with values: [0.09682118001265577, 0.011926451872195055, 0.051501075639692286] and parameters: {'n_layers': 1, 'embedding_dim': 128, 'lr': 0.0016748417327479524, 'lambda_val': 0.00036402541279450417, 'batch_size': 1243, 'optimizer': 'Adam'}.
2026-06-15 05:13:18,892 - optuna.study.study - INFO - Trial 103 finished with values: [0.10452576554834554, 0.012904414227342753, 0.05751887675461363] and parameters: {'n_layers': 1, 'embedding_dim': 128, 'lr': 0.0013635493562820199, 'lambda_val': 1.722502032465723e-05, 'batch_size': 1670, 'optimizer': 'Adam'}.
2026-06-15 05:13:43,450 - experiment_functions - INFO - Early stopping at epoch 550. Best Metrics: (0.024563649269028612, 0.0027764753164980912, 0.011316424106416789)
2026-06-15 05:13:43,532 - optuna.study.study - INFO - Trial 104 finished with values: [0.024563649269028612, 0.0027764753164980912, 0.011316424106416789] and parameters: {'n_layers': 3, 'embedding_dim': 64, 'lr': 0.0467259088974229, 'lambda_val': 0.00010936849207517709, 'batch_size': 1126, 'optimizer': 'RMSprop'}.
2026-06-15 05:14:15,529 - experiment_functions - INFO - Early stopping at epoch 600. Best Metrics: (0.0391809143588242, 0.00478263781900998, 0.01808829540873764)
2026-06-15 05:14:15,598 - optuna.study.study - INFO - Trial 105 finished with values: [0.0391809143588242, 0.00478263781900998, 0.01808829540873764] and parameters: {'n_layers': 4, 'embedding_dim': 128, 'lr': 0.002500554323958941, 'lambda_val': 1.387274745987136e-05, 'batch_size': 3067, 'optimizer': 'Adam'}.
2026-06-15 05:14:57,998 - experiment_functions - INFO - Early stopping at epoch 950. Best Metrics: (0.038179137735850834, 0.004250117221515172, 0.018573285986884555)
2026-06-15 05:14:58,084 - optuna.study.study - INFO - Trial 106 finished with values: [0.038179137735850834, 0.004250117221515172, 0.018573285986884555] and parameters: {'n_layers': 2, 'embedding_dim': 96, 'lr': 0.0213550178381265, 'lambda_val': 2.200390261864473e-05, 'batch_size': 3009, 'optimizer': 'RMSprop'}.
2026-06-15 05:15:38,237 - experiment_functions - INFO - Early stopping at epoch 900. Best Metrics: (0.09008342597574336, 0.011038917543037043, 0.04845031161362884)
2026-06-15 05:15:39,050 - optuna.study.study - INFO - Trial 107 finished with values: [0.09008342597574336, 0.011038917543037043, 0.04845031161362884] and parameters: {'n_layers': 1, 'embedding_dim': 128, 'lr': 0.0031673995217555086, 'lambda_val': 1.722502032465723e-05, 'batch_size': 2363, 'optimizer': 'Adam'}.
2026-06-15 05:16:28,038 - experiment_functions - INFO - Early stopping at epoch 1100. Best Metrics: (0.06824014855629394, 0.008269140598834485, 0.0351441090363126)
2026-06-15 05:16:28,125 - optuna.study.study - INFO - Trial 108 finished with values: [0.06824014855629394, 0.008269140598834485, 0.0351441090363126] and parameters: {'n_layers': 2, 'embedding_dim': 96, 'lr': 0.001230678069228945, 'lambda_val': 1.2492162876084175e-05, 'batch_size': 1670, 'optimizer': 'RMSprop'}.
2026-06-15 05:17:36,544 - experiment_functions - INFO - Early stopping at epoch 1650. Best Metrics: (0.022953289245232735, 0.0029690535199946417, 0.011442523455527135)
2026-06-15 05:17:36,630 - optuna.study.study - INFO - Trial 109 finished with values: [0.022953289245232735, 0.0029690535199946417, 0.011442523455527135] and parameters: {'n_layers': 1, 'embedding_dim': 128, 'lr': 0.022317160745325176, 'lambda_val': 1.2492162876084175e-05, 'batch_size': 2318, 'optimizer': 'RMSprop'}.
2026-06-15 05:18:09,321 - experiment_functions - INFO - Early stopping at epoch 700. Best Metrics: (0.029405665211463494, 0.003236988411815929, 0.013303459357860776)
2026-06-15 05:18:09,392 - optuna.study.study - INFO - Trial 110 finished with values: [0.029405665211463494, 0.003236988411815929, 0.013303459357860776] and parameters: {'n_layers': 2, 'embedding_dim': 128, 'lr': 0.0213550178381265, 'lambda_val': 0.0007531818922155074, 'batch_size': 2519, 'optimizer': 'Adam'}.
2026-06-15 05:18:34,319 - experiment_functions - INFO - Early stopping at epoch 550. Best Metrics: (0.05076230960511012, 0.006289771585504722, 0.025575300114310567)
2026-06-15 05:18:34,699 - optuna.study.study - INFO - Trial 111 finished with values: [0.05076230960511012, 0.006289771585504722, 0.025575300114310567] and parameters: {'n_layers': 1, 'embedding_dim': 128, 'lr': 0.01996792465326568, 'lambda_val': 4.768107725372831e-05, 'batch_size': 2756, 'optimizer': 'Adam'}.
2026-06-15 05:21:09,737 - optuna.study.study - INFO - Trial 112 finished with values: [0.004510857384326244, 0.0008305981646459911, 0.0027115275285842437] and parameters: {'n_layers': 1, 'embedding_dim': 96, 'lr': 0.00037329899863237156, 'lambda_val': 1.2492162876084175e-05, 'batch_size': 1126, 'optimizer': 'RMSprop'}.
2026-06-15 05:23:57,468 - optuna.study.study - INFO - Trial 113 finished with values: [0.027050662535200637, 0.004069261169535803, 0.015181950831871658] and parameters: {'n_layers': 2, 'embedding_dim': 96, 'lr': 0.00035751122245203187, 'lambda_val': 2.576804591367387e-06, 'batch_size': 956, 'optimizer': 'Adam'}.
2026-06-15 05:24:34,532 - experiment_functions - INFO - Early stopping at epoch 600. Best Metrics: (0.05252129225689919, 0.00639862013530712, 0.024916974436386942)
2026-06-15 05:24:34,653 - optuna.study.study - INFO - Trial 114 finished with values: [0.05252129225689919, 0.00639862013530712, 0.024916974436386942] and parameters: {'n_layers': 3, 'embedding_dim': 256, 'lr': 0.002500554323958941, 'lambda_val': 0.00010936849207517709, 'batch_size': 3067, 'optimizer': 'Adam'}.
2026-06-15 05:25:02,408 - experiment_functions - INFO - Early stopping at epoch 550. Best Metrics: (0.027400175037718248, 0.00318842521267332, 0.012789947618056957)
2026-06-15 05:25:02,497 - optuna.study.study - INFO - Trial 115 finished with values: [0.027400175037718248, 0.00318842521267332, 0.012789947618056957] and parameters: {'n_layers': 4, 'embedding_dim': 96, 'lr': 0.0570467104634475, 'lambda_val': 4.768107725372831e-05, 'batch_size': 1392, 'optimizer': 'Adam'}.
2026-06-15 05:26:25,971 - experiment_functions - INFO - Early stopping at epoch 1300. Best Metrics: (0.0338899609105897, 0.003963761805881171, 0.015414733423943104)
2026-06-15 05:26:26,060 - optuna.study.study - INFO - Trial 116 finished with values: [0.0338899609105897, 0.003963761805881171, 0.015414733423943104] and parameters: {'n_layers': 4, 'embedding_dim': 256, 'lr': 0.0031668054510016214, 'lambda_val': 1.722502032465723e-05, 'batch_size': 2363, 'optimizer': 'Adam'}.
2026-06-15 05:29:09,384 - optuna.study.study - INFO - Trial 117 finished with values: [0.050122627259816574, 0.0062144148971799845, 0.024578010245398234] and parameters: {'n_layers': 4, 'embedding_dim': 32, 'lr': 0.00035751122245203187, 'lambda_val': 0.0003193434431604667, 'batch_size': 2538, 'optimizer': 'Adam'}.
2026-06-15 05:30:14,581 - experiment_functions - INFO - Early stopping at epoch 1250. Best Metrics: (0.013042996969664423, 0.0015305780695291046, 0.005682947429556669)
2026-06-15 05:30:14,663 - optuna.study.study - INFO - Trial 118 finished with values: [0.013042996969664423, 0.0015305780695291046, 0.005682947429556669] and parameters: {'n_layers': 2, 'embedding_dim': 256, 'lr': 0.0016188619661959155, 'lambda_val': 0.07704299434119273, 'batch_size': 1085, 'optimizer': 'Adam'}.
2026-06-15 05:31:37,139 - experiment_functions - INFO - Early stopping at epoch 2100. Best Metrics: (0.03070317559458692, 0.003414495277647532, 0.01405089205286898)
2026-06-15 05:31:37,225 - optuna.study.study - INFO - Trial 119 finished with values: [0.03070317559458692, 0.003414495277647532, 0.01405089205286898] and parameters: {'n_layers': 2, 'embedding_dim': 32, 'lr': 0.01930529051255257, 'lambda_val': 4.057584482779664e-06, 'batch_size': 1392, 'optimizer': 'Adam'}.
2026-06-15 05:32:13,353 - experiment_functions - INFO - Early stopping at epoch 800. Best Metrics: (0.011814115194378536, 0.0015188559180119232, 0.005152811323743757)
2026-06-15 05:32:13,426 - optuna.study.study - INFO - Trial 120 finished with values: [0.011814115194378536, 0.0015188559180119232, 0.005152811323743757] and parameters: {'n_layers': 4, 'embedding_dim': 64, 'lr': 0.0013635493562820199, 'lambda_val': 0.031398699991095395, 'batch_size': 1670, 'optimizer': 'Adam'}.
2026-06-15 05:32:43,850 - experiment_functions - INFO - Early stopping at epoch 500. Best Metrics: (0.018185323221977034, 0.001949226337999866, 0.008698082591190839)
2026-06-15 05:32:43,932 - optuna.study.study - INFO - Trial 121 finished with values: [0.018185323221977034, 0.001949226337999866, 0.008698082591190839] and parameters: {'n_layers': 3, 'embedding_dim': 256, 'lr': 0.03659780932790059, 'lambda_val': 0.004367100927407441, 'batch_size': 3374, 'optimizer': 'RMSprop'}.
2026-06-15 05:34:38,323 - experiment_functions - INFO - Early stopping at epoch 2400. Best Metrics: (0.04173747795962104, 0.005186214749815794, 0.020263554246167794)
2026-06-15 05:34:38,399 - optuna.study.study - INFO - Trial 122 finished with values: [0.04173747795962104, 0.005186214749815794, 0.020263554246167794] and parameters: {'n_layers': 4, 'embedding_dim': 96, 'lr': 0.0013635493562820199, 'lambda_val': 2.1444803413213676e-05, 'batch_size': 1402, 'optimizer': 'Adam'}.
2026-06-15 05:35:25,772 - experiment_functions - INFO - Early stopping at epoch 1050. Best Metrics: (0.09215392226807985, 0.011268336794159018, 0.04866386661986741)
2026-06-15 05:35:25,855 - optuna.study.study - INFO - Trial 123 finished with values: [0.09215392226807985, 0.011268336794159018, 0.04866386661986741] and parameters: {'n_layers': 1, 'embedding_dim': 128, 'lr': 0.002403322646261187, 'lambda_val': 0.0003193434431604667, 'batch_size': 2538, 'optimizer': 'Adam'}.
2026-06-15 05:35:52,805 - experiment_functions - INFO - Early stopping at epoch 500. Best Metrics: (0.030788562094405458, 0.003498224931341684, 0.014382743928644203)
2026-06-15 05:35:52,885 - optuna.study.study - INFO - Trial 124 finished with values: [0.030788562094405458, 0.003498224931341684, 0.014382743928644203] and parameters: {'n_layers': 4, 'embedding_dim': 128, 'lr': 0.0570467104634475, 'lambda_val': 4.768107725372831e-05, 'batch_size': 1126, 'optimizer': 'RMSprop'}.
2026-06-15 05:36:22,200 - experiment_functions - INFO - Early stopping at epoch 550. Best Metrics: (0.01906318800011488, 0.0022205104159689197, 0.008746028310743153)
2026-06-15 05:36:22,307 - optuna.study.study - INFO - Trial 125 finished with values: [0.01906318800011488, 0.0022205104159689197, 0.008746028310743153] and parameters: {'n_layers': 4, 'embedding_dim': 128, 'lr': 0.0570467104634475, 'lambda_val': 0.0015940172263239829, 'batch_size': 1383, 'optimizer': 'Adam'}.
2026-06-15 05:37:01,909 - experiment_functions - INFO - Early stopping at epoch 900. Best Metrics: (0.09033264451272667, 0.010966910040860072, 0.04891641408207562)
2026-06-15 05:37:02,006 - optuna.study.study - INFO - Trial 126 finished with values: [0.09033264451272667, 0.010966910040860072, 0.04891641408207562] and parameters: {'n_layers': 1, 'embedding_dim': 96, 'lr': 0.0031668054510016214, 'lambda_val': 1.722502032465723e-05, 'batch_size': 3062, 'optimizer': 'Adam'}.
2026-06-15 05:37:39,652 - experiment_functions - INFO - Early stopping at epoch 900. Best Metrics: (0.05679143683389125, 0.0069378391050974614, 0.027985238767574055)
2026-06-15 05:37:39,743 - optuna.study.study - INFO - Trial 127 finished with values: [0.05679143683389125, 0.0069378391050974614, 0.027985238767574055] and parameters: {'n_layers': 2, 'embedding_dim': 32, 'lr': 0.0016188619661959155, 'lambda_val': 3.730092649254184e-05, 'batch_size': 2750, 'optimizer': 'RMSprop'}.
2026-06-15 05:38:12,274 - experiment_functions - INFO - Early stopping at epoch 700. Best Metrics: (0.03037495367299532, 0.0038348181391921763, 0.014596391515979261)
2026-06-15 05:38:12,383 - optuna.study.study - INFO - Trial 128 finished with values: [0.03037495367299532, 0.0038348181391921763, 0.014596391515979261] and parameters: {'n_layers': 4, 'embedding_dim': 64, 'lr': 0.0017219538258829313, 'lambda_val': 0.004367100927407441, 'batch_size': 2468, 'optimizer': 'Adam'}.
2026-06-15 05:39:31,310 - experiment_functions - INFO - Early stopping at epoch 1900. Best Metrics: (0.08910084804316887, 0.010678880032152185, 0.04597635485231433)
2026-06-15 05:39:31,382 - optuna.study.study - INFO - Trial 129 finished with values: [0.08910084804316887, 0.010678880032152185, 0.04597635485231433] and parameters: {'n_layers': 1, 'embedding_dim': 64, 'lr': 0.0019049517999197474, 'lambda_val': 1.2492162876084175e-05, 'batch_size': 3123, 'optimizer': 'RMSprop'}.
2026-06-15 05:40:40,815 - experiment_functions - INFO - Early stopping at epoch 1700. Best Metrics: (0.035660415202067766, 0.004313751758322728, 0.017176109296769777)
2026-06-15 05:40:40,901 - optuna.study.study - INFO - Trial 130 finished with values: [0.035660415202067766, 0.004313751758322728, 0.017176109296769777] and parameters: {'n_layers': 1, 'embedding_dim': 96, 'lr': 0.017221400491445694, 'lambda_val': 3.385899724058381e-05, 'batch_size': 1491, 'optimizer': 'RMSprop'}.
2026-06-15 05:43:23,784 - optuna.study.study - INFO - Trial 131 finished with values: [0.01640564296856802, 0.002736285082724898, 0.00978506417104129] and parameters: {'n_layers': 1, 'embedding_dim': 128, 'lr': 0.00037329899863237156, 'lambda_val': 1.722502032465723e-05, 'batch_size': 2363, 'optimizer': 'Adam'}.
2026-06-15 05:46:40,009 - experiment_functions - INFO - Early stopping at epoch 3400. Best Metrics: (0.04638343284494915, 0.004802732935896577, 0.020915295791269987)
2026-06-15 05:46:40,086 - optuna.study.study - INFO - Trial 132 finished with values: [0.04638343284494915, 0.004802732935896577, 0.020915295791269987] and parameters: {'n_layers': 3, 'embedding_dim': 256, 'lr': 0.008348690425646019, 'lambda_val': 7.45778035452632e-06, 'batch_size': 3700, 'optimizer': 'Adam'}.
2026-06-15 05:47:37,734 - experiment_functions - INFO - Early stopping at epoch 1250. Best Metrics: (0.0358399692533765, 0.004266863152254003, 0.016794146219657104)
2026-06-15 05:47:37,807 - optuna.study.study - INFO - Trial 133 finished with values: [0.0358399692533765, 0.004266863152254003, 0.016794146219657104] and parameters: {'n_layers': 3, 'embedding_dim': 96, 'lr': 0.002500554323958941, 'lambda_val': 4.1441541348192956e-05, 'batch_size': 3067, 'optimizer': 'RMSprop'}.
2026-06-15 05:48:40,776 - experiment_functions - INFO - Early stopping at epoch 1500. Best Metrics: (0.0966194015874454, 0.011628374305043874, 0.05239812281179185)
2026-06-15 05:48:40,850 - optuna.study.study - INFO - Trial 134 finished with values: [0.0966194015874454, 0.011628374305043874, 0.05239812281179185] and parameters: {'n_layers': 1, 'embedding_dim': 64, 'lr': 0.002403322646261187, 'lambda_val': 4.768107725372831e-05, 'batch_size': 2519, 'optimizer': 'Adam'}.
2026-06-15 05:51:15,998 - experiment_functions - INFO - Early stopping at epoch 3900. Best Metrics: (0.033160833014139565, 0.004149641637082189, 0.015011752023507068)
2026-06-15 05:51:16,076 - optuna.study.study - INFO - Trial 135 finished with values: [0.033160833014139565, 0.004149641637082189, 0.015011752023507068] and parameters: {'n_layers': 1, 'embedding_dim': 96, 'lr': 0.08225798167082751, 'lambda_val': 0.004367100927407441, 'batch_size': 4084, 'optimizer': 'RMSprop'}.
2026-06-15 05:53:34,598 - experiment_functions - INFO - Early stopping at epoch 2900. Best Metrics: (0.09996417551536996, 0.01194989617522942, 0.05095320357483342)
2026-06-15 05:53:34,696 - optuna.study.study - INFO - Trial 136 finished with values: [0.09996417551536996, 0.01194989617522942, 0.05095320357483342] and parameters: {'n_layers': 1, 'embedding_dim': 256, 'lr': 0.0016748417327479524, 'lambda_val': 6.096576799304491e-06, 'batch_size': 1243, 'optimizer': 'RMSprop'}.
2026-06-15 05:54:19,332 - experiment_functions - INFO - Early stopping at epoch 950. Best Metrics: (0.04962666345869941, 0.005964900529171411, 0.023719754368587077)
2026-06-15 05:54:19,420 - optuna.study.study - INFO - Trial 137 finished with values: [0.04962666345869941, 0.005964900529171411, 0.023719754368587077] and parameters: {'n_layers': 3, 'embedding_dim': 96, 'lr': 0.0013635493562820199, 'lambda_val': 0.0007531818922155074, 'batch_size': 1670, 'optimizer': 'Adam'}.
2026-06-15 05:55:03,224 - experiment_functions - INFO - Early stopping at epoch 1000. Best Metrics: (0.08426741084929641, 0.010029137919485566, 0.04332280305597328)
2026-06-15 05:55:03,304 - optuna.study.study - INFO - Trial 138 finished with values: [0.08426741084929641, 0.010029137919485566, 0.04332280305597328] and parameters: {'n_layers': 1, 'embedding_dim': 96, 'lr': 0.002403322646261187, 'lambda_val': 1.722502032465723e-05, 'batch_size': 4084, 'optimizer': 'RMSprop'}.
2026-06-15 05:55:54,374 - experiment_functions - INFO - Early stopping at epoch 1150. Best Metrics: (0.0806263845309902, 0.010044209257150513, 0.0419276909025752)
2026-06-15 05:55:54,463 - optuna.study.study - INFO - Trial 139 finished with values: [0.0806263845309902, 0.010044209257150513, 0.0419276909025752] and parameters: {'n_layers': 1, 'embedding_dim': 128, 'lr': 0.0013399936052392054, 'lambda_val': 0.0020014727227486086, 'batch_size': 2519, 'optimizer': 'RMSprop'}.
2026-06-15 05:56:30,543 - experiment_functions - INFO - Early stopping at epoch 800. Best Metrics: (0.05123679074559666, 0.006323263446982383, 0.024575061773885225)
2026-06-15 05:56:31,423 - optuna.study.study - INFO - Trial 140 finished with values: [0.05123679074559666, 0.006323263446982383, 0.024575061773885225] and parameters: {'n_layers': 3, 'embedding_dim': 64, 'lr': 0.0016748417327479524, 'lambda_val': 0.00036402541279450417, 'batch_size': 1670, 'optimizer': 'Adam'}.
2026-06-15 05:56:55,261 - experiment_functions - INFO - Early stopping at epoch 500. Best Metrics: (0.0005144799297397591, 7.53566883247371e-05, 0.0002554830663374787)
