2026-06-14 14:25:13,671 - optuna.study.study - INFO - Trial 134 finished with values: [0.02921920459652555, 0.003645589121843392, 0.013470610477513847] and parameters: {'n_layers': 1, 'embedding_dim': 96, 'lr': 0.0016839460476377366, 'lambda_val': 0.059953896345215925, 'batch_size': 2843, 'optimizer': 'Adam'}.
2026-06-14 14:25:40,220 - experiment_functions - INFO - Early stopping at epoch 600. Best Metrics: (0.059331565645604725, 0.007301225802130083, 0.02914126310086703)
2026-06-14 14:25:40,309 - optuna.study.study - INFO - Trial 135 finished with values: [0.059331565645604725, 0.007301225802130083, 0.02914126310086703] and parameters: {'n_layers': 2, 'embedding_dim': 64, 'lr': 0.006265835000649171, 'lambda_val': 2.2383157515910264e-06, 'batch_size': 3998, 'optimizer': 'Adam'}.
2026-06-14 14:26:04,464 - experiment_functions - INFO - Early stopping at epoch 550. Best Metrics: (0.026411667196734503, 0.00363889074954786, 0.013807112489093441)
2026-06-14 14:26:04,553 - optuna.study.study - INFO - Trial 136 finished with values: [0.026411667196734503, 0.00363889074954786, 0.013807112489093441] and parameters: {'n_layers': 2, 'embedding_dim': 64, 'lr': 0.01717117311685491, 'lambda_val': 5.9543267651607335e-05, 'batch_size': 626, 'optimizer': 'Adam'}.
2026-06-14 14:26:27,635 - experiment_functions - INFO - Early stopping at epoch 500. Best Metrics: (0.00028673620381428907, 4.8563199142608344e-05, 0.00013249262255738485)
2026-06-14 14:26:27,703 - optuna.study.study - INFO - Trial 137 finished with values: [0.00028673620381428907, 4.8563199142608344e-05, 0.00013249262255738485] and parameters: {'n_layers': 2, 'embedding_dim': 128, 'lr': 0.017010979332815413, 'lambda_val': 8.380696475709368e-06, 'batch_size': 1629, 'optimizer': 'SGD'}.
2026-06-14 14:26:51,012 - experiment_functions - INFO - Early stopping at epoch 550. Best Metrics: (0.04630031602660527, 0.005690267265054592, 0.02157616849216157)
2026-06-14 14:26:51,125 - optuna.study.study - INFO - Trial 138 finished with values: [0.04630031602660527, 0.005690267265054592, 0.02157616849216157] and parameters: {'n_layers': 2, 'embedding_dim': 32, 'lr': 0.012247370054838723, 'lambda_val': 2.6136942653041923e-05, 'batch_size': 3749, 'optimizer': 'Adam'}.
2026-06-14 14:27:17,089 - experiment_functions - INFO - Early stopping at epoch 550. Best Metrics: (0.022136401392448893, 0.002923839506999799, 0.01147185150387255)
2026-06-14 14:27:17,165 - optuna.study.study - INFO - Trial 139 finished with values: [0.022136401392448893, 0.002923839506999799, 0.01147185150387255] and parameters: {'n_layers': 2, 'embedding_dim': 128, 'lr': 0.01717117311685491, 'lambda_val': 0.017688077953229953, 'batch_size': 626, 'optimizer': 'Adam'}.
2026-06-14 14:29:49,885 - optuna.study.study - INFO - Trial 140 finished with values: [0.03096050859085974, 0.004574988277848483, 0.016992199813865037] and parameters: {'n_layers': 2, 'embedding_dim': 32, 'lr': 0.000401967121955758, 'lambda_val': 2.6136942653041923e-05, 'batch_size': 1311, 'optimizer': 'Adam'}.
2026-06-14 14:30:13,171 - experiment_functions - INFO - Early stopping at epoch 550. Best Metrics: (0.00041060694038711555, 6.195994373367272e-05, 0.00019797881902350567)
2026-06-14 14:30:13,262 - optuna.study.study - INFO - Trial 141 finished with values: [0.00041060694038711555, 6.195994373367272e-05, 0.00019797881902350567] and parameters: {'n_layers': 1, 'embedding_dim': 96, 'lr': 3.4051446533511484e-05, 'lambda_val': 0.0009668484743513772, 'batch_size': 2658, 'optimizer': 'RMSprop'}.
2026-06-14 14:32:35,639 - experiment_functions - INFO - Early stopping at epoch 3300. Best Metrics: (0.0005308124344238529, 8.372965369415233e-05, 0.0002558681842535223)
2026-06-14 14:32:35,716 - optuna.study.study - INFO - Trial 142 finished with values: [0.0005308124344238529, 8.372965369415233e-05, 0.0002558681842535223] and parameters: {'n_layers': 3, 'embedding_dim': 96, 'lr': 4.9261740822680004e-05, 'lambda_val': 0.0008120167161284333, 'batch_size': 1332, 'optimizer': 'Adam'}.
2026-06-14 14:33:00,852 - experiment_functions - INFO - Early stopping at epoch 550. Best Metrics: (0.028574163173712697, 0.0032889007971063033, 0.012859484492144743)
2026-06-14 14:33:00,940 - optuna.study.study - INFO - Trial 143 finished with values: [0.028574163173712697, 0.0032889007971063033, 0.012859484492144743] and parameters: {'n_layers': 2, 'embedding_dim': 96, 'lr': 0.049137531063899446, 'lambda_val': 0.0009668484743513772, 'batch_size': 3193, 'optimizer': 'Adam'}.
2026-06-14 14:33:27,227 - experiment_functions - INFO - Early stopping at epoch 550. Best Metrics: (0.0456499489578778, 0.005360372429499632, 0.02036753756305535)
2026-06-14 14:33:27,312 - optuna.study.study - INFO - Trial 144 finished with values: [0.0456499489578778, 0.005360372429499632, 0.02036753756305535] and parameters: {'n_layers': 2, 'embedding_dim': 128, 'lr': 0.012247370054838723, 'lambda_val': 4.528429116955284e-06, 'batch_size': 3602, 'optimizer': 'Adam'}.
2026-06-14 14:37:36,856 - optuna.study.study - INFO - Trial 145 finished with values: [0.05659854944821456, 0.006204367338736687, 0.026179526696016822] and parameters: {'n_layers': 4, 'embedding_dim': 256, 'lr': 0.010960526947587883, 'lambda_val': 8.661801109154544e-06, 'batch_size': 2310, 'optimizer': 'RMSprop'}.
2026-06-14 14:40:16,995 - optuna.study.study - INFO - Trial 146 finished with values: [0.062471528584806466, 0.007374907897380937, 0.029635940873346294] and parameters: {'n_layers': 1, 'embedding_dim': 96, 'lr': 0.0059087621734932, 'lambda_val': 5.588502828653658e-06, 'batch_size': 1067, 'optimizer': 'RMSprop'}.
2026-06-14 14:43:20,312 - experiment_functions - INFO - Early stopping at epoch 3950. Best Metrics: (0.04036936385162332, 0.004223323732333043, 0.017699413111656362)
2026-06-14 14:43:20,387 - optuna.study.study - INFO - Trial 147 finished with values: [0.04036936385162332, 0.004223323732333043, 0.017699413111656362] and parameters: {'n_layers': 3, 'embedding_dim': 128, 'lr': 0.014831110208259727, 'lambda_val': 5.588502828653658e-06, 'batch_size': 3193, 'optimizer': 'Adam'}.
2026-06-14 14:43:46,954 - experiment_functions - INFO - Early stopping at epoch 550. Best Metrics: (0.017369514915728326, 0.0022288833813383347, 0.008251418098138275)
2026-06-14 14:43:47,037 - optuna.study.study - INFO - Trial 148 finished with values: [0.017369514915728326, 0.0022288833813383347, 0.008251418098138275] and parameters: {'n_layers': 1, 'embedding_dim': 256, 'lr': 0.049137531063899446, 'lambda_val': 0.0033545157335197707, 'batch_size': 1955, 'optimizer': 'Adam'}.
2026-06-14 14:44:53,571 - experiment_functions - INFO - Early stopping at epoch 1400. Best Metrics: (0.04294951720185013, 0.005442427490119901, 0.021292066579608568)
2026-06-14 14:44:53,661 - optuna.study.study - INFO - Trial 149 finished with values: [0.04294951720185013, 0.005442427490119901, 0.021292066579608568] and parameters: {'n_layers': 3, 'embedding_dim': 128, 'lr': 0.0008184790240634528, 'lambda_val': 0.0033545157335197707, 'batch_size': 1163, 'optimizer': 'Adam'}.
2026-06-14 14:48:02,525 - optuna.study.study - INFO - Trial 150 finished with values: [0.10662269614230872, 0.01307187353473106, 0.058023596730799994] and parameters: {'n_layers': 1, 'embedding_dim': 256, 'lr': 0.0009052352884581927, 'lambda_val': 0.00016986516228909828, 'batch_size': 3521, 'optimizer': 'Adam'}.
2026-06-14 14:48:27,333 - experiment_functions - INFO - Early stopping at epoch 500. Best Metrics: (0.0004920688906752352, 6.86583160292049e-05, 0.00021884176814285542)
2026-06-14 14:48:27,416 - optuna.study.study - INFO - Trial 151 finished with values: [0.0004920688906752352, 6.86583160292049e-05, 0.00021884176814285542] and parameters: {'n_layers': 3, 'embedding_dim': 128, 'lr': 1.3197255009203389e-05, 'lambda_val': 0.041741574378684046, 'batch_size': 1163, 'optimizer': 'RMSprop'}.
2026-06-14 14:51:10,717 - optuna.study.study - INFO - Trial 152 finished with values: [0.0899078705075415, 0.011551343023645253, 0.048341924851791444] and parameters: {'n_layers': 1, 'embedding_dim': 96, 'lr': 0.0007227490490114654, 'lambda_val': 0.0009668484743513772, 'batch_size': 2843, 'optimizer': 'RMSprop'}.
2026-06-14 14:52:01,626 - experiment_functions - INFO - Early stopping at epoch 1250. Best Metrics: (0.03844153682638244, 0.004563266126331301, 0.018023966311045577)
2026-06-14 14:52:01,712 - optuna.study.study - INFO - Trial 153 finished with values: [0.03844153682638244, 0.004563266126331301, 0.018023966311045577] and parameters: {'n_layers': 1, 'embedding_dim': 96, 'lr': 0.012247370054838723, 'lambda_val': 0.000984382033126084, 'batch_size': 1311, 'optimizer': 'RMSprop'}.
2026-06-14 14:55:25,990 - optuna.study.study - INFO - Trial 154 finished with values: [0.05996190519963044, 0.0065778015942126065, 0.02970076262774358] and parameters: {'n_layers': 2, 'embedding_dim': 256, 'lr': 0.012247370054838723, 'lambda_val': 1.288219485822485e-06, 'batch_size': 3389, 'optimizer': 'RMSprop'}.
2026-06-14 14:55:52,452 - experiment_functions - INFO - Early stopping at epoch 600. Best Metrics: (0.0006128417678270046, 8.372965369415233e-05, 0.00023950984284892387)
2026-06-14 14:55:52,552 - optuna.study.study - INFO - Trial 155 finished with values: [0.0006128417678270046, 8.372965369415233e-05, 0.00023950984284892387] and parameters: {'n_layers': 2, 'embedding_dim': 96, 'lr': 2.817845299483629e-05, 'lambda_val': 2.113988332261468e-05, 'batch_size': 2757, 'optimizer': 'RMSprop'}.
2026-06-14 14:58:34,427 - optuna.study.study - INFO - Trial 156 finished with values: [0.04321599821525859, 0.00552950632996182, 0.02033776358222846] and parameters: {'n_layers': 1, 'embedding_dim': 128, 'lr': 0.049137531063899446, 'lambda_val': 0.0009668484743513772, 'batch_size': 2658, 'optimizer': 'RMSprop'}.
2026-06-14 14:58:57,369 - experiment_functions - INFO - Early stopping at epoch 500. Best Metrics: (0.0004431831564541826, 6.0285350659789674e-05, 0.00020050418674355834)
2026-06-14 14:58:57,450 - optuna.study.study - INFO - Trial 157 finished with values: [0.0004431831564541826, 6.0285350659789674e-05, 0.00020050418674355834] and parameters: {'n_layers': 2, 'embedding_dim': 128, 'lr': 0.012247370054838723, 'lambda_val': 1.1933812384845947e-05, 'batch_size': 3602, 'optimizer': 'SGD'}.
2026-06-14 14:59:26,475 - experiment_functions - INFO - Early stopping at epoch 700. Best Metrics: (0.07727371068283366, 0.009744457096925448, 0.04030724513361626)
2026-06-14 14:59:26,559 - optuna.study.study - INFO - Trial 158 finished with values: [0.07727371068283366, 0.009744457096925448, 0.04030724513361626] and parameters: {'n_layers': 1, 'embedding_dim': 32, 'lr': 0.006265835000649171, 'lambda_val': 8.380696475709368e-06, 'batch_size': 3998, 'optimizer': 'Adam'}.
2026-06-14 15:01:48,687 - experiment_functions - INFO - Early stopping at epoch 3300. Best Metrics: (0.08169455157239036, 0.0100257887333378, 0.04271716349636824)
2026-06-14 15:01:48,774 - optuna.study.study - INFO - Trial 159 finished with values: [0.08169455157239036, 0.0100257887333378, 0.04271716349636824] and parameters: {'n_layers': 2, 'embedding_dim': 96, 'lr': 0.0009052352884581927, 'lambda_val': 0.00010850731668799077, 'batch_size': 2310, 'optimizer': 'Adam'}.
2026-06-14 15:02:23,026 - experiment_functions - INFO - Early stopping at epoch 800. Best Metrics: (0.06427500259990471, 0.008444972871592203, 0.03336857653277734)
2026-06-14 15:02:23,108 - optuna.study.study - INFO - Trial 160 finished with values: [0.06427500259990471, 0.008444972871592203, 0.03336857653277734] and parameters: {'n_layers': 1, 'embedding_dim': 96, 'lr': 0.001483277802508331, 'lambda_val': 0.00851359441108956, 'batch_size': 3193, 'optimizer': 'RMSprop'}.
2026-06-14 15:02:43,458 - experiment_functions - INFO - Early stopping at epoch 500. Best Metrics: (0.00042269154906070564, 7.033290910308795e-05, 0.00018657150813109532)
2026-06-14 15:02:43,545 - optuna.study.study - INFO - Trial 161 finished with values: [0.00042269154906070564, 7.033290910308795e-05, 0.00018657150813109532] and parameters: {'n_layers': 2, 'embedding_dim': 32, 'lr': 0.04548930633882983, 'lambda_val': 3.995664830087363e-05, 'batch_size': 1311, 'optimizer': 'SGD'}.
2026-06-14 15:03:04,611 - experiment_functions - INFO - Early stopping at epoch 500. Best Metrics: (0.00043016424622183895, 7.200750217697099e-05, 0.00019253336968533003)
2026-06-14 15:03:04,898 - optuna.study.study - INFO - Trial 162 finished with values: [0.00043016424622183895, 7.200750217697099e-05, 0.00019253336968533003] and parameters: {'n_layers': 1, 'embedding_dim': 96, 'lr': 0.012247370054838723, 'lambda_val': 8.239725341799072e-06, 'batch_size': 3602, 'optimizer': 'SGD'}.
2026-06-14 15:05:36,572 - optuna.study.study - INFO - Trial 163 finished with values: [0.03273934451177163, 0.003602049701922433, 0.014526516427281422] and parameters: {'n_layers': 2, 'embedding_dim': 32, 'lr': 0.012247370054838723, 'lambda_val': 2.6136942653041923e-05, 'batch_size': 1324, 'optimizer': 'Adam'}.
2026-06-14 15:08:14,788 - optuna.study.study - INFO - Trial 164 finished with values: [0.04338858123445361, 0.00504052515238797, 0.020037147390077798] and parameters: {'n_layers': 1, 'embedding_dim': 96, 'lr': 0.019631069594048547, 'lambda_val': 0.00040725719141865795, 'batch_size': 2843, 'optimizer': 'RMSprop'}.
2026-06-14 15:09:12,250 - experiment_functions - INFO - Early stopping at epoch 1400. Best Metrics: (0.03850056223772263, 0.004318775537544377, 0.01767987088036038)
2026-06-14 15:09:12,341 - optuna.study.study - INFO - Trial 165 finished with values: [0.03850056223772263, 0.004318775537544377, 0.01767987088036038] and parameters: {'n_layers': 2, 'embedding_dim': 64, 'lr': 0.006265835000649171, 'lambda_val': 0.00039332994716362866, 'batch_size': 3998, 'optimizer': 'RMSprop'}.
2026-06-14 15:11:06,388 - experiment_functions - INFO - Early stopping at epoch 2700. Best Metrics: (0.051548095352690386, 0.005459173420858731, 0.024239085803739062)
2026-06-14 15:11:06,471 - optuna.study.study - INFO - Trial 166 finished with values: [0.051548095352690386, 0.005459173420858731, 0.024239085803739062] and parameters: {'n_layers': 2, 'embedding_dim': 96, 'lr': 0.014831110208259727, 'lambda_val': 5.588502828653658e-06, 'batch_size': 3193, 'optimizer': 'RMSprop'}.
2026-06-14 15:13:00,513 - experiment_functions - INFO - Early stopping at epoch 2450. Best Metrics: (0.0365604211031625, 0.004047491459575323, 0.016453271617740704)
2026-06-14 15:13:00,585 - optuna.study.study - INFO - Trial 167 finished with values: [0.0365604211031625, 0.004047491459575323, 0.016453271617740704] and parameters: {'n_layers': 3, 'embedding_dim': 128, 'lr': 0.005879499031446108, 'lambda_val': 1.4115736549435582e-06, 'batch_size': 1332, 'optimizer': 'Adam'}.
2026-06-14 15:13:23,806 - experiment_functions - INFO - Early stopping at epoch 550. Best Metrics: (0.0353487648392389, 0.004116149775604528, 0.016624925596606208)
2026-06-14 15:13:23,906 - optuna.study.study - INFO - Trial 168 finished with values: [0.0353487648392389, 0.004116149775604528, 0.016624925596606208] and parameters: {'n_layers': 2, 'embedding_dim': 32, 'lr': 0.012247370054838723, 'lambda_val': 8.661801109154544e-06, 'batch_size': 2310, 'optimizer': 'Adam'}.
2026-06-14 15:14:03,802 - experiment_functions - INFO - Early stopping at epoch 1000. Best Metrics: (0.043584878347763194, 0.005496014468484159, 0.020437186225471943)
2026-06-14 15:14:03,878 - optuna.study.study - INFO - Trial 169 finished with values: [0.043584878347763194, 0.005496014468484159, 0.020437186225471943] and parameters: {'n_layers': 2, 'embedding_dim': 32, 'lr': 0.0016839460476377366, 'lambda_val': 0.00851359441108956, 'batch_size': 1553, 'optimizer': 'Adam'}.
2026-06-14 15:16:42,866 - optuna.study.study - INFO - Trial 170 finished with values: [0.03699759955156545, 0.0043237993167660254, 0.017098941450213567] and parameters: {'n_layers': 4, 'embedding_dim': 32, 'lr': 0.012247370054838723, 'lambda_val': 2.113988332261468e-05, 'batch_size': 994, 'optimizer': 'RMSprop'}.
2026-06-14 15:19:21,117 - optuna.study.study - INFO - Trial 171 finished with values: [0.03956712590661217, 0.004921629044142274, 0.018477951052521466] and parameters: {'n_layers': 1, 'embedding_dim': 96, 'lr': 0.01359759229313602, 'lambda_val': 0.0020453395420841204, 'batch_size': 3193, 'optimizer': 'RMSprop'}.
2026-06-14 15:20:02,798 - experiment_functions - INFO - Early stopping at epoch 900. Best Metrics: (0.07200761701991784, 0.008803335789403175, 0.03699186565623113)
2026-06-14 15:20:02,880 - optuna.study.study - INFO - Trial 172 finished with values: [0.07200761701991784, 0.008803335789403175, 0.03699186565623113] and parameters: {'n_layers': 2, 'embedding_dim': 128, 'lr': 0.001866327471651579, 'lambda_val': 2.3856782843124496e-06, 'batch_size': 1532, 'optimizer': 'Adam'}.
2026-06-14 15:21:20,894 - experiment_functions - INFO - Early stopping at epoch 1650. Best Metrics: (0.04617082561398933, 0.0055362047022573515, 0.0221801669072104)
2026-06-14 15:21:20,970 - optuna.study.study - INFO - Trial 173 finished with values: [0.04617082561398933, 0.0055362047022573515, 0.0221801669072104] and parameters: {'n_layers': 4, 'embedding_dim': 96, 'lr': 0.00093250867064954, 'lambda_val': 5.588502828653658e-06, 'batch_size': 3749, 'optimizer': 'Adam'}.
2026-06-14 15:22:07,278 - experiment_functions - INFO - Early stopping at epoch 850. Best Metrics: (0.07400360605912351, 0.008917208118427222, 0.037320738918636985)
2026-06-14 15:22:07,791 - optuna.study.study - INFO - Trial 174 finished with values: [0.07400360605912351, 0.008917208118427222, 0.037320738918636985] and parameters: {'n_layers': 2, 'embedding_dim': 256, 'lr': 0.001866327471651579, 'lambda_val': 5.588502828653658e-06, 'batch_size': 1878, 'optimizer': 'Adam'}.
2026-06-14 15:24:42,052 - optuna.study.study - INFO - Trial 175 finished with values: [0.08798242179498703, 0.010911648469421933, 0.047233418233648336] and parameters: {'n_layers': 1, 'embedding_dim': 32, 'lr': 0.0012088550950310484, 'lambda_val': 0.0004821335138179686, 'batch_size': 2289, 'optimizer': 'Adam'}.
2026-06-14 15:27:36,864 - optuna.study.study - INFO - Trial 176 finished with values: [0.03515051915574644, 0.004099403844865698, 0.015723447905203018] and parameters: {'n_layers': 2, 'embedding_dim': 128, 'lr': 0.006265835000649171, 'lambda_val': 5.588502828653658e-06, 'batch_size': 612, 'optimizer': 'Adam'}.
2026-06-14 15:28:03,518 - experiment_functions - INFO - Early stopping at epoch 600. Best Metrics: (0.06002010131686753, 0.007344765222051042, 0.02896649494199294)
2026-06-14 15:28:03,613 - optuna.study.study - INFO - Trial 177 finished with values: [0.06002010131686753, 0.007344765222051042, 0.02896649494199294] and parameters: {'n_layers': 2, 'embedding_dim': 64, 'lr': 0.006265835000649171, 'lambda_val': 5.588502828653658e-06, 'batch_size': 3193, 'optimizer': 'Adam'}.
2026-06-14 15:30:56,906 - optuna.study.study - INFO - Trial 178 finished with values: [0.04508090590439276, 0.005343626498760801, 0.020912198687087526] and parameters: {'n_layers': 2, 'embedding_dim': 128, 'lr': 0.0026515351587830605, 'lambda_val': 0.0001732532813523183, 'batch_size': 1772, 'optimizer': 'RMSprop'}.
2026-06-14 15:31:24,029 - experiment_functions - INFO - Early stopping at epoch 600. Best Metrics: (0.07122011005918094, 0.008622479737423805, 0.035653919676839126)
2026-06-14 15:31:24,102 - optuna.study.study - INFO - Trial 179 finished with values: [0.07122011005918094, 0.008622479737423805, 0.035653919676839126] and parameters: {'n_layers': 1, 'embedding_dim': 128, 'lr': 0.01359759229313602, 'lambda_val': 1.1933812384845947e-05, 'batch_size': 3602, 'optimizer': 'Adam'}.
2026-06-14 15:34:30,208 - optuna.study.study - INFO - Trial 180 finished with values: [0.048109520717899895, 0.005053921896979036, 0.02213723163245244] and parameters: {'n_layers': 4, 'embedding_dim': 96, 'lr': 0.014831110208259727, 'lambda_val': 5.588502828653658e-06, 'batch_size': 3193, 'optimizer': 'RMSprop'}.
2026-06-14 15:34:55,333 - experiment_functions - INFO - Early stopping at epoch 550. Best Metrics: (0.04768937353192061, 0.0058543773862951305, 0.024247855507172334)
2026-06-14 15:34:55,469 - optuna.study.study - INFO - Trial 181 finished with values: [0.04768937353192061, 0.0058543773862951305, 0.024247855507172334] and parameters: {'n_layers': 3, 'embedding_dim': 64, 'lr': 0.006265835000649171, 'lambda_val': 1.3717543216788016e-05, 'batch_size': 3998, 'optimizer': 'Adam'}.
2026-06-14 15:37:35,418 - optuna.study.study - INFO - Trial 182 finished with values: [0.03748071221182693, 0.004409203563534061, 0.016975415721904513] and parameters: {'n_layers': 2, 'embedding_dim': 64, 'lr': 0.049137531063899446, 'lambda_val': 0.0009668484743513772, 'batch_size': 2903, 'optimizer': 'RMSprop'}.
2026-06-14 15:38:15,363 - experiment_functions - INFO - Early stopping at epoch 900. Best Metrics: (0.036793473899722484, 0.004216625360037511, 0.016674473711683638)
2026-06-14 15:38:15,438 - optuna.study.study - INFO - Trial 183 finished with values: [0.036793473899722484, 0.004216625360037511, 0.016674473711683638] and parameters: {'n_layers': 2, 'embedding_dim': 96, 'lr': 0.014831110208259727, 'lambda_val': 5.588502828653658e-06, 'batch_size': 3193, 'optimizer': 'Adam'}.
2026-06-14 15:39:46,970 - experiment_functions - INFO - Early stopping at epoch 2050. Best Metrics: (0.04368224922103565, 0.004591734208587313, 0.019361532695358303)
2026-06-14 15:39:47,065 - optuna.study.study - INFO - Trial 184 finished with values: [0.04368224922103565, 0.004591734208587313, 0.019361532695358303] and parameters: {'n_layers': 2, 'embedding_dim': 128, 'lr': 0.014831110208259727, 'lambda_val': 5.588502828653658e-06, 'batch_size': 3193, 'optimizer': 'Adam'}.
2026-06-14 15:41:34,719 - experiment_functions - INFO - Early stopping at epoch 2700. Best Metrics: (0.07476327850782556, 0.009407863889074953, 0.038168372477424425)
