2026-06-14 06:42:56,401 - optuna.study.study - INFO - Trial 131 finished with values: [0.010852680780697932, 0.0017683702860204972, 0.005374936474730778] and parameters: {'n_layers': 2, 'embedding_dim': 64, 'lr': 0.0024547078565139557, 'lambda_val': 0.06388401397986232, 'batch_size': 2256, 'optimizer': 'Adam'}.
2026-06-14 06:44:07,387 - experiment_functions - INFO - Early stopping at epoch 1750. Best Metrics: (0.08257670210119182, 0.010017415767968385, 0.042673045656160584)
2026-06-14 06:44:07,477 - optuna.study.study - INFO - Trial 132 finished with values: [0.08257670210119182, 0.010017415767968385, 0.042673045656160584] and parameters: {'n_layers': 1, 'embedding_dim': 32, 'lr': 0.002252910187430102, 'lambda_val': 0.0001364070822934131, 'batch_size': 3300, 'optimizer': 'Adam'}.
2026-06-14 06:46:45,515 - optuna.study.study - INFO - Trial 133 finished with values: [0.037434126329621745, 0.004384084667425816, 0.017062874809867765] and parameters: {'n_layers': 3, 'embedding_dim': 32, 'lr': 0.00352106387321726, 'lambda_val': 3.7105397328767524e-06, 'batch_size': 1995, 'optimizer': 'RMSprop'}.
2026-06-14 06:47:11,466 - experiment_functions - INFO - Early stopping at epoch 550. Best Metrics: (0.03402225350333888, 0.004271886931475651, 0.017026844217087694)
2026-06-14 06:47:11,576 - optuna.study.study - INFO - Trial 134 finished with values: [0.03402225350333888, 0.004271886931475651, 0.017026844217087694] and parameters: {'n_layers': 2, 'embedding_dim': 96, 'lr': 0.013849452305144725, 'lambda_val': 0.0003071461412000055, 'batch_size': 2505, 'optimizer': 'RMSprop'}.
2026-06-14 06:50:05,045 - optuna.study.study - INFO - Trial 135 finished with values: [0.05773828741208433, 0.007721548663674727, 0.03314473695650381] and parameters: {'n_layers': 2, 'embedding_dim': 96, 'lr': 0.00037952805925517045, 'lambda_val': 0.0003290497000722153, 'batch_size': 1120, 'optimizer': 'Adam'}.
2026-06-14 06:50:34,421 - experiment_functions - INFO - Early stopping at epoch 600. Best Metrics: (0.048465728238074796, 0.005986670239131891, 0.025336964785148207)
2026-06-14 06:50:34,978 - optuna.study.study - INFO - Trial 136 finished with values: [0.048465728238074796, 0.005986670239131891, 0.025336964785148207] and parameters: {'n_layers': 2, 'embedding_dim': 128, 'lr': 0.013849452305144725, 'lambda_val': 9.92028588022513e-06, 'batch_size': 560, 'optimizer': 'RMSprop'}.
2026-06-14 06:53:26,066 - optuna.study.study - INFO - Trial 137 finished with values: [0.06840569926303941, 0.00900931073749079, 0.03588967169470094] and parameters: {'n_layers': 1, 'embedding_dim': 128, 'lr': 0.0004553975451984739, 'lambda_val': 0.004913946733537837, 'batch_size': 2917, 'optimizer': 'Adam'}.
2026-06-14 06:54:47,643 - experiment_functions - INFO - Early stopping at epoch 1350. Best Metrics: (0.036179268904134615, 0.004757518922901736, 0.017499604573124647)
2026-06-14 06:54:47,712 - optuna.study.study - INFO - Trial 138 finished with values: [0.036179268904134615, 0.004757518922901736, 0.017499604573124647] and parameters: {'n_layers': 3, 'embedding_dim': 256, 'lr': 0.0006540452730759462, 'lambda_val': 0.004913946733537837, 'batch_size': 1988, 'optimizer': 'Adam'}.
2026-06-14 06:55:38,766 - experiment_functions - INFO - Early stopping at epoch 1150. Best Metrics: (0.05245035152297719, 0.006795498693817403, 0.026503083890263963)
2026-06-14 06:55:39,045 - optuna.study.study - INFO - Trial 139 finished with values: [0.05245035152297719, 0.006795498693817403, 0.026503083890263963] and parameters: {'n_layers': 2, 'embedding_dim': 96, 'lr': 0.0007333136681919207, 'lambda_val': 0.0015912107748891956, 'batch_size': 2669, 'optimizer': 'RMSprop'}.
2026-06-14 06:56:02,528 - experiment_functions - INFO - Early stopping at epoch 550. Best Metrics: (0.028524529995573707, 0.003680755576394936, 0.0137023734090356)
2026-06-14 06:56:02,605 - optuna.study.study - INFO - Trial 140 finished with values: [0.028524529995573707, 0.003680755576394936, 0.0137023734090356] and parameters: {'n_layers': 1, 'embedding_dim': 64, 'lr': 0.026553351159696217, 'lambda_val': 8.049701828088752e-06, 'batch_size': 1042, 'optimizer': 'Adam'}.
2026-06-14 06:57:04,145 - experiment_functions - INFO - Early stopping at epoch 1000. Best Metrics: (0.05497121032384275, 0.006767030611561391, 0.02728993596941584)
2026-06-14 06:57:04,227 - optuna.study.study - INFO - Trial 141 finished with values: [0.05497121032384275, 0.006767030611561391, 0.02728993596941584] and parameters: {'n_layers': 3, 'embedding_dim': 256, 'lr': 0.0007333136681919207, 'lambda_val': 4.898157643229756e-06, 'batch_size': 4048, 'optimizer': 'RMSprop'}.
2026-06-14 06:59:03,502 - experiment_functions - INFO - Early stopping at epoch 2850. Best Metrics: (0.015533016451715754, 0.0021786455891218436, 0.00740760496672494)
2026-06-14 06:59:03,587 - optuna.study.study - INFO - Trial 142 finished with values: [0.015533016451715754, 0.0021786455891218436, 0.00740760496672494] and parameters: {'n_layers': 3, 'embedding_dim': 64, 'lr': 0.0003780315395925949, 'lambda_val': 0.04161754134046976, 'batch_size': 3300, 'optimizer': 'Adam'}.
2026-06-14 07:01:50,879 - optuna.study.study - INFO - Trial 143 finished with values: [0.08914974122489587, 0.011330296737892693, 0.04830202965620883] and parameters: {'n_layers': 1, 'embedding_dim': 96, 'lr': 0.0006380704426022134, 'lambda_val': 0.0003071461412000055, 'batch_size': 3438, 'optimizer': 'Adam'}.
2026-06-14 07:02:24,814 - experiment_functions - INFO - Early stopping at epoch 650. Best Metrics: (0.0425532046391753, 0.0051845401567419125, 0.02053995811183922)
2026-06-14 07:02:24,915 - optuna.study.study - INFO - Trial 144 finished with values: [0.0425532046391753, 0.0051845401567419125, 0.02053995811183922] and parameters: {'n_layers': 3, 'embedding_dim': 128, 'lr': 0.002228383544434738, 'lambda_val': 8.049701828088752e-06, 'batch_size': 1995, 'optimizer': 'Adam'}.
2026-06-14 07:05:04,665 - optuna.study.study - INFO - Trial 145 finished with values: [0.08083451953581715, 0.010364056534262176, 0.04493083664032357] and parameters: {'n_layers': 1, 'embedding_dim': 32, 'lr': 0.0008197571059817735, 'lambda_val': 1.910365266111311e-06, 'batch_size': 2132, 'optimizer': 'RMSprop'}.
2026-06-14 07:05:47,820 - experiment_functions - INFO - Early stopping at epoch 1000. Best Metrics: (0.08380898804963431, 0.010347310603523346, 0.04456200385578412)
2026-06-14 07:05:47,905 - optuna.study.study - INFO - Trial 146 finished with values: [0.08380898804963431, 0.010347310603523346, 0.04456200385578412] and parameters: {'n_layers': 1, 'embedding_dim': 64, 'lr': 0.002252910187430102, 'lambda_val': 0.000149120686094812, 'batch_size': 3452, 'optimizer': 'Adam'}.
2026-06-14 07:06:17,989 - experiment_functions - INFO - Early stopping at epoch 700. Best Metrics: (0.021135662555069185, 0.002699444035099471, 0.00968611743651007)
2026-06-14 07:06:18,093 - optuna.study.study - INFO - Trial 147 finished with values: [0.021135662555069185, 0.002699444035099471, 0.00968611743651007] and parameters: {'n_layers': 3, 'embedding_dim': 32, 'lr': 0.003057850425871205, 'lambda_val': 0.004913946733537837, 'batch_size': 4093, 'optimizer': 'RMSprop'}.
2026-06-14 07:06:51,575 - experiment_functions - INFO - Early stopping at epoch 800. Best Metrics: (0.052005389319281295, 0.0070131957934221984, 0.026696667155440473)
2026-06-14 07:06:51,671 - optuna.study.study - INFO - Trial 148 finished with values: [0.052005389319281295, 0.0070131957934221984, 0.026696667155440473] and parameters: {'n_layers': 1, 'embedding_dim': 32, 'lr': 0.002252910187430102, 'lambda_val': 0.010798230168850866, 'batch_size': 3452, 'optimizer': 'Adam'}.
2026-06-14 07:09:23,352 - experiment_functions - INFO - Early stopping at epoch 3500. Best Metrics: (0.04150881665009115, 0.00511755643378659, 0.019103310988104867)
2026-06-14 07:09:23,441 - optuna.study.study - INFO - Trial 149 finished with values: [0.04150881665009115, 0.00511755643378659, 0.019103310988104867] and parameters: {'n_layers': 2, 'embedding_dim': 96, 'lr': 0.0020642799008971833, 'lambda_val': 2.2728319731025804e-05, 'batch_size': 937, 'optimizer': 'RMSprop'}.
2026-06-14 07:09:45,763 - experiment_functions - INFO - Early stopping at epoch 500. Best Metrics: (0.0005035688295894795, 8.372965369415234e-05, 0.000237039894227263)
2026-06-14 07:09:45,887 - optuna.study.study - INFO - Trial 150 finished with values: [0.0005035688295894795, 8.372965369415234e-05, 0.000237039894227263] and parameters: {'n_layers': 4, 'embedding_dim': 32, 'lr': 2.2723897507002764e-05, 'lambda_val': 0.0001364070822934131, 'batch_size': 3300, 'optimizer': 'SGD'}.
2026-06-14 07:10:18,998 - experiment_functions - INFO - Early stopping at epoch 800. Best Metrics: (0.059794304136586165, 0.007755040525152388, 0.03059270794848237)
2026-06-14 07:10:20,052 - optuna.study.study - INFO - Trial 151 finished with values: [0.059794304136586165, 0.007755040525152388, 0.03059270794848237] and parameters: {'n_layers': 1, 'embedding_dim': 32, 'lr': 0.002252910187430102, 'lambda_val': 0.003887569304557066, 'batch_size': 4002, 'optimizer': 'Adam'}.
2026-06-14 07:12:55,669 - optuna.study.study - INFO - Trial 152 finished with values: [0.07701809562336229, 0.009925313148904817, 0.043238324584542645] and parameters: {'n_layers': 1, 'embedding_dim': 32, 'lr': 0.0006380704426022134, 'lambda_val': 0.0003071461412000055, 'batch_size': 4002, 'optimizer': 'RMSprop'}.
2026-06-14 07:13:30,763 - experiment_functions - INFO - Early stopping at epoch 800. Best Metrics: (0.08371434214512165, 0.010724094045147028, 0.04606065768563808)
2026-06-14 07:13:30,855 - optuna.study.study - INFO - Trial 153 finished with values: [0.08371434214512165, 0.010724094045147028, 0.04606065768563808] and parameters: {'n_layers': 1, 'embedding_dim': 96, 'lr': 0.002252910187430102, 'lambda_val': 1.910365266111311e-06, 'batch_size': 3031, 'optimizer': 'Adam'}.
2026-06-14 07:14:11,571 - experiment_functions - INFO - Early stopping at epoch 950. Best Metrics: (0.08744019550778577, 0.01087815660794427, 0.04538972145480865)
2026-06-14 07:14:11,661 - optuna.study.study - INFO - Trial 154 finished with values: [0.08744019550778577, 0.01087815660794427, 0.04538972145480865] and parameters: {'n_layers': 1, 'embedding_dim': 96, 'lr': 0.002252910187430102, 'lambda_val': 2.2728319731025804e-05, 'batch_size': 3452, 'optimizer': 'Adam'}.
2026-06-14 07:14:55,909 - experiment_functions - INFO - Early stopping at epoch 1000. Best Metrics: (0.08505789816785103, 0.01075758590662469, 0.04541598086438909)
2026-06-14 07:14:56,001 - optuna.study.study - INFO - Trial 155 finished with values: [0.08505789816785103, 0.01075758590662469, 0.04541598086438909] and parameters: {'n_layers': 1, 'embedding_dim': 128, 'lr': 0.0011116819593430245, 'lambda_val': 0.0003071461412000055, 'batch_size': 3517, 'optimizer': 'RMSprop'}.
2026-06-14 07:16:24,576 - experiment_functions - INFO - Early stopping at epoch 2050. Best Metrics: (0.09335083146369444, 0.011703730993368614, 0.049786372242640924)
2026-06-14 07:16:24,657 - optuna.study.study - INFO - Trial 156 finished with values: [0.09335083146369444, 0.011703730993368614, 0.049786372242640924] and parameters: {'n_layers': 1, 'embedding_dim': 128, 'lr': 0.0011116819593430245, 'lambda_val': 0.0003071461412000055, 'batch_size': 2416, 'optimizer': 'Adam'}.
2026-06-14 07:19:08,945 - optuna.study.study - INFO - Trial 157 finished with values: [0.09178797215426465, 0.011501105231428763, 0.04984191406782059] and parameters: {'n_layers': 1, 'embedding_dim': 64, 'lr': 0.0009554934943534302, 'lambda_val': 1.547696085959405e-05, 'batch_size': 3452, 'optimizer': 'Adam'}.
2026-06-14 07:20:04,988 - experiment_functions - INFO - Early stopping at epoch 1400. Best Metrics: (0.05665980747600255, 0.007023243351865496, 0.02897664994334504)
2026-06-14 07:20:05,111 - optuna.study.study - INFO - Trial 158 finished with values: [0.05665980747600255, 0.007023243351865496, 0.02897664994334504] and parameters: {'n_layers': 2, 'embedding_dim': 32, 'lr': 0.0011116819593430245, 'lambda_val': 0.0003071461412000055, 'batch_size': 3452, 'optimizer': 'RMSprop'}.
2026-06-14 07:23:06,849 - optuna.study.study - INFO - Trial 159 finished with values: [0.07167435473638831, 0.00907461986737223, 0.03960619300409186] and parameters: {'n_layers': 2, 'embedding_dim': 128, 'lr': 0.00037952805925517045, 'lambda_val': 0.0003290497000722153, 'batch_size': 1638, 'optimizer': 'Adam'}.
2026-06-14 07:23:58,396 - experiment_functions - INFO - Early stopping at epoch 1200. Best Metrics: (0.08130480487367525, 0.010116216759327484, 0.04354985949530686)
2026-06-14 07:23:58,487 - optuna.study.study - INFO - Trial 160 finished with values: [0.08130480487367525, 0.010116216759327484, 0.04354985949530686] and parameters: {'n_layers': 1, 'embedding_dim': 128, 'lr': 0.002252910187430102, 'lambda_val': 1.910365266111311e-06, 'batch_size': 792, 'optimizer': 'Adam'}.
2026-06-14 07:27:08,416 - optuna.study.study - INFO - Trial 161 finished with values: [0.10085436974456032, 0.01263145555629982, 0.055012556000188464] and parameters: {'n_layers': 1, 'embedding_dim': 256, 'lr': 0.0007333136681919207, 'lambda_val': 1.547696085959405e-05, 'batch_size': 2132, 'optimizer': 'RMSprop'}.
2026-06-14 07:29:51,912 - optuna.study.study - INFO - Trial 162 finished with values: [0.03318648719098793, 0.004839573983522005, 0.019433108772843127] and parameters: {'n_layers': 1, 'embedding_dim': 128, 'lr': 0.00034081213821976773, 'lambda_val': 0.00014895795346764513, 'batch_size': 1995, 'optimizer': 'Adam'}.
2026-06-14 07:32:31,995 - optuna.study.study - INFO - Trial 163 finished with values: [0.001919607592524164, 0.0002796570433384687, 0.0008943444216455216] and parameters: {'n_layers': 1, 'embedding_dim': 128, 'lr': 0.00016300423135533462, 'lambda_val': 8.049701828088752e-06, 'batch_size': 3120, 'optimizer': 'Adam'}.
2026-06-14 07:32:59,468 - experiment_functions - INFO - Early stopping at epoch 650. Best Metrics: (0.07437291858542223, 0.009573648603389377, 0.03987739453707244)
2026-06-14 07:32:59,557 - optuna.study.study - INFO - Trial 164 finished with values: [0.07437291858542223, 0.009573648603389377, 0.03987739453707244] and parameters: {'n_layers': 1, 'embedding_dim': 32, 'lr': 0.00486276978616333, 'lambda_val': 0.0005848614199984753, 'batch_size': 3452, 'optimizer': 'Adam'}.
2026-06-14 07:34:46,892 - experiment_functions - INFO - Early stopping at epoch 2800. Best Metrics: (0.03082035523326368, 0.003950365061290107, 0.015179611169112164)
2026-06-14 07:34:46,975 - optuna.study.study - INFO - Trial 165 finished with values: [0.03082035523326368, 0.003950365061290107, 0.015179611169112164] and parameters: {'n_layers': 1, 'embedding_dim': 32, 'lr': 0.019293204553845634, 'lambda_val': 1.910365266111311e-06, 'batch_size': 688, 'optimizer': 'RMSprop'}.
2026-06-14 07:37:24,914 - optuna.study.study - INFO - Trial 166 finished with values: [0.08351335550518814, 0.010526492062428831, 0.045634734097686674] and parameters: {'n_layers': 1, 'embedding_dim': 32, 'lr': 0.0011116819593430245, 'lambda_val': 0.00014895795346764513, 'batch_size': 1995, 'optimizer': 'Adam'}.
2026-06-14 07:39:14,314 - experiment_functions - INFO - Early stopping at epoch 2750. Best Metrics: (0.08079729071919407, 0.009863353205171144, 0.04164439394368608)
2026-06-14 07:39:14,472 - optuna.study.study - INFO - Trial 167 finished with values: [0.08079729071919407, 0.009863353205171144, 0.04164439394368608] and parameters: {'n_layers': 1, 'embedding_dim': 32, 'lr': 0.002252910187430102, 'lambda_val': 0.0001364070822934131, 'batch_size': 2917, 'optimizer': 'Adam'}.
2026-06-14 07:39:54,122 - experiment_functions - INFO - Early stopping at epoch 950. Best Metrics: (0.07895846871660125, 0.010004019023377319, 0.040602625833165804)
2026-06-14 07:39:54,204 - optuna.study.study - INFO - Trial 168 finished with values: [0.07895846871660125, 0.010004019023377319, 0.040602625833165804] and parameters: {'n_layers': 1, 'embedding_dim': 32, 'lr': 0.0020642799008971833, 'lambda_val': 0.0003290497000722153, 'batch_size': 3438, 'optimizer': 'Adam'}.
2026-06-14 07:42:15,945 - experiment_functions - INFO - Early stopping at epoch 3450. Best Metrics: (0.04273560608761834, 0.005109183468417174, 0.020574964454240487)
2026-06-14 07:42:16,022 - optuna.study.study - INFO - Trial 169 finished with values: [0.04273560608761834, 0.005109183468417174, 0.020574964454240487] and parameters: {'n_layers': 2, 'embedding_dim': 64, 'lr': 0.013849452305144725, 'lambda_val': 9.92028588022513e-06, 'batch_size': 1995, 'optimizer': 'RMSprop'}.
2026-06-14 07:42:47,350 - experiment_functions - INFO - Early stopping at epoch 550. Best Metrics: (0.03330422683822625, 0.0038163976153794636, 0.01540897467711986)
2026-06-14 07:42:47,433 - optuna.study.study - INFO - Trial 170 finished with values: [0.03330422683822625, 0.0038163976153794636, 0.01540897467711986] and parameters: {'n_layers': 2, 'embedding_dim': 256, 'lr': 0.013849452305144725, 'lambda_val': 0.00017543678662275883, 'batch_size': 3268, 'optimizer': 'Adam'}.
2026-06-14 07:43:08,301 - experiment_functions - INFO - Early stopping at epoch 500. Best Metrics: (0.0006082301025369897, 7.703128139862013e-05, 0.00026118482117068524)
2026-06-14 07:43:08,386 - optuna.study.study - INFO - Trial 171 finished with values: [0.0006082301025369897, 7.703128139862013e-05, 0.00026118482117068524] and parameters: {'n_layers': 1, 'embedding_dim': 32, 'lr': 6.667389220043674e-05, 'lambda_val': 1.0095478337692803e-05, 'batch_size': 3438, 'optimizer': 'Adam'}.
2026-06-14 07:43:39,815 - experiment_functions - INFO - Early stopping at epoch 700. Best Metrics: (0.0765353361546469, 0.009367673655301762, 0.039504403617598674)
2026-06-14 07:43:39,981 - optuna.study.study - INFO - Trial 172 finished with values: [0.0765353361546469, 0.009367673655301762, 0.039504403617598674] and parameters: {'n_layers': 1, 'embedding_dim': 96, 'lr': 0.004647123942859633, 'lambda_val': 0.0001364070822934131, 'batch_size': 1995, 'optimizer': 'Adam'}.
2026-06-14 07:44:03,607 - experiment_functions - INFO - Early stopping at epoch 550. Best Metrics: (0.024139776085187314, 0.003166655502712841, 0.011797142281577817)
2026-06-14 07:44:03,691 - optuna.study.study - INFO - Trial 173 finished with values: [0.024139776085187314, 0.003166655502712841, 0.011797142281577817] and parameters: {'n_layers': 2, 'embedding_dim': 32, 'lr': 0.013849452305144725, 'lambda_val': 0.0012360905541564393, 'batch_size': 2618, 'optimizer': 'RMSprop'}.
2026-06-14 07:46:56,654 - optuna.study.study - INFO - Trial 174 finished with values: [0.054137889164429465, 0.006681626364793355, 0.026434106531930582] and parameters: {'n_layers': 3, 'embedding_dim': 64, 'lr': 0.0007333136681919207, 'lambda_val': 8.049701828088752e-06, 'batch_size': 2132, 'optimizer': 'RMSprop'}.
2026-06-14 07:49:45,139 - optuna.study.study - INFO - Trial 175 finished with values: [0.08906824576433445, 0.011335320517114342, 0.04770357415320085] and parameters: {'n_layers': 1, 'embedding_dim': 96, 'lr': 0.0006380704426022134, 'lambda_val': 0.0001364070822934131, 'batch_size': 3438, 'optimizer': 'Adam'}.
2026-06-14 07:50:14,464 - experiment_functions - INFO - Early stopping at epoch 650. Best Metrics: (0.07519673750119132, 0.00936097528300623, 0.04053213627902782)
2026-06-14 07:50:14,555 - optuna.study.study - INFO - Trial 176 finished with values: [0.07519673750119132, 0.00936097528300623, 0.04053213627902782] and parameters: {'n_layers': 1, 'embedding_dim': 96, 'lr': 0.00486276978616333, 'lambda_val': 3.297377884127103e-05, 'batch_size': 2088, 'optimizer': 'Adam'}.
2026-06-14 07:51:41,435 - experiment_functions - INFO - Early stopping at epoch 2050. Best Metrics: (0.04350614453252658, 0.005494339875410275, 0.020907168627549995)
2026-06-14 07:51:41,513 - optuna.study.study - INFO - Trial 177 finished with values: [0.04350614453252658, 0.005494339875410275, 0.020907168627549995] and parameters: {'n_layers': 1, 'embedding_dim': 128, 'lr': 0.009852934677495576, 'lambda_val': 0.0003071461412000055, 'batch_size': 1159, 'optimizer': 'RMSprop'}.
2026-06-14 07:52:20,220 - experiment_functions - INFO - Early stopping at epoch 900. Best Metrics: (0.01512591229675073, 0.0019977895371424744, 0.007031820727218309)
2026-06-14 07:52:20,305 - optuna.study.study - INFO - Trial 178 finished with values: [0.01512591229675073, 0.0019977895371424744, 0.007031820727218309] and parameters: {'n_layers': 1, 'embedding_dim': 128, 'lr': 0.0016074754466479785, 'lambda_val': 0.09860978990020916, 'batch_size': 2917, 'optimizer': 'Adam'}.
2026-06-14 07:52:58,883 - experiment_functions - INFO - Early stopping at epoch 900. Best Metrics: (0.0830167524539875, 0.010410945140330901, 0.0441299023926778)
2026-06-14 07:52:58,963 - optuna.study.study - INFO - Trial 179 finished with values: [0.0830167524539875, 0.010410945140330901, 0.0441299023926778] and parameters: {'n_layers': 1, 'embedding_dim': 64, 'lr': 0.002252910187430102, 'lambda_val': 0.000149120686094812, 'batch_size': 3452, 'optimizer': 'Adam'}.
2026-06-14 07:53:22,220 - experiment_functions - INFO - Early stopping at epoch 550. Best Metrics: (0.04304061763294396, 0.005819210931743588, 0.022508359643651662)
2026-06-14 07:53:22,310 - optuna.study.study - INFO - Trial 180 finished with values: [0.04304061763294396, 0.005819210931743588, 0.022508359643651662] and parameters: {'n_layers': 1, 'embedding_dim': 32, 'lr': 0.009455237019112994, 'lambda_val': 0.010798230168850866, 'batch_size': 3452, 'optimizer': 'Adam'}.
2026-06-14 07:53:46,644 - experiment_functions - INFO - Early stopping at epoch 500. Best Metrics: (0.0005320708143234769, 7.033290910308795e-05, 0.0002398257361364897)
