2026-06-13 23:28:12,173 - optuna.study.study - INFO - Trial 238 finished with values: [0.04319448464034188, 0.005839306048630184, 0.021870866508753268] and parameters: {'n_layers': 3, 'embedding_dim': 64, 'lr': 0.0016889361681909714, 'lambda_val': 0.0005195382127114068, 'batch_size': 1602, 'optimizer': 'RMSprop'}.
2026-06-13 23:31:05,938 - optuna.study.study - INFO - Trial 239 finished with values: [0.054891636940839435, 0.007461986737222855, 0.030002444436685677] and parameters: {'n_layers': 3, 'embedding_dim': 128, 'lr': 0.000495651360592853, 'lambda_val': 0.00019652548319010554, 'batch_size': 2493, 'optimizer': 'RMSprop'}.
2026-06-13 23:31:57,049 - experiment_functions - INFO - Early stopping at epoch 1200. Best Metrics: (0.04881116201408697, 0.006537611360439414, 0.02501857662111778)
2026-06-13 23:31:57,139 - optuna.study.study - INFO - Trial 240 finished with values: [0.04881116201408697, 0.006537611360439414, 0.02501857662111778] and parameters: {'n_layers': 3, 'embedding_dim': 96, 'lr': 0.0016889361681909714, 'lambda_val': 3.923732897799114e-05, 'batch_size': 1859, 'optimizer': 'Adam'}.
2026-06-13 23:33:51,105 - experiment_functions - INFO - Early stopping at epoch 2850. Best Metrics: (0.05774310045681611, 0.0076863822091231835, 0.03051478823042238)
2026-06-13 23:33:51,198 - optuna.study.study - INFO - Trial 241 finished with values: [0.05774310045681611, 0.0076863822091231835, 0.03051478823042238] and parameters: {'n_layers': 3, 'embedding_dim': 64, 'lr': 0.0009711234831697961, 'lambda_val': 2.3680453923050776e-05, 'batch_size': 2314, 'optimizer': 'RMSprop'}.
2026-06-13 23:34:12,804 - experiment_functions - INFO - Early stopping at epoch 500. Best Metrics: (0.0007997150207780523, 9.37772121374506e-05, 0.00034282915753772755)
2026-06-13 23:34:12,877 - optuna.study.study - INFO - Trial 242 finished with values: [0.0007997150207780523, 9.37772121374506e-05, 0.00034282915753772755] and parameters: {'n_layers': 3, 'embedding_dim': 96, 'lr': 0.0009711234831697961, 'lambda_val': 0.00035318754870590177, 'batch_size': 3699, 'optimizer': 'SGD'}.
2026-06-13 23:34:50,578 - experiment_functions - INFO - Early stopping at epoch 850. Best Metrics: (0.03940226605104241, 0.005380467546386229, 0.019596038809862305)
2026-06-13 23:34:50,656 - optuna.study.study - INFO - Trial 243 finished with values: [0.03940226605104241, 0.005380467546386229, 0.019596038809862305] and parameters: {'n_layers': 4, 'embedding_dim': 96, 'lr': 0.0009711234831697961, 'lambda_val': 0.0005195382127114068, 'batch_size': 3773, 'optimizer': 'RMSprop'}.
2026-06-13 23:35:23,114 - experiment_functions - INFO - Early stopping at epoch 750. Best Metrics: (0.03520164230302151, 0.0050840645723089295, 0.01880027665911316)
2026-06-13 23:35:23,204 - optuna.study.study - INFO - Trial 244 finished with values: [0.03520164230302151, 0.0050840645723089295, 0.01880027665911316] and parameters: {'n_layers': 2, 'embedding_dim': 128, 'lr': 0.003557379059532174, 'lambda_val': 0.00013735320939513843, 'batch_size': 3009, 'optimizer': 'Adam'}.
2026-06-13 23:37:55,310 - optuna.study.study - INFO - Trial 245 finished with values: [0.04510064374904191, 0.006467278451336326, 0.024683626369828716] and parameters: {'n_layers': 2, 'embedding_dim': 64, 'lr': 0.0009711234831697961, 'lambda_val': 2.3680453923050776e-05, 'batch_size': 1677, 'optimizer': 'Adam'}.
2026-06-13 23:38:18,786 - experiment_functions - INFO - Early stopping at epoch 550. Best Metrics: (0.014535360376956949, 0.0020011387232902406, 0.006975138074227181)
2026-06-13 23:38:18,873 - optuna.study.study - INFO - Trial 246 finished with values: [0.014535360376956949, 0.0020011387232902406, 0.006975138074227181] and parameters: {'n_layers': 4, 'embedding_dim': 64, 'lr': 0.022433447114567566, 'lambda_val': 0.0005590603438440636, 'batch_size': 1677, 'optimizer': 'RMSprop'}.
2026-06-13 23:40:55,730 - optuna.study.study - INFO - Trial 247 finished with values: [0.04650544932722463, 0.006448857927523611, 0.02448132502762199] and parameters: {'n_layers': 3, 'embedding_dim': 64, 'lr': 0.0006193224215073263, 'lambda_val': 4.1509980625924543e-05, 'batch_size': 4095, 'optimizer': 'Adam'}.
2026-06-13 23:43:19,542 - experiment_functions - INFO - Early stopping at epoch 3750. Best Metrics: (0.051217886737767504, 0.0069880768973139525, 0.02751571870312604)
2026-06-13 23:43:19,613 - optuna.study.study - INFO - Trial 248 finished with values: [0.051217886737767504, 0.0069880768973139525, 0.02751571870312604] and parameters: {'n_layers': 2, 'embedding_dim': 64, 'lr': 0.0009711234831697961, 'lambda_val': 2.3680453923050776e-05, 'batch_size': 2916, 'optimizer': 'RMSprop'}.
2026-06-13 23:46:03,562 - optuna.study.study - INFO - Trial 249 finished with values: [0.05149315154356685, 0.007055060620269274, 0.02745660027851257] and parameters: {'n_layers': 3, 'embedding_dim': 96, 'lr': 0.000495651360592853, 'lambda_val': 0.0005590603438440636, 'batch_size': 3048, 'optimizer': 'RMSprop'}.
2026-06-13 23:48:48,701 - optuna.study.study - INFO - Trial 250 finished with values: [0.020357101954367983, 0.0033006229486234845, 0.01259395223567026] and parameters: {'n_layers': 1, 'embedding_dim': 256, 'lr': 0.000495651360592853, 'lambda_val': 0.000580167112308469, 'batch_size': 1887, 'optimizer': 'RMSprop'}.
2026-06-13 23:50:58,418 - experiment_functions - INFO - Early stopping at epoch 3300. Best Metrics: (0.0556740308979926, 0.007423471096523544, 0.0296225451188885)
2026-06-13 23:50:58,491 - optuna.study.study - INFO - Trial 251 finished with values: [0.0556740308979926, 0.007423471096523544, 0.0296225451188885] and parameters: {'n_layers': 3, 'embedding_dim': 64, 'lr': 0.0009822401593291786, 'lambda_val': 2.3680453923050776e-05, 'batch_size': 2300, 'optimizer': 'RMSprop'}.
2026-06-13 23:52:29,817 - experiment_functions - INFO - Early stopping at epoch 1950. Best Metrics: (0.04103179158906741, 0.005931408667693751, 0.022057875717075414)
2026-06-13 23:52:29,897 - optuna.study.study - INFO - Trial 252 finished with values: [0.04103179158906741, 0.005931408667693751, 0.022057875717075414] and parameters: {'n_layers': 2, 'embedding_dim': 256, 'lr': 0.0009711234831697961, 'lambda_val': 0.00035318754870590177, 'batch_size': 1677, 'optimizer': 'Adam'}.
2026-06-13 23:55:07,846 - optuna.study.study - INFO - Trial 253 finished with values: [0.046106946005832566, 0.006562730256547658, 0.025232870151940427] and parameters: {'n_layers': 2, 'embedding_dim': 96, 'lr': 0.0009822401593291786, 'lambda_val': 4.1509980625924543e-05, 'batch_size': 1859, 'optimizer': 'Adam'}.
2026-06-13 23:57:18,499 - experiment_functions - INFO - Early stopping at epoch 3200. Best Metrics: (0.04541837273183499, 0.00638187420456829, 0.024344032761112445)
2026-06-13 23:57:18,570 - optuna.study.study - INFO - Trial 254 finished with values: [0.04541837273183499, 0.00638187420456829, 0.024344032761112445] and parameters: {'n_layers': 2, 'embedding_dim': 128, 'lr': 0.0009822401593291786, 'lambda_val': 0.00035318754870590177, 'batch_size': 1859, 'optimizer': 'Adam'}.
2026-06-13 23:58:18,092 - experiment_functions - INFO - Early stopping at epoch 1350. Best Metrics: (0.052703156634018235, 0.007088552481746936, 0.027671736237917743)
2026-06-13 23:58:18,176 - optuna.study.study - INFO - Trial 255 finished with values: [0.052703156634018235, 0.007088552481746936, 0.027671736237917743] and parameters: {'n_layers': 3, 'embedding_dim': 128, 'lr': 0.0009711234831697961, 'lambda_val': 2.3680453923050776e-05, 'batch_size': 2493, 'optimizer': 'RMSprop'}.
2026-06-13 23:58:52,065 - experiment_functions - INFO - Early stopping at epoch 750. Best Metrics: (0.04072259626771985, 0.005437403710898252, 0.020437136026088376)
2026-06-13 23:58:52,739 - optuna.study.study - INFO - Trial 256 finished with values: [0.04072259626771985, 0.005437403710898252, 0.020437136026088376] and parameters: {'n_layers': 3, 'embedding_dim': 128, 'lr': 0.0016889361681909714, 'lambda_val': 0.00019652548319010554, 'batch_size': 3914, 'optimizer': 'RMSprop'}.
2026-06-14 00:01:30,751 - optuna.study.study - INFO - Trial 257 finished with values: [0.04764923128153768, 0.006827315962221181, 0.02622911067960954] and parameters: {'n_layers': 2, 'embedding_dim': 96, 'lr': 0.0009711234831697961, 'lambda_val': 2.1212701714385975e-05, 'batch_size': 1859, 'optimizer': 'Adam'}.
2026-06-14 00:04:02,918 - optuna.study.study - INFO - Trial 258 finished with values: [0.045954057022181985, 0.006463929265188559, 0.02663602967769571] and parameters: {'n_layers': 3, 'embedding_dim': 32, 'lr': 0.000495651360592853, 'lambda_val': 2.060634847155313e-06, 'batch_size': 3048, 'optimizer': 'RMSprop'}.
2026-06-14 00:04:24,956 - experiment_functions - INFO - Early stopping at epoch 500. Best Metrics: (0.0004649953380147666, 6.86583160292049e-05, 0.00022783912109232112)
2026-06-14 00:04:25,053 - optuna.study.study - INFO - Trial 259 finished with values: [0.0004649953380147666, 6.86583160292049e-05, 0.00022783912109232112] and parameters: {'n_layers': 3, 'embedding_dim': 96, 'lr': 0.0018110448597647927, 'lambda_val': 0.0005590603438440636, 'batch_size': 3048, 'optimizer': 'SGD'}.
2026-06-14 00:05:09,231 - experiment_functions - INFO - Early stopping at epoch 1050. Best Metrics: (0.04481970431194718, 0.0059749480876147105, 0.023107815576713323)
2026-06-14 00:05:09,335 - optuna.study.study - INFO - Trial 260 finished with values: [0.04481970431194718, 0.0059749480876147105, 0.023107815576713323] and parameters: {'n_layers': 3, 'embedding_dim': 64, 'lr': 0.0016889361681909714, 'lambda_val': 3.0223344926075768e-05, 'batch_size': 3048, 'optimizer': 'RMSprop'}.
2026-06-14 00:07:47,170 - optuna.study.study - INFO - Trial 261 finished with values: [0.029101940215251716, 0.004211601580815862, 0.015527614615502774] and parameters: {'n_layers': 1, 'embedding_dim': 128, 'lr': 0.0009711234831697961, 'lambda_val': 2.3680453923050776e-05, 'batch_size': 3914, 'optimizer': 'Adam'}.
2026-06-14 00:08:28,256 - experiment_functions - INFO - Early stopping at epoch 1000. Best Metrics: (0.040754995287626744, 0.005792417442561458, 0.02178692651437708)
2026-06-14 00:08:28,345 - optuna.study.study - INFO - Trial 262 finished with values: [0.040754995287626744, 0.005792417442561458, 0.02178692651437708] and parameters: {'n_layers': 2, 'embedding_dim': 64, 'lr': 0.0016889361681909714, 'lambda_val': 0.00035318754870590177, 'batch_size': 2460, 'optimizer': 'RMSprop'}.
2026-06-14 00:09:12,147 - experiment_functions - INFO - Early stopping at epoch 1050. Best Metrics: (0.04417651923217944, 0.006165851698037377, 0.023057894735975717)
2026-06-14 00:09:12,233 - optuna.study.study - INFO - Trial 263 finished with values: [0.04417651923217944, 0.006165851698037377, 0.023057894735975717] and parameters: {'n_layers': 3, 'embedding_dim': 64, 'lr': 0.0016889361681909714, 'lambda_val': 0.00035318754870590177, 'batch_size': 1264, 'optimizer': 'RMSprop'}.
2026-06-14 00:09:32,935 - experiment_functions - INFO - Early stopping at epoch 500. Best Metrics: (0.0004406306028565477, 6.028535065978967e-05, 0.000180048138935975)
2026-06-14 00:09:33,033 - optuna.study.study - INFO - Trial 264 finished with values: [0.0004406306028565477, 6.028535065978967e-05, 0.000180048138935975] and parameters: {'n_layers': 2, 'embedding_dim': 64, 'lr': 0.0009711234831697961, 'lambda_val': 0.0005590603438440636, 'batch_size': 2216, 'optimizer': 'SGD'}.
2026-06-14 00:12:10,204 - optuna.study.study - INFO - Trial 265 finished with values: [0.051795993224575364, 0.007207448589992634, 0.028317489582530483] and parameters: {'n_layers': 2, 'embedding_dim': 64, 'lr': 0.0009822401593291786, 'lambda_val': 0.00035318754870590177, 'batch_size': 1264, 'optimizer': 'RMSprop'}.
2026-06-14 00:12:33,596 - experiment_functions - INFO - Early stopping at epoch 550. Best Metrics: (0.0177986796795224, 0.0025403576930805817, 0.008810130373282779)
2026-06-14 00:12:33,689 - optuna.study.study - INFO - Trial 266 finished with values: [0.0177986796795224, 0.0025403576930805817, 0.008810130373282779] and parameters: {'n_layers': 3, 'embedding_dim': 64, 'lr': 0.0437879829696123, 'lambda_val': 9.682553704170538e-06, 'batch_size': 1859, 'optimizer': 'Adam'}.
2026-06-14 00:15:20,684 - optuna.study.study - INFO - Trial 267 finished with values: [0.0029786775749549538, 0.000542568155938107, 0.001586182157480409] and parameters: {'n_layers': 4, 'embedding_dim': 96, 'lr': 9.586323422897213e-05, 'lambda_val': 2.3680453923050776e-05, 'batch_size': 3048, 'optimizer': 'RMSprop'}.
2026-06-14 00:16:07,946 - experiment_functions - INFO - Early stopping at epoch 1000. Best Metrics: (0.04277833530929344, 0.005728782905753902, 0.021396274340442622)
2026-06-14 00:16:08,018 - optuna.study.study - INFO - Trial 268 finished with values: [0.04277833530929344, 0.005728782905753902, 0.021396274340442622] and parameters: {'n_layers': 4, 'embedding_dim': 128, 'lr': 0.0009711234831697961, 'lambda_val': 2.3680453923050776e-05, 'batch_size': 4095, 'optimizer': 'RMSprop'}.
2026-06-14 00:17:03,699 - experiment_functions - INFO - Early stopping at epoch 1350. Best Metrics: (0.020066237856188957, 0.0027781499095719743, 0.009502767025366695)
2026-06-14 00:17:03,781 - optuna.study.study - INFO - Trial 269 finished with values: [0.020066237856188957, 0.0027781499095719743, 0.009502767025366695] and parameters: {'n_layers': 4, 'embedding_dim': 64, 'lr': 0.0009711234831697961, 'lambda_val': 0.016073199811550313, 'batch_size': 1677, 'optimizer': 'Adam'}.
2026-06-14 00:18:39,473 - experiment_functions - INFO - Early stopping at epoch 2400. Best Metrics: (0.0008725744873419254, 0.00011052314287628109, 0.0003873101713338355)
2026-06-14 00:18:39,565 - optuna.study.study - INFO - Trial 270 finished with values: [0.0008725744873419254, 0.00011052314287628109, 0.0003873101713338355] and parameters: {'n_layers': 4, 'embedding_dim': 64, 'lr': 5.785538352252215e-05, 'lambda_val': 2.3680453923050776e-05, 'batch_size': 2916, 'optimizer': 'RMSprop'}.
2026-06-14 00:21:27,363 - optuna.study.study - INFO - Trial 271 finished with values: [0.04494266907572909, 0.006534262174291647, 0.02510150243270044] and parameters: {'n_layers': 3, 'embedding_dim': 96, 'lr': 0.000495651360592853, 'lambda_val': 2.3680453923050776e-05, 'batch_size': 2314, 'optimizer': 'Adam'}.
2026-06-14 00:21:49,398 - experiment_functions - INFO - Early stopping at epoch 500. Best Metrics: (0.000284990075978567, 6.698372295532186e-05, 0.00014324578109562046)
2026-06-14 00:21:49,478 - optuna.study.study - INFO - Trial 272 finished with values: [0.000284990075978567, 6.698372295532186e-05, 0.00014324578109562046] and parameters: {'n_layers': 3, 'embedding_dim': 96, 'lr': 0.0016889361681909714, 'lambda_val': 0.00019652548319010554, 'batch_size': 1744, 'optimizer': 'SGD'}.
2026-06-14 00:24:24,220 - optuna.study.study - INFO - Trial 273 finished with values: [0.03880181489625207, 0.0057873936633398085, 0.021767559469275197] and parameters: {'n_layers': 2, 'embedding_dim': 64, 'lr': 0.000495651360592853, 'lambda_val': 0.00035318754870590177, 'batch_size': 3048, 'optimizer': 'RMSprop'}.
2026-06-14 00:25:23,934 - experiment_functions - INFO - Early stopping at epoch 1450. Best Metrics: (0.04602872061633812, 0.006522540022774466, 0.024518804928421307)
2026-06-14 00:25:24,142 - optuna.study.study - INFO - Trial 274 finished with values: [0.04602872061633812, 0.006522540022774466, 0.024518804928421307] and parameters: {'n_layers': 2, 'embedding_dim': 96, 'lr': 0.0009711234831697961, 'lambda_val': 0.0005195382127114068, 'batch_size': 2680, 'optimizer': 'RMSprop'}.
2026-06-14 00:25:46,829 - experiment_functions - INFO - Early stopping at epoch 500. Best Metrics: (0.0002914630547722324, 6.028535065978968e-05, 0.0001540892560288885)
2026-06-14 00:25:47,564 - optuna.study.study - INFO - Trial 275 finished with values: [0.0002914630547722324, 6.028535065978968e-05, 0.0001540892560288885] and parameters: {'n_layers': 4, 'embedding_dim': 96, 'lr': 0.0006193224215073263, 'lambda_val': 0.09760398014665395, 'batch_size': 4095, 'optimizer': 'SGD'}.
2026-06-14 00:28:30,211 - optuna.study.study - INFO - Trial 276 finished with values: [0.04726199282544463, 0.006296469957800256, 0.02425138732863975] and parameters: {'n_layers': 4, 'embedding_dim': 64, 'lr': 0.0009711234831697961, 'lambda_val': 2.3680453923050776e-05, 'batch_size': 1859, 'optimizer': 'Adam'}.
2026-06-14 00:31:16,462 - optuna.study.study - INFO - Trial 277 finished with values: [0.047243127711338866, 0.006679951771719473, 0.025169822515868547] and parameters: {'n_layers': 3, 'embedding_dim': 96, 'lr': 0.000495651360592853, 'lambda_val': 2.060634847155313e-06, 'batch_size': 3048, 'optimizer': 'Adam'}.
2026-06-14 00:32:35,674 - experiment_functions - INFO - Early stopping at epoch 1800. Best Metrics: (0.05395997657891851, 0.0073849554558242355, 0.028480386641106435)
2026-06-14 00:32:36,181 - optuna.study.study - INFO - Trial 278 finished with values: [0.05395997657891851, 0.0073849554558242355, 0.028480386641106435] and parameters: {'n_layers': 3, 'embedding_dim': 128, 'lr': 0.0009711234831697961, 'lambda_val': 0.00013735320939513843, 'batch_size': 1859, 'optimizer': 'RMSprop'}.
2026-06-14 00:33:37,993 - experiment_functions - INFO - Early stopping at epoch 1450. Best Metrics: (0.04934689102621729, 0.006510817871257285, 0.025371510912190996)
2026-06-14 00:33:38,099 - optuna.study.study - INFO - Trial 279 finished with values: [0.04934689102621729, 0.006510817871257285, 0.025371510912190996] and parameters: {'n_layers': 3, 'embedding_dim': 96, 'lr': 0.0009711234831697961, 'lambda_val': 2.3680453923050776e-05, 'batch_size': 4095, 'optimizer': 'RMSprop'}.
2026-06-14 00:34:21,154 - experiment_functions - INFO - Early stopping at epoch 1000. Best Metrics: (0.04203117413652075, 0.005909638957733271, 0.022248947291539787)
2026-06-14 00:34:21,239 - optuna.study.study - INFO - Trial 280 finished with values: [0.04203117413652075, 0.005909638957733271, 0.022248947291539787] and parameters: {'n_layers': 3, 'embedding_dim': 96, 'lr': 0.0016889361681909714, 'lambda_val': 0.000950764440972714, 'batch_size': 1496, 'optimizer': 'Adam'}.
2026-06-14 00:34:57,522 - experiment_functions - INFO - Early stopping at epoch 800. Best Metrics: (0.04224062925956207, 0.005675195927389645, 0.02152563043385013)
2026-06-14 00:34:57,613 - optuna.study.study - INFO - Trial 281 finished with values: [0.04224062925956207, 0.005675195927389645, 0.02152563043385013] and parameters: {'n_layers': 3, 'embedding_dim': 128, 'lr': 0.0016889361681909714, 'lambda_val': 2.060634847155313e-06, 'batch_size': 3914, 'optimizer': 'RMSprop'}.
2026-06-14 00:35:52,220 - experiment_functions - INFO - Early stopping at epoch 1400. Best Metrics: (0.0226876651931262, 0.003240337597963695, 0.011317564786104883)
2026-06-14 00:35:52,313 - optuna.study.study - INFO - Trial 282 finished with values: [0.0226876651931262, 0.003240337597963695, 0.011317564786104883] and parameters: {'n_layers': 2, 'embedding_dim': 64, 'lr': 0.0009711234831697961, 'lambda_val': 0.023622163696085566, 'batch_size': 3699, 'optimizer': 'Adam'}.
2026-06-14 00:36:12,766 - experiment_functions - INFO - Early stopping at epoch 500. Best Metrics: (0.00048511978947166285, 7.033290910308795e-05, 0.00021979624070504256)
2026-06-14 00:36:13,328 - optuna.study.study - INFO - Trial 283 finished with values: [0.00048511978947166285, 7.033290910308795e-05, 0.00021979624070504256] and parameters: {'n_layers': 1, 'embedding_dim': 96, 'lr': 0.0009711234831697961, 'lambda_val': 0.0005195382127114068, 'batch_size': 3699, 'optimizer': 'SGD'}.
2026-06-14 00:37:17,919 - experiment_functions - INFO - Early stopping at epoch 1550. Best Metrics: (0.04183222138061477, 0.005648402438207515, 0.02087697237429252)
2026-06-14 00:37:18,209 - optuna.study.study - INFO - Trial 284 finished with values: [0.04183222138061477, 0.005648402438207515, 0.02087697237429252] and parameters: {'n_layers': 4, 'embedding_dim': 64, 'lr': 0.0009711234831697961, 'lambda_val': 2.060634847155313e-06, 'batch_size': 3914, 'optimizer': 'Adam'}.
2026-06-14 00:38:51,161 - experiment_functions - INFO - Early stopping at epoch 2200. Best Metrics: (0.05019486000305801, 0.006710094447049367, 0.0260359314737592)
2026-06-14 00:38:51,273 - optuna.study.study - INFO - Trial 285 finished with values: [0.05019486000305801, 0.006710094447049367, 0.0260359314737592] and parameters: {'n_layers': 3, 'embedding_dim': 96, 'lr': 0.0009822401593291786, 'lambda_val': 0.00035318754870590177, 'batch_size': 1677, 'optimizer': 'Adam'}.
2026-06-14 00:40:22,482 - experiment_functions - INFO - Early stopping at epoch 2350. Best Metrics: (0.03890142032163493, 0.00560151383213879, 0.02108276451655514)
2026-06-14 00:40:22,588 - optuna.study.study - INFO - Trial 286 finished with values: [0.03890142032163493, 0.00560151383213879, 0.02108276451655514] and parameters: {'n_layers': 2, 'embedding_dim': 64, 'lr': 0.0009711234831697961, 'lambda_val': 0.0020649441225344682, 'batch_size': 1677, 'optimizer': 'Adam'}.
2026-06-14 00:41:07,757 - experiment_functions - INFO - Early stopping at epoch 850. Best Metrics: (0.04336412247013552, 0.006005090762944606, 0.02282505246797556)
2026-06-14 00:41:07,906 - optuna.study.study - INFO - Trial 287 finished with values: [0.04336412247013552, 0.006005090762944606, 0.02282505246797556] and parameters: {'n_layers': 3, 'embedding_dim': 256, 'lr': 0.0016889361681909714, 'lambda_val': 2.330378236205022e-05, 'batch_size': 3151, 'optimizer': 'Adam'}.
2026-06-14 00:43:50,547 - experiment_functions - INFO - Early stopping at epoch 3900. Best Metrics: (0.052710741003606044, 0.007269408533726305, 0.02869854550823591)
