2026-06-15 08:34:47,337 - optuna.study.study - INFO - Trial 242 finished with values: [0.08010024402716172, 0.010484627235581754, 0.04590471437143266] and parameters: {'n_layers': 1, 'embedding_dim': 96, 'lr': 0.0007313618891305963, 'lambda_val': 1.722502032465723e-05, 'batch_size': 1858, 'optimizer': 'RMSprop'}.
2026-06-15 08:37:55,928 - optuna.study.study - INFO - Trial 243 finished with values: [0.1046981717058931, 0.012693415500033493, 0.05666026848451025] and parameters: {'n_layers': 1, 'embedding_dim': 256, 'lr': 0.0016748417327479524, 'lambda_val': 1.2492162876084175e-05, 'batch_size': 1243, 'optimizer': 'Adam'}.
2026-06-15 08:38:34,612 - experiment_functions - INFO - Early stopping at epoch 900. Best Metrics: (0.08958209269785854, 0.011149440685913323, 0.04752314184975643)
2026-06-15 08:38:35,632 - optuna.study.study - INFO - Trial 244 finished with values: [0.08958209269785854, 0.011149440685913323, 0.04752314184975643] and parameters: {'n_layers': 1, 'embedding_dim': 96, 'lr': 0.0031668054510016214, 'lambda_val': 0.00036402541279450417, 'batch_size': 2363, 'optimizer': 'Adam'}.
2026-06-15 08:39:29,158 - experiment_functions - INFO - Early stopping at epoch 1050. Best Metrics: (0.03256753256455095, 0.003888405117556434, 0.015178526538158975)
2026-06-15 08:39:29,231 - optuna.study.study - INFO - Trial 245 finished with values: [0.03256753256455095, 0.003888405117556434, 0.015178526538158975] and parameters: {'n_layers': 4, 'embedding_dim': 128, 'lr': 0.0031668054510016214, 'lambda_val': 1.722502032465723e-05, 'batch_size': 2363, 'optimizer': 'Adam'}.
2026-06-15 08:43:13,242 - optuna.study.study - INFO - Trial 246 finished with values: [0.02305321554319272, 0.0033642574854310407, 0.011985167123207054] and parameters: {'n_layers': 3, 'embedding_dim': 256, 'lr': 0.00012661197216158214, 'lambda_val': 6.096576799304491e-06, 'batch_size': 3859, 'optimizer': 'Adam'}.
2026-06-15 08:45:52,239 - optuna.study.study - INFO - Trial 247 finished with values: [0.08480170568274958, 0.010188224261504456, 0.04404492367471765] and parameters: {'n_layers': 1, 'embedding_dim': 64, 'lr': 0.002403322646261187, 'lambda_val': 1.2492162876084175e-05, 'batch_size': 1126, 'optimizer': 'RMSprop'}.
2026-06-15 08:46:13,808 - experiment_functions - INFO - Early stopping at epoch 500. Best Metrics: (0.00048680349093973587, 6.86583160292049e-05, 0.00020537441135541108)
2026-06-15 08:46:13,900 - optuna.study.study - INFO - Trial 248 finished with values: [0.00048680349093973587, 6.86583160292049e-05, 0.00020537441135541108] and parameters: {'n_layers': 1, 'embedding_dim': 128, 'lr': 1.188333271970453e-05, 'lambda_val': 0.027260003785952794, 'batch_size': 2519, 'optimizer': 'SGD'}.
2026-06-15 08:47:29,036 - experiment_functions - INFO - Early stopping at epoch 1850. Best Metrics: (0.0881559791691708, 0.010590126599236385, 0.04598628088769881)
2026-06-15 08:47:29,124 - optuna.study.study - INFO - Trial 249 finished with values: [0.0881559791691708, 0.010590126599236385, 0.04598628088769881] and parameters: {'n_layers': 1, 'embedding_dim': 64, 'lr': 0.0019049517999197474, 'lambda_val': 1.722502032465723e-05, 'batch_size': 3123, 'optimizer': 'RMSprop'}.
2026-06-15 08:49:37,579 - experiment_functions - INFO - Early stopping at epoch 3050. Best Metrics: (0.09229089908786202, 0.011524549534463125, 0.0489454982445464)
2026-06-15 08:49:37,673 - optuna.study.study - INFO - Trial 250 finished with values: [0.09229089908786202, 0.011524549534463125, 0.0489454982445464] and parameters: {'n_layers': 1, 'embedding_dim': 128, 'lr': 0.0013635493562820199, 'lambda_val': 0.0016135144594650256, 'batch_size': 1243, 'optimizer': 'Adam'}.
2026-06-15 08:50:01,942 - experiment_functions - INFO - Early stopping at epoch 550. Best Metrics: (0.027848592497841607, 0.003648938307991158, 0.01331699732441687)
2026-06-15 08:50:02,043 - optuna.study.study - INFO - Trial 251 finished with values: [0.027848592497841607, 0.003648938307991158, 0.01331699732441687] and parameters: {'n_layers': 1, 'embedding_dim': 128, 'lr': 0.046904916954451405, 'lambda_val': 0.0003191281934324037, 'batch_size': 2420, 'optimizer': 'Adam'}.
2026-06-15 08:50:31,896 - experiment_functions - INFO - Early stopping at epoch 600. Best Metrics: (0.03663166528976157, 0.004519726706410342, 0.017549331841084776)
2026-06-15 08:50:31,983 - optuna.study.study - INFO - Trial 252 finished with values: [0.03663166528976157, 0.004519726706410342, 0.017549331841084776] and parameters: {'n_layers': 4, 'embedding_dim': 96, 'lr': 0.002500554323958941, 'lambda_val': 0.00010936849207517709, 'batch_size': 3067, 'optimizer': 'Adam'}.
2026-06-15 08:50:52,627 - experiment_functions - INFO - Early stopping at epoch 500. Best Metrics: (0.0004701850445782968, 8.038046754638624e-05, 0.00022088115260160475)
2026-06-15 08:50:52,699 - optuna.study.study - INFO - Trial 253 finished with values: [0.0004701850445782968, 8.038046754638624e-05, 0.00022088115260160475] and parameters: {'n_layers': 1, 'embedding_dim': 64, 'lr': 0.0019049517999197474, 'lambda_val': 1.722502032465723e-05, 'batch_size': 3067, 'optimizer': 'SGD'}.
2026-06-15 08:53:57,459 - optuna.study.study - INFO - Trial 254 finished with values: [0.07849569588684427, 0.009290642373903141, 0.0382700296332411] and parameters: {'n_layers': 1, 'embedding_dim': 256, 'lr': 0.0031673995217555086, 'lambda_val': 1.722502032465723e-05, 'batch_size': 2363, 'optimizer': 'RMSprop'}.
2026-06-15 08:54:37,035 - experiment_functions - INFO - Early stopping at epoch 800. Best Metrics: (0.060642908209045214, 0.0073062495813517305, 0.02981246374531749)
2026-06-15 08:54:37,119 - optuna.study.study - INFO - Trial 255 finished with values: [0.060642908209045214, 0.0073062495813517305, 0.02981246374531749] and parameters: {'n_layers': 3, 'embedding_dim': 128, 'lr': 0.0013635493562820199, 'lambda_val': 1.2492162876084175e-05, 'batch_size': 4084, 'optimizer': 'Adam'}.
2026-06-15 08:56:45,755 - experiment_functions - INFO - Early stopping at epoch 2750. Best Metrics: (0.09979539680675431, 0.011894634603791279, 0.05123701653132765)
2026-06-15 08:56:45,881 - optuna.study.study - INFO - Trial 256 finished with values: [0.09979539680675431, 0.011894634603791279, 0.05123701653132765] and parameters: {'n_layers': 1, 'embedding_dim': 256, 'lr': 0.0016748417327479524, 'lambda_val': 1.2492162876084175e-05, 'batch_size': 1243, 'optimizer': 'RMSprop'}.
2026-06-15 08:57:07,490 - experiment_functions - INFO - Early stopping at epoch 500. Best Metrics: (0.0002787253063964982, 6.028535065978967e-05, 0.00015643527503974384)
2026-06-15 08:57:07,586 - optuna.study.study - INFO - Trial 257 finished with values: [0.0002787253063964982, 6.028535065978967e-05, 0.00015643527503974384] and parameters: {'n_layers': 1, 'embedding_dim': 128, 'lr': 0.0013635493562820199, 'lambda_val': 1.722502032465723e-05, 'batch_size': 3062, 'optimizer': 'SGD'}.
2026-06-15 08:57:29,096 - experiment_functions - INFO - Early stopping at epoch 500. Best Metrics: (0.00036655599917680983, 6.028535065978968e-05, 0.00014471876530413357)
2026-06-15 08:57:29,215 - optuna.study.study - INFO - Trial 258 finished with values: [0.00036655599917680983, 6.028535065978968e-05, 0.00014471876530413357] and parameters: {'n_layers': 1, 'embedding_dim': 128, 'lr': 0.0013399936052392054, 'lambda_val': 0.00036402541279450417, 'batch_size': 2363, 'optimizer': 'SGD'}.
2026-06-15 08:59:28,579 - experiment_functions - INFO - Early stopping at epoch 2700. Best Metrics: (0.03936951831202534, 0.004487909438006564, 0.01764642959999411)
2026-06-15 08:59:28,655 - optuna.study.study - INFO - Trial 259 finished with values: [0.03936951831202534, 0.004487909438006564, 0.01764642959999411] and parameters: {'n_layers': 3, 'embedding_dim': 96, 'lr': 0.0031668054510016214, 'lambda_val': 1.2492162876084175e-05, 'batch_size': 1243, 'optimizer': 'Adam'}.
2026-06-15 09:02:19,321 - optuna.study.study - INFO - Trial 260 finished with values: [0.10580157916140309, 0.012715185209993972, 0.05650989872906977] and parameters: {'n_layers': 1, 'embedding_dim': 128, 'lr': 0.0013635493562820199, 'lambda_val': 1.2492162876084175e-05, 'batch_size': 3123, 'optimizer': 'Adam'}.
2026-06-15 09:03:21,062 - experiment_functions - INFO - Early stopping at epoch 1300. Best Metrics: (0.08334113346160267, 0.009826512157545715, 0.041423564720500454)
2026-06-15 09:03:21,183 - optuna.study.study - INFO - Trial 261 finished with values: [0.08334113346160267, 0.009826512157545715, 0.041423564720500454] and parameters: {'n_layers': 1, 'embedding_dim': 256, 'lr': 0.002403322646261187, 'lambda_val': 4.768107725372831e-05, 'batch_size': 1670, 'optimizer': 'RMSprop'}.
2026-06-15 09:06:27,844 - optuna.study.study - INFO - Trial 262 finished with values: [0.0892996321733437, 0.010829593408801661, 0.04615699942220461] and parameters: {'n_layers': 1, 'embedding_dim': 256, 'lr': 0.002403322646261187, 'lambda_val': 0.00010936849207517709, 'batch_size': 573, 'optimizer': 'Adam'}.
2026-06-15 09:08:50,090 - experiment_functions - INFO - Early stopping at epoch 3350. Best Metrics: (0.08911812655811678, 0.010722419452073145, 0.045623193238834577)
2026-06-15 09:08:50,178 - optuna.study.study - INFO - Trial 263 finished with values: [0.08911812655811678, 0.010722419452073145, 0.045623193238834577] and parameters: {'n_layers': 1, 'embedding_dim': 128, 'lr': 0.001903084586886964, 'lambda_val': 0.0001436822287105441, 'batch_size': 974, 'optimizer': 'RMSprop'}.
2026-06-15 09:09:37,405 - experiment_functions - INFO - Early stopping at epoch 800. Best Metrics: (0.05781578791588156, 0.006900998057472034, 0.028001657739905438)
2026-06-15 09:09:37,485 - optuna.study.study - INFO - Trial 264 finished with values: [0.05781578791588156, 0.006900998057472034, 0.028001657739905438] and parameters: {'n_layers': 3, 'embedding_dim': 256, 'lr': 0.0013399936052392054, 'lambda_val': 5.643151325737332e-05, 'batch_size': 1670, 'optimizer': 'Adam'}.
2026-06-15 09:11:36,703 - experiment_functions - INFO - Early stopping at epoch 2800. Best Metrics: (0.10262126893856711, 0.0123467747337397, 0.054793712576251125)
2026-06-15 09:11:36,788 - optuna.study.study - INFO - Trial 265 finished with values: [0.10262126893856711, 0.0123467747337397, 0.054793712576251125] and parameters: {'n_layers': 1, 'embedding_dim': 128, 'lr': 0.0013635493562820199, 'lambda_val': 0.00036402541279450417, 'batch_size': 2519, 'optimizer': 'Adam'}.
2026-06-15 09:14:25,415 - optuna.study.study - INFO - Trial 266 finished with values: [0.09828322054524666, 0.01227476723156273, 0.05484713063723555] and parameters: {'n_layers': 1, 'embedding_dim': 128, 'lr': 0.0013635493562820199, 'lambda_val': 1.722502032465723e-05, 'batch_size': 1243, 'optimizer': 'Adam'}.
2026-06-15 09:15:13,917 - experiment_functions - INFO - Early stopping at epoch 1000. Best Metrics: (0.04210752589383462, 0.0048378993904481206, 0.01944992062433876)
2026-06-15 09:15:13,993 - optuna.study.study - INFO - Trial 267 finished with values: [0.04210752589383462, 0.0048378993904481206, 0.01944992062433876] and parameters: {'n_layers': 3, 'embedding_dim': 128, 'lr': 0.0031668054510016214, 'lambda_val': 4.768107725372831e-05, 'batch_size': 2161, 'optimizer': 'Adam'}.
2026-06-15 09:18:03,288 - optuna.study.study - INFO - Trial 268 finished with values: [0.10017164176830798, 0.012184339205573049, 0.05443324364777776] and parameters: {'n_layers': 1, 'embedding_dim': 128, 'lr': 0.0013635493562820199, 'lambda_val': 1.722502032465723e-05, 'batch_size': 1670, 'optimizer': 'RMSprop'}.
2026-06-15 09:20:43,055 - optuna.study.study - INFO - Trial 269 finished with values: [0.09642922448363439, 0.011968316699042131, 0.05336219262971507] and parameters: {'n_layers': 1, 'embedding_dim': 64, 'lr': 0.0016748417327479524, 'lambda_val': 4.768107725372831e-05, 'batch_size': 1243, 'optimizer': 'Adam'}.
2026-06-15 09:23:32,031 - optuna.study.study - INFO - Trial 270 finished with values: [0.09873172626703122, 0.012105633331100542, 0.05417235035412419] and parameters: {'n_layers': 1, 'embedding_dim': 128, 'lr': 0.0013635493562820199, 'lambda_val': 5.271398387722209e-05, 'batch_size': 1587, 'optimizer': 'RMSprop'}.
2026-06-15 09:23:59,287 - experiment_functions - INFO - Early stopping at epoch 650. Best Metrics: (0.017991841765320496, 0.0024934690870118564, 0.00929283480650689)
2026-06-15 09:23:59,392 - optuna.study.study - INFO - Trial 271 finished with values: [0.017991841765320496, 0.0024934690870118564, 0.00929283480650689] and parameters: {'n_layers': 1, 'embedding_dim': 96, 'lr': 0.026061197139814463, 'lambda_val': 1.722502032465723e-05, 'batch_size': 1670, 'optimizer': 'RMSprop'}.
2026-06-15 09:24:30,776 - experiment_functions - INFO - Early stopping at epoch 700. Best Metrics: (0.0804995864167497, 0.010194922633799989, 0.04388943120171378)
2026-06-15 09:24:30,865 - optuna.study.study - INFO - Trial 272 finished with values: [0.0804995864167497, 0.010194922633799989, 0.04388943120171378] and parameters: {'n_layers': 1, 'embedding_dim': 128, 'lr': 0.004583711632176899, 'lambda_val': 0.00036402541279450417, 'batch_size': 2538, 'optimizer': 'Adam'}.
2026-06-15 09:25:21,265 - experiment_functions - INFO - Early stopping at epoch 1150. Best Metrics: (0.09784888978764823, 0.011824301694688191, 0.05154020465855101)
2026-06-15 09:25:21,355 - optuna.study.study - INFO - Trial 273 finished with values: [0.09784888978764823, 0.011824301694688191, 0.05154020465855101] and parameters: {'n_layers': 1, 'embedding_dim': 128, 'lr': 0.002403322646261187, 'lambda_val': 4.768107725372831e-05, 'batch_size': 3062, 'optimizer': 'Adam'}.
2026-06-15 09:26:06,978 - experiment_functions - INFO - Early stopping at epoch 950. Best Metrics: (0.04079029927619907, 0.004940049567954987, 0.01885283794031341)
2026-06-15 09:26:07,057 - optuna.study.study - INFO - Trial 274 finished with values: [0.04079029927619907, 0.004940049567954987, 0.01885283794031341] and parameters: {'n_layers': 4, 'embedding_dim': 96, 'lr': 0.0013635493562820199, 'lambda_val': 0.00036402541279450417, 'batch_size': 1670, 'optimizer': 'Adam'}.
2026-06-15 09:27:05,874 - experiment_functions - INFO - Early stopping at epoch 1350. Best Metrics: (0.09509928185402781, 0.011372161564739771, 0.05077555206605147)
2026-06-15 09:27:05,952 - optuna.study.study - INFO - Trial 275 finished with values: [0.09509928185402781, 0.011372161564739771, 0.05077555206605147] and parameters: {'n_layers': 1, 'embedding_dim': 128, 'lr': 0.002403322646261187, 'lambda_val': 1.722502032465723e-05, 'batch_size': 2600, 'optimizer': 'Adam'}.
2026-06-15 09:29:33,329 - experiment_functions - INFO - Early stopping at epoch 3450. Best Metrics: (0.10688706324836396, 0.012825708352870252, 0.057674635403349266)
2026-06-15 09:29:33,415 - optuna.study.study - INFO - Trial 276 finished with values: [0.10688706324836396, 0.012825708352870252, 0.057674635403349266] and parameters: {'n_layers': 1, 'embedding_dim': 128, 'lr': 0.0013399936052392054, 'lambda_val': 1.722502032465723e-05, 'batch_size': 3073, 'optimizer': 'Adam'}.
2026-06-15 09:29:56,528 - experiment_functions - INFO - Early stopping at epoch 550. Best Metrics: (0.0004919024620236257, 8.875343291580146e-05, 0.0002443745668998872)
2026-06-15 09:29:56,624 - optuna.study.study - INFO - Trial 277 finished with values: [0.0004919024620236257, 8.875343291580146e-05, 0.0002443745668998872] and parameters: {'n_layers': 1, 'embedding_dim': 96, 'lr': 7.660360135572097e-05, 'lambda_val': 1.722502032465723e-05, 'batch_size': 3170, 'optimizer': 'Adam'}.
2026-06-15 09:31:10,276 - experiment_functions - INFO - Early stopping at epoch 1550. Best Metrics: (0.08956111216084664, 0.010913323062495815, 0.04642078303242399)
2026-06-15 09:31:10,406 - optuna.study.study - INFO - Trial 278 finished with values: [0.08956111216084664, 0.010913323062495815, 0.04642078303242399] and parameters: {'n_layers': 1, 'embedding_dim': 256, 'lr': 0.002500554323958941, 'lambda_val': 0.00010936849207517709, 'batch_size': 1005, 'optimizer': 'Adam'}.
2026-06-15 09:31:54,323 - experiment_functions - INFO - Early stopping at epoch 1000. Best Metrics: (0.09367834993778255, 0.011293455690267264, 0.05038275337192083)
2026-06-15 09:31:54,411 - optuna.study.study - INFO - Trial 279 finished with values: [0.09367834993778255, 0.011293455690267264, 0.05038275337192083] and parameters: {'n_layers': 1, 'embedding_dim': 128, 'lr': 0.002403322646261187, 'lambda_val': 0.0003193434431604667, 'batch_size': 2538, 'optimizer': 'Adam'}.
2026-06-15 09:32:59,167 - experiment_functions - INFO - Early stopping at epoch 1500. Best Metrics: (0.09977977944482332, 0.011990086409002612, 0.052443891582646465)
2026-06-15 09:32:59,236 - optuna.study.study - INFO - Trial 280 finished with values: [0.09977977944482332, 0.011990086409002612, 0.052443891582646465] and parameters: {'n_layers': 1, 'embedding_dim': 128, 'lr': 0.0016748417327479524, 'lambda_val': 0.0003193434431604667, 'batch_size': 3727, 'optimizer': 'Adam'}.
2026-06-15 09:33:43,404 - experiment_functions - INFO - Early stopping at epoch 1000. Best Metrics: (0.0955941352426968, 0.011604930002009512, 0.05178707755028285)
2026-06-15 09:33:43,478 - optuna.study.study - INFO - Trial 281 finished with values: [0.0955941352426968, 0.011604930002009512, 0.05178707755028285] and parameters: {'n_layers': 1, 'embedding_dim': 128, 'lr': 0.002500554323958941, 'lambda_val': 1.722502032465723e-05, 'batch_size': 3170, 'optimizer': 'Adam'}.
2026-06-15 09:36:27,616 - optuna.study.study - INFO - Trial 282 finished with values: [0.09550236814832501, 0.012031951235849691, 0.051988390913354866] and parameters: {'n_layers': 1, 'embedding_dim': 96, 'lr': 0.0013635493562820199, 'lambda_val': 0.00036402541279450417, 'batch_size': 1243, 'optimizer': 'Adam'}.
2026-06-15 09:39:12,491 - optuna.study.study - INFO - Trial 283 finished with values: [0.09978867643852596, 0.012293187755375443, 0.055066169881919015] and parameters: {'n_layers': 1, 'embedding_dim': 96, 'lr': 0.0013399936052392054, 'lambda_val': 0.00010936849207517709, 'batch_size': 1670, 'optimizer': 'Adam'}.
2026-06-15 09:39:36,319 - experiment_functions - INFO - Early stopping at epoch 550. Best Metrics: (0.03277346985748807, 0.004015674191171546, 0.015478490777204194)
2026-06-15 09:39:36,408 - optuna.study.study - INFO - Trial 284 finished with values: [0.03277346985748807, 0.004015674191171546, 0.015478490777204194] and parameters: {'n_layers': 1, 'embedding_dim': 96, 'lr': 0.04032731630707323, 'lambda_val': 0.0003193434431604667, 'batch_size': 2538, 'optimizer': 'Adam'}.
2026-06-15 09:42:17,723 - optuna.study.study - INFO - Trial 285 finished with values: [0.04163951687034695, 0.0052347779489584035, 0.019431086438255463] and parameters: {'n_layers': 1, 'embedding_dim': 128, 'lr': 0.04931642930511404, 'lambda_val': 0.0016135144594650256, 'batch_size': 2420, 'optimizer': 'RMSprop'}.
2026-06-15 09:44:09,622 - experiment_functions - INFO - Early stopping at epoch 2650. Best Metrics: (0.09641508307207353, 0.011861142742313617, 0.05239953486589295)
2026-06-15 09:44:09,700 - optuna.study.study - INFO - Trial 286 finished with values: [0.09641508307207353, 0.011861142742313617, 0.05239953486589295] and parameters: {'n_layers': 1, 'embedding_dim': 128, 'lr': 0.0016748417327479524, 'lambda_val': 0.00036402541279450417, 'batch_size': 1243, 'optimizer': 'Adam'}.
2026-06-15 09:47:14,481 - optuna.study.study - INFO - Trial 287 finished with values: [0.03197757183953074, 0.003747739299350258, 0.014511016008692208] and parameters: {'n_layers': 3, 'embedding_dim': 128, 'lr': 0.0031668054510016214, 'lambda_val': 3.215925176464318e-06, 'batch_size': 607, 'optimizer': 'Adam'}.
2026-06-15 09:49:04,443 - experiment_functions - INFO - Early stopping at epoch 2650. Best Metrics: (0.09863696480033209, 0.012122379261839372, 0.052578224798242264)
2026-06-15 09:49:04,566 - optuna.study.study - INFO - Trial 288 finished with values: [0.09863696480033209, 0.012122379261839372, 0.052578224798242264] and parameters: {'n_layers': 1, 'embedding_dim': 96, 'lr': 0.0016748417327479524, 'lambda_val': 0.00036402541279450417, 'batch_size': 1670, 'optimizer': 'Adam'}.
2026-06-15 09:51:08,417 - experiment_functions - INFO - Early stopping at epoch 2650. Best Metrics: (0.09587417523139115, 0.01182262710161431, 0.05000468940640516)
2026-06-15 09:51:08,508 - optuna.study.study - INFO - Trial 289 finished with values: [0.09587417523139115, 0.01182262710161431, 0.05000468940640516] and parameters: {'n_layers': 1, 'embedding_dim': 256, 'lr': 0.0013399936052392054, 'lambda_val': 0.00036402541279450417, 'batch_size': 1243, 'optimizer': 'RMSprop'}.
2026-06-15 09:51:52,174 - experiment_functions - INFO - Early stopping at epoch 1000. Best Metrics: (0.09194071952733143, 0.011325272958671043, 0.04828708261533386)
2026-06-15 09:51:52,248 - optuna.study.study - INFO - Trial 290 finished with values: [0.09194071952733143, 0.011325272958671043, 0.04828708261533386] and parameters: {'n_layers': 1, 'embedding_dim': 128, 'lr': 0.0031668054510016214, 'lambda_val': 4.768107725372831e-05, 'batch_size': 1670, 'optimizer': 'Adam'}.
2026-06-15 09:54:37,326 - optuna.study.study - INFO - Trial 291 finished with values: [0.09910233130162917, 0.012319981244557573, 0.05531138520240787] and parameters: {'n_layers': 1, 'embedding_dim': 96, 'lr': 0.0013635493562820199, 'lambda_val': 4.768107725372831e-05, 'batch_size': 1670, 'optimizer': 'Adam'}.
2026-06-15 09:55:25,623 - experiment_functions - INFO - Early stopping at epoch 1000. Best Metrics: (0.04306320933956057, 0.005236452542032287, 0.020920564876084624)
2026-06-15 09:55:25,699 - optuna.study.study - INFO - Trial 292 finished with values: [0.04306320933956057, 0.005236452542032287, 0.020920564876084624] and parameters: {'n_layers': 4, 'embedding_dim': 96, 'lr': 0.0013635493562820199, 'lambda_val': 0.00036402541279450417, 'batch_size': 2538, 'optimizer': 'Adam'}.
2026-06-15 09:55:49,682 - experiment_functions - INFO - Early stopping at epoch 550. Best Metrics: (0.030170778892540828, 0.003955388840511756, 0.014451907710830202)
