2026-06-15 09:55:49,771 - optuna.study.study - INFO - Trial 293 finished with values: [0.030170778892540828, 0.003955388840511756, 0.014451907710830202] and parameters: {'n_layers': 1, 'embedding_dim': 96, 'lr': 0.032290945576012066, 'lambda_val': 1.722502032465723e-05, 'batch_size': 1670, 'optimizer': 'Adam'}.
2026-06-15 09:58:08,470 - experiment_functions - INFO - Early stopping at epoch 3550. Best Metrics: (0.0903164805955873, 0.010980306785451137, 0.04794999661421325)
2026-06-15 09:58:08,556 - optuna.study.study - INFO - Trial 294 finished with values: [0.0903164805955873, 0.010980306785451137, 0.04794999661421325] and parameters: {'n_layers': 1, 'embedding_dim': 32, 'lr': 0.001903084586886964, 'lambda_val': 4.768107725372831e-05, 'batch_size': 2108, 'optimizer': 'RMSprop'}.
2026-06-15 10:00:58,477 - optuna.study.study - INFO - Trial 295 finished with values: [0.10094692506036554, 0.012541027530310134, 0.056388045986449115] and parameters: {'n_layers': 1, 'embedding_dim': 128, 'lr': 0.0013635493562820199, 'lambda_val': 0.00010708528521383159, 'batch_size': 1670, 'optimizer': 'Adam'}.
2026-06-15 10:03:38,625 - experiment_functions - INFO - Early stopping at epoch 3450. Best Metrics: (0.08514557608671436, 0.009925313148904817, 0.04116705777425962)
2026-06-15 10:03:38,706 - optuna.study.study - INFO - Trial 296 finished with values: [0.08514557608671436, 0.009925313148904817, 0.04116705777425962] and parameters: {'n_layers': 1, 'embedding_dim': 256, 'lr': 0.002500554323958941, 'lambda_val': 6.0559834187122076e-05, 'batch_size': 1243, 'optimizer': 'RMSprop'}.
2026-06-15 10:04:43,589 - experiment_functions - INFO - Early stopping at epoch 1350. Best Metrics: (0.093543221540936, 0.011069060218366936, 0.04880261635886617)
2026-06-15 10:04:43,675 - optuna.study.study - INFO - Trial 297 finished with values: [0.093543221540936, 0.011069060218366936, 0.04880261635886617] and parameters: {'n_layers': 1, 'embedding_dim': 256, 'lr': 0.0016748417327479524, 'lambda_val': 6.096576799304491e-06, 'batch_size': 2538, 'optimizer': 'RMSprop'}.
2026-06-15 10:07:28,804 - optuna.study.study - INFO - Trial 298 finished with values: [0.09775463869418347, 0.01217429164712975, 0.054041257089470385] and parameters: {'n_layers': 1, 'embedding_dim': 96, 'lr': 0.0013635493562820199, 'lambda_val': 1.722502032465723e-05, 'batch_size': 1670, 'optimizer': 'Adam'}.
2026-06-15 10:10:07,425 - experiment_functions - INFO - Early stopping at epoch 3900. Best Metrics: (0.09697538329520745, 0.011690334248777547, 0.05296232224285524)
2026-06-15 10:10:07,503 - optuna.study.study - INFO - Trial 299 finished with values: [0.09697538329520745, 0.011690334248777547, 0.05296232224285524] and parameters: {'n_layers': 1, 'embedding_dim': 64, 'lr': 0.0013635493562820199, 'lambda_val': 1.722502032465723e-05, 'batch_size': 3123, 'optimizer': 'RMSprop'}.
2026-06-15 10:10:07,518 - root - INFO - Selected Trial 194 based on Max ndcg: 0.0578
2026-06-15 10:10:07,518 - root - INFO - Associated Recall: 0.1045
2026-06-15 10:10:07,518 - experiment_functions - INFO - Training the best model ... for e_gowalla_1c3dcs_rand3
2026-06-15 10:12:55,524 - root - INFO -   **** Training e_gowalla_1c3dcs_rand4
2026-06-15 10:12:55,663 - root - INFO -   **** Getting 558671/845292 random edges
2026-06-15 10:12:55,921 - optuna.storages._rdb.storage - INFO - A new study created in RDB with name: Study_e_gowalla_1c3dcs_rand4
2026-06-15 10:16:13,452 - optuna.study.study - INFO - Trial 0 finished with values: [0.00083504232542099, 0.00011219773595016412, 0.0004514796882353902] and parameters: {'n_layers': 2, 'embedding_dim': 256, 'lr': 0.00010738672816125488, 'lambda_val': 1.297260687824371e-05, 'batch_size': 890, 'optimizer': 'RMSprop'}.
2026-06-15 10:19:18,260 - optuna.study.study - INFO - Trial 1 finished with values: [0.03909855931616864, 0.004857994507334718, 0.019867177483791913] and parameters: {'n_layers': 4, 'embedding_dim': 96, 'lr': 0.0008138925204745388, 'lambda_val': 0.0002014587319781766, 'batch_size': 558, 'optimizer': 'RMSprop'}.
2026-06-15 10:19:41,253 - experiment_functions - INFO - Early stopping at epoch 500. Best Metrics: (0.00036623687032435494, 6.86583160292049e-05, 0.00017500418961268962)
2026-06-15 10:19:41,337 - optuna.study.study - INFO - Trial 2 finished with values: [0.00036623687032435494, 6.86583160292049e-05, 0.00017500418961268962] and parameters: {'n_layers': 4, 'embedding_dim': 64, 'lr': 0.016622698556473102, 'lambda_val': 0.054054390406212044, 'batch_size': 1972, 'optimizer': 'SGD'}.
2026-06-15 10:20:25,531 - experiment_functions - INFO - Early stopping at epoch 900. Best Metrics: (0.0970209705087795, 0.011839373032353138, 0.051576842152621157)
2026-06-15 10:20:25,607 - optuna.study.study - INFO - Trial 3 finished with values: [0.0970209705087795, 0.011839373032353138, 0.051576842152621157] and parameters: {'n_layers': 1, 'embedding_dim': 256, 'lr': 0.0026397990430783503, 'lambda_val': 1.0723270203484857e-05, 'batch_size': 3981, 'optimizer': 'Adam'}.
2026-06-15 10:21:12,627 - experiment_functions - INFO - Early stopping at epoch 1000. Best Metrics: (0.0005683883455555335, 8.372965369415233e-05, 0.0002690523242694589)
2026-06-15 10:21:12,719 - optuna.study.study - INFO - Trial 4 finished with values: [0.0005683883455555335, 8.372965369415233e-05, 0.0002690523242694589] and parameters: {'n_layers': 3, 'embedding_dim': 128, 'lr': 3.476375194109272e-05, 'lambda_val': 2.630457824840663e-05, 'batch_size': 2770, 'optimizer': 'Adam'}.
2026-06-15 10:21:47,512 - experiment_functions - INFO - Early stopping at epoch 850. Best Metrics: (0.0004576346696943724, 7.535668832473711e-05, 0.00021629897290825217)
2026-06-15 10:21:47,601 - optuna.study.study - INFO - Trial 5 finished with values: [0.0004576346696943724, 7.535668832473711e-05, 0.00021629897290825217] and parameters: {'n_layers': 4, 'embedding_dim': 32, 'lr': 1.4920013235879184e-05, 'lambda_val': 0.026359968516020325, 'batch_size': 2872, 'optimizer': 'Adam'}.
2026-06-15 10:22:16,789 - experiment_functions - INFO - Early stopping at epoch 500. Best Metrics: (0.0004290482792255591, 6.865831602920491e-05, 0.00017219822630168204)
2026-06-15 10:22:17,173 - optuna.study.study - INFO - Trial 6 finished with values: [0.0004290482792255591, 6.865831602920491e-05, 0.00017219822630168204] and parameters: {'n_layers': 3, 'embedding_dim': 256, 'lr': 0.002875936463730694, 'lambda_val': 8.416100909608305e-06, 'batch_size': 638, 'optimizer': 'SGD'}.
2026-06-15 10:25:14,438 - optuna.study.study - INFO - Trial 7 finished with values: [0.052484340520847515, 0.006453881706745261, 0.025958548867675135] and parameters: {'n_layers': 3, 'embedding_dim': 96, 'lr': 0.0009437548244297628, 'lambda_val': 1.509459220212265e-05, 'batch_size': 1942, 'optimizer': 'RMSprop'}.
2026-06-15 10:25:57,838 - experiment_functions - INFO - Early stopping at epoch 1150. Best Metrics: (0.0003565138162373573, 7.200750217697099e-05, 0.00018249956319349933)
2026-06-15 10:25:57,917 - optuna.study.study - INFO - Trial 8 finished with values: [0.0003565138162373573, 7.200750217697099e-05, 0.00018249956319349933] and parameters: {'n_layers': 1, 'embedding_dim': 32, 'lr': 4.849869813571652e-05, 'lambda_val': 3.899309689746092e-06, 'batch_size': 3586, 'optimizer': 'Adam'}.
2026-06-15 10:26:28,943 - experiment_functions - INFO - Early stopping at epoch 650. Best Metrics: (0.029884783665900864, 0.0036187956326612634, 0.013786378935420368)
2026-06-15 10:26:29,076 - optuna.study.study - INFO - Trial 9 finished with values: [0.029884783665900864, 0.0036187956326612634, 0.013786378935420368] and parameters: {'n_layers': 1, 'embedding_dim': 256, 'lr': 0.01036324135738448, 'lambda_val': 0.004600256253014536, 'batch_size': 2285, 'optimizer': 'RMSprop'}.
2026-06-15 10:27:08,731 - experiment_functions - INFO - Early stopping at epoch 600. Best Metrics: (0.04456764958681641, 0.0054909906892625085, 0.022229611150769064)
2026-06-15 10:27:08,818 - optuna.study.study - INFO - Trial 10 finished with values: [0.04456764958681641, 0.0054909906892625085, 0.022229611150769064] and parameters: {'n_layers': 4, 'embedding_dim': 256, 'lr': 0.0016086229224309184, 'lambda_val': 2.9677369546189456e-06, 'batch_size': 3981, 'optimizer': 'Adam'}.
2026-06-15 10:27:46,284 - experiment_functions - INFO - Early stopping at epoch 900. Best Metrics: (0.03861547196917783, 0.004697233572241945, 0.01823129791819497)
2026-06-15 10:27:46,377 - optuna.study.study - INFO - Trial 11 finished with values: [0.03861547196917783, 0.004697233572241945, 0.01823129791819497] and parameters: {'n_layers': 4, 'embedding_dim': 32, 'lr': 0.0014227121487339167, 'lambda_val': 0.0004230572417097157, 'batch_size': 3360, 'optimizer': 'Adam'}.
2026-06-15 10:29:24,663 - experiment_functions - INFO - Early stopping at epoch 1550. Best Metrics: (0.044790569879110106, 0.005648402438207516, 0.02224532068502206)
2026-06-15 10:29:24,756 - optuna.study.study - INFO - Trial 12 finished with values: [0.044790569879110106, 0.005648402438207516, 0.02224532068502206] and parameters: {'n_layers': 4, 'embedding_dim': 256, 'lr': 0.0006397931509825065, 'lambda_val': 0.0013236495906126266, 'batch_size': 1273, 'optimizer': 'Adam'}.
2026-06-15 10:29:48,019 - experiment_functions - INFO - Early stopping at epoch 550. Best Metrics: (0.02679054056029024, 0.0031046955589791683, 0.011802638935606834)
2026-06-15 10:29:48,119 - optuna.study.study - INFO - Trial 13 finished with values: [0.02679054056029024, 0.0031046955589791683, 0.011802638935606834] and parameters: {'n_layers': 3, 'embedding_dim': 32, 'lr': 0.039479536736250924, 'lambda_val': 1.914898476788421e-06, 'batch_size': 3951, 'optimizer': 'Adam'}.
2026-06-15 10:32:33,717 - optuna.study.study - INFO - Trial 14 finished with values: [0.06223846240110597, 0.007117020564002948, 0.029630854098376656] and parameters: {'n_layers': 1, 'embedding_dim': 128, 'lr': 0.007264999721759937, 'lambda_val': 4.6804655463952444e-05, 'batch_size': 3812, 'optimizer': 'RMSprop'}.
2026-06-15 10:32:56,425 - experiment_functions - INFO - Early stopping at epoch 500. Best Metrics: (0.00043626262299865357, 7.033290910308795e-05, 0.00018065728598319362)
2026-06-15 10:32:56,517 - optuna.study.study - INFO - Trial 15 finished with values: [0.00043626262299865357, 7.033290910308795e-05, 0.00018065728598319362] and parameters: {'n_layers': 4, 'embedding_dim': 64, 'lr': 0.0011341136552884576, 'lambda_val': 0.03418738836332104, 'batch_size': 2972, 'optimizer': 'SGD'}.
2026-06-15 10:35:18,095 - experiment_functions - INFO - Early stopping at epoch 2500. Best Metrics: (0.03417633556878293, 0.003714247437872597, 0.015316651255479383)
2026-06-15 10:35:18,182 - optuna.study.study - INFO - Trial 16 finished with values: [0.03417633556878293, 0.003714247437872597, 0.015316651255479383] and parameters: {'n_layers': 3, 'embedding_dim': 256, 'lr': 0.005988564288598955, 'lambda_val': 0.00039003938593281393, 'batch_size': 1699, 'optimizer': 'Adam'}.
2026-06-15 10:35:44,498 - experiment_functions - INFO - Early stopping at epoch 500. Best Metrics: (0.0005284175013701679, 6.86583160292049e-05, 0.00024656727271451227)
2026-06-15 10:35:44,597 - optuna.study.study - INFO - Trial 17 finished with values: [0.0005284175013701679, 6.86583160292049e-05, 0.00024656727271451227] and parameters: {'n_layers': 2, 'embedding_dim': 256, 'lr': 5.250508420251108e-05, 'lambda_val': 0.0215792743869707, 'batch_size': 1160, 'optimizer': 'SGD'}.
2026-06-15 10:38:19,751 - optuna.study.study - INFO - Trial 18 finished with values: [0.0053126723037789534, 0.0009360975283006231, 0.003225267004650589] and parameters: {'n_layers': 2, 'embedding_dim': 64, 'lr': 0.0002228538617738401, 'lambda_val': 5.9434208179812506e-06, 'batch_size': 1511, 'optimizer': 'Adam'}.
2026-06-15 10:38:44,251 - experiment_functions - INFO - Early stopping at epoch 500. Best Metrics: (0.0005156298275447984, 8.372965369415233e-05, 0.00023607002495542117)
2026-06-15 10:38:44,353 - optuna.study.study - INFO - Trial 19 finished with values: [0.0005156298275447984, 8.372965369415233e-05, 0.00023607002495542117] and parameters: {'n_layers': 3, 'embedding_dim': 128, 'lr': 0.030109296765145958, 'lambda_val': 3.0681113443407845e-05, 'batch_size': 3690, 'optimizer': 'SGD'}.
2026-06-15 10:39:14,522 - experiment_functions - INFO - Early stopping at epoch 700. Best Metrics: (0.08503208312502332, 0.01045950833947351, 0.04438167270959161)
2026-06-15 10:39:14,604 - optuna.study.study - INFO - Trial 20 finished with values: [0.08503208312502332, 0.01045950833947351, 0.04438167270959161] and parameters: {'n_layers': 1, 'embedding_dim': 96, 'lr': 0.005616296548051391, 'lambda_val': 2.0471988586907107e-05, 'batch_size': 2572, 'optimizer': 'Adam'}.
2026-06-15 10:39:42,145 - experiment_functions - INFO - Early stopping at epoch 700. Best Metrics: (0.0005310839190529571, 8.038046754638622e-05, 0.0002628536959034082)
2026-06-15 10:39:42,236 - optuna.study.study - INFO - Trial 21 finished with values: [0.0005310839190529571, 8.038046754638622e-05, 0.0002628536959034082] and parameters: {'n_layers': 1, 'embedding_dim': 32, 'lr': 4.731234178816297e-05, 'lambda_val': 6.419455382808353e-05, 'batch_size': 2831, 'optimizer': 'RMSprop'}.
2026-06-15 10:40:08,137 - experiment_functions - INFO - Early stopping at epoch 500. Best Metrics: (0.0004725304091704275, 8.038046754638622e-05, 0.00022581969917449186)
2026-06-15 10:40:08,225 - optuna.study.study - INFO - Trial 22 finished with values: [0.0004725304091704275, 8.038046754638622e-05, 0.00022581969917449186] and parameters: {'n_layers': 4, 'embedding_dim': 128, 'lr': 0.00027114321178925145, 'lambda_val': 1.2629561238240175e-05, 'batch_size': 3435, 'optimizer': 'SGD'}.
2026-06-15 10:40:31,003 - experiment_functions - INFO - Early stopping at epoch 500. Best Metrics: (0.0004283005498993361, 5.6936164512023584e-05, 0.00017550421561585754)
2026-06-15 10:40:31,129 - optuna.study.study - INFO - Trial 23 finished with values: [0.0004283005498993361, 5.6936164512023584e-05, 0.00017550421561585754] and parameters: {'n_layers': 4, 'embedding_dim': 64, 'lr': 3.389867855730289e-05, 'lambda_val': 3.340392814976974e-06, 'batch_size': 2169, 'optimizer': 'SGD'}.
2026-06-15 10:42:39,662 - experiment_functions - INFO - Early stopping at epoch 3250. Best Metrics: (0.0006806928694297495, 8.372965369415233e-05, 0.0002742585865093372)
2026-06-15 10:42:39,741 - optuna.study.study - INFO - Trial 24 finished with values: [0.0006806928694297495, 8.372965369415233e-05, 0.0002742585865093372] and parameters: {'n_layers': 1, 'embedding_dim': 128, 'lr': 8.567524870866286e-05, 'lambda_val': 2.2987320743696026e-05, 'batch_size': 3526, 'optimizer': 'RMSprop'}.
2026-06-15 10:43:14,213 - experiment_functions - INFO - Early stopping at epoch 700. Best Metrics: (0.0797533413449314, 0.009742782503851565, 0.040871551419121854)
2026-06-15 10:43:14,359 - optuna.study.study - INFO - Trial 25 finished with values: [0.0797533413449314, 0.009742782503851565, 0.040871551419121854] and parameters: {'n_layers': 1, 'embedding_dim': 256, 'lr': 0.0056865752581316785, 'lambda_val': 7.267949834674351e-06, 'batch_size': 2193, 'optimizer': 'Adam'}.
2026-06-15 10:43:40,066 - experiment_functions - INFO - Early stopping at epoch 600. Best Metrics: (0.022907739804962097, 0.002860204970192243, 0.009986682254247892)
2026-06-15 10:43:40,146 - optuna.study.study - INFO - Trial 26 finished with values: [0.022907739804962097, 0.002860204970192243, 0.009986682254247892] and parameters: {'n_layers': 4, 'embedding_dim': 32, 'lr': 0.004300628102170609, 'lambda_val': 0.00818802156219734, 'batch_size': 4072, 'optimizer': 'Adam'}.
2026-06-15 10:44:01,553 - experiment_functions - INFO - Early stopping at epoch 500. Best Metrics: (0.0005887614818623894, 8.205506062026927e-05, 0.0003158472254227689)
2026-06-15 10:44:01,638 - optuna.study.study - INFO - Trial 27 finished with values: [0.0005887614818623894, 8.205506062026927e-05, 0.0003158472254227689] and parameters: {'n_layers': 2, 'embedding_dim': 64, 'lr': 0.0014827905608559078, 'lambda_val': 0.002872624371953763, 'batch_size': 3991, 'optimizer': 'SGD'}.
2026-06-15 10:44:22,337 - experiment_functions - INFO - Early stopping at epoch 500. Best Metrics: (0.0005901032497608414, 8.372965369415233e-05, 0.0002485162948236005)
2026-06-15 10:44:22,435 - optuna.study.study - INFO - Trial 28 finished with values: [0.0005901032497608414, 8.372965369415233e-05, 0.0002485162948236005] and parameters: {'n_layers': 1, 'embedding_dim': 64, 'lr': 0.00026668784875348404, 'lambda_val': 0.011506952541684051, 'batch_size': 789, 'optimizer': 'Adam'}.
2026-06-15 10:45:03,572 - experiment_functions - INFO - Early stopping at epoch 950. Best Metrics: (0.028763018290619394, 0.0030812512559448054, 0.012957356324658127)
2026-06-15 10:45:03,643 - optuna.study.study - INFO - Trial 29 finished with values: [0.028763018290619394, 0.0030812512559448054, 0.012957356324658127] and parameters: {'n_layers': 3, 'embedding_dim': 64, 'lr': 0.03399653553805821, 'lambda_val': 1.767841499423319e-06, 'batch_size': 3886, 'optimizer': 'Adam'}.
2026-06-15 10:46:06,902 - experiment_functions - INFO - Early stopping at epoch 1450. Best Metrics: (0.029114080563654453, 0.003444637952977427, 0.012897186640765442)
2026-06-15 10:46:06,987 - optuna.study.study - INFO - Trial 30 finished with values: [0.029114080563654453, 0.003444637952977427, 0.012897186640765442] and parameters: {'n_layers': 4, 'embedding_dim': 64, 'lr': 0.0036137927066579685, 'lambda_val': 0.0002179489003846296, 'batch_size': 1959, 'optimizer': 'RMSprop'}.
2026-06-15 10:46:32,783 - experiment_functions - INFO - Early stopping at epoch 550. Best Metrics: (0.009901161351966, 0.0011136043941322258, 0.004504606191986666)
2026-06-15 10:46:33,097 - optuna.study.study - INFO - Trial 31 finished with values: [0.009901161351966, 0.0011136043941322258, 0.004504606191986666] and parameters: {'n_layers': 2, 'embedding_dim': 128, 'lr': 0.0858732081596601, 'lambda_val': 0.00976549585781695, 'batch_size': 3976, 'optimizer': 'Adam'}.
2026-06-15 10:46:56,043 - experiment_functions - INFO - Early stopping at epoch 500. Best Metrics: (0.0004780818159238768, 7.033290910308797e-05, 0.0002504833339633524)
2026-06-15 10:46:56,139 - optuna.study.study - INFO - Trial 32 finished with values: [0.0004780818159238768, 7.033290910308797e-05, 0.0002504833339633524] and parameters: {'n_layers': 4, 'embedding_dim': 64, 'lr': 0.007513927921523434, 'lambda_val': 6.752191135308671e-05, 'batch_size': 3988, 'optimizer': 'SGD'}.
2026-06-15 10:47:19,684 - experiment_functions - INFO - Early stopping at epoch 550. Best Metrics: (0.03994621565430165, 0.004814455087413758, 0.019945872003348544)
2026-06-15 10:47:19,778 - optuna.study.study - INFO - Trial 33 finished with values: [0.03994621565430165, 0.004814455087413758, 0.019945872003348544] and parameters: {'n_layers': 3, 'embedding_dim': 32, 'lr': 0.007887788847370084, 'lambda_val': 2.6397474768530115e-05, 'batch_size': 3364, 'optimizer': 'Adam'}.
2026-06-15 10:47:40,915 - experiment_functions - INFO - Early stopping at epoch 500. Best Metrics: (0.00017104892933816508, 4.1864826847076163e-05, 9.467499402159002e-05)
2026-06-15 10:47:41,000 - optuna.study.study - INFO - Trial 34 finished with values: [0.00017104892933816508, 4.1864826847076163e-05, 9.467499402159002e-05] and parameters: {'n_layers': 3, 'embedding_dim': 32, 'lr': 4.168008775333894e-05, 'lambda_val': 1.2899009126582793e-05, 'batch_size': 2414, 'optimizer': 'SGD'}.
2026-06-15 10:48:08,187 - experiment_functions - INFO - Early stopping at epoch 550. Best Metrics: (0.01656444189963918, 0.0019107106973005562, 0.0075655233133106)
2026-06-15 10:48:08,272 - optuna.study.study - INFO - Trial 35 finished with values: [0.01656444189963918, 0.0019107106973005562, 0.0075655233133106] and parameters: {'n_layers': 3, 'embedding_dim': 128, 'lr': 0.02593878803168038, 'lambda_val': 0.00812460381578991, 'batch_size': 2445, 'optimizer': 'Adam'}.
2026-06-15 10:48:49,099 - experiment_functions - INFO - Early stopping at epoch 1050. Best Metrics: (0.00042333727827080573, 6.698372295532186e-05, 0.00017742830178589587)
2026-06-15 10:48:49,204 - optuna.study.study - INFO - Trial 36 finished with values: [0.00042333727827080573, 6.698372295532186e-05, 0.00017742830178589587] and parameters: {'n_layers': 1, 'embedding_dim': 64, 'lr': 0.00018705375060032152, 'lambda_val': 0.0023900017766903176, 'batch_size': 1969, 'optimizer': 'Adam'}.
2026-06-15 10:50:53,768 - experiment_functions - INFO - Early stopping at epoch 3050. Best Metrics: (0.01428708321522244, 0.001796838368276509, 0.0065526630194343615)
2026-06-15 10:50:53,836 - optuna.study.study - INFO - Trial 37 finished with values: [0.01428708321522244, 0.001796838368276509, 0.0065526630194343615] and parameters: {'n_layers': 3, 'embedding_dim': 64, 'lr': 0.05311018382193878, 'lambda_val': 0.012455307348838913, 'batch_size': 3541, 'optimizer': 'RMSprop'}.
2026-06-15 10:51:16,024 - experiment_functions - INFO - Early stopping at epoch 500. Best Metrics: (0.0004135537788388791, 6.698372295532186e-05, 0.00021618898012171133)
2026-06-15 10:51:16,116 - optuna.study.study - INFO - Trial 38 finished with values: [0.0004135537788388791, 6.698372295532186e-05, 0.00021618898012171133] and parameters: {'n_layers': 3, 'embedding_dim': 64, 'lr': 0.009437755959287303, 'lambda_val': 0.021111346605514066, 'batch_size': 3877, 'optimizer': 'SGD'}.
2026-06-15 10:51:49,396 - experiment_functions - INFO - Early stopping at epoch 850. Best Metrics: (0.0006141746686611231, 8.540424676803537e-05, 0.0002381784313318586)
