2026-06-15 13:57:51,204 - optuna.study.study - INFO - Trial 186 finished with values: [0.0004236835706229433, 7.53566883247371e-05, 0.00019880122965423996] and parameters: {'n_layers': 1, 'embedding_dim': 256, 'lr': 0.0026397990430783503, 'lambda_val': 1.0723270203484857e-05, 'batch_size': 2285, 'optimizer': 'SGD'}.
2026-06-15 13:58:17,443 - experiment_functions - INFO - Early stopping at epoch 600. Best Metrics: (0.07461240195984074, 0.009347578538415165, 0.03945728003340472)
2026-06-15 13:58:17,509 - optuna.study.study - INFO - Trial 187 finished with values: [0.07461240195984074, 0.009347578538415165, 0.03945728003340472] and parameters: {'n_layers': 1, 'embedding_dim': 96, 'lr': 0.010023199654102697, 'lambda_val': 4.6804655463952444e-05, 'batch_size': 2768, 'optimizer': 'Adam'}.
2026-06-15 13:58:49,716 - experiment_functions - INFO - Early stopping at epoch 650. Best Metrics: (0.08765948548729569, 0.01075088753432916, 0.045710248185555774)
2026-06-15 13:58:49,796 - optuna.study.study - INFO - Trial 188 finished with values: [0.08765948548729569, 0.01075088753432916, 0.045710248185555774] and parameters: {'n_layers': 1, 'embedding_dim': 256, 'lr': 0.0056865752581316785, 'lambda_val': 1.509459220212265e-05, 'batch_size': 3479, 'optimizer': 'Adam'}.
2026-06-15 13:59:42,628 - experiment_functions - INFO - Early stopping at epoch 1100. Best Metrics: (0.08724792242536245, 0.010893227945609218, 0.04644738350651943)
2026-06-15 13:59:42,698 - optuna.study.study - INFO - Trial 189 finished with values: [0.08724792242536245, 0.010893227945609218, 0.04644738350651943] and parameters: {'n_layers': 1, 'embedding_dim': 256, 'lr': 0.0026397990430783503, 'lambda_val': 1.6672361180365783e-05, 'batch_size': 1005, 'optimizer': 'Adam'}.
2026-06-15 14:00:21,999 - experiment_functions - INFO - Early stopping at epoch 800. Best Metrics: (0.09416191859267792, 0.011568088954384085, 0.0490035919388816)
2026-06-15 14:00:22,087 - optuna.study.study - INFO - Trial 190 finished with values: [0.09416191859267792, 0.011568088954384085, 0.0490035919388816] and parameters: {'n_layers': 1, 'embedding_dim': 256, 'lr': 0.0030096858286544014, 'lambda_val': 4.6804655463952444e-05, 'batch_size': 3812, 'optimizer': 'Adam'}.
2026-06-15 14:01:31,918 - experiment_functions - INFO - Early stopping at epoch 1450. Best Metrics: (0.09957542889098646, 0.01193315024449059, 0.0531784911680252)
2026-06-15 14:01:32,009 - optuna.study.study - INFO - Trial 191 finished with values: [0.09957542889098646, 0.01193315024449059, 0.0531784911680252] and parameters: {'n_layers': 1, 'embedding_dim': 256, 'lr': 0.0018921194607502668, 'lambda_val': 2.0471988586907107e-05, 'batch_size': 2434, 'optimizer': 'Adam'}.
2026-06-15 14:02:06,527 - experiment_functions - INFO - Early stopping at epoch 700. Best Metrics: (0.07787560975310626, 0.009483220577399693, 0.040105178784201556)
2026-06-15 14:02:06,667 - optuna.study.study - INFO - Trial 192 finished with values: [0.07787560975310626, 0.009483220577399693, 0.040105178784201556] and parameters: {'n_layers': 1, 'embedding_dim': 256, 'lr': 0.0056865752581316785, 'lambda_val': 7.267949834674351e-06, 'batch_size': 2193, 'optimizer': 'Adam'}.
2026-06-15 14:03:05,432 - experiment_functions - INFO - Early stopping at epoch 1500. Best Metrics: (0.06499888247996011, 0.00792584901868846, 0.03258471724486214)
2026-06-15 14:03:05,708 - optuna.study.study - INFO - Trial 193 finished with values: [0.06499888247996011, 0.00792584901868846, 0.03258471724486214] and parameters: {'n_layers': 1, 'embedding_dim': 32, 'lr': 0.005616296548051391, 'lambda_val': 0.0002014587319781766, 'batch_size': 558, 'optimizer': 'Adam'}.
2026-06-15 14:04:01,012 - experiment_functions - INFO - Early stopping at epoch 1300. Best Metrics: (0.06667420732494073, 0.008475115546922098, 0.0343939859039132)
2026-06-15 14:04:01,091 - optuna.study.study - INFO - Trial 194 finished with values: [0.06667420732494073, 0.008475115546922098, 0.0343939859039132] and parameters: {'n_layers': 1, 'embedding_dim': 128, 'lr': 0.0026397990430783503, 'lambda_val': 0.002872624371953763, 'batch_size': 558, 'optimizer': 'Adam'}.
2026-06-15 14:04:40,551 - experiment_functions - INFO - Early stopping at epoch 850. Best Metrics: (0.06019180953026374, 0.007312947953647265, 0.029060627506456656)
2026-06-15 14:04:40,636 - optuna.study.study - INFO - Trial 195 finished with values: [0.06019180953026374, 0.007312947953647265, 0.029060627506456656] and parameters: {'n_layers': 2, 'embedding_dim': 128, 'lr': 0.0016086229224309184, 'lambda_val': 2.9677369546189456e-06, 'batch_size': 3981, 'optimizer': 'RMSprop'}.
2026-06-15 14:07:40,818 - optuna.study.study - INFO - Trial 196 finished with values: [0.0006422610187606226, 0.00010382477058074887, 0.0003271140067670378] and parameters: {'n_layers': 3, 'embedding_dim': 128, 'lr': 4.80687141421787e-05, 'lambda_val': 2.5476071418262236e-05, 'batch_size': 3812, 'optimizer': 'RMSprop'}.
2026-06-15 14:08:12,903 - experiment_functions - INFO - Early stopping at epoch 650. Best Metrics: (0.06035226229484315, 0.007726572442896376, 0.02969979621091562)
2026-06-15 14:08:13,466 - optuna.study.study - INFO - Trial 197 finished with values: [0.06035226229484315, 0.007726572442896376, 0.02969979621091562] and parameters: {'n_layers': 1, 'embedding_dim': 256, 'lr': 0.004300628102170609, 'lambda_val': 0.00818802156219734, 'batch_size': 2831, 'optimizer': 'Adam'}.
2026-06-15 14:10:42,479 - experiment_functions - INFO - Early stopping at epoch 3500. Best Metrics: (0.06746917195441862, 0.0084650679884788, 0.03393107604283417)
2026-06-15 14:10:42,583 - optuna.study.study - INFO - Trial 198 finished with values: [0.06746917195441862, 0.0084650679884788, 0.03393107604283417] and parameters: {'n_layers': 2, 'embedding_dim': 96, 'lr': 0.00044819859318088583, 'lambda_val': 0.002872624371953763, 'batch_size': 3609, 'optimizer': 'Adam'}.
2026-06-15 14:13:48,277 - optuna.study.study - INFO - Trial 199 finished with values: [0.04704014322496635, 0.005330229754169737, 0.021638361727229074] and parameters: {'n_layers': 3, 'embedding_dim': 128, 'lr': 0.007264999721759937, 'lambda_val': 4.6804655463952444e-05, 'batch_size': 2434, 'optimizer': 'RMSprop'}.
2026-06-15 14:14:20,688 - experiment_functions - INFO - Early stopping at epoch 650. Best Metrics: (0.08708633073106882, 0.01084466474646661, 0.04650652747672577)
2026-06-15 14:14:20,781 - optuna.study.study - INFO - Trial 200 finished with values: [0.08708633073106882, 0.01084466474646661, 0.04650652747672577] and parameters: {'n_layers': 1, 'embedding_dim': 256, 'lr': 0.00652783224013236, 'lambda_val': 2.549475670628784e-06, 'batch_size': 3697, 'optimizer': 'Adam'}.
2026-06-15 14:17:22,811 - optuna.study.study - INFO - Trial 201 finished with values: [0.06766051859914188, 0.009265523477794897, 0.039459571993899434] and parameters: {'n_layers': 1, 'embedding_dim': 256, 'lr': 0.00044819859318088583, 'lambda_val': 2.0471988586907107e-05, 'batch_size': 2434, 'optimizer': 'RMSprop'}.
2026-06-15 14:18:09,623 - experiment_functions - INFO - Early stopping at epoch 950. Best Metrics: (0.09528654314192501, 0.011698707214146963, 0.05178541861590789)
2026-06-15 14:18:09,701 - optuna.study.study - INFO - Trial 202 finished with values: [0.09528654314192501, 0.011698707214146963, 0.05178541861590789] and parameters: {'n_layers': 1, 'embedding_dim': 256, 'lr': 0.0026397990430783503, 'lambda_val': 1.0723270203484857e-05, 'batch_size': 3812, 'optimizer': 'Adam'}.
2026-06-15 14:20:39,543 - optuna.study.study - INFO - Trial 203 finished with values: [0.005944089436392549, 0.0010215017750686585, 0.003515445585885056] and parameters: {'n_layers': 1, 'embedding_dim': 64, 'lr': 0.000274327883206069, 'lambda_val': 2.5476071418262236e-05, 'batch_size': 3697, 'optimizer': 'Adam'}.
2026-06-15 14:21:24,492 - experiment_functions - INFO - Early stopping at epoch 1100. Best Metrics: (0.00046516381334520525, 5.693616451202358e-05, 0.00019305983295334436)
2026-06-15 14:21:24,599 - optuna.study.study - INFO - Trial 204 finished with values: [0.00046516381334520525, 5.693616451202358e-05, 0.00019305983295334436] and parameters: {'n_layers': 1, 'embedding_dim': 128, 'lr': 3.072280750116718e-05, 'lambda_val': 0.002872624371953763, 'batch_size': 558, 'optimizer': 'Adam'}.
2026-06-15 14:21:48,197 - experiment_functions - INFO - Early stopping at epoch 500. Best Metrics: (0.000511032968274846, 7.870587447250318e-05, 0.0002130555356872997)
2026-06-15 14:21:48,295 - optuna.study.study - INFO - Trial 205 finished with values: [0.000511032968274846, 7.870587447250318e-05, 0.0002130555356872997] and parameters: {'n_layers': 1, 'embedding_dim': 256, 'lr': 0.0030096858286544014, 'lambda_val': 4.6804655463952444e-05, 'batch_size': 3812, 'optimizer': 'SGD'}.
2026-06-15 14:22:17,557 - experiment_functions - INFO - Early stopping at epoch 500. Best Metrics: (0.00031157114169443913, 6.698372295532187e-05, 0.00015377004509837335)
2026-06-15 14:22:17,634 - optuna.study.study - INFO - Trial 206 finished with values: [0.00031157114169443913, 6.698372295532187e-05, 0.00015377004509837335] and parameters: {'n_layers': 3, 'embedding_dim': 256, 'lr': 0.0056865752581316785, 'lambda_val': 7.267949834674351e-06, 'batch_size': 3624, 'optimizer': 'SGD'}.
2026-06-15 14:22:46,791 - experiment_functions - INFO - Early stopping at epoch 600. Best Metrics: (0.03300225822543772, 0.0039888807019894165, 0.015093672704525662)
2026-06-15 14:22:46,863 - optuna.study.study - INFO - Trial 207 finished with values: [0.03300225822543772, 0.0039888807019894165, 0.015093672704525662] and parameters: {'n_layers': 1, 'embedding_dim': 256, 'lr': 0.004300628102170609, 'lambda_val': 0.011363895394682045, 'batch_size': 2831, 'optimizer': 'RMSprop'}.
2026-06-15 14:25:04,563 - experiment_functions - INFO - Early stopping at epoch 2950. Best Metrics: (0.08384990218273629, 0.009714314421595552, 0.04090790060081174)
2026-06-15 14:25:04,643 - optuna.study.study - INFO - Trial 208 finished with values: [0.08384990218273629, 0.009714314421595552, 0.04090790060081174] and parameters: {'n_layers': 1, 'embedding_dim': 256, 'lr': 0.0026397990430783503, 'lambda_val': 4.6804655463952444e-05, 'batch_size': 2768, 'optimizer': 'RMSprop'}.
2026-06-15 14:25:35,760 - experiment_functions - INFO - Early stopping at epoch 650. Best Metrics: (0.030973185205334854, 0.00377620738160627, 0.013983623780689035)
2026-06-15 14:25:35,884 - optuna.study.study - INFO - Trial 209 finished with values: [0.030973185205334854, 0.00377620738160627, 0.013983623780689035] and parameters: {'n_layers': 1, 'embedding_dim': 256, 'lr': 0.0026397990430783503, 'lambda_val': 0.03022873786200915, 'batch_size': 4066, 'optimizer': 'RMSprop'}.
2026-06-15 14:27:20,722 - experiment_functions - INFO - Early stopping at epoch 2300. Best Metrics: (0.0005542097106832731, 8.205506062026927e-05, 0.0002551784087306689)
2026-06-15 14:27:20,801 - optuna.study.study - INFO - Trial 210 finished with values: [0.0005542097106832731, 8.205506062026927e-05, 0.0002551784087306689] and parameters: {'n_layers': 3, 'embedding_dim': 128, 'lr': 2.5849907826937067e-05, 'lambda_val': 2.0471988586907107e-05, 'batch_size': 2572, 'optimizer': 'Adam'}.
2026-06-15 14:28:00,401 - experiment_functions - INFO - Early stopping at epoch 600. Best Metrics: (0.04257262570597183, 0.005099135909973876, 0.019796655370113454)
2026-06-15 14:28:00,483 - optuna.study.study - INFO - Trial 211 finished with values: [0.04257262570597183, 0.005099135909973876, 0.019796655370113454] and parameters: {'n_layers': 4, 'embedding_dim': 256, 'lr': 0.0026397990430783503, 'lambda_val': 4.6804655463952444e-05, 'batch_size': 3634, 'optimizer': 'Adam'}.
2026-06-15 14:28:20,652 - experiment_functions - INFO - Early stopping at epoch 500. Best Metrics: (0.00047425733203926995, 7.703128139862013e-05, 0.0002292380290744668)
2026-06-15 14:28:20,741 - optuna.study.study - INFO - Trial 212 finished with values: [0.00047425733203926995, 7.703128139862013e-05, 0.0002292380290744668] and parameters: {'n_layers': 1, 'embedding_dim': 32, 'lr': 0.0008138925204745388, 'lambda_val': 0.09949023651714026, 'batch_size': 2434, 'optimizer': 'Adam'}.
2026-06-15 14:30:09,746 - experiment_functions - INFO - Early stopping at epoch 2700. Best Metrics: (0.04529089774133495, 0.005432379931676602, 0.021375793699453898)
2026-06-15 14:30:09,831 - optuna.study.study - INFO - Trial 213 finished with values: [0.04529089774133495, 0.005432379931676602, 0.021375793699453898] and parameters: {'n_layers': 2, 'embedding_dim': 64, 'lr': 0.0026397990430783503, 'lambda_val': 0.00011810217086472745, 'batch_size': 1779, 'optimizer': 'RMSprop'}.
2026-06-15 14:33:13,636 - optuna.study.study - INFO - Trial 214 finished with values: [0.053523054036903196, 0.006120637685042535, 0.02521140856072789] and parameters: {'n_layers': 1, 'embedding_dim': 256, 'lr': 0.010023199654102697, 'lambda_val': 7.267949834674351e-06, 'batch_size': 789, 'optimizer': 'Adam'}.
2026-06-15 14:34:08,634 - experiment_functions - INFO - Early stopping at epoch 1300. Best Metrics: (0.10093835342707902, 0.012191037577868578, 0.05400625909381653)
2026-06-15 14:34:08,715 - optuna.study.study - INFO - Trial 215 finished with values: [0.10093835342707902, 0.012191037577868578, 0.05400625909381653] and parameters: {'n_layers': 1, 'embedding_dim': 96, 'lr': 0.0018921194607502668, 'lambda_val': 2.9677369546189456e-06, 'batch_size': 3981, 'optimizer': 'Adam'}.
2026-06-15 14:34:41,220 - experiment_functions - INFO - Early stopping at epoch 650. Best Metrics: (0.08705853415079758, 0.01080112532654565, 0.04593469588911045)
2026-06-15 14:34:41,305 - optuna.study.study - INFO - Trial 216 finished with values: [0.08705853415079758, 0.01080112532654565, 0.04593469588911045] and parameters: {'n_layers': 1, 'embedding_dim': 256, 'lr': 0.0056865752581316785, 'lambda_val': 1.509459220212265e-05, 'batch_size': 3479, 'optimizer': 'Adam'}.
2026-06-15 14:35:23,242 - experiment_functions - INFO - Early stopping at epoch 850. Best Metrics: (0.09690059403201755, 0.01190133297608681, 0.05166170091486556)
2026-06-15 14:35:23,327 - optuna.study.study - INFO - Trial 217 finished with values: [0.09690059403201755, 0.01190133297608681, 0.05166170091486556] and parameters: {'n_layers': 1, 'embedding_dim': 256, 'lr': 0.0026397990430783503, 'lambda_val': 1.509459220212265e-05, 'batch_size': 3479, 'optimizer': 'Adam'}.
2026-06-15 14:38:07,663 - experiment_functions - INFO - Early stopping at epoch 3850. Best Metrics: (0.06874732359535035, 0.008500234443030344, 0.035280163846733985)
2026-06-15 14:38:08,387 - optuna.study.study - INFO - Trial 218 finished with values: [0.06874732359535035, 0.008500234443030344, 0.035280163846733985] and parameters: {'n_layers': 2, 'embedding_dim': 96, 'lr': 0.00044819859318088583, 'lambda_val': 0.002872624371953763, 'batch_size': 3609, 'optimizer': 'Adam'}.
2026-06-15 14:38:37,988 - experiment_functions - INFO - Early stopping at epoch 700. Best Metrics: (0.0796152072650644, 0.009947082858865296, 0.04228277118934948)
2026-06-15 14:38:38,257 - optuna.study.study - INFO - Trial 219 finished with values: [0.0796152072650644, 0.009947082858865296, 0.04228277118934948] and parameters: {'n_layers': 1, 'embedding_dim': 32, 'lr': 0.0056865752581316785, 'lambda_val': 1.0723270203484857e-05, 'batch_size': 3981, 'optimizer': 'Adam'}.
2026-06-15 14:39:22,039 - experiment_functions - INFO - Early stopping at epoch 1000. Best Metrics: (0.07659337400861685, 0.009612164244088686, 0.041271185361708075)
2026-06-15 14:39:22,125 - optuna.study.study - INFO - Trial 220 finished with values: [0.07659337400861685, 0.009612164244088686, 0.041271185361708075] and parameters: {'n_layers': 1, 'embedding_dim': 32, 'lr': 0.0026397990430783503, 'lambda_val': 1.0723270203484857e-05, 'batch_size': 2285, 'optimizer': 'RMSprop'}.
2026-06-15 14:39:43,521 - experiment_functions - INFO - Early stopping at epoch 500. Best Metrics: (0.0005536713816469411, 8.205506062026927e-05, 0.00030231908654944963)
2026-06-15 14:39:43,604 - optuna.study.study - INFO - Trial 221 finished with values: [0.0005536713816469411, 8.205506062026927e-05, 0.00030231908654944963] and parameters: {'n_layers': 1, 'embedding_dim': 96, 'lr': 0.0056865752581316785, 'lambda_val': 7.267949834674351e-06, 'batch_size': 2193, 'optimizer': 'SGD'}.
2026-06-15 14:40:35,075 - experiment_functions - INFO - Early stopping at epoch 1000. Best Metrics: (0.0951503130141049, 0.011465938776877219, 0.04977941845427637)
2026-06-15 14:40:35,167 - optuna.study.study - INFO - Trial 222 finished with values: [0.0951503130141049, 0.011465938776877219, 0.04977941845427637] and parameters: {'n_layers': 1, 'embedding_dim': 256, 'lr': 0.0030096858286544014, 'lambda_val': 4.6804655463952444e-05, 'batch_size': 2285, 'optimizer': 'Adam'}.
2026-06-15 14:41:06,787 - experiment_functions - INFO - Early stopping at epoch 750. Best Metrics: (0.07674719849237525, 0.009704266863152254, 0.040722847488496354)
2026-06-15 14:41:07,980 - optuna.study.study - INFO - Trial 223 finished with values: [0.07674719849237525, 0.009704266863152254, 0.040722847488496354] and parameters: {'n_layers': 1, 'embedding_dim': 32, 'lr': 0.0056865752581316785, 'lambda_val': 1.0723270203484857e-05, 'batch_size': 2193, 'optimizer': 'Adam'}.
2026-06-15 14:41:49,224 - experiment_functions - INFO - Early stopping at epoch 800. Best Metrics: (0.09572911540596796, 0.011963292919820484, 0.0510702323474551)
2026-06-15 14:41:49,425 - optuna.study.study - INFO - Trial 224 finished with values: [0.09572911540596796, 0.011963292919820484, 0.0510702323474551] and parameters: {'n_layers': 1, 'embedding_dim': 256, 'lr': 0.0026397990430783503, 'lambda_val': 4.6804655463952444e-05, 'batch_size': 3812, 'optimizer': 'Adam'}.
2026-06-15 14:42:22,664 - experiment_functions - INFO - Early stopping at epoch 650. Best Metrics: (0.09161130809818334, 0.011132694755174494, 0.04829741432401669)
2026-06-15 14:42:23,015 - optuna.study.study - INFO - Trial 225 finished with values: [0.09161130809818334, 0.011132694755174494, 0.04829741432401669] and parameters: {'n_layers': 1, 'embedding_dim': 256, 'lr': 0.0056865752581316785, 'lambda_val': 2.5476071418262236e-05, 'batch_size': 3812, 'optimizer': 'Adam'}.
2026-06-15 14:42:50,236 - experiment_functions - INFO - Early stopping at epoch 500. Best Metrics: (0.000579569553420653, 7.2007502176971e-05, 0.000290940761213283)
2026-06-15 14:42:50,676 - optuna.study.study - INFO - Trial 226 finished with values: [0.000579569553420653, 7.2007502176971e-05, 0.000290940761213283] and parameters: {'n_layers': 1, 'embedding_dim': 256, 'lr': 0.0026397990430783503, 'lambda_val': 1.6672361180365783e-05, 'batch_size': 1654, 'optimizer': 'SGD'}.
2026-06-15 14:43:39,475 - experiment_functions - INFO - Early stopping at epoch 1000. Best Metrics: (0.0893448730571083, 0.011023846205372096, 0.04727479977780147)
2026-06-15 14:43:39,553 - optuna.study.study - INFO - Trial 227 finished with values: [0.0893448730571083, 0.011023846205372096, 0.04727479977780147] and parameters: {'n_layers': 1, 'embedding_dim': 256, 'lr': 0.0018921194607502668, 'lambda_val': 0.00013972282445432241, 'batch_size': 2285, 'optimizer': 'RMSprop'}.
2026-06-15 14:44:15,820 - experiment_functions - INFO - Early stopping at epoch 650. Best Metrics: (0.0840955346085207, 0.010459508339473506, 0.04543855236006197)
2026-06-15 14:44:15,901 - optuna.study.study - INFO - Trial 228 finished with values: [0.0840955346085207, 0.010459508339473506, 0.04543855236006197] and parameters: {'n_layers': 1, 'embedding_dim': 256, 'lr': 0.005616296548051391, 'lambda_val': 1.0723270203484857e-05, 'batch_size': 2572, 'optimizer': 'Adam'}.
2026-06-15 14:44:37,486 - experiment_functions - INFO - Early stopping at epoch 500. Best Metrics: (0.0004384861645897215, 5.526157143814053e-05, 0.00020145323375282266)
2026-06-15 14:44:37,556 - optuna.study.study - INFO - Trial 229 finished with values: [0.0004384861645897215, 5.526157143814053e-05, 0.00020145323375282266] and parameters: {'n_layers': 1, 'embedding_dim': 96, 'lr': 0.0008138925204745388, 'lambda_val': 4.6804655463952444e-05, 'batch_size': 3812, 'optimizer': 'SGD'}.
2026-06-15 14:45:26,968 - experiment_functions - INFO - Early stopping at epoch 1100. Best Metrics: (0.05801459749797923, 0.007076830330229754, 0.028446589229944183)
2026-06-15 14:45:27,303 - optuna.study.study - INFO - Trial 230 finished with values: [0.05801459749797923, 0.007076830330229754, 0.028446589229944183] and parameters: {'n_layers': 3, 'embedding_dim': 64, 'lr': 0.0009437548244297628, 'lambda_val': 2.5476071418262236e-05, 'batch_size': 3624, 'optimizer': 'RMSprop'}.
2026-06-15 14:45:51,756 - experiment_functions - INFO - Early stopping at epoch 550. Best Metrics: (0.016105879238646318, 0.0025252863554156343, 0.008671167379831845)
2026-06-15 14:45:51,834 - optuna.study.study - INFO - Trial 231 finished with values: [0.016105879238646318, 0.0025252863554156343, 0.008671167379831845] and parameters: {'n_layers': 1, 'embedding_dim': 128, 'lr': 0.0446292806249701, 'lambda_val': 0.002872624371953763, 'batch_size': 558, 'optimizer': 'Adam'}.
2026-06-15 14:46:39,173 - experiment_functions - INFO - Early stopping at epoch 950. Best Metrics: (0.09552615209580084, 0.011640096456561055, 0.050497786526691006)
2026-06-15 14:46:39,271 - optuna.study.study - INFO - Trial 232 finished with values: [0.09552615209580084, 0.011640096456561055, 0.050497786526691006] and parameters: {'n_layers': 1, 'embedding_dim': 256, 'lr': 0.0030096858286544014, 'lambda_val': 1.509459220212265e-05, 'batch_size': 2261, 'optimizer': 'Adam'}.
