2026-06-15 22:15:37,990 - optuna.study.study - INFO - Trial 232 finished with values: [0.08536716039756795, 0.010568356889275906, 0.045093393079772996] and parameters: {'n_layers': 1, 'embedding_dim': 32, 'lr': 0.001479782641411582, 'lambda_val': 0.001319855427866883, 'batch_size': 2539, 'optimizer': 'Adam'}.
2026-06-15 22:16:26,193 - experiment_functions - INFO - Early stopping at epoch 1050. Best Metrics: (0.06524120012503935, 0.007883984191841383, 0.03214178160183547)
2026-06-15 22:16:26,271 - optuna.study.study - INFO - Trial 233 finished with values: [0.06524120012503935, 0.007883984191841383, 0.03214178160183547] and parameters: {'n_layers': 2, 'embedding_dim': 128, 'lr': 0.0013130193047400018, 'lambda_val': 4.740391388963357e-05, 'batch_size': 2005, 'optimizer': 'RMSprop'}.
2026-06-15 22:19:13,145 - optuna.study.study - INFO - Trial 234 finished with values: [0.08868539057572683, 0.011398955053921897, 0.0497590260688353] and parameters: {'n_layers': 1, 'embedding_dim': 128, 'lr': 0.0008007729293904306, 'lambda_val': 0.00011845962638954619, 'batch_size': 2005, 'optimizer': 'Adam'}.
2026-06-15 22:21:47,202 - experiment_functions - INFO - Early stopping at epoch 3900. Best Metrics: (0.07799990344981166, 0.00939446714448389, 0.04208284294412175)
2026-06-15 22:21:47,294 - optuna.study.study - INFO - Trial 235 finished with values: [0.07799990344981166, 0.00939446714448389, 0.04208284294412175] and parameters: {'n_layers': 2, 'embedding_dim': 32, 'lr': 0.0008007729293904306, 'lambda_val': 0.00011845962638954619, 'batch_size': 3109, 'optimizer': 'RMSprop'}.
2026-06-15 22:22:12,574 - experiment_functions - INFO - Early stopping at epoch 600. Best Metrics: (0.00039883545186240085, 8.540424676803537e-05, 0.00018581896657789317)
2026-06-15 22:22:12,665 - optuna.study.study - INFO - Trial 236 finished with values: [0.00039883545186240085, 8.540424676803537e-05, 0.00018581896657789317] and parameters: {'n_layers': 2, 'embedding_dim': 64, 'lr': 1.5912532556425567e-05, 'lambda_val': 0.0012522872845674186, 'batch_size': 1772, 'optimizer': 'RMSprop'}.
2026-06-15 22:22:55,828 - experiment_functions - INFO - Early stopping at epoch 1000. Best Metrics: (0.05627145037585869, 0.006780427356152456, 0.026560076724517354)
2026-06-15 22:22:55,906 - optuna.study.study - INFO - Trial 237 finished with values: [0.05627145037585869, 0.006780427356152456, 0.026560076724517354] and parameters: {'n_layers': 1, 'embedding_dim': 128, 'lr': 0.0036742654809996723, 'lambda_val': 0.0010303693563230053, 'batch_size': 2005, 'optimizer': 'RMSprop'}.
2026-06-15 22:25:28,463 - optuna.study.study - INFO - Trial 238 finished with values: [0.04932538940745181, 0.00653593676736553, 0.02595626455055761] and parameters: {'n_layers': 2, 'embedding_dim': 32, 'lr': 0.0003649621407716159, 'lambda_val': 0.004749408595262452, 'batch_size': 3620, 'optimizer': 'Adam'}.
2026-06-15 22:28:02,927 - optuna.study.study - INFO - Trial 239 finished with values: [0.06938054565103577, 0.008453345836961617, 0.03732601781113078] and parameters: {'n_layers': 2, 'embedding_dim': 32, 'lr': 0.0008007729293904306, 'lambda_val': 2.0623181656245837e-06, 'batch_size': 2005, 'optimizer': 'RMSprop'}.
2026-06-15 22:31:29,620 - optuna.study.study - INFO - Trial 240 finished with values: [0.09096835941300166, 0.011181257954317101, 0.0501346191363204] and parameters: {'n_layers': 2, 'embedding_dim': 256, 'lr': 0.0008007729293904306, 'lambda_val': 1.5130950471060717e-06, 'batch_size': 1214, 'optimizer': 'Adam'}.
2026-06-15 22:34:00,554 - optuna.study.study - INFO - Trial 241 finished with values: [0.03372036790718512, 0.004928327416437805, 0.01921195298613136] and parameters: {'n_layers': 2, 'embedding_dim': 32, 'lr': 0.0003649621407716159, 'lambda_val': 1.5130950471060717e-06, 'batch_size': 2005, 'optimizer': 'Adam'}.
2026-06-15 22:37:09,063 - optuna.study.study - INFO - Trial 242 finished with values: [0.10185314774072272, 0.01269174090695961, 0.05627526996083529] and parameters: {'n_layers': 1, 'embedding_dim': 256, 'lr': 0.0008007729293904306, 'lambda_val': 2.0623181656245837e-06, 'batch_size': 2539, 'optimizer': 'Adam'}.
2026-06-15 22:38:55,401 - experiment_functions - INFO - Early stopping at epoch 2200. Best Metrics: (0.1051073150641153, 0.012608011253265456, 0.05624980644182136)
2026-06-15 22:38:55,493 - optuna.study.study - INFO - Trial 243 finished with values: [0.1051073150641153, 0.012608011253265456, 0.05624980644182136] and parameters: {'n_layers': 1, 'embedding_dim': 256, 'lr': 0.001479782641411582, 'lambda_val': 2.004361215360341e-05, 'batch_size': 3226, 'optimizer': 'Adam'}.
2026-06-15 22:40:42,058 - experiment_functions - INFO - Early stopping at epoch 2350. Best Metrics: (0.07838725606027372, 0.009590394534128207, 0.042075322701715365)
2026-06-15 22:40:42,143 - optuna.study.study - INFO - Trial 244 finished with values: [0.07838725606027372, 0.009590394534128207, 0.042075322701715365] and parameters: {'n_layers': 2, 'embedding_dim': 128, 'lr': 0.0008007729293904306, 'lambda_val': 0.00041942469140426685, 'batch_size': 1264, 'optimizer': 'RMSprop'}.
2026-06-15 22:43:19,112 - optuna.study.study - INFO - Trial 245 finished with values: [0.08848451398536468, 0.010799450733471766, 0.04894880534333427] and parameters: {'n_layers': 1, 'embedding_dim': 32, 'lr': 0.001479782641411582, 'lambda_val': 6.461965909578869e-06, 'batch_size': 2313, 'optimizer': 'RMSprop'}.
2026-06-15 22:46:00,459 - optuna.study.study - INFO - Trial 246 finished with values: [0.03787986036717983, 0.004228347511554693, 0.017495977290049557] and parameters: {'n_layers': 4, 'embedding_dim': 32, 'lr': 0.02058438318697671, 'lambda_val': 2.6736128190382513e-05, 'batch_size': 1420, 'optimizer': 'RMSprop'}.
2026-06-15 22:46:55,496 - experiment_functions - INFO - Early stopping at epoch 1200. Best Metrics: (0.06301433489934342, 0.00800790407930873, 0.031354409311612735)
2026-06-15 22:46:55,602 - optuna.study.study - INFO - Trial 247 finished with values: [0.06301433489934342, 0.00800790407930873, 0.031354409311612735] and parameters: {'n_layers': 2, 'embedding_dim': 128, 'lr': 0.0008007729293904306, 'lambda_val': 0.004749408595262452, 'batch_size': 2005, 'optimizer': 'Adam'}.
2026-06-15 22:49:33,800 - optuna.study.study - INFO - Trial 248 finished with values: [0.09168949076549006, 0.011226471967311944, 0.049683199346198324] and parameters: {'n_layers': 1, 'embedding_dim': 32, 'lr': 0.001479782641411582, 'lambda_val': 0.0001466773178072416, 'batch_size': 3109, 'optimizer': 'Adam'}.
2026-06-15 22:52:13,223 - optuna.study.study - INFO - Trial 249 finished with values: [0.06659312692912035, 0.009014334516712437, 0.038421303290964236] and parameters: {'n_layers': 1, 'embedding_dim': 64, 'lr': 0.0008007729293904306, 'lambda_val': 1.5130950471060717e-06, 'batch_size': 1545, 'optimizer': 'Adam'}.
2026-06-15 22:52:40,801 - experiment_functions - INFO - Early stopping at epoch 550. Best Metrics: (0.0366802990916224, 0.0046034563601044945, 0.01786633687635245)
2026-06-15 22:52:40,883 - optuna.study.study - INFO - Trial 250 finished with values: [0.0366802990916224, 0.0046034563601044945, 0.01786633687635245] and parameters: {'n_layers': 1, 'embedding_dim': 256, 'lr': 0.028930765704766964, 'lambda_val': 2.004361215360341e-05, 'batch_size': 1772, 'optimizer': 'Adam'}.
2026-06-15 22:53:57,865 - experiment_functions - INFO - Early stopping at epoch 1300. Best Metrics: (0.06543220393655509, 0.007979435997052716, 0.03259782958859179)
2026-06-15 22:53:57,935 - optuna.study.study - INFO - Trial 251 finished with values: [0.06543220393655509, 0.007979435997052716, 0.03259782958859179] and parameters: {'n_layers': 3, 'embedding_dim': 256, 'lr': 0.0008007729293904306, 'lambda_val': 1.5130950471060717e-06, 'batch_size': 2539, 'optimizer': 'Adam'}.
2026-06-15 22:55:56,541 - experiment_functions - INFO - Early stopping at epoch 2750. Best Metrics: (0.1045771513819936, 0.012681693348516312, 0.05671772395770128)
2026-06-15 22:55:56,617 - optuna.study.study - INFO - Trial 252 finished with values: [0.1045771513819936, 0.012681693348516312, 0.05671772395770128] and parameters: {'n_layers': 1, 'embedding_dim': 128, 'lr': 0.001479782641411582, 'lambda_val': 6.852585789077327e-05, 'batch_size': 2248, 'optimizer': 'Adam'}.
2026-06-15 22:58:37,481 - optuna.study.study - INFO - Trial 253 finished with values: [0.010247254685953687, 0.0017399022037644853, 0.006087678511475311] and parameters: {'n_layers': 1, 'embedding_dim': 128, 'lr': 0.00035731579910584327, 'lambda_val': 1.5130950471060717e-06, 'batch_size': 1545, 'optimizer': 'RMSprop'}.
2026-06-15 23:01:29,086 - optuna.study.study - INFO - Trial 254 finished with values: [0.09170595613983783, 0.011621675932748342, 0.05135755716115772] and parameters: {'n_layers': 1, 'embedding_dim': 128, 'lr': 0.0008007729293904306, 'lambda_val': 6.461965909578869e-06, 'batch_size': 2326, 'optimizer': 'Adam'}.
2026-06-15 23:04:35,613 - optuna.study.study - INFO - Trial 255 finished with values: [0.07829276929104491, 0.008925581083796638, 0.037695081748827484] and parameters: {'n_layers': 1, 'embedding_dim': 256, 'lr': 0.0036742654809996723, 'lambda_val': 6.852585789077327e-05, 'batch_size': 3039, 'optimizer': 'RMSprop'}.
2026-06-15 23:05:24,288 - experiment_functions - INFO - Early stopping at epoch 1100. Best Metrics: (0.0004908819995768185, 7.703128139862013e-05, 0.00024510963174825665)
2026-06-15 23:05:24,387 - optuna.study.study - INFO - Trial 256 finished with values: [0.0004908819995768185, 7.703128139862013e-05, 0.00024510963174825665] and parameters: {'n_layers': 2, 'embedding_dim': 128, 'lr': 8.538287845979601e-05, 'lambda_val': 6.461965909578869e-06, 'batch_size': 1633, 'optimizer': 'Adam'}.
2026-06-15 23:06:41,400 - experiment_functions - INFO - Early stopping at epoch 1650. Best Metrics: (0.06134806373633813, 0.008056467278451336, 0.030462098346209568)
2026-06-15 23:06:41,489 - optuna.study.study - INFO - Trial 257 finished with values: [0.06134806373633813, 0.008056467278451336, 0.030462098346209568] and parameters: {'n_layers': 1, 'embedding_dim': 256, 'lr': 0.0008257854890964482, 'lambda_val': 0.016303049896656464, 'batch_size': 3109, 'optimizer': 'Adam'}.
2026-06-15 23:07:05,360 - experiment_functions - INFO - Early stopping at epoch 500. Best Metrics: (0.0004629256124431732, 6.028535065978968e-05, 0.00020730307682594463)
2026-06-15 23:07:05,458 - optuna.study.study - INFO - Trial 258 finished with values: [0.0004629256124431732, 6.028535065978968e-05, 0.00020730307682594463] and parameters: {'n_layers': 1, 'embedding_dim': 256, 'lr': 0.0036742654809996723, 'lambda_val': 1.7187471777464757e-05, 'batch_size': 2050, 'optimizer': 'SGD'}.
2026-06-15 23:09:43,275 - optuna.study.study - INFO - Trial 259 finished with values: [0.09571178296576505, 0.011608279188157279, 0.05079868225125158] and parameters: {'n_layers': 1, 'embedding_dim': 32, 'lr': 0.001479782641411582, 'lambda_val': 2.0623181656245837e-06, 'batch_size': 3620, 'optimizer': 'RMSprop'}.
2026-06-15 23:10:24,035 - experiment_functions - INFO - Early stopping at epoch 950. Best Metrics: (0.06523385683780278, 0.00790910308794963, 0.03250734781699969)
2026-06-15 23:10:24,121 - optuna.study.study - INFO - Trial 260 finished with values: [0.06523385683780278, 0.00790910308794963, 0.03250734781699969] and parameters: {'n_layers': 2, 'embedding_dim': 64, 'lr': 0.001479782641411582, 'lambda_val': 6.461965909578869e-06, 'batch_size': 3620, 'optimizer': 'RMSprop'}.
2026-06-15 23:13:35,742 - experiment_functions - INFO - Early stopping at epoch 3750. Best Metrics: (0.054710419734072, 0.006122312278116418, 0.0255259242728433)
2026-06-15 23:13:35,834 - optuna.study.study - INFO - Trial 261 finished with values: [0.054710419734072, 0.006122312278116418, 0.0255259242728433] and parameters: {'n_layers': 2, 'embedding_dim': 256, 'lr': 0.0036742654809996723, 'lambda_val': 1.7187471777464757e-05, 'batch_size': 2050, 'optimizer': 'RMSprop'}.
2026-06-15 23:15:21,145 - experiment_functions - INFO - Early stopping at epoch 2200. Best Metrics: (0.10637059785336236, 0.012870922365865093, 0.05704166564463123)
2026-06-15 23:15:21,231 - optuna.study.study - INFO - Trial 262 finished with values: [0.10637059785336236, 0.012870922365865093, 0.05704166564463123] and parameters: {'n_layers': 1, 'embedding_dim': 256, 'lr': 0.001479782641411582, 'lambda_val': 2.0623181656245837e-06, 'batch_size': 2539, 'optimizer': 'Adam'}.
2026-06-15 23:16:34,491 - experiment_functions - INFO - Early stopping at epoch 1750. Best Metrics: (0.08533891410198298, 0.01029539821823297, 0.044556910978999636)
2026-06-15 23:16:34,584 - optuna.study.study - INFO - Trial 263 finished with values: [0.08533891410198298, 0.01029539821823297, 0.044556910978999636] and parameters: {'n_layers': 1, 'embedding_dim': 96, 'lr': 0.0036742654809996723, 'lambda_val': 1.7187471777464757e-05, 'batch_size': 776, 'optimizer': 'Adam'}.
2026-06-15 23:19:17,410 - optuna.study.study - INFO - Trial 264 finished with values: [0.08113295225292941, 0.010628642239935697, 0.04599708923813727] and parameters: {'n_layers': 1, 'embedding_dim': 96, 'lr': 0.0008267470550875525, 'lambda_val': 4.740391388963357e-05, 'batch_size': 1772, 'optimizer': 'Adam'}.
2026-06-15 23:19:41,671 - experiment_functions - INFO - Early stopping at epoch 550. Best Metrics: (0.00980334270727358, 0.0013748409136579813, 0.004862843347986435)
2026-06-15 23:19:41,759 - optuna.study.study - INFO - Trial 265 finished with values: [0.00980334270727358, 0.0013748409136579813, 0.004862843347986435] and parameters: {'n_layers': 1, 'embedding_dim': 128, 'lr': 0.09830730183786233, 'lambda_val': 0.00041942469140426685, 'batch_size': 3674, 'optimizer': 'Adam'}.
2026-06-15 23:22:32,529 - optuna.study.study - INFO - Trial 266 finished with values: [0.10124599697581327, 0.012417107642842791, 0.05527030955672155] and parameters: {'n_layers': 1, 'embedding_dim': 128, 'lr': 0.0008007729293904306, 'lambda_val': 2.0623181656245837e-06, 'batch_size': 3620, 'optimizer': 'Adam'}.
2026-06-15 23:22:54,127 - experiment_functions - INFO - Early stopping at epoch 500. Best Metrics: (0.0005215246422395767, 8.205506062026927e-05, 0.0002797480283895457)
2026-06-15 23:22:54,208 - optuna.study.study - INFO - Trial 267 finished with values: [0.0005215246422395767, 8.205506062026927e-05, 0.0002797480283895457] and parameters: {'n_layers': 1, 'embedding_dim': 128, 'lr': 0.001479782641411582, 'lambda_val': 4.740391388963357e-05, 'batch_size': 1772, 'optimizer': 'SGD'}.
2026-06-15 23:25:53,731 - optuna.study.study - INFO - Trial 268 finished with values: [0.08186929351082649, 0.010161430772322327, 0.044082626000811975] and parameters: {'n_layers': 2, 'embedding_dim': 128, 'lr': 0.0008105588166462481, 'lambda_val': 4.740391388963357e-05, 'batch_size': 738, 'optimizer': 'Adam'}.
2026-06-15 23:29:00,423 - optuna.study.study - INFO - Trial 269 finished with values: [0.09042681083041615, 0.011611628374305044, 0.05004520956293561] and parameters: {'n_layers': 1, 'embedding_dim': 256, 'lr': 0.0008007729293904306, 'lambda_val': 0.00041942469140426685, 'batch_size': 1650, 'optimizer': 'Adam'}.
2026-06-15 23:30:18,528 - experiment_functions - INFO - Early stopping at epoch 1700. Best Metrics: (0.07997585411778924, 0.00967412418782236, 0.042880575036155236)
2026-06-15 23:30:19,150 - optuna.study.study - INFO - Trial 270 finished with values: [0.07997585411778924, 0.00967412418782236, 0.042880575036155236] and parameters: {'n_layers': 2, 'embedding_dim': 128, 'lr': 0.0008105588166462481, 'lambda_val': 4.740391388963357e-05, 'batch_size': 3226, 'optimizer': 'RMSprop'}.
2026-06-15 23:33:29,291 - optuna.study.study - INFO - Trial 271 finished with values: [0.1053955926721691, 0.013145555629981914, 0.056849827702747616] and parameters: {'n_layers': 1, 'embedding_dim': 256, 'lr': 0.0008007729293904306, 'lambda_val': 6.461965909578869e-06, 'batch_size': 3226, 'optimizer': 'Adam'}.
2026-06-15 23:36:01,600 - optuna.study.study - INFO - Trial 272 finished with values: [0.02418713303663995, 0.003442963359903544, 0.012057177335308866] and parameters: {'n_layers': 2, 'embedding_dim': 32, 'lr': 0.0004350273858055106, 'lambda_val': 0.03505660171944219, 'batch_size': 2539, 'optimizer': 'Adam'}.
2026-06-15 23:37:00,616 - experiment_functions - INFO - Early stopping at epoch 1350. Best Metrics: (0.09788387476047616, 0.011849420590796437, 0.05163937255930527)
2026-06-15 23:37:00,745 - optuna.study.study - INFO - Trial 273 finished with values: [0.09788387476047616, 0.011849420590796437, 0.05163937255930527] and parameters: {'n_layers': 1, 'embedding_dim': 128, 'lr': 0.001479782641411582, 'lambda_val': 6.461965909578869e-06, 'batch_size': 3226, 'optimizer': 'RMSprop'}.
2026-06-15 23:40:31,502 - optuna.study.study - INFO - Trial 274 finished with values: [0.09155952514412397, 0.011162837430504386, 0.04989100261701817] and parameters: {'n_layers': 2, 'embedding_dim': 256, 'lr': 0.0008007729293904306, 'lambda_val': 1.5130950471060717e-06, 'batch_size': 1214, 'optimizer': 'Adam'}.
2026-06-15 23:41:03,225 - experiment_functions - INFO - Early stopping at epoch 700. Best Metrics: (0.07179493372668608, 0.008488512291513163, 0.03535646104635152)
2026-06-15 23:41:03,303 - optuna.study.study - INFO - Trial 275 finished with values: [0.07179493372668608, 0.008488512291513163, 0.03535646104635152] and parameters: {'n_layers': 1, 'embedding_dim': 128, 'lr': 0.0036742654809996723, 'lambda_val': 1.5130950471060717e-06, 'batch_size': 3620, 'optimizer': 'RMSprop'}.
2026-06-15 23:44:04,353 - optuna.study.study - INFO - Trial 276 finished with values: [0.08142431725993363, 0.00998727309263849, 0.044226679871039606] and parameters: {'n_layers': 2, 'embedding_dim': 128, 'lr': 0.0008007729293904306, 'lambda_val': 6.461965909578869e-06, 'batch_size': 738, 'optimizer': 'Adam'}.
2026-06-15 23:44:30,991 - experiment_functions - INFO - Early stopping at epoch 500. Best Metrics: (0.000497224556394736, 8.205506062026927e-05, 0.00022964271351142028)
2026-06-15 23:44:31,064 - optuna.study.study - INFO - Trial 277 finished with values: [0.000497224556394736, 8.205506062026927e-05, 0.00022964271351142028] and parameters: {'n_layers': 2, 'embedding_dim': 256, 'lr': 0.004291551488964416, 'lambda_val': 0.00041942469140426685, 'batch_size': 1650, 'optimizer': 'SGD'}.
2026-06-15 23:47:43,187 - optuna.study.study - INFO - Trial 278 finished with values: [0.10875086875887223, 0.013212539352937236, 0.05861471457306449] and parameters: {'n_layers': 1, 'embedding_dim': 256, 'lr': 0.0011865391308241743, 'lambda_val': 6.461965909578869e-06, 'batch_size': 2428, 'optimizer': 'Adam'}.
2026-06-15 23:50:22,531 - optuna.study.study - INFO - Trial 279 finished with values: [0.0961007976252881, 0.011636747270413288, 0.05196386394396735] and parameters: {'n_layers': 1, 'embedding_dim': 32, 'lr': 0.001479782641411582, 'lambda_val': 6.461965909578869e-06, 'batch_size': 3226, 'optimizer': 'Adam'}.
2026-06-15 23:53:24,856 - optuna.study.study - INFO - Trial 280 finished with values: [0.08869678766111974, 0.010742514568959742, 0.04878505797338351] and parameters: {'n_layers': 2, 'embedding_dim': 128, 'lr': 0.0008007729293904306, 'lambda_val': 1.5130950471060717e-06, 'batch_size': 1708, 'optimizer': 'Adam'}.
2026-06-15 23:55:46,043 - experiment_functions - INFO - Early stopping at epoch 2650. Best Metrics: (0.08911576844966995, 0.010712371893629849, 0.047486286011254035)
2026-06-15 23:55:46,122 - optuna.study.study - INFO - Trial 281 finished with values: [0.08911576844966995, 0.010712371893629849, 0.047486286011254035] and parameters: {'n_layers': 2, 'embedding_dim': 256, 'lr': 0.0008007729293904306, 'lambda_val': 1.5130950471060717e-06, 'batch_size': 2380, 'optimizer': 'Adam'}.
2026-06-15 23:56:26,747 - experiment_functions - INFO - Early stopping at epoch 900. Best Metrics: (0.0860489642769981, 0.010581753633866972, 0.04635343361074831)
2026-06-15 23:56:27,122 - optuna.study.study - INFO - Trial 282 finished with values: [0.0860489642769981, 0.010581753633866972, 0.04635343361074831] and parameters: {'n_layers': 1, 'embedding_dim': 128, 'lr': 0.0036742654809996723, 'lambda_val': 1.7187471777464757e-05, 'batch_size': 1420, 'optimizer': 'Adam'}.
2026-06-15 23:57:07,677 - experiment_functions - INFO - Early stopping at epoch 850. Best Metrics: (0.07740460855406261, 0.009699243083930605, 0.04032686248346002)
2026-06-15 23:57:08,013 - optuna.study.study - INFO - Trial 283 finished with values: [0.07740460855406261, 0.009699243083930605, 0.04032686248346002] and parameters: {'n_layers': 2, 'embedding_dim': 128, 'lr': 0.001479782641411582, 'lambda_val': 0.00011845962638954619, 'batch_size': 3109, 'optimizer': 'Adam'}.
2026-06-15 23:59:53,503 - optuna.study.study - INFO - Trial 284 finished with values: [0.08041652180769038, 0.010580079040793089, 0.045851665397295564] and parameters: {'n_layers': 1, 'embedding_dim': 96, 'lr': 0.0008007729293904306, 'lambda_val': 2.0623181656245837e-06, 'batch_size': 1908, 'optimizer': 'Adam'}.
2026-06-16 00:02:34,144 - optuna.study.study - INFO - Trial 285 finished with values: [0.0973754905318636, 0.011913055127603992, 0.05389158684415507] and parameters: {'n_layers': 1, 'embedding_dim': 32, 'lr': 0.001479782641411582, 'lambda_val': 0.0001466773178072416, 'batch_size': 3109, 'optimizer': 'Adam'}.
2026-06-16 00:05:17,610 - optuna.study.study - INFO - Trial 286 finished with values: [0.061767362729011066, 0.007383280862750353, 0.03022540620449825] and parameters: {'n_layers': 3, 'embedding_dim': 32, 'lr': 0.0008007729293904306, 'lambda_val': 0.00041942469140426685, 'batch_size': 1545, 'optimizer': 'RMSprop'}.
2026-06-16 00:06:04,552 - experiment_functions - INFO - Early stopping at epoch 1050. Best Metrics: (0.08570949710453768, 0.010474579677138456, 0.04413953083060839)
