2026-06-14 09:15:43,239 - optuna.study.study - INFO - Trial 233 finished with values: [0.08104904686555268, 0.010126264317770781, 0.04199999790624364] and parameters: {'n_layers': 1, 'embedding_dim': 96, 'lr': 0.004647123942859633, 'lambda_val': 0.0001364070822934131, 'batch_size': 3438, 'optimizer': 'Adam'}.
2026-06-14 09:16:48,964 - experiment_functions - INFO - Early stopping at epoch 1700. Best Metrics: (0.03501916134996177, 0.004357291178243687, 0.016895229659034044)
2026-06-14 09:16:49,038 - optuna.study.study - INFO - Trial 234 finished with values: [0.03501916134996177, 0.004357291178243687, 0.016895229659034044] and parameters: {'n_layers': 1, 'embedding_dim': 32, 'lr': 0.013269505805929734, 'lambda_val': 0.00017543678662275883, 'batch_size': 1481, 'optimizer': 'RMSprop'}.
2026-06-14 09:17:10,561 - experiment_functions - INFO - Early stopping at epoch 500. Best Metrics: (0.00039174771843086587, 6.195994373367272e-05, 0.000164014697461087)
2026-06-14 09:17:10,649 - optuna.study.study - INFO - Trial 235 finished with values: [0.00039174771843086587, 6.195994373367272e-05, 0.000164014697461087] and parameters: {'n_layers': 1, 'embedding_dim': 96, 'lr': 0.00017041609211603933, 'lambda_val': 1.910365266111311e-06, 'batch_size': 2852, 'optimizer': 'SGD'}.
2026-06-14 09:19:57,994 - optuna.study.study - INFO - Trial 236 finished with values: [0.0925501085157671, 0.011685310469555898, 0.051788181903228356] and parameters: {'n_layers': 1, 'embedding_dim': 96, 'lr': 0.0007005785040331192, 'lambda_val': 1.910365266111311e-06, 'batch_size': 2852, 'optimizer': 'Adam'}.
2026-06-14 09:20:31,332 - experiment_functions - INFO - Early stopping at epoch 750. Best Metrics: (0.08310680186986473, 0.010434389443365263, 0.04430739226829743)
2026-06-14 09:20:32,126 - optuna.study.study - INFO - Trial 237 finished with values: [0.08310680186986473, 0.010434389443365263, 0.04430739226829743] and parameters: {'n_layers': 1, 'embedding_dim': 96, 'lr': 0.00313272872703372, 'lambda_val': 1.910365266111311e-06, 'batch_size': 2507, 'optimizer': 'Adam'}.
2026-06-14 09:23:45,538 - optuna.study.study - INFO - Trial 238 finished with values: [0.09625793967623247, 0.012058744725031817, 0.050702866414239066] and parameters: {'n_layers': 1, 'embedding_dim': 256, 'lr': 0.0009554934943534302, 'lambda_val': 0.0003071461412000055, 'batch_size': 1756, 'optimizer': 'Adam'}.
2026-06-14 09:26:40,540 - optuna.study.study - INFO - Trial 239 finished with values: [0.09836488676190469, 0.01219773595016411, 0.05270300971989473] and parameters: {'n_layers': 1, 'embedding_dim': 128, 'lr': 0.0011116819593430245, 'lambda_val': 8.09656091279598e-05, 'batch_size': 2416, 'optimizer': 'Adam'}.
2026-06-14 09:29:17,192 - optuna.study.study - INFO - Trial 240 finished with values: [0.04444270791005041, 0.006432111996784781, 0.025800173174024558] and parameters: {'n_layers': 1, 'embedding_dim': 64, 'lr': 0.0004553975451984739, 'lambda_val': 0.004913946733537837, 'batch_size': 1231, 'optimizer': 'RMSprop'}.
2026-06-14 09:30:22,994 - experiment_functions - INFO - Early stopping at epoch 1550. Best Metrics: (0.08307618454530817, 0.01019157344765222, 0.04300567013991786)
2026-06-14 09:30:23,064 - optuna.study.study - INFO - Trial 241 finished with values: [0.08307618454530817, 0.01019157344765222, 0.04300567013991786] and parameters: {'n_layers': 1, 'embedding_dim': 96, 'lr': 0.0011116819593430245, 'lambda_val': 0.0003071461412000055, 'batch_size': 3686, 'optimizer': 'RMSprop'}.
2026-06-14 09:31:54,840 - experiment_functions - INFO - Early stopping at epoch 2100. Best Metrics: (0.09700993400926716, 0.011934824837564473, 0.05078615369214897)
2026-06-14 09:31:54,979 - optuna.study.study - INFO - Trial 242 finished with values: [0.09700993400926716, 0.011934824837564473, 0.05078615369214897] and parameters: {'n_layers': 1, 'embedding_dim': 128, 'lr': 0.0011116819593430245, 'lambda_val': 0.0003071461412000055, 'batch_size': 2416, 'optimizer': 'Adam'}.
2026-06-14 09:34:34,041 - optuna.study.study - INFO - Trial 243 finished with values: [0.09341413551918544, 0.011532922499832541, 0.0502319895483739] and parameters: {'n_layers': 1, 'embedding_dim': 32, 'lr': 0.0018298433238571003, 'lambda_val': 1.547696085959405e-05, 'batch_size': 1995, 'optimizer': 'Adam'}.
2026-06-14 09:35:15,161 - experiment_functions - INFO - Early stopping at epoch 950. Best Metrics: (0.03639305432885585, 0.004832875611226473, 0.01831495587266892)
2026-06-14 09:35:15,370 - optuna.study.study - INFO - Trial 244 finished with values: [0.03639305432885585, 0.004832875611226473, 0.01831495587266892] and parameters: {'n_layers': 2, 'embedding_dim': 64, 'lr': 0.0009554934943534302, 'lambda_val': 0.015415825510823999, 'batch_size': 3129, 'optimizer': 'Adam'}.
2026-06-14 09:38:04,426 - optuna.study.study - INFO - Trial 245 finished with values: [0.0189311435019506, 0.0027111661866166523, 0.008796794939930774] and parameters: {'n_layers': 3, 'embedding_dim': 64, 'lr': 0.004647123942859633, 'lambda_val': 0.015325156862556187, 'batch_size': 3452, 'optimizer': 'Adam'}.
2026-06-14 09:38:58,980 - experiment_functions - INFO - Early stopping at epoch 1100. Best Metrics: (0.08851448546361723, 0.011055663473775873, 0.04638936058237178)
2026-06-14 09:38:59,084 - optuna.study.study - INFO - Trial 246 finished with values: [0.08851448546361723, 0.011055663473775873, 0.04638936058237178] and parameters: {'n_layers': 1, 'embedding_dim': 256, 'lr': 0.0009554934943534302, 'lambda_val': 0.0003071461412000055, 'batch_size': 3452, 'optimizer': 'RMSprop'}.
2026-06-14 09:41:51,310 - optuna.study.study - INFO - Trial 247 finished with values: [0.08632226361422139, 0.01105398888070199, 0.049162034412542716] and parameters: {'n_layers': 1, 'embedding_dim': 128, 'lr': 0.0007333136681919207, 'lambda_val': 1.547696085959405e-05, 'batch_size': 1267, 'optimizer': 'RMSprop'}.
2026-06-14 09:45:25,162 - optuna.study.study - INFO - Trial 248 finished with values: [0.07979081372617529, 0.010176502109987273, 0.04435559903948839] and parameters: {'n_layers': 2, 'embedding_dim': 256, 'lr': 0.00034081213821976773, 'lambda_val': 1.547696085959405e-05, 'batch_size': 2132, 'optimizer': 'RMSprop'}.
2026-06-14 09:48:12,042 - optuna.study.study - INFO - Trial 249 finished with values: [0.08906824576433445, 0.011335320517114342, 0.04770357415320085] and parameters: {'n_layers': 1, 'embedding_dim': 96, 'lr': 0.0006380704426022134, 'lambda_val': 0.0001364070822934131, 'batch_size': 3438, 'optimizer': 'Adam'}.
2026-06-14 09:48:36,927 - experiment_functions - INFO - Early stopping at epoch 550. Best Metrics: (0.06560322376582729, 0.007815325875812178, 0.0339397162364046)
2026-06-14 09:48:37,216 - optuna.study.study - INFO - Trial 250 finished with values: [0.06560322376582729, 0.007815325875812178, 0.0339397162364046] and parameters: {'n_layers': 1, 'embedding_dim': 96, 'lr': 0.013102328715384413, 'lambda_val': 0.0003071461412000055, 'batch_size': 3438, 'optimizer': 'Adam'}.
2026-06-14 09:50:30,398 - experiment_functions - INFO - Early stopping at epoch 2750. Best Metrics: (0.09273036012093835, 0.011541295465201955, 0.050052395240961216)
2026-06-14 09:50:30,493 - optuna.study.study - INFO - Trial 251 finished with values: [0.09273036012093835, 0.011541295465201955, 0.050052395240961216] and parameters: {'n_layers': 1, 'embedding_dim': 64, 'lr': 0.0011116819593430245, 'lambda_val': 0.00014895795346764513, 'batch_size': 3452, 'optimizer': 'Adam'}.
2026-06-14 09:53:42,722 - optuna.study.study - INFO - Trial 252 finished with values: [0.09832334729734521, 0.012529305378792955, 0.055274781460571416] and parameters: {'n_layers': 1, 'embedding_dim': 256, 'lr': 0.0007333136681919207, 'lambda_val': 1.0623109995192106e-05, 'batch_size': 2234, 'optimizer': 'Adam'}.
2026-06-14 09:56:33,599 - optuna.study.study - INFO - Trial 253 finished with values: [0.09372197257821209, 0.011631723491191641, 0.05062392426403799] and parameters: {'n_layers': 1, 'embedding_dim': 96, 'lr': 0.0011116819593430245, 'lambda_val': 1.910365266111311e-06, 'batch_size': 2130, 'optimizer': 'Adam'}.
2026-06-14 09:59:19,154 - optuna.study.study - INFO - Trial 254 finished with values: [0.026087963139929848, 0.003993904481211065, 0.013043765899515175] and parameters: {'n_layers': 1, 'embedding_dim': 128, 'lr': 0.011002226923510005, 'lambda_val': 0.025132453788059513, 'batch_size': 3452, 'optimizer': 'RMSprop'}.
2026-06-14 10:00:09,762 - experiment_functions - INFO - Early stopping at epoch 1150. Best Metrics: (0.06047571584716287, 0.00796436465938777, 0.0315670349798493)
2026-06-14 10:00:09,849 - optuna.study.study - INFO - Trial 255 finished with values: [0.06047571584716287, 0.00796436465938777, 0.0315670349798493] and parameters: {'n_layers': 1, 'embedding_dim': 128, 'lr': 0.0007005785040331192, 'lambda_val': 0.008874081922463268, 'batch_size': 3517, 'optimizer': 'RMSprop'}.
2026-06-14 10:00:47,942 - experiment_functions - INFO - Early stopping at epoch 750. Best Metrics: (0.08229666897711847, 0.010059280594815461, 0.043875145369018285)
2026-06-14 10:00:48,031 - optuna.study.study - INFO - Trial 256 finished with values: [0.08229666897711847, 0.010059280594815461, 0.043875145369018285] and parameters: {'n_layers': 1, 'embedding_dim': 256, 'lr': 0.0033680041802668847, 'lambda_val': 1.547696085959405e-05, 'batch_size': 1995, 'optimizer': 'Adam'}.
2026-06-14 10:03:59,227 - optuna.study.study - INFO - Trial 257 finished with values: [0.09984667062151135, 0.012420456828990557, 0.053887225332745946] and parameters: {'n_layers': 1, 'embedding_dim': 256, 'lr': 0.0007333136681919207, 'lambda_val': 4.898157643229756e-06, 'batch_size': 2132, 'optimizer': 'RMSprop'}.
2026-06-14 10:06:45,375 - optuna.study.study - INFO - Trial 258 finished with values: [0.08206000861682414, 0.010072677339406526, 0.04242376829263593] and parameters: {'n_layers': 1, 'embedding_dim': 96, 'lr': 0.002252910187430102, 'lambda_val': 2.2728319731025804e-05, 'batch_size': 618, 'optimizer': 'Adam'}.
2026-06-14 10:09:56,617 - optuna.study.study - INFO - Trial 259 finished with values: [0.09891418085235236, 0.012589590729452744, 0.05546433385712947] and parameters: {'n_layers': 1, 'embedding_dim': 256, 'lr': 0.0007333136681919207, 'lambda_val': 1.547696085959405e-05, 'batch_size': 2234, 'optimizer': 'Adam'}.
2026-06-14 10:12:46,743 - optuna.study.study - INFO - Trial 260 finished with values: [0.0881157992559087, 0.011400629646995779, 0.049411260054136964] and parameters: {'n_layers': 1, 'embedding_dim': 128, 'lr': 0.0006380704426022134, 'lambda_val': 0.0001364070822934131, 'batch_size': 1995, 'optimizer': 'Adam'}.
2026-06-14 10:15:32,093 - optuna.study.study - INFO - Trial 261 finished with values: [0.08669774980334015, 0.011219773595016412, 0.04808663816284886] and parameters: {'n_layers': 1, 'embedding_dim': 96, 'lr': 0.0008197571059817735, 'lambda_val': 0.00014351954807410275, 'batch_size': 1405, 'optimizer': 'Adam'}.
2026-06-14 10:18:19,178 - optuna.study.study - INFO - Trial 262 finished with values: [0.08503542054107603, 0.01110925045214013, 0.046844448122421126] and parameters: {'n_layers': 1, 'embedding_dim': 96, 'lr': 0.0006380704426022134, 'lambda_val': 0.0003071461412000055, 'batch_size': 2857, 'optimizer': 'Adam'}.
2026-06-14 10:21:09,263 - optuna.study.study - INFO - Trial 263 finished with values: [0.09424485516250353, 0.011839373032353138, 0.05155277320355258] and parameters: {'n_layers': 1, 'embedding_dim': 96, 'lr': 0.0008197571059817735, 'lambda_val': 0.00011675745993133021, 'batch_size': 3452, 'optimizer': 'Adam'}.
2026-06-14 10:21:34,187 - experiment_functions - INFO - Early stopping at epoch 550. Best Metrics: (0.061783271394813426, 0.007351463594346574, 0.03030013512537459)
2026-06-14 10:21:34,273 - optuna.study.study - INFO - Trial 264 finished with values: [0.061783271394813426, 0.007351463594346574, 0.03030013512537459] and parameters: {'n_layers': 1, 'embedding_dim': 96, 'lr': 0.019255232803719595, 'lambda_val': 1.910365266111311e-06, 'batch_size': 3941, 'optimizer': 'Adam'}.
2026-06-14 10:24:25,596 - optuna.study.study - INFO - Trial 265 finished with values: [0.08615532535277719, 0.011176234175095452, 0.04827580799299468] and parameters: {'n_layers': 1, 'embedding_dim': 128, 'lr': 0.0006380704426022134, 'lambda_val': 0.0001364070822934131, 'batch_size': 1995, 'optimizer': 'Adam'}.
2026-06-14 10:25:06,145 - experiment_functions - INFO - Early stopping at epoch 950. Best Metrics: (0.040513078065400936, 0.0048378993904481206, 0.0192181089821051)
2026-06-14 10:25:06,488 - optuna.study.study - INFO - Trial 266 finished with values: [0.040513078065400936, 0.0048378993904481206, 0.0192181089821051] and parameters: {'n_layers': 1, 'embedding_dim': 96, 'lr': 0.014632045183412459, 'lambda_val': 1.910365266111311e-06, 'batch_size': 1405, 'optimizer': 'Adam'}.
2026-06-14 10:26:57,462 - experiment_functions - INFO - Early stopping at epoch 2750. Best Metrics: (0.06512129488432891, 0.008071538616116284, 0.03341407109285386)
2026-06-14 10:26:57,555 - optuna.study.study - INFO - Trial 267 finished with values: [0.06512129488432891, 0.008071538616116284, 0.03341407109285386] and parameters: {'n_layers': 2, 'embedding_dim': 32, 'lr': 0.0009554934943534302, 'lambda_val': 0.0003071461412000055, 'batch_size': 1995, 'optimizer': 'Adam'}.
2026-06-14 10:29:37,979 - optuna.study.study - INFO - Trial 268 finished with values: [0.08706014885212282, 0.011104226672918483, 0.047581300268056764] and parameters: {'n_layers': 1, 'embedding_dim': 32, 'lr': 0.0009554934943534302, 'lambda_val': 0.0001364070822934131, 'batch_size': 2917, 'optimizer': 'Adam'}.
2026-06-14 10:32:21,625 - optuna.study.study - INFO - Trial 269 finished with values: [0.060611111561505567, 0.007493804005626633, 0.030549223373133344] and parameters: {'n_layers': 3, 'embedding_dim': 32, 'lr': 0.0009554934943534302, 'lambda_val': 1.547696085959405e-05, 'batch_size': 940, 'optimizer': 'Adam'}.
2026-06-14 10:35:00,584 - optuna.study.study - INFO - Trial 270 finished with values: [0.0017965223425176358, 0.00026793489182128745, 0.0009331956928569553] and parameters: {'n_layers': 1, 'embedding_dim': 96, 'lr': 0.00020029161120526875, 'lambda_val': 6.85989723382597e-05, 'batch_size': 1995, 'optimizer': 'Adam'}.
2026-06-14 10:35:53,644 - experiment_functions - INFO - Early stopping at epoch 1050. Best Metrics: (0.04095760027986448, 0.005164445039855315, 0.01941874745022124)
2026-06-14 10:35:53,733 - optuna.study.study - INFO - Trial 271 finished with values: [0.04095760027986448, 0.005164445039855315, 0.01941874745022124] and parameters: {'n_layers': 4, 'embedding_dim': 96, 'lr': 0.0007333136681919207, 'lambda_val': 1.547696085959405e-05, 'batch_size': 3438, 'optimizer': 'RMSprop'}.
2026-06-14 10:38:40,069 - optuna.study.study - INFO - Trial 272 finished with values: [0.08561046352037638, 0.010869783642574855, 0.047669204728703014] and parameters: {'n_layers': 1, 'embedding_dim': 96, 'lr': 0.0006380704426022134, 'lambda_val': 2.2728319731025804e-05, 'batch_size': 2234, 'optimizer': 'Adam'}.
2026-06-14 10:41:52,298 - optuna.study.study - INFO - Trial 273 finished with values: [0.09881427661670372, 0.012520932413423539, 0.0543494199226428] and parameters: {'n_layers': 1, 'embedding_dim': 256, 'lr': 0.0007333136681919207, 'lambda_val': 8.09656091279598e-05, 'batch_size': 2416, 'optimizer': 'Adam'}.
2026-06-14 10:42:35,331 - experiment_functions - INFO - Early stopping at epoch 850. Best Metrics: (0.03432168488086828, 0.004136244892491124, 0.01645691300977287)
2026-06-14 10:42:35,435 - optuna.study.study - INFO - Trial 274 finished with values: [0.03432168488086828, 0.004136244892491124, 0.01645691300977287] and parameters: {'n_layers': 4, 'embedding_dim': 96, 'lr': 0.002252910187430102, 'lambda_val': 1.910365266111311e-06, 'batch_size': 3031, 'optimizer': 'Adam'}.
2026-06-14 10:44:20,025 - experiment_functions - INFO - Early stopping at epoch 2350. Best Metrics: (0.09680098181095545, 0.01216424408868645, 0.05243453393072187)
2026-06-14 10:44:20,120 - optuna.study.study - INFO - Trial 275 finished with values: [0.09680098181095545, 0.01216424408868645, 0.05243453393072187] and parameters: {'n_layers': 1, 'embedding_dim': 128, 'lr': 0.0011116819593430245, 'lambda_val': 0.0001364070822934131, 'batch_size': 2416, 'optimizer': 'Adam'}.
2026-06-14 10:44:56,740 - experiment_functions - INFO - Early stopping at epoch 800. Best Metrics: (0.0884396053257309, 0.010985330564672784, 0.046654705573619816)
2026-06-14 10:44:56,827 - optuna.study.study - INFO - Trial 276 finished with values: [0.0884396053257309, 0.010985330564672784, 0.046654705573619816] and parameters: {'n_layers': 1, 'embedding_dim': 128, 'lr': 0.0026151784998877732, 'lambda_val': 1.547696085959405e-05, 'batch_size': 3120, 'optimizer': 'Adam'}.
2026-06-14 10:47:49,511 - optuna.study.study - INFO - Trial 277 finished with values: [0.0946135696064698, 0.012000133967445911, 0.051664971202463265] and parameters: {'n_layers': 1, 'embedding_dim': 128, 'lr': 0.0008197571059817735, 'lambda_val': 1.910365266111311e-06, 'batch_size': 2260, 'optimizer': 'Adam'}.
2026-06-14 10:51:03,456 - optuna.study.study - INFO - Trial 278 finished with values: [0.09958498264731791, 0.012597963694822157, 0.05522467555766266] and parameters: {'n_layers': 1, 'embedding_dim': 256, 'lr': 0.0006380704426022134, 'lambda_val': 0.0001364070822934131, 'batch_size': 3219, 'optimizer': 'Adam'}.
2026-06-14 10:53:12,356 - experiment_functions - INFO - Early stopping at epoch 2650. Best Metrics: (0.096904201132242, 0.011980038850559314, 0.051646223701909875)
2026-06-14 10:53:12,447 - optuna.study.study - INFO - Trial 279 finished with values: [0.096904201132242, 0.011980038850559314, 0.051646223701909875] and parameters: {'n_layers': 1, 'embedding_dim': 256, 'lr': 0.0009554934943534302, 'lambda_val': 0.0003071461412000055, 'batch_size': 2852, 'optimizer': 'Adam'}.
2026-06-14 10:56:26,962 - optuna.study.study - INFO - Trial 280 finished with values: [0.10127220987360169, 0.012530979971866836, 0.0540566422342084] and parameters: {'n_layers': 1, 'embedding_dim': 256, 'lr': 0.0009554934943534302, 'lambda_val': 9.684005068083544e-06, 'batch_size': 3686, 'optimizer': 'Adam'}.
2026-06-14 10:59:20,976 - optuna.study.study - INFO - Trial 281 finished with values: [0.0966058987528785, 0.012047022573514636, 0.05286596417668179] and parameters: {'n_layers': 1, 'embedding_dim': 128, 'lr': 0.0008197571059817735, 'lambda_val': 4.8337470497253965e-05, 'batch_size': 3078, 'optimizer': 'Adam'}.
2026-06-14 11:02:33,097 - optuna.study.study - INFO - Trial 282 finished with values: [0.1012804257732599, 0.012430504387433853, 0.05475856173655772] and parameters: {'n_layers': 1, 'embedding_dim': 256, 'lr': 0.0006380704426022134, 'lambda_val': 0.0001364070822934131, 'batch_size': 3438, 'optimizer': 'RMSprop'}.
2026-06-14 11:02:54,771 - experiment_functions - INFO - Early stopping at epoch 500. Best Metrics: (0.000540947502976375, 8.707883984191843e-05, 0.00022530400924867025)
2026-06-14 11:02:54,862 - optuna.study.study - INFO - Trial 283 finished with values: [0.000540947502976375, 8.707883984191843e-05, 0.00022530400924867025] and parameters: {'n_layers': 1, 'embedding_dim': 96, 'lr': 0.0011116819593430245, 'lambda_val': 0.0003071461412000055, 'batch_size': 3686, 'optimizer': 'SGD'}.
2026-06-14 11:06:09,005 - optuna.study.study - INFO - Trial 284 finished with values: [0.09907324567946539, 0.012497488110389176, 0.05392034602058812] and parameters: {'n_layers': 1, 'embedding_dim': 256, 'lr': 0.0009554934943534302, 'lambda_val': 1.547696085959405e-05, 'batch_size': 1995, 'optimizer': 'Adam'}.
2026-06-14 11:09:02,577 - optuna.study.study - INFO - Trial 285 finished with values: [0.09565907825367556, 0.011770714716323934, 0.05028039218400496] and parameters: {'n_layers': 1, 'embedding_dim': 128, 'lr': 0.0011116819593430245, 'lambda_val': 1.547696085959405e-05, 'batch_size': 2377, 'optimizer': 'RMSprop'}.
2026-06-14 11:09:26,606 - experiment_functions - INFO - Early stopping at epoch 550. Best Metrics: (0.011359016422411102, 0.0015540223725634672, 0.0060041221392101276)
2026-06-14 11:09:26,686 - optuna.study.study - INFO - Trial 286 finished with values: [0.011359016422411102, 0.0015540223725634672, 0.0060041221392101276] and parameters: {'n_layers': 1, 'embedding_dim': 96, 'lr': 0.09730452437731843, 'lambda_val': 0.00014895795346764513, 'batch_size': 1120, 'optimizer': 'Adam'}.
2026-06-14 11:09:51,962 - experiment_functions - INFO - Early stopping at epoch 550. Best Metrics: (0.049075100658221855, 0.005770647732600978, 0.02512068259929661)
2026-06-14 11:09:52,049 - optuna.study.study - INFO - Trial 287 finished with values: [0.049075100658221855, 0.005770647732600978, 0.02512068259929661] and parameters: {'n_layers': 1, 'embedding_dim': 128, 'lr': 0.011804877226441987, 'lambda_val': 1.547696085959405e-05, 'batch_size': 1995, 'optimizer': 'Adam'}.
2026-06-14 11:12:43,551 - optuna.study.study - INFO - Trial 288 finished with values: [0.09142680975260593, 0.011646794828856588, 0.050977506325457146] and parameters: {'n_layers': 1, 'embedding_dim': 128, 'lr': 0.0007333136681919207, 'lambda_val': 0.00014895795346764513, 'batch_size': 1995, 'optimizer': 'RMSprop'}.
2026-06-14 11:15:55,884 - optuna.study.study - INFO - Trial 289 finished with values: [0.09505169006947556, 0.012119030075691605, 0.05207975303405647] and parameters: {'n_layers': 1, 'embedding_dim': 256, 'lr': 0.0005276844076496385, 'lambda_val': 0.00020942259902675129, 'batch_size': 3614, 'optimizer': 'Adam'}.
2026-06-14 11:18:40,724 - optuna.study.study - INFO - Trial 290 finished with values: [0.07550699007766185, 0.00973440953848215, 0.042290952843177555] and parameters: {'n_layers': 1, 'embedding_dim': 96, 'lr': 0.0006380704426022134, 'lambda_val': 0.0003071461412000055, 'batch_size': 1405, 'optimizer': 'Adam'}.
