2026-06-14 20:48:45,316 - optuna.study.study - INFO - Trial 88 finished with values: [0.0005192577806179395, 6.698372295532186e-05, 0.00020639222263756546] and parameters: {'n_layers': 4, 'embedding_dim': 128, 'lr': 5.072344360143428e-05, 'lambda_val': 3.4294150750489234e-05, 'batch_size': 1694, 'optimizer': 'SGD'}.
2026-06-14 20:50:59,073 - experiment_functions - INFO - Early stopping at epoch 2800. Best Metrics: (0.06718930051291584, 0.008093308326076763, 0.03299194659345563)
2026-06-14 20:50:59,157 - optuna.study.study - INFO - Trial 89 finished with values: [0.06718930051291584, 0.008093308326076763, 0.03299194659345563] and parameters: {'n_layers': 3, 'embedding_dim': 128, 'lr': 0.0005365827475896209, 'lambda_val': 7.390761978888471e-05, 'batch_size': 2743, 'optimizer': 'RMSprop'}.
2026-06-14 20:51:21,588 - experiment_functions - INFO - Early stopping at epoch 500. Best Metrics: (0.0003804634242310026, 6.530912988143882e-05, 0.00020901929885002926)
2026-06-14 20:51:21,682 - optuna.study.study - INFO - Trial 90 finished with values: [0.0003804634242310026, 6.530912988143882e-05, 0.00020901929885002926] and parameters: {'n_layers': 2, 'embedding_dim': 96, 'lr': 6.574810040582024e-05, 'lambda_val': 0.009846182559241932, 'batch_size': 2122, 'optimizer': 'RMSprop'}.
2026-06-14 20:51:47,950 - experiment_functions - INFO - Early stopping at epoch 550. Best Metrics: (0.032806016903278966, 0.003849889476857124, 0.01589384947285373)
2026-06-14 20:51:48,027 - optuna.study.study - INFO - Trial 91 finished with values: [0.032806016903278966, 0.003849889476857124, 0.01589384947285373] and parameters: {'n_layers': 2, 'embedding_dim': 128, 'lr': 0.03120448116814287, 'lambda_val': 1.3173739854471634e-06, 'batch_size': 1827, 'optimizer': 'Adam'}.
2026-06-14 20:54:29,823 - optuna.study.study - INFO - Trial 92 finished with values: [0.03040619202914818, 0.004809431308192109, 0.01785853515048382] and parameters: {'n_layers': 1, 'embedding_dim': 128, 'lr': 0.00034626607309513543, 'lambda_val': 0.0005753812376677546, 'batch_size': 3018, 'optimizer': 'RMSprop'}.
2026-06-14 20:54:51,522 - experiment_functions - INFO - Early stopping at epoch 500. Best Metrics: (0.00039271743763344153, 6.530912988143881e-05, 0.00015559922832004405)
2026-06-14 20:54:51,609 - optuna.study.study - INFO - Trial 93 finished with values: [0.00039271743763344153, 6.530912988143881e-05, 0.00015559922832004405] and parameters: {'n_layers': 1, 'embedding_dim': 128, 'lr': 0.01005775655032132, 'lambda_val': 2.850716397525743e-05, 'batch_size': 2307, 'optimizer': 'SGD'}.
2026-06-14 20:55:14,114 - experiment_functions - INFO - Early stopping at epoch 550. Best Metrics: (0.018923492056288974, 0.0026693013597695768, 0.009607456890038673)
2026-06-14 20:55:14,195 - optuna.study.study - INFO - Trial 94 finished with values: [0.018923492056288974, 0.0026693013597695768, 0.009607456890038673] and parameters: {'n_layers': 1, 'embedding_dim': 32, 'lr': 0.06269698469750191, 'lambda_val': 9.400809842586073e-06, 'batch_size': 1424, 'optimizer': 'Adam'}.
2026-06-14 20:55:38,751 - experiment_functions - INFO - Early stopping at epoch 500. Best Metrics: (0.0004099265195583429, 7.368209525085404e-05, 0.00019642716620210811)
2026-06-14 20:55:39,778 - optuna.study.study - INFO - Trial 95 finished with values: [0.0004099265195583429, 7.368209525085404e-05, 0.00019642716620210811] and parameters: {'n_layers': 3, 'embedding_dim': 128, 'lr': 0.09705275513779313, 'lambda_val': 0.0063134170943764285, 'batch_size': 3775, 'optimizer': 'SGD'}.
2026-06-14 20:57:51,177 - experiment_functions - INFO - Early stopping at epoch 3150. Best Metrics: (0.0330593983735855, 0.0036288431911045624, 0.0146264353826355)
2026-06-14 20:57:51,252 - optuna.study.study - INFO - Trial 96 finished with values: [0.0330593983735855, 0.0036288431911045624, 0.0146264353826355] and parameters: {'n_layers': 3, 'embedding_dim': 64, 'lr': 0.01005775655032132, 'lambda_val': 5.779334633401426e-06, 'batch_size': 1827, 'optimizer': 'Adam'}.
2026-06-14 20:58:11,494 - experiment_functions - INFO - Early stopping at epoch 500. Best Metrics: (0.0005361369232959466, 6.865831602920491e-05, 0.00024557902898152145)
2026-06-14 20:58:11,588 - optuna.study.study - INFO - Trial 97 finished with values: [0.0005361369232959466, 6.865831602920491e-05, 0.00024557902898152145] and parameters: {'n_layers': 1, 'embedding_dim': 32, 'lr': 0.0006134550992546751, 'lambda_val': 0.033225453617602554, 'batch_size': 3083, 'optimizer': 'SGD'}.
2026-06-14 20:58:36,096 - experiment_functions - INFO - Early stopping at epoch 550. Best Metrics: (0.0005342010748909465, 8.540424676803538e-05, 0.00024170172714418006)
2026-06-14 20:58:36,197 - optuna.study.study - INFO - Trial 98 finished with values: [0.0005342010748909465, 8.540424676803538e-05, 0.00024170172714418006] and parameters: {'n_layers': 2, 'embedding_dim': 96, 'lr': 7.217177242764055e-05, 'lambda_val': 0.009846182559241932, 'batch_size': 1595, 'optimizer': 'RMSprop'}.
2026-06-14 20:58:58,965 - experiment_functions - INFO - Early stopping at epoch 550. Best Metrics: (0.0005869755937395256, 7.703128139862013e-05, 0.0003052753089744414)
2026-06-14 20:58:59,066 - optuna.study.study - INFO - Trial 99 finished with values: [0.0005869755937395256, 7.703128139862013e-05, 0.0003052753089744414] and parameters: {'n_layers': 1, 'embedding_dim': 64, 'lr': 0.0001358679777661971, 'lambda_val': 7.390761978888471e-05, 'batch_size': 3271, 'optimizer': 'RMSprop'}.
2026-06-14 20:59:30,575 - experiment_functions - INFO - Early stopping at epoch 700. Best Metrics: (0.07409680883650167, 0.008997588585973609, 0.0385215916380932)
2026-06-14 20:59:30,670 - optuna.study.study - INFO - Trial 100 finished with values: [0.07409680883650167, 0.008997588585973609, 0.0385215916380932] and parameters: {'n_layers': 1, 'embedding_dim': 128, 'lr': 0.0029187572679997753, 'lambda_val': 0.00012073664489097666, 'batch_size': 2579, 'optimizer': 'RMSprop'}.
2026-06-14 20:59:55,034 - experiment_functions - INFO - Early stopping at epoch 550. Best Metrics: (0.012209769812540024, 0.0018320048228280526, 0.006258673198140693)
2026-06-14 20:59:55,153 - optuna.study.study - INFO - Trial 101 finished with values: [0.012209769812540024, 0.0018320048228280526, 0.006258673198140693] and parameters: {'n_layers': 1, 'embedding_dim': 128, 'lr': 0.09581481877137882, 'lambda_val': 2.085056364972028e-06, 'batch_size': 2394, 'optimizer': 'Adam'}.
2026-06-14 21:02:29,611 - optuna.study.study - INFO - Trial 102 finished with values: [0.01425235261121748, 0.002232232567486101, 0.008020012492629559] and parameters: {'n_layers': 3, 'embedding_dim': 32, 'lr': 0.0001856606360628364, 'lambda_val': 0.00019713152464851107, 'batch_size': 2490, 'optimizer': 'Adam'}.
2026-06-14 21:03:24,875 - experiment_functions - INFO - Early stopping at epoch 1150. Best Metrics: (0.034908705995340045, 0.004116149775604528, 0.01606550455242259)
2026-06-14 21:03:24,953 - optuna.study.study - INFO - Trial 103 finished with values: [0.034908705995340045, 0.004116149775604528, 0.01606550455242259] and parameters: {'n_layers': 4, 'embedding_dim': 96, 'lr': 0.0023822467229262564, 'lambda_val': 0.00019713152464851107, 'batch_size': 2976, 'optimizer': 'Adam'}.
2026-06-14 21:06:30,684 - optuna.study.study - INFO - Trial 104 finished with values: [0.04235170429522924, 0.004640297407729922, 0.01926784433661116] and parameters: {'n_layers': 4, 'embedding_dim': 96, 'lr': 0.017176020213444436, 'lambda_val': 0.00012073664489097666, 'batch_size': 1756, 'optimizer': 'RMSprop'}.
2026-06-14 21:09:22,752 - optuna.study.study - INFO - Trial 105 finished with values: [0.03295957739589588, 0.004045816866501441, 0.015521510417074613] and parameters: {'n_layers': 4, 'embedding_dim': 64, 'lr': 0.0011967976844806853, 'lambda_val': 0.00020614378723959702, 'batch_size': 913, 'optimizer': 'RMSprop'}.
2026-06-14 21:12:04,219 - optuna.study.study - INFO - Trial 106 finished with values: [0.09505962478714797, 0.011725500703329091, 0.05217281677896299] and parameters: {'n_layers': 1, 'embedding_dim': 64, 'lr': 0.00125444020622911, 'lambda_val': 6.806830251349438e-05, 'batch_size': 1686, 'optimizer': 'RMSprop'}.
2026-06-14 21:14:51,074 - optuna.study.study - INFO - Trial 107 finished with values: [0.0342542970557564, 0.003622144818809029, 0.015147013002813733] and parameters: {'n_layers': 3, 'embedding_dim': 64, 'lr': 0.01005775655032132, 'lambda_val': 5.779334633401426e-06, 'batch_size': 2579, 'optimizer': 'Adam'}.
2026-06-14 21:15:28,302 - experiment_functions - INFO - Early stopping at epoch 750. Best Metrics: (0.04671435202528255, 0.005804139594078639, 0.022733855640027598)
2026-06-14 21:15:28,386 - optuna.study.study - INFO - Trial 108 finished with values: [0.04671435202528255, 0.005804139594078639, 0.022733855640027598] and parameters: {'n_layers': 3, 'embedding_dim': 128, 'lr': 0.0011776400704232174, 'lambda_val': 3.904381306216792e-06, 'batch_size': 3878, 'optimizer': 'RMSprop'}.
2026-06-14 21:19:38,544 - optuna.study.study - INFO - Trial 109 finished with values: [0.05899450606587645, 0.007405050572710832, 0.030716233081146266] and parameters: {'n_layers': 4, 'embedding_dim': 256, 'lr': 0.00018243297440383044, 'lambda_val': 1.017349376345002e-05, 'batch_size': 2888, 'optimizer': 'RMSprop'}.
2026-06-14 21:20:06,087 - experiment_functions - INFO - Early stopping at epoch 550. Best Metrics: (0.008666099444249276, 0.0009662402036305177, 0.004358056875991649)
2026-06-14 21:20:06,180 - optuna.study.study - INFO - Trial 110 finished with values: [0.008666099444249276, 0.0009662402036305177, 0.004358056875991649] and parameters: {'n_layers': 3, 'embedding_dim': 128, 'lr': 0.09705275513779313, 'lambda_val': 0.0063134170943764285, 'batch_size': 1827, 'optimizer': 'Adam'}.
2026-06-14 21:20:57,488 - experiment_functions - INFO - Early stopping at epoch 1050. Best Metrics: (0.0931674856364696, 0.011496081452207116, 0.04898634403129098)
2026-06-14 21:20:57,556 - optuna.study.study - INFO - Trial 111 finished with values: [0.0931674856364696, 0.011496081452207116, 0.04898634403129098] and parameters: {'n_layers': 1, 'embedding_dim': 256, 'lr': 0.0029187572679997753, 'lambda_val': 1.3173739854471634e-06, 'batch_size': 1827, 'optimizer': 'Adam'}.
2026-06-14 21:25:08,803 - optuna.study.study - INFO - Trial 112 finished with values: [0.06263653355462363, 0.007659588719941055, 0.03180968647623777] and parameters: {'n_layers': 4, 'embedding_dim': 256, 'lr': 0.0003794262448571181, 'lambda_val': 3.904381306216792e-06, 'batch_size': 2141, 'optimizer': 'RMSprop'}.
2026-06-14 21:25:34,807 - experiment_functions - INFO - Early stopping at epoch 550. Best Metrics: (0.01734820860141993, 0.002049701922432849, 0.007918752658006492)
2026-06-14 21:25:34,899 - optuna.study.study - INFO - Trial 113 finished with values: [0.01734820860141993, 0.002049701922432849, 0.007918752658006492] and parameters: {'n_layers': 2, 'embedding_dim': 128, 'lr': 0.03120448116814287, 'lambda_val': 0.009846182559241932, 'batch_size': 2122, 'optimizer': 'Adam'}.
2026-06-14 21:28:52,639 - optuna.study.study - INFO - Trial 114 finished with values: [0.03758621755261306, 0.004432647866568424, 0.017525354927750335] and parameters: {'n_layers': 4, 'embedding_dim': 128, 'lr': 0.0014328783582003698, 'lambda_val': 7.390761978888471e-05, 'batch_size': 1286, 'optimizer': 'RMSprop'}.
2026-06-14 21:31:55,241 - optuna.study.study - INFO - Trial 115 finished with values: [0.04975957623690121, 0.007304574988277848, 0.027678575194484595] and parameters: {'n_layers': 1, 'embedding_dim': 256, 'lr': 0.0007032917526721348, 'lambda_val': 0.003948637868067098, 'batch_size': 913, 'optimizer': 'Adam'}.
2026-06-14 21:35:14,973 - optuna.study.study - INFO - Trial 116 finished with values: [0.060267454767758105, 0.007483756447183334, 0.03095395673457827] and parameters: {'n_layers': 4, 'embedding_dim': 128, 'lr': 0.0003794262448571181, 'lambda_val': 1.6750135096134514e-06, 'batch_size': 929, 'optimizer': 'RMSprop'}.
2026-06-14 21:35:46,332 - experiment_functions - INFO - Early stopping at epoch 700. Best Metrics: (0.06840047458196997, 0.00848181391921763, 0.03453136411979373)
2026-06-14 21:35:46,443 - optuna.study.study - INFO - Trial 117 finished with values: [0.06840047458196997, 0.00848181391921763, 0.03453136411979373] and parameters: {'n_layers': 1, 'embedding_dim': 128, 'lr': 0.006926802971380086, 'lambda_val': 0.00020576561233050602, 'batch_size': 1424, 'optimizer': 'Adam'}.
2026-06-14 21:39:35,169 - optuna.study.study - INFO - Trial 118 finished with values: [0.0655834159652766, 0.007930872797910108, 0.03356693442636282] and parameters: {'n_layers': 3, 'embedding_dim': 256, 'lr': 0.000567654585955759, 'lambda_val': 3.246247535060975e-06, 'batch_size': 776, 'optimizer': 'RMSprop'}.
2026-06-14 21:40:02,440 - experiment_functions - INFO - Early stopping at epoch 550. Best Metrics: (0.024580660713919733, 0.002804943398754103, 0.011174984451617059)
2026-06-14 21:40:02,513 - optuna.study.study - INFO - Trial 119 finished with values: [0.024580660713919733, 0.002804943398754103, 0.011174984451617059] and parameters: {'n_layers': 3, 'embedding_dim': 128, 'lr': 0.09705275513779313, 'lambda_val': 0.00020614378723959702, 'batch_size': 2408, 'optimizer': 'Adam'}.
2026-06-14 21:42:35,514 - optuna.study.study - INFO - Trial 120 finished with values: [0.03956608528877805, 0.00560653761136044, 0.021324964313825828] and parameters: {'n_layers': 2, 'embedding_dim': 32, 'lr': 0.00034626607309513543, 'lambda_val': 4.747391845672533e-06, 'batch_size': 2146, 'optimizer': 'RMSprop'}.
2026-06-14 21:43:34,532 - experiment_functions - INFO - Early stopping at epoch 1350. Best Metrics: (0.06793387995754047, 0.008192109317435862, 0.03370788557161373)
2026-06-14 21:43:34,607 - optuna.study.study - INFO - Trial 121 finished with values: [0.06793387995754047, 0.008192109317435862, 0.03370788557161373] and parameters: {'n_layers': 2, 'embedding_dim': 96, 'lr': 0.0012453044445403945, 'lambda_val': 3.904381306216792e-06, 'batch_size': 2141, 'optimizer': 'RMSprop'}.
2026-06-14 21:44:04,192 - experiment_functions - INFO - Early stopping at epoch 650. Best Metrics: (0.08368197850040078, 0.010216692343760467, 0.04271898800625488)
2026-06-14 21:44:04,280 - optuna.study.study - INFO - Trial 122 finished with values: [0.08368197850040078, 0.010216692343760467, 0.04271898800625488] and parameters: {'n_layers': 1, 'embedding_dim': 128, 'lr': 0.006926802971380086, 'lambda_val': 0.0005753812376677546, 'batch_size': 3018, 'optimizer': 'Adam'}.
2026-06-14 21:44:34,251 - experiment_functions - INFO - Early stopping at epoch 550. Best Metrics: (0.025410108084500626, 0.0031046955589791683, 0.012534785110731103)
2026-06-14 21:44:34,322 - optuna.study.study - INFO - Trial 123 finished with values: [0.025410108084500626, 0.0031046955589791683, 0.012534785110731103] and parameters: {'n_layers': 2, 'embedding_dim': 256, 'lr': 0.03120448116814287, 'lambda_val': 0.00019713152464851107, 'batch_size': 2976, 'optimizer': 'RMSprop'}.
2026-06-14 21:45:44,663 - experiment_functions - INFO - Early stopping at epoch 1650. Best Metrics: (0.03475305165101885, 0.004097729251791815, 0.016009453485788822)
2026-06-14 21:45:44,744 - optuna.study.study - INFO - Trial 124 finished with values: [0.03475305165101885, 0.004097729251791815, 0.016009453485788822] and parameters: {'n_layers': 3, 'embedding_dim': 64, 'lr': 0.0029187572679997753, 'lambda_val': 0.0001311708167749871, 'batch_size': 2400, 'optimizer': 'RMSprop'}.
2026-06-14 21:46:10,523 - experiment_functions - INFO - Early stopping at epoch 500. Best Metrics: (0.0003980004038842055, 7.200750217697099e-05, 0.00020019153068801503)
2026-06-14 21:46:10,609 - optuna.study.study - INFO - Trial 125 finished with values: [0.0003980004038842055, 7.200750217697099e-05, 0.00020019153068801503] and parameters: {'n_layers': 4, 'embedding_dim': 128, 'lr': 0.0011776400704232174, 'lambda_val': 2.839715524460245e-05, 'batch_size': 2579, 'optimizer': 'SGD'}.
2026-06-14 21:46:59,484 - experiment_functions - INFO - Early stopping at epoch 750. Best Metrics: (0.032239756715897495, 0.003580279991961954, 0.014946443214345632)
2026-06-14 21:47:00,061 - optuna.study.study - INFO - Trial 126 finished with values: [0.032239756715897495, 0.003580279991961954, 0.014946443214345632] and parameters: {'n_layers': 4, 'embedding_dim': 256, 'lr': 0.03120448116814287, 'lambda_val': 1.3173739854471634e-06, 'batch_size': 2141, 'optimizer': 'Adam'}.
2026-06-14 21:47:21,922 - experiment_functions - INFO - Early stopping at epoch 500. Best Metrics: (0.00034786899410304856, 6.530912988143881e-05, 0.00015763645954467527)
2026-06-14 21:47:22,011 - optuna.study.study - INFO - Trial 127 finished with values: [0.00034786899410304856, 6.530912988143881e-05, 0.00015763645954467527] and parameters: {'n_layers': 1, 'embedding_dim': 128, 'lr': 0.00125444020622911, 'lambda_val': 2.839715524460245e-05, 'batch_size': 4031, 'optimizer': 'SGD'}.
2026-06-14 21:50:06,068 - experiment_functions - INFO - Early stopping at epoch 3550. Best Metrics: (0.031564294929787094, 0.0032621073079241746, 0.014052640208211824)
2026-06-14 21:50:06,142 - optuna.study.study - INFO - Trial 128 finished with values: [0.031564294929787094, 0.0032621073079241746, 0.014052640208211824] and parameters: {'n_layers': 4, 'embedding_dim': 96, 'lr': 0.017176020213444436, 'lambda_val': 0.00019713152464851107, 'batch_size': 3910, 'optimizer': 'Adam'}.
2026-06-14 21:52:57,887 - optuna.study.study - INFO - Trial 129 finished with values: [0.04448487516047392, 0.005258222251992766, 0.02020561434278551] and parameters: {'n_layers': 2, 'embedding_dim': 128, 'lr': 0.0029187572679997753, 'lambda_val': 0.00020614378723959702, 'batch_size': 1277, 'optimizer': 'RMSprop'}.
2026-06-14 21:55:04,239 - experiment_functions - INFO - Early stopping at epoch 2900. Best Metrics: (0.035569968378765526, 0.004141268671712774, 0.015951923677024107)
2026-06-14 21:55:04,323 - optuna.study.study - INFO - Trial 130 finished with values: [0.035569968378765526, 0.004141268671712774, 0.015951923677024107] and parameters: {'n_layers': 3, 'embedding_dim': 96, 'lr': 0.0029187572679997753, 'lambda_val': 0.00020614378723959702, 'batch_size': 1086, 'optimizer': 'Adam'}.
2026-06-14 21:57:46,757 - optuna.study.study - INFO - Trial 131 finished with values: [0.06152203164321555, 0.007100274633264117, 0.028676272623300032] and parameters: {'n_layers': 1, 'embedding_dim': 128, 'lr': 0.006926802971380086, 'lambda_val': 7.390761978888471e-05, 'batch_size': 1424, 'optimizer': 'RMSprop'}.
2026-06-14 21:58:13,768 - experiment_functions - INFO - Early stopping at epoch 550. Best Metrics: (0.027935442318990072, 0.0031834014334516715, 0.012959225425149863)
2026-06-14 21:58:13,848 - optuna.study.study - INFO - Trial 132 finished with values: [0.027935442318990072, 0.0031834014334516715, 0.012959225425149863] and parameters: {'n_layers': 4, 'embedding_dim': 96, 'lr': 0.043522830313762924, 'lambda_val': 5.3435293915341723e-05, 'batch_size': 3128, 'optimizer': 'RMSprop'}.
2026-06-14 21:58:52,496 - experiment_functions - INFO - Early stopping at epoch 850. Best Metrics: (0.04603174946277412, 0.005298412485765959, 0.020833206505229743)
2026-06-14 21:58:52,580 - optuna.study.study - INFO - Trial 133 finished with values: [0.04603174946277412, 0.005298412485765959, 0.020833206505229743] and parameters: {'n_layers': 2, 'embedding_dim': 128, 'lr': 0.0029187572679997753, 'lambda_val': 0.00020614378723959702, 'batch_size': 913, 'optimizer': 'Adam'}.
2026-06-14 21:59:35,507 - experiment_functions - INFO - Early stopping at epoch 800. Best Metrics: (0.06681073258963063, 0.008185410945140331, 0.03307094586960401)
2026-06-14 21:59:35,586 - optuna.study.study - INFO - Trial 134 finished with values: [0.06681073258963063, 0.008185410945140331, 0.03307094586960401] and parameters: {'n_layers': 2, 'embedding_dim': 256, 'lr': 0.0011776400704232174, 'lambda_val': 1.0100521690584193e-05, 'batch_size': 3878, 'optimizer': 'RMSprop'}.
2026-06-14 22:02:11,446 - optuna.study.study - INFO - Trial 135 finished with values: [0.0012910690774495625, 0.00017415767968383683, 0.0005815356979937472] and parameters: {'n_layers': 1, 'embedding_dim': 128, 'lr': 0.0001717695563766432, 'lambda_val': 7.390761978888471e-05, 'batch_size': 3271, 'optimizer': 'RMSprop'}.
2026-06-14 22:03:13,109 - experiment_functions - INFO - Early stopping at epoch 1450. Best Metrics: (0.09165166641077296, 0.010990354343894433, 0.047614623342247135)
2026-06-14 22:03:13,189 - optuna.study.study - INFO - Trial 136 finished with values: [0.09165166641077296, 0.010990354343894433, 0.047614623342247135] and parameters: {'n_layers': 1, 'embedding_dim': 128, 'lr': 0.0029187572679997753, 'lambda_val': 3.0726659085432114e-06, 'batch_size': 1023, 'optimizer': 'Adam'}.
2026-06-14 22:06:14,573 - optuna.study.study - INFO - Trial 137 finished with values: [0.03500678437511603, 0.004233371290776342, 0.016141592954933285] and parameters: {'n_layers': 4, 'embedding_dim': 96, 'lr': 0.0029187572679997753, 'lambda_val': 0.00012073664489097666, 'batch_size': 913, 'optimizer': 'RMSprop'}.
2026-06-14 22:08:49,252 - optuna.study.study - INFO - Trial 138 finished with values: [0.033405273967745626, 0.005115881840712707, 0.020248716909727273] and parameters: {'n_layers': 1, 'embedding_dim': 96, 'lr': 0.000567654585955759, 'lambda_val': 0.00020576561233050602, 'batch_size': 1424, 'optimizer': 'Adam'}.
2026-06-14 22:11:45,725 - optuna.study.study - INFO - Trial 139 finished with values: [0.0376254722572482, 0.0057120369750150715, 0.02258790592981348] and parameters: {'n_layers': 1, 'embedding_dim': 256, 'lr': 0.0003794262448571181, 'lambda_val': 0.00020614378723959702, 'batch_size': 2141, 'optimizer': 'RMSprop'}.
