2026-06-14 17:11:46,166 - optuna.study.study - INFO - Trial 239 finished with values: [0.015688102932828865, 0.0017934891821287425, 0.006699424528635628] and parameters: {'n_layers': 2, 'embedding_dim': 96, 'lr': 0.012247370054838723, 'lambda_val': 0.017642260778618035, 'batch_size': 3749, 'optimizer': 'RMSprop'}.
2026-06-14 17:12:11,600 - experiment_functions - INFO - Early stopping at epoch 600. Best Metrics: (0.07623358349520332, 0.00945977627436533, 0.03997473513528892)
2026-06-14 17:12:12,129 - optuna.study.study - INFO - Trial 240 finished with values: [0.07623358349520332, 0.00945977627436533, 0.03997473513528892] and parameters: {'n_layers': 1, 'embedding_dim': 64, 'lr': 0.012247370054838723, 'lambda_val': 2.6136942653041923e-05, 'batch_size': 3749, 'optimizer': 'Adam'}.
2026-06-14 17:14:44,572 - optuna.study.study - INFO - Trial 241 finished with values: [0.08570083042211175, 0.010714046486703733, 0.04758223716683068] and parameters: {'n_layers': 1, 'embedding_dim': 32, 'lr': 0.0012088550950310484, 'lambda_val': 1.569122997627705e-05, 'batch_size': 1970, 'optimizer': 'RMSprop'}.
2026-06-14 17:15:09,102 - experiment_functions - INFO - Early stopping at epoch 600. Best Metrics: (0.07116719469536538, 0.008751423404112798, 0.036611171380733665)
2026-06-14 17:15:09,456 - optuna.study.study - INFO - Trial 242 finished with values: [0.07116719469536538, 0.008751423404112798, 0.036611171380733665] and parameters: {'n_layers': 1, 'embedding_dim': 32, 'lr': 0.014831110208259727, 'lambda_val': 8.380696475709368e-06, 'batch_size': 3998, 'optimizer': 'Adam'}.
2026-06-14 17:15:35,470 - experiment_functions - INFO - Early stopping at epoch 600. Best Metrics: (0.0560718513638661, 0.006867506195994374, 0.027465966102062037)
2026-06-14 17:15:35,696 - optuna.study.study - INFO - Trial 243 finished with values: [0.0560718513638661, 0.006867506195994374, 0.027465966102062037] and parameters: {'n_layers': 1, 'embedding_dim': 96, 'lr': 0.014670878875368467, 'lambda_val': 2.113988332261468e-05, 'batch_size': 2310, 'optimizer': 'Adam'}.
2026-06-14 17:16:45,588 - experiment_functions - INFO - Early stopping at epoch 1750. Best Metrics: (0.038267677381576555, 0.004273561524549534, 0.01790177231626967)
2026-06-14 17:16:45,671 - optuna.study.study - INFO - Trial 244 finished with values: [0.038267677381576555, 0.004273561524549534, 0.01790177231626967] and parameters: {'n_layers': 2, 'embedding_dim': 32, 'lr': 0.014831110208259727, 'lambda_val': 5.588502828653658e-06, 'batch_size': 3193, 'optimizer': 'RMSprop'}.
2026-06-14 17:17:51,562 - experiment_functions - INFO - Early stopping at epoch 1700. Best Metrics: (0.00045333082360051423, 7.535668832473711e-05, 0.00020400931323488367)
2026-06-14 17:17:51,642 - optuna.study.study - INFO - Trial 245 finished with values: [0.00045333082360051423, 7.535668832473711e-05, 0.00020400931323488367] and parameters: {'n_layers': 1, 'embedding_dim': 64, 'lr': 3.3213670450099466e-05, 'lambda_val': 0.0004821335138179686, 'batch_size': 2289, 'optimizer': 'Adam'}.
2026-06-14 17:20:56,803 - optuna.study.study - INFO - Trial 246 finished with values: [0.05627153020194474, 0.006396945542233238, 0.027249804911930034] and parameters: {'n_layers': 1, 'embedding_dim': 256, 'lr': 0.010960526947587883, 'lambda_val': 1.1933812384845947e-05, 'batch_size': 3602, 'optimizer': 'RMSprop'}.
2026-06-14 17:23:44,194 - optuna.study.study - INFO - Trial 247 finished with values: [0.09106197265144814, 0.01156473976823632, 0.05117096115754031] and parameters: {'n_layers': 1, 'embedding_dim': 96, 'lr': 0.0009052352884581927, 'lambda_val': 2.113988332261468e-05, 'batch_size': 2310, 'optimizer': 'Adam'}.
2026-06-14 17:26:49,541 - optuna.study.study - INFO - Trial 248 finished with values: [0.05515418664168321, 0.006391921763011588, 0.02678337690449471] and parameters: {'n_layers': 1, 'embedding_dim': 256, 'lr': 0.011158555105257607, 'lambda_val': 1.1933812384845947e-05, 'batch_size': 3521, 'optimizer': 'RMSprop'}.
2026-06-14 17:27:11,164 - experiment_functions - INFO - Early stopping at epoch 500. Best Metrics: (0.00037588529527774665, 6.530912988143882e-05, 0.00016301649109900563)
2026-06-14 17:27:11,241 - optuna.study.study - INFO - Trial 249 finished with values: [0.00037588529527774665, 6.530912988143882e-05, 0.00016301649109900563] and parameters: {'n_layers': 1, 'embedding_dim': 96, 'lr': 7.044902875034025e-05, 'lambda_val': 5.588502828653658e-06, 'batch_size': 1311, 'optimizer': 'Adam'}.
2026-06-14 17:27:49,041 - experiment_functions - INFO - Early stopping at epoch 800. Best Metrics: (0.043334692759808995, 0.004914930671846741, 0.02136588278920825)
2026-06-14 17:27:50,309 - optuna.study.study - INFO - Trial 250 finished with values: [0.043334692759808995, 0.004914930671846741, 0.02136588278920825] and parameters: {'n_layers': 2, 'embedding_dim': 96, 'lr': 0.020233494560457786, 'lambda_val': 2.113988332261468e-05, 'batch_size': 1418, 'optimizer': 'RMSprop'}.
2026-06-14 17:30:24,474 - optuna.study.study - INFO - Trial 251 finished with values: [0.05201167381589663, 0.007244289637618059, 0.03055072733556775] and parameters: {'n_layers': 1, 'embedding_dim': 32, 'lr': 0.0009052352884581927, 'lambda_val': 0.00019765543294629712, 'batch_size': 1067, 'optimizer': 'Adam'}.
2026-06-14 17:33:35,328 - optuna.study.study - INFO - Trial 252 finished with values: [0.11058902432117974, 0.013410141335655434, 0.05900366001070952] and parameters: {'n_layers': 1, 'embedding_dim': 256, 'lr': 0.0009052352884581927, 'lambda_val': 2.113988332261468e-05, 'batch_size': 3521, 'optimizer': 'RMSprop'}.
2026-06-14 17:34:12,004 - experiment_functions - INFO - Early stopping at epoch 700. Best Metrics: (0.028602031728372137, 0.0034228682430169476, 0.013272072635947303)
2026-06-14 17:34:12,254 - optuna.study.study - INFO - Trial 253 finished with values: [0.028602031728372137, 0.0034228682430169476, 0.013272072635947303] and parameters: {'n_layers': 4, 'embedding_dim': 128, 'lr': 0.0026515351587830605, 'lambda_val': 0.0004821335138179686, 'batch_size': 3526, 'optimizer': 'RMSprop'}.
2026-06-14 17:34:33,884 - experiment_functions - INFO - Early stopping at epoch 500. Best Metrics: (0.0005396449852546107, 7.87058744725032e-05, 0.0003116051426914186)
2026-06-14 17:34:33,972 - optuna.study.study - INFO - Trial 254 finished with values: [0.0005396449852546107, 7.87058744725032e-05, 0.0003116051426914186] and parameters: {'n_layers': 1, 'embedding_dim': 96, 'lr': 0.0006166288088568304, 'lambda_val': 0.0538861476809243, 'batch_size': 1418, 'optimizer': 'Adam'}.
2026-06-14 17:35:11,480 - experiment_functions - INFO - Early stopping at epoch 900. Best Metrics: (0.07971900863914383, 0.009727711166186618, 0.04199129180240619)
2026-06-14 17:35:11,556 - optuna.study.study - INFO - Trial 255 finished with values: [0.07971900863914383, 0.009727711166186618, 0.04199129180240619] and parameters: {'n_layers': 1, 'embedding_dim': 32, 'lr': 0.0026515351587830605, 'lambda_val': 0.00019765543294629712, 'batch_size': 4088, 'optimizer': 'RMSprop'}.
2026-06-14 17:35:42,324 - experiment_functions - INFO - Early stopping at epoch 700. Best Metrics: (0.0842644223717506, 0.010275303101346374, 0.04317051133745605)
2026-06-14 17:35:42,443 - optuna.study.study - INFO - Trial 256 finished with values: [0.0842644223717506, 0.010275303101346374, 0.04317051133745605] and parameters: {'n_layers': 1, 'embedding_dim': 96, 'lr': 0.006265835000649171, 'lambda_val': 0.00019765543294629712, 'batch_size': 2310, 'optimizer': 'Adam'}.
2026-06-14 17:36:42,134 - experiment_functions - INFO - Early stopping at epoch 1400. Best Metrics: (0.09104209549575391, 0.011079107776810235, 0.048186522622410674)
2026-06-14 17:36:42,215 - optuna.study.study - INFO - Trial 257 finished with values: [0.09104209549575391, 0.011079107776810235, 0.048186522622410674] and parameters: {'n_layers': 1, 'embedding_dim': 96, 'lr': 0.001866327471651579, 'lambda_val': 5.588502828653658e-06, 'batch_size': 1957, 'optimizer': 'RMSprop'}.
2026-06-14 17:39:17,159 - experiment_functions - INFO - Early stopping at epoch 3250. Best Metrics: (0.1091308897926509, 0.013209190166789472, 0.05869179814903668)
2026-06-14 17:39:17,232 - optuna.study.study - INFO - Trial 258 finished with values: [0.1091308897926509, 0.013209190166789472, 0.05869179814903668] and parameters: {'n_layers': 1, 'embedding_dim': 256, 'lr': 0.0009052352884581927, 'lambda_val': 5.9543267651607335e-05, 'batch_size': 3521, 'optimizer': 'RMSprop'}.
2026-06-14 17:39:38,982 - experiment_functions - INFO - Early stopping at epoch 500. Best Metrics: (0.00032944826221040165, 7.033290910308795e-05, 0.0001843056237676085)
2026-06-14 17:39:39,066 - optuna.study.study - INFO - Trial 259 finished with values: [0.00032944826221040165, 7.033290910308795e-05, 0.0001843056237676085] and parameters: {'n_layers': 2, 'embedding_dim': 64, 'lr': 0.0026515351587830605, 'lambda_val': 0.05303428633465467, 'batch_size': 1656, 'optimizer': 'SGD'}.
2026-06-14 17:42:25,407 - optuna.study.study - INFO - Trial 260 finished with values: [0.0911663553100188, 0.011464264183803335, 0.05135411063216168] and parameters: {'n_layers': 1, 'embedding_dim': 96, 'lr': 0.0009052352884581927, 'lambda_val': 2.113988332261468e-05, 'batch_size': 1970, 'optimizer': 'RMSprop'}.
2026-06-14 17:43:29,573 - experiment_functions - INFO - Early stopping at epoch 1500. Best Metrics: (0.09206794068755977, 0.011136043941322256, 0.04941728058092378)
2026-06-14 17:43:29,659 - optuna.study.study - INFO - Trial 261 finished with values: [0.09206794068755977, 0.011136043941322256, 0.04941728058092378] and parameters: {'n_layers': 1, 'embedding_dim': 96, 'lr': 0.001866327471651579, 'lambda_val': 5.588502828653658e-06, 'batch_size': 2310, 'optimizer': 'RMSprop'}.
2026-06-14 17:46:16,928 - optuna.study.study - INFO - Trial 262 finished with values: [0.09519537096279468, 0.011971665885189898, 0.05252978924283348] and parameters: {'n_layers': 1, 'embedding_dim': 96, 'lr': 0.0009052352884581927, 'lambda_val': 2.113988332261468e-05, 'batch_size': 2310, 'optimizer': 'RMSprop'}.
2026-06-14 17:47:18,798 - experiment_functions - INFO - Early stopping at epoch 1300. Best Metrics: (0.06411764045274813, 0.008394735079375713, 0.03238107339140689)
2026-06-14 17:47:18,893 - optuna.study.study - INFO - Trial 263 finished with values: [0.06411764045274813, 0.008394735079375713, 0.03238107339140689] and parameters: {'n_layers': 1, 'embedding_dim': 256, 'lr': 0.0009052352884581927, 'lambda_val': 0.012150219221367786, 'batch_size': 2310, 'optimizer': 'RMSprop'}.
2026-06-14 17:49:55,866 - optuna.study.study - INFO - Trial 264 finished with values: [0.06910568814071912, 0.009128206845736486, 0.03883744802453768] and parameters: {'n_layers': 1, 'embedding_dim': 32, 'lr': 0.0007227490490114654, 'lambda_val': 0.0009668484743513772, 'batch_size': 2843, 'optimizer': 'RMSprop'}.
2026-06-14 17:50:58,236 - experiment_functions - INFO - Early stopping at epoch 1450. Best Metrics: (0.09361141944743745, 0.01114274231361779, 0.0483617242636273)
2026-06-14 17:50:58,383 - optuna.study.study - INFO - Trial 265 finished with values: [0.09361141944743745, 0.01114274231361779, 0.0483617242636273] and parameters: {'n_layers': 1, 'embedding_dim': 96, 'lr': 0.001866327471651579, 'lambda_val': 0.00010850731668799077, 'batch_size': 2310, 'optimizer': 'RMSprop'}.
2026-06-14 17:52:57,580 - experiment_functions - INFO - Early stopping at epoch 3000. Best Metrics: (0.06351317752554984, 0.007992832741643781, 0.03293086745494827)
2026-06-14 17:52:57,659 - optuna.study.study - INFO - Trial 266 finished with values: [0.06351317752554984, 0.007992832741643781, 0.03293086745494827] and parameters: {'n_layers': 2, 'embedding_dim': 32, 'lr': 0.0009052352884581927, 'lambda_val': 0.0038929949351803645, 'batch_size': 1067, 'optimizer': 'Adam'}.
2026-06-14 17:54:37,047 - experiment_functions - INFO - Early stopping at epoch 2450. Best Metrics: (0.08167041195987833, 0.010225065309129882, 0.04220026251875548)
2026-06-14 17:54:37,376 - optuna.study.study - INFO - Trial 267 finished with values: [0.08167041195987833, 0.010225065309129882, 0.04220026251875548] and parameters: {'n_layers': 1, 'embedding_dim': 64, 'lr': 0.0009052352884581927, 'lambda_val': 0.0036620980884206223, 'batch_size': 3591, 'optimizer': 'Adam'}.
2026-06-14 17:56:34,170 - experiment_functions - INFO - Early stopping at epoch 2450. Best Metrics: (0.10677619597515539, 0.012906088820416637, 0.0574444912763088)
2026-06-14 17:56:34,282 - optuna.study.study - INFO - Trial 268 finished with values: [0.10677619597515539, 0.012906088820416637, 0.0574444912763088] and parameters: {'n_layers': 1, 'embedding_dim': 256, 'lr': 0.0009052352884581927, 'lambda_val': 1.2588658448852132e-05, 'batch_size': 3231, 'optimizer': 'RMSprop'}.
2026-06-14 17:59:20,732 - optuna.study.study - INFO - Trial 269 finished with values: [0.09562710288889027, 0.012038649608145222, 0.05334785088604854] and parameters: {'n_layers': 1, 'embedding_dim': 96, 'lr': 0.0009052352884581927, 'lambda_val': 2.113988332261468e-05, 'batch_size': 2310, 'optimizer': 'Adam'}.
2026-06-14 18:00:00,868 - experiment_functions - INFO - Early stopping at epoch 900. Best Metrics: (0.08472338028629407, 0.010508071538616116, 0.044397130080429115)
2026-06-14 18:00:00,947 - optuna.study.study - INFO - Trial 270 finished with values: [0.08472338028629407, 0.010508071538616116, 0.044397130080429115] and parameters: {'n_layers': 1, 'embedding_dim': 128, 'lr': 0.001866327471651579, 'lambda_val': 0.00038277795713177477, 'batch_size': 3345, 'optimizer': 'RMSprop'}.
2026-06-14 18:02:45,043 - optuna.study.study - INFO - Trial 271 finished with values: [0.07821641886702542, 0.010313818742045682, 0.04498355886100815] and parameters: {'n_layers': 1, 'embedding_dim': 96, 'lr': 0.0009052352884581927, 'lambda_val': 1.1933812384845947e-05, 'batch_size': 1318, 'optimizer': 'Adam'}.
2026-06-14 18:05:22,317 - optuna.study.study - INFO - Trial 272 finished with values: [0.07433629879295482, 0.009757853841516513, 0.04243858521491549] and parameters: {'n_layers': 1, 'embedding_dim': 32, 'lr': 0.0009052352884581927, 'lambda_val': 6.002093478340612e-05, 'batch_size': 2372, 'optimizer': 'Adam'}.
2026-06-14 18:07:57,097 - optuna.study.study - INFO - Trial 273 finished with values: [0.059679712469951, 0.00814689530444102, 0.03426094676418268] and parameters: {'n_layers': 1, 'embedding_dim': 32, 'lr': 0.0009052352884581927, 'lambda_val': 8.380696475709368e-06, 'batch_size': 1067, 'optimizer': 'RMSprop'}.
2026-06-14 18:09:09,015 - experiment_functions - INFO - Early stopping at epoch 1750. Best Metrics: (0.03383492577935974, 0.004221649139259161, 0.016490218400372327)
2026-06-14 18:09:09,089 - optuna.study.study - INFO - Trial 274 finished with values: [0.03383492577935974, 0.004221649139259161, 0.016490218400372327] and parameters: {'n_layers': 4, 'embedding_dim': 32, 'lr': 0.001483277802508331, 'lambda_val': 1.3108307538224754e-05, 'batch_size': 1418, 'optimizer': 'RMSprop'}.
2026-06-14 18:11:47,270 - optuna.study.study - INFO - Trial 275 finished with values: [0.08855397296248352, 0.01106571103221917, 0.04803392318138673] and parameters: {'n_layers': 1, 'embedding_dim': 32, 'lr': 0.0012088550950310484, 'lambda_val': 0.0009668484743513772, 'batch_size': 2289, 'optimizer': 'Adam'}.
2026-06-14 18:14:11,601 - experiment_functions - INFO - Early stopping at epoch 2500. Best Metrics: (0.05922691726922018, 0.00708520329559917, 0.029327767778344418)
2026-06-14 18:14:11,690 - optuna.study.study - INFO - Trial 276 finished with values: [0.05922691726922018, 0.00708520329559917, 0.029327767778344418] and parameters: {'n_layers': 3, 'embedding_dim': 256, 'lr': 0.0009052352884581927, 'lambda_val': 1.2588658448852132e-05, 'batch_size': 1878, 'optimizer': 'RMSprop'}.
2026-06-14 18:16:58,884 - optuna.study.study - INFO - Trial 277 finished with values: [0.08972600893543188, 0.011221448188090295, 0.047503927286519296] and parameters: {'n_layers': 1, 'embedding_dim': 96, 'lr': 0.0009052352884581927, 'lambda_val': 0.0012475482978031329, 'batch_size': 2310, 'optimizer': 'RMSprop'}.
2026-06-14 18:17:38,541 - experiment_functions - INFO - Early stopping at epoch 900. Best Metrics: (0.08344496327550675, 0.010308794962824035, 0.043998097444499354)
2026-06-14 18:17:38,701 - optuna.study.study - INFO - Trial 278 finished with values: [0.08344496327550675, 0.010308794962824035, 0.043998097444499354] and parameters: {'n_layers': 1, 'embedding_dim': 96, 'lr': 0.001866327471651579, 'lambda_val': 0.0009668484743513772, 'batch_size': 2843, 'optimizer': 'RMSprop'}.
2026-06-14 18:20:25,926 - optuna.study.study - INFO - Trial 279 finished with values: [0.09476966210299428, 0.01178578605398888, 0.05036222091446181] and parameters: {'n_layers': 1, 'embedding_dim': 96, 'lr': 0.0007227490490114654, 'lambda_val': 0.0009668484743513772, 'batch_size': 3521, 'optimizer': 'RMSprop'}.
2026-06-14 18:20:51,760 - experiment_functions - INFO - Early stopping at epoch 600. Best Metrics: (0.05680425685138634, 0.007034965503382678, 0.028040097427385977)
2026-06-14 18:20:51,836 - optuna.study.study - INFO - Trial 280 finished with values: [0.05680425685138634, 0.007034965503382678, 0.028040097427385977] and parameters: {'n_layers': 2, 'embedding_dim': 32, 'lr': 0.0059087621734932, 'lambda_val': 0.00013135402066123192, 'batch_size': 2822, 'optimizer': 'Adam'}.
2026-06-14 18:23:28,501 - optuna.study.study - INFO - Trial 281 finished with values: [0.0009030366024990943, 0.00011722151517181324, 0.0003720598106239029] and parameters: {'n_layers': 1, 'embedding_dim': 96, 'lr': 0.00010825967869696124, 'lambda_val': 0.00015974311639523663, 'batch_size': 3185, 'optimizer': 'Adam'}.
2026-06-14 18:24:20,608 - experiment_functions - INFO - Early stopping at epoch 1100. Best Metrics: (0.05116458718010851, 0.00677707817000469, 0.025030438037292494)
2026-06-14 18:24:20,700 - optuna.study.study - INFO - Trial 282 finished with values: [0.05116458718010851, 0.00677707817000469, 0.025030438037292494] and parameters: {'n_layers': 1, 'embedding_dim': 256, 'lr': 0.0009052352884581927, 'lambda_val': 0.024035538021527914, 'batch_size': 3521, 'optimizer': 'RMSprop'}.
2026-06-14 18:27:04,259 - optuna.study.study - INFO - Trial 283 finished with values: [0.09323481025086432, 0.011636747270413288, 0.05171257220957323] and parameters: {'n_layers': 1, 'embedding_dim': 64, 'lr': 0.0009052352884581927, 'lambda_val': 1.2588658448852132e-05, 'batch_size': 2851, 'optimizer': 'RMSprop'}.
2026-06-14 18:29:49,086 - optuna.study.study - INFO - Trial 284 finished with values: [0.09321491928374866, 0.011688659655703664, 0.05197889759970142] and parameters: {'n_layers': 1, 'embedding_dim': 96, 'lr': 0.0007227490490114654, 'lambda_val': 2.113988332261468e-05, 'batch_size': 3602, 'optimizer': 'Adam'}.
2026-06-14 18:30:31,740 - experiment_functions - INFO - Early stopping at epoch 900. Best Metrics: (0.07577066968187915, 0.009339205573045751, 0.03836800716113998)
2026-06-14 18:30:31,815 - optuna.study.study - INFO - Trial 285 finished with values: [0.07577066968187915, 0.009339205573045751, 0.03836800716113998] and parameters: {'n_layers': 2, 'embedding_dim': 128, 'lr': 0.001483277802508331, 'lambda_val': 5.9543267651607335e-05, 'batch_size': 3602, 'optimizer': 'Adam'}.
2026-06-14 18:30:52,286 - experiment_functions - INFO - Early stopping at epoch 500. Best Metrics: (0.0005242228917340565, 8.707883984191843e-05, 0.00025860512573738147)
2026-06-14 18:30:52,373 - optuna.study.study - INFO - Trial 286 finished with values: [0.0005242228917340565, 8.707883984191843e-05, 0.00025860512573738147] and parameters: {'n_layers': 1, 'embedding_dim': 32, 'lr': 0.0026515351587830605, 'lambda_val': 0.0004821335138179686, 'batch_size': 2289, 'optimizer': 'SGD'}.
2026-06-14 18:31:36,730 - experiment_functions - INFO - Early stopping at epoch 1050. Best Metrics: (0.08188723875178593, 0.010071002746332642, 0.04328729784932771)
2026-06-14 18:31:36,816 - optuna.study.study - INFO - Trial 287 finished with values: [0.08188723875178593, 0.010071002746332642, 0.04328729784932771] and parameters: {'n_layers': 1, 'embedding_dim': 64, 'lr': 0.0026515351587830605, 'lambda_val': 2.113988332261468e-05, 'batch_size': 2372, 'optimizer': 'RMSprop'}.
2026-06-14 18:34:23,507 - optuna.study.study - INFO - Trial 288 finished with values: [0.10276274007754672, 0.012335052582222521, 0.05493022383583207] and parameters: {'n_layers': 1, 'embedding_dim': 96, 'lr': 0.001866327471651579, 'lambda_val': 5.9543267651607335e-05, 'batch_size': 1532, 'optimizer': 'Adam'}.
2026-06-14 18:34:56,175 - experiment_functions - INFO - Early stopping at epoch 650. Best Metrics: (0.08548880018441561, 0.010541563400093778, 0.044439601293409535)
2026-06-14 18:34:56,254 - optuna.study.study - INFO - Trial 289 finished with values: [0.08548880018441561, 0.010541563400093778, 0.044439601293409535] and parameters: {'n_layers': 1, 'embedding_dim': 256, 'lr': 0.006265835000649171, 'lambda_val': 8.380696475709368e-06, 'batch_size': 4036, 'optimizer': 'Adam'}.
2026-06-14 18:35:35,580 - experiment_functions - INFO - Early stopping at epoch 650. Best Metrics: (0.05124690118322825, 0.006363453680755577, 0.025210209579642352)
2026-06-14 18:35:35,657 - optuna.study.study - INFO - Trial 290 finished with values: [0.05124690118322825, 0.006363453680755577, 0.025210209579642352] and parameters: {'n_layers': 3, 'embedding_dim': 256, 'lr': 0.001866327471651579, 'lambda_val': 5.9543267651607335e-05, 'batch_size': 2310, 'optimizer': 'Adam'}.
2026-06-14 18:38:21,840 - optuna.study.study - INFO - Trial 291 finished with values: [0.09976385248002857, 0.012196061357090227, 0.05503338998771728] and parameters: {'n_layers': 1, 'embedding_dim': 96, 'lr': 0.001483277802508331, 'lambda_val': 5.9543267651607335e-05, 'batch_size': 1532, 'optimizer': 'Adam'}.
2026-06-14 18:38:43,227 - experiment_functions - INFO - Early stopping at epoch 500. Best Metrics: (0.0005491640285902156, 6.698372295532187e-05, 0.00024310639018896828)
