2026-06-15 17:53:19,794 - optuna.study.study - INFO - Trial 79 finished with values: [0.000478457209455006, 7.033290910308795e-05, 0.00021279635117110954] and parameters: {'n_layers': 4, 'embedding_dim': 128, 'lr': 0.0002845041667420409, 'lambda_val': 1.0702432018798528e-05, 'batch_size': 3109, 'optimizer': 'SGD'}.
2026-06-15 17:53:50,271 - experiment_functions - INFO - Early stopping at epoch 550. Best Metrics: (0.035910302837043016, 0.004164712974747137, 0.016766452780343485)
2026-06-15 17:53:50,608 - optuna.study.study - INFO - Trial 80 finished with values: [0.035910302837043016, 0.004164712974747137, 0.016766452780343485] and parameters: {'n_layers': 2, 'embedding_dim': 256, 'lr': 0.02606777968777775, 'lambda_val': 6.461965909578869e-06, 'batch_size': 2936, 'optimizer': 'Adam'}.
2026-06-15 17:54:33,075 - experiment_functions - INFO - Early stopping at epoch 1000. Best Metrics: (0.0243584692504863, 0.003104695558979168, 0.011673599169747653)
2026-06-15 17:54:33,162 - optuna.study.study - INFO - Trial 81 finished with values: [0.0243584692504863, 0.003104695558979168, 0.011673599169747653] and parameters: {'n_layers': 2, 'embedding_dim': 64, 'lr': 0.0010587621938481125, 'lambda_val': 0.0418988089223974, 'batch_size': 4004, 'optimizer': 'Adam'}.
2026-06-15 17:55:01,124 - experiment_functions - INFO - Early stopping at epoch 550. Best Metrics: (0.02458242761948336, 0.0028166655502712837, 0.011314025210855477)
2026-06-15 17:55:01,205 - optuna.study.study - INFO - Trial 82 finished with values: [0.02458242761948336, 0.0028166655502712837, 0.011314025210855477] and parameters: {'n_layers': 3, 'embedding_dim': 128, 'lr': 0.00859558839759563, 'lambda_val': 0.0021104984649676414, 'batch_size': 2936, 'optimizer': 'RMSprop'}.
2026-06-15 17:56:05,712 - experiment_functions - INFO - Early stopping at epoch 1000. Best Metrics: (0.04285774784087613, 0.005300087078839843, 0.020174541148030793)
2026-06-15 17:56:06,051 - optuna.study.study - INFO - Trial 83 finished with values: [0.04285774784087613, 0.005300087078839843, 0.020174541148030793] and parameters: {'n_layers': 4, 'embedding_dim': 256, 'lr': 0.0008257854890964482, 'lambda_val': 6.852585789077327e-05, 'batch_size': 3109, 'optimizer': 'RMSprop'}.
2026-06-15 17:56:35,459 - experiment_functions - INFO - Early stopping at epoch 700. Best Metrics: (0.0006014986698555592, 8.540424676803538e-05, 0.0003775813824165727)
2026-06-15 17:56:35,561 - optuna.study.study - INFO - Trial 84 finished with values: [0.0006014986698555592, 8.540424676803538e-05, 0.0003775813824165727] and parameters: {'n_layers': 2, 'embedding_dim': 64, 'lr': 1.0952121952475175e-05, 'lambda_val': 8.19246360027129e-06, 'batch_size': 3167, 'optimizer': 'Adam'}.
2026-06-15 17:56:57,401 - experiment_functions - INFO - Early stopping at epoch 500. Best Metrics: (0.0006129203329724392, 7.87058744725032e-05, 0.0002452581095530172)
2026-06-15 17:56:57,483 - optuna.study.study - INFO - Trial 85 finished with values: [0.0006129203329724392, 7.87058744725032e-05, 0.0002452581095530172] and parameters: {'n_layers': 4, 'embedding_dim': 32, 'lr': 0.0024881813926483014, 'lambda_val': 2.0623181656245837e-06, 'batch_size': 1638, 'optimizer': 'SGD'}.
2026-06-15 18:00:16,114 - optuna.study.study - INFO - Trial 86 finished with values: [0.03758736842404776, 0.00471063031683301, 0.01763637713735304] and parameters: {'n_layers': 4, 'embedding_dim': 128, 'lr': 0.00035731579910584327, 'lambda_val': 0.005862469300114216, 'batch_size': 1545, 'optimizer': 'Adam'}.
2026-06-15 18:00:44,228 - experiment_functions - INFO - Early stopping at epoch 550. Best Metrics: (0.026313442442028368, 0.0033575591131355088, 0.01262557311616562)
2026-06-15 18:00:44,318 - optuna.study.study - INFO - Trial 87 finished with values: [0.026313442442028368, 0.0033575591131355088, 0.01262557311616562] and parameters: {'n_layers': 3, 'embedding_dim': 128, 'lr': 0.00859558839759563, 'lambda_val': 0.0002091155632832413, 'batch_size': 582, 'optimizer': 'Adam'}.
2026-06-15 18:01:11,994 - experiment_functions - INFO - Early stopping at epoch 500. Best Metrics: (0.00046041654431661246, 5.861075758590662e-05, 0.00020234497667643656)
2026-06-15 18:01:12,080 - optuna.study.study - INFO - Trial 88 finished with values: [0.00046041654431661246, 5.861075758590662e-05, 0.00020234497667643656] and parameters: {'n_layers': 3, 'embedding_dim': 128, 'lr': 1.0018834194534063e-05, 'lambda_val': 0.005862469300114216, 'batch_size': 907, 'optimizer': 'RMSprop'}.
2026-06-15 18:01:32,844 - experiment_functions - INFO - Early stopping at epoch 500. Best Metrics: (0.0005482411754040123, 7.703128139862015e-05, 0.00024201312719006985)
2026-06-15 18:01:33,447 - optuna.study.study - INFO - Trial 89 finished with values: [0.0005482411754040123, 7.703128139862015e-05, 0.00024201312719006985] and parameters: {'n_layers': 2, 'embedding_dim': 32, 'lr': 0.0008007729293904306, 'lambda_val': 0.004749408595262452, 'batch_size': 3620, 'optimizer': 'SGD'}.
2026-06-15 18:03:42,691 - experiment_functions - INFO - Early stopping at epoch 2300. Best Metrics: (0.0004993791757531101, 8.372965369415234e-05, 0.00023825853743952104)
2026-06-15 18:03:42,855 - optuna.study.study - INFO - Trial 90 finished with values: [0.0004993791757531101, 8.372965369415234e-05, 0.00023825853743952104] and parameters: {'n_layers': 3, 'embedding_dim': 256, 'lr': 7.445043075169628e-05, 'lambda_val': 0.0008165334635403181, 'batch_size': 603, 'optimizer': 'RMSprop'}.
2026-06-15 18:04:05,323 - experiment_functions - INFO - Early stopping at epoch 500. Best Metrics: (0.0005496623805331324, 9.545180521133365e-05, 0.0003067009607902216)
2026-06-15 18:04:05,403 - optuna.study.study - INFO - Trial 91 finished with values: [0.0005496623805331324, 9.545180521133365e-05, 0.0003067009607902216] and parameters: {'n_layers': 3, 'embedding_dim': 64, 'lr': 0.012090903971489965, 'lambda_val': 0.017225145941065806, 'batch_size': 1851, 'optimizer': 'SGD'}.
2026-06-15 18:05:15,697 - experiment_functions - INFO - Early stopping at epoch 1200. Best Metrics: (0.03547707932268985, 0.004127871927121709, 0.01574480334517641)
2026-06-15 18:05:15,789 - optuna.study.study - INFO - Trial 92 finished with values: [0.03547707932268985, 0.004127871927121709, 0.01574480334517641] and parameters: {'n_layers': 3, 'embedding_dim': 256, 'lr': 0.0019710220966942236, 'lambda_val': 0.0005662460656125812, 'batch_size': 2933, 'optimizer': 'RMSprop'}.
2026-06-15 18:09:28,364 - optuna.study.study - INFO - Trial 93 finished with values: [0.05443648622626381, 0.0068624824167727244, 0.026951224340172494] and parameters: {'n_layers': 4, 'embedding_dim': 256, 'lr': 0.00017992734758911743, 'lambda_val': 0.001319855427866883, 'batch_size': 2539, 'optimizer': 'RMSprop'}.
2026-06-15 18:09:53,772 - experiment_functions - INFO - Early stopping at epoch 550. Best Metrics: (0.02522775122105521, 0.0031147431174224664, 0.012924191859083316)
2026-06-15 18:09:53,842 - optuna.study.study - INFO - Trial 94 finished with values: [0.02522775122105521, 0.0031147431174224664, 0.012924191859083316] and parameters: {'n_layers': 2, 'embedding_dim': 96, 'lr': 0.03825461568875802, 'lambda_val': 7.673494845521761e-06, 'batch_size': 1003, 'optimizer': 'RMSprop'}.
2026-06-15 18:10:46,626 - experiment_functions - INFO - Early stopping at epoch 800. Best Metrics: (0.04701421305607601, 0.0057572509880099145, 0.022707197627249855)
2026-06-15 18:10:46,706 - optuna.study.study - INFO - Trial 95 finished with values: [0.04701421305607601, 0.0057572509880099145, 0.022707197627249855] and parameters: {'n_layers': 4, 'embedding_dim': 256, 'lr': 0.0010587621938481125, 'lambda_val': 6.852585789077327e-05, 'batch_size': 4004, 'optimizer': 'Adam'}.
2026-06-15 18:11:10,273 - experiment_functions - INFO - Early stopping at epoch 500. Best Metrics: (0.0005823342745849215, 8.372965369415234e-05, 0.00029536742479925154)
2026-06-15 18:11:10,347 - optuna.study.study - INFO - Trial 96 finished with values: [0.0005823342745849215, 8.372965369415234e-05, 0.00029536742479925154] and parameters: {'n_layers': 2, 'embedding_dim': 128, 'lr': 0.00311600732165254, 'lambda_val': 9.225379252713017e-05, 'batch_size': 3237, 'optimizer': 'SGD'}.
2026-06-15 18:13:51,684 - optuna.study.study - INFO - Trial 97 finished with values: [0.07714808292575924, 0.00951336325272959, 0.04149889956508836] and parameters: {'n_layers': 2, 'embedding_dim': 32, 'lr': 0.0008007729293904306, 'lambda_val': 2.0623181656245837e-06, 'batch_size': 2005, 'optimizer': 'Adam'}.
2026-06-15 18:15:40,121 - experiment_functions - INFO - Early stopping at epoch 2700. Best Metrics: (0.03427347628778544, 0.004332172282135441, 0.01662172102035142)
2026-06-15 18:15:40,232 - optuna.study.study - INFO - Trial 98 finished with values: [0.03427347628778544, 0.004332172282135441, 0.01662172102035142] and parameters: {'n_layers': 3, 'embedding_dim': 32, 'lr': 0.0008007729293904306, 'lambda_val': 0.004749408595262452, 'batch_size': 2005, 'optimizer': 'RMSprop'}.
2026-06-15 18:16:07,064 - experiment_functions - INFO - Early stopping at epoch 600. Best Metrics: (0.0003616839387248886, 7.703128139862015e-05, 0.00019251654999484098)
2026-06-15 18:16:07,153 - optuna.study.study - INFO - Trial 99 finished with values: [0.0003616839387248886, 7.703128139862015e-05, 0.00019251654999484098] and parameters: {'n_layers': 3, 'embedding_dim': 64, 'lr': 3.1923012936711204e-05, 'lambda_val': 0.0001666403059897094, 'batch_size': 2189, 'optimizer': 'Adam'}.
2026-06-15 18:16:56,964 - experiment_functions - INFO - Early stopping at epoch 1200. Best Metrics: (0.06972617392782289, 0.008676066715788064, 0.03617411612064043)
2026-06-15 18:16:57,377 - optuna.study.study - INFO - Trial 100 finished with values: [0.06972617392782289, 0.008676066715788064, 0.03617411612064043] and parameters: {'n_layers': 2, 'embedding_dim': 32, 'lr': 0.001479782641411582, 'lambda_val': 0.00041942469140426685, 'batch_size': 1650, 'optimizer': 'Adam'}.
2026-06-15 18:19:47,487 - optuna.study.study - INFO - Trial 101 finished with values: [0.08071605978134141, 0.01053151584165048, 0.04579642862233556] and parameters: {'n_layers': 1, 'embedding_dim': 128, 'lr': 0.0008007729293904306, 'lambda_val': 2.0623181656245837e-06, 'batch_size': 1545, 'optimizer': 'Adam'}.
2026-06-15 18:20:08,824 - experiment_functions - INFO - Early stopping at epoch 500. Best Metrics: (0.00036444997231701806, 6.195994373367272e-05, 0.00017857218035017416)
2026-06-15 18:20:08,905 - optuna.study.study - INFO - Trial 102 finished with values: [0.00036444997231701806, 6.195994373367272e-05, 0.00017857218035017416] and parameters: {'n_layers': 3, 'embedding_dim': 32, 'lr': 0.02606777968777775, 'lambda_val': 0.005463270877339436, 'batch_size': 748, 'optimizer': 'SGD'}.
2026-06-15 18:21:07,806 - experiment_functions - INFO - Early stopping at epoch 1200. Best Metrics: (0.05074173923980613, 0.0061892960010717386, 0.02439516633658171)
2026-06-15 18:21:07,877 - optuna.study.study - INFO - Trial 103 finished with values: [0.05074173923980613, 0.0061892960010717386, 0.02439516633658171] and parameters: {'n_layers': 3, 'embedding_dim': 128, 'lr': 0.0012012771091778557, 'lambda_val': 4.411051153283134e-06, 'batch_size': 2009, 'optimizer': 'RMSprop'}.
2026-06-15 18:21:38,399 - experiment_functions - INFO - Early stopping at epoch 550. Best Metrics: (0.036447648833891004, 0.004146292450934424, 0.01718551425964196)
2026-06-15 18:21:38,472 - optuna.study.study - INFO - Trial 104 finished with values: [0.036447648833891004, 0.004146292450934424, 0.01718551425964196] and parameters: {'n_layers': 2, 'embedding_dim': 256, 'lr': 0.03825461568875802, 'lambda_val': 7.673494845521761e-06, 'batch_size': 2936, 'optimizer': 'Adam'}.
2026-06-15 18:22:09,304 - experiment_functions - INFO - Early stopping at epoch 550. Best Metrics: (0.03658591979996474, 0.004196530243150914, 0.017338653917754326)
2026-06-15 18:22:09,387 - optuna.study.study - INFO - Trial 105 finished with values: [0.03658591979996474, 0.004196530243150914, 0.017338653917754326] and parameters: {'n_layers': 2, 'embedding_dim': 256, 'lr': 0.02606777968777775, 'lambda_val': 1.0030725893466965e-06, 'batch_size': 2933, 'optimizer': 'Adam'}.
2026-06-15 18:24:38,199 - optuna.study.study - INFO - Trial 106 finished with values: [0.0015388208170019116, 0.00022941925112197737, 0.0006428320397325082] and parameters: {'n_layers': 1, 'embedding_dim': 32, 'lr': 0.00035731579910584327, 'lambda_val': 0.0021104984649676414, 'batch_size': 1545, 'optimizer': 'Adam'}.
2026-06-15 18:25:11,385 - experiment_functions - INFO - Early stopping at epoch 700. Best Metrics: (0.028493435162449808, 0.003566883247370889, 0.013032658414921712)
2026-06-15 18:25:12,193 - optuna.study.study - INFO - Trial 107 finished with values: [0.028493435162449808, 0.003566883247370889, 0.013032658414921712] and parameters: {'n_layers': 3, 'embedding_dim': 96, 'lr': 0.0013130193047400018, 'lambda_val': 0.005442003982181833, 'batch_size': 3109, 'optimizer': 'RMSprop'}.
2026-06-15 18:25:39,164 - experiment_functions - INFO - Early stopping at epoch 500. Best Metrics: (0.0006714889903650035, 9.210261906356756e-05, 0.00028322442242732174)
2026-06-15 18:25:39,256 - optuna.study.study - INFO - Trial 108 finished with values: [0.0006714889903650035, 9.210261906356756e-05, 0.00028322442242732174] and parameters: {'n_layers': 2, 'embedding_dim': 256, 'lr': 0.0036742654809996723, 'lambda_val': 2.0623181656245837e-06, 'batch_size': 1425, 'optimizer': 'SGD'}.
2026-06-15 18:26:44,387 - experiment_functions - INFO - Early stopping at epoch 1000. Best Metrics: (0.042622834747739376, 0.005135976957599304, 0.020286487692158576)
2026-06-15 18:26:44,516 - optuna.study.study - INFO - Trial 109 finished with values: [0.042622834747739376, 0.005135976957599304, 0.020286487692158576] and parameters: {'n_layers': 4, 'embedding_dim': 256, 'lr': 0.0008257854890964482, 'lambda_val': 6.852585789077327e-05, 'batch_size': 3109, 'optimizer': 'RMSprop'}.
2026-06-15 18:28:36,192 - experiment_functions - INFO - Early stopping at epoch 2350. Best Metrics: (0.032767866927806436, 0.004069261169535803, 0.015580795923060687)
2026-06-15 18:28:36,261 - optuna.study.study - INFO - Trial 110 finished with values: [0.032767866927806436, 0.004069261169535803, 0.015580795923060687] and parameters: {'n_layers': 3, 'embedding_dim': 128, 'lr': 0.0008007729293904306, 'lambda_val': 0.004749408595262452, 'batch_size': 738, 'optimizer': 'RMSprop'}.
2026-06-15 18:29:41,649 - experiment_functions - INFO - Early stopping at epoch 1500. Best Metrics: (0.03562711090177958, 0.0043020296068055465, 0.016210970959718667)
2026-06-15 18:29:41,734 - optuna.study.study - INFO - Trial 111 finished with values: [0.03562711090177958, 0.0043020296068055465, 0.016210970959718667] and parameters: {'n_layers': 2, 'embedding_dim': 96, 'lr': 0.0013130193047400018, 'lambda_val': 0.005539897590159512, 'batch_size': 739, 'optimizer': 'RMSprop'}.
2026-06-15 18:30:07,548 - experiment_functions - INFO - Early stopping at epoch 550. Best Metrics: (0.04754743354085462, 0.005864424944738428, 0.02291169258396713)
2026-06-15 18:30:07,682 - optuna.study.study - INFO - Trial 112 finished with values: [0.04754743354085462, 0.005864424944738428, 0.02291169258396713] and parameters: {'n_layers': 2, 'embedding_dim': 96, 'lr': 0.00859558839759563, 'lambda_val': 0.0002091155632832413, 'batch_size': 2936, 'optimizer': 'Adam'}.
2026-06-15 18:32:53,339 - optuna.study.study - INFO - Trial 113 finished with values: [0.036577093360514526, 0.005375443767164578, 0.022162785871926407] and parameters: {'n_layers': 1, 'embedding_dim': 128, 'lr': 0.0003649621407716159, 'lambda_val': 1.5130950471060717e-06, 'batch_size': 2933, 'optimizer': 'RMSprop'}.
2026-06-15 18:35:33,491 - optuna.study.study - INFO - Trial 114 finished with values: [0.05208662539870332, 0.00675530846004421, 0.028958216667563853] and parameters: {'n_layers': 3, 'embedding_dim': 32, 'lr': 0.00035731579910584327, 'lambda_val': 2.0623181656245837e-06, 'batch_size': 1545, 'optimizer': 'RMSprop'}.
2026-06-15 18:37:08,859 - experiment_functions - INFO - Early stopping at epoch 2450. Best Metrics: (0.006742251977351526, 0.00093442293522674, 0.002998125823332684)
2026-06-15 18:37:08,936 - optuna.study.study - INFO - Trial 115 finished with values: [0.006742251977351526, 0.00093442293522674, 0.002998125823332684] and parameters: {'n_layers': 3, 'embedding_dim': 32, 'lr': 0.0008007729293904306, 'lambda_val': 0.09046470311754763, 'batch_size': 2005, 'optimizer': 'RMSprop'}.
2026-06-15 18:39:17,204 - experiment_functions - INFO - Early stopping at epoch 2800. Best Metrics: (0.08727682349765788, 0.010501373166320584, 0.04566937196822608)
2026-06-15 18:39:17,281 - optuna.study.study - INFO - Trial 116 finished with values: [0.08727682349765788, 0.010501373166320584, 0.04566937196822608] and parameters: {'n_layers': 2, 'embedding_dim': 128, 'lr': 0.0008007729293904306, 'lambda_val': 1.5130950471060717e-06, 'batch_size': 3620, 'optimizer': 'Adam'}.
2026-06-15 18:42:10,007 - experiment_functions - INFO - Early stopping at epoch 2750. Best Metrics: (0.041816408687950175, 0.005211333645924041, 0.020147837200014927)
2026-06-15 18:42:10,103 - optuna.study.study - INFO - Trial 117 finished with values: [0.041816408687950175, 0.005211333645924041, 0.020147837200014927] and parameters: {'n_layers': 4, 'embedding_dim': 256, 'lr': 0.0002845041667420409, 'lambda_val': 0.0031660536671449806, 'batch_size': 3500, 'optimizer': 'RMSprop'}.
2026-06-15 18:42:37,624 - experiment_functions - INFO - Early stopping at epoch 550. Best Metrics: (0.05433560690008755, 0.006479000602853507, 0.02655398607777881)
2026-06-15 18:42:37,697 - optuna.study.study - INFO - Trial 118 finished with values: [0.05433560690008755, 0.006479000602853507, 0.02655398607777881] and parameters: {'n_layers': 1, 'embedding_dim': 256, 'lr': 0.02606777968777775, 'lambda_val': 0.000140345403888327, 'batch_size': 4004, 'optimizer': 'Adam'}.
2026-06-15 18:43:14,096 - experiment_functions - INFO - Early stopping at epoch 550. Best Metrics: (0.028492142125529394, 0.0034731060352334382, 0.013256147993804153)
2026-06-15 18:43:14,176 - optuna.study.study - INFO - Trial 119 finished with values: [0.028492142125529394, 0.0034731060352334382, 0.013256147993804153] and parameters: {'n_layers': 4, 'embedding_dim': 256, 'lr': 0.0036742654809996723, 'lambda_val': 0.001319855427866883, 'batch_size': 1425, 'optimizer': 'RMSprop'}.
2026-06-15 18:45:53,187 - optuna.study.study - INFO - Trial 120 finished with values: [0.09676036096895461, 0.011770714716323932, 0.051663943208388644] and parameters: {'n_layers': 1, 'embedding_dim': 32, 'lr': 0.001479782641411582, 'lambda_val': 6.461965909578869e-06, 'batch_size': 3226, 'optimizer': 'Adam'}.
2026-06-15 18:48:36,206 - optuna.study.study - INFO - Trial 121 finished with values: [0.04627180115901849, 0.004995311139393128, 0.020973777516275098] and parameters: {'n_layers': 2, 'embedding_dim': 64, 'lr': 0.00859558839759563, 'lambda_val': 7.257175401958617e-06, 'batch_size': 3978, 'optimizer': 'RMSprop'}.
2026-06-15 18:51:12,298 - optuna.study.study - INFO - Trial 122 finished with values: [0.074548006752568, 0.009704266863152254, 0.041594405407891985] and parameters: {'n_layers': 1, 'embedding_dim': 32, 'lr': 0.0008257854890964482, 'lambda_val': 1.0702432018798528e-05, 'batch_size': 3109, 'optimizer': 'Adam'}.
2026-06-15 18:51:32,690 - experiment_functions - INFO - Early stopping at epoch 500. Best Metrics: (0.0004837002468998967, 7.2007502176971e-05, 0.00025720601472784986)
2026-06-15 18:51:32,778 - optuna.study.study - INFO - Trial 123 finished with values: [0.0004837002468998967, 7.2007502176971e-05, 0.00025720601472784986] and parameters: {'n_layers': 1, 'embedding_dim': 32, 'lr': 0.0008007729293904306, 'lambda_val': 0.0418988089223974, 'batch_size': 2005, 'optimizer': 'SGD'}.
2026-06-15 18:51:56,062 - experiment_functions - INFO - Early stopping at epoch 500. Best Metrics: (0.0004632029149523942, 7.2007502176971e-05, 0.00022604743053028547)
2026-06-15 18:51:56,640 - optuna.study.study - INFO - Trial 124 finished with values: [0.0004632029149523942, 7.2007502176971e-05, 0.00022604743053028547] and parameters: {'n_layers': 2, 'embedding_dim': 128, 'lr': 0.0019710220966942236, 'lambda_val': 1.5130950471060717e-06, 'batch_size': 3217, 'optimizer': 'SGD'}.
2026-06-15 18:55:23,296 - optuna.study.study - INFO - Trial 125 finished with values: [0.057960990142089164, 0.006396945542233239, 0.026852095369329445] and parameters: {'n_layers': 2, 'embedding_dim': 256, 'lr': 0.00859558839759563, 'lambda_val': 0.0002091155632832413, 'batch_size': 2936, 'optimizer': 'RMSprop'}.
2026-06-15 18:56:18,808 - experiment_functions - INFO - Early stopping at epoch 1150. Best Metrics: (0.08524089606462172, 0.010534865027798246, 0.044011380229410015)
2026-06-15 18:56:18,885 - optuna.study.study - INFO - Trial 126 finished with values: [0.08524089606462172, 0.010534865027798246, 0.044011380229410015] and parameters: {'n_layers': 1, 'embedding_dim': 256, 'lr': 0.001479782641411582, 'lambda_val': 0.0012522872845674186, 'batch_size': 1650, 'optimizer': 'RMSprop'}.
2026-06-15 18:57:03,269 - experiment_functions - INFO - Early stopping at epoch 1100. Best Metrics: (0.04304452355219342, 0.005263246031214415, 0.02094118661058484)
2026-06-15 18:57:04,392 - optuna.study.study - INFO - Trial 127 finished with values: [0.04304452355219342, 0.005263246031214415, 0.02094118661058484] and parameters: {'n_layers': 2, 'embedding_dim': 32, 'lr': 0.0013130193047400018, 'lambda_val': 0.005539897590159512, 'batch_size': 1650, 'optimizer': 'RMSprop'}.
2026-06-15 18:57:30,705 - experiment_functions - INFO - Early stopping at epoch 550. Best Metrics: (0.023823369857609546, 0.0026877218835822895, 0.010912521838856642)
