2026-06-15 14:49:22,798 - optuna.study.study - INFO - Trial 233 finished with values: [0.055791142123658724, 0.007791881572777816, 0.030026518208958294] and parameters: {'n_layers': 1, 'embedding_dim': 96, 'lr': 0.0008138925204745388, 'lambda_val': 0.00911667885681347, 'batch_size': 789, 'optimizer': 'RMSprop'}.
2026-06-15 14:49:47,425 - experiment_functions - INFO - Early stopping at epoch 550. Best Metrics: (0.05144830437266421, 0.00636512827382946, 0.025957660522940837)
2026-06-15 14:49:47,490 - optuna.study.study - INFO - Trial 234 finished with values: [0.05144830437266421, 0.00636512827382946, 0.025957660522940837] and parameters: {'n_layers': 1, 'embedding_dim': 96, 'lr': 0.02231476664465701, 'lambda_val': 4.6804655463952444e-05, 'batch_size': 2768, 'optimizer': 'Adam'}.
2026-06-15 14:50:17,279 - experiment_functions - INFO - Early stopping at epoch 550. Best Metrics: (0.020639053558565202, 0.002406390247169938, 0.009213792727925892)
2026-06-15 14:50:17,370 - optuna.study.study - INFO - Trial 235 finished with values: [0.020639053558565202, 0.002406390247169938, 0.009213792727925892] and parameters: {'n_layers': 2, 'embedding_dim': 256, 'lr': 0.004256288518759279, 'lambda_val': 0.012715297368252268, 'batch_size': 2434, 'optimizer': 'RMSprop'}.
2026-06-15 14:53:23,403 - optuna.study.study - INFO - Trial 236 finished with values: [0.06111549049893763, 0.008505258222251993, 0.03493682137924649] and parameters: {'n_layers': 1, 'embedding_dim': 256, 'lr': 0.0008138925204745388, 'lambda_val': 0.0004816210017263592, 'batch_size': 789, 'optimizer': 'Adam'}.
2026-06-15 14:53:56,354 - experiment_functions - INFO - Early stopping at epoch 650. Best Metrics: (0.0783279533461267, 0.009814790006028536, 0.041231485505254316)
2026-06-15 14:53:56,435 - optuna.study.study - INFO - Trial 237 finished with values: [0.0783279533461267, 0.009814790006028536, 0.041231485505254316] and parameters: {'n_layers': 1, 'embedding_dim': 256, 'lr': 0.005616296548051391, 'lambda_val': 2.0471988586907107e-05, 'batch_size': 2285, 'optimizer': 'Adam'}.
2026-06-15 14:54:55,599 - experiment_functions - INFO - Early stopping at epoch 1200. Best Metrics: (0.1010762784339275, 0.012304909906892625, 0.05392713631475306)
2026-06-15 14:54:55,677 - optuna.study.study - INFO - Trial 238 finished with values: [0.1010762784339275, 0.012304909906892625, 0.05392713631475306] and parameters: {'n_layers': 1, 'embedding_dim': 256, 'lr': 0.0018921194607502668, 'lambda_val': 2.0471988586907107e-05, 'batch_size': 2768, 'optimizer': 'Adam'}.
2026-06-15 14:57:19,421 - experiment_functions - INFO - Early stopping at epoch 3700. Best Metrics: (0.0515182731906821, 0.006041931810570032, 0.02397369173859918)
2026-06-15 14:57:19,510 - optuna.study.study - INFO - Trial 239 finished with values: [0.0515182731906821, 0.006041931810570032, 0.02397369173859918] and parameters: {'n_layers': 1, 'embedding_dim': 32, 'lr': 0.007985040856195972, 'lambda_val': 9.97147256164674e-05, 'batch_size': 2193, 'optimizer': 'RMSprop'}.
2026-06-15 14:57:59,706 - experiment_functions - INFO - Early stopping at epoch 800. Best Metrics: (0.09003110641722539, 0.01122982115345971, 0.04679834647156356)
2026-06-15 14:57:59,769 - optuna.study.study - INFO - Trial 240 finished with values: [0.09003110641722539, 0.01122982115345971, 0.04679834647156356] and parameters: {'n_layers': 1, 'embedding_dim': 256, 'lr': 0.0026397990430783503, 'lambda_val': 0.0009998560612439528, 'batch_size': 3981, 'optimizer': 'Adam'}.
2026-06-15 14:58:28,653 - experiment_functions - INFO - Early stopping at epoch 600. Best Metrics: (0.00048058816896814644, 6.865831602920491e-05, 0.00020897563442453084)
2026-06-15 14:58:28,730 - optuna.study.study - INFO - Trial 241 finished with values: [0.00048058816896814644, 6.865831602920491e-05, 0.00020897563442453084] and parameters: {'n_layers': 1, 'embedding_dim': 256, 'lr': 1.4345346167199957e-05, 'lambda_val': 2.0471988586907107e-05, 'batch_size': 2434, 'optimizer': 'Adam'}.
2026-06-15 14:59:03,933 - experiment_functions - INFO - Early stopping at epoch 800. Best Metrics: (0.09406950778606728, 0.011290106504119499, 0.050082218964067324)
2026-06-15 14:59:04,022 - optuna.study.study - INFO - Trial 242 finished with values: [0.09406950778606728, 0.011290106504119499, 0.050082218964067324] and parameters: {'n_layers': 1, 'embedding_dim': 64, 'lr': 0.004300628102170609, 'lambda_val': 2.5476071418262236e-05, 'batch_size': 3624, 'optimizer': 'Adam'}.
2026-06-15 14:59:41,511 - experiment_functions - INFO - Early stopping at epoch 750. Best Metrics: (0.069419100302396, 0.008851898988545782, 0.03467000864433522)
2026-06-15 14:59:41,603 - optuna.study.study - INFO - Trial 243 finished with values: [0.069419100302396, 0.008851898988545782, 0.03467000864433522] and parameters: {'n_layers': 1, 'embedding_dim': 256, 'lr': 0.0016086229224309184, 'lambda_val': 0.004600256253014536, 'batch_size': 3697, 'optimizer': 'RMSprop'}.
2026-06-15 15:00:15,015 - experiment_functions - INFO - Early stopping at epoch 650. Best Metrics: (0.08235199267845895, 0.010154732400026793, 0.04397692995439889)
2026-06-15 15:00:15,093 - optuna.study.study - INFO - Trial 244 finished with values: [0.08235199267845895, 0.010154732400026793, 0.04397692995439889] and parameters: {'n_layers': 1, 'embedding_dim': 256, 'lr': 0.0056865752581316785, 'lambda_val': 1.0723270203484857e-05, 'batch_size': 2768, 'optimizer': 'Adam'}.
2026-06-15 15:03:01,870 - optuna.study.study - INFO - Trial 245 finished with values: [0.0699443748216493, 0.008870319512358496, 0.039467797717059036] and parameters: {'n_layers': 2, 'embedding_dim': 64, 'lr': 0.00044819859318088583, 'lambda_val': 2.5476071418262236e-05, 'batch_size': 1999, 'optimizer': 'RMSprop'}.
2026-06-15 15:05:38,473 - optuna.study.study - INFO - Trial 246 finished with values: [0.0797759620450495, 0.010211668564538817, 0.04503768812301103] and parameters: {'n_layers': 1, 'embedding_dim': 32, 'lr': 0.0009437548244297628, 'lambda_val': 1.0723270203484857e-05, 'batch_size': 2768, 'optimizer': 'Adam'}.
2026-06-15 15:08:09,109 - experiment_functions - INFO - Early stopping at epoch 3200. Best Metrics: (0.07873982895468222, 0.008917208118427222, 0.03752775547059645)
2026-06-15 15:08:09,185 - optuna.study.study - INFO - Trial 247 finished with values: [0.07873982895468222, 0.008917208118427222, 0.03752775547059645] and parameters: {'n_layers': 1, 'embedding_dim': 256, 'lr': 0.003688027753754567, 'lambda_val': 2.0471988586907107e-05, 'batch_size': 3624, 'optimizer': 'RMSprop'}.
2026-06-15 15:08:44,513 - experiment_functions - INFO - Early stopping at epoch 700. Best Metrics: (0.08255453622066479, 0.010079375711702056, 0.04281609681876122)
2026-06-15 15:08:44,672 - optuna.study.study - INFO - Trial 248 finished with values: [0.08255453622066479, 0.010079375711702056, 0.04281609681876122] and parameters: {'n_layers': 1, 'embedding_dim': 256, 'lr': 0.0056865752581316785, 'lambda_val': 1.509459220212265e-05, 'batch_size': 2193, 'optimizer': 'Adam'}.
2026-06-15 15:09:12,500 - experiment_functions - INFO - Early stopping at epoch 550. Best Metrics: (0.034981512050287475, 0.004502980775671512, 0.016882522154184704)
2026-06-15 15:09:12,580 - optuna.study.study - INFO - Trial 249 finished with values: [0.034981512050287475, 0.004502980775671512, 0.016882522154184704] and parameters: {'n_layers': 1, 'embedding_dim': 256, 'lr': 0.021349742277361985, 'lambda_val': 7.267949834674351e-06, 'batch_size': 1438, 'optimizer': 'Adam'}.
2026-06-15 15:09:45,549 - experiment_functions - INFO - Early stopping at epoch 650. Best Metrics: (0.088402902237952, 0.010886529573313685, 0.04725998630228068)
2026-06-15 15:09:45,652 - optuna.study.study - INFO - Trial 250 finished with values: [0.088402902237952, 0.010886529573313685, 0.04725998630228068] and parameters: {'n_layers': 1, 'embedding_dim': 256, 'lr': 0.0056865752581316785, 'lambda_val': 1.0723270203484857e-05, 'batch_size': 3812, 'optimizer': 'Adam'}.
2026-06-15 15:12:59,431 - optuna.study.study - INFO - Trial 251 finished with values: [0.1085890453191883, 0.01332976086810905, 0.057864596733010885] and parameters: {'n_layers': 1, 'embedding_dim': 256, 'lr': 0.0009437548244297628, 'lambda_val': 0.00013972282445432241, 'batch_size': 3624, 'optimizer': 'Adam'}.
2026-06-15 15:13:32,577 - experiment_functions - INFO - Early stopping at epoch 650. Best Metrics: (0.08865866836193718, 0.01095016411012124, 0.04766402194612051)
2026-06-15 15:13:32,781 - optuna.study.study - INFO - Trial 252 finished with values: [0.08865866836193718, 0.01095016411012124, 0.04766402194612051] and parameters: {'n_layers': 1, 'embedding_dim': 256, 'lr': 0.0056865752581316785, 'lambda_val': 2.549475670628784e-06, 'batch_size': 3697, 'optimizer': 'Adam'}.
2026-06-15 15:16:06,947 - experiment_functions - INFO - Early stopping at epoch 3250. Best Metrics: (0.0843365493519333, 0.009784647330698639, 0.04070884874862634)
2026-06-15 15:16:07,023 - optuna.study.study - INFO - Trial 253 finished with values: [0.0843365493519333, 0.009784647330698639, 0.04070884874862634] and parameters: {'n_layers': 1, 'embedding_dim': 256, 'lr': 0.0026397990430783503, 'lambda_val': 2.5476071418262236e-05, 'batch_size': 2285, 'optimizer': 'RMSprop'}.
2026-06-15 15:17:15,717 - experiment_functions - INFO - Early stopping at epoch 1400. Best Metrics: (0.1006285406666241, 0.012323330430705338, 0.05486621745092263)
2026-06-15 15:17:15,802 - optuna.study.study - INFO - Trial 254 finished with values: [0.1006285406666241, 0.012323330430705338, 0.05486621745092263] and parameters: {'n_layers': 1, 'embedding_dim': 256, 'lr': 0.0018921194607502668, 'lambda_val': 1.509459220212265e-05, 'batch_size': 2261, 'optimizer': 'Adam'}.
2026-06-15 15:20:27,929 - optuna.study.study - INFO - Trial 255 finished with values: [0.10736035921032079, 0.013147230223055797, 0.058331443682724915] and parameters: {'n_layers': 1, 'embedding_dim': 256, 'lr': 0.0009437548244297628, 'lambda_val': 2.5476071418262236e-05, 'batch_size': 3624, 'optimizer': 'Adam'}.
2026-06-15 15:24:39,413 - optuna.study.study - INFO - Trial 256 finished with values: [0.035282864125669486, 0.0038900797106303166, 0.015486653181017346] and parameters: {'n_layers': 4, 'embedding_dim': 256, 'lr': 0.0056865752581316785, 'lambda_val': 4.6804655463952444e-05, 'batch_size': 2193, 'optimizer': 'Adam'}.
2026-06-15 15:25:13,848 - experiment_functions - INFO - Early stopping at epoch 800. Best Metrics: (0.08543216055010243, 0.010663808694487239, 0.04564618263439162)
2026-06-15 15:25:13,943 - optuna.study.study - INFO - Trial 257 finished with values: [0.08543216055010243, 0.010663808694487239, 0.04564618263439162] and parameters: {'n_layers': 1, 'embedding_dim': 64, 'lr': 0.004300628102170609, 'lambda_val': 1.509459220212265e-05, 'batch_size': 2261, 'optimizer': 'Adam'}.
2026-06-15 15:28:20,524 - optuna.study.study - INFO - Trial 258 finished with values: [0.06555521336715432, 0.0076327952307589245, 0.03051110098564576] and parameters: {'n_layers': 1, 'embedding_dim': 256, 'lr': 0.0056865752581316785, 'lambda_val': 4.6804655463952444e-05, 'batch_size': 789, 'optimizer': 'Adam'}.
2026-06-15 15:29:31,587 - experiment_functions - INFO - Early stopping at epoch 1100. Best Metrics: (0.03863787864314869, 0.004660392524616519, 0.01835800078613537)
2026-06-15 15:29:31,665 - optuna.study.study - INFO - Trial 259 finished with values: [0.03863787864314869, 0.004660392524616519, 0.01835800078613537] and parameters: {'n_layers': 4, 'embedding_dim': 256, 'lr': 0.0018921194607502668, 'lambda_val': 2.0471988586907107e-05, 'batch_size': 2285, 'optimizer': 'Adam'}.
2026-06-15 15:32:39,163 - optuna.study.study - INFO - Trial 260 finished with values: [0.06597291831140895, 0.007708151919083664, 0.03155564070801263] and parameters: {'n_layers': 1, 'embedding_dim': 256, 'lr': 0.005616296548051391, 'lambda_val': 2.0471988586907107e-05, 'batch_size': 758, 'optimizer': 'RMSprop'}.
2026-06-15 15:33:12,461 - experiment_functions - INFO - Early stopping at epoch 650. Best Metrics: (0.08586806844265364, 0.010575055261571438, 0.04566158810375971)
2026-06-15 15:33:12,543 - optuna.study.study - INFO - Trial 261 finished with values: [0.08586806844265364, 0.010575055261571438, 0.04566158810375971] and parameters: {'n_layers': 1, 'embedding_dim': 256, 'lr': 0.0056865752581316785, 'lambda_val': 2.5476071418262236e-05, 'batch_size': 2950, 'optimizer': 'Adam'}.
2026-06-15 15:33:57,622 - experiment_functions - INFO - Early stopping at epoch 1000. Best Metrics: (0.09612507649038907, 0.011743921227141806, 0.05110149040431022)
2026-06-15 15:33:57,704 - optuna.study.study - INFO - Trial 262 finished with values: [0.09612507649038907, 0.011743921227141806, 0.05110149040431022] and parameters: {'n_layers': 1, 'embedding_dim': 128, 'lr': 0.0026397990430783503, 'lambda_val': 4.6804655463952444e-05, 'batch_size': 3981, 'optimizer': 'Adam'}.
2026-06-15 15:34:31,910 - experiment_functions - INFO - Early stopping at epoch 700. Best Metrics: (0.03575687009474347, 0.004209926987741979, 0.016370440563540433)
2026-06-15 15:34:32,003 - optuna.study.study - INFO - Trial 263 finished with values: [0.03575687009474347, 0.004209926987741979, 0.016370440563540433] and parameters: {'n_layers': 1, 'embedding_dim': 256, 'lr': 0.005616296548051391, 'lambda_val': 0.006419152305434605, 'batch_size': 2768, 'optimizer': 'RMSprop'}.
2026-06-15 15:34:55,331 - experiment_functions - INFO - Early stopping at epoch 550. Best Metrics: (0.04066213972380514, 0.005184540156741911, 0.020157363538188422)
2026-06-15 15:34:55,408 - optuna.study.study - INFO - Trial 264 finished with values: [0.04066213972380514, 0.005184540156741911, 0.020157363538188422] and parameters: {'n_layers': 1, 'embedding_dim': 32, 'lr': 0.0337150339096831, 'lambda_val': 2.0471988586907107e-05, 'batch_size': 2768, 'optimizer': 'Adam'}.
2026-06-15 15:35:23,250 - experiment_functions - INFO - Early stopping at epoch 650. Best Metrics: (0.05993894455830898, 0.007902404715654097, 0.030687182583298972)
2026-06-15 15:35:24,373 - optuna.study.study - INFO - Trial 265 finished with values: [0.05993894455830898, 0.007902404715654097, 0.030687182583298972] and parameters: {'n_layers': 1, 'embedding_dim': 64, 'lr': 0.004300628102170609, 'lambda_val': 0.011569916705558831, 'batch_size': 3624, 'optimizer': 'Adam'}.
2026-06-15 15:35:57,452 - experiment_functions - INFO - Early stopping at epoch 650. Best Metrics: (0.09020445270370152, 0.011112599638287894, 0.048386639826247045)
2026-06-15 15:35:57,542 - optuna.study.study - INFO - Trial 266 finished with values: [0.09020445270370152, 0.011112599638287894, 0.048386639826247045] and parameters: {'n_layers': 1, 'embedding_dim': 256, 'lr': 0.0056865752581316785, 'lambda_val': 4.6804655463952444e-05, 'batch_size': 3735, 'optimizer': 'Adam'}.
2026-06-15 15:36:30,770 - experiment_functions - INFO - Early stopping at epoch 650. Best Metrics: (0.08777849644550116, 0.010777681023511287, 0.0458692257587463)
2026-06-15 15:36:30,858 - optuna.study.study - INFO - Trial 267 finished with values: [0.08777849644550116, 0.010777681023511287, 0.0458692257587463] and parameters: {'n_layers': 1, 'embedding_dim': 256, 'lr': 0.00652783224013236, 'lambda_val': 2.549475670628784e-06, 'batch_size': 3697, 'optimizer': 'Adam'}.
2026-06-15 15:37:11,485 - experiment_functions - INFO - Early stopping at epoch 800. Best Metrics: (0.09363512760804427, 0.011546319244423606, 0.050487367120549416)
2026-06-15 15:37:11,772 - optuna.study.study - INFO - Trial 268 finished with values: [0.09363512760804427, 0.011546319244423606, 0.050487367120549416] and parameters: {'n_layers': 1, 'embedding_dim': 256, 'lr': 0.0030096858286544014, 'lambda_val': 1.509459220212265e-05, 'batch_size': 3479, 'optimizer': 'Adam'}.
2026-06-15 15:37:43,134 - experiment_functions - INFO - Early stopping at epoch 750. Best Metrics: (0.07135795991051894, 0.008977493469087012, 0.03702703256842552)
2026-06-15 15:37:43,208 - optuna.study.study - INFO - Trial 269 finished with values: [0.07135795991051894, 0.008977493469087012, 0.03702703256842552] and parameters: {'n_layers': 1, 'embedding_dim': 32, 'lr': 0.004300628102170609, 'lambda_val': 0.002872624371953763, 'batch_size': 3991, 'optimizer': 'Adam'}.
2026-06-15 15:38:35,888 - experiment_functions - INFO - Early stopping at epoch 800. Best Metrics: (0.04361651910749722, 0.005079040793087281, 0.020843111312631155)
2026-06-15 15:38:36,997 - optuna.study.study - INFO - Trial 270 finished with values: [0.04361651910749722, 0.005079040793087281, 0.020843111312631155] and parameters: {'n_layers': 4, 'embedding_dim': 256, 'lr': 0.0018921194607502668, 'lambda_val': 2.0471988586907107e-05, 'batch_size': 2768, 'optimizer': 'Adam'}.
2026-06-15 15:39:17,475 - experiment_functions - INFO - Early stopping at epoch 800. Best Metrics: (0.09586663492527085, 0.011831000066983724, 0.05057488691701944)
2026-06-15 15:39:17,695 - optuna.study.study - INFO - Trial 271 finished with values: [0.09586663492527085, 0.011831000066983724, 0.05057488691701944] and parameters: {'n_layers': 1, 'embedding_dim': 256, 'lr': 0.0030096858286544014, 'lambda_val': 4.6804655463952444e-05, 'batch_size': 3812, 'optimizer': 'Adam'}.
2026-06-15 15:40:04,709 - experiment_functions - INFO - Early stopping at epoch 1100. Best Metrics: (0.0918782611462056, 0.011338669703262107, 0.049631136009843806)
2026-06-15 15:40:05,992 - optuna.study.study - INFO - Trial 272 finished with values: [0.0918782611462056, 0.011338669703262107, 0.049631136009843806] and parameters: {'n_layers': 1, 'embedding_dim': 64, 'lr': 0.0026397990430783503, 'lambda_val': 4.6804655463952444e-05, 'batch_size': 2193, 'optimizer': 'Adam'}.
2026-06-15 15:41:29,889 - experiment_functions - INFO - Early stopping at epoch 1750. Best Metrics: (0.09423000296065688, 0.011896309196865164, 0.04912241811198661)
2026-06-15 15:41:29,979 - optuna.study.study - INFO - Trial 273 finished with values: [0.09423000296065688, 0.011896309196865164, 0.04912241811198661] and parameters: {'n_layers': 1, 'embedding_dim': 256, 'lr': 0.0009437548244297628, 'lambda_val': 0.0013344610744303142, 'batch_size': 3624, 'optimizer': 'Adam'}.
2026-06-15 15:42:31,165 - experiment_functions - INFO - Early stopping at epoch 1500. Best Metrics: (0.09047206562514516, 0.01101044946078103, 0.04907356162814125)
2026-06-15 15:42:31,261 - optuna.study.study - INFO - Trial 274 finished with values: [0.09047206562514516, 0.01101044946078103, 0.04907356162814125] and parameters: {'n_layers': 1, 'embedding_dim': 32, 'lr': 0.0030096858286544014, 'lambda_val': 1.0723270203484857e-05, 'batch_size': 2285, 'optimizer': 'Adam'}.
2026-06-15 15:43:16,347 - experiment_functions - INFO - Early stopping at epoch 900. Best Metrics: (0.09617357825782968, 0.011723826110255206, 0.05118528201766661)
2026-06-15 15:43:17,627 - optuna.study.study - INFO - Trial 275 finished with values: [0.09617357825782968, 0.011723826110255206, 0.05118528201766661] and parameters: {'n_layers': 1, 'embedding_dim': 256, 'lr': 0.0026397990430783503, 'lambda_val': 1.0723270203484857e-05, 'batch_size': 3812, 'optimizer': 'Adam'}.
2026-06-15 15:43:53,993 - experiment_functions - INFO - Early stopping at epoch 750. Best Metrics: (0.029370180965372753, 0.003657311273360574, 0.013121117840773694)
2026-06-15 15:43:54,066 - optuna.study.study - INFO - Trial 276 finished with values: [0.029370180965372753, 0.003657311273360574, 0.013121117840773694] and parameters: {'n_layers': 1, 'embedding_dim': 256, 'lr': 0.0026397990430783503, 'lambda_val': 0.06022058589842987, 'batch_size': 2768, 'optimizer': 'Adam'}.
2026-06-15 15:44:17,938 - experiment_functions - INFO - Early stopping at epoch 500. Best Metrics: (0.00025892753295577066, 5.3586978364257486e-05, 0.0001222725787141865)
2026-06-15 15:44:18,020 - optuna.study.study - INFO - Trial 277 finished with values: [0.00025892753295577066, 5.3586978364257486e-05, 0.0001222725787141865] and parameters: {'n_layers': 1, 'embedding_dim': 256, 'lr': 0.0056865752581316785, 'lambda_val': 4.6804655463952444e-05, 'batch_size': 2193, 'optimizer': 'SGD'}.
2026-06-15 15:47:19,086 - optuna.study.study - INFO - Trial 278 finished with values: [0.004291033773741563, 0.0007368209525085405, 0.0022884410453992247] and parameters: {'n_layers': 1, 'embedding_dim': 256, 'lr': 0.00022715311393781547, 'lambda_val': 4.6804655463952444e-05, 'batch_size': 3812, 'optimizer': 'Adam'}.
2026-06-15 15:48:10,494 - experiment_functions - INFO - Early stopping at epoch 1050. Best Metrics: (0.07933031389052174, 0.01005760600174158, 0.041113982689461336)
2026-06-15 15:48:10,583 - optuna.study.study - INFO - Trial 279 finished with values: [0.07933031389052174, 0.01005760600174158, 0.041113982689461336] and parameters: {'n_layers': 1, 'embedding_dim': 256, 'lr': 0.0026397990430783503, 'lambda_val': 0.0008769693098075944, 'batch_size': 1005, 'optimizer': 'Adam'}.
2026-06-15 15:49:16,950 - experiment_functions - INFO - Early stopping at epoch 1350. Best Metrics: (0.10172344666545463, 0.012108982517248307, 0.05488300284330547)
2026-06-15 15:49:17,035 - optuna.study.study - INFO - Trial 280 finished with values: [0.10172344666545463, 0.012108982517248307, 0.05488300284330547] and parameters: {'n_layers': 1, 'embedding_dim': 256, 'lr': 0.0018921194607502668, 'lambda_val': 1.847207234172021e-05, 'batch_size': 2768, 'optimizer': 'Adam'}.
2026-06-15 15:50:02,111 - experiment_functions - INFO - Early stopping at epoch 900. Best Metrics: (0.09939513283731334, 0.012063768504253468, 0.052328061837064184)
2026-06-15 15:50:02,196 - optuna.study.study - INFO - Trial 281 finished with values: [0.09939513283731334, 0.012063768504253468, 0.052328061837064184] and parameters: {'n_layers': 1, 'embedding_dim': 256, 'lr': 0.0026397990430783503, 'lambda_val': 4.6804655463952444e-05, 'batch_size': 3981, 'optimizer': 'Adam'}.
2026-06-15 15:50:37,441 - experiment_functions - INFO - Early stopping at epoch 700. Best Metrics: (0.0846460601473595, 0.01022506530912988, 0.04364227794100809)
