2026-06-14 18:38:43,792 - optuna.study.study - INFO - Trial 292 finished with values: [0.0005491640285902156, 6.698372295532187e-05, 0.00024310639018896828] and parameters: {'n_layers': 1, 'embedding_dim': 96, 'lr': 0.0011766220344878323, 'lambda_val': 1.569122997627705e-05, 'batch_size': 1970, 'optimizer': 'SGD'}.
2026-06-14 18:41:23,636 - optuna.study.study - INFO - Trial 293 finished with values: [0.009016365985794896, 0.0017047357492129414, 0.005457804177863543] and parameters: {'n_layers': 1, 'embedding_dim': 128, 'lr': 0.0004142892576537248, 'lambda_val': 2.3856782843124496e-06, 'batch_size': 1532, 'optimizer': 'Adam'}.
2026-06-14 18:42:58,729 - experiment_functions - INFO - Early stopping at epoch 2000. Best Metrics: (0.09937273569753528, 0.012013530712036976, 0.05136024609193025)
2026-06-14 18:42:58,817 - optuna.study.study - INFO - Trial 294 finished with values: [0.09937273569753528, 0.012013530712036976, 0.05136024609193025] and parameters: {'n_layers': 1, 'embedding_dim': 256, 'lr': 0.0012088550950310484, 'lambda_val': 0.00019765543294629712, 'batch_size': 2310, 'optimizer': 'RMSprop'}.
2026-06-14 18:44:32,743 - experiment_functions - INFO - Early stopping at epoch 1950. Best Metrics: (0.10230170016960762, 0.01229653694152321, 0.05527562001739464)
2026-06-14 18:44:32,824 - optuna.study.study - INFO - Trial 295 finished with values: [0.10230170016960762, 0.01229653694152321, 0.05527562001739464] and parameters: {'n_layers': 1, 'embedding_dim': 256, 'lr': 0.001866327471651579, 'lambda_val': 5.588502828653658e-06, 'batch_size': 2310, 'optimizer': 'Adam'}.
2026-06-14 18:47:09,908 - optuna.study.study - INFO - Trial 296 finished with values: [0.09047463588597378, 0.011276709759528434, 0.04933688674618291] and parameters: {'n_layers': 1, 'embedding_dim': 32, 'lr': 0.0012088550950310484, 'lambda_val': 5.588502828653658e-06, 'batch_size': 3345, 'optimizer': 'Adam'}.
2026-06-14 18:47:44,079 - experiment_functions - INFO - Early stopping at epoch 750. Best Metrics: (0.07370726948468578, 0.009248777547056065, 0.03834310507526302)
2026-06-14 18:47:44,418 - optuna.study.study - INFO - Trial 297 finished with values: [0.07370726948468578, 0.009248777547056065, 0.03834310507526302] and parameters: {'n_layers': 2, 'embedding_dim': 96, 'lr': 0.001866327471651579, 'lambda_val': 2.113988332261468e-05, 'batch_size': 3147, 'optimizer': 'Adam'}.
2026-06-14 18:50:30,975 - optuna.study.study - INFO - Trial 298 finished with values: [0.08038237247489888, 0.009823162971397952, 0.04248331090755776] and parameters: {'n_layers': 2, 'embedding_dim': 64, 'lr': 0.0009052352884581927, 'lambda_val': 8.380696475709368e-06, 'batch_size': 2722, 'optimizer': 'Adam'}.
2026-06-14 18:53:21,026 - optuna.study.study - INFO - Trial 299 finished with values: [0.0997686403871876, 0.012261370486971667, 0.05519124394657202] and parameters: {'n_layers': 1, 'embedding_dim': 128, 'lr': 0.0009052352884581927, 'lambda_val': 2.6136942653041923e-05, 'batch_size': 2289, 'optimizer': 'RMSprop'}.
2026-06-14 18:53:21,041 - root - INFO - Selected Trial 128 based on Max ndcg: 0.0593
2026-06-14 18:53:21,041 - root - INFO - Associated Recall: 0.1091
2026-06-14 18:53:21,041 - experiment_functions - INFO - Training the best model ... for e_gowalla_1c3dcs_rand1
2026-06-14 18:56:32,226 - root - INFO -   **** Training e_gowalla_1c3dcs_rand2
2026-06-14 18:56:32,377 - root - INFO -   **** Getting 558671/845292 random edges
2026-06-14 18:56:32,638 - optuna.storages._rdb.storage - INFO - A new study created in RDB with name: Study_e_gowalla_1c3dcs_rand2
2026-06-14 18:56:55,891 - experiment_functions - INFO - Early stopping at epoch 550. Best Metrics: (0.009031218488310998, 0.0012525956192645186, 0.004572707758973852)
2026-06-14 18:56:55,983 - optuna.study.study - INFO - Trial 0 finished with values: [0.009031218488310998, 0.0012525956192645186, 0.004572707758973852] and parameters: {'n_layers': 1, 'embedding_dim': 96, 'lr': 0.013923173975164954, 'lambda_val': 0.09089453714374071, 'batch_size': 1188, 'optimizer': 'RMSprop'}.
2026-06-14 18:59:43,370 - optuna.study.study - INFO - Trial 1 finished with values: [0.0011778355138139334, 0.0002093241342353808, 0.000566977511743071] and parameters: {'n_layers': 4, 'embedding_dim': 64, 'lr': 7.807973071932615e-05, 'lambda_val': 6.806830251349438e-05, 'batch_size': 1686, 'optimizer': 'Adam'}.
2026-06-14 19:02:43,798 - optuna.study.study - INFO - Trial 2 finished with values: [0.001634253517924237, 0.00023946680956527568, 0.0007818766654145928] and parameters: {'n_layers': 3, 'embedding_dim': 128, 'lr': 9.529428011134602e-05, 'lambda_val': 1.1530454299125867e-06, 'batch_size': 1086, 'optimizer': 'RMSprop'}.
2026-06-14 19:05:19,336 - optuna.study.study - INFO - Trial 3 finished with values: [0.0008807213109883189, 0.00012726907361511152, 0.00040742461192680505] and parameters: {'n_layers': 4, 'embedding_dim': 32, 'lr': 5.072344360143428e-05, 'lambda_val': 3.4294150750489234e-05, 'batch_size': 3873, 'optimizer': 'Adam'}.
2026-06-14 19:06:06,420 - experiment_functions - INFO - Early stopping at epoch 1150. Best Metrics: (0.00048592326757917906, 7.87058744725032e-05, 0.00024212892364858127)
2026-06-14 19:06:06,514 - optuna.study.study - INFO - Trial 4 finished with values: [0.00048592326757917906, 7.87058744725032e-05, 0.00024212892364858127] and parameters: {'n_layers': 1, 'embedding_dim': 128, 'lr': 3.83044382223544e-05, 'lambda_val': 5.345316952895269e-05, 'batch_size': 770, 'optimizer': 'Adam'}.
2026-06-14 19:09:02,130 - optuna.study.study - INFO - Trial 5 finished with values: [0.03299825673984774, 0.004605130953178378, 0.018253018218311597] and parameters: {'n_layers': 3, 'embedding_dim': 96, 'lr': 0.0001856606360628364, 'lambda_val': 0.00019713152464851107, 'batch_size': 2976, 'optimizer': 'Adam'}.
2026-06-14 19:11:42,665 - experiment_functions - INFO - Early stopping at epoch 2550. Best Metrics: (0.06294699671229272, 0.0076193984861678615, 0.03139575684566389)
2026-06-14 19:11:42,749 - optuna.study.study - INFO - Trial 6 finished with values: [0.06294699671229272, 0.0076193984861678615, 0.03139575684566389] and parameters: {'n_layers': 4, 'embedding_dim': 256, 'lr': 0.0003794262448571181, 'lambda_val': 1.6750135096134514e-06, 'batch_size': 2141, 'optimizer': 'RMSprop'}.
2026-06-14 19:12:24,888 - experiment_functions - INFO - Early stopping at epoch 650. Best Metrics: (0.012794293211521493, 0.0015523477794895841, 0.005446611550499962)
2026-06-14 19:12:24,980 - optuna.study.study - INFO - Trial 7 finished with values: [0.012794293211521493, 0.0015523477794895841, 0.005446611550499962] and parameters: {'n_layers': 4, 'embedding_dim': 256, 'lr': 0.0014328783582003698, 'lambda_val': 0.037666976483585794, 'batch_size': 3874, 'optimizer': 'Adam'}.
2026-06-14 19:12:49,514 - experiment_functions - INFO - Early stopping at epoch 500. Best Metrics: (0.0005400085980774461, 8.038046754638622e-05, 0.0002540795434087353)
2026-06-14 19:12:49,587 - optuna.study.study - INFO - Trial 8 finished with values: [0.0005400085980774461, 8.038046754638622e-05, 0.0002540795434087353] and parameters: {'n_layers': 3, 'embedding_dim': 128, 'lr': 0.004538896962535733, 'lambda_val': 6.974188437607659e-06, 'batch_size': 2887, 'optimizer': 'SGD'}.
2026-06-14 19:14:51,195 - experiment_functions - INFO - Early stopping at epoch 2600. Best Metrics: (0.03167814350571021, 0.003525018420523813, 0.01418714297392644)
2026-06-14 19:14:51,265 - optuna.study.study - INFO - Trial 9 finished with values: [0.03167814350571021, 0.003525018420523813, 0.01418714297392644] and parameters: {'n_layers': 3, 'embedding_dim': 128, 'lr': 0.007727727616910603, 'lambda_val': 0.0001311708167749871, 'batch_size': 776, 'optimizer': 'Adam'}.
2026-06-14 19:15:54,361 - experiment_functions - INFO - Early stopping at epoch 1600. Best Metrics: (0.00041412235477911896, 7.200750217697099e-05, 0.00020863822163605578)
2026-06-14 19:15:54,449 - optuna.study.study - INFO - Trial 10 finished with values: [0.00041412235477911896, 7.200750217697099e-05, 0.00020863822163605578] and parameters: {'n_layers': 1, 'embedding_dim': 96, 'lr': 2.6011541061985968e-05, 'lambda_val': 0.0002463371848132341, 'batch_size': 3911, 'optimizer': 'RMSprop'}.
2026-06-14 19:16:17,395 - experiment_functions - INFO - Early stopping at epoch 500. Best Metrics: (0.00031521163482144593, 6.530912988143882e-05, 0.00017826277660286076)
2026-06-14 19:16:17,482 - optuna.study.study - INFO - Trial 11 finished with values: [0.00031521163482144593, 6.530912988143882e-05, 0.00017826277660286076] and parameters: {'n_layers': 4, 'embedding_dim': 64, 'lr': 1.3201492170619863e-05, 'lambda_val': 0.004799496680559229, 'batch_size': 3537, 'optimizer': 'SGD'}.
2026-06-14 19:16:46,701 - experiment_functions - INFO - Early stopping at epoch 750. Best Metrics: (0.0004239722903900009, 6.530912988143881e-05, 0.0001960964714315434)
2026-06-14 19:16:46,784 - optuna.study.study - INFO - Trial 12 finished with values: [0.0004239722903900009, 6.530912988143881e-05, 0.0001960964714315434] and parameters: {'n_layers': 1, 'embedding_dim': 32, 'lr': 0.0002928023692304227, 'lambda_val': 0.012037109385099855, 'batch_size': 1538, 'optimizer': 'Adam'}.
2026-06-14 19:17:12,950 - experiment_functions - INFO - Early stopping at epoch 500. Best Metrics: (0.0005169679706790167, 7.033290910308794e-05, 0.00020589689518407675)
2026-06-14 19:17:13,034 - optuna.study.study - INFO - Trial 13 finished with values: [0.0005169679706790167, 7.033290910308794e-05, 0.00020589689518407675] and parameters: {'n_layers': 4, 'embedding_dim': 128, 'lr': 0.0002567185904269796, 'lambda_val': 0.07884532572803091, 'batch_size': 1322, 'optimizer': 'SGD'}.
2026-06-14 19:19:05,178 - experiment_functions - INFO - Early stopping at epoch 2500. Best Metrics: (0.04912558338876318, 0.005899591399289972, 0.023638235968421996)
2026-06-14 19:19:05,262 - optuna.study.study - INFO - Trial 14 finished with values: [0.04912558338876318, 0.005899591399289972, 0.023638235968421996] and parameters: {'n_layers': 3, 'embedding_dim': 96, 'lr': 0.0012453044445403945, 'lambda_val': 3.904381306216792e-06, 'batch_size': 1756, 'optimizer': 'RMSprop'}.
2026-06-14 19:19:25,654 - experiment_functions - INFO - Early stopping at epoch 500. Best Metrics: (0.0005188056649895375, 7.703128139862015e-05, 0.00024297692536312608)
2026-06-14 19:19:25,946 - optuna.study.study - INFO - Trial 15 finished with values: [0.0005188056649895375, 7.703128139862015e-05, 0.00024297692536312608] and parameters: {'n_layers': 1, 'embedding_dim': 32, 'lr': 0.0018019270974582522, 'lambda_val': 1.6121618223695043e-05, 'batch_size': 2307, 'optimizer': 'SGD'}.
2026-06-14 19:19:52,144 - experiment_functions - INFO - Early stopping at epoch 500. Best Metrics: (0.0004289092656664902, 7.2007502176971e-05, 0.00019505210928127473)
2026-06-14 19:19:53,112 - optuna.study.study - INFO - Trial 16 finished with values: [0.0004289092656664902, 7.2007502176971e-05, 0.00019505210928127473] and parameters: {'n_layers': 4, 'embedding_dim': 128, 'lr': 0.0025544248901197735, 'lambda_val': 0.00016851916947584493, 'batch_size': 3717, 'optimizer': 'SGD'}.
2026-06-14 19:20:19,202 - experiment_functions - INFO - Early stopping at epoch 500. Best Metrics: (0.00048105989969918396, 7.2007502176971e-05, 0.0002236584640202009)
2026-06-14 19:20:19,269 - optuna.study.study - INFO - Trial 17 finished with values: [0.00048105989969918396, 7.2007502176971e-05, 0.0002236584640202009] and parameters: {'n_layers': 4, 'embedding_dim': 128, 'lr': 2.620448939962123e-05, 'lambda_val': 2.6577876367239726e-05, 'batch_size': 3775, 'optimizer': 'SGD'}.
2026-06-14 19:21:11,748 - experiment_functions - INFO - Early stopping at epoch 1200. Best Metrics: (0.0846385517058931, 0.010722419452073145, 0.045384550850605575)
2026-06-14 19:21:11,823 - optuna.study.study - INFO - Trial 18 finished with values: [0.0846385517058931, 0.010722419452073145, 0.045384550850605575] and parameters: {'n_layers': 1, 'embedding_dim': 128, 'lr': 0.0029187572679997753, 'lambda_val': 0.00020614378723959702, 'batch_size': 913, 'optimizer': 'Adam'}.
2026-06-14 19:21:34,417 - experiment_functions - INFO - Early stopping at epoch 500. Best Metrics: (0.0005424919982237583, 8.875343291580147e-05, 0.00021693070753731368)
2026-06-14 19:21:34,486 - optuna.study.study - INFO - Trial 19 finished with values: [0.0005424919982237583, 8.875343291580147e-05, 0.00021693070753731368] and parameters: {'n_layers': 2, 'embedding_dim': 96, 'lr': 7.217177242764055e-05, 'lambda_val': 0.05110873236108613, 'batch_size': 856, 'optimizer': 'Adam'}.
2026-06-14 19:22:25,303 - experiment_functions - INFO - Early stopping at epoch 1150. Best Metrics: (0.0005383061144939298, 7.53566883247371e-05, 0.00022746546062423504)
2026-06-14 19:22:25,370 - optuna.study.study - INFO - Trial 20 finished with values: [0.0005383061144939298, 7.53566883247371e-05, 0.00022746546062423504] and parameters: {'n_layers': 2, 'embedding_dim': 128, 'lr': 2.296521231277095e-05, 'lambda_val': 0.00033372259858655847, 'batch_size': 1718, 'optimizer': 'Adam'}.
2026-06-14 19:23:12,621 - experiment_functions - INFO - Early stopping at epoch 950. Best Metrics: (0.061420392745099354, 0.007379931676602586, 0.03044057100276411)
2026-06-14 19:23:12,698 - optuna.study.study - INFO - Trial 21 finished with values: [0.061420392745099354, 0.007379931676602586, 0.03044057100276411] and parameters: {'n_layers': 3, 'embedding_dim': 128, 'lr': 0.0011776400704232174, 'lambda_val': 2.839715524460245e-05, 'batch_size': 3878, 'optimizer': 'Adam'}.
2026-06-14 19:23:35,683 - experiment_functions - INFO - Early stopping at epoch 500. Best Metrics: (0.0004888851195163168, 7.870587447250318e-05, 0.00023358756331661015)
2026-06-14 19:23:35,767 - optuna.study.study - INFO - Trial 22 finished with values: [0.0004888851195163168, 7.870587447250318e-05, 0.00023358756331661015] and parameters: {'n_layers': 4, 'embedding_dim': 64, 'lr': 6.725466212820246e-05, 'lambda_val': 2.5483280339000643e-05, 'batch_size': 3555, 'optimizer': 'SGD'}.
2026-06-14 19:26:54,531 - optuna.study.study - INFO - Trial 23 finished with values: [0.047392509568778836, 0.005969924308393061, 0.024340942202006048] and parameters: {'n_layers': 4, 'embedding_dim': 128, 'lr': 0.0001717695563766432, 'lambda_val': 7.390761978888471e-05, 'batch_size': 3271, 'optimizer': 'RMSprop'}.
2026-06-14 19:29:44,284 - optuna.study.study - INFO - Trial 24 finished with values: [0.0021667081314292683, 0.0003516645455154398, 0.0011116278209601428] and parameters: {'n_layers': 2, 'embedding_dim': 128, 'lr': 0.00018235770357627004, 'lambda_val': 3.0087795237858673e-05, 'batch_size': 873, 'optimizer': 'RMSprop'}.
2026-06-14 19:30:16,352 - experiment_functions - INFO - Early stopping at epoch 500. Best Metrics: (0.0004595708861940423, 6.86583160292049e-05, 0.00025639508640838715)
2026-06-14 19:30:16,438 - optuna.study.study - INFO - Trial 25 finished with values: [0.0004595708861940423, 6.86583160292049e-05, 0.00025639508640838715] and parameters: {'n_layers': 4, 'embedding_dim': 256, 'lr': 0.08213435189574451, 'lambda_val': 0.011075363761469397, 'batch_size': 988, 'optimizer': 'SGD'}.
2026-06-14 19:31:49,656 - experiment_functions - INFO - Early stopping at epoch 2450. Best Metrics: (0.011100843344674281, 0.001410007368209525, 0.004824448253212878)
2026-06-14 19:31:49,755 - optuna.study.study - INFO - Trial 26 finished with values: [0.011100843344674281, 0.001410007368209525, 0.004824448253212878] and parameters: {'n_layers': 2, 'embedding_dim': 32, 'lr': 0.005313330876926393, 'lambda_val': 0.040599997604393895, 'batch_size': 618, 'optimizer': 'Adam'}.
2026-06-14 19:35:07,613 - optuna.study.study - INFO - Trial 27 finished with values: [0.03730324090395969, 0.004164712974747136, 0.016475801700029984] and parameters: {'n_layers': 4, 'embedding_dim': 128, 'lr': 0.004960095878914263, 'lambda_val': 0.00012073664489097666, 'batch_size': 2579, 'optimizer': 'RMSprop'}.
2026-06-14 19:37:52,124 - optuna.study.study - INFO - Trial 28 finished with values: [0.012824979898902095, 0.0021083126800187555, 0.007044821709540548] and parameters: {'n_layers': 2, 'embedding_dim': 96, 'lr': 0.0002976018668182029, 'lambda_val': 1.0458611121108427e-05, 'batch_size': 953, 'optimizer': 'Adam'}.
2026-06-14 19:38:24,178 - experiment_functions - INFO - Early stopping at epoch 500. Best Metrics: (0.0004348794414049366, 7.368209525085404e-05, 0.00024582419150487376)
2026-06-14 19:38:24,252 - optuna.study.study - INFO - Trial 29 finished with values: [0.0004348794414049366, 7.368209525085404e-05, 0.00024582419150487376] and parameters: {'n_layers': 4, 'embedding_dim': 256, 'lr': 4.230351178130303e-05, 'lambda_val': 0.0587676444016522, 'batch_size': 2605, 'optimizer': 'SGD'}.
2026-06-14 19:38:50,371 - experiment_functions - INFO - Early stopping at epoch 550. Best Metrics: (0.028940122240855688, 0.003349186147766093, 0.013297940645414551)
2026-06-14 19:38:50,518 - optuna.study.study - INFO - Trial 30 finished with values: [0.028940122240855688, 0.003349186147766093, 0.013297940645414551] and parameters: {'n_layers': 2, 'embedding_dim': 128, 'lr': 0.060031242291035895, 'lambda_val': 0.00023118330968848881, 'batch_size': 3729, 'optimizer': 'Adam'}.
2026-06-14 19:39:11,645 - experiment_functions - INFO - Early stopping at epoch 500. Best Metrics: (0.0004807217578552519, 7.368209525085404e-05, 0.00020337647017853563)
2026-06-14 19:39:11,733 - optuna.study.study - INFO - Trial 31 finished with values: [0.0004807217578552519, 7.368209525085404e-05, 0.00020337647017853563] and parameters: {'n_layers': 3, 'embedding_dim': 32, 'lr': 0.0006134550992546751, 'lambda_val': 0.05868082635682556, 'batch_size': 3083, 'optimizer': 'SGD'}.
2026-06-14 19:41:12,225 - experiment_functions - INFO - Early stopping at epoch 2650. Best Metrics: (0.0006282409682948886, 9.377721213745061e-05, 0.0002682894002446224)
2026-06-14 19:41:12,317 - optuna.study.study - INFO - Trial 32 finished with values: [0.0006282409682948886, 9.377721213745061e-05, 0.0002682894002446224] and parameters: {'n_layers': 4, 'embedding_dim': 96, 'lr': 1.901956646527392e-05, 'lambda_val': 0.0008319854762852718, 'batch_size': 3128, 'optimizer': 'RMSprop'}.
2026-06-14 19:41:43,579 - experiment_functions - INFO - Early stopping at epoch 700. Best Metrics: (0.06696148746772003, 0.00820718065510081, 0.033544642806432774)
2026-06-14 19:41:43,907 - optuna.study.study - INFO - Trial 33 finished with values: [0.06696148746772003, 0.00820718065510081, 0.033544642806432774] and parameters: {'n_layers': 1, 'embedding_dim': 128, 'lr': 0.006926802971380086, 'lambda_val': 0.00020576561233050602, 'batch_size': 1424, 'optimizer': 'Adam'}.
2026-06-14 19:42:07,391 - experiment_functions - INFO - Early stopping at epoch 500. Best Metrics: (0.0005534910355260812, 7.703128139862015e-05, 0.0002539978346109459)
2026-06-14 19:42:07,482 - optuna.study.study - INFO - Trial 34 finished with values: [0.0005534910355260812, 7.703128139862015e-05, 0.0002539978346109459] and parameters: {'n_layers': 3, 'embedding_dim': 96, 'lr': 0.0005430085333326576, 'lambda_val': 1.9571836232714086e-05, 'batch_size': 4028, 'optimizer': 'SGD'}.
2026-06-14 19:42:45,761 - experiment_functions - INFO - Early stopping at epoch 1000. Best Metrics: (0.0005000787596786434, 7.53566883247371e-05, 0.0002546685084143691)
2026-06-14 19:42:45,835 - optuna.study.study - INFO - Trial 35 finished with values: [0.0005000787596786434, 7.53566883247371e-05, 0.0002546685084143691] and parameters: {'n_layers': 1, 'embedding_dim': 32, 'lr': 3.5817665543735086e-05, 'lambda_val': 0.0011144458959468084, 'batch_size': 2490, 'optimizer': 'Adam'}.
2026-06-14 19:43:08,830 - experiment_functions - INFO - Early stopping at epoch 500. Best Metrics: (0.0005355001748962576, 6.0285350659789674e-05, 0.00021438781170248002)
2026-06-14 19:43:08,919 - optuna.study.study - INFO - Trial 36 finished with values: [0.0005355001748962576, 6.0285350659789674e-05, 0.00021438781170248002] and parameters: {'n_layers': 4, 'embedding_dim': 64, 'lr': 2.4865190177684578e-05, 'lambda_val': 0.0023395218378023104, 'batch_size': 2461, 'optimizer': 'RMSprop'}.
2026-06-14 19:45:53,338 - optuna.study.study - INFO - Trial 37 finished with values: [0.08871203718106514, 0.011281733538750085, 0.0495040563456296] and parameters: {'n_layers': 1, 'embedding_dim': 96, 'lr': 0.000567654585955759, 'lambda_val': 3.246247535060975e-06, 'batch_size': 3910, 'optimizer': 'RMSprop'}.
2026-06-14 19:46:13,514 - experiment_functions - INFO - Early stopping at epoch 500. Best Metrics: (0.0002687749126306027, 5.191238529037444e-05, 0.00015593494626367667)
2026-06-14 19:46:13,635 - optuna.study.study - INFO - Trial 38 finished with values: [0.0002687749126306027, 5.191238529037444e-05, 0.00015593494626367667] and parameters: {'n_layers': 1, 'embedding_dim': 32, 'lr': 0.04210231197492228, 'lambda_val': 6.866848182154158e-05, 'batch_size': 564, 'optimizer': 'SGD'}.
2026-06-14 19:47:35,654 - experiment_functions - INFO - Early stopping at epoch 2050. Best Metrics: (0.000479997667154679, 6.698372295532186e-05, 0.0002255149805037333)
2026-06-14 19:47:35,738 - optuna.study.study - INFO - Trial 39 finished with values: [0.000479997667154679, 6.698372295532186e-05, 0.0002255149805037333] and parameters: {'n_layers': 1, 'embedding_dim': 128, 'lr': 0.0001175793954515974, 'lambda_val': 3.666723045410764e-06, 'batch_size': 1651, 'optimizer': 'RMSprop'}.
2026-06-14 19:48:24,409 - experiment_functions - INFO - Early stopping at epoch 1100. Best Metrics: (0.0005399967668545429, 8.707883984191843e-05, 0.00023842289845572192)
