2026-06-14 13:14:50,921 - optuna.study.study - INFO - Trial 85 finished with values: [0.0003171312122074203, 6.530912988143882e-05, 0.00017035452006356416] and parameters: {'n_layers': 1, 'embedding_dim': 32, 'lr': 0.0037253273874735546, 'lambda_val': 0.00017859500187129105, 'batch_size': 2199, 'optimizer': 'SGD'}.
2026-06-14 13:15:18,245 - experiment_functions - INFO - Early stopping at epoch 550. Best Metrics: (0.018580814862605308, 0.002136780762274767, 0.008091683295686235)
2026-06-14 13:15:18,315 - optuna.study.study - INFO - Trial 86 finished with values: [0.018580814862605308, 0.002136780762274767, 0.008091683295686235] and parameters: {'n_layers': 4, 'embedding_dim': 96, 'lr': 0.014831110208259727, 'lambda_val': 0.004674017637886118, 'batch_size': 3157, 'optimizer': 'Adam'}.
2026-06-14 13:19:03,086 - optuna.study.study - INFO - Trial 87 finished with values: [0.03420317496720238, 0.00400730122580213, 0.01548085382926754] and parameters: {'n_layers': 3, 'embedding_dim': 256, 'lr': 0.018731600212785728, 'lambda_val': 0.0013194076641425067, 'batch_size': 3044, 'optimizer': 'RMSprop'}.
2026-06-14 13:21:58,882 - optuna.study.study - INFO - Trial 88 finished with values: [0.03612515584390828, 0.004263513966106237, 0.016640974516312582] and parameters: {'n_layers': 3, 'embedding_dim': 96, 'lr': 0.049137531063899446, 'lambda_val': 0.0009668484743513772, 'batch_size': 2658, 'optimizer': 'RMSprop'}.
2026-06-14 13:22:24,824 - experiment_functions - INFO - Early stopping at epoch 500. Best Metrics: (0.0004431831564541826, 6.0285350659789674e-05, 0.00020050418674355834)
2026-06-14 13:22:24,905 - optuna.study.study - INFO - Trial 89 finished with values: [0.0004431831564541826, 6.0285350659789674e-05, 0.00020050418674355834] and parameters: {'n_layers': 4, 'embedding_dim': 128, 'lr': 0.04590943204225566, 'lambda_val': 0.00017639997626705723, 'batch_size': 1881, 'optimizer': 'SGD'}.
2026-06-14 13:22:46,610 - experiment_functions - INFO - Early stopping at epoch 500. Best Metrics: (0.0004941645368227412, 8.707883984191843e-05, 0.00027722649877726465)
2026-06-14 13:22:46,744 - optuna.study.study - INFO - Trial 90 finished with values: [0.0004941645368227412, 8.707883984191843e-05, 0.00027722649877726465] and parameters: {'n_layers': 1, 'embedding_dim': 128, 'lr': 0.07150156349318315, 'lambda_val': 1.4115736549435582e-06, 'batch_size': 2981, 'optimizer': 'SGD'}.
2026-06-14 13:23:09,092 - experiment_functions - INFO - Early stopping at epoch 500. Best Metrics: (0.0006056788749985621, 9.210261906356756e-05, 0.00025728446846594186)
2026-06-14 13:23:09,182 - optuna.study.study - INFO - Trial 91 finished with values: [0.0006056788749985621, 9.210261906356756e-05, 0.00025728446846594186] and parameters: {'n_layers': 3, 'embedding_dim': 64, 'lr': 0.0006101102889837555, 'lambda_val': 0.02960094540818141, 'batch_size': 2335, 'optimizer': 'SGD'}.
2026-06-14 13:26:10,218 - optuna.study.study - INFO - Trial 92 finished with values: [0.000692633938321872, 0.00011889610824569631, 0.00038977042765796894] and parameters: {'n_layers': 3, 'embedding_dim': 128, 'lr': 9.576339362174683e-05, 'lambda_val': 0.00011547624482479541, 'batch_size': 948, 'optimizer': 'Adam'}.
2026-06-14 13:28:15,661 - experiment_functions - INFO - Early stopping at epoch 2950. Best Metrics: (0.052294566595650856, 0.0055696965637350125, 0.02425072970046443)
2026-06-14 13:28:15,745 - optuna.study.study - INFO - Trial 93 finished with values: [0.052294566595650856, 0.0055696965637350125, 0.02425072970046443] and parameters: {'n_layers': 2, 'embedding_dim': 96, 'lr': 0.014831110208259727, 'lambda_val': 5.588502828653658e-06, 'batch_size': 3193, 'optimizer': 'RMSprop'}.
2026-06-14 13:28:42,875 - experiment_functions - INFO - Early stopping at epoch 550. Best Metrics: (0.012137322094243584, 0.0013614441690669163, 0.005848239677732061)
2026-06-14 13:28:42,970 - optuna.study.study - INFO - Trial 94 finished with values: [0.012137322094243584, 0.0013614441690669163, 0.005848239677732061] and parameters: {'n_layers': 3, 'embedding_dim': 128, 'lr': 0.04590943204225566, 'lambda_val': 0.02204357884427882, 'batch_size': 1332, 'optimizer': 'Adam'}.
2026-06-14 13:29:11,320 - experiment_functions - INFO - Early stopping at epoch 600. Best Metrics: (0.03871796664301753, 0.0044025051912385295, 0.018577929612583886)
2026-06-14 13:29:11,472 - optuna.study.study - INFO - Trial 95 finished with values: [0.03871796664301753, 0.0044025051912385295, 0.018577929612583886] and parameters: {'n_layers': 2, 'embedding_dim': 128, 'lr': 0.02165852287791423, 'lambda_val': 8.380696475709368e-06, 'batch_size': 3310, 'optimizer': 'RMSprop'}.
2026-06-14 13:29:33,050 - experiment_functions - INFO - Early stopping at epoch 500. Best Metrics: (0.0006354015063579704, 8.540424676803538e-05, 0.00032049694901767415)
2026-06-14 13:29:33,139 - optuna.study.study - INFO - Trial 96 finished with values: [0.0006354015063579704, 8.540424676803538e-05, 0.00032049694901767415] and parameters: {'n_layers': 1, 'embedding_dim': 128, 'lr': 0.00021462964196250622, 'lambda_val': 8.370672115052058e-06, 'batch_size': 1333, 'optimizer': 'SGD'}.
2026-06-14 13:30:02,596 - experiment_functions - INFO - Early stopping at epoch 650. Best Metrics: (0.007960549817963822, 0.0009645656105566349, 0.003479698559616312)
2026-06-14 13:30:02,691 - optuna.study.study - INFO - Trial 97 finished with values: [0.007960549817963822, 0.0009645656105566349, 0.003479698559616312] and parameters: {'n_layers': 4, 'embedding_dim': 64, 'lr': 0.04590943204225566, 'lambda_val': 0.02204357884427882, 'batch_size': 3614, 'optimizer': 'Adam'}.
2026-06-14 13:32:28,107 - optuna.study.study - INFO - Trial 98 finished with values: [0.003719504133211886, 0.0006279724027061425, 0.0021729350560694962] and parameters: {'n_layers': 1, 'embedding_dim': 32, 'lr': 0.00031066851934467485, 'lambda_val': 3.208362424362608e-06, 'batch_size': 2290, 'optimizer': 'RMSprop'}.
2026-06-14 13:32:54,810 - experiment_functions - INFO - Early stopping at epoch 650. Best Metrics: (0.04883970622788857, 0.006097193382008172, 0.02488342457236293)
2026-06-14 13:32:54,889 - optuna.study.study - INFO - Trial 99 finished with values: [0.04883970622788857, 0.006097193382008172, 0.02488342457236293] and parameters: {'n_layers': 1, 'embedding_dim': 32, 'lr': 0.012247370054838723, 'lambda_val': 2.6136942653041923e-05, 'batch_size': 1311, 'optimizer': 'Adam'}.
2026-06-14 13:34:30,389 - experiment_functions - INFO - Early stopping at epoch 2150. Best Metrics: (0.05323491196160749, 0.005949829191506465, 0.025826582952333345)
2026-06-14 13:34:30,485 - optuna.study.study - INFO - Trial 100 finished with values: [0.05323491196160749, 0.005949829191506465, 0.025826582952333345] and parameters: {'n_layers': 2, 'embedding_dim': 128, 'lr': 0.014831110208259727, 'lambda_val': 5.588502828653658e-06, 'batch_size': 1311, 'optimizer': 'RMSprop'}.
2026-06-14 13:35:10,911 - experiment_functions - INFO - Early stopping at epoch 1000. Best Metrics: (0.03975844981430493, 0.004692209793020297, 0.0181818242536935)
2026-06-14 13:35:11,248 - optuna.study.study - INFO - Trial 101 finished with values: [0.03975844981430493, 0.004692209793020297, 0.0181818242536935] and parameters: {'n_layers': 2, 'embedding_dim': 32, 'lr': 0.005879499031446108, 'lambda_val': 1.4115736549435582e-06, 'batch_size': 1332, 'optimizer': 'Adam'}.
2026-06-14 13:35:43,432 - experiment_functions - INFO - Early stopping at epoch 500. Best Metrics: (0.00036425593563730105, 8.205506062026927e-05, 0.00022443859386506905)
2026-06-14 13:35:43,508 - optuna.study.study - INFO - Trial 102 finished with values: [0.00036425593563730105, 8.205506062026927e-05, 0.00022443859386506905] and parameters: {'n_layers': 4, 'embedding_dim': 256, 'lr': 0.07596181261878349, 'lambda_val': 1.5795601920073992e-05, 'batch_size': 1536, 'optimizer': 'SGD'}.
2026-06-14 13:36:08,366 - experiment_functions - INFO - Early stopping at epoch 550. Best Metrics: (0.024689887404484814, 0.0029472838100341623, 0.01052632212405716)
2026-06-14 13:36:08,451 - optuna.study.study - INFO - Trial 103 finished with values: [0.024689887404484814, 0.0029472838100341623, 0.01052632212405716] and parameters: {'n_layers': 2, 'embedding_dim': 96, 'lr': 0.014831110208259727, 'lambda_val': 0.00753689598613855, 'batch_size': 3193, 'optimizer': 'Adam'}.
2026-06-14 13:39:14,167 - optuna.study.study - INFO - Trial 104 finished with values: [0.0350550666623172, 0.004102753031013464, 0.016147040158091295] and parameters: {'n_layers': 3, 'embedding_dim': 128, 'lr': 0.02165852287791423, 'lambda_val': 0.0009668484743513772, 'batch_size': 2658, 'optimizer': 'RMSprop'}.
2026-06-14 13:42:18,833 - optuna.study.study - INFO - Trial 105 finished with values: [0.029875737850807136, 0.00324871056333311, 0.013131252229783561] and parameters: {'n_layers': 4, 'embedding_dim': 96, 'lr': 0.010172587367677177, 'lambda_val': 0.00011547624482479541, 'batch_size': 1409, 'optimizer': 'Adam'}.
2026-06-14 13:44:41,466 - experiment_functions - INFO - Early stopping at epoch 3350. Best Metrics: (0.0538226096186334, 0.005795766628709224, 0.024757853979507086)
2026-06-14 13:44:41,540 - optuna.study.study - INFO - Trial 106 finished with values: [0.0538226096186334, 0.005795766628709224, 0.024757853979507086] and parameters: {'n_layers': 2, 'embedding_dim': 96, 'lr': 0.012247370054838723, 'lambda_val': 5.849681189534656e-05, 'batch_size': 2903, 'optimizer': 'RMSprop'}.
2026-06-14 13:46:10,703 - experiment_functions - INFO - Early stopping at epoch 2000. Best Metrics: (0.03891290785802407, 0.004032420121910376, 0.01760290978721745)
2026-06-14 13:46:10,771 - optuna.study.study - INFO - Trial 107 finished with values: [0.03891290785802407, 0.004032420121910376, 0.01760290978721745] and parameters: {'n_layers': 2, 'embedding_dim': 128, 'lr': 0.02165852287791423, 'lambda_val': 2.0680038613717084e-05, 'batch_size': 3193, 'optimizer': 'Adam'}.
2026-06-14 13:46:37,665 - experiment_functions - INFO - Early stopping at epoch 600. Best Metrics: (0.05930165948492027, 0.007721548663674728, 0.029516036551145135)
2026-06-14 13:46:37,742 - optuna.study.study - INFO - Trial 108 finished with values: [0.05930165948492027, 0.007721548663674728, 0.029516036551145135] and parameters: {'n_layers': 1, 'embedding_dim': 128, 'lr': 0.0059087621734932, 'lambda_val': 0.008715403724269365, 'batch_size': 3602, 'optimizer': 'Adam'}.
2026-06-14 13:48:38,136 - experiment_functions - INFO - Early stopping at epoch 2700. Best Metrics: (0.03600095502514171, 0.003906825641369147, 0.016356567514624124)
2026-06-14 13:48:38,242 - optuna.study.study - INFO - Trial 109 finished with values: [0.03600095502514171, 0.003906825641369147, 0.016356567514624124] and parameters: {'n_layers': 3, 'embedding_dim': 96, 'lr': 0.012247370054838723, 'lambda_val': 2.6136942653041923e-05, 'batch_size': 2658, 'optimizer': 'Adam'}.
2026-06-14 13:49:05,445 - experiment_functions - INFO - Early stopping at epoch 650. Best Metrics: (0.006972187417977196, 0.0010633666019157345, 0.0037167398917654832)
2026-06-14 13:49:05,533 - optuna.study.study - INFO - Trial 110 finished with values: [0.006972187417977196, 0.0010633666019157345, 0.0037167398917654832] and parameters: {'n_layers': 1, 'embedding_dim': 96, 'lr': 0.049137531063899446, 'lambda_val': 1.4115736549435582e-06, 'batch_size': 1332, 'optimizer': 'RMSprop'}.
2026-06-14 13:51:46,814 - optuna.study.study - INFO - Trial 111 finished with values: [0.09068449452434287, 0.011462589590729452, 0.04921897345088445] and parameters: {'n_layers': 1, 'embedding_dim': 64, 'lr': 0.0009052352884581927, 'lambda_val': 2.113988332261468e-05, 'batch_size': 2722, 'optimizer': 'Adam'}.
2026-06-14 13:53:34,489 - experiment_functions - INFO - Early stopping at epoch 2300. Best Metrics: (0.03671664345885108, 0.004400830598164646, 0.016639384175674007)
2026-06-14 13:53:34,560 - optuna.study.study - INFO - Trial 112 finished with values: [0.03671664345885108, 0.004400830598164646, 0.016639384175674007] and parameters: {'n_layers': 4, 'embedding_dim': 96, 'lr': 0.0016839460476377366, 'lambda_val': 5.588502828653658e-06, 'batch_size': 3193, 'optimizer': 'RMSprop'}.
2026-06-14 13:53:56,122 - experiment_functions - INFO - Early stopping at epoch 500. Best Metrics: (0.0002440222037236452, 5.023779221649139e-05, 0.00010539818655384313)
2026-06-14 13:53:56,224 - optuna.study.study - INFO - Trial 113 finished with values: [0.0002440222037236452, 5.023779221649139e-05, 0.00010539818655384313] and parameters: {'n_layers': 2, 'embedding_dim': 64, 'lr': 0.001866327471651579, 'lambda_val': 0.0003336301702722937, 'batch_size': 3998, 'optimizer': 'SGD'}.
2026-06-14 13:54:19,375 - experiment_functions - INFO - Early stopping at epoch 500. Best Metrics: (0.000592982028847147, 0.00010717395672851496, 0.0003030905782563459)
2026-06-14 13:54:19,457 - optuna.study.study - INFO - Trial 114 finished with values: [0.000592982028847147, 0.00010717395672851496, 0.0003030905782563459] and parameters: {'n_layers': 4, 'embedding_dim': 64, 'lr': 6.56180903025342e-05, 'lambda_val': 0.017688077953229953, 'batch_size': 4053, 'optimizer': 'Adam'}.
2026-06-14 13:56:59,935 - experiment_functions - INFO - Early stopping at epoch 3800. Best Metrics: (0.04485408899250242, 0.004869716658851899, 0.021049789752950483)
2026-06-14 13:57:00,004 - optuna.study.study - INFO - Trial 115 finished with values: [0.04485408899250242, 0.004869716658851899, 0.021049789752950483] and parameters: {'n_layers': 2, 'embedding_dim': 96, 'lr': 0.019631069594048547, 'lambda_val': 0.00013893649199772526, 'batch_size': 2843, 'optimizer': 'RMSprop'}.
2026-06-14 13:57:24,250 - experiment_functions - INFO - Early stopping at epoch 550. Best Metrics: (0.03508810506174903, 0.00404581686650144, 0.015596653848327742)
2026-06-14 13:57:24,346 - optuna.study.study - INFO - Trial 116 finished with values: [0.03508810506174903, 0.00404581686650144, 0.015596653848327742] and parameters: {'n_layers': 2, 'embedding_dim': 64, 'lr': 0.02165852287791423, 'lambda_val': 8.380696475709368e-06, 'batch_size': 3310, 'optimizer': 'Adam'}.
2026-06-14 13:57:47,731 - experiment_functions - INFO - Early stopping at epoch 500. Best Metrics: (0.000532717105275599, 8.372965369415233e-05, 0.0002552913477722349)
2026-06-14 13:57:47,798 - optuna.study.study - INFO - Trial 117 finished with values: [0.000532717105275599, 8.372965369415233e-05, 0.0002552913477722349] and parameters: {'n_layers': 2, 'embedding_dim': 128, 'lr': 0.0012526785301606343, 'lambda_val': 0.00851359441108956, 'batch_size': 2843, 'optimizer': 'SGD'}.
2026-06-14 14:00:37,213 - optuna.study.study - INFO - Trial 118 finished with values: [0.041612436336776325, 0.004437671645790074, 0.01888935118044264] and parameters: {'n_layers': 2, 'embedding_dim': 96, 'lr': 0.014831110208259727, 'lambda_val': 5.588502828653658e-06, 'batch_size': 3193, 'optimizer': 'Adam'}.
2026-06-14 14:02:24,062 - experiment_functions - INFO - Early stopping at epoch 2500. Best Metrics: (0.04829265220994624, 0.005640029472838101, 0.021924522950867116)
2026-06-14 14:02:24,156 - optuna.study.study - INFO - Trial 119 finished with values: [0.04829265220994624, 0.005640029472838101, 0.021924522950867116] and parameters: {'n_layers': 2, 'embedding_dim': 96, 'lr': 0.0027400782207211267, 'lambda_val': 5.588502828653658e-06, 'batch_size': 3193, 'optimizer': 'RMSprop'}.
2026-06-14 14:05:13,771 - optuna.study.study - INFO - Trial 120 finished with values: [0.05095864990224295, 0.005470895572375913, 0.02431828796647789] and parameters: {'n_layers': 2, 'embedding_dim': 96, 'lr': 0.014831110208259727, 'lambda_val': 5.588502828653658e-06, 'batch_size': 2879, 'optimizer': 'RMSprop'}.
2026-06-14 14:05:39,013 - experiment_functions - INFO - Early stopping at epoch 550. Best Metrics: (0.040366242326255436, 0.00466709089691205, 0.01725818694075895)
2026-06-14 14:05:39,104 - optuna.study.study - INFO - Trial 121 finished with values: [0.040366242326255436, 0.00466709089691205, 0.01725818694075895] and parameters: {'n_layers': 2, 'embedding_dim': 96, 'lr': 0.014831110208259727, 'lambda_val': 5.588502828653658e-06, 'batch_size': 3193, 'optimizer': 'Adam'}.
2026-06-14 14:06:03,264 - experiment_functions - INFO - Early stopping at epoch 550. Best Metrics: (0.024987271871506483, 0.0028953714247437873, 0.010973076140146965)
2026-06-14 14:06:03,338 - optuna.study.study - INFO - Trial 122 finished with values: [0.024987271871506483, 0.0028953714247437873, 0.010973076140146965] and parameters: {'n_layers': 2, 'embedding_dim': 64, 'lr': 0.017010979332815413, 'lambda_val': 0.00469210851629563, 'batch_size': 2722, 'optimizer': 'Adam'}.
2026-06-14 14:08:16,713 - experiment_functions - INFO - Early stopping at epoch 3200. Best Metrics: (0.10128201615271509, 0.012157545716390918, 0.05529219172864052)
2026-06-14 14:08:16,805 - optuna.study.study - INFO - Trial 123 finished with values: [0.10128201615271509, 0.012157545716390918, 0.05529219172864052] and parameters: {'n_layers': 1, 'embedding_dim': 96, 'lr': 0.001866327471651579, 'lambda_val': 5.9543267651607335e-05, 'batch_size': 1532, 'optimizer': 'Adam'}.
2026-06-14 14:09:20,684 - experiment_functions - INFO - Early stopping at epoch 1600. Best Metrics: (0.011802500945312662, 0.0015389510348985198, 0.005188809051692736)
2026-06-14 14:09:20,760 - optuna.study.study - INFO - Trial 124 finished with values: [0.011802500945312662, 0.0015389510348985198, 0.005188809051692736] and parameters: {'n_layers': 1, 'embedding_dim': 96, 'lr': 0.014831110208259727, 'lambda_val': 0.055178084952141014, 'batch_size': 1067, 'optimizer': 'Adam'}.
2026-06-14 14:09:46,644 - experiment_functions - INFO - Early stopping at epoch 500. Best Metrics: (0.0004401909426586185, 7.033290910308795e-05, 0.00019613904271169853)
2026-06-14 14:09:46,724 - optuna.study.study - INFO - Trial 125 finished with values: [0.0004401909426586185, 7.033290910308795e-05, 0.00019613904271169853] and parameters: {'n_layers': 4, 'embedding_dim': 128, 'lr': 0.012270542303638348, 'lambda_val': 0.00011547624482479541, 'batch_size': 1409, 'optimizer': 'SGD'}.
2026-06-14 14:10:19,368 - experiment_functions - INFO - Early stopping at epoch 800. Best Metrics: (0.0005975448946212899, 8.875343291580147e-05, 0.00025101393736816455)
2026-06-14 14:10:19,456 - optuna.study.study - INFO - Trial 126 finished with values: [0.0005975448946212899, 8.875343291580147e-05, 0.00025101393736816455] and parameters: {'n_layers': 1, 'embedding_dim': 96, 'lr': 1.2447740749051395e-05, 'lambda_val': 2.113988332261468e-05, 'batch_size': 3749, 'optimizer': 'RMSprop'}.
2026-06-14 14:13:12,127 - optuna.study.study - INFO - Trial 127 finished with values: [0.03065954936852416, 0.0032805278317368882, 0.013814983287775159] and parameters: {'n_layers': 4, 'embedding_dim': 64, 'lr': 0.017010979332815413, 'lambda_val': 4.530416824267587e-06, 'batch_size': 3722, 'optimizer': 'Adam'}.
2026-06-14 14:15:57,600 - experiment_functions - INFO - Early stopping at epoch 3500. Best Metrics: (0.10910229269119748, 0.013215888539085003, 0.0592533348031203)
2026-06-14 14:15:57,673 - optuna.study.study - INFO - Trial 128 finished with values: [0.10910229269119748, 0.013215888539085003, 0.0592533348031203] and parameters: {'n_layers': 1, 'embedding_dim': 256, 'lr': 0.0009052352884581927, 'lambda_val': 1.2588658448852132e-05, 'batch_size': 3521, 'optimizer': 'RMSprop'}.
2026-06-14 14:16:48,440 - experiment_functions - INFO - Early stopping at epoch 1050. Best Metrics: (0.036264964208493816, 0.0044694889141938515, 0.017255095206688997)
2026-06-14 14:16:48,515 - optuna.study.study - INFO - Trial 129 finished with values: [0.036264964208493816, 0.0044694889141938515, 0.017255095206688997] and parameters: {'n_layers': 4, 'embedding_dim': 96, 'lr': 0.0014788235272357422, 'lambda_val': 1.1933812384845947e-05, 'batch_size': 4014, 'optimizer': 'RMSprop'}.
2026-06-14 14:17:16,644 - experiment_functions - INFO - Early stopping at epoch 650. Best Metrics: (0.049291324241772835, 0.005844329827851832, 0.0235294045677945)
2026-06-14 14:17:17,338 - optuna.study.study - INFO - Trial 130 finished with values: [0.049291324241772835, 0.005844329827851832, 0.0235294045677945] and parameters: {'n_layers': 1, 'embedding_dim': 96, 'lr': 0.012247370054838723, 'lambda_val': 5.588502828653658e-06, 'batch_size': 1311, 'optimizer': 'Adam'}.
2026-06-14 14:20:00,767 - optuna.study.study - INFO - Trial 131 finished with values: [0.06929848237261473, 0.009133230624958136, 0.0367959083714293] and parameters: {'n_layers': 1, 'embedding_dim': 96, 'lr': 0.0006670220003270122, 'lambda_val': 0.00851359441108956, 'batch_size': 2658, 'optimizer': 'Adam'}.
2026-06-14 14:22:57,082 - optuna.study.study - INFO - Trial 132 finished with values: [0.04507189176592054, 0.004693884386094179, 0.020361424925397702] and parameters: {'n_layers': 2, 'embedding_dim': 128, 'lr': 0.014831110208259727, 'lambda_val': 5.588502828653658e-06, 'batch_size': 3193, 'optimizer': 'Adam'}.
2026-06-14 14:24:31,158 - experiment_functions - INFO - Early stopping at epoch 2400. Best Metrics: (0.044475041604977034, 0.005320182195726439, 0.020717277005251465)
2026-06-14 14:24:31,244 - optuna.study.study - INFO - Trial 133 finished with values: [0.044475041604977034, 0.005320182195726439, 0.020717277005251465] and parameters: {'n_layers': 2, 'embedding_dim': 32, 'lr': 0.0026515351587830605, 'lambda_val': 0.0001732532813523183, 'batch_size': 1772, 'optimizer': 'RMSprop'}.
2026-06-14 14:25:12,630 - experiment_functions - INFO - Early stopping at epoch 1000. Best Metrics: (0.02921920459652555, 0.003645589121843392, 0.013470610477513847)
