2026-06-15 03:59:49,664 - optuna.study.study - INFO - Trial 44 finished with values: [0.011141926164044488, 0.0013631187621407997, 0.005073722603828216] and parameters: {'n_layers': 3, 'embedding_dim': 96, 'lr': 0.008348690425646019, 'lambda_val': 0.031398699991095395, 'batch_size': 3062, 'optimizer': 'Adam'}.
2026-06-15 04:02:09,729 - experiment_functions - INFO - Early stopping at epoch 3600. Best Metrics: (0.0007315692834726883, 8.372965369415234e-05, 0.000317106098662942)
2026-06-15 04:02:09,803 - optuna.study.study - INFO - Trial 45 finished with values: [0.0007315692834726883, 8.372965369415234e-05, 0.000317106098662942] and parameters: {'n_layers': 1, 'embedding_dim': 96, 'lr': 0.00011664800734905223, 'lambda_val': 9.6400083899255e-06, 'batch_size': 2304, 'optimizer': 'Adam'}.
2026-06-15 04:02:45,647 - experiment_functions - INFO - Early stopping at epoch 550. Best Metrics: (0.0003374908287832559, 5.861075758590662e-05, 0.00014522123541176995)
2026-06-15 04:02:45,749 - optuna.study.study - INFO - Trial 46 finished with values: [0.0003374908287832559, 5.861075758590662e-05, 0.00014522123541176995] and parameters: {'n_layers': 4, 'embedding_dim': 256, 'lr': 0.00014986722215759026, 'lambda_val': 0.09109541950540113, 'batch_size': 1194, 'optimizer': 'RMSprop'}.
2026-06-15 04:03:07,198 - experiment_functions - INFO - Early stopping at epoch 500. Best Metrics: (0.0003023306073399209, 4.8563199142608344e-05, 0.00015024248017390569)
2026-06-15 04:03:08,215 - optuna.study.study - INFO - Trial 47 finished with values: [0.0003023306073399209, 4.8563199142608344e-05, 0.00015024248017390569] and parameters: {'n_layers': 4, 'embedding_dim': 32, 'lr': 0.00015524719199856704, 'lambda_val': 0.0008872315396352226, 'batch_size': 1021, 'optimizer': 'SGD'}.
2026-06-15 04:03:31,749 - experiment_functions - INFO - Early stopping at epoch 500. Best Metrics: (0.0005224955537186116, 8.038046754638624e-05, 0.0002498311417481824)
2026-06-15 04:03:31,838 - optuna.study.study - INFO - Trial 48 finished with values: [0.0005224955537186116, 8.038046754638624e-05, 0.0002498311417481824] and parameters: {'n_layers': 3, 'embedding_dim': 96, 'lr': 0.008659240096051431, 'lambda_val': 2.1440662329192717e-05, 'batch_size': 3406, 'optimizer': 'SGD'}.
2026-06-15 04:04:01,232 - experiment_functions - INFO - Early stopping at epoch 500. Best Metrics: (0.00048814243825771566, 8.038046754638624e-05, 0.00021069635576344577)
2026-06-15 04:04:01,303 - optuna.study.study - INFO - Trial 49 finished with values: [0.00048814243825771566, 8.038046754638624e-05, 0.00021069635576344577] and parameters: {'n_layers': 3, 'embedding_dim': 256, 'lr': 0.00014910539373746995, 'lambda_val': 2.480647699607947e-05, 'batch_size': 1850, 'optimizer': 'SGD'}.
2026-06-15 04:04:24,425 - experiment_functions - INFO - Early stopping at epoch 550. Best Metrics: (0.000657790720710816, 6.865831602920491e-05, 0.0002769322730684037)
2026-06-15 04:04:24,491 - optuna.study.study - INFO - Trial 50 finished with values: [0.000657790720710816, 6.865831602920491e-05, 0.0002769322730684037] and parameters: {'n_layers': 1, 'embedding_dim': 64, 'lr': 2.757727319834325e-05, 'lambda_val': 0.0020014727227486086, 'batch_size': 1634, 'optimizer': 'Adam'}.
2026-06-15 04:07:21,877 - optuna.study.study - INFO - Trial 51 finished with values: [0.0007384598148414744, 0.00010884854980239801, 0.00042686338841806354] and parameters: {'n_layers': 1, 'embedding_dim': 256, 'lr': 0.00011578403367076658, 'lambda_val': 0.0005879769412094223, 'batch_size': 4032, 'optimizer': 'RMSprop'}.
2026-06-15 04:07:45,341 - experiment_functions - INFO - Early stopping at epoch 550. Best Metrics: (0.023671861598594433, 0.0028685779355616587, 0.011180371740953743)
2026-06-15 04:07:45,441 - optuna.study.study - INFO - Trial 52 finished with values: [0.023671861598594433, 0.0028685779355616587, 0.011180371740953743] and parameters: {'n_layers': 3, 'embedding_dim': 32, 'lr': 0.0467259088974229, 'lambda_val': 0.00010936849207517709, 'batch_size': 1383, 'optimizer': 'Adam'}.
2026-06-15 04:10:33,717 - optuna.study.study - INFO - Trial 53 finished with values: [0.09641482201038866, 0.011956594547524952, 0.05307214358357413] and parameters: {'n_layers': 1, 'embedding_dim': 96, 'lr': 0.0013635493562820199, 'lambda_val': 0.00036402541279450417, 'batch_size': 1670, 'optimizer': 'Adam'}.
2026-06-15 04:13:10,884 - optuna.study.study - INFO - Trial 54 finished with values: [0.022493111683989136, 0.003149909571974011, 0.010793654032963876] and parameters: {'n_layers': 3, 'embedding_dim': 32, 'lr': 0.00042036659412149157, 'lambda_val': 0.01679036251486879, 'batch_size': 1198, 'optimizer': 'RMSprop'}.
2026-06-15 04:13:47,237 - experiment_functions - INFO - Early stopping at epoch 650. Best Metrics: (0.07443694254779347, 0.009203563534061222, 0.03895785118606846)
2026-06-15 04:13:48,174 - optuna.study.study - INFO - Trial 55 finished with values: [0.07443694254779347, 0.009203563534061222, 0.03895785118606846] and parameters: {'n_layers': 2, 'embedding_dim': 256, 'lr': 0.002500554323958941, 'lambda_val': 4.1441541348192956e-05, 'batch_size': 3067, 'optimizer': 'Adam'}.
2026-06-15 04:14:17,380 - experiment_functions - INFO - Early stopping at epoch 550. Best Metrics: (0.02827440679122013, 0.00318842521267332, 0.012759269147477518)
2026-06-15 04:14:17,455 - optuna.study.study - INFO - Trial 56 finished with values: [0.02827440679122013, 0.00318842521267332, 0.012759269147477518] and parameters: {'n_layers': 4, 'embedding_dim': 128, 'lr': 0.0570467104634475, 'lambda_val': 4.768107725372831e-05, 'batch_size': 2519, 'optimizer': 'Adam'}.
2026-06-15 04:15:07,392 - experiment_functions - INFO - Early stopping at epoch 1200. Best Metrics: (0.038289845761811, 0.004544845602518588, 0.018346291689879193)
2026-06-15 04:15:07,476 - optuna.study.study - INFO - Trial 57 finished with values: [0.038289845761811, 0.004544845602518588, 0.018346291689879193] and parameters: {'n_layers': 1, 'embedding_dim': 96, 'lr': 0.015674606313953, 'lambda_val': 1.2492162876084175e-05, 'batch_size': 3852, 'optimizer': 'RMSprop'}.
2026-06-15 04:15:33,509 - experiment_functions - INFO - Early stopping at epoch 500. Best Metrics: (0.0005122157709240634, 6.0285350659789674e-05, 0.00020109073541684796)
2026-06-15 04:15:33,840 - optuna.study.study - INFO - Trial 58 finished with values: [0.0005122157709240634, 6.0285350659789674e-05, 0.00020109073541684796] and parameters: {'n_layers': 4, 'embedding_dim': 128, 'lr': 0.00042036659412149157, 'lambda_val': 0.01679036251486879, 'batch_size': 795, 'optimizer': 'SGD'}.
2026-06-15 04:18:49,732 - optuna.study.study - INFO - Trial 59 finished with values: [0.015587516407148673, 0.002319311407328019, 0.007571503701855108] and parameters: {'n_layers': 4, 'embedding_dim': 128, 'lr': 0.00011578403367076658, 'lambda_val': 0.0005879769412094223, 'batch_size': 2519, 'optimizer': 'RMSprop'}.
2026-06-15 04:19:54,245 - experiment_functions - INFO - Early stopping at epoch 1550. Best Metrics: (0.040358488822572716, 0.004794359970527162, 0.01850789975477966)
2026-06-15 04:19:54,353 - optuna.study.study - INFO - Trial 60 finished with values: [0.040358488822572716, 0.004794359970527162, 0.01850789975477966] and parameters: {'n_layers': 4, 'embedding_dim': 32, 'lr': 0.0017811250463150633, 'lambda_val': 4.057584482779664e-06, 'batch_size': 1634, 'optimizer': 'Adam'}.
2026-06-15 04:20:20,514 - experiment_functions - INFO - Early stopping at epoch 600. Best Metrics: (0.0004976357181834401, 8.205506062026927e-05, 0.0002471586251269067)
2026-06-15 04:20:20,592 - optuna.study.study - INFO - Trial 61 finished with values: [0.0004976357181834401, 8.205506062026927e-05, 0.0002471586251269067] and parameters: {'n_layers': 3, 'embedding_dim': 64, 'lr': 2.5126473577669274e-05, 'lambda_val': 0.002800447938249155, 'batch_size': 1243, 'optimizer': 'RMSprop'}.
2026-06-15 04:21:29,923 - experiment_functions - INFO - Early stopping at epoch 1350. Best Metrics: (0.037366734623611605, 0.004300355013731665, 0.017373718117474613)
2026-06-15 04:21:30,014 - optuna.study.study - INFO - Trial 62 finished with values: [0.037366734623611605, 0.004300355013731665, 0.017373718117474613] and parameters: {'n_layers': 4, 'embedding_dim': 128, 'lr': 0.0016188619661959155, 'lambda_val': 1.2492162876084175e-05, 'batch_size': 4084, 'optimizer': 'RMSprop'}.
2026-06-15 04:22:15,130 - experiment_functions - INFO - Early stopping at epoch 1100. Best Metrics: (0.020191305955270415, 0.002243954719003282, 0.008896970529157121)
2026-06-15 04:22:15,204 - optuna.study.study - INFO - Trial 63 finished with values: [0.020191305955270415, 0.002243954719003282, 0.008896970529157121] and parameters: {'n_layers': 4, 'embedding_dim': 32, 'lr': 0.01930529051255257, 'lambda_val': 0.0020014727227486086, 'batch_size': 1392, 'optimizer': 'RMSprop'}.
2026-06-15 04:25:22,164 - optuna.study.study - INFO - Trial 64 finished with values: [0.034318088430335694, 0.003720945810168129, 0.015544729144669771] and parameters: {'n_layers': 4, 'embedding_dim': 96, 'lr': 0.01930529051255257, 'lambda_val': 4.057584482779664e-06, 'batch_size': 1464, 'optimizer': 'Adam'}.
2026-06-15 04:26:40,696 - experiment_functions - INFO - Early stopping at epoch 1900. Best Metrics: (0.03277592698207644, 0.003519994641302164, 0.014818137474106399)
2026-06-15 04:26:40,776 - optuna.study.study - INFO - Trial 65 finished with values: [0.03277592698207644, 0.003519994641302164, 0.014818137474106399] and parameters: {'n_layers': 2, 'embedding_dim': 64, 'lr': 0.02053638603841251, 'lambda_val': 0.00021635586405720778, 'batch_size': 2769, 'optimizer': 'Adam'}.
2026-06-15 04:27:04,150 - experiment_functions - INFO - Early stopping at epoch 500. Best Metrics: (0.000389363578764675, 6.86583160292049e-05, 0.00024390279794547646)
2026-06-15 04:27:04,268 - optuna.study.study - INFO - Trial 66 finished with values: [0.000389363578764675, 6.86583160292049e-05, 0.00024390279794547646] and parameters: {'n_layers': 4, 'embedding_dim': 64, 'lr': 0.0003369639729525215, 'lambda_val': 1.9818721188201124e-05, 'batch_size': 2358, 'optimizer': 'SGD'}.
2026-06-15 04:27:30,529 - experiment_functions - INFO - Early stopping at epoch 500. Best Metrics: (0.0003590303493001192, 5.3586978364257486e-05, 0.0002159953938930424)
2026-06-15 04:27:31,346 - optuna.study.study - INFO - Trial 67 finished with values: [0.0003590303493001192, 5.3586978364257486e-05, 0.0002159953938930424] and parameters: {'n_layers': 4, 'embedding_dim': 128, 'lr': 1.9451816546339916e-05, 'lambda_val': 2.389407494837916e-05, 'batch_size': 3327, 'optimizer': 'SGD'}.
2026-06-15 04:27:55,145 - experiment_functions - INFO - Early stopping at epoch 500. Best Metrics: (0.00031967474515762326, 6.0285350659789674e-05, 0.0001414588327464919)
2026-06-15 04:27:55,235 - optuna.study.study - INFO - Trial 68 finished with values: [0.00031967474515762326, 6.0285350659789674e-05, 0.0001414588327464919] and parameters: {'n_layers': 3, 'embedding_dim': 96, 'lr': 0.0001827233211888321, 'lambda_val': 0.0028417352904526183, 'batch_size': 2877, 'optimizer': 'SGD'}.
2026-06-15 04:28:24,774 - experiment_functions - INFO - Early stopping at epoch 500. Best Metrics: (0.0003937518409050127, 7.368209525085404e-05, 0.00016556788790399052)
2026-06-15 04:28:25,663 - optuna.study.study - INFO - Trial 69 finished with values: [0.0003937518409050127, 7.368209525085404e-05, 0.00016556788790399052] and parameters: {'n_layers': 3, 'embedding_dim': 256, 'lr': 0.00042036659412149157, 'lambda_val': 1.0585507479606589e-06, 'batch_size': 1850, 'optimizer': 'SGD'}.
2026-06-15 04:31:09,496 - optuna.study.study - INFO - Trial 70 finished with values: [0.03424817209804941, 0.004297005827583898, 0.01571484318983213] and parameters: {'n_layers': 1, 'embedding_dim': 128, 'lr': 0.04226961608248332, 'lambda_val': 0.0002959772395254473, 'batch_size': 3700, 'optimizer': 'RMSprop'}.
2026-06-15 04:31:31,204 - experiment_functions - INFO - Early stopping at epoch 500. Best Metrics: (0.00044468912345671735, 5.191238529037444e-05, 0.00017077671455538275)
2026-06-15 04:31:31,556 - optuna.study.study - INFO - Trial 71 finished with values: [0.00044468912345671735, 5.191238529037444e-05, 0.00017077671455538275] and parameters: {'n_layers': 4, 'embedding_dim': 32, 'lr': 0.00015524719199856704, 'lambda_val': 2.0723588130024673e-05, 'batch_size': 1021, 'optimizer': 'SGD'}.
2026-06-15 04:32:24,319 - experiment_functions - INFO - Early stopping at epoch 1250. Best Metrics: (0.0004642992122714245, 7.033290910308795e-05, 0.0001931973968878818)
2026-06-15 04:32:24,398 - optuna.study.study - INFO - Trial 72 finished with values: [0.0004642992122714245, 7.033290910308795e-05, 0.0001931973968878818] and parameters: {'n_layers': 3, 'embedding_dim': 64, 'lr': 4.0444918269626774e-05, 'lambda_val': 2.1440662329192717e-05, 'batch_size': 1383, 'optimizer': 'Adam'}.
2026-06-15 04:32:49,322 - experiment_functions - INFO - Early stopping at epoch 500. Best Metrics: (0.0005874807336563715, 7.2007502176971e-05, 0.0003006262137823354)
2026-06-15 04:32:49,426 - optuna.study.study - INFO - Trial 73 finished with values: [0.0005874807336563715, 7.2007502176971e-05, 0.0003006262137823354] and parameters: {'n_layers': 3, 'embedding_dim': 128, 'lr': 0.0031097323419541764, 'lambda_val': 3.858902904724874e-05, 'batch_size': 1198, 'optimizer': 'SGD'}.
2026-06-15 04:33:11,906 - experiment_functions - INFO - Early stopping at epoch 500. Best Metrics: (0.00035357020337821937, 7.703128139862013e-05, 0.00015700899948853215)
2026-06-15 04:33:12,005 - optuna.study.study - INFO - Trial 74 finished with values: [0.00035357020337821937, 7.703128139862013e-05, 0.00015700899948853215] and parameters: {'n_layers': 3, 'embedding_dim': 64, 'lr': 0.0002576324017575941, 'lambda_val': 1.7580082173227076e-05, 'batch_size': 2024, 'optimizer': 'SGD'}.
2026-06-15 04:34:07,987 - experiment_functions - INFO - Early stopping at epoch 1250. Best Metrics: (0.020678123276286632, 0.002515238796972336, 0.008944920315156509)
2026-06-15 04:34:08,066 - optuna.study.study - INFO - Trial 75 finished with values: [0.020678123276286632, 0.002515238796972336, 0.008944920315156509] and parameters: {'n_layers': 2, 'embedding_dim': 128, 'lr': 0.0016748417327479524, 'lambda_val': 0.018956543551892822, 'batch_size': 1243, 'optimizer': 'RMSprop'}.
2026-06-15 04:34:31,571 - experiment_functions - INFO - Early stopping at epoch 550. Best Metrics: (0.013966868000201962, 0.0016528233639225669, 0.006357494989696384)
2026-06-15 04:34:31,668 - optuna.study.study - INFO - Trial 76 finished with values: [0.013966868000201962, 0.0016528233639225669, 0.006357494989696384] and parameters: {'n_layers': 3, 'embedding_dim': 32, 'lr': 0.0467259088974229, 'lambda_val': 0.01679036251486879, 'batch_size': 1026, 'optimizer': 'Adam'}.
2026-06-15 04:35:12,250 - experiment_functions - INFO - Early stopping at epoch 900. Best Metrics: (0.09388324142459689, 0.011481010114542167, 0.050497543969371485)
2026-06-15 04:35:12,865 - optuna.study.study - INFO - Trial 77 finished with values: [0.09388324142459689, 0.011481010114542167, 0.050497543969371485] and parameters: {'n_layers': 1, 'embedding_dim': 128, 'lr': 0.0031668054510016214, 'lambda_val': 1.722502032465723e-05, 'batch_size': 2363, 'optimizer': 'Adam'}.
2026-06-15 04:37:49,170 - experiment_functions - INFO - Early stopping at epoch 3350. Best Metrics: (0.03435787480668273, 0.00354008975818876, 0.015125569744384096)
2026-06-15 04:37:49,262 - optuna.study.study - INFO - Trial 78 finished with values: [0.03435787480668273, 0.00354008975818876, 0.015125569744384096] and parameters: {'n_layers': 4, 'embedding_dim': 96, 'lr': 0.022317160745325176, 'lambda_val': 2.1444803413213676e-05, 'batch_size': 2318, 'optimizer': 'Adam'}.
2026-06-15 04:38:12,606 - experiment_functions - INFO - Early stopping at epoch 500. Best Metrics: (0.0004469365238536533, 6.698372295532186e-05, 0.00020058174228038762)
2026-06-15 04:38:12,682 - optuna.study.study - INFO - Trial 79 finished with values: [0.0004469365238536533, 6.698372295532186e-05, 0.00020058174228038762] and parameters: {'n_layers': 3, 'embedding_dim': 96, 'lr': 3.057037118096041e-05, 'lambda_val': 0.00036402541279450417, 'batch_size': 1670, 'optimizer': 'SGD'}.
2026-06-15 04:38:53,617 - experiment_functions - INFO - Early stopping at epoch 1000. Best Metrics: (0.022051654516774297, 0.002913791948556501, 0.009986454822149255)
2026-06-15 04:38:53,933 - optuna.study.study - INFO - Trial 80 finished with values: [0.022051654516774297, 0.002913791948556501, 0.009986454822149255] and parameters: {'n_layers': 2, 'embedding_dim': 64, 'lr': 0.001230678069228945, 'lambda_val': 0.03088265747581675, 'batch_size': 1670, 'optimizer': 'RMSprop'}.
2026-06-15 04:40:51,805 - experiment_functions - INFO - Early stopping at epoch 2950. Best Metrics: (0.08693763445881278, 0.01056500770312814, 0.04595397549864254)
2026-06-15 04:40:51,901 - optuna.study.study - INFO - Trial 81 finished with values: [0.08693763445881278, 0.01056500770312814, 0.04595397549864254] and parameters: {'n_layers': 1, 'embedding_dim': 64, 'lr': 0.002403322646261187, 'lambda_val': 1.2492162876084175e-05, 'batch_size': 1126, 'optimizer': 'RMSprop'}.
2026-06-15 04:44:56,074 - optuna.study.study - INFO - Trial 82 finished with values: [0.006104436798406351, 0.0007636144416906693, 0.0026495752265741066] and parameters: {'n_layers': 4, 'embedding_dim': 256, 'lr': 0.00035751122245203187, 'lambda_val': 0.07334430277784267, 'batch_size': 2363, 'optimizer': 'Adam'}.
2026-06-15 04:45:20,911 - experiment_functions - INFO - Early stopping at epoch 500. Best Metrics: (0.00046544869701101247, 7.703128139862015e-05, 0.0002154334867774352)
2026-06-15 04:45:21,347 - optuna.study.study - INFO - Trial 83 finished with values: [0.00046544869701101247, 7.703128139862015e-05, 0.0002154334867774352] and parameters: {'n_layers': 4, 'embedding_dim': 96, 'lr': 6.220636598056385e-05, 'lambda_val': 0.043451746490740836, 'batch_size': 3009, 'optimizer': 'RMSprop'}.
2026-06-15 04:46:41,284 - experiment_functions - INFO - Early stopping at epoch 2100. Best Metrics: (0.00048032048360564116, 7.2007502176971e-05, 0.00021022167572595213)
2026-06-15 04:46:41,363 - optuna.study.study - INFO - Trial 84 finished with values: [0.00048032048360564116, 7.2007502176971e-05, 0.00021022167572595213] and parameters: {'n_layers': 1, 'embedding_dim': 64, 'lr': 1.9451816546339916e-05, 'lambda_val': 2.389407494837916e-05, 'batch_size': 1634, 'optimizer': 'Adam'}.
2026-06-15 04:47:05,924 - experiment_functions - INFO - Early stopping at epoch 500. Best Metrics: (0.0005894243846371664, 7.368209525085404e-05, 0.0002715214202180275)
2026-06-15 04:47:06,776 - optuna.study.study - INFO - Trial 85 finished with values: [0.0005894243846371664, 7.368209525085404e-05, 0.0002715214202180275] and parameters: {'n_layers': 4, 'embedding_dim': 96, 'lr': 1.790939095429059e-05, 'lambda_val': 2.200390261864473e-05, 'batch_size': 2750, 'optimizer': 'SGD'}.
2026-06-15 04:47:36,937 - experiment_functions - INFO - Early stopping at epoch 550. Best Metrics: (0.03687911794913694, 0.004417576528903477, 0.017851133272081356)
2026-06-15 04:47:37,105 - optuna.study.study - INFO - Trial 86 finished with values: [0.03687911794913694, 0.004417576528903477, 0.017851133272081356] and parameters: {'n_layers': 2, 'embedding_dim': 256, 'lr': 0.0213550178381265, 'lambda_val': 0.0007531818922155074, 'batch_size': 1085, 'optimizer': 'Adam'}.
2026-06-15 04:50:26,102 - optuna.study.study - INFO - Trial 87 finished with values: [0.001199734281189267, 0.00016411012124053855, 0.0005251302076151603] and parameters: {'n_layers': 2, 'embedding_dim': 128, 'lr': 0.00011171717979509281, 'lambda_val': 0.0007419215442272931, 'batch_size': 2358, 'optimizer': 'RMSprop'}.
2026-06-15 04:51:07,880 - experiment_functions - INFO - Early stopping at epoch 900. Best Metrics: (0.05542097203245964, 0.006929466139728046, 0.026546054885651437)
2026-06-15 04:51:07,947 - optuna.study.study - INFO - Trial 88 finished with values: [0.05542097203245964, 0.006929466139728046, 0.026546054885651437] and parameters: {'n_layers': 2, 'embedding_dim': 128, 'lr': 0.0016188619661959155, 'lambda_val': 0.0036237284376758, 'batch_size': 1383, 'optimizer': 'Adam'}.
2026-06-15 04:51:30,877 - experiment_functions - INFO - Early stopping at epoch 500. Best Metrics: (0.0005282588897523879, 7.703128139862013e-05, 0.00023128698180446402)
2026-06-15 04:51:30,967 - optuna.study.study - INFO - Trial 89 finished with values: [0.0005282588897523879, 7.703128139862013e-05, 0.00023128698180446402] and parameters: {'n_layers': 2, 'embedding_dim': 128, 'lr': 0.002500554323958941, 'lambda_val': 0.003668419590828959, 'batch_size': 3067, 'optimizer': 'SGD'}.
2026-06-15 04:51:52,445 - experiment_functions - INFO - Early stopping at epoch 500. Best Metrics: (0.0005303273450164977, 7.870587447250318e-05, 0.000227297305194595)
2026-06-15 04:51:52,532 - optuna.study.study - INFO - Trial 90 finished with values: [0.0005303273450164977, 7.870587447250318e-05, 0.000227297305194595] and parameters: {'n_layers': 2, 'embedding_dim': 64, 'lr': 0.00037329899863237156, 'lambda_val': 3.789532458531003e-06, 'batch_size': 4076, 'optimizer': 'SGD'}.
2026-06-15 04:54:30,295 - optuna.study.study - INFO - Trial 91 finished with values: [0.025449311400465597, 0.0030762274767231566, 0.011496888732406212] and parameters: {'n_layers': 2, 'embedding_dim': 64, 'lr': 0.08225798167082751, 'lambda_val': 0.004367100927407441, 'batch_size': 2975, 'optimizer': 'RMSprop'}.
2026-06-15 04:57:23,911 - optuna.study.study - INFO - Trial 92 finished with values: [0.04121936082058158, 0.004901533927255676, 0.019705554852005168] and parameters: {'n_layers': 3, 'embedding_dim': 96, 'lr': 0.0016748417327479524, 'lambda_val': 3.385899724058381e-05, 'batch_size': 1243, 'optimizer': 'RMSprop'}.
2026-06-15 04:57:52,230 - experiment_functions - INFO - Early stopping at epoch 600. Best Metrics: (0.0004841776491461732, 8.372965369415233e-05, 0.00022927103525192976)
