2026-06-15 00:08:16,249 - optuna.study.study - INFO - Trial 195 finished with values: [0.0824494702049998, 0.009993971464934023, 0.04361741612006091] and parameters: {'n_layers': 2, 'embedding_dim': 64, 'lr': 0.00125444020622911, 'lambda_val': 5.779334633401426e-06, 'batch_size': 1253, 'optimizer': 'Adam'}.
2026-06-15 00:08:44,682 - experiment_functions - INFO - Early stopping at epoch 650. Best Metrics: (0.030305826290874967, 0.0038917543037041997, 0.013534102758789307)
2026-06-15 00:08:44,749 - optuna.study.study - INFO - Trial 196 finished with values: [0.030305826290874967, 0.0038917543037041997, 0.013534102758789307] and parameters: {'n_layers': 1, 'embedding_dim': 128, 'lr': 0.0029187572679997753, 'lambda_val': 0.030364284015139874, 'batch_size': 3910, 'optimizer': 'RMSprop'}.
2026-06-15 00:09:38,917 - experiment_functions - INFO - Early stopping at epoch 1000. Best Metrics: (0.07994975895063373, 0.009727711166186618, 0.04138267863617892)
2026-06-15 00:09:39,015 - optuna.study.study - INFO - Trial 197 finished with values: [0.07994975895063373, 0.009727711166186618, 0.04138267863617892] and parameters: {'n_layers': 2, 'embedding_dim': 256, 'lr': 0.0012453044445403945, 'lambda_val': 1.1527814672590544e-05, 'batch_size': 2141, 'optimizer': 'Adam'}.
2026-06-15 00:12:21,596 - optuna.study.study - INFO - Trial 198 finished with values: [0.06674709959828992, 0.008845200616250251, 0.034476345066157287] and parameters: {'n_layers': 1, 'embedding_dim': 96, 'lr': 0.000567654585955759, 'lambda_val': 0.011713830826003533, 'batch_size': 3910, 'optimizer': 'Adam'}.
2026-06-15 00:15:12,860 - optuna.study.study - INFO - Trial 199 finished with values: [0.0732923016276679, 0.009295666153124792, 0.04099786560104022] and parameters: {'n_layers': 2, 'embedding_dim': 96, 'lr': 0.0003794262448571181, 'lambda_val': 3.904381306216792e-06, 'batch_size': 3018, 'optimizer': 'RMSprop'}.
2026-06-15 00:18:40,274 - optuna.study.study - INFO - Trial 200 finished with values: [0.08189881929913657, 0.010384151651148772, 0.0456131768754409] and parameters: {'n_layers': 2, 'embedding_dim': 256, 'lr': 0.0003794262448571181, 'lambda_val': 1.0458611121108427e-05, 'batch_size': 1827, 'optimizer': 'RMSprop'}.
2026-06-15 00:20:40,373 - experiment_functions - INFO - Early stopping at epoch 3000. Best Metrics: (0.0791016458178444, 0.009593743720275974, 0.03938774862622566)
2026-06-15 00:20:40,440 - optuna.study.study - INFO - Trial 201 finished with values: [0.0791016458178444, 0.009593743720275974, 0.03938774862622566] and parameters: {'n_layers': 1, 'embedding_dim': 64, 'lr': 0.0029187572679997753, 'lambda_val': 6.351942760483931e-05, 'batch_size': 913, 'optimizer': 'RMSprop'}.
2026-06-15 00:23:45,326 - optuna.study.study - INFO - Trial 202 finished with values: [0.06804708952720503, 0.007868912854176435, 0.03221232404823505] and parameters: {'n_layers': 1, 'embedding_dim': 256, 'lr': 0.005819474259875123, 'lambda_val': 0.00020614378723959702, 'batch_size': 3878, 'optimizer': 'RMSprop'}.
2026-06-15 00:26:23,926 - optuna.study.study - INFO - Trial 203 finished with values: [0.035590502779809484, 0.005325205974948088, 0.020985810344335262] and parameters: {'n_layers': 1, 'embedding_dim': 96, 'lr': 0.0003794262448571181, 'lambda_val': 3.246247535060975e-06, 'batch_size': 3910, 'optimizer': 'Adam'}.
2026-06-15 00:27:04,028 - experiment_functions - INFO - Early stopping at epoch 900. Best Metrics: (0.09307011322591999, 0.011415700984660729, 0.049082580982233365)
2026-06-15 00:27:04,107 - optuna.study.study - INFO - Trial 204 finished with values: [0.09307011322591999, 0.011415700984660729, 0.049082580982233365] and parameters: {'n_layers': 1, 'embedding_dim': 128, 'lr': 0.0029187572679997753, 'lambda_val': 0.00012073664489097666, 'batch_size': 2579, 'optimizer': 'Adam'}.
2026-06-15 00:28:02,201 - experiment_functions - INFO - Early stopping at epoch 1200. Best Metrics: (0.08595559439698272, 0.010635340612231226, 0.04632009164671025)
2026-06-15 00:28:02,292 - optuna.study.study - INFO - Trial 205 finished with values: [0.08595559439698272, 0.010635340612231226, 0.04632009164671025] and parameters: {'n_layers': 1, 'embedding_dim': 256, 'lr': 0.0029187572679997753, 'lambda_val': 1.3901992234716063e-05, 'batch_size': 913, 'optimizer': 'Adam'}.
2026-06-15 00:29:45,035 - experiment_functions - INFO - Early stopping at epoch 2450. Best Metrics: (0.10012154777561517, 0.012164244088686448, 0.05313383714268916)
2026-06-15 00:29:45,105 - optuna.study.study - INFO - Trial 206 finished with values: [0.10012154777561517, 0.012164244088686448, 0.05313383714268916] and parameters: {'n_layers': 1, 'embedding_dim': 96, 'lr': 0.0012453044445403945, 'lambda_val': 0.00020614378723959702, 'batch_size': 3152, 'optimizer': 'RMSprop'}.
2026-06-15 00:30:37,180 - experiment_functions - INFO - Early stopping at epoch 1250. Best Metrics: (0.09240823166560067, 0.011017147833076562, 0.04849467283309931)
2026-06-15 00:30:37,260 - optuna.study.study - INFO - Trial 207 finished with values: [0.09240823166560067, 0.011017147833076562, 0.04849467283309931] and parameters: {'n_layers': 1, 'embedding_dim': 64, 'lr': 0.0029187572679997753, 'lambda_val': 3.904381306216792e-06, 'batch_size': 3018, 'optimizer': 'Adam'}.
2026-06-15 00:31:01,743 - experiment_functions - INFO - Early stopping at epoch 500. Best Metrics: (0.0005581533758386687, 9.545180521133365e-05, 0.000250526025637232)
2026-06-15 00:31:01,824 - optuna.study.study - INFO - Trial 208 finished with values: [0.0005581533758386687, 9.545180521133365e-05, 0.000250526025637232] and parameters: {'n_layers': 1, 'embedding_dim': 256, 'lr': 6.073476535611733e-05, 'lambda_val': 1.1527814672590544e-05, 'batch_size': 3018, 'optimizer': 'Adam'}.
2026-06-15 00:31:44,182 - experiment_functions - INFO - Early stopping at epoch 850. Best Metrics: (0.09676872537457859, 0.011725500703329091, 0.05199757055027957)
2026-06-15 00:31:44,259 - optuna.study.study - INFO - Trial 209 finished with values: [0.09676872537457859, 0.011725500703329091, 0.05199757055027957] and parameters: {'n_layers': 1, 'embedding_dim': 256, 'lr': 0.0029187572679997753, 'lambda_val': 2.085056364972028e-06, 'batch_size': 3910, 'optimizer': 'Adam'}.
2026-06-15 00:32:21,852 - experiment_functions - INFO - Early stopping at epoch 850. Best Metrics: (0.09517006357855638, 0.011661866166521536, 0.0501183439062281)
2026-06-15 00:32:21,921 - optuna.study.study - INFO - Trial 210 finished with values: [0.09517006357855638, 0.011661866166521536, 0.0501183439062281] and parameters: {'n_layers': 1, 'embedding_dim': 128, 'lr': 0.0029187572679997753, 'lambda_val': 2.085056364972028e-06, 'batch_size': 3910, 'optimizer': 'Adam'}.
2026-06-15 00:35:10,578 - optuna.study.study - INFO - Trial 211 finished with values: [0.005931613199274731, 0.0009026056668229621, 0.0029550223445699653] and parameters: {'n_layers': 4, 'embedding_dim': 64, 'lr': 9.324634296774709e-05, 'lambda_val': 6.351942760483931e-05, 'batch_size': 3018, 'optimizer': 'Adam'}.
2026-06-15 00:35:41,376 - experiment_functions - INFO - Early stopping at epoch 750. Best Metrics: (0.0005800910136588019, 7.703128139862013e-05, 0.00026375091562855755)
2026-06-15 00:35:41,476 - optuna.study.study - INFO - Trial 212 finished with values: [0.0005800910136588019, 7.703128139862013e-05, 0.00026375091562855755] and parameters: {'n_layers': 1, 'embedding_dim': 96, 'lr': 3.662217920028637e-05, 'lambda_val': 0.00020614378723959702, 'batch_size': 1032, 'optimizer': 'Adam'}.
2026-06-15 00:38:25,241 - experiment_functions - INFO - Early stopping at epoch 3500. Best Metrics: (0.06929738486462181, 0.008456695023109384, 0.03426818489618237)
2026-06-15 00:38:25,327 - optuna.study.study - INFO - Trial 213 finished with values: [0.06929738486462181, 0.008456695023109384, 0.03426818489618237] and parameters: {'n_layers': 3, 'embedding_dim': 128, 'lr': 0.0005365827475896209, 'lambda_val': 1.0100521690584193e-05, 'batch_size': 2287, 'optimizer': 'RMSprop'}.
2026-06-15 00:39:03,158 - experiment_functions - INFO - Early stopping at epoch 900. Best Metrics: (0.0006764197007377473, 9.71263982852167e-05, 0.00034676771294246954)
2026-06-15 00:39:03,247 - optuna.study.study - INFO - Trial 214 finished with values: [0.0006764197007377473, 9.71263982852167e-05, 0.00034676771294246954] and parameters: {'n_layers': 1, 'embedding_dim': 128, 'lr': 3.792942472844233e-05, 'lambda_val': 0.0005753812376677546, 'batch_size': 3018, 'optimizer': 'Adam'}.
2026-06-15 00:39:35,765 - experiment_functions - INFO - Early stopping at epoch 650. Best Metrics: (0.07832551414838408, 0.009483220577399693, 0.039921062172069866)
2026-06-15 00:39:35,849 - optuna.study.study - INFO - Trial 215 finished with values: [0.07832551414838408, 0.009483220577399693, 0.039921062172069866] and parameters: {'n_layers': 1, 'embedding_dim': 256, 'lr': 0.006926802971380086, 'lambda_val': 1.6750135096134514e-06, 'batch_size': 2141, 'optimizer': 'Adam'}.
2026-06-15 00:42:51,894 - optuna.study.study - INFO - Trial 216 finished with values: [0.026687208368882238, 0.003746064706276375, 0.014502566626712447] and parameters: {'n_layers': 4, 'embedding_dim': 128, 'lr': 0.00017099566230665427, 'lambda_val': 0.00020614378723959702, 'batch_size': 913, 'optimizer': 'RMSprop'}.
2026-06-15 00:43:26,306 - experiment_functions - INFO - Early stopping at epoch 800. Best Metrics: (0.00047136589036877845, 7.703128139862015e-05, 0.0002536523688836164)
2026-06-15 00:43:26,398 - optuna.study.study - INFO - Trial 217 finished with values: [0.00047136589036877845, 7.703128139862015e-05, 0.0002536523688836164] and parameters: {'n_layers': 2, 'embedding_dim': 96, 'lr': 4.5148664101037294e-05, 'lambda_val': 5.2807936670700635e-06, 'batch_size': 1725, 'optimizer': 'RMSprop'}.
2026-06-15 00:46:26,041 - optuna.study.study - INFO - Trial 218 finished with values: [0.015676406853461985, 0.002590595485297073, 0.009157665786422188] and parameters: {'n_layers': 1, 'embedding_dim': 256, 'lr': 0.000567654585955759, 'lambda_val': 0.0005845673261093441, 'batch_size': 776, 'optimizer': 'Adam'}.
2026-06-15 00:49:13,874 - optuna.study.study - INFO - Trial 219 finished with values: [0.07456809967333315, 0.010069328153258757, 0.04284236339398339] and parameters: {'n_layers': 1, 'embedding_dim': 128, 'lr': 0.0005365827475896209, 'lambda_val': 7.390761978888471e-05, 'batch_size': 2743, 'optimizer': 'RMSprop'}.
2026-06-15 00:49:43,946 - experiment_functions - INFO - Early stopping at epoch 600. Best Metrics: (0.055619833293179446, 0.006837363520664479, 0.027417087554658177)
2026-06-15 00:49:44,083 - optuna.study.study - INFO - Trial 220 finished with values: [0.055619833293179446, 0.006837363520664479, 0.027417087554658177] and parameters: {'n_layers': 1, 'embedding_dim': 256, 'lr': 0.01005775655032132, 'lambda_val': 0.00020614378723959702, 'batch_size': 1756, 'optimizer': 'Adam'}.
2026-06-15 00:50:26,286 - experiment_functions - INFO - Early stopping at epoch 850. Best Metrics: (0.09495882589875035, 0.011601580815861745, 0.04928648268257772)
2026-06-15 00:50:26,360 - optuna.study.study - INFO - Trial 221 finished with values: [0.09495882589875035, 0.011601580815861745, 0.04928648268257772] and parameters: {'n_layers': 1, 'embedding_dim': 256, 'lr': 0.0029187572679997753, 'lambda_val': 0.00020614378723959702, 'batch_size': 3125, 'optimizer': 'Adam'}.
2026-06-15 00:52:57,342 - experiment_functions - INFO - Early stopping at epoch 3050. Best Metrics: (0.0337399647979437, 0.0040056266327282465, 0.015727778976553645)
2026-06-15 00:52:57,459 - optuna.study.study - INFO - Trial 222 finished with values: [0.0337399647979437, 0.0040056266327282465, 0.015727778976553645] and parameters: {'n_layers': 4, 'embedding_dim': 128, 'lr': 0.0029187572679997753, 'lambda_val': 0.00020614378723959702, 'batch_size': 929, 'optimizer': 'RMSprop'}.
2026-06-15 00:55:57,706 - optuna.study.study - INFO - Trial 223 finished with values: [0.0814958676632157, 0.010184875075356689, 0.04562370978236183] and parameters: {'n_layers': 2, 'embedding_dim': 128, 'lr': 0.0005365827475896209, 'lambda_val': 1.0100521690584193e-05, 'batch_size': 1906, 'optimizer': 'Adam'}.
2026-06-15 00:57:40,353 - experiment_functions - INFO - Early stopping at epoch 2450. Best Metrics: (0.07947682448042981, 0.00939949092370554, 0.040218190713027686)
2026-06-15 00:57:40,432 - optuna.study.study - INFO - Trial 224 finished with values: [0.07947682448042981, 0.00939949092370554, 0.040218190713027686] and parameters: {'n_layers': 2, 'embedding_dim': 64, 'lr': 0.00125444020622911, 'lambda_val': 1.1527814672590544e-05, 'batch_size': 2141, 'optimizer': 'Adam'}.
2026-06-15 01:01:31,850 - optuna.study.study - INFO - Trial 225 finished with values: [0.07304940684953144, 0.008969120503717598, 0.03879396356108645] and parameters: {'n_layers': 3, 'embedding_dim': 256, 'lr': 0.000567654585955759, 'lambda_val': 1.1527814672590544e-05, 'batch_size': 776, 'optimizer': 'Adam'}.
2026-06-15 01:04:23,563 - optuna.study.study - INFO - Trial 226 finished with values: [0.06315679290567223, 0.008230624958135173, 0.034249036202098286] and parameters: {'n_layers': 2, 'embedding_dim': 96, 'lr': 0.00034626607309513543, 'lambda_val': 5.779334633401426e-06, 'batch_size': 3018, 'optimizer': 'Adam'}.
2026-06-15 01:05:04,257 - experiment_functions - INFO - Early stopping at epoch 950. Best Metrics: (0.09336066088500544, 0.01142742313617791, 0.04968880987627349)
2026-06-15 01:05:04,747 - optuna.study.study - INFO - Trial 227 finished with values: [0.09336066088500544, 0.01142742313617791, 0.04968880987627349] and parameters: {'n_layers': 1, 'embedding_dim': 64, 'lr': 0.0029187572679997753, 'lambda_val': 5.8216735655749994e-05, 'batch_size': 3296, 'optimizer': 'Adam'}.
2026-06-15 01:07:42,374 - optuna.study.study - INFO - Trial 228 finished with values: [0.026006995805782772, 0.004189831870855382, 0.016093087195305156] and parameters: {'n_layers': 1, 'embedding_dim': 96, 'lr': 0.000567654585955759, 'lambda_val': 0.00020614378723959702, 'batch_size': 1244, 'optimizer': 'Adam'}.
2026-06-15 01:10:51,734 - optuna.study.study - INFO - Trial 229 finished with values: [0.06020921825198308, 0.007763413490521804, 0.03272077445258092] and parameters: {'n_layers': 3, 'embedding_dim': 128, 'lr': 0.0003794262448571181, 'lambda_val': 3.0726659085432114e-06, 'batch_size': 1023, 'optimizer': 'Adam'}.
2026-06-15 01:11:46,531 - experiment_functions - INFO - Early stopping at epoch 1250. Best Metrics: (0.07751280263399707, 0.00906959608815058, 0.039206845321825265)
2026-06-15 01:11:46,613 - optuna.study.study - INFO - Trial 230 finished with values: [0.07751280263399707, 0.00906959608815058, 0.039206845321825265] and parameters: {'n_layers': 1, 'embedding_dim': 128, 'lr': 0.0029187572679997753, 'lambda_val': 6.806830251349438e-05, 'batch_size': 2579, 'optimizer': 'RMSprop'}.
2026-06-15 01:15:13,432 - optuna.study.study - INFO - Trial 231 finished with values: [0.04925586635222126, 0.00570533860271954, 0.02214660960973067] and parameters: {'n_layers': 2, 'embedding_dim': 256, 'lr': 0.0029187572679997753, 'lambda_val': 1.3173739854471634e-06, 'batch_size': 913, 'optimizer': 'Adam'}.
2026-06-15 01:15:44,449 - experiment_functions - INFO - Early stopping at epoch 700. Best Metrics: (0.06570365010561785, 0.008163641235179852, 0.03383890015531554)
2026-06-15 01:15:44,540 - optuna.study.study - INFO - Trial 232 finished with values: [0.06570365010561785, 0.008163641235179852, 0.03383890015531554] and parameters: {'n_layers': 2, 'embedding_dim': 64, 'lr': 0.0029187572679997753, 'lambda_val': 3.904381306216792e-06, 'batch_size': 2662, 'optimizer': 'Adam'}.
2026-06-15 01:18:21,468 - optuna.study.study - INFO - Trial 233 finished with values: [0.08568063099906525, 0.01085638689798379, 0.04749282042782272] and parameters: {'n_layers': 1, 'embedding_dim': 32, 'lr': 0.00125444020622911, 'lambda_val': 6.806830251349438e-05, 'batch_size': 1686, 'optimizer': 'Adam'}.
2026-06-15 01:19:17,201 - experiment_functions - INFO - Early stopping at epoch 1350. Best Metrics: (0.08759866147568796, 0.010714046486703733, 0.04486958754383207)
2026-06-15 01:19:17,277 - optuna.study.study - INFO - Trial 234 finished with values: [0.08759866147568796, 0.010714046486703733, 0.04486958754383207] and parameters: {'n_layers': 1, 'embedding_dim': 64, 'lr': 0.0029187572679997753, 'lambda_val': 0.00020614378723959702, 'batch_size': 1244, 'optimizer': 'Adam'}.
2026-06-15 01:21:26,622 - experiment_functions - INFO - Early stopping at epoch 2900. Best Metrics: (0.06914513913919432, 0.008279188157277781, 0.033396457370532706)
2026-06-15 01:21:26,705 - optuna.study.study - INFO - Trial 235 finished with values: [0.06914513913919432, 0.008279188157277781, 0.033396457370532706] and parameters: {'n_layers': 2, 'embedding_dim': 128, 'lr': 0.00125444020622911, 'lambda_val': 5.779334633401426e-06, 'batch_size': 1253, 'optimizer': 'RMSprop'}.
2026-06-15 01:24:14,209 - experiment_functions - INFO - Early stopping at epoch 3350. Best Metrics: (0.0604192097946143, 0.007513899122513229, 0.031160846212528348)
2026-06-15 01:24:14,284 - optuna.study.study - INFO - Trial 236 finished with values: [0.0604192097946143, 0.007513899122513229, 0.031160846212528348] and parameters: {'n_layers': 4, 'embedding_dim': 128, 'lr': 0.0003794262448571181, 'lambda_val': 6.806830251349438e-05, 'batch_size': 2141, 'optimizer': 'RMSprop'}.
2026-06-15 01:24:44,750 - experiment_functions - INFO - Early stopping at epoch 750. Best Metrics: (0.07285422297603371, 0.009139928997253669, 0.038719530445908874)
2026-06-15 01:24:44,825 - optuna.study.study - INFO - Trial 237 finished with values: [0.07285422297603371, 0.009139928997253669, 0.038719530445908874] and parameters: {'n_layers': 1, 'embedding_dim': 32, 'lr': 0.006926802971380086, 'lambda_val': 0.00020576561233050602, 'batch_size': 1756, 'optimizer': 'Adam'}.
2026-06-15 01:25:20,374 - experiment_functions - INFO - Early stopping at epoch 650. Best Metrics: (0.05746320123904105, 0.006860807823698842, 0.02697197854247678)
2026-06-15 01:25:20,853 - optuna.study.study - INFO - Trial 238 finished with values: [0.05746320123904105, 0.006860807823698842, 0.02697197854247678] and parameters: {'n_layers': 2, 'embedding_dim': 256, 'lr': 0.0029187572679997753, 'lambda_val': 1.3173739854471634e-06, 'batch_size': 1686, 'optimizer': 'Adam'}.
2026-06-15 01:27:51,789 - optuna.study.study - INFO - Trial 239 finished with values: [0.01166035810656388, 0.001982718199477527, 0.0069596655904286715] and parameters: {'n_layers': 1, 'embedding_dim': 64, 'lr': 0.0004346234237399287, 'lambda_val': 0.00020614378723959702, 'batch_size': 1686, 'optimizer': 'Adam'}.
2026-06-15 01:28:12,728 - experiment_functions - INFO - Early stopping at epoch 500. Best Metrics: (0.0003862665289251129, 6.0285350659789674e-05, 0.00016579476429144315)
2026-06-15 01:28:12,805 - optuna.study.study - INFO - Trial 240 finished with values: [0.0003862665289251129, 6.0285350659789674e-05, 0.00016579476429144315] and parameters: {'n_layers': 1, 'embedding_dim': 64, 'lr': 0.0011776400704232174, 'lambda_val': 2.839715524460245e-05, 'batch_size': 3018, 'optimizer': 'SGD'}.
2026-06-15 01:28:34,098 - experiment_functions - INFO - Early stopping at epoch 500. Best Metrics: (0.0003592252442690136, 6.195994373367272e-05, 0.00016716373248764596)
2026-06-15 01:28:34,171 - optuna.study.study - INFO - Trial 241 finished with values: [0.0003592252442690136, 6.195994373367272e-05, 0.00016716373248764596] and parameters: {'n_layers': 1, 'embedding_dim': 96, 'lr': 0.006926802971380086, 'lambda_val': 0.00020614378723959702, 'batch_size': 913, 'optimizer': 'SGD'}.
2026-06-15 01:31:17,585 - optuna.study.study - INFO - Trial 242 finished with values: [0.09351147417224064, 0.011392256681626366, 0.04948352000239036] and parameters: {'n_layers': 1, 'embedding_dim': 64, 'lr': 0.0029187572679997753, 'lambda_val': 1.3901992234716063e-05, 'batch_size': 913, 'optimizer': 'Adam'}.
2026-06-15 01:34:15,371 - optuna.study.study - INFO - Trial 243 finished with values: [0.04907330327768723, 0.005740505057271084, 0.02217176570892177] and parameters: {'n_layers': 2, 'embedding_dim': 128, 'lr': 0.0029187572679997753, 'lambda_val': 6.806830251349438e-05, 'batch_size': 913, 'optimizer': 'Adam'}.
2026-06-15 01:37:05,640 - optuna.study.study - INFO - Trial 244 finished with values: [0.09329542332383228, 0.011524549534463127, 0.05131572367608973] and parameters: {'n_layers': 1, 'embedding_dim': 128, 'lr': 0.0012453044445403945, 'lambda_val': 0.00020614378723959702, 'batch_size': 913, 'optimizer': 'RMSprop'}.
2026-06-15 01:40:12,528 - optuna.study.study - INFO - Trial 245 finished with values: [0.08428952705279784, 0.009677473373970125, 0.04094998471352118] and parameters: {'n_layers': 1, 'embedding_dim': 256, 'lr': 0.0029187572679997753, 'lambda_val': 1.6750135096134514e-06, 'batch_size': 1708, 'optimizer': 'RMSprop'}.
2026-06-15 01:41:52,685 - experiment_functions - INFO - Early stopping at epoch 1700. Best Metrics: (0.07155541671851678, 0.00869616183267466, 0.035887862038742974)
2026-06-15 01:41:52,770 - optuna.study.study - INFO - Trial 246 finished with values: [0.07155541671851678, 0.00869616183267466, 0.035887862038742974] and parameters: {'n_layers': 3, 'embedding_dim': 256, 'lr': 0.0005365827475896209, 'lambda_val': 1.0100521690584193e-05, 'batch_size': 3878, 'optimizer': 'Adam'}.
2026-06-15 01:45:00,320 - optuna.study.study - INFO - Trial 247 finished with values: [0.04443926338779058, 0.005020430035501375, 0.01998169642618792] and parameters: {'n_layers': 3, 'embedding_dim': 128, 'lr': 0.006364149511391306, 'lambda_val': 0.00012073664489097666, 'batch_size': 1686, 'optimizer': 'RMSprop'}.
2026-06-15 01:47:36,886 - optuna.study.study - INFO - Trial 248 finished with values: [0.048547244948762405, 0.0070165449795699655, 0.028706049146534376] and parameters: {'n_layers': 1, 'embedding_dim': 64, 'lr': 0.000567654585955759, 'lambda_val': 8.178761280584667e-05, 'batch_size': 1686, 'optimizer': 'RMSprop'}.
