2026-06-14 19:48:24,489 - optuna.study.study - INFO - Trial 40 finished with values: [0.0005399967668545429, 8.707883984191843e-05, 0.00023842289845572192] and parameters: {'n_layers': 2, 'embedding_dim': 128, 'lr': 1.8579749370064322e-05, 'lambda_val': 0.002301433608844953, 'batch_size': 3911, 'optimizer': 'RMSprop'}.
2026-06-14 19:48:48,101 - experiment_functions - INFO - Early stopping at epoch 550. Best Metrics: (0.019750920658013926, 0.002367874606470628, 0.008840409323922927)
2026-06-14 19:48:48,188 - optuna.study.study - INFO - Trial 41 finished with values: [0.019750920658013926, 0.002367874606470628, 0.008840409323922927] and parameters: {'n_layers': 3, 'embedding_dim': 32, 'lr': 0.01819050932520439, 'lambda_val': 0.003542792348364727, 'batch_size': 3088, 'optimizer': 'Adam'}.
2026-06-14 19:51:31,618 - optuna.study.study - INFO - Trial 42 finished with values: [0.06189263679815251, 0.008158617455958203, 0.034852326273482524] and parameters: {'n_layers': 2, 'embedding_dim': 64, 'lr': 0.00034626607309513543, 'lambda_val': 5.779334633401426e-06, 'batch_size': 3018, 'optimizer': 'RMSprop'}.
2026-06-14 19:52:01,056 - experiment_functions - INFO - Early stopping at epoch 500. Best Metrics: (0.0004777228469602637, 8.372965369415233e-05, 0.00024347888153380083)
2026-06-14 19:52:01,600 - optuna.study.study - INFO - Trial 43 finished with values: [0.0004777228469602637, 8.372965369415233e-05, 0.00024347888153380083] and parameters: {'n_layers': 3, 'embedding_dim': 256, 'lr': 0.08533459751027628, 'lambda_val': 0.001588558603964603, 'batch_size': 590, 'optimizer': 'SGD'}.
2026-06-14 19:54:39,701 - experiment_functions - INFO - Early stopping at epoch 3450. Best Metrics: (0.05169451326244778, 0.0067871257284479874, 0.02515211563042055)
2026-06-14 19:54:39,783 - optuna.study.study - INFO - Trial 44 finished with values: [0.05169451326244778, 0.0067871257284479874, 0.02515211563042055] and parameters: {'n_layers': 1, 'embedding_dim': 256, 'lr': 0.0007032917526721348, 'lambda_val': 0.033225453617602554, 'batch_size': 2100, 'optimizer': 'Adam'}.
2026-06-14 19:55:15,442 - experiment_functions - INFO - Early stopping at epoch 850. Best Metrics: (0.01735427143100522, 0.002046352736285083, 0.007785578011453303)
2026-06-14 19:55:15,774 - optuna.study.study - INFO - Trial 45 finished with values: [0.01735427143100522, 0.002046352736285083, 0.007785578011453303] and parameters: {'n_layers': 2, 'embedding_dim': 64, 'lr': 0.015446063933850708, 'lambda_val': 0.009846182559241932, 'batch_size': 2122, 'optimizer': 'RMSprop'}.
2026-06-14 19:58:22,544 - optuna.study.study - INFO - Trial 46 finished with values: [0.037166333050701, 0.0040726103556835685, 0.01648920497485616] and parameters: {'n_layers': 3, 'embedding_dim': 128, 'lr': 0.01005775655032132, 'lambda_val': 1.3173739854471634e-06, 'batch_size': 1827, 'optimizer': 'Adam'}.
2026-06-14 19:59:08,726 - experiment_functions - INFO - Early stopping at epoch 1050. Best Metrics: (0.007406257149431508, 0.0010332239265858397, 0.0033110219170346786)
2026-06-14 19:59:08,796 - optuna.study.study - INFO - Trial 47 finished with values: [0.007406257149431508, 0.0010332239265858397, 0.0033110219170346786] and parameters: {'n_layers': 4, 'embedding_dim': 64, 'lr': 0.0012549865829973711, 'lambda_val': 0.0680397377082535, 'batch_size': 3741, 'optimizer': 'RMSprop'}.
2026-06-14 19:59:35,870 - experiment_functions - INFO - Early stopping at epoch 500. Best Metrics: (0.026558879995160573, 0.00305613235983656, 0.013125287841993608)
2026-06-14 19:59:35,955 - optuna.study.study - INFO - Trial 48 finished with values: [0.026558879995160573, 0.00305613235983656, 0.013125287841993608] and parameters: {'n_layers': 2, 'embedding_dim': 256, 'lr': 0.03120448116814287, 'lambda_val': 0.04399608199905535, 'batch_size': 1306, 'optimizer': 'RMSprop'}.
2026-06-14 20:01:27,554 - experiment_functions - INFO - Early stopping at epoch 2400. Best Metrics: (0.015754192904370166, 0.0018336794159019359, 0.006832183270770803)
2026-06-14 20:01:27,656 - optuna.study.study - INFO - Trial 49 finished with values: [0.015754192904370166, 0.0018336794159019359, 0.006832183270770803] and parameters: {'n_layers': 3, 'embedding_dim': 128, 'lr': 0.09705275513779313, 'lambda_val': 0.0063134170943764285, 'batch_size': 2408, 'optimizer': 'Adam'}.
2026-06-14 20:02:23,387 - experiment_functions - INFO - Early stopping at epoch 1150. Best Metrics: (0.08612926171160883, 0.010539888807019896, 0.045292647028220216)
2026-06-14 20:02:23,468 - optuna.study.study - INFO - Trial 50 finished with values: [0.08612926171160883, 0.010539888807019896, 0.045292647028220216] and parameters: {'n_layers': 1, 'embedding_dim': 256, 'lr': 0.0029187572679997753, 'lambda_val': 0.00020614378723959702, 'batch_size': 913, 'optimizer': 'Adam'}.
2026-06-14 20:02:53,482 - experiment_functions - INFO - Early stopping at epoch 500. Best Metrics: (0.01766635336354893, 0.0017851162167593277, 0.008672033877475399)
2026-06-14 20:02:53,837 - optuna.study.study - INFO - Trial 51 finished with values: [0.01766635336354893, 0.0017851162167593277, 0.008672033877475399] and parameters: {'n_layers': 3, 'embedding_dim': 256, 'lr': 0.09705275513779313, 'lambda_val': 0.05596898812097149, 'batch_size': 1306, 'optimizer': 'Adam'}.
2026-06-14 20:03:17,275 - experiment_functions - INFO - Early stopping at epoch 500. Best Metrics: (0.00048343411186306155, 7.368209525085404e-05, 0.0002117982690620615)
2026-06-14 20:03:17,355 - optuna.study.study - INFO - Trial 52 finished with values: [0.00048343411186306155, 7.368209525085404e-05, 0.0002117982690620615] and parameters: {'n_layers': 2, 'embedding_dim': 128, 'lr': 0.00013845433812112025, 'lambda_val': 0.040599997604393895, 'batch_size': 770, 'optimizer': 'Adam'}.
2026-06-14 20:06:08,506 - optuna.study.study - INFO - Trial 53 finished with values: [0.008833547047306343, 0.001482014870386496, 0.005028705822221349] and parameters: {'n_layers': 2, 'embedding_dim': 128, 'lr': 0.0002976018668182029, 'lambda_val': 0.0001311708167749871, 'batch_size': 776, 'optimizer': 'Adam'}.
2026-06-14 20:06:35,932 - experiment_functions - INFO - Early stopping at epoch 550. Best Metrics: (0.01257403505572752, 0.0013564203898452675, 0.005836360177558016)
2026-06-14 20:06:36,074 - optuna.study.study - INFO - Trial 54 finished with values: [0.01257403505572752, 0.0013564203898452675, 0.005836360177558016] and parameters: {'n_layers': 3, 'embedding_dim': 128, 'lr': 0.09705275513779313, 'lambda_val': 0.0063134170943764285, 'batch_size': 1186, 'optimizer': 'Adam'}.
2026-06-14 20:07:08,121 - experiment_functions - INFO - Early stopping at epoch 500. Best Metrics: (0.000676660235124048, 9.71263982852167e-05, 0.00028039641772723727)
2026-06-14 20:07:08,206 - optuna.study.study - INFO - Trial 55 finished with values: [0.000676660235124048, 9.71263982852167e-05, 0.00028039641772723727] and parameters: {'n_layers': 4, 'embedding_dim': 256, 'lr': 0.08213435189574451, 'lambda_val': 0.011075363761469397, 'batch_size': 988, 'optimizer': 'SGD'}.
2026-06-14 20:10:02,708 - experiment_functions - INFO - Early stopping at epoch 3750. Best Metrics: (0.03226711341569126, 0.003618795632661264, 0.014268240413160636)
2026-06-14 20:10:02,784 - optuna.study.study - INFO - Trial 56 finished with values: [0.03226711341569126, 0.003618795632661264, 0.014268240413160636] and parameters: {'n_layers': 3, 'embedding_dim': 128, 'lr': 0.007727727616910603, 'lambda_val': 0.0001311708167749871, 'batch_size': 776, 'optimizer': 'Adam'}.
2026-06-14 20:10:24,329 - experiment_functions - INFO - Early stopping at epoch 500. Best Metrics: (0.0004935501339753397, 8.540424676803538e-05, 0.0002397283431751554)
2026-06-14 20:10:24,418 - optuna.study.study - INFO - Trial 57 finished with values: [0.0004935501339753397, 8.540424676803538e-05, 0.0002397283431751554] and parameters: {'n_layers': 4, 'embedding_dim': 32, 'lr': 0.0018019270974582522, 'lambda_val': 0.0587676444016522, 'batch_size': 2605, 'optimizer': 'SGD'}.
2026-06-14 20:11:02,693 - experiment_functions - INFO - Early stopping at epoch 850. Best Metrics: (0.09516898143012947, 0.011789135240136648, 0.051654228651235284)
2026-06-14 20:11:02,764 - optuna.study.study - INFO - Trial 58 finished with values: [0.09516898143012947, 0.011789135240136648, 0.051654228651235284] and parameters: {'n_layers': 1, 'embedding_dim': 128, 'lr': 0.0029187572679997753, 'lambda_val': 2.085056364972028e-06, 'batch_size': 3910, 'optimizer': 'Adam'}.
2026-06-14 20:11:34,789 - experiment_functions - INFO - Early stopping at epoch 500. Best Metrics: (0.00041060762376953126, 6.698372295532187e-05, 0.0002268693280928238)
2026-06-14 20:11:34,881 - optuna.study.study - INFO - Trial 59 finished with values: [0.00041060762376953126, 6.698372295532187e-05, 0.0002268693280928238] and parameters: {'n_layers': 4, 'embedding_dim': 256, 'lr': 1.3201492170619863e-05, 'lambda_val': 0.004799496680559229, 'batch_size': 776, 'optimizer': 'SGD'}.
2026-06-14 20:11:58,472 - experiment_functions - INFO - Early stopping at epoch 500. Best Metrics: (0.00028119867752954557, 5.3586978364257486e-05, 0.0001350010227547788)
2026-06-14 20:11:58,561 - optuna.study.study - INFO - Trial 60 finished with values: [0.00028119867752954557, 5.3586978364257486e-05, 0.0001350010227547788] and parameters: {'n_layers': 3, 'embedding_dim': 96, 'lr': 0.01005775655032132, 'lambda_val': 2.209811295936425e-06, 'batch_size': 4028, 'optimizer': 'SGD'}.
2026-06-14 20:15:16,821 - optuna.study.study - INFO - Trial 61 finished with values: [0.0007370911823247811, 0.00011219773595016412, 0.00035599006819861113] and parameters: {'n_layers': 2, 'embedding_dim': 256, 'lr': 7.807973071932615e-05, 'lambda_val': 6.806830251349438e-05, 'batch_size': 3018, 'optimizer': 'RMSprop'}.
2026-06-14 20:15:41,447 - experiment_functions - INFO - Early stopping at epoch 550. Best Metrics: (0.0005496438668609282, 7.703128139862013e-05, 0.00026306943194637233)
2026-06-14 20:15:41,548 - optuna.study.study - INFO - Trial 62 finished with values: [0.0005496438668609282, 7.703128139862013e-05, 0.00026306943194637233] and parameters: {'n_layers': 2, 'embedding_dim': 96, 'lr': 7.217177242764055e-05, 'lambda_val': 0.02615350447153138, 'batch_size': 856, 'optimizer': 'Adam'}.
2026-06-14 20:16:07,591 - experiment_functions - INFO - Early stopping at epoch 500. Best Metrics: (0.0004821877613727043, 7.870587447250318e-05, 0.00025236627370178136)
2026-06-14 20:16:07,680 - optuna.study.study - INFO - Trial 63 finished with values: [0.0004821877613727043, 7.870587447250318e-05, 0.00025236627370178136] and parameters: {'n_layers': 4, 'embedding_dim': 128, 'lr': 2.620448939962123e-05, 'lambda_val': 0.01702203153323957, 'batch_size': 3775, 'optimizer': 'SGD'}.
2026-06-14 20:16:52,626 - experiment_functions - INFO - Early stopping at epoch 850. Best Metrics: (0.017806668412753687, 0.002267399022037645, 0.008071613960180373)
2026-06-14 20:16:52,705 - optuna.study.study - INFO - Trial 64 finished with values: [0.017806668412753687, 0.002267399022037645, 0.008071613960180373] and parameters: {'n_layers': 2, 'embedding_dim': 256, 'lr': 0.0012549865829973711, 'lambda_val': 0.0680397377082535, 'batch_size': 3741, 'optimizer': 'Adam'}.
2026-06-14 20:17:22,651 - experiment_functions - INFO - Early stopping at epoch 500. Best Metrics: (0.027470690503897943, 0.0031197668966441157, 0.013649477259063183)
2026-06-14 20:17:22,742 - optuna.study.study - INFO - Trial 65 finished with values: [0.027470690503897943, 0.0031197668966441157, 0.013649477259063183] and parameters: {'n_layers': 3, 'embedding_dim': 256, 'lr': 0.03120448116814287, 'lambda_val': 0.04399608199905535, 'batch_size': 2212, 'optimizer': 'RMSprop'}.
2026-06-14 20:17:48,865 - experiment_functions - INFO - Early stopping at epoch 550. Best Metrics: (0.015801864394339622, 0.0021133364592404048, 0.008043269224933508)
2026-06-14 20:17:48,948 - optuna.study.study - INFO - Trial 66 finished with values: [0.015801864394339622, 0.0021133364592404048, 0.008043269224933508] and parameters: {'n_layers': 2, 'embedding_dim': 128, 'lr': 0.006926802971380086, 'lambda_val': 0.015474167400416464, 'batch_size': 873, 'optimizer': 'Adam'}.
2026-06-14 20:18:55,061 - experiment_functions - INFO - Early stopping at epoch 1650. Best Metrics: (0.0857004890533204, 0.010369080313483825, 0.04457157590662428)
2026-06-14 20:18:55,151 - optuna.study.study - INFO - Trial 67 finished with values: [0.0857004890533204, 0.010369080313483825, 0.04457157590662428] and parameters: {'n_layers': 1, 'embedding_dim': 32, 'lr': 0.0029187572679997753, 'lambda_val': 0.00020614378723959702, 'batch_size': 2490, 'optimizer': 'Adam'}.
2026-06-14 20:22:12,964 - optuna.study.study - INFO - Trial 68 finished with values: [0.03667710258075012, 0.004074284948757453, 0.01647471882776947] and parameters: {'n_layers': 4, 'embedding_dim': 128, 'lr': 0.004960095878914263, 'lambda_val': 0.00012073664489097666, 'batch_size': 2579, 'optimizer': 'RMSprop'}.
2026-06-14 20:22:45,122 - experiment_functions - INFO - Early stopping at epoch 500. Best Metrics: (0.000513545102542486, 8.038046754638622e-05, 0.0002290015812566007)
2026-06-14 20:22:45,207 - optuna.study.study - INFO - Trial 69 finished with values: [0.000513545102542486, 8.038046754638622e-05, 0.0002290015812566007] and parameters: {'n_layers': 4, 'embedding_dim': 256, 'lr': 0.08213435189574451, 'lambda_val': 0.0063134170943764285, 'batch_size': 2408, 'optimizer': 'SGD'}.
2026-06-14 20:23:51,282 - experiment_functions - INFO - Early stopping at epoch 1300. Best Metrics: (0.036389523718188974, 0.004439346238863957, 0.0166872667341567)
2026-06-14 20:23:51,361 - optuna.study.study - INFO - Trial 70 finished with values: [0.036389523718188974, 0.004439346238863957, 0.0166872667341567] and parameters: {'n_layers': 4, 'embedding_dim': 128, 'lr': 0.0014328783582003698, 'lambda_val': 7.390761978888471e-05, 'batch_size': 3874, 'optimizer': 'RMSprop'}.
2026-06-14 20:24:12,505 - experiment_functions - INFO - Early stopping at epoch 500. Best Metrics: (0.0004333562039156213, 6.530912988143882e-05, 0.00019862654755349875)
2026-06-14 20:24:12,593 - optuna.study.study - INFO - Trial 71 finished with values: [0.0004333562039156213, 6.530912988143882e-05, 0.00019862654755349875] and parameters: {'n_layers': 1, 'embedding_dim': 96, 'lr': 1.849323212549931e-05, 'lambda_val': 0.09089453714374071, 'batch_size': 1188, 'optimizer': 'SGD'}.
2026-06-14 20:24:41,787 - experiment_functions - INFO - Early stopping at epoch 600. Best Metrics: (0.000586458493842588, 8.372965369415233e-05, 0.00027738678559526345)
2026-06-14 20:24:41,878 - optuna.study.study - INFO - Trial 72 finished with values: [0.000586458493842588, 8.372965369415233e-05, 0.00027738678559526345] and parameters: {'n_layers': 4, 'embedding_dim': 96, 'lr': 1.901956646527392e-05, 'lambda_val': 0.07884532572803091, 'batch_size': 3128, 'optimizer': 'RMSprop'}.
2026-06-14 20:25:09,115 - experiment_functions - INFO - Early stopping at epoch 600. Best Metrics: (0.07889212368237018, 0.009757853841516513, 0.040713449293583934)
2026-06-14 20:25:09,203 - optuna.study.study - INFO - Trial 73 finished with values: [0.07889212368237018, 0.009757853841516513, 0.040713449293583934] and parameters: {'n_layers': 1, 'embedding_dim': 128, 'lr': 0.01005775655032132, 'lambda_val': 0.00020614378723959702, 'batch_size': 3764, 'optimizer': 'Adam'}.
2026-06-14 20:25:32,705 - experiment_functions - INFO - Early stopping at epoch 500. Best Metrics: (0.00038735878639630357, 7.870587447250318e-05, 0.0002117945040376355)
2026-06-14 20:25:32,828 - optuna.study.study - INFO - Trial 74 finished with values: [0.00038735878639630357, 7.870587447250318e-05, 0.0002117945040376355] and parameters: {'n_layers': 3, 'embedding_dim': 96, 'lr': 0.028494078007069816, 'lambda_val': 0.09913523418738206, 'batch_size': 1188, 'optimizer': 'SGD'}.
2026-06-14 20:27:41,809 - experiment_functions - INFO - Early stopping at epoch 3000. Best Metrics: (0.0005721048389235904, 8.372965369415233e-05, 0.00028643667263563463)
2026-06-14 20:27:41,936 - optuna.study.study - INFO - Trial 75 finished with values: [0.0005721048389235904, 8.372965369415233e-05, 0.00028643667263563463] and parameters: {'n_layers': 3, 'embedding_dim': 96, 'lr': 2.068913648110366e-05, 'lambda_val': 3.904381306216792e-06, 'batch_size': 1756, 'optimizer': 'RMSprop'}.
2026-06-14 20:28:05,012 - experiment_functions - INFO - Early stopping at epoch 500. Best Metrics: (0.0002284749751460856, 3.851564069931007e-05, 9.760340241897729e-05)
2026-06-14 20:28:05,103 - optuna.study.study - INFO - Trial 76 finished with values: [0.0002284749751460856, 3.851564069931007e-05, 9.760340241897729e-05] and parameters: {'n_layers': 2, 'embedding_dim': 128, 'lr': 0.006926802971380086, 'lambda_val': 0.00023118330968848881, 'batch_size': 684, 'optimizer': 'SGD'}.
2026-06-14 20:28:25,388 - experiment_functions - INFO - Early stopping at epoch 500. Best Metrics: (0.0005148347332601513, 8.038046754638624e-05, 0.00023335319804750792)
2026-06-14 20:28:25,494 - optuna.study.study - INFO - Trial 77 finished with values: [0.0005148347332601513, 8.038046754638624e-05, 0.00023335319804750792] and parameters: {'n_layers': 1, 'embedding_dim': 32, 'lr': 0.0001363169290433669, 'lambda_val': 0.033225453617602554, 'batch_size': 2100, 'optimizer': 'Adam'}.
2026-06-14 20:31:48,235 - optuna.study.study - INFO - Trial 78 finished with values: [0.03853376653308304, 0.0055278317368879365, 0.020818997784195017] and parameters: {'n_layers': 2, 'embedding_dim': 256, 'lr': 0.00018243297440383044, 'lambda_val': 1.017349376345002e-05, 'batch_size': 3741, 'optimizer': 'RMSprop'}.
2026-06-14 20:34:11,600 - experiment_functions - INFO - Early stopping at epoch 3450. Best Metrics: (0.0784931942723669, 0.009566950231093843, 0.0405109751979939)
2026-06-14 20:34:11,679 - optuna.study.study - INFO - Trial 79 finished with values: [0.0784931942723669, 0.009566950231093843, 0.0405109751979939] and parameters: {'n_layers': 2, 'embedding_dim': 64, 'lr': 0.00125444020622911, 'lambda_val': 6.806830251349438e-05, 'batch_size': 1686, 'optimizer': 'Adam'}.
2026-06-14 20:34:58,111 - experiment_functions - INFO - Early stopping at epoch 1000. Best Metrics: (0.0686177626330301, 0.008213879027396342, 0.03325543089575996)
2026-06-14 20:34:58,202 - optuna.study.study - INFO - Trial 80 finished with values: [0.0686177626330301, 0.008213879027396342, 0.03325543089575996] and parameters: {'n_layers': 2, 'embedding_dim': 128, 'lr': 0.0011776400704232174, 'lambda_val': 1.0100521690584193e-05, 'batch_size': 3878, 'optimizer': 'RMSprop'}.
2026-06-14 20:35:27,397 - experiment_functions - INFO - Early stopping at epoch 500. Best Metrics: (0.0006780430258631204, 8.540424676803538e-05, 0.0002644842269976)
2026-06-14 20:35:27,494 - optuna.study.study - INFO - Trial 81 finished with values: [0.0006780430258631204, 8.540424676803538e-05, 0.0002644842269976] and parameters: {'n_layers': 3, 'embedding_dim': 256, 'lr': 0.08533459751027628, 'lambda_val': 0.001588558603964603, 'batch_size': 590, 'optimizer': 'SGD'}.
2026-06-14 20:38:00,475 - experiment_functions - INFO - Early stopping at epoch 3550. Best Metrics: (0.032454362152325694, 0.0038900797106303166, 0.014578790639105185)
2026-06-14 20:38:00,549 - optuna.study.study - INFO - Trial 82 finished with values: [0.032454362152325694, 0.0038900797106303166, 0.014578790639105185] and parameters: {'n_layers': 4, 'embedding_dim': 64, 'lr': 0.0029187572679997753, 'lambda_val': 0.00020614378723959702, 'batch_size': 913, 'optimizer': 'RMSprop'}.
2026-06-14 20:38:26,004 - experiment_functions - INFO - Early stopping at epoch 550. Best Metrics: (0.027245640488441438, 0.0033223926585839642, 0.01236614841455677)
2026-06-14 20:38:26,086 - optuna.study.study - INFO - Trial 83 finished with values: [0.027245640488441438, 0.0033223926585839642, 0.01236614841455677] and parameters: {'n_layers': 4, 'embedding_dim': 64, 'lr': 0.007727727616910603, 'lambda_val': 0.0002371700044059273, 'batch_size': 3873, 'optimizer': 'Adam'}.
2026-06-14 20:42:36,492 - optuna.study.study - INFO - Trial 84 finished with values: [0.062244478307490574, 0.007488780226404985, 0.03155951784180255] and parameters: {'n_layers': 4, 'embedding_dim': 256, 'lr': 0.0003794262448571181, 'lambda_val': 1.6750135096134514e-06, 'batch_size': 2141, 'optimizer': 'RMSprop'}.
2026-06-14 20:43:15,656 - experiment_functions - INFO - Early stopping at epoch 600. Best Metrics: (0.03007728530724296, 0.003240337597963695, 0.014451507834673746)
2026-06-14 20:43:15,734 - optuna.study.study - INFO - Trial 85 finished with values: [0.03007728530724296, 0.003240337597963695, 0.014451507834673746] and parameters: {'n_layers': 4, 'embedding_dim': 256, 'lr': 0.043522830313762924, 'lambda_val': 1.6750135096134514e-06, 'batch_size': 3128, 'optimizer': 'RMSprop'}.
2026-06-14 20:45:13,231 - experiment_functions - INFO - Early stopping at epoch 2500. Best Metrics: (0.0356224864184621, 0.004027396342688726, 0.0157841270612754)
2026-06-14 20:45:13,310 - optuna.study.study - INFO - Trial 86 finished with values: [0.0356224864184621, 0.004027396342688726, 0.0157841270612754] and parameters: {'n_layers': 3, 'embedding_dim': 128, 'lr': 0.0029187572679997753, 'lambda_val': 0.00020614378723959702, 'batch_size': 1086, 'optimizer': 'Adam'}.
2026-06-14 20:48:19,119 - optuna.study.study - INFO - Trial 87 finished with values: [0.043539731925404945, 0.0046536941523209864, 0.019755568793417597] and parameters: {'n_layers': 4, 'embedding_dim': 96, 'lr': 0.017176020213444436, 'lambda_val': 0.00012073664489097666, 'batch_size': 3910, 'optimizer': 'RMSprop'}.
2026-06-14 20:48:45,232 - experiment_functions - INFO - Early stopping at epoch 500. Best Metrics: (0.0005192577806179395, 6.698372295532186e-05, 0.00020639222263756546)
