2026-06-13 19:39:47,770 - optuna.study.study - INFO - Trial 45 finished with values: [0.017183923897500664, 0.002418112398687119, 0.00892546729772464] and parameters: {'n_layers': 3, 'embedding_dim': 96, 'lr': 0.042947991983695886, 'lambda_val': 8.588254850037456e-05, 'batch_size': 2035, 'optimizer': 'Adam'}.
2026-06-13 19:40:16,225 - experiment_functions - INFO - Early stopping at epoch 650. Best Metrics: (0.033119397291197714, 0.00473240002679349, 0.01778871688825216)
2026-06-13 19:40:16,303 - optuna.study.study - INFO - Trial 46 finished with values: [0.033119397291197714, 0.00473240002679349, 0.01778871688825216] and parameters: {'n_layers': 2, 'embedding_dim': 128, 'lr': 0.0042802863633449924, 'lambda_val': 0.0008453903829961915, 'batch_size': 2816, 'optimizer': 'Adam'}.
2026-06-13 19:40:41,895 - experiment_functions - INFO - Early stopping at epoch 650. Best Metrics: (0.020216376262486586, 0.0030226404983588993, 0.0102944414836745)
2026-06-13 19:40:41,958 - optuna.study.study - INFO - Trial 47 finished with values: [0.020216376262486586, 0.0030226404983588993, 0.0102944414836745] and parameters: {'n_layers': 2, 'embedding_dim': 32, 'lr': 0.007743186347665371, 'lambda_val': 0.0017018360966363254, 'batch_size': 818, 'optimizer': 'Adam'}.
2026-06-13 19:41:20,393 - experiment_functions - INFO - Early stopping at epoch 950. Best Metrics: (0.038904747769473745, 0.005546252260700649, 0.020167008858553055)
2026-06-13 19:41:20,459 - optuna.study.study - INFO - Trial 48 finished with values: [0.038904747769473745, 0.005546252260700649, 0.020167008858553055] and parameters: {'n_layers': 2, 'embedding_dim': 64, 'lr': 0.0016889361681909714, 'lambda_val': 0.00035318754870590177, 'batch_size': 3699, 'optimizer': 'RMSprop'}.
2026-06-13 19:41:44,908 - experiment_functions - INFO - Early stopping at epoch 500. Best Metrics: (0.0004925851315139924, 6.363453680755576e-05, 0.0001965766722604208)
2026-06-13 19:41:44,970 - optuna.study.study - INFO - Trial 49 finished with values: [0.0004925851315139924, 6.363453680755576e-05, 0.0001965766722604208] and parameters: {'n_layers': 2, 'embedding_dim': 256, 'lr': 1.2334229826708746e-05, 'lambda_val': 0.015219446510686848, 'batch_size': 4034, 'optimizer': 'RMSprop'}.
2026-06-13 19:44:15,374 - optuna.study.study - INFO - Trial 50 finished with values: [0.03756985894227834, 0.005531180923035703, 0.0206188263202056] and parameters: {'n_layers': 1, 'embedding_dim': 64, 'lr': 0.0016889361681909714, 'lambda_val': 0.00035318754870590177, 'batch_size': 1358, 'optimizer': 'RMSprop'}.
2026-06-13 19:46:07,253 - experiment_functions - INFO - Early stopping at epoch 2800. Best Metrics: (0.0004817953332622912, 8.372965369415234e-05, 0.00023748018686646535)
2026-06-13 19:46:07,334 - optuna.study.study - INFO - Trial 51 finished with values: [0.0004817953332622912, 8.372965369415234e-05, 0.00023748018686646535] and parameters: {'n_layers': 2, 'embedding_dim': 128, 'lr': 1.7303763529237848e-05, 'lambda_val': 1.2455620919991295e-05, 'batch_size': 681, 'optimizer': 'Adam'}.
2026-06-13 19:48:40,829 - experiment_functions - INFO - Early stopping at epoch 3100. Best Metrics: (0.017208893756673886, 0.0023611762341750955, 0.008148971243465896)
2026-06-13 19:48:40,908 - optuna.study.study - INFO - Trial 52 finished with values: [0.017208893756673886, 0.0023611762341750955, 0.008148971243465896] and parameters: {'n_layers': 3, 'embedding_dim': 256, 'lr': 0.024143923894547725, 'lambda_val': 0.0020280687587716966, 'batch_size': 3843, 'optimizer': 'RMSprop'}.
2026-06-13 19:51:13,384 - optuna.study.study - INFO - Trial 53 finished with values: [0.03311755748343663, 0.0050924375376783446, 0.018146940754646373] and parameters: {'n_layers': 1, 'embedding_dim': 96, 'lr': 0.0009711234831697961, 'lambda_val': 0.0003920256863411047, 'batch_size': 1859, 'optimizer': 'RMSprop'}.
2026-06-13 19:53:47,776 - optuna.study.study - INFO - Trial 54 finished with values: [0.01706182838664242, 0.002622412753700851, 0.010011113786048432] and parameters: {'n_layers': 1, 'embedding_dim': 128, 'lr': 0.000495651360592853, 'lambda_val': 1.560024380616628e-05, 'batch_size': 3137, 'optimizer': 'Adam'}.
2026-06-13 19:54:07,493 - experiment_functions - INFO - Early stopping at epoch 500. Best Metrics: (0.0005789263583149613, 7.870587447250318e-05, 0.00022913824288205522)
2026-06-13 19:54:07,570 - optuna.study.study - INFO - Trial 55 finished with values: [0.0005789263583149613, 7.870587447250318e-05, 0.00022913824288205522] and parameters: {'n_layers': 1, 'embedding_dim': 32, 'lr': 7.288776137374531e-05, 'lambda_val': 4.980825304078413e-06, 'batch_size': 2617, 'optimizer': 'SGD'}.
2026-06-13 19:54:33,530 - experiment_functions - INFO - Early stopping at epoch 600. Best Metrics: (0.026787021452680554, 0.0038063500569361646, 0.013477245187306272)
2026-06-13 19:54:33,607 - optuna.study.study - INFO - Trial 56 finished with values: [0.026787021452680554, 0.0038063500569361646, 0.013477245187306272] and parameters: {'n_layers': 4, 'embedding_dim': 64, 'lr': 0.0042802863633449924, 'lambda_val': 0.0033626453290954094, 'batch_size': 2816, 'optimizer': 'Adam'}.
2026-06-13 19:55:56,728 - experiment_functions - INFO - Early stopping at epoch 2200. Best Metrics: (0.012189537152461296, 0.001723156273025655, 0.00596107342822396)
2026-06-13 19:55:56,817 - optuna.study.study - INFO - Trial 57 finished with values: [0.012189537152461296, 0.001723156273025655, 0.00596107342822396] and parameters: {'n_layers': 4, 'embedding_dim': 32, 'lr': 0.04448259180305926, 'lambda_val': 0.0028084197543179652, 'batch_size': 3815, 'optimizer': 'RMSprop'}.
2026-06-13 19:56:37,664 - experiment_functions - INFO - Early stopping at epoch 1000. Best Metrics: (0.026292896548291426, 0.003911849420590797, 0.014151088375082041)
2026-06-13 19:56:37,754 - optuna.study.study - INFO - Trial 58 finished with values: [0.026292896548291426, 0.003911849420590797, 0.014151088375082041] and parameters: {'n_layers': 1, 'embedding_dim': 128, 'lr': 0.0042802863633449924, 'lambda_val': 0.0001235940083690254, 'batch_size': 2816, 'optimizer': 'Adam'}.
2026-06-13 19:59:21,003 - optuna.study.study - INFO - Trial 59 finished with values: [0.047427882108678016, 0.006324938040056267, 0.02504263362605073] and parameters: {'n_layers': 4, 'embedding_dim': 64, 'lr': 0.0006193224215073263, 'lambda_val': 2.3680453923050776e-05, 'batch_size': 4095, 'optimizer': 'Adam'}.
2026-06-13 19:59:44,353 - experiment_functions - INFO - Early stopping at epoch 550. Best Metrics: (0.011082775462060929, 0.0015607207448589994, 0.00582540455869426)
2026-06-13 19:59:44,443 - optuna.study.study - INFO - Trial 60 finished with values: [0.011082775462060929, 0.0015607207448589994, 0.00582540455869426] and parameters: {'n_layers': 3, 'embedding_dim': 64, 'lr': 0.024143923894547725, 'lambda_val': 0.0003351122520854177, 'batch_size': 4095, 'optimizer': 'RMSprop'}.
2026-06-13 20:00:37,304 - experiment_functions - INFO - Early stopping at epoch 1350. Best Metrics: (0.02544425044238619, 0.00371592203094648, 0.013056340552563026)
2026-06-13 20:00:37,378 - optuna.study.study - INFO - Trial 61 finished with values: [0.02544425044238619, 0.00371592203094648, 0.013056340552563026] and parameters: {'n_layers': 2, 'embedding_dim': 64, 'lr': 0.0009822401593291786, 'lambda_val': 0.01866673428394609, 'batch_size': 3449, 'optimizer': 'Adam'}.
2026-06-13 20:03:01,674 - experiment_functions - INFO - Early stopping at epoch 3700. Best Metrics: (0.000567402096126701, 8.205506062026927e-05, 0.00023120275384728317)
2026-06-13 20:03:01,753 - optuna.study.study - INFO - Trial 62 finished with values: [0.000567402096126701, 8.205506062026927e-05, 0.00023120275384728317] and parameters: {'n_layers': 4, 'embedding_dim': 64, 'lr': 2.2690303623159337e-05, 'lambda_val': 0.0003351122520854177, 'batch_size': 3843, 'optimizer': 'RMSprop'}.
2026-06-13 20:05:30,062 - optuna.study.study - INFO - Trial 63 finished with values: [0.028089243527354348, 0.0041730859401165514, 0.015428781358821546] and parameters: {'n_layers': 1, 'embedding_dim': 64, 'lr': 0.0009711234831697961, 'lambda_val': 0.0005195382127114068, 'batch_size': 1859, 'optimizer': 'Adam'}.
2026-06-13 20:07:58,835 - optuna.study.study - INFO - Trial 64 finished with values: [0.001563830340569033, 0.0002243954719003282, 0.0007932655232187876] and parameters: {'n_layers': 2, 'embedding_dim': 64, 'lr': 0.00014279942711366034, 'lambda_val': 1.5628541512273901e-06, 'batch_size': 3712, 'optimizer': 'Adam'}.
2026-06-13 20:09:28,268 - experiment_functions - INFO - Early stopping at epoch 2350. Best Metrics: (0.014699270351079605, 0.0019575993033692815, 0.006576347068416929)
2026-06-13 20:09:28,356 - optuna.study.study - INFO - Trial 65 finished with values: [0.014699270351079605, 0.0019575993033692815, 0.006576347068416929] and parameters: {'n_layers': 2, 'embedding_dim': 64, 'lr': 0.06463772794599591, 'lambda_val': 0.0037208546295430245, 'batch_size': 3324, 'optimizer': 'Adam'}.
2026-06-13 20:09:49,535 - experiment_functions - INFO - Early stopping at epoch 500. Best Metrics: (0.007081236449979446, 0.0008054792685377453, 0.003996862729429805)
2026-06-13 20:09:49,629 - optuna.study.study - INFO - Trial 66 finished with values: [0.007081236449979446, 0.0008054792685377453, 0.003996862729429805] and parameters: {'n_layers': 3, 'embedding_dim': 64, 'lr': 0.07582155796568038, 'lambda_val': 2.852470480955519e-05, 'batch_size': 1251, 'optimizer': 'RMSprop'}.
2026-06-13 20:10:11,024 - experiment_functions - INFO - Early stopping at epoch 500. Best Metrics: (0.0006373187846140618, 8.540424676803537e-05, 0.00027252165971186317)
2026-06-13 20:10:11,105 - optuna.study.study - INFO - Trial 67 finished with values: [0.0006373187846140618, 8.540424676803537e-05, 0.00027252165971186317] and parameters: {'n_layers': 4, 'embedding_dim': 64, 'lr': 0.00017169824875211975, 'lambda_val': 8.189329524360161e-06, 'batch_size': 2830, 'optimizer': 'SGD'}.
2026-06-13 20:10:52,086 - experiment_functions - INFO - Early stopping at epoch 1050. Best Metrics: (0.036278754297716695, 0.0051929131221113275, 0.019193275550763007)
2026-06-13 20:10:52,404 - optuna.study.study - INFO - Trial 68 finished with values: [0.036278754297716695, 0.0051929131221113275, 0.019193275550763007] and parameters: {'n_layers': 2, 'embedding_dim': 32, 'lr': 0.0027934085914899194, 'lambda_val': 4.1509980625924543e-05, 'batch_size': 3449, 'optimizer': 'Adam'}.
2026-06-13 20:11:21,653 - experiment_functions - INFO - Early stopping at epoch 700. Best Metrics: (0.0005464815535756694, 8.707883984191843e-05, 0.0002684057748629335)
2026-06-13 20:11:21,741 - optuna.study.study - INFO - Trial 69 finished with values: [0.0005464815535756694, 8.707883984191843e-05, 0.0002684057748629335] and parameters: {'n_layers': 4, 'embedding_dim': 64, 'lr': 2.2690303623159337e-05, 'lambda_val': 4.193894827058616e-05, 'batch_size': 1185, 'optimizer': 'Adam'}.
2026-06-13 20:13:55,363 - optuna.study.study - INFO - Trial 70 finished with values: [0.012954484024555983, 0.002017884654029071, 0.007683558341279928] and parameters: {'n_layers': 1, 'embedding_dim': 128, 'lr': 0.000495651360592853, 'lambda_val': 8.588254850037456e-05, 'batch_size': 2035, 'optimizer': 'Adam'}.
2026-06-13 20:14:34,044 - experiment_functions - INFO - Early stopping at epoch 850. Best Metrics: (0.04175710579448019, 0.00548596691004086, 0.02055652757999489)
2026-06-13 20:14:34,131 - optuna.study.study - INFO - Trial 71 finished with values: [0.04175710579448019, 0.00548596691004086, 0.02055652757999489] and parameters: {'n_layers': 3, 'embedding_dim': 128, 'lr': 0.0016889361681909714, 'lambda_val': 0.00013735320939513843, 'batch_size': 3306, 'optimizer': 'RMSprop'}.
2026-06-13 20:14:54,711 - experiment_functions - INFO - Early stopping at epoch 500. Best Metrics: (0.00046825942180133816, 8.707883984191843e-05, 0.00022871636410227932)
2026-06-13 20:14:54,840 - optuna.study.study - INFO - Trial 72 finished with values: [0.00046825942180133816, 8.707883984191843e-05, 0.00022871636410227932] and parameters: {'n_layers': 2, 'embedding_dim': 64, 'lr': 0.0006193224215073263, 'lambda_val': 0.005651522538859645, 'batch_size': 4095, 'optimizer': 'SGD'}.
2026-06-13 20:15:31,883 - experiment_functions - INFO - Early stopping at epoch 950. Best Metrics: (0.0003902216878557579, 7.703128139862013e-05, 0.00019002477166019617)
2026-06-13 20:15:31,973 - optuna.study.study - INFO - Trial 73 finished with values: [0.0003902216878557579, 7.703128139862013e-05, 0.00019002477166019617] and parameters: {'n_layers': 2, 'embedding_dim': 64, 'lr': 1.53913675389218e-05, 'lambda_val': 1.4558283293252479e-05, 'batch_size': 688, 'optimizer': 'RMSprop'}.
2026-06-13 20:15:52,394 - experiment_functions - INFO - Early stopping at epoch 500. Best Metrics: (0.0005146699520775972, 6.698372295532186e-05, 0.0002166938978317632)
2026-06-13 20:15:52,460 - optuna.study.study - INFO - Trial 74 finished with values: [0.0005146699520775972, 6.698372295532186e-05, 0.0002166938978317632] and parameters: {'n_layers': 1, 'embedding_dim': 96, 'lr': 0.005617696241275853, 'lambda_val': 0.00142877448738649, 'batch_size': 3982, 'optimizer': 'SGD'}.
2026-06-13 20:18:42,017 - optuna.study.study - INFO - Trial 75 finished with values: [0.026425513051679075, 0.0040257217496148445, 0.01516177456291126] and parameters: {'n_layers': 1, 'embedding_dim': 256, 'lr': 0.000495651360592853, 'lambda_val': 2.060634847155313e-06, 'batch_size': 3048, 'optimizer': 'RMSprop'}.
2026-06-13 20:19:20,217 - experiment_functions - INFO - Early stopping at epoch 900. Best Metrics: (0.020650911844106296, 0.002883649273226606, 0.010142546251188907)
2026-06-13 20:19:20,309 - optuna.study.study - INFO - Trial 76 finished with values: [0.020650911844106296, 0.002883649273226606, 0.010142546251188907] and parameters: {'n_layers': 2, 'embedding_dim': 128, 'lr': 0.004987128238810043, 'lambda_val': 0.0017018360966363254, 'batch_size': 818, 'optimizer': 'RMSprop'}.
2026-06-13 20:21:45,494 - experiment_functions - INFO - Early stopping at epoch 3750. Best Metrics: (0.022146255972941516, 0.003409471498425883, 0.011728326465575471)
2026-06-13 20:21:45,583 - optuna.study.study - INFO - Trial 77 finished with values: [0.022146255972941516, 0.003409471498425883, 0.011728326465575471] and parameters: {'n_layers': 1, 'embedding_dim': 128, 'lr': 0.0006971255889475698, 'lambda_val': 0.018328494161540542, 'batch_size': 3311, 'optimizer': 'RMSprop'}.
2026-06-13 20:23:56,056 - experiment_functions - INFO - Early stopping at epoch 3600. Best Metrics: (0.011184409846921836, 0.001662870922365865, 0.005561109036146989)
2026-06-13 20:23:56,129 - optuna.study.study - INFO - Trial 78 finished with values: [0.011184409846921836, 0.001662870922365865, 0.005561109036146989] and parameters: {'n_layers': 2, 'embedding_dim': 32, 'lr': 0.052296616630871054, 'lambda_val': 0.009153220394863267, 'batch_size': 818, 'optimizer': 'Adam'}.
2026-06-13 20:24:18,060 - experiment_functions - INFO - Early stopping at epoch 550. Best Metrics: (0.005242767137323454, 0.0008172014200549268, 0.0026570415875529726)
2026-06-13 20:24:18,153 - optuna.study.study - INFO - Trial 79 finished with values: [0.005242767137323454, 0.0008172014200549268, 0.0026570415875529726] and parameters: {'n_layers': 2, 'embedding_dim': 32, 'lr': 0.044186813805404825, 'lambda_val': 6.698391056726584e-05, 'batch_size': 2642, 'optimizer': 'RMSprop'}.
2026-06-13 20:25:02,500 - experiment_functions - INFO - Early stopping at epoch 1000. Best Metrics: (0.03981013820084731, 0.005372094581016814, 0.019802620529276813)
2026-06-13 20:25:02,594 - optuna.study.study - INFO - Trial 80 finished with values: [0.03981013820084731, 0.005372094581016814, 0.019802620529276813] and parameters: {'n_layers': 4, 'embedding_dim': 96, 'lr': 0.0009711234831697961, 'lambda_val': 0.0005195382127114068, 'batch_size': 3773, 'optimizer': 'RMSprop'}.
2026-06-13 20:25:32,461 - experiment_functions - INFO - Early stopping at epoch 700. Best Metrics: (0.02512473500342329, 0.0035953513296269014, 0.012421507398666909)
2026-06-13 20:25:32,535 - optuna.study.study - INFO - Trial 81 finished with values: [0.02512473500342329, 0.0035953513296269014, 0.012421507398666909] and parameters: {'n_layers': 2, 'embedding_dim': 96, 'lr': 0.007743186347665371, 'lambda_val': 3.622457302805246e-05, 'batch_size': 818, 'optimizer': 'Adam'}.
2026-06-13 20:25:55,017 - experiment_functions - INFO - Early stopping at epoch 500. Best Metrics: (0.0004918155132503046, 7.2007502176971e-05, 0.00024521252211331696)
2026-06-13 20:25:55,116 - optuna.study.study - INFO - Trial 82 finished with values: [0.0004918155132503046, 7.2007502176971e-05, 0.00024521252211331696] and parameters: {'n_layers': 1, 'embedding_dim': 256, 'lr': 0.00013533880906179503, 'lambda_val': 2.060634847155313e-06, 'batch_size': 2726, 'optimizer': 'SGD'}.
2026-06-13 20:26:23,821 - experiment_functions - INFO - Early stopping at epoch 700. Best Metrics: (0.017103470109765623, 0.002448255074017014, 0.008391232003673125)
2026-06-13 20:26:23,907 - optuna.study.study - INFO - Trial 83 finished with values: [0.017103470109765623, 0.002448255074017014, 0.008391232003673125] and parameters: {'n_layers': 2, 'embedding_dim': 64, 'lr': 0.0030675240214635474, 'lambda_val': 0.01866673428394609, 'batch_size': 3483, 'optimizer': 'RMSprop'}.
2026-06-13 20:27:49,824 - experiment_functions - INFO - Early stopping at epoch 2200. Best Metrics: (0.0006145782295941196, 0.00010717395672851497, 0.000296445862602951)
2026-06-13 20:27:49,912 - optuna.study.study - INFO - Trial 84 finished with values: [0.0006145782295941196, 0.00010717395672851497, 0.000296445862602951] and parameters: {'n_layers': 2, 'embedding_dim': 96, 'lr': 8.685983211461693e-05, 'lambda_val': 8.189329524360161e-06, 'batch_size': 2816, 'optimizer': 'Adam'}.
2026-06-13 20:28:13,576 - experiment_functions - INFO - Early stopping at epoch 600. Best Metrics: (0.0005529727908412238, 8.875343291580146e-05, 0.0002259758746978325)
2026-06-13 20:28:13,672 - optuna.study.study - INFO - Trial 85 finished with values: [0.0005529727908412238, 8.875343291580146e-05, 0.0002259758746978325] and parameters: {'n_layers': 1, 'embedding_dim': 64, 'lr': 1.632656303909739e-05, 'lambda_val': 0.031538152891462376, 'batch_size': 1732, 'optimizer': 'Adam'}.
2026-06-13 20:29:03,780 - experiment_functions - INFO - Early stopping at epoch 1300. Best Metrics: (0.030804454826308312, 0.004646995780025454, 0.01646664423883761)
2026-06-13 20:29:03,867 - optuna.study.study - INFO - Trial 86 finished with values: [0.030804454826308312, 0.004646995780025454, 0.01646664423883761] and parameters: {'n_layers': 1, 'embedding_dim': 64, 'lr': 0.0016889361681909714, 'lambda_val': 0.00035318754870590177, 'batch_size': 3914, 'optimizer': 'RMSprop'}.
2026-06-13 20:29:37,942 - experiment_functions - INFO - Early stopping at epoch 850. Best Metrics: (0.01938635824604283, 0.0027781499095719743, 0.009717116387161525)
2026-06-13 20:29:38,021 - optuna.study.study - INFO - Trial 87 finished with values: [0.01938635824604283, 0.0027781499095719743, 0.009717116387161525] and parameters: {'n_layers': 4, 'embedding_dim': 32, 'lr': 0.007743186347665371, 'lambda_val': 0.0005195382127114068, 'batch_size': 818, 'optimizer': 'RMSprop'}.
2026-06-13 20:30:07,984 - experiment_functions - INFO - Early stopping at epoch 700. Best Metrics: (0.015548765326118544, 0.0021217094246098202, 0.007579712522902335)
2026-06-13 20:30:08,073 - optuna.study.study - INFO - Trial 88 finished with values: [0.015548765326118544, 0.0021217094246098202, 0.007579712522902335] and parameters: {'n_layers': 4, 'embedding_dim': 64, 'lr': 0.0018163821909776498, 'lambda_val': 0.02777174946505567, 'batch_size': 2830, 'optimizer': 'Adam'}.
2026-06-13 20:30:31,728 - experiment_functions - INFO - Early stopping at epoch 550. Best Metrics: (0.016222206458173235, 0.002381271351061692, 0.008405327721009517)
2026-06-13 20:30:31,823 - optuna.study.study - INFO - Trial 89 finished with values: [0.016222206458173235, 0.002381271351061692, 0.008405327721009517] and parameters: {'n_layers': 2, 'embedding_dim': 96, 'lr': 0.042947991983695886, 'lambda_val': 4.0905049993760175e-06, 'batch_size': 4095, 'optimizer': 'Adam'}.
2026-06-13 20:30:55,594 - experiment_functions - INFO - Early stopping at epoch 550. Best Metrics: (0.014172092536342024, 0.0020363051778417847, 0.007419229129209275)
2026-06-13 20:30:55,672 - optuna.study.study - INFO - Trial 90 finished with values: [0.014172092536342024, 0.0020363051778417847, 0.007419229129209275] and parameters: {'n_layers': 2, 'embedding_dim': 96, 'lr': 0.042947991983695886, 'lambda_val': 8.588254850037456e-05, 'batch_size': 2816, 'optimizer': 'Adam'}.
2026-06-13 20:31:25,251 - experiment_functions - INFO - Early stopping at epoch 750. Best Metrics: (0.010104889036914512, 0.00165449795699645, 0.005291625279251872)
2026-06-13 20:31:25,329 - optuna.study.study - INFO - Trial 91 finished with values: [0.010104889036914512, 0.00165449795699645, 0.005291625279251872] and parameters: {'n_layers': 1, 'embedding_dim': 64, 'lr': 0.021823625397344976, 'lambda_val': 4.193894827058616e-05, 'batch_size': 688, 'optimizer': 'Adam'}.
2026-06-13 20:31:53,316 - experiment_functions - INFO - Early stopping at epoch 500. Best Metrics: (0.0005681623432331053, 9.545180521133366e-05, 0.0002782367687066386)
2026-06-13 20:31:53,403 - optuna.study.study - INFO - Trial 92 finished with values: [0.0005681623432331053, 9.545180521133366e-05, 0.0002782367687066386] and parameters: {'n_layers': 4, 'embedding_dim': 256, 'lr': 0.0060199272034541455, 'lambda_val': 0.00019637406514583526, 'batch_size': 2364, 'optimizer': 'SGD'}.
2026-06-13 20:34:02,576 - experiment_functions - INFO - Early stopping at epoch 3350. Best Metrics: (0.01358328895703014, 0.0019525755241476322, 0.006408557304487556)
