2026-06-16 00:06:04,633 - optuna.study.study - INFO - Trial 287 finished with values: [0.08570949710453768, 0.010474579677138456, 0.04413953083060839] and parameters: {'n_layers': 1, 'embedding_dim': 128, 'lr': 0.001479782641411582, 'lambda_val': 0.0012522872845674186, 'batch_size': 3109, 'optimizer': 'RMSprop'}.
2026-06-16 00:07:36,365 - experiment_functions - INFO - Early stopping at epoch 2100. Best Metrics: (0.0004555978762279583, 7.870587447250318e-05, 0.00020017709004764233)
2026-06-16 00:07:36,451 - optuna.study.study - INFO - Trial 288 finished with values: [0.0004555978762279583, 7.870587447250318e-05, 0.00020017709004764233] and parameters: {'n_layers': 2, 'embedding_dim': 128, 'lr': 4.271462659670454e-05, 'lambda_val': 0.00041942469140426685, 'batch_size': 1264, 'optimizer': 'RMSprop'}.
2026-06-16 00:08:17,149 - experiment_functions - INFO - Early stopping at epoch 800. Best Metrics: (0.09205280477337507, 0.011228146560385826, 0.048762038704802384)
2026-06-16 00:08:17,253 - optuna.study.study - INFO - Trial 289 finished with values: [0.09205280477337507, 0.011228146560385826, 0.048762038704802384] and parameters: {'n_layers': 1, 'embedding_dim': 256, 'lr': 0.0036742654809996723, 'lambda_val': 6.461965909578869e-06, 'batch_size': 3226, 'optimizer': 'Adam'}.
2026-06-16 00:11:47,159 - optuna.study.study - INFO - Trial 290 finished with values: [0.05839486489528445, 0.00692611695358028, 0.027429091837480653] and parameters: {'n_layers': 2, 'embedding_dim': 256, 'lr': 0.001479782641411582, 'lambda_val': 6.461965909578869e-06, 'batch_size': 1214, 'optimizer': 'RMSprop'}.
2026-06-16 00:12:27,481 - experiment_functions - INFO - Early stopping at epoch 950. Best Metrics: (0.08534940855644707, 0.01031716792819345, 0.04541333938920917)
2026-06-16 00:12:27,597 - optuna.study.study - INFO - Trial 291 finished with values: [0.08534940855644707, 0.01031716792819345, 0.04541333938920917] and parameters: {'n_layers': 1, 'embedding_dim': 32, 'lr': 0.0036742654809996723, 'lambda_val': 1.7187471777464757e-05, 'batch_size': 3747, 'optimizer': 'Adam'}.
2026-06-16 00:15:05,365 - optuna.study.study - INFO - Trial 292 finished with values: [0.06037762169869726, 0.008277513564203899, 0.03519995425404056] and parameters: {'n_layers': 1, 'embedding_dim': 32, 'lr': 0.0008007729293904306, 'lambda_val': 0.0001810183010413855, 'batch_size': 2005, 'optimizer': 'Adam'}.
2026-06-16 00:17:43,524 - optuna.study.study - INFO - Trial 293 finished with values: [0.08859820686961473, 0.011065711032219172, 0.0493126702415128] and parameters: {'n_layers': 1, 'embedding_dim': 32, 'lr': 0.001479782641411582, 'lambda_val': 0.00041942469140426685, 'batch_size': 1650, 'optimizer': 'Adam'}.
2026-06-16 00:20:29,159 - optuna.study.study - INFO - Trial 294 finished with values: [0.06821024590452296, 0.008510282001473643, 0.038004266239559395] and parameters: {'n_layers': 2, 'embedding_dim': 32, 'lr': 0.0008007729293904306, 'lambda_val': 8.744111230415747e-06, 'batch_size': 1173, 'optimizer': 'RMSprop'}.
2026-06-16 00:23:09,963 - optuna.study.study - INFO - Trial 295 finished with values: [0.026340779663836047, 0.004218299953111394, 0.015114270340121076] and parameters: {'n_layers': 1, 'embedding_dim': 32, 'lr': 0.0008105588166462481, 'lambda_val': 0.0001466773178072416, 'batch_size': 738, 'optimizer': 'Adam'}.
2026-06-16 00:26:04,371 - optuna.study.study - INFO - Trial 296 finished with values: [0.0989846469644998, 0.012209458101681293, 0.05432027414213226] and parameters: {'n_layers': 1, 'embedding_dim': 128, 'lr': 0.001479782641411582, 'lambda_val': 2.0623181656245837e-06, 'batch_size': 1247, 'optimizer': 'Adam'}.
2026-06-16 00:29:09,068 - optuna.study.study - INFO - Trial 297 finished with values: [0.03169050402344697, 0.0035836291781097193, 0.013704538327540872] and parameters: {'n_layers': 3, 'embedding_dim': 128, 'lr': 0.003294440016851685, 'lambda_val': 1.2197328169158084e-05, 'batch_size': 522, 'optimizer': 'Adam'}.
2026-06-16 00:31:44,929 - optuna.study.study - INFO - Trial 298 finished with values: [0.0828039481663515, 0.010307120369750152, 0.04429280142403106] and parameters: {'n_layers': 1, 'embedding_dim': 32, 'lr': 0.001479782641411582, 'lambda_val': 0.0012522872845674186, 'batch_size': 1650, 'optimizer': 'Adam'}.
2026-06-16 00:32:14,413 - experiment_functions - INFO - Early stopping at epoch 700. Best Metrics: (0.057509418399063685, 0.00714548864625896, 0.029440476155431463)
2026-06-16 00:32:14,614 - optuna.study.study - INFO - Trial 299 finished with values: [0.057509418399063685, 0.00714548864625896, 0.029440476155431463] and parameters: {'n_layers': 2, 'embedding_dim': 32, 'lr': 0.0036742654809996723, 'lambda_val': 7.752752600732528e-05, 'batch_size': 2005, 'optimizer': 'Adam'}.
2026-06-16 00:32:14,724 - root - INFO - Selected Trial 278 based on Max ndcg: 0.0586
2026-06-16 00:32:14,724 - root - INFO - Associated Recall: 0.1088
2026-06-16 00:32:14,724 - experiment_functions - INFO - Training the best model ... for e_gowalla_1c3dcs_rand5
2026-06-16 00:35:26,791 - root - INFO - Writing final results ...
2026-06-16 00:35:26,800 - root - INFO - Done.
