2026-06-14 07:53:46,739 - optuna.study.study - INFO - Trial 181 finished with values: [0.0005320708143234769, 7.033290910308795e-05, 0.0002398257361364897] and parameters: {'n_layers': 3, 'embedding_dim': 96, 'lr': 0.0008197571059817735, 'lambda_val': 1.910365266111311e-06, 'batch_size': 2682, 'optimizer': 'SGD'}.
2026-06-14 07:54:14,058 - experiment_functions - INFO - Early stopping at epoch 650. Best Metrics: (0.06976524206477075, 0.008786589858664345, 0.03643912284249808)
2026-06-14 07:54:14,221 - optuna.study.study - INFO - Trial 182 finished with values: [0.06976524206477075, 0.008786589858664345, 0.03643912284249808] and parameters: {'n_layers': 1, 'embedding_dim': 32, 'lr': 0.00486276978616333, 'lambda_val': 0.0003071461412000055, 'batch_size': 3438, 'optimizer': 'Adam'}.
2026-06-14 07:56:49,790 - optuna.study.study - INFO - Trial 183 finished with values: [0.04452417494816516, 0.006237859200214348, 0.02556787247951435] and parameters: {'n_layers': 2, 'embedding_dim': 32, 'lr': 0.00037952805925517045, 'lambda_val': 0.0003290497000722153, 'batch_size': 1120, 'optimizer': 'Adam'}.
2026-06-14 07:57:44,911 - experiment_functions - INFO - Early stopping at epoch 1000. Best Metrics: (0.07428460436825979, 0.009277245629312076, 0.037450452680923826)
2026-06-14 07:57:44,989 - optuna.study.study - INFO - Trial 184 finished with values: [0.07428460436825979, 0.009277245629312076, 0.037450452680923826] and parameters: {'n_layers': 2, 'embedding_dim': 256, 'lr': 0.0009554934943534302, 'lambda_val': 0.00014895795346764513, 'batch_size': 4002, 'optimizer': 'Adam'}.
2026-06-14 07:58:15,810 - experiment_functions - INFO - Early stopping at epoch 600. Best Metrics: (0.08406535589126438, 0.010431040257217498, 0.04529202742217561)
2026-06-14 07:58:15,903 - optuna.study.study - INFO - Trial 185 finished with values: [0.08406535589126438, 0.010431040257217498, 0.04529202742217561] and parameters: {'n_layers': 1, 'embedding_dim': 256, 'lr': 0.00486276978616333, 'lambda_val': 0.0001364070822934131, 'batch_size': 3686, 'optimizer': 'Adam'}.
2026-06-14 07:58:36,963 - experiment_functions - INFO - Early stopping at epoch 500. Best Metrics: (0.0005558349719905237, 7.368209525085404e-05, 0.000235966240151044)
2026-06-14 07:58:37,043 - optuna.study.study - INFO - Trial 186 finished with values: [0.0005558349719905237, 7.368209525085404e-05, 0.000235966240151044] and parameters: {'n_layers': 2, 'embedding_dim': 32, 'lr': 0.0007333136681919207, 'lambda_val': 4.898157643229756e-06, 'batch_size': 3268, 'optimizer': 'SGD'}.
2026-06-14 07:59:12,464 - experiment_functions - INFO - Early stopping at epoch 850. Best Metrics: (0.07352562291796631, 0.009216960278652288, 0.037802636714871676)
2026-06-14 07:59:12,541 - optuna.study.study - INFO - Trial 187 finished with values: [0.07352562291796631, 0.009216960278652288, 0.037802636714871676] and parameters: {'n_layers': 1, 'embedding_dim': 32, 'lr': 0.002252910187430102, 'lambda_val': 0.0012360905541564393, 'batch_size': 3749, 'optimizer': 'Adam'}.
2026-06-14 08:01:59,707 - optuna.study.study - INFO - Trial 188 finished with values: [0.08635386118747895, 0.011120972603657311, 0.04894214507520902] and parameters: {'n_layers': 1, 'embedding_dim': 96, 'lr': 0.0008197571059817735, 'lambda_val': 1.910365266111311e-06, 'batch_size': 1405, 'optimizer': 'Adam'}.
2026-06-14 08:05:11,749 - optuna.study.study - INFO - Trial 189 finished with values: [0.09416855646924721, 0.011995110188224262, 0.05154329415495538] and parameters: {'n_layers': 1, 'embedding_dim': 256, 'lr': 0.0005276844076496385, 'lambda_val': 0.0003071461412000055, 'batch_size': 3438, 'optimizer': 'Adam'}.
2026-06-14 08:08:00,686 - optuna.study.study - INFO - Trial 190 finished with values: [0.09470330996484948, 0.011973340478263782, 0.05222393339852674] and parameters: {'n_layers': 1, 'embedding_dim': 96, 'lr': 0.0008197571059817735, 'lambda_val': 1.910365266111311e-06, 'batch_size': 3452, 'optimizer': 'Adam'}.
2026-06-14 08:10:52,268 - optuna.study.study - INFO - Trial 191 finished with values: [0.09941713649980681, 0.012430504387433853, 0.056022079329731904] and parameters: {'n_layers': 1, 'embedding_dim': 128, 'lr': 0.0009554934943534302, 'lambda_val': 1.547696085959405e-05, 'batch_size': 1995, 'optimizer': 'Adam'}.
2026-06-14 08:11:17,234 - experiment_functions - INFO - Early stopping at epoch 600. Best Metrics: (0.05002605210380589, 0.006021836693683435, 0.024189068728735753)
2026-06-14 08:11:17,321 - optuna.study.study - INFO - Trial 192 finished with values: [0.05002605210380589, 0.006021836693683435, 0.024189068728735753] and parameters: {'n_layers': 1, 'embedding_dim': 32, 'lr': 0.013392268143813588, 'lambda_val': 1.547696085959405e-05, 'batch_size': 2132, 'optimizer': 'Adam'}.
2026-06-14 08:14:07,188 - optuna.study.study - INFO - Trial 193 finished with values: [0.06894791986402446, 0.009312412083863622, 0.037265010784053657] and parameters: {'n_layers': 1, 'embedding_dim': 128, 'lr': 0.0004553975451984739, 'lambda_val': 0.004913946733537837, 'batch_size': 2917, 'optimizer': 'Adam'}.
2026-06-14 08:14:33,824 - experiment_functions - INFO - Early stopping at epoch 550. Best Metrics: (0.025829605946206466, 0.0030896242213142213, 0.01207046413869944)
2026-06-14 08:14:33,900 - optuna.study.study - INFO - Trial 194 finished with values: [0.025829605946206466, 0.0030896242213142213, 0.01207046413869944] and parameters: {'n_layers': 3, 'embedding_dim': 96, 'lr': 0.06166603447427804, 'lambda_val': 0.00014895795346764513, 'batch_size': 1588, 'optimizer': 'Adam'}.
2026-06-14 08:15:02,804 - experiment_functions - INFO - Early stopping at epoch 650. Best Metrics: (0.07917233208825855, 0.009900194252796571, 0.041980125288638544)
2026-06-14 08:15:02,873 - optuna.study.study - INFO - Trial 195 finished with values: [0.07917233208825855, 0.009900194252796571, 0.041980125288638544] and parameters: {'n_layers': 1, 'embedding_dim': 96, 'lr': 0.00486276978616333, 'lambda_val': 0.0003071461412000055, 'batch_size': 3438, 'optimizer': 'Adam'}.
2026-06-14 08:15:34,256 - experiment_functions - INFO - Early stopping at epoch 700. Best Metrics: (0.05512095312301145, 0.007331368477459977, 0.027966632066797392)
2026-06-14 08:15:34,345 - optuna.study.study - INFO - Trial 196 finished with values: [0.05512095312301145, 0.007331368477459977, 0.027966632066797392] and parameters: {'n_layers': 1, 'embedding_dim': 128, 'lr': 0.002252910187430102, 'lambda_val': 0.010798230168850866, 'batch_size': 2917, 'optimizer': 'Adam'}.
2026-06-14 08:16:07,189 - experiment_functions - INFO - Early stopping at epoch 750. Best Metrics: (0.06557893025576836, 0.00864090026123652, 0.03425412831788672)
2026-06-14 08:16:07,299 - optuna.study.study - INFO - Trial 197 finished with values: [0.06557893025576836, 0.00864090026123652, 0.03425412831788672] and parameters: {'n_layers': 1, 'embedding_dim': 96, 'lr': 0.0020642799008971833, 'lambda_val': 0.003887569304557066, 'batch_size': 4002, 'optimizer': 'Adam'}.
2026-06-14 08:16:51,845 - experiment_functions - INFO - Early stopping at epoch 1100. Best Metrics: (0.000535730204751087, 8.540424676803537e-05, 0.00028775064994460755)
2026-06-14 08:16:51,956 - optuna.study.study - INFO - Trial 198 finished with values: [0.000535730204751087, 8.540424676803537e-05, 0.00028775064994460755] and parameters: {'n_layers': 1, 'embedding_dim': 96, 'lr': 7.438855050797402e-05, 'lambda_val': 0.0001364070822934131, 'batch_size': 3012, 'optimizer': 'RMSprop'}.
2026-06-14 08:19:39,286 - optuna.study.study - INFO - Trial 199 finished with values: [0.09637319370974552, 0.012072141469622882, 0.053075245261527716] and parameters: {'n_layers': 1, 'embedding_dim': 96, 'lr': 0.0008197571059817735, 'lambda_val': 1.910365266111311e-06, 'batch_size': 2852, 'optimizer': 'Adam'}.
2026-06-14 08:22:15,401 - optuna.study.study - INFO - Trial 200 finished with values: [0.07500562878442511, 0.009520061625025118, 0.04038848558806117] and parameters: {'n_layers': 1, 'embedding_dim': 32, 'lr': 0.0006380704426022134, 'lambda_val': 0.0003071461412000055, 'batch_size': 3438, 'optimizer': 'Adam'}.
2026-06-14 08:22:54,590 - experiment_functions - INFO - Early stopping at epoch 950. Best Metrics: (0.08005421634595154, 0.010126264317770783, 0.04256058608265013)
2026-06-14 08:22:54,673 - optuna.study.study - INFO - Trial 201 finished with values: [0.08005421634595154, 0.010126264317770783, 0.04256058608265013] and parameters: {'n_layers': 1, 'embedding_dim': 32, 'lr': 0.0020642799008971833, 'lambda_val': 0.0003290497000722153, 'batch_size': 4002, 'optimizer': 'Adam'}.
2026-06-14 08:23:58,558 - experiment_functions - INFO - Early stopping at epoch 1500. Best Metrics: (0.059641792775322194, 0.007497153191774398, 0.030170079834927862)
2026-06-14 08:23:58,636 - optuna.study.study - INFO - Trial 202 finished with values: [0.059641792775322194, 0.007497153191774398, 0.030170079834927862] and parameters: {'n_layers': 2, 'embedding_dim': 64, 'lr': 0.0008651627183322989, 'lambda_val': 0.0003071461412000055, 'batch_size': 3452, 'optimizer': 'RMSprop'}.
2026-06-14 08:24:52,796 - experiment_functions - INFO - Early stopping at epoch 1350. Best Metrics: (0.08101353736131939, 0.010005693616451202, 0.0412986799177409)
2026-06-14 08:24:52,872 - optuna.study.study - INFO - Trial 203 finished with values: [0.08101353736131939, 0.010005693616451202, 0.0412986799177409] and parameters: {'n_layers': 1, 'embedding_dim': 32, 'lr': 0.002252910187430102, 'lambda_val': 2.76457759171546e-06, 'batch_size': 3452, 'optimizer': 'Adam'}.
2026-06-14 08:25:17,762 - experiment_functions - INFO - Early stopping at epoch 600. Best Metrics: (0.0733225817669258, 0.009263848884721013, 0.03800008969644638)
2026-06-14 08:25:17,821 - optuna.study.study - INFO - Trial 204 finished with values: [0.0733225817669258, 0.009263848884721013, 0.03800008969644638] and parameters: {'n_layers': 1, 'embedding_dim': 32, 'lr': 0.007475059398880648, 'lambda_val': 0.0003071461412000055, 'batch_size': 3197, 'optimizer': 'Adam'}.
2026-06-14 08:25:47,785 - experiment_functions - INFO - Early stopping at epoch 650. Best Metrics: (0.05144220858992288, 0.006552682698104361, 0.025622550922641794)
2026-06-14 08:25:47,871 - optuna.study.study - INFO - Trial 205 finished with values: [0.05144220858992288, 0.006552682698104361, 0.025622550922641794] and parameters: {'n_layers': 2, 'embedding_dim': 96, 'lr': 0.0020642799008971833, 'lambda_val': 0.003887569304557066, 'batch_size': 4002, 'optimizer': 'Adam'}.
2026-06-14 08:26:19,437 - experiment_functions - INFO - Early stopping at epoch 650. Best Metrics: (0.0436023079299774, 0.005562998191439481, 0.02165902836889233)
2026-06-14 08:26:19,520 - optuna.study.study - INFO - Trial 206 finished with values: [0.0436023079299774, 0.005562998191439481, 0.02165902836889233] and parameters: {'n_layers': 3, 'embedding_dim': 96, 'lr': 0.002252910187430102, 'lambda_val': 0.0001364070822934131, 'batch_size': 3300, 'optimizer': 'Adam'}.
2026-06-14 08:29:01,660 - optuna.study.study - INFO - Trial 207 finished with values: [0.08988281397500711, 0.011209726036573112, 0.04764434627053035] and parameters: {'n_layers': 1, 'embedding_dim': 64, 'lr': 0.0009554934943534302, 'lambda_val': 0.00014895795346764513, 'batch_size': 3452, 'optimizer': 'Adam'}.
2026-06-14 08:31:20,006 - experiment_functions - INFO - Early stopping at epoch 3200. Best Metrics: (0.09874926474027981, 0.012244624556232837, 0.053992336093025964)
2026-06-14 08:31:20,091 - optuna.study.study - INFO - Trial 208 finished with values: [0.09874926474027981, 0.012244624556232837, 0.053992336093025964] and parameters: {'n_layers': 1, 'embedding_dim': 128, 'lr': 0.0011116819593430245, 'lambda_val': 0.00014895795346764513, 'batch_size': 1995, 'optimizer': 'Adam'}.
2026-06-14 08:33:57,135 - optuna.study.study - INFO - Trial 209 finished with values: [0.08450447733552906, 0.010774331837363522, 0.04679893831244517] and parameters: {'n_layers': 1, 'embedding_dim': 32, 'lr': 0.0009554934943534302, 'lambda_val': 0.0001364070822934131, 'batch_size': 2917, 'optimizer': 'Adam'}.
2026-06-14 08:36:49,162 - optuna.study.study - INFO - Trial 210 finished with values: [0.09661788617566039, 0.01212070466876549, 0.05339089200880968] and parameters: {'n_layers': 1, 'embedding_dim': 128, 'lr': 0.0009554934943534302, 'lambda_val': 1.547696085959405e-05, 'batch_size': 1995, 'optimizer': 'Adam'}.
2026-06-14 08:37:20,248 - experiment_functions - INFO - Early stopping at epoch 700. Best Metrics: (0.08284155103602407, 0.010419318105700313, 0.04433660911734806)
2026-06-14 08:37:20,330 - optuna.study.study - INFO - Trial 211 finished with values: [0.08284155103602407, 0.010419318105700313, 0.04433660911734806] and parameters: {'n_layers': 1, 'embedding_dim': 96, 'lr': 0.0033680041802668847, 'lambda_val': 0.0003071461412000055, 'batch_size': 3438, 'optimizer': 'Adam'}.
2026-06-14 08:37:47,957 - experiment_functions - INFO - Early stopping at epoch 600. Best Metrics: (0.07852567277424309, 0.009649005291714115, 0.04062390922707322)
2026-06-14 08:37:48,038 - optuna.study.study - INFO - Trial 212 finished with values: [0.07852567277424309, 0.009649005291714115, 0.04062390922707322] and parameters: {'n_layers': 1, 'embedding_dim': 128, 'lr': 0.006718450684855812, 'lambda_val': 0.0003071461412000055, 'batch_size': 3438, 'optimizer': 'Adam'}.
2026-06-14 08:40:00,918 - experiment_functions - INFO - Early stopping at epoch 3250. Best Metrics: (0.09060736735405171, 0.011144416906691676, 0.04848243848945087)
2026-06-14 08:40:01,007 - optuna.study.study - INFO - Trial 213 finished with values: [0.09060736735405171, 0.011144416906691676, 0.04848243848945087] and parameters: {'n_layers': 1, 'embedding_dim': 64, 'lr': 0.0011116819593430245, 'lambda_val': 1.547696085959405e-05, 'batch_size': 3120, 'optimizer': 'Adam'}.
2026-06-14 08:42:31,672 - experiment_functions - INFO - Early stopping at epoch 3100. Best Metrics: (0.05717955507762714, 0.007016544979569965, 0.028054941382997634)
2026-06-14 08:42:31,746 - optuna.study.study - INFO - Trial 214 finished with values: [0.05717955507762714, 0.007016544979569965, 0.028054941382997634] and parameters: {'n_layers': 3, 'embedding_dim': 128, 'lr': 0.0009554934943534302, 'lambda_val': 1.547696085959405e-05, 'batch_size': 1995, 'optimizer': 'Adam'}.
2026-06-14 08:43:23,644 - experiment_functions - INFO - Early stopping at epoch 1200. Best Metrics: (0.08716883642379274, 0.010819545850358363, 0.046115494000909155)
2026-06-14 08:43:23,734 - optuna.study.study - INFO - Trial 215 finished with values: [0.08716883642379274, 0.010819545850358363, 0.046115494000909155] and parameters: {'n_layers': 1, 'embedding_dim': 96, 'lr': 0.002252910187430102, 'lambda_val': 1.910365266111311e-06, 'batch_size': 1405, 'optimizer': 'Adam'}.
2026-06-14 08:44:42,047 - experiment_functions - INFO - Early stopping at epoch 1950. Best Metrics: (0.08292885747214562, 0.010077701118628175, 0.041762039856782014)
2026-06-14 08:44:42,132 - optuna.study.study - INFO - Trial 216 finished with values: [0.08292885747214562, 0.010077701118628175, 0.041762039856782014] and parameters: {'n_layers': 1, 'embedding_dim': 32, 'lr': 0.002252910187430102, 'lambda_val': 0.0001364070822934131, 'batch_size': 3300, 'optimizer': 'Adam'}.
2026-06-14 08:47:34,338 - experiment_functions - INFO - Early stopping at epoch 3650. Best Metrics: (0.08038374546148708, 0.00974110791077768, 0.04030886129887587)
2026-06-14 08:47:34,436 - optuna.study.study - INFO - Trial 217 finished with values: [0.08038374546148708, 0.00974110791077768, 0.04030886129887587] and parameters: {'n_layers': 1, 'embedding_dim': 256, 'lr': 0.002252910187430102, 'lambda_val': 1.1430377348246126e-06, 'batch_size': 2211, 'optimizer': 'RMSprop'}.
2026-06-14 08:48:11,917 - experiment_functions - INFO - Early stopping at epoch 850. Best Metrics: (0.0618826298087627, 0.007837095585772657, 0.031337797774514044)
2026-06-14 08:48:12,001 - optuna.study.study - INFO - Trial 218 finished with values: [0.0618826298087627, 0.007837095585772657, 0.031337797774514044] and parameters: {'n_layers': 2, 'embedding_dim': 64, 'lr': 0.0011116819593430245, 'lambda_val': 0.0007111068429087423, 'batch_size': 3517, 'optimizer': 'Adam'}.
2026-06-14 08:50:58,527 - optuna.study.study - INFO - Trial 219 finished with values: [0.090650311555844, 0.01152120034831536, 0.05068708779030489] and parameters: {'n_layers': 1, 'embedding_dim': 96, 'lr': 0.0007333136681919207, 'lambda_val': 4.898157643229756e-06, 'batch_size': 2132, 'optimizer': 'Adam'}.
2026-06-14 08:53:35,359 - optuna.study.study - INFO - Trial 220 finished with values: [0.07093405510491686, 0.009240404581686651, 0.04043539499636136] and parameters: {'n_layers': 1, 'embedding_dim': 32, 'lr': 0.0008197571059817735, 'lambda_val': 1.910365266111311e-06, 'batch_size': 1405, 'optimizer': 'Adam'}.
2026-06-14 08:56:10,499 - optuna.study.study - INFO - Trial 221 finished with values: [0.07116992968416513, 0.009211936499430638, 0.03877669116004558] and parameters: {'n_layers': 1, 'embedding_dim': 32, 'lr': 0.0007333136681919207, 'lambda_val': 0.0001364070822934131, 'batch_size': 2132, 'optimizer': 'Adam'}.
2026-06-14 08:58:41,959 - optuna.study.study - INFO - Trial 222 finished with values: [0.04057504085085344, 0.005701989416571773, 0.02370885747317541] and parameters: {'n_layers': 1, 'embedding_dim': 32, 'lr': 0.00034081213821976773, 'lambda_val': 0.0003290497000722153, 'batch_size': 3438, 'optimizer': 'RMSprop'}.
2026-06-14 08:59:08,567 - experiment_functions - INFO - Early stopping at epoch 550. Best Metrics: (0.028521444986374652, 0.0033659320785049233, 0.013022581226599177)
2026-06-14 08:59:08,662 - optuna.study.study - INFO - Trial 223 finished with values: [0.028521444986374652, 0.0033659320785049233, 0.013022581226599177] and parameters: {'n_layers': 2, 'embedding_dim': 128, 'lr': 0.027365020781691878, 'lambda_val': 0.0003071461412000055, 'batch_size': 3120, 'optimizer': 'Adam'}.
2026-06-14 08:59:37,469 - experiment_functions - INFO - Early stopping at epoch 550. Best Metrics: (0.035665365030712874, 0.00416638756782102, 0.016718898564115552)
2026-06-14 08:59:37,558 - optuna.study.study - INFO - Trial 224 finished with values: [0.035665365030712874, 0.00416638756782102, 0.016718898564115552] and parameters: {'n_layers': 3, 'embedding_dim': 128, 'lr': 0.00486276978616333, 'lambda_val': 0.0003071461412000055, 'batch_size': 2454, 'optimizer': 'Adam'}.
2026-06-14 09:00:26,956 - experiment_functions - INFO - Early stopping at epoch 1100. Best Metrics: (0.08520149849308767, 0.010677205439078302, 0.045049536234520536)
2026-06-14 09:00:27,337 - optuna.study.study - INFO - Trial 225 finished with values: [0.08520149849308767, 0.010677205439078302, 0.045049536234520536] and parameters: {'n_layers': 1, 'embedding_dim': 128, 'lr': 0.002252910187430102, 'lambda_val': 0.00014895795346764513, 'batch_size': 1995, 'optimizer': 'Adam'}.
2026-06-14 09:03:21,361 - optuna.study.study - INFO - Trial 226 finished with values: [0.09893808074469894, 0.012418782235916673, 0.05513238800816165] and parameters: {'n_layers': 1, 'embedding_dim': 128, 'lr': 0.0008197571059817735, 'lambda_val': 1.910365266111311e-06, 'batch_size': 2416, 'optimizer': 'Adam'}.
2026-06-14 09:04:46,496 - experiment_functions - INFO - Early stopping at epoch 1950. Best Metrics: (0.08742948826728546, 0.010667157880635006, 0.0458895477867079)
2026-06-14 09:04:46,587 - optuna.study.study - INFO - Trial 227 finished with values: [0.08742948826728546, 0.010667157880635006, 0.0458895477867079] and parameters: {'n_layers': 1, 'embedding_dim': 128, 'lr': 0.0011116819593430245, 'lambda_val': 0.0003071461412000055, 'batch_size': 2130, 'optimizer': 'RMSprop'}.
2026-06-14 09:05:25,654 - experiment_functions - INFO - Early stopping at epoch 850. Best Metrics: (0.05164338986810333, 0.006594547524951437, 0.026082231498328445)
2026-06-14 09:05:25,749 - optuna.study.study - INFO - Trial 228 finished with values: [0.05164338986810333, 0.006594547524951437, 0.026082231498328445] and parameters: {'n_layers': 2, 'embedding_dim': 96, 'lr': 0.0011116819593430245, 'lambda_val': 0.0003071461412000055, 'batch_size': 2841, 'optimizer': 'RMSprop'}.
2026-06-14 09:08:31,699 - optuna.study.study - INFO - Trial 229 finished with values: [0.0054666884492142855, 0.0007803603724294997, 0.0028273586274012385] and parameters: {'n_layers': 4, 'embedding_dim': 96, 'lr': 7.932996623536391e-05, 'lambda_val': 0.0001364070822934131, 'batch_size': 1573, 'optimizer': 'Adam'}.
2026-06-14 09:09:08,145 - experiment_functions - INFO - Early stopping at epoch 850. Best Metrics: (0.08224852853807237, 0.010340612231227812, 0.04360006775289189)
2026-06-14 09:09:08,218 - optuna.study.study - INFO - Trial 230 finished with values: [0.08224852853807237, 0.010340612231227812, 0.04360006775289189] and parameters: {'n_layers': 1, 'embedding_dim': 64, 'lr': 0.002252910187430102, 'lambda_val': 2.2728319731025804e-05, 'batch_size': 3452, 'optimizer': 'Adam'}.
2026-06-14 09:12:19,255 - optuna.study.study - INFO - Trial 231 finished with values: [0.10178472556633184, 0.012778819746801525, 0.05666969674004349] and parameters: {'n_layers': 1, 'embedding_dim': 256, 'lr': 0.0007333136681919207, 'lambda_val': 2.2728319731025804e-05, 'batch_size': 2234, 'optimizer': 'RMSprop'}.
2026-06-14 09:15:14,023 - optuna.study.study - INFO - Trial 232 finished with values: [0.09977166614952526, 0.01252763078571907, 0.054397066250535905] and parameters: {'n_layers': 1, 'embedding_dim': 128, 'lr': 0.0008197571059817735, 'lambda_val': 0.00014895795346764513, 'batch_size': 3078, 'optimizer': 'Adam'}.
2026-06-14 09:15:42,935 - experiment_functions - INFO - Early stopping at epoch 650. Best Metrics: (0.08104904686555268, 0.010126264317770781, 0.04199999790624364)
