2026-06-14 11:21:51,388 - optuna.study.study - INFO - Trial 291 finished with values: [0.10008248804726186, 0.012298211534597094, 0.05330603011295138] and parameters: {'n_layers': 1, 'embedding_dim': 256, 'lr': 0.0007333136681919207, 'lambda_val': 0.00014895795346764513, 'batch_size': 2132, 'optimizer': 'RMSprop'}.
2026-06-14 11:23:14,031 - experiment_functions - INFO - Early stopping at epoch 1700. Best Metrics: (0.05028976673026093, 0.006296469957800256, 0.02434053625590791)
2026-06-14 11:23:14,103 - optuna.study.study - INFO - Trial 292 finished with values: [0.05028976673026093, 0.006296469957800256, 0.02434053625590791] and parameters: {'n_layers': 3, 'embedding_dim': 128, 'lr': 0.0009554934943534302, 'lambda_val': 4.898157643229756e-06, 'batch_size': 1995, 'optimizer': 'RMSprop'}.
2026-06-14 11:23:35,001 - experiment_functions - INFO - Early stopping at epoch 500. Best Metrics: (0.0005684073181868167, 7.87058744725032e-05, 0.0002358869081358649)
2026-06-14 11:23:35,591 - optuna.study.study - INFO - Trial 293 finished with values: [0.0005684073181868167, 7.87058744725032e-05, 0.0002358869081358649] and parameters: {'n_layers': 1, 'embedding_dim': 64, 'lr': 0.0009554934943534302, 'lambda_val': 0.0001364070822934131, 'batch_size': 3452, 'optimizer': 'SGD'}.
2026-06-14 11:25:16,801 - experiment_functions - INFO - Early stopping at epoch 1850. Best Metrics: (0.07606521396569926, 0.00961383883716257, 0.04007446687381576)
2026-06-14 11:25:16,896 - optuna.study.study - INFO - Trial 294 finished with values: [0.07606521396569926, 0.00961383883716257, 0.04007446687381576] and parameters: {'n_layers': 2, 'embedding_dim': 256, 'lr': 0.0007005785040331192, 'lambda_val': 0.0003071461412000055, 'batch_size': 1756, 'optimizer': 'Adam'}.
2026-06-14 11:28:08,669 - optuna.study.study - INFO - Trial 295 finished with values: [0.09398502649154822, 0.011887936231495748, 0.052052363562505026] and parameters: {'n_layers': 1, 'embedding_dim': 128, 'lr': 0.0007538893307285564, 'lambda_val': 1.547696085959405e-05, 'batch_size': 2132, 'optimizer': 'RMSprop'}.
2026-06-14 11:30:55,087 - optuna.study.study - INFO - Trial 296 finished with values: [0.08823767781256044, 0.011206376850425349, 0.04717019630980125] and parameters: {'n_layers': 1, 'embedding_dim': 96, 'lr': 0.0006380704426022134, 'lambda_val': 0.0003071461412000055, 'batch_size': 3438, 'optimizer': 'Adam'}.
2026-06-14 11:34:06,116 - optuna.study.study - INFO - Trial 297 finished with values: [0.10100139530089101, 0.012520932413423537, 0.0552866723245603] and parameters: {'n_layers': 1, 'embedding_dim': 256, 'lr': 0.0009554934943534302, 'lambda_val': 3.021347826956105e-06, 'batch_size': 1995, 'optimizer': 'RMSprop'}.
2026-06-14 11:36:44,466 - optuna.study.study - INFO - Trial 298 finished with values: [0.08320577082775261, 0.01050472235246835, 0.04474684830792108] and parameters: {'n_layers': 1, 'embedding_dim': 32, 'lr': 0.0009554934943534302, 'lambda_val': 0.0001364070822934131, 'batch_size': 2917, 'optimizer': 'Adam'}.
2026-06-14 11:39:37,335 - optuna.study.study - INFO - Trial 299 finished with values: [0.09436301904603135, 0.01179750820550606, 0.05070830943626718] and parameters: {'n_layers': 1, 'embedding_dim': 128, 'lr': 0.0009554934943534302, 'lambda_val': 0.0003071461412000055, 'batch_size': 1995, 'optimizer': 'Adam'}.
2026-06-14 11:39:37,351 - root - INFO - Selected Trial 231 based on Max ndcg: 0.0567
2026-06-14 11:39:37,351 - root - INFO - Associated Recall: 0.1018
2026-06-14 11:39:37,351 - experiment_functions - INFO - Training the best model ... for e_gowalla_1c3dcs
2026-06-14 11:42:48,139 - root - INFO -   **** Training e_gowalla_1c3dcs_rand1
2026-06-14 11:42:48,276 - root - INFO -   **** Getting 558671/845292 random edges
2026-06-14 11:42:48,547 - optuna.storages._rdb.storage - INFO - A new study created in RDB with name: Study_e_gowalla_1c3dcs_rand1
2026-06-14 11:45:38,094 - optuna.study.study - INFO - Trial 0 finished with values: [0.05169904728822202, 0.005507736620001341, 0.023844323046817183] and parameters: {'n_layers': 2, 'embedding_dim': 96, 'lr': 0.014831110208259727, 'lambda_val': 5.588502828653658e-06, 'batch_size': 3193, 'optimizer': 'RMSprop'}.
2026-06-14 11:46:02,760 - experiment_functions - INFO - Early stopping at epoch 500. Best Metrics: (0.0006087874543731432, 9.042802598968451e-05, 0.000306404413605298)
2026-06-14 11:46:02,861 - optuna.study.study - INFO - Trial 1 finished with values: [0.0006087874543731432, 9.042802598968451e-05, 0.000306404413605298] and parameters: {'n_layers': 4, 'embedding_dim': 96, 'lr': 0.000245703660406617, 'lambda_val': 5.665627570491681e-06, 'batch_size': 3131, 'optimizer': 'SGD'}.
2026-06-14 11:46:29,339 - experiment_functions - INFO - Early stopping at epoch 550. Best Metrics: (0.032411578648128825, 0.0039135240136646795, 0.015604710317258108)
2026-06-14 11:46:29,428 - optuna.study.study - INFO - Trial 2 finished with values: [0.032411578648128825, 0.0039135240136646795, 0.015604710317258108] and parameters: {'n_layers': 2, 'embedding_dim': 128, 'lr': 0.020854686224199056, 'lambda_val': 0.00011547624482479541, 'batch_size': 1409, 'optimizer': 'Adam'}.
2026-06-14 11:47:15,414 - experiment_functions - INFO - Early stopping at epoch 1000. Best Metrics: (0.021011114478681984, 0.002530310134637283, 0.00929095025795067)
2026-06-14 11:47:15,617 - optuna.study.study - INFO - Trial 3 finished with values: [0.021011114478681984, 0.002530310134637283, 0.00929095025795067] and parameters: {'n_layers': 3, 'embedding_dim': 96, 'lr': 0.002005854365359982, 'lambda_val': 0.011353389362020643, 'batch_size': 1316, 'optimizer': 'Adam'}.
2026-06-14 11:47:37,640 - experiment_functions - INFO - Early stopping at epoch 500. Best Metrics: (0.0005414673016074599, 7.703128139862015e-05, 0.0002774437764678534)
2026-06-14 11:47:37,733 - optuna.study.study - INFO - Trial 4 finished with values: [0.0005414673016074599, 7.703128139862015e-05, 0.0002774437764678534] and parameters: {'n_layers': 1, 'embedding_dim': 128, 'lr': 4.5547305609159144e-05, 'lambda_val': 0.00012631930008643648, 'batch_size': 1772, 'optimizer': 'RMSprop'}.
2026-06-14 11:50:22,591 - optuna.study.study - INFO - Trial 5 finished with values: [0.04359619382541933, 0.005479268537745329, 0.020476530327529725] and parameters: {'n_layers': 1, 'embedding_dim': 128, 'lr': 0.049137531063899446, 'lambda_val': 0.0009668484743513772, 'batch_size': 2658, 'optimizer': 'RMSprop'}.
2026-06-14 11:50:50,405 - experiment_functions - INFO - Early stopping at epoch 550. Best Metrics: (0.022216367096851892, 0.002624087346774734, 0.009966857908966346)
2026-06-14 11:50:50,531 - optuna.study.study - INFO - Trial 6 finished with values: [0.022216367096851892, 0.002624087346774734, 0.009966857908966346] and parameters: {'n_layers': 3, 'embedding_dim': 128, 'lr': 0.01359759229313602, 'lambda_val': 0.0033545157335197707, 'batch_size': 1955, 'optimizer': 'Adam'}.
2026-06-14 11:53:17,601 - experiment_functions - INFO - Early stopping at epoch 3650. Best Metrics: (0.0006588595290210667, 0.00010549936365463192, 0.0003134184911244371)
2026-06-14 11:53:17,689 - optuna.study.study - INFO - Trial 7 finished with values: [0.0006588595290210667, 0.00010549936365463192, 0.0003134184911244371] and parameters: {'n_layers': 3, 'embedding_dim': 64, 'lr': 9.576339362174683e-05, 'lambda_val': 0.00016973001643245622, 'batch_size': 948, 'optimizer': 'Adam'}.
2026-06-14 11:53:54,376 - experiment_functions - INFO - Early stopping at epoch 900. Best Metrics: (0.07421273231761587, 0.009205238127135107, 0.04013463722160128)
2026-06-14 11:53:54,463 - optuna.study.study - INFO - Trial 8 finished with values: [0.07421273231761587, 0.009205238127135107, 0.04013463722160128] and parameters: {'n_layers': 1, 'embedding_dim': 32, 'lr': 0.0059087621734932, 'lambda_val': 8.380696475709368e-06, 'batch_size': 1067, 'optimizer': 'Adam'}.
2026-06-14 11:54:15,979 - experiment_functions - INFO - Early stopping at epoch 500. Best Metrics: (0.0005721996703571443, 7.535668832473711e-05, 0.000244529479634297)
2026-06-14 11:54:16,072 - optuna.study.study - INFO - Trial 9 finished with values: [0.0005721996703571443, 7.535668832473711e-05, 0.000244529479634297] and parameters: {'n_layers': 2, 'embedding_dim': 64, 'lr': 0.0008184790240634528, 'lambda_val': 0.017688077953229953, 'batch_size': 3398, 'optimizer': 'SGD'}.
2026-06-14 11:54:45,300 - experiment_functions - INFO - Early stopping at epoch 550. Best Metrics: (0.02114865536449604, 0.0026207381606269675, 0.009711490431444212)
2026-06-14 11:54:45,390 - optuna.study.study - INFO - Trial 10 finished with values: [0.02114865536449604, 0.0026207381606269675, 0.009711490431444212] and parameters: {'n_layers': 4, 'embedding_dim': 128, 'lr': 0.0055531975171824715, 'lambda_val': 0.004674017637886118, 'batch_size': 3157, 'optimizer': 'Adam'}.
2026-06-14 11:55:13,300 - experiment_functions - INFO - Early stopping at epoch 550. Best Metrics: (0.03621561753169366, 0.004343894433652622, 0.01640388067678439)
2026-06-14 11:55:13,400 - optuna.study.study - INFO - Trial 11 finished with values: [0.03621561753169366, 0.004343894433652622, 0.01640388067678439] and parameters: {'n_layers': 3, 'embedding_dim': 128, 'lr': 0.006460235541464247, 'lambda_val': 0.0008120167161284333, 'batch_size': 2938, 'optimizer': 'Adam'}.
2026-06-14 11:55:33,722 - experiment_functions - INFO - Early stopping at epoch 500. Best Metrics: (0.0006361555870399299, 8.707883984191842e-05, 0.00032927158750895887)
2026-06-14 11:55:33,811 - optuna.study.study - INFO - Trial 12 finished with values: [0.0006361555870399299, 8.707883984191842e-05, 0.00032927158750895887] and parameters: {'n_layers': 1, 'embedding_dim': 32, 'lr': 0.000994729763516312, 'lambda_val': 0.00017859500187129105, 'batch_size': 2199, 'optimizer': 'SGD'}.
2026-06-14 11:55:55,290 - experiment_functions - INFO - Early stopping at epoch 500. Best Metrics: (0.0005100028542009737, 8.205506062026927e-05, 0.00023137251331653504)
2026-06-14 11:55:55,371 - optuna.study.study - INFO - Trial 13 finished with values: [0.0005100028542009737, 8.205506062026927e-05, 0.00023137251331653504] and parameters: {'n_layers': 2, 'embedding_dim': 64, 'lr': 0.00023017160882395727, 'lambda_val': 1.3619564275513772e-06, 'batch_size': 1454, 'optimizer': 'SGD'}.
2026-06-14 11:56:15,860 - experiment_functions - INFO - Early stopping at epoch 500. Best Metrics: (0.00038373090987524203, 6.865831602920491e-05, 0.00018086819374201293)
2026-06-14 11:56:15,958 - optuna.study.study - INFO - Trial 14 finished with values: [0.00038373090987524203, 6.865831602920491e-05, 0.00018086819374201293] and parameters: {'n_layers': 1, 'embedding_dim': 32, 'lr': 2.2638286825259808e-05, 'lambda_val': 0.02571402158207456, 'batch_size': 1311, 'optimizer': 'Adam'}.
2026-06-14 11:56:48,153 - experiment_functions - INFO - Early stopping at epoch 500. Best Metrics: (0.0005184330454157688, 8.038046754638624e-05, 0.0002269683328160877)
2026-06-14 11:56:48,246 - optuna.study.study - INFO - Trial 15 finished with values: [0.0005184330454157688, 8.038046754638624e-05, 0.0002269683328160877] and parameters: {'n_layers': 4, 'embedding_dim': 256, 'lr': 0.0008531020224794451, 'lambda_val': 0.005012746472781395, 'batch_size': 2981, 'optimizer': 'SGD'}.
2026-06-14 11:57:20,419 - experiment_functions - INFO - Early stopping at epoch 500. Best Metrics: (0.0003020224058136845, 5.3586978364257486e-05, 0.00015957904715457088)
2026-06-14 11:57:20,513 - optuna.study.study - INFO - Trial 16 finished with values: [0.0003020224058136845, 5.3586978364257486e-05, 0.00015957904715457088] and parameters: {'n_layers': 4, 'embedding_dim': 256, 'lr': 0.03467393893756564, 'lambda_val': 2.0907325826851658e-06, 'batch_size': 2290, 'optimizer': 'SGD'}.
2026-06-14 11:58:59,500 - experiment_functions - INFO - Early stopping at epoch 1750. Best Metrics: (0.0006701163283988658, 7.870587447250318e-05, 0.00028068833480008015)
2026-06-14 11:58:59,582 - optuna.study.study - INFO - Trial 17 finished with values: [0.0006701163283988658, 7.870587447250318e-05, 0.00028068833480008015] and parameters: {'n_layers': 3, 'embedding_dim': 256, 'lr': 1.2093646181723548e-05, 'lambda_val': 8.370672115052058e-06, 'batch_size': 2979, 'optimizer': 'Adam'}.
2026-06-14 11:59:22,088 - experiment_functions - INFO - Early stopping at epoch 500. Best Metrics: (0.0006393469823317596, 9.377721213745061e-05, 0.00029845880515192395)
2026-06-14 11:59:22,168 - optuna.study.study - INFO - Trial 18 finished with values: [0.0006393469823317596, 9.377721213745061e-05, 0.00029845880515192395] and parameters: {'n_layers': 1, 'embedding_dim': 96, 'lr': 0.0012150637819486891, 'lambda_val': 4.7054028008895064e-06, 'batch_size': 3756, 'optimizer': 'SGD'}.
2026-06-14 12:00:01,887 - experiment_functions - INFO - Early stopping at epoch 850. Best Metrics: (0.00048415978250114657, 7.703128139862015e-05, 0.00021540537783940698)
2026-06-14 12:00:02,839 - optuna.study.study - INFO - Trial 19 finished with values: [0.00048415978250114657, 7.703128139862015e-05, 0.00021540537783940698] and parameters: {'n_layers': 1, 'embedding_dim': 256, 'lr': 3.917620660171595e-05, 'lambda_val': 3.480493981089125e-05, 'batch_size': 3050, 'optimizer': 'Adam'}.
2026-06-14 12:00:27,308 - experiment_functions - INFO - Early stopping at epoch 500. Best Metrics: (0.0005288722329828718, 6.865831602920491e-05, 0.00025352888434697026)
2026-06-14 12:00:27,532 - optuna.study.study - INFO - Trial 20 finished with values: [0.0005288722329828718, 6.865831602920491e-05, 0.00025352888434697026] and parameters: {'n_layers': 4, 'embedding_dim': 96, 'lr': 4.650549644489209e-05, 'lambda_val': 0.048178885309424616, 'batch_size': 2480, 'optimizer': 'Adam'}.
2026-06-14 12:01:01,409 - experiment_functions - INFO - Early stopping at epoch 700. Best Metrics: (0.0005295023142041019, 7.2007502176971e-05, 0.00021544019390044424)
2026-06-14 12:01:01,543 - optuna.study.study - INFO - Trial 21 finished with values: [0.0005295023142041019, 7.2007502176971e-05, 0.00021544019390044424] and parameters: {'n_layers': 3, 'embedding_dim': 128, 'lr': 3.029561359703306e-05, 'lambda_val': 0.01708306256970705, 'batch_size': 2588, 'optimizer': 'Adam'}.
2026-06-14 12:01:23,880 - experiment_functions - INFO - Early stopping at epoch 500. Best Metrics: (0.0005958481691299277, 8.205506062026927e-05, 0.0002575218928184169)
2026-06-14 12:01:23,955 - optuna.study.study - INFO - Trial 22 finished with values: [0.0005958481691299277, 8.205506062026927e-05, 0.0002575218928184169] and parameters: {'n_layers': 2, 'embedding_dim': 96, 'lr': 0.0013751133009280293, 'lambda_val': 0.007284780441337888, 'batch_size': 2598, 'optimizer': 'SGD'}.
2026-06-14 12:04:17,280 - experiment_functions - INFO - Early stopping at epoch 3950. Best Metrics: (0.03994993423112869, 0.004119498961752294, 0.018598912728323237)
2026-06-14 12:04:17,356 - optuna.study.study - INFO - Trial 23 finished with values: [0.03994993423112869, 0.004119498961752294, 0.018598912728323237] and parameters: {'n_layers': 2, 'embedding_dim': 128, 'lr': 0.02165852287791423, 'lambda_val': 2.0680038613717084e-05, 'batch_size': 3310, 'optimizer': 'Adam'}.
2026-06-14 12:04:43,317 - experiment_functions - INFO - Early stopping at epoch 550. Best Metrics: (0.016079489765915247, 0.0019944403509947082, 0.00739679472199711)
2026-06-14 12:04:43,401 - optuna.study.study - INFO - Trial 24 finished with values: [0.016079489765915247, 0.0019944403509947082, 0.00739679472199711] and parameters: {'n_layers': 3, 'embedding_dim': 96, 'lr': 0.0025213612125029425, 'lambda_val': 0.013529444074993041, 'batch_size': 1939, 'optimizer': 'RMSprop'}.
2026-06-14 12:05:08,520 - experiment_functions - INFO - Early stopping at epoch 550. Best Metrics: (0.029293572434100405, 0.0035082724897849823, 0.013967622485487555)
2026-06-14 12:05:08,723 - optuna.study.study - INFO - Trial 25 finished with values: [0.029293572434100405, 0.0035082724897849823, 0.013967622485487555] and parameters: {'n_layers': 2, 'embedding_dim': 96, 'lr': 0.07150156349318315, 'lambda_val': 1.4115736549435582e-06, 'batch_size': 1332, 'optimizer': 'Adam'}.
2026-06-14 12:07:19,385 - experiment_functions - INFO - Early stopping at epoch 3000. Best Metrics: (0.0434722482371409, 0.0047374238060151385, 0.020250529868162084)
2026-06-14 12:07:20,203 - optuna.study.study - INFO - Trial 26 finished with values: [0.0434722482371409, 0.0047374238060151385, 0.020250529868162084] and parameters: {'n_layers': 4, 'embedding_dim': 64, 'lr': 0.017010979332815413, 'lambda_val': 4.530416824267587e-06, 'batch_size': 2722, 'optimizer': 'RMSprop'}.
2026-06-14 12:07:54,045 - experiment_functions - INFO - Early stopping at epoch 750. Best Metrics: (0.04844239072357249, 0.006293120771652489, 0.023612053726923127)
2026-06-14 12:07:54,129 - optuna.study.study - INFO - Trial 27 finished with values: [0.04844239072357249, 0.006293120771652489, 0.023612053726923127] and parameters: {'n_layers': 2, 'embedding_dim': 96, 'lr': 0.0016839460476377366, 'lambda_val': 0.00851359441108956, 'batch_size': 2843, 'optimizer': 'Adam'}.
2026-06-14 12:08:34,708 - experiment_functions - INFO - Early stopping at epoch 900. Best Metrics: (0.06770473658654062, 0.008473440953848214, 0.03556035997110843)
2026-06-14 12:08:35,497 - optuna.study.study - INFO - Trial 28 finished with values: [0.06770473658654062, 0.008473440953848214, 0.03556035997110843] and parameters: {'n_layers': 2, 'embedding_dim': 96, 'lr': 0.001866327471651579, 'lambda_val': 0.0003336301702722937, 'batch_size': 1532, 'optimizer': 'Adam'}.
2026-06-14 12:08:58,402 - experiment_functions - INFO - Early stopping at epoch 500. Best Metrics: (0.00040402014748622435, 6.698372295532186e-05, 0.00019667081853486893)
2026-06-14 12:08:58,489 - optuna.study.study - INFO - Trial 29 finished with values: [0.00040402014748622435, 6.698372295532186e-05, 0.00019667081853486893] and parameters: {'n_layers': 4, 'embedding_dim': 64, 'lr': 0.044169940397188655, 'lambda_val': 0.02700329666594693, 'batch_size': 1885, 'optimizer': 'SGD'}.
2026-06-14 12:09:37,079 - experiment_functions - INFO - Early stopping at epoch 950. Best Metrics: (0.0744720185438847, 0.009205238127135107, 0.03909402081735191)
2026-06-14 12:09:37,162 - optuna.study.study - INFO - Trial 30 finished with values: [0.0744720185438847, 0.009205238127135107, 0.03909402081735191] and parameters: {'n_layers': 1, 'embedding_dim': 32, 'lr': 0.0026515351587830605, 'lambda_val': 0.0004821335138179686, 'batch_size': 2372, 'optimizer': 'RMSprop'}.
2026-06-14 12:10:01,195 - experiment_functions - INFO - Early stopping at epoch 550. Best Metrics: (0.023649264064318175, 0.0032135441087815667, 0.011771102826628266)
2026-06-14 12:10:01,282 - optuna.study.study - INFO - Trial 31 finished with values: [0.023649264064318175, 0.0032135441087815667, 0.011771102826628266] and parameters: {'n_layers': 2, 'embedding_dim': 64, 'lr': 0.01717117311685491, 'lambda_val': 0.008638560753445159, 'batch_size': 626, 'optimizer': 'Adam'}.
2026-06-14 12:11:11,565 - experiment_functions - INFO - Early stopping at epoch 1600. Best Metrics: (0.025381816846998414, 0.002741308861946547, 0.011341052956331879)
2026-06-14 12:11:11,641 - optuna.study.study - INFO - Trial 32 finished with values: [0.025381816846998414, 0.002741308861946547, 0.011341052956331879] and parameters: {'n_layers': 4, 'embedding_dim': 64, 'lr': 0.018130798648453576, 'lambda_val': 0.00039332994716362866, 'batch_size': 3998, 'optimizer': 'Adam'}.
2026-06-14 12:11:47,805 - experiment_functions - INFO - Early stopping at epoch 550. Best Metrics: (0.0323954829840196, 0.0035585102820014742, 0.014961338536675637)
2026-06-14 12:11:47,895 - optuna.study.study - INFO - Trial 33 finished with values: [0.0323954829840196, 0.0035585102820014742, 0.014961338536675637] and parameters: {'n_layers': 4, 'embedding_dim': 256, 'lr': 0.07596181261878349, 'lambda_val': 5.9193464413915906e-06, 'batch_size': 1561, 'optimizer': 'Adam'}.
2026-06-14 12:12:10,182 - experiment_functions - INFO - Early stopping at epoch 500. Best Metrics: (0.0003988555078411612, 7.53566883247371e-05, 0.00021662800611159163)
2026-06-14 12:12:10,258 - optuna.study.study - INFO - Trial 34 finished with values: [0.0003988555078411612, 7.53566883247371e-05, 0.00021662800611159163] and parameters: {'n_layers': 2, 'embedding_dim': 96, 'lr': 1.5917247543860132e-05, 'lambda_val': 1.288219485822485e-06, 'batch_size': 1880, 'optimizer': 'SGD'}.
2026-06-14 12:12:42,194 - experiment_functions - INFO - Early stopping at epoch 500. Best Metrics: (0.0006900298024360397, 9.71263982852167e-05, 0.0002860065533366934)
2026-06-14 12:12:42,266 - optuna.study.study - INFO - Trial 35 finished with values: [0.0006900298024360397, 9.71263982852167e-05, 0.0002860065533366934] and parameters: {'n_layers': 4, 'embedding_dim': 256, 'lr': 1.0323398848515102e-05, 'lambda_val': 0.008922082100337141, 'batch_size': 3097, 'optimizer': 'SGD'}.
2026-06-14 12:13:12,157 - experiment_functions - INFO - Early stopping at epoch 550. Best Metrics: (0.019637886867420414, 0.0021702726237524286, 0.008476151340487676)
2026-06-14 12:13:12,232 - optuna.study.study - INFO - Trial 36 finished with values: [0.019637886867420414, 0.0021702726237524286, 0.008476151340487676] and parameters: {'n_layers': 2, 'embedding_dim': 256, 'lr': 0.006265835000649171, 'lambda_val': 0.01285564266015507, 'batch_size': 3044, 'optimizer': 'RMSprop'}.
2026-06-14 12:15:22,036 - experiment_functions - INFO - Early stopping at epoch 2650. Best Metrics: (0.008718230596650273, 0.0011353741040927056, 0.004011615858778608)
