2026-06-15 20:29:25,714 - optuna.study.study - INFO - Trial 179 finished with values: [0.08117816602618017, 0.009774599772255343, 0.04181197521048214] and parameters: {'n_layers': 2, 'embedding_dim': 96, 'lr': 0.001479782641411582, 'lambda_val': 4.143254840202029e-06, 'batch_size': 1650, 'optimizer': 'Adam'}.
2026-06-15 20:29:57,998 - experiment_functions - INFO - Early stopping at epoch 500. Best Metrics: (0.00040778057810603294, 7.368209525085404e-05, 0.00019138260367743254)
2026-06-15 20:29:58,123 - optuna.study.study - INFO - Trial 180 finished with values: [0.00040778057810603294, 7.368209525085404e-05, 0.00019138260367743254] and parameters: {'n_layers': 4, 'embedding_dim': 256, 'lr': 0.0008257854890964482, 'lambda_val': 1.4549151430213812e-06, 'batch_size': 3109, 'optimizer': 'SGD'}.
2026-06-15 20:32:57,210 - optuna.study.study - INFO - Trial 181 finished with values: [0.0011489848523050469, 0.00016076093509277245, 0.0004910895082353747] and parameters: {'n_layers': 1, 'embedding_dim': 256, 'lr': 0.00017992734758911743, 'lambda_val': 6.461965909578869e-06, 'batch_size': 2539, 'optimizer': 'Adam'}.
2026-06-15 20:35:31,887 - optuna.study.study - INFO - Trial 182 finished with values: [0.06132174327345055, 0.008416504789336192, 0.03539726409949055] and parameters: {'n_layers': 1, 'embedding_dim': 32, 'lr': 0.0008007729293904306, 'lambda_val': 1.0702432018798528e-05, 'batch_size': 2005, 'optimizer': 'Adam'}.
2026-06-15 20:36:29,604 - experiment_functions - INFO - Early stopping at epoch 1200. Best Metrics: (0.02896148054816808, 0.0034128206845736486, 0.013178917413686396)
2026-06-15 20:36:29,684 - optuna.study.study - INFO - Trial 183 finished with values: [0.02896148054816808, 0.0034128206845736486, 0.013178917413686396] and parameters: {'n_layers': 4, 'embedding_dim': 96, 'lr': 0.004761465307095227, 'lambda_val': 0.0002091155632832413, 'batch_size': 2936, 'optimizer': 'RMSprop'}.
2026-06-15 20:37:46,127 - experiment_functions - INFO - Early stopping at epoch 1750. Best Metrics: (0.09512770036667527, 0.011475986335320518, 0.05035518865044033)
2026-06-15 20:37:46,221 - optuna.study.study - INFO - Trial 184 finished with values: [0.09512770036667527, 0.011475986335320518, 0.05035518865044033] and parameters: {'n_layers': 1, 'embedding_dim': 128, 'lr': 0.001479782641411582, 'lambda_val': 6.461965909578869e-06, 'batch_size': 3226, 'optimizer': 'RMSprop'}.
2026-06-15 20:41:13,717 - optuna.study.study - INFO - Trial 185 finished with values: [0.06719530021440483, 0.008776542300221046, 0.03801492240523183] and parameters: {'n_layers': 2, 'embedding_dim': 256, 'lr': 0.0003649621407716159, 'lambda_val': 1.5130950471060717e-06, 'batch_size': 1214, 'optimizer': 'RMSprop'}.
2026-06-15 20:43:12,980 - experiment_functions - INFO - Early stopping at epoch 2900. Best Metrics: (0.07530846978677116, 0.009138254404179785, 0.03843773029623729)
2026-06-15 20:43:13,096 - optuna.study.study - INFO - Trial 186 finished with values: [0.07530846978677116, 0.009138254404179785, 0.03843773029623729] and parameters: {'n_layers': 2, 'embedding_dim': 32, 'lr': 0.0008007729293904306, 'lambda_val': 0.00041942469140426685, 'batch_size': 3674, 'optimizer': 'Adam'}.
2026-06-15 20:43:37,162 - experiment_functions - INFO - Early stopping at epoch 500. Best Metrics: (0.00040377978748424735, 7.368209525085404e-05, 0.00019231177404850324)
2026-06-15 20:43:37,257 - optuna.study.study - INFO - Trial 187 finished with values: [0.00040377978748424735, 7.368209525085404e-05, 0.00019231177404850324] and parameters: {'n_layers': 1, 'embedding_dim': 256, 'lr': 0.00859558839759563, 'lambda_val': 0.0013027561983238523, 'batch_size': 1420, 'optimizer': 'SGD'}.
2026-06-15 20:47:06,111 - optuna.study.study - INFO - Trial 188 finished with values: [0.07383794037549302, 0.009481545984325808, 0.041287159448305494] and parameters: {'n_layers': 2, 'embedding_dim': 256, 'lr': 0.0002845041667420409, 'lambda_val': 6.461965909578869e-06, 'batch_size': 2936, 'optimizer': 'RMSprop'}.
2026-06-15 20:47:28,681 - experiment_functions - INFO - Early stopping at epoch 500. Best Metrics: (0.0004176048257382975, 5.861075758590662e-05, 0.0002067989466579858)
2026-06-15 20:47:28,785 - optuna.study.study - INFO - Trial 189 finished with values: [0.0004176048257382975, 5.861075758590662e-05, 0.0002067989466579858] and parameters: {'n_layers': 3, 'embedding_dim': 64, 'lr': 0.0012012771091778557, 'lambda_val': 0.0021104984649676414, 'batch_size': 2009, 'optimizer': 'SGD'}.
2026-06-15 20:51:18,511 - optuna.study.study - INFO - Trial 190 finished with values: [0.041160894056408395, 0.004499631589523746, 0.018670073649040917] and parameters: {'n_layers': 3, 'embedding_dim': 256, 'lr': 0.0036742654809996723, 'lambda_val': 4.411051153283134e-06, 'batch_size': 1420, 'optimizer': 'Adam'}.
2026-06-15 20:51:46,607 - experiment_functions - INFO - Early stopping at epoch 550. Best Metrics: (0.03983174147751731, 0.004777614039788332, 0.017820914594003718)
2026-06-15 20:51:46,742 - optuna.study.study - INFO - Trial 191 finished with values: [0.03983174147751731, 0.004777614039788332, 0.017820914594003718] and parameters: {'n_layers': 3, 'embedding_dim': 128, 'lr': 0.00859558839759563, 'lambda_val': 0.0002091155632832413, 'batch_size': 3978, 'optimizer': 'Adam'}.
2026-06-15 20:52:55,179 - experiment_functions - INFO - Early stopping at epoch 1150. Best Metrics: (0.04113756202768088, 0.0046788130484292315, 0.019078176683704238)
2026-06-15 20:52:55,252 - optuna.study.study - INFO - Trial 192 finished with values: [0.04113756202768088, 0.0046788130484292315, 0.019078176683704238] and parameters: {'n_layers': 3, 'embedding_dim': 256, 'lr': 0.0036742654809996723, 'lambda_val': 1.7187471777464757e-05, 'batch_size': 2936, 'optimizer': 'Adam'}.
2026-06-15 20:55:28,066 - experiment_functions - INFO - Early stopping at epoch 3850. Best Metrics: (0.09200997200378908, 0.011156139058208857, 0.05066391663259887)
2026-06-15 20:55:28,145 - optuna.study.study - INFO - Trial 193 finished with values: [0.09200997200378908, 0.011156139058208857, 0.05066391663259887] and parameters: {'n_layers': 1, 'embedding_dim': 32, 'lr': 0.001479782641411582, 'lambda_val': 6.461965909578869e-06, 'batch_size': 3620, 'optimizer': 'RMSprop'}.
2026-06-15 20:56:05,442 - experiment_functions - INFO - Early stopping at epoch 850. Best Metrics: (0.030452028578805197, 0.0036271685980306793, 0.013586878808928516)
2026-06-15 20:56:05,531 - optuna.study.study - INFO - Trial 194 finished with values: [0.030452028578805197, 0.0036271685980306793, 0.013586878808928516] and parameters: {'n_layers': 3, 'embedding_dim': 64, 'lr': 0.0019066667322640374, 'lambda_val': 0.0031660536671449806, 'batch_size': 3741, 'optimizer': 'RMSprop'}.
2026-06-15 20:57:06,617 - experiment_functions - INFO - Early stopping at epoch 1500. Best Metrics: (0.07042821630653626, 0.008614106772054392, 0.03595573539937232)
2026-06-15 20:57:06,976 - optuna.study.study - INFO - Trial 195 finished with values: [0.07042821630653626, 0.008614106772054392, 0.03595573539937232] and parameters: {'n_layers': 2, 'embedding_dim': 32, 'lr': 0.0013130193047400018, 'lambda_val': 7.673494845521761e-06, 'batch_size': 3339, 'optimizer': 'RMSprop'}.
2026-06-15 20:57:55,422 - experiment_functions - INFO - Early stopping at epoch 1050. Best Metrics: (0.06402689673082114, 0.00775001674593074, 0.03152265178337567)
2026-06-15 20:57:55,507 - optuna.study.study - INFO - Trial 196 finished with values: [0.06402689673082114, 0.00775001674593074, 0.03152265178337567] and parameters: {'n_layers': 2, 'embedding_dim': 128, 'lr': 0.0013130193047400018, 'lambda_val': 4.740391388963357e-05, 'batch_size': 1772, 'optimizer': 'RMSprop'}.
2026-06-15 21:02:02,971 - optuna.study.study - INFO - Trial 197 finished with values: [0.04455249718867726, 0.005923035702324336, 0.024589951117589] and parameters: {'n_layers': 4, 'embedding_dim': 256, 'lr': 0.00017992734758911743, 'lambda_val': 0.0005662460656125812, 'batch_size': 1072, 'optimizer': 'RMSprop'}.
2026-06-15 21:04:51,178 - optuna.study.study - INFO - Trial 198 finished with values: [0.05743802103013389, 0.007309598767499498, 0.03066767906462673] and parameters: {'n_layers': 3, 'embedding_dim': 64, 'lr': 0.00035731579910584327, 'lambda_val': 5.887369963944605e-05, 'batch_size': 1772, 'optimizer': 'Adam'}.
2026-06-15 21:07:05,403 - experiment_functions - INFO - Early stopping at epoch 2950. Best Metrics: (0.08852329731613603, 0.01064203898452676, 0.04709408719048691)
2026-06-15 21:07:05,492 - optuna.study.study - INFO - Trial 199 finished with values: [0.08852329731613603, 0.01064203898452676, 0.04709408719048691] and parameters: {'n_layers': 2, 'embedding_dim': 128, 'lr': 0.0008007729293904306, 'lambda_val': 6.461965909578869e-06, 'batch_size': 3226, 'optimizer': 'Adam'}.
2026-06-15 21:10:21,309 - experiment_functions - INFO - Early stopping at epoch 3950. Best Metrics: (0.045474777911095936, 0.005489316096188626, 0.021883438525286923)
2026-06-15 21:10:21,392 - optuna.study.study - INFO - Trial 200 finished with values: [0.045474777911095936, 0.005489316096188626, 0.021883438525286923] and parameters: {'n_layers': 4, 'embedding_dim': 128, 'lr': 0.0008007729293904306, 'lambda_val': 1.0702432018798528e-05, 'batch_size': 983, 'optimizer': 'RMSprop'}.
2026-06-15 21:13:47,487 - optuna.study.study - INFO - Trial 201 finished with values: [0.06489941382611968, 0.007296202022908433, 0.03074873499401689] and parameters: {'n_layers': 2, 'embedding_dim': 256, 'lr': 0.001479782641411582, 'lambda_val': 6.461965909578869e-06, 'batch_size': 2502, 'optimizer': 'RMSprop'}.
2026-06-15 21:16:30,310 - optuna.study.study - INFO - Trial 202 finished with values: [0.0788777965930101, 0.010352334382744993, 0.04493944968444751] and parameters: {'n_layers': 1, 'embedding_dim': 96, 'lr': 0.0008257854890964482, 'lambda_val': 0.0012522872845674186, 'batch_size': 1650, 'optimizer': 'Adam'}.
2026-06-15 21:17:46,983 - experiment_functions - INFO - Early stopping at epoch 1700. Best Metrics: (0.0003310033938216831, 6.363453680755576e-05, 0.00016669223549069874)
2026-06-15 21:17:47,076 - optuna.study.study - INFO - Trial 203 finished with values: [0.0003310033938216831, 6.363453680755576e-05, 0.00016669223549069874] and parameters: {'n_layers': 1, 'embedding_dim': 256, 'lr': 0.0001070757778595348, 'lambda_val': 0.00041942469140426685, 'batch_size': 636, 'optimizer': 'Adam'}.
2026-06-15 21:20:34,960 - optuna.study.study - INFO - Trial 204 finished with values: [0.07640943147967702, 0.0088502243954719, 0.03653025337129978] and parameters: {'n_layers': 1, 'embedding_dim': 128, 'lr': 0.0036742654809996723, 'lambda_val': 6.461965909578869e-06, 'batch_size': 1420, 'optimizer': 'RMSprop'}.
2026-06-15 21:23:35,019 - optuna.study.study - INFO - Trial 205 finished with values: [0.0824744279424844, 0.010238462053720948, 0.044765063507594995] and parameters: {'n_layers': 2, 'embedding_dim': 128, 'lr': 0.0008105588166462481, 'lambda_val': 4.740391388963357e-05, 'batch_size': 738, 'optimizer': 'Adam'}.
2026-06-15 21:24:39,841 - experiment_functions - INFO - Early stopping at epoch 1650. Best Metrics: (0.06026048020009204, 0.007607676334650681, 0.031742967185456855)
2026-06-15 21:24:39,931 - optuna.study.study - INFO - Trial 206 finished with values: [0.06026048020009204, 0.007607676334650681, 0.031742967185456855] and parameters: {'n_layers': 1, 'embedding_dim': 32, 'lr': 0.0036742654809996723, 'lambda_val': 0.00045699500289161265, 'batch_size': 636, 'optimizer': 'RMSprop'}.
2026-06-15 21:27:27,393 - optuna.study.study - INFO - Trial 207 finished with values: [0.07882951835822491, 0.01033391385893228, 0.045253965248265075] and parameters: {'n_layers': 1, 'embedding_dim': 128, 'lr': 0.0008007729293904306, 'lambda_val': 2.0623181656245837e-06, 'batch_size': 1545, 'optimizer': 'Adam'}.
2026-06-15 21:29:14,085 - experiment_functions - INFO - Early stopping at epoch 2050. Best Metrics: (0.06444907919610837, 0.008197133096657514, 0.03160548531229702)
2026-06-15 21:29:14,201 - optuna.study.study - INFO - Trial 208 finished with values: [0.06444907919610837, 0.008197133096657514, 0.03160548531229702] and parameters: {'n_layers': 2, 'embedding_dim': 256, 'lr': 0.0003649621407716159, 'lambda_val': 0.005894910175999821, 'batch_size': 3620, 'optimizer': 'RMSprop'}.
2026-06-15 21:32:12,274 - optuna.study.study - INFO - Trial 209 finished with values: [0.0579204473568599, 0.00792082523946681, 0.03142721386933163] and parameters: {'n_layers': 2, 'embedding_dim': 128, 'lr': 0.0002845041667420409, 'lambda_val': 6.461965909578869e-06, 'batch_size': 3620, 'optimizer': 'Adam'}.
2026-06-15 21:34:40,969 - experiment_functions - INFO - Early stopping at epoch 3100. Best Metrics: (0.10309789884625117, 0.012487440551945879, 0.05566229179424139)
2026-06-15 21:34:41,062 - optuna.study.study - INFO - Trial 210 finished with values: [0.10309789884625117, 0.012487440551945879, 0.05566229179424139] and parameters: {'n_layers': 1, 'embedding_dim': 256, 'lr': 0.001479782641411582, 'lambda_val': 4.740391388963357e-05, 'batch_size': 1772, 'optimizer': 'Adam'}.
2026-06-15 21:37:19,577 - experiment_functions - INFO - Early stopping at epoch 3300. Best Metrics: (0.06654683264343399, 0.008168665014401501, 0.03473974198878271)
2026-06-15 21:37:19,662 - optuna.study.study - INFO - Trial 211 finished with values: [0.06654683264343399, 0.008168665014401501, 0.03473974198878271] and parameters: {'n_layers': 3, 'embedding_dim': 128, 'lr': 0.0008105588166462481, 'lambda_val': 4.740391388963357e-05, 'batch_size': 738, 'optimizer': 'Adam'}.
2026-06-15 21:39:47,535 - optuna.study.study - INFO - Trial 212 finished with values: [0.0005810893754577298, 8.372965369415233e-05, 0.0002599027299400338] and parameters: {'n_layers': 1, 'embedding_dim': 32, 'lr': 0.00016097301150174386, 'lambda_val': 0.00011845962638954619, 'batch_size': 3109, 'optimizer': 'Adam'}.
2026-06-15 21:43:15,994 - optuna.study.study - INFO - Trial 213 finished with values: [0.052594262852988995, 0.005643378658985867, 0.024615696579199063] and parameters: {'n_layers': 2, 'embedding_dim': 256, 'lr': 0.00898308847058507, 'lambda_val': 1.5130950471060717e-06, 'batch_size': 2710, 'optimizer': 'Adam'}.
2026-06-15 21:45:51,338 - optuna.study.study - INFO - Trial 214 finished with values: [0.06300383763254723, 0.008583964096724496, 0.03653677702597054] and parameters: {'n_layers': 1, 'embedding_dim': 32, 'lr': 0.0008007729293904306, 'lambda_val': 1.0702432018798528e-05, 'batch_size': 2005, 'optimizer': 'Adam'}.
2026-06-15 21:46:51,898 - experiment_functions - INFO - Early stopping at epoch 1350. Best Metrics: (0.09695798964033606, 0.011720476924107442, 0.05199869071127567)
2026-06-15 21:46:51,987 - optuna.study.study - INFO - Trial 215 finished with values: [0.09695798964033606, 0.011720476924107442, 0.05199869071127567] and parameters: {'n_layers': 1, 'embedding_dim': 128, 'lr': 0.001479782641411582, 'lambda_val': 6.461965909578869e-06, 'batch_size': 3620, 'optimizer': 'RMSprop'}.
2026-06-15 21:49:33,371 - optuna.study.study - INFO - Trial 216 finished with values: [0.07633733100916408, 0.00935092772456293, 0.04059196691463627] and parameters: {'n_layers': 2, 'embedding_dim': 32, 'lr': 0.0008257854890964482, 'lambda_val': 1.0702432018798528e-05, 'batch_size': 2191, 'optimizer': 'Adam'}.
2026-06-15 21:52:31,822 - optuna.study.study - INFO - Trial 217 finished with values: [0.05362824093868419, 0.00741007435193248, 0.02992675238877705] and parameters: {'n_layers': 2, 'embedding_dim': 128, 'lr': 0.00036808020587629503, 'lambda_val': 6.461965909578869e-06, 'batch_size': 1650, 'optimizer': 'Adam'}.
2026-06-15 21:52:54,524 - experiment_functions - INFO - Early stopping at epoch 550. Best Metrics: (0.0003343413987524486, 7.033290910308795e-05, 0.00018628402089136884)
2026-06-15 21:52:54,593 - optuna.study.study - INFO - Trial 218 finished with values: [0.0003343413987524486, 7.033290910308795e-05, 0.00018628402089136884] and parameters: {'n_layers': 2, 'embedding_dim': 32, 'lr': 1.4082735878671358e-05, 'lambda_val': 6.461965909578869e-06, 'batch_size': 1393, 'optimizer': 'Adam'}.
2026-06-15 21:55:12,303 - experiment_functions - INFO - Early stopping at epoch 2600. Best Metrics: (0.08113272175765786, 0.010077701118628173, 0.041719745676912647)
2026-06-15 21:55:12,581 - optuna.study.study - INFO - Trial 219 finished with values: [0.08113272175765786, 0.010077701118628173, 0.041719745676912647] and parameters: {'n_layers': 2, 'embedding_dim': 256, 'lr': 0.0004267977145290702, 'lambda_val': 0.0012522872845674186, 'batch_size': 3157, 'optimizer': 'RMSprop'}.
2026-06-15 21:55:53,099 - experiment_functions - INFO - Early stopping at epoch 1050. Best Metrics: (0.0005284143730831668, 7.2007502176971e-05, 0.00028491287913098796)
2026-06-15 21:55:53,562 - optuna.study.study - INFO - Trial 220 finished with values: [0.0005284143730831668, 7.2007502176971e-05, 0.00028491287913098796] and parameters: {'n_layers': 1, 'embedding_dim': 32, 'lr': 0.00010507500033181305, 'lambda_val': 1.0702432018798528e-05, 'batch_size': 2005, 'optimizer': 'Adam'}.
2026-06-15 21:58:44,987 - optuna.study.study - INFO - Trial 221 finished with values: [0.10312269503024517, 0.012427155201286087, 0.05496071561296572] and parameters: {'n_layers': 1, 'embedding_dim': 128, 'lr': 0.001479782641411582, 'lambda_val': 6.852585789077327e-05, 'batch_size': 1808, 'optimizer': 'RMSprop'}.
2026-06-15 21:59:19,874 - experiment_functions - INFO - Early stopping at epoch 900. Best Metrics: (0.0005042911912080388, 7.870587447250318e-05, 0.0002528961643057054)
2026-06-15 21:59:19,947 - optuna.study.study - INFO - Trial 222 finished with values: [0.0005042911912080388, 7.870587447250318e-05, 0.0002528961643057054] and parameters: {'n_layers': 2, 'embedding_dim': 32, 'lr': 0.00010138585931816498, 'lambda_val': 4.143254840202029e-06, 'batch_size': 1650, 'optimizer': 'RMSprop'}.
2026-06-15 21:59:58,917 - experiment_functions - INFO - Early stopping at epoch 800. Best Metrics: (0.08806690244733344, 0.010898251724830867, 0.04697458168368651)
2026-06-15 21:59:59,221 - optuna.study.study - INFO - Trial 223 finished with values: [0.08806690244733344, 0.010898251724830867, 0.04697458168368651] and parameters: {'n_layers': 1, 'embedding_dim': 256, 'lr': 0.0036742654809996723, 'lambda_val': 1.7187471777464757e-05, 'batch_size': 2050, 'optimizer': 'Adam'}.
2026-06-15 22:02:56,526 - optuna.study.study - INFO - Trial 224 finished with values: [0.07596065181935138, 0.009705941456226138, 0.04122001510601893] and parameters: {'n_layers': 2, 'embedding_dim': 128, 'lr': 0.0003649621407716159, 'lambda_val': 0.0001716663471456799, 'batch_size': 3620, 'optimizer': 'Adam'}.
2026-06-15 22:03:44,772 - experiment_functions - INFO - Early stopping at epoch 1050. Best Metrics: (0.07034023727527826, 0.008635876482014871, 0.03558996503029583)
2026-06-15 22:03:44,839 - optuna.study.study - INFO - Trial 225 finished with values: [0.07034023727527826, 0.008635876482014871, 0.03558996503029583] and parameters: {'n_layers': 2, 'embedding_dim': 128, 'lr': 0.0008007729293904306, 'lambda_val': 0.0010303693563230053, 'batch_size': 3226, 'optimizer': 'RMSprop'}.
2026-06-15 22:06:50,482 - optuna.study.study - INFO - Trial 226 finished with values: [0.09395492647214213, 0.011978364257485432, 0.05256039528909221] and parameters: {'n_layers': 1, 'embedding_dim': 256, 'lr': 0.0008267470550875525, 'lambda_val': 4.740391388963357e-05, 'batch_size': 1772, 'optimizer': 'Adam'}.
2026-06-15 22:08:10,706 - experiment_functions - INFO - Early stopping at epoch 1700. Best Metrics: (0.09088681308574077, 0.011316899993301627, 0.04723597166060775)
2026-06-15 22:08:10,789 - optuna.study.study - INFO - Trial 227 finished with values: [0.09088681308574077, 0.011316899993301627, 0.04723597166060775] and parameters: {'n_layers': 1, 'embedding_dim': 256, 'lr': 0.001479782641411582, 'lambda_val': 0.0012522872845674186, 'batch_size': 1633, 'optimizer': 'Adam'}.
2026-06-15 22:10:44,770 - optuna.study.study - INFO - Trial 228 finished with values: [0.08705151498383407, 0.010832942594949428, 0.04890202514648041] and parameters: {'n_layers': 1, 'embedding_dim': 32, 'lr': 0.001479782641411582, 'lambda_val': 2.0623181656245837e-06, 'batch_size': 1545, 'optimizer': 'Adam'}.
2026-06-15 22:11:32,669 - experiment_functions - INFO - Early stopping at epoch 1000. Best Metrics: (0.043575452954088434, 0.0053017616719137255, 0.021200206542616385)
2026-06-15 22:11:32,984 - optuna.study.study - INFO - Trial 229 finished with values: [0.043575452954088434, 0.0053017616719137255, 0.021200206542616385] and parameters: {'n_layers': 3, 'embedding_dim': 128, 'lr': 0.001479782641411582, 'lambda_val': 6.461965909578869e-06, 'batch_size': 2936, 'optimizer': 'RMSprop'}.
2026-06-15 22:12:42,225 - experiment_functions - INFO - Early stopping at epoch 1900. Best Metrics: (0.0007262220690096503, 0.00011387232902404717, 0.0003613205176861237)
2026-06-15 22:12:42,306 - optuna.study.study - INFO - Trial 230 finished with values: [0.0007262220690096503, 0.00011387232902404717, 0.0003613205176861237] and parameters: {'n_layers': 1, 'embedding_dim': 32, 'lr': 9.559391534077792e-05, 'lambda_val': 6.461965909578869e-06, 'batch_size': 3620, 'optimizer': 'RMSprop'}.
2026-06-15 22:14:15,796 - experiment_functions - INFO - Early stopping at epoch 2500. Best Metrics: (0.04244741231893785, 0.0048881371826646125, 0.01997861100728681)
2026-06-15 22:14:15,875 - optuna.study.study - INFO - Trial 231 finished with values: [0.04244741231893785, 0.0048881371826646125, 0.01997861100728681] and parameters: {'n_layers': 1, 'embedding_dim': 32, 'lr': 0.012070448902850505, 'lambda_val': 6.461965909578869e-06, 'batch_size': 3109, 'optimizer': 'RMSprop'}.
2026-06-15 22:15:37,915 - experiment_functions - INFO - Early stopping at epoch 2100. Best Metrics: (0.08536716039756795, 0.010568356889275906, 0.045093393079772996)
