2026-06-15 11:38:23,369 - optuna.study.study - INFO - Trial 86 finished with values: [0.03555805551846212, 0.00451302833411481, 0.016710751886099096] and parameters: {'n_layers': 4, 'embedding_dim': 32, 'lr': 0.004300628102170609, 'lambda_val': 9.634375098462012e-06, 'batch_size': 4072, 'optimizer': 'Adam'}.
2026-06-15 11:38:47,241 - experiment_functions - INFO - Early stopping at epoch 500. Best Metrics: (0.0005078330889413927, 9.210261906356756e-05, 0.00023265885341549448)
2026-06-15 11:38:47,346 - optuna.study.study - INFO - Trial 87 finished with values: [0.0005078330889413927, 9.210261906356756e-05, 0.00023265885341549448] and parameters: {'n_layers': 1, 'embedding_dim': 256, 'lr': 5.250508420251108e-05, 'lambda_val': 0.0215792743869707, 'batch_size': 1160, 'optimizer': 'RMSprop'}.
2026-06-15 11:39:54,780 - experiment_functions - INFO - Early stopping at epoch 1850. Best Metrics: (0.0003303318270541519, 6.530912988143882e-05, 0.0001753116855271479)
2026-06-15 11:39:54,869 - optuna.study.study - INFO - Trial 88 finished with values: [0.0003303318270541519, 6.530912988143882e-05, 0.0001753116855271479] and parameters: {'n_layers': 1, 'embedding_dim': 32, 'lr': 1.266434023153163e-05, 'lambda_val': 2.9677369546189456e-06, 'batch_size': 3951, 'optimizer': 'Adam'}.
2026-06-15 11:42:32,827 - optuna.study.study - INFO - Trial 89 finished with values: [0.060976343727081606, 0.00825072007502177, 0.03540224634047281] and parameters: {'n_layers': 1, 'embedding_dim': 96, 'lr': 0.0008138925204745388, 'lambda_val': 4.566471731928917e-05, 'batch_size': 789, 'optimizer': 'RMSprop'}.
2026-06-15 11:43:25,393 - experiment_functions - INFO - Early stopping at epoch 1300. Best Metrics: (0.0005858286397055638, 8.372965369415233e-05, 0.0003302314992000294)
2026-06-15 11:43:25,485 - optuna.study.study - INFO - Trial 90 finished with values: [0.0005858286397055638, 8.372965369415233e-05, 0.0003302314992000294] and parameters: {'n_layers': 1, 'embedding_dim': 128, 'lr': 5.918708868351568e-05, 'lambda_val': 2.2987320743696026e-05, 'batch_size': 2769, 'optimizer': 'Adam'}.
2026-06-15 11:43:51,473 - experiment_functions - INFO - Early stopping at epoch 600. Best Metrics: (0.06044860267260605, 0.007528970460178177, 0.02931445166778432)
2026-06-15 11:43:51,569 - optuna.study.study - INFO - Trial 91 finished with values: [0.06044860267260605, 0.007528970460178177, 0.02931445166778432] and parameters: {'n_layers': 2, 'embedding_dim': 64, 'lr': 0.004300628102170609, 'lambda_val': 0.002872624371953763, 'batch_size': 3991, 'optimizer': 'Adam'}.
2026-06-15 11:44:19,853 - experiment_functions - INFO - Early stopping at epoch 700. Best Metrics: (0.057331372014439885, 0.007652890347645522, 0.029677917531028438)
2026-06-15 11:44:19,951 - optuna.study.study - INFO - Trial 92 finished with values: [0.057331372014439885, 0.007652890347645522, 0.029677917531028438] and parameters: {'n_layers': 1, 'embedding_dim': 32, 'lr': 0.004300628102170609, 'lambda_val': 0.00818802156219734, 'batch_size': 2831, 'optimizer': 'Adam'}.
2026-06-15 11:44:54,015 - experiment_functions - INFO - Early stopping at epoch 800. Best Metrics: (0.06108565239791515, 0.007714850291379196, 0.03164713226145981)
2026-06-15 11:44:54,576 - optuna.study.study - INFO - Trial 93 finished with values: [0.06108565239791515, 0.007714850291379196, 0.03164713226145981] and parameters: {'n_layers': 2, 'embedding_dim': 64, 'lr': 0.0015713090624126847, 'lambda_val': 0.0016396245708417134, 'batch_size': 3609, 'optimizer': 'Adam'}.
2026-06-15 11:45:37,406 - experiment_functions - INFO - Early stopping at epoch 650. Best Metrics: (0.04620135494280824, 0.005712036975015071, 0.022312769233208088)
2026-06-15 11:45:37,490 - optuna.study.study - INFO - Trial 94 finished with values: [0.04620135494280824, 0.005712036975015071, 0.022312769233208088] and parameters: {'n_layers': 4, 'embedding_dim': 256, 'lr': 0.0016086229224309184, 'lambda_val': 1.0723270203484857e-05, 'batch_size': 3981, 'optimizer': 'Adam'}.
2026-06-15 11:46:04,942 - experiment_functions - INFO - Early stopping at epoch 650. Best Metrics: (0.01734025713669605, 0.002017884654029071, 0.007908336381554469)
2026-06-15 11:46:05,034 - optuna.study.study - INFO - Trial 95 finished with values: [0.01734025713669605, 0.002017884654029071, 0.007908336381554469] and parameters: {'n_layers': 4, 'embedding_dim': 32, 'lr': 0.02593878803168038, 'lambda_val': 0.0013236495906126266, 'batch_size': 1273, 'optimizer': 'Adam'}.
2026-06-15 11:46:43,501 - experiment_functions - INFO - Early stopping at epoch 800. Best Metrics: (0.06779852577915287, 0.008756447183334449, 0.034027446073470635)
2026-06-15 11:46:43,617 - optuna.study.study - INFO - Trial 96 finished with values: [0.06779852577915287, 0.008756447183334449, 0.034027446073470635] and parameters: {'n_layers': 1, 'embedding_dim': 256, 'lr': 0.0016086229224309184, 'lambda_val': 0.004600256253014536, 'batch_size': 2285, 'optimizer': 'RMSprop'}.
2026-06-15 11:47:22,717 - experiment_functions - INFO - Early stopping at epoch 800. Best Metrics: (0.07808788852342183, 0.00968919552548731, 0.03988384090973511)
2026-06-15 11:47:23,166 - optuna.study.study - INFO - Trial 97 finished with values: [0.07808788852342183, 0.00968919552548731, 0.03988384090973511] and parameters: {'n_layers': 1, 'embedding_dim': 256, 'lr': 0.0026397990430783503, 'lambda_val': 0.002872624371953763, 'batch_size': 2666, 'optimizer': 'Adam'}.
2026-06-15 11:47:45,232 - experiment_functions - INFO - Early stopping at epoch 500. Best Metrics: (0.0005238231629340831, 7.703128139862015e-05, 0.00022272717684294443)
2026-06-15 11:47:45,325 - optuna.study.study - INFO - Trial 98 finished with values: [0.0005238231629340831, 7.703128139862015e-05, 0.00022272717684294443] and parameters: {'n_layers': 3, 'embedding_dim': 64, 'lr': 0.009437755959287303, 'lambda_val': 0.021111346605514066, 'batch_size': 3877, 'optimizer': 'SGD'}.
2026-06-15 11:48:41,749 - experiment_functions - INFO - Early stopping at epoch 1400. Best Metrics: (0.0007717625092284502, 0.0001038247705807489, 0.0003343092901145255)
2026-06-15 11:48:41,847 - optuna.study.study - INFO - Trial 99 finished with values: [0.0007717625092284502, 0.0001038247705807489, 0.0003343092901145255] and parameters: {'n_layers': 1, 'embedding_dim': 128, 'lr': 8.567524870866286e-05, 'lambda_val': 2.9677369546189456e-06, 'batch_size': 3526, 'optimizer': 'RMSprop'}.
2026-06-15 11:52:27,730 - optuna.study.study - INFO - Trial 100 finished with values: [0.060604372492924476, 0.006713443633197134, 0.029042778387529045] and parameters: {'n_layers': 3, 'embedding_dim': 256, 'lr': 0.01036324135738448, 'lambda_val': 1.653565652226834e-05, 'batch_size': 2285, 'optimizer': 'RMSprop'}.
2026-06-15 11:53:14,704 - experiment_functions - INFO - Early stopping at epoch 1150. Best Metrics: (0.0005342402892601849, 8.540424676803538e-05, 0.0002530597357335887)
2026-06-15 11:53:14,797 - optuna.study.study - INFO - Trial 101 finished with values: [0.0005342402892601849, 8.540424676803538e-05, 0.0002530597357335887] and parameters: {'n_layers': 1, 'embedding_dim': 128, 'lr': 3.9101216585805176e-05, 'lambda_val': 0.00976549585781695, 'batch_size': 3976, 'optimizer': 'Adam'}.
2026-06-15 11:54:01,202 - experiment_functions - INFO - Early stopping at epoch 1000. Best Metrics: (0.0587823089872362, 0.007195726438475452, 0.028925257075552258)
2026-06-15 11:54:01,323 - optuna.study.study - INFO - Trial 102 finished with values: [0.0587823089872362, 0.007195726438475452, 0.028925257075552258] and parameters: {'n_layers': 3, 'embedding_dim': 96, 'lr': 0.0012504020170177757, 'lambda_val': 1.0723270203484857e-05, 'batch_size': 2768, 'optimizer': 'Adam'}.
2026-06-15 11:56:46,336 - optuna.study.study - INFO - Trial 103 finished with values: [0.0630102291969538, 0.007328019291312211, 0.03001223650644777] and parameters: {'n_layers': 1, 'embedding_dim': 128, 'lr': 0.007264999721759937, 'lambda_val': 4.6804655463952444e-05, 'batch_size': 2768, 'optimizer': 'RMSprop'}.
2026-06-15 11:58:01,380 - experiment_functions - INFO - Early stopping at epoch 1900. Best Metrics: (0.08909791350549846, 0.010616920088418516, 0.047431044464734694)
2026-06-15 11:58:01,459 - optuna.study.study - INFO - Trial 104 finished with values: [0.08909791350549846, 0.010616920088418516, 0.047431044464734694] and parameters: {'n_layers': 1, 'embedding_dim': 32, 'lr': 0.0026397990430783503, 'lambda_val': 1.0723270203484857e-05, 'batch_size': 2768, 'optimizer': 'Adam'}.
2026-06-15 11:58:31,169 - experiment_functions - INFO - Early stopping at epoch 600. Best Metrics: (0.03589970188005444, 0.004476187286489383, 0.01699670055372729)
2026-06-15 11:58:31,259 - optuna.study.study - INFO - Trial 105 finished with values: [0.03589970188005444, 0.004476187286489383, 0.01699670055372729] and parameters: {'n_layers': 4, 'embedding_dim': 96, 'lr': 0.005616296548051391, 'lambda_val': 0.0002014587319781766, 'batch_size': 558, 'optimizer': 'RMSprop'}.
2026-06-15 11:59:05,404 - experiment_functions - INFO - Early stopping at epoch 700. Best Metrics: (0.03322424824357656, 0.00391352401366468, 0.015488160423181239)
2026-06-15 11:59:05,490 - optuna.study.study - INFO - Trial 106 finished with values: [0.03322424824357656, 0.00391352401366468, 0.015488160423181239] and parameters: {'n_layers': 4, 'embedding_dim': 96, 'lr': 0.004300628102170609, 'lambda_val': 1.0723270203484857e-05, 'batch_size': 3756, 'optimizer': 'Adam'}.
2026-06-15 12:00:18,563 - experiment_functions - INFO - Early stopping at epoch 1700. Best Metrics: (0.06379734590451604, 0.007626096858463395, 0.0318734474016372)
2026-06-15 12:00:18,646 - optuna.study.study - INFO - Trial 107 finished with values: [0.06379734590451604, 0.007626096858463395, 0.0318734474016372] and parameters: {'n_layers': 3, 'embedding_dim': 64, 'lr': 0.0009437548244297628, 'lambda_val': 1.509459220212265e-05, 'batch_size': 3624, 'optimizer': 'Adam'}.
2026-06-15 12:00:44,346 - experiment_functions - INFO - Early stopping at epoch 600. Best Metrics: (0.022771271093609543, 0.0027865228749413893, 0.010007501730202194)
2026-06-15 12:00:44,431 - optuna.study.study - INFO - Trial 108 finished with values: [0.022771271093609543, 0.0027865228749413893, 0.010007501730202194] and parameters: {'n_layers': 4, 'embedding_dim': 32, 'lr': 0.004300628102170609, 'lambda_val': 0.00818802156219734, 'batch_size': 4072, 'optimizer': 'Adam'}.
2026-06-15 12:03:15,860 - experiment_functions - INFO - Early stopping at epoch 2450. Best Metrics: (0.01905599561153625, 0.0022925179181458905, 0.008324178403430024)
2026-06-15 12:03:15,991 - optuna.study.study - INFO - Trial 109 finished with values: [0.01905599561153625, 0.0022925179181458905, 0.008324178403430024] and parameters: {'n_layers': 4, 'embedding_dim': 256, 'lr': 0.0016086229224309184, 'lambda_val': 0.0063958388754838695, 'batch_size': 789, 'optimizer': 'Adam'}.
2026-06-15 12:03:54,236 - experiment_functions - INFO - Early stopping at epoch 850. Best Metrics: (0.07684342340628911, 0.009376046620671178, 0.04048394197146798)
2026-06-15 12:03:54,324 - optuna.study.study - INFO - Trial 110 finished with values: [0.07684342340628911, 0.009376046620671178, 0.04048394197146798] and parameters: {'n_layers': 2, 'embedding_dim': 96, 'lr': 0.0016086229224309184, 'lambda_val': 2.9677369546189456e-06, 'batch_size': 3981, 'optimizer': 'Adam'}.
2026-06-15 12:06:57,896 - optuna.study.study - INFO - Trial 111 finished with values: [0.0408077203424485, 0.004638622814656038, 0.018685735614528985] and parameters: {'n_layers': 4, 'embedding_dim': 96, 'lr': 0.005616296548051391, 'lambda_val': 2.0471988586907107e-05, 'batch_size': 998, 'optimizer': 'RMSprop'}.
2026-06-15 12:07:33,548 - experiment_functions - INFO - Early stopping at epoch 650. Best Metrics: (0.05748064145408548, 0.007101949226338, 0.027111515606758545)
2026-06-15 12:07:33,642 - optuna.study.study - INFO - Trial 112 finished with values: [0.05748064145408548, 0.007101949226338, 0.027111515606758545] and parameters: {'n_layers': 2, 'embedding_dim': 256, 'lr': 0.0026397990430783503, 'lambda_val': 0.002872624371953763, 'batch_size': 2434, 'optimizer': 'Adam'}.
2026-06-15 12:09:44,053 - experiment_functions - INFO - Early stopping at epoch 3400. Best Metrics: (0.06077456246776918, 0.007189028066179918, 0.0291955419617457)
2026-06-15 12:09:44,138 - optuna.study.study - INFO - Trial 113 finished with values: [0.06077456246776918, 0.007189028066179918, 0.0291955419617457] and parameters: {'n_layers': 1, 'embedding_dim': 32, 'lr': 0.005616296548051391, 'lambda_val': 2.0471988586907107e-05, 'batch_size': 2768, 'optimizer': 'RMSprop'}.
2026-06-15 12:12:19,785 - experiment_functions - INFO - Early stopping at epoch 3050. Best Metrics: (0.03854389676061799, 0.004412552749681827, 0.017853303447775238)
2026-06-15 12:12:19,863 - optuna.study.study - INFO - Trial 114 finished with values: [0.03854389676061799, 0.004412552749681827, 0.017853303447775238] and parameters: {'n_layers': 2, 'embedding_dim': 256, 'lr': 0.005616296548051391, 'lambda_val': 0.0002014587319781766, 'batch_size': 558, 'optimizer': 'Adam'}.
2026-06-15 12:15:05,815 - optuna.study.study - INFO - Trial 115 finished with values: [0.04559986471824509, 0.004914930671846741, 0.020441542244116366] and parameters: {'n_layers': 3, 'embedding_dim': 64, 'lr': 0.01036324135738448, 'lambda_val': 1.509459220212265e-05, 'batch_size': 3411, 'optimizer': 'RMSprop'}.
2026-06-15 12:18:02,757 - optuna.study.study - INFO - Trial 116 finished with values: [0.05899069326420195, 0.007189028066179918, 0.029910889971147818] and parameters: {'n_layers': 3, 'embedding_dim': 96, 'lr': 0.0008138925204745388, 'lambda_val': 2.9677369546189456e-06, 'batch_size': 558, 'optimizer': 'RMSprop'}.
2026-06-15 12:19:21,551 - experiment_functions - INFO - Early stopping at epoch 1950. Best Metrics: (0.0350034763035131, 0.004149641637082189, 0.01598278988785131)
2026-06-15 12:19:21,620 - optuna.study.study - INFO - Trial 117 finished with values: [0.0350034763035131, 0.004149641637082189, 0.01598278988785131] and parameters: {'n_layers': 4, 'embedding_dim': 32, 'lr': 0.0014227121487339167, 'lambda_val': 0.0004230572417097157, 'batch_size': 3360, 'optimizer': 'Adam'}.
2026-06-15 12:19:51,833 - experiment_functions - INFO - Early stopping at epoch 550. Best Metrics: (0.03718576653927505, 0.004196530243150915, 0.0170759746961491)
2026-06-15 12:19:51,928 - optuna.study.study - INFO - Trial 118 finished with values: [0.03718576653927505, 0.004196530243150915, 0.0170759746961491] and parameters: {'n_layers': 2, 'embedding_dim': 256, 'lr': 0.03399653553805821, 'lambda_val': 0.00021849934518962413, 'batch_size': 3981, 'optimizer': 'Adam'}.
2026-06-15 12:21:07,957 - experiment_functions - INFO - Early stopping at epoch 1650. Best Metrics: (0.016549008260821226, 0.002058074887802264, 0.007255978475698741)
2026-06-15 12:21:08,035 - optuna.study.study - INFO - Trial 119 finished with values: [0.016549008260821226, 0.002058074887802264, 0.007255978475698741] and parameters: {'n_layers': 4, 'embedding_dim': 96, 'lr': 0.0018921194607502668, 'lambda_val': 0.00818802156219734, 'batch_size': 876, 'optimizer': 'Adam'}.
2026-06-15 12:21:39,110 - experiment_functions - INFO - Early stopping at epoch 700. Best Metrics: (0.06099809504318442, 0.007654564940719405, 0.030422613996568457)
2026-06-15 12:21:39,206 - optuna.study.study - INFO - Trial 120 finished with values: [0.06099809504318442, 0.007654564940719405, 0.030422613996568457] and parameters: {'n_layers': 1, 'embedding_dim': 128, 'lr': 0.0026397990430783503, 'lambda_val': 0.002872624371953763, 'batch_size': 2666, 'optimizer': 'RMSprop'}.
2026-06-15 12:22:08,458 - experiment_functions - INFO - Early stopping at epoch 600. Best Metrics: (0.04047361598585168, 0.005007033290910309, 0.018793650908365867)
2026-06-15 12:22:08,562 - optuna.study.study - INFO - Trial 121 finished with values: [0.04047361598585168, 0.005007033290910309, 0.018793650908365867] and parameters: {'n_layers': 1, 'embedding_dim': 256, 'lr': 0.01036324135738448, 'lambda_val': 0.004600256253014536, 'batch_size': 1539, 'optimizer': 'Adam'}.
2026-06-15 12:24:43,833 - optuna.study.study - INFO - Trial 122 finished with values: [0.06291538273755821, 0.008115078036037242, 0.032263021156095556] and parameters: {'n_layers': 2, 'embedding_dim': 32, 'lr': 0.00044819859318088583, 'lambda_val': 0.002872624371953763, 'batch_size': 3991, 'optimizer': 'Adam'}.
2026-06-15 12:25:16,412 - experiment_functions - INFO - Early stopping at epoch 550. Best Metrics: (0.020625900320412692, 0.0023444303034362655, 0.009163486336790481)
2026-06-15 12:25:16,490 - optuna.study.study - INFO - Trial 123 finished with values: [0.020625900320412692, 0.0023444303034362655, 0.009163486336790481] and parameters: {'n_layers': 3, 'embedding_dim': 256, 'lr': 0.01036324135738448, 'lambda_val': 0.004600256253014536, 'batch_size': 2285, 'optimizer': 'RMSprop'}.
2026-06-15 12:26:40,635 - experiment_functions - INFO - Early stopping at epoch 1800. Best Metrics: (0.029885215898621375, 0.003396074753834818, 0.013265226026158603)
2026-06-15 12:26:40,726 - optuna.study.study - INFO - Trial 124 finished with values: [0.029885215898621375, 0.003396074753834818, 0.013265226026158603] and parameters: {'n_layers': 4, 'embedding_dim': 96, 'lr': 0.005616296548051391, 'lambda_val': 4.8409725991292286e-06, 'batch_size': 2572, 'optimizer': 'Adam'}.
2026-06-15 12:27:24,058 - experiment_functions - INFO - Early stopping at epoch 1100. Best Metrics: (0.05428549094531073, 0.006545984325808829, 0.02647649366453408)
2026-06-15 12:27:24,145 - optuna.study.study - INFO - Trial 125 finished with values: [0.05428549094531073, 0.006545984325808829, 0.02647649366453408] and parameters: {'n_layers': 1, 'embedding_dim': 32, 'lr': 0.005616296548051391, 'lambda_val': 0.0016396245708417134, 'batch_size': 558, 'optimizer': 'Adam'}.
2026-06-15 12:27:51,237 - experiment_functions - INFO - Early stopping at epoch 500. Best Metrics: (0.020458886643987133, 0.002115011052314288, 0.010326832197803887)
2026-06-15 12:27:51,336 - optuna.study.study - INFO - Trial 126 finished with values: [0.020458886643987133, 0.002115011052314288, 0.010326832197803887] and parameters: {'n_layers': 2, 'embedding_dim': 256, 'lr': 0.03399653553805821, 'lambda_val': 0.016918685856806698, 'batch_size': 2666, 'optimizer': 'RMSprop'}.
2026-06-15 12:30:56,100 - optuna.study.study - INFO - Trial 127 finished with values: [0.08517204024474313, 0.009886797508205506, 0.04169404523344649] and parameters: {'n_layers': 1, 'embedding_dim': 256, 'lr': 0.0026397990430783503, 'lambda_val': 1.0723270203484857e-05, 'batch_size': 2285, 'optimizer': 'RMSprop'}.
2026-06-15 12:31:28,405 - experiment_functions - INFO - Early stopping at epoch 650. Best Metrics: (0.08720170077854586, 0.010712371893629847, 0.045373529094408206)
2026-06-15 12:31:28,479 - optuna.study.study - INFO - Trial 128 finished with values: [0.08720170077854586, 0.010712371893629847, 0.045373529094408206] and parameters: {'n_layers': 1, 'embedding_dim': 256, 'lr': 0.005616296548051391, 'lambda_val': 2.0471988586907107e-05, 'batch_size': 3981, 'optimizer': 'Adam'}.
2026-06-15 12:35:13,861 - optuna.study.study - INFO - Trial 129 finished with values: [0.044526564222822584, 0.005074017013865632, 0.020166504088202183] and parameters: {'n_layers': 3, 'embedding_dim': 256, 'lr': 0.0018921194607502668, 'lambda_val': 1.509459220212265e-05, 'batch_size': 2434, 'optimizer': 'RMSprop'}.
2026-06-15 12:35:44,356 - experiment_functions - INFO - Early stopping at epoch 650. Best Metrics: (0.03748989561420699, 0.004221649139259161, 0.017878325117338518)
2026-06-15 12:35:44,457 - optuna.study.study - INFO - Trial 130 finished with values: [0.03748989561420699, 0.004221649139259161, 0.017878325117338518] and parameters: {'n_layers': 3, 'embedding_dim': 96, 'lr': 0.02593878803168038, 'lambda_val': 2.5476071418262236e-05, 'batch_size': 2841, 'optimizer': 'RMSprop'}.
2026-06-15 12:36:19,371 - experiment_functions - INFO - Early stopping at epoch 750. Best Metrics: (0.04109759992031794, 0.005120905619934356, 0.019729385850864044)
2026-06-15 12:36:19,451 - optuna.study.study - INFO - Trial 131 finished with values: [0.04109759992031794, 0.005120905619934356, 0.019729385850864044] and parameters: {'n_layers': 3, 'embedding_dim': 96, 'lr': 0.0014227121487339167, 'lambda_val': 0.0050932981461299836, 'batch_size': 3360, 'optimizer': 'Adam'}.
2026-06-15 12:36:56,920 - experiment_functions - INFO - Early stopping at epoch 900. Best Metrics: (0.049192132144113526, 0.0060352334382745, 0.023592349370997592)
2026-06-15 12:36:57,009 - optuna.study.study - INFO - Trial 132 finished with values: [0.049192132144113526, 0.0060352334382745, 0.023592349370997592] and parameters: {'n_layers': 3, 'embedding_dim': 32, 'lr': 0.0014227121487339167, 'lambda_val': 0.0004230572417097157, 'batch_size': 3360, 'optimizer': 'RMSprop'}.
2026-06-15 12:40:42,114 - optuna.study.study - INFO - Trial 133 finished with values: [0.04396290349198326, 0.004777614039788332, 0.020095215548298174] and parameters: {'n_layers': 3, 'embedding_dim': 256, 'lr': 0.005988564288598955, 'lambda_val': 0.00039003938593281393, 'batch_size': 3981, 'optimizer': 'RMSprop'}.
2026-06-15 12:43:33,006 - optuna.study.study - INFO - Trial 134 finished with values: [0.03573716923295436, 0.004024047156540961, 0.01591238706449772] and parameters: {'n_layers': 4, 'embedding_dim': 64, 'lr': 0.0858732081596601, 'lambda_val': 0.0006322078828082113, 'batch_size': 3981, 'optimizer': 'RMSprop'}.
2026-06-15 12:47:35,550 - optuna.study.study - INFO - Trial 135 finished with values: [0.009312638650663237, 0.0013949360305445778, 0.004806724926527474] and parameters: {'n_layers': 4, 'embedding_dim': 256, 'lr': 0.00010986907617661836, 'lambda_val': 0.0006322078828082113, 'batch_size': 1017, 'optimizer': 'RMSprop'}.
