2026-06-14 05:34:04,580 - optuna.study.study - INFO - Trial 82 finished with values: [0.023536222607786254, 0.0031884252126733203, 0.011319934150481957] and parameters: {'n_layers': 1, 'embedding_dim': 96, 'lr': 0.002252910187430102, 'lambda_val': 0.0582428198563078, 'batch_size': 3452, 'optimizer': 'Adam'}.
2026-06-14 05:34:34,968 - experiment_functions - INFO - Early stopping at epoch 500. Best Metrics: (0.0005340280053891567, 9.377721213745061e-05, 0.00022889818526184333)
2026-06-14 05:34:35,288 - optuna.study.study - INFO - Trial 83 finished with values: [0.0005340280053891567, 9.377721213745061e-05, 0.00022889818526184333] and parameters: {'n_layers': 3, 'embedding_dim': 256, 'lr': 0.00035232654128344285, 'lambda_val': 0.004913946733537837, 'batch_size': 3350, 'optimizer': 'SGD'}.
2026-06-14 05:34:58,989 - experiment_functions - INFO - Early stopping at epoch 500. Best Metrics: (0.0006981959214191781, 9.04280259896845e-05, 0.00029609204255179474)
2026-06-14 05:34:59,077 - optuna.study.study - INFO - Trial 84 finished with values: [0.0006981959214191781, 9.04280259896845e-05, 0.00029609204255179474] and parameters: {'n_layers': 3, 'embedding_dim': 96, 'lr': 5.771126583454873e-05, 'lambda_val': 1.2392866891979114e-05, 'batch_size': 3623, 'optimizer': 'SGD'}.
2026-06-14 05:35:20,405 - experiment_functions - INFO - Early stopping at epoch 500. Best Metrics: (0.0004242141841101442, 8.540424676803538e-05, 0.00021998928137189318)
2026-06-14 05:35:20,580 - optuna.study.study - INFO - Trial 85 finished with values: [0.0004242141841101442, 8.540424676803538e-05, 0.00021998928137189318] and parameters: {'n_layers': 3, 'embedding_dim': 32, 'lr': 0.04903635821443362, 'lambda_val': 0.023998588162465376, 'batch_size': 3574, 'optimizer': 'SGD'}.
2026-06-14 05:38:03,479 - optuna.study.study - INFO - Trial 86 finished with values: [0.07208576295876767, 0.009620537209458102, 0.04116926667780921] and parameters: {'n_layers': 1, 'embedding_dim': 96, 'lr': 0.0008197571059817735, 'lambda_val': 1.910365266111311e-06, 'batch_size': 792, 'optimizer': 'Adam'}.
2026-06-14 05:38:25,157 - experiment_functions - INFO - Early stopping at epoch 500. Best Metrics: (0.0005507091396036163, 7.2007502176971e-05, 0.00025192835818052897)
2026-06-14 05:38:25,226 - optuna.study.study - INFO - Trial 87 finished with values: [0.0005507091396036163, 7.2007502176971e-05, 0.00025192835818052897] and parameters: {'n_layers': 4, 'embedding_dim': 32, 'lr': 0.01314595964855602, 'lambda_val': 0.0001364070822934131, 'batch_size': 3452, 'optimizer': 'SGD'}.
2026-06-14 05:39:39,699 - experiment_functions - INFO - Early stopping at epoch 1650. Best Metrics: (0.00039490009335697786, 7.033290910308795e-05, 0.00025965481008557783)
2026-06-14 05:39:39,916 - optuna.study.study - INFO - Trial 88 finished with values: [0.00039490009335697786, 7.033290910308795e-05, 0.00025965481008557783] and parameters: {'n_layers': 3, 'embedding_dim': 96, 'lr': 1.0759423112198052e-05, 'lambda_val': 8.049701828088752e-06, 'batch_size': 3438, 'optimizer': 'Adam'}.
2026-06-14 05:42:27,019 - optuna.study.study - INFO - Trial 89 finished with values: [0.0014923923513762971, 0.00023779221649139265, 0.0007453157290249848] and parameters: {'n_layers': 3, 'embedding_dim': 64, 'lr': 5.771126583454873e-05, 'lambda_val': 0.0001928067341566669, 'batch_size': 3623, 'optimizer': 'RMSprop'}.
2026-06-14 05:43:28,003 - experiment_functions - INFO - Early stopping at epoch 900. Best Metrics: (0.03367942452223928, 0.004077634134905218, 0.016076344779906587)
2026-06-14 05:43:28,094 - optuna.study.study - INFO - Trial 90 finished with values: [0.03367942452223928, 0.004077634134905218, 0.016076344779906587] and parameters: {'n_layers': 4, 'embedding_dim': 256, 'lr': 0.0011116819593430245, 'lambda_val': 0.000774370046373062, 'batch_size': 3120, 'optimizer': 'RMSprop'}.
2026-06-14 05:43:59,399 - experiment_functions - INFO - Early stopping at epoch 650. Best Metrics: (0.029609420402031326, 0.003595351329626901, 0.013628609543375346)
2026-06-14 05:43:59,616 - optuna.study.study - INFO - Trial 91 finished with values: [0.029609420402031326, 0.003595351329626901, 0.013628609543375346] and parameters: {'n_layers': 3, 'embedding_dim': 96, 'lr': 0.00486276978616333, 'lambda_val': 0.0005619009286188447, 'batch_size': 2162, 'optimizer': 'RMSprop'}.
2026-06-14 05:44:23,226 - experiment_functions - INFO - Early stopping at epoch 550. Best Metrics: (0.0005275573708789431, 8.372965369415233e-05, 0.00020773495036880034)
2026-06-14 05:44:23,416 - optuna.study.study - INFO - Trial 92 finished with values: [0.0005275573708789431, 8.372965369415233e-05, 0.00020773495036880034] and parameters: {'n_layers': 1, 'embedding_dim': 96, 'lr': 0.00010067552704350233, 'lambda_val': 0.004913946733537837, 'batch_size': 2271, 'optimizer': 'RMSprop'}.
2026-06-14 05:47:49,074 - optuna.study.study - INFO - Trial 93 finished with values: [0.0009280826286227241, 0.00012559448054122848, 0.00040894292774126145] and parameters: {'n_layers': 2, 'embedding_dim': 256, 'lr': 0.00010067552704350233, 'lambda_val': 0.06061131124836911, 'batch_size': 3708, 'optimizer': 'RMSprop'}.
2026-06-14 05:49:22,476 - experiment_functions - INFO - Early stopping at epoch 2300. Best Metrics: (0.03974383290874779, 0.00468886060687253, 0.018371121980943737)
2026-06-14 05:49:22,982 - optuna.study.study - INFO - Trial 94 finished with values: [0.03974383290874779, 0.00468886060687253, 0.018371121980943737] and parameters: {'n_layers': 2, 'embedding_dim': 32, 'lr': 0.00352106387321726, 'lambda_val': 3.7105397328767524e-06, 'batch_size': 2505, 'optimizer': 'RMSprop'}.
2026-06-14 05:49:47,353 - experiment_functions - INFO - Early stopping at epoch 550. Best Metrics: (0.023544976467142056, 0.003076227476723156, 0.0119494258817316)
2026-06-14 05:49:47,528 - optuna.study.study - INFO - Trial 95 finished with values: [0.023544976467142056, 0.003076227476723156, 0.0119494258817316] and parameters: {'n_layers': 1, 'embedding_dim': 96, 'lr': 0.02122039140499773, 'lambda_val': 0.0001364070822934131, 'batch_size': 3452, 'optimizer': 'RMSprop'}.
2026-06-14 05:50:08,914 - experiment_functions - INFO - Early stopping at epoch 500. Best Metrics: (0.0004907735051472807, 7.033290910308795e-05, 0.00022618977320850212)
2026-06-14 05:50:09,053 - optuna.study.study - INFO - Trial 96 finished with values: [0.0004907735051472807, 7.033290910308795e-05, 0.00022618977320850212] and parameters: {'n_layers': 3, 'embedding_dim': 32, 'lr': 0.021508799802187974, 'lambda_val': 0.0015912107748891956, 'batch_size': 1242, 'optimizer': 'SGD'}.
2026-06-14 05:52:54,611 - experiment_functions - INFO - Early stopping at epoch 3400. Best Metrics: (0.05268406911328914, 0.006383548797642173, 0.025820236839365227)
2026-06-14 05:52:54,690 - optuna.study.study - INFO - Trial 97 finished with values: [0.05268406911328914, 0.006383548797642173, 0.025820236839365227] and parameters: {'n_layers': 3, 'embedding_dim': 128, 'lr': 0.0011116819593430245, 'lambda_val': 8.049701828088752e-06, 'batch_size': 1088, 'optimizer': 'Adam'}.
2026-06-14 05:53:20,030 - experiment_functions - INFO - Early stopping at epoch 500. Best Metrics: (0.0005120811574757983, 8.038046754638624e-05, 0.00022672745203638464)
2026-06-14 05:53:20,221 - optuna.study.study - INFO - Trial 98 finished with values: [0.0005120811574757983, 8.038046754638624e-05, 0.00022672745203638464] and parameters: {'n_layers': 3, 'embedding_dim': 128, 'lr': 9.092673167049823e-05, 'lambda_val': 0.05049745047883414, 'batch_size': 2533, 'optimizer': 'RMSprop'}.
2026-06-14 05:53:45,824 - experiment_functions - INFO - Early stopping at epoch 500. Best Metrics: (0.0005022494502008618, 6.865831602920491e-05, 0.000218231509518819)
2026-06-14 05:53:46,571 - optuna.study.study - INFO - Trial 99 finished with values: [0.0005022494502008618, 6.865831602920491e-05, 0.000218231509518819] and parameters: {'n_layers': 3, 'embedding_dim': 128, 'lr': 0.002670622630663831, 'lambda_val': 1.6577722084002546e-06, 'batch_size': 2792, 'optimizer': 'SGD'}.
2026-06-14 05:54:23,445 - experiment_functions - INFO - Early stopping at epoch 750. Best Metrics: (0.04693477404241651, 0.005844329827851832, 0.023551592676720072)
2026-06-14 05:54:23,535 - optuna.study.study - INFO - Trial 100 finished with values: [0.04693477404241651, 0.005844329827851832, 0.023551592676720072] and parameters: {'n_layers': 2, 'embedding_dim': 128, 'lr': 0.013849452305144725, 'lambda_val': 8.049701828088752e-06, 'batch_size': 1088, 'optimizer': 'RMSprop'}.
2026-06-14 05:54:54,175 - experiment_functions - INFO - Early stopping at epoch 750. Best Metrics: (0.032776209241163416, 0.004446044611159488, 0.01591976557968837)
2026-06-14 05:54:54,338 - optuna.study.study - INFO - Trial 101 finished with values: [0.032776209241163416, 0.004446044611159488, 0.01591976557968837] and parameters: {'n_layers': 1, 'embedding_dim': 32, 'lr': 0.002252910187430102, 'lambda_val': 0.016456746884365176, 'batch_size': 3268, 'optimizer': 'RMSprop'}.
2026-06-14 05:56:52,473 - experiment_functions - INFO - Early stopping at epoch 2600. Best Metrics: (0.04378794905058094, 0.005589791680621608, 0.021219571491775994)
2026-06-14 05:56:52,592 - optuna.study.study - INFO - Trial 102 finished with values: [0.04378794905058094, 0.005589791680621608, 0.021219571491775994] and parameters: {'n_layers': 4, 'embedding_dim': 64, 'lr': 0.0009554934943534302, 'lambda_val': 0.00014895795346764513, 'batch_size': 2612, 'optimizer': 'Adam'}.
2026-06-14 05:58:49,526 - experiment_functions - INFO - Early stopping at epoch 2500. Best Metrics: (0.058397005728311094, 0.007274432312947955, 0.028525877282869417)
2026-06-14 05:58:49,610 - optuna.study.study - INFO - Trial 103 finished with values: [0.058397005728311094, 0.007274432312947955, 0.028525877282869417] and parameters: {'n_layers': 3, 'embedding_dim': 96, 'lr': 0.0008197571059817735, 'lambda_val': 1.910365266111311e-06, 'batch_size': 2682, 'optimizer': 'Adam'}.
2026-06-14 05:59:17,140 - experiment_functions - INFO - Early stopping at epoch 650. Best Metrics: (0.06250587285409748, 0.008148569897514904, 0.033609984307356774)
2026-06-14 05:59:17,233 - optuna.study.study - INFO - Trial 104 finished with values: [0.06250587285409748, 0.008148569897514904, 0.033609984307356774] and parameters: {'n_layers': 1, 'embedding_dim': 32, 'lr': 0.00486276978616333, 'lambda_val': 0.0012814196481845078, 'batch_size': 3438, 'optimizer': 'Adam'}.
2026-06-14 06:00:01,421 - experiment_functions - INFO - Early stopping at epoch 950. Best Metrics: (0.03866207539064537, 0.0049417241610288706, 0.019372036070658665)
2026-06-14 06:00:01,532 - optuna.study.study - INFO - Trial 105 finished with values: [0.03866207539064537, 0.0049417241610288706, 0.019372036070658665] and parameters: {'n_layers': 4, 'embedding_dim': 64, 'lr': 0.0011116819593430245, 'lambda_val': 8.049701828088752e-06, 'batch_size': 3411, 'optimizer': 'Adam'}.
2026-06-14 06:00:26,864 - experiment_functions - INFO - Early stopping at epoch 550. Best Metrics: (0.021253392069856186, 0.002597293857592605, 0.009600339356832785)
2026-06-14 06:00:26,951 - optuna.study.study - INFO - Trial 106 finished with values: [0.021253392069856186, 0.002597293857592605, 0.009600339356832785] and parameters: {'n_layers': 3, 'embedding_dim': 64, 'lr': 0.029452417709917918, 'lambda_val': 0.0015912107748891956, 'batch_size': 2682, 'optimizer': 'Adam'}.
2026-06-14 06:03:09,426 - optuna.study.study - INFO - Trial 107 finished with values: [0.05114166231604777, 0.006455556299819144, 0.024936968392501927] and parameters: {'n_layers': 3, 'embedding_dim': 32, 'lr': 0.0011116819593430245, 'lambda_val': 8.049701828088752e-06, 'batch_size': 1761, 'optimizer': 'Adam'}.
2026-06-14 06:06:34,268 - optuna.study.study - INFO - Trial 108 finished with values: [0.050531920279625386, 0.006246232165583763, 0.025062996665577538] and parameters: {'n_layers': 4, 'embedding_dim': 128, 'lr': 0.00034081213821976773, 'lambda_val': 0.00014895795346764513, 'batch_size': 3268, 'optimizer': 'Adam'}.
2026-06-14 06:08:20,656 - experiment_functions - INFO - Early stopping at epoch 2600. Best Metrics: (0.06148540819944269, 0.007818675061959943, 0.03149610343585107)
2026-06-14 06:08:20,732 - optuna.study.study - INFO - Trial 109 finished with values: [0.06148540819944269, 0.007818675061959943, 0.03149610343585107] and parameters: {'n_layers': 2, 'embedding_dim': 64, 'lr': 0.0004540666822812583, 'lambda_val': 0.0015912107748891956, 'batch_size': 1326, 'optimizer': 'RMSprop'}.
2026-06-14 06:09:26,102 - experiment_functions - INFO - Early stopping at epoch 1200. Best Metrics: (0.07058176744143131, 0.008676066715788064, 0.03586231662143777)
2026-06-14 06:09:26,522 - optuna.study.study - INFO - Trial 110 finished with values: [0.07058176744143131, 0.008676066715788064, 0.03586231662143777] and parameters: {'n_layers': 2, 'embedding_dim': 256, 'lr': 0.0007333136681919207, 'lambda_val': 4.898157643229756e-06, 'batch_size': 3900, 'optimizer': 'RMSprop'}.
2026-06-14 06:09:53,776 - experiment_functions - INFO - Early stopping at epoch 550. Best Metrics: (0.054244624776121714, 0.006303168330095787, 0.027312637983126116)
2026-06-14 06:09:53,938 - optuna.study.study - INFO - Trial 111 finished with values: [0.054244624776121714, 0.006303168330095787, 0.027312637983126116] and parameters: {'n_layers': 2, 'embedding_dim': 128, 'lr': 0.006946914948593308, 'lambda_val': 1.910365266111311e-06, 'batch_size': 3268, 'optimizer': 'Adam'}.
2026-06-14 06:10:34,552 - experiment_functions - INFO - Early stopping at epoch 950. Best Metrics: (0.08569079079975586, 0.010593475785384152, 0.04530278568033165)
2026-06-14 06:10:34,912 - optuna.study.study - INFO - Trial 112 finished with values: [0.08569079079975586, 0.010593475785384152, 0.04530278568033165] and parameters: {'n_layers': 1, 'embedding_dim': 64, 'lr': 0.002252910187430102, 'lambda_val': 0.0001364070822934131, 'batch_size': 3452, 'optimizer': 'Adam'}.
2026-06-14 06:11:54,183 - experiment_functions - INFO - Early stopping at epoch 1850. Best Metrics: (0.0884325391233425, 0.010842990153392726, 0.04693219762645025)
2026-06-14 06:11:55,064 - optuna.study.study - INFO - Trial 113 finished with values: [0.0884325391233425, 0.010842990153392726, 0.04693219762645025] and parameters: {'n_layers': 1, 'embedding_dim': 32, 'lr': 0.002252910187430102, 'lambda_val': 1.910365266111311e-06, 'batch_size': 2940, 'optimizer': 'Adam'}.
2026-06-14 06:12:35,568 - experiment_functions - INFO - Early stopping at epoch 750. Best Metrics: (0.03573533202762033, 0.004531448857927524, 0.01724182441297501)
2026-06-14 06:12:36,093 - optuna.study.study - INFO - Trial 114 finished with values: [0.03573533202762033, 0.004531448857927524, 0.01724182441297501] and parameters: {'n_layers': 3, 'embedding_dim': 128, 'lr': 0.0011116819593430245, 'lambda_val': 0.004810529713319858, 'batch_size': 3120, 'optimizer': 'Adam'}.
2026-06-14 06:13:26,401 - experiment_functions - INFO - Early stopping at epoch 1150. Best Metrics: (0.0808218572326835, 0.010144684841583495, 0.04190090281418851)
2026-06-14 06:13:26,486 - optuna.study.study - INFO - Trial 115 finished with values: [0.0808218572326835, 0.010144684841583495, 0.04190090281418851] and parameters: {'n_layers': 1, 'embedding_dim': 128, 'lr': 0.0011116819593430245, 'lambda_val': 0.0003071461412000055, 'batch_size': 3120, 'optimizer': 'RMSprop'}.
2026-06-14 06:16:36,179 - optuna.study.study - INFO - Trial 116 finished with values: [0.03761403693227828, 0.004266863152254003, 0.016740470206129374] and parameters: {'n_layers': 3, 'embedding_dim': 128, 'lr': 0.00507161575917476, 'lambda_val': 9.92028588022513e-06, 'batch_size': 1400, 'optimizer': 'Adam'}.
2026-06-14 06:17:03,517 - experiment_functions - INFO - Early stopping at epoch 550. Best Metrics: (0.06089894716592698, 0.007125393529372363, 0.029965842991644454)
2026-06-14 06:17:03,885 - optuna.study.study - INFO - Trial 117 finished with values: [0.06089894716592698, 0.007125393529372363, 0.029965842991644454] and parameters: {'n_layers': 1, 'embedding_dim': 256, 'lr': 0.013849452305144725, 'lambda_val': 0.0003071461412000055, 'batch_size': 3438, 'optimizer': 'Adam'}.
2026-06-14 06:17:50,640 - experiment_functions - INFO - Early stopping at epoch 1150. Best Metrics: (0.04496265446876026, 0.00576060017415768, 0.02244930008272473)
2026-06-14 06:17:50,735 - optuna.study.study - INFO - Trial 118 finished with values: [0.04496265446876026, 0.00576060017415768, 0.02244930008272473] and parameters: {'n_layers': 3, 'embedding_dim': 32, 'lr': 0.0008197571059817735, 'lambda_val': 0.0012360905541564393, 'batch_size': 3438, 'optimizer': 'Adam'}.
2026-06-14 06:20:30,998 - experiment_functions - INFO - Early stopping at epoch 3700. Best Metrics: (0.009841888336705453, 0.0014267532989483557, 0.00447852121993063)
2026-06-14 06:20:31,088 - optuna.study.study - INFO - Trial 119 finished with values: [0.009841888336705453, 0.0014267532989483557, 0.00447852121993063] and parameters: {'n_layers': 3, 'embedding_dim': 96, 'lr': 0.0008197571059817735, 'lambda_val': 0.0582428198563078, 'batch_size': 792, 'optimizer': 'Adam'}.
2026-06-14 06:23:42,640 - experiment_functions - INFO - Early stopping at epoch 3000. Best Metrics: (0.04109118354471418, 0.004769241074418917, 0.01912076421591962)
2026-06-14 06:23:42,751 - optuna.study.study - INFO - Trial 120 finished with values: [0.04109118354471418, 0.004769241074418917, 0.01912076421591962] and parameters: {'n_layers': 4, 'embedding_dim': 256, 'lr': 0.002859888100455546, 'lambda_val': 2.2885624961089243e-05, 'batch_size': 1504, 'optimizer': 'RMSprop'}.
2026-06-14 06:26:49,515 - optuna.study.study - INFO - Trial 121 finished with values: [0.10064094957263411, 0.012577868577935561, 0.055132988942239634] and parameters: {'n_layers': 1, 'embedding_dim': 256, 'lr': 0.0007333136681919207, 'lambda_val': 4.898157643229756e-06, 'batch_size': 2132, 'optimizer': 'RMSprop'}.
2026-06-14 06:29:57,998 - optuna.study.study - INFO - Trial 122 finished with values: [0.10150874219156102, 0.01269843927925514, 0.05565671418349348] and parameters: {'n_layers': 1, 'embedding_dim': 256, 'lr': 0.0009554934943534302, 'lambda_val': 1.547696085959405e-05, 'batch_size': 1995, 'optimizer': 'Adam'}.
2026-06-14 06:30:50,687 - experiment_functions - INFO - Early stopping at epoch 1300. Best Metrics: (0.043981348302295005, 0.005269944403509948, 0.020866240728401698)
2026-06-14 06:30:50,774 - optuna.study.study - INFO - Trial 123 finished with values: [0.043981348302295005, 0.005269944403509948, 0.020866240728401698] and parameters: {'n_layers': 3, 'embedding_dim': 32, 'lr': 0.002252910187430102, 'lambda_val': 5.308270759214878e-05, 'batch_size': 3621, 'optimizer': 'Adam'}.
2026-06-14 06:31:17,057 - experiment_functions - INFO - Early stopping at epoch 550. Best Metrics: (0.025005425126351077, 0.0031231160827918814, 0.012069316487464172)
2026-06-14 06:31:17,313 - optuna.study.study - INFO - Trial 124 finished with values: [0.025005425126351077, 0.0031231160827918814, 0.012069316487464172] and parameters: {'n_layers': 3, 'embedding_dim': 96, 'lr': 0.006087078582523996, 'lambda_val': 0.0015912107748891956, 'batch_size': 2682, 'optimizer': 'RMSprop'}.
2026-06-14 06:32:22,680 - experiment_functions - INFO - Early stopping at epoch 1350. Best Metrics: (0.05199354710981688, 0.006581150780360373, 0.025720619893111633)
2026-06-14 06:32:22,771 - optuna.study.study - INFO - Trial 125 finished with values: [0.05199354710981688, 0.006581150780360373, 0.025720619893111633] and parameters: {'n_layers': 3, 'embedding_dim': 128, 'lr': 0.0011116819593430245, 'lambda_val': 0.00014895795346764513, 'batch_size': 1995, 'optimizer': 'Adam'}.
2026-06-14 06:32:54,930 - experiment_functions - INFO - Early stopping at epoch 750. Best Metrics: (0.07103892743460875, 0.009227007837095586, 0.037540131460978884)
2026-06-14 06:32:55,004 - optuna.study.study - INFO - Trial 126 finished with values: [0.07103892743460875, 0.009227007837095586, 0.037540131460978884] and parameters: {'n_layers': 1, 'embedding_dim': 96, 'lr': 0.0020642799008971833, 'lambda_val': 0.003887569304557066, 'batch_size': 4002, 'optimizer': 'Adam'}.
2026-06-14 06:35:42,153 - optuna.study.study - INFO - Trial 127 finished with values: [0.04876435416626851, 0.00601346372831402, 0.023871082670140344] and parameters: {'n_layers': 3, 'embedding_dim': 64, 'lr': 0.0011116819593430245, 'lambda_val': 8.049701828088752e-06, 'batch_size': 1912, 'optimizer': 'RMSprop'}.
2026-06-14 06:36:10,917 - experiment_functions - INFO - Early stopping at epoch 650. Best Metrics: (0.0864824476978345, 0.010665483287561122, 0.045448432676082305)
2026-06-14 06:36:10,997 - optuna.study.study - INFO - Trial 128 finished with values: [0.0864824476978345, 0.010665483287561122, 0.045448432676082305] and parameters: {'n_layers': 1, 'embedding_dim': 96, 'lr': 0.00486276978616333, 'lambda_val': 0.0001364070822934131, 'batch_size': 3686, 'optimizer': 'Adam'}.
2026-06-14 06:38:43,129 - optuna.study.study - INFO - Trial 129 finished with values: [0.03678887101983147, 0.005340277312613035, 0.021199740253913975] and parameters: {'n_layers': 1, 'embedding_dim': 64, 'lr': 0.0004540666822812583, 'lambda_val': 1.2706648887332428e-06, 'batch_size': 1326, 'optimizer': 'Adam'}.
2026-06-14 06:41:36,431 - optuna.study.study - INFO - Trial 130 finished with values: [0.052173327675877804, 0.006542635139661062, 0.025611822970238656] and parameters: {'n_layers': 3, 'embedding_dim': 64, 'lr': 0.0007333136681919207, 'lambda_val': 8.049701828088752e-06, 'batch_size': 2132, 'optimizer': 'RMSprop'}.
2026-06-14 06:42:56,316 - experiment_functions - INFO - Early stopping at epoch 1950. Best Metrics: (0.010852680780697932, 0.0017683702860204972, 0.005374936474730778)
