2026-06-15 05:56:55,361 - optuna.study.study - INFO - Trial 141 finished with values: [0.0005144799297397591, 7.53566883247371e-05, 0.0002554830663374787] and parameters: {'n_layers': 2, 'embedding_dim': 128, 'lr': 0.0013399936052392054, 'lambda_val': 4.1441541348192956e-05, 'batch_size': 3067, 'optimizer': 'SGD'}.
2026-06-15 05:59:41,900 - optuna.study.study - INFO - Trial 142 finished with values: [0.04743618034533352, 0.005973273494540827, 0.025317407184021368] and parameters: {'n_layers': 4, 'embedding_dim': 32, 'lr': 0.00042036659412149157, 'lambda_val': 4.057584482779664e-06, 'batch_size': 1066, 'optimizer': 'Adam'}.
2026-06-15 06:02:19,103 - optuna.study.study - INFO - Trial 143 finished with values: [0.021913608934879484, 0.002959005961551343, 0.0107887467561146] and parameters: {'n_layers': 3, 'embedding_dim': 32, 'lr': 0.00042036659412149157, 'lambda_val': 0.01679036251486879, 'batch_size': 1198, 'optimizer': 'RMSprop'}.
2026-06-15 06:02:45,184 - experiment_functions - INFO - Early stopping at epoch 500. Best Metrics: (0.0004506714115380594, 7.535668832473711e-05, 0.0002253880190663111)
2026-06-15 06:02:45,262 - optuna.study.study - INFO - Trial 144 finished with values: [0.0004506714115380594, 7.535668832473711e-05, 0.0002253880190663111] and parameters: {'n_layers': 4, 'embedding_dim': 128, 'lr': 0.022737198852545427, 'lambda_val': 0.01679036251486879, 'batch_size': 3633, 'optimizer': 'SGD'}.
2026-06-15 06:05:15,376 - experiment_functions - INFO - Early stopping at epoch 3350. Best Metrics: (0.040101099568817286, 0.004690535199946413, 0.018635597850515564)
2026-06-15 06:05:15,457 - optuna.study.study - INFO - Trial 145 finished with values: [0.040101099568817286, 0.004690535199946413, 0.018635597850515564] and parameters: {'n_layers': 3, 'embedding_dim': 96, 'lr': 0.002403322646261187, 'lambda_val': 1.2492162876084175e-05, 'batch_size': 1126, 'optimizer': 'RMSprop'}.
2026-06-15 06:07:49,592 - experiment_functions - INFO - Early stopping at epoch 2400. Best Metrics: (0.05781925405673132, 0.007045013061825976, 0.028042302702782993)
2026-06-15 06:07:49,698 - optuna.study.study - INFO - Trial 146 finished with values: [0.05781925405673132, 0.007045013061825976, 0.028042302702782993] and parameters: {'n_layers': 4, 'embedding_dim': 256, 'lr': 0.00035751122245203187, 'lambda_val': 0.0003193434431604667, 'batch_size': 3700, 'optimizer': 'Adam'}.
2026-06-15 06:10:34,182 - optuna.study.study - INFO - Trial 147 finished with values: [0.04553201796397254, 0.005767298546453212, 0.02252981100707041] and parameters: {'n_layers': 4, 'embedding_dim': 32, 'lr': 0.00035751122245203187, 'lambda_val': 0.0003193434431604667, 'batch_size': 1634, 'optimizer': 'Adam'}.
2026-06-15 06:13:44,953 - optuna.study.study - INFO - Trial 148 finished with values: [0.05042297432607918, 0.0055696965637350125, 0.023864945445973715] and parameters: {'n_layers': 3, 'embedding_dim': 128, 'lr': 0.017221400491445694, 'lambda_val': 5.463576743491646e-06, 'batch_size': 1491, 'optimizer': 'RMSprop'}.
2026-06-15 06:14:13,421 - experiment_functions - INFO - Early stopping at epoch 650. Best Metrics: (0.04169115045359134, 0.005395538884051176, 0.019326734490851868)
2026-06-15 06:14:13,502 - optuna.study.study - INFO - Trial 149 finished with values: [0.04169115045359134, 0.005395538884051176, 0.019326734490851868] and parameters: {'n_layers': 1, 'embedding_dim': 96, 'lr': 0.002403322646261187, 'lambda_val': 0.022611772499362814, 'batch_size': 4084, 'optimizer': 'RMSprop'}.
2026-06-15 06:18:08,361 - optuna.study.study - INFO - Trial 150 finished with values: [0.07429998917206497, 0.009136579811105902, 0.038475909631238016] and parameters: {'n_layers': 3, 'embedding_dim': 256, 'lr': 0.00035751122245203187, 'lambda_val': 0.0003193434431604667, 'batch_size': 2538, 'optimizer': 'Adam'}.
2026-06-15 06:20:59,582 - optuna.study.study - INFO - Trial 151 finished with values: [0.09618767248413015, 0.011901332976086811, 0.052153869321929225] and parameters: {'n_layers': 1, 'embedding_dim': 128, 'lr': 0.0013399936052392054, 'lambda_val': 1.2492162876084175e-05, 'batch_size': 1126, 'optimizer': 'RMSprop'}.
2026-06-15 06:23:23,426 - experiment_functions - INFO - Early stopping at epoch 2250. Best Metrics: (0.054921088797581084, 0.00687085538214214, 0.02620509909514043)
2026-06-15 06:23:23,526 - optuna.study.study - INFO - Trial 152 finished with values: [0.054921088797581084, 0.00687085538214214, 0.02620509909514043] and parameters: {'n_layers': 4, 'embedding_dim': 256, 'lr': 0.00035751122245203187, 'lambda_val': 0.0003193434431604667, 'batch_size': 3996, 'optimizer': 'Adam'}.
2026-06-15 06:23:48,156 - experiment_functions - INFO - Early stopping at epoch 500. Best Metrics: (0.0008447277578158006, 9.880099135909974e-05, 0.00038320459549307363)
2026-06-15 06:23:48,233 - optuna.study.study - INFO - Trial 153 finished with values: [0.0008447277578158006, 9.880099135909974e-05, 0.00038320459549307363] and parameters: {'n_layers': 3, 'embedding_dim': 128, 'lr': 0.002403322646261187, 'lambda_val': 1.722502032465723e-05, 'batch_size': 1242, 'optimizer': 'SGD'}.
2026-06-15 06:24:29,440 - experiment_functions - INFO - Early stopping at epoch 950. Best Metrics: (0.09124477149613372, 0.011263313014937371, 0.04839888997955024)
2026-06-15 06:24:29,519 - optuna.study.study - INFO - Trial 154 finished with values: [0.09124477149613372, 0.011263313014937371, 0.04839888997955024] and parameters: {'n_layers': 1, 'embedding_dim': 96, 'lr': 0.0031668054510016214, 'lambda_val': 1.722502032465723e-05, 'batch_size': 2150, 'optimizer': 'Adam'}.
2026-06-15 06:27:39,386 - experiment_functions - INFO - Early stopping at epoch 3800. Best Metrics: (0.027644899421590097, 0.0030963225936097532, 0.012113217064146269)
2026-06-15 06:27:39,491 - optuna.study.study - INFO - Trial 155 finished with values: [0.027644899421590097, 0.0030963225936097532, 0.012113217064146269] and parameters: {'n_layers': 4, 'embedding_dim': 128, 'lr': 0.005766446672619561, 'lambda_val': 0.0003193434431604667, 'batch_size': 1634, 'optimizer': 'Adam'}.
2026-06-15 06:28:24,390 - experiment_functions - INFO - Early stopping at epoch 1000. Best Metrics: (0.09431984162374583, 0.011584834885122915, 0.050638257109178235)
2026-06-15 06:28:24,475 - optuna.study.study - INFO - Trial 156 finished with values: [0.09431984162374583, 0.011584834885122915, 0.050638257109178235] and parameters: {'n_layers': 1, 'embedding_dim': 128, 'lr': 0.002403322646261187, 'lambda_val': 0.0003193434431604667, 'batch_size': 2538, 'optimizer': 'Adam'}.
2026-06-15 06:30:20,552 - experiment_functions - INFO - Early stopping at epoch 2700. Best Metrics: (0.09001639349005591, 0.011311876214079978, 0.047365750493899746)
2026-06-15 06:30:20,624 - optuna.study.study - INFO - Trial 157 finished with values: [0.09001639349005591, 0.011311876214079978, 0.047365750493899746] and parameters: {'n_layers': 1, 'embedding_dim': 128, 'lr': 0.0013635493562820199, 'lambda_val': 0.0016135144594650256, 'batch_size': 1243, 'optimizer': 'Adam'}.
2026-06-15 06:33:03,150 - optuna.study.study - INFO - Trial 158 finished with values: [0.08721393620825311, 0.010484627235581754, 0.04553129557391013] and parameters: {'n_layers': 1, 'embedding_dim': 64, 'lr': 0.002403322646261187, 'lambda_val': 1.2492162876084175e-05, 'batch_size': 1126, 'optimizer': 'RMSprop'}.
2026-06-15 06:33:45,988 - experiment_functions - INFO - Early stopping at epoch 950. Best Metrics: (0.09020580236542815, 0.011045615915332575, 0.04756921041203969)
2026-06-15 06:33:46,073 - optuna.study.study - INFO - Trial 159 finished with values: [0.09020580236542815, 0.011045615915332575, 0.04756921041203969] and parameters: {'n_layers': 1, 'embedding_dim': 128, 'lr': 0.0019049517999197474, 'lambda_val': 1.2492162876084175e-05, 'batch_size': 3123, 'optimizer': 'RMSprop'}.
2026-06-15 06:36:46,245 - optuna.study.study - INFO - Trial 160 finished with values: [0.04828842422713611, 0.005256547658918883, 0.022425405304723662] and parameters: {'n_layers': 3, 'embedding_dim': 96, 'lr': 0.017221400491445694, 'lambda_val': 3.385899724058381e-05, 'batch_size': 1491, 'optimizer': 'RMSprop'}.
2026-06-15 06:37:16,412 - experiment_functions - INFO - Early stopping at epoch 650. Best Metrics: (0.05656168635831108, 0.007111996784781297, 0.02750369050550844)
2026-06-15 06:37:16,885 - optuna.study.study - INFO - Trial 161 finished with values: [0.05656168635831108, 0.007111996784781297, 0.02750369050550844] and parameters: {'n_layers': 2, 'embedding_dim': 96, 'lr': 0.0034561838290846068, 'lambda_val': 0.00017872476351520094, 'batch_size': 1542, 'optimizer': 'Adam'}.
2026-06-15 06:38:36,057 - experiment_functions - INFO - Early stopping at epoch 1800. Best Metrics: (0.09620048953903974, 0.011656842387299887, 0.049940546281706695)
2026-06-15 06:38:36,667 - optuna.study.study - INFO - Trial 162 finished with values: [0.09620048953903974, 0.011656842387299887, 0.049940546281706695] and parameters: {'n_layers': 1, 'embedding_dim': 128, 'lr': 0.0013635493562820199, 'lambda_val': 0.00036402541279450417, 'batch_size': 2519, 'optimizer': 'RMSprop'}.
2026-06-15 06:38:57,318 - experiment_functions - INFO - Early stopping at epoch 500. Best Metrics: (0.00040234904841151295, 7.368209525085404e-05, 0.00022124945045854462)
2026-06-15 06:38:57,401 - optuna.study.study - INFO - Trial 163 finished with values: [0.00040234904841151295, 7.368209525085404e-05, 0.00022124945045854462] and parameters: {'n_layers': 1, 'embedding_dim': 32, 'lr': 0.031442699929852456, 'lambda_val': 0.0031681454953806907, 'batch_size': 1491, 'optimizer': 'SGD'}.
2026-06-15 06:39:47,421 - experiment_functions - INFO - Early stopping at epoch 1000. Best Metrics: (0.09457960539929047, 0.011492732266059347, 0.05094163621549326)
2026-06-15 06:39:47,499 - optuna.study.study - INFO - Trial 164 finished with values: [0.09457960539929047, 0.011492732266059347, 0.05094163621549326] and parameters: {'n_layers': 1, 'embedding_dim': 256, 'lr': 0.002500554323958941, 'lambda_val': 0.00010936849207517709, 'batch_size': 3067, 'optimizer': 'Adam'}.
2026-06-15 06:42:56,674 - optuna.study.study - INFO - Trial 165 finished with values: [0.04234747517935808, 0.005074017013865631, 0.02007655110664895] and parameters: {'n_layers': 3, 'embedding_dim': 128, 'lr': 0.0016748417327479524, 'lambda_val': 3.385899724058381e-05, 'batch_size': 1243, 'optimizer': 'RMSprop'}.
2026-06-15 06:43:52,345 - experiment_functions - INFO - Early stopping at epoch 1250. Best Metrics: (0.06670990611936362, 0.008012927858530377, 0.033594051328420776)
2026-06-15 06:43:52,438 - optuna.study.study - INFO - Trial 166 finished with values: [0.06670990611936362, 0.008012927858530377, 0.033594051328420776] and parameters: {'n_layers': 2, 'embedding_dim': 96, 'lr': 0.001230678069228945, 'lambda_val': 1.2492162876084175e-05, 'batch_size': 3289, 'optimizer': 'RMSprop'}.
2026-06-15 06:47:49,799 - experiment_functions - INFO - Early stopping at epoch 3900. Best Metrics: (0.0007014852859836784, 0.00010215017750686583, 0.0003460289385790486)
2026-06-15 06:47:49,873 - optuna.study.study - INFO - Trial 167 finished with values: [0.0007014852859836784, 0.00010215017750686583, 0.0003460289385790486] and parameters: {'n_layers': 4, 'embedding_dim': 256, 'lr': 2.6997866128530156e-05, 'lambda_val': 3.385899724058381e-05, 'batch_size': 1243, 'optimizer': 'RMSprop'}.
2026-06-15 06:48:11,602 - experiment_functions - INFO - Early stopping at epoch 500. Best Metrics: (0.00028706509063707074, 5.861075758590662e-05, 0.00013740661605014971)
2026-06-15 06:48:11,687 - optuna.study.study - INFO - Trial 168 finished with values: [0.00028706509063707074, 5.861075758590662e-05, 0.00013740661605014971] and parameters: {'n_layers': 1, 'embedding_dim': 128, 'lr': 0.0013635493562820199, 'lambda_val': 1.722502032465723e-05, 'batch_size': 1670, 'optimizer': 'SGD'}.
2026-06-15 06:49:01,762 - experiment_functions - INFO - Early stopping at epoch 1150. Best Metrics: (0.08316191261650406, 0.010407595954183134, 0.043716166143950304)
2026-06-15 06:49:02,259 - optuna.study.study - INFO - Trial 169 finished with values: [0.08316191261650406, 0.010407595954183134, 0.043716166143950304] and parameters: {'n_layers': 1, 'embedding_dim': 128, 'lr': 0.0013399936052392054, 'lambda_val': 0.0020014727227486086, 'batch_size': 2363, 'optimizer': 'RMSprop'}.
2026-06-15 06:51:36,214 - experiment_functions - INFO - Early stopping at epoch 3600. Best Metrics: (0.10177612550175409, 0.012348449326813584, 0.05502132629350016)
2026-06-15 06:51:36,373 - optuna.study.study - INFO - Trial 170 finished with values: [0.10177612550175409, 0.012348449326813584, 0.05502132629350016] and parameters: {'n_layers': 1, 'embedding_dim': 128, 'lr': 0.0013399936052392054, 'lambda_val': 5.271398387722209e-05, 'batch_size': 1760, 'optimizer': 'RMSprop'}.
2026-06-15 06:52:16,424 - experiment_functions - INFO - Early stopping at epoch 900. Best Metrics: (0.09143662890557229, 0.011201353071203696, 0.04773982314776509)
2026-06-15 06:52:16,775 - optuna.study.study - INFO - Trial 171 finished with values: [0.09143662890557229, 0.011201353071203696, 0.04773982314776509] and parameters: {'n_layers': 1, 'embedding_dim': 128, 'lr': 0.0031668054510016214, 'lambda_val': 1.722502032465723e-05, 'batch_size': 2363, 'optimizer': 'Adam'}.
2026-06-15 06:53:32,563 - experiment_functions - INFO - Early stopping at epoch 1300. Best Metrics: (0.04320103875706219, 0.004986938174023713, 0.019781642644511467)
2026-06-15 06:53:32,642 - optuna.study.study - INFO - Trial 172 finished with values: [0.04320103875706219, 0.004986938174023713, 0.019781642644511467] and parameters: {'n_layers': 3, 'embedding_dim': 256, 'lr': 0.002500554323958941, 'lambda_val': 0.00010936849207517709, 'batch_size': 1670, 'optimizer': 'Adam'}.
2026-06-15 06:54:18,878 - experiment_functions - INFO - Early stopping at epoch 950. Best Metrics: (0.03487880370747586, 0.004255141000736822, 0.016213690905934237)
2026-06-15 06:54:18,956 - optuna.study.study - INFO - Trial 173 finished with values: [0.03487880370747586, 0.004255141000736822, 0.016213690905934237] and parameters: {'n_layers': 3, 'embedding_dim': 128, 'lr': 0.0013399936052392054, 'lambda_val': 0.0020014727227486086, 'batch_size': 2519, 'optimizer': 'RMSprop'}.
2026-06-15 06:54:59,304 - experiment_functions - INFO - Early stopping at epoch 900. Best Metrics: (0.094353329863913, 0.011363788599370353, 0.050081336903860296)
2026-06-15 06:54:59,389 - optuna.study.study - INFO - Trial 174 finished with values: [0.094353329863913, 0.011363788599370353, 0.050081336903860296] and parameters: {'n_layers': 1, 'embedding_dim': 128, 'lr': 0.0031668054510016214, 'lambda_val': 4.768107725372831e-05, 'batch_size': 3062, 'optimizer': 'Adam'}.
2026-06-15 06:55:20,631 - experiment_functions - INFO - Early stopping at epoch 500. Best Metrics: (0.00037895863810378063, 6.363453680755577e-05, 0.0001839436053352245)
2026-06-15 06:55:20,711 - optuna.study.study - INFO - Trial 175 finished with values: [0.00037895863810378063, 6.363453680755577e-05, 0.0001839436053352245] and parameters: {'n_layers': 1, 'embedding_dim': 96, 'lr': 0.0034561838290846068, 'lambda_val': 3.730092649254184e-05, 'batch_size': 2304, 'optimizer': 'SGD'}.
2026-06-15 06:58:17,989 - optuna.study.study - INFO - Trial 176 finished with values: [0.05160926983013878, 0.005944805412284816, 0.024295484151874998] and parameters: {'n_layers': 2, 'embedding_dim': 128, 'lr': 0.002500554323958941, 'lambda_val': 4.768107725372831e-05, 'batch_size': 2756, 'optimizer': 'RMSprop'}.
2026-06-15 06:59:15,761 - experiment_functions - INFO - Early stopping at epoch 1150. Best Metrics: (0.012575040288457667, 0.0015222051041596893, 0.005549112713236262)
2026-06-15 06:59:15,850 - optuna.study.study - INFO - Trial 177 finished with values: [0.012575040288457667, 0.0015222051041596893, 0.005549112713236262] and parameters: {'n_layers': 4, 'embedding_dim': 128, 'lr': 0.0016748417327479524, 'lambda_val': 0.021146639636361562, 'batch_size': 2519, 'optimizer': 'RMSprop'}.
2026-06-15 07:00:22,775 - experiment_functions - INFO - Early stopping at epoch 1600. Best Metrics: (0.08227411939909383, 0.01020664478531717, 0.04257578987033483)
2026-06-15 07:00:22,851 - optuna.study.study - INFO - Trial 178 finished with values: [0.08227411939909383, 0.01020664478531717, 0.04257578987033483] and parameters: {'n_layers': 1, 'embedding_dim': 96, 'lr': 0.0013399936052392054, 'lambda_val': 0.0020014727227486086, 'batch_size': 1670, 'optimizer': 'RMSprop'}.
2026-06-15 07:01:07,156 - experiment_functions - INFO - Early stopping at epoch 1000. Best Metrics: (0.0917671722744333, 0.011162837430504386, 0.04794108776557637)
2026-06-15 07:01:07,233 - optuna.study.study - INFO - Trial 179 finished with values: [0.0917671722744333, 0.011162837430504386, 0.04794108776557637] and parameters: {'n_layers': 1, 'embedding_dim': 128, 'lr': 0.002403322646261187, 'lambda_val': 0.0003193434431604667, 'batch_size': 2538, 'optimizer': 'Adam'}.
2026-06-15 07:01:48,201 - experiment_functions - INFO - Early stopping at epoch 1000. Best Metrics: (0.09007226969630286, 0.011027195391519862, 0.04902486634586659)
2026-06-15 07:01:48,461 - optuna.study.study - INFO - Trial 180 finished with values: [0.09007226969630286, 0.011027195391519862, 0.04902486634586659] and parameters: {'n_layers': 1, 'embedding_dim': 32, 'lr': 0.0031668054510016214, 'lambda_val': 1.722502032465723e-05, 'batch_size': 3700, 'optimizer': 'Adam'}.
2026-06-15 07:04:07,950 - experiment_functions - INFO - Early stopping at epoch 2800. Best Metrics: (0.031776222366788474, 0.003858262442226539, 0.014844489336534785)
2026-06-15 07:04:08,262 - optuna.study.study - INFO - Trial 181 finished with values: [0.031776222366788474, 0.003858262442226539, 0.014844489336534785] and parameters: {'n_layers': 4, 'embedding_dim': 128, 'lr': 0.0016748417327479524, 'lambda_val': 0.00036402541279450417, 'batch_size': 1243, 'optimizer': 'RMSprop'}.
2026-06-15 07:04:50,998 - experiment_functions - INFO - Early stopping at epoch 900. Best Metrics: (0.07308490537913569, 0.00900931073749079, 0.038023174627312646)
2026-06-15 07:04:51,109 - optuna.study.study - INFO - Trial 182 finished with values: [0.07308490537913569, 0.00900931073749079, 0.038023174627312646] and parameters: {'n_layers': 2, 'embedding_dim': 128, 'lr': 0.0016188619661959155, 'lambda_val': 5.463576743491646e-06, 'batch_size': 1491, 'optimizer': 'Adam'}.
2026-06-15 07:07:22,545 - optuna.study.study - INFO - Trial 183 finished with values: [0.00499926286684625, 0.0009076294460446113, 0.003043184170452843] and parameters: {'n_layers': 1, 'embedding_dim': 64, 'lr': 0.00042036659412149157, 'lambda_val': 4.057584482779664e-06, 'batch_size': 1066, 'optimizer': 'RMSprop'}.
2026-06-15 07:10:13,864 - optuna.study.study - INFO - Trial 184 finished with values: [0.09666410597793955, 0.011903007569160694, 0.052320151543084] and parameters: {'n_layers': 1, 'embedding_dim': 128, 'lr': 0.0013635493562820199, 'lambda_val': 1.722502032465723e-05, 'batch_size': 1126, 'optimizer': 'RMSprop'}.
2026-06-15 07:12:54,852 - optuna.study.study - INFO - Trial 185 finished with values: [0.04213644405723897, 0.005504387433853574, 0.022667640554399657] and parameters: {'n_layers': 4, 'embedding_dim': 32, 'lr': 0.00035751122245203187, 'lambda_val': 0.0003193434431604667, 'batch_size': 1634, 'optimizer': 'RMSprop'}.
2026-06-15 07:13:34,452 - experiment_functions - INFO - Early stopping at epoch 800. Best Metrics: (0.08451922708393408, 0.010045883850224396, 0.04309264898348872)
2026-06-15 07:13:34,534 - optuna.study.study - INFO - Trial 186 finished with values: [0.08451922708393408, 0.010045883850224396, 0.04309264898348872] and parameters: {'n_layers': 1, 'embedding_dim': 256, 'lr': 0.002403322646261187, 'lambda_val': 1.2492162876084175e-05, 'batch_size': 4084, 'optimizer': 'RMSprop'}.
2026-06-15 07:14:25,753 - experiment_functions - INFO - Early stopping at epoch 1150. Best Metrics: (0.07023264252543347, 0.00850358362917811, 0.034949993143885465)
2026-06-15 07:14:25,837 - optuna.study.study - INFO - Trial 187 finished with values: [0.07023264252543347, 0.00850358362917811, 0.034949993143885465] and parameters: {'n_layers': 2, 'embedding_dim': 96, 'lr': 0.001230678069228945, 'lambda_val': 1.2492162876084175e-05, 'batch_size': 4032, 'optimizer': 'RMSprop'}.
2026-06-15 07:15:37,658 - experiment_functions - INFO - Early stopping at epoch 1650. Best Metrics: (0.09310091842386835, 0.011377185343961418, 0.05048510082791114)
2026-06-15 07:15:37,727 - optuna.study.study - INFO - Trial 188 finished with values: [0.09310091842386835, 0.011377185343961418, 0.05048510082791114] and parameters: {'n_layers': 1, 'embedding_dim': 128, 'lr': 0.002403322646261187, 'lambda_val': 1.722502032465723e-05, 'batch_size': 1137, 'optimizer': 'Adam'}.
2026-06-15 07:16:05,186 - experiment_functions - INFO - Early stopping at epoch 600. Best Metrics: (0.05003758992595348, 0.006323263446982383, 0.02496658470430958)
2026-06-15 07:16:05,276 - optuna.study.study - INFO - Trial 189 finished with values: [0.05003758992595348, 0.006323263446982383, 0.02496658470430958] and parameters: {'n_layers': 3, 'embedding_dim': 64, 'lr': 0.0031668054510016214, 'lambda_val': 1.722502032465723e-05, 'batch_size': 3757, 'optimizer': 'Adam'}.
2026-06-15 07:16:52,815 - experiment_functions - INFO - Early stopping at epoch 1050. Best Metrics: (0.07980218081290712, 0.009690870118561191, 0.0417613039017731)
2026-06-15 07:16:52,888 - optuna.study.study - INFO - Trial 190 finished with values: [0.07980218081290712, 0.009690870118561191, 0.0417613039017731] and parameters: {'n_layers': 2, 'embedding_dim': 96, 'lr': 0.001230678069228945, 'lambda_val': 1.2492162876084175e-05, 'batch_size': 3062, 'optimizer': 'Adam'}.
