2026-06-14 22:14:52,631 - optuna.study.study - INFO - Trial 140 finished with values: [0.07454133041615311, 0.009022707482081855, 0.04051570862018409] and parameters: {'n_layers': 3, 'embedding_dim': 128, 'lr': 0.0003794262448571181, 'lambda_val': 1.6750135096134514e-06, 'batch_size': 2743, 'optimizer': 'RMSprop'}.
2026-06-14 22:18:08,706 - optuna.study.study - INFO - Trial 141 finished with values: [0.05406204909138616, 0.006890950499028736, 0.027981106307468116] and parameters: {'n_layers': 4, 'embedding_dim': 128, 'lr': 0.00027993554408544926, 'lambda_val': 7.390761978888471e-05, 'batch_size': 1409, 'optimizer': 'Adam'}.
2026-06-14 22:18:37,021 - experiment_functions - INFO - Early stopping at epoch 550. Best Metrics: (0.009540849767965227, 0.0010549936365463193, 0.004754600913491173)
2026-06-14 22:18:37,096 - optuna.study.study - INFO - Trial 142 finished with values: [0.009540849767965227, 0.0010549936365463193, 0.004754600913491173] and parameters: {'n_layers': 4, 'embedding_dim': 128, 'lr': 0.060031242291035895, 'lambda_val': 0.026756644971296456, 'batch_size': 1686, 'optimizer': 'Adam'}.
2026-06-14 22:21:17,160 - experiment_functions - INFO - Early stopping at epoch 3500. Best Metrics: (0.04226606921188238, 0.00455154397481412, 0.019455183625290303)
2026-06-14 22:21:17,228 - optuna.study.study - INFO - Trial 143 finished with values: [0.04226606921188238, 0.00455154397481412, 0.019455183625290303] and parameters: {'n_layers': 4, 'embedding_dim': 96, 'lr': 0.017176020213444436, 'lambda_val': 0.00012073664489097666, 'batch_size': 3910, 'optimizer': 'RMSprop'}.
2026-06-14 22:24:20,611 - optuna.study.study - INFO - Trial 144 finished with values: [0.03620728298792883, 0.004107776810235113, 0.016392689330147012] and parameters: {'n_layers': 3, 'embedding_dim': 128, 'lr': 0.0029187572679997753, 'lambda_val': 0.00020614378723959702, 'batch_size': 1086, 'optimizer': 'Adam'}.
2026-06-14 22:27:42,351 - optuna.study.study - INFO - Trial 145 finished with values: [0.06576937004739633, 0.008587313282872261, 0.036821746531603326] and parameters: {'n_layers': 2, 'embedding_dim': 256, 'lr': 0.0003794262448571181, 'lambda_val': 1.0458611121108427e-05, 'batch_size': 953, 'optimizer': 'RMSprop'}.
2026-06-14 22:28:08,738 - experiment_functions - INFO - Early stopping at epoch 650. Best Metrics: (0.06501582785160434, 0.00830598164645991, 0.03510025659164668)
2026-06-14 22:28:08,810 - optuna.study.study - INFO - Trial 146 finished with values: [0.06501582785160434, 0.00830598164645991, 0.03510025659164668] and parameters: {'n_layers': 1, 'embedding_dim': 32, 'lr': 0.01005775655032132, 'lambda_val': 3.904381306216792e-06, 'batch_size': 1756, 'optimizer': 'Adam'}.
2026-06-14 22:31:12,334 - optuna.study.study - INFO - Trial 147 finished with values: [0.04792398476080698, 0.006331636412351799, 0.025258903813922637] and parameters: {'n_layers': 3, 'embedding_dim': 128, 'lr': 0.00018243297440383044, 'lambda_val': 1.017349376345002e-05, 'batch_size': 3741, 'optimizer': 'RMSprop'}.
2026-06-14 22:33:51,577 - optuna.study.study - INFO - Trial 148 finished with values: [0.05904724258267628, 0.00780527831736888, 0.032416985913561736] and parameters: {'n_layers': 2, 'embedding_dim': 64, 'lr': 0.00034626607309513543, 'lambda_val': 6.351942760483931e-05, 'batch_size': 3018, 'optimizer': 'RMSprop'}.
2026-06-14 22:34:18,664 - experiment_functions - INFO - Early stopping at epoch 550. Best Metrics: (0.02889320173490262, 0.0035920021434791356, 0.014117254371878751)
2026-06-14 22:34:18,790 - optuna.study.study - INFO - Trial 149 finished with values: [0.02889320173490262, 0.0035920021434791356, 0.014117254371878751] and parameters: {'n_layers': 3, 'embedding_dim': 128, 'lr': 0.017176020213444436, 'lambda_val': 0.00012073664489097666, 'batch_size': 1064, 'optimizer': 'Adam'}.
2026-06-14 22:36:59,444 - optuna.study.study - INFO - Trial 150 finished with values: [0.03519787079249635, 0.005559649005291715, 0.020726949452117404] and parameters: {'n_layers': 1, 'embedding_dim': 128, 'lr': 0.000567654585955759, 'lambda_val': 7.390761978888471e-05, 'batch_size': 1409, 'optimizer': 'Adam'}.
2026-06-14 22:37:43,471 - experiment_functions - INFO - Early stopping at epoch 1000. Best Metrics: (0.06868782000821018, 0.008175363386697033, 0.03357954093384141)
2026-06-14 22:37:44,518 - optuna.study.study - INFO - Trial 151 finished with values: [0.06868782000821018, 0.008175363386697033, 0.03357954093384141] and parameters: {'n_layers': 1, 'embedding_dim': 128, 'lr': 0.0029187572679997753, 'lambda_val': 0.0006316041432119808, 'batch_size': 1686, 'optimizer': 'RMSprop'}.
2026-06-14 22:41:04,511 - optuna.study.study - INFO - Trial 152 finished with values: [0.062923406883657, 0.007887333377989149, 0.03399050318732909] and parameters: {'n_layers': 4, 'embedding_dim': 128, 'lr': 0.00027993554408544926, 'lambda_val': 1.6750135096134514e-06, 'batch_size': 2207, 'optimizer': 'RMSprop'}.
2026-06-14 22:41:27,837 - experiment_functions - INFO - Early stopping at epoch 500. Best Metrics: (0.0005035704108521261, 7.703128139862015e-05, 0.0002146679585035573)
2026-06-14 22:41:27,932 - optuna.study.study - INFO - Trial 153 finished with values: [0.0005035704108521261, 7.703128139862015e-05, 0.0002146679585035573] and parameters: {'n_layers': 2, 'embedding_dim': 128, 'lr': 0.00125444020622911, 'lambda_val': 6.806830251349438e-05, 'batch_size': 1686, 'optimizer': 'SGD'}.
2026-06-14 22:42:03,603 - experiment_functions - INFO - Early stopping at epoch 800. Best Metrics: (0.04331600274472069, 0.005539553888405118, 0.021174160402525264)
2026-06-14 22:42:03,680 - optuna.study.study - INFO - Trial 154 finished with values: [0.04331600274472069, 0.005539553888405118, 0.021174160402525264] and parameters: {'n_layers': 2, 'embedding_dim': 96, 'lr': 0.0011776400704232174, 'lambda_val': 0.007062287449064174, 'batch_size': 3878, 'optimizer': 'RMSprop'}.
2026-06-14 22:42:39,784 - experiment_functions - INFO - Early stopping at epoch 750. Best Metrics: (0.037305863000870194, 0.0049467479402505185, 0.01766440708397694)
2026-06-14 22:42:39,936 - optuna.study.study - INFO - Trial 155 finished with values: [0.037305863000870194, 0.0049467479402505185, 0.01766440708397694] and parameters: {'n_layers': 1, 'embedding_dim': 256, 'lr': 0.0029187572679997753, 'lambda_val': 0.033225453617602554, 'batch_size': 2100, 'optimizer': 'Adam'}.
2026-06-14 22:44:25,321 - experiment_functions - INFO - Early stopping at epoch 2350. Best Metrics: (0.04876382520609412, 0.005918011923102688, 0.023428626125762245)
2026-06-14 22:44:25,413 - optuna.study.study - INFO - Trial 156 finished with values: [0.04876382520609412, 0.005918011923102688, 0.023428626125762245] and parameters: {'n_layers': 3, 'embedding_dim': 96, 'lr': 0.0012453044445403945, 'lambda_val': 3.904381306216792e-06, 'batch_size': 1756, 'optimizer': 'RMSprop'}.
2026-06-14 22:44:54,473 - experiment_functions - INFO - Early stopping at epoch 650. Best Metrics: (0.05359745194424856, 0.006540960546587179, 0.025897636674488096)
2026-06-14 22:44:54,538 - optuna.study.study - INFO - Trial 157 finished with values: [0.05359745194424856, 0.006540960546587179, 0.025897636674488096] and parameters: {'n_layers': 1, 'embedding_dim': 128, 'lr': 0.009686351331105899, 'lambda_val': 7.390761978888471e-05, 'batch_size': 1409, 'optimizer': 'Adam'}.
2026-06-14 22:45:23,343 - experiment_functions - INFO - Early stopping at epoch 650. Best Metrics: (0.06027719134402321, 0.007276106906021837, 0.029064114973505802)
2026-06-14 22:45:23,415 - optuna.study.study - INFO - Trial 158 finished with values: [0.06027719134402321, 0.007276106906021837, 0.029064114973505802] and parameters: {'n_layers': 1, 'embedding_dim': 128, 'lr': 0.01005775655032132, 'lambda_val': 0.00020614378723959702, 'batch_size': 1756, 'optimizer': 'Adam'}.
2026-06-14 22:48:40,658 - optuna.study.study - INFO - Trial 159 finished with values: [0.04281675245350608, 0.005641704065911984, 0.022507049699171194] and parameters: {'n_layers': 4, 'embedding_dim': 128, 'lr': 0.0001717695563766432, 'lambda_val': 7.390761978888471e-05, 'batch_size': 2743, 'optimizer': 'RMSprop'}.
2026-06-14 22:51:22,173 - optuna.study.study - INFO - Trial 160 finished with values: [0.029164514504638358, 0.004626900663138858, 0.0175483098938883] and parameters: {'n_layers': 1, 'embedding_dim': 128, 'lr': 0.00034626607309513543, 'lambda_val': 3.246247535060975e-06, 'batch_size': 3018, 'optimizer': 'RMSprop'}.
2026-06-14 22:51:47,901 - experiment_functions - INFO - Early stopping at epoch 550. Best Metrics: (0.02915757000964319, 0.003528367606671579, 0.013968117926511439)
2026-06-14 22:51:47,958 - optuna.study.study - INFO - Trial 161 finished with values: [0.02915757000964319, 0.003528367606671579, 0.013968117926511439] and parameters: {'n_layers': 2, 'embedding_dim': 128, 'lr': 0.06625429324262323, 'lambda_val': 0.00020576561233050602, 'batch_size': 678, 'optimizer': 'Adam'}.
2026-06-14 22:54:16,168 - experiment_functions - INFO - Early stopping at epoch 3200. Best Metrics: (0.03434630114639207, 0.004025721749614844, 0.015413276583862795)
2026-06-14 22:54:16,241 - optuna.study.study - INFO - Trial 162 finished with values: [0.03434630114639207, 0.004025721749614844, 0.015413276583862795] and parameters: {'n_layers': 4, 'embedding_dim': 96, 'lr': 0.0029187572679997753, 'lambda_val': 1.6750135096134514e-06, 'batch_size': 2141, 'optimizer': 'RMSprop'}.
2026-06-14 22:56:32,693 - experiment_functions - INFO - Early stopping at epoch 3050. Best Metrics: (0.04818349579895555, 0.00585940116551678, 0.02356163398633111)
2026-06-14 22:56:32,762 - optuna.study.study - INFO - Trial 163 finished with values: [0.04818349579895555, 0.00585940116551678, 0.02356163398633111] and parameters: {'n_layers': 3, 'embedding_dim': 96, 'lr': 0.0012453044445403945, 'lambda_val': 3.904381306216792e-06, 'batch_size': 1756, 'optimizer': 'RMSprop'}.
2026-06-14 22:59:41,626 - optuna.study.study - INFO - Trial 164 finished with values: [0.06283359079506315, 0.008001205707013195, 0.0353137668093415] and parameters: {'n_layers': 3, 'embedding_dim': 128, 'lr': 0.0003794262448571181, 'lambda_val': 1.6750135096134514e-06, 'batch_size': 776, 'optimizer': 'RMSprop'}.
2026-06-14 23:03:52,782 - optuna.study.study - INFO - Trial 165 finished with values: [0.0641520037100628, 0.007837095585772657, 0.03297224303113203] and parameters: {'n_layers': 4, 'embedding_dim': 256, 'lr': 0.0003794262448571181, 'lambda_val': 1.6750135096134514e-06, 'batch_size': 1708, 'optimizer': 'RMSprop'}.
2026-06-14 23:04:13,863 - experiment_functions - INFO - Early stopping at epoch 500. Best Metrics: (0.000569571859929553, 7.368209525085404e-05, 0.00024515627886452783)
2026-06-14 23:04:14,048 - optuna.study.study - INFO - Trial 166 finished with values: [0.000569571859929553, 7.368209525085404e-05, 0.00024515627886452783] and parameters: {'n_layers': 1, 'embedding_dim': 96, 'lr': 0.000567654585955759, 'lambda_val': 0.00012073664489097666, 'batch_size': 3910, 'optimizer': 'SGD'}.
2026-06-14 23:05:09,899 - experiment_functions - INFO - Early stopping at epoch 1300. Best Metrics: (0.07371705396340837, 0.008828454685511421, 0.0362097861810292)
2026-06-14 23:05:09,958 - optuna.study.study - INFO - Trial 167 finished with values: [0.07371705396340837, 0.008828454685511421, 0.0362097861810292] and parameters: {'n_layers': 1, 'embedding_dim': 128, 'lr': 0.0029187572679997753, 'lambda_val': 0.00020614378723959702, 'batch_size': 953, 'optimizer': 'RMSprop'}.
2026-06-14 23:05:56,524 - experiment_functions - INFO - Early stopping at epoch 950. Best Metrics: (0.09200171231161802, 0.011263313014937371, 0.04823409131243653)
2026-06-14 23:05:56,596 - optuna.study.study - INFO - Trial 168 finished with values: [0.09200171231161802, 0.011263313014937371, 0.04823409131243653] and parameters: {'n_layers': 1, 'embedding_dim': 256, 'lr': 0.0029187572679997753, 'lambda_val': 0.00020614378723959702, 'batch_size': 1827, 'optimizer': 'Adam'}.
2026-06-14 23:08:47,353 - optuna.study.study - INFO - Trial 169 finished with values: [0.10224034341941186, 0.01242882979435997, 0.055128532573679924] and parameters: {'n_layers': 1, 'embedding_dim': 128, 'lr': 0.00125444020622911, 'lambda_val': 6.806830251349438e-05, 'batch_size': 1686, 'optimizer': 'RMSprop'}.
2026-06-14 23:10:36,071 - experiment_functions - INFO - Early stopping at epoch 2950. Best Metrics: (0.0007376132508386366, 0.00012224529439346243, 0.0003186412953228851)
2026-06-14 23:10:36,166 - optuna.study.study - INFO - Trial 170 finished with values: [0.0007376132508386366, 0.00012224529439346243, 0.0003186412953228851] and parameters: {'n_layers': 1, 'embedding_dim': 32, 'lr': 0.00018243297440383044, 'lambda_val': 3.165997937915021e-05, 'batch_size': 2490, 'optimizer': 'Adam'}.
2026-06-14 23:11:05,911 - experiment_functions - INFO - Early stopping at epoch 650. Best Metrics: (0.0004920597442665943, 7.870587447250318e-05, 0.00020198263464990117)
2026-06-14 23:11:06,331 - optuna.study.study - INFO - Trial 171 finished with values: [0.0004920597442665943, 7.870587447250318e-05, 0.00020198263464990117] and parameters: {'n_layers': 2, 'embedding_dim': 128, 'lr': 3.5776252650565295e-05, 'lambda_val': 0.0031078842197627427, 'batch_size': 3878, 'optimizer': 'Adam'}.
2026-06-14 23:11:58,622 - experiment_functions - INFO - Early stopping at epoch 1250. Best Metrics: (0.0931800624950478, 0.011177908768169337, 0.04879538133579815)
2026-06-14 23:11:58,708 - optuna.study.study - INFO - Trial 172 finished with values: [0.0931800624950478, 0.011177908768169337, 0.04879538133579815] and parameters: {'n_layers': 1, 'embedding_dim': 64, 'lr': 0.0029187572679997753, 'lambda_val': 6.351942760483931e-05, 'batch_size': 3018, 'optimizer': 'Adam'}.
2026-06-14 23:14:41,028 - optuna.study.study - INFO - Trial 173 finished with values: [0.05391155137958125, 0.007328019291312211, 0.02997007293241978] and parameters: {'n_layers': 2, 'embedding_dim': 64, 'lr': 0.0003794262448571181, 'lambda_val': 1.6750135096134514e-06, 'batch_size': 2141, 'optimizer': 'Adam'}.
2026-06-14 23:17:41,168 - optuna.study.study - INFO - Trial 174 finished with values: [0.03555279033925295, 0.0054524750485631995, 0.02110252454961966] and parameters: {'n_layers': 1, 'embedding_dim': 256, 'lr': 0.0003794262448571181, 'lambda_val': 0.00020614378723959702, 'batch_size': 2141, 'optimizer': 'RMSprop'}.
2026-06-14 23:20:26,129 - optuna.study.study - INFO - Trial 175 finished with values: [0.08723512633775246, 0.011028869984593744, 0.049522491791847464] and parameters: {'n_layers': 1, 'embedding_dim': 96, 'lr': 0.0012453044445403945, 'lambda_val': 0.00020614378723959702, 'batch_size': 913, 'optimizer': 'RMSprop'}.
2026-06-14 23:23:30,959 - optuna.study.study - INFO - Trial 176 finished with values: [0.033232900992993, 0.0038800321521870185, 0.014814945583430697] and parameters: {'n_layers': 3, 'embedding_dim': 128, 'lr': 0.0033794417587331652, 'lambda_val': 0.00020614378723959702, 'batch_size': 913, 'optimizer': 'Adam'}.
2026-06-14 23:27:37,019 - optuna.study.study - INFO - Trial 177 finished with values: [0.04258816201652561, 0.005070667827717864, 0.020627209577492117] and parameters: {'n_layers': 4, 'embedding_dim': 256, 'lr': 0.0029187572679997753, 'lambda_val': 3.904381306216792e-06, 'batch_size': 913, 'optimizer': 'RMSprop'}.
2026-06-14 23:31:46,685 - optuna.study.study - INFO - Trial 178 finished with values: [0.06647003879542823, 0.008063165650746868, 0.033379947226411716] and parameters: {'n_layers': 4, 'embedding_dim': 256, 'lr': 0.0003794262448571181, 'lambda_val': 1.6750135096134514e-06, 'batch_size': 2141, 'optimizer': 'Adam'}.
2026-06-14 23:35:09,150 - optuna.study.study - INFO - Trial 179 finished with values: [0.06085340376861342, 0.007090227074820818, 0.029124332471320118] and parameters: {'n_layers': 2, 'embedding_dim': 256, 'lr': 0.006926802971380086, 'lambda_val': 7.390761978888471e-05, 'batch_size': 953, 'optimizer': 'RMSprop'}.
2026-06-14 23:38:11,377 - optuna.study.study - INFO - Trial 180 finished with values: [0.0430916057834352, 0.004680487641503115, 0.01974213134045648] and parameters: {'n_layers': 4, 'embedding_dim': 96, 'lr': 0.017176020213444436, 'lambda_val': 0.00012073664489097666, 'batch_size': 1756, 'optimizer': 'RMSprop'}.
2026-06-14 23:39:31,737 - experiment_functions - INFO - Early stopping at epoch 1700. Best Metrics: (0.06413155616756867, 0.007867238261102553, 0.032584355548226605)
2026-06-14 23:39:31,831 - optuna.study.study - INFO - Trial 181 finished with values: [0.06413155616756867, 0.007867238261102553, 0.032584355548226605] and parameters: {'n_layers': 3, 'embedding_dim': 128, 'lr': 0.0005365827475896209, 'lambda_val': 1.0100521690584193e-05, 'batch_size': 3878, 'optimizer': 'RMSprop'}.
2026-06-14 23:40:26,150 - experiment_functions - INFO - Early stopping at epoch 1350. Best Metrics: (0.0914237170298977, 0.01115278987206109, 0.04823045103693209)
2026-06-14 23:40:26,254 - optuna.study.study - INFO - Trial 182 finished with values: [0.0914237170298977, 0.01115278987206109, 0.04823045103693209] and parameters: {'n_layers': 1, 'embedding_dim': 64, 'lr': 0.0029187572679997753, 'lambda_val': 0.00020614378723959702, 'batch_size': 1244, 'optimizer': 'Adam'}.
2026-06-14 23:40:57,329 - experiment_functions - INFO - Early stopping at epoch 650. Best Metrics: (0.012470567530617236, 0.0014368008573916538, 0.005389722438434066)
2026-06-14 23:40:57,409 - optuna.study.study - INFO - Trial 183 finished with values: [0.012470567530617236, 0.0014368008573916538, 0.005389722438434066] and parameters: {'n_layers': 4, 'embedding_dim': 96, 'lr': 0.017176020213444436, 'lambda_val': 0.010316360506961574, 'batch_size': 3910, 'optimizer': 'RMSprop'}.
2026-06-14 23:41:54,284 - experiment_functions - INFO - Early stopping at epoch 1200. Best Metrics: (0.08619730667621152, 0.01057003148234979, 0.045882807578813294)
2026-06-14 23:41:54,375 - optuna.study.study - INFO - Trial 184 finished with values: [0.08619730667621152, 0.01057003148234979, 0.045882807578813294] and parameters: {'n_layers': 1, 'embedding_dim': 256, 'lr': 0.0029187572679997753, 'lambda_val': 1.3901992234716063e-05, 'batch_size': 913, 'optimizer': 'Adam'}.
2026-06-14 23:45:10,748 - optuna.study.study - INFO - Trial 185 finished with values: [0.05961211219521218, 0.007307924174425615, 0.031480500656700224] and parameters: {'n_layers': 4, 'embedding_dim': 128, 'lr': 0.0003794262448571181, 'lambda_val': 1.6750135096134514e-06, 'batch_size': 929, 'optimizer': 'RMSprop'}.
2026-06-14 23:48:03,374 - optuna.study.study - INFO - Trial 186 finished with values: [0.021108124580074324, 0.0033073213209190173, 0.0124071618620155] and parameters: {'n_layers': 2, 'embedding_dim': 128, 'lr': 0.0003794262448571181, 'lambda_val': 1.6750135096134514e-06, 'batch_size': 635, 'optimizer': 'Adam'}.
2026-06-14 23:51:08,505 - optuna.study.study - INFO - Trial 187 finished with values: [0.04150949846526943, 0.004725701654497956, 0.018484141606915003] and parameters: {'n_layers': 3, 'embedding_dim': 128, 'lr': 0.0029187572679997753, 'lambda_val': 3.9499778025869e-06, 'batch_size': 2694, 'optimizer': 'RMSprop'}.
2026-06-14 23:51:37,607 - experiment_functions - INFO - Early stopping at epoch 550. Best Metrics: (0.028512108850599883, 0.003359233706209391, 0.012778081550938306)
2026-06-14 23:51:37,686 - optuna.study.study - INFO - Trial 188 finished with values: [0.028512108850599883, 0.003359233706209391, 0.012778081550938306] and parameters: {'n_layers': 4, 'embedding_dim': 128, 'lr': 0.043670378185799816, 'lambda_val': 7.390761978888471e-05, 'batch_size': 913, 'optimizer': 'Adam'}.
2026-06-14 23:54:18,823 - optuna.study.study - INFO - Trial 189 finished with values: [0.09695291026176309, 0.011953245361377186, 0.05358546257487872] and parameters: {'n_layers': 1, 'embedding_dim': 64, 'lr': 0.00125444020622911, 'lambda_val': 6.806830251349438e-05, 'batch_size': 1686, 'optimizer': 'Adam'}.
2026-06-14 23:57:01,803 - optuna.study.study - INFO - Trial 190 finished with values: [0.08607297212041023, 0.011007100274633265, 0.04903462037192173] and parameters: {'n_layers': 1, 'embedding_dim': 96, 'lr': 0.000567654585955759, 'lambda_val': 3.246247535060975e-06, 'batch_size': 3910, 'optimizer': 'RMSprop'}.
2026-06-15 00:01:05,679 - optuna.study.study - INFO - Trial 191 finished with values: [0.0008140624937886039, 0.00012559448054122848, 0.0003651902528559507] and parameters: {'n_layers': 4, 'embedding_dim': 256, 'lr': 3.458069320077333e-05, 'lambda_val': 3.246247535060975e-06, 'batch_size': 3910, 'optimizer': 'Adam'}.
2026-06-15 00:02:04,727 - experiment_functions - INFO - Early stopping at epoch 1450. Best Metrics: (0.024856353530130965, 0.0029791010784379402, 0.011403291085336052)
2026-06-15 00:02:04,821 - optuna.study.study - INFO - Trial 192 finished with values: [0.024856353530130965, 0.0029791010784379402, 0.011403291085336052] and parameters: {'n_layers': 4, 'embedding_dim': 32, 'lr': 0.01005775655032132, 'lambda_val': 3.904381306216792e-06, 'batch_size': 2490, 'optimizer': 'Adam'}.
2026-06-15 00:02:46,116 - experiment_functions - INFO - Early stopping at epoch 1000. Best Metrics: (0.0005577081607793645, 9.042802598968451e-05, 0.00026199239474255327)
2026-06-15 00:02:46,674 - optuna.study.study - INFO - Trial 193 finished with values: [0.0005577081607793645, 9.042802598968451e-05, 0.00026199239474255327] and parameters: {'n_layers': 1, 'embedding_dim': 128, 'lr': 5.153593732570109e-05, 'lambda_val': 6.351942760483931e-05, 'batch_size': 1424, 'optimizer': 'Adam'}.
2026-06-15 00:05:30,581 - optuna.study.study - INFO - Trial 194 finished with values: [0.04732287756705182, 0.005576394936030545, 0.02254996213438727] and parameters: {'n_layers': 1, 'embedding_dim': 128, 'lr': 0.01393656885044344, 'lambda_val': 0.00012073664489097666, 'batch_size': 2579, 'optimizer': 'RMSprop'}.
