2026-06-15 01:50:25,431 - optuna.study.study - INFO - Trial 249 finished with values: [0.0914393171125548, 0.011434121508473442, 0.050569484813058174] and parameters: {'n_layers': 1, 'embedding_dim': 128, 'lr': 0.00125444020622911, 'lambda_val': 6.806830251349438e-05, 'batch_size': 953, 'optimizer': 'RMSprop'}.
2026-06-15 01:51:07,568 - experiment_functions - INFO - Early stopping at epoch 950. Best Metrics: (0.08898927781280987, 0.011104226672918481, 0.04810212110640373)
2026-06-15 01:51:07,650 - optuna.study.study - INFO - Trial 250 finished with values: [0.08898927781280987, 0.011104226672918481, 0.04810212110640373] and parameters: {'n_layers': 1, 'embedding_dim': 128, 'lr': 0.0029187572679997753, 'lambda_val': 0.00020614378723959702, 'batch_size': 1827, 'optimizer': 'Adam'}.
2026-06-15 01:53:47,613 - optuna.study.study - INFO - Trial 251 finished with values: [0.028367638441472526, 0.004343894433652623, 0.01726003800936296] and parameters: {'n_layers': 1, 'embedding_dim': 128, 'lr': 0.0005365827475896209, 'lambda_val': 4.549679102255953e-06, 'batch_size': 913, 'optimizer': 'RMSprop'}.
2026-06-15 01:55:10,291 - experiment_functions - INFO - Early stopping at epoch 1850. Best Metrics: (0.051409268634115025, 0.005988344832205774, 0.02398588300034278)
2026-06-15 01:55:10,382 - optuna.study.study - INFO - Trial 252 finished with values: [0.051409268634115025, 0.005988344832205774, 0.02398588300034278] and parameters: {'n_layers': 2, 'embedding_dim': 128, 'lr': 0.0029187572679997753, 'lambda_val': 1.0100521690584193e-05, 'batch_size': 1023, 'optimizer': 'Adam'}.
2026-06-15 01:55:55,092 - experiment_functions - INFO - Early stopping at epoch 900. Best Metrics: (0.09398962153883975, 0.011248241677272421, 0.049728418739309256)
2026-06-15 01:55:56,445 - optuna.study.study - INFO - Trial 253 finished with values: [0.09398962153883975, 0.011248241677272421, 0.049728418739309256] and parameters: {'n_layers': 1, 'embedding_dim': 256, 'lr': 0.0029187572679997753, 'lambda_val': 0.00020614378723959702, 'batch_size': 3125, 'optimizer': 'Adam'}.
2026-06-15 01:58:36,582 - optuna.study.study - INFO - Trial 254 finished with values: [0.07939685338846003, 0.00953680755576395, 0.041406687368995755] and parameters: {'n_layers': 2, 'embedding_dim': 32, 'lr': 0.00125444020622911, 'lambda_val': 1.1527814672590544e-05, 'batch_size': 1686, 'optimizer': 'Adam'}.
2026-06-15 02:01:24,997 - optuna.study.study - INFO - Trial 255 finished with values: [0.06539459446887881, 0.00899926317904749, 0.03625755954116078] and parameters: {'n_layers': 1, 'embedding_dim': 128, 'lr': 0.0005365827475896209, 'lambda_val': 0.002228323656630075, 'batch_size': 2743, 'optimizer': 'Adam'}.
2026-06-15 02:02:52,069 - experiment_functions - INFO - Early stopping at epoch 2050. Best Metrics: (0.07175550174673079, 0.009046151785116217, 0.03618742555986647)
2026-06-15 02:02:52,142 - optuna.study.study - INFO - Trial 256 finished with values: [0.07175550174673079, 0.009046151785116217, 0.03618742555986647] and parameters: {'n_layers': 1, 'embedding_dim': 128, 'lr': 0.00125444020622911, 'lambda_val': 0.00570691261366525, 'batch_size': 913, 'optimizer': 'RMSprop'}.
2026-06-15 02:03:12,642 - experiment_functions - INFO - Early stopping at epoch 500. Best Metrics: (0.0004802525252437437, 9.042802598968451e-05, 0.00023902742185150577)
2026-06-15 02:03:12,706 - optuna.study.study - INFO - Trial 257 finished with values: [0.0004802525252437437, 9.042802598968451e-05, 0.00023902742185150577] and parameters: {'n_layers': 1, 'embedding_dim': 32, 'lr': 0.00125444020622911, 'lambda_val': 6.806830251349438e-05, 'batch_size': 1765, 'optimizer': 'SGD'}.
2026-06-15 02:06:00,836 - optuna.study.study - INFO - Trial 258 finished with values: [0.10195129692353375, 0.012291513162301562, 0.05333867898050204] and parameters: {'n_layers': 1, 'embedding_dim': 96, 'lr': 0.00125444020622911, 'lambda_val': 6.806830251349438e-05, 'batch_size': 2684, 'optimizer': 'RMSprop'}.
2026-06-15 02:06:42,564 - experiment_functions - INFO - Early stopping at epoch 1000. Best Metrics: (0.09031905970777099, 0.011105901265992363, 0.04827238635975789)
2026-06-15 02:06:42,634 - optuna.study.study - INFO - Trial 259 finished with values: [0.09031905970777099, 0.011105901265992363, 0.04827238635975789] and parameters: {'n_layers': 1, 'embedding_dim': 64, 'lr': 0.0029187572679997753, 'lambda_val': 3.904381306216792e-06, 'batch_size': 3018, 'optimizer': 'Adam'}.
2026-06-15 02:09:22,417 - optuna.study.study - INFO - Trial 260 finished with values: [0.08160828895173239, 0.01041764351262643, 0.04538855462303135] and parameters: {'n_layers': 1, 'embedding_dim': 64, 'lr': 0.00125444020622911, 'lambda_val': 5.8216735655749994e-05, 'batch_size': 894, 'optimizer': 'RMSprop'}.
2026-06-15 02:12:03,671 - optuna.study.study - INFO - Trial 261 finished with values: [0.09007371009105775, 0.010757585906624692, 0.047751280504447706] and parameters: {'n_layers': 1, 'embedding_dim': 64, 'lr': 0.0029187572679997753, 'lambda_val': 1.3901992234716063e-05, 'batch_size': 948, 'optimizer': 'Adam'}.
2026-06-15 02:12:44,292 - experiment_functions - INFO - Early stopping at epoch 900. Best Metrics: (0.09381826129105308, 0.011516176569093711, 0.05001739691174272)
2026-06-15 02:12:44,375 - optuna.study.study - INFO - Trial 262 finished with values: [0.09381826129105308, 0.011516176569093711, 0.05001739691174272] and parameters: {'n_layers': 1, 'embedding_dim': 128, 'lr': 0.0029187572679997753, 'lambda_val': 1.1203550733501718e-05, 'batch_size': 3125, 'optimizer': 'Adam'}.
2026-06-15 02:15:25,571 - optuna.study.study - INFO - Trial 263 finished with values: [0.0942442071665987, 0.011787460647062766, 0.052380197616209094] and parameters: {'n_layers': 1, 'embedding_dim': 64, 'lr': 0.00125444020622911, 'lambda_val': 6.806830251349438e-05, 'batch_size': 1686, 'optimizer': 'Adam'}.
2026-06-15 02:16:19,485 - experiment_functions - INFO - Early stopping at epoch 1300. Best Metrics: (0.01944921556528479, 0.002552079844597763, 0.008964875577966937)
2026-06-15 02:16:19,561 - optuna.study.study - INFO - Trial 264 finished with values: [0.01944921556528479, 0.002552079844597763, 0.008964875577966937] and parameters: {'n_layers': 1, 'embedding_dim': 128, 'lr': 0.00125444020622911, 'lambda_val': 0.08456784579851959, 'batch_size': 1686, 'optimizer': 'RMSprop'}.
2026-06-15 02:17:15,580 - experiment_functions - INFO - Early stopping at epoch 1350. Best Metrics: (0.08964197137455521, 0.010941791144751826, 0.047566287964064716)
2026-06-15 02:17:15,651 - optuna.study.study - INFO - Trial 265 finished with values: [0.08964197137455521, 0.010941791144751826, 0.047566287964064716] and parameters: {'n_layers': 1, 'embedding_dim': 64, 'lr': 0.0029187572679997753, 'lambda_val': 2.085056364972028e-06, 'batch_size': 1244, 'optimizer': 'Adam'}.
2026-06-15 02:20:27,316 - optuna.study.study - INFO - Trial 266 finished with values: [0.10726195209336443, 0.013045080045548933, 0.0584751907313401] and parameters: {'n_layers': 1, 'embedding_dim': 256, 'lr': 0.00125444020622911, 'lambda_val': 6.806830251349438e-05, 'batch_size': 1686, 'optimizer': 'Adam'}.
2026-06-15 02:23:13,493 - optuna.study.study - INFO - Trial 267 finished with values: [0.0878019019501511, 0.010976957599303372, 0.048997932105482415] and parameters: {'n_layers': 1, 'embedding_dim': 96, 'lr': 0.0012453044445403945, 'lambda_val': 0.00020614378723959702, 'batch_size': 913, 'optimizer': 'RMSprop'}.
2026-06-15 02:24:58,579 - experiment_functions - INFO - Early stopping at epoch 2500. Best Metrics: (0.07920622346228529, 0.009603791278719272, 0.03952021073712066)
2026-06-15 02:24:58,658 - optuna.study.study - INFO - Trial 268 finished with values: [0.07920622346228529, 0.009603791278719272, 0.03952021073712066] and parameters: {'n_layers': 2, 'embedding_dim': 64, 'lr': 0.00125444020622911, 'lambda_val': 6.806830251349438e-05, 'batch_size': 1686, 'optimizer': 'Adam'}.
2026-06-15 02:25:37,148 - experiment_functions - INFO - Early stopping at epoch 650. Best Metrics: (0.008946703568260796, 0.0010851363118762143, 0.0038173218398018572)
2026-06-15 02:25:37,220 - optuna.study.study - INFO - Trial 269 finished with values: [0.008946703568260796, 0.0010851363118762143, 0.0038173218398018572] and parameters: {'n_layers': 3, 'embedding_dim': 256, 'lr': 0.004053707131040957, 'lambda_val': 0.06651034258614598, 'batch_size': 3910, 'optimizer': 'Adam'}.
2026-06-15 02:26:22,882 - experiment_functions - INFO - Early stopping at epoch 750. Best Metrics: (0.05707729038135172, 0.007061758992564808, 0.028659782133807734)
2026-06-15 02:26:22,999 - optuna.study.study - INFO - Trial 270 finished with values: [0.05707729038135172, 0.007061758992564808, 0.028659782133807734] and parameters: {'n_layers': 3, 'embedding_dim': 256, 'lr': 0.00125444020622911, 'lambda_val': 0.00020614378723959702, 'batch_size': 2141, 'optimizer': 'Adam'}.
2026-06-15 02:26:56,207 - experiment_functions - INFO - Early stopping at epoch 550. Best Metrics: (0.03343310556850706, 0.0037678344162368547, 0.016376066188369023)
2026-06-15 02:26:56,315 - optuna.study.study - INFO - Trial 271 finished with values: [0.03343310556850706, 0.0037678344162368547, 0.016376066188369023] and parameters: {'n_layers': 3, 'embedding_dim': 256, 'lr': 0.038857122225990755, 'lambda_val': 1.6750135096134514e-06, 'batch_size': 1827, 'optimizer': 'RMSprop'}.
2026-06-15 02:27:36,821 - experiment_functions - INFO - Early stopping at epoch 950. Best Metrics: (0.01572600469981787, 0.0019575993033692815, 0.006765780272824531)
2026-06-15 02:27:37,640 - optuna.study.study - INFO - Trial 272 finished with values: [0.01572600469981787, 0.0019575993033692815, 0.006765780272824531] and parameters: {'n_layers': 1, 'embedding_dim': 128, 'lr': 0.00125444020622911, 'lambda_val': 0.09791134818446255, 'batch_size': 3281, 'optimizer': 'RMSprop'}.
2026-06-15 02:28:22,647 - experiment_functions - INFO - Early stopping at epoch 1100. Best Metrics: (0.00045933157991929726, 8.205506062026927e-05, 0.0002629033704224518)
2026-06-15 02:28:22,736 - optuna.study.study - INFO - Trial 273 finished with values: [0.00045933157991929726, 8.205506062026927e-05, 0.0002629033704224518] and parameters: {'n_layers': 2, 'embedding_dim': 64, 'lr': 3.379624009161835e-05, 'lambda_val': 3.246247535060975e-06, 'batch_size': 720, 'optimizer': 'Adam'}.
2026-06-15 02:28:45,816 - experiment_functions - INFO - Early stopping at epoch 550. Best Metrics: (0.0005405188670630487, 8.205506062026927e-05, 0.00023303084233935122)
2026-06-15 02:28:45,895 - optuna.study.study - INFO - Trial 274 finished with values: [0.0005405188670630487, 8.205506062026927e-05, 0.00023303084233935122] and parameters: {'n_layers': 1, 'embedding_dim': 64, 'lr': 1.919820300228473e-05, 'lambda_val': 6.806830251349438e-05, 'batch_size': 1307, 'optimizer': 'Adam'}.
2026-06-15 02:31:48,095 - experiment_functions - INFO - Early stopping at epoch 2900. Best Metrics: (0.04907686586399888, 0.0053821421394601105, 0.02381504941064593)
2026-06-15 02:31:48,165 - optuna.study.study - INFO - Trial 275 finished with values: [0.04907686586399888, 0.0053821421394601105, 0.02381504941064593] and parameters: {'n_layers': 4, 'embedding_dim': 256, 'lr': 0.01855462775054443, 'lambda_val': 1.6750135096134514e-06, 'batch_size': 1686, 'optimizer': 'RMSprop'}.
2026-06-15 02:32:39,540 - experiment_functions - INFO - Early stopping at epoch 1250. Best Metrics: (0.08739516396323632, 0.01073581619666421, 0.04724768237831937)
2026-06-15 02:32:39,616 - optuna.study.study - INFO - Trial 276 finished with values: [0.08739516396323632, 0.01073581619666421, 0.04724768237831937] and parameters: {'n_layers': 1, 'embedding_dim': 64, 'lr': 0.0029187572679997753, 'lambda_val': 0.00020614378723959702, 'batch_size': 1244, 'optimizer': 'Adam'}.
2026-06-15 02:33:55,539 - experiment_functions - INFO - Early stopping at epoch 1850. Best Metrics: (0.08650609536453364, 0.01053151584165048, 0.04559818203807932)
2026-06-15 02:33:55,631 - optuna.study.study - INFO - Trial 277 finished with values: [0.08650609536453364, 0.01053151584165048, 0.04559818203807932] and parameters: {'n_layers': 1, 'embedding_dim': 64, 'lr': 0.0029187572679997753, 'lambda_val': 0.00020614378723959702, 'batch_size': 715, 'optimizer': 'Adam'}.
2026-06-15 02:36:37,410 - optuna.study.study - INFO - Trial 278 finished with values: [0.09378335986305132, 0.011748945006363453, 0.05189787122235822] and parameters: {'n_layers': 1, 'embedding_dim': 64, 'lr': 0.0012453044445403945, 'lambda_val': 5.779334633401426e-06, 'batch_size': 1572, 'optimizer': 'Adam'}.
2026-06-15 02:39:38,238 - experiment_functions - INFO - Early stopping at epoch 3850. Best Metrics: (0.04573653003797048, 0.005281666555027129, 0.021478644862881827)
2026-06-15 02:39:38,322 - optuna.study.study - INFO - Trial 279 finished with values: [0.04573653003797048, 0.005281666555027129, 0.021478644862881827] and parameters: {'n_layers': 3, 'embedding_dim': 128, 'lr': 0.0012629839295728211, 'lambda_val': 5.8216735655749994e-05, 'batch_size': 3296, 'optimizer': 'RMSprop'}.
2026-06-15 02:40:04,375 - experiment_functions - INFO - Early stopping at epoch 550. Best Metrics: (0.02682238798469208, 0.003211869515707683, 0.012520068237984832)
2026-06-15 02:40:04,454 - optuna.study.study - INFO - Trial 280 finished with values: [0.02682238798469208, 0.003211869515707683, 0.012520068237984832] and parameters: {'n_layers': 4, 'embedding_dim': 64, 'lr': 0.06471225494361917, 'lambda_val': 1.3901992234716063e-05, 'batch_size': 913, 'optimizer': 'Adam'}.
2026-06-15 02:40:31,017 - experiment_functions - INFO - Early stopping at epoch 600. Best Metrics: (0.04600594726094179, 0.005566347377587247, 0.021336865864181934)
2026-06-15 02:40:31,103 - optuna.study.study - INFO - Trial 281 finished with values: [0.04600594726094179, 0.005566347377587247, 0.021336865864181934] and parameters: {'n_layers': 2, 'embedding_dim': 64, 'lr': 0.005629427986907437, 'lambda_val': 1.0458611121108427e-05, 'batch_size': 1827, 'optimizer': 'Adam'}.
2026-06-15 02:42:15,336 - experiment_functions - INFO - Early stopping at epoch 2550. Best Metrics: (0.09486103135148066, 0.011489383079911583, 0.04984225410497975)
2026-06-15 02:42:15,409 - optuna.study.study - INFO - Trial 282 finished with values: [0.09486103135148066, 0.011489383079911583, 0.04984225410497975] and parameters: {'n_layers': 1, 'embedding_dim': 64, 'lr': 0.0029187572679997753, 'lambda_val': 1.3901992234716063e-05, 'batch_size': 913, 'optimizer': 'Adam'}.
2026-06-15 02:44:53,640 - experiment_functions - INFO - Early stopping at epoch 3850. Best Metrics: (0.10032819965202214, 0.012083863621140063, 0.05363119340611437)
2026-06-15 02:44:53,718 - optuna.study.study - INFO - Trial 283 finished with values: [0.10032819965202214, 0.012083863621140063, 0.05363119340611437] and parameters: {'n_layers': 1, 'embedding_dim': 64, 'lr': 0.00125444020622911, 'lambda_val': 6.806830251349438e-05, 'batch_size': 3401, 'optimizer': 'RMSprop'}.
2026-06-15 02:47:35,692 - optuna.study.study - INFO - Trial 284 finished with values: [0.09400767455490458, 0.011516176569093711, 0.05186201593627943] and parameters: {'n_layers': 1, 'embedding_dim': 64, 'lr': 0.00125444020622911, 'lambda_val': 6.806830251349438e-05, 'batch_size': 1686, 'optimizer': 'RMSprop'}.
2026-06-15 02:50:17,356 - optuna.study.study - INFO - Trial 285 finished with values: [0.0853064202938085, 0.010765958871994106, 0.047586191695761865] and parameters: {'n_layers': 1, 'embedding_dim': 64, 'lr': 0.00125444020622911, 'lambda_val': 6.806830251349438e-05, 'batch_size': 913, 'optimizer': 'RMSprop'}.
2026-06-15 02:50:59,737 - experiment_functions - INFO - Early stopping at epoch 850. Best Metrics: (0.09534280368937917, 0.011635072677339408, 0.05084171435412649)
2026-06-15 02:50:59,829 - optuna.study.study - INFO - Trial 286 finished with values: [0.09534280368937917, 0.011635072677339408, 0.05084171435412649] and parameters: {'n_layers': 1, 'embedding_dim': 256, 'lr': 0.0029187572679997753, 'lambda_val': 0.00020614378723959702, 'batch_size': 3257, 'optimizer': 'Adam'}.
2026-06-15 02:53:49,880 - optuna.study.study - INFO - Trial 287 finished with values: [0.09199049801407365, 0.011486033893763814, 0.05134516433331229] and parameters: {'n_layers': 1, 'embedding_dim': 128, 'lr': 0.00125444020622911, 'lambda_val': 6.806830251349438e-05, 'batch_size': 953, 'optimizer': 'RMSprop'}.
2026-06-15 02:54:16,821 - experiment_functions - INFO - Early stopping at epoch 500. Best Metrics: (0.0004348794414049366, 7.368209525085404e-05, 0.00024582419150487376)
2026-06-15 02:54:16,909 - optuna.study.study - INFO - Trial 288 finished with values: [0.0004348794414049366, 7.368209525085404e-05, 0.00024582419150487376] and parameters: {'n_layers': 2, 'embedding_dim': 256, 'lr': 0.0012453044445403945, 'lambda_val': 6.806830251349438e-05, 'batch_size': 1686, 'optimizer': 'SGD'}.
2026-06-15 02:57:02,579 - optuna.study.study - INFO - Trial 289 finished with values: [0.08917384043856498, 0.01122982115345971, 0.05041091985700099] and parameters: {'n_layers': 1, 'embedding_dim': 96, 'lr': 0.0012453044445403945, 'lambda_val': 0.00020614378723959702, 'batch_size': 913, 'optimizer': 'RMSprop'}.
2026-06-15 03:00:09,881 - optuna.study.study - INFO - Trial 290 finished with values: [0.08203196911989813, 0.00948154598432581, 0.04051831378195516] and parameters: {'n_layers': 1, 'embedding_dim': 256, 'lr': 0.0029187572679997753, 'lambda_val': 2.085056364972028e-06, 'batch_size': 1906, 'optimizer': 'RMSprop'}.
2026-06-15 03:02:13,984 - experiment_functions - INFO - Early stopping at epoch 2850. Best Metrics: (0.07259392054537345, 0.008697836425748545, 0.036118989687435384)
2026-06-15 03:02:14,063 - optuna.study.study - INFO - Trial 291 finished with values: [0.07259392054537345, 0.008697836425748545, 0.036118989687435384] and parameters: {'n_layers': 2, 'embedding_dim': 96, 'lr': 0.00125444020622911, 'lambda_val': 6.806830251349438e-05, 'batch_size': 953, 'optimizer': 'RMSprop'}.
2026-06-15 03:03:00,696 - experiment_functions - INFO - Early stopping at epoch 1050. Best Metrics: (0.0937379169749232, 0.011546319244423606, 0.05072269393658894)
2026-06-15 03:03:00,771 - optuna.study.study - INFO - Trial 292 finished with values: [0.0937379169749232, 0.011546319244423606, 0.05072269393658894] and parameters: {'n_layers': 1, 'embedding_dim': 128, 'lr': 0.0029187572679997753, 'lambda_val': 2.085056364972028e-06, 'batch_size': 1827, 'optimizer': 'Adam'}.
2026-06-15 03:03:27,143 - experiment_functions - INFO - Early stopping at epoch 650. Best Metrics: (0.04401533265851621, 0.005298412485765959, 0.02058833638757681)
2026-06-15 03:03:28,347 - optuna.study.study - INFO - Trial 293 finished with values: [0.04401533265851621, 0.005298412485765959, 0.02058833638757681] and parameters: {'n_layers': 1, 'embedding_dim': 32, 'lr': 0.015780825834758004, 'lambda_val': 6.806830251349438e-05, 'batch_size': 1310, 'optimizer': 'Adam'}.
2026-06-15 03:06:19,363 - optuna.study.study - INFO - Trial 294 finished with values: [0.10145778191647739, 0.012319981244557573, 0.05578088304647167] and parameters: {'n_layers': 1, 'embedding_dim': 128, 'lr': 0.00125444020622911, 'lambda_val': 6.806830251349438e-05, 'batch_size': 1686, 'optimizer': 'RMSprop'}.
2026-06-15 03:06:43,759 - experiment_functions - INFO - Early stopping at epoch 550. Best Metrics: (0.0006456708483514677, 9.042802598968451e-05, 0.00028501502669623144)
2026-06-15 03:06:43,850 - optuna.study.study - INFO - Trial 295 finished with values: [0.0006456708483514677, 9.042802598968451e-05, 0.00028501502669623144] and parameters: {'n_layers': 1, 'embedding_dim': 128, 'lr': 3.606637486821963e-05, 'lambda_val': 3.904381306216792e-06, 'batch_size': 3129, 'optimizer': 'Adam'}.
2026-06-15 03:07:23,921 - experiment_functions - INFO - Early stopping at epoch 950. Best Metrics: (0.0931264126700696, 0.011512827382945946, 0.04877374923227188)
2026-06-15 03:07:24,005 - optuna.study.study - INFO - Trial 296 finished with values: [0.0931264126700696, 0.011512827382945946, 0.04877374923227188] and parameters: {'n_layers': 1, 'embedding_dim': 64, 'lr': 0.0029187572679997753, 'lambda_val': 0.00020614378723959702, 'batch_size': 3018, 'optimizer': 'Adam'}.
2026-06-15 03:08:04,095 - experiment_functions - INFO - Early stopping at epoch 1000. Best Metrics: (0.0004575943960628787, 7.870587447250318e-05, 0.00018649860464525994)
2026-06-15 03:08:04,186 - optuna.study.study - INFO - Trial 297 finished with values: [0.0004575943960628787, 7.870587447250318e-05, 0.00018649860464525994] and parameters: {'n_layers': 1, 'embedding_dim': 96, 'lr': 4.6785314836613025e-05, 'lambda_val': 0.00020614378723959702, 'batch_size': 3152, 'optimizer': 'RMSprop'}.
2026-06-15 03:10:53,280 - optuna.study.study - INFO - Trial 298 finished with values: [0.10352316919756882, 0.012604662067117689, 0.05644054788645219] and parameters: {'n_layers': 1, 'embedding_dim': 128, 'lr': 0.00125444020622911, 'lambda_val': 6.806830251349438e-05, 'batch_size': 1686, 'optimizer': 'RMSprop'}.
2026-06-15 03:12:58,048 - experiment_functions - INFO - Early stopping at epoch 3200. Best Metrics: (0.0908046583737749, 0.011002076495411618, 0.04841969740693229)
