2026-06-15 16:58:51,046 - optuna.study.study - INFO - Trial 31 finished with values: [0.0005341784621205361, 8.205506062026927e-05, 0.0002808545688146261] and parameters: {'n_layers': 3, 'embedding_dim': 64, 'lr': 3.1923012936711204e-05, 'lambda_val': 0.0001666403059897094, 'batch_size': 1034, 'optimizer': 'SGD'}.
2026-06-15 16:59:49,070 - experiment_functions - INFO - Early stopping at epoch 900. Best Metrics: (0.04326362972642202, 0.00523310335588452, 0.02031839783571143)
2026-06-15 16:59:49,177 - optuna.study.study - INFO - Trial 32 finished with values: [0.04326362972642202, 0.00523310335588452, 0.02031839783571143] and parameters: {'n_layers': 4, 'embedding_dim': 256, 'lr': 0.0008257854890964482, 'lambda_val': 1.0702432018798528e-05, 'batch_size': 3109, 'optimizer': 'RMSprop'}.
2026-06-15 17:03:13,466 - optuna.study.study - INFO - Trial 33 finished with values: [0.058378475412041254, 0.0065108178712572845, 0.027264439871939387] and parameters: {'n_layers': 2, 'embedding_dim': 256, 'lr': 0.00859558839759563, 'lambda_val': 0.0002091155632832413, 'batch_size': 2936, 'optimizer': 'RMSprop'}.
2026-06-15 17:03:37,860 - experiment_functions - INFO - Early stopping at epoch 500. Best Metrics: (0.0007390058999441449, 9.210261906356756e-05, 0.00030676571577882366)
2026-06-15 17:03:38,006 - optuna.study.study - INFO - Trial 34 finished with values: [0.0007390058999441449, 9.210261906356756e-05, 0.00030676571577882366] and parameters: {'n_layers': 3, 'embedding_dim': 128, 'lr': 0.0009032156442764802, 'lambda_val': 2.2783896782701448e-06, 'batch_size': 3364, 'optimizer': 'SGD'}.
2026-06-15 17:06:18,267 - experiment_functions - INFO - Early stopping at epoch 2600. Best Metrics: (0.034418342980515715, 0.003873333779891486, 0.015534694061107543)
2026-06-15 17:06:18,358 - optuna.study.study - INFO - Trial 35 finished with values: [0.034418342980515715, 0.003873333779891486, 0.015534694061107543] and parameters: {'n_layers': 4, 'embedding_dim': 256, 'lr': 0.03084046980611842, 'lambda_val': 0.0007056459220346085, 'batch_size': 3500, 'optimizer': 'RMSprop'}.
2026-06-15 17:07:15,921 - experiment_functions - INFO - Early stopping at epoch 1000. Best Metrics: (0.00852166263948412, 0.0011470962556098868, 0.0038159890968117037)
2026-06-15 17:07:15,996 - optuna.study.study - INFO - Trial 36 finished with values: [0.00852166263948412, 0.0011470962556098868, 0.0038159890968117037] and parameters: {'n_layers': 3, 'embedding_dim': 256, 'lr': 0.004675942348308898, 'lambda_val': 0.0623488839874133, 'batch_size': 2336, 'optimizer': 'Adam'}.
2026-06-15 17:07:38,027 - experiment_functions - INFO - Early stopping at epoch 500. Best Metrics: (0.00040577619067794495, 6.865831602920491e-05, 0.0002494745174753239)
2026-06-15 17:07:38,114 - optuna.study.study - INFO - Trial 37 finished with values: [0.00040577619067794495, 6.865831602920491e-05, 0.0002494745174753239] and parameters: {'n_layers': 2, 'embedding_dim': 96, 'lr': 0.0005972336465063562, 'lambda_val': 0.05295995185432029, 'batch_size': 1362, 'optimizer': 'SGD'}.
2026-06-15 17:08:25,869 - experiment_functions - INFO - Early stopping at epoch 1150. Best Metrics: (0.0004211263149030982, 6.86583160292049e-05, 0.00018797334734206792)
2026-06-15 17:08:25,964 - optuna.study.study - INFO - Trial 38 finished with values: [0.0004211263149030982, 6.86583160292049e-05, 0.00018797334734206792] and parameters: {'n_layers': 3, 'embedding_dim': 64, 'lr': 3.76460060237364e-05, 'lambda_val': 0.0009585573678261187, 'batch_size': 1224, 'optimizer': 'Adam'}.
2026-06-15 17:09:16,387 - experiment_functions - INFO - Early stopping at epoch 1100. Best Metrics: (0.06348405782546136, 0.007744992966709089, 0.03137797063787347)
2026-06-15 17:09:16,473 - optuna.study.study - INFO - Trial 39 finished with values: [0.06348405782546136, 0.007744992966709089, 0.03137797063787347] and parameters: {'n_layers': 2, 'embedding_dim': 128, 'lr': 0.0013130193047400018, 'lambda_val': 4.740391388963357e-05, 'batch_size': 1772, 'optimizer': 'RMSprop'}.
2026-06-15 17:09:52,466 - experiment_functions - INFO - Early stopping at epoch 800. Best Metrics: (0.008452687352279623, 0.0010466206711769043, 0.003841996230649836)
2026-06-15 17:09:53,352 - optuna.study.study - INFO - Trial 40 finished with values: [0.008452687352279623, 0.0010466206711769043, 0.003841996230649836] and parameters: {'n_layers': 2, 'embedding_dim': 128, 'lr': 0.002670491335680087, 'lambda_val': 0.09716580295971683, 'batch_size': 2835, 'optimizer': 'Adam'}.
2026-06-15 17:10:14,719 - experiment_functions - INFO - Early stopping at epoch 500. Best Metrics: (0.00046993252800741573, 6.698372295532186e-05, 0.00021022770368820173)
2026-06-15 17:10:14,799 - optuna.study.study - INFO - Trial 41 finished with values: [0.00046993252800741573, 6.698372295532186e-05, 0.00021022770368820173] and parameters: {'n_layers': 2, 'embedding_dim': 64, 'lr': 0.0012542589490973331, 'lambda_val': 0.09654737049434427, 'batch_size': 1882, 'optimizer': 'SGD'}.
2026-06-15 17:12:49,228 - optuna.study.study - INFO - Trial 42 finished with values: [0.08807004367912474, 0.011000401902337732, 0.0486676466753281] and parameters: {'n_layers': 1, 'embedding_dim': 32, 'lr': 0.001479782641411582, 'lambda_val': 0.00041942469140426685, 'batch_size': 1650, 'optimizer': 'Adam'}.
2026-06-15 17:13:13,043 - experiment_functions - INFO - Early stopping at epoch 550. Best Metrics: (0.026001029578677375, 0.0034111460914997655, 0.012601180302459823)
2026-06-15 17:13:13,112 - optuna.study.study - INFO - Trial 43 finished with values: [0.026001029578677375, 0.0034111460914997655, 0.012601180302459823] and parameters: {'n_layers': 2, 'embedding_dim': 64, 'lr': 0.004490672612947781, 'lambda_val': 0.0034870006252512636, 'batch_size': 907, 'optimizer': 'RMSprop'}.
2026-06-15 17:17:16,821 - optuna.study.study - INFO - Trial 44 finished with values: [0.01611739789813461, 0.0023980172818005227, 0.00839891705761675] and parameters: {'n_layers': 4, 'embedding_dim': 256, 'lr': 0.00010674383570653404, 'lambda_val': 0.001319855427866883, 'batch_size': 1854, 'optimizer': 'RMSprop'}.
2026-06-15 17:17:43,342 - experiment_functions - INFO - Early stopping at epoch 500. Best Metrics: (0.0005314092724111904, 8.540424676803538e-05, 0.0002509159490869171)
2026-06-15 17:17:43,511 - optuna.study.study - INFO - Trial 45 finished with values: [0.0005314092724111904, 8.540424676803538e-05, 0.0002509159490869171] and parameters: {'n_layers': 2, 'embedding_dim': 256, 'lr': 0.00311600732165254, 'lambda_val': 6.461965909578869e-06, 'batch_size': 3237, 'optimizer': 'SGD'}.
2026-06-15 17:18:04,840 - experiment_functions - INFO - Early stopping at epoch 500. Best Metrics: (0.00031156322084347355, 5.861075758590662e-05, 0.00016449589205529372)
2026-06-15 17:18:04,933 - optuna.study.study - INFO - Trial 46 finished with values: [0.00031156322084347355, 5.861075758590662e-05, 0.00016449589205529372] and parameters: {'n_layers': 2, 'embedding_dim': 64, 'lr': 0.01095825750409513, 'lambda_val': 0.00036906228006454916, 'batch_size': 1227, 'optimizer': 'SGD'}.
2026-06-15 17:18:31,074 - experiment_functions - INFO - Early stopping at epoch 550. Best Metrics: (0.0334453179192685, 0.0038163976153794627, 0.015438014642177445)
2026-06-15 17:18:31,180 - optuna.study.study - INFO - Trial 47 finished with values: [0.0334453179192685, 0.0038163976153794627, 0.015438014642177445] and parameters: {'n_layers': 2, 'embedding_dim': 128, 'lr': 0.04915150101302751, 'lambda_val': 1.5130950471060717e-06, 'batch_size': 3620, 'optimizer': 'Adam'}.
2026-06-15 17:19:05,483 - experiment_functions - INFO - Early stopping at epoch 750. Best Metrics: (0.004821025705391724, 0.0005894567620068323, 0.0022198072055324976)
2026-06-15 17:19:05,809 - optuna.study.study - INFO - Trial 48 finished with values: [0.004821025705391724, 0.0005894567620068323, 0.0022198072055324976] and parameters: {'n_layers': 3, 'embedding_dim': 96, 'lr': 0.012030553977889366, 'lambda_val': 0.09831775588527714, 'batch_size': 2976, 'optimizer': 'Adam'}.
2026-06-15 17:21:58,358 - optuna.study.study - INFO - Trial 49 finished with values: [0.0273557689772676, 0.0037427155201286088, 0.0131299356409845] and parameters: {'n_layers': 2, 'embedding_dim': 128, 'lr': 0.0003649621407716159, 'lambda_val': 0.042138402944349104, 'batch_size': 1866, 'optimizer': 'RMSprop'}.
2026-06-15 17:24:56,242 - optuna.study.study - INFO - Trial 50 finished with values: [0.04800313948232081, 0.006113939312747002, 0.02350882737118874] and parameters: {'n_layers': 3, 'embedding_dim': 96, 'lr': 0.0002845041667420409, 'lambda_val': 0.0031660536671449806, 'batch_size': 2933, 'optimizer': 'Adam'}.
2026-06-15 17:25:23,208 - experiment_functions - INFO - Early stopping at epoch 550. Best Metrics: (0.004632047343103628, 0.000577734610489651, 0.0022901572353437546)
2026-06-15 17:25:23,284 - optuna.study.study - INFO - Trial 51 finished with values: [0.004632047343103628, 0.000577734610489651, 0.0022901572353437546] and parameters: {'n_layers': 4, 'embedding_dim': 96, 'lr': 0.012030553977889366, 'lambda_val': 0.09831775588527714, 'batch_size': 2556, 'optimizer': 'Adam'}.
2026-06-15 17:25:46,634 - experiment_functions - INFO - Early stopping at epoch 500. Best Metrics: (0.0005314528839446005, 7.703128139862015e-05, 0.0002484371688319769)
2026-06-15 17:25:46,763 - optuna.study.study - INFO - Trial 52 finished with values: [0.0005314528839446005, 7.703128139862015e-05, 0.0002484371688319769] and parameters: {'n_layers': 2, 'embedding_dim': 128, 'lr': 0.05792036935472597, 'lambda_val': 4.740391388963357e-05, 'batch_size': 1638, 'optimizer': 'SGD'}.
2026-06-15 17:26:13,318 - experiment_functions - INFO - Early stopping at epoch 500. Best Metrics: (0.0006203974565615278, 9.377721213745061e-05, 0.0002718993223946706)
2026-06-15 17:26:13,404 - optuna.study.study - INFO - Trial 53 finished with values: [0.0006203974565615278, 9.377721213745061e-05, 0.0002718993223946706] and parameters: {'n_layers': 2, 'embedding_dim': 256, 'lr': 0.04915150101302751, 'lambda_val': 6.461965909578869e-06, 'batch_size': 3237, 'optimizer': 'SGD'}.
2026-06-15 17:28:02,269 - experiment_functions - INFO - Early stopping at epoch 2450. Best Metrics: (0.04116777528020642, 0.005182865563668029, 0.019891356055628775)
2026-06-15 17:28:02,412 - optuna.study.study - INFO - Trial 54 finished with values: [0.04116777528020642, 0.005182865563668029, 0.019891356055628775] and parameters: {'n_layers': 3, 'embedding_dim': 96, 'lr': 0.0008007729293904306, 'lambda_val': 0.004749408595262452, 'batch_size': 748, 'optimizer': 'Adam'}.
2026-06-15 17:28:38,645 - experiment_functions - INFO - Early stopping at epoch 750. Best Metrics: (0.0005640963220336298, 8.540424676803537e-05, 0.00024331784211743704)
2026-06-15 17:28:38,909 - optuna.study.study - INFO - Trial 55 finished with values: [0.0005640963220336298, 8.540424676803537e-05, 0.00024331784211743704] and parameters: {'n_layers': 3, 'embedding_dim': 128, 'lr': 1.0018834194534063e-05, 'lambda_val': 0.07774271070529826, 'batch_size': 1638, 'optimizer': 'Adam'}.
2026-06-15 17:29:14,103 - experiment_functions - INFO - Early stopping at epoch 650. Best Metrics: (0.02126085054897146, 0.0026458570567352135, 0.009614560547668733)
2026-06-15 17:29:14,311 - optuna.study.study - INFO - Trial 56 finished with values: [0.02126085054897146, 0.0026458570567352135, 0.009614560547668733] and parameters: {'n_layers': 4, 'embedding_dim': 128, 'lr': 0.0013130193047400018, 'lambda_val': 0.005442003982181833, 'batch_size': 3109, 'optimizer': 'RMSprop'}.
2026-06-15 17:29:51,889 - experiment_functions - INFO - Early stopping at epoch 800. Best Metrics: (0.06670514317773732, 0.008016277044678144, 0.03356092979905176)
2026-06-15 17:29:51,974 - optuna.study.study - INFO - Trial 57 finished with values: [0.06670514317773732, 0.008016277044678144, 0.03356092979905176] and parameters: {'n_layers': 2, 'embedding_dim': 128, 'lr': 0.0013130193047400018, 'lambda_val': 7.673494845521761e-06, 'batch_size': 3339, 'optimizer': 'RMSprop'}.
2026-06-15 17:30:29,829 - experiment_functions - INFO - Early stopping at epoch 900. Best Metrics: (0.03291425564490707, 0.004142943264786657, 0.015874606930591385)
2026-06-15 17:30:29,899 - optuna.study.study - INFO - Trial 58 finished with values: [0.03291425564490707, 0.004142943264786657, 0.015874606930591385] and parameters: {'n_layers': 4, 'embedding_dim': 32, 'lr': 0.0010587621938481125, 'lambda_val': 0.00041942469140426685, 'batch_size': 4004, 'optimizer': 'Adam'}.
2026-06-15 17:31:49,565 - experiment_functions - INFO - Early stopping at epoch 2050. Best Metrics: (0.006482863261416373, 0.000941121307522272, 0.003008138622943397)
2026-06-15 17:31:49,640 - optuna.study.study - INFO - Trial 59 finished with values: [0.006482863261416373, 0.000941121307522272, 0.003008138622943397] and parameters: {'n_layers': 3, 'embedding_dim': 32, 'lr': 0.0024881813926483014, 'lambda_val': 0.07774271070529826, 'batch_size': 1875, 'optimizer': 'RMSprop'}.
2026-06-15 17:35:15,276 - optuna.study.study - INFO - Trial 60 finished with values: [0.05758998453222574, 0.0064656038582624415, 0.026985035486900424] and parameters: {'n_layers': 2, 'embedding_dim': 256, 'lr': 0.00859558839759563, 'lambda_val': 0.0002091155632832413, 'batch_size': 3978, 'optimizer': 'RMSprop'}.
2026-06-15 17:35:40,331 - experiment_functions - INFO - Early stopping at epoch 550. Best Metrics: (0.03406366396666877, 0.004248442628441289, 0.016948282230327197)
2026-06-15 17:35:41,089 - optuna.study.study - INFO - Trial 61 finished with values: [0.03406366396666877, 0.004248442628441289, 0.016948282230327197] and parameters: {'n_layers': 2, 'embedding_dim': 96, 'lr': 0.022766173337797516, 'lambda_val': 1.5130950471060717e-06, 'batch_size': 748, 'optimizer': 'Adam'}.
2026-06-15 17:36:13,256 - experiment_functions - INFO - Early stopping at epoch 500. Best Metrics: (0.00047160257166788073, 7.53566883247371e-05, 0.00022717694519654822)
2026-06-15 17:36:13,354 - optuna.study.study - INFO - Trial 62 finished with values: [0.00047160257166788073, 7.53566883247371e-05, 0.00022717694519654822] and parameters: {'n_layers': 4, 'embedding_dim': 256, 'lr': 0.03084046980611842, 'lambda_val': 2.2622744314412e-06, 'batch_size': 3500, 'optimizer': 'SGD'}.
2026-06-15 17:36:42,705 - experiment_functions - INFO - Early stopping at epoch 750. Best Metrics: (0.008793351070130902, 0.0011169535802799918, 0.003933495039887301)
2026-06-15 17:36:42,765 - optuna.study.study - INFO - Trial 63 finished with values: [0.008793351070130902, 0.0011169535802799918, 0.003933495039887301] and parameters: {'n_layers': 1, 'embedding_dim': 32, 'lr': 0.02606777968777775, 'lambda_val': 0.07774271070529826, 'batch_size': 2974, 'optimizer': 'RMSprop'}.
2026-06-15 17:39:22,946 - optuna.study.study - INFO - Trial 64 finished with values: [0.03074408843087419, 0.0037996516846406326, 0.014638131371590824] and parameters: {'n_layers': 4, 'embedding_dim': 32, 'lr': 0.0036742654809996723, 'lambda_val': 2.0623181656245837e-06, 'batch_size': 1425, 'optimizer': 'RMSprop'}.
2026-06-15 17:40:56,681 - experiment_functions - INFO - Early stopping at epoch 2250. Best Metrics: (0.010811202751638955, 0.0014451738227610692, 0.005234771046714144)
2026-06-15 17:40:57,003 - optuna.study.study - INFO - Trial 65 finished with values: [0.010811202751638955, 0.0014451738227610692, 0.005234771046714144] and parameters: {'n_layers': 2, 'embedding_dim': 96, 'lr': 0.0008257854890964482, 'lambda_val': 0.09716580295971683, 'batch_size': 2835, 'optimizer': 'Adam'}.
2026-06-15 17:41:18,039 - experiment_functions - INFO - Early stopping at epoch 500. Best Metrics: (0.0005744890966632786, 7.368209525085403e-05, 0.0002121954887000513)
2026-06-15 17:41:18,186 - optuna.study.study - INFO - Trial 66 finished with values: [0.0005744890966632786, 7.368209525085403e-05, 0.0002121954887000513] and parameters: {'n_layers': 1, 'embedding_dim': 64, 'lr': 1.0952121952475175e-05, 'lambda_val': 8.19246360027129e-06, 'batch_size': 907, 'optimizer': 'RMSprop'}.
2026-06-15 17:41:41,517 - experiment_functions - INFO - Early stopping at epoch 550. Best Metrics: (0.021911540201108935, 0.002568825775336594, 0.009884249948147765)
2026-06-15 17:41:41,608 - optuna.study.study - INFO - Trial 67 finished with values: [0.021911540201108935, 0.002568825775336594, 0.009884249948147765] and parameters: {'n_layers': 3, 'embedding_dim': 32, 'lr': 0.012090903971489965, 'lambda_val': 0.0021104984649676414, 'batch_size': 2256, 'optimizer': 'Adam'}.
2026-06-15 17:42:04,087 - experiment_functions - INFO - Early stopping at epoch 550. Best Metrics: (0.032015905655162574, 0.004080983321052984, 0.015386804157690613)
2026-06-15 17:42:04,195 - optuna.study.study - INFO - Trial 68 finished with values: [0.032015905655162574, 0.004080983321052984, 0.015386804157690613] and parameters: {'n_layers': 1, 'embedding_dim': 32, 'lr': 0.04915150101302751, 'lambda_val': 1.5130950471060717e-06, 'batch_size': 3620, 'optimizer': 'Adam'}.
2026-06-15 17:42:34,601 - experiment_functions - INFO - Early stopping at epoch 650. Best Metrics: (0.029360653270639192, 0.003769509009310738, 0.013412279937215455)
2026-06-15 17:42:34,936 - optuna.study.study - INFO - Trial 69 finished with values: [0.029360653270639192, 0.003769509009310738, 0.013412279937215455] and parameters: {'n_layers': 2, 'embedding_dim': 128, 'lr': 0.002670491335680087, 'lambda_val': 0.02514504131117439, 'batch_size': 2835, 'optimizer': 'Adam'}.
2026-06-15 17:42:58,060 - experiment_functions - INFO - Early stopping at epoch 500. Best Metrics: (0.00043805571436693525, 6.865831602920491e-05, 0.00019654208506760223)
2026-06-15 17:42:58,431 - optuna.study.study - INFO - Trial 70 finished with values: [0.00043805571436693525, 6.865831602920491e-05, 0.00019654208506760223] and parameters: {'n_layers': 2, 'embedding_dim': 128, 'lr': 0.0008007729293904306, 'lambda_val': 0.0034870006252512636, 'batch_size': 993, 'optimizer': 'SGD'}.
2026-06-15 17:43:37,013 - experiment_functions - INFO - Early stopping at epoch 800. Best Metrics: (0.02580314946279816, 0.0028987206108915535, 0.011319006413599977)
2026-06-15 17:43:37,085 - optuna.study.study - INFO - Trial 71 finished with values: [0.02580314946279816, 0.0028987206108915535, 0.011319006413599977] and parameters: {'n_layers': 3, 'embedding_dim': 32, 'lr': 0.02606777968777775, 'lambda_val': 5.956037576324779e-06, 'batch_size': 2974, 'optimizer': 'Adam'}.
2026-06-15 17:44:00,463 - experiment_functions - INFO - Early stopping at epoch 500. Best Metrics: (0.0005164898622159396, 8.205506062026927e-05, 0.00022179519902364178)
2026-06-15 17:44:00,547 - optuna.study.study - INFO - Trial 72 finished with values: [0.0005164898622159396, 8.205506062026927e-05, 0.00022179519902364178] and parameters: {'n_layers': 2, 'embedding_dim': 128, 'lr': 0.0003649621407716159, 'lambda_val': 0.042138402944349104, 'batch_size': 1866, 'optimizer': 'SGD'}.
2026-06-15 17:44:38,422 - experiment_functions - INFO - Early stopping at epoch 800. Best Metrics: (0.016708496411979263, 0.001969321454886463, 0.007435118623692304)
2026-06-15 17:44:38,506 - optuna.study.study - INFO - Trial 73 finished with values: [0.016708496411979263, 0.001969321454886463, 0.007435118623692304] and parameters: {'n_layers': 1, 'embedding_dim': 256, 'lr': 0.002670491335680087, 'lambda_val': 0.09716580295971683, 'batch_size': 2336, 'optimizer': 'Adam'}.
2026-06-15 17:47:46,870 - optuna.study.study - INFO - Trial 74 finished with values: [0.05881192553950673, 0.007155536204702258, 0.030500271430614352] and parameters: {'n_layers': 3, 'embedding_dim': 128, 'lr': 0.0008105588166462481, 'lambda_val': 4.411051153283134e-06, 'batch_size': 738, 'optimizer': 'RMSprop'}.
2026-06-15 17:48:41,037 - experiment_functions - INFO - Early stopping at epoch 1350. Best Metrics: (0.04191356740455971, 0.005085739165382813, 0.019772038450881383)
2026-06-15 17:48:41,215 - optuna.study.study - INFO - Trial 75 finished with values: [0.04191356740455971, 0.005085739165382813, 0.019772038450881383] and parameters: {'n_layers': 2, 'embedding_dim': 32, 'lr': 0.001479782641411582, 'lambda_val': 0.005539897590159512, 'batch_size': 1650, 'optimizer': 'RMSprop'}.
2026-06-15 17:49:25,651 - experiment_functions - INFO - Early stopping at epoch 900. Best Metrics: (0.08676708660693012, 0.010446111594882445, 0.045552005082138164)
2026-06-15 17:49:25,745 - optuna.study.study - INFO - Trial 76 finished with values: [0.08676708660693012, 0.010446111594882445, 0.045552005082138164] and parameters: {'n_layers': 1, 'embedding_dim': 256, 'lr': 0.0036742654809996723, 'lambda_val': 1.7187471777464757e-05, 'batch_size': 1420, 'optimizer': 'Adam'}.
2026-06-15 17:52:26,974 - optuna.study.study - INFO - Trial 77 finished with values: [0.08228880827649958, 0.010255207984459778, 0.04511151879578159] and parameters: {'n_layers': 2, 'embedding_dim': 128, 'lr': 0.0003649621407716159, 'lambda_val': 1.5130950471060717e-06, 'batch_size': 3620, 'optimizer': 'RMSprop'}.
2026-06-15 17:52:53,411 - experiment_functions - INFO - Early stopping at epoch 550. Best Metrics: (0.032567408446418464, 0.0037829057539018013, 0.015115562643832138)
2026-06-15 17:52:53,513 - optuna.study.study - INFO - Trial 78 finished with values: [0.032567408446418464, 0.0037829057539018013, 0.015115562643832138] and parameters: {'n_layers': 2, 'embedding_dim': 128, 'lr': 0.04915150101302751, 'lambda_val': 4.740391388963357e-05, 'batch_size': 3620, 'optimizer': 'Adam'}.
2026-06-15 17:53:19,705 - experiment_functions - INFO - Early stopping at epoch 500. Best Metrics: (0.000478457209455006, 7.033290910308795e-05, 0.00021279635117110954)
