2026-06-14 15:41:34,793 - optuna.study.study - INFO - Trial 185 finished with values: [0.07476327850782556, 0.009407863889074953, 0.038168372477424425] and parameters: {'n_layers': 1, 'embedding_dim': 64, 'lr': 0.0009052352884581927, 'lambda_val': 0.00851359441108956, 'batch_size': 2658, 'optimizer': 'Adam'}.
2026-06-14 15:42:36,472 - experiment_functions - INFO - Early stopping at epoch 1400. Best Metrics: (0.07586198814126592, 0.009265523477794895, 0.04137070321653902)
2026-06-14 15:42:36,849 - optuna.study.study - INFO - Trial 186 finished with values: [0.07586198814126592, 0.009265523477794895, 0.04137070321653902] and parameters: {'n_layers': 2, 'embedding_dim': 96, 'lr': 0.0009052352884581927, 'lambda_val': 2.113988332261468e-05, 'batch_size': 2310, 'optimizer': 'RMSprop'}.
2026-06-14 15:45:15,222 - optuna.study.study - INFO - Trial 187 finished with values: [0.049403268216396054, 0.0073095987674994985, 0.027501628751573717] and parameters: {'n_layers': 1, 'embedding_dim': 96, 'lr': 0.0006670220003270122, 'lambda_val': 0.00851359441108956, 'batch_size': 1311, 'optimizer': 'Adam'}.
2026-06-14 15:46:00,814 - experiment_functions - INFO - Early stopping at epoch 950. Best Metrics: (0.031110079951945587, 0.003903476455221381, 0.013855171557160054)
2026-06-14 15:46:00,887 - optuna.study.study - INFO - Trial 188 finished with values: [0.031110079951945587, 0.003903476455221381, 0.013855171557160054] and parameters: {'n_layers': 3, 'embedding_dim': 128, 'lr': 0.001866327471651579, 'lambda_val': 0.0033545157335197707, 'batch_size': 1163, 'optimizer': 'Adam'}.
2026-06-14 15:48:43,374 - optuna.study.study - INFO - Trial 189 finished with values: [0.043481247467713195, 0.005571371156808896, 0.02046645701602711] and parameters: {'n_layers': 1, 'embedding_dim': 128, 'lr': 0.049137531063899446, 'lambda_val': 0.0009668484743513772, 'batch_size': 2658, 'optimizer': 'RMSprop'}.
2026-06-14 15:51:30,693 - optuna.study.study - INFO - Trial 190 finished with values: [0.03918586521642817, 0.004317100944470493, 0.017616641028807316] and parameters: {'n_layers': 2, 'embedding_dim': 96, 'lr': 0.012247370054838723, 'lambda_val': 2.6136942653041923e-05, 'batch_size': 1311, 'optimizer': 'Adam'}.
2026-06-14 15:54:04,655 - optuna.study.study - INFO - Trial 191 finished with values: [0.0013310214057142772, 0.00022774465804809433, 0.0006571777126598184] and parameters: {'n_layers': 1, 'embedding_dim': 96, 'lr': 0.00020385739434262702, 'lambda_val': 5.588502828653658e-06, 'batch_size': 3602, 'optimizer': 'Adam'}.
2026-06-14 15:56:52,870 - optuna.study.study - INFO - Trial 192 finished with values: [0.04878620464726513, 0.005350324871056333, 0.022416110802977438] and parameters: {'n_layers': 2, 'embedding_dim': 96, 'lr': 0.014831110208259727, 'lambda_val': 0.00013410017154667016, 'batch_size': 3193, 'optimizer': 'RMSprop'}.
2026-06-14 15:57:19,205 - experiment_functions - INFO - Early stopping at epoch 550. Best Metrics: (0.03821089942580013, 0.004375711702056401, 0.01692601545685486)
2026-06-14 15:57:19,299 - optuna.study.study - INFO - Trial 193 finished with values: [0.03821089942580013, 0.004375711702056401, 0.01692601545685486] and parameters: {'n_layers': 2, 'embedding_dim': 128, 'lr': 0.012247370054838723, 'lambda_val': 2.6136942653041923e-05, 'batch_size': 2715, 'optimizer': 'Adam'}.
2026-06-14 16:00:24,980 - optuna.study.study - INFO - Trial 194 finished with values: [0.04926109785806582, 0.0050924375376783446, 0.022480507199235233] and parameters: {'n_layers': 4, 'embedding_dim': 96, 'lr': 0.014831110208259727, 'lambda_val': 1.5625579511947262e-06, 'batch_size': 2879, 'optimizer': 'RMSprop'}.
2026-06-14 16:03:05,844 - optuna.study.study - INFO - Trial 195 finished with values: [0.045734741029152745, 0.005253198472771116, 0.021757602264428928] and parameters: {'n_layers': 2, 'embedding_dim': 64, 'lr': 0.006265835000649171, 'lambda_val': 5.588502828653658e-06, 'batch_size': 1311, 'optimizer': 'RMSprop'}.
2026-06-14 16:07:15,779 - optuna.study.study - INFO - Trial 196 finished with values: [0.04974742925262113, 0.005303436264987609, 0.022116455818675662] and parameters: {'n_layers': 4, 'embedding_dim': 256, 'lr': 0.006265835000649171, 'lambda_val': 5.588502828653658e-06, 'batch_size': 3998, 'optimizer': 'RMSprop'}.
2026-06-14 16:09:56,631 - optuna.study.study - INFO - Trial 197 finished with values: [0.08674836079092207, 0.010873132828722619, 0.048450038938298697] and parameters: {'n_layers': 1, 'embedding_dim': 64, 'lr': 0.0009052352884581927, 'lambda_val': 2.113988332261468e-05, 'batch_size': 1970, 'optimizer': 'RMSprop'}.
2026-06-14 16:10:32,129 - experiment_functions - INFO - Early stopping at epoch 800. Best Metrics: (0.07156184192106016, 0.008908835153057806, 0.03809943591651757)
2026-06-14 16:10:32,207 - optuna.study.study - INFO - Trial 198 finished with values: [0.07156184192106016, 0.008908835153057806, 0.03809943591651757] and parameters: {'n_layers': 1, 'embedding_dim': 128, 'lr': 0.0059087621734932, 'lambda_val': 8.380696475709368e-06, 'batch_size': 1067, 'optimizer': 'Adam'}.
2026-06-14 16:10:58,121 - experiment_functions - INFO - Early stopping at epoch 550. Best Metrics: (0.020711912611075904, 0.0024733739701252597, 0.010562831999594676)
2026-06-14 16:10:58,586 - optuna.study.study - INFO - Trial 199 finished with values: [0.020711912611075904, 0.0024733739701252597, 0.010562831999594676] and parameters: {'n_layers': 2, 'embedding_dim': 128, 'lr': 0.049137531063899446, 'lambda_val': 1.4065920828427494e-05, 'batch_size': 1772, 'optimizer': 'RMSprop'}.
2026-06-14 16:12:17,822 - experiment_functions - INFO - Early stopping at epoch 1750. Best Metrics: (0.05375104034471848, 0.006308192109317437, 0.02535511671805578)
2026-06-14 16:12:17,900 - optuna.study.study - INFO - Trial 200 finished with values: [0.05375104034471848, 0.006308192109317437, 0.02535511671805578] and parameters: {'n_layers': 2, 'embedding_dim': 128, 'lr': 0.001701997594477999, 'lambda_val': 2.113988332261468e-05, 'batch_size': 2310, 'optimizer': 'RMSprop'}.
2026-06-14 16:15:01,415 - optuna.study.study - INFO - Trial 201 finished with values: [0.08443680734681347, 0.010901600910978632, 0.04688615401732353] and parameters: {'n_layers': 1, 'embedding_dim': 96, 'lr': 0.0006670220003270122, 'lambda_val': 0.00015974311639523663, 'batch_size': 3185, 'optimizer': 'Adam'}.
2026-06-14 16:15:55,367 - experiment_functions - INFO - Early stopping at epoch 1350. Best Metrics: (0.06534096790428404, 0.007927523611762343, 0.03308764000136755)
2026-06-14 16:15:55,452 - optuna.study.study - INFO - Trial 202 finished with values: [0.06534096790428404, 0.007927523611762343, 0.03308764000136755] and parameters: {'n_layers': 2, 'embedding_dim': 32, 'lr': 0.001483277802508331, 'lambda_val': 0.0004821335138179686, 'batch_size': 1092, 'optimizer': 'RMSprop'}.
2026-06-14 16:19:19,811 - optuna.study.study - INFO - Trial 203 finished with values: [0.04989416401478991, 0.005191238529037444, 0.02306586378104302] and parameters: {'n_layers': 2, 'embedding_dim': 256, 'lr': 0.014831110208259727, 'lambda_val': 5.588502828653658e-06, 'batch_size': 3193, 'optimizer': 'Adam'}.
2026-06-14 16:19:58,182 - experiment_functions - INFO - Early stopping at epoch 900. Best Metrics: (0.07091843158077077, 0.008835153057806954, 0.03795331123145101)
2026-06-14 16:19:58,700 - optuna.study.study - INFO - Trial 204 finished with values: [0.07091843158077077, 0.008835153057806954, 0.03795331123145101] and parameters: {'n_layers': 2, 'embedding_dim': 64, 'lr': 0.001866327471651579, 'lambda_val': 2.113988332261468e-05, 'batch_size': 1532, 'optimizer': 'Adam'}.
2026-06-14 16:20:24,054 - experiment_functions - INFO - Early stopping at epoch 650. Best Metrics: (0.0005180759018104086, 8.038046754638624e-05, 0.00024302648026889895)
2026-06-14 16:20:24,142 - optuna.study.study - INFO - Trial 205 finished with values: [0.0005180759018104086, 8.038046754638624e-05, 0.00024302648026889895] and parameters: {'n_layers': 1, 'embedding_dim': 32, 'lr': 2.9855291659303064e-05, 'lambda_val': 0.0004821335138179686, 'batch_size': 2658, 'optimizer': 'RMSprop'}.
2026-06-14 16:20:56,268 - experiment_functions - INFO - Early stopping at epoch 650. Best Metrics: (0.0820565909330132, 0.010027463326411683, 0.04305571842648967)
2026-06-14 16:20:56,341 - optuna.study.study - INFO - Trial 206 finished with values: [0.0820565909330132, 0.010027463326411683, 0.04305571842648967] and parameters: {'n_layers': 1, 'embedding_dim': 256, 'lr': 0.006265835000649171, 'lambda_val': 8.380696475709368e-06, 'batch_size': 2745, 'optimizer': 'Adam'}.
2026-06-14 16:21:21,015 - experiment_functions - INFO - Early stopping at epoch 600. Best Metrics: (0.06984061232872593, 0.008739701252595619, 0.03649608319693099)
2026-06-14 16:21:21,110 - optuna.study.study - INFO - Trial 207 finished with values: [0.06984061232872593, 0.008739701252595619, 0.03649608319693099] and parameters: {'n_layers': 1, 'embedding_dim': 32, 'lr': 0.01359759229313602, 'lambda_val': 1.1933812384845947e-05, 'batch_size': 3193, 'optimizer': 'Adam'}.
2026-06-14 16:21:47,810 - experiment_functions - INFO - Early stopping at epoch 600. Best Metrics: (0.06952013550486964, 0.008299283274164378, 0.03440981338627758)
2026-06-14 16:21:47,902 - optuna.study.study - INFO - Trial 208 finished with values: [0.06952013550486964, 0.008299283274164378, 0.03440981338627758] and parameters: {'n_layers': 1, 'embedding_dim': 128, 'lr': 0.01359759229313602, 'lambda_val': 1.1933812384845947e-05, 'batch_size': 3602, 'optimizer': 'Adam'}.
2026-06-14 16:24:30,273 - optuna.study.study - INFO - Trial 209 finished with values: [0.09464485962856051, 0.011407328019291313, 0.050377936737678555] and parameters: {'n_layers': 1, 'embedding_dim': 96, 'lr': 0.001866327471651579, 'lambda_val': 5.9543267651607335e-05, 'batch_size': 1067, 'optimizer': 'RMSprop'}.
2026-06-14 16:25:09,027 - experiment_functions - INFO - Early stopping at epoch 900. Best Metrics: (0.07027835452753997, 0.008528702525286357, 0.03554433398191931)
2026-06-14 16:25:09,671 - optuna.study.study - INFO - Trial 210 finished with values: [0.07027835452753997, 0.008528702525286357, 0.03554433398191931] and parameters: {'n_layers': 2, 'embedding_dim': 64, 'lr': 0.001866327471651579, 'lambda_val': 2.3856782843124496e-06, 'batch_size': 3193, 'optimizer': 'Adam'}.
2026-06-14 16:26:35,430 - experiment_functions - INFO - Early stopping at epoch 1850. Best Metrics: (0.02994944576410991, 0.0033625828923571567, 0.013646235563250479)
2026-06-14 16:26:35,506 - optuna.study.study - INFO - Trial 211 finished with values: [0.02994944576410991, 0.0033625828923571567, 0.013646235563250479] and parameters: {'n_layers': 4, 'embedding_dim': 96, 'lr': 0.012247370054838723, 'lambda_val': 5.588502828653658e-06, 'batch_size': 1311, 'optimizer': 'Adam'}.
2026-06-14 16:29:12,192 - optuna.study.study - INFO - Trial 212 finished with values: [0.0776222795640826, 0.009672449594748476, 0.04344565769745886] and parameters: {'n_layers': 2, 'embedding_dim': 32, 'lr': 0.0009052352884581927, 'lambda_val': 8.380696475709368e-06, 'batch_size': 1067, 'optimizer': 'Adam'}.
2026-06-14 16:31:45,832 - optuna.study.study - INFO - Trial 213 finished with values: [0.04763113194840638, 0.0067151182262710175, 0.027795896061545425] and parameters: {'n_layers': 1, 'embedding_dim': 64, 'lr': 0.0009052352884581927, 'lambda_val': 2.113988332261468e-05, 'batch_size': 569, 'optimizer': 'RMSprop'}.
2026-06-14 16:32:46,763 - experiment_functions - INFO - Early stopping at epoch 1550. Best Metrics: (0.07782089653663694, 0.009513363252729588, 0.04025512122928992)
2026-06-14 16:32:46,835 - optuna.study.study - INFO - Trial 214 finished with values: [0.07782089653663694, 0.009513363252729588, 0.04025512122928992] and parameters: {'n_layers': 1, 'embedding_dim': 32, 'lr': 0.0026515351587830605, 'lambda_val': 5.588502828653658e-06, 'batch_size': 2372, 'optimizer': 'RMSprop'}.
2026-06-14 16:33:16,478 - experiment_functions - INFO - Early stopping at epoch 700. Best Metrics: (0.06347176098808124, 0.007793556165851698, 0.031943559582757186)
2026-06-14 16:33:16,536 - optuna.study.study - INFO - Trial 215 finished with values: [0.06347176098808124, 0.007793556165851698, 0.031943559582757186] and parameters: {'n_layers': 1, 'embedding_dim': 96, 'lr': 0.006265835000649171, 'lambda_val': 0.0012895617288533922, 'batch_size': 1311, 'optimizer': 'Adam'}.
2026-06-14 16:34:24,209 - experiment_functions - INFO - Early stopping at epoch 1600. Best Metrics: (0.049652651812240295, 0.006098867975082055, 0.02298774005867401)
2026-06-14 16:34:24,301 - optuna.study.study - INFO - Trial 216 finished with values: [0.049652651812240295, 0.006098867975082055, 0.02298774005867401] and parameters: {'n_layers': 2, 'embedding_dim': 96, 'lr': 0.001866327471651579, 'lambda_val': 0.0003336301702722937, 'batch_size': 1532, 'optimizer': 'RMSprop'}.
2026-06-14 16:36:03,199 - experiment_functions - INFO - Early stopping at epoch 2550. Best Metrics: (0.06632469251259804, 0.008458369616183266, 0.03382117416189553)
2026-06-14 16:36:03,276 - optuna.study.study - INFO - Trial 217 finished with values: [0.06632469251259804, 0.008458369616183266, 0.03382117416189553] and parameters: {'n_layers': 1, 'embedding_dim': 64, 'lr': 0.0009052352884581927, 'lambda_val': 0.01123733558129611, 'batch_size': 2310, 'optimizer': 'Adam'}.
2026-06-14 16:37:17,497 - experiment_functions - INFO - Early stopping at epoch 1850. Best Metrics: (0.09419507779113025, 0.011661866166521536, 0.049432672854627366)
2026-06-14 16:37:17,566 - optuna.study.study - INFO - Trial 218 finished with values: [0.09419507779113025, 0.011661866166521536, 0.049432672854627366] and parameters: {'n_layers': 1, 'embedding_dim': 64, 'lr': 0.001483277802508331, 'lambda_val': 0.0004821335138179686, 'batch_size': 3193, 'optimizer': 'Adam'}.
2026-06-14 16:39:51,059 - optuna.study.study - INFO - Trial 219 finished with values: [0.08622435741554442, 0.010819545850358365, 0.04804730574076476] and parameters: {'n_layers': 1, 'embedding_dim': 32, 'lr': 0.0012088550950310484, 'lambda_val': 0.00019765543294629712, 'batch_size': 2310, 'optimizer': 'RMSprop'}.
2026-06-14 16:42:32,645 - optuna.study.study - INFO - Trial 220 finished with values: [0.09223122953983783, 0.011638421863487172, 0.04974119196984847] and parameters: {'n_layers': 1, 'embedding_dim': 96, 'lr': 0.0007227490490114654, 'lambda_val': 0.0009668484743513772, 'batch_size': 2843, 'optimizer': 'RMSprop'}.
2026-06-14 16:45:10,372 - optuna.study.study - INFO - Trial 221 finished with values: [0.04034004739203017, 0.004809431308192109, 0.01912201845364661] and parameters: {'n_layers': 2, 'embedding_dim': 64, 'lr': 0.006265835000649171, 'lambda_val': 0.0002025297893238039, 'batch_size': 1311, 'optimizer': 'RMSprop'}.
2026-06-14 16:45:52,070 - experiment_functions - INFO - Early stopping at epoch 1050. Best Metrics: (0.07457630127451001, 0.0092454283609083, 0.03850093360964281)
2026-06-14 16:45:52,145 - optuna.study.study - INFO - Trial 222 finished with values: [0.07457630127451001, 0.0092454283609083, 0.03850093360964281] and parameters: {'n_layers': 1, 'embedding_dim': 32, 'lr': 0.0026515351587830605, 'lambda_val': 0.0004821335138179686, 'batch_size': 2372, 'optimizer': 'RMSprop'}.
2026-06-14 16:46:30,546 - experiment_functions - INFO - Early stopping at epoch 1000. Best Metrics: (0.0005543654230692231, 6.698372295532186e-05, 0.00020098539120255005)
2026-06-14 16:46:30,635 - optuna.study.study - INFO - Trial 223 finished with values: [0.0005543654230692231, 6.698372295532186e-05, 0.00020098539120255005] and parameters: {'n_layers': 1, 'embedding_dim': 64, 'lr': 1.080717577011629e-05, 'lambda_val': 2.113988332261468e-05, 'batch_size': 984, 'optimizer': 'RMSprop'}.
2026-06-14 16:46:51,675 - experiment_functions - INFO - Early stopping at epoch 500. Best Metrics: (0.0005293157435355999, 7.53566883247371e-05, 0.00023371935196877305)
2026-06-14 16:46:52,148 - optuna.study.study - INFO - Trial 224 finished with values: [0.0005293157435355999, 7.53566883247371e-05, 0.00023371935196877305] and parameters: {'n_layers': 2, 'embedding_dim': 64, 'lr': 0.006265835000649171, 'lambda_val': 5.588502828653658e-06, 'batch_size': 3389, 'optimizer': 'SGD'}.
2026-06-14 16:49:33,001 - optuna.study.study - INFO - Trial 225 finished with values: [0.08784917380680644, 0.011089155335253535, 0.049474385870663745] and parameters: {'n_layers': 1, 'embedding_dim': 96, 'lr': 0.0009052352884581927, 'lambda_val': 5.9543267651607335e-05, 'batch_size': 1532, 'optimizer': 'RMSprop'}.
2026-06-14 16:50:30,279 - experiment_functions - INFO - Early stopping at epoch 1200. Best Metrics: (0.1014838545804305, 0.012226204032420123, 0.05343643425556178)
2026-06-14 16:50:30,352 - optuna.study.study - INFO - Trial 226 finished with values: [0.1014838545804305, 0.012226204032420123, 0.05343643425556178] and parameters: {'n_layers': 1, 'embedding_dim': 256, 'lr': 0.001866327471651579, 'lambda_val': 5.588502828653658e-06, 'batch_size': 3345, 'optimizer': 'Adam'}.
2026-06-14 16:53:12,771 - optuna.study.study - INFO - Trial 227 finished with values: [0.09821478967893506, 0.011973340478263782, 0.052758795718724334] and parameters: {'n_layers': 1, 'embedding_dim': 96, 'lr': 0.001483277802508331, 'lambda_val': 5.9543267651607335e-05, 'batch_size': 1418, 'optimizer': 'RMSprop'}.
2026-06-14 16:55:43,631 - optuna.study.study - INFO - Trial 228 finished with values: [0.07675410352210822, 0.010035836291781099, 0.043690114838713386] and parameters: {'n_layers': 1, 'embedding_dim': 32, 'lr': 0.0009052352884581927, 'lambda_val': 0.0004821335138179686, 'batch_size': 2289, 'optimizer': 'Adam'}.
2026-06-14 16:58:25,935 - optuna.study.study - INFO - Trial 229 finished with values: [0.09644176193775787, 0.012058744725031816, 0.05393967619851054] and parameters: {'n_layers': 1, 'embedding_dim': 96, 'lr': 0.0009052352884581927, 'lambda_val': 0.00017929853037390874, 'batch_size': 2310, 'optimizer': 'RMSprop'}.
2026-06-14 16:58:53,462 - experiment_functions - INFO - Early stopping at epoch 550. Best Metrics: (0.04849179123892305, 0.005874472503181727, 0.022603012211978968)
2026-06-14 16:58:53,552 - optuna.study.study - INFO - Trial 230 finished with values: [0.04849179123892305, 0.005874472503181727, 0.022603012211978968] and parameters: {'n_layers': 3, 'embedding_dim': 128, 'lr': 0.006265835000649171, 'lambda_val': 1.1933812384845947e-05, 'batch_size': 3998, 'optimizer': 'Adam'}.
2026-06-14 16:59:13,810 - experiment_functions - INFO - Early stopping at epoch 500. Best Metrics: (0.00040529657425873917, 7.368209525085404e-05, 0.00020050537345487338)
2026-06-14 16:59:14,200 - optuna.study.study - INFO - Trial 231 finished with values: [0.00040529657425873917, 7.368209525085404e-05, 0.00020050537345487338] and parameters: {'n_layers': 1, 'embedding_dim': 64, 'lr': 0.0009052352884581927, 'lambda_val': 7.807398642673042e-06, 'batch_size': 1713, 'optimizer': 'SGD'}.
2026-06-14 17:01:33,990 - experiment_functions - INFO - Early stopping at epoch 3550. Best Metrics: (0.03576024573617936, 0.004124522740973944, 0.015993402806500807)
2026-06-14 17:01:34,068 - optuna.study.study - INFO - Trial 232 finished with values: [0.03576024573617936, 0.004124522740973944, 0.015993402806500807] and parameters: {'n_layers': 2, 'embedding_dim': 64, 'lr': 0.0059087621734932, 'lambda_val': 0.000402863900878484, 'batch_size': 1067, 'optimizer': 'Adam'}.
2026-06-14 17:04:38,277 - optuna.study.study - INFO - Trial 233 finished with values: [0.10420096451974763, 0.012879295331234511, 0.05721274249373535] and parameters: {'n_layers': 1, 'embedding_dim': 256, 'lr': 0.0009052352884581927, 'lambda_val': 1.2588658448852132e-05, 'batch_size': 1878, 'optimizer': 'RMSprop'}.
2026-06-14 17:05:05,781 - experiment_functions - INFO - Early stopping at epoch 650. Best Metrics: (0.0004911200617023304, 6.363453680755577e-05, 0.00019160313119007518)
2026-06-14 17:05:05,895 - optuna.study.study - INFO - Trial 234 finished with values: [0.0004911200617023304, 6.363453680755577e-05, 0.00019160313119007518] and parameters: {'n_layers': 1, 'embedding_dim': 128, 'lr': 4.4840904296993255e-05, 'lambda_val': 1.1933812384845947e-05, 'batch_size': 3602, 'optimizer': 'Adam'}.
2026-06-14 17:07:43,990 - optuna.study.study - INFO - Trial 235 finished with values: [0.09899597274145752, 0.012008506932815329, 0.05408176528990623] and parameters: {'n_layers': 1, 'embedding_dim': 64, 'lr': 0.0009052352884581927, 'lambda_val': 2.113988332261468e-05, 'batch_size': 3602, 'optimizer': 'RMSprop'}.
2026-06-14 17:10:28,687 - optuna.study.study - INFO - Trial 236 finished with values: [0.0844594339857548, 0.010896577131756983, 0.04771214023897547] and parameters: {'n_layers': 1, 'embedding_dim': 128, 'lr': 0.001252028349356115, 'lambda_val': 1.2588658448852132e-05, 'batch_size': 706, 'optimizer': 'Adam'}.
2026-06-14 17:10:55,742 - experiment_functions - INFO - Early stopping at epoch 650. Best Metrics: (0.025978875538726826, 0.0031348382343090626, 0.01199943670347912)
2026-06-14 17:10:55,817 - optuna.study.study - INFO - Trial 237 finished with values: [0.025978875538726826, 0.0031348382343090626, 0.01199943670347912] and parameters: {'n_layers': 1, 'embedding_dim': 96, 'lr': 0.012247370054838723, 'lambda_val': 0.00851359441108956, 'batch_size': 3163, 'optimizer': 'RMSprop'}.
2026-06-14 17:11:17,657 - experiment_functions - INFO - Early stopping at epoch 500. Best Metrics: (0.0003323245791207655, 5.6936164512023584e-05, 0.000158947437226578)
2026-06-14 17:11:17,732 - optuna.study.study - INFO - Trial 238 finished with values: [0.0003323245791207655, 5.6936164512023584e-05, 0.000158947437226578] and parameters: {'n_layers': 2, 'embedding_dim': 96, 'lr': 0.0009052352884581927, 'lambda_val': 0.00010850731668799077, 'batch_size': 2310, 'optimizer': 'SGD'}.
2026-06-14 17:11:46,082 - experiment_functions - INFO - Early stopping at epoch 650. Best Metrics: (0.015688102932828865, 0.0017934891821287425, 0.006699424528635628)
