2026-06-13 20:34:02,670 - optuna.study.study - INFO - Trial 93 finished with values: [0.01358328895703014, 0.0019525755241476322, 0.006408557304487556] and parameters: {'n_layers': 1, 'embedding_dim': 128, 'lr': 0.021823625397344976, 'lambda_val': 0.018328494161540542, 'batch_size': 688, 'optimizer': 'RMSprop'}.
2026-06-13 20:36:30,917 - experiment_functions - INFO - Early stopping at epoch 3800. Best Metrics: (0.04982522010355718, 0.007031616317234913, 0.02699320692164182)
2026-06-13 20:36:31,006 - optuna.study.study - INFO - Trial 94 finished with values: [0.04982522010355718, 0.007031616317234913, 0.02699320692164182] and parameters: {'n_layers': 2, 'embedding_dim': 64, 'lr': 0.0009822401593291786, 'lambda_val': 0.0005590603438440636, 'batch_size': 1677, 'optimizer': 'RMSprop'}.
2026-06-13 20:38:57,758 - optuna.study.study - INFO - Trial 95 finished with values: [0.013464170457359004, 0.00198439279255141, 0.006483368667470924] and parameters: {'n_layers': 1, 'embedding_dim': 64, 'lr': 0.052296616630871054, 'lambda_val': 0.009153220394863267, 'batch_size': 688, 'optimizer': 'RMSprop'}.
2026-06-13 20:39:37,463 - experiment_functions - INFO - Early stopping at epoch 950. Best Metrics: (0.042121229772977234, 0.00570533860271954, 0.021850119443840025)
2026-06-13 20:39:37,555 - optuna.study.study - INFO - Trial 96 finished with values: [0.042121229772977234, 0.00570533860271954, 0.021850119443840025] and parameters: {'n_layers': 3, 'embedding_dim': 64, 'lr': 0.0016889361681909714, 'lambda_val': 0.00035318754870590177, 'batch_size': 3699, 'optimizer': 'Adam'}.
2026-06-13 20:41:07,479 - experiment_functions - INFO - Early stopping at epoch 2400. Best Metrics: (0.01634178596574081, 0.002372898385692277, 0.00810598869036201)
2026-06-13 20:41:07,555 - optuna.study.study - INFO - Trial 97 finished with values: [0.01634178596574081, 0.002372898385692277, 0.00810598869036201] and parameters: {'n_layers': 1, 'embedding_dim': 64, 'lr': 0.0060199272034541455, 'lambda_val': 0.009153220394863267, 'batch_size': 3914, 'optimizer': 'RMSprop'}.
2026-06-13 20:41:32,523 - experiment_functions - INFO - Early stopping at epoch 550. Best Metrics: (0.008950342224308702, 0.0011387232902404715, 0.0043754996998136815)
2026-06-13 20:41:32,609 - optuna.study.study - INFO - Trial 98 finished with values: [0.008950342224308702, 0.0011387232902404715, 0.0043754996998136815] and parameters: {'n_layers': 4, 'embedding_dim': 96, 'lr': 0.052296616630871054, 'lambda_val': 4.1509980625924543e-05, 'batch_size': 2830, 'optimizer': 'RMSprop'}.
2026-06-13 20:41:56,348 - experiment_functions - INFO - Early stopping at epoch 550. Best Metrics: (0.014698678242862447, 0.0022205104159689197, 0.007698598338560775)
2026-06-13 20:41:56,417 - optuna.study.study - INFO - Trial 99 finished with values: [0.014698678242862447, 0.0022205104159689197, 0.007698598338560775] and parameters: {'n_layers': 2, 'embedding_dim': 96, 'lr': 0.024143923894547725, 'lambda_val': 0.0003351122520854177, 'batch_size': 818, 'optimizer': 'Adam'}.
2026-06-13 20:44:30,543 - experiment_functions - INFO - Early stopping at epoch 3100. Best Metrics: (0.01685737055708946, 0.0023410811172884993, 0.008059393986612687)
2026-06-13 20:44:30,625 - optuna.study.study - INFO - Trial 100 finished with values: [0.01685737055708946, 0.0023410811172884993, 0.008059393986612687] and parameters: {'n_layers': 3, 'embedding_dim': 256, 'lr': 0.024143923894547725, 'lambda_val': 0.0020280687587716966, 'batch_size': 3048, 'optimizer': 'RMSprop'}.
2026-06-13 20:44:54,598 - experiment_functions - INFO - Early stopping at epoch 550. Best Metrics: (0.019150946280945953, 0.0027011186281733542, 0.009572977685942351)
2026-06-13 20:44:54,686 - optuna.study.study - INFO - Trial 101 finished with values: [0.019150946280945953, 0.0027011186281733542, 0.009572977685942351] and parameters: {'n_layers': 4, 'embedding_dim': 64, 'lr': 0.0042802863633449924, 'lambda_val': 0.0033626453290954094, 'batch_size': 2816, 'optimizer': 'RMSprop'}.
2026-06-13 20:47:23,079 - experiment_functions - INFO - Early stopping at epoch 3550. Best Metrics: (0.04925304140875191, 0.006412016879898184, 0.024718712581305587)
2026-06-13 20:47:23,162 - optuna.study.study - INFO - Trial 102 finished with values: [0.04925304140875191, 0.006412016879898184, 0.024718712581305587] and parameters: {'n_layers': 3, 'embedding_dim': 96, 'lr': 0.0016889361681909714, 'lambda_val': 0.00019652548319010554, 'batch_size': 589, 'optimizer': 'RMSprop'}.
2026-06-13 20:50:00,074 - optuna.study.study - INFO - Trial 103 finished with values: [0.0354367690925508, 0.0053017616719137255, 0.019970484688775672] and parameters: {'n_layers': 1, 'embedding_dim': 128, 'lr': 0.0009711234831697961, 'lambda_val': 2.060634847155313e-06, 'batch_size': 1859, 'optimizer': 'RMSprop'}.
2026-06-13 20:50:24,095 - experiment_functions - INFO - Early stopping at epoch 550. Best Metrics: (0.015525276869933245, 0.0021300823899792353, 0.007591933457185021)
2026-06-13 20:50:24,179 - optuna.study.study - INFO - Trial 104 finished with values: [0.015525276869933245, 0.0021300823899792353, 0.007591933457185021] and parameters: {'n_layers': 4, 'embedding_dim': 64, 'lr': 0.06463772794599591, 'lambda_val': 1.78517212522022e-05, 'batch_size': 4095, 'optimizer': 'Adam'}.
2026-06-13 20:51:52,219 - experiment_functions - INFO - Early stopping at epoch 2050. Best Metrics: (0.016288211909641682, 0.002183669368343493, 0.007757862504176961)
2026-06-13 20:51:52,312 - optuna.study.study - INFO - Trial 105 finished with values: [0.016288211909641682, 0.002183669368343493, 0.007757862504176961] and parameters: {'n_layers': 3, 'embedding_dim': 128, 'lr': 0.024143923894547725, 'lambda_val': 0.0003351122520854177, 'batch_size': 3843, 'optimizer': 'RMSprop'}.
2026-06-13 20:52:32,607 - experiment_functions - INFO - Early stopping at epoch 950. Best Metrics: (0.020906392806128268, 0.002858530377118361, 0.010132196382807998)
2026-06-13 20:52:32,901 - optuna.study.study - INFO - Trial 106 finished with values: [0.020906392806128268, 0.002858530377118361, 0.010132196382807998] and parameters: {'n_layers': 2, 'embedding_dim': 128, 'lr': 0.004987128238810043, 'lambda_val': 0.0017018360966363254, 'batch_size': 818, 'optimizer': 'RMSprop'}.
2026-06-13 20:52:54,308 - experiment_functions - INFO - Early stopping at epoch 500. Best Metrics: (0.0005753291074517369, 7.870587447250318e-05, 0.0002744904723784169)
2026-06-13 20:52:54,385 - optuna.study.study - INFO - Trial 107 finished with values: [0.0005753291074517369, 7.870587447250318e-05, 0.0002744904723784169] and parameters: {'n_layers': 4, 'embedding_dim': 64, 'lr': 0.007743186347665371, 'lambda_val': 2.6473069390883154e-06, 'batch_size': 1740, 'optimizer': 'SGD'}.
2026-06-13 20:53:17,200 - experiment_functions - INFO - Early stopping at epoch 500. Best Metrics: (0.000428862151676384, 7.368209525085404e-05, 0.00019247306080901836)
2026-06-13 20:53:17,294 - optuna.study.study - INFO - Trial 108 finished with values: [0.000428862151676384, 7.368209525085404e-05, 0.00019247306080901836] and parameters: {'n_layers': 3, 'embedding_dim': 128, 'lr': 0.0006193224215073263, 'lambda_val': 0.005651522538859645, 'batch_size': 4095, 'optimizer': 'SGD'}.
2026-06-13 20:54:15,068 - experiment_functions - INFO - Early stopping at epoch 1400. Best Metrics: (0.0385161081481581, 0.005211333645924041, 0.019615159221730467)
2026-06-13 20:54:15,166 - optuna.study.study - INFO - Trial 109 finished with values: [0.0385161081481581, 0.005211333645924041, 0.019615159221730467] and parameters: {'n_layers': 4, 'embedding_dim': 64, 'lr': 0.0009711234831697961, 'lambda_val': 0.0005195382127114068, 'batch_size': 1859, 'optimizer': 'RMSprop'}.
2026-06-13 20:55:02,462 - experiment_functions - INFO - Early stopping at epoch 1100. Best Metrics: (0.015071002085528022, 0.0019559247102953984, 0.007133782562888985)
2026-06-13 20:55:02,550 - optuna.study.study - INFO - Trial 110 finished with values: [0.015071002085528022, 0.0019559247102953984, 0.007133782562888985] and parameters: {'n_layers': 4, 'embedding_dim': 96, 'lr': 0.0009711234831697961, 'lambda_val': 0.02716389444627943, 'batch_size': 1859, 'optimizer': 'RMSprop'}.
2026-06-13 20:56:17,786 - experiment_functions - INFO - Early stopping at epoch 2000. Best Metrics: (0.034746813263097254, 0.005115881840712707, 0.01813487007142299)
2026-06-13 20:56:17,848 - optuna.study.study - INFO - Trial 111 finished with values: [0.034746813263097254, 0.005115881840712707, 0.01813487007142299] and parameters: {'n_layers': 2, 'embedding_dim': 32, 'lr': 0.0009711234831697961, 'lambda_val': 0.0034172702614614723, 'batch_size': 2816, 'optimizer': 'Adam'}.
2026-06-13 20:57:00,850 - experiment_functions - INFO - Early stopping at epoch 1050. Best Metrics: (0.03527579117889776, 0.005082389979235046, 0.018403626843640677)
2026-06-13 20:57:00,920 - optuna.study.study - INFO - Trial 112 finished with values: [0.03527579117889776, 0.005082389979235046, 0.018403626843640677] and parameters: {'n_layers': 3, 'embedding_dim': 64, 'lr': 0.0009822401593291786, 'lambda_val': 0.0037208546295430245, 'batch_size': 3324, 'optimizer': 'Adam'}.
2026-06-13 20:57:41,262 - experiment_functions - INFO - Early stopping at epoch 950. Best Metrics: (0.02862877334377557, 0.003987206108915534, 0.014374142460028863)
2026-06-13 20:57:41,550 - optuna.study.study - INFO - Trial 113 finished with values: [0.02862877334377557, 0.003987206108915534, 0.014374142460028863] and parameters: {'n_layers': 2, 'embedding_dim': 128, 'lr': 0.004211819191883463, 'lambda_val': 0.0008453903829961915, 'batch_size': 650, 'optimizer': 'Adam'}.
2026-06-13 20:58:02,390 - experiment_functions - INFO - Early stopping at epoch 500. Best Metrics: (0.0005835676505170656, 7.703128139862013e-05, 0.0002715244106624474)
2026-06-13 20:58:02,471 - optuna.study.study - INFO - Trial 114 finished with values: [0.0005835676505170656, 7.703128139862013e-05, 0.0002715244106624474] and parameters: {'n_layers': 1, 'embedding_dim': 128, 'lr': 0.0006971255889475698, 'lambda_val': 0.018328494161540542, 'batch_size': 4095, 'optimizer': 'SGD'}.
2026-06-13 21:00:23,666 - experiment_functions - INFO - Early stopping at epoch 3650. Best Metrics: (0.04292603326113962, 0.0060335588452006175, 0.023093420955363538)
2026-06-13 21:00:23,810 - optuna.study.study - INFO - Trial 115 finished with values: [0.04292603326113962, 0.0060335588452006175, 0.023093420955363538] and parameters: {'n_layers': 2, 'embedding_dim': 64, 'lr': 0.0009711234831697961, 'lambda_val': 0.0005590603438440636, 'batch_size': 1677, 'optimizer': 'Adam'}.
2026-06-13 21:01:25,349 - experiment_functions - INFO - Early stopping at epoch 1550. Best Metrics: (0.0400454436912972, 0.005599839239064908, 0.020980686011301403)
2026-06-13 21:01:25,429 - optuna.study.study - INFO - Trial 116 finished with values: [0.0400454436912972, 0.005599839239064908, 0.020980686011301403] and parameters: {'n_layers': 2, 'embedding_dim': 64, 'lr': 0.0009822401593291786, 'lambda_val': 0.0016643534908328272, 'batch_size': 3009, 'optimizer': 'RMSprop'}.
2026-06-13 21:02:13,042 - experiment_functions - INFO - Early stopping at epoch 1100. Best Metrics: (0.042055230805485934, 0.00572208453345837, 0.02125372405646186)
2026-06-13 21:02:13,131 - optuna.study.study - INFO - Trial 117 finished with values: [0.042055230805485934, 0.00572208453345837, 0.02125372405646186] and parameters: {'n_layers': 3, 'embedding_dim': 96, 'lr': 0.0009711234831697961, 'lambda_val': 0.0005195382127114068, 'batch_size': 3699, 'optimizer': 'RMSprop'}.
2026-06-13 21:04:47,719 - optuna.study.study - INFO - Trial 118 finished with values: [0.018203217725488302, 0.0030125929399156008, 0.009556347759029027] and parameters: {'n_layers': 1, 'embedding_dim': 128, 'lr': 0.0006971255889475698, 'lambda_val': 0.018328494161540542, 'batch_size': 1712, 'optimizer': 'RMSprop'}.
2026-06-13 21:05:36,374 - experiment_functions - INFO - Early stopping at epoch 1200. Best Metrics: (0.031022806569638364, 0.004605130953178379, 0.01660980618531315)
2026-06-13 21:05:36,457 - optuna.study.study - INFO - Trial 119 finished with values: [0.031022806569638364, 0.004605130953178379, 0.01660980618531315] and parameters: {'n_layers': 1, 'embedding_dim': 128, 'lr': 0.0016889361681909714, 'lambda_val': 0.00035318754870590177, 'batch_size': 3311, 'optimizer': 'RMSprop'}.
2026-06-13 21:06:01,520 - experiment_functions - INFO - Early stopping at epoch 600. Best Metrics: (0.024554354143637387, 0.003548462723558175, 0.012719930762645)
2026-06-13 21:06:01,601 - optuna.study.study - INFO - Trial 120 finished with values: [0.024554354143637387, 0.003548462723558175, 0.012719930762645] and parameters: {'n_layers': 2, 'embedding_dim': 64, 'lr': 0.01224525865201161, 'lambda_val': 0.0005195382127114068, 'batch_size': 1859, 'optimizer': 'Adam'}.
2026-06-13 21:06:27,640 - experiment_functions - INFO - Early stopping at epoch 650. Best Metrics: (0.01991424629101629, 0.002985799450733472, 0.010438015634546898)
2026-06-13 21:06:27,723 - optuna.study.study - INFO - Trial 121 finished with values: [0.01991424629101629, 0.002985799450733472, 0.010438015634546898] and parameters: {'n_layers': 2, 'embedding_dim': 32, 'lr': 0.007743186347665371, 'lambda_val': 0.0017018360966363254, 'batch_size': 818, 'optimizer': 'Adam'}.
2026-06-13 21:08:29,149 - experiment_functions - INFO - Early stopping at epoch 2950. Best Metrics: (0.05257197700650364, 0.006994775269609486, 0.026550711991096296)
2026-06-13 21:08:29,243 - optuna.study.study - INFO - Trial 122 finished with values: [0.05257197700650364, 0.006994775269609486, 0.026550711991096296] and parameters: {'n_layers': 4, 'embedding_dim': 64, 'lr': 0.0009711234831697961, 'lambda_val': 2.3680453923050776e-05, 'batch_size': 1859, 'optimizer': 'RMSprop'}.
2026-06-13 21:08:52,612 - experiment_functions - INFO - Early stopping at epoch 550. Best Metrics: (0.007035142769263856, 0.0009595418313349855, 0.0036937381324080106)
2026-06-13 21:08:52,706 - optuna.study.study - INFO - Trial 123 finished with values: [0.007035142769263856, 0.0009595418313349855, 0.0036937381324080106] and parameters: {'n_layers': 2, 'embedding_dim': 96, 'lr': 0.042947991983695886, 'lambda_val': 8.588254850037456e-05, 'batch_size': 3914, 'optimizer': 'RMSprop'}.
2026-06-13 21:09:17,700 - experiment_functions - INFO - Early stopping at epoch 600. Best Metrics: (0.02553035982269736, 0.003642239935695626, 0.013207670457898281)
2026-06-13 21:09:17,781 - optuna.study.study - INFO - Trial 124 finished with values: [0.02553035982269736, 0.003642239935695626, 0.013207670457898281] and parameters: {'n_layers': 2, 'embedding_dim': 64, 'lr': 0.011131385529516813, 'lambda_val': 0.0016643534908328272, 'batch_size': 3449, 'optimizer': 'Adam'}.
2026-06-13 21:10:04,575 - experiment_functions - INFO - Early stopping at epoch 1200. Best Metrics: (0.029948784753915852, 0.004564940719405185, 0.016195555997956957)
2026-06-13 21:10:04,662 - optuna.study.study - INFO - Trial 125 finished with values: [0.029948784753915852, 0.004564940719405185, 0.016195555997956957] and parameters: {'n_layers': 1, 'embedding_dim': 64, 'lr': 0.0030101219400550665, 'lambda_val': 0.00035318754870590177, 'batch_size': 1732, 'optimizer': 'RMSprop'}.
2026-06-13 21:10:41,733 - experiment_functions - INFO - Early stopping at epoch 850. Best Metrics: (0.04062185352816637, 0.005472570165449795, 0.020216350932648536)
2026-06-13 21:10:41,829 - optuna.study.study - INFO - Trial 126 finished with values: [0.04062185352816637, 0.005472570165449795, 0.020216350932648536] and parameters: {'n_layers': 3, 'embedding_dim': 96, 'lr': 0.0016889361681909714, 'lambda_val': 0.0003920256863411047, 'batch_size': 3306, 'optimizer': 'RMSprop'}.
2026-06-13 21:13:32,037 - optuna.study.study - INFO - Trial 127 finished with values: [0.01832149010170735, 0.0030795766628709223, 0.010186727347826564] and parameters: {'n_layers': 1, 'embedding_dim': 256, 'lr': 0.0011850840182929016, 'lambda_val': 0.005651522538859645, 'batch_size': 638, 'optimizer': 'Adam'}.
2026-06-13 21:13:55,634 - experiment_functions - INFO - Early stopping at epoch 550. Best Metrics: (0.015320916958175277, 0.0022506530912988145, 0.0076821723254418125)
2026-06-13 21:13:55,720 - optuna.study.study - INFO - Trial 128 finished with values: [0.015320916958175277, 0.0022506530912988145, 0.0076821723254418125] and parameters: {'n_layers': 2, 'embedding_dim': 96, 'lr': 0.024143923894547725, 'lambda_val': 0.0003351122520854177, 'batch_size': 818, 'optimizer': 'Adam'}.
2026-06-13 21:14:45,297 - experiment_functions - INFO - Early stopping at epoch 1200. Best Metrics: (0.04697633330747129, 0.006495746533592336, 0.024734167564342498)
2026-06-13 21:14:45,379 - optuna.study.study - INFO - Trial 129 finished with values: [0.04697633330747129, 0.006495746533592336, 0.024734167564342498] and parameters: {'n_layers': 3, 'embedding_dim': 64, 'lr': 0.0016889361681909714, 'lambda_val': 0.00035318754870590177, 'batch_size': 1358, 'optimizer': 'Adam'}.
2026-06-13 21:15:15,241 - experiment_functions - INFO - Early stopping at epoch 700. Best Metrics: (0.02847331138274769, 0.004152990823229954, 0.01442217608199932)
2026-06-13 21:15:15,333 - optuna.study.study - INFO - Trial 130 finished with values: [0.02847331138274769, 0.004152990823229954, 0.01442217608199932] and parameters: {'n_layers': 4, 'embedding_dim': 64, 'lr': 0.0023210401240154363, 'lambda_val': 0.0033626453290954094, 'batch_size': 1911, 'optimizer': 'Adam'}.
2026-06-13 21:15:50,586 - experiment_functions - INFO - Early stopping at epoch 900. Best Metrics: (0.01859709833219631, 0.0029255141000736826, 0.009763644324543228)
2026-06-13 21:15:50,891 - optuna.study.study - INFO - Trial 131 finished with values: [0.01859709833219631, 0.0029255141000736826, 0.009763644324543228] and parameters: {'n_layers': 1, 'embedding_dim': 64, 'lr': 0.0030675240214635474, 'lambda_val': 0.01866673428394609, 'batch_size': 3483, 'optimizer': 'Adam'}.
2026-06-13 21:18:23,995 - optuna.study.study - INFO - Trial 132 finished with values: [0.012976352073552624, 0.002136780762274767, 0.007473699834242572] and parameters: {'n_layers': 1, 'embedding_dim': 128, 'lr': 0.000495651360592853, 'lambda_val': 1.560024380616628e-05, 'batch_size': 2071, 'optimizer': 'Adam'}.
2026-06-13 21:19:10,851 - experiment_functions - INFO - Early stopping at epoch 1150. Best Metrics: (0.024623916796033037, 0.0037527630785719073, 0.01326366082640319)
2026-06-13 21:19:10,942 - optuna.study.study - INFO - Trial 133 finished with values: [0.024623916796033037, 0.0037527630785719073, 0.01326366082640319] and parameters: {'n_layers': 1, 'embedding_dim': 128, 'lr': 0.0027934085914899194, 'lambda_val': 0.0008453903829961915, 'batch_size': 2816, 'optimizer': 'Adam'}.
2026-06-13 21:21:54,704 - optuna.study.study - INFO - Trial 134 finished with values: [0.04587811044188948, 0.00609551878893429, 0.02342620741977261] and parameters: {'n_layers': 4, 'embedding_dim': 64, 'lr': 0.0006193224215073263, 'lambda_val': 1.2390048556225255e-05, 'batch_size': 4095, 'optimizer': 'Adam'}.
2026-06-13 21:22:20,045 - experiment_functions - INFO - Early stopping at epoch 550. Best Metrics: (0.017750078562571676, 0.002426485364056534, 0.008938325077858017)
2026-06-13 21:22:20,113 - optuna.study.study - INFO - Trial 135 finished with values: [0.017750078562571676, 0.002426485364056534, 0.008938325077858017] and parameters: {'n_layers': 4, 'embedding_dim': 96, 'lr': 0.017858448770491267, 'lambda_val': 0.00035318754870590177, 'batch_size': 3773, 'optimizer': 'RMSprop'}.
2026-06-13 21:22:57,341 - experiment_functions - INFO - Early stopping at epoch 850. Best Metrics: (0.04312582016606001, 0.005969924308393061, 0.022346653683756174)
2026-06-13 21:22:57,440 - optuna.study.study - INFO - Trial 136 finished with values: [0.04312582016606001, 0.005969924308393061, 0.022346653683756174] and parameters: {'n_layers': 3, 'embedding_dim': 96, 'lr': 0.0016889361681909714, 'lambda_val': 0.0003920256863411047, 'batch_size': 1859, 'optimizer': 'RMSprop'}.
2026-06-13 21:23:33,270 - experiment_functions - INFO - Early stopping at epoch 750. Best Metrics: (0.038799303329798744, 0.005321856788800322, 0.019594764617051227)
2026-06-13 21:23:33,949 - optuna.study.study - INFO - Trial 137 finished with values: [0.038799303329798744, 0.005321856788800322, 0.019594764617051227] and parameters: {'n_layers': 4, 'embedding_dim': 128, 'lr': 0.0016889361681909714, 'lambda_val': 0.00013735320939513843, 'batch_size': 4095, 'optimizer': 'Adam'}.
2026-06-13 21:23:57,393 - experiment_functions - INFO - Early stopping at epoch 550. Best Metrics: (0.008109829705926315, 0.001083461718802331, 0.004443367902700162)
2026-06-13 21:23:57,479 - optuna.study.study - INFO - Trial 138 finished with values: [0.008109829705926315, 0.001083461718802331, 0.004443367902700162] and parameters: {'n_layers': 2, 'embedding_dim': 96, 'lr': 0.042947991983695886, 'lambda_val': 8.588254850037456e-05, 'batch_size': 2035, 'optimizer': 'RMSprop'}.
2026-06-13 21:24:42,178 - experiment_functions - INFO - Early stopping at epoch 1100. Best Metrics: (0.02573784332071828, 0.003739366333980842, 0.013728736087085188)
2026-06-13 21:24:42,683 - optuna.study.study - INFO - Trial 139 finished with values: [0.02573784332071828, 0.003739366333980842, 0.013728736087085188] and parameters: {'n_layers': 1, 'embedding_dim': 128, 'lr': 0.0042802863633449924, 'lambda_val': 0.0001235940083690254, 'batch_size': 2816, 'optimizer': 'Adam'}.
2026-06-13 21:26:15,830 - experiment_functions - INFO - Early stopping at epoch 2150. Best Metrics: (0.029757710903466943, 0.004149641637082189, 0.014887562373784191)
