2026-06-15 10:51:49,496 - optuna.study.study - INFO - Trial 39 finished with values: [0.0006141746686611231, 8.540424676803537e-05, 0.0002381784313318586] and parameters: {'n_layers': 2, 'embedding_dim': 32, 'lr': 2.198854600770114e-05, 'lambda_val': 0.0016396245708417134, 'batch_size': 3609, 'optimizer': 'RMSprop'}.
2026-06-15 10:52:16,639 - experiment_functions - INFO - Early stopping at epoch 600. Best Metrics: (0.03399884787157786, 0.004270212338401768, 0.015319771061760712)
2026-06-15 10:52:16,730 - optuna.study.study - INFO - Trial 40 finished with values: [0.03399884787157786, 0.004270212338401768, 0.015319771061760712] and parameters: {'n_layers': 2, 'embedding_dim': 96, 'lr': 0.0040695578270300336, 'lambda_val': 0.014772603784905358, 'batch_size': 3024, 'optimizer': 'Adam'}.
2026-06-15 10:52:41,133 - experiment_functions - INFO - Early stopping at epoch 500. Best Metrics: (0.0005375161345713627, 7.368209525085404e-05, 0.0002493427265712388)
2026-06-15 10:52:41,231 - optuna.study.study - INFO - Trial 41 finished with values: [0.0005375161345713627, 7.368209525085404e-05, 0.0002493427265712388] and parameters: {'n_layers': 4, 'embedding_dim': 96, 'lr': 0.036095320814702674, 'lambda_val': 0.011951908153940477, 'batch_size': 620, 'optimizer': 'SGD'}.
2026-06-15 10:53:04,179 - experiment_functions - INFO - Early stopping at epoch 500. Best Metrics: (0.0003854322317015268, 7.870587447250317e-05, 0.0001779993264172563)
2026-06-15 10:53:04,273 - optuna.study.study - INFO - Trial 42 finished with values: [0.0003854322317015268, 7.870587447250317e-05, 0.0001779993264172563] and parameters: {'n_layers': 2, 'embedding_dim': 128, 'lr': 4.250662616466241e-05, 'lambda_val': 5.9569752943943486e-05, 'batch_size': 1912, 'optimizer': 'SGD'}.
2026-06-15 10:53:24,808 - experiment_functions - INFO - Early stopping at epoch 500. Best Metrics: (0.0003451940558727811, 5.023779221649139e-05, 0.0001660313785280018)
2026-06-15 10:53:24,949 - optuna.study.study - INFO - Trial 43 finished with values: [0.0003451940558727811, 5.023779221649139e-05, 0.0001660313785280018] and parameters: {'n_layers': 1, 'embedding_dim': 64, 'lr': 2.835193862853027e-05, 'lambda_val': 0.0021197162840537924, 'batch_size': 1368, 'optimizer': 'SGD'}.
2026-06-15 10:53:56,980 - experiment_functions - INFO - Early stopping at epoch 500. Best Metrics: (0.0006407821662565853, 7.033290910308795e-05, 0.00032271355731586986)
2026-06-15 10:53:57,066 - optuna.study.study - INFO - Trial 44 finished with values: [0.0006407821662565853, 7.033290910308795e-05, 0.00032271355731586986] and parameters: {'n_layers': 4, 'embedding_dim': 256, 'lr': 6.176387007423133e-05, 'lambda_val': 0.0001938199344770558, 'batch_size': 553, 'optimizer': 'SGD'}.
2026-06-15 10:54:21,473 - experiment_functions - INFO - Early stopping at epoch 500. Best Metrics: (0.0005205430557806285, 9.210261906356756e-05, 0.000215259333979626)
2026-06-15 10:54:21,569 - optuna.study.study - INFO - Trial 45 finished with values: [0.0005205430557806285, 9.210261906356756e-05, 0.000215259333979626] and parameters: {'n_layers': 3, 'embedding_dim': 128, 'lr': 0.0022774521612070335, 'lambda_val': 0.00012106578213362904, 'batch_size': 2375, 'optimizer': 'SGD'}.
2026-06-15 10:54:47,435 - experiment_functions - INFO - Early stopping at epoch 500. Best Metrics: (0.00039695082495535937, 6.363453680755577e-05, 0.00016205939121603875)
2026-06-15 10:54:47,530 - optuna.study.study - INFO - Trial 46 finished with values: [0.00039695082495535937, 6.363453680755577e-05, 0.00016205939121603875] and parameters: {'n_layers': 4, 'embedding_dim': 128, 'lr': 0.09320204099211776, 'lambda_val': 0.0038012900372072344, 'batch_size': 3506, 'optimizer': 'SGD'}.
2026-06-15 10:56:42,995 - experiment_functions - INFO - Early stopping at epoch 2900. Best Metrics: (0.0007281113878683296, 0.00010215017750686583, 0.0003323827669652283)
2026-06-15 10:56:43,078 - optuna.study.study - INFO - Trial 47 finished with values: [0.0007281113878683296, 0.00010215017750686583, 0.0003323827669652283] and parameters: {'n_layers': 1, 'embedding_dim': 128, 'lr': 5.918708868351568e-05, 'lambda_val': 0.000160530769455361, 'batch_size': 2769, 'optimizer': 'Adam'}.
2026-06-15 10:57:06,294 - experiment_functions - INFO - Early stopping at epoch 500. Best Metrics: (0.00041835728942496545, 6.698372295532186e-05, 0.00019834227468667622)
2026-06-15 10:57:06,375 - optuna.study.study - INFO - Trial 48 finished with values: [0.00041835728942496545, 6.698372295532186e-05, 0.00019834227468667622] and parameters: {'n_layers': 2, 'embedding_dim': 128, 'lr': 0.00037856977069147227, 'lambda_val': 0.08155655094298038, 'batch_size': 1157, 'optimizer': 'Adam'}.
2026-06-15 10:57:45,332 - experiment_functions - INFO - Early stopping at epoch 650. Best Metrics: (0.05409934504372736, 0.006763681425413625, 0.02717115730445776)
2026-06-15 10:57:45,390 - optuna.study.study - INFO - Trial 49 finished with values: [0.05409934504372736, 0.006763681425413625, 0.02717115730445776] and parameters: {'n_layers': 3, 'embedding_dim': 256, 'lr': 0.0018921194607502668, 'lambda_val': 2.5476071418262236e-05, 'batch_size': 2434, 'optimizer': 'Adam'}.
2026-06-15 11:00:38,747 - experiment_functions - INFO - Early stopping at epoch 3750. Best Metrics: (0.03247115418543577, 0.003494875745193918, 0.015206234853167154)
2026-06-15 11:00:38,837 - optuna.study.study - INFO - Trial 50 finished with values: [0.03247115418543577, 0.003494875745193918, 0.015206234853167154] and parameters: {'n_layers': 3, 'embedding_dim': 128, 'lr': 0.02593878803168038, 'lambda_val': 2.5476071418262236e-05, 'batch_size': 2434, 'optimizer': 'Adam'}.
2026-06-15 11:01:05,206 - experiment_functions - INFO - Early stopping at epoch 500. Best Metrics: (0.000595556362238405, 8.038046754638624e-05, 0.00027891204636050547)
2026-06-15 11:01:05,297 - optuna.study.study - INFO - Trial 51 finished with values: [0.000595556362238405, 8.038046754638624e-05, 0.00027891204636050547] and parameters: {'n_layers': 2, 'embedding_dim': 256, 'lr': 0.0016086229224309184, 'lambda_val': 0.014772603784905358, 'batch_size': 3024, 'optimizer': 'SGD'}.
2026-06-15 11:01:39,891 - experiment_functions - INFO - Early stopping at epoch 700. Best Metrics: (0.08169761093286451, 0.009881773728983856, 0.04140432928408492)
2026-06-15 11:01:39,970 - optuna.study.study - INFO - Trial 52 finished with values: [0.08169761093286451, 0.009881773728983856, 0.04140432928408492] and parameters: {'n_layers': 1, 'embedding_dim': 256, 'lr': 0.0056865752581316785, 'lambda_val': 2.5476071418262236e-05, 'batch_size': 2193, 'optimizer': 'Adam'}.
2026-06-15 11:02:38,793 - experiment_functions - INFO - Early stopping at epoch 1500. Best Metrics: (0.06499888247996011, 0.00792584901868846, 0.03258471724486214)
2026-06-15 11:02:38,862 - optuna.study.study - INFO - Trial 53 finished with values: [0.06499888247996011, 0.00792584901868846, 0.03258471724486214] and parameters: {'n_layers': 1, 'embedding_dim': 32, 'lr': 0.005616296548051391, 'lambda_val': 0.0002014587319781766, 'batch_size': 558, 'optimizer': 'Adam'}.
2026-06-15 11:03:10,799 - experiment_functions - INFO - Early stopping at epoch 500. Best Metrics: (0.0004922685000715756, 6.195994373367272e-05, 0.0001858898344946618)
2026-06-15 11:03:10,908 - optuna.study.study - INFO - Trial 54 finished with values: [0.0004922685000715756, 6.195994373367272e-05, 0.0001858898344946618] and parameters: {'n_layers': 4, 'embedding_dim': 256, 'lr': 6.176387007423133e-05, 'lambda_val': 0.0001938199344770558, 'batch_size': 553, 'optimizer': 'SGD'}.
2026-06-15 11:03:34,169 - experiment_functions - INFO - Early stopping at epoch 550. Best Metrics: (0.00039577022077506846, 6.195994373367272e-05, 0.00018737550682921595)
2026-06-15 11:03:34,252 - optuna.study.study - INFO - Trial 55 finished with values: [0.00039577022077506846, 6.195994373367272e-05, 0.00018737550682921595] and parameters: {'n_layers': 4, 'embedding_dim': 32, 'lr': 1.4920013235879184e-05, 'lambda_val': 0.026359968516020325, 'batch_size': 890, 'optimizer': 'RMSprop'}.
2026-06-15 11:06:35,817 - optuna.study.study - INFO - Trial 56 finished with values: [0.054111432453178634, 0.006400294728381003, 0.026033019990074662] and parameters: {'n_layers': 1, 'embedding_dim': 256, 'lr': 0.01036324135738448, 'lambda_val': 1.8499653768568122e-06, 'batch_size': 2285, 'optimizer': 'RMSprop'}.
2026-06-15 11:07:08,597 - experiment_functions - INFO - Early stopping at epoch 550. Best Metrics: (0.009466954457442237, 0.0011136043941322258, 0.00441074901648895)
2026-06-15 11:07:08,683 - optuna.study.study - INFO - Trial 57 finished with values: [0.009466954457442237, 0.0011136043941322258, 0.00441074901648895] and parameters: {'n_layers': 3, 'embedding_dim': 256, 'lr': 0.005988564288598955, 'lambda_val': 0.05546823298892251, 'batch_size': 1699, 'optimizer': 'Adam'}.
2026-06-15 11:07:37,938 - experiment_functions - INFO - Early stopping at epoch 650. Best Metrics: (0.05068823747592669, 0.006149105767298547, 0.0248272244794961)
2026-06-15 11:07:38,022 - optuna.study.study - INFO - Trial 58 finished with values: [0.05068823747592669, 0.006149105767298547, 0.0248272244794961] and parameters: {'n_layers': 3, 'embedding_dim': 64, 'lr': 0.0022774521612070335, 'lambda_val': 0.00012106578213362904, 'batch_size': 3624, 'optimizer': 'Adam'}.
2026-06-15 11:08:02,285 - experiment_functions - INFO - Early stopping at epoch 500. Best Metrics: (0.0005310128332352883, 7.368209525085404e-05, 0.00025638663457235267)
2026-06-15 11:08:02,385 - optuna.study.study - INFO - Trial 59 finished with values: [0.0005310128332352883, 7.368209525085404e-05, 0.00025638663457235267] and parameters: {'n_layers': 3, 'embedding_dim': 128, 'lr': 0.019910211445474457, 'lambda_val': 3.0361380436722275e-05, 'batch_size': 3690, 'optimizer': 'SGD'}.
2026-06-15 11:09:18,229 - experiment_functions - INFO - Early stopping at epoch 1950. Best Metrics: (0.08009914701261385, 0.009369348248375644, 0.03993985978534728)
2026-06-15 11:09:18,300 - optuna.study.study - INFO - Trial 60 finished with values: [0.08009914701261385, 0.009369348248375644, 0.03993985978534728] and parameters: {'n_layers': 1, 'embedding_dim': 32, 'lr': 0.0026397990430783503, 'lambda_val': 1.0723270203484857e-05, 'batch_size': 2768, 'optimizer': 'RMSprop'}.
2026-06-15 11:09:50,161 - experiment_functions - INFO - Early stopping at epoch 500. Best Metrics: (0.000733015506738321, 9.210261906356756e-05, 0.0002979230841803486)
2026-06-15 11:09:50,239 - optuna.study.study - INFO - Trial 61 finished with values: [0.000733015506738321, 9.210261906356756e-05, 0.0002979230841803486] and parameters: {'n_layers': 4, 'embedding_dim': 256, 'lr': 0.0006397931509825065, 'lambda_val': 0.0011192032186667425, 'batch_size': 3690, 'optimizer': 'SGD'}.
2026-06-15 11:10:11,482 - experiment_functions - INFO - Early stopping at epoch 500. Best Metrics: (0.0007716830775188005, 9.210261906356757e-05, 0.00036086796174144393)
2026-06-15 11:10:11,584 - optuna.study.study - INFO - Trial 62 finished with values: [0.0007716830775188005, 9.210261906356757e-05, 0.00036086796174144393] and parameters: {'n_layers': 4, 'embedding_dim': 32, 'lr': 2.198854600770114e-05, 'lambda_val': 0.0016396245708417134, 'batch_size': 1205, 'optimizer': 'RMSprop'}.
2026-06-15 11:10:47,983 - experiment_functions - INFO - Early stopping at epoch 750. Best Metrics: (0.06989915273350769, 0.008771518520999397, 0.03471693902863937)
2026-06-15 11:10:48,137 - optuna.study.study - INFO - Trial 63 finished with values: [0.06989915273350769, 0.008771518520999397, 0.03471693902863937] and parameters: {'n_layers': 1, 'embedding_dim': 256, 'lr': 0.0016086229224309184, 'lambda_val': 0.004600256253014536, 'batch_size': 3981, 'optimizer': 'RMSprop'}.
2026-06-15 11:11:18,472 - experiment_functions - INFO - Early stopping at epoch 550. Best Metrics: (0.03814231782954077, 0.004291982048362248, 0.017550088350343784)
2026-06-15 11:11:18,566 - optuna.study.study - INFO - Trial 64 finished with values: [0.03814231782954077, 0.004291982048362248, 0.017550088350343784] and parameters: {'n_layers': 2, 'embedding_dim': 256, 'lr': 0.03399653553805821, 'lambda_val': 2.9677369546189456e-06, 'batch_size': 3981, 'optimizer': 'Adam'}.
2026-06-15 11:11:42,715 - experiment_functions - INFO - Early stopping at epoch 500. Best Metrics: (0.00049673661227234, 7.033290910308795e-05, 0.0001952452575980623)
2026-06-15 11:11:42,802 - optuna.study.study - INFO - Trial 65 finished with values: [0.00049673661227234, 7.033290910308795e-05, 0.0001952452575980623] and parameters: {'n_layers': 1, 'embedding_dim': 256, 'lr': 1.1041592896480048e-05, 'lambda_val': 0.00039003938593281393, 'batch_size': 1273, 'optimizer': 'Adam'}.
2026-06-15 11:12:26,262 - experiment_functions - INFO - Early stopping at epoch 850. Best Metrics: (0.026276932316935, 0.0032604327148502915, 0.012054230860465379)
2026-06-15 11:12:26,354 - optuna.study.study - INFO - Trial 66 finished with values: [0.026276932316935, 0.0032604327148502915, 0.012054230860465379] and parameters: {'n_layers': 4, 'embedding_dim': 128, 'lr': 0.000983693390197904, 'lambda_val': 0.005341790606555578, 'batch_size': 3526, 'optimizer': 'RMSprop'}.
2026-06-15 11:13:05,316 - experiment_functions - INFO - Early stopping at epoch 1000. Best Metrics: (0.0006989363380956646, 0.00010717395672851497, 0.0002950149073767892)
2026-06-15 11:13:05,394 - optuna.study.study - INFO - Trial 67 finished with values: [0.0006989363380956646, 0.00010717395672851497, 0.0002950149073767892] and parameters: {'n_layers': 1, 'embedding_dim': 64, 'lr': 0.00018705375060032152, 'lambda_val': 0.001414642290413673, 'batch_size': 1969, 'optimizer': 'Adam'}.
2026-06-15 11:13:31,288 - experiment_functions - INFO - Early stopping at epoch 500. Best Metrics: (0.0005193115727346011, 7.870587447250317e-05, 0.00024932152116407467)
2026-06-15 11:13:31,379 - optuna.study.study - INFO - Trial 68 finished with values: [0.0005193115727346011, 7.870587447250317e-05, 0.00024932152116407467] and parameters: {'n_layers': 4, 'embedding_dim': 128, 'lr': 0.00027114321178925145, 'lambda_val': 1.2629561238240175e-05, 'batch_size': 3886, 'optimizer': 'SGD'}.
2026-06-15 11:15:56,444 - optuna.study.study - INFO - Trial 69 finished with values: [0.0037157188765321795, 0.0006547658918882712, 0.0020670941608026843] and parameters: {'n_layers': 1, 'embedding_dim': 32, 'lr': 0.00026668784875348404, 'lambda_val': 0.0004230572417097157, 'batch_size': 3360, 'optimizer': 'Adam'}.
2026-06-15 11:16:20,775 - experiment_functions - INFO - Early stopping at epoch 500. Best Metrics: (0.0004278818545290322, 7.703128139862013e-05, 0.00028012030765988885)
2026-06-15 11:16:20,859 - optuna.study.study - INFO - Trial 70 finished with values: [0.0004278818545290322, 7.703128139862013e-05, 0.00028012030765988885] and parameters: {'n_layers': 4, 'embedding_dim': 96, 'lr': 0.0014227121487339167, 'lambda_val': 0.0004230572417097157, 'batch_size': 3360, 'optimizer': 'SGD'}.
2026-06-15 11:16:49,498 - experiment_functions - INFO - Early stopping at epoch 550. Best Metrics: (0.007248552983327596, 0.0009143278183401435, 0.003755035739179)
2026-06-15 11:16:49,583 - optuna.study.study - INFO - Trial 71 finished with values: [0.007248552983327596, 0.0009143278183401435, 0.003755035739179] and parameters: {'n_layers': 4, 'embedding_dim': 128, 'lr': 0.08209431996538023, 'lambda_val': 0.00957439056078652, 'batch_size': 1959, 'optimizer': 'Adam'}.
2026-06-15 11:17:23,330 - experiment_functions - INFO - Early stopping at epoch 800. Best Metrics: (0.02460063089924795, 0.0030243150914327816, 0.011100636067238125)
2026-06-15 11:17:23,438 - optuna.study.study - INFO - Trial 72 finished with values: [0.02460063089924795, 0.0030243150914327816, 0.011100636067238125] and parameters: {'n_layers': 4, 'embedding_dim': 32, 'lr': 0.0018921194607502668, 'lambda_val': 0.00818802156219734, 'batch_size': 2434, 'optimizer': 'Adam'}.
2026-06-15 11:20:26,811 - optuna.study.study - INFO - Trial 73 finished with values: [0.030041790875579576, 0.0036070734811440826, 0.01402139340976772] and parameters: {'n_layers': 4, 'embedding_dim': 96, 'lr': 0.0016086229224309184, 'lambda_val': 3.1553787251817323e-06, 'batch_size': 558, 'optimizer': 'Adam'}.
2026-06-15 11:20:56,334 - experiment_functions - INFO - Early stopping at epoch 600. Best Metrics: (0.04704216495913397, 0.005856051979369013, 0.0220262769242064)
2026-06-15 11:20:56,433 - optuna.study.study - INFO - Trial 74 finished with values: [0.04704216495913397, 0.005856051979369013, 0.0220262769242064] and parameters: {'n_layers': 1, 'embedding_dim': 256, 'lr': 0.01036324135738448, 'lambda_val': 0.004600256253014536, 'batch_size': 2285, 'optimizer': 'Adam'}.
2026-06-15 11:21:47,872 - experiment_functions - INFO - Early stopping at epoch 1300. Best Metrics: (0.00048083178505409723, 8.205506062026926e-05, 0.0002755358018203559)
2026-06-15 11:21:47,973 - optuna.study.study - INFO - Trial 75 finished with values: [0.00048083178505409723, 8.205506062026926e-05, 0.0002755358018203559] and parameters: {'n_layers': 1, 'embedding_dim': 96, 'lr': 1.1681530875222099e-05, 'lambda_val': 1.914898476788421e-06, 'batch_size': 914, 'optimizer': 'Adam'}.
2026-06-15 11:25:49,488 - optuna.study.study - INFO - Trial 76 finished with values: [0.000695649215523152, 0.00010549936365463193, 0.0003367636885036074] and parameters: {'n_layers': 4, 'embedding_dim': 256, 'lr': 6.176387007423133e-05, 'lambda_val': 0.0001938199344770558, 'batch_size': 558, 'optimizer': 'RMSprop'}.
2026-06-15 11:29:41,805 - experiment_functions - INFO - Early stopping at epoch 3750. Best Metrics: (0.045182904389028444, 0.004976890615580415, 0.020579659953063704)
2026-06-15 11:29:41,881 - optuna.study.study - INFO - Trial 77 finished with values: [0.045182904389028444, 0.004976890615580415, 0.020579659953063704] and parameters: {'n_layers': 4, 'embedding_dim': 256, 'lr': 0.005616296548051391, 'lambda_val': 4.6804655463952444e-05, 'batch_size': 2572, 'optimizer': 'RMSprop'}.
2026-06-15 11:30:09,057 - experiment_functions - INFO - Early stopping at epoch 550. Best Metrics: (0.02334552656313323, 0.0028685779355616583, 0.010621759571295825)
2026-06-15 11:30:09,137 - optuna.study.study - INFO - Trial 78 finished with values: [0.02334552656313323, 0.0028685779355616583, 0.010621759571295825] and parameters: {'n_layers': 4, 'embedding_dim': 96, 'lr': 0.0056865752581316785, 'lambda_val': 0.0014666767049690977, 'batch_size': 2193, 'optimizer': 'RMSprop'}.
2026-06-15 11:30:42,696 - experiment_functions - INFO - Early stopping at epoch 550. Best Metrics: (0.04354525122262693, 0.00507904079308728, 0.02025351403877886)
2026-06-15 11:30:42,787 - optuna.study.study - INFO - Trial 79 finished with values: [0.04354525122262693, 0.00507904079308728, 0.02025351403877886] and parameters: {'n_layers': 3, 'embedding_dim': 256, 'lr': 0.0056865752581316785, 'lambda_val': 7.267949834674351e-06, 'batch_size': 3364, 'optimizer': 'Adam'}.
2026-06-15 11:33:41,043 - experiment_functions - INFO - Early stopping at epoch 3850. Best Metrics: (0.04235083304914459, 0.004926652823363923, 0.019371829085174246)
2026-06-15 11:33:41,117 - optuna.study.study - INFO - Trial 80 finished with values: [0.04235083304914459, 0.004926652823363923, 0.019371829085174246] and parameters: {'n_layers': 3, 'embedding_dim': 128, 'lr': 0.0018921194607502668, 'lambda_val': 1.2629561238240175e-05, 'batch_size': 2434, 'optimizer': 'RMSprop'}.
2026-06-15 11:34:13,935 - experiment_functions - INFO - Early stopping at epoch 500. Best Metrics: (0.03133504120885482, 0.003588652957331369, 0.015114822957663868)
2026-06-15 11:34:14,027 - optuna.study.study - INFO - Trial 81 finished with values: [0.03133504120885482, 0.003588652957331369, 0.015114822957663868] and parameters: {'n_layers': 4, 'embedding_dim': 256, 'lr': 0.0858732081596601, 'lambda_val': 0.0006322078828082113, 'batch_size': 3981, 'optimizer': 'RMSprop'}.
2026-06-15 11:34:37,286 - experiment_functions - INFO - Early stopping at epoch 550. Best Metrics: (0.00046469349537269546, 7.87058744725032e-05, 0.00021881771129529158)
2026-06-15 11:34:37,380 - optuna.study.study - INFO - Trial 82 finished with values: [0.00046469349537269546, 7.87058744725032e-05, 0.00021881771129529158] and parameters: {'n_layers': 4, 'embedding_dim': 32, 'lr': 1.4920013235879184e-05, 'lambda_val': 0.026359968516020325, 'batch_size': 2872, 'optimizer': 'Adam'}.
2026-06-15 11:36:24,864 - experiment_functions - INFO - Early stopping at epoch 2400. Best Metrics: (0.055877939798494335, 0.006646459910241812, 0.02686905565620543)
2026-06-15 11:36:24,934 - optuna.study.study - INFO - Trial 83 finished with values: [0.055877939798494335, 0.006646459910241812, 0.02686905565620543] and parameters: {'n_layers': 3, 'embedding_dim': 96, 'lr': 0.0009437548244297628, 'lambda_val': 1.509459220212265e-05, 'batch_size': 2270, 'optimizer': 'RMSprop'}.
2026-06-15 11:36:49,588 - experiment_functions - INFO - Early stopping at epoch 500. Best Metrics: (0.0003719016544546441, 6.698372295532186e-05, 0.0001980236204865239)
2026-06-15 11:36:49,669 - optuna.study.study - INFO - Trial 84 finished with values: [0.0003719016544546441, 6.698372295532186e-05, 0.0001980236204865239] and parameters: {'n_layers': 3, 'embedding_dim': 128, 'lr': 0.05311018382193878, 'lambda_val': 3.0681113443407845e-05, 'batch_size': 3690, 'optimizer': 'SGD'}.
2026-06-15 11:37:57,471 - experiment_functions - INFO - Early stopping at epoch 1500. Best Metrics: (0.05643246819802629, 0.0067536338669703265, 0.027676267324072638)
2026-06-15 11:37:57,540 - optuna.study.study - INFO - Trial 85 finished with values: [0.05643246819802629, 0.0067536338669703265, 0.027676267324072638] and parameters: {'n_layers': 3, 'embedding_dim': 96, 'lr': 0.0009437548244297628, 'lambda_val': 0.0004230572417097157, 'batch_size': 3360, 'optimizer': 'Adam'}.
2026-06-15 11:38:23,280 - experiment_functions - INFO - Early stopping at epoch 600. Best Metrics: (0.03555805551846212, 0.00451302833411481, 0.016710751886099096)
