2026-06-15 07:19:52,029 - optuna.study.study - INFO - Trial 191 finished with values: [0.04981684242401137, 0.005380467546386229, 0.02298582810669225] and parameters: {'n_layers': 3, 'embedding_dim': 96, 'lr': 0.017221400491445694, 'lambda_val': 3.385899724058381e-05, 'batch_size': 1491, 'optimizer': 'RMSprop'}.
2026-06-15 07:21:16,239 - experiment_functions - INFO - Early stopping at epoch 1700. Best Metrics: (0.008785064767854123, 0.0011671913724964835, 0.00389769596547844)
2026-06-15 07:21:16,330 - optuna.study.study - INFO - Trial 192 finished with values: [0.008785064767854123, 0.0011671913724964835, 0.00389769596547844] and parameters: {'n_layers': 4, 'embedding_dim': 128, 'lr': 0.002500554323958941, 'lambda_val': 0.046252186968184526, 'batch_size': 3067, 'optimizer': 'RMSprop'}.
2026-06-15 07:21:37,461 - experiment_functions - INFO - Early stopping at epoch 500. Best Metrics: (0.000541563930545408, 7.2007502176971e-05, 0.0002466289241308451)
2026-06-15 07:21:37,691 - optuna.study.study - INFO - Trial 193 finished with values: [0.000541563930545408, 7.2007502176971e-05, 0.0002466289241308451] and parameters: {'n_layers': 3, 'embedding_dim': 32, 'lr': 1.0711447388272507e-05, 'lambda_val': 0.0007531818922155074, 'batch_size': 1066, 'optimizer': 'Adam'}.
2026-06-15 07:24:25,146 - optuna.study.study - INFO - Trial 194 finished with values: [0.10446837520584552, 0.012601312880969924, 0.05779141483773027] and parameters: {'n_layers': 1, 'embedding_dim': 96, 'lr': 0.0013635493562820199, 'lambda_val': 4.768107725372831e-05, 'batch_size': 2519, 'optimizer': 'Adam'}.
2026-06-15 07:24:55,211 - experiment_functions - INFO - Early stopping at epoch 650. Best Metrics: (0.023839270119109766, 0.002642507870587447, 0.010590018145716527)
2026-06-15 07:24:55,286 - optuna.study.study - INFO - Trial 195 finished with values: [0.023839270119109766, 0.002642507870587447, 0.010590018145716527] and parameters: {'n_layers': 3, 'embedding_dim': 96, 'lr': 0.017221400491445694, 'lambda_val': 0.0018713046645249234, 'batch_size': 3178, 'optimizer': 'RMSprop'}.
2026-06-15 07:27:38,916 - optuna.study.study - INFO - Trial 196 finished with values: [0.0993085489785191, 0.012298211534597094, 0.05435064125746173] and parameters: {'n_layers': 1, 'embedding_dim': 96, 'lr': 0.0013635493562820199, 'lambda_val': 1.722502032465723e-05, 'batch_size': 1670, 'optimizer': 'Adam'}.
2026-06-15 07:28:11,176 - experiment_functions - INFO - Early stopping at epoch 750. Best Metrics: (0.052459118262981455, 0.006949561256614643, 0.025246274153017816)
2026-06-15 07:28:11,256 - optuna.study.study - INFO - Trial 197 finished with values: [0.052459118262981455, 0.006949561256614643, 0.025246274153017816] and parameters: {'n_layers': 1, 'embedding_dim': 96, 'lr': 0.002403322646261187, 'lambda_val': 0.022611772499362814, 'batch_size': 3384, 'optimizer': 'Adam'}.
2026-06-15 07:31:01,973 - optuna.study.study - INFO - Trial 198 finished with values: [0.1042438120390321, 0.012646526893964765, 0.057321788147413844] and parameters: {'n_layers': 1, 'embedding_dim': 128, 'lr': 0.0013635493562820199, 'lambda_val': 1.722502032465723e-05, 'batch_size': 1670, 'optimizer': 'Adam'}.
2026-06-15 07:31:42,288 - experiment_functions - INFO - Early stopping at epoch 950. Best Metrics: (0.025808437797748676, 0.003498224931341684, 0.01320485348146357)
2026-06-15 07:31:42,374 - optuna.study.study - INFO - Trial 199 finished with values: [0.025808437797748676, 0.003498224931341684, 0.01320485348146357] and parameters: {'n_layers': 1, 'embedding_dim': 128, 'lr': 0.01996792465326568, 'lambda_val': 4.768107725372831e-05, 'batch_size': 887, 'optimizer': 'RMSprop'}.
2026-06-15 07:34:16,475 - optuna.study.study - INFO - Trial 200 finished with values: [0.07911596849654504, 0.01007435193248041, 0.04494055671640384] and parameters: {'n_layers': 1, 'embedding_dim': 32, 'lr': 0.0013399936052392054, 'lambda_val': 0.00012183196897012276, 'batch_size': 1126, 'optimizer': 'RMSprop'}.
2026-06-15 07:37:01,321 - optuna.study.study - INFO - Trial 201 finished with values: [0.0990225250155798, 0.012299886127670976, 0.05286659230863542] and parameters: {'n_layers': 1, 'embedding_dim': 96, 'lr': 0.0013635493562820199, 'lambda_val': 0.00036402541279450417, 'batch_size': 1670, 'optimizer': 'Adam'}.
2026-06-15 07:37:56,285 - experiment_functions - INFO - Early stopping at epoch 1300. Best Metrics: (0.0963730833735788, 0.011871190300756916, 0.05113283997799344)
2026-06-15 07:37:56,362 - optuna.study.study - INFO - Trial 202 finished with values: [0.0963730833735788, 0.011871190300756916, 0.05113283997799344] and parameters: {'n_layers': 1, 'embedding_dim': 96, 'lr': 0.002403322646261187, 'lambda_val': 4.768107725372831e-05, 'batch_size': 1670, 'optimizer': 'Adam'}.
2026-06-15 07:40:19,832 - experiment_functions - INFO - Early stopping at epoch 3450. Best Metrics: (0.10247056153947104, 0.012217831067050705, 0.05418738684403647)
2026-06-15 07:40:19,913 - optuna.study.study - INFO - Trial 203 finished with values: [0.10247056153947104, 0.012217831067050705, 0.05418738684403647] and parameters: {'n_layers': 1, 'embedding_dim': 96, 'lr': 0.0013635493562820199, 'lambda_val': 1.2492162876084175e-05, 'batch_size': 4084, 'optimizer': 'Adam'}.
2026-06-15 07:41:29,837 - experiment_functions - INFO - Early stopping at epoch 1500. Best Metrics: (0.022314003399848726, 0.0026910710697300552, 0.009992904909928109)
2026-06-15 07:41:29,924 - optuna.study.study - INFO - Trial 204 finished with values: [0.022314003399848726, 0.0026910710697300552, 0.009992904909928109] and parameters: {'n_layers': 3, 'embedding_dim': 128, 'lr': 0.0013399936052392054, 'lambda_val': 0.008754516011129079, 'batch_size': 1760, 'optimizer': 'RMSprop'}.
2026-06-15 07:44:04,985 - optuna.study.study - INFO - Trial 205 finished with values: [0.0857974222406767, 0.010454484560251859, 0.04689419429677827] and parameters: {'n_layers': 1, 'embedding_dim': 32, 'lr': 0.0031668054510016214, 'lambda_val': 7.341702196089064e-06, 'batch_size': 665, 'optimizer': 'Adam'}.
2026-06-15 07:44:42,680 - experiment_functions - INFO - Early stopping at epoch 850. Best Metrics: (0.0870775424679537, 0.01063534061223123, 0.04539203821956157)
2026-06-15 07:44:42,813 - optuna.study.study - INFO - Trial 206 finished with values: [0.0870775424679537, 0.01063534061223123, 0.04539203821956157] and parameters: {'n_layers': 1, 'embedding_dim': 128, 'lr': 0.0019049517999197474, 'lambda_val': 0.0003193434431604667, 'batch_size': 3123, 'optimizer': 'RMSprop'}.
2026-06-15 07:47:19,002 - optuna.study.study - INFO - Trial 207 finished with values: [0.0008250588044286947, 0.00013061825976287765, 0.00039011582606479937] and parameters: {'n_layers': 1, 'embedding_dim': 128, 'lr': 0.0002143320371877716, 'lambda_val': 1.7950457155654556e-06, 'batch_size': 1670, 'optimizer': 'RMSprop'}.
2026-06-15 07:48:01,132 - experiment_functions - INFO - Early stopping at epoch 1000. Best Metrics: (0.08879439503441702, 0.01083964096724496, 0.04811986661808731)
2026-06-15 07:48:01,205 - optuna.study.study - INFO - Trial 208 finished with values: [0.08879439503441702, 0.01083964096724496, 0.04811986661808731] and parameters: {'n_layers': 1, 'embedding_dim': 64, 'lr': 0.0019049517999197474, 'lambda_val': 1.2492162876084175e-05, 'batch_size': 3123, 'optimizer': 'RMSprop'}.
2026-06-15 07:49:20,670 - experiment_functions - INFO - Early stopping at epoch 1850. Best Metrics: (0.09505722052760239, 0.011487708486837696, 0.05141422347131497)
2026-06-15 07:49:20,747 - optuna.study.study - INFO - Trial 209 finished with values: [0.09505722052760239, 0.011487708486837696, 0.05141422347131497] and parameters: {'n_layers': 1, 'embedding_dim': 128, 'lr': 0.0016748417327479524, 'lambda_val': 0.0003193434431604667, 'batch_size': 2538, 'optimizer': 'Adam'}.
2026-06-15 07:50:02,997 - experiment_functions - INFO - Early stopping at epoch 1050. Best Metrics: (0.07560343029433647, 0.009165047893361913, 0.03952541001387804)
2026-06-15 07:50:03,103 - optuna.study.study - INFO - Trial 210 finished with values: [0.07560343029433647, 0.009165047893361913, 0.03952541001387804] and parameters: {'n_layers': 1, 'embedding_dim': 32, 'lr': 0.002403322646261187, 'lambda_val': 0.0003193434431604667, 'batch_size': 2538, 'optimizer': 'RMSprop'}.
2026-06-15 07:50:44,506 - experiment_functions - INFO - Early stopping at epoch 950. Best Metrics: (0.08403144077840867, 0.01008607408399759, 0.04255861162847798)
2026-06-15 07:50:44,589 - optuna.study.study - INFO - Trial 211 finished with values: [0.08403144077840867, 0.01008607408399759, 0.04255861162847798] and parameters: {'n_layers': 1, 'embedding_dim': 128, 'lr': 0.0024604251371383177, 'lambda_val': 1.2492162876084175e-05, 'batch_size': 1670, 'optimizer': 'RMSprop'}.
2026-06-15 07:51:08,318 - experiment_functions - INFO - Early stopping at epoch 550. Best Metrics: (0.02716342693379954, 0.0035819545850358367, 0.013266867912406246)
2026-06-15 07:51:08,411 - optuna.study.study - INFO - Trial 212 finished with values: [0.02716342693379954, 0.0035819545850358367, 0.013266867912406246] and parameters: {'n_layers': 1, 'embedding_dim': 96, 'lr': 0.05862402476164565, 'lambda_val': 1.722502032465723e-05, 'batch_size': 3700, 'optimizer': 'Adam'}.
2026-06-15 07:53:33,955 - experiment_functions - INFO - Early stopping at epoch 3650. Best Metrics: (0.08713101352912313, 0.01047625427021234, 0.04574639245758748)
2026-06-15 07:53:34,039 - optuna.study.study - INFO - Trial 213 finished with values: [0.08713101352912313, 0.01047625427021234, 0.04574639245758748] and parameters: {'n_layers': 1, 'embedding_dim': 64, 'lr': 0.002403322646261187, 'lambda_val': 1.2492162876084175e-05, 'batch_size': 1126, 'optimizer': 'RMSprop'}.
2026-06-15 07:56:24,370 - optuna.study.study - INFO - Trial 214 finished with values: [0.10417835109402106, 0.012636479335521469, 0.05691649510099194] and parameters: {'n_layers': 1, 'embedding_dim': 128, 'lr': 0.0013635493562820199, 'lambda_val': 1.722502032465723e-05, 'batch_size': 2420, 'optimizer': 'Adam'}.
2026-06-15 07:59:30,568 - optuna.study.study - INFO - Trial 215 finished with values: [0.042563033179394937, 0.0050421997454618535, 0.020149989267430325] and parameters: {'n_layers': 3, 'embedding_dim': 128, 'lr': 0.0016188619661959155, 'lambda_val': 3.730092649254184e-05, 'batch_size': 2363, 'optimizer': 'RMSprop'}.
2026-06-15 08:00:14,734 - experiment_functions - INFO - Early stopping at epoch 1000. Best Metrics: (0.09571905592173674, 0.011712103958738028, 0.05087121451677986)
2026-06-15 08:00:14,812 - optuna.study.study - INFO - Trial 216 finished with values: [0.09571905592173674, 0.011712103958738028, 0.05087121451677986] and parameters: {'n_layers': 1, 'embedding_dim': 128, 'lr': 0.002500554323958941, 'lambda_val': 0.00010936849207517709, 'batch_size': 3170, 'optimizer': 'Adam'}.
2026-06-15 08:00:49,640 - experiment_functions - INFO - Early stopping at epoch 750. Best Metrics: (0.029805740615573156, 0.003503248710563333, 0.01341873969313493)
2026-06-15 08:00:49,939 - optuna.study.study - INFO - Trial 217 finished with values: [0.029805740615573156, 0.003503248710563333, 0.01341873969313493] and parameters: {'n_layers': 3, 'embedding_dim': 96, 'lr': 0.002403322646261187, 'lambda_val': 0.0020014727227486086, 'batch_size': 4084, 'optimizer': 'RMSprop'}.
2026-06-15 08:01:35,925 - experiment_functions - INFO - Early stopping at epoch 1050. Best Metrics: (0.09203894464002275, 0.01120302766427758, 0.04892380256036061)
2026-06-15 08:01:36,012 - optuna.study.study - INFO - Trial 218 finished with values: [0.09203894464002275, 0.01120302766427758, 0.04892380256036061] and parameters: {'n_layers': 1, 'embedding_dim': 128, 'lr': 0.002403322646261187, 'lambda_val': 0.0003193434431604667, 'batch_size': 2538, 'optimizer': 'Adam'}.
2026-06-15 08:03:46,792 - experiment_functions - INFO - Early stopping at epoch 2800. Best Metrics: (0.04608401312435854, 0.005475919351597563, 0.0217057840340072)
2026-06-15 08:03:46,875 - optuna.study.study - INFO - Trial 219 finished with values: [0.04608401312435854, 0.005475919351597563, 0.0217057840340072] and parameters: {'n_layers': 3, 'embedding_dim': 128, 'lr': 0.0013635493562820199, 'lambda_val': 1.722502032465723e-05, 'batch_size': 1126, 'optimizer': 'RMSprop'}.
2026-06-15 08:04:33,047 - experiment_functions - INFO - Early stopping at epoch 1050. Best Metrics: (0.0953857188464007, 0.011722151517181326, 0.052113700725731606)
2026-06-15 08:04:33,130 - optuna.study.study - INFO - Trial 220 finished with values: [0.0953857188464007, 0.011722151517181326, 0.052113700725731606] and parameters: {'n_layers': 1, 'embedding_dim': 128, 'lr': 0.002403322646261187, 'lambda_val': 1.722502032465723e-05, 'batch_size': 2363, 'optimizer': 'Adam'}.
2026-06-15 08:05:15,622 - experiment_functions - INFO - Early stopping at epoch 950. Best Metrics: (0.06925238937858058, 0.008562194386764015, 0.03483635965138568)
2026-06-15 08:05:15,697 - optuna.study.study - INFO - Trial 221 finished with values: [0.06925238937858058, 0.008562194386764015, 0.03483635965138568] and parameters: {'n_layers': 2, 'embedding_dim': 96, 'lr': 0.001230678069228945, 'lambda_val': 1.2492162876084175e-05, 'batch_size': 2363, 'optimizer': 'RMSprop'}.
2026-06-15 08:08:00,212 - optuna.study.study - INFO - Trial 222 finished with values: [0.09709170714979486, 0.011958269140598835, 0.05239370838889063] and parameters: {'n_layers': 1, 'embedding_dim': 96, 'lr': 0.0013399936052392054, 'lambda_val': 1.722502032465723e-05, 'batch_size': 1670, 'optimizer': 'RMSprop'}.
2026-06-15 08:08:54,846 - experiment_functions - INFO - Early stopping at epoch 1300. Best Metrics: (0.08938668657461082, 0.011149440685913324, 0.046436299242404055)
2026-06-15 08:08:54,934 - optuna.study.study - INFO - Trial 223 finished with values: [0.08938668657461082, 0.011149440685913324, 0.046436299242404055] and parameters: {'n_layers': 1, 'embedding_dim': 96, 'lr': 0.0013635493562820199, 'lambda_val': 0.0016135144594650256, 'batch_size': 4084, 'optimizer': 'Adam'}.
2026-06-15 08:09:48,355 - experiment_functions - INFO - Early stopping at epoch 1300. Best Metrics: (0.08759450086887695, 0.010342286824301697, 0.04571446516507793)
2026-06-15 08:09:48,437 - optuna.study.study - INFO - Trial 224 finished with values: [0.08759450086887695, 0.010342286824301697, 0.04571446516507793] and parameters: {'n_layers': 1, 'embedding_dim': 64, 'lr': 0.002403322646261187, 'lambda_val': 8.845755176013004e-06, 'batch_size': 2519, 'optimizer': 'RMSprop'}.
2026-06-15 08:10:20,222 - experiment_functions - INFO - Early stopping at epoch 700. Best Metrics: (0.06519157597139236, 0.00823899792350459, 0.0339227110637373)
2026-06-15 08:10:20,309 - optuna.study.study - INFO - Trial 225 finished with values: [0.06519157597139236, 0.00823899792350459, 0.0339227110637373] and parameters: {'n_layers': 2, 'embedding_dim': 96, 'lr': 0.002500554323958941, 'lambda_val': 0.0008463152031500274, 'batch_size': 1883, 'optimizer': 'Adam'}.
2026-06-15 08:13:09,313 - optuna.study.study - INFO - Trial 226 finished with values: [0.10060789023165434, 0.012333377989148638, 0.05459747367389781] and parameters: {'n_layers': 1, 'embedding_dim': 128, 'lr': 0.0013635493562820199, 'lambda_val': 0.00036402541279450417, 'batch_size': 1587, 'optimizer': 'Adam'}.
2026-06-15 08:13:46,293 - experiment_functions - INFO - Early stopping at epoch 850. Best Metrics: (0.07390438403227956, 0.009355951503784581, 0.037600176594726885)
2026-06-15 08:13:46,385 - optuna.study.study - INFO - Trial 227 finished with values: [0.07390438403227956, 0.009355951503784581, 0.037600176594726885] and parameters: {'n_layers': 1, 'embedding_dim': 128, 'lr': 0.002403322646261187, 'lambda_val': 0.005404200201710886, 'batch_size': 2519, 'optimizer': 'Adam'}.
2026-06-15 08:14:10,635 - experiment_functions - INFO - Early stopping at epoch 500. Best Metrics: (0.0004940868291980222, 7.2007502176971e-05, 0.00019956133957655368)
2026-06-15 08:14:10,733 - optuna.study.study - INFO - Trial 228 finished with values: [0.0004940868291980222, 7.2007502176971e-05, 0.00019956133957655368] and parameters: {'n_layers': 1, 'embedding_dim': 256, 'lr': 0.00012020349651271694, 'lambda_val': 6.8336144179305345e-06, 'batch_size': 3067, 'optimizer': 'Adam'}.
2026-06-15 08:14:47,207 - experiment_functions - INFO - Early stopping at epoch 900. Best Metrics: (0.00038455836933541036, 6.698372295532187e-05, 0.00019877450972105047)
2026-06-15 08:14:47,275 - optuna.study.study - INFO - Trial 229 finished with values: [0.00038455836933541036, 6.698372295532187e-05, 0.00019877450972105047] and parameters: {'n_layers': 1, 'embedding_dim': 96, 'lr': 2.0034246334664206e-05, 'lambda_val': 0.0015551672896221768, 'batch_size': 2363, 'optimizer': 'RMSprop'}.
2026-06-15 08:15:21,757 - experiment_functions - INFO - Early stopping at epoch 800. Best Metrics: (0.04293887810208249, 0.00560151383213879, 0.020676557472837736)
2026-06-15 08:15:21,854 - optuna.study.study - INFO - Trial 230 finished with values: [0.04293887810208249, 0.00560151383213879, 0.020676557472837736] and parameters: {'n_layers': 1, 'embedding_dim': 128, 'lr': 0.002403322646261187, 'lambda_val': 0.02963250025551523, 'batch_size': 2538, 'optimizer': 'Adam'}.
2026-06-15 08:18:26,867 - optuna.study.study - INFO - Trial 231 finished with values: [0.08552615004743361, 0.010134637283140195, 0.04309094555423764] and parameters: {'n_layers': 1, 'embedding_dim': 256, 'lr': 0.002403322646261187, 'lambda_val': 6.096576799304491e-06, 'batch_size': 1137, 'optimizer': 'RMSprop'}.
2026-06-15 08:20:08,349 - experiment_functions - INFO - Early stopping at epoch 2400. Best Metrics: (0.0855075327938555, 0.010271953915198606, 0.04363960918001235)
2026-06-15 08:20:08,435 - optuna.study.study - INFO - Trial 232 finished with values: [0.0855075327938555, 0.010271953915198606, 0.04363960918001235] and parameters: {'n_layers': 1, 'embedding_dim': 128, 'lr': 0.002403322646261187, 'lambda_val': 1.2492162876084175e-05, 'batch_size': 1137, 'optimizer': 'RMSprop'}.
2026-06-15 08:22:56,343 - optuna.study.study - INFO - Trial 233 finished with values: [0.0929262340143392, 0.011412351798512962, 0.048759389371045486] and parameters: {'n_layers': 1, 'embedding_dim': 128, 'lr': 0.0013399936052392054, 'lambda_val': 0.00036402541279450417, 'batch_size': 885, 'optimizer': 'RMSprop'}.
2026-06-15 08:23:26,917 - experiment_functions - INFO - Early stopping at epoch 700. Best Metrics: (0.06422256768838872, 0.008039721347712506, 0.03319012088733748)
2026-06-15 08:23:27,038 - optuna.study.study - INFO - Trial 234 finished with values: [0.06422256768838872, 0.008039721347712506, 0.03319012088733748] and parameters: {'n_layers': 2, 'embedding_dim': 64, 'lr': 0.0031668054510016214, 'lambda_val': 1.722502032465723e-05, 'batch_size': 2363, 'optimizer': 'Adam'}.
2026-06-15 08:26:11,596 - optuna.study.study - INFO - Trial 235 finished with values: [0.09220528255858787, 0.011045615915332575, 0.04707953137501068] and parameters: {'n_layers': 1, 'embedding_dim': 96, 'lr': 0.001903084586886964, 'lambda_val': 1.722502032465723e-05, 'batch_size': 1670, 'optimizer': 'RMSprop'}.
2026-06-15 08:26:50,431 - experiment_functions - INFO - Early stopping at epoch 900. Best Metrics: (0.08481394452628448, 0.010206644785317168, 0.04400019232872567)
2026-06-15 08:26:51,020 - optuna.study.study - INFO - Trial 236 finished with values: [0.08481394452628448, 0.010206644785317168, 0.04400019232872567] and parameters: {'n_layers': 1, 'embedding_dim': 96, 'lr': 0.002403322646261187, 'lambda_val': 1.722502032465723e-05, 'batch_size': 4084, 'optimizer': 'RMSprop'}.
2026-06-15 08:27:33,681 - experiment_functions - INFO - Early stopping at epoch 1050. Best Metrics: (0.019647352515106655, 0.0025453814723022305, 0.008961975134109738)
2026-06-15 08:27:33,764 - optuna.study.study - INFO - Trial 237 finished with values: [0.019647352515106655, 0.0025453814723022305, 0.008961975134109738] and parameters: {'n_layers': 1, 'embedding_dim': 96, 'lr': 0.0013635493562820199, 'lambda_val': 0.08299134806435796, 'batch_size': 2519, 'optimizer': 'RMSprop'}.
2026-06-15 08:28:31,978 - experiment_functions - INFO - Early stopping at epoch 1250. Best Metrics: (0.050664873815553145, 0.006512492464331167, 0.024535694859290698)
2026-06-15 08:28:32,061 - optuna.study.study - INFO - Trial 238 finished with values: [0.050664873815553145, 0.006512492464331167, 0.024535694859290698] and parameters: {'n_layers': 1, 'embedding_dim': 256, 'lr': 0.0013635493562820199, 'lambda_val': 0.01699516734246832, 'batch_size': 1243, 'optimizer': 'RMSprop'}.
2026-06-15 08:30:31,616 - experiment_functions - INFO - Early stopping at epoch 2950. Best Metrics: (0.09860782897639984, 0.011943197802933885, 0.05367372416399661)
2026-06-15 08:30:31,700 - optuna.study.study - INFO - Trial 239 finished with values: [0.09860782897639984, 0.011943197802933885, 0.05367372416399661] and parameters: {'n_layers': 1, 'embedding_dim': 64, 'lr': 0.0013635493562820199, 'lambda_val': 1.722502032465723e-05, 'batch_size': 3123, 'optimizer': 'RMSprop'}.
2026-06-15 08:31:11,566 - experiment_functions - INFO - Early stopping at epoch 900. Best Metrics: (0.0931832146456852, 0.01144249447384286, 0.04894974278472371)
2026-06-15 08:31:11,967 - optuna.study.study - INFO - Trial 240 finished with values: [0.0931832146456852, 0.01144249447384286, 0.04894974278472371] and parameters: {'n_layers': 1, 'embedding_dim': 128, 'lr': 0.0031668054510016214, 'lambda_val': 1.722502032465723e-05, 'batch_size': 2363, 'optimizer': 'Adam'}.
2026-06-15 08:32:05,511 - experiment_functions - INFO - Early stopping at epoch 1050. Best Metrics: (0.03255078663381212, 0.0038867305244825513, 0.015173308050656729)
2026-06-15 08:32:05,582 - optuna.study.study - INFO - Trial 241 finished with values: [0.03255078663381212, 0.0038867305244825513, 0.015173308050656729] and parameters: {'n_layers': 4, 'embedding_dim': 128, 'lr': 0.0031673995217555086, 'lambda_val': 1.722502032465723e-05, 'batch_size': 2363, 'optimizer': 'Adam'}.
