2026-06-14 12:15:22,094 - optuna.study.study - INFO - Trial 37 finished with values: [0.008718230596650273, 0.0011353741040927056, 0.004011615858778608] and parameters: {'n_layers': 4, 'embedding_dim': 128, 'lr': 0.04590943204225566, 'lambda_val': 0.02204357884427882, 'batch_size': 3614, 'optimizer': 'Adam'}.
2026-06-14 12:17:34,104 - experiment_functions - INFO - Early stopping at epoch 3400. Best Metrics: (0.022433350783303496, 0.0029389108446647464, 0.010461950315437448)
2026-06-14 12:17:34,198 - optuna.study.study - INFO - Trial 38 finished with values: [0.022433350783303496, 0.0029389108446647464, 0.010461950315437448] and parameters: {'n_layers': 3, 'embedding_dim': 32, 'lr': 0.0006101102889837555, 'lambda_val': 0.02960094540818141, 'batch_size': 1724, 'optimizer': 'Adam'}.
2026-06-14 12:17:56,013 - experiment_functions - INFO - Early stopping at epoch 550. Best Metrics: (0.0005654742965156842, 7.87058744725032e-05, 0.00022629230476124422)
2026-06-14 12:17:56,086 - optuna.study.study - INFO - Trial 39 finished with values: [0.0005654742965156842, 7.87058744725032e-05, 0.00022629230476124422] and parameters: {'n_layers': 1, 'embedding_dim': 32, 'lr': 0.00021462964196250622, 'lambda_val': 0.009026518760244583, 'batch_size': 1521, 'optimizer': 'Adam'}.
2026-06-14 12:18:23,834 - experiment_functions - INFO - Early stopping at epoch 500. Best Metrics: (0.0004148319772389134, 7.703128139862015e-05, 0.00019699995424496755)
2026-06-14 12:18:23,912 - optuna.study.study - INFO - Trial 40 finished with values: [0.0004148319772389134, 7.703128139862015e-05, 0.00019699995424496755] and parameters: {'n_layers': 1, 'embedding_dim': 256, 'lr': 0.0006343817365097772, 'lambda_val': 4.620590125320207e-06, 'batch_size': 2912, 'optimizer': 'SGD'}.
2026-06-14 12:18:46,820 - experiment_functions - INFO - Early stopping at epoch 550. Best Metrics: (0.00028122475803311675, 4.856319914260835e-05, 0.00012396605455335187)
2026-06-14 12:18:47,008 - optuna.study.study - INFO - Trial 41 finished with values: [0.00028122475803311675, 4.856319914260835e-05, 0.00012396605455335187] and parameters: {'n_layers': 1, 'embedding_dim': 64, 'lr': 1.517941549302569e-05, 'lambda_val': 0.008697486329982953, 'batch_size': 2097, 'optimizer': 'RMSprop'}.
2026-06-14 12:19:09,544 - experiment_functions - INFO - Early stopping at epoch 500. Best Metrics: (0.0006297128645509018, 7.703128139862013e-05, 0.0002388338651958469)
2026-06-14 12:19:10,299 - optuna.study.study - INFO - Trial 42 finished with values: [0.0006297128645509018, 7.703128139862013e-05, 0.0002388338651958469] and parameters: {'n_layers': 1, 'embedding_dim': 128, 'lr': 1.1837803620871388e-05, 'lambda_val': 0.00017639997626705723, 'batch_size': 1881, 'optimizer': 'SGD'}.
2026-06-14 12:22:26,560 - optuna.study.study - INFO - Trial 43 finished with values: [0.021453513928121313, 0.003061156139058209, 0.011115641569459095] and parameters: {'n_layers': 4, 'embedding_dim': 128, 'lr': 0.00012396135781114173, 'lambda_val': 5.849681189534656e-05, 'batch_size': 2903, 'optimizer': 'RMSprop'}.
2026-06-14 12:22:49,801 - experiment_functions - INFO - Early stopping at epoch 500. Best Metrics: (0.0005449639146171404, 7.2007502176971e-05, 0.0002647325680000038)
2026-06-14 12:22:49,875 - optuna.study.study - INFO - Trial 44 finished with values: [0.0005449639146171404, 7.2007502176971e-05, 0.0002647325680000038] and parameters: {'n_layers': 2, 'embedding_dim': 128, 'lr': 0.0009165912474127543, 'lambda_val': 0.0009028699871947036, 'batch_size': 2783, 'optimizer': 'SGD'}.
2026-06-14 12:23:15,820 - experiment_functions - INFO - Early stopping at epoch 500. Best Metrics: (0.0005593228191120473, 7.033290910308795e-05, 0.00022980847739559877)
2026-06-14 12:23:15,998 - optuna.study.study - INFO - Trial 45 finished with values: [0.0005593228191120473, 7.033290910308795e-05, 0.00022980847739559877] and parameters: {'n_layers': 4, 'embedding_dim': 128, 'lr': 0.0229885862247751, 'lambda_val': 0.0005039688920258961, 'batch_size': 958, 'optimizer': 'SGD'}.
2026-06-14 12:23:53,934 - experiment_functions - INFO - Early stopping at epoch 900. Best Metrics: (0.00041613087193776674, 7.87058744725032e-05, 0.00023696818481583703)
2026-06-14 12:23:54,006 - optuna.study.study - INFO - Trial 46 finished with values: [0.00041613087193776674, 7.87058744725032e-05, 0.00023696818481583703] and parameters: {'n_layers': 1, 'embedding_dim': 96, 'lr': 4.0618712298134785e-05, 'lambda_val': 1.1933812384845947e-05, 'batch_size': 3748, 'optimizer': 'Adam'}.
2026-06-14 12:24:17,964 - experiment_functions - INFO - Early stopping at epoch 550. Best Metrics: (0.05196880188966211, 0.006524214615848349, 0.0255309410621443)
2026-06-14 12:24:18,040 - optuna.study.study - INFO - Trial 47 finished with values: [0.05196880188966211, 0.006524214615848349, 0.0255309410621443] and parameters: {'n_layers': 2, 'embedding_dim': 32, 'lr': 0.012247370054838723, 'lambda_val': 2.6136942653041923e-05, 'batch_size': 3749, 'optimizer': 'Adam'}.
2026-06-14 12:25:00,050 - experiment_functions - INFO - Early stopping at epoch 900. Best Metrics: (0.0005039503088801824, 9.210261906356753e-05, 0.00026180497439844743)
2026-06-14 12:25:00,259 - optuna.study.study - INFO - Trial 48 finished with values: [0.0005039503088801824, 9.210261906356753e-05, 0.00026180497439844743] and parameters: {'n_layers': 1, 'embedding_dim': 256, 'lr': 1.6885548116768026e-05, 'lambda_val': 8.60960300274209e-05, 'batch_size': 678, 'optimizer': 'RMSprop'}.
2026-06-14 12:28:04,086 - experiment_functions - INFO - Early stopping at epoch 2950. Best Metrics: (0.044942835602492924, 0.005288364927322661, 0.020713604196446127)
2026-06-14 12:28:04,165 - optuna.study.study - INFO - Trial 49 finished with values: [0.044942835602492924, 0.005288364927322661, 0.020713604196446127] and parameters: {'n_layers': 4, 'embedding_dim': 256, 'lr': 0.0009052352884581927, 'lambda_val': 2.113988332261468e-05, 'batch_size': 2310, 'optimizer': 'RMSprop'}.
2026-06-14 12:30:44,483 - experiment_functions - INFO - Early stopping at epoch 3800. Best Metrics: (0.04314120775962612, 0.004449393797307255, 0.019001836173484134)
2026-06-14 12:30:44,563 - optuna.study.study - INFO - Trial 50 finished with values: [0.04314120775962612, 0.004449393797307255, 0.019001836173484134] and parameters: {'n_layers': 2, 'embedding_dim': 96, 'lr': 0.014831110208259727, 'lambda_val': 5.588502828653658e-06, 'batch_size': 3193, 'optimizer': 'Adam'}.
2026-06-14 12:31:57,460 - experiment_functions - INFO - Early stopping at epoch 1800. Best Metrics: (0.0006589738588816322, 9.545180521133365e-05, 0.0003155451071945597)
2026-06-14 12:31:57,541 - optuna.study.study - INFO - Trial 51 finished with values: [0.0006589738588816322, 9.545180521133365e-05, 0.0003155451071945597] and parameters: {'n_layers': 1, 'embedding_dim': 128, 'lr': 3.917620660171595e-05, 'lambda_val': 3.480493981089125e-05, 'batch_size': 3050, 'optimizer': 'Adam'}.
2026-06-14 12:32:34,084 - experiment_functions - INFO - Early stopping at epoch 950. Best Metrics: (0.00047637955607473316, 8.205506062026927e-05, 0.0002247575517091557)
2026-06-14 12:32:34,260 - optuna.study.study - INFO - Trial 52 finished with values: [0.00047637955607473316, 8.205506062026927e-05, 0.0002247575517091557] and parameters: {'n_layers': 1, 'embedding_dim': 32, 'lr': 7.242672828473398e-05, 'lambda_val': 0.0004010528232305161, 'batch_size': 2779, 'optimizer': 'Adam'}.
2026-06-14 12:32:56,456 - experiment_functions - INFO - Early stopping at epoch 500. Best Metrics: (0.0005746228560633716, 0.00010047558443298278, 0.0002629429633573074)
2026-06-14 12:32:56,554 - optuna.study.study - INFO - Trial 53 finished with values: [0.0005746228560633716, 0.00010047558443298278, 0.0002629429633573074] and parameters: {'n_layers': 3, 'embedding_dim': 64, 'lr': 0.018130798648453576, 'lambda_val': 0.0033545157335197707, 'batch_size': 1955, 'optimizer': 'SGD'}.
2026-06-14 12:33:22,901 - experiment_functions - INFO - Early stopping at epoch 550. Best Metrics: (0.03637626443042471, 0.0043941322258691145, 0.017658117586583113)
2026-06-14 12:33:23,787 - optuna.study.study - INFO - Trial 54 finished with values: [0.03637626443042471, 0.0043941322258691145, 0.017658117586583113] and parameters: {'n_layers': 2, 'embedding_dim': 128, 'lr': 0.020854686224199056, 'lambda_val': 0.0001732532813523183, 'batch_size': 1772, 'optimizer': 'RMSprop'}.
2026-06-14 12:35:16,763 - experiment_functions - INFO - Early stopping at epoch 2550. Best Metrics: (0.04108886074297528, 0.004302029606805546, 0.018799357576876265)
2026-06-14 12:35:16,854 - optuna.study.study - INFO - Trial 55 finished with values: [0.04108886074297528, 0.004302029606805546, 0.018799357576876265] and parameters: {'n_layers': 2, 'embedding_dim': 128, 'lr': 0.019631069594048547, 'lambda_val': 1.6369981839363024e-06, 'batch_size': 2843, 'optimizer': 'Adam'}.
2026-06-14 12:35:43,768 - experiment_functions - INFO - Early stopping at epoch 500. Best Metrics: (0.00045031008922113535, 8.372965369415234e-05, 0.00021442948241344234)
2026-06-14 12:35:43,862 - optuna.study.study - INFO - Trial 56 finished with values: [0.00045031008922113535, 8.372965369415234e-05, 0.00021442948241344234] and parameters: {'n_layers': 2, 'embedding_dim': 256, 'lr': 1.1837803620871388e-05, 'lambda_val': 0.008638560753445159, 'batch_size': 626, 'optimizer': 'RMSprop'}.
2026-06-14 12:36:08,209 - experiment_functions - INFO - Early stopping at epoch 550. Best Metrics: (0.0004931807496625898, 7.703128139862015e-05, 0.00025937729834434677)
2026-06-14 12:36:08,287 - optuna.study.study - INFO - Trial 57 finished with values: [0.0004931807496625898, 7.703128139862015e-05, 0.00025937729834434677] and parameters: {'n_layers': 2, 'embedding_dim': 96, 'lr': 4.0659614349918144e-05, 'lambda_val': 0.023436637356109288, 'batch_size': 3131, 'optimizer': 'RMSprop'}.
2026-06-14 12:38:50,534 - optuna.study.study - INFO - Trial 58 finished with values: [0.04191646120861918, 0.005114207247638824, 0.019417419879131335] and parameters: {'n_layers': 1, 'embedding_dim': 128, 'lr': 0.049137531063899446, 'lambda_val': 0.0009668484743513772, 'batch_size': 1772, 'optimizer': 'RMSprop'}.
2026-06-14 12:39:29,764 - experiment_functions - INFO - Early stopping at epoch 550. Best Metrics: (0.006513235572564714, 0.0007552414763212538, 0.0028680305137398113)
2026-06-14 12:39:29,865 - optuna.study.study - INFO - Trial 59 finished with values: [0.006513235572564714, 0.0007552414763212538, 0.0028680305137398113] and parameters: {'n_layers': 4, 'embedding_dim': 256, 'lr': 0.0055531975171824715, 'lambda_val': 0.0734121258978754, 'batch_size': 3157, 'optimizer': 'RMSprop'}.
2026-06-14 12:40:01,940 - experiment_functions - INFO - Early stopping at epoch 500. Best Metrics: (0.0006248409771394686, 8.038046754638624e-05, 0.00024275645026215572)
2026-06-14 12:40:03,091 - optuna.study.study - INFO - Trial 60 finished with values: [0.0006248409771394686, 8.038046754638624e-05, 0.00024275645026215572] and parameters: {'n_layers': 4, 'embedding_dim': 256, 'lr': 1.0323398848515102e-05, 'lambda_val': 0.008922082100337141, 'batch_size': 3619, 'optimizer': 'SGD'}.
2026-06-14 12:42:20,390 - experiment_functions - INFO - Early stopping at epoch 2950. Best Metrics: (0.036330853133656645, 0.004154665416303839, 0.016370947511525166)
2026-06-14 12:42:20,467 - optuna.study.study - INFO - Trial 61 finished with values: [0.036330853133656645, 0.004154665416303839, 0.016370947511525166] and parameters: {'n_layers': 4, 'embedding_dim': 96, 'lr': 0.0059087621734932, 'lambda_val': 5.849681189534656e-05, 'batch_size': 2903, 'optimizer': 'RMSprop'}.
2026-06-14 12:42:47,797 - experiment_functions - INFO - Early stopping at epoch 550. Best Metrics: (0.0004351406791269401, 7.535668832473711e-05, 0.00018912207770545078)
2026-06-14 12:42:48,189 - optuna.study.study - INFO - Trial 62 finished with values: [0.0004351406791269401, 7.535668832473711e-05, 0.00018912207770545078] and parameters: {'n_layers': 3, 'embedding_dim': 128, 'lr': 9.576339362174683e-05, 'lambda_val': 0.00016973001643245622, 'batch_size': 948, 'optimizer': 'Adam'}.
2026-06-14 12:43:24,476 - experiment_functions - INFO - Early stopping at epoch 550. Best Metrics: (0.03124352636063397, 0.003496550338267801, 0.014089723900695055)
2026-06-14 12:43:24,575 - optuna.study.study - INFO - Trial 63 finished with values: [0.03124352636063397, 0.003496550338267801, 0.014089723900695055] and parameters: {'n_layers': 4, 'embedding_dim': 256, 'lr': 0.07596181261878349, 'lambda_val': 1.5795601920073992e-05, 'batch_size': 3614, 'optimizer': 'Adam'}.
2026-06-14 12:46:00,998 - experiment_functions - INFO - Early stopping at epoch 3900. Best Metrics: (0.03523211515249649, 0.0041395940786388905, 0.01687947540805463)
2026-06-14 12:46:01,074 - optuna.study.study - INFO - Trial 64 finished with values: [0.03523211515249649, 0.0041395940786388905, 0.01687947540805463] and parameters: {'n_layers': 2, 'embedding_dim': 64, 'lr': 0.01717117311685491, 'lambda_val': 4.530416824267587e-06, 'batch_size': 626, 'optimizer': 'Adam'}.
2026-06-14 12:46:49,091 - experiment_functions - INFO - Early stopping at epoch 1050. Best Metrics: (0.04277947212026617, 0.005526157143814052, 0.02107258016623115)
2026-06-14 12:46:49,176 - optuna.study.study - INFO - Trial 65 finished with values: [0.04277947212026617, 0.005526157143814052, 0.02107258016623115] and parameters: {'n_layers': 2, 'embedding_dim': 128, 'lr': 0.0008184790240634528, 'lambda_val': 0.017688077953229953, 'batch_size': 3193, 'optimizer': 'Adam'}.
2026-06-14 12:47:16,686 - experiment_functions - INFO - Early stopping at epoch 600. Best Metrics: (0.07143768875611436, 0.008453345836961619, 0.035179409886008844)
2026-06-14 12:47:16,766 - optuna.study.study - INFO - Trial 66 finished with values: [0.07143768875611436, 0.008453345836961619, 0.035179409886008844] and parameters: {'n_layers': 1, 'embedding_dim': 128, 'lr': 0.01359759229313602, 'lambda_val': 1.1933812384845947e-05, 'batch_size': 3602, 'optimizer': 'Adam'}.
2026-06-14 12:50:23,114 - optuna.study.study - INFO - Trial 67 finished with values: [0.03368743003044917, 0.0037929533123451007, 0.015194748871260521] and parameters: {'n_layers': 3, 'embedding_dim': 128, 'lr': 0.006460235541464247, 'lambda_val': 8.380696475709368e-06, 'batch_size': 673, 'optimizer': 'Adam'}.
2026-06-14 12:53:06,957 - optuna.study.study - INFO - Trial 68 finished with values: [0.04475279454019197, 0.005614910576729855, 0.020782254203321877] and parameters: {'n_layers': 1, 'embedding_dim': 128, 'lr': 0.049137531063899446, 'lambda_val': 0.0009668484743513772, 'batch_size': 2658, 'optimizer': 'RMSprop'}.
2026-06-14 12:53:32,290 - experiment_functions - INFO - Early stopping at epoch 600. Best Metrics: (0.006481502172288096, 0.0010734141603590327, 0.003535586788664195)
2026-06-14 12:53:32,369 - optuna.study.study - INFO - Trial 69 finished with values: [0.006481502172288096, 0.0010734141603590327, 0.003535586788664195] and parameters: {'n_layers': 1, 'embedding_dim': 96, 'lr': 0.049137531063899446, 'lambda_val': 5.588502828653658e-06, 'batch_size': 2658, 'optimizer': 'RMSprop'}.
2026-06-14 12:54:05,318 - experiment_functions - INFO - Early stopping at epoch 500. Best Metrics: (0.011910738203482315, 0.0012475718400428695, 0.005890712534932773)
2026-06-14 12:54:05,402 - optuna.study.study - INFO - Trial 70 finished with values: [0.011910738203482315, 0.0012475718400428695, 0.005890712534932773] and parameters: {'n_layers': 4, 'embedding_dim': 256, 'lr': 0.07596181261878349, 'lambda_val': 0.08015276911480321, 'batch_size': 1561, 'optimizer': 'Adam'}.
2026-06-14 12:55:49,065 - experiment_functions - INFO - Early stopping at epoch 2550. Best Metrics: (0.03852984516027498, 0.0041061022171612295, 0.017305895998858525)
2026-06-14 12:55:49,647 - optuna.study.study - INFO - Trial 71 finished with values: [0.03852984516027498, 0.0041061022171612295, 0.017305895998858525] and parameters: {'n_layers': 2, 'embedding_dim': 64, 'lr': 0.017010979332815413, 'lambda_val': 4.530416824267587e-06, 'batch_size': 2722, 'optimizer': 'Adam'}.
2026-06-14 12:56:21,268 - experiment_functions - INFO - Early stopping at epoch 750. Best Metrics: (0.025974957143054533, 0.003327416437805613, 0.012018482430604936)
2026-06-14 12:56:21,355 - optuna.study.study - INFO - Trial 72 finished with values: [0.025974957143054533, 0.003327416437805613, 0.012018482430604936] and parameters: {'n_layers': 3, 'embedding_dim': 32, 'lr': 0.002005854365359982, 'lambda_val': 0.011353389362020643, 'batch_size': 2310, 'optimizer': 'Adam'}.
2026-06-14 12:59:10,331 - optuna.study.study - INFO - Trial 73 finished with values: [0.05372100866147817, 0.0057572509880099145, 0.02514623693338812] and parameters: {'n_layers': 2, 'embedding_dim': 96, 'lr': 0.012247370054838723, 'lambda_val': 1.288219485822485e-06, 'batch_size': 3749, 'optimizer': 'RMSprop'}.
2026-06-14 13:01:54,961 - experiment_functions - INFO - Early stopping at epoch 3950. Best Metrics: (0.03827394009086953, 0.0042484426284412884, 0.017378147889323757)
2026-06-14 13:01:55,040 - optuna.study.study - INFO - Trial 74 finished with values: [0.03827394009086953, 0.0042484426284412884, 0.017378147889323757] and parameters: {'n_layers': 3, 'embedding_dim': 64, 'lr': 0.017010979332815413, 'lambda_val': 0.0003336301702722937, 'batch_size': 2722, 'optimizer': 'RMSprop'}.
2026-06-14 13:03:37,584 - experiment_functions - INFO - Early stopping at epoch 2050. Best Metrics: (0.04029177639440506, 0.004330497689061559, 0.017979188910688167)
2026-06-14 13:03:37,670 - optuna.study.study - INFO - Trial 75 finished with values: [0.04029177639440506, 0.004330497689061559, 0.017979188910688167] and parameters: {'n_layers': 4, 'embedding_dim': 128, 'lr': 0.010960526947587883, 'lambda_val': 0.00017859500187129105, 'batch_size': 2903, 'optimizer': 'RMSprop'}.
2026-06-14 13:04:03,022 - experiment_functions - INFO - Early stopping at epoch 550. Best Metrics: (0.03929830593047934, 0.004564940719405185, 0.016862930884935394)
2026-06-14 13:04:03,171 - optuna.study.study - INFO - Trial 76 finished with values: [0.03929830593047934, 0.004564940719405185, 0.016862930884935394] and parameters: {'n_layers': 2, 'embedding_dim': 96, 'lr': 0.014831110208259727, 'lambda_val': 5.588502828653658e-06, 'batch_size': 3193, 'optimizer': 'Adam'}.
2026-06-14 13:04:29,715 - experiment_functions - INFO - Early stopping at epoch 600. Best Metrics: (0.06084839563021883, 0.0074351932480407265, 0.02966707464064683)
2026-06-14 13:04:29,802 - optuna.study.study - INFO - Trial 77 finished with values: [0.06084839563021883, 0.0074351932480407265, 0.02966707464064683] and parameters: {'n_layers': 2, 'embedding_dim': 64, 'lr': 0.006265835000649171, 'lambda_val': 0.00039332994716362866, 'batch_size': 3998, 'optimizer': 'Adam'}.
2026-06-14 13:04:54,510 - experiment_functions - INFO - Early stopping at epoch 500. Best Metrics: (0.0004108621000348306, 7.870587447250318e-05, 0.00020826968014719485)
2026-06-14 13:04:54,608 - optuna.study.study - INFO - Trial 78 finished with values: [0.0004108621000348306, 7.870587447250318e-05, 0.00020826968014719485] and parameters: {'n_layers': 4, 'embedding_dim': 96, 'lr': 4.650549644489209e-05, 'lambda_val': 0.048178885309424616, 'batch_size': 2480, 'optimizer': 'Adam'}.
2026-06-14 13:05:48,130 - experiment_functions - INFO - Early stopping at epoch 1050. Best Metrics: (0.0346466811210276, 0.00428193448991895, 0.016222976282645976)
2026-06-14 13:05:48,220 - optuna.study.study - INFO - Trial 79 finished with values: [0.0346466811210276, 0.00428193448991895, 0.016222976282645976] and parameters: {'n_layers': 4, 'embedding_dim': 128, 'lr': 0.001866327471651579, 'lambda_val': 5.9543267651607335e-05, 'batch_size': 1532, 'optimizer': 'Adam'}.
2026-06-14 13:08:25,756 - optuna.study.study - INFO - Trial 80 finished with values: [0.0006488580831116769, 0.00010382477058074888, 0.0002987461842531647] and parameters: {'n_layers': 1, 'embedding_dim': 128, 'lr': 0.00012396135781114173, 'lambda_val': 5.849681189534656e-05, 'batch_size': 1772, 'optimizer': 'RMSprop'}.
2026-06-14 13:08:45,931 - experiment_functions - INFO - Early stopping at epoch 500. Best Metrics: (0.0005108869399653883, 8.038046754638624e-05, 0.00021884412061749483)
2026-06-14 13:08:46,040 - optuna.study.study - INFO - Trial 81 finished with values: [0.0005108869399653883, 8.038046754638624e-05, 0.00021884412061749483] and parameters: {'n_layers': 1, 'embedding_dim': 32, 'lr': 0.000994729763516312, 'lambda_val': 0.00017859500187129105, 'batch_size': 2981, 'optimizer': 'SGD'}.
2026-06-14 13:09:11,379 - experiment_functions - INFO - Early stopping at epoch 550. Best Metrics: (0.016859785326424053, 0.001944202558778217, 0.008184080523544402)
2026-06-14 13:09:11,581 - optuna.study.study - INFO - Trial 82 finished with values: [0.016859785326424053, 0.001944202558778217, 0.008184080523544402] and parameters: {'n_layers': 4, 'embedding_dim': 64, 'lr': 0.07878135701319014, 'lambda_val': 8.370672115052058e-06, 'batch_size': 2722, 'optimizer': 'RMSprop'}.
2026-06-14 13:11:56,839 - optuna.study.study - INFO - Trial 83 finished with values: [0.09666354621354466, 0.011980038850559316, 0.05339067379955518] and parameters: {'n_layers': 1, 'embedding_dim': 96, 'lr': 0.0009052352884581927, 'lambda_val': 2.113988332261468e-05, 'batch_size': 2310, 'optimizer': 'RMSprop'}.
2026-06-14 13:14:30,411 - experiment_functions - INFO - Early stopping at epoch 3300. Best Metrics: (0.049658312032557404, 0.005179516377520263, 0.022579799149822673)
2026-06-14 13:14:30,485 - optuna.study.study - INFO - Trial 84 finished with values: [0.049658312032557404, 0.005179516377520263, 0.022579799149822673] and parameters: {'n_layers': 4, 'embedding_dim': 96, 'lr': 0.014831110208259727, 'lambda_val': 5.588502828653658e-06, 'batch_size': 3193, 'optimizer': 'RMSprop'}.
2026-06-14 13:14:50,827 - experiment_functions - INFO - Early stopping at epoch 500. Best Metrics: (0.0003171312122074203, 6.530912988143882e-05, 0.00017035452006356416)
