2026-06-15 03:12:58,134 - optuna.study.study - INFO - Trial 299 finished with values: [0.0908046583737749, 0.011002076495411618, 0.04841969740693229] and parameters: {'n_layers': 1, 'embedding_dim': 32, 'lr': 0.0029187572679997753, 'lambda_val': 1.3173739854471634e-06, 'batch_size': 1827, 'optimizer': 'Adam'}.
2026-06-15 03:12:58,152 - root - INFO - Selected Trial 266 based on Max ndcg: 0.0585
2026-06-15 03:12:58,152 - root - INFO - Associated Recall: 0.1073
2026-06-15 03:12:58,152 - experiment_functions - INFO - Training the best model ... for e_gowalla_1c3dcs_rand2
2026-06-15 03:16:06,464 - root - INFO -   **** Training e_gowalla_1c3dcs_rand3
2026-06-15 03:16:06,619 - root - INFO -   **** Getting 558671/845292 random edges
2026-06-15 03:16:06,886 - optuna.storages._rdb.storage - INFO - A new study created in RDB with name: Study_e_gowalla_1c3dcs_rand3
2026-06-15 03:16:59,495 - experiment_functions - INFO - Early stopping at epoch 1050. Best Metrics: (0.021860149060775155, 0.002754705606537612, 0.01026419181760805)
2026-06-15 03:16:59,614 - optuna.study.study - INFO - Trial 0 finished with values: [0.021860149060775155, 0.002754705606537612, 0.01026419181760805] and parameters: {'n_layers': 4, 'embedding_dim': 128, 'lr': 0.00042036659412149157, 'lambda_val': 0.01679036251486879, 'batch_size': 3793, 'optimizer': 'RMSprop'}.
2026-06-15 03:17:22,305 - experiment_functions - INFO - Early stopping at epoch 500. Best Metrics: (0.0005179446522418722, 7.703128139862013e-05, 0.00026234865505212396)
2026-06-15 03:17:22,390 - optuna.study.study - INFO - Trial 1 finished with values: [0.0005179446522418722, 7.703128139862013e-05, 0.00026234865505212396] and parameters: {'n_layers': 4, 'embedding_dim': 64, 'lr': 2.1838812856597197e-05, 'lambda_val': 0.0022004607531230847, 'batch_size': 838, 'optimizer': 'SGD'}.
2026-06-15 03:17:54,447 - experiment_functions - INFO - Early stopping at epoch 500. Best Metrics: (0.0003468419126530925, 5.861075758590663e-05, 0.0001632622075319002)
2026-06-15 03:17:54,532 - optuna.study.study - INFO - Trial 2 finished with values: [0.0003468419126530925, 5.861075758590663e-05, 0.0001632622075319002] and parameters: {'n_layers': 4, 'embedding_dim': 256, 'lr': 5.316661720880308e-05, 'lambda_val': 6.253884105156874e-05, 'batch_size': 852, 'optimizer': 'SGD'}.
2026-06-15 03:18:52,252 - experiment_functions - INFO - Early stopping at epoch 900. Best Metrics: (0.031108313102288995, 0.0037259695893897787, 0.01411274628922875)
2026-06-15 03:18:52,327 - optuna.study.study - INFO - Trial 3 finished with values: [0.031108313102288995, 0.0037259695893897787, 0.01411274628922875] and parameters: {'n_layers': 4, 'embedding_dim': 256, 'lr': 0.0019049517999197474, 'lambda_val': 0.0004029384606494118, 'batch_size': 3123, 'optimizer': 'RMSprop'}.
2026-06-15 03:19:31,852 - experiment_functions - INFO - Early stopping at epoch 850. Best Metrics: (0.0002709724227090894, 5.023779221649139e-05, 0.00012687987569437242)
2026-06-15 03:19:32,144 - optuna.study.study - INFO - Trial 4 finished with values: [0.0002709724227090894, 5.023779221649139e-05, 0.00012687987569437242] and parameters: {'n_layers': 1, 'embedding_dim': 256, 'lr': 1.9343927222008687e-05, 'lambda_val': 1.8315231601394665e-05, 'batch_size': 2018, 'optimizer': 'RMSprop'}.
2026-06-15 03:19:54,862 - experiment_functions - INFO - Early stopping at epoch 550. Best Metrics: (0.0004235721954553457, 7.2007502176971e-05, 0.0001985750666495256)
2026-06-15 03:19:54,979 - optuna.study.study - INFO - Trial 5 finished with values: [0.0004235721954553457, 7.2007502176971e-05, 0.0001985750666495256] and parameters: {'n_layers': 3, 'embedding_dim': 32, 'lr': 1.557069203698868e-05, 'lambda_val': 0.01365341632227879, 'batch_size': 1910, 'optimizer': 'RMSprop'}.
2026-06-15 03:20:33,947 - experiment_functions - INFO - Early stopping at epoch 900. Best Metrics: (0.08673592022600868, 0.01030712036975015, 0.0446387011186915)
2026-06-15 03:20:34,015 - optuna.study.study - INFO - Trial 6 finished with values: [0.08673592022600868, 0.01030712036975015, 0.0446387011186915] and parameters: {'n_layers': 1, 'embedding_dim': 96, 'lr': 0.002403322646261187, 'lambda_val': 1.2492162876084175e-05, 'batch_size': 4084, 'optimizer': 'RMSprop'}.
2026-06-15 03:21:19,729 - experiment_functions - INFO - Early stopping at epoch 1000. Best Metrics: (0.04836699579270738, 0.005623283542099271, 0.022111826358555315)
2026-06-15 03:21:19,797 - optuna.study.study - INFO - Trial 7 finished with values: [0.04836699579270738, 0.005623283542099271, 0.022111826358555315] and parameters: {'n_layers': 2, 'embedding_dim': 128, 'lr': 0.002500554323958941, 'lambda_val': 1.387274745987136e-05, 'batch_size': 3067, 'optimizer': 'RMSprop'}.
2026-06-15 03:21:44,135 - experiment_functions - INFO - Early stopping at epoch 500. Best Metrics: (0.00045212652008623034, 8.038046754638624e-05, 0.00020010097317032643)
2026-06-15 03:21:44,201 - optuna.study.study - INFO - Trial 8 finished with values: [0.00045212652008623034, 8.038046754638624e-05, 0.00020010097317032643] and parameters: {'n_layers': 3, 'embedding_dim': 128, 'lr': 0.026701576110326253, 'lambda_val': 0.0002939685326585288, 'batch_size': 2018, 'optimizer': 'SGD'}.
2026-06-15 03:22:07,295 - experiment_functions - INFO - Early stopping at epoch 500. Best Metrics: (0.0005424049554757245, 7.033290910308797e-05, 0.0002227042831103281)
2026-06-15 03:22:07,432 - optuna.study.study - INFO - Trial 9 finished with values: [0.0005424049554757245, 7.033290910308797e-05, 0.0002227042831103281] and parameters: {'n_layers': 4, 'embedding_dim': 64, 'lr': 0.0003369639729525215, 'lambda_val': 1.9818721188201124e-05, 'batch_size': 2556, 'optimizer': 'SGD'}.
2026-06-15 03:24:58,019 - experiment_functions - INFO - Early stopping at epoch 3650. Best Metrics: (0.04056501210047403, 0.004894835554960146, 0.01934695792909349)
2026-06-15 03:24:58,107 - optuna.study.study - INFO - Trial 10 finished with values: [0.04056501210047403, 0.004894835554960146, 0.01934695792909349] and parameters: {'n_layers': 3, 'embedding_dim': 128, 'lr': 0.0016748417327479524, 'lambda_val': 6.136113149551945e-05, 'batch_size': 1243, 'optimizer': 'RMSprop'}.
2026-06-15 03:25:19,860 - experiment_functions - INFO - Early stopping at epoch 500. Best Metrics: (0.0004315612716791081, 7.53566883247371e-05, 0.0001967966655080887)
2026-06-15 03:25:19,939 - optuna.study.study - INFO - Trial 11 finished with values: [0.0004315612716791081, 7.53566883247371e-05, 0.0001967966655080887] and parameters: {'n_layers': 1, 'embedding_dim': 128, 'lr': 0.0007847673481327813, 'lambda_val': 0.0002959772395254473, 'batch_size': 2737, 'optimizer': 'SGD'}.
2026-06-15 03:25:42,911 - experiment_functions - INFO - Early stopping at epoch 500. Best Metrics: (0.0006838768428348129, 8.038046754638624e-05, 0.00028290911716869453)
2026-06-15 03:25:43,003 - optuna.study.study - INFO - Trial 12 finished with values: [0.0006838768428348129, 8.038046754638624e-05, 0.00028290911716869453] and parameters: {'n_layers': 4, 'embedding_dim': 64, 'lr': 7.812653374349954e-05, 'lambda_val': 0.0002510433157763933, 'batch_size': 2271, 'optimizer': 'SGD'}.
2026-06-15 03:26:07,622 - experiment_functions - INFO - Early stopping at epoch 500. Best Metrics: (0.00044616988040662445, 8.038046754638624e-05, 0.00022993124946664553)
2026-06-15 03:26:07,717 - optuna.study.study - INFO - Trial 13 finished with values: [0.00044616988040662445, 8.038046754638624e-05, 0.00022993124946664553] and parameters: {'n_layers': 4, 'embedding_dim': 96, 'lr': 9.721584968930023e-05, 'lambda_val': 0.0006582148988126551, 'batch_size': 749, 'optimizer': 'SGD'}.
2026-06-15 03:30:00,862 - experiment_functions - INFO - Early stopping at epoch 3700. Best Metrics: (0.05688469243792803, 0.0070131957934221984, 0.027718343545015633)
2026-06-15 03:30:00,943 - optuna.study.study - INFO - Trial 14 finished with values: [0.05688469243792803, 0.0070131957934221984, 0.027718343545015633] and parameters: {'n_layers': 4, 'embedding_dim': 256, 'lr': 0.00035751122245203187, 'lambda_val': 0.0003193434431604667, 'batch_size': 2538, 'optimizer': 'Adam'}.
2026-06-15 03:32:45,251 - experiment_functions - INFO - Early stopping at epoch 3700. Best Metrics: (0.04725028034402425, 0.005187889342889679, 0.021686379366806348)
2026-06-15 03:32:45,320 - optuna.study.study - INFO - Trial 15 finished with values: [0.04725028034402425, 0.005187889342889679, 0.021686379366806348] and parameters: {'n_layers': 3, 'embedding_dim': 96, 'lr': 0.017221400491445694, 'lambda_val': 3.385899724058381e-05, 'batch_size': 1491, 'optimizer': 'RMSprop'}.
2026-06-15 03:33:35,087 - experiment_functions - INFO - Early stopping at epoch 1050. Best Metrics: (0.008681913337818318, 0.001150445441757653, 0.003916388685633832)
2026-06-15 03:33:35,164 - optuna.study.study - INFO - Trial 16 finished with values: [0.008681913337818318, 0.001150445441757653, 0.003916388685633832] and parameters: {'n_layers': 4, 'embedding_dim': 96, 'lr': 0.003372226116409623, 'lambda_val': 0.043451746490740836, 'batch_size': 2981, 'optimizer': 'Adam'}.
2026-06-15 03:34:09,214 - experiment_functions - INFO - Early stopping at epoch 750. Best Metrics: (0.028037657251390215, 0.0030293388706544317, 0.012561873654201375)
2026-06-15 03:34:09,319 - optuna.study.study - INFO - Trial 17 finished with values: [0.028037657251390215, 0.0030293388706544317, 0.012561873654201375] and parameters: {'n_layers': 4, 'embedding_dim': 64, 'lr': 0.04226961608248332, 'lambda_val': 7.45778035452632e-06, 'batch_size': 3700, 'optimizer': 'Adam'}.
2026-06-15 03:34:32,645 - experiment_functions - INFO - Early stopping at epoch 500. Best Metrics: (0.00045373474564912504, 6.530912988143882e-05, 0.00017958783770009485)
2026-06-15 03:34:32,769 - optuna.study.study - INFO - Trial 18 finished with values: [0.00045373474564912504, 6.530912988143882e-05, 0.00017958783770009485] and parameters: {'n_layers': 2, 'embedding_dim': 128, 'lr': 0.004316584699041619, 'lambda_val': 0.0028417352904526183, 'batch_size': 2877, 'optimizer': 'SGD'}.
2026-06-15 03:34:56,490 - experiment_functions - INFO - Early stopping at epoch 500. Best Metrics: (0.016974712306284386, 0.0016494741777748007, 0.008131878804329935)
2026-06-15 03:34:56,577 - optuna.study.study - INFO - Trial 19 finished with values: [0.016974712306284386, 0.0016494741777748007, 0.008131878804329935] and parameters: {'n_layers': 3, 'embedding_dim': 96, 'lr': 0.07549529202095465, 'lambda_val': 0.00036402541279450417, 'batch_size': 1670, 'optimizer': 'RMSprop'}.
2026-06-15 03:35:19,788 - experiment_functions - INFO - Early stopping at epoch 500. Best Metrics: (0.00040152957271394183, 6.698372295532186e-05, 0.00019806660083177897)
2026-06-15 03:35:19,880 - optuna.study.study - INFO - Trial 20 finished with values: [0.00040152957271394183, 6.698372295532186e-05, 0.00019806660083177897] and parameters: {'n_layers': 2, 'embedding_dim': 128, 'lr': 2.305360782133465e-05, 'lambda_val': 0.02208239829734417, 'batch_size': 2576, 'optimizer': 'SGD'}.
2026-06-15 03:36:05,968 - experiment_functions - INFO - Early stopping at epoch 900. Best Metrics: (0.023570994469734846, 0.0028903476455221385, 0.010866125362821036)
2026-06-15 03:36:06,054 - optuna.study.study - INFO - Trial 21 finished with values: [0.023570994469734846, 0.0028903476455221385, 0.010866125362821036] and parameters: {'n_layers': 4, 'embedding_dim': 128, 'lr': 0.0016188619661959155, 'lambda_val': 0.0036237284376758, 'batch_size': 1383, 'optimizer': 'Adam'}.
2026-06-15 03:38:54,262 - optuna.study.study - INFO - Trial 22 finished with values: [0.0011344811074848406, 0.00019425279657043338, 0.0005369695098217205] and parameters: {'n_layers': 2, 'embedding_dim': 128, 'lr': 0.00011171717979509281, 'lambda_val': 0.0007419215442272931, 'batch_size': 2358, 'optimizer': 'RMSprop'}.
2026-06-15 03:39:18,645 - experiment_functions - INFO - Early stopping at epoch 500. Best Metrics: (0.0004416978106966644, 6.195994373367273e-05, 0.00021761751498273557)
2026-06-15 03:39:19,046 - optuna.study.study - INFO - Trial 23 finished with values: [0.0004416978106966644, 6.195994373367273e-05, 0.00021761751498273557] and parameters: {'n_layers': 3, 'embedding_dim': 128, 'lr': 0.0031097323419541764, 'lambda_val': 3.858902904724874e-05, 'batch_size': 1198, 'optimizer': 'SGD'}.
2026-06-15 03:41:29,766 - experiment_functions - INFO - Early stopping at epoch 3000. Best Metrics: (0.008384068416131592, 0.001145421662536004, 0.0037157593527959213)
2026-06-15 03:41:29,860 - optuna.study.study - INFO - Trial 24 finished with values: [0.008384068416131592, 0.001145421662536004, 0.0037157593527959213] and parameters: {'n_layers': 3, 'embedding_dim': 96, 'lr': 0.0031668054510016214, 'lambda_val': 0.07334430277784267, 'batch_size': 2363, 'optimizer': 'Adam'}.
2026-06-15 03:41:53,556 - experiment_functions - INFO - Early stopping at epoch 500. Best Metrics: (0.00029181440597811776, 5.861075758590662e-05, 0.00015325809142588274)
2026-06-15 03:41:53,639 - optuna.study.study - INFO - Trial 25 finished with values: [0.00029181440597811776, 5.861075758590662e-05, 0.00015325809142588274] and parameters: {'n_layers': 1, 'embedding_dim': 256, 'lr': 0.00018124272572339446, 'lambda_val': 2.63845257739459e-06, 'batch_size': 556, 'optimizer': 'SGD'}.
2026-06-15 03:42:14,679 - experiment_functions - INFO - Early stopping at epoch 500. Best Metrics: (0.00036400933659230773, 7.2007502176971e-05, 0.00018410163713667525)
2026-06-15 03:42:14,769 - optuna.study.study - INFO - Trial 26 finished with values: [0.00036400933659230773, 7.2007502176971e-05, 0.00018410163713667525] and parameters: {'n_layers': 3, 'embedding_dim': 32, 'lr': 2.578996418412898e-05, 'lambda_val': 0.00015125881155738367, 'batch_size': 2195, 'optimizer': 'SGD'}.
2026-06-15 03:42:38,676 - experiment_functions - INFO - Early stopping at epoch 500. Best Metrics: (0.00044756390345356147, 9.042802598968451e-05, 0.00021810912184822817)
2026-06-15 03:42:38,793 - optuna.study.study - INFO - Trial 27 finished with values: [0.00044756390345356147, 9.042802598968451e-05, 0.00021810912184822817] and parameters: {'n_layers': 1, 'embedding_dim': 256, 'lr': 0.0213550178381265, 'lambda_val': 0.004219561722855613, 'batch_size': 517, 'optimizer': 'SGD'}.
2026-06-15 03:43:02,053 - experiment_functions - INFO - Early stopping at epoch 550. Best Metrics: (0.021075411702923326, 0.0024650010047558442, 0.009954272360991867)
2026-06-15 03:43:02,137 - optuna.study.study - INFO - Trial 28 finished with values: [0.021075411702923326, 0.0024650010047558442, 0.009954272360991867] and parameters: {'n_layers': 3, 'embedding_dim': 32, 'lr': 0.0467259088974229, 'lambda_val': 0.00010936849207517709, 'batch_size': 1026, 'optimizer': 'RMSprop'}.
2026-06-15 03:46:10,027 - optuna.study.study - INFO - Trial 29 finished with values: [0.05512646657573501, 0.006825641369147297, 0.02917542675095936] and parameters: {'n_layers': 4, 'embedding_dim': 96, 'lr': 0.00037329899863237156, 'lambda_val': 2.200390261864473e-05, 'batch_size': 3009, 'optimizer': 'RMSprop'}.
2026-06-15 03:46:47,400 - experiment_functions - INFO - Early stopping at epoch 900. Best Metrics: (0.0006799647931803905, 9.210261906356756e-05, 0.00029775475681107584)
2026-06-15 03:46:47,489 - optuna.study.study - INFO - Trial 30 finished with values: [0.0006799647931803905, 9.210261906356756e-05, 0.00029775475681107584] and parameters: {'n_layers': 2, 'embedding_dim': 64, 'lr': 7.825799605183839e-05, 'lambda_val': 0.00021635586405720778, 'batch_size': 2769, 'optimizer': 'Adam'}.
2026-06-15 03:47:13,581 - experiment_functions - INFO - Early stopping at epoch 600. Best Metrics: (0.0005572557780309145, 9.37772121374506e-05, 0.00022754647390852271)
2026-06-15 03:47:13,965 - optuna.study.study - INFO - Trial 31 finished with values: [0.0005572557780309145, 9.37772121374506e-05, 0.00022754647390852271] and parameters: {'n_layers': 3, 'embedding_dim': 64, 'lr': 1.2263244956243106e-05, 'lambda_val': 0.0033177323911816013, 'batch_size': 1762, 'optimizer': 'RMSprop'}.
2026-06-15 03:48:45,660 - experiment_functions - INFO - Early stopping at epoch 2300. Best Metrics: (0.02743264558334455, 0.003025989684506665, 0.012309299654570042)
2026-06-15 03:48:45,838 - optuna.study.study - INFO - Trial 32 finished with values: [0.02743264558334455, 0.003025989684506665, 0.012309299654570042] and parameters: {'n_layers': 4, 'embedding_dim': 32, 'lr': 0.01930529051255257, 'lambda_val': 4.057584482779664e-06, 'batch_size': 1392, 'optimizer': 'Adam'}.
2026-06-15 03:49:12,187 - experiment_functions - INFO - Early stopping at epoch 650. Best Metrics: (0.0006263994404523665, 8.707883984191843e-05, 0.0002576557127568447)
2026-06-15 03:49:12,280 - optuna.study.study - INFO - Trial 33 finished with values: [0.0006263994404523665, 8.707883984191843e-05, 0.0002576557127568447] and parameters: {'n_layers': 2, 'embedding_dim': 32, 'lr': 1.546848679817365e-05, 'lambda_val': 0.0007531818922155074, 'batch_size': 1085, 'optimizer': 'Adam'}.
2026-06-15 03:49:33,946 - experiment_functions - INFO - Early stopping at epoch 500. Best Metrics: (0.0004566920992167157, 6.0285350659789674e-05, 0.00019517016178535908)
2026-06-15 03:49:34,029 - optuna.study.study - INFO - Trial 34 finished with values: [0.0004566920992167157, 6.0285350659789674e-05, 0.00019517016178535908] and parameters: {'n_layers': 2, 'embedding_dim': 64, 'lr': 0.00014045732318627944, 'lambda_val': 3.789532458531003e-06, 'batch_size': 2024, 'optimizer': 'SGD'}.
2026-06-15 03:52:30,721 - optuna.study.study - INFO - Trial 35 finished with values: [0.0008307966264007015, 0.0001255944805412285, 0.0003660623977871445] and parameters: {'n_layers': 1, 'embedding_dim': 256, 'lr': 0.00011578403367076658, 'lambda_val': 0.0005879769412094223, 'batch_size': 3746, 'optimizer': 'RMSprop'}.
2026-06-15 03:54:18,908 - experiment_functions - INFO - Early stopping at epoch 2550. Best Metrics: (0.07989059836210342, 0.00991526559046152, 0.04112352254371693)
2026-06-15 03:54:19,018 - optuna.study.study - INFO - Trial 36 finished with values: [0.07989059836210342, 0.00991526559046152, 0.04112352254371693] and parameters: {'n_layers': 1, 'embedding_dim': 128, 'lr': 0.0013399936052392054, 'lambda_val': 0.0020014727227486086, 'batch_size': 887, 'optimizer': 'RMSprop'}.
2026-06-15 03:56:37,455 - experiment_functions - INFO - Early stopping at epoch 3250. Best Metrics: (0.020933391584525722, 0.0024884453077902075, 0.009255339951611848)
2026-06-15 03:56:37,537 - optuna.study.study - INFO - Trial 37 finished with values: [0.020933391584525722, 0.0024884453077902075, 0.009255339951611848] and parameters: {'n_layers': 4, 'embedding_dim': 64, 'lr': 0.0017219538258829313, 'lambda_val': 0.004367100927407441, 'batch_size': 1528, 'optimizer': 'RMSprop'}.
2026-06-15 03:57:00,390 - experiment_functions - INFO - Early stopping at epoch 500. Best Metrics: (0.0004565740423822477, 7.200750217697099e-05, 0.0002646155234728396)
2026-06-15 03:57:00,481 - optuna.study.study - INFO - Trial 38 finished with values: [0.0004565740423822477, 7.200750217697099e-05, 0.0002646155234728396] and parameters: {'n_layers': 2, 'embedding_dim': 128, 'lr': 3.057037118096041e-05, 'lambda_val': 4.180612033002956e-05, 'batch_size': 3598, 'optimizer': 'SGD'}.
2026-06-15 03:57:23,116 - experiment_functions - INFO - Early stopping at epoch 500. Best Metrics: (0.000399301341325601, 6.195994373367272e-05, 0.000180075348984259)
2026-06-15 03:57:23,214 - optuna.study.study - INFO - Trial 39 finished with values: [0.000399301341325601, 6.195994373367272e-05, 0.000180075348984259] and parameters: {'n_layers': 4, 'embedding_dim': 64, 'lr': 0.0002576324017575941, 'lambda_val': 0.002486142832425607, 'batch_size': 1585, 'optimizer': 'SGD'}.
2026-06-15 03:57:45,478 - experiment_functions - INFO - Early stopping at epoch 500. Best Metrics: (0.0006172760566175109, 7.703128139862015e-05, 0.0002565570011847877)
2026-06-15 03:57:45,555 - optuna.study.study - INFO - Trial 40 finished with values: [0.0006172760566175109, 7.703128139862015e-05, 0.0002565570011847877] and parameters: {'n_layers': 3, 'embedding_dim': 64, 'lr': 1.9451816546339916e-05, 'lambda_val': 2.389407494837916e-05, 'batch_size': 3327, 'optimizer': 'SGD'}.
2026-06-15 03:58:14,973 - experiment_functions - INFO - Early stopping at epoch 550. Best Metrics: (0.02882264285763043, 0.003283877017884654, 0.01291296221649534)
2026-06-15 03:58:15,144 - optuna.study.study - INFO - Trial 41 finished with values: [0.02882264285763043, 0.003283877017884654, 0.01291296221649534] and parameters: {'n_layers': 4, 'embedding_dim': 128, 'lr': 0.0570467104634475, 'lambda_val': 4.768107725372831e-05, 'batch_size': 2519, 'optimizer': 'Adam'}.
2026-06-15 03:58:55,913 - experiment_functions - INFO - Early stopping at epoch 1050. Best Metrics: (0.0006325555105641953, 8.540424676803537e-05, 0.0002834056095028176)
2026-06-15 03:58:56,248 - optuna.study.study - INFO - Trial 42 finished with values: [0.0006325555105641953, 8.540424676803537e-05, 0.0002834056095028176] and parameters: {'n_layers': 1, 'embedding_dim': 64, 'lr': 2.757727319834325e-05, 'lambda_val': 0.004064403021316518, 'batch_size': 1634, 'optimizer': 'Adam'}.
2026-06-15 03:59:17,072 - experiment_functions - INFO - Early stopping at epoch 500. Best Metrics: (0.0006089127121790974, 7.53566883247371e-05, 0.00026841308023801323)
2026-06-15 03:59:17,179 - optuna.study.study - INFO - Trial 43 finished with values: [0.0006089127121790974, 7.53566883247371e-05, 0.00026841308023801323] and parameters: {'n_layers': 2, 'embedding_dim': 32, 'lr': 5.2833200317063495e-05, 'lambda_val': 1.5904579683247487e-06, 'batch_size': 1096, 'optimizer': 'SGD'}.
2026-06-15 03:59:49,573 - experiment_functions - INFO - Early stopping at epoch 700. Best Metrics: (0.011141926164044488, 0.0013631187621407997, 0.005073722603828216)
