2026-06-15 18:57:30,803 - optuna.study.study - INFO - Trial 128 finished with values: [0.023823369857609546, 0.0026877218835822895, 0.010912521838856642] and parameters: {'n_layers': 2, 'embedding_dim': 128, 'lr': 0.04915150101302751, 'lambda_val': 0.0017527613804902056, 'batch_size': 2803, 'optimizer': 'Adam'}.
2026-06-15 18:58:39,680 - experiment_functions - INFO - Early stopping at epoch 1700. Best Metrics: (0.013796630152677661, 0.0016863152254002276, 0.006023064103036841)
2026-06-15 18:58:39,752 - optuna.study.study - INFO - Trial 129 finished with values: [0.013796630152677661, 0.0016863152254002276, 0.006023064103036841] and parameters: {'n_layers': 4, 'embedding_dim': 32, 'lr': 0.03610320063773607, 'lambda_val': 0.008148243057508029, 'batch_size': 3368, 'optimizer': 'RMSprop'}.
2026-06-15 18:59:02,506 - experiment_functions - INFO - Early stopping at epoch 550. Best Metrics: (0.03129515061037994, 0.004015674191171546, 0.014206650636549915)
2026-06-15 18:59:02,608 - optuna.study.study - INFO - Trial 130 finished with values: [0.03129515061037994, 0.004015674191171546, 0.014206650636549915] and parameters: {'n_layers': 1, 'embedding_dim': 32, 'lr': 0.02606777968777775, 'lambda_val': 0.005463270877339436, 'batch_size': 2793, 'optimizer': 'Adam'}.
2026-06-15 18:59:25,689 - experiment_functions - INFO - Early stopping at epoch 550. Best Metrics: (0.03924081137816164, 0.00511253265456494, 0.019486117007887237)
2026-06-15 18:59:25,763 - optuna.study.study - INFO - Trial 131 finished with values: [0.03924081137816164, 0.00511253265456494, 0.019486117007887237] and parameters: {'n_layers': 1, 'embedding_dim': 32, 'lr': 0.02606777968777775, 'lambda_val': 0.0031309099362347758, 'batch_size': 2974, 'optimizer': 'Adam'}.
2026-06-15 19:00:15,347 - experiment_functions - INFO - Early stopping at epoch 850. Best Metrics: (0.00037709706271439846, 6.530912988143882e-05, 0.00016677031979608903)
2026-06-15 19:00:15,438 - optuna.study.study - INFO - Trial 132 finished with values: [0.00037709706271439846, 6.530912988143882e-05, 0.00016677031979608903] and parameters: {'n_layers': 3, 'embedding_dim': 256, 'lr': 1.9734731325390103e-05, 'lambda_val': 6.461965909578869e-06, 'batch_size': 2933, 'optimizer': 'Adam'}.
2026-06-15 19:01:12,748 - experiment_functions - INFO - Early stopping at epoch 1250. Best Metrics: (0.04530865781303709, 0.005713711568088955, 0.02229920497440944)
2026-06-15 19:01:12,859 - optuna.study.study - INFO - Trial 133 finished with values: [0.04530865781303709, 0.005713711568088955, 0.02229920497440944] and parameters: {'n_layers': 3, 'embedding_dim': 96, 'lr': 0.0008007729293904306, 'lambda_val': 0.004749408595262452, 'batch_size': 1545, 'optimizer': 'Adam'}.
2026-06-15 19:03:02,299 - experiment_functions - INFO - Early stopping at epoch 1900. Best Metrics: (0.04022976601449026, 0.004961819277915468, 0.018675187341010167)
2026-06-15 19:03:02,385 - optuna.study.study - INFO - Trial 134 finished with values: [0.04022976601449026, 0.004961819277915468, 0.018675187341010167] and parameters: {'n_layers': 3, 'embedding_dim': 256, 'lr': 0.0008007729293904306, 'lambda_val': 0.004749408595262452, 'batch_size': 748, 'optimizer': 'Adam'}.
2026-06-15 19:06:28,687 - optuna.study.study - INFO - Trial 135 finished with values: [0.06181396186048416, 0.008223926585839642, 0.03362920057109785] and parameters: {'n_layers': 2, 'embedding_dim': 256, 'lr': 0.0002845041667420409, 'lambda_val': 6.461965909578869e-06, 'batch_size': 2936, 'optimizer': 'Adam'}.
2026-06-15 19:08:43,427 - experiment_functions - INFO - Early stopping at epoch 3100. Best Metrics: (0.02826608827209786, 0.003243686784111461, 0.012889709359018403)
2026-06-15 19:08:43,510 - optuna.study.study - INFO - Trial 136 finished with values: [0.02826608827209786, 0.003243686784111461, 0.012889709359018403] and parameters: {'n_layers': 2, 'embedding_dim': 128, 'lr': 0.004490672612947781, 'lambda_val': 0.0034870006252512636, 'batch_size': 2456, 'optimizer': 'RMSprop'}.
2026-06-15 19:11:12,203 - optuna.study.study - INFO - Trial 137 finished with values: [0.0033336209748944874, 0.0006447183334449729, 0.00171433949491418] and parameters: {'n_layers': 2, 'embedding_dim': 32, 'lr': 0.00017992734758911743, 'lambda_val': 6.35275341540772e-06, 'batch_size': 2134, 'optimizer': 'RMSprop'}.
2026-06-15 19:13:49,333 - experiment_functions - INFO - Early stopping at epoch 3550. Best Metrics: (0.03958356770152059, 0.005286690334248778, 0.019194835810715228)
2026-06-15 19:13:49,450 - optuna.study.study - INFO - Trial 138 finished with values: [0.03958356770152059, 0.005286690334248778, 0.019194835810715228] and parameters: {'n_layers': 2, 'embedding_dim': 128, 'lr': 0.0003649621407716159, 'lambda_val': 0.02514504131117439, 'batch_size': 3620, 'optimizer': 'Adam'}.
2026-06-15 19:15:15,906 - experiment_functions - INFO - Early stopping at epoch 2200. Best Metrics: (0.03309478649021595, 0.003871659186817604, 0.014552009646881242)
2026-06-15 19:15:15,976 - optuna.study.study - INFO - Trial 139 finished with values: [0.03309478649021595, 0.003871659186817604, 0.014552009646881242] and parameters: {'n_layers': 2, 'embedding_dim': 32, 'lr': 0.00859558839759563, 'lambda_val': 6.35275341540772e-06, 'batch_size': 1328, 'optimizer': 'Adam'}.
2026-06-15 19:16:14,478 - experiment_functions - INFO - Early stopping at epoch 900. Best Metrics: (0.04241039561176384, 0.005244825507401701, 0.02028295932653696)
2026-06-15 19:16:14,574 - optuna.study.study - INFO - Trial 140 finished with values: [0.04241039561176384, 0.005244825507401701, 0.02028295932653696] and parameters: {'n_layers': 4, 'embedding_dim': 256, 'lr': 0.0008257854890964482, 'lambda_val': 1.0702432018798528e-05, 'batch_size': 3109, 'optimizer': 'RMSprop'}.
2026-06-15 19:17:39,865 - experiment_functions - INFO - Early stopping at epoch 1850. Best Metrics: (0.07255663531344052, 0.008897113001540625, 0.03759636909234637)
2026-06-15 19:17:39,946 - optuna.study.study - INFO - Trial 141 finished with values: [0.07255663531344052, 0.008897113001540625, 0.03759636909234637] and parameters: {'n_layers': 2, 'embedding_dim': 128, 'lr': 0.0008007729293904306, 'lambda_val': 0.001568136579936885, 'batch_size': 2005, 'optimizer': 'Adam'}.
2026-06-15 19:20:27,977 - experiment_functions - INFO - Early stopping at epoch 3550. Best Metrics: (0.046854036075782805, 0.0055998392390649064, 0.021946636397849096)
2026-06-15 19:20:28,045 - optuna.study.study - INFO - Trial 142 finished with values: [0.046854036075782805, 0.0055998392390649064, 0.021946636397849096] and parameters: {'n_layers': 3, 'embedding_dim': 128, 'lr': 0.0013130193047400018, 'lambda_val': 4.740391388963357e-05, 'batch_size': 1772, 'optimizer': 'RMSprop'}.
2026-06-15 19:23:26,301 - optuna.study.study - INFO - Trial 143 finished with values: [0.05060236208297244, 0.005578069529104428, 0.023644540903558574] and parameters: {'n_layers': 2, 'embedding_dim': 128, 'lr': 0.00859558839759563, 'lambda_val': 0.0002091155632832413, 'batch_size': 3978, 'optimizer': 'RMSprop'}.
2026-06-15 19:25:01,921 - experiment_functions - INFO - Early stopping at epoch 1800. Best Metrics: (0.07889537414238285, 0.009478196798178042, 0.03970461524841453)
2026-06-15 19:25:02,007 - optuna.study.study - INFO - Trial 144 finished with values: [0.07889537414238285, 0.009478196798178042, 0.03970461524841453] and parameters: {'n_layers': 2, 'embedding_dim': 256, 'lr': 0.0008257854890964482, 'lambda_val': 6.052046926304192e-06, 'batch_size': 2380, 'optimizer': 'RMSprop'}.
2026-06-15 19:25:50,211 - experiment_functions - INFO - Early stopping at epoch 1200. Best Metrics: (0.07150500272413396, 0.009299015339272559, 0.03821785501878014)
2026-06-15 19:25:51,351 - optuna.study.study - INFO - Trial 145 finished with values: [0.07150500272413396, 0.009299015339272559, 0.03821785501878014] and parameters: {'n_layers': 1, 'embedding_dim': 32, 'lr': 0.0036742654809996723, 'lambda_val': 0.00041942469140426685, 'batch_size': 636, 'optimizer': 'Adam'}.
2026-06-15 19:28:49,667 - experiment_functions - INFO - Early stopping at epoch 3700. Best Metrics: (0.06809806419047594, 0.007880635005693616, 0.03260966758095086)
2026-06-15 19:28:49,759 - optuna.study.study - INFO - Trial 146 finished with values: [0.06809806419047594, 0.007880635005693616, 0.03260966758095086] and parameters: {'n_layers': 1, 'embedding_dim': 256, 'lr': 0.0036742654809996723, 'lambda_val': 0.0002091155632832413, 'batch_size': 914, 'optimizer': 'RMSprop'}.
2026-06-15 19:29:26,811 - experiment_functions - INFO - Early stopping at epoch 550. Best Metrics: (0.032588158571700526, 0.0039218969790340945, 0.015228188450439913)
2026-06-15 19:29:26,901 - optuna.study.study - INFO - Trial 147 finished with values: [0.032588158571700526, 0.0039218969790340945, 0.015228188450439913] and parameters: {'n_layers': 4, 'embedding_dim': 256, 'lr': 0.0036742654809996723, 'lambda_val': 6.852585789077327e-05, 'batch_size': 3109, 'optimizer': 'Adam'}.
2026-06-15 19:32:26,895 - experiment_functions - INFO - Early stopping at epoch 3750. Best Metrics: (0.068867136015641, 0.00830598164645991, 0.03613422727413694)
2026-06-15 19:32:26,981 - optuna.study.study - INFO - Trial 148 finished with values: [0.068867136015641, 0.00830598164645991, 0.03613422727413694] and parameters: {'n_layers': 3, 'embedding_dim': 128, 'lr': 0.0008105588166462481, 'lambda_val': 4.740391388963357e-05, 'batch_size': 738, 'optimizer': 'Adam'}.
2026-06-15 19:35:35,038 - optuna.study.study - INFO - Trial 149 finished with values: [0.039800618300947596, 0.004883113403442964, 0.018529459142314013] and parameters: {'n_layers': 3, 'embedding_dim': 128, 'lr': 0.0013130193047400018, 'lambda_val': 0.00026356397956022734, 'batch_size': 738, 'optimizer': 'RMSprop'}.
2026-06-15 19:38:15,586 - optuna.study.study - INFO - Trial 150 finished with values: [0.03668283978188721, 0.005017080849353607, 0.018985424539633082] and parameters: {'n_layers': 3, 'embedding_dim': 32, 'lr': 0.0002845041667420409, 'lambda_val': 0.0031660536671449806, 'batch_size': 2854, 'optimizer': 'Adam'}.
2026-06-15 19:39:04,959 - experiment_functions - INFO - Early stopping at epoch 1050. Best Metrics: (0.06755896432063803, 0.008620805144349921, 0.036052219472914794)
2026-06-15 19:39:06,102 - optuna.study.study - INFO - Trial 151 finished with values: [0.06755896432063803, 0.008620805144349921, 0.036052219472914794] and parameters: {'n_layers': 2, 'embedding_dim': 128, 'lr': 0.0008007729293904306, 'lambda_val': 0.0010303693563230053, 'batch_size': 2005, 'optimizer': 'RMSprop'}.
2026-06-15 19:39:43,957 - experiment_functions - INFO - Early stopping at epoch 750. Best Metrics: (0.0825149039782549, 0.010245160426016477, 0.043020434512974444)
2026-06-15 19:39:44,050 - optuna.study.study - INFO - Trial 152 finished with values: [0.0825149039782549, 0.010245160426016477, 0.043020434512974444] and parameters: {'n_layers': 1, 'embedding_dim': 256, 'lr': 0.0036742654809996723, 'lambda_val': 0.001319855427866883, 'batch_size': 2539, 'optimizer': 'Adam'}.
2026-06-15 19:41:08,675 - experiment_functions - INFO - Early stopping at epoch 1750. Best Metrics: (0.09809774148079374, 0.011777413088619466, 0.05172524782871297)
2026-06-15 19:41:08,766 - optuna.study.study - INFO - Trial 153 finished with values: [0.09809774148079374, 0.011777413088619466, 0.05172524782871297] and parameters: {'n_layers': 1, 'embedding_dim': 256, 'lr': 0.001479782641411582, 'lambda_val': 6.852585789077327e-05, 'batch_size': 1808, 'optimizer': 'RMSprop'}.
2026-06-15 19:43:49,109 - optuna.study.study - INFO - Trial 154 finished with values: [0.0947439195517611, 0.011628374305043874, 0.051049932864418356] and parameters: {'n_layers': 1, 'embedding_dim': 32, 'lr': 0.001479782641411582, 'lambda_val': 0.00011845962638954619, 'batch_size': 3109, 'optimizer': 'Adam'}.
2026-06-15 19:44:11,428 - experiment_functions - INFO - Early stopping at epoch 500. Best Metrics: (0.0003554127145219261, 7.033290910308795e-05, 0.00015002602290523765)
2026-06-15 19:44:11,523 - optuna.study.study - INFO - Trial 155 finished with values: [0.0003554127145219261, 7.033290910308795e-05, 0.00015002602290523765] and parameters: {'n_layers': 1, 'embedding_dim': 128, 'lr': 0.00035731579910584327, 'lambda_val': 0.0021104984649676414, 'batch_size': 1545, 'optimizer': 'Adam'}.
2026-06-15 19:44:53,776 - experiment_functions - INFO - Early stopping at epoch 1050. Best Metrics: (0.017032090198890074, 0.002195391519860674, 0.00811443929045798)
2026-06-15 19:44:53,883 - optuna.study.study - INFO - Trial 156 finished with values: [0.017032090198890074, 0.002195391519860674, 0.00811443929045798] and parameters: {'n_layers': 2, 'embedding_dim': 32, 'lr': 0.0013130193047400018, 'lambda_val': 0.04971147660470459, 'batch_size': 2005, 'optimizer': 'RMSprop'}.
2026-06-15 19:45:31,273 - experiment_functions - INFO - Early stopping at epoch 750. Best Metrics: (0.06696762841487232, 0.00783877017884654, 0.031902179243206125)
2026-06-15 19:45:31,446 - optuna.study.study - INFO - Trial 157 finished with values: [0.06696762841487232, 0.00783877017884654, 0.031902179243206125] and parameters: {'n_layers': 1, 'embedding_dim': 256, 'lr': 0.006895117642270885, 'lambda_val': 1.7187471777464757e-05, 'batch_size': 1420, 'optimizer': 'Adam'}.
2026-06-15 19:46:21,196 - experiment_functions - INFO - Early stopping at epoch 1050. Best Metrics: (0.06810348865212845, 0.008540424676803536, 0.03440507039094181)
2026-06-15 19:46:21,662 - optuna.study.study - INFO - Trial 158 finished with values: [0.06810348865212845, 0.008540424676803536, 0.03440507039094181] and parameters: {'n_layers': 2, 'embedding_dim': 128, 'lr': 0.0008007729293904306, 'lambda_val': 0.001568136579936885, 'batch_size': 2005, 'optimizer': 'RMSprop'}.
2026-06-15 19:49:02,804 - optuna.study.study - INFO - Trial 159 finished with values: [0.07986855174344809, 0.009734409538482149, 0.04243556293917783] and parameters: {'n_layers': 2, 'embedding_dim': 32, 'lr': 0.0008007729293904306, 'lambda_val': 1.5130950471060717e-06, 'batch_size': 2005, 'optimizer': 'Adam'}.
2026-06-15 19:50:29,921 - experiment_functions - INFO - Early stopping at epoch 1800. Best Metrics: (0.05431978054942876, 0.006812244624556233, 0.026987391768756898)
2026-06-15 19:50:30,059 - optuna.study.study - INFO - Trial 160 finished with values: [0.05431978054942876, 0.006812244624556233, 0.026987391768756898] and parameters: {'n_layers': 3, 'embedding_dim': 128, 'lr': 0.00035731579910584327, 'lambda_val': 0.0021104984649676414, 'batch_size': 3339, 'optimizer': 'RMSprop'}.
2026-06-15 19:53:26,301 - optuna.study.study - INFO - Trial 161 finished with values: [0.03905931469090818, 0.004412552749681827, 0.01750313723134679] and parameters: {'n_layers': 3, 'embedding_dim': 96, 'lr': 0.0036742654809996723, 'lambda_val': 6.178520449456923e-05, 'batch_size': 3069, 'optimizer': 'RMSprop'}.
2026-06-15 19:56:21,471 - optuna.study.study - INFO - Trial 162 finished with values: [0.0010210425692274256, 0.00012894366668899458, 0.0004675713473891938] and parameters: {'n_layers': 1, 'embedding_dim': 256, 'lr': 0.00017992734758911743, 'lambda_val': 5.053149613915092e-05, 'batch_size': 2005, 'optimizer': 'RMSprop'}.
2026-06-15 19:56:43,173 - experiment_functions - INFO - Early stopping at epoch 500. Best Metrics: (0.00045362548985802663, 7.870587447250318e-05, 0.00021431151558494045)
2026-06-15 19:56:43,338 - optuna.study.study - INFO - Trial 163 finished with values: [0.00045362548985802663, 7.870587447250318e-05, 0.00021431151558494045] and parameters: {'n_layers': 1, 'embedding_dim': 128, 'lr': 0.00859558839759563, 'lambda_val': 2.0623181656245837e-06, 'batch_size': 1545, 'optimizer': 'SGD'}.
2026-06-15 19:59:20,915 - optuna.study.study - INFO - Trial 164 finished with values: [0.0684851236728056, 0.008444972871592205, 0.03508811730024426] and parameters: {'n_layers': 2, 'embedding_dim': 32, 'lr': 0.0008007729293904306, 'lambda_val': 0.001568136579936885, 'batch_size': 2005, 'optimizer': 'Adam'}.
2026-06-15 19:59:50,614 - experiment_functions - INFO - Early stopping at epoch 700. Best Metrics: (0.0005195678649886238, 8.540424676803537e-05, 0.00023414657885989648)
2026-06-15 19:59:50,743 - optuna.study.study - INFO - Trial 165 finished with values: [0.0005195678649886238, 8.540424676803537e-05, 0.00023414657885989648] and parameters: {'n_layers': 1, 'embedding_dim': 128, 'lr': 0.0002845041667420409, 'lambda_val': 0.0031660536671449806, 'batch_size': 832, 'optimizer': 'Adam'}.
2026-06-15 20:00:39,159 - experiment_functions - INFO - Early stopping at epoch 1050. Best Metrics: (0.06559455164844824, 0.007967713845535535, 0.032923221344544576)
2026-06-15 20:00:39,241 - optuna.study.study - INFO - Trial 166 finished with values: [0.06559455164844824, 0.007967713845535535, 0.032923221344544576] and parameters: {'n_layers': 2, 'embedding_dim': 128, 'lr': 0.0013130193047400018, 'lambda_val': 4.740391388963357e-05, 'batch_size': 1772, 'optimizer': 'RMSprop'}.
2026-06-15 20:01:32,444 - experiment_functions - INFO - Early stopping at epoch 1150. Best Metrics: (0.07355160361619593, 0.009044477192042334, 0.037762976827999714)
2026-06-15 20:01:32,516 - optuna.study.study - INFO - Trial 167 finished with values: [0.07355160361619593, 0.009044477192042334, 0.037762976827999714] and parameters: {'n_layers': 2, 'embedding_dim': 128, 'lr': 0.0008257854890964482, 'lambda_val': 0.00041942469140426685, 'batch_size': 3109, 'optimizer': 'RMSprop'}.
2026-06-15 20:04:41,143 - optuna.study.study - INFO - Trial 168 finished with values: [0.07004123650794324, 0.00868443968115748, 0.038284138925992646] and parameters: {'n_layers': 3, 'embedding_dim': 128, 'lr': 0.00035731579910584327, 'lambda_val': 4.740391388963357e-05, 'batch_size': 1545, 'optimizer': 'RMSprop'}.
2026-06-15 20:08:45,862 - optuna.study.study - INFO - Trial 169 finished with values: [0.003236290051704452, 0.0005542903074552884, 0.001701069429560489] and parameters: {'n_layers': 4, 'embedding_dim': 256, 'lr': 6.744089539488785e-05, 'lambda_val': 1.5130950471060717e-06, 'batch_size': 2933, 'optimizer': 'Adam'}.
2026-06-15 20:09:24,983 - experiment_functions - INFO - Early stopping at epoch 800. Best Metrics: (0.040158841931499545, 0.0050338267800924385, 0.019088691910539565)
2026-06-15 20:09:25,083 - optuna.study.study - INFO - Trial 170 finished with values: [0.040158841931499545, 0.0050338267800924385, 0.019088691910539565] and parameters: {'n_layers': 3, 'embedding_dim': 128, 'lr': 0.001479782641411582, 'lambda_val': 0.0021104984649676414, 'batch_size': 1545, 'optimizer': 'Adam'}.
2026-06-15 20:10:07,284 - experiment_functions - INFO - Early stopping at epoch 900. Best Metrics: (0.0643317027054436, 0.0077734610489651025, 0.03139885645211168)
2026-06-15 20:10:07,367 - optuna.study.study - INFO - Trial 171 finished with values: [0.0643317027054436, 0.0077734610489651025, 0.03139885645211168] and parameters: {'n_layers': 2, 'embedding_dim': 128, 'lr': 0.0013130193047400018, 'lambda_val': 0.0002091155632832413, 'batch_size': 2936, 'optimizer': 'RMSprop'}.
2026-06-15 20:10:42,774 - experiment_functions - INFO - Early stopping at epoch 750. Best Metrics: (0.06647713038239175, 0.008093308326076763, 0.03362206986255605)
2026-06-15 20:10:42,984 - optuna.study.study - INFO - Trial 172 finished with values: [0.06647713038239175, 0.008093308326076763, 0.03362206986255605] and parameters: {'n_layers': 2, 'embedding_dim': 128, 'lr': 0.0013130193047400018, 'lambda_val': 7.257175401958617e-06, 'batch_size': 3978, 'optimizer': 'RMSprop'}.
2026-06-15 20:14:02,331 - optuna.study.study - INFO - Trial 173 finished with values: [0.06032688905667268, 0.007463661330296739, 0.031978817957018416] and parameters: {'n_layers': 4, 'embedding_dim': 128, 'lr': 0.0003649621407716159, 'lambda_val': 1.5130950471060717e-06, 'batch_size': 983, 'optimizer': 'RMSprop'}.
2026-06-15 20:16:37,190 - optuna.study.study - INFO - Trial 174 finished with values: [0.004483869461972366, 0.0008758121776408334, 0.002572568318750121] and parameters: {'n_layers': 1, 'embedding_dim': 96, 'lr': 0.0002845041667420409, 'lambda_val': 0.0031660536671449806, 'batch_size': 2933, 'optimizer': 'Adam'}.
2026-06-15 20:20:02,794 - optuna.study.study - INFO - Trial 175 finished with values: [0.059030659139808414, 0.006510817871257285, 0.02757479992582746] and parameters: {'n_layers': 2, 'embedding_dim': 256, 'lr': 0.00767717975911996, 'lambda_val': 0.0002091155632832413, 'batch_size': 3978, 'optimizer': 'RMSprop'}.
2026-06-15 20:23:18,187 - optuna.study.study - INFO - Trial 176 finished with values: [0.022189776971017715, 0.0033140196932145496, 0.011538869411168667] and parameters: {'n_layers': 4, 'embedding_dim': 128, 'lr': 0.00015177430480912906, 'lambda_val': 6.461965909578869e-06, 'batch_size': 1772, 'optimizer': 'Adam'}.
2026-06-15 20:25:48,295 - optuna.study.study - INFO - Trial 177 finished with values: [0.03300738589431683, 0.005512760399222988, 0.017468429355187474] and parameters: {'n_layers': 1, 'embedding_dim': 32, 'lr': 0.0008007729293904306, 'lambda_val': 0.026167750348086705, 'batch_size': 914, 'optimizer': 'Adam'}.
2026-06-15 20:28:33,751 - optuna.study.study - INFO - Trial 178 finished with values: [0.04676081985449975, 0.006792149507669638, 0.02735454514918939] and parameters: {'n_layers': 1, 'embedding_dim': 128, 'lr': 0.0003649621407716159, 'lambda_val': 1.5130950471060717e-06, 'batch_size': 3620, 'optimizer': 'RMSprop'}.
2026-06-15 20:29:25,635 - experiment_functions - INFO - Early stopping at epoch 1150. Best Metrics: (0.08117816602618017, 0.009774599772255343, 0.04181197521048214)
