2026-06-13 21:26:15,913 - optuna.study.study - INFO - Trial 140 finished with values: [0.029757710903466943, 0.004149641637082189, 0.014887562373784191] and parameters: {'n_layers': 3, 'embedding_dim': 128, 'lr': 0.000495651360592853, 'lambda_val': 0.01048017957242826, 'batch_size': 3137, 'optimizer': 'RMSprop'}.
2026-06-13 21:27:34,759 - experiment_functions - INFO - Early stopping at epoch 2000. Best Metrics: (0.04445451174667539, 0.006231160827918816, 0.023720519556395755)
2026-06-13 21:27:34,864 - optuna.study.study - INFO - Trial 141 finished with values: [0.04445451174667539, 0.006231160827918816, 0.023720519556395755] and parameters: {'n_layers': 2, 'embedding_dim': 64, 'lr': 0.0016889361681909714, 'lambda_val': 0.00035318754870590177, 'batch_size': 1264, 'optimizer': 'Adam'}.
2026-06-13 21:28:40,544 - experiment_functions - INFO - Early stopping at epoch 1500. Best Metrics: (0.030832167944054332, 0.004655368745394869, 0.016857947858575074)
2026-06-13 21:28:40,639 - optuna.study.study - INFO - Trial 142 finished with values: [0.030832167944054332, 0.004655368745394869, 0.016857947858575074] and parameters: {'n_layers': 1, 'embedding_dim': 256, 'lr': 0.0016889361681909714, 'lambda_val': 2.060634847155313e-06, 'batch_size': 3311, 'optimizer': 'RMSprop'}.
2026-06-13 21:31:09,006 - optuna.study.study - INFO - Trial 143 finished with values: [0.016730225401585478, 0.0026274365329225, 0.009562078877740004] and parameters: {'n_layers': 1, 'embedding_dim': 64, 'lr': 0.000495651360592853, 'lambda_val': 0.00035318754870590177, 'batch_size': 3699, 'optimizer': 'Adam'}.
2026-06-13 21:33:39,654 - optuna.study.study - INFO - Trial 144 finished with values: [0.014414974826548318, 0.00264418246366133, 0.007904288005915078] and parameters: {'n_layers': 1, 'embedding_dim': 96, 'lr': 0.000495651360592853, 'lambda_val': 0.02437752071214252, 'batch_size': 2283, 'optimizer': 'RMSprop'}.
2026-06-13 21:36:08,163 - optuna.study.study - INFO - Trial 145 finished with values: [0.028790432567427977, 0.004432647866568424, 0.016524016207920326] and parameters: {'n_layers': 2, 'embedding_dim': 32, 'lr': 0.000495651360592853, 'lambda_val': 2.657146317841358e-05, 'batch_size': 3048, 'optimizer': 'Adam'}.
2026-06-13 21:38:38,293 - optuna.study.study - INFO - Trial 146 finished with values: [0.032480908788912854, 0.004811105901265994, 0.017726117530893374] and parameters: {'n_layers': 1, 'embedding_dim': 64, 'lr': 0.0018163821909776498, 'lambda_val': 3.0596052181477996e-06, 'batch_size': 1358, 'optimizer': 'Adam'}.
2026-06-13 21:39:03,473 - experiment_functions - INFO - Early stopping at epoch 550. Best Metrics: (0.016263402647805004, 0.0021886931475651413, 0.008380216365196095)
2026-06-13 21:39:03,569 - optuna.study.study - INFO - Trial 147 finished with values: [0.016263402647805004, 0.0021886931475651413, 0.008380216365196095] and parameters: {'n_layers': 3, 'embedding_dim': 128, 'lr': 0.02476872752275395, 'lambda_val': 4.0905049993760175e-06, 'batch_size': 3306, 'optimizer': 'RMSprop'}.
2026-06-13 21:39:26,274 - experiment_functions - INFO - Early stopping at epoch 500. Best Metrics: (0.004971620319199969, 0.0005978297273762476, 0.002731196174240632)
2026-06-13 21:39:26,356 - optuna.study.study - INFO - Trial 148 finished with values: [0.004971620319199969, 0.0005978297273762476, 0.002731196174240632] and parameters: {'n_layers': 4, 'embedding_dim': 96, 'lr': 0.020427549926046215, 'lambda_val': 0.09270181369288938, 'batch_size': 1859, 'optimizer': 'RMSprop'}.
2026-06-13 21:40:00,589 - experiment_functions - INFO - Early stopping at epoch 800. Best Metrics: (0.03346524089916026, 0.00449628240337598, 0.01685342542014997)
2026-06-13 21:40:00,886 - optuna.study.study - INFO - Trial 149 finished with values: [0.03346524089916026, 0.00449628240337598, 0.01685342542014997] and parameters: {'n_layers': 4, 'embedding_dim': 64, 'lr': 0.0013289886132312838, 'lambda_val': 0.0011485147822124096, 'batch_size': 3143, 'optimizer': 'RMSprop'}.
2026-06-13 21:40:41,174 - experiment_functions - INFO - Early stopping at epoch 850. Best Metrics: (0.037960410310841367, 0.0052933887065443105, 0.019401509187214394)
2026-06-13 21:40:41,263 - optuna.study.study - INFO - Trial 150 finished with values: [0.037960410310841367, 0.0052933887065443105, 0.019401509187214394] and parameters: {'n_layers': 4, 'embedding_dim': 128, 'lr': 0.0013289886132312838, 'lambda_val': 0.0008453903829961915, 'batch_size': 2816, 'optimizer': 'Adam'}.
2026-06-13 21:41:22,162 - experiment_functions - INFO - Early stopping at epoch 950. Best Metrics: (0.042772805422885855, 0.0059163373300288044, 0.02233387825415116)
2026-06-13 21:41:22,482 - optuna.study.study - INFO - Trial 151 finished with values: [0.042772805422885855, 0.0059163373300288044, 0.02233387825415116] and parameters: {'n_layers': 3, 'embedding_dim': 96, 'lr': 0.0016889361681909714, 'lambda_val': 0.00019652548319010554, 'batch_size': 1821, 'optimizer': 'RMSprop'}.
2026-06-13 21:42:16,172 - experiment_functions - INFO - Early stopping at epoch 1200. Best Metrics: (0.04857505761618725, 0.006430437403710898, 0.025145636974905107)
2026-06-13 21:42:16,272 - optuna.study.study - INFO - Trial 152 finished with values: [0.04857505761618725, 0.006430437403710898, 0.025145636974905107] and parameters: {'n_layers': 3, 'embedding_dim': 128, 'lr': 0.0009711234831697961, 'lambda_val': 2.060634847155313e-06, 'batch_size': 3914, 'optimizer': 'RMSprop'}.
2026-06-13 21:43:15,520 - experiment_functions - INFO - Early stopping at epoch 1550. Best Metrics: (0.03177990780294414, 0.004662067117690401, 0.017116442927037803)
2026-06-13 21:43:15,608 - optuna.study.study - INFO - Trial 153 finished with values: [0.03177990780294414, 0.004662067117690401, 0.017116442927037803] and parameters: {'n_layers': 1, 'embedding_dim': 64, 'lr': 0.0016889361681909714, 'lambda_val': 0.00035318754870590177, 'batch_size': 3311, 'optimizer': 'RMSprop'}.
2026-06-13 21:45:24,712 - experiment_functions - INFO - Early stopping at epoch 3150. Best Metrics: (0.05043987964484397, 0.006760332239265858, 0.026157299869070838)
2026-06-13 21:45:24,794 - optuna.study.study - INFO - Trial 154 finished with values: [0.05043987964484397, 0.006760332239265858, 0.026157299869070838] and parameters: {'n_layers': 4, 'embedding_dim': 64, 'lr': 0.0009711234831697961, 'lambda_val': 2.3680453923050776e-05, 'batch_size': 1859, 'optimizer': 'Adam'}.
2026-06-13 21:46:09,435 - experiment_functions - INFO - Early stopping at epoch 1150. Best Metrics: (0.02413894232156723, 0.0036857793556165845, 0.012652584030833027)
2026-06-13 21:46:09,529 - optuna.study.study - INFO - Trial 155 finished with values: [0.02413894232156723, 0.0036857793556165845, 0.012652584030833027] and parameters: {'n_layers': 1, 'embedding_dim': 64, 'lr': 0.0016889361681909714, 'lambda_val': 0.0037208546295430245, 'batch_size': 3324, 'optimizer': 'RMSprop'}.
2026-06-13 21:46:47,581 - experiment_functions - INFO - Early stopping at epoch 900. Best Metrics: (0.031680490753953364, 0.004713979502980776, 0.016511030324843416)
2026-06-13 21:46:47,652 - optuna.study.study - INFO - Trial 156 finished with values: [0.031680490753953364, 0.004713979502980776, 0.016511030324843416] and parameters: {'n_layers': 2, 'embedding_dim': 96, 'lr': 0.0016889361681909714, 'lambda_val': 0.0034172702614614723, 'batch_size': 3306, 'optimizer': 'Adam'}.
2026-06-13 21:49:20,864 - optuna.study.study - INFO - Trial 157 finished with values: [0.03311600533722428, 0.005089088351530578, 0.018951574748427943] and parameters: {'n_layers': 1, 'embedding_dim': 96, 'lr': 0.0009711234831697961, 'lambda_val': 0.00013114137848842562, 'batch_size': 1859, 'optimizer': 'RMSprop'}.
2026-06-13 21:49:42,783 - experiment_functions - INFO - Early stopping at epoch 500. Best Metrics: (0.0004893697616774152, 8.540424676803537e-05, 0.0002002105139052413)
2026-06-13 21:49:42,879 - optuna.study.study - INFO - Trial 158 finished with values: [0.0004893697616774152, 8.540424676803537e-05, 0.0002002105139052413] and parameters: {'n_layers': 3, 'embedding_dim': 96, 'lr': 0.0009711234831697961, 'lambda_val': 0.0003920256863411047, 'batch_size': 3699, 'optimizer': 'SGD'}.
2026-06-13 21:50:16,088 - experiment_functions - INFO - Early stopping at epoch 750. Best Metrics: (0.042698418488978006, 0.00576562395337933, 0.021010606349294903)
2026-06-13 21:50:16,170 - optuna.study.study - INFO - Trial 159 finished with values: [0.042698418488978006, 0.00576562395337933, 0.021010606349294903] and parameters: {'n_layers': 3, 'embedding_dim': 96, 'lr': 0.0016889361681909714, 'lambda_val': 0.00019652548319010554, 'batch_size': 3967, 'optimizer': 'RMSprop'}.
2026-06-13 21:51:02,768 - experiment_functions - INFO - Early stopping at epoch 1150. Best Metrics: (0.028170211826773168, 0.004288632862214483, 0.015111193268495337)
2026-06-13 21:51:02,862 - optuna.study.study - INFO - Trial 160 finished with values: [0.028170211826773168, 0.004288632862214483, 0.015111193268495337] and parameters: {'n_layers': 1, 'embedding_dim': 128, 'lr': 0.0030101219400550665, 'lambda_val': 0.00035318754870590177, 'batch_size': 1732, 'optimizer': 'RMSprop'}.
2026-06-13 21:53:38,279 - optuna.study.study - INFO - Trial 161 finished with values: [0.04604415823209263, 0.006552682698104361, 0.02420632003005202] and parameters: {'n_layers': 2, 'embedding_dim': 64, 'lr': 0.0009711234831697961, 'lambda_val': 0.00035318754870590177, 'batch_size': 1677, 'optimizer': 'Adam'}.
2026-06-13 21:55:57,557 - experiment_functions - INFO - Early stopping at epoch 3550. Best Metrics: (0.04493347914209537, 0.006333311005425682, 0.02417409040129672)
2026-06-13 21:55:57,627 - optuna.study.study - INFO - Trial 162 finished with values: [0.04493347914209537, 0.006333311005425682, 0.02417409040129672] and parameters: {'n_layers': 2, 'embedding_dim': 64, 'lr': 0.0009711234831697961, 'lambda_val': 4.1509980625924543e-05, 'batch_size': 3449, 'optimizer': 'Adam'}.
2026-06-13 21:56:42,180 - experiment_functions - INFO - Early stopping at epoch 950. Best Metrics: (0.032922938880038076, 0.004441020831937839, 0.01675567754305672)
2026-06-13 21:56:42,274 - optuna.study.study - INFO - Trial 163 finished with values: [0.032922938880038076, 0.004441020831937839, 0.01675567754305672] and parameters: {'n_layers': 4, 'embedding_dim': 128, 'lr': 0.0009711234831697961, 'lambda_val': 0.0034172702614614723, 'batch_size': 3271, 'optimizer': 'Adam'}.
2026-06-13 21:57:24,102 - experiment_functions - INFO - Early stopping at epoch 1000. Best Metrics: (0.03202139506258421, 0.004511353741040927, 0.01668101036180894)
2026-06-13 21:57:24,195 - optuna.study.study - INFO - Trial 164 finished with values: [0.03202139506258421, 0.004511353741040927, 0.01668101036180894] and parameters: {'n_layers': 2, 'embedding_dim': 96, 'lr': 0.0016889361681909714, 'lambda_val': 0.0033626453290954094, 'batch_size': 2816, 'optimizer': 'Adam'}.
2026-06-13 22:00:12,042 - optuna.study.study - INFO - Trial 165 finished with values: [0.055346783342654186, 0.0075607877285819546, 0.030266035870721505] and parameters: {'n_layers': 3, 'embedding_dim': 96, 'lr': 0.000495651360592853, 'lambda_val': 2.060634847155313e-06, 'batch_size': 3048, 'optimizer': 'RMSprop'}.
2026-06-13 22:02:41,340 - optuna.study.study - INFO - Trial 166 finished with values: [0.027507462121003384, 0.004198204836224797, 0.014897693684509978] and parameters: {'n_layers': 1, 'embedding_dim': 64, 'lr': 0.0009822401593291786, 'lambda_val': 0.0033626453290954094, 'batch_size': 1677, 'optimizer': 'RMSprop'}.
2026-06-13 22:05:32,003 - optuna.study.study - INFO - Trial 167 finished with values: [0.02643751994643283, 0.004141268671712774, 0.014572425544320762] and parameters: {'n_layers': 1, 'embedding_dim': 256, 'lr': 0.0009711234831697961, 'lambda_val': 0.0005195382127114068, 'batch_size': 1859, 'optimizer': 'Adam'}.
2026-06-13 22:06:23,409 - experiment_functions - INFO - Early stopping at epoch 1200. Best Metrics: (0.0434315773772032, 0.0058376314555563, 0.022130109274874812)
2026-06-13 22:06:23,493 - optuna.study.study - INFO - Trial 168 finished with values: [0.0434315773772032, 0.0058376314555563, 0.022130109274874812] and parameters: {'n_layers': 3, 'embedding_dim': 96, 'lr': 0.0009711234831697961, 'lambda_val': 0.0004033369882552061, 'batch_size': 3699, 'optimizer': 'RMSprop'}.
2026-06-13 22:08:55,373 - optuna.study.study - INFO - Trial 169 finished with values: [0.032941409764511695, 0.004930002009511689, 0.01824551186834097] and parameters: {'n_layers': 1, 'embedding_dim': 96, 'lr': 0.0009711234831697961, 'lambda_val': 0.0003920256863411047, 'batch_size': 1859, 'optimizer': 'RMSprop'}.
2026-06-13 22:09:20,567 - experiment_functions - INFO - Early stopping at epoch 550. Best Metrics: (0.005306348690316522, 0.0006916069395136983, 0.0029565468979929734)
2026-06-13 22:09:20,662 - optuna.study.study - INFO - Trial 170 finished with values: [0.005306348690316522, 0.0006916069395136983, 0.0029565468979929734] and parameters: {'n_layers': 1, 'embedding_dim': 256, 'lr': 0.04060618505496948, 'lambda_val': 1.0675657258140777e-06, 'batch_size': 3311, 'optimizer': 'RMSprop'}.
2026-06-13 22:11:54,080 - optuna.study.study - INFO - Trial 171 finished with values: [0.03306271961813394, 0.0050388505593140865, 0.01853141083953832] and parameters: {'n_layers': 1, 'embedding_dim': 96, 'lr': 0.0009711234831697961, 'lambda_val': 0.0003920256863411047, 'batch_size': 1859, 'optimizer': 'RMSprop'}.
2026-06-13 22:12:16,970 - experiment_functions - INFO - Early stopping at epoch 550. Best Metrics: (0.01568157629385104, 0.002337731931140733, 0.007946972291938059)
2026-06-13 22:12:17,056 - optuna.study.study - INFO - Trial 172 finished with values: [0.01568157629385104, 0.002337731931140733, 0.007946972291938059] and parameters: {'n_layers': 2, 'embedding_dim': 64, 'lr': 0.02184395095758255, 'lambda_val': 0.00035318754870590177, 'batch_size': 1264, 'optimizer': 'Adam'}.
2026-06-13 22:13:12,048 - experiment_functions - INFO - Early stopping at epoch 1300. Best Metrics: (0.04652234933960472, 0.0061340344296335995, 0.024483878219558528)
2026-06-13 22:13:12,152 - optuna.study.study - INFO - Trial 173 finished with values: [0.04652234933960472, 0.0061340344296335995, 0.024483878219558528] and parameters: {'n_layers': 4, 'embedding_dim': 64, 'lr': 0.0009711234831697961, 'lambda_val': 2.3680453923050776e-05, 'batch_size': 2959, 'optimizer': 'RMSprop'}.
2026-06-13 22:13:34,775 - experiment_functions - INFO - Early stopping at epoch 550. Best Metrics: (0.005099099052086739, 0.0007284479871391252, 0.0026970502461203167)
2026-06-13 22:13:34,864 - optuna.study.study - INFO - Trial 174 finished with values: [0.005099099052086739, 0.0007284479871391252, 0.0026970502461203167] and parameters: {'n_layers': 2, 'embedding_dim': 64, 'lr': 0.06608053518021677, 'lambda_val': 4.1509980625924543e-05, 'batch_size': 3449, 'optimizer': 'RMSprop'}.
2026-06-13 22:14:54,291 - experiment_functions - INFO - Early stopping at epoch 2050. Best Metrics: (0.0005000085831485294, 7.703128139862013e-05, 0.00021759681263114154)
2026-06-13 22:14:54,383 - optuna.study.study - INFO - Trial 175 finished with values: [0.0005000085831485294, 7.703128139862013e-05, 0.00021759681263114154] and parameters: {'n_layers': 3, 'embedding_dim': 64, 'lr': 2.0373366410055783e-05, 'lambda_val': 0.0005590603438440636, 'batch_size': 1264, 'optimizer': 'Adam'}.
2026-06-13 22:15:57,748 - experiment_functions - INFO - Early stopping at epoch 1550. Best Metrics: (0.04517059742394477, 0.00636010449460781, 0.02382737002733124)
2026-06-13 22:15:57,831 - optuna.study.study - INFO - Trial 176 finished with values: [0.04517059742394477, 0.00636010449460781, 0.02382737002733124] and parameters: {'n_layers': 2, 'embedding_dim': 96, 'lr': 0.0016889361681909714, 'lambda_val': 3.6850667956484766e-06, 'batch_size': 1859, 'optimizer': 'Adam'}.
2026-06-13 22:18:25,460 - optuna.study.study - INFO - Trial 177 finished with values: [0.026824287943101793, 0.004137919485565008, 0.016374788085685633] and parameters: {'n_layers': 1, 'embedding_dim': 64, 'lr': 0.0009711234831697961, 'lambda_val': 0.00035318754870590177, 'batch_size': 1151, 'optimizer': 'RMSprop'}.
2026-06-13 22:19:12,025 - experiment_functions - INFO - Early stopping at epoch 1000. Best Metrics: (0.041880518472964444, 0.005768973139527096, 0.021446149324466427)
2026-06-13 22:19:12,118 - optuna.study.study - INFO - Trial 178 finished with values: [0.041880518472964444, 0.005768973139527096, 0.021446149324466427] and parameters: {'n_layers': 4, 'embedding_dim': 128, 'lr': 0.0009711234831697961, 'lambda_val': 0.0005195382127114068, 'batch_size': 1859, 'optimizer': 'RMSprop'}.
2026-06-13 22:21:47,305 - optuna.study.study - INFO - Trial 179 finished with values: [0.04460212665843635, 0.006313215888539086, 0.02369775692665924] and parameters: {'n_layers': 2, 'embedding_dim': 64, 'lr': 0.0009822401593291786, 'lambda_val': 2.657146317841358e-05, 'batch_size': 3009, 'optimizer': 'Adam'}.
2026-06-13 22:22:39,692 - experiment_functions - INFO - Early stopping at epoch 1250. Best Metrics: (0.045272504001686316, 0.00601346372831402, 0.024314897374572694)
2026-06-13 22:22:39,781 - optuna.study.study - INFO - Trial 180 finished with values: [0.045272504001686316, 0.00601346372831402, 0.024314897374572694] and parameters: {'n_layers': 4, 'embedding_dim': 64, 'lr': 0.0009711234831697961, 'lambda_val': 2.3680453923050776e-05, 'batch_size': 2916, 'optimizer': 'RMSprop'}.
2026-06-13 22:23:43,140 - experiment_functions - INFO - Early stopping at epoch 1450. Best Metrics: (0.02916651253078317, 0.004213276173889745, 0.01550691381598465)
2026-06-13 22:23:43,270 - optuna.study.study - INFO - Trial 181 finished with values: [0.02916651253078317, 0.004213276173889745, 0.01550691381598465] and parameters: {'n_layers': 1, 'embedding_dim': 256, 'lr': 0.0016889361681909714, 'lambda_val': 0.00035318754870590177, 'batch_size': 2816, 'optimizer': 'RMSprop'}.
2026-06-13 22:26:19,193 - optuna.study.study - INFO - Trial 182 finished with values: [0.0362205983541646, 0.0053938642909772926, 0.0205926157669765] and parameters: {'n_layers': 1, 'embedding_dim': 128, 'lr': 0.0009711234831697961, 'lambda_val': 2.060634847155313e-06, 'batch_size': 1859, 'optimizer': 'RMSprop'}.
2026-06-13 22:26:41,543 - experiment_functions - INFO - Early stopping at epoch 500. Best Metrics: (0.0004355017270092435, 7.53566883247371e-05, 0.00022043814241087573)
2026-06-13 22:26:41,639 - optuna.study.study - INFO - Trial 183 finished with values: [0.0004355017270092435, 7.53566883247371e-05, 0.00022043814241087573] and parameters: {'n_layers': 1, 'embedding_dim': 256, 'lr': 0.0016889361681909714, 'lambda_val': 0.00035318754870590177, 'batch_size': 3311, 'optimizer': 'SGD'}.
2026-06-13 22:27:17,185 - experiment_functions - INFO - Early stopping at epoch 750. Best Metrics: (0.040055389937638804, 0.0053386027195391535, 0.01958718342527256)
2026-06-13 22:27:17,274 - optuna.study.study - INFO - Trial 184 finished with values: [0.040055389937638804, 0.0053386027195391535, 0.01958718342527256] and parameters: {'n_layers': 4, 'embedding_dim': 128, 'lr': 0.0013289886132312838, 'lambda_val': 0.0003920256863411047, 'batch_size': 2523, 'optimizer': 'RMSprop'}.
2026-06-13 22:28:05,662 - experiment_functions - INFO - Early stopping at epoch 1250. Best Metrics: (0.031413590526416894, 0.004698908165315829, 0.01684970114508206)
2026-06-13 22:28:05,746 - optuna.study.study - INFO - Trial 185 finished with values: [0.031413590526416894, 0.004698908165315829, 0.01684970114508206] and parameters: {'n_layers': 1, 'embedding_dim': 64, 'lr': 0.0016889361681909714, 'lambda_val': 0.00035318754870590177, 'batch_size': 3699, 'optimizer': 'RMSprop'}.
2026-06-13 22:29:05,023 - experiment_functions - INFO - Early stopping at epoch 1550. Best Metrics: (0.032617574402828864, 0.004822828052783174, 0.01731626801428715)
2026-06-13 22:29:05,110 - optuna.study.study - INFO - Trial 186 finished with values: [0.032617574402828864, 0.004822828052783174, 0.01731626801428715] and parameters: {'n_layers': 1, 'embedding_dim': 64, 'lr': 0.0016889361681909714, 'lambda_val': 0.00035318754870590177, 'batch_size': 3311, 'optimizer': 'RMSprop'}.
2026-06-13 22:30:02,146 - experiment_functions - INFO - Early stopping at epoch 1400. Best Metrics: (0.0486910863919943, 0.006477326009779624, 0.025220586971005547)
2026-06-13 22:30:02,246 - optuna.study.study - INFO - Trial 187 finished with values: [0.0486910863919943, 0.006477326009779624, 0.025220586971005547] and parameters: {'n_layers': 3, 'embedding_dim': 64, 'lr': 0.0016889361681909714, 'lambda_val': 3.0223344926075768e-05, 'batch_size': 1602, 'optimizer': 'RMSprop'}.
2026-06-13 22:31:16,129 - experiment_functions - INFO - Early stopping at epoch 1900. Best Metrics: (0.009626996740122325, 0.0011772389309397816, 0.0040986599524620825)
2026-06-13 22:31:16,214 - optuna.study.study - INFO - Trial 188 finished with values: [0.009626996740122325, 0.0011772389309397816, 0.0040986599524620825] and parameters: {'n_layers': 3, 'embedding_dim': 64, 'lr': 0.0016889361681909714, 'lambda_val': 0.07656336552963279, 'batch_size': 1049, 'optimizer': 'Adam'}.
2026-06-13 22:32:20,849 - experiment_functions - INFO - Early stopping at epoch 1400. Best Metrics: (0.0480657530702784, 0.006385223390716056, 0.02422463192002017)
2026-06-13 22:32:20,928 - optuna.study.study - INFO - Trial 189 finished with values: [0.0480657530702784, 0.006385223390716056, 0.02422463192002017] and parameters: {'n_layers': 4, 'embedding_dim': 128, 'lr': 0.0009711234831697961, 'lambda_val': 0.00013735320939513843, 'batch_size': 1859, 'optimizer': 'RMSprop'}.
2026-06-13 22:32:42,451 - experiment_functions - INFO - Early stopping at epoch 500. Best Metrics: (0.0005107098794556828, 7.703128139862013e-05, 0.00024353239105064992)
