2026-06-13 18:52:41,014 - root - INFO - **** Training e_gowalla_full
2026-06-13 18:52:41,036 - root - INFO - --- Hardware Check ---
2026-06-13 18:52:41,036 - root - INFO - PyTorch version 2.6.0+cu124
2026-06-13 18:52:41,037 - root - INFO - Is CUDA available? True
2026-06-13 18:52:41,109 - root - INFO - GPU Device Name: NVIDIA GeForce RTX 3090
2026-06-13 18:52:43,496 - helper_functions - INFO - Users: 29858, Items: 40981
2026-06-13 18:52:43,496 - helper_functions - INFO - Edge index: torch.Size([2, 1027370])
2026-06-13 18:52:43,496 - root - INFO - **** Generating the graph:
2026-06-13 18:52:44,742 - helper_functions - INFO - Number of unique users: 29858
2026-06-13 18:52:44,754 - helper_functions - INFO - Number of unique items: 40981
2026-06-13 18:52:44,754 - helper_functions - INFO - Number of nodes: 70839
2026-06-13 18:52:44,777 - helper_functions - INFO - Number of edges: 1027370
2026-06-13 18:52:45,672 - root - INFO -   **** Training e_gowalla_1c3dcs_strict_rand5
2026-06-13 18:52:45,714 - root - INFO -   **** Getting 140770/845292 random edges
2026-06-13 18:52:46,431 - optuna.storages._rdb.storage - INFO - A new study created in RDB with name: Study_e_gowalla_1c3dcs_strict_rand5
2026-06-13 18:53:10,565 - experiment_functions - INFO - Early stopping at epoch 500. Best Metrics: (0.0005419930363827549, 8.875343291580146e-05, 0.00024318740822317945)
2026-06-13 18:53:10,636 - optuna.study.study - INFO - Trial 0 finished with values: [0.0005419930363827549, 8.875343291580146e-05, 0.00024318740822317945] and parameters: {'n_layers': 4, 'embedding_dim': 64, 'lr': 0.0009143326292039892, 'lambda_val': 5.169784616577781e-05, 'batch_size': 2038, 'optimizer': 'SGD'}.
2026-06-13 18:55:05,773 - experiment_functions - INFO - Early stopping at epoch 2950. Best Metrics: (0.021289992876897486, 0.003389376381539286, 0.011398964347841059)
2026-06-13 18:55:05,851 - optuna.study.study - INFO - Trial 1 finished with values: [0.021289992876897486, 0.003389376381539286, 0.011398964347841059] and parameters: {'n_layers': 1, 'embedding_dim': 128, 'lr': 0.0006971255889475698, 'lambda_val': 0.018328494161540542, 'batch_size': 3751, 'optimizer': 'RMSprop'}.
2026-06-13 18:55:28,302 - experiment_functions - INFO - Early stopping at epoch 500. Best Metrics: (0.0006130531622067194, 9.880099135909974e-05, 0.00030673296487172363)
2026-06-13 18:55:28,390 - optuna.study.study - INFO - Trial 2 finished with values: [0.0006130531622067194, 9.880099135909974e-05, 0.00030673296487172363] and parameters: {'n_layers': 4, 'embedding_dim': 96, 'lr': 0.00017169824875211975, 'lambda_val': 8.189329524360161e-06, 'batch_size': 4027, 'optimizer': 'SGD'}.
2026-06-13 18:57:25,531 - experiment_functions - INFO - Early stopping at epoch 3200. Best Metrics: (0.000895668273086623, 0.00011889610824569631, 0.00036573304728320754)
2026-06-13 18:57:25,625 - optuna.study.study - INFO - Trial 3 finished with values: [0.000895668273086623, 0.00011889610824569631, 0.00036573304728320754] and parameters: {'n_layers': 1, 'embedding_dim': 64, 'lr': 0.00018340313041142431, 'lambda_val': 0.015571764027357576, 'batch_size': 3483, 'optimizer': 'RMSprop'}.
2026-06-13 18:57:47,111 - experiment_functions - INFO - Early stopping at epoch 500. Best Metrics: (0.000683601031112561, 9.545180521133366e-05, 0.00028358667746225476)
2026-06-13 18:57:47,171 - optuna.study.study - INFO - Trial 4 finished with values: [0.000683601031112561, 9.545180521133366e-05, 0.00028358667746225476] and parameters: {'n_layers': 2, 'embedding_dim': 128, 'lr': 0.001194173234719219, 'lambda_val': 0.024938154480712085, 'batch_size': 738, 'optimizer': 'SGD'}.
2026-06-13 18:58:08,269 - experiment_functions - INFO - Early stopping at epoch 500. Best Metrics: (0.0004973652786237618, 6.865831602920491e-05, 0.00021066264760970466)
2026-06-13 18:58:08,335 - optuna.study.study - INFO - Trial 5 finished with values: [0.0004973652786237618, 6.865831602920491e-05, 0.00021066264760970466] and parameters: {'n_layers': 2, 'embedding_dim': 96, 'lr': 7.288776137374531e-05, 'lambda_val': 4.980825304078413e-06, 'batch_size': 2617, 'optimizer': 'SGD'}.
2026-06-13 18:58:39,967 - experiment_functions - INFO - Early stopping at epoch 850. Best Metrics: (0.0003980718312303191, 5.3586978364257486e-05, 0.00021036298293939293)
2026-06-13 18:58:40,201 - optuna.study.study - INFO - Trial 6 finished with values: [0.0003980718312303191, 5.3586978364257486e-05, 0.00021036298293939293] and parameters: {'n_layers': 1, 'embedding_dim': 32, 'lr': 1.632656303909739e-05, 'lambda_val': 0.031538152891462376, 'batch_size': 1430, 'optimizer': 'RMSprop'}.
2026-06-13 18:59:03,083 - experiment_functions - INFO - Early stopping at epoch 550. Best Metrics: (0.01134414944618787, 0.001657847143144216, 0.005655527598320651)
2026-06-13 18:59:03,151 - optuna.study.study - INFO - Trial 7 finished with values: [0.01134414944618787, 0.001657847143144216, 0.005655527598320651] and parameters: {'n_layers': 2, 'embedding_dim': 64, 'lr': 0.02452752830598187, 'lambda_val': 0.01866673428394609, 'batch_size': 3449, 'optimizer': 'Adam'}.
2026-06-13 18:59:34,236 - experiment_functions - INFO - Early stopping at epoch 700. Best Metrics: (0.00041182615092750515, 6.195994373367272e-05, 0.00017238023965509167)
2026-06-13 18:59:34,311 - optuna.study.study - INFO - Trial 8 finished with values: [0.00041182615092750515, 6.195994373367272e-05, 0.00017238023965509167] and parameters: {'n_layers': 3, 'embedding_dim': 128, 'lr': 6.210270982307735e-05, 'lambda_val': 0.09960379375666684, 'batch_size': 2221, 'optimizer': 'Adam'}.
2026-06-13 19:00:38,484 - experiment_functions - INFO - Early stopping at epoch 1500. Best Metrics: (0.0003869818913679043, 7.53566883247371e-05, 0.00024389525918682862)
2026-06-13 19:00:38,563 - optuna.study.study - INFO - Trial 9 finished with values: [0.0003869818913679043, 7.53566883247371e-05, 0.00024389525918682862] and parameters: {'n_layers': 3, 'embedding_dim': 128, 'lr': 1.5233273365166598e-05, 'lambda_val': 0.00013735320939513843, 'batch_size': 3306, 'optimizer': 'Adam'}.
2026-06-13 19:01:39,730 - experiment_functions - INFO - Early stopping at epoch 1400. Best Metrics: (0.039251338236533484, 0.005325205974948088, 0.019921450919296077)
2026-06-13 19:01:39,824 - optuna.study.study - INFO - Trial 10 finished with values: [0.039251338236533484, 0.005325205974948088, 0.019921450919296077] and parameters: {'n_layers': 4, 'embedding_dim': 96, 'lr': 0.0009711234831697961, 'lambda_val': 0.0005195382127114068, 'batch_size': 1859, 'optimizer': 'RMSprop'}.
2026-06-13 19:02:35,480 - experiment_functions - INFO - Early stopping at epoch 1400. Best Metrics: (0.039190607122402035, 0.0055194587715185215, 0.020232671500998552)
2026-06-13 19:02:35,552 - optuna.study.study - INFO - Trial 11 finished with values: [0.039190607122402035, 0.0055194587715185215, 0.020232671500998552] and parameters: {'n_layers': 2, 'embedding_dim': 64, 'lr': 0.0009822401593291786, 'lambda_val': 0.0016643534908328272, 'batch_size': 3009, 'optimizer': 'RMSprop'}.
2026-06-13 19:03:53,179 - experiment_functions - INFO - Early stopping at epoch 1850. Best Metrics: (0.0006483341255338607, 9.880099135909974e-05, 0.00030278898527258104)
2026-06-13 19:03:53,254 - optuna.study.study - INFO - Trial 12 finished with values: [0.0006483341255338607, 9.880099135909974e-05, 0.00030278898527258104] and parameters: {'n_layers': 4, 'embedding_dim': 96, 'lr': 0.00013346452999613302, 'lambda_val': 0.003364828890815943, 'batch_size': 774, 'optimizer': 'Adam'}.
2026-06-13 19:04:14,790 - experiment_functions - INFO - Early stopping at epoch 500. Best Metrics: (0.0004490651168258509, 6.865831602920491e-05, 0.0001985503764054823)
2026-06-13 19:04:14,856 - optuna.study.study - INFO - Trial 13 finished with values: [0.0004490651168258509, 6.865831602920491e-05, 0.0001985503764054823] and parameters: {'n_layers': 4, 'embedding_dim': 64, 'lr': 2.2690303623159337e-05, 'lambda_val': 0.05150048837354903, 'batch_size': 1185, 'optimizer': 'Adam'}.
2026-06-13 19:06:25,807 - experiment_functions - INFO - Early stopping at epoch 3450. Best Metrics: (0.007937687912006296, 0.0011353741040927056, 0.0036006845157791484)
2026-06-13 19:06:25,886 - optuna.study.study - INFO - Trial 14 finished with values: [0.007937687912006296, 0.0011353741040927056, 0.0036006845157791484] and parameters: {'n_layers': 2, 'embedding_dim': 64, 'lr': 0.06463772794599591, 'lambda_val': 0.07395182262474423, 'batch_size': 3324, 'optimizer': 'Adam'}.
2026-06-13 19:08:56,086 - optuna.study.study - INFO - Trial 15 finished with values: [0.001501609543734749, 0.00025286355415634005, 0.0008208006498357191] and parameters: {'n_layers': 2, 'embedding_dim': 64, 'lr': 0.00016238280601144333, 'lambda_val': 1.0994160714564823e-06, 'batch_size': 2418, 'optimizer': 'RMSprop'}.
2026-06-13 19:09:18,596 - experiment_functions - INFO - Early stopping at epoch 500. Best Metrics: (0.0003241388334954326, 6.698372295532186e-05, 0.00017198605972895074)
2026-06-13 19:09:18,667 - optuna.study.study - INFO - Trial 16 finished with values: [0.0003241388334954326, 6.698372295532186e-05, 0.00017198605972895074] and parameters: {'n_layers': 1, 'embedding_dim': 256, 'lr': 0.00020489656664522015, 'lambda_val': 3.7362303650496025e-06, 'batch_size': 3519, 'optimizer': 'SGD'}.
2026-06-13 19:09:42,940 - experiment_functions - INFO - Early stopping at epoch 500. Best Metrics: (0.00066474813498781, 7.53566883247371e-05, 0.00028015188279709207)
2026-06-13 19:09:43,016 - optuna.study.study - INFO - Trial 17 finished with values: [0.00066474813498781, 7.53566883247371e-05, 0.00028015188279709207] and parameters: {'n_layers': 2, 'embedding_dim': 256, 'lr': 0.011641903680609965, 'lambda_val': 0.05228234449631282, 'batch_size': 1677, 'optimizer': 'SGD'}.
2026-06-13 19:10:03,068 - experiment_functions - INFO - Early stopping at epoch 500. Best Metrics: (0.0003010894028198631, 5.861075758590664e-05, 0.00017283055921897886)
2026-06-13 19:10:03,199 - optuna.study.study - INFO - Trial 18 finished with values: [0.0003010894028198631, 5.861075758590664e-05, 0.00017283055921897886] and parameters: {'n_layers': 1, 'embedding_dim': 64, 'lr': 0.0026660606895797957, 'lambda_val': 1.362354562307035e-05, 'batch_size': 1247, 'optimizer': 'SGD'}.
2026-06-13 19:12:37,459 - optuna.study.study - INFO - Trial 19 finished with values: [0.013317011167668813, 0.0021300823899792353, 0.00787898716823979] and parameters: {'n_layers': 1, 'embedding_dim': 128, 'lr': 0.000495651360592853, 'lambda_val': 1.560024380616628e-05, 'batch_size': 2071, 'optimizer': 'Adam'}.
2026-06-13 19:13:03,574 - experiment_functions - INFO - Early stopping at epoch 500. Best Metrics: (0.00038345503762940414, 5.693616451202358e-05, 0.00017825744949360276)
2026-06-13 19:13:03,664 - optuna.study.study - INFO - Trial 20 finished with values: [0.00038345503762940414, 5.693616451202358e-05, 0.00017825744949360276] and parameters: {'n_layers': 3, 'embedding_dim': 256, 'lr': 0.0009340839325656311, 'lambda_val': 0.058182259541522556, 'batch_size': 3899, 'optimizer': 'SGD'}.
2026-06-13 19:15:31,140 - optuna.study.study - INFO - Trial 21 finished with values: [0.011887759440052756, 0.0017298546453211872, 0.0058374433735850495] and parameters: {'n_layers': 3, 'embedding_dim': 32, 'lr': 0.04448259180305926, 'lambda_val': 0.002996942924953501, 'batch_size': 929, 'optimizer': 'RMSprop'}.
2026-06-13 19:16:00,462 - experiment_functions - INFO - Early stopping at epoch 650. Best Metrics: (0.013194036264618146, 0.001765021099872731, 0.006429428958025747)
2026-06-13 19:16:00,541 - optuna.study.study - INFO - Trial 22 finished with values: [0.013194036264618146, 0.001765021099872731, 0.006429428958025747] and parameters: {'n_layers': 4, 'embedding_dim': 96, 'lr': 0.0018163821909776498, 'lambda_val': 0.02777174946505567, 'batch_size': 3815, 'optimizer': 'RMSprop'}.
2026-06-13 19:16:22,313 - experiment_functions - INFO - Early stopping at epoch 500. Best Metrics: (0.0004302230431678236, 7.033290910308795e-05, 0.0002017415422133562)
2026-06-13 19:16:22,406 - optuna.study.study - INFO - Trial 23 finished with values: [0.0004302230431678236, 7.033290910308795e-05, 0.0002017415422133562] and parameters: {'n_layers': 3, 'embedding_dim': 96, 'lr': 0.03876243614740241, 'lambda_val': 7.637053569861663e-05, 'batch_size': 2398, 'optimizer': 'SGD'}.
2026-06-13 19:17:58,284 - experiment_functions - INFO - Early stopping at epoch 2250. Best Metrics: (0.0164003358032842, 0.0022556768705204637, 0.00785793018329069)
2026-06-13 19:17:58,364 - optuna.study.study - INFO - Trial 24 finished with values: [0.0164003358032842, 0.0022556768705204637, 0.00785793018329069] and parameters: {'n_layers': 3, 'embedding_dim': 128, 'lr': 0.024143923894547725, 'lambda_val': 0.0003351122520854177, 'batch_size': 3843, 'optimizer': 'RMSprop'}.
2026-06-13 19:18:22,462 - experiment_functions - INFO - Early stopping at epoch 600. Best Metrics: (0.00040482881580423496, 6.86583160292049e-05, 0.0002294095659906136)
2026-06-13 19:18:22,548 - optuna.study.study - INFO - Trial 25 finished with values: [0.00040482881580423496, 6.86583160292049e-05, 0.0002294095659906136] and parameters: {'n_layers': 4, 'embedding_dim': 32, 'lr': 2.1207916774601382e-05, 'lambda_val': 3.3799013769204694e-06, 'batch_size': 619, 'optimizer': 'Adam'}.
2026-06-13 19:20:31,509 - experiment_functions - INFO - Early stopping at epoch 3550. Best Metrics: (0.0009617016748057382, 0.0001356420389845268, 0.0004938756321428141)
2026-06-13 19:20:31,598 - optuna.study.study - INFO - Trial 26 finished with values: [0.0009617016748057382, 0.0001356420389845268, 0.0004938756321428141] and parameters: {'n_layers': 1, 'embedding_dim': 64, 'lr': 0.00014279942711366034, 'lambda_val': 4.193894827058616e-05, 'batch_size': 3712, 'optimizer': 'Adam'}.
2026-06-13 19:23:05,094 - optuna.study.study - INFO - Trial 27 finished with values: [0.031159127409187616, 0.004375711702056401, 0.016217696937184528] and parameters: {'n_layers': 2, 'embedding_dim': 64, 'lr': 0.0006193224215073263, 'lambda_val': 0.005651522538859645, 'batch_size': 4095, 'optimizer': 'Adam'}.
2026-06-13 19:23:27,671 - experiment_functions - INFO - Early stopping at epoch 500. Best Metrics: (0.00045383365828613177, 8.038046754638624e-05, 0.00020393270340616243)
2026-06-13 19:23:27,762 - optuna.study.study - INFO - Trial 28 finished with values: [0.00045383365828613177, 8.038046754638624e-05, 0.00020393270340616243] and parameters: {'n_layers': 3, 'embedding_dim': 128, 'lr': 0.035690615716791725, 'lambda_val': 0.00020064871301867665, 'batch_size': 556, 'optimizer': 'SGD'}.
2026-06-13 19:24:04,546 - experiment_functions - INFO - Early stopping at epoch 950. Best Metrics: (0.008426085114607792, 0.0013580949829191508, 0.004436292942269559)
2026-06-13 19:24:04,611 - optuna.study.study - INFO - Trial 29 finished with values: [0.008426085114607792, 0.0013580949829191508, 0.004436292942269559] and parameters: {'n_layers': 1, 'embedding_dim': 64, 'lr': 0.021823625397344976, 'lambda_val': 1.4558283293252479e-05, 'batch_size': 688, 'optimizer': 'RMSprop'}.
2026-06-13 19:24:26,433 - experiment_functions - INFO - Early stopping at epoch 550. Best Metrics: (0.00522967687079004, 0.0007652890347645523, 0.002691054973983011)
2026-06-13 19:24:26,514 - optuna.study.study - INFO - Trial 30 finished with values: [0.00522967687079004, 0.0007652890347645523, 0.002691054973983011] and parameters: {'n_layers': 2, 'embedding_dim': 32, 'lr': 0.044186813805404825, 'lambda_val': 6.698391056726584e-05, 'batch_size': 1531, 'optimizer': 'RMSprop'}.
2026-06-13 19:27:18,215 - optuna.study.study - INFO - Trial 31 finished with values: [0.02920736594401873, 0.004338870654430974, 0.01619096966333844] and parameters: {'n_layers': 1, 'embedding_dim': 256, 'lr': 0.0011850840182929016, 'lambda_val': 2.060634847155313e-06, 'batch_size': 3311, 'optimizer': 'Adam'}.
2026-06-13 19:27:38,255 - experiment_functions - INFO - Early stopping at epoch 500. Best Metrics: (0.0004930786725094482, 7.870587447250318e-05, 0.000228374718770495)
2026-06-13 19:27:38,342 - optuna.study.study - INFO - Trial 32 finished with values: [0.0004930786725094482, 7.870587447250318e-05, 0.000228374718770495] and parameters: {'n_layers': 2, 'embedding_dim': 32, 'lr': 2.761470836542897e-05, 'lambda_val': 2.9851010320173887e-05, 'batch_size': 956, 'optimizer': 'RMSprop'}.
2026-06-13 19:27:59,824 - experiment_functions - INFO - Early stopping at epoch 500. Best Metrics: (0.0003027990058414969, 7.703128139862015e-05, 0.00015689530794566324)
2026-06-13 19:27:59,962 - optuna.study.study - INFO - Trial 33 finished with values: [0.0003027990058414969, 7.703128139862015e-05, 0.00015689530794566324] and parameters: {'n_layers': 4, 'embedding_dim': 64, 'lr': 0.006557255412878819, 'lambda_val': 0.0007496396768111535, 'batch_size': 3374, 'optimizer': 'SGD'}.
2026-06-13 19:28:23,812 - experiment_functions - INFO - Early stopping at epoch 550. Best Metrics: (0.02259533617568652, 0.0029288632862214488, 0.010962596326419046)
2026-06-13 19:28:23,910 - optuna.study.study - INFO - Trial 34 finished with values: [0.02259533617568652, 0.0029288632862214488, 0.010962596326419046] and parameters: {'n_layers': 4, 'embedding_dim': 64, 'lr': 0.03094768927981534, 'lambda_val': 2.3680453923050776e-05, 'batch_size': 3516, 'optimizer': 'Adam'}.
2026-06-13 19:28:59,160 - experiment_functions - INFO - Early stopping at epoch 900. Best Metrics: (0.023751857717329947, 0.0036455891218433924, 0.012951565817321082)
2026-06-13 19:28:59,236 - optuna.study.study - INFO - Trial 35 finished with values: [0.023751857717329947, 0.0036455891218433924, 0.012951565817321082] and parameters: {'n_layers': 1, 'embedding_dim': 64, 'lr': 0.0060199272034541455, 'lambda_val': 0.00019637406514583526, 'batch_size': 1732, 'optimizer': 'Adam'}.
2026-06-13 19:29:22,070 - experiment_functions - INFO - Early stopping at epoch 550. Best Metrics: (0.0007992849700461809, 9.71263982852167e-05, 0.0003884689174499955)
2026-06-13 19:29:22,160 - optuna.study.study - INFO - Trial 36 finished with values: [0.0007992849700461809, 9.71263982852167e-05, 0.0003884689174499955] and parameters: {'n_layers': 2, 'embedding_dim': 96, 'lr': 0.005617696241275853, 'lambda_val': 0.00142877448738649, 'batch_size': 681, 'optimizer': 'SGD'}.
2026-06-13 19:31:47,544 - optuna.study.study - INFO - Trial 37 finished with values: [0.001119575061964842, 0.0001657847143144216, 0.0005484030460564381] and parameters: {'n_layers': 3, 'embedding_dim': 32, 'lr': 0.00013539840549825556, 'lambda_val': 2.852470480955519e-05, 'batch_size': 1251, 'optimizer': 'RMSprop'}.
2026-06-13 19:33:44,799 - experiment_functions - INFO - Early stopping at epoch 3100. Best Metrics: (0.017248352737628897, 0.0025621274030410614, 0.008470584899382239)
2026-06-13 19:33:44,873 - optuna.study.study - INFO - Trial 38 finished with values: [0.017248352737628897, 0.0025621274030410614, 0.008470584899382239] and parameters: {'n_layers': 1, 'embedding_dim': 96, 'lr': 0.052296616630871054, 'lambda_val': 0.009153220394863267, 'batch_size': 3914, 'optimizer': 'RMSprop'}.
2026-06-13 19:34:17,009 - experiment_functions - INFO - Early stopping at epoch 750. Best Metrics: (0.03740236403161777, 0.005042199745461852, 0.01863522168445921)
2026-06-13 19:34:17,103 - optuna.study.study - INFO - Trial 39 finished with values: [0.03740236403161777, 0.005042199745461852, 0.01863522168445921] and parameters: {'n_layers': 4, 'embedding_dim': 64, 'lr': 0.0027934085914899194, 'lambda_val': 4.1509980625924543e-05, 'batch_size': 2830, 'optimizer': 'Adam'}.
2026-06-13 19:34:40,615 - experiment_functions - INFO - Early stopping at epoch 500. Best Metrics: (0.0004960216812697866, 6.530912988143881e-05, 0.0002698029915012626)
2026-06-13 19:34:40,702 - optuna.study.study - INFO - Trial 40 finished with values: [0.0004960216812697866, 6.530912988143881e-05, 0.0002698029915012626] and parameters: {'n_layers': 4, 'embedding_dim': 128, 'lr': 1.3610029834583656e-05, 'lambda_val': 2.514156118543351e-06, 'batch_size': 2421, 'optimizer': 'SGD'}.
2026-06-13 19:37:29,463 - optuna.study.study - INFO - Trial 41 finished with values: [0.021742241568263255, 0.003486502779824503, 0.01178975420993746] and parameters: {'n_layers': 1, 'embedding_dim': 256, 'lr': 0.0004968249913840261, 'lambda_val': 0.009412757279676068, 'batch_size': 3636, 'optimizer': 'RMSprop'}.
2026-06-13 19:37:50,113 - experiment_functions - INFO - Early stopping at epoch 500. Best Metrics: (0.000621041152098684, 8.038046754638622e-05, 0.00028599205666211423)
2026-06-13 19:37:50,183 - optuna.study.study - INFO - Trial 42 finished with values: [0.000621041152098684, 8.038046754638622e-05, 0.00028599205666211423] and parameters: {'n_layers': 1, 'embedding_dim': 128, 'lr': 0.0010041785152034265, 'lambda_val': 0.01948614622063529, 'batch_size': 2218, 'optimizer': 'SGD'}.
2026-06-13 19:38:55,497 - experiment_functions - INFO - Early stopping at epoch 1600. Best Metrics: (0.000520139397442948, 6.530912988143882e-05, 0.00021031029539013944)
2026-06-13 19:38:55,573 - optuna.study.study - INFO - Trial 43 finished with values: [0.000520139397442948, 6.530912988143882e-05, 0.00021031029539013944] and parameters: {'n_layers': 2, 'embedding_dim': 128, 'lr': 1.7303763529237848e-05, 'lambda_val': 1.2455620919991295e-05, 'batch_size': 2754, 'optimizer': 'Adam'}.
2026-06-13 19:39:23,281 - experiment_functions - INFO - Early stopping at epoch 700. Best Metrics: (0.0006274541375650393, 7.53566883247371e-05, 0.0002715826622898888)
2026-06-13 19:39:23,352 - optuna.study.study - INFO - Trial 44 finished with values: [0.0006274541375650393, 7.53566883247371e-05, 0.0002715826622898888] and parameters: {'n_layers': 2, 'embedding_dim': 64, 'lr': 6.984457303991609e-05, 'lambda_val': 0.0008404983998828952, 'batch_size': 3118, 'optimizer': 'Adam'}.
2026-06-13 19:39:47,723 - experiment_functions - INFO - Early stopping at epoch 550. Best Metrics: (0.017183923897500664, 0.002418112398687119, 0.00892546729772464)
