2026-06-15 15:50:37,514 - optuna.study.study - INFO - Trial 282 finished with values: [0.0846460601473595, 0.01022506530912988, 0.04364227794100809] and parameters: {'n_layers': 1, 'embedding_dim': 256, 'lr': 0.0056865752581316785, 'lambda_val': 1.0723270203484857e-05, 'batch_size': 2768, 'optimizer': 'Adam'}.
2026-06-15 15:51:10,888 - experiment_functions - INFO - Early stopping at epoch 650. Best Metrics: (0.0864265245299763, 0.01077768102351129, 0.0462050361735877)
2026-06-15 15:51:10,995 - optuna.study.study - INFO - Trial 283 finished with values: [0.0864265245299763, 0.01077768102351129, 0.0462050361735877] and parameters: {'n_layers': 1, 'embedding_dim': 256, 'lr': 0.0056865752581316785, 'lambda_val': 4.6804655463952444e-05, 'batch_size': 3479, 'optimizer': 'Adam'}.
2026-06-15 15:53:53,492 - optuna.study.study - INFO - Trial 284 finished with values: [0.06815546796711518, 0.00824067251657847, 0.03525046438622874] and parameters: {'n_layers': 3, 'embedding_dim': 32, 'lr': 0.0006927984696641446, 'lambda_val': 2.549475670628784e-06, 'batch_size': 3697, 'optimizer': 'Adam'}.
2026-06-15 15:54:51,422 - experiment_functions - INFO - Early stopping at epoch 1200. Best Metrics: (0.08252771836402281, 0.010055931408667694, 0.04356598030319354)
2026-06-15 15:54:51,512 - optuna.study.study - INFO - Trial 285 finished with values: [0.08252771836402281, 0.010055931408667694, 0.04356598030319354] and parameters: {'n_layers': 1, 'embedding_dim': 256, 'lr': 0.0030096858286544014, 'lambda_val': 2.0471988586907107e-05, 'batch_size': 811, 'optimizer': 'Adam'}.
2026-06-15 15:55:28,388 - experiment_functions - INFO - Early stopping at epoch 600. Best Metrics: (0.05576534450124214, 0.006852434858329426, 0.02753632769977907)
2026-06-15 15:55:28,467 - optuna.study.study - INFO - Trial 286 finished with values: [0.05576534450124214, 0.006852434858329426, 0.02753632769977907] and parameters: {'n_layers': 3, 'embedding_dim': 256, 'lr': 0.0026397990430783503, 'lambda_val': 1.0723270203484857e-05, 'batch_size': 3812, 'optimizer': 'Adam'}.
2026-06-15 15:56:20,917 - experiment_functions - INFO - Early stopping at epoch 800. Best Metrics: (0.04827059388582402, 0.005971598901466943, 0.02294035902942617)
2026-06-15 15:56:20,991 - optuna.study.study - INFO - Trial 287 finished with values: [0.04827059388582402, 0.005971598901466943, 0.02294035902942617] and parameters: {'n_layers': 4, 'embedding_dim': 256, 'lr': 0.0009175184684713226, 'lambda_val': 2.0471988586907107e-05, 'batch_size': 3812, 'optimizer': 'Adam'}.
2026-06-15 15:58:58,307 - optuna.study.study - INFO - Trial 288 finished with values: [0.053725615359720424, 0.007433518654966844, 0.030853899259487734] and parameters: {'n_layers': 1, 'embedding_dim': 64, 'lr': 0.0008138925204745388, 'lambda_val': 2.0471988586907107e-05, 'batch_size': 789, 'optimizer': 'RMSprop'}.
2026-06-15 15:59:43,103 - experiment_functions - INFO - Early stopping at epoch 1050. Best Metrics: (0.09183695281731666, 0.011296804876415033, 0.048617064197382834)
2026-06-15 15:59:44,375 - optuna.study.study - INFO - Trial 289 finished with values: [0.09183695281731666, 0.011296804876415033, 0.048617064197382834] and parameters: {'n_layers': 1, 'embedding_dim': 64, 'lr': 0.0026397990430783503, 'lambda_val': 1.0723270203484857e-05, 'batch_size': 3812, 'optimizer': 'Adam'}.
2026-06-15 16:00:34,345 - experiment_functions - INFO - Early stopping at epoch 1000. Best Metrics: (0.10113630951764407, 0.012191037577868578, 0.05412925676276659)
2026-06-15 16:00:34,444 - optuna.study.study - INFO - Trial 290 finished with values: [0.10113630951764407, 0.012191037577868578, 0.05412925676276659] and parameters: {'n_layers': 1, 'embedding_dim': 256, 'lr': 0.0022902718264188287, 'lambda_val': 2.0471988586907107e-05, 'batch_size': 3981, 'optimizer': 'Adam'}.
2026-06-15 16:03:11,822 - optuna.study.study - INFO - Trial 291 finished with values: [0.07645818397642368, 0.009963828789604126, 0.043386972274177295] and parameters: {'n_layers': 1, 'embedding_dim': 32, 'lr': 0.0008138925204745388, 'lambda_val': 1.0723270203484857e-05, 'batch_size': 3098, 'optimizer': 'RMSprop'}.
2026-06-15 16:03:44,749 - experiment_functions - INFO - Early stopping at epoch 650. Best Metrics: (0.0876337532173744, 0.010841315560318844, 0.04634568152022936)
2026-06-15 16:03:44,836 - optuna.study.study - INFO - Trial 292 finished with values: [0.0876337532173744, 0.010841315560318844, 0.04634568152022936] and parameters: {'n_layers': 1, 'embedding_dim': 256, 'lr': 0.005616296548051391, 'lambda_val': 2.0471988586907107e-05, 'batch_size': 3981, 'optimizer': 'Adam'}.
2026-06-15 16:04:25,262 - experiment_functions - INFO - Early stopping at epoch 800. Best Metrics: (0.09622477750362646, 0.011953245361377186, 0.051152506455519824)
2026-06-15 16:04:27,369 - optuna.study.study - INFO - Trial 293 finished with values: [0.09622477750362646, 0.011953245361377186, 0.051152506455519824] and parameters: {'n_layers': 1, 'embedding_dim': 256, 'lr': 0.0026397990430783503, 'lambda_val': 1.509459220212265e-05, 'batch_size': 3812, 'optimizer': 'Adam'}.
2026-06-15 16:07:11,587 - optuna.study.study - INFO - Trial 294 finished with values: [0.09615455856261608, 0.012015205305110858, 0.05265777110509725] and parameters: {'n_layers': 1, 'embedding_dim': 64, 'lr': 0.0009437548244297628, 'lambda_val': 4.6804655463952444e-05, 'batch_size': 3624, 'optimizer': 'Adam'}.
2026-06-15 16:07:55,393 - experiment_functions - INFO - Early stopping at epoch 900. Best Metrics: (0.07775365654516382, 0.009777948958403108, 0.04145676003777054)
2026-06-15 16:07:55,476 - optuna.study.study - INFO - Trial 295 finished with values: [0.07775365654516382, 0.009777948958403108, 0.04145676003777054] and parameters: {'n_layers': 1, 'embedding_dim': 256, 'lr': 0.0030096858286544014, 'lambda_val': 0.0009378495790752476, 'batch_size': 1189, 'optimizer': 'Adam'}.
2026-06-15 16:10:36,412 - optuna.study.study - INFO - Trial 296 finished with values: [0.09397192895617973, 0.01176234175095452, 0.052190635345579245] and parameters: {'n_layers': 1, 'embedding_dim': 64, 'lr': 0.0009437548244297628, 'lambda_val': 2.5476071418262236e-05, 'batch_size': 3325, 'optimizer': 'Adam'}.
2026-06-15 16:13:46,234 - optuna.study.study - INFO - Trial 297 finished with values: [0.10840401106743412, 0.013246031214414897, 0.05909048865605405] and parameters: {'n_layers': 1, 'embedding_dim': 256, 'lr': 0.0009437548244297628, 'lambda_val': 2.5476071418262236e-05, 'batch_size': 3624, 'optimizer': 'Adam'}.
2026-06-15 16:16:52,557 - optuna.study.study - INFO - Trial 298 finished with values: [0.07237794289694396, 0.008259093040391186, 0.034982424052639634] and parameters: {'n_layers': 1, 'embedding_dim': 256, 'lr': 0.0056865752581316785, 'lambda_val': 1.0723270203484857e-05, 'batch_size': 3812, 'optimizer': 'RMSprop'}.
2026-06-15 16:18:06,347 - experiment_functions - INFO - Early stopping at epoch 1500. Best Metrics: (0.09741635744005386, 0.011807555763949361, 0.05224125262927532)
2026-06-15 16:18:06,741 - optuna.study.study - INFO - Trial 299 finished with values: [0.09741635744005386, 0.011807555763949361, 0.05224125262927532] and parameters: {'n_layers': 1, 'embedding_dim': 256, 'lr': 0.0018921194607502668, 'lambda_val': 0.00013972282445432241, 'batch_size': 2285, 'optimizer': 'Adam'}.
2026-06-15 16:18:06,757 - root - INFO - Selected Trial 297 based on Max ndcg: 0.0591
2026-06-15 16:18:06,757 - root - INFO - Associated Recall: 0.1084
2026-06-15 16:18:06,757 - experiment_functions - INFO - Training the best model ... for e_gowalla_1c3dcs_rand4
2026-06-15 16:21:18,973 - root - INFO -   **** Training e_gowalla_1c3dcs_rand5
2026-06-15 16:21:19,122 - root - INFO -   **** Getting 558671/845292 random edges
2026-06-15 16:21:19,412 - optuna.storages._rdb.storage - INFO - A new study created in RDB with name: Study_e_gowalla_1c3dcs_rand5
2026-06-15 16:24:20,855 - optuna.study.study - INFO - Trial 0 finished with values: [0.05920503047406791, 0.007488780226404985, 0.029989137343819087] and parameters: {'n_layers': 3, 'embedding_dim': 96, 'lr': 0.0002845041667420409, 'lambda_val': 0.0005662460656125812, 'batch_size': 2933, 'optimizer': 'Adam'}.
2026-06-15 16:24:43,590 - experiment_functions - INFO - Early stopping at epoch 550. Best Metrics: (0.03292068565607613, 0.004189831870855382, 0.015547801611660679)
2026-06-15 16:24:43,668 - optuna.study.study - INFO - Trial 1 finished with values: [0.03292068565607613, 0.004189831870855382, 0.015547801611660679] and parameters: {'n_layers': 1, 'embedding_dim': 32, 'lr': 0.02606777968777775, 'lambda_val': 0.005463270877339436, 'batch_size': 2974, 'optimizer': 'Adam'}.
2026-06-15 16:25:35,713 - experiment_functions - INFO - Early stopping at epoch 1000. Best Metrics: (0.00042612204358344124, 6.865831602920491e-05, 0.00017994983141216228)
2026-06-15 16:25:35,831 - optuna.study.study - INFO - Trial 2 finished with values: [0.00042612204358344124, 6.865831602920491e-05, 0.00017994983141216228] and parameters: {'n_layers': 2, 'embedding_dim': 256, 'lr': 4.323067723753026e-05, 'lambda_val': 5.2413219840548504e-05, 'batch_size': 3370, 'optimizer': 'RMSprop'}.
2026-06-15 16:26:39,108 - experiment_functions - INFO - Early stopping at epoch 1600. Best Metrics: (0.039324108422203914, 0.004802732935896577, 0.01852961046567976)
2026-06-15 16:26:39,834 - optuna.study.study - INFO - Trial 3 finished with values: [0.039324108422203914, 0.004802732935896577, 0.01852961046567976] and parameters: {'n_layers': 2, 'embedding_dim': 32, 'lr': 0.0036742654809996723, 'lambda_val': 6.35275341540772e-06, 'batch_size': 1420, 'optimizer': 'RMSprop'}.
2026-06-15 16:27:04,535 - experiment_functions - INFO - Early stopping at epoch 500. Best Metrics: (0.00040936371558773256, 6.86583160292049e-05, 0.00019593736342943317)
2026-06-15 16:27:05,624 - optuna.study.study - INFO - Trial 4 finished with values: [0.00040936371558773256, 6.86583160292049e-05, 0.00019593736342943317] and parameters: {'n_layers': 4, 'embedding_dim': 96, 'lr': 0.011549806301745284, 'lambda_val': 6.844796202420359e-06, 'batch_size': 2538, 'optimizer': 'SGD'}.
2026-06-15 16:27:27,302 - experiment_functions - INFO - Early stopping at epoch 500. Best Metrics: (0.0007287354238378864, 9.377721213745061e-05, 0.00039314624918420374)
2026-06-15 16:27:28,777 - optuna.study.study - INFO - Trial 5 finished with values: [0.0007287354238378864, 9.377721213745061e-05, 0.00039314624918420374] and parameters: {'n_layers': 2, 'embedding_dim': 64, 'lr': 0.012090903971489965, 'lambda_val': 0.0002644890211428865, 'batch_size': 2256, 'optimizer': 'SGD'}.
2026-06-15 16:28:05,616 - experiment_functions - INFO - Early stopping at epoch 500. Best Metrics: (0.0005197426611005019, 7.703128139862015e-05, 0.0002550718418177293)
2026-06-15 16:28:07,104 - optuna.study.study - INFO - Trial 6 finished with values: [0.0005197426611005019, 7.703128139862015e-05, 0.0002550718418177293] and parameters: {'n_layers': 4, 'embedding_dim': 64, 'lr': 1.0248827139917921e-05, 'lambda_val': 0.0441157405906667, 'batch_size': 1293, 'optimizer': 'SGD'}.
2026-06-15 16:30:56,310 - optuna.study.study - INFO - Trial 7 finished with values: [0.040496225553416886, 0.004988612767097596, 0.019174515092164085] and parameters: {'n_layers': 4, 'embedding_dim': 32, 'lr': 0.0011947708152090597, 'lambda_val': 2.0623181656245837e-06, 'batch_size': 1425, 'optimizer': 'RMSprop'}.
2026-06-15 16:34:15,721 - optuna.study.study - INFO - Trial 8 finished with values: [0.059068208793860835, 0.007413423538080248, 0.02991682971585333] and parameters: {'n_layers': 3, 'embedding_dim': 128, 'lr': 0.00035731579910584327, 'lambda_val': 0.0021104984649676414, 'batch_size': 1545, 'optimizer': 'Adam'}.
2026-06-15 16:34:46,750 - experiment_functions - INFO - Early stopping at epoch 500. Best Metrics: (0.0004889467798378005, 8.205506062026927e-05, 0.00023426989643745175)
2026-06-15 16:34:48,218 - optuna.study.study - INFO - Trial 9 finished with values: [0.0004889467798378005, 8.205506062026927e-05, 0.00023426989643745175] and parameters: {'n_layers': 2, 'embedding_dim': 256, 'lr': 1.1581241085251126e-05, 'lambda_val': 0.02514504131117439, 'batch_size': 3253, 'optimizer': 'Adam'}.
2026-06-15 16:37:57,096 - optuna.study.study - INFO - Trial 10 finished with values: [0.0579241096560889, 0.006899323464398152, 0.029533700115014046] and parameters: {'n_layers': 3, 'embedding_dim': 128, 'lr': 0.0008105588166462481, 'lambda_val': 4.411051153283134e-06, 'batch_size': 738, 'optimizer': 'RMSprop'}.
2026-06-15 16:38:19,798 - experiment_functions - INFO - Early stopping at epoch 500. Best Metrics: (0.00041432705737797214, 6.86583160292049e-05, 0.0001701733917539809)
2026-06-15 16:38:19,879 - optuna.study.study - INFO - Trial 11 finished with values: [0.00041432705737797214, 6.86583160292049e-05, 0.0001701733917539809] and parameters: {'n_layers': 4, 'embedding_dim': 64, 'lr': 0.09854318952190196, 'lambda_val': 6.94074661230337e-05, 'batch_size': 3846, 'optimizer': 'SGD'}.
2026-06-15 16:38:46,757 - experiment_functions - INFO - Early stopping at epoch 550. Best Metrics: (0.029444860865398353, 0.0036623350525822225, 0.01449975193764061)
2026-06-15 16:38:46,867 - optuna.study.study - INFO - Trial 12 finished with values: [0.029444860865398353, 0.0036623350525822225, 0.01449975193764061] and parameters: {'n_layers': 3, 'embedding_dim': 96, 'lr': 0.022766173337797516, 'lambda_val': 4.074562997129889e-05, 'batch_size': 748, 'optimizer': 'Adam'}.
2026-06-15 16:39:11,121 - experiment_functions - INFO - Early stopping at epoch 550. Best Metrics: (0.0006510657822228341, 0.0001004755844329828, 0.0002848568229497893)
2026-06-15 16:39:12,105 - optuna.study.study - INFO - Trial 13 finished with values: [0.0006510657822228341, 0.0001004755844329828, 0.0002848568229497893] and parameters: {'n_layers': 3, 'embedding_dim': 64, 'lr': 1.0952121952475175e-05, 'lambda_val': 8.19246360027129e-06, 'batch_size': 941, 'optimizer': 'RMSprop'}.
2026-06-15 16:39:50,743 - experiment_functions - INFO - Early stopping at epoch 650. Best Metrics: (0.0005651421569814017, 7.703128139862013e-05, 0.00022677930054900192)
2026-06-15 16:39:52,520 - optuna.study.study - INFO - Trial 14 finished with values: [0.0005651421569814017, 7.703128139862013e-05, 0.00022677930054900192] and parameters: {'n_layers': 4, 'embedding_dim': 128, 'lr': 1.0018834194534063e-05, 'lambda_val': 0.005862469300114216, 'batch_size': 2492, 'optimizer': 'Adam'}.
2026-06-15 16:40:40,167 - experiment_functions - INFO - Early stopping at epoch 950. Best Metrics: (0.000448367992915664, 8.038046754638624e-05, 0.0002545399263797744)
2026-06-15 16:40:40,257 - optuna.study.study - INFO - Trial 15 finished with values: [0.000448367992915664, 8.038046754638624e-05, 0.0002545399263797744] and parameters: {'n_layers': 1, 'embedding_dim': 128, 'lr': 4.162429808318238e-05, 'lambda_val': 0.0007581520712207142, 'batch_size': 2742, 'optimizer': 'RMSprop'}.
2026-06-15 16:43:16,919 - optuna.study.study - INFO - Trial 16 finished with values: [0.004644956572049953, 0.000753566883247371, 0.002315835717371206] and parameters: {'n_layers': 4, 'embedding_dim': 32, 'lr': 0.00011112188727359117, 'lambda_val': 0.00015702633838611315, 'batch_size': 2189, 'optimizer': 'Adam'}.
2026-06-15 16:43:57,275 - experiment_functions - INFO - Early stopping at epoch 850. Best Metrics: (0.0005824772662409406, 9.377721213745061e-05, 0.00028058950195706167)
2026-06-15 16:43:58,896 - optuna.study.study - INFO - Trial 17 finished with values: [0.0005824772662409406, 9.377721213745061e-05, 0.00028058950195706167] and parameters: {'n_layers': 3, 'embedding_dim': 128, 'lr': 1.0276621280855708e-05, 'lambda_val': 0.0008165334635403181, 'batch_size': 603, 'optimizer': 'RMSprop'}.
2026-06-15 16:46:52,423 - optuna.study.study - INFO - Trial 18 finished with values: [0.00887997915829179, 0.0015021099872730927, 0.005002370523690921] and parameters: {'n_layers': 2, 'embedding_dim': 128, 'lr': 0.00015059353672279818, 'lambda_val': 0.0010287203428144807, 'batch_size': 3396, 'optimizer': 'RMSprop'}.
2026-06-15 16:47:18,974 - experiment_functions - INFO - Early stopping at epoch 500. Best Metrics: (0.0006353834934077599, 7.368209525085404e-05, 0.0002688769974690984)
2026-06-15 16:47:19,456 - optuna.study.study - INFO - Trial 19 finished with values: [0.0006353834934077599, 7.368209525085404e-05, 0.0002688769974690984] and parameters: {'n_layers': 2, 'embedding_dim': 256, 'lr': 0.00024480291507322885, 'lambda_val': 7.684415867063543e-06, 'batch_size': 2731, 'optimizer': 'SGD'}.
2026-06-15 16:47:45,392 - experiment_functions - INFO - Early stopping at epoch 500. Best Metrics: (0.00044350752574062204, 7.368209525085404e-05, 0.00020873557996048544)
2026-06-15 16:47:45,714 - optuna.study.study - INFO - Trial 20 finished with values: [0.00044350752574062204, 7.368209525085404e-05, 0.00020873557996048544] and parameters: {'n_layers': 4, 'embedding_dim': 128, 'lr': 9.773549337100438e-05, 'lambda_val': 0.0017804805525555136, 'batch_size': 2406, 'optimizer': 'SGD'}.
2026-06-15 16:48:43,839 - experiment_functions - INFO - Early stopping at epoch 1300. Best Metrics: (0.04273910718657882, 0.005218032018219573, 0.020331791556417945)
2026-06-15 16:48:43,914 - optuna.study.study - INFO - Trial 21 finished with values: [0.04273910718657882, 0.005218032018219573, 0.020331791556417945] and parameters: {'n_layers': 4, 'embedding_dim': 64, 'lr': 0.0010587621938481125, 'lambda_val': 6.852585789077327e-05, 'batch_size': 4004, 'optimizer': 'Adam'}.
2026-06-15 16:51:32,961 - optuna.study.study - INFO - Trial 22 finished with values: [0.001519272810676671, 0.0002629111125996383, 0.0007339822141131581] and parameters: {'n_layers': 2, 'embedding_dim': 128, 'lr': 0.00019625689167583035, 'lambda_val': 1.8675403692794926e-06, 'batch_size': 1003, 'optimizer': 'Adam'}.
2026-06-15 16:51:53,069 - experiment_functions - INFO - Early stopping at epoch 500. Best Metrics: (0.00034736942741771156, 6.363453680755577e-05, 0.00014531054873877206)
2026-06-15 16:51:53,610 - optuna.study.study - INFO - Trial 23 finished with values: [0.00034736942741771156, 6.363453680755577e-05, 0.00014531054873877206] and parameters: {'n_layers': 1, 'embedding_dim': 32, 'lr': 0.0003326077318294145, 'lambda_val': 2.2544481120839566e-06, 'batch_size': 4085, 'optimizer': 'SGD'}.
2026-06-15 16:52:16,464 - experiment_functions - INFO - Early stopping at epoch 550. Best Metrics: (0.0052762566684859576, 0.0006698372295532187, 0.002562857573412489)
2026-06-15 16:52:16,551 - optuna.study.study - INFO - Trial 24 finished with values: [0.0052762566684859576, 0.0006698372295532187, 0.002562857573412489] and parameters: {'n_layers': 3, 'embedding_dim': 32, 'lr': 0.0024881813926483014, 'lambda_val': 0.07774271070529826, 'batch_size': 1638, 'optimizer': 'RMSprop'}.
2026-06-15 16:55:55,897 - optuna.study.study - INFO - Trial 25 finished with values: [0.0009945092864264249, 0.00016411012124053855, 0.00044324618889090325] and parameters: {'n_layers': 3, 'embedding_dim': 256, 'lr': 7.445043075169628e-05, 'lambda_val': 0.0015013565626010121, 'batch_size': 1875, 'optimizer': 'RMSprop'}.
2026-06-15 16:56:54,993 - experiment_functions - INFO - Early stopping at epoch 1300. Best Metrics: (0.06211405828605573, 0.00788733337798915, 0.031057588661286602)
2026-06-15 16:56:55,084 - optuna.study.study - INFO - Trial 26 finished with values: [0.06211405828605573, 0.00788733337798915, 0.031057588661286602] and parameters: {'n_layers': 2, 'embedding_dim': 128, 'lr': 0.0008007729293904306, 'lambda_val': 0.004749408595262452, 'batch_size': 2005, 'optimizer': 'Adam'}.
2026-06-15 16:57:17,420 - experiment_functions - INFO - Early stopping at epoch 500. Best Metrics: (0.00024789786175327986, 4.353941992095921e-05, 0.00013858196576369306)
2026-06-15 16:57:17,497 - optuna.study.study - INFO - Trial 27 finished with values: [0.00024789786175327986, 4.353941992095921e-05, 0.00013858196576369306] and parameters: {'n_layers': 2, 'embedding_dim': 96, 'lr': 0.004326807117751771, 'lambda_val': 7.376895742728984e-06, 'batch_size': 1732, 'optimizer': 'SGD'}.
2026-06-15 16:57:42,201 - experiment_functions - INFO - Early stopping at epoch 500. Best Metrics: (0.0003885855860841895, 6.865831602920491e-05, 0.0002207894974498769)
2026-06-15 16:57:42,282 - optuna.study.study - INFO - Trial 28 finished with values: [0.0003885855860841895, 6.865831602920491e-05, 0.0002207894974498769] and parameters: {'n_layers': 4, 'embedding_dim': 96, 'lr': 1.862961462155509e-05, 'lambda_val': 0.015908639564496514, 'batch_size': 2782, 'optimizer': 'RMSprop'}.
2026-06-15 16:58:03,712 - experiment_functions - INFO - Early stopping at epoch 500. Best Metrics: (0.000552663080983405, 7.535668832473711e-05, 0.00024064829526625954)
2026-06-15 16:58:03,806 - optuna.study.study - INFO - Trial 29 finished with values: [0.000552663080983405, 7.535668832473711e-05, 0.00024064829526625954] and parameters: {'n_layers': 4, 'embedding_dim': 32, 'lr': 0.041463776071073204, 'lambda_val': 0.005727834392664706, 'batch_size': 1716, 'optimizer': 'SGD'}.
2026-06-15 16:58:28,797 - experiment_functions - INFO - Early stopping at epoch 550. Best Metrics: (0.022760545205572413, 0.0027630785719070265, 0.011517411664432878)
2026-06-15 16:58:28,888 - optuna.study.study - INFO - Trial 30 finished with values: [0.022760545205572413, 0.0027630785719070265, 0.011517411664432878] and parameters: {'n_layers': 2, 'embedding_dim': 96, 'lr': 0.03825461568875802, 'lambda_val': 7.673494845521761e-06, 'batch_size': 3339, 'optimizer': 'RMSprop'}.
2026-06-15 16:58:50,947 - experiment_functions - INFO - Early stopping at epoch 500. Best Metrics: (0.0005341784621205361, 8.205506062026927e-05, 0.0002808545688146261)
