2026-06-14 04:40:12,427 - optuna.study.study - INFO - Trial 34 finished with values: [0.000494778089874044, 6.698372295532186e-05, 0.0002091527696444493] and parameters: {'n_layers': 3, 'embedding_dim': 96, 'lr': 0.000126894374863317, 'lambda_val': 0.00039522591450468777, 'batch_size': 3947, 'optimizer': 'SGD'}.
2026-06-14 04:42:37,988 - experiment_functions - INFO - Early stopping at epoch 2850. Best Metrics: (0.01394983161547373, 0.0019559247102953984, 0.006370430438655606)
2026-06-14 04:42:38,078 - optuna.study.study - INFO - Trial 35 finished with values: [0.01394983161547373, 0.0019559247102953984, 0.006370430438655606] and parameters: {'n_layers': 4, 'embedding_dim': 128, 'lr': 0.00507161575917476, 'lambda_val': 0.01435466976921057, 'batch_size': 1400, 'optimizer': 'Adam'}.
2026-06-14 04:42:58,607 - experiment_functions - INFO - Early stopping at epoch 500. Best Metrics: (0.00044352615811206524, 7.703128139862013e-05, 0.00020478302939597157)
2026-06-14 04:42:58,706 - optuna.study.study - INFO - Trial 36 finished with values: [0.00044352615811206524, 7.703128139862013e-05, 0.00020478302939597157] and parameters: {'n_layers': 1, 'embedding_dim': 32, 'lr': 0.00012179803275727338, 'lambda_val': 0.00016390169929985193, 'batch_size': 2643, 'optimizer': 'SGD'}.
2026-06-14 04:43:23,982 - experiment_functions - INFO - Early stopping at epoch 500. Best Metrics: (0.0005256425081005475, 8.205506062026927e-05, 0.00026315357532206616)
2026-06-14 04:43:24,080 - optuna.study.study - INFO - Trial 37 finished with values: [0.0005256425081005475, 8.205506062026927e-05, 0.00026315357532206616] and parameters: {'n_layers': 3, 'embedding_dim': 128, 'lr': 0.002859080241936583, 'lambda_val': 0.014808028051095296, 'batch_size': 2120, 'optimizer': 'SGD'}.
2026-06-14 04:46:01,522 - optuna.study.study - INFO - Trial 38 finished with values: [0.01698589043860923, 0.00231428762810637, 0.007683545425876926] and parameters: {'n_layers': 3, 'embedding_dim': 32, 'lr': 0.04903635821443362, 'lambda_val': 0.023998588162465376, 'batch_size': 2089, 'optimizer': 'RMSprop'}.
2026-06-14 04:46:35,742 - experiment_functions - INFO - Early stopping at epoch 500. Best Metrics: (0.0005713530986594956, 9.377721213745061e-05, 0.00024347172365687296)
2026-06-14 04:46:36,242 - optuna.study.study - INFO - Trial 39 finished with values: [0.0005713530986594956, 9.377721213745061e-05, 0.00024347172365687296] and parameters: {'n_layers': 4, 'embedding_dim': 256, 'lr': 1.70750612769041e-05, 'lambda_val': 0.06061131124836911, 'batch_size': 3708, 'optimizer': 'Adam'}.
2026-06-14 04:47:30,592 - experiment_functions - INFO - Early stopping at epoch 1300. Best Metrics: (0.07693926455722157, 0.009441355750552615, 0.03926833166558826)
2026-06-14 04:47:30,668 - optuna.study.study - INFO - Trial 40 finished with values: [0.07693926455722157, 0.009441355750552615, 0.03926833166558826] and parameters: {'n_layers': 1, 'embedding_dim': 32, 'lr': 0.0020642799008971833, 'lambda_val': 0.0003290497000722153, 'batch_size': 4002, 'optimizer': 'Adam'}.
2026-06-14 04:47:51,469 - experiment_functions - INFO - Early stopping at epoch 500. Best Metrics: (0.00039129422679380144, 7.033290910308797e-05, 0.00022152981430261212)
2026-06-14 04:47:51,536 - optuna.study.study - INFO - Trial 41 finished with values: [0.00039129422679380144, 7.033290910308797e-05, 0.00022152981430261212] and parameters: {'n_layers': 2, 'embedding_dim': 32, 'lr': 1.0781596481098677e-05, 'lambda_val': 7.349656019126073e-05, 'batch_size': 1489, 'optimizer': 'SGD'}.
2026-06-14 04:48:15,754 - experiment_functions - INFO - Early stopping at epoch 500. Best Metrics: (0.000490244090170257, 6.86583160292049e-05, 0.0002529002243364632)
2026-06-14 04:48:16,510 - optuna.study.study - INFO - Trial 42 finished with values: [0.000490244090170257, 6.86583160292049e-05, 0.0002529002243364632] and parameters: {'n_layers': 3, 'embedding_dim': 96, 'lr': 0.006840365079845014, 'lambda_val': 1.2392866891979114e-05, 'batch_size': 2743, 'optimizer': 'SGD'}.
2026-06-14 04:50:37,934 - experiment_functions - INFO - Early stopping at epoch 3100. Best Metrics: (0.02479067565571802, 0.0035551610958537076, 0.011847532196892207)
2026-06-14 04:50:38,714 - optuna.study.study - INFO - Trial 43 finished with values: [0.02479067565571802, 0.0035551610958537076, 0.011847532196892207] and parameters: {'n_layers': 3, 'embedding_dim': 96, 'lr': 0.029452417709917918, 'lambda_val': 0.0015912107748891956, 'batch_size': 2682, 'optimizer': 'RMSprop'}.
2026-06-14 04:51:05,727 - experiment_functions - INFO - Early stopping at epoch 650. Best Metrics: (0.000622312452155257, 0.00010549936365463193, 0.0002986959607787923)
2026-06-14 04:51:06,754 - optuna.study.study - INFO - Trial 44 finished with values: [0.000622312452155257, 0.00010549936365463193, 0.0002986959607787923] and parameters: {'n_layers': 1, 'embedding_dim': 64, 'lr': 3.37315994933247e-05, 'lambda_val': 0.01489984539310318, 'batch_size': 1159, 'optimizer': 'Adam'}.
2026-06-14 04:51:28,127 - experiment_functions - INFO - Early stopping at epoch 500. Best Metrics: (0.00029703420549477853, 5.861075758590662e-05, 0.0001462945411682953)
2026-06-14 04:51:28,196 - optuna.study.study - INFO - Trial 45 finished with values: [0.00029703420549477853, 5.861075758590662e-05, 0.0001462945411682953] and parameters: {'n_layers': 1, 'embedding_dim': 64, 'lr': 1.2415281823212662e-05, 'lambda_val': 6.263733082812518e-06, 'batch_size': 1345, 'optimizer': 'Adam'}.
2026-06-14 04:51:49,429 - experiment_functions - INFO - Early stopping at epoch 500. Best Metrics: (0.00042289010903727263, 6.530912988143881e-05, 0.00019676803542625936)
2026-06-14 04:51:50,335 - optuna.study.study - INFO - Trial 46 finished with values: [0.00042289010903727263, 6.530912988143881e-05, 0.00019676803542625936] and parameters: {'n_layers': 1, 'embedding_dim': 64, 'lr': 0.051090148226171264, 'lambda_val': 0.06388401397986232, 'batch_size': 2256, 'optimizer': 'SGD'}.
2026-06-14 04:53:04,937 - experiment_functions - INFO - Early stopping at epoch 1850. Best Metrics: (0.03476571416945473, 0.004238395069997991, 0.015969494686653124)
2026-06-14 04:53:05,016 - optuna.study.study - INFO - Trial 47 finished with values: [0.03476571416945473, 0.004238395069997991, 0.015969494686653124] and parameters: {'n_layers': 2, 'embedding_dim': 32, 'lr': 0.003057850425871205, 'lambda_val': 0.0005619009286188447, 'batch_size': 2505, 'optimizer': 'RMSprop'}.
2026-06-14 04:56:11,279 - optuna.study.study - INFO - Trial 48 finished with values: [0.0009206302107156756, 0.00014736419050170808, 0.0004546139148286668] and parameters: {'n_layers': 4, 'embedding_dim': 96, 'lr': 5.7312987617118975e-05, 'lambda_val': 0.0006180321668228782, 'batch_size': 1252, 'optimizer': 'Adam'}.
2026-06-14 04:57:25,758 - experiment_functions - INFO - Early stopping at epoch 1850. Best Metrics: (0.0698398189100039, 0.00856889275905955, 0.03392280347843208)
2026-06-14 04:57:25,820 - optuna.study.study - INFO - Trial 49 finished with values: [0.0698398189100039, 0.00856889275905955, 0.03392280347843208] and parameters: {'n_layers': 1, 'embedding_dim': 32, 'lr': 0.002252910187430102, 'lambda_val': 0.0001364070822934131, 'batch_size': 3452, 'optimizer': 'RMSprop'}.
2026-06-14 05:00:04,718 - optuna.study.study - INFO - Trial 50 finished with values: [0.0123123900077938, 0.002058074887802264, 0.007030045380531635] and parameters: {'n_layers': 1, 'embedding_dim': 96, 'lr': 0.0004247472663011328, 'lambda_val': 0.0003290497000722153, 'batch_size': 792, 'optimizer': 'Adam'}.
2026-06-14 05:01:52,293 - experiment_functions - INFO - Early stopping at epoch 2700. Best Metrics: (0.00032510257426823287, 6.195994373367272e-05, 0.00016175327274390927)
2026-06-14 05:01:52,673 - optuna.study.study - INFO - Trial 51 finished with values: [0.00032510257426823287, 6.195994373367272e-05, 0.00016175327274390927] and parameters: {'n_layers': 2, 'embedding_dim': 64, 'lr': 1.2631882430812376e-05, 'lambda_val': 9.92028588022513e-06, 'batch_size': 1930, 'optimizer': 'Adam'}.
2026-06-14 05:04:46,827 - optuna.study.study - INFO - Trial 52 finished with values: [0.0981630725779076, 0.012286489383079913, 0.05358828779223192] and parameters: {'n_layers': 1, 'embedding_dim': 128, 'lr': 0.0009554934943534302, 'lambda_val': 0.00014895795346764513, 'batch_size': 1995, 'optimizer': 'Adam'}.
2026-06-14 05:05:07,443 - experiment_functions - INFO - Early stopping at epoch 500. Best Metrics: (0.0005550734944905756, 7.87058744725032e-05, 0.00025833012242335084)
2026-06-14 05:05:08,999 - optuna.study.study - INFO - Trial 53 finished with values: [0.0005550734944905756, 7.87058744725032e-05, 0.00025833012242335084] and parameters: {'n_layers': 1, 'embedding_dim': 32, 'lr': 0.0004033023394603914, 'lambda_val': 0.00016390169929985193, 'batch_size': 2089, 'optimizer': 'SGD'}.
2026-06-14 05:06:23,786 - experiment_functions - INFO - Early stopping at epoch 1850. Best Metrics: (0.04946294654589031, 0.006159153325741845, 0.025623119181068535)
2026-06-14 05:06:24,191 - optuna.study.study - INFO - Trial 54 finished with values: [0.04946294654589031, 0.006159153325741845, 0.025623119181068535] and parameters: {'n_layers': 2, 'embedding_dim': 32, 'lr': 0.0008197571059817735, 'lambda_val': 0.0012360905541564393, 'batch_size': 2618, 'optimizer': 'Adam'}.
2026-06-14 05:07:19,831 - experiment_functions - INFO - Early stopping at epoch 1350. Best Metrics: (0.0005936401928837467, 7.200750217697099e-05, 0.0002671576289892104)
2026-06-14 05:07:20,202 - optuna.study.study - INFO - Trial 55 finished with values: [0.0005936401928837467, 7.200750217697099e-05, 0.0002671576289892104] and parameters: {'n_layers': 2, 'embedding_dim': 64, 'lr': 3.298311195843919e-05, 'lambda_val': 0.0026562784556607116, 'batch_size': 2326, 'optimizer': 'Adam'}.
2026-06-14 05:10:06,682 - optuna.study.study - INFO - Trial 56 finished with values: [0.0013504507383733581, 0.00018253064505325205, 0.0006227463124948625] and parameters: {'n_layers': 3, 'embedding_dim': 64, 'lr': 5.771126583454873e-05, 'lambda_val': 0.0001928067341566669, 'batch_size': 3324, 'optimizer': 'Adam'}.
2026-06-14 05:10:36,596 - experiment_functions - INFO - Early stopping at epoch 550. Best Metrics: (0.017298264617993404, 0.0020346305847679016, 0.008002065707488437)
2026-06-14 05:10:37,664 - optuna.study.study - INFO - Trial 57 finished with values: [0.017298264617993404, 0.0020346305847679016, 0.008002065707488437] and parameters: {'n_layers': 4, 'embedding_dim': 128, 'lr': 0.00507161575917476, 'lambda_val': 0.0026562784556607116, 'batch_size': 1400, 'optimizer': 'Adam'}.
2026-06-14 05:11:05,802 - experiment_functions - INFO - Early stopping at epoch 550. Best Metrics: (0.06183697851148161, 0.007068457364860339, 0.02997958661814694)
2026-06-14 05:11:05,905 - optuna.study.study - INFO - Trial 58 finished with values: [0.06183697851148161, 0.007068457364860339, 0.02997958661814694] and parameters: {'n_layers': 1, 'embedding_dim': 256, 'lr': 0.013849452305144725, 'lambda_val': 0.0003071461412000055, 'batch_size': 3438, 'optimizer': 'Adam'}.
2026-06-14 05:12:06,774 - experiment_functions - INFO - Early stopping at epoch 1300. Best Metrics: (0.045404495183833486, 0.005686918078906826, 0.02238263699738299)
2026-06-14 05:12:07,212 - optuna.study.study - INFO - Trial 59 finished with values: [0.045404495183833486, 0.005686918078906826, 0.02238263699738299] and parameters: {'n_layers': 3, 'embedding_dim': 96, 'lr': 0.0004553975451984739, 'lambda_val': 0.0015912107748891956, 'batch_size': 2682, 'optimizer': 'RMSprop'}.
2026-06-14 05:15:11,819 - optuna.study.study - INFO - Trial 60 finished with values: [0.07783917360735657, 0.009865027798245028, 0.040825055981968644] and parameters: {'n_layers': 2, 'embedding_dim': 128, 'lr': 0.00034081213821976773, 'lambda_val': 0.00017543678662275883, 'batch_size': 3268, 'optimizer': 'RMSprop'}.
2026-06-14 05:15:45,070 - experiment_functions - INFO - Early stopping at epoch 800. Best Metrics: (0.020243611592872107, 0.0026090160091097863, 0.00944432758931365)
2026-06-14 05:15:45,833 - optuna.study.study - INFO - Trial 61 finished with values: [0.020243611592872107, 0.0026090160091097863, 0.00944432758931365] and parameters: {'n_layers': 3, 'embedding_dim': 32, 'lr': 0.003057850425871205, 'lambda_val': 0.004913946733537837, 'batch_size': 3789, 'optimizer': 'RMSprop'}.
2026-06-14 05:16:25,252 - experiment_functions - INFO - Early stopping at epoch 550. Best Metrics: (0.026802298082093046, 0.0033793288230959877, 0.013189029602409915)
2026-06-14 05:16:25,497 - optuna.study.study - INFO - Trial 62 finished with values: [0.026802298082093046, 0.0033793288230959877, 0.013189029602409915] and parameters: {'n_layers': 3, 'embedding_dim': 256, 'lr': 0.002670622630663831, 'lambda_val': 0.0015912107748891956, 'batch_size': 2682, 'optimizer': 'RMSprop'}.
2026-06-14 05:16:49,381 - experiment_functions - INFO - Early stopping at epoch 550. Best Metrics: (0.0006078488972157591, 9.042802598968451e-05, 0.00026562117598435573)
2026-06-14 05:16:49,530 - optuna.study.study - INFO - Trial 63 finished with values: [0.0006078488972157591, 9.042802598968451e-05, 0.00026562117598435573] and parameters: {'n_layers': 3, 'embedding_dim': 32, 'lr': 2.5032958289816027e-05, 'lambda_val': 0.00039522591450468777, 'batch_size': 3947, 'optimizer': 'RMSprop'}.
2026-06-14 05:17:32,839 - experiment_functions - INFO - Early stopping at epoch 950. Best Metrics: (0.03606000391767445, 0.004454417576528903, 0.01680318209395003)
2026-06-14 05:17:32,908 - optuna.study.study - INFO - Trial 64 finished with values: [0.03606000391767445, 0.004454417576528903, 0.01680318209395003] and parameters: {'n_layers': 4, 'embedding_dim': 64, 'lr': 0.0011116819593430245, 'lambda_val': 8.049701828088752e-06, 'batch_size': 1042, 'optimizer': 'Adam'}.
2026-06-14 05:17:59,906 - experiment_functions - INFO - Early stopping at epoch 500. Best Metrics: (0.0005148971140118186, 7.703128139862013e-05, 0.0002114122389213967)
2026-06-14 05:18:00,174 - optuna.study.study - INFO - Trial 65 finished with values: [0.0005148971140118186, 7.703128139862013e-05, 0.0002114122389213967] and parameters: {'n_layers': 4, 'embedding_dim': 128, 'lr': 4.686279768667576e-05, 'lambda_val': 0.01435466976921057, 'batch_size': 792, 'optimizer': 'RMSprop'}.
2026-06-14 05:19:48,130 - experiment_functions - INFO - Early stopping at epoch 2400. Best Metrics: (0.04573309183405057, 0.005472570165449796, 0.02267457748855608)
2026-06-14 05:19:48,296 - optuna.study.study - INFO - Trial 66 finished with values: [0.04573309183405057, 0.005472570165449796, 0.02267457748855608] and parameters: {'n_layers': 2, 'embedding_dim': 128, 'lr': 0.013849452305144725, 'lambda_val': 9.92028588022513e-06, 'batch_size': 1930, 'optimizer': 'RMSprop'}.
2026-06-14 05:20:31,756 - experiment_functions - INFO - Early stopping at epoch 900. Best Metrics: (0.0006181511440197479, 9.04280259896845e-05, 0.00029665007402256333)
2026-06-14 05:20:32,361 - optuna.study.study - INFO - Trial 67 finished with values: [0.0006181511440197479, 9.04280259896845e-05, 0.00029665007402256333] and parameters: {'n_layers': 4, 'embedding_dim': 96, 'lr': 1.0266968550011489e-05, 'lambda_val': 0.0012222105431406712, 'batch_size': 3649, 'optimizer': 'RMSprop'}.
2026-06-14 05:20:56,173 - experiment_functions - INFO - Early stopping at epoch 550. Best Metrics: (0.007730589204950785, 0.000900931073749079, 0.003799726707939645)
2026-06-14 05:20:56,337 - optuna.study.study - INFO - Trial 68 finished with values: [0.007730589204950785, 0.000900931073749079, 0.003799726707939645] and parameters: {'n_layers': 2, 'embedding_dim': 64, 'lr': 0.051090148226171264, 'lambda_val': 0.06388401397986232, 'batch_size': 2256, 'optimizer': 'Adam'}.
2026-06-14 05:21:50,040 - experiment_functions - INFO - Early stopping at epoch 1250. Best Metrics: (0.0004201726826117056, 6.363453680755577e-05, 0.00016186581622998028)
2026-06-14 05:21:50,356 - optuna.study.study - INFO - Trial 69 finished with values: [0.0004201726826117056, 6.363453680755577e-05, 0.00016186581622998028] and parameters: {'n_layers': 2, 'embedding_dim': 96, 'lr': 1.3178712483400947e-05, 'lambda_val': 5.308270759214878e-05, 'batch_size': 1042, 'optimizer': 'Adam'}.
2026-06-14 05:22:29,141 - experiment_functions - INFO - Early stopping at epoch 950. Best Metrics: (0.07756839092220681, 0.00981646459910242, 0.040597471524050806)
2026-06-14 05:22:29,210 - optuna.study.study - INFO - Trial 70 finished with values: [0.07756839092220681, 0.00981646459910242, 0.040597471524050806] and parameters: {'n_layers': 1, 'embedding_dim': 32, 'lr': 0.002252910187430102, 'lambda_val': 0.0001364070822934131, 'batch_size': 3452, 'optimizer': 'Adam'}.
2026-06-14 05:22:55,944 - experiment_functions - INFO - Early stopping at epoch 550. Best Metrics: (0.018999462652760667, 0.0026324603121441487, 0.009872153618342277)
2026-06-14 05:22:56,651 - optuna.study.study - INFO - Trial 71 finished with values: [0.018999462652760667, 0.0026324603121441487, 0.009872153618342277] and parameters: {'n_layers': 1, 'embedding_dim': 256, 'lr': 0.021508799802187974, 'lambda_val': 1.4178492713838987e-06, 'batch_size': 1912, 'optimizer': 'RMSprop'}.
2026-06-14 05:23:26,449 - experiment_functions - INFO - Early stopping at epoch 500. Best Metrics: (0.0004039666456178913, 7.2007502176971e-05, 0.0002107685222211603)
2026-06-14 05:23:26,566 - optuna.study.study - INFO - Trial 72 finished with values: [0.0004039666456178913, 7.2007502176971e-05, 0.0002107685222211603] and parameters: {'n_layers': 3, 'embedding_dim': 128, 'lr': 0.00507161575917476, 'lambda_val': 0.01435466976921057, 'batch_size': 2804, 'optimizer': 'SGD'}.
2026-06-14 05:23:55,022 - experiment_functions - INFO - Early stopping at epoch 600. Best Metrics: (0.01191458798692075, 0.0014200549266528235, 0.005052814940056874)
2026-06-14 05:23:55,537 - optuna.study.study - INFO - Trial 73 finished with values: [0.01191458798692075, 0.0014200549266528235, 0.005052814940056874] and parameters: {'n_layers': 3, 'embedding_dim': 96, 'lr': 0.037793745537053614, 'lambda_val': 0.014704932353667426, 'batch_size': 3623, 'optimizer': 'Adam'}.
2026-06-14 05:24:38,128 - experiment_functions - INFO - Early stopping at epoch 1100. Best Metrics: (0.0004955756857919148, 8.038046754638624e-05, 0.0002656946171642039)
2026-06-14 05:24:38,243 - optuna.study.study - INFO - Trial 74 finished with values: [0.0004955756857919148, 8.038046754638624e-05, 0.0002656946171642039] and parameters: {'n_layers': 2, 'embedding_dim': 32, 'lr': 1.1876146438334165e-05, 'lambda_val': 0.0005619009286188447, 'batch_size': 2505, 'optimizer': 'RMSprop'}.
2026-06-14 05:26:03,011 - experiment_functions - INFO - Early stopping at epoch 1650. Best Metrics: (0.04326612822634869, 0.005534530109183468, 0.021155431844363734)
2026-06-14 05:26:03,098 - optuna.study.study - INFO - Trial 75 finished with values: [0.04326612822634869, 0.005534530109183468, 0.021155431844363734] and parameters: {'n_layers': 4, 'embedding_dim': 128, 'lr': 0.0009554934943534302, 'lambda_val': 0.00014895795346764513, 'batch_size': 1995, 'optimizer': 'Adam'}.
2026-06-14 05:26:27,865 - experiment_functions - INFO - Early stopping at epoch 550. Best Metrics: (0.02157087416966965, 0.0026307857190702665, 0.009670869922855515)
2026-06-14 05:26:27,954 - optuna.study.study - INFO - Trial 76 finished with values: [0.02157087416966965, 0.0026307857190702665, 0.009670869922855515] and parameters: {'n_layers': 3, 'embedding_dim': 64, 'lr': 0.029452417709917918, 'lambda_val': 0.0015912107748891956, 'batch_size': 2682, 'optimizer': 'Adam'}.
2026-06-14 05:28:18,939 - experiment_functions - INFO - Early stopping at epoch 2700. Best Metrics: (0.07639425762235928, 0.00909136579811106, 0.03807741446809111)
2026-06-14 05:28:19,017 - optuna.study.study - INFO - Trial 77 finished with values: [0.07639425762235928, 0.00909136579811106, 0.03807741446809111] and parameters: {'n_layers': 1, 'embedding_dim': 96, 'lr': 0.0020642799008971833, 'lambda_val': 2.2728319731025804e-05, 'batch_size': 4002, 'optimizer': 'RMSprop'}.
2026-06-14 05:28:53,020 - experiment_functions - INFO - Early stopping at epoch 500. Best Metrics: (0.000611746987433644, 8.707883984191842e-05, 0.00028834987668911245)
2026-06-14 05:28:53,093 - optuna.study.study - INFO - Trial 78 finished with values: [0.000611746987433644, 8.707883984191842e-05, 0.00028834987668911245] and parameters: {'n_layers': 4, 'embedding_dim': 256, 'lr': 1.70750612769041e-05, 'lambda_val': 0.06061131124836911, 'batch_size': 3708, 'optimizer': 'Adam'}.
2026-06-14 05:30:26,285 - experiment_functions - INFO - Early stopping at epoch 2300. Best Metrics: (0.05371013387071882, 0.006301493737021904, 0.025954069896202255)
2026-06-14 05:30:26,908 - optuna.study.study - INFO - Trial 79 finished with values: [0.05371013387071882, 0.006301493737021904, 0.025954069896202255] and parameters: {'n_layers': 1, 'embedding_dim': 64, 'lr': 0.009852934677495576, 'lambda_val': 5.308270759214878e-05, 'batch_size': 1159, 'optimizer': 'Adam'}.
2026-06-14 05:30:59,574 - experiment_functions - INFO - Early stopping at epoch 700. Best Metrics: (0.0005757829339763385, 8.540424676803537e-05, 0.00022679786115094584)
2026-06-14 05:30:59,826 - optuna.study.study - INFO - Trial 80 finished with values: [0.0005757829339763385, 8.540424676803537e-05, 0.00022679786115094584] and parameters: {'n_layers': 3, 'embedding_dim': 96, 'lr': 5.7312987617118975e-05, 'lambda_val': 0.0006180321668228782, 'batch_size': 1252, 'optimizer': 'Adam'}.
2026-06-14 05:33:32,832 - optuna.study.study - INFO - Trial 81 finished with values: [0.03224647406054728, 0.004936700381807221, 0.018359366119084595] and parameters: {'n_layers': 1, 'embedding_dim': 64, 'lr': 0.0004540666822812583, 'lambda_val': 0.006064608501624435, 'batch_size': 1326, 'optimizer': 'Adam'}.
2026-06-14 05:34:04,486 - experiment_functions - INFO - Early stopping at epoch 750. Best Metrics: (0.023536222607786254, 0.0031884252126733203, 0.011319934150481957)
