2026-07-08 04:01:41,954 - optuna.study.study - INFO - Trial 18 finished with values: [0.0007677489164190655, 0.00032577930589062175, 0.0005815385834890168] and parameters: {'n_layers': 4, 'embedding_dim': 96, 'lr': 0.036663509284873615, 'lambda_val': 3.2211675044384433e-06, 'batch_size': 641, 'optimizer': 'Adam'}.
2026-07-08 04:02:27,209 - experiment_functions - INFO - Early stopping at epoch 500. Best Metrics: (0.0001776875352564699, 4.9389282525691926e-05, 0.00010313234196740951)
2026-07-08 04:02:27,301 - optuna.study.study - INFO - Trial 19 finished with values: [0.0001776875352564699, 4.9389282525691926e-05, 0.00010313234196740951] and parameters: {'n_layers': 1, 'embedding_dim': 256, 'lr': 0.0012682409374242438, 'lambda_val': 0.0011960064684069726, 'batch_size': 2551, 'optimizer': 'SGD'}.
2026-07-08 04:03:30,790 - experiment_functions - INFO - Early stopping at epoch 700. Best Metrics: (0.002550388623667659, 0.0009697395665140665, 0.0018456301545024642)
2026-07-08 04:03:30,908 - optuna.study.study - INFO - Trial 20 finished with values: [0.002550388623667659, 0.0009697395665140665, 0.0018456301545024642] and parameters: {'n_layers': 1, 'embedding_dim': 256, 'lr': 0.0015624843511555678, 'lambda_val': 0.008718367574739911, 'batch_size': 1616, 'optimizer': 'Adam'}.
2026-07-08 04:04:17,808 - experiment_functions - INFO - Early stopping at epoch 550. Best Metrics: (0.0006809694340778719, 0.00021275383241836526, 0.00047182276025330914)
2026-07-08 04:04:17,889 - optuna.study.study - INFO - Trial 21 finished with values: [0.0006809694340778719, 0.00021275383241836526, 0.00047182276025330914] and parameters: {'n_layers': 4, 'embedding_dim': 64, 'lr': 0.005183122195502878, 'lambda_val': 0.00107672908847346, 'batch_size': 892, 'optimizer': 'Adam'}.
2026-07-08 04:04:58,467 - experiment_functions - INFO - Early stopping at epoch 500. Best Metrics: (0.0006963499429647259, 0.00016811351936629754, 0.00042813014895608047)
2026-07-08 04:04:59,059 - optuna.study.study - INFO - Trial 22 finished with values: [0.0006963499429647259, 0.00016811351936629754, 0.00042813014895608047] and parameters: {'n_layers': 2, 'embedding_dim': 32, 'lr': 0.056102627097893265, 'lambda_val': 1.4127535884622939e-06, 'batch_size': 4055, 'optimizer': 'RMSprop'}.
2026-07-08 04:05:58,356 - experiment_functions - INFO - Early stopping at epoch 550. Best Metrics: (0.0007916105527502312, 0.00040651178694223357, 0.0006570258725793642)
2026-07-08 04:05:58,436 - optuna.study.study - INFO - Trial 23 finished with values: [0.0007916105527502312, 0.00040651178694223357, 0.0006570258725793642] and parameters: {'n_layers': 4, 'embedding_dim': 256, 'lr': 0.0458702168238454, 'lambda_val': 2.6914266686102143e-05, 'batch_size': 3218, 'optimizer': 'Adam'}.
2026-07-08 04:06:42,668 - experiment_functions - INFO - Early stopping at epoch 500. Best Metrics: (0.0010057311865821897, 0.0002611933210493323, 0.0006524518054101933)
2026-07-08 04:06:42,749 - optuna.study.study - INFO - Trial 24 finished with values: [0.0010057311865821897, 0.0002611933210493323, 0.0006524518054101933] and parameters: {'n_layers': 2, 'embedding_dim': 128, 'lr': 0.04987726912111417, 'lambda_val': 8.260362465218067e-05, 'batch_size': 3934, 'optimizer': 'RMSprop'}.
2026-07-08 04:07:23,345 - experiment_functions - INFO - Early stopping at epoch 500. Best Metrics: (0.00015306078245565428, 3.894154968371863e-05, 8.67812543025945e-05)
2026-07-08 04:07:24,297 - optuna.study.study - INFO - Trial 25 finished with values: [0.00015306078245565428, 3.894154968371863e-05, 8.67812543025945e-05] and parameters: {'n_layers': 3, 'embedding_dim': 32, 'lr': 3.815126181188016e-05, 'lambda_val': 1.259787555478653e-06, 'batch_size': 3358, 'optimizer': 'SGD'}.
2026-07-08 04:12:58,107 - optuna.study.study - INFO - Trial 26 finished with values: [0.0005284279050126893, 0.0001643143437873981, 0.0003468178238830968] and parameters: {'n_layers': 3, 'embedding_dim': 128, 'lr': 6.121918118836184e-05, 'lambda_val': 0.005679169949528195, 'batch_size': 3638, 'optimizer': 'Adam'}.
2026-07-08 04:13:43,980 - experiment_functions - INFO - Early stopping at epoch 500. Best Metrics: (0.00023813696573541488, 5.1288870315141624e-05, 0.0001312178351740356)
2026-07-08 04:13:44,054 - optuna.study.study - INFO - Trial 27 finished with values: [0.00023813696573541488, 5.1288870315141624e-05, 0.0001312178351740356] and parameters: {'n_layers': 4, 'embedding_dim': 128, 'lr': 0.005164709619332017, 'lambda_val': 0.0016575310493183691, 'batch_size': 2503, 'optimizer': 'SGD'}.
2026-07-08 04:15:17,268 - experiment_functions - INFO - Early stopping at epoch 950. Best Metrics: (0.0017732505003925476, 0.0005907718025188535, 0.0011441631431810286)
2026-07-08 04:15:17,347 - optuna.study.study - INFO - Trial 28 finished with values: [0.0017732505003925476, 0.0005907718025188535, 0.0011441631431810286] and parameters: {'n_layers': 3, 'embedding_dim': 256, 'lr': 0.0002900679124230289, 'lambda_val': 0.003584385278278044, 'batch_size': 1475, 'optimizer': 'RMSprop'}.
2026-07-08 04:16:46,423 - experiment_functions - INFO - Early stopping at epoch 1150. Best Metrics: (0.0008925296568489555, 0.00031913074862754785, 0.0006178231278651392)
2026-07-08 04:16:46,505 - optuna.study.study - INFO - Trial 29 finished with values: [0.0008925296568489555, 0.00031913074862754785, 0.0006178231278651392] and parameters: {'n_layers': 4, 'embedding_dim': 32, 'lr': 0.0003799309972702845, 'lambda_val': 2.662133030039408e-05, 'batch_size': 2229, 'optimizer': 'Adam'}.
2026-07-08 04:17:39,358 - experiment_functions - INFO - Early stopping at epoch 500. Best Metrics: (0.00024494068654238097, 5.7937427578215534e-05, 0.00013390634284881836)
2026-07-08 04:17:39,490 - optuna.study.study - INFO - Trial 30 finished with values: [0.00024494068654238097, 5.7937427578215534e-05, 0.00013390634284881836] and parameters: {'n_layers': 4, 'embedding_dim': 256, 'lr': 0.00015789214662297664, 'lambda_val': 2.4420988063453982e-05, 'batch_size': 591, 'optimizer': 'SGD'}.
2026-07-08 04:18:57,885 - experiment_functions - INFO - Early stopping at epoch 900. Best Metrics: (0.0007909954671576313, 0.00038846570294246156, 0.0006566084657223915)
2026-07-08 04:18:57,965 - optuna.study.study - INFO - Trial 31 finished with values: [0.0007909954671576313, 0.00038846570294246156, 0.0006566084657223915] and parameters: {'n_layers': 3, 'embedding_dim': 128, 'lr': 0.024502316304316978, 'lambda_val': 1.406185594688521e-06, 'batch_size': 3550, 'optimizer': 'Adam'}.
2026-07-08 04:19:38,377 - experiment_functions - INFO - Early stopping at epoch 500. Best Metrics: (0.000805226335259918, 0.00022130197747088884, 0.0005206269736290853)
2026-07-08 04:19:38,447 - optuna.study.study - INFO - Trial 32 finished with values: [0.000805226335259918, 0.00022130197747088884, 0.0005206269736290853] and parameters: {'n_layers': 3, 'embedding_dim': 32, 'lr': 0.07536807567160399, 'lambda_val': 4.0474983815594535e-05, 'batch_size': 2367, 'optimizer': 'RMSprop'}.
2026-07-08 04:24:29,792 - optuna.study.study - INFO - Trial 33 finished with values: [0.001670601241696201, 0.0004976920008358185, 0.001086056218751886] and parameters: {'n_layers': 1, 'embedding_dim': 32, 'lr': 0.00020722097982791597, 'lambda_val': 0.0009342965534059371, 'batch_size': 3416, 'optimizer': 'Adam'}.
2026-07-08 04:25:39,343 - experiment_functions - INFO - Early stopping at epoch 850. Best Metrics: (0.0007532285294815815, 0.0004815455046254962, 0.0007141395680801582)
2026-07-08 04:25:39,423 - optuna.study.study - INFO - Trial 34 finished with values: [0.0007532285294815815, 0.0004815455046254962, 0.0007141395680801582] and parameters: {'n_layers': 1, 'embedding_dim': 128, 'lr': 0.005347815108040949, 'lambda_val': 0.0032390393902218804, 'batch_size': 3448, 'optimizer': 'RMSprop'}.
2026-07-08 04:26:19,561 - experiment_functions - INFO - Early stopping at epoch 500. Best Metrics: (0.0002721944732708571, 6.173660315711492e-05, 0.00015683789940189525)
2026-07-08 04:26:19,755 - optuna.study.study - INFO - Trial 35 finished with values: [0.0002721944732708571, 6.173660315711492e-05, 0.00015683789940189525] and parameters: {'n_layers': 1, 'embedding_dim': 64, 'lr': 0.07600452475748604, 'lambda_val': 4.737952714698493e-06, 'batch_size': 2050, 'optimizer': 'SGD'}.
2026-07-08 04:27:45,781 - experiment_functions - INFO - Early stopping at epoch 1100. Best Metrics: (0.0014033452217937768, 0.0005157380848355907, 0.0009082960127391058)
2026-07-08 04:27:45,874 - optuna.study.study - INFO - Trial 36 finished with values: [0.0014033452217937768, 0.0005157380848355907, 0.0009082960127391058] and parameters: {'n_layers': 2, 'embedding_dim': 64, 'lr': 0.0003487064801909266, 'lambda_val': 0.015942655831918742, 'batch_size': 4095, 'optimizer': 'Adam'}.
2026-07-08 04:32:55,802 - experiment_functions - INFO - Early stopping at epoch 3450. Best Metrics: (0.0027548047191924994, 0.0009991831772505366, 0.001968819353125972)
2026-07-08 04:32:55,893 - optuna.study.study - INFO - Trial 37 finished with values: [0.0027548047191924994, 0.0009991831772505366, 0.001968819353125972] and parameters: {'n_layers': 2, 'embedding_dim': 256, 'lr': 0.000222035220678721, 'lambda_val': 0.00045919787742064835, 'batch_size': 2380, 'optimizer': 'RMSprop'}.
2026-07-08 04:33:40,430 - experiment_functions - INFO - Early stopping at epoch 500. Best Metrics: (0.0001711565489885751, 5.128887031514162e-05, 0.00010541028333058959)
2026-07-08 04:33:40,520 - optuna.study.study - INFO - Trial 38 finished with values: [0.0001711565489885751, 5.128887031514162e-05, 0.00010541028333058959] and parameters: {'n_layers': 3, 'embedding_dim': 128, 'lr': 0.00333400803888874, 'lambda_val': 0.005991795946077446, 'batch_size': 1507, 'optimizer': 'SGD'}.
2026-07-08 04:34:25,121 - experiment_functions - INFO - Early stopping at epoch 500. Best Metrics: (0.00022279328009037374, 5.31884581045913e-05, 0.00011373909669151821)
2026-07-08 04:34:25,574 - optuna.study.study - INFO - Trial 39 finished with values: [0.00022279328009037374, 5.31884581045913e-05, 0.00011373909669151821] and parameters: {'n_layers': 4, 'embedding_dim': 96, 'lr': 0.0029528925727747685, 'lambda_val': 5.102890658366971e-06, 'batch_size': 3766, 'optimizer': 'SGD'}.
2026-07-08 04:37:39,982 - experiment_functions - INFO - Early stopping at epoch 2550. Best Metrics: (0.0006860371896228806, 0.0004881940618885702, 0.0006592358307721279)
2026-07-08 04:37:40,068 - optuna.study.study - INFO - Trial 40 finished with values: [0.0006860371896228806, 0.0004881940618885702, 0.0006592358307721279] and parameters: {'n_layers': 2, 'embedding_dim': 64, 'lr': 0.02604116087817698, 'lambda_val': 0.001326976050973506, 'batch_size': 2938, 'optimizer': 'RMSprop'}.
2026-07-08 04:38:50,384 - experiment_functions - INFO - Early stopping at epoch 900. Best Metrics: (0.003552465794293718, 0.00125467773493152, 0.0025378518646363866)
2026-07-08 04:38:50,473 - optuna.study.study - INFO - Trial 41 finished with values: [0.003552465794293718, 0.00125467773493152, 0.0025378518646363866] and parameters: {'n_layers': 1, 'embedding_dim': 64, 'lr': 0.002396901451187955, 'lambda_val': 1.8566194585261947e-06, 'batch_size': 1430, 'optimizer': 'Adam'}.
2026-07-08 04:39:45,639 - experiment_functions - INFO - Early stopping at epoch 700. Best Metrics: (0.0021684852946868925, 0.0007227931538856067, 0.0014872335939375367)
2026-07-08 04:39:45,737 - optuna.study.study - INFO - Trial 42 finished with values: [0.0021684852946868925, 0.0007227931538856067, 0.0014872335939375367] and parameters: {'n_layers': 2, 'embedding_dim': 32, 'lr': 0.001309868495798698, 'lambda_val': 9.401895144659415e-05, 'batch_size': 3918, 'optimizer': 'Adam'}.
2026-07-08 04:40:38,772 - experiment_functions - INFO - Early stopping at epoch 500. Best Metrics: (0.00024504192809115876, 6.648557263073913e-05, 0.00012465461171169362)
2026-07-08 04:40:38,866 - optuna.study.study - INFO - Trial 43 finished with values: [0.00024504192809115876, 6.648557263073913e-05, 0.00012465461171169362] and parameters: {'n_layers': 4, 'embedding_dim': 256, 'lr': 0.00032514351632586044, 'lambda_val': 0.017676312107551197, 'batch_size': 2818, 'optimizer': 'SGD'}.
2026-07-08 04:41:42,252 - experiment_functions - INFO - Early stopping at epoch 600. Best Metrics: (0.00021194879416486952, 6.0786809262390075e-05, 0.00012287860173289944)
2026-07-08 04:41:42,338 - optuna.study.study - INFO - Trial 44 finished with values: [0.00021194879416486952, 6.0786809262390075e-05, 0.00012287860173289944] and parameters: {'n_layers': 4, 'embedding_dim': 256, 'lr': 1.819643739370084e-05, 'lambda_val': 7.683439861663996e-05, 'batch_size': 2426, 'optimizer': 'RMSprop'}.
2026-07-08 04:42:22,406 - experiment_functions - INFO - Early stopping at epoch 500. Best Metrics: (0.00020868490546204215, 5.983701536766521e-05, 0.00010979562361442207)
2026-07-08 04:42:22,477 - optuna.study.study - INFO - Trial 45 finished with values: [0.00020868490546204215, 5.983701536766521e-05, 0.00010979562361442207] and parameters: {'n_layers': 2, 'embedding_dim': 32, 'lr': 1.65807463659292e-05, 'lambda_val': 1.4993956067328433e-06, 'batch_size': 1619, 'optimizer': 'SGD'}.
2026-07-08 04:43:15,514 - experiment_functions - INFO - Early stopping at epoch 500. Best Metrics: (0.00019536724999160172, 5.698763368349069e-05, 0.0001217617281742603)
2026-07-08 04:43:15,600 - optuna.study.study - INFO - Trial 46 finished with values: [0.00019536724999160172, 5.698763368349069e-05, 0.0001217617281742603] and parameters: {'n_layers': 4, 'embedding_dim': 256, 'lr': 1.4926395359209656e-05, 'lambda_val': 6.799132178065368e-05, 'batch_size': 2631, 'optimizer': 'SGD'}.
2026-07-08 04:43:56,282 - experiment_functions - INFO - Early stopping at epoch 500. Best Metrics: (0.00026031059635475565, 6.743536652546397e-05, 0.00014534541011683883)
2026-07-08 04:43:56,666 - optuna.study.study - INFO - Trial 47 finished with values: [0.00026031059635475565, 6.743536652546397e-05, 0.00014534541011683883] and parameters: {'n_layers': 1, 'embedding_dim': 64, 'lr': 0.00012077316457524685, 'lambda_val': 0.0005608240770201872, 'batch_size': 2481, 'optimizer': 'SGD'}.
2026-07-08 04:48:47,445 - optuna.study.study - INFO - Trial 48 finished with values: [0.0018529181983922064, 0.0006230647949394982, 0.0012748690326521174] and parameters: {'n_layers': 1, 'embedding_dim': 32, 'lr': 0.00028288762235460313, 'lambda_val': 1.684289604060617e-05, 'batch_size': 1565, 'optimizer': 'Adam'}.
2026-07-08 04:49:41,319 - experiment_functions - INFO - Early stopping at epoch 550. Best Metrics: (0.0006608791623081103, 0.00034287559599566897, 0.0005364106882671009)
2026-07-08 04:49:41,408 - optuna.study.study - INFO - Trial 49 finished with values: [0.0006608791623081103, 0.00034287559599566897, 0.0005364106882671009] and parameters: {'n_layers': 2, 'embedding_dim': 256, 'lr': 0.008566952759050308, 'lambda_val': 0.0018926378100243956, 'batch_size': 2587, 'optimizer': 'Adam'}.
2026-07-08 04:50:31,143 - experiment_functions - INFO - Early stopping at epoch 600. Best Metrics: (0.0003130183086107109, 0.000110176091788082, 0.0001907763718179843)
2026-07-08 04:50:31,234 - optuna.study.study - INFO - Trial 50 finished with values: [0.0003130183086107109, 0.000110176091788082, 0.0001907763718179843] and parameters: {'n_layers': 3, 'embedding_dim': 64, 'lr': 0.0007398611586122253, 'lambda_val': 0.030154094023922395, 'batch_size': 1930, 'optimizer': 'RMSprop'}.
2026-07-08 04:51:52,593 - experiment_functions - INFO - Early stopping at epoch 1000. Best Metrics: (0.0012357613912116164, 0.0004653990084151739, 0.0008118483051365137)
2026-07-08 04:51:52,681 - optuna.study.study - INFO - Trial 51 finished with values: [0.0012357613912116164, 0.0004653990084151739, 0.0008118483051365137] and parameters: {'n_layers': 2, 'embedding_dim': 96, 'lr': 0.0003487064801909266, 'lambda_val': 0.015942655831918742, 'batch_size': 4095, 'optimizer': 'Adam'}.
2026-07-08 04:52:44,777 - experiment_functions - INFO - Early stopping at epoch 650. Best Metrics: (0.002977574110258437, 0.0010979617423019206, 0.002141162709681533)
2026-07-08 04:52:44,866 - optuna.study.study - INFO - Trial 52 finished with values: [0.002977574110258437, 0.0010979617423019206, 0.002141162709681533] and parameters: {'n_layers': 1, 'embedding_dim': 64, 'lr': 0.0031808570812741697, 'lambda_val': 1.783091837418501e-05, 'batch_size': 3820, 'optimizer': 'Adam'}.
2026-07-08 04:54:21,127 - experiment_functions - INFO - Early stopping at epoch 1200. Best Metrics: (0.00155633720244921, 0.0007332408867275802, 0.0012000343725708411)
2026-07-08 04:54:21,201 - optuna.study.study - INFO - Trial 53 finished with values: [0.00155633720244921, 0.0007332408867275802, 0.0012000343725708411] and parameters: {'n_layers': 1, 'embedding_dim': 128, 'lr': 0.0031808570812741697, 'lambda_val': 0.0003916704930847683, 'batch_size': 2296, 'optimizer': 'RMSprop'}.
2026-07-08 04:56:17,774 - experiment_functions - INFO - Early stopping at epoch 1550. Best Metrics: (0.0029628521649022574, 0.0009573922458826434, 0.0019293035509766723)
2026-07-08 04:56:17,887 - optuna.study.study - INFO - Trial 54 finished with values: [0.0029628521649022574, 0.0009573922458826434, 0.0019293035509766723] and parameters: {'n_layers': 1, 'embedding_dim': 32, 'lr': 0.000565645409068954, 'lambda_val': 0.00107672908847346, 'batch_size': 3416, 'optimizer': 'Adam'}.
2026-07-08 04:58:24,898 - experiment_functions - INFO - Early stopping at epoch 1700. Best Metrics: (0.0016003400392851585, 0.0005280854054670137, 0.0010094232025018213)
2026-07-08 04:58:24,969 - optuna.study.study - INFO - Trial 55 finished with values: [0.0016003400392851585, 0.0005280854054670137, 0.0010094232025018213] and parameters: {'n_layers': 2, 'embedding_dim': 32, 'lr': 0.0003487064801909266, 'lambda_val': 0.00045919787742064835, 'batch_size': 4095, 'optimizer': 'Adam'}.
2026-07-08 04:59:08,126 - experiment_functions - INFO - Early stopping at epoch 550. Best Metrics: (0.0019537735489750787, 0.0006591569629390425, 0.0012623633184242194)
2026-07-08 04:59:08,220 - optuna.study.study - INFO - Trial 56 finished with values: [0.0019537735489750787, 0.0006591569629390425, 0.0012623633184242194] and parameters: {'n_layers': 1, 'embedding_dim': 32, 'lr': 0.02592538525808625, 'lambda_val': 1.3679427856170778e-05, 'batch_size': 1585, 'optimizer': 'Adam'}.
2026-07-08 05:00:00,906 - experiment_functions - INFO - Early stopping at epoch 500. Best Metrics: (0.0002813525024272663, 7.123454210436335e-05, 0.0001779660459291417)
2026-07-08 05:00:01,002 - optuna.study.study - INFO - Trial 57 finished with values: [0.0002813525024272663, 7.123454210436335e-05, 0.0001779660459291417] and parameters: {'n_layers': 4, 'embedding_dim': 256, 'lr': 0.0006747030870563427, 'lambda_val': 0.003584385278278044, 'batch_size': 2796, 'optimizer': 'SGD'}.
2026-07-08 05:05:17,802 - experiment_functions - INFO - Early stopping at epoch 3350. Best Metrics: (0.002209640037982699, 0.0008035256349372187, 0.001572683419746881)
2026-07-08 05:05:17,888 - optuna.study.study - INFO - Trial 58 finished with values: [0.002209640037982699, 0.0008035256349372187, 0.001572683419746881] and parameters: {'n_layers': 3, 'embedding_dim': 256, 'lr': 0.000222035220678721, 'lambda_val': 5.9395571423324406e-05, 'batch_size': 2380, 'optimizer': 'RMSprop'}.
2026-07-08 05:07:44,544 - experiment_functions - INFO - Early stopping at epoch 2000. Best Metrics: (0.00021869948217004642, 6.268639705183975e-05, 0.00014016246675217098)
2026-07-08 05:07:44,627 - optuna.study.study - INFO - Trial 59 finished with values: [0.00021869948217004642, 6.268639705183975e-05, 0.00014016246675217098] and parameters: {'n_layers': 1, 'embedding_dim': 32, 'lr': 4.9624019676997205e-05, 'lambda_val': 0.0009342965534059371, 'batch_size': 3416, 'optimizer': 'Adam'}.
2026-07-08 05:08:43,536 - experiment_functions - INFO - Early stopping at epoch 750. Best Metrics: (0.001027958394705306, 0.0003514237410481926, 0.0006491325513174394)
2026-07-08 05:08:43,639 - optuna.study.study - INFO - Trial 60 finished with values: [0.001027958394705306, 0.0003514237410481926, 0.0006491325513174394] and parameters: {'n_layers': 4, 'embedding_dim': 32, 'lr': 0.0011108364748811956, 'lambda_val': 1.684289604060617e-05, 'batch_size': 3456, 'optimizer': 'RMSprop'}.
2026-07-08 05:09:30,192 - experiment_functions - INFO - Early stopping at epoch 550. Best Metrics: (0.0006178229640168923, 0.0003523735349429174, 0.0005288757169404464)
2026-07-08 05:09:30,289 - optuna.study.study - INFO - Trial 61 finished with values: [0.0006178229640168923, 0.0003523735349429174, 0.0005288757169404464] and parameters: {'n_layers': 1, 'embedding_dim': 128, 'lr': 0.010452918288279748, 'lambda_val': 0.025405452939105753, 'batch_size': 2481, 'optimizer': 'Adam'}.
2026-07-08 05:10:15,778 - experiment_functions - INFO - Early stopping at epoch 550. Best Metrics: (0.0012167510807993595, 0.0005679767490454572, 0.0009128566927868393)
2026-07-08 05:10:15,845 - optuna.study.study - INFO - Trial 62 finished with values: [0.0012167510807993595, 0.0005679767490454572, 0.0009128566927868393] and parameters: {'n_layers': 1, 'embedding_dim': 96, 'lr': 0.0458702168238454, 'lambda_val': 4.737952714698493e-06, 'batch_size': 3218, 'optimizer': 'Adam'}.
2026-07-08 05:11:32,070 - experiment_functions - INFO - Early stopping at epoch 1000. Best Metrics: (0.000214559223481889, 5.0339076420416775e-05, 0.00011985388114349726)
2026-07-08 05:11:32,144 - optuna.study.study - INFO - Trial 63 finished with values: [0.000214559223481889, 5.0339076420416775e-05, 0.00011985388114349726] and parameters: {'n_layers': 1, 'embedding_dim': 64, 'lr': 0.008715727859634363, 'lambda_val': 7.294825670791652e-06, 'batch_size': 1132, 'optimizer': 'SGD'}.
2026-07-08 05:12:35,208 - experiment_functions - INFO - Early stopping at epoch 800. Best Metrics: (0.0036453654003317055, 0.0012470793837737212, 0.0025631427583077135)
