2026-07-08 18:13:38,804 - optuna.study.study - INFO - Trial 139 finished with values: [0.004069505744467842, 0.0010438234903026044, 0.002548279021165361] and parameters: {'n_layers': 2, 'embedding_dim': 32, 'lr': 0.0024216232986666152, 'lambda_val': 6.892455337046496e-05, 'batch_size': 2162, 'optimizer': 'Adam'}.
2026-07-08 18:18:50,533 - optuna.study.study - INFO - Trial 140 finished with values: [0.0005471912863121325, 0.00014436867199817642, 0.00037503265953562373] and parameters: {'n_layers': 3, 'embedding_dim': 64, 'lr': 0.00015253758920747145, 'lambda_val': 8.982642030344512e-06, 'batch_size': 3801, 'optimizer': 'Adam'}.
2026-07-08 18:20:13,321 - experiment_functions - INFO - Early stopping at epoch 850. Best Metrics: (0.0035958541180571573, 0.0009649905970404424, 0.0022957477461831395)
2026-07-08 18:20:13,410 - optuna.study.study - INFO - Trial 141 finished with values: [0.0035958541180571573, 0.0009649905970404424, 0.0022957477461831395] and parameters: {'n_layers': 2, 'embedding_dim': 256, 'lr': 0.006382168654473921, 'lambda_val': 6.892455337046496e-05, 'batch_size': 1391, 'optimizer': 'Adam'}.
2026-07-08 18:22:51,804 - experiment_functions - INFO - Early stopping at epoch 1800. Best Metrics: (0.0028647247845050836, 0.0007826301692532721, 0.0018076737048793828)
2026-07-08 18:22:51,894 - optuna.study.study - INFO - Trial 142 finished with values: [0.0028647247845050836, 0.0007826301692532721, 0.0018076737048793828] and parameters: {'n_layers': 1, 'embedding_dim': 256, 'lr': 0.00872192112731876, 'lambda_val': 0.0008206810021385492, 'batch_size': 2191, 'optimizer': 'Adam'}.
2026-07-08 18:23:50,912 - experiment_functions - INFO - Early stopping at epoch 550. Best Metrics: (0.0034671021206193423, 0.0009393461618828714, 0.0021520377353398245)
2026-07-08 18:23:50,999 - optuna.study.study - INFO - Trial 143 finished with values: [0.0034671021206193423, 0.0009393461618828714, 0.0021520377353398245] and parameters: {'n_layers': 3, 'embedding_dim': 256, 'lr': 0.019047571127829455, 'lambda_val': 2.620125710300901e-06, 'batch_size': 2341, 'optimizer': 'Adam'}.
2026-07-08 18:27:59,932 - experiment_functions - INFO - Early stopping at epoch 2650. Best Metrics: (0.004528167154359273, 0.001210987215774177, 0.0029280222097955236)
2026-07-08 18:28:00,021 - optuna.study.study - INFO - Trial 144 finished with values: [0.004528167154359273, 0.001210987215774177, 0.0029280222097955236] and parameters: {'n_layers': 2, 'embedding_dim': 256, 'lr': 0.0020140299216981693, 'lambda_val': 5.222245565310666e-05, 'batch_size': 1709, 'optimizer': 'Adam'}.
2026-07-08 18:28:41,771 - experiment_functions - INFO - Early stopping at epoch 500. Best Metrics: (0.00023932315532330665, 5.6987633683490685e-05, 0.00014851590855410066)
2026-07-08 18:28:41,871 - optuna.study.study - INFO - Trial 145 finished with values: [0.00023932315532330665, 5.6987633683490685e-05, 0.00014851590855410066] and parameters: {'n_layers': 2, 'embedding_dim': 64, 'lr': 0.0020140299216981693, 'lambda_val': 0.07709765649919904, 'batch_size': 1520, 'optimizer': 'SGD'}.
2026-07-08 18:29:57,223 - experiment_functions - INFO - Early stopping at epoch 850. Best Metrics: (0.00540523480409906, 0.001579507246927417, 0.003478894569356209)
2026-07-08 18:29:57,328 - optuna.study.study - INFO - Trial 146 finished with values: [0.00540523480409906, 0.001579507246927417, 0.003478894569356209] and parameters: {'n_layers': 4, 'embedding_dim': 96, 'lr': 0.0026199811222762572, 'lambda_val': 6.5939387363411675e-06, 'batch_size': 2727, 'optimizer': 'RMSprop'}.
2026-07-08 18:32:54,780 - experiment_functions - INFO - Early stopping at epoch 2350. Best Metrics: (0.0018806066710811836, 0.000581273863571605, 0.0013346527326089164)
2026-07-08 18:32:54,872 - optuna.study.study - INFO - Trial 147 finished with values: [0.0018806066710811836, 0.000581273863571605, 0.0013346527326089164] and parameters: {'n_layers': 3, 'embedding_dim': 32, 'lr': 0.0013152005063538942, 'lambda_val': 0.05897770276939827, 'batch_size': 2986, 'optimizer': 'Adam'}.
2026-07-08 18:38:22,365 - optuna.study.study - INFO - Trial 148 finished with values: [0.004817839450642189, 0.0011938909256691299, 0.003102028462760665] and parameters: {'n_layers': 3, 'embedding_dim': 96, 'lr': 0.0005079724528508135, 'lambda_val': 6.625860010406062e-06, 'batch_size': 2341, 'optimizer': 'Adam'}.
2026-07-08 18:39:57,158 - experiment_functions - INFO - Early stopping at epoch 850. Best Metrics: (0.00503953404024438, 0.0014037953764033206, 0.00326873097112214)
2026-07-08 18:39:57,251 - optuna.study.study - INFO - Trial 149 finished with values: [0.00503953404024438, 0.0014037953764033206, 0.00326873097112214] and parameters: {'n_layers': 4, 'embedding_dim': 256, 'lr': 0.002634796822286242, 'lambda_val': 6.892455337046496e-05, 'batch_size': 2341, 'optimizer': 'Adam'}.
2026-07-08 18:41:13,025 - experiment_functions - INFO - Early stopping at epoch 950. Best Metrics: (0.005686188819332081, 0.0016440932317687063, 0.0036947240751217885)
2026-07-08 18:41:13,116 - optuna.study.study - INFO - Trial 150 finished with values: [0.005686188819332081, 0.0016440932317687063, 0.0036947240751217885] and parameters: {'n_layers': 4, 'embedding_dim': 32, 'lr': 0.0026199811222762572, 'lambda_val': 4.325919770856533e-05, 'batch_size': 2727, 'optimizer': 'RMSprop'}.
2026-07-08 18:44:15,985 - experiment_functions - INFO - Early stopping at epoch 2250. Best Metrics: (0.006978937729703065, 0.001967023155975153, 0.004729207108286429)
2026-07-08 18:44:16,079 - optuna.study.study - INFO - Trial 151 finished with values: [0.006978937729703065, 0.001967023155975153, 0.004729207108286429] and parameters: {'n_layers': 4, 'embedding_dim': 64, 'lr': 0.0013152005063538942, 'lambda_val': 1.0684413344508431e-05, 'batch_size': 2258, 'optimizer': 'RMSprop'}.
2026-07-08 18:47:08,390 - experiment_functions - INFO - Early stopping at epoch 2250. Best Metrics: (0.005828004155686749, 0.001705829834925821, 0.0037722905447259074)
2026-07-08 18:47:08,479 - optuna.study.study - INFO - Trial 152 finished with values: [0.005828004155686749, 0.001705829834925821, 0.0037722905447259074] and parameters: {'n_layers': 4, 'embedding_dim': 32, 'lr': 0.0028299651229841192, 'lambda_val': 4.325919770856533e-05, 'batch_size': 654, 'optimizer': 'Adam'}.
2026-07-08 18:50:38,907 - experiment_functions - INFO - Early stopping at epoch 2500. Best Metrics: (0.00033042190192842313, 8.07324810516118e-05, 0.00017028213804022184)
2026-07-08 18:50:39,004 - optuna.study.study - INFO - Trial 153 finished with values: [0.00033042190192842313, 8.07324810516118e-05, 0.00017028213804022184] and parameters: {'n_layers': 4, 'embedding_dim': 96, 'lr': 5.1640753956278134e-05, 'lambda_val': 6.892455337046496e-05, 'batch_size': 2341, 'optimizer': 'Adam'}.
2026-07-08 18:52:21,226 - experiment_functions - INFO - Early stopping at epoch 1250. Best Metrics: (0.004580630503830175, 0.0012546777349315198, 0.0029884896059899843)
2026-07-08 18:52:21,315 - optuna.study.study - INFO - Trial 154 finished with values: [0.004580630503830175, 0.0012546777349315198, 0.0029884896059899843] and parameters: {'n_layers': 2, 'embedding_dim': 96, 'lr': 0.0026199811222762572, 'lambda_val': 5.222245565310666e-05, 'batch_size': 3297, 'optimizer': 'RMSprop'}.
2026-07-08 18:55:21,544 - experiment_functions - INFO - Early stopping at epoch 2300. Best Metrics: (0.0023356251126859994, 0.0007047470698858348, 0.0015317391944252915)
2026-07-08 18:55:21,631 - optuna.study.study - INFO - Trial 155 finished with values: [0.0023356251126859994, 0.0007047470698858348, 0.0015317391944252915] and parameters: {'n_layers': 3, 'embedding_dim': 64, 'lr': 0.001488688533444762, 'lambda_val': 0.039581622356694005, 'batch_size': 1562, 'optimizer': 'Adam'}.
2026-07-08 18:57:24,856 - experiment_functions - INFO - Early stopping at epoch 1600. Best Metrics: (0.004652985624209858, 0.0012651254677734933, 0.0029899021213401237)
2026-07-08 18:57:24,976 - optuna.study.study - INFO - Trial 156 finished with values: [0.004652985624209858, 0.0012651254677734933, 0.0029899021213401237] and parameters: {'n_layers': 2, 'embedding_dim': 64, 'lr': 0.0026199811222762572, 'lambda_val': 4.325919770856533e-05, 'batch_size': 1938, 'optimizer': 'RMSprop'}.
2026-07-08 19:02:43,641 - optuna.study.study - INFO - Trial 157 finished with values: [0.005527216095543886, 0.001516820849875577, 0.003662695155086585] and parameters: {'n_layers': 4, 'embedding_dim': 64, 'lr': 0.0005079724528508135, 'lambda_val': 6.892455337046496e-05, 'batch_size': 3350, 'optimizer': 'Adam'}.
2026-07-08 19:07:46,196 - optuna.study.study - INFO - Trial 158 finished with values: [0.0049359060945478326, 0.0012879205212468897, 0.0032421168457747304] and parameters: {'n_layers': 2, 'embedding_dim': 64, 'lr': 0.0009859128880233146, 'lambda_val': 7.828203946990764e-05, 'batch_size': 891, 'optimizer': 'RMSprop'}.
2026-07-08 19:14:21,730 - optuna.study.study - INFO - Trial 159 finished with values: [0.005502521522821356, 0.00140759455198222, 0.0034128300981790234] and parameters: {'n_layers': 3, 'embedding_dim': 256, 'lr': 0.0003947216765049812, 'lambda_val': 6.625860010406062e-06, 'batch_size': 2350, 'optimizer': 'RMSprop'}.
2026-07-08 19:19:25,079 - optuna.study.study - INFO - Trial 160 finished with values: [0.0019877462899029427, 0.00051953726041449, 0.0014322536584475758] and parameters: {'n_layers': 2, 'embedding_dim': 64, 'lr': 0.0005079724528508135, 'lambda_val': 6.892455337046496e-05, 'batch_size': 1388, 'optimizer': 'RMSprop'}.
2026-07-08 19:24:53,620 - optuna.study.study - INFO - Trial 161 finished with values: [0.005117786921231626, 0.0013192637197728093, 0.0032542185447427107] and parameters: {'n_layers': 3, 'embedding_dim': 96, 'lr': 0.0005079724528508135, 'lambda_val': 8.982642030344512e-06, 'batch_size': 2341, 'optimizer': 'Adam'}.
2026-07-08 19:26:06,738 - experiment_functions - INFO - Early stopping at epoch 650. Best Metrics: (0.005224802529219611, 0.0014370381627186902, 0.0034256782809051014)
2026-07-08 19:26:06,861 - optuna.study.study - INFO - Trial 162 finished with values: [0.005224802529219611, 0.0014370381627186902, 0.0034256782809051014] and parameters: {'n_layers': 4, 'embedding_dim': 256, 'lr': 0.002634796822286242, 'lambda_val': 5.207268504744844e-05, 'batch_size': 3285, 'optimizer': 'RMSprop'}.
2026-07-08 19:30:36,994 - experiment_functions - INFO - Early stopping at epoch 3500. Best Metrics: (0.0056524169700072, 0.0015567121934540206, 0.0037320901984368247)
2026-07-08 19:30:37,075 - optuna.study.study - INFO - Trial 163 finished with values: [0.0056524169700072, 0.0015567121934540206, 0.0037320901984368247] and parameters: {'n_layers': 2, 'embedding_dim': 64, 'lr': 0.0020140299216981693, 'lambda_val': 1.0684413344508431e-05, 'batch_size': 1388, 'optimizer': 'RMSprop'}.
2026-07-08 19:35:50,851 - optuna.study.study - INFO - Trial 164 finished with values: [0.004503661441637741, 0.0011805938111429822, 0.002893789676355707] and parameters: {'n_layers': 3, 'embedding_dim': 64, 'lr': 0.0005079724528508135, 'lambda_val': 6.625860010406062e-06, 'batch_size': 2341, 'optimizer': 'Adam'}.
2026-07-08 19:37:37,227 - experiment_functions - INFO - Early stopping at epoch 1350. Best Metrics: (0.0047720663086630805, 0.0012869707273521645, 0.003120803591532211)
2026-07-08 19:37:37,308 - optuna.study.study - INFO - Trial 165 finished with values: [0.0047720663086630805, 0.0012869707273521645, 0.003120803591532211] and parameters: {'n_layers': 2, 'embedding_dim': 64, 'lr': 0.0016459794241324855, 'lambda_val': 6.625860010406062e-06, 'batch_size': 2965, 'optimizer': 'RMSprop'}.
2026-07-08 19:39:03,461 - experiment_functions - INFO - Early stopping at epoch 1100. Best Metrics: (0.001711683507209146, 0.0005347339627300876, 0.0011494654447408987)
2026-07-08 19:39:03,540 - optuna.study.study - INFO - Trial 166 finished with values: [0.001711683507209146, 0.0005347339627300876, 0.0011494654447408987] and parameters: {'n_layers': 4, 'embedding_dim': 32, 'lr': 0.0026199811222762572, 'lambda_val': 0.030952964373606406, 'batch_size': 1562, 'optimizer': 'Adam'}.
2026-07-08 19:40:16,173 - experiment_functions - INFO - Early stopping at epoch 650. Best Metrics: (0.004015094911993759, 0.001188192162300781, 0.002573501129568043)
2026-07-08 19:40:16,247 - optuna.study.study - INFO - Trial 167 finished with values: [0.004015094911993759, 0.001188192162300781, 0.002573501129568043] and parameters: {'n_layers': 4, 'embedding_dim': 256, 'lr': 0.002634796822286242, 'lambda_val': 0.0016935759490927101, 'batch_size': 2341, 'optimizer': 'RMSprop'}.
2026-07-08 19:46:45,210 - experiment_functions - INFO - Early stopping at epoch 3900. Best Metrics: (0.006612749739742298, 0.001786562315977433, 0.004185162483379321)
2026-07-08 19:46:45,299 - optuna.study.study - INFO - Trial 168 finished with values: [0.006612749739742298, 0.001786562315977433, 0.004185162483379321] and parameters: {'n_layers': 3, 'embedding_dim': 256, 'lr': 0.0005079724528508135, 'lambda_val': 4.325919770856533e-05, 'batch_size': 3285, 'optimizer': 'RMSprop'}.
2026-07-08 19:51:47,982 - optuna.study.study - INFO - Trial 169 finished with values: [0.002804243612141131, 0.0007009478943069354, 0.001876098682677114] and parameters: {'n_layers': 2, 'embedding_dim': 64, 'lr': 0.0005079724528508135, 'lambda_val': 7.840364300890388e-05, 'batch_size': 2258, 'optimizer': 'RMSprop'}.
2026-07-08 19:53:16,893 - experiment_functions - INFO - Early stopping at epoch 800. Best Metrics: (0.005257297089793775, 0.001442736926087039, 0.0032933762638567305)
2026-07-08 19:53:16,978 - optuna.study.study - INFO - Trial 170 finished with values: [0.005257297089793775, 0.001442736926087039, 0.0032933762638567305] and parameters: {'n_layers': 4, 'embedding_dim': 256, 'lr': 0.002634796822286242, 'lambda_val': 0.00010177575634003874, 'batch_size': 1562, 'optimizer': 'Adam'}.
2026-07-08 19:55:14,154 - experiment_functions - INFO - Early stopping at epoch 1500. Best Metrics: (0.0044059058752849226, 0.0011625477271432101, 0.0028281153095170383)
2026-07-08 19:55:14,276 - optuna.study.study - INFO - Trial 171 finished with values: [0.0044059058752849226, 0.0011625477271432101, 0.0028281153095170383] and parameters: {'n_layers': 2, 'embedding_dim': 64, 'lr': 0.0032367595099432405, 'lambda_val': 4.325919770856533e-05, 'batch_size': 1388, 'optimizer': 'Adam'}.
2026-07-08 19:56:34,389 - experiment_functions - INFO - Early stopping at epoch 1050. Best Metrics: (0.004154433236886764, 0.0011160078263016925, 0.0027490775435782)
2026-07-08 19:56:34,466 - optuna.study.study - INFO - Trial 172 finished with values: [0.004154433236886764, 0.0011160078263016925, 0.0027490775435782] and parameters: {'n_layers': 2, 'embedding_dim': 32, 'lr': 0.0026199811222762572, 'lambda_val': 8.982642030344512e-06, 'batch_size': 3801, 'optimizer': 'RMSprop'}.
2026-07-08 20:00:44,127 - experiment_functions - INFO - Early stopping at epoch 3400. Best Metrics: (0.004086929241325371, 0.0010533214292498528, 0.002609491518486279)
2026-07-08 20:00:44,209 - optuna.study.study - INFO - Trial 173 finished with values: [0.004086929241325371, 0.0010533214292498528, 0.002609491518486279] and parameters: {'n_layers': 2, 'embedding_dim': 32, 'lr': 0.0020140299216981693, 'lambda_val': 4.325919770856533e-05, 'batch_size': 891, 'optimizer': 'Adam'}.
2026-07-08 20:01:56,789 - experiment_functions - INFO - Early stopping at epoch 650. Best Metrics: (0.00509106246285691, 0.0014560340406131868, 0.0033075884332824153)
2026-07-08 20:01:56,876 - optuna.study.study - INFO - Trial 174 finished with values: [0.00509106246285691, 0.0014560340406131868, 0.0033075884332824153] and parameters: {'n_layers': 4, 'embedding_dim': 256, 'lr': 0.003328720631447993, 'lambda_val': 6.5939387363411675e-06, 'batch_size': 2258, 'optimizer': 'RMSprop'}.
2026-07-08 20:03:08,093 - experiment_functions - INFO - Early stopping at epoch 800. Best Metrics: (0.006369705045239487, 0.0017599680869251377, 0.00425322532131322)
2026-07-08 20:03:08,177 - optuna.study.study - INFO - Trial 175 finished with values: [0.006369705045239487, 0.0017599680869251377, 0.00425322532131322] and parameters: {'n_layers': 4, 'embedding_dim': 96, 'lr': 0.0016459794241324855, 'lambda_val': 2.0431242153221654e-06, 'batch_size': 3801, 'optimizer': 'RMSprop'}.
2026-07-08 20:05:15,079 - experiment_functions - INFO - Early stopping at epoch 1550. Best Metrics: (0.006832197857282499, 0.001882491499344642, 0.00450201551229421)
2026-07-08 20:05:15,177 - optuna.study.study - INFO - Trial 176 finished with values: [0.006832197857282499, 0.001882491499344642, 0.00450201551229421] and parameters: {'n_layers': 4, 'embedding_dim': 64, 'lr': 0.0009859128880233146, 'lambda_val': 6.625860010406062e-06, 'batch_size': 3603, 'optimizer': 'RMSprop'}.
2026-07-08 20:07:22,019 - experiment_functions - INFO - Early stopping at epoch 1400. Best Metrics: (0.005649038689513547, 0.0015985031248219137, 0.00376964194759869)
2026-07-08 20:07:22,140 - optuna.study.study - INFO - Trial 177 finished with values: [0.005649038689513547, 0.0015985031248219137, 0.00376964194759869] and parameters: {'n_layers': 4, 'embedding_dim': 128, 'lr': 0.002634796822286242, 'lambda_val': 4.325919770856533e-05, 'batch_size': 891, 'optimizer': 'RMSprop'}.
2026-07-08 20:09:00,844 - experiment_functions - INFO - Early stopping at epoch 950. Best Metrics: (0.0048967230880327395, 0.0013696027961932259, 0.003226285214179023)
2026-07-08 20:09:00,981 - optuna.study.study - INFO - Trial 178 finished with values: [0.0048967230880327395, 0.0013696027961932259, 0.003226285214179023] and parameters: {'n_layers': 3, 'embedding_dim': 256, 'lr': 0.002634796822286242, 'lambda_val': 6.892455337046496e-05, 'batch_size': 3461, 'optimizer': 'Adam'}.
2026-07-08 20:12:03,581 - experiment_functions - INFO - Early stopping at epoch 1800. Best Metrics: (0.005757781486325152, 0.0015035237353494295, 0.0036260518900330376)
2026-07-08 20:12:03,676 - optuna.study.study - INFO - Trial 179 finished with values: [0.005757781486325152, 0.0015035237353494295, 0.0036260518900330376] and parameters: {'n_layers': 3, 'embedding_dim': 256, 'lr': 0.001488688533444762, 'lambda_val': 1.3798424398068006e-06, 'batch_size': 1562, 'optimizer': 'Adam'}.
2026-07-08 20:13:49,054 - experiment_functions - INFO - Early stopping at epoch 1300. Best Metrics: (0.005154817815904703, 0.0013999962008244208, 0.0033215825557594697)
2026-07-08 20:13:49,164 - optuna.study.study - INFO - Trial 180 finished with values: [0.005154817815904703, 0.0013999962008244208, 0.0033215825557594697] and parameters: {'n_layers': 3, 'embedding_dim': 64, 'lr': 0.0026199811222762572, 'lambda_val': 4.325919770856533e-05, 'batch_size': 2341, 'optimizer': 'Adam'}.
2026-07-08 20:14:51,397 - experiment_functions - INFO - Early stopping at epoch 550. Best Metrics: (0.0037253096423140995, 0.0010447732841973292, 0.0025056612308740882)
2026-07-08 20:14:51,494 - optuna.study.study - INFO - Trial 181 finished with values: [0.0037253096423140995, 0.0010447732841973292, 0.0025056612308740882] and parameters: {'n_layers': 4, 'embedding_dim': 256, 'lr': 0.004459156843251533, 'lambda_val': 0.0016935759490927101, 'batch_size': 891, 'optimizer': 'RMSprop'}.
2026-07-08 20:17:44,402 - experiment_functions - INFO - Early stopping at epoch 2350. Best Metrics: (0.003915412668799646, 0.0009279486351461734, 0.0023811022044367756)
2026-07-08 20:17:44,494 - optuna.study.study - INFO - Trial 182 finished with values: [0.003915412668799646, 0.0009279486351461734, 0.0023811022044367756] and parameters: {'n_layers': 1, 'embedding_dim': 32, 'lr': 0.0026199811222762572, 'lambda_val': 4.325919770856533e-05, 'batch_size': 1388, 'optimizer': 'RMSprop'}.
2026-07-08 20:19:42,426 - experiment_functions - INFO - Early stopping at epoch 1500. Best Metrics: (0.004838451086162061, 0.0012470793837737212, 0.0031371386366603063)
2026-07-08 20:19:42,523 - optuna.study.study - INFO - Trial 183 finished with values: [0.004838451086162061, 0.0012470793837737212, 0.0031371386366603063] and parameters: {'n_layers': 2, 'embedding_dim': 64, 'lr': 0.0026199811222762572, 'lambda_val': 4.325919770856533e-05, 'batch_size': 2598, 'optimizer': 'RMSprop'}.
2026-07-08 20:20:49,521 - experiment_functions - INFO - Early stopping at epoch 750. Best Metrics: (0.005553165375937851, 0.0015016241475599797, 0.0036210218160925216)
2026-07-08 20:20:49,612 - optuna.study.study - INFO - Trial 184 finished with values: [0.005553165375937851, 0.0015016241475599797, 0.0036210218160925216] and parameters: {'n_layers': 4, 'embedding_dim': 96, 'lr': 0.0026199811222762572, 'lambda_val': 6.5939387363411675e-06, 'batch_size': 3801, 'optimizer': 'RMSprop'}.
2026-07-08 20:22:12,232 - experiment_functions - INFO - Early stopping at epoch 850. Best Metrics: (0.003988941550319325, 0.0011331041164067397, 0.0024957496621340718)
2026-07-08 20:22:12,326 - optuna.study.study - INFO - Trial 185 finished with values: [0.003988941550319325, 0.0011331041164067397, 0.0024957496621340718] and parameters: {'n_layers': 2, 'embedding_dim': 256, 'lr': 0.0033540795104684273, 'lambda_val': 6.625860010406062e-06, 'batch_size': 3461, 'optimizer': 'RMSprop'}.
2026-07-08 20:25:04,027 - experiment_functions - INFO - Early stopping at epoch 1900. Best Metrics: (0.00605400811542673, 0.0017010808654521969, 0.004026969866384646)
2026-07-08 20:25:04,116 - optuna.study.study - INFO - Trial 186 finished with values: [0.00605400811542673, 0.0017010808654521969, 0.004026969866384646] and parameters: {'n_layers': 4, 'embedding_dim': 128, 'lr': 0.0013152005063538942, 'lambda_val': 6.494946904588344e-05, 'batch_size': 1562, 'optimizer': 'Adam'}.
