2026-06-29 23:01:14,707 - optuna.study.study - INFO - Trial 91 finished with values: [0.0009467747749702256, 0.0002801891989438292, 0.0007566445317642095] and parameters: {'n_layers': 4, 'embedding_dim': 256, 'lr': 0.09031528723133264, 'lambda_val': 0.004495593710473149, 'batch_size': 2642, 'optimizer': 'Adam'}.
2026-06-29 23:07:42,279 - optuna.study.study - INFO - Trial 92 finished with values: [0.000720984121761622, 0.0001871093972607944, 0.0004626649885945271] and parameters: {'n_layers': 3, 'embedding_dim': 256, 'lr': 0.00015494413902254658, 'lambda_val': 0.0002476989748552402, 'batch_size': 2719, 'optimizer': 'RMSprop'}.
2026-06-29 23:08:22,129 - experiment_functions - INFO - Early stopping at epoch 500. Best Metrics: (0.00024602769969784416, 7.40839237885379e-05, 0.00014570501320178004)
2026-06-29 23:08:22,213 - optuna.study.study - INFO - Trial 93 finished with values: [0.00024602769969784416, 7.40839237885379e-05, 0.00014570501320178004] and parameters: {'n_layers': 1, 'embedding_dim': 32, 'lr': 0.022884196889134636, 'lambda_val': 0.010704271874330006, 'batch_size': 2264, 'optimizer': 'SGD'}.
2026-06-29 23:12:14,484 - experiment_functions - INFO - Early stopping at epoch 2950. Best Metrics: (0.002355812529641318, 0.0006401610850445453, 0.0016138739598862723)
2026-06-29 23:12:14,561 - optuna.study.study - INFO - Trial 94 finished with values: [0.002355812529641318, 0.0006401610850445453, 0.0016138739598862723] and parameters: {'n_layers': 2, 'embedding_dim': 96, 'lr': 0.0009496158639399897, 'lambda_val': 3.423463120625302e-05, 'batch_size': 2346, 'optimizer': 'RMSprop'}.
2026-06-29 23:13:02,831 - experiment_functions - INFO - Early stopping at epoch 500. Best Metrics: (0.00021631393272697843, 5.9837015367665226e-05, 0.00012267637521538814)
2026-06-29 23:13:02,901 - optuna.study.study - INFO - Trial 95 finished with values: [0.00021631393272697843, 5.9837015367665226e-05, 0.00012267637521538814] and parameters: {'n_layers': 2, 'embedding_dim': 256, 'lr': 0.00331004334789819, 'lambda_val': 0.08585612397020126, 'batch_size': 3648, 'optimizer': 'SGD'}.
2026-06-29 23:13:43,045 - experiment_functions - INFO - Early stopping at epoch 500. Best Metrics: (0.00021975999941684963, 6.55357787360143e-05, 0.00013538501497927056)
2026-06-29 23:13:43,122 - optuna.study.study - INFO - Trial 96 finished with values: [0.00021975999941684963, 6.55357787360143e-05, 0.00013538501497927056] and parameters: {'n_layers': 2, 'embedding_dim': 32, 'lr': 0.011476202823028593, 'lambda_val': 0.01605709757307348, 'batch_size': 594, 'optimizer': 'SGD'}.
2026-06-29 23:14:40,657 - experiment_functions - INFO - Early stopping at epoch 550. Best Metrics: (0.0016133005666068932, 0.0004701479778887981, 0.001173501298551898)
2026-06-29 23:14:40,742 - optuna.study.study - INFO - Trial 97 finished with values: [0.0016133005666068932, 0.0004701479778887981, 0.001173501298551898] and parameters: {'n_layers': 3, 'embedding_dim': 256, 'lr': 0.02833621835555532, 'lambda_val': 1.554897118169841e-06, 'batch_size': 3181, 'optimizer': 'RMSprop'}.
2026-06-29 23:15:53,691 - experiment_functions - INFO - Early stopping at epoch 950. Best Metrics: (0.0018134185452640245, 0.0004568508633626503, 0.0011790666577658167)
2026-06-29 23:15:53,781 - optuna.study.study - INFO - Trial 98 finished with values: [0.0018134185452640245, 0.0004568508633626503, 0.0011790666577658167] and parameters: {'n_layers': 2, 'embedding_dim': 32, 'lr': 0.002365530211589969, 'lambda_val': 3.918882692849622e-06, 'batch_size': 2746, 'optimizer': 'Adam'}.
2026-06-29 23:16:40,989 - experiment_functions - INFO - Early stopping at epoch 550. Best Metrics: (0.0009459565303052389, 0.0002963356951541516, 0.0006903619626853892)
2026-06-29 23:16:41,081 - optuna.study.study - INFO - Trial 99 finished with values: [0.0009459565303052389, 0.0002963356951541516, 0.0006903619626853892] and parameters: {'n_layers': 4, 'embedding_dim': 64, 'lr': 0.013963397837397955, 'lambda_val': 0.035511336040904305, 'batch_size': 1472, 'optimizer': 'Adam'}.
2026-06-29 23:21:56,934 - optuna.study.study - INFO - Trial 100 finished with values: [0.0023204303906441187, 0.0006287635583078472, 0.0015322754067217102] and parameters: {'n_layers': 4, 'embedding_dim': 64, 'lr': 0.0005030162275943933, 'lambda_val': 3.9206514264817366e-05, 'batch_size': 3239, 'optimizer': 'Adam'}.
2026-06-29 23:23:30,740 - experiment_functions - INFO - Early stopping at epoch 1200. Best Metrics: (0.0021604547790152907, 0.000563227779571833, 0.0014493474572063877)
2026-06-29 23:23:30,816 - optuna.study.study - INFO - Trial 101 finished with values: [0.0021604547790152907, 0.000563227779571833, 0.0014493474572063877] and parameters: {'n_layers': 2, 'embedding_dim': 64, 'lr': 0.00235708379888552, 'lambda_val': 1.554897118169841e-06, 'batch_size': 2649, 'optimizer': 'RMSprop'}.
2026-06-29 23:25:06,218 - experiment_functions - INFO - Early stopping at epoch 950. Best Metrics: (0.0021726450272029512, 0.0006534581995706933, 0.0014860442349495897)
2026-06-29 23:25:06,349 - optuna.study.study - INFO - Trial 102 finished with values: [0.0021726450272029512, 0.0006534581995706933, 0.0014860442349495897] and parameters: {'n_layers': 3, 'embedding_dim': 256, 'lr': 0.0013047089047836713, 'lambda_val': 0.0005400904118495423, 'batch_size': 2836, 'optimizer': 'RMSprop'}.
2026-06-29 23:31:35,280 - optuna.study.study - INFO - Trial 103 finished with values: [0.0027468115222875726, 0.0007645840852535, 0.001799419004891111] and parameters: {'n_layers': 3, 'embedding_dim': 256, 'lr': 0.0005030162275943933, 'lambda_val': 2.281093086329608e-05, 'batch_size': 2664, 'optimizer': 'RMSprop'}.
2026-06-29 23:32:34,045 - experiment_functions - INFO - Early stopping at epoch 700. Best Metrics: (0.0019526765477764086, 0.0005622779856771081, 0.001340195177088645)
2026-06-29 23:32:34,122 - optuna.study.study - INFO - Trial 104 finished with values: [0.0019526765477764086, 0.0005622779856771081, 0.001340195177088645] and parameters: {'n_layers': 4, 'embedding_dim': 64, 'lr': 0.013963397837397955, 'lambda_val': 1.582941209280553e-06, 'batch_size': 1681, 'optimizer': 'Adam'}.
2026-06-29 23:33:34,952 - experiment_functions - INFO - Early stopping at epoch 550. Best Metrics: (0.0010147362081285734, 0.00032767889368007144, 0.0007156063356622621)
2026-06-29 23:33:35,044 - optuna.study.study - INFO - Trial 105 finished with values: [0.0010147362081285734, 0.00032767889368007144, 0.0007156063356622621] and parameters: {'n_layers': 4, 'embedding_dim': 256, 'lr': 0.022884196889134636, 'lambda_val': 0.012791585416026822, 'batch_size': 2264, 'optimizer': 'Adam'}.
2026-06-29 23:34:56,864 - experiment_functions - INFO - Early stopping at epoch 1000. Best Metrics: (0.0017468352288030008, 0.00047299735957297265, 0.0011998245461309234)
2026-06-29 23:34:56,966 - optuna.study.study - INFO - Trial 106 finished with values: [0.0017468352288030008, 0.00047299735957297265, 0.0011998245461309234] and parameters: {'n_layers': 2, 'embedding_dim': 96, 'lr': 0.002365530211589969, 'lambda_val': 0.0034877418541278907, 'batch_size': 594, 'optimizer': 'RMSprop'}.
2026-06-29 23:39:59,011 - optuna.study.study - INFO - Trial 107 finished with values: [0.0022149160334393792, 0.0005926713903083032, 0.0014586783487899183] and parameters: {'n_layers': 4, 'embedding_dim': 32, 'lr': 0.0005030162275943933, 'lambda_val': 3.9206514264817366e-05, 'batch_size': 3604, 'optimizer': 'RMSprop'}.
2026-06-29 23:42:27,534 - experiment_functions - INFO - Early stopping at epoch 1750. Best Metrics: (0.0009595090462257296, 0.0003466747715745684, 0.0007078074096302307)
2026-06-29 23:42:27,822 - optuna.study.study - INFO - Trial 108 finished with values: [0.0009595090462257296, 0.0003466747715745684, 0.0007078074096302307] and parameters: {'n_layers': 4, 'embedding_dim': 96, 'lr': 0.09031528723133264, 'lambda_val': 0.004495593710473149, 'batch_size': 4019, 'optimizer': 'Adam'}.
2026-06-29 23:44:08,676 - experiment_functions - INFO - Early stopping at epoch 1300. Best Metrics: (0.0008955610644124244, 0.0002991850768383261, 0.0006378394464741754)
2026-06-29 23:44:08,767 - optuna.study.study - INFO - Trial 109 finished with values: [0.0008955610644124244, 0.0002991850768383261, 0.0006378394464741754] and parameters: {'n_layers': 4, 'embedding_dim': 32, 'lr': 0.017351300430976352, 'lambda_val': 0.012664480229843079, 'batch_size': 3566, 'optimizer': 'RMSprop'}.
2026-06-29 23:47:11,119 - experiment_functions - INFO - Early stopping at epoch 2450. Best Metrics: (0.0009191967238929856, 0.00027259084778603047, 0.0006531690832583927)
2026-06-29 23:47:11,194 - optuna.study.study - INFO - Trial 110 finished with values: [0.0009191967238929856, 0.00027259084778603047, 0.0006531690832583927] and parameters: {'n_layers': 2, 'embedding_dim': 32, 'lr': 0.0013047089047836713, 'lambda_val': 0.05204272963685584, 'batch_size': 2274, 'optimizer': 'RMSprop'}.
2026-06-29 23:52:48,847 - experiment_functions - INFO - Early stopping at epoch 3250. Best Metrics: (0.00315765539369615, 0.0009241494595672739, 0.0021939424157842767)
2026-06-29 23:52:48,933 - optuna.study.study - INFO - Trial 111 finished with values: [0.00315765539369615, 0.0009241494595672739, 0.0021939424157842767] and parameters: {'n_layers': 4, 'embedding_dim': 256, 'lr': 0.0013047089047836713, 'lambda_val': 2.199939619081897e-06, 'batch_size': 620, 'optimizer': 'RMSprop'}.
2026-06-29 23:53:36,214 - experiment_functions - INFO - Early stopping at epoch 500. Best Metrics: (0.001100266751823741, 0.0003039340463119504, 0.0008433350510445184)
2026-06-29 23:53:36,355 - optuna.study.study - INFO - Trial 112 finished with values: [0.001100266751823741, 0.0003039340463119504, 0.0008433350510445184] and parameters: {'n_layers': 4, 'embedding_dim': 128, 'lr': 0.09031528723133264, 'lambda_val': 3.423463120625302e-05, 'batch_size': 2642, 'optimizer': 'RMSprop'}.
2026-06-29 23:55:40,903 - experiment_functions - INFO - Early stopping at epoch 1500. Best Metrics: (0.002182224542833858, 0.0006135668559922496, 0.0014737869461958928)
2026-06-29 23:55:40,981 - optuna.study.study - INFO - Trial 113 finished with values: [0.002182224542833858, 0.0006135668559922496, 0.0014737869461958928] and parameters: {'n_layers': 2, 'embedding_dim': 128, 'lr': 0.0013047089047836713, 'lambda_val': 6.704969299857427e-05, 'batch_size': 4019, 'optimizer': 'RMSprop'}.
2026-06-29 23:56:25,272 - experiment_functions - INFO - Early stopping at epoch 550. Best Metrics: (0.001193795270093481, 0.00032672909978534665, 0.0008011776518043998)
2026-06-29 23:56:25,351 - optuna.study.study - INFO - Trial 114 finished with values: [0.001193795270093481, 0.00032672909978534665, 0.0008011776518043998] and parameters: {'n_layers': 2, 'embedding_dim': 32, 'lr': 0.011476202823028593, 'lambda_val': 0.0005053800255522991, 'batch_size': 1857, 'optimizer': 'RMSprop'}.
2026-06-29 23:58:17,512 - experiment_functions - INFO - Early stopping at epoch 1400. Best Metrics: (0.001359927841491138, 0.00044830271831012664, 0.0009432017225706995)
2026-06-29 23:58:17,589 - optuna.study.study - INFO - Trial 115 finished with values: [0.001359927841491138, 0.00044830271831012664, 0.0009432017225706995] and parameters: {'n_layers': 1, 'embedding_dim': 128, 'lr': 0.014443422489975663, 'lambda_val': 0.0027740064296835685, 'batch_size': 3636, 'optimizer': 'RMSprop'}.
2026-06-30 00:02:57,388 - experiment_functions - INFO - Early stopping at epoch 3200. Best Metrics: (0.0031694603965822738, 0.0009023041999886026, 0.002099501708923441)
2026-06-30 00:02:57,483 - optuna.study.study - INFO - Trial 116 finished with values: [0.0031694603965822738, 0.0009023041999886026, 0.002099501708923441] and parameters: {'n_layers': 4, 'embedding_dim': 128, 'lr': 0.0007630224543931566, 'lambda_val': 3.9206514264817366e-05, 'batch_size': 2746, 'optimizer': 'RMSprop'}.
2026-06-30 00:04:01,754 - experiment_functions - INFO - Early stopping at epoch 800. Best Metrics: (0.0018203563322260368, 0.0004511520999943012, 0.0012546721452126634)
2026-06-30 00:04:01,862 - optuna.study.study - INFO - Trial 117 finished with values: [0.0018203563322260368, 0.0004511520999943012, 0.0012546721452126634] and parameters: {'n_layers': 1, 'embedding_dim': 96, 'lr': 0.002365530211589969, 'lambda_val': 0.0007016033312988068, 'batch_size': 2746, 'optimizer': 'RMSprop'}.
2026-06-30 00:05:43,870 - experiment_functions - INFO - Early stopping at epoch 1350. Best Metrics: (0.00090839628939395, 0.00031153239746974906, 0.0006642957860127242)
2026-06-30 00:05:43,947 - optuna.study.study - INFO - Trial 118 finished with values: [0.00090839628939395, 0.00031153239746974906, 0.0006642957860127242] and parameters: {'n_layers': 2, 'embedding_dim': 32, 'lr': 0.00331004334789819, 'lambda_val': 0.08585612397020126, 'batch_size': 3648, 'optimizer': 'RMSprop'}.
2026-06-30 00:06:35,066 - experiment_functions - INFO - Early stopping at epoch 500. Best Metrics: (0.0002642221926778227, 6.553577873601429e-05, 0.00015529345206662185)
2026-06-30 00:06:35,134 - optuna.study.study - INFO - Trial 119 finished with values: [0.0002642221926778227, 6.553577873601429e-05, 0.00015529345206662185] and parameters: {'n_layers': 3, 'embedding_dim': 256, 'lr': 0.02833621835555532, 'lambda_val': 1.582941209280553e-06, 'batch_size': 761, 'optimizer': 'SGD'}.
2026-06-30 00:07:21,792 - experiment_functions - INFO - Early stopping at epoch 550. Best Metrics: (0.0014531689282381265, 0.0004179093136789317, 0.000987418402445684)
2026-06-30 00:07:21,878 - optuna.study.study - INFO - Trial 120 finished with values: [0.0014531689282381265, 0.0004179093136789317, 0.000987418402445684] and parameters: {'n_layers': 2, 'embedding_dim': 96, 'lr': 0.02833621835555532, 'lambda_val': 1.554897118169841e-06, 'batch_size': 3028, 'optimizer': 'RMSprop'}.
2026-06-30 00:08:22,911 - experiment_functions - INFO - Early stopping at epoch 550. Best Metrics: (0.0016252100506630547, 0.0004672985962046237, 0.0011063083702516966)
2026-06-30 00:08:22,980 - optuna.study.study - INFO - Trial 121 finished with values: [0.0016252100506630547, 0.0004672985962046237, 0.0011063083702516966] and parameters: {'n_layers': 4, 'embedding_dim': 256, 'lr': 0.09031528723133264, 'lambda_val': 1.554897118169841e-06, 'batch_size': 2642, 'optimizer': 'Adam'}.
2026-06-30 00:09:10,925 - experiment_functions - INFO - Early stopping at epoch 550. Best Metrics: (0.001579850933342051, 0.0004445035427312274, 0.0010828302875165816)
2026-06-30 00:09:10,998 - optuna.study.study - INFO - Trial 122 finished with values: [0.001579850933342051, 0.0004445035427312274, 0.0010828302875165816] and parameters: {'n_layers': 3, 'embedding_dim': 96, 'lr': 0.014443422489975663, 'lambda_val': 0.0005613082418791808, 'batch_size': 2746, 'optimizer': 'RMSprop'}.
2026-06-30 00:10:00,009 - experiment_functions - INFO - Early stopping at epoch 600. Best Metrics: (0.0014084293524422803, 0.0003656706494690653, 0.0009818273319870299)
2026-06-30 00:10:00,075 - optuna.study.study - INFO - Trial 123 finished with values: [0.0014084293524422803, 0.0003656706494690653, 0.0009818273319870299] and parameters: {'n_layers': 2, 'embedding_dim': 64, 'lr': 0.02704828677113879, 'lambda_val': 3.423463120625302e-05, 'batch_size': 1591, 'optimizer': 'RMSprop'}.
2026-06-30 00:11:22,556 - experiment_functions - INFO - Early stopping at epoch 900. Best Metrics: (0.00193090440572585, 0.0005888722147294038, 0.0013335481162091891)
2026-06-30 00:11:22,651 - optuna.study.study - INFO - Trial 124 finished with values: [0.00193090440572585, 0.0005888722147294038, 0.0013335481162091891] and parameters: {'n_layers': 4, 'embedding_dim': 128, 'lr': 0.0019032891633152442, 'lambda_val': 0.004495593710473149, 'batch_size': 4019, 'optimizer': 'Adam'}.
2026-06-30 00:12:09,678 - experiment_functions - INFO - Early stopping at epoch 550. Best Metrics: (0.0018037526743279618, 0.0005480310772562355, 0.0012251759074074573)
2026-06-30 00:12:09,760 - optuna.study.study - INFO - Trial 125 finished with values: [0.0018037526743279618, 0.0005480310772562355, 0.0012251759074074573] and parameters: {'n_layers': 4, 'embedding_dim': 64, 'lr': 0.017351300430976352, 'lambda_val': 2.199939619081897e-06, 'batch_size': 620, 'optimizer': 'RMSprop'}.
2026-06-30 00:13:01,657 - experiment_functions - INFO - Early stopping at epoch 600. Best Metrics: (0.0016054412511772372, 0.00046729859620462365, 0.0011834642916429996)
2026-06-30 00:13:01,749 - optuna.study.study - INFO - Trial 126 finished with values: [0.0016054412511772372, 0.00046729859620462365, 0.0011834642916429996] and parameters: {'n_layers': 3, 'embedding_dim': 96, 'lr': 0.021245875855951238, 'lambda_val': 5.263043696503393e-06, 'batch_size': 3827, 'optimizer': 'RMSprop'}.
2026-06-30 00:15:01,306 - experiment_functions - INFO - Early stopping at epoch 1450. Best Metrics: (0.0009353809964743201, 0.00034572497767984355, 0.0007192406994152125)
2026-06-30 00:15:01,379 - optuna.study.study - INFO - Trial 127 finished with values: [0.0009353809964743201, 0.00034572497767984355, 0.0007192406994152125] and parameters: {'n_layers': 3, 'embedding_dim': 96, 'lr': 0.02833621835555532, 'lambda_val': 0.041400477571589746, 'batch_size': 3028, 'optimizer': 'RMSprop'}.
2026-06-30 00:17:16,413 - experiment_functions - INFO - Early stopping at epoch 1750. Best Metrics: (0.00205939743336073, 0.0005043405580988924, 0.001388535184435431)
2026-06-30 00:17:16,492 - optuna.study.study - INFO - Trial 128 finished with values: [0.00205939743336073, 0.0005043405580988924, 0.001388535184435431] and parameters: {'n_layers': 1, 'embedding_dim': 96, 'lr': 0.002365530211589969, 'lambda_val': 1.4993414708120436e-05, 'batch_size': 1472, 'optimizer': 'RMSprop'}.
2026-06-30 00:22:36,121 - experiment_functions - INFO - Early stopping at epoch 3850. Best Metrics: (0.0021362837089260065, 0.0005546796345193094, 0.0014655478087548226)
2026-06-30 00:22:36,195 - optuna.study.study - INFO - Trial 129 finished with values: [0.0021362837089260065, 0.0005546796345193094, 0.0014655478087548226] and parameters: {'n_layers': 4, 'embedding_dim': 96, 'lr': 0.0003326962115608699, 'lambda_val': 0.0001469814413818991, 'batch_size': 3827, 'optimizer': 'RMSprop'}.
2026-06-30 00:23:17,336 - experiment_functions - INFO - Early stopping at epoch 500. Best Metrics: (0.00020608116075115736, 5.128887031514162e-05, 0.00012828228256433634)
2026-06-30 00:23:17,427 - optuna.study.study - INFO - Trial 130 finished with values: [0.00020608116075115736, 5.128887031514162e-05, 0.00012828228256433634] and parameters: {'n_layers': 2, 'embedding_dim': 64, 'lr': 0.0130511149893422, 'lambda_val': 3.423463120625302e-05, 'batch_size': 3636, 'optimizer': 'SGD'}.
2026-06-30 00:28:07,799 - experiment_functions - INFO - Early stopping at epoch 3800. Best Metrics: (0.0012617004184411946, 0.00042455787094200563, 0.0009200247702655914)
2026-06-30 00:28:07,883 - optuna.study.study - INFO - Trial 131 finished with values: [0.0012617004184411946, 0.00042455787094200563, 0.0009200247702655914] and parameters: {'n_layers': 1, 'embedding_dim': 96, 'lr': 0.008890902785936981, 'lambda_val': 0.004495593710473149, 'batch_size': 2642, 'optimizer': 'Adam'}.
2026-06-30 00:29:37,730 - experiment_functions - INFO - Early stopping at epoch 1050. Best Metrics: (0.0002457268605502066, 5.603783978876583e-05, 0.00016291537501989572)
2026-06-30 00:29:37,824 - optuna.study.study - INFO - Trial 132 finished with values: [0.0002457268605502066, 5.603783978876583e-05, 0.00016291537501989572] and parameters: {'n_layers': 4, 'embedding_dim': 96, 'lr': 4.059523801439177e-05, 'lambda_val': 1.8486466043822117e-05, 'batch_size': 2746, 'optimizer': 'RMSprop'}.
2026-06-30 00:30:23,989 - experiment_functions - INFO - Early stopping at epoch 550. Best Metrics: (0.00158854462010562, 0.0004245578709420057, 0.0011123664970935328)
2026-06-30 00:30:24,096 - optuna.study.study - INFO - Trial 133 finished with values: [0.00158854462010562, 0.0004245578709420057, 0.0011123664970935328] and parameters: {'n_layers': 3, 'embedding_dim': 64, 'lr': 0.02833621835555532, 'lambda_val': 1.554897118169841e-06, 'batch_size': 1591, 'optimizer': 'RMSprop'}.
2026-06-30 00:31:19,013 - experiment_functions - INFO - Early stopping at epoch 650. Best Metrics: (0.0016159244395779514, 0.00045970024504682485, 0.001123356557397595)
2026-06-30 00:31:19,103 - optuna.study.study - INFO - Trial 134 finished with values: [0.0016159244395779514, 0.00045970024504682485, 0.001123356557397595] and parameters: {'n_layers': 4, 'embedding_dim': 64, 'lr': 0.005817892184311597, 'lambda_val': 0.0034877418541278907, 'batch_size': 3566, 'optimizer': 'Adam'}.
2026-06-30 00:33:26,707 - experiment_functions - INFO - Early stopping at epoch 1200. Best Metrics: (0.0022934639919161707, 0.0006762532530440893, 0.0014970951793799496)
2026-06-30 00:33:26,791 - optuna.study.study - INFO - Trial 135 finished with values: [0.0022934639919161707, 0.0006762532530440893, 0.0014970951793799496] and parameters: {'n_layers': 4, 'embedding_dim': 256, 'lr': 0.003551859771094245, 'lambda_val': 1.582941209280553e-06, 'batch_size': 2746, 'optimizer': 'RMSprop'}.
2026-06-30 00:36:42,373 - experiment_functions - INFO - Early stopping at epoch 2450. Best Metrics: (0.0026185944908443596, 0.0007569857340957013, 0.0018481002053000793)
2026-06-30 00:36:42,462 - optuna.study.study - INFO - Trial 136 finished with values: [0.0026185944908443596, 0.0007569857340957013, 0.0018481002053000793] and parameters: {'n_layers': 4, 'embedding_dim': 64, 'lr': 0.0009496158639399897, 'lambda_val': 3.423463120625302e-05, 'batch_size': 3604, 'optimizer': 'RMSprop'}.
2026-06-30 00:37:24,941 - experiment_functions - INFO - Early stopping at epoch 500. Best Metrics: (0.00019970528177671267, 5.888722147294038e-05, 0.00012503910506514378)
