2026-07-06 02:24:04,750 - optuna.study.study - INFO - Trial 187 finished with values: [0.020649972797313048, 0.004550462549626731, 0.01234031139147821] and parameters: {'n_layers': 1, 'embedding_dim': 64, 'lr': 0.004643736874356213, 'lambda_val': 1.1602258783212233e-06, 'batch_size': 1120, 'optimizer': 'Adam'}.
2026-07-06 02:28:37,978 - experiment_functions - INFO - Early stopping at epoch 3450. Best Metrics: (0.012623154132987875, 0.002885473852174079, 0.007613348699273491)
2026-07-06 02:28:38,067 - optuna.study.study - INFO - Trial 188 finished with values: [0.012623154132987875, 0.002885473852174079, 0.007613348699273491] and parameters: {'n_layers': 3, 'embedding_dim': 32, 'lr': 0.01406276067877314, 'lambda_val': 1.4745289700620854e-05, 'batch_size': 2385, 'optimizer': 'RMSprop'}.
2026-07-06 02:33:01,315 - experiment_functions - INFO - Early stopping at epoch 3300. Best Metrics: (0.007558398026317774, 0.0017267253006097677, 0.004254144450496277)
2026-07-06 02:33:01,395 - optuna.study.study - INFO - Trial 189 finished with values: [0.007558398026317774, 0.0017267253006097677, 0.004254144450496277] and parameters: {'n_layers': 4, 'embedding_dim': 32, 'lr': 0.0020004569205185102, 'lambda_val': 0.0030759808459583132, 'batch_size': 2594, 'optimizer': 'RMSprop'}.
2026-07-06 02:38:42,411 - optuna.study.study - INFO - Trial 190 finished with values: [0.01691044977421191, 0.003653857113006477, 0.009628328839804069] and parameters: {'n_layers': 2, 'embedding_dim': 96, 'lr': 0.00552003570381155, 'lambda_val': 2.412093285142066e-05, 'batch_size': 2901, 'optimizer': 'RMSprop'}.
2026-07-06 02:44:05,222 - optuna.study.study - INFO - Trial 191 finished with values: [0.012455113144603326, 0.002879775088805729, 0.00730676831478246] and parameters: {'n_layers': 2, 'embedding_dim': 64, 'lr': 0.006236516613152459, 'lambda_val': 0.0008455954335710432, 'batch_size': 1692, 'optimizer': 'RMSprop'}.
2026-07-06 02:44:51,139 - experiment_functions - INFO - Early stopping at epoch 550. Best Metrics: (0.001520293383913778, 0.0004188591075736565, 0.0009265229704991291)
2026-07-06 02:44:51,221 - optuna.study.study - INFO - Trial 192 finished with values: [0.001520293383913778, 0.0004188591075736565, 0.0009265229704991291] and parameters: {'n_layers': 3, 'embedding_dim': 32, 'lr': 0.08522301501004441, 'lambda_val': 0.00023140225629595055, 'batch_size': 1854, 'optimizer': 'RMSprop'}.
2026-07-06 02:50:09,016 - experiment_functions - INFO - Early stopping at epoch 3650. Best Metrics: (0.008580974913090943, 0.001990768003343275, 0.004813974594200774)
2026-07-06 02:50:09,104 - optuna.study.study - INFO - Trial 193 finished with values: [0.008580974913090943, 0.001990768003343275, 0.004813974594200774] and parameters: {'n_layers': 2, 'embedding_dim': 128, 'lr': 0.0028516566741058234, 'lambda_val': 0.0067674206888748, 'batch_size': 673, 'optimizer': 'RMSprop'}.
2026-07-06 02:54:55,395 - experiment_functions - INFO - Early stopping at epoch 3550. Best Metrics: (0.012360040149347131, 0.0030678342799612484, 0.007433457808399904)
2026-07-06 02:54:55,486 - optuna.study.study - INFO - Trial 194 finished with values: [0.012360040149347131, 0.0030678342799612484, 0.007433457808399904] and parameters: {'n_layers': 2, 'embedding_dim': 64, 'lr': 0.0008914583956121026, 'lambda_val': 0.0020434717977580296, 'batch_size': 1458, 'optimizer': 'RMSprop'}.
2026-07-06 02:55:41,975 - experiment_functions - INFO - Early stopping at epoch 500. Best Metrics: (0.00021414815578201969, 5.603783978876583e-05, 0.00012681924153632937)
2026-07-06 02:55:42,049 - optuna.study.study - INFO - Trial 195 finished with values: [0.00021414815578201969, 5.603783978876583e-05, 0.00012681924153632937] and parameters: {'n_layers': 2, 'embedding_dim': 128, 'lr': 0.0008914583956121026, 'lambda_val': 1.059674657990583e-05, 'batch_size': 1918, 'optimizer': 'SGD'}.
2026-07-06 02:56:31,101 - experiment_functions - INFO - Early stopping at epoch 550. Best Metrics: (0.00545564176851535, 0.0013572554755618032, 0.003417908949225887)
2026-07-06 02:56:31,193 - optuna.study.study - INFO - Trial 196 finished with values: [0.00545564176851535, 0.0013572554755618032, 0.003417908949225887] and parameters: {'n_layers': 3, 'embedding_dim': 64, 'lr': 0.01414602555765168, 'lambda_val': 0.0067674206888748, 'batch_size': 1120, 'optimizer': 'RMSprop'}.
2026-07-06 03:01:29,732 - optuna.study.study - INFO - Trial 197 finished with values: [0.0013039853510205819, 0.000354273122732367, 0.0007986318220540423] and parameters: {'n_layers': 1, 'embedding_dim': 32, 'lr': 0.00046943052333612564, 'lambda_val': 0.0030759808459583132, 'batch_size': 3234, 'optimizer': 'Adam'}.
2026-07-06 03:07:45,537 - optuna.study.study - INFO - Trial 198 finished with values: [0.015087533603935905, 0.0034458522500617366, 0.008793987397393661] and parameters: {'n_layers': 3, 'embedding_dim': 128, 'lr': 0.0008914583956121026, 'lambda_val': 1.3028958114301324e-06, 'batch_size': 1749, 'optimizer': 'RMSprop'}.
2026-07-06 03:13:31,537 - optuna.study.study - INFO - Trial 199 finished with values: [0.012004001312222672, 0.002666071462492639, 0.007067418447439518] and parameters: {'n_layers': 4, 'embedding_dim': 64, 'lr': 0.002260615499918563, 'lambda_val': 0.00011341953218080074, 'batch_size': 3725, 'optimizer': 'RMSprop'}.
2026-07-06 03:21:51,916 - optuna.study.study - INFO - Trial 200 finished with values: [0.013484472396190862, 0.0029329635469103202, 0.00772699852104279] and parameters: {'n_layers': 4, 'embedding_dim': 256, 'lr': 0.0014317988640719153, 'lambda_val': 1.059674657990583e-05, 'batch_size': 1458, 'optimizer': 'Adam'}.
2026-07-06 03:29:25,068 - optuna.study.study - INFO - Trial 201 finished with values: [0.010847984596901098, 0.0024932089736527173, 0.0062215663447931216] and parameters: {'n_layers': 3, 'embedding_dim': 256, 'lr': 0.0008914583956121026, 'lambda_val': 0.0058075472450839355, 'batch_size': 2586, 'optimizer': 'RMSprop'}.
2026-07-06 03:35:36,057 - optuna.study.study - INFO - Trial 202 finished with values: [0.022644242081674114, 0.004894287939517125, 0.013472500991933443] and parameters: {'n_layers': 1, 'embedding_dim': 256, 'lr': 0.004643736874356213, 'lambda_val': 1.3028958114301324e-06, 'batch_size': 1692, 'optimizer': 'RMSprop'}.
2026-07-06 03:41:16,373 - optuna.study.study - INFO - Trial 203 finished with values: [0.016918233034926757, 0.0037592842353209354, 0.009827244744048126] and parameters: {'n_layers': 2, 'embedding_dim': 96, 'lr': 0.00552003570381155, 'lambda_val': 7.042695090433518e-06, 'batch_size': 3299, 'optimizer': 'RMSprop'}.
2026-07-06 03:42:41,139 - experiment_functions - INFO - Early stopping at epoch 900. Best Metrics: (0.00017810976206702626, 5.31884581045913e-05, 0.00010311062250862354)
2026-07-06 03:42:41,645 - optuna.study.study - INFO - Trial 204 finished with values: [0.00017810976206702626, 5.31884581045913e-05, 0.00010311062250862354] and parameters: {'n_layers': 1, 'embedding_dim': 256, 'lr': 1.8727439332431026e-05, 'lambda_val': 0.0067674206888748, 'batch_size': 2385, 'optimizer': 'RMSprop'}.
2026-07-06 03:47:49,630 - optuna.study.study - INFO - Trial 205 finished with values: [0.02101788348044628, 0.004546663374047831, 0.012052123157706048] and parameters: {'n_layers': 1, 'embedding_dim': 32, 'lr': 0.004643736874356213, 'lambda_val': 1.4745289700620854e-05, 'batch_size': 2888, 'optimizer': 'RMSprop'}.
2026-07-06 03:49:05,481 - experiment_functions - INFO - Early stopping at epoch 800. Best Metrics: (0.00018876722232541275, 5.603783978876584e-05, 9.532908393420283e-05)
2026-07-06 03:49:05,586 - optuna.study.study - INFO - Trial 206 finished with values: [0.00018876722232541275, 5.603783978876584e-05, 9.532908393420283e-05] and parameters: {'n_layers': 1, 'embedding_dim': 256, 'lr': 0.00034565699176840965, 'lambda_val': 6.830924023769031e-06, 'batch_size': 1120, 'optimizer': 'RMSprop'}.
2026-07-06 03:54:31,038 - optuna.study.study - INFO - Trial 207 finished with values: [0.01683037325117234, 0.0037022966016374455, 0.009997162448438547] and parameters: {'n_layers': 1, 'embedding_dim': 96, 'lr': 0.00841343884415209, 'lambda_val': 1.4745289700620854e-05, 'batch_size': 2901, 'optimizer': 'RMSprop'}.
2026-07-06 03:59:01,650 - experiment_functions - INFO - Early stopping at epoch 2600. Best Metrics: (0.012632976355515423, 0.0027942936382804938, 0.0071674573500031934)
2026-07-06 03:59:01,758 - optuna.study.study - INFO - Trial 208 finished with values: [0.012632976355515423, 0.0027942936382804938, 0.0071674573500031934] and parameters: {'n_layers': 2, 'embedding_dim': 256, 'lr': 0.0033823653385842145, 'lambda_val': 0.002906975496505062, 'batch_size': 2079, 'optimizer': 'Adam'}.
2026-07-06 04:04:40,399 - optuna.study.study - INFO - Trial 209 finished with values: [0.012746392634827165, 0.002845582508595635, 0.007186448603209444] and parameters: {'n_layers': 2, 'embedding_dim': 96, 'lr': 0.006553786429577227, 'lambda_val': 6.830924023769031e-06, 'batch_size': 1506, 'optimizer': 'Adam'}.
2026-07-06 04:07:52,512 - experiment_functions - INFO - Early stopping at epoch 2250. Best Metrics: (0.014716201803657788, 0.0032198013031172236, 0.00822442537663737)
2026-07-06 04:07:52,597 - optuna.study.study - INFO - Trial 210 finished with values: [0.014716201803657788, 0.0032198013031172236, 0.00822442537663737] and parameters: {'n_layers': 3, 'embedding_dim': 64, 'lr': 0.0020004569205185102, 'lambda_val': 0.0007517515862491342, 'batch_size': 2482, 'optimizer': 'Adam'}.
2026-07-06 04:08:33,098 - experiment_functions - INFO - Early stopping at epoch 500. Best Metrics: (0.0001412545761362865, 4.084113747316833e-05, 8.718717194561851e-05)
2026-07-06 04:08:33,189 - optuna.study.study - INFO - Trial 211 finished with values: [0.0001412545761362865, 4.084113747316833e-05, 8.718717194561851e-05] and parameters: {'n_layers': 1, 'embedding_dim': 32, 'lr': 0.05749879110329603, 'lambda_val': 1.3028958114301324e-06, 'batch_size': 1692, 'optimizer': 'SGD'}.
2026-07-06 04:14:49,512 - optuna.study.study - INFO - Trial 212 finished with values: [0.024017517019788933, 0.005096594039093517, 0.01420549391039133] and parameters: {'n_layers': 1, 'embedding_dim': 256, 'lr': 0.0033823653385842145, 'lambda_val': 2.6612699284810097e-06, 'batch_size': 1553, 'optimizer': 'Adam'}.
2026-07-06 04:20:44,836 - optuna.study.study - INFO - Trial 213 finished with values: [0.013535498364798075, 0.0029814030355412875, 0.007801889906784655] and parameters: {'n_layers': 2, 'embedding_dim': 128, 'lr': 0.006236516613152459, 'lambda_val': 2.412093285142066e-05, 'batch_size': 1692, 'optimizer': 'Adam'}.
2026-07-06 04:26:06,890 - optuna.study.study - INFO - Trial 214 finished with values: [0.01592754615897368, 0.003553178960165644, 0.00930259182600399] and parameters: {'n_layers': 1, 'embedding_dim': 96, 'lr': 0.004643736874356213, 'lambda_val': 0.0020434717977580296, 'batch_size': 1120, 'optimizer': 'RMSprop'}.
2026-07-06 04:34:28,466 - optuna.study.study - INFO - Trial 215 finished with values: [0.012374272126536105, 0.0027667496153334727, 0.007193901457187265] and parameters: {'n_layers': 4, 'embedding_dim': 256, 'lr': 0.002260615499918563, 'lambda_val': 1.3028958114301324e-06, 'batch_size': 2615, 'optimizer': 'Adam'}.
2026-07-06 04:39:31,342 - experiment_functions - INFO - Early stopping at epoch 3750. Best Metrics: (0.011696491489182089, 0.0026993142488080085, 0.006784783766740736)
2026-07-06 04:39:31,426 - optuna.study.study - INFO - Trial 216 finished with values: [0.011696491489182089, 0.0026993142488080085, 0.006784783766740736] and parameters: {'n_layers': 2, 'embedding_dim': 64, 'lr': 0.006236516613152459, 'lambda_val': 0.0017059305455562248, 'batch_size': 2304, 'optimizer': 'RMSprop'}.
2026-07-06 04:45:45,003 - optuna.study.study - INFO - Trial 217 finished with values: [0.026097774580064743, 0.005595235833824061, 0.015554843178901661] and parameters: {'n_layers': 1, 'embedding_dim': 256, 'lr': 0.0028516566741058234, 'lambda_val': 1.4745289700620854e-05, 'batch_size': 1692, 'optimizer': 'RMSprop'}.
2026-07-06 04:52:42,737 - optuna.study.study - INFO - Trial 218 finished with values: [0.016928868889008724, 0.0036187147389016585, 0.00993013848823488] and parameters: {'n_layers': 2, 'embedding_dim': 256, 'lr': 0.0070515306300978796, 'lambda_val': 7.042695090433518e-06, 'batch_size': 3276, 'optimizer': 'Adam'}.
2026-07-06 04:58:55,313 - optuna.study.study - INFO - Trial 219 finished with values: [0.022266072760901624, 0.004748969473624224, 0.012983872393897873] and parameters: {'n_layers': 1, 'embedding_dim': 256, 'lr': 0.004643736874356213, 'lambda_val': 0.0002561236193059283, 'batch_size': 2231, 'optimizer': 'RMSprop'}.
2026-07-06 05:04:03,414 - optuna.study.study - INFO - Trial 220 finished with values: [0.02180267632646331, 0.004785061641623768, 0.012948346273425709] and parameters: {'n_layers': 1, 'embedding_dim': 32, 'lr': 0.004643736874356213, 'lambda_val': 1.3028958114301324e-06, 'batch_size': 3276, 'optimizer': 'Adam'}.
2026-07-06 05:05:09,744 - experiment_functions - INFO - Early stopping at epoch 550. Best Metrics: (0.007692526894268216, 0.0017143779799783448, 0.004624093230643692)
2026-07-06 05:05:09,830 - optuna.study.study - INFO - Trial 221 finished with values: [0.007692526894268216, 0.0017143779799783448, 0.004624093230643692] and parameters: {'n_layers': 3, 'embedding_dim': 256, 'lr': 0.055451108820409135, 'lambda_val': 2.1563767437652712e-06, 'batch_size': 1692, 'optimizer': 'Adam'}.
2026-07-06 05:09:07,709 - experiment_functions - INFO - Early stopping at epoch 2750. Best Metrics: (0.00894152753259186, 0.0021227893547100278, 0.005222124694658779)
2026-07-06 05:09:07,804 - optuna.study.study - INFO - Trial 222 finished with values: [0.00894152753259186, 0.0021227893547100278, 0.005222124694658779] and parameters: {'n_layers': 4, 'embedding_dim': 64, 'lr': 0.006236516613152459, 'lambda_val': 0.0008455954335710432, 'batch_size': 1692, 'optimizer': 'RMSprop'}.
2026-07-06 05:14:19,306 - optuna.study.study - INFO - Trial 223 finished with values: [0.013707960461413779, 0.0031039264479607925, 0.008138114306216804] and parameters: {'n_layers': 1, 'embedding_dim': 64, 'lr': 0.010885883325460335, 'lambda_val': 1.1602258783212233e-06, 'batch_size': 1120, 'optimizer': 'RMSprop'}.
2026-07-06 05:19:56,272 - optuna.study.study - INFO - Trial 224 finished with values: [0.021697206846905195, 0.004853446802043957, 0.01279499054904315] and parameters: {'n_layers': 1, 'embedding_dim': 128, 'lr': 0.002260615499918563, 'lambda_val': 0.002906975496505062, 'batch_size': 2385, 'optimizer': 'Adam'}.
2026-07-06 05:25:19,153 - optuna.study.study - INFO - Trial 225 finished with values: [0.01957119526773664, 0.004271223144577628, 0.011508377713733474] and parameters: {'n_layers': 1, 'embedding_dim': 96, 'lr': 0.00552003570381155, 'lambda_val': 2.412093285142066e-05, 'batch_size': 2015, 'optimizer': 'RMSprop'}.
2026-07-06 05:26:03,886 - experiment_functions - INFO - Early stopping at epoch 500. Best Metrics: (0.00014182659295370464, 4.274072526261801e-05, 8.945557154867718e-05)
2026-07-06 05:26:03,974 - optuna.study.study - INFO - Trial 226 finished with values: [0.00014182659295370464, 4.274072526261801e-05, 8.945557154867718e-05] and parameters: {'n_layers': 2, 'embedding_dim': 96, 'lr': 0.00841343884415209, 'lambda_val': 0.0012923669531330183, 'batch_size': 2901, 'optimizer': 'SGD'}.
2026-07-06 05:31:46,055 - optuna.study.study - INFO - Trial 227 finished with values: [0.02075931506450146, 0.004578006572573752, 0.012069968379366485] and parameters: {'n_layers': 2, 'embedding_dim': 96, 'lr': 0.0014317988640719153, 'lambda_val': 1.4745289700620854e-05, 'batch_size': 2482, 'optimizer': 'RMSprop'}.
2026-07-06 05:37:27,101 - optuna.study.study - INFO - Trial 228 finished with values: [0.016839444945395927, 0.0036548069069012026, 0.00996338014110758] and parameters: {'n_layers': 2, 'embedding_dim': 96, 'lr': 0.00841343884415209, 'lambda_val': 2.412093285142066e-05, 'batch_size': 2615, 'optimizer': 'RMSprop'}.
2026-07-06 05:42:25,286 - optuna.study.study - INFO - Trial 229 finished with values: [0.004892385465863446, 0.001236631650931748, 0.003084025874349066] and parameters: {'n_layers': 1, 'embedding_dim': 32, 'lr': 0.000628496153565313, 'lambda_val': 4.26055594331169e-06, 'batch_size': 2079, 'optimizer': 'RMSprop'}.
2026-07-06 05:46:59,973 - experiment_functions - INFO - Early stopping at epoch 2950. Best Metrics: (0.015838214023835912, 0.0036386604106908803, 0.009327090795678335)
2026-07-06 05:47:00,054 - optuna.study.study - INFO - Trial 230 finished with values: [0.015838214023835912, 0.0036386604106908803, 0.009327090795678335] and parameters: {'n_layers': 1, 'embedding_dim': 256, 'lr': 0.0028516566741058234, 'lambda_val': 0.0067674206888748, 'batch_size': 2385, 'optimizer': 'RMSprop'}.
2026-07-06 05:48:41,231 - experiment_functions - INFO - Early stopping at epoch 1200. Best Metrics: (0.00031861147473766536, 7.313412989381304e-05, 0.00015700989997627046)
2026-07-06 05:48:41,309 - optuna.study.study - INFO - Trial 231 finished with values: [0.00031861147473766536, 7.313412989381304e-05, 0.00015700989997627046] and parameters: {'n_layers': 1, 'embedding_dim': 128, 'lr': 0.00012507594756712109, 'lambda_val': 1.4745289700620854e-05, 'batch_size': 2385, 'optimizer': 'Adam'}.
2026-07-06 05:56:19,714 - optuna.study.study - INFO - Trial 232 finished with values: [0.020823788942544393, 0.004450734190680623, 0.01219236363830278] and parameters: {'n_layers': 3, 'embedding_dim': 256, 'lr': 0.0070515306300978796, 'lambda_val': 1.4745289700620854e-05, 'batch_size': 2095, 'optimizer': 'RMSprop'}.
2026-07-06 06:03:13,674 - optuna.study.study - INFO - Trial 233 finished with values: [0.00847393717017093, 0.0022738065839712786, 0.0051464169191528875] and parameters: {'n_layers': 2, 'embedding_dim': 256, 'lr': 0.000363795778121085, 'lambda_val': 7.042695090433518e-06, 'batch_size': 3299, 'optimizer': 'Adam'}.
2026-07-06 06:09:29,890 - optuna.study.study - INFO - Trial 234 finished with values: [0.01869327367888776, 0.004105009213000779, 0.010890909607891314] and parameters: {'n_layers': 1, 'embedding_dim': 256, 'lr': 0.0070515306300978796, 'lambda_val': 0.0004285214687900552, 'batch_size': 2482, 'optimizer': 'Adam'}.
2026-07-06 06:14:47,480 - optuna.study.study - INFO - Trial 235 finished with values: [0.024443995651823397, 0.005361586535721748, 0.01482833002808552] and parameters: {'n_layers': 1, 'embedding_dim': 64, 'lr': 0.0033823653385842145, 'lambda_val': 2.6612699284810097e-06, 'batch_size': 2079, 'optimizer': 'Adam'}.
2026-07-06 06:21:05,401 - optuna.study.study - INFO - Trial 236 finished with values: [0.01238071734348138, 0.002727808065649754, 0.006927566097058439] and parameters: {'n_layers': 3, 'embedding_dim': 128, 'lr': 0.0020004569205185102, 'lambda_val': 0.0017059305455562248, 'batch_size': 2482, 'optimizer': 'Adam'}.
2026-07-06 06:26:16,037 - optuna.study.study - INFO - Trial 237 finished with values: [0.010066904920794048, 0.002618581767756397, 0.006135581549348336] and parameters: {'n_layers': 1, 'embedding_dim': 64, 'lr': 0.01406276067877314, 'lambda_val': 0.008074295700127012, 'batch_size': 2385, 'optimizer': 'RMSprop'}.
2026-07-06 06:32:28,104 - optuna.study.study - INFO - Trial 238 finished with values: [0.021471004297673377, 0.004647341526888665, 0.012395602813214406] and parameters: {'n_layers': 1, 'embedding_dim': 256, 'lr': 0.0028516566741058234, 'lambda_val': 0.0017059305455562248, 'batch_size': 1554, 'optimizer': 'RMSprop'}.
2026-07-06 06:34:24,153 - experiment_functions - INFO - Early stopping at epoch 1300. Best Metrics: (0.0002411329325160133, 6.17366031571149e-05, 0.00013890673599455924)
2026-07-06 06:34:24,243 - optuna.study.study - INFO - Trial 239 finished with values: [0.0002411329325160133, 6.17366031571149e-05, 0.00013890673599455924] and parameters: {'n_layers': 3, 'embedding_dim': 96, 'lr': 1.3932460239447976e-05, 'lambda_val': 9.680630831203904e-06, 'batch_size': 1692, 'optimizer': 'RMSprop'}.
2026-07-06 06:39:48,699 - optuna.study.study - INFO - Trial 240 finished with values: [0.01584020352331845, 0.0036139657694280345, 0.009250351646938399] and parameters: {'n_layers': 2, 'embedding_dim': 64, 'lr': 0.0069539644625034236, 'lambda_val': 2.412093285142066e-05, 'batch_size': 1692, 'optimizer': 'RMSprop'}.
2026-07-06 06:44:32,091 - experiment_functions - INFO - Early stopping at epoch 3500. Best Metrics: (0.01592524453093136, 0.0036196645327963833, 0.009290160175388343)
2026-07-06 06:44:32,179 - optuna.study.study - INFO - Trial 241 finished with values: [0.01592524453093136, 0.0036196645327963833, 0.009290160175388343] and parameters: {'n_layers': 1, 'embedding_dim': 96, 'lr': 0.0028516566741058234, 'lambda_val': 0.0067674206888748, 'batch_size': 2385, 'optimizer': 'RMSprop'}.
2026-07-06 06:45:20,775 - experiment_functions - INFO - Early stopping at epoch 500. Best Metrics: (0.0002472553401029277, 5.5088045894041e-05, 0.000125297138126299)
2026-07-06 06:45:20,858 - optuna.study.study - INFO - Trial 242 finished with values: [0.0002472553401029277, 5.5088045894041e-05, 0.000125297138126299] and parameters: {'n_layers': 1, 'embedding_dim': 256, 'lr': 0.0020004569205185102, 'lambda_val': 0.0007983330649980958, 'batch_size': 1749, 'optimizer': 'SGD'}.
2026-07-06 06:48:48,082 - experiment_functions - INFO - Early stopping at epoch 2400. Best Metrics: (0.014336535559216544, 0.003102026860171343, 0.008248554522125357)
2026-07-06 06:48:48,173 - optuna.study.study - INFO - Trial 243 finished with values: [0.014336535559216544, 0.003102026860171343, 0.008248554522125357] and parameters: {'n_layers': 2, 'embedding_dim': 96, 'lr': 0.006236516613152459, 'lambda_val': 1.059674657990583e-05, 'batch_size': 3299, 'optimizer': 'Adam'}.
