2026-06-29 13:20:59,157 - optuna.study.study - INFO - Trial 27 finished with values: [0.00020867361273639145, 6.173660315711492e-05, 0.00012071933260206754] and parameters: {'n_layers': 2, 'embedding_dim': 32, 'lr': 0.004199839263677167, 'lambda_val': 3.7451957208637473e-06, 'batch_size': 3639, 'optimizer': 'SGD'}.
2026-06-29 13:21:40,248 - experiment_functions - INFO - Early stopping at epoch 500. Best Metrics: (0.0002549847878761653, 6.268639705183975e-05, 0.00014956456457081632)
2026-06-29 13:21:40,333 - optuna.study.study - INFO - Trial 28 finished with values: [0.0002549847878761653, 6.268639705183975e-05, 0.00014956456457081632] and parameters: {'n_layers': 2, 'embedding_dim': 64, 'lr': 0.0006475996595311599, 'lambda_val': 0.0001800101227182521, 'batch_size': 3941, 'optimizer': 'SGD'}.
2026-06-29 13:23:14,950 - experiment_functions - INFO - Early stopping at epoch 1150. Best Metrics: (0.00031405981185165177, 0.0001386699086298273, 0.00023667513042286404)
2026-06-29 13:23:15,035 - optuna.study.study - INFO - Trial 29 finished with values: [0.00031405981185165177, 0.0001386699086298273, 0.00023667513042286404] and parameters: {'n_layers': 2, 'embedding_dim': 128, 'lr': 0.0007549780410006504, 'lambda_val': 0.06339729256067027, 'batch_size': 1999, 'optimizer': 'RMSprop'}.
2026-06-29 13:23:57,322 - experiment_functions - INFO - Early stopping at epoch 500. Best Metrics: (0.0006615745256446331, 0.00020610527515529134, 0.00045409981803717876)
2026-06-29 13:23:57,393 - optuna.study.study - INFO - Trial 30 finished with values: [0.0006615745256446331, 0.00020610527515529134, 0.00045409981803717876] and parameters: {'n_layers': 2, 'embedding_dim': 96, 'lr': 0.027994598569073718, 'lambda_val': 0.0004074220264916171, 'batch_size': 1478, 'optimizer': 'RMSprop'}.
2026-06-29 13:24:49,510 - experiment_functions - INFO - Early stopping at epoch 500. Best Metrics: (0.0002487339564744364, 5.698763368349069e-05, 0.0001477880577581752)
2026-06-29 13:24:49,581 - optuna.study.study - INFO - Trial 31 finished with values: [0.0002487339564744364, 5.698763368349069e-05, 0.0001477880577581752] and parameters: {'n_layers': 4, 'embedding_dim': 256, 'lr': 0.07945214517899378, 'lambda_val': 0.004235103893108358, 'batch_size': 3711, 'optimizer': 'SGD'}.
2026-06-29 13:25:31,545 - experiment_functions - INFO - Early stopping at epoch 500. Best Metrics: (0.00016046919873915526, 4.46403130520677e-05, 0.00010638463648278244)
2026-06-29 13:25:31,631 - optuna.study.study - INFO - Trial 32 finished with values: [0.00016046919873915526, 4.46403130520677e-05, 0.00010638463648278244] and parameters: {'n_layers': 2, 'embedding_dim': 96, 'lr': 0.0012381073692047733, 'lambda_val': 0.015150315781646618, 'batch_size': 3516, 'optimizer': 'SGD'}.
2026-06-29 13:26:31,965 - experiment_functions - INFO - Early stopping at epoch 700. Best Metrics: (0.0015015887659126654, 0.0003932146724160858, 0.0009168082802835084)
2026-06-29 13:26:32,057 - optuna.study.study - INFO - Trial 33 finished with values: [0.0015015887659126654, 0.0003932146724160858, 0.0009168082802835084] and parameters: {'n_layers': 4, 'embedding_dim': 96, 'lr': 0.0007886779079223827, 'lambda_val': 0.0004244982241785935, 'batch_size': 995, 'optimizer': 'Adam'}.
2026-06-29 13:27:20,385 - experiment_functions - INFO - Early stopping at epoch 550. Best Metrics: (0.00024348906448376273, 0.00012537279410367952, 0.00020642979438510137)
2026-06-29 13:27:20,474 - optuna.study.study - INFO - Trial 34 finished with values: [0.00024348906448376273, 0.00012537279410367952, 0.00020642979438510137] and parameters: {'n_layers': 4, 'embedding_dim': 96, 'lr': 0.02064202885573002, 'lambda_val': 0.007051881506369518, 'batch_size': 2064, 'optimizer': 'Adam'}.
2026-06-29 13:28:13,405 - experiment_functions - INFO - Early stopping at epoch 500. Best Metrics: (0.0012230466498912385, 0.0003571225044165416, 0.0008179528367226705)
2026-06-29 13:28:13,537 - optuna.study.study - INFO - Trial 35 finished with values: [0.0012230466498912385, 0.0003571225044165416, 0.0008179528367226705] and parameters: {'n_layers': 4, 'embedding_dim': 256, 'lr': 0.016122404315501142, 'lambda_val': 0.0013071970674845765, 'batch_size': 3867, 'optimizer': 'RMSprop'}.
2026-06-29 13:29:00,765 - experiment_functions - INFO - Early stopping at epoch 600. Best Metrics: (0.0026233510269720512, 0.0007284919172539558, 0.0016934169089003125)
2026-06-29 13:29:00,849 - optuna.study.study - INFO - Trial 36 finished with values: [0.0026233510269720512, 0.0007284919172539558, 0.0016934169089003125] and parameters: {'n_layers': 1, 'embedding_dim': 32, 'lr': 0.0020146212204725906, 'lambda_val': 1.3664921212013244e-05, 'batch_size': 4012, 'optimizer': 'RMSprop'}.
2026-06-29 13:29:43,112 - experiment_functions - INFO - Early stopping at epoch 500. Best Metrics: (0.00017043174145444108, 5.5088045894041e-05, 0.00010663047919391271)
2026-06-29 13:29:43,196 - optuna.study.study - INFO - Trial 37 finished with values: [0.00017043174145444108, 5.5088045894041e-05, 0.00010663047919391271] and parameters: {'n_layers': 2, 'embedding_dim': 96, 'lr': 0.09454684835980978, 'lambda_val': 0.0001374983730670942, 'batch_size': 1682, 'optimizer': 'SGD'}.
2026-06-29 13:30:23,545 - experiment_functions - INFO - Early stopping at epoch 500. Best Metrics: (0.00013934982074327462, 4.179093136789316e-05, 8.744859058236928e-05)
2026-06-29 13:30:23,675 - optuna.study.study - INFO - Trial 38 finished with values: [0.00013934982074327462, 4.179093136789316e-05, 8.744859058236928e-05] and parameters: {'n_layers': 3, 'embedding_dim': 32, 'lr': 0.022915632396432333, 'lambda_val': 0.0011184567081568432, 'batch_size': 1244, 'optimizer': 'SGD'}.
2026-06-29 13:31:43,607 - experiment_functions - INFO - Early stopping at epoch 1000. Best Metrics: (0.00022772495533868672, 6.268639705183975e-05, 0.0001310913615513513)
2026-06-29 13:31:43,738 - optuna.study.study - INFO - Trial 39 finished with values: [0.00022772495533868672, 6.268639705183975e-05, 0.0001310913615513513] and parameters: {'n_layers': 3, 'embedding_dim': 64, 'lr': 0.00025854448617997734, 'lambda_val': 0.08175195923841846, 'batch_size': 582, 'optimizer': 'Adam'}.
2026-06-29 13:32:27,409 - experiment_functions - INFO - Early stopping at epoch 550. Best Metrics: (0.00022933232732036594, 5.888722147294038e-05, 0.0001228222927266437)
2026-06-29 13:32:27,503 - optuna.study.study - INFO - Trial 40 finished with values: [0.00022933232732036594, 5.888722147294038e-05, 0.0001228222927266437] and parameters: {'n_layers': 1, 'embedding_dim': 32, 'lr': 4.52872891826316e-05, 'lambda_val': 0.009184765150279788, 'batch_size': 4046, 'optimizer': 'RMSprop'}.
2026-06-29 13:33:07,658 - experiment_functions - INFO - Early stopping at epoch 500. Best Metrics: (0.00012218921945654143, 3.799175578899379e-05, 7.148150207790016e-05)
2026-06-29 13:33:07,728 - optuna.study.study - INFO - Trial 41 finished with values: [0.00012218921945654143, 3.799175578899379e-05, 7.148150207790016e-05] and parameters: {'n_layers': 2, 'embedding_dim': 32, 'lr': 0.0072549799591822275, 'lambda_val': 2.306774332525939e-06, 'batch_size': 3817, 'optimizer': 'SGD'}.
2026-06-29 13:33:48,953 - experiment_functions - INFO - Early stopping at epoch 500. Best Metrics: (0.00024852554153010167, 6.743536652546397e-05, 0.0001442347357076024)
2026-06-29 13:33:49,041 - optuna.study.study - INFO - Trial 42 finished with values: [0.00024852554153010167, 6.743536652546397e-05, 0.0001442347357076024] and parameters: {'n_layers': 2, 'embedding_dim': 64, 'lr': 0.0008610148671532738, 'lambda_val': 7.321668982372259e-06, 'batch_size': 2023, 'optimizer': 'SGD'}.
2026-06-29 13:34:38,474 - experiment_functions - INFO - Early stopping at epoch 500. Best Metrics: (0.0002555605863119353, 7.408392378853791e-05, 0.0001550422892577661)
2026-06-29 13:34:38,569 - optuna.study.study - INFO - Trial 43 finished with values: [0.0002555605863119353, 7.408392378853791e-05, 0.0001550422892577661] and parameters: {'n_layers': 3, 'embedding_dim': 256, 'lr': 0.011256430418064723, 'lambda_val': 0.002101784363136079, 'batch_size': 2321, 'optimizer': 'SGD'}.
2026-06-29 13:35:23,060 - experiment_functions - INFO - Early stopping at epoch 500. Best Metrics: (0.00027144111167415775, 6.648557263073914e-05, 0.00014419211771233122)
2026-06-29 13:35:23,143 - optuna.study.study - INFO - Trial 44 finished with values: [0.00027144111167415775, 6.648557263073914e-05, 0.00014419211771233122] and parameters: {'n_layers': 3, 'embedding_dim': 128, 'lr': 0.017064597658571556, 'lambda_val': 3.3900229645679598e-06, 'batch_size': 1574, 'optimizer': 'SGD'}.
2026-06-29 13:36:07,180 - experiment_functions - INFO - Early stopping at epoch 500. Best Metrics: (0.00022782716961038398, 6.268639705183976e-05, 0.00013811867961991382)
2026-06-29 13:36:07,271 - optuna.study.study - INFO - Trial 45 finished with values: [0.00022782716961038398, 6.268639705183976e-05, 0.00013811867961991382] and parameters: {'n_layers': 3, 'embedding_dim': 128, 'lr': 0.00035448965689355364, 'lambda_val': 0.0002503570058262612, 'batch_size': 2320, 'optimizer': 'SGD'}.
2026-06-29 13:36:52,279 - experiment_functions - INFO - Early stopping at epoch 500. Best Metrics: (0.0001663458650676011, 4.8439488630967084e-05, 9.04189264378996e-05)
2026-06-29 13:36:52,366 - optuna.study.study - INFO - Trial 46 finished with values: [0.0001663458650676011, 4.8439488630967084e-05, 9.04189264378996e-05] and parameters: {'n_layers': 1, 'embedding_dim': 256, 'lr': 2.284639283458017e-05, 'lambda_val': 5.110509216445487e-06, 'batch_size': 3142, 'optimizer': 'SGD'}.
2026-06-29 13:37:35,281 - experiment_functions - INFO - Early stopping at epoch 500. Best Metrics: (0.00020229713519359627, 5.413825199931615e-05, 0.00011833599879187006)
2026-06-29 13:37:35,369 - optuna.study.study - INFO - Trial 47 finished with values: [0.00020229713519359627, 5.413825199931615e-05, 0.00011833599879187006] and parameters: {'n_layers': 2, 'embedding_dim': 128, 'lr': 7.16297103408976e-05, 'lambda_val': 0.012019501277095026, 'batch_size': 4065, 'optimizer': 'SGD'}.
2026-06-29 13:42:44,840 - optuna.study.study - INFO - Trial 48 finished with values: [0.00023637094501856694, 6.458598484128944e-05, 0.0001327073356576228] and parameters: {'n_layers': 1, 'embedding_dim': 128, 'lr': 0.00010781636022881619, 'lambda_val': 0.000917634231851402, 'batch_size': 1811, 'optimizer': 'Adam'}.
2026-06-29 13:43:35,016 - experiment_functions - INFO - Early stopping at epoch 600. Best Metrics: (0.00024250517630878572, 0.00012157361852478011, 0.00018303003800430602)
2026-06-29 13:43:35,115 - optuna.study.study - INFO - Trial 49 finished with values: [0.00024250517630878572, 0.00012157361852478011, 0.00018303003800430602] and parameters: {'n_layers': 2, 'embedding_dim': 96, 'lr': 0.0017983427733368042, 'lambda_val': 0.0454190417515518, 'batch_size': 1488, 'optimizer': 'RMSprop'}.
2026-06-29 13:45:23,635 - experiment_functions - INFO - Early stopping at epoch 1450. Best Metrics: (0.0004598625008696754, 0.00030203445852250064, 0.0004392730682942205)
2026-06-29 13:45:23,698 - optuna.study.study - INFO - Trial 50 finished with values: [0.0004598625008696754, 0.00030203445852250064, 0.0004392730682942205] and parameters: {'n_layers': 2, 'embedding_dim': 32, 'lr': 0.015188551974826818, 'lambda_val': 4.9806804138388375e-05, 'batch_size': 3459, 'optimizer': 'RMSprop'}.
2026-06-29 13:46:06,628 - experiment_functions - INFO - Early stopping at epoch 500. Best Metrics: (0.00021217453212638208, 6.458598484128944e-05, 0.00013519651417504374)
2026-06-29 13:46:06,693 - optuna.study.study - INFO - Trial 51 finished with values: [0.00021217453212638208, 6.458598484128944e-05, 0.00013519651417504374] and parameters: {'n_layers': 2, 'embedding_dim': 128, 'lr': 0.005466403487028649, 'lambda_val': 3.3900229645679598e-06, 'batch_size': 3775, 'optimizer': 'SGD'}.
2026-06-29 13:46:50,787 - experiment_functions - INFO - Early stopping at epoch 500. Best Metrics: (0.00018138196696051946, 4.179093136789317e-05, 9.408521433573452e-05)
2026-06-29 13:46:50,861 - optuna.study.study - INFO - Trial 52 finished with values: [0.00018138196696051946, 4.179093136789317e-05, 9.408521433573452e-05] and parameters: {'n_layers': 3, 'embedding_dim': 128, 'lr': 6.187519558446778e-05, 'lambda_val': 0.014386781210446935, 'batch_size': 1574, 'optimizer': 'SGD'}.
2026-06-29 13:49:08,109 - experiment_functions - INFO - Early stopping at epoch 1750. Best Metrics: (0.00021887059628853179, 5.508804589404098e-05, 0.00011267053057855209)
2026-06-29 13:49:08,175 - optuna.study.study - INFO - Trial 53 finished with values: [0.00021887059628853179, 5.508804589404098e-05, 0.00011267053057855209] and parameters: {'n_layers': 2, 'embedding_dim': 96, 'lr': 4.866934196735807e-05, 'lambda_val': 3.159634083184005e-05, 'batch_size': 1035, 'optimizer': 'Adam'}.
2026-06-29 13:51:17,908 - experiment_functions - INFO - Early stopping at epoch 1750. Best Metrics: (0.00033678151462799986, 0.00023269950420758693, 0.00032642863858996777)
2026-06-29 13:51:18,018 - optuna.study.study - INFO - Trial 54 finished with values: [0.00033678151462799986, 0.00023269950420758693, 0.00032642863858996777] and parameters: {'n_layers': 2, 'embedding_dim': 32, 'lr': 0.005466403487028649, 'lambda_val': 0.0045158154821205955, 'batch_size': 2365, 'optimizer': 'RMSprop'}.
2026-06-29 13:51:58,272 - experiment_functions - INFO - Early stopping at epoch 500. Best Metrics: (0.00022512536720230912, 5.1288870315141624e-05, 0.00012033972761418416)
2026-06-29 13:51:58,356 - optuna.study.study - INFO - Trial 55 finished with values: [0.00022512536720230912, 5.1288870315141624e-05, 0.00012033972761418416] and parameters: {'n_layers': 3, 'embedding_dim': 32, 'lr': 0.0020146212204725906, 'lambda_val': 0.004235103893108358, 'batch_size': 4012, 'optimizer': 'SGD'}.
2026-06-29 13:52:57,409 - experiment_functions - INFO - Early stopping at epoch 700. Best Metrics: (0.0016395297295191513, 0.000483445092414946, 0.0010231742634736788)
2026-06-29 13:52:57,500 - optuna.study.study - INFO - Trial 56 finished with values: [0.0016395297295191513, 0.000483445092414946, 0.0010231742634736788] and parameters: {'n_layers': 2, 'embedding_dim': 128, 'lr': 0.0007549780410006504, 'lambda_val': 0.002101784363136079, 'batch_size': 1999, 'optimizer': 'RMSprop'}.
2026-06-29 13:55:48,858 - experiment_functions - INFO - Early stopping at epoch 2300. Best Metrics: (0.0004342493150954151, 0.00013677032084037766, 0.0002472258640831371)
2026-06-29 13:55:48,959 - optuna.study.study - INFO - Trial 57 finished with values: [0.0004342493150954151, 0.00013677032084037766, 0.0002472258640831371] and parameters: {'n_layers': 3, 'embedding_dim': 32, 'lr': 0.0001976293616470771, 'lambda_val': 0.043836516646315986, 'batch_size': 3078, 'optimizer': 'RMSprop'}.
2026-06-29 13:56:32,351 - experiment_functions - INFO - Early stopping at epoch 500. Best Metrics: (0.0001701479624126834, 6.078680926239006e-05, 0.00010887664388209245)
2026-06-29 13:56:32,423 - optuna.study.study - INFO - Trial 58 finished with values: [0.0001701479624126834, 6.078680926239006e-05, 0.00010887664388209245] and parameters: {'n_layers': 4, 'embedding_dim': 96, 'lr': 0.002038269853150342, 'lambda_val': 1.5124002494034645e-06, 'batch_size': 779, 'optimizer': 'SGD'}.
2026-06-29 13:57:19,494 - experiment_functions - INFO - Early stopping at epoch 600. Best Metrics: (0.003105676720768234, 0.0009507436886195697, 0.002088516137769911)
2026-06-29 13:57:19,570 - optuna.study.study - INFO - Trial 59 finished with values: [0.003105676720768234, 0.0009507436886195697, 0.002088516137769911] and parameters: {'n_layers': 1, 'embedding_dim': 32, 'lr': 0.005466403487028649, 'lambda_val': 0.0004994369806250174, 'batch_size': 3775, 'optimizer': 'Adam'}.
2026-06-29 13:58:00,179 - experiment_functions - INFO - Early stopping at epoch 500. Best Metrics: (0.0006808128811638762, 0.0001671637254715727, 0.00042543601921566726)
2026-06-29 13:58:00,271 - optuna.study.study - INFO - Trial 60 finished with values: [0.0006808128811638762, 0.0001671637254715727, 0.00042543601921566726] and parameters: {'n_layers': 3, 'embedding_dim': 32, 'lr': 0.04591730982357234, 'lambda_val': 1.4166254702318954e-06, 'batch_size': 2365, 'optimizer': 'RMSprop'}.
2026-06-29 13:58:40,286 - experiment_functions - INFO - Early stopping at epoch 500. Best Metrics: (0.00026007305339259887, 5.793742757821552e-05, 0.0001296124389969345)
2026-06-29 13:58:40,374 - optuna.study.study - INFO - Trial 61 finished with values: [0.00026007305339259887, 5.793742757821552e-05, 0.0001296124389969345] and parameters: {'n_layers': 3, 'embedding_dim': 32, 'lr': 0.022915632396432333, 'lambda_val': 0.0011184567081568432, 'batch_size': 1244, 'optimizer': 'SGD'}.
2026-06-29 13:59:20,147 - experiment_functions - INFO - Early stopping at epoch 500. Best Metrics: (0.0004027229244025134, 9.877856505138387e-05, 0.00025856361457267363)
2026-06-29 13:59:20,224 - optuna.study.study - INFO - Trial 62 finished with values: [0.0004027229244025134, 9.877856505138387e-05, 0.00025856361457267363] and parameters: {'n_layers': 2, 'embedding_dim': 32, 'lr': 0.0951182596909589, 'lambda_val': 3.7451957208637473e-06, 'batch_size': 3639, 'optimizer': 'RMSprop'}.
2026-06-29 14:00:11,750 - experiment_functions - INFO - Early stopping at epoch 500. Best Metrics: (0.00021868208701835074, 5.5088045894040994e-05, 0.00012994949350011404)
2026-06-29 14:00:11,822 - optuna.study.study - INFO - Trial 63 finished with values: [0.00021868208701835074, 5.5088045894040994e-05, 0.00012994949350011404] and parameters: {'n_layers': 4, 'embedding_dim': 256, 'lr': 3.0233013705671465e-05, 'lambda_val': 0.06339729256067027, 'batch_size': 1999, 'optimizer': 'SGD'}.
2026-06-29 14:00:53,096 - experiment_functions - INFO - Early stopping at epoch 500. Best Metrics: (0.0002706815944357334, 6.838516042018883e-05, 0.00014377975893242945)
2026-06-29 14:00:53,163 - optuna.study.study - INFO - Trial 64 finished with values: [0.0002706815944357334, 6.838516042018883e-05, 0.00014377975893242945] and parameters: {'n_layers': 3, 'embedding_dim': 64, 'lr': 0.00037359951233542556, 'lambda_val': 0.007998340389978697, 'batch_size': 1797, 'optimizer': 'SGD'}.
2026-06-29 14:01:44,373 - experiment_functions - INFO - Early stopping at epoch 500. Best Metrics: (0.00024471609414993456, 6.17366031571149e-05, 0.0001489365465967819)
2026-06-29 14:01:44,457 - optuna.study.study - INFO - Trial 65 finished with values: [0.00024471609414993456, 6.17366031571149e-05, 0.0001489365465967819] and parameters: {'n_layers': 4, 'embedding_dim': 256, 'lr': 0.00876059957683057, 'lambda_val': 0.004235103893108358, 'batch_size': 3120, 'optimizer': 'SGD'}.
2026-06-29 14:02:27,671 - experiment_functions - INFO - Early stopping at epoch 500. Best Metrics: (0.00019427941175262004, 5.5088045894041e-05, 0.00010331844451308367)
2026-06-29 14:02:27,749 - optuna.study.study - INFO - Trial 66 finished with values: [0.00019427941175262004, 5.5088045894041e-05, 0.00010331844451308367] and parameters: {'n_layers': 4, 'embedding_dim': 96, 'lr': 0.0007886779079223827, 'lambda_val': 0.0004244982241785935, 'batch_size': 995, 'optimizer': 'SGD'}.
2026-06-29 14:03:34,655 - experiment_functions - INFO - Early stopping at epoch 850. Best Metrics: (0.0021099133248729117, 0.0005850730391505043, 0.0012694065064303606)
2026-06-29 14:03:34,731 - optuna.study.study - INFO - Trial 67 finished with values: [0.0021099133248729117, 0.0005850730391505043, 0.0012694065064303606] and parameters: {'n_layers': 2, 'embedding_dim': 64, 'lr': 0.0006475996595311599, 'lambda_val': 6.062226724528523e-06, 'batch_size': 3941, 'optimizer': 'Adam'}.
2026-06-29 14:04:26,944 - experiment_functions - INFO - Early stopping at epoch 500. Best Metrics: (0.0013001448600005322, 0.0003780179701004882, 0.0008695371535204596)
2026-06-29 14:04:27,030 - optuna.study.study - INFO - Trial 68 finished with values: [0.0013001448600005322, 0.0003780179701004882, 0.0008695371535204596] and parameters: {'n_layers': 4, 'embedding_dim': 256, 'lr': 0.016122404315501142, 'lambda_val': 0.0002503570058262612, 'batch_size': 2320, 'optimizer': 'RMSprop'}.
2026-06-29 14:10:36,330 - optuna.study.study - INFO - Trial 69 finished with values: [0.00040556567315878445, 0.00010637691620918262, 0.00023114593482398557] and parameters: {'n_layers': 3, 'embedding_dim': 256, 'lr': 4.5882747189392185e-05, 'lambda_val': 1.4166254702318954e-06, 'batch_size': 2365, 'optimizer': 'RMSprop'}.
2026-06-29 14:11:52,071 - experiment_functions - INFO - Early stopping at epoch 950. Best Metrics: (0.0004315319988837998, 0.00026119332104933225, 0.0004042048553234739)
2026-06-29 14:11:52,169 - optuna.study.study - INFO - Trial 70 finished with values: [0.0004315319988837998, 0.00026119332104933225, 0.0004042048553234739] and parameters: {'n_layers': 3, 'embedding_dim': 64, 'lr': 0.02761939993756294, 'lambda_val': 1.5359911139419394e-06, 'batch_size': 2584, 'optimizer': 'Adam'}.
2026-06-29 14:12:42,206 - experiment_functions - INFO - Early stopping at epoch 500. Best Metrics: (0.001350170015450626, 0.00045780065725737517, 0.0009412882395773161)
2026-06-29 14:12:42,280 - optuna.study.study - INFO - Trial 71 finished with values: [0.001350170015450626, 0.00045780065725737517, 0.0009412882395773161] and parameters: {'n_layers': 3, 'embedding_dim': 256, 'lr': 0.0951182596909589, 'lambda_val': 6.062226724528523e-06, 'batch_size': 831, 'optimizer': 'RMSprop'}.
2026-06-29 14:13:23,981 - experiment_functions - INFO - Early stopping at epoch 500. Best Metrics: (0.00019732201257869163, 5.0339076420416775e-05, 0.00012049513858036724)
