2026-06-29 17:35:26,737 - optuna.study.study - INFO - Trial 208 finished with values: [0.0023752823855851418, 0.0006867009858860627, 0.0014491411663696049] and parameters: {'n_layers': 2, 'embedding_dim': 96, 'lr': 0.0013135077251507194, 'lambda_val': 0.0004244982241785935, 'batch_size': 1478, 'optimizer': 'Adam'}.
2026-06-29 17:39:58,905 - experiment_functions - INFO - Early stopping at epoch 3500. Best Metrics: (0.00319151303347706, 0.0010314761696711813, 0.002175294738153366)
2026-06-29 17:39:59,057 - optuna.study.study - INFO - Trial 209 finished with values: [0.00319151303347706, 0.0010314761696711813, 0.002175294738153366] and parameters: {'n_layers': 1, 'embedding_dim': 128, 'lr': 0.0007556847336647807, 'lambda_val': 0.00018778243941196433, 'batch_size': 1473, 'optimizer': 'Adam'}.
2026-06-29 17:40:49,752 - experiment_functions - INFO - Early stopping at epoch 600. Best Metrics: (0.002900706334960513, 0.0009896852383032883, 0.002022637910395901)
2026-06-29 17:40:49,852 - optuna.study.study - INFO - Trial 210 finished with values: [0.002900706334960513, 0.0009896852383032883, 0.002022637910395901] and parameters: {'n_layers': 1, 'embedding_dim': 128, 'lr': 0.005466403487028649, 'lambda_val': 0.0008172053117174909, 'batch_size': 2498, 'optimizer': 'Adam'}.
2026-06-29 17:41:40,342 - experiment_functions - INFO - Early stopping at epoch 600. Best Metrics: (0.002783214909531442, 0.000911802138935851, 0.001974065732218273)
2026-06-29 17:41:40,443 - optuna.study.study - INFO - Trial 211 finished with values: [0.002783214909531442, 0.000911802138935851, 0.001974065732218273] and parameters: {'n_layers': 1, 'embedding_dim': 128, 'lr': 0.005466403487028649, 'lambda_val': 0.0005944842242671787, 'batch_size': 1999, 'optimizer': 'Adam'}.
2026-06-29 17:44:10,240 - experiment_functions - INFO - Early stopping at epoch 1900. Best Metrics: (0.003081224329987725, 0.0009478943069353951, 0.0020398652228363684)
2026-06-29 17:44:10,346 - optuna.study.study - INFO - Trial 212 finished with values: [0.003081224329987725, 0.0009478943069353951, 0.0020398652228363684] and parameters: {'n_layers': 1, 'embedding_dim': 128, 'lr': 0.0007886779079223827, 'lambda_val': 0.0004468421098360447, 'batch_size': 1304, 'optimizer': 'Adam'}.
2026-06-29 17:45:18,063 - experiment_functions - INFO - Early stopping at epoch 850. Best Metrics: (0.00024297201567274591, 5.603783978876584e-05, 0.0001299259036620507)
2026-06-29 17:45:18,188 - optuna.study.study - INFO - Trial 213 finished with values: [0.00024297201567274591, 5.603783978876584e-05, 0.0001299259036620507] and parameters: {'n_layers': 1, 'embedding_dim': 96, 'lr': 5.57344210168341e-05, 'lambda_val': 0.0004244982241785935, 'batch_size': 1811, 'optimizer': 'Adam'}.
2026-06-29 17:46:42,133 - experiment_functions - INFO - Early stopping at epoch 900. Best Metrics: (0.0023887507473117934, 0.000721843359990882, 0.0015474733574541402)
2026-06-29 17:46:42,241 - optuna.study.study - INFO - Trial 214 finished with values: [0.0023887507473117934, 0.000721843359990882, 0.0015474733574541402] and parameters: {'n_layers': 2, 'embedding_dim': 256, 'lr': 0.0007886779079223827, 'lambda_val': 1.3664921212013244e-05, 'batch_size': 1811, 'optimizer': 'Adam'}.
2026-06-29 17:47:23,878 - experiment_functions - INFO - Early stopping at epoch 500. Best Metrics: (0.00019678707824364135, 5.1288870315141624e-05, 0.00010820113939745372)
2026-06-29 17:47:24,029 - optuna.study.study - INFO - Trial 215 finished with values: [0.00019678707824364135, 5.1288870315141624e-05, 0.00010820113939745372] and parameters: {'n_layers': 1, 'embedding_dim': 128, 'lr': 0.0035216428821725973, 'lambda_val': 0.00033189470931703025, 'batch_size': 1304, 'optimizer': 'SGD'}.
2026-06-29 17:48:43,564 - experiment_functions - INFO - Early stopping at epoch 950. Best Metrics: (0.0024875496916669034, 0.000734190680622305, 0.0016670886613142962)
2026-06-29 17:48:43,692 - optuna.study.study - INFO - Trial 216 finished with values: [0.0024875496916669034, 0.000734190680622305, 0.0016670886613142962] and parameters: {'n_layers': 2, 'embedding_dim': 128, 'lr': 0.0007556847336647807, 'lambda_val': 0.00018778243941196433, 'batch_size': 1473, 'optimizer': 'Adam'}.
2026-06-29 17:50:39,357 - experiment_functions - INFO - Early stopping at epoch 1550. Best Metrics: (0.0028907113582645775, 0.0008491157418840113, 0.0019427032984039164)
2026-06-29 17:50:39,456 - optuna.study.study - INFO - Trial 217 finished with values: [0.0028907113582645775, 0.0008491157418840113, 0.0019427032984039164] and parameters: {'n_layers': 1, 'embedding_dim': 32, 'lr': 0.0007886779079223827, 'lambda_val': 1.5539366984973123e-06, 'batch_size': 3775, 'optimizer': 'Adam'}.
2026-06-29 17:52:24,909 - experiment_functions - INFO - Early stopping at epoch 1350. Best Metrics: (0.0030113349534977188, 0.0009137017267253006, 0.002013290811404479)
2026-06-29 17:52:25,018 - optuna.study.study - INFO - Trial 218 finished with values: [0.0030113349534977188, 0.0009137017267253006, 0.002013290811404479] and parameters: {'n_layers': 1, 'embedding_dim': 96, 'lr': 0.0007556847336647807, 'lambda_val': 0.0004244982241785935, 'batch_size': 1473, 'optimizer': 'Adam'}.
2026-06-29 17:54:13,716 - experiment_functions - INFO - Early stopping at epoch 1400. Best Metrics: (0.002870838152758588, 0.0008918564671466292, 0.0019073883579991137)
2026-06-29 17:54:13,819 - optuna.study.study - INFO - Trial 219 finished with values: [0.002870838152758588, 0.0008918564671466292, 0.0019073883579991137] and parameters: {'n_layers': 1, 'embedding_dim': 96, 'lr': 0.0006475996595311599, 'lambda_val': 0.0004244982241785935, 'batch_size': 2146, 'optimizer': 'RMSprop'}.
2026-06-29 17:59:05,284 - optuna.study.study - INFO - Trial 220 finished with values: [0.0007244744892551145, 0.00019470774841859318, 0.00044389253734476144] and parameters: {'n_layers': 2, 'embedding_dim': 32, 'lr': 0.0001296646404679051, 'lambda_val': 3.159634083184005e-05, 'batch_size': 1478, 'optimizer': 'RMSprop'}.
2026-06-29 18:01:00,827 - experiment_functions - INFO - Early stopping at epoch 1450. Best Metrics: (0.0031706144841278845, 0.0009478943069353949, 0.002141720212091718)
2026-06-29 18:01:00,933 - optuna.study.study - INFO - Trial 221 finished with values: [0.0031706144841278845, 0.0009478943069353949, 0.002141720212091718] and parameters: {'n_layers': 1, 'embedding_dim': 128, 'lr': 0.0007556847336647807, 'lambda_val': 3.159634083184005e-05, 'batch_size': 1811, 'optimizer': 'Adam'}.
2026-06-29 18:05:52,401 - optuna.study.study - INFO - Trial 222 finished with values: [0.003595215829411711, 0.0009630910092509925, 0.0022770657002491234] and parameters: {'n_layers': 1, 'embedding_dim': 32, 'lr': 0.0007886779079223827, 'lambda_val': 6.144456630757942e-06, 'batch_size': 1304, 'optimizer': 'Adam'}.
2026-06-29 18:08:15,480 - experiment_functions - INFO - Early stopping at epoch 1850. Best Metrics: (0.0029902541464106465, 0.0009649905970404424, 0.002109430678430235)
2026-06-29 18:08:15,584 - optuna.study.study - INFO - Trial 223 finished with values: [0.0029902541464106465, 0.0009649905970404424, 0.002109430678430235] and parameters: {'n_layers': 1, 'embedding_dim': 96, 'lr': 0.0006475996595311599, 'lambda_val': 3.159634083184005e-05, 'batch_size': 3561, 'optimizer': 'Adam'}.
2026-06-29 18:09:20,290 - experiment_functions - INFO - Early stopping at epoch 800. Best Metrics: (0.002903008806140526, 0.0009099025511464012, 0.0020213489835905385)
2026-06-29 18:09:20,436 - optuna.study.study - INFO - Trial 224 finished with values: [0.002903008806140526, 0.0009099025511464012, 0.0020213489835905385] and parameters: {'n_layers': 1, 'embedding_dim': 96, 'lr': 0.0013135077251507194, 'lambda_val': 2.0353666375564097e-05, 'batch_size': 3898, 'optimizer': 'Adam'}.
2026-06-29 18:11:08,430 - experiment_functions - INFO - Early stopping at epoch 1450. Best Metrics: (0.0033019193621046396, 0.0009383963679881466, 0.002163149874217681)
2026-06-29 18:11:08,535 - optuna.study.study - INFO - Trial 225 finished with values: [0.0033019193621046396, 0.0009383963679881466, 0.002163149874217681] and parameters: {'n_layers': 1, 'embedding_dim': 32, 'lr': 0.0007886779079223827, 'lambda_val': 0.0004244982241785935, 'batch_size': 1811, 'optimizer': 'Adam'}.
2026-06-29 18:12:12,358 - experiment_functions - INFO - Early stopping at epoch 750. Best Metrics: (0.002085200636073534, 0.0006458598484128944, 0.001385346799834559)
2026-06-29 18:12:12,514 - optuna.study.study - INFO - Trial 226 finished with values: [0.002085200636073534, 0.0006458598484128944, 0.001385346799834559] and parameters: {'n_layers': 2, 'embedding_dim': 128, 'lr': 0.0007556847336647807, 'lambda_val': 0.002101784363136079, 'batch_size': 2428, 'optimizer': 'Adam'}.
2026-06-29 18:13:02,806 - experiment_functions - INFO - Early stopping at epoch 600. Best Metrics: (0.002947097542892412, 0.0009640408031457174, 0.001999282814384702)
2026-06-29 18:13:02,914 - optuna.study.study - INFO - Trial 227 finished with values: [0.002947097542892412, 0.0009640408031457174, 0.001999282814384702] and parameters: {'n_layers': 1, 'embedding_dim': 128, 'lr': 0.005466403487028649, 'lambda_val': 6.579378672773439e-05, 'batch_size': 1999, 'optimizer': 'Adam'}.
2026-06-29 18:15:50,313 - experiment_functions - INFO - Early stopping at epoch 1950. Best Metrics: (0.0030033888381053343, 0.001003932146724161, 0.0021447795503145724)
2026-06-29 18:15:50,391 - optuna.study.study - INFO - Trial 228 finished with values: [0.0030033888381053343, 0.001003932146724161, 0.0021447795503145724] and parameters: {'n_layers': 1, 'embedding_dim': 256, 'lr': 0.0006475996595311599, 'lambda_val': 0.0004244982241785935, 'batch_size': 1940, 'optimizer': 'Adam'}.
2026-06-29 18:16:31,875 - experiment_functions - INFO - Early stopping at epoch 500. Best Metrics: (0.0003227404908528869, 7.123454210436335e-05, 0.00017318452060385094)
2026-06-29 18:16:31,994 - optuna.study.study - INFO - Trial 229 finished with values: [0.0003227404908528869, 7.123454210436335e-05, 0.00017318452060385094] and parameters: {'n_layers': 1, 'embedding_dim': 96, 'lr': 0.0006475996595311599, 'lambda_val': 0.0001800101227182521, 'batch_size': 3561, 'optimizer': 'SGD'}.
2026-06-29 18:17:47,415 - experiment_functions - INFO - Early stopping at epoch 900. Best Metrics: (0.0023308389387457066, 0.0007360902684117547, 0.0014848060053377328)
2026-06-29 18:17:47,495 - optuna.study.study - INFO - Trial 230 finished with values: [0.0023308389387457066, 0.0007360902684117547, 0.0014848060053377328] and parameters: {'n_layers': 2, 'embedding_dim': 128, 'lr': 0.0007556847336647807, 'lambda_val': 0.0004156717015337369, 'batch_size': 1811, 'optimizer': 'Adam'}.
2026-06-29 18:19:08,593 - experiment_functions - INFO - Early stopping at epoch 1000. Best Metrics: (0.002864496643453451, 0.0008985050244097032, 0.0018993822513871778)
2026-06-29 18:19:08,693 - optuna.study.study - INFO - Trial 231 finished with values: [0.002864496643453451, 0.0008985050244097032, 0.0018993822513871778] and parameters: {'n_layers': 1, 'embedding_dim': 128, 'lr': 0.0007886779079223827, 'lambda_val': 0.0001464766902440311, 'batch_size': 3775, 'optimizer': 'Adam'}.
2026-06-29 18:21:10,726 - experiment_functions - INFO - Early stopping at epoch 1500. Best Metrics: (0.0005463007189185006, 0.0003628212677848907, 0.0005143137827051725)
2026-06-29 18:21:10,831 - optuna.study.study - INFO - Trial 232 finished with values: [0.0005463007189185006, 0.0003628212677848907, 0.0005143137827051725] and parameters: {'n_layers': 2, 'embedding_dim': 128, 'lr': 0.005051802596702307, 'lambda_val': 0.00033969921116222085, 'batch_size': 3561, 'optimizer': 'RMSprop'}.
2026-06-29 18:22:55,271 - experiment_functions - INFO - Early stopping at epoch 1400. Best Metrics: (0.003349155370991839, 0.0009279486351461733, 0.002113315884173935)
2026-06-29 18:22:55,377 - optuna.study.study - INFO - Trial 233 finished with values: [0.003349155370991839, 0.0009279486351461733, 0.002113315884173935] and parameters: {'n_layers': 1, 'embedding_dim': 32, 'lr': 0.0007886779079223827, 'lambda_val': 0.0004244982241785935, 'batch_size': 1811, 'optimizer': 'RMSprop'}.
2026-06-29 18:23:35,976 - experiment_functions - INFO - Early stopping at epoch 500. Best Metrics: (0.00020460870823396475, 5.318845810459131e-05, 0.00011913842772657911)
2026-06-29 18:23:36,165 - optuna.study.study - INFO - Trial 234 finished with values: [0.00020460870823396475, 5.318845810459131e-05, 0.00011913842772657911] and parameters: {'n_layers': 4, 'embedding_dim': 32, 'lr': 0.04591730982357234, 'lambda_val': 0.0002503570058262612, 'batch_size': 1478, 'optimizer': 'SGD'}.
2026-06-29 18:25:51,565 - experiment_functions - INFO - Early stopping at epoch 1750. Best Metrics: (0.0033348375362711627, 0.0009754383298824156, 0.0021561229162370575)
2026-06-29 18:25:51,668 - optuna.study.study - INFO - Trial 235 finished with values: [0.0033348375362711627, 0.0009754383298824156, 0.0021561229162370575] and parameters: {'n_layers': 1, 'embedding_dim': 96, 'lr': 0.0007886779079223827, 'lambda_val': 1.0392013695958279e-05, 'batch_size': 1304, 'optimizer': 'Adam'}.
2026-06-29 18:26:58,729 - experiment_functions - INFO - Early stopping at epoch 850. Best Metrics: (0.0009062513258585704, 0.0002421974431548354, 0.0005925906770416071)
2026-06-29 18:26:58,830 - optuna.study.study - INFO - Trial 236 finished with values: [0.0009062513258585704, 0.0002421974431548354, 0.0005925906770416071] and parameters: {'n_layers': 4, 'embedding_dim': 32, 'lr': 0.0006475996595311599, 'lambda_val': 5.309427644018964e-06, 'batch_size': 3561, 'optimizer': 'Adam'}.
2026-06-29 18:30:30,484 - experiment_functions - INFO - Early stopping at epoch 2700. Best Metrics: (0.0032593610392621045, 0.0010514218414604032, 0.0022640735313573606)
2026-06-29 18:30:30,646 - optuna.study.study - INFO - Trial 237 finished with values: [0.0032593610392621045, 0.0010514218414604032, 0.0022640735313573606] and parameters: {'n_layers': 1, 'embedding_dim': 128, 'lr': 0.0007556847336647807, 'lambda_val': 3.159634083184005e-05, 'batch_size': 1473, 'optimizer': 'Adam'}.
2026-06-29 18:32:29,233 - experiment_functions - INFO - Early stopping at epoch 1500. Best Metrics: (0.003369362259154716, 0.000936496780198697, 0.00223912812802946)
2026-06-29 18:32:29,338 - optuna.study.study - INFO - Trial 238 finished with values: [0.003369362259154716, 0.000936496780198697, 0.00223912812802946] and parameters: {'n_layers': 1, 'embedding_dim': 128, 'lr': 0.0007886779079223827, 'lambda_val': 0.0004244982241785935, 'batch_size': 605, 'optimizer': 'RMSprop'}.
2026-06-29 18:33:35,123 - experiment_functions - INFO - Early stopping at epoch 800. Best Metrics: (0.00217118358115668, 0.0006335125277814714, 0.0013753795818648488)
2026-06-29 18:33:35,229 - optuna.study.study - INFO - Trial 239 finished with values: [0.00217118358115668, 0.0006335125277814714, 0.0013753795818648488] and parameters: {'n_layers': 2, 'embedding_dim': 96, 'lr': 0.0007556847336647807, 'lambda_val': 9.735276139088454e-06, 'batch_size': 2062, 'optimizer': 'Adam'}.
2026-06-29 18:35:10,410 - experiment_functions - INFO - Early stopping at epoch 1150. Best Metrics: (0.0022296891870721798, 0.0007009478943069355, 0.0014584687548095674)
2026-06-29 18:35:10,558 - optuna.study.study - INFO - Trial 240 finished with values: [0.0022296891870721798, 0.0007009478943069355, 0.0014584687548095674] and parameters: {'n_layers': 2, 'embedding_dim': 128, 'lr': 0.0007556847336647807, 'lambda_val': 3.159634083184005e-05, 'batch_size': 1478, 'optimizer': 'Adam'}.
2026-06-29 18:38:02,126 - experiment_functions - INFO - Early stopping at epoch 2000. Best Metrics: (0.0028367290722711197, 0.0009260490473567234, 0.002010354436885677)
2026-06-29 18:38:02,235 - optuna.study.study - INFO - Trial 241 finished with values: [0.0028367290722711197, 0.0009260490473567234, 0.002010354436885677] and parameters: {'n_layers': 1, 'embedding_dim': 256, 'lr': 0.0007556847336647807, 'lambda_val': 0.0004244982241785935, 'batch_size': 911, 'optimizer': 'Adam'}.
2026-06-29 18:39:11,507 - experiment_functions - INFO - Early stopping at epoch 900. Best Metrics: (0.001995245212037246, 0.0005822236574663298, 0.0012101240021276044)
2026-06-29 18:39:11,625 - optuna.study.study - INFO - Trial 242 finished with values: [0.001995245212037246, 0.0005822236574663298, 0.0012101240021276044] and parameters: {'n_layers': 2, 'embedding_dim': 32, 'lr': 0.0007556847336647807, 'lambda_val': 0.0004244982241785935, 'batch_size': 1967, 'optimizer': 'Adam'}.
2026-06-29 18:39:56,236 - experiment_functions - INFO - Early stopping at epoch 500. Best Metrics: (0.0001429957553636961, 3.894154968371863e-05, 7.167169721915176e-05)
2026-06-29 18:39:56,353 - optuna.study.study - INFO - Trial 243 finished with values: [0.0001429957553636961, 3.894154968371863e-05, 7.167169721915176e-05] and parameters: {'n_layers': 1, 'embedding_dim': 256, 'lr': 0.0007886779079223827, 'lambda_val': 0.0004244982241785935, 'batch_size': 1940, 'optimizer': 'SGD'}.
2026-06-29 18:41:21,457 - experiment_functions - INFO - Early stopping at epoch 1050. Best Metrics: (0.0027412249568200112, 0.0009222498717778243, 0.0019031781095946272)
2026-06-29 18:41:21,560 - optuna.study.study - INFO - Trial 244 finished with values: [0.0027412249568200112, 0.0009222498717778243, 0.0019031781095946272] and parameters: {'n_layers': 1, 'embedding_dim': 128, 'lr': 0.0007556847336647807, 'lambda_val': 0.0005944842242671787, 'batch_size': 3940, 'optimizer': 'Adam'}.
2026-06-29 18:42:22,116 - experiment_functions - INFO - Early stopping at epoch 750. Best Metrics: (0.002544134036728805, 0.0008054252227266683, 0.0016655835207885312)
2026-06-29 18:42:22,277 - optuna.study.study - INFO - Trial 245 finished with values: [0.002544134036728805, 0.0008054252227266683, 0.0016655835207885312] and parameters: {'n_layers': 1, 'embedding_dim': 96, 'lr': 0.0007556847336647807, 'lambda_val': 0.002101784363136079, 'batch_size': 4033, 'optimizer': 'RMSprop'}.
2026-06-29 18:43:29,887 - experiment_functions - INFO - Early stopping at epoch 750. Best Metrics: (0.003174434454460645, 0.000990635032198013, 0.002151841459993033)
2026-06-29 18:43:30,004 - optuna.study.study - INFO - Trial 246 finished with values: [0.003174434454460645, 0.000990635032198013, 0.002151841459993033] and parameters: {'n_layers': 1, 'embedding_dim': 256, 'lr': 0.0013135077251507194, 'lambda_val': 0.0005944842242671787, 'batch_size': 3898, 'optimizer': 'Adam'}.
2026-06-29 18:44:53,156 - experiment_functions - INFO - Early stopping at epoch 1000. Best Metrics: (0.0025397785901245386, 0.0007455882073590031, 0.0016416438202862395)
2026-06-29 18:44:53,276 - optuna.study.study - INFO - Trial 247 finished with values: [0.0025397785901245386, 0.0007455882073590031, 0.0016416438202862395] and parameters: {'n_layers': 2, 'embedding_dim': 128, 'lr': 0.0007556847336647807, 'lambda_val': 3.159634083184005e-05, 'batch_size': 1473, 'optimizer': 'Adam'}.
2026-06-29 18:46:39,010 - experiment_functions - INFO - Early stopping at epoch 1350. Best Metrics: (0.0005812497559794007, 0.0003029842524172255, 0.000465478994579921)
2026-06-29 18:46:39,164 - optuna.study.study - INFO - Trial 248 finished with values: [0.0005812497559794007, 0.0003029842524172255, 0.000465478994579921] and parameters: {'n_layers': 3, 'embedding_dim': 64, 'lr': 0.005051802596702307, 'lambda_val': 1.3664921212013244e-05, 'batch_size': 1811, 'optimizer': 'RMSprop'}.
2026-06-29 18:48:13,583 - experiment_functions - INFO - Early stopping at epoch 1200. Best Metrics: (0.0026462601723539095, 0.0008405675968314877, 0.0017136875071252944)
2026-06-29 18:48:13,705 - optuna.study.study - INFO - Trial 249 finished with values: [0.0026462601723539095, 0.0008405675968314877, 0.0017136875071252944] and parameters: {'n_layers': 1, 'embedding_dim': 96, 'lr': 0.0006475996595311599, 'lambda_val': 0.0012630378471499039, 'batch_size': 3561, 'optimizer': 'Adam'}.
2026-06-29 18:49:49,499 - experiment_functions - INFO - Early stopping at epoch 1200. Best Metrics: (0.003178254864521243, 0.0009687897726193416, 0.0021347799839027005)
2026-06-29 18:49:49,643 - optuna.study.study - INFO - Trial 250 finished with values: [0.003178254864521243, 0.0009687897726193416, 0.0021347799839027005] and parameters: {'n_layers': 1, 'embedding_dim': 128, 'lr': 0.0007886779079223827, 'lambda_val': 0.0004244982241785935, 'batch_size': 1556, 'optimizer': 'RMSprop'}.
2026-06-29 18:50:56,920 - experiment_functions - INFO - Early stopping at epoch 800. Best Metrics: (0.0018746732540661213, 0.0005432821077826113, 0.001232475082068907)
2026-06-29 18:50:57,028 - optuna.study.study - INFO - Trial 251 finished with values: [0.0018746732540661213, 0.0005432821077826113, 0.001232475082068907] and parameters: {'n_layers': 3, 'embedding_dim': 96, 'lr': 0.0007556847336647807, 'lambda_val': 1.3664921212013244e-05, 'batch_size': 1473, 'optimizer': 'Adam'}.
2026-06-29 18:51:47,554 - experiment_functions - INFO - Early stopping at epoch 600. Best Metrics: (0.0030462704066731667, 0.0009697395665140664, 0.0020724978159858865)
2026-06-29 18:51:47,660 - optuna.study.study - INFO - Trial 252 finished with values: [0.0030462704066731667, 0.0009697395665140664, 0.0020724978159858865] and parameters: {'n_layers': 1, 'embedding_dim': 128, 'lr': 0.005466403487028649, 'lambda_val': 0.0004244982241785935, 'batch_size': 1999, 'optimizer': 'Adam'}.
2026-06-29 18:55:38,689 - experiment_functions - INFO - Early stopping at epoch 2950. Best Metrics: (0.002739122459521652, 0.0009545428641984689, 0.0020070087136124974)
