2026-07-02 06:52:35,510 - optuna.study.study - INFO - Trial 176 finished with values: [0.003036324875450399, 0.0008510153296734609, 0.002058444747814419] and parameters: {'n_layers': 3, 'embedding_dim': 128, 'lr': 0.0014374939555211086, 'lambda_val': 2.188289071859108e-05, 'batch_size': 1298, 'optimizer': 'RMSprop'}.
2026-07-02 06:53:28,988 - experiment_functions - INFO - Early stopping at epoch 600. Best Metrics: (0.0019108485157939877, 0.0005660771612560076, 0.001327535364000295)
2026-07-02 06:53:29,074 - optuna.study.study - INFO - Trial 177 finished with values: [0.0019108485157939877, 0.0005660771612560076, 0.001327535364000295] and parameters: {'n_layers': 4, 'embedding_dim': 96, 'lr': 0.01321022891213974, 'lambda_val': 0.00010877216929113007, 'batch_size': 3798, 'optimizer': 'Adam'}.
2026-07-02 06:58:51,710 - optuna.study.study - INFO - Trial 178 finished with values: [0.0013657014114996195, 0.0003267290997853466, 0.0008792257382423236] and parameters: {'n_layers': 3, 'embedding_dim': 96, 'lr': 0.0002889968108070523, 'lambda_val': 1.5990539279825177e-06, 'batch_size': 3027, 'optimizer': 'Adam'}.
2026-07-02 06:59:41,007 - experiment_functions - INFO - Early stopping at epoch 550. Best Metrics: (0.0014300280484404195, 0.0003865661151530118, 0.0009972094309943756)
2026-07-02 06:59:41,083 - optuna.study.study - INFO - Trial 179 finished with values: [0.0014300280484404195, 0.0003865661151530118, 0.0009972094309943756] and parameters: {'n_layers': 4, 'embedding_dim': 96, 'lr': 0.06513265335336567, 'lambda_val': 1.0477656620736208e-06, 'batch_size': 3749, 'optimizer': 'RMSprop'}.
2026-07-02 07:00:43,823 - experiment_functions - INFO - Early stopping at epoch 750. Best Metrics: (0.002563467009696152, 0.0007104458332541838, 0.0017093769978188658)
2026-07-02 07:00:43,916 - optuna.study.study - INFO - Trial 180 finished with values: [0.002563467009696152, 0.0007104458332541838, 0.0017093769978188658] and parameters: {'n_layers': 4, 'embedding_dim': 64, 'lr': 0.003175598950751376, 'lambda_val': 0.00024499244831156216, 'batch_size': 2302, 'optimizer': 'RMSprop'}.
2026-07-02 07:01:35,499 - experiment_functions - INFO - Early stopping at epoch 550. Best Metrics: (0.0016698801853054332, 0.00048724426799384534, 0.001162746892860247)
2026-07-02 07:01:35,622 - optuna.study.study - INFO - Trial 181 finished with values: [0.0016698801853054332, 0.00048724426799384534, 0.001162746892860247] and parameters: {'n_layers': 4, 'embedding_dim': 128, 'lr': 0.056177353679575485, 'lambda_val': 4.0508714922137996e-06, 'batch_size': 924, 'optimizer': 'Adam'}.
2026-07-02 07:02:25,378 - experiment_functions - INFO - Early stopping at epoch 550. Best Metrics: (0.0016164554504828417, 0.0004948426191516441, 0.0010944857478991387)
2026-07-02 07:02:25,471 - optuna.study.study - INFO - Trial 182 finished with values: [0.0016164554504828417, 0.0004948426191516441, 0.0010944857478991387] and parameters: {'n_layers': 3, 'embedding_dim': 128, 'lr': 0.004562468343132884, 'lambda_val': 0.008265752694310466, 'batch_size': 2880, 'optimizer': 'RMSprop'}.
2026-07-02 07:07:13,864 - experiment_functions - INFO - Early stopping at epoch 3800. Best Metrics: (0.0018930391518811223, 0.00044640313052067706, 0.0011578549545679156)
2026-07-02 07:07:13,941 - optuna.study.study - INFO - Trial 183 finished with values: [0.0018930391518811223, 0.00044640313052067706, 0.0011578549545679156] and parameters: {'n_layers': 2, 'embedding_dim': 64, 'lr': 0.0005054275041431983, 'lambda_val': 1.3509843414861852e-06, 'batch_size': 3579, 'optimizer': 'Adam'}.
2026-07-02 07:07:55,193 - experiment_functions - INFO - Early stopping at epoch 500. Best Metrics: (0.0002660289944583382, 6.458598484128944e-05, 0.0001526245109779751)
2026-07-02 07:07:55,326 - optuna.study.study - INFO - Trial 184 finished with values: [0.0002660289944583382, 6.458598484128944e-05, 0.0001526245109779751] and parameters: {'n_layers': 1, 'embedding_dim': 96, 'lr': 0.00042777516068918454, 'lambda_val': 0.00031903142585685315, 'batch_size': 1280, 'optimizer': 'SGD'}.
2026-07-02 07:09:29,390 - experiment_functions - INFO - Early stopping at epoch 1100. Best Metrics: (0.0027109232102293644, 0.0008111239860950175, 0.0018258527240892683)
2026-07-02 07:09:29,465 - optuna.study.study - INFO - Trial 185 finished with values: [0.0027109232102293644, 0.0008111239860950175, 0.0018258527240892683] and parameters: {'n_layers': 4, 'embedding_dim': 96, 'lr': 0.0028258902906977677, 'lambda_val': 1.0477656620736208e-06, 'batch_size': 2099, 'optimizer': 'RMSprop'}.
2026-07-02 07:11:34,260 - experiment_functions - INFO - Early stopping at epoch 1650. Best Metrics: (0.0011941576869088806, 0.00040746158083695836, 0.0008519737030159587)
2026-07-02 07:11:34,500 - optuna.study.study - INFO - Trial 186 finished with values: [0.0011941576869088806, 0.00040746158083695836, 0.0008519737030159587] and parameters: {'n_layers': 1, 'embedding_dim': 64, 'lr': 0.06668313223783916, 'lambda_val': 0.00644136210147127, 'batch_size': 2302, 'optimizer': 'RMSprop'}.
2026-07-02 07:12:21,180 - experiment_functions - INFO - Early stopping at epoch 550. Best Metrics: (0.001026172179260845, 0.00029348631346997706, 0.0007708191256882808)
2026-07-02 07:12:21,262 - optuna.study.study - INFO - Trial 187 finished with values: [0.001026172179260845, 0.00029348631346997706, 0.0007708191256882808] and parameters: {'n_layers': 1, 'embedding_dim': 128, 'lr': 0.04341824847785206, 'lambda_val': 4.931381588268726e-06, 'batch_size': 3443, 'optimizer': 'Adam'}.
2026-07-02 07:17:30,474 - optuna.study.study - INFO - Trial 188 finished with values: [0.0034909569532580753, 0.000947894306935395, 0.002341765347390728] and parameters: {'n_layers': 3, 'embedding_dim': 64, 'lr': 0.0014374939555211086, 'lambda_val': 2.188289071859108e-05, 'batch_size': 539, 'optimizer': 'RMSprop'}.
2026-07-02 07:21:55,057 - experiment_functions - INFO - Early stopping at epoch 3500. Best Metrics: (0.0003660914799920889, 9.592918336720931e-05, 0.000208003710151415)
2026-07-02 07:21:55,179 - optuna.study.study - INFO - Trial 189 finished with values: [0.0003660914799920889, 9.592918336720931e-05, 0.000208003710151415] and parameters: {'n_layers': 2, 'embedding_dim': 64, 'lr': 8.224841275543935e-05, 'lambda_val': 0.0006325039773618912, 'batch_size': 3842, 'optimizer': 'RMSprop'}.
2026-07-02 07:24:10,126 - experiment_functions - INFO - Early stopping at epoch 1700. Best Metrics: (0.002041624717885124, 0.0005974203597819273, 0.0014176365512460275)
2026-07-02 07:24:10,237 - optuna.study.study - INFO - Trial 190 finished with values: [0.002041624717885124, 0.0005974203597819273, 0.0014176365512460275] and parameters: {'n_layers': 2, 'embedding_dim': 96, 'lr': 0.0028258902906977677, 'lambda_val': 1.0477656620736208e-06, 'batch_size': 3749, 'optimizer': 'RMSprop'}.
2026-07-02 07:29:41,862 - optuna.study.study - INFO - Trial 191 finished with values: [0.001575949011030299, 0.00043405580988925405, 0.0011267078213711684] and parameters: {'n_layers': 4, 'embedding_dim': 96, 'lr': 0.0002889968108070523, 'lambda_val': 1.2721858922599357e-06, 'batch_size': 3749, 'optimizer': 'Adam'}.
2026-07-02 07:34:54,132 - experiment_functions - INFO - Early stopping at epoch 3200. Best Metrics: (0.002392472019378436, 0.000709496039359459, 0.0016475674555413433)
2026-07-02 07:34:54,255 - optuna.study.study - INFO - Trial 192 finished with values: [0.002392472019378436, 0.000709496039359459, 0.0016475674555413433] and parameters: {'n_layers': 3, 'embedding_dim': 256, 'lr': 0.0014374939555211086, 'lambda_val': 1.2112627410590521e-05, 'batch_size': 2081, 'optimizer': 'Adam'}.
2026-07-02 07:37:47,828 - experiment_functions - INFO - Early stopping at epoch 2200. Best Metrics: (0.001430167260410812, 0.00046729859620462365, 0.0009829698222715633)
2026-07-02 07:37:47,944 - optuna.study.study - INFO - Trial 193 finished with values: [0.001430167260410812, 0.00046729859620462365, 0.0009829698222715633] and parameters: {'n_layers': 1, 'embedding_dim': 128, 'lr': 0.005014370880052961, 'lambda_val': 0.011356721163774775, 'batch_size': 3988, 'optimizer': 'Adam'}.
2026-07-02 07:40:24,640 - experiment_functions - INFO - Early stopping at epoch 2050. Best Metrics: (0.001641305810341637, 0.00040271261136333415, 0.0011019391313176559)
2026-07-02 07:40:24,727 - optuna.study.study - INFO - Trial 194 finished with values: [0.001641305810341637, 0.00040271261136333415, 0.0011019391313176559] and parameters: {'n_layers': 1, 'embedding_dim': 96, 'lr': 0.005014370880052961, 'lambda_val': 4.554302389333304e-06, 'batch_size': 4067, 'optimizer': 'Adam'}.
2026-07-02 07:44:01,302 - experiment_functions - INFO - Early stopping at epoch 2750. Best Metrics: (0.0018747314544617084, 0.0005119389092566913, 0.001342387699504624)
2026-07-02 07:44:01,403 - optuna.study.study - INFO - Trial 195 finished with values: [0.0018747314544617084, 0.0005119389092566913, 0.001342387699504624] and parameters: {'n_layers': 2, 'embedding_dim': 96, 'lr': 0.0014381034476558553, 'lambda_val': 4.0508714922137996e-06, 'batch_size': 3190, 'optimizer': 'Adam'}.
2026-07-02 07:44:47,952 - experiment_functions - INFO - Early stopping at epoch 550. Best Metrics: (0.0011121730869718875, 0.000336227038732595, 0.0007858465828752675)
2026-07-02 07:44:48,118 - optuna.study.study - INFO - Trial 196 finished with values: [0.0011121730869718875, 0.000336227038732595, 0.0007858465828752675] and parameters: {'n_layers': 2, 'embedding_dim': 96, 'lr': 0.07137537182714382, 'lambda_val': 0.00010877216929113007, 'batch_size': 539, 'optimizer': 'RMSprop'}.
2026-07-02 07:49:56,261 - optuna.study.study - INFO - Trial 197 finished with values: [0.0018255594573846632, 0.0004568508633626503, 0.0012474480066513752] and parameters: {'n_layers': 3, 'embedding_dim': 64, 'lr': 0.00042777516068918454, 'lambda_val': 0.00857156187814291, 'batch_size': 2754, 'optimizer': 'RMSprop'}.
2026-07-02 07:51:02,418 - experiment_functions - INFO - Early stopping at epoch 850. Best Metrics: (0.0017356645756557625, 0.0004122105503105827, 0.0011181172534905806)
2026-07-02 07:51:02,521 - optuna.study.study - INFO - Trial 198 finished with values: [0.0017356645756557625, 0.0004122105503105827, 0.0011181172534905806] and parameters: {'n_layers': 1, 'embedding_dim': 64, 'lr': 0.004042957173512393, 'lambda_val': 2.188289071859108e-05, 'batch_size': 2754, 'optimizer': 'RMSprop'}.
2026-07-02 07:53:08,778 - experiment_functions - INFO - Early stopping at epoch 1600. Best Metrics: (0.0027475849950393, 0.0007427388256748287, 0.0017961943411249535)
2026-07-02 07:53:08,878 - optuna.study.study - INFO - Trial 199 finished with values: [0.0027475849950393, 0.0007427388256748287, 0.0017961943411249535] and parameters: {'n_layers': 3, 'embedding_dim': 64, 'lr': 0.0014374939555211086, 'lambda_val': 2.188289071859108e-05, 'batch_size': 2754, 'optimizer': 'RMSprop'}.
2026-07-02 07:54:15,809 - experiment_functions - INFO - Early stopping at epoch 800. Best Metrics: (0.0021054178588110315, 0.000599319947571377, 0.0014577426803773718)
2026-07-02 07:54:15,903 - optuna.study.study - INFO - Trial 200 finished with values: [0.0021054178588110315, 0.000599319947571377, 0.0014577426803773718] and parameters: {'n_layers': 4, 'embedding_dim': 64, 'lr': 0.003175598950751376, 'lambda_val': 0.0008385607052181827, 'batch_size': 2754, 'optimizer': 'Adam'}.
2026-07-02 07:56:48,718 - experiment_functions - INFO - Early stopping at epoch 1950. Best Metrics: (0.002103002158231027, 0.0005717759246243565, 0.001355728160709194)
2026-07-02 07:56:48,798 - optuna.study.study - INFO - Trial 201 finished with values: [0.002103002158231027, 0.0005717759246243565, 0.001355728160709194] and parameters: {'n_layers': 3, 'embedding_dim': 64, 'lr': 0.0014374939555211086, 'lambda_val': 0.0006325039773618912, 'batch_size': 2754, 'optimizer': 'Adam'}.
2026-07-02 07:57:42,338 - experiment_functions - INFO - Early stopping at epoch 600. Best Metrics: (0.002059582207345354, 0.0005822236574663298, 0.0013516514002404288)
2026-07-02 07:57:42,505 - optuna.study.study - INFO - Trial 202 finished with values: [0.002059582207345354, 0.0005822236574663298, 0.0013516514002404288] and parameters: {'n_layers': 4, 'embedding_dim': 96, 'lr': 0.01321022891213974, 'lambda_val': 0.00010877216929113007, 'batch_size': 2099, 'optimizer': 'Adam'}.
2026-07-02 08:03:30,798 - optuna.study.study - INFO - Trial 203 finished with values: [0.002372966695747318, 0.0007075964515700095, 0.001632159234654674] and parameters: {'n_layers': 4, 'embedding_dim': 128, 'lr': 0.00042777516068918454, 'lambda_val': 1.0477656620736208e-06, 'batch_size': 3749, 'optimizer': 'Adam'}.
2026-07-02 08:04:53,287 - experiment_functions - INFO - Early stopping at epoch 1000. Best Metrics: (0.0022890687332423974, 0.0006363619094656459, 0.001542474848234437)
2026-07-02 08:04:53,366 - optuna.study.study - INFO - Trial 204 finished with values: [0.0022890687332423974, 0.0006363619094656459, 0.001542474848234437] and parameters: {'n_layers': 4, 'embedding_dim': 64, 'lr': 0.003175598950751376, 'lambda_val': 0.00024499244831156216, 'batch_size': 2302, 'optimizer': 'Adam'}.
2026-07-02 08:06:01,165 - experiment_functions - INFO - Early stopping at epoch 800. Best Metrics: (0.0014764409731163192, 0.0004492525122048516, 0.0010335636332665706)
2026-07-02 08:06:01,275 - optuna.study.study - INFO - Trial 205 finished with values: [0.0014764409731163192, 0.0004492525122048516, 0.0010335636332665706] and parameters: {'n_layers': 2, 'embedding_dim': 128, 'lr': 0.0025911876680863384, 'lambda_val': 0.011356721163774775, 'batch_size': 1285, 'optimizer': 'RMSprop'}.
2026-07-02 08:06:50,383 - experiment_functions - INFO - Early stopping at epoch 550. Best Metrics: (0.0018152010922563675, 0.0005508804589404099, 0.0013083750525479496)
2026-07-02 08:06:50,477 - optuna.study.study - INFO - Trial 206 finished with values: [0.0018152010922563675, 0.0005508804589404099, 0.0013083750525479496] and parameters: {'n_layers': 4, 'embedding_dim': 96, 'lr': 0.014582350289404945, 'lambda_val': 1.8310592897560325e-05, 'batch_size': 1900, 'optimizer': 'RMSprop'}.
2026-07-02 08:09:41,782 - experiment_functions - INFO - Early stopping at epoch 2050. Best Metrics: (0.0030112783477474784, 0.0009051535816727771, 0.001993415339218476)
2026-07-02 08:09:41,929 - optuna.study.study - INFO - Trial 207 finished with values: [0.0030112783477474784, 0.0009051535816727771, 0.001993415339218476] and parameters: {'n_layers': 4, 'embedding_dim': 96, 'lr': 0.0028258902906977677, 'lambda_val': 1.0477656620736208e-06, 'batch_size': 529, 'optimizer': 'RMSprop'}.
2026-07-02 08:13:40,200 - experiment_functions - INFO - Early stopping at epoch 2950. Best Metrics: (0.003042531024042119, 0.0008329692456736889, 0.002033396091671329)
2026-07-02 08:13:40,268 - optuna.study.study - INFO - Trial 208 finished with values: [0.003042531024042119, 0.0008329692456736889, 0.002033396091671329] and parameters: {'n_layers': 3, 'embedding_dim': 96, 'lr': 0.0014374939555211086, 'lambda_val': 2.188289071859108e-05, 'batch_size': 1298, 'optimizer': 'RMSprop'}.
2026-07-02 08:19:15,655 - optuna.study.study - INFO - Trial 209 finished with values: [0.002668350191340791, 0.0007484375890431777, 0.001803246622262824] and parameters: {'n_layers': 3, 'embedding_dim': 128, 'lr': 0.0014374939555211086, 'lambda_val': 1.2112627410590521e-05, 'batch_size': 1298, 'optimizer': 'Adam'}.
2026-07-02 08:21:32,723 - experiment_functions - INFO - Early stopping at epoch 1750. Best Metrics: (0.002013743457006462, 0.0005014911764147181, 0.001285155093039276)
2026-07-02 08:21:32,801 - optuna.study.study - INFO - Trial 210 finished with values: [0.002013743457006462, 0.0005014911764147181, 0.001285155093039276] and parameters: {'n_layers': 1, 'embedding_dim': 128, 'lr': 0.002187649930388769, 'lambda_val': 0.00010877216929113007, 'batch_size': 1290, 'optimizer': 'RMSprop'}.
2026-07-02 08:24:26,104 - experiment_functions - INFO - Early stopping at epoch 2250. Best Metrics: (0.00020600712951685042, 5.603783978876585e-05, 0.00014455326814052905)
2026-07-02 08:24:26,202 - optuna.study.study - INFO - Trial 211 finished with values: [0.00020600712951685042, 5.603783978876585e-05, 0.00014455326814052905] and parameters: {'n_layers': 3, 'embedding_dim': 64, 'lr': 9.909787639865634e-05, 'lambda_val': 2.188289071859108e-05, 'batch_size': 539, 'optimizer': 'RMSprop'}.
2026-07-02 08:25:32,026 - experiment_functions - INFO - Early stopping at epoch 800. Best Metrics: (0.0013533115072659396, 0.0004236080770472807, 0.0009639304949277761)
2026-07-02 08:25:32,398 - optuna.study.study - INFO - Trial 212 finished with values: [0.0013533115072659396, 0.0004236080770472807, 0.0009639304949277761] and parameters: {'n_layers': 4, 'embedding_dim': 64, 'lr': 0.0014374939555211086, 'lambda_val': 0.04126579935269706, 'batch_size': 3027, 'optimizer': 'RMSprop'}.
2026-07-02 08:26:40,554 - experiment_functions - INFO - Early stopping at epoch 750. Best Metrics: (0.002529192356477017, 0.0007208935660961572, 0.0016307454904652245)
2026-07-02 08:26:40,626 - optuna.study.study - INFO - Trial 213 finished with values: [0.002529192356477017, 0.0007208935660961572, 0.0016307454904652245] and parameters: {'n_layers': 4, 'embedding_dim': 128, 'lr': 0.003175598950751376, 'lambda_val': 0.00013041816739515328, 'batch_size': 1403, 'optimizer': 'RMSprop'}.
2026-07-02 08:28:40,401 - experiment_functions - INFO - Early stopping at epoch 1350. Best Metrics: (0.0027787865419817777, 0.0007883289326216211, 0.001884865342520056)
2026-07-02 08:28:40,493 - optuna.study.study - INFO - Trial 214 finished with values: [0.0027787865419817777, 0.0007883289326216211, 0.001884865342520056] and parameters: {'n_layers': 4, 'embedding_dim': 128, 'lr': 0.0014374939555211086, 'lambda_val': 2.188289071859108e-05, 'batch_size': 3871, 'optimizer': 'RMSprop'}.
2026-07-02 08:29:25,811 - experiment_functions - INFO - Early stopping at epoch 500. Best Metrics: (0.0001763475366142983, 5.318845810459131e-05, 0.0001166402917863764)
2026-07-02 08:29:26,034 - optuna.study.study - INFO - Trial 215 finished with values: [0.0001763475366142983, 5.318845810459131e-05, 0.0001166402917863764] and parameters: {'n_layers': 3, 'embedding_dim': 128, 'lr': 0.004152271479480873, 'lambda_val': 1.5990539279825177e-06, 'batch_size': 1473, 'optimizer': 'SGD'}.
2026-07-02 08:30:08,322 - experiment_functions - INFO - Early stopping at epoch 500. Best Metrics: (0.00019506033728467696, 5.5088045894040994e-05, 0.00011304592285985613)
2026-07-02 08:30:08,475 - optuna.study.study - INFO - Trial 216 finished with values: [0.00019506033728467696, 5.5088045894040994e-05, 0.00011304592285985613] and parameters: {'n_layers': 4, 'embedding_dim': 64, 'lr': 0.003175598950751376, 'lambda_val': 0.00024499244831156216, 'batch_size': 2302, 'optimizer': 'SGD'}.
2026-07-02 08:31:12,573 - experiment_functions - INFO - Early stopping at epoch 700. Best Metrics: (0.0019244236026711519, 0.0005698763368349068, 0.001318475418696726)
2026-07-02 08:31:13,042 - optuna.study.study - INFO - Trial 217 finished with values: [0.0019244236026711519, 0.0005698763368349068, 0.001318475418696726] and parameters: {'n_layers': 4, 'embedding_dim': 128, 'lr': 0.01321022891213974, 'lambda_val': 1.3509843414861852e-06, 'batch_size': 3470, 'optimizer': 'RMSprop'}.
2026-07-02 08:32:15,163 - experiment_functions - INFO - Early stopping at epoch 600. Best Metrics: (0.0020737682598252383, 0.000574625306308531, 0.001363971695478743)
2026-07-02 08:32:15,244 - optuna.study.study - INFO - Trial 218 finished with values: [0.0020737682598252383, 0.000574625306308531, 0.001363971695478743] and parameters: {'n_layers': 3, 'embedding_dim': 256, 'lr': 0.01321022891213974, 'lambda_val': 0.00010877216929113007, 'batch_size': 3749, 'optimizer': 'Adam'}.
2026-07-02 08:33:06,691 - experiment_functions - INFO - Early stopping at epoch 550. Best Metrics: (0.0009721987162787471, 0.0002678418783124062, 0.0007256525094204981)
2026-07-02 08:33:07,092 - optuna.study.study - INFO - Trial 219 finished with values: [0.0009721987162787471, 0.0002678418783124062, 0.0007256525094204981] and parameters: {'n_layers': 3, 'embedding_dim': 128, 'lr': 0.0674784460057297, 'lambda_val': 0.00010877216929113007, 'batch_size': 3621, 'optimizer': 'RMSprop'}.
2026-07-02 08:35:18,540 - experiment_functions - INFO - Early stopping at epoch 1600. Best Metrics: (0.0024214439223842806, 0.0006905001614649621, 0.001711062222537795)
2026-07-02 08:35:18,632 - optuna.study.study - INFO - Trial 220 finished with values: [0.0024214439223842806, 0.0006905001614649621, 0.001711062222537795] and parameters: {'n_layers': 3, 'embedding_dim': 96, 'lr': 0.0014381034476558553, 'lambda_val': 3.074529830564746e-05, 'batch_size': 3749, 'optimizer': 'RMSprop'}.
2026-07-02 08:36:09,618 - experiment_functions - INFO - Early stopping at epoch 600. Best Metrics: (0.001784462001734855, 0.0005166878787303156, 0.00126539496512431)
2026-07-02 08:36:09,696 - optuna.study.study - INFO - Trial 221 finished with values: [0.001784462001734855, 0.0005166878787303156, 0.00126539496512431] and parameters: {'n_layers': 4, 'embedding_dim': 64, 'lr': 0.012943330980207375, 'lambda_val': 0.00024499244831156216, 'batch_size': 3470, 'optimizer': 'Adam'}.
2026-07-02 08:37:00,264 - experiment_functions - INFO - Early stopping at epoch 600. Best Metrics: (0.0018818542719249742, 0.0005280854054670136, 0.0012415398715338666)
2026-07-02 08:37:00,354 - optuna.study.study - INFO - Trial 222 finished with values: [0.0018818542719249742, 0.0005280854054670136, 0.0012415398715338666] and parameters: {'n_layers': 4, 'embedding_dim': 64, 'lr': 0.014582350289404945, 'lambda_val': 1.5990539279825177e-06, 'batch_size': 2302, 'optimizer': 'RMSprop'}.
2026-07-02 08:40:35,262 - experiment_functions - INFO - Early stopping at epoch 2550. Best Metrics: (0.0018088871677695937, 0.000544231901677336, 0.0013109146125009513)
