2026-07-04 11:30:45,558 - optuna.study.study - INFO - Trial 197 finished with values: [0.018009589633391214, 0.004071766426685409, 0.010742810932036462] and parameters: {'n_layers': 3, 'embedding_dim': 128, 'lr': 0.000825254884924141, 'lambda_val': 0.0002512734421382798, 'batch_size': 2838, 'optimizer': 'Adam'}.
2026-07-04 11:36:39,330 - optuna.study.study - INFO - Trial 198 finished with values: [0.012693539937590701, 0.0030374408753300534, 0.007623048701512422] and parameters: {'n_layers': 3, 'embedding_dim': 96, 'lr': 0.000825254884924141, 'lambda_val': 0.0016032367653458185, 'batch_size': 1726, 'optimizer': 'RMSprop'}.
2026-07-04 11:37:57,807 - experiment_functions - INFO - Early stopping at epoch 800. Best Metrics: (0.015188029356317814, 0.0033850654407993463, 0.009072143868004033)
2026-07-04 11:37:57,887 - optuna.study.study - INFO - Trial 199 finished with values: [0.015188029356317814, 0.0033850654407993463, 0.009072143868004033] and parameters: {'n_layers': 1, 'embedding_dim': 256, 'lr': 0.01117512599566325, 'lambda_val': 5.385694884049571e-05, 'batch_size': 3865, 'optimizer': 'Adam'}.
2026-07-04 11:43:48,322 - optuna.study.study - INFO - Trial 200 finished with values: [0.006974341287024022, 0.0017951104610299568, 0.004088309456936776] and parameters: {'n_layers': 2, 'embedding_dim': 128, 'lr': 0.00917953252838311, 'lambda_val': 0.01686232613958166, 'batch_size': 3723, 'optimizer': 'RMSprop'}.
2026-07-04 11:48:57,904 - optuna.study.study - INFO - Trial 201 finished with values: [0.013078778901991925, 0.003159964287749559, 0.007820744285164294] and parameters: {'n_layers': 2, 'embedding_dim': 32, 'lr': 0.0006924103134205528, 'lambda_val': 0.00011379845769455902, 'batch_size': 2982, 'optimizer': 'Adam'}.
2026-07-04 11:54:50,913 - optuna.study.study - INFO - Trial 202 finished with values: [0.016153017660320387, 0.003566476074691792, 0.009744501494648597] and parameters: {'n_layers': 2, 'embedding_dim': 128, 'lr': 0.010561378130282784, 'lambda_val': 0.0002512734421382798, 'batch_size': 1590, 'optimizer': 'RMSprop'}.
2026-07-04 12:00:16,179 - optuna.study.study - INFO - Trial 203 finished with values: [0.01592536670859328, 0.003510438234903026, 0.009369222609455326] and parameters: {'n_layers': 2, 'embedding_dim': 64, 'lr': 0.01117512599566325, 'lambda_val': 8.712752718400284e-06, 'batch_size': 1490, 'optimizer': 'RMSprop'}.
2026-07-04 12:05:28,703 - optuna.study.study - INFO - Trial 204 finished with values: [0.012760226679502896, 0.0028978211728055013, 0.007542426166040697] and parameters: {'n_layers': 1, 'embedding_dim': 64, 'lr': 0.01117512599566325, 'lambda_val': 0.0002512734421382798, 'batch_size': 1239, 'optimizer': 'RMSprop'}.
2026-07-04 12:06:17,727 - experiment_functions - INFO - Early stopping at epoch 550. Best Metrics: (0.0049980539844994894, 0.0013021674296677622, 0.0030731095347219547)
2026-07-04 12:06:17,805 - optuna.study.study - INFO - Trial 205 finished with values: [0.0049980539844994894, 0.0013021674296677622, 0.0030731095347219547] and parameters: {'n_layers': 1, 'embedding_dim': 128, 'lr': 0.05256901369033282, 'lambda_val': 9.51130760446514e-05, 'batch_size': 3865, 'optimizer': 'Adam'}.
2026-07-04 12:09:07,763 - experiment_functions - INFO - Early stopping at epoch 2000. Best Metrics: (0.011052910308012006, 0.00250745588207359, 0.006510179929235887)
2026-07-04 12:09:07,845 - optuna.study.study - INFO - Trial 206 finished with values: [0.011052910308012006, 0.00250745588207359, 0.006510179929235887] and parameters: {'n_layers': 3, 'embedding_dim': 64, 'lr': 0.008660151763754238, 'lambda_val': 4.6468491925734505e-06, 'batch_size': 4003, 'optimizer': 'Adam'}.
2026-07-04 12:15:16,299 - optuna.study.study - INFO - Trial 207 finished with values: [0.015118152036907542, 0.003470546891324583, 0.009395131318257335] and parameters: {'n_layers': 1, 'embedding_dim': 256, 'lr': 0.00917953252838311, 'lambda_val': 5.842035456079482e-06, 'batch_size': 733, 'optimizer': 'RMSprop'}.
2026-07-04 12:16:05,930 - experiment_functions - INFO - Early stopping at epoch 500. Best Metrics: (0.00029668141221561996, 6.743536652546399e-05, 0.000167064512892654)
2026-07-04 12:16:06,006 - optuna.study.study - INFO - Trial 208 finished with values: [0.00029668141221561996, 6.743536652546399e-05, 0.000167064512892654] and parameters: {'n_layers': 3, 'embedding_dim': 128, 'lr': 0.0008496123911369606, 'lambda_val': 0.0030408745239375477, 'batch_size': 3310, 'optimizer': 'SGD'}.
2026-07-04 12:24:26,788 - optuna.study.study - INFO - Trial 209 finished with values: [0.017920703610750956, 0.0037725813498470833, 0.01087804656380009] and parameters: {'n_layers': 4, 'embedding_dim': 256, 'lr': 0.015216834194850396, 'lambda_val': 5.842035456079482e-06, 'batch_size': 3485, 'optimizer': 'RMSprop'}.
2026-07-04 12:27:04,334 - experiment_functions - INFO - Early stopping at epoch 1850. Best Metrics: (0.011136159083217124, 0.002530250935546986, 0.00651613720353803)
2026-07-04 12:27:04,422 - optuna.study.study - INFO - Trial 210 finished with values: [0.011136159083217124, 0.002530250935546986, 0.00651613720353803] and parameters: {'n_layers': 3, 'embedding_dim': 64, 'lr': 0.006729729627316455, 'lambda_val': 2.502572700858551e-05, 'batch_size': 4003, 'optimizer': 'Adam'}.
2026-07-04 12:32:44,246 - optuna.study.study - INFO - Trial 211 finished with values: [0.01748175359047983, 0.0038523640370039702, 0.010497263355021793] and parameters: {'n_layers': 2, 'embedding_dim': 96, 'lr': 0.010561378130282784, 'lambda_val': 1.3386054080202036e-05, 'batch_size': 2102, 'optimizer': 'RMSprop'}.
2026-07-04 12:37:54,707 - optuna.study.study - INFO - Trial 212 finished with values: [0.008251773817996836, 0.002171228843340995, 0.004948633755325642] and parameters: {'n_layers': 1, 'embedding_dim': 64, 'lr': 0.008660151763754238, 'lambda_val': 0.02030916094849311, 'batch_size': 1756, 'optimizer': 'Adam'}.
2026-07-04 12:44:50,430 - optuna.study.study - INFO - Trial 213 finished with values: [0.022475662397233094, 0.004918032786885246, 0.012887116751984425] and parameters: {'n_layers': 2, 'embedding_dim': 256, 'lr': 0.0013930224389611008, 'lambda_val': 0.0002512734421382798, 'batch_size': 3865, 'optimizer': 'RMSprop'}.
2026-07-04 12:50:00,659 - optuna.study.study - INFO - Trial 214 finished with values: [0.016086805475829257, 0.003480994624166556, 0.009471739825275088] and parameters: {'n_layers': 2, 'embedding_dim': 32, 'lr': 0.003976153551196258, 'lambda_val': 5.245398963432972e-05, 'batch_size': 1590, 'optimizer': 'Adam'}.
2026-07-04 12:50:52,517 - experiment_functions - INFO - Early stopping at epoch 500. Best Metrics: (0.00018378859781877465, 6.268639705183975e-05, 0.00012375754546248128)
2026-07-04 12:50:52,610 - optuna.study.study - INFO - Trial 215 finished with values: [0.00018378859781877465, 6.268639705183975e-05, 0.00012375754546248128] and parameters: {'n_layers': 4, 'embedding_dim': 128, 'lr': 0.010561378130282784, 'lambda_val': 1.3386054080202036e-05, 'batch_size': 4003, 'optimizer': 'SGD'}.
2026-07-04 12:57:05,085 - optuna.study.study - INFO - Trial 216 finished with values: [0.016277306731282953, 0.0035455806090078455, 0.009485630299975565] and parameters: {'n_layers': 4, 'embedding_dim': 96, 'lr': 0.000825254884924141, 'lambda_val': 4.958440833983199e-05, 'batch_size': 2838, 'optimizer': 'Adam'}.
2026-07-04 13:02:58,090 - optuna.study.study - INFO - Trial 217 finished with values: [0.012429169285945198, 0.003126721501434189, 0.007630013282742102] and parameters: {'n_layers': 2, 'embedding_dim': 128, 'lr': 0.0008496123911369606, 'lambda_val': 0.0030408745239375477, 'batch_size': 1590, 'optimizer': 'Adam'}.
2026-07-04 13:08:54,615 - optuna.study.study - INFO - Trial 218 finished with values: [0.019293029229667257, 0.00449917367931159, 0.01172781250837351] and parameters: {'n_layers': 2, 'embedding_dim': 128, 'lr': 0.0008496123911369606, 'lambda_val': 6.577413395094084e-06, 'batch_size': 3141, 'optimizer': 'Adam'}.
2026-07-04 13:16:28,936 - experiment_functions - INFO - Early stopping at epoch 3950. Best Metrics: (0.01597733496448605, 0.0034211576087988913, 0.009193127850101204)
2026-07-04 13:16:29,014 - optuna.study.study - INFO - Trial 219 finished with values: [0.01597733496448605, 0.0034211576087988913, 0.009193127850101204] and parameters: {'n_layers': 3, 'embedding_dim': 256, 'lr': 0.004214167238747189, 'lambda_val': 5.0315298057897486e-06, 'batch_size': 3865, 'optimizer': 'Adam'}.
2026-07-04 13:17:59,035 - experiment_functions - INFO - Early stopping at epoch 950. Best Metrics: (0.00014907669452055188, 4.938928252569192e-05, 0.00010338850631845413)
2026-07-04 13:17:59,127 - optuna.study.study - INFO - Trial 220 finished with values: [0.00014907669452055188, 4.938928252569192e-05, 0.00010338850631845413] and parameters: {'n_layers': 1, 'embedding_dim': 256, 'lr': 2.3450528392491817e-05, 'lambda_val': 0.0016032367653458185, 'batch_size': 3865, 'optimizer': 'Adam'}.
2026-07-04 13:23:39,357 - optuna.study.study - INFO - Trial 221 finished with values: [0.018121645548696677, 0.004177193548999867, 0.010940807468130184] and parameters: {'n_layers': 2, 'embedding_dim': 96, 'lr': 0.0013879274114569848, 'lambda_val': 5.245398963432972e-05, 'batch_size': 1590, 'optimizer': 'Adam'}.
2026-07-04 13:28:48,856 - optuna.study.study - INFO - Trial 222 finished with values: [0.013450226606039957, 0.003277738730695439, 0.007902800997391445] and parameters: {'n_layers': 2, 'embedding_dim': 32, 'lr': 0.0006924103134205528, 'lambda_val': 1.3386054080202036e-05, 'batch_size': 3257, 'optimizer': 'RMSprop'}.
2026-07-04 13:33:08,644 - experiment_functions - INFO - Early stopping at epoch 2750. Best Metrics: (0.014887804317298232, 0.0033698687384837492, 0.008749397281220426)
2026-07-04 13:33:08,736 - optuna.study.study - INFO - Trial 223 finished with values: [0.014887804317298232, 0.0033698687384837492, 0.008749397281220426] and parameters: {'n_layers': 3, 'embedding_dim': 128, 'lr': 0.000825254884924141, 'lambda_val': 0.0030408745239375477, 'batch_size': 3310, 'optimizer': 'Adam'}.
2026-07-04 13:39:25,946 - optuna.study.study - INFO - Trial 224 finished with values: [0.017929744625120803, 0.004083163953422108, 0.010605161348099374] and parameters: {'n_layers': 3, 'embedding_dim': 128, 'lr': 0.0006924103134205528, 'lambda_val': 0.0002512734421382798, 'batch_size': 2838, 'optimizer': 'Adam'}.
2026-07-04 13:44:50,914 - optuna.study.study - INFO - Trial 225 finished with values: [0.016489229178623648, 0.003782079288794332, 0.009949410907278132] and parameters: {'n_layers': 2, 'embedding_dim': 64, 'lr': 0.00917953252838311, 'lambda_val': 5.245398963432972e-05, 'batch_size': 825, 'optimizer': 'RMSprop'}.
2026-07-04 13:50:15,272 - optuna.study.study - INFO - Trial 226 finished with values: [0.014545809013177539, 0.0031932070740649282, 0.008561133091899674] and parameters: {'n_layers': 2, 'embedding_dim': 64, 'lr': 0.010561378130282784, 'lambda_val': 1.3386054080202036e-05, 'batch_size': 4003, 'optimizer': 'RMSprop'}.
2026-07-04 13:55:39,258 - optuna.study.study - INFO - Trial 227 finished with values: [0.015930040377134413, 0.0035579279296392686, 0.009306359315409515] and parameters: {'n_layers': 2, 'embedding_dim': 64, 'lr': 0.012323002098276907, 'lambda_val': 5.347102143813337e-06, 'batch_size': 1256, 'optimizer': 'RMSprop'}.
2026-07-04 13:56:28,397 - experiment_functions - INFO - Early stopping at epoch 500. Best Metrics: (0.00021943344044363867, 5.8887221472940384e-05, 0.00014555414516454677)
2026-07-04 13:56:28,487 - optuna.study.study - INFO - Trial 228 finished with values: [0.00021943344044363867, 5.8887221472940384e-05, 0.00014555414516454677] and parameters: {'n_layers': 4, 'embedding_dim': 96, 'lr': 1.6730487351727866e-05, 'lambda_val': 0.02356380590287942, 'batch_size': 4003, 'optimizer': 'RMSprop'}.
2026-07-04 14:04:51,217 - optuna.study.study - INFO - Trial 229 finished with values: [0.015901793219676597, 0.0035066390593241265, 0.009216710201978073] and parameters: {'n_layers': 4, 'embedding_dim': 256, 'lr': 0.0013930224389611008, 'lambda_val': 5.842035456079482e-06, 'batch_size': 3485, 'optimizer': 'Adam'}.
2026-07-04 14:10:15,201 - optuna.study.study - INFO - Trial 230 finished with values: [0.014847246774065608, 0.003290086051326862, 0.008551758418043613] and parameters: {'n_layers': 2, 'embedding_dim': 64, 'lr': 0.00917953252838311, 'lambda_val': 0.0002512734421382798, 'batch_size': 3723, 'optimizer': 'RMSprop'}.
2026-07-04 14:11:03,725 - experiment_functions - INFO - Early stopping at epoch 500. Best Metrics: (0.000175002896180452, 5.318845810459131e-05, 0.00012041474678581806)
2026-07-04 14:11:03,801 - optuna.study.study - INFO - Trial 231 finished with values: [0.000175002896180452, 5.318845810459131e-05, 0.00012041474678581806] and parameters: {'n_layers': 1, 'embedding_dim': 256, 'lr': 0.01117512599566325, 'lambda_val': 2.0003344352285716e-06, 'batch_size': 4003, 'optimizer': 'SGD'}.
2026-07-04 14:16:39,951 - optuna.study.study - INFO - Trial 232 finished with values: [0.02440007131506297, 0.005524951085614422, 0.01488365635451138] and parameters: {'n_layers': 1, 'embedding_dim': 128, 'lr': 0.0013930224389611008, 'lambda_val': 5.842035456079482e-06, 'batch_size': 3865, 'optimizer': 'Adam'}.
2026-07-04 14:22:48,183 - optuna.study.study - INFO - Trial 233 finished with values: [0.014604393987101144, 0.0033765172957468236, 0.009003229937684895] and parameters: {'n_layers': 1, 'embedding_dim': 256, 'lr': 0.010561378130282784, 'lambda_val': 5.385694884049571e-05, 'batch_size': 1447, 'optimizer': 'RMSprop'}.
2026-07-04 14:28:22,560 - optuna.study.study - INFO - Trial 234 finished with values: [0.017717176404214077, 0.0038248200140569497, 0.010646348988580781] and parameters: {'n_layers': 1, 'embedding_dim': 128, 'lr': 0.008660151763754238, 'lambda_val': 5.245398963432972e-05, 'batch_size': 2311, 'optimizer': 'Adam'}.
2026-07-04 14:33:55,261 - optuna.study.study - INFO - Trial 235 finished with values: [0.015463949828056931, 0.0034164086393252665, 0.008953869036908547] and parameters: {'n_layers': 1, 'embedding_dim': 128, 'lr': 0.008660151763754238, 'lambda_val': 2.4590779491154827e-05, 'batch_size': 1068, 'optimizer': 'Adam'}.
2026-07-04 14:35:13,133 - experiment_functions - INFO - Early stopping at epoch 950. Best Metrics: (0.015191748897476964, 0.003371768326273199, 0.008873624191920343)
2026-07-04 14:35:13,237 - optuna.study.study - INFO - Trial 236 finished with values: [0.015191748897476964, 0.003371768326273199, 0.008873624191920343] and parameters: {'n_layers': 1, 'embedding_dim': 64, 'lr': 0.01117512599566325, 'lambda_val': 2.1472074483729182e-05, 'batch_size': 4003, 'optimizer': 'Adam'}.
2026-07-04 14:36:23,607 - experiment_functions - INFO - Early stopping at epoch 800. Best Metrics: (0.016823426693028175, 0.0037877780521626808, 0.010030736571190298)
2026-07-04 14:36:23,726 - optuna.study.study - INFO - Trial 237 finished with values: [0.016823426693028175, 0.0037877780521626808, 0.010030736571190298] and parameters: {'n_layers': 1, 'embedding_dim': 128, 'lr': 0.00917953252838311, 'lambda_val': 0.00039287654059549373, 'batch_size': 3723, 'optimizer': 'Adam'}.
2026-07-04 14:41:41,218 - optuna.study.study - INFO - Trial 238 finished with values: [0.0035171582497647196, 0.0009782877115665901, 0.002211227039618126] and parameters: {'n_layers': 1, 'embedding_dim': 96, 'lr': 0.000633525048466326, 'lambda_val': 0.00011379845769455902, 'batch_size': 1756, 'optimizer': 'Adam'}.
2026-07-04 14:42:45,353 - experiment_functions - INFO - Early stopping at epoch 650. Best Metrics: (0.009705592167413934, 0.0021987728662880156, 0.005662603039813956)
2026-07-04 14:42:45,441 - optuna.study.study - INFO - Trial 239 finished with values: [0.009705592167413934, 0.0021987728662880156, 0.005662603039813956] and parameters: {'n_layers': 1, 'embedding_dim': 256, 'lr': 0.020246827455838553, 'lambda_val': 0.0002512734421382798, 'batch_size': 3723, 'optimizer': 'Adam'}.
2026-07-04 14:47:27,495 - experiment_functions - INFO - Early stopping at epoch 3600. Best Metrics: (0.012258194106358982, 0.00278004672985962, 0.007342050763641275)
2026-07-04 14:47:27,586 - optuna.study.study - INFO - Trial 240 finished with values: [0.012258194106358982, 0.00278004672985962, 0.007342050763641275] and parameters: {'n_layers': 1, 'embedding_dim': 64, 'lr': 0.01117512599566325, 'lambda_val': 5.385694884049571e-05, 'batch_size': 3865, 'optimizer': 'RMSprop'}.
2026-07-04 14:53:04,779 - optuna.study.study - INFO - Trial 241 finished with values: [0.018094289785195287, 0.00404042322815949, 0.010727958850483577] and parameters: {'n_layers': 3, 'embedding_dim': 64, 'lr': 0.000825254884924141, 'lambda_val': 0.0002623010666251748, 'batch_size': 4003, 'optimizer': 'Adam'}.
2026-07-04 14:58:28,196 - optuna.study.study - INFO - Trial 242 finished with values: [0.01887805104673556, 0.004403244495944381, 0.011281028809269272] and parameters: {'n_layers': 1, 'embedding_dim': 96, 'lr': 0.0013930224389611008, 'lambda_val': 5.842035456079482e-06, 'batch_size': 2102, 'optimizer': 'RMSprop'}.
2026-07-04 15:00:41,369 - experiment_functions - INFO - Early stopping at epoch 1500. Best Metrics: (0.0002005114251448803, 4.938928252569192e-05, 0.00010369478493654038)
2026-07-04 15:00:41,460 - optuna.study.study - INFO - Trial 243 finished with values: [0.0002005114251448803, 4.938928252569192e-05, 0.00010369478493654038] and parameters: {'n_layers': 3, 'embedding_dim': 96, 'lr': 2.273754605314947e-05, 'lambda_val': 2.502572700858551e-05, 'batch_size': 628, 'optimizer': 'Adam'}.
2026-07-04 15:06:58,184 - optuna.study.study - INFO - Trial 244 finished with values: [0.025825645573131554, 0.0058469312159261455, 0.015691246632640606] and parameters: {'n_layers': 1, 'embedding_dim': 256, 'lr': 0.0013930224389611008, 'lambda_val': 5.842035456079482e-06, 'batch_size': 4003, 'optimizer': 'Adam'}.
2026-07-04 15:15:18,900 - optuna.study.study - INFO - Trial 245 finished with values: [0.016882750785173855, 0.003656706494690652, 0.010051302485641738] and parameters: {'n_layers': 4, 'embedding_dim': 256, 'lr': 0.015216834194850396, 'lambda_val': 0.00011379845769455902, 'batch_size': 3485, 'optimizer': 'RMSprop'}.
2026-07-04 15:20:51,801 - optuna.study.study - INFO - Trial 246 finished with values: [0.018682965975550456, 0.004361453564576487, 0.011210046140177442] and parameters: {'n_layers': 1, 'embedding_dim': 128, 'lr': 0.0013930224389611008, 'lambda_val': 3.339379548029398e-06, 'batch_size': 1590, 'optimizer': 'RMSprop'}.
2026-07-04 15:22:02,895 - experiment_functions - INFO - Early stopping at epoch 850. Best Metrics: (0.016651389903572605, 0.0037013468077427203, 0.010088094227624408)
2026-07-04 15:22:02,979 - optuna.study.study - INFO - Trial 247 finished with values: [0.016651389903572605, 0.0037013468077427203, 0.010088094227624408] and parameters: {'n_layers': 1, 'embedding_dim': 64, 'lr': 0.00917953252838311, 'lambda_val': 0.0002512734421382798, 'batch_size': 3723, 'optimizer': 'Adam'}.
2026-07-04 15:28:21,034 - optuna.study.study - INFO - Trial 248 finished with values: [0.015626199567322977, 0.0033480234789050782, 0.009296691115495453] and parameters: {'n_layers': 3, 'embedding_dim': 128, 'lr': 0.015216834194850396, 'lambda_val': 5.842035456079482e-06, 'batch_size': 3475, 'optimizer': 'RMSprop'}.
2026-07-04 15:33:43,795 - optuna.study.study - INFO - Trial 249 finished with values: [0.013878367088546478, 0.0031352696464867127, 0.008221639361266467] and parameters: {'n_layers': 1, 'embedding_dim': 96, 'lr': 0.010561378130282784, 'lambda_val': 1.3386054080202036e-05, 'batch_size': 733, 'optimizer': 'RMSprop'}.
2026-07-04 15:34:33,374 - experiment_functions - INFO - Early stopping at epoch 500. Best Metrics: (0.00029668141221561996, 6.743536652546399e-05, 0.000167064512892654)
2026-07-04 15:34:33,452 - optuna.study.study - INFO - Trial 250 finished with values: [0.00029668141221561996, 6.743536652546399e-05, 0.000167064512892654] and parameters: {'n_layers': 3, 'embedding_dim': 128, 'lr': 0.0013930224389611008, 'lambda_val': 0.0002623010666251748, 'batch_size': 1305, 'optimizer': 'SGD'}.
2026-07-04 15:35:37,965 - experiment_functions - INFO - Early stopping at epoch 500. Best Metrics: (0.0002562954135752829, 5.888722147294038e-05, 0.0001440651455776282)
2026-07-04 15:35:38,051 - optuna.study.study - INFO - Trial 251 finished with values: [0.0002562954135752829, 5.888722147294038e-05, 0.0001440651455776282] and parameters: {'n_layers': 4, 'embedding_dim': 256, 'lr': 0.015216834194850396, 'lambda_val': 5.842035456079482e-06, 'batch_size': 3485, 'optimizer': 'SGD'}.
2026-07-04 15:42:35,300 - optuna.study.study - INFO - Trial 252 finished with values: [0.023027013003685173, 0.0049664722755162136, 0.013525575484804769] and parameters: {'n_layers': 2, 'embedding_dim': 256, 'lr': 0.0013930224389611008, 'lambda_val': 0.0002512734421382798, 'batch_size': 3865, 'optimizer': 'RMSprop'}.
2026-07-04 15:47:57,741 - optuna.study.study - INFO - Trial 253 finished with values: [0.009822369951578681, 0.002539748874494235, 0.006120653589295545] and parameters: {'n_layers': 1, 'embedding_dim': 96, 'lr': 0.000825254884924141, 'lambda_val': 5.245398963432972e-05, 'batch_size': 2311, 'optimizer': 'Adam'}.
2026-07-04 15:53:40,330 - optuna.study.study - INFO - Trial 254 finished with values: [0.016408388812008755, 0.003513287616587201, 0.00965825002732348] and parameters: {'n_layers': 2, 'embedding_dim': 96, 'lr': 0.010561378130282784, 'lambda_val': 1.3386054080202036e-05, 'batch_size': 3443, 'optimizer': 'RMSprop'}.
2026-07-04 15:54:27,743 - experiment_functions - INFO - Early stopping at epoch 550. Best Metrics: (0.00351255955140973, 0.0008652622380943335, 0.0021064996872819123)
