2026-07-01 12:41:10,217 - optuna.study.study - INFO - Trial 7 finished with values: [0.00023113949813750065, 5.5088045894041e-05, 0.0001242460416080375] and parameters: {'n_layers': 1, 'embedding_dim': 256, 'lr': 0.08085437072675228, 'lambda_val': 0.0006938129437878243, 'batch_size': 1323, 'optimizer': 'SGD'}.
2026-07-01 12:41:52,187 - experiment_functions - INFO - Early stopping at epoch 500. Best Metrics: (0.0002608835455199818, 5.9837015367665226e-05, 0.00013966399340838184)
2026-07-01 12:41:52,286 - optuna.study.study - INFO - Trial 8 finished with values: [0.0002608835455199818, 5.9837015367665226e-05, 0.00013966399340838184] and parameters: {'n_layers': 1, 'embedding_dim': 96, 'lr': 6.48701223290552e-05, 'lambda_val': 0.03735444866149272, 'batch_size': 1025, 'optimizer': 'Adam'}.
2026-07-01 12:46:46,899 - optuna.study.study - INFO - Trial 9 finished with values: [0.000579100459798733, 0.0001443686719981764, 0.00037035938034678397] and parameters: {'n_layers': 3, 'embedding_dim': 32, 'lr': 0.00018410347496287927, 'lambda_val': 3.183633360936297e-05, 'batch_size': 1557, 'optimizer': 'RMSprop'}.
2026-07-01 12:48:38,628 - experiment_functions - INFO - Early stopping at epoch 1400. Best Metrics: (0.0002626229604082307, 7.598351157798758e-05, 0.00016155496675642592)
2026-07-01 12:48:38,730 - optuna.study.study - INFO - Trial 10 finished with values: [0.0002626229604082307, 7.598351157798758e-05, 0.00016155496675642592] and parameters: {'n_layers': 2, 'embedding_dim': 96, 'lr': 5.0018666919213385e-05, 'lambda_val': 0.0004182641746888362, 'batch_size': 3546, 'optimizer': 'RMSprop'}.
2026-07-01 12:49:21,589 - experiment_functions - INFO - Early stopping at epoch 500. Best Metrics: (0.00025415865900554527, 6.743536652546399e-05, 0.00017324423653452384)
2026-07-01 12:49:21,671 - optuna.study.study - INFO - Trial 11 finished with values: [0.00025415865900554527, 6.743536652546399e-05, 0.00017324423653452384] and parameters: {'n_layers': 4, 'embedding_dim': 64, 'lr': 3.9913118879641105e-05, 'lambda_val': 5.585605103846419e-06, 'batch_size': 3465, 'optimizer': 'SGD'}.
2026-07-01 12:54:42,707 - optuna.study.study - INFO - Trial 12 finished with values: [0.0007840278325460878, 0.00018995877894496894, 0.0004563296027653825] and parameters: {'n_layers': 3, 'embedding_dim': 96, 'lr': 0.0002344555894573946, 'lambda_val': 0.012387749411648405, 'batch_size': 1848, 'optimizer': 'RMSprop'}.
2026-07-01 13:00:32,543 - optuna.study.study - INFO - Trial 13 finished with values: [0.0026678376246052652, 0.0007503371768326273, 0.0018130461685508209] and parameters: {'n_layers': 4, 'embedding_dim': 128, 'lr': 0.0008423328164015242, 'lambda_val': 3.1335017132005896e-06, 'batch_size': 1965, 'optimizer': 'Adam'}.
2026-07-01 13:01:13,026 - experiment_functions - INFO - Early stopping at epoch 500. Best Metrics: (0.0002244245788305169, 6.173660315711492e-05, 0.0001359637161949051)
2026-07-01 13:01:13,118 - optuna.study.study - INFO - Trial 14 finished with values: [0.0002244245788305169, 6.173660315711492e-05, 0.0001359637161949051] and parameters: {'n_layers': 3, 'embedding_dim': 32, 'lr': 2.0279784448757135e-05, 'lambda_val': 3.6906191044755753e-06, 'batch_size': 3037, 'optimizer': 'SGD'}.
2026-07-01 13:02:07,994 - experiment_functions - INFO - Early stopping at epoch 500. Best Metrics: (0.0002118908505148366, 6.648557263073914e-05, 0.00013593114981996792)
2026-07-01 13:02:08,079 - optuna.study.study - INFO - Trial 15 finished with values: [0.0002118908505148366, 6.648557263073914e-05, 0.00013593114981996792] and parameters: {'n_layers': 4, 'embedding_dim': 256, 'lr': 0.00022927557385284198, 'lambda_val': 1.2020112467251177e-05, 'batch_size': 3214, 'optimizer': 'SGD'}.
2026-07-01 13:03:20,056 - experiment_functions - INFO - Early stopping at epoch 700. Best Metrics: (0.0015083372051489785, 0.00046729859620462365, 0.0010190665706683198)
2026-07-01 13:03:20,155 - optuna.study.study - INFO - Trial 16 finished with values: [0.0015083372051489785, 0.00046729859620462365, 0.0010190665706683198] and parameters: {'n_layers': 3, 'embedding_dim': 256, 'lr': 0.0016422068986048546, 'lambda_val': 0.03603856247164571, 'batch_size': 3642, 'optimizer': 'RMSprop'}.
2026-07-01 13:04:18,794 - experiment_functions - INFO - Early stopping at epoch 650. Best Metrics: (0.001965103781713072, 0.0005480310772562354, 0.001364772590914975)
2026-07-01 13:04:18,897 - optuna.study.study - INFO - Trial 17 finished with values: [0.001965103781713072, 0.0005480310772562354, 0.001364772590914975] and parameters: {'n_layers': 3, 'embedding_dim': 128, 'lr': 0.006376466713326958, 'lambda_val': 0.00034740027371853627, 'batch_size': 4001, 'optimizer': 'Adam'}.
2026-07-01 13:05:08,821 - experiment_functions - INFO - Early stopping at epoch 550. Best Metrics: (0.0013797105291233826, 0.0004198089014683813, 0.0010315401894146214)
2026-07-01 13:05:08,915 - optuna.study.study - INFO - Trial 18 finished with values: [0.0013797105291233826, 0.0004198089014683813, 0.0010315401894146214] and parameters: {'n_layers': 3, 'embedding_dim': 128, 'lr': 0.01617740530595442, 'lambda_val': 0.0012592144246174213, 'batch_size': 1159, 'optimizer': 'RMSprop'}.
2026-07-01 13:05:49,915 - experiment_functions - INFO - Early stopping at epoch 500. Best Metrics: (0.00016622346695230192, 5.318845810459131e-05, 0.00010961905694021274)
2026-07-01 13:05:50,005 - optuna.study.study - INFO - Trial 19 finished with values: [0.00016622346695230192, 5.318845810459131e-05, 0.00010961905694021274] and parameters: {'n_layers': 4, 'embedding_dim': 32, 'lr': 0.00010549755673182789, 'lambda_val': 0.0010917729032735917, 'batch_size': 1905, 'optimizer': 'SGD'}.
2026-07-01 13:10:57,090 - optuna.study.study - INFO - Trial 20 finished with values: [0.00035012588935776713, 7.503371768326274e-05, 0.00017777778833791768] and parameters: {'n_layers': 3, 'embedding_dim': 64, 'lr': 0.0001385692374716, 'lambda_val': 4.844011811529606e-06, 'batch_size': 618, 'optimizer': 'RMSprop'}.
2026-07-01 13:15:52,864 - optuna.study.study - INFO - Trial 21 finished with values: [0.0010908246575277937, 0.00026689208441768136, 0.0006718416083866677] and parameters: {'n_layers': 3, 'embedding_dim': 32, 'lr': 0.0002270042929626457, 'lambda_val': 8.476760666962497e-05, 'batch_size': 3905, 'optimizer': 'RMSprop'}.
2026-07-01 13:16:37,277 - experiment_functions - INFO - Early stopping at epoch 500. Best Metrics: (0.00022165473933616673, 5.793742757821554e-05, 0.00012257036157255075)
2026-07-01 13:16:37,353 - optuna.study.study - INFO - Trial 22 finished with values: [0.00022165473933616673, 5.793742757821554e-05, 0.00012257036157255075] and parameters: {'n_layers': 4, 'embedding_dim': 96, 'lr': 9.655131101868287e-05, 'lambda_val': 0.0010332857801635745, 'batch_size': 547, 'optimizer': 'SGD'}.
2026-07-01 13:21:34,935 - optuna.study.study - INFO - Trial 23 finished with values: [0.0021973976896419315, 0.0005869726269399541, 0.001429084302596876] and parameters: {'n_layers': 3, 'embedding_dim': 32, 'lr': 0.0008549054963496413, 'lambda_val': 8.805105847994294e-05, 'batch_size': 4034, 'optimizer': 'Adam'}.
2026-07-01 13:22:36,291 - experiment_functions - INFO - Early stopping at epoch 550. Best Metrics: (0.0018963501138642917, 0.000544231901677336, 0.001252189961041559)
2026-07-01 13:22:36,385 - optuna.study.study - INFO - Trial 24 finished with values: [0.0018963501138642917, 0.000544231901677336, 0.001252189961041559] and parameters: {'n_layers': 4, 'embedding_dim': 256, 'lr': 0.019546253809520703, 'lambda_val': 1.1427509100447198e-06, 'batch_size': 3544, 'optimizer': 'Adam'}.
2026-07-01 13:23:28,141 - experiment_functions - INFO - Early stopping at epoch 500. Best Metrics: (0.00022413533732137933, 5.888722147294038e-05, 0.00011265811521696668)
2026-07-01 13:23:28,229 - optuna.study.study - INFO - Trial 25 finished with values: [0.00022413533732137933, 5.888722147294038e-05, 0.00011265811521696668] and parameters: {'n_layers': 3, 'embedding_dim': 256, 'lr': 0.025035185117328034, 'lambda_val': 1.7400188628222683e-06, 'batch_size': 2357, 'optimizer': 'SGD'}.
2026-07-01 13:27:19,917 - experiment_functions - INFO - Early stopping at epoch 2500. Best Metrics: (0.001187350864720108, 0.00041221055031058257, 0.0008207513242731697)
2026-07-01 13:27:20,011 - optuna.study.study - INFO - Trial 26 finished with values: [0.001187350864720108, 0.00041221055031058257, 0.0008207513242731697] and parameters: {'n_layers': 2, 'embedding_dim': 256, 'lr': 0.07542520245467159, 'lambda_val': 0.0013727825446578378, 'batch_size': 3389, 'optimizer': 'Adam'}.
2026-07-01 13:30:23,558 - experiment_functions - INFO - Early stopping at epoch 2450. Best Metrics: (0.0026397854715388535, 0.0006942993370438616, 0.0016817867925373038)
2026-07-01 13:30:23,646 - optuna.study.study - INFO - Trial 27 finished with values: [0.0026397854715388535, 0.0006942993370438616, 0.0016817867925373038] and parameters: {'n_layers': 3, 'embedding_dim': 32, 'lr': 0.001878376227052758, 'lambda_val': 3.747302157374259e-06, 'batch_size': 1100, 'optimizer': 'Adam'}.
2026-07-01 13:31:08,351 - experiment_functions - INFO - Early stopping at epoch 550. Best Metrics: (0.0011100914783185845, 0.00027544022947020494, 0.0007849157390157216)
2026-07-01 13:31:08,482 - optuna.study.study - INFO - Trial 28 finished with values: [0.0011100914783185845, 0.00027544022947020494, 0.0007849157390157216] and parameters: {'n_layers': 1, 'embedding_dim': 64, 'lr': 0.08473267368894868, 'lambda_val': 3.5705571192617918e-06, 'batch_size': 2816, 'optimizer': 'Adam'}.
2026-07-01 13:31:53,757 - experiment_functions - INFO - Early stopping at epoch 500. Best Metrics: (0.0002491884623386808, 5.888722147294038e-05, 0.00014282461884780357)
2026-07-01 13:31:53,841 - optuna.study.study - INFO - Trial 29 finished with values: [0.0002491884623386808, 5.888722147294038e-05, 0.00014282461884780357] and parameters: {'n_layers': 1, 'embedding_dim': 256, 'lr': 0.09928603244201695, 'lambda_val': 0.017959355068286404, 'batch_size': 3125, 'optimizer': 'SGD'}.
2026-07-01 13:37:06,024 - optuna.study.study - INFO - Trial 30 finished with values: [0.00036395157053391465, 8.453165663051119e-05, 0.00019990348420562837] and parameters: {'n_layers': 1, 'embedding_dim': 128, 'lr': 0.00010813714265458819, 'lambda_val': 0.0024700480666482363, 'batch_size': 3869, 'optimizer': 'Adam'}.
2026-07-01 13:37:49,979 - experiment_functions - INFO - Early stopping at epoch 500. Best Metrics: (0.00017878927350376266, 4.653990084151739e-05, 8.717158916268765e-05)
2026-07-01 13:37:50,071 - optuna.study.study - INFO - Trial 31 finished with values: [0.00017878927350376266, 4.653990084151739e-05, 8.717158916268765e-05] and parameters: {'n_layers': 2, 'embedding_dim': 128, 'lr': 0.00028746185906824653, 'lambda_val': 1.700611762500559e-05, 'batch_size': 3344, 'optimizer': 'SGD'}.
2026-07-01 13:38:38,454 - experiment_functions - INFO - Early stopping at epoch 550. Best Metrics: (0.0008093203987691077, 0.00022510115304978821, 0.0005723589078245652)
2026-07-01 13:38:38,552 - optuna.study.study - INFO - Trial 32 finished with values: [0.0008093203987691077, 0.00022510115304978821, 0.0005723589078245652] and parameters: {'n_layers': 2, 'embedding_dim': 128, 'lr': 0.07037617495184816, 'lambda_val': 0.004293504048725636, 'batch_size': 627, 'optimizer': 'Adam'}.
2026-07-01 13:39:34,219 - experiment_functions - INFO - Early stopping at epoch 700. Best Metrics: (0.0017787370155215084, 0.00048059571073077144, 0.001177993680325864)
2026-07-01 13:39:34,298 - optuna.study.study - INFO - Trial 33 finished with values: [0.0017787370155215084, 0.00048059571073077144, 0.001177993680325864] and parameters: {'n_layers': 3, 'embedding_dim': 32, 'lr': 0.005594285769148444, 'lambda_val': 0.0041037694916939175, 'batch_size': 1427, 'optimizer': 'Adam'}.
2026-07-01 13:40:31,728 - experiment_functions - INFO - Early stopping at epoch 550. Best Metrics: (0.0016459643710873902, 0.000501491176414718, 0.0011300161086709633)
2026-07-01 13:40:31,851 - optuna.study.study - INFO - Trial 34 finished with values: [0.0016459643710873902, 0.000501491176414718, 0.0011300161086709633] and parameters: {'n_layers': 3, 'embedding_dim': 256, 'lr': 0.006276231155246127, 'lambda_val': 0.0030494501587534817, 'batch_size': 2281, 'optimizer': 'RMSprop'}.
2026-07-01 13:45:57,075 - optuna.study.study - INFO - Trial 35 finished with values: [0.00038913401085591314, 9.97283589461087e-05, 0.0002200858250515288] and parameters: {'n_layers': 2, 'embedding_dim': 128, 'lr': 0.00012030396263709818, 'lambda_val': 3.1498910463361027e-06, 'batch_size': 3344, 'optimizer': 'Adam'}.
2026-07-01 13:46:51,951 - experiment_functions - INFO - Early stopping at epoch 500. Best Metrics: (0.0002307103131140999, 5.983701536766523e-05, 0.00012018191207438032)
2026-07-01 13:46:52,047 - optuna.study.study - INFO - Trial 36 finished with values: [0.0002307103131140999, 5.983701536766523e-05, 0.00012018191207438032] and parameters: {'n_layers': 4, 'embedding_dim': 256, 'lr': 0.07788459868999296, 'lambda_val': 0.00016066177863859982, 'batch_size': 2635, 'optimizer': 'SGD'}.
2026-07-01 13:51:48,352 - optuna.study.study - INFO - Trial 37 finished with values: [0.0014486845446310733, 0.000348574359364018, 0.0010228405404698905] and parameters: {'n_layers': 3, 'embedding_dim': 32, 'lr': 0.000401888224098322, 'lambda_val': 0.002686613104990216, 'batch_size': 2234, 'optimizer': 'RMSprop'}.
2026-07-01 13:54:25,937 - experiment_functions - INFO - Early stopping at epoch 2050. Best Metrics: (0.001841964324277372, 0.0004900936496780199, 0.0012505380025517171)
2026-07-01 13:54:26,014 - optuna.study.study - INFO - Trial 38 finished with values: [0.001841964324277372, 0.0004900936496780199, 0.0012505380025517171] and parameters: {'n_layers': 2, 'embedding_dim': 64, 'lr': 0.005703114197626056, 'lambda_val': 3.0256770800491656e-06, 'batch_size': 960, 'optimizer': 'Adam'}.
2026-07-01 13:57:01,689 - experiment_functions - INFO - Early stopping at epoch 1950. Best Metrics: (0.000994770277865811, 0.000336227038732595, 0.0007356269664821946)
2026-07-01 13:57:01,780 - optuna.study.study - INFO - Trial 39 finished with values: [0.000994770277865811, 0.000336227038732595, 0.0007356269664821946] and parameters: {'n_layers': 2, 'embedding_dim': 96, 'lr': 0.06687940984545002, 'lambda_val': 0.03577149464687162, 'batch_size': 3758, 'optimizer': 'Adam'}.
2026-07-01 13:57:53,502 - experiment_functions - INFO - Early stopping at epoch 500. Best Metrics: (0.00025636828523132725, 6.743536652546399e-05, 0.00013511208539150393)
2026-07-01 13:57:53,589 - optuna.study.study - INFO - Trial 40 finished with values: [0.00025636828523132725, 6.743536652546399e-05, 0.00013511208539150393] and parameters: {'n_layers': 3, 'embedding_dim': 256, 'lr': 1.754913341960358e-05, 'lambda_val': 0.00375182893263002, 'batch_size': 1841, 'optimizer': 'SGD'}.
2026-07-01 14:00:16,435 - experiment_functions - INFO - Early stopping at epoch 1850. Best Metrics: (0.0011567164564330343, 0.00038751590904773667, 0.0008106278188874967)
2026-07-01 14:00:16,520 - optuna.study.study - INFO - Trial 41 finished with values: [0.0011567164564330343, 0.00038751590904773667, 0.0008106278188874967] and parameters: {'n_layers': 2, 'embedding_dim': 64, 'lr': 0.05809621572933163, 'lambda_val': 0.007739151169996188, 'batch_size': 4074, 'optimizer': 'Adam'}.
2026-07-01 14:01:37,670 - experiment_functions - INFO - Early stopping at epoch 1000. Best Metrics: (0.0007575813051388904, 0.00024979579431263414, 0.0005891032110828661)
2026-07-01 14:01:37,762 - optuna.study.study - INFO - Trial 42 finished with values: [0.0007575813051388904, 0.00024979579431263414, 0.0005891032110828661] and parameters: {'n_layers': 2, 'embedding_dim': 96, 'lr': 0.08122930190238219, 'lambda_val': 0.03347243406404254, 'batch_size': 3055, 'optimizer': 'RMSprop'}.
2026-07-01 14:03:15,193 - experiment_functions - INFO - Early stopping at epoch 1250. Best Metrics: (0.0012378155848206678, 0.0003732690006268639, 0.0008963832243160444)
2026-07-01 14:03:15,281 - optuna.study.study - INFO - Trial 43 finished with values: [0.0012378155848206678, 0.0003732690006268639, 0.0008963832243160444] and parameters: {'n_layers': 2, 'embedding_dim': 64, 'lr': 0.0022914869194475, 'lambda_val': 0.02620035099122833, 'batch_size': 1838, 'optimizer': 'RMSprop'}.
2026-07-01 14:04:03,462 - experiment_functions - INFO - Early stopping at epoch 600. Best Metrics: (0.0013616352315832573, 0.00034192580210094407, 0.0009295428835905722)
2026-07-01 14:04:03,552 - optuna.study.study - INFO - Trial 44 finished with values: [0.0013616352315832573, 0.00034192580210094407, 0.0009295428835905722] and parameters: {'n_layers': 1, 'embedding_dim': 64, 'lr': 0.013510241191251177, 'lambda_val': 2.9125236439191383e-06, 'batch_size': 2701, 'optimizer': 'RMSprop'}.
2026-07-01 14:04:44,586 - experiment_functions - INFO - Early stopping at epoch 500. Best Metrics: (0.0001720597092174516, 5.223866420986646e-05, 0.00011171388057030982)
2026-07-01 14:04:44,670 - optuna.study.study - INFO - Trial 45 finished with values: [0.0001720597092174516, 5.223866420986646e-05, 0.00011171388057030982] and parameters: {'n_layers': 1, 'embedding_dim': 96, 'lr': 5.4819352996587904e-05, 'lambda_val': 2.080609400911567e-06, 'batch_size': 1768, 'optimizer': 'SGD'}.
2026-07-01 14:05:25,289 - experiment_functions - INFO - Early stopping at epoch 500. Best Metrics: (0.00023967380948207166, 6.17366031571149e-05, 0.00013535310595097272)
2026-07-01 14:05:25,394 - optuna.study.study - INFO - Trial 46 finished with values: [0.00023967380948207166, 6.17366031571149e-05, 0.00013535310595097272] and parameters: {'n_layers': 3, 'embedding_dim': 32, 'lr': 0.0036176308881654073, 'lambda_val': 3.9206684194563995e-06, 'batch_size': 1059, 'optimizer': 'SGD'}.
2026-07-01 14:06:05,771 - experiment_functions - INFO - Early stopping at epoch 500. Best Metrics: (0.0002037848683970423, 5.603783978876584e-05, 0.00010624815363010739)
2026-07-01 14:06:06,103 - optuna.study.study - INFO - Trial 47 finished with values: [0.0002037848683970423, 5.603783978876584e-05, 0.00010624815363010739] and parameters: {'n_layers': 1, 'embedding_dim': 64, 'lr': 0.000602258744474486, 'lambda_val': 0.0008741244788756404, 'batch_size': 3300, 'optimizer': 'SGD'}.
2026-07-01 14:07:34,442 - experiment_functions - INFO - Early stopping at epoch 1050. Best Metrics: (0.0019753730196106164, 0.0005556294284140341, 0.0013605886820144439)
2026-07-01 14:07:34,527 - optuna.study.study - INFO - Trial 48 finished with values: [0.0019753730196106164, 0.0005556294284140341, 0.0013605886820144439] and parameters: {'n_layers': 2, 'embedding_dim': 128, 'lr': 0.0030363640610353106, 'lambda_val': 6.5134158560038e-06, 'batch_size': 3567, 'optimizer': 'RMSprop'}.
2026-07-01 14:08:27,502 - experiment_functions - INFO - Early stopping at epoch 650. Best Metrics: (0.0014828232959180911, 0.00039796364188971, 0.0009763858632673619)
2026-07-01 14:08:27,613 - optuna.study.study - INFO - Trial 49 finished with values: [0.0014828232959180911, 0.00039796364188971, 0.0009763858632673619] and parameters: {'n_layers': 2, 'embedding_dim': 64, 'lr': 0.021107902436215267, 'lambda_val': 3.9837177447581685e-05, 'batch_size': 2705, 'optimizer': 'Adam'}.
2026-07-01 14:09:49,565 - experiment_functions - INFO - Early stopping at epoch 900. Best Metrics: (0.0024010771581734875, 0.0007180441844119826, 0.0015946508314844368)
2026-07-01 14:09:49,662 - optuna.study.study - INFO - Trial 50 finished with values: [0.0024010771581734875, 0.0007180441844119826, 0.0015946508314844368] and parameters: {'n_layers': 4, 'embedding_dim': 128, 'lr': 0.0030363640610353106, 'lambda_val': 4.5390100598147375e-06, 'batch_size': 3174, 'optimizer': 'RMSprop'}.
2026-07-01 14:10:33,451 - experiment_functions - INFO - Early stopping at epoch 500. Best Metrics: (0.00021348940039937956, 5.9837015367665226e-05, 0.00013295284822238638)
2026-07-01 14:10:33,538 - optuna.study.study - INFO - Trial 51 finished with values: [0.00021348940039937956, 5.9837015367665226e-05, 0.00013295284822238638] and parameters: {'n_layers': 3, 'embedding_dim': 96, 'lr': 0.06687940984545002, 'lambda_val': 2.2572188706037416e-06, 'batch_size': 1841, 'optimizer': 'SGD'}.
2026-07-01 14:11:54,658 - experiment_functions - INFO - Early stopping at epoch 1050. Best Metrics: (0.0021834533343155914, 0.0005831734513610547, 0.0013958615240260575)
2026-07-01 14:11:54,974 - optuna.study.study - INFO - Trial 52 finished with values: [0.0021834533343155914, 0.0005831734513610547, 0.0013958615240260575] and parameters: {'n_layers': 3, 'embedding_dim': 32, 'lr': 0.001878376227052758, 'lambda_val': 0.0012592144246174213, 'batch_size': 3082, 'optimizer': 'RMSprop'}.
2026-07-01 14:12:49,567 - experiment_functions - INFO - Early stopping at epoch 500. Best Metrics: (0.00022566600024143205, 6.173660315711492e-05, 0.00013206078109337377)
2026-07-01 14:12:49,663 - optuna.study.study - INFO - Trial 53 finished with values: [0.00022566600024143205, 6.173660315711492e-05, 0.00013206078109337377] and parameters: {'n_layers': 4, 'embedding_dim': 256, 'lr': 0.0030363640610353106, 'lambda_val': 0.03603856247164571, 'batch_size': 3567, 'optimizer': 'SGD'}.
2026-07-01 14:13:49,960 - experiment_functions - INFO - Early stopping at epoch 700. Best Metrics: (0.000240827283809935, 5.7937427578215534e-05, 0.00014731981720542128)
2026-07-01 14:13:50,047 - optuna.study.study - INFO - Trial 54 finished with values: [0.000240827283809935, 5.7937427578215534e-05, 0.00014731981720542128] and parameters: {'n_layers': 2, 'embedding_dim': 128, 'lr': 1.0076352581297662e-05, 'lambda_val': 0.03577149464687162, 'batch_size': 3758, 'optimizer': 'Adam'}.
2026-07-01 14:18:27,309 - experiment_functions - INFO - Early stopping at epoch 3700. Best Metrics: (0.002735342863725364, 0.0007683832608323994, 0.0018125134380046924)
