2026-06-30 16:34:52,973 - optuna.study.study - INFO - Trial 177 finished with values: [0.001623247277077163, 0.00046634880230989875, 0.001134246448747225] and parameters: {'n_layers': 3, 'embedding_dim': 96, 'lr': 0.004974098253366267, 'lambda_val': 0.009549864442144507, 'batch_size': 2368, 'optimizer': 'Adam'}.
2026-06-30 16:35:50,655 - experiment_functions - INFO - Early stopping at epoch 650. Best Metrics: (0.0014892918438053834, 0.0004720475656782478, 0.001049392236719347)
2026-06-30 16:35:50,729 - optuna.study.study - INFO - Trial 178 finished with values: [0.0014892918438053834, 0.0004720475656782478, 0.001049392236719347] and parameters: {'n_layers': 4, 'embedding_dim': 96, 'lr': 0.004974098253366267, 'lambda_val': 0.016466179289838786, 'batch_size': 2368, 'optimizer': 'Adam'}.
2026-06-30 16:42:22,685 - optuna.study.study - INFO - Trial 179 finished with values: [0.0022208773758915753, 0.0006401610850445453, 0.0015484657815251614] and parameters: {'n_layers': 3, 'embedding_dim': 256, 'lr': 0.0006387010239111333, 'lambda_val': 0.00016218839236180774, 'batch_size': 1925, 'optimizer': 'Adam'}.
2026-06-30 16:44:46,654 - experiment_functions - INFO - Early stopping at epoch 1550. Best Metrics: (0.0021177089322563626, 0.0006116672682028, 0.0014206817003231834)
2026-06-30 16:44:46,729 - optuna.study.study - INFO - Trial 180 finished with values: [0.0021177089322563626, 0.0006116672682028, 0.0014206817003231834] and parameters: {'n_layers': 2, 'embedding_dim': 256, 'lr': 0.004124417799899418, 'lambda_val': 1.3936968571078208e-06, 'batch_size': 2917, 'optimizer': 'RMSprop'}.
2026-06-30 16:49:47,808 - optuna.study.study - INFO - Trial 181 finished with values: [0.002146309644523752, 0.0006002697414661019, 0.0014507495331007806] and parameters: {'n_layers': 4, 'embedding_dim': 32, 'lr': 0.000678453369086835, 'lambda_val': 0.00023859514179547838, 'batch_size': 3994, 'optimizer': 'Adam'}.
2026-06-30 16:50:44,002 - experiment_functions - INFO - Early stopping at epoch 650. Best Metrics: (0.0018165010592522532, 0.0005347339627300876, 0.001253920442993651)
2026-06-30 16:50:44,083 - optuna.study.study - INFO - Trial 182 finished with values: [0.0018165010592522532, 0.0005347339627300876, 0.001253920442993651] and parameters: {'n_layers': 3, 'embedding_dim': 96, 'lr': 0.00875572898955806, 'lambda_val': 0.00016218839236180774, 'batch_size': 1192, 'optimizer': 'RMSprop'}.
2026-06-30 16:54:42,662 - experiment_functions - INFO - Early stopping at epoch 3250. Best Metrics: (0.0017979365942312677, 0.0004217084892578311, 0.001160640428318026)
2026-06-30 16:54:42,756 - optuna.study.study - INFO - Trial 183 finished with values: [0.0017979365942312677, 0.0004217084892578311, 0.001160640428318026] and parameters: {'n_layers': 2, 'embedding_dim': 32, 'lr': 0.000678453369086835, 'lambda_val': 0.0013330885045298511, 'batch_size': 2119, 'optimizer': 'RMSprop'}.
2026-06-30 16:56:01,371 - experiment_functions - INFO - Early stopping at epoch 950. Best Metrics: (0.002377558247763501, 0.0006762532530440895, 0.0016982303593412642)
2026-06-30 16:56:01,452 - optuna.study.study - INFO - Trial 184 finished with values: [0.002377558247763501, 0.0006762532530440895, 0.0016982303593412642] and parameters: {'n_layers': 4, 'embedding_dim': 64, 'lr': 0.004766437510594636, 'lambda_val': 1.3936968571078208e-06, 'batch_size': 2553, 'optimizer': 'Adam'}.
2026-06-30 16:56:46,061 - experiment_functions - INFO - Early stopping at epoch 500. Best Metrics: (0.00026966308432619057, 6.268639705183976e-05, 0.00014484134622381052)
2026-06-30 16:56:46,150 - optuna.study.study - INFO - Trial 185 finished with values: [0.00026966308432619057, 6.268639705183976e-05, 0.00014484134622381052] and parameters: {'n_layers': 4, 'embedding_dim': 96, 'lr': 0.004974098253366267, 'lambda_val': 0.0005147043850123313, 'batch_size': 2368, 'optimizer': 'SGD'}.
2026-06-30 16:57:39,979 - experiment_functions - INFO - Early stopping at epoch 600. Best Metrics: (0.0017808929699501136, 0.0005119389092566913, 0.0012312097569087668)
2026-06-30 16:57:40,085 - optuna.study.study - INFO - Trial 186 finished with values: [0.0017808929699501136, 0.0005119389092566913, 0.0012312097569087668] and parameters: {'n_layers': 4, 'embedding_dim': 96, 'lr': 0.004974098253366267, 'lambda_val': 0.006790143066606948, 'batch_size': 3994, 'optimizer': 'Adam'}.
2026-06-30 17:03:03,655 - optuna.study.study - INFO - Trial 187 finished with values: [0.002599171022908368, 0.0006658055202021162, 0.001692317416923979] and parameters: {'n_layers': 3, 'embedding_dim': 96, 'lr': 0.0006387010239111333, 'lambda_val': 0.00016218839236180774, 'batch_size': 2156, 'optimizer': 'Adam'}.
2026-06-30 17:04:45,502 - experiment_functions - INFO - Early stopping at epoch 1300. Best Metrics: (0.0016116738210620097, 0.0004141101381000323, 0.0010571124537959785)
2026-06-30 17:04:45,594 - optuna.study.study - INFO - Trial 188 finished with values: [0.0016116738210620097, 0.0004141101381000323, 0.0010571124537959785] and parameters: {'n_layers': 1, 'embedding_dim': 96, 'lr': 0.004974098253366267, 'lambda_val': 0.00042560409247420055, 'batch_size': 733, 'optimizer': 'Adam'}.
2026-06-30 17:06:52,097 - experiment_functions - INFO - Early stopping at epoch 1600. Best Metrics: (0.0032719248477430097, 0.0008823585281993808, 0.0022062023873736228)
2026-06-30 17:06:52,193 - optuna.study.study - INFO - Trial 189 finished with values: [0.0032719248477430097, 0.0008823585281993808, 0.0022062023873736228] and parameters: {'n_layers': 3, 'embedding_dim': 64, 'lr': 0.002537969130795011, 'lambda_val': 6.297092163325562e-06, 'batch_size': 591, 'optimizer': 'RMSprop'}.
2026-06-30 17:08:39,287 - experiment_functions - INFO - Early stopping at epoch 1300. Best Metrics: (0.0011107749739434564, 0.0003761183823110385, 0.0007829480224000694)
2026-06-30 17:08:39,378 - optuna.study.study - INFO - Trial 190 finished with values: [0.0011107749739434564, 0.0003761183823110385, 0.0007829480224000694] and parameters: {'n_layers': 3, 'embedding_dim': 96, 'lr': 0.058252757069912876, 'lambda_val': 0.00042560409247420055, 'batch_size': 2089, 'optimizer': 'RMSprop'}.
2026-06-30 17:09:44,221 - experiment_functions - INFO - Early stopping at epoch 700. Best Metrics: (0.002155571627619589, 0.0006306631460972968, 0.001492341600725682)
2026-06-30 17:09:44,308 - optuna.study.study - INFO - Trial 191 finished with values: [0.002155571627619589, 0.0006306631460972968, 0.001492341600725682] and parameters: {'n_layers': 4, 'embedding_dim': 128, 'lr': 0.00476777556110791, 'lambda_val': 0.0006597683688978018, 'batch_size': 1897, 'optimizer': 'Adam'}.
2026-06-30 17:10:58,767 - experiment_functions - INFO - Early stopping at epoch 900. Best Metrics: (0.002042440057490645, 0.0005850730391505043, 0.0014122483311377646)
2026-06-30 17:10:58,841 - optuna.study.study - INFO - Trial 192 finished with values: [0.002042440057490645, 0.0005850730391505043, 0.0014122483311377646] and parameters: {'n_layers': 4, 'embedding_dim': 64, 'lr': 0.00875572898955806, 'lambda_val': 4.2886606921314005e-06, 'batch_size': 697, 'optimizer': 'Adam'}.
2026-06-30 17:12:05,495 - experiment_functions - INFO - Early stopping at epoch 800. Best Metrics: (0.0022795336761916927, 0.0006411108789392702, 0.0015478404450569216)
2026-06-30 17:12:05,583 - optuna.study.study - INFO - Trial 193 finished with values: [0.0022795336761916927, 0.0006411108789392702, 0.0015478404450569216] and parameters: {'n_layers': 4, 'embedding_dim': 64, 'lr': 0.004974098253366267, 'lambda_val': 0.00042560409247420055, 'batch_size': 2089, 'optimizer': 'Adam'}.
2026-06-30 17:17:28,692 - optuna.study.study - INFO - Trial 194 finished with values: [0.002395664897294122, 0.0006838516042018881, 0.0016224385180555016] and parameters: {'n_layers': 3, 'embedding_dim': 96, 'lr': 0.0006387010239111333, 'lambda_val': 0.00135046939560172, 'batch_size': 2956, 'optimizer': 'RMSprop'}.
2026-06-30 17:18:24,709 - experiment_functions - INFO - Early stopping at epoch 700. Best Metrics: (0.0018592023451207411, 0.0005033907642041678, 0.0012750132846779069)
2026-06-30 17:18:24,793 - optuna.study.study - INFO - Trial 195 finished with values: [0.0018592023451207411, 0.0005033907642041678, 0.0012750132846779069] and parameters: {'n_layers': 4, 'embedding_dim': 32, 'lr': 0.00875572898955806, 'lambda_val': 0.0006597683688978018, 'batch_size': 1897, 'optimizer': 'Adam'}.
2026-06-30 17:19:16,748 - experiment_functions - INFO - Early stopping at epoch 600. Best Metrics: (0.0018234348181765312, 0.0005242862298881144, 0.001274103132855632)
2026-06-30 17:19:16,831 - optuna.study.study - INFO - Trial 196 finished with values: [0.0018234348181765312, 0.0005242862298881144, 0.001274103132855632] and parameters: {'n_layers': 3, 'embedding_dim': 96, 'lr': 0.017656978087572574, 'lambda_val': 0.00016218839236180774, 'batch_size': 2917, 'optimizer': 'Adam'}.
2026-06-30 17:24:13,851 - experiment_functions - INFO - Early stopping at epoch 3950. Best Metrics: (0.002155659472476927, 0.0005641775734665578, 0.001451448894671894)
2026-06-30 17:24:13,919 - optuna.study.study - INFO - Trial 197 finished with values: [0.002155659472476927, 0.0005641775734665578, 0.001451448894671894] and parameters: {'n_layers': 4, 'embedding_dim': 32, 'lr': 0.000678453369086835, 'lambda_val': 0.0009178169951654746, 'batch_size': 3994, 'optimizer': 'Adam'}.
2026-06-30 17:29:12,951 - optuna.study.study - INFO - Trial 198 finished with values: [0.0020691014664892585, 0.0005394829322037119, 0.001396021774400832] and parameters: {'n_layers': 4, 'embedding_dim': 32, 'lr': 0.000678453369086835, 'lambda_val': 1.4316982223935532e-06, 'batch_size': 591, 'optimizer': 'RMSprop'}.
2026-06-30 17:30:20,702 - experiment_functions - INFO - Early stopping at epoch 800. Best Metrics: (0.0023860344335708762, 0.0006829018103071634, 0.0015940064403960606)
2026-06-30 17:30:20,797 - optuna.study.study - INFO - Trial 199 finished with values: [0.0023860344335708762, 0.0006829018103071634, 0.0015940064403960606] and parameters: {'n_layers': 3, 'embedding_dim': 96, 'lr': 0.003664683492842946, 'lambda_val': 0.00020499046063986734, 'batch_size': 1192, 'optimizer': 'RMSprop'}.
2026-06-30 17:31:56,330 - experiment_functions - INFO - Early stopping at epoch 950. Best Metrics: (0.0022168965708435056, 0.0006544079934654181, 0.0014574455504670983)
2026-06-30 17:31:56,398 - optuna.study.study - INFO - Trial 200 finished with values: [0.0022168965708435056, 0.0006544079934654181, 0.0014574455504670983] and parameters: {'n_layers': 3, 'embedding_dim': 256, 'lr': 0.006717797853561655, 'lambda_val': 4.2886606921314005e-06, 'batch_size': 697, 'optimizer': 'RMSprop'}.
2026-06-30 17:33:01,768 - experiment_functions - INFO - Early stopping at epoch 750. Best Metrics: (0.002327397468651525, 0.0006696046957810156, 0.0015097404913479552)
2026-06-30 17:33:01,863 - optuna.study.study - INFO - Trial 201 finished with values: [0.002327397468651525, 0.0006696046957810156, 0.0015097404913479552] and parameters: {'n_layers': 4, 'embedding_dim': 96, 'lr': 0.005907828997735388, 'lambda_val': 4.2886606921314005e-06, 'batch_size': 1192, 'optimizer': 'RMSprop'}.
2026-06-30 17:33:57,831 - experiment_functions - INFO - Early stopping at epoch 700. Best Metrics: (0.001473676453683579, 0.00044830271831012674, 0.0009734579827250046)
2026-06-30 17:33:57,903 - optuna.study.study - INFO - Trial 202 finished with values: [0.001473676453683579, 0.00044830271831012674, 0.0009734579827250046] and parameters: {'n_layers': 4, 'embedding_dim': 32, 'lr': 0.004124417799899418, 'lambda_val': 0.013093814395562463, 'batch_size': 591, 'optimizer': 'RMSprop'}.
2026-06-30 17:39:48,607 - optuna.study.study - INFO - Trial 203 finished with values: [0.002624303016479111, 0.0007579355279904261, 0.0017515274081965626] and parameters: {'n_layers': 4, 'embedding_dim': 128, 'lr': 0.000678453369086835, 'lambda_val': 1.2687145973445492e-05, 'batch_size': 2830, 'optimizer': 'Adam'}.
2026-06-30 17:40:50,468 - experiment_functions - INFO - Early stopping at epoch 700. Best Metrics: (0.0023593151037020104, 0.0006525084056759683, 0.0016082197302433137)
2026-06-30 17:40:50,536 - optuna.study.study - INFO - Trial 204 finished with values: [0.0023593151037020104, 0.0006525084056759683, 0.0016082197302433137] and parameters: {'n_layers': 4, 'embedding_dim': 96, 'lr': 0.004974098253366267, 'lambda_val': 0.00042560409247420055, 'batch_size': 2368, 'optimizer': 'Adam'}.
2026-06-30 17:41:44,548 - experiment_functions - INFO - Early stopping at epoch 600. Best Metrics: (0.0019282734061574515, 0.000586972626939954, 0.001363085207575702)
2026-06-30 17:41:44,639 - optuna.study.study - INFO - Trial 205 finished with values: [0.0019282734061574515, 0.000586972626939954, 0.001363085207575702] and parameters: {'n_layers': 3, 'embedding_dim': 128, 'lr': 0.00593507973929026, 'lambda_val': 0.00020499046063986734, 'batch_size': 2156, 'optimizer': 'RMSprop'}.
2026-06-30 17:42:59,304 - experiment_functions - INFO - Early stopping at epoch 950. Best Metrics: (0.002279249864331198, 0.0006316129399920218, 0.001464950858225142)
2026-06-30 17:42:59,382 - optuna.study.study - INFO - Trial 206 finished with values: [0.002279249864331198, 0.0006316129399920218, 0.001464950858225142] and parameters: {'n_layers': 4, 'embedding_dim': 32, 'lr': 0.00476777556110791, 'lambda_val': 0.0005632302201312664, 'batch_size': 733, 'optimizer': 'Adam'}.
2026-06-30 17:43:59,461 - experiment_functions - INFO - Early stopping at epoch 700. Best Metrics: (0.002032628449624062, 0.0006050187109397262, 0.0014087134468324363)
2026-06-30 17:43:59,531 - optuna.study.study - INFO - Trial 207 finished with values: [0.002032628449624062, 0.0006050187109397262, 0.0014087134468324363] and parameters: {'n_layers': 3, 'embedding_dim': 96, 'lr': 0.005804994964493687, 'lambda_val': 0.00020499046063986734, 'batch_size': 1192, 'optimizer': 'RMSprop'}.
2026-06-30 17:49:50,975 - experiment_functions - INFO - Early stopping at epoch 3400. Best Metrics: (0.0029622849404752362, 0.0008396178029367627, 0.00197419662786186)
2026-06-30 17:49:51,064 - optuna.study.study - INFO - Trial 208 finished with values: [0.0029622849404752362, 0.0008396178029367627, 0.00197419662786186] and parameters: {'n_layers': 4, 'embedding_dim': 256, 'lr': 0.00044843281655524526, 'lambda_val': 0.0006597683688978018, 'batch_size': 1897, 'optimizer': 'RMSprop'}.
2026-06-30 17:55:05,402 - optuna.study.study - INFO - Trial 209 finished with values: [0.0007820928354749499, 0.0001994567178922174, 0.0005155734957037513] and parameters: {'n_layers': 4, 'embedding_dim': 64, 'lr': 0.0002610079670845781, 'lambda_val': 4.2886606921314005e-06, 'batch_size': 1094, 'optimizer': 'RMSprop'}.
2026-06-30 17:57:15,655 - experiment_functions - INFO - Early stopping at epoch 1400. Best Metrics: (0.0019645327166355375, 0.000581273863571605, 0.0013845680506821899)
2026-06-30 17:57:15,741 - optuna.study.study - INFO - Trial 210 finished with values: [0.0019645327166355375, 0.000581273863571605, 0.0013845680506821899] and parameters: {'n_layers': 2, 'embedding_dim': 256, 'lr': 0.004124417799899418, 'lambda_val': 6.297092163325562e-06, 'batch_size': 2119, 'optimizer': 'RMSprop'}.
2026-06-30 18:02:29,028 - optuna.study.study - INFO - Trial 211 finished with values: [0.00040710279864856217, 0.00010732671010390746, 0.00023129586114172172] and parameters: {'n_layers': 2, 'embedding_dim': 96, 'lr': 0.0002880068796147015, 'lambda_val': 0.025361176998261025, 'batch_size': 1094, 'optimizer': 'Adam'}.
2026-06-30 18:07:46,764 - optuna.study.study - INFO - Trial 212 finished with values: [0.0026628381025882632, 0.0007351404745170298, 0.001830116986144282] and parameters: {'n_layers': 4, 'embedding_dim': 64, 'lr': 0.000678453369086835, 'lambda_val': 1.2687145973445492e-05, 'batch_size': 3994, 'optimizer': 'Adam'}.
2026-06-30 18:08:53,526 - experiment_functions - INFO - Early stopping at epoch 800. Best Metrics: (0.002492716113513587, 0.0007218433599908822, 0.001671692566209976)
2026-06-30 18:08:53,650 - optuna.study.study - INFO - Trial 213 finished with values: [0.002492716113513587, 0.0007218433599908822, 0.001671692566209976] and parameters: {'n_layers': 4, 'embedding_dim': 64, 'lr': 0.002537969130795011, 'lambda_val': 6.297092163325562e-06, 'batch_size': 3549, 'optimizer': 'RMSprop'}.
2026-06-30 18:09:55,389 - experiment_functions - INFO - Early stopping at epoch 700. Best Metrics: (0.002327685345881819, 0.0006905001614649621, 0.00154054032040201)
2026-06-30 18:09:55,477 - optuna.study.study - INFO - Trial 214 finished with values: [0.002327685345881819, 0.0006905001614649621, 0.00154054032040201] and parameters: {'n_layers': 4, 'embedding_dim': 96, 'lr': 0.004974098253366267, 'lambda_val': 4.2886606921314005e-06, 'batch_size': 1094, 'optimizer': 'RMSprop'}.
2026-06-30 18:14:18,237 - experiment_functions - INFO - Early stopping at epoch 3150. Best Metrics: (0.0030311353466619443, 0.0008538647113576353, 0.0020258709828522466)
2026-06-30 18:14:18,332 - optuna.study.study - INFO - Trial 215 finished with values: [0.0030311353466619443, 0.0008538647113576353, 0.0020258709828522466] and parameters: {'n_layers': 4, 'embedding_dim': 96, 'lr': 0.0006387010239111333, 'lambda_val': 4.2886606921314005e-06, 'batch_size': 3994, 'optimizer': 'RMSprop'}.
2026-06-30 18:15:11,894 - experiment_functions - INFO - Early stopping at epoch 600. Best Metrics: (0.0019984060944770363, 0.0006126170620975248, 0.0013375795306995208)
2026-06-30 18:15:11,997 - optuna.study.study - INFO - Trial 216 finished with values: [0.0019984060944770363, 0.0006126170620975248, 0.0013375795306995208] and parameters: {'n_layers': 4, 'embedding_dim': 96, 'lr': 0.004124417799899418, 'lambda_val': 0.00135046939560172, 'batch_size': 2956, 'optimizer': 'RMSprop'}.
2026-06-30 18:16:00,071 - experiment_functions - INFO - Early stopping at epoch 550. Best Metrics: (0.0014343266681556821, 0.0004122105503105827, 0.0010376688642079982)
2026-06-30 18:16:00,150 - optuna.study.study - INFO - Trial 217 finished with values: [0.0014343266681556821, 0.0004122105503105827, 0.0010376688642079982] and parameters: {'n_layers': 3, 'embedding_dim': 96, 'lr': 0.08807049283917555, 'lambda_val': 1.3936968571078208e-06, 'batch_size': 2089, 'optimizer': 'Adam'}.
2026-06-30 18:18:43,423 - experiment_functions - INFO - Early stopping at epoch 1750. Best Metrics: (0.0019032242770319432, 0.0005499306650456851, 0.0013376506503238498)
2026-06-30 18:18:43,511 - optuna.study.study - INFO - Trial 218 finished with values: [0.0019032242770319432, 0.0005499306650456851, 0.0013376506503238498] and parameters: {'n_layers': 2, 'embedding_dim': 256, 'lr': 0.004124417799899418, 'lambda_val': 4.2886606921314005e-06, 'batch_size': 591, 'optimizer': 'Adam'}.
2026-06-30 18:23:08,469 - experiment_functions - INFO - Early stopping at epoch 3550. Best Metrics: (0.002053630989046742, 0.0005024409703094429, 0.001360163441872762)
2026-06-30 18:23:08,555 - optuna.study.study - INFO - Trial 219 finished with values: [0.002053630989046742, 0.0005024409703094429, 0.001360163441872762] and parameters: {'n_layers': 3, 'embedding_dim': 32, 'lr': 0.000678453369086835, 'lambda_val': 0.00016218839236180774, 'batch_size': 3196, 'optimizer': 'Adam'}.
2026-06-30 18:25:19,626 - experiment_functions - INFO - Early stopping at epoch 1550. Best Metrics: (0.0031122953086820428, 0.0009374465740934217, 0.002149618127967473)
2026-06-30 18:25:19,724 - optuna.study.study - INFO - Trial 220 finished with values: [0.0031122953086820428, 0.0009374465740934217, 0.002149618127967473] and parameters: {'n_layers': 4, 'embedding_dim': 96, 'lr': 0.0025247724250856145, 'lambda_val': 4.2886606921314005e-06, 'batch_size': 697, 'optimizer': 'RMSprop'}.
2026-06-30 18:26:19,186 - experiment_functions - INFO - Early stopping at epoch 750. Best Metrics: (0.0018685689013346878, 0.00045590106946792554, 0.0012285077183695093)
2026-06-30 18:26:19,278 - optuna.study.study - INFO - Trial 221 finished with values: [0.0018685689013346878, 0.00045590106946792554, 0.0012285077183695093] and parameters: {'n_layers': 3, 'embedding_dim': 32, 'lr': 0.004124417799899418, 'lambda_val': 0.0004266264333481233, 'batch_size': 3407, 'optimizer': 'Adam'}.
2026-06-30 18:27:09,485 - experiment_functions - INFO - Early stopping at epoch 600. Best Metrics: (0.0021069024280276198, 0.0005679767490454572, 0.0014405378291010025)
2026-06-30 18:27:09,562 - optuna.study.study - INFO - Trial 222 finished with values: [0.0021069024280276198, 0.0005679767490454572, 0.0014405378291010025] and parameters: {'n_layers': 3, 'embedding_dim': 64, 'lr': 0.004974098253366267, 'lambda_val': 0.00042560409247420055, 'batch_size': 3994, 'optimizer': 'RMSprop'}.
2026-06-30 18:28:15,440 - experiment_functions - INFO - Early stopping at epoch 750. Best Metrics: (0.0024337707122583582, 0.0006829018103071634, 0.0016068039536631974)
2026-06-30 18:28:15,843 - optuna.study.study - INFO - Trial 223 finished with values: [0.0024337707122583582, 0.0006829018103071634, 0.0016068039536631974] and parameters: {'n_layers': 4, 'embedding_dim': 96, 'lr': 0.005448807202205781, 'lambda_val': 0.00016218839236180774, 'batch_size': 2156, 'optimizer': 'Adam'}.
2026-06-30 18:33:38,309 - optuna.study.study - INFO - Trial 224 finished with values: [0.0027047414628383545, 0.000758885321885151, 0.0019346153735528807] and parameters: {'n_layers': 3, 'embedding_dim': 96, 'lr': 0.0006387010239111333, 'lambda_val': 0.0008445896857268108, 'batch_size': 2170, 'optimizer': 'RMSprop'}.
2026-06-30 18:34:26,840 - experiment_functions - INFO - Early stopping at epoch 600. Best Metrics: (0.0019301466504198991, 0.0005480310772562354, 0.0012866034760743578)
2026-06-30 18:34:26,928 - optuna.study.study - INFO - Trial 225 finished with values: [0.0019301466504198991, 0.0005480310772562354, 0.0012866034760743578] and parameters: {'n_layers': 4, 'embedding_dim': 32, 'lr': 0.004766437510594636, 'lambda_val': 0.0009178169951654746, 'batch_size': 3196, 'optimizer': 'RMSprop'}.
