2026-06-30 10:56:38,909 - optuna.study.study - INFO - Trial 33 finished with values: [0.0013922799050718093, 0.00033242786315369565, 0.0008377181831410655] and parameters: {'n_layers': 1, 'embedding_dim': 96, 'lr': 0.004766437510594636, 'lambda_val': 0.0036553940027304025, 'batch_size': 2089, 'optimizer': 'Adam'}.
2026-06-30 10:57:24,225 - experiment_functions - INFO - Early stopping at epoch 500. Best Metrics: (0.00024050525829269663, 6.0786809262390075e-05, 0.0001182464487523697)
2026-06-30 10:57:24,322 - optuna.study.study - INFO - Trial 34 finished with values: [0.00024050525829269663, 6.0786809262390075e-05, 0.0001182464487523697] and parameters: {'n_layers': 1, 'embedding_dim': 256, 'lr': 0.00026284896555565354, 'lambda_val': 0.0009577973156644654, 'batch_size': 1516, 'optimizer': 'SGD'}.
2026-06-30 10:58:08,831 - experiment_functions - INFO - Early stopping at epoch 500. Best Metrics: (0.00011953913945261109, 3.3242786315369565e-05, 8.223971676082141e-05)
2026-06-30 10:58:08,921 - optuna.study.study - INFO - Trial 35 finished with values: [0.00011953913945261109, 3.3242786315369565e-05, 8.223971676082141e-05] and parameters: {'n_layers': 4, 'embedding_dim': 96, 'lr': 0.00023638674666407123, 'lambda_val': 0.0005642793176655723, 'batch_size': 1950, 'optimizer': 'SGD'}.
2026-06-30 10:59:15,178 - experiment_functions - INFO - Early stopping at epoch 600. Best Metrics: (0.0018418698310674855, 0.0005556294284140341, 0.001254895334152185)
2026-06-30 10:59:15,267 - optuna.study.study - INFO - Trial 36 finished with values: [0.0018418698310674855, 0.0005556294284140341, 0.001254895334152185] and parameters: {'n_layers': 4, 'embedding_dim': 256, 'lr': 0.004843365039812707, 'lambda_val': 0.009549864442144507, 'batch_size': 1496, 'optimizer': 'Adam'}.
2026-06-30 11:05:43,051 - optuna.study.study - INFO - Trial 37 finished with values: [0.0009435308244054415, 0.0002307999164181373, 0.0006008441242408627] and parameters: {'n_layers': 3, 'embedding_dim': 256, 'lr': 0.00015458725064861943, 'lambda_val': 9.104358741363162e-06, 'batch_size': 3624, 'optimizer': 'RMSprop'}.
2026-06-30 11:08:19,606 - experiment_functions - INFO - Early stopping at epoch 1500. Best Metrics: (0.0002389527050304417, 6.743536652546399e-05, 0.00014192169505698022)
2026-06-30 11:08:19,711 - optuna.study.study - INFO - Trial 38 finished with values: [0.0002389527050304417, 6.743536652546399e-05, 0.00014192169505698022] and parameters: {'n_layers': 4, 'embedding_dim': 256, 'lr': 1.0395859500941949e-05, 'lambda_val': 1.6082008532057943e-05, 'batch_size': 1542, 'optimizer': 'RMSprop'}.
2026-06-30 11:09:00,110 - experiment_functions - INFO - Early stopping at epoch 500. Best Metrics: (0.00021163469868611123, 5.413825199931615e-05, 0.00013449559686803004)
2026-06-30 11:09:00,262 - optuna.study.study - INFO - Trial 39 finished with values: [0.00021163469868611123, 5.413825199931615e-05, 0.00013449559686803004] and parameters: {'n_layers': 1, 'embedding_dim': 64, 'lr': 2.3934344726028388e-05, 'lambda_val': 5.5867199816500706e-05, 'batch_size': 1846, 'optimizer': 'SGD'}.
2026-06-30 11:09:44,194 - experiment_functions - INFO - Early stopping at epoch 550. Best Metrics: (0.00020810702268343254, 5.888722147294036e-05, 0.0001152803294205934)
2026-06-30 11:09:44,263 - optuna.study.study - INFO - Trial 40 finished with values: [0.00020810702268343254, 5.888722147294036e-05, 0.0001152803294205934] and parameters: {'n_layers': 2, 'embedding_dim': 32, 'lr': 4.473519296662849e-05, 'lambda_val': 0.004228737771711465, 'batch_size': 3065, 'optimizer': 'Adam'}.
2026-06-30 11:12:22,538 - experiment_functions - INFO - Early stopping at epoch 1850. Best Metrics: (0.00023527616074533393, 5.5088045894041e-05, 0.00014081823101553756)
2026-06-30 11:12:22,621 - optuna.study.study - INFO - Trial 41 finished with values: [0.00023527616074533393, 5.5088045894041e-05, 0.00014081823101553756] and parameters: {'n_layers': 1, 'embedding_dim': 256, 'lr': 3.445112808415425e-05, 'lambda_val': 7.67614944328337e-06, 'batch_size': 2176, 'optimizer': 'RMSprop'}.
2026-06-30 11:13:11,223 - experiment_functions - INFO - Early stopping at epoch 600. Best Metrics: (0.001660111240277441, 0.0004938928252569193, 0.0011038468585699288)
2026-06-30 11:13:11,311 - optuna.study.study - INFO - Trial 42 finished with values: [0.001660111240277441, 0.0004938928252569193, 0.0011038468585699288] and parameters: {'n_layers': 4, 'embedding_dim': 32, 'lr': 0.006717797853561655, 'lambda_val': 0.0013330885045298511, 'batch_size': 2167, 'optimizer': 'RMSprop'}.
2026-06-30 11:18:15,264 - optuna.study.study - INFO - Trial 43 finished with values: [0.00044704069985322014, 0.00011492506126170623, 0.00027281361002605306] and parameters: {'n_layers': 1, 'embedding_dim': 96, 'lr': 0.0001561670266831934, 'lambda_val': 0.0031327508443226783, 'batch_size': 2098, 'optimizer': 'Adam'}.
2026-06-30 11:19:21,646 - experiment_functions - INFO - Early stopping at epoch 600. Best Metrics: (0.001906669190972705, 0.0005755751002032559, 0.0012791762029414372)
2026-06-30 11:19:21,732 - optuna.study.study - INFO - Trial 44 finished with values: [0.001906669190972705, 0.0005755751002032559, 0.0012791762029414372] and parameters: {'n_layers': 4, 'embedding_dim': 256, 'lr': 0.00875572898955806, 'lambda_val': 0.0006597683688978018, 'batch_size': 1897, 'optimizer': 'Adam'}.
2026-06-30 11:20:43,737 - experiment_functions - INFO - Early stopping at epoch 1000. Best Metrics: (0.0015930351440199741, 0.0004359553976787038, 0.001092038854828492)
2026-06-30 11:20:43,823 - optuna.study.study - INFO - Trial 45 finished with values: [0.0015930351440199741, 0.0004359553976787038, 0.001092038854828492] and parameters: {'n_layers': 2, 'embedding_dim': 96, 'lr': 0.0019185273374190653, 'lambda_val': 0.006790143066606948, 'batch_size': 3734, 'optimizer': 'Adam'}.
2026-06-30 11:21:46,018 - experiment_functions - INFO - Early stopping at epoch 700. Best Metrics: (0.002393802007484544, 0.0006829018103071634, 0.0015775799441506652)
2026-06-30 11:21:46,101 - optuna.study.study - INFO - Trial 46 finished with values: [0.002393802007484544, 0.0006829018103071634, 0.0015775799441506652] and parameters: {'n_layers': 4, 'embedding_dim': 96, 'lr': 0.004974098253366267, 'lambda_val': 0.00042560409247420055, 'batch_size': 2368, 'optimizer': 'Adam'}.
2026-06-30 11:22:25,653 - experiment_functions - INFO - Early stopping at epoch 500. Best Metrics: (0.0002171116120270675, 5.318845810459131e-05, 0.00013689816888404175)
2026-06-30 11:22:25,746 - optuna.study.study - INFO - Trial 47 finished with values: [0.0002171116120270675, 5.318845810459131e-05, 0.00013689816888404175] and parameters: {'n_layers': 1, 'embedding_dim': 32, 'lr': 0.00012158497669592332, 'lambda_val': 0.0008009096459726104, 'batch_size': 1003, 'optimizer': 'SGD'}.
2026-06-30 11:23:09,467 - experiment_functions - INFO - Early stopping at epoch 500. Best Metrics: (0.0002715062939990167, 6.268639705183976e-05, 0.0001444334163155051)
2026-06-30 11:23:09,559 - optuna.study.study - INFO - Trial 48 finished with values: [0.0002715062939990167, 6.268639705183976e-05, 0.0001444334163155051] and parameters: {'n_layers': 3, 'embedding_dim': 96, 'lr': 1.0114417078403466e-05, 'lambda_val': 8.420578701822342e-05, 'batch_size': 3512, 'optimizer': 'SGD'}.
2026-06-30 11:28:09,723 - optuna.study.study - INFO - Trial 49 finished with values: [0.002681653202486617, 0.0007018976882016603, 0.0017836990112689436] and parameters: {'n_layers': 4, 'embedding_dim': 32, 'lr': 0.000678453369086835, 'lambda_val': 0.00020499046063986734, 'batch_size': 3196, 'optimizer': 'RMSprop'}.
2026-06-30 11:30:55,223 - experiment_functions - INFO - Early stopping at epoch 2200. Best Metrics: (0.0019686781197064355, 0.0004454533366259522, 0.0012365295634568737)
2026-06-30 11:30:55,346 - optuna.study.study - INFO - Trial 50 finished with values: [0.0019686781197064355, 0.0004454533366259522, 0.0012365295634568737] and parameters: {'n_layers': 1, 'embedding_dim': 64, 'lr': 0.001568445204958937, 'lambda_val': 0.00042560409247420055, 'batch_size': 2368, 'optimizer': 'Adam'}.
2026-06-30 11:34:50,598 - experiment_functions - INFO - Early stopping at epoch 2900. Best Metrics: (0.0015278752628871213, 0.00046634880230989886, 0.0010964627634260206)
2026-06-30 11:34:50,687 - optuna.study.study - INFO - Trial 51 finished with values: [0.0015278752628871213, 0.00046634880230989886, 0.0010964627634260206] and parameters: {'n_layers': 3, 'embedding_dim': 96, 'lr': 0.0005089814183335586, 'lambda_val': 0.021770054012174384, 'batch_size': 3945, 'optimizer': 'Adam'}.
2026-06-30 11:36:38,638 - experiment_functions - INFO - Early stopping at epoch 1400. Best Metrics: (0.0022495750538399795, 0.0006933495431491367, 0.0015631606183062583)
2026-06-30 11:36:38,729 - optuna.study.study - INFO - Trial 52 finished with values: [0.0022495750538399795, 0.0006933495431491367, 0.0015631606183062583] and parameters: {'n_layers': 4, 'embedding_dim': 32, 'lr': 0.006717797853561655, 'lambda_val': 4.2886606921314005e-06, 'batch_size': 697, 'optimizer': 'RMSprop'}.
2026-06-30 11:41:53,511 - optuna.study.study - INFO - Trial 53 finished with values: [0.0009070120072509665, 0.00021560321410253976, 0.0005737262007334197] and parameters: {'n_layers': 4, 'embedding_dim': 64, 'lr': 0.0002168513457058419, 'lambda_val': 0.00013116825599389072, 'batch_size': 2081, 'optimizer': 'Adam'}.
2026-06-30 11:46:09,201 - experiment_functions - INFO - Early stopping at epoch 2450. Best Metrics: (0.00020924914435668663, 6.268639705183975e-05, 0.00014151467340410218)
2026-06-30 11:46:09,295 - optuna.study.study - INFO - Trial 54 finished with values: [0.00020924914435668663, 6.268639705183975e-05, 0.00014151467340410218] and parameters: {'n_layers': 4, 'embedding_dim': 256, 'lr': 1.4122814985163985e-05, 'lambda_val': 0.003822203775543289, 'batch_size': 3331, 'optimizer': 'Adam'}.
2026-06-30 11:46:50,238 - experiment_functions - INFO - Early stopping at epoch 500. Best Metrics: (0.000213449253420634, 5.793742757821552e-05, 0.00013032157727920266)
2026-06-30 11:46:50,334 - optuna.study.study - INFO - Trial 55 finished with values: [0.000213449253420634, 5.793742757821552e-05, 0.00013032157727920266] and parameters: {'n_layers': 1, 'embedding_dim': 96, 'lr': 0.003664683492842946, 'lambda_val': 0.00016218839236180774, 'batch_size': 2156, 'optimizer': 'SGD'}.
2026-06-30 11:47:46,489 - experiment_functions - INFO - Early stopping at epoch 650. Best Metrics: (0.0016309758355778376, 0.0005052903519936174, 0.00112042975605853)
2026-06-30 11:47:46,586 - optuna.study.study - INFO - Trial 56 finished with values: [0.0016309758355778376, 0.0005052903519936174, 0.00112042975605853] and parameters: {'n_layers': 3, 'embedding_dim': 96, 'lr': 0.002537969130795011, 'lambda_val': 0.008151110145395832, 'batch_size': 3549, 'optimizer': 'RMSprop'}.
2026-06-30 11:51:31,824 - experiment_functions - INFO - Early stopping at epoch 2950. Best Metrics: (0.0016416897756578288, 0.00039131508462663604, 0.0010261678060401547)
2026-06-30 11:51:31,909 - optuna.study.study - INFO - Trial 57 finished with values: [0.0016416897756578288, 0.00039131508462663604, 0.0010261678060401547] and parameters: {'n_layers': 1, 'embedding_dim': 96, 'lr': 0.0006387010239111333, 'lambda_val': 1.7935776768087697e-05, 'batch_size': 2528, 'optimizer': 'Adam'}.
2026-06-30 11:52:39,945 - experiment_functions - INFO - Early stopping at epoch 700. Best Metrics: (0.001462699716690574, 0.00043975457325760316, 0.0010314020438874866)
2026-06-30 11:52:40,029 - optuna.study.study - INFO - Trial 58 finished with values: [0.001462699716690574, 0.00043975457325760316, 0.0010314020438874866] and parameters: {'n_layers': 2, 'embedding_dim': 256, 'lr': 0.004843365039812707, 'lambda_val': 0.009549864442144507, 'batch_size': 1496, 'optimizer': 'Adam'}.
2026-06-30 11:53:21,413 - experiment_functions - INFO - Early stopping at epoch 500. Best Metrics: (0.00030708750048044414, 6.933495431491367e-05, 0.0001785185603770547)
2026-06-30 11:53:21,509 - optuna.study.study - INFO - Trial 59 finished with values: [0.00030708750048044414, 6.933495431491367e-05, 0.0001785185603770547] and parameters: {'n_layers': 1, 'embedding_dim': 96, 'lr': 0.00046002559598455904, 'lambda_val': 0.07767999411271777, 'batch_size': 1987, 'optimizer': 'SGD'}.
2026-06-30 11:58:21,801 - optuna.study.study - INFO - Trial 60 finished with values: [0.0021103129030499617, 0.0005831734513610547, 0.0014732372052305822] and parameters: {'n_layers': 4, 'embedding_dim': 32, 'lr': 0.000678453369086835, 'lambda_val': 1.2687145973445492e-05, 'batch_size': 3994, 'optimizer': 'Adam'}.
2026-06-30 12:01:25,040 - experiment_functions - INFO - Early stopping at epoch 2250. Best Metrics: (0.0024412132726025645, 0.0006696046957810156, 0.0016228401138083817)
2026-06-30 12:01:25,131 - optuna.study.study - INFO - Trial 61 finished with values: [0.0024412132726025645, 0.0006696046957810156, 0.0016228401138083817] and parameters: {'n_layers': 3, 'embedding_dim': 96, 'lr': 0.0006387010239111333, 'lambda_val': 0.00135046939560172, 'batch_size': 3994, 'optimizer': 'RMSprop'}.
2026-06-30 12:02:09,024 - experiment_functions - INFO - Early stopping at epoch 550. Best Metrics: (0.0010004953957049498, 0.00025169538210208383, 0.0007190941429589064)
2026-06-30 12:02:09,098 - optuna.study.study - INFO - Trial 62 finished with values: [0.0010004953957049498, 0.00025169538210208383, 0.0007190941429589064] and parameters: {'n_layers': 2, 'embedding_dim': 32, 'lr': 0.0670799365395721, 'lambda_val': 1.7935776768087697e-05, 'batch_size': 2528, 'optimizer': 'Adam'}.
2026-06-30 12:07:22,146 - optuna.study.study - INFO - Trial 63 finished with values: [0.0005834350807558649, 0.00015386661094542485, 0.00034250339925666166] and parameters: {'n_layers': 4, 'embedding_dim': 64, 'lr': 0.00026284896555565354, 'lambda_val': 0.025392814672562707, 'batch_size': 1516, 'optimizer': 'RMSprop'}.
2026-06-30 12:08:02,506 - experiment_functions - INFO - Early stopping at epoch 500. Best Metrics: (0.0002673530712911042, 5.7937427578215534e-05, 0.00013285643444165)
2026-06-30 12:08:02,598 - optuna.study.study - INFO - Trial 64 finished with values: [0.0002673530712911042, 5.7937427578215534e-05, 0.00013285643444165] and parameters: {'n_layers': 1, 'embedding_dim': 64, 'lr': 9.253172652713506e-05, 'lambda_val': 0.0006597683688978018, 'batch_size': 3288, 'optimizer': 'SGD'}.
2026-06-30 12:08:55,084 - experiment_functions - INFO - Early stopping at epoch 650. Best Metrics: (0.0018753823652311679, 0.0005090895275725168, 0.0013234042134780564)
2026-06-30 12:08:55,179 - optuna.study.study - INFO - Trial 65 finished with values: [0.0018753823652311679, 0.0005090895275725168, 0.0013234042134780564] and parameters: {'n_layers': 4, 'embedding_dim': 32, 'lr': 0.00875572898955806, 'lambda_val': 0.00020499046063986734, 'batch_size': 1897, 'optimizer': 'Adam'}.
2026-06-30 12:10:01,025 - experiment_functions - INFO - Early stopping at epoch 750. Best Metrics: (0.0023205684430150455, 0.0006800524286229888, 0.001542239536335493)
2026-06-30 12:10:01,094 - optuna.study.study - INFO - Trial 66 finished with values: [0.0023205684430150455, 0.0006800524286229888, 0.001542239536335493] and parameters: {'n_layers': 4, 'embedding_dim': 96, 'lr': 0.004974098253366267, 'lambda_val': 0.00042560409247420055, 'batch_size': 1192, 'optimizer': 'Adam'}.
2026-06-30 12:16:28,231 - optuna.study.study - INFO - Trial 67 finished with values: [0.0020026041339567774, 0.0005166878787303156, 0.0013566733518926828] and parameters: {'n_layers': 3, 'embedding_dim': 256, 'lr': 0.00044843281655524526, 'lambda_val': 0.00023859514179547838, 'batch_size': 784, 'optimizer': 'RMSprop'}.
2026-06-30 12:17:47,559 - experiment_functions - INFO - Early stopping at epoch 900. Best Metrics: (0.0013596157540607097, 0.0004226582831525559, 0.0010123564197559182)
2026-06-30 12:17:47,644 - optuna.study.study - INFO - Trial 68 finished with values: [0.0013596157540607097, 0.0004226582831525559, 0.0010123564197559182] and parameters: {'n_layers': 1, 'embedding_dim': 256, 'lr': 0.006717797853561655, 'lambda_val': 0.0013330885045298511, 'batch_size': 1542, 'optimizer': 'RMSprop'}.
2026-06-30 12:18:41,332 - experiment_functions - INFO - Early stopping at epoch 600. Best Metrics: (0.001835500032657922, 0.0005366335505195373, 0.0012889073509861977)
2026-06-30 12:18:41,420 - optuna.study.study - INFO - Trial 69 finished with values: [0.001835500032657922, 0.0005366335505195373, 0.0012889073509861977] and parameters: {'n_layers': 4, 'embedding_dim': 96, 'lr': 0.004974098253366267, 'lambda_val': 0.006790143066606948, 'batch_size': 2368, 'optimizer': 'Adam'}.
2026-06-30 12:19:29,527 - experiment_functions - INFO - Early stopping at epoch 550. Best Metrics: (0.0010960251001493387, 0.00030868301578557453, 0.0007975616836309422)
2026-06-30 12:19:29,615 - optuna.study.study - INFO - Trial 70 finished with values: [0.0010960251001493387, 0.00030868301578557453, 0.0007975616836309422] and parameters: {'n_layers': 2, 'embedding_dim': 128, 'lr': 0.07122568677043598, 'lambda_val': 1.346197601849964e-05, 'batch_size': 3789, 'optimizer': 'RMSprop'}.
2026-06-30 12:24:42,110 - optuna.study.study - INFO - Trial 71 finished with values: [0.0016958255607396264, 0.0004074615808369584, 0.0011020251900267257] and parameters: {'n_layers': 1, 'embedding_dim': 128, 'lr': 0.0006387010239111333, 'lambda_val': 1.7935776768087697e-05, 'batch_size': 2528, 'optimizer': 'Adam'}.
2026-06-30 12:25:38,103 - experiment_functions - INFO - Early stopping at epoch 700. Best Metrics: (0.0018127743391722095, 0.0005309347871511881, 0.0012902205691778237)
2026-06-30 12:25:38,196 - optuna.study.study - INFO - Trial 72 finished with values: [0.0018127743391722095, 0.0005309347871511881, 0.0012902205691778237] and parameters: {'n_layers': 4, 'embedding_dim': 32, 'lr': 0.00875572898955806, 'lambda_val': 0.00020499046063986734, 'batch_size': 1897, 'optimizer': 'RMSprop'}.
2026-06-30 12:26:31,180 - experiment_functions - INFO - Early stopping at epoch 650. Best Metrics: (0.0012779692901545509, 0.0003276788936800715, 0.000849869585980304)
2026-06-30 12:26:31,275 - optuna.study.study - INFO - Trial 73 finished with values: [0.0012779692901545509, 0.0003276788936800715, 0.000849869585980304] and parameters: {'n_layers': 1, 'embedding_dim': 96, 'lr': 0.017656978087572574, 'lambda_val': 7.82025383806306e-05, 'batch_size': 3071, 'optimizer': 'Adam'}.
2026-06-30 12:27:24,941 - experiment_functions - INFO - Early stopping at epoch 600. Best Metrics: (0.001821298656933223, 0.0005366335505195373, 0.0012623428256279669)
2026-06-30 12:27:25,018 - optuna.study.study - INFO - Trial 74 finished with values: [0.001821298656933223, 0.0005366335505195373, 0.0012623428256279669] and parameters: {'n_layers': 3, 'embedding_dim': 128, 'lr': 0.00875572898955806, 'lambda_val': 0.0006597683688978018, 'batch_size': 1897, 'optimizer': 'RMSprop'}.
2026-06-30 12:32:16,648 - optuna.study.study - INFO - Trial 75 finished with values: [0.0020862151352025165, 0.00046065003894154975, 0.0014198405621669572] and parameters: {'n_layers': 2, 'embedding_dim': 32, 'lr': 0.000678453369086835, 'lambda_val': 0.0013330885045298511, 'batch_size': 2119, 'optimizer': 'RMSprop'}.
2026-06-30 12:37:25,539 - experiment_functions - INFO - Early stopping at epoch 3550. Best Metrics: (0.00025429237364485305, 6.458598484128944e-05, 0.00013463172213486462)
2026-06-30 12:37:25,632 - optuna.study.study - INFO - Trial 76 finished with values: [0.00025429237364485305, 6.458598484128944e-05, 0.00013463172213486462] and parameters: {'n_layers': 4, 'embedding_dim': 128, 'lr': 6.897801784012238e-05, 'lambda_val': 0.000172821084218635, 'batch_size': 774, 'optimizer': 'Adam'}.
2026-06-30 12:38:22,996 - experiment_functions - INFO - Early stopping at epoch 650. Best Metrics: (0.001688448392084358, 0.0005366335505195373, 0.0011979478711665438)
2026-06-30 12:38:23,089 - optuna.study.study - INFO - Trial 77 finished with values: [0.001688448392084358, 0.0005366335505195373, 0.0011979478711665438] and parameters: {'n_layers': 4, 'embedding_dim': 96, 'lr': 0.004974098253366267, 'lambda_val': 0.009549864442144507, 'batch_size': 2368, 'optimizer': 'Adam'}.
2026-06-30 12:40:52,954 - experiment_functions - INFO - Early stopping at epoch 2000. Best Metrics: (0.0003376816988424727, 7.21843359990882e-05, 0.00020213553709560198)
2026-06-30 12:40:53,042 - optuna.study.study - INFO - Trial 78 finished with values: [0.0003376816988424727, 7.21843359990882e-05, 0.00020213553709560198] and parameters: {'n_layers': 1, 'embedding_dim': 64, 'lr': 5.8698864593593056e-05, 'lambda_val': 1.3243840463181226e-06, 'batch_size': 3288, 'optimizer': 'Adam'}.
2026-06-30 12:42:08,908 - experiment_functions - INFO - Early stopping at epoch 900. Best Metrics: (0.002281736349816566, 0.0006449100545181697, 0.0015348041122908067)
2026-06-30 12:42:08,995 - optuna.study.study - INFO - Trial 79 finished with values: [0.002281736349816566, 0.0006449100545181697, 0.0015348041122908067] and parameters: {'n_layers': 3, 'embedding_dim': 96, 'lr': 0.004766437510594636, 'lambda_val': 1.3936968571078208e-06, 'batch_size': 2089, 'optimizer': 'Adam'}.
2026-06-30 12:42:54,348 - experiment_functions - INFO - Early stopping at epoch 500. Best Metrics: (0.00018241855025452497, 4.084113747316833e-05, 9.850486564162399e-05)
2026-06-30 12:42:54,437 - optuna.study.study - INFO - Trial 80 finished with values: [0.00018241855025452497, 4.084113747316833e-05, 9.850486564162399e-05] and parameters: {'n_layers': 1, 'embedding_dim': 256, 'lr': 0.00026284896555565354, 'lambda_val': 0.0009577973156644654, 'batch_size': 1192, 'optimizer': 'SGD'}.
2026-06-30 12:45:36,659 - experiment_functions - INFO - Early stopping at epoch 2050. Best Metrics: (0.0013631210732039621, 0.0004359553976787037, 0.000959662611555464)
