2026-07-01 22:35:02,925 - optuna.study.study - INFO - Trial 245 finished with values: [0.0029424239348791008, 0.0008320194517789641, 0.0019483322548701386] and parameters: {'n_layers': 3, 'embedding_dim': 128, 'lr': 0.001878376227052758, 'lambda_val': 8.805105847994294e-05, 'batch_size': 1100, 'optimizer': 'RMSprop'}.
2026-07-01 22:37:31,330 - experiment_functions - INFO - Early stopping at epoch 1500. Best Metrics: (0.0024654175358684504, 0.0007199437722014324, 0.0016652920914504994)
2026-07-01 22:37:31,418 - optuna.study.study - INFO - Trial 246 finished with values: [0.0024654175358684504, 0.0007199437722014324, 0.0016652920914504994] and parameters: {'n_layers': 3, 'embedding_dim': 256, 'lr': 0.0020091203438644, 'lambda_val': 3.747302157374259e-06, 'batch_size': 3544, 'optimizer': 'RMSprop'}.
2026-07-01 22:39:00,266 - experiment_functions - INFO - Early stopping at epoch 950. Best Metrics: (0.00017622415948748032, 5.223866420986647e-05, 0.00010837471344731261)
2026-07-01 22:39:00,345 - optuna.study.study - INFO - Trial 247 finished with values: [0.00017622415948748032, 5.223866420986647e-05, 0.00010837471344731261] and parameters: {'n_layers': 2, 'embedding_dim': 256, 'lr': 1.1398500610141753e-05, 'lambda_val': 3.747302157374259e-06, 'batch_size': 2726, 'optimizer': 'RMSprop'}.
2026-07-01 22:41:45,708 - experiment_functions - INFO - Early stopping at epoch 1950. Best Metrics: (0.0026572461291944852, 0.0007512869707273522, 0.00180105814110691)
2026-07-01 22:41:45,799 - optuna.study.study - INFO - Trial 248 finished with values: [0.0026572461291944852, 0.0007512869707273522, 0.00180105814110691] and parameters: {'n_layers': 3, 'embedding_dim': 128, 'lr': 0.0008549054963496413, 'lambda_val': 8.805105847994294e-05, 'batch_size': 4034, 'optimizer': 'RMSprop'}.
2026-07-01 22:43:17,957 - experiment_functions - INFO - Early stopping at epoch 1150. Best Metrics: (0.002422470458661331, 0.0006819520164124386, 0.0016533129461046149)
2026-07-01 22:43:18,050 - optuna.study.study - INFO - Trial 249 finished with values: [0.002422470458661331, 0.0006819520164124386, 0.0016533129461046149] and parameters: {'n_layers': 3, 'embedding_dim': 64, 'lr': 0.0030363640610353106, 'lambda_val': 6.5134158560038e-06, 'batch_size': 2650, 'optimizer': 'RMSprop'}.
2026-07-01 22:46:50,436 - experiment_functions - INFO - Early stopping at epoch 2850. Best Metrics: (0.0022899316440080243, 0.0006230647949394982, 0.0015389889469783163)
2026-07-01 22:46:50,538 - optuna.study.study - INFO - Trial 250 finished with values: [0.0022899316440080243, 0.0006230647949394982, 0.0015389889469783163] and parameters: {'n_layers': 3, 'embedding_dim': 32, 'lr': 0.001878376227052758, 'lambda_val': 2.9125236439191383e-06, 'batch_size': 1661, 'optimizer': 'Adam'}.
2026-07-01 22:50:25,556 - experiment_functions - INFO - Early stopping at epoch 2650. Best Metrics: (0.002620150241820858, 0.0007151948027278082, 0.0017551123227542958)
2026-07-01 22:50:25,664 - optuna.study.study - INFO - Trial 251 finished with values: [0.002620150241820858, 0.0007151948027278082, 0.0017551123227542958] and parameters: {'n_layers': 2, 'embedding_dim': 128, 'lr': 0.001878376227052758, 'lambda_val': 3.747302157374259e-06, 'batch_size': 1100, 'optimizer': 'RMSprop'}.
2026-07-01 22:53:41,420 - experiment_functions - INFO - Early stopping at epoch 2000. Best Metrics: (0.0027612561211210122, 0.000771232642516574, 0.001820193501113842)
2026-07-01 22:53:41,514 - optuna.study.study - INFO - Trial 252 finished with values: [0.0027612561211210122, 0.000771232642516574, 0.001820193501113842] and parameters: {'n_layers': 3, 'embedding_dim': 256, 'lr': 0.001878376227052758, 'lambda_val': 3.747302157374259e-06, 'batch_size': 1100, 'optimizer': 'RMSprop'}.
2026-07-01 22:54:55,825 - experiment_functions - INFO - Early stopping at epoch 850. Best Metrics: (0.0024861345571800305, 0.0007142450088330832, 0.0016601430035644547)
2026-07-01 22:54:55,904 - optuna.study.study - INFO - Trial 253 finished with values: [0.0024861345571800305, 0.0007142450088330832, 0.0016601430035644547] and parameters: {'n_layers': 3, 'embedding_dim': 128, 'lr': 0.001878376227052758, 'lambda_val': 0.0012592144246174213, 'batch_size': 1470, 'optimizer': 'RMSprop'}.
2026-07-01 22:55:49,874 - experiment_functions - INFO - Early stopping at epoch 600. Best Metrics: (0.001465560853479575, 0.00039796364188970993, 0.0010712984795518102)
2026-07-01 22:55:49,981 - optuna.study.study - INFO - Trial 254 finished with values: [0.001465560853479575, 0.00039796364188970993, 0.0010712984795518102] and parameters: {'n_layers': 3, 'embedding_dim': 128, 'lr': 0.06297609509267578, 'lambda_val': 3.747302157374259e-06, 'batch_size': 1848, 'optimizer': 'RMSprop'}.
2026-07-01 22:58:28,753 - experiment_functions - INFO - Early stopping at epoch 2100. Best Metrics: (0.002627227190074617, 0.0007142450088330834, 0.0017538461169376563)
2026-07-01 22:58:28,844 - optuna.study.study - INFO - Trial 255 finished with values: [0.002627227190074617, 0.0007142450088330834, 0.0017538461169376563] and parameters: {'n_layers': 4, 'embedding_dim': 32, 'lr': 0.001878376227052758, 'lambda_val': 3.747302157374259e-06, 'batch_size': 1100, 'optimizer': 'Adam'}.
2026-07-01 23:03:36,586 - optuna.study.study - INFO - Trial 256 finished with values: [0.0029996535880404515, 0.0007417890317801038, 0.0019364492675092815] and parameters: {'n_layers': 3, 'embedding_dim': 64, 'lr': 0.0008549054963496413, 'lambda_val': 8.805105847994294e-05, 'batch_size': 1050, 'optimizer': 'RMSprop'}.
2026-07-01 23:08:52,226 - experiment_functions - INFO - Early stopping at epoch 3750. Best Metrics: (0.0023936051667232477, 0.0006781528408335392, 0.001647515987735227)
2026-07-01 23:08:53,213 - optuna.study.study - INFO - Trial 257 finished with values: [0.0023936051667232477, 0.0006781528408335392, 0.001647515987735227] and parameters: {'n_layers': 3, 'embedding_dim': 128, 'lr': 0.0008102278066186573, 'lambda_val': 3.0256770800491656e-06, 'batch_size': 4034, 'optimizer': 'Adam'}.
2026-07-01 23:12:36,895 - experiment_functions - INFO - Early stopping at epoch 2300. Best Metrics: (0.002761861378852646, 0.0007883289326216211, 0.001847744154443517)
2026-07-01 23:12:37,999 - optuna.study.study - INFO - Trial 258 finished with values: [0.002761861378852646, 0.0007883289326216211, 0.001847744154443517] and parameters: {'n_layers': 3, 'embedding_dim': 256, 'lr': 0.001878376227052758, 'lambda_val': 3.747302157374259e-06, 'batch_size': 1050, 'optimizer': 'RMSprop'}.
2026-07-01 23:15:59,119 - experiment_functions - INFO - Early stopping at epoch 2050. Best Metrics: (0.002834360375340395, 0.0008111239860950175, 0.0018884606430967423)
2026-07-01 23:15:59,270 - optuna.study.study - INFO - Trial 259 finished with values: [0.002834360375340395, 0.0008111239860950175, 0.0018884606430967423] and parameters: {'n_layers': 3, 'embedding_dim': 256, 'lr': 0.001878376227052758, 'lambda_val': 3.747302157374259e-06, 'batch_size': 1100, 'optimizer': 'RMSprop'}.
2026-07-01 23:18:01,715 - experiment_functions - INFO - Early stopping at epoch 1550. Best Metrics: (0.0012039555462402198, 0.0004084113747316832, 0.0008694837793403784)
2026-07-01 23:18:01,805 - optuna.study.study - INFO - Trial 260 finished with values: [0.0012039555462402198, 0.0004084113747316832, 0.0008694837793403784] and parameters: {'n_layers': 3, 'embedding_dim': 64, 'lr': 0.001878376227052758, 'lambda_val': 0.09048565509097474, 'batch_size': 3365, 'optimizer': 'Adam'}.
2026-07-01 23:20:14,944 - experiment_functions - INFO - Early stopping at epoch 1750. Best Metrics: (0.0030508405354583517, 0.0008244211006211651, 0.0020295512334878984)
2026-07-01 23:20:15,030 - optuna.study.study - INFO - Trial 261 finished with values: [0.0030508405354583517, 0.0008244211006211651, 0.0020295512334878984] and parameters: {'n_layers': 4, 'embedding_dim': 32, 'lr': 0.001878376227052758, 'lambda_val': 3.1335017132005896e-06, 'batch_size': 1661, 'optimizer': 'RMSprop'}.
2026-07-01 23:22:15,685 - experiment_functions - INFO - Early stopping at epoch 1600. Best Metrics: (0.00023094492908525864, 6.17366031571149e-05, 0.00012724724274896588)
2026-07-01 23:22:15,762 - optuna.study.study - INFO - Trial 262 finished with values: [0.00023094492908525864, 6.17366031571149e-05, 0.00012724724274896588] and parameters: {'n_layers': 4, 'embedding_dim': 32, 'lr': 1.1255726893147826e-05, 'lambda_val': 1.7400188628222683e-06, 'batch_size': 1100, 'optimizer': 'RMSprop'}.
2026-07-01 23:24:22,723 - experiment_functions - INFO - Early stopping at epoch 1500. Best Metrics: (0.0027839773816383437, 0.0007968770776741447, 0.0018603894174695293)
2026-07-01 23:24:22,805 - optuna.study.study - INFO - Trial 263 finished with values: [0.0027839773816383437, 0.0007968770776741447, 0.0018603894174695293] and parameters: {'n_layers': 3, 'embedding_dim': 128, 'lr': 0.001878376227052758, 'lambda_val': 8.805105847994294e-05, 'batch_size': 1100, 'optimizer': 'RMSprop'}.
2026-07-01 23:26:27,145 - experiment_functions - INFO - Early stopping at epoch 1650. Best Metrics: (0.002748789124825354, 0.000697148718728036, 0.0017995269454496767)
2026-07-01 23:26:27,243 - optuna.study.study - INFO - Trial 264 finished with values: [0.002748789124825354, 0.000697148718728036, 0.0017995269454496767] and parameters: {'n_layers': 3, 'embedding_dim': 32, 'lr': 0.001878376227052758, 'lambda_val': 3.747302157374259e-06, 'batch_size': 1684, 'optimizer': 'RMSprop'}.
2026-07-01 23:28:45,100 - experiment_functions - INFO - Early stopping at epoch 1800. Best Metrics: (0.0021101543626590733, 0.0004957924130463689, 0.0013273951558092141)
2026-07-01 23:28:45,187 - optuna.study.study - INFO - Trial 265 finished with values: [0.0021101543626590733, 0.0004957924130463689, 0.0013273951558092141] and parameters: {'n_layers': 1, 'embedding_dim': 96, 'lr': 0.001878376227052758, 'lambda_val': 0.0006778527201004557, 'batch_size': 1100, 'optimizer': 'RMSprop'}.
2026-07-01 23:30:20,478 - experiment_functions - INFO - Early stopping at epoch 1100. Best Metrics: (0.002622910138780452, 0.000770282848621849, 0.0017194480117520925)
2026-07-01 23:30:20,581 - optuna.study.study - INFO - Trial 266 finished with values: [0.002622910138780452, 0.000770282848621849, 0.0017194480117520925] and parameters: {'n_layers': 3, 'embedding_dim': 128, 'lr': 0.001878376227052758, 'lambda_val': 3.747302157374259e-06, 'batch_size': 2701, 'optimizer': 'RMSprop'}.
2026-07-01 23:31:00,643 - experiment_functions - INFO - Early stopping at epoch 500. Best Metrics: (0.00021887468941139183, 6.838516042018881e-05, 0.0001630965707904955)
2026-07-01 23:31:00,758 - optuna.study.study - INFO - Trial 267 finished with values: [0.00021887468941139183, 6.838516042018881e-05, 0.0001630965707904955] and parameters: {'n_layers': 3, 'embedding_dim': 32, 'lr': 0.0008102278066186573, 'lambda_val': 0.0006778527201004557, 'batch_size': 2026, 'optimizer': 'SGD'}.
2026-07-01 23:34:06,750 - experiment_functions - INFO - Early stopping at epoch 1900. Best Metrics: (0.0025391664414897703, 0.0007379898562012043, 0.001690870281006109)
2026-07-01 23:34:07,079 - optuna.study.study - INFO - Trial 268 finished with values: [0.0025391664414897703, 0.0007379898562012043, 0.001690870281006109] and parameters: {'n_layers': 3, 'embedding_dim': 256, 'lr': 0.001878376227052758, 'lambda_val': 3.747302157374259e-06, 'batch_size': 2701, 'optimizer': 'RMSprop'}.
2026-07-01 23:38:19,096 - experiment_functions - INFO - Early stopping at epoch 3400. Best Metrics: (0.0006475591819108405, 0.00014911764147180063, 0.0004039172905373424)
2026-07-01 23:38:19,181 - optuna.study.study - INFO - Trial 269 finished with values: [0.0006475591819108405, 0.00014911764147180063, 0.0004039172905373424] and parameters: {'n_layers': 4, 'embedding_dim': 32, 'lr': 0.00016991165833530936, 'lambda_val': 0.001077586452266838, 'batch_size': 2734, 'optimizer': 'RMSprop'}.
2026-07-01 23:39:25,398 - experiment_functions - INFO - Early stopping at epoch 750. Best Metrics: (0.002035801161700428, 0.0005736755124138062, 0.0013902442196739452)
2026-07-01 23:39:25,469 - optuna.study.study - INFO - Trial 270 finished with values: [0.002035801161700428, 0.0005736755124138062, 0.0013902442196739452] and parameters: {'n_layers': 3, 'embedding_dim': 128, 'lr': 0.001878376227052758, 'lambda_val': 0.0013255792626965, 'batch_size': 3313, 'optimizer': 'RMSprop'}.
2026-07-01 23:41:04,231 - experiment_functions - INFO - Early stopping at epoch 1100. Best Metrics: (0.002609217562456279, 0.0007550861463062516, 0.0017174191029522977)
2026-07-01 23:41:04,331 - optuna.study.study - INFO - Trial 271 finished with values: [0.002609217562456279, 0.0007550861463062516, 0.0017174191029522977] and parameters: {'n_layers': 4, 'embedding_dim': 128, 'lr': 0.001878376227052758, 'lambda_val': 1.7400188628222683e-06, 'batch_size': 3927, 'optimizer': 'RMSprop'}.
2026-07-01 23:45:45,205 - experiment_functions - INFO - Early stopping at epoch 2900. Best Metrics: (0.003015871373673031, 0.0008519651235681857, 0.0019923580560324626)
2026-07-01 23:45:45,313 - optuna.study.study - INFO - Trial 272 finished with values: [0.003015871373673031, 0.0008519651235681857, 0.0019923580560324626] and parameters: {'n_layers': 3, 'embedding_dim': 256, 'lr': 0.0008423328164015242, 'lambda_val': 3.1335017132005896e-06, 'batch_size': 1100, 'optimizer': 'RMSprop'}.
2026-07-01 23:46:30,352 - experiment_functions - INFO - Early stopping at epoch 500. Best Metrics: (0.00023817482002333573, 4.7489694736242234e-05, 0.00012504517161192541)
2026-07-01 23:46:30,445 - optuna.study.study - INFO - Trial 273 finished with values: [0.00023817482002333573, 4.7489694736242234e-05, 0.00012504517161192541] and parameters: {'n_layers': 3, 'embedding_dim': 128, 'lr': 0.001878376227052758, 'lambda_val': 4.5390100598147375e-06, 'batch_size': 1100, 'optimizer': 'SGD'}.
2026-07-01 23:49:11,798 - experiment_functions - INFO - Early stopping at epoch 1650. Best Metrics: (0.002674177758750486, 0.0007607849096746006, 0.0017734472557500497)
2026-07-01 23:49:11,919 - optuna.study.study - INFO - Trial 274 finished with values: [0.002674177758750486, 0.0007607849096746006, 0.0017734472557500497] and parameters: {'n_layers': 3, 'embedding_dim': 256, 'lr': 0.001878376227052758, 'lambda_val': 3.747302157374259e-06, 'batch_size': 1100, 'optimizer': 'RMSprop'}.
2026-07-01 23:50:50,209 - experiment_functions - INFO - Early stopping at epoch 1150. Best Metrics: (0.0022633822139658615, 0.0006477594362023441, 0.0014857327192231262)
2026-07-01 23:50:50,281 - optuna.study.study - INFO - Trial 275 finished with values: [0.0022633822139658615, 0.0006477594362023441, 0.0014857327192231262] and parameters: {'n_layers': 4, 'embedding_dim': 96, 'lr': 0.0030363640610353106, 'lambda_val': 0.0006778527201004557, 'batch_size': 1159, 'optimizer': 'Adam'}.
2026-07-01 23:51:39,934 - experiment_functions - INFO - Early stopping at epoch 550. Best Metrics: (0.0016846705903735036, 0.0004777463290465969, 0.0011617783568943678)
2026-07-01 23:51:40,011 - optuna.study.study - INFO - Trial 276 finished with values: [0.0016846705903735036, 0.0004777463290465969, 0.0011617783568943678] and parameters: {'n_layers': 3, 'embedding_dim': 128, 'lr': 0.03190519678908658, 'lambda_val': 8.805105847994294e-05, 'batch_size': 900, 'optimizer': 'RMSprop'}.
2026-07-01 23:55:56,172 - experiment_functions - INFO - Early stopping at epoch 2950. Best Metrics: (0.0028857045646226613, 0.0008386680090420379, 0.0019369194256070286)
2026-07-01 23:55:56,246 - optuna.study.study - INFO - Trial 277 finished with values: [0.0028857045646226613, 0.0008386680090420379, 0.0019369194256070286] and parameters: {'n_layers': 4, 'embedding_dim': 128, 'lr': 0.0008102278066186573, 'lambda_val': 1.413159904245194e-06, 'batch_size': 2701, 'optimizer': 'RMSprop'}.
2026-07-01 23:57:07,654 - experiment_functions - INFO - Early stopping at epoch 700. Best Metrics: (0.0019320842732079605, 0.0005860228330452292, 0.0013321253082523002)
2026-07-01 23:57:07,731 - optuna.study.study - INFO - Trial 278 finished with values: [0.0019320842732079605, 0.0005860228330452292, 0.0013321253082523002] and parameters: {'n_layers': 3, 'embedding_dim': 256, 'lr': 0.001878376227052758, 'lambda_val': 0.0024713935182789555, 'batch_size': 2916, 'optimizer': 'RMSprop'}.
2026-07-01 23:59:40,107 - experiment_functions - INFO - Early stopping at epoch 1950. Best Metrics: (0.0019868565263377, 0.0004919932374674697, 0.0013095158056239495)
2026-07-01 23:59:40,184 - optuna.study.study - INFO - Trial 279 finished with values: [0.0019868565263377, 0.0004919932374674697, 0.0013095158056239495] and parameters: {'n_layers': 1, 'embedding_dim': 128, 'lr': 0.0016422068986048546, 'lambda_val': 0.0006778527201004557, 'batch_size': 880, 'optimizer': 'RMSprop'}.
2026-07-02 00:04:51,091 - experiment_functions - INFO - Early stopping at epoch 3750. Best Metrics: (0.0028194905306912345, 0.000789278726516346, 0.0018886152341114175)
2026-07-02 00:04:51,417 - optuna.study.study - INFO - Trial 280 finished with values: [0.0028194905306912345, 0.000789278726516346, 0.0018886152341114175] and parameters: {'n_layers': 4, 'embedding_dim': 96, 'lr': 0.0008423328164015242, 'lambda_val': 3.1335017132005896e-06, 'batch_size': 2924, 'optimizer': 'Adam'}.
2026-07-02 00:08:04,692 - experiment_functions - INFO - Early stopping at epoch 2550. Best Metrics: (0.003305044691025791, 0.0009250992534619987, 0.002318218105006933)
2026-07-02 00:08:04,820 - optuna.study.study - INFO - Trial 281 finished with values: [0.003305044691025791, 0.0009250992534619987, 0.002318218105006933] and parameters: {'n_layers': 4, 'embedding_dim': 32, 'lr': 0.001878376227052758, 'lambda_val': 4.427987057533364e-06, 'batch_size': 1051, 'optimizer': 'RMSprop'}.
2026-07-02 00:13:39,608 - optuna.study.study - INFO - Trial 282 finished with values: [0.002962722887429952, 0.0008139733677791919, 0.002003301366516001] and parameters: {'n_layers': 3, 'embedding_dim': 128, 'lr': 0.0008102278066186573, 'lambda_val': 3.1335017132005896e-06, 'batch_size': 1965, 'optimizer': 'RMSprop'}.
2026-07-02 00:15:52,767 - experiment_functions - INFO - Early stopping at epoch 1350. Best Metrics: (0.001903560096807695, 0.0005613281917823833, 0.0013512512194999938)
2026-07-02 00:15:52,902 - optuna.study.study - INFO - Trial 283 finished with values: [0.001903560096807695, 0.0005613281917823833, 0.0013512512194999938] and parameters: {'n_layers': 3, 'embedding_dim': 256, 'lr': 0.0008102278066186573, 'lambda_val': 0.005069569413021836, 'batch_size': 1100, 'optimizer': 'RMSprop'}.
2026-07-02 00:20:31,547 - experiment_functions - INFO - Early stopping at epoch 3350. Best Metrics: (0.003033008592339908, 0.0009013544060938775, 0.0019884297544832145)
2026-07-02 00:20:32,042 - optuna.study.study - INFO - Trial 284 finished with values: [0.003033008592339908, 0.0009013544060938775, 0.0019884297544832145] and parameters: {'n_layers': 4, 'embedding_dim': 96, 'lr': 0.0008102278066186573, 'lambda_val': 7.533493302126267e-06, 'batch_size': 2701, 'optimizer': 'RMSprop'}.
2026-07-02 00:22:19,756 - experiment_functions - INFO - Early stopping at epoch 1200. Best Metrics: (0.002634174088451121, 0.0007940276959899703, 0.0017627036232229325)
2026-07-02 00:22:19,844 - optuna.study.study - INFO - Trial 285 finished with values: [0.002634174088451121, 0.0007940276959899703, 0.0017627036232229325] and parameters: {'n_layers': 4, 'embedding_dim': 128, 'lr': 0.001878376227052758, 'lambda_val': 1.1327416378479618e-05, 'batch_size': 2924, 'optimizer': 'RMSprop'}.
2026-07-02 00:26:15,955 - experiment_functions - INFO - Early stopping at epoch 2800. Best Metrics: (0.002825634742055832, 0.0007968770776741448, 0.001929834194238512)
2026-07-02 00:26:16,040 - optuna.study.study - INFO - Trial 286 finished with values: [0.002825634742055832, 0.0007968770776741448, 0.001929834194238512] and parameters: {'n_layers': 3, 'embedding_dim': 128, 'lr': 0.0008549054963496413, 'lambda_val': 1.1327416378479618e-05, 'batch_size': 2867, 'optimizer': 'RMSprop'}.
2026-07-02 00:28:26,480 - experiment_functions - INFO - Early stopping at epoch 1700. Best Metrics: (0.0025579165749738697, 0.0007199437722014323, 0.0017216970021318274)
2026-07-02 00:28:26,570 - optuna.study.study - INFO - Trial 287 finished with values: [0.0025579165749738697, 0.0007199437722014323, 0.0017216970021318274] and parameters: {'n_layers': 4, 'embedding_dim': 32, 'lr': 0.0020091203438644, 'lambda_val': 1.1427509100447198e-06, 'batch_size': 2726, 'optimizer': 'RMSprop'}.
2026-07-02 00:30:47,625 - experiment_functions - INFO - Early stopping at epoch 1850. Best Metrics: (0.003092303864790016, 0.0008358186273578635, 0.0020364286712571166)
2026-07-02 00:30:47,704 - optuna.study.study - INFO - Trial 288 finished with values: [0.003092303864790016, 0.0008358186273578635, 0.0020364286712571166] and parameters: {'n_layers': 4, 'embedding_dim': 32, 'lr': 0.0016422068986048546, 'lambda_val': 1.1427509100447198e-06, 'batch_size': 1848, 'optimizer': 'RMSprop'}.
2026-07-02 00:31:32,595 - experiment_functions - INFO - Early stopping at epoch 500. Best Metrics: (0.00018890726662081658, 5.128887031514162e-05, 0.00010661442160221265)
2026-07-02 00:31:32,679 - optuna.study.study - INFO - Trial 289 finished with values: [0.00018890726662081658, 5.128887031514162e-05, 0.00010661442160221265] and parameters: {'n_layers': 4, 'embedding_dim': 96, 'lr': 0.0008423328164015242, 'lambda_val': 1.7400188628222683e-06, 'batch_size': 2701, 'optimizer': 'SGD'}.
2026-07-02 00:33:58,585 - experiment_functions - INFO - Early stopping at epoch 1650. Best Metrics: (0.002822973195884088, 0.0008386680090420378, 0.00188642372514042)
