2026-07-02 17:02:04,640 - optuna.study.study - INFO - Trial 111 finished with values: [0.015244657947424228, 0.003532283494481698, 0.009132105035366492] and parameters: {'n_layers': 3, 'embedding_dim': 256, 'lr': 0.0005152458540342933, 'lambda_val': 5.288093815108994e-05, 'batch_size': 3579, 'optimizer': 'RMSprop'}.
2026-07-02 17:03:09,105 - experiment_functions - INFO - Early stopping at epoch 650. Best Metrics: (0.005342420995335833, 0.001258476910510419, 0.0033273777845712334)
2026-07-02 17:03:10,315 - optuna.study.study - INFO - Trial 112 finished with values: [0.005342420995335833, 0.001258476910510419, 0.0033273777845712334] and parameters: {'n_layers': 4, 'embedding_dim': 64, 'lr': 0.03152700214098363, 'lambda_val': 5.288093815108994e-05, 'batch_size': 2440, 'optimizer': 'RMSprop'}.
2026-07-02 17:09:30,710 - optuna.study.study - INFO - Trial 113 finished with values: [0.015005575270895617, 0.0034771954485876564, 0.009043099071046067] and parameters: {'n_layers': 3, 'embedding_dim': 96, 'lr': 0.0005152458540342933, 'lambda_val': 9.00355461091747e-05, 'batch_size': 1092, 'optimizer': 'Adam'}.
2026-07-02 17:15:12,885 - experiment_functions - INFO - Early stopping at epoch 3150. Best Metrics: (0.015434170823366278, 0.0036272628839541816, 0.009471264052806783)
2026-07-02 17:15:13,030 - optuna.study.study - INFO - Trial 114 finished with values: [0.015434170823366278, 0.0036272628839541816, 0.009471264052806783] and parameters: {'n_layers': 2, 'embedding_dim': 256, 'lr': 0.0005152458540342933, 'lambda_val': 0.0013701200929940348, 'batch_size': 2391, 'optimizer': 'RMSprop'}.
2026-07-02 17:16:48,597 - experiment_functions - INFO - Early stopping at epoch 1150. Best Metrics: (0.008646105843269438, 0.0020639021332370874, 0.0051341765106936044)
2026-07-02 17:16:48,699 - optuna.study.study - INFO - Trial 115 finished with values: [0.008646105843269438, 0.0020639021332370874, 0.0051341765106936044] and parameters: {'n_layers': 2, 'embedding_dim': 32, 'lr': 0.0016188426517038284, 'lambda_val': 0.003381769296625175, 'batch_size': 1891, 'optimizer': 'RMSprop'}.
2026-07-02 17:18:00,091 - experiment_functions - INFO - Early stopping at epoch 500. Best Metrics: (0.008101786767603125, 0.001867294797029045, 0.0054137812548781085)
2026-07-02 17:18:00,244 - optuna.study.study - INFO - Trial 116 finished with values: [0.008101786767603125, 0.001867294797029045, 0.0054137812548781085] and parameters: {'n_layers': 4, 'embedding_dim': 256, 'lr': 0.07382485429937159, 'lambda_val': 1.7663549326396572e-05, 'batch_size': 2407, 'optimizer': 'RMSprop'}.
2026-07-02 17:25:10,825 - optuna.study.study - INFO - Trial 117 finished with values: [0.009514724923563823, 0.0023754345307068366, 0.005633825870762435] and parameters: {'n_layers': 2, 'embedding_dim': 256, 'lr': 0.00020560294075841994, 'lambda_val': 0.006272911689093162, 'batch_size': 2391, 'optimizer': 'RMSprop'}.
2026-07-02 17:31:29,769 - optuna.study.study - INFO - Trial 118 finished with values: [0.014070614257935496, 0.0032501947077484186, 0.008489371335034879] and parameters: {'n_layers': 3, 'embedding_dim': 96, 'lr': 0.0005152458540342933, 'lambda_val': 9.00355461091747e-05, 'batch_size': 1092, 'optimizer': 'RMSprop'}.
2026-07-02 17:32:11,593 - experiment_functions - INFO - Early stopping at epoch 500. Best Metrics: (0.0002402492337278451, 6.36361909465646e-05, 0.00013705318274211172)
2026-07-02 17:32:11,692 - optuna.study.study - INFO - Trial 119 finished with values: [0.0002402492337278451, 6.36361909465646e-05, 0.00013705318274211172] and parameters: {'n_layers': 1, 'embedding_dim': 32, 'lr': 0.0007787505453018097, 'lambda_val': 0.00045598605516994004, 'batch_size': 2278, 'optimizer': 'SGD'}.
2026-07-02 17:33:21,936 - experiment_functions - INFO - Early stopping at epoch 550. Best Metrics: (0.0022413175704917724, 0.0005755751002032559, 0.0014269101460735265)
2026-07-02 17:33:22,064 - optuna.study.study - INFO - Trial 120 finished with values: [0.0022413175704917724, 0.0005755751002032559, 0.0014269101460735265] and parameters: {'n_layers': 3, 'embedding_dim': 256, 'lr': 0.013707584571164062, 'lambda_val': 0.02455984895138463, 'batch_size': 3948, 'optimizer': 'RMSprop'}.
2026-07-02 17:34:06,952 - experiment_functions - INFO - Early stopping at epoch 500. Best Metrics: (0.00018959018139626629, 5.5088045894041e-05, 0.00011092730682585355)
2026-07-02 17:34:07,055 - optuna.study.study - INFO - Trial 121 finished with values: [0.00018959018139626629, 5.5088045894041e-05, 0.00011092730682585355] and parameters: {'n_layers': 2, 'embedding_dim': 64, 'lr': 0.01003894592310146, 'lambda_val': 0.008015948669672757, 'batch_size': 2370, 'optimizer': 'SGD'}.
2026-07-02 17:35:12,366 - experiment_functions - INFO - Early stopping at epoch 700. Best Metrics: (0.0020836201249976962, 0.0006439602606234447, 0.0013239655059386793)
2026-07-02 17:35:12,468 - optuna.study.study - INFO - Trial 122 finished with values: [0.0020836201249976962, 0.0006439602606234447, 0.0013239655059386793] and parameters: {'n_layers': 3, 'embedding_dim': 64, 'lr': 0.0009421389461291987, 'lambda_val': 0.02455984895138463, 'batch_size': 950, 'optimizer': 'RMSprop'}.
2026-07-02 17:36:59,257 - experiment_functions - INFO - Early stopping at epoch 850. Best Metrics: (0.006394271098151208, 0.0016108504454533368, 0.004224508308532146)
2026-07-02 17:36:59,373 - optuna.study.study - INFO - Trial 123 finished with values: [0.006394271098151208, 0.0016108504454533368, 0.004224508308532146] and parameters: {'n_layers': 3, 'embedding_dim': 256, 'lr': 0.0027092005148847305, 'lambda_val': 2.9585431976985735e-06, 'batch_size': 2839, 'optimizer': 'RMSprop'}.
2026-07-02 17:37:46,679 - experiment_functions - INFO - Early stopping at epoch 550. Best Metrics: (0.006991387631624249, 0.0018150561328191786, 0.004376787390979794)
2026-07-02 17:37:46,778 - optuna.study.study - INFO - Trial 124 finished with values: [0.006991387631624249, 0.0018150561328191786, 0.004376787390979794] and parameters: {'n_layers': 1, 'embedding_dim': 64, 'lr': 0.008098897183412869, 'lambda_val': 0.0011961653407329168, 'batch_size': 3187, 'optimizer': 'RMSprop'}.
2026-07-02 17:39:21,908 - experiment_functions - INFO - Early stopping at epoch 1100. Best Metrics: (0.007685418889693388, 0.0018881902627129914, 0.004387504575101698)
2026-07-02 17:39:22,057 - optuna.study.study - INFO - Trial 125 finished with values: [0.007685418889693388, 0.0018881902627129914, 0.004387504575101698] and parameters: {'n_layers': 3, 'embedding_dim': 32, 'lr': 0.0007787505453018097, 'lambda_val': 0.013961176255968233, 'batch_size': 2370, 'optimizer': 'Adam'}.
2026-07-02 17:40:16,845 - experiment_functions - INFO - Early stopping at epoch 550. Best Metrics: (0.007224549176693513, 0.0017485705601884391, 0.00453496173938583)
2026-07-02 17:40:16,949 - optuna.study.study - INFO - Trial 126 finished with values: [0.007224549176693513, 0.0017485705601884391, 0.00453496173938583] and parameters: {'n_layers': 4, 'embedding_dim': 64, 'lr': 0.010539985286058167, 'lambda_val': 3.277688503988446e-05, 'batch_size': 1113, 'optimizer': 'RMSprop'}.
2026-07-02 17:46:12,585 - optuna.study.study - INFO - Trial 127 finished with values: [0.010385499840662947, 0.002487510210284368, 0.0062340484303854546] and parameters: {'n_layers': 3, 'embedding_dim': 64, 'lr': 0.0012100089708552634, 'lambda_val': 9.00355461091747e-05, 'batch_size': 677, 'optimizer': 'RMSprop'}.
2026-07-02 17:47:02,522 - experiment_functions - INFO - Early stopping at epoch 550. Best Metrics: (0.006139751628178215, 0.0015804570408221416, 0.003899228727104997)
2026-07-02 17:47:02,630 - optuna.study.study - INFO - Trial 128 finished with values: [0.006139751628178215, 0.0015804570408221416, 0.003899228727104997] and parameters: {'n_layers': 2, 'embedding_dim': 64, 'lr': 0.019732524959614816, 'lambda_val': 0.00020052239202191264, 'batch_size': 3332, 'optimizer': 'Adam'}.
2026-07-02 17:47:56,449 - experiment_functions - INFO - Early stopping at epoch 600. Best Metrics: (0.006842290261829719, 0.0016554907585054044, 0.004265508197844623)
2026-07-02 17:47:56,595 - optuna.study.study - INFO - Trial 129 finished with values: [0.006842290261829719, 0.0016554907585054044, 0.004265508197844623] and parameters: {'n_layers': 3, 'embedding_dim': 32, 'lr': 0.013707584571164062, 'lambda_val': 1.1641323668209177e-05, 'batch_size': 1393, 'optimizer': 'RMSprop'}.
2026-07-02 17:48:44,147 - experiment_functions - INFO - Early stopping at epoch 500. Best Metrics: (0.0001601888584338588, 5.31884581045913e-05, 0.0001043370116151021)
2026-07-02 17:48:44,263 - optuna.study.study - INFO - Trial 130 finished with values: [0.0001601888584338588, 5.31884581045913e-05, 0.0001043370116151021] and parameters: {'n_layers': 3, 'embedding_dim': 64, 'lr': 1.034668654589238e-05, 'lambda_val': 0.008015948669672757, 'batch_size': 3637, 'optimizer': 'Adam'}.
2026-07-02 17:51:31,842 - experiment_functions - INFO - Early stopping at epoch 1950. Best Metrics: (0.014888485395079407, 0.0034971411203768782, 0.008892835538876284)
2026-07-02 17:51:31,972 - optuna.study.study - INFO - Trial 131 finished with values: [0.014888485395079407, 0.0034971411203768782, 0.008892835538876284] and parameters: {'n_layers': 2, 'embedding_dim': 64, 'lr': 0.0006781284315626388, 'lambda_val': 0.0013438659236486964, 'batch_size': 2370, 'optimizer': 'Adam'}.
2026-07-02 17:56:53,462 - optuna.study.study - INFO - Trial 132 finished with values: [0.00029244763925887385, 6.36361909465646e-05, 0.00018148277768088048] and parameters: {'n_layers': 1, 'embedding_dim': 96, 'lr': 0.00018037892110303518, 'lambda_val': 0.002011391227853155, 'batch_size': 1948, 'optimizer': 'RMSprop'}.
2026-07-02 17:57:48,650 - experiment_functions - INFO - Early stopping at epoch 550. Best Metrics: (0.007245534781195671, 0.0016801853997682502, 0.004620396028577218)
2026-07-02 17:57:48,985 - optuna.study.study - INFO - Trial 133 finished with values: [0.007245534781195671, 0.0016801853997682502, 0.004620396028577218] and parameters: {'n_layers': 3, 'embedding_dim': 96, 'lr': 0.01575252065743786, 'lambda_val': 9.00355461091747e-05, 'batch_size': 1092, 'optimizer': 'RMSprop'}.
2026-07-02 18:03:46,975 - optuna.study.study - INFO - Trial 134 finished with values: [0.014487317456788261, 0.0034059609064832934, 0.008752825054459255] and parameters: {'n_layers': 3, 'embedding_dim': 64, 'lr': 0.00035937037082201277, 'lambda_val': 9.00355461091747e-05, 'batch_size': 2355, 'optimizer': 'RMSprop'}.
2026-07-02 18:05:06,042 - experiment_functions - INFO - Early stopping at epoch 850. Best Metrics: (0.007760432996988375, 0.0019461276902912072, 0.0049263376842007996)
2026-07-02 18:05:06,148 - optuna.study.study - INFO - Trial 135 finished with values: [0.007760432996988375, 0.0019461276902912072, 0.0049263376842007996] and parameters: {'n_layers': 3, 'embedding_dim': 64, 'lr': 0.0036717136369980364, 'lambda_val': 9.00355461091747e-05, 'batch_size': 677, 'optimizer': 'RMSprop'}.
2026-07-02 18:10:39,554 - optuna.study.study - INFO - Trial 136 finished with values: [0.006810979613577694, 0.0016773360180840757, 0.0041051021443919] and parameters: {'n_layers': 3, 'embedding_dim': 32, 'lr': 0.00018037892110303518, 'lambda_val': 1.1788269361824724e-06, 'batch_size': 3709, 'optimizer': 'RMSprop'}.
2026-07-02 18:14:45,470 - experiment_functions - INFO - Early stopping at epoch 2000. Best Metrics: (0.008122583223030834, 0.0020401572858689664, 0.004907937310739543)
2026-07-02 18:14:45,620 - optuna.study.study - INFO - Trial 137 finished with values: [0.008122583223030834, 0.0020401572858689664, 0.004907937310739543] and parameters: {'n_layers': 3, 'embedding_dim': 256, 'lr': 0.00045784196880844456, 'lambda_val': 0.008015948669672757, 'batch_size': 2370, 'optimizer': 'Adam'}.
2026-07-02 18:20:13,968 - experiment_functions - INFO - Early stopping at epoch 3900. Best Metrics: (0.012322127708119779, 0.002922515814068347, 0.007199809411376407)
2026-07-02 18:20:14,083 - optuna.study.study - INFO - Trial 138 finished with values: [0.012322127708119779, 0.002922515814068347, 0.007199809411376407] and parameters: {'n_layers': 2, 'embedding_dim': 64, 'lr': 0.00045784196880844456, 'lambda_val': 0.008015948669672757, 'batch_size': 1891, 'optimizer': 'RMSprop'}.
2026-07-02 18:25:21,634 - optuna.study.study - INFO - Trial 139 finished with values: [0.012645111170028879, 0.003015595615751382, 0.007776027382142251] and parameters: {'n_layers': 1, 'embedding_dim': 32, 'lr': 0.0005747446367875012, 'lambda_val': 0.0012545102603406476, 'batch_size': 2278, 'optimizer': 'Adam'}.
2026-07-02 18:26:20,890 - experiment_functions - INFO - Early stopping at epoch 600. Best Metrics: (0.010839781616605796, 0.0026204813555458467, 0.006956941489705719)
2026-07-02 18:26:21,015 - optuna.study.study - INFO - Trial 140 finished with values: [0.010839781616605796, 0.0026204813555458467, 0.006956941489705719] and parameters: {'n_layers': 2, 'embedding_dim': 128, 'lr': 0.01003894592310146, 'lambda_val': 1.6046175410536033e-05, 'batch_size': 667, 'optimizer': 'RMSprop'}.
2026-07-02 18:33:36,380 - experiment_functions - INFO - Early stopping at epoch 3550. Best Metrics: (0.01449491312817489, 0.0033755675018520984, 0.008544123929007292)
2026-07-02 18:33:36,487 - optuna.study.study - INFO - Trial 141 finished with values: [0.01449491312817489, 0.0033755675018520984, 0.008544123929007292] and parameters: {'n_layers': 3, 'embedding_dim': 256, 'lr': 0.0005693523871630874, 'lambda_val': 0.00020052239202191264, 'batch_size': 1092, 'optimizer': 'Adam'}.
2026-07-02 18:36:30,845 - experiment_functions - INFO - Early stopping at epoch 1600. Best Metrics: (0.009245089628189406, 0.0022253670953403114, 0.005371526363896761)
2026-07-02 18:36:30,931 - optuna.study.study - INFO - Trial 142 finished with values: [0.009245089628189406, 0.0022253670953403114, 0.005371526363896761] and parameters: {'n_layers': 2, 'embedding_dim': 256, 'lr': 0.0005693523871630874, 'lambda_val': 0.005299023139585472, 'batch_size': 780, 'optimizer': 'RMSprop'}.
2026-07-02 18:38:03,709 - experiment_functions - INFO - Early stopping at epoch 950. Best Metrics: (0.00021772698661434045, 5.603783978876583e-05, 0.0001118819551685772)
2026-07-02 18:38:03,811 - optuna.study.study - INFO - Trial 143 finished with values: [0.00021772698661434045, 5.603783978876583e-05, 0.0001118819551685772] and parameters: {'n_layers': 1, 'embedding_dim': 256, 'lr': 5.798062744150962e-05, 'lambda_val': 0.005299023139585472, 'batch_size': 3332, 'optimizer': 'Adam'}.
2026-07-02 18:38:59,543 - experiment_functions - INFO - Early stopping at epoch 600. Best Metrics: (0.005255009088842477, 0.0013828999107193742, 0.0032401228935952197)
2026-07-02 18:38:59,621 - optuna.study.study - INFO - Trial 144 finished with values: [0.005255009088842477, 0.0013828999107193742, 0.0032401228935952197] and parameters: {'n_layers': 4, 'embedding_dim': 32, 'lr': 0.010539985286058167, 'lambda_val': 2.9585431976985735e-06, 'batch_size': 2839, 'optimizer': 'RMSprop'}.
2026-07-02 18:41:55,931 - experiment_functions - INFO - Early stopping at epoch 2050. Best Metrics: (0.01568926809958045, 0.003659555876374827, 0.009296661137561522)
2026-07-02 18:41:56,029 - optuna.study.study - INFO - Trial 145 finished with values: [0.01568926809958045, 0.003659555876374827, 0.009296661137561522] and parameters: {'n_layers': 2, 'embedding_dim': 64, 'lr': 0.0006781284315626388, 'lambda_val': 0.0004266548063750315, 'batch_size': 2340, 'optimizer': 'RMSprop'}.
2026-07-02 18:42:51,812 - experiment_functions - INFO - Early stopping at epoch 550. Best Metrics: (0.003748808783578789, 0.001003932146724161, 0.0025609839517739623)
2026-07-02 18:42:51,902 - optuna.study.study - INFO - Trial 146 finished with values: [0.003748808783578789, 0.001003932146724161, 0.0025609839517739623] and parameters: {'n_layers': 1, 'embedding_dim': 256, 'lr': 0.05561848162385812, 'lambda_val': 1.1641323668209177e-05, 'batch_size': 2370, 'optimizer': 'Adam'}.
2026-07-02 18:43:46,319 - experiment_functions - INFO - Early stopping at epoch 600. Best Metrics: (0.006708600577242454, 0.0016735368425051763, 0.004337586179104947)
2026-07-02 18:43:46,408 - optuna.study.study - INFO - Trial 147 finished with values: [0.006708600577242454, 0.0016735368425051763, 0.004337586179104947] and parameters: {'n_layers': 2, 'embedding_dim': 64, 'lr': 0.004261513620626375, 'lambda_val': 2.3467434467462208e-05, 'batch_size': 3269, 'optimizer': 'RMSprop'}.
2026-07-02 18:44:49,855 - experiment_functions - INFO - Early stopping at epoch 550. Best Metrics: (0.00871264231921281, 0.0022785555534449026, 0.005562525785538456)
2026-07-02 18:44:49,931 - optuna.study.study - INFO - Trial 148 finished with values: [0.00871264231921281, 0.0022785555534449026, 0.005562525785538456] and parameters: {'n_layers': 2, 'embedding_dim': 256, 'lr': 0.01003894592310146, 'lambda_val': 1.6046175410536033e-05, 'batch_size': 541, 'optimizer': 'Adam'}.
2026-07-02 18:45:46,468 - experiment_functions - INFO - Early stopping at epoch 500. Best Metrics: (0.00025888210411112173, 6.36361909465646e-05, 0.00014611114989577302)
2026-07-02 18:45:46,577 - optuna.study.study - INFO - Trial 149 finished with values: [0.00025888210411112173, 6.36361909465646e-05, 0.00014611114989577302] and parameters: {'n_layers': 2, 'embedding_dim': 256, 'lr': 0.05595981347829616, 'lambda_val': 0.02455984895138463, 'batch_size': 2370, 'optimizer': 'SGD'}.
2026-07-02 18:48:00,149 - experiment_functions - INFO - Early stopping at epoch 1200. Best Metrics: (0.011809122575622569, 0.0028864236460688034, 0.007195830656090467)
2026-07-02 18:48:00,592 - optuna.study.study - INFO - Trial 150 finished with values: [0.011809122575622569, 0.0028864236460688034, 0.007195830656090467] and parameters: {'n_layers': 2, 'embedding_dim': 256, 'lr': 0.0006781284315626388, 'lambda_val': 0.008015948669672757, 'batch_size': 3579, 'optimizer': 'Adam'}.
2026-07-02 18:53:59,395 - optuna.study.study - INFO - Trial 151 finished with values: [0.014217515099678621, 0.0033299773949053064, 0.008314244139789862] and parameters: {'n_layers': 3, 'embedding_dim': 64, 'lr': 0.0005152458540342933, 'lambda_val': 5.288093815108994e-05, 'batch_size': 1948, 'optimizer': 'Adam'}.
2026-07-02 18:59:33,713 - optuna.study.study - INFO - Trial 152 finished with values: [0.009068219646821534, 0.002173128431130445, 0.005311948840596663] and parameters: {'n_layers': 3, 'embedding_dim': 32, 'lr': 0.0002702800397506894, 'lambda_val': 0.00020052239202191264, 'batch_size': 1092, 'optimizer': 'Adam'}.
2026-07-02 19:01:41,814 - experiment_functions - INFO - Early stopping at epoch 1400. Best Metrics: (0.012232431047386598, 0.0027866952871226946, 0.0071061519338902444)
2026-07-02 19:01:42,476 - optuna.study.study - INFO - Trial 153 finished with values: [0.012232431047386598, 0.0027866952871226946, 0.0071061519338902444] and parameters: {'n_layers': 3, 'embedding_dim': 64, 'lr': 0.0007787505453018097, 'lambda_val': 0.0002014217145995872, 'batch_size': 2278, 'optimizer': 'RMSprop'}.
2026-07-02 19:08:01,119 - optuna.study.study - INFO - Trial 154 finished with values: [0.01383136400096959, 0.003163763463328458, 0.008245967651864566] and parameters: {'n_layers': 3, 'embedding_dim': 96, 'lr': 0.0005152458540342933, 'lambda_val': 5.288093815108994e-05, 'batch_size': 573, 'optimizer': 'RMSprop'}.
2026-07-02 19:08:59,928 - experiment_functions - INFO - Early stopping at epoch 550. Best Metrics: (0.00616434636043146, 0.0016023023004008128, 0.003860023595252108)
2026-07-02 19:09:00,033 - optuna.study.study - INFO - Trial 155 finished with values: [0.00616434636043146, 0.0016023023004008128, 0.003860023595252108] and parameters: {'n_layers': 4, 'embedding_dim': 96, 'lr': 0.010539985286058167, 'lambda_val': 9.00355461091747e-05, 'batch_size': 1948, 'optimizer': 'RMSprop'}.
2026-07-02 19:11:34,201 - experiment_functions - INFO - Early stopping at epoch 1700. Best Metrics: (0.009109782403763712, 0.0021949736907091164, 0.00536334492256663)
2026-07-02 19:11:34,287 - optuna.study.study - INFO - Trial 156 finished with values: [0.009109782403763712, 0.0021949736907091164, 0.00536334492256663] and parameters: {'n_layers': 3, 'embedding_dim': 64, 'lr': 0.00045784196880844456, 'lambda_val': 0.008015948669672757, 'batch_size': 2353, 'optimizer': 'RMSprop'}.
2026-07-02 19:19:14,493 - experiment_functions - INFO - Early stopping at epoch 3400. Best Metrics: (0.009849499140962708, 0.0022671580267082047, 0.005615266490757308)
2026-07-02 19:19:14,608 - optuna.study.study - INFO - Trial 157 finished with values: [0.009849499140962708, 0.0022671580267082047, 0.005615266490757308] and parameters: {'n_layers': 4, 'embedding_dim': 256, 'lr': 0.0005693523871630874, 'lambda_val': 0.00020052239202191264, 'batch_size': 780, 'optimizer': 'Adam'}.
2026-07-02 19:20:14,073 - experiment_functions - INFO - Early stopping at epoch 600. Best Metrics: (0.00019906874633166414, 4.843948863096708e-05, 0.0001136540344905991)
2026-07-02 19:20:14,173 - optuna.study.study - INFO - Trial 158 finished with values: [0.00019906874633166414, 4.843948863096708e-05, 0.0001136540344905991] and parameters: {'n_layers': 1, 'embedding_dim': 256, 'lr': 7.042103028925848e-05, 'lambda_val': 5.288093815108994e-05, 'batch_size': 2407, 'optimizer': 'RMSprop'}.
2026-07-02 19:21:01,310 - experiment_functions - INFO - Early stopping at epoch 550. Best Metrics: (0.004762177487410013, 0.001173945253879908, 0.003089884842207463)
2026-07-02 19:21:01,402 - optuna.study.study - INFO - Trial 159 finished with values: [0.004762177487410013, 0.001173945253879908, 0.003089884842207463] and parameters: {'n_layers': 1, 'embedding_dim': 64, 'lr': 0.015411915269475452, 'lambda_val': 0.0013701200929940348, 'batch_size': 2391, 'optimizer': 'RMSprop'}.
2026-07-02 19:22:43,318 - experiment_functions - INFO - Early stopping at epoch 1050. Best Metrics: (0.008399370447369684, 0.0020392074919742416, 0.004776909282153636)
