2026-07-04 15:54:27,820 - optuna.study.study - INFO - Trial 255 finished with values: [0.00351255955140973, 0.0008652622380943335, 0.0021064996872819123] and parameters: {'n_layers': 4, 'embedding_dim': 32, 'lr': 0.06392148936641796, 'lambda_val': 5.842035456079482e-06, 'batch_size': 3485, 'optimizer': 'RMSprop'}.
2026-07-04 15:56:29,423 - experiment_functions - INFO - Early stopping at epoch 1500. Best Metrics: (0.010829239432540598, 0.0024514180422848244, 0.006205263355611932)
2026-07-04 15:56:29,505 - optuna.study.study - INFO - Trial 256 finished with values: [0.010829239432540598, 0.0024514180422848244, 0.006205263355611932] and parameters: {'n_layers': 3, 'embedding_dim': 32, 'lr': 0.015216834194850396, 'lambda_val': 0.00011379845769455902, 'batch_size': 3899, 'optimizer': 'RMSprop'}.
2026-07-04 16:03:26,554 - optuna.study.study - INFO - Trial 257 finished with values: [0.02282174619973277, 0.00495412495488479, 0.01330550579991228] and parameters: {'n_layers': 2, 'embedding_dim': 256, 'lr': 0.0013879274114569848, 'lambda_val': 5.842035456079482e-06, 'batch_size': 3485, 'optimizer': 'RMSprop'}.
2026-07-04 16:11:47,822 - optuna.study.study - INFO - Trial 258 finished with values: [0.01839992503373941, 0.0038267196018463992, 0.010972097106432085] and parameters: {'n_layers': 4, 'embedding_dim': 256, 'lr': 0.015216834194850396, 'lambda_val': 1.3386054080202036e-05, 'batch_size': 3485, 'optimizer': 'RMSprop'}.
2026-07-04 16:20:09,254 - optuna.study.study - INFO - Trial 259 finished with values: [0.01959852791561281, 0.004143000968789773, 0.011760788533961538] and parameters: {'n_layers': 4, 'embedding_dim': 256, 'lr': 0.01117512599566325, 'lambda_val': 5.842035456079482e-06, 'batch_size': 3485, 'optimizer': 'RMSprop'}.
2026-07-04 16:25:42,812 - optuna.study.study - INFO - Trial 260 finished with values: [0.014171018082225742, 0.0034838440058507303, 0.008735379483511134] and parameters: {'n_layers': 1, 'embedding_dim': 128, 'lr': 0.0008496123911369606, 'lambda_val': 2.693600404305163e-06, 'batch_size': 3141, 'optimizer': 'Adam'}.
2026-07-04 16:31:55,401 - optuna.study.study - INFO - Trial 261 finished with values: [0.02243203964622087, 0.004769864939308171, 0.01304552154617272] and parameters: {'n_layers': 1, 'embedding_dim': 256, 'lr': 0.004214167238747189, 'lambda_val': 0.0002512734421382798, 'batch_size': 1756, 'optimizer': 'RMSprop'}.
2026-07-04 16:38:05,870 - optuna.study.study - INFO - Trial 262 finished with values: [0.01496726943209475, 0.0033632201812206753, 0.009084168594432947] and parameters: {'n_layers': 1, 'embedding_dim': 256, 'lr': 0.010561378130282784, 'lambda_val': 1.3386054080202036e-05, 'batch_size': 2102, 'optimizer': 'RMSprop'}.
2026-07-04 16:43:21,839 - experiment_functions - INFO - Early stopping at epoch 3350. Best Metrics: (0.010186690757014366, 0.002329844423760044, 0.005925988534713808)
2026-07-04 16:43:21,922 - optuna.study.study - INFO - Trial 263 finished with values: [0.010186690757014366, 0.002329844423760044, 0.005925988534713808] and parameters: {'n_layers': 3, 'embedding_dim': 128, 'lr': 0.010561378130282784, 'lambda_val': 0.0002512734421382798, 'batch_size': 3213, 'optimizer': 'Adam'}.
2026-07-04 16:48:48,132 - optuna.study.study - INFO - Trial 264 finished with values: [0.01751040635793086, 0.0038333681591094736, 0.010029933676418492] and parameters: {'n_layers': 1, 'embedding_dim': 96, 'lr': 0.008660151763754238, 'lambda_val': 2.0003344352285716e-06, 'batch_size': 2031, 'optimizer': 'Adam'}.
2026-07-04 16:53:59,134 - experiment_functions - INFO - Early stopping at epoch 3850. Best Metrics: (0.013424050523562265, 0.0029738046843834883, 0.007932473293078985)
2026-07-04 16:53:59,218 - optuna.study.study - INFO - Trial 265 finished with values: [0.013424050523562265, 0.0029738046843834883, 0.007932473293078985] and parameters: {'n_layers': 4, 'embedding_dim': 32, 'lr': 0.0013930224389611008, 'lambda_val': 0.0002512734421382798, 'batch_size': 3865, 'optimizer': 'RMSprop'}.
2026-07-04 16:59:29,997 - experiment_functions - INFO - Early stopping at epoch 3950. Best Metrics: (0.017175042230725038, 0.0037545352658473114, 0.010227335672733321)
2026-07-04 16:59:30,085 - optuna.study.study - INFO - Trial 266 finished with values: [0.017175042230725038, 0.0037545352658473114, 0.010227335672733321] and parameters: {'n_layers': 1, 'embedding_dim': 128, 'lr': 0.008660151763754238, 'lambda_val': 6.577413395094084e-06, 'batch_size': 4003, 'optimizer': 'RMSprop'}.
2026-07-04 17:02:31,246 - experiment_functions - INFO - Early stopping at epoch 1800. Best Metrics: (0.009077653201834282, 0.001982219858290751, 0.005258230399950852)
2026-07-04 17:02:31,337 - optuna.study.study - INFO - Trial 267 finished with values: [0.009077653201834282, 0.001982219858290751, 0.005258230399950852] and parameters: {'n_layers': 4, 'embedding_dim': 128, 'lr': 0.015216834194850396, 'lambda_val': 0.00011379845769455902, 'batch_size': 4003, 'optimizer': 'Adam'}.
2026-07-04 17:06:56,724 - experiment_functions - INFO - Early stopping at epoch 3000. Best Metrics: (0.004759073298738088, 0.0012261839180897744, 0.002734357116793361)
2026-07-04 17:06:56,812 - optuna.study.study - INFO - Trial 268 finished with values: [0.004759073298738088, 0.0012261839180897744, 0.002734357116793361] and parameters: {'n_layers': 2, 'embedding_dim': 128, 'lr': 0.004214167238747189, 'lambda_val': 0.041358136976405155, 'batch_size': 3865, 'optimizer': 'Adam'}.
2026-07-04 17:13:51,728 - optuna.study.study - INFO - Trial 269 finished with values: [0.019126732731642483, 0.004206637159736338, 0.011542481904706704] and parameters: {'n_layers': 2, 'embedding_dim': 256, 'lr': 0.00917953252838311, 'lambda_val': 0.0002512734421382798, 'batch_size': 1590, 'optimizer': 'RMSprop'}.
2026-07-04 17:16:13,164 - experiment_functions - INFO - Early stopping at epoch 1600. Best Metrics: (0.00020496312665735687, 6.458598484128944e-05, 0.00013040479326176366)
2026-07-04 17:16:13,250 - optuna.study.study - INFO - Trial 270 finished with values: [0.00020496312665735687, 6.458598484128944e-05, 0.00013040479326176366] and parameters: {'n_layers': 2, 'embedding_dim': 128, 'lr': 2.753513428507512e-05, 'lambda_val': 5.842035456079482e-06, 'batch_size': 3310, 'optimizer': 'RMSprop'}.
2026-07-04 17:21:37,988 - optuna.study.study - INFO - Trial 271 finished with values: [0.01428082589009085, 0.0032881864635374127, 0.008534290078085564] and parameters: {'n_layers': 2, 'embedding_dim': 64, 'lr': 0.010561378130282784, 'lambda_val': 0.0002512734421382798, 'batch_size': 1447, 'optimizer': 'RMSprop'}.
2026-07-04 17:26:45,312 - optuna.study.study - INFO - Trial 272 finished with values: [0.018561356697137925, 0.004143000968789772, 0.010838730726584547] and parameters: {'n_layers': 1, 'embedding_dim': 32, 'lr': 0.003976153551196258, 'lambda_val': 0.0010711634463373325, 'batch_size': 2442, 'optimizer': 'RMSprop'}.
2026-07-04 17:31:28,304 - experiment_functions - INFO - Early stopping at epoch 2250. Best Metrics: (0.010709477732159195, 0.002407727523127481, 0.006082341273623605)
2026-07-04 17:31:28,400 - optuna.study.study - INFO - Trial 273 finished with values: [0.010709477732159195, 0.002407727523127481, 0.006082341273623605] and parameters: {'n_layers': 4, 'embedding_dim': 256, 'lr': 0.000825254884924141, 'lambda_val': 0.004611832865416926, 'batch_size': 3865, 'optimizer': 'Adam'}.
2026-07-04 17:32:45,092 - experiment_functions - INFO - Early stopping at epoch 950. Best Metrics: (0.011248810190334912, 0.002595786714283001, 0.006536062529382916)
2026-07-04 17:32:45,206 - optuna.study.study - INFO - Trial 274 finished with values: [0.011248810190334912, 0.002595786714283001, 0.006536062529382916] and parameters: {'n_layers': 2, 'embedding_dim': 32, 'lr': 0.00917953252838311, 'lambda_val': 1.3386054080202036e-05, 'batch_size': 3268, 'optimizer': 'Adam'}.
2026-07-04 17:38:23,455 - optuna.study.study - INFO - Trial 275 finished with values: [0.014455347599237752, 0.00327773873069544, 0.008514840966663764] and parameters: {'n_layers': 2, 'embedding_dim': 96, 'lr': 0.010561378130282784, 'lambda_val': 0.00044915718987851753, 'batch_size': 1294, 'optimizer': 'RMSprop'}.
2026-07-04 17:39:08,399 - experiment_functions - INFO - Early stopping at epoch 500. Best Metrics: (0.00018110324604129964, 4.9389282525691926e-05, 0.00010631922458616512)
2026-07-04 17:39:08,491 - optuna.study.study - INFO - Trial 276 finished with values: [0.00018110324604129964, 4.9389282525691926e-05, 0.00010631922458616512] and parameters: {'n_layers': 2, 'embedding_dim': 96, 'lr': 0.010561378130282784, 'lambda_val': 1.9713647311976392e-05, 'batch_size': 3310, 'optimizer': 'SGD'}.
2026-07-04 17:44:48,523 - optuna.study.study - INFO - Trial 277 finished with values: [0.01582673063892122, 0.0033936135858518707, 0.009265821783809145] and parameters: {'n_layers': 2, 'embedding_dim': 96, 'lr': 0.010561378130282784, 'lambda_val': 9.197742608620578e-05, 'batch_size': 3485, 'optimizer': 'RMSprop'}.
2026-07-04 17:51:02,741 - optuna.study.study - INFO - Trial 278 finished with values: [0.021350828847809613, 0.004537165435100582, 0.012546106237372887] and parameters: {'n_layers': 1, 'embedding_dim': 256, 'lr': 0.006700064876975983, 'lambda_val': 5.842035456079482e-06, 'batch_size': 3485, 'optimizer': 'RMSprop'}.
2026-07-04 17:51:58,264 - experiment_functions - INFO - Early stopping at epoch 600. Best Metrics: (0.00020792288294273323, 4.7489694736242234e-05, 0.00012336842884196872)
2026-07-04 17:51:58,349 - optuna.study.study - INFO - Trial 279 finished with values: [0.00020792288294273323, 4.7489694736242234e-05, 0.00012336842884196872] and parameters: {'n_layers': 2, 'embedding_dim': 128, 'lr': 3.044625132635379e-05, 'lambda_val': 3.339379548029398e-06, 'batch_size': 754, 'optimizer': 'RMSprop'}.
2026-07-04 17:58:15,520 - optuna.study.study - INFO - Trial 280 finished with values: [0.017594850881659383, 0.003974887449423475, 0.010610895271320427] and parameters: {'n_layers': 3, 'embedding_dim': 128, 'lr': 0.000825254884924141, 'lambda_val': 5.842035456079482e-06, 'batch_size': 3310, 'optimizer': 'RMSprop'}.
2026-07-04 18:05:10,602 - optuna.study.study - INFO - Trial 281 finished with values: [0.01985815655332188, 0.004204737571946888, 0.011898264497010999] and parameters: {'n_layers': 2, 'embedding_dim': 256, 'lr': 0.010561378130282784, 'lambda_val': 1.3386054080202036e-05, 'batch_size': 3723, 'optimizer': 'RMSprop'}.
2026-07-04 18:06:00,378 - experiment_functions - INFO - Early stopping at epoch 550. Best Metrics: (0.0018814212873400796, 0.0004739471534676975, 0.0012317131568168028)
2026-07-04 18:06:00,473 - optuna.study.study - INFO - Trial 282 finished with values: [0.0018814212873400796, 0.0004739471534676975, 0.0012317131568168028] and parameters: {'n_layers': 2, 'embedding_dim': 96, 'lr': 0.05949180905755476, 'lambda_val': 0.06617920137140877, 'batch_size': 3865, 'optimizer': 'Adam'}.
2026-07-04 18:08:00,017 - experiment_functions - INFO - Early stopping at epoch 1150. Best Metrics: (0.00020344327903052667, 5.7937427578215534e-05, 0.0001254711388232851)
2026-07-04 18:08:00,108 - optuna.study.study - INFO - Trial 283 finished with values: [0.00020344327903052667, 5.7937427578215534e-05, 0.0001254711388232851] and parameters: {'n_layers': 2, 'embedding_dim': 256, 'lr': 4.86441501140013e-05, 'lambda_val': 1.3386054080202036e-05, 'batch_size': 1447, 'optimizer': 'RMSprop'}.
2026-07-04 18:11:22,268 - experiment_functions - INFO - Early stopping at epoch 2050. Best Metrics: (0.00028428841244129195, 7.503371768326274e-05, 0.0001534632266169511)
2026-07-04 18:11:22,362 - optuna.study.study - INFO - Trial 284 finished with values: [0.00028428841244129195, 7.503371768326274e-05, 0.0001534632266169511] and parameters: {'n_layers': 4, 'embedding_dim': 128, 'lr': 1.31492594234586e-05, 'lambda_val': 5.842035456079482e-06, 'batch_size': 3475, 'optimizer': 'RMSprop'}.
2026-07-04 18:17:05,338 - optuna.study.study - INFO - Trial 285 finished with values: [0.022977133501709567, 0.005050054138251998, 0.01374802804255736] and parameters: {'n_layers': 2, 'embedding_dim': 96, 'lr': 0.0013930224389611008, 'lambda_val': 6.577413395094084e-06, 'batch_size': 3141, 'optimizer': 'Adam'}.
2026-07-04 18:22:33,711 - experiment_functions - INFO - Early stopping at epoch 3950. Best Metrics: (0.014301726742690224, 0.0032207510970119493, 0.008517166396692418)
2026-07-04 18:22:33,826 - optuna.study.study - INFO - Trial 286 finished with values: [0.014301726742690224, 0.0032207510970119493, 0.008517166396692418] and parameters: {'n_layers': 1, 'embedding_dim': 128, 'lr': 0.010561378130282784, 'lambda_val': 1.0725546740804394e-05, 'batch_size': 1447, 'optimizer': 'Adam'}.
2026-07-04 18:29:33,379 - optuna.study.study - INFO - Trial 287 finished with values: [0.024085540925117836, 0.005302699314248808, 0.014487065936757741] and parameters: {'n_layers': 2, 'embedding_dim': 256, 'lr': 0.0010757379542588284, 'lambda_val': 5.385694884049571e-05, 'batch_size': 3723, 'optimizer': 'Adam'}.
2026-07-04 18:35:26,828 - optuna.study.study - INFO - Trial 288 finished with values: [0.013567026963209591, 0.00336606956290485, 0.0084166339965127] and parameters: {'n_layers': 2, 'embedding_dim': 128, 'lr': 0.000825254884924141, 'lambda_val': 2.502572700858551e-05, 'batch_size': 1117, 'optimizer': 'Adam'}.
2026-07-04 18:43:46,071 - optuna.study.study - INFO - Trial 289 finished with values: [0.0156898318640916, 0.003612066181638585, 0.009230797686468853] and parameters: {'n_layers': 4, 'embedding_dim': 256, 'lr': 0.00047354634504501403, 'lambda_val': 5.842035456079482e-06, 'batch_size': 3485, 'optimizer': 'RMSprop'}.
2026-07-04 18:49:36,606 - optuna.study.study - INFO - Trial 290 finished with values: [0.005518655855546845, 0.0014398875444028643, 0.0032623437841126884] and parameters: {'n_layers': 3, 'embedding_dim': 96, 'lr': 0.0016776946103172154, 'lambda_val': 0.018997620490891435, 'batch_size': 3601, 'optimizer': 'RMSprop'}.
2026-07-04 18:55:32,496 - optuna.study.study - INFO - Trial 291 finished with values: [0.01979560637267258, 0.004533366259521684, 0.011775464772845363] and parameters: {'n_layers': 2, 'embedding_dim': 128, 'lr': 0.000825254884924141, 'lambda_val': 0.0002512734421382798, 'batch_size': 3723, 'optimizer': 'Adam'}.
2026-07-04 19:01:50,040 - optuna.study.study - INFO - Trial 292 finished with values: [0.0177915341851778, 0.003784928670478506, 0.01047727305818916] and parameters: {'n_layers': 3, 'embedding_dim': 128, 'lr': 0.012323002098276907, 'lambda_val': 2.502572700858551e-05, 'batch_size': 3485, 'optimizer': 'RMSprop'}.
2026-07-04 19:06:22,403 - experiment_functions - INFO - Early stopping at epoch 3350. Best Metrics: (0.01409568054302897, 0.0031666128450126324, 0.008615051851230703)
2026-07-04 19:06:22,507 - optuna.study.study - INFO - Trial 293 finished with values: [0.01409568054302897, 0.0031666128450126324, 0.008615051851230703] and parameters: {'n_layers': 1, 'embedding_dim': 96, 'lr': 0.010561378130282784, 'lambda_val': 5.842035456079482e-06, 'batch_size': 4003, 'optimizer': 'RMSprop'}.
2026-07-04 19:09:58,824 - experiment_functions - INFO - Early stopping at epoch 1700. Best Metrics: (0.015255996247784885, 0.003351822654483977, 0.008740073504779702)
2026-07-04 19:09:58,918 - optuna.study.study - INFO - Trial 294 finished with values: [0.015255996247784885, 0.003351822654483977, 0.008740073504779702] and parameters: {'n_layers': 4, 'embedding_dim': 256, 'lr': 0.0013930224389611008, 'lambda_val': 5.842035456079482e-06, 'batch_size': 3485, 'optimizer': 'Adam'}.
2026-07-04 19:16:09,258 - optuna.study.study - INFO - Trial 295 finished with values: [0.018240905152127316, 0.004113557358053303, 0.011175826017571857] and parameters: {'n_layers': 1, 'embedding_dim': 256, 'lr': 0.00917953252838311, 'lambda_val': 5.385694884049571e-05, 'batch_size': 3865, 'optimizer': 'RMSprop'}.
2026-07-04 19:22:41,767 - experiment_functions - INFO - Early stopping at epoch 3950. Best Metrics: (0.014992510273952354, 0.0034297057538514144, 0.008833929417713295)
2026-07-04 19:22:41,836 - optuna.study.study - INFO - Trial 296 finished with values: [0.014992510273952354, 0.0034297057538514144, 0.008833929417713295] and parameters: {'n_layers': 4, 'embedding_dim': 128, 'lr': 0.0008496123911369606, 'lambda_val': 6.577413395094084e-06, 'batch_size': 1842, 'optimizer': 'Adam'}.
2026-07-04 19:30:19,121 - optuna.study.study - INFO - Trial 297 finished with values: [0.018477451680887175, 0.003988184563949624, 0.010808091124766885] and parameters: {'n_layers': 3, 'embedding_dim': 256, 'lr': 0.004214167238747189, 'lambda_val': 1.3386054080202036e-05, 'batch_size': 3865, 'optimizer': 'RMSprop'}.
2026-07-04 19:33:44,968 - experiment_functions - INFO - Early stopping at epoch 2300. Best Metrics: (0.0101016909141886, 0.0023526394772334404, 0.005765107510576345)
2026-07-04 19:33:45,047 - optuna.study.study - INFO - Trial 298 finished with values: [0.0101016909141886, 0.0023526394772334404, 0.005765107510576345] and parameters: {'n_layers': 3, 'embedding_dim': 96, 'lr': 0.00917953252838311, 'lambda_val': 0.0002512734421382798, 'batch_size': 3310, 'optimizer': 'Adam'}.
2026-07-04 19:36:16,029 - experiment_functions - INFO - Early stopping at epoch 1950. Best Metrics: (0.013763295695019983, 0.0030744828372243223, 0.00814619698750851)
2026-07-04 19:36:16,121 - optuna.study.study - INFO - Trial 299 finished with values: [0.013763295695019983, 0.0030744828372243223, 0.00814619698750851] and parameters: {'n_layers': 1, 'embedding_dim': 32, 'lr': 0.010561378130282784, 'lambda_val': 4.201777384389004e-06, 'batch_size': 2102, 'optimizer': 'Adam'}.
2026-07-04 19:36:16,136 - root - INFO - Selected Trial 244 based on Max ndcg: 0.0157
2026-07-04 19:36:16,136 - root - INFO - Associated Recall: 0.0258
2026-07-04 19:36:16,136 - experiment_functions - INFO - Training the best model ... for e_amazon_1c1dcs_rand2
2026-07-04 19:42:36,375 - root - INFO -   **** Training e_amazon_1c1dcs_rand3
2026-07-04 19:42:36,700 - root - INFO -   **** Getting 858585/2429444 random edges
2026-07-04 19:42:37,200 - optuna.storages._rdb.storage - INFO - A new study created in RDB with name: Study_e_amazon_1c1dcs_rand3
2026-07-04 19:50:51,975 - optuna.study.study - INFO - Trial 0 finished with values: [0.0005219434016520212, 0.00015576619873487456, 0.00034749866928831125] and parameters: {'n_layers': 4, 'embedding_dim': 256, 'lr': 9.005841274576329e-05, 'lambda_val': 1.4514407124820874e-06, 'batch_size': 2771, 'optimizer': 'Adam'}.
2026-07-04 19:55:58,448 - optuna.study.study - INFO - Trial 1 finished with values: [0.00455094489879025, 0.0011112588568280685, 0.0028652110095228403] and parameters: {'n_layers': 1, 'embedding_dim': 64, 'lr': 0.0007561669333504839, 'lambda_val': 2.439879643655442e-06, 'batch_size': 878, 'optimizer': 'RMSprop'}.
2026-07-04 20:00:41,960 - experiment_functions - INFO - Early stopping at epoch 3550. Best Metrics: (0.0030763537214741846, 0.0006961989248333111, 0.0017358542113055625)
2026-07-04 20:00:42,059 - optuna.study.study - INFO - Trial 2 finished with values: [0.0030763537214741846, 0.0006961989248333111, 0.0017358542113055625] and parameters: {'n_layers': 2, 'embedding_dim': 64, 'lr': 0.0028044930867102327, 'lambda_val': 0.04059388055961011, 'batch_size': 741, 'optimizer': 'Adam'}.
2026-07-04 20:01:29,218 - experiment_functions - INFO - Early stopping at epoch 500. Best Metrics: (0.0001761940239226032, 4.6539900841517385e-05, 0.0001270645089678559)
2026-07-04 20:01:29,305 - optuna.study.study - INFO - Trial 3 finished with values: [0.0001761940239226032, 4.6539900841517385e-05, 0.0001270645089678559] and parameters: {'n_layers': 3, 'embedding_dim': 96, 'lr': 0.0009960690196132256, 'lambda_val': 1.1407948092996293e-06, 'batch_size': 1931, 'optimizer': 'SGD'}.
2026-07-04 20:05:45,540 - experiment_functions - INFO - Early stopping at epoch 3250. Best Metrics: (0.015064427681359396, 0.003335676158273655, 0.00885715642485798)
2026-07-04 20:05:45,633 - optuna.study.study - INFO - Trial 4 finished with values: [0.015064427681359396, 0.003335676158273655, 0.00885715642485798] and parameters: {'n_layers': 1, 'embedding_dim': 64, 'lr': 0.008715315659881847, 'lambda_val': 0.0001483339453277888, 'batch_size': 3323, 'optimizer': 'RMSprop'}.
2026-07-04 20:09:03,803 - experiment_functions - INFO - Early stopping at epoch 2350. Best Metrics: (0.017158658545729493, 0.003879908059950991, 0.010092800038491926)
2026-07-04 20:09:03,894 - optuna.study.study - INFO - Trial 5 finished with values: [0.017158658545729493, 0.003879908059950991, 0.010092800038491926] and parameters: {'n_layers': 1, 'embedding_dim': 128, 'lr': 0.0028256479959556857, 'lambda_val': 0.005128289632509461, 'batch_size': 3221, 'optimizer': 'RMSprop'}.
2026-07-04 20:10:08,791 - experiment_functions - INFO - Early stopping at epoch 500. Best Metrics: (0.0001838445081008847, 4.559010694679254e-05, 0.00010065178100007468)
2026-07-04 20:10:08,912 - optuna.study.study - INFO - Trial 6 finished with values: [0.0001838445081008847, 4.559010694679254e-05, 0.00010065178100007468] and parameters: {'n_layers': 4, 'embedding_dim': 256, 'lr': 0.002656879406835307, 'lambda_val': 0.0007044808999883783, 'batch_size': 3443, 'optimizer': 'SGD'}.
2026-07-04 20:15:30,362 - optuna.study.study - INFO - Trial 7 finished with values: [0.008848051598093093, 0.002196873278498566, 0.005278503045885772] and parameters: {'n_layers': 4, 'embedding_dim': 32, 'lr': 0.0005102423819790047, 'lambda_val': 0.0035329079623473226, 'batch_size': 3494, 'optimizer': 'Adam'}.
2026-07-04 20:16:13,504 - experiment_functions - INFO - Early stopping at epoch 500. Best Metrics: (0.00027456751416587836, 5.888722147294038e-05, 0.00013012288940017266)
