2026-07-04 03:14:35,087 - optuna.study.study - INFO - Trial 40 finished with values: [0.0017544436653601622, 0.0005062401458883422, 0.0011509865302021186] and parameters: {'n_layers': 4, 'embedding_dim': 32, 'lr': 0.00236087646104434, 'lambda_val': 0.04329475963657309, 'batch_size': 1583, 'optimizer': 'RMSprop'}.
2026-07-04 03:15:15,616 - experiment_functions - INFO - Early stopping at epoch 500. Best Metrics: (0.00016711519476376316, 5.983701536766521e-05, 0.00010887453188582082)
2026-07-04 03:15:15,720 - optuna.study.study - INFO - Trial 41 finished with values: [0.00016711519476376316, 5.983701536766521e-05, 0.00010887453188582082] and parameters: {'n_layers': 1, 'embedding_dim': 32, 'lr': 0.04307998212853662, 'lambda_val': 1.2056212361873352e-05, 'batch_size': 830, 'optimizer': 'SGD'}.
2026-07-04 03:16:05,268 - experiment_functions - INFO - Early stopping at epoch 550. Best Metrics: (0.005598366281247934, 0.0015082727048230536, 0.0036283674178866437)
2026-07-04 03:16:05,366 - optuna.study.study - INFO - Trial 42 finished with values: [0.005598366281247934, 0.0015082727048230536, 0.0036283674178866437] and parameters: {'n_layers': 2, 'embedding_dim': 96, 'lr': 0.00917953252838311, 'lambda_val': 0.04182092985961486, 'batch_size': 1047, 'optimizer': 'RMSprop'}.
2026-07-04 03:21:30,145 - optuna.study.study - INFO - Trial 43 finished with values: [0.0032904790325342303, 0.0008519651235681857, 0.00201315212738487] and parameters: {'n_layers': 1, 'embedding_dim': 128, 'lr': 0.0008496123911369606, 'lambda_val': 0.0030408745239375477, 'batch_size': 733, 'optimizer': 'Adam'}.
2026-07-04 03:22:11,720 - experiment_functions - INFO - Early stopping at epoch 500. Best Metrics: (0.00018513936503881844, 4.369051915734285e-05, 0.0001077468629587272)
2026-07-04 03:22:11,825 - optuna.study.study - INFO - Trial 44 finished with values: [0.00018513936503881844, 4.369051915734285e-05, 0.0001077468629587272] and parameters: {'n_layers': 2, 'embedding_dim': 32, 'lr': 2.7604222723597844e-05, 'lambda_val': 3.1662931890992793e-06, 'batch_size': 3420, 'optimizer': 'SGD'}.
2026-07-04 03:22:54,327 - experiment_functions - INFO - Early stopping at epoch 500. Best Metrics: (0.00034718915632984726, 8.45316566305112e-05, 0.00020331078322176262)
2026-07-04 03:22:54,430 - optuna.study.study - INFO - Trial 45 finished with values: [0.00034718915632984726, 8.45316566305112e-05, 0.00020331078322176262] and parameters: {'n_layers': 4, 'embedding_dim': 32, 'lr': 0.0002027861823219702, 'lambda_val': 0.01237312233964013, 'batch_size': 3499, 'optimizer': 'SGD'}.
2026-07-04 03:23:37,591 - experiment_functions - INFO - Early stopping at epoch 500. Best Metrics: (0.000171831891495189, 5.5088045894040994e-05, 0.000100586150544856)
2026-07-04 03:23:37,697 - optuna.study.study - INFO - Trial 46 finished with values: [0.000171831891495189, 5.5088045894040994e-05, 0.000100586150544856] and parameters: {'n_layers': 2, 'embedding_dim': 64, 'lr': 0.0403308468985651, 'lambda_val': 7.748570910448429e-06, 'batch_size': 3558, 'optimizer': 'SGD'}.
2026-07-04 03:24:28,256 - experiment_functions - INFO - Early stopping at epoch 600. Best Metrics: (0.005188665664730099, 0.0011786942233535324, 0.0030394616715432618)
2026-07-04 03:24:28,399 - optuna.study.study - INFO - Trial 47 finished with values: [0.005188665664730099, 0.0011786942233535324, 0.0030394616715432618] and parameters: {'n_layers': 4, 'embedding_dim': 32, 'lr': 0.04841448245788081, 'lambda_val': 2.553678767931203e-06, 'batch_size': 547, 'optimizer': 'RMSprop'}.
2026-07-04 03:25:08,901 - experiment_functions - INFO - Early stopping at epoch 500. Best Metrics: (0.00020940469574289532, 5.318845810459131e-05, 0.0001220020166959966)
2026-07-04 03:25:09,001 - optuna.study.study - INFO - Trial 48 finished with values: [0.00020940469574289532, 5.318845810459131e-05, 0.0001220020166959966] and parameters: {'n_layers': 1, 'embedding_dim': 32, 'lr': 0.01750360964187914, 'lambda_val': 0.003164423895698861, 'batch_size': 1568, 'optimizer': 'SGD'}.
2026-07-04 03:30:09,897 - optuna.study.study - INFO - Trial 49 finished with values: [0.00903124194741373, 0.00235453906502289, 0.005216752743617878] and parameters: {'n_layers': 1, 'embedding_dim': 32, 'lr': 0.013444539848276985, 'lambda_val': 0.005222699236026829, 'batch_size': 3506, 'optimizer': 'RMSprop'}.
2026-07-04 03:31:07,642 - experiment_functions - INFO - Early stopping at epoch 550. Best Metrics: (0.0018756838484990696, 0.00046444921452044906, 0.001145891826709407)
2026-07-04 03:31:07,737 - optuna.study.study - INFO - Trial 50 finished with values: [0.0018756838484990696, 0.00046444921452044906, 0.001145891826709407] and parameters: {'n_layers': 4, 'embedding_dim': 128, 'lr': 0.04253268374092292, 'lambda_val': 0.045192697044491914, 'batch_size': 3540, 'optimizer': 'RMSprop'}.
2026-07-04 03:32:24,235 - experiment_functions - INFO - Early stopping at epoch 900. Best Metrics: (0.0011381990257336287, 0.0003495241532587429, 0.0007111227375960511)
2026-07-04 03:32:24,343 - optuna.study.study - INFO - Trial 51 finished with values: [0.0011381990257336287, 0.0003495241532587429, 0.0007111227375960511] and parameters: {'n_layers': 1, 'embedding_dim': 128, 'lr': 0.09265361857820965, 'lambda_val': 0.000418444762312661, 'batch_size': 2792, 'optimizer': 'RMSprop'}.
2026-07-04 03:35:14,452 - experiment_functions - INFO - Early stopping at epoch 2000. Best Metrics: (0.0002232460483471096, 5.8887221472940384e-05, 0.00013075222114027494)
2026-07-04 03:35:14,556 - optuna.study.study - INFO - Trial 52 finished with values: [0.0002232460483471096, 5.8887221472940384e-05, 0.00013075222114027494] and parameters: {'n_layers': 4, 'embedding_dim': 64, 'lr': 2.7604222723597844e-05, 'lambda_val': 2.553678767931203e-06, 'batch_size': 3420, 'optimizer': 'RMSprop'}.
2026-07-04 03:36:06,645 - experiment_functions - INFO - Early stopping at epoch 500. Best Metrics: (0.00026160003541779344, 6.0786809262390075e-05, 0.00014572948705563564)
2026-07-04 03:36:06,799 - optuna.study.study - INFO - Trial 53 finished with values: [0.00026160003541779344, 6.0786809262390075e-05, 0.00014572948705563564] and parameters: {'n_layers': 4, 'embedding_dim': 128, 'lr': 1.3324826754140698e-05, 'lambda_val': 2.591986046953647e-06, 'batch_size': 1490, 'optimizer': 'SGD'}.
2026-07-04 03:40:06,511 - experiment_functions - INFO - Early stopping at epoch 2600. Best Metrics: (0.002732950353126235, 0.0007550861463062516, 0.0016574667668111038)
2026-07-04 03:40:06,612 - optuna.study.study - INFO - Trial 54 finished with values: [0.002732950353126235, 0.0007550861463062516, 0.0016574667668111038] and parameters: {'n_layers': 4, 'embedding_dim': 96, 'lr': 0.0029943229674374533, 'lambda_val': 0.04520049155677577, 'batch_size': 3485, 'optimizer': 'Adam'}.
2026-07-04 03:45:28,494 - optuna.study.study - INFO - Trial 55 finished with values: [0.016925413294764574, 0.003741238151321163, 0.00997038815941939] and parameters: {'n_layers': 1, 'embedding_dim': 96, 'lr': 0.008660151763754238, 'lambda_val': 2.0003344352285716e-06, 'batch_size': 2031, 'optimizer': 'Adam'}.
2026-07-04 03:46:28,703 - experiment_functions - INFO - Early stopping at epoch 550. Best Metrics: (0.0028037239313104425, 0.0006544079934654181, 0.001801200882839931)
2026-07-04 03:46:28,824 - optuna.study.study - INFO - Trial 56 finished with values: [0.0028037239313104425, 0.0006544079934654181, 0.001801200882839931] and parameters: {'n_layers': 2, 'embedding_dim': 256, 'lr': 0.04253268374092292, 'lambda_val': 0.0540879399991663, 'batch_size': 2929, 'optimizer': 'Adam'}.
2026-07-04 03:48:50,653 - experiment_functions - INFO - Early stopping at epoch 1800. Best Metrics: (0.004740455177484117, 0.0011758448416693578, 0.00276592172008352)
2026-07-04 03:48:50,754 - optuna.study.study - INFO - Trial 57 finished with values: [0.004740455177484117, 0.0011758448416693578, 0.00276592172008352] and parameters: {'n_layers': 3, 'embedding_dim': 32, 'lr': 0.013002125754081323, 'lambda_val': 0.005222699236026829, 'batch_size': 2058, 'optimizer': 'Adam'}.
2026-07-04 03:49:36,621 - experiment_functions - INFO - Early stopping at epoch 500. Best Metrics: (0.00022274792081686875, 5.6987633683490685e-05, 0.00012291933865563818)
2026-07-04 03:49:36,727 - optuna.study.study - INFO - Trial 58 finished with values: [0.00022274792081686875, 5.6987633683490685e-05, 0.00012291933865563818] and parameters: {'n_layers': 4, 'embedding_dim': 64, 'lr': 0.003976153551196258, 'lambda_val': 5.245398963432972e-05, 'batch_size': 3847, 'optimizer': 'SGD'}.
2026-07-04 03:50:17,275 - experiment_functions - INFO - Early stopping at epoch 500. Best Metrics: (0.00019397306277875377, 5.128887031514161e-05, 0.00012516278286866717)
2026-07-04 03:50:17,376 - optuna.study.study - INFO - Trial 59 finished with values: [0.00019397306277875377, 5.128887031514161e-05, 0.00012516278286866717] and parameters: {'n_layers': 1, 'embedding_dim': 32, 'lr': 0.0008569884095631057, 'lambda_val': 0.044682006756860536, 'batch_size': 1200, 'optimizer': 'Adam'}.
2026-07-04 03:51:00,296 - experiment_functions - INFO - Early stopping at epoch 500. Best Metrics: (0.0002490541154642062, 5.8887221472940384e-05, 0.0001315539676016266)
2026-07-04 03:51:00,402 - optuna.study.study - INFO - Trial 60 finished with values: [0.0002490541154642062, 5.8887221472940384e-05, 0.0001315539676016266] and parameters: {'n_layers': 4, 'embedding_dim': 32, 'lr': 1.5930839532885107e-05, 'lambda_val': 0.005222699236026829, 'batch_size': 3506, 'optimizer': 'SGD'}.
2026-07-04 03:58:34,160 - optuna.study.study - INFO - Trial 61 finished with values: [0.007717564007589353, 0.0020268601713428185, 0.004769327514737529] and parameters: {'n_layers': 3, 'embedding_dim': 256, 'lr': 0.00026307955757801885, 'lambda_val': 1.3386054080202036e-05, 'batch_size': 2611, 'optimizer': 'Adam'}.
2026-07-04 03:59:15,350 - experiment_functions - INFO - Early stopping at epoch 500. Best Metrics: (0.0003448979996124867, 6.933495431491366e-05, 0.00016505832711409218)
2026-07-04 03:59:15,457 - optuna.study.study - INFO - Trial 62 finished with values: [0.0003448979996124867, 6.933495431491366e-05, 0.00016505832711409218] and parameters: {'n_layers': 1, 'embedding_dim': 64, 'lr': 0.013444539848276985, 'lambda_val': 0.005222699236026829, 'batch_size': 3558, 'optimizer': 'SGD'}.
2026-07-04 04:03:54,799 - experiment_functions - INFO - Early stopping at epoch 3300. Best Metrics: (0.013306178927090764, 0.002861729004805957, 0.007769873151648692)
2026-07-04 04:03:54,906 - optuna.study.study - INFO - Trial 63 finished with values: [0.013306178927090764, 0.002861729004805957, 0.007769873151648692] and parameters: {'n_layers': 2, 'embedding_dim': 96, 'lr': 0.010561378130282784, 'lambda_val': 1.3386054080202036e-05, 'batch_size': 3310, 'optimizer': 'Adam'}.
2026-07-04 04:04:46,431 - experiment_functions - INFO - Early stopping at epoch 500. Best Metrics: (0.00020945882927141107, 5.6987633683490685e-05, 0.00011147489749110687)
2026-07-04 04:04:46,545 - optuna.study.study - INFO - Trial 64 finished with values: [0.00020945882927141107, 5.6987633683490685e-05, 0.00011147489749110687] and parameters: {'n_layers': 4, 'embedding_dim': 128, 'lr': 1.2959136904151421e-05, 'lambda_val': 0.0016032367653458185, 'batch_size': 1726, 'optimizer': 'SGD'}.
2026-07-04 04:05:33,457 - experiment_functions - INFO - Early stopping at epoch 500. Best Metrics: (0.0001833827915147864, 5.413825199931615e-05, 0.00010639488144392654)
2026-07-04 04:05:33,584 - optuna.study.study - INFO - Trial 65 finished with values: [0.0001833827915147864, 5.413825199931615e-05, 0.00010639488144392654] and parameters: {'n_layers': 3, 'embedding_dim': 96, 'lr': 0.0006924103134205528, 'lambda_val': 2.029945108338137e-05, 'batch_size': 1982, 'optimizer': 'SGD'}.
2026-07-04 04:06:17,209 - experiment_functions - INFO - Early stopping at epoch 500. Best Metrics: (0.0002135944007236898, 4.8439488630967084e-05, 0.00011168788770479597)
2026-07-04 04:06:17,531 - optuna.study.study - INFO - Trial 66 finished with values: [0.0002135944007236898, 4.8439488630967084e-05, 0.00011168788770479597] and parameters: {'n_layers': 1, 'embedding_dim': 128, 'lr': 0.0002027861823219702, 'lambda_val': 0.0030408745239375477, 'batch_size': 3499, 'optimizer': 'SGD'}.
2026-07-04 04:07:23,849 - experiment_functions - INFO - Early stopping at epoch 800. Best Metrics: (0.0001870536798596496, 5.793742757821552e-05, 0.00010616893858436397)
2026-07-04 04:07:23,965 - optuna.study.study - INFO - Trial 67 finished with values: [0.0001870536798596496, 5.793742757821552e-05, 0.00010616893858436397] and parameters: {'n_layers': 2, 'embedding_dim': 64, 'lr': 0.0002027861823219702, 'lambda_val': 0.01237312233964013, 'batch_size': 2034, 'optimizer': 'Adam'}.
2026-07-04 04:12:57,931 - optuna.study.study - INFO - Trial 68 finished with values: [0.007774259653237274, 0.0019594248048173547, 0.004622155906897426] and parameters: {'n_layers': 2, 'embedding_dim': 96, 'lr': 0.010561378130282784, 'lambda_val': 0.00627610193516373, 'batch_size': 2412, 'optimizer': 'Adam'}.
2026-07-04 04:13:57,886 - experiment_functions - INFO - Early stopping at epoch 550. Best Metrics: (0.010163360532860466, 0.002428622988811428, 0.006156743637703689)
2026-07-04 04:13:58,759 - optuna.study.study - INFO - Trial 69 finished with values: [0.010163360532860466, 0.002428622988811428, 0.006156743637703689] and parameters: {'n_layers': 2, 'embedding_dim': 256, 'lr': 0.00917953252838311, 'lambda_val': 0.0016032367653458185, 'batch_size': 1726, 'optimizer': 'RMSprop'}.
2026-07-04 04:14:49,898 - experiment_functions - INFO - Early stopping at epoch 550. Best Metrics: (0.008671519676307358, 0.0020525046065003895, 0.005371978535745411)
2026-07-04 04:14:50,002 - optuna.study.study - INFO - Trial 70 finished with values: [0.008671519676307358, 0.0020525046065003895, 0.005371978535745411] and parameters: {'n_layers': 2, 'embedding_dim': 128, 'lr': 0.05646473129906133, 'lambda_val': 2.693600404305163e-06, 'batch_size': 1625, 'optimizer': 'Adam'}.
2026-07-04 04:21:24,120 - optuna.study.study - INFO - Trial 71 finished with values: [0.011396364733069158, 0.002477062477442395, 0.0066672116118142374] and parameters: {'n_layers': 4, 'embedding_dim': 128, 'lr': 0.01117512599566325, 'lambda_val': 5.842035456079482e-06, 'batch_size': 3865, 'optimizer': 'Adam'}.
2026-07-04 04:22:11,085 - experiment_functions - INFO - Early stopping at epoch 550. Best Metrics: (0.00458374629372022, 0.0011796440172482572, 0.0029419334434244706)
2026-07-04 04:22:11,249 - optuna.study.study - INFO - Trial 72 finished with values: [0.00458374629372022, 0.0011796440172482572, 0.0029419334434244706] and parameters: {'n_layers': 2, 'embedding_dim': 64, 'lr': 0.04253268374092292, 'lambda_val': 1.9831699407759734e-06, 'batch_size': 3656, 'optimizer': 'RMSprop'}.
2026-07-04 04:27:41,083 - optuna.study.study - INFO - Trial 73 finished with values: [0.005068520557283216, 0.001297418460194138, 0.0028789385021759845] and parameters: {'n_layers': 2, 'embedding_dim': 96, 'lr': 0.002418408076717017, 'lambda_val': 0.02788180573288284, 'batch_size': 2058, 'optimizer': 'RMSprop'}.
2026-07-04 04:28:27,347 - experiment_functions - INFO - Early stopping at epoch 500. Best Metrics: (0.0001909588143382927, 5.603783978876584e-05, 0.00011055247401605077)
2026-07-04 04:28:27,449 - optuna.study.study - INFO - Trial 74 finished with values: [0.0001909588143382927, 5.603783978876584e-05, 0.00011055247401605077] and parameters: {'n_layers': 2, 'embedding_dim': 128, 'lr': 0.0008496123911369606, 'lambda_val': 2.591986046953647e-06, 'batch_size': 733, 'optimizer': 'SGD'}.
2026-07-04 04:29:21,337 - experiment_functions - INFO - Early stopping at epoch 550. Best Metrics: (0.0027071960387709385, 0.0007474877951484529, 0.0017481413895264852)
2026-07-04 04:29:21,487 - optuna.study.study - INFO - Trial 75 finished with values: [0.0027071960387709385, 0.0007474877951484529, 0.0017481413895264852] and parameters: {'n_layers': 1, 'embedding_dim': 256, 'lr': 0.04083467235083537, 'lambda_val': 0.02788180573288284, 'batch_size': 2082, 'optimizer': 'Adam'}.
2026-07-04 04:30:04,949 - experiment_functions - INFO - Early stopping at epoch 500. Best Metrics: (0.0002040728547020824, 5.413825199931616e-05, 0.00011342258245008029)
2026-07-04 04:30:05,054 - optuna.study.study - INFO - Trial 76 finished with values: [0.0002040728547020824, 5.413825199931616e-05, 0.00011342258245008029] and parameters: {'n_layers': 1, 'embedding_dim': 128, 'lr': 1.3324826754140698e-05, 'lambda_val': 2.591986046953647e-06, 'batch_size': 3852, 'optimizer': 'SGD'}.
2026-07-04 04:30:54,403 - experiment_functions - INFO - Early stopping at epoch 500. Best Metrics: (0.0001857334246559712, 5.0339076420416775e-05, 0.00010931223836516975)
2026-07-04 04:30:54,795 - optuna.study.study - INFO - Trial 77 finished with values: [0.0001857334246559712, 5.0339076420416775e-05, 0.00010931223836516975] and parameters: {'n_layers': 3, 'embedding_dim': 128, 'lr': 0.013444539848276985, 'lambda_val': 1.6695749389303757e-05, 'batch_size': 2681, 'optimizer': 'SGD'}.
2026-07-04 04:34:00,935 - experiment_functions - INFO - Early stopping at epoch 2250. Best Metrics: (0.004049694792883456, 0.0010143798795661343, 0.0023467355033307048)
2026-07-04 04:34:01,043 - optuna.study.study - INFO - Trial 78 finished with values: [0.004049694792883456, 0.0010143798795661343, 0.0023467355033307048] and parameters: {'n_layers': 3, 'embedding_dim': 64, 'lr': 0.002418408076717017, 'lambda_val': 0.02788180573288284, 'batch_size': 2058, 'optimizer': 'Adam'}.
2026-07-04 04:34:51,207 - experiment_functions - INFO - Early stopping at epoch 550. Best Metrics: (0.00028544799552110683, 6.553577873601429e-05, 0.00016341135499963342)
2026-07-04 04:34:51,315 - optuna.study.study - INFO - Trial 79 finished with values: [0.00028544799552110683, 6.553577873601429e-05, 0.00016341135499963342] and parameters: {'n_layers': 4, 'embedding_dim': 64, 'lr': 2.620777012891229e-05, 'lambda_val': 2.0003344352285716e-06, 'batch_size': 930, 'optimizer': 'Adam'}.
2026-07-04 04:36:21,371 - experiment_functions - INFO - Early stopping at epoch 1150. Best Metrics: (0.0001919164418568822, 5.128887031514162e-05, 0.0001011750632970294)
2026-07-04 04:36:21,740 - optuna.study.study - INFO - Trial 80 finished with values: [0.0001919164418568822, 5.128887031514162e-05, 0.0001011750632970294] and parameters: {'n_layers': 2, 'embedding_dim': 32, 'lr': 1.3523364750416222e-05, 'lambda_val': 0.0002512734421382798, 'batch_size': 3362, 'optimizer': 'Adam'}.
2026-07-04 04:37:13,392 - experiment_functions - INFO - Early stopping at epoch 550. Best Metrics: (0.008779922390011902, 0.0020344585225006177, 0.005252968383312125)
2026-07-04 04:37:13,524 - optuna.study.study - INFO - Trial 81 finished with values: [0.008779922390011902, 0.0020344585225006177, 0.005252968383312125] and parameters: {'n_layers': 2, 'embedding_dim': 128, 'lr': 0.039464971202713, 'lambda_val': 1.3386054080202036e-05, 'batch_size': 4003, 'optimizer': 'Adam'}.
2026-07-04 04:38:00,194 - experiment_functions - INFO - Early stopping at epoch 500. Best Metrics: (0.00024220488154187296, 5.983701536766521e-05, 0.00013946220148926532)
2026-07-04 04:38:00,319 - optuna.study.study - INFO - Trial 82 finished with values: [0.00024220488154187296, 5.983701536766521e-05, 0.00013946220148926532] and parameters: {'n_layers': 3, 'embedding_dim': 96, 'lr': 0.000825254884924141, 'lambda_val': 0.025150250334833837, 'batch_size': 1982, 'optimizer': 'SGD'}.
2026-07-04 04:38:42,750 - experiment_functions - INFO - Early stopping at epoch 500. Best Metrics: (0.00021360926084895623, 5.413825199931615e-05, 0.00011470049423605299)
2026-07-04 04:38:42,850 - optuna.study.study - INFO - Trial 83 finished with values: [0.00021360926084895623, 5.413825199931615e-05, 0.00011470049423605299] and parameters: {'n_layers': 2, 'embedding_dim': 64, 'lr': 0.0403308468985651, 'lambda_val': 7.748570910448429e-06, 'batch_size': 2587, 'optimizer': 'SGD'}.
2026-07-04 04:44:15,316 - optuna.study.study - INFO - Trial 84 finished with values: [0.013379886220449421, 0.0030231939669091807, 0.007879458279282773] and parameters: {'n_layers': 3, 'embedding_dim': 64, 'lr': 0.003976153551196258, 'lambda_val': 5.245398963432972e-05, 'batch_size': 1590, 'optimizer': 'RMSprop'}.
2026-07-04 04:45:10,178 - experiment_functions - INFO - Early stopping at epoch 550. Best Metrics: (0.00752392255093842, 0.0017495203540831643, 0.004424560175339939)
2026-07-04 04:45:10,500 - optuna.study.study - INFO - Trial 85 finished with values: [0.00752392255093842, 0.0017495203540831643, 0.004424560175339939] and parameters: {'n_layers': 3, 'embedding_dim': 128, 'lr': 0.039464971202713, 'lambda_val': 0.0002512734421382798, 'batch_size': 3502, 'optimizer': 'Adam'}.
2026-07-04 04:45:53,509 - experiment_functions - INFO - Early stopping at epoch 500. Best Metrics: (0.00021333489688672155, 6.173660315711492e-05, 0.00013649091991892924)
2026-07-04 04:45:53,613 - optuna.study.study - INFO - Trial 86 finished with values: [0.00021333489688672155, 6.173660315711492e-05, 0.00013649091991892924] and parameters: {'n_layers': 4, 'embedding_dim': 32, 'lr': 5.402134943476108e-05, 'lambda_val': 1.3926918047277332e-06, 'batch_size': 1568, 'optimizer': 'SGD'}.
2026-07-04 04:46:42,168 - experiment_functions - INFO - Early stopping at epoch 500. Best Metrics: (0.00017137458651723348, 5.3188458104591316e-05, 0.0001086374602738667)
2026-07-04 04:46:42,313 - optuna.study.study - INFO - Trial 87 finished with values: [0.00017137458651723348, 5.3188458104591316e-05, 0.0001086374602738667] and parameters: {'n_layers': 4, 'embedding_dim': 96, 'lr': 0.00448690613597682, 'lambda_val': 0.00022935220402494757, 'batch_size': 1625, 'optimizer': 'SGD'}.
2026-07-04 04:47:26,388 - experiment_functions - INFO - Early stopping at epoch 500. Best Metrics: (0.00024017209805483035, 7.313412989381305e-05, 0.00013750471529819328)
