2026-07-08 16:33:10,212 - optuna.study.study - INFO - Trial 92 finished with values: [0.004543091300555382, 0.0011606481393537603, 0.002928808510545521] and parameters: {'n_layers': 2, 'embedding_dim': 96, 'lr': 0.0016459794241324855, 'lambda_val': 8.982642030344512e-06, 'batch_size': 3801, 'optimizer': 'Adam'}.
2026-07-08 16:36:00,810 - experiment_functions - INFO - Early stopping at epoch 2250. Best Metrics: (0.003087686135121502, 0.000782630169253272, 0.0019112593202186949)
2026-07-08 16:36:00,895 - optuna.study.study - INFO - Trial 93 finished with values: [0.003087686135121502, 0.000782630169253272, 0.0019112593202186949] and parameters: {'n_layers': 1, 'embedding_dim': 64, 'lr': 0.0026199811222762572, 'lambda_val': 4.325919770856533e-05, 'batch_size': 1388, 'optimizer': 'Adam'}.
2026-07-08 16:37:53,474 - experiment_functions - INFO - Early stopping at epoch 1500. Best Metrics: (0.0014187054806770918, 0.0004074615808369584, 0.0008757621799043872)
2026-07-08 16:37:53,611 - optuna.study.study - INFO - Trial 94 finished with values: [0.0014187054806770918, 0.0004074615808369584, 0.0008757621799043872] and parameters: {'n_layers': 1, 'embedding_dim': 32, 'lr': 0.0024216232986666152, 'lambda_val': 0.038323962237623424, 'batch_size': 3093, 'optimizer': 'Adam'}.
2026-07-08 16:39:02,435 - experiment_functions - INFO - Early stopping at epoch 650. Best Metrics: (0.003213446637490422, 0.0008852079098835553, 0.0021415612634112908)
2026-07-08 16:39:02,530 - optuna.study.study - INFO - Trial 95 finished with values: [0.003213446637490422, 0.0008852079098835553, 0.0021415612634112908] and parameters: {'n_layers': 3, 'embedding_dim': 256, 'lr': 0.016511190294346553, 'lambda_val': 1.3798424398068006e-06, 'batch_size': 587, 'optimizer': 'Adam'}.
2026-07-08 16:40:16,016 - experiment_functions - INFO - Early stopping at epoch 650. Best Metrics: (0.004741625475749832, 0.001340159185456756, 0.003074620354377431)
2026-07-08 16:40:16,107 - optuna.study.study - INFO - Trial 96 finished with values: [0.004741625475749832, 0.001340159185456756, 0.003074620354377431] and parameters: {'n_layers': 4, 'embedding_dim': 256, 'lr': 0.003328720631447993, 'lambda_val': 0.0008206810021385492, 'batch_size': 2191, 'optimizer': 'Adam'}.
2026-07-08 16:41:03,768 - experiment_functions - INFO - Early stopping at epoch 500. Best Metrics: (0.00018946013059273294, 5.698763368349069e-05, 0.00011483634739126735)
2026-07-08 16:41:03,858 - optuna.study.study - INFO - Trial 97 finished with values: [0.00018946013059273294, 5.698763368349069e-05, 0.00011483634739126735] and parameters: {'n_layers': 4, 'embedding_dim': 128, 'lr': 0.001177253088002245, 'lambda_val': 0.03786575442820556, 'batch_size': 3584, 'optimizer': 'SGD'}.
2026-07-08 16:43:22,339 - experiment_functions - INFO - Early stopping at epoch 1450. Best Metrics: (0.004140903364325197, 0.0011179074140911423, 0.0026640317604037255)
2026-07-08 16:43:22,427 - optuna.study.study - INFO - Trial 98 finished with values: [0.004140903364325197, 0.0011179074140911423, 0.0026640317604037255] and parameters: {'n_layers': 2, 'embedding_dim': 256, 'lr': 0.0020140299216981693, 'lambda_val': 5.222245565310666e-05, 'batch_size': 3390, 'optimizer': 'Adam'}.
2026-07-08 16:44:02,542 - experiment_functions - INFO - Early stopping at epoch 500. Best Metrics: (0.0002045937494055546, 6.17366031571149e-05, 0.00012079655258606229)
2026-07-08 16:44:03,376 - optuna.study.study - INFO - Trial 99 finished with values: [0.0002045937494055546, 6.17366031571149e-05, 0.00012079655258606229] and parameters: {'n_layers': 1, 'embedding_dim': 32, 'lr': 0.0013449757396422478, 'lambda_val': 6.892455337046496e-05, 'batch_size': 3584, 'optimizer': 'SGD'}.
2026-07-08 16:44:51,938 - experiment_functions - INFO - Early stopping at epoch 600. Best Metrics: (0.002888878151570693, 0.0007911783143057956, 0.0018782865379316906)
2026-07-08 16:44:52,024 - optuna.study.study - INFO - Trial 100 finished with values: [0.002888878151570693, 0.0007911783143057956, 0.0018782865379316906] and parameters: {'n_layers': 3, 'embedding_dim': 32, 'lr': 0.00635566229797604, 'lambda_val': 0.0071217114816529686, 'batch_size': 2781, 'optimizer': 'Adam'}.
2026-07-08 16:46:07,685 - experiment_functions - INFO - Early stopping at epoch 850. Best Metrics: (0.006272945194133296, 0.0017229261250308685, 0.00405399313621953)
2026-07-08 16:46:07,774 - optuna.study.study - INFO - Trial 101 finished with values: [0.006272945194133296, 0.0017229261250308685, 0.00405399313621953] and parameters: {'n_layers': 4, 'embedding_dim': 96, 'lr': 0.0016459794241324855, 'lambda_val': 8.982642030344512e-06, 'batch_size': 3801, 'optimizer': 'RMSprop'}.
2026-07-08 16:47:38,664 - experiment_functions - INFO - Early stopping at epoch 1200. Best Metrics: (0.0018060860164703263, 0.00046159983283627454, 0.001122187955686152)
2026-07-08 16:47:38,750 - optuna.study.study - INFO - Trial 102 finished with values: [0.0018060860164703263, 0.00046159983283627454, 0.001122187955686152] and parameters: {'n_layers': 1, 'embedding_dim': 32, 'lr': 0.0026199811222762572, 'lambda_val': 0.009907083646107878, 'batch_size': 2986, 'optimizer': 'Adam'}.
2026-07-08 16:52:52,994 - optuna.study.study - INFO - Trial 103 finished with values: [0.00557907943471967, 0.0013895484679824477, 0.00354521172640116] and parameters: {'n_layers': 3, 'embedding_dim': 64, 'lr': 0.0005079724528508135, 'lambda_val': 6.625860010406062e-06, 'batch_size': 2965, 'optimizer': 'RMSprop'}.
2026-07-08 16:53:42,296 - experiment_functions - INFO - Early stopping at epoch 600. Best Metrics: (0.0034550695772627414, 0.0009811370932507645, 0.0022170473923363407)
2026-07-08 16:53:42,371 - optuna.study.study - INFO - Trial 104 finished with values: [0.0034550695772627414, 0.0009811370932507645, 0.0022170473923363407] and parameters: {'n_layers': 4, 'embedding_dim': 32, 'lr': 0.00635566229797604, 'lambda_val': 0.005748467002573189, 'batch_size': 3285, 'optimizer': 'Adam'}.
2026-07-08 16:54:55,563 - experiment_functions - INFO - Early stopping at epoch 850. Best Metrics: (0.0034898519742605954, 0.0009478943069353951, 0.0022672464936535843)
2026-07-08 16:54:55,653 - optuna.study.study - INFO - Trial 105 finished with values: [0.0034898519742605954, 0.0009478943069353951, 0.0022672464936535843] and parameters: {'n_layers': 2, 'embedding_dim': 128, 'lr': 0.006297648769451647, 'lambda_val': 3.919783466405167e-06, 'batch_size': 3967, 'optimizer': 'RMSprop'}.
2026-07-08 16:56:03,701 - experiment_functions - INFO - Early stopping at epoch 600. Best Metrics: (0.003862222376005182, 0.0010647189559865509, 0.0024658041621949713)
2026-07-08 16:56:03,787 - optuna.study.study - INFO - Trial 106 finished with values: [0.003862222376005182, 0.0010647189559865509, 0.0024658041621949713] and parameters: {'n_layers': 4, 'embedding_dim': 256, 'lr': 0.003328720631447993, 'lambda_val': 0.005748467002573189, 'batch_size': 3365, 'optimizer': 'Adam'}.
2026-07-08 16:57:17,729 - experiment_functions - INFO - Early stopping at epoch 950. Best Metrics: (0.003744115316361086, 0.0009744885359876907, 0.002424555387990755)
2026-07-08 16:57:17,817 - optuna.study.study - INFO - Trial 107 finished with values: [0.003744115316361086, 0.0009744885359876907, 0.002424555387990755] and parameters: {'n_layers': 2, 'embedding_dim': 32, 'lr': 0.0026199811222762572, 'lambda_val': 8.982642030344512e-06, 'batch_size': 3801, 'optimizer': 'Adam'}.
2026-07-08 16:58:54,586 - experiment_functions - INFO - Early stopping at epoch 1250. Best Metrics: (0.005246812461735422, 0.0013734019717721254, 0.0032208771815784368)
2026-07-08 16:58:54,674 - optuna.study.study - INFO - Trial 108 finished with values: [0.005246812461735422, 0.0013734019717721254, 0.0032208771815784368] and parameters: {'n_layers': 3, 'embedding_dim': 32, 'lr': 0.0026199811222762572, 'lambda_val': 4.325919770856533e-05, 'batch_size': 1388, 'optimizer': 'Adam'}.
2026-07-08 16:59:45,038 - experiment_functions - INFO - Early stopping at epoch 500. Best Metrics: (0.0014170288526923012, 0.00037896776399521303, 0.0009177595686733904)
2026-07-08 16:59:45,126 - optuna.study.study - INFO - Trial 109 finished with values: [0.0014170288526923012, 0.00037896776399521303, 0.0009177595686733904] and parameters: {'n_layers': 2, 'embedding_dim': 256, 'lr': 0.03603955087652466, 'lambda_val': 0.012725394538693799, 'batch_size': 2341, 'optimizer': 'RMSprop'}.
2026-07-08 17:04:58,746 - optuna.study.study - INFO - Trial 110 finished with values: [0.004920251717382382, 0.0013078661930361114, 0.0032100389100357847] and parameters: {'n_layers': 3, 'embedding_dim': 64, 'lr': 0.0005079724528508135, 'lambda_val': 6.892455337046496e-05, 'batch_size': 2341, 'optimizer': 'RMSprop'}.
2026-07-08 17:06:33,755 - experiment_functions - INFO - Early stopping at epoch 1200. Best Metrics: (0.004153967113465865, 0.0011691962844062838, 0.002793726605801474)
2026-07-08 17:06:33,819 - optuna.study.study - INFO - Trial 111 finished with values: [0.004153967113465865, 0.0011691962844062838, 0.002793726605801474] and parameters: {'n_layers': 2, 'embedding_dim': 64, 'lr': 0.0026199811222762572, 'lambda_val': 4.325919770856533e-05, 'batch_size': 3297, 'optimizer': 'RMSprop'}.
2026-07-08 17:08:19,871 - experiment_functions - INFO - Early stopping at epoch 1400. Best Metrics: (0.004093912598309133, 0.0010960621545124708, 0.0025556989712943495)
2026-07-08 17:08:19,952 - optuna.study.study - INFO - Trial 112 finished with values: [0.004093912598309133, 0.0010960621545124708, 0.0025556989712943495] and parameters: {'n_layers': 2, 'embedding_dim': 32, 'lr': 0.0026199811222762572, 'lambda_val': 4.325919770856533e-05, 'batch_size': 2727, 'optimizer': 'Adam'}.
2026-07-08 17:12:59,058 - experiment_functions - INFO - Early stopping at epoch 3550. Best Metrics: (0.006151448323156147, 0.001640294056189807, 0.003930187119046174)
2026-07-08 17:12:59,151 - optuna.study.study - INFO - Trial 113 finished with values: [0.006151448323156147, 0.001640294056189807, 0.003930187119046174] and parameters: {'n_layers': 3, 'embedding_dim': 64, 'lr': 0.001488688533444762, 'lambda_val': 6.625860010406062e-06, 'batch_size': 1562, 'optimizer': 'Adam'}.
2026-07-08 17:15:07,494 - experiment_functions - INFO - Early stopping at epoch 1350. Best Metrics: (0.0045507129021233805, 0.001271774025036567, 0.002904558875206297)
2026-07-08 17:15:07,586 - optuna.study.study - INFO - Trial 114 finished with values: [0.0045507129021233805, 0.001271774025036567, 0.002904558875206297] and parameters: {'n_layers': 2, 'embedding_dim': 256, 'lr': 0.0020140299216981693, 'lambda_val': 6.625860010406062e-06, 'batch_size': 3461, 'optimizer': 'RMSprop'}.
2026-07-08 17:17:17,287 - experiment_functions - INFO - Early stopping at epoch 1350. Best Metrics: (0.00391856767430965, 0.0010476226658815036, 0.0024582272668683906)
2026-07-08 17:17:17,388 - optuna.study.study - INFO - Trial 115 finished with values: [0.00391856767430965, 0.0010476226658815036, 0.0024582272668683906] and parameters: {'n_layers': 2, 'embedding_dim': 256, 'lr': 0.0020140299216981693, 'lambda_val': 0.0006827192638894672, 'batch_size': 3297, 'optimizer': 'Adam'}.
2026-07-08 17:18:22,345 - experiment_functions - INFO - Early stopping at epoch 750. Best Metrics: (0.0033432317693118177, 0.000899454818304428, 0.002212094210172175)
2026-07-08 17:18:22,441 - optuna.study.study - INFO - Trial 116 finished with values: [0.0033432317693118177, 0.000899454818304428, 0.002212094210172175] and parameters: {'n_layers': 2, 'embedding_dim': 128, 'lr': 0.006297648769451647, 'lambda_val': 6.892455337046496e-05, 'batch_size': 3695, 'optimizer': 'RMSprop'}.
2026-07-08 17:21:05,052 - experiment_functions - INFO - Early stopping at epoch 1800. Best Metrics: (0.006693914536209476, 0.0017941606671352315, 0.004248674113582836)
2026-07-08 17:21:05,163 - optuna.study.study - INFO - Trial 117 finished with values: [0.006693914536209476, 0.0017941606671352315, 0.004248674113582836] and parameters: {'n_layers': 4, 'embedding_dim': 128, 'lr': 0.0013152005063538942, 'lambda_val': 4.325919770856533e-05, 'batch_size': 1562, 'optimizer': 'Adam'}.
2026-07-08 17:21:55,996 - experiment_functions - INFO - Early stopping at epoch 550. Best Metrics: (0.00371272644782482, 0.0010286267879870067, 0.0024427723619220893)
2026-07-08 17:21:56,113 - optuna.study.study - INFO - Trial 118 finished with values: [0.00371272644782482, 0.0010286267879870067, 0.0024427723619220893] and parameters: {'n_layers': 3, 'embedding_dim': 128, 'lr': 0.016511190294346553, 'lambda_val': 3.6408582848345172e-06, 'batch_size': 3688, 'optimizer': 'Adam'}.
2026-07-08 17:23:29,981 - experiment_functions - INFO - Early stopping at epoch 1250. Best Metrics: (0.002851904094766371, 0.0007094960393594592, 0.00177455671862073)
2026-07-08 17:23:30,062 - optuna.study.study - INFO - Trial 119 finished with values: [0.002851904094766371, 0.0007094960393594592, 0.00177455671862073] and parameters: {'n_layers': 1, 'embedding_dim': 32, 'lr': 0.0024216232986666152, 'lambda_val': 0.0071217114816529686, 'batch_size': 1136, 'optimizer': 'RMSprop'}.
2026-07-08 17:24:56,293 - experiment_functions - INFO - Early stopping at epoch 1050. Best Metrics: (0.004459359199349805, 0.0012584769105104191, 0.0028860762758804153)
2026-07-08 17:24:56,387 - optuna.study.study - INFO - Trial 120 finished with values: [0.004459359199349805, 0.0012584769105104191, 0.0028860762758804153] and parameters: {'n_layers': 2, 'embedding_dim': 96, 'lr': 0.0033540795104684273, 'lambda_val': 1.0684413344508431e-05, 'batch_size': 2258, 'optimizer': 'RMSprop'}.
2026-07-08 17:25:58,894 - experiment_functions - INFO - Early stopping at epoch 550. Best Metrics: (0.0034435120929075936, 0.0009241494595672739, 0.0021463370936088207)
2026-07-08 17:25:58,986 - optuna.study.study - INFO - Trial 121 finished with values: [0.0034435120929075936, 0.0009241494595672739, 0.0021463370936088207] and parameters: {'n_layers': 4, 'embedding_dim': 256, 'lr': 0.016511190294346553, 'lambda_val': 0.0008206810021385492, 'batch_size': 587, 'optimizer': 'Adam'}.
2026-07-08 17:30:31,925 - experiment_functions - INFO - Early stopping at epoch 3650. Best Metrics: (0.00295229670347654, 0.0007598351157798758, 0.0018431694685717738)
2026-07-08 17:30:32,013 - optuna.study.study - INFO - Trial 122 finished with values: [0.00295229670347654, 0.0007598351157798758, 0.0018431694685717738] and parameters: {'n_layers': 1, 'embedding_dim': 64, 'lr': 0.0020140299216981693, 'lambda_val': 2.9442593107541877e-05, 'batch_size': 1388, 'optimizer': 'Adam'}.
2026-07-08 17:33:49,941 - experiment_functions - INFO - Early stopping at epoch 2650. Best Metrics: (0.0054455934818984355, 0.001450335277244838, 0.0034706207515712833)
2026-07-08 17:33:50,030 - optuna.study.study - INFO - Trial 123 finished with values: [0.0054455934818984355, 0.001450335277244838, 0.0034706207515712833] and parameters: {'n_layers': 2, 'embedding_dim': 32, 'lr': 0.0026199811222762572, 'lambda_val': 1.3798424398068006e-06, 'batch_size': 891, 'optimizer': 'RMSprop'}.
2026-07-08 17:35:39,703 - experiment_functions - INFO - Early stopping at epoch 1150. Best Metrics: (0.00444222491084887, 0.0012109872157741771, 0.0027980196313479627)
2026-07-08 17:35:39,796 - optuna.study.study - INFO - Trial 124 finished with values: [0.00444222491084887, 0.0012109872157741771, 0.0027980196313479627] and parameters: {'n_layers': 2, 'embedding_dim': 256, 'lr': 0.002634796822286242, 'lambda_val': 5.207268504744844e-05, 'batch_size': 1964, 'optimizer': 'RMSprop'}.
2026-07-08 17:36:52,454 - experiment_functions - INFO - Early stopping at epoch 650. Best Metrics: (0.004952698820749334, 0.0013990464069296967, 0.0032165994038686843)
2026-07-08 17:36:52,555 - optuna.study.study - INFO - Trial 125 finished with values: [0.004952698820749334, 0.0013990464069296967, 0.0032165994038686843] and parameters: {'n_layers': 4, 'embedding_dim': 256, 'lr': 0.003328720631447993, 'lambda_val': 6.52656868894088e-06, 'batch_size': 2258, 'optimizer': 'RMSprop'}.
2026-07-08 17:40:30,481 - experiment_functions - INFO - Early stopping at epoch 2750. Best Metrics: (0.00029880310610595783, 7.123454210436335e-05, 0.00016525595597247637)
2026-07-08 17:40:30,568 - optuna.study.study - INFO - Trial 126 finished with values: [0.00029880310610595783, 7.123454210436335e-05, 0.00016525595597247637] and parameters: {'n_layers': 2, 'embedding_dim': 96, 'lr': 5.1566808379483104e-05, 'lambda_val': 4.325919770856533e-05, 'batch_size': 2727, 'optimizer': 'Adam'}.
2026-07-08 17:41:34,688 - experiment_functions - INFO - Early stopping at epoch 800. Best Metrics: (0.004966576895026431, 0.0013961970252455217, 0.0031876338483881987)
2026-07-08 17:41:34,810 - optuna.study.study - INFO - Trial 127 finished with values: [0.004966576895026431, 0.0013961970252455217, 0.0031876338483881987] and parameters: {'n_layers': 4, 'embedding_dim': 32, 'lr': 0.003328720631447993, 'lambda_val': 0.0008206810021385492, 'batch_size': 2191, 'optimizer': 'Adam'}.
2026-07-08 17:44:05,389 - experiment_functions - INFO - Early stopping at epoch 1800. Best Metrics: (0.005659911563621101, 0.0015263187888228257, 0.0036861250664200975)
2026-07-08 17:44:05,485 - optuna.study.study - INFO - Trial 128 finished with values: [0.005659911563621101, 0.0015263187888228257, 0.0036861250664200975] and parameters: {'n_layers': 3, 'embedding_dim': 96, 'lr': 0.0016459794241324855, 'lambda_val': 8.982642030344512e-06, 'batch_size': 2341, 'optimizer': 'Adam'}.
2026-07-08 17:44:58,454 - experiment_functions - INFO - Early stopping at epoch 600. Best Metrics: (0.0028694168525481827, 0.0008481659479892863, 0.0019179188406868767)
2026-07-08 17:44:58,547 - optuna.study.study - INFO - Trial 129 finished with values: [0.0028694168525481827, 0.0008481659479892863, 0.0019179188406868767] and parameters: {'n_layers': 3, 'embedding_dim': 96, 'lr': 0.003328720631447993, 'lambda_val': 0.009907083646107878, 'batch_size': 2191, 'optimizer': 'RMSprop'}.
2026-07-08 17:45:46,264 - experiment_functions - INFO - Early stopping at epoch 600. Best Metrics: (0.0018616079346868626, 0.0004786961229413218, 0.0011669100970968958)
2026-07-08 17:45:46,351 - optuna.study.study - INFO - Trial 130 finished with values: [0.0018616079346868626, 0.0004786961229413218, 0.0011669100970968958] and parameters: {'n_layers': 1, 'embedding_dim': 32, 'lr': 0.019047571127829455, 'lambda_val': 3.0374075566562216e-06, 'batch_size': 2727, 'optimizer': 'Adam'}.
2026-07-08 17:50:52,961 - optuna.study.study - INFO - Trial 131 finished with values: [0.0051876134182384185, 0.0012793723761943658, 0.0034159626556366286] and parameters: {'n_layers': 2, 'embedding_dim': 64, 'lr': 0.0009859128880233146, 'lambda_val': 1.0684413344508431e-05, 'batch_size': 1388, 'optimizer': 'RMSprop'}.
2026-07-08 17:55:59,229 - optuna.study.study - INFO - Trial 132 finished with values: [0.0018337657032787718, 0.00044545333662595216, 0.0012383904395552015] and parameters: {'n_layers': 1, 'embedding_dim': 96, 'lr': 0.0004475125719004404, 'lambda_val': 2.1792866157824918e-05, 'batch_size': 3077, 'optimizer': 'RMSprop'}.
2026-07-08 18:01:13,651 - optuna.study.study - INFO - Trial 133 finished with values: [0.004826827270814236, 0.0012356818570370231, 0.002927903723249909] and parameters: {'n_layers': 3, 'embedding_dim': 64, 'lr': 0.0005079724528508135, 'lambda_val': 1.3039147191760127e-05, 'batch_size': 3350, 'optimizer': 'Adam'}.
2026-07-08 18:02:47,385 - experiment_functions - INFO - Early stopping at epoch 900. Best Metrics: (0.0027494561336844684, 0.0008063750166213932, 0.001837297049875763)
2026-07-08 18:02:47,473 - optuna.study.study - INFO - Trial 134 finished with values: [0.0027494561336844684, 0.0008063750166213932, 0.001837297049875763] and parameters: {'n_layers': 3, 'embedding_dim': 256, 'lr': 0.0026199811222762572, 'lambda_val': 0.026231052260673512, 'batch_size': 1388, 'optimizer': 'Adam'}.
2026-07-08 18:03:46,755 - experiment_functions - INFO - Early stopping at epoch 550. Best Metrics: (0.0036059857173401434, 0.0010105807039872347, 0.0023363457526280117)
2026-07-08 18:03:46,848 - optuna.study.study - INFO - Trial 135 finished with values: [0.0036059857173401434, 0.0010105807039872347, 0.0023363457526280117] and parameters: {'n_layers': 3, 'embedding_dim': 256, 'lr': 0.019047571127829455, 'lambda_val': 2.620125710300901e-06, 'batch_size': 2781, 'optimizer': 'Adam'}.
2026-07-08 18:05:52,453 - experiment_functions - INFO - Early stopping at epoch 1550. Best Metrics: (0.006759664906251944, 0.0018862906749235419, 0.004308705648069916)
2026-07-08 18:05:52,565 - optuna.study.study - INFO - Trial 136 finished with values: [0.006759664906251944, 0.0018862906749235419, 0.004308705648069916] and parameters: {'n_layers': 4, 'embedding_dim': 64, 'lr': 0.0013152005063538942, 'lambda_val': 6.625860010406062e-06, 'batch_size': 2341, 'optimizer': 'RMSprop'}.
2026-07-08 18:10:49,053 - optuna.study.study - INFO - Trial 137 finished with values: [0.002037980615637565, 0.0005698763368349068, 0.0012775957721733904] and parameters: {'n_layers': 1, 'embedding_dim': 64, 'lr': 0.00635566229797604, 'lambda_val': 0.0071217114816529686, 'batch_size': 2781, 'optimizer': 'Adam'}.
2026-07-08 18:11:56,426 - experiment_functions - INFO - Early stopping at epoch 600. Best Metrics: (0.004761819239483537, 0.0013126151625097355, 0.0031065415437332424)
2026-07-08 18:11:56,528 - optuna.study.study - INFO - Trial 138 finished with values: [0.004761819239483537, 0.0013126151625097355, 0.0031065415437332424] and parameters: {'n_layers': 4, 'embedding_dim': 256, 'lr': 0.003328720631447993, 'lambda_val': 4.325919770856533e-05, 'batch_size': 3285, 'optimizer': 'RMSprop'}.
2026-07-08 18:13:38,652 - experiment_functions - INFO - Early stopping at epoch 1350. Best Metrics: (0.004069505744467842, 0.0010438234903026044, 0.002548279021165361)
