2026-07-01 05:40:06,911 - optuna.study.study - INFO - Trial 167 finished with values: [0.0023395036513344947, 0.0006772030469388143, 0.0015884519854119528] and parameters: {'n_layers': 4, 'embedding_dim': 96, 'lr': 0.0006152603091001123, 'lambda_val': 1.9470910869906704e-05, 'batch_size': 3344, 'optimizer': 'Adam'}.
2026-07-01 05:41:19,166 - experiment_functions - INFO - Early stopping at epoch 850. Best Metrics: (0.002163559457037704, 0.000624014588834223, 0.0015012885301093617)
2026-07-01 05:41:19,295 - optuna.study.study - INFO - Trial 168 finished with values: [0.002163559457037704, 0.000624014588834223, 0.0015012885301093617] and parameters: {'n_layers': 3, 'embedding_dim': 96, 'lr': 0.0016405237668077803, 'lambda_val': 0.002718086981783345, 'batch_size': 2475, 'optimizer': 'RMSprop'}.
2026-07-01 05:44:43,184 - experiment_functions - INFO - Early stopping at epoch 2300. Best Metrics: (0.0024638920801342535, 0.0007009478943069354, 0.001641612230052932)
2026-07-01 05:44:43,275 - optuna.study.study - INFO - Trial 169 finished with values: [0.0024638920801342535, 0.0007009478943069354, 0.001641612230052932] and parameters: {'n_layers': 4, 'embedding_dim': 128, 'lr': 0.0010455025017472735, 'lambda_val': 4.9195072317508555e-06, 'batch_size': 3304, 'optimizer': 'Adam'}.
2026-07-01 05:46:07,954 - experiment_functions - INFO - Early stopping at epoch 1050. Best Metrics: (0.0026746855084863455, 0.0006923997492544119, 0.0017790044913926803)
2026-07-01 05:46:08,038 - optuna.study.study - INFO - Trial 170 finished with values: [0.0026746855084863455, 0.0006923997492544119, 0.0017790044913926803] and parameters: {'n_layers': 3, 'embedding_dim': 64, 'lr': 0.001557510643925403, 'lambda_val': 0.001439719660074157, 'batch_size': 1544, 'optimizer': 'RMSprop'}.
2026-07-01 05:49:36,865 - experiment_functions - INFO - Early stopping at epoch 2500. Best Metrics: (0.0002303187780511801, 5.413825199931615e-05, 0.0001180586911195777)
2026-07-01 05:49:36,937 - optuna.study.study - INFO - Trial 171 finished with values: [0.0002303187780511801, 5.413825199931615e-05, 0.0001180586911195777] and parameters: {'n_layers': 4, 'embedding_dim': 96, 'lr': 2.280276729332137e-05, 'lambda_val': 4.9195072317508555e-06, 'batch_size': 2940, 'optimizer': 'RMSprop'}.
2026-07-01 05:51:34,354 - experiment_functions - INFO - Early stopping at epoch 1100. Best Metrics: (0.0025199047947646867, 0.0007512869707273522, 0.0016923326979096718)
2026-07-01 05:51:34,419 - optuna.study.study - INFO - Trial 172 finished with values: [0.0025199047947646867, 0.0007512869707273522, 0.0016923326979096718] and parameters: {'n_layers': 4, 'embedding_dim': 256, 'lr': 0.0016405237668077803, 'lambda_val': 2.17039496761906e-05, 'batch_size': 3660, 'optimizer': 'RMSprop'}.
2026-07-01 05:52:55,040 - experiment_functions - INFO - Early stopping at epoch 1000. Best Metrics: (0.002396745633137156, 0.000630663146097297, 0.0016347905109526384)
2026-07-01 05:52:55,125 - optuna.study.study - INFO - Trial 173 finished with values: [0.002396745633137156, 0.000630663146097297, 0.0016347905109526384] and parameters: {'n_layers': 3, 'embedding_dim': 64, 'lr': 0.001557510643925403, 'lambda_val': 0.0011842577394473573, 'batch_size': 2607, 'optimizer': 'RMSprop'}.
2026-07-01 05:56:05,538 - experiment_functions - INFO - Early stopping at epoch 2150. Best Metrics: (0.002578664699700651, 0.0007256425355697814, 0.0016960489268665062)
2026-07-01 05:56:05,626 - optuna.study.study - INFO - Trial 174 finished with values: [0.002578664699700651, 0.0007256425355697814, 0.0016960489268665062] and parameters: {'n_layers': 4, 'embedding_dim': 128, 'lr': 0.0006773858234142329, 'lambda_val': 4.134172720235837e-06, 'batch_size': 3304, 'optimizer': 'Adam'}.
2026-07-01 05:57:56,422 - experiment_functions - INFO - Early stopping at epoch 1450. Best Metrics: (0.0026259045634311915, 0.0006999981004122107, 0.001719882642108743)
2026-07-01 05:57:56,491 - optuna.study.study - INFO - Trial 175 finished with values: [0.0026259045634311915, 0.0006999981004122107, 0.001719882642108743] and parameters: {'n_layers': 3, 'embedding_dim': 32, 'lr': 0.0017746907712049957, 'lambda_val': 1.3421969689673777e-05, 'batch_size': 2839, 'optimizer': 'RMSprop'}.
2026-07-01 05:59:20,552 - experiment_functions - INFO - Early stopping at epoch 1000. Best Metrics: (0.0023117463372312633, 0.0006648557263073913, 0.0016057727731641424)
2026-07-01 05:59:20,635 - optuna.study.study - INFO - Trial 176 finished with values: [0.0023117463372312633, 0.0006648557263073913, 0.0016057727731641424] and parameters: {'n_layers': 3, 'embedding_dim': 96, 'lr': 0.0027303142774942266, 'lambda_val': 4.889129207716808e-06, 'batch_size': 2839, 'optimizer': 'RMSprop'}.
2026-07-01 06:04:49,156 - experiment_functions - INFO - Early stopping at epoch 3950. Best Metrics: (0.003381280548859272, 0.0009345971924092473, 0.0022527850000971152)
2026-07-01 06:04:49,240 - optuna.study.study - INFO - Trial 177 finished with values: [0.003381280548859272, 0.0009345971924092473, 0.0022527850000971152] and parameters: {'n_layers': 4, 'embedding_dim': 96, 'lr': 0.0006773858234142329, 'lambda_val': 1.343770739040948e-05, 'batch_size': 1203, 'optimizer': 'RMSprop'}.
2026-07-01 06:08:34,736 - experiment_functions - INFO - Early stopping at epoch 2650. Best Metrics: (0.002379489908186599, 0.0006420606728339951, 0.001597952153668159)
2026-07-01 06:08:34,828 - optuna.study.study - INFO - Trial 178 finished with values: [0.002379489908186599, 0.0006420606728339951, 0.001597952153668159] and parameters: {'n_layers': 3, 'embedding_dim': 128, 'lr': 0.0010455025017472735, 'lambda_val': 1.3421969689673777e-05, 'batch_size': 3005, 'optimizer': 'Adam'}.
2026-07-01 06:11:57,078 - experiment_functions - INFO - Early stopping at epoch 2300. Best Metrics: (0.0031405817253352866, 0.0009013544060938776, 0.0021105050458846888)
2026-07-01 06:11:57,172 - optuna.study.study - INFO - Trial 179 finished with values: [0.0031405817253352866, 0.0009013544060938776, 0.0021105050458846888] and parameters: {'n_layers': 4, 'embedding_dim': 128, 'lr': 0.0010455025017472735, 'lambda_val': 4.9195072317508555e-06, 'batch_size': 1581, 'optimizer': 'RMSprop'}.
2026-07-01 06:16:03,136 - experiment_functions - INFO - Early stopping at epoch 3350. Best Metrics: (0.002527468942286577, 0.0006202154132553235, 0.001700467898717062)
2026-07-01 06:16:03,226 - optuna.study.study - INFO - Trial 180 finished with values: [0.002527468942286577, 0.0006202154132553235, 0.001700467898717062] and parameters: {'n_layers': 2, 'embedding_dim': 32, 'lr': 0.0016405237668077803, 'lambda_val': 0.00011682518010112995, 'batch_size': 868, 'optimizer': 'RMSprop'}.
2026-07-01 06:17:41,195 - experiment_functions - INFO - Early stopping at epoch 1200. Best Metrics: (0.0024830275158422713, 0.0007436886195695534, 0.0017326771208462037)
2026-07-01 06:17:41,278 - optuna.study.study - INFO - Trial 181 finished with values: [0.0024830275158422713, 0.0007436886195695534, 0.0017326771208462037] and parameters: {'n_layers': 4, 'embedding_dim': 64, 'lr': 0.002835761631416988, 'lambda_val': 1.3573657888080551e-06, 'batch_size': 3342, 'optimizer': 'RMSprop'}.
2026-07-01 06:23:13,416 - optuna.study.study - INFO - Trial 182 finished with values: [0.002331045288286123, 0.0006439602606234449, 0.0016105162287814302] and parameters: {'n_layers': 4, 'embedding_dim': 96, 'lr': 0.00039452895313047835, 'lambda_val': 1.9470910869906704e-05, 'batch_size': 3344, 'optimizer': 'RMSprop'}.
2026-07-01 06:24:02,856 - experiment_functions - INFO - Early stopping at epoch 550. Best Metrics: (0.0018732906498558969, 0.0005337841688353627, 0.0013019309246969522)
2026-07-01 06:24:02,941 - optuna.study.study - INFO - Trial 183 finished with values: [0.0018732906498558969, 0.0005337841688353627, 0.0013019309246969522] and parameters: {'n_layers': 4, 'embedding_dim': 96, 'lr': 0.021488705418931445, 'lambda_val': 0.00022111146363119937, 'batch_size': 1265, 'optimizer': 'Adam'}.
2026-07-01 06:24:56,623 - experiment_functions - INFO - Early stopping at epoch 600. Best Metrics: (0.002062626616726936, 0.0006202154132553236, 0.0013776419196772213)
2026-07-01 06:24:56,700 - optuna.study.study - INFO - Trial 184 finished with values: [0.002062626616726936, 0.0006202154132553236, 0.0013776419196772213] and parameters: {'n_layers': 4, 'embedding_dim': 96, 'lr': 0.0042511247911092235, 'lambda_val': 0.003195386254489329, 'batch_size': 2688, 'optimizer': 'RMSprop'}.
2026-07-01 06:27:36,704 - experiment_functions - INFO - Early stopping at epoch 1900. Best Metrics: (0.002394774792263889, 0.0006942993370438616, 0.001625277599484458)
2026-07-01 06:27:36,838 - optuna.study.study - INFO - Trial 185 finished with values: [0.002394774792263889, 0.0006942993370438616, 0.001625277599484458] and parameters: {'n_layers': 4, 'embedding_dim': 96, 'lr': 0.0006152603091001123, 'lambda_val': 0.003195386254489329, 'batch_size': 2475, 'optimizer': 'RMSprop'}.
2026-07-01 06:33:08,914 - optuna.study.study - INFO - Trial 186 finished with values: [0.002297375871587417, 0.0006439602606234447, 0.0015200823734363243] and parameters: {'n_layers': 4, 'embedding_dim': 96, 'lr': 0.00039452895313047835, 'lambda_val': 0.00022111146363119937, 'batch_size': 2475, 'optimizer': 'RMSprop'}.
2026-07-01 06:38:31,147 - optuna.study.study - INFO - Trial 187 finished with values: [0.0031312686164255026, 0.0008690614136732329, 0.0020654997309760247] and parameters: {'n_layers': 3, 'embedding_dim': 96, 'lr': 0.0010455025017472735, 'lambda_val': 0.00011682518010112995, 'batch_size': 526, 'optimizer': 'RMSprop'}.
2026-07-01 06:42:44,116 - experiment_functions - INFO - Early stopping at epoch 3000. Best Metrics: (0.0031388770569406163, 0.0009004046121991531, 0.002120072323958004)
2026-07-01 06:42:44,190 - optuna.study.study - INFO - Trial 188 finished with values: [0.0031388770569406163, 0.0009004046121991531, 0.002120072323958004] and parameters: {'n_layers': 3, 'embedding_dim': 128, 'lr': 0.001557510643925403, 'lambda_val': 4.186926040366856e-06, 'batch_size': 977, 'optimizer': 'RMSprop'}.
2026-07-01 06:43:50,938 - experiment_functions - INFO - Early stopping at epoch 800. Best Metrics: (0.0026491845763750633, 0.0007598351157798758, 0.0018254773684396421)
2026-07-01 06:43:51,019 - optuna.study.study - INFO - Trial 189 finished with values: [0.0026491845763750633, 0.0007598351157798758, 0.0018254773684396421] and parameters: {'n_layers': 4, 'embedding_dim': 64, 'lr': 0.0027189191366266373, 'lambda_val': 0.0001729300632177007, 'batch_size': 2839, 'optimizer': 'RMSprop'}.
2026-07-01 06:48:30,452 - experiment_functions - INFO - Early stopping at epoch 3450. Best Metrics: (0.002788621755545429, 0.0007864293448321716, 0.0018819856125314683)
2026-07-01 06:48:30,538 - optuna.study.study - INFO - Trial 190 finished with values: [0.002788621755545429, 0.0007864293448321716, 0.0018819856125314683] and parameters: {'n_layers': 3, 'embedding_dim': 96, 'lr': 0.0010455025017472735, 'lambda_val': 4.9195072317508555e-06, 'batch_size': 2839, 'optimizer': 'RMSprop'}.
2026-07-01 06:50:00,599 - experiment_functions - INFO - Early stopping at epoch 950. Best Metrics: (0.0019171998718866057, 0.000549930665045685, 0.0012954482579968223)
2026-07-01 06:50:00,686 - optuna.study.study - INFO - Trial 191 finished with values: [0.0019171998718866057, 0.000549930665045685, 0.0012954482579968223] and parameters: {'n_layers': 2, 'embedding_dim': 256, 'lr': 0.0038652724378170286, 'lambda_val': 2.17039496761906e-05, 'batch_size': 3660, 'optimizer': 'RMSprop'}.
2026-07-01 06:52:02,138 - experiment_functions - INFO - Early stopping at epoch 1200. Best Metrics: (0.0022750447314363346, 0.0006648557263073913, 0.0015407958169504081)
2026-07-01 06:52:02,213 - optuna.study.study - INFO - Trial 192 finished with values: [0.0022750447314363346, 0.0006648557263073913, 0.0015407958169504081] and parameters: {'n_layers': 3, 'embedding_dim': 256, 'lr': 0.0017202674480021566, 'lambda_val': 0.0002170393924492861, 'batch_size': 3304, 'optimizer': 'Adam'}.
2026-07-01 06:53:06,178 - experiment_functions - INFO - Early stopping at epoch 750. Best Metrics: (0.002166532197851124, 0.0006097676804133503, 0.0015003229805559777)
2026-07-01 06:53:06,275 - optuna.study.study - INFO - Trial 193 finished with values: [0.002166532197851124, 0.0006097676804133503, 0.0015003229805559777] and parameters: {'n_layers': 3, 'embedding_dim': 96, 'lr': 0.0016405237668077803, 'lambda_val': 0.002718086981783345, 'batch_size': 2839, 'optimizer': 'RMSprop'}.
2026-07-01 06:56:10,344 - experiment_functions - INFO - Early stopping at epoch 2300. Best Metrics: (0.002546580344003018, 0.0007284919172539559, 0.001704157123499333)
2026-07-01 06:56:10,427 - optuna.study.study - INFO - Trial 194 finished with values: [0.002546580344003018, 0.0007284919172539559, 0.001704157123499333] and parameters: {'n_layers': 4, 'embedding_dim': 64, 'lr': 0.0011423999744800083, 'lambda_val': 1.9470910869906704e-05, 'batch_size': 3005, 'optimizer': 'Adam'}.
2026-07-01 06:59:06,194 - experiment_functions - INFO - Early stopping at epoch 2300. Best Metrics: (0.0016570961345581119, 0.00044260395494177764, 0.0011393404389445593)
2026-07-01 06:59:06,288 - optuna.study.study - INFO - Trial 195 finished with values: [0.0016570961345581119, 0.00044260395494177764, 0.0011393404389445593] and parameters: {'n_layers': 2, 'embedding_dim': 64, 'lr': 0.0006943898292817254, 'lambda_val': 0.002718086981783345, 'batch_size': 3295, 'optimizer': 'RMSprop'}.
2026-07-01 07:00:08,410 - experiment_functions - INFO - Early stopping at epoch 800. Best Metrics: (0.0017662754848415479, 0.0004549512755732006, 0.0011444088185098014)
2026-07-01 07:00:08,503 - optuna.study.study - INFO - Trial 196 finished with values: [0.0017662754848415479, 0.0004549512755732006, 0.0011444088185098014] and parameters: {'n_layers': 2, 'embedding_dim': 32, 'lr': 0.005034910940629331, 'lambda_val': 4.461595733760336e-06, 'batch_size': 2607, 'optimizer': 'RMSprop'}.
2026-07-01 07:05:42,283 - optuna.study.study - INFO - Trial 197 finished with values: [0.002344578185897108, 0.0006876507797807876, 0.001592774201190317] and parameters: {'n_layers': 4, 'embedding_dim': 96, 'lr': 0.0006152603091001123, 'lambda_val': 0.00022467171684366154, 'batch_size': 3304, 'optimizer': 'Adam'}.
2026-07-01 07:06:25,325 - experiment_functions - INFO - Early stopping at epoch 500. Best Metrics: (0.0001486180907206064, 4.274072526261801e-05, 8.476911912194579e-05)
2026-07-01 07:06:25,414 - optuna.study.study - INFO - Trial 198 finished with values: [0.0001486180907206064, 4.274072526261801e-05, 8.476911912194579e-05] and parameters: {'n_layers': 4, 'embedding_dim': 64, 'lr': 0.005034910940629331, 'lambda_val': 0.012502922659404926, 'batch_size': 2607, 'optimizer': 'SGD'}.
2026-07-01 07:07:31,144 - experiment_functions - INFO - Early stopping at epoch 750. Best Metrics: (0.0023446149742590125, 0.0006781528408335392, 0.0015989593539739065)
2026-07-01 07:07:31,232 - optuna.study.study - INFO - Trial 199 finished with values: [0.0023446149742590125, 0.0006781528408335392, 0.0015989593539739065] and parameters: {'n_layers': 4, 'embedding_dim': 96, 'lr': 0.0016405237668077803, 'lambda_val': 0.003195386254489329, 'batch_size': 2475, 'optimizer': 'RMSprop'}.
2026-07-01 07:12:35,597 - optuna.study.study - INFO - Trial 200 finished with values: [0.0021312053440563743, 0.0004900936496780199, 0.001320359266118468] and parameters: {'n_layers': 1, 'embedding_dim': 96, 'lr': 0.0006152603091001123, 'lambda_val': 1.9470910869906704e-05, 'batch_size': 3344, 'optimizer': 'RMSprop'}.
2026-07-01 07:13:18,272 - experiment_functions - INFO - Early stopping at epoch 500. Best Metrics: (0.00022239894176585482, 5.508804589404098e-05, 0.00012454164010381374)
2026-07-01 07:13:18,362 - optuna.study.study - INFO - Trial 201 finished with values: [0.00022239894176585482, 5.508804589404098e-05, 0.00012454164010381374] and parameters: {'n_layers': 4, 'embedding_dim': 64, 'lr': 0.0027189191366266373, 'lambda_val': 1.7083313201931035e-06, 'batch_size': 2839, 'optimizer': 'SGD'}.
2026-07-01 07:20:11,023 - optuna.study.study - INFO - Trial 202 finished with values: [0.003183218109036302, 0.0009061033755675018, 0.0021431456720694096] and parameters: {'n_layers': 4, 'embedding_dim': 256, 'lr': 0.0006943898292817254, 'lambda_val': 1.343770739040948e-05, 'batch_size': 1358, 'optimizer': 'RMSprop'}.
2026-07-01 07:25:22,416 - optuna.study.study - INFO - Trial 203 finished with values: [0.0005230697364818542, 0.00015861558041904906, 0.0003724934763164522] and parameters: {'n_layers': 2, 'embedding_dim': 96, 'lr': 0.00039452895313047835, 'lambda_val': 0.04812690059184524, 'batch_size': 1581, 'optimizer': 'RMSprop'}.
2026-07-01 07:27:57,589 - experiment_functions - INFO - Early stopping at epoch 1750. Best Metrics: (0.0026425603698495338, 0.0007541363524115268, 0.0017830582323682166)
2026-07-01 07:27:57,684 - optuna.study.study - INFO - Trial 204 finished with values: [0.0026425603698495338, 0.0007541363524115268, 0.0017830582323682166] and parameters: {'n_layers': 4, 'embedding_dim': 128, 'lr': 0.0008921739854607602, 'lambda_val': 0.0017791379537564294, 'batch_size': 1581, 'optimizer': 'Adam'}.
2026-07-01 07:30:38,119 - experiment_functions - INFO - Early stopping at epoch 2000. Best Metrics: (0.0029105924414090773, 0.0008671618258837833, 0.0020042635056962397)
2026-07-01 07:30:38,210 - optuna.study.study - INFO - Trial 205 finished with values: [0.0029105924414090773, 0.0008671618258837833, 0.0020042635056962397] and parameters: {'n_layers': 4, 'embedding_dim': 64, 'lr': 0.0011663890806018467, 'lambda_val': 4.9195072317508555e-06, 'batch_size': 3342, 'optimizer': 'RMSprop'}.
2026-07-01 07:35:47,734 - optuna.study.study - INFO - Trial 206 finished with values: [0.0029746095897539107, 0.000807324810516118, 0.0019948122390602563] and parameters: {'n_layers': 3, 'embedding_dim': 64, 'lr': 0.0008921739854607602, 'lambda_val': 0.00011682518010112995, 'batch_size': 977, 'optimizer': 'RMSprop'}.
2026-07-01 07:40:47,340 - optuna.study.study - INFO - Trial 207 finished with values: [0.002456936330529543, 0.0006401610850445454, 0.0016659657253847205] and parameters: {'n_layers': 4, 'embedding_dim': 32, 'lr': 0.0006943898292817254, 'lambda_val': 0.00011682518010112995, 'batch_size': 1203, 'optimizer': 'RMSprop'}.
2026-07-01 07:41:29,221 - experiment_functions - INFO - Early stopping at epoch 500. Best Metrics: (0.00023836097531425133, 5.698763368349069e-05, 0.00012886025581906413)
2026-07-01 07:41:29,292 - optuna.study.study - INFO - Trial 208 finished with values: [0.00023836097531425133, 5.698763368349069e-05, 0.00012886025581906413] and parameters: {'n_layers': 3, 'embedding_dim': 64, 'lr': 2.8436828731527233e-05, 'lambda_val': 4.9195072317508555e-06, 'batch_size': 1544, 'optimizer': 'RMSprop'}.
2026-07-01 07:44:43,810 - experiment_functions - INFO - Early stopping at epoch 2500. Best Metrics: (0.0032019437691373346, 0.0008681116197785081, 0.0020832229020130975)
2026-07-01 07:44:43,887 - optuna.study.study - INFO - Trial 209 finished with values: [0.0032019437691373346, 0.0008681116197785081, 0.0020832229020130975] and parameters: {'n_layers': 3, 'embedding_dim': 64, 'lr': 0.001557510643925403, 'lambda_val': 0.00011682518010112995, 'batch_size': 977, 'optimizer': 'RMSprop'}.
2026-07-01 07:47:40,657 - experiment_functions - INFO - Early stopping at epoch 2000. Best Metrics: (0.0030994184416359614, 0.0008719107953574074, 0.0020580859448092004)
2026-07-01 07:47:40,750 - optuna.study.study - INFO - Trial 210 finished with values: [0.0030994184416359614, 0.0008719107953574074, 0.0020580859448092004] and parameters: {'n_layers': 4, 'embedding_dim': 128, 'lr': 0.0010455025017472735, 'lambda_val': 4.9195072317508555e-06, 'batch_size': 2475, 'optimizer': 'RMSprop'}.
2026-07-01 07:52:46,525 - experiment_functions - INFO - Early stopping at epoch 2950. Best Metrics: (0.0030315747010175886, 0.0008890070854624547, 0.002123730872617639)
2026-07-01 07:52:46,614 - optuna.study.study - INFO - Trial 211 finished with values: [0.0030315747010175886, 0.0008890070854624547, 0.002123730872617639] and parameters: {'n_layers': 4, 'embedding_dim': 256, 'lr': 0.0006773858234142329, 'lambda_val': 1.343770739040948e-05, 'batch_size': 1203, 'optimizer': 'RMSprop'}.
2026-07-01 07:53:30,190 - experiment_functions - INFO - Early stopping at epoch 500. Best Metrics: (0.0002349206049644731, 5.8887221472940384e-05, 0.0001506357029240444)
2026-07-01 07:53:30,285 - optuna.study.study - INFO - Trial 212 finished with values: [0.0002349206049644731, 5.8887221472940384e-05, 0.0001506357029240444] and parameters: {'n_layers': 2, 'embedding_dim': 128, 'lr': 0.0010455025017472735, 'lambda_val': 0.016266406235544602, 'batch_size': 3022, 'optimizer': 'SGD'}.
2026-07-01 07:58:44,579 - optuna.study.study - INFO - Trial 213 finished with values: [0.0019467745221700876, 0.000501491176414718, 0.001420723678492925] and parameters: {'n_layers': 4, 'embedding_dim': 64, 'lr': 0.0006152603091001123, 'lambda_val': 0.003195386254489329, 'batch_size': 517, 'optimizer': 'RMSprop'}.
2026-07-01 07:59:27,519 - experiment_functions - INFO - Early stopping at epoch 500. Best Metrics: (0.0002346970453889342, 5.128887031514162e-05, 0.00012361773998783063)
2026-07-01 07:59:27,599 - optuna.study.study - INFO - Trial 214 finished with values: [0.0002346970453889342, 5.128887031514162e-05, 0.00012361773998783063] and parameters: {'n_layers': 4, 'embedding_dim': 64, 'lr': 0.0011423999744800083, 'lambda_val': 0.005588113021506967, 'batch_size': 3342, 'optimizer': 'SGD'}.
2026-07-01 08:02:19,643 - experiment_functions - INFO - Early stopping at epoch 1950. Best Metrics: (0.0025253944115805776, 0.0007683832608323994, 0.0017292208318223728)
