2026-07-01 10:09:30,856 - optuna.study.study - INFO - Trial 261 finished with values: [0.0032454788028890517, 0.0008994548183044281, 0.002144897574580895] and parameters: {'n_layers': 4, 'embedding_dim': 128, 'lr': 0.0006943898292817254, 'lambda_val': 1.343770739040948e-05, 'batch_size': 2112, 'optimizer': 'RMSprop'}.
2026-07-01 10:14:46,340 - optuna.study.study - INFO - Trial 262 finished with values: [0.0018235783200011087, 0.00046919818399407333, 0.0012033856648967774] and parameters: {'n_layers': 4, 'embedding_dim': 64, 'lr': 0.00032422282942261304, 'lambda_val': 4.9195072317508555e-06, 'batch_size': 3342, 'optimizer': 'RMSprop'}.
2026-07-01 10:17:28,433 - experiment_functions - INFO - Early stopping at epoch 1900. Best Metrics: (0.0028092385114031676, 0.000771232642516574, 0.0018775552019590302)
2026-07-01 10:17:28,508 - optuna.study.study - INFO - Trial 263 finished with values: [0.0028092385114031676, 0.000771232642516574, 0.0018775552019590302] and parameters: {'n_layers': 3, 'embedding_dim': 128, 'lr': 0.0011423999744800083, 'lambda_val': 4.186926040366856e-06, 'batch_size': 3342, 'optimizer': 'RMSprop'}.
2026-07-01 10:18:13,127 - experiment_functions - INFO - Early stopping at epoch 500. Best Metrics: (0.00023889316396031655, 6.553577873601429e-05, 0.00013606437296428134)
2026-07-01 10:18:13,219 - optuna.study.study - INFO - Trial 264 finished with values: [0.00023889316396031655, 6.553577873601429e-05, 0.00013606437296428134] and parameters: {'n_layers': 4, 'embedding_dim': 96, 'lr': 0.0010455025017472735, 'lambda_val': 4.9195072317508555e-06, 'batch_size': 2475, 'optimizer': 'SGD'}.
2026-07-01 10:21:49,425 - experiment_functions - INFO - Early stopping at epoch 2650. Best Metrics: (0.002685236567030575, 0.0006705544896757405, 0.0017627248947551307)
2026-07-01 10:21:49,516 - optuna.study.study - INFO - Trial 265 finished with values: [0.002685236567030575, 0.0006705544896757405, 0.0017627248947551307] and parameters: {'n_layers': 2, 'embedding_dim': 128, 'lr': 0.0010455025017472735, 'lambda_val': 4.9195072317508555e-06, 'batch_size': 2475, 'optimizer': 'RMSprop'}.
2026-07-01 10:27:07,354 - experiment_functions - INFO - Early stopping at epoch 3650. Best Metrics: (0.0031839637375377632, 0.0008833083220941055, 0.002194384377796334)
2026-07-01 10:27:07,442 - optuna.study.study - INFO - Trial 266 finished with values: [0.0031839637375377632, 0.0008833083220941055, 0.002194384377796334] and parameters: {'n_layers': 4, 'embedding_dim': 128, 'lr': 0.0006773858234142329, 'lambda_val': 1.3573657888080551e-06, 'batch_size': 1203, 'optimizer': 'RMSprop'}.
2026-07-01 10:27:52,591 - experiment_functions - INFO - Early stopping at epoch 500. Best Metrics: (0.00027842083090221013, 6.933495431491368e-05, 0.00014818958250399354)
2026-07-01 10:27:52,673 - optuna.study.study - INFO - Trial 267 finished with values: [0.00027842083090221013, 6.933495431491368e-05, 0.00014818958250399354] and parameters: {'n_layers': 3, 'embedding_dim': 128, 'lr': 2.2053438542553932e-05, 'lambda_val': 4.9195072317508555e-06, 'batch_size': 2214, 'optimizer': 'SGD'}.
2026-07-01 10:32:58,075 - experiment_functions - INFO - Early stopping at epoch 2950. Best Metrics: (0.0030723710796236614, 0.0008833083220941056, 0.0020833130705334387)
2026-07-01 10:32:58,166 - optuna.study.study - INFO - Trial 268 finished with values: [0.0030723710796236614, 0.0008833083220941056, 0.0020833130705334387] and parameters: {'n_layers': 4, 'embedding_dim': 256, 'lr': 0.0006773858234142329, 'lambda_val': 1.343770739040948e-05, 'batch_size': 1203, 'optimizer': 'RMSprop'}.
2026-07-01 10:36:54,806 - experiment_functions - INFO - Early stopping at epoch 2700. Best Metrics: (0.0033454534605848103, 0.0009763881237771404, 0.002259512066563627)
2026-07-01 10:36:54,891 - optuna.study.study - INFO - Trial 269 finished with values: [0.0033454534605848103, 0.0009763881237771404, 0.002259512066563627] and parameters: {'n_layers': 4, 'embedding_dim': 128, 'lr': 0.0008921739854607602, 'lambda_val': 4.134172720235837e-06, 'batch_size': 1581, 'optimizer': 'RMSprop'}.
2026-07-01 10:40:21,887 - experiment_functions - INFO - Early stopping at epoch 2350. Best Metrics: (0.003014232995679411, 0.0008719107953574074, 0.002038883103313302)
2026-07-01 10:40:21,972 - optuna.study.study - INFO - Trial 270 finished with values: [0.003014232995679411, 0.0008719107953574074, 0.002038883103313302] and parameters: {'n_layers': 4, 'embedding_dim': 128, 'lr': 0.0008921739854607602, 'lambda_val': 4.134172720235837e-06, 'batch_size': 3011, 'optimizer': 'RMSprop'}.
2026-07-01 10:45:30,335 - optuna.study.study - INFO - Trial 271 finished with values: [0.0003830092477350114, 0.00010162794673555839, 0.0002296061188912288] and parameters: {'n_layers': 3, 'embedding_dim': 64, 'lr': 0.0001646520081069701, 'lambda_val': 0.008592540162558825, 'batch_size': 1581, 'optimizer': 'RMSprop'}.
2026-07-01 10:51:04,360 - optuna.study.study - INFO - Trial 272 finished with values: [0.0029014115980942486, 0.0008491157418840113, 0.002012302334773384] and parameters: {'n_layers': 4, 'embedding_dim': 96, 'lr': 0.0016405237668077803, 'lambda_val': 4.134172720235837e-06, 'batch_size': 580, 'optimizer': 'Adam'}.
2026-07-01 10:57:57,620 - optuna.study.study - INFO - Trial 273 finished with values: [0.0031486040621563145, 0.0009032539938833275, 0.0021574056490478257] and parameters: {'n_layers': 4, 'embedding_dim': 256, 'lr': 0.0006773858234142329, 'lambda_val': 1.343770739040948e-05, 'batch_size': 1203, 'optimizer': 'RMSprop'}.
2026-07-01 11:00:14,938 - experiment_functions - INFO - Early stopping at epoch 1600. Best Metrics: (0.00268942170043902, 0.0007493873829379025, 0.0017426530342509292)
2026-07-01 11:00:15,026 - optuna.study.study - INFO - Trial 274 finished with values: [0.00268942170043902, 0.0007493873829379025, 0.0017426530342509292] and parameters: {'n_layers': 3, 'embedding_dim': 128, 'lr': 0.0011663890806018467, 'lambda_val': 1.6580882382113483e-05, 'batch_size': 3342, 'optimizer': 'RMSprop'}.
2026-07-01 11:04:34,049 - experiment_functions - INFO - Early stopping at epoch 3350. Best Metrics: (0.002913231731168974, 0.0007826301692532722, 0.001982491601931231)
2026-07-01 11:04:34,124 - optuna.study.study - INFO - Trial 275 finished with values: [0.002913231731168974, 0.0007826301692532722, 0.001982491601931231] and parameters: {'n_layers': 3, 'embedding_dim': 64, 'lr': 0.0010455025017472735, 'lambda_val': 4.9195072317508555e-06, 'batch_size': 1544, 'optimizer': 'RMSprop'}.
2026-07-01 11:07:42,802 - experiment_functions - INFO - Early stopping at epoch 2150. Best Metrics: (0.00027934933130631785, 7.503371768326274e-05, 0.00016360598115195576)
2026-07-01 11:07:42,901 - optuna.study.study - INFO - Trial 276 finished with values: [0.00027934933130631785, 7.503371768326274e-05, 0.00016360598115195576] and parameters: {'n_layers': 4, 'embedding_dim': 128, 'lr': 6.7326677816997e-05, 'lambda_val': 1.6580882382113483e-05, 'batch_size': 2842, 'optimizer': 'RMSprop'}.
2026-07-01 11:09:28,657 - experiment_functions - INFO - Early stopping at epoch 1050. Best Metrics: (0.0025363469442859507, 0.0007066466576752845, 0.0017201441938069569)
2026-07-01 11:09:28,745 - optuna.study.study - INFO - Trial 277 finished with values: [0.0025363469442859507, 0.0007066466576752845, 0.0017201441938069569] and parameters: {'n_layers': 3, 'embedding_dim': 256, 'lr': 0.0016405237668077803, 'lambda_val': 0.00011682518010112995, 'batch_size': 1938, 'optimizer': 'RMSprop'}.
2026-07-01 11:10:18,767 - experiment_functions - INFO - Early stopping at epoch 550. Best Metrics: (0.0019022147537904976, 0.0005242862298881143, 0.0013061814761711026)
2026-07-01 11:10:18,862 - optuna.study.study - INFO - Trial 278 finished with values: [0.0019022147537904976, 0.0005242862298881143, 0.0013061814761711026] and parameters: {'n_layers': 3, 'embedding_dim': 128, 'lr': 0.020051476331021476, 'lambda_val': 4.9195072317508555e-06, 'batch_size': 1544, 'optimizer': 'RMSprop'}.
2026-07-01 11:11:00,922 - experiment_functions - INFO - Early stopping at epoch 500. Best Metrics: (0.0002218262227087788, 5.698763368349067e-05, 0.00011343284512767559)
2026-07-01 11:11:01,030 - optuna.study.study - INFO - Trial 279 finished with values: [0.0002218262227087788, 5.698763368349067e-05, 0.00011343284512767559] and parameters: {'n_layers': 1, 'embedding_dim': 128, 'lr': 0.0006773858234142329, 'lambda_val': 4.9195072317508555e-06, 'batch_size': 2475, 'optimizer': 'SGD'}.
2026-07-01 11:16:01,326 - optuna.study.study - INFO - Trial 280 finished with values: [0.0029457354473603104, 0.0007930779020952455, 0.001986119328297983] and parameters: {'n_layers': 4, 'embedding_dim': 32, 'lr': 0.0008921739854607602, 'lambda_val': 0.00011682518010112995, 'batch_size': 1992, 'optimizer': 'RMSprop'}.
2026-07-01 11:21:17,423 - optuna.study.study - INFO - Trial 281 finished with values: [0.002946279000613617, 0.0008339190395684137, 0.002045575606372765] and parameters: {'n_layers': 4, 'embedding_dim': 64, 'lr': 0.0006943898292817254, 'lambda_val': 1.343770739040948e-05, 'batch_size': 977, 'optimizer': 'RMSprop'}.
2026-07-01 11:23:35,353 - experiment_functions - INFO - Early stopping at epoch 1750. Best Metrics: (0.0027700617899605873, 0.000734190680622305, 0.0018725878390346761)
2026-07-01 11:23:35,443 - optuna.study.study - INFO - Trial 282 finished with values: [0.0027700617899605873, 0.000734190680622305, 0.0018725878390346761] and parameters: {'n_layers': 3, 'embedding_dim': 64, 'lr': 0.0010455025017472735, 'lambda_val': 0.001038386966389063, 'batch_size': 1893, 'optimizer': 'RMSprop'}.
2026-07-01 11:28:30,813 - optuna.study.study - INFO - Trial 283 finished with values: [0.0020797114868909682, 0.0005071899397830671, 0.0013692489265710187] and parameters: {'n_layers': 3, 'embedding_dim': 32, 'lr': 0.0006943898292817254, 'lambda_val': 0.00011682518010112995, 'batch_size': 977, 'optimizer': 'RMSprop'}.
2026-07-01 11:32:37,812 - experiment_functions - INFO - Early stopping at epoch 2950. Best Metrics: (0.0029896232753328323, 0.0008405675968314875, 0.0019666805810333713)
2026-07-01 11:32:37,898 - optuna.study.study - INFO - Trial 284 finished with values: [0.0029896232753328323, 0.0008405675968314875, 0.0019666805810333713] and parameters: {'n_layers': 4, 'embedding_dim': 96, 'lr': 0.0006773858234142329, 'lambda_val': 1.343770739040948e-05, 'batch_size': 3342, 'optimizer': 'RMSprop'}.
2026-07-01 11:33:46,433 - experiment_functions - INFO - Early stopping at epoch 800. Best Metrics: (0.0021425086054019105, 0.0005945709780977529, 0.0014221037715170155)
2026-07-01 11:33:46,519 - optuna.study.study - INFO - Trial 285 finished with values: [0.0021425086054019105, 0.0005945709780977529, 0.0014221037715170155] and parameters: {'n_layers': 3, 'embedding_dim': 96, 'lr': 0.0064950531504085526, 'lambda_val': 3.186188638129305e-06, 'batch_size': 2348, 'optimizer': 'Adam'}.
2026-07-01 11:37:39,407 - experiment_functions - INFO - Early stopping at epoch 2800. Best Metrics: (0.00026140242783204983, 7.21843359990882e-05, 0.00016022426417334478)
2026-07-01 11:37:39,483 - optuna.study.study - INFO - Trial 286 finished with values: [0.00026140242783204983, 7.21843359990882e-05, 0.00016022426417334478] and parameters: {'n_layers': 4, 'embedding_dim': 96, 'lr': 1.1688117784319196e-05, 'lambda_val': 4.134172720235837e-06, 'batch_size': 2475, 'optimizer': 'RMSprop'}.
2026-07-01 11:38:24,775 - experiment_functions - INFO - Early stopping at epoch 500. Best Metrics: (0.00022720693666780973, 5.8887221472940384e-05, 0.00012570053095258528)
2026-07-01 11:38:24,914 - optuna.study.study - INFO - Trial 287 finished with values: [0.00022720693666780973, 5.8887221472940384e-05, 0.00012570053095258528] and parameters: {'n_layers': 3, 'embedding_dim': 128, 'lr': 0.003470032832218879, 'lambda_val': 4.9195072317508555e-06, 'batch_size': 1544, 'optimizer': 'SGD'}.
2026-07-01 11:42:52,465 - experiment_functions - INFO - Early stopping at epoch 3450. Best Metrics: (0.0033147960870154587, 0.0009023041999886024, 0.0021624300106229885)
2026-07-01 11:42:52,553 - optuna.study.study - INFO - Trial 288 finished with values: [0.0033147960870154587, 0.0009023041999886024, 0.0021624300106229885] and parameters: {'n_layers': 3, 'embedding_dim': 64, 'lr': 0.001557510643925403, 'lambda_val': 4.9195072317508555e-06, 'batch_size': 977, 'optimizer': 'RMSprop'}.
2026-07-01 11:43:50,058 - experiment_functions - INFO - Early stopping at epoch 700. Best Metrics: (0.0018559387814914392, 0.0005537298406245846, 0.0012204452989092742)
2026-07-01 11:43:50,145 - optuna.study.study - INFO - Trial 289 finished with values: [0.0018559387814914392, 0.0005537298406245846, 0.0012204452989092742] and parameters: {'n_layers': 3, 'embedding_dim': 64, 'lr': 0.01223073948010036, 'lambda_val': 4.134172720235837e-06, 'batch_size': 1581, 'optimizer': 'RMSprop'}.
2026-07-01 11:47:58,462 - experiment_functions - INFO - Early stopping at epoch 3300. Best Metrics: (0.0022481287395480936, 0.0006259141766236727, 0.0015089968133370668)
2026-07-01 11:47:58,557 - optuna.study.study - INFO - Trial 290 finished with values: [0.0022481287395480936, 0.0006259141766236727, 0.0015089968133370668] and parameters: {'n_layers': 4, 'embedding_dim': 32, 'lr': 0.0011663890806018467, 'lambda_val': 1.5787402268763296e-05, 'batch_size': 3342, 'optimizer': 'Adam'}.
2026-07-01 11:50:06,392 - experiment_functions - INFO - Early stopping at epoch 1700. Best Metrics: (0.00031168539354049996, 7.883289326216212e-05, 0.00018162923989118376)
2026-07-01 11:50:06,471 - optuna.study.study - INFO - Trial 291 finished with values: [0.00031168539354049996, 7.883289326216212e-05, 0.00018162923989118376] and parameters: {'n_layers': 1, 'embedding_dim': 64, 'lr': 0.0001447626014231346, 'lambda_val': 7.473018599488769e-05, 'batch_size': 1475, 'optimizer': 'RMSprop'}.
2026-07-01 11:54:01,520 - experiment_functions - INFO - Early stopping at epoch 2400. Best Metrics: (0.002686149162018736, 0.0007664836730429498, 0.001811309801626389)
2026-07-01 11:54:01,620 - optuna.study.study - INFO - Trial 292 finished with values: [0.002686149162018736, 0.0007664836730429498, 0.001811309801626389] and parameters: {'n_layers': 3, 'embedding_dim': 256, 'lr': 0.0008762749973772559, 'lambda_val': 0.00011682518010112995, 'batch_size': 1487, 'optimizer': 'RMSprop'}.
2026-07-01 11:59:37,260 - optuna.study.study - INFO - Trial 293 finished with values: [0.003184987964055927, 0.0008671618258837832, 0.002151861378491326] and parameters: {'n_layers': 3, 'embedding_dim': 128, 'lr': 0.0010455025017472735, 'lambda_val': 0.00011682518010112995, 'batch_size': 526, 'optimizer': 'RMSprop'}.
2026-07-01 12:04:38,410 - experiment_functions - INFO - Early stopping at epoch 2900. Best Metrics: (0.003142813458759661, 0.0008890070854624547, 0.002041238748932844)
2026-07-01 12:04:38,496 - optuna.study.study - INFO - Trial 294 finished with values: [0.003142813458759661, 0.0008890070854624547, 0.002041238748932844] and parameters: {'n_layers': 4, 'embedding_dim': 256, 'lr': 0.0006943898292817254, 'lambda_val': 0.00011682518010112995, 'batch_size': 1203, 'optimizer': 'RMSprop'}.
2026-07-01 12:09:47,433 - optuna.study.study - INFO - Trial 295 finished with values: [0.002632310168777342, 0.0006439602606234449, 0.0017639579105137159] and parameters: {'n_layers': 3, 'embedding_dim': 64, 'lr': 0.0006773858234142329, 'lambda_val': 0.00035055699517666885, 'batch_size': 1203, 'optimizer': 'RMSprop'}.
2026-07-01 12:12:03,921 - experiment_functions - INFO - Early stopping at epoch 1700. Best Metrics: (0.0029354933661207227, 0.0008092243983055678, 0.001954282706311593)
2026-07-01 12:12:04,261 - optuna.study.study - INFO - Trial 296 finished with values: [0.0029354933661207227, 0.0008092243983055678, 0.001954282706311593] and parameters: {'n_layers': 4, 'embedding_dim': 64, 'lr': 0.0011663890806018467, 'lambda_val': 3.731842014863797e-05, 'batch_size': 3342, 'optimizer': 'RMSprop'}.
2026-07-01 12:14:38,737 - experiment_functions - INFO - Early stopping at epoch 1800. Best Metrics: (0.0027842433218755, 0.0007959272837794199, 0.0019892137370956047)
2026-07-01 12:14:38,832 - optuna.study.study - INFO - Trial 297 finished with values: [0.0027842433218755, 0.0007959272837794199, 0.0019892137370956047] and parameters: {'n_layers': 3, 'embedding_dim': 128, 'lr': 0.001557510643925403, 'lambda_val': 4.186926040366856e-06, 'batch_size': 1544, 'optimizer': 'RMSprop'}.
2026-07-01 12:16:24,737 - experiment_functions - INFO - Early stopping at epoch 1300. Best Metrics: (0.0018443224821394686, 0.0005499306650456851, 0.0012419589090193386)
2026-07-01 12:16:24,832 - optuna.study.study - INFO - Trial 298 finished with values: [0.0018443224821394686, 0.0005499306650456851, 0.0012419589090193386] and parameters: {'n_layers': 4, 'embedding_dim': 64, 'lr': 0.000712747552835163, 'lambda_val': 0.020941160180282962, 'batch_size': 2938, 'optimizer': 'RMSprop'}.
2026-07-01 12:19:40,806 - experiment_functions - INFO - Early stopping at epoch 2300. Best Metrics: (0.0029682052827350405, 0.000850065535778736, 0.0019665253679434034)
2026-07-01 12:19:40,895 - optuna.study.study - INFO - Trial 299 finished with values: [0.0029682052827350405, 0.000850065535778736, 0.0019665253679434034] and parameters: {'n_layers': 3, 'embedding_dim': 128, 'lr': 0.0010455025017472735, 'lambda_val': 4.9195072317508555e-06, 'batch_size': 2475, 'optimizer': 'RMSprop'}.
2026-07-01 12:19:40,911 - root - INFO - Selected Trial 269 based on Max ndcg: 0.0023
2026-07-01 12:19:40,911 - root - INFO - Associated Recall: 0.0033
2026-07-01 12:19:40,911 - experiment_functions - INFO - Training the best model ... for e_amazon_1c1dcs_strict_rand3
2026-07-01 12:23:54,131 - experiment_functions - INFO - Early stopping at epoch 2900. Best Metrics: (0.0033290942137089385, 0.000959291833672093, 0.0022198111997420366)
2026-07-01 12:24:01,113 - root - INFO -   **** Training e_amazon_1c1dcs_strict_rand4
2026-07-01 12:24:01,147 - root - INFO -   **** Getting 88982/2429444 random edges
2026-07-01 12:24:01,333 - optuna.storages._rdb.storage - INFO - A new study created in RDB with name: Study_e_amazon_1c1dcs_strict_rand4
2026-07-01 12:29:00,513 - optuna.study.study - INFO - Trial 0 finished with values: [0.0022467727049524065, 0.0005926713903083032, 0.0014948889043259813] and parameters: {'n_layers': 4, 'embedding_dim': 32, 'lr': 0.0008102278066186573, 'lambda_val': 0.0006778527201004557, 'batch_size': 880, 'optimizer': 'Adam'}.
2026-07-01 12:29:40,345 - experiment_functions - INFO - Early stopping at epoch 500. Best Metrics: (0.00024525517239544324, 6.36361909465646e-05, 0.00014002549826241226)
2026-07-01 12:29:40,447 - optuna.study.study - INFO - Trial 1 finished with values: [0.00024525517239544324, 6.36361909465646e-05, 0.00014002549826241226] and parameters: {'n_layers': 2, 'embedding_dim': 32, 'lr': 1.8672828757172372e-05, 'lambda_val': 2.4079875094150965e-06, 'batch_size': 2228, 'optimizer': 'SGD'}.
2026-07-01 12:32:38,390 - experiment_functions - INFO - Early stopping at epoch 2250. Best Metrics: (0.00027793709188526683, 6.648557263073914e-05, 0.00014272267408816587)
2026-07-01 12:32:38,477 - optuna.study.study - INFO - Trial 2 finished with values: [0.00027793709188526683, 6.648557263073914e-05, 0.00014272267408816587] and parameters: {'n_layers': 2, 'embedding_dim': 96, 'lr': 5.9167605683523374e-05, 'lambda_val': 0.0019223012795244999, 'batch_size': 2065, 'optimizer': 'Adam'}.
2026-07-01 12:34:54,319 - experiment_functions - INFO - Early stopping at epoch 1650. Best Metrics: (0.0012833229683384027, 0.0004236080770472807, 0.0008853474814590877)
2026-07-01 12:34:54,407 - optuna.study.study - INFO - Trial 3 finished with values: [0.0012833229683384027, 0.0004236080770472807, 0.0008853474814590877] and parameters: {'n_layers': 2, 'embedding_dim': 128, 'lr': 0.019644800914724134, 'lambda_val': 0.003411841331736191, 'batch_size': 1441, 'optimizer': 'RMSprop'}.
2026-07-01 12:38:27,091 - experiment_functions - INFO - Early stopping at epoch 2850. Best Metrics: (0.00029910450336074985, 6.933495431491366e-05, 0.00017628223588374173)
2026-07-01 12:38:27,171 - optuna.study.study - INFO - Trial 4 finished with values: [0.00029910450336074985, 6.933495431491366e-05, 0.00017628223588374173] and parameters: {'n_layers': 3, 'embedding_dim': 32, 'lr': 3.11415526677058e-05, 'lambda_val': 0.00010201728542065144, 'batch_size': 3009, 'optimizer': 'Adam'}.
2026-07-01 12:39:36,034 - experiment_functions - INFO - Early stopping at epoch 750. Best Metrics: (0.0018914197050700742, 0.0005366335505195373, 0.001292118033998831)
2026-07-01 12:39:36,130 - optuna.study.study - INFO - Trial 5 finished with values: [0.0018914197050700742, 0.0005366335505195373, 0.001292118033998831] and parameters: {'n_layers': 4, 'embedding_dim': 128, 'lr': 0.021330846186373622, 'lambda_val': 1.413159904245194e-06, 'batch_size': 3604, 'optimizer': 'RMSprop'}.
2026-07-01 12:40:24,421 - experiment_functions - INFO - Early stopping at epoch 500. Best Metrics: (0.00019898942599561167, 6.078680926239006e-05, 0.00011906370856161453)
2026-07-01 12:40:24,511 - optuna.study.study - INFO - Trial 6 finished with values: [0.00019898942599561167, 6.078680926239006e-05, 0.00011906370856161453] and parameters: {'n_layers': 2, 'embedding_dim': 256, 'lr': 0.0002261339481783622, 'lambda_val': 7.5398262624568176e-06, 'batch_size': 1308, 'optimizer': 'SGD'}.
2026-07-01 12:41:10,125 - experiment_functions - INFO - Early stopping at epoch 500. Best Metrics: (0.00023113949813750065, 5.5088045894041e-05, 0.0001242460416080375)
