2026-07-02 05:25:54,239 - optuna.study.study - INFO - Trial 130 finished with values: [0.001268299218416709, 0.0003390764204167696, 0.0008804519130397207] and parameters: {'n_layers': 1, 'embedding_dim': 128, 'lr': 0.03763589357669579, 'lambda_val': 1.6859211427741615e-06, 'batch_size': 1473, 'optimizer': 'RMSprop'}.
2026-07-02 05:26:39,670 - experiment_functions - INFO - Early stopping at epoch 550. Best Metrics: (0.0009436800411357385, 0.0002744904355754801, 0.0006537871173860697)
2026-07-02 05:26:39,810 - optuna.study.study - INFO - Trial 131 finished with values: [0.0009436800411357385, 0.0002744904355754801, 0.0006537871173860697] and parameters: {'n_layers': 1, 'embedding_dim': 96, 'lr': 0.05486910650870985, 'lambda_val': 0.0005538736786267274, 'batch_size': 3462, 'optimizer': 'Adam'}.
2026-07-02 05:28:00,701 - experiment_functions - INFO - Early stopping at epoch 1000. Best Metrics: (0.0013630834307596122, 0.0003495241532587429, 0.0009709423093768699)
2026-07-02 05:28:00,801 - optuna.study.study - INFO - Trial 132 finished with values: [0.0013630834307596122, 0.0003495241532587429, 0.0009709423093768699] and parameters: {'n_layers': 1, 'embedding_dim': 128, 'lr': 0.01321022891213974, 'lambda_val': 0.00010877216929113007, 'batch_size': 1473, 'optimizer': 'Adam'}.
2026-07-02 05:28:47,362 - experiment_functions - INFO - Early stopping at epoch 500. Best Metrics: (0.00024690174575369393, 6.0786809262390055e-05, 0.0001522319929954368)
2026-07-02 05:28:47,443 - optuna.study.study - INFO - Trial 133 finished with values: [0.00024690174575369393, 6.0786809262390055e-05, 0.0001522319929954368] and parameters: {'n_layers': 4, 'embedding_dim': 128, 'lr': 0.056177353679575485, 'lambda_val': 0.0030987592849129864, 'batch_size': 3749, 'optimizer': 'SGD'}.
2026-07-02 05:30:05,087 - experiment_functions - INFO - Early stopping at epoch 950. Best Metrics: (0.0012793832766145262, 0.0004122105503105825, 0.0008462864565298923)
2026-07-02 05:30:05,195 - optuna.study.study - INFO - Trial 134 finished with values: [0.0012793832766145262, 0.0004122105503105825, 0.0008462864565298923] and parameters: {'n_layers': 2, 'embedding_dim': 96, 'lr': 0.0029910676555346106, 'lambda_val': 0.0823868703803942, 'batch_size': 3462, 'optimizer': 'RMSprop'}.
2026-07-02 05:30:47,137 - experiment_functions - INFO - Early stopping at epoch 500. Best Metrics: (0.00023527228922438212, 6.36361909465646e-05, 0.00012042464322071707)
2026-07-02 05:30:47,233 - optuna.study.study - INFO - Trial 135 finished with values: [0.00023527228922438212, 6.36361909465646e-05, 0.00012042464322071707] and parameters: {'n_layers': 1, 'embedding_dim': 128, 'lr': 0.003175598950751376, 'lambda_val': 0.01586888242047408, 'batch_size': 918, 'optimizer': 'SGD'}.
2026-07-02 05:31:41,750 - experiment_functions - INFO - Early stopping at epoch 650. Best Metrics: (0.001524395872210363, 0.00036662044336379014, 0.0009909768198915426)
2026-07-02 05:31:41,844 - optuna.study.study - INFO - Trial 136 finished with values: [0.001524395872210363, 0.00036662044336379014, 0.0009909768198915426] and parameters: {'n_layers': 1, 'embedding_dim': 128, 'lr': 0.01321022891213974, 'lambda_val': 0.00010877216929113007, 'batch_size': 3842, 'optimizer': 'Adam'}.
2026-07-02 05:32:31,919 - experiment_functions - INFO - Early stopping at epoch 600. Best Metrics: (0.0015365090827181062, 0.00036946982504796466, 0.0010703199094728563)
2026-07-02 05:32:32,051 - optuna.study.study - INFO - Trial 137 finished with values: [0.0015365090827181062, 0.00036946982504796466, 0.0010703199094728563] and parameters: {'n_layers': 1, 'embedding_dim': 128, 'lr': 0.014582350289404945, 'lambda_val': 2.5958738722362203e-05, 'batch_size': 2610, 'optimizer': 'RMSprop'}.
2026-07-02 05:34:57,200 - experiment_functions - INFO - Early stopping at epoch 1900. Best Metrics: (0.0002535089338829322, 6.458598484128944e-05, 0.00014367082891626344)
2026-07-02 05:34:57,275 - optuna.study.study - INFO - Trial 138 finished with values: [0.0002535089338829322, 6.458598484128944e-05, 0.00014367082891626344] and parameters: {'n_layers': 1, 'embedding_dim': 96, 'lr': 1.550561994530287e-05, 'lambda_val': 1.0477656620736208e-06, 'batch_size': 1093, 'optimizer': 'RMSprop'}.
2026-07-02 05:35:47,178 - experiment_functions - INFO - Early stopping at epoch 550. Best Metrics: (0.0015563877525941482, 0.00047964591683604665, 0.0010974476667476576)
2026-07-02 05:35:47,258 - optuna.study.study - INFO - Trial 139 finished with values: [0.0015563877525941482, 0.00047964591683604665, 0.0010974476667476576] and parameters: {'n_layers': 3, 'embedding_dim': 128, 'lr': 0.004562468343132884, 'lambda_val': 0.008265752694310466, 'batch_size': 2880, 'optimizer': 'RMSprop'}.
2026-07-02 05:41:35,815 - optuna.study.study - INFO - Trial 140 finished with values: [0.0018243010487765106, 0.0004758467412571472, 0.0012664165819239168] and parameters: {'n_layers': 4, 'embedding_dim': 128, 'lr': 0.0002889968108070523, 'lambda_val': 1.5990539279825177e-06, 'batch_size': 3027, 'optimizer': 'Adam'}.
2026-07-02 05:42:52,278 - experiment_functions - INFO - Early stopping at epoch 950. Best Metrics: (0.0016304076000684409, 0.0004995915886252683, 0.001183927059006302)
2026-07-02 05:42:52,360 - optuna.study.study - INFO - Trial 141 finished with values: [0.0016304076000684409, 0.0004995915886252683, 0.001183927059006302] and parameters: {'n_layers': 3, 'embedding_dim': 64, 'lr': 0.0014374939555211086, 'lambda_val': 0.00857156187814291, 'batch_size': 2754, 'optimizer': 'RMSprop'}.
2026-07-02 05:45:49,393 - experiment_functions - INFO - Early stopping at epoch 2250. Best Metrics: (0.0012387070070446057, 0.00039701384799498515, 0.0008544906209210189)
2026-07-02 05:45:49,469 - optuna.study.study - INFO - Trial 142 finished with values: [0.0012387070070446057, 0.00039701384799498515, 0.0008544906209210189] and parameters: {'n_layers': 2, 'embedding_dim': 96, 'lr': 0.002399062123093389, 'lambda_val': 0.08701027942844691, 'batch_size': 1093, 'optimizer': 'RMSprop'}.
2026-07-02 05:46:40,878 - experiment_functions - INFO - Early stopping at epoch 550. Best Metrics: (0.0014558091751094094, 0.0004264574587314553, 0.0010126286830629875)
2026-07-02 05:46:41,006 - optuna.study.study - INFO - Trial 143 finished with values: [0.0014558091751094094, 0.0004264574587314553, 0.0010126286830629875] and parameters: {'n_layers': 4, 'embedding_dim': 128, 'lr': 0.07137537182714382, 'lambda_val': 0.00010877216929113007, 'batch_size': 539, 'optimizer': 'Adam'}.
2026-07-02 05:49:18,694 - experiment_functions - INFO - Early stopping at epoch 1700. Best Metrics: (0.0011726787837514916, 0.0004093611686264081, 0.0008040830033668934)
2026-07-02 05:49:18,771 - optuna.study.study - INFO - Trial 144 finished with values: [0.0011726787837514916, 0.0004093611686264081, 0.0008040830033668934] and parameters: {'n_layers': 2, 'embedding_dim': 256, 'lr': 0.07137537182714382, 'lambda_val': 0.008265752694310466, 'batch_size': 2880, 'optimizer': 'Adam'}.
2026-07-02 05:54:10,703 - experiment_functions - INFO - Early stopping at epoch 3750. Best Metrics: (0.0002222537190585185, 6.458598484128944e-05, 0.00011194039058637785)
2026-07-02 05:54:10,793 - optuna.study.study - INFO - Trial 145 finished with values: [0.0002222537190585185, 6.458598484128944e-05, 0.00011194039058637785] and parameters: {'n_layers': 4, 'embedding_dim': 64, 'lr': 1.6084672644418857e-05, 'lambda_val': 1.5990539279825177e-06, 'batch_size': 3842, 'optimizer': 'RMSprop'}.
2026-07-02 05:55:03,638 - experiment_functions - INFO - Early stopping at epoch 500. Best Metrics: (0.0007336863882455167, 0.00019375795452386833, 0.0005440869550281351)
2026-07-02 05:55:03,734 - optuna.study.study - INFO - Trial 146 finished with values: [0.0007336863882455167, 0.00019375795452386833, 0.0005440869550281351] and parameters: {'n_layers': 3, 'embedding_dim': 256, 'lr': 0.06613475956745304, 'lambda_val': 0.0132654287745143, 'batch_size': 2600, 'optimizer': 'Adam'}.
2026-07-02 05:55:45,605 - experiment_functions - INFO - Early stopping at epoch 500. Best Metrics: (0.0008874530084776954, 0.00022320156526033853, 0.000670017154256533)
2026-07-02 05:55:45,675 - optuna.study.study - INFO - Trial 147 finished with values: [0.0008874530084776954, 0.00022320156526033853, 0.000670017154256533] and parameters: {'n_layers': 3, 'embedding_dim': 64, 'lr': 0.060351600967047295, 'lambda_val': 0.0005770865766618662, 'batch_size': 2610, 'optimizer': 'RMSprop'}.
2026-07-02 05:56:30,608 - experiment_functions - INFO - Early stopping at epoch 550. Best Metrics: (0.0014585071152337739, 0.0004093611686264081, 0.00096698785644295)
2026-07-02 05:56:30,710 - optuna.study.study - INFO - Trial 148 finished with values: [0.0014585071152337739, 0.0004093611686264081, 0.00096698785644295] and parameters: {'n_layers': 4, 'embedding_dim': 32, 'lr': 0.042094421390589304, 'lambda_val': 0.00010877216929113007, 'batch_size': 2092, 'optimizer': 'Adam'}.
2026-07-02 05:58:24,075 - experiment_functions - INFO - Early stopping at epoch 1450. Best Metrics: (0.001740008434738047, 0.00043405580988925405, 0.0011550395884179453)
2026-07-02 05:58:24,158 - optuna.study.study - INFO - Trial 149 finished with values: [0.001740008434738047, 0.00043405580988925405, 0.0011550395884179453] and parameters: {'n_layers': 1, 'embedding_dim': 96, 'lr': 0.005014370880052961, 'lambda_val': 4.554302389333304e-06, 'batch_size': 4067, 'optimizer': 'Adam'}.
2026-07-02 05:59:36,439 - experiment_functions - INFO - Early stopping at epoch 900. Best Metrics: (0.0011259870352508718, 0.0003789677639952131, 0.0007944091006864967)
2026-07-02 05:59:36,508 - optuna.study.study - INFO - Trial 150 finished with values: [0.0011259870352508718, 0.0003789677639952131, 0.0007944091006864967] and parameters: {'n_layers': 3, 'embedding_dim': 64, 'lr': 0.014582350289404945, 'lambda_val': 0.011243822747952163, 'batch_size': 3798, 'optimizer': 'RMSprop'}.
2026-07-02 06:00:33,839 - experiment_functions - INFO - Early stopping at epoch 550. Best Metrics: (0.0011307916001391401, 0.00034572497767984344, 0.0008366393089633151)
2026-07-02 06:00:33,928 - optuna.study.study - INFO - Trial 151 finished with values: [0.0011307916001391401, 0.00034572497767984344, 0.0008366393089633151] and parameters: {'n_layers': 3, 'embedding_dim': 256, 'lr': 0.056177353679575485, 'lambda_val': 0.0008946216390413014, 'batch_size': 3798, 'optimizer': 'Adam'}.
2026-07-02 06:01:23,317 - experiment_functions - INFO - Early stopping at epoch 550. Best Metrics: (0.0010088113415454368, 0.0003229299242064472, 0.000750503282319726)
2026-07-02 06:01:23,732 - optuna.study.study - INFO - Trial 152 finished with values: [0.0010088113415454368, 0.0003229299242064472, 0.000750503282319726] and parameters: {'n_layers': 4, 'embedding_dim': 96, 'lr': 0.014582350289404945, 'lambda_val': 0.04115908335664114, 'batch_size': 3308, 'optimizer': 'Adam'}.
2026-07-02 06:02:09,189 - experiment_functions - INFO - Early stopping at epoch 500. Best Metrics: (0.00029158412627960153, 6.553577873601429e-05, 0.0001390156546139328)
2026-07-02 06:02:10,070 - optuna.study.study - INFO - Trial 153 finished with values: [0.00029158412627960153, 6.553577873601429e-05, 0.0001390156546139328] and parameters: {'n_layers': 4, 'embedding_dim': 96, 'lr': 0.023233384256700264, 'lambda_val': 1.8310592897560325e-05, 'batch_size': 3308, 'optimizer': 'SGD'}.
2026-07-02 06:02:51,998 - experiment_functions - INFO - Early stopping at epoch 500. Best Metrics: (0.00020634482017125178, 5.128887031514161e-05, 0.0001051065413846496)
2026-07-02 06:02:52,134 - optuna.study.study - INFO - Trial 154 finished with values: [0.00020634482017125178, 5.128887031514161e-05, 0.0001051065413846496] and parameters: {'n_layers': 3, 'embedding_dim': 64, 'lr': 0.056177353679575485, 'lambda_val': 2.5958738722362203e-05, 'batch_size': 3798, 'optimizer': 'SGD'}.
2026-07-02 06:03:37,298 - experiment_functions - INFO - Early stopping at epoch 550. Best Metrics: (0.001136365889204423, 0.0003305282753642459, 0.0008332727391992503)
2026-07-02 06:03:37,393 - optuna.study.study - INFO - Trial 155 finished with values: [0.001136365889204423, 0.0003305282753642459, 0.0008332727391992503] and parameters: {'n_layers': 1, 'embedding_dim': 96, 'lr': 0.01568431932038665, 'lambda_val': 0.00024499244831156216, 'batch_size': 3462, 'optimizer': 'RMSprop'}.
2026-07-02 06:04:28,787 - experiment_functions - INFO - Early stopping at epoch 550. Best Metrics: (0.0017332301861554987, 0.0005328343749406379, 0.0012093289471842702)
2026-07-02 06:04:28,926 - optuna.study.study - INFO - Trial 156 finished with values: [0.0017332301861554987, 0.0005328343749406379, 0.0012093289471842702] and parameters: {'n_layers': 4, 'embedding_dim': 128, 'lr': 0.003175598950751376, 'lambda_val': 0.012091641495900276, 'batch_size': 2754, 'optimizer': 'RMSprop'}.
2026-07-02 06:09:40,007 - experiment_functions - INFO - Early stopping at epoch 3850. Best Metrics: (0.0023427944171431777, 0.000666755314096841, 0.0016569816895294995)
2026-07-02 06:09:40,121 - optuna.study.study - INFO - Trial 157 finished with values: [0.0023427944171431777, 0.000666755314096841, 0.0016569816895294995] and parameters: {'n_layers': 2, 'embedding_dim': 128, 'lr': 0.0009577271711573342, 'lambda_val': 1.3509843414861852e-06, 'batch_size': 3470, 'optimizer': 'RMSprop'}.
2026-07-02 06:10:31,813 - experiment_functions - INFO - Early stopping at epoch 550. Best Metrics: (0.0020291130164095308, 0.0005907718025188535, 0.0013643109552056855)
2026-07-02 06:10:31,891 - optuna.study.study - INFO - Trial 158 finished with values: [0.0020291130164095308, 0.0005907718025188535, 0.0013643109552056855] and parameters: {'n_layers': 4, 'embedding_dim': 128, 'lr': 0.014582350289404945, 'lambda_val': 0.00010877216929113007, 'batch_size': 3749, 'optimizer': 'Adam'}.
2026-07-02 06:11:20,757 - experiment_functions - INFO - Early stopping at epoch 550. Best Metrics: (0.001827817362276163, 0.0005309347871511882, 0.0012625986639178645)
2026-07-02 06:11:20,835 - optuna.study.study - INFO - Trial 159 finished with values: [0.001827817362276163, 0.0005309347871511882, 0.0012625986639178645] and parameters: {'n_layers': 4, 'embedding_dim': 96, 'lr': 0.01321022891213974, 'lambda_val': 0.00010877216929113007, 'batch_size': 3798, 'optimizer': 'RMSprop'}.
2026-07-02 06:12:17,831 - experiment_functions - INFO - Early stopping at epoch 550. Best Metrics: (0.0014754742173750345, 0.00046729859620462365, 0.0010664176101799446)
2026-07-02 06:12:17,902 - optuna.study.study - INFO - Trial 160 finished with values: [0.0014754742173750345, 0.00046729859620462365, 0.0010664176101799446] and parameters: {'n_layers': 3, 'embedding_dim': 256, 'lr': 0.014582350289404945, 'lambda_val': 0.0006325039773618912, 'batch_size': 2610, 'optimizer': 'RMSprop'}.
2026-07-02 06:13:14,004 - experiment_functions - INFO - Early stopping at epoch 600. Best Metrics: (0.001641536432438932, 0.0005005413825199932, 0.0011340521542715799)
2026-07-02 06:13:14,105 - optuna.study.study - INFO - Trial 161 finished with values: [0.001641536432438932, 0.0005005413825199932, 0.0011340521542715799] and parameters: {'n_layers': 4, 'embedding_dim': 128, 'lr': 0.005014370880052961, 'lambda_val': 0.011356721163774775, 'batch_size': 2490, 'optimizer': 'Adam'}.
2026-07-02 06:15:58,224 - experiment_functions - INFO - Early stopping at epoch 2150. Best Metrics: (0.0012958818945929165, 0.0004084113747316832, 0.0009255669197600884)
2026-07-02 06:15:59,310 - optuna.study.study - INFO - Trial 162 finished with values: [0.0012958818945929165, 0.0004084113747316832, 0.0009255669197600884] and parameters: {'n_layers': 1, 'embedding_dim': 96, 'lr': 0.0028258902906977677, 'lambda_val': 0.00644136210147127, 'batch_size': 3308, 'optimizer': 'RMSprop'}.
2026-07-02 06:22:52,706 - optuna.study.study - INFO - Trial 163 finished with values: [0.001984285138218007, 0.0005385331383089871, 0.0013400602503181433] and parameters: {'n_layers': 4, 'embedding_dim': 256, 'lr': 0.00042777516068918454, 'lambda_val': 2.188289071859108e-05, 'batch_size': 1036, 'optimizer': 'Adam'}.
2026-07-02 06:28:41,407 - optuna.study.study - INFO - Trial 164 finished with values: [0.002390943982854225, 0.0007056968637805596, 0.0016430041885144814] and parameters: {'n_layers': 4, 'embedding_dim': 128, 'lr': 0.0005462517735220497, 'lambda_val': 0.00010877216929113007, 'batch_size': 3871, 'optimizer': 'Adam'}.
2026-07-02 06:33:37,349 - optuna.study.study - INFO - Trial 165 finished with values: [0.0016464504872659757, 0.00042170848925783105, 0.0010712452965636063] and parameters: {'n_layers': 1, 'embedding_dim': 64, 'lr': 0.0005054275041431983, 'lambda_val': 0.00010877216929113007, 'batch_size': 2519, 'optimizer': 'RMSprop'}.
2026-07-02 06:34:32,676 - experiment_functions - INFO - Early stopping at epoch 650. Best Metrics: (0.0019657451377516687, 0.0005233364359933895, 0.0012670745807302165)
2026-07-02 06:34:32,759 - optuna.study.study - INFO - Trial 166 finished with values: [0.0019657451377516687, 0.0005233364359933895, 0.0012670745807302165] and parameters: {'n_layers': 4, 'embedding_dim': 64, 'lr': 0.014582350289404945, 'lambda_val': 1.8310592897560325e-05, 'batch_size': 3308, 'optimizer': 'Adam'}.
2026-07-02 06:39:34,018 - optuna.study.study - INFO - Trial 167 finished with values: [0.001944762958849828, 0.00046919818399407333, 0.0012629350876317664] and parameters: {'n_layers': 2, 'embedding_dim': 64, 'lr': 0.0005054275041431983, 'lambda_val': 1.3509843414861852e-06, 'batch_size': 2519, 'optimizer': 'RMSprop'}.
2026-07-02 06:42:05,565 - experiment_functions - INFO - Early stopping at epoch 1950. Best Metrics: (0.00028008118389727545, 5.8887221472940384e-05, 0.00014796869732619427)
2026-07-02 06:42:05,650 - optuna.study.study - INFO - Trial 168 finished with values: [0.00028008118389727545, 5.8887221472940384e-05, 0.00014796869732619427] and parameters: {'n_layers': 3, 'embedding_dim': 64, 'lr': 2.2104561091514654e-05, 'lambda_val': 1.8310592897560325e-05, 'batch_size': 3308, 'optimizer': 'RMSprop'}.
2026-07-02 06:42:57,003 - experiment_functions - INFO - Early stopping at epoch 550. Best Metrics: (0.0017768614383622762, 0.0005356837566248124, 0.0012838207899004475)
2026-07-02 06:42:57,170 - optuna.study.study - INFO - Trial 169 finished with values: [0.0017768614383622762, 0.0005356837566248124, 0.0012838207899004475] and parameters: {'n_layers': 4, 'embedding_dim': 128, 'lr': 0.014582350289404945, 'lambda_val': 0.00017208742502229977, 'batch_size': 1889, 'optimizer': 'RMSprop'}.
2026-07-02 06:43:43,303 - experiment_functions - INFO - Early stopping at epoch 550. Best Metrics: (0.0016717847639321662, 0.0004597002450468249, 0.0011421998690940977)
2026-07-02 06:43:43,392 - optuna.study.study - INFO - Trial 170 finished with values: [0.0016717847639321662, 0.0004597002450468249, 0.0011421998690940977] and parameters: {'n_layers': 3, 'embedding_dim': 64, 'lr': 0.01321022891213974, 'lambda_val': 0.00010877216929113007, 'batch_size': 3749, 'optimizer': 'RMSprop'}.
2026-07-02 06:44:53,917 - experiment_functions - INFO - Early stopping at epoch 850. Best Metrics: (0.002489562513452466, 0.0006933495431491368, 0.0017180056512396088)
2026-07-02 06:44:54,087 - optuna.study.study - INFO - Trial 171 finished with values: [0.002489562513452466, 0.0006933495431491368, 0.0017180056512396088] and parameters: {'n_layers': 4, 'embedding_dim': 64, 'lr': 0.004152271479480873, 'lambda_val': 0.00013041816739515328, 'batch_size': 1473, 'optimizer': 'Adam'}.
2026-07-02 06:45:41,312 - experiment_functions - INFO - Early stopping at epoch 550. Best Metrics: (0.0011508418473591506, 0.0003143817791539236, 0.0008326775755734397)
2026-07-02 06:45:42,392 - optuna.study.study - INFO - Trial 172 finished with values: [0.0011508418473591506, 0.0003143817791539236, 0.0008326775755734397] and parameters: {'n_layers': 1, 'embedding_dim': 128, 'lr': 0.014582350289404945, 'lambda_val': 0.00010877216929113007, 'batch_size': 3308, 'optimizer': 'RMSprop'}.
2026-07-02 06:47:00,696 - experiment_functions - INFO - Early stopping at epoch 1000. Best Metrics: (0.002258428337134076, 0.000629713352202572, 0.0015794207230258187)
2026-07-02 06:47:00,780 - optuna.study.study - INFO - Trial 173 finished with values: [0.002258428337134076, 0.000629713352202572, 0.0015794207230258187] and parameters: {'n_layers': 4, 'embedding_dim': 32, 'lr': 0.003175598950751376, 'lambda_val': 0.00010858880627123378, 'batch_size': 2403, 'optimizer': 'RMSprop'}.
2026-07-02 06:47:47,080 - experiment_functions - INFO - Early stopping at epoch 550. Best Metrics: (0.0011614735396810359, 0.0002820887867332789, 0.0007160443045970026)
2026-07-02 06:47:47,187 - optuna.study.study - INFO - Trial 174 finished with values: [0.0011614735396810359, 0.0002820887867332789, 0.0007160443045970026] and parameters: {'n_layers': 1, 'embedding_dim': 128, 'lr': 0.06668313223783916, 'lambda_val': 9.238843538868996e-06, 'batch_size': 3308, 'optimizer': 'RMSprop'}.
2026-07-02 06:49:33,021 - experiment_functions - INFO - Early stopping at epoch 1350. Best Metrics: (0.0012788724591000567, 0.000428357046520905, 0.000933743392864157)
2026-07-02 06:49:33,530 - optuna.study.study - INFO - Trial 175 finished with values: [0.0012788724591000567, 0.000428357046520905, 0.000933743392864157] and parameters: {'n_layers': 1, 'embedding_dim': 96, 'lr': 0.01321022891213974, 'lambda_val': 0.00644136210147127, 'batch_size': 3621, 'optimizer': 'Adam'}.
2026-07-02 06:52:35,395 - experiment_functions - INFO - Early stopping at epoch 2150. Best Metrics: (0.003036324875450399, 0.0008510153296734609, 0.002058444747814419)
