2026-07-08 06:46:14,007 - optuna.study.study - INFO - Trial 111 finished with values: [0.0032778612658301664, 0.0011046102995649946, 0.0022847213687520137] and parameters: {'n_layers': 1, 'embedding_dim': 256, 'lr': 0.0002900679124230289, 'lambda_val': 0.003584385278278044, 'batch_size': 1147, 'optimizer': 'RMSprop'}.
2026-07-08 06:51:11,720 - optuna.study.study - INFO - Trial 112 finished with values: [0.002196368997714983, 0.0007417890317801037, 0.0014976019411806485] and parameters: {'n_layers': 1, 'embedding_dim': 64, 'lr': 0.000222035220678721, 'lambda_val': 0.00045919787742064835, 'batch_size': 2380, 'optimizer': 'RMSprop'}.
2026-07-08 06:52:52,253 - experiment_functions - INFO - Early stopping at epoch 1250. Best Metrics: (0.00352486334909431, 0.0012746234067207414, 0.0025115721076966685)
2026-07-08 06:52:52,367 - optuna.study.study - INFO - Trial 113 finished with values: [0.00352486334909431, 0.0012746234067207414, 0.0025115721076966685] and parameters: {'n_layers': 1, 'embedding_dim': 128, 'lr': 0.0009008516306813866, 'lambda_val': 0.0002947495461502324, 'batch_size': 1949, 'optimizer': 'Adam'}.
2026-07-08 06:53:32,762 - experiment_functions - INFO - Early stopping at epoch 500. Best Metrics: (0.0008046333854699699, 0.0002165530079972646, 0.0005037574746700647)
2026-07-08 06:53:33,317 - optuna.study.study - INFO - Trial 114 finished with values: [0.0008046333854699699, 0.0002165530079972646, 0.0005037574746700647] and parameters: {'n_layers': 3, 'embedding_dim': 32, 'lr': 0.07536807567160399, 'lambda_val': 0.0003916704930847683, 'batch_size': 2296, 'optimizer': 'RMSprop'}.
2026-07-08 06:58:14,289 - experiment_functions - INFO - Early stopping at epoch 3650. Best Metrics: (0.0011106504400765444, 0.0007028474820963852, 0.001054778658790989)
2026-07-08 06:58:14,384 - optuna.study.study - INFO - Trial 115 finished with values: [0.0011106504400765444, 0.0007028474820963852, 0.001054778658790989] and parameters: {'n_layers': 1, 'embedding_dim': 128, 'lr': 0.0458702168238454, 'lambda_val': 0.00045919787742064835, 'batch_size': 2380, 'optimizer': 'RMSprop'}.
2026-07-08 07:01:10,827 - experiment_functions - INFO - Early stopping at epoch 2350. Best Metrics: (0.0016108497374885764, 0.0005926713903083032, 0.0010344828255456375)
2026-07-08 07:01:10,962 - optuna.study.study - INFO - Trial 116 finished with values: [0.0016108497374885764, 0.0005926713903083032, 0.0010344828255456375] and parameters: {'n_layers': 3, 'embedding_dim': 32, 'lr': 0.000565645409068954, 'lambda_val': 0.00107672908847346, 'batch_size': 2380, 'optimizer': 'RMSprop'}.
2026-07-08 07:02:12,838 - experiment_functions - INFO - Early stopping at epoch 750. Best Metrics: (0.003000998877040774, 0.001108409475143894, 0.002095452571261144)
2026-07-08 07:02:12,974 - optuna.study.study - INFO - Trial 117 finished with values: [0.003000998877040774, 0.001108409475143894, 0.002095452571261144] and parameters: {'n_layers': 1, 'embedding_dim': 128, 'lr': 0.0011108364748811956, 'lambda_val': 1.684289604060617e-05, 'batch_size': 3456, 'optimizer': 'RMSprop'}.
2026-07-08 07:03:38,772 - experiment_functions - INFO - Early stopping at epoch 1050. Best Metrics: (0.0006308306222810689, 0.0003580722983112665, 0.0005304431140069608)
2026-07-08 07:03:38,858 - optuna.study.study - INFO - Trial 118 finished with values: [0.0006308306222810689, 0.0003580722983112665, 0.0005304431140069608] and parameters: {'n_layers': 4, 'embedding_dim': 64, 'lr': 0.024502316304316978, 'lambda_val': 7.923771221646992e-06, 'batch_size': 3550, 'optimizer': 'Adam'}.
2026-07-08 07:05:42,701 - experiment_functions - INFO - Early stopping at epoch 1600. Best Metrics: (0.002567209219890332, 0.0008424671846209372, 0.0017009320419824534)
2026-07-08 07:05:42,783 - optuna.study.study - INFO - Trial 119 finished with values: [0.002567209219890332, 0.0008424671846209372, 0.0017009320419824534] and parameters: {'n_layers': 2, 'embedding_dim': 64, 'lr': 0.0004683675544444161, 'lambda_val': 1.8566194585261947e-06, 'batch_size': 1897, 'optimizer': 'RMSprop'}.
2026-07-08 07:06:51,039 - experiment_functions - INFO - Early stopping at epoch 800. Best Metrics: (0.00033693985469403405, 0.00014151929031400187, 0.0002443241638938155)
2026-07-08 07:06:51,137 - optuna.study.study - INFO - Trial 120 finished with values: [0.00033693985469403405, 0.00014151929031400187, 0.0002443241638938155] and parameters: {'n_layers': 4, 'embedding_dim': 96, 'lr': 0.0031808570812741697, 'lambda_val': 0.015942655831918742, 'batch_size': 4042, 'optimizer': 'RMSprop'}.
2026-07-08 07:08:22,454 - experiment_functions - INFO - Early stopping at epoch 1150. Best Metrics: (0.0011399222949389826, 0.00041600972588948194, 0.0007272937197296217)
2026-07-08 07:08:22,546 - optuna.study.study - INFO - Trial 121 finished with values: [0.0011399222949389826, 0.00041600972588948194, 0.0007272937197296217] and parameters: {'n_layers': 3, 'embedding_dim': 64, 'lr': 0.0003487064801909266, 'lambda_val': 0.015942655831918742, 'batch_size': 1278, 'optimizer': 'Adam'}.
2026-07-08 07:10:49,291 - experiment_functions - INFO - Early stopping at epoch 1450. Best Metrics: (0.001486739034735025, 0.0005128887031514162, 0.0009953784270505415)
2026-07-08 07:10:49,379 - optuna.study.study - INFO - Trial 122 finished with values: [0.001486739034735025, 0.0005128887031514162, 0.0009953784270505415] and parameters: {'n_layers': 4, 'embedding_dim': 256, 'lr': 0.000222035220678721, 'lambda_val': 0.00045919787742064835, 'batch_size': 2797, 'optimizer': 'RMSprop'}.
2026-07-08 07:11:36,276 - experiment_functions - INFO - Early stopping at epoch 550. Best Metrics: (0.0009645715218528068, 0.00044165416104705285, 0.0007582548633444756)
2026-07-08 07:11:36,357 - optuna.study.study - INFO - Trial 123 finished with values: [0.0009645715218528068, 0.00044165416104705285, 0.0007582548633444756] and parameters: {'n_layers': 2, 'embedding_dim': 96, 'lr': 0.036663509284873615, 'lambda_val': 3.2211675044384433e-06, 'batch_size': 641, 'optimizer': 'Adam'}.
2026-07-08 07:12:35,227 - experiment_functions - INFO - Early stopping at epoch 650. Best Metrics: (0.0002747032731995132, 6.838516042018883e-05, 0.00016999558327103606)
2026-07-08 07:12:35,313 - optuna.study.study - INFO - Trial 124 finished with values: [0.0002747032731995132, 6.838516042018883e-05, 0.00016999558327103606] and parameters: {'n_layers': 1, 'embedding_dim': 256, 'lr': 1.9341112255733904e-05, 'lambda_val': 0.00045919787742064835, 'batch_size': 4042, 'optimizer': 'RMSprop'}.
2026-07-08 07:16:23,041 - experiment_functions - INFO - Early stopping at epoch 3150. Best Metrics: (0.00028099564015790095, 6.648557263073914e-05, 0.0001709317653055983)
2026-07-08 07:16:23,125 - optuna.study.study - INFO - Trial 125 finished with values: [0.00028099564015790095, 6.648557263073914e-05, 0.0001709317653055983] and parameters: {'n_layers': 1, 'embedding_dim': 32, 'lr': 0.00010564931873877367, 'lambda_val': 0.00045919787742064835, 'batch_size': 1930, 'optimizer': 'RMSprop'}.
2026-07-08 07:21:20,558 - optuna.study.study - INFO - Trial 126 finished with values: [0.0013018481523632771, 0.0004112607564158578, 0.0007864464977666668] and parameters: {'n_layers': 4, 'embedding_dim': 32, 'lr': 0.0003799309972702845, 'lambda_val': 2.662133030039408e-05, 'batch_size': 2229, 'optimizer': 'Adam'}.
2026-07-08 07:23:07,815 - experiment_functions - INFO - Early stopping at epoch 1100. Best Metrics: (0.001362433396685713, 0.0005280854054670137, 0.0009225367750319307)
2026-07-08 07:23:07,913 - optuna.study.study - INFO - Trial 127 finished with values: [0.001362433396685713, 0.0005280854054670137, 0.0009225367750319307] and parameters: {'n_layers': 3, 'embedding_dim': 256, 'lr': 0.0002272750442023231, 'lambda_val': 0.003584385278278044, 'batch_size': 3172, 'optimizer': 'RMSprop'}.
2026-07-08 07:24:10,850 - experiment_functions - INFO - Early stopping at epoch 700. Best Metrics: (0.002843936585166013, 0.001059020192618202, 0.0019895124070235617)
2026-07-08 07:24:10,949 - optuna.study.study - INFO - Trial 128 finished with values: [0.002843936585166013, 0.001059020192618202, 0.0019895124070235617] and parameters: {'n_layers': 1, 'embedding_dim': 256, 'lr': 0.0007590336035255057, 'lambda_val': 0.003584385278278044, 'batch_size': 4042, 'optimizer': 'RMSprop'}.
2026-07-08 07:25:04,623 - experiment_functions - INFO - Early stopping at epoch 550. Best Metrics: (0.0021502276084276765, 0.0007626844974640502, 0.0014391161273086454)
2026-07-08 07:25:04,816 - optuna.study.study - INFO - Trial 129 finished with values: [0.0021502276084276765, 0.0007626844974640502, 0.0014391161273086454] and parameters: {'n_layers': 2, 'embedding_dim': 256, 'lr': 0.005183122195502878, 'lambda_val': 2.6914266686102143e-05, 'batch_size': 3218, 'optimizer': 'Adam'}.
2026-07-08 07:31:05,000 - optuna.study.study - INFO - Trial 130 finished with values: [0.0002577154316869094, 8.168227494633666e-05, 0.00016134529241532388] and parameters: {'n_layers': 2, 'embedding_dim': 256, 'lr': 5.1356583391639814e-05, 'lambda_val': 9.401895144659415e-05, 'batch_size': 3918, 'optimizer': 'Adam'}.
2026-07-08 07:31:45,639 - experiment_functions - INFO - Early stopping at epoch 500. Best Metrics: (0.0008300476417927069, 0.00026594229052295657, 0.0005935282519848794)
2026-07-08 07:31:45,734 - optuna.study.study - INFO - Trial 131 finished with values: [0.0008300476417927069, 0.00026594229052295657, 0.0005935282519848794] and parameters: {'n_layers': 3, 'embedding_dim': 32, 'lr': 0.05564512935248532, 'lambda_val': 4.0474983815594535e-05, 'batch_size': 892, 'optimizer': 'RMSprop'}.
2026-07-08 07:33:07,273 - experiment_functions - INFO - Early stopping at epoch 1000. Best Metrics: (0.0012203013363994285, 0.0004549512755732007, 0.0008464454956453988)
2026-07-08 07:33:07,355 - optuna.study.study - INFO - Trial 132 finished with values: [0.0012203013363994285, 0.0004549512755732007, 0.0008464454956453988] and parameters: {'n_layers': 2, 'embedding_dim': 96, 'lr': 0.0003487064801909266, 'lambda_val': 0.015942655831918742, 'batch_size': 4095, 'optimizer': 'Adam'}.
2026-07-08 07:37:59,899 - optuna.study.study - INFO - Trial 133 finished with values: [0.00025957637751760287, 7.788309936743727e-05, 0.00015780138661250178] and parameters: {'n_layers': 2, 'embedding_dim': 32, 'lr': 6.972386647692216e-05, 'lambda_val': 4.0474983815594535e-05, 'batch_size': 2380, 'optimizer': 'Adam'}.
2026-07-08 07:39:46,785 - experiment_functions - INFO - Early stopping at epoch 1400. Best Metrics: (0.0032237550543294815, 0.0010960621545124708, 0.002255209106019124)
2026-07-08 07:39:46,868 - optuna.study.study - INFO - Trial 134 finished with values: [0.0032237550543294815, 0.0010960621545124708, 0.002255209106019124] and parameters: {'n_layers': 1, 'embedding_dim': 64, 'lr': 0.0007398611586122253, 'lambda_val': 1.8566194585261947e-06, 'batch_size': 1930, 'optimizer': 'Adam'}.
2026-07-08 07:41:55,286 - experiment_functions - INFO - Early stopping at epoch 1250. Best Metrics: (0.0018424154440762027, 0.0005689265429401819, 0.0012476793326467702)
2026-07-08 07:41:55,377 - optuna.study.study - INFO - Trial 135 finished with values: [0.0018424154440762027, 0.0005689265429401819, 0.0012476793326467702] and parameters: {'n_layers': 4, 'embedding_dim': 256, 'lr': 0.0003799309972702845, 'lambda_val': 2.662133030039408e-05, 'batch_size': 703, 'optimizer': 'Adam'}.
2026-07-08 07:42:45,657 - experiment_functions - INFO - Early stopping at epoch 550. Best Metrics: (0.0010592195536695162, 0.0004141101381000323, 0.0007996440389564163)
2026-07-08 07:42:45,749 - optuna.study.study - INFO - Trial 136 finished with values: [0.0010592195536695162, 0.0004141101381000323, 0.0007996440389564163] and parameters: {'n_layers': 1, 'embedding_dim': 256, 'lr': 0.02592538525808625, 'lambda_val': 1.3679427856170778e-05, 'batch_size': 3068, 'optimizer': 'RMSprop'}.
2026-07-08 07:48:04,901 - optuna.study.study - INFO - Trial 137 finished with values: [0.0006424175405026159, 0.0002051554812605665, 0.0004088364226669782] and parameters: {'n_layers': 2, 'embedding_dim': 128, 'lr': 7.427341241118983e-05, 'lambda_val': 3.563396940672441e-05, 'batch_size': 3918, 'optimizer': 'RMSprop'}.
2026-07-08 07:52:55,796 - optuna.study.study - INFO - Trial 138 finished with values: [0.0017769514326090184, 0.0005394829322037119, 0.0011235516372726003] and parameters: {'n_layers': 1, 'embedding_dim': 32, 'lr': 0.0002053143028903975, 'lambda_val': 0.00044891351853285386, 'batch_size': 3416, 'optimizer': 'Adam'}.
2026-07-08 07:53:42,407 - experiment_functions - INFO - Early stopping at epoch 500. Best Metrics: (0.00138372744655336, 0.00041980890146838147, 0.0009352719939028326)
2026-07-08 07:53:42,491 - optuna.study.study - INFO - Trial 139 finished with values: [0.00138372744655336, 0.00041980890146838147, 0.0009352719939028326] and parameters: {'n_layers': 4, 'embedding_dim': 128, 'lr': 0.01897326468953457, 'lambda_val': 0.0003916704930847683, 'batch_size': 2296, 'optimizer': 'RMSprop'}.
2026-07-08 07:54:33,137 - experiment_functions - INFO - Early stopping at epoch 600. Best Metrics: (0.002051866870750073, 0.0006734038713599149, 0.0013758589924115572)
2026-07-08 07:54:33,220 - optuna.study.study - INFO - Trial 140 finished with values: [0.002051866870750073, 0.0006734038713599149, 0.0013758589924115572] and parameters: {'n_layers': 2, 'embedding_dim': 96, 'lr': 0.002396901451187955, 'lambda_val': 1.8566194585261947e-06, 'batch_size': 1430, 'optimizer': 'Adam'}.
2026-07-08 07:56:23,864 - experiment_functions - INFO - Early stopping at epoch 1450. Best Metrics: (0.0024787614894400353, 0.0008852079098835553, 0.0018001614366451291)
2026-07-08 07:56:23,972 - optuna.study.study - INFO - Trial 141 finished with values: [0.0024787614894400353, 0.0008852079098835553, 0.0018001614366451291] and parameters: {'n_layers': 1, 'embedding_dim': 64, 'lr': 0.002396901451187955, 'lambda_val': 1.8566194585261947e-06, 'batch_size': 1430, 'optimizer': 'RMSprop'}.
2026-07-08 07:58:04,348 - experiment_functions - INFO - Early stopping at epoch 1250. Best Metrics: (0.001974942868851686, 0.0007132952149383584, 0.0013376170521390196)
2026-07-08 07:58:04,440 - optuna.study.study - INFO - Trial 142 finished with values: [0.001974942868851686, 0.0007132952149383584, 0.0013376170521390196] and parameters: {'n_layers': 2, 'embedding_dim': 96, 'lr': 0.0003487064801909266, 'lambda_val': 0.00045919787742064835, 'batch_size': 4095, 'optimizer': 'Adam'}.
2026-07-08 08:00:01,410 - experiment_functions - INFO - Early stopping at epoch 1200. Best Metrics: (0.0018343911677525518, 0.0006715042835704652, 0.0012766578354353056)
2026-07-08 08:00:01,498 - optuna.study.study - INFO - Trial 143 finished with values: [0.0018343911677525518, 0.0006715042835704652, 0.0012766578354353056] and parameters: {'n_layers': 3, 'embedding_dim': 256, 'lr': 0.0002900679124230289, 'lambda_val': 0.00045919787742064835, 'batch_size': 1478, 'optimizer': 'RMSprop'}.
2026-07-08 08:02:24,385 - experiment_functions - INFO - Early stopping at epoch 1400. Best Metrics: (0.0016821737246390644, 0.0005765248940979808, 0.001135624846903611)
2026-07-08 08:02:24,476 - optuna.study.study - INFO - Trial 144 finished with values: [0.0016821737246390644, 0.0005765248940979808, 0.001135624846903611] and parameters: {'n_layers': 4, 'embedding_dim': 256, 'lr': 0.000222035220678721, 'lambda_val': 0.00045919787742064835, 'batch_size': 2380, 'optimizer': 'RMSprop'}.
2026-07-08 08:03:16,753 - experiment_functions - INFO - Early stopping at epoch 650. Best Metrics: (0.0033011081663087507, 0.0011663469027221095, 0.002398609809149268)
2026-07-08 08:03:16,853 - optuna.study.study - INFO - Trial 145 finished with values: [0.0033011081663087507, 0.0011663469027221095, 0.002398609809149268] and parameters: {'n_layers': 1, 'embedding_dim': 64, 'lr': 0.0031808570812741697, 'lambda_val': 1.783091837418501e-05, 'batch_size': 3820, 'optimizer': 'Adam'}.
2026-07-08 08:04:49,073 - experiment_functions - INFO - Early stopping at epoch 1200. Best Metrics: (0.0033631185686884826, 0.0011834431928271568, 0.0022740773085576445)
2026-07-08 08:04:49,161 - optuna.study.study - INFO - Trial 146 finished with values: [0.0033631185686884826, 0.0011834431928271568, 0.0022740773085576445] and parameters: {'n_layers': 1, 'embedding_dim': 64, 'lr': 0.0013601909806526136, 'lambda_val': 1.8566194585261947e-06, 'batch_size': 1430, 'optimizer': 'Adam'}.
2026-07-08 08:05:32,610 - experiment_functions - INFO - Early stopping at epoch 550. Best Metrics: (0.0005498682559299897, 0.00018426001557661986, 0.0003555121565653165)
2026-07-08 08:05:32,694 - optuna.study.study - INFO - Trial 147 finished with values: [0.0005498682559299897, 0.00018426001557661986, 0.0003555121565653165] and parameters: {'n_layers': 1, 'embedding_dim': 32, 'lr': 0.08630804498596618, 'lambda_val': 1.684289604060617e-05, 'batch_size': 1930, 'optimizer': 'RMSprop'}.
2026-07-08 08:10:51,625 - optuna.study.study - INFO - Trial 148 finished with values: [0.002084894200742833, 0.0006202154132553235, 0.0012993227171714504] and parameters: {'n_layers': 2, 'embedding_dim': 128, 'lr': 0.0001470531785244107, 'lambda_val': 0.003584385278278044, 'batch_size': 1278, 'optimizer': 'RMSprop'}.
2026-07-08 08:11:43,685 - experiment_functions - INFO - Early stopping at epoch 650. Best Metrics: (0.003191970208125405, 0.0011520999943012366, 0.002216508228415152)
2026-07-08 08:11:43,770 - optuna.study.study - INFO - Trial 149 finished with values: [0.003191970208125405, 0.0011520999943012366, 0.002216508228415152] and parameters: {'n_layers': 1, 'embedding_dim': 64, 'lr': 0.0031808570812741697, 'lambda_val': 0.00044891351853285386, 'batch_size': 3820, 'optimizer': 'Adam'}.
2026-07-08 08:12:38,162 - experiment_functions - INFO - Early stopping at epoch 650. Best Metrics: (0.0004024198385931265, 0.00022890032862868756, 0.000325382975991625)
2026-07-08 08:12:38,255 - optuna.study.study - INFO - Trial 150 finished with values: [0.0004024198385931265, 0.00022890032862868756, 0.000325382975991625] and parameters: {'n_layers': 4, 'embedding_dim': 64, 'lr': 0.0031808570812741697, 'lambda_val': 0.00044891351853285386, 'batch_size': 2380, 'optimizer': 'RMSprop'}.
2026-07-08 08:13:43,739 - experiment_functions - INFO - Early stopping at epoch 850. Best Metrics: (0.0032254102752327196, 0.0010305263757764568, 0.002116466163262937)
2026-07-08 08:13:43,835 - optuna.study.study - INFO - Trial 151 finished with values: [0.0032254102752327196, 0.0010305263757764568, 0.002116466163262937] and parameters: {'n_layers': 1, 'embedding_dim': 32, 'lr': 0.0013601909806526136, 'lambda_val': 6.203728084045531e-06, 'batch_size': 3394, 'optimizer': 'Adam'}.
2026-07-08 08:14:24,731 - experiment_functions - INFO - Early stopping at epoch 500. Best Metrics: (0.0001573265879391879, 4.559010694679255e-05, 9.450592451331641e-05)
2026-07-08 08:14:25,760 - optuna.study.study - INFO - Trial 152 finished with values: [0.0001573265879391879, 4.559010694679255e-05, 9.450592451331641e-05] and parameters: {'n_layers': 1, 'embedding_dim': 64, 'lr': 0.0031808570812741697, 'lambda_val': 0.00044891351853285386, 'batch_size': 3416, 'optimizer': 'SGD'}.
2026-07-08 08:15:59,643 - experiment_functions - INFO - Early stopping at epoch 1250. Best Metrics: (0.0023382315061033845, 0.0007142450088330832, 0.001482427700694891)
2026-07-08 08:15:59,753 - optuna.study.study - INFO - Trial 153 finished with values: [0.0023382315061033845, 0.0007142450088330832, 0.001482427700694891] and parameters: {'n_layers': 2, 'embedding_dim': 32, 'lr': 0.000565645409068954, 'lambda_val': 0.00107672908847346, 'batch_size': 1930, 'optimizer': 'Adam'}.
2026-07-08 08:21:35,983 - optuna.study.study - INFO - Trial 154 finished with values: [0.0033231917503205705, 0.0010723173071443498, 0.002289418819789003] and parameters: {'n_layers': 1, 'embedding_dim': 256, 'lr': 0.0002900679124230289, 'lambda_val': 3.4017247985764347e-06, 'batch_size': 1147, 'optimizer': 'RMSprop'}.
2026-07-08 08:24:07,409 - experiment_functions - INFO - Early stopping at epoch 2050. Best Metrics: (0.0030909995430221937, 0.0010067815284083353, 0.001942983933909782)
2026-07-08 08:24:07,501 - optuna.study.study - INFO - Trial 155 finished with values: [0.0030909995430221937, 0.0010067815284083353, 0.001942983933909782] and parameters: {'n_layers': 1, 'embedding_dim': 32, 'lr': 0.000565645409068954, 'lambda_val': 0.013358348953892523, 'batch_size': 1098, 'optimizer': 'Adam'}.
2026-07-08 08:24:47,239 - experiment_functions - INFO - Early stopping at epoch 500. Best Metrics: (0.00025592919228662787, 6.55357787360143e-05, 0.00015228227274563863)
2026-07-08 08:24:48,339 - optuna.study.study - INFO - Trial 156 finished with values: [0.00025592919228662787, 6.55357787360143e-05, 0.00015228227274563863] and parameters: {'n_layers': 1, 'embedding_dim': 32, 'lr': 0.00028288762235460313, 'lambda_val': 1.8566194585261947e-06, 'batch_size': 1430, 'optimizer': 'SGD'}.
2026-07-08 08:25:54,363 - experiment_functions - INFO - Early stopping at epoch 850. Best Metrics: (0.00042959142764793746, 0.00026689208441768136, 0.00041031867517441395)
2026-07-08 08:25:54,455 - optuna.study.study - INFO - Trial 157 finished with values: [0.00042959142764793746, 0.00026689208441768136, 0.00041031867517441395] and parameters: {'n_layers': 2, 'embedding_dim': 32, 'lr': 0.03218424784810326, 'lambda_val': 0.00045919787742064835, 'batch_size': 1299, 'optimizer': 'Adam'}.
2026-07-08 08:26:41,025 - experiment_functions - INFO - Early stopping at epoch 550. Best Metrics: (0.0009525426280472084, 0.0004540014816784758, 0.0007503320094068377)
