2026-07-06 12:12:25,593 - optuna.study.study - INFO - Trial 4 finished with values: [0.004842891594003286, 0.0012926694907205137, 0.0027088288766722503] and parameters: {'n_layers': 3, 'embedding_dim': 64, 'lr': 0.0004638441828593938, 'lambda_val': 0.014042324704312418, 'batch_size': 881, 'optimizer': 'RMSprop'}.
2026-07-06 12:18:40,114 - optuna.study.study - INFO - Trial 5 finished with values: [0.016036227017008794, 0.0035854719525862887, 0.009183487877442883] and parameters: {'n_layers': 3, 'embedding_dim': 128, 'lr': 0.0010707349549773082, 'lambda_val': 1.3821671642527758e-06, 'batch_size': 2134, 'optimizer': 'RMSprop'}.
2026-07-06 12:19:29,734 - experiment_functions - INFO - Early stopping at epoch 500. Best Metrics: (0.00018083525413268436, 4.938928252569192e-05, 0.00010590881100842452)
2026-07-06 12:19:29,831 - optuna.study.study - INFO - Trial 6 finished with values: [0.00018083525413268436, 4.938928252569192e-05, 0.00010590881100842452] and parameters: {'n_layers': 3, 'embedding_dim': 128, 'lr': 2.2353961575801088e-05, 'lambda_val': 0.005577850565436778, 'batch_size': 1399, 'optimizer': 'RMSprop'}.
2026-07-06 12:20:23,954 - experiment_functions - INFO - Early stopping at epoch 550. Best Metrics: (0.002771962071057485, 0.0007294417111486807, 0.0017569742634308719)
2026-07-06 12:20:24,058 - optuna.study.study - INFO - Trial 7 finished with values: [0.002771962071057485, 0.0007294417111486807, 0.0017569742634308719] and parameters: {'n_layers': 1, 'embedding_dim': 256, 'lr': 0.09187492113273477, 'lambda_val': 2.465157645661239e-06, 'batch_size': 3063, 'optimizer': 'Adam'}.
2026-07-06 12:25:30,100 - optuna.study.study - INFO - Trial 8 finished with values: [0.004627832873617602, 0.001217635773037251, 0.002890138252870442] and parameters: {'n_layers': 1, 'embedding_dim': 64, 'lr': 0.0004983510224999149, 'lambda_val': 0.0038206436204871875, 'batch_size': 2771, 'optimizer': 'RMSprop'}.
2026-07-06 12:26:13,733 - experiment_functions - INFO - Early stopping at epoch 500. Best Metrics: (0.00015241276216050107, 5.128887031514162e-05, 9.779354958005611e-05)
2026-07-06 12:26:13,824 - optuna.study.study - INFO - Trial 9 finished with values: [0.00015241276216050107, 5.128887031514162e-05, 9.779354958005611e-05] and parameters: {'n_layers': 1, 'embedding_dim': 128, 'lr': 1.7814783404908316e-05, 'lambda_val': 5.6940479106759095e-05, 'batch_size': 3929, 'optimizer': 'SGD'}.
2026-07-06 12:26:56,594 - experiment_functions - INFO - Early stopping at epoch 500. Best Metrics: (0.00019917697363239345, 5.413825199931615e-05, 0.0001231557289391666)
2026-07-06 12:26:56,675 - optuna.study.study - INFO - Trial 10 finished with values: [0.00019917697363239345, 5.413825199931615e-05, 0.0001231557289391666] and parameters: {'n_layers': 1, 'embedding_dim': 96, 'lr': 0.0011255535780813864, 'lambda_val': 0.0005069434409962794, 'batch_size': 1402, 'optimizer': 'SGD'}.
2026-07-06 12:27:53,801 - experiment_functions - INFO - Early stopping at epoch 650. Best Metrics: (0.0001806277887103345, 5.603783978876584e-05, 0.00010484245178792297)
2026-07-06 12:27:53,897 - optuna.study.study - INFO - Trial 11 finished with values: [0.0001806277887103345, 5.603783978876584e-05, 0.00010484245178792297] and parameters: {'n_layers': 2, 'embedding_dim': 96, 'lr': 1.45296681752437e-05, 'lambda_val': 0.00027601347740795955, 'batch_size': 1305, 'optimizer': 'Adam'}.
2026-07-06 12:29:21,498 - experiment_functions - INFO - Early stopping at epoch 700. Best Metrics: (0.00022452112215876123, 4.9389282525691926e-05, 0.00012266740615369452)
2026-07-06 12:29:21,606 - optuna.study.study - INFO - Trial 12 finished with values: [0.00022452112215876123, 4.9389282525691926e-05, 0.00012266740615369452] and parameters: {'n_layers': 4, 'embedding_dim': 256, 'lr': 0.0685825242579766, 'lambda_val': 0.06400383077034119, 'batch_size': 3285, 'optimizer': 'SGD'}.
2026-07-06 12:34:30,422 - optuna.study.study - INFO - Trial 13 finished with values: [0.013701657995150052, 0.003097277890697719, 0.00769536953042647] and parameters: {'n_layers': 2, 'embedding_dim': 32, 'lr': 0.004800543051042116, 'lambda_val': 3.765712134740546e-05, 'batch_size': 3112, 'optimizer': 'RMSprop'}.
2026-07-06 12:35:22,312 - experiment_functions - INFO - Early stopping at epoch 650. Best Metrics: (0.00019378172681622428, 5.0339076420416775e-05, 0.00011494830613906601)
2026-07-06 12:35:22,399 - optuna.study.study - INFO - Trial 14 finished with values: [0.00019378172681622428, 5.0339076420416775e-05, 0.00011494830613906601] and parameters: {'n_layers': 1, 'embedding_dim': 32, 'lr': 2.3388226322623013e-05, 'lambda_val': 0.0002496726403665611, 'batch_size': 3073, 'optimizer': 'Adam'}.
2026-07-06 12:36:09,377 - experiment_functions - INFO - Early stopping at epoch 550. Best Metrics: (0.004723016787693975, 0.0012147863913530765, 0.0029461760603456395)
2026-07-06 12:36:09,465 - optuna.study.study - INFO - Trial 15 finished with values: [0.004723016787693975, 0.0012147863913530765, 0.0029461760603456395] and parameters: {'n_layers': 4, 'embedding_dim': 32, 'lr': 0.01642454456848159, 'lambda_val': 0.010649182367450922, 'batch_size': 668, 'optimizer': 'Adam'}.
2026-07-06 12:36:51,935 - experiment_functions - INFO - Early stopping at epoch 500. Best Metrics: (0.00026534974526153663, 6.933495431491366e-05, 0.00015764531232231483)
2026-07-06 12:36:52,027 - optuna.study.study - INFO - Trial 16 finished with values: [0.00026534974526153663, 6.933495431491366e-05, 0.00015764531232231483] and parameters: {'n_layers': 1, 'embedding_dim': 96, 'lr': 0.00022033581734668916, 'lambda_val': 2.8062317756791392e-06, 'batch_size': 2890, 'optimizer': 'SGD'}.
2026-07-06 12:37:36,783 - experiment_functions - INFO - Early stopping at epoch 500. Best Metrics: (0.00023194451924238462, 6.078680926239006e-05, 0.0001172165283052739)
2026-07-06 12:37:36,871 - optuna.study.study - INFO - Trial 17 finished with values: [0.00023194451924238462, 6.078680926239006e-05, 0.0001172165283052739] and parameters: {'n_layers': 2, 'embedding_dim': 96, 'lr': 0.022292730801283123, 'lambda_val': 3.2526061508437436e-06, 'batch_size': 2061, 'optimizer': 'SGD'}.
2026-07-06 12:41:50,050 - experiment_functions - INFO - Early stopping at epoch 2050. Best Metrics: (0.000244792982651021, 6.458598484128944e-05, 0.00014148898090622056)
2026-07-06 12:41:50,131 - optuna.study.study - INFO - Trial 18 finished with values: [0.000244792982651021, 6.458598484128944e-05, 0.00014148898090622056] and parameters: {'n_layers': 4, 'embedding_dim': 256, 'lr': 1.0866027176885656e-05, 'lambda_val': 6.085326153419731e-06, 'batch_size': 1865, 'optimizer': 'RMSprop'}.
2026-07-06 12:48:45,376 - optuna.study.study - INFO - Trial 19 finished with values: [0.02210092701041768, 0.004677734931519861, 0.01310297030855179] and parameters: {'n_layers': 2, 'embedding_dim': 256, 'lr': 0.007748940378927992, 'lambda_val': 1.7965641297535496e-06, 'batch_size': 3098, 'optimizer': 'RMSprop'}.
2026-07-06 12:49:44,458 - experiment_functions - INFO - Early stopping at epoch 500. Best Metrics: (0.0001967593603642434, 5.7937427578215534e-05, 0.00011194050192260755)
2026-07-06 12:49:44,549 - optuna.study.study - INFO - Trial 20 finished with values: [0.0001967593603642434, 5.7937427578215534e-05, 0.00011194050192260755] and parameters: {'n_layers': 3, 'embedding_dim': 256, 'lr': 0.052099042918672546, 'lambda_val': 3.7781172042115236e-06, 'batch_size': 3558, 'optimizer': 'SGD'}.
2026-07-06 12:50:44,737 - experiment_functions - INFO - Early stopping at epoch 500. Best Metrics: (0.00018002663816280977, 5.223866420986646e-05, 0.0001221739436408498)
2026-07-06 12:50:44,824 - optuna.study.study - INFO - Trial 21 finished with values: [0.00018002663816280977, 5.223866420986646e-05, 0.0001221739436408498] and parameters: {'n_layers': 3, 'embedding_dim': 256, 'lr': 3.725863949554831e-05, 'lambda_val': 0.0026218147232462984, 'batch_size': 1867, 'optimizer': 'RMSprop'}.
2026-07-06 12:57:03,629 - experiment_functions - INFO - Early stopping at epoch 3650. Best Metrics: (0.012026732984128659, 0.0026157323860722228, 0.007134786819484476)
2026-07-06 12:57:03,703 - optuna.study.study - INFO - Trial 22 finished with values: [0.012026732984128659, 0.0026157323860722228, 0.007134786819484476] and parameters: {'n_layers': 2, 'embedding_dim': 256, 'lr': 0.01677700597951071, 'lambda_val': 1.838250716065182e-06, 'batch_size': 1500, 'optimizer': 'Adam'}.
2026-07-06 12:57:57,812 - experiment_functions - INFO - Early stopping at epoch 550. Best Metrics: (0.0022566418557462904, 0.0007085462454647343, 0.001545121312331259)
2026-07-06 12:57:57,896 - optuna.study.study - INFO - Trial 23 finished with values: [0.0022566418557462904, 0.0007085462454647343, 0.001545121312331259] and parameters: {'n_layers': 1, 'embedding_dim': 256, 'lr': 0.021220223601806684, 'lambda_val': 0.06343578078779324, 'batch_size': 1381, 'optimizer': 'Adam'}.
2026-07-06 12:58:50,518 - experiment_functions - INFO - Early stopping at epoch 650. Best Metrics: (0.0002601839730470116, 6.933495431491367e-05, 0.00015039424780568725)
2026-07-06 12:58:50,595 - optuna.study.study - INFO - Trial 24 finished with values: [0.0002601839730470116, 6.933495431491367e-05, 0.00015039424780568725] and parameters: {'n_layers': 2, 'embedding_dim': 32, 'lr': 1.2104113466827545e-05, 'lambda_val': 0.007360202916885347, 'batch_size': 1544, 'optimizer': 'Adam'}.
2026-07-06 13:07:04,521 - optuna.study.study - INFO - Trial 25 finished with values: [0.0018570835812217062, 0.0005090895275725168, 0.0011945933551638262] and parameters: {'n_layers': 4, 'embedding_dim': 256, 'lr': 0.0001277244495089132, 'lambda_val': 1.3710755672555229e-05, 'batch_size': 2026, 'optimizer': 'Adam'}.
2026-07-06 13:07:47,644 - experiment_functions - INFO - Early stopping at epoch 500. Best Metrics: (0.00017185315702481058, 4.843948863096708e-05, 9.849316396357921e-05)
2026-07-06 13:07:47,725 - optuna.study.study - INFO - Trial 26 finished with values: [0.00017185315702481058, 4.843948863096708e-05, 9.849316396357921e-05] and parameters: {'n_layers': 2, 'embedding_dim': 64, 'lr': 5.35751749943553e-05, 'lambda_val': 0.048860889824046655, 'batch_size': 3283, 'optimizer': 'RMSprop'}.
2026-07-06 13:08:43,127 - experiment_functions - INFO - Early stopping at epoch 700. Best Metrics: (0.0002289298548801301, 7.21843359990882e-05, 0.00014768607682530234)
2026-07-06 13:08:43,211 - optuna.study.study - INFO - Trial 27 finished with values: [0.0002289298548801301, 7.21843359990882e-05, 0.00014768607682530234] and parameters: {'n_layers': 1, 'embedding_dim': 32, 'lr': 0.0001322376104578907, 'lambda_val': 1.9053615668693293e-06, 'batch_size': 2215, 'optimizer': 'Adam'}.
2026-07-06 13:14:18,676 - experiment_functions - INFO - Early stopping at epoch 3550. Best Metrics: (0.026824632221766568, 0.005687365841612371, 0.015696978654864364)
2026-07-06 13:14:18,769 - optuna.study.study - INFO - Trial 28 finished with values: [0.026824632221766568, 0.005687365841612371, 0.015696978654864364] and parameters: {'n_layers': 1, 'embedding_dim': 256, 'lr': 0.002656669860795703, 'lambda_val': 0.000319221155640928, 'batch_size': 3807, 'optimizer': 'Adam'}.
2026-07-06 13:15:01,431 - experiment_functions - INFO - Early stopping at epoch 500. Best Metrics: (0.00026414625607980156, 6.933495431491367e-05, 0.00016330753369366572)
2026-07-06 13:15:01,545 - optuna.study.study - INFO - Trial 29 finished with values: [0.00026414625607980156, 6.933495431491367e-05, 0.00016330753369366572] and parameters: {'n_layers': 4, 'embedding_dim': 32, 'lr': 0.015039695069437966, 'lambda_val': 1.4470104577841801e-06, 'batch_size': 3542, 'optimizer': 'SGD'}.
2026-07-06 13:21:32,684 - optuna.study.study - INFO - Trial 30 finished with values: [0.0005714553868480725, 0.00015766578652432424, 0.00032413375908466307] and parameters: {'n_layers': 4, 'embedding_dim': 128, 'lr': 8.484022484750847e-05, 'lambda_val': 8.951880820647161e-06, 'batch_size': 4072, 'optimizer': 'Adam'}.
2026-07-06 13:22:22,223 - experiment_functions - INFO - Early stopping at epoch 550. Best Metrics: (0.004301163969426206, 0.0010333757574606311, 0.0026399737731963727)
2026-07-06 13:22:22,304 - optuna.study.study - INFO - Trial 31 finished with values: [0.004301163969426206, 0.0010333757574606311, 0.0026399737731963727] and parameters: {'n_layers': 2, 'embedding_dim': 96, 'lr': 0.05503475124833015, 'lambda_val': 1.4112370474419454e-05, 'batch_size': 561, 'optimizer': 'RMSprop'}.
2026-07-06 13:23:45,716 - experiment_functions - INFO - Early stopping at epoch 1050. Best Metrics: (0.00017481729133018173, 5.413825199931616e-05, 0.0001091804558485836)
2026-07-06 13:23:45,837 - optuna.study.study - INFO - Trial 32 finished with values: [0.00017481729133018173, 5.413825199931616e-05, 0.0001091804558485836] and parameters: {'n_layers': 1, 'embedding_dim': 64, 'lr': 1.0005419701698253e-05, 'lambda_val': 0.006606419176859235, 'batch_size': 2966, 'optimizer': 'RMSprop'}.
2026-07-06 13:24:34,672 - experiment_functions - INFO - Early stopping at epoch 500. Best Metrics: (0.00023701629542432034, 6.743536652546399e-05, 0.0001344802578284328)
2026-07-06 13:24:34,761 - optuna.study.study - INFO - Trial 33 finished with values: [0.00023701629542432034, 6.743536652546399e-05, 0.0001344802578284328] and parameters: {'n_layers': 4, 'embedding_dim': 96, 'lr': 0.06535558135772093, 'lambda_val': 0.03768427241340957, 'batch_size': 3998, 'optimizer': 'SGD'}.
2026-07-06 13:25:17,710 - experiment_functions - INFO - Early stopping at epoch 500. Best Metrics: (0.00027016534860501194, 5.9837015367665226e-05, 0.0001471962158651556)
2026-07-06 13:25:17,781 - optuna.study.study - INFO - Trial 34 finished with values: [0.00027016534860501194, 5.9837015367665226e-05, 0.0001471962158651556] and parameters: {'n_layers': 4, 'embedding_dim': 32, 'lr': 1.1757724916138184e-05, 'lambda_val': 0.0011436125128021309, 'batch_size': 3171, 'optimizer': 'SGD'}.
2026-07-06 13:26:41,227 - experiment_functions - INFO - Early stopping at epoch 1050. Best Metrics: (0.00019988893006990917, 5.698763368349069e-05, 0.00011449600933298657)
2026-07-06 13:26:41,313 - optuna.study.study - INFO - Trial 35 finished with values: [0.00019988893006990917, 5.698763368349069e-05, 0.00011449600933298657] and parameters: {'n_layers': 1, 'embedding_dim': 64, 'lr': 3.2566852347666256e-05, 'lambda_val': 2.5044442098393602e-05, 'batch_size': 1852, 'optimizer': 'Adam'}.
2026-07-06 13:27:28,022 - experiment_functions - INFO - Early stopping at epoch 500. Best Metrics: (0.00020833090620784393, 5.6987633683490685e-05, 0.00010977610712530843)
2026-07-06 13:27:28,110 - optuna.study.study - INFO - Trial 36 finished with values: [0.00020833090620784393, 5.6987633683490685e-05, 0.00010977610712530843] and parameters: {'n_layers': 3, 'embedding_dim': 96, 'lr': 0.0009923398673734416, 'lambda_val': 5.960673439428243e-06, 'batch_size': 1767, 'optimizer': 'SGD'}.
2026-07-06 13:28:11,137 - experiment_functions - INFO - Early stopping at epoch 500. Best Metrics: (0.00029521443560777557, 6.838516042018881e-05, 0.00018730616239501696)
2026-07-06 13:28:11,207 - optuna.study.study - INFO - Trial 37 finished with values: [0.00029521443560777557, 6.838516042018881e-05, 0.00018730616239501696] and parameters: {'n_layers': 4, 'embedding_dim': 32, 'lr': 0.0001681957706317053, 'lambda_val': 0.010866137346376039, 'batch_size': 550, 'optimizer': 'RMSprop'}.
2026-07-06 13:29:10,009 - experiment_functions - INFO - Early stopping at epoch 500. Best Metrics: (0.0002118498576379904, 5.5088045894041e-05, 0.00011040207137769156)
2026-07-06 13:29:10,079 - optuna.study.study - INFO - Trial 38 finished with values: [0.0002118498576379904, 5.5088045894041e-05, 0.00011040207137769156] and parameters: {'n_layers': 3, 'embedding_dim': 256, 'lr': 0.004271847773025596, 'lambda_val': 2.658294036433984e-06, 'batch_size': 1446, 'optimizer': 'SGD'}.
2026-07-06 13:29:59,438 - experiment_functions - INFO - Early stopping at epoch 500. Best Metrics: (0.0002150851794830932, 5.3188458104591316e-05, 0.00012109499944579738)
2026-07-06 13:29:59,518 - optuna.study.study - INFO - Trial 39 finished with values: [0.0002150851794830932, 5.3188458104591316e-05, 0.00012109499944579738] and parameters: {'n_layers': 3, 'embedding_dim': 128, 'lr': 0.001068739399184412, 'lambda_val': 0.0015291740739542922, 'batch_size': 1343, 'optimizer': 'SGD'}.
2026-07-06 13:35:44,174 - optuna.study.study - INFO - Trial 40 finished with values: [0.012522730206402165, 0.0027306574473339286, 0.0075012734132076314] and parameters: {'n_layers': 4, 'embedding_dim': 64, 'lr': 0.024621994148519108, 'lambda_val': 5.734344867778707e-06, 'batch_size': 906, 'optimizer': 'RMSprop'}.
2026-07-06 13:36:30,143 - experiment_functions - INFO - Early stopping at epoch 550. Best Metrics: (0.003085722215528996, 0.0008776095587257565, 0.0019943611359154777)
2026-07-06 13:36:31,087 - optuna.study.study - INFO - Trial 41 finished with values: [0.003085722215528996, 0.0008776095587257565, 0.0019943611359154777] and parameters: {'n_layers': 1, 'embedding_dim': 64, 'lr': 0.06754974326511395, 'lambda_val': 9.525438162158697e-06, 'batch_size': 691, 'optimizer': 'Adam'}.
2026-07-06 13:42:48,094 - optuna.study.study - INFO - Trial 42 finished with values: [0.02214551899817598, 0.004653990084151739, 0.013092593828928583] and parameters: {'n_layers': 1, 'embedding_dim': 256, 'lr': 0.006478106002947754, 'lambda_val': 4.230259051937931e-06, 'batch_size': 3792, 'optimizer': 'Adam'}.
2026-07-06 13:44:23,848 - experiment_functions - INFO - Early stopping at epoch 1200. Best Metrics: (0.00020317980324166649, 5.793742757821554e-05, 0.00011215856048262432)
2026-07-06 13:44:23,922 - optuna.study.study - INFO - Trial 43 finished with values: [0.00020317980324166649, 5.793742757821554e-05, 0.00011215856048262432] and parameters: {'n_layers': 3, 'embedding_dim': 32, 'lr': 2.719121464741019e-05, 'lambda_val': 1.6160915395686394e-05, 'batch_size': 3636, 'optimizer': 'Adam'}.
2026-07-06 13:45:34,076 - experiment_functions - INFO - Early stopping at epoch 800. Best Metrics: (0.011496889014836021, 0.0026622722869137404, 0.006783938130158663)
2026-07-06 13:45:34,168 - optuna.study.study - INFO - Trial 44 finished with values: [0.011496889014836021, 0.0026622722869137404, 0.006783938130158663] and parameters: {'n_layers': 1, 'embedding_dim': 128, 'lr': 0.011688810705771883, 'lambda_val': 0.003235866498706212, 'batch_size': 4084, 'optimizer': 'Adam'}.
2026-07-06 13:46:25,571 - experiment_functions - INFO - Early stopping at epoch 550. Best Metrics: (0.00025917687949551164, 6.17366031571149e-05, 0.00015830149973074757)
2026-07-06 13:46:25,675 - optuna.study.study - INFO - Trial 45 finished with values: [0.00025917687949551164, 6.17366031571149e-05, 0.00015830149973074757] and parameters: {'n_layers': 3, 'embedding_dim': 96, 'lr': 1.5046305492285578e-05, 'lambda_val': 0.008708552292021214, 'batch_size': 847, 'optimizer': 'RMSprop'}.
2026-07-06 13:54:42,497 - optuna.study.study - INFO - Trial 46 finished with values: [0.014263327294120422, 0.003015595615751382, 0.008805896439834994] and parameters: {'n_layers': 4, 'embedding_dim': 256, 'lr': 0.019829977892525583, 'lambda_val': 8.354147532190842e-06, 'batch_size': 1513, 'optimizer': 'RMSprop'}.
2026-07-06 13:55:32,786 - experiment_functions - INFO - Early stopping at epoch 550. Best Metrics: (0.0011978603535492383, 0.00032577930589062175, 0.0007207837793996662)
2026-07-06 13:55:32,875 - optuna.study.study - INFO - Trial 47 finished with values: [0.0011978603535492383, 0.00032577930589062175, 0.0007207837793996662] and parameters: {'n_layers': 4, 'embedding_dim': 64, 'lr': 0.0016460373905062384, 'lambda_val': 0.09344210196306219, 'batch_size': 1768, 'optimizer': 'RMSprop'}.
2026-07-06 13:56:17,852 - experiment_functions - INFO - Early stopping at epoch 500. Best Metrics: (0.00012551519755521707, 3.3242786315369565e-05, 7.030156916912314e-05)
2026-07-06 13:56:17,935 - optuna.study.study - INFO - Trial 48 finished with values: [0.00012551519755521707, 3.3242786315369565e-05, 7.030156916912314e-05] and parameters: {'n_layers': 3, 'embedding_dim': 64, 'lr': 1.6753051865988237e-05, 'lambda_val': 0.00017603789365726032, 'batch_size': 2420, 'optimizer': 'Adam'}.
2026-07-06 13:57:21,407 - experiment_functions - INFO - Early stopping at epoch 800. Best Metrics: (0.00022846145982042282, 6.078680926239006e-05, 0.00012748243038135672)
2026-07-06 13:57:21,494 - optuna.study.study - INFO - Trial 49 finished with values: [0.00022846145982042282, 6.078680926239006e-05, 0.00012748243038135672] and parameters: {'n_layers': 2, 'embedding_dim': 32, 'lr': 0.00010617081082302014, 'lambda_val': 0.0029685465001748896, 'batch_size': 2021, 'optimizer': 'RMSprop'}.
2026-07-06 14:04:52,433 - optuna.study.study - INFO - Trial 50 finished with values: [0.000393940341318039, 9.402959557775963e-05, 0.00022599991197934906] and parameters: {'n_layers': 3, 'embedding_dim': 256, 'lr': 0.0001322376104578907, 'lambda_val': 1.838250716065182e-06, 'batch_size': 1500, 'optimizer': 'Adam'}.
2026-07-06 14:11:07,539 - optuna.study.study - INFO - Trial 51 finished with values: [0.016720819044017978, 0.003700397013847995, 0.010108709174181246] and parameters: {'n_layers': 1, 'embedding_dim': 256, 'lr': 0.011688810705771883, 'lambda_val': 2.465157645661239e-06, 'batch_size': 3063, 'optimizer': 'Adam'}.
2026-07-06 14:15:15,747 - experiment_functions - INFO - Early stopping at epoch 2200. Best Metrics: (0.000247385568839308, 5.6987633683490685e-05, 0.00013319237712962613)
2026-07-06 14:15:15,824 - optuna.study.study - INFO - Trial 52 finished with values: [0.000247385568839308, 5.6987633683490685e-05, 0.00013319237712962613] and parameters: {'n_layers': 3, 'embedding_dim': 256, 'lr': 3.725863949554831e-05, 'lambda_val': 1.840856803140451e-05, 'batch_size': 1867, 'optimizer': 'RMSprop'}.
2026-07-06 14:19:32,215 - experiment_functions - INFO - Early stopping at epoch 3300. Best Metrics: (0.014032711751064169, 0.0032036548069069013, 0.008087815141356371)
