2026-07-02 19:22:43,401 - optuna.study.study - INFO - Trial 160 finished with values: [0.008399370447369684, 0.0020392074919742416, 0.004776909282153636] and parameters: {'n_layers': 3, 'embedding_dim': 96, 'lr': 0.0006781284315626388, 'lambda_val': 0.008015948669672757, 'batch_size': 2370, 'optimizer': 'Adam'}.
2026-07-02 19:23:46,830 - experiment_functions - INFO - Early stopping at epoch 550. Best Metrics: (0.008097658444725825, 0.002141785232604525, 0.005150611507986325)
2026-07-02 19:23:47,323 - optuna.study.study - INFO - Trial 161 finished with values: [0.008097658444725825, 0.002141785232604525, 0.005150611507986325] and parameters: {'n_layers': 2, 'embedding_dim': 256, 'lr': 0.01003894592310146, 'lambda_val': 1.6046175410536033e-05, 'batch_size': 541, 'optimizer': 'Adam'}.
2026-07-02 19:26:33,964 - experiment_functions - INFO - Early stopping at epoch 1750. Best Metrics: (0.008779150238825261, 0.0019898182094485496, 0.0052966680577855646)
2026-07-02 19:26:34,066 - optuna.study.study - INFO - Trial 162 finished with values: [0.008779150238825261, 0.0019898182094485496, 0.0052966680577855646] and parameters: {'n_layers': 4, 'embedding_dim': 64, 'lr': 0.0007787505453018097, 'lambda_val': 0.0012545102603406476, 'batch_size': 1092, 'optimizer': 'Adam'}.
2026-07-02 19:30:23,697 - experiment_functions - INFO - Early stopping at epoch 2550. Best Metrics: (0.013172264356294648, 0.0031542655243812093, 0.008021832868836055)
2026-07-02 19:30:23,779 - optuna.study.study - INFO - Trial 163 finished with values: [0.013172264356294648, 0.0031542655243812093, 0.008021832868836055] and parameters: {'n_layers': 3, 'embedding_dim': 64, 'lr': 0.0005152458540342933, 'lambda_val': 9.00355461091747e-05, 'batch_size': 1948, 'optimizer': 'RMSprop'}.
2026-07-02 19:35:43,853 - optuna.study.study - INFO - Trial 164 finished with values: [0.014096759910186416, 0.0034468020439564614, 0.008746524448868078] and parameters: {'n_layers': 1, 'embedding_dim': 64, 'lr': 0.0012100089708552634, 'lambda_val': 0.005299023139585472, 'batch_size': 677, 'optimizer': 'Adam'}.
2026-07-02 19:41:41,674 - optuna.study.study - INFO - Trial 165 finished with values: [0.010679281730161678, 0.002539748874494235, 0.0062076733303622405] and parameters: {'n_layers': 3, 'embedding_dim': 64, 'lr': 0.0005152458540342933, 'lambda_val': 0.003381769296625175, 'batch_size': 780, 'optimizer': 'Adam'}.
2026-07-02 19:48:53,792 - optuna.study.study - INFO - Trial 166 finished with values: [0.013957753443531066, 0.0032112531580646996, 0.008124712364496781] and parameters: {'n_layers': 2, 'embedding_dim': 256, 'lr': 0.0007787505453018097, 'lambda_val': 0.000258470339808441, 'batch_size': 1092, 'optimizer': 'RMSprop'}.
2026-07-02 19:50:29,963 - experiment_functions - INFO - Early stopping at epoch 1100. Best Metrics: (0.011361847498558463, 0.0027230590961761295, 0.006663739739508263)
2026-07-02 19:50:30,059 - optuna.study.study - INFO - Trial 167 finished with values: [0.011361847498558463, 0.0027230590961761295, 0.006663739739508263] and parameters: {'n_layers': 2, 'embedding_dim': 64, 'lr': 0.0006781284315626388, 'lambda_val': 0.008015948669672757, 'batch_size': 2370, 'optimizer': 'Adam'}.
2026-07-02 19:56:45,505 - experiment_functions - INFO - Early stopping at epoch 3450. Best Metrics: (0.017204049049861374, 0.004050870961001462, 0.010507760815919816)
2026-07-02 19:56:45,588 - optuna.study.study - INFO - Trial 168 finished with values: [0.017204049049861374, 0.004050870961001462, 0.010507760815919816] and parameters: {'n_layers': 2, 'embedding_dim': 256, 'lr': 0.0005693523871630874, 'lambda_val': 0.00020052239202191264, 'batch_size': 3756, 'optimizer': 'RMSprop'}.
2026-07-02 20:02:06,098 - optuna.study.study - INFO - Trial 169 finished with values: [0.017230031377564837, 0.004080314571737932, 0.010640588749219578] and parameters: {'n_layers': 1, 'embedding_dim': 64, 'lr': 0.0007787505453018097, 'lambda_val': 0.0012545102603406476, 'batch_size': 2278, 'optimizer': 'Adam'}.
2026-07-02 20:05:26,509 - experiment_functions - INFO - Early stopping at epoch 2400. Best Metrics: (0.005918478145287727, 0.0014332389871397908, 0.003257784850625451)
2026-07-02 20:05:26,596 - optuna.study.study - INFO - Trial 170 finished with values: [0.005918478145287727, 0.0014332389871397908, 0.003257784850625451] and parameters: {'n_layers': 3, 'embedding_dim': 32, 'lr': 0.00045784196880844456, 'lambda_val': 0.02455984895138463, 'batch_size': 950, 'optimizer': 'RMSprop'}.
2026-07-02 20:11:03,389 - experiment_functions - INFO - Early stopping at epoch 3750. Best Metrics: (0.01571611230099707, 0.0035256349372186236, 0.009258702010294962)
2026-07-02 20:11:03,467 - optuna.study.study - INFO - Trial 171 finished with values: [0.01571611230099707, 0.0035256349372186236, 0.009258702010294962] and parameters: {'n_layers': 3, 'embedding_dim': 64, 'lr': 0.0006781284315626388, 'lambda_val': 5.246496407901207e-06, 'batch_size': 981, 'optimizer': 'Adam'}.
2026-07-02 20:12:54,799 - experiment_functions - INFO - Early stopping at epoch 1150. Best Metrics: (0.01132548899088044, 0.0025995858898619, 0.006500780970074502)
2026-07-02 20:12:54,909 - optuna.study.study - INFO - Trial 172 finished with values: [0.01132548899088044, 0.0025995858898619, 0.006500780970074502] and parameters: {'n_layers': 3, 'embedding_dim': 96, 'lr': 0.0005152458540342933, 'lambda_val': 0.002319811633993424, 'batch_size': 1092, 'optimizer': 'RMSprop'}.
2026-07-02 20:16:40,817 - experiment_functions - INFO - Early stopping at epoch 2650. Best Metrics: (0.014687003863959339, 0.003299583990274111, 0.008583111307253366)
2026-07-02 20:16:40,911 - optuna.study.study - INFO - Trial 173 finished with values: [0.014687003863959339, 0.003299583990274111, 0.008583111307253366] and parameters: {'n_layers': 2, 'embedding_dim': 64, 'lr': 0.0012100089708552634, 'lambda_val': 9.00355461091747e-05, 'batch_size': 677, 'optimizer': 'Adam'}.
2026-07-02 20:24:50,586 - optuna.study.study - INFO - Trial 174 finished with values: [0.014172473444835604, 0.003322379043747507, 0.008590176370971586] and parameters: {'n_layers': 3, 'embedding_dim': 256, 'lr': 0.0005693523871630874, 'lambda_val': 0.0005995419679288804, 'batch_size': 3066, 'optimizer': 'Adam'}.
2026-07-02 20:30:39,915 - optuna.study.study - INFO - Trial 175 finished with values: [0.01410910279284961, 0.003200805425222726, 0.00849599935325696] and parameters: {'n_layers': 4, 'embedding_dim': 32, 'lr': 0.0005152458540342933, 'lambda_val': 5.288093815108994e-05, 'batch_size': 1948, 'optimizer': 'RMSprop'}.
2026-07-02 20:36:15,215 - optuna.study.study - INFO - Trial 176 finished with values: [0.010866914149344698, 0.002608134034914423, 0.006424682300758537] and parameters: {'n_layers': 2, 'embedding_dim': 64, 'lr': 0.00026052492972575584, 'lambda_val': 8.117707452282847e-06, 'batch_size': 2340, 'optimizer': 'RMSprop'}.
2026-07-02 20:38:28,870 - experiment_functions - INFO - Early stopping at epoch 1700. Best Metrics: (0.008731805567705324, 0.0020904963622893832, 0.005107753177276337)
2026-07-02 20:38:28,948 - optuna.study.study - INFO - Trial 177 finished with values: [0.008731805567705324, 0.0020904963622893832, 0.005107753177276337] and parameters: {'n_layers': 1, 'embedding_dim': 32, 'lr': 0.0027092005148847305, 'lambda_val': 0.005299023139585472, 'batch_size': 898, 'optimizer': 'RMSprop'}.
2026-07-02 20:39:20,650 - experiment_functions - INFO - Early stopping at epoch 550. Best Metrics: (0.004018464645161934, 0.0009250992534619987, 0.002472754560580287)
2026-07-02 20:39:20,728 - optuna.study.study - INFO - Trial 178 finished with values: [0.004018464645161934, 0.0009250992534619987, 0.002472754560580287] and parameters: {'n_layers': 3, 'embedding_dim': 64, 'lr': 0.08392442756161961, 'lambda_val': 0.00045598605516994004, 'batch_size': 2127, 'optimizer': 'Adam'}.
2026-07-02 20:42:22,811 - experiment_functions - INFO - Early stopping at epoch 1900. Best Metrics: (0.014451480752939934, 0.003416408639325267, 0.008686194741808049)
2026-07-02 20:42:22,890 - optuna.study.study - INFO - Trial 179 finished with values: [0.014451480752939934, 0.003416408639325267, 0.008686194741808049] and parameters: {'n_layers': 3, 'embedding_dim': 96, 'lr': 0.0005152458540342933, 'lambda_val': 5.288093815108994e-05, 'batch_size': 1948, 'optimizer': 'RMSprop'}.
2026-07-02 20:46:42,103 - experiment_functions - INFO - Early stopping at epoch 3050. Best Metrics: (0.011987943559438002, 0.0028816746765951786, 0.0070809365275309455)
2026-07-02 20:46:42,194 - optuna.study.study - INFO - Trial 180 finished with values: [0.011987943559438002, 0.0028816746765951786, 0.0070809365275309455] and parameters: {'n_layers': 2, 'embedding_dim': 64, 'lr': 0.0006781284315626388, 'lambda_val': 0.008015948669672757, 'batch_size': 2370, 'optimizer': 'Adam'}.
2026-07-02 20:47:31,434 - experiment_functions - INFO - Early stopping at epoch 500. Best Metrics: (0.00020433599574106072, 5.5088045894040994e-05, 0.00012749880569305798)
2026-07-02 20:47:31,966 - optuna.study.study - INFO - Trial 181 finished with values: [0.00020433599574106072, 5.5088045894040994e-05, 0.00012749880569305798] and parameters: {'n_layers': 1, 'embedding_dim': 256, 'lr': 0.0005693523871630874, 'lambda_val': 0.0052893230335175154, 'batch_size': 2006, 'optimizer': 'SGD'}.
2026-07-02 20:52:48,761 - optuna.study.study - INFO - Trial 182 finished with values: [0.01153916176026351, 0.0028009421955435673, 0.007154279092435451] and parameters: {'n_layers': 1, 'embedding_dim': 64, 'lr': 0.0006781284315626388, 'lambda_val': 0.008015948669672757, 'batch_size': 677, 'optimizer': 'RMSprop'}.
2026-07-02 20:54:49,870 - experiment_functions - INFO - Early stopping at epoch 1250. Best Metrics: (0.010045677971566408, 0.0023554888589176147, 0.005934716386657336)
2026-07-02 20:54:49,960 - optuna.study.study - INFO - Trial 183 finished with values: [0.010045677971566408, 0.0023554888589176147, 0.005934716386657336] and parameters: {'n_layers': 3, 'embedding_dim': 96, 'lr': 0.0005152458540342933, 'lambda_val': 0.005299023139585472, 'batch_size': 1092, 'optimizer': 'Adam'}.
2026-07-02 20:57:42,613 - experiment_functions - INFO - Early stopping at epoch 1400. Best Metrics: (0.013056377901101203, 0.003000398913435784, 0.007926375127254456)
2026-07-02 20:57:42,689 - optuna.study.study - INFO - Trial 184 finished with values: [0.013056377901101203, 0.003000398913435784, 0.007926375127254456] and parameters: {'n_layers': 3, 'embedding_dim': 256, 'lr': 0.0005152458540342933, 'lambda_val': 0.0007874202710607479, 'batch_size': 2391, 'optimizer': 'RMSprop'}.
2026-07-02 21:03:22,806 - optuna.study.study - INFO - Trial 185 finished with values: [0.015403099865276484, 0.003664304845848451, 0.009432299467401447] and parameters: {'n_layers': 2, 'embedding_dim': 64, 'lr': 0.0005152458540342933, 'lambda_val': 5.288093815108994e-05, 'batch_size': 3269, 'optimizer': 'RMSprop'}.
2026-07-02 21:04:10,029 - experiment_functions - INFO - Early stopping at epoch 500. Best Metrics: (0.00023368909606452068, 5.31884581045913e-05, 0.00011246114335219208)
2026-07-02 21:04:10,153 - optuna.study.study - INFO - Trial 186 finished with values: [0.00023368909606452068, 5.31884581045913e-05, 0.00011246114335219208] and parameters: {'n_layers': 2, 'embedding_dim': 96, 'lr': 0.0005152458540342933, 'lambda_val': 0.0013701200929940348, 'batch_size': 3332, 'optimizer': 'SGD'}.
2026-07-02 21:10:15,488 - experiment_functions - INFO - Early stopping at epoch 2700. Best Metrics: (0.011114421117635725, 0.0025596945462834563, 0.006548743424099584)
2026-07-02 21:10:15,584 - optuna.study.study - INFO - Trial 187 finished with values: [0.011114421117635725, 0.0025596945462834563, 0.006548743424099584] and parameters: {'n_layers': 4, 'embedding_dim': 256, 'lr': 0.0005152458540342933, 'lambda_val': 6.366456568390523e-06, 'batch_size': 1147, 'optimizer': 'RMSprop'}.
2026-07-02 21:11:18,364 - experiment_functions - INFO - Early stopping at epoch 750. Best Metrics: (0.00021286738391513785, 6.173660315711492e-05, 0.00012593196168115078)
2026-07-02 21:11:18,445 - optuna.study.study - INFO - Trial 188 finished with values: [0.00021286738391513785, 6.173660315711492e-05, 0.00012593196168115078] and parameters: {'n_layers': 2, 'embedding_dim': 32, 'lr': 4.488035272426267e-05, 'lambda_val': 0.0004266548063750315, 'batch_size': 1092, 'optimizer': 'RMSprop'}.
2026-07-02 21:13:30,726 - experiment_functions - INFO - Early stopping at epoch 1550. Best Metrics: (0.0024569331871127933, 0.0006876507797807876, 0.0016329741597091061)
2026-07-02 21:13:30,797 - optuna.study.study - INFO - Trial 189 finished with values: [0.0024569331871127933, 0.0006876507797807876, 0.0016329741597091061] and parameters: {'n_layers': 1, 'embedding_dim': 128, 'lr': 0.05104879286500262, 'lambda_val': 5.288093815108994e-05, 'batch_size': 3579, 'optimizer': 'RMSprop'}.
2026-07-02 21:17:10,327 - experiment_functions - INFO - Early stopping at epoch 2700. Best Metrics: (0.014733061339765586, 0.0035265847311133484, 0.008920296063191752)
2026-07-02 21:17:10,750 - optuna.study.study - INFO - Trial 190 finished with values: [0.014733061339765586, 0.0035265847311133484, 0.008920296063191752] and parameters: {'n_layers': 2, 'embedding_dim': 32, 'lr': 0.0007787505453018097, 'lambda_val': 0.00045598605516994004, 'batch_size': 1891, 'optimizer': 'RMSprop'}.
2026-07-02 21:23:08,224 - optuna.study.study - INFO - Trial 191 finished with values: [0.013182711696438981, 0.0031105750052238665, 0.0080286855510468] and parameters: {'n_layers': 3, 'embedding_dim': 64, 'lr': 0.00026052492972575584, 'lambda_val': 9.00355461091747e-05, 'batch_size': 3269, 'optimizer': 'RMSprop'}.
2026-07-02 21:29:18,413 - optuna.study.study - INFO - Trial 192 finished with values: [0.01607503554779668, 0.003807723723951902, 0.009766744335599532] and parameters: {'n_layers': 2, 'embedding_dim': 128, 'lr': 0.00045784196880844456, 'lambda_val': 1.6046175410536033e-05, 'batch_size': 1891, 'optimizer': 'RMSprop'}.
2026-07-02 21:30:32,105 - experiment_functions - INFO - Early stopping at epoch 800. Best Metrics: (0.0002069839615010708, 5.698763368349067e-05, 0.00011550052533363689)
2026-07-02 21:30:32,190 - optuna.study.study - INFO - Trial 193 finished with values: [0.0002069839615010708, 5.698763368349067e-05, 0.00011550052533363689] and parameters: {'n_layers': 3, 'embedding_dim': 64, 'lr': 1.4876113913784765e-05, 'lambda_val': 0.0036693670312856292, 'batch_size': 2355, 'optimizer': 'RMSprop'}.
2026-07-02 21:33:22,288 - experiment_functions - INFO - Early stopping at epoch 2000. Best Metrics: (0.0050316102158845695, 0.0014104439336663944, 0.0029322440322435903)
2026-07-02 21:33:22,377 - optuna.study.study - INFO - Trial 194 finished with values: [0.0050316102158845695, 0.0014104439336663944, 0.0029322440322435903] and parameters: {'n_layers': 2, 'embedding_dim': 64, 'lr': 0.00045784196880844456, 'lambda_val': 0.05464329946950947, 'batch_size': 2370, 'optimizer': 'RMSprop'}.
2026-07-02 21:41:29,021 - optuna.study.study - INFO - Trial 195 finished with values: [0.006774824956718547, 0.0017001310715574717, 0.004016826673841067] and parameters: {'n_layers': 3, 'embedding_dim': 256, 'lr': 0.0005693523871630874, 'lambda_val': 0.005299023139585472, 'batch_size': 780, 'optimizer': 'Adam'}.
2026-07-02 21:46:24,807 - experiment_functions - INFO - Early stopping at epoch 3350. Best Metrics: (0.012570721299444037, 0.0028284862184905874, 0.007035934586247677)
2026-07-02 21:46:24,893 - optuna.study.study - INFO - Trial 196 finished with values: [0.012570721299444037, 0.0028284862184905874, 0.007035934586247677] and parameters: {'n_layers': 4, 'embedding_dim': 32, 'lr': 0.0005152458540342933, 'lambda_val': 9.00355461091747e-05, 'batch_size': 2432, 'optimizer': 'Adam'}.
2026-07-02 21:52:06,083 - optuna.study.study - INFO - Trial 197 finished with values: [0.01584675359740044, 0.0037877780521626803, 0.009596197459342965] and parameters: {'n_layers': 2, 'embedding_dim': 64, 'lr': 0.00045784196880844456, 'lambda_val': 2.3467434467462208e-05, 'batch_size': 3269, 'optimizer': 'RMSprop'}.
2026-07-02 21:57:46,988 - optuna.study.study - INFO - Trial 198 finished with values: [0.015328447842871068, 0.003629162471743632, 0.009451360168475816] and parameters: {'n_layers': 2, 'embedding_dim': 64, 'lr': 0.0006781284315626388, 'lambda_val': 0.0004266548063750315, 'batch_size': 1092, 'optimizer': 'Adam'}.
2026-07-02 21:58:57,736 - experiment_functions - INFO - Early stopping at epoch 550. Best Metrics: (0.0070623971517964615, 0.0016697376669262771, 0.004553704554296736)
2026-07-02 21:58:57,809 - optuna.study.study - INFO - Trial 199 finished with values: [0.0070623971517964615, 0.0016697376669262771, 0.004553704554296736] and parameters: {'n_layers': 3, 'embedding_dim': 256, 'lr': 0.039397889064631424, 'lambda_val': 1.942297226860337e-05, 'batch_size': 1092, 'optimizer': 'Adam'}.
2026-07-02 21:59:55,733 - experiment_functions - INFO - Early stopping at epoch 650. Best Metrics: (0.00518898464173767, 0.0013259122770358834, 0.0029904833704636966)
2026-07-02 21:59:55,796 - optuna.study.study - INFO - Trial 200 finished with values: [0.00518898464173767, 0.0013259122770358834, 0.0029904833704636966] and parameters: {'n_layers': 3, 'embedding_dim': 32, 'lr': 0.00426116607312671, 'lambda_val': 0.0005995419679288804, 'batch_size': 3066, 'optimizer': 'RMSprop'}.
2026-07-02 22:05:36,940 - optuna.study.study - INFO - Trial 201 finished with values: [0.015427887512552346, 0.00342685637216724, 0.009057180086661362] and parameters: {'n_layers': 2, 'embedding_dim': 64, 'lr': 0.0012100089708552634, 'lambda_val': 9.00355461091747e-05, 'batch_size': 677, 'optimizer': 'Adam'}.
2026-07-02 22:10:47,730 - optuna.study.study - INFO - Trial 202 finished with values: [0.014006947542890027, 0.00342685637216724, 0.008444528294682611] and parameters: {'n_layers': 1, 'embedding_dim': 32, 'lr': 0.0005747446367875012, 'lambda_val': 0.00045598605516994004, 'batch_size': 2278, 'optimizer': 'RMSprop'}.
2026-07-02 22:11:50,694 - experiment_functions - INFO - Early stopping at epoch 500. Best Metrics: (0.00024620258556081864, 5.888722147294038e-05, 0.00012219640107024896)
2026-07-02 22:11:50,766 - optuna.study.study - INFO - Trial 203 finished with values: [0.00024620258556081864, 5.888722147294038e-05, 0.00012219640107024896] and parameters: {'n_layers': 3, 'embedding_dim': 256, 'lr': 0.0005152458540342933, 'lambda_val': 5.288093815108994e-05, 'batch_size': 3579, 'optimizer': 'SGD'}.
2026-07-02 22:17:48,063 - experiment_functions - INFO - Early stopping at epoch 3750. Best Metrics: (0.014150443615776064, 0.0032881864635374127, 0.008447197818508348)
2026-07-02 22:17:48,157 - optuna.study.study - INFO - Trial 204 finished with values: [0.014150443615776064, 0.0032881864635374127, 0.008447197818508348] and parameters: {'n_layers': 3, 'embedding_dim': 96, 'lr': 0.0005693523871630874, 'lambda_val': 5.288093815108994e-05, 'batch_size': 2578, 'optimizer': 'RMSprop'}.
2026-07-02 22:19:28,829 - experiment_functions - INFO - Early stopping at epoch 1150. Best Metrics: (0.014028378083945983, 0.0032815379062743383, 0.008641514754260138)
2026-07-02 22:19:28,918 - optuna.study.study - INFO - Trial 205 finished with values: [0.014028378083945983, 0.0032815379062743383, 0.008641514754260138] and parameters: {'n_layers': 2, 'embedding_dim': 64, 'lr': 0.0007787505453018097, 'lambda_val': 0.0004266548063750315, 'batch_size': 2278, 'optimizer': 'RMSprop'}.
2026-07-02 22:25:48,305 - optuna.study.study - INFO - Trial 206 finished with values: [0.011979929431445172, 0.002802841783333017, 0.007548057814265998] and parameters: {'n_layers': 1, 'embedding_dim': 256, 'lr': 0.0005152458540342933, 'lambda_val': 0.0004266548063750315, 'batch_size': 1211, 'optimizer': 'Adam'}.
2026-07-02 22:26:33,427 - experiment_functions - INFO - Early stopping at epoch 500. Best Metrics: (0.00023755830296049406, 5.8887221472940384e-05, 0.00014063534426114591)
2026-07-02 22:26:33,521 - optuna.study.study - INFO - Trial 207 finished with values: [0.00023755830296049406, 5.8887221472940384e-05, 0.00014063534426114591] and parameters: {'n_layers': 2, 'embedding_dim': 64, 'lr': 0.0006781284315626388, 'lambda_val': 0.0004266548063750315, 'batch_size': 1341, 'optimizer': 'SGD'}.
2026-07-02 22:33:49,344 - optuna.study.study - INFO - Trial 208 finished with values: [0.011775167300400005, 0.002767699409228198, 0.0072933993290411605] and parameters: {'n_layers': 2, 'embedding_dim': 256, 'lr': 0.0012100089708552634, 'lambda_val': 0.00020052239202191264, 'batch_size': 677, 'optimizer': 'Adam'}.
2026-07-02 22:36:12,755 - experiment_functions - INFO - Early stopping at epoch 1150. Best Metrics: (0.00702939828479224, 0.0018141063389244536, 0.004188265988822694)
2026-07-02 22:36:12,845 - optuna.study.study - INFO - Trial 209 finished with values: [0.00702939828479224, 0.0018141063389244536, 0.004188265988822694] and parameters: {'n_layers': 3, 'embedding_dim': 256, 'lr': 0.0005166576163232293, 'lambda_val': 0.010996021647210663, 'batch_size': 3332, 'optimizer': 'Adam'}.
2026-07-02 22:42:32,319 - optuna.study.study - INFO - Trial 210 finished with values: [0.013619457545316922, 0.0030991774784871686, 0.008287139905506957] and parameters: {'n_layers': 3, 'embedding_dim': 96, 'lr': 0.0005152458540342933, 'lambda_val': 9.00355461091747e-05, 'batch_size': 781, 'optimizer': 'RMSprop'}.
2026-07-02 22:48:55,074 - optuna.study.study - INFO - Trial 211 finished with values: [0.016598027401733995, 0.0038789582660562656, 0.010381638312949906] and parameters: {'n_layers': 1, 'embedding_dim': 256, 'lr': 0.0005152458540342933, 'lambda_val': 0.0012545102603406476, 'batch_size': 2391, 'optimizer': 'Adam'}.
2026-07-02 22:53:21,611 - experiment_functions - INFO - Early stopping at epoch 2950. Best Metrics: (0.01383032273278707, 0.0031352696464867127, 0.008095624822665515)
