2026-07-02 08:40:35,334 - optuna.study.study - INFO - Trial 223 finished with values: [0.0018088871677695937, 0.000544231901677336, 0.0013109146125009513] and parameters: {'n_layers': 3, 'embedding_dim': 128, 'lr': 0.00042777516068918454, 'lambda_val': 0.008265752694310466, 'batch_size': 2880, 'optimizer': 'RMSprop'}.
2026-07-02 08:45:44,102 - optuna.study.study - INFO - Trial 224 finished with values: [0.0019385354215048119, 0.0004995915886252683, 0.0012842848762892665] and parameters: {'n_layers': 3, 'embedding_dim': 64, 'lr': 0.0005312143499496538, 'lambda_val': 2.188289071859108e-05, 'batch_size': 2099, 'optimizer': 'Adam'}.
2026-07-02 08:50:53,879 - optuna.study.study - INFO - Trial 225 finished with values: [0.0020693631649175777, 0.0005356837566248125, 0.0014602063925601208] and parameters: {'n_layers': 3, 'embedding_dim': 64, 'lr': 0.0005054275041431983, 'lambda_val': 1.3509843414861852e-06, 'batch_size': 3579, 'optimizer': 'Adam'}.
2026-07-02 08:51:49,734 - experiment_functions - INFO - Early stopping at epoch 600. Best Metrics: (0.0019105187099400802, 0.0005603783978876584, 0.001273291178392701)
2026-07-02 08:51:49,847 - optuna.study.study - INFO - Trial 226 finished with values: [0.0019105187099400802, 0.0005603783978876584, 0.001273291178392701] and parameters: {'n_layers': 4, 'embedding_dim': 128, 'lr': 0.01321022891213974, 'lambda_val': 0.00010877216929113007, 'batch_size': 3621, 'optimizer': 'Adam'}.
2026-07-02 08:53:15,597 - experiment_functions - INFO - Early stopping at epoch 800. Best Metrics: (0.002171330041725428, 0.0006553577873601429, 0.0014821461206230117)
2026-07-02 08:53:15,685 - optuna.study.study - INFO - Trial 227 finished with values: [0.002171330041725428, 0.0006553577873601429, 0.0014821461206230117] and parameters: {'n_layers': 4, 'embedding_dim': 256, 'lr': 0.004152271479480873, 'lambda_val': 2.188289071859108e-05, 'batch_size': 2754, 'optimizer': 'RMSprop'}.
2026-07-02 08:54:14,012 - experiment_functions - INFO - Early stopping at epoch 650. Best Metrics: (0.002152716533871468, 0.0006430104667287199, 0.001403201329484298)
2026-07-02 08:54:14,112 - optuna.study.study - INFO - Trial 228 finished with values: [0.002152716533871468, 0.0006430104667287199, 0.001403201329484298] and parameters: {'n_layers': 3, 'embedding_dim': 128, 'lr': 0.004562468343132884, 'lambda_val': 1.2112627410590521e-05, 'batch_size': 2880, 'optimizer': 'RMSprop'}.
2026-07-02 08:55:19,476 - experiment_functions - INFO - Early stopping at epoch 600. Best Metrics: (0.0021124313596939544, 0.0006344623216761963, 0.0014476482444988987)
2026-07-02 08:55:19,785 - optuna.study.study - INFO - Trial 229 finished with values: [0.0021124313596939544, 0.0006344623216761963, 0.0014476482444988987] and parameters: {'n_layers': 4, 'embedding_dim': 256, 'lr': 0.003175598950751376, 'lambda_val': 0.00021406239676046432, 'batch_size': 2403, 'optimizer': 'RMSprop'}.
2026-07-02 08:56:37,694 - experiment_functions - INFO - Early stopping at epoch 950. Best Metrics: (0.002709439002137357, 0.0007807305814638223, 0.0018059738099589643)
2026-07-02 08:56:37,783 - optuna.study.study - INFO - Trial 230 finished with values: [0.002709439002137357, 0.0007807305814638223, 0.0018059738099589643] and parameters: {'n_layers': 4, 'embedding_dim': 64, 'lr': 0.0028258902906977677, 'lambda_val': 1.0477656620736208e-06, 'batch_size': 2302, 'optimizer': 'RMSprop'}.
2026-07-02 08:58:49,868 - experiment_functions - INFO - Early stopping at epoch 1650. Best Metrics: (0.002770355630846423, 0.0008310696578842393, 0.0019166590502302842)
2026-07-02 08:58:49,983 - optuna.study.study - INFO - Trial 231 finished with values: [0.002770355630846423, 0.0008310696578842393, 0.0019166590502302842] and parameters: {'n_layers': 4, 'embedding_dim': 64, 'lr': 0.0014374939555211086, 'lambda_val': 0.00010858880627123378, 'batch_size': 2223, 'optimizer': 'RMSprop'}.
2026-07-02 09:05:20,066 - optuna.study.study - INFO - Trial 232 finished with values: [0.0004190384464825992, 0.00010447732841973293, 0.0002137067540415201] and parameters: {'n_layers': 3, 'embedding_dim': 256, 'lr': 8.626742388359102e-05, 'lambda_val': 2.188289071859108e-05, 'batch_size': 3749, 'optimizer': 'Adam'}.
2026-07-02 09:06:11,399 - experiment_functions - INFO - Early stopping at epoch 550. Best Metrics: (0.0019409619815218845, 0.0005518302528351349, 0.0013280730212391926)
2026-07-02 09:06:11,501 - optuna.study.study - INFO - Trial 233 finished with values: [0.0019409619815218845, 0.0005518302528351349, 0.0013280730212391926] and parameters: {'n_layers': 4, 'embedding_dim': 128, 'lr': 0.014582350289404945, 'lambda_val': 0.00010877216929113007, 'batch_size': 3749, 'optimizer': 'RMSprop'}.
2026-07-02 09:07:06,196 - experiment_functions - INFO - Early stopping at epoch 650. Best Metrics: (0.002022148975546353, 0.0005632277795718329, 0.001383092782148169)
2026-07-02 09:07:07,175 - optuna.study.study - INFO - Trial 234 finished with values: [0.002022148975546353, 0.0005632277795718329, 0.001383092782148169] and parameters: {'n_layers': 4, 'embedding_dim': 64, 'lr': 0.012943330980207375, 'lambda_val': 5.9712928804209935e-06, 'batch_size': 2302, 'optimizer': 'Adam'}.
2026-07-02 09:07:54,244 - experiment_functions - INFO - Early stopping at epoch 550. Best Metrics: (0.0014672462416430636, 0.00039606405410026025, 0.0010077191781723814)
2026-07-02 09:07:54,332 - optuna.study.study - INFO - Trial 235 finished with values: [0.0014672462416430636, 0.00039606405410026025, 0.0010077191781723814] and parameters: {'n_layers': 4, 'embedding_dim': 64, 'lr': 0.048378799109923175, 'lambda_val': 1.8310592897560325e-05, 'batch_size': 3308, 'optimizer': 'RMSprop'}.
2026-07-02 09:09:42,005 - experiment_functions - INFO - Early stopping at epoch 1000. Best Metrics: (0.002362086905325659, 0.0006905001614649621, 0.0015862572227867517)
2026-07-02 09:09:42,103 - optuna.study.study - INFO - Trial 236 finished with values: [0.002362086905325659, 0.0006905001614649621, 0.0015862572227867517] and parameters: {'n_layers': 4, 'embedding_dim': 256, 'lr': 0.0028258902906977677, 'lambda_val': 1.0477656620736208e-06, 'batch_size': 3749, 'optimizer': 'Adam'}.
2026-07-02 09:15:00,257 - experiment_functions - INFO - Early stopping at epoch 3850. Best Metrics: (0.000304008530106128, 7.503371768326272e-05, 0.00018140961778495928)
2026-07-02 09:15:00,344 - optuna.study.study - INFO - Trial 237 finished with values: [0.000304008530106128, 7.503371768326272e-05, 0.00018140961778495928] and parameters: {'n_layers': 4, 'embedding_dim': 96, 'lr': 4.4259766314290274e-05, 'lambda_val': 0.00033122929111008466, 'batch_size': 2818, 'optimizer': 'Adam'}.
2026-07-02 09:15:51,839 - experiment_functions - INFO - Early stopping at epoch 550. Best Metrics: (0.002020674509681637, 0.0005831734513610547, 0.0013858953014775951)
2026-07-02 09:15:51,962 - optuna.study.study - INFO - Trial 238 finished with values: [0.002020674509681637, 0.0005831734513610547, 0.0013858953014775951] and parameters: {'n_layers': 4, 'embedding_dim': 128, 'lr': 0.014582350289404945, 'lambda_val': 1.5990539279825177e-06, 'batch_size': 1889, 'optimizer': 'RMSprop'}.
2026-07-02 09:17:49,460 - experiment_functions - INFO - Early stopping at epoch 1500. Best Metrics: (0.002664475724480254, 0.0007322910928328553, 0.0018622232442402206)
2026-07-02 09:17:50,174 - optuna.study.study - INFO - Trial 239 finished with values: [0.002664475724480254, 0.0007322910928328553, 0.0018622232442402206] and parameters: {'n_layers': 3, 'embedding_dim': 64, 'lr': 0.0014374939555211086, 'lambda_val': 2.2254265826758908e-06, 'batch_size': 2754, 'optimizer': 'RMSprop'}.
2026-07-02 09:19:38,861 - experiment_functions - INFO - Early stopping at epoch 1350. Best Metrics: (0.0027740655579589005, 0.0008054252227266683, 0.001914283981057047)
2026-07-02 09:19:38,950 - optuna.study.study - INFO - Trial 240 finished with values: [0.0027740655579589005, 0.0008054252227266683, 0.001914283981057047] and parameters: {'n_layers': 4, 'embedding_dim': 64, 'lr': 0.0014374939555211086, 'lambda_val': 1.8310592897560325e-05, 'batch_size': 2754, 'optimizer': 'RMSprop'}.
2026-07-02 09:20:28,712 - experiment_functions - INFO - Early stopping at epoch 550. Best Metrics: (0.0015750249979701566, 0.0004957924130463689, 0.0010938333139198979)
2026-07-02 09:20:28,803 - optuna.study.study - INFO - Trial 241 finished with values: [0.0015750249979701566, 0.0004957924130463689, 0.0010938333139198979] and parameters: {'n_layers': 3, 'embedding_dim': 128, 'lr': 0.004562468343132884, 'lambda_val': 0.008265752694310466, 'batch_size': 2880, 'optimizer': 'RMSprop'}.
2026-07-02 09:21:47,185 - experiment_functions - INFO - Early stopping at epoch 950. Best Metrics: (0.0023585004189033815, 0.000667705107991566, 0.0015868565405808875)
2026-07-02 09:21:47,574 - optuna.study.study - INFO - Trial 242 finished with values: [0.0023585004189033815, 0.000667705107991566, 0.0015868565405808875] and parameters: {'n_layers': 4, 'embedding_dim': 64, 'lr': 0.004152271479480873, 'lambda_val': 0.00010858880627123378, 'batch_size': 2403, 'optimizer': 'Adam'}.
2026-07-02 09:23:17,427 - experiment_functions - INFO - Early stopping at epoch 1150. Best Metrics: (0.00019834314166955244, 5.5088045894041e-05, 0.00012052291913192593)
2026-07-02 09:23:17,542 - optuna.study.study - INFO - Trial 243 finished with values: [0.00019834314166955244, 5.5088045894041e-05, 0.00012052291913192593] and parameters: {'n_layers': 1, 'embedding_dim': 96, 'lr': 1.36220901583558e-05, 'lambda_val': 0.00010877216929113007, 'batch_size': 3798, 'optimizer': 'RMSprop'}.
2026-07-02 09:24:40,156 - experiment_functions - INFO - Early stopping at epoch 950. Best Metrics: (0.0022384556558942676, 0.0006923997492544119, 0.001606423701446405)
2026-07-02 09:24:40,267 - optuna.study.study - INFO - Trial 244 finished with values: [0.0022384556558942676, 0.0006923997492544119, 0.001606423701446405] and parameters: {'n_layers': 4, 'embedding_dim': 96, 'lr': 0.0028258902906977677, 'lambda_val': 0.00010877216929113007, 'batch_size': 3749, 'optimizer': 'Adam'}.
2026-07-02 09:30:29,394 - optuna.study.study - INFO - Trial 245 finished with values: [0.002559047267824679, 0.0007588853218851509, 0.0017620454748582513] and parameters: {'n_layers': 4, 'embedding_dim': 128, 'lr': 0.0005462517735220497, 'lambda_val': 1.0477656620736208e-06, 'batch_size': 2099, 'optimizer': 'Adam'}.
2026-07-02 09:32:02,506 - experiment_functions - INFO - Early stopping at epoch 1150. Best Metrics: (0.0019918134361092857, 0.0005622779856771082, 0.0013714679743090333)
2026-07-02 09:32:02,592 - optuna.study.study - INFO - Trial 246 finished with values: [0.0019918134361092857, 0.0005622779856771082, 0.0013714679743090333] and parameters: {'n_layers': 2, 'embedding_dim': 96, 'lr': 0.0028258902906977677, 'lambda_val': 2.188289071859108e-05, 'batch_size': 3749, 'optimizer': 'RMSprop'}.
2026-07-02 09:35:07,503 - experiment_functions - INFO - Early stopping at epoch 2500. Best Metrics: (0.0023193086530031684, 0.0005774746879927056, 0.0014543618244871976)
2026-07-02 09:35:07,578 - optuna.study.study - INFO - Trial 247 finished with values: [0.0023193086530031684, 0.0005774746879927056, 0.0014543618244871976] and parameters: {'n_layers': 2, 'embedding_dim': 32, 'lr': 0.0014374939555211086, 'lambda_val': 2.188289071859108e-05, 'batch_size': 2417, 'optimizer': 'RMSprop'}.
2026-07-02 09:36:45,674 - experiment_functions - INFO - Early stopping at epoch 1150. Best Metrics: (0.0028293417302159996, 0.0008253708945158901, 0.0018990256437322018)
2026-07-02 09:36:45,771 - optuna.study.study - INFO - Trial 248 finished with values: [0.0028293417302159996, 0.0008253708945158901, 0.0018990256437322018] and parameters: {'n_layers': 4, 'embedding_dim': 96, 'lr': 0.0028258902906977677, 'lambda_val': 1.0477656620736208e-06, 'batch_size': 1471, 'optimizer': 'RMSprop'}.
2026-07-02 09:39:23,890 - experiment_functions - INFO - Early stopping at epoch 1800. Best Metrics: (0.00023618434973666822, 6.173660315711492e-05, 0.00012248672615643014)
2026-07-02 09:39:24,007 - optuna.study.study - INFO - Trial 249 finished with values: [0.00023618434973666822, 6.173660315711492e-05, 0.00012248672615643014] and parameters: {'n_layers': 4, 'embedding_dim': 128, 'lr': 1.0072556873152325e-05, 'lambda_val': 0.00010877216929113007, 'batch_size': 2099, 'optimizer': 'Adam'}.
2026-07-02 09:45:10,402 - optuna.study.study - INFO - Trial 250 finished with values: [0.0007921581894633641, 0.0002184525957867143, 0.0005292587612735557] and parameters: {'n_layers': 4, 'embedding_dim': 128, 'lr': 0.00016501153256731936, 'lambda_val': 1.9954511607948486e-05, 'batch_size': 3470, 'optimizer': 'RMSprop'}.
2026-07-02 09:48:18,821 - experiment_functions - INFO - Early stopping at epoch 2250. Best Metrics: (0.003148685527057455, 0.0009156013145147502, 0.0022097282702467293)
2026-07-02 09:48:18,913 - optuna.study.study - INFO - Trial 251 finished with values: [0.003148685527057455, 0.0009156013145147502, 0.0022097282702467293] and parameters: {'n_layers': 4, 'embedding_dim': 96, 'lr': 0.0009577271711573342, 'lambda_val': 0.00020215338645287496, 'batch_size': 1819, 'optimizer': 'RMSprop'}.
2026-07-02 09:51:11,179 - experiment_functions - INFO - Early stopping at epoch 1950. Best Metrics: (0.002671589842364085, 0.0007721824364112989, 0.0016968218717066579)
2026-07-02 09:51:11,313 - optuna.study.study - INFO - Trial 252 finished with values: [0.002671589842364085, 0.0007721824364112989, 0.0016968218717066579] and parameters: {'n_layers': 4, 'embedding_dim': 128, 'lr': 0.0028258902906977677, 'lambda_val': 1.0477656620736208e-06, 'batch_size': 529, 'optimizer': 'Adam'}.
2026-07-02 09:53:43,883 - experiment_functions - INFO - Early stopping at epoch 1650. Best Metrics: (0.0021125189855977925, 0.0006249643827289479, 0.00147630020175419)
2026-07-02 09:53:43,975 - optuna.study.study - INFO - Trial 253 finished with values: [0.0021125189855977925, 0.0006249643827289479, 0.00147630020175419] and parameters: {'n_layers': 2, 'embedding_dim': 256, 'lr': 0.0014374939555211086, 'lambda_val': 2.188289071859108e-05, 'batch_size': 3506, 'optimizer': 'RMSprop'}.
2026-07-02 09:55:19,874 - experiment_functions - INFO - Early stopping at epoch 1200. Best Metrics: (0.0018504655949054523, 0.0004606500389415498, 0.0012239871280704544)
2026-07-02 09:55:19,970 - optuna.study.study - INFO - Trial 254 finished with values: [0.0018504655949054523, 0.0004606500389415498, 0.0012239871280704544] and parameters: {'n_layers': 1, 'embedding_dim': 128, 'lr': 0.003175598950751376, 'lambda_val': 0.00013041816739515328, 'batch_size': 1403, 'optimizer': 'RMSprop'}.
2026-07-02 09:57:10,513 - experiment_functions - INFO - Early stopping at epoch 1300. Best Metrics: (0.002683232234573306, 0.0008263206884106149, 0.0018797913549843262)
2026-07-02 09:57:10,602 - optuna.study.study - INFO - Trial 255 finished with values: [0.002683232234573306, 0.0008263206884106149, 0.0018797913549843262] and parameters: {'n_layers': 4, 'embedding_dim': 96, 'lr': 0.0028258902906977677, 'lambda_val': 1.0477656620736208e-06, 'batch_size': 1471, 'optimizer': 'RMSprop'}.
2026-07-02 09:59:04,090 - experiment_functions - INFO - Early stopping at epoch 1400. Best Metrics: (0.0028610085406338866, 0.0008291700700947895, 0.001974619838599045)
2026-07-02 09:59:04,178 - optuna.study.study - INFO - Trial 256 finished with values: [0.0028610085406338866, 0.0008291700700947895, 0.001974619838599045] and parameters: {'n_layers': 4, 'embedding_dim': 64, 'lr': 0.0014374939555211086, 'lambda_val': 1.0477656620736208e-06, 'batch_size': 3871, 'optimizer': 'RMSprop'}.
2026-07-02 10:01:39,320 - experiment_functions - INFO - Early stopping at epoch 1900. Best Metrics: (0.003266086560192424, 0.0008842581159888304, 0.0021361847043253513)
2026-07-02 10:01:39,569 - optuna.study.study - INFO - Trial 257 finished with values: [0.003266086560192424, 0.0008842581159888304, 0.0021361847043253513] and parameters: {'n_layers': 3, 'embedding_dim': 96, 'lr': 0.0014374939555211086, 'lambda_val': 2.188289071859108e-05, 'batch_size': 1298, 'optimizer': 'RMSprop'}.
2026-07-02 10:07:09,375 - optuna.study.study - INFO - Trial 258 finished with values: [0.0003816276442942416, 9.118021389358509e-05, 0.00021878473627425735] and parameters: {'n_layers': 4, 'embedding_dim': 96, 'lr': 9.12789802853505e-05, 'lambda_val': 1.0477656620736208e-06, 'batch_size': 3189, 'optimizer': 'RMSprop'}.
2026-07-02 10:10:39,942 - experiment_functions - INFO - Early stopping at epoch 2150. Best Metrics: (0.0026693184057797375, 0.0007721824364112989, 0.001781656321244133)
2026-07-02 10:10:40,851 - optuna.study.study - INFO - Trial 259 finished with values: [0.0026693184057797375, 0.0007721824364112989, 0.001781656321244133] and parameters: {'n_layers': 3, 'embedding_dim': 256, 'lr': 0.0014374939555211086, 'lambda_val': 1.2112627410590521e-05, 'batch_size': 2081, 'optimizer': 'RMSprop'}.
2026-07-02 10:12:00,572 - experiment_functions - INFO - Early stopping at epoch 950. Best Metrics: (0.0013182605054277783, 0.00039606405410026025, 0.0009546688021621768)
2026-07-02 10:12:00,666 - optuna.study.study - INFO - Trial 260 finished with values: [0.0013182605054277783, 0.00039606405410026025, 0.0009546688021621768] and parameters: {'n_layers': 3, 'embedding_dim': 96, 'lr': 0.0929793755499708, 'lambda_val': 1.3509843414861852e-06, 'batch_size': 3579, 'optimizer': 'RMSprop'}.
2026-07-02 10:17:35,317 - optuna.study.study - INFO - Trial 261 finished with values: [0.0023275648116229774, 0.0006002697414661019, 0.0016162841255093399] and parameters: {'n_layers': 3, 'embedding_dim': 128, 'lr': 0.00041855675189609784, 'lambda_val': 0.00010858880627123378, 'batch_size': 2403, 'optimizer': 'RMSprop'}.
2026-07-02 10:18:51,563 - experiment_functions - INFO - Early stopping at epoch 900. Best Metrics: (0.002302439933114742, 0.0006515586117812435, 0.0015651236372643943)
2026-07-02 10:18:51,640 - optuna.study.study - INFO - Trial 262 finished with values: [0.002302439933114742, 0.0006515586117812435, 0.0015651236372643943] and parameters: {'n_layers': 3, 'embedding_dim': 96, 'lr': 0.004152271479480873, 'lambda_val': 0.00010858880627123378, 'batch_size': 1471, 'optimizer': 'Adam'}.
2026-07-02 10:24:01,381 - optuna.study.study - INFO - Trial 263 finished with values: [0.003202895409421837, 0.0008880572915677299, 0.0021574504126563717] and parameters: {'n_layers': 3, 'embedding_dim': 64, 'lr': 0.0014374939555211086, 'lambda_val': 0.00010858880627123378, 'batch_size': 539, 'optimizer': 'RMSprop'}.
2026-07-02 10:25:05,625 - experiment_functions - INFO - Early stopping at epoch 700. Best Metrics: (0.0018387372357467912, 0.0005708261307296317, 0.001234845539437392)
2026-07-02 10:25:06,293 - optuna.study.study - INFO - Trial 264 finished with values: [0.0018387372357467912, 0.0005708261307296317, 0.001234845539437392] and parameters: {'n_layers': 4, 'embedding_dim': 128, 'lr': 0.0014374939555211086, 'lambda_val': 0.010019509367354342, 'batch_size': 3676, 'optimizer': 'RMSprop'}.
2026-07-02 10:27:05,895 - experiment_functions - INFO - Early stopping at epoch 1450. Best Metrics: (0.002305796139851664, 0.0006667553140968409, 0.0015556456343466145)
2026-07-02 10:27:05,975 - optuna.study.study - INFO - Trial 265 finished with values: [0.002305796139851664, 0.0006667553140968409, 0.0015556456343466145] and parameters: {'n_layers': 3, 'embedding_dim': 96, 'lr': 0.004152271479480873, 'lambda_val': 3.074529830564746e-05, 'batch_size': 811, 'optimizer': 'RMSprop'}.
2026-07-02 10:28:35,942 - experiment_functions - INFO - Early stopping at epoch 1150. Best Metrics: (0.0019261253329446314, 0.0005223866420986646, 0.001352120755238583)
2026-07-02 10:28:36,028 - optuna.study.study - INFO - Trial 266 finished with values: [0.0019261253329446314, 0.0005223866420986646, 0.001352120755238583] and parameters: {'n_layers': 2, 'embedding_dim': 64, 'lr': 0.0028258902906977677, 'lambda_val': 1.3509843414861852e-06, 'batch_size': 3749, 'optimizer': 'RMSprop'}.
2026-07-02 10:31:33,399 - experiment_functions - INFO - Early stopping at epoch 2000. Best Metrics: (0.0024972713121032995, 0.0007693330547271242, 0.0017323567433942162)
2026-07-02 10:31:34,602 - optuna.study.study - INFO - Trial 267 finished with values: [0.0024972713121032995, 0.0007693330547271242, 0.0017323567433942162] and parameters: {'n_layers': 4, 'embedding_dim': 128, 'lr': 0.0014374939555211086, 'lambda_val': 1.813908417584956e-06, 'batch_size': 2754, 'optimizer': 'Adam'}.
2026-07-02 10:33:27,672 - experiment_functions - INFO - Early stopping at epoch 1400. Best Metrics: (0.0029153997107565213, 0.0008586136808312597, 0.001939488127371815)
2026-07-02 10:33:27,767 - optuna.study.study - INFO - Trial 268 finished with values: [0.0029153997107565213, 0.0008586136808312597, 0.001939488127371815] and parameters: {'n_layers': 4, 'embedding_dim': 64, 'lr': 0.0014374939555211086, 'lambda_val': 0.00014878801252093954, 'batch_size': 2223, 'optimizer': 'RMSprop'}.
2026-07-02 10:34:59,721 - experiment_functions - INFO - Early stopping at epoch 1150. Best Metrics: (0.002201090033117163, 0.0006078680926239006, 0.0015155734695765088)
2026-07-02 10:34:59,849 - optuna.study.study - INFO - Trial 269 finished with values: [0.002201090033117163, 0.0006078680926239006, 0.0015155734695765088] and parameters: {'n_layers': 3, 'embedding_dim': 64, 'lr': 0.003175598950751376, 'lambda_val': 1.6529096514257592e-05, 'batch_size': 1740, 'optimizer': 'Adam'}.
2026-07-02 10:36:17,737 - experiment_functions - INFO - Early stopping at epoch 900. Best Metrics: (0.00227831040276407, 0.0006923997492544119, 0.0015534454265955535)
