2026-07-03 02:53:27,080 - optuna.study.study - INFO - Trial 267 finished with values: [0.01826008581322018, 0.004293068404156298, 0.011584031065240858] and parameters: {'n_layers': 1, 'embedding_dim': 256, 'lr': 0.0007787505453018097, 'lambda_val': 0.005299023139585472, 'batch_size': 3332, 'optimizer': 'Adam'}.
2026-07-03 02:58:35,531 - optuna.study.study - INFO - Trial 268 finished with values: [0.011444406544778513, 0.002784795699333245, 0.007131708846167826] and parameters: {'n_layers': 1, 'embedding_dim': 32, 'lr': 0.0005152458540342933, 'lambda_val': 0.00045598605516994004, 'batch_size': 2391, 'optimizer': 'Adam'}.
2026-07-03 03:00:38,033 - experiment_functions - INFO - Early stopping at epoch 1350. Best Metrics: (0.014051604376496206, 0.0033518226544839774, 0.008454223362231462)
2026-07-03 03:00:38,141 - optuna.study.study - INFO - Trial 269 finished with values: [0.014051604376496206, 0.0033518226544839774, 0.008454223362231462] and parameters: {'n_layers': 2, 'embedding_dim': 96, 'lr': 0.0006781284315626388, 'lambda_val': 0.0006598328418478489, 'batch_size': 3579, 'optimizer': 'RMSprop'}.
2026-07-03 03:06:56,692 - optuna.study.study - INFO - Trial 270 finished with values: [0.01666384881906451, 0.003999582090686321, 0.01061127661679387] and parameters: {'n_layers': 1, 'embedding_dim': 256, 'lr': 0.0005152458540342933, 'lambda_val': 9.00355461091747e-05, 'batch_size': 1541, 'optimizer': 'RMSprop'}.
2026-07-03 03:12:38,212 - optuna.study.study - INFO - Trial 271 finished with values: [0.016539363329118477, 0.003905552495108562, 0.010060276209967762] and parameters: {'n_layers': 2, 'embedding_dim': 64, 'lr': 0.00045784196880844456, 'lambda_val': 1.6046175410536033e-05, 'batch_size': 3796, 'optimizer': 'RMSprop'}.
2026-07-03 03:18:20,607 - optuna.study.study - INFO - Trial 272 finished with values: [0.016646816318935977, 0.003831468571320023, 0.010051332180897304] and parameters: {'n_layers': 2, 'embedding_dim': 64, 'lr': 0.0006781284315626388, 'lambda_val': 5.288093815108994e-05, 'batch_size': 3269, 'optimizer': 'RMSprop'}.
2026-07-03 03:24:44,008 - optuna.study.study - INFO - Trial 273 finished with values: [0.016777693511130877, 0.003969188686055126, 0.01050673830914472] and parameters: {'n_layers': 1, 'embedding_dim': 256, 'lr': 0.0007787505453018097, 'lambda_val': 0.005299023139585472, 'batch_size': 1891, 'optimizer': 'Adam'}.
2026-07-03 03:25:29,292 - experiment_functions - INFO - Early stopping at epoch 500. Best Metrics: (0.0002069839615010708, 5.698763368349067e-05, 0.00011533363732835908)
2026-07-03 03:25:29,437 - optuna.study.study - INFO - Trial 274 finished with values: [0.0002069839615010708, 5.698763368349067e-05, 0.00011533363732835908] and parameters: {'n_layers': 2, 'embedding_dim': 64, 'lr': 0.0005152458540342933, 'lambda_val': 5.288093815108994e-05, 'batch_size': 3269, 'optimizer': 'SGD'}.
2026-07-03 03:27:43,197 - experiment_functions - INFO - Early stopping at epoch 1200. Best Metrics: (0.011806245520931033, 0.002849381684174534, 0.007274086611092231)
2026-07-03 03:27:43,628 - optuna.study.study - INFO - Trial 275 finished with values: [0.011806245520931033, 0.002849381684174534, 0.007274086611092231] and parameters: {'n_layers': 2, 'embedding_dim': 256, 'lr': 0.0005693523871630874, 'lambda_val': 0.005299023139585472, 'batch_size': 3332, 'optimizer': 'RMSprop'}.
2026-07-03 03:33:20,073 - experiment_functions - INFO - Early stopping at epoch 3950. Best Metrics: (0.012692833128303943, 0.0030250935546986307, 0.007561461930682258)
2026-07-03 03:33:20,173 - optuna.study.study - INFO - Trial 276 finished with values: [0.012692833128303943, 0.0030250935546986307, 0.007561461930682258] and parameters: {'n_layers': 2, 'embedding_dim': 64, 'lr': 0.0005693523871630874, 'lambda_val': 0.005299023139585472, 'batch_size': 1170, 'optimizer': 'Adam'}.
2026-07-03 03:34:17,921 - experiment_functions - INFO - Early stopping at epoch 500. Best Metrics: (0.00019387412565614038, 5.0339076420416775e-05, 0.00011939265293579567)
2026-07-03 03:34:18,051 - optuna.study.study - INFO - Trial 277 finished with values: [0.00019387412565614038, 5.0339076420416775e-05, 0.00011939265293579567] and parameters: {'n_layers': 2, 'embedding_dim': 256, 'lr': 0.00014142010890183827, 'lambda_val': 0.0004266548063750315, 'batch_size': 1092, 'optimizer': 'Adam'}.
2026-07-03 03:35:06,594 - experiment_functions - INFO - Early stopping at epoch 500. Best Metrics: (0.0002377534639006598, 6.458598484128944e-05, 0.00013132131770475101)
2026-07-03 03:35:06,681 - optuna.study.study - INFO - Trial 278 finished with values: [0.0002377534639006598, 6.458598484128944e-05, 0.00013132131770475101] and parameters: {'n_layers': 2, 'embedding_dim': 128, 'lr': 0.0005152458540342933, 'lambda_val': 0.0013701200929940348, 'batch_size': 1170, 'optimizer': 'SGD'}.
2026-07-03 03:43:18,770 - optuna.study.study - INFO - Trial 279 finished with values: [0.01688913973110831, 0.003819121250688601, 0.010132028585110468] and parameters: {'n_layers': 3, 'embedding_dim': 256, 'lr': 0.0005693523871630874, 'lambda_val': 5.288093815108994e-05, 'batch_size': 1948, 'optimizer': 'Adam'}.
2026-07-03 03:48:40,941 - optuna.study.study - INFO - Trial 280 finished with values: [0.017154885600984996, 0.004127804266474176, 0.010655348826259787] and parameters: {'n_layers': 1, 'embedding_dim': 64, 'lr': 0.0007787505453018097, 'lambda_val': 0.0012545102603406476, 'batch_size': 2019, 'optimizer': 'Adam'}.
2026-07-03 03:49:24,241 - experiment_functions - INFO - Early stopping at epoch 500. Best Metrics: (0.00023357028435132474, 6.458598484128944e-05, 0.0001380232461754811)
2026-07-03 03:49:24,313 - optuna.study.study - INFO - Trial 281 finished with values: [0.00023357028435132474, 6.458598484128944e-05, 0.0001380232461754811] and parameters: {'n_layers': 2, 'embedding_dim': 32, 'lr': 0.0005693523871630874, 'lambda_val': 0.00020052239202191264, 'batch_size': 3756, 'optimizer': 'SGD'}.
2026-07-03 03:54:56,245 - experiment_functions - INFO - Early stopping at epoch 3050. Best Metrics: (0.015476893976206284, 0.003632011853427806, 0.009522856005162353)
2026-07-03 03:54:56,338 - optuna.study.study - INFO - Trial 282 finished with values: [0.015476893976206284, 0.003632011853427806, 0.009522856005162353] and parameters: {'n_layers': 2, 'embedding_dim': 256, 'lr': 0.0005152458540342933, 'lambda_val': 0.0012545102603406476, 'batch_size': 2391, 'optimizer': 'RMSprop'}.
2026-07-03 03:55:41,765 - experiment_functions - INFO - Early stopping at epoch 500. Best Metrics: (0.0002748211738013051, 6.17366031571149e-05, 0.0001724965217564935)
2026-07-03 03:55:41,897 - optuna.study.study - INFO - Trial 283 finished with values: [0.0002748211738013051, 6.17366031571149e-05, 0.0001724965217564935] and parameters: {'n_layers': 2, 'embedding_dim': 64, 'lr': 0.07599826213217221, 'lambda_val': 9.00355461091747e-05, 'batch_size': 3269, 'optimizer': 'SGD'}.
2026-07-03 03:58:41,850 - experiment_functions - INFO - Early stopping at epoch 2100. Best Metrics: (0.01435034560572717, 0.003314780692589709, 0.008643333155575783)
2026-07-03 03:58:41,938 - optuna.study.study - INFO - Trial 284 finished with values: [0.01435034560572717, 0.003314780692589709, 0.008643333155575783] and parameters: {'n_layers': 2, 'embedding_dim': 64, 'lr': 0.0006781284315626388, 'lambda_val': 0.0013701200929940348, 'batch_size': 981, 'optimizer': 'RMSprop'}.
2026-07-03 04:03:52,513 - optuna.study.study - INFO - Trial 285 finished with values: [0.01330379136757459, 0.0032131527458541496, 0.008153321026123345] and parameters: {'n_layers': 1, 'embedding_dim': 32, 'lr': 0.0005152458540342933, 'lambda_val': 9.00355461091747e-05, 'batch_size': 3332, 'optimizer': 'Adam'}.
2026-07-03 04:04:56,827 - experiment_functions - INFO - Early stopping at epoch 500. Best Metrics: (0.00025899192895033856, 5.793742757821552e-05, 0.00015759990172121838)
2026-07-03 04:04:56,900 - optuna.study.study - INFO - Trial 286 finished with values: [0.00025899192895033856, 5.793742757821552e-05, 0.00015759990172121838] and parameters: {'n_layers': 3, 'embedding_dim': 256, 'lr': 8.017570047082469e-05, 'lambda_val': 0.00020052239202191264, 'batch_size': 2340, 'optimizer': 'RMSprop'}.
2026-07-03 04:07:00,508 - experiment_functions - INFO - Early stopping at epoch 1500. Best Metrics: (0.016713330060600745, 0.0038732595026879173, 0.010426110993877871)
2026-07-03 04:07:00,600 - optuna.study.study - INFO - Trial 287 finished with values: [0.016713330060600745, 0.0038732595026879173, 0.010426110993877871] and parameters: {'n_layers': 1, 'embedding_dim': 64, 'lr': 0.0012100089708552634, 'lambda_val': 0.005299023139585472, 'batch_size': 3332, 'optimizer': 'Adam'}.
2026-07-03 04:13:21,432 - optuna.study.study - INFO - Trial 288 finished with values: [0.012817771078363368, 0.003045989020382577, 0.008030702400002762] and parameters: {'n_layers': 1, 'embedding_dim': 256, 'lr': 0.00046308506967561187, 'lambda_val': 5.288093815108994e-05, 'batch_size': 1891, 'optimizer': 'Adam'}.
2026-07-03 04:18:40,017 - experiment_functions - INFO - Early stopping at epoch 3550. Best Metrics: (0.015549666421260114, 0.003705145983321619, 0.009361504448992678)
2026-07-03 04:18:40,103 - optuna.study.study - INFO - Trial 289 finished with values: [0.015549666421260114, 0.003705145983321619, 0.009361504448992678] and parameters: {'n_layers': 2, 'embedding_dim': 96, 'lr': 0.0005152458540342933, 'lambda_val': 0.0013701200929940348, 'batch_size': 2391, 'optimizer': 'Adam'}.
2026-07-03 04:24:22,090 - optuna.study.study - INFO - Trial 290 finished with values: [0.01587078258854029, 0.003840016716372547, 0.00978138818594157] and parameters: {'n_layers': 2, 'embedding_dim': 64, 'lr': 0.00045784196880844456, 'lambda_val': 9.00355461091747e-05, 'batch_size': 3269, 'optimizer': 'Adam'}.
2026-07-03 04:28:20,455 - experiment_functions - INFO - Early stopping at epoch 2550. Best Metrics: (0.01600765154088985, 0.0037288908306897404, 0.009740712328593151)
2026-07-03 04:28:20,546 - optuna.study.study - INFO - Trial 291 finished with values: [0.01600765154088985, 0.0037288908306897404, 0.009740712328593151] and parameters: {'n_layers': 2, 'embedding_dim': 128, 'lr': 0.0005152458540342933, 'lambda_val': 0.00020052239202191264, 'batch_size': 2371, 'optimizer': 'RMSprop'}.
2026-07-03 04:34:03,554 - optuna.study.study - INFO - Trial 292 finished with values: [0.016638194835343557, 0.003893205174477138, 0.009831970785656893] and parameters: {'n_layers': 2, 'embedding_dim': 64, 'lr': 0.0006781284315626388, 'lambda_val': 7.985696748203348e-05, 'batch_size': 2780, 'optimizer': 'Adam'}.
2026-07-03 04:40:28,398 - optuna.study.study - INFO - Trial 293 finished with values: [0.017637239687466687, 0.004251277472788405, 0.011182787404887252] and parameters: {'n_layers': 1, 'embedding_dim': 256, 'lr': 0.0005693523871630874, 'lambda_val': 0.0012545102603406476, 'batch_size': 2517, 'optimizer': 'Adam'}.
2026-07-03 04:45:52,173 - optuna.study.study - INFO - Trial 294 finished with values: [0.019168242291924698, 0.00449537450373269, 0.01187777010294704] and parameters: {'n_layers': 1, 'embedding_dim': 64, 'lr': 0.0007787505453018097, 'lambda_val': 8.049469981121346e-05, 'batch_size': 3659, 'optimizer': 'Adam'}.
2026-07-03 04:52:13,281 - optuna.study.study - INFO - Trial 295 finished with values: [0.012092942690740452, 0.0029415116919628437, 0.0077161674992240435] and parameters: {'n_layers': 1, 'embedding_dim': 256, 'lr': 0.0005693523871630874, 'lambda_val': 0.0012545102603406476, 'batch_size': 1092, 'optimizer': 'Adam'}.
2026-07-03 04:55:32,979 - experiment_functions - INFO - Early stopping at epoch 1800. Best Metrics: (0.013557792598143496, 0.003280588112379614, 0.008468711208624245)
2026-07-03 04:55:33,113 - optuna.study.study - INFO - Trial 296 finished with values: [0.013557792598143496, 0.003280588112379614, 0.008468711208624245] and parameters: {'n_layers': 2, 'embedding_dim': 256, 'lr': 0.0005693523871630874, 'lambda_val': 0.005299023139585472, 'batch_size': 3332, 'optimizer': 'Adam'}.
2026-07-03 04:57:52,096 - experiment_functions - INFO - Early stopping at epoch 1250. Best Metrics: (0.015293444730350868, 0.003499040708166328, 0.00923839500666667)
2026-07-03 04:57:52,181 - optuna.study.study - INFO - Trial 297 finished with values: [0.015293444730350868, 0.003499040708166328, 0.00923839500666667] and parameters: {'n_layers': 2, 'embedding_dim': 256, 'lr': 0.0006781284315626388, 'lambda_val': 0.0004266548063750315, 'batch_size': 2278, 'optimizer': 'RMSprop'}.
2026-07-03 05:03:15,126 - optuna.study.study - INFO - Trial 298 finished with values: [0.016824226017545452, 0.003994833121212698, 0.010492284337385737] and parameters: {'n_layers': 1, 'embedding_dim': 64, 'lr': 0.0007787505453018097, 'lambda_val': 6.96123788111646e-06, 'batch_size': 1821, 'optimizer': 'Adam'}.
2026-07-03 05:09:35,039 - optuna.study.study - INFO - Trial 299 finished with values: [0.014215931538488696, 0.003308132135326634, 0.008264595501599924] and parameters: {'n_layers': 4, 'embedding_dim': 64, 'lr': 0.00045784196880844456, 'lambda_val': 2.3467434467462208e-05, 'batch_size': 2340, 'optimizer': 'RMSprop'}.
2026-07-03 05:09:35,055 - root - INFO - Selected Trial 262 based on Max ndcg: 0.0131
2026-07-03 05:09:35,055 - root - INFO - Associated Recall: 0.0207
2026-07-03 05:09:35,055 - experiment_functions - INFO - Training the best model ... for e_amazon_1c1dcs
2026-07-03 05:16:01,263 - root - INFO -   **** Training e_amazon_1c1dcs_rand1
2026-07-03 05:16:01,571 - root - INFO -   **** Getting 858585/2429444 random edges
2026-07-03 05:16:02,084 - optuna.storages._rdb.storage - INFO - A new study created in RDB with name: Study_e_amazon_1c1dcs_rand1
2026-07-03 05:22:11,237 - optuna.study.study - INFO - Trial 0 finished with values: [0.007600995729633166, 0.0019185836673441864, 0.004659785710914453] and parameters: {'n_layers': 4, 'embedding_dim': 96, 'lr': 0.000255879508728056, 'lambda_val': 0.00027900648211190204, 'batch_size': 1979, 'optimizer': 'Adam'}.
2026-07-03 05:22:59,646 - experiment_functions - INFO - Early stopping at epoch 500. Best Metrics: (0.00025561058941128896, 6.933495431491366e-05, 0.00015136632114535984)
2026-07-03 05:22:59,741 - optuna.study.study - INFO - Trial 1 finished with values: [0.00025561058941128896, 6.933495431491366e-05, 0.00015136632114535984] and parameters: {'n_layers': 1, 'embedding_dim': 256, 'lr': 0.011126263210365092, 'lambda_val': 8.791409734776828e-06, 'batch_size': 788, 'optimizer': 'SGD'}.
2026-07-03 05:25:05,098 - experiment_functions - INFO - Early stopping at epoch 1600. Best Metrics: (0.0018594501128276519, 0.0006164162376764243, 0.0012652766451183074)
2026-07-03 05:25:05,172 - optuna.study.study - INFO - Trial 2 finished with values: [0.0018594501128276519, 0.0006164162376764243, 0.0012652766451183074] and parameters: {'n_layers': 1, 'embedding_dim': 64, 'lr': 0.09103503079318301, 'lambda_val': 6.451410394190748e-06, 'batch_size': 838, 'optimizer': 'RMSprop'}.
2026-07-03 05:30:30,458 - experiment_functions - INFO - Early stopping at epoch 3900. Best Metrics: (0.00548321431300045, 0.0015149212620861273, 0.0034586064750814927)
2026-07-03 05:30:30,530 - optuna.study.study - INFO - Trial 3 finished with values: [0.00548321431300045, 0.0015149212620861273, 0.0034586064750814927] and parameters: {'n_layers': 3, 'embedding_dim': 64, 'lr': 0.0005027312526223404, 'lambda_val': 0.015163515739882642, 'batch_size': 3981, 'optimizer': 'Adam'}.
2026-07-03 05:31:24,560 - experiment_functions - INFO - Early stopping at epoch 550. Best Metrics: (0.0002109374820943102, 6.173660315711492e-05, 0.0001260091260422956)
2026-07-03 05:31:24,641 - optuna.study.study - INFO - Trial 4 finished with values: [0.0002109374820943102, 6.173660315711492e-05, 0.0001260091260422956] and parameters: {'n_layers': 1, 'embedding_dim': 256, 'lr': 6.647367087318159e-05, 'lambda_val': 0.08055207883692107, 'batch_size': 827, 'optimizer': 'Adam'}.
2026-07-03 05:35:03,361 - experiment_functions - INFO - Early stopping at epoch 1750. Best Metrics: (0.00025025642323917816, 6.268639705183976e-05, 0.00013545285509293)
2026-07-03 05:35:03,467 - optuna.study.study - INFO - Trial 5 finished with values: [0.00025025642323917816, 6.268639705183976e-05, 0.00013545285509293] and parameters: {'n_layers': 4, 'embedding_dim': 256, 'lr': 3.8871895478957114e-05, 'lambda_val': 5.904534764337884e-05, 'batch_size': 1525, 'optimizer': 'Adam'}.
2026-07-03 05:37:19,778 - experiment_functions - INFO - Early stopping at epoch 1450. Best Metrics: (0.003479082519213085, 0.000899454818304428, 0.0020741855212539463)
2026-07-03 05:37:19,853 - optuna.study.study - INFO - Trial 6 finished with values: [0.003479082519213085, 0.000899454818304428, 0.0020741855212539463] and parameters: {'n_layers': 1, 'embedding_dim': 256, 'lr': 0.003942474684271309, 'lambda_val': 0.06788703773680012, 'batch_size': 2210, 'optimizer': 'Adam'}.
2026-07-03 05:38:23,923 - experiment_functions - INFO - Early stopping at epoch 500. Best Metrics: (0.000299937171633707, 7.313412989381305e-05, 0.00017292170911562544)
2026-07-03 05:38:24,614 - optuna.study.study - INFO - Trial 7 finished with values: [0.000299937171633707, 7.313412989381305e-05, 0.00017292170911562544] and parameters: {'n_layers': 4, 'embedding_dim': 256, 'lr': 0.05999243777213477, 'lambda_val': 3.0397104734720642e-05, 'batch_size': 770, 'optimizer': 'SGD'}.
2026-07-03 05:39:14,448 - experiment_functions - INFO - Early stopping at epoch 550. Best Metrics: (0.006964752373055138, 0.0016554907585054047, 0.004238963756382526)
2026-07-03 05:39:14,538 - optuna.study.study - INFO - Trial 8 finished with values: [0.006964752373055138, 0.0016554907585054047, 0.004238963756382526] and parameters: {'n_layers': 2, 'embedding_dim': 96, 'lr': 0.06243657955169784, 'lambda_val': 3.7175116690643465e-05, 'batch_size': 3839, 'optimizer': 'Adam'}.
2026-07-03 05:41:07,483 - experiment_functions - INFO - Early stopping at epoch 1450. Best Metrics: (0.0001771331347750502, 4.748969473624224e-05, 0.00010062295733278771)
2026-07-03 05:41:07,572 - optuna.study.study - INFO - Trial 9 finished with values: [0.0001771331347750502, 4.748969473624224e-05, 0.00010062295733278771] and parameters: {'n_layers': 2, 'embedding_dim': 32, 'lr': 4.191600418761623e-05, 'lambda_val': 1.2475091715216112e-06, 'batch_size': 2286, 'optimizer': 'RMSprop'}.
2026-07-03 05:48:44,268 - optuna.study.study - INFO - Trial 10 finished with values: [0.01787964143803297, 0.0038837072355298904, 0.010197397826258453] and parameters: {'n_layers': 3, 'embedding_dim': 256, 'lr': 0.0014333316079584322, 'lambda_val': 7.33580764656977e-05, 'batch_size': 3121, 'optimizer': 'RMSprop'}.
2026-07-03 05:56:22,445 - optuna.study.study - INFO - Trial 11 finished with values: [0.014877342578875853, 0.003604467830480786, 0.00893084874896549] and parameters: {'n_layers': 3, 'embedding_dim': 256, 'lr': 0.0005924494216455263, 'lambda_val': 4.982512602626827e-06, 'batch_size': 1561, 'optimizer': 'Adam'}.
2026-07-03 05:57:04,607 - experiment_functions - INFO - Early stopping at epoch 500. Best Metrics: (0.00023469411522204068, 5.7937427578215534e-05, 0.0001393100752643507)
2026-07-03 05:57:04,691 - optuna.study.study - INFO - Trial 12 finished with values: [0.00023469411522204068, 5.7937427578215534e-05, 0.0001393100752643507] and parameters: {'n_layers': 1, 'embedding_dim': 64, 'lr': 0.0002698133379596034, 'lambda_val': 0.013867627627877101, 'batch_size': 3672, 'optimizer': 'Adam'}.
2026-07-03 05:57:58,374 - experiment_functions - INFO - Early stopping at epoch 550. Best Metrics: (0.00019611416952922565, 5.033907642041678e-05, 0.00012130990703556486)
2026-07-03 05:57:58,470 - optuna.study.study - INFO - Trial 13 finished with values: [0.00019611416952922565, 5.033907642041678e-05, 0.00012130990703556486] and parameters: {'n_layers': 1, 'embedding_dim': 256, 'lr': 6.503787649884767e-05, 'lambda_val': 3.589622013087031e-05, 'batch_size': 1353, 'optimizer': 'RMSprop'}.
2026-07-03 05:58:44,432 - experiment_functions - INFO - Early stopping at epoch 500. Best Metrics: (0.0002513919929670216, 5.603783978876584e-05, 0.00014093919740494013)
2026-07-03 05:58:44,533 - optuna.study.study - INFO - Trial 14 finished with values: [0.0002513919929670216, 5.603783978876584e-05, 0.00014093919740494013] and parameters: {'n_layers': 4, 'embedding_dim': 64, 'lr': 0.008057425283025757, 'lambda_val': 0.00016569298362557902, 'batch_size': 2198, 'optimizer': 'SGD'}.
2026-07-03 05:59:27,676 - experiment_functions - INFO - Early stopping at epoch 500. Best Metrics: (0.00023209062842108094, 5.793742757821552e-05, 0.00012114959533784748)
2026-07-03 05:59:27,836 - optuna.study.study - INFO - Trial 15 finished with values: [0.00023209062842108094, 5.793742757821552e-05, 0.00012114959533784748] and parameters: {'n_layers': 1, 'embedding_dim': 96, 'lr': 5.464227499499986e-05, 'lambda_val': 0.0077074924870758395, 'batch_size': 1692, 'optimizer': 'SGD'}.
2026-07-03 06:00:30,904 - experiment_functions - INFO - Early stopping at epoch 650. Best Metrics: (0.002127273945675145, 0.0005983701536766522, 0.0014406000467520608)
2026-07-03 06:00:30,990 - optuna.study.study - INFO - Trial 16 finished with values: [0.002127273945675145, 0.0005983701536766522, 0.0014406000467520608] and parameters: {'n_layers': 1, 'embedding_dim': 256, 'lr': 0.07963049146030712, 'lambda_val': 5.748803102387373e-05, 'batch_size': 1202, 'optimizer': 'RMSprop'}.
2026-07-03 06:01:21,702 - experiment_functions - INFO - Early stopping at epoch 550. Best Metrics: (0.002720274751532069, 0.000642060672833995, 0.001708865335800978)
2026-07-03 06:01:21,801 - optuna.study.study - INFO - Trial 17 finished with values: [0.002720274751532069, 0.000642060672833995, 0.001708865335800978] and parameters: {'n_layers': 4, 'embedding_dim': 64, 'lr': 0.08804916819456024, 'lambda_val': 3.472338378805577e-05, 'batch_size': 2093, 'optimizer': 'RMSprop'}.
