2026-07-09 01:20:01,025 - optuna.study.study - INFO - Trial 283 finished with values: [0.005429080225668769, 0.001478829094086583, 0.003338503122037837] and parameters: {'n_layers': 4, 'embedding_dim': 256, 'lr': 0.0026199811222762572, 'lambda_val': 4.325919770856533e-05, 'batch_size': 2727, 'optimizer': 'RMSprop'}.
2026-07-09 01:22:12,365 - experiment_functions - INFO - Early stopping at epoch 1600. Best Metrics: (0.006881655869388628, 0.0018720437665026692, 0.004639864262055813)
2026-07-09 01:22:12,520 - optuna.study.study - INFO - Trial 284 finished with values: [0.006881655869388628, 0.0018720437665026692, 0.004639864262055813] and parameters: {'n_layers': 4, 'embedding_dim': 64, 'lr': 0.000910636145359334, 'lambda_val': 3.96387168983835e-05, 'batch_size': 3603, 'optimizer': 'RMSprop'}.
2026-07-09 01:28:03,402 - optuna.study.study - INFO - Trial 285 finished with values: [0.0004057450308981878, 0.00010922629789335716, 0.0002383232653363888] and parameters: {'n_layers': 4, 'embedding_dim': 128, 'lr': 0.00012433707116670816, 'lambda_val': 1.0684413344508431e-05, 'batch_size': 1562, 'optimizer': 'RMSprop'}.
2026-07-09 01:28:50,904 - experiment_functions - INFO - Early stopping at epoch 500. Best Metrics: (0.00024667020125619107, 5.5088045894040994e-05, 0.00015483723986668135)
2026-07-09 01:28:51,028 - optuna.study.study - INFO - Trial 286 finished with values: [0.00024667020125619107, 5.5088045894040994e-05, 0.00015483723986668135] and parameters: {'n_layers': 4, 'embedding_dim': 128, 'lr': 0.0013152005063538942, 'lambda_val': 4.325919770856533e-05, 'batch_size': 1562, 'optimizer': 'SGD'}.
2026-07-09 01:34:29,217 - optuna.study.study - INFO - Trial 287 finished with values: [0.0053887149092661435, 0.0014341887810345156, 0.003453366877082383] and parameters: {'n_layers': 4, 'embedding_dim': 96, 'lr': 0.0005079724528508135, 'lambda_val': 4.325919770856533e-05, 'batch_size': 1562, 'optimizer': 'Adam'}.
2026-07-09 01:35:48,855 - experiment_functions - INFO - Early stopping at epoch 950. Best Metrics: (0.0026901992752047174, 0.0008462663601998367, 0.001845907692250312)
2026-07-09 01:35:48,957 - optuna.study.study - INFO - Trial 288 finished with values: [0.0026901992752047174, 0.0008462663601998367, 0.001845907692250312] and parameters: {'n_layers': 4, 'embedding_dim': 64, 'lr': 0.001488688533444762, 'lambda_val': 0.015882153795329063, 'batch_size': 2486, 'optimizer': 'RMSprop'}.
2026-07-09 01:38:37,450 - experiment_functions - INFO - Early stopping at epoch 2100. Best Metrics: (0.006332460514627987, 0.0017504701479778891, 0.004064074150120087)
2026-07-09 01:38:37,549 - optuna.study.study - INFO - Trial 289 finished with values: [0.006332460514627987, 0.0017504701479778891, 0.004064074150120087] and parameters: {'n_layers': 3, 'embedding_dim': 64, 'lr': 0.0013152005063538942, 'lambda_val': 6.625860010406062e-06, 'batch_size': 2993, 'optimizer': 'RMSprop'}.
2026-07-09 01:41:48,799 - experiment_functions - INFO - Early stopping at epoch 2300. Best Metrics: (0.00668446921362581, 0.0018748931481868435, 0.004346771234753228)
2026-07-09 01:41:48,931 - optuna.study.study - INFO - Trial 290 finished with values: [0.00668446921362581, 0.0018748931481868435, 0.004346771234753228] and parameters: {'n_layers': 3, 'embedding_dim': 96, 'lr': 0.0013152005063538942, 'lambda_val': 7.976077689522992e-06, 'batch_size': 2350, 'optimizer': 'RMSprop'}.
2026-07-09 01:47:09,219 - experiment_functions - INFO - Early stopping at epoch 3800. Best Metrics: (0.007079290564070827, 0.001881541705449918, 0.004514116623222425)
2026-07-09 01:47:09,351 - optuna.study.study - INFO - Trial 291 finished with values: [0.007079290564070827, 0.001881541705449918, 0.004514116623222425] and parameters: {'n_layers': 4, 'embedding_dim': 96, 'lr': 0.0005079724528508135, 'lambda_val': 2.0431242153221654e-06, 'batch_size': 3801, 'optimizer': 'RMSprop'}.
2026-07-09 01:49:27,467 - experiment_functions - INFO - Early stopping at epoch 1600. Best Metrics: (0.006918653062097131, 0.0019556256292384555, 0.004565883453515644)
2026-07-09 01:49:27,593 - optuna.study.study - INFO - Trial 292 finished with values: [0.006918653062097131, 0.0019556256292384555, 0.004565883453515644] and parameters: {'n_layers': 4, 'embedding_dim': 96, 'lr': 0.0013152005063538942, 'lambda_val': 0.0002700570923386852, 'batch_size': 1562, 'optimizer': 'RMSprop'}.
2026-07-09 01:52:02,344 - experiment_functions - INFO - Early stopping at epoch 1700. Best Metrics: (0.006753895723068846, 0.0019461276902912072, 0.004385888051924699)
2026-07-09 01:52:02,498 - optuna.study.study - INFO - Trial 293 finished with values: [0.006753895723068846, 0.0019461276902912072, 0.004385888051924699] and parameters: {'n_layers': 4, 'embedding_dim': 128, 'lr': 0.0013152005063538942, 'lambda_val': 4.325919770856533e-05, 'batch_size': 2350, 'optimizer': 'RMSprop'}.
2026-07-09 01:54:06,314 - experiment_functions - INFO - Early stopping at epoch 1350. Best Metrics: (0.006568789417168245, 0.0018587466519765213, 0.00439028311932644)
2026-07-09 01:54:06,444 - optuna.study.study - INFO - Trial 294 finished with values: [0.006568789417168245, 0.0018587466519765213, 0.00439028311932644] and parameters: {'n_layers': 4, 'embedding_dim': 128, 'lr': 0.0013152005063538942, 'lambda_val': 8.982642030344512e-06, 'batch_size': 2350, 'optimizer': 'RMSprop'}.
2026-07-09 01:55:16,783 - experiment_functions - INFO - Early stopping at epoch 750. Best Metrics: (0.005539028788713132, 0.001517770643770302, 0.003584692123840217)
2026-07-09 01:55:16,915 - optuna.study.study - INFO - Trial 295 finished with values: [0.005539028788713132, 0.001517770643770302, 0.003584692123840217] and parameters: {'n_layers': 4, 'embedding_dim': 128, 'lr': 0.002634796822286242, 'lambda_val': 8.982642030344512e-06, 'batch_size': 3801, 'optimizer': 'RMSprop'}.
2026-07-09 02:01:52,626 - optuna.study.study - INFO - Trial 296 finished with values: [0.005266883776352694, 0.0013487073305092794, 0.003331619352523346] and parameters: {'n_layers': 3, 'embedding_dim': 256, 'lr': 0.0005079724528508135, 'lambda_val': 4.325919770856533e-05, 'batch_size': 781, 'optimizer': 'RMSprop'}.
2026-07-09 02:05:23,875 - experiment_functions - INFO - Early stopping at epoch 2100. Best Metrics: (0.006504863502916273, 0.001788461903766883, 0.004116436878136813)
2026-07-09 02:05:24,004 - optuna.study.study - INFO - Trial 297 finished with values: [0.006504863502916273, 0.001788461903766883, 0.004116436878136813] and parameters: {'n_layers': 3, 'embedding_dim': 256, 'lr': 0.0013152005063538942, 'lambda_val': 6.494946904588344e-05, 'batch_size': 1342, 'optimizer': 'RMSprop'}.
2026-07-09 02:10:22,847 - optuna.study.study - INFO - Trial 298 finished with values: [0.006095988758714297, 0.0015899549797693897, 0.003911305117187709] and parameters: {'n_layers': 3, 'embedding_dim': 32, 'lr': 0.001488688533444762, 'lambda_val': 0.0010119023152848768, 'batch_size': 891, 'optimizer': 'Adam'}.
2026-07-09 02:17:26,854 - optuna.study.study - INFO - Trial 299 finished with values: [0.005989822511423475, 0.001543415078927873, 0.0037706869527707495] and parameters: {'n_layers': 4, 'embedding_dim': 256, 'lr': 0.0003947216765049812, 'lambda_val': 0.00010330204936423383, 'batch_size': 1355, 'optimizer': 'RMSprop'}.
2026-07-09 02:17:26,869 - root - INFO - Selected Trial 247 based on Max ndcg: 0.0048
2026-07-09 02:17:26,869 - root - INFO - Associated Recall: 0.0078
2026-07-09 02:17:26,869 - experiment_functions - INFO - Training the best model ... for e_amazon_1c2dcs_strict_rand1
2026-07-09 02:21:45,561 - experiment_functions - INFO - Early stopping at epoch 3400. Best Metrics: (0.007351539977309839, 0.0020620025454476383, 0.004571990173753978)
2026-07-09 02:21:52,437 - root - INFO -   **** Training e_amazon_1c2dcs_strict_rand2
2026-07-09 02:21:52,496 - root - INFO -   **** Getting 154469/2429444 random edges
2026-07-09 02:21:52,678 - optuna.storages._rdb.storage - INFO - A new study created in RDB with name: Study_e_amazon_1c2dcs_strict_rand2
2026-07-09 02:22:36,727 - experiment_functions - INFO - Early stopping at epoch 500. Best Metrics: (0.00018625828690781423, 5.5088045894041e-05, 0.00011615609807144583)
2026-07-09 02:22:36,816 - optuna.study.study - INFO - Trial 0 finished with values: [0.00018625828690781423, 5.5088045894041e-05, 0.00011615609807144583] and parameters: {'n_layers': 2, 'embedding_dim': 128, 'lr': 3.8385225574059946e-05, 'lambda_val': 0.015464776349687475, 'batch_size': 768, 'optimizer': 'RMSprop'}.
2026-07-09 02:23:22,121 - experiment_functions - INFO - Early stopping at epoch 550. Best Metrics: (0.001950816135595757, 0.000526185817677564, 0.0013377072942947425)
2026-07-09 02:23:22,223 - optuna.study.study - INFO - Trial 1 finished with values: [0.001950816135595757, 0.000526185817677564, 0.0013377072942947425] and parameters: {'n_layers': 2, 'embedding_dim': 64, 'lr': 0.06328387972552833, 'lambda_val': 1.1044364908360503e-05, 'batch_size': 1124, 'optimizer': 'RMSprop'}.
2026-07-09 02:28:16,771 - experiment_functions - INFO - Early stopping at epoch 2800. Best Metrics: (0.0002320469952765324, 5.7937427578215534e-05, 0.00013812752440699319)
2026-07-09 02:28:16,863 - optuna.study.study - INFO - Trial 2 finished with values: [0.0002320469952765324, 5.7937427578215534e-05, 0.00013812752440699319] and parameters: {'n_layers': 4, 'embedding_dim': 256, 'lr': 2.2704534736252587e-05, 'lambda_val': 0.0013843701973488246, 'batch_size': 810, 'optimizer': 'RMSprop'}.
2026-07-09 02:29:04,230 - experiment_functions - INFO - Early stopping at epoch 500. Best Metrics: (0.00025290301937077735, 5.413825199931615e-05, 0.00013801512480619805)
2026-07-09 02:29:04,341 - optuna.study.study - INFO - Trial 3 finished with values: [0.00025290301937077735, 5.413825199931615e-05, 0.00013801512480619805] and parameters: {'n_layers': 4, 'embedding_dim': 128, 'lr': 0.03790950683739818, 'lambda_val': 0.0014178934663658606, 'batch_size': 2752, 'optimizer': 'SGD'}.
2026-07-09 02:30:32,367 - experiment_functions - INFO - Early stopping at epoch 850. Best Metrics: (0.0041796924013208885, 0.0011900917500902305, 0.0026746930099164163)
2026-07-09 02:30:32,462 - optuna.study.study - INFO - Trial 4 finished with values: [0.0041796924013208885, 0.0011900917500902305, 0.0026746930099164163] and parameters: {'n_layers': 3, 'embedding_dim': 256, 'lr': 0.0018829727920662888, 'lambda_val': 0.0022068799876143563, 'batch_size': 734, 'optimizer': 'RMSprop'}.
2026-07-09 02:33:23,773 - experiment_functions - INFO - Early stopping at epoch 2200. Best Metrics: (0.00022362033415078382, 5.9837015367665226e-05, 0.00014282604380940557)
2026-07-09 02:33:23,865 - optuna.study.study - INFO - Trial 5 finished with values: [0.00022362033415078382, 5.9837015367665226e-05, 0.00014282604380940557] and parameters: {'n_layers': 3, 'embedding_dim': 64, 'lr': 2.3085230831911518e-05, 'lambda_val': 0.0005112640639013851, 'batch_size': 4048, 'optimizer': 'RMSprop'}.
2026-07-09 02:34:22,938 - experiment_functions - INFO - Early stopping at epoch 700. Best Metrics: (0.0051435590495931905, 0.0014056949641927702, 0.0033089366570625113)
2026-07-09 02:34:23,029 - optuna.study.study - INFO - Trial 6 finished with values: [0.0051435590495931905, 0.0014056949641927702, 0.0033089366570625113] and parameters: {'n_layers': 4, 'embedding_dim': 64, 'lr': 0.005405488767134608, 'lambda_val': 2.2522964152299898e-05, 'batch_size': 2200, 'optimizer': 'Adam'}.
2026-07-09 02:35:03,682 - experiment_functions - INFO - Early stopping at epoch 500. Best Metrics: (0.00023584724476188233, 5.7937427578215534e-05, 0.00012624339205728183)
2026-07-09 02:35:04,125 - optuna.study.study - INFO - Trial 7 finished with values: [0.00023584724476188233, 5.7937427578215534e-05, 0.00012624339205728183] and parameters: {'n_layers': 1, 'embedding_dim': 64, 'lr': 0.0012628398878528648, 'lambda_val': 9.695396858418277e-05, 'batch_size': 2242, 'optimizer': 'SGD'}.
2026-07-09 02:35:44,430 - experiment_functions - INFO - Early stopping at epoch 500. Best Metrics: (0.00023113660551198282, 6.268639705183976e-05, 0.0001425080589157178)
2026-07-09 02:35:44,525 - optuna.study.study - INFO - Trial 8 finished with values: [0.00023113660551198282, 6.268639705183976e-05, 0.0001425080589157178] and parameters: {'n_layers': 3, 'embedding_dim': 32, 'lr': 0.005980177817312796, 'lambda_val': 0.06512279230573839, 'batch_size': 763, 'optimizer': 'SGD'}.
2026-07-09 02:36:25,182 - experiment_functions - INFO - Early stopping at epoch 500. Best Metrics: (0.00022603841617331615, 5.318845810459131e-05, 0.00012760877395529027)
2026-07-09 02:36:25,274 - optuna.study.study - INFO - Trial 9 finished with values: [0.00022603841617331615, 5.318845810459131e-05, 0.00012760877395529027] and parameters: {'n_layers': 1, 'embedding_dim': 64, 'lr': 1.1886214722316954e-05, 'lambda_val': 0.01470963918898905, 'batch_size': 2152, 'optimizer': 'SGD'}.
2026-07-09 02:37:04,754 - experiment_functions - INFO - Early stopping at epoch 500. Best Metrics: (0.0002503954429811032, 5.3188458104591316e-05, 0.00011907590988516744)
2026-07-09 02:37:04,862 - optuna.study.study - INFO - Trial 10 finished with values: [0.0002503954429811032, 5.3188458104591316e-05, 0.00011907590988516744] and parameters: {'n_layers': 1, 'embedding_dim': 32, 'lr': 0.026355536898596613, 'lambda_val': 0.05993758381779579, 'batch_size': 3886, 'optimizer': 'SGD'}.
2026-07-09 02:38:00,075 - experiment_functions - INFO - Early stopping at epoch 700. Best Metrics: (0.0030820742164987844, 0.0008225215128317156, 0.002002131840022289)
2026-07-09 02:38:00,166 - optuna.study.study - INFO - Trial 11 finished with values: [0.0030820742164987844, 0.0008225215128317156, 0.002002131840022289] and parameters: {'n_layers': 2, 'embedding_dim': 32, 'lr': 0.005401986486476224, 'lambda_val': 1.1879305228456365e-06, 'batch_size': 3474, 'optimizer': 'RMSprop'}.
2026-07-09 02:38:41,071 - experiment_functions - INFO - Early stopping at epoch 500. Best Metrics: (0.00016549374352814683, 4.843948863096708e-05, 0.00010023712537663477)
2026-07-09 02:38:41,214 - optuna.study.study - INFO - Trial 12 finished with values: [0.00016549374352814683, 4.843948863096708e-05, 0.00010023712537663477] and parameters: {'n_layers': 4, 'embedding_dim': 32, 'lr': 0.000942340752022982, 'lambda_val': 0.005767728602541003, 'batch_size': 1229, 'optimizer': 'SGD'}.
2026-07-09 02:39:21,903 - experiment_functions - INFO - Early stopping at epoch 500. Best Metrics: (0.00021009544328943339, 5.793742757821552e-05, 0.00012530312331769528)
2026-07-09 02:39:21,996 - optuna.study.study - INFO - Trial 13 finished with values: [0.00021009544328943339, 5.793742757821552e-05, 0.00012530312331769528] and parameters: {'n_layers': 3, 'embedding_dim': 32, 'lr': 2.3006900989001136e-05, 'lambda_val': 0.0022036206337819574, 'batch_size': 1235, 'optimizer': 'RMSprop'}.
2026-07-09 02:40:44,305 - experiment_functions - INFO - Early stopping at epoch 1000. Best Metrics: (0.0016753191327574593, 0.0004891438557832951, 0.0011277591296518271)
2026-07-09 02:40:44,390 - optuna.study.study - INFO - Trial 14 finished with values: [0.0016753191327574593, 0.0004891438557832951, 0.0011277591296518271] and parameters: {'n_layers': 4, 'embedding_dim': 64, 'lr': 0.0027594675228998556, 'lambda_val': 0.04009508185911089, 'batch_size': 1757, 'optimizer': 'RMSprop'}.
2026-07-09 02:44:40,106 - experiment_functions - INFO - Early stopping at epoch 2550. Best Metrics: (0.0002540401151032363, 6.933495431491368e-05, 0.00014805589181792988)
2026-07-09 02:44:40,188 - optuna.study.study - INFO - Trial 15 finished with values: [0.0002540401151032363, 6.933495431491368e-05, 0.00014805589181792988] and parameters: {'n_layers': 2, 'embedding_dim': 256, 'lr': 7.593908560888827e-05, 'lambda_val': 0.009804192439320786, 'batch_size': 4014, 'optimizer': 'RMSprop'}.
2026-07-09 02:45:25,859 - experiment_functions - INFO - Early stopping at epoch 500. Best Metrics: (0.0002112948841709725, 5.033907642041677e-05, 0.00013276300592605532)
2026-07-09 02:45:25,983 - optuna.study.study - INFO - Trial 16 finished with values: [0.0002112948841709725, 5.033907642041677e-05, 0.00013276300592605532] and parameters: {'n_layers': 4, 'embedding_dim': 96, 'lr': 1.2975218459578488e-05, 'lambda_val': 5.813076249153271e-06, 'batch_size': 3307, 'optimizer': 'SGD'}.
2026-07-09 02:46:12,723 - experiment_functions - INFO - Early stopping at epoch 550. Best Metrics: (0.0021924113127357067, 0.0006392112911498205, 0.0015595386203507305)
2026-07-09 02:46:12,809 - optuna.study.study - INFO - Trial 17 finished with values: [0.0021924113127357067, 0.0006392112911498205, 0.0015595386203507305] and parameters: {'n_layers': 3, 'embedding_dim': 64, 'lr': 0.038876785008240544, 'lambda_val': 3.887073615336297e-06, 'batch_size': 3127, 'optimizer': 'RMSprop'}.
2026-07-09 02:50:07,044 - experiment_functions - INFO - Early stopping at epoch 3000. Best Metrics: (0.00022384989702309345, 5.698763368349069e-05, 0.00012195212449645271)
2026-07-09 02:50:07,177 - optuna.study.study - INFO - Trial 18 finished with values: [0.00022384989702309345, 5.698763368349069e-05, 0.00012195212449645271] and parameters: {'n_layers': 3, 'embedding_dim': 64, 'lr': 2.412992678437667e-05, 'lambda_val': 0.0011985849625703743, 'batch_size': 3022, 'optimizer': 'Adam'}.
2026-07-09 02:55:12,633 - optuna.study.study - INFO - Trial 19 finished with values: [0.0021568620710818464, 0.0005119389092566914, 0.0014077149549106627] and parameters: {'n_layers': 1, 'embedding_dim': 96, 'lr': 0.0005051031254670146, 'lambda_val': 4.97629581405907e-06, 'batch_size': 3512, 'optimizer': 'RMSprop'}.
2026-07-09 02:56:24,871 - experiment_functions - INFO - Early stopping at epoch 800. Best Metrics: (0.00212375121201243, 0.0005641775734665578, 0.0013993888835330608)
2026-07-09 02:56:24,955 - optuna.study.study - INFO - Trial 20 finished with values: [0.00212375121201243, 0.0005641775734665578, 0.0013993888835330608] and parameters: {'n_layers': 1, 'embedding_dim': 256, 'lr': 0.01758124022883156, 'lambda_val': 7.837950389546045e-06, 'batch_size': 2256, 'optimizer': 'RMSprop'}.
2026-07-09 03:01:29,708 - optuna.study.study - INFO - Trial 21 finished with values: [0.00045416332503713257, 0.00010637691620918262, 0.00026503935396138923] and parameters: {'n_layers': 2, 'embedding_dim': 64, 'lr': 0.0002893749569362745, 'lambda_val': 6.76414986866491e-05, 'batch_size': 1042, 'optimizer': 'Adam'}.
2026-07-09 03:03:48,398 - experiment_functions - INFO - Early stopping at epoch 1800. Best Metrics: (0.0002879421493345696, 7.21843359990882e-05, 0.00016103284278889702)
2026-07-09 03:03:48,508 - optuna.study.study - INFO - Trial 22 finished with values: [0.0002879421493345696, 7.21843359990882e-05, 0.00016103284278889702] and parameters: {'n_layers': 2, 'embedding_dim': 64, 'lr': 0.0001738400579646775, 'lambda_val': 0.010570956583988819, 'batch_size': 1249, 'optimizer': 'RMSprop'}.
2026-07-09 03:09:07,464 - optuna.study.study - INFO - Trial 23 finished with values: [0.004057039968009695, 0.0010694679254601752, 0.002533970926361414] and parameters: {'n_layers': 4, 'embedding_dim': 64, 'lr': 0.00029123976619087056, 'lambda_val': 5.567710369086332e-06, 'batch_size': 3930, 'optimizer': 'RMSprop'}.
2026-07-09 03:14:04,081 - optuna.study.study - INFO - Trial 24 finished with values: [0.0012172012206859409, 0.0002801891989438292, 0.0007631561176583155] and parameters: {'n_layers': 3, 'embedding_dim': 32, 'lr': 0.0003039378235738315, 'lambda_val': 3.0327311840688856e-06, 'batch_size': 1762, 'optimizer': 'RMSprop'}.
2026-07-09 03:14:47,067 - experiment_functions - INFO - Early stopping at epoch 500. Best Metrics: (0.0010556442029218893, 0.00027164105389130557, 0.0007188659848222256)
2026-07-09 03:14:47,154 - optuna.study.study - INFO - Trial 25 finished with values: [0.0010556442029218893, 0.00027164105389130557, 0.0007188659848222256] and parameters: {'n_layers': 2, 'embedding_dim': 96, 'lr': 0.038288473257002346, 'lambda_val': 0.05359174045352731, 'batch_size': 2319, 'optimizer': 'RMSprop'}.
2026-07-09 03:15:28,676 - experiment_functions - INFO - Early stopping at epoch 500. Best Metrics: (0.0002495896267754439, 6.458598484128944e-05, 0.0001379177601392505)
2026-07-09 03:15:28,807 - optuna.study.study - INFO - Trial 26 finished with values: [0.0002495896267754439, 6.458598484128944e-05, 0.0001379177601392505] and parameters: {'n_layers': 1, 'embedding_dim': 96, 'lr': 0.02804964981133586, 'lambda_val': 1.9168945772016106e-05, 'batch_size': 3524, 'optimizer': 'SGD'}.
2026-07-09 03:17:21,574 - experiment_functions - INFO - Early stopping at epoch 1450. Best Metrics: (0.002035597098722564, 0.0005803240696768802, 0.0012711351135345145)
2026-07-09 03:17:21,660 - optuna.study.study - INFO - Trial 27 finished with values: [0.002035597098722564, 0.0005803240696768802, 0.0012711351135345145] and parameters: {'n_layers': 2, 'embedding_dim': 64, 'lr': 0.0030210056990346585, 'lambda_val': 0.03562985911238626, 'batch_size': 2119, 'optimizer': 'RMSprop'}.
2026-07-09 03:18:46,579 - experiment_functions - INFO - Early stopping at epoch 1100. Best Metrics: (0.002800946368489317, 0.000734190680622305, 0.0017628979243746296)
2026-07-09 03:18:46,655 - optuna.study.study - INFO - Trial 28 finished with values: [0.002800946368489317, 0.000734190680622305, 0.0017628979243746296] and parameters: {'n_layers': 1, 'embedding_dim': 64, 'lr': 0.003771234694941661, 'lambda_val': 4.799651509510136e-05, 'batch_size': 3232, 'optimizer': 'RMSprop'}.
2026-07-09 03:24:10,972 - optuna.study.study - INFO - Trial 29 finished with values: [0.0005016639485345135, 0.0001272723818931292, 0.0003273238387617639] and parameters: {'n_layers': 2, 'embedding_dim': 128, 'lr': 0.0001924396217608583, 'lambda_val': 0.00042689590179151803, 'batch_size': 2663, 'optimizer': 'RMSprop'}.
2026-07-09 03:25:01,587 - experiment_functions - INFO - Early stopping at epoch 550. Best Metrics: (0.0030299899229376554, 0.0008025758410424938, 0.0020758609200813697)
