2026-07-02 14:40:33,944 - optuna.study.study - INFO - Trial 63 finished with values: [0.007654591633178443, 0.001974621507132952, 0.004776340409119866] and parameters: {'n_layers': 1, 'embedding_dim': 64, 'lr': 0.00035937037082201277, 'lambda_val': 0.00044379091524845374, 'batch_size': 3269, 'optimizer': 'Adam'}.
2026-07-02 14:47:45,396 - optuna.study.study - INFO - Trial 64 finished with values: [0.009925861323260052, 0.0024058279353380316, 0.005887409265980319] and parameters: {'n_layers': 2, 'embedding_dim': 256, 'lr': 0.00020560294075841994, 'lambda_val': 0.006272911689093162, 'batch_size': 2391, 'optimizer': 'RMSprop'}.
2026-07-02 14:50:25,193 - experiment_functions - INFO - Early stopping at epoch 1750. Best Metrics: (0.008640702417939137, 0.002110442034078605, 0.00512998082114749)
2026-07-02 14:50:25,290 - optuna.study.study - INFO - Trial 65 finished with values: [0.008640702417939137, 0.002110442034078605, 0.00512998082114749] and parameters: {'n_layers': 3, 'embedding_dim': 64, 'lr': 0.0006781284315626388, 'lambda_val': 0.008015948669672757, 'batch_size': 2370, 'optimizer': 'Adam'}.
2026-07-02 14:51:15,285 - experiment_functions - INFO - Early stopping at epoch 550. Best Metrics: (0.007552405617212303, 0.002007864293448322, 0.00497217432137465)
2026-07-02 14:51:15,400 - optuna.study.study - INFO - Trial 66 finished with values: [0.007552405617212303, 0.002007864293448322, 0.00497217432137465] and parameters: {'n_layers': 2, 'embedding_dim': 64, 'lr': 0.019732524959614816, 'lambda_val': 0.00044379091524845374, 'batch_size': 667, 'optimizer': 'Adam'}.
2026-07-02 14:52:15,072 - experiment_functions - INFO - Early stopping at epoch 600. Best Metrics: (0.00027655640975595775, 6.078680926239006e-05, 0.00016013601062393973)
2026-07-02 14:52:15,145 - optuna.study.study - INFO - Trial 67 finished with values: [0.00027655640975595775, 6.078680926239006e-05, 0.00016013601062393973] and parameters: {'n_layers': 1, 'embedding_dim': 256, 'lr': 3.161480996601466e-05, 'lambda_val': 0.021992616267768692, 'batch_size': 3228, 'optimizer': 'RMSprop'}.
2026-07-02 14:53:04,973 - experiment_functions - INFO - Early stopping at epoch 500. Best Metrics: (0.0002682161711457888, 7.028474820963851e-05, 0.0001435397874227439)
2026-07-02 14:53:05,073 - optuna.study.study - INFO - Trial 68 finished with values: [0.0002682161711457888, 7.028474820963851e-05, 0.0001435397874227439] and parameters: {'n_layers': 1, 'embedding_dim': 256, 'lr': 0.001480646322042953, 'lambda_val': 0.0007993704414203944, 'batch_size': 2883, 'optimizer': 'SGD'}.
2026-07-02 14:53:54,861 - experiment_functions - INFO - Early stopping at epoch 500. Best Metrics: (0.00022371691231223728, 5.983701536766521e-05, 0.00013150974142362633)
2026-07-02 14:53:54,951 - optuna.study.study - INFO - Trial 69 finished with values: [0.00022371691231223728, 5.983701536766521e-05, 0.00013150974142362633] and parameters: {'n_layers': 4, 'embedding_dim': 64, 'lr': 0.002575131183249765, 'lambda_val': 0.03509986846797964, 'batch_size': 3722, 'optimizer': 'SGD'}.
2026-07-02 14:55:21,666 - experiment_functions - INFO - Early stopping at epoch 1050. Best Metrics: (0.00017168994578825217, 4.653990084151739e-05, 9.216820595992808e-05)
2026-07-02 14:55:21,770 - optuna.study.study - INFO - Trial 70 finished with values: [0.00017168994578825217, 4.653990084151739e-05, 9.216820595992808e-05] and parameters: {'n_layers': 2, 'embedding_dim': 32, 'lr': 7.823794535608523e-05, 'lambda_val': 9.760164094547295e-05, 'batch_size': 2544, 'optimizer': 'Adam'}.
2026-07-02 15:01:41,327 - optuna.study.study - INFO - Trial 71 finished with values: [0.014005327604171166, 0.003291035845221587, 0.008243847155940674] and parameters: {'n_layers': 3, 'embedding_dim': 96, 'lr': 0.0005152458540342933, 'lambda_val': 9.00355461091747e-05, 'batch_size': 1092, 'optimizer': 'RMSprop'}.
2026-07-02 15:03:00,909 - experiment_functions - INFO - Early stopping at epoch 700. Best Metrics: (0.008861583384032222, 0.0021398856448150753, 0.005202148797431206)
2026-07-02 15:03:00,994 - optuna.study.study - INFO - Trial 72 finished with values: [0.008861583384032222, 0.0021398856448150753, 0.005202148797431206] and parameters: {'n_layers': 2, 'embedding_dim': 256, 'lr': 0.0016372104773050206, 'lambda_val': 0.0008444952897102547, 'batch_size': 3503, 'optimizer': 'RMSprop'}.
2026-07-02 15:03:55,876 - experiment_functions - INFO - Early stopping at epoch 550. Best Metrics: (0.00020771498391136103, 5.128887031514162e-05, 0.00011906407778691555)
2026-07-02 15:03:55,947 - optuna.study.study - INFO - Trial 73 finished with values: [0.00020771498391136103, 5.128887031514162e-05, 0.00011906407778691555] and parameters: {'n_layers': 4, 'embedding_dim': 64, 'lr': 1.0458690643817229e-05, 'lambda_val': 0.009806979837729053, 'batch_size': 1481, 'optimizer': 'RMSprop'}.
2026-07-02 15:04:42,761 - experiment_functions - INFO - Early stopping at epoch 500. Best Metrics: (0.0002775490795667737, 6.17366031571149e-05, 0.00016294135568669822)
2026-07-02 15:04:42,844 - optuna.study.study - INFO - Trial 74 finished with values: [0.0002775490795667737, 6.17366031571149e-05, 0.00016294135568669822] and parameters: {'n_layers': 4, 'embedding_dim': 32, 'lr': 6.665205514120102e-05, 'lambda_val': 1.0200526955125864e-06, 'batch_size': 2747, 'optimizer': 'SGD'}.
2026-07-02 15:11:58,941 - optuna.study.study - INFO - Trial 75 finished with values: [0.013512567633071662, 0.003202705013012177, 0.00809873351156153] and parameters: {'n_layers': 2, 'embedding_dim': 256, 'lr': 0.00045784196880844456, 'lambda_val': 0.003381769296625175, 'batch_size': 780, 'optimizer': 'Adam'}.
2026-07-02 15:12:46,045 - experiment_functions - INFO - Early stopping at epoch 500. Best Metrics: (0.0001806856731044704, 5.128887031514162e-05, 0.00010500919152196192)
2026-07-02 15:12:46,138 - optuna.study.study - INFO - Trial 76 finished with values: [0.0001806856731044704, 5.128887031514162e-05, 0.00010500919152196192] and parameters: {'n_layers': 4, 'embedding_dim': 32, 'lr': 5.109734257346146e-05, 'lambda_val': 2.1262063244338483e-06, 'batch_size': 3187, 'optimizer': 'Adam'}.
2026-07-02 15:14:23,526 - experiment_functions - INFO - Early stopping at epoch 1050. Best Metrics: (0.008551265489689161, 0.0020487054309214904, 0.0049627395071202215)
2026-07-02 15:14:23,638 - optuna.study.study - INFO - Trial 77 finished with values: [0.008551265489689161, 0.0020487054309214904, 0.0049627395071202215] and parameters: {'n_layers': 3, 'embedding_dim': 64, 'lr': 0.0007787505453018097, 'lambda_val': 0.008015948669672757, 'batch_size': 2370, 'optimizer': 'Adam'}.
2026-07-02 15:18:11,097 - experiment_functions - INFO - Early stopping at epoch 1650. Best Metrics: (0.010301686992289583, 0.002393480614706609, 0.006063149831389577)
2026-07-02 15:18:11,172 - optuna.study.study - INFO - Trial 78 finished with values: [0.010301686992289583, 0.002393480614706609, 0.006063149831389577] and parameters: {'n_layers': 4, 'embedding_dim': 256, 'lr': 0.0011190330220107111, 'lambda_val': 6.694873967138273e-06, 'batch_size': 2407, 'optimizer': 'Adam'}.
2026-07-02 15:20:02,932 - experiment_functions - INFO - Early stopping at epoch 800. Best Metrics: (0.005842680234695154, 0.0011777444294588074, 0.003980611855958735)
2026-07-02 15:20:03,006 - optuna.study.study - INFO - Trial 79 finished with values: [0.005842680234695154, 0.0011777444294588074, 0.003980611855958735] and parameters: {'n_layers': 4, 'embedding_dim': 256, 'lr': 0.05561848162385812, 'lambda_val': 1.1641323668209177e-05, 'batch_size': 3948, 'optimizer': 'RMSprop'}.
2026-07-02 15:20:50,261 - experiment_functions - INFO - Early stopping at epoch 500. Best Metrics: (0.00021185242947392257, 5.223866420986647e-05, 0.00012246551967178026)
2026-07-02 15:20:50,401 - optuna.study.study - INFO - Trial 80 finished with values: [0.00021185242947392257, 5.223866420986647e-05, 0.00012246551967178026] and parameters: {'n_layers': 2, 'embedding_dim': 96, 'lr': 0.0005927995424167511, 'lambda_val': 0.05122867725901079, 'batch_size': 1016, 'optimizer': 'SGD'}.
2026-07-02 15:22:01,007 - experiment_functions - INFO - Early stopping at epoch 800. Best Metrics: (0.00029669359364871395, 6.933495431491367e-05, 0.0001545306823563296)
2026-07-02 15:22:01,103 - optuna.study.study - INFO - Trial 81 finished with values: [0.00029669359364871395, 6.933495431491367e-05, 0.0001545306823563296] and parameters: {'n_layers': 2, 'embedding_dim': 64, 'lr': 1.0015469335477442e-05, 'lambda_val': 0.008015948669672757, 'batch_size': 2572, 'optimizer': 'Adam'}.
2026-07-02 15:23:37,979 - experiment_functions - INFO - Early stopping at epoch 1000. Best Metrics: (0.00028913795851379516, 7.21843359990882e-05, 0.0001697779944216823)
2026-07-02 15:23:38,056 - optuna.study.study - INFO - Trial 82 finished with values: [0.00028913795851379516, 7.21843359990882e-05, 0.0001697779944216823] and parameters: {'n_layers': 3, 'embedding_dim': 96, 'lr': 1.4550365488281395e-05, 'lambda_val': 0.0007523035355748674, 'batch_size': 2659, 'optimizer': 'Adam'}.
2026-07-02 15:32:38,656 - optuna.study.study - INFO - Trial 83 finished with values: [0.01043429911096429, 0.002461865775126798, 0.0067903848292528105] and parameters: {'n_layers': 4, 'embedding_dim': 256, 'lr': 0.010539985286058167, 'lambda_val': 3.277688503988446e-05, 'batch_size': 3016, 'optimizer': 'RMSprop'}.
2026-07-02 15:38:22,420 - experiment_functions - INFO - Early stopping at epoch 3850. Best Metrics: (0.009226610463509718, 0.0021474839959728744, 0.005499767293261199)
2026-07-02 15:38:22,527 - optuna.study.study - INFO - Trial 84 finished with values: [0.009226610463509718, 0.0021474839959728744, 0.005499767293261199] and parameters: {'n_layers': 3, 'embedding_dim': 64, 'lr': 0.0012100089708552634, 'lambda_val': 9.00355461091747e-05, 'batch_size': 677, 'optimizer': 'RMSprop'}.
2026-07-02 15:42:13,186 - experiment_functions - INFO - Early stopping at epoch 2550. Best Metrics: (0.015000586607658573, 0.0035408316395342215, 0.009132182056250441)
2026-07-02 15:42:13,336 - optuna.study.study - INFO - Trial 85 finished with values: [0.015000586607658573, 0.0035408316395342215, 0.009132182056250441] and parameters: {'n_layers': 3, 'embedding_dim': 64, 'lr': 0.0005152458540342933, 'lambda_val': 5.288093815108994e-05, 'batch_size': 1948, 'optimizer': 'RMSprop'}.
2026-07-02 15:43:45,596 - experiment_functions - INFO - Early stopping at epoch 1050. Best Metrics: (0.009274197308998667, 0.002270007408392379, 0.0059580837117723575)
2026-07-02 15:43:46,382 - optuna.study.study - INFO - Trial 86 finished with values: [0.009274197308998667, 0.002270007408392379, 0.0059580837117723575] and parameters: {'n_layers': 1, 'embedding_dim': 128, 'lr': 0.01003894592310146, 'lambda_val': 1.6046175410536033e-05, 'batch_size': 541, 'optimizer': 'RMSprop'}.
2026-07-02 15:44:40,798 - experiment_functions - INFO - Early stopping at epoch 550. Best Metrics: (0.0033895241416087873, 0.0009773379176718654, 0.0022760787040844842)
2026-07-02 15:44:40,919 - optuna.study.study - INFO - Trial 87 finished with values: [0.0033895241416087873, 0.0009773379176718654, 0.0022760787040844842] and parameters: {'n_layers': 2, 'embedding_dim': 128, 'lr': 0.010169867799443354, 'lambda_val': 0.0406201462474943, 'batch_size': 2355, 'optimizer': 'RMSprop'}.
2026-07-02 15:45:26,381 - experiment_functions - INFO - Early stopping at epoch 500. Best Metrics: (0.00021555081652833687, 6.36361909465646e-05, 0.00013258881874977831)
2026-07-02 15:45:26,488 - optuna.study.study - INFO - Trial 88 finished with values: [0.00021555081652833687, 6.36361909465646e-05, 0.00013258881874977831] and parameters: {'n_layers': 3, 'embedding_dim': 32, 'lr': 8.2508581336358e-05, 'lambda_val': 0.04524808111507399, 'batch_size': 3709, 'optimizer': 'RMSprop'}.
2026-07-02 15:51:41,245 - optuna.study.study - INFO - Trial 89 finished with values: [0.0014501312078734592, 0.00039891343578443483, 0.0009238171609807412] and parameters: {'n_layers': 3, 'embedding_dim': 96, 'lr': 8.720210273774637e-05, 'lambda_val': 3.277688503988446e-05, 'batch_size': 3642, 'optimizer': 'RMSprop'}.
2026-07-02 15:52:51,021 - experiment_functions - INFO - Early stopping at epoch 500. Best Metrics: (0.00025946086150568617, 6.553577873601429e-05, 0.0001434381752874159)
2026-07-02 15:52:51,139 - optuna.study.study - INFO - Trial 90 finished with values: [0.00025946086150568617, 6.553577873601429e-05, 0.0001434381752874159] and parameters: {'n_layers': 4, 'embedding_dim': 256, 'lr': 0.0011190330220107111, 'lambda_val': 0.0021486567738515953, 'batch_size': 3463, 'optimizer': 'SGD'}.
2026-07-02 15:53:48,585 - experiment_functions - INFO - Early stopping at epoch 500. Best Metrics: (0.0001515578409194611, 5.603783978876583e-05, 9.453481048651262e-05)
2026-07-02 15:53:48,685 - optuna.study.study - INFO - Trial 91 finished with values: [0.0001515578409194611, 5.603783978876583e-05, 9.453481048651262e-05] and parameters: {'n_layers': 2, 'embedding_dim': 256, 'lr': 4.034782991634621e-05, 'lambda_val': 0.012982265417847255, 'batch_size': 879, 'optimizer': 'RMSprop'}.
2026-07-02 15:54:45,293 - experiment_functions - INFO - Early stopping at epoch 500. Best Metrics: (0.0002481660560737423, 6.648557263073914e-05, 0.00014215989700208472)
2026-07-02 15:54:45,452 - optuna.study.study - INFO - Trial 92 finished with values: [0.0002481660560737423, 6.648557263073914e-05, 0.00014215989700208472] and parameters: {'n_layers': 4, 'embedding_dim': 128, 'lr': 0.002575131183249765, 'lambda_val': 0.03509986846797964, 'batch_size': 554, 'optimizer': 'SGD'}.
2026-07-02 15:56:49,626 - experiment_functions - INFO - Early stopping at epoch 1500. Best Metrics: (0.008731412537964136, 0.002028759759132268, 0.005107058390024826)
2026-07-02 15:56:49,731 - optuna.study.study - INFO - Trial 93 finished with values: [0.008731412537964136, 0.002028759759132268, 0.005107058390024826] and parameters: {'n_layers': 2, 'embedding_dim': 32, 'lr': 0.0027092005148847305, 'lambda_val': 2.9585431976985735e-06, 'batch_size': 2839, 'optimizer': 'RMSprop'}.
2026-07-02 16:02:21,991 - experiment_functions - INFO - Early stopping at epoch 3950. Best Metrics: (0.007814414154394466, 0.001730524476188667, 0.00487964178213873)
2026-07-02 16:02:22,095 - optuna.study.study - INFO - Trial 94 finished with values: [0.007814414154394466, 0.001730524476188667, 0.00487964178213873] and parameters: {'n_layers': 2, 'embedding_dim': 64, 'lr': 0.013707584571164062, 'lambda_val': 2.3467434467462208e-05, 'batch_size': 3948, 'optimizer': 'RMSprop'}.
2026-07-02 16:08:46,424 - optuna.study.study - INFO - Trial 95 finished with values: [0.01975543222271111, 0.004661588435309538, 0.012750691693047789] and parameters: {'n_layers': 1, 'embedding_dim': 256, 'lr': 0.0005693523871630874, 'lambda_val': 0.00020052239202191264, 'batch_size': 3332, 'optimizer': 'Adam'}.
2026-07-02 16:15:07,395 - optuna.study.study - INFO - Trial 96 finished with values: [0.01490610021556442, 0.003409760082062193, 0.008972392627380905] and parameters: {'n_layers': 3, 'embedding_dim': 96, 'lr': 0.0005152458540342933, 'lambda_val': 9.00355461091747e-05, 'batch_size': 1948, 'optimizer': 'RMSprop'}.
2026-07-02 16:20:20,143 - experiment_functions - INFO - Early stopping at epoch 3900. Best Metrics: (0.01738318337549468, 0.004138251999316149, 0.010459320020590622)
2026-07-02 16:20:20,252 - optuna.study.study - INFO - Trial 97 finished with values: [0.01738318337549468, 0.004138251999316149, 0.010459320020590622] and parameters: {'n_layers': 1, 'embedding_dim': 64, 'lr': 0.0007787505453018097, 'lambda_val': 0.00045598605516994004, 'batch_size': 2278, 'optimizer': 'RMSprop'}.
2026-07-02 16:21:14,204 - experiment_functions - INFO - Early stopping at epoch 600. Best Metrics: (0.00030685410112292526, 7.21843359990882e-05, 0.0001652339172069949)
2026-07-02 16:21:14,310 - optuna.study.study - INFO - Trial 98 finished with values: [0.00030685410112292526, 7.21843359990882e-05, 0.0001652339172069949] and parameters: {'n_layers': 1, 'embedding_dim': 128, 'lr': 3.161480996601466e-05, 'lambda_val': 1.6046175410536033e-05, 'batch_size': 3228, 'optimizer': 'Adam'}.
2026-07-02 16:22:17,035 - experiment_functions - INFO - Early stopping at epoch 750. Best Metrics: (0.0002082076321129354, 5.698763368349069e-05, 0.00011277404344733845)
2026-07-02 16:22:17,141 - optuna.study.study - INFO - Trial 99 finished with values: [0.0002082076321129354, 5.698763368349069e-05, 0.00011277404344733845] and parameters: {'n_layers': 2, 'embedding_dim': 32, 'lr': 4.1207810094587616e-05, 'lambda_val': 1.0200526955125864e-06, 'batch_size': 3873, 'optimizer': 'RMSprop'}.
2026-07-02 16:23:20,554 - experiment_functions - INFO - Early stopping at epoch 550. Best Metrics: (0.005501546578114179, 0.0013810003229299246, 0.0035555849285388626)
2026-07-02 16:23:20,701 - optuna.study.study - INFO - Trial 100 finished with values: [0.005501546578114179, 0.0013810003229299246, 0.0035555849285388626] and parameters: {'n_layers': 2, 'embedding_dim': 256, 'lr': 0.020623134336649276, 'lambda_val': 0.006272911689093162, 'batch_size': 2391, 'optimizer': 'Adam'}.
2026-07-02 16:28:05,352 - experiment_functions - INFO - Early stopping at epoch 2100. Best Metrics: (0.01081005711550679, 0.00250745588207359, 0.00635544025476188)
2026-07-02 16:28:05,463 - optuna.study.study - INFO - Trial 101 finished with values: [0.01081005711550679, 0.00250745588207359, 0.00635544025476188] and parameters: {'n_layers': 4, 'embedding_dim': 256, 'lr': 0.0005152458540342933, 'lambda_val': 9.00355461091747e-05, 'batch_size': 1147, 'optimizer': 'RMSprop'}.
2026-07-02 16:28:53,156 - experiment_functions - INFO - Early stopping at epoch 500. Best Metrics: (0.0002454527116618208, 5.698763368349069e-05, 0.0001421475037516497)
2026-07-02 16:28:53,262 - optuna.study.study - INFO - Trial 102 finished with values: [0.0002454527116618208, 5.698763368349069e-05, 0.0001421475037516497] and parameters: {'n_layers': 3, 'embedding_dim': 64, 'lr': 0.0013969795863943153, 'lambda_val': 9.00355461091747e-05, 'batch_size': 1092, 'optimizer': 'SGD'}.
2026-07-02 16:32:21,136 - experiment_functions - INFO - Early stopping at epoch 2650. Best Metrics: (0.00020867320054190775, 5.31884581045913e-05, 0.00013070286342342966)
2026-07-02 16:32:21,239 - optuna.study.study - INFO - Trial 103 finished with values: [0.00020867320054190775, 5.31884581045913e-05, 0.00013070286342342966] and parameters: {'n_layers': 1, 'embedding_dim': 64, 'lr': 4.4348902953140375e-05, 'lambda_val': 0.00044379091524845374, 'batch_size': 1567, 'optimizer': 'Adam'}.
2026-07-02 16:38:15,599 - optuna.study.study - INFO - Trial 104 finished with values: [0.00660772429534978, 0.0017485705601884393, 0.004300579399767609] and parameters: {'n_layers': 3, 'embedding_dim': 64, 'lr': 0.019732524959614816, 'lambda_val': 0.00044379091524845374, 'batch_size': 1891, 'optimizer': 'RMSprop'}.
2026-07-02 16:40:07,343 - experiment_functions - INFO - Early stopping at epoch 1150. Best Metrics: (0.008650866133063028, 0.002103793476815531, 0.005052970944743154)
2026-07-02 16:40:07,490 - optuna.study.study - INFO - Trial 105 finished with values: [0.008650866133063028, 0.002103793476815531, 0.005052970944743154] and parameters: {'n_layers': 3, 'embedding_dim': 96, 'lr': 0.0006781284315626388, 'lambda_val': 0.008015948669672757, 'batch_size': 2370, 'optimizer': 'Adam'}.
2026-07-02 16:46:30,015 - optuna.study.study - INFO - Trial 106 finished with values: [0.01638261546605025, 0.003873259502687917, 0.010707407770659276] and parameters: {'n_layers': 1, 'embedding_dim': 256, 'lr': 0.0005152458540342933, 'lambda_val': 5.288093815108994e-05, 'batch_size': 2371, 'optimizer': 'Adam'}.
2026-07-02 16:47:17,826 - experiment_functions - INFO - Early stopping at epoch 550. Best Metrics: (0.004878088331363057, 0.0014531846589290126, 0.0032182667269720264)
2026-07-02 16:47:17,929 - optuna.study.study - INFO - Trial 107 finished with values: [0.004878088331363057, 0.0014531846589290126, 0.0032182667269720264] and parameters: {'n_layers': 2, 'embedding_dim': 32, 'lr': 0.019732524959614816, 'lambda_val': 0.0012545102603406476, 'batch_size': 2278, 'optimizer': 'Adam'}.
2026-07-02 16:48:50,337 - experiment_functions - INFO - Early stopping at epoch 950. Best Metrics: (0.008052457033903426, 0.0019024371711338641, 0.004685375760351312)
2026-07-02 16:48:50,437 - optuna.study.study - INFO - Trial 108 finished with values: [0.008052457033903426, 0.0019024371711338641, 0.004685375760351312] and parameters: {'n_layers': 4, 'embedding_dim': 64, 'lr': 0.0012100089708552634, 'lambda_val': 9.00355461091747e-05, 'batch_size': 677, 'optimizer': 'RMSprop'}.
2026-07-02 16:50:46,294 - experiment_functions - INFO - Early stopping at epoch 1450. Best Metrics: (0.00022954347136830788, 6.458598484128944e-05, 0.0001267419901087612)
2026-07-02 16:50:46,400 - optuna.study.study - INFO - Trial 109 finished with values: [0.00022954347136830788, 6.458598484128944e-05, 0.0001267419901087612] and parameters: {'n_layers': 1, 'embedding_dim': 64, 'lr': 0.00012340164517186117, 'lambda_val': 0.00045598605516994004, 'batch_size': 2533, 'optimizer': 'Adam'}.
2026-07-02 16:53:56,171 - experiment_functions - INFO - Early stopping at epoch 1850. Best Metrics: (0.013054412414611897, 0.003034591493645879, 0.008028258529721489)
2026-07-02 16:53:56,276 - optuna.study.study - INFO - Trial 110 finished with values: [0.013054412414611897, 0.003034591493645879, 0.008028258529721489] and parameters: {'n_layers': 4, 'embedding_dim': 96, 'lr': 0.0005152458540342933, 'lambda_val': 9.00355461091747e-05, 'batch_size': 1948, 'optimizer': 'RMSprop'}.
