2026-07-03 20:27:35,883 - optuna.study.study - INFO - Trial 233 finished with values: [0.023745070644438464, 0.005159280436145357, 0.014109309546736512] and parameters: {'n_layers': 1, 'embedding_dim': 96, 'lr': 0.0040524633409478395, 'lambda_val': 2.5379243415253125e-05, 'batch_size': 3121, 'optimizer': 'Adam'}.
2026-07-03 20:33:51,920 - optuna.study.study - INFO - Trial 234 finished with values: [0.023304381891748587, 0.005126987443724711, 0.013705878576495101] and parameters: {'n_layers': 1, 'embedding_dim': 256, 'lr': 0.003942474684271309, 'lambda_val': 2.0533552356322422e-05, 'batch_size': 1548, 'optimizer': 'Adam'}.
2026-07-03 20:39:52,888 - optuna.study.study - INFO - Trial 235 finished with values: [0.024129429446122955, 0.00516782858119788, 0.014152294498801087] and parameters: {'n_layers': 2, 'embedding_dim': 128, 'lr': 0.0015735980650247014, 'lambda_val': 1.722007256837861e-06, 'batch_size': 3913, 'optimizer': 'Adam'}.
2026-07-03 20:45:31,571 - optuna.study.study - INFO - Trial 236 finished with values: [0.027399125988009816, 0.005951408544345876, 0.016386043505259365] and parameters: {'n_layers': 1, 'embedding_dim': 128, 'lr': 0.0022700314607702445, 'lambda_val': 1.360510913687726e-06, 'batch_size': 3349, 'optimizer': 'Adam'}.
2026-07-03 20:52:26,503 - optuna.study.study - INFO - Trial 237 finished with values: [0.02189045005524298, 0.004972171038884562, 0.013112244518892684] and parameters: {'n_layers': 2, 'embedding_dim': 256, 'lr': 0.0008850965018050803, 'lambda_val': 2.5379243415253125e-05, 'batch_size': 2599, 'optimizer': 'RMSprop'}.
2026-07-03 20:55:36,334 - experiment_functions - INFO - Early stopping at epoch 2250. Best Metrics: (0.015289933464463685, 0.0035930703037440883, 0.009094917226310242)
2026-07-03 20:55:36,441 - optuna.study.study - INFO - Trial 238 finished with values: [0.015289933464463685, 0.0035930703037440883, 0.009094917226310242] and parameters: {'n_layers': 1, 'embedding_dim': 128, 'lr': 0.0022700314607702445, 'lambda_val': 0.012953012229103649, 'batch_size': 3832, 'optimizer': 'Adam'}.
2026-07-03 21:01:52,670 - optuna.study.study - INFO - Trial 239 finished with values: [0.0235697305259553, 0.005368235092984823, 0.014296822705464772] and parameters: {'n_layers': 1, 'embedding_dim': 256, 'lr': 0.0014333316079584322, 'lambda_val': 0.0021058650140697312, 'batch_size': 3832, 'optimizer': 'Adam'}.
2026-07-03 21:07:49,103 - optuna.study.study - INFO - Trial 240 finished with values: [0.0213248868208244, 0.0046872328704671085, 0.012499434495558277] and parameters: {'n_layers': 2, 'embedding_dim': 128, 'lr': 0.0014333316079584322, 'lambda_val': 3.7175116690643465e-05, 'batch_size': 3121, 'optimizer': 'RMSprop'}.
2026-07-03 21:11:41,090 - experiment_functions - INFO - Early stopping at epoch 2850. Best Metrics: (0.016451019496316274, 0.0037868282582679564, 0.009568002814254422)
2026-07-03 21:11:41,186 - optuna.study.study - INFO - Trial 241 finished with values: [0.016451019496316274, 0.0037868282582679564, 0.009568002814254422] and parameters: {'n_layers': 1, 'embedding_dim': 96, 'lr': 0.0022700314607702445, 'lambda_val': 0.008107712298875159, 'batch_size': 3960, 'optimizer': 'RMSprop'}.
2026-07-03 21:19:17,456 - optuna.study.study - INFO - Trial 242 finished with values: [0.01677195902206517, 0.0037060957772163446, 0.009939836390006689] and parameters: {'n_layers': 3, 'embedding_dim': 256, 'lr': 0.0026410131585060054, 'lambda_val': 2.1822424023435777e-05, 'batch_size': 1026, 'optimizer': 'RMSprop'}.
2026-07-03 21:24:28,681 - optuna.study.study - INFO - Trial 243 finished with values: [0.016202528588749186, 0.003840016716372547, 0.00985383150556353] and parameters: {'n_layers': 2, 'embedding_dim': 32, 'lr': 0.0010282533123218839, 'lambda_val': 9.917852447655537e-05, 'batch_size': 2599, 'optimizer': 'Adam'}.
2026-07-03 21:31:24,321 - optuna.study.study - INFO - Trial 244 finished with values: [0.01492903688033541, 0.003335676158273655, 0.008580506525473604] and parameters: {'n_layers': 2, 'embedding_dim': 256, 'lr': 0.0026410131585060054, 'lambda_val': 0.0012137845603352728, 'batch_size': 1632, 'optimizer': 'Adam'}.
2026-07-03 21:37:19,763 - optuna.study.study - INFO - Trial 245 finished with values: [0.019365512275760083, 0.004419390992154702, 0.011528724535224605] and parameters: {'n_layers': 2, 'embedding_dim': 128, 'lr': 0.0010282533123218839, 'lambda_val': 6.484021368099217e-05, 'batch_size': 2165, 'optimizer': 'RMSprop'}.
2026-07-03 21:42:50,648 - optuna.study.study - INFO - Trial 246 finished with values: [0.014994058398959925, 0.003669053815322075, 0.0092915605022548] and parameters: {'n_layers': 1, 'embedding_dim': 128, 'lr': 0.0008107107656200319, 'lambda_val': 7.33580764656977e-05, 'batch_size': 3121, 'optimizer': 'RMSprop'}.
2026-07-03 21:48:25,093 - optuna.study.study - INFO - Trial 247 finished with values: [0.022253197174062732, 0.005107991565830215, 0.013309075738339548] and parameters: {'n_layers': 1, 'embedding_dim': 128, 'lr': 0.0014333316079584322, 'lambda_val': 2.302284243959985e-05, 'batch_size': 2366, 'optimizer': 'RMSprop'}.
2026-07-03 21:53:50,408 - optuna.study.study - INFO - Trial 248 finished with values: [0.02213854657667675, 0.004916133199095798, 0.013228327271744356] and parameters: {'n_layers': 1, 'embedding_dim': 96, 'lr': 0.0040524633409478395, 'lambda_val': 2.0533552356322422e-05, 'batch_size': 1548, 'optimizer': 'Adam'}.
2026-07-03 22:00:04,223 - optuna.study.study - INFO - Trial 249 finished with values: [0.010307707495124009, 0.0023592880344965143, 0.005967027730902135] and parameters: {'n_layers': 4, 'embedding_dim': 96, 'lr': 0.0022700314607702445, 'lambda_val': 2.0533552356322422e-05, 'batch_size': 1389, 'optimizer': 'Adam'}.
2026-07-03 22:05:23,417 - experiment_functions - INFO - Early stopping at epoch 3750. Best Metrics: (0.01904626621347843, 0.004261725205630377, 0.011097121218713387)
2026-07-03 22:05:23,525 - optuna.study.study - INFO - Trial 250 finished with values: [0.01904626621347843, 0.004261725205630377, 0.011097121218713387] and parameters: {'n_layers': 2, 'embedding_dim': 96, 'lr': 0.0022700314607702445, 'lambda_val': 2.0533552356322422e-05, 'batch_size': 3121, 'optimizer': 'RMSprop'}.
2026-07-03 22:06:23,827 - experiment_functions - INFO - Early stopping at epoch 650. Best Metrics: (0.00021492877670770434, 5.31884581045913e-05, 0.00013325512375306507)
2026-07-03 22:06:23,931 - optuna.study.study - INFO - Trial 251 finished with values: [0.00021492877670770434, 5.31884581045913e-05, 0.00013325512375306507] and parameters: {'n_layers': 3, 'embedding_dim': 96, 'lr': 1.0072883213596244e-05, 'lambda_val': 3.7175116690643465e-05, 'batch_size': 3832, 'optimizer': 'RMSprop'}.
2026-07-03 22:12:28,437 - experiment_functions - INFO - Early stopping at epoch 3900. Best Metrics: (0.013587260035344577, 0.003086830157855746, 0.008087520567198265)
2026-07-03 22:12:28,597 - optuna.study.study - INFO - Trial 252 finished with values: [0.013587260035344577, 0.003086830157855746, 0.008087520567198265] and parameters: {'n_layers': 4, 'embedding_dim': 96, 'lr': 0.005306455009021957, 'lambda_val': 7.33580764656977e-05, 'batch_size': 3121, 'optimizer': 'RMSprop'}.
2026-07-03 22:17:55,004 - optuna.study.study - INFO - Trial 253 finished with values: [0.02308889661639104, 0.005061451664988698, 0.013450011009474029] and parameters: {'n_layers': 1, 'embedding_dim': 96, 'lr': 0.0040524633409478395, 'lambda_val': 2.0533552356322422e-05, 'batch_size': 1548, 'optimizer': 'Adam'}.
2026-07-03 22:23:52,605 - optuna.study.study - INFO - Trial 254 finished with values: [0.019389849296538808, 0.004266474175104003, 0.011375977960261734] and parameters: {'n_layers': 2, 'embedding_dim': 128, 'lr': 0.0022700314607702445, 'lambda_val': 2.0533552356322422e-05, 'batch_size': 1750, 'optimizer': 'Adam'}.
2026-07-03 22:29:09,133 - optuna.study.study - INFO - Trial 255 finished with values: [0.025291554261815712, 0.00557529016203484, 0.015074649062502558] and parameters: {'n_layers': 1, 'embedding_dim': 64, 'lr': 0.0018743209181168723, 'lambda_val': 2.0533552356322422e-05, 'batch_size': 3832, 'optimizer': 'Adam'}.
2026-07-03 22:34:46,316 - optuna.study.study - INFO - Trial 256 finished with values: [0.025168034046941682, 0.0057035123378226926, 0.015343759839179504] and parameters: {'n_layers': 1, 'embedding_dim': 128, 'lr': 0.0015735980650247014, 'lambda_val': 1.722007256837861e-06, 'batch_size': 3913, 'optimizer': 'Adam'}.
2026-07-03 22:39:42,668 - experiment_functions - INFO - Early stopping at epoch 3700. Best Metrics: (0.010252291788563036, 0.002468514332389872, 0.00593253358876418)
2026-07-03 22:39:42,949 - optuna.study.study - INFO - Trial 257 finished with values: [0.010252291788563036, 0.002468514332389872, 0.00593253358876418] and parameters: {'n_layers': 1, 'embedding_dim': 96, 'lr': 0.0022700314607702445, 'lambda_val': 0.027885381943155062, 'batch_size': 2790, 'optimizer': 'Adam'}.
2026-07-03 22:45:08,365 - optuna.study.study - INFO - Trial 258 finished with values: [0.025853901846138793, 0.005610432536139657, 0.015490543335041197] and parameters: {'n_layers': 1, 'embedding_dim': 96, 'lr': 0.0022700314607702445, 'lambda_val': 2.0533552356322422e-05, 'batch_size': 3121, 'optimizer': 'RMSprop'}.
2026-07-03 22:46:00,076 - experiment_functions - INFO - Early stopping at epoch 550. Best Metrics: (0.004792776449370603, 0.0010960621545124708, 0.002989569300001223)
2026-07-03 22:46:00,225 - optuna.study.study - INFO - Trial 259 finished with values: [0.004792776449370603, 0.0010960621545124708, 0.002989569300001223] and parameters: {'n_layers': 2, 'embedding_dim': 128, 'lr': 0.04885803110495001, 'lambda_val': 1.360510913687726e-06, 'batch_size': 2826, 'optimizer': 'RMSprop'}.
2026-07-03 22:51:14,159 - optuna.study.study - INFO - Trial 260 finished with values: [0.01998915862711098, 0.004701479778887982, 0.012222030525572835] and parameters: {'n_layers': 1, 'embedding_dim': 64, 'lr': 0.0018743209181168723, 'lambda_val': 0.0009968004606582162, 'batch_size': 2527, 'optimizer': 'Adam'}.
2026-07-03 22:56:37,818 - optuna.study.study - INFO - Trial 261 finished with values: [0.02405434936715427, 0.005145033527724484, 0.014256553991144437] and parameters: {'n_layers': 1, 'embedding_dim': 96, 'lr': 0.0040524633409478395, 'lambda_val': 2.407155618872632e-06, 'batch_size': 3121, 'optimizer': 'RMSprop'}.
2026-07-03 23:00:11,923 - experiment_functions - INFO - Early stopping at epoch 2700. Best Metrics: (0.023816443418944667, 0.005179226107934577, 0.01394553174176442)
2026-07-03 23:00:12,036 - optuna.study.study - INFO - Trial 262 finished with values: [0.023816443418944667, 0.005179226107934577, 0.01394553174176442] and parameters: {'n_layers': 1, 'embedding_dim': 64, 'lr': 0.0040524633409478395, 'lambda_val': 2.5379243415253125e-05, 'batch_size': 3121, 'optimizer': 'Adam'}.
2026-07-03 23:05:42,549 - optuna.study.study - INFO - Trial 263 finished with values: [0.01472314190358781, 0.003590220922059913, 0.008927916970261589] and parameters: {'n_layers': 1, 'embedding_dim': 128, 'lr': 0.0008107107656200319, 'lambda_val': 2.0533552356322422e-05, 'batch_size': 2599, 'optimizer': 'RMSprop'}.
2026-07-03 23:12:00,030 - optuna.study.study - INFO - Trial 264 finished with values: [0.025817084760502724, 0.00559903500940296, 0.015277371097186613] and parameters: {'n_layers': 1, 'embedding_dim': 256, 'lr': 0.0022700314607702445, 'lambda_val': 0.0008248417682209932, 'batch_size': 3832, 'optimizer': 'Adam'}.
2026-07-03 23:18:14,926 - optuna.study.study - INFO - Trial 265 finished with values: [0.023209106015853125, 0.005245711680565317, 0.013895988300882827] and parameters: {'n_layers': 1, 'embedding_dim': 256, 'lr': 0.0014333316079584322, 'lambda_val': 0.00029211819050406485, 'batch_size': 2366, 'optimizer': 'Adam'}.
2026-07-03 23:24:29,251 - optuna.study.study - INFO - Trial 266 finished with values: [0.027270690509714895, 0.005929563284767206, 0.016235813194816904] and parameters: {'n_layers': 1, 'embedding_dim': 256, 'lr': 0.0022700314607702445, 'lambda_val': 2.219891852826878e-05, 'batch_size': 2790, 'optimizer': 'RMSprop'}.
2026-07-03 23:29:56,149 - optuna.study.study - INFO - Trial 267 finished with values: [0.02608838145112003, 0.0057538514142431085, 0.015770919378451403] and parameters: {'n_layers': 1, 'embedding_dim': 96, 'lr': 0.0022700314607702445, 'lambda_val': 2.0533552356322422e-05, 'batch_size': 3360, 'optimizer': 'Adam'}.
2026-07-03 23:34:08,658 - experiment_functions - INFO - Early stopping at epoch 3200. Best Metrics: (0.023433661294782488, 0.005084246718462094, 0.013742530915320985)
2026-07-03 23:34:08,770 - optuna.study.study - INFO - Trial 268 finished with values: [0.023433661294782488, 0.005084246718462094, 0.013742530915320985] and parameters: {'n_layers': 1, 'embedding_dim': 64, 'lr': 0.0040524633409478395, 'lambda_val': 5.384881228226039e-06, 'batch_size': 3839, 'optimizer': 'Adam'}.
2026-07-03 23:34:51,402 - experiment_functions - INFO - Early stopping at epoch 500. Best Metrics: (0.0001859683762274021, 5.8887221472940384e-05, 0.00011889675682091167)
2026-07-03 23:34:51,508 - optuna.study.study - INFO - Trial 269 finished with values: [0.0001859683762274021, 5.8887221472940384e-05, 0.00011889675682091167] and parameters: {'n_layers': 1, 'embedding_dim': 96, 'lr': 1.913513990436218e-05, 'lambda_val': 0.009316295076421774, 'batch_size': 2790, 'optimizer': 'RMSprop'}.
2026-07-03 23:41:03,360 - optuna.study.study - INFO - Trial 270 finished with values: [0.023497229421700763, 0.005260908382880914, 0.014311777131605979] and parameters: {'n_layers': 1, 'embedding_dim': 256, 'lr': 0.0022700314607702445, 'lambda_val': 2.5379243415253125e-05, 'batch_size': 1228, 'optimizer': 'RMSprop'}.
2026-07-03 23:46:29,764 - optuna.study.study - INFO - Trial 271 finished with values: [0.022493871245715304, 0.005202021161407975, 0.013830929720308164] and parameters: {'n_layers': 1, 'embedding_dim': 96, 'lr': 0.0014333316079584322, 'lambda_val': 0.00015236573767345014, 'batch_size': 3832, 'optimizer': 'Adam'}.
2026-07-03 23:51:28,027 - experiment_functions - INFO - Early stopping at epoch 3550. Best Metrics: (0.021289894115604908, 0.00455806090078453, 0.012458710890575325)
2026-07-03 23:51:28,216 - optuna.study.study - INFO - Trial 272 finished with values: [0.021289894115604908, 0.00455806090078453, 0.012458710890575325] and parameters: {'n_layers': 1, 'embedding_dim': 128, 'lr': 0.005306455009021957, 'lambda_val': 0.00015236573767345014, 'batch_size': 3960, 'optimizer': 'RMSprop'}.
2026-07-03 23:56:56,040 - optuna.study.study - INFO - Trial 273 finished with values: [0.006863810824552364, 0.001823604277871702, 0.004312498241361265] and parameters: {'n_layers': 1, 'embedding_dim': 128, 'lr': 0.0014333316079584322, 'lambda_val': 0.03630738044055308, 'batch_size': 1398, 'optimizer': 'RMSprop'}.
2026-07-04 00:02:20,199 - optuna.study.study - INFO - Trial 274 finished with values: [0.017238707530555928, 0.004207586953631062, 0.010797232313445256] and parameters: {'n_layers': 1, 'embedding_dim': 96, 'lr': 0.0018743209181168723, 'lambda_val': 2.0533552356322422e-05, 'batch_size': 1146, 'optimizer': 'Adam'}.
2026-07-04 00:07:58,048 - optuna.study.study - INFO - Trial 275 finished with values: [0.026900070361155128, 0.005922914727504132, 0.016285732905636605] and parameters: {'n_layers': 1, 'embedding_dim': 128, 'lr': 0.0022700314607702445, 'lambda_val': 2.0533552356322422e-05, 'batch_size': 2832, 'optimizer': 'Adam'}.
2026-07-04 00:13:23,639 - optuna.study.study - INFO - Trial 276 finished with values: [0.024641770902959124, 0.005480310772562354, 0.014711902415310691] and parameters: {'n_layers': 1, 'embedding_dim': 96, 'lr': 0.0022700314607702445, 'lambda_val': 2.302284243959985e-05, 'batch_size': 2366, 'optimizer': 'Adam'}.
2026-07-04 00:18:51,541 - optuna.study.study - INFO - Trial 277 finished with values: [0.02259492818862181, 0.0050718993978306716, 0.013578558845875579] and parameters: {'n_layers': 1, 'embedding_dim': 96, 'lr': 0.0022700314607702445, 'lambda_val': 2.0533552356322422e-05, 'batch_size': 1548, 'optimizer': 'RMSprop'}.
2026-07-04 00:24:18,444 - optuna.study.study - INFO - Trial 278 finished with values: [0.02625219735668504, 0.005795642345611003, 0.015642503728228428] and parameters: {'n_layers': 1, 'embedding_dim': 96, 'lr': 0.0022700314607702445, 'lambda_val': 3.7175116690643465e-05, 'batch_size': 3121, 'optimizer': 'Adam'}.
2026-07-04 00:29:26,141 - experiment_functions - INFO - Early stopping at epoch 3600. Best Metrics: (0.019952795123300927, 0.004323461808787493, 0.011917705665823373)
2026-07-04 00:29:26,338 - optuna.study.study - INFO - Trial 279 finished with values: [0.019952795123300927, 0.004323461808787493, 0.011917705665823373] and parameters: {'n_layers': 2, 'embedding_dim': 96, 'lr': 0.0022700314607702445, 'lambda_val': 2.0533552356322422e-05, 'batch_size': 3832, 'optimizer': 'RMSprop'}.
2026-07-04 00:35:41,680 - optuna.study.study - INFO - Trial 280 finished with values: [0.023203838957995316, 0.005111790741409114, 0.013968386281830093] and parameters: {'n_layers': 1, 'embedding_dim': 256, 'lr': 0.003942474684271309, 'lambda_val': 0.00015236573767345014, 'batch_size': 1548, 'optimizer': 'Adam'}.
2026-07-04 00:36:35,527 - experiment_functions - INFO - Early stopping at epoch 550. Best Metrics: (0.0020954000862517226, 0.0005204870543092149, 0.001276575272718222)
2026-07-04 00:36:35,635 - optuna.study.study - INFO - Trial 281 finished with values: [0.0020954000862517226, 0.0005204870543092149, 0.001276575272718222] and parameters: {'n_layers': 1, 'embedding_dim': 256, 'lr': 0.04596549981487974, 'lambda_val': 0.00015236573767345014, 'batch_size': 2111, 'optimizer': 'RMSprop'}.
2026-07-04 00:42:02,082 - optuna.study.study - INFO - Trial 282 finished with values: [0.02614486606878459, 0.005713960070664666, 0.015589858580152296] and parameters: {'n_layers': 1, 'embedding_dim': 96, 'lr': 0.0022700314607702445, 'lambda_val': 3.212149396263254e-06, 'batch_size': 3232, 'optimizer': 'Adam'}.
2026-07-04 00:47:58,108 - optuna.study.study - INFO - Trial 283 finished with values: [0.021395232137764602, 0.004696730809414357, 0.012612567024972566] and parameters: {'n_layers': 2, 'embedding_dim': 128, 'lr': 0.0010282533123218839, 'lambda_val': 7.408845727030556e-06, 'batch_size': 3913, 'optimizer': 'RMSprop'}.
2026-07-04 00:53:13,139 - optuna.study.study - INFO - Trial 284 finished with values: [0.022394012927687987, 0.005137435176566686, 0.013708915605310814] and parameters: {'n_layers': 1, 'embedding_dim': 64, 'lr': 0.0018743209181168723, 'lambda_val': 3.212149396263254e-06, 'batch_size': 2599, 'optimizer': 'Adam'}.
2026-07-04 00:54:09,479 - experiment_functions - INFO - Early stopping at epoch 650. Best Metrics: (0.0018559580745206123, 0.00051953726041449, 0.0012232487767803604)
2026-07-04 00:54:09,651 - optuna.study.study - INFO - Trial 285 finished with values: [0.0018559580745206123, 0.00051953726041449, 0.0012232487767803604] and parameters: {'n_layers': 1, 'embedding_dim': 128, 'lr': 0.05798996932199646, 'lambda_val': 3.7175116690643465e-05, 'batch_size': 3121, 'optimizer': 'RMSprop'}.
2026-07-04 00:54:52,484 - experiment_functions - INFO - Early stopping at epoch 500. Best Metrics: (0.00024649737087074604, 6.36361909465646e-05, 0.0001476471643771165)
2026-07-04 00:54:52,592 - optuna.study.study - INFO - Trial 286 finished with values: [0.00024649737087074604, 6.36361909465646e-05, 0.0001476471643771165] and parameters: {'n_layers': 1, 'embedding_dim': 96, 'lr': 0.0010282533123218839, 'lambda_val': 3.7175116690643465e-05, 'batch_size': 2599, 'optimizer': 'SGD'}.
2026-07-04 01:00:33,562 - experiment_functions - INFO - Early stopping at epoch 3850. Best Metrics: (0.01767588117532268, 0.0038846570294246148, 0.010173764943935761)
2026-07-04 01:00:33,724 - optuna.study.study - INFO - Trial 287 finished with values: [0.01767588117532268, 0.0038846570294246148, 0.010173764943935761] and parameters: {'n_layers': 2, 'embedding_dim': 128, 'lr': 0.0026410131585060054, 'lambda_val': 3.7175116690643465e-05, 'batch_size': 2210, 'optimizer': 'RMSprop'}.
2026-07-04 01:01:16,838 - experiment_functions - INFO - Early stopping at epoch 500. Best Metrics: (0.0002658681843560236, 6.363619094656459e-05, 0.00015702948112120862)
2026-07-04 01:01:16,975 - optuna.study.study - INFO - Trial 288 finished with values: [0.0002658681843560236, 6.363619094656459e-05, 0.00015702948112120862] and parameters: {'n_layers': 2, 'embedding_dim': 64, 'lr': 0.005306455009021957, 'lambda_val': 7.329771199139694e-05, 'batch_size': 3121, 'optimizer': 'SGD'}.
2026-07-04 01:03:45,841 - experiment_functions - INFO - Early stopping at epoch 1600. Best Metrics: (0.00024037335308115532, 5.888722147294038e-05, 0.00014588988801188797)
2026-07-04 01:03:45,944 - optuna.study.study - INFO - Trial 289 finished with values: [0.00024037335308115532, 5.888722147294038e-05, 0.00014588988801188797] and parameters: {'n_layers': 1, 'embedding_dim': 256, 'lr': 1.012253811971171e-05, 'lambda_val': 4.426585129732606e-06, 'batch_size': 3832, 'optimizer': 'Adam'}.
2026-07-04 01:05:53,938 - experiment_functions - INFO - Early stopping at epoch 1600. Best Metrics: (0.0002550694233029892, 7.788309936743727e-05, 0.00016696594677940185)
2026-07-04 01:05:54,037 - optuna.study.study - INFO - Trial 290 finished with values: [0.0002550694233029892, 7.788309936743727e-05, 0.00016696594677940185] and parameters: {'n_layers': 1, 'embedding_dim': 96, 'lr': 7.880582803422306e-05, 'lambda_val': 3.7175116690643465e-05, 'batch_size': 1548, 'optimizer': 'RMSprop'}.
2026-07-04 01:11:19,214 - optuna.study.study - INFO - Trial 291 finished with values: [0.020237900996702755, 0.004719525862887754, 0.012273673286696677] and parameters: {'n_layers': 1, 'embedding_dim': 96, 'lr': 0.0026410131585060054, 'lambda_val': 7.329771199139694e-05, 'batch_size': 969, 'optimizer': 'Adam'}.
