2026-07-01 03:32:56,365 - optuna.study.study - INFO - Trial 120 finished with values: [0.002501403429695243, 0.0007427388256748286, 0.001682979357159413] and parameters: {'n_layers': 3, 'embedding_dim': 128, 'lr': 0.0027303142774942266, 'lambda_val': 4.889129207716808e-06, 'batch_size': 3022, 'optimizer': 'RMSprop'}.
2026-07-01 03:36:16,904 - experiment_functions - INFO - Early stopping at epoch 2450. Best Metrics: (0.0023542747441925925, 0.0006525084056759683, 0.0016586362263993945)
2026-07-01 03:36:16,993 - optuna.study.study - INFO - Trial 121 finished with values: [0.0023542747441925925, 0.0006525084056759683, 0.0016586362263993945] and parameters: {'n_layers': 3, 'embedding_dim': 96, 'lr': 0.0010455025017472735, 'lambda_val': 4.896683182666777e-06, 'batch_size': 3402, 'optimizer': 'Adam'}.
2026-07-01 03:41:21,306 - optuna.study.study - INFO - Trial 122 finished with values: [0.0011362647437524406, 0.00034572497767984344, 0.0008175686720965612] and parameters: {'n_layers': 2, 'embedding_dim': 64, 'lr': 0.0006773858234142329, 'lambda_val': 0.054886825440717865, 'batch_size': 3344, 'optimizer': 'Adam'}.
2026-07-01 03:42:15,264 - experiment_functions - INFO - Early stopping at epoch 600. Best Metrics: (0.0014661190248379478, 0.0004777463290465969, 0.0010270780960707027)
2026-07-01 03:42:15,339 - optuna.study.study - INFO - Trial 123 finished with values: [0.0014661190248379478, 0.0004777463290465969, 0.0010270780960707027] and parameters: {'n_layers': 3, 'embedding_dim': 128, 'lr': 0.0027303142774942266, 'lambda_val': 0.018338380328878464, 'batch_size': 3022, 'optimizer': 'RMSprop'}.
2026-07-01 03:43:12,037 - experiment_functions - INFO - Early stopping at epoch 700. Best Metrics: (0.0016805568289577821, 0.0004511520999943012, 0.0011108406833270918)
2026-07-01 03:43:12,153 - optuna.study.study - INFO - Trial 124 finished with values: [0.0016805568289577821, 0.0004511520999943012, 0.0011108406833270918] and parameters: {'n_layers': 2, 'embedding_dim': 64, 'lr': 0.0038571213778042786, 'lambda_val': 0.0007914071498367372, 'batch_size': 3342, 'optimizer': 'RMSprop'}.
2026-07-01 03:44:42,208 - experiment_functions - INFO - Early stopping at epoch 950. Best Metrics: (0.0012998128641032454, 0.0004274072526261801, 0.0009365818134705516)
2026-07-01 03:44:42,296 - optuna.study.study - INFO - Trial 125 finished with values: [0.0012998128641032454, 0.0004274072526261801, 0.0009365818134705516] and parameters: {'n_layers': 2, 'embedding_dim': 256, 'lr': 0.0038652724378170286, 'lambda_val': 0.060758280214166994, 'batch_size': 2607, 'optimizer': 'RMSprop'}.
2026-07-01 03:45:36,814 - experiment_functions - INFO - Early stopping at epoch 650. Best Metrics: (0.0015904509385617986, 0.0004587504511521, 0.0010735176681313564)
2026-07-01 03:45:36,917 - optuna.study.study - INFO - Trial 126 finished with values: [0.0015904509385617986, 0.0004587504511521, 0.0010735176681313564] and parameters: {'n_layers': 2, 'embedding_dim': 96, 'lr': 0.0038652724378170286, 'lambda_val': 0.002718086981783345, 'batch_size': 3660, 'optimizer': 'RMSprop'}.
2026-07-01 03:50:52,391 - optuna.study.study - INFO - Trial 127 finished with values: [0.00033765109004901556, 7.21843359990882e-05, 0.00017811486788567562] and parameters: {'n_layers': 4, 'embedding_dim': 64, 'lr': 7.306523433436068e-05, 'lambda_val': 0.00818244172221547, 'batch_size': 3304, 'optimizer': 'RMSprop'}.
2026-07-01 03:54:04,670 - experiment_functions - INFO - Early stopping at epoch 2350. Best Metrics: (0.0025521307204928456, 0.0007199437722014323, 0.0018173668041775361)
2026-07-01 03:54:04,760 - optuna.study.study - INFO - Trial 128 finished with values: [0.0025521307204928456, 0.0007199437722014323, 0.0018173668041775361] and parameters: {'n_layers': 3, 'embedding_dim': 96, 'lr': 0.0016405237668077803, 'lambda_val': 4.050788726107644e-05, 'batch_size': 1265, 'optimizer': 'Adam'}.
2026-07-01 03:56:10,425 - experiment_functions - INFO - Early stopping at epoch 1550. Best Metrics: (0.0028669288783546684, 0.0008244211006211651, 0.001967935344235375)
2026-07-01 03:56:10,500 - optuna.study.study - INFO - Trial 129 finished with values: [0.0028669288783546684, 0.0008244211006211651, 0.001967935344235375] and parameters: {'n_layers': 4, 'embedding_dim': 64, 'lr': 0.0011663890806018467, 'lambda_val': 4.134172720235837e-06, 'batch_size': 3342, 'optimizer': 'RMSprop'}.
2026-07-01 03:57:01,677 - experiment_functions - INFO - Early stopping at epoch 550. Best Metrics: (0.0014232205421711092, 0.00037991755788993793, 0.0009965562267552903)
2026-07-01 03:57:01,760 - optuna.study.study - INFO - Trial 130 finished with values: [0.0014232205421711092, 0.00037991755788993793, 0.0009965562267552903] and parameters: {'n_layers': 1, 'embedding_dim': 256, 'lr': 0.031461997995131906, 'lambda_val': 4.889129207716808e-06, 'batch_size': 3054, 'optimizer': 'Adam'}.
2026-07-01 03:58:40,533 - experiment_functions - INFO - Early stopping at epoch 1150. Best Metrics: (0.0027968784652149985, 0.0007911783143057956, 0.0018209574623902164)
2026-07-01 03:58:40,621 - optuna.study.study - INFO - Trial 131 finished with values: [0.0027968784652149985, 0.0007911783143057956, 0.0018209574623902164] and parameters: {'n_layers': 4, 'embedding_dim': 96, 'lr': 0.0016405237668077803, 'lambda_val': 1.3421969689673777e-05, 'batch_size': 3344, 'optimizer': 'RMSprop'}.
2026-07-01 04:01:28,741 - experiment_functions - INFO - Early stopping at epoch 2050. Best Metrics: (0.002841552736552639, 0.0008168227494633664, 0.001959403731345048)
2026-07-01 04:01:28,834 - optuna.study.study - INFO - Trial 132 finished with values: [0.002841552736552639, 0.0008168227494633664, 0.001959403731345048] and parameters: {'n_layers': 3, 'embedding_dim': 96, 'lr': 0.0010455025017472735, 'lambda_val': 4.9195072317508555e-06, 'batch_size': 2842, 'optimizer': 'RMSprop'}.
2026-07-01 04:02:27,071 - experiment_functions - INFO - Early stopping at epoch 650. Best Metrics: (0.0015908562544453956, 0.0004511520999943013, 0.0010491648537429288)
2026-07-01 04:02:27,160 - optuna.study.study - INFO - Trial 133 finished with values: [0.0015908562544453956, 0.0004511520999943013, 0.0010491648537429288] and parameters: {'n_layers': 3, 'embedding_dim': 128, 'lr': 0.0027303142774942266, 'lambda_val': 0.018338380328878464, 'batch_size': 1544, 'optimizer': 'RMSprop'}.
2026-07-01 04:04:48,837 - experiment_functions - INFO - Early stopping at epoch 1750. Best Metrics: (0.0019816649375266394, 0.0005822236574663297, 0.0013735973507473331)
2026-07-01 04:04:48,925 - optuna.study.study - INFO - Trial 134 finished with values: [0.0019816649375266394, 0.0005822236574663297, 0.0013735973507473331] and parameters: {'n_layers': 4, 'embedding_dim': 64, 'lr': 0.0008693206599023528, 'lambda_val': 0.00818244172221547, 'batch_size': 2607, 'optimizer': 'Adam'}.
2026-07-01 04:10:56,141 - optuna.study.study - INFO - Trial 135 finished with values: [0.0021432150594421755, 0.0005413825199931616, 0.0014258233510628599] and parameters: {'n_layers': 2, 'embedding_dim': 256, 'lr': 0.0010455025017472735, 'lambda_val': 4.9195072317508555e-06, 'batch_size': 840, 'optimizer': 'Adam'}.
2026-07-01 04:12:52,754 - experiment_functions - INFO - Early stopping at epoch 1150. Best Metrics: (0.0022041849166209806, 0.0006506088178865186, 0.00151060875591733)
2026-07-01 04:12:52,823 - optuna.study.study - INFO - Trial 136 finished with values: [0.0022041849166209806, 0.0006506088178865186, 0.00151060875591733] and parameters: {'n_layers': 3, 'embedding_dim': 256, 'lr': 0.0017202674480021566, 'lambda_val': 0.0002170393924492861, 'batch_size': 3304, 'optimizer': 'Adam'}.
2026-07-01 04:18:59,342 - optuna.study.study - INFO - Trial 137 finished with values: [0.0011523624627873123, 0.0002849381684174534, 0.0007595567413123356] and parameters: {'n_layers': 2, 'embedding_dim': 256, 'lr': 0.00039452895313047835, 'lambda_val': 0.0007130096093807206, 'batch_size': 1318, 'optimizer': 'Adam'}.
2026-07-01 04:24:34,024 - optuna.study.study - INFO - Trial 138 finished with values: [0.000879145847976228, 0.00020800486294474102, 0.0005583840238216299] and parameters: {'n_layers': 3, 'embedding_dim': 128, 'lr': 0.0002478082099623773, 'lambda_val': 4.9195072317508555e-06, 'batch_size': 1180, 'optimizer': 'RMSprop'}.
2026-07-01 04:25:25,247 - experiment_functions - INFO - Early stopping at epoch 600. Best Metrics: (0.002186325111569788, 0.0006249643827289479, 0.0014247202952139071)
2026-07-01 04:25:25,340 - optuna.study.study - INFO - Trial 139 finished with values: [0.002186325111569788, 0.0006249643827289479, 0.0014247202952139071] and parameters: {'n_layers': 4, 'embedding_dim': 64, 'lr': 0.005034910940629331, 'lambda_val': 4.461595733760336e-06, 'batch_size': 2607, 'optimizer': 'RMSprop'}.
2026-07-01 04:26:09,861 - experiment_functions - INFO - Early stopping at epoch 550. Best Metrics: (0.0008280680677121025, 0.00022985012252341243, 0.0005058099354868143)
2026-07-01 04:26:09,933 - optuna.study.study - INFO - Trial 140 finished with values: [0.0008280680677121025, 0.00022985012252341243, 0.0005058099354868143] and parameters: {'n_layers': 3, 'embedding_dim': 32, 'lr': 0.049631220521300534, 'lambda_val': 0.0002170393924492861, 'batch_size': 2842, 'optimizer': 'RMSprop'}.
2026-07-01 04:27:30,712 - experiment_functions - INFO - Early stopping at epoch 1000. Best Metrics: (0.002123310066123491, 0.0006116672682028, 0.001416862367053506)
2026-07-01 04:27:30,797 - optuna.study.study - INFO - Trial 141 finished with values: [0.002123310066123491, 0.0006116672682028, 0.001416862367053506] and parameters: {'n_layers': 3, 'embedding_dim': 64, 'lr': 0.001557510643925403, 'lambda_val': 0.002718086981783345, 'batch_size': 3295, 'optimizer': 'RMSprop'}.
2026-07-01 04:30:43,500 - experiment_functions - INFO - Early stopping at epoch 2500. Best Metrics: (0.0018430295249533125, 0.00043880477936287827, 0.0012000470379964706)
2026-07-01 04:30:43,586 - optuna.study.study - INFO - Trial 142 finished with values: [0.0018430295249533125, 0.00043880477936287827, 0.0012000470379964706] and parameters: {'n_layers': 1, 'embedding_dim': 96, 'lr': 0.0011423999744800083, 'lambda_val': 4.186926040366856e-06, 'batch_size': 3842, 'optimizer': 'Adam'}.
2026-07-01 04:31:37,669 - experiment_functions - INFO - Early stopping at epoch 550. Best Metrics: (0.0013305759917454328, 0.0003761183823110385, 0.0009468246000506484)
2026-07-01 04:31:37,755 - optuna.study.study - INFO - Trial 143 finished with values: [0.0013305759917454328, 0.0003761183823110385, 0.0009468246000506484] and parameters: {'n_layers': 2, 'embedding_dim': 256, 'lr': 0.034307056579589164, 'lambda_val': 0.00011682518010112995, 'batch_size': 2839, 'optimizer': 'RMSprop'}.
2026-07-01 04:34:02,886 - experiment_functions - INFO - Early stopping at epoch 1850. Best Metrics: (0.00027602987077104236, 8.45316566305112e-05, 0.00015353592233504205)
2026-07-01 04:34:02,969 - optuna.study.study - INFO - Trial 144 finished with values: [0.00027602987077104236, 8.45316566305112e-05, 0.00015353592233504205] and parameters: {'n_layers': 3, 'embedding_dim': 64, 'lr': 4.1391584261010236e-05, 'lambda_val': 0.00025685620781996097, 'batch_size': 977, 'optimizer': 'RMSprop'}.
2026-07-01 04:35:58,920 - experiment_functions - INFO - Early stopping at epoch 1450. Best Metrics: (0.00201156549144706, 0.0005033907642041677, 0.0013450012636061477)
2026-07-01 04:35:59,001 - optuna.study.study - INFO - Trial 145 finished with values: [0.00201156549144706, 0.0005033907642041677, 0.0013450012636061477] and parameters: {'n_layers': 1, 'embedding_dim': 128, 'lr': 0.001557510643925403, 'lambda_val': 7.991464155756268e-05, 'batch_size': 3344, 'optimizer': 'RMSprop'}.
2026-07-01 04:37:45,931 - experiment_functions - INFO - Early stopping at epoch 1250. Best Metrics: (0.002940901300596762, 0.0008500655357787362, 0.00197502797450455)
2026-07-01 04:37:46,000 - optuna.study.study - INFO - Trial 146 finished with values: [0.002940901300596762, 0.0008500655357787362, 0.00197502797450455] and parameters: {'n_layers': 4, 'embedding_dim': 96, 'lr': 0.0016405237668077803, 'lambda_val': 3.186188638129305e-06, 'batch_size': 2475, 'optimizer': 'RMSprop'}.
2026-07-01 04:43:32,610 - experiment_functions - INFO - Early stopping at epoch 3350. Best Metrics: (0.0033260505117034167, 0.0009488441008301201, 0.0022227081488915452)
2026-07-01 04:43:32,730 - optuna.study.study - INFO - Trial 147 finished with values: [0.0033260505117034167, 0.0009488441008301201, 0.0022227081488915452] and parameters: {'n_layers': 4, 'embedding_dim': 256, 'lr': 0.0006773858234142329, 'lambda_val': 1.3573657888080551e-06, 'batch_size': 1203, 'optimizer': 'RMSprop'}.
2026-07-01 04:49:04,869 - optuna.study.study - INFO - Trial 148 finished with values: [0.0022285085626098516, 0.0006088178865186254, 0.001567617163663212] and parameters: {'n_layers': 4, 'embedding_dim': 96, 'lr': 0.00039452895313047835, 'lambda_val': 0.00022111146363119937, 'batch_size': 2839, 'optimizer': 'RMSprop'}.
2026-07-01 04:49:57,107 - experiment_functions - INFO - Early stopping at epoch 600. Best Metrics: (0.0016538050786861795, 0.00046444921452044906, 0.001098822410849202)
2026-07-01 04:49:57,203 - optuna.study.study - INFO - Trial 149 finished with values: [0.0016538050786861795, 0.00046444921452044906, 0.001098822410849202] and parameters: {'n_layers': 3, 'embedding_dim': 96, 'lr': 0.027207137179041257, 'lambda_val': 1.3573657888080551e-06, 'batch_size': 870, 'optimizer': 'Adam'}.
2026-07-01 04:50:41,144 - experiment_functions - INFO - Early stopping at epoch 500. Best Metrics: (0.00018332734312186306, 5.983701536766521e-05, 0.00010792156297355018)
2026-07-01 04:50:41,234 - optuna.study.study - INFO - Trial 150 finished with values: [0.00018332734312186306, 5.983701536766521e-05, 0.00010792156297355018] and parameters: {'n_layers': 3, 'embedding_dim': 96, 'lr': 0.0011423999744800083, 'lambda_val': 1.9470910869906704e-05, 'batch_size': 3342, 'optimizer': 'SGD'}.
2026-07-01 04:55:21,058 - experiment_functions - INFO - Early stopping at epoch 3600. Best Metrics: (0.0028210834111774253, 0.0007626844974640502, 0.0018651619034751345)
2026-07-01 04:55:21,144 - optuna.study.study - INFO - Trial 151 finished with values: [0.0028210834111774253, 0.0007626844974640502, 0.0018651619034751345] and parameters: {'n_layers': 3, 'embedding_dim': 64, 'lr': 0.0008921739854607602, 'lambda_val': 4.134172720235837e-06, 'batch_size': 2839, 'optimizer': 'RMSprop'}.
2026-07-01 04:59:00,209 - experiment_functions - INFO - Early stopping at epoch 2100. Best Metrics: (0.003061379542440775, 0.0008757099709363068, 0.0020316244121946127)
2026-07-01 04:59:00,308 - optuna.study.study - INFO - Trial 152 finished with values: [0.003061379542440775, 0.0008757099709363068, 0.0020316244121946127] and parameters: {'n_layers': 4, 'embedding_dim': 256, 'lr': 0.0011423999744800083, 'lambda_val': 1.3573657888080551e-06, 'batch_size': 1203, 'optimizer': 'RMSprop'}.
2026-07-01 05:02:19,507 - experiment_functions - INFO - Early stopping at epoch 2250. Best Metrics: (0.0025624161176057546, 0.0007493873829379025, 0.0016934540062126314)
2026-07-01 05:02:19,596 - optuna.study.study - INFO - Trial 153 finished with values: [0.0025624161176057546, 0.0007493873829379025, 0.0016934540062126314] and parameters: {'n_layers': 4, 'embedding_dim': 128, 'lr': 0.0016405237668077803, 'lambda_val': 3.186188638129305e-06, 'batch_size': 3022, 'optimizer': 'Adam'}.
2026-07-01 05:03:18,587 - experiment_functions - INFO - Early stopping at epoch 700. Best Metrics: (0.002238391777618574, 0.0006401610850445454, 0.0015403601023221234)
2026-07-01 05:03:18,683 - optuna.study.study - INFO - Trial 154 finished with values: [0.002238391777618574, 0.0006401610850445454, 0.0015403601023221234] and parameters: {'n_layers': 4, 'embedding_dim': 64, 'lr': 0.005034910940629331, 'lambda_val': 4.134172720235837e-06, 'batch_size': 2607, 'optimizer': 'RMSprop'}.
2026-07-01 05:03:58,931 - experiment_functions - INFO - Early stopping at epoch 500. Best Metrics: (0.0002773496998526726, 6.648557263073914e-05, 0.0001601128991621873)
2026-07-01 05:03:59,251 - optuna.study.study - INFO - Trial 155 finished with values: [0.0002773496998526726, 6.648557263073914e-05, 0.0001601128991621873] and parameters: {'n_layers': 3, 'embedding_dim': 32, 'lr': 0.001557510643925403, 'lambda_val': 1.9470910869906704e-05, 'batch_size': 2842, 'optimizer': 'SGD'}.
2026-07-01 05:07:07,241 - experiment_functions - INFO - Early stopping at epoch 2250. Best Metrics: (0.0002735491369607834, 6.36361909465646e-05, 0.00015273255085157097)
2026-07-01 05:07:07,335 - optuna.study.study - INFO - Trial 156 finished with values: [0.0002735491369607834, 6.36361909465646e-05, 0.00015273255085157097] and parameters: {'n_layers': 4, 'embedding_dim': 96, 'lr': 5.084148730445775e-05, 'lambda_val': 0.003195386254489329, 'batch_size': 2475, 'optimizer': 'RMSprop'}.
2026-07-01 05:09:08,609 - experiment_functions - INFO - Early stopping at epoch 1500. Best Metrics: (0.0027087326378024052, 0.0007759816119901981, 0.0017762782538278481)
2026-07-01 05:09:08,684 - optuna.study.study - INFO - Trial 157 finished with values: [0.0027087326378024052, 0.0007759816119901981, 0.0017762782538278481] and parameters: {'n_layers': 4, 'embedding_dim': 64, 'lr': 0.0011663890806018467, 'lambda_val': 1.9470910869906704e-05, 'batch_size': 3342, 'optimizer': 'RMSprop'}.
2026-07-01 05:11:54,245 - experiment_functions - INFO - Early stopping at epoch 2150. Best Metrics: (0.001796419403677248, 0.00046634880230989875, 0.0012181660904600215)
2026-07-01 05:11:54,319 - optuna.study.study - INFO - Trial 158 finished with values: [0.001796419403677248, 0.00046634880230989875, 0.0012181660904600215] and parameters: {'n_layers': 1, 'embedding_dim': 96, 'lr': 0.0038652724378170286, 'lambda_val': 4.134172720235837e-06, 'batch_size': 2692, 'optimizer': 'RMSprop'}.
2026-07-01 05:12:55,755 - experiment_functions - INFO - Early stopping at epoch 750. Best Metrics: (0.0017342141524522015, 0.000513838497046141, 0.0011819220925259207)
2026-07-01 05:12:55,846 - optuna.study.study - INFO - Trial 159 finished with values: [0.0017342141524522015, 0.000513838497046141, 0.0011819220925259207] and parameters: {'n_layers': 3, 'embedding_dim': 64, 'lr': 0.012230674461303695, 'lambda_val': 4.186926040366856e-06, 'batch_size': 2842, 'optimizer': 'RMSprop'}.
2026-07-01 05:16:24,588 - experiment_functions - INFO - Early stopping at epoch 2550. Best Metrics: (0.0020727861833695444, 0.0005641775734665578, 0.0014402589962017058)
2026-07-01 05:16:24,670 - optuna.study.study - INFO - Trial 160 finished with values: [0.0020727861833695444, 0.0005641775734665578, 0.0014402589962017058] and parameters: {'n_layers': 3, 'embedding_dim': 96, 'lr': 0.0006152603091001123, 'lambda_val': 0.0045975674207156415, 'batch_size': 3005, 'optimizer': 'Adam'}.
2026-07-01 05:21:20,847 - experiment_functions - INFO - Early stopping at epoch 2850. Best Metrics: (0.0029848182816854655, 0.0008785593526204815, 0.0019857473644856656)
2026-07-01 05:21:20,924 - optuna.study.study - INFO - Trial 161 finished with values: [0.0029848182816854655, 0.0008785593526204815, 0.0019857473644856656] and parameters: {'n_layers': 4, 'embedding_dim': 256, 'lr': 0.0006943898292817254, 'lambda_val': 0.00011682518010112995, 'batch_size': 1203, 'optimizer': 'RMSprop'}.
2026-07-01 05:24:51,582 - experiment_functions - INFO - Early stopping at epoch 2500. Best Metrics: (0.002577316588185336, 0.0007512869707273522, 0.0017441417653215796)
2026-07-01 05:24:51,669 - optuna.study.study - INFO - Trial 162 finished with values: [0.002577316588185336, 0.0007512869707273522, 0.0017441417653215796] and parameters: {'n_layers': 4, 'embedding_dim': 96, 'lr': 0.0011423999744800083, 'lambda_val': 4.186926040366856e-06, 'batch_size': 3005, 'optimizer': 'Adam'}.
2026-07-01 05:27:52,877 - experiment_functions - INFO - Early stopping at epoch 2150. Best Metrics: (0.0031125625268839355, 0.0009127519328305759, 0.0021525413329708505)
2026-07-01 05:27:52,968 - optuna.study.study - INFO - Trial 163 finished with values: [0.0031125625268839355, 0.0009127519328305759, 0.0021525413329708505] and parameters: {'n_layers': 4, 'embedding_dim': 96, 'lr': 0.0010455025017472735, 'lambda_val': 4.9195072317508555e-06, 'batch_size': 2475, 'optimizer': 'RMSprop'}.
2026-07-01 05:29:40,339 - experiment_functions - INFO - Early stopping at epoch 1250. Best Metrics: (0.002073876340348146, 0.0006164162376764243, 0.0013881318348674945)
2026-07-01 05:29:40,432 - optuna.study.study - INFO - Trial 164 finished with values: [0.002073876340348146, 0.0006164162376764243, 0.0013881318348674945] and parameters: {'n_layers': 4, 'embedding_dim': 96, 'lr': 0.0008693206599023528, 'lambda_val': 0.00818244172221547, 'batch_size': 3005, 'optimizer': 'Adam'}.
2026-07-01 05:31:58,020 - experiment_functions - INFO - Early stopping at epoch 1700. Best Metrics: (0.003079984855878108, 0.0008833083220941057, 0.002085698444455136)
2026-07-01 05:31:58,114 - optuna.study.study - INFO - Trial 165 finished with values: [0.003079984855878108, 0.0008833083220941057, 0.002085698444455136] and parameters: {'n_layers': 4, 'embedding_dim': 64, 'lr': 0.0011663890806018467, 'lambda_val': 1.6580882382113483e-05, 'batch_size': 3342, 'optimizer': 'RMSprop'}.
2026-07-01 05:34:32,328 - experiment_functions - INFO - Early stopping at epoch 2100. Best Metrics: (0.0021134491587584173, 0.0004919932374674695, 0.0013499659349521197)
2026-07-01 05:34:32,451 - optuna.study.study - INFO - Trial 166 finished with values: [0.0021134491587584173, 0.0004919932374674695, 0.0013499659349521197] and parameters: {'n_layers': 1, 'embedding_dim': 32, 'lr': 0.0010455025017472735, 'lambda_val': 2.1459890692391423e-05, 'batch_size': 3344, 'optimizer': 'RMSprop'}.
