2026-06-29 18:55:38,824 - optuna.study.study - INFO - Trial 253 finished with values: [0.002739122459521652, 0.0009545428641984689, 0.0020070087136124974] and parameters: {'n_layers': 1, 'embedding_dim': 128, 'lr': 0.0007886779079223827, 'lambda_val': 6.144456630757942e-06, 'batch_size': 2953, 'optimizer': 'Adam'}.
2026-06-29 18:57:08,931 - experiment_functions - INFO - Early stopping at epoch 1150. Best Metrics: (0.003139366959008942, 0.0009488441008301201, 0.0021433452605132196)
2026-06-29 18:57:09,032 - optuna.study.study - INFO - Trial 254 finished with values: [0.003139366959008942, 0.0009488441008301201, 0.0021433452605132196] and parameters: {'n_layers': 1, 'embedding_dim': 96, 'lr': 0.0007886779079223827, 'lambda_val': 0.0004244982241785935, 'batch_size': 1811, 'optimizer': 'RMSprop'}.
2026-06-29 18:59:46,703 - experiment_functions - INFO - Early stopping at epoch 2000. Best Metrics: (0.0031043792028274692, 0.0009716391543035161, 0.0021301698195921545)
2026-06-29 18:59:46,800 - optuna.study.study - INFO - Trial 255 finished with values: [0.0031043792028274692, 0.0009716391543035161, 0.0021301698195921545] and parameters: {'n_layers': 1, 'embedding_dim': 128, 'lr': 0.0007556847336647807, 'lambda_val': 3.159634083184005e-05, 'batch_size': 1473, 'optimizer': 'Adam'}.
2026-06-29 19:01:43,151 - experiment_functions - INFO - Early stopping at epoch 1500. Best Metrics: (0.0033875393667086944, 0.0009782877115665901, 0.002193151177837513)
2026-06-29 19:01:43,257 - optuna.study.study - INFO - Trial 256 finished with values: [0.0033875393667086944, 0.0009782877115665901, 0.002193151177837513] and parameters: {'n_layers': 1, 'embedding_dim': 96, 'lr': 0.0007886779079223827, 'lambda_val': 0.0004468421098360447, 'batch_size': 1811, 'optimizer': 'Adam'}.
2026-06-29 19:02:58,698 - experiment_functions - INFO - Early stopping at epoch 950. Best Metrics: (0.0017919096377297327, 0.000629713352202572, 0.0011451681025048555)
2026-06-29 19:02:58,839 - optuna.study.study - INFO - Trial 257 finished with values: [0.0017919096377297327, 0.000629713352202572, 0.0011451681025048555] and parameters: {'n_layers': 1, 'embedding_dim': 96, 'lr': 0.0007556847336647807, 'lambda_val': 0.021832610805824354, 'batch_size': 1473, 'optimizer': 'Adam'}.
2026-06-29 19:05:40,898 - experiment_functions - INFO - Early stopping at epoch 2100. Best Metrics: (0.0032589995564944155, 0.0009725889481982412, 0.0021837320933830195)
2026-06-29 19:05:41,037 - optuna.study.study - INFO - Trial 258 finished with values: [0.0032589995564944155, 0.0009725889481982412, 0.0021837320933830195] and parameters: {'n_layers': 1, 'embedding_dim': 96, 'lr': 0.0007886779079223827, 'lambda_val': 6.144456630757942e-06, 'batch_size': 1304, 'optimizer': 'Adam'}.
2026-06-29 19:07:52,019 - experiment_functions - INFO - Early stopping at epoch 1650. Best Metrics: (0.0031058334793860254, 0.0009820868871454895, 0.002106718403814145)
2026-06-29 19:07:52,130 - optuna.study.study - INFO - Trial 259 finished with values: [0.0031058334793860254, 0.0009820868871454895, 0.002106718403814145] and parameters: {'n_layers': 1, 'embedding_dim': 128, 'lr': 0.0007886779079223827, 'lambda_val': 0.0004244982241785935, 'batch_size': 1304, 'optimizer': 'Adam'}.
2026-06-29 19:08:36,485 - experiment_functions - INFO - Early stopping at epoch 550. Best Metrics: (0.0015477210495383287, 0.00039891343578443483, 0.0009967249727317632)
2026-06-29 19:08:36,587 - optuna.study.study - INFO - Trial 260 finished with values: [0.0015477210495383287, 0.00039891343578443483, 0.0009967249727317632] and parameters: {'n_layers': 3, 'embedding_dim': 32, 'lr': 0.005466403487028649, 'lambda_val': 0.0004468421098360447, 'batch_size': 3775, 'optimizer': 'Adam'}.
2026-06-29 19:10:39,833 - experiment_functions - INFO - Early stopping at epoch 1550. Best Metrics: (0.0032637405132981325, 0.0009668901848298919, 0.0021313715520214875)
2026-06-29 19:10:39,934 - optuna.study.study - INFO - Trial 261 finished with values: [0.0032637405132981325, 0.0009668901848298919, 0.0021313715520214875] and parameters: {'n_layers': 1, 'embedding_dim': 128, 'lr': 0.0007886779079223827, 'lambda_val': 1.0392013695958279e-05, 'batch_size': 1811, 'optimizer': 'Adam'}.
2026-06-29 19:11:37,031 - experiment_functions - INFO - Early stopping at epoch 700. Best Metrics: (0.0029775153112189877, 0.0009146515206200255, 0.002067887987052575)
2026-06-29 19:11:37,117 - optuna.study.study - INFO - Trial 262 finished with values: [0.0029775153112189877, 0.0009146515206200255, 0.002067887987052575] and parameters: {'n_layers': 1, 'embedding_dim': 96, 'lr': 0.002471406577390761, 'lambda_val': 3.159634083184005e-05, 'batch_size': 1811, 'optimizer': 'Adam'}.
2026-06-29 19:12:22,398 - experiment_functions - INFO - Early stopping at epoch 550. Best Metrics: (0.0006269943235338968, 0.0003305282753642459, 0.0005412569506463668)
2026-06-29 19:12:22,476 - optuna.study.study - INFO - Trial 263 finished with values: [0.0006269943235338968, 0.0003305282753642459, 0.0005412569506463668] and parameters: {'n_layers': 1, 'embedding_dim': 96, 'lr': 0.011970778056485295, 'lambda_val': 0.0004244982241785935, 'batch_size': 2146, 'optimizer': 'RMSprop'}.
2026-06-29 19:13:11,196 - experiment_functions - INFO - Early stopping at epoch 550. Best Metrics: (0.00034670022731414323, 0.00017666166441882112, 0.0002772494064611717)
2026-06-29 19:13:11,553 - optuna.study.study - INFO - Trial 264 finished with values: [0.00034670022731414323, 0.00017666166441882112, 0.0002772494064611717] and parameters: {'n_layers': 4, 'embedding_dim': 96, 'lr': 0.01631556622906717, 'lambda_val': 0.0004244982241785935, 'batch_size': 1473, 'optimizer': 'Adam'}.
2026-06-29 19:14:58,713 - experiment_functions - INFO - Early stopping at epoch 1350. Best Metrics: (0.0032786862189378716, 0.0009156013145147503, 0.002211427658135856)
2026-06-29 19:14:58,844 - optuna.study.study - INFO - Trial 265 finished with values: [0.0032786862189378716, 0.0009156013145147503, 0.002211427658135856] and parameters: {'n_layers': 1, 'embedding_dim': 128, 'lr': 0.0007556847336647807, 'lambda_val': 0.0004244982241785935, 'batch_size': 1076, 'optimizer': 'RMSprop'}.
2026-06-29 19:16:10,631 - experiment_functions - INFO - Early stopping at epoch 850. Best Metrics: (0.002250899518446505, 0.000661056550728492, 0.0013593790709629883)
2026-06-29 19:16:10,735 - optuna.study.study - INFO - Trial 266 finished with values: [0.002250899518446505, 0.000661056550728492, 0.0013593790709629883] and parameters: {'n_layers': 2, 'embedding_dim': 128, 'lr': 0.0007556847336647807, 'lambda_val': 3.159634083184005e-05, 'batch_size': 1616, 'optimizer': 'Adam'}.
2026-06-29 19:18:11,083 - experiment_functions - INFO - Early stopping at epoch 1550. Best Metrics: (0.003066874369351912, 0.0009564424519879186, 0.002076411511526119)
2026-06-29 19:18:11,195 - optuna.study.study - INFO - Trial 267 finished with values: [0.003066874369351912, 0.0009564424519879186, 0.002076411511526119] and parameters: {'n_layers': 1, 'embedding_dim': 96, 'lr': 0.0007886779079223827, 'lambda_val': 0.0004244982241785935, 'batch_size': 1811, 'optimizer': 'Adam'}.
2026-06-29 19:20:02,811 - experiment_functions - INFO - Early stopping at epoch 1400. Best Metrics: (0.003242649600524182, 0.0010058317345136105, 0.0022886101638572615)
2026-06-29 19:20:02,912 - optuna.study.study - INFO - Trial 268 finished with values: [0.003242649600524182, 0.0010058317345136105, 0.0022886101638572615] and parameters: {'n_layers': 1, 'embedding_dim': 128, 'lr': 0.0007886779079223827, 'lambda_val': 1.0392013695958279e-05, 'batch_size': 1811, 'optimizer': 'Adam'}.
2026-06-29 19:20:44,849 - experiment_functions - INFO - Early stopping at epoch 500. Best Metrics: (0.00029243034635209066, 6.268639705183973e-05, 0.00014828637514900347)
2026-06-29 19:20:45,020 - optuna.study.study - INFO - Trial 269 finished with values: [0.00029243034635209066, 6.268639705183973e-05, 0.00014828637514900347] and parameters: {'n_layers': 1, 'embedding_dim': 128, 'lr': 0.0007886779079223827, 'lambda_val': 0.0004244982241785935, 'batch_size': 605, 'optimizer': 'SGD'}.
2026-06-29 19:21:27,314 - experiment_functions - INFO - Early stopping at epoch 500. Best Metrics: (0.00024717578534232663, 5.223866420986646e-05, 0.0001225323589493462)
2026-06-29 19:21:27,393 - optuna.study.study - INFO - Trial 270 finished with values: [0.00024717578534232663, 5.223866420986646e-05, 0.0001225323589493462] and parameters: {'n_layers': 1, 'embedding_dim': 128, 'lr': 0.0013135077251507194, 'lambda_val': 0.0015525678045565424, 'batch_size': 3898, 'optimizer': 'SGD'}.
2026-06-29 19:24:39,161 - experiment_functions - INFO - Early stopping at epoch 2450. Best Metrics: (0.0030536347712889537, 0.0009592918336720933, 0.0020867759196501125)
2026-06-29 19:24:40,539 - optuna.study.study - INFO - Trial 271 finished with values: [0.0030536347712889537, 0.0009592918336720933, 0.0020867759196501125] and parameters: {'n_layers': 1, 'embedding_dim': 128, 'lr': 0.0007556847336647807, 'lambda_val': 0.00018778243941196433, 'batch_size': 911, 'optimizer': 'Adam'}.
2026-06-29 19:25:29,545 - experiment_functions - INFO - Early stopping at epoch 550. Best Metrics: (0.0004008347509305678, 0.0002564443515757081, 0.00036889346787021275)
2026-06-29 19:25:29,645 - optuna.study.study - INFO - Trial 272 finished with values: [0.0004008347509305678, 0.0002564443515757081, 0.00036889346787021275] and parameters: {'n_layers': 3, 'embedding_dim': 128, 'lr': 0.09001399222309084, 'lambda_val': 7.408953437758266e-05, 'batch_size': 1811, 'optimizer': 'Adam'}.
2026-06-29 19:26:33,092 - experiment_functions - INFO - Early stopping at epoch 700. Best Metrics: (0.0028227138317113254, 0.0009089527572516764, 0.0019664966209187815)
2026-06-29 19:26:33,198 - optuna.study.study - INFO - Trial 273 finished with values: [0.0028227138317113254, 0.0009089527572516764, 0.0019664966209187815] and parameters: {'n_layers': 1, 'embedding_dim': 256, 'lr': 0.0013135077251507194, 'lambda_val': 0.0005944842242671787, 'batch_size': 3898, 'optimizer': 'Adam'}.
2026-06-29 19:27:15,888 - experiment_functions - INFO - Early stopping at epoch 500. Best Metrics: (0.00021878291886861156, 6.363619094656459e-05, 0.0001316207896334512)
2026-06-29 19:27:16,009 - optuna.study.study - INFO - Trial 274 finished with values: [0.00021878291886861156, 6.363619094656459e-05, 0.0001316207896334512] and parameters: {'n_layers': 1, 'embedding_dim': 128, 'lr': 1.1258264432500971e-05, 'lambda_val': 3.159634083184005e-05, 'batch_size': 1811, 'optimizer': 'Adam'}.
2026-06-29 19:28:32,865 - experiment_functions - INFO - Early stopping at epoch 950. Best Metrics: (0.0032181256134319503, 0.0009497938947248447, 0.0022290434481584747)
2026-06-29 19:28:33,010 - optuna.study.study - INFO - Trial 275 finished with values: [0.0032181256134319503, 0.0009497938947248447, 0.0022290434481584747] and parameters: {'n_layers': 1, 'embedding_dim': 128, 'lr': 0.0013135077251507194, 'lambda_val': 0.00018778243941196433, 'batch_size': 1473, 'optimizer': 'Adam'}.
2026-06-29 19:30:08,567 - experiment_functions - INFO - Early stopping at epoch 1200. Best Metrics: (0.002926166776366477, 0.0009127519328305758, 0.0020728764468220754)
2026-06-29 19:30:08,667 - optuna.study.study - INFO - Trial 276 finished with values: [0.002926166776366477, 0.0009127519328305758, 0.0020728764468220754] and parameters: {'n_layers': 1, 'embedding_dim': 128, 'lr': 0.0007886779079223827, 'lambda_val': 6.144456630757942e-06, 'batch_size': 1811, 'optimizer': 'RMSprop'}.
2026-06-29 19:31:02,636 - experiment_functions - INFO - Early stopping at epoch 650. Best Metrics: (0.00026303649958357993, 7.123454210436335e-05, 0.00014175463201904914)
2026-06-29 19:31:02,737 - optuna.study.study - INFO - Trial 277 finished with values: [0.00026303649958357993, 7.123454210436335e-05, 0.00014175463201904914] and parameters: {'n_layers': 1, 'embedding_dim': 128, 'lr': 0.0001388889429428894, 'lambda_val': 6.579378672773439e-05, 'batch_size': 979, 'optimizer': 'Adam'}.
2026-06-29 19:31:51,811 - experiment_functions - INFO - Early stopping at epoch 600. Best Metrics: (0.0029023987204242468, 0.0008538647113576354, 0.001950541303094538)
2026-06-29 19:31:51,919 - optuna.study.study - INFO - Trial 278 finished with values: [0.0029023987204242468, 0.0008538647113576354, 0.001950541303094538] and parameters: {'n_layers': 1, 'embedding_dim': 96, 'lr': 0.0057963141261993525, 'lambda_val': 0.0004244982241785935, 'batch_size': 995, 'optimizer': 'Adam'}.
2026-06-29 19:33:48,791 - experiment_functions - INFO - Early stopping at epoch 1500. Best Metrics: (0.003015248499805246, 0.0009393461618828714, 0.002024742196253912)
2026-06-29 19:33:48,894 - optuna.study.study - INFO - Trial 279 finished with values: [0.003015248499805246, 0.0009393461618828714, 0.002024742196253912] and parameters: {'n_layers': 1, 'embedding_dim': 96, 'lr': 0.0007886779079223827, 'lambda_val': 0.0004244982241785935, 'batch_size': 1811, 'optimizer': 'Adam'}.
2026-06-29 19:34:35,252 - experiment_functions - INFO - Early stopping at epoch 550. Best Metrics: (0.0018210798781066132, 0.0006705544896757403, 0.0012852480415025396)
2026-06-29 19:34:35,394 - optuna.study.study - INFO - Trial 280 finished with values: [0.0018210798781066132, 0.0006705544896757403, 0.0012852480415025396] and parameters: {'n_layers': 1, 'embedding_dim': 128, 'lr': 0.02255644569276849, 'lambda_val': 0.0005944842242671787, 'batch_size': 2276, 'optimizer': 'Adam'}.
2026-06-29 19:37:24,244 - experiment_functions - INFO - Early stopping at epoch 2300. Best Metrics: (0.00324737867857807, 0.000983036681040214, 0.00214973988288002)
2026-06-29 19:37:24,348 - optuna.study.study - INFO - Trial 281 finished with values: [0.00324737867857807, 0.000983036681040214, 0.00214973988288002] and parameters: {'n_layers': 1, 'embedding_dim': 32, 'lr': 0.0007556847336647807, 'lambda_val': 0.0005944842242671787, 'batch_size': 1304, 'optimizer': 'Adam'}.
2026-06-29 19:40:17,131 - experiment_functions - INFO - Early stopping at epoch 2250. Best Metrics: (0.0034601138784729466, 0.0010010827650399864, 0.0022049792518400425)
2026-06-29 19:40:17,239 - optuna.study.study - INFO - Trial 282 finished with values: [0.0034601138784729466, 0.0010010827650399864, 0.0022049792518400425] and parameters: {'n_layers': 1, 'embedding_dim': 96, 'lr': 0.0007556847336647807, 'lambda_val': 1.0392013695958279e-05, 'batch_size': 1304, 'optimizer': 'Adam'}.
2026-06-29 19:41:04,695 - experiment_functions - INFO - Early stopping at epoch 600. Best Metrics: (0.002963334624460108, 0.0008415173907262126, 0.001967055803129851)
2026-06-29 19:41:04,802 - optuna.study.study - INFO - Trial 283 finished with values: [0.002963334624460108, 0.0008415173907262126, 0.001967055803129851] and parameters: {'n_layers': 1, 'embedding_dim': 32, 'lr': 0.005466403487028649, 'lambda_val': 0.0004994369806250174, 'batch_size': 1940, 'optimizer': 'Adam'}.
2026-06-29 19:43:30,841 - experiment_functions - INFO - Early stopping at epoch 1850. Best Metrics: (0.0032409409580336826, 0.0009811370932507645, 0.0022374618602733847)
2026-06-29 19:43:30,948 - optuna.study.study - INFO - Trial 284 finished with values: [0.0032409409580336826, 0.0009811370932507645, 0.0022374618602733847] and parameters: {'n_layers': 1, 'embedding_dim': 128, 'lr': 0.0007556847336647807, 'lambda_val': 3.159634083184005e-05, 'batch_size': 1473, 'optimizer': 'Adam'}.
2026-06-29 19:45:12,681 - experiment_functions - INFO - Early stopping at epoch 1350. Best Metrics: (0.002618872964734735, 0.000734190680622305, 0.00159785470940426)
2026-06-29 19:45:12,827 - optuna.study.study - INFO - Trial 285 finished with values: [0.002618872964734735, 0.000734190680622305, 0.00159785470940426] and parameters: {'n_layers': 2, 'embedding_dim': 32, 'lr': 0.0007886779079223827, 'lambda_val': 1.0392013695958279e-05, 'batch_size': 1304, 'optimizer': 'Adam'}.
2026-06-29 19:45:57,730 - experiment_functions - INFO - Early stopping at epoch 500. Best Metrics: (0.00025868173827781277, 6.17366031571149e-05, 0.0001236288580068632)
2026-06-29 19:45:57,960 - optuna.study.study - INFO - Trial 286 finished with values: [0.00025868173827781277, 6.17366031571149e-05, 0.0001236288580068632] and parameters: {'n_layers': 1, 'embedding_dim': 256, 'lr': 0.0007886779079223827, 'lambda_val': 0.0004244982241785935, 'batch_size': 1304, 'optimizer': 'SGD'}.
2026-06-29 19:47:41,437 - experiment_functions - INFO - Early stopping at epoch 1300. Best Metrics: (0.00022736988393757428, 5.6987633683490685e-05, 0.0001271941885160746)
2026-06-29 19:47:41,559 - optuna.study.study - INFO - Trial 287 finished with values: [0.00022736988393757428, 5.6987633683490685e-05, 0.0001271941885160746] and parameters: {'n_layers': 1, 'embedding_dim': 128, 'lr': 3.2116462701522884e-05, 'lambda_val': 0.00018778243941196433, 'batch_size': 1811, 'optimizer': 'Adam'}.
2026-06-29 19:49:34,753 - experiment_functions - INFO - Early stopping at epoch 1450. Best Metrics: (0.0030030239694832984, 0.0008861577037782803, 0.001975919623649379)
2026-06-29 19:49:34,905 - optuna.study.study - INFO - Trial 288 finished with values: [0.0030030239694832984, 0.0008861577037782803, 0.001975919623649379] and parameters: {'n_layers': 1, 'embedding_dim': 96, 'lr': 0.0006475996595311599, 'lambda_val': 0.0004244982241785935, 'batch_size': 2146, 'optimizer': 'Adam'}.
2026-06-29 19:51:16,909 - experiment_functions - INFO - Early stopping at epoch 1300. Best Metrics: (0.0028268957068903304, 0.0009307980168303478, 0.001956780940659575)
2026-06-29 19:51:17,053 - optuna.study.study - INFO - Trial 289 finished with values: [0.0028268957068903304, 0.0009307980168303478, 0.001956780940659575] and parameters: {'n_layers': 1, 'embedding_dim': 96, 'lr': 0.0013135077251507194, 'lambda_val': 1.0392013695958279e-05, 'batch_size': 1304, 'optimizer': 'Adam'}.
2026-06-29 19:53:01,214 - experiment_functions - INFO - Early stopping at epoch 1300. Best Metrics: (0.003005331549230733, 0.0009440951313564956, 0.00203723374702098)
2026-06-29 19:53:01,319 - optuna.study.study - INFO - Trial 290 finished with values: [0.003005331549230733, 0.0009440951313564956, 0.00203723374702098] and parameters: {'n_layers': 1, 'embedding_dim': 128, 'lr': 0.0007886779079223827, 'lambda_val': 0.0004244982241785935, 'batch_size': 1304, 'optimizer': 'Adam'}.
2026-06-29 19:53:42,952 - experiment_functions - INFO - Early stopping at epoch 500. Best Metrics: (0.00021182545293656392, 5.9837015367665226e-05, 0.00013028009471767598)
2026-06-29 19:53:43,107 - optuna.study.study - INFO - Trial 291 finished with values: [0.00021182545293656392, 5.9837015367665226e-05, 0.00013028009471767598] and parameters: {'n_layers': 1, 'embedding_dim': 128, 'lr': 0.0007556847336647807, 'lambda_val': 3.159634083184005e-05, 'batch_size': 1811, 'optimizer': 'SGD'}.
2026-06-29 19:54:32,546 - experiment_functions - INFO - Early stopping at epoch 600. Best Metrics: (0.0029710000801623122, 0.0009279486351461734, 0.001995586482752179)
2026-06-29 19:54:32,669 - optuna.study.study - INFO - Trial 292 finished with values: [0.0029710000801623122, 0.0009279486351461734, 0.001995586482752179] and parameters: {'n_layers': 1, 'embedding_dim': 96, 'lr': 0.005466403487028649, 'lambda_val': 0.0004244982241785935, 'batch_size': 1940, 'optimizer': 'Adam'}.
2026-06-29 19:56:18,387 - experiment_functions - INFO - Early stopping at epoch 1350. Best Metrics: (0.0029297422802878437, 0.0009222498717778242, 0.002017092770340656)
2026-06-29 19:56:18,518 - optuna.study.study - INFO - Trial 293 finished with values: [0.0029297422802878437, 0.0009222498717778242, 0.002017092770340656] and parameters: {'n_layers': 1, 'embedding_dim': 96, 'lr': 0.0007556847336647807, 'lambda_val': 1.3664921212013244e-05, 'batch_size': 2314, 'optimizer': 'Adam'}.
2026-06-29 19:57:27,837 - experiment_functions - INFO - Early stopping at epoch 850. Best Metrics: (0.003027565285012512, 0.0009535930703037441, 0.001985269079642476)
2026-06-29 19:57:27,940 - optuna.study.study - INFO - Trial 294 finished with values: [0.003027565285012512, 0.0009535930703037441, 0.001985269079642476] and parameters: {'n_layers': 1, 'embedding_dim': 128, 'lr': 0.0017708928746349836, 'lambda_val': 0.0008172053117174909, 'batch_size': 995, 'optimizer': 'Adam'}.
2026-06-29 19:59:15,804 - experiment_functions - INFO - Early stopping at epoch 1350. Best Metrics: (0.003149797656871373, 0.0009421955435670458, 0.002133098650254236)
2026-06-29 19:59:15,906 - optuna.study.study - INFO - Trial 295 finished with values: [0.003149797656871373, 0.0009421955435670458, 0.002133098650254236] and parameters: {'n_layers': 1, 'embedding_dim': 128, 'lr': 0.0007886779079223827, 'lambda_val': 1.0392013695958279e-05, 'batch_size': 1473, 'optimizer': 'Adam'}.
2026-06-29 20:00:52,349 - experiment_functions - INFO - Early stopping at epoch 1200. Best Metrics: (0.0028553186932919485, 0.0008823585281993807, 0.001950323315254208)
2026-06-29 20:00:52,449 - optuna.study.study - INFO - Trial 296 finished with values: [0.0028553186932919485, 0.0008823585281993807, 0.001950323315254208] and parameters: {'n_layers': 1, 'embedding_dim': 128, 'lr': 0.0007886779079223827, 'lambda_val': 0.003695132023167134, 'batch_size': 1040, 'optimizer': 'Adam'}.
2026-06-29 20:02:45,093 - experiment_functions - INFO - Early stopping at epoch 1450. Best Metrics: (0.00311048456990678, 0.0009269988412514483, 0.002152095229683618)
2026-06-29 20:02:45,197 - optuna.study.study - INFO - Trial 297 finished with values: [0.00311048456990678, 0.0009269988412514483, 0.002152095229683618] and parameters: {'n_layers': 1, 'embedding_dim': 96, 'lr': 0.0007556847336647807, 'lambda_val': 3.159634083184005e-05, 'batch_size': 1811, 'optimizer': 'Adam'}.
2026-06-29 20:04:21,706 - experiment_functions - INFO - Early stopping at epoch 1200. Best Metrics: (0.003411183519224552, 0.0010181790551450336, 0.0023129815481040847)
