2026-07-04 20:16:13,672 - optuna.study.study - INFO - Trial 8 finished with values: [0.00027456751416587836, 5.888722147294038e-05, 0.00013012288940017266] and parameters: {'n_layers': 1, 'embedding_dim': 96, 'lr': 0.0005488389855052743, 'lambda_val': 0.0005612435554550185, 'batch_size': 1889, 'optimizer': 'SGD'}.
2026-07-04 20:16:56,019 - experiment_functions - INFO - Early stopping at epoch 500. Best Metrics: (0.0002140845913669742, 5.793742757821552e-05, 0.00011703373875590624)
2026-07-04 20:16:56,168 - optuna.study.study - INFO - Trial 9 finished with values: [0.0002140845913669742, 5.793742757821552e-05, 0.00011703373875590624] and parameters: {'n_layers': 3, 'embedding_dim': 32, 'lr': 0.0011666881071828394, 'lambda_val': 0.010933198073438875, 'batch_size': 846, 'optimizer': 'SGD'}.
2026-07-04 20:17:58,012 - experiment_functions - INFO - Early stopping at epoch 750. Best Metrics: (0.00020870355054121597, 5.7937427578215534e-05, 0.0001245075217932624)
2026-07-04 20:17:58,112 - optuna.study.study - INFO - Trial 10 finished with values: [0.00020870355054121597, 5.7937427578215534e-05, 0.0001245075217932624] and parameters: {'n_layers': 3, 'embedding_dim': 32, 'lr': 1.3957297102460703e-05, 'lambda_val': 0.03806652067331256, 'batch_size': 1533, 'optimizer': 'Adam'}.
2026-07-04 20:19:58,704 - experiment_functions - INFO - Early stopping at epoch 1550. Best Metrics: (0.00021167695490300188, 4.8439488630967084e-05, 0.00011905914799233296)
2026-07-04 20:19:58,797 - optuna.study.study - INFO - Trial 11 finished with values: [0.00021167695490300188, 4.8439488630967084e-05, 0.00011905914799233296] and parameters: {'n_layers': 2, 'embedding_dim': 32, 'lr': 4.4316828814424224e-05, 'lambda_val': 4.880362866165937e-06, 'batch_size': 3927, 'optimizer': 'RMSprop'}.
2026-07-04 20:20:58,128 - experiment_functions - INFO - Early stopping at epoch 500. Best Metrics: (0.0002329205755810458, 5.7937427578215534e-05, 0.0001451065814630164)
2026-07-04 20:20:58,229 - optuna.study.study - INFO - Trial 12 finished with values: [0.0002329205755810458, 5.7937427578215534e-05, 0.0001451065814630164] and parameters: {'n_layers': 3, 'embedding_dim': 256, 'lr': 0.003767185723100653, 'lambda_val': 0.006568546318566723, 'batch_size': 1874, 'optimizer': 'SGD'}.
2026-07-04 20:21:51,309 - experiment_functions - INFO - Early stopping at epoch 500. Best Metrics: (0.00020499827728355735, 5.698763368349069e-05, 0.0001036240501440441)
2026-07-04 20:21:51,399 - optuna.study.study - INFO - Trial 13 finished with values: [0.00020499827728355735, 5.698763368349069e-05, 0.0001036240501440441] and parameters: {'n_layers': 4, 'embedding_dim': 128, 'lr': 0.00016973448007264431, 'lambda_val': 0.01796364698125225, 'batch_size': 3961, 'optimizer': 'Adam'}.
2026-07-04 20:22:41,444 - experiment_functions - INFO - Early stopping at epoch 500. Best Metrics: (0.0002641914208389777, 7.693330547271242e-05, 0.00016215195124642072)
2026-07-04 20:22:41,568 - optuna.study.study - INFO - Trial 14 finished with values: [0.0002641914208389777, 7.693330547271242e-05, 0.00016215195124642072] and parameters: {'n_layers': 3, 'embedding_dim': 128, 'lr': 1.2707719617220297e-05, 'lambda_val': 3.621775569400358e-05, 'batch_size': 2808, 'optimizer': 'RMSprop'}.
2026-07-04 20:28:09,710 - optuna.study.study - INFO - Trial 15 finished with values: [0.014177828093060809, 0.0035161369982713757, 0.008494796711144937] and parameters: {'n_layers': 1, 'embedding_dim': 128, 'lr': 0.07167055366810839, 'lambda_val': 0.0023013643954001, 'batch_size': 2864, 'optimizer': 'RMSprop'}.
2026-07-04 20:28:59,219 - experiment_functions - INFO - Early stopping at epoch 500. Best Metrics: (0.00021001276203845353, 5.413825199931615e-05, 0.0001182834848338136)
2026-07-04 20:28:59,323 - optuna.study.study - INFO - Trial 16 finished with values: [0.00021001276203845353, 5.413825199931615e-05, 0.0001182834848338136] and parameters: {'n_layers': 4, 'embedding_dim': 96, 'lr': 3.274080317891632e-05, 'lambda_val': 0.034489118819714414, 'batch_size': 3954, 'optimizer': 'RMSprop'}.
2026-07-04 20:30:03,292 - experiment_functions - INFO - Early stopping at epoch 750. Best Metrics: (0.0001926754293813224, 5.0339076420416775e-05, 9.7564737208007e-05)
2026-07-04 20:30:03,379 - optuna.study.study - INFO - Trial 17 finished with values: [0.0001926754293813224, 5.0339076420416775e-05, 9.7564737208007e-05] and parameters: {'n_layers': 1, 'embedding_dim': 128, 'lr': 4.333967512492249e-05, 'lambda_val': 6.0551714285052794e-05, 'batch_size': 3275, 'optimizer': 'RMSprop'}.
2026-07-04 20:30:56,848 - experiment_functions - INFO - Early stopping at epoch 500. Best Metrics: (0.00024295165947661892, 5.603783978876583e-05, 0.00012274640730586202)
2026-07-04 20:30:56,964 - optuna.study.study - INFO - Trial 18 finished with values: [0.00024295165947661892, 5.603783978876583e-05, 0.00012274640730586202] and parameters: {'n_layers': 2, 'embedding_dim': 256, 'lr': 2.5233555556778855e-05, 'lambda_val': 1.0986341986825808e-06, 'batch_size': 1963, 'optimizer': 'SGD'}.
2026-07-04 20:31:42,913 - experiment_functions - INFO - Early stopping at epoch 500. Best Metrics: (0.00018524682436283371, 5.31884581045913e-05, 9.392452919379153e-05)
2026-07-04 20:31:43,051 - optuna.study.study - INFO - Trial 19 finished with values: [0.00018524682436283371, 5.31884581045913e-05, 9.392452919379153e-05] and parameters: {'n_layers': 4, 'embedding_dim': 64, 'lr': 1.009570022386974e-05, 'lambda_val': 1.6630335533045858e-05, 'batch_size': 2952, 'optimizer': 'SGD'}.
2026-07-04 20:32:24,130 - experiment_functions - INFO - Early stopping at epoch 500. Best Metrics: (0.00016271274963080832, 5.223866420986647e-05, 0.00013393129422571207)
2026-07-04 20:32:24,225 - optuna.study.study - INFO - Trial 20 finished with values: [0.00016271274963080832, 5.223866420986647e-05, 0.00013393129422571207] and parameters: {'n_layers': 2, 'embedding_dim': 32, 'lr': 0.0001418385706838221, 'lambda_val': 0.000824976096043852, 'batch_size': 688, 'optimizer': 'SGD'}.
2026-07-04 20:37:35,648 - optuna.study.study - INFO - Trial 21 finished with values: [0.009451701855992095, 0.002209220599129989, 0.005237161630642784] and parameters: {'n_layers': 3, 'embedding_dim': 32, 'lr': 0.0015091555359142122, 'lambda_val': 0.00037674227085943596, 'batch_size': 623, 'optimizer': 'Adam'}.
2026-07-04 20:38:26,753 - experiment_functions - INFO - Early stopping at epoch 550. Best Metrics: (0.006705113335778614, 0.0016174990027164108, 0.004093850199770909)
2026-07-04 20:38:27,172 - optuna.study.study - INFO - Trial 22 finished with values: [0.006705113335778614, 0.0016174990027164108, 0.004093850199770909] and parameters: {'n_layers': 4, 'embedding_dim': 64, 'lr': 0.03509621169937048, 'lambda_val': 6.047949750223317e-05, 'batch_size': 1042, 'optimizer': 'Adam'}.
2026-07-04 20:39:14,644 - experiment_functions - INFO - Early stopping at epoch 500. Best Metrics: (0.0002713769121857059, 6.838516042018883e-05, 0.0001473206099478811)
2026-07-04 20:39:14,737 - optuna.study.study - INFO - Trial 23 finished with values: [0.0002713769121857059, 6.838516042018883e-05, 0.0001473206099478811] and parameters: {'n_layers': 3, 'embedding_dim': 96, 'lr': 0.011756498977087774, 'lambda_val': 0.00023887347484446604, 'batch_size': 2469, 'optimizer': 'SGD'}.
2026-07-04 20:45:00,146 - optuna.study.study - INFO - Trial 24 finished with values: [0.010073306010082378, 0.0023773341184962866, 0.00609499408774802] and parameters: {'n_layers': 4, 'embedding_dim': 64, 'lr': 0.0010295843799712518, 'lambda_val': 7.045045135561742e-06, 'batch_size': 953, 'optimizer': 'Adam'}.
2026-07-04 20:50:33,104 - optuna.study.study - INFO - Trial 25 finished with values: [0.022122170964823787, 0.0047964591683604665, 0.013036171412090802] and parameters: {'n_layers': 1, 'embedding_dim': 128, 'lr': 0.004947459881909782, 'lambda_val': 2.3028734947350154e-05, 'batch_size': 2098, 'optimizer': 'RMSprop'}.
2026-07-04 20:51:21,193 - experiment_functions - INFO - Early stopping at epoch 500. Best Metrics: (0.0002717782150679393, 6.458598484128944e-05, 0.00015011116991880117)
2026-07-04 20:51:21,259 - optuna.study.study - INFO - Trial 26 finished with values: [0.0002717782150679393, 6.458598484128944e-05, 0.00015011116991880117] and parameters: {'n_layers': 1, 'embedding_dim': 256, 'lr': 0.024466693088048486, 'lambda_val': 0.00041384951091696736, 'batch_size': 1962, 'optimizer': 'SGD'}.
2026-07-04 20:53:48,533 - experiment_functions - INFO - Early stopping at epoch 1900. Best Metrics: (0.00023210387323763216, 6.458598484128944e-05, 0.00014674757392703046)
2026-07-04 20:53:48,615 - optuna.study.study - INFO - Trial 27 finished with values: [0.00023210387323763216, 6.458598484128944e-05, 0.00014674757392703046] and parameters: {'n_layers': 1, 'embedding_dim': 64, 'lr': 3.072899142988224e-05, 'lambda_val': 2.397699061850615e-05, 'batch_size': 3368, 'optimizer': 'Adam'}.
2026-07-04 21:02:00,572 - optuna.study.study - INFO - Trial 28 finished with values: [0.0026501052202341354, 0.0007113956271489087, 0.001672213681206544] and parameters: {'n_layers': 4, 'embedding_dim': 256, 'lr': 0.0001369010553537351, 'lambda_val': 4.969406458018728e-05, 'batch_size': 1435, 'optimizer': 'RMSprop'}.
2026-07-04 21:02:43,904 - experiment_functions - INFO - Early stopping at epoch 500. Best Metrics: (0.00022218992626531428, 5.413825199931616e-05, 0.00011608398127925644)
2026-07-04 21:02:44,002 - optuna.study.study - INFO - Trial 29 finished with values: [0.00022218992626531428, 5.413825199931616e-05, 0.00011608398127925644] and parameters: {'n_layers': 4, 'embedding_dim': 32, 'lr': 2.6984119282416838e-05, 'lambda_val': 1.0733194511928922e-06, 'batch_size': 3861, 'optimizer': 'Adam'}.
2026-07-04 21:04:33,747 - experiment_functions - INFO - Early stopping at epoch 1450. Best Metrics: (0.00025028061828801505, 6.648557263073913e-05, 0.00015949406695006237)
2026-07-04 21:04:33,846 - optuna.study.study - INFO - Trial 30 finished with values: [0.00025028061828801505, 6.648557263073913e-05, 0.00015949406695006237] and parameters: {'n_layers': 1, 'embedding_dim': 32, 'lr': 1.5070125958012312e-05, 'lambda_val': 4.3936331022094976e-05, 'batch_size': 2629, 'optimizer': 'Adam'}.
2026-07-04 21:06:34,461 - experiment_functions - INFO - Early stopping at epoch 1450. Best Metrics: (0.00028320657095859197, 6.743536652546397e-05, 0.00015224720140763454)
2026-07-04 21:06:34,551 - optuna.study.study - INFO - Trial 31 finished with values: [0.00028320657095859197, 6.743536652546397e-05, 0.00015224720140763454] and parameters: {'n_layers': 1, 'embedding_dim': 128, 'lr': 1.631808895961836e-05, 'lambda_val': 0.00015071277165284132, 'batch_size': 3931, 'optimizer': 'Adam'}.
2026-07-04 21:08:48,652 - experiment_functions - INFO - Early stopping at epoch 1750. Best Metrics: (0.00020987999244488035, 5.9837015367665226e-05, 0.00012708094490992348)
2026-07-04 21:08:48,901 - optuna.study.study - INFO - Trial 32 finished with values: [0.00020987999244488035, 5.9837015367665226e-05, 0.00012708094490992348] and parameters: {'n_layers': 2, 'embedding_dim': 32, 'lr': 5.924094521851306e-05, 'lambda_val': 5.027699947863275e-06, 'batch_size': 1792, 'optimizer': 'RMSprop'}.
2026-07-04 21:09:32,497 - experiment_functions - INFO - Early stopping at epoch 500. Best Metrics: (0.00023393105707085774, 6.36361909465646e-05, 0.00014712673107346015)
2026-07-04 21:09:32,593 - optuna.study.study - INFO - Trial 33 finished with values: [0.00023393105707085774, 6.36361909465646e-05, 0.00014712673107346015] and parameters: {'n_layers': 1, 'embedding_dim': 128, 'lr': 0.00046295257519938306, 'lambda_val': 0.0009317299598432893, 'batch_size': 565, 'optimizer': 'SGD'}.
2026-07-04 21:10:15,587 - experiment_functions - INFO - Early stopping at epoch 500. Best Metrics: (0.00020844723504753423, 4.8439488630967084e-05, 0.00010863435285080407)
2026-07-04 21:10:15,758 - optuna.study.study - INFO - Trial 34 finished with values: [0.00020844723504753423, 4.8439488630967084e-05, 0.00010863435285080407] and parameters: {'n_layers': 2, 'embedding_dim': 64, 'lr': 0.01899723207583389, 'lambda_val': 0.07531373828865467, 'batch_size': 2304, 'optimizer': 'SGD'}.
2026-07-04 21:10:56,284 - experiment_functions - INFO - Early stopping at epoch 500. Best Metrics: (0.0002396882866995507, 6.17366031571149e-05, 0.00012370764553442038)
2026-07-04 21:10:56,379 - optuna.study.study - INFO - Trial 35 finished with values: [0.0002396882866995507, 6.17366031571149e-05, 0.00012370764553442038] and parameters: {'n_layers': 1, 'embedding_dim': 32, 'lr': 0.00010725914828407688, 'lambda_val': 3.78430457230463e-06, 'batch_size': 2411, 'optimizer': 'SGD'}.
2026-07-04 21:11:48,817 - experiment_functions - INFO - Early stopping at epoch 500. Best Metrics: (0.0002258143336733137, 5.318845810459131e-05, 0.00014474891382359052)
2026-07-04 21:11:48,980 - optuna.study.study - INFO - Trial 36 finished with values: [0.0002258143336733137, 5.318845810459131e-05, 0.00014474891382359052] and parameters: {'n_layers': 4, 'embedding_dim': 128, 'lr': 0.00022732011830362667, 'lambda_val': 0.00012447976919866053, 'batch_size': 3773, 'optimizer': 'SGD'}.
2026-07-04 21:17:08,327 - optuna.study.study - INFO - Trial 37 finished with values: [0.0070413225708243965, 0.0018606462397659708, 0.004239147349196437] and parameters: {'n_layers': 1, 'embedding_dim': 96, 'lr': 0.00932707322077697, 'lambda_val': 0.02638365044689118, 'batch_size': 1468, 'optimizer': 'Adam'}.
2026-07-04 21:22:42,113 - optuna.study.study - INFO - Trial 38 finished with values: [0.01240631992924, 0.002800942195543567, 0.0073355846954217515] and parameters: {'n_layers': 3, 'embedding_dim': 64, 'lr': 0.003969600055009677, 'lambda_val': 1.1487538529008038e-05, 'batch_size': 1923, 'optimizer': 'Adam'}.
2026-07-04 21:28:52,284 - optuna.study.study - INFO - Trial 39 finished with values: [0.012879590663724082, 0.0031048762418555177, 0.007549086219182908] and parameters: {'n_layers': 4, 'embedding_dim': 96, 'lr': 0.00039718261379734926, 'lambda_val': 0.001169539462381399, 'batch_size': 2553, 'optimizer': 'RMSprop'}.
2026-07-04 21:34:24,288 - optuna.study.study - INFO - Trial 40 finished with values: [0.010266134007271693, 0.0024742130957582206, 0.0062102252897194] and parameters: {'n_layers': 3, 'embedding_dim': 64, 'lr': 0.021200667544250287, 'lambda_val': 0.0012837533787936162, 'batch_size': 3479, 'optimizer': 'RMSprop'}.
2026-07-04 21:35:07,477 - experiment_functions - INFO - Early stopping at epoch 500. Best Metrics: (0.00020404412704694668, 4.8439488630967084e-05, 0.0001210482515846303)
2026-07-04 21:35:07,586 - optuna.study.study - INFO - Trial 41 finished with values: [0.00020404412704694668, 4.8439488630967084e-05, 0.0001210482515846303] and parameters: {'n_layers': 1, 'embedding_dim': 96, 'lr': 0.0002658473095245979, 'lambda_val': 0.04444103887151776, 'batch_size': 3027, 'optimizer': 'RMSprop'}.
2026-07-04 21:36:12,033 - experiment_functions - INFO - Early stopping at epoch 500. Best Metrics: (0.00016998032982834635, 4.7489694736242234e-05, 0.00010880739046068653)
2026-07-04 21:36:12,131 - optuna.study.study - INFO - Trial 42 finished with values: [0.00016998032982834635, 4.7489694736242234e-05, 0.00010880739046068653] and parameters: {'n_layers': 4, 'embedding_dim': 256, 'lr': 0.00014999327452138868, 'lambda_val': 0.0002606911528209485, 'batch_size': 4055, 'optimizer': 'SGD'}.
2026-07-04 21:37:06,962 - experiment_functions - INFO - Early stopping at epoch 500. Best Metrics: (0.00434798537045658, 0.0008557642991470852, 0.0025973055896042845)
2026-07-04 21:37:07,067 - optuna.study.study - INFO - Trial 43 finished with values: [0.00434798537045658, 0.0008557642991470852, 0.0025973055896042845] and parameters: {'n_layers': 2, 'embedding_dim': 256, 'lr': 0.024488667087683845, 'lambda_val': 0.03297467797875669, 'batch_size': 1884, 'optimizer': 'RMSprop'}.
2026-07-04 21:42:22,313 - optuna.study.study - INFO - Trial 44 finished with values: [0.01976941389786939, 0.004399445320365481, 0.011711823498492644] and parameters: {'n_layers': 1, 'embedding_dim': 64, 'lr': 0.004313984522769102, 'lambda_val': 0.0014481008831556158, 'batch_size': 1645, 'optimizer': 'Adam'}.
2026-07-04 21:43:47,297 - experiment_functions - INFO - Early stopping at epoch 1000. Best Metrics: (0.00018405075036230587, 5.603783978876584e-05, 0.00011303765821932175)
2026-07-04 21:43:47,388 - optuna.study.study - INFO - Trial 45 finished with values: [0.00018405075036230587, 5.603783978876584e-05, 0.00011303765821932175] and parameters: {'n_layers': 1, 'embedding_dim': 128, 'lr': 1.4761844578315365e-05, 'lambda_val': 6.378214928054678e-05, 'batch_size': 758, 'optimizer': 'Adam'}.
2026-07-04 21:44:38,106 - experiment_functions - INFO - Early stopping at epoch 600. Best Metrics: (0.0002004932741670392, 5.5088045894041e-05, 0.00012188021100185427)
2026-07-04 21:44:38,322 - optuna.study.study - INFO - Trial 46 finished with values: [0.0002004932741670392, 5.5088045894041e-05, 0.00012188021100185427] and parameters: {'n_layers': 1, 'embedding_dim': 96, 'lr': 7.398361932545356e-05, 'lambda_val': 0.0032430445758719686, 'batch_size': 906, 'optimizer': 'RMSprop'}.
2026-07-04 21:50:54,504 - optuna.study.study - INFO - Trial 47 finished with values: [0.02269192719503292, 0.004988317535094885, 0.013639852016489741] and parameters: {'n_layers': 1, 'embedding_dim': 256, 'lr': 0.0032934455374620674, 'lambda_val': 4.331327481478862e-06, 'batch_size': 1171, 'optimizer': 'Adam'}.
2026-07-04 21:52:08,902 - experiment_functions - INFO - Early stopping at epoch 900. Best Metrics: (0.0002353169060727822, 5.888722147294036e-05, 0.00013651175020452884)
2026-07-04 21:52:09,245 - optuna.study.study - INFO - Trial 48 finished with values: [0.0002353169060727822, 5.888722147294036e-05, 0.00013651175020452884] and parameters: {'n_layers': 2, 'embedding_dim': 64, 'lr': 1.4583312992283933e-05, 'lambda_val': 0.0015456320967875508, 'batch_size': 1614, 'optimizer': 'Adam'}.
2026-07-04 21:58:01,975 - experiment_functions - INFO - Early stopping at epoch 3800. Best Metrics: (0.014557695419174073, 0.0031077256235396925, 0.008816618708138336)
2026-07-04 21:58:02,063 - optuna.study.study - INFO - Trial 49 finished with values: [0.014557695419174073, 0.0031077256235396925, 0.008816618708138336] and parameters: {'n_layers': 4, 'embedding_dim': 96, 'lr': 0.01945737514319542, 'lambda_val': 2.9920385603702593e-06, 'batch_size': 2702, 'optimizer': 'RMSprop'}.
2026-07-04 21:58:51,197 - experiment_functions - INFO - Early stopping at epoch 550. Best Metrics: (0.0002155732683126096, 5.698763368349067e-05, 0.00011800012473803335)
2026-07-04 21:58:51,625 - optuna.study.study - INFO - Trial 50 finished with values: [0.0002155732683126096, 5.698763368349067e-05, 0.00011800012473803335] and parameters: {'n_layers': 3, 'embedding_dim': 64, 'lr': 1.631808895961836e-05, 'lambda_val': 0.00015071277165284132, 'batch_size': 3931, 'optimizer': 'Adam'}.
2026-07-04 21:59:40,271 - experiment_functions - INFO - Early stopping at epoch 500. Best Metrics: (0.00019859401148444148, 4.653990084151739e-05, 0.0001014088205931961)
2026-07-04 21:59:40,697 - optuna.study.study - INFO - Trial 51 finished with values: [0.00019859401148444148, 4.653990084151739e-05, 0.0001014088205931961] and parameters: {'n_layers': 1, 'embedding_dim': 256, 'lr': 0.03509621169937048, 'lambda_val': 6.047949750223317e-05, 'batch_size': 1042, 'optimizer': 'SGD'}.
2026-07-04 22:00:31,468 - experiment_functions - INFO - Early stopping at epoch 550. Best Metrics: (0.006967592703448265, 0.00171342818608362, 0.004251147558169804)
2026-07-04 22:00:31,571 - optuna.study.study - INFO - Trial 52 finished with values: [0.006967592703448265, 0.00171342818608362, 0.004251147558169804] and parameters: {'n_layers': 4, 'embedding_dim': 64, 'lr': 0.03509621169937048, 'lambda_val': 4.331327481478862e-06, 'batch_size': 1042, 'optimizer': 'Adam'}.
2026-07-04 22:02:19,147 - experiment_functions - INFO - Early stopping at epoch 1400. Best Metrics: (0.0001687511402956065, 4.653990084151739e-05, 0.00010268037002124902)
2026-07-04 22:02:19,241 - optuna.study.study - INFO - Trial 53 finished with values: [0.0001687511402956065, 4.653990084151739e-05, 0.00010268037002124902] and parameters: {'n_layers': 1, 'embedding_dim': 32, 'lr': 1.5070125958012312e-05, 'lambda_val': 2.827018821143772e-06, 'batch_size': 2629, 'optimizer': 'Adam'}.
2026-07-04 22:03:07,805 - experiment_functions - INFO - Early stopping at epoch 500. Best Metrics: (0.00029858952958920066, 6.268639705183976e-05, 0.00017916807420544146)
2026-07-04 22:03:08,265 - optuna.study.study - INFO - Trial 54 finished with values: [0.00029858952958920066, 6.268639705183976e-05, 0.00017916807420544146] and parameters: {'n_layers': 1, 'embedding_dim': 256, 'lr': 0.01945737514319542, 'lambda_val': 0.00041384951091696736, 'batch_size': 1962, 'optimizer': 'SGD'}.
2026-07-04 22:08:16,437 - optuna.study.study - INFO - Trial 55 finished with values: [0.006613753611513944, 0.001645992819558156, 0.003960459818057131] and parameters: {'n_layers': 1, 'embedding_dim': 64, 'lr': 0.0010295843799712518, 'lambda_val': 7.045045135561742e-06, 'batch_size': 953, 'optimizer': 'Adam'}.
2026-07-04 22:09:04,888 - experiment_functions - INFO - Early stopping at epoch 550. Best Metrics: (0.001735326937101691, 0.0004587504511521001, 0.0011873238479754196)
2026-07-04 22:09:05,422 - optuna.study.study - INFO - Trial 56 finished with values: [0.001735326937101691, 0.0004587504511521001, 0.0011873238479754196] and parameters: {'n_layers': 1, 'embedding_dim': 128, 'lr': 0.07167055366810839, 'lambda_val': 2.9920385603702593e-06, 'batch_size': 2702, 'optimizer': 'RMSprop'}.
