2026-06-28 13:45:45,756 - optuna.study.study - INFO - Trial 281 finished with values: [0.035141422817820865, 0.007606899302851281, 0.02162898043555221] and parameters: {'n_layers': 1, 'embedding_dim': 256, 'lr': 0.001948110338269317, 'lambda_val': 6.447923168817336e-05, 'batch_size': 2778, 'optimizer': 'Adam'}.
2026-06-28 13:51:52,426 - optuna.study.study - INFO - Trial 282 finished with values: [0.031234254009759856, 0.0068280683091769085, 0.018921121438763584] and parameters: {'n_layers': 1, 'embedding_dim': 128, 'lr': 0.001948110338269317, 'lambda_val': 0.0006043567828314722, 'batch_size': 2896, 'optimizer': 'Adam'}.
2026-06-28 13:58:47,145 - optuna.study.study - INFO - Trial 283 finished with values: [0.0263298373171148, 0.005652223467507551, 0.016106049166949698] and parameters: {'n_layers': 1, 'embedding_dim': 256, 'lr': 0.001948110338269317, 'lambda_val': 6.447923168817336e-05, 'batch_size': 1380, 'optimizer': 'RMSprop'}.
2026-06-28 14:00:27,897 - experiment_functions - INFO - Early stopping at epoch 1250. Best Metrics: (0.0002189166867030441, 5.0339076420416775e-05, 0.00011149927304281046)
2026-06-28 14:00:27,980 - optuna.study.study - INFO - Trial 284 finished with values: [0.0002189166867030441, 5.0339076420416775e-05, 0.00011149927304281046] and parameters: {'n_layers': 1, 'embedding_dim': 32, 'lr': 9.8331407744681e-05, 'lambda_val': 4.470441871474425e-06, 'batch_size': 2292, 'optimizer': 'Adam'}.
2026-06-28 14:04:58,280 - experiment_functions - INFO - Early stopping at epoch 1900. Best Metrics: (0.0002535273821548465, 5.7937427578215534e-05, 0.00016211933500854877)
2026-06-28 14:04:58,355 - optuna.study.study - INFO - Trial 285 finished with values: [0.0002535273821548465, 5.7937427578215534e-05, 0.00016211933500854877] and parameters: {'n_layers': 3, 'embedding_dim': 256, 'lr': 5.5706775815473365e-05, 'lambda_val': 0.00042582251014454875, 'batch_size': 904, 'optimizer': 'RMSprop'}.
2026-06-28 14:06:52,999 - experiment_functions - INFO - Early stopping at epoch 1250. Best Metrics: (0.00026622993403342584, 6.553577873601429e-05, 0.0001435480211977626)
2026-06-28 14:06:53,089 - optuna.study.study - INFO - Trial 286 finished with values: [0.00026622993403342584, 6.553577873601429e-05, 0.0001435480211977626] and parameters: {'n_layers': 1, 'embedding_dim': 128, 'lr': 3.0975713711754736e-05, 'lambda_val': 8.960789240600014e-06, 'batch_size': 3167, 'optimizer': 'Adam'}.
2026-06-28 14:12:58,395 - optuna.study.study - INFO - Trial 287 finished with values: [0.018669009764787116, 0.004343407480576715, 0.01117172888305905] and parameters: {'n_layers': 1, 'embedding_dim': 128, 'lr': 0.005739501470387607, 'lambda_val': 0.004160554354915883, 'batch_size': 2563, 'optimizer': 'RMSprop'}.
2026-06-28 14:19:03,344 - optuna.study.study - INFO - Trial 288 finished with values: [0.023672055558903157, 0.005232414566039169, 0.014214429374010417] and parameters: {'n_layers': 1, 'embedding_dim': 128, 'lr': 0.005739501470387607, 'lambda_val': 0.0006043567828314722, 'batch_size': 2563, 'optimizer': 'RMSprop'}.
2026-06-28 14:24:56,734 - optuna.study.study - INFO - Trial 289 finished with values: [0.025166195722111397, 0.005389130558668769, 0.015112632111044666] and parameters: {'n_layers': 1, 'embedding_dim': 96, 'lr': 0.005739501470387607, 'lambda_val': 8.960789240600014e-06, 'batch_size': 2430, 'optimizer': 'Adam'}.
2026-06-28 14:28:57,044 - experiment_functions - INFO - Early stopping at epoch 2600. Best Metrics: (0.027002458916262337, 0.005741504093611687, 0.0158934856044799)
2026-06-28 14:28:57,125 - optuna.study.study - INFO - Trial 290 finished with values: [0.027002458916262337, 0.005741504093611687, 0.0158934856044799] and parameters: {'n_layers': 1, 'embedding_dim': 128, 'lr': 0.005739501470387607, 'lambda_val': 0.000307769265113033, 'batch_size': 4066, 'optimizer': 'Adam'}.
2026-06-28 14:34:48,194 - optuna.study.study - INFO - Trial 291 finished with values: [0.02552428761679076, 0.005592386452139887, 0.015386957123781719] and parameters: {'n_layers': 1, 'embedding_dim': 96, 'lr': 0.001948110338269317, 'lambda_val': 0.0007291764073054842, 'batch_size': 2430, 'optimizer': 'RMSprop'}.
2026-06-28 14:40:53,764 - optuna.study.study - INFO - Trial 292 finished with values: [0.02419180003570356, 0.005365385711300649, 0.01437441504264436] and parameters: {'n_layers': 1, 'embedding_dim': 128, 'lr': 0.005739501470387607, 'lambda_val': 0.0006043567828314722, 'batch_size': 2792, 'optimizer': 'Adam'}.
2026-06-28 14:41:44,411 - experiment_functions - INFO - Early stopping at epoch 550. Best Metrics: (0.003314958012064491, 0.0009307980168303479, 0.002209851391890242)
2026-06-28 14:41:44,720 - optuna.study.study - INFO - Trial 293 finished with values: [0.003314958012064491, 0.0009307980168303479, 0.002209851391890242] and parameters: {'n_layers': 1, 'embedding_dim': 96, 'lr': 0.046156281837345055, 'lambda_val': 6.447923168817336e-05, 'batch_size': 2292, 'optimizer': 'RMSprop'}.
2026-06-28 14:47:50,351 - optuna.study.study - INFO - Trial 294 finished with values: [0.02869854841472765, 0.006499439621602112, 0.0174113018019625] and parameters: {'n_layers': 1, 'embedding_dim': 128, 'lr': 0.0018317416818496054, 'lambda_val': 0.000307769265113033, 'batch_size': 2000, 'optimizer': 'Adam'}.
2026-06-28 14:53:56,063 - optuna.study.study - INFO - Trial 295 finished with values: [0.02873330192175007, 0.006458598484128944, 0.017771752866891456] and parameters: {'n_layers': 1, 'embedding_dim': 128, 'lr': 0.001948110338269317, 'lambda_val': 6.447923168817336e-05, 'batch_size': 2204, 'optimizer': 'Adam'}.
2026-06-28 14:54:43,933 - experiment_functions - INFO - Early stopping at epoch 500. Best Metrics: (0.00019030715320248533, 5.033907642041677e-05, 0.00010715661197369862)
2026-06-28 14:54:44,035 - optuna.study.study - INFO - Trial 296 finished with values: [0.00019030715320248533, 5.033907642041677e-05, 0.00010715661197369862] and parameters: {'n_layers': 1, 'embedding_dim': 128, 'lr': 3.056166107816257e-05, 'lambda_val': 0.0006043567828314722, 'batch_size': 4066, 'optimizer': 'Adam'}.
2026-06-28 14:55:29,985 - experiment_functions - INFO - Early stopping at epoch 500. Best Metrics: (0.00019330028363139358, 5.413825199931615e-05, 0.00012335089483936587)
2026-06-28 14:55:30,110 - optuna.study.study - INFO - Trial 297 finished with values: [0.00019330028363139358, 5.413825199931615e-05, 0.00012335089483936587] and parameters: {'n_layers': 1, 'embedding_dim': 96, 'lr': 0.001948110338269317, 'lambda_val': 6.447923168817336e-05, 'batch_size': 2292, 'optimizer': 'SGD'}.
2026-06-28 15:01:18,178 - optuna.study.study - INFO - Trial 298 finished with values: [0.02234040853821447, 0.004817354634044413, 0.013127138939360803] and parameters: {'n_layers': 1, 'embedding_dim': 96, 'lr': 0.005739501470387607, 'lambda_val': 0.0006043567828314722, 'batch_size': 2430, 'optimizer': 'RMSprop'}.
2026-06-28 15:07:22,630 - optuna.study.study - INFO - Trial 299 finished with values: [0.02531670941729417, 0.005425222726668314, 0.015275382260998923] and parameters: {'n_layers': 1, 'embedding_dim': 128, 'lr': 0.005739501470387607, 'lambda_val': 6.447923168817336e-05, 'batch_size': 2292, 'optimizer': 'Adam'}.
2026-06-28 15:07:22,645 - root - INFO - Selected Trial 281 based on Max ndcg: 0.0216
2026-06-28 15:07:22,645 - root - INFO - Associated Recall: 0.0351
2026-06-28 15:07:22,645 - experiment_functions - INFO - Training the best model ... for e_amazon_full
2026-06-28 15:14:27,692 - root - INFO - **** Training e_amazon_1c1dcs
2026-06-28 15:14:27,692 - root - INFO -   ** 1-Dominant stats:
2026-06-28 15:14:27,692 - root - INFO -   ** Finding the dominant set:
2026-06-29 12:50:30,435 - root - INFO -   ** Getting the trainable edges:
2026-06-29 12:50:30,514 - helper_functions - INFO -      Number of nodes: 19061
2026-06-29 12:50:30,514 - helper_functions - INFO -      Ratio: 0.13214597689993207
2026-06-29 12:50:30,514 - helper_functions - INFO -      Number of unique users: 4799
2026-06-29 12:50:30,514 - helper_functions - INFO -      Number of unique items: 14262
2026-06-29 12:50:30,514 - helper_functions - INFO -      Total dominant set edge: 110407
2026-06-29 12:50:30,514 - helper_functions - INFO -      Trainable edges: 88325.6
2026-06-29 12:50:30,634 - root - INFO -   **** Getting 110407 dominant set edges
2026-06-29 12:50:30,750 - optuna.storages._rdb.storage - INFO - A new study created in RDB with name: Study_e_amazon_1c1dcs_strict
2026-06-29 12:51:13,357 - experiment_functions - INFO - Early stopping at epoch 550. Best Metrics: (0.0018208591322287117, 0.0005622779856771081, 0.0011173535559506472)
2026-06-29 12:51:13,452 - optuna.study.study - INFO - Trial 0 finished with values: [0.0018208591322287117, 0.0005622779856771081, 0.0011173535559506472] and parameters: {'n_layers': 2, 'embedding_dim': 32, 'lr': 0.005466403487028649, 'lambda_val': 0.0045158154821205955, 'batch_size': 3775, 'optimizer': 'Adam'}.
2026-06-29 12:51:56,799 - experiment_functions - INFO - Early stopping at epoch 500. Best Metrics: (0.00024954701491289105, 4.9389282525691926e-05, 0.0001283750554959808)
2026-06-29 12:51:56,866 - optuna.study.study - INFO - Trial 1 finished with values: [0.00024954701491289105, 4.9389282525691926e-05, 0.0001283750554959808] and parameters: {'n_layers': 3, 'embedding_dim': 128, 'lr': 0.0014332644113720027, 'lambda_val': 0.014386781210446935, 'batch_size': 3896, 'optimizer': 'SGD'}.
2026-06-29 12:52:47,065 - experiment_functions - INFO - Early stopping at epoch 500. Best Metrics: (0.0011180232946693253, 0.0003314780692589708, 0.0007565477656212464)
2026-06-29 12:52:47,133 - optuna.study.study - INFO - Trial 2 finished with values: [0.0011180232946693253, 0.0003314780692589708, 0.0007565477656212464] and parameters: {'n_layers': 3, 'embedding_dim': 256, 'lr': 0.02761939993756294, 'lambda_val': 1.5359911139419394e-06, 'batch_size': 2584, 'optimizer': 'RMSprop'}.
2026-06-29 12:53:26,157 - experiment_functions - INFO - Early stopping at epoch 500. Best Metrics: (0.00022325695873504162, 5.983701536766521e-05, 0.00014373684636742682)
2026-06-29 12:53:26,245 - optuna.study.study - INFO - Trial 3 finished with values: [0.00022325695873504162, 5.983701536766521e-05, 0.00014373684636742682] and parameters: {'n_layers': 1, 'embedding_dim': 32, 'lr': 0.00023688334312331656, 'lambda_val': 0.0006941170508368597, 'batch_size': 2657, 'optimizer': 'SGD'}.
2026-06-29 12:54:08,097 - experiment_functions - INFO - Early stopping at epoch 500. Best Metrics: (0.00022758834167742732, 5.603783978876584e-05, 0.00013246554219468334)
2026-06-29 12:54:08,201 - optuna.study.study - INFO - Trial 4 finished with values: [0.00022758834167742732, 5.603783978876584e-05, 0.00013246554219468334] and parameters: {'n_layers': 3, 'embedding_dim': 64, 'lr': 0.09683727895728858, 'lambda_val': 0.000685201976998681, 'batch_size': 944, 'optimizer': 'SGD'}.
2026-06-29 12:54:51,588 - experiment_functions - INFO - Early stopping at epoch 500. Best Metrics: (0.00017342406546825214, 5.983701536766521e-05, 0.00012157953842257879)
2026-06-29 12:54:51,671 - optuna.study.study - INFO - Trial 5 finished with values: [0.00017342406546825214, 5.983701536766521e-05, 0.00012157953842257879] and parameters: {'n_layers': 2, 'embedding_dim': 128, 'lr': 0.00012192508098868524, 'lambda_val': 0.02213661621737592, 'batch_size': 711, 'optimizer': 'RMSprop'}.
2026-06-29 12:55:49,441 - experiment_functions - INFO - Early stopping at epoch 650. Best Metrics: (0.00045871659084323, 0.00020895465683946587, 0.00036528931131768835)
2026-06-29 12:55:49,511 - optuna.study.study - INFO - Trial 6 finished with values: [0.00045871659084323, 0.00020895465683946587, 0.00036528931131768835] and parameters: {'n_layers': 3, 'embedding_dim': 128, 'lr': 0.0951182596909589, 'lambda_val': 6.062226724528523e-06, 'batch_size': 831, 'optimizer': 'Adam'}.
2026-06-29 12:56:31,480 - experiment_functions - INFO - Early stopping at epoch 500. Best Metrics: (0.00024119115658111925, 6.553577873601429e-05, 0.0001512073432916863)
2026-06-29 12:56:31,586 - optuna.study.study - INFO - Trial 7 finished with values: [0.00024119115658111925, 6.553577873601429e-05, 0.0001512073432916863] and parameters: {'n_layers': 2, 'embedding_dim': 96, 'lr': 0.06732722053295126, 'lambda_val': 0.0004994369806250174, 'batch_size': 1678, 'optimizer': 'SGD'}.
2026-06-29 12:57:24,039 - experiment_functions - INFO - Early stopping at epoch 500. Best Metrics: (0.0002834132413922132, 6.743536652546397e-05, 0.0001680266353906114)
2026-06-29 12:57:24,119 - optuna.study.study - INFO - Trial 8 finished with values: [0.0002834132413922132, 6.743536652546397e-05, 0.0001680266353906114] and parameters: {'n_layers': 4, 'embedding_dim': 256, 'lr': 0.0008508763683757391, 'lambda_val': 1.5124002494034645e-06, 'batch_size': 779, 'optimizer': 'SGD'}.
2026-06-29 12:58:10,656 - experiment_functions - INFO - Early stopping at epoch 550. Best Metrics: (0.0013496456668828575, 0.0004929430313621944, 0.0009097499946201362)
2026-06-29 12:58:10,740 - optuna.study.study - INFO - Trial 9 finished with values: [0.0013496456668828575, 0.0004929430313621944, 0.0009097499946201362] and parameters: {'n_layers': 1, 'embedding_dim': 128, 'lr': 0.04247752781777964, 'lambda_val': 6.579378672773439e-05, 'batch_size': 1304, 'optimizer': 'Adam'}.
2026-06-29 12:58:51,484 - experiment_functions - INFO - Early stopping at epoch 500. Best Metrics: (0.0002816002248287907, 6.553577873601429e-05, 0.00016963470291292342)
2026-06-29 12:58:51,541 - optuna.study.study - INFO - Trial 10 finished with values: [0.0002816002248287907, 6.553577873601429e-05, 0.00016963470291292342] and parameters: {'n_layers': 3, 'embedding_dim': 32, 'lr': 0.0001976293616470771, 'lambda_val': 0.043836516646315986, 'batch_size': 1141, 'optimizer': 'SGD'}.
2026-06-29 13:00:26,396 - experiment_functions - INFO - Early stopping at epoch 1250. Best Metrics: (0.00023746287235693053, 7.123454210436335e-05, 0.00015415307027193906)
2026-06-29 13:00:26,477 - optuna.study.study - INFO - Trial 11 finished with values: [0.00023746287235693053, 7.123454210436335e-05, 0.00015415307027193906] and parameters: {'n_layers': 1, 'embedding_dim': 32, 'lr': 4.0175637269628575e-05, 'lambda_val': 4.9806804138388375e-05, 'batch_size': 3459, 'optimizer': 'RMSprop'}.
2026-06-29 13:01:24,730 - experiment_functions - INFO - Early stopping at epoch 750. Best Metrics: (0.00018763499373506816, 5.6987633683490685e-05, 0.00010123867720410156)
2026-06-29 13:01:24,824 - optuna.study.study - INFO - Trial 12 finished with values: [0.00018763499373506816, 5.6987633683490685e-05, 0.00010123867720410156] and parameters: {'n_layers': 1, 'embedding_dim': 32, 'lr': 0.05327230267336559, 'lambda_val': 1.5213422827494516e-06, 'batch_size': 2288, 'optimizer': 'SGD'}.
2026-06-29 13:02:54,683 - experiment_functions - INFO - Early stopping at epoch 1100. Best Metrics: (0.0002923797542957674, 0.00014721805368235092, 0.0002221319504363518)
2026-06-29 13:02:54,783 - optuna.study.study - INFO - Trial 13 finished with values: [0.0002923797542957674, 0.00014721805368235092, 0.0002221319504363518] and parameters: {'n_layers': 4, 'embedding_dim': 64, 'lr': 0.003964255356378358, 'lambda_val': 0.010580947887077394, 'batch_size': 3991, 'optimizer': 'RMSprop'}.
2026-06-29 13:03:36,985 - experiment_functions - INFO - Early stopping at epoch 500. Best Metrics: (0.0002517133462011162, 5.698763368349069e-05, 0.0001412559279794186)
2026-06-29 13:03:37,054 - optuna.study.study - INFO - Trial 14 finished with values: [0.0002517133462011162, 5.698763368349069e-05, 0.0001412559279794186] and parameters: {'n_layers': 2, 'embedding_dim': 96, 'lr': 0.011907671856603224, 'lambda_val': 0.0002566219366809368, 'batch_size': 1253, 'optimizer': 'SGD'}.
2026-06-29 13:04:18,195 - experiment_functions - INFO - Early stopping at epoch 500. Best Metrics: (0.00022128673856887474, 5.698763368349067e-05, 0.0001268529237772602)
2026-06-29 13:04:18,273 - optuna.study.study - INFO - Trial 15 finished with values: [0.00022128673856887474, 5.698763368349067e-05, 0.0001268529237772602] and parameters: {'n_layers': 1, 'embedding_dim': 64, 'lr': 0.00036473397562610844, 'lambda_val': 0.08690275367538379, 'batch_size': 2493, 'optimizer': 'SGD'}.
2026-06-29 13:06:22,395 - experiment_functions - INFO - Early stopping at epoch 1550. Best Metrics: (0.0002105270616485414, 7.123454210436335e-05, 0.0001242264971152125)
2026-06-29 13:06:22,542 - optuna.study.study - INFO - Trial 16 finished with values: [0.0002105270616485414, 7.123454210436335e-05, 0.0001242264971152125] and parameters: {'n_layers': 2, 'embedding_dim': 96, 'lr': 4.866934196735807e-05, 'lambda_val': 1.468326914234123e-05, 'batch_size': 1035, 'optimizer': 'Adam'}.
2026-06-29 13:11:00,455 - experiment_functions - INFO - Early stopping at epoch 3700. Best Metrics: (0.00027384519206255937, 7.313412989381305e-05, 0.00015869779898583457)
2026-06-29 13:11:00,523 - optuna.study.study - INFO - Trial 17 finished with values: [0.00027384519206255937, 7.313412989381305e-05, 0.00015869779898583457] and parameters: {'n_layers': 3, 'embedding_dim': 32, 'lr': 4.5882747189392185e-05, 'lambda_val': 1.4166254702318954e-06, 'batch_size': 2365, 'optimizer': 'RMSprop'}.
2026-06-29 13:14:15,048 - experiment_functions - INFO - Early stopping at epoch 2450. Best Metrics: (0.003096066694606681, 0.0009858860627243889, 0.002125001819500982)
2026-06-29 13:14:15,134 - optuna.study.study - INFO - Trial 18 finished with values: [0.003096066694606681, 0.0009858860627243889, 0.002125001819500982] and parameters: {'n_layers': 1, 'embedding_dim': 128, 'lr': 0.0007556847336647807, 'lambda_val': 3.159634083184005e-05, 'batch_size': 1473, 'optimizer': 'Adam'}.
2026-06-29 13:14:58,455 - experiment_functions - INFO - Early stopping at epoch 550. Best Metrics: (0.0004311166218152886, 0.0001481678475770758, 0.00026859125016086955)
2026-06-29 13:14:58,531 - optuna.study.study - INFO - Trial 19 finished with values: [0.0004311166218152886, 0.0001481678475770758, 0.00026859125016086955] and parameters: {'n_layers': 1, 'embedding_dim': 32, 'lr': 0.002038269853150342, 'lambda_val': 0.042373271372499535, 'batch_size': 1718, 'optimizer': 'RMSprop'}.
2026-06-29 13:15:39,135 - experiment_functions - INFO - Early stopping at epoch 500. Best Metrics: (0.0001725863050565593, 5.5088045894041e-05, 0.00010528394509907071)
2026-06-29 13:15:39,220 - optuna.study.study - INFO - Trial 20 finished with values: [0.0001725863050565593, 5.5088045894041e-05, 0.00010528394509907071] and parameters: {'n_layers': 4, 'embedding_dim': 32, 'lr': 0.046845690075975055, 'lambda_val': 0.0011906653056529613, 'batch_size': 1606, 'optimizer': 'SGD'}.
2026-06-29 13:16:23,405 - experiment_functions - INFO - Early stopping at epoch 500. Best Metrics: (0.0002439538548549184, 6.173660315711492e-05, 0.0001412829264662599)
2026-06-29 13:16:23,481 - optuna.study.study - INFO - Trial 21 finished with values: [0.0002439538548549184, 6.173660315711492e-05, 0.0001412829264662599] and parameters: {'n_layers': 4, 'embedding_dim': 96, 'lr': 3.612819876896157e-05, 'lambda_val': 0.0006440628507108451, 'batch_size': 2954, 'optimizer': 'SGD'}.
2026-06-29 13:17:12,334 - experiment_functions - INFO - Early stopping at epoch 600. Best Metrics: (0.00015236580356227893, 5.223866420986646e-05, 0.00010096459017530028)
2026-06-29 13:17:12,417 - optuna.study.study - INFO - Trial 22 finished with values: [0.00015236580356227893, 5.223866420986646e-05, 0.00010096459017530028] and parameters: {'n_layers': 1, 'embedding_dim': 96, 'lr': 5.9960621287356206e-05, 'lambda_val': 0.018800828996706705, 'batch_size': 2854, 'optimizer': 'RMSprop'}.
2026-06-29 13:17:55,078 - experiment_functions - INFO - Early stopping at epoch 500. Best Metrics: (0.00026741040887136145, 5.983701536766521e-05, 0.00014220688462665838)
2026-06-29 13:17:55,162 - optuna.study.study - INFO - Trial 23 finished with values: [0.00026741040887136145, 5.983701536766521e-05, 0.00014220688462665838] and parameters: {'n_layers': 1, 'embedding_dim': 128, 'lr': 1.239375273942605e-05, 'lambda_val': 0.021968189496120952, 'batch_size': 4078, 'optimizer': 'RMSprop'}.
2026-06-29 13:18:45,401 - experiment_functions - INFO - Early stopping at epoch 500. Best Metrics: (0.0008653388474388529, 0.00030298425241722553, 0.0006596601857917541)
2026-06-29 13:18:45,462 - optuna.study.study - INFO - Trial 24 finished with values: [0.0008653388474388529, 0.00030298425241722553, 0.0006596601857917541] and parameters: {'n_layers': 3, 'embedding_dim': 256, 'lr': 0.018335519634559577, 'lambda_val': 0.007998340389978697, 'batch_size': 1797, 'optimizer': 'RMSprop'}.
2026-06-29 13:19:26,584 - experiment_functions - INFO - Early stopping at epoch 500. Best Metrics: (0.00020025407917302602, 5.413825199931615e-05, 0.00011447265508293902)
2026-06-29 13:19:26,673 - optuna.study.study - INFO - Trial 25 finished with values: [0.00020025407917302602, 5.413825199931615e-05, 0.00011447265508293902] and parameters: {'n_layers': 2, 'embedding_dim': 64, 'lr': 0.00033158672458672204, 'lambda_val': 1.3422411001986959e-05, 'batch_size': 3252, 'optimizer': 'SGD'}.
2026-06-29 13:20:18,501 - experiment_functions - INFO - Early stopping at epoch 500. Best Metrics: (0.00016030515663440978, 6.17366031571149e-05, 0.00011124598481349252)
2026-06-29 13:20:18,587 - optuna.study.study - INFO - Trial 26 finished with values: [0.00016030515663440978, 6.17366031571149e-05, 0.00011124598481349252] and parameters: {'n_layers': 4, 'embedding_dim': 256, 'lr': 0.004754282947509598, 'lambda_val': 1.1005164412742897e-06, 'batch_size': 2600, 'optimizer': 'SGD'}.
2026-06-29 13:20:59,053 - experiment_functions - INFO - Early stopping at epoch 500. Best Metrics: (0.00020867361273639145, 6.173660315711492e-05, 0.00012071933260206754)
