2026-06-30 18:40:56,640 - optuna.study.study - INFO - Trial 226 finished with values: [0.0021963437829250363, 0.0006658055202021162, 0.0015160001849842742] and parameters: {'n_layers': 3, 'embedding_dim': 256, 'lr': 0.00044843281655524526, 'lambda_val': 0.00023859514179547838, 'batch_size': 4084, 'optimizer': 'RMSprop'}.
2026-06-30 18:47:26,332 - optuna.study.study - INFO - Trial 227 finished with values: [0.002494405670424628, 0.000720893566096157, 0.001695768422958148] and parameters: {'n_layers': 3, 'embedding_dim': 256, 'lr': 0.00044843281655524526, 'lambda_val': 0.00020499046063986734, 'batch_size': 3196, 'optimizer': 'RMSprop'}.
2026-06-30 18:48:58,156 - experiment_functions - INFO - Early stopping at epoch 900. Best Metrics: (0.002271283829798214, 0.0006639059324126664, 0.0015123056823818939)
2026-06-30 18:48:58,249 - optuna.study.study - INFO - Trial 228 finished with values: [0.002271283829798214, 0.0006639059324126664, 0.0015123056823818939] and parameters: {'n_layers': 3, 'embedding_dim': 256, 'lr': 0.004124417799899418, 'lambda_val': 4.2886606921314005e-06, 'batch_size': 2368, 'optimizer': 'Adam'}.
2026-06-30 18:49:47,690 - experiment_functions - INFO - Early stopping at epoch 550. Best Metrics: (0.002063670487396585, 0.0005955207719924776, 0.001375774864377035)
2026-06-30 18:49:47,765 - optuna.study.study - INFO - Trial 229 finished with values: [0.002063670487396585, 0.0005955207719924776, 0.001375774864377035] and parameters: {'n_layers': 4, 'embedding_dim': 96, 'lr': 0.004974098253366267, 'lambda_val': 0.00042560409247420055, 'batch_size': 3196, 'optimizer': 'RMSprop'}.
2026-06-30 18:51:44,516 - experiment_functions - INFO - Early stopping at epoch 1500. Best Metrics: (0.001224722089164591, 0.0003960640541002602, 0.000877342663956012)
2026-06-30 18:51:44,605 - optuna.study.study - INFO - Trial 230 finished with values: [0.001224722089164591, 0.0003960640541002602, 0.000877342663956012] and parameters: {'n_layers': 2, 'embedding_dim': 64, 'lr': 0.002537969130795011, 'lambda_val': 0.03100285473033492, 'batch_size': 4039, 'optimizer': 'Adam'}.
2026-06-30 18:53:46,701 - experiment_functions - INFO - Early stopping at epoch 1600. Best Metrics: (0.00024641035680066613, 5.9837015367665226e-05, 0.00012285141943463383)
2026-06-30 18:53:46,800 - optuna.study.study - INFO - Trial 231 finished with values: [0.00024641035680066613, 5.9837015367665226e-05, 0.00012285141943463383] and parameters: {'n_layers': 4, 'embedding_dim': 32, 'lr': 2.433773452525261e-05, 'lambda_val': 0.00020499046063986734, 'batch_size': 3196, 'optimizer': 'RMSprop'}.
2026-06-30 18:54:36,158 - experiment_functions - INFO - Early stopping at epoch 550. Best Metrics: (0.001974001280911926, 0.000581273863571605, 0.0013152108553384462)
2026-06-30 18:54:36,258 - optuna.study.study - INFO - Trial 232 finished with values: [0.001974001280911926, 0.000581273863571605, 0.0013152108553384462] and parameters: {'n_layers': 4, 'embedding_dim': 96, 'lr': 0.004974098253366267, 'lambda_val': 0.00135046939560172, 'batch_size': 2625, 'optimizer': 'RMSprop'}.
2026-06-30 18:55:26,961 - experiment_functions - INFO - Early stopping at epoch 650. Best Metrics: (0.0015648888376573378, 0.0003865661151530118, 0.0009508379091489671)
2026-06-30 18:55:27,034 - optuna.study.study - INFO - Trial 233 finished with values: [0.0015648888376573378, 0.0003865661151530118, 0.0009508379091489671] and parameters: {'n_layers': 1, 'embedding_dim': 32, 'lr': 0.006717797853561655, 'lambda_val': 4.2886606921314005e-06, 'batch_size': 2368, 'optimizer': 'Adam'}.
2026-06-30 19:00:17,430 - experiment_functions - INFO - Early stopping at epoch 3800. Best Metrics: (0.00173955570245048, 0.00038371673346883724, 0.001084465836982202)
2026-06-30 19:00:17,503 - optuna.study.study - INFO - Trial 234 finished with values: [0.00173955570245048, 0.00038371673346883724, 0.001084465836982202] and parameters: {'n_layers': 1, 'embedding_dim': 96, 'lr': 0.000678453369086835, 'lambda_val': 0.00023859514179547838, 'batch_size': 3994, 'optimizer': 'Adam'}.
2026-06-30 19:06:29,915 - experiment_functions - INFO - Early stopping at epoch 3600. Best Metrics: (0.0024743171699653974, 0.0007655338791482248, 0.0017191101276091403)
2026-06-30 19:06:29,987 - optuna.study.study - INFO - Trial 235 finished with values: [0.0024743171699653974, 0.0007655338791482248, 0.0017191101276091403] and parameters: {'n_layers': 4, 'embedding_dim': 256, 'lr': 0.00044843281655524526, 'lambda_val': 0.00020499046063986734, 'batch_size': 3994, 'optimizer': 'RMSprop'}.
2026-06-30 19:13:22,877 - optuna.study.study - INFO - Trial 236 finished with values: [0.0034113406763958943, 0.0009801872993560397, 0.0022805287556869453] and parameters: {'n_layers': 4, 'embedding_dim': 256, 'lr': 0.000769747194462119, 'lambda_val': 4.2886606921314005e-06, 'batch_size': 591, 'optimizer': 'RMSprop'}.
2026-06-30 19:14:18,709 - experiment_functions - INFO - Early stopping at epoch 700. Best Metrics: (0.0018371352439448686, 0.0005328343749406379, 0.001237829037720339)
2026-06-30 19:14:18,793 - optuna.study.study - INFO - Trial 237 finished with values: [0.0018371352439448686, 0.0005328343749406379, 0.001237829037720339] and parameters: {'n_layers': 4, 'embedding_dim': 32, 'lr': 0.006717797853561655, 'lambda_val': 6.297092163325562e-06, 'batch_size': 2833, 'optimizer': 'RMSprop'}.
2026-06-30 19:19:19,225 - optuna.study.study - INFO - Trial 238 finished with values: [0.002012864035828273, 0.000501491176414718, 0.0013738077065255862] and parameters: {'n_layers': 4, 'embedding_dim': 32, 'lr': 0.000678453369086835, 'lambda_val': 0.0001986652205643858, 'batch_size': 591, 'optimizer': 'RMSprop'}.
2026-06-30 19:20:31,599 - experiment_functions - INFO - Early stopping at epoch 850. Best Metrics: (0.0022738270614365633, 0.0006582071690443175, 0.0014970195777238438)
2026-06-30 19:20:31,692 - optuna.study.study - INFO - Trial 239 finished with values: [0.0022738270614365633, 0.0006582071690443175, 0.0014970195777238438] and parameters: {'n_layers': 3, 'embedding_dim': 96, 'lr': 0.004974098253366267, 'lambda_val': 0.00016218839236180774, 'batch_size': 1192, 'optimizer': 'Adam'}.
2026-06-30 19:26:20,543 - optuna.study.study - INFO - Trial 240 finished with values: [0.002305675949691501, 0.000618315825465874, 0.0015993981128314266] and parameters: {'n_layers': 4, 'embedding_dim': 128, 'lr': 0.0006387010239111333, 'lambda_val': 0.00016218839236180774, 'batch_size': 591, 'optimizer': 'Adam'}.
2026-06-30 19:27:41,978 - experiment_functions - INFO - Early stopping at epoch 750. Best Metrics: (0.001963214997644836, 0.0006078680926239005, 0.0013242961311419024)
2026-06-30 19:27:42,055 - optuna.study.study - INFO - Trial 241 finished with values: [0.001963214997644836, 0.0006078680926239005, 0.0013242961311419024] and parameters: {'n_layers': 4, 'embedding_dim': 256, 'lr': 0.004974098253366267, 'lambda_val': 0.00042560409247420055, 'batch_size': 697, 'optimizer': 'Adam'}.
2026-06-30 19:28:44,937 - experiment_functions - INFO - Early stopping at epoch 750. Best Metrics: (0.0024467615331974523, 0.0006743536652546398, 0.0015810271090563961)
2026-06-30 19:28:45,013 - optuna.study.study - INFO - Trial 242 finished with values: [0.0024467615331974523, 0.0006743536652546398, 0.0015810271090563961] and parameters: {'n_layers': 4, 'embedding_dim': 64, 'lr': 0.002537969130795011, 'lambda_val': 6.297092163325562e-06, 'batch_size': 3549, 'optimizer': 'RMSprop'}.
2026-06-30 19:29:51,351 - experiment_functions - INFO - Early stopping at epoch 750. Best Metrics: (0.0023285931411116696, 0.0006629561385179416, 0.001561430521902613)
2026-06-30 19:29:51,433 - optuna.study.study - INFO - Trial 243 finished with values: [0.0023285931411116696, 0.0006629561385179416, 0.001561430521902613] and parameters: {'n_layers': 3, 'embedding_dim': 128, 'lr': 0.004124417799899418, 'lambda_val': 1.2687145973445492e-05, 'batch_size': 2097, 'optimizer': 'RMSprop'}.
2026-06-30 19:31:43,534 - experiment_functions - INFO - Early stopping at epoch 1250. Best Metrics: (0.001123825025271152, 0.0003780179701004882, 0.0007958250764907739)
2026-06-30 19:31:43,608 - optuna.study.study - INFO - Trial 244 finished with values: [0.001123825025271152, 0.0003780179701004882, 0.0007958250764907739] and parameters: {'n_layers': 4, 'embedding_dim': 128, 'lr': 0.00476777556110791, 'lambda_val': 0.08322696713712696, 'batch_size': 1192, 'optimizer': 'Adam'}.
2026-06-30 19:37:17,128 - optuna.study.study - INFO - Trial 245 finished with values: [0.002738839553729888, 0.0007389396500959291, 0.0018096329681166743] and parameters: {'n_layers': 4, 'embedding_dim': 96, 'lr': 0.0006387010239111333, 'lambda_val': 0.00016218839236180774, 'batch_size': 2156, 'optimizer': 'Adam'}.
2026-06-30 19:38:29,443 - experiment_functions - INFO - Early stopping at epoch 700. Best Metrics: (0.0020094163315476344, 0.0005831734513610547, 0.0012875947037968285)
2026-06-30 19:38:29,529 - optuna.study.study - INFO - Trial 246 finished with values: [0.0020094163315476344, 0.0005831734513610547, 0.0012875947037968285] and parameters: {'n_layers': 3, 'embedding_dim': 256, 'lr': 0.006717797853561655, 'lambda_val': 0.0005632302201312664, 'batch_size': 691, 'optimizer': 'Adam'}.
2026-06-30 19:44:02,934 - optuna.study.study - INFO - Trial 247 finished with values: [0.0026187810108497466, 0.0007474877951484529, 0.0018174852273873346] and parameters: {'n_layers': 4, 'embedding_dim': 96, 'lr': 0.0006387010239111333, 'lambda_val': 0.00016218839236180774, 'batch_size': 2156, 'optimizer': 'Adam'}.
2026-06-30 19:45:39,800 - experiment_functions - INFO - Early stopping at epoch 1250. Best Metrics: (0.002704509160888433, 0.0007845297570427218, 0.0018313192714324341)
2026-06-30 19:45:39,893 - optuna.study.study - INFO - Trial 248 finished with values: [0.002704509160888433, 0.0007845297570427218, 0.0018313192714324341] and parameters: {'n_layers': 4, 'embedding_dim': 32, 'lr': 0.004124417799899418, 'lambda_val': 0.00020499046063986734, 'batch_size': 591, 'optimizer': 'RMSprop'}.
2026-06-30 19:47:35,234 - experiment_functions - INFO - Early stopping at epoch 1350. Best Metrics: (0.0021664421361922504, 0.0006572573751495926, 0.0014276937534235504)
2026-06-30 19:47:35,348 - optuna.study.study - INFO - Trial 249 finished with values: [0.0021664421361922504, 0.0006572573751495926, 0.0014276937534235504] and parameters: {'n_layers': 4, 'embedding_dim': 96, 'lr': 0.005907828997735388, 'lambda_val': 4.2886606921314005e-06, 'batch_size': 1192, 'optimizer': 'Adam'}.
2026-06-30 19:52:50,800 - optuna.study.study - INFO - Trial 250 finished with values: [0.002913478905854738, 0.0007512869707273522, 0.0019501196911619295] and parameters: {'n_layers': 4, 'embedding_dim': 64, 'lr': 0.000769747194462119, 'lambda_val': 4.2886606921314005e-06, 'batch_size': 591, 'optimizer': 'RMSprop'}.
2026-06-30 19:58:22,962 - optuna.study.study - INFO - Trial 251 finished with values: [0.0027412901025878336, 0.0007645840852535, 0.0018228720461600243] and parameters: {'n_layers': 4, 'embedding_dim': 96, 'lr': 0.00044843281655524526, 'lambda_val': 1.2687145973445492e-05, 'batch_size': 3994, 'optimizer': 'RMSprop'}.
2026-06-30 20:03:05,310 - experiment_functions - INFO - Early stopping at epoch 3750. Best Metrics: (0.0024788584270185143, 0.0006154664437816995, 0.0015858204591086384)
2026-06-30 20:03:05,409 - optuna.study.study - INFO - Trial 252 finished with values: [0.0024788584270185143, 0.0006154664437816995, 0.0015858204591086384] and parameters: {'n_layers': 4, 'embedding_dim': 32, 'lr': 0.000678453369086835, 'lambda_val': 0.00020499046063986734, 'batch_size': 2830, 'optimizer': 'Adam'}.
2026-06-30 20:08:19,525 - optuna.study.study - INFO - Trial 253 finished with values: [0.0016887110424971042, 0.0004093611686264081, 0.0011063256750088871] and parameters: {'n_layers': 2, 'embedding_dim': 96, 'lr': 0.00044843281655524526, 'lambda_val': 1.2687145973445492e-05, 'batch_size': 3994, 'optimizer': 'Adam'}.
2026-06-30 20:09:24,873 - experiment_functions - INFO - Early stopping at epoch 800. Best Metrics: (0.0022362464181069647, 0.0006154664437816994, 0.0015608456175770292)
2026-06-30 20:09:24,960 - optuna.study.study - INFO - Trial 254 finished with values: [0.0022362464181069647, 0.0006154664437816994, 0.0015608456175770292] and parameters: {'n_layers': 3, 'embedding_dim': 64, 'lr': 0.002537969130795011, 'lambda_val': 0.00023859514179547838, 'batch_size': 4084, 'optimizer': 'RMSprop'}.
2026-06-30 20:14:47,420 - optuna.study.study - INFO - Trial 255 finished with values: [0.0024321478197193943, 0.0006192656193605988, 0.0016721072304538543] and parameters: {'n_layers': 3, 'embedding_dim': 96, 'lr': 0.00044843281655524526, 'lambda_val': 9.07823158663835e-05, 'batch_size': 3994, 'optimizer': 'RMSprop'}.
2026-06-30 20:21:39,273 - optuna.study.study - INFO - Trial 256 finished with values: [0.0021529577827422296, 0.0006088178865186255, 0.0015459773785671586] and parameters: {'n_layers': 4, 'embedding_dim': 256, 'lr': 0.00044843281655524526, 'lambda_val': 0.00020499046063986734, 'batch_size': 591, 'optimizer': 'RMSprop'}.
2026-06-30 20:28:32,082 - optuna.study.study - INFO - Trial 257 finished with values: [0.003052165754891778, 0.0008823585281993809, 0.002039561606846044] and parameters: {'n_layers': 4, 'embedding_dim': 256, 'lr': 0.0006387010239111333, 'lambda_val': 4.2886606921314005e-06, 'batch_size': 697, 'optimizer': 'RMSprop'}.
2026-06-30 20:29:23,940 - experiment_functions - INFO - Early stopping at epoch 650. Best Metrics: (0.00021529802182397305, 4.9389282525691926e-05, 0.00010864614205124872)
2026-06-30 20:29:24,007 - optuna.study.study - INFO - Trial 258 finished with values: [0.00021529802182397305, 4.9389282525691926e-05, 0.00010864614205124872] and parameters: {'n_layers': 3, 'embedding_dim': 32, 'lr': 3.170999451764273e-05, 'lambda_val': 6.297092163325562e-06, 'batch_size': 591, 'optimizer': 'RMSprop'}.
2026-06-30 20:30:23,630 - experiment_functions - INFO - Early stopping at epoch 750. Best Metrics: (0.0022405577291357156, 0.000642060672833995, 0.0015581649229962388)
2026-06-30 20:30:23,725 - optuna.study.study - INFO - Trial 259 finished with values: [0.0022405577291357156, 0.000642060672833995, 0.0015581649229962388] and parameters: {'n_layers': 4, 'embedding_dim': 32, 'lr': 0.004974098253366267, 'lambda_val': 0.0004266264333481233, 'batch_size': 910, 'optimizer': 'RMSprop'}.
2026-06-30 20:31:38,230 - experiment_functions - INFO - Early stopping at epoch 850. Best Metrics: (0.0023204299531483334, 0.0006734038713599148, 0.001551292128565453)
2026-06-30 20:31:38,310 - optuna.study.study - INFO - Trial 260 finished with values: [0.0023204299531483334, 0.0006734038713599148, 0.001551292128565453] and parameters: {'n_layers': 4, 'embedding_dim': 96, 'lr': 0.004974098253366267, 'lambda_val': 1.8435610067604346e-05, 'batch_size': 2368, 'optimizer': 'Adam'}.
2026-06-30 20:37:10,652 - optuna.study.study - INFO - Trial 261 finished with values: [0.0032163038811074745, 0.0009023041999886024, 0.002109213074516332] and parameters: {'n_layers': 4, 'embedding_dim': 96, 'lr': 0.0006387010239111333, 'lambda_val': 0.00016218839236180774, 'batch_size': 2156, 'optimizer': 'RMSprop'}.
2026-06-30 20:37:58,832 - experiment_functions - INFO - Early stopping at epoch 600. Best Metrics: (0.0014274916360376136, 0.00041695951978420684, 0.00097535141332224)
2026-06-30 20:37:58,924 - optuna.study.study - INFO - Trial 262 finished with values: [0.0014274916360376136, 0.00041695951978420684, 0.00097535141332224] and parameters: {'n_layers': 4, 'embedding_dim': 32, 'lr': 0.014770778960020806, 'lambda_val': 0.00020499046063986734, 'batch_size': 2156, 'optimizer': 'RMSprop'}.
2026-06-30 20:38:43,853 - experiment_functions - INFO - Early stopping at epoch 500. Best Metrics: (0.00017960491075316766, 5.223866420986646e-05, 0.0001095661370198651)
2026-06-30 20:38:43,941 - optuna.study.study - INFO - Trial 263 finished with values: [0.00017960491075316766, 5.223866420986646e-05, 0.0001095661370198651] and parameters: {'n_layers': 4, 'embedding_dim': 96, 'lr': 0.006717797853561655, 'lambda_val': 4.394195950204873e-06, 'batch_size': 2392, 'optimizer': 'SGD'}.
2026-06-30 20:43:44,917 - optuna.study.study - INFO - Trial 264 finished with values: [0.0023964266891595433, 0.0006392112911498206, 0.0016278104966874398] and parameters: {'n_layers': 4, 'embedding_dim': 32, 'lr': 0.000678453369086835, 'lambda_val': 6.297092163325562e-06, 'batch_size': 3994, 'optimizer': 'RMSprop'}.
2026-06-30 20:44:25,817 - experiment_functions - INFO - Early stopping at epoch 500. Best Metrics: (0.00025972488400124636, 6.078680926239006e-05, 0.00012088338413873989)
2026-06-30 20:44:25,907 - optuna.study.study - INFO - Trial 265 finished with values: [0.00025972488400124636, 6.078680926239006e-05, 0.00012088338413873989] and parameters: {'n_layers': 4, 'embedding_dim': 32, 'lr': 0.0006387010239111333, 'lambda_val': 4.2886606921314005e-06, 'batch_size': 3994, 'optimizer': 'SGD'}.
2026-06-30 20:45:25,887 - experiment_functions - INFO - Early stopping at epoch 750. Best Metrics: (0.0024699808977591696, 0.0006772030469388143, 0.0015882924807134335)
2026-06-30 20:45:25,957 - optuna.study.study - INFO - Trial 266 finished with values: [0.0024699808977591696, 0.0006772030469388143, 0.0015882924807134335] and parameters: {'n_layers': 4, 'embedding_dim': 32, 'lr': 0.004974098253366267, 'lambda_val': 0.0004266264333481233, 'batch_size': 1094, 'optimizer': 'RMSprop'}.
2026-06-30 20:47:07,883 - experiment_functions - INFO - Early stopping at epoch 1300. Best Metrics: (0.0016175257592398477, 0.00041411013810003226, 0.0011066160274689546)
2026-06-30 20:47:07,969 - optuna.study.study - INFO - Trial 267 finished with values: [0.0016175257592398477, 0.00041411013810003226, 0.0011066160274689546] and parameters: {'n_layers': 1, 'embedding_dim': 96, 'lr': 0.006870800117503575, 'lambda_val': 4.2886606921314005e-06, 'batch_size': 3994, 'optimizer': 'RMSprop'}.
2026-06-30 20:48:07,510 - experiment_functions - INFO - Early stopping at epoch 750. Best Metrics: (0.0017819766815642577, 0.0005347339627300876, 0.0012017695527480087)
2026-06-30 20:48:07,599 - optuna.study.study - INFO - Trial 268 finished with values: [0.0017819766815642577, 0.0005347339627300876, 0.0012017695527480087] and parameters: {'n_layers': 4, 'embedding_dim': 32, 'lr': 0.006717797853561655, 'lambda_val': 0.00016218839236180774, 'batch_size': 2156, 'optimizer': 'RMSprop'}.
2026-06-30 20:53:07,226 - optuna.study.study - INFO - Trial 269 finished with values: [0.0019475738233321101, 0.0004720475656782478, 0.0012738909714874868] and parameters: {'n_layers': 4, 'embedding_dim': 32, 'lr': 0.0006387010239111333, 'lambda_val': 0.0004278351533596911, 'batch_size': 591, 'optimizer': 'RMSprop'}.
2026-06-30 20:57:11,847 - experiment_functions - INFO - Early stopping at epoch 2350. Best Metrics: (0.002596202053760733, 0.0007693330547271242, 0.0017261126654335576)
2026-06-30 20:57:11,915 - optuna.study.study - INFO - Trial 270 finished with values: [0.002596202053760733, 0.0007693330547271242, 0.0017261126654335576] and parameters: {'n_layers': 4, 'embedding_dim': 256, 'lr': 0.00044843281655524526, 'lambda_val': 0.00020499046063986734, 'batch_size': 4084, 'optimizer': 'RMSprop'}.
2026-06-30 21:02:34,438 - optuna.study.study - INFO - Trial 271 finished with values: [0.002458830203492358, 0.0006952491309385864, 0.0016643336534929453] and parameters: {'n_layers': 3, 'embedding_dim': 96, 'lr': 0.0006387010239111333, 'lambda_val': 0.0008445896857268108, 'batch_size': 2170, 'optimizer': 'RMSprop'}.
2026-06-30 21:07:31,870 - optuna.study.study - INFO - Trial 272 finished with values: [0.002191888384095351, 0.0005508804589404099, 0.0013870885701295211] and parameters: {'n_layers': 3, 'embedding_dim': 32, 'lr': 0.0006387010239111333, 'lambda_val': 0.00135046939560172, 'batch_size': 2956, 'optimizer': 'Adam'}.
2026-06-30 21:08:36,034 - experiment_functions - INFO - Early stopping at epoch 750. Best Metrics: (0.0011945803927581814, 0.00038086735178466266, 0.0008588751036934605)
2026-06-30 21:08:36,106 - optuna.study.study - INFO - Trial 273 finished with values: [0.0011945803927581814, 0.00038086735178466266, 0.0008588751036934605] and parameters: {'n_layers': 3, 'embedding_dim': 96, 'lr': 0.013136572478451689, 'lambda_val': 0.0059381746506392595, 'batch_size': 3196, 'optimizer': 'RMSprop'}.
2026-06-30 21:09:37,906 - experiment_functions - INFO - Early stopping at epoch 600. Best Metrics: (0.002035977837372405, 0.0005993199475713771, 0.001405371698671943)
2026-06-30 21:09:38,001 - optuna.study.study - INFO - Trial 274 finished with values: [0.002035977837372405, 0.0005993199475713771, 0.001405371698671943] and parameters: {'n_layers': 3, 'embedding_dim': 256, 'lr': 0.004974098253366267, 'lambda_val': 0.00020499046063986734, 'batch_size': 2212, 'optimizer': 'RMSprop'}.
2026-06-30 21:10:38,726 - experiment_functions - INFO - Early stopping at epoch 550. Best Metrics: (0.0014336378243189193, 0.00043215622209980437, 0.0009490704447167663)
2026-06-30 21:10:38,805 - optuna.study.study - INFO - Trial 275 finished with values: [0.0014336378243189193, 0.00043215622209980437, 0.0009490704447167663] and parameters: {'n_layers': 4, 'embedding_dim': 256, 'lr': 0.004974098253366267, 'lambda_val': 0.021427809669417208, 'batch_size': 2368, 'optimizer': 'RMSprop'}.
2026-06-30 21:16:09,852 - experiment_functions - INFO - Early stopping at epoch 3200. Best Metrics: (0.0024828461388734075, 0.000727542123359231, 0.0016670481052700374)
2026-06-30 21:16:09,941 - optuna.study.study - INFO - Trial 276 finished with values: [0.0024828461388734075, 0.000727542123359231, 0.0016670481052700374] and parameters: {'n_layers': 4, 'embedding_dim': 256, 'lr': 0.00044843281655524526, 'lambda_val': 0.0006597683688978018, 'batch_size': 1897, 'optimizer': 'RMSprop'}.
