2026-07-05 04:56:06,925 - optuna.study.study - INFO - Trial 164 finished with values: [0.025463351675014814, 0.005514503352772447, 0.015387567973807133] and parameters: {'n_layers': 1, 'embedding_dim': 256, 'lr': 0.0028256479959556857, 'lambda_val': 9.719335288636405e-05, 'batch_size': 1931, 'optimizer': 'Adam'}.
2026-07-05 04:59:48,185 - experiment_functions - INFO - Early stopping at epoch 2850. Best Metrics: (0.003031026399092129, 0.0008871074976730051, 0.0018253719320517022)
2026-07-05 04:59:48,551 - optuna.study.study - INFO - Trial 165 finished with values: [0.003031026399092129, 0.0008871074976730051, 0.0018253719320517022] and parameters: {'n_layers': 1, 'embedding_dim': 64, 'lr': 0.004313984522769102, 'lambda_val': 0.08968482615361537, 'batch_size': 3814, 'optimizer': 'RMSprop'}.
2026-07-05 05:05:03,118 - optuna.study.study - INFO - Trial 166 finished with values: [0.018444650357328694, 0.004071766426685409, 0.010875907001015452] and parameters: {'n_layers': 1, 'embedding_dim': 64, 'lr': 0.004947459881909782, 'lambda_val': 2.3028734947350154e-05, 'batch_size': 1162, 'optimizer': 'RMSprop'}.
2026-07-05 05:13:23,805 - optuna.study.study - INFO - Trial 167 finished with values: [0.0118018447835296, 0.002677468989229338, 0.006959734897472391] and parameters: {'n_layers': 4, 'embedding_dim': 256, 'lr': 0.0032934455374620674, 'lambda_val': 1.4514407124820874e-06, 'batch_size': 1923, 'optimizer': 'Adam'}.
2026-07-05 05:18:57,788 - optuna.study.study - INFO - Trial 168 finished with values: [0.0168347666024242, 0.0036643048458484513, 0.01010929135709381] and parameters: {'n_layers': 1, 'embedding_dim': 128, 'lr': 0.008715315659881847, 'lambda_val': 0.0001483339453277888, 'batch_size': 3931, 'optimizer': 'Adam'}.
2026-07-05 05:24:05,447 - optuna.study.study - INFO - Trial 169 finished with values: [0.008121290867475171, 0.0020126132629219463, 0.004632909904470706] and parameters: {'n_layers': 2, 'embedding_dim': 32, 'lr': 0.01945737514319542, 'lambda_val': 0.0023013643954001, 'batch_size': 2251, 'optimizer': 'RMSprop'}.
2026-07-05 05:26:39,936 - experiment_functions - INFO - Early stopping at epoch 1900. Best Metrics: (0.010805643571945677, 0.0024134262864958307, 0.005987158816523017)
2026-07-05 05:26:40,033 - optuna.study.study - INFO - Trial 170 finished with values: [0.010805643571945677, 0.0024134262864958307, 0.005987158816523017] and parameters: {'n_layers': 4, 'embedding_dim': 32, 'lr': 0.003969600055009677, 'lambda_val': 2.9920385603702593e-06, 'batch_size': 2251, 'optimizer': 'Adam'}.
2026-07-05 05:29:39,420 - experiment_functions - INFO - Early stopping at epoch 2050. Best Metrics: (0.010730449658053467, 0.002425773607127253, 0.005951490073543279)
2026-07-05 05:29:39,507 - optuna.study.study - INFO - Trial 171 finished with values: [0.010730449658053467, 0.002425773607127253, 0.005951490073543279] and parameters: {'n_layers': 4, 'embedding_dim': 64, 'lr': 0.003969600055009677, 'lambda_val': 2.9920385603702593e-06, 'batch_size': 3323, 'optimizer': 'Adam'}.
2026-07-05 05:31:04,234 - experiment_functions - INFO - Early stopping at epoch 1050. Best Metrics: (0.014188720282054234, 0.0031362194403814375, 0.008406902496802494)
2026-07-05 05:31:04,319 - optuna.study.study - INFO - Trial 172 finished with values: [0.014188720282054234, 0.0031362194403814375, 0.008406902496802494] and parameters: {'n_layers': 2, 'embedding_dim': 32, 'lr': 0.005762844285462508, 'lambda_val': 1.4514407124820874e-06, 'batch_size': 3323, 'optimizer': 'Adam'}.
2026-07-05 05:38:42,608 - optuna.study.study - INFO - Trial 173 finished with values: [0.017806291848422084, 0.004013828999107194, 0.010561608693196804] and parameters: {'n_layers': 3, 'embedding_dim': 256, 'lr': 0.0009960690196132256, 'lambda_val': 1.1407948092996293e-06, 'batch_size': 1206, 'optimizer': 'Adam'}.
2026-07-05 05:44:08,228 - optuna.study.study - INFO - Trial 174 finished with values: [0.02384825256354134, 0.005340691070037803, 0.014402062978581128] and parameters: {'n_layers': 1, 'embedding_dim': 96, 'lr': 0.0016013137270230607, 'lambda_val': 2.9920385603702593e-06, 'batch_size': 2702, 'optimizer': 'RMSprop'}.
2026-07-05 05:45:08,918 - experiment_functions - INFO - Early stopping at epoch 700. Best Metrics: (0.00022334722282038138, 4.9389282525691926e-05, 0.00010904929552763018)
2026-07-05 05:45:09,008 - optuna.study.study - INFO - Trial 175 finished with values: [0.00022334722282038138, 4.9389282525691926e-05, 0.00010904929552763018] and parameters: {'n_layers': 1, 'embedding_dim': 128, 'lr': 0.00026877143655355183, 'lambda_val': 0.014413483629034015, 'batch_size': 2251, 'optimizer': 'Adam'}.
2026-07-05 05:53:30,647 - optuna.study.study - INFO - Trial 176 finished with values: [0.01572885573711142, 0.003689949281006021, 0.009420158343585667] and parameters: {'n_layers': 4, 'embedding_dim': 256, 'lr': 0.0003813853757363634, 'lambda_val': 4.969406458018728e-05, 'batch_size': 3907, 'optimizer': 'Adam'}.
2026-07-05 05:58:45,177 - optuna.study.study - INFO - Trial 177 finished with values: [0.02035779182765815, 0.004753718443097848, 0.012206233114817382] and parameters: {'n_layers': 1, 'embedding_dim': 64, 'lr': 0.0012203503451401305, 'lambda_val': 7.045045135561742e-06, 'batch_size': 3907, 'optimizer': 'RMSprop'}.
2026-07-05 06:04:57,093 - optuna.study.study - INFO - Trial 178 finished with values: [0.023087865211807456, 0.004902836084569649, 0.013631359902905961] and parameters: {'n_layers': 1, 'embedding_dim': 256, 'lr': 0.004313984522769102, 'lambda_val': 1.138243802328125e-05, 'batch_size': 1645, 'optimizer': 'RMSprop'}.
2026-07-05 06:09:29,146 - experiment_functions - INFO - Early stopping at epoch 3450. Best Metrics: (0.020796377279186616, 0.004464981099101496, 0.012111499647471834)
2026-07-05 06:09:29,239 - optuna.study.study - INFO - Trial 179 finished with values: [0.020796377279186616, 0.004464981099101496, 0.012111499647471834] and parameters: {'n_layers': 1, 'embedding_dim': 64, 'lr': 0.004947459881909782, 'lambda_val': 0.00032357419589914736, 'batch_size': 2864, 'optimizer': 'RMSprop'}.
2026-07-05 06:15:42,940 - optuna.study.study - INFO - Trial 180 finished with values: [0.0187093106468361, 0.004471629656364568, 0.011644767851160889] and parameters: {'n_layers': 1, 'embedding_dim': 256, 'lr': 0.0010295843799712518, 'lambda_val': 7.045045135561742e-06, 'batch_size': 2808, 'optimizer': 'Adam'}.
2026-07-05 06:16:27,855 - experiment_functions - INFO - Early stopping at epoch 500. Best Metrics: (0.00023647902399489456, 6.36361909465646e-05, 0.00012636054976833286)
2026-07-05 06:16:27,963 - optuna.study.study - INFO - Trial 181 finished with values: [0.00023647902399489456, 6.36361909465646e-05, 0.00012636054976833286] and parameters: {'n_layers': 3, 'embedding_dim': 64, 'lr': 0.01945737514319542, 'lambda_val': 1.8740162708106138e-06, 'batch_size': 2702, 'optimizer': 'SGD'}.
2026-07-05 06:24:02,943 - optuna.study.study - INFO - Trial 182 finished with values: [0.018084825975607757, 0.00403472446479114, 0.01069438803281211] and parameters: {'n_layers': 3, 'embedding_dim': 256, 'lr': 0.003969600055009677, 'lambda_val': 1.491644569541864e-06, 'batch_size': 887, 'optimizer': 'RMSprop'}.
2026-07-05 06:24:46,948 - experiment_functions - INFO - Early stopping at epoch 500. Best Metrics: (0.00023802020715079752, 6.0786809262390055e-05, 0.00013932435119190043)
2026-07-05 06:24:47,053 - optuna.study.study - INFO - Trial 183 finished with values: [0.00023802020715079752, 6.0786809262390055e-05, 0.00013932435119190043] and parameters: {'n_layers': 1, 'embedding_dim': 128, 'lr': 0.004947459881909782, 'lambda_val': 0.03757659178825819, 'batch_size': 2098, 'optimizer': 'SGD'}.
2026-07-05 06:25:51,640 - experiment_functions - INFO - Early stopping at epoch 800. Best Metrics: (0.0017670799194256554, 0.0004938928252569193, 0.0011202537446529544)
2026-07-05 06:25:51,731 - optuna.study.study - INFO - Trial 184 finished with values: [0.0017670799194256554, 0.0004938928252569193, 0.0011202537446529544] and parameters: {'n_layers': 1, 'embedding_dim': 64, 'lr': 0.08733620098966303, 'lambda_val': 7.045045135561742e-06, 'batch_size': 2864, 'optimizer': 'RMSprop'}.
2026-07-05 06:26:33,015 - experiment_functions - INFO - Early stopping at epoch 500. Best Metrics: (0.00017934541141611436, 5.033907642041677e-05, 0.00010754444592356081)
2026-07-05 06:26:33,135 - optuna.study.study - INFO - Trial 185 finished with values: [0.00017934541141611436, 5.033907642041677e-05, 0.00010754444592356081] and parameters: {'n_layers': 1, 'embedding_dim': 64, 'lr': 0.004313984522769102, 'lambda_val': 0.0003399124494485313, 'batch_size': 1645, 'optimizer': 'SGD'}.
2026-07-05 06:31:50,140 - experiment_functions - INFO - Early stopping at epoch 3950. Best Metrics: (0.013945986791088891, 0.003265391410064016, 0.008361407295214738)
2026-07-05 06:31:50,241 - optuna.study.study - INFO - Trial 186 finished with values: [0.013945986791088891, 0.003265391410064016, 0.008361407295214738] and parameters: {'n_layers': 1, 'embedding_dim': 96, 'lr': 0.010950652965873981, 'lambda_val': 2.0747113934570335e-06, 'batch_size': 1273, 'optimizer': 'RMSprop'}.
2026-07-05 06:34:56,136 - experiment_functions - INFO - Early stopping at epoch 2250. Best Metrics: (0.00020108295972277225, 6.268639705183976e-05, 0.00011891667548674964)
2026-07-05 06:34:56,225 - optuna.study.study - INFO - Trial 187 finished with values: [0.00020108295972277225, 6.268639705183976e-05, 0.00011891667548674964] and parameters: {'n_layers': 3, 'embedding_dim': 64, 'lr': 4.79651965415659e-05, 'lambda_val': 1.1487538529008038e-05, 'batch_size': 1923, 'optimizer': 'RMSprop'}.
2026-07-05 06:35:46,617 - experiment_functions - INFO - Early stopping at epoch 550. Best Metrics: (0.0030031549177723846, 0.0008272704823053398, 0.0019032418429364068)
2026-07-05 06:35:46,713 - optuna.study.study - INFO - Trial 188 finished with values: [0.0030031549177723846, 0.0008272704823053398, 0.0019032418429364068] and parameters: {'n_layers': 4, 'embedding_dim': 64, 'lr': 0.004313984522769102, 'lambda_val': 0.020768524897520953, 'batch_size': 1645, 'optimizer': 'RMSprop'}.
2026-07-05 06:41:20,192 - optuna.study.study - INFO - Trial 189 finished with values: [0.01024399277850245, 0.00232509545428642, 0.005949277375995251] and parameters: {'n_layers': 3, 'embedding_dim': 64, 'lr': 0.004313984522769102, 'lambda_val': 1.1407948092996293e-06, 'batch_size': 953, 'optimizer': 'Adam'}.
2026-07-05 06:47:56,351 - optuna.study.study - INFO - Trial 190 finished with values: [0.010544742387613427, 0.002367836179549038, 0.006038684583249684] and parameters: {'n_layers': 4, 'embedding_dim': 128, 'lr': 0.0028256479959556857, 'lambda_val': 4.969406458018728e-05, 'batch_size': 1645, 'optimizer': 'Adam'}.
2026-07-05 06:49:04,078 - experiment_functions - INFO - Early stopping at epoch 650. Best Metrics: (0.0067654479650895855, 0.0015985031248219137, 0.003995579572757231)
2026-07-05 06:49:04,164 - optuna.study.study - INFO - Trial 191 finished with values: [0.0067654479650895855, 0.0015985031248219137, 0.003995579572757231] and parameters: {'n_layers': 4, 'embedding_dim': 128, 'lr': 0.0032934455374620674, 'lambda_val': 0.0023013643954001, 'batch_size': 3931, 'optimizer': 'RMSprop'}.
2026-07-05 06:54:39,943 - optuna.study.study - INFO - Trial 192 finished with values: [0.017200173542521045, 0.0037735311437418085, 0.010158977325825129] and parameters: {'n_layers': 3, 'embedding_dim': 64, 'lr': 0.0015091555359142122, 'lambda_val': 7.045045135561742e-06, 'batch_size': 1931, 'optimizer': 'Adam'}.
2026-07-05 07:00:04,886 - optuna.study.study - INFO - Trial 193 finished with values: [0.022615112398667626, 0.005117489504777464, 0.013278367371216697] and parameters: {'n_layers': 1, 'embedding_dim': 96, 'lr': 0.0015091555359142122, 'lambda_val': 2.9920385603702593e-06, 'batch_size': 2702, 'optimizer': 'RMSprop'}.
2026-07-05 07:06:16,081 - optuna.study.study - INFO - Trial 194 finished with values: [0.023295850195179768, 0.005082347130672645, 0.013944927486456841] and parameters: {'n_layers': 1, 'embedding_dim': 256, 'lr': 0.0032934455374620674, 'lambda_val': 2.3028734947350154e-05, 'batch_size': 1171, 'optimizer': 'RMSprop'}.
2026-07-05 07:11:51,978 - optuna.study.study - INFO - Trial 195 finished with values: [0.015902997953775345, 0.0036861501054271223, 0.0095472889802687] and parameters: {'n_layers': 3, 'embedding_dim': 64, 'lr': 0.008715315659881847, 'lambda_val': 5.01869493536842e-05, 'batch_size': 549, 'optimizer': 'RMSprop'}.
2026-07-05 07:12:39,585 - experiment_functions - INFO - Early stopping at epoch 550. Best Metrics: (0.003321281328474094, 0.000783579963147997, 0.0020420691978694943)
2026-07-05 07:12:39,682 - optuna.study.study - INFO - Trial 196 finished with values: [0.003321281328474094, 0.000783579963147997, 0.0020420691978694943] and parameters: {'n_layers': 4, 'embedding_dim': 32, 'lr': 0.07167055366810839, 'lambda_val': 2.9920385603702593e-06, 'batch_size': 2864, 'optimizer': 'RMSprop'}.
2026-07-05 07:18:54,001 - optuna.study.study - INFO - Trial 197 finished with values: [0.027751792782112428, 0.0058564291548733926, 0.016273668191434797] and parameters: {'n_layers': 1, 'embedding_dim': 256, 'lr': 0.00314525224106882, 'lambda_val': 1.4514407124820874e-06, 'batch_size': 3907, 'optimizer': 'RMSprop'}.
2026-07-05 07:24:21,857 - optuna.study.study - INFO - Trial 198 finished with values: [0.007206922033650651, 0.001786562315977433, 0.004556203776990128] and parameters: {'n_layers': 1, 'embedding_dim': 128, 'lr': 0.01945737514319542, 'lambda_val': 1.1407948092996293e-06, 'batch_size': 2251, 'optimizer': 'RMSprop'}.
2026-07-05 07:25:06,684 - experiment_functions - INFO - Early stopping at epoch 500. Best Metrics: (0.00024333607981434023, 6.078680926239006e-05, 0.00014967131373126656)
2026-07-05 07:25:06,779 - optuna.study.study - INFO - Trial 199 finished with values: [0.00024333607981434023, 6.078680926239006e-05, 0.00014967131373126656] and parameters: {'n_layers': 2, 'embedding_dim': 96, 'lr': 0.0002995784397933112, 'lambda_val': 2.9920385603702593e-06, 'batch_size': 3718, 'optimizer': 'SGD'}.
2026-07-05 07:30:22,978 - optuna.study.study - INFO - Trial 200 finished with values: [0.020986458511012808, 0.00470907813004578, 0.012337326170720501] and parameters: {'n_layers': 1, 'embedding_dim': 64, 'lr': 0.004313984522769102, 'lambda_val': 7.045045135561742e-06, 'batch_size': 953, 'optimizer': 'Adam'}.
2026-07-05 07:35:38,446 - optuna.study.study - INFO - Trial 201 finished with values: [0.02068774192286478, 0.004730923389624451, 0.012318923793359336] and parameters: {'n_layers': 1, 'embedding_dim': 64, 'lr': 0.0015091555359142122, 'lambda_val': 2.9920385603702593e-06, 'batch_size': 2702, 'optimizer': 'RMSprop'}.
2026-07-05 07:41:13,173 - optuna.study.study - INFO - Trial 202 finished with values: [0.02372966361659353, 0.005338791482248352, 0.014316706963912759] and parameters: {'n_layers': 1, 'embedding_dim': 128, 'lr': 0.0017671653194099594, 'lambda_val': 2.7629412628671407e-05, 'batch_size': 2137, 'optimizer': 'RMSprop'}.
2026-07-05 07:43:45,513 - experiment_functions - INFO - Early stopping at epoch 1650. Best Metrics: (0.003361341568243839, 0.0007892787265163461, 0.0019106109558985529)
2026-07-05 07:43:45,618 - optuna.study.study - INFO - Trial 203 finished with values: [0.003361341568243839, 0.0007892787265163461, 0.0019106109558985529] and parameters: {'n_layers': 1, 'embedding_dim': 256, 'lr': 0.0032934455374620674, 'lambda_val': 0.06764078044788478, 'batch_size': 1171, 'optimizer': 'RMSprop'}.
2026-07-05 07:50:41,515 - optuna.study.study - INFO - Trial 204 finished with values: [0.014166406163900606, 0.003047888608172027, 0.00815744589434067] and parameters: {'n_layers': 2, 'embedding_dim': 256, 'lr': 0.012478838421164089, 'lambda_val': 0.0001946251736185544, 'batch_size': 2808, 'optimizer': 'Adam'}.
2026-07-05 07:56:13,535 - optuna.study.study - INFO - Trial 205 finished with values: [0.019112499806458686, 0.004560910282468704, 0.01159216547082487] and parameters: {'n_layers': 1, 'embedding_dim': 128, 'lr': 0.0012203503451401305, 'lambda_val': 0.00032357419589914736, 'batch_size': 2303, 'optimizer': 'RMSprop'}.
2026-07-05 07:56:56,642 - experiment_functions - INFO - Early stopping at epoch 500. Best Metrics: (0.00027448529300232795, 6.648557263073914e-05, 0.00014690877907828752)
2026-07-05 07:56:56,739 - optuna.study.study - INFO - Trial 206 finished with values: [0.00027448529300232795, 6.648557263073914e-05, 0.00014690877907828752] and parameters: {'n_layers': 1, 'embedding_dim': 96, 'lr': 0.004947459881909782, 'lambda_val': 2.3028734947350154e-05, 'batch_size': 2251, 'optimizer': 'SGD'}.
2026-07-05 08:05:14,352 - optuna.study.study - INFO - Trial 207 finished with values: [0.01584220657060425, 0.00360731721216496, 0.009384662284424125] and parameters: {'n_layers': 4, 'embedding_dim': 256, 'lr': 0.0035795282949111907, 'lambda_val': 4.331327481478862e-06, 'batch_size': 1171, 'optimizer': 'RMSprop'}.
2026-07-05 08:10:38,323 - optuna.study.study - INFO - Trial 208 finished with values: [0.021955738799164307, 0.004848697832570332, 0.012949892929745056] and parameters: {'n_layers': 1, 'embedding_dim': 96, 'lr': 0.00314525224106882, 'lambda_val': 1.4514407124820874e-06, 'batch_size': 1544, 'optimizer': 'RMSprop'}.
2026-07-05 08:18:15,155 - optuna.study.study - INFO - Trial 209 finished with values: [0.014169360044279046, 0.003100127272381893, 0.008091046564296581] and parameters: {'n_layers': 3, 'embedding_dim': 256, 'lr': 0.0015303911096150708, 'lambda_val': 0.00032357419589914736, 'batch_size': 1206, 'optimizer': 'Adam'}.
2026-07-05 08:23:48,501 - optuna.study.study - INFO - Trial 210 finished with values: [0.015524570795288104, 0.0034183082271147165, 0.009176280587495896] and parameters: {'n_layers': 1, 'embedding_dim': 128, 'lr': 0.008715315659881847, 'lambda_val': 2.3028734947350154e-05, 'batch_size': 1162, 'optimizer': 'Adam'}.
2026-07-05 08:29:55,682 - optuna.study.study - INFO - Trial 211 finished with values: [0.0036978359004098934, 0.0009507436886195697, 0.002309807203307262] and parameters: {'n_layers': 1, 'embedding_dim': 256, 'lr': 0.0003813853757363634, 'lambda_val': 4.969406458018728e-05, 'batch_size': 3907, 'optimizer': 'Adam'}.
2026-07-05 08:36:09,426 - optuna.study.study - INFO - Trial 212 finished with values: [0.009907209429386605, 0.00226620823281348, 0.0057773590627478895] and parameters: {'n_layers': 3, 'embedding_dim': 128, 'lr': 0.0032934455374620674, 'lambda_val': 4.331327481478862e-06, 'batch_size': 887, 'optimizer': 'Adam'}.
2026-07-05 08:36:58,215 - experiment_functions - INFO - Early stopping at epoch 500. Best Metrics: (0.0002444824683914749, 6.17366031571149e-05, 0.00012977525541988733)
2026-07-05 08:36:58,297 - optuna.study.study - INFO - Trial 213 finished with values: [0.0002444824683914749, 6.17366031571149e-05, 0.00012977525541988733] and parameters: {'n_layers': 1, 'embedding_dim': 256, 'lr': 0.009245302928338509, 'lambda_val': 0.0001483339453277888, 'batch_size': 2685, 'optimizer': 'SGD'}.
2026-07-05 08:43:09,510 - optuna.study.study - INFO - Trial 214 finished with values: [0.023242895045436477, 0.005028208878673328, 0.013784233057450546] and parameters: {'n_layers': 1, 'embedding_dim': 256, 'lr': 0.0028256479959556857, 'lambda_val': 2.3028734947350154e-05, 'batch_size': 1171, 'optimizer': 'RMSprop'}.
2026-07-05 08:47:12,283 - experiment_functions - INFO - Early stopping at epoch 2300. Best Metrics: (0.022754693674914426, 0.0049560245426742405, 0.013264710133373155)
2026-07-05 08:47:12,381 - optuna.study.study - INFO - Trial 215 finished with values: [0.022754693674914426, 0.0049560245426742405, 0.013264710133373155] and parameters: {'n_layers': 2, 'embedding_dim': 256, 'lr': 0.0017671653194099594, 'lambda_val': 7.045045135561742e-06, 'batch_size': 3907, 'optimizer': 'Adam'}.
2026-07-05 08:47:58,166 - experiment_functions - INFO - Early stopping at epoch 550. Best Metrics: (0.004963032495384175, 0.0012670250555629429, 0.0030728462020514335)
2026-07-05 08:47:58,518 - optuna.study.study - INFO - Trial 216 finished with values: [0.004963032495384175, 0.0012670250555629429, 0.0030728462020514335] and parameters: {'n_layers': 2, 'embedding_dim': 32, 'lr': 0.036147299898651244, 'lambda_val': 0.005237614575624684, 'batch_size': 2137, 'optimizer': 'Adam'}.
2026-07-05 08:56:19,796 - optuna.study.study - INFO - Trial 217 finished with values: [0.01179807110414049, 0.0026261801189141954, 0.006849467764104092] and parameters: {'n_layers': 4, 'embedding_dim': 256, 'lr': 0.003969600055009677, 'lambda_val': 1.491644569541864e-06, 'batch_size': 2666, 'optimizer': 'Adam'}.
2026-07-05 08:57:13,715 - experiment_functions - INFO - Early stopping at epoch 550. Best Metrics: (0.0016515316534693866, 0.0004416541610470528, 0.0010564643458151064)
2026-07-05 08:57:13,805 - optuna.study.study - INFO - Trial 218 finished with values: [0.0016515316534693866, 0.0004416541610470528, 0.0010564643458151064] and parameters: {'n_layers': 1, 'embedding_dim': 256, 'lr': 0.0465364147420131, 'lambda_val': 0.00032357419589914736, 'batch_size': 2864, 'optimizer': 'RMSprop'}.
2026-07-05 09:02:39,376 - optuna.study.study - INFO - Trial 219 finished with values: [0.01872569242280312, 0.0042778717018407, 0.011246326428190607] and parameters: {'n_layers': 2, 'embedding_dim': 64, 'lr': 0.0009960690196132256, 'lambda_val': 7.045045135561742e-06, 'batch_size': 3907, 'optimizer': 'RMSprop'}.
2026-07-05 09:07:55,460 - optuna.study.study - INFO - Trial 220 finished with values: [0.021820535076337643, 0.004897137321201299, 0.012857473391510665] and parameters: {'n_layers': 1, 'embedding_dim': 64, 'lr': 0.0028256479959556857, 'lambda_val': 3.959696507549483e-06, 'batch_size': 1645, 'optimizer': 'Adam'}.
