2026-07-02 03:52:11,011 - optuna.study.study - INFO - Trial 83 finished with values: [0.0002350378671746242, 5.413825199931616e-05, 0.0001248597639147426] and parameters: {'n_layers': 4, 'embedding_dim': 32, 'lr': 0.01321022891213974, 'lambda_val': 0.00010877216929113007, 'batch_size': 3621, 'optimizer': 'SGD'}.
2026-07-02 03:54:26,174 - experiment_functions - INFO - Early stopping at epoch 1700. Best Metrics: (0.0013887491465064275, 0.00044735292441540185, 0.0009775857193093697)
2026-07-02 03:54:26,264 - optuna.study.study - INFO - Trial 84 finished with values: [0.0013887491465064275, 0.00044735292441540185, 0.0009775857193093697] and parameters: {'n_layers': 1, 'embedding_dim': 128, 'lr': 0.005014370880052961, 'lambda_val': 0.011356721163774775, 'batch_size': 1473, 'optimizer': 'RMSprop'}.
2026-07-02 03:55:13,007 - experiment_functions - INFO - Early stopping at epoch 500. Best Metrics: (0.0002580123045299616, 5.128887031514162e-05, 0.00014180708364333185)
2026-07-02 03:55:13,094 - optuna.study.study - INFO - Trial 85 finished with values: [0.0002580123045299616, 5.128887031514162e-05, 0.00014180708364333185] and parameters: {'n_layers': 4, 'embedding_dim': 128, 'lr': 0.006423009501763469, 'lambda_val': 2.9372864907090347e-05, 'batch_size': 1550, 'optimizer': 'SGD'}.
2026-07-02 03:55:54,798 - experiment_functions - INFO - Early stopping at epoch 500. Best Metrics: (0.00018526057837126115, 5.603783978876584e-05, 0.0001112921702851255)
2026-07-02 03:55:54,879 - optuna.study.study - INFO - Trial 86 finished with values: [0.00018526057837126115, 5.603783978876584e-05, 0.0001112921702851255] and parameters: {'n_layers': 1, 'embedding_dim': 96, 'lr': 0.0028258902906977677, 'lambda_val': 0.0022981549063997245, 'batch_size': 1336, 'optimizer': 'SGD'}.
2026-07-02 03:56:39,662 - experiment_functions - INFO - Early stopping at epoch 550. Best Metrics: (0.00096479263038681, 0.00024789620652318446, 0.0006414334170367276)
2026-07-02 03:56:39,745 - optuna.study.study - INFO - Trial 87 finished with values: [0.00096479263038681, 0.00024789620652318446, 0.0006414334170367276] and parameters: {'n_layers': 1, 'embedding_dim': 64, 'lr': 0.06668313223783916, 'lambda_val': 2.9969303918440104e-05, 'batch_size': 3308, 'optimizer': 'Adam'}.
2026-07-02 03:57:22,616 - experiment_functions - INFO - Early stopping at epoch 500. Best Metrics: (0.0002588647072620861, 6.838516042018881e-05, 0.00015413533753521938)
2026-07-02 03:57:22,719 - optuna.study.study - INFO - Trial 88 finished with values: [0.0002588647072620861, 6.838516042018881e-05, 0.00015413533753521938] and parameters: {'n_layers': 4, 'embedding_dim': 64, 'lr': 3.5061153766401395e-05, 'lambda_val': 2.079258642930449e-06, 'batch_size': 1923, 'optimizer': 'SGD'}.
2026-07-02 03:58:09,109 - experiment_functions - INFO - Early stopping at epoch 550. Best Metrics: (0.0006242042007223182, 0.0001757118705240963, 0.00042307505867468476)
2026-07-02 03:58:09,192 - optuna.study.study - INFO - Trial 89 finished with values: [0.0006242042007223182, 0.0001757118705240963, 0.00042307505867468476] and parameters: {'n_layers': 3, 'embedding_dim': 64, 'lr': 0.05486910650870985, 'lambda_val': 0.008265752694310466, 'batch_size': 1094, 'optimizer': 'Adam'}.
2026-07-02 04:01:16,227 - experiment_functions - INFO - Early stopping at epoch 2000. Best Metrics: (0.001127524115294494, 0.0003818171456793876, 0.0008013594797796951)
2026-07-02 04:01:16,313 - optuna.study.study - INFO - Trial 90 finished with values: [0.001127524115294494, 0.0003818171456793876, 0.0008013594797796951] and parameters: {'n_layers': 2, 'embedding_dim': 256, 'lr': 0.07137537182714382, 'lambda_val': 0.0132654287745143, 'batch_size': 3579, 'optimizer': 'Adam'}.
2026-07-02 04:01:57,075 - experiment_functions - INFO - Early stopping at epoch 500. Best Metrics: (0.0002802142040944484, 6.838516042018881e-05, 0.00016923637626245817)
2026-07-02 04:01:57,183 - optuna.study.study - INFO - Trial 91 finished with values: [0.0002802142040944484, 6.838516042018881e-05, 0.00016923637626245817] and parameters: {'n_layers': 3, 'embedding_dim': 32, 'lr': 0.00010899306073745633, 'lambda_val': 2.079258642930449e-06, 'batch_size': 2783, 'optimizer': 'SGD'}.
2026-07-02 04:07:08,757 - optuna.study.study - INFO - Trial 92 finished with values: [0.0004219639445988764, 0.00010637691620918262, 0.000261270583450934] and parameters: {'n_layers': 1, 'embedding_dim': 128, 'lr': 0.00012596460191365054, 'lambda_val': 0.00024499244831156216, 'batch_size': 3470, 'optimizer': 'RMSprop'}.
2026-07-02 04:07:55,466 - experiment_functions - INFO - Early stopping at epoch 500. Best Metrics: (0.0002933472101771411, 6.078680926239008e-05, 0.00014499977664194627)
2026-07-02 04:07:55,560 - optuna.study.study - INFO - Trial 93 finished with values: [0.0002933472101771411, 6.078680926239008e-05, 0.00014499977664194627] and parameters: {'n_layers': 4, 'embedding_dim': 128, 'lr': 0.006423009501763469, 'lambda_val': 2.9372864907090347e-05, 'batch_size': 1550, 'optimizer': 'SGD'}.
2026-07-02 04:10:00,821 - experiment_functions - INFO - Early stopping at epoch 1550. Best Metrics: (0.0012318179579845776, 0.0004046121991527839, 0.0008638596614818848)
2026-07-02 04:10:00,944 - optuna.study.study - INFO - Trial 94 finished with values: [0.0012318179579845776, 0.0004046121991527839, 0.0008638596614818848] and parameters: {'n_layers': 2, 'embedding_dim': 96, 'lr': 0.05486910650870985, 'lambda_val': 0.008265752694310466, 'batch_size': 2880, 'optimizer': 'Adam'}.
2026-07-02 04:14:32,383 - experiment_functions - INFO - Early stopping at epoch 3550. Best Metrics: (0.00025794687173297503, 6.553577873601429e-05, 0.0001526473359674307)
2026-07-02 04:14:32,462 - optuna.study.study - INFO - Trial 95 finished with values: [0.00025794687173297503, 6.553577873601429e-05, 0.0001526473359674307] and parameters: {'n_layers': 1, 'embedding_dim': 96, 'lr': 0.00012596460191365054, 'lambda_val': 0.0007404864260870633, 'batch_size': 855, 'optimizer': 'Adam'}.
2026-07-02 04:15:19,253 - experiment_functions - INFO - Early stopping at epoch 500. Best Metrics: (0.00021722668543932473, 6.268639705183975e-05, 0.00012920808904699305)
2026-07-02 04:15:19,332 - optuna.study.study - INFO - Trial 96 finished with values: [0.00021722668543932473, 6.268639705183975e-05, 0.00012920808904699305] and parameters: {'n_layers': 4, 'embedding_dim': 128, 'lr': 0.00012596460191365054, 'lambda_val': 2.8736044863125995e-05, 'batch_size': 2852, 'optimizer': 'SGD'}.
2026-07-02 04:16:05,039 - experiment_functions - INFO - Early stopping at epoch 500. Best Metrics: (0.00022684854031933849, 6.458598484128944e-05, 0.00012241183259067146)
2026-07-02 04:16:05,116 - optuna.study.study - INFO - Trial 97 finished with values: [0.00022684854031933849, 6.458598484128944e-05, 0.00012241183259067146] and parameters: {'n_layers': 1, 'embedding_dim': 256, 'lr': 4.306000179903948e-05, 'lambda_val': 0.015248414860902306, 'batch_size': 2066, 'optimizer': 'SGD'}.
2026-07-02 04:16:46,516 - experiment_functions - INFO - Early stopping at epoch 500. Best Metrics: (0.0002192856466334156, 6.743536652546399e-05, 0.00014201783841398874)
2026-07-02 04:16:46,623 - optuna.study.study - INFO - Trial 98 finished with values: [0.0002192856466334156, 6.743536652546399e-05, 0.00014201783841398874] and parameters: {'n_layers': 1, 'embedding_dim': 96, 'lr': 0.0008372445612620814, 'lambda_val': 0.006710596703232843, 'batch_size': 2066, 'optimizer': 'SGD'}.
2026-07-02 04:21:23,376 - experiment_functions - INFO - Early stopping at epoch 3750. Best Metrics: (0.0009056626192284712, 0.00030108466462777574, 0.0006461799583560305)
2026-07-02 04:21:23,463 - optuna.study.study - INFO - Trial 99 finished with values: [0.0009056626192284712, 0.00030108466462777574, 0.0006461799583560305] and parameters: {'n_layers': 2, 'embedding_dim': 32, 'lr': 0.002399062123093389, 'lambda_val': 0.08701027942844691, 'batch_size': 1093, 'optimizer': 'RMSprop'}.
2026-07-02 04:22:47,736 - experiment_functions - INFO - Early stopping at epoch 1000. Best Metrics: (0.000908496578009066, 0.0002830385806280038, 0.0006400688291420935)
2026-07-02 04:22:47,820 - optuna.study.study - INFO - Trial 100 finished with values: [0.000908496578009066, 0.0002830385806280038, 0.0006400688291420935] and parameters: {'n_layers': 2, 'embedding_dim': 128, 'lr': 0.05486910650870985, 'lambda_val': 0.035063843860833145, 'batch_size': 3027, 'optimizer': 'RMSprop'}.
2026-07-02 04:23:28,152 - experiment_functions - INFO - Early stopping at epoch 500. Best Metrics: (0.00021005389484897444, 5.603783978876584e-05, 0.00011608661146458052)
2026-07-02 04:23:28,242 - optuna.study.study - INFO - Trial 101 finished with values: [0.00021005389484897444, 5.603783978876584e-05, 0.00011608661146458052] and parameters: {'n_layers': 1, 'embedding_dim': 32, 'lr': 0.06668313223783916, 'lambda_val': 1.5990539279825177e-06, 'batch_size': 3308, 'optimizer': 'SGD'}.
2026-07-02 04:24:59,013 - experiment_functions - INFO - Early stopping at epoch 1000. Best Metrics: (0.0026627693452412073, 0.0007845297570427218, 0.0018502330308773198)
2026-07-02 04:24:59,085 - optuna.study.study - INFO - Trial 102 finished with values: [0.0026627693452412073, 0.0007845297570427218, 0.0018502330308773198] and parameters: {'n_layers': 4, 'embedding_dim': 128, 'lr': 0.0014374939555211086, 'lambda_val': 2.188289071859108e-05, 'batch_size': 2754, 'optimizer': 'RMSprop'}.
2026-07-02 04:30:04,764 - optuna.study.study - INFO - Trial 103 finished with values: [0.0016983364260647026, 0.0003827669395741125, 0.0010583056091189895] and parameters: {'n_layers': 1, 'embedding_dim': 96, 'lr': 0.00042777516068918454, 'lambda_val': 0.00031903142585685315, 'batch_size': 3462, 'optimizer': 'RMSprop'}.
2026-07-02 04:30:47,583 - experiment_functions - INFO - Early stopping at epoch 500. Best Metrics: (0.00022975514612301267, 5.698763368349069e-05, 0.0001238295928229892)
2026-07-02 04:30:47,664 - optuna.study.study - INFO - Trial 104 finished with values: [0.00022975514612301267, 5.698763368349069e-05, 0.0001238295928229892] and parameters: {'n_layers': 4, 'embedding_dim': 64, 'lr': 0.023233384256700264, 'lambda_val': 0.00010191497823375508, 'batch_size': 1201, 'optimizer': 'SGD'}.
2026-07-02 04:31:33,203 - experiment_functions - INFO - Early stopping at epoch 500. Best Metrics: (0.0002094484117075342, 5.128887031514162e-05, 0.00013181184036012552)
2026-07-02 04:31:33,277 - optuna.study.study - INFO - Trial 105 finished with values: [0.0002094484117075342, 5.128887031514162e-05, 0.00013181184036012552] and parameters: {'n_layers': 3, 'embedding_dim': 128, 'lr': 2.018314016056023e-05, 'lambda_val': 0.0006325039773618912, 'batch_size': 2610, 'optimizer': 'SGD'}.
2026-07-02 04:34:28,832 - experiment_functions - INFO - Early stopping at epoch 2200. Best Metrics: (0.0011169553695074112, 0.00038846570294246156, 0.0007747643963352606)
2026-07-02 04:34:28,915 - optuna.study.study - INFO - Trial 106 finished with values: [0.0011169553695074112, 0.00038846570294246156, 0.0007747643963352606] and parameters: {'n_layers': 2, 'embedding_dim': 96, 'lr': 0.07137537182714382, 'lambda_val': 0.0132654287745143, 'batch_size': 3749, 'optimizer': 'Adam'}.
2026-07-02 04:35:20,368 - experiment_functions - INFO - Early stopping at epoch 600. Best Metrics: (0.0019831058314704175, 0.0005375833444142622, 0.0013714168566844303)
2026-07-02 04:35:20,444 - optuna.study.study - INFO - Trial 107 finished with values: [0.0019831058314704175, 0.0005375833444142622, 0.0013714168566844303] and parameters: {'n_layers': 4, 'embedding_dim': 64, 'lr': 0.012943330980207375, 'lambda_val': 5.9712928804209935e-06, 'batch_size': 2302, 'optimizer': 'Adam'}.
2026-07-02 04:36:12,159 - experiment_functions - INFO - Early stopping at epoch 550. Best Metrics: (0.0015797381478633275, 0.00047679653515187207, 0.0010251363529989825)
2026-07-02 04:36:12,241 - optuna.study.study - INFO - Trial 108 finished with values: [0.0015797381478633275, 0.00047679653515187207, 0.0010251363529989825] and parameters: {'n_layers': 4, 'embedding_dim': 128, 'lr': 0.005014370880052961, 'lambda_val': 0.011356721163774775, 'batch_size': 1285, 'optimizer': 'RMSprop'}.
2026-07-02 04:36:59,122 - experiment_functions - INFO - Early stopping at epoch 500. Best Metrics: (0.000292633652811185, 6.458598484128944e-05, 0.0001418332350587699)
2026-07-02 04:36:59,199 - optuna.study.study - INFO - Trial 109 finished with values: [0.000292633652811185, 6.458598484128944e-05, 0.0001418332350587699] and parameters: {'n_layers': 4, 'embedding_dim': 128, 'lr': 0.003175598950751376, 'lambda_val': 0.00024499244831156216, 'batch_size': 3579, 'optimizer': 'SGD'}.
2026-07-02 04:39:15,574 - experiment_functions - INFO - Early stopping at epoch 1700. Best Metrics: (0.0017554041196490178, 0.00044355374883650253, 0.001187869941007746)
2026-07-02 04:39:16,538 - optuna.study.study - INFO - Trial 110 finished with values: [0.0017554041196490178, 0.00044355374883650253, 0.001187869941007746] and parameters: {'n_layers': 1, 'embedding_dim': 128, 'lr': 0.002187649930388769, 'lambda_val': 0.00010877216929113007, 'batch_size': 3308, 'optimizer': 'Adam'}.
2026-07-02 04:41:20,968 - experiment_functions - INFO - Early stopping at epoch 1550. Best Metrics: (0.00143484766325824, 0.0004426039549417777, 0.0009801077965639526)
2026-07-02 04:41:21,061 - optuna.study.study - INFO - Trial 111 finished with values: [0.00143484766325824, 0.0004426039549417777, 0.0009801077965639526] and parameters: {'n_layers': 1, 'embedding_dim': 128, 'lr': 0.005014370880052961, 'lambda_val': 0.011356721163774775, 'batch_size': 3443, 'optimizer': 'Adam'}.
2026-07-02 04:42:22,181 - experiment_functions - INFO - Early stopping at epoch 750. Best Metrics: (0.00163698168497895, 0.0004293068404156299, 0.0010891747446161678)
2026-07-02 04:42:22,258 - optuna.study.study - INFO - Trial 112 finished with values: [0.00163698168497895, 0.0004293068404156299, 0.0010891747446161678] and parameters: {'n_layers': 2, 'embedding_dim': 64, 'lr': 0.004152271479480873, 'lambda_val': 0.0006325039773618912, 'batch_size': 3842, 'optimizer': 'Adam'}.
2026-07-02 04:48:30,290 - optuna.study.study - INFO - Trial 113 finished with values: [0.0017342628502676517, 0.00045590106946792554, 0.001165120098949573] and parameters: {'n_layers': 2, 'embedding_dim': 256, 'lr': 0.00042777516068918454, 'lambda_val': 0.0006325039773618912, 'batch_size': 3579, 'optimizer': 'Adam'}.
2026-07-02 04:52:11,222 - experiment_functions - INFO - Early stopping at epoch 3000. Best Metrics: (0.0010916054950511462, 0.00026689208441768136, 0.0006951753710319859)
2026-07-02 04:52:11,322 - optuna.study.study - INFO - Trial 114 finished with values: [0.0010916054950511462, 0.00026689208441768136, 0.0006951753710319859] and parameters: {'n_layers': 1, 'embedding_dim': 64, 'lr': 0.000567234027981187, 'lambda_val': 0.01586888242047408, 'batch_size': 3308, 'optimizer': 'RMSprop'}.
2026-07-02 04:52:51,226 - experiment_functions - INFO - Early stopping at epoch 500. Best Metrics: (0.0001995429083143879, 4.369051915734285e-05, 9.786292200230929e-05)
2026-07-02 04:52:51,619 - optuna.study.study - INFO - Trial 115 finished with values: [0.0001995429083143879, 4.369051915734285e-05, 9.786292200230929e-05] and parameters: {'n_layers': 2, 'embedding_dim': 32, 'lr': 0.0005054275041431983, 'lambda_val': 6.947273812568026e-05, 'batch_size': 2547, 'optimizer': 'SGD'}.
2026-07-02 04:53:31,099 - experiment_functions - INFO - Early stopping at epoch 500. Best Metrics: (0.00023143840345759775, 5.698763368349069e-05, 0.0001416252155240943)
2026-07-02 04:53:31,175 - optuna.study.study - INFO - Trial 116 finished with values: [0.00023143840345759775, 5.698763368349069e-05, 0.0001416252155240943] and parameters: {'n_layers': 2, 'embedding_dim': 32, 'lr': 0.00011391053126125925, 'lambda_val': 1.3509843414861852e-06, 'batch_size': 2547, 'optimizer': 'SGD'}.
2026-07-02 04:57:24,791 - experiment_functions - INFO - Early stopping at epoch 3150. Best Metrics: (0.0012643663295794387, 0.0004312064282050795, 0.0009136515166796373)
2026-07-02 04:57:24,889 - optuna.study.study - INFO - Trial 117 finished with values: [0.0012643663295794387, 0.0004312064282050795, 0.0009136515166796373] and parameters: {'n_layers': 1, 'embedding_dim': 64, 'lr': 0.03153530615030484, 'lambda_val': 0.016909081027786498, 'batch_size': 1298, 'optimizer': 'Adam'}.
2026-07-02 04:58:14,091 - experiment_functions - INFO - Early stopping at epoch 550. Best Metrics: (0.0018367843207528988, 0.0005404327260984367, 0.0012785260873003374)
2026-07-02 04:58:14,165 - optuna.study.study - INFO - Trial 118 finished with values: [0.0018367843207528988, 0.0005404327260984367, 0.0012785260873003374] and parameters: {'n_layers': 4, 'embedding_dim': 96, 'lr': 0.014582350289404945, 'lambda_val': 1.8310592897560325e-05, 'batch_size': 3308, 'optimizer': 'RMSprop'}.
2026-07-02 04:59:07,994 - experiment_functions - INFO - Early stopping at epoch 650. Best Metrics: (0.0019305863443030368, 0.0005024409703094429, 0.0013187269021895697)
2026-07-02 04:59:08,077 - optuna.study.study - INFO - Trial 119 finished with values: [0.0019305863443030368, 0.0005024409703094429, 0.0013187269021895697] and parameters: {'n_layers': 3, 'embedding_dim': 64, 'lr': 0.01321022891213974, 'lambda_val': 0.00010877216929113007, 'batch_size': 3798, 'optimizer': 'Adam'}.
2026-07-02 05:03:57,734 - optuna.study.study - INFO - Trial 120 finished with values: [0.0011433074938259407, 0.00027544022947020494, 0.0007383263482601672] and parameters: {'n_layers': 1, 'embedding_dim': 32, 'lr': 0.0005054275041431983, 'lambda_val': 0.01586888242047408, 'batch_size': 2547, 'optimizer': 'Adam'}.
2026-07-02 05:09:01,098 - optuna.study.study - INFO - Trial 121 finished with values: [0.0013382399492699861, 0.00030868301578557453, 0.0008125728393417269] and parameters: {'n_layers': 1, 'embedding_dim': 96, 'lr': 0.00042777516068918454, 'lambda_val': 0.00031903142585685315, 'batch_size': 2073, 'optimizer': 'Adam'}.
2026-07-02 05:09:43,198 - experiment_functions - INFO - Early stopping at epoch 500. Best Metrics: (0.00022930440475629524, 6.268639705183975e-05, 0.000140747926968727)
2026-07-02 05:09:43,314 - optuna.study.study - INFO - Trial 122 finished with values: [0.00022930440475629524, 6.268639705183975e-05, 0.000140747926968727] and parameters: {'n_layers': 1, 'embedding_dim': 128, 'lr': 0.040943052425008536, 'lambda_val': 0.002381540326363519, 'batch_size': 2305, 'optimizer': 'SGD'}.
2026-07-02 05:14:45,117 - optuna.study.study - INFO - Trial 123 finished with values: [0.0016997848315986322, 0.0004264574587314553, 0.001161394345975497] and parameters: {'n_layers': 2, 'embedding_dim': 64, 'lr': 0.0005054275041431983, 'lambda_val': 1.3509843414861852e-06, 'batch_size': 2519, 'optimizer': 'RMSprop'}.
2026-07-02 05:17:26,153 - experiment_functions - INFO - Early stopping at epoch 2150. Best Metrics: (0.0012752062140863963, 0.00041505993199475715, 0.0009142083624958863)
2026-07-02 05:17:26,259 - optuna.study.study - INFO - Trial 124 finished with values: [0.0012752062140863963, 0.00041505993199475715, 0.0009142083624958863] and parameters: {'n_layers': 1, 'embedding_dim': 64, 'lr': 0.06668313223783916, 'lambda_val': 0.0006325039773618912, 'batch_size': 3308, 'optimizer': 'RMSprop'}.
2026-07-02 05:20:35,743 - experiment_functions - INFO - Early stopping at epoch 1800. Best Metrics: (0.001058278423218099, 0.00037231920673213914, 0.0007620396547714533)
2026-07-02 05:20:36,329 - optuna.study.study - INFO - Trial 125 finished with values: [0.001058278423218099, 0.00037231920673213914, 0.0007620396547714533] and parameters: {'n_layers': 4, 'embedding_dim': 256, 'lr': 0.07137537182714382, 'lambda_val': 0.0132654287745143, 'batch_size': 3579, 'optimizer': 'Adam'}.
2026-07-02 05:21:27,411 - experiment_functions - INFO - Early stopping at epoch 550. Best Metrics: (0.0011480724577415259, 0.0003276788936800715, 0.0008687545471445404)
2026-07-02 05:21:27,481 - optuna.study.study - INFO - Trial 126 finished with values: [0.0011480724577415259, 0.0003276788936800715, 0.0008687545471445404] and parameters: {'n_layers': 1, 'embedding_dim': 256, 'lr': 0.056177353679575485, 'lambda_val': 3.003513281700426e-05, 'batch_size': 3798, 'optimizer': 'Adam'}.
2026-07-02 05:22:41,120 - experiment_functions - INFO - Early stopping at epoch 850. Best Metrics: (0.002628205826004527, 0.0007531865585168018, 0.0017515861215579283)
2026-07-02 05:22:41,204 - optuna.study.study - INFO - Trial 127 finished with values: [0.002628205826004527, 0.0007531865585168018, 0.0017515861215579283] and parameters: {'n_layers': 4, 'embedding_dim': 96, 'lr': 0.0028258902906977677, 'lambda_val': 1.0477656620736208e-06, 'batch_size': 3749, 'optimizer': 'RMSprop'}.
2026-07-02 05:23:30,104 - experiment_functions - INFO - Early stopping at epoch 550. Best Metrics: (0.0002864079488221274, 7.028474820963851e-05, 0.00015564236081547542)
2026-07-02 05:23:30,206 - optuna.study.study - INFO - Trial 128 finished with values: [0.0002864079488221274, 7.028474820963851e-05, 0.00015564236081547542] and parameters: {'n_layers': 4, 'embedding_dim': 96, 'lr': 2.348530881824708e-05, 'lambda_val': 1.0477656620736208e-06, 'batch_size': 3749, 'optimizer': 'RMSprop'}.
2026-07-02 05:24:21,874 - experiment_functions - INFO - Early stopping at epoch 550. Best Metrics: (0.0013825416238874677, 0.00042075869536310626, 0.000982867147898077)
2026-07-02 05:24:21,982 - optuna.study.study - INFO - Trial 129 finished with values: [0.0013825416238874677, 0.00042075869536310626, 0.000982867147898077] and parameters: {'n_layers': 4, 'embedding_dim': 128, 'lr': 0.014582350289404945, 'lambda_val': 0.011356721163774775, 'batch_size': 3749, 'optimizer': 'Adam'}.
2026-07-02 05:25:54,151 - experiment_functions - INFO - Early stopping at epoch 1150. Best Metrics: (0.001268299218416709, 0.0003390764204167696, 0.0008804519130397207)
