2026-07-08 09:43:26,017 - optuna.study.study - INFO - Trial 204 finished with values: [0.0022154024952081046, 0.0008405675968314875, 0.0015141244322569064] and parameters: {'n_layers': 2, 'embedding_dim': 128, 'lr': 0.0011108364748811956, 'lambda_val': 1.8566194585261947e-06, 'batch_size': 3456, 'optimizer': 'Adam'}.
2026-07-08 09:48:26,965 - optuna.study.study - INFO - Trial 205 finished with values: [0.0025590515527307046, 0.0008168227494633664, 0.0016961504385749513] and parameters: {'n_layers': 2, 'embedding_dim': 64, 'lr': 0.000222035220678721, 'lambda_val': 1.587564112161169e-05, 'batch_size': 2380, 'optimizer': 'RMSprop'}.
2026-07-08 09:53:17,501 - optuna.study.study - INFO - Trial 206 finished with values: [0.002544749968113011, 0.0008605132686207094, 0.0017879094425782916] and parameters: {'n_layers': 1, 'embedding_dim': 32, 'lr': 0.00028288762235460313, 'lambda_val': 1.684289604060617e-05, 'batch_size': 3388, 'optimizer': 'Adam'}.
2026-07-08 09:54:06,476 - experiment_functions - INFO - Early stopping at epoch 600. Best Metrics: (0.0022341444554162294, 0.0007607849096746005, 0.0015769055146072624)
2026-07-08 09:54:06,590 - optuna.study.study - INFO - Trial 207 finished with values: [0.0022341444554162294, 0.0007607849096746005, 0.0015769055146072624] and parameters: {'n_layers': 1, 'embedding_dim': 64, 'lr': 0.0031808570812741697, 'lambda_val': 0.013358348953892523, 'batch_size': 1988, 'optimizer': 'Adam'}.
2026-07-08 09:55:32,185 - experiment_functions - INFO - Early stopping at epoch 1050. Best Metrics: (0.0033931904807454646, 0.0011900917500902305, 0.002386492256577267)
2026-07-08 09:55:32,703 - optuna.study.study - INFO - Trial 208 finished with values: [0.0033931904807454646, 0.0011900917500902305, 0.002386492256577267] and parameters: {'n_layers': 1, 'embedding_dim': 128, 'lr': 0.0008107931898913872, 'lambda_val': 1.783091837418501e-05, 'batch_size': 3820, 'optimizer': 'Adam'}.
2026-07-08 09:57:28,920 - experiment_functions - INFO - Early stopping at epoch 1550. Best Metrics: (0.0016636851677721276, 0.000679102634728264, 0.0012607565329459485)
2026-07-08 09:57:29,527 - optuna.study.study - INFO - Trial 209 finished with values: [0.0016636851677721276, 0.000679102634728264, 0.0012607565329459485] and parameters: {'n_layers': 1, 'embedding_dim': 32, 'lr': 0.0031808570812741697, 'lambda_val': 0.00045919787742064835, 'batch_size': 1430, 'optimizer': 'RMSprop'}.
2026-07-08 09:58:23,815 - experiment_functions - INFO - Early stopping at epoch 650. Best Metrics: (0.003448844132787924, 0.0011995896890374788, 0.0024073322403671865)
2026-07-08 09:58:23,992 - optuna.study.study - INFO - Trial 210 finished with values: [0.003448844132787924, 0.0011995896890374788, 0.0024073322403671865] and parameters: {'n_layers': 1, 'embedding_dim': 96, 'lr': 0.002396901451187955, 'lambda_val': 0.0002947495461502324, 'batch_size': 3809, 'optimizer': 'Adam'}.
2026-07-08 10:04:06,321 - optuna.study.study - INFO - Trial 211 finished with values: [0.003253358228557196, 0.0012081378340900025, 0.0023878837900426484] and parameters: {'n_layers': 1, 'embedding_dim': 256, 'lr': 0.0002900679124230289, 'lambda_val': 3.4017247985764347e-06, 'batch_size': 3820, 'optimizer': 'Adam'}.
2026-07-08 10:05:04,549 - experiment_functions - INFO - Early stopping at epoch 750. Best Metrics: (0.0034986946763320825, 0.0011008111239860952, 0.0023292083036051546)
2026-07-08 10:05:04,629 - optuna.study.study - INFO - Trial 212 finished with values: [0.0034986946763320825, 0.0011008111239860952, 0.0023292083036051546] and parameters: {'n_layers': 1, 'embedding_dim': 32, 'lr': 0.002396901451187955, 'lambda_val': 1.8566194585261947e-06, 'batch_size': 1422, 'optimizer': 'Adam'}.
2026-07-08 10:05:44,760 - experiment_functions - INFO - Early stopping at epoch 500. Best Metrics: (0.0002168858073479869, 5.6987633683490685e-05, 0.00013190330125622263)
2026-07-08 10:05:44,837 - optuna.study.study - INFO - Trial 213 finished with values: [0.0002168858073479869, 5.6987633683490685e-05, 0.00013190330125622263] and parameters: {'n_layers': 2, 'embedding_dim': 32, 'lr': 9.69664935603752e-05, 'lambda_val': 0.0002947495461502324, 'batch_size': 3102, 'optimizer': 'SGD'}.
2026-07-08 10:06:42,987 - experiment_functions - INFO - Early stopping at epoch 700. Best Metrics: (0.0026649297758367784, 0.0010305263757764565, 0.0019504667469399995)
2026-07-08 10:06:43,082 - optuna.study.study - INFO - Trial 214 finished with values: [0.0026649297758367784, 0.0010305263757764565, 0.0019504667469399995] and parameters: {'n_layers': 1, 'embedding_dim': 128, 'lr': 0.0009008516306813866, 'lambda_val': 0.0038562488650002408, 'batch_size': 3809, 'optimizer': 'RMSprop'}.
2026-07-08 10:11:53,436 - optuna.study.study - INFO - Trial 215 finished with values: [0.0009189063140216278, 0.0002906369317858025, 0.0006413807849676426] and parameters: {'n_layers': 1, 'embedding_dim': 128, 'lr': 0.00013343306832841584, 'lambda_val': 0.0002947495461502324, 'batch_size': 3644, 'optimizer': 'Adam'}.
2026-07-08 10:12:53,095 - experiment_functions - INFO - Early stopping at epoch 550. Best Metrics: (0.000999162305815509, 0.0003580722983112665, 0.0006284278110565871)
2026-07-08 10:12:53,180 - optuna.study.study - INFO - Trial 216 finished with values: [0.000999162305815509, 0.0003580722983112665, 0.0006284278110565871] and parameters: {'n_layers': 4, 'embedding_dim': 256, 'lr': 0.0031808570812741697, 'lambda_val': 2.5413502561792073e-05, 'batch_size': 3369, 'optimizer': 'Adam'}.
2026-07-08 10:13:54,369 - experiment_functions - INFO - Early stopping at epoch 750. Best Metrics: (0.0033422991028516434, 0.0012404308265106473, 0.0025115210959544467)
2026-07-08 10:13:54,471 - optuna.study.study - INFO - Trial 217 finished with values: [0.0033422991028516434, 0.0012404308265106473, 0.0025115210959544467] and parameters: {'n_layers': 1, 'embedding_dim': 96, 'lr': 0.0031808570812741697, 'lambda_val': 1.8566194585261947e-06, 'batch_size': 1967, 'optimizer': 'Adam'}.
2026-07-08 10:14:48,325 - experiment_functions - INFO - Early stopping at epoch 600. Best Metrics: (0.001512651316996236, 0.000507189939783067, 0.0009550522579714533)
2026-07-08 10:14:48,510 - optuna.study.study - INFO - Trial 218 finished with values: [0.001512651316996236, 0.000507189939783067, 0.0009550522579714533] and parameters: {'n_layers': 3, 'embedding_dim': 128, 'lr': 0.0017130068187002413, 'lambda_val': 0.0002947495461502324, 'batch_size': 1949, 'optimizer': 'Adam'}.
2026-07-08 10:15:44,396 - experiment_functions - INFO - Early stopping at epoch 700. Best Metrics: (0.003345051806767533, 0.0011169576201964175, 0.0022721311024285107)
2026-07-08 10:15:44,750 - optuna.study.study - INFO - Trial 219 finished with values: [0.003345051806767533, 0.0011169576201964175, 0.0022721311024285107] and parameters: {'n_layers': 1, 'embedding_dim': 64, 'lr': 0.0028431167684609335, 'lambda_val': 0.001113470490516116, 'batch_size': 1338, 'optimizer': 'Adam'}.
2026-07-08 10:16:41,075 - experiment_functions - INFO - Early stopping at epoch 700. Best Metrics: (0.003454538413369851, 0.0012043386585111032, 0.0023437102748981634)
2026-07-08 10:16:41,241 - optuna.study.study - INFO - Trial 220 finished with values: [0.003454538413369851, 0.0012043386585111032, 0.0023437102748981634] and parameters: {'n_layers': 1, 'embedding_dim': 64, 'lr': 0.0031808570812741697, 'lambda_val': 1.8566194585261947e-06, 'batch_size': 1897, 'optimizer': 'Adam'}.
2026-07-08 10:17:33,598 - experiment_functions - INFO - Early stopping at epoch 650. Best Metrics: (0.0034144935221388545, 0.00116254772714321, 0.0023368149954837397)
2026-07-08 10:17:33,678 - optuna.study.study - INFO - Trial 221 finished with values: [0.0034144935221388545, 0.00116254772714321, 0.0023368149954837397] and parameters: {'n_layers': 1, 'embedding_dim': 64, 'lr': 0.0031808570812741697, 'lambda_val': 0.00044891351853285386, 'batch_size': 3809, 'optimizer': 'Adam'}.
2026-07-08 10:18:32,172 - experiment_functions - INFO - Early stopping at epoch 700. Best Metrics: (0.0027623949855386867, 0.001094162566723021, 0.0020861875247895896)
2026-07-08 10:18:32,255 - optuna.study.study - INFO - Trial 222 finished with values: [0.0027623949855386867, 0.001094162566723021, 0.0020861875247895896] and parameters: {'n_layers': 1, 'embedding_dim': 128, 'lr': 0.0018700520158202879, 'lambda_val': 0.00019693560751835414, 'batch_size': 3456, 'optimizer': 'RMSprop'}.
2026-07-08 10:23:24,842 - optuna.study.study - INFO - Trial 223 finished with values: [0.001647384751027429, 0.0005860228330452292, 0.0011433841769898849] and parameters: {'n_layers': 1, 'embedding_dim': 32, 'lr': 0.0002900679124230289, 'lambda_val': 0.003584385278278044, 'batch_size': 1147, 'optimizer': 'RMSprop'}.
2026-07-08 10:24:17,286 - experiment_functions - INFO - Early stopping at epoch 650. Best Metrics: (0.003137203436679098, 0.0011340539103014645, 0.0021476304505958586)
2026-07-08 10:24:17,377 - optuna.study.study - INFO - Trial 224 finished with values: [0.003137203436679098, 0.0011340539103014645, 0.0021476304505958586] and parameters: {'n_layers': 1, 'embedding_dim': 64, 'lr': 0.0031808570812741697, 'lambda_val': 0.0008202861034155112, 'batch_size': 1430, 'optimizer': 'Adam'}.
2026-07-08 10:25:02,062 - experiment_functions - INFO - Early stopping at epoch 550. Best Metrics: (0.0023060239939446895, 0.0007759816119901981, 0.0015379542891718842)
2026-07-08 10:25:02,149 - optuna.study.study - INFO - Trial 225 finished with values: [0.0023060239939446895, 0.0007759816119901981, 0.0015379542891718842] and parameters: {'n_layers': 1, 'embedding_dim': 64, 'lr': 0.01653938235048405, 'lambda_val': 0.00012808197719446312, 'batch_size': 1930, 'optimizer': 'Adam'}.
2026-07-08 10:25:57,362 - experiment_functions - INFO - Early stopping at epoch 600. Best Metrics: (0.003547304589881106, 0.0012955188724046883, 0.002579487269816914)
2026-07-08 10:25:57,447 - optuna.study.study - INFO - Trial 226 finished with values: [0.003547304589881106, 0.0012955188724046883, 0.002579487269816914] and parameters: {'n_layers': 1, 'embedding_dim': 256, 'lr': 0.0031808570812741697, 'lambda_val': 0.00044891351853285386, 'batch_size': 3820, 'optimizer': 'Adam'}.
2026-07-08 10:27:11,642 - experiment_functions - INFO - Early stopping at epoch 900. Best Metrics: (0.0013255143922944162, 0.0004416541610470528, 0.0008515072178234693)
2026-07-08 10:27:11,735 - optuna.study.study - INFO - Trial 227 finished with values: [0.0013255143922944162, 0.0004416541610470528, 0.0008515072178234693] and parameters: {'n_layers': 4, 'embedding_dim': 64, 'lr': 0.000565645409068954, 'lambda_val': 2.7230144105200075e-05, 'batch_size': 1930, 'optimizer': 'Adam'}.
2026-07-08 10:28:01,575 - experiment_functions - INFO - Early stopping at epoch 600. Best Metrics: (0.003169541508788426, 0.0011539995820906864, 0.0022824354832139287)
2026-07-08 10:28:01,660 - optuna.study.study - INFO - Trial 228 finished with values: [0.003169541508788426, 0.0011539995820906864, 0.0022824354832139287] and parameters: {'n_layers': 1, 'embedding_dim': 96, 'lr': 0.006422216402274719, 'lambda_val': 0.00044891351853285386, 'batch_size': 1430, 'optimizer': 'Adam'}.
2026-07-08 10:28:48,062 - experiment_functions - INFO - Early stopping at epoch 550. Best Metrics: (0.001346442479916036, 0.00040556199304750873, 0.0009292636800367537)
2026-07-08 10:28:48,361 - optuna.study.study - INFO - Trial 229 finished with values: [0.001346442479916036, 0.00040556199304750873, 0.0009292636800367537] and parameters: {'n_layers': 3, 'embedding_dim': 64, 'lr': 0.0031808570812741697, 'lambda_val': 1.783091837418501e-05, 'batch_size': 3820, 'optimizer': 'Adam'}.
2026-07-08 10:33:47,590 - optuna.study.study - INFO - Trial 230 finished with values: [0.0030094386150279363, 0.0009963337955663622, 0.0021420826291759657] and parameters: {'n_layers': 1, 'embedding_dim': 64, 'lr': 0.00036362799625678024, 'lambda_val': 1.8566194585261947e-06, 'batch_size': 1430, 'optimizer': 'Adam'}.
2026-07-08 10:36:12,638 - experiment_functions - INFO - Early stopping at epoch 1900. Best Metrics: (0.0033400086788653504, 0.0011606481393537603, 0.002263543036305994)
2026-07-08 10:36:13,019 - optuna.study.study - INFO - Trial 231 finished with values: [0.0033400086788653504, 0.0011606481393537603, 0.002263543036305994] and parameters: {'n_layers': 1, 'embedding_dim': 64, 'lr': 0.0009008516306813866, 'lambda_val': 0.0002947495461502324, 'batch_size': 1930, 'optimizer': 'Adam'}.
2026-07-08 10:36:53,666 - experiment_functions - INFO - Early stopping at epoch 500. Best Metrics: (0.00023551463101189278, 5.888722147294038e-05, 0.00013633028296108348)
2026-07-08 10:36:54,110 - optuna.study.study - INFO - Trial 232 finished with values: [0.00023551463101189278, 5.888722147294038e-05, 0.00013633028296108348] and parameters: {'n_layers': 1, 'embedding_dim': 64, 'lr': 0.0031808570812741697, 'lambda_val': 0.00044891351853285386, 'batch_size': 3820, 'optimizer': 'SGD'}.
2026-07-08 10:42:32,677 - optuna.study.study - INFO - Trial 233 finished with values: [0.0033607985719882956, 0.0011967403073533044, 0.0023829635900532273] and parameters: {'n_layers': 1, 'embedding_dim': 256, 'lr': 0.0002900679124230289, 'lambda_val': 0.0013552584940860833, 'batch_size': 1930, 'optimizer': 'RMSprop'}.
2026-07-08 10:44:32,380 - experiment_functions - INFO - Early stopping at epoch 1500. Best Metrics: (0.003656907187464425, 0.0012280835058792244, 0.0025291355695420434)
2026-07-08 10:44:32,543 - optuna.study.study - INFO - Trial 234 finished with values: [0.003656907187464425, 0.0012280835058792244, 0.0025291355695420434] and parameters: {'n_layers': 1, 'embedding_dim': 128, 'lr': 0.0007398611586122253, 'lambda_val': 1.8566194585261947e-06, 'batch_size': 883, 'optimizer': 'RMSprop'}.
2026-07-08 10:45:17,474 - experiment_functions - INFO - Early stopping at epoch 550. Best Metrics: (0.0022034529317789863, 0.0007873791387268963, 0.001480066861615837)
2026-07-08 10:45:17,559 - optuna.study.study - INFO - Trial 235 finished with values: [0.0022034529317789863, 0.0007873791387268963, 0.001480066861615837] and parameters: {'n_layers': 1, 'embedding_dim': 64, 'lr': 0.0031808570812741697, 'lambda_val': 3.779398646925851e-06, 'batch_size': 3820, 'optimizer': 'RMSprop'}.
2026-07-08 10:50:16,075 - optuna.study.study - INFO - Trial 236 finished with values: [0.0037760275207311504, 0.001253727941036795, 0.0025232912224098913] and parameters: {'n_layers': 1, 'embedding_dim': 64, 'lr': 0.000565645409068954, 'lambda_val': 0.00044891351853285386, 'batch_size': 1585, 'optimizer': 'Adam'}.
2026-07-08 10:55:07,773 - optuna.study.study - INFO - Trial 237 finished with values: [0.0037742400061930503, 0.0011511502004065118, 0.0024942635855301596] and parameters: {'n_layers': 1, 'embedding_dim': 32, 'lr': 0.000565645409068954, 'lambda_val': 1.3187714692785522e-06, 'batch_size': 1098, 'optimizer': 'Adam'}.
2026-07-08 10:56:07,526 - experiment_functions - INFO - Early stopping at epoch 650. Best Metrics: (0.00362917343529838, 0.0013069163991413864, 0.002673599940969918)
2026-07-08 10:56:07,626 - optuna.study.study - INFO - Trial 238 finished with values: [0.00362917343529838, 0.0013069163991413864, 0.002673599940969918] and parameters: {'n_layers': 1, 'embedding_dim': 256, 'lr': 0.0031808570812741697, 'lambda_val': 1.8566194585261947e-06, 'batch_size': 3820, 'optimizer': 'Adam'}.
2026-07-08 11:01:39,343 - experiment_functions - INFO - Early stopping at epoch 3500. Best Metrics: (0.0011364557952513157, 0.0006268639705183975, 0.0010131457374540408)
2026-07-08 11:01:39,434 - optuna.study.study - INFO - Trial 239 finished with values: [0.0011364557952513157, 0.0006268639705183975, 0.0010131457374540408] and parameters: {'n_layers': 3, 'embedding_dim': 256, 'lr': 0.004484005536215966, 'lambda_val': 3.4017247985764347e-06, 'batch_size': 1929, 'optimizer': 'RMSprop'}.
2026-07-08 11:02:28,472 - experiment_functions - INFO - Early stopping at epoch 600. Best Metrics: (0.002307567720885321, 0.0007427388256748286, 0.001460745980630798)
2026-07-08 11:02:29,327 - optuna.study.study - INFO - Trial 240 finished with values: [0.002307567720885321, 0.0007427388256748286, 0.001460745980630798] and parameters: {'n_layers': 2, 'embedding_dim': 64, 'lr': 0.0031808570812741697, 'lambda_val': 1.783091837418501e-05, 'batch_size': 2839, 'optimizer': 'Adam'}.
2026-07-08 11:03:21,796 - experiment_functions - INFO - Early stopping at epoch 650. Best Metrics: (0.003103999819337511, 0.0010476226658815038, 0.0022133129329756163)
2026-07-08 11:03:21,878 - optuna.study.study - INFO - Trial 241 finished with values: [0.003103999819337511, 0.0010476226658815038, 0.0022133129329756163] and parameters: {'n_layers': 1, 'embedding_dim': 64, 'lr': 0.0031808570812741697, 'lambda_val': 1.8566194585261947e-06, 'batch_size': 1430, 'optimizer': 'Adam'}.
2026-07-08 11:08:32,662 - optuna.study.study - INFO - Trial 242 finished with values: [0.003871889164533589, 0.001302167429667762, 0.0026772538591163754] and parameters: {'n_layers': 1, 'embedding_dim': 128, 'lr': 0.0004683675544444161, 'lambda_val': 1.684289604060617e-05, 'batch_size': 1430, 'optimizer': 'RMSprop'}.
2026-07-08 11:09:36,074 - experiment_functions - INFO - Early stopping at epoch 800. Best Metrics: (0.003150846586334857, 0.0011577987576695857, 0.0022169396771257077)
2026-07-08 11:09:36,163 - optuna.study.study - INFO - Trial 243 finished with values: [0.003150846586334857, 0.0011577987576695857, 0.0022169396771257077] and parameters: {'n_layers': 1, 'embedding_dim': 64, 'lr': 0.002396901451187955, 'lambda_val': 1.8566194585261947e-06, 'batch_size': 3820, 'optimizer': 'Adam'}.
2026-07-08 11:12:18,944 - experiment_functions - INFO - Early stopping at epoch 2200. Best Metrics: (0.0034339284579476045, 0.0011900917500902305, 0.0023185257702849843)
2026-07-08 11:12:19,039 - optuna.study.study - INFO - Trial 244 finished with values: [0.0034339284579476045, 0.0011900917500902305, 0.0023185257702849843] and parameters: {'n_layers': 1, 'embedding_dim': 32, 'lr': 0.0008107931898913872, 'lambda_val': 1.8566194585261947e-06, 'batch_size': 3820, 'optimizer': 'Adam'}.
2026-07-08 11:17:09,914 - optuna.study.study - INFO - Trial 245 finished with values: [0.003678243660303252, 0.0011217065896700416, 0.002406669943888287] and parameters: {'n_layers': 1, 'embedding_dim': 32, 'lr': 0.000565645409068954, 'lambda_val': 1.8566194585261947e-06, 'batch_size': 1098, 'optimizer': 'Adam'}.
2026-07-08 11:18:14,053 - experiment_functions - INFO - Early stopping at epoch 800. Best Metrics: (0.003227567700783968, 0.001108409475143894, 0.002243707912729648)
2026-07-08 11:18:14,134 - optuna.study.study - INFO - Trial 246 finished with values: [0.003227567700783968, 0.001108409475143894, 0.002243707912729648] and parameters: {'n_layers': 1, 'embedding_dim': 96, 'lr': 0.0011108364748811956, 'lambda_val': 0.0013552584940860833, 'batch_size': 1930, 'optimizer': 'RMSprop'}.
2026-07-08 11:19:07,394 - experiment_functions - INFO - Early stopping at epoch 650. Best Metrics: (0.0034137381155462387, 0.0012527781471420702, 0.002443131388851551)
2026-07-08 11:19:07,484 - optuna.study.study - INFO - Trial 247 finished with values: [0.0034137381155462387, 0.0012527781471420702, 0.002443131388851551] and parameters: {'n_layers': 1, 'embedding_dim': 96, 'lr': 0.0031808570812741697, 'lambda_val': 0.0002947495461502324, 'batch_size': 3809, 'optimizer': 'Adam'}.
2026-07-08 11:20:08,568 - experiment_functions - INFO - Early stopping at epoch 750. Best Metrics: (0.003614156617906323, 0.001261326292194594, 0.0025283381671113857)
2026-07-08 11:20:08,681 - optuna.study.study - INFO - Trial 248 finished with values: [0.003614156617906323, 0.001261326292194594, 0.0025283381671113857] and parameters: {'n_layers': 1, 'embedding_dim': 96, 'lr': 0.0031808570812741697, 'lambda_val': 1.9166677808452497e-06, 'batch_size': 1967, 'optimizer': 'Adam'}.
2026-07-08 11:20:53,739 - experiment_functions - INFO - Early stopping at epoch 500. Best Metrics: (0.00021923411739210698, 5.603783978876583e-05, 0.0001270412942841709)
2026-07-08 11:20:53,818 - optuna.study.study - INFO - Trial 249 finished with values: [0.00021923411739210698, 5.603783978876583e-05, 0.0001270412942841709] and parameters: {'n_layers': 3, 'embedding_dim': 128, 'lr': 1.6816286935061024e-05, 'lambda_val': 1.3187714692785522e-06, 'batch_size': 1278, 'optimizer': 'SGD'}.
2026-07-08 11:22:42,032 - experiment_functions - INFO - Early stopping at epoch 1350. Best Metrics: (0.0033604960229683765, 0.0012185855669319759, 0.0024243717931569007)
2026-07-08 11:22:42,103 - optuna.study.study - INFO - Trial 250 finished with values: [0.0033604960229683765, 0.0012185855669319759, 0.0024243717931569007] and parameters: {'n_layers': 1, 'embedding_dim': 128, 'lr': 0.0009008516306813866, 'lambda_val': 0.0002947495461502324, 'batch_size': 1949, 'optimizer': 'Adam'}.
2026-07-08 11:23:29,210 - experiment_functions - INFO - Early stopping at epoch 600. Best Metrics: (0.00020967871280685595, 6.17366031571149e-05, 0.00012841323249055184)
2026-07-08 11:23:29,299 - optuna.study.study - INFO - Trial 251 finished with values: [0.00020967871280685595, 6.17366031571149e-05, 0.00012841323249055184] and parameters: {'n_layers': 1, 'embedding_dim': 32, 'lr': 3.987431205086326e-05, 'lambda_val': 1.8566194585261947e-06, 'batch_size': 1098, 'optimizer': 'Adam'}.
2026-07-08 11:24:18,415 - experiment_functions - INFO - Early stopping at epoch 600. Best Metrics: (0.00211434014578809, 0.0007721824364112989, 0.001454907417379391)
2026-07-08 11:24:18,491 - optuna.study.study - INFO - Trial 252 finished with values: [0.00211434014578809, 0.0007721824364112989, 0.001454907417379391] and parameters: {'n_layers': 2, 'embedding_dim': 64, 'lr': 0.0031808570812741697, 'lambda_val': 0.00045919787742064835, 'batch_size': 3820, 'optimizer': 'Adam'}.
2026-07-08 11:25:10,983 - experiment_functions - INFO - Early stopping at epoch 650. Best Metrics: (0.0028607870376299877, 0.001046672871986779, 0.0019938817649585725)
