2026-06-27 21:14:53,103 - optuna.study.study - INFO - Trial 97 finished with values: [0.0002530874318288918, 5.793742757821554e-05, 0.00014084897478661723] and parameters: {'n_layers': 4, 'embedding_dim': 64, 'lr': 0.04523975005049768, 'lambda_val': 4.470441871474425e-06, 'batch_size': 3774, 'optimizer': 'SGD'}.
2026-06-27 21:20:55,481 - optuna.study.study - INFO - Trial 98 finished with values: [0.023117016638477306, 0.005080447542883194, 0.013777419049478507] and parameters: {'n_layers': 1, 'embedding_dim': 128, 'lr': 0.005739501470387607, 'lambda_val': 0.0006043567828314722, 'batch_size': 2292, 'optimizer': 'Adam'}.
2026-06-27 21:26:41,254 - optuna.study.study - INFO - Trial 99 finished with values: [0.015337531580484457, 0.0033394753338525543, 0.009045325599645219] and parameters: {'n_layers': 1, 'embedding_dim': 96, 'lr': 0.018682831918637316, 'lambda_val': 6.447923168817336e-05, 'batch_size': 2978, 'optimizer': 'Adam'}.
2026-06-27 21:28:02,536 - experiment_functions - INFO - Early stopping at epoch 550. Best Metrics: (0.00020611234917469658, 5.413825199931615e-05, 0.00010461583360839682)
2026-06-27 21:28:02,647 - optuna.study.study - INFO - Trial 100 finished with values: [0.00020611234917469658, 5.413825199931615e-05, 0.00010461583360839682] and parameters: {'n_layers': 3, 'embedding_dim': 256, 'lr': 1.0420504254047765e-05, 'lambda_val': 0.002864767214859732, 'batch_size': 892, 'optimizer': 'Adam'}.
2026-06-27 21:32:39,001 - experiment_functions - INFO - Early stopping at epoch 2250. Best Metrics: (0.006603843790692231, 0.001603252094295538, 0.00393965472837653)
2026-06-27 21:32:39,090 - optuna.study.study - INFO - Trial 101 finished with values: [0.006603843790692231, 0.001603252094295538, 0.00393965472837653] and parameters: {'n_layers': 2, 'embedding_dim': 256, 'lr': 0.001948110338269317, 'lambda_val': 0.02969185262265662, 'batch_size': 2430, 'optimizer': 'Adam'}.
2026-06-27 21:37:33,659 - experiment_functions - INFO - Early stopping at epoch 2850. Best Metrics: (0.016428329388526414, 0.0036158653572174837, 0.00967271980419893)
2026-06-27 21:37:33,742 - optuna.study.study - INFO - Trial 102 finished with values: [0.016428329388526414, 0.0036158653572174837, 0.00967271980419893] and parameters: {'n_layers': 3, 'embedding_dim': 96, 'lr': 0.001948110338269317, 'lambda_val': 6.447923168817336e-05, 'batch_size': 3568, 'optimizer': 'Adam'}.
2026-06-27 21:43:54,844 - optuna.study.study - INFO - Trial 103 finished with values: [0.018713608680425212, 0.004022377144159718, 0.010797503254616137] and parameters: {'n_layers': 2, 'embedding_dim': 96, 'lr': 0.005739501470387607, 'lambda_val': 6.447923168817336e-05, 'batch_size': 3238, 'optimizer': 'RMSprop'}.
2026-06-27 21:50:51,558 - optuna.study.study - INFO - Trial 104 finished with values: [0.032229991787208326, 0.006719791805178277, 0.019178733778626188] and parameters: {'n_layers': 1, 'embedding_dim': 256, 'lr': 0.007515611127205712, 'lambda_val': 0.00011460379227540933, 'batch_size': 3545, 'optimizer': 'RMSprop'}.
2026-06-27 21:51:48,918 - experiment_functions - INFO - Early stopping at epoch 600. Best Metrics: (0.009824477163516109, 0.002404878141443307, 0.0062402153174003295)
2026-06-27 21:51:49,002 - optuna.study.study - INFO - Trial 105 finished with values: [0.009824477163516109, 0.002404878141443307, 0.0062402153174003295] and parameters: {'n_layers': 1, 'embedding_dim': 128, 'lr': 0.018609867636620366, 'lambda_val': 0.00038291857999994005, 'batch_size': 1385, 'optimizer': 'RMSprop'}.
2026-06-27 22:01:18,658 - optuna.study.study - INFO - Trial 106 finished with values: [0.009302197830295199, 0.002143684820393975, 0.005467753432624204] and parameters: {'n_layers': 3, 'embedding_dim': 256, 'lr': 0.007515611127205712, 'lambda_val': 0.0014204277708555555, 'batch_size': 3545, 'optimizer': 'Adam'}.
2026-06-27 22:02:39,604 - experiment_functions - INFO - Early stopping at epoch 700. Best Metrics: (0.008589413054623046, 0.001913834697870562, 0.0050836253059892275)
2026-06-27 22:02:39,674 - optuna.study.study - INFO - Trial 107 finished with values: [0.008589413054623046, 0.001913834697870562, 0.0050836253059892275] and parameters: {'n_layers': 4, 'embedding_dim': 96, 'lr': 0.019921281966616786, 'lambda_val': 6.447923168817336e-05, 'batch_size': 2430, 'optimizer': 'Adam'}.
2026-06-27 22:03:27,256 - experiment_functions - INFO - Early stopping at epoch 500. Best Metrics: (0.0001868140868286239, 5.603783978876585e-05, 0.00011487314947707405)
2026-06-27 22:03:27,368 - optuna.study.study - INFO - Trial 108 finished with values: [0.0001868140868286239, 5.603783978876585e-05, 0.00011487314947707405] and parameters: {'n_layers': 2, 'embedding_dim': 64, 'lr': 0.0007259712952677559, 'lambda_val': 6.447923168817336e-05, 'batch_size': 1553, 'optimizer': 'SGD'}.
2026-06-27 22:12:59,370 - optuna.study.study - INFO - Trial 109 finished with values: [0.012393332445868646, 0.003201755219117452, 0.00740030483689424] and parameters: {'n_layers': 3, 'embedding_dim': 256, 'lr': 0.00030208896688504897, 'lambda_val': 0.0005255886197318135, 'batch_size': 2269, 'optimizer': 'RMSprop'}.
2026-06-27 22:17:03,652 - experiment_functions - INFO - Early stopping at epoch 2350. Best Metrics: (0.015544733885099263, 0.003402161730904394, 0.008965718671303673)
2026-06-27 22:17:03,747 - optuna.study.study - INFO - Trial 110 finished with values: [0.015544733885099263, 0.003402161730904394, 0.008965718671303673] and parameters: {'n_layers': 3, 'embedding_dim': 96, 'lr': 0.001948110338269317, 'lambda_val': 0.0004799935885720918, 'batch_size': 3568, 'optimizer': 'Adam'}.
2026-06-27 22:17:53,953 - experiment_functions - INFO - Early stopping at epoch 600. Best Metrics: (0.00029210269091398214, 7.028474820963851e-05, 0.0001733078095871122)
2026-06-27 22:17:54,036 - optuna.study.study - INFO - Trial 111 finished with values: [0.00029210269091398214, 7.028474820963851e-05, 0.0001733078095871122] and parameters: {'n_layers': 1, 'embedding_dim': 32, 'lr': 0.00038340250686706587, 'lambda_val': 0.005101231486027863, 'batch_size': 2430, 'optimizer': 'RMSprop'}.
2026-06-27 22:18:45,011 - experiment_functions - INFO - Early stopping at epoch 550. Best Metrics: (0.0034388311664456375, 0.0009478943069353951, 0.002156372248425195)
2026-06-27 22:18:45,119 - optuna.study.study - INFO - Trial 112 finished with values: [0.0034388311664456375, 0.0009478943069353951, 0.002156372248425195] and parameters: {'n_layers': 3, 'embedding_dim': 32, 'lr': 0.002544878960896036, 'lambda_val': 0.01227951629522181, 'batch_size': 1355, 'optimizer': 'RMSprop'}.
2026-06-27 22:25:25,964 - optuna.study.study - INFO - Trial 113 finished with values: [0.01029531728764043, 0.002561594134072907, 0.006207996404161193] and parameters: {'n_layers': 4, 'embedding_dim': 64, 'lr': 0.00032475511680244166, 'lambda_val': 0.0024964471498600837, 'batch_size': 1947, 'optimizer': 'RMSprop'}.
2026-06-27 22:33:32,182 - optuna.study.study - INFO - Trial 114 finished with values: [0.0037468991839038407, 0.0009877856505138385, 0.002273711695563303] and parameters: {'n_layers': 2, 'embedding_dim': 256, 'lr': 0.00030208896688504897, 'lambda_val': 0.0027920341523376825, 'batch_size': 1382, 'optimizer': 'Adam'}.
2026-06-27 22:39:53,165 - optuna.study.study - INFO - Trial 115 finished with values: [0.015962556543163045, 0.003551279372376194, 0.009155325378302402] and parameters: {'n_layers': 3, 'embedding_dim': 64, 'lr': 0.001948110338269317, 'lambda_val': 5.1429527123207e-06, 'batch_size': 3583, 'optimizer': 'Adam'}.
2026-06-27 22:49:23,986 - optuna.study.study - INFO - Trial 116 finished with values: [0.01472221936790346, 0.003634861235111981, 0.008988055720448243] and parameters: {'n_layers': 3, 'embedding_dim': 256, 'lr': 0.00030208896688504897, 'lambda_val': 8.747132820486757e-06, 'batch_size': 4065, 'optimizer': 'RMSprop'}.
2026-06-27 22:52:21,923 - experiment_functions - INFO - Early stopping at epoch 2200. Best Metrics: (0.01246961205665883, 0.002856980035332333, 0.0075076928823706295)
2026-06-27 22:52:22,007 - optuna.study.study - INFO - Trial 117 finished with values: [0.01246961205665883, 0.002856980035332333, 0.0075076928823706295] and parameters: {'n_layers': 1, 'embedding_dim': 32, 'lr': 0.01813590478888849, 'lambda_val': 0.0003312399156887171, 'batch_size': 4066, 'optimizer': 'Adam'}.
2026-06-27 22:53:07,771 - experiment_functions - INFO - Early stopping at epoch 500. Best Metrics: (0.0002123975992134982, 5.793742757821554e-05, 0.0001227825457835661)
2026-06-27 22:53:07,868 - optuna.study.study - INFO - Trial 118 finished with values: [0.0002123975992134982, 5.793742757821554e-05, 0.0001227825457835661] and parameters: {'n_layers': 1, 'embedding_dim': 96, 'lr': 0.018682831918637316, 'lambda_val': 6.447923168817336e-05, 'batch_size': 2978, 'optimizer': 'SGD'}.
2026-06-27 22:53:53,318 - experiment_functions - INFO - Early stopping at epoch 500. Best Metrics: (0.00019953696422214367, 5.223866420986646e-05, 0.00010334699702481442)
2026-06-27 22:53:53,401 - optuna.study.study - INFO - Trial 119 finished with values: [0.00019953696422214367, 5.223866420986646e-05, 0.00010334699702481442] and parameters: {'n_layers': 1, 'embedding_dim': 96, 'lr': 0.0007259712952677559, 'lambda_val': 0.0003312399156887171, 'batch_size': 2292, 'optimizer': 'SGD'}.
2026-06-27 23:01:56,517 - optuna.study.study - INFO - Trial 120 finished with values: [0.012285531569140635, 0.003134319852591988, 0.007283794613775554] and parameters: {'n_layers': 4, 'embedding_dim': 128, 'lr': 0.00041390450370843926, 'lambda_val': 0.0006043567828314722, 'batch_size': 2292, 'optimizer': 'RMSprop'}.
2026-06-27 23:07:46,872 - optuna.study.study - INFO - Trial 121 finished with values: [0.0032582584234570372, 0.000850065535778736, 0.0020781868306450923] and parameters: {'n_layers': 2, 'embedding_dim': 64, 'lr': 0.00043015831536342714, 'lambda_val': 1.0416486521122021e-05, 'batch_size': 602, 'optimizer': 'Adam'}.
2026-06-27 23:13:53,868 - optuna.study.study - INFO - Trial 122 finished with values: [0.027123135018337467, 0.005804190490663527, 0.016211704478398103] and parameters: {'n_layers': 1, 'embedding_dim': 128, 'lr': 0.005739501470387607, 'lambda_val': 0.000307769265113033, 'batch_size': 4066, 'optimizer': 'Adam'}.
2026-06-27 23:19:43,862 - optuna.study.study - INFO - Trial 123 finished with values: [0.02314117061741451, 0.004961723306042589, 0.013751302257897249] and parameters: {'n_layers': 1, 'embedding_dim': 96, 'lr': 0.005739501470387607, 'lambda_val': 6.447923168817336e-05, 'batch_size': 2430, 'optimizer': 'RMSprop'}.
2026-06-27 23:25:39,474 - optuna.study.study - INFO - Trial 124 finished with values: [0.00917449610449122, 0.0021712288433409954, 0.005344401819404783] and parameters: {'n_layers': 2, 'embedding_dim': 64, 'lr': 0.005739501470387607, 'lambda_val': 0.0006043567828314722, 'batch_size': 1437, 'optimizer': 'Adam'}.
2026-06-27 23:32:22,966 - optuna.study.study - INFO - Trial 125 finished with values: [0.018810077135946495, 0.0040518207548961875, 0.010807106955662893] and parameters: {'n_layers': 2, 'embedding_dim': 128, 'lr': 0.001662600137131039, 'lambda_val': 0.000307769265113033, 'batch_size': 4066, 'optimizer': 'RMSprop'}.
2026-06-27 23:36:42,546 - experiment_functions - INFO - Early stopping at epoch 2950. Best Metrics: (0.00985447322356119, 0.0021911745151302173, 0.00573186138900077)
2026-06-27 23:36:42,638 - optuna.study.study - INFO - Trial 126 finished with values: [0.00985447322356119, 0.0021911745151302173, 0.00573186138900077] and parameters: {'n_layers': 3, 'embedding_dim': 32, 'lr': 0.009091499316683776, 'lambda_val': 3.731801442207796e-05, 'batch_size': 2978, 'optimizer': 'Adam'}.
2026-06-27 23:43:06,081 - optuna.study.study - INFO - Trial 127 finished with values: [0.014789994026070641, 0.003164713257223183, 0.008557461940583978] and parameters: {'n_layers': 2, 'embedding_dim': 96, 'lr': 0.009091499316683776, 'lambda_val': 6.447923168817336e-05, 'batch_size': 2778, 'optimizer': 'Adam'}.
2026-06-27 23:48:55,319 - optuna.study.study - INFO - Trial 128 finished with values: [0.00912053556200533, 0.002043006667553141, 0.005184752182804231] and parameters: {'n_layers': 3, 'embedding_dim': 32, 'lr': 0.007515611127205712, 'lambda_val': 0.0006043567828314722, 'batch_size': 3571, 'optimizer': 'Adam'}.
2026-06-27 23:54:18,770 - optuna.study.study - INFO - Trial 129 finished with values: [0.023107433510770756, 0.005041505993199477, 0.013799601464843037] and parameters: {'n_layers': 1, 'embedding_dim': 32, 'lr': 0.005739501470387607, 'lambda_val': 8.960789240600014e-06, 'batch_size': 2292, 'optimizer': 'Adam'}.
2026-06-28 00:00:40,428 - optuna.study.study - INFO - Trial 130 finished with values: [0.016101539504586194, 0.003599718861007162, 0.00949999673928219] and parameters: {'n_layers': 3, 'embedding_dim': 64, 'lr': 0.007515611127205712, 'lambda_val': 1.5450706960350556e-06, 'batch_size': 2778, 'optimizer': 'RMSprop'}.
2026-06-28 00:03:20,673 - experiment_functions - INFO - Early stopping at epoch 1900. Best Metrics: (0.011533259896359543, 0.0025786904241779534, 0.006558934233577241)
2026-06-28 00:03:20,764 - optuna.study.study - INFO - Trial 131 finished with values: [0.011533259896359543, 0.0025786904241779534, 0.006558934233577241] and parameters: {'n_layers': 2, 'embedding_dim': 32, 'lr': 0.003548193425453264, 'lambda_val': 0.0024964471498600837, 'batch_size': 2974, 'optimizer': 'Adam'}.
2026-06-28 00:08:50,167 - optuna.study.study - INFO - Trial 132 finished with values: [0.0011231599714701303, 0.0003143817791539236, 0.0007056193731077022] and parameters: {'n_layers': 2, 'embedding_dim': 32, 'lr': 0.00022510550270076726, 'lambda_val': 3.731801442207796e-05, 'batch_size': 2778, 'optimizer': 'Adam'}.
2026-06-28 00:14:41,750 - experiment_functions - INFO - Early stopping at epoch 3500. Best Metrics: (0.007297409358046327, 0.0016725870486104515, 0.00432000648512421)
2026-06-28 00:14:41,826 - optuna.study.study - INFO - Trial 133 finished with values: [0.007297409358046327, 0.0016725870486104515, 0.00432000648512421] and parameters: {'n_layers': 4, 'embedding_dim': 64, 'lr': 0.0021025807952068966, 'lambda_val': 0.0014974387796867583, 'batch_size': 1437, 'optimizer': 'RMSprop'}.
2026-06-28 00:22:07,759 - optuna.study.study - INFO - Trial 134 finished with values: [0.014482890835197989, 0.0031542655243812093, 0.008361012573102813] and parameters: {'n_layers': 3, 'embedding_dim': 128, 'lr': 0.001948110338269317, 'lambda_val': 6.447923168817336e-05, 'batch_size': 2430, 'optimizer': 'Adam'}.
2026-06-28 00:28:57,499 - optuna.study.study - INFO - Trial 135 finished with values: [0.011203952677892294, 0.0024371711338639517, 0.006501467937424706] and parameters: {'n_layers': 3, 'embedding_dim': 96, 'lr': 0.009091499316683776, 'lambda_val': 3.731801442207796e-05, 'batch_size': 2430, 'optimizer': 'Adam'}.
2026-06-28 00:29:51,453 - experiment_functions - INFO - Early stopping at epoch 500. Best Metrics: (0.0002994207344777356, 6.458598484128944e-05, 0.00017203452181547638)
2026-06-28 00:29:51,526 - optuna.study.study - INFO - Trial 136 finished with values: [0.0002994207344777356, 6.458598484128944e-05, 0.00017203452181547638] and parameters: {'n_layers': 3, 'embedding_dim': 96, 'lr': 8.015371904255175e-05, 'lambda_val': 0.00038291857999994005, 'batch_size': 1553, 'optimizer': 'RMSprop'}.
2026-06-28 00:36:10,995 - optuna.study.study - INFO - Trial 137 finished with values: [0.01158065839330624, 0.0025824895997568526, 0.006611472817971345] and parameters: {'n_layers': 3, 'embedding_dim': 64, 'lr': 0.007515611127205712, 'lambda_val': 1.5450706960350556e-06, 'batch_size': 3583, 'optimizer': 'Adam'}.
2026-06-28 00:42:31,708 - optuna.study.study - INFO - Trial 138 finished with values: [0.016516604861454506, 0.0035968694793229875, 0.009543725963888743] and parameters: {'n_layers': 3, 'embedding_dim': 64, 'lr': 0.019921281966616786, 'lambda_val': 0.00029254234783687136, 'batch_size': 2430, 'optimizer': 'RMSprop'}.
2026-06-28 00:46:33,573 - experiment_functions - INFO - Early stopping at epoch 1950. Best Metrics: (0.01177578815797854, 0.0026622722869137404, 0.0068320936758309615)
2026-06-28 00:46:33,651 - optuna.study.study - INFO - Trial 139 finished with values: [0.01177578815797854, 0.0026622722869137404, 0.0068320936758309615] and parameters: {'n_layers': 2, 'embedding_dim': 256, 'lr': 0.001662600137131039, 'lambda_val': 0.01064904655766616, 'batch_size': 2974, 'optimizer': 'Adam'}.
2026-06-28 00:52:17,546 - optuna.study.study - INFO - Trial 140 finished with values: [0.013307065865872778, 0.0031010770662766186, 0.008060177473717588] and parameters: {'n_layers': 1, 'embedding_dim': 96, 'lr': 0.018682831918637316, 'lambda_val': 6.447923168817336e-05, 'batch_size': 2430, 'optimizer': 'RMSprop'}.
2026-06-28 00:59:40,058 - optuna.study.study - INFO - Trial 141 finished with values: [0.010702658584798876, 0.0024086773170222064, 0.006308133346445023] and parameters: {'n_layers': 3, 'embedding_dim': 128, 'lr': 0.005739501470387607, 'lambda_val': 1.3394226593367904e-06, 'batch_size': 2292, 'optimizer': 'Adam'}.
2026-06-28 01:00:30,480 - experiment_functions - INFO - Early stopping at epoch 500. Best Metrics: (0.0002579309923059887, 5.603783978876584e-05, 0.0001332134648467998)
2026-06-28 01:00:30,562 - optuna.study.study - INFO - Trial 142 finished with values: [0.0002579309923059887, 5.603783978876584e-05, 0.0001332134648467998] and parameters: {'n_layers': 3, 'embedding_dim': 64, 'lr': 0.00022510550270076726, 'lambda_val': 8.248333957774017e-06, 'batch_size': 1053, 'optimizer': 'SGD'}.
2026-06-28 01:01:13,909 - experiment_functions - INFO - Early stopping at epoch 500. Best Metrics: (0.0002353888015521747, 6.553577873601427e-05, 0.0001404948096680817)
2026-06-28 01:01:13,994 - optuna.study.study - INFO - Trial 143 finished with values: [0.0002353888015521747, 6.553577873601427e-05, 0.0001404948096680817] and parameters: {'n_layers': 1, 'embedding_dim': 32, 'lr': 2.0848143570577665e-05, 'lambda_val': 2.214240854863183e-06, 'batch_size': 1413, 'optimizer': 'SGD'}.
2026-06-28 01:06:23,967 - experiment_functions - INFO - Early stopping at epoch 3800. Best Metrics: (0.023883484251686408, 0.005129836825408886, 0.014011588372460927)
2026-06-28 01:06:24,064 - optuna.study.study - INFO - Trial 144 finished with values: [0.023883484251686408, 0.005129836825408886, 0.014011588372460927] and parameters: {'n_layers': 1, 'embedding_dim': 32, 'lr': 0.005739501470387607, 'lambda_val': 0.000307769265113033, 'batch_size': 3817, 'optimizer': 'Adam'}.
2026-06-28 01:11:59,517 - optuna.study.study - INFO - Trial 145 finished with values: [0.014943967804928064, 0.0033290276010105807, 0.008954419338118006] and parameters: {'n_layers': 1, 'embedding_dim': 64, 'lr': 0.018682831918637316, 'lambda_val': 6.447923168817336e-05, 'batch_size': 2978, 'optimizer': 'Adam'}.
2026-06-28 01:18:45,024 - optuna.study.study - INFO - Trial 146 finished with values: [0.014097411254217885, 0.003353722242273427, 0.00840546837822258] and parameters: {'n_layers': 4, 'embedding_dim': 64, 'lr': 0.0005928900750652104, 'lambda_val': 1.0416486521122021e-05, 'batch_size': 4033, 'optimizer': 'RMSprop'}.
2026-06-28 01:24:07,989 - optuna.study.study - INFO - Trial 147 finished with values: [0.014501520847724086, 0.0033033831658530093, 0.00858987102250868] and parameters: {'n_layers': 1, 'embedding_dim': 32, 'lr': 0.01636069874707295, 'lambda_val': 0.0003312399156887171, 'batch_size': 2978, 'optimizer': 'RMSprop'}.
2026-06-28 01:30:29,760 - optuna.study.study - INFO - Trial 148 finished with values: [0.016121810626133416, 0.003560777311323443, 0.009274034212757042] and parameters: {'n_layers': 2, 'embedding_dim': 96, 'lr': 0.005739501470387607, 'lambda_val': 0.0006043567828314722, 'batch_size': 2292, 'optimizer': 'RMSprop'}.
2026-06-28 01:31:33,592 - experiment_functions - INFO - Early stopping at epoch 500. Best Metrics: (0.0002043755986601008, 6.078680926239006e-05, 0.00011513942097453818)
2026-06-28 01:31:33,695 - optuna.study.study - INFO - Trial 149 finished with values: [0.0002043755986601008, 6.078680926239006e-05, 0.00011513942097453818] and parameters: {'n_layers': 2, 'embedding_dim': 256, 'lr': 0.000242059070964804, 'lambda_val': 0.00016988289577808146, 'batch_size': 4065, 'optimizer': 'SGD'}.
2026-06-28 01:37:15,888 - optuna.study.study - INFO - Trial 150 finished with values: [0.0022322630780348494, 0.0006563075812548678, 0.0014812556715666234] and parameters: {'n_layers': 1, 'embedding_dim': 96, 'lr': 0.0003870670578702054, 'lambda_val': 0.0006043567828314722, 'batch_size': 3568, 'optimizer': 'Adam'}.
2026-06-28 01:43:23,652 - optuna.study.study - INFO - Trial 151 finished with values: [0.028177906734218706, 0.00605778546055506, 0.016800278186983684] and parameters: {'n_layers': 1, 'embedding_dim': 128, 'lr': 0.005739501470387607, 'lambda_val': 3.2651363553563376e-05, 'batch_size': 4066, 'optimizer': 'Adam'}.
2026-06-28 01:49:15,734 - optuna.study.study - INFO - Trial 152 finished with values: [0.03005460864316097, 0.006737837889178049, 0.01843845513914022] and parameters: {'n_layers': 1, 'embedding_dim': 96, 'lr': 0.001948110338269317, 'lambda_val': 6.447923168817336e-05, 'batch_size': 2430, 'optimizer': 'Adam'}.
2026-06-28 01:55:07,695 - optuna.study.study - INFO - Trial 153 finished with values: [0.02861481227294063, 0.006408259407708527, 0.017358417210900128] and parameters: {'n_layers': 1, 'embedding_dim': 96, 'lr': 0.001948110338269317, 'lambda_val': 6.447923168817336e-05, 'batch_size': 2292, 'optimizer': 'Adam'}.
2026-06-28 02:00:56,910 - optuna.study.study - INFO - Trial 154 finished with values: [0.018420867859132637, 0.004073666014474859, 0.011386992675722402] and parameters: {'n_layers': 1, 'embedding_dim': 96, 'lr': 0.01636069874707295, 'lambda_val': 6.447923168817336e-05, 'batch_size': 3419, 'optimizer': 'RMSprop'}.
