2026-07-05 09:13:31,230 - optuna.study.study - INFO - Trial 221 finished with values: [0.014818505840305371, 0.0033090819292213593, 0.008619057715032036] and parameters: {'n_layers': 3, 'embedding_dim': 64, 'lr': 0.008715315659881847, 'lambda_val': 1.1407948092996293e-06, 'batch_size': 3636, 'optimizer': 'RMSprop'}.
2026-07-05 09:19:16,022 - optuna.study.study - INFO - Trial 222 finished with values: [0.01139268370375466, 0.002562543927967631, 0.006777286727669801] and parameters: {'n_layers': 4, 'embedding_dim': 64, 'lr': 0.0017671653194099594, 'lambda_val': 2.7629412628671407e-05, 'batch_size': 2137, 'optimizer': 'RMSprop'}.
2026-07-05 09:27:35,795 - optuna.study.study - INFO - Trial 223 finished with values: [0.01155733223890212, 0.00244476948502175, 0.006790484467454547] and parameters: {'n_layers': 4, 'embedding_dim': 256, 'lr': 0.021317035601398873, 'lambda_val': 7.045045135561742e-06, 'batch_size': 2808, 'optimizer': 'Adam'}.
2026-07-05 09:28:19,682 - experiment_functions - INFO - Early stopping at epoch 500. Best Metrics: (0.00018610557082723294, 4.7489694736242234e-05, 0.00010127610226275592)
2026-07-05 09:28:19,778 - optuna.study.study - INFO - Trial 224 finished with values: [0.00018610557082723294, 4.7489694736242234e-05, 0.00010127610226275592] and parameters: {'n_layers': 1, 'embedding_dim': 128, 'lr': 0.00041214572618093043, 'lambda_val': 1.4382423490445773e-06, 'batch_size': 2864, 'optimizer': 'SGD'}.
2026-07-05 09:34:35,555 - optuna.study.study - INFO - Trial 225 finished with values: [0.02420090870908039, 0.0052751552913017875, 0.014501508311257735] and parameters: {'n_layers': 1, 'embedding_dim': 256, 'lr': 0.0028256479959556857, 'lambda_val': 9.719335288636405e-05, 'batch_size': 1645, 'optimizer': 'Adam'}.
2026-07-05 09:36:21,989 - experiment_functions - INFO - Early stopping at epoch 900. Best Metrics: (0.008423660389535457, 0.0018748931481868435, 0.004791214525788441)
2026-07-05 09:36:22,074 - optuna.study.study - INFO - Trial 226 finished with values: [0.008423660389535457, 0.0018748931481868435, 0.004791214525788441] and parameters: {'n_layers': 3, 'embedding_dim': 256, 'lr': 0.0028256479959556857, 'lambda_val': 0.005128289632509461, 'batch_size': 3221, 'optimizer': 'Adam'}.
2026-07-05 09:39:22,414 - experiment_functions - INFO - Early stopping at epoch 2200. Best Metrics: (0.014294630222604085, 0.003097277890697719, 0.008406835925989788)
2026-07-05 09:39:22,494 - optuna.study.study - INFO - Trial 227 finished with values: [0.014294630222604085, 0.003097277890697719, 0.008406835925989788] and parameters: {'n_layers': 1, 'embedding_dim': 96, 'lr': 0.012629772595771391, 'lambda_val': 1.1570432281383126e-06, 'batch_size': 2702, 'optimizer': 'Adam'}.
2026-07-05 09:45:31,160 - optuna.study.study - INFO - Trial 228 finished with values: [0.009156061351346964, 0.002342191744391467, 0.005820541528891983] and parameters: {'n_layers': 1, 'embedding_dim': 256, 'lr': 0.0008623840834654643, 'lambda_val': 4.331327481478862e-06, 'batch_size': 1406, 'optimizer': 'Adam'}.
2026-07-05 09:51:47,759 - optuna.study.study - INFO - Trial 229 finished with values: [0.025360933891156144, 0.005578139543719013, 0.01520416920602264] and parameters: {'n_layers': 1, 'embedding_dim': 256, 'lr': 0.0028256479959556857, 'lambda_val': 9.719335288636405e-05, 'batch_size': 1931, 'optimizer': 'Adam'}.
2026-07-05 09:57:22,054 - optuna.study.study - INFO - Trial 230 finished with values: [0.021331398168857416, 0.004686283076572385, 0.012746373586611504] and parameters: {'n_layers': 1, 'embedding_dim': 128, 'lr': 0.004947459881909782, 'lambda_val': 0.00018323335848083124, 'batch_size': 2137, 'optimizer': 'RMSprop'}.
2026-07-05 10:03:34,499 - optuna.study.study - INFO - Trial 231 finished with values: [0.01828367107345659, 0.0041268544725794505, 0.011088843184480668] and parameters: {'n_layers': 1, 'embedding_dim': 256, 'lr': 0.008715315659881847, 'lambda_val': 0.0001483339453277888, 'batch_size': 3239, 'optimizer': 'RMSprop'}.
2026-07-05 10:08:50,925 - optuna.study.study - INFO - Trial 232 finished with values: [0.021219118042551534, 0.00486199494709648, 0.012956311079832857] and parameters: {'n_layers': 1, 'embedding_dim': 64, 'lr': 0.0015091555359142122, 'lambda_val': 2.9920385603702593e-06, 'batch_size': 3191, 'optimizer': 'RMSprop'}.
2026-07-05 10:17:10,242 - optuna.study.study - INFO - Trial 233 finished with values: [0.01435739851161589, 0.003392663791957146, 0.008610130795681072] and parameters: {'n_layers': 4, 'embedding_dim': 256, 'lr': 0.00046184078404352654, 'lambda_val': 1.491644569541864e-06, 'batch_size': 1923, 'optimizer': 'RMSprop'}.
2026-07-05 10:23:19,303 - optuna.study.study - INFO - Trial 234 finished with values: [0.014057730832162049, 0.0032188515092224992, 0.00860888095796307] and parameters: {'n_layers': 1, 'embedding_dim': 256, 'lr': 0.011027906958586966, 'lambda_val': 1.138243802328125e-05, 'batch_size': 1645, 'optimizer': 'RMSprop'}.
2026-07-05 10:28:55,528 - optuna.study.study - INFO - Trial 235 finished with values: [0.023180158421954998, 0.004976920008358187, 0.013378519507081774] and parameters: {'n_layers': 1, 'embedding_dim': 128, 'lr': 0.004947459881909782, 'lambda_val': 2.075496652412749e-05, 'batch_size': 3907, 'optimizer': 'RMSprop'}.
2026-07-05 10:35:11,381 - optuna.study.study - INFO - Trial 236 finished with values: [0.02839064318976953, 0.006006496590239918, 0.016821526651406] and parameters: {'n_layers': 1, 'embedding_dim': 256, 'lr': 0.0028256479959556857, 'lambda_val': 1.4514407124820874e-06, 'batch_size': 3907, 'optimizer': 'RMSprop'}.
2026-07-05 10:40:38,823 - optuna.study.study - INFO - Trial 237 finished with values: [0.025444831861786903, 0.005458465512983683, 0.01491556977231728] and parameters: {'n_layers': 1, 'embedding_dim': 96, 'lr': 0.0028256479959556857, 'lambda_val': 2.9920385603702593e-06, 'batch_size': 2702, 'optimizer': 'RMSprop'}.
2026-07-05 10:46:12,223 - optuna.study.study - INFO - Trial 238 finished with values: [0.02001369017796624, 0.004416541610470528, 0.011740945212663096] and parameters: {'n_layers': 1, 'embedding_dim': 128, 'lr': 0.004313984522769102, 'lambda_val': 0.0001483339453277888, 'batch_size': 953, 'optimizer': 'RMSprop'}.
2026-07-05 10:47:41,583 - experiment_functions - INFO - Early stopping at epoch 950. Best Metrics: (0.0002049715245303167, 5.128887031514161e-05, 0.00013537216768508707)
2026-07-05 10:47:41,668 - optuna.study.study - INFO - Trial 239 finished with values: [0.0002049715245303167, 5.128887031514161e-05, 0.00013537216768508707] and parameters: {'n_layers': 1, 'embedding_dim': 256, 'lr': 3.0671459915930276e-05, 'lambda_val': 9.719335288636405e-05, 'batch_size': 2137, 'optimizer': 'RMSprop'}.
2026-07-05 10:53:24,929 - optuna.study.study - INFO - Trial 240 finished with values: [0.020753035949307688, 0.004562809870258155, 0.012173541313055265] and parameters: {'n_layers': 2, 'embedding_dim': 96, 'lr': 0.0015091555359142122, 'lambda_val': 2.3028734947350154e-05, 'batch_size': 3411, 'optimizer': 'RMSprop'}.
2026-07-05 10:58:59,444 - optuna.study.study - INFO - Trial 241 finished with values: [0.022341470876397675, 0.004796459168360466, 0.0130583582015855] and parameters: {'n_layers': 1, 'embedding_dim': 128, 'lr': 0.004947459881909782, 'lambda_val': 2.3028734947350154e-05, 'batch_size': 2098, 'optimizer': 'RMSprop'}.
2026-07-05 10:59:43,646 - experiment_functions - INFO - Early stopping at epoch 500. Best Metrics: (0.0002446486102761386, 6.838516042018881e-05, 0.00014113082421991148)
2026-07-05 10:59:44,003 - optuna.study.study - INFO - Trial 242 finished with values: [0.0002446486102761386, 6.838516042018881e-05, 0.00014113082421991148] and parameters: {'n_layers': 1, 'embedding_dim': 128, 'lr': 0.004947459881909782, 'lambda_val': 0.005128289632509461, 'batch_size': 846, 'optimizer': 'SGD'}.
2026-07-05 11:05:17,077 - optuna.study.study - INFO - Trial 243 finished with values: [0.017257836800496456, 0.003911251258476911, 0.010192138475853967] and parameters: {'n_layers': 1, 'embedding_dim': 128, 'lr': 0.0028256479959556857, 'lambda_val': 0.005128289632509461, 'batch_size': 2247, 'optimizer': 'RMSprop'}.
2026-07-05 11:10:34,636 - optuna.study.study - INFO - Trial 244 finished with values: [0.024959416699201768, 0.005562942841403416, 0.015083047388476621] and parameters: {'n_layers': 1, 'embedding_dim': 64, 'lr': 0.0027287091631692877, 'lambda_val': 6.836101180852533e-05, 'batch_size': 2864, 'optimizer': 'Adam'}.
2026-07-05 11:16:48,743 - optuna.study.study - INFO - Trial 245 finished with values: [0.02105795556509644, 0.004539065022890033, 0.012439055076363378] and parameters: {'n_layers': 1, 'embedding_dim': 256, 'lr': 0.004947459881909782, 'lambda_val': 1.4514407124820874e-06, 'batch_size': 1162, 'optimizer': 'Adam'}.
2026-07-05 11:21:26,403 - experiment_functions - INFO - Early stopping at epoch 3350. Best Metrics: (0.014471333965318129, 0.0034657979218509585, 0.00854936031648125)
2026-07-05 11:21:26,484 - optuna.study.study - INFO - Trial 246 finished with values: [0.014471333965318129, 0.0034657979218509585, 0.00854936031648125] and parameters: {'n_layers': 1, 'embedding_dim': 128, 'lr': 0.004313984522769102, 'lambda_val': 0.005128289632509461, 'batch_size': 2205, 'optimizer': 'RMSprop'}.
2026-07-05 11:27:35,052 - optuna.study.study - INFO - Trial 247 finished with values: [0.016250395106452733, 0.0036139657694280345, 0.009590019850167898] and parameters: {'n_layers': 1, 'embedding_dim': 256, 'lr': 0.008715315659881847, 'lambda_val': 1.5015851047570079e-05, 'batch_size': 958, 'optimizer': 'RMSprop'}.
2026-07-05 11:32:48,757 - optuna.study.study - INFO - Trial 248 finished with values: [0.018778776821750026, 0.004205687365841613, 0.011080485961738334] and parameters: {'n_layers': 1, 'embedding_dim': 64, 'lr': 0.004313984522769102, 'lambda_val': 0.0001483339453277888, 'batch_size': 953, 'optimizer': 'RMSprop'}.
2026-07-05 11:37:58,546 - optuna.study.study - INFO - Trial 249 finished with values: [0.010719982905014644, 0.00272115950838668, 0.006421929981454351] and parameters: {'n_layers': 1, 'embedding_dim': 64, 'lr': 0.07167055366810839, 'lambda_val': 0.0023013643954001, 'batch_size': 2864, 'optimizer': 'RMSprop'}.
2026-07-05 11:43:34,594 - optuna.study.study - INFO - Trial 250 finished with values: [0.02265420940118735, 0.004911384229622172, 0.013254269704778127] and parameters: {'n_layers': 1, 'embedding_dim': 128, 'lr': 0.0028256479959556857, 'lambda_val': 0.0014481008831556158, 'batch_size': 2702, 'optimizer': 'RMSprop'}.
2026-07-05 11:44:23,080 - experiment_functions - INFO - Early stopping at epoch 500. Best Metrics: (0.00018542772430586745, 5.603783978876583e-05, 0.00011110647459944426)
2026-07-05 11:44:23,177 - optuna.study.study - INFO - Trial 251 finished with values: [0.00018542772430586745, 5.603783978876583e-05, 0.00011110647459944426] and parameters: {'n_layers': 1, 'embedding_dim': 256, 'lr': 9.514330667034597e-05, 'lambda_val': 9.719335288636405e-05, 'batch_size': 1171, 'optimizer': 'SGD'}.
2026-07-05 11:50:41,117 - optuna.study.study - INFO - Trial 252 finished with values: [0.02622474830821095, 0.0056940143988754455, 0.015644819563511395] and parameters: {'n_layers': 1, 'embedding_dim': 256, 'lr': 0.0028256479959556857, 'lambda_val': 1.1678999044973737e-06, 'batch_size': 2620, 'optimizer': 'Adam'}.
2026-07-05 11:56:15,748 - optuna.study.study - INFO - Trial 253 finished with values: [0.022163591771048125, 0.004784111847729043, 0.013068095944291775] and parameters: {'n_layers': 1, 'embedding_dim': 128, 'lr': 0.004947459881909782, 'lambda_val': 0.00018323335848083124, 'batch_size': 2137, 'optimizer': 'RMSprop'}.
2026-07-05 12:03:13,441 - optuna.study.study - INFO - Trial 254 finished with values: [0.02257568981704194, 0.004841099481412534, 0.013284910898458801] and parameters: {'n_layers': 2, 'embedding_dim': 256, 'lr': 0.0017671653194099594, 'lambda_val': 4.331327481478862e-06, 'batch_size': 2291, 'optimizer': 'Adam'}.
2026-07-05 12:08:02,383 - experiment_functions - INFO - Early stopping at epoch 3450. Best Metrics: (0.02126669733938399, 0.0046093497710996715, 0.012421741933882229)
2026-07-05 12:08:02,525 - optuna.study.study - INFO - Trial 255 finished with values: [0.02126669733938399, 0.0046093497710996715, 0.012421741933882229] and parameters: {'n_layers': 1, 'embedding_dim': 128, 'lr': 0.004947459881909782, 'lambda_val': 2.075496652412749e-05, 'batch_size': 2251, 'optimizer': 'RMSprop'}.
2026-07-05 12:14:14,720 - optuna.study.study - INFO - Trial 256 finished with values: [0.013931487359571735, 0.0034999905020610526, 0.008642812181105337] and parameters: {'n_layers': 1, 'embedding_dim': 256, 'lr': 0.0007113126776581904, 'lambda_val': 7.045045135561742e-06, 'batch_size': 3907, 'optimizer': 'Adam'}.
2026-07-05 12:19:33,438 - optuna.study.study - INFO - Trial 257 finished with values: [0.00805201779235004, 0.0019337803696597839, 0.004711128789972467] and parameters: {'n_layers': 1, 'embedding_dim': 96, 'lr': 0.0028256479959556857, 'lambda_val': 0.027603777759492, 'batch_size': 1171, 'optimizer': 'RMSprop'}.
2026-07-05 12:25:45,091 - optuna.study.study - INFO - Trial 258 finished with values: [0.016747834786029737, 0.003965389510476227, 0.010110158326645403] and parameters: {'n_layers': 1, 'embedding_dim': 256, 'lr': 0.008715315659881847, 'lambda_val': 0.0029121308526850417, 'batch_size': 3239, 'optimizer': 'RMSprop'}.
2026-07-05 12:31:59,308 - optuna.study.study - INFO - Trial 259 finished with values: [0.026135207862029608, 0.005543946963508919, 0.015202641667601746] and parameters: {'n_layers': 1, 'embedding_dim': 256, 'lr': 0.0028256479959556857, 'lambda_val': 6.836101180852533e-05, 'batch_size': 1931, 'optimizer': 'RMSprop'}.
2026-07-05 12:32:58,659 - experiment_functions - INFO - Early stopping at epoch 600. Best Metrics: (0.007008452186311767, 0.0017637672625040366, 0.004296072691351218)
2026-07-05 12:32:58,745 - optuna.study.study - INFO - Trial 260 finished with values: [0.007008452186311767, 0.0017637672625040366, 0.004296072691351218] and parameters: {'n_layers': 1, 'embedding_dim': 256, 'lr': 0.02927922247848779, 'lambda_val': 6.836101180852533e-05, 'batch_size': 3707, 'optimizer': 'Adam'}.
2026-07-05 12:35:46,607 - experiment_functions - INFO - Early stopping at epoch 1800. Best Metrics: (0.00022394673260154493, 5.888722147294038e-05, 0.00014235616045518105)
2026-07-05 12:35:46,696 - optuna.study.study - INFO - Trial 261 finished with values: [0.00022394673260154493, 5.888722147294038e-05, 0.00014235616045518105] and parameters: {'n_layers': 1, 'embedding_dim': 256, 'lr': 1.8091895422047598e-05, 'lambda_val': 0.0028053825979420495, 'batch_size': 2864, 'optimizer': 'Adam'}.
2026-07-05 12:41:04,074 - optuna.study.study - INFO - Trial 262 finished with values: [0.022053649192777948, 0.0049968656801474085, 0.013404540250183467] and parameters: {'n_layers': 1, 'embedding_dim': 64, 'lr': 0.0028256479959556857, 'lambda_val': 3.959696507549483e-06, 'batch_size': 1645, 'optimizer': 'Adam'}.
2026-07-05 12:41:52,775 - experiment_functions - INFO - Early stopping at epoch 500. Best Metrics: (0.0003016817909411013, 7.028474820963851e-05, 0.00018731546659250193)
2026-07-05 12:41:52,873 - optuna.study.study - INFO - Trial 263 finished with values: [0.0003016817909411013, 7.028474820963851e-05, 0.00018731546659250193] and parameters: {'n_layers': 1, 'embedding_dim': 256, 'lr': 0.0028256479959556857, 'lambda_val': 3.959696507549483e-06, 'batch_size': 1645, 'optimizer': 'SGD'}.
2026-07-05 12:45:57,854 - experiment_functions - INFO - Early stopping at epoch 2600. Best Metrics: (0.017596828521694818, 0.003956841365423703, 0.01055742546816978)
2026-07-05 12:45:57,947 - optuna.study.study - INFO - Trial 264 finished with values: [0.017596828521694818, 0.003956841365423703, 0.01055742546816978] and parameters: {'n_layers': 1, 'embedding_dim': 256, 'lr': 0.00314525224106882, 'lambda_val': 0.005366059254216105, 'batch_size': 1931, 'optimizer': 'Adam'}.
2026-07-05 12:51:32,282 - optuna.study.study - INFO - Trial 265 finished with values: [0.021663098100419824, 0.00468533328267766, 0.012713399718591416] and parameters: {'n_layers': 1, 'embedding_dim': 128, 'lr': 0.004313984522769102, 'lambda_val': 0.0001483339453277888, 'batch_size': 1645, 'optimizer': 'RMSprop'}.
2026-07-05 12:57:19,966 - optuna.study.study - INFO - Trial 266 finished with values: [0.011906581305936416, 0.0026888665159660358, 0.006672202640867615] and parameters: {'n_layers': 4, 'embedding_dim': 64, 'lr': 0.004947459881909782, 'lambda_val': 0.00018323335848083124, 'batch_size': 2628, 'optimizer': 'RMSprop'}.
2026-07-05 13:02:46,426 - optuna.study.study - INFO - Trial 267 finished with values: [0.02148197461407618, 0.004669186786467337, 0.012622188306533895] and parameters: {'n_layers': 1, 'embedding_dim': 96, 'lr': 0.004947459881909782, 'lambda_val': 1.249247516373248e-05, 'batch_size': 3907, 'optimizer': 'RMSprop'}.
2026-07-05 13:08:11,718 - optuna.study.study - INFO - Trial 268 finished with values: [0.021091185800175716, 0.004524818114469161, 0.012132023336936389] and parameters: {'n_layers': 1, 'embedding_dim': 96, 'lr': 0.004947459881909782, 'lambda_val': 1.4115609594122773e-06, 'batch_size': 1645, 'optimizer': 'RMSprop'}.
2026-07-05 13:13:38,984 - optuna.study.study - INFO - Trial 269 finished with values: [0.025188381596312433, 0.005536348612351119, 0.014912550330264668] and parameters: {'n_layers': 1, 'embedding_dim': 96, 'lr': 0.0015091555359142122, 'lambda_val': 0.00016205252984653076, 'batch_size': 3907, 'optimizer': 'RMSprop'}.
2026-07-05 13:19:16,849 - optuna.study.study - INFO - Trial 270 finished with values: [0.02626980633016884, 0.00557529016203484, 0.015346361911805098] and parameters: {'n_layers': 1, 'embedding_dim': 128, 'lr': 0.0028256479959556857, 'lambda_val': 2.7629412628671407e-05, 'batch_size': 3907, 'optimizer': 'RMSprop'}.
2026-07-05 13:24:51,334 - optuna.study.study - INFO - Trial 271 finished with values: [0.022174657046712187, 0.004813555458465513, 0.012986422731328176] and parameters: {'n_layers': 1, 'embedding_dim': 128, 'lr': 0.004947459881909782, 'lambda_val': 1.138243802328125e-05, 'batch_size': 2098, 'optimizer': 'RMSprop'}.
2026-07-05 13:30:59,266 - optuna.study.study - INFO - Trial 272 finished with values: [0.0045998758662563555, 0.001149250612617062, 0.002885075381209848] and parameters: {'n_layers': 1, 'embedding_dim': 256, 'lr': 0.0004117746857541991, 'lambda_val': 4.331327481478862e-06, 'batch_size': 3931, 'optimizer': 'Adam'}.
2026-07-05 13:36:33,975 - optuna.study.study - INFO - Trial 273 finished with values: [0.01989836574715678, 0.004407043671523279, 0.01185994641529845] and parameters: {'n_layers': 1, 'embedding_dim': 128, 'lr': 0.004947459881909782, 'lambda_val': 0.00018323335848083124, 'batch_size': 1197, 'optimizer': 'Adam'}.
2026-07-05 13:41:39,170 - optuna.study.study - INFO - Trial 274 finished with values: [0.01690034569646352, 0.00394259445700283, 0.009827994573016164] and parameters: {'n_layers': 1, 'embedding_dim': 32, 'lr': 0.0015091555359142122, 'lambda_val': 1.491644569541864e-06, 'batch_size': 2702, 'optimizer': 'RMSprop'}.
2026-07-05 13:46:05,809 - experiment_functions - INFO - Early stopping at epoch 2900. Best Metrics: (0.002779192591763533, 0.000801626047147769, 0.0017012020035650855)
2026-07-05 13:46:05,933 - optuna.study.study - INFO - Trial 275 finished with values: [0.002779192591763533, 0.000801626047147769, 0.0017012020035650855] and parameters: {'n_layers': 1, 'embedding_dim': 256, 'lr': 0.0028256479959556857, 'lambda_val': 0.09112235343956966, 'batch_size': 1900, 'optimizer': 'Adam'}.
2026-07-05 13:51:40,903 - optuna.study.study - INFO - Trial 276 finished with values: [0.024095675121495158, 0.005398628497616018, 0.014579381217714635] and parameters: {'n_layers': 1, 'embedding_dim': 128, 'lr': 0.0017671653194099594, 'lambda_val': 2.7629412628671407e-05, 'batch_size': 2137, 'optimizer': 'RMSprop'}.
2026-07-05 13:56:50,318 - experiment_functions - INFO - Early stopping at epoch 3500. Best Metrics: (0.009711339375284051, 0.0022282164770244858, 0.005662982016098485)
2026-07-05 13:56:50,424 - optuna.study.study - INFO - Trial 277 finished with values: [0.009711339375284051, 0.0022282164770244858, 0.005662982016098485] and parameters: {'n_layers': 3, 'embedding_dim': 96, 'lr': 0.0028256479959556857, 'lambda_val': 0.0004248156166632058, 'batch_size': 953, 'optimizer': 'Adam'}.
2026-07-05 14:02:24,789 - optuna.study.study - INFO - Trial 278 finished with values: [0.020000970816069826, 0.004649241114678115, 0.012110736543903893] and parameters: {'n_layers': 1, 'embedding_dim': 128, 'lr': 0.0028256479959556857, 'lambda_val': 9.719335288636405e-05, 'batch_size': 953, 'optimizer': 'Adam'}.
2026-07-05 14:08:39,158 - optuna.study.study - INFO - Trial 279 finished with values: [0.020464955300538153, 0.004515320175521912, 0.012070800160817161] and parameters: {'n_layers': 1, 'embedding_dim': 256, 'lr': 0.004947459881909782, 'lambda_val': 1.4514407124820874e-06, 'batch_size': 1162, 'optimizer': 'Adam'}.
2026-07-05 14:13:48,919 - optuna.study.study - INFO - Trial 280 finished with values: [0.016885658774230664, 0.003810573105636077, 0.010039398760289428] and parameters: {'n_layers': 2, 'embedding_dim': 32, 'lr': 0.0017671653194099594, 'lambda_val': 1.4514407124820874e-06, 'batch_size': 2137, 'optimizer': 'RMSprop'}.
2026-07-05 14:19:13,247 - optuna.study.study - INFO - Trial 281 finished with values: [0.016949325965000286, 0.003781129494899607, 0.010260478038700022] and parameters: {'n_layers': 2, 'embedding_dim': 64, 'lr': 0.0017671653194099594, 'lambda_val': 7.045045135561742e-06, 'batch_size': 1645, 'optimizer': 'RMSprop'}.
2026-07-05 14:24:02,570 - experiment_functions - INFO - Early stopping at epoch 2300. Best Metrics: (0.010873834492566294, 0.0024656649507056967, 0.006212501016935584)
