2026-06-29 21:39:43,744 - optuna.study.study - INFO - Trial 44 finished with values: [0.00020862253135898328, 6.078680926239006e-05, 0.0001349347017179333] and parameters: {'n_layers': 1, 'embedding_dim': 32, 'lr': 0.0026233787042601255, 'lambda_val': 3.9206514264817366e-05, 'batch_size': 2047, 'optimizer': 'SGD'}.
2026-06-29 21:41:28,236 - experiment_functions - INFO - Early stopping at epoch 1400. Best Metrics: (0.0022309833397285385, 0.0004644492145204491, 0.0013963660084827848)
2026-06-29 21:41:28,376 - optuna.study.study - INFO - Trial 45 finished with values: [0.0022309833397285385, 0.0004644492145204491, 0.0013963660084827848] and parameters: {'n_layers': 1, 'embedding_dim': 32, 'lr': 0.002365530211589969, 'lambda_val': 6.696439606049452e-06, 'batch_size': 607, 'optimizer': 'Adam'}.
2026-06-29 21:42:13,762 - experiment_functions - INFO - Early stopping at epoch 500. Best Metrics: (0.00019135759653038479, 5.793742757821552e-05, 0.00010118615943678451)
2026-06-29 21:42:13,852 - optuna.study.study - INFO - Trial 46 finished with values: [0.00019135759653038479, 5.793742757821552e-05, 0.00010118615943678451] and parameters: {'n_layers': 1, 'embedding_dim': 256, 'lr': 2.9723068480936443e-05, 'lambda_val': 0.008340224912346914, 'batch_size': 667, 'optimizer': 'SGD'}.
2026-06-29 21:43:29,242 - experiment_functions - INFO - Early stopping at epoch 950. Best Metrics: (0.001426728247871752, 0.000348574359364018, 0.0009398209836618763)
2026-06-29 21:43:29,337 - optuna.study.study - INFO - Trial 47 finished with values: [0.001426728247871752, 0.000348574359364018, 0.0009398209836618763] and parameters: {'n_layers': 1, 'embedding_dim': 96, 'lr': 0.014443422489975663, 'lambda_val': 1.4993414708120436e-05, 'batch_size': 2746, 'optimizer': 'Adam'}.
2026-06-29 21:44:09,215 - experiment_functions - INFO - Early stopping at epoch 500. Best Metrics: (0.00020888241019265453, 5.6987633683490685e-05, 0.00011919562930605209)
2026-06-29 21:44:09,307 - optuna.study.study - INFO - Trial 48 finished with values: [0.00020888241019265453, 5.6987633683490685e-05, 0.00011919562930605209] and parameters: {'n_layers': 1, 'embedding_dim': 32, 'lr': 1.1390526828494613e-05, 'lambda_val': 0.010184670079017568, 'batch_size': 1795, 'optimizer': 'SGD'}.
2026-06-29 21:44:49,835 - experiment_functions - INFO - Early stopping at epoch 500. Best Metrics: (0.00020591478911876308, 5.9837015367665226e-05, 0.00012648753839198176)
2026-06-29 21:44:49,928 - optuna.study.study - INFO - Trial 49 finished with values: [0.00020591478911876308, 5.9837015367665226e-05, 0.00012648753839198176] and parameters: {'n_layers': 2, 'embedding_dim': 32, 'lr': 0.00331004334789819, 'lambda_val': 0.08585612397020126, 'batch_size': 3648, 'optimizer': 'SGD'}.
2026-06-29 21:45:30,434 - experiment_functions - INFO - Early stopping at epoch 500. Best Metrics: (0.00021975999941684963, 6.55357787360143e-05, 0.00013538501497927056)
2026-06-29 21:45:30,509 - optuna.study.study - INFO - Trial 50 finished with values: [0.00021975999941684963, 6.55357787360143e-05, 0.00013538501497927056] and parameters: {'n_layers': 3, 'embedding_dim': 32, 'lr': 1.9553689513569963e-05, 'lambda_val': 0.052526207766869525, 'batch_size': 1177, 'optimizer': 'SGD'}.
2026-06-29 21:46:15,176 - experiment_functions - INFO - Early stopping at epoch 500. Best Metrics: (0.00021830362774396059, 5.413825199931615e-05, 0.00010541375487133086)
2026-06-29 21:46:15,277 - optuna.study.study - INFO - Trial 51 finished with values: [0.00021830362774396059, 5.413825199931615e-05, 0.00010541375487133086] and parameters: {'n_layers': 4, 'embedding_dim': 96, 'lr': 0.0009496158639399897, 'lambda_val': 1.554897118169841e-06, 'batch_size': 2664, 'optimizer': 'SGD'}.
2026-06-29 21:47:09,656 - experiment_functions - INFO - Early stopping at epoch 700. Best Metrics: (0.00018787590117041146, 5.888722147294038e-05, 0.00011529346989027928)
2026-06-29 21:47:09,833 - optuna.study.study - INFO - Trial 52 finished with values: [0.00018787590117041146, 5.888722147294038e-05, 0.00011529346989027928] and parameters: {'n_layers': 1, 'embedding_dim': 32, 'lr': 2.5773622279305045e-05, 'lambda_val': 0.0005400904118495423, 'batch_size': 761, 'optimizer': 'RMSprop'}.
2026-06-29 21:50:06,813 - experiment_functions - INFO - Early stopping at epoch 1900. Best Metrics: (0.0014579825868819701, 0.0004597002450468249, 0.000990563511589769)
2026-06-29 21:50:06,890 - optuna.study.study - INFO - Trial 53 finished with values: [0.0014579825868819701, 0.0004597002450468249, 0.000990563511589769] and parameters: {'n_layers': 2, 'embedding_dim': 256, 'lr': 0.0013047089047836713, 'lambda_val': 0.05204272963685584, 'batch_size': 2274, 'optimizer': 'Adam'}.
2026-06-29 21:50:48,417 - experiment_functions - INFO - Early stopping at epoch 500. Best Metrics: (0.0002722317613680497, 6.933495431491368e-05, 0.0001644894654040197)
2026-06-29 21:50:48,766 - optuna.study.study - INFO - Trial 54 finished with values: [0.0002722317613680497, 6.933495431491368e-05, 0.0001644894654040197] and parameters: {'n_layers': 4, 'embedding_dim': 32, 'lr': 0.0003326962115608699, 'lambda_val': 0.08585612397020126, 'batch_size': 2809, 'optimizer': 'SGD'}.
2026-06-29 21:51:32,740 - experiment_functions - INFO - Early stopping at epoch 550. Best Metrics: (0.0010275925722833673, 0.0002830385806280037, 0.000701958158047618)
2026-06-29 21:51:32,822 - optuna.study.study - INFO - Trial 55 finished with values: [0.0010275925722833673, 0.0002830385806280037, 0.000701958158047618] and parameters: {'n_layers': 2, 'embedding_dim': 32, 'lr': 0.017351300430976352, 'lambda_val': 0.0001469814413818991, 'batch_size': 2809, 'optimizer': 'RMSprop'}.
2026-06-29 21:52:19,780 - experiment_functions - INFO - Early stopping at epoch 550. Best Metrics: (0.0016518586897147065, 0.00047204756567824786, 0.0011756082909184927)
2026-06-29 21:52:19,868 - optuna.study.study - INFO - Trial 56 finished with values: [0.0016518586897147065, 0.00047204756567824786, 0.0011756082909184927] and parameters: {'n_layers': 4, 'embedding_dim': 64, 'lr': 0.017351300430976352, 'lambda_val': 8.378994108262931e-05, 'batch_size': 3566, 'optimizer': 'RMSprop'}.
2026-06-29 21:53:00,549 - experiment_functions - INFO - Early stopping at epoch 500. Best Metrics: (0.00026019863319816567, 6.743536652546397e-05, 0.00015021723964639235)
2026-06-29 21:53:00,622 - optuna.study.study - INFO - Trial 57 finished with values: [0.00026019863319816567, 6.743536652546397e-05, 0.00015021723964639235] and parameters: {'n_layers': 2, 'embedding_dim': 32, 'lr': 1.1172703671405845e-05, 'lambda_val': 0.0034877418541278907, 'batch_size': 3622, 'optimizer': 'SGD'}.
2026-06-29 21:58:00,598 - optuna.study.study - INFO - Trial 58 finished with values: [0.0005208107987704179, 0.00012727238189312918, 0.00034456372787415633] and parameters: {'n_layers': 4, 'embedding_dim': 32, 'lr': 0.0001512479598847229, 'lambda_val': 4.420361838456624e-06, 'batch_size': 4090, 'optimizer': 'Adam'}.
2026-06-29 22:03:16,347 - optuna.study.study - INFO - Trial 59 finished with values: [0.001967118482200155, 0.0004900936496780199, 0.0013223231138631457] and parameters: {'n_layers': 4, 'embedding_dim': 64, 'lr': 0.0003326962115608699, 'lambda_val': 0.0001469814413818991, 'batch_size': 3827, 'optimizer': 'RMSprop'}.
2026-06-29 22:06:56,225 - experiment_functions - INFO - Early stopping at epoch 2700. Best Metrics: (0.001633632223240381, 0.00044735292441540185, 0.0010968181260185698)
2026-06-29 22:06:56,313 - optuna.study.study - INFO - Trial 60 finished with values: [0.001633632223240381, 0.00044735292441540185, 0.0010968181260185698] and parameters: {'n_layers': 2, 'embedding_dim': 128, 'lr': 0.0005030162275943933, 'lambda_val': 0.004495593710473149, 'batch_size': 4019, 'optimizer': 'RMSprop'}.
2026-06-29 22:07:41,659 - experiment_functions - INFO - Early stopping at epoch 500. Best Metrics: (0.00023194259323268968, 5.603783978876583e-05, 0.00015024901659375258)
2026-06-29 22:07:41,756 - optuna.study.study - INFO - Trial 61 finished with values: [0.00023194259323268968, 5.603783978876583e-05, 0.00015024901659375258] and parameters: {'n_layers': 1, 'embedding_dim': 256, 'lr': 0.0002346078961102155, 'lambda_val': 9.36393319586799e-05, 'batch_size': 2567, 'optimizer': 'SGD'}.
2026-06-29 22:08:36,693 - experiment_functions - INFO - Early stopping at epoch 500. Best Metrics: (0.00022480294227042487, 6.173660315711492e-05, 0.00011616484369669367)
2026-06-29 22:08:36,786 - optuna.study.study - INFO - Trial 62 finished with values: [0.00022480294227042487, 6.173660315711492e-05, 0.00011616484369669367] and parameters: {'n_layers': 4, 'embedding_dim': 256, 'lr': 2.2358086910332184e-05, 'lambda_val': 0.004495593710473149, 'batch_size': 4019, 'optimizer': 'SGD'}.
2026-06-29 22:09:23,760 - experiment_functions - INFO - Early stopping at epoch 550. Best Metrics: (0.0002316677412720782, 5.413825199931615e-05, 0.00013694802055842114)
2026-06-29 22:09:23,849 - optuna.study.study - INFO - Trial 63 finished with values: [0.0002316677412720782, 5.413825199931615e-05, 0.00013694802055842114] and parameters: {'n_layers': 4, 'embedding_dim': 64, 'lr': 3.8334407047671796e-05, 'lambda_val': 0.013627320500464371, 'batch_size': 1212, 'optimizer': 'Adam'}.
2026-06-29 22:10:30,733 - experiment_functions - INFO - Early stopping at epoch 650. Best Metrics: (0.0016750724498246204, 0.0005081397336777918, 0.0011957473429529476)
2026-06-29 22:10:30,865 - optuna.study.study - INFO - Trial 64 finished with values: [0.0016750724498246204, 0.0005081397336777918, 0.0011957473429529476] and parameters: {'n_layers': 3, 'embedding_dim': 256, 'lr': 0.02833621835555532, 'lambda_val': 1.554897118169841e-06, 'batch_size': 2664, 'optimizer': 'RMSprop'}.
2026-06-29 22:11:25,364 - experiment_functions - INFO - Early stopping at epoch 500. Best Metrics: (0.00022930392763159468, 5.7937427578215534e-05, 0.00013450031736604397)
2026-06-29 22:11:25,452 - optuna.study.study - INFO - Trial 65 finished with values: [0.00022930392763159468, 5.7937427578215534e-05, 0.00013450031736604397] and parameters: {'n_layers': 4, 'embedding_dim': 256, 'lr': 2.2358086910332184e-05, 'lambda_val': 2.6073206722937477e-06, 'batch_size': 1315, 'optimizer': 'SGD'}.
2026-06-29 22:12:10,730 - experiment_functions - INFO - Early stopping at epoch 500. Best Metrics: (0.0001568495393863323, 5.223866420986647e-05, 0.00010028211273548917)
2026-06-29 22:12:10,818 - optuna.study.study - INFO - Trial 66 finished with values: [0.0001568495393863323, 5.223866420986647e-05, 0.00010028211273548917] and parameters: {'n_layers': 3, 'embedding_dim': 128, 'lr': 0.0008813727724231659, 'lambda_val': 1.9539016523817146e-05, 'batch_size': 1347, 'optimizer': 'SGD'}.
2026-06-29 22:15:24,129 - experiment_functions - INFO - Early stopping at epoch 2650. Best Metrics: (0.00026183474029745974, 7.693330547271242e-05, 0.00017180954880127936)
2026-06-29 22:15:24,207 - optuna.study.study - INFO - Trial 67 finished with values: [0.00026183474029745974, 7.693330547271242e-05, 0.00017180954880127936] and parameters: {'n_layers': 1, 'embedding_dim': 32, 'lr': 4.1984616338291605e-05, 'lambda_val': 0.0001412866336858831, 'batch_size': 3566, 'optimizer': 'RMSprop'}.
2026-06-29 22:16:10,063 - experiment_functions - INFO - Early stopping at epoch 550. Best Metrics: (0.0012048652433223348, 0.0002991850768383261, 0.00079069423487383)
2026-06-29 22:16:10,132 - optuna.study.study - INFO - Trial 68 finished with values: [0.0012048652433223348, 0.0002991850768383261, 0.00079069423487383] and parameters: {'n_layers': 1, 'embedding_dim': 96, 'lr': 0.06936182342264759, 'lambda_val': 1.4993414708120436e-05, 'batch_size': 1472, 'optimizer': 'Adam'}.
2026-06-29 22:19:55,193 - experiment_functions - INFO - Early stopping at epoch 3050. Best Metrics: (0.0010532747094282142, 0.000348574359364018, 0.0007483896713730247)
2026-06-29 22:19:55,282 - optuna.study.study - INFO - Trial 69 finished with values: [0.0010532747094282142, 0.000348574359364018, 0.0007483896713730247] and parameters: {'n_layers': 2, 'embedding_dim': 32, 'lr': 0.00331004334789819, 'lambda_val': 0.08585612397020126, 'batch_size': 3648, 'optimizer': 'Adam'}.
2026-06-29 22:20:40,539 - experiment_functions - INFO - Early stopping at epoch 500. Best Metrics: (0.00023964543383510274, 6.933495431491366e-05, 0.00013640009907865512)
2026-06-29 22:20:40,625 - optuna.study.study - INFO - Trial 70 finished with values: [0.00023964543383510274, 6.933495431491366e-05, 0.00013640009907865512] and parameters: {'n_layers': 3, 'embedding_dim': 128, 'lr': 0.02833621835555532, 'lambda_val': 0.0034877418541278907, 'batch_size': 766, 'optimizer': 'SGD'}.
2026-06-29 22:22:25,506 - experiment_functions - INFO - Early stopping at epoch 1300. Best Metrics: (0.001933138901522745, 0.0005489808711509603, 0.0013007752203142802)
2026-06-29 22:22:25,598 - optuna.study.study - INFO - Trial 71 finished with values: [0.001933138901522745, 0.0005489808711509603, 0.0013007752203142802] and parameters: {'n_layers': 2, 'embedding_dim': 96, 'lr': 0.005084074098593243, 'lambda_val': 1.1813358915438924e-05, 'batch_size': 2346, 'optimizer': 'RMSprop'}.
2026-06-29 22:27:40,862 - optuna.study.study - INFO - Trial 72 finished with values: [0.002584381955077484, 0.0007123454210436335, 0.0017127145356847558] and parameters: {'n_layers': 4, 'embedding_dim': 64, 'lr': 0.0005030162275943933, 'lambda_val': 3.9206514264817366e-05, 'batch_size': 3604, 'optimizer': 'RMSprop'}.
2026-06-29 22:33:05,233 - optuna.study.study - INFO - Trial 73 finished with values: [0.0026719537470344004, 0.0007474877951484529, 0.0017874369389093035] and parameters: {'n_layers': 3, 'embedding_dim': 96, 'lr': 0.0019032891633152442, 'lambda_val': 1.4824096770292976e-06, 'batch_size': 620, 'optimizer': 'Adam'}.
2026-06-29 22:33:49,359 - experiment_functions - INFO - Early stopping at epoch 550. Best Metrics: (0.0011817497127187633, 0.00031058260357502427, 0.000758566199446323)
2026-06-29 22:33:49,437 - optuna.study.study - INFO - Trial 74 finished with values: [0.0011817497127187633, 0.00031058260357502427, 0.000758566199446323] and parameters: {'n_layers': 2, 'embedding_dim': 32, 'lr': 0.011476202823028593, 'lambda_val': 0.0034877418541278907, 'batch_size': 594, 'optimizer': 'RMSprop'}.
2026-06-29 22:34:36,584 - experiment_functions - INFO - Early stopping at epoch 550. Best Metrics: (0.001072080236943496, 0.0003229299242064472, 0.0007830482420671094)
2026-06-29 22:34:36,653 - optuna.study.study - INFO - Trial 75 finished with values: [0.001072080236943496, 0.0003229299242064472, 0.0007830482420671094] and parameters: {'n_layers': 4, 'embedding_dim': 64, 'lr': 0.013963397837397955, 'lambda_val': 0.035511336040904305, 'batch_size': 2986, 'optimizer': 'Adam'}.
2026-06-29 22:37:01,982 - experiment_functions - INFO - Early stopping at epoch 1700. Best Metrics: (0.0026419019675968936, 0.0007512869707273521, 0.0018556465978052557)
2026-06-29 22:37:02,072 - optuna.study.study - INFO - Trial 76 finished with values: [0.0026419019675968936, 0.0007512869707273521, 0.0018556465978052557] and parameters: {'n_layers': 3, 'embedding_dim': 128, 'lr': 0.0013047089047836713, 'lambda_val': 3.423463120625302e-05, 'batch_size': 2836, 'optimizer': 'RMSprop'}.
2026-06-29 22:37:48,601 - experiment_functions - INFO - Early stopping at epoch 500. Best Metrics: (0.00024987525430773794, 6.648557263073913e-05, 0.0001454339250281159)
2026-06-29 22:37:48,676 - optuna.study.study - INFO - Trial 77 finished with values: [0.00024987525430773794, 6.648557263073913e-05, 0.0001454339250281159] and parameters: {'n_layers': 4, 'embedding_dim': 128, 'lr': 0.014414361625223582, 'lambda_val': 0.00040284199994133397, 'batch_size': 4019, 'optimizer': 'SGD'}.
2026-06-29 22:38:31,648 - experiment_functions - INFO - Early stopping at epoch 500. Best Metrics: (0.0002316677412720782, 5.413825199931615e-05, 0.00013583135596419792)
2026-06-29 22:38:31,723 - optuna.study.study - INFO - Trial 78 finished with values: [0.0002316677412720782, 5.413825199931615e-05, 0.00013583135596419792] and parameters: {'n_layers': 4, 'embedding_dim': 64, 'lr': 0.0005030162275943933, 'lambda_val': 0.0009457526726407804, 'batch_size': 2642, 'optimizer': 'SGD'}.
2026-06-29 22:39:13,113 - experiment_functions - INFO - Early stopping at epoch 500. Best Metrics: (0.00020416915090837375, 5.603783978876584e-05, 0.00011057137736052229)
2026-06-29 22:39:13,196 - optuna.study.study - INFO - Trial 79 finished with values: [0.00020416915090837375, 5.603783978876584e-05, 0.00011057137736052229] and parameters: {'n_layers': 1, 'embedding_dim': 96, 'lr': 2.9723068480936443e-05, 'lambda_val': 0.008340224912346914, 'batch_size': 667, 'optimizer': 'SGD'}.
2026-06-29 22:40:04,833 - experiment_functions - INFO - Early stopping at epoch 650. Best Metrics: (0.00022437941639156966, 5.128887031514161e-05, 0.00011593304555246862)
2026-06-29 22:40:05,864 - optuna.study.study - INFO - Trial 80 finished with values: [0.00022437941639156966, 5.128887031514161e-05, 0.00011593304555246862] and parameters: {'n_layers': 3, 'embedding_dim': 32, 'lr': 0.00011992795516299757, 'lambda_val': 0.03306247440749874, 'batch_size': 3028, 'optimizer': 'Adam'}.
2026-06-29 22:40:54,996 - experiment_functions - INFO - Early stopping at epoch 500. Best Metrics: (0.00017784523103017325, 5.223866420986647e-05, 0.00011772611939864049)
2026-06-29 22:40:55,112 - optuna.study.study - INFO - Trial 81 finished with values: [0.00017784523103017325, 5.223866420986647e-05, 0.00011772611939864049] and parameters: {'n_layers': 1, 'embedding_dim': 32, 'lr': 0.0001512479598847229, 'lambda_val': 4.420361838456624e-06, 'batch_size': 1257, 'optimizer': 'SGD'}.
2026-06-29 22:41:49,546 - experiment_functions - INFO - Early stopping at epoch 500. Best Metrics: (0.00017378485398632048, 4.274072526261801e-05, 9.24318827330559e-05)
2026-06-29 22:41:49,614 - optuna.study.study - INFO - Trial 82 finished with values: [0.00017378485398632048, 4.274072526261801e-05, 9.24318827330559e-05] and parameters: {'n_layers': 3, 'embedding_dim': 256, 'lr': 0.0013047089047836713, 'lambda_val': 0.052526207766869525, 'batch_size': 1067, 'optimizer': 'SGD'}.
2026-06-29 22:47:25,149 - optuna.study.study - INFO - Trial 83 finished with values: [0.0005675346934239545, 0.00012442300020895468, 0.00032272658018665535] and parameters: {'n_layers': 3, 'embedding_dim': 128, 'lr': 0.0001512479598847229, 'lambda_val': 0.0005613082418791808, 'batch_size': 1698, 'optimizer': 'Adam'}.
2026-06-29 22:48:10,262 - experiment_functions - INFO - Early stopping at epoch 500. Best Metrics: (0.0001980621292106639, 5.223866420986647e-05, 0.0001246086623647689)
2026-06-29 22:48:10,353 - optuna.study.study - INFO - Trial 84 finished with values: [0.0001980621292106639, 5.223866420986647e-05, 0.0001246086623647689] and parameters: {'n_layers': 4, 'embedding_dim': 96, 'lr': 3.8334407047671796e-05, 'lambda_val': 0.0019420686804081744, 'batch_size': 1212, 'optimizer': 'Adam'}.
2026-06-29 22:53:13,907 - optuna.study.study - INFO - Trial 85 finished with values: [0.0008030789912810868, 0.0001975571301027677, 0.0005233461889728405] and parameters: {'n_layers': 2, 'embedding_dim': 64, 'lr': 0.00019631821053048875, 'lambda_val': 3.423463120625302e-05, 'batch_size': 3498, 'optimizer': 'Adam'}.
2026-06-29 22:54:05,501 - experiment_functions - INFO - Early stopping at epoch 550. Best Metrics: (0.0015071956734688222, 0.00046159983283627454, 0.001025634778119184)
2026-06-29 22:54:05,574 - optuna.study.study - INFO - Trial 86 finished with values: [0.0015071956734688222, 0.00046159983283627454, 0.001025634778119184] and parameters: {'n_layers': 4, 'embedding_dim': 128, 'lr': 0.01061027311546988, 'lambda_val': 0.0024351223150280593, 'batch_size': 4019, 'optimizer': 'RMSprop'}.
2026-06-29 22:56:42,620 - experiment_functions - INFO - Early stopping at epoch 1500. Best Metrics: (0.002435082799593971, 0.0007056968637805596, 0.0016435356534223653)
2026-06-29 22:56:42,729 - optuna.study.study - INFO - Trial 87 finished with values: [0.002435082799593971, 0.0007056968637805596, 0.0016435356534223653] and parameters: {'n_layers': 4, 'embedding_dim': 256, 'lr': 0.003551859771094245, 'lambda_val': 1.582941209280553e-06, 'batch_size': 761, 'optimizer': 'RMSprop'}.
2026-06-29 22:57:22,669 - experiment_functions - INFO - Early stopping at epoch 500. Best Metrics: (0.0001838285984670754, 5.033907642041677e-05, 0.00011185240319257653)
2026-06-29 22:57:22,756 - optuna.study.study - INFO - Trial 88 finished with values: [0.0001838285984670754, 5.033907642041677e-05, 0.00011185240319257653] and parameters: {'n_layers': 2, 'embedding_dim': 32, 'lr': 1.1390526828494613e-05, 'lambda_val': 0.001531971082798087, 'batch_size': 760, 'optimizer': 'SGD'}.
2026-06-29 22:58:32,743 - experiment_functions - INFO - Early stopping at epoch 850. Best Metrics: (0.00141171689240617, 0.0004008130235738844, 0.0009817165901793053)
2026-06-29 22:58:32,805 - optuna.study.study - INFO - Trial 89 finished with values: [0.00141171689240617, 0.0004008130235738844, 0.0009817165901793053] and parameters: {'n_layers': 2, 'embedding_dim': 96, 'lr': 0.005817892184311597, 'lambda_val': 0.0034877418541278907, 'batch_size': 594, 'optimizer': 'Adam'}.
2026-06-29 23:00:18,729 - experiment_functions - INFO - Early stopping at epoch 1250. Best Metrics: (0.001155167462922678, 0.0003808673517846627, 0.0008028477478765145)
2026-06-29 23:00:18,805 - optuna.study.study - INFO - Trial 90 finished with values: [0.001155167462922678, 0.0003808673517846627, 0.0008028477478765145] and parameters: {'n_layers': 4, 'embedding_dim': 96, 'lr': 0.014443422489975663, 'lambda_val': 0.012791585416026822, 'batch_size': 2746, 'optimizer': 'RMSprop'}.
2026-06-29 23:01:14,628 - experiment_functions - INFO - Early stopping at epoch 500. Best Metrics: (0.0009467747749702256, 0.0002801891989438292, 0.0007566445317642095)
