2026-06-29 15:19:51,975 - optuna.study.study - INFO - Trial 117 finished with values: [0.00038920650252560984, 0.00018520980947134467, 0.00030492661015517526] and parameters: {'n_layers': 1, 'embedding_dim': 32, 'lr': 0.0951182596909589, 'lambda_val': 0.0004244982241785935, 'batch_size': 2994, 'optimizer': 'Adam'}.
2026-06-29 15:20:32,040 - experiment_functions - INFO - Early stopping at epoch 500. Best Metrics: (0.00016819026882610312, 5.413825199931615e-05, 0.00010203832853517208)
2026-06-29 15:20:32,131 - optuna.study.study - INFO - Trial 118 finished with values: [0.00016819026882610312, 5.413825199931615e-05, 0.00010203832853517208] and parameters: {'n_layers': 1, 'embedding_dim': 32, 'lr': 0.005466403487028649, 'lambda_val': 0.0010713582144552649, 'batch_size': 4079, 'optimizer': 'SGD'}.
2026-06-29 15:22:47,958 - experiment_functions - INFO - Early stopping at epoch 1750. Best Metrics: (0.0031545347806484743, 0.0009630910092509926, 0.002055571810575329)
2026-06-29 15:22:48,026 - optuna.study.study - INFO - Trial 119 finished with values: [0.0031545347806484743, 0.0009630910092509926, 0.002055571810575329] and parameters: {'n_layers': 1, 'embedding_dim': 96, 'lr': 0.0007886779079223827, 'lambda_val': 0.0004244982241785935, 'batch_size': 995, 'optimizer': 'Adam'}.
2026-06-29 15:23:35,861 - experiment_functions - INFO - Early stopping at epoch 500. Best Metrics: (0.00101629370682134, 0.0003628212677848907, 0.000692510312212358)
2026-06-29 15:23:35,946 - optuna.study.study - INFO - Trial 120 finished with values: [0.00101629370682134, 0.0003628212677848907, 0.000692510312212358] and parameters: {'n_layers': 2, 'embedding_dim': 256, 'lr': 0.0951182596909589, 'lambda_val': 0.0045158154821205955, 'batch_size': 831, 'optimizer': 'RMSprop'}.
2026-06-29 15:24:16,439 - experiment_functions - INFO - Early stopping at epoch 500. Best Metrics: (0.00027992150259499127, 7.693330547271244e-05, 0.00015135884349442322)
2026-06-29 15:24:17,369 - optuna.study.study - INFO - Trial 121 finished with values: [0.00027992150259499127, 7.693330547271244e-05, 0.00015135884349442322] and parameters: {'n_layers': 3, 'embedding_dim': 32, 'lr': 0.0001976293616470771, 'lambda_val': 0.00021554704163262878, 'batch_size': 2954, 'optimizer': 'SGD'}.
2026-06-29 15:25:03,676 - experiment_functions - INFO - Early stopping at epoch 500. Best Metrics: (0.0010838595149838964, 0.00028588796231217826, 0.0006763992201564649)
2026-06-29 15:25:03,752 - optuna.study.study - INFO - Trial 122 finished with values: [0.0010838595149838964, 0.00028588796231217826, 0.0006763992201564649] and parameters: {'n_layers': 4, 'embedding_dim': 128, 'lr': 0.018335519634559577, 'lambda_val': 0.0004244982241785935, 'batch_size': 3639, 'optimizer': 'RMSprop'}.
2026-06-29 15:25:46,004 - experiment_functions - INFO - Early stopping at epoch 500. Best Metrics: (0.0002549847878761653, 6.268639705183975e-05, 0.00014956456457081632)
2026-06-29 15:25:46,082 - optuna.study.study - INFO - Trial 123 finished with values: [0.0002549847878761653, 6.268639705183975e-05, 0.00014956456457081632] and parameters: {'n_layers': 4, 'embedding_dim': 64, 'lr': 0.011256430418064723, 'lambda_val': 0.0004244982241785935, 'batch_size': 2321, 'optimizer': 'SGD'}.
2026-06-29 15:26:30,494 - experiment_functions - INFO - Early stopping at epoch 500. Best Metrics: (0.00027144111167415775, 6.648557263073914e-05, 0.00014419211771233122)
2026-06-29 15:26:31,232 - optuna.study.study - INFO - Trial 124 finished with values: [0.00027144111167415775, 6.648557263073914e-05, 0.00014419211771233122] and parameters: {'n_layers': 3, 'embedding_dim': 128, 'lr': 0.0007886779079223827, 'lambda_val': 0.043836516646315986, 'batch_size': 1811, 'optimizer': 'SGD'}.
2026-06-29 15:27:30,753 - experiment_functions - INFO - Early stopping at epoch 700. Best Metrics: (0.0017258388382674656, 0.0005005413825199932, 0.0011340318172091547)
2026-06-29 15:27:30,825 - optuna.study.study - INFO - Trial 125 finished with values: [0.0017258388382674656, 0.0005005413825199932, 0.0011340318172091547] and parameters: {'n_layers': 2, 'embedding_dim': 128, 'lr': 0.0007549780410006504, 'lambda_val': 0.002101784363136079, 'batch_size': 1999, 'optimizer': 'RMSprop'}.
2026-06-29 15:29:52,484 - experiment_functions - INFO - Early stopping at epoch 1800. Best Metrics: (0.0027926620939835983, 0.0008947058488308037, 0.001913646232956209)
2026-06-29 15:29:52,563 - optuna.study.study - INFO - Trial 126 finished with values: [0.0027926620939835983, 0.0008947058488308037, 0.001913646232956209] and parameters: {'n_layers': 1, 'embedding_dim': 128, 'lr': 0.0007556847336647807, 'lambda_val': 3.159634083184005e-05, 'batch_size': 1473, 'optimizer': 'Adam'}.
2026-06-29 15:30:41,203 - experiment_functions - INFO - Early stopping at epoch 600. Best Metrics: (0.0003756604862114923, 0.0001415192903140019, 0.0002618123236433324)
2026-06-29 15:30:41,331 - optuna.study.study - INFO - Trial 127 finished with values: [0.0003756604862114923, 0.0001415192903140019, 0.0002618123236433324] and parameters: {'n_layers': 2, 'embedding_dim': 64, 'lr': 0.0007886779079223827, 'lambda_val': 0.028535148638905668, 'batch_size': 3561, 'optimizer': 'RMSprop'}.
2026-06-29 15:31:23,976 - experiment_functions - INFO - Early stopping at epoch 500. Best Metrics: (0.0011916194977452793, 0.000287787550101628, 0.0007071950775351356)
2026-06-29 15:31:24,070 - optuna.study.study - INFO - Trial 128 finished with values: [0.0011916194977452793, 0.000287787550101628, 0.0007071950775351356] and parameters: {'n_layers': 4, 'embedding_dim': 64, 'lr': 0.07945214517899378, 'lambda_val': 5.3222531406855436e-05, 'batch_size': 3561, 'optimizer': 'RMSprop'}.
2026-06-29 15:32:52,399 - experiment_functions - INFO - Early stopping at epoch 1150. Best Metrics: (0.00029557436558923944, 0.00015291681705069998, 0.00024287604256397545)
2026-06-29 15:32:52,496 - optuna.study.study - INFO - Trial 129 finished with values: [0.00029557436558923944, 0.00015291681705069998, 0.00024287604256397545] and parameters: {'n_layers': 3, 'embedding_dim': 32, 'lr': 0.018335519634559577, 'lambda_val': 0.007998340389978697, 'batch_size': 4012, 'optimizer': 'RMSprop'}.
2026-06-29 15:33:34,672 - experiment_functions - INFO - Early stopping at epoch 500. Best Metrics: (0.000621836627114347, 0.00019090857283969375, 0.00044678968184284397)
2026-06-29 15:33:34,777 - optuna.study.study - INFO - Trial 130 finished with values: [0.000621836627114347, 0.00019090857283969375, 0.00044678968184284397] and parameters: {'n_layers': 2, 'embedding_dim': 96, 'lr': 0.027994598569073718, 'lambda_val': 3.159634083184005e-05, 'batch_size': 1478, 'optimizer': 'RMSprop'}.
2026-06-29 15:34:17,921 - experiment_functions - INFO - Early stopping at epoch 500. Best Metrics: (0.0009794336767282115, 0.00029253651957525216, 0.0006709017604959168)
2026-06-29 15:34:18,070 - optuna.study.study - INFO - Trial 131 finished with values: [0.0009794336767282115, 0.00029253651957525216, 0.0006709017604959168] and parameters: {'n_layers': 3, 'embedding_dim': 96, 'lr': 0.0951182596909589, 'lambda_val': 6.062226724528523e-06, 'batch_size': 1277, 'optimizer': 'RMSprop'}.
2026-06-29 15:36:09,688 - experiment_functions - INFO - Early stopping at epoch 1400. Best Metrics: (0.003184992435468088, 0.0009830366810402143, 0.0021823774815062573)
2026-06-29 15:36:09,793 - optuna.study.study - INFO - Trial 132 finished with values: [0.003184992435468088, 0.0009830366810402143, 0.0021823774815062573] and parameters: {'n_layers': 1, 'embedding_dim': 128, 'lr': 0.0007556847336647807, 'lambda_val': 0.0005944842242671787, 'batch_size': 1473, 'optimizer': 'Adam'}.
2026-06-29 15:41:09,677 - optuna.study.study - INFO - Trial 133 finished with values: [0.0005231362628162374, 0.00035142374104819255, 0.0004885640048898287] and parameters: {'n_layers': 2, 'embedding_dim': 64, 'lr': 0.027994598569073718, 'lambda_val': 0.0001800101227182521, 'batch_size': 2358, 'optimizer': 'RMSprop'}.
2026-06-29 15:42:12,657 - experiment_functions - INFO - Early stopping at epoch 750. Best Metrics: (0.00033698369373346635, 6.933495431491367e-05, 0.00020502874906737513)
2026-06-29 15:42:12,760 - optuna.study.study - INFO - Trial 134 finished with values: [0.00033698369373346635, 6.933495431491367e-05, 0.00020502874906737513] and parameters: {'n_layers': 2, 'embedding_dim': 128, 'lr': 3.815742252893849e-05, 'lambda_val': 6.062226724528523e-06, 'batch_size': 583, 'optimizer': 'RMSprop'}.
2026-06-29 15:43:48,936 - experiment_functions - INFO - Early stopping at epoch 1000. Best Metrics: (0.00021757406294594075, 5.128887031514161e-05, 0.00010898124963246182)
2026-06-29 15:43:49,043 - optuna.study.study - INFO - Trial 135 finished with values: [0.00021757406294594075, 5.128887031514161e-05, 0.00010898124963246182] and parameters: {'n_layers': 3, 'embedding_dim': 256, 'lr': 2.071153985022877e-05, 'lambda_val': 0.0002503570058262612, 'batch_size': 2584, 'optimizer': 'RMSprop'}.
2026-06-29 15:44:41,756 - experiment_functions - INFO - Early stopping at epoch 500. Best Metrics: (0.0016122553628859255, 0.0004957924130463689, 0.0010931352262267943)
2026-06-29 15:44:41,860 - optuna.study.study - INFO - Trial 136 finished with values: [0.0016122553628859255, 0.0004957924130463689, 0.0010931352262267943] and parameters: {'n_layers': 4, 'embedding_dim': 256, 'lr': 0.04591730982357234, 'lambda_val': 0.0002503570058262612, 'batch_size': 1940, 'optimizer': 'RMSprop'}.
2026-06-29 15:45:49,116 - experiment_functions - INFO - Early stopping at epoch 750. Best Metrics: (0.0014507960378868508, 0.00032957848146952107, 0.0008112026220256671)
2026-06-29 15:45:49,217 - optuna.study.study - INFO - Trial 137 finished with values: [0.0014507960378868508, 0.00032957848146952107, 0.0008112026220256671] and parameters: {'n_layers': 4, 'embedding_dim': 128, 'lr': 0.0007886779079223827, 'lambda_val': 0.0004244982241785935, 'batch_size': 711, 'optimizer': 'Adam'}.
2026-06-29 15:47:29,538 - experiment_functions - INFO - Early stopping at epoch 1250. Best Metrics: (0.003178573516937013, 0.0009526432764090194, 0.0021118255397146505)
2026-06-29 15:47:29,639 - optuna.study.study - INFO - Trial 138 finished with values: [0.003178573516937013, 0.0009526432764090194, 0.0021118255397146505] and parameters: {'n_layers': 1, 'embedding_dim': 128, 'lr': 0.0007886779079223827, 'lambda_val': 0.0004244982241785935, 'batch_size': 1811, 'optimizer': 'Adam'}.
2026-06-29 15:52:29,297 - optuna.study.study - INFO - Trial 139 finished with values: [0.000320969458250717, 9.11802138935851e-05, 0.0002097923932515864] and parameters: {'n_layers': 2, 'embedding_dim': 64, 'lr': 0.00010380403077207956, 'lambda_val': 1.1570798914196541e-06, 'batch_size': 995, 'optimizer': 'Adam'}.
2026-06-29 15:54:22,369 - experiment_functions - INFO - Early stopping at epoch 1300. Best Metrics: (0.0016057950524761165, 0.0004084113747316833, 0.001006466991317067)
2026-06-29 15:54:22,473 - optuna.study.study - INFO - Trial 140 finished with values: [0.0016057950524761165, 0.0004084113747316833, 0.001006466991317067] and parameters: {'n_layers': 4, 'embedding_dim': 128, 'lr': 0.00031797016715384626, 'lambda_val': 5.131979370324087e-06, 'batch_size': 1811, 'optimizer': 'Adam'}.
2026-06-29 15:55:04,375 - experiment_functions - INFO - Early stopping at epoch 500. Best Metrics: (0.00019515473314308623, 5.318845810459131e-05, 0.00011497264298737576)
2026-06-29 15:55:04,483 - optuna.study.study - INFO - Trial 141 finished with values: [0.00019515473314308623, 5.318845810459131e-05, 0.00011497264298737576] and parameters: {'n_layers': 2, 'embedding_dim': 96, 'lr': 0.0017983427733368042, 'lambda_val': 0.0454190417515518, 'batch_size': 1488, 'optimizer': 'SGD'}.
2026-06-29 15:55:50,952 - experiment_functions - INFO - Early stopping at epoch 550. Best Metrics: (0.00042722254288529845, 0.00012822217578785402, 0.000257467655189863)
2026-06-29 15:55:51,059 - optuna.study.study - INFO - Trial 142 finished with values: [0.00042722254288529845, 0.00012822217578785402, 0.000257467655189863] and parameters: {'n_layers': 4, 'embedding_dim': 64, 'lr': 0.0007549780410006504, 'lambda_val': 0.010580947887077394, 'batch_size': 1999, 'optimizer': 'RMSprop'}.
2026-06-29 15:56:36,759 - experiment_functions - INFO - Early stopping at epoch 550. Best Metrics: (0.00021294035428878644, 0.00011777444294588075, 0.0001901327410253524)
2026-06-29 15:56:36,860 - optuna.study.study - INFO - Trial 143 finished with values: [0.00021294035428878644, 0.00011777444294588075, 0.0001901327410253524] and parameters: {'n_layers': 3, 'embedding_dim': 64, 'lr': 0.02761939993756294, 'lambda_val': 0.01464520469229449, 'batch_size': 2584, 'optimizer': 'Adam'}.
2026-06-29 15:57:49,935 - experiment_functions - INFO - Early stopping at epoch 900. Best Metrics: (0.00193840600369943, 0.0005850730391505044, 0.0012174756885896503)
2026-06-29 15:57:50,044 - optuna.study.study - INFO - Trial 144 finished with values: [0.00193840600369943, 0.0005850730391505044, 0.0012174756885896503] and parameters: {'n_layers': 2, 'embedding_dim': 96, 'lr': 0.0007556847336647807, 'lambda_val': 0.0004244982241785935, 'batch_size': 1478, 'optimizer': 'RMSprop'}.
2026-06-29 15:58:41,428 - experiment_functions - INFO - Early stopping at epoch 650. Best Metrics: (0.0005408577754679024, 0.00028873734399635284, 0.0004941479818372953)
2026-06-29 15:58:41,552 - optuna.study.study - INFO - Trial 145 finished with values: [0.0005408577754679024, 0.00028873734399635284, 0.0004941479818372953] and parameters: {'n_layers': 3, 'embedding_dim': 32, 'lr': 0.015188551974826818, 'lambda_val': 4.9806804138388375e-05, 'batch_size': 831, 'optimizer': 'RMSprop'}.
2026-06-29 15:59:34,605 - experiment_functions - INFO - Early stopping at epoch 500. Best Metrics: (0.0006016599765912256, 0.00018615960336606957, 0.0004280830121408398)
2026-06-29 15:59:34,713 - optuna.study.study - INFO - Trial 146 finished with values: [0.0006016599765912256, 0.00018615960336606957, 0.0004280830121408398] and parameters: {'n_layers': 4, 'embedding_dim': 256, 'lr': 0.07945214517899378, 'lambda_val': 5.3222531406855436e-05, 'batch_size': 2600, 'optimizer': 'Adam'}.
2026-06-29 16:00:33,171 - experiment_functions - INFO - Early stopping at epoch 750. Best Metrics: (0.00020911095208409045, 6.173660315711492e-05, 0.00012121502520006425)
2026-06-29 16:00:33,275 - optuna.study.study - INFO - Trial 147 finished with values: [0.00020911095208409045, 6.173660315711492e-05, 0.00012121502520006425] and parameters: {'n_layers': 3, 'embedding_dim': 32, 'lr': 4.5882747189392185e-05, 'lambda_val': 1.4166254702318954e-06, 'batch_size': 2365, 'optimizer': 'RMSprop'}.
2026-06-29 16:01:47,430 - experiment_functions - INFO - Early stopping at epoch 950. Best Metrics: (0.0003107292445495196, 7.40839237885379e-05, 0.00017537722069821147)
2026-06-29 16:01:47,581 - optuna.study.study - INFO - Trial 148 finished with values: [0.0003107292445495196, 7.40839237885379e-05, 0.00017537722069821147] and parameters: {'n_layers': 1, 'embedding_dim': 96, 'lr': 1.3407054587553896e-05, 'lambda_val': 0.0004244982241785935, 'batch_size': 944, 'optimizer': 'Adam'}.
2026-06-29 16:02:55,004 - experiment_functions - INFO - Early stopping at epoch 850. Best Metrics: (0.002868603445986254, 0.0008785593526204813, 0.0018879234847695395)
2026-06-29 16:02:55,108 - optuna.study.study - INFO - Trial 149 finished with values: [0.002868603445986254, 0.0008785593526204813, 0.0018879234847695395] and parameters: {'n_layers': 1, 'embedding_dim': 96, 'lr': 0.0013135077251507194, 'lambda_val': 0.0004244982241785935, 'batch_size': 1478, 'optimizer': 'RMSprop'}.
2026-06-29 16:04:47,384 - experiment_functions - INFO - Early stopping at epoch 1300. Best Metrics: (0.0005431368283888849, 0.00026689208441768136, 0.0004395645625226221)
2026-06-29 16:04:47,531 - optuna.study.study - INFO - Trial 150 finished with values: [0.0005431368283888849, 0.00026689208441768136, 0.0004395645625226221] and parameters: {'n_layers': 4, 'embedding_dim': 128, 'lr': 0.0020146212204725906, 'lambda_val': 5.131979370324087e-06, 'batch_size': 1811, 'optimizer': 'RMSprop'}.
2026-06-29 16:05:42,586 - experiment_functions - INFO - Early stopping at epoch 650. Best Metrics: (0.001577589514752465, 0.0004758467412571471, 0.000959726191581575)
2026-06-29 16:05:42,693 - optuna.study.study - INFO - Trial 151 finished with values: [0.001577589514752465, 0.0004758467412571471, 0.000959726191581575] and parameters: {'n_layers': 2, 'embedding_dim': 128, 'lr': 0.0007549780410006504, 'lambda_val': 0.002101784363136079, 'batch_size': 1999, 'optimizer': 'RMSprop'}.
2026-06-29 16:07:41,791 - experiment_functions - INFO - Early stopping at epoch 1500. Best Metrics: (0.0031414044713557084, 0.0009526432764090194, 0.0021394223988933604)
2026-06-29 16:07:41,891 - optuna.study.study - INFO - Trial 152 finished with values: [0.0031414044713557084, 0.0009526432764090194, 0.0021394223988933604] and parameters: {'n_layers': 1, 'embedding_dim': 128, 'lr': 0.0007556847336647807, 'lambda_val': 3.159634083184005e-05, 'batch_size': 1811, 'optimizer': 'Adam'}.
2026-06-29 16:09:00,430 - experiment_functions - INFO - Early stopping at epoch 1000. Best Metrics: (0.002522511235915959, 0.0007113956271489088, 0.0015805979709212564)
2026-06-29 16:09:00,583 - optuna.study.study - INFO - Trial 153 finished with values: [0.002522511235915959, 0.0007113956271489088, 0.0015805979709212564] and parameters: {'n_layers': 2, 'embedding_dim': 64, 'lr': 0.0006475996595311599, 'lambda_val': 6.062226724528523e-06, 'batch_size': 1304, 'optimizer': 'Adam'}.
2026-06-29 16:09:54,949 - experiment_functions - INFO - Early stopping at epoch 650. Best Metrics: (0.0019310132580498515, 0.0005128887031514162, 0.0011256224594526564)
2026-06-29 16:09:55,051 - optuna.study.study - INFO - Trial 154 finished with values: [0.0019310132580498515, 0.0005128887031514162, 0.0011256224594526564] and parameters: {'n_layers': 2, 'embedding_dim': 96, 'lr': 0.0007886779079223827, 'lambda_val': 0.0001800101227182521, 'batch_size': 3561, 'optimizer': 'RMSprop'}.
2026-06-29 16:10:44,727 - experiment_functions - INFO - Early stopping at epoch 550. Best Metrics: (0.0006138290331378542, 0.00024789620652318446, 0.0004369804311472945)
2026-06-29 16:10:44,850 - optuna.study.study - INFO - Trial 155 finished with values: [0.0006138290331378542, 0.00024789620652318446, 0.0004369804311472945] and parameters: {'n_layers': 1, 'embedding_dim': 256, 'lr': 0.02761939993756294, 'lambda_val': 1.3664921212013244e-05, 'batch_size': 2584, 'optimizer': 'RMSprop'}.
2026-06-29 16:11:35,083 - experiment_functions - INFO - Early stopping at epoch 600. Best Metrics: (0.0006114214442979408, 0.0002887373439963528, 0.0004935828038963957)
2026-06-29 16:11:35,185 - optuna.study.study - INFO - Trial 156 finished with values: [0.0006114214442979408, 0.0002887373439963528, 0.0004935828038963957] and parameters: {'n_layers': 2, 'embedding_dim': 96, 'lr': 0.02761939993756294, 'lambda_val': 1.5359911139419394e-06, 'batch_size': 1478, 'optimizer': 'RMSprop'}.
2026-06-29 16:12:26,565 - experiment_functions - INFO - Early stopping at epoch 650. Best Metrics: (0.0005137951620883858, 0.00026404270273350683, 0.00043756948167668645)
2026-06-29 16:12:26,663 - optuna.study.study - INFO - Trial 157 finished with values: [0.0005137951620883858, 0.00026404270273350683, 0.00043756948167668645] and parameters: {'n_layers': 3, 'embedding_dim': 32, 'lr': 0.015188551974826818, 'lambda_val': 4.9806804138388375e-05, 'batch_size': 831, 'optimizer': 'RMSprop'}.
2026-06-29 16:13:24,479 - experiment_functions - INFO - Early stopping at epoch 700. Best Metrics: (0.0018094760104875446, 0.00048059571073077144, 0.0011222786380360322)
2026-06-29 16:13:25,836 - optuna.study.study - INFO - Trial 158 finished with values: [0.0018094760104875446, 0.00048059571073077144, 0.0011222786380360322] and parameters: {'n_layers': 2, 'embedding_dim': 96, 'lr': 0.0007549780410006504, 'lambda_val': 0.002101784363136079, 'batch_size': 1999, 'optimizer': 'RMSprop'}.
2026-06-29 16:14:21,263 - experiment_functions - INFO - Early stopping at epoch 700. Best Metrics: (0.00043797129178982944, 0.0002801891989438292, 0.0004377188336134679)
2026-06-29 16:14:21,367 - optuna.study.study - INFO - Trial 159 finished with values: [0.00043797129178982944, 0.0002801891989438292, 0.0004377188336134679] and parameters: {'n_layers': 3, 'embedding_dim': 32, 'lr': 0.015188551974826818, 'lambda_val': 4.9806804138388375e-05, 'batch_size': 2987, 'optimizer': 'RMSprop'}.
2026-06-29 16:15:11,245 - experiment_functions - INFO - Early stopping at epoch 600. Best Metrics: (0.0023595697576380445, 0.0008652622380943336, 0.001655090588431348)
2026-06-29 16:15:11,347 - optuna.study.study - INFO - Trial 160 finished with values: [0.0023595697576380445, 0.0008652622380943336, 0.001655090588431348] and parameters: {'n_layers': 1, 'embedding_dim': 128, 'lr': 0.005466403487028649, 'lambda_val': 0.002101784363136079, 'batch_size': 1999, 'optimizer': 'Adam'}.
2026-06-29 16:16:26,140 - experiment_functions - INFO - Early stopping at epoch 900. Best Metrics: (0.0018349307025729584, 0.0005945709780977529, 0.0012281468322563154)
2026-06-29 16:16:26,256 - optuna.study.study - INFO - Trial 161 finished with values: [0.0018349307025729584, 0.0005945709780977529, 0.0012281468322563154] and parameters: {'n_layers': 3, 'embedding_dim': 96, 'lr': 0.0007886779079223827, 'lambda_val': 7.689281917654029e-05, 'batch_size': 1093, 'optimizer': 'Adam'}.
2026-06-29 16:21:26,956 - optuna.study.study - INFO - Trial 162 finished with values: [0.0018541409051934803, 0.0005309347871511882, 0.001219507763410144] and parameters: {'n_layers': 1, 'embedding_dim': 96, 'lr': 0.00015159499100507432, 'lambda_val': 0.0004244982241785935, 'batch_size': 3941, 'optimizer': 'RMSprop'}.
2026-06-29 16:22:29,611 - experiment_functions - INFO - Early stopping at epoch 700. Best Metrics: (0.0012721164156259887, 0.00034097600820621923, 0.000751271801410956)
