2026-07-06 06:56:26,998 - optuna.study.study - INFO - Trial 244 finished with values: [0.01964347128349876, 0.004209486541420512, 0.011494281312517346] and parameters: {'n_layers': 3, 'embedding_dim': 256, 'lr': 0.004643736874356213, 'lambda_val': 1.3028958114301324e-06, 'batch_size': 3425, 'optimizer': 'RMSprop'}.
2026-07-06 07:01:43,382 - optuna.study.study - INFO - Trial 245 finished with values: [0.013765649137827365, 0.0033527724483787017, 0.00794637229292801] and parameters: {'n_layers': 3, 'embedding_dim': 32, 'lr': 0.000628496153565313, 'lambda_val': 1.4745289700620854e-05, 'batch_size': 2385, 'optimizer': 'RMSprop'}.
2026-07-06 07:03:42,302 - experiment_functions - INFO - Early stopping at epoch 1500. Best Metrics: (0.01449035085682853, 0.003231198829853922, 0.008500598893501075)
2026-07-06 07:03:42,406 - optuna.study.study - INFO - Trial 246 finished with values: [0.01449035085682853, 0.003231198829853922, 0.008500598893501075] and parameters: {'n_layers': 2, 'embedding_dim': 32, 'lr': 0.004643736874356213, 'lambda_val': 1.3028958114301324e-06, 'batch_size': 3276, 'optimizer': 'Adam'}.
2026-07-06 07:04:33,876 - experiment_functions - INFO - Early stopping at epoch 550. Best Metrics: (0.0039969602080310055, 0.001100811123986095, 0.002651405648788621)
2026-07-06 07:04:33,961 - optuna.study.study - INFO - Trial 247 finished with values: [0.0039969602080310055, 0.001100811123986095, 0.002651405648788621] and parameters: {'n_layers': 2, 'embedding_dim': 128, 'lr': 0.0069539644625034236, 'lambda_val': 0.0523922047118479, 'batch_size': 1692, 'optimizer': 'RMSprop'}.
2026-07-06 07:10:15,129 - optuna.study.study - INFO - Trial 248 finished with values: [0.017703010504798642, 0.00388370723552989, 0.010324859939735719] and parameters: {'n_layers': 2, 'embedding_dim': 96, 'lr': 0.0070515306300978796, 'lambda_val': 1.059674657990583e-05, 'batch_size': 3299, 'optimizer': 'RMSprop'}.
2026-07-06 07:15:37,872 - optuna.study.study - INFO - Trial 249 finished with values: [0.018660969977542564, 0.004025226525843892, 0.011017136077536672] and parameters: {'n_layers': 1, 'embedding_dim': 96, 'lr': 0.006553786429577227, 'lambda_val': 3.5012332654571365e-05, 'batch_size': 1506, 'optimizer': 'RMSprop'}.
2026-07-06 07:20:44,737 - optuna.study.study - INFO - Trial 250 finished with values: [0.02083142323741928, 0.004545713580153108, 0.012072404711771793] and parameters: {'n_layers': 1, 'embedding_dim': 32, 'lr': 0.004643736874356213, 'lambda_val': 1.3028958114301324e-06, 'batch_size': 2888, 'optimizer': 'RMSprop'}.
2026-07-06 07:27:00,667 - optuna.study.study - INFO - Trial 251 finished with values: [0.023959473799216473, 0.005447067986246984, 0.014467092434889788] and parameters: {'n_layers': 1, 'embedding_dim': 256, 'lr': 0.0014317988640719153, 'lambda_val': 2.1563767437652712e-06, 'batch_size': 2654, 'optimizer': 'Adam'}.
2026-07-06 07:32:39,863 - optuna.study.study - INFO - Trial 252 finished with values: [0.016705509774758612, 0.0036681040214273505, 0.00949262382252583] and parameters: {'n_layers': 2, 'embedding_dim': 96, 'lr': 0.00552003570381155, 'lambda_val': 2.412093285142066e-05, 'batch_size': 2901, 'optimizer': 'RMSprop'}.
2026-07-06 07:38:04,418 - optuna.study.study - INFO - Trial 253 finished with values: [0.01753652045327044, 0.0038561632125828694, 0.010366906493250066] and parameters: {'n_layers': 1, 'embedding_dim': 96, 'lr': 0.00841343884415209, 'lambda_val': 1.4745289700620854e-05, 'batch_size': 2385, 'optimizer': 'Adam'}.
2026-07-06 07:43:40,351 - optuna.study.study - INFO - Trial 254 finished with values: [0.023461082475016586, 0.005153581672777008, 0.014080123337577374] and parameters: {'n_layers': 1, 'embedding_dim': 128, 'lr': 0.0033823653385842145, 'lambda_val': 2.6612699284810097e-06, 'batch_size': 1692, 'optimizer': 'Adam'}.
2026-07-06 07:50:35,065 - optuna.study.study - INFO - Trial 255 finished with values: [0.019433532892916522, 0.004256976236156755, 0.011301931379341724] and parameters: {'n_layers': 2, 'embedding_dim': 256, 'lr': 0.002260615499918563, 'lambda_val': 1.4745289700620854e-05, 'batch_size': 2615, 'optimizer': 'RMSprop'}.
2026-07-06 07:56:14,874 - optuna.study.study - INFO - Trial 256 finished with values: [0.016554012109452242, 0.0035940200976388123, 0.009324569256264332] and parameters: {'n_layers': 2, 'embedding_dim': 96, 'lr': 0.0033823653385842145, 'lambda_val': 2.412093285142066e-05, 'batch_size': 2901, 'optimizer': 'RMSprop'}.
2026-07-06 08:01:24,358 - optuna.study.study - INFO - Trial 257 finished with values: [0.012963652540409763, 0.003000398913435785, 0.007705208728762377] and parameters: {'n_layers': 2, 'embedding_dim': 32, 'lr': 0.006553786429577227, 'lambda_val': 1.4745289700620854e-05, 'batch_size': 1692, 'optimizer': 'RMSprop'}.
2026-07-06 08:07:38,027 - optuna.study.study - INFO - Trial 258 finished with values: [0.026867033244865047, 0.0057680983226639825, 0.01593753815341338] and parameters: {'n_layers': 1, 'embedding_dim': 256, 'lr': 0.0028516566741058234, 'lambda_val': 1.4745289700620854e-05, 'batch_size': 2231, 'optimizer': 'RMSprop'}.
2026-07-06 08:13:12,866 - optuna.study.study - INFO - Trial 259 finished with values: [0.023855691076404558, 0.005248561062249492, 0.014380508019399557] and parameters: {'n_layers': 1, 'embedding_dim': 128, 'lr': 0.002260615499918563, 'lambda_val': 2.412093285142066e-05, 'batch_size': 2015, 'optimizer': 'RMSprop'}.
2026-07-06 08:19:23,915 - optuna.study.study - INFO - Trial 260 finished with values: [0.021150645818293783, 0.00455046254962673, 0.012548300205679198] and parameters: {'n_layers': 1, 'embedding_dim': 256, 'lr': 0.004643736874356213, 'lambda_val': 1.059674657990583e-05, 'batch_size': 1120, 'optimizer': 'RMSprop'}.
2026-07-06 08:26:18,801 - optuna.study.study - INFO - Trial 261 finished with values: [0.021018189423799818, 0.00458560492373155, 0.01224007785856758] and parameters: {'n_layers': 2, 'embedding_dim': 256, 'lr': 0.0014317988640719153, 'lambda_val': 1.4745289700620854e-05, 'batch_size': 2482, 'optimizer': 'RMSprop'}.
2026-07-06 08:31:40,737 - optuna.study.study - INFO - Trial 262 finished with values: [0.015566608756043477, 0.0034999905020610526, 0.009092505218263944] and parameters: {'n_layers': 1, 'embedding_dim': 96, 'lr': 0.004643736874356213, 'lambda_val': 0.0020434717977580296, 'batch_size': 1120, 'optimizer': 'RMSprop'}.
2026-07-06 08:37:21,053 - optuna.study.study - INFO - Trial 263 finished with values: [0.013036795978772107, 0.0028778755010162795, 0.007546633724073341] and parameters: {'n_layers': 2, 'embedding_dim': 96, 'lr': 0.0069539644625034236, 'lambda_val': 2.412093285142066e-05, 'batch_size': 1692, 'optimizer': 'Adam'}.
2026-07-06 08:40:15,936 - experiment_functions - INFO - Early stopping at epoch 1750. Best Metrics: (0.00327579448244801, 0.0008557642991470852, 0.0019217160572751763)
2026-07-06 08:40:16,020 - optuna.study.study - INFO - Trial 264 finished with values: [0.00327579448244801, 0.0008557642991470852, 0.0019217160572751763] and parameters: {'n_layers': 4, 'embedding_dim': 128, 'lr': 0.004643736874356213, 'lambda_val': 0.0191017352633709, 'batch_size': 2385, 'optimizer': 'Adam'}.
2026-07-06 08:46:29,768 - optuna.study.study - INFO - Trial 265 finished with values: [0.026384997492034056, 0.005609482742244933, 0.015448907301946573] and parameters: {'n_layers': 1, 'embedding_dim': 256, 'lr': 0.0028516566741058234, 'lambda_val': 1.4745289700620854e-05, 'batch_size': 2385, 'optimizer': 'RMSprop'}.
2026-07-06 08:52:44,842 - optuna.study.study - INFO - Trial 266 finished with values: [0.022790014563848163, 0.004991166916779059, 0.013585256934232858] and parameters: {'n_layers': 1, 'embedding_dim': 256, 'lr': 0.002260615499918563, 'lambda_val': 0.002062935328163689, 'batch_size': 2079, 'optimizer': 'Adam'}.
2026-07-06 08:58:31,810 - optuna.study.study - INFO - Trial 267 finished with values: [0.014343023503109266, 0.0032122029519594253, 0.008367253249848192] and parameters: {'n_layers': 4, 'embedding_dim': 64, 'lr': 0.0070515306300978796, 'lambda_val': 1.059674657990583e-05, 'batch_size': 2079, 'optimizer': 'RMSprop'}.
2026-07-06 09:02:04,089 - experiment_functions - INFO - Early stopping at epoch 2300. Best Metrics: (0.006243494383887976, 0.0016013525065060885, 0.0036593153913316158)
2026-07-06 09:02:04,198 - optuna.study.study - INFO - Trial 268 finished with values: [0.006243494383887976, 0.0016013525065060885, 0.0036593153913316158] and parameters: {'n_layers': 1, 'embedding_dim': 256, 'lr': 0.0070515306300978796, 'lambda_val': 0.02828962807508312, 'batch_size': 2231, 'optimizer': 'RMSprop'}.
2026-07-06 09:04:19,642 - experiment_functions - INFO - Early stopping at epoch 1750. Best Metrics: (0.014841825037896241, 0.003317630074273883, 0.00862871913961824)
2026-07-06 09:04:19,736 - optuna.study.study - INFO - Trial 269 finished with values: [0.014841825037896241, 0.003317630074273883, 0.00862871913961824] and parameters: {'n_layers': 1, 'embedding_dim': 32, 'lr': 0.004643736874356213, 'lambda_val': 0.0028192766346169305, 'batch_size': 3276, 'optimizer': 'RMSprop'}.
2026-07-06 09:10:35,718 - optuna.study.study - INFO - Trial 270 finished with values: [0.023031826227494365, 0.005087096100146268, 0.013849218852591787] and parameters: {'n_layers': 1, 'embedding_dim': 256, 'lr': 0.0033823653385842145, 'lambda_val': 5.8299690516601355e-05, 'batch_size': 1553, 'optimizer': 'Adam'}.
2026-07-06 09:18:14,002 - optuna.study.study - INFO - Trial 271 finished with values: [0.020873804636119153, 0.004469730068575119, 0.012346651780978787] and parameters: {'n_layers': 3, 'embedding_dim': 256, 'lr': 0.0070515306300978796, 'lambda_val': 1.4745289700620854e-05, 'batch_size': 2512, 'optimizer': 'RMSprop'}.
2026-07-06 09:23:20,340 - optuna.study.study - INFO - Trial 272 finished with values: [0.016564316468193507, 0.0036719031970062492, 0.009838620381790593] and parameters: {'n_layers': 1, 'embedding_dim': 32, 'lr': 0.0070515306300978796, 'lambda_val': 1.059674657990583e-05, 'batch_size': 1692, 'optimizer': 'RMSprop'}.
2026-07-06 09:29:30,786 - optuna.study.study - INFO - Trial 273 finished with values: [0.011690381077101112, 0.0027069125999658076, 0.0067588697723098825] and parameters: {'n_layers': 4, 'embedding_dim': 96, 'lr': 0.0028516566741058234, 'lambda_val': 2.412093285142066e-05, 'batch_size': 1692, 'optimizer': 'RMSprop'}.
2026-07-06 09:35:46,476 - optuna.study.study - INFO - Trial 274 finished with values: [0.023493283199512875, 0.0051991717797238, 0.01419291360503902] and parameters: {'n_layers': 1, 'embedding_dim': 256, 'lr': 0.0033823653385842145, 'lambda_val': 2.6612699284810097e-06, 'batch_size': 1553, 'optimizer': 'Adam'}.
2026-07-06 09:41:58,401 - optuna.study.study - INFO - Trial 275 finished with values: [0.020251493544354952, 0.004402294702049656, 0.012078514415100385] and parameters: {'n_layers': 1, 'embedding_dim': 256, 'lr': 0.0070515306300978796, 'lambda_val': 7.042695090433518e-06, 'batch_size': 3299, 'optimizer': 'RMSprop'}.
2026-07-06 09:47:04,731 - optuna.study.study - INFO - Trial 276 finished with values: [0.00032348610189111057, 8.643124441996089e-05, 0.00017111304305829735] and parameters: {'n_layers': 1, 'embedding_dim': 64, 'lr': 0.0002921041818926329, 'lambda_val': 0.0017059305455562248, 'batch_size': 2385, 'optimizer': 'RMSprop'}.
2026-07-06 09:52:13,043 - experiment_functions - INFO - Early stopping at epoch 3900. Best Metrics: (0.012670122671734476, 0.002860779210911232, 0.007546548266262641)
2026-07-06 09:52:13,132 - optuna.study.study - INFO - Trial 277 finished with values: [0.012670122671734476, 0.002860779210911232, 0.007546548266262641] and parameters: {'n_layers': 3, 'embedding_dim': 32, 'lr': 0.006553786429577227, 'lambda_val': 1.3028958114301324e-06, 'batch_size': 3276, 'optimizer': 'RMSprop'}.
2026-07-06 09:58:30,164 - optuna.study.study - INFO - Trial 278 finished with values: [0.02426005826386574, 0.005121288680356363, 0.01424034554338368] and parameters: {'n_layers': 1, 'embedding_dim': 256, 'lr': 0.004643736874356213, 'lambda_val': 1.3028958114301324e-06, 'batch_size': 2385, 'optimizer': 'Adam'}.
2026-07-06 10:04:44,178 - optuna.study.study - INFO - Trial 279 finished with values: [0.02412005404561522, 0.005137435176566686, 0.014210384314011937] and parameters: {'n_layers': 1, 'embedding_dim': 256, 'lr': 0.004643736874356213, 'lambda_val': 1.4745289700620854e-05, 'batch_size': 2888, 'optimizer': 'RMSprop'}.
2026-07-06 10:09:59,926 - optuna.study.study - INFO - Trial 280 finished with values: [0.0225239341229729, 0.004991166916779059, 0.013296103229089468] and parameters: {'n_layers': 1, 'embedding_dim': 64, 'lr': 0.0033823653385842145, 'lambda_val': 1.3028958114301324e-06, 'batch_size': 1692, 'optimizer': 'Adam'}.
2026-07-06 10:15:52,372 - experiment_functions - INFO - Early stopping at epoch 3750. Best Metrics: (0.021178569494768592, 0.004770814733202895, 0.01279033971487694)
2026-07-06 10:15:52,467 - optuna.study.study - INFO - Trial 281 finished with values: [0.021178569494768592, 0.004770814733202895, 0.01279033971487694] and parameters: {'n_layers': 1, 'embedding_dim': 256, 'lr': 0.0028516566741058234, 'lambda_val': 0.0017059305455562248, 'batch_size': 1692, 'optimizer': 'Adam'}.
2026-07-06 10:22:00,290 - optuna.study.study - INFO - Trial 282 finished with values: [0.01459709173702231, 0.0034885929753243547, 0.008620193732688002] and parameters: {'n_layers': 1, 'embedding_dim': 256, 'lr': 0.004643736874356213, 'lambda_val': 0.0067674206888748, 'batch_size': 2385, 'optimizer': 'RMSprop'}.
2026-07-06 10:23:06,510 - experiment_functions - INFO - Early stopping at epoch 550. Best Metrics: (0.00859257851037958, 0.002030659346921718, 0.005072886301180399)
2026-07-06 10:23:06,594 - optuna.study.study - INFO - Trial 283 finished with values: [0.00859257851037958, 0.002030659346921718, 0.005072886301180399] and parameters: {'n_layers': 3, 'embedding_dim': 256, 'lr': 0.0070515306300978796, 'lambda_val': 0.0017059305455562248, 'batch_size': 2385, 'optimizer': 'RMSprop'}.
2026-07-06 10:30:43,998 - optuna.study.study - INFO - Trial 284 finished with values: [0.020253081289026396, 0.004444085633417549, 0.012279964179512808] and parameters: {'n_layers': 3, 'embedding_dim': 256, 'lr': 0.0070515306300978796, 'lambda_val': 7.042695090433518e-06, 'batch_size': 2385, 'optimizer': 'RMSprop'}.
2026-07-06 10:36:24,448 - optuna.study.study - INFO - Trial 285 finished with values: [0.017129096083608575, 0.003758334441426211, 0.00997708942700692] and parameters: {'n_layers': 2, 'embedding_dim': 96, 'lr': 0.00552003570381155, 'lambda_val': 7.042695090433518e-06, 'batch_size': 3299, 'optimizer': 'RMSprop'}.
2026-07-06 10:40:41,899 - experiment_functions - INFO - Early stopping at epoch 3400. Best Metrics: (0.011300628966031274, 0.0027278080656497543, 0.006636159596945453)
2026-07-06 10:40:41,971 - optuna.study.study - INFO - Trial 286 finished with values: [0.011300628966031274, 0.0027278080656497543, 0.006636159596945453] and parameters: {'n_layers': 1, 'embedding_dim': 32, 'lr': 0.004643736874356213, 'lambda_val': 0.012471909333094278, 'batch_size': 1524, 'optimizer': 'Adam'}.
2026-07-06 10:46:20,669 - optuna.study.study - INFO - Trial 287 finished with values: [0.017206579645128364, 0.0037516858841631366, 0.01008840853736064] and parameters: {'n_layers': 2, 'embedding_dim': 96, 'lr': 0.00841343884415209, 'lambda_val': 2.412093285142066e-05, 'batch_size': 3299, 'optimizer': 'RMSprop'}.
2026-07-06 10:52:32,210 - optuna.study.study - INFO - Trial 288 finished with values: [0.01662346144595722, 0.003882757441635165, 0.009818344016726785] and parameters: {'n_layers': 1, 'embedding_dim': 256, 'lr': 0.0020004569205185102, 'lambda_val': 0.011720789781497609, 'batch_size': 1902, 'optimizer': 'Adam'}.
2026-07-06 10:58:12,054 - optuna.study.study - INFO - Trial 289 finished with values: [0.017770223421904575, 0.003934046311950307, 0.010295021440177974] and parameters: {'n_layers': 2, 'embedding_dim': 96, 'lr': 0.0014317988640719153, 'lambda_val': 0.0017059305455562248, 'batch_size': 2482, 'optimizer': 'RMSprop'}.
2026-07-06 11:03:19,576 - optuna.study.study - INFO - Trial 290 finished with values: [0.019786115266245116, 0.004504872442679939, 0.011902095453369885] and parameters: {'n_layers': 1, 'embedding_dim': 32, 'lr': 0.0033823653385842145, 'lambda_val': 0.0002561236193059283, 'batch_size': 1553, 'optimizer': 'RMSprop'}.
2026-07-06 11:09:35,496 - optuna.study.study - INFO - Trial 291 finished with values: [0.014200699756812506, 0.0031647132572231824, 0.008263892152333262] and parameters: {'n_layers': 3, 'embedding_dim': 128, 'lr': 0.004643736874356213, 'lambda_val': 0.0002903476112171693, 'batch_size': 1553, 'optimizer': 'RMSprop'}.
2026-07-06 11:15:12,491 - optuna.study.study - INFO - Trial 292 finished with values: [0.024978066424113664, 0.005417624375510515, 0.015000038019856799] and parameters: {'n_layers': 1, 'embedding_dim': 128, 'lr': 0.0033823653385842145, 'lambda_val': 2.6612699284810097e-06, 'batch_size': 2079, 'optimizer': 'Adam'}.
2026-07-06 11:21:25,769 - optuna.study.study - INFO - Trial 293 finished with values: [0.019323862631106185, 0.00424842809110423, 0.011375463820471027] and parameters: {'n_layers': 1, 'embedding_dim': 256, 'lr': 0.0070515306300978796, 'lambda_val': 1.1875193284309632e-06, 'batch_size': 1692, 'optimizer': 'Adam'}.
2026-07-06 11:26:47,417 - optuna.study.study - INFO - Trial 294 finished with values: [0.010817800616429852, 0.002631878882282545, 0.006349055991502775] and parameters: {'n_layers': 2, 'embedding_dim': 64, 'lr': 0.0014317988640719153, 'lambda_val': 0.008908776930320971, 'batch_size': 1692, 'optimizer': 'Adam'}.
2026-07-06 11:27:54,905 - experiment_functions - INFO - Early stopping at epoch 700. Best Metrics: (0.000274049876149897, 6.173660315711492e-05, 0.00016050750220790468)
2026-07-06 11:27:54,974 - optuna.study.study - INFO - Trial 295 finished with values: [0.000274049876149897, 6.173660315711492e-05, 0.00016050750220790468] and parameters: {'n_layers': 1, 'embedding_dim': 256, 'lr': 1.1648428384479141e-05, 'lambda_val': 0.0017059305455562248, 'batch_size': 1458, 'optimizer': 'Adam'}.
2026-07-06 11:33:33,358 - optuna.study.study - INFO - Trial 296 finished with values: [0.01313118245314006, 0.00302699314248808, 0.00756958769901029] and parameters: {'n_layers': 2, 'embedding_dim': 96, 'lr': 0.0070515306300978796, 'lambda_val': 0.0013980862943055838, 'batch_size': 3299, 'optimizer': 'RMSprop'}.
2026-07-06 11:40:24,370 - experiment_functions - INFO - Early stopping at epoch 3950. Best Metrics: (0.016812730429538448, 0.003538932051744771, 0.009703934591843672)
2026-07-06 11:40:24,451 - optuna.study.study - INFO - Trial 297 finished with values: [0.016812730429538448, 0.003538932051744771, 0.009703934591843672] and parameters: {'n_layers': 2, 'embedding_dim': 256, 'lr': 0.0070515306300978796, 'lambda_val': 2.1570766139286586e-05, 'batch_size': 2888, 'optimizer': 'Adam'}.
2026-07-06 11:46:36,114 - optuna.study.study - INFO - Trial 298 finished with values: [0.019881999133884637, 0.004455483160154247, 0.011914388270998659] and parameters: {'n_layers': 1, 'embedding_dim': 256, 'lr': 0.0070515306300978796, 'lambda_val': 1.3028958114301324e-06, 'batch_size': 2095, 'optimizer': 'RMSprop'}.
2026-07-06 11:47:27,807 - experiment_functions - INFO - Early stopping at epoch 550. Best Metrics: (0.004079053037810084, 0.0010609197804076515, 0.0025571990277930916)
2026-07-06 11:47:27,890 - optuna.study.study - INFO - Trial 299 finished with values: [0.004079053037810084, 0.0010609197804076515, 0.0025571990277930916] and parameters: {'n_layers': 3, 'embedding_dim': 96, 'lr': 0.0070515306300978796, 'lambda_val': 0.06731919943061447, 'batch_size': 1498, 'optimizer': 'RMSprop'}.
2026-07-06 11:47:27,905 - root - INFO - Selected Trial 258 based on Max ndcg: 0.0159
2026-07-06 11:47:27,905 - root - INFO - Associated Recall: 0.0269
2026-07-06 11:47:27,906 - experiment_functions - INFO - Training the best model ... for e_amazon_1c1dcs_rand4
2026-07-06 11:53:43,930 - root - INFO -   **** Training e_amazon_1c1dcs_rand5
2026-07-06 11:53:44,298 - root - INFO -   **** Getting 858585/2429444 random edges
2026-07-06 11:53:44,802 - optuna.storages._rdb.storage - INFO - A new study created in RDB with name: Study_e_amazon_1c1dcs_rand5
2026-07-06 11:59:24,375 - optuna.study.study - INFO - Trial 0 finished with values: [0.005360980944597773, 0.0013895484679824477, 0.0031183000375241583] and parameters: {'n_layers': 4, 'embedding_dim': 64, 'lr': 0.0002246112733291363, 'lambda_val': 0.00011800461112611352, 'batch_size': 1992, 'optimizer': 'Adam'}.
2026-07-06 12:00:08,319 - experiment_functions - INFO - Early stopping at epoch 500. Best Metrics: (0.0002713765779672295, 6.648557263073913e-05, 0.00015335911972676474)
2026-07-06 12:00:08,403 - optuna.study.study - INFO - Trial 1 finished with values: [0.0002713765779672295, 6.648557263073913e-05, 0.00015335911972676474] and parameters: {'n_layers': 1, 'embedding_dim': 128, 'lr': 0.009016730047694576, 'lambda_val': 0.047397572073982076, 'batch_size': 2510, 'optimizer': 'SGD'}.
2026-07-06 12:05:43,898 - optuna.study.study - INFO - Trial 2 finished with values: [0.015441680766271733, 0.003388864616378246, 0.008892680000362821] and parameters: {'n_layers': 3, 'embedding_dim': 64, 'lr': 0.00938818303360569, 'lambda_val': 1.9420463734703053e-05, 'batch_size': 2416, 'optimizer': 'RMSprop'}.
2026-07-06 12:06:55,815 - experiment_functions - INFO - Early stopping at epoch 750. Best Metrics: (0.0002620188048573577, 6.078680926239006e-05, 0.00012573356034904526)
2026-07-06 12:06:55,889 - optuna.study.study - INFO - Trial 3 finished with values: [0.0002620188048573577, 6.078680926239006e-05, 0.00012573356034904526] and parameters: {'n_layers': 1, 'embedding_dim': 256, 'lr': 3.159302487895435e-05, 'lambda_val': 5.753755422314766e-05, 'batch_size': 3159, 'optimizer': 'Adam'}.
