2026-07-08 11:25:11,067 - optuna.study.study - INFO - Trial 253 finished with values: [0.0028607870376299877, 0.001046672871986779, 0.0019938817649585725] and parameters: {'n_layers': 1, 'embedding_dim': 64, 'lr': 0.002396901451187955, 'lambda_val': 2.4879562990791014e-05, 'batch_size': 3820, 'optimizer': 'Adam'}.
2026-07-08 11:25:57,353 - experiment_functions - INFO - Early stopping at epoch 500. Best Metrics: (0.0002246518034570676, 4.7489694736242234e-05, 0.00013521487189339522)
2026-07-08 11:25:57,441 - optuna.study.study - INFO - Trial 254 finished with values: [0.0002246518034570676, 4.7489694736242234e-05, 0.00013521487189339522] and parameters: {'n_layers': 1, 'embedding_dim': 256, 'lr': 4.344613532697723e-05, 'lambda_val': 1.8566194585261947e-06, 'batch_size': 3437, 'optimizer': 'Adam'}.
2026-07-08 11:31:08,612 - optuna.study.study - INFO - Trial 255 finished with values: [0.003909054777234635, 0.001247079383773721, 0.0026688877087736843] and parameters: {'n_layers': 1, 'embedding_dim': 128, 'lr': 0.0004683675544444161, 'lambda_val': 1.684289604060617e-05, 'batch_size': 1430, 'optimizer': 'RMSprop'}.
2026-07-08 11:32:08,011 - experiment_functions - INFO - Early stopping at epoch 650. Best Metrics: (0.003398267672210974, 0.0012641756738787685, 0.0024484676698092148)
2026-07-08 11:32:09,133 - optuna.study.study - INFO - Trial 256 finished with values: [0.003398267672210974, 0.0012641756738787685, 0.0024484676698092148] and parameters: {'n_layers': 1, 'embedding_dim': 256, 'lr': 0.0031808570812741697, 'lambda_val': 0.00044891351853285386, 'batch_size': 1967, 'optimizer': 'Adam'}.
2026-07-08 11:33:02,467 - experiment_functions - INFO - Early stopping at epoch 650. Best Metrics: (0.0033860684018888147, 0.0011710958721957339, 0.0023668487242006217)
2026-07-08 11:33:02,559 - optuna.study.study - INFO - Trial 257 finished with values: [0.0033860684018888147, 0.0011710958721957339, 0.0023668487242006217] and parameters: {'n_layers': 1, 'embedding_dim': 96, 'lr': 0.0031808570812741697, 'lambda_val': 0.00044891351853285386, 'batch_size': 1430, 'optimizer': 'Adam'}.
2026-07-08 11:35:00,879 - experiment_functions - INFO - Early stopping at epoch 1350. Best Metrics: (0.00021423855153274992, 0.00010447732841973292, 0.0001553893921016167)
2026-07-08 11:35:00,977 - optuna.study.study - INFO - Trial 258 finished with values: [0.00021423855153274992, 0.00010447732841973292, 0.0001553893921016167] and parameters: {'n_layers': 4, 'embedding_dim': 128, 'lr': 0.0011108364748811956, 'lambda_val': 0.029061246418184295, 'batch_size': 3820, 'optimizer': 'RMSprop'}.
2026-07-08 11:35:46,231 - experiment_functions - INFO - Early stopping at epoch 550. Best Metrics: (0.0007179836225397735, 0.00032672909978534665, 0.000567527070347442)
2026-07-08 11:35:46,492 - optuna.study.study - INFO - Trial 259 finished with values: [0.0007179836225397735, 0.00032672909978534665, 0.000567527070347442] and parameters: {'n_layers': 1, 'embedding_dim': 96, 'lr': 0.0882444412809832, 'lambda_val': 0.0002947495461502324, 'batch_size': 1430, 'optimizer': 'Adam'}.
2026-07-08 11:36:40,454 - experiment_functions - INFO - Early stopping at epoch 650. Best Metrics: (0.0033878927267123925, 0.0011938909256691299, 0.0023926302132834874)
2026-07-08 11:36:40,545 - optuna.study.study - INFO - Trial 260 finished with values: [0.0033878927267123925, 0.0011938909256691299, 0.0023926302132834874] and parameters: {'n_layers': 1, 'embedding_dim': 96, 'lr': 0.002396901451187955, 'lambda_val': 0.0002947495461502324, 'batch_size': 3809, 'optimizer': 'Adam'}.
2026-07-08 11:37:38,167 - experiment_functions - INFO - Early stopping at epoch 700. Best Metrics: (0.003244774926893915, 0.0011834431928271565, 0.0023406347302993634)
2026-07-08 11:37:38,258 - optuna.study.study - INFO - Trial 261 finished with values: [0.003244774926893915, 0.0011834431928271565, 0.0023406347302993634] and parameters: {'n_layers': 1, 'embedding_dim': 96, 'lr': 0.0031808570812741697, 'lambda_val': 1.783091837418501e-05, 'batch_size': 1430, 'optimizer': 'Adam'}.
2026-07-08 11:38:29,440 - experiment_functions - INFO - Early stopping at epoch 650. Best Metrics: (0.003416717423722933, 0.001113158444617518, 0.0023113544306210512)
2026-07-08 11:38:29,523 - optuna.study.study - INFO - Trial 262 finished with values: [0.003416717423722933, 0.001113158444617518, 0.0023113544306210512] and parameters: {'n_layers': 1, 'embedding_dim': 32, 'lr': 0.0031808570812741697, 'lambda_val': 0.0013552584940860833, 'batch_size': 1967, 'optimizer': 'Adam'}.
2026-07-08 11:40:56,037 - experiment_functions - INFO - Early stopping at epoch 1850. Best Metrics: (0.00022669302521895638, 5.7937427578215534e-05, 0.00012864894321511867)
2026-07-08 11:40:56,132 - optuna.study.study - INFO - Trial 263 finished with values: [0.00022669302521895638, 5.7937427578215534e-05, 0.00012864894321511867] and parameters: {'n_layers': 1, 'embedding_dim': 128, 'lr': 2.3839846877886584e-05, 'lambda_val': 1.684289604060617e-05, 'batch_size': 1430, 'optimizer': 'Adam'}.
2026-07-08 11:44:31,153 - experiment_functions - INFO - Early stopping at epoch 2850. Best Metrics: (0.003488208472963799, 0.001229983093668674, 0.002484105873497836)
2026-07-08 11:44:31,242 - optuna.study.study - INFO - Trial 264 finished with values: [0.003488208472963799, 0.001229983093668674, 0.002484105873497836] and parameters: {'n_layers': 1, 'embedding_dim': 64, 'lr': 0.0008107931898913872, 'lambda_val': 7.250486260412989e-05, 'batch_size': 2781, 'optimizer': 'Adam'}.
2026-07-08 11:46:06,863 - experiment_functions - INFO - Early stopping at epoch 1250. Best Metrics: (0.0005307575254123808, 0.0002592937332598826, 0.0003757407083550466)
2026-07-08 11:46:06,979 - optuna.study.study - INFO - Trial 265 finished with values: [0.0005307575254123808, 0.0002592937332598826, 0.0003757407083550466] and parameters: {'n_layers': 1, 'embedding_dim': 64, 'lr': 0.0004683675544444161, 'lambda_val': 0.0975669794685733, 'batch_size': 3820, 'optimizer': 'RMSprop'}.
2026-07-08 11:47:06,361 - experiment_functions - INFO - Early stopping at epoch 550. Best Metrics: (0.0009608749992406546, 0.00035427312273236713, 0.000627760959929384)
2026-07-08 11:47:06,455 - optuna.study.study - INFO - Trial 266 finished with values: [0.0009608749992406546, 0.00035427312273236713, 0.000627760959929384] and parameters: {'n_layers': 4, 'embedding_dim': 256, 'lr': 0.0031808570812741697, 'lambda_val': 0.00044891351853285386, 'batch_size': 3820, 'optimizer': 'Adam'}.
2026-07-08 11:48:16,695 - experiment_functions - INFO - Early stopping at epoch 900. Best Metrics: (0.00014542532111219925, 4.4640313052067714e-05, 8.937453768595071e-05)
2026-07-08 11:48:16,804 - optuna.study.study - INFO - Trial 267 finished with values: [0.00014542532111219925, 4.4640313052067714e-05, 8.937453768595071e-05] and parameters: {'n_layers': 1, 'embedding_dim': 64, 'lr': 3.0354811699522213e-05, 'lambda_val': 1.8566194585261947e-06, 'batch_size': 2365, 'optimizer': 'Adam'}.
2026-07-08 11:52:48,713 - experiment_functions - INFO - Early stopping at epoch 3700. Best Metrics: (0.003831767687082751, 0.0012518283532473454, 0.002560428641981347)
2026-07-08 11:52:48,833 - optuna.study.study - INFO - Trial 268 finished with values: [0.003831767687082751, 0.0012518283532473454, 0.002560428641981347] and parameters: {'n_layers': 1, 'embedding_dim': 32, 'lr': 0.0009008516306813866, 'lambda_val': 1.8566194585261947e-06, 'batch_size': 1897, 'optimizer': 'Adam'}.
2026-07-08 11:54:54,863 - experiment_functions - INFO - Early stopping at epoch 1650. Best Metrics: (0.003375253348661824, 0.0012195353608267004, 0.0023732047575228195)
2026-07-08 11:54:54,939 - optuna.study.study - INFO - Trial 269 finished with values: [0.003375253348661824, 0.0012195353608267004, 0.0023732047575228195] and parameters: {'n_layers': 1, 'embedding_dim': 64, 'lr': 0.0008107931898913872, 'lambda_val': 1.783091837418501e-05, 'batch_size': 3820, 'optimizer': 'Adam'}.
2026-07-08 11:59:38,169 - experiment_functions - INFO - Early stopping at epoch 3900. Best Metrics: (0.003753659967539932, 0.0011520999943012366, 0.0024630757241996225)
2026-07-08 11:59:38,249 - optuna.study.study - INFO - Trial 270 finished with values: [0.003753659967539932, 0.0011520999943012366, 0.0024630757241996225] and parameters: {'n_layers': 1, 'embedding_dim': 32, 'lr': 0.0004683675544444161, 'lambda_val': 1.8566194585261947e-06, 'batch_size': 1430, 'optimizer': 'RMSprop'}.
2026-07-08 12:04:28,958 - experiment_functions - INFO - Early stopping at epoch 3900. Best Metrics: (0.004047525428216422, 0.0012774727884049162, 0.002719894480756686)
2026-07-08 12:04:29,045 - optuna.study.study - INFO - Trial 271 finished with values: [0.004047525428216422, 0.0012774727884049162, 0.002719894480756686] and parameters: {'n_layers': 1, 'embedding_dim': 64, 'lr': 0.0004683675544444161, 'lambda_val': 0.001113470490516116, 'batch_size': 1430, 'optimizer': 'RMSprop'}.
2026-07-08 12:05:17,893 - experiment_functions - INFO - Early stopping at epoch 600. Best Metrics: (0.003416312177038224, 0.0011701460783010086, 0.002328104279281697)
2026-07-08 12:05:17,987 - optuna.study.study - INFO - Trial 272 finished with values: [0.003416312177038224, 0.0011701460783010086, 0.002328104279281697] and parameters: {'n_layers': 1, 'embedding_dim': 64, 'lr': 0.003362796030966124, 'lambda_val': 0.004784059368647631, 'batch_size': 3820, 'optimizer': 'Adam'}.
2026-07-08 12:06:17,155 - experiment_functions - INFO - Early stopping at epoch 650. Best Metrics: (0.0030010698587180965, 0.0010951123606177458, 0.002095705124967182)
2026-07-08 12:06:17,243 - optuna.study.study - INFO - Trial 273 finished with values: [0.0030010698587180965, 0.0010951123606177458, 0.002095705124967182] and parameters: {'n_layers': 1, 'embedding_dim': 256, 'lr': 0.0031808570812741697, 'lambda_val': 0.0013922688097931523, 'batch_size': 1220, 'optimizer': 'Adam'}.
2026-07-08 12:07:04,850 - experiment_functions - INFO - Early stopping at epoch 600. Best Metrics: (0.003193864720342424, 0.0010675683376707254, 0.0022133123637606217)
2026-07-08 12:07:04,948 - optuna.study.study - INFO - Trial 274 finished with values: [0.003193864720342424, 0.0010675683376707254, 0.0022133123637606217] and parameters: {'n_layers': 1, 'embedding_dim': 32, 'lr': 0.002396901451187955, 'lambda_val': 1.8566194585261947e-06, 'batch_size': 3820, 'optimizer': 'RMSprop'}.
2026-07-08 12:07:59,563 - experiment_functions - INFO - Early stopping at epoch 650. Best Metrics: (0.00336355509207521, 0.0012869707273521645, 0.0024185128577040326)
2026-07-08 12:07:59,647 - optuna.study.study - INFO - Trial 275 finished with values: [0.00336355509207521, 0.0012869707273521645, 0.0024185128577040326] and parameters: {'n_layers': 1, 'embedding_dim': 128, 'lr': 0.0031808570812741697, 'lambda_val': 0.0002947495461502324, 'batch_size': 3820, 'optimizer': 'Adam'}.
2026-07-08 12:12:52,138 - optuna.study.study - INFO - Trial 276 finished with values: [0.003839268895453446, 0.001198639895142754, 0.002510490634317272] and parameters: {'n_layers': 1, 'embedding_dim': 32, 'lr': 0.000565645409068954, 'lambda_val': 1.783091837418501e-05, 'batch_size': 1092, 'optimizer': 'Adam'}.
2026-07-08 12:13:44,349 - experiment_functions - INFO - Early stopping at epoch 650. Best Metrics: (0.0036497982213503123, 0.001192941131774405, 0.0025019133791820223)
2026-07-08 12:13:44,439 - optuna.study.study - INFO - Trial 277 finished with values: [0.0036497982213503123, 0.001192941131774405, 0.0025019133791820223] and parameters: {'n_layers': 1, 'embedding_dim': 64, 'lr': 0.0031808570812741697, 'lambda_val': 1.8566194585261947e-06, 'batch_size': 2781, 'optimizer': 'Adam'}.
2026-07-08 12:19:05,246 - experiment_functions - INFO - Early stopping at epoch 3750. Best Metrics: (0.0034060413969839993, 0.001261326292194594, 0.002479112744609238)
2026-07-08 12:19:05,409 - optuna.study.study - INFO - Trial 278 finished with values: [0.0034060413969839993, 0.001261326292194594, 0.002479112744609238] and parameters: {'n_layers': 1, 'embedding_dim': 256, 'lr': 0.000565645409068954, 'lambda_val': 0.00044891351853285386, 'batch_size': 1585, 'optimizer': 'Adam'}.
2026-07-08 12:19:54,966 - experiment_functions - INFO - Early stopping at epoch 600. Best Metrics: (0.0020918898647313143, 0.0005736755124138063, 0.0012007065905219759)
2026-07-08 12:19:55,059 - optuna.study.study - INFO - Trial 279 finished with values: [0.0020918898647313143, 0.0005736755124138063, 0.0012007065905219759] and parameters: {'n_layers': 2, 'embedding_dim': 64, 'lr': 0.0031808570812741697, 'lambda_val': 1.783091837418501e-05, 'batch_size': 1155, 'optimizer': 'Adam'}.
2026-07-08 12:20:45,465 - experiment_functions - INFO - Early stopping at epoch 550. Best Metrics: (0.0018050477324366226, 0.0007332408867275802, 0.0013189645260564791)
2026-07-08 12:20:45,557 - optuna.study.study - INFO - Trial 280 finished with values: [0.0018050477324366226, 0.0007332408867275802, 0.0013189645260564791] and parameters: {'n_layers': 1, 'embedding_dim': 256, 'lr': 0.0031808570812741697, 'lambda_val': 0.0006118985538624221, 'batch_size': 3820, 'optimizer': 'RMSprop'}.
2026-07-08 12:25:26,203 - experiment_functions - INFO - Early stopping at epoch 3750. Best Metrics: (0.0036822398117155306, 0.0012423304143000967, 0.0025272078387181705)
2026-07-08 12:25:26,303 - optuna.study.study - INFO - Trial 281 finished with values: [0.0036822398117155306, 0.0012423304143000967, 0.0025272078387181705] and parameters: {'n_layers': 1, 'embedding_dim': 64, 'lr': 0.0007398611586122253, 'lambda_val': 0.0013552584940860833, 'batch_size': 691, 'optimizer': 'Adam'}.
2026-07-08 12:26:19,657 - experiment_functions - INFO - Early stopping at epoch 650. Best Metrics: (0.003277077694912373, 0.0011862925745113313, 0.0023063937178081835)
2026-07-08 12:26:19,741 - optuna.study.study - INFO - Trial 282 finished with values: [0.003277077694912373, 0.0011862925745113313, 0.0023063937178081835] and parameters: {'n_layers': 1, 'embedding_dim': 96, 'lr': 0.0031808570812741697, 'lambda_val': 0.0002947495461502324, 'batch_size': 1967, 'optimizer': 'Adam'}.
2026-07-08 12:31:15,411 - optuna.study.study - INFO - Trial 283 finished with values: [0.0023302891719149494, 0.0007579355279904261, 0.001615052204729418] and parameters: {'n_layers': 1, 'embedding_dim': 64, 'lr': 0.0002900679124230289, 'lambda_val': 3.4017247985764347e-06, 'batch_size': 1147, 'optimizer': 'RMSprop'}.
2026-07-08 12:32:32,952 - experiment_functions - INFO - Early stopping at epoch 1000. Best Metrics: (0.0019834043041674436, 0.0006629561385179416, 0.0012690612032532909)
2026-07-08 12:32:33,042 - optuna.study.study - INFO - Trial 284 finished with values: [0.0019834043041674436, 0.0006629561385179416, 0.0012690612032532909] and parameters: {'n_layers': 3, 'embedding_dim': 32, 'lr': 0.0009008516306813866, 'lambda_val': 0.00045919787742064835, 'batch_size': 1326, 'optimizer': 'Adam'}.
2026-07-08 12:38:15,620 - optuna.study.study - INFO - Trial 285 finished with values: [0.0037874086143952625, 0.0013078661930361114, 0.0026165442714524223] and parameters: {'n_layers': 1, 'embedding_dim': 256, 'lr': 0.0002900679124230289, 'lambda_val': 3.4017247985764347e-06, 'batch_size': 3820, 'optimizer': 'Adam'}.
2026-07-08 12:40:38,431 - experiment_functions - INFO - Early stopping at epoch 1850. Best Metrics: (0.00023686602240240788, 6.268639705183976e-05, 0.00014188255626499042)
2026-07-08 12:40:38,537 - optuna.study.study - INFO - Trial 286 finished with values: [0.00023686602240240788, 6.268639705183976e-05, 0.00014188255626499042] and parameters: {'n_layers': 1, 'embedding_dim': 96, 'lr': 3.333131174638476e-05, 'lambda_val': 1.9166677808452497e-06, 'batch_size': 1967, 'optimizer': 'Adam'}.
2026-07-08 12:42:17,988 - experiment_functions - INFO - Early stopping at epoch 1250. Best Metrics: (0.0033701872407061618, 0.0011777444294588076, 0.0023238901269026055)
2026-07-08 12:42:18,789 - optuna.study.study - INFO - Trial 287 finished with values: [0.0033701872407061618, 0.0011777444294588076, 0.0023238901269026055] and parameters: {'n_layers': 1, 'embedding_dim': 96, 'lr': 0.0008107931898913872, 'lambda_val': 1.8566194585261947e-06, 'batch_size': 2781, 'optimizer': 'Adam'}.
2026-07-08 12:44:04,172 - experiment_functions - INFO - Early stopping at epoch 1350. Best Metrics: (0.0033977987673386016, 0.0011426020553539883, 0.002364057857040851)
2026-07-08 12:44:04,322 - optuna.study.study - INFO - Trial 288 finished with values: [0.0033977987673386016, 0.0011426020553539883, 0.002364057857040851] and parameters: {'n_layers': 1, 'embedding_dim': 96, 'lr': 0.000565645409068954, 'lambda_val': 0.0013552584940860833, 'batch_size': 1930, 'optimizer': 'RMSprop'}.
2026-07-08 12:45:29,861 - experiment_functions - INFO - Early stopping at epoch 1100. Best Metrics: (0.0040637298860239585, 0.0012603764982998691, 0.0027339209410641666)
2026-07-08 12:45:29,949 - optuna.study.study - INFO - Trial 289 finished with values: [0.0040637298860239585, 0.0012603764982998691, 0.0027339209410641666] and parameters: {'n_layers': 1, 'embedding_dim': 64, 'lr': 0.0013601909806526136, 'lambda_val': 1.8566194585261947e-06, 'batch_size': 1430, 'optimizer': 'Adam'}.
2026-07-08 12:47:02,617 - experiment_functions - INFO - Early stopping at epoch 1200. Best Metrics: (0.0030736930639826705, 0.0010865642155652225, 0.002181338515813472)
2026-07-08 12:47:02,755 - optuna.study.study - INFO - Trial 290 finished with values: [0.0030736930639826705, 0.0010865642155652225, 0.002181338515813472] and parameters: {'n_layers': 1, 'embedding_dim': 64, 'lr': 0.0008107931898913872, 'lambda_val': 0.00044891351853285386, 'batch_size': 3820, 'optimizer': 'Adam'}.
2026-07-08 12:47:55,023 - experiment_functions - INFO - Early stopping at epoch 650. Best Metrics: (0.002999106404212825, 0.0010846646277757727, 0.0020593109896001097)
2026-07-08 12:47:55,105 - optuna.study.study - INFO - Trial 291 finished with values: [0.002999106404212825, 0.0010846646277757727, 0.0020593109896001097] and parameters: {'n_layers': 1, 'embedding_dim': 64, 'lr': 0.002396901451187955, 'lambda_val': 0.0002947495461502324, 'batch_size': 3809, 'optimizer': 'Adam'}.
2026-07-08 12:49:34,584 - experiment_functions - INFO - Early stopping at epoch 1250. Best Metrics: (0.0016338325209749624, 0.0005974203597819273, 0.0010866693717890607)
2026-07-08 12:49:34,717 - optuna.study.study - INFO - Trial 292 finished with values: [0.0016338325209749624, 0.0005974203597819273, 0.0010866693717890607] and parameters: {'n_layers': 3, 'embedding_dim': 64, 'lr': 0.000565645409068954, 'lambda_val': 1.8566194585261947e-06, 'batch_size': 1897, 'optimizer': 'Adam'}.
2026-07-08 12:51:22,987 - experiment_functions - INFO - Early stopping at epoch 1350. Best Metrics: (0.0036045769947827557, 0.0012964686662994133, 0.002556082193849301)
2026-07-08 12:51:23,076 - optuna.study.study - INFO - Trial 293 finished with values: [0.0036045769947827557, 0.0012964686662994133, 0.002556082193849301] and parameters: {'n_layers': 1, 'embedding_dim': 128, 'lr': 0.0009008516306813866, 'lambda_val': 0.0002947495461502324, 'batch_size': 1930, 'optimizer': 'Adam'}.
2026-07-08 12:52:30,066 - experiment_functions - INFO - Early stopping at epoch 850. Best Metrics: (0.0038258065022807857, 0.0012242843303003248, 0.0026193860508038087)
2026-07-08 12:52:30,181 - optuna.study.study - INFO - Trial 294 finished with values: [0.0038258065022807857, 0.0012242843303003248, 0.0026193860508038087] and parameters: {'n_layers': 1, 'embedding_dim': 64, 'lr': 0.002396901451187955, 'lambda_val': 3.329858191297094e-06, 'batch_size': 1430, 'optimizer': 'Adam'}.
2026-07-08 12:57:43,580 - optuna.study.study - INFO - Trial 295 finished with values: [0.003780145084673701, 0.0012480291776684463, 0.002570917367187193] and parameters: {'n_layers': 1, 'embedding_dim': 128, 'lr': 0.0004683675544444161, 'lambda_val': 1.684289604060617e-05, 'batch_size': 1430, 'optimizer': 'Adam'}.
2026-07-08 13:00:10,879 - experiment_functions - INFO - Early stopping at epoch 1850. Best Metrics: (0.003456563940661255, 0.0012252341241950496, 0.002417901427900474)
2026-07-08 13:00:10,935 - optuna.study.study - INFO - Trial 296 finished with values: [0.003456563940661255, 0.0012252341241950496, 0.002417901427900474] and parameters: {'n_layers': 1, 'embedding_dim': 128, 'lr': 0.0008107931898913872, 'lambda_val': 1.8566194585261947e-06, 'batch_size': 1422, 'optimizer': 'Adam'}.
2026-07-08 13:01:14,223 - experiment_functions - INFO - Early stopping at epoch 800. Best Metrics: (0.0033230098512874277, 0.0011910415439849553, 0.0023302616383232724)
2026-07-08 13:01:14,282 - optuna.study.study - INFO - Trial 297 finished with values: [0.0033230098512874277, 0.0011910415439849553, 0.0023302616383232724] and parameters: {'n_layers': 1, 'embedding_dim': 64, 'lr': 0.002396901451187955, 'lambda_val': 1.8566194585261947e-06, 'batch_size': 1430, 'optimizer': 'Adam'}.
2026-07-08 13:02:29,533 - experiment_functions - INFO - Early stopping at epoch 850. Best Metrics: (0.0032999312229700256, 0.0011606481393537603, 0.002246736333091421)
2026-07-08 13:02:29,656 - optuna.study.study - INFO - Trial 298 finished with values: [0.0032999312229700256, 0.0011606481393537603, 0.002246736333091421] and parameters: {'n_layers': 1, 'embedding_dim': 256, 'lr': 0.0009008516306813866, 'lambda_val': 0.0002947495461502324, 'batch_size': 1949, 'optimizer': 'RMSprop'}.
2026-07-08 13:03:17,518 - experiment_functions - INFO - Early stopping at epoch 600. Best Metrics: (0.0019915873517394045, 0.0005252360237828392, 0.0012174856861745776)
