2026-07-03 08:37:35,470 - optuna.study.study - INFO - Trial 68 finished with values: [0.01321339258197167, 0.0030250935546986303, 0.007865766636002075] and parameters: {'n_layers': 1, 'embedding_dim': 128, 'lr': 0.0040524633409478395, 'lambda_val': 0.008107712298875159, 'batch_size': 3960, 'optimizer': 'RMSprop'}.
2026-07-03 08:38:22,505 - experiment_functions - INFO - Early stopping at epoch 500. Best Metrics: (0.00020501365138449307, 6.173660315711492e-05, 0.00012115162207074286)
2026-07-03 08:38:22,581 - optuna.study.study - INFO - Trial 69 finished with values: [0.00020501365138449307, 6.173660315711492e-05, 0.00012115162207074286] and parameters: {'n_layers': 3, 'embedding_dim': 96, 'lr': 4.743029530515188e-05, 'lambda_val': 0.00027900648211190204, 'batch_size': 2299, 'optimizer': 'SGD'}.
2026-07-03 08:45:59,773 - optuna.study.study - INFO - Trial 70 finished with values: [0.015092894782315803, 0.0036510077313223034, 0.00915486239722592] and parameters: {'n_layers': 3, 'embedding_dim': 256, 'lr': 0.0005924494216455263, 'lambda_val': 6.525874471654226e-06, 'batch_size': 1561, 'optimizer': 'Adam'}.
2026-07-03 08:49:15,194 - experiment_functions - INFO - Early stopping at epoch 2300. Best Metrics: (0.023758364734518825, 0.005113690329198564, 0.01391783089135132)
2026-07-03 08:49:15,263 - optuna.study.study - INFO - Trial 71 finished with values: [0.023758364734518825, 0.005113690329198564, 0.01391783089135132] and parameters: {'n_layers': 1, 'embedding_dim': 128, 'lr': 0.0040524633409478395, 'lambda_val': 3.7175116690643465e-05, 'batch_size': 3839, 'optimizer': 'Adam'}.
2026-07-03 08:51:58,343 - experiment_functions - INFO - Early stopping at epoch 1850. Best Metrics: (0.005281957516937564, 0.001400945994719146, 0.003075732170419064)
2026-07-03 08:51:58,410 - optuna.study.study - INFO - Trial 72 finished with values: [0.005281957516937564, 0.001400945994719146, 0.003075732170419064] and parameters: {'n_layers': 2, 'embedding_dim': 128, 'lr': 0.0005027312526223404, 'lambda_val': 0.015163515739882642, 'batch_size': 1439, 'optimizer': 'RMSprop'}.
2026-07-03 08:53:02,895 - experiment_functions - INFO - Early stopping at epoch 500. Best Metrics: (0.00016716697870627575, 5.128887031514162e-05, 0.0001141540728204396)
2026-07-03 08:53:02,965 - optuna.study.study - INFO - Trial 73 finished with values: [0.00016716697870627575, 5.128887031514162e-05, 0.0001141540728204396] and parameters: {'n_layers': 4, 'embedding_dim': 256, 'lr': 0.003942474684271309, 'lambda_val': 3.0397104734720642e-05, 'batch_size': 2210, 'optimizer': 'SGD'}.
2026-07-03 08:53:49,426 - experiment_functions - INFO - Early stopping at epoch 500. Best Metrics: (0.0001741474531250497, 4.843948863096708e-05, 0.00011697811323726588)
2026-07-03 08:53:49,507 - optuna.study.study - INFO - Trial 74 finished with values: [0.0001741474531250497, 4.843948863096708e-05, 0.00011697811323726588] and parameters: {'n_layers': 2, 'embedding_dim': 128, 'lr': 1.2931534392649212e-05, 'lambda_val': 3.405924979359868e-06, 'batch_size': 2778, 'optimizer': 'SGD'}.
2026-07-03 08:59:43,078 - optuna.study.study - INFO - Trial 75 finished with values: [0.01244878663647191, 0.0030079972645935833, 0.007458182335136665] and parameters: {'n_layers': 3, 'embedding_dim': 96, 'lr': 0.0008107107656200319, 'lambda_val': 3.994713178662255e-05, 'batch_size': 732, 'optimizer': 'RMSprop'}.
2026-07-03 09:00:43,346 - experiment_functions - INFO - Early stopping at epoch 500. Best Metrics: (0.00014881976964718947, 4.6539900841517385e-05, 8.850891268700078e-05)
2026-07-03 09:00:43,446 - optuna.study.study - INFO - Trial 76 finished with values: [0.00014881976964718947, 4.6539900841517385e-05, 8.850891268700078e-05] and parameters: {'n_layers': 3, 'embedding_dim': 256, 'lr': 1.4123922522390498e-05, 'lambda_val': 0.0031563334074732655, 'batch_size': 1046, 'optimizer': 'Adam'}.
2026-07-03 09:01:56,038 - experiment_functions - INFO - Early stopping at epoch 750. Best Metrics: (0.00025688759547838944, 6.743536652546397e-05, 0.0001384153639442508)
2026-07-03 09:01:56,122 - optuna.study.study - INFO - Trial 77 finished with values: [0.00025688759547838944, 6.743536652546397e-05, 0.0001384153639442508] and parameters: {'n_layers': 3, 'embedding_dim': 128, 'lr': 5.907882632077122e-05, 'lambda_val': 2.302284243959985e-05, 'batch_size': 1742, 'optimizer': 'RMSprop'}.
2026-07-03 09:02:40,768 - experiment_functions - INFO - Early stopping at epoch 500. Best Metrics: (0.00029378608043544903, 6.36361909465646e-05, 0.00014420685653491623)
2026-07-03 09:02:40,847 - optuna.study.study - INFO - Trial 78 finished with values: [0.00029378608043544903, 6.36361909465646e-05, 0.00014420685653491623] and parameters: {'n_layers': 2, 'embedding_dim': 96, 'lr': 0.011126263210365092, 'lambda_val': 7.329771199139694e-05, 'batch_size': 788, 'optimizer': 'SGD'}.
2026-07-03 09:03:33,001 - experiment_functions - INFO - Early stopping at epoch 500. Best Metrics: (0.00016831843827233936, 5.7937427578215534e-05, 0.00011152648177886396)
2026-07-03 09:03:33,091 - optuna.study.study - INFO - Trial 79 finished with values: [0.00016831843827233936, 5.7937427578215534e-05, 0.00011152648177886396] and parameters: {'n_layers': 4, 'embedding_dim': 128, 'lr': 4.107051848620635e-05, 'lambda_val': 0.076707683896583, 'batch_size': 2198, 'optimizer': 'SGD'}.
2026-07-03 09:04:45,206 - experiment_functions - INFO - Early stopping at epoch 550. Best Metrics: (0.005953886911644359, 0.0014037953764033206, 0.0034982114302083075)
2026-07-03 09:04:45,291 - optuna.study.study - INFO - Trial 80 finished with values: [0.005953886911644359, 0.0014037953764033206, 0.0034982114302083075] and parameters: {'n_layers': 4, 'embedding_dim': 256, 'lr': 0.06339720330400815, 'lambda_val': 8.41405405813264e-05, 'batch_size': 647, 'optimizer': 'Adam'}.
2026-07-03 09:10:39,989 - optuna.study.study - INFO - Trial 81 finished with values: [0.013257042277315102, 0.002976654066067663, 0.0077700006474463006] and parameters: {'n_layers': 3, 'embedding_dim': 96, 'lr': 0.0026410131585060054, 'lambda_val': 1.2677615672600141e-06, 'batch_size': 1561, 'optimizer': 'RMSprop'}.
2026-07-03 09:15:34,502 - experiment_functions - INFO - Early stopping at epoch 3700. Best Metrics: (0.016533870599785276, 0.0037231920673213913, 0.00962652686119238)
2026-07-03 09:15:34,623 - optuna.study.study - INFO - Trial 82 finished with values: [0.016533870599785276, 0.0037231920673213913, 0.00962652686119238] and parameters: {'n_layers': 3, 'embedding_dim': 32, 'lr': 0.0018743209181168723, 'lambda_val': 7.33580764656977e-05, 'batch_size': 2366, 'optimizer': 'Adam'}.
2026-07-03 09:16:24,547 - experiment_functions - INFO - Early stopping at epoch 550. Best Metrics: (0.007161057516472407, 0.001651691582926505, 0.004229062858874205)
2026-07-03 09:16:24,624 - optuna.study.study - INFO - Trial 83 finished with values: [0.007161057516472407, 0.001651691582926505, 0.004229062858874205] and parameters: {'n_layers': 2, 'embedding_dim': 96, 'lr': 0.06243657955169784, 'lambda_val': 3.7175116690643465e-05, 'batch_size': 2813, 'optimizer': 'Adam'}.
2026-07-03 09:18:46,975 - experiment_functions - INFO - Early stopping at epoch 1700. Best Metrics: (0.0002808369635729093, 8.168227494633666e-05, 0.00018071668921124876)
2026-07-03 09:18:47,057 - optuna.study.study - INFO - Trial 84 finished with values: [0.0002808369635729093, 8.168227494633666e-05, 0.00018071668921124876] and parameters: {'n_layers': 3, 'embedding_dim': 64, 'lr': 4.995927757596963e-05, 'lambda_val': 2.1833975968191893e-05, 'batch_size': 3722, 'optimizer': 'Adam'}.
2026-07-03 09:19:36,309 - experiment_functions - INFO - Early stopping at epoch 500. Best Metrics: (0.00022696028695451365, 6.55357787360143e-05, 0.00013819760634807505)
2026-07-03 09:19:36,379 - optuna.study.study - INFO - Trial 85 finished with values: [0.00022696028695451365, 6.55357787360143e-05, 0.00013819760634807505] and parameters: {'n_layers': 4, 'embedding_dim': 96, 'lr': 6.647367087318159e-05, 'lambda_val': 0.00222409027904442, 'batch_size': 827, 'optimizer': 'Adam'}.
2026-07-03 09:27:55,875 - optuna.study.study - INFO - Trial 86 finished with values: [0.011387064387217339, 0.002516004027126114, 0.0066649989406115445] and parameters: {'n_layers': 4, 'embedding_dim': 256, 'lr': 0.013423812802703095, 'lambda_val': 8.41405405813264e-05, 'batch_size': 1800, 'optimizer': 'Adam'}.
2026-07-03 09:30:19,029 - experiment_functions - INFO - Early stopping at epoch 1800. Best Metrics: (0.00022470269693762067, 6.268639705183975e-05, 0.00012244780367846753)
2026-07-03 09:30:19,115 - optuna.study.study - INFO - Trial 87 finished with values: [0.00022470269693762067, 6.268639705183975e-05, 0.00012244780367846753] and parameters: {'n_layers': 4, 'embedding_dim': 32, 'lr': 3.8871895478957114e-05, 'lambda_val': 0.0001005425766925018, 'batch_size': 1525, 'optimizer': 'RMSprop'}.
2026-07-03 09:31:23,305 - experiment_functions - INFO - Early stopping at epoch 500. Best Metrics: (0.00016706059139987408, 5.508804589404101e-05, 0.00010036909693083059)
2026-07-03 09:31:23,393 - optuna.study.study - INFO - Trial 88 finished with values: [0.00016706059139987408, 5.508804589404101e-05, 0.00010036909693083059] and parameters: {'n_layers': 4, 'embedding_dim': 256, 'lr': 0.08852801476573076, 'lambda_val': 3.0397104734720642e-05, 'batch_size': 788, 'optimizer': 'SGD'}.
2026-07-03 09:33:07,827 - experiment_functions - INFO - Early stopping at epoch 1250. Best Metrics: (0.01685237914435401, 0.003743137739110613, 0.010180262586594638)
2026-07-03 09:33:07,918 - optuna.study.study - INFO - Trial 89 finished with values: [0.01685237914435401, 0.003743137739110613, 0.010180262586594638] and parameters: {'n_layers': 1, 'embedding_dim': 96, 'lr': 0.008841806029042509, 'lambda_val': 1.2350413453119533e-05, 'batch_size': 3384, 'optimizer': 'Adam'}.
2026-07-03 09:34:52,211 - experiment_functions - INFO - Early stopping at epoch 900. Best Metrics: (0.00019229099283005552, 5.888722147294038e-05, 0.00013662661989446322)
2026-07-03 09:34:52,328 - optuna.study.study - INFO - Trial 90 finished with values: [0.00019229099283005552, 5.888722147294038e-05, 0.00013662661989446322] and parameters: {'n_layers': 3, 'embedding_dim': 256, 'lr': 2.4873316067386108e-05, 'lambda_val': 4.982512602626827e-06, 'batch_size': 3913, 'optimizer': 'RMSprop'}.
2026-07-03 09:40:06,298 - optuna.study.study - INFO - Trial 91 finished with values: [0.018662395820451646, 0.004338658511103091, 0.011370101666117504] and parameters: {'n_layers': 1, 'embedding_dim': 64, 'lr': 0.0014537114423835192, 'lambda_val': 3.7175116690643465e-05, 'batch_size': 2527, 'optimizer': 'Adam'}.
2026-07-03 09:40:55,380 - experiment_functions - INFO - Early stopping at epoch 500. Best Metrics: (0.00024186401773424766, 6.743536652546397e-05, 0.00013549242445510116)
2026-07-03 09:40:55,484 - optuna.study.study - INFO - Trial 92 finished with values: [0.00024186401773424766, 6.743536652546397e-05, 0.00013549242445510116] and parameters: {'n_layers': 4, 'embedding_dim': 96, 'lr': 9.66616734629361e-05, 'lambda_val': 0.0002218870149356506, 'batch_size': 1341, 'optimizer': 'SGD'}.
2026-07-03 09:44:30,076 - experiment_functions - INFO - Early stopping at epoch 2600. Best Metrics: (0.020833966883693173, 0.004545713580153107, 0.012189714857696168)
2026-07-03 09:44:30,157 - optuna.study.study - INFO - Trial 93 finished with values: [0.020833966883693173, 0.004545713580153107, 0.012189714857696168] and parameters: {'n_layers': 2, 'embedding_dim': 64, 'lr': 0.0022700314607702445, 'lambda_val': 5.874173464438341e-05, 'batch_size': 3832, 'optimizer': 'Adam'}.
2026-07-03 09:46:05,887 - experiment_functions - INFO - Early stopping at epoch 1250. Best Metrics: (0.0001910287132286542, 5.793742757821552e-05, 0.00011568302543151006)
2026-07-03 09:46:05,974 - optuna.study.study - INFO - Trial 94 finished with values: [0.0001910287132286542, 5.793742757821552e-05, 0.00011568302543151006] and parameters: {'n_layers': 1, 'embedding_dim': 32, 'lr': 5.014024852676533e-05, 'lambda_val': 3.328417231611093e-05, 'batch_size': 2619, 'optimizer': 'RMSprop'}.
2026-07-03 09:51:19,895 - optuna.study.study - INFO - Trial 95 finished with values: [0.01566240040531766, 0.003597819273217712, 0.00927038500562512] and parameters: {'n_layers': 1, 'embedding_dim': 64, 'lr': 0.008057425283025757, 'lambda_val': 0.00016569298362557902, 'batch_size': 1692, 'optimizer': 'RMSprop'}.
2026-07-03 09:53:36,760 - experiment_functions - INFO - Early stopping at epoch 1550. Best Metrics: (0.01228125220137275, 0.0027278080656497543, 0.007168398289036997)
2026-07-03 09:53:36,861 - optuna.study.study - INFO - Trial 96 finished with values: [0.01228125220137275, 0.0027278080656497543, 0.007168398289036997] and parameters: {'n_layers': 4, 'embedding_dim': 64, 'lr': 0.0018743209181168723, 'lambda_val': 7.329771199139694e-05, 'batch_size': 2366, 'optimizer': 'Adam'}.
2026-07-03 09:54:22,544 - experiment_functions - INFO - Early stopping at epoch 500. Best Metrics: (0.00020142647171045668, 5.223866420986647e-05, 0.00010403623999452582)
2026-07-03 09:54:22,625 - optuna.study.study - INFO - Trial 97 finished with values: [0.00020142647171045668, 5.223866420986647e-05, 0.00010403623999452582] and parameters: {'n_layers': 4, 'embedding_dim': 64, 'lr': 0.011126263210365092, 'lambda_val': 0.00016569298362557902, 'batch_size': 788, 'optimizer': 'SGD'}.
2026-07-03 10:02:43,650 - optuna.study.study - INFO - Trial 98 finished with values: [0.013579841288183328, 0.002976654066067663, 0.007822836759474644] and parameters: {'n_layers': 4, 'embedding_dim': 256, 'lr': 0.001509217129870026, 'lambda_val': 6.962327788353928e-05, 'batch_size': 2163, 'optimizer': 'Adam'}.
2026-07-03 10:08:56,771 - optuna.study.study - INFO - Trial 99 finished with values: [0.015874462846094218, 0.003493341944797979, 0.00937152894198877] and parameters: {'n_layers': 4, 'embedding_dim': 96, 'lr': 0.0008107107656200319, 'lambda_val': 1.2350413453119533e-05, 'batch_size': 3622, 'optimizer': 'Adam'}.
2026-07-03 10:10:53,542 - experiment_functions - INFO - Early stopping at epoch 1400. Best Metrics: (0.01737183799248271, 0.003746936914689513, 0.01026079447254278)
2026-07-03 10:10:53,626 - optuna.study.study - INFO - Trial 100 finished with values: [0.01737183799248271, 0.003746936914689513, 0.01026079447254278] and parameters: {'n_layers': 1, 'embedding_dim': 96, 'lr': 0.008841806029042509, 'lambda_val': 1.2350413453119533e-05, 'batch_size': 3384, 'optimizer': 'Adam'}.
2026-07-03 10:17:04,536 - optuna.study.study - INFO - Trial 101 finished with values: [0.00996086680557383, 0.0022966016374446744, 0.005809538489813228] and parameters: {'n_layers': 4, 'embedding_dim': 96, 'lr': 0.0034898058361558884, 'lambda_val': 8.41405405813264e-05, 'batch_size': 1979, 'optimizer': 'Adam'}.
2026-07-03 10:18:03,938 - experiment_functions - INFO - Early stopping at epoch 550. Best Metrics: (0.00025561058941128896, 6.933495431491366e-05, 0.0001513431498063566)
2026-07-03 10:18:04,295 - optuna.study.study - INFO - Trial 102 finished with values: [0.00025561058941128896, 6.933495431491366e-05, 0.0001513431498063566] and parameters: {'n_layers': 2, 'embedding_dim': 256, 'lr': 1.221777316041566e-05, 'lambda_val': 0.0006168359830718268, 'batch_size': 1561, 'optimizer': 'RMSprop'}.
2026-07-03 10:18:49,378 - experiment_functions - INFO - Early stopping at epoch 500. Best Metrics: (0.00032176183144790363, 8.358186273578635e-05, 0.00018707337363483895)
2026-07-03 10:18:49,461 - optuna.study.study - INFO - Trial 103 finished with values: [0.00032176183144790363, 8.358186273578635e-05, 0.00018707337363483895] and parameters: {'n_layers': 2, 'embedding_dim': 96, 'lr': 0.0010282533123218839, 'lambda_val': 4.456437629274438e-05, 'batch_size': 1104, 'optimizer': 'SGD'}.
2026-07-03 10:24:46,137 - optuna.study.study - INFO - Trial 104 finished with values: [0.015656202265636215, 0.0034420530744828375, 0.009004704146027926] and parameters: {'n_layers': 3, 'embedding_dim': 96, 'lr': 0.0018743209181168723, 'lambda_val': 1.9972882720613643e-06, 'batch_size': 1684, 'optimizer': 'Adam'}.
2026-07-03 10:32:23,777 - optuna.study.study - INFO - Trial 105 finished with values: [0.014808706114022721, 0.0032511445016431433, 0.00863466170757295] and parameters: {'n_layers': 3, 'embedding_dim': 256, 'lr': 0.0018743209181168723, 'lambda_val': 7.33580764656977e-05, 'batch_size': 1561, 'optimizer': 'Adam'}.
2026-07-03 10:33:18,900 - experiment_functions - INFO - Early stopping at epoch 550. Best Metrics: (0.008717425663328672, 0.002001215736185248, 0.0052391630372175075)
2026-07-03 10:33:18,972 - optuna.study.study - INFO - Trial 106 finished with values: [0.008717425663328672, 0.002001215736185248, 0.0052391630372175075] and parameters: {'n_layers': 3, 'embedding_dim': 128, 'lr': 0.026710406287072025, 'lambda_val': 8.41405405813264e-05, 'batch_size': 3156, 'optimizer': 'Adam'}.
2026-07-03 10:38:29,959 - optuna.study.study - INFO - Trial 107 finished with values: [0.007759968553372244, 0.0017884619037668826, 0.004263758613460862] and parameters: {'n_layers': 3, 'embedding_dim': 32, 'lr': 0.0026410131585060054, 'lambda_val': 7.33580764656977e-05, 'batch_size': 668, 'optimizer': 'Adam'}.
2026-07-03 10:44:24,453 - optuna.study.study - INFO - Trial 108 finished with values: [0.01585203607321751, 0.0035303839066922484, 0.00922479473242577] and parameters: {'n_layers': 2, 'embedding_dim': 128, 'lr': 0.008841806029042509, 'lambda_val': 0.0006168359830718268, 'batch_size': 2527, 'optimizer': 'RMSprop'}.
2026-07-03 10:50:18,529 - optuna.study.study - INFO - Trial 109 finished with values: [0.013176763060252205, 0.0030146458218566576, 0.007731592496403297] and parameters: {'n_layers': 3, 'embedding_dim': 96, 'lr': 0.0026410131585060054, 'lambda_val': 1.492140203661907e-05, 'batch_size': 732, 'optimizer': 'RMSprop'}.
2026-07-03 10:55:51,776 - optuna.study.study - INFO - Trial 110 finished with values: [0.017198411489560163, 0.003779229907110157, 0.009955717633894528] and parameters: {'n_layers': 1, 'embedding_dim': 128, 'lr': 0.008057425283025757, 'lambda_val': 0.00016569298362557902, 'batch_size': 3614, 'optimizer': 'RMSprop'}.
2026-07-03 10:59:13,563 - experiment_functions - INFO - Early stopping at epoch 2250. Best Metrics: (0.014420208482943963, 0.003140968409855062, 0.00835434890403327)
2026-07-03 10:59:13,649 - optuna.study.study - INFO - Trial 111 finished with values: [0.014420208482943963, 0.003140968409855062, 0.00835434890403327] and parameters: {'n_layers': 3, 'embedding_dim': 96, 'lr': 0.0026410131585060054, 'lambda_val': 5.2843386136125674e-05, 'batch_size': 3913, 'optimizer': 'RMSprop'}.
2026-07-03 11:02:54,870 - experiment_functions - INFO - Early stopping at epoch 2350. Best Metrics: (0.014596713801247076, 0.0031998556313280017, 0.008503310213717172)
2026-07-03 11:02:54,985 - optuna.study.study - INFO - Trial 112 finished with values: [0.014596713801247076, 0.0031998556313280017, 0.008503310213717172] and parameters: {'n_layers': 4, 'embedding_dim': 96, 'lr': 0.001509217129870026, 'lambda_val': 7.329771199139694e-05, 'batch_size': 3575, 'optimizer': 'Adam'}.
2026-07-03 11:10:30,179 - optuna.study.study - INFO - Trial 113 finished with values: [0.009292161573561483, 0.0023963299963907832, 0.005565807287053375] and parameters: {'n_layers': 3, 'embedding_dim': 256, 'lr': 0.0005924494216455263, 'lambda_val': 0.00515224702140942, 'batch_size': 1561, 'optimizer': 'Adam'}.
2026-07-03 11:15:58,059 - experiment_functions - INFO - Early stopping at epoch 3500. Best Metrics: (0.018606434748942424, 0.004212335923104687, 0.010907521373784108)
2026-07-03 11:15:58,142 - optuna.study.study - INFO - Trial 114 finished with values: [0.018606434748942424, 0.004212335923104687, 0.010907521373784108] and parameters: {'n_layers': 1, 'embedding_dim': 256, 'lr': 0.003942474684271309, 'lambda_val': 0.0022828427253251586, 'batch_size': 2210, 'optimizer': 'Adam'}.
2026-07-03 11:21:23,129 - optuna.study.study - INFO - Trial 115 finished with values: [0.022402487833501752, 0.005110840947514389, 0.013498615056474738] and parameters: {'n_layers': 1, 'embedding_dim': 96, 'lr': 0.0022700314607702445, 'lambda_val': 2.0533552356322422e-05, 'batch_size': 1548, 'optimizer': 'RMSprop'}.
2026-07-03 11:22:18,297 - experiment_functions - INFO - Early stopping at epoch 550. Best Metrics: (0.005295478329219661, 0.0012926694907205137, 0.0031005725474718806)
2026-07-03 11:22:18,384 - optuna.study.study - INFO - Trial 116 finished with values: [0.005295478329219661, 0.0012926694907205137, 0.0031005725474718806] and parameters: {'n_layers': 3, 'embedding_dim': 128, 'lr': 0.0077501750409489385, 'lambda_val': 0.006826471065079358, 'batch_size': 3121, 'optimizer': 'RMSprop'}.
2026-07-03 11:23:02,136 - experiment_functions - INFO - Early stopping at epoch 500. Best Metrics: (0.00019998536852732432, 5.5088045894041e-05, 0.00010353927854466373)
2026-07-03 11:23:02,207 - optuna.study.study - INFO - Trial 117 finished with values: [0.00019998536852732432, 5.5088045894041e-05, 0.00010353927854466373] and parameters: {'n_layers': 1, 'embedding_dim': 128, 'lr': 0.0005027312526223404, 'lambda_val': 3.7175116690643465e-05, 'batch_size': 3981, 'optimizer': 'SGD'}.
2026-07-03 11:28:46,776 - optuna.study.study - INFO - Trial 118 finished with values: [0.010661982816264853, 0.0024742130957582206, 0.00639750706055833] and parameters: {'n_layers': 4, 'embedding_dim': 64, 'lr': 0.0027009536573961556, 'lambda_val': 1.7807868447316915e-05, 'batch_size': 647, 'optimizer': 'RMSprop'}.
2026-07-03 11:34:59,862 - optuna.study.study - INFO - Trial 119 finished with values: [0.015139333091609402, 0.003326178219326407, 0.00879067144132345] and parameters: {'n_layers': 4, 'embedding_dim': 96, 'lr': 0.0008107107656200319, 'lambda_val': 1.2350413453119533e-05, 'batch_size': 3789, 'optimizer': 'Adam'}.
