2026-07-01 14:18:27,395 - optuna.study.study - INFO - Trial 55 finished with values: [0.002735342863725364, 0.0007683832608323994, 0.0018125134380046924] and parameters: {'n_layers': 4, 'embedding_dim': 32, 'lr': 0.0008102278066186573, 'lambda_val': 0.0006778527201004557, 'batch_size': 2026, 'optimizer': 'RMSprop'}.
2026-07-01 14:23:24,020 - optuna.study.study - INFO - Trial 56 finished with values: [0.0006823093139490786, 0.0001785612522082708, 0.00043948819628410445] and parameters: {'n_layers': 3, 'embedding_dim': 32, 'lr': 0.0001711299677444068, 'lambda_val': 3.747302157374259e-06, 'batch_size': 4074, 'optimizer': 'Adam'}.
2026-07-01 14:24:07,383 - experiment_functions - INFO - Early stopping at epoch 500. Best Metrics: (0.00017035068411190056, 5.223866420986646e-05, 0.00010413340075982868)
2026-07-01 14:24:07,476 - optuna.study.study - INFO - Trial 57 finished with values: [0.00017035068411190056, 5.223866420986646e-05, 0.00010413340075982868] and parameters: {'n_layers': 2, 'embedding_dim': 128, 'lr': 0.07037617495184816, 'lambda_val': 0.0014524764553647753, 'batch_size': 627, 'optimizer': 'SGD'}.
2026-07-01 14:25:34,749 - experiment_functions - INFO - Early stopping at epoch 1150. Best Metrics: (0.0002605086509537338, 6.743536652546397e-05, 0.00015806133464701385)
2026-07-01 14:25:34,839 - optuna.study.study - INFO - Trial 58 finished with values: [0.0002605086509537338, 6.743536652546397e-05, 0.00015806133464701385] and parameters: {'n_layers': 2, 'embedding_dim': 32, 'lr': 6.927973868314471e-05, 'lambda_val': 0.0004182641746888362, 'batch_size': 3546, 'optimizer': 'Adam'}.
2026-07-01 14:27:57,847 - experiment_functions - INFO - Early stopping at epoch 1650. Best Metrics: (0.0019377372846024225, 0.0005375833444142621, 0.0013671113502710783)
2026-07-01 14:27:57,934 - optuna.study.study - INFO - Trial 59 finished with values: [0.0019377372846024225, 0.0005375833444142621, 0.0013671113502710783] and parameters: {'n_layers': 1, 'embedding_dim': 256, 'lr': 0.0030363640610353106, 'lambda_val': 6.5134158560038e-06, 'batch_size': 3125, 'optimizer': 'RMSprop'}.
2026-07-01 14:29:43,186 - experiment_functions - INFO - Early stopping at epoch 1350. Best Metrics: (0.001203148006751092, 0.00038086735178466266, 0.0008824467815340578)
2026-07-01 14:29:43,302 - optuna.study.study - INFO - Trial 60 finished with values: [0.001203148006751092, 0.00038086735178466266, 0.0008824467815340578] and parameters: {'n_layers': 2, 'embedding_dim': 64, 'lr': 0.0022914869194475, 'lambda_val': 0.02620035099122833, 'batch_size': 1838, 'optimizer': 'Adam'}.
2026-07-01 14:32:12,049 - experiment_functions - INFO - Early stopping at epoch 1600. Best Metrics: (0.001966831638056326, 0.0005717759246243565, 0.0013077530441742277)
2026-07-01 14:32:12,141 - optuna.study.study - INFO - Trial 61 finished with values: [0.001966831638056326, 0.0005717759246243565, 0.0013077530441742277] and parameters: {'n_layers': 2, 'embedding_dim': 256, 'lr': 0.006276231155246127, 'lambda_val': 1.7400188628222683e-06, 'batch_size': 3927, 'optimizer': 'RMSprop'}.
2026-07-01 14:32:54,376 - experiment_functions - INFO - Early stopping at epoch 500. Best Metrics: (0.00021066029483995724, 5.5088045894041e-05, 0.00011173408410442342)
2026-07-01 14:32:54,469 - optuna.study.study - INFO - Trial 62 finished with values: [0.00021066029483995724, 5.5088045894041e-05, 0.00011173408410442342] and parameters: {'n_layers': 2, 'embedding_dim': 96, 'lr': 3.0920669289479146e-05, 'lambda_val': 0.0006938129437878243, 'batch_size': 1323, 'optimizer': 'SGD'}.
2026-07-01 14:35:31,976 - experiment_functions - INFO - Early stopping at epoch 2100. Best Metrics: (0.0030561129502034365, 0.0007968770776741448, 0.0020012864815390037)
2026-07-01 14:35:32,064 - optuna.study.study - INFO - Trial 63 finished with values: [0.0030561129502034365, 0.0007968770776741448, 0.0020012864815390037] and parameters: {'n_layers': 3, 'embedding_dim': 32, 'lr': 0.0016422068986048546, 'lambda_val': 0.0006778527201004557, 'batch_size': 880, 'optimizer': 'RMSprop'}.
2026-07-01 14:37:04,080 - experiment_functions - INFO - Early stopping at epoch 900. Best Metrics: (0.0010737696760311313, 0.0003704196189426895, 0.0007991592451682003)
2026-07-01 14:37:04,159 - optuna.study.study - INFO - Trial 64 finished with values: [0.0010737696760311313, 0.0003704196189426895, 0.0007991592451682003] and parameters: {'n_layers': 3, 'embedding_dim': 256, 'lr': 0.019546253809520703, 'lambda_val': 0.020983244862775217, 'batch_size': 3758, 'optimizer': 'Adam'}.
2026-07-01 14:37:48,647 - experiment_functions - INFO - Early stopping at epoch 550. Best Metrics: (0.0011209597757463599, 0.00029348631346997695, 0.0007790453061144274)
2026-07-01 14:37:48,738 - optuna.study.study - INFO - Trial 65 finished with values: [0.0011209597757463599, 0.00029348631346997695, 0.0007790453061144274] and parameters: {'n_layers': 1, 'embedding_dim': 64, 'lr': 0.021330846186373622, 'lambda_val': 1.413159904245194e-06, 'batch_size': 3604, 'optimizer': 'RMSprop'}.
2026-07-01 14:38:30,965 - experiment_functions - INFO - Early stopping at epoch 500. Best Metrics: (0.000247024907070136, 5.413825199931615e-05, 0.00012546743984084044)
2026-07-01 14:38:31,038 - optuna.study.study - INFO - Trial 66 finished with values: [0.000247024907070136, 5.413825199931615e-05, 0.00012546743984084044] and parameters: {'n_layers': 2, 'embedding_dim': 96, 'lr': 9.655131101868287e-05, 'lambda_val': 0.0010332857801635745, 'batch_size': 3105, 'optimizer': 'SGD'}.
2026-07-01 14:39:16,525 - experiment_functions - INFO - Early stopping at epoch 500. Best Metrics: (0.0001884225383742073, 5.793742757821552e-05, 0.00012121372157910835)
2026-07-01 14:39:16,633 - optuna.study.study - INFO - Trial 67 finished with values: [0.0001884225383742073, 5.793742757821552e-05, 0.00012121372157910835] and parameters: {'n_layers': 1, 'embedding_dim': 256, 'lr': 0.006276231155246127, 'lambda_val': 0.017959355068286404, 'batch_size': 3125, 'optimizer': 'SGD'}.
2026-07-01 14:39:58,534 - experiment_functions - INFO - Early stopping at epoch 500. Best Metrics: (0.00017865774236997691, 3.894154968371863e-05, 9.522985045197592e-05)
2026-07-01 14:39:58,646 - optuna.study.study - INFO - Trial 68 finished with values: [0.00017865774236997691, 3.894154968371863e-05, 9.522985045197592e-05] and parameters: {'n_layers': 1, 'embedding_dim': 128, 'lr': 0.09928603244201695, 'lambda_val': 0.017959355068286404, 'batch_size': 3125, 'optimizer': 'SGD'}.
2026-07-01 14:41:06,186 - experiment_functions - INFO - Early stopping at epoch 700. Best Metrics: (0.0010744410852122962, 0.0003656706494690653, 0.0007478350338226541)
2026-07-01 14:41:06,272 - optuna.study.study - INFO - Trial 69 finished with values: [0.0010744410852122962, 0.0003656706494690653, 0.0007478350338226541] and parameters: {'n_layers': 2, 'embedding_dim': 256, 'lr': 0.013510241191251177, 'lambda_val': 0.03603856247164571, 'batch_size': 3642, 'optimizer': 'RMSprop'}.
2026-07-01 14:42:01,644 - experiment_functions - INFO - Early stopping at epoch 650. Best Metrics: (0.0021047899517415763, 0.0006211652071500483, 0.001430793638560026)
2026-07-01 14:42:01,730 - optuna.study.study - INFO - Trial 70 finished with values: [0.0021047899517415763, 0.0006211652071500483, 0.001430793638560026] and parameters: {'n_layers': 4, 'embedding_dim': 64, 'lr': 0.005703114197626056, 'lambda_val': 5.585605103846419e-06, 'batch_size': 3465, 'optimizer': 'RMSprop'}.
2026-07-01 14:43:37,214 - experiment_functions - INFO - Early stopping at epoch 1100. Best Metrics: (0.002296910170176625, 0.0006848013980966129, 0.0015886479170378362)
2026-07-01 14:43:37,303 - optuna.study.study - INFO - Trial 71 finished with values: [0.002296910170176625, 0.0006848013980966129, 0.0015886479170378362] and parameters: {'n_layers': 3, 'embedding_dim': 128, 'lr': 0.0030363640610353106, 'lambda_val': 6.5134158560038e-06, 'batch_size': 3567, 'optimizer': 'RMSprop'}.
2026-07-01 14:46:33,471 - experiment_functions - INFO - Early stopping at epoch 2300. Best Metrics: (0.0011752153615249001, 0.00042075869536310626, 0.000810144520496091)
2026-07-01 14:46:33,556 - optuna.study.study - INFO - Trial 72 finished with values: [0.0011752153615249001, 0.00042075869536310626, 0.000810144520496091] and parameters: {'n_layers': 1, 'embedding_dim': 96, 'lr': 0.08122930190238219, 'lambda_val': 0.03347243406404254, 'batch_size': 3124, 'optimizer': 'RMSprop'}.
2026-07-01 14:51:18,269 - experiment_functions - INFO - Early stopping at epoch 3650. Best Metrics: (0.0018691113580448847, 0.0004502023060995764, 0.001166069071214543)
2026-07-01 14:51:18,363 - optuna.study.study - INFO - Trial 73 finished with values: [0.0018691113580448847, 0.0004502023060995764, 0.001166069071214543] and parameters: {'n_layers': 1, 'embedding_dim': 128, 'lr': 0.001878376227052758, 'lambda_val': 3.747302157374259e-06, 'batch_size': 1100, 'optimizer': 'Adam'}.
2026-07-01 14:53:06,124 - experiment_functions - INFO - Early stopping at epoch 1350. Best Metrics: (0.0015153954696027151, 0.0004074615808369584, 0.0011215674214082238)
2026-07-01 14:53:06,197 - optuna.study.study - INFO - Trial 74 finished with values: [0.0015153954696027151, 0.0004074615808369584, 0.0011215674214082238] and parameters: {'n_layers': 1, 'embedding_dim': 128, 'lr': 0.01071657957476966, 'lambda_val': 2.9125236439191383e-06, 'batch_size': 3604, 'optimizer': 'RMSprop'}.
2026-07-01 14:55:09,765 - experiment_functions - INFO - Early stopping at epoch 1600. Best Metrics: (0.0002425349593022531, 6.078680926239006e-05, 0.00015280818094952613)
2026-07-01 14:55:09,853 - optuna.study.study - INFO - Trial 75 finished with values: [0.0002425349593022531, 6.078680926239006e-05, 0.00015280818094952613] and parameters: {'n_layers': 1, 'embedding_dim': 96, 'lr': 6.48701223290552e-05, 'lambda_val': 0.0006778527201004557, 'batch_size': 880, 'optimizer': 'Adam'}.
2026-07-01 14:55:56,867 - experiment_functions - INFO - Early stopping at epoch 550. Best Metrics: (0.0015178244355587888, 0.00040746158083695836, 0.0010448436545634284)
2026-07-01 14:55:56,953 - optuna.study.study - INFO - Trial 76 finished with values: [0.0015178244355587888, 0.00040746158083695836, 0.0010448436545634284] and parameters: {'n_layers': 4, 'embedding_dim': 64, 'lr': 0.0405228244449841, 'lambda_val': 2.9125236439191383e-06, 'batch_size': 3604, 'optimizer': 'RMSprop'}.
2026-07-01 15:01:19,634 - optuna.study.study - INFO - Trial 77 finished with values: [0.0006841515508653788, 0.00015671599262959937, 0.0004139086483592069] and parameters: {'n_layers': 3, 'embedding_dim': 96, 'lr': 0.0002344555894573946, 'lambda_val': 0.012387749411648405, 'batch_size': 1848, 'optimizer': 'Adam'}.
2026-07-01 15:05:37,809 - experiment_functions - INFO - Early stopping at epoch 3400. Best Metrics: (0.00037289483353785725, 9.213000778830993e-05, 0.00022461725368530018)
2026-07-01 15:05:37,887 - optuna.study.study - INFO - Trial 78 finished with values: [0.00037289483353785725, 9.213000778830993e-05, 0.00022461725368530018] and parameters: {'n_layers': 2, 'embedding_dim': 64, 'lr': 0.00018567107805672465, 'lambda_val': 0.03577149464687162, 'batch_size': 3758, 'optimizer': 'Adam'}.
2026-07-01 15:07:02,343 - experiment_functions - INFO - Early stopping at epoch 1000. Best Metrics: (0.002116747196984233, 0.0005784244818874305, 0.0014388065270834565)
2026-07-01 15:07:02,419 - optuna.study.study - INFO - Trial 79 finished with values: [0.002116747196984233, 0.0005784244818874305, 0.0014388065270834565] and parameters: {'n_layers': 2, 'embedding_dim': 128, 'lr': 0.0030363640610353106, 'lambda_val': 3.9837177447581685e-05, 'batch_size': 3567, 'optimizer': 'RMSprop'}.
2026-07-01 15:07:47,746 - experiment_functions - INFO - Early stopping at epoch 500. Best Metrics: (0.00019693390448930555, 5.223866420986646e-05, 0.00012364284956958448)
2026-07-01 15:07:47,837 - optuna.study.study - INFO - Trial 80 finished with values: [0.00019693390448930555, 5.223866420986646e-05, 0.00012364284956958448] and parameters: {'n_layers': 1, 'embedding_dim': 256, 'lr': 0.019546253809520703, 'lambda_val': 0.0006938129437878243, 'batch_size': 1323, 'optimizer': 'SGD'}.
2026-07-01 15:08:40,105 - experiment_functions - INFO - Early stopping at epoch 650. Best Metrics: (0.0017834994563469657, 0.0004559010694679255, 0.0011598935954861083)
2026-07-01 15:08:40,187 - optuna.study.study - INFO - Trial 81 finished with values: [0.0017834994563469657, 0.0004559010694679255, 0.0011598935954861083] and parameters: {'n_layers': 3, 'embedding_dim': 32, 'lr': 0.011309022774653494, 'lambda_val': 8.805105847994294e-05, 'batch_size': 4034, 'optimizer': 'Adam'}.
2026-07-01 15:15:12,239 - optuna.study.study - INFO - Trial 82 finished with values: [0.002390308959644396, 0.0006601067568337672, 0.0015909887279156258] and parameters: {'n_layers': 3, 'embedding_dim': 256, 'lr': 0.0008102278066186573, 'lambda_val': 0.0006778527201004557, 'batch_size': 880, 'optimizer': 'Adam'}.
2026-07-01 15:16:04,047 - experiment_functions - INFO - Early stopping at epoch 550. Best Metrics: (0.00182605301802355, 0.0005375833444142621, 0.0012078610555792315)
2026-07-01 15:16:04,144 - optuna.study.study - INFO - Trial 83 finished with values: [0.00182605301802355, 0.0005375833444142621, 0.0012078610555792315] and parameters: {'n_layers': 4, 'embedding_dim': 128, 'lr': 0.024179138310396777, 'lambda_val': 1.413159904245194e-06, 'batch_size': 529, 'optimizer': 'Adam'}.
2026-07-01 15:21:29,913 - optuna.study.study - INFO - Trial 84 finished with values: [0.0024862460542505152, 0.0007075964515700095, 0.0017251307142139675] and parameters: {'n_layers': 3, 'embedding_dim': 96, 'lr': 0.0008423328164015242, 'lambda_val': 3.1335017132005896e-06, 'batch_size': 2924, 'optimizer': 'Adam'}.
2026-07-01 15:22:24,801 - experiment_functions - INFO - Early stopping at epoch 700. Best Metrics: (0.00017159498414365357, 6.268639705183976e-05, 0.0001113594546558762)
2026-07-01 15:22:24,895 - optuna.study.study - INFO - Trial 85 finished with values: [0.00017159498414365357, 6.268639705183976e-05, 0.0001113594546558762] and parameters: {'n_layers': 2, 'embedding_dim': 32, 'lr': 5.9167605683523374e-05, 'lambda_val': 0.02620035099122833, 'batch_size': 1838, 'optimizer': 'RMSprop'}.
2026-07-01 15:25:27,963 - experiment_functions - INFO - Early stopping at epoch 2300. Best Metrics: (0.0009985216959737641, 0.0003742187945215888, 0.000741892119112671)
2026-07-01 15:25:28,058 - optuna.study.study - INFO - Trial 86 finished with values: [0.0009985216959737641, 0.0003742187945215888, 0.000741892119112671] and parameters: {'n_layers': 2, 'embedding_dim': 96, 'lr': 0.06687940984545002, 'lambda_val': 0.03577149464687162, 'batch_size': 2825, 'optimizer': 'Adam'}.
2026-07-01 15:30:24,460 - optuna.study.study - INFO - Trial 87 finished with values: [0.0008267131724293163, 0.00020135630568166707, 0.00048667677257255596] and parameters: {'n_layers': 3, 'embedding_dim': 32, 'lr': 0.0002344555894573946, 'lambda_val': 8.805105847994294e-05, 'batch_size': 1848, 'optimizer': 'Adam'}.
2026-07-01 15:31:22,524 - experiment_functions - INFO - Early stopping at epoch 550. Best Metrics: (0.0015945418610106253, 0.00045970024504682485, 0.0010467680008332395)
2026-07-01 15:31:22,627 - optuna.study.study - INFO - Trial 88 finished with values: [0.0015945418610106253, 0.00045970024504682485, 0.0010467680008332395] and parameters: {'n_layers': 3, 'embedding_dim': 256, 'lr': 0.07542520245467159, 'lambda_val': 3.1335017132005896e-06, 'batch_size': 1631, 'optimizer': 'Adam'}.
2026-07-01 15:32:07,965 - experiment_functions - INFO - Early stopping at epoch 500. Best Metrics: (0.00020248075516821558, 5.128887031514162e-05, 0.0001170897509498642)
2026-07-01 15:32:08,051 - optuna.study.study - INFO - Trial 89 finished with values: [0.00020248075516821558, 5.128887031514162e-05, 0.0001170897509498642] and parameters: {'n_layers': 1, 'embedding_dim': 256, 'lr': 0.08085437072675228, 'lambda_val': 0.0006938129437878243, 'batch_size': 3116, 'optimizer': 'SGD'}.
2026-07-01 15:35:40,373 - experiment_functions - INFO - Early stopping at epoch 2850. Best Metrics: (0.0005236242436023345, 0.00012442300020895468, 0.00031088354844775577)
2026-07-01 15:35:40,455 - optuna.study.study - INFO - Trial 90 finished with values: [0.0005236242436023345, 0.00012442300020895468, 0.00031088354844775577] and parameters: {'n_layers': 3, 'embedding_dim': 32, 'lr': 0.00010813714265458819, 'lambda_val': 1.5726932097084567e-06, 'batch_size': 4056, 'optimizer': 'Adam'}.
2026-07-01 15:36:30,558 - experiment_functions - INFO - Early stopping at epoch 550. Best Metrics: (0.0014766807703482955, 0.00042455787094200563, 0.0010541308186693805)
2026-07-01 15:36:30,651 - optuna.study.study - INFO - Trial 91 finished with values: [0.0014766807703482955, 0.00042455787094200563, 0.0010541308186693805] and parameters: {'n_layers': 3, 'embedding_dim': 128, 'lr': 0.01617740530595442, 'lambda_val': 0.0012592144246174213, 'batch_size': 1159, 'optimizer': 'RMSprop'}.
2026-07-01 15:37:15,200 - experiment_functions - INFO - Early stopping at epoch 550. Best Metrics: (0.001124240576146557, 0.00028113899283855405, 0.0007190153610930818)
2026-07-01 15:37:15,289 - optuna.study.study - INFO - Trial 92 finished with values: [0.001124240576146557, 0.00028113899283855405, 0.0007190153610930818] and parameters: {'n_layers': 1, 'embedding_dim': 64, 'lr': 0.08473267368894868, 'lambda_val': 3.9206684194563995e-06, 'batch_size': 2816, 'optimizer': 'Adam'}.
2026-07-01 15:41:20,007 - experiment_functions - INFO - Early stopping at epoch 3250. Best Metrics: (0.002930917296891483, 0.0007550861463062516, 0.0018608334383889463)
2026-07-01 15:41:20,096 - optuna.study.study - INFO - Trial 93 finished with values: [0.002930917296891483, 0.0007550861463062516, 0.0018608334383889463] and parameters: {'n_layers': 4, 'embedding_dim': 32, 'lr': 0.0008102278066186573, 'lambda_val': 2.9125236439191383e-06, 'batch_size': 2701, 'optimizer': 'RMSprop'}.
2026-07-01 15:42:05,972 - experiment_functions - INFO - Early stopping at epoch 500. Best Metrics: (0.0008105709327056317, 0.00024504682483901, 0.0006119656106614951)
2026-07-01 15:42:06,045 - optuna.study.study - INFO - Trial 94 finished with values: [0.0008105709327056317, 0.00024504682483901, 0.0006119656106614951] and parameters: {'n_layers': 3, 'embedding_dim': 128, 'lr': 0.08122930190238219, 'lambda_val': 0.03603856247164571, 'batch_size': 3642, 'optimizer': 'RMSprop'}.
2026-07-01 15:43:03,599 - experiment_functions - INFO - Early stopping at epoch 550. Best Metrics: (0.0016227012987335282, 0.0004653990084151739, 0.0011538608088316848)
2026-07-01 15:43:03,687 - optuna.study.study - INFO - Trial 95 finished with values: [0.0016227012987335282, 0.0004653990084151739, 0.0011538608088316848] and parameters: {'n_layers': 3, 'embedding_dim': 256, 'lr': 0.08473267368894868, 'lambda_val': 3.5705571192617918e-06, 'batch_size': 2816, 'optimizer': 'Adam'}.
2026-07-01 15:48:25,737 - optuna.study.study - INFO - Trial 96 finished with values: [0.0002618984513062205, 6.36361909465646e-05, 0.00016035244071772447] and parameters: {'n_layers': 2, 'embedding_dim': 128, 'lr': 5.0018666919213385e-05, 'lambda_val': 0.0004182641746888362, 'batch_size': 3567, 'optimizer': 'RMSprop'}.
2026-07-01 15:51:07,235 - experiment_functions - INFO - Early stopping at epoch 2150. Best Metrics: (0.0022479097423940496, 0.0005917215964135783, 0.001491491157090387)
2026-07-01 15:51:07,317 - optuna.study.study - INFO - Trial 97 finished with values: [0.0022479097423940496, 0.0005917215964135783, 0.001491491157090387] and parameters: {'n_layers': 3, 'embedding_dim': 32, 'lr': 0.001878376227052758, 'lambda_val': 3.747302157374259e-06, 'batch_size': 1661, 'optimizer': 'Adam'}.
2026-07-01 15:53:18,772 - experiment_functions - INFO - Early stopping at epoch 1700. Best Metrics: (0.0017338124281185195, 0.0004701479778887981, 0.0012402994833972828)
2026-07-01 15:53:18,856 - optuna.study.study - INFO - Trial 98 finished with values: [0.0017338124281185195, 0.0004701479778887981, 0.0012402994833972828] and parameters: {'n_layers': 2, 'embedding_dim': 64, 'lr': 0.005703114197626056, 'lambda_val': 3.0256770800491656e-06, 'batch_size': 3389, 'optimizer': 'Adam'}.
2026-07-01 15:58:21,768 - optuna.study.study - INFO - Trial 99 finished with values: [0.00192518694488994, 0.00044735292441540185, 0.0012334990870844962] and parameters: {'n_layers': 1, 'embedding_dim': 96, 'lr': 0.0006563150009157793, 'lambda_val': 0.0006938129437878243, 'batch_size': 1848, 'optimizer': 'RMSprop'}.
2026-07-01 16:03:18,003 - optuna.study.study - INFO - Trial 100 finished with values: [0.0012715513842549914, 0.00031723116083809817, 0.0007934416297538789] and parameters: {'n_layers': 3, 'embedding_dim': 32, 'lr': 0.000401888224098322, 'lambda_val': 0.0041037694916939175, 'batch_size': 1427, 'optimizer': 'Adam'}.
2026-07-01 16:04:14,074 - experiment_functions - INFO - Early stopping at epoch 650. Best Metrics: (0.0013433585805521823, 0.0004274072526261801, 0.0009555927138870645)
2026-07-01 16:04:14,169 - optuna.study.study - INFO - Trial 101 finished with values: [0.0013433585805521823, 0.0004274072526261801, 0.0009555927138870645] and parameters: {'n_layers': 2, 'embedding_dim': 128, 'lr': 0.0030363640610353106, 'lambda_val': 0.020677823997699827, 'batch_size': 3567, 'optimizer': 'RMSprop'}.
2026-07-01 16:05:50,240 - experiment_functions - INFO - Early stopping at epoch 1150. Best Metrics: (0.001950940313226656, 0.0005518302528351349, 0.0013923301814555878)
2026-07-01 16:05:50,349 - optuna.study.study - INFO - Trial 102 finished with values: [0.001950940313226656, 0.0005518302528351349, 0.0013923301814555878] and parameters: {'n_layers': 2, 'embedding_dim': 128, 'lr': 0.0030363640610353106, 'lambda_val': 3.9837177447581685e-05, 'batch_size': 3567, 'optimizer': 'RMSprop'}.
2026-07-01 16:07:06,984 - experiment_functions - INFO - Early stopping at epoch 800. Best Metrics: (0.0020350440798686522, 0.000575575100203256, 0.0013463125614772615)
