2026-06-30 12:45:36,747 - optuna.study.study - INFO - Trial 81 finished with values: [0.0013631210732039621, 0.0004359553976787037, 0.000959662611555464] and parameters: {'n_layers': 1, 'embedding_dim': 128, 'lr': 0.004869490884186211, 'lambda_val': 0.014327594065318831, 'batch_size': 3139, 'optimizer': 'Adam'}.
2026-06-30 12:46:23,164 - experiment_functions - INFO - Early stopping at epoch 500. Best Metrics: (0.00014071447449590723, 4.653990084151739e-05, 8.894070872276576e-05)
2026-06-30 12:46:23,215 - optuna.study.study - INFO - Trial 82 finished with values: [0.00014071447449590723, 4.653990084151739e-05, 8.894070872276576e-05] and parameters: {'n_layers': 4, 'embedding_dim': 128, 'lr': 0.001568445204958937, 'lambda_val': 0.0002684345402178449, 'batch_size': 3288, 'optimizer': 'SGD'}.
2026-06-30 12:48:39,364 - experiment_functions - INFO - Early stopping at epoch 1850. Best Metrics: (0.0015870599086790442, 0.00037991755788993793, 0.0010297293501575534)
2026-06-30 12:48:39,431 - optuna.study.study - INFO - Trial 83 finished with values: [0.0015870599086790442, 0.00037991755788993793, 0.0010297293501575534] and parameters: {'n_layers': 1, 'embedding_dim': 32, 'lr': 0.000678453369086835, 'lambda_val': 0.012320859739201282, 'batch_size': 3257, 'optimizer': 'RMSprop'}.
2026-06-30 12:50:14,525 - experiment_functions - INFO - Early stopping at epoch 950. Best Metrics: (0.002019488904759939, 0.0006078680926239008, 0.001370612396142246)
2026-06-30 12:50:14,592 - optuna.study.study - INFO - Trial 84 finished with values: [0.002019488904759939, 0.0006078680926239008, 0.001370612396142246] and parameters: {'n_layers': 3, 'embedding_dim': 256, 'lr': 0.006717797853561655, 'lambda_val': 9.104358741363162e-06, 'batch_size': 691, 'optimizer': 'RMSprop'}.
2026-06-30 12:51:34,276 - experiment_functions - INFO - Early stopping at epoch 900. Best Metrics: (0.0016677737323196847, 0.0004568508633626503, 0.00117248834535485)
2026-06-30 12:51:34,351 - optuna.study.study - INFO - Trial 85 finished with values: [0.0016677737323196847, 0.0004568508633626503, 0.00117248834535485] and parameters: {'n_layers': 1, 'embedding_dim': 256, 'lr': 0.004843365039812707, 'lambda_val': 0.0002747455114236161, 'batch_size': 1496, 'optimizer': 'RMSprop'}.
2026-06-30 12:56:43,335 - optuna.study.study - INFO - Trial 86 finished with values: [0.0010009503039258769, 0.00022415135915506337, 0.0005832994375878743] and parameters: {'n_layers': 3, 'embedding_dim': 64, 'lr': 0.0002168513457058419, 'lambda_val': 8.040998772747945e-06, 'batch_size': 2508, 'optimizer': 'Adam'}.
2026-06-30 13:00:08,233 - experiment_functions - INFO - Early stopping at epoch 2750. Best Metrics: (0.0013208981893771533, 0.0004350056037839789, 0.0009314111364687125)
2026-06-30 13:00:08,318 - optuna.study.study - INFO - Trial 87 finished with values: [0.0013208981893771533, 0.0004350056037839789, 0.0009314111364687125] and parameters: {'n_layers': 1, 'embedding_dim': 64, 'lr': 0.017656978087572574, 'lambda_val': 0.012320859739201282, 'batch_size': 1340, 'optimizer': 'Adam'}.
2026-06-30 13:01:03,040 - experiment_functions - INFO - Early stopping at epoch 700. Best Metrics: (0.00020137547191639247, 4.748969473624223e-05, 0.00011593957889316445)
2026-06-30 13:01:03,121 - optuna.study.study - INFO - Trial 88 finished with values: [0.00020137547191639247, 4.748969473624223e-05, 0.00011593957889316445] and parameters: {'n_layers': 2, 'embedding_dim': 32, 'lr': 1.9211420375151694e-05, 'lambda_val': 0.000172821084218635, 'batch_size': 925, 'optimizer': 'Adam'}.
2026-06-30 13:02:50,291 - experiment_functions - INFO - Early stopping at epoch 1350. Best Metrics: (0.002333299065571705, 0.0006458598484128946, 0.001593180401620877)
2026-06-30 13:02:50,378 - optuna.study.study - INFO - Trial 89 finished with values: [0.002333299065571705, 0.0006458598484128946, 0.001593180401620877] and parameters: {'n_layers': 3, 'embedding_dim': 64, 'lr': 0.002537969130795011, 'lambda_val': 6.297092163325562e-06, 'batch_size': 3549, 'optimizer': 'RMSprop'}.
2026-06-30 13:03:35,679 - experiment_functions - INFO - Early stopping at epoch 500. Best Metrics: (0.00019617931093423538, 5.7937427578215534e-05, 0.00013195506009123297)
2026-06-30 13:03:35,761 - optuna.study.study - INFO - Trial 90 finished with values: [0.00019617931093423538, 5.7937427578215534e-05, 0.00013195506009123297] and parameters: {'n_layers': 3, 'embedding_dim': 128, 'lr': 0.001568445204958937, 'lambda_val': 8.420578701822342e-05, 'batch_size': 3421, 'optimizer': 'SGD'}.
2026-06-30 13:07:42,949 - experiment_functions - INFO - Early stopping at epoch 2850. Best Metrics: (0.0002359909767931561, 6.55357787360143e-05, 0.00012702004123203443)
2026-06-30 13:07:43,032 - optuna.study.study - INFO - Trial 91 finished with values: [0.0002359909767931561, 6.55357787360143e-05, 0.00012702004123203443] and parameters: {'n_layers': 4, 'embedding_dim': 128, 'lr': 4.060833583196873e-05, 'lambda_val': 0.0005632302201312664, 'batch_size': 961, 'optimizer': 'RMSprop'}.
2026-06-30 13:10:09,818 - experiment_functions - INFO - Early stopping at epoch 1850. Best Metrics: (0.001722851742098495, 0.0004445035427312273, 0.0012169702989082503)
2026-06-30 13:10:09,905 - optuna.study.study - INFO - Trial 92 finished with values: [0.001722851742098495, 0.0004445035427312273, 0.0012169702989082503] and parameters: {'n_layers': 1, 'embedding_dim': 128, 'lr': 0.004766437510594636, 'lambda_val': 1.7935776768087697e-05, 'batch_size': 1456, 'optimizer': 'Adam'}.
2026-06-30 13:14:50,693 - experiment_functions - INFO - Early stopping at epoch 3700. Best Metrics: (0.00027323008142077633, 6.268639705183975e-05, 0.00017240434186571217)
2026-06-30 13:14:50,775 - optuna.study.study - INFO - Trial 93 finished with values: [0.00027323008142077633, 6.268639705183975e-05, 0.00017240434186571217] and parameters: {'n_layers': 1, 'embedding_dim': 96, 'lr': 3.445112808415425e-05, 'lambda_val': 0.000172821084218635, 'batch_size': 2176, 'optimizer': 'Adam'}.
2026-06-30 13:16:06,942 - experiment_functions - INFO - Early stopping at epoch 900. Best Metrics: (0.0011888623577003398, 0.0004065117869422335, 0.0008314047667946663)
2026-06-30 13:16:07,034 - optuna.study.study - INFO - Trial 94 finished with values: [0.0011888623577003398, 0.0004065117869422335, 0.0008314047667946663] and parameters: {'n_layers': 2, 'embedding_dim': 128, 'lr': 0.014447029284688736, 'lambda_val': 0.012320859739201282, 'batch_size': 3789, 'optimizer': 'RMSprop'}.
2026-06-30 13:18:37,084 - experiment_functions - INFO - Early stopping at epoch 2000. Best Metrics: (0.0011352483557369936, 0.00041600972588948194, 0.0008365155286590648)
2026-06-30 13:18:37,162 - optuna.study.study - INFO - Trial 95 finished with values: [0.0011352483557369936, 0.00041600972588948194, 0.0008365155286590648] and parameters: {'n_layers': 1, 'embedding_dim': 64, 'lr': 0.07122568677043598, 'lambda_val': 0.012320859739201282, 'batch_size': 3789, 'optimizer': 'RMSprop'}.
2026-06-30 13:23:28,909 - optuna.study.study - INFO - Trial 96 finished with values: [0.0002898766699297838, 7.40839237885379e-05, 0.00014340046608887614] and parameters: {'n_layers': 2, 'embedding_dim': 32, 'lr': 4.473519296662849e-05, 'lambda_val': 0.004228737771711465, 'batch_size': 819, 'optimizer': 'Adam'}.
2026-06-30 13:25:09,974 - experiment_functions - INFO - Early stopping at epoch 1300. Best Metrics: (0.00021776004590703818, 4.8439488630967084e-05, 0.00012439804159041973)
2026-06-30 13:25:10,052 - optuna.study.study - INFO - Trial 97 finished with values: [0.00021776004590703818, 4.8439488630967084e-05, 0.00012439804159041973] and parameters: {'n_layers': 1, 'embedding_dim': 96, 'lr': 2.3934344726028388e-05, 'lambda_val': 0.022516107485598704, 'batch_size': 3789, 'optimizer': 'RMSprop'}.
2026-06-30 13:30:12,607 - optuna.study.study - INFO - Trial 98 finished with values: [0.001307695141355965, 0.0003352772448378702, 0.0008599521412219558] and parameters: {'n_layers': 2, 'embedding_dim': 64, 'lr': 0.00044843281655524526, 'lambda_val': 0.010440504100671865, 'batch_size': 3734, 'optimizer': 'Adam'}.
2026-06-30 13:31:50,625 - experiment_functions - INFO - Early stopping at epoch 1300. Best Metrics: (0.0018548886606624933, 0.00044640313052067706, 0.0011573557238709622)
2026-06-30 13:31:50,724 - optuna.study.study - INFO - Trial 99 finished with values: [0.0018548886606624933, 0.00044640313052067706, 0.0011573557238709622] and parameters: {'n_layers': 2, 'embedding_dim': 32, 'lr': 0.004124417799899418, 'lambda_val': 0.0001986652205643858, 'batch_size': 591, 'optimizer': 'Adam'}.
2026-06-30 13:32:57,488 - experiment_functions - INFO - Early stopping at epoch 850. Best Metrics: (0.0021030295593623843, 0.0006145166498869746, 0.0014084936016678365)
2026-06-30 13:32:57,599 - optuna.study.study - INFO - Trial 100 finished with values: [0.0021030295593623843, 0.0006145166498869746, 0.0014084936016678365] and parameters: {'n_layers': 4, 'embedding_dim': 32, 'lr': 0.004766437510594636, 'lambda_val': 0.0009178169951654746, 'batch_size': 697, 'optimizer': 'RMSprop'}.
2026-06-30 13:35:13,608 - experiment_functions - INFO - Early stopping at epoch 1650. Best Metrics: (0.0012646762006116932, 0.00042550766483673047, 0.0008835401106971174)
2026-06-30 13:35:13,686 - optuna.study.study - INFO - Trial 101 finished with values: [0.0012646762006116932, 0.00042550766483673047, 0.0008835401106971174] and parameters: {'n_layers': 2, 'embedding_dim': 128, 'lr': 0.07122568677043598, 'lambda_val': 0.00021110341224207427, 'batch_size': 3789, 'optimizer': 'RMSprop'}.
2026-06-30 13:37:29,293 - experiment_functions - INFO - Early stopping at epoch 1800. Best Metrics: (0.0013545252371044202, 0.00044260395494177764, 0.0009266542335407745)
2026-06-30 13:37:29,371 - optuna.study.study - INFO - Trial 102 finished with values: [0.0013545252371044202, 0.00044260395494177764, 0.0009266542335407745] and parameters: {'n_layers': 1, 'embedding_dim': 64, 'lr': 0.014447029284688736, 'lambda_val': 0.012320859739201282, 'batch_size': 3257, 'optimizer': 'RMSprop'}.
2026-06-30 13:38:25,185 - experiment_functions - INFO - Early stopping at epoch 650. Best Metrics: (0.0019286662376748471, 0.0005765248940979808, 0.0013168872356940265)
2026-06-30 13:38:25,257 - optuna.study.study - INFO - Trial 103 finished with values: [0.0019286662376748471, 0.0005765248940979808, 0.0013168872356940265] and parameters: {'n_layers': 3, 'embedding_dim': 96, 'lr': 0.00875572898955806, 'lambda_val': 0.00016218839236180774, 'batch_size': 2956, 'optimizer': 'RMSprop'}.
2026-06-30 13:39:37,502 - experiment_functions - INFO - Early stopping at epoch 850. Best Metrics: (0.0022596596647350376, 0.0006325627338867467, 0.0015930680566849016)
2026-06-30 13:39:37,591 - optuna.study.study - INFO - Trial 104 finished with values: [0.0022596596647350376, 0.0006325627338867467, 0.0015930680566849016] and parameters: {'n_layers': 3, 'embedding_dim': 96, 'lr': 0.004974098253366267, 'lambda_val': 2.8444833126965342e-05, 'batch_size': 2368, 'optimizer': 'Adam'}.
2026-06-30 13:44:47,257 - optuna.study.study - INFO - Trial 105 finished with values: [0.002602425154358766, 0.0006810022225177137, 0.0017657289481691333] and parameters: {'n_layers': 3, 'embedding_dim': 64, 'lr': 0.000678453369086835, 'lambda_val': 6.297092163325562e-06, 'batch_size': 2119, 'optimizer': 'RMSprop'}.
2026-06-30 13:49:47,302 - optuna.study.study - INFO - Trial 106 finished with values: [0.0023863151257592467, 0.0006088178865186255, 0.0015031234219199164] and parameters: {'n_layers': 4, 'embedding_dim': 32, 'lr': 0.000678453369086835, 'lambda_val': 1.2687145973445492e-05, 'batch_size': 3994, 'optimizer': 'Adam'}.
2026-06-30 13:52:03,501 - experiment_functions - INFO - Early stopping at epoch 1450. Best Metrics: (0.0019135702130432832, 0.0005404327260984367, 0.001293177599603931)
2026-06-30 13:52:03,584 - optuna.study.study - INFO - Trial 107 finished with values: [0.0019135702130432832, 0.0005404327260984367, 0.001293177599603931] and parameters: {'n_layers': 2, 'embedding_dim': 256, 'lr': 0.0019185273374190653, 'lambda_val': 0.00016218839236180774, 'batch_size': 3734, 'optimizer': 'Adam'}.
2026-06-30 13:52:55,725 - experiment_functions - INFO - Early stopping at epoch 650. Best Metrics: (0.0017574115253684165, 0.0005052903519936174, 0.001217410581593474)
2026-06-30 13:52:55,840 - optuna.study.study - INFO - Trial 108 finished with values: [0.0017574115253684165, 0.0005052903519936174, 0.001217410581593474] and parameters: {'n_layers': 4, 'embedding_dim': 32, 'lr': 0.006717797853561655, 'lambda_val': 0.0006597683688978018, 'batch_size': 1897, 'optimizer': 'RMSprop'}.
2026-06-30 13:57:48,801 - optuna.study.study - INFO - Trial 109 finished with values: [0.00076354030821395, 0.00016906331326102232, 0.00044904027208659555] and parameters: {'n_layers': 2, 'embedding_dim': 32, 'lr': 0.00044843281655524526, 'lambda_val': 0.007686038126323996, 'batch_size': 591, 'optimizer': 'Adam'}.
2026-06-30 13:58:35,612 - experiment_functions - INFO - Early stopping at epoch 500. Best Metrics: (0.00024322887553104665, 4.9389282525691926e-05, 0.00011182522005067172)
2026-06-30 13:58:35,710 - optuna.study.study - INFO - Trial 110 finished with values: [0.00024322887553104665, 4.9389282525691926e-05, 0.00011182522005067172] and parameters: {'n_layers': 4, 'embedding_dim': 128, 'lr': 0.00875572898955806, 'lambda_val': 0.00020499046063986734, 'batch_size': 1897, 'optimizer': 'SGD'}.
2026-06-30 14:01:34,542 - experiment_functions - INFO - Early stopping at epoch 1800. Best Metrics: (0.0015564115279989783, 0.0005052903519936174, 0.0011012158272145549)
2026-06-30 14:01:34,638 - optuna.study.study - INFO - Trial 111 finished with values: [0.0015564115279989783, 0.0005052903519936174, 0.0011012158272145549] and parameters: {'n_layers': 3, 'embedding_dim': 256, 'lr': 0.0005089814183335586, 'lambda_val': 0.021770054012174384, 'batch_size': 3557, 'optimizer': 'Adam'}.
2026-06-30 14:02:30,836 - experiment_functions - INFO - Early stopping at epoch 700. Best Metrics: (0.0018687147438708064, 0.00047774632904659686, 0.0012104486102269244)
2026-06-30 14:02:30,923 - optuna.study.study - INFO - Trial 112 finished with values: [0.0018687147438708064, 0.00047774632904659686, 0.0012104486102269244] and parameters: {'n_layers': 4, 'embedding_dim': 32, 'lr': 0.00875572898955806, 'lambda_val': 1.2687145973445492e-05, 'batch_size': 3652, 'optimizer': 'RMSprop'}.
2026-06-30 14:03:27,304 - experiment_functions - INFO - Early stopping at epoch 650. Best Metrics: (0.0016631090119748088, 0.0004492525122048516, 0.0011369436275140419)
2026-06-30 14:03:27,384 - optuna.study.study - INFO - Trial 113 finished with values: [0.0016631090119748088, 0.0004492525122048516, 0.0011369436275140419] and parameters: {'n_layers': 2, 'embedding_dim': 128, 'lr': 0.00875572898955806, 'lambda_val': 0.0006597683688978018, 'batch_size': 1897, 'optimizer': 'Adam'}.
2026-06-30 14:04:18,363 - experiment_functions - INFO - Early stopping at epoch 600. Best Metrics: (0.0014419500892827609, 0.0004084113747316832, 0.0010180782821101063)
2026-06-30 14:04:18,472 - optuna.study.study - INFO - Trial 114 finished with values: [0.0014419500892827609, 0.0004084113747316832, 0.0010180782821101063] and parameters: {'n_layers': 2, 'embedding_dim': 96, 'lr': 0.013659600852906724, 'lambda_val': 0.0013330885045298511, 'batch_size': 2528, 'optimizer': 'Adam'}.
2026-06-30 14:05:22,318 - experiment_functions - INFO - Early stopping at epoch 750. Best Metrics: (0.0023722154734774916, 0.0006819520164124385, 0.0016507032887541544)
2026-06-30 14:05:22,391 - optuna.study.study - INFO - Trial 115 finished with values: [0.0023722154734774916, 0.0006819520164124385, 0.0016507032887541544] and parameters: {'n_layers': 3, 'embedding_dim': 96, 'lr': 0.003664683492842946, 'lambda_val': 0.00020499046063986734, 'batch_size': 2156, 'optimizer': 'RMSprop'}.
2026-06-30 14:09:31,465 - experiment_functions - INFO - Early stopping at epoch 3100. Best Metrics: (0.00024604874350965663, 6.36361909465646e-05, 0.00016749657268991052)
2026-06-30 14:09:31,552 - optuna.study.study - INFO - Trial 116 finished with values: [0.00024604874350965663, 6.36361909465646e-05, 0.00016749657268991052] and parameters: {'n_layers': 3, 'embedding_dim': 96, 'lr': 2.7637486577263947e-05, 'lambda_val': 0.00015491559121408042, 'batch_size': 2248, 'optimizer': 'RMSprop'}.
2026-06-30 14:10:59,625 - experiment_functions - INFO - Early stopping at epoch 1050. Best Metrics: (0.002001310588538584, 0.0005774746879927056, 0.001358221251822921)
2026-06-30 14:10:59,704 - optuna.study.study - INFO - Trial 117 finished with values: [0.002001310588538584, 0.0005774746879927056, 0.001358221251822921] and parameters: {'n_layers': 3, 'embedding_dim': 96, 'lr': 0.004974098253366267, 'lambda_val': 0.00042560409247420055, 'batch_size': 1192, 'optimizer': 'Adam'}.
2026-06-30 14:16:31,258 - optuna.study.study - INFO - Trial 118 finished with values: [0.0013476655023603541, 0.00043785498546815337, 0.0009399804854300111] and parameters: {'n_layers': 4, 'embedding_dim': 96, 'lr': 0.00044843281655524526, 'lambda_val': 0.09084677064109929, 'batch_size': 3907, 'optimizer': 'RMSprop'}.
2026-06-30 14:17:30,231 - experiment_functions - INFO - Early stopping at epoch 750. Best Metrics: (0.0018929419661541564, 0.0005252360237828392, 0.001250527081877792)
2026-06-30 14:17:30,322 - optuna.study.study - INFO - Trial 119 finished with values: [0.0018929419661541564, 0.0005252360237828392, 0.001250527081877792] and parameters: {'n_layers': 3, 'embedding_dim': 32, 'lr': 0.006066311051503263, 'lambda_val': 6.297092163325562e-06, 'batch_size': 2917, 'optimizer': 'RMSprop'}.
2026-06-30 14:19:02,488 - experiment_functions - INFO - Early stopping at epoch 1200. Best Metrics: (0.0018827549685291537, 0.00046824839009934843, 0.0012069253745654047)
2026-06-30 14:19:02,569 - optuna.study.study - INFO - Trial 120 finished with values: [0.0018827549685291537, 0.00046824839009934843, 0.0012069253745654047] and parameters: {'n_layers': 1, 'embedding_dim': 64, 'lr': 0.001568445204958937, 'lambda_val': 0.00042560409247420055, 'batch_size': 2368, 'optimizer': 'RMSprop'}.
2026-06-30 14:20:20,720 - experiment_functions - INFO - Early stopping at epoch 1000. Best Metrics: (0.002580311813441167, 0.0007493873829379026, 0.0017365360943012154)
2026-06-30 14:20:20,806 - optuna.study.study - INFO - Trial 121 finished with values: [0.002580311813441167, 0.0007493873829379026, 0.0017365360943012154] and parameters: {'n_layers': 4, 'embedding_dim': 32, 'lr': 0.004124417799899418, 'lambda_val': 0.0004266264333481233, 'batch_size': 591, 'optimizer': 'RMSprop'}.
2026-06-30 14:26:47,537 - optuna.study.study - INFO - Trial 122 finished with values: [0.0010061261642416003, 0.00026784187831240626, 0.0006672089332629355] and parameters: {'n_layers': 3, 'embedding_dim': 256, 'lr': 0.0003110027047607671, 'lambda_val': 0.00023859514179547838, 'batch_size': 784, 'optimizer': 'RMSprop'}.
2026-06-30 14:27:32,393 - experiment_functions - INFO - Early stopping at epoch 550. Best Metrics: (0.0017082688405596917, 0.0005062401458883422, 0.001196687736401997)
2026-06-30 14:27:32,478 - optuna.study.study - INFO - Trial 123 finished with values: [0.0017082688405596917, 0.0005062401458883422, 0.001196687736401997] and parameters: {'n_layers': 4, 'embedding_dim': 32, 'lr': 0.00875572898955806, 'lambda_val': 0.00020499046063986734, 'batch_size': 1897, 'optimizer': 'RMSprop'}.
2026-06-30 14:31:41,508 - experiment_functions - INFO - Early stopping at epoch 2550. Best Metrics: (0.0024754081132246975, 0.0007123454210436335, 0.0017156333062718807)
2026-06-30 14:31:41,589 - optuna.study.study - INFO - Trial 124 finished with values: [0.0024754081132246975, 0.0007123454210436335, 0.0017156333062718807] and parameters: {'n_layers': 3, 'embedding_dim': 256, 'lr': 0.00044843281655524526, 'lambda_val': 0.00023859514179547838, 'batch_size': 4084, 'optimizer': 'RMSprop'}.
2026-06-30 14:32:26,454 - experiment_functions - INFO - Early stopping at epoch 500. Best Metrics: (0.0002006284566893007, 4.7489694736242234e-05, 0.00010778080232338326)
2026-06-30 14:32:26,540 - optuna.study.study - INFO - Trial 125 finished with values: [0.0002006284566893007, 4.7489694736242234e-05, 0.00010778080232338326] and parameters: {'n_layers': 4, 'embedding_dim': 96, 'lr': 5.696473453390322e-05, 'lambda_val': 0.024320659830107946, 'batch_size': 2528, 'optimizer': 'SGD'}.
2026-06-30 14:33:42,773 - experiment_functions - INFO - Early stopping at epoch 900. Best Metrics: (0.001627454934279325, 0.00046729859620462365, 0.0011651752892515408)
2026-06-30 14:33:42,862 - optuna.study.study - INFO - Trial 126 finished with values: [0.001627454934279325, 0.00046729859620462365, 0.0011651752892515408] and parameters: {'n_layers': 2, 'embedding_dim': 128, 'lr': 0.004766437510594636, 'lambda_val': 0.0013330885045298511, 'batch_size': 2119, 'optimizer': 'Adam'}.
2026-06-30 14:38:35,446 - optuna.study.study - INFO - Trial 127 finished with values: [0.0009441574571246547, 0.00021560321410253976, 0.0006104383045083925] and parameters: {'n_layers': 2, 'embedding_dim': 32, 'lr': 0.0005089814183335586, 'lambda_val': 0.021770054012174384, 'batch_size': 2196, 'optimizer': 'RMSprop'}.
2026-06-30 14:43:58,323 - optuna.study.study - INFO - Trial 128 finished with values: [0.0022002261927274243, 0.0006259141766236727, 0.0015379543329216748] and parameters: {'n_layers': 3, 'embedding_dim': 96, 'lr': 0.0006387010239111333, 'lambda_val': 0.00016218839236180774, 'batch_size': 2156, 'optimizer': 'Adam'}.
2026-06-30 14:44:47,105 - experiment_functions - INFO - Early stopping at epoch 600. Best Metrics: (0.001249663167795512, 0.00035902209220599134, 0.0008122246600483069)
