2026-07-01 20:08:03,503 - optuna.study.study - INFO - Trial 197 finished with values: [0.002272375453225745, 0.0006753034591493646, 0.0015967099526725355] and parameters: {'n_layers': 3, 'embedding_dim': 96, 'lr': 0.001878376227052758, 'lambda_val': 0.0012592144246174213, 'batch_size': 3082, 'optimizer': 'RMSprop'}.
2026-07-01 20:08:52,165 - experiment_functions - INFO - Early stopping at epoch 500. Best Metrics: (0.0001755359404107184, 3.894154968371863e-05, 0.00011186246795285524)
2026-07-01 20:08:52,277 - optuna.study.study - INFO - Trial 198 finished with values: [0.0001755359404107184, 3.894154968371863e-05, 0.00011186246795285524] and parameters: {'n_layers': 2, 'embedding_dim': 256, 'lr': 0.019546253809520703, 'lambda_val': 4.5390100598147375e-06, 'batch_size': 1035, 'optimizer': 'SGD'}.
2026-07-01 20:11:09,201 - experiment_functions - INFO - Early stopping at epoch 1600. Best Metrics: (0.002250016748670167, 0.0006886005736755124, 0.0015767653789734418)
2026-07-01 20:11:09,450 - optuna.study.study - INFO - Trial 199 finished with values: [0.002250016748670167, 0.0006886005736755124, 0.0015767653789734418] and parameters: {'n_layers': 3, 'embedding_dim': 128, 'lr': 0.0030363640610353106, 'lambda_val': 4.5390100598147375e-06, 'batch_size': 3263, 'optimizer': 'RMSprop'}.
2026-07-01 20:16:03,451 - optuna.study.study - INFO - Trial 200 finished with values: [0.0020793885528436738, 0.0004986417947305435, 0.0013826495352300047] and parameters: {'n_layers': 2, 'embedding_dim': 32, 'lr': 0.0008423328164015242, 'lambda_val': 0.0006778527201004557, 'batch_size': 1159, 'optimizer': 'RMSprop'}.
2026-07-01 20:17:21,428 - experiment_functions - INFO - Early stopping at epoch 900. Best Metrics: (0.0024428381685252837, 0.0007237429477803317, 0.0015938188526508188)
2026-07-01 20:17:22,354 - optuna.study.study - INFO - Trial 201 finished with values: [0.0024428381685252837, 0.0007237429477803317, 0.0015938188526508188] and parameters: {'n_layers': 4, 'embedding_dim': 96, 'lr': 0.0030363640610353106, 'lambda_val': 0.0006778527201004557, 'batch_size': 1159, 'optimizer': 'RMSprop'}.
2026-07-01 20:18:10,936 - experiment_functions - INFO - Early stopping at epoch 500. Best Metrics: (0.00022792500851782173, 5.888722147294038e-05, 0.00013972047037323466)
2026-07-01 20:18:11,045 - optuna.study.study - INFO - Trial 202 finished with values: [0.00022792500851782173, 5.888722147294038e-05, 0.00013972047037323466] and parameters: {'n_layers': 2, 'embedding_dim': 256, 'lr': 0.0008423328164015242, 'lambda_val': 3.1335017132005896e-06, 'batch_size': 1848, 'optimizer': 'SGD'}.
2026-07-01 20:19:11,961 - experiment_functions - INFO - Early stopping at epoch 550. Best Metrics: (0.0019939133669097057, 0.000568926542940182, 0.0014255664974655237)
2026-07-01 20:19:12,063 - optuna.study.study - INFO - Trial 203 finished with values: [0.0019939133669097057, 0.000568926542940182, 0.0014255664974655237] and parameters: {'n_layers': 4, 'embedding_dim': 256, 'lr': 0.01815593558640291, 'lambda_val': 2.9125236439191383e-06, 'batch_size': 1848, 'optimizer': 'RMSprop'}.
2026-07-01 20:21:02,959 - experiment_functions - INFO - Early stopping at epoch 1300. Best Metrics: (0.0023347294498158515, 0.0006297133522025722, 0.0015713375713391534)
2026-07-01 20:21:03,153 - optuna.study.study - INFO - Trial 204 finished with values: [0.0023347294498158515, 0.0006297133522025722, 0.0015713375713391534] and parameters: {'n_layers': 3, 'embedding_dim': 128, 'lr': 0.0020091203438644, 'lambda_val': 1.1427509100447198e-06, 'batch_size': 2726, 'optimizer': 'Adam'}.
2026-07-01 20:22:48,917 - experiment_functions - INFO - Early stopping at epoch 1450. Best Metrics: (0.001983583776227462, 0.00045780065725737517, 0.001301960063069109)
2026-07-01 20:22:49,075 - optuna.study.study - INFO - Trial 205 finished with values: [0.001983583776227462, 0.00045780065725737517, 0.001301960063069109] and parameters: {'n_layers': 1, 'embedding_dim': 32, 'lr': 0.001878376227052758, 'lambda_val': 0.0006778527201004557, 'batch_size': 1100, 'optimizer': 'Adam'}.
2026-07-01 20:25:31,118 - experiment_functions - INFO - Early stopping at epoch 1650. Best Metrics: (0.002546426799543303, 0.0007598351157798758, 0.0016725077628820305)
2026-07-01 20:25:31,210 - optuna.study.study - INFO - Trial 206 finished with values: [0.002546426799543303, 0.0007598351157798758, 0.0016725077628820305] and parameters: {'n_layers': 3, 'embedding_dim': 256, 'lr': 0.001878376227052758, 'lambda_val': 3.747302157374259e-06, 'batch_size': 2701, 'optimizer': 'RMSprop'}.
2026-07-01 20:26:37,729 - experiment_functions - INFO - Early stopping at epoch 850. Best Metrics: (0.0023921444118218905, 0.0006838516042018884, 0.001630411198563607)
2026-07-01 20:26:37,841 - optuna.study.study - INFO - Trial 207 finished with values: [0.0023921444118218905, 0.0006838516042018884, 0.001630411198563607] and parameters: {'n_layers': 4, 'embedding_dim': 32, 'lr': 0.0030363640610353106, 'lambda_val': 3.9837177447581685e-05, 'batch_size': 3056, 'optimizer': 'RMSprop'}.
2026-07-01 20:30:51,293 - experiment_functions - INFO - Early stopping at epoch 3450. Best Metrics: (0.0031082388124461474, 0.0008282202762000646, 0.002129385271626029)
2026-07-01 20:30:51,393 - optuna.study.study - INFO - Trial 208 finished with values: [0.0031082388124461474, 0.0008282202762000646, 0.002129385271626029] and parameters: {'n_layers': 3, 'embedding_dim': 32, 'lr': 0.001878376227052758, 'lambda_val': 4.427987057533364e-06, 'batch_size': 694, 'optimizer': 'RMSprop'}.
2026-07-01 20:35:04,475 - experiment_functions - INFO - Early stopping at epoch 3400. Best Metrics: (0.0025162993418592346, 0.0006658055202021162, 0.0017427338703091039)
2026-07-01 20:35:04,591 - optuna.study.study - INFO - Trial 209 finished with values: [0.0025162993418592346, 0.0006658055202021162, 0.0017427338703091039] and parameters: {'n_layers': 4, 'embedding_dim': 32, 'lr': 0.0008423328164015242, 'lambda_val': 8.805105847994294e-05, 'batch_size': 4034, 'optimizer': 'RMSprop'}.
2026-07-01 20:36:10,863 - experiment_functions - INFO - Early stopping at epoch 750. Best Metrics: (0.002100707102994032, 0.0006135668559922496, 0.0014225405842923245)
2026-07-01 20:36:11,148 - optuna.study.study - INFO - Trial 210 finished with values: [0.002100707102994032, 0.0006135668559922496, 0.0014225405842923245] and parameters: {'n_layers': 3, 'embedding_dim': 128, 'lr': 0.001878376227052758, 'lambda_val': 0.0012592144246174213, 'batch_size': 4034, 'optimizer': 'RMSprop'}.
2026-07-01 20:41:04,148 - experiment_functions - INFO - Early stopping at epoch 3950. Best Metrics: (0.002705336933877326, 0.0007465380012537281, 0.0018096893111634454)
2026-07-01 20:41:04,233 - optuna.study.study - INFO - Trial 211 finished with values: [0.002705336933877326, 0.0007465380012537281, 0.0018096893111634454] and parameters: {'n_layers': 4, 'embedding_dim': 32, 'lr': 0.0008102278066186573, 'lambda_val': 3.1335017132005896e-06, 'batch_size': 2701, 'optimizer': 'RMSprop'}.
2026-07-01 20:42:26,680 - experiment_functions - INFO - Early stopping at epoch 950. Best Metrics: (0.002438614650594344, 0.0006648557263073913, 0.0016777606068903333)
2026-07-01 20:42:27,500 - optuna.study.study - INFO - Trial 212 finished with values: [0.002438614650594344, 0.0006648557263073913, 0.0016777606068903333] and parameters: {'n_layers': 3, 'embedding_dim': 128, 'lr': 0.001878376227052758, 'lambda_val': 8.805105847994294e-05, 'batch_size': 4034, 'optimizer': 'RMSprop'}.
2026-07-01 20:47:33,209 - optuna.study.study - INFO - Trial 213 finished with values: [0.0007713066492861305, 0.00020040651178694229, 0.00048284208596777227] and parameters: {'n_layers': 1, 'embedding_dim': 128, 'lr': 0.00034173428273577447, 'lambda_val': 1.413159904245194e-06, 'batch_size': 1100, 'optimizer': 'RMSprop'}.
2026-07-01 20:48:49,258 - experiment_functions - INFO - Early stopping at epoch 750. Best Metrics: (0.002098471922538385, 0.0006173660315711492, 0.0014300528986233856)
2026-07-01 20:48:49,378 - optuna.study.study - INFO - Trial 214 finished with values: [0.002098471922538385, 0.0006173660315711492, 0.0014300528986233856] and parameters: {'n_layers': 3, 'embedding_dim': 256, 'lr': 0.001878376227052758, 'lambda_val': 0.0012592144246174213, 'batch_size': 3074, 'optimizer': 'RMSprop'}.
2026-07-01 20:50:54,168 - experiment_functions - INFO - Early stopping at epoch 1650. Best Metrics: (0.0024041743339231814, 0.000661056550728492, 0.001648141422273522)
2026-07-01 20:50:54,252 - optuna.study.study - INFO - Trial 215 finished with values: [0.0024041743339231814, 0.000661056550728492, 0.001648141422273522] and parameters: {'n_layers': 4, 'embedding_dim': 32, 'lr': 0.001878376227052758, 'lambda_val': 2.9125236439191383e-06, 'batch_size': 1100, 'optimizer': 'Adam'}.
2026-07-01 20:53:01,768 - experiment_functions - INFO - Early stopping at epoch 1700. Best Metrics: (0.003194722416641092, 0.0008301198639895143, 0.002038595398939571)
2026-07-01 20:53:02,215 - optuna.study.study - INFO - Trial 216 finished with values: [0.003194722416641092, 0.0008301198639895143, 0.002038595398939571] and parameters: {'n_layers': 3, 'embedding_dim': 32, 'lr': 0.001878376227052758, 'lambda_val': 3.747302157374259e-06, 'batch_size': 1100, 'optimizer': 'RMSprop'}.
2026-07-01 20:55:47,927 - experiment_functions - INFO - Early stopping at epoch 2200. Best Metrics: (0.0036525506361248937, 0.0010058317345136105, 0.0024335786833407603)
2026-07-01 20:55:48,021 - optuna.study.study - INFO - Trial 217 finished with values: [0.0036525506361248937, 0.0010058317345136105, 0.0024335786833407603] and parameters: {'n_layers': 4, 'embedding_dim': 32, 'lr': 0.0016422068986048546, 'lambda_val': 1.1427509100447198e-06, 'batch_size': 1051, 'optimizer': 'RMSprop'}.
2026-07-01 21:01:22,389 - optuna.study.study - INFO - Trial 218 finished with values: [0.0024137710964545153, 0.0006886005736755124, 0.0016613566821593179] and parameters: {'n_layers': 3, 'embedding_dim': 128, 'lr': 0.0008423328164015242, 'lambda_val': 0.0006778527201004557, 'batch_size': 1848, 'optimizer': 'Adam'}.
2026-07-01 21:02:19,585 - experiment_functions - INFO - Early stopping at epoch 650. Best Metrics: (0.002353040818006323, 0.0006810022225177136, 0.0015713247259294986)
2026-07-01 21:02:19,689 - optuna.study.study - INFO - Trial 219 finished with values: [0.002353040818006323, 0.0006810022225177136, 0.0015713247259294986] and parameters: {'n_layers': 4, 'embedding_dim': 96, 'lr': 0.006505331334905405, 'lambda_val': 2.9125236439191383e-06, 'batch_size': 2026, 'optimizer': 'RMSprop'}.
2026-07-01 21:03:50,147 - experiment_functions - INFO - Early stopping at epoch 1100. Best Metrics: (0.0024683916820599666, 0.0006905001614649621, 0.0017021220642073995)
2026-07-01 21:03:50,237 - optuna.study.study - INFO - Trial 220 finished with values: [0.0024683916820599666, 0.0006905001614649621, 0.0017021220642073995] and parameters: {'n_layers': 3, 'embedding_dim': 96, 'lr': 0.001878376227052758, 'lambda_val': 0.0006778527201004557, 'batch_size': 1470, 'optimizer': 'RMSprop'}.
2026-07-01 21:10:18,291 - optuna.study.study - INFO - Trial 221 finished with values: [0.0024547678622440063, 0.0006829018103071632, 0.0016572600244044934] and parameters: {'n_layers': 3, 'embedding_dim': 256, 'lr': 0.0008423328164015242, 'lambda_val': 2.0117688743440434e-05, 'batch_size': 1965, 'optimizer': 'Adam'}.
2026-07-01 21:12:33,664 - experiment_functions - INFO - Early stopping at epoch 1600. Best Metrics: (0.0029338634079379357, 0.000862412856410159, 0.002025636387848933)
2026-07-01 21:12:34,201 - optuna.study.study - INFO - Trial 222 finished with values: [0.0029338634079379357, 0.000862412856410159, 0.002025636387848933] and parameters: {'n_layers': 3, 'embedding_dim': 128, 'lr': 0.001878376227052758, 'lambda_val': 3.747302157374259e-06, 'batch_size': 1100, 'optimizer': 'RMSprop'}.
2026-07-01 21:15:17,446 - experiment_functions - INFO - Early stopping at epoch 2200. Best Metrics: (0.0033404206568619153, 0.000844366772410387, 0.0021824154757584765)
2026-07-01 21:15:17,529 - optuna.study.study - INFO - Trial 223 finished with values: [0.0033404206568619153, 0.000844366772410387, 0.0021824154757584765] and parameters: {'n_layers': 3, 'embedding_dim': 32, 'lr': 0.001878376227052758, 'lambda_val': 1.413159904245194e-06, 'batch_size': 1100, 'optimizer': 'RMSprop'}.
2026-07-01 21:19:00,350 - experiment_functions - INFO - Early stopping at epoch 3000. Best Metrics: (0.002645757455854508, 0.0007028474820963851, 0.0017370553892823663)
2026-07-01 21:19:00,572 - optuna.study.study - INFO - Trial 224 finished with values: [0.002645757455854508, 0.0007028474820963851, 0.0017370553892823663] and parameters: {'n_layers': 4, 'embedding_dim': 32, 'lr': 0.0008102278066186573, 'lambda_val': 0.0012592144246174213, 'batch_size': 2701, 'optimizer': 'RMSprop'}.
2026-07-01 21:24:19,771 - optuna.study.study - INFO - Trial 225 finished with values: [0.0025870120982069227, 0.0006791026347282641, 0.001750382612574956] and parameters: {'n_layers': 3, 'embedding_dim': 96, 'lr': 0.0008102278066186573, 'lambda_val': 8.805105847994294e-05, 'batch_size': 1159, 'optimizer': 'Adam'}.
2026-07-01 21:28:07,968 - experiment_functions - INFO - Early stopping at epoch 2750. Best Metrics: (0.002673009213284475, 0.0007712326425165738, 0.0018885414671849815)
2026-07-01 21:28:08,070 - optuna.study.study - INFO - Trial 226 finished with values: [0.002673009213284475, 0.0007712326425165738, 0.0018885414671849815] and parameters: {'n_layers': 3, 'embedding_dim': 128, 'lr': 0.0008549054963496413, 'lambda_val': 0.0006778527201004557, 'batch_size': 1050, 'optimizer': 'RMSprop'}.
2026-07-01 21:32:27,215 - experiment_functions - INFO - Early stopping at epoch 3100. Best Metrics: (0.0023397420550992486, 0.0006648557263073913, 0.001596498316743682)
2026-07-01 21:32:27,309 - optuna.study.study - INFO - Trial 227 finished with values: [0.0023397420550992486, 0.0006648557263073913, 0.001596498316743682] and parameters: {'n_layers': 3, 'embedding_dim': 128, 'lr': 0.0008102278066186573, 'lambda_val': 0.00034740027371853627, 'batch_size': 3420, 'optimizer': 'Adam'}.
2026-07-01 21:37:33,635 - optuna.study.study - INFO - Trial 228 finished with values: [0.002072564293325432, 0.0005375833444142621, 0.0013692722219423908] and parameters: {'n_layers': 3, 'embedding_dim': 64, 'lr': 0.0006014877491059857, 'lambda_val': 0.0006778527201004557, 'batch_size': 2924, 'optimizer': 'Adam'}.
2026-07-01 21:43:08,736 - optuna.study.study - INFO - Trial 229 finished with values: [0.002560770239346752, 0.0006971487187280359, 0.001797988955448766] and parameters: {'n_layers': 3, 'embedding_dim': 128, 'lr': 0.0008102278066186573, 'lambda_val': 3.0256770800491656e-06, 'batch_size': 1848, 'optimizer': 'Adam'}.
2026-07-01 21:44:14,436 - experiment_functions - INFO - Early stopping at epoch 800. Best Metrics: (0.0017132384705635679, 0.0004179093136789317, 0.0010987090023387178)
2026-07-01 21:44:14,508 - optuna.study.study - INFO - Trial 230 finished with values: [0.0017132384705635679, 0.0004179093136789317, 0.0010987090023387178] and parameters: {'n_layers': 1, 'embedding_dim': 128, 'lr': 0.0020091203438644, 'lambda_val': 0.002060089880309017, 'batch_size': 2701, 'optimizer': 'RMSprop'}.
2026-07-01 21:46:06,534 - experiment_functions - INFO - Early stopping at epoch 1300. Best Metrics: (0.0025952155426796886, 0.0007465380012537281, 0.0017500335154268416)
2026-07-01 21:46:06,606 - optuna.study.study - INFO - Trial 231 finished with values: [0.0025952155426796886, 0.0007465380012537281, 0.0017500335154268416] and parameters: {'n_layers': 3, 'embedding_dim': 128, 'lr': 0.0016422068986048546, 'lambda_val': 0.0006778527201004557, 'batch_size': 880, 'optimizer': 'RMSprop'}.
2026-07-01 21:48:04,706 - experiment_functions - INFO - Early stopping at epoch 1550. Best Metrics: (0.0025150389182015233, 0.0006477594362023442, 0.0016692605611141398)
2026-07-01 21:48:04,848 - optuna.study.study - INFO - Trial 232 finished with values: [0.0025150389182015233, 0.0006477594362023442, 0.0016692605611141398] and parameters: {'n_layers': 3, 'embedding_dim': 32, 'lr': 0.001878376227052758, 'lambda_val': 3.747302157374259e-06, 'batch_size': 3173, 'optimizer': 'RMSprop'}.
2026-07-01 21:53:05,022 - optuna.study.study - INFO - Trial 233 finished with values: [0.002714024387738191, 0.0007104458332541838, 0.0018045442270471937] and parameters: {'n_layers': 4, 'embedding_dim': 32, 'lr': 0.0008423328164015242, 'lambda_val': 0.0006778527201004557, 'batch_size': 1159, 'optimizer': 'Adam'}.
2026-07-01 21:56:05,889 - experiment_functions - INFO - Early stopping at epoch 2050. Best Metrics: (0.002562828609472206, 0.000721843359990882, 0.0016950999552755761)
2026-07-01 21:56:06,421 - optuna.study.study - INFO - Trial 234 finished with values: [0.002562828609472206, 0.000721843359990882, 0.0016950999552755761] and parameters: {'n_layers': 4, 'embedding_dim': 128, 'lr': 0.0008423328164015242, 'lambda_val': 0.00028417824693763923, 'batch_size': 4034, 'optimizer': 'Adam'}.
2026-07-01 22:00:23,133 - experiment_functions - INFO - Early stopping at epoch 2950. Best Metrics: (0.003100943299199907, 0.0008700112075679578, 0.002024323991528772)
2026-07-01 22:00:24,447 - optuna.study.study - INFO - Trial 235 finished with values: [0.003100943299199907, 0.0008700112075679578, 0.002024323991528772] and parameters: {'n_layers': 4, 'embedding_dim': 128, 'lr': 0.0008102278066186573, 'lambda_val': 1.413159904245194e-06, 'batch_size': 2701, 'optimizer': 'RMSprop'}.
2026-07-01 22:05:19,470 - optuna.study.study - INFO - Trial 236 finished with values: [0.002429316176789486, 0.0005822236574663297, 0.0015732682471508274] and parameters: {'n_layers': 3, 'embedding_dim': 32, 'lr': 0.0008102278066186573, 'lambda_val': 0.0006778527201004557, 'batch_size': 880, 'optimizer': 'RMSprop'}.
2026-07-01 22:10:50,554 - experiment_functions - INFO - Early stopping at epoch 3950. Best Metrics: (0.0028078062326490133, 0.0007759816119901981, 0.0018673145329842979)
2026-07-01 22:10:50,631 - optuna.study.study - INFO - Trial 237 finished with values: [0.0028078062326490133, 0.0007759816119901981, 0.0018673145329842979] and parameters: {'n_layers': 3, 'embedding_dim': 128, 'lr': 0.0008423328164015242, 'lambda_val': 1.7400188628222683e-06, 'batch_size': 3927, 'optimizer': 'RMSprop'}.
2026-07-01 22:12:26,800 - experiment_functions - INFO - Early stopping at epoch 950. Best Metrics: (0.0023259896076534233, 0.0006696046957810156, 0.0015362562090742928)
2026-07-01 22:12:26,934 - optuna.study.study - INFO - Trial 238 finished with values: [0.0023259896076534233, 0.0006696046957810156, 0.0015362562090742928] and parameters: {'n_layers': 3, 'embedding_dim': 256, 'lr': 0.003286887054674964, 'lambda_val': 1.1427509100447198e-06, 'batch_size': 3448, 'optimizer': 'RMSprop'}.
2026-07-01 22:13:11,893 - experiment_functions - INFO - Early stopping at epoch 550. Best Metrics: (0.0012203800651276137, 0.0003210303364169975, 0.0008239835757242003)
2026-07-01 22:13:12,016 - optuna.study.study - INFO - Trial 239 finished with values: [0.0012203800651276137, 0.0003210303364169975, 0.0008239835757242003] and parameters: {'n_layers': 4, 'embedding_dim': 32, 'lr': 0.09070206622840378, 'lambda_val': 3.1335017132005896e-06, 'batch_size': 2924, 'optimizer': 'Adam'}.
2026-07-01 22:18:08,090 - optuna.study.study - INFO - Trial 240 finished with values: [0.0004954506166833615, 0.000122523412419505, 0.0002697953637042945] and parameters: {'n_layers': 3, 'embedding_dim': 32, 'lr': 0.00011826104032033762, 'lambda_val': 3.747302157374259e-06, 'batch_size': 3082, 'optimizer': 'RMSprop'}.
2026-07-01 22:21:09,892 - experiment_functions - INFO - Early stopping at epoch 2350. Best Metrics: (0.0018242329933885785, 0.0004169595197842069, 0.0011172477123943742)
2026-07-01 22:21:09,980 - optuna.study.study - INFO - Trial 241 finished with values: [0.0018242329933885785, 0.0004169595197842069, 0.0011172477123943742] and parameters: {'n_layers': 1, 'embedding_dim': 96, 'lr': 0.0008102278066186573, 'lambda_val': 2.9125236439191383e-06, 'batch_size': 2924, 'optimizer': 'Adam'}.
2026-07-01 22:24:33,693 - experiment_functions - INFO - Early stopping at epoch 2300. Best Metrics: (0.0025618759360100897, 0.0007417890317801038, 0.0017830803670223453)
2026-07-01 22:24:33,762 - optuna.study.study - INFO - Trial 242 finished with values: [0.0025618759360100897, 0.0007417890317801038, 0.0017830803670223453] and parameters: {'n_layers': 4, 'embedding_dim': 128, 'lr': 0.0008423328164015242, 'lambda_val': 4.5390100598147375e-06, 'batch_size': 3263, 'optimizer': 'Adam'}.
2026-07-01 22:28:02,962 - experiment_functions - INFO - Early stopping at epoch 2800. Best Metrics: (0.00028436345441831763, 7.503371768326274e-05, 0.0001724627669858476)
2026-07-01 22:28:03,032 - optuna.study.study - INFO - Trial 243 finished with values: [0.00028436345441831763, 7.503371768326274e-05, 0.0001724627669858476] and parameters: {'n_layers': 4, 'embedding_dim': 32, 'lr': 5.4745597790617536e-05, 'lambda_val': 0.00068223832506485, 'batch_size': 1661, 'optimizer': 'Adam'}.
2026-07-01 22:32:42,339 - experiment_functions - INFO - Early stopping at epoch 3750. Best Metrics: (0.0030695825704531512, 0.0008462663601998366, 0.002019061534108494)
2026-07-01 22:32:42,431 - optuna.study.study - INFO - Trial 244 finished with values: [0.0030695825704531512, 0.0008462663601998366, 0.002019061534108494] and parameters: {'n_layers': 4, 'embedding_dim': 32, 'lr': 0.0008423328164015242, 'lambda_val': 3.1335017132005896e-06, 'batch_size': 1661, 'optimizer': 'RMSprop'}.
2026-07-01 22:35:02,813 - experiment_functions - INFO - Early stopping at epoch 1650. Best Metrics: (0.0029424239348791008, 0.0008320194517789641, 0.0019483322548701386)
