2026-06-28 07:25:50,334 - optuna.study.study - INFO - Trial 216 finished with values: [0.031450872652818186, 0.007023725851490228, 0.019521583827747657] and parameters: {'n_layers': 1, 'embedding_dim': 128, 'lr': 0.001948110338269317, 'lambda_val': 1.5450706960350556e-06, 'batch_size': 2430, 'optimizer': 'Adam'}.
2026-06-28 07:31:41,071 - optuna.study.study - INFO - Trial 217 finished with values: [0.026342146796396532, 0.0056123321239291086, 0.015454936979997223] and parameters: {'n_layers': 1, 'embedding_dim': 96, 'lr': 0.005739501470387607, 'lambda_val': 0.000307769265113033, 'batch_size': 4066, 'optimizer': 'RMSprop'}.
2026-06-28 07:38:39,648 - optuna.study.study - INFO - Trial 218 finished with values: [0.029978150327236636, 0.0065754231331801, 0.01825277620617711] and parameters: {'n_layers': 1, 'embedding_dim': 256, 'lr': 0.007515611127205712, 'lambda_val': 9.540675805568016e-05, 'batch_size': 2778, 'optimizer': 'RMSprop'}.
2026-06-28 07:45:32,592 - optuna.study.study - INFO - Trial 219 finished with values: [0.016127371410142536, 0.0035341830822711476, 0.009418391224747996] and parameters: {'n_layers': 3, 'embedding_dim': 96, 'lr': 0.001948110338269317, 'lambda_val': 0.000307769265113033, 'batch_size': 3568, 'optimizer': 'Adam'}.
2026-06-28 07:51:51,196 - optuna.study.study - INFO - Trial 220 finished with values: [0.01672120083641936, 0.0036519575252170282, 0.00969921244055634] and parameters: {'n_layers': 2, 'embedding_dim': 96, 'lr': 0.005739501470387607, 'lambda_val': 0.0006043567828314722, 'batch_size': 3238, 'optimizer': 'RMSprop'}.
2026-06-28 07:57:40,186 - optuna.study.study - INFO - Trial 221 finished with values: [0.023185021783448286, 0.005005413825199932, 0.013629412919460498] and parameters: {'n_layers': 1, 'embedding_dim': 96, 'lr': 0.005739501470387607, 'lambda_val': 0.0006043567828314722, 'batch_size': 2430, 'optimizer': 'Adam'}.
2026-06-28 08:03:15,214 - optuna.study.study - INFO - Trial 222 finished with values: [0.020860147620659276, 0.00464829132078339, 0.012491373053095552] and parameters: {'n_layers': 1, 'embedding_dim': 64, 'lr': 0.011943294714746845, 'lambda_val': 3.731801442207796e-05, 'batch_size': 2778, 'optimizer': 'RMSprop'}.
2026-06-28 08:09:03,634 - optuna.study.study - INFO - Trial 223 finished with values: [0.02632681744457815, 0.00581273863571605, 0.01587297543303682] and parameters: {'n_layers': 1, 'embedding_dim': 96, 'lr': 0.001948110338269317, 'lambda_val': 6.447923168817336e-05, 'batch_size': 2292, 'optimizer': 'RMSprop'}.
2026-06-28 08:10:07,326 - experiment_functions - INFO - Early stopping at epoch 550. Best Metrics: (0.0014984831956476462, 0.00039701384799498515, 0.0009868323210644246)
2026-06-28 08:10:07,411 - optuna.study.study - INFO - Trial 224 finished with values: [0.0014984831956476462, 0.00039701384799498515, 0.0009868323210644246] and parameters: {'n_layers': 3, 'embedding_dim': 128, 'lr': 0.005739501470387607, 'lambda_val': 0.09239924376488579, 'batch_size': 4066, 'optimizer': 'Adam'}.
2026-06-28 08:16:08,840 - optuna.study.study - INFO - Trial 225 finished with values: [0.02349955249082167, 0.00520107136751325, 0.013959559605918272] and parameters: {'n_layers': 1, 'embedding_dim': 128, 'lr': 0.005739501470387607, 'lambda_val': 0.0006043567828314722, 'batch_size': 2563, 'optimizer': 'RMSprop'}.
2026-06-28 08:17:11,741 - experiment_functions - INFO - Early stopping at epoch 700. Best Metrics: (0.0019369257871420108, 0.0005964705658872024, 0.0012692700144202108)
2026-06-28 08:17:11,826 - optuna.study.study - INFO - Trial 226 finished with values: [0.0019369257871420108, 0.0005964705658872024, 0.0012692700144202108] and parameters: {'n_layers': 1, 'embedding_dim': 96, 'lr': 0.08415610322112996, 'lambda_val': 6.447923168817336e-05, 'batch_size': 2778, 'optimizer': 'RMSprop'}.
2026-06-28 08:22:48,919 - optuna.study.study - INFO - Trial 227 finished with values: [0.026425421843595455, 0.005903918849609635, 0.016308770009609286] and parameters: {'n_layers': 1, 'embedding_dim': 64, 'lr': 0.001948110338269317, 'lambda_val': 6.447923168817336e-05, 'batch_size': 2430, 'optimizer': 'RMSprop'}.
2026-06-28 08:23:41,787 - experiment_functions - INFO - Early stopping at epoch 500. Best Metrics: (0.00018920172302181885, 4.843948863096708e-05, 0.00011071330114217072)
2026-06-28 08:23:41,859 - optuna.study.study - INFO - Trial 228 finished with values: [0.00018920172302181885, 4.843948863096708e-05, 0.00011071330114217072] and parameters: {'n_layers': 2, 'embedding_dim': 128, 'lr': 0.005739501470387607, 'lambda_val': 6.447923168817336e-05, 'batch_size': 2896, 'optimizer': 'SGD'}.
2026-06-28 08:30:04,340 - optuna.study.study - INFO - Trial 229 finished with values: [0.016341859341564517, 0.003549379784586745, 0.009561067376465249] and parameters: {'n_layers': 2, 'embedding_dim': 96, 'lr': 0.001948110338269317, 'lambda_val': 0.000307769265113033, 'batch_size': 2455, 'optimizer': 'RMSprop'}.
2026-06-28 08:30:53,745 - experiment_functions - INFO - Early stopping at epoch 550. Best Metrics: (0.00017335853974521435, 4.8439488630967084e-05, 0.00010342433132797945)
2026-06-28 08:30:53,817 - optuna.study.study - INFO - Trial 230 finished with values: [0.00017335853974521435, 4.8439488630967084e-05, 0.00010342433132797945] and parameters: {'n_layers': 1, 'embedding_dim': 64, 'lr': 1.801629118261777e-05, 'lambda_val': 3.147388684080306e-05, 'batch_size': 2634, 'optimizer': 'Adam'}.
2026-06-28 08:37:01,034 - optuna.study.study - INFO - Trial 231 finished with values: [0.027005103308079342, 0.005798491727295178, 0.015809119610110108] and parameters: {'n_layers': 1, 'embedding_dim': 128, 'lr': 0.005739501470387607, 'lambda_val': 0.00011460379227540933, 'batch_size': 3545, 'optimizer': 'Adam'}.
2026-06-28 08:42:52,268 - optuna.study.study - INFO - Trial 232 finished with values: [0.023470007324867672, 0.005063351252778147, 0.013768881604003486] and parameters: {'n_layers': 1, 'embedding_dim': 96, 'lr': 0.005739501470387607, 'lambda_val': 0.0006043567828314722, 'batch_size': 2430, 'optimizer': 'Adam'}.
2026-06-28 08:48:53,376 - optuna.study.study - INFO - Trial 233 finished with values: [0.014945584100023371, 0.0033204794559580568, 0.009038761013950713] and parameters: {'n_layers': 1, 'embedding_dim': 128, 'lr': 0.017291764573035214, 'lambda_val': 0.0006043567828314722, 'batch_size': 2292, 'optimizer': 'Adam'}.
2026-06-28 08:55:51,654 - optuna.study.study - INFO - Trial 234 finished with values: [0.02919386666723895, 0.006325627338867466, 0.017608451201920363] and parameters: {'n_layers': 1, 'embedding_dim': 256, 'lr': 0.007515611127205712, 'lambda_val': 0.000538205104499364, 'batch_size': 2778, 'optimizer': 'RMSprop'}.
2026-06-28 09:01:42,435 - optuna.study.study - INFO - Trial 235 finished with values: [0.02817580095282041, 0.006214501453184658, 0.017462603869572213] and parameters: {'n_layers': 1, 'embedding_dim': 96, 'lr': 0.001948110338269317, 'lambda_val': 6.447923168817336e-05, 'batch_size': 2430, 'optimizer': 'RMSprop'}.
2026-06-28 09:09:57,520 - optuna.study.study - INFO - Trial 236 finished with values: [0.02531728459138098, 0.005316946222669682, 0.014997865466461079] and parameters: {'n_layers': 2, 'embedding_dim': 256, 'lr': 0.005739501470387607, 'lambda_val': 6.447923168817336e-05, 'batch_size': 3238, 'optimizer': 'RMSprop'}.
2026-06-28 09:19:27,575 - optuna.study.study - INFO - Trial 237 finished with values: [0.021668433119611905, 0.004683433694888209, 0.01288324670976525] and parameters: {'n_layers': 3, 'embedding_dim': 256, 'lr': 0.005739501470387607, 'lambda_val': 3.731801442207796e-05, 'batch_size': 1355, 'optimizer': 'RMSprop'}.
2026-06-28 09:25:30,139 - optuna.study.study - INFO - Trial 238 finished with values: [0.025838878525132843, 0.005508804589404099, 0.015418452840963617] and parameters: {'n_layers': 1, 'embedding_dim': 128, 'lr': 0.005739501470387607, 'lambda_val': 8.960789240600014e-06, 'batch_size': 2292, 'optimizer': 'Adam'}.
2026-06-28 09:31:30,318 - optuna.study.study - INFO - Trial 239 finished with values: [0.006478319361759555, 0.0015776076591379673, 0.003827355853548571] and parameters: {'n_layers': 4, 'embedding_dim': 32, 'lr': 0.005739501470387607, 'lambda_val': 4.470441871474425e-06, 'batch_size': 965, 'optimizer': 'Adam'}.
2026-06-28 09:37:49,711 - optuna.study.study - INFO - Trial 240 finished with values: [0.016249434835426655, 0.0035218357616397244, 0.009611485102081341] and parameters: {'n_layers': 3, 'embedding_dim': 64, 'lr': 0.009091499316683776, 'lambda_val': 0.00011460379227540933, 'batch_size': 1816, 'optimizer': 'RMSprop'}.
2026-06-28 09:43:40,592 - optuna.study.study - INFO - Trial 241 finished with values: [0.03138355741828924, 0.006715992629599378, 0.018712509739513643] and parameters: {'n_layers': 1, 'embedding_dim': 96, 'lr': 0.001948110338269317, 'lambda_val': 6.447923168817336e-05, 'batch_size': 4065, 'optimizer': 'RMSprop'}.
2026-06-28 09:49:41,597 - experiment_functions - INFO - Early stopping at epoch 3250. Best Metrics: (0.012294805355990982, 0.002791444256596319, 0.007132208576956243)
2026-06-28 09:49:41,698 - optuna.study.study - INFO - Trial 242 finished with values: [0.012294805355990982, 0.002791444256596319, 0.007132208576956243] and parameters: {'n_layers': 4, 'embedding_dim': 96, 'lr': 0.0012038063634363806, 'lambda_val': 0.00011460379227540933, 'batch_size': 2927, 'optimizer': 'RMSprop'}.
2026-06-28 09:50:26,545 - experiment_functions - INFO - Early stopping at epoch 500. Best Metrics: (0.0002929452065417377, 7.313412989381304e-05, 0.00017491830551499208)
2026-06-28 09:50:26,634 - optuna.study.study - INFO - Trial 243 finished with values: [0.0002929452065417377, 7.313412989381304e-05, 0.00017491830551499208] and parameters: {'n_layers': 1, 'embedding_dim': 64, 'lr': 0.00017155985475600152, 'lambda_val': 3.731801442207796e-05, 'batch_size': 3545, 'optimizer': 'SGD'}.
2026-06-28 09:56:04,956 - optuna.study.study - INFO - Trial 244 finished with values: [0.021441218281173662, 0.004744220504150598, 0.012655370589433343] and parameters: {'n_layers': 1, 'embedding_dim': 64, 'lr': 0.007515611127205712, 'lambda_val': 0.00011460379227540933, 'batch_size': 3545, 'optimizer': 'RMSprop'}.
2026-06-28 10:02:28,524 - optuna.study.study - INFO - Trial 245 finished with values: [0.016342858380041493, 0.0035759740136390404, 0.009541100163649124] and parameters: {'n_layers': 3, 'embedding_dim': 64, 'lr': 0.019921281966616786, 'lambda_val': 0.000307769265113033, 'batch_size': 2430, 'optimizer': 'RMSprop'}.
2026-06-28 10:09:21,921 - optuna.study.study - INFO - Trial 246 finished with values: [0.0224805685549196, 0.0049759702144634614, 0.01320829510559213] and parameters: {'n_layers': 1, 'embedding_dim': 256, 'lr': 0.001948110338269317, 'lambda_val': 6.447923168817336e-05, 'batch_size': 992, 'optimizer': 'RMSprop'}.
2026-06-28 10:15:13,730 - optuna.study.study - INFO - Trial 247 finished with values: [0.024751418506187207, 0.005422373344984138, 0.014322606165361053] and parameters: {'n_layers': 1, 'embedding_dim': 96, 'lr': 0.005739501470387607, 'lambda_val': 0.0006043567828314722, 'batch_size': 4066, 'optimizer': 'Adam'}.
2026-06-28 10:21:02,862 - optuna.study.study - INFO - Trial 248 finished with values: [0.02314117061741451, 0.004961723306042589, 0.013751302257897249] and parameters: {'n_layers': 1, 'embedding_dim': 96, 'lr': 0.005739501470387607, 'lambda_val': 6.447923168817336e-05, 'batch_size': 2430, 'optimizer': 'RMSprop'}.
2026-06-28 10:26:28,079 - optuna.study.study - INFO - Trial 249 finished with values: [0.02522042738618959, 0.0056351271774025035, 0.015201680201928365] and parameters: {'n_layers': 1, 'embedding_dim': 32, 'lr': 0.0036120268001017704, 'lambda_val': 8.960789240600014e-06, 'batch_size': 3817, 'optimizer': 'Adam'}.
2026-06-28 10:37:16,992 - optuna.study.study - INFO - Trial 250 finished with values: [0.008358177297660712, 0.0019480272780806568, 0.004673081168272794] and parameters: {'n_layers': 4, 'embedding_dim': 256, 'lr': 0.007515611127205712, 'lambda_val': 0.0012841478061844864, 'batch_size': 3967, 'optimizer': 'Adam'}.
2026-06-28 10:44:41,686 - optuna.study.study - INFO - Trial 251 finished with values: [0.014484686102600107, 0.003186558516801854, 0.00850272117573611] and parameters: {'n_layers': 4, 'embedding_dim': 96, 'lr': 0.005739501470387607, 'lambda_val': 6.447923168817336e-05, 'batch_size': 2430, 'optimizer': 'RMSprop'}.
2026-06-28 10:52:52,060 - optuna.study.study - INFO - Trial 252 finished with values: [0.018911414613507944, 0.004136352411526698, 0.010935223020761225] and parameters: {'n_layers': 2, 'embedding_dim': 256, 'lr': 0.001948110338269317, 'lambda_val': 8.960789240600014e-06, 'batch_size': 3350, 'optimizer': 'RMSprop'}.
2026-06-28 10:58:54,557 - optuna.study.study - INFO - Trial 253 finished with values: [0.024632717797852987, 0.00544231901677336, 0.01464576197645295] and parameters: {'n_layers': 1, 'embedding_dim': 128, 'lr': 0.007515611127205712, 'lambda_val': 0.000538205104499364, 'batch_size': 2563, 'optimizer': 'RMSprop'}.
2026-06-28 11:05:51,842 - optuna.study.study - INFO - Trial 254 finished with values: [0.029620311174286505, 0.006352221567919762, 0.017973140417245254] and parameters: {'n_layers': 1, 'embedding_dim': 256, 'lr': 0.007515611127205712, 'lambda_val': 0.00011460379227540933, 'batch_size': 2430, 'optimizer': 'RMSprop'}.
2026-06-28 11:06:45,476 - experiment_functions - INFO - Early stopping at epoch 500. Best Metrics: (0.0001835630463072889, 5.223866420986646e-05, 0.00010050511574054403)
2026-06-28 11:06:45,601 - optuna.study.study - INFO - Trial 255 finished with values: [0.0001835630463072889, 5.223866420986646e-05, 0.00010050511574054403] and parameters: {'n_layers': 1, 'embedding_dim': 256, 'lr': 0.007515611127205712, 'lambda_val': 0.000538205104499364, 'batch_size': 2430, 'optimizer': 'SGD'}.
2026-06-28 11:12:36,425 - optuna.study.study - INFO - Trial 256 finished with values: [0.025590261692555672, 0.005467963451930931, 0.015359852606514072] and parameters: {'n_layers': 1, 'embedding_dim': 96, 'lr': 0.005739501470387607, 'lambda_val': 6.447923168817336e-05, 'batch_size': 2430, 'optimizer': 'Adam'}.
2026-06-28 11:18:21,540 - experiment_functions - INFO - Early stopping at epoch 3350. Best Metrics: (0.022576854193128913, 0.004844898656991433, 0.01309784835253497)
2026-06-28 11:18:21,627 - optuna.study.study - INFO - Trial 257 finished with values: [0.022576854193128913, 0.004844898656991433, 0.01309784835253497] and parameters: {'n_layers': 2, 'embedding_dim': 128, 'lr': 0.001948110338269317, 'lambda_val': 2.319444713208817e-05, 'batch_size': 3399, 'optimizer': 'Adam'}.
2026-06-28 11:24:16,799 - optuna.study.study - INFO - Trial 258 finished with values: [0.026771882491871412, 0.0059960488573979455, 0.016398381425251008] and parameters: {'n_layers': 1, 'embedding_dim': 96, 'lr': 0.001948110338269317, 'lambda_val': 1.5450706960350556e-06, 'batch_size': 2430, 'optimizer': 'RMSprop'}.
2026-06-28 11:30:07,287 - optuna.study.study - INFO - Trial 259 finished with values: [0.026272961089839036, 0.005575290162034839, 0.015658567701104326] and parameters: {'n_layers': 1, 'embedding_dim': 96, 'lr': 0.0053500991167468115, 'lambda_val': 0.00011460379227540933, 'batch_size': 2430, 'optimizer': 'Adam'}.
2026-06-28 11:35:57,537 - optuna.study.study - INFO - Trial 260 finished with values: [0.02604418003174535, 0.00578139543719013, 0.01575488064515727] and parameters: {'n_layers': 1, 'embedding_dim': 96, 'lr': 0.001948110338269317, 'lambda_val': 6.447923168817336e-05, 'batch_size': 2292, 'optimizer': 'RMSprop'}.
2026-06-28 11:41:34,094 - optuna.study.study - INFO - Trial 261 finished with values: [0.021626163974262914, 0.004691981839940733, 0.012670031874696727] and parameters: {'n_layers': 1, 'embedding_dim': 64, 'lr': 0.007515611127205712, 'lambda_val': 0.00011460379227540933, 'batch_size': 2430, 'optimizer': 'RMSprop'}.
2026-06-28 11:47:40,288 - optuna.study.study - INFO - Trial 262 finished with values: [0.025506800096958146, 0.005464164276352032, 0.015157040567848844] and parameters: {'n_layers': 1, 'embedding_dim': 128, 'lr': 0.005739501470387607, 'lambda_val': 0.000307769265113033, 'batch_size': 2896, 'optimizer': 'Adam'}.
2026-06-28 11:53:43,585 - optuna.study.study - INFO - Trial 263 finished with values: [0.023613139898056062, 0.005237163535512794, 0.01391771926610678] and parameters: {'n_layers': 1, 'embedding_dim': 128, 'lr': 0.005739501470387607, 'lambda_val': 0.0006043567828314722, 'batch_size': 2778, 'optimizer': 'RMSprop'}.
2026-06-28 11:59:46,967 - optuna.study.study - INFO - Trial 264 finished with values: [0.021468060509485132, 0.004732822977413901, 0.012722131737421665] and parameters: {'n_layers': 1, 'embedding_dim': 128, 'lr': 0.005739501470387607, 'lambda_val': 0.0007410124913718467, 'batch_size': 1845, 'optimizer': 'Adam'}.
2026-06-28 12:05:51,972 - optuna.study.study - INFO - Trial 265 finished with values: [0.024776480142733183, 0.005275155291301788, 0.014815389703116143] and parameters: {'n_layers': 1, 'embedding_dim': 128, 'lr': 0.007995735751467357, 'lambda_val': 0.00011460379227540933, 'batch_size': 3545, 'optimizer': 'Adam'}.
2026-06-28 12:12:41,881 - optuna.study.study - INFO - Trial 266 finished with values: [0.012400547505674065, 0.0031922572801702034, 0.007377250643797133] and parameters: {'n_layers': 1, 'embedding_dim': 256, 'lr': 0.007515611127205712, 'lambda_val': 0.013131865348619471, 'batch_size': 2778, 'optimizer': 'RMSprop'}.
2026-06-28 12:19:38,948 - optuna.study.study - INFO - Trial 267 finished with values: [0.030379184551478648, 0.006464297247497293, 0.018240471384962778] and parameters: {'n_layers': 1, 'embedding_dim': 256, 'lr': 0.007515611127205712, 'lambda_val': 1.5450706960350556e-06, 'batch_size': 2430, 'optimizer': 'RMSprop'}.
2026-06-28 12:25:15,429 - optuna.study.study - INFO - Trial 268 finished with values: [0.02559105205455708, 0.005467963451930931, 0.015129872791686155] and parameters: {'n_layers': 1, 'embedding_dim': 64, 'lr': 0.0053500991167468115, 'lambda_val': 6.447923168817336e-05, 'batch_size': 2430, 'optimizer': 'Adam'}.
2026-06-28 12:31:21,313 - optuna.study.study - INFO - Trial 269 finished with values: [0.02419053830052661, 0.005259958588986191, 0.014448709957531666] and parameters: {'n_layers': 1, 'embedding_dim': 128, 'lr': 0.005739501470387607, 'lambda_val': 0.0006043567828314722, 'batch_size': 3354, 'optimizer': 'Adam'}.
2026-06-28 12:38:22,975 - optuna.study.study - INFO - Trial 270 finished with values: [0.033691950559883554, 0.007337157836749425, 0.020461913284203482] and parameters: {'n_layers': 1, 'embedding_dim': 256, 'lr': 0.001948110338269317, 'lambda_val': 6.447923168817336e-05, 'batch_size': 2292, 'optimizer': 'Adam'}.
2026-06-28 12:44:16,737 - optuna.study.study - INFO - Trial 271 finished with values: [0.026027041299535435, 0.005564842429192866, 0.015471993605471569] and parameters: {'n_layers': 1, 'embedding_dim': 96, 'lr': 0.0053500991167468115, 'lambda_val': 8.960789240600014e-06, 'batch_size': 2430, 'optimizer': 'Adam'}.
2026-06-28 12:50:11,856 - optuna.study.study - INFO - Trial 272 finished with values: [0.028548616120649756, 0.0063892635298140295, 0.017310477515626067] and parameters: {'n_layers': 1, 'embedding_dim': 96, 'lr': 0.001948110338269317, 'lambda_val': 0.00011460379227540933, 'batch_size': 2292, 'optimizer': 'Adam'}.
2026-06-28 12:56:19,226 - optuna.study.study - INFO - Trial 273 finished with values: [0.02895576661249001, 0.006223999392131907, 0.01730568098623096] and parameters: {'n_layers': 1, 'embedding_dim': 128, 'lr': 0.004433331932069102, 'lambda_val': 0.000307769265113033, 'batch_size': 4066, 'optimizer': 'Adam'}.
2026-06-28 13:02:24,366 - optuna.study.study - INFO - Trial 274 finished with values: [0.02541617824744737, 0.005461314894667858, 0.015086016226902416] and parameters: {'n_layers': 1, 'embedding_dim': 128, 'lr': 0.005739501470387607, 'lambda_val': 1.0615618278698485e-05, 'batch_size': 2292, 'optimizer': 'Adam'}.
2026-06-28 13:08:15,773 - optuna.study.study - INFO - Trial 275 finished with values: [0.02610176082177578, 0.00574625306308531, 0.015435933149563074] and parameters: {'n_layers': 1, 'embedding_dim': 96, 'lr': 0.005739501470387607, 'lambda_val': 6.447923168817336e-05, 'batch_size': 4065, 'optimizer': 'RMSprop'}.
2026-06-28 13:15:13,686 - optuna.study.study - INFO - Trial 276 finished with values: [0.02936275291947389, 0.006405410026024354, 0.01790886594733301] and parameters: {'n_layers': 1, 'embedding_dim': 256, 'lr': 0.007515611127205712, 'lambda_val': 0.000307769265113033, 'batch_size': 2778, 'optimizer': 'RMSprop'}.
2026-06-28 13:21:16,353 - optuna.study.study - INFO - Trial 277 finished with values: [0.02532386976731901, 0.005618980681192181, 0.01541102587747304] and parameters: {'n_layers': 1, 'embedding_dim': 128, 'lr': 0.001948110338269317, 'lambda_val': 6.447923168817336e-05, 'batch_size': 1557, 'optimizer': 'RMSprop'}.
2026-06-28 13:27:23,439 - optuna.study.study - INFO - Trial 278 finished with values: [0.03082911262906896, 0.006837566248124158, 0.018790541885671332] and parameters: {'n_layers': 1, 'embedding_dim': 128, 'lr': 0.001948110338269317, 'lambda_val': 5.738384252537289e-05, 'batch_size': 2430, 'optimizer': 'Adam'}.
2026-06-28 13:33:11,119 - optuna.study.study - INFO - Trial 279 finished with values: [0.02493211170038909, 0.005569591398666489, 0.014966655531080652] and parameters: {'n_layers': 1, 'embedding_dim': 96, 'lr': 0.001948110338269317, 'lambda_val': 6.447923168817336e-05, 'batch_size': 1656, 'optimizer': 'RMSprop'}.
2026-06-28 13:38:44,448 - optuna.study.study - INFO - Trial 280 finished with values: [0.022366765246804678, 0.004853446802043956, 0.013236389866295791] and parameters: {'n_layers': 1, 'embedding_dim': 64, 'lr': 0.007515611127205712, 'lambda_val': 4.470441871474425e-06, 'batch_size': 2456, 'optimizer': 'RMSprop'}.
