2026-07-03 06:07:34,057 - optuna.study.study - INFO - Trial 18 finished with values: [0.01392561907040637, 0.003124821913644739, 0.008207171683572146] and parameters: {'n_layers': 4, 'embedding_dim': 96, 'lr': 0.0008107107656200319, 'lambda_val': 2.1833975968191893e-05, 'batch_size': 3622, 'optimizer': 'RMSprop'}.
2026-07-03 06:08:18,151 - experiment_functions - INFO - Early stopping at epoch 500. Best Metrics: (0.00017793809579045642, 5.603783978876584e-05, 0.00011428977064375017)
2026-07-03 06:08:18,238 - optuna.study.study - INFO - Trial 19 finished with values: [0.00017793809579045642, 5.603783978876584e-05, 0.00011428977064375017] and parameters: {'n_layers': 1, 'embedding_dim': 128, 'lr': 0.0006914691839064478, 'lambda_val': 0.03224394016353027, 'batch_size': 1231, 'optimizer': 'SGD'}.
2026-07-03 06:09:02,539 - experiment_functions - INFO - Early stopping at epoch 500. Best Metrics: (0.00021794551849561056, 5.318845810459131e-05, 0.0001107031921634588)
2026-07-03 06:09:02,629 - optuna.study.study - INFO - Trial 20 finished with values: [0.00021794551849561056, 5.318845810459131e-05, 0.0001107031921634588] and parameters: {'n_layers': 3, 'embedding_dim': 64, 'lr': 0.004597304853170298, 'lambda_val': 2.0357849897204796e-06, 'batch_size': 679, 'optimizer': 'SGD'}.
2026-07-03 06:09:48,837 - experiment_functions - INFO - Early stopping at epoch 500. Best Metrics: (0.0001833956993974043, 5.31884581045913e-05, 0.00010645782932357832)
2026-07-03 06:09:48,929 - optuna.study.study - INFO - Trial 21 finished with values: [0.0001833956993974043, 5.31884581045913e-05, 0.00010645782932357832] and parameters: {'n_layers': 4, 'embedding_dim': 64, 'lr': 0.003956033948050206, 'lambda_val': 1.4391759364222375e-05, 'batch_size': 1458, 'optimizer': 'SGD'}.
2026-07-03 06:10:42,647 - experiment_functions - INFO - Early stopping at epoch 500. Best Metrics: (0.00020472335693402338, 5.5088045894041e-05, 0.00011270400770637492)
2026-07-03 06:10:42,733 - optuna.study.study - INFO - Trial 22 finished with values: [0.00020472335693402338, 5.5088045894041e-05, 0.00011270400770637492] and parameters: {'n_layers': 2, 'embedding_dim': 256, 'lr': 0.009618227217923374, 'lambda_val': 1.0429699863940936e-05, 'batch_size': 2439, 'optimizer': 'SGD'}.
2026-07-03 06:11:36,690 - experiment_functions - INFO - Early stopping at epoch 500. Best Metrics: (0.0002438705836577088, 6.838516042018881e-05, 0.0001423346021814334)
2026-07-03 06:11:36,776 - optuna.study.study - INFO - Trial 23 finished with values: [0.0002438705836577088, 6.838516042018881e-05, 0.0001423346021814334] and parameters: {'n_layers': 2, 'embedding_dim': 256, 'lr': 8.830450095489835e-05, 'lambda_val': 5.8077273110974984e-05, 'batch_size': 2198, 'optimizer': 'SGD'}.
2026-07-03 06:16:56,841 - optuna.study.study - INFO - Trial 24 finished with values: [0.016960696082732325, 0.0037668825864787337, 0.009853307199532433] and parameters: {'n_layers': 3, 'embedding_dim': 32, 'lr': 0.0018743209181168723, 'lambda_val': 2.302284243959985e-05, 'batch_size': 2366, 'optimizer': 'Adam'}.
2026-07-03 06:22:35,020 - optuna.study.study - INFO - Trial 25 finished with values: [0.009078384901176314, 0.00220542142355109, 0.005278233620947243] and parameters: {'n_layers': 2, 'embedding_dim': 96, 'lr': 0.008841806029042509, 'lambda_val': 0.0031563334074732655, 'batch_size': 2778, 'optimizer': 'Adam'}.
2026-07-03 06:23:42,827 - experiment_functions - INFO - Early stopping at epoch 800. Best Metrics: (0.008457966062734492, 0.001993617385027449, 0.005228496978095808)
2026-07-03 06:23:42,923 - optuna.study.study - INFO - Trial 26 finished with values: [0.008457966062734492, 0.001993617385027449, 0.005228496978095808] and parameters: {'n_layers': 1, 'embedding_dim': 96, 'lr': 0.021737337182750487, 'lambda_val': 1.2350413453119533e-05, 'batch_size': 3384, 'optimizer': 'Adam'}.
2026-07-03 06:27:58,297 - experiment_functions - INFO - Early stopping at epoch 2600. Best Metrics: (0.0002235239221019754, 6.268639705183976e-05, 0.00012983779825406503)
2026-07-03 06:27:58,635 - optuna.study.study - INFO - Trial 27 finished with values: [0.0002235239221019754, 6.268639705183976e-05, 0.00012983779825406503] and parameters: {'n_layers': 4, 'embedding_dim': 128, 'lr': 4.107051848620635e-05, 'lambda_val': 1.4104732881639325e-05, 'batch_size': 1709, 'optimizer': 'Adam'}.
2026-07-03 06:30:38,811 - experiment_functions - INFO - Early stopping at epoch 1900. Best Metrics: (0.013168279257419308, 0.0031381190281708866, 0.007752035736795861)
2026-07-03 06:30:38,893 - optuna.study.study - INFO - Trial 28 finished with values: [0.013168279257419308, 0.0031381190281708866, 0.007752035736795861] and parameters: {'n_layers': 1, 'embedding_dim': 128, 'lr': 0.0040524633409478395, 'lambda_val': 0.008107712298875159, 'batch_size': 3960, 'optimizer': 'RMSprop'}.
2026-07-03 06:31:31,267 - experiment_functions - INFO - Early stopping at epoch 550. Best Metrics: (0.008033626538613333, 0.0018046083999772049, 0.004632198550021881)
2026-07-03 06:31:31,341 - optuna.study.study - INFO - Trial 29 finished with values: [0.008033626538613333, 0.0018046083999772049, 0.004632198550021881] and parameters: {'n_layers': 3, 'embedding_dim': 96, 'lr': 0.05530542775322035, 'lambda_val': 6.525874471654226e-06, 'batch_size': 3789, 'optimizer': 'Adam'}.
2026-07-03 06:37:28,275 - optuna.study.study - INFO - Trial 30 finished with values: [0.021595278691749036, 0.00486579412267538, 0.013159682992519243] and parameters: {'n_layers': 2, 'embedding_dim': 128, 'lr': 0.0010282533123218839, 'lambda_val': 9.917852447655537e-05, 'batch_size': 2599, 'optimizer': 'RMSprop'}.
2026-07-03 06:43:37,862 - optuna.study.study - INFO - Trial 31 finished with values: [0.011069003618055776, 0.002549246813441483, 0.00651822502119412] and parameters: {'n_layers': 4, 'embedding_dim': 96, 'lr': 0.0022700314607702445, 'lambda_val': 2.0533552356322422e-05, 'batch_size': 1016, 'optimizer': 'RMSprop'}.
2026-07-03 06:49:06,095 - optuna.study.study - INFO - Trial 32 finished with values: [0.0003202979460659318, 8.073248105161182e-05, 0.00018232112277949934] and parameters: {'n_layers': 3, 'embedding_dim': 64, 'lr': 9.105196004705614e-05, 'lambda_val': 3.328417231611093e-05, 'batch_size': 3690, 'optimizer': 'RMSprop'}.
2026-07-03 06:49:54,736 - experiment_functions - INFO - Early stopping at epoch 500. Best Metrics: (0.00022249713793778727, 5.793742757821552e-05, 0.00012391534512923717)
2026-07-03 06:49:54,806 - optuna.study.study - INFO - Trial 33 finished with values: [0.00022249713793778727, 5.793742757821552e-05, 0.00012391534512923717] and parameters: {'n_layers': 4, 'embedding_dim': 96, 'lr': 2.8660944491457246e-05, 'lambda_val': 0.0002218870149356506, 'batch_size': 1341, 'optimizer': 'SGD'}.
2026-07-03 06:55:31,901 - optuna.study.study - INFO - Trial 34 finished with values: [0.010761614780817712, 0.0027069125999658076, 0.006662988883703804] and parameters: {'n_layers': 2, 'embedding_dim': 96, 'lr': 0.0007096062779705466, 'lambda_val': 2.6660349002830665e-06, 'batch_size': 1104, 'optimizer': 'Adam'}.
2026-07-03 06:56:31,524 - experiment_functions - INFO - Early stopping at epoch 650. Best Metrics: (0.0002702744000092696, 6.838516042018881e-05, 0.0001542127446757256)
2026-07-03 06:56:31,993 - optuna.study.study - INFO - Trial 35 finished with values: [0.0002702744000092696, 6.838516042018881e-05, 0.0001542127446757256] and parameters: {'n_layers': 2, 'embedding_dim': 128, 'lr': 0.00012219522725549238, 'lambda_val': 4.037530466814123e-06, 'batch_size': 1439, 'optimizer': 'RMSprop'}.
2026-07-03 07:01:59,943 - optuna.study.study - INFO - Trial 36 finished with values: [0.02056067585770472, 0.004634994206257242, 0.012130911278005372] and parameters: {'n_layers': 2, 'embedding_dim': 64, 'lr': 0.0014537114423835192, 'lambda_val': 0.0006168359830718268, 'batch_size': 2527, 'optimizer': 'Adam'}.
2026-07-03 07:02:41,901 - experiment_functions - INFO - Early stopping at epoch 500. Best Metrics: (0.00013876972046227554, 4.274072526261802e-05, 8.442788800939377e-05)
2026-07-03 07:02:41,995 - optuna.study.study - INFO - Trial 37 finished with values: [0.00013876972046227554, 4.274072526261802e-05, 8.442788800939377e-05] and parameters: {'n_layers': 3, 'embedding_dim': 32, 'lr': 0.00020705235615206966, 'lambda_val': 0.00040282178495633435, 'batch_size': 1502, 'optimizer': 'SGD'}.
2026-07-03 07:06:01,379 - experiment_functions - INFO - Early stopping at epoch 2450. Best Metrics: (0.0155134215842716, 0.00333472636437893, 0.009070185905525992)
2026-07-03 07:06:01,451 - optuna.study.study - INFO - Trial 38 finished with values: [0.0155134215842716, 0.00333472636437893, 0.009070185905525992] and parameters: {'n_layers': 4, 'embedding_dim': 32, 'lr': 0.001509217129870026, 'lambda_val': 7.329771199139694e-05, 'batch_size': 3575, 'optimizer': 'Adam'}.
2026-07-03 07:07:51,479 - experiment_functions - INFO - Early stopping at epoch 1400. Best Metrics: (0.00023212324259716925, 5.223866420986647e-05, 0.00011891831839812971)
2026-07-03 07:07:52,575 - optuna.study.study - INFO - Trial 39 finished with values: [0.00023212324259716925, 5.223866420986647e-05, 0.00011891831839812971] and parameters: {'n_layers': 1, 'embedding_dim': 64, 'lr': 3.724090457573053e-05, 'lambda_val': 3.173741277736752e-06, 'batch_size': 3979, 'optimizer': 'RMSprop'}.
2026-07-03 07:11:36,433 - experiment_functions - INFO - Early stopping at epoch 3000. Best Metrics: (0.00022025642385904137, 5.318845810459131e-05, 0.00011339570193348984)
2026-07-03 07:11:36,543 - optuna.study.study - INFO - Trial 40 finished with values: [0.00022025642385904137, 5.318845810459131e-05, 0.00011339570193348984] and parameters: {'n_layers': 1, 'embedding_dim': 32, 'lr': 5.014024852676533e-05, 'lambda_val': 4.785406104107672e-06, 'batch_size': 2163, 'optimizer': 'Adam'}.
2026-07-03 07:12:23,875 - experiment_functions - INFO - Early stopping at epoch 550. Best Metrics: (0.00020007047599632862, 5.128887031514162e-05, 0.00013210341303764546)
2026-07-03 07:12:23,956 - optuna.study.study - INFO - Trial 41 finished with values: [0.00020007047599632862, 5.128887031514162e-05, 0.00013210341303764546] and parameters: {'n_layers': 2, 'embedding_dim': 64, 'lr': 2.56295503732607e-05, 'lambda_val': 0.004196882157632485, 'batch_size': 2691, 'optimizer': 'RMSprop'}.
2026-07-03 07:13:11,519 - experiment_functions - INFO - Early stopping at epoch 500. Best Metrics: (0.00020735997292106463, 5.888722147294038e-05, 0.00012388276912479702)
2026-07-03 07:13:11,593 - optuna.study.study - INFO - Trial 42 finished with values: [0.00020735997292106463, 5.888722147294038e-05, 0.00012388276912479702] and parameters: {'n_layers': 3, 'embedding_dim': 96, 'lr': 7.200469607832426e-05, 'lambda_val': 0.027377247916397292, 'batch_size': 3740, 'optimizer': 'RMSprop'}.
2026-07-03 07:13:55,379 - experiment_functions - INFO - Early stopping at epoch 500. Best Metrics: (0.0002400670656662161, 5.983701536766521e-05, 0.00012153706634964642)
2026-07-03 07:13:55,466 - optuna.study.study - INFO - Trial 43 finished with values: [0.0002400670656662161, 5.983701536766521e-05, 0.00012153706634964642] and parameters: {'n_layers': 1, 'embedding_dim': 128, 'lr': 0.0004490735082888678, 'lambda_val': 3.405924979359868e-06, 'batch_size': 1101, 'optimizer': 'SGD'}.
2026-07-03 07:15:08,045 - experiment_functions - INFO - Early stopping at epoch 550. Best Metrics: (0.009674744641108814, 0.0023174971031286215, 0.00581808783610166)
2026-07-03 07:15:08,121 - optuna.study.study - INFO - Trial 44 finished with values: [0.009674744641108814, 0.0023174971031286215, 0.00581808783610166] and parameters: {'n_layers': 4, 'embedding_dim': 256, 'lr': 0.013423812802703095, 'lambda_val': 8.41405405813264e-05, 'batch_size': 647, 'optimizer': 'Adam'}.
2026-07-03 07:17:03,580 - experiment_functions - INFO - Early stopping at epoch 1000. Best Metrics: (0.00025582227261421, 7.028474820963853e-05, 0.00016534896442717314)
2026-07-03 07:17:03,666 - optuna.study.study - INFO - Trial 45 finished with values: [0.00025582227261421, 7.028474820963853e-05, 0.00016534896442717314] and parameters: {'n_layers': 3, 'embedding_dim': 256, 'lr': 1.3833929376811967e-05, 'lambda_val': 3.2748247990772547e-06, 'batch_size': 2011, 'optimizer': 'RMSprop'}.
2026-07-03 07:20:02,049 - experiment_functions - INFO - Early stopping at epoch 1550. Best Metrics: (0.0041842564830317, 0.0010960621545124706, 0.002448361722585853)
2026-07-03 07:20:02,140 - optuna.study.study - INFO - Trial 46 finished with values: [0.0041842564830317, 0.0010960621545124706, 0.002448361722585853] and parameters: {'n_layers': 3, 'embedding_dim': 256, 'lr': 0.0048083624508031015, 'lambda_val': 0.012269783040016443, 'batch_size': 2163, 'optimizer': 'Adam'}.
2026-07-03 07:21:01,403 - experiment_functions - INFO - Early stopping at epoch 500. Best Metrics: (0.00020452093517234066, 5.5088045894040994e-05, 0.00011195207678213823)
2026-07-03 07:21:01,480 - optuna.study.study - INFO - Trial 47 finished with values: [0.00020452093517234066, 5.5088045894040994e-05, 0.00011195207678213823] and parameters: {'n_layers': 3, 'embedding_dim': 256, 'lr': 9.66616734629361e-05, 'lambda_val': 1.5525944353196107e-05, 'batch_size': 2394, 'optimizer': 'SGD'}.
2026-07-03 07:27:13,897 - optuna.study.study - INFO - Trial 48 finished with values: [0.007781909399765126, 0.001975571301027677, 0.004649219467950755] and parameters: {'n_layers': 3, 'embedding_dim': 128, 'lr': 0.026710406287072025, 'lambda_val': 0.006826471065079358, 'batch_size': 3580, 'optimizer': 'RMSprop'}.
2026-07-03 07:34:49,954 - optuna.study.study - INFO - Trial 49 finished with values: [0.01725619876974081, 0.0037288908306897404, 0.009995501245278602] and parameters: {'n_layers': 3, 'embedding_dim': 256, 'lr': 0.0026410131585060054, 'lambda_val': 3.994713178662255e-05, 'batch_size': 3913, 'optimizer': 'RMSprop'}.
2026-07-03 07:40:26,020 - optuna.study.study - INFO - Trial 50 finished with values: [0.014229238018861452, 0.003167562638907357, 0.00824115989553009] and parameters: {'n_layers': 3, 'embedding_dim': 64, 'lr': 0.0048083624508031015, 'lambda_val': 3.328417231611093e-05, 'batch_size': 3690, 'optimizer': 'RMSprop'}.
2026-07-03 07:46:35,662 - optuna.study.study - INFO - Trial 51 finished with values: [0.011602542210498617, 0.002649924966282317, 0.006873091107171967] and parameters: {'n_layers': 4, 'embedding_dim': 96, 'lr': 0.0022700314607702445, 'lambda_val': 2.0533552356322422e-05, 'batch_size': 1548, 'optimizer': 'RMSprop'}.
2026-07-03 07:49:27,914 - experiment_functions - INFO - Early stopping at epoch 2150. Best Metrics: (0.022548332735161124, 0.004847748038675608, 0.01317733338035732)
2026-07-03 07:49:28,009 - optuna.study.study - INFO - Trial 52 finished with values: [0.022548332735161124, 0.004847748038675608, 0.01317733338035732] and parameters: {'n_layers': 1, 'embedding_dim': 64, 'lr': 0.005306455009021957, 'lambda_val': 7.329771199139694e-05, 'batch_size': 3575, 'optimizer': 'Adam'}.
2026-07-03 07:50:15,087 - experiment_functions - INFO - Early stopping at epoch 550. Best Metrics: (0.0023266347228952, 0.0006819520164124385, 0.0015479404289770401)
2026-07-03 07:50:15,167 - optuna.study.study - INFO - Trial 53 finished with values: [0.0023266347228952, 0.0006819520164124385, 0.0015479404289770401] and parameters: {'n_layers': 1, 'embedding_dim': 96, 'lr': 0.09103503079318301, 'lambda_val': 0.00027900648211190204, 'batch_size': 901, 'optimizer': 'Adam'}.
2026-07-03 07:56:31,769 - optuna.study.study - INFO - Trial 54 finished with values: [0.013887101042080855, 0.003102026860171343, 0.008099889663125456] and parameters: {'n_layers': 3, 'embedding_dim': 128, 'lr': 0.003942474684271309, 'lambda_val': 3.328417231611093e-05, 'batch_size': 2210, 'optimizer': 'Adam'}.
2026-07-03 07:57:21,974 - experiment_functions - INFO - Early stopping at epoch 550. Best Metrics: (0.0076441804275333685, 0.0018758429420815683, 0.004723993935698928)
2026-07-03 07:57:22,083 - optuna.study.study - INFO - Trial 55 finished with values: [0.0076441804275333685, 0.0018758429420815683, 0.004723993935698928] and parameters: {'n_layers': 2, 'embedding_dim': 96, 'lr': 0.026710406287072025, 'lambda_val': 3.871532073501651e-05, 'batch_size': 2778, 'optimizer': 'Adam'}.
2026-07-03 07:58:56,567 - experiment_functions - INFO - Early stopping at epoch 1100. Best Metrics: (0.00019387400059133416, 4.9389282525691926e-05, 0.00010643983504155001)
2026-07-03 07:58:56,657 - optuna.study.study - INFO - Trial 56 finished with values: [0.00019387400059133416, 4.9389282525691926e-05, 0.00010643983504155001] and parameters: {'n_layers': 2, 'embedding_dim': 96, 'lr': 1.3833929376811967e-05, 'lambda_val': 2.0533552356322422e-05, 'batch_size': 3699, 'optimizer': 'RMSprop'}.
2026-07-03 08:01:25,938 - experiment_functions - INFO - Early stopping at epoch 1600. Best Metrics: (0.0013523119916948813, 0.000471097771783523, 0.0009204828526274633)
2026-07-03 08:01:26,374 - optuna.study.study - INFO - Trial 57 finished with values: [0.0013523119916948813, 0.000471097771783523, 0.0009204828526274633] and parameters: {'n_layers': 4, 'embedding_dim': 96, 'lr': 0.001509217129870026, 'lambda_val': 0.06201042967333836, 'batch_size': 3575, 'optimizer': 'Adam'}.
2026-07-03 08:09:03,089 - optuna.study.study - INFO - Trial 58 finished with values: [0.017313357919354, 0.0037241418612161165, 0.009939288823709912] and parameters: {'n_layers': 3, 'embedding_dim': 256, 'lr': 0.0026410131585060054, 'lambda_val': 4.576689567534931e-05, 'batch_size': 3913, 'optimizer': 'RMSprop'}.
2026-07-03 08:14:58,637 - optuna.study.study - INFO - Trial 59 finished with values: [0.018979368910803047, 0.0043063655186824455, 0.01147278033132132] and parameters: {'n_layers': 2, 'embedding_dim': 128, 'lr': 0.0010282533123218839, 'lambda_val': 0.0006168359830718268, 'batch_size': 2527, 'optimizer': 'RMSprop'}.
2026-07-03 08:15:46,096 - experiment_functions - INFO - Early stopping at epoch 550. Best Metrics: (0.0017016420383925953, 0.0004141101381000323, 0.0010390492620837187)
2026-07-03 08:15:46,186 - optuna.study.study - INFO - Trial 60 finished with values: [0.0017016420383925953, 0.0004141101381000323, 0.0010390492620837187] and parameters: {'n_layers': 2, 'embedding_dim': 64, 'lr': 0.06941683831126039, 'lambda_val': 0.0006168359830718268, 'batch_size': 2527, 'optimizer': 'RMSprop'}.
2026-07-03 08:19:33,486 - experiment_functions - INFO - Early stopping at epoch 2000. Best Metrics: (0.0040150865539061616, 0.001045723078092054, 0.0022804120843510013)
2026-07-03 08:19:33,558 - optuna.study.study - INFO - Trial 61 finished with values: [0.0040150865539061616, 0.001045723078092054, 0.0022804120843510013] and parameters: {'n_layers': 3, 'embedding_dim': 256, 'lr': 0.0014187321710568024, 'lambda_val': 0.03662205350906382, 'batch_size': 3913, 'optimizer': 'RMSprop'}.
2026-07-03 08:20:23,263 - experiment_functions - INFO - Early stopping at epoch 550. Best Metrics: (0.005852537854864482, 0.0014104439336663946, 0.003637655435944695)
2026-07-03 08:20:23,352 - optuna.study.study - INFO - Trial 62 finished with values: [0.005852537854864482, 0.0014104439336663946, 0.003637655435944695] and parameters: {'n_layers': 2, 'embedding_dim': 96, 'lr': 0.07963049146030712, 'lambda_val': 5.748803102387373e-05, 'batch_size': 1202, 'optimizer': 'Adam'}.
2026-07-03 08:23:36,901 - experiment_functions - INFO - Early stopping at epoch 2050. Best Metrics: (0.01507734071260493, 0.003353722242273427, 0.008775912931139928)
2026-07-03 08:23:36,984 - optuna.study.study - INFO - Trial 63 finished with values: [0.01507734071260493, 0.003353722242273427, 0.008775912931139928] and parameters: {'n_layers': 4, 'embedding_dim': 96, 'lr': 0.001509217129870026, 'lambda_val': 6.525874471654226e-06, 'batch_size': 3575, 'optimizer': 'Adam'}.
2026-07-03 08:24:19,200 - experiment_functions - INFO - Early stopping at epoch 500. Best Metrics: (0.000179485802705177, 5.698763368349069e-05, 0.00010830208502709033)
2026-07-03 08:24:19,326 - optuna.study.study - INFO - Trial 64 finished with values: [0.000179485802705177, 5.698763368349069e-05, 0.00010830208502709033] and parameters: {'n_layers': 3, 'embedding_dim': 32, 'lr': 1.3833929376811967e-05, 'lambda_val': 3.994713178662255e-05, 'batch_size': 3274, 'optimizer': 'RMSprop'}.
2026-07-03 08:30:15,616 - optuna.study.study - INFO - Trial 65 finished with values: [0.01579431118674049, 0.003448701631745911, 0.009308340020317857] and parameters: {'n_layers': 3, 'embedding_dim': 96, 'lr': 0.008841806029042509, 'lambda_val': 5.919481359842955e-05, 'batch_size': 3690, 'optimizer': 'RMSprop'}.
2026-07-03 08:31:04,111 - experiment_functions - INFO - Early stopping at epoch 500. Best Metrics: (0.00016952770500904232, 4.4640313052067714e-05, 9.872681564616155e-05)
2026-07-03 08:31:04,199 - optuna.study.study - INFO - Trial 66 finished with values: [0.00016952770500904232, 4.4640313052067714e-05, 9.872681564616155e-05] and parameters: {'n_layers': 1, 'embedding_dim': 256, 'lr': 6.503787649884767e-05, 'lambda_val': 3.589622013087031e-05, 'batch_size': 1353, 'optimizer': 'SGD'}.
2026-07-03 08:36:01,354 - optuna.study.study - INFO - Trial 67 finished with values: [0.0027839650100820296, 0.0008035256349372186, 0.0016626020206584576] and parameters: {'n_layers': 1, 'embedding_dim': 32, 'lr': 0.003942474684271309, 'lambda_val': 0.06788703773680012, 'batch_size': 675, 'optimizer': 'Adam'}.
2026-07-03 08:37:35,384 - experiment_functions - INFO - Early stopping at epoch 1100. Best Metrics: (0.01321339258197167, 0.0030250935546986303, 0.007865766636002075)
