2026-07-05 19:18:46,055 - optuna.study.study - INFO - Trial 80 finished with values: [0.00022012262902566405, 5.793742757821552e-05, 0.00012644001605065756] and parameters: {'n_layers': 3, 'embedding_dim': 64, 'lr': 0.00011496928666132993, 'lambda_val': 2.8481754235506968e-06, 'batch_size': 1722, 'optimizer': 'Adam'}.
2026-07-05 19:24:57,226 - optuna.study.study - INFO - Trial 81 finished with values: [0.00783296193588312, 0.002024960583553369, 0.004634090117770183] and parameters: {'n_layers': 3, 'embedding_dim': 128, 'lr': 0.00030085296551505755, 'lambda_val': 1.059674657990583e-05, 'batch_size': 1692, 'optimizer': 'RMSprop'}.
2026-07-05 19:25:43,572 - experiment_functions - INFO - Early stopping at epoch 500. Best Metrics: (0.0003257561368241875, 7.028474820963853e-05, 0.00019462119471344317)
2026-07-05 19:25:43,651 - optuna.study.study - INFO - Trial 82 finished with values: [0.0003257561368241875, 7.028474820963853e-05, 0.00019462119471344317] and parameters: {'n_layers': 4, 'embedding_dim': 64, 'lr': 0.000628496153565313, 'lambda_val': 1.1602258783212233e-06, 'batch_size': 2418, 'optimizer': 'SGD'}.
2026-07-05 19:26:28,308 - experiment_functions - INFO - Early stopping at epoch 500. Best Metrics: (0.0002446254278466341, 6.648557263073913e-05, 0.00013570398125044056)
2026-07-05 19:26:28,394 - optuna.study.study - INFO - Trial 83 finished with values: [0.0002446254278466341, 6.648557263073913e-05, 0.00013570398125044056] and parameters: {'n_layers': 2, 'embedding_dim': 96, 'lr': 0.0001259161727533467, 'lambda_val': 0.00038841840354160716, 'batch_size': 824, 'optimizer': 'SGD'}.
2026-07-05 19:27:12,616 - experiment_functions - INFO - Early stopping at epoch 500. Best Metrics: (0.00020724014846897976, 6.458598484128943e-05, 0.00012382692604766762)
2026-07-05 19:27:12,731 - optuna.study.study - INFO - Trial 84 finished with values: [0.00020724014846897976, 6.458598484128943e-05, 0.00012382692604766762] and parameters: {'n_layers': 1, 'embedding_dim': 128, 'lr': 0.00010908557577672226, 'lambda_val': 0.03158923345136703, 'batch_size': 3892, 'optimizer': 'RMSprop'}.
2026-07-05 19:28:24,238 - experiment_functions - INFO - Early stopping at epoch 550. Best Metrics: (0.0036122510992753253, 0.0009260490473567238, 0.0022760959863388545)
2026-07-05 19:28:24,335 - optuna.study.study - INFO - Trial 85 finished with values: [0.0036122510992753253, 0.0009260490473567238, 0.0022760959863388545] and parameters: {'n_layers': 4, 'embedding_dim': 256, 'lr': 0.011820592307196294, 'lambda_val': 0.009008883638359447, 'batch_size': 2404, 'optimizer': 'RMSprop'}.
2026-07-05 19:33:45,567 - optuna.study.study - INFO - Trial 86 finished with values: [0.011932340589646826, 0.0027819463176490707, 0.00710062421652159] and parameters: {'n_layers': 2, 'embedding_dim': 64, 'lr': 0.006236516613152459, 'lambda_val': 0.0017059305455562248, 'batch_size': 2304, 'optimizer': 'RMSprop'}.
2026-07-05 19:35:46,333 - experiment_functions - INFO - Early stopping at epoch 950. Best Metrics: (0.0002706617306621415, 7.40839237885379e-05, 0.00018446607959833887)
2026-07-05 19:35:46,410 - optuna.study.study - INFO - Trial 87 finished with values: [0.0002706617306621415, 7.40839237885379e-05, 0.00018446607959833887] and parameters: {'n_layers': 4, 'embedding_dim': 256, 'lr': 1.3233388040325013e-05, 'lambda_val': 2.798613238286131e-06, 'batch_size': 2654, 'optimizer': 'Adam'}.
2026-07-05 19:40:24,184 - experiment_functions - INFO - Early stopping at epoch 3500. Best Metrics: (0.013217905260637342, 0.002951009630910093, 0.007864489580456551)
2026-07-05 19:40:24,268 - optuna.study.study - INFO - Trial 88 finished with values: [0.013217905260637342, 0.002951009630910093, 0.007864489580456551] and parameters: {'n_layers': 3, 'embedding_dim': 32, 'lr': 0.01406276067877314, 'lambda_val': 1.4745289700620854e-05, 'batch_size': 2385, 'optimizer': 'RMSprop'}.
2026-07-05 19:41:12,531 - experiment_functions - INFO - Early stopping at epoch 500. Best Metrics: (0.0002472553401029277, 5.5088045894041e-05, 0.000125297138126299)
2026-07-05 19:41:12,610 - optuna.study.study - INFO - Trial 89 finished with values: [0.0002472553401029277, 5.5088045894041e-05, 0.000125297138126299] and parameters: {'n_layers': 1, 'embedding_dim': 256, 'lr': 7.49696931619416e-05, 'lambda_val': 0.0017059305455562248, 'batch_size': 1458, 'optimizer': 'SGD'}.
2026-07-05 19:41:57,793 - experiment_functions - INFO - Early stopping at epoch 500. Best Metrics: (0.0002411656049962058, 5.6987633683490685e-05, 0.00012141212229672037)
2026-07-05 19:41:57,890 - optuna.study.study - INFO - Trial 90 finished with values: [0.0002411656049962058, 5.6987633683490685e-05, 0.00012141212229672037] and parameters: {'n_layers': 2, 'embedding_dim': 96, 'lr': 0.03904938033542978, 'lambda_val': 7.212570658280532e-05, 'batch_size': 1929, 'optimizer': 'SGD'}.
2026-07-05 19:43:46,745 - experiment_functions - INFO - Early stopping at epoch 1350. Best Metrics: (0.00021894200133953855, 5.793742757821552e-05, 0.0001264969296800963)
2026-07-05 19:43:46,835 - optuna.study.study - INFO - Trial 91 finished with values: [0.00021894200133953855, 5.793742757821552e-05, 0.0001264969296800963] and parameters: {'n_layers': 4, 'embedding_dim': 32, 'lr': 4.463254283229942e-05, 'lambda_val': 0.0002836463264671757, 'batch_size': 1658, 'optimizer': 'RMSprop'}.
2026-07-05 19:44:46,142 - experiment_functions - INFO - Early stopping at epoch 500. Best Metrics: (0.00020255219698455496, 5.603783978876584e-05, 0.00011305470243366435)
2026-07-05 19:44:46,234 - optuna.study.study - INFO - Trial 92 finished with values: [0.00020255219698455496, 5.603783978876584e-05, 0.00011305470243366435] and parameters: {'n_layers': 3, 'embedding_dim': 256, 'lr': 0.0015662544273340173, 'lambda_val': 0.03963263115435443, 'batch_size': 1294, 'optimizer': 'SGD'}.
2026-07-05 19:45:53,027 - experiment_functions - INFO - Early stopping at epoch 650. Best Metrics: (0.0001883579726818658, 4.8439488630967084e-05, 0.00011555947624742936)
2026-07-05 19:45:53,103 - optuna.study.study - INFO - Trial 93 finished with values: [0.0001883579726818658, 4.8439488630967084e-05, 0.00011555947624742936] and parameters: {'n_layers': 4, 'embedding_dim': 128, 'lr': 2.7814288402399942e-05, 'lambda_val': 0.00038841840354160716, 'batch_size': 1074, 'optimizer': 'RMSprop'}.
2026-07-05 19:47:01,982 - experiment_functions - INFO - Early stopping at epoch 800. Best Metrics: (0.00021894881743440985, 5.318845810459131e-05, 0.00011755895660508903)
2026-07-05 19:47:02,068 - optuna.study.study - INFO - Trial 94 finished with values: [0.00021894881743440985, 5.318845810459131e-05, 0.00011755895660508903] and parameters: {'n_layers': 3, 'embedding_dim': 64, 'lr': 3.3219927300946406e-05, 'lambda_val': 7.168086117382093e-05, 'batch_size': 2061, 'optimizer': 'Adam'}.
2026-07-05 19:52:20,961 - optuna.study.study - INFO - Trial 95 finished with values: [0.009662972581030908, 0.0024229242254430786, 0.005986991078594679] and parameters: {'n_layers': 1, 'embedding_dim': 96, 'lr': 0.000628496153565313, 'lambda_val': 0.0018102440350191405, 'batch_size': 3710, 'optimizer': 'Adam'}.
2026-07-05 19:54:12,720 - experiment_functions - INFO - Early stopping at epoch 950. Best Metrics: (0.007801644534038054, 0.0018454495374503731, 0.004746558181109668)
2026-07-05 19:54:12,807 - optuna.study.study - INFO - Trial 96 finished with values: [0.007801644534038054, 0.0018454495374503731, 0.004746558181109668] and parameters: {'n_layers': 3, 'embedding_dim': 256, 'lr': 0.009228822744585308, 'lambda_val': 0.0009639808071822736, 'batch_size': 3299, 'optimizer': 'Adam'}.
2026-07-05 19:58:46,941 - experiment_functions - INFO - Early stopping at epoch 2950. Best Metrics: (0.007953637140213573, 0.0018444997435556486, 0.004500188801343663)
2026-07-05 19:58:47,033 - optuna.study.study - INFO - Trial 97 finished with values: [0.007953637140213573, 0.0018444997435556486, 0.004500188801343663] and parameters: {'n_layers': 4, 'embedding_dim': 96, 'lr': 0.002260615499918563, 'lambda_val': 0.002906975496505062, 'batch_size': 2615, 'optimizer': 'Adam'}.
2026-07-05 19:59:34,083 - experiment_functions - INFO - Early stopping at epoch 550. Best Metrics: (0.002509480246599008, 0.0006829018103071634, 0.0016164389794392515)
2026-07-05 19:59:34,164 - optuna.study.study - INFO - Trial 98 finished with values: [0.002509480246599008, 0.0006829018103071634, 0.0016164389794392515] and parameters: {'n_layers': 4, 'embedding_dim': 32, 'lr': 0.008002638743453066, 'lambda_val': 0.026080793635433332, 'batch_size': 2404, 'optimizer': 'RMSprop'}.
2026-07-05 20:06:29,828 - optuna.study.study - INFO - Trial 99 finished with values: [0.0170190431959202, 0.0036006686549018858, 0.009964927303398027] and parameters: {'n_layers': 2, 'embedding_dim': 256, 'lr': 0.0070515306300978796, 'lambda_val': 7.042695090433518e-06, 'batch_size': 3299, 'optimizer': 'Adam'}.
2026-07-05 20:11:06,562 - experiment_functions - INFO - Early stopping at epoch 3250. Best Metrics: (0.017696381342092504, 0.0038124726934255265, 0.01030561261272884)
2026-07-05 20:11:06,652 - optuna.study.study - INFO - Trial 100 finished with values: [0.017696381342092504, 0.0038124726934255265, 0.01030561261272884] and parameters: {'n_layers': 2, 'embedding_dim': 96, 'lr': 0.00841343884415209, 'lambda_val': 2.412093285142066e-05, 'batch_size': 2901, 'optimizer': 'RMSprop'}.
2026-07-05 20:12:39,978 - experiment_functions - INFO - Early stopping at epoch 1150. Best Metrics: (0.007368910425711964, 0.0017409722090306404, 0.004324105209397718)
2026-07-05 20:12:40,068 - optuna.study.study - INFO - Trial 101 finished with values: [0.007368910425711964, 0.0017409722090306404, 0.004324105209397718] and parameters: {'n_layers': 3, 'embedding_dim': 32, 'lr': 0.014970220633329265, 'lambda_val': 0.0002603817889184556, 'batch_size': 3618, 'optimizer': 'Adam'}.
2026-07-05 20:17:40,004 - optuna.study.study - INFO - Trial 102 finished with values: [0.006646676859231925, 0.0016839845753471498, 0.004061627724640364] and parameters: {'n_layers': 1, 'embedding_dim': 32, 'lr': 0.000628496153565313, 'lambda_val': 0.0018102440350191405, 'batch_size': 3618, 'optimizer': 'Adam'}.
2026-07-05 20:18:22,962 - experiment_functions - INFO - Early stopping at epoch 500. Best Metrics: (0.0002159196397338435, 6.078680926239006e-05, 0.00011260786414598262)
2026-07-05 20:18:23,049 - optuna.study.study - INFO - Trial 103 finished with values: [0.0002159196397338435, 6.078680926239006e-05, 0.00011260786414598262] and parameters: {'n_layers': 2, 'embedding_dim': 64, 'lr': 0.00043143181329967817, 'lambda_val': 0.0002603817889184556, 'batch_size': 1458, 'optimizer': 'SGD'}.
2026-07-05 20:23:40,990 - optuna.study.study - INFO - Trial 104 finished with values: [0.008113958579275998, 0.002037307904184792, 0.004975409934525751] and parameters: {'n_layers': 4, 'embedding_dim': 32, 'lr': 0.00031301183442768784, 'lambda_val': 1.059674657990583e-05, 'batch_size': 3494, 'optimizer': 'RMSprop'}.
2026-07-05 20:29:51,236 - optuna.study.study - INFO - Trial 105 finished with values: [0.016335699491765828, 0.00379157722774158, 0.009710801968499577] and parameters: {'n_layers': 1, 'embedding_dim': 256, 'lr': 0.0028516566741058234, 'lambda_val': 0.0067674206888748, 'batch_size': 2385, 'optimizer': 'RMSprop'}.
2026-07-05 20:31:03,108 - experiment_functions - INFO - Early stopping at epoch 550. Best Metrics: (0.0049462827352636084, 0.0012204851547214257, 0.0028864503464721323)
2026-07-05 20:31:03,184 - optuna.study.study - INFO - Trial 106 finished with values: [0.0049462827352636084, 0.0012204851547214257, 0.0028864503464721323] and parameters: {'n_layers': 4, 'embedding_dim': 256, 'lr': 0.006553786429577227, 'lambda_val': 0.005013303766522477, 'batch_size': 3787, 'optimizer': 'RMSprop'}.
2026-07-05 20:31:56,840 - experiment_functions - INFO - Early stopping at epoch 550. Best Metrics: (0.002043492645771101, 0.0005337841688353627, 0.0013041186485020422)
2026-07-05 20:31:57,354 - optuna.study.study - INFO - Trial 107 finished with values: [0.002043492645771101, 0.0005337841688353627, 0.0013041186485020422] and parameters: {'n_layers': 1, 'embedding_dim': 256, 'lr': 0.05904329143419785, 'lambda_val': 3.28947879719355e-05, 'batch_size': 1749, 'optimizer': 'RMSprop'}.
2026-07-05 20:37:04,220 - optuna.study.study - INFO - Trial 108 finished with values: [0.011634982198212476, 0.002612883004388048, 0.006716463418908941] and parameters: {'n_layers': 2, 'embedding_dim': 32, 'lr': 0.004643736874356213, 'lambda_val': 0.0013813939605119977, 'batch_size': 1749, 'optimizer': 'RMSprop'}.
2026-07-05 20:38:47,492 - experiment_functions - INFO - Early stopping at epoch 800. Best Metrics: (0.00900003577039771, 0.0020097638812377715, 0.005076007573801057)
2026-07-05 20:38:47,587 - optuna.study.study - INFO - Trial 109 finished with values: [0.00900003577039771, 0.0020097638812377715, 0.005076007573801057] and parameters: {'n_layers': 4, 'embedding_dim': 256, 'lr': 0.003000504479694176, 'lambda_val': 0.0009639808071822736, 'batch_size': 3299, 'optimizer': 'Adam'}.
2026-07-05 20:39:57,500 - experiment_functions - INFO - Early stopping at epoch 900. Best Metrics: (0.00020244136200221616, 5.793742757821552e-05, 0.00012980360571163501)
2026-07-05 20:39:57,601 - optuna.study.study - INFO - Trial 110 finished with values: [0.00020244136200221616, 5.793742757821552e-05, 0.00012980360571163501] and parameters: {'n_layers': 1, 'embedding_dim': 32, 'lr': 0.0003882124668573459, 'lambda_val': 0.0013813939605119977, 'batch_size': 1102, 'optimizer': 'Adam'}.
2026-07-05 20:45:00,140 - experiment_functions - INFO - Early stopping at epoch 3900. Best Metrics: (0.00448846798884832, 0.0013145147502991851, 0.002676918376622545)
2026-07-05 20:45:00,211 - optuna.study.study - INFO - Trial 111 finished with values: [0.00448846798884832, 0.0013145147502991851, 0.002676918376622545] and parameters: {'n_layers': 3, 'embedding_dim': 32, 'lr': 0.0004477568083688352, 'lambda_val': 0.025389792435966986, 'batch_size': 1724, 'optimizer': 'RMSprop'}.
2026-07-05 20:46:33,255 - experiment_functions - INFO - Early stopping at epoch 1150. Best Metrics: (0.008412953839837867, 0.0019537260414490055, 0.0050129089763031225)
2026-07-05 20:46:33,340 - optuna.study.study - INFO - Trial 112 finished with values: [0.008412953839837867, 0.0019537260414490055, 0.0050129089763031225] and parameters: {'n_layers': 3, 'embedding_dim': 32, 'lr': 0.014970220633329265, 'lambda_val': 1.726755899122382e-05, 'batch_size': 3618, 'optimizer': 'Adam'}.
2026-07-05 20:52:39,164 - optuna.study.study - INFO - Trial 113 finished with values: [0.006421951200594134, 0.0016165492088216857, 0.003934265054266744] and parameters: {'n_layers': 1, 'embedding_dim': 256, 'lr': 0.000628496153565313, 'lambda_val': 0.0018102440350191405, 'batch_size': 1962, 'optimizer': 'Adam'}.
2026-07-05 20:53:33,436 - experiment_functions - INFO - Early stopping at epoch 550. Best Metrics: (0.003787610080801459, 0.0010628193681971013, 0.002502597696233524)
2026-07-05 20:53:33,522 - optuna.study.study - INFO - Trial 114 finished with values: [0.003787610080801459, 0.0010628193681971013, 0.002502597696233524] and parameters: {'n_layers': 1, 'embedding_dim': 256, 'lr': 0.027822239419745227, 'lambda_val': 0.011720789781497609, 'batch_size': 2903, 'optimizer': 'Adam'}.
2026-07-05 20:54:31,387 - experiment_functions - INFO - Early stopping at epoch 550. Best Metrics: (0.008536217266098482, 0.0020306593469217185, 0.005163190273234131)
2026-07-05 20:54:31,484 - optuna.study.study - INFO - Trial 115 finished with values: [0.008536217266098482, 0.0020306593469217185, 0.005163190273234131] and parameters: {'n_layers': 4, 'embedding_dim': 128, 'lr': 0.00622194471935376, 'lambda_val': 0.0008455954335710432, 'batch_size': 1775, 'optimizer': 'RMSprop'}.
2026-07-05 21:02:47,469 - optuna.study.study - INFO - Trial 116 finished with values: [0.014783400765959995, 0.003357521417852326, 0.008680486903475228] and parameters: {'n_layers': 4, 'embedding_dim': 256, 'lr': 0.006553786429577227, 'lambda_val': 0.00023140225629595055, 'batch_size': 1506, 'optimizer': 'RMSprop'}.
2026-07-05 21:08:30,178 - optuna.study.study - INFO - Trial 117 finished with values: [0.011344818568837794, 0.002738255798491728, 0.0064427850314701844] and parameters: {'n_layers': 4, 'embedding_dim': 64, 'lr': 0.00031301183442768784, 'lambda_val': 8.13684422458198e-05, 'batch_size': 3892, 'optimizer': 'RMSprop'}.
2026-07-05 21:09:43,167 - experiment_functions - INFO - Early stopping at epoch 900. Best Metrics: (0.0123970221027559, 0.002782896111543795, 0.007166817326876328)
2026-07-05 21:09:43,261 - optuna.study.study - INFO - Trial 118 finished with values: [0.0123970221027559, 0.002782896111543795, 0.007166817326876328] and parameters: {'n_layers': 2, 'embedding_dim': 32, 'lr': 0.00622194471935376, 'lambda_val': 0.0008455954335710432, 'batch_size': 3276, 'optimizer': 'Adam'}.
2026-07-05 21:14:59,119 - optuna.study.study - INFO - Trial 119 finished with values: [0.007236122631643382, 0.0017409722090306402, 0.004330040464855566] and parameters: {'n_layers': 4, 'embedding_dim': 32, 'lr': 0.00031301183442768784, 'lambda_val': 4.859553849541615e-06, 'batch_size': 1132, 'optimizer': 'RMSprop'}.
2026-07-05 21:19:56,126 - optuna.study.study - INFO - Trial 120 finished with values: [0.0009423979224487655, 0.0002554945576809832, 0.00060102902350824] and parameters: {'n_layers': 1, 'embedding_dim': 32, 'lr': 0.00046943052333612564, 'lambda_val': 1.3028958114301324e-06, 'batch_size': 2594, 'optimizer': 'Adam'}.
2026-07-05 21:23:21,908 - experiment_functions - INFO - Early stopping at epoch 2650. Best Metrics: (0.01352826190630204, 0.0030535873715403757, 0.007926577430600382)
2026-07-05 21:23:21,986 - optuna.study.study - INFO - Trial 121 finished with values: [0.01352826190630204, 0.0030535873715403757, 0.007926577430600382] and parameters: {'n_layers': 2, 'embedding_dim': 32, 'lr': 0.002260615499918563, 'lambda_val': 0.0012923669531330183, 'batch_size': 2615, 'optimizer': 'RMSprop'}.
2026-07-05 21:30:26,457 - experiment_functions - INFO - Early stopping at epoch 3400. Best Metrics: (0.010277758828792134, 0.0022671580267082042, 0.005855315279599036)
2026-07-05 21:30:26,547 - optuna.study.study - INFO - Trial 122 finished with values: [0.010277758828792134, 0.0022671580267082042, 0.005855315279599036] and parameters: {'n_layers': 4, 'embedding_dim': 256, 'lr': 0.006236516613152459, 'lambda_val': 0.0002603817889184556, 'batch_size': 3276, 'optimizer': 'Adam'}.
2026-07-05 21:34:46,029 - experiment_functions - INFO - Early stopping at epoch 2800. Best Metrics: (0.007436675680078545, 0.0017609178808198624, 0.004348152279393248)
2026-07-05 21:34:46,099 - optuna.study.study - INFO - Trial 123 finished with values: [0.007436675680078545, 0.0017609178808198624, 0.004348152279393248] and parameters: {'n_layers': 4, 'embedding_dim': 96, 'lr': 0.00622194471935376, 'lambda_val': 0.0008455954335710432, 'batch_size': 1692, 'optimizer': 'Adam'}.
2026-07-05 21:35:46,918 - experiment_functions - INFO - Early stopping at epoch 550. Best Metrics: (0.007335528404467563, 0.0018758429420815683, 0.004766694856207243)
2026-07-05 21:35:47,008 - optuna.study.study - INFO - Trial 124 finished with values: [0.007335528404467563, 0.0018758429420815683, 0.004766694856207243] and parameters: {'n_layers': 2, 'embedding_dim': 256, 'lr': 0.014085204921955032, 'lambda_val': 0.0017059305455562248, 'batch_size': 1506, 'optimizer': 'Adam'}.
2026-07-05 21:40:54,457 - optuna.study.study - INFO - Trial 125 finished with values: [0.019079940262915127, 0.004309214900366621, 0.011391588089058217] and parameters: {'n_layers': 1, 'embedding_dim': 32, 'lr': 0.00622194471935376, 'lambda_val': 1.1875193284309632e-06, 'batch_size': 1692, 'optimizer': 'Adam'}.
2026-07-05 21:46:49,563 - optuna.study.study - INFO - Trial 126 finished with values: [0.010390650386385689, 0.002708812187755257, 0.0063304193622586375] and parameters: {'n_layers': 3, 'embedding_dim': 96, 'lr': 0.00035999108299303935, 'lambda_val': 0.0018102440350191405, 'batch_size': 3710, 'optimizer': 'Adam'}.
2026-07-05 21:48:48,468 - experiment_functions - INFO - Early stopping at epoch 1250. Best Metrics: (0.01228163998323635, 0.0028778755010162795, 0.007227004349490974)
2026-07-05 21:48:48,559 - optuna.study.study - INFO - Trial 127 finished with values: [0.01228163998323635, 0.0028778755010162795, 0.007227004349490974] and parameters: {'n_layers': 1, 'embedding_dim': 256, 'lr': 0.0020004569205185102, 'lambda_val': 0.024499694307189884, 'batch_size': 3966, 'optimizer': 'Adam'}.
2026-07-05 21:56:07,263 - experiment_functions - INFO - Early stopping at epoch 3500. Best Metrics: (0.013674904214164544, 0.003015595615751382, 0.00780354489225604)
2026-07-05 21:56:07,354 - optuna.study.study - INFO - Trial 128 finished with values: [0.013674904214164544, 0.003015595615751382, 0.00780354489225604] and parameters: {'n_layers': 4, 'embedding_dim': 256, 'lr': 0.0014758085710817913, 'lambda_val': 3.28947879719355e-05, 'batch_size': 1749, 'optimizer': 'Adam'}.
2026-07-05 22:03:02,244 - optuna.study.study - INFO - Trial 129 finished with values: [0.021080830501236568, 0.004475428831943468, 0.01243972429298034] and parameters: {'n_layers': 2, 'embedding_dim': 256, 'lr': 0.0070515306300978796, 'lambda_val': 1.059674657990583e-05, 'batch_size': 3299, 'optimizer': 'RMSprop'}.
2026-07-05 22:07:33,808 - experiment_functions - INFO - Early stopping at epoch 2750. Best Metrics: (0.007060122042765975, 0.0016659384913473773, 0.00401259259507014)
