2026-06-30 00:37:25,030 - optuna.study.study - INFO - Trial 137 finished with values: [0.00019970528177671267, 5.888722147294038e-05, 0.00012503910506514378] and parameters: {'n_layers': 2, 'embedding_dim': 96, 'lr': 0.017351300430976352, 'lambda_val': 0.0001469814413818991, 'batch_size': 2809, 'optimizer': 'SGD'}.
2026-06-30 00:43:53,355 - optuna.study.study - INFO - Trial 138 finished with values: [0.0010409115643341283, 0.00029633569515415153, 0.0007478999156392653] and parameters: {'n_layers': 3, 'embedding_dim': 256, 'lr': 0.00021672262965770087, 'lambda_val': 0.020589462317437596, 'batch_size': 2642, 'optimizer': 'RMSprop'}.
2026-06-30 00:49:21,779 - experiment_functions - INFO - Early stopping at epoch 3600. Best Metrics: (0.002319671409663458, 0.0006686549018862908, 0.001588701167825296)
2026-06-30 00:49:21,865 - optuna.study.study - INFO - Trial 139 finished with values: [0.002319671409663458, 0.0006686549018862908, 0.001588701167825296] and parameters: {'n_layers': 2, 'embedding_dim': 256, 'lr': 0.0013047089047836713, 'lambda_val': 2.199939619081897e-06, 'batch_size': 3492, 'optimizer': 'RMSprop'}.
2026-06-30 00:54:37,377 - optuna.study.study - INFO - Trial 140 finished with values: [0.00204495007556145, 0.0005100393214672416, 0.0012711600431755388] and parameters: {'n_layers': 4, 'embedding_dim': 64, 'lr': 0.0003326962115608699, 'lambda_val': 0.0001469814413818991, 'batch_size': 3827, 'optimizer': 'RMSprop'}.
2026-06-30 00:59:34,545 - optuna.study.study - INFO - Trial 141 finished with values: [0.002436864237432116, 0.0005888722147294037, 0.0016654887080558307] and parameters: {'n_layers': 3, 'embedding_dim': 32, 'lr': 0.0013047089047836713, 'lambda_val': 6.696439606049452e-06, 'batch_size': 620, 'optimizer': 'Adam'}.
2026-06-30 01:04:58,076 - optuna.study.study - INFO - Trial 142 finished with values: [0.0008023562408309638, 0.00018805919115551925, 0.00045222997987208826] and parameters: {'n_layers': 2, 'embedding_dim': 128, 'lr': 0.0005030162275943933, 'lambda_val': 0.007054089513088074, 'batch_size': 620, 'optimizer': 'Adam'}.
2026-06-30 01:10:13,780 - optuna.study.study - INFO - Trial 143 finished with values: [0.002428606237023821, 0.0006762532530440895, 0.0017160824446736213] and parameters: {'n_layers': 4, 'embedding_dim': 64, 'lr': 0.0005030162275943933, 'lambda_val': 3.9206514264817366e-05, 'batch_size': 3604, 'optimizer': 'RMSprop'}.
2026-06-30 01:11:11,623 - experiment_functions - INFO - Early stopping at epoch 550. Best Metrics: (0.0015869856496218773, 0.0004653990084151739, 0.0011197968066244178)
2026-06-30 01:11:11,715 - optuna.study.study - INFO - Trial 144 finished with values: [0.0015869856496218773, 0.0004653990084151739, 0.0011197968066244178] and parameters: {'n_layers': 3, 'embedding_dim': 256, 'lr': 0.09031528723133264, 'lambda_val': 1.554897118169841e-06, 'batch_size': 4019, 'optimizer': 'Adam'}.
2026-06-30 01:12:35,672 - experiment_functions - INFO - Early stopping at epoch 1000. Best Metrics: (0.0011396393836089697, 0.00039416446631081057, 0.0007907542770313732)
2026-06-30 01:12:35,762 - optuna.study.study - INFO - Trial 145 finished with values: [0.0011396393836089697, 0.00039416446631081057, 0.0007907542770313732] and parameters: {'n_layers': 3, 'embedding_dim': 96, 'lr': 0.021245875855951238, 'lambda_val': 0.004495593710473149, 'batch_size': 3028, 'optimizer': 'RMSprop'}.
2026-06-30 01:18:43,541 - optuna.study.study - INFO - Trial 146 finished with values: [0.002115174346187707, 0.000581273863571605, 0.0014494007374217764] and parameters: {'n_layers': 2, 'embedding_dim': 256, 'lr': 0.0009496158639399897, 'lambda_val': 1.554897118169841e-06, 'batch_size': 2346, 'optimizer': 'Adam'}.
2026-06-30 01:20:06,555 - experiment_functions - INFO - Early stopping at epoch 1050. Best Metrics: (0.0015403136946291005, 0.00037231920673213914, 0.0009862275879336086)
2026-06-30 01:20:06,643 - optuna.study.study - INFO - Trial 147 finished with values: [0.0015403136946291005, 0.00037231920673213914, 0.0009862275879336086] and parameters: {'n_layers': 1, 'embedding_dim': 96, 'lr': 0.00331004334789819, 'lambda_val': 0.0004806110924684931, 'batch_size': 3648, 'optimizer': 'Adam'}.
2026-06-30 01:21:00,622 - experiment_functions - INFO - Early stopping at epoch 550. Best Metrics: (0.0014082817353031224, 0.0004255076648367304, 0.0010357059027784404)
2026-06-30 01:21:00,710 - optuna.study.study - INFO - Trial 148 finished with values: [0.0014082817353031224, 0.0004255076648367304, 0.0010357059027784404] and parameters: {'n_layers': 2, 'embedding_dim': 256, 'lr': 0.02833621835555532, 'lambda_val': 3.423463120625302e-05, 'batch_size': 2346, 'optimizer': 'RMSprop'}.
2026-06-30 01:26:16,742 - optuna.study.study - INFO - Trial 149 finished with values: [0.002599637771864302, 0.000697148718728036, 0.001742025676670945] and parameters: {'n_layers': 4, 'embedding_dim': 64, 'lr': 0.0005030162275943933, 'lambda_val': 3.423463120625302e-05, 'batch_size': 2642, 'optimizer': 'RMSprop'}.
2026-06-30 01:28:05,693 - experiment_functions - INFO - Early stopping at epoch 1400. Best Metrics: (0.0021074705383636733, 0.0005765248940979808, 0.0014308259011895966)
2026-06-30 01:28:05,791 - optuna.study.study - INFO - Trial 150 finished with values: [0.0021074705383636733, 0.0005765248940979808, 0.0014308259011895966] and parameters: {'n_layers': 2, 'embedding_dim': 64, 'lr': 0.00235708379888552, 'lambda_val': 3.9206514264817366e-05, 'batch_size': 2649, 'optimizer': 'RMSprop'}.
2026-06-30 01:31:41,051 - experiment_functions - INFO - Early stopping at epoch 2650. Best Metrics: (0.0016635540395291486, 0.00042455787094200563, 0.0011268939466482263)
2026-06-30 01:31:41,156 - optuna.study.study - INFO - Trial 151 finished with values: [0.0016635540395291486, 0.00042455787094200563, 0.0011268939466482263] and parameters: {'n_layers': 2, 'embedding_dim': 128, 'lr': 0.0005030162275943933, 'lambda_val': 0.004495593710473149, 'batch_size': 2816, 'optimizer': 'RMSprop'}.
2026-06-30 01:32:34,497 - experiment_functions - INFO - Early stopping at epoch 600. Best Metrics: (0.002154236651844706, 0.0006430104667287199, 0.0014480050426681705)
2026-06-30 01:32:34,584 - optuna.study.study - INFO - Trial 152 finished with values: [0.002154236651844706, 0.0006430104667287199, 0.0014480050426681705] and parameters: {'n_layers': 4, 'embedding_dim': 96, 'lr': 0.0065689657435421345, 'lambda_val': 0.0001469814413818991, 'batch_size': 1716, 'optimizer': 'RMSprop'}.
2026-06-30 01:33:21,396 - experiment_functions - INFO - Early stopping at epoch 500. Best Metrics: (0.0002549169764875804, 5.983701536766521e-05, 0.0001350786396211635)
2026-06-30 01:33:21,486 - optuna.study.study - INFO - Trial 153 finished with values: [0.0002549169764875804, 5.983701536766521e-05, 0.0001350786396211635] and parameters: {'n_layers': 4, 'embedding_dim': 128, 'lr': 0.0013047089047836713, 'lambda_val': 0.013941874422138588, 'batch_size': 620, 'optimizer': 'SGD'}.
2026-06-30 01:34:12,231 - experiment_functions - INFO - Early stopping at epoch 600. Best Metrics: (0.0017251439596582675, 0.00048344509241494586, 0.001184683715916043)
2026-06-30 01:34:12,313 - optuna.study.study - INFO - Trial 154 finished with values: [0.0017251439596582675, 0.00048344509241494586, 0.001184683715916043] and parameters: {'n_layers': 4, 'embedding_dim': 64, 'lr': 0.030158238679944264, 'lambda_val': 1.582941209280553e-06, 'batch_size': 2746, 'optimizer': 'RMSprop'}.
2026-06-30 01:39:27,781 - optuna.study.study - INFO - Trial 155 finished with values: [0.0025493210461949266, 0.0006772030469388143, 0.00181818391066477] and parameters: {'n_layers': 4, 'embedding_dim': 64, 'lr': 0.0005030162275943933, 'lambda_val': 3.9206514264817366e-05, 'batch_size': 1750, 'optimizer': 'RMSprop'}.
2026-06-30 01:43:07,063 - experiment_functions - INFO - Early stopping at epoch 2900. Best Metrics: (0.0022228837392425527, 0.0006078680926239006, 0.001457207951497158)
2026-06-30 01:43:07,158 - optuna.study.study - INFO - Trial 156 finished with values: [0.0022228837392425527, 0.0006078680926239006, 0.001457207951497158] and parameters: {'n_layers': 4, 'embedding_dim': 32, 'lr': 0.0013047089047836713, 'lambda_val': 3.9206514264817366e-05, 'batch_size': 3604, 'optimizer': 'Adam'}.
2026-06-30 01:44:19,219 - experiment_functions - INFO - Early stopping at epoch 850. Best Metrics: (0.0020022718426184463, 0.0005955207719924776, 0.001383124423147415)
2026-06-30 01:44:19,312 - optuna.study.study - INFO - Trial 157 finished with values: [0.0020022718426184463, 0.0005955207719924776, 0.001383124423147415] and parameters: {'n_layers': 3, 'embedding_dim': 96, 'lr': 0.005817892184311597, 'lambda_val': 3.9206514264817366e-05, 'batch_size': 1698, 'optimizer': 'RMSprop'}.
2026-06-30 01:45:00,812 - experiment_functions - INFO - Early stopping at epoch 500. Best Metrics: (0.00029999406334170486, 7.313412989381305e-05, 0.00016724676409453956)
2026-06-30 01:45:00,907 - optuna.study.study - INFO - Trial 158 finished with values: [0.00029999406334170486, 7.313412989381305e-05, 0.00016724676409453956] and parameters: {'n_layers': 2, 'embedding_dim': 64, 'lr': 0.0005030162275943933, 'lambda_val': 3.423463120625302e-05, 'batch_size': 2642, 'optimizer': 'SGD'}.
2026-06-30 01:47:23,126 - experiment_functions - INFO - Early stopping at epoch 1350. Best Metrics: (0.0019802326552942275, 0.0006116672682027999, 0.0013700841811363571)
2026-06-30 01:47:23,222 - optuna.study.study - INFO - Trial 159 finished with values: [0.0019802326552942275, 0.0006116672682027999, 0.0013700841811363571] and parameters: {'n_layers': 4, 'embedding_dim': 256, 'lr': 0.0005030162275943933, 'lambda_val': 0.007239505689320495, 'batch_size': 2746, 'optimizer': 'RMSprop'}.
2026-06-30 01:51:42,944 - experiment_functions - INFO - Early stopping at epoch 2500. Best Metrics: (0.0030199938236965193, 0.0008709610014626828, 0.0020132515808567206)
2026-06-30 01:51:43,036 - optuna.study.study - INFO - Trial 160 finished with values: [0.0030199938236965193, 0.0008709610014626828, 0.0020132515808567206] and parameters: {'n_layers': 4, 'embedding_dim': 256, 'lr': 0.0013047089047836713, 'lambda_val': 1.582941209280553e-06, 'batch_size': 1106, 'optimizer': 'RMSprop'}.
2026-06-30 01:52:39,633 - experiment_functions - INFO - Early stopping at epoch 650. Best Metrics: (0.001510393045655133, 0.00042455787094200563, 0.0010447711184874973)
2026-06-30 01:52:39,727 - optuna.study.study - INFO - Trial 161 finished with values: [0.001510393045655133, 0.00042455787094200563, 0.0010447711184874973] and parameters: {'n_layers': 2, 'embedding_dim': 128, 'lr': 0.02833621835555532, 'lambda_val': 3.918882692849622e-06, 'batch_size': 2746, 'optimizer': 'Adam'}.
2026-06-30 01:57:42,177 - optuna.study.study - INFO - Trial 162 finished with values: [0.0010277771992733835, 0.0003039340463119503, 0.0007381497375588464] and parameters: {'n_layers': 1, 'embedding_dim': 96, 'lr': 0.0017629535051935379, 'lambda_val': 0.03178537583665405, 'batch_size': 620, 'optimizer': 'RMSprop'}.
2026-06-30 02:02:35,324 - experiment_functions - INFO - Early stopping at epoch 3950. Best Metrics: (0.003252181024011973, 0.0008899568793571796, 0.0021835056679471963)
2026-06-30 02:02:35,404 - optuna.study.study - INFO - Trial 163 finished with values: [0.003252181024011973, 0.0008899568793571796, 0.0021835056679471963] and parameters: {'n_layers': 3, 'embedding_dim': 32, 'lr': 0.0019032891633152442, 'lambda_val': 3.9206514264817366e-05, 'batch_size': 620, 'optimizer': 'RMSprop'}.
2026-06-30 02:05:05,886 - experiment_functions - INFO - Early stopping at epoch 1950. Best Metrics: (0.0021227683527692757, 0.0004919932374674695, 0.0013777350926402214)
2026-06-30 02:05:05,974 - optuna.study.study - INFO - Trial 164 finished with values: [0.0021227683527692757, 0.0004919932374674695, 0.0013777350926402214] and parameters: {'n_layers': 1, 'embedding_dim': 96, 'lr': 0.002365530211589969, 'lambda_val': 1.4824096770292976e-06, 'batch_size': 2746, 'optimizer': 'RMSprop'}.
2026-06-30 02:05:46,404 - experiment_functions - INFO - Early stopping at epoch 500. Best Metrics: (0.0002799279807607587, 7.40839237885379e-05, 0.00014960522103190635)
2026-06-30 02:05:46,492 - optuna.study.study - INFO - Trial 165 finished with values: [0.0002799279807607587, 7.40839237885379e-05, 0.00014960522103190635] and parameters: {'n_layers': 1, 'embedding_dim': 64, 'lr': 0.002365530211589969, 'lambda_val': 0.0005613082418791808, 'batch_size': 1698, 'optimizer': 'SGD'}.
2026-06-30 02:07:31,732 - experiment_functions - INFO - Early stopping at epoch 1050. Best Metrics: (0.0024499285005406225, 0.0006620063446232168, 0.0016348764242062677)
2026-06-30 02:07:31,835 - optuna.study.study - INFO - Trial 166 finished with values: [0.0024499285005406225, 0.0006620063446232168, 0.0016348764242062677] and parameters: {'n_layers': 3, 'embedding_dim': 256, 'lr': 0.0013047089047836713, 'lambda_val': 0.0005400904118495423, 'batch_size': 1378, 'optimizer': 'RMSprop'}.
2026-06-30 02:12:13,286 - experiment_functions - INFO - Early stopping at epoch 3700. Best Metrics: (0.0024061647490699954, 0.0005746253063085311, 0.0015272179963280346)
2026-06-30 02:12:13,360 - optuna.study.study - INFO - Trial 167 finished with values: [0.0024061647490699954, 0.0005746253063085311, 0.0015272179963280346] and parameters: {'n_layers': 1, 'embedding_dim': 96, 'lr': 0.0009496158639399897, 'lambda_val': 5.980121303172299e-06, 'batch_size': 1591, 'optimizer': 'RMSprop'}.
2026-06-30 02:13:34,730 - experiment_functions - INFO - Early stopping at epoch 1050. Best Metrics: (0.001458970126996534, 0.00037041961894268945, 0.0010117031413444555)
2026-06-30 02:13:34,865 - optuna.study.study - INFO - Trial 168 finished with values: [0.001458970126996534, 0.00037041961894268945, 0.0010117031413444555] and parameters: {'n_layers': 1, 'embedding_dim': 64, 'lr': 0.013963397837397955, 'lambda_val': 1.582941209280553e-06, 'batch_size': 2558, 'optimizer': 'Adam'}.
2026-06-30 02:14:19,276 - experiment_functions - INFO - Early stopping at epoch 550. Best Metrics: (0.0011556702421078294, 0.00029728548904887637, 0.0006934150058741804)
2026-06-30 02:14:19,668 - optuna.study.study - INFO - Trial 169 finished with values: [0.0011556702421078294, 0.00029728548904887637, 0.0006934150058741804] and parameters: {'n_layers': 1, 'embedding_dim': 64, 'lr': 0.021145058931520334, 'lambda_val': 3.423463120625302e-05, 'batch_size': 2649, 'optimizer': 'RMSprop'}.
2026-06-30 02:16:07,846 - experiment_functions - INFO - Early stopping at epoch 1350. Best Metrics: (0.002065256137580117, 0.0005708261307296317, 0.001463461592836826)
2026-06-30 02:16:07,920 - optuna.study.study - INFO - Trial 170 finished with values: [0.002065256137580117, 0.0005708261307296317, 0.001463461592836826] and parameters: {'n_layers': 2, 'embedding_dim': 96, 'lr': 0.005084074098593243, 'lambda_val': 1.1813358915438924e-05, 'batch_size': 1121, 'optimizer': 'RMSprop'}.
2026-06-30 02:21:03,574 - optuna.study.study - INFO - Trial 171 finished with values: [0.0006678039179020913, 0.0001481678475770758, 0.0003879119775839164] and parameters: {'n_layers': 3, 'embedding_dim': 32, 'lr': 0.0003326962115608699, 'lambda_val': 0.0001469814413818991, 'batch_size': 620, 'optimizer': 'RMSprop'}.
2026-06-30 02:26:33,750 - optuna.study.study - INFO - Trial 172 finished with values: [0.00038429096780416685, 9.972835894610871e-05, 0.00022882596065995297] and parameters: {'n_layers': 4, 'embedding_dim': 96, 'lr': 9.820368732627061e-05, 'lambda_val': 3.423463120625302e-05, 'batch_size': 2346, 'optimizer': 'RMSprop'}.
2026-06-30 02:30:06,771 - experiment_functions - INFO - Early stopping at epoch 2150. Best Metrics: (0.002508037332101891, 0.000716144596622533, 0.0016604899481845604)
2026-06-30 02:30:06,855 - optuna.study.study - INFO - Trial 173 finished with values: [0.002508037332101891, 0.000716144596622533, 0.0016604899481845604] and parameters: {'n_layers': 3, 'embedding_dim': 256, 'lr': 0.0019032891633152442, 'lambda_val': 1.4824096770292976e-06, 'batch_size': 620, 'optimizer': 'Adam'}.
2026-06-30 02:34:58,091 - experiment_functions - INFO - Early stopping at epoch 3600. Best Metrics: (0.0017995294219942636, 0.0004815455046254963, 0.0012260016380756808)
2026-06-30 02:34:58,192 - optuna.study.study - INFO - Trial 174 finished with values: [0.0017995294219942636, 0.0004815455046254963, 0.0012260016380756808] and parameters: {'n_layers': 2, 'embedding_dim': 128, 'lr': 0.0005030162275943933, 'lambda_val': 0.0034877418541278907, 'batch_size': 2642, 'optimizer': 'RMSprop'}.
2026-06-30 02:37:36,914 - experiment_functions - INFO - Early stopping at epoch 2000. Best Metrics: (0.0022601676639000742, 0.0006097676804133503, 0.0015257119711877985)
2026-06-30 02:37:37,002 - optuna.study.study - INFO - Trial 175 finished with values: [0.0022601676639000742, 0.0006097676804133503, 0.0015257119711877985] and parameters: {'n_layers': 2, 'embedding_dim': 96, 'lr': 0.0013047089047836713, 'lambda_val': 1.4824096770292976e-06, 'batch_size': 3144, 'optimizer': 'RMSprop'}.
2026-06-30 02:42:37,377 - optuna.study.study - INFO - Trial 176 finished with values: [0.0032250129103084755, 0.0008472161540945615, 0.0021452187049829105] and parameters: {'n_layers': 4, 'embedding_dim': 32, 'lr': 0.0013047089047836713, 'lambda_val': 3.9206514264817366e-05, 'batch_size': 620, 'optimizer': 'RMSprop'}.
2026-06-30 02:45:26,111 - experiment_functions - INFO - Early stopping at epoch 2300. Best Metrics: (0.0019730901861414706, 0.00046824839009934854, 0.0012240083094298643)
2026-06-30 02:45:26,201 - optuna.study.study - INFO - Trial 177 finished with values: [0.0019730901861414706, 0.00046824839009934854, 0.0012240083094298643] and parameters: {'n_layers': 1, 'embedding_dim': 32, 'lr': 0.002365530211589969, 'lambda_val': 2.199939619081897e-06, 'batch_size': 607, 'optimizer': 'Adam'}.
2026-06-30 02:46:26,856 - experiment_functions - INFO - Early stopping at epoch 550. Best Metrics: (0.0019094303673183892, 0.0005575290162034839, 0.0013494903335784483)
2026-06-30 02:46:26,941 - optuna.study.study - INFO - Trial 178 finished with values: [0.0019094303673183892, 0.0005575290162034839, 0.0013494903335784483] and parameters: {'n_layers': 4, 'embedding_dim': 256, 'lr': 0.011969954708165368, 'lambda_val': 0.0001469814413818991, 'batch_size': 761, 'optimizer': 'RMSprop'}.
2026-06-30 02:51:43,003 - optuna.study.study - INFO - Trial 179 finished with values: [0.0017858057790309842, 0.0004521018938890261, 0.0012354795611923132] and parameters: {'n_layers': 4, 'embedding_dim': 64, 'lr': 0.0003326962115608699, 'lambda_val': 0.00026298441775334766, 'batch_size': 3827, 'optimizer': 'RMSprop'}.
2026-06-30 02:53:23,229 - experiment_functions - INFO - Early stopping at epoch 1200. Best Metrics: (0.0024150453712860004, 0.0006753034591493646, 0.0015550890876711609)
2026-06-30 02:53:23,314 - optuna.study.study - INFO - Trial 180 finished with values: [0.0024150453712860004, 0.0006753034591493646, 0.0015550890876711609] and parameters: {'n_layers': 3, 'embedding_dim': 96, 'lr': 0.00462778555680869, 'lambda_val': 1.4824096770292976e-06, 'batch_size': 620, 'optimizer': 'Adam'}.
2026-06-30 02:58:32,419 - optuna.study.study - INFO - Trial 181 finished with values: [0.002993562870789763, 0.0007683832608323994, 0.001954418909453718] and parameters: {'n_layers': 3, 'embedding_dim': 64, 'lr': 0.0009496158639399897, 'lambda_val': 3.423463120625302e-05, 'batch_size': 620, 'optimizer': 'RMSprop'}.
2026-06-30 03:03:43,368 - optuna.study.study - INFO - Trial 182 finished with values: [0.0015650043778706563, 0.0003846665273635622, 0.0009600679729633043] and parameters: {'n_layers': 1, 'embedding_dim': 128, 'lr': 0.0005030162275943933, 'lambda_val': 3.9206514264817366e-05, 'batch_size': 2664, 'optimizer': 'RMSprop'}.
2026-06-30 03:06:21,871 - experiment_functions - INFO - Early stopping at epoch 1850. Best Metrics: (0.0023140046102644173, 0.0006658055202021162, 0.001640556818393587)
2026-06-30 03:06:21,961 - optuna.study.study - INFO - Trial 183 finished with values: [0.0023140046102644173, 0.0006658055202021162, 0.001640556818393587] and parameters: {'n_layers': 3, 'embedding_dim': 128, 'lr': 0.0013047089047836713, 'lambda_val': 1.554897118169841e-06, 'batch_size': 2836, 'optimizer': 'Adam'}.
2026-06-30 03:09:33,611 - experiment_functions - INFO - Early stopping at epoch 2350. Best Metrics: (0.0017227262153211309, 0.00044925251220485164, 0.0011729017444281852)
2026-06-30 03:09:33,701 - optuna.study.study - INFO - Trial 184 finished with values: [0.0017227262153211309, 0.00044925251220485164, 0.0011729017444281852] and parameters: {'n_layers': 2, 'embedding_dim': 128, 'lr': 0.0005030162275943933, 'lambda_val': 0.004495593710473149, 'batch_size': 4019, 'optimizer': 'RMSprop'}.
2026-06-30 03:14:49,065 - optuna.study.study - INFO - Trial 185 finished with values: [0.0018012795494217165, 0.00046729859620462365, 0.001232534619479182] and parameters: {'n_layers': 4, 'embedding_dim': 64, 'lr': 0.0003326962115608699, 'lambda_val': 0.0001469814413818991, 'batch_size': 3827, 'optimizer': 'RMSprop'}.
2026-06-30 03:20:56,402 - optuna.study.study - INFO - Trial 186 finished with values: [0.002040918280937309, 0.0005584788100982088, 0.0013803797961272515] and parameters: {'n_layers': 2, 'embedding_dim': 256, 'lr': 0.0013047089047836713, 'lambda_val': 1.554897118169841e-06, 'batch_size': 2346, 'optimizer': 'Adam'}.
2026-06-30 03:21:51,017 - experiment_functions - INFO - Early stopping at epoch 500. Best Metrics: (0.000196179580735485, 4.3690519157342865e-05, 9.836268473457762e-05)
2026-06-30 03:21:51,105 - optuna.study.study - INFO - Trial 187 finished with values: [0.000196179580735485, 4.3690519157342865e-05, 9.836268473457762e-05] and parameters: {'n_layers': 4, 'embedding_dim': 256, 'lr': 0.00023083335295538064, 'lambda_val': 1.554897118169841e-06, 'batch_size': 2642, 'optimizer': 'SGD'}.
