2026-06-30 05:47:08,898 - optuna.study.study - INFO - Trial 236 finished with values: [0.0026204690949906237, 0.0007645840852535, 0.001761998192764291] and parameters: {'n_layers': 4, 'embedding_dim': 256, 'lr': 0.0013047089047836713, 'lambda_val': 1.582941209280553e-06, 'batch_size': 2836, 'optimizer': 'RMSprop'}.
2026-06-30 05:51:49,327 - experiment_functions - INFO - Early stopping at epoch 2700. Best Metrics: (0.0027670146375178184, 0.0007949774898846952, 0.0018918877565238077)
2026-06-30 05:51:49,406 - optuna.study.study - INFO - Trial 237 finished with values: [0.0027670146375178184, 0.0007949774898846952, 0.0018918877565238077] and parameters: {'n_layers': 4, 'embedding_dim': 256, 'lr': 0.0005030162275943933, 'lambda_val': 1.582941209280553e-06, 'batch_size': 2642, 'optimizer': 'RMSprop'}.
2026-06-30 05:54:45,869 - experiment_functions - INFO - Early stopping at epoch 2300. Best Metrics: (0.0023334877886316985, 0.000624014588834223, 0.001649168854704236)
2026-06-30 05:54:45,956 - optuna.study.study - INFO - Trial 238 finished with values: [0.0023334877886316985, 0.000624014588834223, 0.001649168854704236] and parameters: {'n_layers': 2, 'embedding_dim': 64, 'lr': 0.0013047089047836713, 'lambda_val': 2.199939619081897e-06, 'batch_size': 2642, 'optimizer': 'RMSprop'}.
2026-06-30 05:56:33,918 - experiment_functions - INFO - Early stopping at epoch 1200. Best Metrics: (0.0024608989267701827, 0.0007123454210436335, 0.0016057788901022525)
2026-06-30 05:56:34,010 - optuna.study.study - INFO - Trial 239 finished with values: [0.0024608989267701827, 0.0007123454210436335, 0.0016057788901022525] and parameters: {'n_layers': 4, 'embedding_dim': 128, 'lr': 0.0013254856718013359, 'lambda_val': 3.423463120625302e-05, 'batch_size': 2836, 'optimizer': 'Adam'}.
2026-06-30 06:01:36,858 - optuna.study.study - INFO - Trial 240 finished with values: [0.0026066586653005065, 0.0006382614972550957, 0.00166995732271297] and parameters: {'n_layers': 2, 'embedding_dim': 64, 'lr': 0.0009496158639399897, 'lambda_val': 3.423463120625302e-05, 'batch_size': 1591, 'optimizer': 'RMSprop'}.
2026-06-30 06:06:37,623 - optuna.study.study - INFO - Trial 241 finished with values: [0.003642677829631743, 0.0009621412153562678, 0.002376636842259851] and parameters: {'n_layers': 4, 'embedding_dim': 32, 'lr': 0.0013047089047836713, 'lambda_val': 2.199939619081897e-06, 'batch_size': 620, 'optimizer': 'RMSprop'}.
2026-06-30 06:11:45,625 - optuna.study.study - INFO - Trial 242 finished with values: [0.0014962145425875806, 0.00036852003115323977, 0.0010782698553325875] and parameters: {'n_layers': 3, 'embedding_dim': 64, 'lr': 0.0005030162275943933, 'lambda_val': 2.199939619081897e-06, 'batch_size': 620, 'optimizer': 'RMSprop'}.
2026-06-30 06:15:29,644 - experiment_functions - INFO - Early stopping at epoch 2850. Best Metrics: (0.0022735549405630863, 0.0006335125277814714, 0.001625338866321339)
2026-06-30 06:15:29,736 - optuna.study.study - INFO - Trial 243 finished with values: [0.0022735549405630863, 0.0006335125277814714, 0.001625338866321339] and parameters: {'n_layers': 2, 'embedding_dim': 96, 'lr': 0.00462778555680869, 'lambda_val': 2.199939619081897e-06, 'batch_size': 620, 'optimizer': 'RMSprop'}.
2026-06-30 06:19:41,128 - experiment_functions - INFO - Early stopping at epoch 2400. Best Metrics: (0.002573990950577942, 0.0007531865585168018, 0.001645064061530095)
2026-06-30 06:19:41,212 - optuna.study.study - INFO - Trial 244 finished with values: [0.002573990950577942, 0.0007531865585168018, 0.001645064061530095] and parameters: {'n_layers': 4, 'embedding_dim': 256, 'lr': 0.0019032891633152442, 'lambda_val': 2.199939619081897e-06, 'batch_size': 620, 'optimizer': 'Adam'}.
2026-06-30 06:21:28,032 - experiment_functions - INFO - Early stopping at epoch 1000. Best Metrics: (0.0024287105071477666, 0.0007284919172539558, 0.001573188102133304)
2026-06-30 06:21:28,127 - optuna.study.study - INFO - Trial 245 finished with values: [0.0024287105071477666, 0.0007284919172539558, 0.001573188102133304] and parameters: {'n_layers': 4, 'embedding_dim': 256, 'lr': 0.003551859771094245, 'lambda_val': 1.582941209280553e-06, 'batch_size': 1106, 'optimizer': 'RMSprop'}.
2026-06-30 06:27:01,557 - optuna.study.study - INFO - Trial 246 finished with values: [0.0023680428476792453, 0.0006838516042018884, 0.0016493266536876413] and parameters: {'n_layers': 4, 'embedding_dim': 96, 'lr': 0.0005030162275943933, 'lambda_val': 1.4824096770292976e-06, 'batch_size': 3604, 'optimizer': 'Adam'}.
2026-06-30 06:28:08,380 - experiment_functions - INFO - Early stopping at epoch 850. Best Metrics: (0.0019521954896629667, 0.0004872442679938454, 0.0012469899376569616)
2026-06-30 06:28:08,468 - optuna.study.study - INFO - Trial 247 finished with values: [0.0019521954896629667, 0.0004872442679938454, 0.0012469899376569616] and parameters: {'n_layers': 3, 'embedding_dim': 32, 'lr': 0.003551859771094245, 'lambda_val': 6.696439606049452e-06, 'batch_size': 2872, 'optimizer': 'Adam'}.
2026-06-30 06:30:23,518 - experiment_functions - INFO - Early stopping at epoch 1600. Best Metrics: (0.00025913568740827247, 6.743536652546399e-05, 0.00014184547096297032)
2026-06-30 06:30:23,599 - optuna.study.study - INFO - Trial 248 finished with values: [0.00025913568740827247, 6.743536652546399e-05, 0.00014184547096297032] and parameters: {'n_layers': 4, 'embedding_dim': 96, 'lr': 2.3086778521484887e-05, 'lambda_val': 2.199939619081897e-06, 'batch_size': 2836, 'optimizer': 'RMSprop'}.
2026-06-30 06:31:17,534 - experiment_functions - INFO - Early stopping at epoch 550. Best Metrics: (0.0017223691028274498, 0.0005024409703094429, 0.0012327002754166222)
2026-06-30 06:31:17,612 - optuna.study.study - INFO - Trial 249 finished with values: [0.0017223691028274498, 0.0005024409703094429, 0.0012327002754166222] and parameters: {'n_layers': 2, 'embedding_dim': 256, 'lr': 0.015824528401365202, 'lambda_val': 3.9206514264817366e-05, 'batch_size': 1694, 'optimizer': 'RMSprop'}.
2026-06-30 06:36:27,063 - optuna.study.study - INFO - Trial 250 finished with values: [0.0029593329029260814, 0.0007484375890431777, 0.0019616964819632195] and parameters: {'n_layers': 3, 'embedding_dim': 64, 'lr': 0.0009496158639399897, 'lambda_val': 1.2998445360626841e-05, 'batch_size': 620, 'optimizer': 'RMSprop'}.
2026-06-30 06:42:06,138 - optuna.study.study - INFO - Trial 251 finished with values: [0.00213215389209019, 0.0005337841688353627, 0.0014269899793399182] and parameters: {'n_layers': 1, 'embedding_dim': 256, 'lr': 0.0013047089047836713, 'lambda_val': 2.6725312640472836e-05, 'batch_size': 620, 'optimizer': 'RMSprop'}.
2026-06-30 06:47:22,240 - optuna.study.study - INFO - Trial 252 finished with values: [0.0021061926025878154, 0.0005670269551507323, 0.0014536012019467411] and parameters: {'n_layers': 4, 'embedding_dim': 64, 'lr': 0.0005030162275943933, 'lambda_val': 8.371597941680678e-06, 'batch_size': 1739, 'optimizer': 'Adam'}.
2026-06-30 06:52:37,587 - optuna.study.study - INFO - Trial 253 finished with values: [0.0024562940767084637, 0.0006923997492544119, 0.001626570665805193] and parameters: {'n_layers': 4, 'embedding_dim': 64, 'lr': 0.0005030162275943933, 'lambda_val': 0.0024351223150280593, 'batch_size': 2642, 'optimizer': 'RMSprop'}.
2026-06-30 06:56:54,363 - experiment_functions - INFO - Early stopping at epoch 3300. Best Metrics: (0.0036881643561205934, 0.001003932146724161, 0.0024162732236633604)
2026-06-30 06:56:54,447 - optuna.study.study - INFO - Trial 254 finished with values: [0.0036881643561205934, 0.001003932146724161, 0.0024162732236633604] and parameters: {'n_layers': 3, 'embedding_dim': 64, 'lr': 0.0019032891633152442, 'lambda_val': 3.9206514264817366e-05, 'batch_size': 620, 'optimizer': 'RMSprop'}.
2026-06-30 06:58:41,327 - experiment_functions - INFO - Early stopping at epoch 1400. Best Metrics: (0.0024002100971769694, 0.0006354121155709211, 0.0015671610619086736)
2026-06-30 06:58:41,417 - optuna.study.study - INFO - Trial 255 finished with values: [0.0024002100971769694, 0.0006354121155709211, 0.0015671610619086736] and parameters: {'n_layers': 3, 'embedding_dim': 32, 'lr': 0.0019032891633152442, 'lambda_val': 3.9206514264817366e-05, 'batch_size': 1750, 'optimizer': 'RMSprop'}.
2026-06-30 06:59:39,103 - experiment_functions - INFO - Early stopping at epoch 550. Best Metrics: (0.0015477944238412658, 0.00045875045115209996, 0.0011084100124976696)
2026-06-30 06:59:39,188 - optuna.study.study - INFO - Trial 256 finished with values: [0.0015477944238412658, 0.00045875045115209996, 0.0011084100124976696] and parameters: {'n_layers': 3, 'embedding_dim': 256, 'lr': 0.07574401798690115, 'lambda_val': 2.199939619081897e-06, 'batch_size': 620, 'optimizer': 'Adam'}.
2026-06-30 07:02:22,709 - experiment_functions - INFO - Early stopping at epoch 2050. Best Metrics: (0.0029371175245622664, 0.0008519651235681856, 0.002065352842955141)
2026-06-30 07:02:22,797 - optuna.study.study - INFO - Trial 257 finished with values: [0.0029371175245622664, 0.0008519651235681856, 0.002065352842955141] and parameters: {'n_layers': 4, 'embedding_dim': 64, 'lr': 0.0013047089047836713, 'lambda_val': 3.9206514264817366e-05, 'batch_size': 1750, 'optimizer': 'RMSprop'}.
2026-06-30 07:04:59,431 - experiment_functions - INFO - Early stopping at epoch 2000. Best Metrics: (0.002461563496026994, 0.0006496590239917937, 0.0016541496113268103)
2026-06-30 07:04:59,511 - optuna.study.study - INFO - Trial 258 finished with values: [0.002461563496026994, 0.0006496590239917937, 0.0016541496113268103] and parameters: {'n_layers': 3, 'embedding_dim': 64, 'lr': 0.0009496158639399897, 'lambda_val': 0.003125628581679788, 'batch_size': 1378, 'optimizer': 'RMSprop'}.
2026-06-30 07:10:09,180 - optuna.study.study - INFO - Trial 259 finished with values: [0.003189358502587554, 0.0008681116197785081, 0.0020806453112848823] and parameters: {'n_layers': 3, 'embedding_dim': 64, 'lr': 0.0013047089047836713, 'lambda_val': 3.9206514264817366e-05, 'batch_size': 527, 'optimizer': 'RMSprop'}.
2026-06-30 07:17:00,996 - optuna.study.study - INFO - Trial 260 finished with values: [0.0005268953651572149, 0.00013961970252455218, 0.0003490611729428953] and parameters: {'n_layers': 4, 'embedding_dim': 256, 'lr': 0.00013988779385335347, 'lambda_val': 3.5505946883162264e-05, 'batch_size': 1588, 'optimizer': 'RMSprop'}.
2026-06-30 07:20:34,386 - experiment_functions - INFO - Early stopping at epoch 2850. Best Metrics: (0.002378447063592496, 0.000647759436202344, 0.0016069790550705997)
2026-06-30 07:20:34,459 - optuna.study.study - INFO - Trial 261 finished with values: [0.002378447063592496, 0.000647759436202344, 0.0016069790550705997] and parameters: {'n_layers': 3, 'embedding_dim': 32, 'lr': 0.0013047089047836713, 'lambda_val': 8.429103116936915e-06, 'batch_size': 2664, 'optimizer': 'RMSprop'}.
2026-06-30 07:22:26,442 - experiment_functions - INFO - Early stopping at epoch 1350. Best Metrics: (0.002647833577136578, 0.0007360902684117546, 0.001795181297390628)
2026-06-30 07:22:26,531 - optuna.study.study - INFO - Trial 262 finished with values: [0.002647833577136578, 0.0007360902684117546, 0.001795181297390628] and parameters: {'n_layers': 3, 'embedding_dim': 96, 'lr': 0.0019032891633152442, 'lambda_val': 1.554897118169841e-06, 'batch_size': 3447, 'optimizer': 'RMSprop'}.
2026-06-30 07:27:36,238 - optuna.study.study - INFO - Trial 263 finished with values: [0.0031293845549855903, 0.0007579355279904262, 0.002009206266388193] and parameters: {'n_layers': 3, 'embedding_dim': 64, 'lr': 0.0009496158639399897, 'lambda_val': 3.9133224858424936e-05, 'batch_size': 620, 'optimizer': 'RMSprop'}.
2026-06-30 07:29:17,867 - experiment_functions - INFO - Early stopping at epoch 950. Best Metrics: (0.0027796248635204774, 0.0008035256349372186, 0.0019048287612299377)
2026-06-30 07:29:17,949 - optuna.study.study - INFO - Trial 264 finished with values: [0.0027796248635204774, 0.0008035256349372186, 0.0019048287612299377] and parameters: {'n_layers': 4, 'embedding_dim': 256, 'lr': 0.0019032891633152442, 'lambda_val': 3.9206514264817366e-05, 'batch_size': 1106, 'optimizer': 'RMSprop'}.
2026-06-30 07:31:24,934 - experiment_functions - INFO - Early stopping at epoch 1200. Best Metrics: (0.0027710983020590688, 0.0007978268715688696, 0.0018024517406549174)
2026-06-30 07:31:25,010 - optuna.study.study - INFO - Trial 265 finished with values: [0.0027710983020590688, 0.0007978268715688696, 0.0018024517406549174] and parameters: {'n_layers': 4, 'embedding_dim': 256, 'lr': 0.0013047089047836713, 'lambda_val': 3.9206514264817366e-05, 'batch_size': 1750, 'optimizer': 'RMSprop'}.
2026-06-30 07:34:11,420 - experiment_functions - INFO - Early stopping at epoch 2100. Best Metrics: (0.00032865850827905893, 8.738103831468573e-05, 0.00019944412944235493)
2026-06-30 07:34:11,510 - optuna.study.study - INFO - Trial 266 finished with values: [0.00032865850827905893, 8.738103831468573e-05, 0.00019944412944235493] and parameters: {'n_layers': 4, 'embedding_dim': 64, 'lr': 8.823352443027257e-05, 'lambda_val': 1.582941209280553e-06, 'batch_size': 1739, 'optimizer': 'RMSprop'}.
2026-06-30 07:39:44,748 - optuna.study.study - INFO - Trial 267 finished with values: [0.002548274916347337, 0.0006734038713599149, 0.0017612341848527917] and parameters: {'n_layers': 4, 'embedding_dim': 96, 'lr': 0.0005030162275943933, 'lambda_val': 2.281093086329608e-05, 'batch_size': 2664, 'optimizer': 'Adam'}.
2026-06-30 07:41:01,379 - experiment_functions - INFO - Early stopping at epoch 750. Best Metrics: (0.00155808710409213, 0.00047774632904659686, 0.0010816458061182774)
2026-06-30 07:41:01,464 - optuna.study.study - INFO - Trial 268 finished with values: [0.00155808710409213, 0.00047774632904659686, 0.0010816458061182774] and parameters: {'n_layers': 3, 'embedding_dim': 256, 'lr': 0.0013047089047836713, 'lambda_val': 0.02489251442174991, 'batch_size': 2836, 'optimizer': 'RMSprop'}.
2026-06-30 07:45:50,080 - experiment_functions - INFO - Early stopping at epoch 3650. Best Metrics: (0.0034473795979583746, 0.0009203502839883746, 0.002274221721015562)
2026-06-30 07:45:50,235 - optuna.study.study - INFO - Trial 269 finished with values: [0.0034473795979583746, 0.0009203502839883746, 0.002274221721015562] and parameters: {'n_layers': 4, 'embedding_dim': 64, 'lr': 0.0009496158639399897, 'lambda_val': 3.423463120625302e-05, 'batch_size': 1317, 'optimizer': 'RMSprop'}.
2026-06-30 07:48:24,896 - experiment_functions - INFO - Early stopping at epoch 1550. Best Metrics: (0.0023513584256957165, 0.0006572573751495926, 0.0015700310073223686)
2026-06-30 07:48:24,975 - optuna.study.study - INFO - Trial 270 finished with values: [0.0023513584256957165, 0.0006572573751495926, 0.0015700310073223686] and parameters: {'n_layers': 3, 'embedding_dim': 256, 'lr': 0.0019032891633152442, 'lambda_val': 0.0014524018384289156, 'batch_size': 620, 'optimizer': 'Adam'}.
2026-06-30 07:50:01,565 - experiment_functions - INFO - Early stopping at epoch 900. Best Metrics: (0.0024024399206411693, 0.0006961989248333111, 0.0015874259964317049)
2026-06-30 07:50:01,656 - optuna.study.study - INFO - Trial 271 finished with values: [0.0024024399206411693, 0.0006961989248333111, 0.0015874259964317049] and parameters: {'n_layers': 4, 'embedding_dim': 256, 'lr': 0.0013047089047836713, 'lambda_val': 0.00117585320986071, 'batch_size': 1413, 'optimizer': 'RMSprop'}.
2026-06-30 07:55:04,338 - optuna.study.study - INFO - Trial 272 finished with values: [0.002285578832816362, 0.0005831734513610547, 0.0015739884992513257] and parameters: {'n_layers': 2, 'embedding_dim': 64, 'lr': 0.0009496158639399897, 'lambda_val': 3.423463120625302e-05, 'batch_size': 1591, 'optimizer': 'RMSprop'}.
2026-06-30 08:00:19,026 - optuna.study.study - INFO - Trial 273 finished with values: [0.001718352201728291, 0.0004321562220998044, 0.0011742461806111145] and parameters: {'n_layers': 4, 'embedding_dim': 64, 'lr': 0.0005030162275943933, 'lambda_val': 1.4824096770292976e-06, 'batch_size': 620, 'optimizer': 'RMSprop'}.
2026-06-30 08:05:33,761 - optuna.study.study - INFO - Trial 274 finished with values: [0.0021628152005177233, 0.0005822236574663297, 0.001546641702017472] and parameters: {'n_layers': 4, 'embedding_dim': 64, 'lr': 0.0005030162275943933, 'lambda_val': 5.792375439364778e-05, 'batch_size': 1307, 'optimizer': 'RMSprop'}.
2026-06-30 08:06:20,676 - experiment_functions - INFO - Early stopping at epoch 550. Best Metrics: (0.0014849473997799747, 0.00043120642820507947, 0.0010641377800680127)
2026-06-30 08:06:20,751 - optuna.study.study - INFO - Trial 275 finished with values: [0.0014849473997799747, 0.00043120642820507947, 0.0010641377800680127] and parameters: {'n_layers': 4, 'embedding_dim': 64, 'lr': 0.07227123812760104, 'lambda_val': 2.199939619081897e-06, 'batch_size': 620, 'optimizer': 'RMSprop'}.
2026-06-30 08:12:31,458 - experiment_functions - INFO - Early stopping at epoch 3550. Best Metrics: (0.002482910628126263, 0.0007047470698858348, 0.0016692176736176833)
2026-06-30 08:12:31,548 - optuna.study.study - INFO - Trial 276 finished with values: [0.002482910628126263, 0.0007047470698858348, 0.0016692176736176833] and parameters: {'n_layers': 4, 'embedding_dim': 256, 'lr': 0.0005030162275943933, 'lambda_val': 1.4824096770292976e-06, 'batch_size': 3604, 'optimizer': 'Adam'}.
2026-06-30 08:17:06,611 - experiment_functions - INFO - Early stopping at epoch 3700. Best Metrics: (0.002130529409891377, 0.0005717759246243565, 0.0014013302962448226)
2026-06-30 08:17:06,812 - optuna.study.study - INFO - Trial 277 finished with values: [0.002130529409891377, 0.0005717759246243565, 0.0014013302962448226] and parameters: {'n_layers': 3, 'embedding_dim': 32, 'lr': 0.0013047089047836713, 'lambda_val': 0.003994902887373803, 'batch_size': 620, 'optimizer': 'Adam'}.
2026-06-30 08:20:56,760 - experiment_functions - INFO - Early stopping at epoch 3050. Best Metrics: (0.0031503129119871175, 0.0008443667724103871, 0.0021383963152568778)
2026-06-30 08:20:56,851 - optuna.study.study - INFO - Trial 278 finished with values: [0.0031503129119871175, 0.0008443667724103871, 0.0021383963152568778] and parameters: {'n_layers': 4, 'embedding_dim': 32, 'lr': 0.0013047089047836713, 'lambda_val': 2.199939619081897e-06, 'batch_size': 1106, 'optimizer': 'RMSprop'}.
2026-06-30 08:22:19,000 - experiment_functions - INFO - Early stopping at epoch 1000. Best Metrics: (0.0021343864251115543, 0.000630663146097297, 0.0014059199503365452)
2026-06-30 08:22:19,080 - optuna.study.study - INFO - Trial 279 finished with values: [0.0021343864251115543, 0.000630663146097297, 0.0014059199503365452] and parameters: {'n_layers': 4, 'embedding_dim': 64, 'lr': 0.008133603076144514, 'lambda_val': 2.199939619081897e-06, 'batch_size': 620, 'optimizer': 'RMSprop'}.
2026-06-30 08:23:52,205 - experiment_functions - INFO - Early stopping at epoch 1100. Best Metrics: (0.00028798996466651794, 7.788309936743727e-05, 0.000159519149151472)
2026-06-30 08:23:52,299 - optuna.study.study - INFO - Trial 280 finished with values: [0.00028798996466651794, 7.788309936743727e-05, 0.000159519149151472] and parameters: {'n_layers': 4, 'embedding_dim': 96, 'lr': 0.0754483174275551, 'lambda_val': 3.423463120625302e-05, 'batch_size': 3447, 'optimizer': 'SGD'}.
2026-06-30 08:25:47,687 - experiment_functions - INFO - Early stopping at epoch 1500. Best Metrics: (0.0028840600799710536, 0.0007455882073590033, 0.0019439816558144225)
2026-06-30 08:25:47,765 - optuna.study.study - INFO - Trial 281 finished with values: [0.0028840600799710536, 0.0007455882073590033, 0.0019439816558144225] and parameters: {'n_layers': 4, 'embedding_dim': 32, 'lr': 0.0013047089047836713, 'lambda_val': 3.9206514264817366e-05, 'batch_size': 2746, 'optimizer': 'RMSprop'}.
2026-06-30 08:31:50,062 - optuna.study.study - INFO - Trial 282 finished with values: [0.0010206285887206694, 0.0002944361073647019, 0.0007551154562465248] and parameters: {'n_layers': 2, 'embedding_dim': 256, 'lr': 0.0005379024919032739, 'lambda_val': 0.019032189065450168, 'batch_size': 620, 'optimizer': 'RMSprop'}.
2026-06-30 08:34:49,883 - experiment_functions - INFO - Early stopping at epoch 2250. Best Metrics: (0.0029172451867991098, 0.0008310696578842391, 0.0019744151303699173)
2026-06-30 08:34:49,979 - optuna.study.study - INFO - Trial 283 finished with values: [0.0029172451867991098, 0.0008310696578842391, 0.0019744151303699173] and parameters: {'n_layers': 4, 'embedding_dim': 64, 'lr': 0.0009496158639399897, 'lambda_val': 3.9206514264817366e-05, 'batch_size': 3447, 'optimizer': 'RMSprop'}.
2026-06-30 08:40:38,650 - optuna.study.study - INFO - Trial 284 finished with values: [0.0017323328902584016, 0.0004483027183101268, 0.0012017513659655376] and parameters: {'n_layers': 4, 'embedding_dim': 128, 'lr': 0.0005030162275943933, 'lambda_val': 1.4824096770292976e-06, 'batch_size': 620, 'optimizer': 'Adam'}.
2026-06-30 08:45:01,629 - experiment_functions - INFO - Early stopping at epoch 3500. Best Metrics: (0.0033614603938886497, 0.0009459947191459454, 0.002275139100634989)
2026-06-30 08:45:01,724 - optuna.study.study - INFO - Trial 285 finished with values: [0.0033614603938886497, 0.0009459947191459454, 0.002275139100634989] and parameters: {'n_layers': 4, 'embedding_dim': 32, 'lr': 0.0013047089047836713, 'lambda_val': 3.918882692849622e-06, 'batch_size': 620, 'optimizer': 'RMSprop'}.
2026-06-30 08:48:00,333 - experiment_functions - INFO - Early stopping at epoch 1700. Best Metrics: (0.0029414461818935097, 0.0008709610014626828, 0.001955725134321823)
2026-06-30 08:48:00,419 - optuna.study.study - INFO - Trial 286 finished with values: [0.0029414461818935097, 0.0008709610014626828, 0.001955725134321823] and parameters: {'n_layers': 4, 'embedding_dim': 256, 'lr': 0.0013047089047836713, 'lambda_val': 6.696439606049452e-06, 'batch_size': 1387, 'optimizer': 'RMSprop'}.
