2026-07-04 07:51:31,430 - optuna.study.study - INFO - Trial 142 finished with values: [0.009015874465105015, 0.002294702049655225, 0.005470407088236703] and parameters: {'n_layers': 1, 'embedding_dim': 32, 'lr': 0.002418408076717017, 'lambda_val': 0.02788180573288284, 'batch_size': 2058, 'optimizer': 'Adam'}.
2026-07-04 07:57:10,448 - optuna.study.study - INFO - Trial 143 finished with values: [0.011348246773566936, 0.0026394772334403438, 0.006646876524162424] and parameters: {'n_layers': 2, 'embedding_dim': 96, 'lr': 0.010561378130282784, 'lambda_val': 2.035462829964434e-06, 'batch_size': 1072, 'optimizer': 'Adam'}.
2026-07-04 07:57:58,322 - experiment_functions - INFO - Early stopping at epoch 550. Best Metrics: (0.007685372392612732, 0.0018995877894496893, 0.00489953129802241)
2026-07-04 07:57:58,392 - optuna.study.study - INFO - Trial 144 finished with values: [0.007685372392612732, 0.0018995877894496893, 0.00489953129802241] and parameters: {'n_layers': 2, 'embedding_dim': 64, 'lr': 0.04253268374092292, 'lambda_val': 8.712752718400284e-06, 'batch_size': 1490, 'optimizer': 'Adam'}.
2026-07-04 08:03:28,837 - optuna.study.study - INFO - Trial 145 finished with values: [0.014191516645352809, 0.0032093535702752505, 0.00847330659180493] and parameters: {'n_layers': 1, 'embedding_dim': 128, 'lr': 0.01117512599566325, 'lambda_val': 5.842035456079482e-06, 'batch_size': 733, 'optimizer': 'RMSprop'}.
2026-07-04 08:08:59,210 - experiment_functions - INFO - Early stopping at epoch 3900. Best Metrics: (0.011263201294821185, 0.0025511464012309333, 0.006532957651956824)
2026-07-04 08:08:59,277 - optuna.study.study - INFO - Trial 146 finished with values: [0.011263201294821185, 0.0025511464012309333, 0.006532957651956824] and parameters: {'n_layers': 2, 'embedding_dim': 96, 'lr': 0.010561378130282784, 'lambda_val': 0.000434831816568687, 'batch_size': 2611, 'optimizer': 'Adam'}.
2026-07-04 08:09:43,622 - experiment_functions - INFO - Early stopping at epoch 500. Best Metrics: (0.0002444324989884043, 5.7937427578215534e-05, 0.00013978096430811434)
2026-07-04 08:09:43,706 - optuna.study.study - INFO - Trial 147 finished with values: [0.0002444324989884043, 5.7937427578215534e-05, 0.00013978096430811434] and parameters: {'n_layers': 3, 'embedding_dim': 64, 'lr': 0.003976153551196258, 'lambda_val': 5.245398963432972e-05, 'batch_size': 1590, 'optimizer': 'SGD'}.
2026-07-04 08:15:23,499 - optuna.study.study - INFO - Trial 148 finished with values: [0.016514310354373465, 0.0035275345250080736, 0.009541812866923662] and parameters: {'n_layers': 2, 'embedding_dim': 96, 'lr': 0.010561378130282784, 'lambda_val': 1.3386054080202036e-05, 'batch_size': 4003, 'optimizer': 'RMSprop'}.
2026-07-04 08:21:21,811 - optuna.study.study - INFO - Trial 149 finished with values: [0.019092199877102773, 0.0042626749995251035, 0.0112478610827773] and parameters: {'n_layers': 3, 'embedding_dim': 96, 'lr': 0.000825254884924141, 'lambda_val': 2.502572700858551e-05, 'batch_size': 4003, 'optimizer': 'Adam'}.
2026-07-04 08:27:14,789 - optuna.study.study - INFO - Trial 150 finished with values: [0.01564440262889504, 0.0034411032805881127, 0.008934049033178817] and parameters: {'n_layers': 2, 'embedding_dim': 128, 'lr': 0.003976153551196258, 'lambda_val': 0.0002512734421382798, 'batch_size': 1590, 'optimizer': 'RMSprop'}.
2026-07-04 08:32:40,459 - optuna.study.study - INFO - Trial 151 finished with values: [0.01655936824677224, 0.0036529073191117535, 0.00969420183245705] and parameters: {'n_layers': 2, 'embedding_dim': 64, 'lr': 0.00917953252838311, 'lambda_val': 8.712752718400284e-06, 'batch_size': 1490, 'optimizer': 'RMSprop'}.
2026-07-04 08:33:26,864 - experiment_functions - INFO - Early stopping at epoch 500. Best Metrics: (0.00018439805565526662, 4.9389282525691926e-05, 9.89568074840817e-05)
2026-07-04 08:33:27,346 - optuna.study.study - INFO - Trial 152 finished with values: [0.00018439805565526662, 4.9389282525691926e-05, 9.89568074840817e-05] and parameters: {'n_layers': 2, 'embedding_dim': 128, 'lr': 0.003976153551196258, 'lambda_val': 0.00024094534041408627, 'batch_size': 3310, 'optimizer': 'SGD'}.
2026-07-04 08:41:03,258 - optuna.study.study - INFO - Trial 153 finished with values: [0.017152708851614476, 0.0038761088843720917, 0.01031369531781048] and parameters: {'n_layers': 3, 'embedding_dim': 256, 'lr': 0.012323002098276907, 'lambda_val': 0.000434831816568687, 'batch_size': 3485, 'optimizer': 'RMSprop'}.
2026-07-04 08:45:43,909 - experiment_functions - INFO - Early stopping at epoch 3600. Best Metrics: (0.013244204529107394, 0.0030830309822768463, 0.007906397586737399)
2026-07-04 08:45:43,995 - optuna.study.study - INFO - Trial 154 finished with values: [0.013244204529107394, 0.0030830309822768463, 0.007906397586737399] and parameters: {'n_layers': 1, 'embedding_dim': 64, 'lr': 0.01117512599566325, 'lambda_val': 0.0002512734421382798, 'batch_size': 1239, 'optimizer': 'RMSprop'}.
2026-07-04 08:46:29,442 - experiment_functions - INFO - Early stopping at epoch 550. Best Metrics: (0.002457054481143321, 0.000635412115570921, 0.0015748909289559538)
2026-07-04 08:46:29,521 - optuna.study.study - INFO - Trial 155 finished with values: [0.002457054481143321, 0.000635412115570921, 0.0015748909289559538] and parameters: {'n_layers': 2, 'embedding_dim': 32, 'lr': 0.06583972847008256, 'lambda_val': 0.010714233222348575, 'batch_size': 3865, 'optimizer': 'Adam'}.
2026-07-04 08:51:56,384 - optuna.study.study - INFO - Trial 156 finished with values: [0.0002790914811243768, 8.26320688410615e-05, 0.0001705287521798479] and parameters: {'n_layers': 1, 'embedding_dim': 128, 'lr': 0.0001645531725371351, 'lambda_val': 0.00011379845769455902, 'batch_size': 3865, 'optimizer': 'Adam'}.
2026-07-04 08:52:55,812 - experiment_functions - INFO - Early stopping at epoch 500. Best Metrics: (0.00027917761193670446, 6.648557263073913e-05, 0.00015167861897237003)
2026-07-04 08:52:55,907 - optuna.study.study - INFO - Trial 157 finished with values: [0.00027917761193670446, 6.648557263073913e-05, 0.00015167861897237003] and parameters: {'n_layers': 3, 'embedding_dim': 256, 'lr': 0.0006924103134205528, 'lambda_val': 0.015849517119376627, 'batch_size': 2982, 'optimizer': 'SGD'}.
2026-07-04 08:58:18,048 - optuna.study.study - INFO - Trial 158 finished with values: [0.013195127518542753, 0.003253993883327318, 0.00816585190705922] and parameters: {'n_layers': 2, 'embedding_dim': 64, 'lr': 0.0006924103134205528, 'lambda_val': 5.347102143813337e-06, 'batch_size': 1256, 'optimizer': 'RMSprop'}.
2026-07-04 09:03:34,598 - optuna.study.study - INFO - Trial 159 finished with values: [0.013777310794694199, 0.0032511445016431433, 0.008209410980749983] and parameters: {'n_layers': 3, 'embedding_dim': 32, 'lr': 0.0006924103134205528, 'lambda_val': 0.000418444762312661, 'batch_size': 2982, 'optimizer': 'Adam'}.
2026-07-04 09:09:13,600 - optuna.study.study - INFO - Trial 160 finished with values: [0.015604144220244582, 0.003483844005850731, 0.009148546362821645] and parameters: {'n_layers': 2, 'embedding_dim': 96, 'lr': 0.003976153551196258, 'lambda_val': 1.8863610642623192e-06, 'batch_size': 1590, 'optimizer': 'RMSprop'}.
2026-07-04 09:12:41,042 - experiment_functions - INFO - Early stopping at epoch 2550. Best Metrics: (0.011829640044586053, 0.0025644435157570807, 0.0069503958661806765)
2026-07-04 09:12:41,116 - optuna.study.study - INFO - Trial 161 finished with values: [0.011829640044586053, 0.0025644435157570807, 0.0069503958661806765] and parameters: {'n_layers': 4, 'embedding_dim': 32, 'lr': 0.015216834194850396, 'lambda_val': 5.842035456079482e-06, 'batch_size': 3865, 'optimizer': 'RMSprop'}.
2026-07-04 09:18:36,506 - optuna.study.study - INFO - Trial 162 finished with values: [0.018153797323063055, 0.003913150846266361, 0.01088560939604704] and parameters: {'n_layers': 2, 'embedding_dim': 128, 'lr': 0.00917953252838311, 'lambda_val': 2.035462829964434e-06, 'batch_size': 3723, 'optimizer': 'RMSprop'}.
2026-07-04 09:23:56,397 - optuna.study.study - INFO - Trial 163 finished with values: [0.009854758537800606, 0.0024818114469160194, 0.006112680136337474] and parameters: {'n_layers': 1, 'embedding_dim': 96, 'lr': 0.000825254884924141, 'lambda_val': 1.126199379401549e-05, 'batch_size': 2031, 'optimizer': 'Adam'}.
2026-07-04 09:24:41,412 - experiment_functions - INFO - Early stopping at epoch 500. Best Metrics: (0.0002401527269690369, 6.458598484128944e-05, 0.00013686722899604778)
2026-07-04 09:24:41,505 - optuna.study.study - INFO - Trial 164 finished with values: [0.0002401527269690369, 6.458598484128944e-05, 0.00013686722899604778] and parameters: {'n_layers': 2, 'embedding_dim': 96, 'lr': 0.025344100892934637, 'lambda_val': 1.3386054080202036e-05, 'batch_size': 4003, 'optimizer': 'SGD'}.
2026-07-04 09:30:16,859 - experiment_functions - INFO - Early stopping at epoch 3950. Best Metrics: (0.016733236055595457, 0.003576923807533765, 0.009987502938931067)
2026-07-04 09:30:16,949 - optuna.study.study - INFO - Trial 165 finished with values: [0.016733236055595457, 0.003576923807533765, 0.009987502938931067] and parameters: {'n_layers': 2, 'embedding_dim': 96, 'lr': 0.010561378130282784, 'lambda_val': 1.3386054080202036e-05, 'batch_size': 4003, 'optimizer': 'RMSprop'}.
2026-07-04 09:33:19,314 - experiment_functions - INFO - Early stopping at epoch 2300. Best Metrics: (0.013874240758345218, 0.003072583249434872, 0.008106797260426377)
2026-07-04 09:33:19,398 - optuna.study.study - INFO - Trial 166 finished with values: [0.013874240758345218, 0.003072583249434872, 0.008106797260426377] and parameters: {'n_layers': 1, 'embedding_dim': 64, 'lr': 0.008660151763754238, 'lambda_val': 0.0009350662159596599, 'batch_size': 1773, 'optimizer': 'Adam'}.
2026-07-04 09:38:30,035 - optuna.study.study - INFO - Trial 167 finished with values: [0.022363893790176486, 0.004914233611306347, 0.013454224809824465] and parameters: {'n_layers': 1, 'embedding_dim': 32, 'lr': 0.004214167238747189, 'lambda_val': 0.00011379845769455902, 'batch_size': 1756, 'optimizer': 'Adam'}.
2026-07-04 09:43:40,643 - optuna.study.study - INFO - Trial 168 finished with values: [0.014075489829096352, 0.0034031115247991186, 0.008551599294550226] and parameters: {'n_layers': 2, 'embedding_dim': 32, 'lr': 0.0013930224389611008, 'lambda_val': 0.0002512734421382798, 'batch_size': 733, 'optimizer': 'Adam'}.
2026-07-04 09:45:08,057 - experiment_functions - INFO - Early stopping at epoch 1000. Best Metrics: (0.01654556084994915, 0.0036500579374275787, 0.009859799307417344)
2026-07-04 09:45:08,124 - optuna.study.study - INFO - Trial 169 finished with values: [0.01654556084994915, 0.0036500579374275787, 0.009859799307417344] and parameters: {'n_layers': 1, 'embedding_dim': 128, 'lr': 0.010561378130282784, 'lambda_val': 2.693600404305163e-06, 'batch_size': 4003, 'optimizer': 'Adam'}.
2026-07-04 09:46:10,507 - experiment_functions - INFO - Early stopping at epoch 650. Best Metrics: (0.0001880749097861274, 5.603783978876583e-05, 0.00010949500038617308)
2026-07-04 09:46:10,580 - optuna.study.study - INFO - Trial 170 finished with values: [0.0001880749097861274, 5.603783978876583e-05, 0.00010949500038617308] and parameters: {'n_layers': 1, 'embedding_dim': 256, 'lr': 1.6291837150723865e-05, 'lambda_val': 0.0016032367653458185, 'batch_size': 1726, 'optimizer': 'RMSprop'}.
2026-07-04 09:52:24,743 - optuna.study.study - INFO - Trial 171 finished with values: [0.021086771572496454, 0.004951275573200616, 0.0128544690966276] and parameters: {'n_layers': 1, 'embedding_dim': 256, 'lr': 0.0013930224389611008, 'lambda_val': 5.842035456079482e-06, 'batch_size': 2102, 'optimizer': 'Adam'}.
2026-07-04 09:58:03,490 - experiment_functions - INFO - Early stopping at epoch 3800. Best Metrics: (0.014268462054705278, 0.003216002127538325, 0.008241855056273745)
2026-07-04 09:58:03,574 - optuna.study.study - INFO - Trial 172 finished with values: [0.014268462054705278, 0.003216002127538325, 0.008241855056273745] and parameters: {'n_layers': 3, 'embedding_dim': 96, 'lr': 0.003976153551196258, 'lambda_val': 1.3386054080202036e-05, 'batch_size': 3656, 'optimizer': 'RMSprop'}.
2026-07-04 09:59:13,992 - experiment_functions - INFO - Early stopping at epoch 850. Best Metrics: (0.014762240218493303, 0.003317630074273883, 0.008844851987594198)
2026-07-04 09:59:14,068 - optuna.study.study - INFO - Trial 173 finished with values: [0.014762240218493303, 0.003317630074273883, 0.008844851987594198] and parameters: {'n_layers': 1, 'embedding_dim': 64, 'lr': 0.01117512599566325, 'lambda_val': 0.0002623010666251748, 'batch_size': 4003, 'optimizer': 'Adam'}.
2026-07-04 10:04:15,601 - optuna.study.study - INFO - Trial 174 finished with values: [0.007313009288809016, 0.001977470888817127, 0.004367192436064191] and parameters: {'n_layers': 1, 'embedding_dim': 32, 'lr': 0.05862759240705656, 'lambda_val': 0.02788180573288284, 'batch_size': 3099, 'optimizer': 'Adam'}.
2026-07-04 10:05:07,685 - experiment_functions - INFO - Early stopping at epoch 550. Best Metrics: (0.009133109069649594, 0.0020885967744999337, 0.005529621729479972)
2026-07-04 10:05:07,759 - optuna.study.study - INFO - Trial 175 finished with values: [0.009133109069649594, 0.0020885967744999337, 0.005529621729479972] and parameters: {'n_layers': 2, 'embedding_dim': 128, 'lr': 0.039464971202713, 'lambda_val': 1.8863610642623192e-06, 'batch_size': 3362, 'optimizer': 'Adam'}.
2026-07-04 10:05:48,663 - experiment_functions - INFO - Early stopping at epoch 500. Best Metrics: (0.00026966954654199953, 7.028474820963851e-05, 0.00016004205844054935)
2026-07-04 10:05:48,753 - optuna.study.study - INFO - Trial 176 finished with values: [0.00026966954654199953, 7.028474820963851e-05, 0.00016004205844054935] and parameters: {'n_layers': 1, 'embedding_dim': 32, 'lr': 1.975171429524443e-05, 'lambda_val': 5.385694884049571e-05, 'batch_size': 733, 'optimizer': 'Adam'}.
2026-07-04 10:14:08,877 - optuna.study.study - INFO - Trial 177 finished with values: [0.018352528466777197, 0.003846665273635621, 0.011133135252773157] and parameters: {'n_layers': 4, 'embedding_dim': 256, 'lr': 0.015216834194850396, 'lambda_val': 5.842035456079482e-06, 'batch_size': 3485, 'optimizer': 'RMSprop'}.
2026-07-04 10:20:02,490 - optuna.study.study - INFO - Trial 178 finished with values: [0.012386693206605546, 0.002737306004597003, 0.007258213257033681] and parameters: {'n_layers': 2, 'embedding_dim': 128, 'lr': 0.01117512599566325, 'lambda_val': 8.310152356857856e-06, 'batch_size': 1159, 'optimizer': 'Adam'}.
2026-07-04 10:21:18,241 - experiment_functions - INFO - Early stopping at epoch 900. Best Metrics: (0.007711677506816727, 0.0018388009801872996, 0.00446366326574847)
2026-07-04 10:21:18,328 - optuna.study.study - INFO - Trial 179 finished with values: [0.007711677506816727, 0.0018388009801872996, 0.00446366326574847] and parameters: {'n_layers': 1, 'embedding_dim': 96, 'lr': 0.00917953252838311, 'lambda_val': 0.016738975661941942, 'batch_size': 3865, 'optimizer': 'Adam'}.
2026-07-04 10:27:09,845 - optuna.study.study - INFO - Trial 180 finished with values: [0.015205309430453895, 0.0032929354330110366, 0.008969332833955972] and parameters: {'n_layers': 2, 'embedding_dim': 128, 'lr': 0.015216834194850396, 'lambda_val': 2.693600404305163e-06, 'batch_size': 733, 'optimizer': 'RMSprop'}.
2026-07-04 10:32:34,963 - optuna.study.study - INFO - Trial 181 finished with values: [0.014520448746887694, 0.003220751097011948, 0.008381801644086443] and parameters: {'n_layers': 2, 'embedding_dim': 64, 'lr': 0.00917953252838311, 'lambda_val': 0.0002512734421382798, 'batch_size': 3723, 'optimizer': 'RMSprop'}.
2026-07-04 10:33:15,871 - experiment_functions - INFO - Early stopping at epoch 500. Best Metrics: (0.00022337081154278076, 5.31884581045913e-05, 0.00011548345041130057)
2026-07-04 10:33:15,957 - optuna.study.study - INFO - Trial 182 finished with values: [0.00022337081154278076, 5.31884581045913e-05, 0.00011548345041130057] and parameters: {'n_layers': 1, 'embedding_dim': 32, 'lr': 0.010561378130282784, 'lambda_val': 0.0002911487611325228, 'batch_size': 2435, 'optimizer': 'SGD'}.
2026-07-04 10:34:00,381 - experiment_functions - INFO - Early stopping at epoch 500. Best Metrics: (0.00021784739565858596, 5.888722147294038e-05, 0.0001314740029750817)
2026-07-04 10:34:00,466 - optuna.study.study - INFO - Trial 183 finished with values: [0.00021784739565858596, 5.888722147294038e-05, 0.0001314740029750817] and parameters: {'n_layers': 3, 'embedding_dim': 64, 'lr': 1.036282362335599e-05, 'lambda_val': 5.245398963432972e-05, 'batch_size': 1590, 'optimizer': 'RMSprop'}.
2026-07-04 10:38:45,574 - experiment_functions - INFO - Early stopping at epoch 3200. Best Metrics: (0.013680528320625428, 0.002981403035541288, 0.007860897180945115)
2026-07-04 10:38:45,645 - optuna.study.study - INFO - Trial 184 finished with values: [0.013680528320625428, 0.002981403035541288, 0.007860897180945115] and parameters: {'n_layers': 2, 'embedding_dim': 128, 'lr': 0.010561378130282784, 'lambda_val': 2.0028786198894676e-06, 'batch_size': 4003, 'optimizer': 'Adam'}.
2026-07-04 10:42:55,769 - experiment_functions - INFO - Early stopping at epoch 3300. Best Metrics: (0.008638786126454622, 0.002214919362498338, 0.0051926701334709495)
2026-07-04 10:42:56,010 - optuna.study.study - INFO - Trial 185 finished with values: [0.008638786126454622, 0.002214919362498338, 0.0051926701334709495] and parameters: {'n_layers': 1, 'embedding_dim': 32, 'lr': 0.002418408076717017, 'lambda_val': 0.02788180573288284, 'batch_size': 2058, 'optimizer': 'Adam'}.
2026-07-04 10:45:58,145 - experiment_functions - INFO - Early stopping at epoch 2300. Best Metrics: (0.015883697602999975, 0.0035123378226924766, 0.009287195178128297)
2026-07-04 10:45:58,245 - optuna.study.study - INFO - Trial 186 finished with values: [0.015883697602999975, 0.0035123378226924766, 0.009287195178128297] and parameters: {'n_layers': 1, 'embedding_dim': 64, 'lr': 0.008660151763754238, 'lambda_val': 0.00011379845769455902, 'batch_size': 2031, 'optimizer': 'Adam'}.
2026-07-04 10:51:10,017 - optuna.study.study - INFO - Trial 187 finished with values: [0.011231345413967416, 0.0028721767376479307, 0.006864990543060324] and parameters: {'n_layers': 1, 'embedding_dim': 64, 'lr': 0.001034077148613127, 'lambda_val': 0.00011379845769455902, 'batch_size': 1756, 'optimizer': 'Adam'}.
2026-07-04 10:56:32,621 - optuna.study.study - INFO - Trial 188 finished with values: [0.01560573433679779, 0.003535132876165872, 0.009342448132774501] and parameters: {'n_layers': 1, 'embedding_dim': 96, 'lr': 0.00917953252838311, 'lambda_val': 5.842035456079482e-06, 'batch_size': 1047, 'optimizer': 'RMSprop'}.
2026-07-04 10:57:18,949 - experiment_functions - INFO - Early stopping at epoch 500. Best Metrics: (0.0002198819962819641, 6.173660315711492e-05, 0.00011321483063134091)
2026-07-04 10:57:19,032 - optuna.study.study - INFO - Trial 189 finished with values: [0.0002198819962819641, 6.173660315711492e-05, 0.00011321483063134091] and parameters: {'n_layers': 2, 'embedding_dim': 128, 'lr': 0.0018842593654879714, 'lambda_val': 0.005222699236026829, 'batch_size': 916, 'optimizer': 'SGD'}.
2026-07-04 11:03:14,375 - optuna.study.study - INFO - Trial 190 finished with values: [0.011407990991871782, 0.002580590011967403, 0.006683320029317646] and parameters: {'n_layers': 3, 'embedding_dim': 96, 'lr': 0.008660151763754238, 'lambda_val': 5.385694884049571e-05, 'batch_size': 1953, 'optimizer': 'Adam'}.
2026-07-04 11:03:59,269 - experiment_functions - INFO - Early stopping at epoch 500. Best Metrics: (0.00020471436520598857, 5.508804589404098e-05, 0.00010907187929493428)
2026-07-04 11:03:59,358 - optuna.study.study - INFO - Trial 191 finished with values: [0.00020471436520598857, 5.508804589404098e-05, 0.00010907187929493428] and parameters: {'n_layers': 2, 'embedding_dim': 96, 'lr': 0.010561378130282784, 'lambda_val': 2.693600404305163e-06, 'batch_size': 1072, 'optimizer': 'SGD'}.
2026-07-04 11:05:17,904 - experiment_functions - INFO - Early stopping at epoch 900. Best Metrics: (0.01548008732074521, 0.003435404517219764, 0.009120942133697619)
2026-07-04 11:05:17,990 - optuna.study.study - INFO - Trial 192 finished with values: [0.01548008732074521, 0.003435404517219764, 0.009120942133697619] and parameters: {'n_layers': 1, 'embedding_dim': 128, 'lr': 0.010561378130282784, 'lambda_val': 0.000434831816568687, 'batch_size': 3865, 'optimizer': 'Adam'}.
2026-07-04 11:12:11,553 - optuna.study.study - INFO - Trial 193 finished with values: [0.019275535188885445, 0.004166745816157894, 0.011684792024581479] and parameters: {'n_layers': 2, 'embedding_dim': 256, 'lr': 0.010561378130282784, 'lambda_val': 1.3386054080202036e-05, 'batch_size': 1447, 'optimizer': 'RMSprop'}.
2026-07-04 11:17:57,015 - optuna.study.study - INFO - Trial 194 finished with values: [0.014076142556673759, 0.00318180954732823, 0.008235342265744265] and parameters: {'n_layers': 4, 'embedding_dim': 64, 'lr': 0.015216834194850396, 'lambda_val': 5.245398963432972e-05, 'batch_size': 1590, 'optimizer': 'RMSprop'}.
2026-07-04 11:19:10,003 - experiment_functions - INFO - Early stopping at epoch 550. Best Metrics: (0.008565765586609536, 0.0019869688277643753, 0.005122714548899185)
2026-07-04 11:19:10,101 - optuna.study.study - INFO - Trial 195 finished with values: [0.008565765586609536, 0.0019869688277643753, 0.005122714548899185] and parameters: {'n_layers': 4, 'embedding_dim': 256, 'lr': 0.04403558016082412, 'lambda_val': 5.842035456079482e-06, 'batch_size': 3485, 'optimizer': 'Adam'}.
2026-07-04 11:24:26,289 - optuna.study.study - INFO - Trial 196 finished with values: [0.013818885472579562, 0.0033005337841688354, 0.008281124987485311] and parameters: {'n_layers': 3, 'embedding_dim': 32, 'lr': 0.0006924103134205528, 'lambda_val': 5.842035456079482e-06, 'batch_size': 2982, 'optimizer': 'RMSprop'}.
