2026-07-02 00:33:58,858 - optuna.study.study - INFO - Trial 290 finished with values: [0.002822973195884088, 0.0008386680090420378, 0.00188642372514042] and parameters: {'n_layers': 4, 'embedding_dim': 128, 'lr': 0.001878376227052758, 'lambda_val': 1.1327416378479618e-05, 'batch_size': 1661, 'optimizer': 'RMSprop'}.
2026-07-02 00:35:14,446 - experiment_functions - INFO - Early stopping at epoch 1000. Best Metrics: (0.0019020559101291814, 0.0004245578709420057, 0.0011573613870926418)
2026-07-02 00:35:14,538 - optuna.study.study - INFO - Trial 291 finished with values: [0.0019020559101291814, 0.0004245578709420057, 0.0011573613870926418] and parameters: {'n_layers': 1, 'embedding_dim': 32, 'lr': 0.0016422068986048546, 'lambda_val': 0.0030313007548460886, 'batch_size': 2339, 'optimizer': 'RMSprop'}.
2026-07-02 00:36:44,287 - experiment_functions - INFO - Early stopping at epoch 1150. Best Metrics: (0.0021536306969922752, 0.0006002697414661019, 0.0014657894620707583)
2026-07-02 00:36:44,376 - optuna.study.study - INFO - Trial 292 finished with values: [0.0021536306969922752, 0.0006002697414661019, 0.0014657894620707583] and parameters: {'n_layers': 4, 'embedding_dim': 32, 'lr': 0.0016422068986048546, 'lambda_val': 3.1335017132005896e-06, 'batch_size': 2701, 'optimizer': 'Adam'}.
2026-07-02 00:38:29,244 - experiment_functions - INFO - Early stopping at epoch 1400. Best Metrics: (0.0021071914767934754, 0.0005527800467298597, 0.0013692745915114114)
2026-07-02 00:38:29,554 - optuna.study.study - INFO - Trial 293 finished with values: [0.0021071914767934754, 0.0005527800467298597, 0.0013692745915114114] and parameters: {'n_layers': 2, 'embedding_dim': 32, 'lr': 0.001878376227052758, 'lambda_val': 3.747302157374259e-06, 'batch_size': 2026, 'optimizer': 'RMSprop'}.
2026-07-02 00:39:40,160 - experiment_functions - INFO - Early stopping at epoch 800. Best Metrics: (0.0025191186810058054, 0.0007009478943069352, 0.0016620277617382156)
2026-07-02 00:39:40,478 - optuna.study.study - INFO - Trial 294 finished with values: [0.0025191186810058054, 0.0007009478943069352, 0.0016620277617382156] and parameters: {'n_layers': 3, 'embedding_dim': 128, 'lr': 0.001878376227052758, 'lambda_val': 0.0012592144246174213, 'batch_size': 1470, 'optimizer': 'RMSprop'}.
2026-07-02 00:41:56,713 - experiment_functions - INFO - Early stopping at epoch 1800. Best Metrics: (0.002419382013481174, 0.000635412115570921, 0.00164964458893417)
2026-07-02 00:41:56,811 - optuna.study.study - INFO - Trial 295 finished with values: [0.002419382013481174, 0.000635412115570921, 0.00164964458893417] and parameters: {'n_layers': 3, 'embedding_dim': 32, 'lr': 0.001878376227052758, 'lambda_val': 8.805105847994294e-05, 'batch_size': 1100, 'optimizer': 'Adam'}.
2026-07-02 00:47:13,065 - optuna.study.study - INFO - Trial 296 finished with values: [0.0029215853287640333, 0.0008035256349372186, 0.0019246531575882453] and parameters: {'n_layers': 4, 'embedding_dim': 64, 'lr': 0.0008549054963496413, 'lambda_val': 1.413159904245194e-06, 'batch_size': 2701, 'optimizer': 'RMSprop'}.
2026-07-02 00:48:00,078 - experiment_functions - INFO - Early stopping at epoch 500. Best Metrics: (0.00018838627051516023, 5.5088045894040994e-05, 0.00010208859814915464)
2026-07-02 00:48:00,232 - optuna.study.study - INFO - Trial 297 finished with values: [0.00018838627051516023, 5.5088045894040994e-05, 0.00010208859814915464] and parameters: {'n_layers': 4, 'embedding_dim': 128, 'lr': 1.7855616823353212e-05, 'lambda_val': 0.015441318461128705, 'batch_size': 2701, 'optimizer': 'RMSprop'}.
2026-07-02 00:53:00,376 - optuna.study.study - INFO - Trial 298 finished with values: [0.0029197901775912336, 0.0007740820242007484, 0.0018843495391732761] and parameters: {'n_layers': 4, 'embedding_dim': 32, 'lr': 0.0008102278066186573, 'lambda_val': 3.0256770800491656e-06, 'batch_size': 2003, 'optimizer': 'RMSprop'}.
2026-07-02 00:55:59,545 - experiment_functions - INFO - Early stopping at epoch 2400. Best Metrics: (0.0024092672689956162, 0.000575575100203256, 0.0015960064250123477)
2026-07-02 00:55:59,735 - optuna.study.study - INFO - Trial 299 finished with values: [0.0024092672689956162, 0.000575575100203256, 0.0015960064250123477] and parameters: {'n_layers': 1, 'embedding_dim': 64, 'lr': 0.001878376227052758, 'lambda_val': 1.413159904245194e-06, 'batch_size': 1100, 'optimizer': 'RMSprop'}.
2026-07-02 00:55:59,750 - root - INFO - Selected Trial 217 based on Max ndcg: 0.0024
2026-07-02 00:55:59,750 - root - INFO - Associated Recall: 0.0037
2026-07-02 00:55:59,751 - experiment_functions - INFO - Training the best model ... for e_amazon_1c1dcs_strict_rand4
2026-07-02 01:00:03,503 - experiment_functions - INFO - Early stopping at epoch 3250. Best Metrics: (0.003339305377079492, 0.0008918564671466292, 0.002216638620357008)
2026-07-02 01:00:10,722 - root - INFO -   **** Training e_amazon_1c1dcs_strict_rand5
2026-07-02 01:00:10,756 - root - INFO -   **** Getting 88982/2429444 random edges
2026-07-02 01:00:10,896 - optuna.storages._rdb.storage - INFO - A new study created in RDB with name: Study_e_amazon_1c1dcs_strict_rand5
2026-07-02 01:00:53,376 - experiment_functions - INFO - Early stopping at epoch 500. Best Metrics: (0.00019652330474004498, 5.7937427578215534e-05, 0.000112617318943915)
2026-07-02 01:00:53,458 - optuna.study.study - INFO - Trial 0 finished with values: [0.00019652330474004498, 5.7937427578215534e-05, 0.000112617318943915] and parameters: {'n_layers': 2, 'embedding_dim': 96, 'lr': 0.00037064170900742656, 'lambda_val': 2.079258642930449e-06, 'batch_size': 2783, 'optimizer': 'SGD'}.
2026-07-02 01:01:37,156 - experiment_functions - INFO - Early stopping at epoch 500. Best Metrics: (0.00022819767299357065, 5.413825199931616e-05, 0.00012093592202141295)
2026-07-02 01:01:37,760 - optuna.study.study - INFO - Trial 1 finished with values: [0.00022819767299357065, 5.413825199931616e-05, 0.00012093592202141295] and parameters: {'n_layers': 2, 'embedding_dim': 128, 'lr': 0.07917880854714401, 'lambda_val': 6.953056466773753e-05, 'batch_size': 1545, 'optimizer': 'SGD'}.
2026-07-02 01:02:23,079 - experiment_functions - INFO - Early stopping at epoch 500. Best Metrics: (0.00021181070069571, 6.648557263073913e-05, 0.00011540871408489204)
2026-07-02 01:02:23,416 - optuna.study.study - INFO - Trial 2 finished with values: [0.00021181070069571, 6.648557263073913e-05, 0.00011540871408489204] and parameters: {'n_layers': 1, 'embedding_dim': 256, 'lr': 4.306000179903948e-05, 'lambda_val': 0.0022981549063997245, 'batch_size': 1336, 'optimizer': 'SGD'}.
2026-07-02 01:03:07,092 - experiment_functions - INFO - Early stopping at epoch 500. Best Metrics: (0.00020097149419297193, 6.0786809262390075e-05, 0.00013262253086960955)
2026-07-02 01:03:07,185 - optuna.study.study - INFO - Trial 3 finished with values: [0.00020097149419297193, 6.0786809262390075e-05, 0.00013262253086960955] and parameters: {'n_layers': 2, 'embedding_dim': 128, 'lr': 0.0017801469022637167, 'lambda_val': 1.31939091185931e-06, 'batch_size': 3363, 'optimizer': 'SGD'}.
2026-07-02 01:03:51,844 - experiment_functions - INFO - Early stopping at epoch 500. Best Metrics: (0.0001783406828316477, 5.318845810459131e-05, 0.00011539809035177494)
2026-07-02 01:03:51,967 - optuna.study.study - INFO - Trial 4 finished with values: [0.0001783406828316477, 5.318845810459131e-05, 0.00011539809035177494] and parameters: {'n_layers': 3, 'embedding_dim': 128, 'lr': 0.023937501145110285, 'lambda_val': 0.0029893033970281356, 'batch_size': 828, 'optimizer': 'SGD'}.
2026-07-02 01:04:41,961 - experiment_functions - INFO - Early stopping at epoch 550. Best Metrics: (0.0019213088121240538, 0.0005375833444142621, 0.0013474677480015216)
2026-07-02 01:04:42,089 - optuna.study.study - INFO - Trial 5 finished with values: [0.0019213088121240538, 0.0005375833444142621, 0.0013474677480015216] and parameters: {'n_layers': 3, 'embedding_dim': 128, 'lr': 0.014582350289404945, 'lambda_val': 1.5990539279825177e-06, 'batch_size': 2610, 'optimizer': 'RMSprop'}.
2026-07-02 01:05:28,805 - experiment_functions - INFO - Early stopping at epoch 500. Best Metrics: (0.00017849410261961112, 5.793742757821552e-05, 0.0001071993840808886)
2026-07-02 01:05:28,967 - optuna.study.study - INFO - Trial 6 finished with values: [0.00017849410261961112, 5.793742757821552e-05, 0.0001071993840808886] and parameters: {'n_layers': 4, 'embedding_dim': 128, 'lr': 0.006423009501763469, 'lambda_val': 2.9372864907090347e-05, 'batch_size': 1550, 'optimizer': 'SGD'}.
2026-07-02 01:09:55,025 - experiment_functions - INFO - Early stopping at epoch 3600. Best Metrics: (0.00039758150039896823, 9.97283589461087e-05, 0.0002570283379584102)
2026-07-02 01:09:55,102 - optuna.study.study - INFO - Trial 7 finished with values: [0.00039758150039896823, 9.97283589461087e-05, 0.0002570283379584102] and parameters: {'n_layers': 3, 'embedding_dim': 32, 'lr': 0.00010899306073745633, 'lambda_val': 2.188289071859108e-05, 'batch_size': 2754, 'optimizer': 'RMSprop'}.
2026-07-02 01:14:48,564 - optuna.study.study - INFO - Trial 8 finished with values: [0.0016366781644089957, 0.00037326900062686403, 0.0010738868442841474] and parameters: {'n_layers': 2, 'embedding_dim': 32, 'lr': 0.0005054275041431983, 'lambda_val': 1.3509843414861852e-06, 'batch_size': 2547, 'optimizer': 'Adam'}.
2026-07-02 01:20:10,795 - optuna.study.study - INFO - Trial 9 finished with values: [0.0008595012892703518, 0.00021940238968143913, 0.0005511635967511186] and parameters: {'n_layers': 3, 'embedding_dim': 96, 'lr': 0.00018259669020323155, 'lambda_val': 0.0007768299501636463, 'batch_size': 3901, 'optimizer': 'Adam'}.
2026-07-02 01:25:30,359 - experiment_functions - INFO - Early stopping at epoch 3700. Best Metrics: (0.0004951757986892886, 0.00011872423684060558, 0.0002728335078486702)
2026-07-02 01:25:30,434 - optuna.study.study - INFO - Trial 10 finished with values: [0.0004951757986892886, 0.00011872423684060558, 0.0002728335078486702] and parameters: {'n_layers': 4, 'embedding_dim': 128, 'lr': 0.00012596460191365054, 'lambda_val': 7.527708733761619e-05, 'batch_size': 2305, 'optimizer': 'RMSprop'}.
2026-07-02 01:26:12,323 - experiment_functions - INFO - Early stopping at epoch 500. Best Metrics: (0.00017366044298236969, 6.078680926239006e-05, 0.0001183386304568229)
2026-07-02 01:26:12,438 - optuna.study.study - INFO - Trial 11 finished with values: [0.00017366044298236969, 6.078680926239006e-05, 0.0001183386304568229] and parameters: {'n_layers': 3, 'embedding_dim': 64, 'lr': 2.3877732233134334e-05, 'lambda_val': 0.018209859669299278, 'batch_size': 598, 'optimizer': 'SGD'}.
2026-07-02 01:26:55,106 - experiment_functions - INFO - Early stopping at epoch 500. Best Metrics: (0.0002108733789608444, 5.603783978876584e-05, 0.00012385816299954986)
2026-07-02 01:26:55,201 - optuna.study.study - INFO - Trial 12 finished with values: [0.0002108733789608444, 5.603783978876584e-05, 0.00012385816299954986] and parameters: {'n_layers': 4, 'embedding_dim': 64, 'lr': 3.5061153766401395e-05, 'lambda_val': 0.0011463774111558364, 'batch_size': 1923, 'optimizer': 'SGD'}.
2026-07-02 01:27:40,038 - experiment_functions - INFO - Early stopping at epoch 500. Best Metrics: (0.00024099967462706693, 6.743536652546399e-05, 0.00015392785547965694)
2026-07-02 01:27:40,518 - optuna.study.study - INFO - Trial 13 finished with values: [0.00024099967462706693, 6.743536652546399e-05, 0.00015392785547965694] and parameters: {'n_layers': 3, 'embedding_dim': 128, 'lr': 1.117817003272977e-05, 'lambda_val': 2.8736044863125995e-05, 'batch_size': 2852, 'optimizer': 'SGD'}.
2026-07-02 01:28:54,580 - experiment_functions - INFO - Early stopping at epoch 900. Best Metrics: (0.001412007235040854, 0.0004682483900993485, 0.001044366938147109)
2026-07-02 01:28:54,770 - optuna.study.study - INFO - Trial 14 finished with values: [0.001412007235040854, 0.0004682483900993485, 0.001044366938147109] and parameters: {'n_layers': 4, 'embedding_dim': 64, 'lr': 0.0014374939555211086, 'lambda_val': 0.035063843860833145, 'batch_size': 3027, 'optimizer': 'RMSprop'}.
2026-07-02 01:29:55,188 - experiment_functions - INFO - Early stopping at epoch 650. Best Metrics: (0.0022675916007508044, 0.0006762532530440893, 0.0015084280251644866)
2026-07-02 01:29:55,288 - optuna.study.study - INFO - Trial 15 finished with values: [0.0022675916007508044, 0.0006762532530440893, 0.0015084280251644866] and parameters: {'n_layers': 4, 'embedding_dim': 128, 'lr': 0.003175598950751376, 'lambda_val': 0.00024499244831156216, 'batch_size': 3470, 'optimizer': 'RMSprop'}.
2026-07-02 01:32:42,599 - experiment_functions - INFO - Early stopping at epoch 1800. Best Metrics: (0.0011255791722282783, 0.0003922648785213608, 0.0007908502627265877)
2026-07-02 01:32:42,714 - optuna.study.study - INFO - Trial 16 finished with values: [0.0011255791722282783, 0.0003922648785213608, 0.0007908502627265877] and parameters: {'n_layers': 2, 'embedding_dim': 256, 'lr': 0.07137537182714382, 'lambda_val': 0.0132654287745143, 'batch_size': 3579, 'optimizer': 'Adam'}.
2026-07-02 01:33:26,311 - experiment_functions - INFO - Early stopping at epoch 500. Best Metrics: (0.00022330010011662084, 5.128887031514162e-05, 0.00012585768487919646)
2026-07-02 01:33:26,381 - optuna.study.study - INFO - Trial 17 finished with values: [0.00022330010011662084, 5.128887031514162e-05, 0.00012585768487919646] and parameters: {'n_layers': 2, 'embedding_dim': 128, 'lr': 0.0024426924601332993, 'lambda_val': 0.015248414860902306, 'batch_size': 2066, 'optimizer': 'SGD'}.
2026-07-02 01:34:07,880 - experiment_functions - INFO - Early stopping at epoch 500. Best Metrics: (0.0002192856466334156, 6.743536652546399e-05, 0.00014201783841398874)
2026-07-02 01:34:08,190 - optuna.study.study - INFO - Trial 18 finished with values: [0.0002192856466334156, 6.743536652546399e-05, 0.00014201783841398874] and parameters: {'n_layers': 1, 'embedding_dim': 96, 'lr': 0.03231295689705411, 'lambda_val': 0.009173555980000624, 'batch_size': 2880, 'optimizer': 'SGD'}.
2026-07-02 01:34:50,405 - experiment_functions - INFO - Early stopping at epoch 500. Best Metrics: (0.0001950559833070549, 5.033907642041676e-05, 9.738670167770927e-05)
2026-07-02 01:34:50,518 - optuna.study.study - INFO - Trial 19 finished with values: [0.0001950559833070549, 5.033907642041676e-05, 9.738670167770927e-05] and parameters: {'n_layers': 2, 'embedding_dim': 96, 'lr': 2.7772457018870208e-05, 'lambda_val': 0.044932320302830404, 'batch_size': 3846, 'optimizer': 'SGD'}.
2026-07-02 01:35:33,406 - experiment_functions - INFO - Early stopping at epoch 500. Best Metrics: (0.00017566421376266148, 5.128887031514162e-05, 0.0001008004325868703)
2026-07-02 01:35:33,479 - optuna.study.study - INFO - Trial 20 finished with values: [0.00017566421376266148, 5.128887031514162e-05, 0.0001008004325868703] and parameters: {'n_layers': 4, 'embedding_dim': 64, 'lr': 3.9088044862138156e-05, 'lambda_val': 7.748314078830902e-05, 'batch_size': 2442, 'optimizer': 'SGD'}.
2026-07-02 01:36:18,627 - experiment_functions - INFO - Early stopping at epoch 550. Best Metrics: (0.0013127479478833323, 0.000348574359364018, 0.0008560406818361742)
2026-07-02 01:36:18,719 - optuna.study.study - INFO - Trial 21 finished with values: [0.0013127479478833323, 0.000348574359364018, 0.0008560406818361742] and parameters: {'n_layers': 2, 'embedding_dim': 64, 'lr': 0.021995690568246046, 'lambda_val': 0.0006325039773618912, 'batch_size': 1473, 'optimizer': 'RMSprop'}.
2026-07-02 01:41:39,466 - optuna.study.study - INFO - Trial 22 finished with values: [0.0007053786075119351, 0.00017951104610299567, 0.00043395031165652633] and parameters: {'n_layers': 3, 'embedding_dim': 96, 'lr': 0.0001797315454341379, 'lambda_val': 1.8700361803401475e-05, 'batch_size': 2136, 'optimizer': 'RMSprop'}.
2026-07-02 01:46:42,384 - optuna.study.study - INFO - Trial 23 finished with values: [0.0017238472105309947, 0.0003960640541002602, 0.0010583212009897074] and parameters: {'n_layers': 1, 'embedding_dim': 96, 'lr': 0.00042777516068918454, 'lambda_val': 0.00031903142585685315, 'batch_size': 3842, 'optimizer': 'RMSprop'}.
2026-07-02 01:47:23,526 - experiment_functions - INFO - Early stopping at epoch 500. Best Metrics: (0.000534047596069997, 0.0001272723818931292, 0.0003204310476167517)
2026-07-02 01:47:23,629 - optuna.study.study - INFO - Trial 24 finished with values: [0.000534047596069997, 0.0001272723818931292, 0.0003204310476167517] and parameters: {'n_layers': 4, 'embedding_dim': 32, 'lr': 0.09867975451892089, 'lambda_val': 0.006563950737757412, 'batch_size': 1127, 'optimizer': 'Adam'}.
2026-07-02 01:50:24,478 - experiment_functions - INFO - Early stopping at epoch 2450. Best Metrics: (0.0010195192142719736, 0.0003390764204167696, 0.0007157653172035409)
2026-07-02 01:50:24,560 - optuna.study.study - INFO - Trial 25 finished with values: [0.0010195192142719736, 0.0003390764204167696, 0.0007157653172035409] and parameters: {'n_layers': 2, 'embedding_dim': 32, 'lr': 0.0029910676555346106, 'lambda_val': 0.0823868703803942, 'batch_size': 3462, 'optimizer': 'RMSprop'}.
2026-07-02 01:51:11,384 - experiment_functions - INFO - Early stopping at epoch 500. Best Metrics: (0.00018179759793520323, 4.653990084151739e-05, 0.00010217150114192294)
2026-07-02 01:51:11,507 - optuna.study.study - INFO - Trial 26 finished with values: [0.00018179759793520323, 4.653990084151739e-05, 0.00010217150114192294] and parameters: {'n_layers': 4, 'embedding_dim': 128, 'lr': 0.00026087720256833094, 'lambda_val': 0.0009279972649508626, 'batch_size': 2826, 'optimizer': 'SGD'}.
2026-07-02 01:53:30,713 - experiment_functions - INFO - Early stopping at epoch 1700. Best Metrics: (0.0010570978475842737, 0.00037516858841631366, 0.0007726613495499945)
2026-07-02 01:53:30,787 - optuna.study.study - INFO - Trial 27 finished with values: [0.0010570978475842737, 0.00037516858841631366, 0.0007726613495499945] and parameters: {'n_layers': 3, 'embedding_dim': 96, 'lr': 0.05486910650870985, 'lambda_val': 0.008265752694310466, 'batch_size': 2073, 'optimizer': 'Adam'}.
2026-07-02 01:54:14,392 - experiment_functions - INFO - Early stopping at epoch 500. Best Metrics: (0.00019346172398167078, 5.603783978876583e-05, 9.996741373099929e-05)
2026-07-02 01:54:15,166 - optuna.study.study - INFO - Trial 28 finished with values: [0.00019346172398167078, 5.603783978876583e-05, 9.996741373099929e-05] and parameters: {'n_layers': 3, 'embedding_dim': 96, 'lr': 0.00017161375237074726, 'lambda_val': 1.929507855897743e-05, 'batch_size': 1242, 'optimizer': 'SGD'}.
2026-07-02 01:54:56,951 - experiment_functions - INFO - Early stopping at epoch 500. Best Metrics: (0.00019545803306643834, 5.5088045894040994e-05, 0.00012491180182553125)
2026-07-02 01:54:57,068 - optuna.study.study - INFO - Trial 29 finished with values: [0.00019545803306643834, 5.5088045894040994e-05, 0.00012491180182553125] and parameters: {'n_layers': 3, 'embedding_dim': 64, 'lr': 0.03145227990956575, 'lambda_val': 0.0019825165620793797, 'batch_size': 3132, 'optimizer': 'SGD'}.
2026-07-02 02:00:20,508 - optuna.study.study - INFO - Trial 30 finished with values: [0.0008006119066311636, 0.00019850692399749257, 0.000482770453899922] and parameters: {'n_layers': 2, 'embedding_dim': 128, 'lr': 0.0002889968108070523, 'lambda_val': 0.00032528490658824676, 'batch_size': 1928, 'optimizer': 'Adam'}.
2026-07-02 02:02:43,950 - experiment_functions - INFO - Early stopping at epoch 1800. Best Metrics: (0.0010113744261393335, 0.00034477518378511865, 0.0006769939997085631)
2026-07-02 02:02:44,028 - optuna.study.study - INFO - Trial 31 finished with values: [0.0010113744261393335, 0.00034477518378511865, 0.0006769939997085631] and parameters: {'n_layers': 4, 'embedding_dim': 64, 'lr': 0.060296795460340454, 'lambda_val': 0.01679204361251738, 'batch_size': 2092, 'optimizer': 'Adam'}.
2026-07-02 02:03:27,506 - experiment_functions - INFO - Early stopping at epoch 500. Best Metrics: (0.0001924356584624127, 5.888722147294038e-05, 0.00010939566937568705)
2026-07-02 02:03:27,727 - optuna.study.study - INFO - Trial 32 finished with values: [0.0001924356584624127, 5.888722147294038e-05, 0.00010939566937568705] and parameters: {'n_layers': 3, 'embedding_dim': 96, 'lr': 0.08932371766756121, 'lambda_val': 0.05693666840095486, 'batch_size': 1422, 'optimizer': 'SGD'}.
2026-07-02 02:06:03,479 - experiment_functions - INFO - Early stopping at epoch 1950. Best Metrics: (0.0010097621174129478, 0.0003609216799954411, 0.0007183854796269499)
2026-07-02 02:06:03,581 - optuna.study.study - INFO - Trial 33 finished with values: [0.0010097621174129478, 0.0003609216799954411, 0.0007183854796269499] and parameters: {'n_layers': 4, 'embedding_dim': 64, 'lr': 0.03153530615030484, 'lambda_val': 0.016909081027786498, 'batch_size': 1298, 'optimizer': 'Adam'}.
2026-07-02 02:06:46,893 - experiment_functions - INFO - Early stopping at epoch 500. Best Metrics: (0.00024213753923773545, 6.648557263073913e-05, 0.0001379138723809182)
2026-07-02 02:06:47,024 - optuna.study.study - INFO - Trial 34 finished with values: [0.00024213753923773545, 6.648557263073913e-05, 0.0001379138723809182] and parameters: {'n_layers': 3, 'embedding_dim': 96, 'lr': 0.0008372445612620814, 'lambda_val': 0.0009310566593716265, 'batch_size': 3846, 'optimizer': 'SGD'}.
2026-07-02 02:10:23,112 - experiment_functions - INFO - Early stopping at epoch 2200. Best Metrics: (0.00020429037950320562, 5.413825199931615e-05, 0.00010646801142511488)
2026-07-02 02:10:23,190 - optuna.study.study - INFO - Trial 35 finished with values: [0.00020429037950320562, 5.413825199931615e-05, 0.00010646801142511488] and parameters: {'n_layers': 3, 'embedding_dim': 256, 'lr': 1.03728568256777e-05, 'lambda_val': 0.00010191497823375508, 'batch_size': 2099, 'optimizer': 'Adam'}.
2026-07-02 02:11:07,939 - experiment_functions - INFO - Early stopping at epoch 500. Best Metrics: (0.00021447959847889676, 5.888722147294038e-05, 0.00012564689233593112)
