2026-07-01 01:14:47,736 - optuna.study.study - INFO - Trial 71 finished with values: [0.00170968740821997, 0.0005214368482039397, 0.0012487676686440995] and parameters: {'n_layers': 4, 'embedding_dim': 64, 'lr': 0.0033307691236149854, 'lambda_val': 0.00818244172221547, 'batch_size': 2842, 'optimizer': 'RMSprop'}.
2026-07-01 01:16:21,020 - experiment_functions - INFO - Early stopping at epoch 1050. Best Metrics: (0.00019761006989770115, 4.7489694736242234e-05, 0.00010993785730926128)
2026-07-01 01:16:21,091 - optuna.study.study - INFO - Trial 72 finished with values: [0.00019761006989770115, 4.7489694736242234e-05, 0.00010993785730926128] and parameters: {'n_layers': 1, 'embedding_dim': 256, 'lr': 3.015131775439725e-05, 'lambda_val': 4.889129207716808e-06, 'batch_size': 2842, 'optimizer': 'Adam'}.
2026-07-01 01:17:07,561 - experiment_functions - INFO - Early stopping at epoch 550. Best Metrics: (0.0011096678756350796, 0.0002963356951541516, 0.0007383226214275601)
2026-07-01 01:17:07,730 - optuna.study.study - INFO - Trial 73 finished with values: [0.0011096678756350796, 0.0002963356951541516, 0.0007383226214275601] and parameters: {'n_layers': 1, 'embedding_dim': 128, 'lr': 0.04868116684391351, 'lambda_val': 0.00015502261169145315, 'batch_size': 615, 'optimizer': 'RMSprop'}.
2026-07-01 01:18:01,802 - experiment_functions - INFO - Early stopping at epoch 550. Best Metrics: (0.0013130445613466198, 0.0004188591075736565, 0.0009341334485935066)
2026-07-01 01:18:01,880 - optuna.study.study - INFO - Trial 74 finished with values: [0.0013130445613466198, 0.0004188591075736565, 0.0009341334485935066] and parameters: {'n_layers': 2, 'embedding_dim': 256, 'lr': 0.009008716318387032, 'lambda_val': 0.006082431400646874, 'batch_size': 3031, 'optimizer': 'RMSprop'}.
2026-07-01 01:20:04,674 - experiment_functions - INFO - Early stopping at epoch 1450. Best Metrics: (0.0010494425590114845, 0.0003666204433637901, 0.0007369613725897713)
2026-07-01 01:20:04,745 - optuna.study.study - INFO - Trial 75 finished with values: [0.0010494425590114845, 0.0003666204433637901, 0.0007369613725897713] and parameters: {'n_layers': 4, 'embedding_dim': 96, 'lr': 0.02183534419427124, 'lambda_val': 0.004564716452285849, 'batch_size': 1581, 'optimizer': 'RMSprop'}.
2026-07-01 01:24:47,202 - experiment_functions - INFO - Early stopping at epoch 3350. Best Metrics: (0.0029034187432128164, 0.0008035256349372187, 0.0019952427019379734)
2026-07-01 01:24:47,288 - optuna.study.study - INFO - Trial 76 finished with values: [0.0029034187432128164, 0.0008035256349372187, 0.0019952427019379734] and parameters: {'n_layers': 3, 'embedding_dim': 128, 'lr': 0.0010455025017472735, 'lambda_val': 4.9195072317508555e-06, 'batch_size': 1544, 'optimizer': 'RMSprop'}.
2026-07-01 01:29:49,816 - optuna.study.study - INFO - Trial 77 finished with values: [0.00022705316595297904, 5.888722147294038e-05, 0.00011299249219946473] and parameters: {'n_layers': 2, 'embedding_dim': 64, 'lr': 4.8919580655916446e-05, 'lambda_val': 9.61150219103321e-05, 'batch_size': 2522, 'optimizer': 'RMSprop'}.
2026-07-01 01:31:31,137 - experiment_functions - INFO - Early stopping at epoch 1250. Best Metrics: (0.001225219975413381, 0.00041980890146838136, 0.0008694276637533275)
2026-07-01 01:31:31,236 - optuna.study.study - INFO - Trial 78 finished with values: [0.001225219975413381, 0.00041980890146838136, 0.0008694276637533275] and parameters: {'n_layers': 2, 'embedding_dim': 96, 'lr': 0.007281442021246473, 'lambda_val': 0.03852293779947387, 'batch_size': 3927, 'optimizer': 'RMSprop'}.
2026-07-01 01:32:13,576 - experiment_functions - INFO - Early stopping at epoch 500. Best Metrics: (0.0001588874965556028, 4.274072526261801e-05, 8.042096488423897e-05)
2026-07-01 01:32:13,662 - optuna.study.study - INFO - Trial 79 finished with values: [0.0001588874965556028, 4.274072526261801e-05, 8.042096488423897e-05] and parameters: {'n_layers': 2, 'embedding_dim': 96, 'lr': 0.0002959388978333034, 'lambda_val': 0.002718086981783345, 'batch_size': 3342, 'optimizer': 'SGD'}.
2026-07-01 01:37:13,647 - optuna.study.study - INFO - Trial 80 finished with values: [0.0002306172343211899, 7.788309936743727e-05, 0.00015992326474333014] and parameters: {'n_layers': 4, 'embedding_dim': 32, 'lr': 7.806013351746004e-05, 'lambda_val': 4.134172720235837e-06, 'batch_size': 3537, 'optimizer': 'RMSprop'}.
2026-07-01 01:38:05,048 - experiment_functions - INFO - Early stopping at epoch 550. Best Metrics: (0.0011604681939157092, 0.00031913074862754785, 0.000825255853118841)
2026-07-01 01:38:05,139 - optuna.study.study - INFO - Trial 81 finished with values: [0.0011604681939157092, 0.00031913074862754785, 0.000825255853118841] and parameters: {'n_layers': 1, 'embedding_dim': 256, 'lr': 0.04868116684391351, 'lambda_val': 4.186926040366856e-06, 'batch_size': 1807, 'optimizer': 'Adam'}.
2026-07-01 01:38:49,710 - experiment_functions - INFO - Early stopping at epoch 500. Best Metrics: (0.00020910056648647433, 4.938928252569193e-05, 0.00011751000889375706)
2026-07-01 01:38:49,798 - optuna.study.study - INFO - Trial 82 finished with values: [0.00020910056648647433, 4.938928252569193e-05, 0.00011751000889375706] and parameters: {'n_layers': 4, 'embedding_dim': 96, 'lr': 0.019417272401911833, 'lambda_val': 0.026598606887552556, 'batch_size': 1771, 'optimizer': 'SGD'}.
2026-07-01 01:40:51,008 - experiment_functions - INFO - Early stopping at epoch 1400. Best Metrics: (0.0023310405356628057, 0.0006582071690443173, 0.0015883884308627461)
2026-07-01 01:40:51,093 - optuna.study.study - INFO - Trial 83 finished with values: [0.0023310405356628057, 0.0006582071690443173, 0.0015883884308627461] and parameters: {'n_layers': 3, 'embedding_dim': 128, 'lr': 0.0027303142774942266, 'lambda_val': 4.889129207716808e-06, 'batch_size': 3022, 'optimizer': 'Adam'}.
2026-07-01 01:46:23,810 - optuna.study.study - INFO - Trial 84 finished with values: [0.00227272296954071, 0.0006154664437816995, 0.0015727401881687096] and parameters: {'n_layers': 4, 'embedding_dim': 96, 'lr': 0.00039452895313047835, 'lambda_val': 0.00022111146363119937, 'batch_size': 2475, 'optimizer': 'RMSprop'}.
2026-07-01 01:47:12,466 - experiment_functions - INFO - Early stopping at epoch 500. Best Metrics: (0.00022135202196019467, 5.983701536766521e-05, 0.00011982583621522623)
2026-07-01 01:47:12,549 - optuna.study.study - INFO - Trial 85 finished with values: [0.00022135202196019467, 5.983701536766521e-05, 0.00011982583621522623] and parameters: {'n_layers': 2, 'embedding_dim': 256, 'lr': 9.429754131927594e-05, 'lambda_val': 0.010824502265804115, 'batch_size': 3660, 'optimizer': 'SGD'}.
2026-07-01 01:48:35,129 - experiment_functions - INFO - Early stopping at epoch 950. Best Metrics: (0.0023984453481707213, 0.00067245407746519, 0.0015853977502636187)
2026-07-01 01:48:35,215 - optuna.study.study - INFO - Trial 86 finished with values: [0.0023984453481707213, 0.00067245407746519, 0.0015853977502636187] and parameters: {'n_layers': 4, 'embedding_dim': 96, 'lr': 0.0038652724378170286, 'lambda_val': 8.770885111981227e-06, 'batch_size': 1265, 'optimizer': 'Adam'}.
2026-07-01 01:50:43,281 - experiment_functions - INFO - Early stopping at epoch 1550. Best Metrics: (0.002610763153233191, 0.0007379898562012042, 0.0017882901805827537)
2026-07-01 01:50:43,366 - optuna.study.study - INFO - Trial 87 finished with values: [0.002610763153233191, 0.0007379898562012042, 0.0017882901805827537] and parameters: {'n_layers': 3, 'embedding_dim': 96, 'lr': 0.0016405237668077803, 'lambda_val': 1.3421969689673777e-05, 'batch_size': 2839, 'optimizer': 'RMSprop'}.
2026-07-01 01:51:47,909 - experiment_functions - INFO - Early stopping at epoch 750. Best Metrics: (0.0019270913046182479, 0.0005404327260984367, 0.0013103437261970134)
2026-07-01 01:51:48,054 - optuna.study.study - INFO - Trial 88 finished with values: [0.0019270913046182479, 0.0005404327260984367, 0.0013103437261970134] and parameters: {'n_layers': 3, 'embedding_dim': 96, 'lr': 0.004158289986890814, 'lambda_val': 0.002718086981783345, 'batch_size': 3295, 'optimizer': 'Adam'}.
2026-07-01 01:56:58,775 - optuna.study.study - INFO - Trial 89 finished with values: [0.0021965408342282562, 0.0005242862298881143, 0.001418749155796288] and parameters: {'n_layers': 1, 'embedding_dim': 128, 'lr': 0.0010455025017472735, 'lambda_val': 4.9195072317508555e-06, 'batch_size': 840, 'optimizer': 'RMSprop'}.
2026-07-01 02:01:08,531 - experiment_functions - INFO - Early stopping at epoch 2700. Best Metrics: (0.0015378258811644078, 0.00049009364967802, 0.0010593350072600637)
2026-07-01 02:01:08,618 - optuna.study.study - INFO - Trial 90 finished with values: [0.0015378258811644078, 0.00049009364967802, 0.0010593350072600637] and parameters: {'n_layers': 2, 'embedding_dim': 256, 'lr': 0.0006773858234142329, 'lambda_val': 0.019235096524352614, 'batch_size': 3237, 'optimizer': 'Adam'}.
2026-07-01 02:02:44,116 - experiment_functions - INFO - Early stopping at epoch 1200. Best Metrics: (0.0013507246617022331, 0.00042930684041562984, 0.0009685710983797925)
2026-07-01 02:02:44,194 - optuna.study.study - INFO - Trial 91 finished with values: [0.0013507246617022331, 0.00042930684041562984, 0.0009685710983797925] and parameters: {'n_layers': 3, 'embedding_dim': 64, 'lr': 0.001557510643925403, 'lambda_val': 0.02562701842876702, 'batch_size': 977, 'optimizer': 'RMSprop'}.
2026-07-01 02:07:58,808 - optuna.study.study - INFO - Trial 92 finished with values: [0.0017410646237958057, 0.0004426039549417776, 0.0011649570634703588] and parameters: {'n_layers': 2, 'embedding_dim': 96, 'lr': 0.0006773858234142329, 'lambda_val': 0.0007130096093807206, 'batch_size': 1318, 'optimizer': 'Adam'}.
2026-07-01 02:10:05,443 - experiment_functions - INFO - Early stopping at epoch 1600. Best Metrics: (0.002663831320026641, 0.0007265923294645063, 0.0017985740570018271)
2026-07-01 02:10:05,519 - optuna.study.study - INFO - Trial 93 finished with values: [0.002663831320026641, 0.0007265923294645063, 0.0017985740570018271] and parameters: {'n_layers': 3, 'embedding_dim': 64, 'lr': 0.001557510643925403, 'lambda_val': 1.9470910869906704e-05, 'batch_size': 3344, 'optimizer': 'RMSprop'}.
2026-07-01 02:11:22,957 - experiment_functions - INFO - Early stopping at epoch 750. Best Metrics: (0.0016164049857388682, 0.0004805957107307715, 0.0010956182198397341)
2026-07-01 02:11:23,046 - optuna.study.study - INFO - Trial 94 finished with values: [0.0016164049857388682, 0.0004805957107307715, 0.0010956182198397341] and parameters: {'n_layers': 3, 'embedding_dim': 256, 'lr': 0.0017202674480021566, 'lambda_val': 0.014202196015128657, 'batch_size': 3304, 'optimizer': 'Adam'}.
2026-07-01 02:13:43,316 - experiment_functions - INFO - Early stopping at epoch 1650. Best Metrics: (0.0025521952544076128, 0.0007132952149383584, 0.001703011133866721)
2026-07-01 02:13:43,393 - optuna.study.study - INFO - Trial 95 finished with values: [0.0025521952544076128, 0.0007132952149383584, 0.001703011133866721] and parameters: {'n_layers': 4, 'embedding_dim': 96, 'lr': 0.001557510643925403, 'lambda_val': 0.00011682518010112995, 'batch_size': 3005, 'optimizer': 'Adam'}.
2026-07-01 02:16:37,169 - experiment_functions - INFO - Early stopping at epoch 2250. Best Metrics: (0.001311139132056494, 0.00043215622209980437, 0.0009408026004000265)
2026-07-01 02:16:37,253 - optuna.study.study - INFO - Trial 96 finished with values: [0.001311139132056494, 0.00043215622209980437, 0.0009408026004000265] and parameters: {'n_layers': 1, 'embedding_dim': 96, 'lr': 0.015373486122751166, 'lambda_val': 0.002718086981783345, 'batch_size': 3295, 'optimizer': 'Adam'}.
2026-07-01 02:22:01,244 - optuna.study.study - INFO - Trial 97 finished with values: [0.0020400545317912615, 0.0005594286039929336, 0.0014462387447400696] and parameters: {'n_layers': 3, 'embedding_dim': 96, 'lr': 0.0006152603091001123, 'lambda_val': 0.0045975674207156415, 'batch_size': 1425, 'optimizer': 'Adam'}.
2026-07-01 02:25:41,933 - experiment_functions - INFO - Early stopping at epoch 2900. Best Metrics: (0.0003971075260349173, 0.00010732671010390747, 0.0002486592398261817)
2026-07-01 02:25:42,075 - optuna.study.study - INFO - Trial 98 finished with values: [0.0003971075260349173, 0.00010732671010390747, 0.0002486592398261817] and parameters: {'n_layers': 2, 'embedding_dim': 64, 'lr': 0.00012424307540990912, 'lambda_val': 0.0007914071498367372, 'batch_size': 3342, 'optimizer': 'RMSprop'}.
2026-07-01 02:30:58,545 - optuna.study.study - INFO - Trial 99 finished with values: [0.001977728442990811, 0.0005271356115722889, 0.0013451964977864177] and parameters: {'n_layers': 4, 'embedding_dim': 64, 'lr': 0.00039452895313047835, 'lambda_val': 0.003195386254489329, 'batch_size': 2607, 'optimizer': 'RMSprop'}.
2026-07-01 02:33:05,450 - experiment_functions - INFO - Early stopping at epoch 1650. Best Metrics: (0.0025383519589262473, 0.0006810022225177136, 0.0016500403293630889)
2026-07-01 02:33:05,536 - optuna.study.study - INFO - Trial 100 finished with values: [0.0025383519589262473, 0.0006810022225177136, 0.0016500403293630889] and parameters: {'n_layers': 4, 'embedding_dim': 32, 'lr': 0.001557510643925403, 'lambda_val': 1.9470910869906704e-05, 'batch_size': 3344, 'optimizer': 'RMSprop'}.
2026-07-01 02:34:45,853 - experiment_functions - INFO - Early stopping at epoch 1150. Best Metrics: (0.001456086648948367, 0.00045685086336265027, 0.0010084213936482065)
2026-07-01 02:34:45,933 - optuna.study.study - INFO - Trial 101 finished with values: [0.001456086648948367, 0.00045685086336265027, 0.0010084213936482065] and parameters: {'n_layers': 3, 'embedding_dim': 128, 'lr': 0.001557510643925403, 'lambda_val': 0.04136673525744197, 'batch_size': 3022, 'optimizer': 'Adam'}.
2026-07-01 02:35:38,242 - experiment_functions - INFO - Early stopping at epoch 600. Best Metrics: (0.001353495904506, 0.00042360807704728073, 0.0009652182006149757)
2026-07-01 02:35:38,341 - optuna.study.study - INFO - Trial 102 finished with values: [0.001353495904506, 0.00042360807704728073, 0.0009652182006149757] and parameters: {'n_layers': 3, 'embedding_dim': 96, 'lr': 0.004158289986890814, 'lambda_val': 0.015974024397581003, 'batch_size': 3295, 'optimizer': 'RMSprop'}.
2026-07-01 02:41:11,889 - optuna.study.study - INFO - Trial 103 finished with values: [0.0023922683905379266, 0.0006980985126227608, 0.0017251967478320788] and parameters: {'n_layers': 4, 'embedding_dim': 96, 'lr': 0.00039452895313047835, 'lambda_val': 0.003195386254489329, 'batch_size': 2475, 'optimizer': 'RMSprop'}.
2026-07-01 02:42:01,164 - experiment_functions - INFO - Early stopping at epoch 550. Best Metrics: (0.0015753349343908911, 0.00048534468020439565, 0.001134787232471478)
2026-07-01 02:42:01,256 - optuna.study.study - INFO - Trial 104 finished with values: [0.0015753349343908911, 0.00048534468020439565, 0.001134787232471478] and parameters: {'n_layers': 4, 'embedding_dim': 96, 'lr': 0.027207137179041257, 'lambda_val': 0.00011682518010112995, 'batch_size': 3005, 'optimizer': 'RMSprop'}.
2026-07-01 02:42:50,438 - experiment_functions - INFO - Early stopping at epoch 550. Best Metrics: (0.0014095358971891278, 0.00044355374883650253, 0.0009771785651786428)
2026-07-01 02:42:50,608 - optuna.study.study - INFO - Trial 105 finished with values: [0.0014095358971891278, 0.00044355374883650253, 0.0009771785651786428] and parameters: {'n_layers': 4, 'embedding_dim': 96, 'lr': 0.009008716318387032, 'lambda_val': 0.006082431400646874, 'batch_size': 3031, 'optimizer': 'RMSprop'}.
2026-07-01 02:44:28,339 - experiment_functions - INFO - Early stopping at epoch 1250. Best Metrics: (0.0016080522695553043, 0.00043120642820507947, 0.0011612045949552742)
2026-07-01 02:44:28,434 - optuna.study.study - INFO - Trial 106 finished with values: [0.0016080522695553043, 0.00043120642820507947, 0.0011612045949552742] and parameters: {'n_layers': 1, 'embedding_dim': 96, 'lr': 0.007281442021246473, 'lambda_val': 8.770885111981227e-06, 'batch_size': 1265, 'optimizer': 'RMSprop'}.
2026-07-01 02:49:58,895 - experiment_functions - INFO - Early stopping at epoch 3800. Best Metrics: (0.0005554239968200917, 0.00014721805368235092, 0.0003554087181796082)
2026-07-01 02:49:58,985 - optuna.study.study - INFO - Trial 107 finished with values: [0.0005554239968200917, 0.00014721805368235092, 0.0003554087181796082] and parameters: {'n_layers': 4, 'embedding_dim': 128, 'lr': 0.0001670950514503419, 'lambda_val': 4.134172720235837e-06, 'batch_size': 1581, 'optimizer': 'RMSprop'}.
2026-07-01 02:54:27,255 - experiment_functions - INFO - Early stopping at epoch 2550. Best Metrics: (0.002471180080481318, 0.0007028474820963852, 0.0016210597516267055)
2026-07-01 02:54:27,348 - optuna.study.study - INFO - Trial 108 finished with values: [0.002471180080481318, 0.0007028474820963852, 0.0016210597516267055] and parameters: {'n_layers': 4, 'embedding_dim': 256, 'lr': 0.0006773858234142329, 'lambda_val': 0.00022467171684366154, 'batch_size': 3304, 'optimizer': 'Adam'}.
2026-07-01 02:55:57,352 - experiment_functions - INFO - Early stopping at epoch 1100. Best Metrics: (0.001183581659581381, 0.00039606405410026025, 0.0008659453460187817)
2026-07-01 02:55:57,420 - optuna.study.study - INFO - Trial 109 finished with values: [0.001183581659581381, 0.00039606405410026025, 0.0008659453460187817] and parameters: {'n_layers': 4, 'embedding_dim': 64, 'lr': 0.0011423999744800083, 'lambda_val': 0.09750461641032457, 'batch_size': 3927, 'optimizer': 'RMSprop'}.
2026-07-01 03:01:32,457 - optuna.study.study - INFO - Trial 110 finished with values: [0.0025849571255364768, 0.0007417890317801038, 0.0017313600736021245] and parameters: {'n_layers': 4, 'embedding_dim': 96, 'lr': 0.0006152603091001123, 'lambda_val': 1.9470910869906704e-05, 'batch_size': 3344, 'optimizer': 'Adam'}.
2026-07-01 03:06:42,947 - optuna.study.study - INFO - Trial 111 finished with values: [0.0007080103343193705, 0.00016336454989267332, 0.00043004941205198406] and parameters: {'n_layers': 3, 'embedding_dim': 64, 'lr': 0.00015332846912304729, 'lambda_val': 1.9470910869906704e-05, 'batch_size': 3344, 'optimizer': 'RMSprop'}.
2026-07-01 03:09:16,021 - experiment_functions - INFO - Early stopping at epoch 1950. Best Metrics: (0.002563616221500233, 0.0006591569629390425, 0.0017174182543349607)
2026-07-01 03:09:16,108 - optuna.study.study - INFO - Trial 112 finished with values: [0.002563616221500233, 0.0006591569629390425, 0.0017174182543349607] and parameters: {'n_layers': 3, 'embedding_dim': 64, 'lr': 0.0010455025017472735, 'lambda_val': 0.0005862379393176599, 'batch_size': 1544, 'optimizer': 'RMSprop'}.
2026-07-01 03:10:10,471 - experiment_functions - INFO - Early stopping at epoch 550. Best Metrics: (0.0013202035650745868, 0.00042265828315255594, 0.0009313871059441909)
2026-07-01 03:10:10,767 - optuna.study.study - INFO - Trial 113 finished with values: [0.0013202035650745868, 0.00042265828315255594, 0.0009313871059441909] and parameters: {'n_layers': 2, 'embedding_dim': 256, 'lr': 0.009008716318387032, 'lambda_val': 0.006082431400646874, 'batch_size': 3031, 'optimizer': 'RMSprop'}.
2026-07-01 03:16:17,925 - optuna.study.study - INFO - Trial 114 finished with values: [0.001668803923889284, 0.00045780065725737517, 0.0011683903720019566] and parameters: {'n_layers': 2, 'embedding_dim': 256, 'lr': 0.0006152603091001123, 'lambda_val': 0.00011682518010112995, 'batch_size': 1425, 'optimizer': 'Adam'}.
2026-07-01 03:21:22,956 - optuna.study.study - INFO - Trial 115 finished with values: [0.00115676958651152, 0.000330528275364246, 0.000841214378656906] and parameters: {'n_layers': 1, 'embedding_dim': 96, 'lr': 0.0010455025017472735, 'lambda_val': 0.01702128987746691, 'batch_size': 3187, 'optimizer': 'Adam'}.
2026-07-01 03:22:17,105 - experiment_functions - INFO - Early stopping at epoch 600. Best Metrics: (0.0012518331915777462, 0.00034572497767984355, 0.0009323854886408792)
2026-07-01 03:22:17,180 - optuna.study.study - INFO - Trial 116 finished with values: [0.0012518331915777462, 0.00034572497767984355, 0.0009323854886408792] and parameters: {'n_layers': 3, 'embedding_dim': 128, 'lr': 0.06928801192246781, 'lambda_val': 4.9195072317508555e-06, 'batch_size': 3927, 'optimizer': 'RMSprop'}.
2026-07-01 03:24:53,585 - experiment_functions - INFO - Early stopping at epoch 1900. Best Metrics: (0.0022450956377516405, 0.0006401610850445454, 0.0015514721220342322)
2026-07-01 03:24:53,652 - optuna.study.study - INFO - Trial 117 finished with values: [0.0022450956377516405, 0.0006401610850445454, 0.0015514721220342322] and parameters: {'n_layers': 3, 'embedding_dim': 96, 'lr': 0.0016405237668077803, 'lambda_val': 1.3421969689673777e-05, 'batch_size': 3005, 'optimizer': 'Adam'}.
2026-07-01 03:25:44,722 - experiment_functions - INFO - Early stopping at epoch 600. Best Metrics: (0.0017695752920187746, 0.0005204870543092149, 0.001154472780613909)
2026-07-01 03:25:44,813 - optuna.study.study - INFO - Trial 118 finished with values: [0.0017695752920187746, 0.0005204870543092149, 0.001154472780613909] and parameters: {'n_layers': 4, 'embedding_dim': 64, 'lr': 0.0033307691236149854, 'lambda_val': 0.00818244172221547, 'batch_size': 1280, 'optimizer': 'RMSprop'}.
2026-07-01 03:30:59,438 - optuna.study.study - INFO - Trial 119 finished with values: [0.0013617378175963446, 0.0003409760082062193, 0.0008740016928130875] and parameters: {'n_layers': 2, 'embedding_dim': 96, 'lr': 0.00039452895313047835, 'lambda_val': 4.186926040366856e-06, 'batch_size': 3005, 'optimizer': 'Adam'}.
2026-07-01 03:32:56,296 - experiment_functions - INFO - Early stopping at epoch 1350. Best Metrics: (0.002501403429695243, 0.0007427388256748286, 0.001682979357159413)
