2026-07-06 14:19:32,302 - optuna.study.study - INFO - Trial 53 finished with values: [0.014032711751064169, 0.0032036548069069013, 0.008087815141356371] and parameters: {'n_layers': 2, 'embedding_dim': 32, 'lr': 0.004800543051042116, 'lambda_val': 3.765712134740546e-05, 'batch_size': 3112, 'optimizer': 'RMSprop'}.
2026-07-06 14:20:14,019 - experiment_functions - INFO - Early stopping at epoch 500. Best Metrics: (0.0002556697157709357, 5.413825199931616e-05, 0.00012559512134757638)
2026-07-06 14:20:14,101 - optuna.study.study - INFO - Trial 54 finished with values: [0.0002556697157709357, 5.413825199931616e-05, 0.00012559512134757638] and parameters: {'n_layers': 1, 'embedding_dim': 64, 'lr': 1.0005419701698253e-05, 'lambda_val': 0.006606419176859235, 'batch_size': 2134, 'optimizer': 'RMSprop'}.
2026-07-06 14:26:24,669 - optuna.study.study - INFO - Trial 55 finished with values: [0.009054425459946402, 0.002031609140816443, 0.005300548751368088] and parameters: {'n_layers': 4, 'embedding_dim': 96, 'lr': 0.022292730801283123, 'lambda_val': 3.2526061508437436e-06, 'batch_size': 2061, 'optimizer': 'Adam'}.
2026-07-06 14:27:14,106 - experiment_functions - INFO - Early stopping at epoch 550. Best Metrics: (0.00318162572780459, 0.0007873791387268963, 0.002023539252565323)
2026-07-06 14:27:14,198 - optuna.study.study - INFO - Trial 56 finished with values: [0.00318162572780459, 0.0007873791387268963, 0.002023539252565323] and parameters: {'n_layers': 2, 'embedding_dim': 96, 'lr': 0.05503475124833015, 'lambda_val': 1.4112370474419454e-05, 'batch_size': 3729, 'optimizer': 'RMSprop'}.
2026-07-06 14:28:59,203 - experiment_functions - INFO - Early stopping at epoch 1250. Best Metrics: (0.00019002890396677973, 5.603783978876584e-05, 0.00010496587689503817)
2026-07-06 14:28:59,281 - optuna.study.study - INFO - Trial 57 finished with values: [0.00019002890396677973, 5.603783978876584e-05, 0.00010496587689503817] and parameters: {'n_layers': 1, 'embedding_dim': 128, 'lr': 8.484022484750847e-05, 'lambda_val': 4.230259051937931e-06, 'batch_size': 4072, 'optimizer': 'Adam'}.
2026-07-06 14:30:11,992 - experiment_functions - INFO - Early stopping at epoch 550. Best Metrics: (0.009180209599813935, 0.0021579317288148475, 0.0055359733498191194)
2026-07-06 14:30:12,079 - optuna.study.study - INFO - Trial 58 finished with values: [0.009180209599813935, 0.0021579317288148475, 0.0055359733498191194] and parameters: {'n_layers': 4, 'embedding_dim': 256, 'lr': 0.019829977892525583, 'lambda_val': 8.354147532190842e-06, 'batch_size': 1513, 'optimizer': 'Adam'}.
2026-07-06 14:31:10,388 - experiment_functions - INFO - Early stopping at epoch 550. Best Metrics: (0.0076396797062851735, 0.0018388009801872994, 0.004581425502012881)
2026-07-06 14:31:10,465 - optuna.study.study - INFO - Trial 59 finished with values: [0.0076396797062851735, 0.0018388009801872994, 0.004581425502012881] and parameters: {'n_layers': 4, 'embedding_dim': 128, 'lr': 0.024621994148519108, 'lambda_val': 5.734344867778707e-06, 'batch_size': 906, 'optimizer': 'Adam'}.
2026-07-06 14:31:52,477 - experiment_functions - INFO - Early stopping at epoch 500. Best Metrics: (0.0001916947009212437, 5.033907642041677e-05, 0.00011323728335820276)
2026-07-06 14:31:52,546 - optuna.study.study - INFO - Trial 60 finished with values: [0.0001916947009212437, 5.033907642041677e-05, 0.00011323728335820276] and parameters: {'n_layers': 1, 'embedding_dim': 64, 'lr': 0.00022033581734668916, 'lambda_val': 2.8062317756791392e-06, 'batch_size': 977, 'optimizer': 'SGD'}.
2026-07-06 14:38:07,598 - optuna.study.study - INFO - Trial 61 finished with values: [0.016521916049361964, 0.0035797731892179404, 0.009697201549021275] and parameters: {'n_layers': 1, 'embedding_dim': 256, 'lr': 0.011688810705771883, 'lambda_val': 5.753755422314766e-05, 'batch_size': 3159, 'optimizer': 'Adam'}.
2026-07-06 14:39:01,889 - experiment_functions - INFO - Early stopping at epoch 550. Best Metrics: (0.0020567887019304395, 0.0006563075812548677, 0.0014082126004671856)
2026-07-06 14:39:01,969 - optuna.study.study - INFO - Trial 62 finished with values: [0.0020567887019304395, 0.0006563075812548677, 0.0014082126004671856] and parameters: {'n_layers': 1, 'embedding_dim': 256, 'lr': 0.021220223601806684, 'lambda_val': 0.06343578078779324, 'batch_size': 1381, 'optimizer': 'Adam'}.
2026-07-06 14:39:47,768 - experiment_functions - INFO - Early stopping at epoch 550. Best Metrics: (0.00018333122752677434, 4.843948863096707e-05, 9.850023403575286e-05)
2026-07-06 14:39:47,850 - optuna.study.study - INFO - Trial 63 finished with values: [0.00018333122752677434, 4.843948863096707e-05, 9.850023403575286e-05] and parameters: {'n_layers': 1, 'embedding_dim': 64, 'lr': 1.1757724916138184e-05, 'lambda_val': 0.0011436125128021309, 'batch_size': 1735, 'optimizer': 'RMSprop'}.
2026-07-06 14:46:03,577 - optuna.study.study - INFO - Trial 64 finished with values: [0.015460659276409225, 0.003467697509640409, 0.008839672514819995] and parameters: {'n_layers': 3, 'embedding_dim': 128, 'lr': 0.0010707349549773082, 'lambda_val': 1.3821671642527758e-06, 'batch_size': 2134, 'optimizer': 'RMSprop'}.
2026-07-06 14:47:03,702 - experiment_functions - INFO - Early stopping at epoch 650. Best Metrics: (0.00022363283938986377, 6.078680926239006e-05, 0.00014618456191056454)
2026-07-06 14:47:03,787 - optuna.study.study - INFO - Trial 65 finished with values: [0.00022363283938986377, 6.078680926239006e-05, 0.00014618456191056454] and parameters: {'n_layers': 3, 'embedding_dim': 96, 'lr': 1.5046305492285578e-05, 'lambda_val': 0.008708552292021214, 'batch_size': 847, 'optimizer': 'RMSprop'}.
2026-07-06 14:48:00,074 - experiment_functions - INFO - Early stopping at epoch 600. Best Metrics: (0.00028962772130688486, 6.648557263073913e-05, 0.00017598118612081317)
2026-07-06 14:48:00,160 - optuna.study.study - INFO - Trial 66 finished with values: [0.00028962772130688486, 6.648557263073913e-05, 0.00017598118612081317] and parameters: {'n_layers': 2, 'embedding_dim': 128, 'lr': 1.2104113466827545e-05, 'lambda_val': 5.6940479106759095e-05, 'batch_size': 3929, 'optimizer': 'Adam'}.
2026-07-06 14:49:12,072 - experiment_functions - INFO - Early stopping at epoch 550. Best Metrics: (0.007786901597227672, 0.0016383944684003572, 0.00482501294532632)
2026-07-06 14:49:12,167 - optuna.study.study - INFO - Trial 67 finished with values: [0.007786901597227672, 0.0016383944684003572, 0.00482501294532632] and parameters: {'n_layers': 4, 'embedding_dim': 256, 'lr': 0.09187492113273477, 'lambda_val': 2.465157645661239e-06, 'batch_size': 1865, 'optimizer': 'RMSprop'}.
2026-07-06 14:49:55,839 - experiment_functions - INFO - Early stopping at epoch 500. Best Metrics: (0.00013861885266984689, 4.4640313052067694e-05, 8.17395311423619e-05)
2026-07-06 14:49:55,925 - optuna.study.study - INFO - Trial 68 finished with values: [0.00013861885266984689, 4.4640313052067694e-05, 8.17395311423619e-05] and parameters: {'n_layers': 1, 'embedding_dim': 128, 'lr': 2.0359166656778783e-05, 'lambda_val': 0.0015291740739542922, 'batch_size': 2771, 'optimizer': 'SGD'}.
2026-07-06 14:50:44,087 - experiment_functions - INFO - Early stopping at epoch 500. Best Metrics: (0.00027399218596921635, 6.36361909465646e-05, 0.00014293133082031245)
2026-07-06 14:50:44,170 - optuna.study.study - INFO - Trial 69 finished with values: [0.00027399218596921635, 6.36361909465646e-05, 0.00014293133082031245] and parameters: {'n_layers': 1, 'embedding_dim': 256, 'lr': 0.009016730047694576, 'lambda_val': 0.047397572073982076, 'batch_size': 3929, 'optimizer': 'SGD'}.
2026-07-06 14:51:56,947 - experiment_functions - INFO - Early stopping at epoch 550. Best Metrics: (0.006873870116311022, 0.0015187204376650267, 0.004069421313932066)
2026-07-06 14:51:57,034 - optuna.study.study - INFO - Trial 70 finished with values: [0.006873870116311022, 0.0015187204376650267, 0.004069421313932066] and parameters: {'n_layers': 4, 'embedding_dim': 256, 'lr': 0.09187492113273477, 'lambda_val': 1.7965641297535496e-06, 'batch_size': 3063, 'optimizer': 'Adam'}.
2026-07-06 14:52:38,556 - experiment_functions - INFO - Early stopping at epoch 500. Best Metrics: (0.000167381388746596, 4.559010694679255e-05, 8.928289035707098e-05)
2026-07-06 14:52:38,657 - optuna.study.study - INFO - Trial 71 finished with values: [0.000167381388746596, 4.559010694679255e-05, 8.928289035707098e-05] and parameters: {'n_layers': 2, 'embedding_dim': 32, 'lr': 0.00022033581734668916, 'lambda_val': 1.7965641297535496e-06, 'batch_size': 1954, 'optimizer': 'SGD'}.
2026-07-06 14:58:23,078 - optuna.study.study - INFO - Trial 72 finished with values: [0.013090986595154576, 0.0028465323024903593, 0.007686370783751206] and parameters: {'n_layers': 4, 'embedding_dim': 64, 'lr': 0.024621994148519108, 'lambda_val': 5.734344867778707e-06, 'batch_size': 906, 'optimizer': 'RMSprop'}.
2026-07-06 15:00:42,370 - experiment_functions - INFO - Early stopping at epoch 1350. Best Metrics: (0.00015835540664660687, 5.603783978876584e-05, 0.00011258996813168684)
2026-07-06 15:00:42,448 - optuna.study.study - INFO - Trial 73 finished with values: [0.00015835540664660687, 5.603783978876584e-05, 0.00011258996813168684] and parameters: {'n_layers': 2, 'embedding_dim': 256, 'lr': 1.5046305492285578e-05, 'lambda_val': 0.0001524835076815608, 'batch_size': 847, 'optimizer': 'RMSprop'}.
2026-07-06 15:09:02,807 - optuna.study.study - INFO - Trial 74 finished with values: [0.011980551570775962, 0.002577740630283229, 0.007053232029132816] and parameters: {'n_layers': 4, 'embedding_dim': 256, 'lr': 0.01677700597951071, 'lambda_val': 1.3710755672555229e-05, 'batch_size': 2026, 'optimizer': 'Adam'}.
2026-07-06 15:10:01,771 - experiment_functions - INFO - Early stopping at epoch 600. Best Metrics: (0.00551796245420095, 0.0014246908420872673, 0.0034663451208662333)
2026-07-06 15:10:01,845 - optuna.study.study - INFO - Trial 75 finished with values: [0.00551796245420095, 0.0014246908420872673, 0.0034663451208662333] and parameters: {'n_layers': 1, 'embedding_dim': 256, 'lr': 0.029415665414537304, 'lambda_val': 2.465157645661239e-06, 'batch_size': 1512, 'optimizer': 'Adam'}.
2026-07-06 15:10:48,008 - experiment_functions - INFO - Early stopping at epoch 550. Best Metrics: (0.0033301251021653844, 0.0009222498717778243, 0.002188882548436973)
2026-07-06 15:10:48,100 - optuna.study.study - INFO - Trial 76 finished with values: [0.0033301251021653844, 0.0009222498717778243, 0.002188882548436973] and parameters: {'n_layers': 1, 'embedding_dim': 64, 'lr': 0.06754974326511395, 'lambda_val': 2.465157645661239e-06, 'batch_size': 691, 'optimizer': 'Adam'}.
2026-07-06 15:11:49,227 - experiment_functions - INFO - Early stopping at epoch 750. Best Metrics: (0.00024788908822502575, 5.603783978876583e-05, 0.00014499497885378689)
2026-07-06 15:11:49,338 - optuna.study.study - INFO - Trial 77 finished with values: [0.00024788908822502575, 5.603783978876583e-05, 0.00014499497885378689] and parameters: {'n_layers': 1, 'embedding_dim': 64, 'lr': 3.2566852347666256e-05, 'lambda_val': 2.5044442098393602e-05, 'batch_size': 1852, 'optimizer': 'Adam'}.
2026-07-06 15:12:38,350 - experiment_functions - INFO - Early stopping at epoch 500. Best Metrics: (0.00022651690843049203, 5.9837015367665226e-05, 0.00012055259555757309)
2026-07-06 15:12:38,425 - optuna.study.study - INFO - Trial 78 finished with values: [0.00022651690843049203, 5.9837015367665226e-05, 0.00012055259555757309] and parameters: {'n_layers': 4, 'embedding_dim': 96, 'lr': 0.06535558135772093, 'lambda_val': 0.03768427241340957, 'batch_size': 3998, 'optimizer': 'SGD'}.
2026-07-06 15:13:21,150 - experiment_functions - INFO - Early stopping at epoch 500. Best Metrics: (0.0001822665462292974, 4.748969473624224e-05, 0.00012706306492126965)
2026-07-06 15:13:21,231 - optuna.study.study - INFO - Trial 79 finished with values: [0.0001822665462292974, 4.748969473624224e-05, 0.00012706306492126965] and parameters: {'n_layers': 1, 'embedding_dim': 96, 'lr': 0.00010248604977855195, 'lambda_val': 5.792174972867366e-05, 'batch_size': 2890, 'optimizer': 'SGD'}.
2026-07-06 15:14:08,400 - experiment_functions - INFO - Early stopping at epoch 500. Best Metrics: (0.00023194451924238462, 6.078680926239006e-05, 0.0001172165283052739)
2026-07-06 15:14:08,487 - optuna.study.study - INFO - Trial 80 finished with values: [0.00023194451924238462, 6.078680926239006e-05, 0.0001172165283052739] and parameters: {'n_layers': 3, 'embedding_dim': 96, 'lr': 0.0004638441828593938, 'lambda_val': 0.014042324704312418, 'batch_size': 881, 'optimizer': 'SGD'}.
2026-07-06 15:16:06,688 - experiment_functions - INFO - Early stopping at epoch 1350. Best Metrics: (0.0009479901032723316, 0.0002972854890488764, 0.0006182706132972214)
2026-07-06 15:16:06,777 - optuna.study.study - INFO - Trial 81 finished with values: [0.0009479901032723316, 0.0002972854890488764, 0.0006182706132972214] and parameters: {'n_layers': 4, 'embedding_dim': 64, 'lr': 0.002656669860795703, 'lambda_val': 0.09344210196306219, 'batch_size': 3807, 'optimizer': 'Adam'}.
2026-07-06 15:16:50,021 - experiment_functions - INFO - Early stopping at epoch 500. Best Metrics: (0.00016519636588594285, 4.46403130520677e-05, 9.146771056290044e-05)
2026-07-06 15:16:50,143 - optuna.study.study - INFO - Trial 82 finished with values: [0.00016519636588594285, 4.46403130520677e-05, 9.146771056290044e-05] and parameters: {'n_layers': 4, 'embedding_dim': 32, 'lr': 0.01677700597951071, 'lambda_val': 0.010866137346376039, 'batch_size': 1500, 'optimizer': 'SGD'}.
2026-07-06 15:18:02,435 - experiment_functions - INFO - Early stopping at epoch 550. Best Metrics: (0.006684948877882634, 0.0014712307429287845, 0.004025884670932586)
2026-07-06 15:18:02,524 - optuna.study.study - INFO - Trial 83 finished with values: [0.006684948877882634, 0.0014712307429287845, 0.004025884670932586] and parameters: {'n_layers': 4, 'embedding_dim': 256, 'lr': 0.09187492113273477, 'lambda_val': 2.465157645661239e-06, 'batch_size': 2026, 'optimizer': 'Adam'}.
2026-07-06 15:19:14,235 - experiment_functions - INFO - Early stopping at epoch 550. Best Metrics: (0.006643707104262925, 0.0016127500332427864, 0.004037564560008566)
2026-07-06 15:19:14,310 - optuna.study.study - INFO - Trial 84 finished with values: [0.006643707104262925, 0.0016127500332427864, 0.004037564560008566] and parameters: {'n_layers': 4, 'embedding_dim': 256, 'lr': 0.007748940378927992, 'lambda_val': 0.010866137346376039, 'batch_size': 550, 'optimizer': 'RMSprop'}.
2026-07-06 15:20:49,069 - experiment_functions - INFO - Early stopping at epoch 1000. Best Metrics: (0.0002950152903967574, 6.268639705183976e-05, 0.00014577109591637434)
2026-07-06 15:20:49,139 - optuna.study.study - INFO - Trial 85 finished with values: [0.0002950152903967574, 6.268639705183976e-05, 0.00014577109591637434] and parameters: {'n_layers': 1, 'embedding_dim': 256, 'lr': 8.484022484750847e-05, 'lambda_val': 1.9085492655342063e-05, 'batch_size': 3063, 'optimizer': 'Adam'}.
2026-07-06 15:25:56,948 - optuna.study.study - INFO - Trial 86 finished with values: [0.004667019886665808, 0.0012214349486161504, 0.002906298439865897] and parameters: {'n_layers': 1, 'embedding_dim': 64, 'lr': 0.0004983510224999149, 'lambda_val': 0.0038206436204871875, 'batch_size': 2771, 'optimizer': 'RMSprop'}.
2026-07-06 15:26:59,702 - experiment_functions - INFO - Early stopping at epoch 600. Best Metrics: (0.0001677562595535001, 5.5088045894041e-05, 0.00010389676539438667)
2026-07-06 15:26:59,812 - optuna.study.study - INFO - Trial 87 finished with values: [0.0001677562595535001, 5.5088045894041e-05, 0.00010389676539438667] and parameters: {'n_layers': 4, 'embedding_dim': 128, 'lr': 8.484022484750847e-05, 'lambda_val': 8.951880820647161e-06, 'batch_size': 1768, 'optimizer': 'Adam'}.
2026-07-06 15:27:42,663 - experiment_functions - INFO - Early stopping at epoch 500. Best Metrics: (0.00029532620305127273, 6.933495431491366e-05, 0.0001529760074556796)
2026-07-06 15:27:42,751 - optuna.study.study - INFO - Trial 88 finished with values: [0.00029532620305127273, 6.933495431491366e-05, 0.0001529760074556796] and parameters: {'n_layers': 1, 'embedding_dim': 96, 'lr': 0.0011255535780813864, 'lambda_val': 0.0005069434409962794, 'batch_size': 1402, 'optimizer': 'SGD'}.
2026-07-06 15:28:23,669 - experiment_functions - INFO - Early stopping at epoch 500. Best Metrics: (0.00025900247341995974, 6.17366031571149e-05, 0.00013947409633559204)
2026-07-06 15:28:23,749 - optuna.study.study - INFO - Trial 89 finished with values: [0.00025900247341995974, 6.17366031571149e-05, 0.00013947409633559204] and parameters: {'n_layers': 1, 'embedding_dim': 32, 'lr': 2.3388226322623013e-05, 'lambda_val': 0.0002496726403665611, 'batch_size': 3073, 'optimizer': 'SGD'}.
2026-07-06 15:29:11,730 - experiment_functions - INFO - Early stopping at epoch 550. Best Metrics: (0.004326849075776651, 0.0010998613300913702, 0.002718781028891)
2026-07-06 15:29:11,822 - optuna.study.study - INFO - Trial 90 finished with values: [0.004326849075776651, 0.0010998613300913702, 0.002718781028891] and parameters: {'n_layers': 2, 'embedding_dim': 64, 'lr': 0.06754974326511395, 'lambda_val': 0.0016349041997802487, 'batch_size': 1500, 'optimizer': 'Adam'}.
2026-07-06 15:29:53,342 - experiment_functions - INFO - Early stopping at epoch 500. Best Metrics: (0.0001714319669241772, 4.8439488630967084e-05, 0.00010722409371868413)
2026-07-06 15:29:53,423 - optuna.study.study - INFO - Trial 91 finished with values: [0.0001714319669241772, 4.8439488630967084e-05, 0.00010722409371868413] and parameters: {'n_layers': 2, 'embedding_dim': 32, 'lr': 0.022292730801283123, 'lambda_val': 1.1272363633063483e-05, 'batch_size': 4077, 'optimizer': 'SGD'}.
2026-07-06 15:35:04,910 - optuna.study.study - INFO - Trial 92 finished with values: [0.011171669693985658, 0.0027942936382804938, 0.006688845745307515] and parameters: {'n_layers': 1, 'embedding_dim': 64, 'lr': 0.0027021927373699207, 'lambda_val': 0.014042324704312418, 'batch_size': 881, 'optimizer': 'Adam'}.
2026-07-06 15:36:23,149 - experiment_functions - INFO - Early stopping at epoch 850. Best Metrics: (0.011739219248092573, 0.002600535683756625, 0.006614325179937606)
2026-07-06 15:36:23,254 - optuna.study.study - INFO - Trial 93 finished with values: [0.011739219248092573, 0.002600535683756625, 0.006614325179937606] and parameters: {'n_layers': 2, 'embedding_dim': 128, 'lr': 0.004800543051042116, 'lambda_val': 0.003235866498706212, 'batch_size': 3654, 'optimizer': 'Adam'}.
2026-07-06 15:37:50,641 - experiment_functions - INFO - Early stopping at epoch 1100. Best Metrics: (0.00020872363102644433, 6.17366031571149e-05, 0.00012393165693985454)
2026-07-06 15:37:50,730 - optuna.study.study - INFO - Trial 94 finished with values: [0.00020872363102644433, 6.17366031571149e-05, 0.00012393165693985454] and parameters: {'n_layers': 1, 'embedding_dim': 64, 'lr': 3.2566852347666256e-05, 'lambda_val': 2.5044442098393602e-05, 'batch_size': 3674, 'optimizer': 'Adam'}.
2026-07-06 15:38:32,499 - experiment_functions - INFO - Early stopping at epoch 500. Best Metrics: (0.00018873891428321468, 5.603783978876584e-05, 0.0001085661182400033)
2026-07-06 15:38:32,574 - optuna.study.study - INFO - Trial 95 finished with values: [0.00018873891428321468, 5.603783978876584e-05, 0.0001085661182400033] and parameters: {'n_layers': 1, 'embedding_dim': 64, 'lr': 0.0004983510224999149, 'lambda_val': 0.0038206436204871875, 'batch_size': 2021, 'optimizer': 'Adam'}.
2026-07-06 15:44:06,110 - optuna.study.study - INFO - Trial 96 finished with values: [0.02095279313905037, 0.004451683984575347, 0.012228125592556269] and parameters: {'n_layers': 1, 'embedding_dim': 128, 'lr': 0.006478106002947754, 'lambda_val': 1.838250716065182e-06, 'batch_size': 3792, 'optimizer': 'RMSprop'}.
2026-07-06 15:45:08,828 - experiment_functions - INFO - Early stopping at epoch 650. Best Metrics: (0.00025278090207114443, 6.078680926239006e-05, 0.0001467436549370866)
2026-07-06 15:45:08,940 - optuna.study.study - INFO - Trial 97 finished with values: [0.00025278090207114443, 6.078680926239006e-05, 0.0001467436549370866] and parameters: {'n_layers': 1, 'embedding_dim': 256, 'lr': 1.0866027176885656e-05, 'lambda_val': 6.085326153419731e-06, 'batch_size': 3159, 'optimizer': 'RMSprop'}.
2026-07-06 15:51:21,590 - optuna.study.study - INFO - Trial 98 finished with values: [0.019898416717192453, 0.004345307068366166, 0.011820318908967488] and parameters: {'n_layers': 1, 'embedding_dim': 256, 'lr': 0.007748940378927992, 'lambda_val': 1.7965641297535496e-06, 'batch_size': 3098, 'optimizer': 'RMSprop'}.
2026-07-06 15:52:08,951 - experiment_functions - INFO - Early stopping at epoch 550. Best Metrics: (0.0019230534172265323, 0.0006154664437816994, 0.0013822227779987906)
2026-07-06 15:52:09,040 - optuna.study.study - INFO - Trial 99 finished with values: [0.0019230534172265323, 0.0006154664437816994, 0.0013822227779987906] and parameters: {'n_layers': 1, 'embedding_dim': 96, 'lr': 0.019829977892525583, 'lambda_val': 0.047397572073982076, 'batch_size': 1513, 'optimizer': 'RMSprop'}.
2026-07-06 15:54:43,478 - experiment_functions - INFO - Early stopping at epoch 1750. Best Metrics: (0.011291602832080349, 0.0024314723704956026, 0.006719489479518884)
2026-07-06 15:54:43,564 - optuna.study.study - INFO - Trial 100 finished with values: [0.011291602832080349, 0.0024314723704956026, 0.006719489479518884] and parameters: {'n_layers': 4, 'embedding_dim': 64, 'lr': 0.024621994148519108, 'lambda_val': 1.7965641297535496e-06, 'batch_size': 2348, 'optimizer': 'RMSprop'}.
2026-07-06 15:55:29,621 - experiment_functions - INFO - Early stopping at epoch 500. Best Metrics: (0.00020978215564360498, 7.313412989381305e-05, 0.00013687309680184202)
