2026-07-06 18:42:12,170 - optuna.study.study - INFO - Trial 152 finished with values: [0.012208424777881947, 0.0027012138365974585, 0.007214203952068655] and parameters: {'n_layers': 3, 'embedding_dim': 256, 'lr': 0.01677700597951071, 'lambda_val': 2.465157645661239e-06, 'batch_size': 2026, 'optimizer': 'Adam'}.
2026-07-06 18:49:06,047 - optuna.study.study - INFO - Trial 153 finished with values: [0.018448749494481168, 0.004011929411317745, 0.011046946631036489] and parameters: {'n_layers': 2, 'embedding_dim': 256, 'lr': 0.011688810705771883, 'lambda_val': 2.465157645661239e-06, 'batch_size': 2101, 'optimizer': 'RMSprop'}.
2026-07-06 18:50:06,137 - experiment_functions - INFO - Early stopping at epoch 550. Best Metrics: (0.008859190807534712, 0.0020705506905001614, 0.005597513888653443)
2026-07-06 18:50:06,252 - optuna.study.study - INFO - Trial 154 finished with values: [0.008859190807534712, 0.0020705506905001614, 0.005597513888653443] and parameters: {'n_layers': 2, 'embedding_dim': 256, 'lr': 0.024621994148519108, 'lambda_val': 1.870375957132669e-06, 'batch_size': 906, 'optimizer': 'RMSprop'}.
2026-07-06 18:56:16,457 - optuna.study.study - INFO - Trial 155 finished with values: [0.0124985915927534, 0.002837034363543111, 0.007511074379456092] and parameters: {'n_layers': 1, 'embedding_dim': 256, 'lr': 0.011688810705771883, 'lambda_val': 2.465157645661239e-06, 'batch_size': 798, 'optimizer': 'Adam'}.
2026-07-06 19:00:48,535 - experiment_functions - INFO - Early stopping at epoch 3150. Best Metrics: (0.008911641211381516, 0.001993617385027449, 0.005069355403301835)
2026-07-06 19:00:49,138 - optuna.study.study - INFO - Trial 156 finished with values: [0.008911641211381516, 0.001993617385027449, 0.005069355403301835] and parameters: {'n_layers': 4, 'embedding_dim': 64, 'lr': 0.019829977892525583, 'lambda_val': 1.9420463734703053e-05, 'batch_size': 2416, 'optimizer': 'Adam'}.
2026-07-06 19:09:06,854 - optuna.study.study - INFO - Trial 157 finished with values: [0.016250613681986034, 0.003471496685219307, 0.009845242435346672] and parameters: {'n_layers': 4, 'embedding_dim': 256, 'lr': 0.01677700597951071, 'lambda_val': 3.765712134740546e-05, 'batch_size': 2026, 'optimizer': 'RMSprop'}.
2026-07-06 19:14:52,355 - optuna.study.study - INFO - Trial 158 finished with values: [0.013074211662717059, 0.002800942195543567, 0.007877068503176647] and parameters: {'n_layers': 4, 'embedding_dim': 64, 'lr': 0.024621994148519108, 'lambda_val': 1.3821671642527758e-06, 'batch_size': 906, 'optimizer': 'RMSprop'}.
2026-07-06 19:15:36,880 - experiment_functions - INFO - Early stopping at epoch 500. Best Metrics: (0.0002234208028636726, 5.888722147294038e-05, 0.00012293090845062017)
2026-07-06 19:15:36,957 - optuna.study.study - INFO - Trial 159 finished with values: [0.0002234208028636726, 5.888722147294038e-05, 0.00012293090845062017] and parameters: {'n_layers': 3, 'embedding_dim': 64, 'lr': 0.00342183193380688, 'lambda_val': 1.9420463734703053e-05, 'batch_size': 2026, 'optimizer': 'SGD'}.
2026-07-06 19:20:47,199 - optuna.study.study - INFO - Trial 160 finished with values: [0.014557089064115066, 0.0031951066618543774, 0.008427758062508936] and parameters: {'n_layers': 2, 'embedding_dim': 32, 'lr': 0.004800543051042116, 'lambda_val': 1.7965641297535496e-06, 'batch_size': 3098, 'optimizer': 'RMSprop'}.
2026-07-06 19:29:05,539 - optuna.study.study - INFO - Trial 161 finished with values: [0.010919677980933264, 0.002733506829018104, 0.006555245758298968] and parameters: {'n_layers': 4, 'embedding_dim': 256, 'lr': 0.00033928390565174827, 'lambda_val': 8.354147532190842e-06, 'batch_size': 1513, 'optimizer': 'Adam'}.
2026-07-06 19:30:12,237 - experiment_functions - INFO - Early stopping at epoch 550. Best Metrics: (0.010369508010849479, 0.002458066599547899, 0.006341996748358502)
2026-07-06 19:30:12,343 - optuna.study.study - INFO - Trial 162 finished with values: [0.010369508010849479, 0.002458066599547899, 0.006341996748358502] and parameters: {'n_layers': 3, 'embedding_dim': 256, 'lr': 0.01677700597951071, 'lambda_val': 1.3821671642527758e-06, 'batch_size': 1500, 'optimizer': 'Adam'}.
2026-07-06 19:34:15,012 - experiment_functions - INFO - Early stopping at epoch 2600. Best Metrics: (0.011806052086620424, 0.002519803202705013, 0.007176251648564728)
2026-07-06 19:34:15,102 - optuna.study.study - INFO - Trial 163 finished with values: [0.011806052086620424, 0.002519803202705013, 0.007176251648564728] and parameters: {'n_layers': 4, 'embedding_dim': 96, 'lr': 0.024621994148519108, 'lambda_val': 5.734344867778707e-06, 'batch_size': 3098, 'optimizer': 'RMSprop'}.
2026-07-06 19:37:40,560 - experiment_functions - INFO - Early stopping at epoch 2500. Best Metrics: (0.017941404812063445, 0.0038989039378454875, 0.01040100792461853)
2026-07-06 19:37:40,642 - optuna.study.study - INFO - Trial 164 finished with values: [0.017941404812063445, 0.0038989039378454875, 0.01040100792461853] and parameters: {'n_layers': 2, 'embedding_dim': 64, 'lr': 0.0027021927373699207, 'lambda_val': 0.0006130975118365463, 'batch_size': 2416, 'optimizer': 'Adam'}.
2026-07-06 19:43:46,904 - optuna.study.study - INFO - Trial 165 finished with values: [0.006825212951161224, 0.0017390726212411906, 0.004233235064220113] and parameters: {'n_layers': 1, 'embedding_dim': 256, 'lr': 0.019829977892525583, 'lambda_val': 8.354147532190842e-06, 'batch_size': 3792, 'optimizer': 'RMSprop'}.
2026-07-06 19:50:05,078 - optuna.study.study - INFO - Trial 166 finished with values: [0.025853925889718563, 0.005483160154246528, 0.015333929083864157] and parameters: {'n_layers': 1, 'embedding_dim': 256, 'lr': 0.003261445844811169, 'lambda_val': 2.465157645661239e-06, 'batch_size': 3792, 'optimizer': 'Adam'}.
2026-07-06 19:53:46,553 - experiment_functions - INFO - Early stopping at epoch 2850. Best Metrics: (0.024091670149985644, 0.005248561062249492, 0.014134914529320908)
2026-07-06 19:53:46,640 - optuna.study.study - INFO - Trial 167 finished with values: [0.024091670149985644, 0.005248561062249492, 0.014134914529320908] and parameters: {'n_layers': 1, 'embedding_dim': 32, 'lr': 0.004800543051042116, 'lambda_val': 1.838250716065182e-06, 'batch_size': 3112, 'optimizer': 'Adam'}.
2026-07-06 19:55:41,670 - experiment_functions - INFO - Early stopping at epoch 1000. Best Metrics: (0.00021754832243330418, 5.603783978876583e-05, 0.00012973009548262159)
2026-07-06 19:55:41,746 - optuna.study.study - INFO - Trial 168 finished with values: [0.00021754832243330418, 5.603783978876583e-05, 0.00012973009548262159] and parameters: {'n_layers': 3, 'embedding_dim': 256, 'lr': 5.361507190290062e-05, 'lambda_val': 0.0004346590855846191, 'batch_size': 1513, 'optimizer': 'RMSprop'}.
2026-07-06 19:56:49,042 - experiment_functions - INFO - Early stopping at epoch 700. Best Metrics: (0.00020597936312231026, 5.413825199931615e-05, 0.00011981731974543021)
2026-07-06 19:56:49,124 - optuna.study.study - INFO - Trial 169 finished with values: [0.00020597936312231026, 5.413825199931615e-05, 0.00011981731974543021] and parameters: {'n_layers': 1, 'embedding_dim': 256, 'lr': 7.659793047994865e-05, 'lambda_val': 1.7965641297535496e-06, 'batch_size': 3792, 'optimizer': 'RMSprop'}.
2026-07-06 20:00:11,875 - experiment_functions - INFO - Early stopping at epoch 2150. Best Metrics: (0.016304481671136718, 0.0036187147389016585, 0.009825750477050432)
2026-07-06 20:00:11,966 - optuna.study.study - INFO - Trial 170 finished with values: [0.016304481671136718, 0.0036187147389016585, 0.009825750477050432] and parameters: {'n_layers': 1, 'embedding_dim': 256, 'lr': 0.011688810705771883, 'lambda_val': 1.838250716065182e-06, 'batch_size': 3792, 'optimizer': 'Adam'}.
2026-07-06 20:01:16,451 - experiment_functions - INFO - Early stopping at epoch 500. Best Metrics: (0.0002194745009973744, 6.078680926239006e-05, 0.0001251970415790719)
2026-07-06 20:01:16,560 - optuna.study.study - INFO - Trial 171 finished with values: [0.0002194745009973744, 6.078680926239006e-05, 0.0001251970415790719] and parameters: {'n_layers': 4, 'embedding_dim': 256, 'lr': 0.01677700597951071, 'lambda_val': 1.3710755672555229e-05, 'batch_size': 2025, 'optimizer': 'SGD'}.
2026-07-06 20:06:40,462 - optuna.study.study - INFO - Trial 172 finished with values: [0.015398195198812489, 0.0034335049294303135, 0.008991823215892737] and parameters: {'n_layers': 2, 'embedding_dim': 64, 'lr': 0.0027021927373699207, 'lambda_val': 2.465157645661239e-06, 'batch_size': 1865, 'optimizer': 'RMSprop'}.
2026-07-06 20:08:23,251 - experiment_functions - INFO - Early stopping at epoch 1200. Best Metrics: (0.011084655434582012, 0.002434321752179777, 0.006417649636581174)
2026-07-06 20:08:23,330 - optuna.study.study - INFO - Trial 173 finished with values: [0.011084655434582012, 0.002434321752179777, 0.006417649636581174] and parameters: {'n_layers': 3, 'embedding_dim': 64, 'lr': 0.006478106002947754, 'lambda_val': 0.00022839439645125766, 'batch_size': 3792, 'optimizer': 'Adam'}.
2026-07-06 20:15:18,170 - optuna.study.study - INFO - Trial 174 finished with values: [0.015406674995807605, 0.003326178219326407, 0.009123798645785783] and parameters: {'n_layers': 2, 'embedding_dim': 256, 'lr': 0.00938818303360569, 'lambda_val': 2.28823110658976e-05, 'batch_size': 2026, 'optimizer': 'Adam'}.
2026-07-06 20:21:22,488 - optuna.study.study - INFO - Trial 175 finished with values: [0.0006893159088473285, 0.00018710939726079444, 0.00044295562548235805] and parameters: {'n_layers': 1, 'embedding_dim': 256, 'lr': 0.00033928390565174827, 'lambda_val': 8.394282396768187e-06, 'batch_size': 2875, 'optimizer': 'Adam'}.
2026-07-06 20:26:38,868 - optuna.study.study - INFO - Trial 176 finished with values: [0.0031673979098515445, 0.0008405675968314875, 0.001952005990279374] and parameters: {'n_layers': 1, 'embedding_dim': 96, 'lr': 0.0004624413468437749, 'lambda_val': 0.0002471011260672202, 'batch_size': 3112, 'optimizer': 'Adam'}.
2026-07-06 20:31:47,728 - optuna.study.study - INFO - Trial 177 finished with values: [0.016174310499365258, 0.0038172216628991505, 0.009634115770427753] and parameters: {'n_layers': 2, 'embedding_dim': 32, 'lr': 0.0010707349549773082, 'lambda_val': 1.3821671642527758e-06, 'batch_size': 2134, 'optimizer': 'RMSprop'}.
2026-07-06 20:36:46,986 - experiment_functions - INFO - Early stopping at epoch 3200. Best Metrics: (0.0171029216697803, 0.0036728529909009744, 0.010217732039615212)
2026-07-06 20:36:47,567 - optuna.study.study - INFO - Trial 178 finished with values: [0.0171029216697803, 0.0036728529909009744, 0.010217732039615212] and parameters: {'n_layers': 1, 'embedding_dim': 256, 'lr': 0.011688810705771883, 'lambda_val': 4.230259051937931e-06, 'batch_size': 4084, 'optimizer': 'Adam'}.
2026-07-06 20:38:04,001 - experiment_functions - INFO - Early stopping at epoch 800. Best Metrics: (0.00027501429656073546, 5.698763368349069e-05, 0.00013298293085087421)
2026-07-06 20:38:04,117 - optuna.study.study - INFO - Trial 179 finished with values: [0.00027501429656073546, 5.698763368349069e-05, 0.00013298293085087421] and parameters: {'n_layers': 1, 'embedding_dim': 256, 'lr': 6.925522449417968e-05, 'lambda_val': 0.000319221155640928, 'batch_size': 3807, 'optimizer': 'Adam'}.
2026-07-06 20:44:58,068 - optuna.study.study - INFO - Trial 180 finished with values: [0.02146724059893327, 0.00458940409931045, 0.012314266447199369] and parameters: {'n_layers': 2, 'embedding_dim': 256, 'lr': 0.004800543051042116, 'lambda_val': 2.188780439699737e-06, 'batch_size': 3098, 'optimizer': 'RMSprop'}.
2026-07-06 20:50:21,111 - optuna.study.study - INFO - Trial 181 finished with values: [0.0159999489350892, 0.003601618448796611, 0.009353116493078047] and parameters: {'n_layers': 2, 'embedding_dim': 64, 'lr': 0.006478106002947754, 'lambda_val': 1.838250716065182e-06, 'batch_size': 1270, 'optimizer': 'RMSprop'}.
2026-07-06 20:56:14,334 - optuna.study.study - INFO - Trial 182 finished with values: [0.012134294815568393, 0.0026936154854396597, 0.0072610265659405265] and parameters: {'n_layers': 2, 'embedding_dim': 128, 'lr': 0.011688810705771883, 'lambda_val': 4.230259051937931e-06, 'batch_size': 1177, 'optimizer': 'Adam'}.
2026-07-06 21:01:44,375 - optuna.study.study - INFO - Trial 183 finished with values: [0.008661374520747006, 0.0021113918279733303, 0.0049892574189579295] and parameters: {'n_layers': 1, 'embedding_dim': 128, 'lr': 0.011688810705771883, 'lambda_val': 0.003235866498706212, 'batch_size': 550, 'optimizer': 'Adam'}.
2026-07-06 21:05:26,050 - experiment_functions - INFO - Early stopping at epoch 2800. Best Metrics: (0.018024514050881575, 0.003968238892160402, 0.010808090539523576)
2026-07-06 21:05:26,121 - optuna.study.study - INFO - Trial 184 finished with values: [0.018024514050881575, 0.003968238892160402, 0.010808090539523576] and parameters: {'n_layers': 1, 'embedding_dim': 64, 'lr': 0.006576207134668591, 'lambda_val': 6.366112313580186e-06, 'batch_size': 3792, 'optimizer': 'RMSprop'}.
2026-07-06 21:09:55,372 - experiment_functions - INFO - Early stopping at epoch 2900. Best Metrics: (0.011624168481673114, 0.0025948369203882757, 0.006543910193748089)
2026-07-06 21:09:55,459 - optuna.study.study - INFO - Trial 185 finished with values: [0.011624168481673114, 0.0025948369203882757, 0.006543910193748089] and parameters: {'n_layers': 4, 'embedding_dim': 96, 'lr': 0.0025676377553735474, 'lambda_val': 0.000319221155640928, 'batch_size': 3807, 'optimizer': 'RMSprop'}.
2026-07-06 21:15:02,934 - optuna.study.study - INFO - Trial 186 finished with values: [0.010673052760093185, 0.0024542674239689984, 0.006398407264878543] and parameters: {'n_layers': 2, 'embedding_dim': 32, 'lr': 0.002656669860795703, 'lambda_val': 0.000319221155640928, 'batch_size': 834, 'optimizer': 'RMSprop'}.
2026-07-06 21:16:01,962 - experiment_functions - INFO - Early stopping at epoch 700. Best Metrics: (0.005075478662038762, 0.001358205269456528, 0.003158609512112862)
2026-07-06 21:16:02,049 - optuna.study.study - INFO - Trial 187 finished with values: [0.005075478662038762, 0.001358205269456528, 0.003158609512112862] and parameters: {'n_layers': 1, 'embedding_dim': 96, 'lr': 0.024621994148519108, 'lambda_val': 0.000319221155640928, 'batch_size': 906, 'optimizer': 'Adam'}.
2026-07-06 21:22:12,343 - optuna.study.study - INFO - Trial 188 finished with values: [0.0199307334411484, 0.004363353152365937, 0.011834018694729352] and parameters: {'n_layers': 1, 'embedding_dim': 256, 'lr': 0.006478106002947754, 'lambda_val': 1.838250716065182e-06, 'batch_size': 1500, 'optimizer': 'RMSprop'}.
2026-07-06 21:28:04,877 - optuna.study.study - INFO - Trial 189 finished with values: [0.013022616947874797, 0.0031438177915392366, 0.007646937268375864] and parameters: {'n_layers': 3, 'embedding_dim': 96, 'lr': 0.00042659375141999053, 'lambda_val': 3.4444951023727845e-05, 'batch_size': 2416, 'optimizer': 'RMSprop'}.
2026-07-06 21:33:51,849 - optuna.study.study - INFO - Trial 190 finished with values: [0.012783921885692792, 0.002894021997226602, 0.007454863582940236] and parameters: {'n_layers': 4, 'embedding_dim': 64, 'lr': 0.006478106002947754, 'lambda_val': 5.734344867778707e-06, 'batch_size': 3792, 'optimizer': 'RMSprop'}.
2026-07-06 21:40:46,346 - optuna.study.study - INFO - Trial 191 finished with values: [0.02061430271393583, 0.004338658511103091, 0.012100783562444062] and parameters: {'n_layers': 2, 'embedding_dim': 256, 'lr': 0.00938818303360569, 'lambda_val': 3.765712134740546e-05, 'batch_size': 2416, 'optimizer': 'RMSprop'}.
2026-07-06 21:41:30,115 - experiment_functions - INFO - Early stopping at epoch 500. Best Metrics: (0.00023408096459009498, 5.6987633683490685e-05, 0.00012564031552905503)
2026-07-06 21:41:30,189 - optuna.study.study - INFO - Trial 192 finished with values: [0.00023408096459009498, 5.6987633683490685e-05, 0.00012564031552905503] and parameters: {'n_layers': 1, 'embedding_dim': 128, 'lr': 0.011688810705771883, 'lambda_val': 1.838250716065182e-06, 'batch_size': 1500, 'optimizer': 'SGD'}.
2026-07-06 21:47:43,590 - optuna.study.study - INFO - Trial 193 finished with values: [0.01649036888599423, 0.0035997188610071614, 0.009946231928093265] and parameters: {'n_layers': 1, 'embedding_dim': 256, 'lr': 0.011688810705771883, 'lambda_val': 2.465157645661239e-06, 'batch_size': 3063, 'optimizer': 'Adam'}.
2026-07-06 21:54:38,843 - optuna.study.study - INFO - Trial 194 finished with values: [0.021482233211994453, 0.004566609045837053, 0.012715089047653] and parameters: {'n_layers': 2, 'embedding_dim': 256, 'lr': 0.006223205691487941, 'lambda_val': 7.622729342060076e-06, 'batch_size': 3821, 'optimizer': 'RMSprop'}.
2026-07-06 22:00:51,014 - optuna.study.study - INFO - Trial 195 finished with values: [0.02212553017197072, 0.004705278954466882, 0.012950366638408598] and parameters: {'n_layers': 1, 'embedding_dim': 256, 'lr': 0.006478106002947754, 'lambda_val': 5.7152734605233486e-05, 'batch_size': 3098, 'optimizer': 'RMSprop'}.
2026-07-06 22:07:24,693 - optuna.study.study - INFO - Trial 196 finished with values: [0.010322962403242705, 0.0023820830879699106, 0.006066873744423038] and parameters: {'n_layers': 4, 'embedding_dim': 128, 'lr': 0.0013662938043453867, 'lambda_val': 3.765712134740546e-05, 'batch_size': 753, 'optimizer': 'RMSprop'}.
2026-07-06 22:08:51,617 - experiment_functions - INFO - Early stopping at epoch 1000. Best Metrics: (0.014166852447863115, 0.0032217008909066736, 0.008511980404772182)
2026-07-06 22:08:51,709 - optuna.study.study - INFO - Trial 197 finished with values: [0.014166852447863115, 0.0032217008909066736, 0.008511980404772182] and parameters: {'n_layers': 1, 'embedding_dim': 128, 'lr': 0.011688810705771883, 'lambda_val': 3.765712134740546e-05, 'batch_size': 3112, 'optimizer': 'Adam'}.
2026-07-06 22:15:02,965 - optuna.study.study - INFO - Trial 198 finished with values: [0.010824836516381024, 0.002532150523336436, 0.006420084162848543] and parameters: {'n_layers': 1, 'embedding_dim': 256, 'lr': 0.01677700597951071, 'lambda_val': 1.838250716065182e-06, 'batch_size': 2026, 'optimizer': 'Adam'}.
2026-07-06 22:20:47,194 - optuna.study.study - INFO - Trial 199 finished with values: [0.00972691126828762, 0.0022063712174458143, 0.005756612817791027] and parameters: {'n_layers': 4, 'embedding_dim': 64, 'lr': 0.019829977892525583, 'lambda_val': 8.354147532190842e-06, 'batch_size': 906, 'optimizer': 'Adam'}.
2026-07-06 22:26:41,926 - optuna.study.study - INFO - Trial 200 finished with values: [0.018200791419499648, 0.0039397450753186555, 0.010602052663145095] and parameters: {'n_layers': 2, 'embedding_dim': 128, 'lr': 0.005856482986389289, 'lambda_val': 2.465157645661239e-06, 'batch_size': 3792, 'optimizer': 'RMSprop'}.
2026-07-06 22:32:39,212 - experiment_functions - INFO - Early stopping at epoch 3800. Best Metrics: (0.021709725420162997, 0.0046739357559409615, 0.012953716158836701)
2026-07-06 22:32:39,298 - optuna.study.study - INFO - Trial 201 finished with values: [0.021709725420162997, 0.0046739357559409615, 0.012953716158836701] and parameters: {'n_layers': 1, 'embedding_dim': 256, 'lr': 0.006478106002947754, 'lambda_val': 1.838250716065182e-06, 'batch_size': 3098, 'optimizer': 'Adam'}.
2026-07-06 22:39:33,698 - optuna.study.study - INFO - Trial 202 finished with values: [0.02158747872236786, 0.0045960526565735245, 0.012585127177535462] and parameters: {'n_layers': 2, 'embedding_dim': 256, 'lr': 0.004800543051042116, 'lambda_val': 2.264107328414845e-06, 'batch_size': 3098, 'optimizer': 'RMSprop'}.
2026-07-06 22:42:18,817 - experiment_functions - INFO - Early stopping at epoch 2150. Best Metrics: (0.012975225085645392, 0.0029500598370153677, 0.007674696455545913)
2026-07-06 22:42:18,923 - optuna.study.study - INFO - Trial 203 finished with values: [0.012975225085645392, 0.0029500598370153677, 0.007674696455545913] and parameters: {'n_layers': 1, 'embedding_dim': 32, 'lr': 0.011688810705771883, 'lambda_val': 2.465157645661239e-06, 'batch_size': 1703, 'optimizer': 'Adam'}.
2026-07-06 22:49:55,885 - optuna.study.study - INFO - Trial 204 finished with values: [0.020897643781221154, 0.004406093877628555, 0.012316042199694068] and parameters: {'n_layers': 3, 'embedding_dim': 256, 'lr': 0.00938818303360569, 'lambda_val': 2.188780439699737e-06, 'batch_size': 2416, 'optimizer': 'RMSprop'}.
2026-07-06 22:55:32,366 - optuna.study.study - INFO - Trial 205 finished with values: [0.020532958444776882, 0.00440704367152328, 0.012179369574037457] and parameters: {'n_layers': 1, 'embedding_dim': 128, 'lr': 0.006478106002947754, 'lambda_val': 1.3821671642527758e-06, 'batch_size': 2385, 'optimizer': 'Adam'}.
2026-07-06 23:00:27,214 - experiment_functions - INFO - Early stopping at epoch 3750. Best Metrics: (0.01842340551309957, 0.0040518207548961875, 0.010935509931075662)
2026-07-06 23:00:27,290 - optuna.study.study - INFO - Trial 206 finished with values: [0.01842340551309957, 0.0040518207548961875, 0.010935509931075662] and parameters: {'n_layers': 1, 'embedding_dim': 64, 'lr': 0.006576207134668591, 'lambda_val': 6.366112313580186e-06, 'batch_size': 3063, 'optimizer': 'RMSprop'}.
2026-07-06 23:01:57,654 - experiment_functions - INFO - Early stopping at epoch 950. Best Metrics: (0.00031694784660347004, 7.313412989381305e-05, 0.00017282201755455638)
2026-07-06 23:01:57,964 - optuna.study.study - INFO - Trial 207 finished with values: [0.00031694784660347004, 7.313412989381305e-05, 0.00017282201755455638] and parameters: {'n_layers': 1, 'embedding_dim': 256, 'lr': 7.38665102144917e-05, 'lambda_val': 4.230259051937931e-06, 'batch_size': 3743, 'optimizer': 'Adam'}.
2026-07-06 23:08:09,858 - optuna.study.study - INFO - Trial 208 finished with values: [0.013959010023403986, 0.0031827593412229543, 0.008304961863043895] and parameters: {'n_layers': 1, 'embedding_dim': 256, 'lr': 0.011688810705771883, 'lambda_val': 8.354147532190842e-06, 'batch_size': 1513, 'optimizer': 'Adam'}.
