2026-07-03 11:43:19,896 - optuna.study.study - INFO - Trial 120 finished with values: [0.01476044620442706, 0.0034847937997454555, 0.008956497293869181] and parameters: {'n_layers': 4, 'embedding_dim': 256, 'lr': 0.0005924494216455263, 'lambda_val': 2.0533552356322422e-05, 'batch_size': 1548, 'optimizer': 'Adam'}.
2026-07-03 11:44:05,407 - experiment_functions - INFO - Early stopping at epoch 500. Best Metrics: (0.004018235458238647, 0.0008025758410424939, 0.002307165958033773)
2026-07-03 11:44:05,487 - optuna.study.study - INFO - Trial 121 finished with values: [0.004018235458238647, 0.0008025758410424939, 0.002307165958033773] and parameters: {'n_layers': 2, 'embedding_dim': 96, 'lr': 0.08839278026219809, 'lambda_val': 1.2639797663881617e-05, 'batch_size': 1104, 'optimizer': 'RMSprop'}.
2026-07-03 11:50:03,193 - optuna.study.study - INFO - Trial 122 finished with values: [0.01740884000180681, 0.0038808578538457156, 0.01000364572201668] and parameters: {'n_layers': 3, 'embedding_dim': 96, 'lr': 0.0010282533123218839, 'lambda_val': 3.994713178662255e-05, 'batch_size': 2599, 'optimizer': 'RMSprop'}.
2026-07-03 11:57:26,962 - experiment_functions - INFO - Early stopping at epoch 3550. Best Metrics: (0.016929618731993373, 0.003637710616796155, 0.009787143905468497)
2026-07-03 11:57:27,058 - optuna.study.study - INFO - Trial 123 finished with values: [0.016929618731993373, 0.003637710616796155, 0.009787143905468497] and parameters: {'n_layers': 4, 'embedding_dim': 256, 'lr': 0.0008107107656200319, 'lambda_val': 6.774334055524311e-06, 'batch_size': 3913, 'optimizer': 'RMSprop'}.
2026-07-03 12:03:00,407 - optuna.study.study - INFO - Trial 124 finished with values: [0.015058800056504815, 0.0037032463955321694, 0.00937160821718428] and parameters: {'n_layers': 1, 'embedding_dim': 128, 'lr': 0.0010282533123218839, 'lambda_val': 3.7175116690643465e-05, 'batch_size': 2527, 'optimizer': 'Adam'}.
2026-07-03 12:08:20,154 - optuna.study.study - INFO - Trial 125 finished with values: [0.00918900107232488, 0.002118990179131128, 0.005500632753132037] and parameters: {'n_layers': 4, 'embedding_dim': 32, 'lr': 0.0022700314607702445, 'lambda_val': 2.0533552356322422e-05, 'batch_size': 1016, 'optimizer': 'RMSprop'}.
2026-07-03 12:13:28,105 - experiment_functions - INFO - Early stopping at epoch 3800. Best Metrics: (0.01668374235315981, 0.0038267196018463992, 0.009981493812169062)
2026-07-03 12:13:28,197 - optuna.study.study - INFO - Trial 126 finished with values: [0.01668374235315981, 0.0038267196018463992, 0.009981493812169062] and parameters: {'n_layers': 1, 'embedding_dim': 96, 'lr': 0.0022700314607702445, 'lambda_val': 0.008107712298875159, 'batch_size': 3960, 'optimizer': 'RMSprop'}.
2026-07-03 12:20:08,674 - experiment_functions - INFO - Early stopping at epoch 3550. Best Metrics: (0.004265811713519276, 0.0011359534980909143, 0.002525837949664825)
2026-07-03 12:20:08,747 - optuna.study.study - INFO - Trial 127 finished with values: [0.004265811713519276, 0.0011359534980909143, 0.002525837949664825] and parameters: {'n_layers': 3, 'embedding_dim': 256, 'lr': 0.0014187321710568024, 'lambda_val': 0.03662205350906382, 'batch_size': 3913, 'optimizer': 'RMSprop'}.
2026-07-03 12:25:12,597 - experiment_functions - INFO - Early stopping at epoch 3900. Best Metrics: (0.015659080522831804, 0.003513287616587201, 0.009037712142241056)
2026-07-03 12:25:12,685 - optuna.study.study - INFO - Trial 128 finished with values: [0.015659080522831804, 0.003513287616587201, 0.009037712142241056] and parameters: {'n_layers': 1, 'embedding_dim': 64, 'lr': 0.008057425283025757, 'lambda_val': 0.00016569298362557902, 'batch_size': 1692, 'optimizer': 'RMSprop'}.
2026-07-03 12:31:08,901 - optuna.study.study - INFO - Trial 129 finished with values: [0.018671036849747732, 0.0040385236403700404, 0.0107866578266154] and parameters: {'n_layers': 2, 'embedding_dim': 128, 'lr': 0.0026410131585060054, 'lambda_val': 9.917852447655537e-05, 'batch_size': 3913, 'optimizer': 'RMSprop'}.
2026-07-03 12:31:55,666 - experiment_functions - INFO - Early stopping at epoch 500. Best Metrics: (0.0001860612316284509, 5.7937427578215534e-05, 0.00012008180679844762)
2026-07-03 12:31:55,754 - optuna.study.study - INFO - Trial 130 finished with values: [0.0001860612316284509, 5.7937427578215534e-05, 0.00012008180679844762] and parameters: {'n_layers': 3, 'embedding_dim': 96, 'lr': 0.0005924494216455263, 'lambda_val': 1.2677615672600141e-06, 'batch_size': 1807, 'optimizer': 'SGD'}.
2026-07-03 12:32:42,567 - experiment_functions - INFO - Early stopping at epoch 550. Best Metrics: (0.00562297583613389, 0.001353456299982904, 0.003407069303677151)
2026-07-03 12:32:42,639 - optuna.study.study - INFO - Trial 131 finished with values: [0.00562297583613389, 0.001353456299982904, 0.003407069303677151] and parameters: {'n_layers': 3, 'embedding_dim': 32, 'lr': 0.06905134580008003, 'lambda_val': 7.33580764656977e-05, 'batch_size': 2366, 'optimizer': 'Adam'}.
2026-07-03 12:38:06,168 - optuna.study.study - INFO - Trial 132 finished with values: [0.012774562468790013, 0.0032103033641699757, 0.007809983026718127] and parameters: {'n_layers': 2, 'embedding_dim': 64, 'lr': 0.0014537114423835192, 'lambda_val': 2.6660349002830665e-06, 'batch_size': 575, 'optimizer': 'Adam'}.
2026-07-03 12:43:28,806 - optuna.study.study - INFO - Trial 133 finished with values: [0.013065841912523527, 0.0030431396386984026, 0.007889323333659421] and parameters: {'n_layers': 4, 'embedding_dim': 32, 'lr': 0.0008107107656200319, 'lambda_val': 1.2350413453119533e-05, 'batch_size': 3622, 'optimizer': 'Adam'}.
2026-07-03 12:49:24,068 - optuna.study.study - INFO - Trial 134 finished with values: [0.019407860647626916, 0.004447884808996448, 0.011803598054155397] and parameters: {'n_layers': 2, 'embedding_dim': 128, 'lr': 0.0008107107656200319, 'lambda_val': 1.2350413453119533e-05, 'batch_size': 2599, 'optimizer': 'RMSprop'}.
2026-07-03 12:55:02,810 - experiment_functions - INFO - Early stopping at epoch 3600. Best Metrics: (0.01360127782318122, 0.0029890013866990866, 0.007887955111993956)
2026-07-03 12:55:02,900 - optuna.study.study - INFO - Trial 135 finished with values: [0.01360127782318122, 0.0029890013866990866, 0.007887955111993956] and parameters: {'n_layers': 3, 'embedding_dim': 128, 'lr': 0.003942474684271309, 'lambda_val': 3.328417231611093e-05, 'batch_size': 2210, 'optimizer': 'Adam'}.
2026-07-03 13:00:41,076 - optuna.study.study - INFO - Trial 136 finished with values: [0.01823113926274117, 0.004035674258685866, 0.010716279134188149] and parameters: {'n_layers': 3, 'embedding_dim': 64, 'lr': 0.0014537114423835192, 'lambda_val': 2.302284243959985e-05, 'batch_size': 2366, 'optimizer': 'Adam'}.
2026-07-03 13:06:54,604 - optuna.study.study - INFO - Trial 137 finished with values: [0.026549307526623517, 0.00587162585718899, 0.016072209335818988] and parameters: {'n_layers': 1, 'embedding_dim': 256, 'lr': 0.0014333316079584322, 'lambda_val': 7.33580764656977e-05, 'batch_size': 3121, 'optimizer': 'RMSprop'}.
2026-07-03 13:07:42,279 - experiment_functions - INFO - Early stopping at epoch 500. Best Metrics: (0.004656285595583065, 0.0009925346199874626, 0.00273217650118098)
2026-07-03 13:07:42,358 - optuna.study.study - INFO - Trial 138 finished with values: [0.004656285595583065, 0.0009925346199874626, 0.00273217650118098] and parameters: {'n_layers': 3, 'embedding_dim': 96, 'lr': 0.06339720330400815, 'lambda_val': 8.41405405813264e-05, 'batch_size': 732, 'optimizer': 'RMSprop'}.
2026-07-03 13:10:40,702 - experiment_functions - INFO - Early stopping at epoch 2300. Best Metrics: (0.020778446545317995, 0.004607450183310223, 0.012377597205807991)
2026-07-03 13:10:40,814 - optuna.study.study - INFO - Trial 139 finished with values: [0.020778446545317995, 0.004607450183310223, 0.012377597205807991] and parameters: {'n_layers': 1, 'embedding_dim': 32, 'lr': 0.0040524633409478395, 'lambda_val': 7.33580764656977e-05, 'batch_size': 3839, 'optimizer': 'Adam'}.
2026-07-03 13:18:20,272 - optuna.study.study - INFO - Trial 140 finished with values: [0.01594620158309457, 0.003440153486693388, 0.009065482168920887] and parameters: {'n_layers': 3, 'embedding_dim': 256, 'lr': 0.0026410131585060054, 'lambda_val': 4.576689567534931e-05, 'batch_size': 3913, 'optimizer': 'Adam'}.
2026-07-03 13:23:29,640 - optuna.study.study - INFO - Trial 141 finished with values: [0.013878091765706535, 0.0034078604942727425, 0.008490901453715166] and parameters: {'n_layers': 2, 'embedding_dim': 32, 'lr': 0.0010282533123218839, 'lambda_val': 0.0006168359830718268, 'batch_size': 2366, 'optimizer': 'RMSprop'}.
2026-07-03 13:26:56,826 - experiment_functions - INFO - Early stopping at epoch 2200. Best Metrics: (0.014590038402135866, 0.0031970062496438274, 0.00843248724565221)
2026-07-03 13:26:56,916 - optuna.study.study - INFO - Trial 142 finished with values: [0.014590038402135866, 0.0031970062496438274, 0.00843248724565221] and parameters: {'n_layers': 4, 'embedding_dim': 96, 'lr': 0.001509217129870026, 'lambda_val': 6.525874471654226e-06, 'batch_size': 3575, 'optimizer': 'Adam'}.
2026-07-03 13:32:33,941 - optuna.study.study - INFO - Trial 143 finished with values: [0.008718468902176098, 0.0020942955378682833, 0.00489385010429155] and parameters: {'n_layers': 2, 'embedding_dim': 96, 'lr': 0.0018743209181168723, 'lambda_val': 0.01131983811944959, 'batch_size': 1104, 'optimizer': 'Adam'}.
2026-07-03 13:33:23,668 - experiment_functions - INFO - Early stopping at epoch 500. Best Metrics: (0.00025937697887811183, 5.5088045894040994e-05, 0.00013460408126416096)
2026-07-03 13:33:24,471 - optuna.study.study - INFO - Trial 144 finished with values: [0.00025937697887811183, 5.5088045894040994e-05, 0.00013460408126416096] and parameters: {'n_layers': 1, 'embedding_dim': 256, 'lr': 0.0005924494216455263, 'lambda_val': 0.0040435356537193885, 'batch_size': 1561, 'optimizer': 'Adam'}.
2026-07-03 13:41:01,327 - optuna.study.study - INFO - Trial 145 finished with values: [0.011430651093366271, 0.002583439393651578, 0.0066030912570463444] and parameters: {'n_layers': 3, 'embedding_dim': 256, 'lr': 0.0026410131585060054, 'lambda_val': 4.576689567534931e-05, 'batch_size': 1016, 'optimizer': 'Adam'}.
2026-07-03 13:46:12,714 - optuna.study.study - INFO - Trial 146 finished with values: [0.013058838361638944, 0.003129570883118364, 0.007818291068192158] and parameters: {'n_layers': 1, 'embedding_dim': 64, 'lr': 0.0040524633409478395, 'lambda_val': 0.008107712298875159, 'batch_size': 2527, 'optimizer': 'RMSprop'}.
2026-07-03 13:47:51,415 - experiment_functions - INFO - Early stopping at epoch 1200. Best Metrics: (0.00702627060898908, 0.0016355450867161824, 0.004071829610255052)
2026-07-03 13:47:51,502 - optuna.study.study - INFO - Trial 147 finished with values: [0.00702627060898908, 0.0016355450867161824, 0.004071829610255052] and parameters: {'n_layers': 4, 'embedding_dim': 32, 'lr': 0.021737337182750487, 'lambda_val': 1.2350413453119533e-05, 'batch_size': 3384, 'optimizer': 'Adam'}.
2026-07-03 13:50:48,263 - experiment_functions - INFO - Early stopping at epoch 1950. Best Metrics: (0.021441558803402063, 0.0045989020382576976, 0.012558786015572221)
2026-07-03 13:50:48,351 - optuna.study.study - INFO - Trial 148 finished with values: [0.021441558803402063, 0.0045989020382576976, 0.012558786015572221] and parameters: {'n_layers': 2, 'embedding_dim': 128, 'lr': 0.0022700314607702445, 'lambda_val': 3.7175116690643465e-05, 'batch_size': 3832, 'optimizer': 'Adam'}.
2026-07-03 13:56:30,205 - optuna.study.study - INFO - Trial 149 finished with values: [0.018909602641762696, 0.004372851091313185, 0.011059294672943122] and parameters: {'n_layers': 2, 'embedding_dim': 96, 'lr': 0.0008107107656200319, 'lambda_val': 1.2350413453119533e-05, 'batch_size': 4088, 'optimizer': 'Adam'}.
2026-07-03 14:04:06,548 - optuna.study.study - INFO - Trial 150 finished with values: [0.018131031830190634, 0.00400528085405467, 0.010352752821092857] and parameters: {'n_layers': 3, 'embedding_dim': 256, 'lr': 0.0014333316079584322, 'lambda_val': 7.33580764656977e-05, 'batch_size': 3121, 'optimizer': 'RMSprop'}.
2026-07-03 14:09:30,033 - optuna.study.study - INFO - Trial 151 finished with values: [0.023136002107930008, 0.005058602283304523, 0.013569392751729806] and parameters: {'n_layers': 1, 'embedding_dim': 96, 'lr': 0.0040524633409478395, 'lambda_val': 2.0533552356322422e-05, 'batch_size': 1548, 'optimizer': 'Adam'}.
2026-07-03 14:14:16,002 - experiment_functions - INFO - Early stopping at epoch 2300. Best Metrics: (0.008182996639072898, 0.0018919894382918908, 0.004617955175664981)
2026-07-03 14:14:16,090 - optuna.study.study - INFO - Trial 152 finished with values: [0.008182996639072898, 0.0018919894382918908, 0.004617955175664981] and parameters: {'n_layers': 4, 'embedding_dim': 256, 'lr': 0.0008107107656200319, 'lambda_val': 0.007888596182009985, 'batch_size': 3835, 'optimizer': 'RMSprop'}.
2026-07-03 14:19:23,964 - experiment_functions - INFO - Early stopping at epoch 3300. Best Metrics: (0.014286183890453615, 0.003197956043538552, 0.008494343491612065)
2026-07-03 14:19:24,054 - optuna.study.study - INFO - Trial 153 finished with values: [0.014286183890453615, 0.003197956043538552, 0.008494343491612065] and parameters: {'n_layers': 4, 'embedding_dim': 96, 'lr': 0.0014537114423835192, 'lambda_val': 3.7175116690643465e-05, 'batch_size': 2527, 'optimizer': 'Adam'}.
2026-07-03 14:25:33,469 - optuna.study.study - INFO - Trial 154 finished with values: [0.016198759568277606, 0.004009080029633569, 0.009968502311515678] and parameters: {'n_layers': 1, 'embedding_dim': 256, 'lr': 0.0008107107656200319, 'lambda_val': 0.00016569298362557902, 'batch_size': 2782, 'optimizer': 'RMSprop'}.
2026-07-03 14:31:41,381 - optuna.study.study - INFO - Trial 155 finished with values: [0.0003125880712579206, 7.028474820963851e-05, 0.00015938352862019067] and parameters: {'n_layers': 3, 'embedding_dim': 128, 'lr': 6.406377002672054e-05, 'lambda_val': 1.2350413453119533e-05, 'batch_size': 3913, 'optimizer': 'RMSprop'}.
2026-07-03 14:39:18,713 - optuna.study.study - INFO - Trial 156 finished with values: [0.014920787907919435, 0.0036234637083752833, 0.009041294699736158] and parameters: {'n_layers': 3, 'embedding_dim': 256, 'lr': 0.0005924494216455263, 'lambda_val': 4.982512602626827e-06, 'batch_size': 1561, 'optimizer': 'Adam'}.
2026-07-03 14:44:06,554 - experiment_functions - INFO - Early stopping at epoch 3650. Best Metrics: (0.01668112612746404, 0.003758334441426211, 0.009722797431720354)
2026-07-03 14:44:06,643 - optuna.study.study - INFO - Trial 157 finished with values: [0.01668112612746404, 0.003758334441426211, 0.009722797431720354] and parameters: {'n_layers': 3, 'embedding_dim': 32, 'lr': 0.0018743209181168723, 'lambda_val': 2.302284243959985e-05, 'batch_size': 2366, 'optimizer': 'Adam'}.
2026-07-03 14:49:38,951 - optuna.study.study - INFO - Trial 158 finished with values: [0.01793017476528721, 0.004239879946051707, 0.010941077654231982] and parameters: {'n_layers': 1, 'embedding_dim': 128, 'lr': 0.0010282533123218839, 'lambda_val': 9.917852447655537e-05, 'batch_size': 2599, 'optimizer': 'RMSprop'}.
2026-07-03 14:55:50,976 - optuna.study.study - INFO - Trial 159 finished with values: [0.014208258763679846, 0.0033318769826947547, 0.008491812960776042] and parameters: {'n_layers': 4, 'embedding_dim': 96, 'lr': 0.0005924494216455263, 'lambda_val': 2.0533552356322422e-05, 'batch_size': 2295, 'optimizer': 'Adam'}.
2026-07-03 14:56:38,444 - experiment_functions - INFO - Early stopping at epoch 550. Best Metrics: (0.0026775497837647003, 0.0007313412989381305, 0.0016865348923088836)
2026-07-03 14:56:38,525 - optuna.study.study - INFO - Trial 160 finished with values: [0.0026775497837647003, 0.0007313412989381305, 0.0016865348923088836] and parameters: {'n_layers': 1, 'embedding_dim': 96, 'lr': 0.09772162900645621, 'lambda_val': 1.2350413453119533e-05, 'batch_size': 4088, 'optimizer': 'Adam'}.
2026-07-03 15:02:13,299 - optuna.study.study - INFO - Trial 161 finished with values: [0.023969771747210954, 0.005375833444142622, 0.014482864032137086] and parameters: {'n_layers': 1, 'embedding_dim': 128, 'lr': 0.0014333316079584322, 'lambda_val': 1.360510913687726e-06, 'batch_size': 3121, 'optimizer': 'RMSprop'}.
2026-07-03 15:08:51,405 - optuna.study.study - INFO - Trial 162 finished with values: [0.015109651452188115, 0.0034534506012195354, 0.009064436526115665] and parameters: {'n_layers': 4, 'embedding_dim': 128, 'lr': 0.0008107107656200319, 'lambda_val': 3.7175116690643465e-05, 'batch_size': 1957, 'optimizer': 'Adam'}.
2026-07-03 15:14:34,906 - experiment_functions - INFO - Early stopping at epoch 3850. Best Metrics: (0.017167999029305818, 0.0038191212506886014, 0.01005956574247257)
2026-07-03 15:14:35,009 - optuna.study.study - INFO - Trial 163 finished with values: [0.017167999029305818, 0.0038191212506886014, 0.01005956574247257] and parameters: {'n_layers': 3, 'embedding_dim': 96, 'lr': 0.0010282533123218839, 'lambda_val': 9.917852447655537e-05, 'batch_size': 3384, 'optimizer': 'RMSprop'}.
2026-07-03 15:19:49,151 - experiment_functions - INFO - Early stopping at epoch 3500. Best Metrics: (0.020661717893679103, 0.004388047793628783, 0.012007828325820251)
2026-07-03 15:19:49,228 - optuna.study.study - INFO - Trial 164 finished with values: [0.020661717893679103, 0.004388047793628783, 0.012007828325820251] and parameters: {'n_layers': 2, 'embedding_dim': 128, 'lr': 0.0026410131585060054, 'lambda_val': 1.722007256837861e-06, 'batch_size': 3913, 'optimizer': 'Adam'}.
2026-07-03 15:25:13,722 - optuna.study.study - INFO - Trial 165 finished with values: [0.02568969113403364, 0.005620880268981631, 0.01532538109651518] and parameters: {'n_layers': 1, 'embedding_dim': 96, 'lr': 0.0022700314607702445, 'lambda_val': 3.7175116690643465e-05, 'batch_size': 2790, 'optimizer': 'RMSprop'}.
2026-07-03 15:31:29,640 - optuna.study.study - INFO - Trial 166 finished with values: [0.024353835759957285, 0.005512603764982999, 0.014797919967288357] and parameters: {'n_layers': 1, 'embedding_dim': 256, 'lr': 0.0014333316079584322, 'lambda_val': 2.5379243415253125e-05, 'batch_size': 3121, 'optimizer': 'Adam'}.
2026-07-03 15:33:11,701 - experiment_functions - INFO - Early stopping at epoch 1300. Best Metrics: (0.016946097935587764, 0.003784928670478506, 0.010223298816036792)
2026-07-03 15:33:11,777 - optuna.study.study - INFO - Trial 167 finished with values: [0.016946097935587764, 0.003784928670478506, 0.010223298816036792] and parameters: {'n_layers': 1, 'embedding_dim': 32, 'lr': 0.008841806029042509, 'lambda_val': 1.2350413453119533e-05, 'batch_size': 3839, 'optimizer': 'Adam'}.
2026-07-03 15:40:07,658 - optuna.study.study - INFO - Trial 168 finished with values: [0.018141042676052724, 0.004010029823528294, 0.01063300308388003] and parameters: {'n_layers': 2, 'embedding_dim': 256, 'lr': 0.0022700314607702445, 'lambda_val': 4.982512602626827e-06, 'batch_size': 1561, 'optimizer': 'Adam'}.
2026-07-03 15:47:41,997 - optuna.study.study - INFO - Trial 169 finished with values: [0.016974117074511255, 0.0037326900062686396, 0.009895204697471542] and parameters: {'n_layers': 3, 'embedding_dim': 256, 'lr': 0.0014333316079584322, 'lambda_val': 3.994713178662255e-05, 'batch_size': 2599, 'optimizer': 'RMSprop'}.
2026-07-03 15:53:54,579 - optuna.study.study - INFO - Trial 170 finished with values: [0.016247765005567613, 0.0036358110290067055, 0.009455871681534994] and parameters: {'n_layers': 4, 'embedding_dim': 96, 'lr': 0.0008107107656200319, 'lambda_val': 6.774334055524311e-06, 'batch_size': 3575, 'optimizer': 'Adam'}.
2026-07-03 15:54:37,791 - experiment_functions - INFO - Early stopping at epoch 500. Best Metrics: (0.00018686358953630484, 5.128887031514162e-05, 0.00010677852729401786)
2026-07-03 15:54:37,877 - optuna.study.study - INFO - Trial 171 finished with values: [0.00018686358953630484, 5.128887031514162e-05, 0.00010677852729401786] and parameters: {'n_layers': 2, 'embedding_dim': 64, 'lr': 0.06364912319668577, 'lambda_val': 0.0006168359830718268, 'batch_size': 2527, 'optimizer': 'SGD'}.
2026-07-03 15:58:05,213 - experiment_functions - INFO - Early stopping at epoch 2650. Best Metrics: (0.01573666810547153, 0.0034126094637463673, 0.00908185817585351)
2026-07-03 15:58:05,315 - optuna.study.study - INFO - Trial 172 finished with values: [0.01573666810547153, 0.0034126094637463673, 0.00908185817585351] and parameters: {'n_layers': 1, 'embedding_dim': 64, 'lr': 0.008057425283025757, 'lambda_val': 0.00016569298362557902, 'batch_size': 2527, 'optimizer': 'RMSprop'}.
2026-07-03 16:03:29,053 - optuna.study.study - INFO - Trial 173 finished with values: [0.014175923396408486, 0.003147616967118136, 0.008087939875434436] and parameters: {'n_layers': 2, 'embedding_dim': 64, 'lr': 0.0032634179104737335, 'lambda_val': 0.0006168359830718268, 'batch_size': 2549, 'optimizer': 'RMSprop'}.
2026-07-03 16:11:47,170 - optuna.study.study - INFO - Trial 174 finished with values: [0.015196159520051612, 0.0033176300742738833, 0.008965896254576578] and parameters: {'n_layers': 4, 'embedding_dim': 256, 'lr': 0.0008107107656200319, 'lambda_val': 7.329771199139694e-05, 'batch_size': 2331, 'optimizer': 'RMSprop'}.
2026-07-03 16:12:29,616 - experiment_functions - INFO - Early stopping at epoch 500. Best Metrics: (0.0002177637900159702, 6.36361909465646e-05, 0.0001288971939357383)
2026-07-03 16:12:29,684 - optuna.study.study - INFO - Trial 175 finished with values: [0.0002177637900159702, 6.36361909465646e-05, 0.0001288971939357383] and parameters: {'n_layers': 3, 'embedding_dim': 32, 'lr': 0.0018743209181168723, 'lambda_val': 2.302284243959985e-05, 'batch_size': 2740, 'optimizer': 'SGD'}.
