2026-07-06 23:15:45,365 - optuna.study.study - INFO - Trial 209 finished with values: [0.018618109967662992, 0.0041401515871055975, 0.010916664809074085] and parameters: {'n_layers': 3, 'embedding_dim': 256, 'lr': 0.004800543051042116, 'lambda_val': 3.765712134740546e-05, 'batch_size': 2026, 'optimizer': 'RMSprop'}.
2026-07-06 23:21:41,299 - optuna.study.study - INFO - Trial 210 finished with values: [0.0201497131197439, 0.0044051440837338295, 0.01203886421282988] and parameters: {'n_layers': 2, 'embedding_dim': 128, 'lr': 0.0015437546616201686, 'lambda_val': 1.838250716065182e-06, 'batch_size': 2576, 'optimizer': 'RMSprop'}.
2026-07-06 23:27:04,747 - optuna.study.study - INFO - Trial 211 finished with values: [0.01267837388550437, 0.003155215318275934, 0.007596354105140319] and parameters: {'n_layers': 2, 'embedding_dim': 64, 'lr': 0.00048401876021836126, 'lambda_val': 1.838250716065182e-06, 'batch_size': 3792, 'optimizer': 'RMSprop'}.
2026-07-06 23:29:26,367 - experiment_functions - INFO - Early stopping at epoch 1650. Best Metrics: (0.02096553144449867, 0.004495374503732691, 0.012361628598949506)
2026-07-06 23:29:26,451 - optuna.study.study - INFO - Trial 212 finished with values: [0.02096553144449867, 0.004495374503732691, 0.012361628598949506] and parameters: {'n_layers': 1, 'embedding_dim': 128, 'lr': 0.006478106002947754, 'lambda_val': 1.838250716065182e-06, 'batch_size': 3792, 'optimizer': 'Adam'}.
2026-07-06 23:35:01,380 - optuna.study.study - INFO - Trial 213 finished with values: [0.0200543023527122, 0.0043984955264707555, 0.011781036114480942] and parameters: {'n_layers': 1, 'embedding_dim': 128, 'lr': 0.006478106002947754, 'lambda_val': 1.838250716065182e-06, 'batch_size': 3792, 'optimizer': 'RMSprop'}.
2026-07-06 23:39:59,295 - experiment_functions - INFO - Early stopping at epoch 3850. Best Metrics: (0.012831067861821225, 0.0028930722033318774, 0.007476945996340727)
2026-07-06 23:39:59,381 - optuna.study.study - INFO - Trial 214 finished with values: [0.012831067861821225, 0.0028930722033318774, 0.007476945996340727] and parameters: {'n_layers': 2, 'embedding_dim': 32, 'lr': 0.00938818303360569, 'lambda_val': 3.765712134740546e-05, 'batch_size': 3159, 'optimizer': 'RMSprop'}.
2026-07-06 23:45:24,899 - optuna.study.study - INFO - Trial 215 finished with values: [0.016485999691819405, 0.003700397013847995, 0.009743374202815194] and parameters: {'n_layers': 2, 'embedding_dim': 64, 'lr': 0.006478106002947754, 'lambda_val': 1.838250716065182e-06, 'batch_size': 1270, 'optimizer': 'RMSprop'}.
2026-07-06 23:46:24,423 - experiment_functions - INFO - Early stopping at epoch 550. Best Metrics: (0.00373529984203111, 0.0009450449252512205, 0.0024823771552576024)
2026-07-06 23:46:25,146 - optuna.study.study - INFO - Trial 216 finished with values: [0.00373529984203111, 0.0009450449252512205, 0.0024823771552576024] and parameters: {'n_layers': 2, 'embedding_dim': 256, 'lr': 0.006478106002947754, 'lambda_val': 0.05408880115920807, 'batch_size': 2542, 'optimizer': 'RMSprop'}.
2026-07-06 23:51:40,342 - optuna.study.study - INFO - Trial 217 finished with values: [0.015699637803976773, 0.0036415097923750556, 0.009293316852998407] and parameters: {'n_layers': 3, 'embedding_dim': 32, 'lr': 0.0010707349549773082, 'lambda_val': 1.3821671642527758e-06, 'batch_size': 2134, 'optimizer': 'Adam'}.
2026-07-06 23:56:50,895 - optuna.study.study - INFO - Trial 218 finished with values: [0.014311668003312671, 0.0031960564557491017, 0.008376846379681013] and parameters: {'n_layers': 2, 'embedding_dim': 32, 'lr': 0.004800543051042116, 'lambda_val': 1.3821671642527758e-06, 'batch_size': 3098, 'optimizer': 'RMSprop'}.
2026-07-07 00:03:02,903 - optuna.study.study - INFO - Trial 219 finished with values: [0.022197102121255467, 0.004713827099519405, 0.012949506653228835] and parameters: {'n_layers': 1, 'embedding_dim': 256, 'lr': 0.006478106002947754, 'lambda_val': 2.465157645661239e-06, 'batch_size': 3792, 'optimizer': 'RMSprop'}.
2026-07-07 00:03:51,071 - experiment_functions - INFO - Early stopping at epoch 500. Best Metrics: (0.00025278090207114443, 6.078680926239006e-05, 0.00014642068313141574)
2026-07-07 00:03:51,153 - optuna.study.study - INFO - Trial 220 finished with values: [0.00025278090207114443, 6.078680926239006e-05, 0.00014642068313141574] and parameters: {'n_layers': 1, 'embedding_dim': 256, 'lr': 0.004800543051042116, 'lambda_val': 3.765712134740546e-05, 'batch_size': 2433, 'optimizer': 'SGD'}.
2026-07-07 00:09:07,111 - optuna.study.study - INFO - Trial 221 finished with values: [0.022819529806843715, 0.005202970955302699, 0.013546639847005253] and parameters: {'n_layers': 1, 'embedding_dim': 64, 'lr': 0.0015523967946049835, 'lambda_val': 6.366112313580186e-06, 'batch_size': 3792, 'optimizer': 'RMSprop'}.
2026-07-07 00:09:51,457 - experiment_functions - INFO - Early stopping at epoch 500. Best Metrics: (0.0001753722550820809, 5.5088045894041e-05, 0.00010030720425678614)
2026-07-07 00:09:51,525 - optuna.study.study - INFO - Trial 222 finished with values: [0.0001753722550820809, 5.5088045894041e-05, 0.00010030720425678614] and parameters: {'n_layers': 1, 'embedding_dim': 128, 'lr': 1.5466277085302623e-05, 'lambda_val': 0.000319221155640928, 'batch_size': 3112, 'optimizer': 'Adam'}.
2026-07-07 00:18:02,303 - optuna.study.study - INFO - Trial 223 finished with values: [0.0038189840699467737, 0.0009127519328305759, 0.00218639040982422] and parameters: {'n_layers': 4, 'embedding_dim': 256, 'lr': 0.0010707349549773082, 'lambda_val': 0.01639656801277251, 'batch_size': 1103, 'optimizer': 'RMSprop'}.
2026-07-07 00:23:41,712 - optuna.study.study - INFO - Trial 224 finished with values: [0.01765366945205758, 0.0037963261972152043, 0.010118678710284365] and parameters: {'n_layers': 2, 'embedding_dim': 96, 'lr': 0.007748940378927992, 'lambda_val': 1.7965641297535496e-06, 'batch_size': 3573, 'optimizer': 'RMSprop'}.
2026-07-07 00:29:58,157 - optuna.study.study - INFO - Trial 225 finished with values: [0.025858263155938463, 0.0055572440780350665, 0.015486393749078346] and parameters: {'n_layers': 1, 'embedding_dim': 256, 'lr': 0.002656669860795703, 'lambda_val': 0.000319221155640928, 'batch_size': 3112, 'optimizer': 'Adam'}.
2026-07-07 00:35:13,044 - optuna.study.study - INFO - Trial 226 finished with values: [0.02228804970470343, 0.004933229489200843, 0.013123909569579711] and parameters: {'n_layers': 1, 'embedding_dim': 64, 'lr': 0.003261445844811169, 'lambda_val': 2.465157645661239e-06, 'batch_size': 1500, 'optimizer': 'RMSprop'}.
2026-07-07 00:39:00,493 - experiment_functions - INFO - Early stopping at epoch 2400. Best Metrics: (0.023615859105713295, 0.0051051421841460404, 0.013915935829222409)
2026-07-07 00:39:00,565 - optuna.study.study - INFO - Trial 227 finished with values: [0.023615859105713295, 0.0051051421841460404, 0.013915935829222409] and parameters: {'n_layers': 1, 'embedding_dim': 256, 'lr': 0.004800543051042116, 'lambda_val': 1.838250716065182e-06, 'batch_size': 3112, 'optimizer': 'Adam'}.
2026-07-07 00:45:12,176 - optuna.study.study - INFO - Trial 228 finished with values: [0.013148759448640338, 0.0029453108675417438, 0.007889547496292384] and parameters: {'n_layers': 1, 'embedding_dim': 256, 'lr': 0.011688810705771883, 'lambda_val': 6.977447444009337e-05, 'batch_size': 1065, 'optimizer': 'Adam'}.
2026-07-07 00:49:08,146 - experiment_functions - INFO - Early stopping at epoch 2500. Best Metrics: (0.021579945308991974, 0.004672985962046236, 0.01288611493003007)
2026-07-07 00:49:08,229 - optuna.study.study - INFO - Trial 229 finished with values: [0.021579945308991974, 0.004672985962046236, 0.01288611493003007] and parameters: {'n_layers': 1, 'embedding_dim': 256, 'lr': 0.006478106002947754, 'lambda_val': 2.465157645661239e-06, 'batch_size': 3390, 'optimizer': 'Adam'}.
2026-07-07 00:54:48,214 - optuna.study.study - INFO - Trial 230 finished with values: [0.017387653161546227, 0.003753585471952586, 0.009991154029470317] and parameters: {'n_layers': 2, 'embedding_dim': 96, 'lr': 0.006576207134668591, 'lambda_val': 6.366112313580186e-06, 'batch_size': 3792, 'optimizer': 'RMSprop'}.
2026-07-07 01:01:02,326 - optuna.study.study - INFO - Trial 231 finished with values: [0.026857225784384053, 0.0057035123378226926, 0.01576281792844056] and parameters: {'n_layers': 1, 'embedding_dim': 256, 'lr': 0.003261445844811169, 'lambda_val': 2.465157645661239e-06, 'batch_size': 3098, 'optimizer': 'RMSprop'}.
2026-07-07 01:07:13,656 - optuna.study.study - INFO - Trial 232 finished with values: [0.020831295453975107, 0.004442186045628098, 0.012324905183377456] and parameters: {'n_layers': 1, 'embedding_dim': 256, 'lr': 0.007748940378927992, 'lambda_val': 1.7965641297535496e-06, 'batch_size': 3098, 'optimizer': 'RMSprop'}.
2026-07-07 01:09:21,611 - experiment_functions - INFO - Early stopping at epoch 1000. Best Metrics: (0.009627852020407095, 0.0020705506905001614, 0.005986484350361626)
2026-07-07 01:09:21,695 - optuna.study.study - INFO - Trial 233 finished with values: [0.009627852020407095, 0.0020705506905001614, 0.005986484350361626] and parameters: {'n_layers': 4, 'embedding_dim': 256, 'lr': 0.030616937890775114, 'lambda_val': 1.7965641297535496e-06, 'batch_size': 2061, 'optimizer': 'RMSprop'}.
2026-07-07 01:13:03,228 - experiment_functions - INFO - Early stopping at epoch 2600. Best Metrics: (0.0165270488795964, 0.0035968694793229866, 0.009475607112481913)
2026-07-07 01:13:03,315 - optuna.study.study - INFO - Trial 234 finished with values: [0.0165270488795964, 0.0035968694793229866, 0.009475607112481913] and parameters: {'n_layers': 3, 'embedding_dim': 64, 'lr': 0.0027021927373699207, 'lambda_val': 1.838250716065182e-06, 'batch_size': 3073, 'optimizer': 'Adam'}.
2026-07-07 01:14:52,672 - experiment_functions - INFO - Early stopping at epoch 1050. Best Metrics: (0.00028557743464192523, 7.313412989381304e-05, 0.00016499292372755862)
2026-07-07 01:14:52,744 - optuna.study.study - INFO - Trial 235 finished with values: [0.00028557743464192523, 7.313412989381304e-05, 0.00016499292372755862] and parameters: {'n_layers': 2, 'embedding_dim': 256, 'lr': 2.049887312909136e-05, 'lambda_val': 1.7965641297535496e-06, 'batch_size': 1270, 'optimizer': 'RMSprop'}.
2026-07-07 01:21:08,755 - optuna.study.study - INFO - Trial 236 finished with values: [0.01654304655301047, 0.003665254639743176, 0.009697270365638052] and parameters: {'n_layers': 3, 'embedding_dim': 128, 'lr': 0.006478106002947754, 'lambda_val': 1.9420463734703053e-05, 'batch_size': 3792, 'optimizer': 'RMSprop'}.
2026-07-07 01:21:57,377 - experiment_functions - INFO - Early stopping at epoch 500. Best Metrics: (0.00025278090207114443, 6.078680926239006e-05, 0.00014642068313141574)
2026-07-07 01:21:57,471 - optuna.study.study - INFO - Trial 237 finished with values: [0.00025278090207114443, 6.078680926239006e-05, 0.00014642068313141574] and parameters: {'n_layers': 1, 'embedding_dim': 256, 'lr': 0.006478106002947754, 'lambda_val': 1.838250716065182e-06, 'batch_size': 3792, 'optimizer': 'SGD'}.
2026-07-07 01:23:15,877 - experiment_functions - INFO - Early stopping at epoch 800. Best Metrics: (0.014467089398745296, 0.003272989761221815, 0.008456711110980914)
2026-07-07 01:23:15,966 - optuna.study.study - INFO - Trial 238 finished with values: [0.014467089398745296, 0.003272989761221815, 0.008456711110980914] and parameters: {'n_layers': 1, 'embedding_dim': 256, 'lr': 0.00938818303360569, 'lambda_val': 0.0012958789162359364, 'batch_size': 4084, 'optimizer': 'Adam'}.
2026-07-07 01:30:11,832 - optuna.study.study - INFO - Trial 239 finished with values: [0.014860128194569073, 0.003258742852800943, 0.008780826821735636] and parameters: {'n_layers': 2, 'embedding_dim': 256, 'lr': 0.00938818303360569, 'lambda_val': 2.28823110658976e-05, 'batch_size': 2026, 'optimizer': 'Adam'}.
2026-07-07 01:38:29,843 - optuna.study.study - INFO - Trial 240 finished with values: [0.01577704424436454, 0.003374617707957374, 0.009494538887874202] and parameters: {'n_layers': 4, 'embedding_dim': 256, 'lr': 0.01677700597951071, 'lambda_val': 3.765712134740546e-05, 'batch_size': 2026, 'optimizer': 'RMSprop'}.
2026-07-07 01:46:48,792 - optuna.study.study - INFO - Trial 241 finished with values: [0.01632805168067588, 0.0035484299906920203, 0.009531072794351723] and parameters: {'n_layers': 4, 'embedding_dim': 256, 'lr': 0.004800543051042116, 'lambda_val': 2.188780439699737e-06, 'batch_size': 3792, 'optimizer': 'RMSprop'}.
2026-07-07 01:55:07,155 - optuna.study.study - INFO - Trial 242 finished with values: [0.01740655598524296, 0.0036367608229014308, 0.01059348659415749] and parameters: {'n_layers': 4, 'embedding_dim': 256, 'lr': 0.01677700597951071, 'lambda_val': 1.7965641297535496e-06, 'batch_size': 2543, 'optimizer': 'RMSprop'}.
2026-07-07 02:02:01,885 - optuna.study.study - INFO - Trial 243 finished with values: [0.02150308367381951, 0.004582755542047376, 0.012473176714860413] and parameters: {'n_layers': 2, 'embedding_dim': 256, 'lr': 0.004800543051042116, 'lambda_val': 1.7965641297535496e-06, 'batch_size': 3098, 'optimizer': 'RMSprop'}.
2026-07-07 02:08:11,077 - optuna.study.study - INFO - Trial 244 finished with values: [0.014234935286887412, 0.0032093535702752505, 0.008430877704823286] and parameters: {'n_layers': 1, 'embedding_dim': 256, 'lr': 0.011688810705771883, 'lambda_val': 1.838250716065182e-06, 'batch_size': 3792, 'optimizer': 'RMSprop'}.
2026-07-07 02:13:19,670 - optuna.study.study - INFO - Trial 245 finished with values: [0.024753316406394856, 0.0054926580931937774, 0.014808385659680437] and parameters: {'n_layers': 1, 'embedding_dim': 32, 'lr': 0.002656669860795703, 'lambda_val': 1.838250716065182e-06, 'batch_size': 3792, 'optimizer': 'Adam'}.
2026-07-07 02:19:34,836 - optuna.study.study - INFO - Trial 246 finished with values: [0.015695827297145068, 0.0035550785479550938, 0.00916316152333058] and parameters: {'n_layers': 3, 'embedding_dim': 128, 'lr': 0.004322444050938931, 'lambda_val': 2.0602895450120936e-06, 'batch_size': 2134, 'optimizer': 'RMSprop'}.
2026-07-07 02:24:40,958 - optuna.study.study - INFO - Trial 247 finished with values: [0.02211488881829068, 0.0048914385578329505, 0.013080206608009202] and parameters: {'n_layers': 1, 'embedding_dim': 32, 'lr': 0.004800543051042116, 'lambda_val': 1.838250716065182e-06, 'batch_size': 2101, 'optimizer': 'Adam'}.
2026-07-07 02:25:25,936 - experiment_functions - INFO - Early stopping at epoch 500. Best Metrics: (0.00019715926269829834, 5.6987633683490685e-05, 0.00011438075715499328)
2026-07-07 02:25:26,280 - optuna.study.study - INFO - Trial 248 finished with values: [0.00019715926269829834, 5.6987633683490685e-05, 0.00011438075715499328] and parameters: {'n_layers': 3, 'embedding_dim': 64, 'lr': 1.4677092389736537e-05, 'lambda_val': 3.765712134740546e-05, 'batch_size': 2416, 'optimizer': 'Adam'}.
2026-07-07 02:31:37,846 - optuna.study.study - INFO - Trial 249 finished with values: [0.021257712342122214, 0.004596052656573524, 0.012654929594403739] and parameters: {'n_layers': 1, 'embedding_dim': 256, 'lr': 0.006576207134668591, 'lambda_val': 6.366112313580186e-06, 'batch_size': 3159, 'optimizer': 'RMSprop'}.
2026-07-07 02:37:51,821 - optuna.study.study - INFO - Trial 250 finished with values: [0.02703600814131534, 0.005774746879927057, 0.015841251437444807] and parameters: {'n_layers': 1, 'embedding_dim': 256, 'lr': 0.003261445844811169, 'lambda_val': 6.422984931404328e-06, 'batch_size': 3159, 'optimizer': 'RMSprop'}.
2026-07-07 02:40:36,220 - experiment_functions - INFO - Early stopping at epoch 2050. Best Metrics: (0.021702277983575657, 0.004743270710255874, 0.012672945532796487)
2026-07-07 02:40:36,298 - optuna.study.study - INFO - Trial 251 finished with values: [0.021702277983575657, 0.004743270710255874, 0.012672945532796487] and parameters: {'n_layers': 1, 'embedding_dim': 64, 'lr': 0.004800543051042116, 'lambda_val': 6.366112313580186e-06, 'batch_size': 3792, 'optimizer': 'Adam'}.
2026-07-07 02:41:48,647 - experiment_functions - INFO - Early stopping at epoch 600. Best Metrics: (0.006601888968893803, 0.0015139714681914023, 0.003963435682023808)
2026-07-07 02:41:48,757 - optuna.study.study - INFO - Trial 252 finished with values: [0.006601888968893803, 0.0015139714681914023, 0.003963435682023808] and parameters: {'n_layers': 3, 'embedding_dim': 256, 'lr': 0.00938818303360569, 'lambda_val': 0.0029486289012079516, 'batch_size': 3112, 'optimizer': 'Adam'}.
2026-07-07 02:48:02,946 - optuna.study.study - INFO - Trial 253 finished with values: [0.021014167554014047, 0.004526717702258609, 0.01255263158828808] and parameters: {'n_layers': 1, 'embedding_dim': 256, 'lr': 0.006478106002947754, 'lambda_val': 1.3821671642527758e-06, 'batch_size': 1894, 'optimizer': 'Adam'}.
2026-07-07 02:54:15,239 - optuna.study.study - INFO - Trial 254 finished with values: [0.0222045428570732, 0.004770814733202896, 0.013289969755278587] and parameters: {'n_layers': 1, 'embedding_dim': 256, 'lr': 0.006478106002947754, 'lambda_val': 4.230259051937931e-06, 'batch_size': 3098, 'optimizer': 'RMSprop'}.
2026-07-07 03:01:12,674 - optuna.study.study - INFO - Trial 255 finished with values: [0.017638687008072494, 0.003743137739110613, 0.010348941592310649] and parameters: {'n_layers': 2, 'embedding_dim': 256, 'lr': 0.006478106002947754, 'lambda_val': 2.465157645661239e-06, 'batch_size': 3792, 'optimizer': 'Adam'}.
2026-07-07 03:08:06,239 - optuna.study.study - INFO - Trial 256 finished with values: [0.019380810678094388, 0.0042560264422620295, 0.01147149055194771] and parameters: {'n_layers': 2, 'embedding_dim': 256, 'lr': 0.006576207134668591, 'lambda_val': 0.000319221155640928, 'batch_size': 3159, 'optimizer': 'RMSprop'}.
2026-07-07 03:14:19,541 - optuna.study.study - INFO - Trial 257 finished with values: [0.026717096902751793, 0.005653173261402276, 0.01561143312720653] and parameters: {'n_layers': 1, 'embedding_dim': 256, 'lr': 0.003261445844811169, 'lambda_val': 2.264107328414845e-06, 'batch_size': 3098, 'optimizer': 'RMSprop'}.
2026-07-07 03:15:08,437 - experiment_functions - INFO - Early stopping at epoch 550. Best Metrics: (0.004431519217741294, 0.001173945253879908, 0.0028950428233725334)
2026-07-07 03:15:08,522 - optuna.study.study - INFO - Trial 258 finished with values: [0.004431519217741294, 0.001173945253879908, 0.0028950428233725334] and parameters: {'n_layers': 1, 'embedding_dim': 128, 'lr': 0.05201485029971975, 'lambda_val': 1.838250716065182e-06, 'batch_size': 3792, 'optimizer': 'Adam'}.
2026-07-07 03:20:19,875 - optuna.study.study - INFO - Trial 259 finished with values: [0.013903096217362082, 0.003435404517219763, 0.008340697645803172] and parameters: {'n_layers': 1, 'embedding_dim': 64, 'lr': 0.0011428503604520406, 'lambda_val': 4.230259051937931e-06, 'batch_size': 1500, 'optimizer': 'RMSprop'}.
2026-07-07 03:25:35,325 - optuna.study.study - INFO - Trial 260 finished with values: [0.0200550152807371, 0.004666337404783162, 0.0121819979409037] and parameters: {'n_layers': 1, 'embedding_dim': 64, 'lr': 0.0015523967946049835, 'lambda_val': 6.366112313580186e-06, 'batch_size': 3098, 'optimizer': 'RMSprop'}.
2026-07-07 03:33:12,069 - optuna.study.study - INFO - Trial 261 finished with values: [0.020881264995886925, 0.0044022947020496556, 0.012203479391289691] and parameters: {'n_layers': 3, 'embedding_dim': 256, 'lr': 0.00938818303360569, 'lambda_val': 5.7152734605233486e-05, 'batch_size': 3098, 'optimizer': 'RMSprop'}.
2026-07-07 03:39:28,140 - optuna.study.study - INFO - Trial 262 finished with values: [0.023736239997491065, 0.005200121573618526, 0.014294470268051628] and parameters: {'n_layers': 1, 'embedding_dim': 256, 'lr': 0.004800543051042116, 'lambda_val': 2.465157645661239e-06, 'batch_size': 3112, 'optimizer': 'Adam'}.
2026-07-07 03:45:44,953 - optuna.study.study - INFO - Trial 263 finished with values: [0.02424582922446651, 0.0051393347643561346, 0.014399424301940586] and parameters: {'n_layers': 1, 'embedding_dim': 256, 'lr': 0.004800543051042116, 'lambda_val': 1.838250716065182e-06, 'batch_size': 3098, 'optimizer': 'Adam'}.
2026-07-07 03:50:53,846 - experiment_functions - INFO - Early stopping at epoch 3850. Best Metrics: (0.010657083772367798, 0.002526451759968087, 0.006175370026654197)
2026-07-07 03:50:53,937 - optuna.study.study - INFO - Trial 264 finished with values: [0.010657083772367798, 0.002526451759968087, 0.006175370026654197] and parameters: {'n_layers': 4, 'embedding_dim': 32, 'lr': 0.004800543051042116, 'lambda_val': 2.159554659550129e-06, 'batch_size': 2061, 'optimizer': 'RMSprop'}.
2026-07-07 03:57:06,554 - optuna.study.study - INFO - Trial 265 finished with values: [0.019395269176952057, 0.0042731227323670766, 0.011674319129876399] and parameters: {'n_layers': 1, 'embedding_dim': 256, 'lr': 0.007748940378927992, 'lambda_val': 1.7965641297535496e-06, 'batch_size': 3098, 'optimizer': 'RMSprop'}.
2026-07-07 03:57:52,976 - experiment_functions - INFO - Early stopping at epoch 550. Best Metrics: (0.0021878921915647644, 0.0005632277795718328, 0.0012956641635400385)
2026-07-07 03:57:53,376 - optuna.study.study - INFO - Trial 266 finished with values: [0.0021878921915647644, 0.0005632277795718328, 0.0012956641635400385] and parameters: {'n_layers': 3, 'embedding_dim': 32, 'lr': 0.07595317826706972, 'lambda_val': 2.188780439699737e-06, 'batch_size': 2416, 'optimizer': 'RMSprop'}.
2026-07-07 04:04:00,904 - experiment_functions - INFO - Early stopping at epoch 3700. Best Metrics: (0.011020001507439597, 0.0023782839123910114, 0.006317797580917809)
2026-07-07 04:04:00,989 - optuna.study.study - INFO - Trial 267 finished with values: [0.011020001507439597, 0.0023782839123910114, 0.006317797580917809] and parameters: {'n_layers': 4, 'embedding_dim': 128, 'lr': 0.00938818303360569, 'lambda_val': 4.230259051937931e-06, 'batch_size': 3098, 'optimizer': 'Adam'}.
