2026-07-08 23:01:12,812 - optuna.study.study - INFO - Trial 235 finished with values: [0.006303517678855543, 0.0017856125220827078, 0.00411590745121382] and parameters: {'n_layers': 4, 'embedding_dim': 128, 'lr': 0.0013152005063538942, 'lambda_val': 6.625860010406062e-06, 'batch_size': 3603, 'optimizer': 'RMSprop'}.
2026-07-08 23:02:46,196 - experiment_functions - INFO - Early stopping at epoch 900. Best Metrics: (0.0058296819889079275, 0.0015804570408221414, 0.003714344441008261)
2026-07-08 23:02:46,317 - optuna.study.study - INFO - Trial 236 finished with values: [0.0058296819889079275, 0.0015804570408221414, 0.003714344441008261] and parameters: {'n_layers': 3, 'embedding_dim': 256, 'lr': 0.0016459794241324855, 'lambda_val': 6.625860010406062e-06, 'batch_size': 3801, 'optimizer': 'RMSprop'}.
2026-07-08 23:08:00,729 - optuna.study.study - INFO - Trial 237 finished with values: [0.0046652093567484424, 0.001248978971563171, 0.0030269568698285568] and parameters: {'n_layers': 3, 'embedding_dim': 64, 'lr': 0.0005079724528508135, 'lambda_val': 4.325919770856533e-05, 'batch_size': 2965, 'optimizer': 'RMSprop'}.
2026-07-08 23:13:38,874 - optuna.study.study - INFO - Trial 238 finished with values: [0.006867387574053698, 0.001785612522082708, 0.004439756030462001] and parameters: {'n_layers': 4, 'embedding_dim': 96, 'lr': 0.0005079724528508135, 'lambda_val': 1.3798424398068006e-06, 'batch_size': 2412, 'optimizer': 'RMSprop'}.
2026-07-08 23:16:01,164 - experiment_functions - INFO - Early stopping at epoch 1300. Best Metrics: (0.005874968063388548, 0.0016250973538742093, 0.0037515881029580533)
2026-07-08 23:16:01,283 - optuna.study.study - INFO - Trial 239 finished with values: [0.005874968063388548, 0.0016250973538742093, 0.0037515881029580533] and parameters: {'n_layers': 4, 'embedding_dim': 256, 'lr': 0.0013152005063538942, 'lambda_val': 1.3798424398068006e-06, 'batch_size': 1562, 'optimizer': 'Adam'}.
2026-07-08 23:19:36,107 - experiment_functions - INFO - Early stopping at epoch 2700. Best Metrics: (0.005984127721514954, 0.0015871055980852154, 0.0037779118359777767)
2026-07-08 23:19:36,210 - optuna.study.study - INFO - Trial 240 finished with values: [0.005984127721514954, 0.0015871055980852154, 0.0037779118359777767] and parameters: {'n_layers': 3, 'embedding_dim': 64, 'lr': 0.001488688533444762, 'lambda_val': 6.625860010406062e-06, 'batch_size': 2055, 'optimizer': 'Adam'}.
2026-07-08 23:26:15,444 - optuna.study.study - INFO - Trial 241 finished with values: [0.005651851105806033, 0.0015196702315597515, 0.0037272390830527333] and parameters: {'n_layers': 3, 'embedding_dim': 256, 'lr': 0.0003947216765049812, 'lambda_val': 6.625860010406062e-06, 'batch_size': 3801, 'optimizer': 'RMSprop'}.
2026-07-08 23:31:17,774 - experiment_functions - INFO - Early stopping at epoch 3950. Best Metrics: (0.004311995469450563, 0.0011027107117755448, 0.0028342108304785403)
2026-07-08 23:31:17,896 - optuna.study.study - INFO - Trial 242 finished with values: [0.004311995469450563, 0.0011027107117755448, 0.0028342108304785403] and parameters: {'n_layers': 1, 'embedding_dim': 96, 'lr': 0.002634796822286242, 'lambda_val': 1.5963570066484359e-06, 'batch_size': 891, 'optimizer': 'RMSprop'}.
2026-07-08 23:33:05,422 - experiment_functions - INFO - Early stopping at epoch 1300. Best Metrics: (0.006576562603415467, 0.0018302528351347757, 0.004406273533842084)
2026-07-08 23:33:05,554 - optuna.study.study - INFO - Trial 243 finished with values: [0.006576562603415467, 0.0018302528351347757, 0.004406273533842084] and parameters: {'n_layers': 4, 'embedding_dim': 64, 'lr': 0.001488688533444762, 'lambda_val': 6.625860010406062e-06, 'batch_size': 2993, 'optimizer': 'RMSprop'}.
2026-07-08 23:34:12,651 - experiment_functions - INFO - Early stopping at epoch 750. Best Metrics: (0.005729593799622155, 0.0016269969416636593, 0.0037355791191496703)
2026-07-08 23:34:12,779 - optuna.study.study - INFO - Trial 244 finished with values: [0.005729593799622155, 0.0016269969416636593, 0.0037355791191496703] and parameters: {'n_layers': 4, 'embedding_dim': 96, 'lr': 0.002634796822286242, 'lambda_val': 8.982642030344512e-06, 'batch_size': 3801, 'optimizer': 'RMSprop'}.
2026-07-08 23:35:58,189 - experiment_functions - INFO - Early stopping at epoch 1150. Best Metrics: (0.006304049451363532, 0.001761867674714587, 0.0041885011760343475)
2026-07-08 23:35:58,295 - optuna.study.study - INFO - Trial 245 finished with values: [0.006304049451363532, 0.001761867674714587, 0.0041885011760343475] and parameters: {'n_layers': 4, 'embedding_dim': 128, 'lr': 0.0016459794241324855, 'lambda_val': 6.5939387363411675e-06, 'batch_size': 1934, 'optimizer': 'RMSprop'}.
2026-07-08 23:37:09,735 - experiment_functions - INFO - Early stopping at epoch 800. Best Metrics: (0.005221676586823471, 0.0014702809490340595, 0.003381341170290002)
2026-07-08 23:37:09,864 - optuna.study.study - INFO - Trial 246 finished with values: [0.005221676586823471, 0.0014702809490340595, 0.003381341170290002] and parameters: {'n_layers': 4, 'embedding_dim': 96, 'lr': 0.0028299651229841192, 'lambda_val': 4.325919770856533e-05, 'batch_size': 2727, 'optimizer': 'Adam'}.
2026-07-08 23:42:14,871 - optuna.study.study - INFO - Trial 247 finished with values: [0.007805565400286899, 0.002134186881446726, 0.004810261451273142] and parameters: {'n_layers': 4, 'embedding_dim': 32, 'lr': 0.0013152005063538942, 'lambda_val': 0.0010119023152848768, 'batch_size': 891, 'optimizer': 'RMSprop'}.
2026-07-08 23:44:09,244 - experiment_functions - INFO - Early stopping at epoch 1250. Best Metrics: (0.005969025477765147, 0.0016678380791368273, 0.0038686717164588204)
2026-07-08 23:44:09,564 - optuna.study.study - INFO - Trial 248 finished with values: [0.005969025477765147, 0.0016678380791368273, 0.0038686717164588204] and parameters: {'n_layers': 4, 'embedding_dim': 128, 'lr': 0.0016459794241324855, 'lambda_val': 6.494946904588344e-05, 'batch_size': 1562, 'optimizer': 'Adam'}.
2026-07-08 23:46:25,334 - experiment_functions - INFO - Early stopping at epoch 1250. Best Metrics: (0.0065333218736815055, 0.001818855308398078, 0.004262134904041371)
2026-07-08 23:46:25,465 - optuna.study.study - INFO - Trial 249 finished with values: [0.0065333218736815055, 0.001818855308398078, 0.004262134904041371] and parameters: {'n_layers': 4, 'embedding_dim': 256, 'lr': 0.0013152005063538942, 'lambda_val': 6.494946904588344e-05, 'batch_size': 1562, 'optimizer': 'RMSprop'}.
2026-07-08 23:47:36,690 - experiment_functions - INFO - Early stopping at epoch 800. Best Metrics: (0.005478710945632541, 0.001535816727770074, 0.0035071770137868313)
2026-07-08 23:47:36,815 - optuna.study.study - INFO - Trial 250 finished with values: [0.005478710945632541, 0.001535816727770074, 0.0035071770137868313] and parameters: {'n_layers': 4, 'embedding_dim': 96, 'lr': 0.0020140299216981693, 'lambda_val': 0.0010680861723322826, 'batch_size': 2412, 'optimizer': 'RMSprop'}.
2026-07-08 23:50:51,097 - experiment_functions - INFO - Early stopping at epoch 2400. Best Metrics: (0.0072961784925295, 0.001986968827764375, 0.004653890895261599)
2026-07-08 23:50:51,252 - optuna.study.study - INFO - Trial 251 finished with values: [0.0072961784925295, 0.001986968827764375, 0.004653890895261599] and parameters: {'n_layers': 4, 'embedding_dim': 64, 'lr': 0.001488688533444762, 'lambda_val': 6.625860010406062e-06, 'batch_size': 1562, 'optimizer': 'RMSprop'}.
2026-07-08 23:51:33,544 - experiment_functions - INFO - Early stopping at epoch 500. Best Metrics: (0.00021711150533978123, 6.268639705183975e-05, 0.00012019541449856874)
2026-07-08 23:51:33,658 - optuna.study.study - INFO - Trial 252 finished with values: [0.00021711150533978123, 6.268639705183975e-05, 0.00012019541449856874] and parameters: {'n_layers': 3, 'embedding_dim': 64, 'lr': 0.0009859128880233146, 'lambda_val': 6.625860010406062e-06, 'batch_size': 2976, 'optimizer': 'SGD'}.
2026-07-08 23:53:14,221 - experiment_functions - INFO - Early stopping at epoch 1150. Best Metrics: (0.006458072992320831, 0.0017903614915563322, 0.00422386946881097)
2026-07-08 23:53:14,412 - optuna.study.study - INFO - Trial 253 finished with values: [0.006458072992320831, 0.0017903614915563322, 0.00422386946881097] and parameters: {'n_layers': 4, 'embedding_dim': 96, 'lr': 0.0013152005063538942, 'lambda_val': 4.4424536151927375e-06, 'batch_size': 3801, 'optimizer': 'RMSprop'}.
2026-07-08 23:55:13,478 - experiment_functions - INFO - Early stopping at epoch 1250. Best Metrics: (0.0031258092989887324, 0.0008785593526204812, 0.0019780715931387396)
2026-07-08 23:55:13,627 - optuna.study.study - INFO - Trial 254 finished with values: [0.0031258092989887324, 0.0008785593526204812, 0.0019780715931387396] and parameters: {'n_layers': 2, 'embedding_dim': 256, 'lr': 0.0013152005063538942, 'lambda_val': 0.011378185122471516, 'batch_size': 1562, 'optimizer': 'RMSprop'}.
2026-07-08 23:58:33,830 - experiment_functions - INFO - Early stopping at epoch 2500. Best Metrics: (0.00024241892274907067, 6.078680926239006e-05, 0.00013236344789438963)
2026-07-08 23:58:34,158 - optuna.study.study - INFO - Trial 255 finished with values: [0.00024241892274907067, 6.078680926239006e-05, 0.00013236344789438963] and parameters: {'n_layers': 4, 'embedding_dim': 64, 'lr': 4.087113312235677e-05, 'lambda_val': 1.0684413344508431e-05, 'batch_size': 1655, 'optimizer': 'RMSprop'}.
2026-07-09 00:03:43,470 - experiment_functions - INFO - Early stopping at epoch 3850. Best Metrics: (0.006333321914261378, 0.0017381228273464658, 0.0040539239316571656)
2026-07-09 00:03:43,602 - optuna.study.study - INFO - Trial 256 finished with values: [0.006333321914261378, 0.0017381228273464658, 0.0040539239316571656] and parameters: {'n_layers': 4, 'embedding_dim': 64, 'lr': 0.0013152005063538942, 'lambda_val': 1.3798424398068006e-06, 'batch_size': 1562, 'optimizer': 'Adam'}.
2026-07-09 00:05:07,029 - experiment_functions - INFO - Early stopping at epoch 1000. Best Metrics: (0.005383032167275425, 0.0014588834222973614, 0.0033980235640852985)
2026-07-09 00:05:07,163 - optuna.study.study - INFO - Trial 257 finished with values: [0.005383032167275425, 0.0014588834222973614, 0.0033980235640852985] and parameters: {'n_layers': 4, 'embedding_dim': 64, 'lr': 0.0013152005063538942, 'lambda_val': 0.002047601427695139, 'batch_size': 3904, 'optimizer': 'Adam'}.
2026-07-09 00:10:21,033 - optuna.study.study - INFO - Trial 258 finished with values: [0.005428410968123369, 0.0013923978496666225, 0.0034204020948654635] and parameters: {'n_layers': 3, 'embedding_dim': 64, 'lr': 0.0005079724528508135, 'lambda_val': 4.325919770856533e-05, 'batch_size': 3285, 'optimizer': 'RMSprop'}.
2026-07-09 00:12:55,144 - experiment_functions - INFO - Early stopping at epoch 1700. Best Metrics: (0.0070573169853316905, 0.00201546264460612, 0.004666599160142948)
2026-07-09 00:12:55,337 - optuna.study.study - INFO - Trial 259 finished with values: [0.0070573169853316905, 0.00201546264460612, 0.004666599160142948] and parameters: {'n_layers': 4, 'embedding_dim': 128, 'lr': 0.0013152005063538942, 'lambda_val': 8.448240016837379e-05, 'batch_size': 1562, 'optimizer': 'RMSprop'}.
2026-07-09 00:17:25,636 - experiment_functions - INFO - Early stopping at epoch 3300. Best Metrics: (0.00034783521726717767, 7.218433599908821e-05, 0.00020916894204686627)
2026-07-09 00:17:25,785 - optuna.study.study - INFO - Trial 260 finished with values: [0.00034783521726717767, 7.218433599908821e-05, 0.00020916894204686627] and parameters: {'n_layers': 3, 'embedding_dim': 96, 'lr': 8.66521322152313e-05, 'lambda_val': 6.494946904588344e-05, 'batch_size': 3801, 'optimizer': 'RMSprop'}.
2026-07-09 00:21:54,667 - experiment_functions - INFO - Early stopping at epoch 3400. Best Metrics: (0.005783169709708889, 0.0015633607507170946, 0.0037362106797932514)
2026-07-09 00:21:54,774 - optuna.study.study - INFO - Trial 261 finished with values: [0.005783169709708889, 0.0015633607507170946, 0.0037362106797932514] and parameters: {'n_layers': 3, 'embedding_dim': 64, 'lr': 0.001488688533444762, 'lambda_val': 6.625860010406062e-06, 'batch_size': 1562, 'optimizer': 'Adam'}.
2026-07-09 00:24:28,776 - experiment_functions - INFO - Early stopping at epoch 1700. Best Metrics: (0.006846970924396856, 0.001872993560397394, 0.00451368812200192)
2026-07-09 00:24:28,891 - optuna.study.study - INFO - Trial 262 finished with values: [0.006846970924396856, 0.001872993560397394, 0.00451368812200192] and parameters: {'n_layers': 4, 'embedding_dim': 128, 'lr': 0.0013152005063538942, 'lambda_val': 5.005247503388632e-06, 'batch_size': 1562, 'optimizer': 'RMSprop'}.
2026-07-09 00:25:21,724 - experiment_functions - INFO - Early stopping at epoch 500. Best Metrics: (0.00029082567140216534, 7.123454210436335e-05, 0.00015032600355574115)
2026-07-09 00:25:21,832 - optuna.study.study - INFO - Trial 263 finished with values: [0.00029082567140216534, 7.123454210436335e-05, 0.00015032600355574115] and parameters: {'n_layers': 3, 'embedding_dim': 256, 'lr': 0.0013152005063538942, 'lambda_val': 6.494946904588344e-05, 'batch_size': 1562, 'optimizer': 'SGD'}.
2026-07-09 00:29:20,038 - experiment_functions - INFO - Early stopping at epoch 2350. Best Metrics: (0.005582491593211626, 0.001542465285033148, 0.003533259917735946)
2026-07-09 00:29:20,143 - optuna.study.study - INFO - Trial 264 finished with values: [0.005582491593211626, 0.001542465285033148, 0.003533259917735946] and parameters: {'n_layers': 3, 'embedding_dim': 256, 'lr': 0.001488688533444762, 'lambda_val': 1.3798424398068006e-06, 'batch_size': 1562, 'optimizer': 'Adam'}.
2026-07-09 00:35:03,310 - optuna.study.study - INFO - Trial 265 finished with values: [0.0025290328859331438, 0.0006297133522025722, 0.0016492323944948494] and parameters: {'n_layers': 1, 'embedding_dim': 256, 'lr': 0.0005079724528508135, 'lambda_val': 3.1068466230353927e-06, 'batch_size': 3285, 'optimizer': 'RMSprop'}.
2026-07-09 00:36:02,827 - experiment_functions - INFO - Early stopping at epoch 700. Best Metrics: (0.0043795061906434455, 0.0012774727884049162, 0.002919807362738957)
2026-07-09 00:36:02,955 - optuna.study.study - INFO - Trial 266 finished with values: [0.0043795061906434455, 0.0012774727884049162, 0.002919807362738957] and parameters: {'n_layers': 4, 'embedding_dim': 64, 'lr': 0.004462715603104516, 'lambda_val': 6.625860010406062e-06, 'batch_size': 2341, 'optimizer': 'RMSprop'}.
2026-07-09 00:39:03,605 - experiment_functions - INFO - Early stopping at epoch 2000. Best Metrics: (0.007156624961408752, 0.001972721919343503, 0.004608858060492957)
2026-07-09 00:39:03,727 - optuna.study.study - INFO - Trial 267 finished with values: [0.007156624961408752, 0.001972721919343503, 0.004608858060492957] and parameters: {'n_layers': 4, 'embedding_dim': 128, 'lr': 0.0009175905206639244, 'lambda_val': 6.625860010406062e-06, 'batch_size': 2341, 'optimizer': 'RMSprop'}.
2026-07-09 00:40:53,822 - experiment_functions - INFO - Early stopping at epoch 1000. Best Metrics: (0.006221805374077084, 0.0017381228273464658, 0.003966308873893666)
2026-07-09 00:40:53,948 - optuna.study.study - INFO - Trial 268 finished with values: [0.006221805374077084, 0.0017381228273464658, 0.003966308873893666] and parameters: {'n_layers': 4, 'embedding_dim': 256, 'lr': 0.0016459794241324855, 'lambda_val': 6.494946904588344e-05, 'batch_size': 1935, 'optimizer': 'RMSprop'}.
2026-07-09 00:44:18,346 - experiment_functions - INFO - Early stopping at epoch 2400. Best Metrics: (0.000348656393969021, 8.643124441996089e-05, 0.00020579484112320982)
2026-07-09 00:44:18,450 - optuna.study.study - INFO - Trial 269 finished with values: [0.000348656393969021, 8.643124441996089e-05, 0.00020579484112320982] and parameters: {'n_layers': 4, 'embedding_dim': 96, 'lr': 9.696210961945641e-05, 'lambda_val': 8.982642030344512e-06, 'batch_size': 3949, 'optimizer': 'Adam'}.
2026-07-09 00:46:39,433 - experiment_functions - INFO - Early stopping at epoch 1550. Best Metrics: (0.006031403986471143, 0.001749520354083164, 0.004026755596469975)
2026-07-09 00:46:39,568 - optuna.study.study - INFO - Trial 270 finished with values: [0.006031403986471143, 0.001749520354083164, 0.004026755596469975] and parameters: {'n_layers': 4, 'embedding_dim': 128, 'lr': 0.0013152005063538942, 'lambda_val': 0.0010119023152848768, 'batch_size': 891, 'optimizer': 'RMSprop'}.
2026-07-09 00:49:18,554 - experiment_functions - INFO - Early stopping at epoch 1450. Best Metrics: (0.005836974231859214, 0.001674486636399901, 0.0037731413319035396)
2026-07-09 00:49:18,658 - optuna.study.study - INFO - Trial 271 finished with values: [0.005836974231859214, 0.001674486636399901, 0.0037731413319035396] and parameters: {'n_layers': 4, 'embedding_dim': 256, 'lr': 0.0013152005063538942, 'lambda_val': 0.00011408095693043007, 'batch_size': 2350, 'optimizer': 'Adam'}.
2026-07-09 00:51:24,827 - experiment_functions - INFO - Early stopping at epoch 1450. Best Metrics: (0.00681235853570613, 0.0018748931481868437, 0.0045072476624013315)
2026-07-09 00:51:25,027 - optuna.study.study - INFO - Trial 272 finished with values: [0.00681235853570613, 0.0018748931481868437, 0.0045072476624013315] and parameters: {'n_layers': 4, 'embedding_dim': 96, 'lr': 0.0013152005063538942, 'lambda_val': 1.0684413344508431e-05, 'batch_size': 2341, 'optimizer': 'RMSprop'}.
2026-07-09 00:53:02,121 - experiment_functions - INFO - Early stopping at epoch 1100. Best Metrics: (0.006921292137081145, 0.0018929392321866156, 0.004491376049384726)
2026-07-09 00:53:02,243 - optuna.study.study - INFO - Trial 273 finished with values: [0.006921292137081145, 0.0018929392321866156, 0.004491376049384726] and parameters: {'n_layers': 4, 'embedding_dim': 96, 'lr': 0.0016459794241324855, 'lambda_val': 2.0431242153221654e-06, 'batch_size': 2412, 'optimizer': 'RMSprop'}.
2026-07-09 00:54:21,563 - experiment_functions - INFO - Early stopping at epoch 850. Best Metrics: (0.003898965920150342, 0.00103907452082898, 0.002487330371873791)
2026-07-09 00:54:21,691 - optuna.study.study - INFO - Trial 274 finished with values: [0.003898965920150342, 0.00103907452082898, 0.002487330371873791] and parameters: {'n_layers': 4, 'embedding_dim': 128, 'lr': 0.0013152005063538942, 'lambda_val': 0.008475154608617285, 'batch_size': 2341, 'optimizer': 'Adam'}.
2026-07-09 00:56:37,302 - experiment_functions - INFO - Early stopping at epoch 1650. Best Metrics: (0.006320046093358511, 0.0017343236517675669, 0.004094902020124022)
2026-07-09 00:56:37,435 - optuna.study.study - INFO - Trial 275 finished with values: [0.006320046093358511, 0.0017343236517675669, 0.004094902020124022] and parameters: {'n_layers': 4, 'embedding_dim': 64, 'lr': 0.0013152005063538942, 'lambda_val': 0.00011408095693043007, 'batch_size': 1686, 'optimizer': 'Adam'}.
2026-07-09 00:59:02,519 - experiment_functions - INFO - Early stopping at epoch 1600. Best Metrics: (0.006581343555938959, 0.0018274034534506013, 0.004260920401385512)
2026-07-09 00:59:02,669 - optuna.study.study - INFO - Trial 276 finished with values: [0.006581343555938959, 0.0018274034534506013, 0.004260920401385512] and parameters: {'n_layers': 4, 'embedding_dim': 128, 'lr': 0.0013152005063538942, 'lambda_val': 4.325919770856533e-05, 'batch_size': 2350, 'optimizer': 'RMSprop'}.
2026-07-09 01:00:54,282 - experiment_functions - INFO - Early stopping at epoch 1350. Best Metrics: (0.006368563421556597, 0.0017295746822939423, 0.00405044449994736)
2026-07-09 01:00:54,404 - optuna.study.study - INFO - Trial 277 finished with values: [0.006368563421556597, 0.0017295746822939423, 0.00405044449994736] and parameters: {'n_layers': 4, 'embedding_dim': 64, 'lr': 0.001488688533444762, 'lambda_val': 1.3798424398068006e-06, 'batch_size': 3014, 'optimizer': 'Adam'}.
2026-07-09 01:03:52,705 - experiment_functions - INFO - Early stopping at epoch 2050. Best Metrics: (0.0026877015040843617, 0.0007398894439906541, 0.0017821511303355428)
2026-07-09 01:03:52,839 - optuna.study.study - INFO - Trial 278 finished with values: [0.0026877015040843617, 0.0007398894439906541, 0.0017821511303355428] and parameters: {'n_layers': 1, 'embedding_dim': 256, 'lr': 0.001488688533444762, 'lambda_val': 0.006845800574823482, 'batch_size': 1710, 'optimizer': 'RMSprop'}.
2026-07-09 01:05:36,221 - experiment_functions - INFO - Early stopping at epoch 1250. Best Metrics: (0.005518635573367721, 0.0015092224987177784, 0.003635142274782245)
2026-07-09 01:05:36,346 - optuna.study.study - INFO - Trial 279 finished with values: [0.005518635573367721, 0.0015092224987177784, 0.003635142274782245] and parameters: {'n_layers': 4, 'embedding_dim': 64, 'lr': 0.0016459794241324855, 'lambda_val': 8.982642030344512e-06, 'batch_size': 3801, 'optimizer': 'Adam'}.
2026-07-09 01:06:41,891 - experiment_functions - INFO - Early stopping at epoch 700. Best Metrics: (0.0022516801721073156, 0.0006439602606234449, 0.0014217912794116045)
2026-07-09 01:06:42,814 - optuna.study.study - INFO - Trial 280 finished with values: [0.0022516801721073156, 0.0006439602606234449, 0.0014217912794116045] and parameters: {'n_layers': 4, 'embedding_dim': 128, 'lr': 0.002634796822286242, 'lambda_val': 0.031864222008479236, 'batch_size': 3285, 'optimizer': 'RMSprop'}.
2026-07-09 01:11:43,416 - optuna.study.study - INFO - Trial 281 finished with values: [0.0003243768866474481, 8.26320688410615e-05, 0.00017820547648405376] and parameters: {'n_layers': 4, 'embedding_dim': 32, 'lr': 8.01928930014995e-05, 'lambda_val': 2.0431242153221654e-06, 'batch_size': 3801, 'optimizer': 'RMSprop'}.
2026-07-09 01:18:47,919 - optuna.study.study - INFO - Trial 282 finished with values: [0.006731988232564441, 0.0018691943848184948, 0.004381584372806577] and parameters: {'n_layers': 4, 'embedding_dim': 256, 'lr': 0.0003664246620624996, 'lambda_val': 6.494946904588344e-05, 'batch_size': 4015, 'optimizer': 'RMSprop'}.
2026-07-09 01:20:00,917 - experiment_functions - INFO - Early stopping at epoch 650. Best Metrics: (0.005429080225668769, 0.001478829094086583, 0.003338503122037837)
