2026-07-07 04:09:19,210 - optuna.study.study - INFO - Trial 268 finished with values: [0.0047064851429641725, 0.0012394810326159223, 0.002893596908041703] and parameters: {'n_layers': 1, 'embedding_dim': 96, 'lr': 0.0005239946347764732, 'lambda_val': 1.838250716065182e-06, 'batch_size': 3098, 'optimizer': 'Adam'}.
2026-07-07 04:14:28,665 - optuna.study.study - INFO - Trial 269 finished with values: [0.013615082110807624, 0.003066884486066524, 0.00787476925678936] and parameters: {'n_layers': 2, 'embedding_dim': 32, 'lr': 0.006478106002947754, 'lambda_val': 2.465157645661239e-06, 'batch_size': 3098, 'optimizer': 'RMSprop'}.
2026-07-07 04:20:05,362 - optuna.study.study - INFO - Trial 270 finished with values: [0.021025462464110713, 0.004479228007522367, 0.012514568953280346] and parameters: {'n_layers': 1, 'embedding_dim': 128, 'lr': 0.006478106002947754, 'lambda_val': 1.3821671642527758e-06, 'batch_size': 2385, 'optimizer': 'Adam'}.
2026-07-07 04:26:21,469 - optuna.study.study - INFO - Trial 271 finished with values: [0.02217422796106406, 0.004616948122257469, 0.012907909392174675] and parameters: {'n_layers': 1, 'embedding_dim': 256, 'lr': 0.006478106002947754, 'lambda_val': 2.1139034944617854e-06, 'batch_size': 3792, 'optimizer': 'Adam'}.
2026-07-07 04:33:48,398 - optuna.study.study - INFO - Trial 272 finished with values: [0.0005200403728079791, 0.0001424690842087267, 0.0003285811365220888] and parameters: {'n_layers': 3, 'embedding_dim': 256, 'lr': 0.0001244639389197863, 'lambda_val': 0.00022317293869054554, 'batch_size': 1716, 'optimizer': 'RMSprop'}.
2026-07-07 04:38:19,475 - experiment_functions - INFO - Early stopping at epoch 3500. Best Metrics: (0.0223220545279157, 0.004853446802043957, 0.013198070033506712)
2026-07-07 04:38:19,548 - optuna.study.study - INFO - Trial 273 finished with values: [0.0223220545279157, 0.004853446802043957, 0.013198070033506712] and parameters: {'n_layers': 1, 'embedding_dim': 32, 'lr': 0.004800543051042116, 'lambda_val': 1.7583524641852027e-05, 'batch_size': 3112, 'optimizer': 'Adam'}.
2026-07-07 04:46:38,792 - optuna.study.study - INFO - Trial 274 finished with values: [0.018808505957354997, 0.00404042322815949, 0.010925550970146528] and parameters: {'n_layers': 4, 'embedding_dim': 256, 'lr': 0.006478106002947754, 'lambda_val': 1.838250716065182e-06, 'batch_size': 3098, 'optimizer': 'RMSprop'}.
2026-07-07 04:51:30,783 - experiment_functions - INFO - Early stopping at epoch 3100. Best Metrics: (0.021948557021991826, 0.00465209049636229, 0.012920606249943598)
2026-07-07 04:51:30,856 - optuna.study.study - INFO - Trial 275 finished with values: [0.021948557021991826, 0.00465209049636229, 0.012920606249943598] and parameters: {'n_layers': 1, 'embedding_dim': 256, 'lr': 0.006478106002947754, 'lambda_val': 1.7965641297535496e-06, 'batch_size': 3792, 'optimizer': 'Adam'}.
2026-07-07 04:56:50,089 - optuna.study.study - INFO - Trial 276 finished with values: [0.00821394494460818, 0.0019062363467127633, 0.004813758891210725] and parameters: {'n_layers': 4, 'embedding_dim': 32, 'lr': 0.004800543051042116, 'lambda_val': 1.838250716065182e-06, 'batch_size': 1354, 'optimizer': 'Adam'}.
2026-07-07 05:03:07,061 - optuna.study.study - INFO - Trial 277 finished with values: [0.024177773536098165, 0.005150732291092832, 0.014371117933069354] and parameters: {'n_layers': 1, 'embedding_dim': 256, 'lr': 0.004800543051042116, 'lambda_val': 1.838250716065182e-06, 'batch_size': 3112, 'optimizer': 'Adam'}.
2026-07-07 05:08:21,903 - optuna.study.study - INFO - Trial 278 finished with values: [0.022139641238527432, 0.004875292061622628, 0.0130412445508494] and parameters: {'n_layers': 1, 'embedding_dim': 64, 'lr': 0.003261445844811169, 'lambda_val': 0.0001042022208350098, 'batch_size': 1500, 'optimizer': 'RMSprop'}.
2026-07-07 05:09:38,790 - experiment_functions - INFO - Early stopping at epoch 950. Best Metrics: (0.00019996536957974504, 6.17366031571149e-05, 0.0001371821155552302)
2026-07-07 05:09:38,875 - optuna.study.study - INFO - Trial 279 finished with values: [0.00019996536957974504, 6.17366031571149e-05, 0.0001371821155552302] and parameters: {'n_layers': 3, 'embedding_dim': 32, 'lr': 1.088462110389967e-05, 'lambda_val': 1.838250716065182e-06, 'batch_size': 2416, 'optimizer': 'Adam'}.
2026-07-07 05:14:38,232 - optuna.study.study - INFO - Trial 280 finished with values: [0.0014635811709696695, 0.00038276693957411246, 0.0009697256847719823] and parameters: {'n_layers': 1, 'embedding_dim': 32, 'lr': 0.0003987688408180936, 'lambda_val': 1.7296101021931137e-06, 'batch_size': 3098, 'optimizer': 'RMSprop'}.
2026-07-07 05:20:50,110 - optuna.study.study - INFO - Trial 281 finished with values: [0.02208946594988985, 0.004689132458256559, 0.012869733396571457] and parameters: {'n_layers': 1, 'embedding_dim': 256, 'lr': 0.006478106002947754, 'lambda_val': 4.385438414340575e-05, 'batch_size': 3792, 'optimizer': 'RMSprop'}.
2026-07-07 05:27:45,880 - optuna.study.study - INFO - Trial 282 finished with values: [0.021380757921769022, 0.004553311931310906, 0.012378199643054226] and parameters: {'n_layers': 2, 'embedding_dim': 256, 'lr': 0.004800543051042116, 'lambda_val': 2.188780439699737e-06, 'batch_size': 3098, 'optimizer': 'RMSprop'}.
2026-07-07 05:28:47,706 - experiment_functions - INFO - Early stopping at epoch 700. Best Metrics: (0.008238926821788893, 0.0019708223315540526, 0.004872499739231833)
2026-07-07 05:28:47,784 - optuna.study.study - INFO - Trial 283 finished with values: [0.008238926821788893, 0.0019708223315540526, 0.004872499739231833] and parameters: {'n_layers': 1, 'embedding_dim': 128, 'lr': 0.02305442772701557, 'lambda_val': 1.838250716065182e-06, 'batch_size': 3098, 'optimizer': 'Adam'}.
2026-07-07 05:32:24,826 - experiment_functions - INFO - Early stopping at epoch 2100. Best Metrics: (0.00029057215998449067, 6.933495431491367e-05, 0.00015918853691328065)
2026-07-07 05:32:24,919 - optuna.study.study - INFO - Trial 284 finished with values: [0.00029057215998449067, 6.933495431491367e-05, 0.00015918853691328065] and parameters: {'n_layers': 2, 'embedding_dim': 256, 'lr': 0.000122450075452455, 'lambda_val': 2.099676855482031e-05, 'batch_size': 3792, 'optimizer': 'Adam'}.
2026-07-07 05:37:40,415 - optuna.study.study - INFO - Trial 285 finished with values: [0.01870225287739735, 0.0041059590068955034, 0.011000217234878948] and parameters: {'n_layers': 1, 'embedding_dim': 64, 'lr': 0.006576207134668591, 'lambda_val': 6.366112313580186e-06, 'batch_size': 3063, 'optimizer': 'RMSprop'}.
2026-07-07 05:44:35,838 - optuna.study.study - INFO - Trial 286 finished with values: [0.020687748917740303, 0.004468780274680394, 0.012076216596328123] and parameters: {'n_layers': 2, 'embedding_dim': 256, 'lr': 0.0038500277134463252, 'lambda_val': 2.465157645661239e-06, 'batch_size': 3183, 'optimizer': 'RMSprop'}.
2026-07-07 05:48:57,858 - experiment_functions - INFO - Early stopping at epoch 3300. Best Metrics: (0.0003728208672873705, 9.687897726193417e-05, 0.0002473849638758088)
2026-07-07 05:48:57,936 - optuna.study.study - INFO - Trial 287 finished with values: [0.0003728208672873705, 9.687897726193417e-05, 0.0002473849638758088] and parameters: {'n_layers': 1, 'embedding_dim': 96, 'lr': 0.0002119187498711758, 'lambda_val': 2.465157645661239e-06, 'batch_size': 3792, 'optimizer': 'Adam'}.
2026-07-07 05:55:15,595 - optuna.study.study - INFO - Trial 288 finished with values: [0.025783621550077525, 0.00559713542161351, 0.015549783899859866] and parameters: {'n_layers': 1, 'embedding_dim': 256, 'lr': 0.002656669860795703, 'lambda_val': 0.000319221155640928, 'batch_size': 3112, 'optimizer': 'Adam'}.
2026-07-07 06:01:24,997 - optuna.study.study - INFO - Trial 289 finished with values: [0.020493630507898215, 0.004567558839731778, 0.012017226216104961] and parameters: {'n_layers': 1, 'embedding_dim': 256, 'lr': 0.003261445844811169, 'lambda_val': 2.465157645661239e-06, 'batch_size': 662, 'optimizer': 'RMSprop'}.
2026-07-07 06:07:37,495 - optuna.study.study - INFO - Trial 290 finished with values: [0.021465111694587008, 0.004780312672150144, 0.012615137100000758] and parameters: {'n_layers': 1, 'embedding_dim': 256, 'lr': 0.006478106002947754, 'lambda_val': 0.00037048749559460834, 'batch_size': 3792, 'optimizer': 'RMSprop'}.
2026-07-07 06:13:05,843 - experiment_functions - INFO - Early stopping at epoch 3300. Best Metrics: (0.010263361761008123, 0.0023051497824971984, 0.005953871889331169)
2026-07-07 06:13:05,930 - optuna.study.study - INFO - Trial 291 finished with values: [0.010263361761008123, 0.0023051497824971984, 0.005953871889331169] and parameters: {'n_layers': 4, 'embedding_dim': 128, 'lr': 0.00938818303360569, 'lambda_val': 3.765712134740546e-05, 'batch_size': 2385, 'optimizer': 'Adam'}.
2026-07-07 06:18:39,015 - optuna.study.study - INFO - Trial 292 finished with values: [0.013950505255305366, 0.003344224303326179, 0.008248022832518367] and parameters: {'n_layers': 1, 'embedding_dim': 128, 'lr': 0.006478106002947754, 'lambda_val': 0.005480563605660439, 'batch_size': 3792, 'optimizer': 'RMSprop'}.
2026-07-07 06:24:04,449 - optuna.study.study - INFO - Trial 293 finished with values: [0.01896147109782214, 0.00418764128184184, 0.011309539631755084] and parameters: {'n_layers': 1, 'embedding_dim': 96, 'lr': 0.006478106002947754, 'lambda_val': 6.137513095321998e-05, 'batch_size': 3112, 'optimizer': 'RMSprop'}.
2026-07-07 06:31:00,023 - optuna.study.study - INFO - Trial 294 finished with values: [0.02207388893344861, 0.004701479778887982, 0.012942232535453601] and parameters: {'n_layers': 2, 'embedding_dim': 256, 'lr': 0.006478106002947754, 'lambda_val': 5.7152734605233486e-05, 'batch_size': 3098, 'optimizer': 'RMSprop'}.
2026-07-07 06:37:13,762 - optuna.study.study - INFO - Trial 295 finished with values: [0.024327228601529353, 0.0052343141538286194, 0.014378210700719906] and parameters: {'n_layers': 1, 'embedding_dim': 256, 'lr': 0.004800543051042116, 'lambda_val': 2.465157645661239e-06, 'batch_size': 3112, 'optimizer': 'RMSprop'}.
2026-07-07 06:42:21,238 - optuna.study.study - INFO - Trial 296 finished with values: [0.021364072035123728, 0.004684383488782934, 0.012680710384524592] and parameters: {'n_layers': 1, 'embedding_dim': 32, 'lr': 0.004800543051042116, 'lambda_val': 1.838250716065182e-06, 'batch_size': 2101, 'optimizer': 'Adam'}.
2026-07-07 06:45:45,122 - experiment_functions - INFO - Early stopping at epoch 2150. Best Metrics: (0.019492646082594163, 0.0042085367475257875, 0.011501989817213367)
2026-07-07 06:45:45,193 - optuna.study.study - INFO - Trial 297 finished with values: [0.019492646082594163, 0.0042085367475257875, 0.011501989817213367] and parameters: {'n_layers': 1, 'embedding_dim': 256, 'lr': 0.006478106002947754, 'lambda_val': 0.000382035437476243, 'batch_size': 3792, 'optimizer': 'Adam'}.
2026-07-07 06:51:22,979 - optuna.study.study - INFO - Trial 298 finished with values: [0.027007414950300394, 0.0057652489409798086, 0.01601948366543104] and parameters: {'n_layers': 1, 'embedding_dim': 128, 'lr': 0.002656669860795703, 'lambda_val': 6.268651738501626e-05, 'batch_size': 3792, 'optimizer': 'RMSprop'}.
2026-07-07 06:52:08,163 - experiment_functions - INFO - Early stopping at epoch 500. Best Metrics: (0.0001763768812027179, 5.413825199931615e-05, 0.0001059045652184731)
2026-07-07 06:52:08,252 - optuna.study.study - INFO - Trial 299 finished with values: [0.0001763768812027179, 5.413825199931615e-05, 0.0001059045652184731] and parameters: {'n_layers': 2, 'embedding_dim': 96, 'lr': 0.007748940378927992, 'lambda_val': 1.7965641297535496e-06, 'batch_size': 989, 'optimizer': 'SGD'}.
2026-07-07 06:52:08,267 - root - INFO - Selected Trial 298 based on Max ndcg: 0.0160
2026-07-07 06:52:08,267 - root - INFO - Associated Recall: 0.0270
2026-07-07 06:52:08,267 - experiment_functions - INFO - Training the best model ... for e_amazon_1c1dcs_rand5
2026-07-07 06:57:49,218 - root - INFO - **** Training e_amazon_1c2dcs
2026-07-07 06:57:49,219 - root - INFO -   ** 2-Dominant stats:
2026-07-07 06:57:49,219 - root - INFO -   ** Finding the dominant set:
2026-07-08 03:33:38,921 - root - INFO -   ** Getting the trainable edges:
2026-07-08 03:33:39,001 - helper_functions - INFO -      Number of nodes: 22204
2026-07-08 03:33:39,001 - helper_functions - INFO -      Ratio: 0.15393574686984374
2026-07-08 03:33:39,001 - helper_functions - INFO -      Number of unique users: 6839
2026-07-08 03:33:39,001 - helper_functions - INFO -      Number of unique items: 15365
2026-07-08 03:33:39,001 - helper_functions - INFO -      Total dominant set edge: 191695
2026-07-08 03:33:39,001 - helper_functions - INFO -      Trainable edges: 153356.0
2026-07-08 03:33:39,118 - root - INFO -   **** Getting 191695 dominant set edges
2026-07-08 03:33:39,235 - optuna.storages._rdb.storage - INFO - A new study created in RDB with name: Study_e_amazon_1c2dcs_strict
2026-07-08 03:35:17,305 - experiment_functions - INFO - Early stopping at epoch 1300. Best Metrics: (0.0035695785446832216, 0.0011938909256691299, 0.0024144807792525324)
2026-07-08 03:35:17,406 - optuna.study.study - INFO - Trial 0 finished with values: [0.0035695785446832216, 0.0011938909256691299, 0.0024144807792525324] and parameters: {'n_layers': 1, 'embedding_dim': 64, 'lr': 0.0007398611586122253, 'lambda_val': 0.0013552584940860833, 'batch_size': 1930, 'optimizer': 'RMSprop'}.
2026-07-08 03:36:07,190 - experiment_functions - INFO - Early stopping at epoch 500. Best Metrics: (0.00020227035234247562, 5.7937427578215534e-05, 0.00011565943880255902)
2026-07-08 03:36:07,273 - optuna.study.study - INFO - Trial 1 finished with values: [0.00020227035234247562, 5.7937427578215534e-05, 0.00011565943880255902] and parameters: {'n_layers': 3, 'embedding_dim': 256, 'lr': 0.00010986064829578726, 'lambda_val': 0.0639078082605272, 'batch_size': 2380, 'optimizer': 'SGD'}.
2026-07-08 03:36:47,624 - experiment_functions - INFO - Early stopping at epoch 500. Best Metrics: (0.00019010281108915926, 5.413825199931615e-05, 0.00011167602419691348)
2026-07-08 03:36:47,698 - optuna.study.study - INFO - Trial 2 finished with values: [0.00019010281108915926, 5.413825199931615e-05, 0.00011167602419691348] and parameters: {'n_layers': 1, 'embedding_dim': 64, 'lr': 0.008715727859634363, 'lambda_val': 7.294825670791652e-06, 'batch_size': 1132, 'optimizer': 'SGD'}.
2026-07-08 03:37:35,341 - experiment_functions - INFO - Early stopping at epoch 500. Best Metrics: (0.00022424571109980052, 6.458598484128946e-05, 0.00015455692933475764)
2026-07-08 03:37:35,421 - optuna.study.study - INFO - Trial 3 finished with values: [0.00022424571109980052, 6.458598484128946e-05, 0.00015455692933475764] and parameters: {'n_layers': 2, 'embedding_dim': 256, 'lr': 0.06848262302681386, 'lambda_val': 0.0001739882810012065, 'batch_size': 2857, 'optimizer': 'SGD'}.
2026-07-08 03:38:27,720 - experiment_functions - INFO - Early stopping at epoch 650. Best Metrics: (0.003251844244101038, 0.001229983093668674, 0.0024438277661437986)
2026-07-08 03:38:27,799 - optuna.study.study - INFO - Trial 4 finished with values: [0.003251844244101038, 0.001229983093668674, 0.0024438277661437986] and parameters: {'n_layers': 1, 'embedding_dim': 64, 'lr': 0.0031808570812741697, 'lambda_val': 0.00044891351853285386, 'batch_size': 3820, 'optimizer': 'Adam'}.
2026-07-08 03:39:14,549 - experiment_functions - INFO - Early stopping at epoch 550. Best Metrics: (0.0010292031587621623, 0.0004872442679938454, 0.0007363211377451435)
2026-07-08 03:39:14,638 - optuna.study.study - INFO - Trial 5 finished with values: [0.0010292031587621623, 0.0004872442679938454, 0.0007363211377451435] and parameters: {'n_layers': 1, 'embedding_dim': 128, 'lr': 0.0079102673926836, 'lambda_val': 0.025405452939105753, 'batch_size': 2755, 'optimizer': 'Adam'}.
2026-07-08 03:44:34,049 - optuna.study.study - INFO - Trial 6 finished with values: [0.0003507624819913851, 8.07324810516118e-05, 0.00020860306656065095] and parameters: {'n_layers': 2, 'embedding_dim': 128, 'lr': 5.432222343143515e-05, 'lambda_val': 0.0022862633692624606, 'batch_size': 2296, 'optimizer': 'RMSprop'}.
2026-07-08 03:45:14,997 - experiment_functions - INFO - Early stopping at epoch 500. Best Metrics: (0.00021652196393176965, 6.36361909465646e-05, 0.00013702271956638742)
2026-07-08 03:45:15,083 - optuna.study.study - INFO - Trial 7 finished with values: [0.00021652196393176965, 6.36361909465646e-05, 0.00013702271956638742] and parameters: {'n_layers': 4, 'embedding_dim': 32, 'lr': 0.0006747030870563427, 'lambda_val': 0.012131730144822283, 'batch_size': 2298, 'optimizer': 'SGD'}.
2026-07-08 03:46:03,840 - experiment_functions - INFO - Early stopping at epoch 550. Best Metrics: (0.0009217054755026039, 0.0003134319852591988, 0.0005971506431380027)
2026-07-08 03:46:03,922 - optuna.study.study - INFO - Trial 8 finished with values: [0.0009217054755026039, 0.0003134319852591988, 0.0005971506431380027] and parameters: {'n_layers': 4, 'embedding_dim': 96, 'lr': 0.0011108364748811956, 'lambda_val': 1.3187714692785522e-06, 'batch_size': 3456, 'optimizer': 'RMSprop'}.
2026-07-08 03:46:51,298 - experiment_functions - INFO - Early stopping at epoch 600. Best Metrics: (0.0002470058282587694, 7.028474820963851e-05, 0.00014063547673455603)
2026-07-08 03:46:51,380 - optuna.study.study - INFO - Trial 9 finished with values: [0.0002470058282587694, 7.028474820963851e-05, 0.00014063547673455603] and parameters: {'n_layers': 1, 'embedding_dim': 32, 'lr': 0.00016598679874195863, 'lambda_val': 0.0200195782622266, 'batch_size': 2630, 'optimizer': 'Adam'}.
2026-07-08 03:50:19,149 - experiment_functions - INFO - Early stopping at epoch 2500. Best Metrics: (0.0006481846242347586, 0.00040556199304750873, 0.0006110446096025733)
2026-07-08 03:50:19,271 - optuna.study.study - INFO - Trial 10 finished with values: [0.0006481846242347586, 0.00040556199304750873, 0.0006110446096025733] and parameters: {'n_layers': 4, 'embedding_dim': 96, 'lr': 0.02031682350129153, 'lambda_val': 0.00015098129117324614, 'batch_size': 3538, 'optimizer': 'Adam'}.
2026-07-08 03:51:01,047 - experiment_functions - INFO - Early stopping at epoch 500. Best Metrics: (0.00017443204868647534, 4.9389282525691926e-05, 9.557480034264462e-05)
2026-07-08 03:51:01,145 - optuna.study.study - INFO - Trial 11 finished with values: [0.00017443204868647534, 4.9389282525691926e-05, 9.557480034264462e-05] and parameters: {'n_layers': 3, 'embedding_dim': 64, 'lr': 0.05359898882565773, 'lambda_val': 0.0006870822029075707, 'batch_size': 3698, 'optimizer': 'SGD'}.
2026-07-08 03:51:44,365 - experiment_functions - INFO - Early stopping at epoch 500. Best Metrics: (0.00018240331702049014, 5.223866420986646e-05, 0.0001012656451778871)
2026-07-08 03:51:44,450 - optuna.study.study - INFO - Trial 12 finished with values: [0.00018240331702049014, 5.223866420986646e-05, 0.0001012656451778871] and parameters: {'n_layers': 2, 'embedding_dim': 128, 'lr': 0.00022952011606630214, 'lambda_val': 2.37643325937073e-06, 'batch_size': 3801, 'optimizer': 'SGD'}.
2026-07-08 03:52:26,417 - experiment_functions - INFO - Early stopping at epoch 500. Best Metrics: (0.00023441288508831588, 5.8887221472940384e-05, 0.00014867242998236604)
2026-07-08 03:52:26,511 - optuna.study.study - INFO - Trial 13 finished with values: [0.00023441288508831588, 5.8887221472940384e-05, 0.00014867242998236604] and parameters: {'n_layers': 3, 'embedding_dim': 64, 'lr': 0.003811211152809902, 'lambda_val': 0.08879480022987277, 'batch_size': 1772, 'optimizer': 'SGD'}.
2026-07-08 03:53:16,627 - experiment_functions - INFO - Early stopping at epoch 500. Best Metrics: (0.00019835122791829007, 5.128887031514162e-05, 0.00012337908321391602)
2026-07-08 03:53:16,700 - optuna.study.study - INFO - Trial 14 finished with values: [0.00019835122791829007, 5.128887031514162e-05, 0.00012337908321391602] and parameters: {'n_layers': 3, 'embedding_dim': 256, 'lr': 0.0013540853599400065, 'lambda_val': 0.0004296871397940581, 'batch_size': 2309, 'optimizer': 'SGD'}.
2026-07-08 03:55:11,965 - experiment_functions - INFO - Early stopping at epoch 1550. Best Metrics: (0.00023673711587966336, 6.36361909465646e-05, 0.0001357154790654386)
2026-07-08 03:55:12,048 - optuna.study.study - INFO - Trial 15 finished with values: [0.00023673711587966336, 6.36361909465646e-05, 0.0001357154790654386] and parameters: {'n_layers': 1, 'embedding_dim': 32, 'lr': 3.017174867650392e-05, 'lambda_val': 1.3679427856170778e-05, 'batch_size': 1585, 'optimizer': 'Adam'}.
2026-07-08 03:55:53,057 - experiment_functions - INFO - Early stopping at epoch 500. Best Metrics: (0.00017593702457704792, 5.223866420986646e-05, 0.00011420579281960365)
2026-07-08 03:55:53,357 - optuna.study.study - INFO - Trial 16 finished with values: [0.00017593702457704792, 5.223866420986646e-05, 0.00011420579281960365] and parameters: {'n_layers': 3, 'embedding_dim': 32, 'lr': 0.0014074030292395231, 'lambda_val': 2.8860755756906057e-05, 'batch_size': 2656, 'optimizer': 'SGD'}.
2026-07-08 04:00:28,476 - experiment_functions - INFO - Early stopping at epoch 3500. Best Metrics: (0.0007349338443953178, 0.0004976920008358186, 0.0007262621796273829)
2026-07-08 04:00:28,549 - optuna.study.study - INFO - Trial 17 finished with values: [0.0007349338443953178, 0.0004976920008358186, 0.0007262621796273829] and parameters: {'n_layers': 2, 'embedding_dim': 96, 'lr': 0.013197525752935474, 'lambda_val': 0.0005735534363448313, 'batch_size': 3332, 'optimizer': 'Adam'}.
2026-07-08 04:01:41,850 - experiment_functions - INFO - Early stopping at epoch 850. Best Metrics: (0.0007677489164190655, 0.00032577930589062175, 0.0005815385834890168)
