2026-07-05 00:49:34,745 - optuna.study.study - INFO - Trial 108 finished with values: [0.00032752571292285644, 8.928062610413543e-05, 0.00018548966694809926] and parameters: {'n_layers': 2, 'embedding_dim': 32, 'lr': 0.00019237069575836737, 'lambda_val': 0.00037674227085943596, 'batch_size': 2137, 'optimizer': 'RMSprop'}.
2026-07-05 00:56:29,338 - optuna.study.study - INFO - Trial 109 finished with values: [0.013407149843741287, 0.003276788936800715, 0.008077597895883875] and parameters: {'n_layers': 2, 'embedding_dim': 256, 'lr': 0.0010295843799712518, 'lambda_val': 0.00037674227085943596, 'batch_size': 623, 'optimizer': 'Adam'}.
2026-07-05 00:58:19,747 - experiment_functions - INFO - Early stopping at epoch 1350. Best Metrics: (0.006555383728019508, 0.0014617328039815357, 0.003818500694054196)
2026-07-05 00:58:19,851 - optuna.study.study - INFO - Trial 110 finished with values: [0.006555383728019508, 0.0014617328039815357, 0.003818500694054196] and parameters: {'n_layers': 4, 'embedding_dim': 32, 'lr': 0.004313984522769102, 'lambda_val': 0.0035329079623473226, 'batch_size': 3494, 'optimizer': 'Adam'}.
2026-07-05 01:04:15,339 - optuna.study.study - INFO - Trial 111 finished with values: [0.013747575221956356, 0.0030393404631195043, 0.007802726141248556] and parameters: {'n_layers': 3, 'embedding_dim': 96, 'lr': 0.003969600055009677, 'lambda_val': 2.9920385603702593e-06, 'batch_size': 2251, 'optimizer': 'Adam'}.
2026-07-05 01:10:25,970 - optuna.study.study - INFO - Trial 112 finished with values: [0.013226616732417379, 0.002930114165226146, 0.0075940217043141784] and parameters: {'n_layers': 4, 'embedding_dim': 96, 'lr': 0.0016013137270230607, 'lambda_val': 1.4115609594122773e-06, 'batch_size': 2132, 'optimizer': 'RMSprop'}.
2026-07-05 01:16:38,073 - optuna.study.study - INFO - Trial 113 finished with values: [0.012877947143009024, 0.0030098968523830333, 0.007649193320993916] and parameters: {'n_layers': 1, 'embedding_dim': 256, 'lr': 0.010950652965873981, 'lambda_val': 0.0023013643954001, 'batch_size': 1171, 'optimizer': 'Adam'}.
2026-07-05 01:22:11,392 - optuna.study.study - INFO - Trial 114 finished with values: [0.012238366501274049, 0.0029595577759626165, 0.00736954661535567] and parameters: {'n_layers': 3, 'embedding_dim': 64, 'lr': 0.0009960690196132256, 'lambda_val': 5.01869493536842e-05, 'batch_size': 623, 'optimizer': 'Adam'}.
2026-07-05 01:27:12,819 - optuna.study.study - INFO - Trial 115 finished with values: [0.011125780410827514, 0.0028360845696483866, 0.006957425667025697] and parameters: {'n_layers': 1, 'embedding_dim': 32, 'lr': 0.0015091555359142122, 'lambda_val': 1.1487538529008038e-05, 'batch_size': 953, 'optimizer': 'Adam'}.
2026-07-05 01:31:52,719 - experiment_functions - INFO - Early stopping at epoch 3150. Best Metrics: (0.01353679267506566, 0.002887373439963528, 0.008118047778448743)
2026-07-05 01:31:52,805 - optuna.study.study - INFO - Trial 116 finished with values: [0.01353679267506566, 0.002887373439963528, 0.008118047778448743] and parameters: {'n_layers': 3, 'embedding_dim': 96, 'lr': 0.01945737514319542, 'lambda_val': 1.1407948092996293e-06, 'batch_size': 2251, 'optimizer': 'RMSprop'}.
2026-07-05 01:32:47,733 - experiment_functions - INFO - Early stopping at epoch 550. Best Metrics: (0.004130029711894939, 0.0010571206048287523, 0.002507481393369747)
2026-07-05 01:32:47,855 - optuna.study.study - INFO - Trial 117 finished with values: [0.004130029711894939, 0.0010571206048287523, 0.002507481393369747] and parameters: {'n_layers': 3, 'embedding_dim': 128, 'lr': 0.010950652965873981, 'lambda_val': 0.008088588647389221, 'batch_size': 3323, 'optimizer': 'Adam'}.
2026-07-05 01:33:30,442 - experiment_functions - INFO - Early stopping at epoch 500. Best Metrics: (0.00019791504734152505, 5.128887031514162e-05, 0.00013223800527932964)
2026-07-05 01:33:30,543 - optuna.study.study - INFO - Trial 118 finished with values: [0.00019791504734152505, 5.128887031514162e-05, 0.00013223800527932964] and parameters: {'n_layers': 1, 'embedding_dim': 96, 'lr': 0.01945737514319542, 'lambda_val': 2.9920385603702593e-06, 'batch_size': 623, 'optimizer': 'SGD'}.
2026-07-05 01:41:49,244 - optuna.study.study - INFO - Trial 119 finished with values: [0.014652629899963528, 0.0032236004786961236, 0.008580309863018009] and parameters: {'n_layers': 4, 'embedding_dim': 256, 'lr': 0.0010295843799712518, 'lambda_val': 7.045045135561742e-06, 'batch_size': 2808, 'optimizer': 'RMSprop'}.
2026-07-05 01:46:50,597 - optuna.study.study - INFO - Trial 120 finished with values: [0.009324498445971054, 0.00232319586649697, 0.00551755338392314] and parameters: {'n_layers': 1, 'embedding_dim': 32, 'lr': 0.005762844285462508, 'lambda_val': 0.012560198721464461, 'batch_size': 2149, 'optimizer': 'RMSprop'}.
2026-07-05 01:52:48,117 - experiment_functions - INFO - Early stopping at epoch 3850. Best Metrics: (0.003415978756902586, 0.0009402959557775963, 0.002076282462872811)
2026-07-05 01:52:48,195 - optuna.study.study - INFO - Trial 121 finished with values: [0.003415978756902586, 0.0009402959557775963, 0.002076282462872811] and parameters: {'n_layers': 3, 'embedding_dim': 128, 'lr': 0.0009960690196132256, 'lambda_val': 0.02759173687124737, 'batch_size': 1046, 'optimizer': 'Adam'}.
2026-07-05 01:58:00,042 - optuna.study.study - INFO - Trial 122 finished with values: [0.011137394719587836, 0.0027790969359648954, 0.006837387498305546] and parameters: {'n_layers': 1, 'embedding_dim': 64, 'lr': 0.0007561669333504839, 'lambda_val': 1.5624132374141575e-06, 'batch_size': 3346, 'optimizer': 'Adam'}.
2026-07-05 02:04:18,142 - optuna.study.study - INFO - Trial 123 finished with values: [0.02511849599260706, 0.005400528085405467, 0.01513664190892315] and parameters: {'n_layers': 1, 'embedding_dim': 256, 'lr': 0.0032934455374620674, 'lambda_val': 4.331327481478862e-06, 'batch_size': 3931, 'optimizer': 'Adam'}.
2026-07-05 02:10:12,846 - optuna.study.study - INFO - Trial 124 finished with values: [0.01265383255537736, 0.003035541287540604, 0.00751601469313712] and parameters: {'n_layers': 2, 'embedding_dim': 128, 'lr': 0.008715315659881847, 'lambda_val': 0.0023013643954001, 'batch_size': 2864, 'optimizer': 'RMSprop'}.
2026-07-05 02:11:02,955 - experiment_functions - INFO - Early stopping at epoch 600. Best Metrics: (0.004375332610074412, 0.0012147863913530765, 0.0027078786009434564)
2026-07-05 02:11:03,040 - optuna.study.study - INFO - Trial 125 finished with values: [0.004375332610074412, 0.0012147863913530765, 0.0027078786009434564] and parameters: {'n_layers': 1, 'embedding_dim': 64, 'lr': 0.03509621169937048, 'lambda_val': 6.047949750223317e-05, 'batch_size': 2258, 'optimizer': 'Adam'}.
2026-07-05 02:18:43,600 - optuna.study.study - INFO - Trial 126 finished with values: [0.019759672262382975, 0.004342457686681991, 0.011523012499609258] and parameters: {'n_layers': 3, 'embedding_dim': 256, 'lr': 0.0009960690196132256, 'lambda_val': 1.1407948092996293e-06, 'batch_size': 1931, 'optimizer': 'Adam'}.
2026-07-05 02:23:56,935 - optuna.study.study - INFO - Trial 127 finished with values: [0.01497491738718852, 0.003378416883536273, 0.008820969223241973] and parameters: {'n_layers': 1, 'embedding_dim': 64, 'lr': 0.00932707322077697, 'lambda_val': 0.0001483339453277888, 'batch_size': 1468, 'optimizer': 'Adam'}.
2026-07-05 02:29:24,650 - optuna.study.study - INFO - Trial 128 finished with values: [0.010537671124108184, 0.002700264042702734, 0.006520504351912687] and parameters: {'n_layers': 1, 'embedding_dim': 128, 'lr': 0.0007561669333504839, 'lambda_val': 2.3028734947350154e-05, 'batch_size': 2098, 'optimizer': 'RMSprop'}.
2026-07-05 02:34:38,280 - optuna.study.study - INFO - Trial 129 finished with values: [0.010828982040039813, 0.00263092908838782, 0.005974671947901732] and parameters: {'n_layers': 3, 'embedding_dim': 32, 'lr': 0.0015091555359142122, 'lambda_val': 9.606012314407097e-06, 'batch_size': 623, 'optimizer': 'Adam'}.
2026-07-05 02:39:24,556 - experiment_functions - INFO - Early stopping at epoch 3450. Best Metrics: (0.01473711274528863, 0.0035208859677449992, 0.00884714271954173)
2026-07-05 02:39:24,646 - optuna.study.study - INFO - Trial 130 finished with values: [0.01473711274528863, 0.0035208859677449992, 0.00884714271954173] and parameters: {'n_layers': 1, 'embedding_dim': 128, 'lr': 0.004947459881909782, 'lambda_val': 0.005128289632509461, 'batch_size': 2105, 'optimizer': 'RMSprop'}.
2026-07-05 02:40:11,872 - experiment_functions - INFO - Early stopping at epoch 550. Best Metrics: (0.003238542096413953, 0.0008177725433580914, 0.0019920639993412383)
2026-07-05 02:40:11,977 - optuna.study.study - INFO - Trial 131 finished with values: [0.003238542096413953, 0.0008177725433580914, 0.0019920639993412383] and parameters: {'n_layers': 2, 'embedding_dim': 64, 'lr': 0.024488667087683845, 'lambda_val': 0.03297467797875669, 'batch_size': 1884, 'optimizer': 'RMSprop'}.
2026-07-05 02:41:02,821 - experiment_functions - INFO - Early stopping at epoch 550. Best Metrics: (0.006908063054014333, 0.001670687460821002, 0.0041416566763957195)
2026-07-05 02:41:02,927 - optuna.study.study - INFO - Trial 132 finished with values: [0.006908063054014333, 0.001670687460821002, 0.0041416566763957195] and parameters: {'n_layers': 4, 'embedding_dim': 64, 'lr': 0.03509621169937048, 'lambda_val': 6.047949750223317e-05, 'batch_size': 1042, 'optimizer': 'Adam'}.
2026-07-05 02:48:07,544 - experiment_functions - INFO - Early stopping at epoch 3400. Best Metrics: (0.015006447001648947, 0.0033442243033261782, 0.008810144168066674)
2026-07-05 02:48:07,632 - optuna.study.study - INFO - Trial 133 finished with values: [0.015006447001648947, 0.0033442243033261782, 0.008810144168066674] and parameters: {'n_layers': 4, 'embedding_dim': 256, 'lr': 0.0012203503451401305, 'lambda_val': 4.969406458018728e-05, 'batch_size': 3907, 'optimizer': 'RMSprop'}.
2026-07-05 02:49:02,393 - experiment_functions - INFO - Early stopping at epoch 550. Best Metrics: (0.0001950435950029946, 5.318845810459131e-05, 0.00012358039998798423)
2026-07-05 02:49:02,493 - optuna.study.study - INFO - Trial 134 finished with values: [0.0001950435950029946, 5.318845810459131e-05, 0.00012358039998798423] and parameters: {'n_layers': 3, 'embedding_dim': 128, 'lr': 7.126603406789501e-05, 'lambda_val': 0.0012837533787936162, 'batch_size': 1645, 'optimizer': 'Adam'}.
2026-07-05 02:49:52,151 - experiment_functions - INFO - Early stopping at epoch 550. Best Metrics: (0.005919654409680888, 0.0014541344528237374, 0.0035802956964651298)
2026-07-05 02:49:52,279 - optuna.study.study - INFO - Trial 135 finished with values: [0.005919654409680888, 0.0014541344528237374, 0.0035802956964651298] and parameters: {'n_layers': 3, 'embedding_dim': 64, 'lr': 0.021200667544250287, 'lambda_val': 0.0012837533787936162, 'batch_size': 3479, 'optimizer': 'Adam'}.
2026-07-05 02:50:37,771 - experiment_functions - INFO - Early stopping at epoch 550. Best Metrics: (0.005857633307999406, 0.0015757080713485175, 0.003672681511957797)
2026-07-05 02:50:37,880 - optuna.study.study - INFO - Trial 136 finished with values: [0.005857633307999406, 0.0015757080713485175, 0.003672681511957797] and parameters: {'n_layers': 2, 'embedding_dim': 32, 'lr': 0.036067303468980835, 'lambda_val': 0.0035329079623473226, 'batch_size': 661, 'optimizer': 'Adam'}.
2026-07-05 02:58:52,383 - optuna.study.study - INFO - Trial 137 finished with values: [0.009006325860896192, 0.0022396140037611837, 0.005201941804480869] and parameters: {'n_layers': 4, 'embedding_dim': 256, 'lr': 0.00039718261379734926, 'lambda_val': 0.001169539462381399, 'batch_size': 636, 'optimizer': 'RMSprop'}.
2026-07-05 03:05:07,782 - optuna.study.study - INFO - Trial 138 finished with values: [0.012323650209255601, 0.002801891989438292, 0.007088397049163576] and parameters: {'n_layers': 3, 'embedding_dim': 128, 'lr': 0.004313984522769102, 'lambda_val': 1.1882774866356996e-05, 'batch_size': 2001, 'optimizer': 'Adam'}.
2026-07-05 03:10:53,949 - optuna.study.study - INFO - Trial 139 finished with values: [0.011370122761715546, 0.0027211595083866807, 0.006985681112931435] and parameters: {'n_layers': 4, 'embedding_dim': 64, 'lr': 0.0007561669333504839, 'lambda_val': 2.439879643655442e-06, 'batch_size': 878, 'optimizer': 'RMSprop'}.
2026-07-05 03:13:24,608 - experiment_functions - INFO - Early stopping at epoch 1750. Best Metrics: (0.00019975051512678392, 4.8439488630967084e-05, 0.00011631917841949467)
2026-07-05 03:13:24,699 - optuna.study.study - INFO - Trial 140 finished with values: [0.00019975051512678392, 4.8439488630967084e-05, 0.00011631917841949467] and parameters: {'n_layers': 4, 'embedding_dim': 64, 'lr': 1.368762993654069e-05, 'lambda_val': 0.00037674227085943596, 'batch_size': 1923, 'optimizer': 'RMSprop'}.
2026-07-05 03:19:31,201 - optuna.study.study - INFO - Trial 141 finished with values: [0.007111799165629758, 0.0018843910871340923, 0.004092186899459739] and parameters: {'n_layers': 1, 'embedding_dim': 256, 'lr': 0.00932707322077697, 'lambda_val': 0.02638365044689118, 'batch_size': 1923, 'optimizer': 'RMSprop'}.
2026-07-05 03:25:06,733 - optuna.study.study - INFO - Trial 142 finished with values: [0.020687624498640984, 0.004511520999943013, 0.012005613157048237] and parameters: {'n_layers': 1, 'embedding_dim': 128, 'lr': 0.004947459881909782, 'lambda_val': 0.00032357419589914736, 'batch_size': 2864, 'optimizer': 'RMSprop'}.
2026-07-05 03:30:40,258 - optuna.study.study - INFO - Trial 143 finished with values: [0.01994399882648783, 0.004339608304997815, 0.011574688065189267] and parameters: {'n_layers': 1, 'embedding_dim': 128, 'lr': 0.004313984522769102, 'lambda_val': 0.0001483339453277888, 'batch_size': 953, 'optimizer': 'RMSprop'}.
2026-07-05 03:35:56,107 - optuna.study.study - INFO - Trial 144 finished with values: [0.014297272919960408, 0.003302433371958285, 0.008380102170252552] and parameters: {'n_layers': 3, 'embedding_dim': 32, 'lr': 0.0015091555359142122, 'lambda_val': 7.045045135561742e-06, 'batch_size': 2162, 'optimizer': 'Adam'}.
2026-07-05 03:36:59,400 - experiment_functions - INFO - Early stopping at epoch 750. Best Metrics: (0.011180561292168026, 0.002522652584389188, 0.006768136594526617)
2026-07-05 03:36:59,490 - optuna.study.study - INFO - Trial 145 finished with values: [0.011180561292168026, 0.002522652584389188, 0.006768136594526617] and parameters: {'n_layers': 3, 'embedding_dim': 32, 'lr': 0.01945737514319542, 'lambda_val': 2.9920385603702593e-06, 'batch_size': 2702, 'optimizer': 'RMSprop'}.
2026-07-05 03:42:35,293 - optuna.study.study - INFO - Trial 146 finished with values: [0.013053075433814466, 0.003178960165644055, 0.007729824197964982] and parameters: {'n_layers': 3, 'embedding_dim': 64, 'lr': 0.0005102423819790047, 'lambda_val': 0.0012837533787936162, 'batch_size': 3596, 'optimizer': 'Adam'}.
2026-07-05 03:50:52,713 - optuna.study.study - INFO - Trial 147 finished with values: [0.011389091737575723, 0.0027040632182816333, 0.006605594195178602] and parameters: {'n_layers': 4, 'embedding_dim': 256, 'lr': 0.021200667544250287, 'lambda_val': 0.0012837533787936162, 'batch_size': 3931, 'optimizer': 'RMSprop'}.
2026-07-05 03:56:03,674 - optuna.study.study - INFO - Trial 148 finished with values: [0.010766192830747458, 0.0027695989970176475, 0.006555142505162679] and parameters: {'n_layers': 1, 'embedding_dim': 64, 'lr': 0.07167055366810839, 'lambda_val': 0.0023013643954001, 'batch_size': 2864, 'optimizer': 'RMSprop'}.
2026-07-05 03:56:58,807 - experiment_functions - INFO - Early stopping at epoch 500. Best Metrics: (0.003414583655015289, 0.0006610565507284918, 0.0020844132784888993)
2026-07-05 03:56:58,896 - optuna.study.study - INFO - Trial 149 finished with values: [0.003414583655015289, 0.0006610565507284918, 0.0020844132784888993] and parameters: {'n_layers': 2, 'embedding_dim': 256, 'lr': 0.024488667087683845, 'lambda_val': 0.03297467797875669, 'batch_size': 2553, 'optimizer': 'RMSprop'}.
2026-07-05 04:02:32,971 - optuna.study.study - INFO - Trial 150 finished with values: [0.01227517620884756, 0.0029994491195410597, 0.007346802928528227] and parameters: {'n_layers': 3, 'embedding_dim': 64, 'lr': 0.0009960690196132256, 'lambda_val': 2.9920385603702593e-06, 'batch_size': 623, 'optimizer': 'Adam'}.
2026-07-05 04:08:41,093 - optuna.study.study - INFO - Trial 151 finished with values: [0.0076438062585458145, 0.001951826453659556, 0.004777698743702743] and parameters: {'n_layers': 1, 'embedding_dim': 256, 'lr': 0.0012203503451401305, 'lambda_val': 4.969406458018728e-05, 'batch_size': 531, 'optimizer': 'Adam'}.
2026-07-05 04:09:33,630 - experiment_functions - INFO - Early stopping at epoch 500. Best Metrics: (0.0002047583691004481, 5.3188458104591316e-05, 0.00012008209454882487)
2026-07-05 04:09:34,369 - optuna.study.study - INFO - Trial 152 finished with values: [0.0002047583691004481, 5.3188458104591316e-05, 0.00012008209454882487] and parameters: {'n_layers': 4, 'embedding_dim': 128, 'lr': 0.010950652965873981, 'lambda_val': 0.0023013643954001, 'batch_size': 999, 'optimizer': 'SGD'}.
2026-07-05 04:15:04,970 - optuna.study.study - INFO - Trial 153 finished with values: [0.017096469791504542, 0.0038485648614250707, 0.010178534110124924] and parameters: {'n_layers': 1, 'embedding_dim': 128, 'lr': 0.004947459881909782, 'lambda_val': 0.00032357419589914736, 'batch_size': 637, 'optimizer': 'RMSprop'}.
2026-07-05 04:18:37,900 - experiment_functions - INFO - Early stopping at epoch 2550. Best Metrics: (0.008929697487431217, 0.0020601029576581883, 0.005051260421158973)
2026-07-05 04:18:37,962 - optuna.study.study - INFO - Trial 154 finished with values: [0.008929697487431217, 0.0020601029576581883, 0.005051260421158973] and parameters: {'n_layers': 3, 'embedding_dim': 64, 'lr': 0.004313984522769102, 'lambda_val': 0.0016628550535030876, 'batch_size': 1645, 'optimizer': 'Adam'}.
2026-07-05 04:19:43,410 - experiment_functions - INFO - Early stopping at epoch 500. Best Metrics: (0.0038075781963977, 0.0007351404745170298, 0.0022728385809286005)
2026-07-05 04:19:43,478 - optuna.study.study - INFO - Trial 155 finished with values: [0.0038075781963977, 0.0007351404745170298, 0.0022728385809286005] and parameters: {'n_layers': 4, 'embedding_dim': 256, 'lr': 0.07167055366810839, 'lambda_val': 0.0023013643954001, 'batch_size': 3505, 'optimizer': 'RMSprop'}.
2026-07-05 04:28:04,320 - optuna.study.study - INFO - Trial 156 finished with values: [0.015022834461999089, 0.003529434112797523, 0.0091860888293433] and parameters: {'n_layers': 4, 'embedding_dim': 256, 'lr': 0.00046184078404352654, 'lambda_val': 1.4514407124820874e-06, 'batch_size': 2666, 'optimizer': 'Adam'}.
2026-07-05 04:33:00,344 - optuna.study.study - INFO - Trial 157 finished with values: [0.0009062667901340709, 0.0002516953821020839, 0.0006019285409674609] and parameters: {'n_layers': 1, 'embedding_dim': 32, 'lr': 0.00039718261379734926, 'lambda_val': 0.001169539462381399, 'batch_size': 3931, 'optimizer': 'Adam'}.
2026-07-05 04:34:13,868 - experiment_functions - INFO - Early stopping at epoch 900. Best Metrics: (0.012545807522494677, 0.002905419523963301, 0.007442940245073466)
2026-07-05 04:34:13,963 - optuna.study.study - INFO - Trial 158 finished with values: [0.012545807522494677, 0.002905419523963301, 0.007442940245073466] and parameters: {'n_layers': 1, 'embedding_dim': 64, 'lr': 0.00597649694627476, 'lambda_val': 0.006568546318566723, 'batch_size': 3323, 'optimizer': 'Adam'}.
2026-07-05 04:35:26,144 - experiment_functions - INFO - Early stopping at epoch 550. Best Metrics: (0.0061134173221699395, 0.0015310677582964496, 0.0036311989407111153)
2026-07-05 04:35:26,236 - optuna.study.study - INFO - Trial 159 finished with values: [0.0061134173221699395, 0.0015310677582964496, 0.0036311989407111153] and parameters: {'n_layers': 4, 'embedding_dim': 256, 'lr': 0.010950652965873981, 'lambda_val': 0.005128289632509461, 'batch_size': 1171, 'optimizer': 'Adam'}.
2026-07-05 04:40:56,300 - optuna.study.study - INFO - Trial 160 finished with values: [0.0169693029737516, 0.004059419106053987, 0.010517501118236093] and parameters: {'n_layers': 1, 'embedding_dim': 128, 'lr': 0.0015303911096150708, 'lambda_val': 0.00032357419589914736, 'batch_size': 1171, 'optimizer': 'RMSprop'}.
2026-07-05 04:43:26,996 - experiment_functions - INFO - Early stopping at epoch 1450. Best Metrics: (0.0002441952152665176, 6.268639705183977e-05, 0.00015253949514798323)
2026-07-05 04:43:27,098 - optuna.study.study - INFO - Trial 161 finished with values: [0.0002441952152665176, 6.268639705183977e-05, 0.00015253949514798323] and parameters: {'n_layers': 2, 'embedding_dim': 256, 'lr': 3.4929349454804114e-05, 'lambda_val': 0.00037674227085943596, 'batch_size': 2160, 'optimizer': 'Adam'}.
2026-07-05 04:49:02,091 - optuna.study.study - INFO - Trial 162 finished with values: [0.023659109757513636, 0.005317896016564406, 0.014231912369130774] and parameters: {'n_layers': 1, 'embedding_dim': 128, 'lr': 0.0017671653194099594, 'lambda_val': 2.7629412628671407e-05, 'batch_size': 2137, 'optimizer': 'RMSprop'}.
2026-07-05 04:49:50,757 - experiment_functions - INFO - Early stopping at epoch 500. Best Metrics: (0.0002235855301499524, 5.9837015367665226e-05, 0.00011961494684500782)
2026-07-05 04:49:50,870 - optuna.study.study - INFO - Trial 163 finished with values: [0.0002235855301499524, 5.9837015367665226e-05, 0.00011961494684500782] and parameters: {'n_layers': 1, 'embedding_dim': 256, 'lr': 0.00046184078404352654, 'lambda_val': 4.331327481478862e-06, 'batch_size': 3931, 'optimizer': 'SGD'}.
