2026-07-05 22:07:33,913 - optuna.study.study - INFO - Trial 130 finished with values: [0.007060122042765975, 0.0016659384913473773, 0.00401259259507014] and parameters: {'n_layers': 4, 'embedding_dim': 128, 'lr': 0.002260615499918563, 'lambda_val': 0.003425407565344529, 'batch_size': 3183, 'optimizer': 'RMSprop'}.
2026-07-05 22:09:41,953 - experiment_functions - INFO - Early stopping at epoch 1350. Best Metrics: (0.010159616993285445, 0.00232699504207587, 0.005975983853564302)
2026-07-05 22:09:42,042 - optuna.study.study - INFO - Trial 131 finished with values: [0.010159616993285445, 0.00232699504207587, 0.005975983853564302] and parameters: {'n_layers': 4, 'embedding_dim': 96, 'lr': 0.0033823653385842145, 'lambda_val': 1.46191732094479e-06, 'batch_size': 2615, 'optimizer': 'Adam'}.
2026-07-05 22:14:30,308 - experiment_functions - INFO - Early stopping at epoch 3100. Best Metrics: (0.011215325422577213, 0.00253879908059951, 0.00635290666914824)
2026-07-05 22:14:30,399 - optuna.study.study - INFO - Trial 132 finished with values: [0.011215325422577213, 0.00253879908059951, 0.00635290666914824] and parameters: {'n_layers': 4, 'embedding_dim': 96, 'lr': 0.0033823653385842145, 'lambda_val': 2.6612699284810097e-06, 'batch_size': 2615, 'optimizer': 'Adam'}.
2026-07-05 22:20:44,750 - optuna.study.study - INFO - Trial 133 finished with values: [0.016703853222535085, 0.0038257698079516744, 0.010053744706772637] and parameters: {'n_layers': 3, 'embedding_dim': 128, 'lr': 0.0008914583956121026, 'lambda_val': 1.059674657990583e-05, 'batch_size': 1692, 'optimizer': 'RMSprop'}.
2026-07-05 22:21:31,339 - experiment_functions - INFO - Early stopping at epoch 550. Best Metrics: (0.0024835946937231653, 0.0007056968637805597, 0.0015164773783123986)
2026-07-05 22:21:31,431 - optuna.study.study - INFO - Trial 134 finished with values: [0.0024835946937231653, 0.0007056968637805597, 0.0015164773783123986] and parameters: {'n_layers': 3, 'embedding_dim': 32, 'lr': 0.0070515306300978796, 'lambda_val': 0.025389792435966986, 'batch_size': 3331, 'optimizer': 'RMSprop'}.
2026-07-05 22:28:27,953 - optuna.study.study - INFO - Trial 135 finished with values: [0.016631728248132846, 0.0035541287540603694, 0.009707129683486498] and parameters: {'n_layers': 2, 'embedding_dim': 256, 'lr': 0.0070515306300978796, 'lambda_val': 7.042695090433518e-06, 'batch_size': 3299, 'optimizer': 'Adam'}.
2026-07-05 22:29:33,241 - experiment_functions - INFO - Early stopping at epoch 750. Best Metrics: (0.006460491895278444, 0.0015329673460858994, 0.0037643083278470577)
2026-07-05 22:29:33,589 - optuna.study.study - INFO - Trial 136 finished with values: [0.006460491895278444, 0.0015329673460858994, 0.0037643083278470577] and parameters: {'n_layers': 1, 'embedding_dim': 128, 'lr': 0.008002638743453066, 'lambda_val': 0.026080793635433332, 'batch_size': 3710, 'optimizer': 'Adam'}.
2026-07-05 22:35:19,674 - optuna.study.study - INFO - Trial 137 finished with values: [0.013249920298928627, 0.003000398913435784, 0.007890073457102761] and parameters: {'n_layers': 4, 'embedding_dim': 64, 'lr': 0.004643736874356213, 'lambda_val': 1.3028958114301324e-06, 'batch_size': 1749, 'optimizer': 'RMSprop'}.
2026-07-05 22:42:50,668 - optuna.study.study - INFO - Trial 138 finished with values: [0.010341893527823944, 0.0025596945462834563, 0.006341416874926406] and parameters: {'n_layers': 3, 'embedding_dim': 256, 'lr': 0.00031301183442768784, 'lambda_val': 4.859553849541615e-06, 'batch_size': 1692, 'optimizer': 'RMSprop'}.
2026-07-05 22:43:38,362 - experiment_functions - INFO - Early stopping at epoch 500. Best Metrics: (0.0030541354579015248, 0.0005955207719924776, 0.0017915418551769408)
2026-07-05 22:43:38,701 - optuna.study.study - INFO - Trial 139 finished with values: [0.0030541354579015248, 0.0005955207719924776, 0.0017915418551769408] and parameters: {'n_layers': 2, 'embedding_dim': 96, 'lr': 0.08173787211738727, 'lambda_val': 0.0002603817889184556, 'batch_size': 1692, 'optimizer': 'RMSprop'}.
2026-07-05 22:48:52,629 - optuna.study.study - INFO - Trial 140 finished with values: [0.01383895322287783, 0.0033423247155367286, 0.008272614196628062] and parameters: {'n_layers': 3, 'embedding_dim': 32, 'lr': 0.000628496153565313, 'lambda_val': 1.4745289700620854e-05, 'batch_size': 2385, 'optimizer': 'RMSprop'}.
2026-07-05 22:54:45,802 - optuna.study.study - INFO - Trial 141 finished with values: [0.008883318583141665, 0.002067701308815987, 0.005251897676130122] and parameters: {'n_layers': 3, 'embedding_dim': 96, 'lr': 0.00622194471935376, 'lambda_val': 0.0008455954335710432, 'batch_size': 1692, 'optimizer': 'Adam'}.
2026-07-05 22:55:26,259 - experiment_functions - INFO - Early stopping at epoch 500. Best Metrics: (0.00020010942943241207, 5.223866420986646e-05, 0.0001229995902123451)
2026-07-05 22:55:26,338 - optuna.study.study - INFO - Trial 142 finished with values: [0.00020010942943241207, 5.223866420986646e-05, 0.0001229995902123451] and parameters: {'n_layers': 1, 'embedding_dim': 32, 'lr': 0.004643736874356213, 'lambda_val': 8.041921540387641e-06, 'batch_size': 984, 'optimizer': 'SGD'}.
2026-07-05 23:00:55,899 - optuna.study.study - INFO - Trial 143 finished with values: [0.010041742565813753, 0.0024989077370210664, 0.00597896158658587] and parameters: {'n_layers': 1, 'embedding_dim': 128, 'lr': 0.006553786429577227, 'lambda_val': 0.011720789781497609, 'batch_size': 1506, 'optimizer': 'RMSprop'}.
2026-07-05 23:07:01,474 - optuna.study.study - INFO - Trial 144 finished with values: [0.002812265309501088, 0.0007265923294645062, 0.0018544354960124138] and parameters: {'n_layers': 1, 'embedding_dim': 256, 'lr': 0.000628496153565313, 'lambda_val': 1.3028958114301324e-06, 'batch_size': 1120, 'optimizer': 'Adam'}.
2026-07-05 23:09:27,902 - experiment_functions - INFO - Early stopping at epoch 1700. Best Metrics: (0.015256824202360828, 0.0033043329597477345, 0.008797467993569862)
2026-07-05 23:09:27,987 - optuna.study.study - INFO - Trial 145 finished with values: [0.015256824202360828, 0.0033043329597477345, 0.008797467993569862] and parameters: {'n_layers': 2, 'embedding_dim': 96, 'lr': 0.002260615499918563, 'lambda_val': 0.002906975496505062, 'batch_size': 2615, 'optimizer': 'Adam'}.
2026-07-05 23:17:46,450 - optuna.study.study - INFO - Trial 146 finished with values: [0.00744540196628842, 0.0019119351100811122, 0.00438764014842824] and parameters: {'n_layers': 4, 'embedding_dim': 256, 'lr': 0.00046943052333612564, 'lambda_val': 0.009008883638359447, 'batch_size': 2572, 'optimizer': 'Adam'}.
2026-07-05 23:26:00,590 - optuna.study.study - INFO - Trial 147 finished with values: [0.008003010489221678, 0.001881541705449917, 0.004574237305043262] and parameters: {'n_layers': 4, 'embedding_dim': 256, 'lr': 0.0006743657717693198, 'lambda_val': 0.007099761503143894, 'batch_size': 2304, 'optimizer': 'RMSprop'}.
2026-07-05 23:32:06,189 - optuna.study.study - INFO - Trial 148 finished with values: [0.011049469137183297, 0.0028503314780692584, 0.007005960741960405] and parameters: {'n_layers': 1, 'embedding_dim': 256, 'lr': 0.0008914583956121026, 'lambda_val': 4.859553849541615e-06, 'batch_size': 1132, 'optimizer': 'RMSprop'}.
2026-07-05 23:37:31,751 - optuna.study.study - INFO - Trial 149 finished with values: [0.017941150742692286, 0.004122105503105826, 0.010527986745560531] and parameters: {'n_layers': 2, 'embedding_dim': 64, 'lr': 0.0014317988640719153, 'lambda_val': 0.0017059305455562248, 'batch_size': 1458, 'optimizer': 'Adam'}.
2026-07-05 23:42:59,601 - optuna.study.study - INFO - Trial 150 finished with values: [0.018661024003293808, 0.004172444579526243, 0.011018292079757627] and parameters: {'n_layers': 2, 'embedding_dim': 64, 'lr': 0.0014317988640719153, 'lambda_val': 0.0017059305455562248, 'batch_size': 2482, 'optimizer': 'Adam'}.
2026-07-05 23:48:15,837 - optuna.study.study - INFO - Trial 151 finished with values: [0.020352114592271403, 0.004454533366259522, 0.011817449930872049] and parameters: {'n_layers': 1, 'embedding_dim': 64, 'lr': 0.0028516566741058234, 'lambda_val': 0.0017059305455562248, 'batch_size': 2385, 'optimizer': 'RMSprop'}.
2026-07-05 23:54:00,118 - optuna.study.study - INFO - Trial 152 finished with values: [0.009022139107169713, 0.0023060995763919236, 0.005508997218121668] and parameters: {'n_layers': 4, 'embedding_dim': 64, 'lr': 0.0004597340510218388, 'lambda_val': 0.002906975496505062, 'batch_size': 2615, 'optimizer': 'Adam'}.
2026-07-05 23:55:11,323 - experiment_functions - INFO - Early stopping at epoch 850. Best Metrics: (0.004600821812520597, 0.0011473510248276124, 0.0027413664144315553)
2026-07-05 23:55:11,410 - optuna.study.study - INFO - Trial 153 finished with values: [0.004600821812520597, 0.0011473510248276124, 0.0027413664144315553] and parameters: {'n_layers': 2, 'embedding_dim': 64, 'lr': 0.006236516613152459, 'lambda_val': 0.024499694307189884, 'batch_size': 3966, 'optimizer': 'Adam'}.
2026-07-05 23:55:54,900 - experiment_functions - INFO - Early stopping at epoch 500. Best Metrics: (0.00022292535519597917, 5.603783978876584e-05, 0.00013057730511551453)
2026-07-05 23:55:55,485 - optuna.study.study - INFO - Trial 154 finished with values: [0.00022292535519597917, 5.603783978876584e-05, 0.00013057730511551453] and parameters: {'n_layers': 2, 'embedding_dim': 64, 'lr': 0.0001047450553060545, 'lambda_val': 0.0017059305455562248, 'batch_size': 2646, 'optimizer': 'Adam'}.
2026-07-05 23:56:51,604 - experiment_functions - INFO - Early stopping at epoch 650. Best Metrics: (0.0001871183816031219, 4.843948863096709e-05, 9.475964788830482e-05)
2026-07-05 23:56:51,694 - optuna.study.study - INFO - Trial 155 finished with values: [0.0001871183816031219, 4.843948863096709e-05, 9.475964788830482e-05] and parameters: {'n_layers': 1, 'embedding_dim': 128, 'lr': 0.0002495551758213276, 'lambda_val': 0.011720789781497609, 'batch_size': 1506, 'optimizer': 'RMSprop'}.
2026-07-06 00:03:05,372 - optuna.study.study - INFO - Trial 156 finished with values: [0.019576299928493437, 0.004309214900366621, 0.011461406815759021] and parameters: {'n_layers': 1, 'embedding_dim': 256, 'lr': 0.0070515306300978796, 'lambda_val': 2.1563767437652712e-06, 'batch_size': 1692, 'optimizer': 'Adam'}.
2026-07-06 00:03:50,153 - experiment_functions - INFO - Early stopping at epoch 500. Best Metrics: (0.00029085443488389653, 5.8887221472940384e-05, 0.00016565250024738306)
2026-07-06 00:03:50,248 - optuna.study.study - INFO - Trial 157 finished with values: [0.00029085443488389653, 5.8887221472940384e-05, 0.00016565250024738306] and parameters: {'n_layers': 2, 'embedding_dim': 96, 'lr': 0.002260615499918563, 'lambda_val': 0.04604908825845266, 'batch_size': 2615, 'optimizer': 'SGD'}.
2026-07-06 00:09:30,585 - optuna.study.study - INFO - Trial 158 finished with values: [0.01747311375268642, 0.003776380525425983, 0.010038172690914308] and parameters: {'n_layers': 2, 'embedding_dim': 96, 'lr': 0.00841343884415209, 'lambda_val': 2.412093285142066e-05, 'batch_size': 2901, 'optimizer': 'RMSprop'}.
2026-07-06 00:10:12,534 - experiment_functions - INFO - Early stopping at epoch 500. Best Metrics: (0.00024859681515787405, 6.173660315711492e-05, 0.00015184226899217084)
2026-07-06 00:10:12,647 - optuna.study.study - INFO - Trial 159 finished with values: [0.00024859681515787405, 6.173660315711492e-05, 0.00015184226899217084] and parameters: {'n_layers': 1, 'embedding_dim': 64, 'lr': 2.2543869768937283e-05, 'lambda_val': 1.1875193284309632e-06, 'batch_size': 1458, 'optimizer': 'SGD'}.
2026-07-06 00:11:06,627 - experiment_functions - INFO - Early stopping at epoch 550. Best Metrics: (0.0018916070198540017, 0.0005670269551507324, 0.0012990796285862211)
2026-07-06 00:11:07,000 - optuna.study.study - INFO - Trial 160 finished with values: [0.0018916070198540017, 0.0005670269551507324, 0.0012990796285862211] and parameters: {'n_layers': 1, 'embedding_dim': 256, 'lr': 0.00841343884415209, 'lambda_val': 0.08857919252476919, 'batch_size': 2901, 'optimizer': 'RMSprop'}.
2026-07-06 00:16:28,102 - optuna.study.study - INFO - Trial 161 finished with values: [0.011607482562019895, 0.002692665691544935, 0.006779412714916704] and parameters: {'n_layers': 4, 'embedding_dim': 32, 'lr': 0.006236516613152459, 'lambda_val': 8.13684422458198e-05, 'batch_size': 2304, 'optimizer': 'RMSprop'}.
2026-07-06 00:19:03,830 - experiment_functions - INFO - Early stopping at epoch 1800. Best Metrics: (0.014980466395954848, 0.003230249035959197, 0.008460117254600856)
2026-07-06 00:19:03,910 - optuna.study.study - INFO - Trial 162 finished with values: [0.014980466395954848, 0.003230249035959197, 0.008460117254600856] and parameters: {'n_layers': 2, 'embedding_dim': 96, 'lr': 0.006236516613152459, 'lambda_val': 1.059674657990583e-05, 'batch_size': 3299, 'optimizer': 'Adam'}.
2026-07-06 00:24:47,674 - optuna.study.study - INFO - Trial 163 finished with values: [0.012437767216747634, 0.0028940219972266017, 0.007718813190452712] and parameters: {'n_layers': 4, 'embedding_dim': 64, 'lr': 0.0031396548392481098, 'lambda_val': 1.3028958114301324e-06, 'batch_size': 604, 'optimizer': 'RMSprop'}.
2026-07-06 00:30:11,398 - optuna.study.study - INFO - Trial 164 finished with values: [0.004639811436839814, 0.0011691962844062838, 0.002874537491843466] and parameters: {'n_layers': 1, 'embedding_dim': 128, 'lr': 0.0005396027445916047, 'lambda_val': 0.011720789781497609, 'batch_size': 1906, 'optimizer': 'RMSprop'}.
2026-07-06 00:35:23,714 - optuna.study.study - INFO - Trial 165 finished with values: [0.019587227268222422, 0.004379499648576259, 0.01139865165273191] and parameters: {'n_layers': 2, 'embedding_dim': 32, 'lr': 0.002260615499918563, 'lambda_val': 0.0007266529464041023, 'batch_size': 2615, 'optimizer': 'Adam'}.
2026-07-06 00:41:02,224 - experiment_functions - INFO - Early stopping at epoch 2700. Best Metrics: (0.010928596506195768, 0.002503656706494691, 0.006288128562227567)
2026-07-06 00:41:02,303 - optuna.study.study - INFO - Trial 166 finished with values: [0.010928596506195768, 0.002503656706494691, 0.006288128562227567] and parameters: {'n_layers': 4, 'embedding_dim': 256, 'lr': 0.0006743657717693198, 'lambda_val': 0.005013303766522477, 'batch_size': 3787, 'optimizer': 'Adam'}.
2026-07-06 00:47:15,465 - optuna.study.study - INFO - Trial 167 finished with values: [0.01691842833084587, 0.003872309708793192, 0.00997364454513414] and parameters: {'n_layers': 1, 'embedding_dim': 256, 'lr': 0.0020004569205185102, 'lambda_val': 0.011720789781497609, 'batch_size': 2482, 'optimizer': 'Adam'}.
2026-07-06 00:49:23,529 - experiment_functions - INFO - Early stopping at epoch 1350. Best Metrics: (0.010843522891871063, 0.002450468248390099, 0.006287093220658827)
2026-07-06 00:49:23,612 - optuna.study.study - INFO - Trial 168 finished with values: [0.010843522891871063, 0.002450468248390099, 0.006287093220658827] and parameters: {'n_layers': 4, 'embedding_dim': 96, 'lr': 0.0033823653385842145, 'lambda_val': 2.876272386464763e-06, 'batch_size': 2615, 'optimizer': 'Adam'}.
2026-07-06 00:55:39,085 - optuna.study.study - INFO - Trial 169 finished with values: [0.02470812460398443, 0.00532834374940638, 0.014597452370261116] and parameters: {'n_layers': 1, 'embedding_dim': 256, 'lr': 0.0033823653385842145, 'lambda_val': 2.6612699284810097e-06, 'batch_size': 2079, 'optimizer': 'Adam'}.
2026-07-06 01:00:45,888 - optuna.study.study - INFO - Trial 170 finished with values: [0.020082172420546305, 0.004478278213627642, 0.011833517827877038] and parameters: {'n_layers': 1, 'embedding_dim': 32, 'lr': 0.004643736874356213, 'lambda_val': 1.3028958114301324e-06, 'batch_size': 1692, 'optimizer': 'Adam'}.
2026-07-06 01:08:22,127 - optuna.study.study - INFO - Trial 171 finished with values: [0.020461911637439403, 0.004472579450259293, 0.012126805829409155] and parameters: {'n_layers': 3, 'embedding_dim': 256, 'lr': 0.0070515306300978796, 'lambda_val': 1.4745289700620854e-05, 'batch_size': 2385, 'optimizer': 'RMSprop'}.
2026-07-06 01:14:32,098 - optuna.study.study - INFO - Trial 172 finished with values: [0.020192271399788443, 0.004399445320365481, 0.012027142193319035] and parameters: {'n_layers': 1, 'embedding_dim': 256, 'lr': 0.006553786429577227, 'lambda_val': 6.830924023769031e-06, 'batch_size': 1506, 'optimizer': 'RMSprop'}.
2026-07-06 01:22:44,602 - optuna.study.study - INFO - Trial 173 finished with values: [0.002804041207877105, 0.0007788309936743727, 0.0017246768398910739] and parameters: {'n_layers': 4, 'embedding_dim': 256, 'lr': 0.0001135687797153643, 'lambda_val': 0.005013303766522477, 'batch_size': 3787, 'optimizer': 'RMSprop'}.
2026-07-06 01:29:40,770 - optuna.study.study - INFO - Trial 174 finished with values: [0.014899153589961415, 0.00329958399027411, 0.008833762768236894] and parameters: {'n_layers': 2, 'embedding_dim': 256, 'lr': 0.0070515306300978796, 'lambda_val': 7.042695090433518e-06, 'batch_size': 1692, 'optimizer': 'Adam'}.
2026-07-06 01:35:55,491 - optuna.study.study - INFO - Trial 175 finished with values: [0.013121092833324015, 0.0028930722033318765, 0.0073908675122997085] and parameters: {'n_layers': 3, 'embedding_dim': 128, 'lr': 0.0020004569205185102, 'lambda_val': 0.0007517515862491342, 'batch_size': 2482, 'optimizer': 'RMSprop'}.
2026-07-06 01:40:00,533 - experiment_functions - INFO - Early stopping at epoch 2500. Best Metrics: (0.0001857483984823951, 5.033907642041678e-05, 0.00010401997231718016)
2026-07-06 01:40:01,116 - optuna.study.study - INFO - Trial 176 finished with values: [0.0001857483984823951, 5.033907642041678e-05, 0.00010401997231718016] and parameters: {'n_layers': 4, 'embedding_dim': 128, 'lr': 2.918137533026034e-05, 'lambda_val': 1.059674657990583e-05, 'batch_size': 3494, 'optimizer': 'RMSprop'}.
2026-07-06 01:45:57,214 - optuna.study.study - INFO - Trial 177 finished with values: [0.018309826750113847, 0.004056569724369812, 0.010829363326241707] and parameters: {'n_layers': 2, 'embedding_dim': 128, 'lr': 0.0069539644625034236, 'lambda_val': 2.412093285142066e-05, 'batch_size': 1692, 'optimizer': 'RMSprop'}.
2026-07-06 01:47:27,713 - experiment_functions - INFO - Early stopping at epoch 1100. Best Metrics: (0.007692781930527042, 0.0017599680869251374, 0.00437938248698989)
2026-07-06 01:47:27,802 - optuna.study.study - INFO - Trial 178 finished with values: [0.007692781930527042, 0.0017599680869251374, 0.00437938248698989] and parameters: {'n_layers': 4, 'embedding_dim': 32, 'lr': 0.00622194471935376, 'lambda_val': 0.0008455954335710432, 'batch_size': 3276, 'optimizer': 'Adam'}.
2026-07-06 01:48:17,679 - experiment_functions - INFO - Early stopping at epoch 500. Best Metrics: (0.00021646297314477318, 4.748969473624224e-05, 0.00011000002100337447)
2026-07-06 01:48:17,761 - optuna.study.study - INFO - Trial 179 finished with values: [0.00021646297314477318, 4.748969473624224e-05, 0.00011000002100337447] and parameters: {'n_layers': 3, 'embedding_dim': 128, 'lr': 1.5359715464363217e-05, 'lambda_val': 1.059674657990583e-05, 'batch_size': 1692, 'optimizer': 'RMSprop'}.
2026-07-06 01:49:06,328 - experiment_functions - INFO - Early stopping at epoch 500. Best Metrics: (0.00024350164316104623, 5.888722147294038e-05, 0.00013327533587053887)
2026-07-06 01:49:06,447 - optuna.study.study - INFO - Trial 180 finished with values: [0.00024350164316104623, 5.888722147294038e-05, 0.00013327533587053887] and parameters: {'n_layers': 4, 'embedding_dim': 96, 'lr': 0.006236516613152459, 'lambda_val': 1.3028958114301324e-06, 'batch_size': 1749, 'optimizer': 'SGD'}.
2026-07-06 01:50:17,426 - experiment_functions - INFO - Early stopping at epoch 800. Best Metrics: (0.0092334145236392, 0.002082898011131585, 0.005282353397610323)
2026-07-06 01:50:17,512 - optuna.study.study - INFO - Trial 181 finished with values: [0.0092334145236392, 0.002082898011131585, 0.005282353397610323] and parameters: {'n_layers': 2, 'embedding_dim': 96, 'lr': 0.0070515306300978796, 'lambda_val': 0.002906975496505062, 'batch_size': 3299, 'optimizer': 'Adam'}.
2026-07-06 01:55:41,431 - optuna.study.study - INFO - Trial 182 finished with values: [0.016009151079194102, 0.0034648481279562337, 0.009340899739304333] and parameters: {'n_layers': 2, 'embedding_dim': 64, 'lr': 0.007216380152839391, 'lambda_val': 8.13684422458198e-05, 'batch_size': 3892, 'optimizer': 'RMSprop'}.
2026-07-06 02:03:18,077 - optuna.study.study - INFO - Trial 183 finished with values: [0.01987274265119609, 0.004399445320365481, 0.011690142244803315] and parameters: {'n_layers': 3, 'embedding_dim': 256, 'lr': 0.006553786429577227, 'lambda_val': 1.4745289700620854e-05, 'batch_size': 1692, 'optimizer': 'RMSprop'}.
2026-07-06 02:07:29,828 - experiment_functions - INFO - Early stopping at epoch 3150. Best Metrics: (0.007939144977697642, 0.0018891400566077164, 0.004582779057643985)
2026-07-06 02:07:29,915 - optuna.study.study - INFO - Trial 184 finished with values: [0.007939144977697642, 0.0018891400566077164, 0.004582779057643985] and parameters: {'n_layers': 4, 'embedding_dim': 32, 'lr': 0.006553786429577227, 'lambda_val': 0.0012923669531330183, 'batch_size': 2615, 'optimizer': 'RMSprop'}.
2026-07-06 02:13:07,963 - experiment_functions - INFO - Early stopping at epoch 3250. Best Metrics: (0.015567163290710694, 0.0033755675018520984, 0.008862132745217499)
2026-07-06 02:13:08,042 - optuna.study.study - INFO - Trial 185 finished with values: [0.015567163290710694, 0.0033755675018520984, 0.008862132745217499] and parameters: {'n_layers': 2, 'embedding_dim': 256, 'lr': 0.002260615499918563, 'lambda_val': 0.002062935328163689, 'batch_size': 1553, 'optimizer': 'Adam'}.
2026-07-06 02:18:48,597 - optuna.study.study - INFO - Trial 186 finished with values: [0.017406216971163128, 0.0037279410367950156, 0.010236572893467565] and parameters: {'n_layers': 2, 'embedding_dim': 96, 'lr': 0.0070515306300978796, 'lambda_val': 7.042695090433518e-06, 'batch_size': 3299, 'optimizer': 'RMSprop'}.
