2026-07-08 20:30:18,680 - optuna.study.study - INFO - Trial 187 finished with values: [0.005143797390918247, 0.0013781509412457496, 0.0033269026368885337] and parameters: {'n_layers': 3, 'embedding_dim': 64, 'lr': 0.0005079724528508135, 'lambda_val': 6.625860010406062e-06, 'batch_size': 2965, 'optimizer': 'RMSprop'}.
2026-07-08 20:31:48,019 - experiment_functions - INFO - Early stopping at epoch 800. Best Metrics: (0.005321999639379672, 0.001473130330718234, 0.0033643201695998386)
2026-07-08 20:31:48,108 - optuna.study.study - INFO - Trial 188 finished with values: [0.005321999639379672, 0.001473130330718234, 0.0033643201695998386] and parameters: {'n_layers': 4, 'embedding_dim': 256, 'lr': 0.0026199811222762572, 'lambda_val': 0.000113168638168215, 'batch_size': 2727, 'optimizer': 'Adam'}.
2026-07-08 20:34:46,048 - experiment_functions - INFO - Early stopping at epoch 1750. Best Metrics: (0.005436422282957133, 0.0014721805368235093, 0.003465757270274239)
2026-07-08 20:34:46,213 - optuna.study.study - INFO - Trial 189 finished with values: [0.005436422282957133, 0.0014721805368235093, 0.003465757270274239] and parameters: {'n_layers': 3, 'embedding_dim': 256, 'lr': 0.0020140299216981693, 'lambda_val': 1.3798424398068006e-06, 'batch_size': 1320, 'optimizer': 'Adam'}.
2026-07-08 20:41:52,692 - optuna.study.study - INFO - Trial 190 finished with values: [0.005568121191771963, 0.0014930760025074557, 0.003725179241373981] and parameters: {'n_layers': 4, 'embedding_dim': 256, 'lr': 0.0003947216765049812, 'lambda_val': 0.00011408095693043007, 'batch_size': 2350, 'optimizer': 'Adam'}.
2026-07-08 20:42:52,322 - experiment_functions - INFO - Early stopping at epoch 600. Best Metrics: (0.002952684257584044, 0.000770282848621849, 0.0019037808612740767)
2026-07-08 20:42:52,432 - optuna.study.study - INFO - Trial 191 finished with values: [0.002952684257584044, 0.000770282848621849, 0.0019037808612740767] and parameters: {'n_layers': 2, 'embedding_dim': 256, 'lr': 0.024088893332696436, 'lambda_val': 1.3798424398068006e-06, 'batch_size': 2740, 'optimizer': 'Adam'}.
2026-07-08 20:47:21,668 - experiment_functions - INFO - Early stopping at epoch 3350. Best Metrics: (0.006444473942067599, 0.0017894116976616072, 0.004246633001720453)
2026-07-08 20:47:22,008 - optuna.study.study - INFO - Trial 192 finished with values: [0.006444473942067599, 0.0017894116976616072, 0.004246633001720453] and parameters: {'n_layers': 4, 'embedding_dim': 64, 'lr': 0.0013152005063538942, 'lambda_val': 2.6993939082559436e-06, 'batch_size': 1562, 'optimizer': 'Adam'}.
2026-07-08 20:49:49,330 - experiment_functions - INFO - Early stopping at epoch 1950. Best Metrics: (0.002794021961318604, 0.0007161445966225328, 0.0016889536458883727)
2026-07-08 20:49:49,422 - optuna.study.study - INFO - Trial 193 finished with values: [0.002794021961318604, 0.0007161445966225328, 0.0016889536458883727] and parameters: {'n_layers': 1, 'embedding_dim': 64, 'lr': 0.003328720631447993, 'lambda_val': 1.3028548464191915e-06, 'batch_size': 2341, 'optimizer': 'Adam'}.
2026-07-08 20:56:02,347 - optuna.study.study - INFO - Trial 194 finished with values: [0.0045620730483289995, 0.0011834431928271568, 0.002948766302492324] and parameters: {'n_layers': 2, 'embedding_dim': 256, 'lr': 0.0009859128880233146, 'lambda_val': 3.522694850766875e-05, 'batch_size': 2258, 'optimizer': 'Adam'}.
2026-07-08 21:00:08,814 - experiment_functions - INFO - Early stopping at epoch 2450. Best Metrics: (0.005904270757874143, 0.0015880553919799406, 0.0037587509953598383)
2026-07-08 21:00:08,905 - optuna.study.study - INFO - Trial 195 finished with values: [0.005904270757874143, 0.0015880553919799406, 0.0037587509953598383] and parameters: {'n_layers': 3, 'embedding_dim': 256, 'lr': 0.001488688533444762, 'lambda_val': 6.625860010406062e-06, 'batch_size': 891, 'optimizer': 'Adam'}.
2026-07-08 21:00:50,371 - experiment_functions - INFO - Early stopping at epoch 500. Best Metrics: (0.00022965839120703466, 6.17366031571149e-05, 0.0001128232183358381)
2026-07-08 21:00:50,470 - optuna.study.study - INFO - Trial 196 finished with values: [0.00022965839120703466, 6.17366031571149e-05, 0.0001128232183358381] and parameters: {'n_layers': 2, 'embedding_dim': 64, 'lr': 0.0005079724528508135, 'lambda_val': 1.3798424398068006e-06, 'batch_size': 4022, 'optimizer': 'SGD'}.
2026-07-08 21:04:32,064 - experiment_functions - INFO - Early stopping at epoch 2050. Best Metrics: (0.005991741873561888, 0.0016621393157684782, 0.003876019892501935)
2026-07-08 21:04:32,161 - optuna.study.study - INFO - Trial 197 finished with values: [0.005991741873561888, 0.0016621393157684782, 0.003876019892501935] and parameters: {'n_layers': 4, 'embedding_dim': 256, 'lr': 0.0013152005063538942, 'lambda_val': 1.3798424398068006e-06, 'batch_size': 1562, 'optimizer': 'Adam'}.
2026-07-08 21:05:57,740 - experiment_functions - INFO - Early stopping at epoch 1050. Best Metrics: (0.006079031380931997, 0.001639344262295082, 0.003885909894956872)
2026-07-08 21:05:57,830 - optuna.study.study - INFO - Trial 198 finished with values: [0.006079031380931997, 0.001639344262295082, 0.003885909894956872] and parameters: {'n_layers': 3, 'embedding_dim': 64, 'lr': 0.0016459794241324855, 'lambda_val': 6.625860010406062e-06, 'batch_size': 3801, 'optimizer': 'RMSprop'}.
2026-07-08 21:11:23,792 - optuna.study.study - INFO - Trial 199 finished with values: [0.005465023270334056, 0.0014436867199817643, 0.0035997367551991815] and parameters: {'n_layers': 3, 'embedding_dim': 96, 'lr': 0.0005079724528508135, 'lambda_val': 1.3798424398068006e-06, 'batch_size': 2341, 'optimizer': 'RMSprop'}.
2026-07-08 21:14:12,085 - experiment_functions - INFO - Early stopping at epoch 1550. Best Metrics: (0.005706832908529684, 0.001543415078927873, 0.0036480309694149524)
2026-07-08 21:14:12,181 - optuna.study.study - INFO - Trial 200 finished with values: [0.005706832908529684, 0.001543415078927873, 0.0036480309694149524] and parameters: {'n_layers': 4, 'embedding_dim': 256, 'lr': 0.0013152005063538942, 'lambda_val': 4.325919770856533e-05, 'batch_size': 1562, 'optimizer': 'Adam'}.
2026-07-08 21:19:49,378 - optuna.study.study - INFO - Trial 201 finished with values: [0.006359146125872009, 0.0016820849875577003, 0.004067910564818859] and parameters: {'n_layers': 4, 'embedding_dim': 96, 'lr': 0.0004844383730923344, 'lambda_val': 1.0684413344508431e-05, 'batch_size': 2341, 'optimizer': 'RMSprop'}.
2026-07-08 21:22:16,712 - experiment_functions - INFO - Early stopping at epoch 1350. Best Metrics: (0.005592751312059913, 0.001530117964401725, 0.0035788653814099783)
2026-07-08 21:22:17,062 - optuna.study.study - INFO - Trial 202 finished with values: [0.005592751312059913, 0.001530117964401725, 0.0035788653814099783] and parameters: {'n_layers': 4, 'embedding_dim': 256, 'lr': 0.0013152005063538942, 'lambda_val': 1.3798424398068006e-06, 'batch_size': 2350, 'optimizer': 'Adam'}.
2026-07-08 21:27:34,376 - experiment_functions - INFO - Early stopping at epoch 3850. Best Metrics: (0.005560660834534236, 0.0015149212620861273, 0.0035840057496864925)
2026-07-08 21:27:34,463 - optuna.study.study - INFO - Trial 203 finished with values: [0.005560660834534236, 0.0015149212620861273, 0.0035840057496864925] and parameters: {'n_layers': 3, 'embedding_dim': 96, 'lr': 0.0009859128880233146, 'lambda_val': 8.982642030344512e-06, 'batch_size': 2341, 'optimizer': 'Adam'}.
2026-07-08 21:29:22,408 - experiment_functions - INFO - Early stopping at epoch 1300. Best Metrics: (0.006058086086772382, 0.001696331895978573, 0.004029241403622583)
2026-07-08 21:29:22,489 - optuna.study.study - INFO - Trial 204 finished with values: [0.006058086086772382, 0.001696331895978573, 0.004029241403622583] and parameters: {'n_layers': 4, 'embedding_dim': 64, 'lr': 0.001488688533444762, 'lambda_val': 1.3798424398068006e-06, 'batch_size': 3801, 'optimizer': 'Adam'}.
2026-07-08 21:30:30,008 - experiment_functions - INFO - Early stopping at epoch 600. Best Metrics: (0.001539794915151198, 0.0004274072526261801, 0.0010559761086320766)
2026-07-08 21:30:30,097 - optuna.study.study - INFO - Trial 205 finished with values: [0.001539794915151198, 0.0004274072526261801, 0.0010559761086320766] and parameters: {'n_layers': 4, 'embedding_dim': 256, 'lr': 0.002634796822286242, 'lambda_val': 0.0590705343678621, 'batch_size': 2106, 'optimizer': 'RMSprop'}.
2026-07-08 21:35:06,745 - experiment_functions - INFO - Early stopping at epoch 3250. Best Metrics: (0.006960669502531684, 0.0019489770719753816, 0.004532377638018336)
2026-07-08 21:35:06,810 - optuna.study.study - INFO - Trial 206 finished with values: [0.006960669502531684, 0.0019489770719753816, 0.004532377638018336] and parameters: {'n_layers': 4, 'embedding_dim': 96, 'lr': 0.0013152005063538942, 'lambda_val': 6.5939387363411675e-06, 'batch_size': 1355, 'optimizer': 'Adam'}.
2026-07-08 21:35:51,644 - experiment_functions - INFO - Early stopping at epoch 550. Best Metrics: (0.0011528670759122922, 0.00029253651957525216, 0.0007576508360903469)
2026-07-08 21:35:51,719 - optuna.study.study - INFO - Trial 207 finished with values: [0.0011528670759122922, 0.00029253651957525216, 0.0007576508360903469] and parameters: {'n_layers': 1, 'embedding_dim': 64, 'lr': 0.049419849427299115, 'lambda_val': 8.982642030344512e-06, 'batch_size': 1562, 'optimizer': 'Adam'}.
2026-07-08 21:37:32,880 - experiment_functions - INFO - Early stopping at epoch 1250. Best Metrics: (0.005136041573599717, 0.001427540223771442, 0.0033733661241772102)
2026-07-08 21:37:32,964 - optuna.study.study - INFO - Trial 208 finished with values: [0.005136041573599717, 0.001427540223771442, 0.0033733661241772102] and parameters: {'n_layers': 3, 'embedding_dim': 64, 'lr': 0.001488688533444762, 'lambda_val': 0.002095466473299945, 'batch_size': 1562, 'optimizer': 'RMSprop'}.
2026-07-08 21:39:01,779 - experiment_functions - INFO - Early stopping at epoch 1000. Best Metrics: (0.00643877653271096, 0.0017457211785042643, 0.0041181571404618495)
2026-07-08 21:39:01,850 - optuna.study.study - INFO - Trial 209 finished with values: [0.00643877653271096, 0.0017457211785042643, 0.0041181571404618495] and parameters: {'n_layers': 4, 'embedding_dim': 96, 'lr': 0.0013152005063538942, 'lambda_val': 6.494946904588344e-05, 'batch_size': 3801, 'optimizer': 'RMSprop'}.
2026-07-08 21:40:46,876 - experiment_functions - INFO - Early stopping at epoch 950. Best Metrics: (0.0056056754533707525, 0.001567159926295994, 0.003483639019061)
2026-07-08 21:40:46,968 - optuna.study.study - INFO - Trial 210 finished with values: [0.0056056754533707525, 0.001567159926295994, 0.003483639019061] and parameters: {'n_layers': 4, 'embedding_dim': 256, 'lr': 0.0026199811222762572, 'lambda_val': 3.919783466405167e-06, 'batch_size': 1492, 'optimizer': 'Adam'}.
2026-07-08 21:41:59,741 - experiment_functions - INFO - Early stopping at epoch 650. Best Metrics: (0.005239693130749827, 0.0014550842467184622, 0.003362457769386962)
2026-07-08 21:41:59,829 - optuna.study.study - INFO - Trial 211 finished with values: [0.005239693130749827, 0.0014550842467184622, 0.003362457769386962] and parameters: {'n_layers': 4, 'embedding_dim': 256, 'lr': 0.0026199811222762572, 'lambda_val': 5.207268504744844e-05, 'batch_size': 3285, 'optimizer': 'RMSprop'}.
2026-07-08 21:46:02,629 - experiment_functions - INFO - Early stopping at epoch 2400. Best Metrics: (0.005509429940142303, 0.001494025796402181, 0.003528618377781361)
2026-07-08 21:46:02,711 - optuna.study.study - INFO - Trial 212 finished with values: [0.005509429940142303, 0.001494025796402181, 0.003528618377781361] and parameters: {'n_layers': 3, 'embedding_dim': 256, 'lr': 0.001488688533444762, 'lambda_val': 6.625860010406062e-06, 'batch_size': 1562, 'optimizer': 'Adam'}.
2026-07-08 21:47:39,611 - experiment_functions - INFO - Early stopping at epoch 1100. Best Metrics: (0.005703282379903616, 0.001603252094295538, 0.003665087682069977)
2026-07-08 21:47:39,736 - optuna.study.study - INFO - Trial 213 finished with values: [0.005703282379903616, 0.001603252094295538, 0.003665087682069977] and parameters: {'n_layers': 4, 'embedding_dim': 96, 'lr': 0.0016459794241324855, 'lambda_val': 8.982642030344512e-06, 'batch_size': 3949, 'optimizer': 'Adam'}.
2026-07-08 21:50:40,002 - experiment_functions - INFO - Early stopping at epoch 2000. Best Metrics: (0.006990443572701285, 0.0019755713010276774, 0.004521094339677641)
2026-07-08 21:50:40,221 - optuna.study.study - INFO - Trial 214 finished with values: [0.006990443572701285, 0.0019755713010276774, 0.004521094339677641] and parameters: {'n_layers': 4, 'embedding_dim': 128, 'lr': 0.0013152005063538942, 'lambda_val': 4.325919770856533e-05, 'batch_size': 1562, 'optimizer': 'RMSprop'}.
2026-07-08 21:53:15,391 - experiment_functions - INFO - Early stopping at epoch 1900. Best Metrics: (0.0070981374239072696, 0.0019413787208175826, 0.004694436323226549)
2026-07-08 21:53:15,590 - optuna.study.study - INFO - Trial 215 finished with values: [0.0070981374239072696, 0.0019413787208175826, 0.004694436323226549] and parameters: {'n_layers': 4, 'embedding_dim': 64, 'lr': 0.0013152005063538942, 'lambda_val': 6.625860010406062e-06, 'batch_size': 2341, 'optimizer': 'RMSprop'}.
2026-07-08 21:58:26,952 - optuna.study.study - INFO - Trial 216 finished with values: [0.0013007611568272156, 0.0003333776570484205, 0.0008249814859763533] and parameters: {'n_layers': 3, 'embedding_dim': 64, 'lr': 0.0002188089940774318, 'lambda_val': 0.0011027283717992185, 'batch_size': 3801, 'optimizer': 'RMSprop'}.
2026-07-08 22:01:27,268 - experiment_functions - INFO - Early stopping at epoch 2000. Best Metrics: (0.007062491789378047, 0.001993617385027449, 0.004747427963218622)
2026-07-08 22:01:27,379 - optuna.study.study - INFO - Trial 217 finished with values: [0.007062491789378047, 0.001993617385027449, 0.004747427963218622] and parameters: {'n_layers': 4, 'embedding_dim': 128, 'lr': 0.0013152005063538942, 'lambda_val': 3.96387168983835e-05, 'batch_size': 1686, 'optimizer': 'RMSprop'}.
2026-07-08 22:03:13,162 - experiment_functions - INFO - Early stopping at epoch 1250. Best Metrics: (0.006207253844081903, 0.001725775506715043, 0.004016716389028126)
2026-07-08 22:03:13,534 - optuna.study.study - INFO - Trial 218 finished with values: [0.006207253844081903, 0.001725775506715043, 0.004016716389028126] and parameters: {'n_layers': 3, 'embedding_dim': 96, 'lr': 0.0016459794241324855, 'lambda_val': 2.0431242153221654e-06, 'batch_size': 2454, 'optimizer': 'RMSprop'}.
2026-07-08 22:03:56,838 - experiment_functions - INFO - Early stopping at epoch 500. Best Metrics: (0.00017455021122086948, 5.223866420986646e-05, 0.00010315396979533531)
2026-07-08 22:03:56,961 - optuna.study.study - INFO - Trial 219 finished with values: [0.00017455021122086948, 5.223866420986646e-05, 0.00010315396979533531] and parameters: {'n_layers': 4, 'embedding_dim': 64, 'lr': 0.001488688533444762, 'lambda_val': 0.003732961460813027, 'batch_size': 1562, 'optimizer': 'SGD'}.
2026-07-08 22:09:24,105 - optuna.study.study - INFO - Trial 220 finished with values: [0.005360843730127747, 0.0014455863077712135, 0.003607338097315592] and parameters: {'n_layers': 3, 'embedding_dim': 96, 'lr': 0.0005079724528508135, 'lambda_val': 9.80032649369625e-06, 'batch_size': 2341, 'optimizer': 'RMSprop'}.
2026-07-08 22:10:09,301 - experiment_functions - INFO - Early stopping at epoch 500. Best Metrics: (0.00021800738653609465, 5.793742757821554e-05, 0.00012712733677173926)
2026-07-08 22:10:09,425 - optuna.study.study - INFO - Trial 221 finished with values: [0.00021800738653609465, 5.793742757821554e-05, 0.00012712733677173926] and parameters: {'n_layers': 4, 'embedding_dim': 96, 'lr': 0.0026199811222762572, 'lambda_val': 6.5939387363411675e-06, 'batch_size': 654, 'optimizer': 'SGD'}.
2026-07-08 22:15:50,171 - optuna.study.study - INFO - Trial 222 finished with values: [0.0061486119231831315, 0.0017153277738730696, 0.004064465391704114] and parameters: {'n_layers': 4, 'embedding_dim': 96, 'lr': 0.0005079724528508135, 'lambda_val': 2.0431242153221654e-06, 'batch_size': 3801, 'optimizer': 'RMSprop'}.
2026-07-08 22:18:23,033 - experiment_functions - INFO - Early stopping at epoch 1750. Best Metrics: (0.0063055991877732165, 0.0018103071633455542, 0.004164301059977921)
2026-07-08 22:18:23,142 - optuna.study.study - INFO - Trial 223 finished with values: [0.0063055991877732165, 0.0018103071633455542, 0.004164301059977921] and parameters: {'n_layers': 3, 'embedding_dim': 128, 'lr': 0.0013152005063538942, 'lambda_val': 4.325919770856533e-05, 'batch_size': 2350, 'optimizer': 'RMSprop'}.
2026-07-08 22:21:29,250 - experiment_functions - INFO - Early stopping at epoch 2400. Best Metrics: (0.005483457373913782, 0.0014949755902969057, 0.0035524343557666095)
2026-07-08 22:21:29,356 - optuna.study.study - INFO - Trial 224 finished with values: [0.005483457373913782, 0.0014949755902969057, 0.0035524343557666095] and parameters: {'n_layers': 2, 'embedding_dim': 64, 'lr': 0.002634796822286242, 'lambda_val': 1.3798424398068006e-06, 'batch_size': 891, 'optimizer': 'RMSprop'}.
2026-07-08 22:22:17,019 - experiment_functions - INFO - Early stopping at epoch 500. Best Metrics: (0.00016834770890308714, 5.603783978876584e-05, 9.819785209533709e-05)
2026-07-08 22:22:17,217 - optuna.study.study - INFO - Trial 225 finished with values: [0.00016834770890308714, 5.603783978876584e-05, 9.819785209533709e-05] and parameters: {'n_layers': 4, 'embedding_dim': 128, 'lr': 0.002634796822286242, 'lambda_val': 4.325919770856533e-05, 'batch_size': 891, 'optimizer': 'SGD'}.
2026-07-08 22:23:28,679 - experiment_functions - INFO - Early stopping at epoch 800. Best Metrics: (0.00582705528725558, 0.0016317459111372832, 0.0038434114912819974)
2026-07-08 22:23:28,798 - optuna.study.study - INFO - Trial 226 finished with values: [0.00582705528725558, 0.0016317459111372832, 0.0038434114912819974] and parameters: {'n_layers': 4, 'embedding_dim': 96, 'lr': 0.0020140299216981693, 'lambda_val': 0.0002700570923386852, 'batch_size': 3801, 'optimizer': 'RMSprop'}.
2026-07-08 22:27:28,620 - experiment_functions - INFO - Early stopping at epoch 2400. Best Metrics: (0.0033802160032975963, 0.000972588948198241, 0.0021587228440012696)
2026-07-08 22:27:28,801 - optuna.study.study - INFO - Trial 227 finished with values: [0.0033802160032975963, 0.000972588948198241, 0.0021587228440012696] and parameters: {'n_layers': 3, 'embedding_dim': 256, 'lr': 0.0005079724528508135, 'lambda_val': 0.025557064406181117, 'batch_size': 2341, 'optimizer': 'RMSprop'}.
2026-07-08 22:33:42,121 - optuna.study.study - INFO - Trial 228 finished with values: [0.004227489772714632, 0.0011093592690386187, 0.002789351519461782] and parameters: {'n_layers': 2, 'embedding_dim': 256, 'lr': 0.0009859128880233146, 'lambda_val': 1.0684413344508431e-05, 'batch_size': 1511, 'optimizer': 'Adam'}.
2026-07-08 22:37:38,502 - experiment_functions - INFO - Early stopping at epoch 3050. Best Metrics: (0.0028707961519341533, 0.0007227931538856067, 0.0017720327436542564)
2026-07-08 22:37:38,627 - optuna.study.study - INFO - Trial 229 finished with values: [0.0028707961519341533, 0.0007227931538856067, 0.0017720327436542564] and parameters: {'n_layers': 1, 'embedding_dim': 96, 'lr': 0.0013152005063538942, 'lambda_val': 8.982642030344512e-06, 'batch_size': 3801, 'optimizer': 'Adam'}.
2026-07-08 22:42:58,161 - experiment_functions - INFO - Early stopping at epoch 3000. Best Metrics: (0.00043982974507184095, 9.592918336720931e-05, 0.00023785779733137034)
2026-07-08 22:42:58,313 - optuna.study.study - INFO - Trial 230 finished with values: [0.00043982974507184095, 9.592918336720931e-05, 0.00023785779733137034] and parameters: {'n_layers': 4, 'embedding_dim': 256, 'lr': 0.00010250007094662677, 'lambda_val': 0.0008206810021385492, 'batch_size': 2550, 'optimizer': 'Adam'}.
2026-07-08 22:47:20,994 - experiment_functions - INFO - Early stopping at epoch 2600. Best Metrics: (0.005659500497308365, 0.0015263187888228252, 0.0035722693495726333)
2026-07-08 22:47:21,098 - optuna.study.study - INFO - Trial 231 finished with values: [0.005659500497308365, 0.0015263187888228252, 0.0035722693495726333] and parameters: {'n_layers': 3, 'embedding_dim': 256, 'lr': 0.001488688533444762, 'lambda_val': 1.5167768692426234e-06, 'batch_size': 1562, 'optimizer': 'Adam'}.
2026-07-08 22:48:19,995 - experiment_functions - INFO - Early stopping at epoch 650. Best Metrics: (0.004557262283949245, 0.001319263719772809, 0.0029205250137072)
2026-07-08 22:48:20,103 - optuna.study.study - INFO - Trial 232 finished with values: [0.004557262283949245, 0.001319263719772809, 0.0029205250137072] and parameters: {'n_layers': 4, 'embedding_dim': 96, 'lr': 0.003328720631447993, 'lambda_val': 0.0006720047453101626, 'batch_size': 3127, 'optimizer': 'RMSprop'}.
2026-07-08 22:53:23,474 - optuna.study.study - INFO - Trial 233 finished with values: [0.0028228319560656637, 0.0007398894439906541, 0.0017911113975192386] and parameters: {'n_layers': 4, 'embedding_dim': 32, 'lr': 0.0003947216765049812, 'lambda_val': 4.325919770856533e-05, 'batch_size': 1562, 'optimizer': 'Adam'}.
2026-07-08 22:59:09,470 - optuna.study.study - INFO - Trial 234 finished with values: [0.001125990280424425, 0.0002564443515757081, 0.0007198043765910939] and parameters: {'n_layers': 1, 'embedding_dim': 256, 'lr': 0.0003947216765049812, 'lambda_val': 0.00011408095693043007, 'batch_size': 2350, 'optimizer': 'Adam'}.
2026-07-08 23:01:12,684 - experiment_functions - INFO - Early stopping at epoch 1350. Best Metrics: (0.006303517678855543, 0.0017856125220827078, 0.00411590745121382)
