2026-07-02 22:53:21,694 - optuna.study.study - INFO - Trial 212 finished with values: [0.01383032273278707, 0.0031352696464867127, 0.008095624822665515] and parameters: {'n_layers': 3, 'embedding_dim': 64, 'lr': 0.0006781284315626388, 'lambda_val': 0.0004266548063750315, 'batch_size': 1793, 'optimizer': 'Adam'}.
2026-07-02 22:58:57,890 - experiment_functions - INFO - Early stopping at epoch 2750. Best Metrics: (0.012011058210963155, 0.002782896111543795, 0.007241319136154892)
2026-07-02 22:58:57,968 - optuna.study.study - INFO - Trial 213 finished with values: [0.012011058210963155, 0.002782896111543795, 0.007241319136154892] and parameters: {'n_layers': 3, 'embedding_dim': 256, 'lr': 0.0005152458540342933, 'lambda_val': 0.0007874202710607479, 'batch_size': 1489, 'optimizer': 'RMSprop'}.
2026-07-02 23:04:34,737 - optuna.study.study - INFO - Trial 214 finished with values: [0.007532198660209664, 0.0018710939726079442, 0.004717935193755501] and parameters: {'n_layers': 2, 'embedding_dim': 64, 'lr': 0.0001985012219070607, 'lambda_val': 2.3467434467462208e-05, 'batch_size': 3269, 'optimizer': 'RMSprop'}.
2026-07-02 23:09:54,766 - optuna.study.study - INFO - Trial 215 finished with values: [0.012664760521067598, 0.0030830309822768454, 0.00807934244973086] and parameters: {'n_layers': 1, 'embedding_dim': 64, 'lr': 0.0005152458540342933, 'lambda_val': 5.288093815108994e-05, 'batch_size': 2371, 'optimizer': 'Adam'}.
2026-07-02 23:12:03,178 - experiment_functions - INFO - Early stopping at epoch 1350. Best Metrics: (0.00023261723966920813, 6.458598484128944e-05, 0.0001265222979784343)
2026-07-02 23:12:03,259 - optuna.study.study - INFO - Trial 216 finished with values: [0.00023261723966920813, 6.458598484128944e-05, 0.0001265222979784343] and parameters: {'n_layers': 3, 'embedding_dim': 96, 'lr': 1.1181450885923612e-05, 'lambda_val': 5.288093815108994e-05, 'batch_size': 573, 'optimizer': 'RMSprop'}.
2026-07-02 23:17:41,616 - optuna.study.study - INFO - Trial 217 finished with values: [0.013876039675614222, 0.0031523659365917593, 0.008120787795649217] and parameters: {'n_layers': 3, 'embedding_dim': 32, 'lr': 0.00045784196880844456, 'lambda_val': 2.3467434467462208e-05, 'batch_size': 1948, 'optimizer': 'RMSprop'}.
2026-07-02 23:18:45,197 - experiment_functions - INFO - Early stopping at epoch 550. Best Metrics: (0.007058884374010873, 0.00174287179682009, 0.004331739019175639)
2026-07-02 23:18:45,283 - optuna.study.study - INFO - Trial 218 finished with values: [0.007058884374010873, 0.00174287179682009, 0.004331739019175639] and parameters: {'n_layers': 2, 'embedding_dim': 256, 'lr': 0.007661561762118724, 'lambda_val': 0.000258470339808441, 'batch_size': 2370, 'optimizer': 'Adam'}.
2026-07-02 23:25:09,762 - optuna.study.study - INFO - Trial 219 finished with values: [0.02008493624928479, 0.004688182664361834, 0.012940271174344696] and parameters: {'n_layers': 1, 'embedding_dim': 256, 'lr': 0.0007787505453018097, 'lambda_val': 0.00045598605516994004, 'batch_size': 1891, 'optimizer': 'Adam'}.
2026-07-02 23:29:10,770 - experiment_functions - INFO - Early stopping at epoch 2800. Best Metrics: (0.01583424376179179, 0.0036177649450069337, 0.009730687995137445)
2026-07-02 23:29:10,862 - optuna.study.study - INFO - Trial 220 finished with values: [0.01583424376179179, 0.0036177649450069337, 0.009730687995137445] and parameters: {'n_layers': 2, 'embedding_dim': 64, 'lr': 0.0012100089708552634, 'lambda_val': 9.00355461091747e-05, 'batch_size': 3269, 'optimizer': 'Adam'}.
2026-07-02 23:35:34,360 - optuna.study.study - INFO - Trial 221 finished with values: [0.01788159797069044, 0.004256976236156755, 0.01139718247373114] and parameters: {'n_layers': 1, 'embedding_dim': 256, 'lr': 0.0005152458540342933, 'lambda_val': 0.00020052239202191264, 'batch_size': 3057, 'optimizer': 'Adam'}.
2026-07-02 23:38:05,475 - experiment_functions - INFO - Early stopping at epoch 1350. Best Metrics: (0.01643224053643406, 0.003830518777425299, 0.010334121733641653)
2026-07-02 23:38:05,602 - optuna.study.study - INFO - Trial 222 finished with values: [0.01643224053643406, 0.003830518777425299, 0.010334121733641653] and parameters: {'n_layers': 2, 'embedding_dim': 256, 'lr': 0.0006781284315626388, 'lambda_val': 0.001811142501804266, 'batch_size': 3066, 'optimizer': 'Adam'}.
2026-07-02 23:43:43,821 - optuna.study.study - INFO - Trial 223 finished with values: [0.014153865554302748, 0.003224550272590848, 0.008449708096835536] and parameters: {'n_layers': 3, 'embedding_dim': 32, 'lr': 0.0005152458540342933, 'lambda_val': 5.288093815108994e-05, 'batch_size': 1948, 'optimizer': 'Adam'}.
2026-07-02 23:50:28,486 - optuna.study.study - INFO - Trial 224 finished with values: [0.01280505328449443, 0.0029491100431206434, 0.007664985162113634] and parameters: {'n_layers': 4, 'embedding_dim': 96, 'lr': 0.0005152458540342933, 'lambda_val': 5.288093815108994e-05, 'batch_size': 573, 'optimizer': 'RMSprop'}.
2026-07-02 23:55:51,098 - optuna.study.study - INFO - Trial 225 finished with values: [0.018422604925613057, 0.004343407480576715, 0.01162119042038768] and parameters: {'n_layers': 1, 'embedding_dim': 64, 'lr': 0.0007787505453018097, 'lambda_val': 0.0012545102603406476, 'batch_size': 2278, 'optimizer': 'Adam'}.
2026-07-02 23:56:34,931 - experiment_functions - INFO - Early stopping at epoch 500. Best Metrics: (0.00020379821580440743, 6.36361909465646e-05, 0.00012229366087657004)
2026-07-02 23:56:35,038 - optuna.study.study - INFO - Trial 226 finished with values: [0.00020379821580440743, 6.36361909465646e-05, 0.00012229366087657004] and parameters: {'n_layers': 1, 'embedding_dim': 96, 'lr': 0.0005152458540342933, 'lambda_val': 5.288093815108994e-05, 'batch_size': 2572, 'optimizer': 'SGD'}.
2026-07-02 23:58:58,877 - experiment_functions - INFO - Early stopping at epoch 1550. Best Metrics: (0.00024443178945565247, 7.408392378853788e-05, 0.00014658487325091473)
2026-07-02 23:58:58,978 - optuna.study.study - INFO - Trial 227 finished with values: [0.00024443178945565247, 7.408392378853788e-05, 0.00014658487325091473] and parameters: {'n_layers': 2, 'embedding_dim': 128, 'lr': 1.5546426158312652e-05, 'lambda_val': 1.6046175410536033e-05, 'batch_size': 667, 'optimizer': 'RMSprop'}.
2026-07-03 00:05:12,310 - optuna.study.study - INFO - Trial 228 finished with values: [0.01631609307471024, 0.0039027031134243866, 0.01005170795522407] and parameters: {'n_layers': 2, 'embedding_dim': 128, 'lr': 0.0006781284315626388, 'lambda_val': 0.0004266548063750315, 'batch_size': 1170, 'optimizer': 'Adam'}.
2026-07-03 00:05:59,688 - experiment_functions - INFO - Early stopping at epoch 550. Best Metrics: (0.005834050616353143, 0.0014588834222973616, 0.0038980727026845735)
2026-07-03 00:05:59,800 - optuna.study.study - INFO - Trial 229 finished with values: [0.005834050616353143, 0.0014588834222973616, 0.0038980727026845735] and parameters: {'n_layers': 1, 'embedding_dim': 64, 'lr': 0.01393630139283661, 'lambda_val': 0.00045598605516994004, 'batch_size': 2340, 'optimizer': 'RMSprop'}.
2026-07-03 00:06:45,230 - experiment_functions - INFO - Early stopping at epoch 500. Best Metrics: (0.00022896351348123013, 5.9837015367665226e-05, 0.00013377125277779807)
2026-07-03 00:06:46,090 - optuna.study.study - INFO - Trial 230 finished with values: [0.00022896351348123013, 5.9837015367665226e-05, 0.00013377125277779807] and parameters: {'n_layers': 2, 'embedding_dim': 64, 'lr': 0.0005152458540342933, 'lambda_val': 5.288093815108994e-05, 'batch_size': 1891, 'optimizer': 'SGD'}.
2026-07-03 00:13:07,216 - optuna.study.study - INFO - Trial 231 finished with values: [0.016818340114435264, 0.003985335182265449, 0.010919315251402443] and parameters: {'n_layers': 1, 'embedding_dim': 256, 'lr': 0.0005693523871630874, 'lambda_val': 0.005299023139585472, 'batch_size': 3332, 'optimizer': 'RMSprop'}.
2026-07-03 00:18:49,946 - optuna.study.study - INFO - Trial 232 finished with values: [0.016225221150494334, 0.0038533138308986955, 0.009786726352077536] and parameters: {'n_layers': 2, 'embedding_dim': 64, 'lr': 0.0006781284315626388, 'lambda_val': 0.0008302700861970946, 'batch_size': 2432, 'optimizer': 'Adam'}.
2026-07-03 00:21:24,775 - experiment_functions - INFO - Early stopping at epoch 1250. Best Metrics: (0.012564708844964488, 0.002847482096385085, 0.0074740842677699934)
2026-07-03 00:21:24,875 - optuna.study.study - INFO - Trial 233 finished with values: [0.012564708844964488, 0.002847482096385085, 0.0074740842677699934] and parameters: {'n_layers': 3, 'embedding_dim': 256, 'lr': 0.0006781284315626388, 'lambda_val': 5.246496407901207e-06, 'batch_size': 981, 'optimizer': 'RMSprop'}.
2026-07-03 00:27:43,950 - optuna.study.study - INFO - Trial 234 finished with values: [0.015462893259328122, 0.003682350929848223, 0.009831672137219947] and parameters: {'n_layers': 1, 'embedding_dim': 256, 'lr': 0.0005693523871630874, 'lambda_val': 0.00020052239202191264, 'batch_size': 1092, 'optimizer': 'RMSprop'}.
2026-07-03 00:33:23,011 - optuna.study.study - INFO - Trial 235 finished with values: [0.013001593439166868, 0.0030611857226981753, 0.007774250071429899] and parameters: {'n_layers': 2, 'embedding_dim': 64, 'lr': 0.0005152458540342933, 'lambda_val': 0.004935686998929018, 'batch_size': 677, 'optimizer': 'Adam'}.
2026-07-03 00:39:03,679 - optuna.study.study - INFO - Trial 236 finished with values: [0.015187380366826346, 0.0036576562885853774, 0.009000547503531084] and parameters: {'n_layers': 2, 'embedding_dim': 64, 'lr': 0.0005152458540342933, 'lambda_val': 5.288093815108994e-05, 'batch_size': 1948, 'optimizer': 'Adam'}.
2026-07-03 00:44:56,853 - optuna.study.study - INFO - Trial 237 finished with values: [0.001465299208020806, 0.0003561727105218168, 0.0008671507719313] and parameters: {'n_layers': 3, 'embedding_dim': 64, 'lr': 9.596973225389827e-05, 'lambda_val': 2.3467434467462208e-05, 'batch_size': 3269, 'optimizer': 'RMSprop'}.
2026-07-03 00:50:07,603 - experiment_functions - INFO - Early stopping at epoch 3450. Best Metrics: (0.015064026953919712, 0.0035835723647968387, 0.009215302741032393)
2026-07-03 00:50:07,702 - optuna.study.study - INFO - Trial 238 finished with values: [0.015064026953919712, 0.0035835723647968387, 0.009215302741032393] and parameters: {'n_layers': 3, 'embedding_dim': 64, 'lr': 0.0005152458540342933, 'lambda_val': 0.0002715838662966775, 'batch_size': 1462, 'optimizer': 'RMSprop'}.
2026-07-03 00:50:49,430 - experiment_functions - INFO - Early stopping at epoch 500. Best Metrics: (0.00017364196885324377, 5.8887221472940384e-05, 0.00011859104034761703)
2026-07-03 00:50:49,531 - optuna.study.study - INFO - Trial 239 finished with values: [0.00017364196885324377, 5.8887221472940384e-05, 0.00011859104034761703] and parameters: {'n_layers': 1, 'embedding_dim': 32, 'lr': 0.0005693523871630874, 'lambda_val': 0.02274341959029943, 'batch_size': 1948, 'optimizer': 'Adam'}.
2026-07-03 00:56:31,101 - optuna.study.study - INFO - Trial 240 finished with values: [0.015577739484420983, 0.003651957525217028, 0.00954391833636662] and parameters: {'n_layers': 2, 'embedding_dim': 64, 'lr': 0.0005152458540342933, 'lambda_val': 5.288093815108994e-05, 'batch_size': 3269, 'optimizer': 'RMSprop'}.
2026-07-03 00:59:54,902 - experiment_functions - INFO - Early stopping at epoch 2600. Best Metrics: (0.012173141531289969, 0.002784795699333245, 0.007249471652345895)
2026-07-03 00:59:55,044 - optuna.study.study - INFO - Trial 241 finished with values: [0.012173141531289969, 0.002784795699333245, 0.007249471652345895] and parameters: {'n_layers': 1, 'embedding_dim': 32, 'lr': 0.004674761931022821, 'lambda_val': 0.0004266548063750315, 'batch_size': 677, 'optimizer': 'Adam'}.
2026-07-03 01:00:58,573 - experiment_functions - INFO - Early stopping at epoch 500. Best Metrics: (0.00018476695850068686, 5.698763368349069e-05, 0.00010529858064165771)
2026-07-03 01:00:58,678 - optuna.study.study - INFO - Trial 242 finished with values: [0.00018476695850068686, 5.698763368349069e-05, 0.00010529858064165771] and parameters: {'n_layers': 3, 'embedding_dim': 256, 'lr': 0.00045784196880844456, 'lambda_val': 0.003381769296625175, 'batch_size': 3579, 'optimizer': 'SGD'}.
2026-07-03 01:03:42,474 - experiment_functions - INFO - Early stopping at epoch 1900. Best Metrics: (0.014972530072452132, 0.003502839883745228, 0.008917210217863335)
2026-07-03 01:03:42,575 - optuna.study.study - INFO - Trial 243 finished with values: [0.014972530072452132, 0.003502839883745228, 0.008917210217863335] and parameters: {'n_layers': 2, 'embedding_dim': 64, 'lr': 0.0005152458540342933, 'lambda_val': 0.0011201236742586218, 'batch_size': 3659, 'optimizer': 'RMSprop'}.
2026-07-03 01:09:03,736 - optuna.study.study - INFO - Trial 244 finished with values: [0.015169243691460216, 0.0036662044336379005, 0.009576916649878127] and parameters: {'n_layers': 1, 'embedding_dim': 64, 'lr': 0.0005152458540342933, 'lambda_val': 9.00355461091747e-05, 'batch_size': 3112, 'optimizer': 'Adam'}.
2026-07-03 01:14:27,927 - experiment_functions - INFO - Early stopping at epoch 3800. Best Metrics: (0.014054950798137978, 0.0033128811048002585, 0.008505874514308327)
2026-07-03 01:14:28,032 - optuna.study.study - INFO - Trial 245 finished with values: [0.014054950798137978, 0.0033128811048002585, 0.008505874514308327] and parameters: {'n_layers': 2, 'embedding_dim': 64, 'lr': 0.00045784196880844456, 'lambda_val': 0.003381769296625175, 'batch_size': 3487, 'optimizer': 'Adam'}.
2026-07-03 01:20:22,301 - optuna.study.study - INFO - Trial 246 finished with values: [0.013140196753780222, 0.003080181600592672, 0.007928086096212643] and parameters: {'n_layers': 2, 'embedding_dim': 96, 'lr': 0.00026052492972575584, 'lambda_val': 2.3467434467462208e-05, 'batch_size': 3269, 'optimizer': 'RMSprop'}.
2026-07-03 01:24:50,402 - experiment_functions - INFO - Early stopping at epoch 3300. Best Metrics: (0.014288243789677248, 0.003310981517010809, 0.008442779913300138)
2026-07-03 01:24:50,500 - optuna.study.study - INFO - Trial 247 finished with values: [0.014288243789677248, 0.003310981517010809, 0.008442779913300138] and parameters: {'n_layers': 2, 'embedding_dim': 32, 'lr': 0.00045784196880844456, 'lambda_val': 0.003381769296625175, 'batch_size': 1891, 'optimizer': 'RMSprop'}.
2026-07-03 01:31:22,604 - experiment_functions - INFO - Early stopping at epoch 3600. Best Metrics: (0.015695552450558436, 0.0037203426856372173, 0.009584385361517464)
2026-07-03 01:31:22,756 - optuna.study.study - INFO - Trial 248 finished with values: [0.015695552450558436, 0.0037203426856372173, 0.009584385361517464] and parameters: {'n_layers': 2, 'embedding_dim': 256, 'lr': 0.0005152458540342933, 'lambda_val': 0.0005995419679288804, 'batch_size': 3269, 'optimizer': 'RMSprop'}.
2026-07-03 01:33:08,494 - experiment_functions - INFO - Early stopping at epoch 1100. Best Metrics: (0.001743006756768229, 0.000508139733677792, 0.0010731154784270319)
2026-07-03 01:33:08,647 - optuna.study.study - INFO - Trial 249 finished with values: [0.001743006756768229, 0.000508139733677792, 0.0010731154784270319] and parameters: {'n_layers': 4, 'embedding_dim': 64, 'lr': 0.0006781284315626388, 'lambda_val': 0.01911653759370279, 'batch_size': 981, 'optimizer': 'RMSprop'}.
2026-07-03 01:38:24,602 - experiment_functions - INFO - Early stopping at epoch 3700. Best Metrics: (0.014627277347185278, 0.003462948540166784, 0.008666965449689774)
2026-07-03 01:38:24,706 - optuna.study.study - INFO - Trial 250 finished with values: [0.014627277347185278, 0.003462948540166784, 0.008666965449689774] and parameters: {'n_layers': 2, 'embedding_dim': 64, 'lr': 0.0006781284315626388, 'lambda_val': 0.0011201236742586218, 'batch_size': 3659, 'optimizer': 'RMSprop'}.
2026-07-03 01:40:29,987 - experiment_functions - INFO - Early stopping at epoch 1450. Best Metrics: (0.013045000120907601, 0.0030744828372243223, 0.007680218190914839)
2026-07-03 01:40:30,134 - optuna.study.study - INFO - Trial 251 finished with values: [0.013045000120907601, 0.0030744828372243223, 0.007680218190914839] and parameters: {'n_layers': 2, 'embedding_dim': 64, 'lr': 0.00045784196880844456, 'lambda_val': 0.003381769296625175, 'batch_size': 3659, 'optimizer': 'RMSprop'}.
2026-07-03 01:46:55,369 - optuna.study.study - INFO - Trial 252 finished with values: [0.019186983682679928, 0.004645441939099216, 0.012250395744055002] and parameters: {'n_layers': 1, 'embedding_dim': 256, 'lr': 0.0005693523871630874, 'lambda_val': 0.00020052239202191264, 'batch_size': 3332, 'optimizer': 'Adam'}.
2026-07-03 01:47:45,638 - experiment_functions - INFO - Early stopping at epoch 550. Best Metrics: (0.007153370342174884, 0.00189578861387079, 0.004551044850956736)
2026-07-03 01:47:45,739 - optuna.study.study - INFO - Trial 253 finished with values: [0.007153370342174884, 0.00189578861387079, 0.004551044850956736] and parameters: {'n_layers': 2, 'embedding_dim': 64, 'lr': 0.004312263630434214, 'lambda_val': 5.288093815108994e-05, 'batch_size': 2278, 'optimizer': 'RMSprop'}.
2026-07-03 01:54:07,097 - optuna.study.study - INFO - Trial 254 finished with values: [0.017596345105448746, 0.004226582831525559, 0.011156365662661151] and parameters: {'n_layers': 1, 'embedding_dim': 256, 'lr': 0.0005152458540342933, 'lambda_val': 0.003381769296625175, 'batch_size': 3057, 'optimizer': 'RMSprop'}.
2026-07-03 01:54:49,811 - experiment_functions - INFO - Early stopping at epoch 500. Best Metrics: (0.00023809773241679997, 5.4138251999316165e-05, 0.00013100685017399368)
2026-07-03 01:54:49,924 - optuna.study.study - INFO - Trial 255 finished with values: [0.00023809773241679997, 5.4138251999316165e-05, 0.00013100685017399368] and parameters: {'n_layers': 1, 'embedding_dim': 64, 'lr': 0.0005152458540342933, 'lambda_val': 0.0011201236742586218, 'batch_size': 2010, 'optimizer': 'SGD'}.
2026-07-03 01:58:09,897 - experiment_functions - INFO - Early stopping at epoch 2450. Best Metrics: (0.012414545955165954, 0.0030022985012252345, 0.0073833595892476515)
2026-07-03 01:58:09,996 - optuna.study.study - INFO - Trial 256 finished with values: [0.012414545955165954, 0.0030022985012252345, 0.0073833595892476515] and parameters: {'n_layers': 2, 'embedding_dim': 32, 'lr': 0.00045784196880844456, 'lambda_val': 0.008798881322768575, 'batch_size': 1891, 'optimizer': 'RMSprop'}.
2026-07-03 02:04:05,593 - optuna.study.study - INFO - Trial 257 finished with values: [0.017089188993911993, 0.003964439716581502, 0.010237581453345667] and parameters: {'n_layers': 2, 'embedding_dim': 96, 'lr': 0.0005152458540342933, 'lambda_val': 5.288093815108994e-05, 'batch_size': 1891, 'optimizer': 'RMSprop'}.
2026-07-03 02:05:01,625 - experiment_functions - INFO - Early stopping at epoch 550. Best Metrics: (0.0021192856329402023, 0.0005223866420986646, 0.0012925178942824504)
2026-07-03 02:05:01,756 - optuna.study.study - INFO - Trial 258 finished with values: [0.0021192856329402023, 0.0005223866420986646, 0.0012925178942824504] and parameters: {'n_layers': 1, 'embedding_dim': 256, 'lr': 0.09661619955668717, 'lambda_val': 0.00020052239202191264, 'batch_size': 3057, 'optimizer': 'Adam'}.
2026-07-03 02:10:54,416 - optuna.study.study - INFO - Trial 259 finished with values: [0.013002602121431112, 0.0030450392264878517, 0.007462953343645236] and parameters: {'n_layers': 4, 'embedding_dim': 32, 'lr': 0.00045784196880844456, 'lambda_val': 2.3467434467462208e-05, 'batch_size': 1891, 'optimizer': 'Adam'}.
2026-07-03 02:16:21,076 - optuna.study.study - INFO - Trial 260 finished with values: [0.016136010619131745, 0.0037944266094257547, 0.009948853240094271] and parameters: {'n_layers': 2, 'embedding_dim': 32, 'lr': 0.0006781284315626388, 'lambda_val': 0.00045598605516994004, 'batch_size': 1895, 'optimizer': 'RMSprop'}.
2026-07-03 02:21:59,736 - optuna.study.study - INFO - Trial 261 finished with values: [0.013359080337910383, 0.0031295708831183626, 0.007700669331559379] and parameters: {'n_layers': 2, 'embedding_dim': 64, 'lr': 0.00045784196880844456, 'lambda_val': 0.003381769296625175, 'batch_size': 677, 'optimizer': 'RMSprop'}.
2026-07-03 02:28:22,399 - optuna.study.study - INFO - Trial 262 finished with values: [0.02074915112329927, 0.0048439488630967085, 0.013100681887294793] and parameters: {'n_layers': 1, 'embedding_dim': 256, 'lr': 0.0007787505453018097, 'lambda_val': 0.00045598605516994004, 'batch_size': 2278, 'optimizer': 'RMSprop'}.
2026-07-03 02:30:37,213 - experiment_functions - INFO - Early stopping at epoch 1400. Best Metrics: (0.01229794185232813, 0.002789544668806869, 0.007418886036964945)
2026-07-03 02:30:37,324 - optuna.study.study - INFO - Trial 263 finished with values: [0.01229794185232813, 0.002789544668806869, 0.007418886036964945] and parameters: {'n_layers': 4, 'embedding_dim': 64, 'lr': 0.0005152458540342933, 'lambda_val': 0.0005501993615550524, 'batch_size': 2278, 'optimizer': 'RMSprop'}.
2026-07-03 02:36:17,525 - optuna.study.study - INFO - Trial 264 finished with values: [0.015782417555312872, 0.003766882586478735, 0.009659998544915551] and parameters: {'n_layers': 2, 'embedding_dim': 64, 'lr': 0.0005152458540342933, 'lambda_val': 5.288093815108994e-05, 'batch_size': 1948, 'optimizer': 'Adam'}.
2026-07-03 02:41:38,378 - optuna.study.study - INFO - Trial 265 finished with values: [0.017091224396454323, 0.004078414983948483, 0.010265066682523886] and parameters: {'n_layers': 1, 'embedding_dim': 64, 'lr': 0.0007787505453018097, 'lambda_val': 0.0012545102603406476, 'batch_size': 2278, 'optimizer': 'RMSprop'}.
2026-07-03 02:47:03,482 - optuna.study.study - INFO - Trial 266 finished with values: [0.014307701330067738, 0.0033470736850103526, 0.008559205951683658] and parameters: {'n_layers': 2, 'embedding_dim': 32, 'lr': 0.00045784196880844456, 'lambda_val': 0.00020052239202191264, 'batch_size': 1891, 'optimizer': 'RMSprop'}.
