2026-06-30 03:27:54,655 - optuna.study.study - INFO - Trial 188 finished with values: [0.002476152798815261, 0.0007047470698858348, 0.0016511932555172582] and parameters: {'n_layers': 2, 'embedding_dim': 256, 'lr': 0.0013047089047836713, 'lambda_val': 2.199939619081897e-06, 'batch_size': 620, 'optimizer': 'RMSprop'}.
2026-06-30 03:28:36,774 - experiment_functions - INFO - Early stopping at epoch 500. Best Metrics: (0.00021145478776395923, 5.223866420986646e-05, 0.00012736420306892876)
2026-06-30 03:28:36,843 - optuna.study.study - INFO - Trial 189 finished with values: [0.00021145478776395923, 5.223866420986646e-05, 0.00012736420306892876] and parameters: {'n_layers': 3, 'embedding_dim': 64, 'lr': 0.0013047089047836713, 'lambda_val': 0.0005400904118495423, 'batch_size': 3827, 'optimizer': 'SGD'}.
2026-06-30 03:33:33,978 - optuna.study.study - INFO - Trial 190 finished with values: [0.0017610165184177426, 0.00043880477936287827, 0.0011456453022777706] and parameters: {'n_layers': 3, 'embedding_dim': 32, 'lr': 0.0005030162275943933, 'lambda_val': 2.281093086329608e-05, 'batch_size': 3470, 'optimizer': 'Adam'}.
2026-06-30 03:35:07,435 - experiment_functions - INFO - Early stopping at epoch 1150. Best Metrics: (0.0011555235806299416, 0.00038276693957411246, 0.0007919281386917018)
2026-06-30 03:35:07,524 - optuna.study.study - INFO - Trial 191 finished with values: [0.0011555235806299416, 0.00038276693957411246, 0.0007919281386917018] and parameters: {'n_layers': 2, 'embedding_dim': 96, 'lr': 0.021245875855951238, 'lambda_val': 0.02801404234885656, 'batch_size': 3028, 'optimizer': 'Adam'}.
2026-06-30 03:40:05,025 - optuna.study.study - INFO - Trial 192 finished with values: [0.0023367898376881633, 0.0005964705658872025, 0.001520154250534125] and parameters: {'n_layers': 3, 'embedding_dim': 32, 'lr': 0.0013047089047836713, 'lambda_val': 6.696439606049452e-06, 'batch_size': 620, 'optimizer': 'Adam'}.
2026-06-30 03:45:05,532 - optuna.study.study - INFO - Trial 193 finished with values: [0.0018153537974073904, 0.0004796459168360466, 0.001227970948581012] and parameters: {'n_layers': 4, 'embedding_dim': 32, 'lr': 0.0005030162275943933, 'lambda_val': 1.554897118169841e-06, 'batch_size': 2664, 'optimizer': 'Adam'}.
2026-06-30 03:49:13,500 - experiment_functions - INFO - Early stopping at epoch 3300. Best Metrics: (0.0005156166513435341, 0.00011112588568280684, 0.00026478850127914586)
2026-06-30 03:49:13,582 - optuna.study.study - INFO - Trial 194 finished with values: [0.0005156166513435341, 0.00011112588568280684, 0.00026478850127914586] and parameters: {'n_layers': 4, 'embedding_dim': 32, 'lr': 0.00010333111840570907, 'lambda_val': 6.696439606049452e-06, 'batch_size': 3604, 'optimizer': 'Adam'}.
2026-06-30 03:50:02,396 - experiment_functions - INFO - Early stopping at epoch 600. Best Metrics: (0.0012902760928862114, 0.0003609216799954411, 0.0008594272515389619)
2026-06-30 03:50:02,480 - optuna.study.study - INFO - Trial 195 finished with values: [0.0012902760928862114, 0.0003609216799954411, 0.0008594272515389619] and parameters: {'n_layers': 2, 'embedding_dim': 64, 'lr': 0.0202036133857427, 'lambda_val': 3.423463120625302e-05, 'batch_size': 3239, 'optimizer': 'RMSprop'}.
2026-06-30 03:52:57,412 - experiment_functions - INFO - Early stopping at epoch 2300. Best Metrics: (0.002482288218439252, 0.0006696046957810157, 0.0016452896461033478)
2026-06-30 03:52:57,489 - optuna.study.study - INFO - Trial 196 finished with values: [0.002482288218439252, 0.0006696046957810157, 0.0016452896461033478] and parameters: {'n_layers': 4, 'embedding_dim': 32, 'lr': 0.0013047089047836713, 'lambda_val': 3.918882692849622e-06, 'batch_size': 2836, 'optimizer': 'Adam'}.
2026-06-30 03:54:04,313 - experiment_functions - INFO - Early stopping at epoch 800. Best Metrics: (0.0024578329181131607, 0.0006895503675702373, 0.0016621258516614364)
2026-06-30 03:54:04,433 - optuna.study.study - INFO - Trial 197 finished with values: [0.0024578329181131607, 0.0006895503675702373, 0.0016621258516614364] and parameters: {'n_layers': 4, 'embedding_dim': 64, 'lr': 0.0017025182331862833, 'lambda_val': 0.001512103562001924, 'batch_size': 2746, 'optimizer': 'RMSprop'}.
2026-06-30 03:59:20,581 - optuna.study.study - INFO - Trial 198 finished with values: [0.0025768475528478254, 0.0007018976882016602, 0.0018082277037200503] and parameters: {'n_layers': 4, 'embedding_dim': 64, 'lr': 0.0005030162275943933, 'lambda_val': 1.582941209280553e-06, 'batch_size': 3604, 'optimizer': 'RMSprop'}.
2026-06-30 04:04:30,833 - optuna.study.study - INFO - Trial 199 finished with values: [0.003442863238148425, 0.0009156013145147503, 0.002284939759027446] and parameters: {'n_layers': 3, 'embedding_dim': 64, 'lr': 0.0013047089047836713, 'lambda_val': 2.199939619081897e-06, 'batch_size': 620, 'optimizer': 'RMSprop'}.
2026-06-30 04:05:44,352 - experiment_functions - INFO - Early stopping at epoch 800. Best Metrics: (0.0019862146138470618, 0.0006012195353608267, 0.0013638043583836623)
2026-06-30 04:05:44,435 - optuna.study.study - INFO - Trial 200 finished with values: [0.0019862146138470618, 0.0006012195353608267, 0.0013638043583836623] and parameters: {'n_layers': 4, 'embedding_dim': 128, 'lr': 0.0019032891633152442, 'lambda_val': 0.004495593710473149, 'batch_size': 4019, 'optimizer': 'Adam'}.
2026-06-30 04:06:55,362 - experiment_functions - INFO - Early stopping at epoch 650. Best Metrics: (0.002366831208325199, 0.0007018976882016603, 0.001548379288650576)
2026-06-30 04:06:55,460 - optuna.study.study - INFO - Trial 201 finished with values: [0.002366831208325199, 0.0007018976882016603, 0.001548379288650576] and parameters: {'n_layers': 4, 'embedding_dim': 256, 'lr': 0.003551859771094245, 'lambda_val': 2.281093086329608e-05, 'batch_size': 2664, 'optimizer': 'RMSprop'}.
2026-06-30 04:11:34,411 - experiment_functions - INFO - Early stopping at epoch 3700. Best Metrics: (0.003585500360779381, 0.0009811370932507645, 0.002387289615993541)
2026-06-30 04:11:34,504 - optuna.study.study - INFO - Trial 202 finished with values: [0.003585500360779381, 0.0009811370932507645, 0.002387289615993541] and parameters: {'n_layers': 4, 'embedding_dim': 32, 'lr': 0.0019032891633152442, 'lambda_val': 1.4824096770292976e-06, 'batch_size': 620, 'optimizer': 'RMSprop'}.
2026-06-30 04:14:02,838 - experiment_functions - INFO - Early stopping at epoch 1950. Best Metrics: (0.002452180585710082, 0.0006942993370438616, 0.0016467865286807863)
2026-06-30 04:14:02,920 - optuna.study.study - INFO - Trial 203 finished with values: [0.002452180585710082, 0.0006942993370438616, 0.0016467865286807863] and parameters: {'n_layers': 4, 'embedding_dim': 32, 'lr': 0.0013047089047836713, 'lambda_val': 6.696439606049452e-06, 'batch_size': 3757, 'optimizer': 'RMSprop'}.
2026-06-30 04:14:45,002 - experiment_functions - INFO - Early stopping at epoch 500. Best Metrics: (0.00021335011600307518, 5.7937427578215534e-05, 0.00011046674446036347)
2026-06-30 04:14:45,097 - optuna.study.study - INFO - Trial 204 finished with values: [0.00021335011600307518, 5.7937427578215534e-05, 0.00011046674446036347] and parameters: {'n_layers': 3, 'embedding_dim': 64, 'lr': 0.0019032891633152442, 'lambda_val': 1.4824096770292976e-06, 'batch_size': 620, 'optimizer': 'SGD'}.
2026-06-30 04:15:26,410 - experiment_functions - INFO - Early stopping at epoch 500. Best Metrics: (0.00022389154429415802, 6.268639705183975e-05, 0.00012094432929661946)
2026-06-30 04:15:26,515 - optuna.study.study - INFO - Trial 205 finished with values: [0.00022389154429415802, 6.268639705183975e-05, 0.00012094432929661946] and parameters: {'n_layers': 2, 'embedding_dim': 64, 'lr': 0.0005030162275943933, 'lambda_val': 0.08950252276131834, 'batch_size': 620, 'optimizer': 'RMSprop'}.
2026-06-30 04:17:12,622 - experiment_functions - INFO - Early stopping at epoch 1050. Best Metrics: (0.0022545544564593263, 0.0006477594362023442, 0.0014933484521764647)
2026-06-30 04:17:12,697 - optuna.study.study - INFO - Trial 206 finished with values: [0.0022545544564593263, 0.0006477594362023442, 0.0014933484521764647] and parameters: {'n_layers': 3, 'embedding_dim': 256, 'lr': 0.002732548141775194, 'lambda_val': 0.0008637852745302033, 'batch_size': 620, 'optimizer': 'Adam'}.
2026-06-30 04:19:45,210 - experiment_functions - INFO - Early stopping at epoch 1900. Best Metrics: (0.003495908356187962, 0.000966890184829892, 0.002330713738373327)
2026-06-30 04:19:45,293 - optuna.study.study - INFO - Trial 207 finished with values: [0.003495908356187962, 0.000966890184829892, 0.002330713738373327] and parameters: {'n_layers': 4, 'embedding_dim': 64, 'lr': 0.0013047089047836713, 'lambda_val': 3.9206514264817366e-05, 'batch_size': 1750, 'optimizer': 'RMSprop'}.
2026-06-30 04:22:48,493 - experiment_functions - INFO - Early stopping at epoch 2300. Best Metrics: (0.003220638852571028, 0.0009573922458826436, 0.0021864561828936137)
2026-06-30 04:22:48,577 - optuna.study.study - INFO - Trial 208 finished with values: [0.003220638852571028, 0.0009573922458826436, 0.0021864561828936137] and parameters: {'n_layers': 4, 'embedding_dim': 64, 'lr': 0.0013047089047836713, 'lambda_val': 1.582941209280553e-06, 'batch_size': 1739, 'optimizer': 'RMSprop'}.
2026-06-30 04:26:53,480 - experiment_functions - INFO - Early stopping at epoch 2500. Best Metrics: (0.002624266448147777, 0.0007674334669376745, 0.0017970368915419751)
2026-06-30 04:26:53,549 - optuna.study.study - INFO - Trial 209 finished with values: [0.002624266448147777, 0.0007674334669376745, 0.0017970368915419751] and parameters: {'n_layers': 3, 'embedding_dim': 256, 'lr': 0.0013047089047836713, 'lambda_val': 2.199939619081897e-06, 'batch_size': 2346, 'optimizer': 'RMSprop'}.
2026-06-30 04:29:05,474 - experiment_functions - INFO - Early stopping at epoch 1250. Best Metrics: (0.0020101587654670944, 0.0005831734513610546, 0.0013972874495964183)
2026-06-30 04:29:05,563 - optuna.study.study - INFO - Trial 210 finished with values: [0.0020101587654670944, 0.0005831734513610546, 0.0013972874495964183] and parameters: {'n_layers': 4, 'embedding_dim': 256, 'lr': 0.0005030162275943933, 'lambda_val': 0.007239505689320495, 'batch_size': 2746, 'optimizer': 'RMSprop'}.
2026-06-30 04:29:57,058 - experiment_functions - INFO - Early stopping at epoch 500. Best Metrics: (0.0002233831310664681, 5.9837015367665226e-05, 0.00011641509657505713)
2026-06-30 04:29:57,148 - optuna.study.study - INFO - Trial 211 finished with values: [0.0002233831310664681, 5.9837015367665226e-05, 0.00011641509657505713] and parameters: {'n_layers': 3, 'embedding_dim': 256, 'lr': 0.0013047089047836713, 'lambda_val': 1.4824096770292976e-06, 'batch_size': 620, 'optimizer': 'SGD'}.
2026-06-30 04:32:35,030 - experiment_functions - INFO - Early stopping at epoch 2150. Best Metrics: (0.0021675418063604257, 0.000471097771783523, 0.0013202414392910053)
2026-06-30 04:32:35,123 - optuna.study.study - INFO - Trial 212 finished with values: [0.0021675418063604257, 0.000471097771783523, 0.0013202414392910053] and parameters: {'n_layers': 1, 'embedding_dim': 32, 'lr': 0.0009496158639399897, 'lambda_val': 3.9206514264817366e-05, 'batch_size': 3604, 'optimizer': 'RMSprop'}.
2026-06-30 04:36:03,748 - experiment_functions - INFO - Early stopping at epoch 2000. Best Metrics: (0.0029802200140728206, 0.0008757099709363068, 0.0019974517871875304)
2026-06-30 04:36:03,832 - optuna.study.study - INFO - Trial 213 finished with values: [0.0029802200140728206, 0.0008757099709363068, 0.0019974517871875304] and parameters: {'n_layers': 4, 'embedding_dim': 256, 'lr': 0.0019032891633152442, 'lambda_val': 2.199939619081897e-06, 'batch_size': 620, 'optimizer': 'RMSprop'}.
2026-06-30 04:38:30,904 - experiment_functions - INFO - Early stopping at epoch 2000. Best Metrics: (0.0023606305985831035, 0.0005375833444142622, 0.0014667292155289037)
2026-06-30 04:38:30,971 - optuna.study.study - INFO - Trial 214 finished with values: [0.0023606305985831035, 0.0005375833444142622, 0.0014667292155289037] and parameters: {'n_layers': 1, 'embedding_dim': 32, 'lr': 0.0013047089047836713, 'lambda_val': 1.4824096770292976e-06, 'batch_size': 1624, 'optimizer': 'RMSprop'}.
2026-06-30 04:41:56,309 - experiment_functions - INFO - Early stopping at epoch 1950. Best Metrics: (0.002499097483574869, 0.0007113956271489087, 0.0016211966260802394)
2026-06-30 04:41:56,399 - optuna.study.study - INFO - Trial 215 finished with values: [0.002499097483574869, 0.0007113956271489087, 0.0016211966260802394] and parameters: {'n_layers': 4, 'embedding_dim': 256, 'lr': 0.0013047089047836713, 'lambda_val': 1.582941209280553e-06, 'batch_size': 1429, 'optimizer': 'Adam'}.
2026-06-30 04:47:17,700 - optuna.study.study - INFO - Trial 216 finished with values: [0.0013202213733023284, 0.00036377106167961555, 0.0008816428027104241] and parameters: {'n_layers': 3, 'embedding_dim': 96, 'lr': 0.0005878583114905817, 'lambda_val': 0.01909303983156082, 'batch_size': 620, 'optimizer': 'RMSprop'}.
2026-06-30 04:48:44,095 - experiment_functions - INFO - Early stopping at epoch 850. Best Metrics: (0.002282724697110012, 0.0006525084056759682, 0.0015555603910265767)
2026-06-30 04:48:44,171 - optuna.study.study - INFO - Trial 217 finished with values: [0.002282724697110012, 0.0006525084056759682, 0.0015555603910265767] and parameters: {'n_layers': 3, 'embedding_dim': 256, 'lr': 0.0013047089047836713, 'lambda_val': 0.0005400904118495423, 'batch_size': 2836, 'optimizer': 'RMSprop'}.
2026-06-30 04:52:05,891 - experiment_functions - INFO - Early stopping at epoch 2700. Best Metrics: (0.002454662261806427, 0.0006297133522025722, 0.0016289711578661187)
2026-06-30 04:52:05,964 - optuna.study.study - INFO - Trial 218 finished with values: [0.002454662261806427, 0.0006297133522025722, 0.0016289711578661187] and parameters: {'n_layers': 3, 'embedding_dim': 32, 'lr': 0.0019032891633152442, 'lambda_val': 1.554897118169841e-06, 'batch_size': 620, 'optimizer': 'Adam'}.
2026-06-30 04:54:47,379 - experiment_functions - INFO - Early stopping at epoch 2050. Best Metrics: (0.0023312959635443356, 0.0005451816955720608, 0.0014212269523109005)
2026-06-30 04:54:47,467 - optuna.study.study - INFO - Trial 219 finished with values: [0.0023312959635443356, 0.0005451816955720608, 0.0014212269523109005] and parameters: {'n_layers': 1, 'embedding_dim': 128, 'lr': 0.0013047089047836713, 'lambda_val': 3.423463120625302e-05, 'batch_size': 2836, 'optimizer': 'RMSprop'}.
2026-06-30 04:59:48,114 - optuna.study.study - INFO - Trial 220 finished with values: [0.0020853604238351953, 0.000556579222308759, 0.0013414049574191071] and parameters: {'n_layers': 4, 'embedding_dim': 32, 'lr': 0.0005030162275943933, 'lambda_val': 0.0024351223150280593, 'batch_size': 3604, 'optimizer': 'Adam'}.
2026-06-30 05:02:55,414 - experiment_functions - INFO - Early stopping at epoch 2400. Best Metrics: (0.0029990834326054294, 0.0008757099709363068, 0.002019465113487339)
2026-06-30 05:02:55,503 - optuna.study.study - INFO - Trial 221 finished with values: [0.0029990834326054294, 0.0008757099709363068, 0.002019465113487339] and parameters: {'n_layers': 3, 'embedding_dim': 64, 'lr': 0.0013047089047836713, 'lambda_val': 3.9133224858424936e-05, 'batch_size': 1378, 'optimizer': 'RMSprop'}.
2026-06-30 05:04:31,362 - experiment_functions - INFO - Early stopping at epoch 1100. Best Metrics: (0.0020457450835730828, 0.0005945709780977529, 0.0013509470716781555)
2026-06-30 05:04:31,453 - optuna.study.study - INFO - Trial 222 finished with values: [0.0020457450835730828, 0.0005945709780977529, 0.0013509470716781555] and parameters: {'n_layers': 3, 'embedding_dim': 128, 'lr': 0.008565389960564131, 'lambda_val': 2.199939619081897e-06, 'batch_size': 620, 'optimizer': 'Adam'}.
2026-06-30 05:05:26,080 - experiment_functions - INFO - Early stopping at epoch 500. Best Metrics: (0.00022713329092002851, 7.123454210436335e-05, 0.00013404929900253794)
2026-06-30 05:05:26,168 - optuna.study.study - INFO - Trial 223 finished with values: [0.00022713329092002851, 7.123454210436335e-05, 0.00013404929900253794] and parameters: {'n_layers': 4, 'embedding_dim': 256, 'lr': 0.0019032891633152442, 'lambda_val': 0.007239505689320495, 'batch_size': 620, 'optimizer': 'SGD'}.
2026-06-30 05:06:17,827 - experiment_functions - INFO - Early stopping at epoch 550. Best Metrics: (0.0021262020593699857, 0.0006192656193605988, 0.0014068396793715287)
2026-06-30 05:06:17,909 - optuna.study.study - INFO - Trial 224 finished with values: [0.0021262020593699857, 0.0006192656193605988, 0.0014068396793715287] and parameters: {'n_layers': 4, 'embedding_dim': 128, 'lr': 0.003551859771094245, 'lambda_val': 0.0024351223150280593, 'batch_size': 2443, 'optimizer': 'RMSprop'}.
2026-06-30 05:12:05,384 - optuna.study.study - INFO - Trial 225 finished with values: [0.0028879523135495358, 0.0007455882073590031, 0.001932953626179853] and parameters: {'n_layers': 4, 'embedding_dim': 128, 'lr': 0.0005030162275943933, 'lambda_val': 3.9206514264817366e-05, 'batch_size': 1307, 'optimizer': 'RMSprop'}.
2026-06-30 05:16:30,667 - experiment_functions - INFO - Early stopping at epoch 3400. Best Metrics: (0.0021392213619717457, 0.0005290351993617386, 0.0014398426531947617)
2026-06-30 05:16:30,764 - optuna.study.study - INFO - Trial 226 finished with values: [0.0021392213619717457, 0.0005290351993617386, 0.0014398426531947617] and parameters: {'n_layers': 1, 'embedding_dim': 128, 'lr': 0.0013047089047836713, 'lambda_val': 1.554897118169841e-06, 'batch_size': 3694, 'optimizer': 'RMSprop'}.
2026-06-30 05:21:33,030 - optuna.study.study - INFO - Trial 227 finished with values: [0.0015661558959685505, 0.0003533233288376422, 0.0009993123254266889] and parameters: {'n_layers': 2, 'embedding_dim': 64, 'lr': 0.0005030162275943933, 'lambda_val': 1.4824096770292976e-06, 'batch_size': 1356, 'optimizer': 'RMSprop'}.
2026-06-30 05:27:35,209 - optuna.study.study - INFO - Trial 228 finished with values: [0.0012318289728238036, 0.0003029842524172255, 0.0007918729179074733] and parameters: {'n_layers': 2, 'embedding_dim': 256, 'lr': 0.0004669413392071977, 'lambda_val': 1.4824096770292976e-06, 'batch_size': 620, 'optimizer': 'RMSprop'}.
2026-06-30 05:29:09,077 - experiment_functions - INFO - Early stopping at epoch 1150. Best Metrics: (0.0022484841840947163, 0.0006496590239917939, 0.001539489839766875)
2026-06-30 05:29:09,163 - optuna.study.study - INFO - Trial 229 finished with values: [0.0022484841840947163, 0.0006496590239917939, 0.001539489839766875] and parameters: {'n_layers': 4, 'embedding_dim': 64, 'lr': 0.0009496158639399897, 'lambda_val': 0.0024351223150280593, 'batch_size': 3604, 'optimizer': 'RMSprop'}.
2026-06-30 05:33:10,193 - experiment_functions - INFO - Early stopping at epoch 2750. Best Metrics: (0.0033063915137889247, 0.0009868358566191137, 0.0023278825366232)
2026-06-30 05:33:10,264 - optuna.study.study - INFO - Trial 230 finished with values: [0.0033063915137889247, 0.0009868358566191137, 0.0023278825366232] and parameters: {'n_layers': 4, 'embedding_dim': 128, 'lr': 0.0013047089047836713, 'lambda_val': 1.554897118169841e-06, 'batch_size': 1106, 'optimizer': 'RMSprop'}.
2026-06-30 05:36:26,148 - experiment_functions - INFO - Early stopping at epoch 2400. Best Metrics: (0.0027014514175173893, 0.0007702828486218492, 0.0017739217896757657)
2026-06-30 05:36:26,218 - optuna.study.study - INFO - Trial 231 finished with values: [0.0027014514175173893, 0.0007702828486218492, 0.0017739217896757657] and parameters: {'n_layers': 3, 'embedding_dim': 96, 'lr': 0.0009496158639399897, 'lambda_val': 3.423463120625302e-05, 'batch_size': 3447, 'optimizer': 'RMSprop'}.
2026-06-30 05:39:58,140 - experiment_functions - INFO - Early stopping at epoch 2800. Best Metrics: (0.0027228857770624985, 0.0007142450088330832, 0.0018172711440265488)
2026-06-30 05:39:58,217 - optuna.study.study - INFO - Trial 232 finished with values: [0.0027228857770624985, 0.0007142450088330832, 0.0018172711440265488] and parameters: {'n_layers': 4, 'embedding_dim': 32, 'lr': 0.0013047089047836713, 'lambda_val': 0.00117585320986071, 'batch_size': 1413, 'optimizer': 'Adam'}.
2026-06-30 05:40:53,739 - experiment_functions - INFO - Early stopping at epoch 700. Best Metrics: (0.001714778961173539, 0.00047014797788879817, 0.0012000235942903898)
2026-06-30 05:40:54,342 - optuna.study.study - INFO - Trial 233 finished with values: [0.001714778961173539, 0.00047014797788879817, 0.0012000235942903898] and parameters: {'n_layers': 3, 'embedding_dim': 32, 'lr': 0.006408397022184587, 'lambda_val': 3.9206514264817366e-05, 'batch_size': 3561, 'optimizer': 'RMSprop'}.
2026-06-30 05:41:38,708 - experiment_functions - INFO - Early stopping at epoch 550. Best Metrics: (0.0013247464703796852, 0.000360921679995441, 0.0008429835548808647)
2026-06-30 05:41:38,794 - optuna.study.study - INFO - Trial 234 finished with values: [0.0013247464703796852, 0.000360921679995441, 0.0008429835548808647] and parameters: {'n_layers': 3, 'embedding_dim': 32, 'lr': 0.04434836070063637, 'lambda_val': 3.9206514264817366e-05, 'batch_size': 620, 'optimizer': 'RMSprop'}.
2026-06-30 05:44:10,755 - experiment_functions - INFO - Early stopping at epoch 1800. Best Metrics: (0.0014569842015600286, 0.00045780065725737517, 0.0010460212435876603)
2026-06-30 05:44:10,844 - optuna.study.study - INFO - Trial 235 finished with values: [0.0014569842015600286, 0.00045780065725737517, 0.0010460212435876603] and parameters: {'n_layers': 4, 'embedding_dim': 96, 'lr': 0.0013047089047836713, 'lambda_val': 0.039636159120686056, 'batch_size': 620, 'optimizer': 'Adam'}.
2026-06-30 05:47:08,821 - experiment_functions - INFO - Early stopping at epoch 1700. Best Metrics: (0.0026204690949906237, 0.0007645840852535, 0.001761998192764291)
