2026-06-29 16:22:29,720 - optuna.study.study - INFO - Trial 163 finished with values: [0.0012721164156259887, 0.00034097600820621923, 0.000751271801410956] and parameters: {'n_layers': 4, 'embedding_dim': 128, 'lr': 0.0007886779079223827, 'lambda_val': 1.6024162841802354e-05, 'batch_size': 1432, 'optimizer': 'Adam'}.
2026-06-29 16:23:53,469 - experiment_functions - INFO - Early stopping at epoch 1050. Best Metrics: (0.0031689897988213755, 0.0009545428641984689, 0.0021807052596701255)
2026-06-29 16:23:53,613 - optuna.study.study - INFO - Trial 164 finished with values: [0.0031689897988213755, 0.0009545428641984689, 0.0021807052596701255] and parameters: {'n_layers': 1, 'embedding_dim': 128, 'lr': 0.0007886779079223827, 'lambda_val': 0.0004468421098360447, 'batch_size': 1811, 'optimizer': 'RMSprop'}.
2026-06-29 16:24:45,867 - experiment_functions - INFO - Early stopping at epoch 550. Best Metrics: (0.0006828744469900976, 0.00034667477157456834, 0.0005684357351171304)
2026-06-29 16:24:45,972 - optuna.study.study - INFO - Trial 165 finished with values: [0.0006828744469900976, 0.00034667477157456834, 0.0005684357351171304] and parameters: {'n_layers': 2, 'embedding_dim': 256, 'lr': 0.016122404315501142, 'lambda_val': 1.3664921212013244e-05, 'batch_size': 2320, 'optimizer': 'RMSprop'}.
2026-06-29 16:25:33,182 - experiment_functions - INFO - Early stopping at epoch 550. Best Metrics: (0.0012973832647145448, 0.00036757023725851487, 0.0007668096308988936)
2026-06-29 16:25:33,289 - optuna.study.study - INFO - Trial 166 finished with values: [0.0012973832647145448, 0.00036757023725851487, 0.0007668096308988936] and parameters: {'n_layers': 2, 'embedding_dim': 128, 'lr': 0.0013135077251507194, 'lambda_val': 0.0004244982241785935, 'batch_size': 1478, 'optimizer': 'RMSprop'}.
2026-06-29 16:27:16,599 - experiment_functions - INFO - Early stopping at epoch 1300. Best Metrics: (0.0032427956211987592, 0.0009554926580931937, 0.002180222897615549)
2026-06-29 16:27:16,748 - optuna.study.study - INFO - Trial 167 finished with values: [0.0032427956211987592, 0.0009554926580931937, 0.002180222897615549] and parameters: {'n_layers': 1, 'embedding_dim': 128, 'lr': 0.0007886779079223827, 'lambda_val': 0.0004244982241785935, 'batch_size': 1304, 'optimizer': 'Adam'}.
2026-06-29 16:32:10,257 - experiment_functions - INFO - Early stopping at epoch 3500. Best Metrics: (0.0005684180917988798, 0.00029823528294360127, 0.00045013267702566004)
2026-06-29 16:32:10,365 - optuna.study.study - INFO - Trial 168 finished with values: [0.0005684180917988798, 0.00029823528294360127, 0.00045013267702566004] and parameters: {'n_layers': 4, 'embedding_dim': 128, 'lr': 0.0026615346588440172, 'lambda_val': 3.159634083184005e-05, 'batch_size': 1473, 'optimizer': 'RMSprop'}.
2026-06-29 16:32:56,247 - experiment_functions - INFO - Early stopping at epoch 550. Best Metrics: (0.0013190855572379086, 0.00047299735957297275, 0.0008589848779089626)
2026-06-29 16:32:56,354 - optuna.study.study - INFO - Trial 169 finished with values: [0.0013190855572379086, 0.00047299735957297275, 0.0008589848779089626] and parameters: {'n_layers': 1, 'embedding_dim': 128, 'lr': 0.04247752781777964, 'lambda_val': 3.159634083184005e-05, 'batch_size': 1304, 'optimizer': 'Adam'}.
2026-06-29 16:33:42,407 - experiment_functions - INFO - Early stopping at epoch 550. Best Metrics: (0.0009591874264978976, 0.0004046121991527839, 0.0006850605617521192)
2026-06-29 16:33:42,511 - optuna.study.study - INFO - Trial 170 finished with values: [0.0009591874264978976, 0.0004046121991527839, 0.0006850605617521192] and parameters: {'n_layers': 1, 'embedding_dim': 128, 'lr': 0.04247752781777964, 'lambda_val': 0.0004244982241785935, 'batch_size': 1304, 'optimizer': 'Adam'}.
2026-06-29 16:34:30,380 - experiment_functions - INFO - Early stopping at epoch 550. Best Metrics: (0.0022344152303037236, 0.0005803240696768802, 0.001311259388151466)
2026-06-29 16:34:30,496 - optuna.study.study - INFO - Trial 171 finished with values: [0.0022344152303037236, 0.0005803240696768802, 0.001311259388151466] and parameters: {'n_layers': 2, 'embedding_dim': 128, 'lr': 0.005466403487028649, 'lambda_val': 3.159634083184005e-05, 'batch_size': 1473, 'optimizer': 'Adam'}.
2026-06-29 16:38:08,912 - experiment_functions - INFO - Early stopping at epoch 2600. Best Metrics: (0.0005879208779327868, 0.0004264574587314553, 0.0005959972565016423)
2026-06-29 16:38:09,029 - optuna.study.study - INFO - Trial 172 finished with values: [0.0005879208779327868, 0.0004264574587314553, 0.0005959972565016423] and parameters: {'n_layers': 1, 'embedding_dim': 256, 'lr': 0.027994598569073718, 'lambda_val': 0.0004994369806250174, 'batch_size': 2358, 'optimizer': 'RMSprop'}.
2026-06-29 16:40:17,209 - experiment_functions - INFO - Early stopping at epoch 1650. Best Metrics: (0.0027233695368431136, 0.0008690614136732329, 0.001805051713764736)
2026-06-29 16:40:17,358 - optuna.study.study - INFO - Trial 173 finished with values: [0.0027233695368431136, 0.0008690614136732329, 0.001805051713764736] and parameters: {'n_layers': 1, 'embedding_dim': 96, 'lr': 0.0006475996595311599, 'lambda_val': 0.0001800101227182521, 'batch_size': 3561, 'optimizer': 'Adam'}.
2026-06-29 16:41:22,904 - experiment_functions - INFO - Early stopping at epoch 800. Best Metrics: (0.00027973448066636155, 6.458598484128944e-05, 0.00014106890220986842)
2026-06-29 16:41:23,056 - optuna.study.study - INFO - Trial 174 finished with values: [0.00027973448066636155, 6.458598484128944e-05, 0.00014106890220986842] and parameters: {'n_layers': 2, 'embedding_dim': 96, 'lr': 6.52507900499196e-05, 'lambda_val': 0.0004244982241785935, 'batch_size': 2450, 'optimizer': 'Adam'}.
2026-06-29 16:42:40,042 - experiment_functions - INFO - Early stopping at epoch 950. Best Metrics: (0.003026290893658184, 0.0008662120319890584, 0.0019959704019342907)
2026-06-29 16:42:40,353 - optuna.study.study - INFO - Trial 175 finished with values: [0.003026290893658184, 0.0008662120319890584, 0.0019959704019342907] and parameters: {'n_layers': 1, 'embedding_dim': 128, 'lr': 0.0007556847336647807, 'lambda_val': 0.0004244982241785935, 'batch_size': 2498, 'optimizer': 'RMSprop'}.
2026-06-29 16:44:07,643 - experiment_functions - INFO - Early stopping at epoch 1150. Best Metrics: (0.002494100237086106, 0.0006895503675702372, 0.001469208063057622)
2026-06-29 16:44:07,759 - optuna.study.study - INFO - Trial 176 finished with values: [0.002494100237086106, 0.0006895503675702372, 0.001469208063057622] and parameters: {'n_layers': 2, 'embedding_dim': 32, 'lr': 0.0007886779079223827, 'lambda_val': 0.00048806792050110173, 'batch_size': 1478, 'optimizer': 'Adam'}.
2026-06-29 16:45:00,672 - experiment_functions - INFO - Early stopping at epoch 550. Best Metrics: (0.0005939096264067018, 0.0003115323974697491, 0.0005107786476387333)
2026-06-29 16:45:00,781 - optuna.study.study - INFO - Trial 177 finished with values: [0.0005939096264067018, 0.0003115323974697491, 0.0005107786476387333] and parameters: {'n_layers': 2, 'embedding_dim': 256, 'lr': 0.015188551974826818, 'lambda_val': 3.159634083184005e-05, 'batch_size': 1649, 'optimizer': 'Adam'}.
2026-06-29 16:45:43,496 - experiment_functions - INFO - Early stopping at epoch 500. Best Metrics: (0.0010084139038788352, 0.0003257793058906217, 0.000735594270619357)
2026-06-29 16:45:44,799 - optuna.study.study - INFO - Trial 178 finished with values: [0.0010084139038788352, 0.0003257793058906217, 0.000735594270619357] and parameters: {'n_layers': 4, 'embedding_dim': 64, 'lr': 0.07945214517899378, 'lambda_val': 5.3222531406855436e-05, 'batch_size': 1478, 'optimizer': 'RMSprop'}.
2026-06-29 16:46:35,106 - experiment_functions - INFO - Early stopping at epoch 600. Best Metrics: (0.0029675080605837114, 0.0009583420397773684, 0.0020714830228931226)
2026-06-29 16:46:35,260 - optuna.study.study - INFO - Trial 179 finished with values: [0.0029675080605837114, 0.0009583420397773684, 0.0020714830228931226] and parameters: {'n_layers': 1, 'embedding_dim': 128, 'lr': 0.005051802596702307, 'lambda_val': 6.579378672773439e-05, 'batch_size': 3775, 'optimizer': 'Adam'}.
2026-06-29 16:49:06,377 - experiment_functions - INFO - Early stopping at epoch 2000. Best Metrics: (0.0016380301393371989, 0.0003742187945215889, 0.0009007530968626447)
2026-06-29 16:49:06,477 - optuna.study.study - INFO - Trial 180 finished with values: [0.0016380301393371989, 0.0003742187945215889, 0.0009007530968626447] and parameters: {'n_layers': 4, 'embedding_dim': 32, 'lr': 0.00046976485747899423, 'lambda_val': 0.00019178812863822936, 'batch_size': 1432, 'optimizer': 'Adam'}.
2026-06-29 16:49:47,633 - experiment_functions - INFO - Early stopping at epoch 500. Best Metrics: (0.00042730603515509196, 9.877856505138387e-05, 0.0002289190488027131)
2026-06-29 16:49:47,838 - optuna.study.study - INFO - Trial 181 finished with values: [0.00042730603515509196, 9.877856505138387e-05, 0.0002289190488027131] and parameters: {'n_layers': 1, 'embedding_dim': 96, 'lr': 0.09570556445914484, 'lambda_val': 0.0004244982241785935, 'batch_size': 1811, 'optimizer': 'RMSprop'}.
2026-06-29 16:53:02,242 - experiment_functions - INFO - Early stopping at epoch 2650. Best Metrics: (0.003269918900640112, 0.0008852079098835552, 0.0020771117493763405)
2026-06-29 16:53:02,348 - optuna.study.study - INFO - Trial 182 finished with values: [0.003269918900640112, 0.0008852079098835552, 0.0020771117493763405] and parameters: {'n_layers': 1, 'embedding_dim': 32, 'lr': 0.0007886779079223827, 'lambda_val': 1.3664921212013244e-05, 'batch_size': 1811, 'optimizer': 'Adam'}.
2026-06-29 16:54:11,827 - experiment_functions - INFO - Early stopping at epoch 800. Best Metrics: (0.001760754692327543, 0.0005024409703094429, 0.0010828605282391247)
2026-06-29 16:54:11,973 - optuna.study.study - INFO - Trial 183 finished with values: [0.001760754692327543, 0.0005024409703094429, 0.0010828605282391247] and parameters: {'n_layers': 3, 'embedding_dim': 128, 'lr': 0.0007556847336647807, 'lambda_val': 6.062226724528523e-06, 'batch_size': 1473, 'optimizer': 'Adam'}.
2026-06-29 16:54:58,427 - experiment_functions - INFO - Early stopping at epoch 550. Best Metrics: (0.000267018842963667, 6.648557263073914e-05, 0.00015174135084452818)
2026-06-29 16:54:58,537 - optuna.study.study - INFO - Trial 184 finished with values: [0.000267018842963667, 6.648557263073914e-05, 0.00015174135084452818] and parameters: {'n_layers': 1, 'embedding_dim': 128, 'lr': 1.0486817485692653e-05, 'lambda_val': 0.0004244982241785935, 'batch_size': 3838, 'optimizer': 'Adam'}.
2026-06-29 16:55:53,712 - experiment_functions - INFO - Early stopping at epoch 650. Best Metrics: (0.0011235020991056596, 0.0003267290997853466, 0.0006902225363476973)
2026-06-29 16:55:53,816 - optuna.study.study - INFO - Trial 185 finished with values: [0.0011235020991056596, 0.0003267290997853466, 0.0006902225363476973] and parameters: {'n_layers': 3, 'embedding_dim': 96, 'lr': 0.0007886779079223827, 'lambda_val': 6.062226724528523e-06, 'batch_size': 3881, 'optimizer': 'RMSprop'}.
2026-06-29 16:56:38,878 - experiment_functions - INFO - Early stopping at epoch 550. Best Metrics: (0.0007328933046918964, 0.00022320156526033853, 0.0005210238206575119)
2026-06-29 16:56:38,987 - optuna.study.study - INFO - Trial 186 finished with values: [0.0007328933046918964, 0.00022320156526033853, 0.0005210238206575119] and parameters: {'n_layers': 4, 'embedding_dim': 32, 'lr': 0.005466403487028649, 'lambda_val': 3.159634083184005e-05, 'batch_size': 3775, 'optimizer': 'Adam'}.
2026-06-29 16:58:20,588 - experiment_functions - INFO - Early stopping at epoch 1350. Best Metrics: (0.0021324341684472283, 0.0006268639705183975, 0.0012763379345214437)
2026-06-29 16:58:20,693 - optuna.study.study - INFO - Trial 187 finished with values: [0.0021324341684472283, 0.0006268639705183975, 0.0012763379345214437] and parameters: {'n_layers': 2, 'embedding_dim': 32, 'lr': 0.0007556847336647807, 'lambda_val': 3.159634083184005e-05, 'batch_size': 1478, 'optimizer': 'Adam'}.
2026-06-29 16:59:20,975 - experiment_functions - INFO - Early stopping at epoch 750. Best Metrics: (0.0021327616724192157, 0.0006202154132553236, 0.0013130759208792486)
2026-06-29 16:59:21,128 - optuna.study.study - INFO - Trial 188 finished with values: [0.0021327616724192157, 0.0006202154132553236, 0.0013130759208792486] and parameters: {'n_layers': 2, 'embedding_dim': 64, 'lr': 0.0007549780410006504, 'lambda_val': 0.0001800101227182521, 'batch_size': 3561, 'optimizer': 'RMSprop'}.
2026-06-29 17:01:26,476 - experiment_functions - INFO - Early stopping at epoch 1450. Best Metrics: (0.0027723278073236704, 0.0009260490473567235, 0.0018770031522603245)
2026-06-29 17:01:26,589 - optuna.study.study - INFO - Trial 189 finished with values: [0.0027723278073236704, 0.0009260490473567235, 0.0018770031522603245] and parameters: {'n_layers': 1, 'embedding_dim': 256, 'lr': 0.0007556847336647807, 'lambda_val': 0.0005944842242671787, 'batch_size': 1940, 'optimizer': 'Adam'}.
2026-06-29 17:02:27,008 - experiment_functions - INFO - Early stopping at epoch 700. Best Metrics: (0.0002792506991388085, 0.00011682464905115591, 0.00020602836209145106)
2026-06-29 17:02:27,111 - optuna.study.study - INFO - Trial 190 finished with values: [0.0002792506991388085, 0.00011682464905115591, 0.00020602836209145106] and parameters: {'n_layers': 4, 'embedding_dim': 96, 'lr': 0.005466403487028649, 'lambda_val': 0.013956918889075444, 'batch_size': 1811, 'optimizer': 'Adam'}.
2026-06-29 17:03:29,598 - experiment_functions - INFO - Early stopping at epoch 750. Best Metrics: (0.0011666333837020498, 0.00030488384020667516, 0.0006701372498498551)
2026-06-29 17:03:29,701 - optuna.study.study - INFO - Trial 191 finished with values: [0.0011666333837020498, 0.00030488384020667516, 0.0006701372498498551] and parameters: {'n_layers': 4, 'embedding_dim': 64, 'lr': 0.0007886779079223827, 'lambda_val': 0.0004244982241785935, 'batch_size': 1811, 'optimizer': 'Adam'}.
2026-06-29 17:04:16,775 - experiment_functions - INFO - Early stopping at epoch 600. Best Metrics: (0.000264983040716781, 6.17366031571149e-05, 0.0001551679947002593)
2026-06-29 17:04:16,903 - optuna.study.study - INFO - Trial 192 finished with values: [0.000264983040716781, 6.17366031571149e-05, 0.0001551679947002593] and parameters: {'n_layers': 1, 'embedding_dim': 32, 'lr': 2.057188625264106e-05, 'lambda_val': 0.0004244982241785935, 'batch_size': 1478, 'optimizer': 'RMSprop'}.
2026-06-29 17:08:12,203 - experiment_functions - INFO - Early stopping at epoch 3000. Best Metrics: (0.0030177288214129983, 0.0009754383298824156, 0.0020412516918674934)
2026-06-29 17:08:12,302 - optuna.study.study - INFO - Trial 193 finished with values: [0.0030177288214129983, 0.0009754383298824156, 0.0020412516918674934] and parameters: {'n_layers': 1, 'embedding_dim': 128, 'lr': 0.0007556847336647807, 'lambda_val': 0.00018778243941196433, 'batch_size': 1473, 'optimizer': 'Adam'}.
2026-06-29 17:12:23,510 - experiment_functions - INFO - Early stopping at epoch 3300. Best Metrics: (0.00025862852251643957, 6.458598484128944e-05, 0.0001260471635533294)
2026-06-29 17:12:23,620 - optuna.study.study - INFO - Trial 194 finished with values: [0.00025862852251643957, 6.458598484128944e-05, 0.0001260471635533294] and parameters: {'n_layers': 1, 'embedding_dim': 96, 'lr': 2.4517841266362253e-05, 'lambda_val': 0.0004244982241785935, 'batch_size': 1811, 'optimizer': 'Adam'}.
2026-06-29 17:13:21,978 - experiment_functions - INFO - Early stopping at epoch 550. Best Metrics: (0.0005563774964970845, 0.0003390764204167696, 0.0005041889095044962)
2026-06-29 17:13:22,082 - optuna.study.study - INFO - Trial 195 finished with values: [0.0005563774964970845, 0.0003390764204167696, 0.0005041889095044962] and parameters: {'n_layers': 4, 'embedding_dim': 256, 'lr': 0.04591730982357234, 'lambda_val': 2.6864080823740134e-06, 'batch_size': 3989, 'optimizer': 'Adam'}.
2026-06-29 17:14:06,011 - experiment_functions - INFO - Early stopping at epoch 500. Best Metrics: (0.0007304902436231296, 0.00023364929810231185, 0.00047788401328609605)
2026-06-29 17:14:06,137 - optuna.study.study - INFO - Trial 196 finished with values: [0.0007304902436231296, 0.00023364929810231185, 0.00047788401328609605] and parameters: {'n_layers': 2, 'embedding_dim': 128, 'lr': 0.0951182596909589, 'lambda_val': 0.0045158154821205955, 'batch_size': 1999, 'optimizer': 'RMSprop'}.
2026-06-29 17:15:25,532 - experiment_functions - INFO - Early stopping at epoch 1000. Best Metrics: (0.002748135104058014, 0.0008453165663051119, 0.0017618546485246784)
2026-06-29 17:15:25,663 - optuna.study.study - INFO - Trial 197 finished with values: [0.002748135104058014, 0.0008453165663051119, 0.0017618546485246784] and parameters: {'n_layers': 1, 'embedding_dim': 96, 'lr': 0.0006475996595311599, 'lambda_val': 0.0004244982241785935, 'batch_size': 3898, 'optimizer': 'RMSprop'}.
2026-06-29 17:16:37,163 - experiment_functions - INFO - Early stopping at epoch 800. Best Metrics: (0.002986368831381092, 0.0009877856505138385, 0.002079500332109715)
2026-06-29 17:16:37,264 - optuna.study.study - INFO - Trial 198 finished with values: [0.002986368831381092, 0.0009877856505138385, 0.002079500332109715] and parameters: {'n_layers': 1, 'embedding_dim': 256, 'lr': 0.0013135077251507194, 'lambda_val': 0.0004244982241785935, 'batch_size': 3898, 'optimizer': 'Adam'}.
2026-06-29 17:17:18,622 - experiment_functions - INFO - Early stopping at epoch 500. Best Metrics: (0.00021157255833063567, 5.413825199931615e-05, 0.00010233688537923044)
2026-06-29 17:17:18,747 - optuna.study.study - INFO - Trial 199 finished with values: [0.00021157255833063567, 5.413825199931615e-05, 0.00010233688537923044] and parameters: {'n_layers': 1, 'embedding_dim': 96, 'lr': 0.0007886779079223827, 'lambda_val': 4.6645799202057965e-05, 'batch_size': 2825, 'optimizer': 'SGD'}.
2026-06-29 17:18:55,026 - experiment_functions - INFO - Early stopping at epoch 1200. Best Metrics: (0.0029811216988286657, 0.0009469445130406702, 0.002146156432438714)
2026-06-29 17:18:55,125 - optuna.study.study - INFO - Trial 200 finished with values: [0.0029811216988286657, 0.0009469445130406702, 0.002146156432438714] and parameters: {'n_layers': 1, 'embedding_dim': 128, 'lr': 0.0013135077251507194, 'lambda_val': 0.0004244982241785935, 'batch_size': 736, 'optimizer': 'Adam'}.
2026-06-29 17:20:19,648 - experiment_functions - INFO - Early stopping at epoch 1050. Best Metrics: (0.0019109374565772451, 0.0006031191231502765, 0.0012329534245500314)
2026-06-29 17:20:19,797 - optuna.study.study - INFO - Trial 201 finished with values: [0.0019109374565772451, 0.0006031191231502765, 0.0012329534245500314] and parameters: {'n_layers': 2, 'embedding_dim': 96, 'lr': 0.0007549780410006504, 'lambda_val': 2.6944711373217586e-06, 'batch_size': 1811, 'optimizer': 'RMSprop'}.
2026-06-29 17:25:21,941 - optuna.study.study - INFO - Trial 202 finished with values: [0.0017599786776237038, 0.00045590106946792554, 0.001201716150375657] and parameters: {'n_layers': 1, 'embedding_dim': 96, 'lr': 0.00015159499100507432, 'lambda_val': 0.0004244982241785935, 'batch_size': 3898, 'optimizer': 'RMSprop'}.
2026-06-29 17:26:46,446 - experiment_functions - INFO - Early stopping at epoch 1050. Best Metrics: (0.0033577116006119094, 0.0009345971924092473, 0.0022612864449898895)
2026-06-29 17:26:46,589 - optuna.study.study - INFO - Trial 203 finished with values: [0.0033577116006119094, 0.0009345971924092473, 0.0022612864449898895] and parameters: {'n_layers': 1, 'embedding_dim': 128, 'lr': 0.0007886779079223827, 'lambda_val': 0.0004244982241785935, 'batch_size': 1811, 'optimizer': 'RMSprop'}.
2026-06-29 17:27:56,998 - experiment_functions - INFO - Early stopping at epoch 900. Best Metrics: (0.0018280560171371417, 0.000618315825465874, 0.0011521404996637874)
2026-06-29 17:27:57,145 - optuna.study.study - INFO - Trial 204 finished with values: [0.0018280560171371417, 0.000618315825465874, 0.0011521404996637874] and parameters: {'n_layers': 1, 'embedding_dim': 64, 'lr': 0.0006475996595311599, 'lambda_val': 0.018854483202102718, 'batch_size': 3898, 'optimizer': 'Adam'}.
2026-06-29 17:28:51,568 - experiment_functions - INFO - Early stopping at epoch 600. Best Metrics: (0.00279393414062429, 0.000912751932830576, 0.0019966715989051574)
2026-06-29 17:28:51,670 - optuna.study.study - INFO - Trial 205 finished with values: [0.00279393414062429, 0.000912751932830576, 0.0019966715989051574] and parameters: {'n_layers': 1, 'embedding_dim': 256, 'lr': 0.005466403487028649, 'lambda_val': 0.0004244982241785935, 'batch_size': 1811, 'optimizer': 'Adam'}.
2026-06-29 17:33:14,947 - experiment_functions - INFO - Early stopping at epoch 3450. Best Metrics: (0.0032267255021721096, 0.0009678399787246168, 0.0021520532427317263)
2026-06-29 17:33:15,067 - optuna.study.study - INFO - Trial 206 finished with values: [0.0032267255021721096, 0.0009678399787246168, 0.0021520532427317263] and parameters: {'n_layers': 1, 'embedding_dim': 96, 'lr': 0.0007886779079223827, 'lambda_val': 1.3664921212013244e-05, 'batch_size': 995, 'optimizer': 'Adam'}.
2026-06-29 17:34:24,278 - experiment_functions - INFO - Early stopping at epoch 850. Best Metrics: (0.0025931756645486306, 0.0008776095587257565, 0.0018028024171907765)
2026-06-29 17:34:24,443 - optuna.study.study - INFO - Trial 207 finished with values: [0.0025931756645486306, 0.0008776095587257565, 0.0018028024171907765] and parameters: {'n_layers': 1, 'embedding_dim': 128, 'lr': 0.0013135077251507194, 'lambda_val': 0.002981676836187542, 'batch_size': 1473, 'optimizer': 'Adam'}.
2026-06-29 17:35:26,638 - experiment_functions - INFO - Early stopping at epoch 750. Best Metrics: (0.0023752823855851418, 0.0006867009858860627, 0.0014491411663696049)
