2026-06-30 23:21:18,445 - optuna.study.study - INFO - Trial 24 finished with values: [0.00023032091246802015, 6.743536652546399e-05, 0.00015900763453044532] and parameters: {'n_layers': 1, 'embedding_dim': 64, 'lr': 1.980563312897711e-05, 'lambda_val': 0.005893450231683289, 'batch_size': 2522, 'optimizer': 'RMSprop'}.
2026-06-30 23:25:56,184 - experiment_functions - INFO - Early stopping at epoch 3050. Best Metrics: (0.00022977469960244737, 5.128887031514162e-05, 0.00011392944232199759)
2026-06-30 23:25:56,255 - optuna.study.study - INFO - Trial 25 finished with values: [0.00022977469960244737, 5.128887031514162e-05, 0.00011392944232199759] and parameters: {'n_layers': 2, 'embedding_dim': 256, 'lr': 1.572896658362327e-05, 'lambda_val': 0.019235096524352614, 'batch_size': 3237, 'optimizer': 'RMSprop'}.
2026-06-30 23:26:50,746 - experiment_functions - INFO - Early stopping at epoch 550. Best Metrics: (0.0015497301412824732, 0.00046444921452044896, 0.0011001973377283891)
2026-06-30 23:26:50,822 - optuna.study.study - INFO - Trial 26 finished with values: [0.0015497301412824732, 0.00046444921452044896, 0.0011001973377283891] and parameters: {'n_layers': 2, 'embedding_dim': 256, 'lr': 0.031461997995131906, 'lambda_val': 4.889129207716808e-06, 'batch_size': 3054, 'optimizer': 'Adam'}.
2026-06-30 23:31:35,147 - experiment_functions - INFO - Early stopping at epoch 3900. Best Metrics: (0.00034302868156429035, 7.978268715688696e-05, 0.00021756810991415356)
2026-06-30 23:31:35,239 - optuna.study.study - INFO - Trial 27 finished with values: [0.00034302868156429035, 7.978268715688696e-05, 0.00021756810991415356] and parameters: {'n_layers': 2, 'embedding_dim': 32, 'lr': 7.500962037987662e-05, 'lambda_val': 3.731947105634678e-05, 'batch_size': 3362, 'optimizer': 'RMSprop'}.
2026-06-30 23:32:18,898 - experiment_functions - INFO - Early stopping at epoch 550. Best Metrics: (0.0010695843052536402, 0.00025169538210208383, 0.0006966279251569872)
2026-06-30 23:32:18,981 - optuna.study.study - INFO - Trial 28 finished with values: [0.0010695843052536402, 0.00025169538210208383, 0.0006966279251569872] and parameters: {'n_layers': 1, 'embedding_dim': 32, 'lr': 0.019417272401911833, 'lambda_val': 3.272620247549331e-05, 'batch_size': 3537, 'optimizer': 'RMSprop'}.
2026-06-30 23:33:01,599 - experiment_functions - INFO - Early stopping at epoch 500. Best Metrics: (0.0002385524649601918, 6.458598484128944e-05, 0.0001222797434113964)
2026-06-30 23:33:01,695 - optuna.study.study - INFO - Trial 29 finished with values: [0.0002385524649601918, 6.458598484128944e-05, 0.0001222797434113964] and parameters: {'n_layers': 4, 'embedding_dim': 64, 'lr': 0.0011793862625969344, 'lambda_val': 0.000353683997241554, 'batch_size': 3083, 'optimizer': 'SGD'}.
2026-06-30 23:33:44,352 - experiment_functions - INFO - Early stopping at epoch 500. Best Metrics: (0.0002234041807593543, 6.17366031571149e-05, 0.00012522448960761967)
2026-06-30 23:33:44,442 - optuna.study.study - INFO - Trial 30 finished with values: [0.0002234041807593543, 6.17366031571149e-05, 0.00012522448960761967] and parameters: {'n_layers': 2, 'embedding_dim': 96, 'lr': 0.0010140984220257444, 'lambda_val': 0.00024401938556457782, 'batch_size': 2990, 'optimizer': 'SGD'}.
2026-06-30 23:39:17,137 - optuna.study.study - INFO - Trial 31 finished with values: [0.0024461097706047403, 0.0006496590239917938, 0.0016502130819677145] and parameters: {'n_layers': 4, 'embedding_dim': 96, 'lr': 0.00039452895313047835, 'lambda_val': 0.003195386254489329, 'batch_size': 2475, 'optimizer': 'RMSprop'}.
2026-06-30 23:39:58,198 - experiment_functions - INFO - Early stopping at epoch 500. Best Metrics: (0.00025451495134933835, 6.838516042018883e-05, 0.0001548379455781471)
2026-06-30 23:39:58,524 - optuna.study.study - INFO - Trial 32 finished with values: [0.00025451495134933835, 6.838516042018883e-05, 0.0001548379455781471] and parameters: {'n_layers': 1, 'embedding_dim': 96, 'lr': 1.1168700270423612e-05, 'lambda_val': 0.000263799962904147, 'batch_size': 2112, 'optimizer': 'SGD'}.
2026-06-30 23:40:50,163 - experiment_functions - INFO - Early stopping at epoch 500. Best Metrics: (0.00020706062625899845, 5.888722147294038e-05, 0.00011984481362515104)
2026-06-30 23:40:50,248 - optuna.study.study - INFO - Trial 33 finished with values: [0.00020706062625899845, 5.888722147294038e-05, 0.00011984481362515104] and parameters: {'n_layers': 3, 'embedding_dim': 256, 'lr': 4.8919580655916446e-05, 'lambda_val': 9.61150219103321e-05, 'batch_size': 1555, 'optimizer': 'SGD'}.
2026-06-30 23:44:25,598 - experiment_functions - INFO - Early stopping at epoch 2550. Best Metrics: (0.00022764468287654876, 5.413825199931615e-05, 0.00011559880147631298)
2026-06-30 23:44:25,689 - optuna.study.study - INFO - Trial 34 finished with values: [0.00022764468287654876, 5.413825199931615e-05, 0.00011559880147631298] and parameters: {'n_layers': 3, 'embedding_dim': 128, 'lr': 7.724697480261131e-05, 'lambda_val': 7.13347346886595e-06, 'batch_size': 1110, 'optimizer': 'Adam'}.
2026-06-30 23:46:26,754 - experiment_functions - INFO - Early stopping at epoch 1200. Best Metrics: (0.0022557170739070163, 0.0006316129399920218, 0.001521219551736094)
2026-06-30 23:46:26,840 - optuna.study.study - INFO - Trial 35 finished with values: [0.0022557170739070163, 0.0006316129399920218, 0.001521219551736094] and parameters: {'n_layers': 3, 'embedding_dim': 256, 'lr': 0.0017202674480021566, 'lambda_val': 0.00022467171684366154, 'batch_size': 3304, 'optimizer': 'Adam'}.
2026-06-30 23:50:05,233 - experiment_functions - INFO - Early stopping at epoch 2800. Best Metrics: (0.0031879079261328633, 0.0008814087343046557, 0.002151301707857398)
2026-06-30 23:50:05,302 - optuna.study.study - INFO - Trial 36 finished with values: [0.0031879079261328633, 0.0008814087343046557, 0.002151301707857398] and parameters: {'n_layers': 3, 'embedding_dim': 64, 'lr': 0.001557510643925403, 'lambda_val': 0.00011682518010112995, 'batch_size': 977, 'optimizer': 'RMSprop'}.
2026-06-30 23:53:44,235 - experiment_functions - INFO - Early stopping at epoch 2600. Best Metrics: (0.0025791942833853477, 0.0007560359402009764, 0.001810615680242467)
2026-06-30 23:53:44,330 - optuna.study.study - INFO - Trial 37 finished with values: [0.0025791942833853477, 0.0007560359402009764, 0.001810615680242467] and parameters: {'n_layers': 4, 'embedding_dim': 96, 'lr': 0.0011423999744800083, 'lambda_val': 4.186926040366856e-06, 'batch_size': 3005, 'optimizer': 'Adam'}.
2026-06-30 23:55:47,668 - experiment_functions - INFO - Early stopping at epoch 1450. Best Metrics: (0.001903671809034317, 0.0005907718025188535, 0.0013333444062352535)
2026-06-30 23:55:47,759 - optuna.study.study - INFO - Trial 38 finished with values: [0.001903671809034317, 0.0005907718025188535, 0.0013333444062352535] and parameters: {'n_layers': 4, 'embedding_dim': 96, 'lr': 0.0008693206599023528, 'lambda_val': 0.00818244172221547, 'batch_size': 2842, 'optimizer': 'Adam'}.
2026-06-30 23:59:01,408 - experiment_functions - INFO - Early stopping at epoch 2200. Best Metrics: (0.003299222121893631, 0.0009459947191459454, 0.0022097233135526437)
2026-06-30 23:59:01,487 - optuna.study.study - INFO - Trial 39 finished with values: [0.003299222121893631, 0.0009459947191459454, 0.0022097233135526437] and parameters: {'n_layers': 4, 'embedding_dim': 128, 'lr': 0.0008921739854607602, 'lambda_val': 4.134172720235837e-06, 'batch_size': 1581, 'optimizer': 'RMSprop'}.
2026-06-30 23:59:43,663 - experiment_functions - INFO - Early stopping at epoch 500. Best Metrics: (0.00024318241489842908, 6.458598484128946e-05, 0.00012809437252754173)
2026-06-30 23:59:43,758 - optuna.study.study - INFO - Trial 40 finished with values: [0.00024318241489842908, 6.458598484128946e-05, 0.00012809437252754173] and parameters: {'n_layers': 1, 'embedding_dim': 128, 'lr': 0.00020228772775578846, 'lambda_val': 2.5973810283415526e-06, 'batch_size': 2204, 'optimizer': 'SGD'}.
2026-07-01 00:00:37,668 - experiment_functions - INFO - Early stopping at epoch 600. Best Metrics: (0.0015478367591357325, 0.0004777463290465969, 0.0010661342029339748)
2026-07-01 00:00:38,200 - optuna.study.study - INFO - Trial 41 finished with values: [0.0015478367591357325, 0.0004777463290465969, 0.0010661342029339748] and parameters: {'n_layers': 3, 'embedding_dim': 128, 'lr': 0.0027303142774942266, 'lambda_val': 0.018338380328878464, 'batch_size': 3022, 'optimizer': 'RMSprop'}.
2026-07-01 00:01:21,897 - experiment_functions - INFO - Early stopping at epoch 500. Best Metrics: (0.0002404395596807145, 6.743536652546397e-05, 0.0001615017451911216)
2026-07-01 00:01:21,985 - optuna.study.study - INFO - Trial 42 finished with values: [0.0002404395596807145, 6.743536652546397e-05, 0.0001615017451911216] and parameters: {'n_layers': 3, 'embedding_dim': 96, 'lr': 2.623513118060286e-05, 'lambda_val': 0.006547349704811034, 'batch_size': 1771, 'optimizer': 'SGD'}.
2026-07-01 00:06:32,446 - optuna.study.study - INFO - Trial 43 finished with values: [0.00044359730759372957, 0.0001234732063142298, 0.0002871381526977675] and parameters: {'n_layers': 1, 'embedding_dim': 128, 'lr': 0.00013804802424657094, 'lambda_val': 0.0014410548016705043, 'batch_size': 2733, 'optimizer': 'RMSprop'}.
2026-07-01 00:07:17,402 - experiment_functions - INFO - Early stopping at epoch 500. Best Metrics: (0.0002046627871208428, 5.508804589404101e-05, 0.00013435964974524108)
2026-07-01 00:07:17,503 - optuna.study.study - INFO - Trial 44 finished with values: [0.0002046627871208428, 5.508804589404101e-05, 0.00013435964974524108] and parameters: {'n_layers': 3, 'embedding_dim': 128, 'lr': 0.017248904463474834, 'lambda_val': 0.08167684090749118, 'batch_size': 1377, 'optimizer': 'SGD'}.
2026-07-01 00:08:12,475 - experiment_functions - INFO - Early stopping at epoch 650. Best Metrics: (0.001818393934956707, 0.0005043405580988927, 0.0012310856138201965)
2026-07-01 00:08:12,557 - optuna.study.study - INFO - Trial 45 finished with values: [0.001818393934956707, 0.0005043405580988927, 0.0012310856138201965] and parameters: {'n_layers': 2, 'embedding_dim': 96, 'lr': 0.007281442021246473, 'lambda_val': 0.00030330566948671007, 'batch_size': 1318, 'optimizer': 'RMSprop'}.
2026-07-01 00:08:57,841 - experiment_functions - INFO - Early stopping at epoch 500. Best Metrics: (0.00019625750897360537, 5.128887031514161e-05, 0.0001122410332316179)
2026-07-01 00:08:57,935 - optuna.study.study - INFO - Trial 46 finished with values: [0.00019625750897360537, 5.128887031514161e-05, 0.0001122410332316179] and parameters: {'n_layers': 1, 'embedding_dim': 256, 'lr': 0.00018620477546199652, 'lambda_val': 1.9636318573842382e-05, 'batch_size': 640, 'optimizer': 'SGD'}.
2026-07-01 00:10:37,723 - experiment_functions - INFO - Early stopping at epoch 1300. Best Metrics: (0.002525781983713435, 0.0006582071690443175, 0.0017693655940503711)
2026-07-01 00:10:37,812 - optuna.study.study - INFO - Trial 47 finished with values: [0.002525781983713435, 0.0006582071690443175, 0.0017693655940503711] and parameters: {'n_layers': 3, 'embedding_dim': 32, 'lr': 0.0016405237668077803, 'lambda_val': 0.0002170393924492861, 'batch_size': 2839, 'optimizer': 'RMSprop'}.
2026-07-01 00:11:17,729 - experiment_functions - INFO - Early stopping at epoch 500. Best Metrics: (0.00017958871480837688, 5.9837015367665226e-05, 0.00010760693993265031)
2026-07-01 00:11:18,026 - optuna.study.study - INFO - Trial 48 finished with values: [0.00017958871480837688, 5.9837015367665226e-05, 0.00010760693993265031] and parameters: {'n_layers': 1, 'embedding_dim': 32, 'lr': 0.0007653769498500043, 'lambda_val': 0.0673683266081649, 'batch_size': 755, 'optimizer': 'SGD'}.
2026-07-01 00:14:53,870 - experiment_functions - INFO - Early stopping at epoch 2900. Best Metrics: (0.00039242733509940893, 8.548145052523602e-05, 0.0002190034176543213)
2026-07-01 00:14:53,964 - optuna.study.study - INFO - Trial 49 finished with values: [0.00039242733509940893, 8.548145052523602e-05, 0.0002190034176543213] and parameters: {'n_layers': 3, 'embedding_dim': 32, 'lr': 0.00012424307540990912, 'lambda_val': 2.315958805195039e-06, 'batch_size': 1425, 'optimizer': 'RMSprop'}.
2026-07-01 00:20:43,738 - experiment_functions - INFO - Early stopping at epoch 3850. Best Metrics: (0.00048780976790512243, 0.00011872423684060558, 0.0002721732221204106)
2026-07-01 00:20:43,838 - optuna.study.study - INFO - Trial 50 finished with values: [0.00048780976790512243, 0.00011872423684060558, 0.0002721732221204106] and parameters: {'n_layers': 2, 'embedding_dim': 256, 'lr': 0.00011721700452597054, 'lambda_val': 0.00018211311456273736, 'batch_size': 2882, 'optimizer': 'RMSprop'}.
2026-07-01 00:21:42,208 - experiment_functions - INFO - Early stopping at epoch 600. Best Metrics: (0.001542970402903396, 0.0004559010694679254, 0.0010714970560142447)
2026-07-01 00:21:42,297 - optuna.study.study - INFO - Trial 51 finished with values: [0.001542970402903396, 0.0004559010694679254, 0.0010714970560142447] and parameters: {'n_layers': 2, 'embedding_dim': 256, 'lr': 0.0038652724378170286, 'lambda_val': 0.002718086981783345, 'batch_size': 3660, 'optimizer': 'RMSprop'}.
2026-07-01 00:23:56,014 - experiment_functions - INFO - Early stopping at epoch 1550. Best Metrics: (0.00031604833103868874, 6.648557263073913e-05, 0.00016247828131016204)
2026-07-01 00:23:56,095 - optuna.study.study - INFO - Trial 52 finished with values: [0.00031604833103868874, 6.648557263073913e-05, 0.00016247828131016204] and parameters: {'n_layers': 1, 'embedding_dim': 256, 'lr': 0.00010388043909039313, 'lambda_val': 0.0002170393924492861, 'batch_size': 868, 'optimizer': 'RMSprop'}.
2026-07-01 00:24:50,522 - experiment_functions - INFO - Early stopping at epoch 550. Best Metrics: (0.001367687617087009, 0.00040556199304750873, 0.0009467560087512572)
2026-07-01 00:24:50,611 - optuna.study.study - INFO - Trial 53 finished with values: [0.001367687617087009, 0.00040556199304750873, 0.0009467560087512572] and parameters: {'n_layers': 2, 'embedding_dim': 256, 'lr': 0.031461997995131906, 'lambda_val': 0.0014410548016705043, 'batch_size': 2733, 'optimizer': 'Adam'}.
2026-07-01 00:27:03,870 - experiment_functions - INFO - Early stopping at epoch 1650. Best Metrics: (0.002932650662670449, 0.0008329692456736887, 0.001936016454925701)
2026-07-01 00:27:03,946 - optuna.study.study - INFO - Trial 54 finished with values: [0.002932650662670449, 0.0008329692456736887, 0.001936016454925701] and parameters: {'n_layers': 4, 'embedding_dim': 64, 'lr': 0.0011423999744800083, 'lambda_val': 4.186926040366856e-06, 'batch_size': 3342, 'optimizer': 'RMSprop'}.
2026-07-01 00:32:39,280 - optuna.study.study - INFO - Trial 55 finished with values: [0.00046246696567422746, 0.00011967403073533045, 0.00025889758701178587] and parameters: {'n_layers': 3, 'embedding_dim': 128, 'lr': 0.00011721700452597054, 'lambda_val': 2.0872081718094317e-06, 'batch_size': 3031, 'optimizer': 'RMSprop'}.
2026-07-01 00:38:43,053 - optuna.study.study - INFO - Trial 56 finished with values: [0.002298217682090628, 0.0006002697414661019, 0.001485969037574476] and parameters: {'n_layers': 2, 'embedding_dim': 256, 'lr': 0.0006943898292817254, 'lambda_val': 0.00011682518010112995, 'batch_size': 868, 'optimizer': 'RMSprop'}.
2026-07-01 00:44:14,436 - optuna.study.study - INFO - Trial 57 finished with values: [0.001791112521302375, 0.00047299735957297265, 0.0011707679512997764] and parameters: {'n_layers': 4, 'embedding_dim': 96, 'lr': 0.00036793465593271086, 'lambda_val': 0.00818244172221547, 'batch_size': 1697, 'optimizer': 'RMSprop'}.
2026-07-01 00:44:55,969 - experiment_functions - INFO - Early stopping at epoch 500. Best Metrics: (0.0002346640948582393, 5.8887221472940384e-05, 0.00012756745025582704)
2026-07-01 00:44:56,044 - optuna.study.study - INFO - Trial 58 finished with values: [0.0002346640948582393, 5.8887221472940384e-05, 0.00012756745025582704] and parameters: {'n_layers': 2, 'embedding_dim': 64, 'lr': 0.0038652724378170286, 'lambda_val': 4.461595733760336e-06, 'batch_size': 2607, 'optimizer': 'SGD'}.
2026-07-01 00:45:39,497 - experiment_functions - INFO - Early stopping at epoch 500. Best Metrics: (0.00022020193348175994, 6.17366031571149e-05, 0.00014304763443911836)
2026-07-01 00:45:39,613 - optuna.study.study - INFO - Trial 59 finished with values: [0.00022020193348175994, 6.17366031571149e-05, 0.00014304763443911836] and parameters: {'n_layers': 3, 'embedding_dim': 96, 'lr': 0.00020384857480906953, 'lambda_val': 0.00818244172221547, 'batch_size': 3402, 'optimizer': 'SGD'}.
2026-07-01 00:50:51,157 - optuna.study.study - INFO - Trial 60 finished with values: [0.002111999251428854, 0.0005280854054670137, 0.0014091339776966967] and parameters: {'n_layers': 1, 'embedding_dim': 128, 'lr': 0.001557510643925403, 'lambda_val': 0.00011682518010112995, 'batch_size': 977, 'optimizer': 'RMSprop'}.
2026-07-01 00:52:21,278 - experiment_functions - INFO - Early stopping at epoch 1050. Best Metrics: (0.00017451496711295563, 5.983701536766523e-05, 0.00010188291984443471)
2026-07-01 00:52:21,360 - optuna.study.study - INFO - Trial 61 finished with values: [0.00017451496711295563, 5.983701536766523e-05, 0.00010188291984443471] and parameters: {'n_layers': 4, 'embedding_dim': 96, 'lr': 1.980563312897711e-05, 'lambda_val': 0.003195386254489329, 'batch_size': 2475, 'optimizer': 'RMSprop'}.
2026-07-01 00:53:11,865 - experiment_functions - INFO - Early stopping at epoch 600. Best Metrics: (0.001326912341213103, 0.00034097600820621923, 0.0008900608249410477)
2026-07-01 00:53:11,946 - optuna.study.study - INFO - Trial 62 finished with values: [0.001326912341213103, 0.00034097600820621923, 0.0008900608249410477] and parameters: {'n_layers': 2, 'embedding_dim': 96, 'lr': 0.06928801192246781, 'lambda_val': 4.186926040366856e-06, 'batch_size': 3005, 'optimizer': 'RMSprop'}.
2026-07-01 00:53:57,238 - experiment_functions - INFO - Early stopping at epoch 500. Best Metrics: (0.00023166613788875063, 5.888722147294038e-05, 0.0001316379693124264)
2026-07-01 00:53:57,325 - optuna.study.study - INFO - Trial 63 finished with values: [0.00023166613788875063, 5.888722147294038e-05, 0.0001316379693124264] and parameters: {'n_layers': 3, 'embedding_dim': 128, 'lr': 0.00011232539418061215, 'lambda_val': 0.01571503459381708, 'batch_size': 3062, 'optimizer': 'SGD'}.
2026-07-01 00:57:13,512 - experiment_functions - INFO - Early stopping at epoch 2400. Best Metrics: (0.0011117940044929721, 0.0003666204433637901, 0.0007564409603896878)
2026-07-01 00:57:13,585 - optuna.study.study - INFO - Trial 64 finished with values: [0.0011117940044929721, 0.0003666204433637901, 0.0007564409603896878] and parameters: {'n_layers': 2, 'embedding_dim': 128, 'lr': 0.06928801192246781, 'lambda_val': 0.03852293779947387, 'batch_size': 3927, 'optimizer': 'RMSprop'}.
2026-07-01 00:58:06,952 - experiment_functions - INFO - Early stopping at epoch 600. Best Metrics: (0.0017347497952768798, 0.0004948426191516441, 0.0012190792002941696)
2026-07-01 00:58:07,035 - optuna.study.study - INFO - Trial 65 finished with values: [0.0017347497952768798, 0.0004948426191516441, 0.0012190792002941696] and parameters: {'n_layers': 4, 'embedding_dim': 96, 'lr': 0.027207137179041257, 'lambda_val': 4.134172720235837e-06, 'batch_size': 3402, 'optimizer': 'RMSprop'}.
2026-07-01 00:59:25,568 - experiment_functions - INFO - Early stopping at epoch 950. Best Metrics: (0.0021742714267121424, 0.0006202154132553236, 0.0014856415737832963)
2026-07-01 00:59:25,661 - optuna.study.study - INFO - Trial 66 finished with values: [0.0021742714267121424, 0.0006202154132553236, 0.0014856415737832963] and parameters: {'n_layers': 4, 'embedding_dim': 64, 'lr': 0.005034910940629331, 'lambda_val': 4.461595733760336e-06, 'batch_size': 3309, 'optimizer': 'RMSprop'}.
2026-07-01 01:00:10,979 - experiment_functions - INFO - Early stopping at epoch 500. Best Metrics: (0.00021687962405165075, 5.6987633683490685e-05, 0.00011912847032720099)
2026-07-01 01:00:11,116 - optuna.study.study - INFO - Trial 67 finished with values: [0.00021687962405165075, 5.6987633683490685e-05, 0.00011912847032720099] and parameters: {'n_layers': 1, 'embedding_dim': 256, 'lr': 0.00040792058080505686, 'lambda_val': 1.3573657888080551e-06, 'batch_size': 1425, 'optimizer': 'SGD'}.
2026-07-01 01:05:57,479 - optuna.study.study - INFO - Trial 68 finished with values: [0.0003131880784152298, 6.933495431491366e-05, 0.000172117448665814] and parameters: {'n_layers': 4, 'embedding_dim': 128, 'lr': 7.474179240056188e-05, 'lambda_val': 0.004610412577275848, 'batch_size': 1581, 'optimizer': 'RMSprop'}.
2026-07-01 01:08:31,376 - experiment_functions - INFO - Early stopping at epoch 1800. Best Metrics: (0.00019087670324623393, 6.838516042018884e-05, 0.0001135588977837585)
2026-07-01 01:08:31,462 - optuna.study.study - INFO - Trial 69 finished with values: [0.00019087670324623393, 6.838516042018884e-05, 0.0001135588977837585] and parameters: {'n_layers': 3, 'embedding_dim': 128, 'lr': 2.7574907624731768e-05, 'lambda_val': 0.00022111146363119937, 'batch_size': 2929, 'optimizer': 'Adam'}.
2026-07-01 01:13:56,410 - optuna.study.study - INFO - Trial 70 finished with values: [0.002081470198552705, 0.0005470812833615106, 0.0013928494937538588] and parameters: {'n_layers': 2, 'embedding_dim': 128, 'lr': 0.0010455025017472735, 'lambda_val': 9.685985329294218e-06, 'batch_size': 1544, 'optimizer': 'Adam'}.
2026-07-01 01:14:47,651 - experiment_functions - INFO - Early stopping at epoch 600. Best Metrics: (0.00170968740821997, 0.0005214368482039397, 0.0012487676686440995)
