2026-07-08 13:03:17,614 - optuna.study.study - INFO - Trial 299 finished with values: [0.0019915873517394045, 0.0005252360237828392, 0.0012174856861745776] and parameters: {'n_layers': 3, 'embedding_dim': 32, 'lr': 0.002396901451187955, 'lambda_val': 0.00045919787742064835, 'batch_size': 1422, 'optimizer': 'Adam'}.
2026-07-08 13:03:17,629 - root - INFO - Selected Trial 289 based on Max ndcg: 0.0027
2026-07-08 13:03:17,629 - root - INFO - Associated Recall: 0.0041
2026-07-08 13:03:17,629 - experiment_functions - INFO - Training the best model ... for e_amazon_1c2dcs_strict
2026-07-08 13:04:49,263 - experiment_functions - INFO - Early stopping at epoch 1200. Best Metrics: (0.003592294926657968, 0.0012423304143000967, 0.002615751773460783)
2026-07-08 13:04:56,149 - root - INFO -   **** Training e_amazon_1c2dcs_strict_rand1
2026-07-08 13:04:56,212 - root - INFO -   **** Getting 154469/2429444 random edges
2026-07-08 13:04:56,408 - optuna.storages._rdb.storage - INFO - A new study created in RDB with name: Study_e_amazon_1c2dcs_strict_rand1
2026-07-08 13:08:58,748 - experiment_functions - INFO - Early stopping at epoch 2400. Best Metrics: (0.0056147154439437795, 0.0015842562164010408, 0.003616908214992721)
2026-07-08 13:08:58,838 - optuna.study.study - INFO - Trial 0 finished with values: [0.0056147154439437795, 0.0015842562164010408, 0.003616908214992721] and parameters: {'n_layers': 3, 'embedding_dim': 256, 'lr': 0.0020140299216981693, 'lambda_val': 1.3798424398068006e-06, 'batch_size': 587, 'optimizer': 'Adam'}.
2026-07-08 13:09:43,397 - experiment_functions - INFO - Early stopping at epoch 550. Best Metrics: (0.0011355877774984289, 0.00026879167220713105, 0.0007003286117529384)
2026-07-08 13:09:43,515 - optuna.study.study - INFO - Trial 1 finished with values: [0.0011355877774984289, 0.00026879167220713105, 0.0007003286117529384] and parameters: {'n_layers': 1, 'embedding_dim': 64, 'lr': 0.0551856388391199, 'lambda_val': 0.0016232859849467467, 'batch_size': 1279, 'optimizer': 'Adam'}.
2026-07-08 13:14:47,822 - optuna.study.study - INFO - Trial 2 finished with values: [0.0017028748003480472, 0.00041031096252113294, 0.0010156934085455845] and parameters: {'n_layers': 1, 'embedding_dim': 96, 'lr': 0.0004475125719004404, 'lambda_val': 2.1792866157824918e-05, 'batch_size': 3958, 'optimizer': 'RMSprop'}.
2026-07-08 13:16:22,845 - experiment_functions - INFO - Early stopping at epoch 1000. Best Metrics: (0.00017639821447939274, 6.078680926239006e-05, 0.00012324812379344897)
2026-07-08 13:16:22,928 - optuna.study.study - INFO - Trial 3 finished with values: [0.00017639821447939274, 6.078680926239006e-05, 0.00012324812379344897] and parameters: {'n_layers': 2, 'embedding_dim': 256, 'lr': 2.4098713819124373e-05, 'lambda_val': 2.489099384365272e-06, 'batch_size': 3954, 'optimizer': 'RMSprop'}.
2026-07-08 13:18:24,475 - experiment_functions - INFO - Early stopping at epoch 1500. Best Metrics: (0.004538586196953336, 0.0012698744372471175, 0.002989092734566629)
2026-07-08 13:18:24,558 - optuna.study.study - INFO - Trial 4 finished with values: [0.004538586196953336, 0.0012698744372471175, 0.002989092734566629] and parameters: {'n_layers': 2, 'embedding_dim': 96, 'lr': 0.0033540795104684273, 'lambda_val': 1.3682303752290278e-06, 'batch_size': 1709, 'optimizer': 'RMSprop'}.
2026-07-08 13:24:33,091 - optuna.study.study - INFO - Trial 5 finished with values: [0.0025698364138334695, 0.0007607849096746006, 0.001756524737554695] and parameters: {'n_layers': 2, 'embedding_dim': 256, 'lr': 0.0003860546096975283, 'lambda_val': 0.026231052260673512, 'batch_size': 3155, 'optimizer': 'RMSprop'}.
2026-07-08 13:26:37,105 - experiment_functions - INFO - Early stopping at epoch 1600. Best Metrics: (0.004509435341246027, 0.0011767946355640826, 0.0028537214226897877)
2026-07-08 13:26:37,180 - optuna.study.study - INFO - Trial 6 finished with values: [0.004509435341246027, 0.0011767946355640826, 0.0028537214226897877] and parameters: {'n_layers': 2, 'embedding_dim': 64, 'lr': 0.0026199811222762572, 'lambda_val': 4.325919770856533e-05, 'batch_size': 1388, 'optimizer': 'Adam'}.
2026-07-08 13:27:18,308 - experiment_functions - INFO - Early stopping at epoch 500. Best Metrics: (0.00013444257572914825, 4.653990084151739e-05, 8.686843769692385e-05)
2026-07-08 13:27:18,416 - optuna.study.study - INFO - Trial 7 finished with values: [0.00013444257572914825, 4.653990084151739e-05, 8.686843769692385e-05] and parameters: {'n_layers': 2, 'embedding_dim': 64, 'lr': 0.003066731724002767, 'lambda_val': 0.014987555234859019, 'batch_size': 604, 'optimizer': 'SGD'}.
2026-07-08 13:34:03,487 - experiment_functions - INFO - Early stopping at epoch 3850. Best Metrics: (0.0003550835334927426, 8.073248105161182e-05, 0.0001858065756669579)
2026-07-08 13:34:03,615 - optuna.study.study - INFO - Trial 8 finished with values: [0.0003550835334927426, 8.073248105161182e-05, 0.0001858065756669579] and parameters: {'n_layers': 4, 'embedding_dim': 256, 'lr': 0.00010523058953886062, 'lambda_val': 1.0848669243382651e-05, 'batch_size': 2163, 'optimizer': 'RMSprop'}.
2026-07-08 13:34:45,983 - experiment_functions - INFO - Early stopping at epoch 500. Best Metrics: (0.00020036990605718145, 4.748969473624224e-05, 0.00012045184339564671)
2026-07-08 13:34:46,085 - optuna.study.study - INFO - Trial 9 finished with values: [0.00020036990605718145, 4.748969473624224e-05, 0.00012045184339564671] and parameters: {'n_layers': 2, 'embedding_dim': 96, 'lr': 0.008407564987450959, 'lambda_val': 1.7714407793786636e-06, 'batch_size': 747, 'optimizer': 'SGD'}.
2026-07-08 13:35:32,623 - experiment_functions - INFO - Early stopping at epoch 550. Best Metrics: (0.0017802536320752772, 0.00046444921452044906, 0.001189341059940278)
2026-07-08 13:35:32,739 - optuna.study.study - INFO - Trial 10 finished with values: [0.0017802536320752772, 0.00046444921452044906, 0.001189341059940278] and parameters: {'n_layers': 3, 'embedding_dim': 64, 'lr': 0.06676092903588395, 'lambda_val': 5.028751133238856e-05, 'batch_size': 2986, 'optimizer': 'RMSprop'}.
2026-07-08 13:36:18,165 - experiment_functions - INFO - Early stopping at epoch 500. Best Metrics: (0.00017676787895370052, 5.0339076420416775e-05, 0.00010216414735217974)
2026-07-08 13:36:18,256 - optuna.study.study - INFO - Trial 11 finished with values: [0.00017676787895370052, 5.0339076420416775e-05, 0.00010216414735217974] and parameters: {'n_layers': 3, 'embedding_dim': 128, 'lr': 0.0004370524927230785, 'lambda_val': 3.0488381156329643e-05, 'batch_size': 1837, 'optimizer': 'SGD'}.
2026-07-08 13:37:05,069 - experiment_functions - INFO - Early stopping at epoch 500. Best Metrics: (0.00018670992682789825, 5.6987633683490685e-05, 0.0001161765086351516)
2026-07-08 13:37:05,151 - optuna.study.study - INFO - Trial 12 finished with values: [0.00018670992682789825, 5.6987633683490685e-05, 0.0001161765086351516] and parameters: {'n_layers': 4, 'embedding_dim': 128, 'lr': 0.021962016808300084, 'lambda_val': 0.037372323099812595, 'batch_size': 2019, 'optimizer': 'SGD'}.
2026-07-08 13:38:22,411 - experiment_functions - INFO - Early stopping at epoch 700. Best Metrics: (0.003956466274122618, 0.0011777444294588076, 0.002556660286986845)
2026-07-08 13:38:22,497 - optuna.study.study - INFO - Trial 13 finished with values: [0.003956466274122618, 0.0011777444294588076, 0.002556660286986845] and parameters: {'n_layers': 4, 'embedding_dim': 256, 'lr': 0.002634796822286242, 'lambda_val': 0.0016935759490927101, 'batch_size': 891, 'optimizer': 'RMSprop'}.
2026-07-08 13:39:30,099 - experiment_functions - INFO - Early stopping at epoch 600. Best Metrics: (0.0026134481067071128, 0.0006667553140968412, 0.0017028217429531697)
2026-07-08 13:39:30,179 - optuna.study.study - INFO - Trial 14 finished with values: [0.0026134481067071128, 0.0006667553140968412, 0.0017028217429531697] and parameters: {'n_layers': 4, 'embedding_dim': 256, 'lr': 0.06323571881194533, 'lambda_val': 7.545018077704894e-06, 'batch_size': 2799, 'optimizer': 'RMSprop'}.
2026-07-08 13:40:13,249 - experiment_functions - INFO - Early stopping at epoch 500. Best Metrics: (0.0001931184018560141, 4.843948863096708e-05, 0.00010645935294109461)
2026-07-08 13:40:13,329 - optuna.study.study - INFO - Trial 15 finished with values: [0.0001931184018560141, 4.843948863096708e-05, 0.00010645935294109461] and parameters: {'n_layers': 2, 'embedding_dim': 96, 'lr': 1.7043431645229402e-05, 'lambda_val': 0.04992703133212536, 'batch_size': 3376, 'optimizer': 'SGD'}.
2026-07-08 13:41:26,624 - experiment_functions - INFO - Early stopping at epoch 650. Best Metrics: (0.003840626380664501, 0.001107459681249169, 0.0024541633144077443)
2026-07-08 13:41:26,698 - optuna.study.study - INFO - Trial 16 finished with values: [0.003840626380664501, 0.001107459681249169, 0.0024541633144077443] and parameters: {'n_layers': 4, 'embedding_dim': 256, 'lr': 0.003328720631447993, 'lambda_val': 0.005748467002573189, 'batch_size': 3285, 'optimizer': 'Adam'}.
2026-07-08 13:42:07,624 - experiment_functions - INFO - Early stopping at epoch 500. Best Metrics: (0.0002821520118152474, 6.838516042018881e-05, 0.00013963790293210082)
2026-07-08 13:42:07,704 - optuna.study.study - INFO - Trial 17 finished with values: [0.0002821520118152474, 6.838516042018881e-05, 0.00013963790293210082] and parameters: {'n_layers': 4, 'embedding_dim': 32, 'lr': 0.01683385264949986, 'lambda_val': 1.639348156161879e-05, 'batch_size': 3584, 'optimizer': 'SGD'}.
2026-07-08 13:42:50,818 - experiment_functions - INFO - Early stopping at epoch 550. Best Metrics: (0.0002535563503161266, 7.313412989381304e-05, 0.00017226973452333388)
2026-07-08 13:42:50,887 - optuna.study.study - INFO - Trial 18 finished with values: [0.0002535563503161266, 7.313412989381304e-05, 0.00017226973452333388] and parameters: {'n_layers': 1, 'embedding_dim': 32, 'lr': 2.2676180158888087e-05, 'lambda_val': 0.011208072633836318, 'batch_size': 1487, 'optimizer': 'RMSprop'}.
2026-07-08 13:44:27,801 - experiment_functions - INFO - Early stopping at epoch 1300. Best Metrics: (0.0029015411605284058, 0.0007132952149383583, 0.001854608369289933)
2026-07-08 13:44:27,868 - optuna.study.study - INFO - Trial 19 finished with values: [0.0029015411605284058, 0.0007132952149383583, 0.001854608369289933] and parameters: {'n_layers': 1, 'embedding_dim': 32, 'lr': 0.0024216232986666152, 'lambda_val': 6.892455337046496e-05, 'batch_size': 3093, 'optimizer': 'Adam'}.
2026-07-08 13:45:42,685 - experiment_functions - INFO - Early stopping at epoch 1000. Best Metrics: (0.0001898567009037517, 5.603783978876584e-05, 0.00012513878874406646)
2026-07-08 13:45:42,783 - optuna.study.study - INFO - Trial 20 finished with values: [0.0001898567009037517, 5.603783978876584e-05, 0.00012513878874406646] and parameters: {'n_layers': 1, 'embedding_dim': 32, 'lr': 2.0366584886481747e-05, 'lambda_val': 3.7303655613955388e-06, 'batch_size': 1881, 'optimizer': 'RMSprop'}.
2026-07-08 13:49:01,671 - experiment_functions - INFO - Early stopping at epoch 2700. Best Metrics: (0.0002726861136949871, 7.503371768326274e-05, 0.0001535906743249561)
2026-07-08 13:49:01,736 - optuna.study.study - INFO - Trial 21 finished with values: [0.0002726861136949871, 7.503371768326274e-05, 0.0001535906743249561] and parameters: {'n_layers': 2, 'embedding_dim': 32, 'lr': 7.799284663222714e-05, 'lambda_val': 0.0007708873743567546, 'batch_size': 3801, 'optimizer': 'Adam'}.
2026-07-08 13:51:45,319 - experiment_functions - INFO - Early stopping at epoch 2050. Best Metrics: (0.00022656696537735747, 6.268639705183976e-05, 0.0001264261882161323)
2026-07-08 13:51:45,410 - optuna.study.study - INFO - Trial 22 finished with values: [0.00022656696537735747, 6.268639705183976e-05, 0.0001264261882161323] and parameters: {'n_layers': 4, 'embedding_dim': 64, 'lr': 3.990245198417773e-05, 'lambda_val': 0.00033292933050373764, 'batch_size': 1626, 'optimizer': 'RMSprop'}.
2026-07-08 13:52:37,554 - experiment_functions - INFO - Early stopping at epoch 500. Best Metrics: (0.00019548805028515875, 5.698763368349069e-05, 0.00012505348370747454)
2026-07-08 13:52:37,621 - optuna.study.study - INFO - Trial 23 finished with values: [0.00019548805028515875, 5.698763368349069e-05, 0.00012505348370747454] and parameters: {'n_layers': 3, 'embedding_dim': 256, 'lr': 0.07277712609285816, 'lambda_val': 0.00021691802766604288, 'batch_size': 2003, 'optimizer': 'SGD'}.
2026-07-08 13:53:18,968 - experiment_functions - INFO - Early stopping at epoch 500. Best Metrics: (0.0001898653308076814, 5.223866420986646e-05, 0.00010441785761939789)
2026-07-08 13:53:19,491 - optuna.study.study - INFO - Trial 24 finished with values: [0.0001898653308076814, 5.223866420986646e-05, 0.00010441785761939789] and parameters: {'n_layers': 1, 'embedding_dim': 96, 'lr': 0.00020538479700520375, 'lambda_val': 0.01207248845563283, 'batch_size': 1739, 'optimizer': 'SGD'}.
2026-07-08 13:54:04,661 - experiment_functions - INFO - Early stopping at epoch 500. Best Metrics: (0.00018944665670086818, 5.318845810459131e-05, 0.00011740306947597405)
2026-07-08 13:54:04,758 - optuna.study.study - INFO - Trial 25 finished with values: [0.00018944665670086818, 5.318845810459131e-05, 0.00011740306947597405] and parameters: {'n_layers': 1, 'embedding_dim': 256, 'lr': 0.00014411157006363916, 'lambda_val': 0.00024021886586439757, 'batch_size': 2294, 'optimizer': 'SGD'}.
2026-07-08 13:54:53,621 - experiment_functions - INFO - Early stopping at epoch 500. Best Metrics: (0.0001947573651019846, 5.223866420986647e-05, 0.00011769414236547745)
2026-07-08 13:54:53,693 - optuna.study.study - INFO - Trial 26 finished with values: [0.0001947573651019846, 5.223866420986647e-05, 0.00011769414236547745] and parameters: {'n_layers': 2, 'embedding_dim': 256, 'lr': 0.0009178741978142315, 'lambda_val': 2.0369390975196905e-06, 'batch_size': 1390, 'optimizer': 'SGD'}.
2026-07-08 13:55:38,137 - experiment_functions - INFO - Early stopping at epoch 550. Best Metrics: (0.0020715674451388943, 0.0006135668559922496, 0.0013413683419641219)
2026-07-08 13:55:38,461 - optuna.study.study - INFO - Trial 27 finished with values: [0.0020715674451388943, 0.0006135668559922496, 0.0013413683419641219] and parameters: {'n_layers': 3, 'embedding_dim': 32, 'lr': 0.00635566229797604, 'lambda_val': 0.0071217114816529686, 'batch_size': 2781, 'optimizer': 'RMSprop'}.
2026-07-08 13:58:06,603 - experiment_functions - INFO - Early stopping at epoch 1800. Best Metrics: (0.00268773410723802, 0.0007883289326216211, 0.0018577256716601012)
2026-07-08 13:58:06,710 - optuna.study.study - INFO - Trial 28 finished with values: [0.00268773410723802, 0.0007883289326216211, 0.0018577256716601012] and parameters: {'n_layers': 2, 'embedding_dim': 128, 'lr': 0.001177253088002245, 'lambda_val': 0.03786575442820556, 'batch_size': 1520, 'optimizer': 'Adam'}.
2026-07-08 13:58:49,092 - experiment_functions - INFO - Early stopping at epoch 500. Best Metrics: (0.0002298835622454277, 5.508804589404098e-05, 0.00012655831037169775)
2026-07-08 13:58:49,198 - optuna.study.study - INFO - Trial 29 finished with values: [0.0002298835622454277, 5.508804589404098e-05, 0.00012655831037169775] and parameters: {'n_layers': 2, 'embedding_dim': 96, 'lr': 0.0007269915590454588, 'lambda_val': 5.643699086352486e-05, 'batch_size': 2163, 'optimizer': 'SGD'}.
2026-07-08 14:04:05,425 - optuna.study.study - INFO - Trial 30 finished with values: [0.0002693459073338953, 7.123454210436335e-05, 0.00014374714486483807] and parameters: {'n_layers': 2, 'embedding_dim': 96, 'lr': 6.440420204683438e-05, 'lambda_val': 0.00013037887369277324, 'batch_size': 2727, 'optimizer': 'Adam'}.
2026-07-08 14:05:10,003 - experiment_functions - INFO - Early stopping at epoch 750. Best Metrics: (0.0002696230965772992, 7.313412989381304e-05, 0.0001407849496847111)
2026-07-08 14:05:10,163 - optuna.study.study - INFO - Trial 31 finished with values: [0.0002696230965772992, 7.313412989381304e-05, 0.0001407849496847111] and parameters: {'n_layers': 3, 'embedding_dim': 96, 'lr': 2.697463836977008e-05, 'lambda_val': 5.412802489563213e-05, 'batch_size': 3400, 'optimizer': 'Adam'}.
2026-07-08 14:10:46,249 - optuna.study.study - INFO - Trial 32 finished with values: [0.004021334287970248, 0.001095112360617746, 0.0025468939518016554] and parameters: {'n_layers': 4, 'embedding_dim': 96, 'lr': 0.00031544987227609666, 'lambda_val': 5.222245565310666e-05, 'batch_size': 2290, 'optimizer': 'RMSprop'}.
2026-07-08 14:14:22,296 - experiment_functions - INFO - Early stopping at epoch 2950. Best Metrics: (0.0010577821264479664, 0.00032198013031172244, 0.000710250921522531)
2026-07-08 14:14:22,372 - optuna.study.study - INFO - Trial 33 finished with values: [0.0010577821264479664, 0.00032198013031172244, 0.000710250921522531] and parameters: {'n_layers': 1, 'embedding_dim': 32, 'lr': 0.0018422302832834167, 'lambda_val': 0.08001288108820112, 'batch_size': 2085, 'optimizer': 'RMSprop'}.
2026-07-08 14:21:00,273 - optuna.study.study - INFO - Trial 34 finished with values: [0.00561429321195847, 0.0014484356894553883, 0.003699833988372625] and parameters: {'n_layers': 3, 'embedding_dim': 256, 'lr': 0.0003947216765049812, 'lambda_val': 0.00022747449700120018, 'batch_size': 2350, 'optimizer': 'RMSprop'}.
2026-07-08 14:22:22,465 - experiment_functions - INFO - Early stopping at epoch 1000. Best Metrics: (0.00020831748379008803, 5.983701536766521e-05, 0.00014236009566071894)
2026-07-08 14:22:22,563 - optuna.study.study - INFO - Trial 35 finished with values: [0.00020831748379008803, 5.983701536766521e-05, 0.00014236009566071894] and parameters: {'n_layers': 4, 'embedding_dim': 64, 'lr': 3.9137881969792394e-05, 'lambda_val': 1.9164184765323345e-06, 'batch_size': 2444, 'optimizer': 'RMSprop'}.
2026-07-08 14:23:59,442 - experiment_functions - INFO - Early stopping at epoch 1250. Best Metrics: (0.00024197910470553834, 6.36361909465646e-05, 0.0001311793929982429)
2026-07-08 14:23:59,523 - optuna.study.study - INFO - Trial 36 finished with values: [0.00024197910470553834, 6.36361909465646e-05, 0.0001311793929982429] and parameters: {'n_layers': 4, 'embedding_dim': 32, 'lr': 1.9706069050044566e-05, 'lambda_val': 9.06090753534178e-05, 'batch_size': 2277, 'optimizer': 'Adam'}.
2026-07-08 14:24:45,138 - experiment_functions - INFO - Early stopping at epoch 500. Best Metrics: (0.00019678799217755745, 5.223866420986647e-05, 0.00010159781044769268)
2026-07-08 14:24:45,233 - optuna.study.study - INFO - Trial 37 finished with values: [0.00019678799217755745, 5.223866420986647e-05, 0.00010159781044769268] and parameters: {'n_layers': 3, 'embedding_dim': 128, 'lr': 0.0003054703159021048, 'lambda_val': 0.00107804564009617, 'batch_size': 3628, 'optimizer': 'SGD'}.
2026-07-08 14:25:35,951 - experiment_functions - INFO - Early stopping at epoch 650. Best Metrics: (0.0018342429647447394, 0.0004606500389415497, 0.0011404616746219327)
2026-07-08 14:25:36,034 - optuna.study.study - INFO - Trial 38 finished with values: [0.0018342429647447394, 0.0004606500389415497, 0.0011404616746219327] and parameters: {'n_layers': 1, 'embedding_dim': 32, 'lr': 0.016511190294346553, 'lambda_val': 0.0008206810021385492, 'batch_size': 2191, 'optimizer': 'Adam'}.
2026-07-08 14:26:20,139 - experiment_functions - INFO - Early stopping at epoch 500. Best Metrics: (0.00018946013059273294, 5.698763368349069e-05, 0.00011483634739126735)
2026-07-08 14:26:20,229 - optuna.study.study - INFO - Trial 39 finished with values: [0.00018946013059273294, 5.698763368349069e-05, 0.00011483634739126735] and parameters: {'n_layers': 2, 'embedding_dim': 128, 'lr': 0.006297648769451647, 'lambda_val': 0.019409563843673885, 'batch_size': 3967, 'optimizer': 'SGD'}.
2026-07-08 14:27:02,312 - experiment_functions - INFO - Early stopping at epoch 500. Best Metrics: (0.0001710333441782644, 5.223866420986646e-05, 0.0001126453628425644)
2026-07-08 14:27:02,467 - optuna.study.study - INFO - Trial 40 finished with values: [0.0001710333441782644, 5.223866420986646e-05, 0.0001126453628425644] and parameters: {'n_layers': 3, 'embedding_dim': 64, 'lr': 0.00022323260308062016, 'lambda_val': 0.021711963400481683, 'batch_size': 2700, 'optimizer': 'SGD'}.
2026-07-08 14:32:16,443 - optuna.study.study - INFO - Trial 41 finished with values: [0.004663176567880344, 0.0011587485515643105, 0.002915031642405768] and parameters: {'n_layers': 3, 'embedding_dim': 64, 'lr': 0.0005079724528508135, 'lambda_val': 6.625860010406062e-06, 'batch_size': 2341, 'optimizer': 'Adam'}.
2026-07-08 14:37:20,005 - optuna.study.study - INFO - Trial 42 finished with values: [0.001807773362504602, 0.000526185817677564, 0.0011810220981320367] and parameters: {'n_layers': 4, 'embedding_dim': 32, 'lr': 0.09512817229126444, 'lambda_val': 0.038323962237623424, 'batch_size': 3239, 'optimizer': 'Adam'}.
2026-07-08 14:42:46,785 - optuna.study.study - INFO - Trial 43 finished with values: [0.0005243135124586241, 0.00012347320631422984, 0.00032255170586539946] and parameters: {'n_layers': 2, 'embedding_dim': 128, 'lr': 0.0002454729414198771, 'lambda_val': 0.00031126728324925375, 'batch_size': 1384, 'optimizer': 'Adam'}.
2026-07-08 14:46:34,086 - experiment_functions - INFO - Early stopping at epoch 2800. Best Metrics: (0.006948430031056676, 0.0019594248048173547, 0.004596861037214852)
2026-07-08 14:46:34,179 - optuna.study.study - INFO - Trial 44 finished with values: [0.006948430031056676, 0.0019594248048173547, 0.004596861037214852] and parameters: {'n_layers': 4, 'embedding_dim': 64, 'lr': 0.0013152005063538942, 'lambda_val': 3.919783466405167e-06, 'batch_size': 1562, 'optimizer': 'RMSprop'}.
2026-07-08 14:47:16,922 - experiment_functions - INFO - Early stopping at epoch 500. Best Metrics: (0.0002544786593623047, 6.36361909465646e-05, 0.000135236490216583)
