2026-07-08 08:26:41,111 - optuna.study.study - INFO - Trial 158 finished with values: [0.0009525426280472084, 0.0004540014816784758, 0.0007503320094068377] and parameters: {'n_layers': 1, 'embedding_dim': 128, 'lr': 0.0031808570812741697, 'lambda_val': 0.0075007094493865275, 'batch_size': 3930, 'optimizer': 'RMSprop'}.
2026-07-08 08:30:46,863 - experiment_functions - INFO - Early stopping at epoch 2550. Best Metrics: (0.0017517347412663365, 0.0006173660315711491, 0.0011940893513439684)
2026-07-08 08:30:46,955 - optuna.study.study - INFO - Trial 159 finished with values: [0.0017517347412663365, 0.0006173660315711491, 0.0011940893513439684] and parameters: {'n_layers': 3, 'embedding_dim': 256, 'lr': 0.000222035220678721, 'lambda_val': 3.856436452574138e-05, 'batch_size': 3820, 'optimizer': 'Adam'}.
2026-07-08 08:31:42,973 - experiment_functions - INFO - Early stopping at epoch 550. Best Metrics: (0.0008856158569555345, 0.00034477518378511865, 0.0005750722012818437)
2026-07-08 08:31:43,073 - optuna.study.study - INFO - Trial 160 finished with values: [0.0008856158569555345, 0.00034477518378511865, 0.0005750722012818437] and parameters: {'n_layers': 3, 'embedding_dim': 256, 'lr': 0.0007590336035255057, 'lambda_val': 0.003584385278278044, 'batch_size': 4042, 'optimizer': 'RMSprop'}.
2026-07-08 08:36:33,214 - experiment_functions - INFO - Early stopping at epoch 3850. Best Metrics: (0.0003221370504123047, 7.59835115779876e-05, 0.00019869284722247296)
2026-07-08 08:36:33,600 - optuna.study.study - INFO - Trial 161 finished with values: [0.0003221370504123047, 7.59835115779876e-05, 0.00019869284722247296] and parameters: {'n_layers': 1, 'embedding_dim': 96, 'lr': 0.00011797082228583884, 'lambda_val': 1.8566194585261947e-06, 'batch_size': 1430, 'optimizer': 'RMSprop'}.
2026-07-08 08:37:42,397 - experiment_functions - INFO - Early stopping at epoch 850. Best Metrics: (0.00028419309108017457, 6.743536652546399e-05, 0.0001515202012130019)
2026-07-08 08:37:43,720 - optuna.study.study - INFO - Trial 162 finished with values: [0.00028419309108017457, 6.743536652546399e-05, 0.0001515202012130019] and parameters: {'n_layers': 1, 'embedding_dim': 128, 'lr': 2.7969422224568184e-05, 'lambda_val': 1.3187714692785522e-06, 'batch_size': 1278, 'optimizer': 'RMSprop'}.
2026-07-08 08:39:12,731 - experiment_functions - INFO - Early stopping at epoch 1100. Best Metrics: (0.0033682796109907364, 0.0011967403073533044, 0.002335039421260712)
2026-07-08 08:39:12,826 - optuna.study.study - INFO - Trial 163 finished with values: [0.0033682796109907364, 0.0011967403073533044, 0.002335039421260712] and parameters: {'n_layers': 1, 'embedding_dim': 128, 'lr': 0.0007398611586122253, 'lambda_val': 0.0013552584940860833, 'batch_size': 1930, 'optimizer': 'RMSprop'}.
2026-07-08 08:40:05,720 - experiment_functions - INFO - Early stopping at epoch 650. Best Metrics: (0.0019612489228871322, 0.0006335125277814714, 0.001240975334796087)
2026-07-08 08:40:05,813 - optuna.study.study - INFO - Trial 164 finished with values: [0.0019612489228871322, 0.0006335125277814714, 0.001240975334796087] and parameters: {'n_layers': 2, 'embedding_dim': 64, 'lr': 0.0008107931898913872, 'lambda_val': 0.00045919787742064835, 'batch_size': 2781, 'optimizer': 'RMSprop'}.
2026-07-08 08:40:53,789 - experiment_functions - INFO - Early stopping at epoch 600. Best Metrics: (0.0020082025630697668, 0.0007037972759911099, 0.0013002949952130307)
2026-07-08 08:40:53,881 - optuna.study.study - INFO - Trial 165 finished with values: [0.0020082025630697668, 0.0007037972759911099, 0.0013002949952130307] and parameters: {'n_layers': 2, 'embedding_dim': 32, 'lr': 0.0031808570812741697, 'lambda_val': 0.0002950093253862043, 'batch_size': 3820, 'optimizer': 'Adam'}.
2026-07-08 08:41:45,838 - experiment_functions - INFO - Early stopping at epoch 650. Best Metrics: (0.002798502612387818, 0.0010818152460915981, 0.002016321657080821)
2026-07-08 08:41:45,929 - optuna.study.study - INFO - Trial 166 finished with values: [0.002798502612387818, 0.0010818152460915981, 0.002016321657080821] and parameters: {'n_layers': 1, 'embedding_dim': 64, 'lr': 0.0031808570812741697, 'lambda_val': 0.00044891351853285386, 'batch_size': 3820, 'optimizer': 'Adam'}.
2026-07-08 08:42:27,229 - experiment_functions - INFO - Early stopping at epoch 500. Best Metrics: (0.00021472191534373166, 5.7937427578215534e-05, 0.00011603584226161554)
2026-07-08 08:42:27,319 - optuna.study.study - INFO - Trial 167 finished with values: [0.00021472191534373166, 5.7937427578215534e-05, 0.00011603584226161554] and parameters: {'n_layers': 1, 'embedding_dim': 96, 'lr': 0.0023952146954601223, 'lambda_val': 0.0003864058951599907, 'batch_size': 1616, 'optimizer': 'SGD'}.
2026-07-08 08:43:16,159 - experiment_functions - INFO - Early stopping at epoch 600. Best Metrics: (0.0021381967706105985, 0.0006848013980966129, 0.0014303219436169014)
2026-07-08 08:43:16,249 - optuna.study.study - INFO - Trial 168 finished with values: [0.0021381967706105985, 0.0006848013980966129, 0.0014303219436169014] and parameters: {'n_layers': 2, 'embedding_dim': 64, 'lr': 0.0031808570812741697, 'lambda_val': 4.0474983815594535e-05, 'batch_size': 3416, 'optimizer': 'Adam'}.
2026-07-08 08:44:29,632 - experiment_functions - INFO - Early stopping at epoch 900. Best Metrics: (0.003004503325673038, 0.0011729954599851832, 0.0021553990408042173)
2026-07-08 08:44:30,220 - optuna.study.study - INFO - Trial 169 finished with values: [0.003004503325673038, 0.0011729954599851832, 0.0021553990408042173] and parameters: {'n_layers': 1, 'embedding_dim': 128, 'lr': 0.0011108364748811956, 'lambda_val': 1.684289604060617e-05, 'batch_size': 3456, 'optimizer': 'RMSprop'}.
2026-07-08 08:45:16,688 - experiment_functions - INFO - Early stopping at epoch 550. Best Metrics: (0.0006577914043575211, 0.00023079991641813724, 0.0004373254797623871)
2026-07-08 08:45:16,784 - optuna.study.study - INFO - Trial 170 finished with values: [0.0006577914043575211, 0.00023079991641813724, 0.0004373254797623871] and parameters: {'n_layers': 4, 'embedding_dim': 64, 'lr': 0.002396901451187955, 'lambda_val': 1.8566194585261947e-06, 'batch_size': 1430, 'optimizer': 'RMSprop'}.
2026-07-08 08:46:09,205 - experiment_functions - INFO - Early stopping at epoch 650. Best Metrics: (0.0033546586807428956, 0.0011862925745113311, 0.002322275590398885)
2026-07-08 08:46:09,319 - optuna.study.study - INFO - Trial 171 finished with values: [0.0033546586807428956, 0.0011862925745113311, 0.002322275590398885] and parameters: {'n_layers': 1, 'embedding_dim': 64, 'lr': 0.002396901451187955, 'lambda_val': 1.8566194585261947e-06, 'batch_size': 3820, 'optimizer': 'Adam'}.
2026-07-08 08:51:04,812 - optuna.study.study - INFO - Trial 172 finished with values: [0.0031721529113225197, 0.001156848963774861, 0.002162866793673711] and parameters: {'n_layers': 1, 'embedding_dim': 64, 'lr': 0.000565645409068954, 'lambda_val': 1.783091837418501e-05, 'batch_size': 1930, 'optimizer': 'Adam'}.
2026-07-08 08:51:44,679 - experiment_functions - INFO - Early stopping at epoch 500. Best Metrics: (0.00024275792762199841, 6.55357787360143e-05, 0.0001309981518175425)
2026-07-08 08:51:44,782 - optuna.study.study - INFO - Trial 173 finished with values: [0.00024275792762199841, 6.55357787360143e-05, 0.0001309981518175425] and parameters: {'n_layers': 1, 'embedding_dim': 64, 'lr': 0.0031808570812741697, 'lambda_val': 0.00044891351853285386, 'batch_size': 3820, 'optimizer': 'SGD'}.
2026-07-08 08:52:43,922 - experiment_functions - INFO - Early stopping at epoch 550. Best Metrics: (0.00112567423758961, 0.00036852003115323977, 0.0007335851004589373)
2026-07-08 08:52:44,017 - optuna.study.study - INFO - Trial 174 finished with values: [0.00112567423758961, 0.00036852003115323977, 0.0007335851004589373] and parameters: {'n_layers': 4, 'embedding_dim': 256, 'lr': 0.002396901451187955, 'lambda_val': 1.8566194585261947e-06, 'batch_size': 1430, 'optimizer': 'Adam'}.
2026-07-08 08:53:24,331 - experiment_functions - INFO - Early stopping at epoch 500. Best Metrics: (0.00025189269418423086, 6.838516042018881e-05, 0.00013577710920995278)
2026-07-08 08:53:24,418 - optuna.study.study - INFO - Trial 175 finished with values: [0.00025189269418423086, 6.838516042018881e-05, 0.00013577710920995278] and parameters: {'n_layers': 1, 'embedding_dim': 64, 'lr': 0.0007398611586122253, 'lambda_val': 0.07322850848707306, 'batch_size': 716, 'optimizer': 'Adam'}.
2026-07-08 08:57:33,399 - experiment_functions - INFO - Early stopping at epoch 3150. Best Metrics: (0.002356489840851205, 0.0007911783143057957, 0.0015420952238868954)
2026-07-08 08:57:33,488 - optuna.study.study - INFO - Trial 176 finished with values: [0.002356489840851205, 0.0007911783143057957, 0.0015420952238868954] and parameters: {'n_layers': 3, 'embedding_dim': 96, 'lr': 0.0002900679124230289, 'lambda_val': 1.3187714692785522e-06, 'batch_size': 1278, 'optimizer': 'RMSprop'}.
2026-07-08 09:00:27,715 - experiment_functions - INFO - Early stopping at epoch 2300. Best Metrics: (0.0035238335684181026, 0.0012157361852478013, 0.0024580015447793957)
2026-07-08 09:00:27,812 - optuna.study.study - INFO - Trial 177 finished with values: [0.0035238335684181026, 0.0012157361852478013, 0.0024580015447793957] and parameters: {'n_layers': 1, 'embedding_dim': 64, 'lr': 0.0008107931898913872, 'lambda_val': 1.8566194585261947e-06, 'batch_size': 2781, 'optimizer': 'Adam'}.
2026-07-08 09:01:25,844 - experiment_functions - INFO - Early stopping at epoch 750. Best Metrics: (0.0033729996198143247, 0.0011511502004065118, 0.002410356614336317)
2026-07-08 09:01:25,941 - optuna.study.study - INFO - Trial 178 finished with values: [0.0033729996198143247, 0.0011511502004065118, 0.002410356614336317] and parameters: {'n_layers': 1, 'embedding_dim': 32, 'lr': 0.0031808570812741697, 'lambda_val': 1.9166677808452497e-06, 'batch_size': 1967, 'optimizer': 'Adam'}.
2026-07-08 09:02:17,958 - experiment_functions - INFO - Early stopping at epoch 650. Best Metrics: (0.0031897089911729687, 0.0011539995820906864, 0.002199461791457347)
2026-07-08 09:02:18,089 - optuna.study.study - INFO - Trial 179 finished with values: [0.0031897089911729687, 0.0011539995820906864, 0.002199461791457347] and parameters: {'n_layers': 1, 'embedding_dim': 64, 'lr': 0.0031808570812741697, 'lambda_val': 1.8566194585261947e-06, 'batch_size': 3820, 'optimizer': 'Adam'}.
2026-07-08 09:03:02,981 - experiment_functions - INFO - Early stopping at epoch 550. Best Metrics: (0.0015096076840288367, 0.0006230647949394982, 0.0011124051291366193)
2026-07-08 09:03:03,087 - optuna.study.study - INFO - Trial 180 finished with values: [0.0015096076840288367, 0.0006230647949394982, 0.0011124051291366193] and parameters: {'n_layers': 1, 'embedding_dim': 64, 'lr': 0.02592538525808625, 'lambda_val': 1.8566194585261947e-06, 'batch_size': 1585, 'optimizer': 'Adam'}.
2026-07-08 09:03:52,856 - experiment_functions - INFO - Early stopping at epoch 600. Best Metrics: (0.0024162994030282447, 0.0008681116197785081, 0.0015991651684058121)
2026-07-08 09:03:53,318 - optuna.study.study - INFO - Trial 181 finished with values: [0.0024162994030282447, 0.0008681116197785081, 0.0015991651684058121] and parameters: {'n_layers': 2, 'embedding_dim': 64, 'lr': 0.0031808570812741697, 'lambda_val': 0.00044891351853285386, 'batch_size': 3820, 'optimizer': 'Adam'}.
2026-07-08 09:04:45,646 - experiment_functions - INFO - Early stopping at epoch 650. Best Metrics: (0.0029961423633684003, 0.0010523716353551277, 0.002055311029799158)
2026-07-08 09:04:45,738 - optuna.study.study - INFO - Trial 182 finished with values: [0.0029961423633684003, 0.0010523716353551277, 0.002055311029799158] and parameters: {'n_layers': 1, 'embedding_dim': 64, 'lr': 0.002396901451187955, 'lambda_val': 0.00044891351853285386, 'batch_size': 3449, 'optimizer': 'Adam'}.
2026-07-08 09:05:41,430 - experiment_functions - INFO - Early stopping at epoch 700. Best Metrics: (0.003446562458654652, 0.0012271337119844992, 0.002345021348971341)
2026-07-08 09:05:41,529 - optuna.study.study - INFO - Trial 183 finished with values: [0.003446562458654652, 0.0012271337119844992, 0.002345021348971341] and parameters: {'n_layers': 1, 'embedding_dim': 64, 'lr': 0.0031808570812741697, 'lambda_val': 1.8566194585261947e-06, 'batch_size': 1430, 'optimizer': 'Adam'}.
2026-07-08 09:06:33,268 - experiment_functions - INFO - Early stopping at epoch 600. Best Metrics: (0.0011688652885620706, 0.0003865661151530118, 0.0007336669461594946)
2026-07-08 09:06:33,358 - optuna.study.study - INFO - Trial 184 finished with values: [0.0011688652885620706, 0.0003865661151530118, 0.0007336669461594946] and parameters: {'n_layers': 3, 'embedding_dim': 96, 'lr': 0.002396901451187955, 'lambda_val': 4.0474983815594535e-05, 'batch_size': 1430, 'optimizer': 'Adam'}.
2026-07-08 09:07:58,120 - experiment_functions - INFO - Early stopping at epoch 1100. Best Metrics: (0.003030988389326397, 0.0010523716353551282, 0.0021101824243700117)
2026-07-08 09:07:58,213 - optuna.study.study - INFO - Trial 185 finished with values: [0.003030988389326397, 0.0010523716353551282, 0.0021101824243700117] and parameters: {'n_layers': 1, 'embedding_dim': 64, 'lr': 0.0008107931898913872, 'lambda_val': 1.783091837418501e-05, 'batch_size': 3820, 'optimizer': 'Adam'}.
2026-07-08 09:08:46,713 - experiment_functions - INFO - Early stopping at epoch 600. Best Metrics: (0.0029836632126571507, 0.001034325551355356, 0.0020380868521646766)
2026-07-08 09:08:46,838 - optuna.study.study - INFO - Trial 186 finished with values: [0.0029836632126571507, 0.001034325551355356, 0.0020380868521646766] and parameters: {'n_layers': 1, 'embedding_dim': 64, 'lr': 0.0031808570812741697, 'lambda_val': 0.00044891351853285386, 'batch_size': 3820, 'optimizer': 'Adam'}.
2026-07-08 09:09:28,542 - experiment_functions - INFO - Early stopping at epoch 500. Best Metrics: (0.000183778386589848, 5.128887031514162e-05, 0.00010616985336045167)
2026-07-08 09:09:28,660 - optuna.study.study - INFO - Trial 187 finished with values: [0.000183778386589848, 5.128887031514162e-05, 0.00010616985336045167] and parameters: {'n_layers': 3, 'embedding_dim': 64, 'lr': 0.0031808570812741697, 'lambda_val': 0.00045919787742064835, 'batch_size': 1478, 'optimizer': 'SGD'}.
2026-07-08 09:10:09,454 - experiment_functions - INFO - Early stopping at epoch 500. Best Metrics: (0.00028366986877533565, 6.268639705183976e-05, 0.0001684283584255104)
2026-07-08 09:10:10,261 - optuna.study.study - INFO - Trial 188 finished with values: [0.00028366986877533565, 6.268639705183976e-05, 0.0001684283584255104] and parameters: {'n_layers': 1, 'embedding_dim': 64, 'lr': 0.005183122195502878, 'lambda_val': 0.0002947495461502324, 'batch_size': 3809, 'optimizer': 'SGD'}.
2026-07-08 09:12:25,671 - experiment_functions - INFO - Early stopping at epoch 1600. Best Metrics: (0.001954564159968393, 0.0007256425355697814, 0.0012972956637740552)
2026-07-08 09:12:25,773 - optuna.study.study - INFO - Trial 189 finished with values: [0.001954564159968393, 0.0007256425355697814, 0.0012972956637740552] and parameters: {'n_layers': 3, 'embedding_dim': 128, 'lr': 0.00029101415218507826, 'lambda_val': 4.0474983815594535e-05, 'batch_size': 2367, 'optimizer': 'Adam'}.
2026-07-08 09:17:16,136 - optuna.study.study - INFO - Trial 190 finished with values: [0.0036800549083027784, 0.001095112360617746, 0.0023770244062791246] and parameters: {'n_layers': 1, 'embedding_dim': 32, 'lr': 0.0004683675544444161, 'lambda_val': 1.8566194585261947e-06, 'batch_size': 1430, 'optimizer': 'RMSprop'}.
2026-07-08 09:22:22,746 - optuna.study.study - INFO - Trial 191 finished with values: [0.002443519251148109, 0.0007959272837794199, 0.001531834527370295] and parameters: {'n_layers': 3, 'embedding_dim': 64, 'lr': 0.0002900679124230289, 'lambda_val': 1.3187714692785522e-06, 'batch_size': 1278, 'optimizer': 'RMSprop'}.
2026-07-08 09:23:17,959 - experiment_functions - INFO - Early stopping at epoch 600. Best Metrics: (0.003463505515622479, 0.0013059666052466614, 0.0025221859849307855)
2026-07-08 09:23:18,069 - optuna.study.study - INFO - Trial 192 finished with values: [0.003463505515622479, 0.0013059666052466614, 0.0025221859849307855] and parameters: {'n_layers': 1, 'embedding_dim': 256, 'lr': 0.0031808570812741697, 'lambda_val': 0.00045919787742064835, 'batch_size': 3820, 'optimizer': 'Adam'}.
2026-07-08 09:24:09,375 - experiment_functions - INFO - Early stopping at epoch 650. Best Metrics: (0.003492048316625998, 0.0011312045286172904, 0.002359876650683685)
2026-07-08 09:24:09,472 - optuna.study.study - INFO - Trial 193 finished with values: [0.003492048316625998, 0.0011312045286172904, 0.002359876650683685] and parameters: {'n_layers': 1, 'embedding_dim': 32, 'lr': 0.0031808570812741697, 'lambda_val': 1.8566194585261947e-06, 'batch_size': 3820, 'optimizer': 'Adam'}.
2026-07-08 09:24:57,773 - experiment_functions - INFO - Early stopping at epoch 600. Best Metrics: (0.002180107265162043, 0.0007398894439906541, 0.0014503095670704881)
2026-07-08 09:24:57,871 - optuna.study.study - INFO - Trial 194 finished with values: [0.002180107265162043, 0.0007398894439906541, 0.0014503095670704881] and parameters: {'n_layers': 2, 'embedding_dim': 32, 'lr': 0.003449853559180679, 'lambda_val': 1.4993956067328433e-06, 'batch_size': 3102, 'optimizer': 'Adam'}.
2026-07-08 09:29:48,327 - experiment_functions - INFO - Early stopping at epoch 3850. Best Metrics: (0.0006849651768605345, 0.00046065003894154975, 0.0006722940407954725)
2026-07-08 09:29:48,437 - optuna.study.study - INFO - Trial 195 finished with values: [0.0006849651768605345, 0.00046065003894154975, 0.0006722940407954725] and parameters: {'n_layers': 2, 'embedding_dim': 64, 'lr': 0.019666467616960885, 'lambda_val': 1.4993956067328433e-06, 'batch_size': 1436, 'optimizer': 'Adam'}.
2026-07-08 09:34:56,380 - optuna.study.study - INFO - Trial 196 finished with values: [0.002931182058683875, 0.0009915848260927378, 0.0020133280217938276] and parameters: {'n_layers': 1, 'embedding_dim': 128, 'lr': 0.000222035220678721, 'lambda_val': 5.9395571423324406e-05, 'batch_size': 3456, 'optimizer': 'RMSprop'}.
2026-07-08 09:36:48,838 - experiment_functions - INFO - Early stopping at epoch 1500. Best Metrics: (0.002563981100524159, 0.0007778811997796479, 0.0016953778509572344)
2026-07-08 09:36:48,989 - optuna.study.study - INFO - Trial 197 finished with values: [0.002563981100524159, 0.0007778811997796479, 0.0016953778509572344] and parameters: {'n_layers': 2, 'embedding_dim': 32, 'lr': 0.0005611421163304754, 'lambda_val': 1.4993956067328433e-06, 'batch_size': 3102, 'optimizer': 'RMSprop'}.
2026-07-08 09:37:51,445 - experiment_functions - INFO - Early stopping at epoch 800. Best Metrics: (0.00211023660380797, 0.0008405675968314875, 0.0014948895127153703)
2026-07-08 09:37:51,563 - optuna.study.study - INFO - Trial 198 finished with values: [0.00211023660380797, 0.0008405675968314875, 0.0014948895127153703] and parameters: {'n_layers': 1, 'embedding_dim': 64, 'lr': 0.0031808570812741697, 'lambda_val': 2.222217583476914e-06, 'batch_size': 1930, 'optimizer': 'RMSprop'}.
2026-07-08 09:38:45,042 - experiment_functions - INFO - Early stopping at epoch 650. Best Metrics: (0.0034137381155462387, 0.0012527781471420702, 0.002443131388851551)
2026-07-08 09:38:45,142 - optuna.study.study - INFO - Trial 199 finished with values: [0.0034137381155462387, 0.0012527781471420702, 0.002443131388851551] and parameters: {'n_layers': 1, 'embedding_dim': 96, 'lr': 0.0031808570812741697, 'lambda_val': 0.0002947495461502324, 'batch_size': 3809, 'optimizer': 'Adam'}.
2026-07-08 09:39:45,479 - experiment_functions - INFO - Early stopping at epoch 750. Best Metrics: (0.0032110835808355875, 0.0011217065896700416, 0.0022902064216047636)
2026-07-08 09:39:45,596 - optuna.study.study - INFO - Trial 200 finished with values: [0.0032110835808355875, 0.0011217065896700416, 0.0022902064216047636] and parameters: {'n_layers': 1, 'embedding_dim': 64, 'lr': 0.0031808570812741697, 'lambda_val': 1.8566194585261947e-06, 'batch_size': 1430, 'optimizer': 'Adam'}.
2026-07-08 09:40:38,300 - experiment_functions - INFO - Early stopping at epoch 650. Best Metrics: (0.0033387545607289483, 0.0011891419561955057, 0.0023625023471427224)
2026-07-08 09:40:38,403 - optuna.study.study - INFO - Trial 201 finished with values: [0.0033387545607289483, 0.0011891419561955057, 0.0023625023471427224] and parameters: {'n_layers': 1, 'embedding_dim': 64, 'lr': 0.0031808570812741697, 'lambda_val': 1.783091837418501e-05, 'batch_size': 3222, 'optimizer': 'Adam'}.
2026-07-08 09:41:33,238 - experiment_functions - INFO - Early stopping at epoch 650. Best Metrics: (0.0030561421417808895, 0.0012651254677734933, 0.0022818423316253496)
2026-07-08 09:41:33,855 - optuna.study.study - INFO - Trial 202 finished with values: [0.0030561421417808895, 0.0012651254677734933, 0.0022818423316253496] and parameters: {'n_layers': 1, 'embedding_dim': 128, 'lr': 0.0031808570812741697, 'lambda_val': 1.8566194585261947e-06, 'batch_size': 3820, 'optimizer': 'Adam'}.
2026-07-08 09:42:25,208 - experiment_functions - INFO - Early stopping at epoch 600. Best Metrics: (0.000819683306904677, 0.00027733981725965473, 0.0005295379762787577)
2026-07-08 09:42:25,319 - optuna.study.study - INFO - Trial 203 finished with values: [0.000819683306904677, 0.00027733981725965473, 0.0005295379762787577] and parameters: {'n_layers': 4, 'embedding_dim': 64, 'lr': 0.0013601909806526136, 'lambda_val': 0.0019286790831675056, 'batch_size': 3820, 'optimizer': 'Adam'}.
2026-07-08 09:43:25,478 - experiment_functions - INFO - Early stopping at epoch 700. Best Metrics: (0.0022154024952081046, 0.0008405675968314875, 0.0015141244322569064)
