2026-07-05 16:56:34,432 - optuna.study.study - INFO - Trial 31 finished with values: [0.010124770726458707, 0.002307049370286648, 0.005825875723956456] and parameters: {'n_layers': 2, 'embedding_dim': 64, 'lr': 0.006236516613152459, 'lambda_val': 0.0017059305455562248, 'batch_size': 1458, 'optimizer': 'Adam'}.
2026-07-05 16:57:33,328 - experiment_functions - INFO - Early stopping at epoch 500. Best Metrics: (0.0001712898933160479, 4.653990084151739e-05, 9.908975392271103e-05)
2026-07-05 16:57:33,415 - optuna.study.study - INFO - Trial 32 finished with values: [0.0001712898933160479, 4.653990084151739e-05, 9.908975392271103e-05] and parameters: {'n_layers': 3, 'embedding_dim': 256, 'lr': 1.0824577407330065e-05, 'lambda_val': 0.009360354139089696, 'batch_size': 1993, 'optimizer': 'SGD'}.
2026-07-05 16:58:18,545 - experiment_functions - INFO - Early stopping at epoch 550. Best Metrics: (0.0027521910383107896, 0.0007873791387268963, 0.0017701542928008128)
2026-07-05 16:58:18,631 - optuna.study.study - INFO - Trial 33 finished with values: [0.0027521910383107896, 0.0007873791387268963, 0.0017701542928008128] and parameters: {'n_layers': 1, 'embedding_dim': 32, 'lr': 0.05238625036386789, 'lambda_val': 0.0013813939605119977, 'batch_size': 1102, 'optimizer': 'Adam'}.
2026-07-05 17:04:13,831 - optuna.study.study - INFO - Trial 34 finished with values: [0.011605074772682376, 0.002732557035123378, 0.006699818221372492] and parameters: {'n_layers': 3, 'embedding_dim': 96, 'lr': 0.00622194471935376, 'lambda_val': 0.0008455954335710432, 'batch_size': 1692, 'optimizer': 'RMSprop'}.
2026-07-05 17:05:04,507 - experiment_functions - INFO - Early stopping at epoch 600. Best Metrics: (0.00029085443488389653, 5.8887221472940384e-05, 0.00016571421789520786)
2026-07-05 17:05:04,592 - optuna.study.study - INFO - Trial 35 finished with values: [0.00029085443488389653, 5.8887221472940384e-05, 0.00016571421789520786] and parameters: {'n_layers': 1, 'embedding_dim': 96, 'lr': 0.05904329143419785, 'lambda_val': 7.168086117382093e-05, 'batch_size': 2061, 'optimizer': 'SGD'}.
2026-07-05 17:06:33,994 - experiment_functions - INFO - Early stopping at epoch 1100. Best Metrics: (0.00024690252453294796, 5.888722147294038e-05, 0.0001333839995614785)
2026-07-05 17:06:34,125 - optuna.study.study - INFO - Trial 36 finished with values: [0.00024690252453294796, 5.888722147294038e-05, 0.0001333839995614785] and parameters: {'n_layers': 4, 'embedding_dim': 32, 'lr': 4.463254283229942e-05, 'lambda_val': 0.0002836463264671757, 'batch_size': 1658, 'optimizer': 'RMSprop'}.
2026-07-05 17:07:19,374 - experiment_functions - INFO - Early stopping at epoch 500. Best Metrics: (0.0002457656044256106, 6.17366031571149e-05, 0.00012710157874168458)
2026-07-05 17:07:19,453 - optuna.study.study - INFO - Trial 37 finished with values: [0.0002457656044256106, 6.17366031571149e-05, 0.00012710157874168458] and parameters: {'n_layers': 2, 'embedding_dim': 96, 'lr': 0.0001259161727533467, 'lambda_val': 0.0018102440350191405, 'batch_size': 3710, 'optimizer': 'SGD'}.
2026-07-05 17:08:18,638 - experiment_functions - INFO - Early stopping at epoch 600. Best Metrics: (0.006556534905472126, 0.0016583401401895788, 0.004040306572074826)
2026-07-05 17:08:19,125 - optuna.study.study - INFO - Trial 38 finished with values: [0.006556534905472126, 0.0016583401401895788, 0.004040306572074826] and parameters: {'n_layers': 1, 'embedding_dim': 256, 'lr': 0.027822239419745227, 'lambda_val': 1.1875193284309632e-06, 'batch_size': 2903, 'optimizer': 'Adam'}.
2026-07-05 17:09:05,419 - experiment_functions - INFO - Early stopping at epoch 500. Best Metrics: (0.00021950437246194522, 5.7937427578215534e-05, 0.00011499696790848659)
2026-07-05 17:09:05,514 - optuna.study.study - INFO - Trial 39 finished with values: [0.00021950437246194522, 5.7937427578215534e-05, 0.00011499696790848659] and parameters: {'n_layers': 4, 'embedding_dim': 64, 'lr': 6.691729833054821e-05, 'lambda_val': 0.0021707055686299662, 'batch_size': 2418, 'optimizer': 'SGD'}.
2026-07-05 17:15:40,097 - optuna.study.study - INFO - Trial 40 finished with values: [0.011826268386798637, 0.002881674676595179, 0.006966826132591703] and parameters: {'n_layers': 4, 'embedding_dim': 128, 'lr': 0.00030085296551505755, 'lambda_val': 1.059674657990583e-05, 'batch_size': 3892, 'optimizer': 'RMSprop'}.
2026-07-05 17:16:22,056 - experiment_functions - INFO - Early stopping at epoch 500. Best Metrics: (0.00016369010053955438, 4.843948863096708e-05, 0.00011265612980318891)
2026-07-05 17:16:22,173 - optuna.study.study - INFO - Trial 41 finished with values: [0.00016369010053955438, 4.843948863096708e-05, 0.00011265612980318891] and parameters: {'n_layers': 1, 'embedding_dim': 64, 'lr': 0.0025629165930267633, 'lambda_val': 5.6616034141916265e-05, 'batch_size': 2942, 'optimizer': 'SGD'}.
2026-07-05 17:22:15,037 - optuna.study.study - INFO - Trial 42 finished with values: [0.009563226508141346, 0.00247991185912657, 0.005860953195121461] and parameters: {'n_layers': 3, 'embedding_dim': 96, 'lr': 0.0005396027445916047, 'lambda_val': 0.005013303766522477, 'batch_size': 1906, 'optimizer': 'Adam'}.
2026-07-05 17:23:03,406 - experiment_functions - INFO - Early stopping at epoch 500. Best Metrics: (0.00022920349069808786, 6.458598484128944e-05, 0.00012760192813388206)
2026-07-05 17:23:03,571 - optuna.study.study - INFO - Trial 43 finished with values: [0.00022920349069808786, 6.458598484128944e-05, 0.00012760192813388206] and parameters: {'n_layers': 1, 'embedding_dim': 256, 'lr': 0.03904938033542978, 'lambda_val': 7.212570658280532e-05, 'batch_size': 1929, 'optimizer': 'SGD'}.
2026-07-05 17:24:05,121 - experiment_functions - INFO - Early stopping at epoch 750. Best Metrics: (0.0002038404449599395, 5.8887221472940384e-05, 0.00012331032470240595)
2026-07-05 17:24:05,201 - optuna.study.study - INFO - Trial 44 finished with values: [0.0002038404449599395, 5.8887221472940384e-05, 0.00012331032470240595] and parameters: {'n_layers': 3, 'embedding_dim': 32, 'lr': 1.1577488284627798e-05, 'lambda_val': 1.4745289700620854e-05, 'batch_size': 2057, 'optimizer': 'RMSprop'}.
2026-07-05 17:24:47,099 - experiment_functions - INFO - Early stopping at epoch 500. Best Metrics: (0.0002020846793199071, 5.7937427578215534e-05, 0.00012817040834824025)
2026-07-05 17:24:47,186 - optuna.study.study - INFO - Trial 45 finished with values: [0.0002020846793199071, 5.7937427578215534e-05, 0.00012817040834824025] and parameters: {'n_layers': 2, 'embedding_dim': 32, 'lr': 0.00841343884415209, 'lambda_val': 0.00023852566138575734, 'batch_size': 2901, 'optimizer': 'SGD'}.
2026-07-05 17:25:52,363 - experiment_functions - INFO - Early stopping at epoch 500. Best Metrics: (0.00019321222511021384, 4.748969473624224e-05, 0.00010534221755420968)
2026-07-05 17:25:52,468 - optuna.study.study - INFO - Trial 46 finished with values: [0.00019321222511021384, 4.748969473624224e-05, 0.00010534221755420968] and parameters: {'n_layers': 4, 'embedding_dim': 256, 'lr': 3.623094781799258e-05, 'lambda_val': 0.009038493185820347, 'batch_size': 3063, 'optimizer': 'RMSprop'}.
2026-07-05 17:26:34,704 - experiment_functions - INFO - Early stopping at epoch 500. Best Metrics: (0.00022429585319342108, 6.743536652546399e-05, 0.00015637481331895768)
2026-07-05 17:26:34,796 - optuna.study.study - INFO - Trial 47 finished with values: [0.00022429585319342108, 6.743536652546399e-05, 0.00015637481331895768] and parameters: {'n_layers': 3, 'embedding_dim': 32, 'lr': 0.0015662544273340173, 'lambda_val': 0.03963263115435443, 'batch_size': 3988, 'optimizer': 'SGD'}.
2026-07-05 17:27:21,128 - experiment_functions - INFO - Early stopping at epoch 550. Best Metrics: (0.0026386407121191764, 0.0008225215128317156, 0.0017940780852359417)
2026-07-05 17:27:21,271 - optuna.study.study - INFO - Trial 48 finished with values: [0.0026386407121191764, 0.0008225215128317156, 0.0017940780852359417] and parameters: {'n_layers': 3, 'embedding_dim': 32, 'lr': 0.008002638743453066, 'lambda_val': 0.026080793635433332, 'batch_size': 915, 'optimizer': 'Adam'}.
2026-07-05 17:32:39,137 - optuna.study.study - INFO - Trial 49 finished with values: [0.006814907109583629, 0.0016421936439792565, 0.004084456737947229] and parameters: {'n_layers': 4, 'embedding_dim': 32, 'lr': 0.00031301183442768784, 'lambda_val': 4.859553849541615e-06, 'batch_size': 1132, 'optimizer': 'RMSprop'}.
2026-07-05 17:38:51,906 - optuna.study.study - INFO - Trial 50 finished with values: [0.01488745269835456, 0.003339475333852554, 0.008956161111576771] and parameters: {'n_layers': 4, 'embedding_dim': 96, 'lr': 0.004643736874356213, 'lambda_val': 1.3028958114301324e-06, 'batch_size': 1749, 'optimizer': 'RMSprop'}.
2026-07-05 17:45:00,750 - optuna.study.study - INFO - Trial 51 finished with values: [0.015466988560952978, 0.003786828258267956, 0.009688008669808167] and parameters: {'n_layers': 1, 'embedding_dim': 256, 'lr': 0.0008914583956121026, 'lambda_val': 0.002062935328163689, 'batch_size': 2079, 'optimizer': 'RMSprop'}.
2026-07-05 17:45:42,640 - experiment_functions - INFO - Early stopping at epoch 500. Best Metrics: (0.00016385204387089542, 4.274072526261802e-05, 7.95731104357809e-05)
2026-07-05 17:45:42,724 - optuna.study.study - INFO - Trial 52 finished with values: [0.00016385204387089542, 4.274072526261802e-05, 7.95731104357809e-05] and parameters: {'n_layers': 2, 'embedding_dim': 32, 'lr': 0.00031301183442768784, 'lambda_val': 0.013847709065002064, 'batch_size': 1434, 'optimizer': 'RMSprop'}.
2026-07-05 17:50:42,813 - experiment_functions - INFO - Early stopping at epoch 3050. Best Metrics: (0.005222161135221378, 0.0012442300020895467, 0.003015886632959645)
2026-07-05 17:50:43,175 - optuna.study.study - INFO - Trial 53 finished with values: [0.005222161135221378, 0.0012442300020895467, 0.003015886632959645] and parameters: {'n_layers': 4, 'embedding_dim': 128, 'lr': 0.0009003456059922558, 'lambda_val': 0.014786673306865639, 'batch_size': 3397, 'optimizer': 'RMSprop'}.
2026-07-05 17:54:25,721 - experiment_functions - INFO - Early stopping at epoch 2400. Best Metrics: (0.006964361830067873, 0.0016336454989267328, 0.0040575963781992515)
2026-07-05 17:54:25,811 - optuna.study.study - INFO - Trial 54 finished with values: [0.006964361830067873, 0.0016336454989267328, 0.0040575963781992515] and parameters: {'n_layers': 4, 'embedding_dim': 96, 'lr': 0.0033823653385842145, 'lambda_val': 0.002906975496505062, 'batch_size': 2615, 'optimizer': 'Adam'}.
2026-07-05 18:00:10,297 - experiment_functions - INFO - Early stopping at epoch 2800. Best Metrics: (0.002322062992246885, 0.0007142450088330832, 0.0014007495521026244)
2026-07-05 18:00:10,395 - optuna.study.study - INFO - Trial 55 finished with values: [0.002322062992246885, 0.0007142450088330832, 0.0014007495521026244] and parameters: {'n_layers': 4, 'embedding_dim': 256, 'lr': 0.0003147219827396413, 'lambda_val': 0.041881312163002817, 'batch_size': 3397, 'optimizer': 'RMSprop'}.
2026-07-05 18:03:29,854 - experiment_functions - INFO - Early stopping at epoch 2150. Best Metrics: (0.007983480023641142, 0.0018226544839769771, 0.004527488113985366)
2026-07-05 18:03:30,001 - optuna.study.study - INFO - Trial 56 finished with values: [0.007983480023641142, 0.0018226544839769771, 0.004527488113985366] and parameters: {'n_layers': 4, 'embedding_dim': 96, 'lr': 0.002260615499918563, 'lambda_val': 0.002906975496505062, 'batch_size': 2615, 'optimizer': 'Adam'}.
2026-07-05 18:08:10,792 - experiment_functions - INFO - Early stopping at epoch 3300. Best Metrics: (0.0140478278764798, 0.0031115247991185917, 0.008086128774904782)
2026-07-05 18:08:10,881 - optuna.study.study - INFO - Trial 57 finished with values: [0.0140478278764798, 0.0031115247991185917, 0.008086128774904782] and parameters: {'n_layers': 2, 'embedding_dim': 96, 'lr': 0.006236516613152459, 'lambda_val': 0.0002603817889184556, 'batch_size': 3276, 'optimizer': 'Adam'}.
2026-07-05 18:09:23,047 - experiment_functions - INFO - Early stopping at epoch 900. Best Metrics: (0.007928756236287375, 0.0017960602549246816, 0.004510008447218051)
2026-07-05 18:09:23,157 - optuna.study.study - INFO - Trial 58 finished with values: [0.007928756236287375, 0.0017960602549246816, 0.004510008447218051] and parameters: {'n_layers': 2, 'embedding_dim': 32, 'lr': 0.00841343884415209, 'lambda_val': 0.002906975496505062, 'batch_size': 2901, 'optimizer': 'Adam'}.
2026-07-05 18:14:18,699 - experiment_functions - INFO - Early stopping at epoch 3550. Best Metrics: (0.015528470808084354, 0.0035721748380601413, 0.009151683249278345)
2026-07-05 18:14:18,787 - optuna.study.study - INFO - Trial 59 finished with values: [0.015528470808084354, 0.0035721748380601413, 0.009151683249278345] and parameters: {'n_layers': 1, 'embedding_dim': 128, 'lr': 0.0020004569205185102, 'lambda_val': 0.011720789781497609, 'batch_size': 2482, 'optimizer': 'RMSprop'}.
2026-07-05 18:15:05,696 - experiment_functions - INFO - Early stopping at epoch 500. Best Metrics: (0.00030286392569946625, 7.028474820963853e-05, 0.00015977954867849023)
2026-07-05 18:15:05,786 - optuna.study.study - INFO - Trial 60 finished with values: [0.00030286392569946625, 7.028474820963853e-05, 0.00015977954867849023] and parameters: {'n_layers': 3, 'embedding_dim': 96, 'lr': 0.008379149262555622, 'lambda_val': 0.003764047770043437, 'batch_size': 1434, 'optimizer': 'SGD'}.
2026-07-05 18:22:40,172 - optuna.study.study - INFO - Trial 61 finished with values: [0.005190272578443447, 0.0012499287654578956, 0.002969984521517327] and parameters: {'n_layers': 3, 'embedding_dim': 256, 'lr': 0.0008914583956121026, 'lambda_val': 0.032519438616119015, 'batch_size': 3299, 'optimizer': 'Adam'}.
2026-07-05 18:23:23,443 - experiment_functions - INFO - Early stopping at epoch 500. Best Metrics: (0.00021125076513374465, 5.888722147294036e-05, 0.00011780393947808936)
2026-07-05 18:23:23,584 - optuna.study.study - INFO - Trial 62 finished with values: [0.00021125076513374465, 5.888722147294036e-05, 0.00011780393947808936] and parameters: {'n_layers': 4, 'embedding_dim': 32, 'lr': 0.004001812495099144, 'lambda_val': 0.0002836463264671757, 'batch_size': 1120, 'optimizer': 'SGD'}.
2026-07-05 18:24:06,736 - experiment_functions - INFO - Early stopping at epoch 500. Best Metrics: (0.00021864650996604023, 6.648557263073914e-05, 0.00013487018660061388)
2026-07-05 18:24:06,830 - optuna.study.study - INFO - Trial 63 finished with values: [0.00021864650996604023, 6.648557263073914e-05, 0.00013487018660061388] and parameters: {'n_layers': 1, 'embedding_dim': 96, 'lr': 9.466322549119509e-05, 'lambda_val': 0.03718133598255181, 'batch_size': 1922, 'optimizer': 'Adam'}.
2026-07-05 18:24:58,974 - experiment_functions - INFO - Early stopping at epoch 550. Best Metrics: (0.005029855522364661, 0.0012432802081948214, 0.0029641373634807637)
2026-07-05 18:24:59,053 - optuna.study.study - INFO - Trial 64 finished with values: [0.005029855522364661, 0.0012432802081948214, 0.0029641373634807637] and parameters: {'n_layers': 3, 'embedding_dim': 96, 'lr': 0.00580142466972445, 'lambda_val': 0.009008883638359447, 'batch_size': 2404, 'optimizer': 'RMSprop'}.
2026-07-05 18:30:18,767 - optuna.study.study - INFO - Trial 65 finished with values: [0.008501828099786, 0.0021142412096575042, 0.004982684460825522] and parameters: {'n_layers': 4, 'embedding_dim': 32, 'lr': 0.00031301183442768784, 'lambda_val': 1.059674657990583e-05, 'batch_size': 3892, 'optimizer': 'RMSprop'}.
2026-07-05 18:35:05,103 - experiment_functions - INFO - Early stopping at epoch 2300. Best Metrics: (0.00023214948854205492, 6.458598484128944e-05, 0.0001538849327975825)
2026-07-05 18:35:05,185 - optuna.study.study - INFO - Trial 66 finished with values: [0.00023214948854205492, 6.458598484128944e-05, 0.0001538849327975825] and parameters: {'n_layers': 4, 'embedding_dim': 256, 'lr': 3.142252320316741e-05, 'lambda_val': 1.1875193284309632e-06, 'batch_size': 2594, 'optimizer': 'Adam'}.
2026-07-05 18:35:49,020 - experiment_functions - INFO - Early stopping at epoch 500. Best Metrics: (0.0002156160977563002, 5.318845810459131e-05, 0.0001226902496248403)
2026-07-05 18:35:49,116 - optuna.study.study - INFO - Trial 67 finished with values: [0.0002156160977563002, 5.318845810459131e-05, 0.0001226902496248403] and parameters: {'n_layers': 1, 'embedding_dim': 128, 'lr': 0.0001969537403189991, 'lambda_val': 3.739024363742545e-05, 'batch_size': 906, 'optimizer': 'SGD'}.
2026-07-05 18:40:18,347 - experiment_functions - INFO - Early stopping at epoch 3450. Best Metrics: (0.009571765367659437, 0.002270007408392379, 0.0055781657895850505)
2026-07-05 18:40:18,434 - optuna.study.study - INFO - Trial 68 finished with values: [0.009571765367659437, 0.002270007408392379, 0.0055781657895850505] and parameters: {'n_layers': 3, 'embedding_dim': 32, 'lr': 0.00622194471935376, 'lambda_val': 0.0008455954335710432, 'batch_size': 1692, 'optimizer': 'RMSprop'}.
2026-07-05 18:41:01,012 - experiment_functions - INFO - Early stopping at epoch 500. Best Metrics: (0.00016223946078445947, 5.31884581045913e-05, 0.00010043720450649055)
2026-07-05 18:41:01,099 - optuna.study.study - INFO - Trial 69 finished with values: [0.00016223946078445947, 5.31884581045913e-05, 0.00010043720450649055] and parameters: {'n_layers': 4, 'embedding_dim': 32, 'lr': 3.142252320316741e-05, 'lambda_val': 0.03145939883663255, 'batch_size': 2461, 'optimizer': 'Adam'}.
2026-07-05 18:47:07,816 - optuna.study.study - INFO - Trial 70 finished with values: [0.008416443015286757, 0.00211139182797333, 0.0049825975623550255] and parameters: {'n_layers': 4, 'embedding_dim': 96, 'lr': 0.00024019407802996546, 'lambda_val': 2.6612699284810097e-06, 'batch_size': 3115, 'optimizer': 'RMSprop'}.
2026-07-05 18:48:01,615 - experiment_functions - INFO - Early stopping at epoch 550. Best Metrics: (0.0021441170505656386, 0.0005584788100982087, 0.00140002885530552)
2026-07-05 18:48:01,700 - optuna.study.study - INFO - Trial 71 finished with values: [0.0021441170505656386, 0.0005584788100982087, 0.00140002885530552] and parameters: {'n_layers': 1, 'embedding_dim': 256, 'lr': 0.05904329143419785, 'lambda_val': 3.28947879719355e-05, 'batch_size': 1749, 'optimizer': 'RMSprop'}.
2026-07-05 18:52:44,391 - experiment_functions - INFO - Early stopping at epoch 3600. Best Metrics: (0.004949088619670151, 0.0013145147502991851, 0.0029063461495871384)
2026-07-05 18:52:44,514 - optuna.study.study - INFO - Trial 72 finished with values: [0.004949088619670151, 0.0013145147502991851, 0.0029063461495871384] and parameters: {'n_layers': 3, 'embedding_dim': 32, 'lr': 0.009228822744585308, 'lambda_val': 0.011720789781497609, 'batch_size': 3299, 'optimizer': 'Adam'}.
2026-07-05 18:58:29,808 - experiment_functions - INFO - Early stopping at epoch 2750. Best Metrics: (0.011180827899985708, 0.0025406986683889597, 0.006364863211297237)
2026-07-05 18:58:30,135 - optuna.study.study - INFO - Trial 73 finished with values: [0.011180827899985708, 0.0025406986683889597, 0.006364863211297237] and parameters: {'n_layers': 4, 'embedding_dim': 256, 'lr': 0.0006743657717693198, 'lambda_val': 0.005013303766522477, 'batch_size': 3787, 'optimizer': 'Adam'}.
2026-07-05 19:01:03,913 - experiment_functions - INFO - Early stopping at epoch 1850. Best Metrics: (0.0002574830153172972, 6.55357787360143e-05, 0.00013676587731126162)
2026-07-05 19:01:03,994 - optuna.study.study - INFO - Trial 74 finished with values: [0.0002574830153172972, 6.55357787360143e-05, 0.00013676587731126162] and parameters: {'n_layers': 1, 'embedding_dim': 128, 'lr': 4.997910299733336e-05, 'lambda_val': 1.059674657990583e-05, 'batch_size': 2461, 'optimizer': 'Adam'}.
2026-07-05 19:01:48,332 - experiment_functions - INFO - Early stopping at epoch 500. Best Metrics: (0.00026527818136126246, 7.21843359990882e-05, 0.00016498910577492163)
2026-07-05 19:01:48,698 - optuna.study.study - INFO - Trial 75 finished with values: [0.00026527818136126246, 7.21843359990882e-05, 0.00016498910577492163] and parameters: {'n_layers': 3, 'embedding_dim': 64, 'lr': 0.00024019407802996546, 'lambda_val': 1.1602258783212233e-06, 'batch_size': 1120, 'optimizer': 'SGD'}.
2026-07-05 19:02:31,796 - experiment_functions - INFO - Early stopping at epoch 500. Best Metrics: (0.00021864650996604023, 6.648557263073914e-05, 0.00013477707487923523)
2026-07-05 19:02:31,883 - optuna.study.study - INFO - Trial 76 finished with values: [0.00021864650996604023, 6.648557263073914e-05, 0.00013477707487923523] and parameters: {'n_layers': 1, 'embedding_dim': 96, 'lr': 0.00010908557577672226, 'lambda_val': 0.00727169489073933, 'batch_size': 1175, 'optimizer': 'Adam'}.
2026-07-05 19:06:25,878 - experiment_functions - INFO - Early stopping at epoch 2900. Best Metrics: (0.009578505044337915, 0.0023887316452329845, 0.005649776285719178)
2026-07-05 19:06:25,965 - optuna.study.study - INFO - Trial 77 finished with values: [0.009578505044337915, 0.0023887316452329845, 0.005649776285719178] and parameters: {'n_layers': 4, 'embedding_dim': 32, 'lr': 0.00046943052333612564, 'lambda_val': 0.0030759808459583132, 'batch_size': 2594, 'optimizer': 'Adam'}.
2026-07-05 19:07:08,129 - experiment_functions - INFO - Early stopping at epoch 500. Best Metrics: (0.0003004793942003758, 6.36361909465646e-05, 0.00015430673740140458)
2026-07-05 19:07:08,209 - optuna.study.study - INFO - Trial 78 finished with values: [0.0003004793942003758, 6.36361909465646e-05, 0.00015430673740140458] and parameters: {'n_layers': 3, 'embedding_dim': 32, 'lr': 1.8141120365012412e-05, 'lambda_val': 1.8437185332785566e-05, 'batch_size': 3988, 'optimizer': 'SGD'}.
2026-07-05 19:13:18,664 - optuna.study.study - INFO - Trial 79 finished with values: [0.01943724830746814, 0.004230382007104458, 0.011624904106620156] and parameters: {'n_layers': 1, 'embedding_dim': 256, 'lr': 0.006553786429577227, 'lambda_val': 1.4745289700620854e-05, 'batch_size': 1506, 'optimizer': 'RMSprop'}.
