2026-07-01 16:07:07,070 - optuna.study.study - INFO - Trial 103 finished with values: [0.0020350440798686522, 0.000575575100203256, 0.0013463125614772615] and parameters: {'n_layers': 2, 'embedding_dim': 256, 'lr': 0.006276231155246127, 'lambda_val': 4.5390100598147375e-06, 'batch_size': 3927, 'optimizer': 'RMSprop'}.
2026-07-01 16:11:49,250 - experiment_functions - INFO - Early stopping at epoch 3900. Best Metrics: (0.00020744698724821075, 4.559010694679254e-05, 0.0001254632075880894)
2026-07-01 16:11:49,333 - optuna.study.study - INFO - Trial 104 finished with values: [0.00020744698724821075, 4.559010694679254e-05, 0.0001254632075880894] and parameters: {'n_layers': 1, 'embedding_dim': 32, 'lr': 2.2912620108768134e-05, 'lambda_val': 4.81634531384043e-06, 'batch_size': 3125, 'optimizer': 'RMSprop'}.
2026-07-01 16:12:35,172 - experiment_functions - INFO - Early stopping at epoch 550. Best Metrics: (0.00025056716542750914, 6.458598484128944e-05, 0.00013706619258208367)
2026-07-01 16:12:35,502 - optuna.study.study - INFO - Trial 105 finished with values: [0.00025056716542750914, 6.458598484128944e-05, 0.00013706619258208367] and parameters: {'n_layers': 3, 'embedding_dim': 64, 'lr': 3.3359755362127824e-05, 'lambda_val': 0.002686613104990216, 'batch_size': 2234, 'optimizer': 'RMSprop'}.
2026-07-01 16:13:27,413 - experiment_functions - INFO - Early stopping at epoch 550. Best Metrics: (0.001620272881518218, 0.0004843948863096708, 0.0011140479253592746)
2026-07-01 16:13:27,533 - optuna.study.study - INFO - Trial 106 finished with values: [0.001620272881518218, 0.0004843948863096708, 0.0011140479253592746] and parameters: {'n_layers': 4, 'embedding_dim': 128, 'lr': 0.019644800914724134, 'lambda_val': 0.003411841331736191, 'batch_size': 3604, 'optimizer': 'Adam'}.
2026-07-01 16:16:26,382 - experiment_functions - INFO - Early stopping at epoch 1800. Best Metrics: (0.0022174874697939635, 0.0006097676804133503, 0.0015435376744408265)
2026-07-01 16:16:26,457 - optuna.study.study - INFO - Trial 107 finished with values: [0.0022174874697939635, 0.0006097676804133503, 0.0015435376744408265] and parameters: {'n_layers': 3, 'embedding_dim': 256, 'lr': 0.0008423328164015242, 'lambda_val': 0.0006778527201004557, 'batch_size': 2026, 'optimizer': 'Adam'}.
2026-07-01 16:17:23,556 - experiment_functions - INFO - Early stopping at epoch 550. Best Metrics: (0.0015972643161113133, 0.0005024409703094429, 0.0011480972291785037)
2026-07-01 16:17:23,625 - optuna.study.study - INFO - Trial 108 finished with values: [0.0015972643161113133, 0.0005024409703094429, 0.0011480972291785037] and parameters: {'n_layers': 3, 'embedding_dim': 256, 'lr': 0.006276231155246127, 'lambda_val': 0.0030494501587534817, 'batch_size': 1420, 'optimizer': 'RMSprop'}.
2026-07-01 16:20:09,558 - experiment_functions - INFO - Early stopping at epoch 1950. Best Metrics: (0.002790181477160623, 0.0007493873829379025, 0.0018367126003960464)
2026-07-01 16:20:09,654 - optuna.study.study - INFO - Trial 109 finished with values: [0.002790181477160623, 0.0007493873829379025, 0.0018367126003960464] and parameters: {'n_layers': 3, 'embedding_dim': 128, 'lr': 0.0008549054963496413, 'lambda_val': 8.805105847994294e-05, 'batch_size': 4034, 'optimizer': 'RMSprop'}.
2026-07-01 16:21:03,797 - experiment_functions - INFO - Early stopping at epoch 700. Best Metrics: (0.001402803439965051, 0.0003295784814695211, 0.0008951690964146183)
2026-07-01 16:21:03,890 - optuna.study.study - INFO - Trial 110 finished with values: [0.001402803439965051, 0.0003295784814695211, 0.0008951690964146183] and parameters: {'n_layers': 1, 'embedding_dim': 32, 'lr': 0.01071657957476966, 'lambda_val': 3.747302157374259e-06, 'batch_size': 1100, 'optimizer': 'RMSprop'}.
2026-07-01 16:22:36,798 - experiment_functions - INFO - Early stopping at epoch 1200. Best Metrics: (0.0008651532419332493, 0.0003039340463119503, 0.0006345073602680233)
2026-07-01 16:22:36,902 - optuna.study.study - INFO - Trial 111 finished with values: [0.0008651532419332493, 0.0003039340463119503, 0.0006345073602680233] and parameters: {'n_layers': 4, 'embedding_dim': 32, 'lr': 0.0405228244449841, 'lambda_val': 0.010073355472910484, 'batch_size': 3604, 'optimizer': 'RMSprop'}.
2026-07-01 16:23:39,139 - experiment_functions - INFO - Early stopping at epoch 600. Best Metrics: (0.0021013590915793384, 0.0006050187109397261, 0.0013990098451651383)
2026-07-01 16:23:39,276 - optuna.study.study - INFO - Trial 112 finished with values: [0.0021013590915793384, 0.0006050187109397261, 0.0013990098451651383] and parameters: {'n_layers': 3, 'embedding_dim': 256, 'lr': 0.006276231155246127, 'lambda_val': 1.0006381339845013e-05, 'batch_size': 1100, 'optimizer': 'RMSprop'}.
2026-07-01 16:25:19,605 - experiment_functions - INFO - Early stopping at epoch 1300. Best Metrics: (0.002488912513743474, 0.0007161445966225328, 0.0017520466338812994)
2026-07-01 16:25:19,697 - optuna.study.study - INFO - Trial 113 finished with values: [0.002488912513743474, 0.0007161445966225328, 0.0017520466338812994] and parameters: {'n_layers': 4, 'embedding_dim': 32, 'lr': 0.001878376227052758, 'lambda_val': 1.7400188628222683e-06, 'batch_size': 3927, 'optimizer': 'RMSprop'}.
2026-07-01 16:26:22,761 - experiment_functions - INFO - Early stopping at epoch 700. Best Metrics: (0.001489256524857406, 0.00040366240525805904, 0.0010605875891942509)
2026-07-01 16:26:22,851 - optuna.study.study - INFO - Trial 114 finished with values: [0.001489256524857406, 0.00040366240525805904, 0.0010605875891942509] and parameters: {'n_layers': 1, 'embedding_dim': 256, 'lr': 0.01071657957476966, 'lambda_val': 0.00013119531241056955, 'batch_size': 920, 'optimizer': 'RMSprop'}.
2026-07-01 16:27:55,100 - experiment_functions - INFO - Early stopping at epoch 900. Best Metrics: (0.0019926448737018734, 0.0005888722147294037, 0.0014347834507021596)
2026-07-01 16:27:55,173 - optuna.study.study - INFO - Trial 115 finished with values: [0.0019926448737018734, 0.0005888722147294037, 0.0014347834507021596] and parameters: {'n_layers': 3, 'embedding_dim': 256, 'lr': 0.001878376227052758, 'lambda_val': 0.0012592144246174213, 'batch_size': 3101, 'optimizer': 'Adam'}.
2026-07-01 16:28:40,033 - experiment_functions - INFO - Early stopping at epoch 550. Best Metrics: (0.0013660321900741887, 0.0003580722983112665, 0.0008936557402760629)
2026-07-01 16:28:40,126 - optuna.study.study - INFO - Trial 116 finished with values: [0.0013660321900741887, 0.0003580722983112665, 0.0008936557402760629] and parameters: {'n_layers': 4, 'embedding_dim': 32, 'lr': 0.019644800914724134, 'lambda_val': 0.0006778527201004557, 'batch_size': 2026, 'optimizer': 'RMSprop'}.
2026-07-01 16:29:31,712 - experiment_functions - INFO - Early stopping at epoch 550. Best Metrics: (0.0013272193797785783, 0.0004198089014683813, 0.0009400479240996156)
2026-07-01 16:29:31,782 - optuna.study.study - INFO - Trial 117 finished with values: [0.0013272193797785783, 0.0004198089014683813, 0.0009400479240996156] and parameters: {'n_layers': 4, 'embedding_dim': 128, 'lr': 0.01617740530595442, 'lambda_val': 0.0012592144246174213, 'batch_size': 3465, 'optimizer': 'RMSprop'}.
2026-07-01 16:31:15,519 - experiment_functions - INFO - Early stopping at epoch 1300. Best Metrics: (0.001783355628504637, 0.0004644492145204491, 0.001187251403931383)
2026-07-01 16:31:15,599 - optuna.study.study - INFO - Trial 118 finished with values: [0.001783355628504637, 0.0004644492145204491, 0.001187251403931383] and parameters: {'n_layers': 1, 'embedding_dim': 128, 'lr': 0.0030363640610353106, 'lambda_val': 6.5134158560038e-06, 'batch_size': 3567, 'optimizer': 'RMSprop'}.
2026-07-01 16:36:52,711 - optuna.study.study - INFO - Trial 119 finished with values: [0.0024948218821824976, 0.0006620063446232168, 0.0017145349072149585] and parameters: {'n_layers': 3, 'embedding_dim': 128, 'lr': 0.0008102278066186573, 'lambda_val': 0.0006778527201004557, 'batch_size': 1159, 'optimizer': 'Adam'}.
2026-07-01 16:37:49,694 - experiment_functions - INFO - Early stopping at epoch 550. Best Metrics: (0.001413716910697545, 0.0004188591075736566, 0.001014524802227655)
2026-07-01 16:37:49,785 - optuna.study.study - INFO - Trial 120 finished with values: [0.001413716910697545, 0.0004188591075736566, 0.001014524802227655] and parameters: {'n_layers': 3, 'embedding_dim': 256, 'lr': 0.07542520245467159, 'lambda_val': 3.1335017132005896e-06, 'batch_size': 1631, 'optimizer': 'RMSprop'}.
2026-07-01 16:40:06,274 - experiment_functions - INFO - Early stopping at epoch 1600. Best Metrics: (0.0010541372306305012, 0.0003704196189426895, 0.0007100310443923667)
2026-07-01 16:40:06,368 - optuna.study.study - INFO - Trial 121 finished with values: [0.0010541372306305012, 0.0003704196189426895, 0.0007100310443923667] and parameters: {'n_layers': 3, 'embedding_dim': 128, 'lr': 0.01617740530595442, 'lambda_val': 0.016802924980267107, 'batch_size': 1159, 'optimizer': 'RMSprop'}.
2026-07-01 16:41:38,569 - experiment_functions - INFO - Early stopping at epoch 1200. Best Metrics: (0.001811747795848539, 0.0005043405580988926, 0.0012205856172822984)
2026-07-01 16:41:38,657 - optuna.study.study - INFO - Trial 122 finished with values: [0.001811747795848539, 0.0005043405580988926, 0.0012205856172822984] and parameters: {'n_layers': 3, 'embedding_dim': 32, 'lr': 0.001878376227052758, 'lambda_val': 0.0012592144246174213, 'batch_size': 3082, 'optimizer': 'Adam'}.
2026-07-01 16:46:35,226 - optuna.study.study - INFO - Trial 123 finished with values: [0.002106265476210989, 0.0005480310772562354, 0.0014024937163713998] and parameters: {'n_layers': 3, 'embedding_dim': 32, 'lr': 0.0008102278066186573, 'lambda_val': 0.0006778527201004557, 'batch_size': 880, 'optimizer': 'Adam'}.
2026-07-01 16:47:52,937 - experiment_functions - INFO - Early stopping at epoch 850. Best Metrics: (0.002491999593972498, 0.000716144596622533, 0.0016093246006513304)
2026-07-01 16:47:53,013 - optuna.study.study - INFO - Trial 124 finished with values: [0.002491999593972498, 0.000716144596622533, 0.0016093246006513304] and parameters: {'n_layers': 4, 'embedding_dim': 128, 'lr': 0.0030363640610353106, 'lambda_val': 6.5134158560038e-06, 'batch_size': 3125, 'optimizer': 'RMSprop'}.
2026-07-01 16:53:36,686 - optuna.study.study - INFO - Trial 125 finished with values: [0.0016515220476179086, 0.0004046121991527839, 0.0010866221653773865] and parameters: {'n_layers': 1, 'embedding_dim': 256, 'lr': 0.0008102278066186573, 'lambda_val': 0.0006778527201004557, 'batch_size': 3125, 'optimizer': 'Adam'}.
2026-07-01 16:54:40,763 - experiment_functions - INFO - Early stopping at epoch 750. Best Metrics: (0.0021244447966963466, 0.0006040689170450013, 0.0014922149323492741)
2026-07-01 16:54:40,858 - optuna.study.study - INFO - Trial 126 finished with values: [0.0021244447966963466, 0.0006040689170450013, 0.0014922149323492741] and parameters: {'n_layers': 3, 'embedding_dim': 96, 'lr': 0.001878376227052758, 'lambda_val': 0.002490163795926445, 'batch_size': 3082, 'optimizer': 'RMSprop'}.
2026-07-01 16:58:36,276 - experiment_functions - INFO - Early stopping at epoch 2400. Best Metrics: (0.0026701627710884706, 0.0007731322303060237, 0.0018012739347407461)
2026-07-01 16:58:36,371 - optuna.study.study - INFO - Trial 127 finished with values: [0.0026701627710884706, 0.0007731322303060237, 0.0018012739347407461] and parameters: {'n_layers': 3, 'embedding_dim': 256, 'lr': 0.001878376227052758, 'lambda_val': 3.747302157374259e-06, 'batch_size': 1100, 'optimizer': 'RMSprop'}.
2026-07-01 16:59:32,474 - experiment_functions - INFO - Early stopping at epoch 600. Best Metrics: (0.0012717481737219258, 0.0003561727105218168, 0.0009742269480394753)
2026-07-01 16:59:32,570 - optuna.study.study - INFO - Trial 128 finished with values: [0.0012717481737219258, 0.0003561727105218168, 0.0009742269480394753] and parameters: {'n_layers': 4, 'embedding_dim': 128, 'lr': 0.07757013011813507, 'lambda_val': 2.9125236439191383e-06, 'batch_size': 2701, 'optimizer': 'RMSprop'}.
2026-07-01 17:00:32,254 - experiment_functions - INFO - Early stopping at epoch 750. Best Metrics: (0.0014868625182068833, 0.000476796535151872, 0.0010449699073491947)
2026-07-01 17:00:32,340 - optuna.study.study - INFO - Trial 129 finished with values: [0.0014868625182068833, 0.000476796535151872, 0.0010449699073491947] and parameters: {'n_layers': 4, 'embedding_dim': 32, 'lr': 0.011309022774653494, 'lambda_val': 0.0006778527201004557, 'batch_size': 880, 'optimizer': 'Adam'}.
2026-07-01 17:01:57,158 - experiment_functions - INFO - Early stopping at epoch 1100. Best Metrics: (0.001736329468645644, 0.0004445035427312274, 0.0011846948566172164)
2026-07-01 17:01:57,475 - optuna.study.study - INFO - Trial 130 finished with values: [0.001736329468645644, 0.0004445035427312274, 0.0011846948566172164] and parameters: {'n_layers': 1, 'embedding_dim': 64, 'lr': 0.003605939295355438, 'lambda_val': 3.0256770800491656e-06, 'batch_size': 3389, 'optimizer': 'RMSprop'}.
2026-07-01 17:02:38,492 - experiment_functions - INFO - Early stopping at epoch 500. Best Metrics: (0.0002444600613731465, 5.983701536766521e-05, 0.0001299680563924179)
2026-07-01 17:02:38,586 - optuna.study.study - INFO - Trial 131 finished with values: [0.0002444600613731465, 5.983701536766521e-05, 0.0001299680563924179] and parameters: {'n_layers': 2, 'embedding_dim': 64, 'lr': 0.0022914869194475, 'lambda_val': 0.016023005626160075, 'batch_size': 1838, 'optimizer': 'SGD'}.
2026-07-01 17:08:03,360 - experiment_functions - INFO - Early stopping at epoch 3300. Best Metrics: (0.0023261263650814386, 0.000660106756833767, 0.001584876962493957)
2026-07-01 17:08:03,457 - optuna.study.study - INFO - Trial 132 finished with values: [0.0023261263650814386, 0.000660106756833767, 0.001584876962493957] and parameters: {'n_layers': 3, 'embedding_dim': 256, 'lr': 0.0008549054963496413, 'lambda_val': 8.805105847994294e-05, 'batch_size': 1848, 'optimizer': 'Adam'}.
2026-07-01 17:11:07,104 - experiment_functions - INFO - Early stopping at epoch 2450. Best Metrics: (0.0023148185889242034, 0.0006259141766236727, 0.0015228273691067166)
2026-07-01 17:11:07,185 - optuna.study.study - INFO - Trial 133 finished with values: [0.0023148185889242034, 0.0006259141766236727, 0.0015228273691067166] and parameters: {'n_layers': 3, 'embedding_dim': 32, 'lr': 0.001878376227052758, 'lambda_val': 3.747302157374259e-06, 'batch_size': 1100, 'optimizer': 'Adam'}.
2026-07-01 17:12:35,001 - experiment_functions - INFO - Early stopping at epoch 1050. Best Metrics: (0.0009129523253217075, 0.0003219801303117223, 0.0006984337010815186)
2026-07-01 17:12:35,089 - optuna.study.study - INFO - Trial 134 finished with values: [0.0009129523253217075, 0.0003219801303117223, 0.0006984337010815186] and parameters: {'n_layers': 3, 'embedding_dim': 96, 'lr': 0.01071657957476966, 'lambda_val': 0.054505568668268826, 'batch_size': 3604, 'optimizer': 'RMSprop'}.
2026-07-01 17:13:32,412 - experiment_functions - INFO - Early stopping at epoch 550. Best Metrics: (0.0016613367865704904, 0.000513838497046141, 0.001134234756595891)
2026-07-01 17:13:32,516 - optuna.study.study - INFO - Trial 135 finished with values: [0.0016613367865704904, 0.000513838497046141, 0.001134234756595891] and parameters: {'n_layers': 3, 'embedding_dim': 256, 'lr': 0.006276231155246127, 'lambda_val': 0.0030494501587534817, 'batch_size': 2281, 'optimizer': 'RMSprop'}.
2026-07-01 17:18:29,517 - optuna.study.study - INFO - Trial 136 finished with values: [0.0014168983781725096, 0.000348574359364018, 0.0009154883057301904] and parameters: {'n_layers': 3, 'embedding_dim': 32, 'lr': 0.0003718740979743619, 'lambda_val': 3.0256770800491656e-06, 'batch_size': 3082, 'optimizer': 'Adam'}.
2026-07-01 17:19:57,684 - experiment_functions - INFO - Early stopping at epoch 1050. Best Metrics: (0.001885740061094306, 0.000526185817677564, 0.0013532756232049958)
2026-07-01 17:19:57,775 - optuna.study.study - INFO - Trial 137 finished with values: [0.001885740061094306, 0.000526185817677564, 0.0013532756232049958] and parameters: {'n_layers': 2, 'embedding_dim': 128, 'lr': 0.005594285769148444, 'lambda_val': 1.413159904245194e-06, 'batch_size': 3604, 'optimizer': 'RMSprop'}.
2026-07-01 17:21:08,979 - experiment_functions - INFO - Early stopping at epoch 800. Best Metrics: (0.002288521596621939, 0.0006259141766236727, 0.00154716671819499)
2026-07-01 17:21:09,067 - optuna.study.study - INFO - Trial 138 finished with values: [0.002288521596621939, 0.0006259141766236727, 0.00154716671819499] and parameters: {'n_layers': 3, 'embedding_dim': 128, 'lr': 0.0030363640610353106, 'lambda_val': 0.00034740027371853627, 'batch_size': 4001, 'optimizer': 'Adam'}.
2026-07-01 17:23:24,586 - experiment_functions - INFO - Early stopping at epoch 1800. Best Metrics: (0.00033112301554607697, 9.307980168303478e-05, 0.00020273421988696504)
2026-07-01 17:23:24,676 - optuna.study.study - INFO - Trial 139 finished with values: [0.00033112301554607697, 9.307980168303478e-05, 0.00020273421988696504] and parameters: {'n_layers': 3, 'embedding_dim': 32, 'lr': 0.00019822190274073505, 'lambda_val': 1.413159904245194e-06, 'batch_size': 529, 'optimizer': 'Adam'}.
2026-07-01 17:24:09,843 - experiment_functions - INFO - Early stopping at epoch 500. Best Metrics: (0.00016498886191108629, 4.274072526261801e-05, 9.143497625028511e-05)
2026-07-01 17:24:10,329 - optuna.study.study - INFO - Trial 140 finished with values: [0.00016498886191108629, 4.274072526261801e-05, 9.143497625028511e-05] and parameters: {'n_layers': 1, 'embedding_dim': 256, 'lr': 0.0008102278066186573, 'lambda_val': 3.9206684194563995e-06, 'batch_size': 880, 'optimizer': 'SGD'}.
2026-07-01 17:26:33,455 - experiment_functions - INFO - Early stopping at epoch 1800. Best Metrics: (0.0017542728602752344, 0.0004321562220998044, 0.0011225799141322314)
2026-07-01 17:26:33,533 - optuna.study.study - INFO - Trial 141 finished with values: [0.0017542728602752344, 0.0004321562220998044, 0.0011225799141322314] and parameters: {'n_layers': 1, 'embedding_dim': 128, 'lr': 0.001878376227052758, 'lambda_val': 3.747302157374259e-06, 'batch_size': 3927, 'optimizer': 'Adam'}.
2026-07-01 17:29:25,480 - experiment_functions - INFO - Early stopping at epoch 2350. Best Metrics: (0.00024639045416057403, 5.7937427578215534e-05, 0.00011696855107432633)
2026-07-01 17:29:25,558 - optuna.study.study - INFO - Trial 142 finished with values: [0.00024639045416057403, 5.7937427578215534e-05, 0.00011696855107432633] and parameters: {'n_layers': 1, 'embedding_dim': 32, 'lr': 2.464970216824428e-05, 'lambda_val': 3.9837177447581685e-05, 'batch_size': 1100, 'optimizer': 'Adam'}.
2026-07-01 17:34:19,237 - optuna.study.study - INFO - Trial 143 finished with values: [0.0018469307120111045, 0.00047014797788879817, 0.001203577427748225] and parameters: {'n_layers': 2, 'embedding_dim': 32, 'lr': 0.0008102278066186573, 'lambda_val': 3.0256770800491656e-06, 'batch_size': 3389, 'optimizer': 'Adam'}.
2026-07-01 17:38:25,412 - experiment_functions - INFO - Early stopping at epoch 2850. Best Metrics: (0.0014128042544461524, 0.0004312064282050795, 0.0010026381974569485)
2026-07-01 17:38:25,498 - optuna.study.study - INFO - Trial 144 finished with values: [0.0014128042544461524, 0.0004312064282050795, 0.0010026381974569485] and parameters: {'n_layers': 1, 'embedding_dim': 256, 'lr': 0.0029227495960639856, 'lambda_val': 0.0030494501587534817, 'batch_size': 1100, 'optimizer': 'Adam'}.
2026-07-01 17:39:10,411 - experiment_functions - INFO - Early stopping at epoch 550. Best Metrics: (0.0013743533751173073, 0.00040746158083695836, 0.0009063170242744418)
2026-07-01 17:39:10,526 - optuna.study.study - INFO - Trial 145 finished with values: [0.0013743533751173073, 0.00040746158083695836, 0.0009063170242744418] and parameters: {'n_layers': 4, 'embedding_dim': 32, 'lr': 0.01617740530595442, 'lambda_val': 0.0012592144246174213, 'batch_size': 1159, 'optimizer': 'RMSprop'}.
2026-07-01 17:44:10,195 - optuna.study.study - INFO - Trial 146 finished with values: [0.002124902729235462, 0.0005375833444142621, 0.0014222699322197355] and parameters: {'n_layers': 4, 'embedding_dim': 32, 'lr': 0.0008102278066186573, 'lambda_val': 2.9125236439191383e-06, 'batch_size': 795, 'optimizer': 'Adam'}.
2026-07-01 17:45:45,963 - experiment_functions - INFO - Early stopping at epoch 1150. Best Metrics: (0.0026531251171393712, 0.0007740820242007485, 0.001850847903285947)
2026-07-01 17:45:46,088 - optuna.study.study - INFO - Trial 147 finished with values: [0.0026531251171393712, 0.0007740820242007485, 0.001850847903285947] and parameters: {'n_layers': 3, 'embedding_dim': 96, 'lr': 0.001878376227052758, 'lambda_val': 0.0006778527201004557, 'batch_size': 1100, 'optimizer': 'RMSprop'}.
2026-07-01 17:46:52,758 - experiment_functions - INFO - Early stopping at epoch 600. Best Metrics: (0.0019714992397362723, 0.0005651273673612826, 0.0013173403825661506)
2026-07-01 17:46:52,847 - optuna.study.study - INFO - Trial 148 finished with values: [0.0019714992397362723, 0.0005651273673612826, 0.0013173403825661506] and parameters: {'n_layers': 4, 'embedding_dim': 256, 'lr': 0.019546253809520703, 'lambda_val': 1.1427509100447198e-06, 'batch_size': 1100, 'optimizer': 'Adam'}.
2026-07-01 17:50:18,409 - experiment_functions - INFO - Early stopping at epoch 2750. Best Metrics: (0.002196061612852244, 0.0005670269551507324, 0.0014693114276787833)
2026-07-01 17:50:18,496 - optuna.study.study - INFO - Trial 149 finished with values: [0.002196061612852244, 0.0005670269551507324, 0.0014693114276787833] and parameters: {'n_layers': 3, 'embedding_dim': 32, 'lr': 0.0008102278066186573, 'lambda_val': 2.9125236439191383e-06, 'batch_size': 2701, 'optimizer': 'Adam'}.
