2026-07-04 22:14:19,050 - optuna.study.study - INFO - Trial 57 finished with values: [0.010687769902014917, 0.0025217027904944627, 0.005996125493670613] and parameters: {'n_layers': 3, 'embedding_dim': 32, 'lr': 0.0015091555359142122, 'lambda_val': 1.1487538529008038e-05, 'batch_size': 623, 'optimizer': 'Adam'}.
2026-07-04 22:15:32,792 - experiment_functions - INFO - Early stopping at epoch 900. Best Metrics: (0.011869650887419503, 0.0029082689056474744, 0.007264121268271354)
2026-07-04 22:15:32,996 - optuna.study.study - INFO - Trial 58 finished with values: [0.011869650887419503, 0.0029082689056474744, 0.007264121268271354] and parameters: {'n_layers': 1, 'embedding_dim': 64, 'lr': 0.005762844285462508, 'lambda_val': 0.006568546318566723, 'batch_size': 3323, 'optimizer': 'Adam'}.
2026-07-04 22:17:03,141 - experiment_functions - INFO - Early stopping at epoch 1100. Best Metrics: (0.000262374312185017, 6.078680926239006e-05, 0.00014309044619405112)
2026-07-04 22:17:03,241 - optuna.study.study - INFO - Trial 59 finished with values: [0.000262374312185017, 6.078680926239006e-05, 0.00014309044619405112] and parameters: {'n_layers': 2, 'embedding_dim': 64, 'lr': 4.4316828814424224e-05, 'lambda_val': 4.880362866165937e-06, 'batch_size': 3927, 'optimizer': 'RMSprop'}.
2026-07-04 22:17:47,817 - experiment_functions - INFO - Early stopping at epoch 500. Best Metrics: (0.00021845968961305243, 5.603783978876584e-05, 0.00013986501178514976)
2026-07-04 22:17:48,286 - optuna.study.study - INFO - Trial 60 finished with values: [0.00021845968961305243, 5.603783978876584e-05, 0.00013986501178514976] and parameters: {'n_layers': 3, 'embedding_dim': 64, 'lr': 1.3957297102460703e-05, 'lambda_val': 1.6630335533045858e-05, 'batch_size': 1533, 'optimizer': 'SGD'}.
2026-07-04 22:18:38,449 - experiment_functions - INFO - Early stopping at epoch 600. Best Metrics: (0.004059336580775722, 0.0011786942233535322, 0.0027139568975955417)
2026-07-04 22:18:38,541 - optuna.study.study - INFO - Trial 61 finished with values: [0.004059336580775722, 0.0011786942233535322, 0.0027139568975955417] and parameters: {'n_layers': 1, 'embedding_dim': 64, 'lr': 0.03509621169937048, 'lambda_val': 6.047949750223317e-05, 'batch_size': 1042, 'optimizer': 'Adam'}.
2026-07-04 22:24:50,515 - optuna.study.study - INFO - Trial 62 finished with values: [0.013227048194328938, 0.0029624071576467904, 0.007729117968062479] and parameters: {'n_layers': 4, 'embedding_dim': 96, 'lr': 0.0016013137270230607, 'lambda_val': 2.9920385603702593e-06, 'batch_size': 2702, 'optimizer': 'RMSprop'}.
2026-07-04 22:25:57,381 - experiment_functions - INFO - Early stopping at epoch 700. Best Metrics: (0.00018815114765991718, 5.793742757821552e-05, 0.00011251922391669539)
2026-07-04 22:25:57,469 - optuna.study.study - INFO - Trial 63 finished with values: [0.00018815114765991718, 5.793742757821552e-05, 0.00011251922391669539] and parameters: {'n_layers': 1, 'embedding_dim': 256, 'lr': 5.924094521851306e-05, 'lambda_val': 2.681601710477832e-05, 'batch_size': 1792, 'optimizer': 'RMSprop'}.
2026-07-04 22:26:57,740 - experiment_functions - INFO - Early stopping at epoch 550. Best Metrics: (0.004447423908378105, 0.0011103090629333435, 0.0028205050008925092)
2026-07-04 22:26:57,828 - optuna.study.study - INFO - Trial 64 finished with values: [0.004447423908378105, 0.0011103090629333435, 0.0028205050008925092] and parameters: {'n_layers': 2, 'embedding_dim': 256, 'lr': 0.024488667087683845, 'lambda_val': 0.03297467797875669, 'batch_size': 1884, 'optimizer': 'Adam'}.
2026-07-04 22:33:08,699 - optuna.study.study - INFO - Trial 65 finished with values: [0.008876220772803109, 0.0022424633854453585, 0.0053912663452843936] and parameters: {'n_layers': 4, 'embedding_dim': 96, 'lr': 0.0002658473095245979, 'lambda_val': 1.1882774866356996e-05, 'batch_size': 3816, 'optimizer': 'Adam'}.
2026-07-04 22:38:22,877 - optuna.study.study - INFO - Trial 66 finished with values: [0.02075494732240931, 0.0044801778014170925, 0.01203494480689943] and parameters: {'n_layers': 1, 'embedding_dim': 64, 'lr': 0.004313984522769102, 'lambda_val': 1.4115609594122773e-06, 'batch_size': 1645, 'optimizer': 'RMSprop'}.
2026-07-04 22:46:41,287 - optuna.study.study - INFO - Trial 67 finished with values: [0.01491370676528194, 0.003270140379537641, 0.008667855097158353] and parameters: {'n_layers': 4, 'embedding_dim': 256, 'lr': 0.0010295843799712518, 'lambda_val': 7.045045135561742e-06, 'batch_size': 2808, 'optimizer': 'RMSprop'}.
2026-07-04 22:47:27,484 - experiment_functions - INFO - Early stopping at epoch 500. Best Metrics: (0.00023647902399489456, 6.36361909465646e-05, 0.00012636054976833286)
2026-07-04 22:47:27,567 - optuna.study.study - INFO - Trial 68 finished with values: [0.00023647902399489456, 6.36361909465646e-05, 0.00012636054976833286] and parameters: {'n_layers': 4, 'embedding_dim': 64, 'lr': 0.03509621169937048, 'lambda_val': 0.00010682970046533922, 'batch_size': 1042, 'optimizer': 'SGD'}.
2026-07-04 22:53:03,602 - optuna.study.study - INFO - Trial 69 finished with values: [0.017112417803431597, 0.0038989039378454875, 0.01018739107735964] and parameters: {'n_layers': 3, 'embedding_dim': 64, 'lr': 0.0009960690196132256, 'lambda_val': 1.1407948092996293e-06, 'batch_size': 1931, 'optimizer': 'Adam'}.
2026-07-04 22:54:07,777 - experiment_functions - INFO - Early stopping at epoch 750. Best Metrics: (0.0002315840936073044, 5.793742757821552e-05, 0.00013314627232476617)
2026-07-04 22:54:07,863 - optuna.study.study - INFO - Trial 70 finished with values: [0.0002315840936073044, 5.793742757821552e-05, 0.00013314627232476617] and parameters: {'n_layers': 1, 'embedding_dim': 128, 'lr': 5.258387866664753e-05, 'lambda_val': 4.331327481478862e-06, 'batch_size': 2808, 'optimizer': 'RMSprop'}.
2026-07-04 22:55:38,697 - experiment_functions - INFO - Early stopping at epoch 1100. Best Metrics: (0.0002502927111234672, 6.458598484128944e-05, 0.00012997414963967772)
2026-07-04 22:55:38,788 - optuna.study.study - INFO - Trial 71 finished with values: [0.0002502927111234672, 6.458598484128944e-05, 0.00012997414963967772] and parameters: {'n_layers': 2, 'embedding_dim': 64, 'lr': 1.4583312992283933e-05, 'lambda_val': 0.0015456320967875508, 'batch_size': 2553, 'optimizer': 'Adam'}.
2026-07-04 23:00:44,576 - experiment_functions - INFO - Early stopping at epoch 3650. Best Metrics: (0.012298477435569744, 0.0029101684934369244, 0.007370222139247719)
2026-07-04 23:00:44,985 - optuna.study.study - INFO - Trial 72 finished with values: [0.012298477435569744, 0.0029101684934369244, 0.007370222139247719] and parameters: {'n_layers': 3, 'embedding_dim': 64, 'lr': 0.008715315659881847, 'lambda_val': 0.00037674227085943596, 'batch_size': 549, 'optimizer': 'RMSprop'}.
2026-07-04 23:01:45,863 - experiment_functions - INFO - Early stopping at epoch 750. Best Metrics: (0.00015066030935736657, 4.7489694736242234e-05, 0.00010167666220765069)
2026-07-04 23:01:46,291 - optuna.study.study - INFO - Trial 73 finished with values: [0.00015066030935736657, 4.7489694736242234e-05, 0.00010167666220765069] and parameters: {'n_layers': 1, 'embedding_dim': 64, 'lr': 1.5070125958012312e-05, 'lambda_val': 0.029871570652371733, 'batch_size': 2629, 'optimizer': 'Adam'}.
2026-07-04 23:02:35,032 - experiment_functions - INFO - Early stopping at epoch 550. Best Metrics: (0.003322378287612613, 0.0008776095587257564, 0.0020992976357995007)
2026-07-04 23:02:35,147 - optuna.study.study - INFO - Trial 74 finished with values: [0.003322378287612613, 0.0008776095587257564, 0.0020992976357995007] and parameters: {'n_layers': 1, 'embedding_dim': 128, 'lr': 0.07167055366810839, 'lambda_val': 1.069181444128658e-05, 'batch_size': 2864, 'optimizer': 'Adam'}.
2026-07-04 23:03:49,618 - experiment_functions - INFO - Early stopping at epoch 700. Best Metrics: (0.00023236492050968577, 5.603783978876584e-05, 0.00012638495143445016)
2026-07-04 23:03:49,753 - optuna.study.study - INFO - Trial 75 finished with values: [0.00023236492050968577, 5.603783978876584e-05, 0.00012638495143445016] and parameters: {'n_layers': 2, 'embedding_dim': 256, 'lr': 2.5233555556778855e-05, 'lambda_val': 1.0986341986825808e-06, 'batch_size': 1963, 'optimizer': 'RMSprop'}.
2026-07-04 23:09:00,583 - optuna.study.study - INFO - Trial 76 finished with values: [0.016792615207735107, 0.0038675607393195677, 0.010289468218857357] and parameters: {'n_layers': 2, 'embedding_dim': 32, 'lr': 0.0015091555359142122, 'lambda_val': 0.00037674227085943596, 'batch_size': 2137, 'optimizer': 'RMSprop'}.
2026-07-04 23:14:34,816 - optuna.study.study - INFO - Trial 77 finished with values: [0.018181830321790576, 0.004083163953422107, 0.01066731208644351] and parameters: {'n_layers': 1, 'embedding_dim': 128, 'lr': 0.0028256479959556857, 'lambda_val': 0.005128289632509461, 'batch_size': 1645, 'optimizer': 'Adam'}.
2026-07-04 23:20:05,990 - optuna.study.study - INFO - Trial 78 finished with values: [0.015012482087623642, 0.003615865357217484, 0.009033326127146492] and parameters: {'n_layers': 1, 'embedding_dim': 128, 'lr': 0.010950652965873981, 'lambda_val': 0.0023013643954001, 'batch_size': 2864, 'optimizer': 'RMSprop'}.
2026-07-04 23:20:52,323 - experiment_functions - INFO - Early stopping at epoch 500. Best Metrics: (0.000229567997822157, 5.5088045894040994e-05, 0.0001183842925134354)
2026-07-04 23:20:52,409 - optuna.study.study - INFO - Trial 79 finished with values: [0.000229567997822157, 5.5088045894040994e-05, 0.0001183842925134354] and parameters: {'n_layers': 2, 'embedding_dim': 128, 'lr': 0.00046295257519938306, 'lambda_val': 3.78430457230463e-06, 'batch_size': 683, 'optimizer': 'SGD'}.
2026-07-04 23:21:59,331 - experiment_functions - INFO - Early stopping at epoch 800. Best Metrics: (0.00016576506326154385, 5.128887031514161e-05, 9.815886202181068e-05)
2026-07-04 23:21:59,418 - optuna.study.study - INFO - Trial 80 finished with values: [0.00016576506326154385, 5.128887031514161e-05, 9.815886202181068e-05] and parameters: {'n_layers': 2, 'embedding_dim': 64, 'lr': 1.4583312992283933e-05, 'lambda_val': 0.0015456320967875508, 'batch_size': 1614, 'optimizer': 'Adam'}.
2026-07-04 23:22:52,386 - experiment_functions - INFO - Early stopping at epoch 600. Best Metrics: (0.004561336620329563, 0.001217635773037251, 0.003023829775409837)
2026-07-04 23:22:52,485 - optuna.study.study - INFO - Trial 81 finished with values: [0.004561336620329563, 0.001217635773037251, 0.003023829775409837] and parameters: {'n_layers': 1, 'embedding_dim': 128, 'lr': 0.024466693088048486, 'lambda_val': 2.0895142317645162e-05, 'batch_size': 2943, 'optimizer': 'RMSprop'}.
2026-07-04 23:28:05,092 - experiment_functions - INFO - Early stopping at epoch 3750. Best Metrics: (0.016445187643619512, 0.003598769067112436, 0.009927397742396654)
2026-07-04 23:28:05,179 - optuna.study.study - INFO - Trial 82 finished with values: [0.016445187643619512, 0.003598769067112436, 0.009927397742396654] and parameters: {'n_layers': 1, 'embedding_dim': 128, 'lr': 0.008715315659881847, 'lambda_val': 0.0001483339453277888, 'batch_size': 3323, 'optimizer': 'RMSprop'}.
2026-07-04 23:28:59,747 - experiment_functions - INFO - Early stopping at epoch 500. Best Metrics: (0.00020927918742792375, 5.888722147294036e-05, 0.00012492623935570683)
2026-07-04 23:28:59,834 - optuna.study.study - INFO - Trial 83 finished with values: [0.00020927918742792375, 5.888722147294036e-05, 0.00012492623935570683] and parameters: {'n_layers': 2, 'embedding_dim': 256, 'lr': 0.00018931879316300273, 'lambda_val': 0.03297467797875669, 'batch_size': 1614, 'optimizer': 'RMSprop'}.
2026-07-04 23:29:48,264 - experiment_functions - INFO - Early stopping at epoch 500. Best Metrics: (0.0002201350826912006, 5.9837015367665226e-05, 0.00013989919019861708)
2026-07-04 23:29:48,366 - optuna.study.study - INFO - Trial 84 finished with values: [0.0002201350826912006, 5.9837015367665226e-05, 0.00013989919019861708] and parameters: {'n_layers': 1, 'embedding_dim': 256, 'lr': 0.0028256479959556857, 'lambda_val': 8.58002565377482e-06, 'batch_size': 1962, 'optimizer': 'SGD'}.
2026-07-04 23:35:33,318 - optuna.study.study - INFO - Trial 85 finished with values: [0.010105792742466502, 0.0023317440115494937, 0.005841934342733592] and parameters: {'n_layers': 4, 'embedding_dim': 64, 'lr': 0.0010295843799712518, 'lambda_val': 0.004249614939874193, 'batch_size': 2553, 'optimizer': 'Adam'}.
2026-07-04 23:36:20,637 - experiment_functions - INFO - Early stopping at epoch 550. Best Metrics: (0.0019977798344022442, 0.0005489808711509603, 0.0012398238767178504)
2026-07-04 23:36:20,860 - optuna.study.study - INFO - Trial 86 finished with values: [0.0019977798344022442, 0.0005489808711509603, 0.0012398238767178504] and parameters: {'n_layers': 1, 'embedding_dim': 96, 'lr': 0.038003497902824174, 'lambda_val': 0.0015456320967875508, 'batch_size': 906, 'optimizer': 'RMSprop'}.
2026-07-04 23:37:12,953 - experiment_functions - INFO - Early stopping at epoch 500. Best Metrics: (0.00023487427792597045, 6.17366031571149e-05, 0.00014533942001362823)
2026-07-04 23:37:13,072 - optuna.study.study - INFO - Trial 87 finished with values: [0.00023487427792597045, 6.17366031571149e-05, 0.00014533942001362823] and parameters: {'n_layers': 4, 'embedding_dim': 128, 'lr': 0.03509621169937048, 'lambda_val': 6.047949750223317e-05, 'batch_size': 1042, 'optimizer': 'SGD'}.
2026-07-04 23:39:30,770 - experiment_functions - INFO - Early stopping at epoch 1550. Best Metrics: (0.00026365174749816043, 6.458598484128944e-05, 0.00014787649484935934)
2026-07-04 23:39:30,896 - optuna.study.study - INFO - Trial 88 finished with values: [0.00026365174749816043, 6.458598484128944e-05, 0.00014787649484935934] and parameters: {'n_layers': 2, 'embedding_dim': 128, 'lr': 0.00011448974562369571, 'lambda_val': 2.3028734947350154e-05, 'batch_size': 2098, 'optimizer': 'RMSprop'}.
2026-07-04 23:45:05,147 - optuna.study.study - INFO - Trial 89 finished with values: [0.009959643757694685, 0.0024609159812320723, 0.006008846624797871] and parameters: {'n_layers': 3, 'embedding_dim': 64, 'lr': 0.021200667544250287, 'lambda_val': 0.0012837533787936162, 'batch_size': 3931, 'optimizer': 'RMSprop'}.
2026-07-04 23:45:47,437 - experiment_functions - INFO - Early stopping at epoch 500. Best Metrics: (0.00024602461055876133, 6.173660315711492e-05, 0.00014450091733645847)
2026-07-04 23:45:47,531 - optuna.study.study - INFO - Trial 90 finished with values: [0.00024602461055876133, 6.173660315711492e-05, 0.00014450091733645847] and parameters: {'n_layers': 3, 'embedding_dim': 32, 'lr': 0.006644850692834592, 'lambda_val': 0.03806652067331256, 'batch_size': 623, 'optimizer': 'SGD'}.
2026-07-04 23:51:04,380 - experiment_functions - INFO - Early stopping at epoch 3500. Best Metrics: (0.0002573687485823979, 5.8887221472940384e-05, 0.00013503889764962068)
2026-07-04 23:51:04,464 - optuna.study.study - INFO - Trial 91 finished with values: [0.0002573687485823979, 5.8887221472940384e-05, 0.00013503889764962068] and parameters: {'n_layers': 1, 'embedding_dim': 256, 'lr': 0.0001369010553537351, 'lambda_val': 4.969406458018728e-05, 'batch_size': 1435, 'optimizer': 'RMSprop'}.
2026-07-04 23:51:48,339 - experiment_functions - INFO - Early stopping at epoch 500. Best Metrics: (0.00019107533626998974, 5.413825199931616e-05, 9.797815748644972e-05)
2026-07-04 23:51:48,983 - optuna.study.study - INFO - Trial 92 finished with values: [0.00019107533626998974, 5.413825199931616e-05, 9.797815748644972e-05] and parameters: {'n_layers': 1, 'embedding_dim': 128, 'lr': 0.004947459881909782, 'lambda_val': 5.219009443304329e-06, 'batch_size': 565, 'optimizer': 'SGD'}.
2026-07-04 23:53:06,658 - experiment_functions - INFO - Early stopping at epoch 1000. Best Metrics: (0.00017532282934627167, 5.1288870315141624e-05, 0.00010292000662802797)
2026-07-04 23:53:06,897 - optuna.study.study - INFO - Trial 93 finished with values: [0.00017532282934627167, 5.1288870315141624e-05, 0.00010292000662802797] and parameters: {'n_layers': 1, 'embedding_dim': 32, 'lr': 5.924094521851306e-05, 'lambda_val': 5.027699947863275e-06, 'batch_size': 2098, 'optimizer': 'RMSprop'}.
2026-07-04 23:59:19,745 - optuna.study.study - INFO - Trial 94 finished with values: [0.014550807256924472, 0.0031476169671181354, 0.008843273031018431] and parameters: {'n_layers': 4, 'embedding_dim': 96, 'lr': 0.01945737514319542, 'lambda_val': 2.9920385603702593e-06, 'batch_size': 2251, 'optimizer': 'RMSprop'}.
2026-07-05 00:04:35,984 - optuna.study.study - INFO - Trial 95 finished with values: [0.01887111108282385, 0.00430921490036662, 0.011221668914053788] and parameters: {'n_layers': 1, 'embedding_dim': 64, 'lr': 0.004313984522769102, 'lambda_val': 7.045045135561742e-06, 'batch_size': 953, 'optimizer': 'Adam'}.
2026-07-05 00:12:57,137 - optuna.study.study - INFO - Trial 96 finished with values: [0.014291269277189647, 0.0034458522500617366, 0.008332345983042286] and parameters: {'n_layers': 4, 'embedding_dim': 256, 'lr': 0.00046184078404352654, 'lambda_val': 1.4514407124820874e-06, 'batch_size': 1923, 'optimizer': 'Adam'}.
2026-07-05 00:13:46,150 - experiment_functions - INFO - Early stopping at epoch 550. Best Metrics: (0.0034115207228658886, 0.0009269988412514486, 0.0021240901692122435)
2026-07-05 00:13:46,235 - optuna.study.study - INFO - Trial 97 finished with values: [0.0034115207228658886, 0.0009269988412514486, 0.0021240901692122435] and parameters: {'n_layers': 1, 'embedding_dim': 128, 'lr': 0.07167055366810839, 'lambda_val': 2.3028734947350154e-05, 'batch_size': 2864, 'optimizer': 'Adam'}.
2026-07-05 00:18:48,733 - optuna.study.study - INFO - Trial 98 finished with values: [0.007578633616502126, 0.0017675664380829362, 0.004534640753884622] and parameters: {'n_layers': 1, 'embedding_dim': 32, 'lr': 0.015795066078019605, 'lambda_val': 0.00037674227085943596, 'batch_size': 623, 'optimizer': 'Adam'}.
2026-07-05 00:24:03,559 - optuna.study.study - INFO - Trial 99 finished with values: [0.012650601121100627, 0.002873126531542655, 0.007394570360575317] and parameters: {'n_layers': 3, 'embedding_dim': 32, 'lr': 0.0012203503451401305, 'lambda_val': 0.0012837533787936162, 'batch_size': 3907, 'optimizer': 'RMSprop'}.
2026-07-05 00:27:47,518 - experiment_functions - INFO - Early stopping at epoch 2450. Best Metrics: (0.00022870639534636512, 5.6987633683490685e-05, 0.0001216451789541906)
2026-07-05 00:27:47,611 - optuna.study.study - INFO - Trial 100 finished with values: [0.00022870639534636512, 5.6987633683490685e-05, 0.0001216451789541906] and parameters: {'n_layers': 1, 'embedding_dim': 256, 'lr': 5.1530866800984826e-05, 'lambda_val': 2.9920385603702593e-06, 'batch_size': 2864, 'optimizer': 'RMSprop'}.
2026-07-05 00:33:01,358 - optuna.study.study - INFO - Trial 101 finished with values: [0.021375342827544597, 0.004946526603726992, 0.012898024752723466] and parameters: {'n_layers': 1, 'embedding_dim': 64, 'lr': 0.0012203503451401305, 'lambda_val': 7.045045135561742e-06, 'batch_size': 3907, 'optimizer': 'RMSprop'}.
2026-07-05 00:33:47,259 - experiment_functions - INFO - Early stopping at epoch 500. Best Metrics: (0.00023461773598413245, 5.31884581045913e-05, 0.00013211902039715956)
2026-07-05 00:33:47,350 - optuna.study.study - INFO - Trial 102 finished with values: [0.00023461773598413245, 5.31884581045913e-05, 0.00013211902039715956] and parameters: {'n_layers': 4, 'embedding_dim': 64, 'lr': 0.004313984522769102, 'lambda_val': 0.0014481008831556158, 'batch_size': 1645, 'optimizer': 'SGD'}.
2026-07-05 00:36:28,819 - experiment_functions - INFO - Early stopping at epoch 2000. Best Metrics: (0.0068197601148716315, 0.0016735368425051765, 0.00410140153963851)
2026-07-05 00:36:28,906 - optuna.study.study - INFO - Trial 103 finished with values: [0.0068197601148716315, 0.0016735368425051765, 0.00410140153963851] and parameters: {'n_layers': 1, 'embedding_dim': 96, 'lr': 0.01945737514319542, 'lambda_val': 2.9920385603702593e-06, 'batch_size': 2702, 'optimizer': 'RMSprop'}.
2026-07-05 00:41:52,543 - optuna.study.study - INFO - Trial 104 finished with values: [0.021674204784237858, 0.004642592557415041, 0.012483366209839522] and parameters: {'n_layers': 1, 'embedding_dim': 96, 'lr': 0.004947459881909782, 'lambda_val': 2.3028734947350154e-05, 'batch_size': 2251, 'optimizer': 'RMSprop'}.
2026-07-05 00:42:37,320 - experiment_functions - INFO - Early stopping at epoch 550. Best Metrics: (0.00028670577227524066, 5.9837015367665226e-05, 0.00014635009829268585)
2026-07-05 00:42:37,414 - optuna.study.study - INFO - Trial 105 finished with values: [0.00028670577227524066, 5.9837015367665226e-05, 0.00014635009829268585] and parameters: {'n_layers': 1, 'embedding_dim': 32, 'lr': 5.11038782942727e-05, 'lambda_val': 0.00037674227085943596, 'batch_size': 623, 'optimizer': 'RMSprop'}.
2026-07-05 00:47:48,810 - optuna.study.study - INFO - Trial 106 finished with values: [0.019687205824300693, 0.004427939137207226, 0.011514859574482941] and parameters: {'n_layers': 2, 'embedding_dim': 32, 'lr': 0.0017671653194099594, 'lambda_val': 4.380499543621736e-06, 'batch_size': 2137, 'optimizer': 'Adam'}.
2026-07-05 00:48:38,045 - experiment_functions - INFO - Early stopping at epoch 500. Best Metrics: (0.00029735082234846953, 6.268639705183976e-05, 0.0001597613800099799)
2026-07-05 00:48:38,142 - optuna.study.study - INFO - Trial 107 finished with values: [0.00029735082234846953, 6.268639705183976e-05, 0.0001597613800099799] and parameters: {'n_layers': 4, 'embedding_dim': 96, 'lr': 0.005762844285462508, 'lambda_val': 0.006568546318566723, 'batch_size': 2702, 'optimizer': 'SGD'}.
2026-07-05 00:49:34,656 - experiment_functions - INFO - Early stopping at epoch 700. Best Metrics: (0.00032752571292285644, 8.928062610413543e-05, 0.00018548966694809926)
