2026-07-04 01:17:27,306 - optuna.study.study - INFO - Trial 292 finished with values: [0.01610710044753976, 0.003991983739528523, 0.010068883551754936] and parameters: {'n_layers': 1, 'embedding_dim': 256, 'lr': 0.0008850965018050803, 'lambda_val': 2.5379243415253125e-05, 'batch_size': 2111, 'optimizer': 'RMSprop'}.
2026-07-04 01:22:50,688 - optuna.study.study - INFO - Trial 293 finished with values: [0.02327268529736726, 0.005302699314248808, 0.013791832837141764] and parameters: {'n_layers': 1, 'embedding_dim': 96, 'lr': 0.0014333316079584322, 'lambda_val': 0.00024312871690729122, 'batch_size': 3121, 'optimizer': 'RMSprop'}.
2026-07-04 01:27:56,879 - optuna.study.study - INFO - Trial 294 finished with values: [0.0223052517403117, 0.005045305168778376, 0.013668837790378002] and parameters: {'n_layers': 1, 'embedding_dim': 32, 'lr': 0.0022700314607702445, 'lambda_val': 2.0533552356322422e-05, 'batch_size': 3333, 'optimizer': 'Adam'}.
2026-07-04 01:33:53,489 - optuna.study.study - INFO - Trial 295 finished with values: [0.019904430702112473, 0.00448967574036434, 0.012154804377547537] and parameters: {'n_layers': 2, 'embedding_dim': 128, 'lr': 0.0008107107656200319, 'lambda_val': 2.0533552356322422e-05, 'batch_size': 3232, 'optimizer': 'RMSprop'}.
2026-07-04 01:34:37,390 - experiment_functions - INFO - Early stopping at epoch 500. Best Metrics: (0.00021026611370413736, 5.5088045894040994e-05, 0.00011229270691171891)
2026-07-04 01:34:37,696 - optuna.study.study - INFO - Trial 296 finished with values: [0.00021026611370413736, 5.5088045894040994e-05, 0.00011229270691171891] and parameters: {'n_layers': 1, 'embedding_dim': 128, 'lr': 0.0010282533123218839, 'lambda_val': 9.917852447655537e-05, 'batch_size': 3121, 'optimizer': 'SGD'}.
2026-07-04 01:39:52,781 - optuna.study.study - INFO - Trial 297 finished with values: [0.022445097305977314, 0.0050681002222517715, 0.013616317981305817] and parameters: {'n_layers': 1, 'embedding_dim': 64, 'lr': 0.0018743209181168723, 'lambda_val': 3.7175116690643465e-05, 'batch_size': 2527, 'optimizer': 'Adam'}.
2026-07-04 01:45:48,036 - optuna.study.study - INFO - Trial 298 finished with values: [0.017545083265512035, 0.004088862716790457, 0.010513662213412517] and parameters: {'n_layers': 2, 'embedding_dim': 128, 'lr': 0.0014333316079584322, 'lambda_val': 3.7175116690643465e-05, 'batch_size': 853, 'optimizer': 'Adam'}.
2026-07-04 01:52:06,074 - optuna.study.study - INFO - Trial 299 finished with values: [0.02808106794687401, 0.006014094941397717, 0.016858734893287878] and parameters: {'n_layers': 1, 'embedding_dim': 256, 'lr': 0.0022700314607702445, 'lambda_val': 1.360510913687726e-06, 'batch_size': 3349, 'optimizer': 'Adam'}.
2026-07-04 01:52:06,089 - root - INFO - Selected Trial 226 based on Max ndcg: 0.0169
2026-07-04 01:52:06,089 - root - INFO - Associated Recall: 0.0283
2026-07-04 01:52:06,089 - experiment_functions - INFO - Training the best model ... for e_amazon_1c1dcs_rand1
2026-07-04 01:58:23,373 - root - INFO -   **** Training e_amazon_1c1dcs_rand2
2026-07-04 01:58:23,698 - root - INFO -   **** Getting 858585/2429444 random edges
2026-07-04 01:58:24,265 - optuna.storages._rdb.storage - INFO - A new study created in RDB with name: Study_e_amazon_1c1dcs_rand2
2026-07-04 01:59:30,501 - experiment_functions - INFO - Early stopping at epoch 850. Best Metrics: (0.0011779509130718346, 0.0003580722983112665, 0.0007677279290698888)
2026-07-04 01:59:30,605 - optuna.study.study - INFO - Trial 0 finished with values: [0.0011779509130718346, 0.0003580722983112665, 0.0007677279290698888] and parameters: {'n_layers': 1, 'embedding_dim': 32, 'lr': 0.09265361857820965, 'lambda_val': 0.000418444762312661, 'batch_size': 2982, 'optimizer': 'RMSprop'}.
2026-07-04 02:00:22,310 - experiment_functions - INFO - Early stopping at epoch 550. Best Metrics: (0.008669643240171635, 0.0019803202705013013, 0.005178288873587988)
2026-07-04 02:00:22,407 - optuna.study.study - INFO - Trial 1 finished with values: [0.008669643240171635, 0.0019803202705013013, 0.005178288873587988] and parameters: {'n_layers': 2, 'embedding_dim': 128, 'lr': 0.039464971202713, 'lambda_val': 0.0002512734421382798, 'batch_size': 3362, 'optimizer': 'Adam'}.
2026-07-04 02:02:00,863 - experiment_functions - INFO - Early stopping at epoch 1100. Best Metrics: (0.00022322031295538645, 5.888722147294038e-05, 0.0001220773280615428)
2026-07-04 02:02:00,966 - optuna.study.study - INFO - Trial 2 finished with values: [0.00022322031295538645, 5.888722147294038e-05, 0.0001220773280615428] and parameters: {'n_layers': 2, 'embedding_dim': 128, 'lr': 1.2055505476811379e-05, 'lambda_val': 2.9526125320592064e-06, 'batch_size': 2034, 'optimizer': 'Adam'}.
2026-07-04 02:02:59,064 - experiment_functions - INFO - Early stopping at epoch 550. Best Metrics: (0.002488393825691943, 0.0006221150010447733, 0.0016040927072700987)
2026-07-04 02:02:59,169 - optuna.study.study - INFO - Trial 3 finished with values: [0.002488393825691943, 0.0006221150010447733, 0.0016040927072700987] and parameters: {'n_layers': 4, 'embedding_dim': 128, 'lr': 0.03057225625591837, 'lambda_val': 0.075361035221045, 'batch_size': 3079, 'optimizer': 'RMSprop'}.
2026-07-04 02:03:42,090 - experiment_functions - INFO - Early stopping at epoch 500. Best Metrics: (0.00019981747332993588, 4.748969473624224e-05, 0.00010430281743301539)
2026-07-04 02:03:42,194 - optuna.study.study - INFO - Trial 4 finished with values: [0.00019981747332993588, 4.748969473624224e-05, 0.00010430281743301539] and parameters: {'n_layers': 4, 'embedding_dim': 32, 'lr': 0.07762706693039911, 'lambda_val': 0.0010971874001752136, 'batch_size': 2691, 'optimizer': 'SGD'}.
2026-07-04 02:04:26,082 - experiment_functions - INFO - Early stopping at epoch 500. Best Metrics: (0.0002803527626595096, 7.218433599908821e-05, 0.00019165978899091424)
2026-07-04 02:04:26,187 - optuna.study.study - INFO - Trial 5 finished with values: [0.0002803527626595096, 7.218433599908821e-05, 0.00019165978899091424] and parameters: {'n_layers': 3, 'embedding_dim': 64, 'lr': 0.003976153551196258, 'lambda_val': 5.245398963432972e-05, 'batch_size': 1590, 'optimizer': 'SGD'}.
2026-07-04 02:06:05,889 - experiment_functions - INFO - Early stopping at epoch 850. Best Metrics: (0.00014567933800413029, 4.653990084151739e-05, 9.82627415806712e-05)
2026-07-04 02:06:05,990 - optuna.study.study - INFO - Trial 6 finished with values: [0.00014567933800413029, 4.653990084151739e-05, 9.82627415806712e-05] and parameters: {'n_layers': 3, 'embedding_dim': 256, 'lr': 5.0870364379593575e-05, 'lambda_val': 0.0002532565825364056, 'batch_size': 3965, 'optimizer': 'Adam'}.
2026-07-04 02:06:51,829 - experiment_functions - INFO - Early stopping at epoch 500. Best Metrics: (0.0002543558599765824, 5.793742757821552e-05, 0.00014675247042177095)
2026-07-04 02:06:51,937 - optuna.study.study - INFO - Trial 7 finished with values: [0.0002543558599765824, 5.793742757821552e-05, 0.00014675247042177095] and parameters: {'n_layers': 4, 'embedding_dim': 64, 'lr': 8.283018819281077e-05, 'lambda_val': 9.742895074443092e-06, 'batch_size': 3531, 'optimizer': 'SGD'}.
2026-07-04 02:08:08,224 - experiment_functions - INFO - Early stopping at epoch 850. Best Metrics: (0.00024817448931760644, 6.36361909465646e-05, 0.00012838893877100769)
2026-07-04 02:08:08,322 - optuna.study.study - INFO - Trial 8 finished with values: [0.00024817448931760644, 6.36361909465646e-05, 0.00012838893877100769] and parameters: {'n_layers': 2, 'embedding_dim': 128, 'lr': 0.00015326808434556872, 'lambda_val': 0.0016032367653458185, 'batch_size': 1726, 'optimizer': 'RMSprop'}.
2026-07-04 02:08:55,318 - experiment_functions - INFO - Early stopping at epoch 500. Best Metrics: (0.00023634191230968257, 5.413825199931615e-05, 0.00011843071383264523)
2026-07-04 02:08:55,423 - optuna.study.study - INFO - Trial 9 finished with values: [0.00023634191230968257, 5.413825199931615e-05, 0.00011843071383264523] and parameters: {'n_layers': 3, 'embedding_dim': 96, 'lr': 0.006013383277207805, 'lambda_val': 2.029945108338137e-05, 'batch_size': 1982, 'optimizer': 'SGD'}.
2026-07-04 02:10:07,267 - experiment_functions - INFO - Early stopping at epoch 550. Best Metrics: (0.00019746087568137566, 4.7489694736242234e-05, 0.0001125772311879232)
2026-07-04 02:10:07,375 - optuna.study.study - INFO - Trial 10 finished with values: [0.00019746087568137566, 4.7489694736242234e-05, 0.0001125772311879232] and parameters: {'n_layers': 4, 'embedding_dim': 256, 'lr': 1.0805517187139436e-05, 'lambda_val': 1.2623721578922964e-05, 'batch_size': 3935, 'optimizer': 'Adam'}.
2026-07-04 02:10:50,039 - experiment_functions - INFO - Early stopping at epoch 500. Best Metrics: (0.00017375461994625457, 5.4138251999316145e-05, 0.00011646310333269059)
2026-07-04 02:10:50,186 - optuna.study.study - INFO - Trial 11 finished with values: [0.00017375461994625457, 5.4138251999316145e-05, 0.00011646310333269059] and parameters: {'n_layers': 1, 'embedding_dim': 96, 'lr': 2.12846257852309e-05, 'lambda_val': 7.336348320101561e-06, 'batch_size': 3847, 'optimizer': 'SGD'}.
2026-07-04 02:16:30,797 - experiment_functions - INFO - Early stopping at epoch 3850. Best Metrics: (0.014118560997303648, 0.002993750356172711, 0.00817087452010143)
2026-07-04 02:16:30,898 - optuna.study.study - INFO - Trial 12 finished with values: [0.014118560997303648, 0.002993750356172711, 0.00817087452010143] and parameters: {'n_layers': 2, 'embedding_dim': 128, 'lr': 0.010561378130282784, 'lambda_val': 1.3386054080202036e-05, 'batch_size': 4003, 'optimizer': 'Adam'}.
2026-07-04 02:17:22,785 - experiment_functions - INFO - Early stopping at epoch 500. Best Metrics: (0.00019706629598545254, 4.7489694736242234e-05, 0.00011848532100759995)
2026-07-04 02:17:22,912 - optuna.study.study - INFO - Trial 13 finished with values: [0.00019706629598545254, 4.7489694736242234e-05, 0.00011848532100759995] and parameters: {'n_layers': 4, 'embedding_dim': 128, 'lr': 2.781731981174014e-05, 'lambda_val': 1.3926918047277332e-06, 'batch_size': 3724, 'optimizer': 'SGD'}.
2026-07-04 02:22:54,228 - optuna.study.study - INFO - Trial 14 finished with values: [0.01468912705166869, 0.003298634196379386, 0.008695493104111848] and parameters: {'n_layers': 1, 'embedding_dim': 128, 'lr': 0.01117512599566325, 'lambda_val': 2.693600404305163e-06, 'batch_size': 1625, 'optimizer': 'Adam'}.
2026-07-04 02:31:13,521 - optuna.study.study - INFO - Trial 15 finished with values: [0.017911084407007196, 0.0037469369146895123, 0.010957776933525312] and parameters: {'n_layers': 4, 'embedding_dim': 256, 'lr': 0.015216834194850396, 'lambda_val': 5.842035456079482e-06, 'batch_size': 3485, 'optimizer': 'RMSprop'}.
2026-07-04 02:31:59,864 - experiment_functions - INFO - Early stopping at epoch 500. Best Metrics: (0.000195258964346402, 4.559010694679254e-05, 0.00011905556951767069)
2026-07-04 02:31:59,966 - optuna.study.study - INFO - Trial 16 finished with values: [0.000195258964346402, 4.559010694679254e-05, 0.00011905556951767069] and parameters: {'n_layers': 2, 'embedding_dim': 128, 'lr': 0.005785164289216302, 'lambda_val': 0.03383423099720373, 'batch_size': 2587, 'optimizer': 'SGD'}.
2026-07-04 02:32:44,899 - experiment_functions - INFO - Early stopping at epoch 550. Best Metrics: (0.002376802955348565, 0.000716144596622533, 0.001550772943297525)
2026-07-04 02:32:45,250 - optuna.study.study - INFO - Trial 17 finished with values: [0.002376802955348565, 0.000716144596622533, 0.001550772943297525] and parameters: {'n_layers': 2, 'embedding_dim': 32, 'lr': 0.01126760716530157, 'lambda_val': 0.044682006756860536, 'batch_size': 1200, 'optimizer': 'Adam'}.
2026-07-04 02:35:04,476 - experiment_functions - INFO - Early stopping at epoch 1700. Best Metrics: (0.00019180025747486042, 5.318845810459131e-05, 0.00011039975177774877)
2026-07-04 02:35:04,834 - optuna.study.study - INFO - Trial 18 finished with values: [0.00019180025747486042, 5.318845810459131e-05, 0.00011039975177774877] and parameters: {'n_layers': 3, 'embedding_dim': 64, 'lr': 5.806880883457564e-05, 'lambda_val': 9.150987477975102e-06, 'batch_size': 2383, 'optimizer': 'RMSprop'}.
2026-07-04 02:35:47,277 - experiment_functions - INFO - Early stopping at epoch 500. Best Metrics: (0.00020972488387443764, 5.6987633683490685e-05, 0.00011735163646991287)
2026-07-04 02:35:47,384 - optuna.study.study - INFO - Trial 19 finished with values: [0.00020972488387443764, 5.6987633683490685e-05, 0.00011735163646991287] and parameters: {'n_layers': 1, 'embedding_dim': 96, 'lr': 1.62451233393602e-05, 'lambda_val': 9.01589570139575e-06, 'batch_size': 4025, 'optimizer': 'SGD'}.
2026-07-04 02:36:39,271 - experiment_functions - INFO - Early stopping at epoch 500. Best Metrics: (0.00018686654056286942, 5.8887221472940384e-05, 0.00015101446058435943)
2026-07-04 02:36:39,417 - optuna.study.study - INFO - Trial 20 finished with values: [0.00018686654056286942, 5.8887221472940384e-05, 0.00015101446058435943] and parameters: {'n_layers': 4, 'embedding_dim': 128, 'lr': 1.2959136904151421e-05, 'lambda_val': 0.003885608276595819, 'batch_size': 3630, 'optimizer': 'SGD'}.
2026-07-04 02:37:28,701 - experiment_functions - INFO - Early stopping at epoch 500. Best Metrics: (0.00020593954692527607, 5.5088045894040994e-05, 0.00012171665796729698)
2026-07-04 02:37:28,825 - optuna.study.study - INFO - Trial 21 finished with values: [0.00020593954692527607, 5.5088045894040994e-05, 0.00012171665796729698] and parameters: {'n_layers': 3, 'embedding_dim': 128, 'lr': 0.0021980724805079218, 'lambda_val': 0.050688205537892994, 'batch_size': 517, 'optimizer': 'SGD'}.
2026-07-04 02:38:14,552 - experiment_functions - INFO - Early stopping at epoch 500. Best Metrics: (0.00017889849993484947, 4.46403130520677e-05, 0.00011778520749231497)
2026-07-04 02:38:14,654 - optuna.study.study - INFO - Trial 22 finished with values: [0.00017889849993484947, 4.46403130520677e-05, 0.00011778520749231497] and parameters: {'n_layers': 4, 'embedding_dim': 64, 'lr': 1.125608969432912e-05, 'lambda_val': 1.5539013269672255e-05, 'batch_size': 930, 'optimizer': 'Adam'}.
2026-07-04 02:39:03,887 - experiment_functions - INFO - Early stopping at epoch 500. Best Metrics: (0.00019662458863437687, 5.983701536766521e-05, 0.00011382522059021752)
2026-07-04 02:39:04,038 - optuna.study.study - INFO - Trial 23 finished with values: [0.00019662458863437687, 5.983701536766521e-05, 0.00011382522059021752] and parameters: {'n_layers': 3, 'embedding_dim': 128, 'lr': 0.010638488968179774, 'lambda_val': 1.6695749389303757e-05, 'batch_size': 2681, 'optimizer': 'SGD'}.
2026-07-04 02:39:53,085 - experiment_functions - INFO - Early stopping at epoch 500. Best Metrics: (0.0001822310790639204, 4.653990084151739e-05, 9.701885110863951e-05)
2026-07-04 02:39:53,224 - optuna.study.study - INFO - Trial 24 finished with values: [0.0001822310790639204, 4.653990084151739e-05, 9.701885110863951e-05] and parameters: {'n_layers': 4, 'embedding_dim': 96, 'lr': 1.2034396802976706e-05, 'lambda_val': 0.05307041660381051, 'batch_size': 3723, 'optimizer': 'RMSprop'}.
2026-07-04 02:40:42,873 - experiment_functions - INFO - Early stopping at epoch 500. Best Metrics: (0.000215455243973515, 4.938928252569193e-05, 0.00011191799082777563)
2026-07-04 02:40:42,979 - optuna.study.study - INFO - Trial 25 finished with values: [0.000215455243973515, 4.938928252569193e-05, 0.00011191799082777563] and parameters: {'n_layers': 3, 'embedding_dim': 128, 'lr': 0.000834295481044046, 'lambda_val': 0.03452640884954576, 'batch_size': 1626, 'optimizer': 'SGD'}.
2026-07-04 02:41:35,033 - experiment_functions - INFO - Early stopping at epoch 500. Best Metrics: (0.00020650406647723177, 5.603783978876583e-05, 0.00012888502950408475)
2026-07-04 02:41:35,184 - optuna.study.study - INFO - Trial 26 finished with values: [0.00020650406647723177, 5.603783978876583e-05, 0.00012888502950408475] and parameters: {'n_layers': 4, 'embedding_dim': 128, 'lr': 1.3324826754140698e-05, 'lambda_val': 2.591986046953647e-06, 'batch_size': 3852, 'optimizer': 'SGD'}.
2026-07-04 02:42:19,581 - experiment_functions - INFO - Early stopping at epoch 500. Best Metrics: (0.00029340653220451404, 6.458598484128944e-05, 0.0001537629186359887)
2026-07-04 02:42:19,686 - optuna.study.study - INFO - Trial 27 finished with values: [0.00029340653220451404, 6.458598484128944e-05, 0.0001537629186359887] and parameters: {'n_layers': 2, 'embedding_dim': 96, 'lr': 0.000825254884924141, 'lambda_val': 1.9713647311976392e-05, 'batch_size': 3310, 'optimizer': 'SGD'}.
2026-07-04 02:43:08,265 - experiment_functions - INFO - Early stopping at epoch 500. Best Metrics: (0.0002789565907031567, 6.55357787360143e-05, 0.00014052348579609084)
2026-07-04 02:43:08,365 - optuna.study.study - INFO - Trial 28 finished with values: [0.0002789565907031567, 6.55357787360143e-05, 0.00014052348579609084] and parameters: {'n_layers': 1, 'embedding_dim': 256, 'lr': 2.620777012891229e-05, 'lambda_val': 2.0003344352285716e-06, 'batch_size': 2838, 'optimizer': 'SGD'}.
2026-07-04 02:44:02,607 - experiment_functions - INFO - Early stopping at epoch 550. Best Metrics: (0.00015332119871954152, 4.9389282525691926e-05, 9.55452648609892e-05)
2026-07-04 02:44:02,719 - optuna.study.study - INFO - Trial 29 finished with values: [0.00015332119871954152, 4.9389282525691926e-05, 9.55452648609892e-05] and parameters: {'n_layers': 1, 'embedding_dim': 256, 'lr': 5.47266766378904e-05, 'lambda_val': 9.502826679863725e-05, 'batch_size': 2767, 'optimizer': 'Adam'}.
2026-07-04 02:44:51,995 - experiment_functions - INFO - Early stopping at epoch 500. Best Metrics: (0.00017968816494568214, 4.938928252569192e-05, 9.432978640397564e-05)
2026-07-04 02:44:52,105 - optuna.study.study - INFO - Trial 30 finished with values: [0.00017968816494568214, 4.938928252569192e-05, 9.432978640397564e-05] and parameters: {'n_layers': 4, 'embedding_dim': 96, 'lr': 0.0029943229674374533, 'lambda_val': 4.11738853463409e-05, 'batch_size': 3395, 'optimizer': 'SGD'}.
2026-07-04 02:45:52,741 - experiment_functions - INFO - Early stopping at epoch 700. Best Metrics: (0.00021384213213879654, 5.223866420986645e-05, 0.00010992906430886249)
2026-07-04 02:45:52,851 - optuna.study.study - INFO - Trial 31 finished with values: [0.00021384213213879654, 5.223866420986645e-05, 0.00010992906430886249] and parameters: {'n_layers': 3, 'embedding_dim': 64, 'lr': 2.4914143817275907e-05, 'lambda_val': 0.0003451161615824805, 'batch_size': 3502, 'optimizer': 'RMSprop'}.
2026-07-04 02:53:26,440 - optuna.study.study - INFO - Trial 32 finished with values: [0.0045372707211398505, 0.0011995896890374788, 0.0026491988794557016] and parameters: {'n_layers': 3, 'embedding_dim': 256, 'lr': 0.002418408076717017, 'lambda_val': 0.02788180573288284, 'batch_size': 2058, 'optimizer': 'Adam'}.
2026-07-04 02:54:14,068 - experiment_functions - INFO - Early stopping at epoch 550. Best Metrics: (0.0043777663915072935, 0.0010856144216704977, 0.0027739663815895834)
2026-07-04 02:54:14,172 - optuna.study.study - INFO - Trial 33 finished with values: [0.0043777663915072935, 0.0010856144216704977, 0.0027739663815895834] and parameters: {'n_layers': 2, 'embedding_dim': 64, 'lr': 0.04253268374092292, 'lambda_val': 6.358214811292208e-05, 'batch_size': 2929, 'optimizer': 'RMSprop'}.
2026-07-04 03:01:45,754 - optuna.study.study - INFO - Trial 34 finished with values: [0.00955477766221932, 0.0024732633018634954, 0.005785299503990358] and parameters: {'n_layers': 3, 'embedding_dim': 256, 'lr': 0.00026307955757801885, 'lambda_val': 0.000434831816568687, 'batch_size': 2611, 'optimizer': 'RMSprop'}.
2026-07-04 03:07:18,752 - optuna.study.study - INFO - Trial 35 finished with values: [0.01312098635938864, 0.0031846589290124043, 0.007695037591605218] and parameters: {'n_layers': 3, 'embedding_dim': 64, 'lr': 0.0006924103134205528, 'lambda_val': 2.035462829964434e-06, 'batch_size': 1072, 'optimizer': 'Adam'}.
2026-07-04 03:08:00,372 - experiment_functions - INFO - Early stopping at epoch 500. Best Metrics: (0.00021550421910980052, 5.1288870315141624e-05, 0.00012166972847721666)
2026-07-04 03:08:00,469 - optuna.study.study - INFO - Trial 36 finished with values: [0.00021550421910980052, 5.1288870315141624e-05, 0.00012166972847721666] and parameters: {'n_layers': 1, 'embedding_dim': 64, 'lr': 0.07718877906777162, 'lambda_val': 0.06708304755168053, 'batch_size': 2153, 'optimizer': 'SGD'}.
2026-07-04 03:08:48,172 - experiment_functions - INFO - Early stopping at epoch 550. Best Metrics: (0.0074889672152126645, 0.001829303041240051, 0.00456063274662446)
2026-07-04 03:08:48,276 - optuna.study.study - INFO - Trial 37 finished with values: [0.0074889672152126645, 0.001829303041240051, 0.00456063274662446] and parameters: {'n_layers': 2, 'embedding_dim': 64, 'lr': 0.05646473129906133, 'lambda_val': 8.712752718400284e-06, 'batch_size': 1490, 'optimizer': 'Adam'}.
2026-07-04 03:10:53,871 - experiment_functions - INFO - Early stopping at epoch 1250. Best Metrics: (0.0021293292044674813, 0.0006572573751495926, 0.001349846491886651)
2026-07-04 03:10:54,021 - optuna.study.study - INFO - Trial 38 finished with values: [0.0021293292044674813, 0.0006572573751495926, 0.001349846491886651] and parameters: {'n_layers': 4, 'embedding_dim': 128, 'lr': 0.0006819231383194605, 'lambda_val': 0.045192697044491914, 'batch_size': 3540, 'optimizer': 'Adam'}.
2026-07-04 03:13:47,771 - experiment_functions - INFO - Early stopping at epoch 2200. Best Metrics: (0.01593009482257485, 0.003558877723533993, 0.009459831016330774)
2026-07-04 03:13:48,133 - optuna.study.study - INFO - Trial 39 finished with values: [0.01593009482257485, 0.003558877723533993, 0.009459831016330774] and parameters: {'n_layers': 1, 'embedding_dim': 64, 'lr': 0.008660151763754238, 'lambda_val': 0.00011379845769455902, 'batch_size': 1756, 'optimizer': 'Adam'}.
2026-07-04 03:14:34,930 - experiment_functions - INFO - Early stopping at epoch 550. Best Metrics: (0.0017544436653601622, 0.0005062401458883422, 0.0011509865302021186)
