2026-06-29 14:13:24,069 - optuna.study.study - INFO - Trial 72 finished with values: [0.00019732201257869163, 5.0339076420416775e-05, 0.00012049513858036724] and parameters: {'n_layers': 1, 'embedding_dim': 128, 'lr': 0.017064597658571556, 'lambda_val': 3.3900229645679598e-06, 'batch_size': 1574, 'optimizer': 'SGD'}.
2026-06-29 14:16:39,004 - experiment_functions - INFO - Early stopping at epoch 2450. Best Metrics: (0.00029989961816315815, 0.000165264137682123, 0.00025160257106170695)
2026-06-29 14:16:39,079 - optuna.study.study - INFO - Trial 73 finished with values: [0.00029989961816315815, 0.000165264137682123, 0.00025160257106170695] and parameters: {'n_layers': 3, 'embedding_dim': 96, 'lr': 0.07945214517899378, 'lambda_val': 0.004235103893108358, 'batch_size': 831, 'optimizer': 'Adam'}.
2026-06-29 14:17:20,018 - experiment_functions - INFO - Early stopping at epoch 500. Best Metrics: (0.00018937849710610224, 5.223866420986647e-05, 0.00012034090960807974)
2026-06-29 14:17:20,104 - optuna.study.study - INFO - Trial 74 finished with values: [0.00018937849710610224, 5.223866420986647e-05, 0.00012034090960807974] and parameters: {'n_layers': 4, 'embedding_dim': 32, 'lr': 0.0030584880334294908, 'lambda_val': 1.1005164412742897e-06, 'batch_size': 2600, 'optimizer': 'SGD'}.
2026-06-29 14:18:24,133 - experiment_functions - INFO - Early stopping at epoch 800. Best Metrics: (0.0026496339029274158, 0.0008700112075679577, 0.0018728396380401394)
2026-06-29 14:18:24,253 - optuna.study.study - INFO - Trial 75 finished with values: [0.0026496339029274158, 0.0008700112075679577, 0.0018728396380401394] and parameters: {'n_layers': 1, 'embedding_dim': 96, 'lr': 0.0013135077251507194, 'lambda_val': 0.0004244982241785935, 'batch_size': 3898, 'optimizer': 'Adam'}.
2026-06-29 14:19:05,982 - experiment_functions - INFO - Early stopping at epoch 500. Best Metrics: (0.00021157255833063567, 5.413825199931615e-05, 0.00010233688537923044)
2026-06-29 14:19:06,055 - optuna.study.study - INFO - Trial 76 finished with values: [0.00021157255833063567, 5.413825199931615e-05, 0.00010233688537923044] and parameters: {'n_layers': 2, 'embedding_dim': 96, 'lr': 0.011907671856603224, 'lambda_val': 0.015150315781646618, 'batch_size': 1253, 'optimizer': 'SGD'}.
2026-06-29 14:19:59,720 - experiment_functions - INFO - Early stopping at epoch 650. Best Metrics: (0.0007093605331838205, 0.00023079991641813727, 0.000447529624110986)
2026-06-29 14:19:59,824 - optuna.study.study - INFO - Trial 77 finished with values: [0.0007093605331838205, 0.00023079991641813727, 0.000447529624110986] and parameters: {'n_layers': 4, 'embedding_dim': 64, 'lr': 0.0007886779079223827, 'lambda_val': 0.0004244982241785935, 'batch_size': 3991, 'optimizer': 'RMSprop'}.
2026-06-29 14:20:42,341 - experiment_functions - INFO - Early stopping at epoch 500. Best Metrics: (0.00016588477407185348, 4.843948863096708e-05, 9.90305093464348e-05)
2026-06-29 14:20:42,427 - optuna.study.study - INFO - Trial 78 finished with values: [0.00016588477407185348, 4.843948863096708e-05, 9.90305093464348e-05] and parameters: {'n_layers': 2, 'embedding_dim': 128, 'lr': 0.004199839263677167, 'lambda_val': 3.7451957208637473e-06, 'batch_size': 4065, 'optimizer': 'SGD'}.
2026-06-29 14:21:34,518 - experiment_functions - INFO - Early stopping at epoch 550. Best Metrics: (0.00022020687398441156, 5.31884581045913e-05, 0.00012580931290483667)
2026-06-29 14:21:34,593 - optuna.study.study - INFO - Trial 79 finished with values: [0.00022020687398441156, 5.31884581045913e-05, 0.00012580931290483667] and parameters: {'n_layers': 2, 'embedding_dim': 256, 'lr': 1.4086659833990027e-05, 'lambda_val': 0.0045158154821205955, 'batch_size': 3775, 'optimizer': 'RMSprop'}.
2026-06-29 14:22:24,070 - experiment_functions - INFO - Early stopping at epoch 500. Best Metrics: (0.00025022558098430236, 6.173660315711492e-05, 0.00013730017659854682)
2026-06-29 14:22:24,174 - optuna.study.study - INFO - Trial 80 finished with values: [0.00025022558098430236, 6.173660315711492e-05, 0.00013730017659854682] and parameters: {'n_layers': 3, 'embedding_dim': 256, 'lr': 0.011256430418064723, 'lambda_val': 3.3900229645679598e-06, 'batch_size': 2321, 'optimizer': 'SGD'}.
2026-06-29 14:23:08,218 - experiment_functions - INFO - Early stopping at epoch 500. Best Metrics: (0.0011588135255244602, 0.0003124821913644739, 0.0007437122863683303)
2026-06-29 14:23:08,332 - optuna.study.study - INFO - Trial 81 finished with values: [0.0011588135255244602, 0.0003124821913644739, 0.0007437122863683303] and parameters: {'n_layers': 4, 'embedding_dim': 96, 'lr': 0.027994598569073718, 'lambda_val': 0.0006440628507108451, 'batch_size': 2954, 'optimizer': 'RMSprop'}.
2026-06-29 14:23:59,950 - experiment_functions - INFO - Early stopping at epoch 500. Best Metrics: (0.0002511623040564446, 6.173660315711492e-05, 0.00013943380764977438)
2026-06-29 14:24:00,099 - optuna.study.study - INFO - Trial 82 finished with values: [0.0002511623040564446, 6.173660315711492e-05, 0.00013943380764977438] and parameters: {'n_layers': 4, 'embedding_dim': 256, 'lr': 0.06732722053295126, 'lambda_val': 1.1005164412742897e-06, 'batch_size': 1678, 'optimizer': 'SGD'}.
2026-06-29 14:24:40,746 - experiment_functions - INFO - Early stopping at epoch 500. Best Metrics: (0.00018923266753955462, 5.128887031514161e-05, 0.00012390179569900497)
2026-06-29 14:24:40,870 - optuna.study.study - INFO - Trial 83 finished with values: [0.00018923266753955462, 5.128887031514161e-05, 0.00012390179569900497] and parameters: {'n_layers': 1, 'embedding_dim': 96, 'lr': 0.002038269853150342, 'lambda_val': 0.042373271372499535, 'batch_size': 1678, 'optimizer': 'SGD'}.
2026-06-29 14:26:06,468 - experiment_functions - INFO - Early stopping at epoch 1100. Best Metrics: (0.001839144619326288, 0.000568926542940182, 0.0012740594112544013)
2026-06-29 14:26:06,572 - optuna.study.study - INFO - Trial 84 finished with values: [0.001839144619326288, 0.000568926542940182, 0.0012740594112544013] and parameters: {'n_layers': 2, 'embedding_dim': 64, 'lr': 0.0006475996595311599, 'lambda_val': 0.0001800101227182521, 'batch_size': 3561, 'optimizer': 'RMSprop'}.
2026-06-29 14:26:52,672 - experiment_functions - INFO - Early stopping at epoch 550. Best Metrics: (0.00019029000098099084, 4.938928252569193e-05, 0.00012321458329052717)
2026-06-29 14:26:52,770 - optuna.study.study - INFO - Trial 85 finished with values: [0.00019029000098099084, 4.938928252569193e-05, 0.00012321458329052717] and parameters: {'n_layers': 2, 'embedding_dim': 96, 'lr': 4.866934196735807e-05, 'lambda_val': 0.0013071970674845765, 'batch_size': 1035, 'optimizer': 'Adam'}.
2026-06-29 14:27:32,858 - experiment_functions - INFO - Early stopping at epoch 500. Best Metrics: (0.00018785185620288683, 5.223866420986647e-05, 0.00011326233107902433)
2026-06-29 14:27:32,964 - optuna.study.study - INFO - Trial 86 finished with values: [0.00018785185620288683, 5.223866420986647e-05, 0.00011326233107902433] and parameters: {'n_layers': 3, 'embedding_dim': 32, 'lr': 0.0001976293616470771, 'lambda_val': 0.0006941170508368597, 'batch_size': 2657, 'optimizer': 'SGD'}.
2026-06-29 14:31:11,364 - experiment_functions - INFO - Early stopping at epoch 2800. Best Metrics: (0.003325381833322654, 0.0010143798795661343, 0.002211619986813032)
2026-06-29 14:31:11,466 - optuna.study.study - INFO - Trial 87 finished with values: [0.003325381833322654, 0.0010143798795661343, 0.002211619986813032] and parameters: {'n_layers': 1, 'embedding_dim': 128, 'lr': 0.0007556847336647807, 'lambda_val': 3.159634083184005e-05, 'batch_size': 1473, 'optimizer': 'Adam'}.
2026-06-29 14:37:43,912 - optuna.study.study - INFO - Trial 88 finished with values: [0.0015818667946927065, 0.00041505993199475715, 0.0009645411275255337] and parameters: {'n_layers': 4, 'embedding_dim': 256, 'lr': 0.00010380403077207956, 'lambda_val': 1.1570798914196541e-06, 'batch_size': 995, 'optimizer': 'Adam'}.
2026-06-29 14:39:26,689 - experiment_functions - INFO - Early stopping at epoch 1200. Best Metrics: (0.0002063483798570743, 6.078680926239006e-05, 0.00011599833706651199)
2026-06-29 14:39:26,794 - optuna.study.study - INFO - Trial 89 finished with values: [0.0002063483798570743, 6.078680926239006e-05, 0.00011599833706651199] and parameters: {'n_layers': 1, 'embedding_dim': 256, 'lr': 2.025379973329606e-05, 'lambda_val': 5.110509216445487e-06, 'batch_size': 3142, 'optimizer': 'RMSprop'}.
2026-06-29 14:40:11,159 - experiment_functions - INFO - Early stopping at epoch 550. Best Metrics: (0.0005823961019111165, 0.0001937579545238683, 0.00038344241219442356)
2026-06-29 14:40:11,258 - optuna.study.study - INFO - Trial 90 finished with values: [0.0005823961019111165, 0.0001937579545238683, 0.00038344241219442356] and parameters: {'n_layers': 4, 'embedding_dim': 32, 'lr': 0.0020146212204725906, 'lambda_val': 1.3664921212013244e-05, 'batch_size': 4012, 'optimizer': 'RMSprop'}.
2026-06-29 14:41:01,341 - experiment_functions - INFO - Early stopping at epoch 550. Best Metrics: (0.0004713235113540917, 0.00026404270273350683, 0.0003799859614960675)
2026-06-29 14:41:01,444 - optuna.study.study - INFO - Trial 91 finished with values: [0.0004713235113540917, 0.00026404270273350683, 0.0003799859614960675] and parameters: {'n_layers': 4, 'embedding_dim': 128, 'lr': 0.06585169484651783, 'lambda_val': 5.131979370324087e-06, 'batch_size': 1811, 'optimizer': 'Adam'}.
2026-06-29 14:43:11,525 - experiment_functions - INFO - Early stopping at epoch 1750. Best Metrics: (0.0026293062619768617, 0.0007265923294645061, 0.0015477904015889386)
2026-06-29 14:43:11,895 - optuna.study.study - INFO - Trial 92 finished with values: [0.0026293062619768617, 0.0007265923294645061, 0.0015477904015889386] and parameters: {'n_layers': 2, 'embedding_dim': 32, 'lr': 0.0007556847336647807, 'lambda_val': 3.159634083184005e-05, 'batch_size': 1478, 'optimizer': 'RMSprop'}.
2026-06-29 14:44:27,794 - experiment_functions - INFO - Early stopping at epoch 900. Best Metrics: (0.00023273927429856027, 6.458598484128944e-05, 0.00013657420613048482)
2026-06-29 14:44:27,905 - optuna.study.study - INFO - Trial 93 finished with values: [0.00023273927429856027, 6.458598484128944e-05, 0.00013657420613048482] and parameters: {'n_layers': 3, 'embedding_dim': 128, 'lr': 0.017064597658571556, 'lambda_val': 3.3900229645679598e-06, 'batch_size': 1574, 'optimizer': 'SGD'}.
2026-06-29 14:46:16,597 - experiment_functions - INFO - Early stopping at epoch 1400. Best Metrics: (0.0031069131922791785, 0.0009963337955663622, 0.0022815382706295)
2026-06-29 14:46:16,678 - optuna.study.study - INFO - Trial 94 finished with values: [0.0031069131922791785, 0.0009963337955663622, 0.0022815382706295] and parameters: {'n_layers': 1, 'embedding_dim': 96, 'lr': 0.0007886779079223827, 'lambda_val': 0.0004244982241785935, 'batch_size': 1811, 'optimizer': 'Adam'}.
2026-06-29 14:47:00,166 - experiment_functions - INFO - Early stopping at epoch 500. Best Metrics: (0.0003446699982208931, 0.0001206238246300553, 0.00025562457702748366)
2026-06-29 14:47:00,240 - optuna.study.study - INFO - Trial 95 finished with values: [0.0003446699982208931, 0.0001206238246300553, 0.00025562457702748366] and parameters: {'n_layers': 2, 'embedding_dim': 128, 'lr': 0.018335519634559577, 'lambda_val': 0.0260313924430871, 'batch_size': 3639, 'optimizer': 'RMSprop'}.
2026-06-29 14:47:40,808 - experiment_functions - INFO - Early stopping at epoch 500. Best Metrics: (0.0002549847878761653, 6.268639705183975e-05, 0.00014956456457081632)
2026-06-29 14:47:40,909 - optuna.study.study - INFO - Trial 96 finished with values: [0.0002549847878761653, 6.268639705183975e-05, 0.00014956456457081632] and parameters: {'n_layers': 1, 'embedding_dim': 64, 'lr': 0.09683727895728858, 'lambda_val': 3.159634083184005e-05, 'batch_size': 944, 'optimizer': 'SGD'}.
2026-06-29 14:49:34,512 - experiment_functions - INFO - Early stopping at epoch 1400. Best Metrics: (0.00022252305409037795, 0.000122523412419505, 0.00017128987544816498)
2026-06-29 14:49:34,586 - optuna.study.study - INFO - Trial 97 finished with values: [0.00022252305409037795, 0.000122523412419505, 0.00017128987544816498] and parameters: {'n_layers': 2, 'embedding_dim': 128, 'lr': 0.0007549780410006504, 'lambda_val': 0.06339729256067027, 'batch_size': 1488, 'optimizer': 'RMSprop'}.
2026-06-29 14:50:16,524 - experiment_functions - INFO - Early stopping at epoch 500. Best Metrics: (0.0001574333294107039, 4.9389282525691926e-05, 9.842920941743099e-05)
2026-06-29 14:50:16,620 - optuna.study.study - INFO - Trial 98 finished with values: [0.0001574333294107039, 4.9389282525691926e-05, 9.842920941743099e-05] and parameters: {'n_layers': 3, 'embedding_dim': 64, 'lr': 0.00035448965689355364, 'lambda_val': 0.08175195923841846, 'batch_size': 582, 'optimizer': 'SGD'}.
2026-06-29 14:51:15,279 - experiment_functions - INFO - Early stopping at epoch 550. Best Metrics: (0.000472338569317755, 0.0003001348707330509, 0.0004366153431720627)
2026-06-29 14:51:15,381 - optuna.study.study - INFO - Trial 99 finished with values: [0.000472338569317755, 0.0003001348707330509, 0.0004366153431720627] and parameters: {'n_layers': 4, 'embedding_dim': 256, 'lr': 0.07945214517899378, 'lambda_val': 5.3222531406855436e-05, 'batch_size': 2600, 'optimizer': 'Adam'}.
2026-06-29 14:52:06,520 - experiment_functions - INFO - Early stopping at epoch 500. Best Metrics: (0.0011400335507331472, 0.0003675702372585149, 0.0007492999719615386)
2026-06-29 14:52:06,621 - optuna.study.study - INFO - Trial 100 finished with values: [0.0011400335507331472, 0.0003675702372585149, 0.0007492999719615386] and parameters: {'n_layers': 3, 'embedding_dim': 256, 'lr': 0.0951182596909589, 'lambda_val': 6.062226724528523e-06, 'batch_size': 2450, 'optimizer': 'RMSprop'}.
2026-06-29 14:52:50,959 - experiment_functions - INFO - Early stopping at epoch 550. Best Metrics: (0.0014508979711178593, 0.00041980890146838136, 0.0008697862012342412)
2026-06-29 14:52:51,064 - optuna.study.study - INFO - Trial 101 finished with values: [0.0014508979711178593, 0.00041980890146838136, 0.0008697862012342412] and parameters: {'n_layers': 2, 'embedding_dim': 32, 'lr': 0.0020146212204725906, 'lambda_val': 3.159634083184005e-05, 'batch_size': 4012, 'optimizer': 'RMSprop'}.
2026-06-29 14:53:35,638 - experiment_functions - INFO - Early stopping at epoch 500. Best Metrics: (0.0008803822476013143, 0.00024884600041790936, 0.000571246216193263)
2026-06-29 14:53:35,735 - optuna.study.study - INFO - Trial 102 finished with values: [0.0008803822476013143, 0.00024884600041790936, 0.000571246216193263] and parameters: {'n_layers': 4, 'embedding_dim': 96, 'lr': 0.016122404315501142, 'lambda_val': 0.0002503570058262612, 'batch_size': 2320, 'optimizer': 'RMSprop'}.
2026-06-29 14:54:43,293 - experiment_functions - INFO - Early stopping at epoch 850. Best Metrics: (0.0011268228374218846, 0.0003039340463119503, 0.0006914339362736671)
2026-06-29 14:54:43,401 - optuna.study.study - INFO - Trial 103 finished with values: [0.0011268228374218846, 0.0003039340463119503, 0.0006914339362736671] and parameters: {'n_layers': 4, 'embedding_dim': 32, 'lr': 0.0007886779079223827, 'lambda_val': 0.0004244982241785935, 'batch_size': 1432, 'optimizer': 'Adam'}.
2026-06-29 14:59:47,934 - optuna.study.study - INFO - Trial 104 finished with values: [0.0019183605304697296, 0.00051953726041449, 0.0012211619347059664] and parameters: {'n_layers': 1, 'embedding_dim': 96, 'lr': 0.00015159499100507432, 'lambda_val': 0.0004244982241785935, 'batch_size': 3898, 'optimizer': 'RMSprop'}.
2026-06-29 15:01:08,541 - experiment_functions - INFO - Early stopping at epoch 1000. Best Metrics: (0.0013500680306701709, 0.00036946982504796466, 0.0008071605687101077)
2026-06-29 15:01:08,666 - optuna.study.study - INFO - Trial 105 finished with values: [0.0013500680306701709, 0.00036946982504796466, 0.0008071605687101077] and parameters: {'n_layers': 3, 'embedding_dim': 64, 'lr': 0.00037359951233542556, 'lambda_val': 0.007998340389978697, 'batch_size': 1797, 'optimizer': 'Adam'}.
2026-06-29 15:01:56,806 - experiment_functions - INFO - Early stopping at epoch 550. Best Metrics: (0.0005050462033033956, 0.00025359496989153357, 0.00041567485431617135)
2026-06-29 15:01:56,907 - optuna.study.study - INFO - Trial 106 finished with values: [0.0005050462033033956, 0.00025359496989153357, 0.00041567485431617135] and parameters: {'n_layers': 2, 'embedding_dim': 128, 'lr': 0.011855029480121257, 'lambda_val': 3.159634083184005e-05, 'batch_size': 1478, 'optimizer': 'Adam'}.
2026-06-29 15:03:37,748 - experiment_functions - INFO - Early stopping at epoch 1250. Best Metrics: (0.0006170524656072473, 0.00027544022947020494, 0.0004646802177143787)
2026-06-29 15:03:37,851 - optuna.study.study - INFO - Trial 107 finished with values: [0.0006170524656072473, 0.00027544022947020494, 0.0004646802177143787] and parameters: {'n_layers': 4, 'embedding_dim': 64, 'lr': 0.003964255356378358, 'lambda_val': 6.062226724528523e-06, 'batch_size': 831, 'optimizer': 'RMSprop'}.
2026-06-29 15:05:22,307 - experiment_functions - INFO - Early stopping at epoch 1200. Best Metrics: (0.003002601686036914, 0.0008880572915677296, 0.0020096968693700105)
2026-06-29 15:05:22,409 - optuna.study.study - INFO - Trial 108 finished with values: [0.003002601686036914, 0.0008880572915677296, 0.0020096968693700105] and parameters: {'n_layers': 1, 'embedding_dim': 256, 'lr': 0.0007886779079223827, 'lambda_val': 0.0004244982241785935, 'batch_size': 605, 'optimizer': 'RMSprop'}.
2026-06-29 15:06:48,069 - experiment_functions - INFO - Early stopping at epoch 1050. Best Metrics: (0.002409075272379674, 0.0006980985126227608, 0.0015429368649373645)
2026-06-29 15:06:48,226 - optuna.study.study - INFO - Trial 109 finished with values: [0.002409075272379674, 0.0006980985126227608, 0.0015429368649373645] and parameters: {'n_layers': 2, 'embedding_dim': 96, 'lr': 0.0007556847336647807, 'lambda_val': 7.689281917654029e-05, 'batch_size': 1093, 'optimizer': 'Adam'}.
2026-06-29 15:07:35,022 - experiment_functions - INFO - Early stopping at epoch 550. Best Metrics: (0.000508990232908607, 0.0002402978553653857, 0.00038385369470191684)
2026-06-29 15:07:35,130 - optuna.study.study - INFO - Trial 110 finished with values: [0.000508990232908607, 0.0002402978553653857, 0.00038385369470191684] and parameters: {'n_layers': 2, 'embedding_dim': 96, 'lr': 0.01856705629644072, 'lambda_val': 0.00022424641721907778, 'batch_size': 2281, 'optimizer': 'Adam'}.
2026-06-29 15:08:28,581 - experiment_functions - INFO - Early stopping at epoch 650. Best Metrics: (0.0030225188529966296, 0.0008719107953574076, 0.001914054500245487)
2026-06-29 15:08:29,421 - optuna.study.study - INFO - Trial 111 finished with values: [0.0030225188529966296, 0.0008719107953574076, 0.001914054500245487] and parameters: {'n_layers': 1, 'embedding_dim': 96, 'lr': 0.002471406577390761, 'lambda_val': 0.0004244982241785935, 'batch_size': 1811, 'optimizer': 'Adam'}.
2026-06-29 15:11:50,440 - experiment_functions - INFO - Early stopping at epoch 2700. Best Metrics: (0.0001911306125227258, 4.843948863096708e-05, 0.0001114427063256828)
2026-06-29 15:11:50,519 - optuna.study.study - INFO - Trial 112 finished with values: [0.0001911306125227258, 4.843948863096708e-05, 0.0001114427063256828] and parameters: {'n_layers': 1, 'embedding_dim': 64, 'lr': 1.426985795815301e-05, 'lambda_val': 6.062226724528523e-06, 'batch_size': 3941, 'optimizer': 'Adam'}.
2026-06-29 15:12:32,692 - experiment_functions - INFO - Early stopping at epoch 500. Best Metrics: (0.0005338875664445283, 0.000165264137682123, 0.0003342399027715052)
2026-06-29 15:12:33,150 - optuna.study.study - INFO - Trial 113 finished with values: [0.0005338875664445283, 0.000165264137682123, 0.0003342399027715052] and parameters: {'n_layers': 2, 'embedding_dim': 96, 'lr': 0.027994598569073718, 'lambda_val': 0.0004074220264916171, 'batch_size': 1478, 'optimizer': 'RMSprop'}.
2026-06-29 15:13:13,744 - experiment_functions - INFO - Early stopping at epoch 500. Best Metrics: (0.00028366986877533565, 6.268639705183976e-05, 0.0001684283584255104)
2026-06-29 15:13:13,817 - optuna.study.study - INFO - Trial 114 finished with values: [0.00028366986877533565, 6.268639705183976e-05, 0.0001684283584255104] and parameters: {'n_layers': 2, 'embedding_dim': 64, 'lr': 0.0008610148671532738, 'lambda_val': 7.321668982372259e-06, 'batch_size': 2023, 'optimizer': 'SGD'}.
2026-06-29 15:14:32,856 - experiment_functions - INFO - Early stopping at epoch 950. Best Metrics: (0.0023550943202166, 0.0007237429477803317, 0.0015494754638495252)
2026-06-29 15:14:32,929 - optuna.study.study - INFO - Trial 115 finished with values: [0.0023550943202166, 0.0007237429477803317, 0.0015494754638495252] and parameters: {'n_layers': 2, 'embedding_dim': 128, 'lr': 0.0007556847336647807, 'lambda_val': 3.159634083184005e-05, 'batch_size': 1473, 'optimizer': 'Adam'}.
2026-06-29 15:19:08,519 - experiment_functions - INFO - Early stopping at epoch 3550. Best Metrics: (0.0005826343030415669, 0.0003200805425222727, 0.00048089200965306016)
2026-06-29 15:19:08,578 - optuna.study.study - INFO - Trial 116 finished with values: [0.0005826343030415669, 0.0003200805425222727, 0.00048089200965306016] and parameters: {'n_layers': 4, 'embedding_dim': 64, 'lr': 0.004761469879022457, 'lambda_val': 1.3664921212013244e-05, 'batch_size': 4012, 'optimizer': 'RMSprop'}.
2026-06-29 15:19:51,904 - experiment_functions - INFO - Early stopping at epoch 550. Best Metrics: (0.00038920650252560984, 0.00018520980947134467, 0.00030492661015517526)
