2026-07-03 16:18:25,068 - optuna.study.study - INFO - Trial 176 finished with values: [0.01795132806685906, 0.003935945899739756, 0.010493730176981221] and parameters: {'n_layers': 2, 'embedding_dim': 128, 'lr': 0.0040524633409478395, 'lambda_val': 3.7175116690643465e-05, 'batch_size': 3839, 'optimizer': 'RMSprop'}.
2026-07-03 16:19:18,598 - experiment_functions - INFO - Early stopping at epoch 500. Best Metrics: (0.0002299726866216376, 6.078680926239006e-05, 0.00012931397421017796)
2026-07-03 16:19:18,682 - optuna.study.study - INFO - Trial 177 finished with values: [0.0002299726866216376, 6.078680926239006e-05, 0.00012931397421017796] and parameters: {'n_layers': 2, 'embedding_dim': 256, 'lr': 0.0014333316079584322, 'lambda_val': 0.0006168359830718268, 'batch_size': 2527, 'optimizer': 'SGD'}.
2026-07-03 16:24:53,158 - optuna.study.study - INFO - Trial 178 finished with values: [0.017212162333903692, 0.0037108447466899686, 0.009928744054025275] and parameters: {'n_layers': 1, 'embedding_dim': 128, 'lr': 0.008057425283025757, 'lambda_val': 6.525874471654226e-06, 'batch_size': 1561, 'optimizer': 'Adam'}.
2026-07-03 16:30:14,128 - optuna.study.study - INFO - Trial 179 finished with values: [0.01182546472514545, 0.0030991774784871677, 0.007518490301828765] and parameters: {'n_layers': 1, 'embedding_dim': 96, 'lr': 0.0008107107656200319, 'lambda_val': 0.008107712298875159, 'batch_size': 3960, 'optimizer': 'RMSprop'}.
2026-07-03 16:32:51,427 - experiment_functions - INFO - Early stopping at epoch 1900. Best Metrics: (0.02000111421901397, 0.004407043671523281, 0.011759898452814378)
2026-07-03 16:32:51,534 - optuna.study.study - INFO - Trial 180 finished with values: [0.02000111421901397, 0.004407043671523281, 0.011759898452814378] and parameters: {'n_layers': 1, 'embedding_dim': 96, 'lr': 0.0040524633409478395, 'lambda_val': 0.0011070921634379147, 'batch_size': 3839, 'optimizer': 'Adam'}.
2026-07-03 16:40:25,629 - optuna.study.study - INFO - Trial 181 finished with values: [0.015334473427339361, 0.003372718120167923, 0.008778637852537295] and parameters: {'n_layers': 3, 'embedding_dim': 256, 'lr': 0.0018743209181168723, 'lambda_val': 7.33580764656977e-05, 'batch_size': 1561, 'optimizer': 'RMSprop'}.
2026-07-03 16:41:10,371 - experiment_functions - INFO - Early stopping at epoch 500. Best Metrics: (0.0002385542218883284, 5.793742757821554e-05, 0.00014038007104077855)
2026-07-03 16:41:10,465 - optuna.study.study - INFO - Trial 182 finished with values: [0.0002385542218883284, 5.793742757821554e-05, 0.00014038007104077855] and parameters: {'n_layers': 2, 'embedding_dim': 96, 'lr': 9.489761664126779e-05, 'lambda_val': 1.2350413453119533e-05, 'batch_size': 4088, 'optimizer': 'SGD'}.
2026-07-03 16:46:55,935 - optuna.study.study - INFO - Trial 183 finished with values: [0.012679211806792193, 0.0029025701422791253, 0.0073217131288403296] and parameters: {'n_layers': 4, 'embedding_dim': 64, 'lr': 0.008057425283025757, 'lambda_val': 0.00016569298362557902, 'batch_size': 1692, 'optimizer': 'RMSprop'}.
2026-07-03 16:51:52,320 - experiment_functions - INFO - Early stopping at epoch 3450. Best Metrics: (0.02091003902970244, 0.004426039549417777, 0.0120529415429148)
2026-07-03 16:51:52,414 - optuna.study.study - INFO - Trial 184 finished with values: [0.02091003902970244, 0.004426039549417777, 0.0120529415429148] and parameters: {'n_layers': 2, 'embedding_dim': 96, 'lr': 0.0022700314607702445, 'lambda_val': 2.0533552356322422e-05, 'batch_size': 3232, 'optimizer': 'Adam'}.
2026-07-03 16:57:09,806 - optuna.study.study - INFO - Trial 185 finished with values: [0.015766022437050338, 0.003473396273008758, 0.009243288241999284] and parameters: {'n_layers': 3, 'embedding_dim': 32, 'lr': 0.0018743209181168723, 'lambda_val': 2.302284243959985e-05, 'batch_size': 2366, 'optimizer': 'Adam'}.
2026-07-03 17:02:22,089 - optuna.study.study - INFO - Trial 186 finished with values: [0.017022009348288767, 0.003691848868795471, 0.009742905504207335] and parameters: {'n_layers': 2, 'embedding_dim': 32, 'lr': 0.0026410131585060054, 'lambda_val': 9.917852447655537e-05, 'batch_size': 3913, 'optimizer': 'RMSprop'}.
2026-07-03 17:09:59,000 - optuna.study.study - INFO - Trial 187 finished with values: [0.01806270661113419, 0.003959690747107878, 0.01029702864435226] and parameters: {'n_layers': 3, 'embedding_dim': 256, 'lr': 0.0014333316079584322, 'lambda_val': 7.33580764656977e-05, 'batch_size': 3121, 'optimizer': 'RMSprop'}.
2026-07-03 17:15:14,251 - optuna.study.study - INFO - Trial 188 finished with values: [0.022305518714853898, 0.0051155899169880135, 0.01383004941810095] and parameters: {'n_layers': 1, 'embedding_dim': 64, 'lr': 0.0018743209181168723, 'lambda_val': 1.9972882720613643e-06, 'batch_size': 2527, 'optimizer': 'Adam'}.
2026-07-03 17:17:58,463 - experiment_functions - INFO - Early stopping at epoch 2050. Best Metrics: (0.017379819456133445, 0.003879908059950991, 0.010291689709007026)
2026-07-03 17:17:58,573 - optuna.study.study - INFO - Trial 189 finished with values: [0.017379819456133445, 0.003879908059950991, 0.010291689709007026] and parameters: {'n_layers': 3, 'embedding_dim': 32, 'lr': 0.001509217129870026, 'lambda_val': 7.329771199139694e-05, 'batch_size': 3575, 'optimizer': 'Adam'}.
2026-07-03 17:23:52,183 - optuna.study.study - INFO - Trial 190 finished with values: [0.014412202259663196, 0.003136219440381437, 0.008303020415910486] and parameters: {'n_layers': 3, 'embedding_dim': 96, 'lr': 0.0026410131585060054, 'lambda_val': 3.994713178662255e-05, 'batch_size': 2186, 'optimizer': 'RMSprop'}.
2026-07-03 17:29:49,715 - optuna.study.study - INFO - Trial 191 finished with values: [0.021809845878732585, 0.004779362878255419, 0.01264224383942096] and parameters: {'n_layers': 2, 'embedding_dim': 128, 'lr': 0.001509217129870026, 'lambda_val': 3.7175116690643465e-05, 'batch_size': 3832, 'optimizer': 'RMSprop'}.
2026-07-03 17:35:58,787 - optuna.study.study - INFO - Trial 192 finished with values: [0.017716686137059606, 0.00425792603005148, 0.010939649306990346] and parameters: {'n_layers': 1, 'embedding_dim': 256, 'lr': 0.0010282533123218839, 'lambda_val': 0.0006168359830718268, 'batch_size': 1831, 'optimizer': 'RMSprop'}.
2026-07-03 17:42:14,854 - optuna.study.study - INFO - Trial 193 finished with values: [0.016206403584230793, 0.003613965769428034, 0.00932279401540007] and parameters: {'n_layers': 3, 'embedding_dim': 128, 'lr': 0.0014333316079584322, 'lambda_val': 7.33580764656977e-05, 'batch_size': 3121, 'optimizer': 'RMSprop'}.
2026-07-03 17:47:42,685 - optuna.study.study - INFO - Trial 194 finished with values: [0.026588844530705227, 0.005848830803715593, 0.015610294922161011] and parameters: {'n_layers': 1, 'embedding_dim': 96, 'lr': 0.0022700314607702445, 'lambda_val': 2.0533552356322422e-05, 'batch_size': 3349, 'optimizer': 'Adam'}.
2026-07-03 17:53:16,028 - optuna.study.study - INFO - Trial 195 finished with values: [0.016156309768842504, 0.003581672777007389, 0.009504898252953038] and parameters: {'n_layers': 1, 'embedding_dim': 128, 'lr': 0.008057425283025757, 'lambda_val': 1.2350413453119533e-05, 'batch_size': 1026, 'optimizer': 'Adam'}.
2026-07-03 17:53:57,693 - experiment_functions - INFO - Early stopping at epoch 500. Best Metrics: (0.00021308735653482986, 5.6987633683490685e-05, 0.00013260371264965404)
2026-07-03 17:53:58,117 - optuna.study.study - INFO - Trial 196 finished with values: [0.00021308735653482986, 5.6987633683490685e-05, 0.00013260371264965404] and parameters: {'n_layers': 2, 'embedding_dim': 32, 'lr': 0.0008107107656200319, 'lambda_val': 7.33580764656977e-05, 'batch_size': 3640, 'optimizer': 'SGD'}.
2026-07-03 17:55:27,111 - experiment_functions - INFO - Early stopping at epoch 1100. Best Metrics: (0.01304928658422466, 0.0030877799517504702, 0.007695030437893873)
2026-07-03 17:55:27,186 - optuna.study.study - INFO - Trial 197 finished with values: [0.01304928658422466, 0.0030877799517504702, 0.007695030437893873] and parameters: {'n_layers': 1, 'embedding_dim': 64, 'lr': 0.003942474684271309, 'lambda_val': 0.011439605580545874, 'batch_size': 3575, 'optimizer': 'Adam'}.
2026-07-03 18:00:45,335 - experiment_functions - INFO - Early stopping at epoch 3800. Best Metrics: (0.021404313434390553, 0.004657789259730639, 0.012599867767386157)
2026-07-03 18:00:45,426 - optuna.study.study - INFO - Trial 198 finished with values: [0.021404313434390553, 0.004657789259730639, 0.012599867767386157] and parameters: {'n_layers': 1, 'embedding_dim': 128, 'lr': 0.005306455009021957, 'lambda_val': 7.329771199139694e-05, 'batch_size': 3047, 'optimizer': 'RMSprop'}.
2026-07-03 18:01:35,930 - experiment_functions - INFO - Early stopping at epoch 550. Best Metrics: (0.005360215526056235, 0.0013781509412457498, 0.003248842477772245)
2026-07-03 18:01:36,000 - optuna.study.study - INFO - Trial 199 finished with values: [0.005360215526056235, 0.0013781509412457498, 0.003248842477772245] and parameters: {'n_layers': 4, 'embedding_dim': 64, 'lr': 0.008057425283025757, 'lambda_val': 0.0032207074718639274, 'batch_size': 1692, 'optimizer': 'RMSprop'}.
2026-07-03 18:03:26,077 - experiment_functions - INFO - Early stopping at epoch 1200. Best Metrics: (0.017561990432550047, 0.003794426609425755, 0.01016210677034764)
2026-07-03 18:03:26,162 - optuna.study.study - INFO - Trial 200 finished with values: [0.017561990432550047, 0.003794426609425755, 0.01016210677034764] and parameters: {'n_layers': 2, 'embedding_dim': 128, 'lr': 0.0040524633409478395, 'lambda_val': 3.7175116690643465e-05, 'batch_size': 3575, 'optimizer': 'Adam'}.
2026-07-03 18:08:52,905 - optuna.study.study - INFO - Trial 201 finished with values: [0.025877404332901602, 0.005656972436981175, 0.015301841916798427] and parameters: {'n_layers': 1, 'embedding_dim': 96, 'lr': 0.0022700314607702445, 'lambda_val': 3.7175116690643465e-05, 'batch_size': 3232, 'optimizer': 'Adam'}.
2026-07-03 18:09:58,519 - experiment_functions - INFO - Early stopping at epoch 500. Best Metrics: (0.00023848945395410406, 5.6987633683490685e-05, 0.00014507791389055716)
2026-07-03 18:09:58,598 - optuna.study.study - INFO - Trial 202 finished with values: [0.00023848945395410406, 5.6987633683490685e-05, 0.00014507791389055716] and parameters: {'n_layers': 4, 'embedding_dim': 256, 'lr': 1.2920715300651423e-05, 'lambda_val': 0.0022828427253251586, 'batch_size': 2527, 'optimizer': 'Adam'}.
2026-07-03 18:16:08,344 - optuna.study.study - INFO - Trial 203 finished with values: [0.016873727529813903, 0.004152498907737021, 0.010398772438494602] and parameters: {'n_layers': 1, 'embedding_dim': 256, 'lr': 0.0008107107656200319, 'lambda_val': 2.302284243959985e-05, 'batch_size': 2782, 'optimizer': 'RMSprop'}.
2026-07-03 18:22:06,553 - optuna.study.study - INFO - Trial 204 finished with values: [0.020890186160938348, 0.004553311931310906, 0.012439914995786516] and parameters: {'n_layers': 2, 'embedding_dim': 128, 'lr': 0.0022700314607702445, 'lambda_val': 2.0533552356322422e-05, 'batch_size': 3232, 'optimizer': 'Adam'}.
2026-07-03 18:22:52,939 - experiment_functions - INFO - Early stopping at epoch 500. Best Metrics: (0.00021026611370413736, 5.5088045894040994e-05, 0.00011229270691171891)
2026-07-03 18:22:53,019 - optuna.study.study - INFO - Trial 205 finished with values: [0.00021026611370413736, 5.5088045894040994e-05, 0.00011229270691171891] and parameters: {'n_layers': 2, 'embedding_dim': 128, 'lr': 0.003942474684271309, 'lambda_val': 3.7175116690643465e-05, 'batch_size': 2210, 'optimizer': 'SGD'}.
2026-07-03 18:29:07,062 - optuna.study.study - INFO - Trial 206 finished with values: [0.027517141475208715, 0.005899169880136012, 0.016377927414429932] and parameters: {'n_layers': 1, 'embedding_dim': 256, 'lr': 0.0026410131585060054, 'lambda_val': 3.994713178662255e-05, 'batch_size': 2210, 'optimizer': 'RMSprop'}.
2026-07-03 18:34:48,059 - optuna.study.study - INFO - Trial 207 finished with values: [0.018781017113863607, 0.004368102121839561, 0.011067880512371866] and parameters: {'n_layers': 2, 'embedding_dim': 96, 'lr': 0.0008107107656200319, 'lambda_val': 1.2350413453119533e-05, 'batch_size': 3121, 'optimizer': 'Adam'}.
2026-07-03 18:40:42,996 - optuna.study.study - INFO - Trial 208 finished with values: [0.0193732521622735, 0.004407993465418005, 0.011593254087586474] and parameters: {'n_layers': 2, 'embedding_dim': 128, 'lr': 0.0010282533123218839, 'lambda_val': 7.33580764656977e-05, 'batch_size': 2527, 'optimizer': 'RMSprop'}.
2026-07-03 18:45:55,740 - optuna.study.study - INFO - Trial 209 finished with values: [0.019934134196648072, 0.004729973595729728, 0.011998144865984123] and parameters: {'n_layers': 1, 'embedding_dim': 64, 'lr': 0.0014537114423835192, 'lambda_val': 7.33580764656977e-05, 'batch_size': 3121, 'optimizer': 'Adam'}.
2026-07-03 18:49:01,260 - experiment_functions - INFO - Early stopping at epoch 2250. Best Metrics: (0.021047211530714063, 0.004499173679311589, 0.012111949611427517)
2026-07-03 18:49:01,340 - optuna.study.study - INFO - Trial 210 finished with values: [0.021047211530714063, 0.004499173679311589, 0.012111949611427517] and parameters: {'n_layers': 2, 'embedding_dim': 64, 'lr': 0.0026410131585060054, 'lambda_val': 7.329771199139694e-05, 'batch_size': 3913, 'optimizer': 'Adam'}.
2026-07-03 18:54:27,788 - optuna.study.study - INFO - Trial 211 finished with values: [0.020528801610593252, 0.00449347491594324, 0.012035139101274605] and parameters: {'n_layers': 2, 'embedding_dim': 64, 'lr': 0.0014333316079584322, 'lambda_val': 7.33580764656977e-05, 'batch_size': 3121, 'optimizer': 'RMSprop'}.
2026-07-03 18:58:08,479 - experiment_functions - INFO - Early stopping at epoch 1900. Best Metrics: (0.016798433089589532, 0.0036994472199532707, 0.009659336432655631)
2026-07-03 18:58:08,573 - optuna.study.study - INFO - Trial 212 finished with values: [0.016798433089589532, 0.0036994472199532707, 0.009659336432655631] and parameters: {'n_layers': 3, 'embedding_dim': 256, 'lr': 0.0014537114423835192, 'lambda_val': 0.0006168359830718268, 'batch_size': 3121, 'optimizer': 'Adam'}.
2026-07-03 19:00:21,181 - experiment_functions - INFO - Early stopping at epoch 1450. Best Metrics: (0.02029577173200149, 0.004383298824155159, 0.011913581741053622)
2026-07-03 19:00:21,260 - optuna.study.study - INFO - Trial 213 finished with values: [0.02029577173200149, 0.004383298824155159, 0.011913581741053622] and parameters: {'n_layers': 2, 'embedding_dim': 128, 'lr': 0.0026410131585060054, 'lambda_val': 9.917852447655537e-05, 'batch_size': 3940, 'optimizer': 'Adam'}.
2026-07-03 19:06:39,688 - optuna.study.study - INFO - Trial 214 finished with values: [0.018823077800629803, 0.00418764128184184, 0.011080687617321151] and parameters: {'n_layers': 3, 'embedding_dim': 128, 'lr': 0.0010282533123218839, 'lambda_val': 2.302284243959985e-05, 'batch_size': 2599, 'optimizer': 'Adam'}.
2026-07-03 19:07:29,021 - experiment_functions - INFO - Early stopping at epoch 550. Best Metrics: (0.007569595481089063, 0.001727675094504493, 0.004426851266140063)
2026-07-03 19:07:29,119 - optuna.study.study - INFO - Trial 215 finished with values: [0.007569595481089063, 0.001727675094504493, 0.004426851266140063] and parameters: {'n_layers': 3, 'embedding_dim': 64, 'lr': 0.048587079753163176, 'lambda_val': 7.329771199139694e-05, 'batch_size': 3913, 'optimizer': 'Adam'}.
2026-07-03 19:10:47,417 - experiment_functions - INFO - Early stopping at epoch 2200. Best Metrics: (0.021174683064859413, 0.004502972854890489, 0.012215365475382402)
2026-07-03 19:10:47,492 - optuna.study.study - INFO - Trial 216 finished with values: [0.021174683064859413, 0.004502972854890489, 0.012215365475382402] and parameters: {'n_layers': 2, 'embedding_dim': 128, 'lr': 0.0022700314607702445, 'lambda_val': 9.917852447655537e-05, 'batch_size': 3913, 'optimizer': 'Adam'}.
2026-07-03 19:16:43,490 - optuna.study.study - INFO - Trial 217 finished with values: [0.021574295464462614, 0.004716676481203579, 0.012632825248343183] and parameters: {'n_layers': 2, 'embedding_dim': 128, 'lr': 0.0014333316079584322, 'lambda_val': 1.360510913687726e-06, 'batch_size': 3121, 'optimizer': 'RMSprop'}.
2026-07-03 19:22:10,380 - optuna.study.study - INFO - Trial 218 finished with values: [0.02041408490046967, 0.004475428831943468, 0.012141882612661902] and parameters: {'n_layers': 2, 'embedding_dim': 64, 'lr': 0.001509217129870026, 'lambda_val': 5.874173464438341e-05, 'batch_size': 3832, 'optimizer': 'RMSprop'}.
2026-07-03 19:27:26,220 - optuna.study.study - INFO - Trial 219 finished with values: [0.020833290516334292, 0.0048297019546758345, 0.012664663971378992] and parameters: {'n_layers': 1, 'embedding_dim': 64, 'lr': 0.0014333316079584322, 'lambda_val': 7.33580764656977e-05, 'batch_size': 3121, 'optimizer': 'RMSprop'}.
2026-07-03 19:35:02,472 - optuna.study.study - INFO - Trial 220 finished with values: [0.016901975175889237, 0.0037668825864787345, 0.009677161758988638] and parameters: {'n_layers': 3, 'embedding_dim': 256, 'lr': 0.0026410131585060054, 'lambda_val': 4.576689567534931e-05, 'batch_size': 3205, 'optimizer': 'RMSprop'}.
2026-07-03 19:36:58,879 - experiment_functions - INFO - Early stopping at epoch 1400. Best Metrics: (0.01757186915193946, 0.003886556617214065, 0.010415349223073895)
2026-07-03 19:36:58,966 - optuna.study.study - INFO - Trial 221 finished with values: [0.01757186915193946, 0.003886556617214065, 0.010415349223073895] and parameters: {'n_layers': 2, 'embedding_dim': 64, 'lr': 0.0040524633409478395, 'lambda_val': 5.874173464438341e-05, 'batch_size': 3839, 'optimizer': 'Adam'}.
2026-07-03 19:37:53,524 - experiment_functions - INFO - Early stopping at epoch 650. Best Metrics: (0.004292400951544249, 0.0011672966966168343, 0.0027899380163105094)
2026-07-03 19:37:53,610 - optuna.study.study - INFO - Trial 222 finished with values: [0.004292400951544249, 0.0011672966966168343, 0.0027899380163105094] and parameters: {'n_layers': 1, 'embedding_dim': 96, 'lr': 0.035127646942631346, 'lambda_val': 7.329771199139694e-05, 'batch_size': 1548, 'optimizer': 'Adam'}.
2026-07-03 19:43:18,637 - optuna.study.study - INFO - Trial 223 finished with values: [0.025975715189170256, 0.0057035123378226926, 0.015662571754251644] and parameters: {'n_layers': 1, 'embedding_dim': 96, 'lr': 0.0026410131585060054, 'lambda_val': 3.212149396263254e-06, 'batch_size': 2599, 'optimizer': 'Adam'}.
2026-07-03 19:48:35,147 - optuna.study.study - INFO - Trial 224 finished with values: [0.022704769958160346, 0.005159280436145357, 0.013840139563206863] and parameters: {'n_layers': 1, 'embedding_dim': 64, 'lr': 0.0018743209181168723, 'lambda_val': 2.0533552356322422e-05, 'batch_size': 2527, 'optimizer': 'Adam'}.
2026-07-03 19:49:17,774 - experiment_functions - INFO - Early stopping at epoch 500. Best Metrics: (0.00024186401773424766, 6.743536652546397e-05, 0.00013549242445510116)
2026-07-03 19:49:17,860 - optuna.study.study - INFO - Trial 225 finished with values: [0.00024186401773424766, 6.743536652546397e-05, 0.00013549242445510116] and parameters: {'n_layers': 1, 'embedding_dim': 96, 'lr': 0.0014333316079584322, 'lambda_val': 1.360510913687726e-06, 'batch_size': 3121, 'optimizer': 'SGD'}.
2026-07-03 19:55:32,257 - optuna.study.study - INFO - Trial 226 finished with values: [0.028326793845153832, 0.006120471857606899, 0.01690680766742765] and parameters: {'n_layers': 1, 'embedding_dim': 256, 'lr': 0.0014333316079584322, 'lambda_val': 0.00015236573767345014, 'batch_size': 3960, 'optimizer': 'RMSprop'}.
2026-07-03 20:01:08,056 - optuna.study.study - INFO - Trial 227 finished with values: [0.013962599213055043, 0.003097277890697719, 0.008138461886130863] and parameters: {'n_layers': 3, 'embedding_dim': 64, 'lr': 0.0022700314607702445, 'lambda_val': 5.874173464438341e-05, 'batch_size': 2599, 'optimizer': 'RMSprop'}.
2026-07-03 20:06:20,479 - optuna.study.study - INFO - Trial 228 finished with values: [0.012739070398203826, 0.003197956043538552, 0.007817319642491454] and parameters: {'n_layers': 1, 'embedding_dim': 64, 'lr': 0.0014537114423835192, 'lambda_val': 3.7175116690643465e-05, 'batch_size': 950, 'optimizer': 'Adam'}.
2026-07-03 20:08:16,141 - experiment_functions - INFO - Early stopping at epoch 1350. Best Metrics: (0.00020424588245582362, 5.5088045894041e-05, 0.00011795176580399843)
2026-07-03 20:08:16,256 - optuna.study.study - INFO - Trial 229 finished with values: [0.00020424588245582362, 5.5088045894041e-05, 0.00011795176580399843] and parameters: {'n_layers': 2, 'embedding_dim': 96, 'lr': 1.1091299543378575e-05, 'lambda_val': 2.5379243415253125e-05, 'batch_size': 2508, 'optimizer': 'Adam'}.
2026-07-03 20:13:44,164 - optuna.study.study - INFO - Trial 230 finished with values: [0.025679636888069162, 0.005580039131508464, 0.015139094270584753] and parameters: {'n_layers': 1, 'embedding_dim': 96, 'lr': 0.0022700314607702445, 'lambda_val': 2.0533552356322422e-05, 'batch_size': 3121, 'optimizer': 'RMSprop'}.
2026-07-03 20:17:17,013 - experiment_functions - INFO - Early stopping at epoch 2600. Best Metrics: (0.00030616709486939564, 7.883289326216212e-05, 0.00017055507866148615)
2026-07-03 20:17:17,089 - optuna.study.study - INFO - Trial 231 finished with values: [0.00030616709486939564, 7.883289326216212e-05, 0.00017055507866148615] and parameters: {'n_layers': 1, 'embedding_dim': 128, 'lr': 0.00013300178641228856, 'lambda_val': 7.329771199139694e-05, 'batch_size': 3913, 'optimizer': 'RMSprop'}.
2026-07-03 20:22:51,423 - optuna.study.study - INFO - Trial 232 finished with values: [0.021696102306624082, 0.00495412495488479, 0.01321524400647884] and parameters: {'n_layers': 1, 'embedding_dim': 128, 'lr': 0.0014333316079584322, 'lambda_val': 7.33580764656977e-05, 'batch_size': 2111, 'optimizer': 'RMSprop'}.
2026-07-03 20:27:35,793 - experiment_functions - INFO - Early stopping at epoch 3450. Best Metrics: (0.023745070644438464, 0.005159280436145357, 0.014109309546736512)
