2026-07-01 17:55:17,886 - optuna.study.study - INFO - Trial 150 finished with values: [0.0025429522577474478, 0.0006648557263073913, 0.0016647205338628783] and parameters: {'n_layers': 4, 'embedding_dim': 32, 'lr': 0.0008102278066186573, 'lambda_val': 2.9125236439191383e-06, 'batch_size': 795, 'optimizer': 'RMSprop'}.
2026-07-01 17:59:28,570 - experiment_functions - INFO - Early stopping at epoch 3100. Best Metrics: (0.0002950093443396479, 7.598351157798758e-05, 0.0001576270675605872)
2026-07-01 17:59:28,648 - optuna.study.study - INFO - Trial 151 finished with values: [0.0002950093443396479, 7.598351157798758e-05, 0.0001576270675605872] and parameters: {'n_layers': 2, 'embedding_dim': 128, 'lr': 2.4161683093417925e-05, 'lambda_val': 6.5134158560038e-06, 'batch_size': 3567, 'optimizer': 'RMSprop'}.
2026-07-01 18:02:17,544 - experiment_functions - INFO - Early stopping at epoch 2300. Best Metrics: (0.002056380417526842, 0.0004540014816784758, 0.0012098604207481701)
2026-07-01 18:02:17,627 - optuna.study.study - INFO - Trial 152 finished with values: [0.002056380417526842, 0.0004540014816784758, 0.0012098604207481701] and parameters: {'n_layers': 1, 'embedding_dim': 32, 'lr': 0.0008549054963496413, 'lambda_val': 3.0256770800491656e-06, 'batch_size': 4034, 'optimizer': 'Adam'}.
2026-07-01 18:03:36,445 - experiment_functions - INFO - Early stopping at epoch 900. Best Metrics: (0.0025916597653783922, 0.0007132952149383583, 0.0017794339659097226)
2026-07-01 18:03:36,520 - optuna.study.study - INFO - Trial 153 finished with values: [0.0025916597653783922, 0.0007132952149383583, 0.0017794339659097226] and parameters: {'n_layers': 3, 'embedding_dim': 128, 'lr': 0.001878376227052758, 'lambda_val': 0.0012592144246174213, 'batch_size': 1470, 'optimizer': 'RMSprop'}.
2026-07-01 18:08:57,111 - experiment_functions - INFO - Early stopping at epoch 3800. Best Metrics: (0.002561175092871087, 0.0006696046957810156, 0.0016950130254070029)
2026-07-01 18:08:57,200 - optuna.study.study - INFO - Trial 154 finished with values: [0.002561175092871087, 0.0006696046957810156, 0.0016950130254070029] and parameters: {'n_layers': 3, 'embedding_dim': 128, 'lr': 0.0008549054963496413, 'lambda_val': 0.0006778527201004557, 'batch_size': 1848, 'optimizer': 'Adam'}.
2026-07-01 18:09:48,419 - experiment_functions - INFO - Early stopping at epoch 500. Best Metrics: (0.00018666038101873648, 5.6987633683490685e-05, 0.00012098317786882074)
2026-07-01 18:09:48,506 - optuna.study.study - INFO - Trial 155 finished with values: [0.00018666038101873648, 5.6987633683490685e-05, 0.00012098317786882074] and parameters: {'n_layers': 3, 'embedding_dim': 256, 'lr': 0.001878376227052758, 'lambda_val': 3.747302157374259e-06, 'batch_size': 1661, 'optimizer': 'SGD'}.
2026-07-01 18:11:10,106 - experiment_functions - INFO - Early stopping at epoch 800. Best Metrics: (0.0021265637199201527, 0.0006268639705183975, 0.0014252246685232273)
2026-07-01 18:11:10,207 - optuna.study.study - INFO - Trial 156 finished with values: [0.0021265637199201527, 0.0006268639705183975, 0.0014252246685232273] and parameters: {'n_layers': 3, 'embedding_dim': 256, 'lr': 0.0030363640610353106, 'lambda_val': 0.00034740027371853627, 'batch_size': 1420, 'optimizer': 'RMSprop'}.
2026-07-01 18:13:03,868 - experiment_functions - INFO - Early stopping at epoch 1500. Best Metrics: (0.002518485556672293, 0.0006354121155709211, 0.001577977431809)
2026-07-01 18:13:03,958 - optuna.study.study - INFO - Trial 157 finished with values: [0.002518485556672293, 0.0006354121155709211, 0.001577977431809] and parameters: {'n_layers': 3, 'embedding_dim': 32, 'lr': 0.001878376227052758, 'lambda_val': 3.747302157374259e-06, 'batch_size': 3082, 'optimizer': 'RMSprop'}.
2026-07-01 18:14:30,106 - experiment_functions - INFO - Early stopping at epoch 800. Best Metrics: (0.0019450747264353582, 0.000574625306308531, 0.001377162485975321)
2026-07-01 18:14:30,198 - optuna.study.study - INFO - Trial 158 finished with values: [0.0019450747264353582, 0.000574625306308531, 0.001377162485975321] and parameters: {'n_layers': 4, 'embedding_dim': 256, 'lr': 0.019546253809520703, 'lambda_val': 3.747302157374259e-06, 'batch_size': 3544, 'optimizer': 'RMSprop'}.
2026-07-01 18:19:27,751 - optuna.study.study - INFO - Trial 159 finished with values: [0.0023910594310126744, 0.0006012195353608267, 0.0015895848571748999] and parameters: {'n_layers': 3, 'embedding_dim': 32, 'lr': 0.0008102278066186573, 'lambda_val': 2.0117688743440434e-05, 'batch_size': 2701, 'optimizer': 'Adam'}.
2026-07-01 18:20:28,909 - experiment_functions - INFO - Early stopping at epoch 550. Best Metrics: (0.002074370601271437, 0.0005803240696768802, 0.0013407444920470986)
2026-07-01 18:20:28,992 - optuna.study.study - INFO - Trial 160 finished with values: [0.002074370601271437, 0.0005803240696768802, 0.0013407444920470986] and parameters: {'n_layers': 4, 'embedding_dim': 256, 'lr': 0.021330846186373622, 'lambda_val': 1.413159904245194e-06, 'batch_size': 1100, 'optimizer': 'Adam'}.
2026-07-01 18:23:42,652 - experiment_functions - INFO - Early stopping at epoch 1950. Best Metrics: (0.002260567189166398, 0.0006525084056759682, 0.0015299076323554415)
2026-07-01 18:23:42,756 - optuna.study.study - INFO - Trial 161 finished with values: [0.002260567189166398, 0.0006525084056759682, 0.0015299076323554415] and parameters: {'n_layers': 3, 'embedding_dim': 256, 'lr': 0.0008102278066186573, 'lambda_val': 0.0006778527201004557, 'batch_size': 3927, 'optimizer': 'Adam'}.
2026-07-01 18:26:35,792 - experiment_functions - INFO - Early stopping at epoch 1650. Best Metrics: (0.0027379603945859045, 0.0007902285204110708, 0.0018259783873256425)
2026-07-01 18:26:35,886 - optuna.study.study - INFO - Trial 162 finished with values: [0.0027379603945859045, 0.0007902285204110708, 0.0018259783873256425] and parameters: {'n_layers': 4, 'embedding_dim': 256, 'lr': 0.001878376227052758, 'lambda_val': 3.747302157374259e-06, 'batch_size': 1100, 'optimizer': 'RMSprop'}.
2026-07-01 18:27:44,738 - experiment_functions - INFO - Early stopping at epoch 850. Best Metrics: (0.0024251316394830577, 0.0006734038713599149, 0.0016488058901348395)
2026-07-01 18:27:44,823 - optuna.study.study - INFO - Trial 163 finished with values: [0.0024251316394830577, 0.0006734038713599149, 0.0016488058901348395] and parameters: {'n_layers': 3, 'embedding_dim': 64, 'lr': 0.0030363640610353106, 'lambda_val': 0.0006778527201004557, 'batch_size': 1159, 'optimizer': 'RMSprop'}.
2026-07-01 18:29:20,512 - experiment_functions - INFO - Early stopping at epoch 950. Best Metrics: (0.0022741480640264006, 0.000667705107991566, 0.0015228441908350407)
2026-07-01 18:29:20,605 - optuna.study.study - INFO - Trial 164 finished with values: [0.0022741480640264006, 0.000667705107991566, 0.0015228441908350407] and parameters: {'n_layers': 3, 'embedding_dim': 256, 'lr': 0.001878376227052758, 'lambda_val': 0.0006778527201004557, 'batch_size': 525, 'optimizer': 'RMSprop'}.
2026-07-01 18:31:04,671 - experiment_functions - INFO - Early stopping at epoch 1200. Best Metrics: (0.001963739914554461, 0.0005670269551507323, 0.001308316884586475)
2026-07-01 18:31:04,758 - optuna.study.study - INFO - Trial 165 finished with values: [0.001963739914554461, 0.0005670269551507323, 0.001308316884586475] and parameters: {'n_layers': 3, 'embedding_dim': 128, 'lr': 0.0016422068986048546, 'lambda_val': 0.0055410884689056725, 'batch_size': 1159, 'optimizer': 'Adam'}.
2026-07-01 18:33:17,943 - experiment_functions - INFO - Early stopping at epoch 1750. Best Metrics: (0.00023283605306068125, 5.8887221472940384e-05, 0.00012909048043226081)
2026-07-01 18:33:18,012 - optuna.study.study - INFO - Trial 166 finished with values: [0.00023283605306068125, 5.8887221472940384e-05, 0.00012909048043226081] and parameters: {'n_layers': 4, 'embedding_dim': 32, 'lr': 3.524212728720262e-05, 'lambda_val': 3.747302157374259e-06, 'batch_size': 3927, 'optimizer': 'Adam'}.
2026-07-01 18:37:23,467 - experiment_functions - INFO - Early stopping at epoch 2500. Best Metrics: (0.002633177408486118, 0.0007474877951484529, 0.0016802066428936635)
2026-07-01 18:37:23,572 - optuna.study.study - INFO - Trial 167 finished with values: [0.002633177408486118, 0.0007474877951484529, 0.0016802066428936635] and parameters: {'n_layers': 3, 'embedding_dim': 256, 'lr': 0.0020091203438644, 'lambda_val': 1.1427509100447198e-06, 'batch_size': 2726, 'optimizer': 'RMSprop'}.
2026-07-01 18:39:03,897 - experiment_functions - INFO - Early stopping at epoch 1200. Best Metrics: (0.002036667442718313, 0.000568926542940182, 0.0014059028121956993)
2026-07-01 18:39:03,993 - optuna.study.study - INFO - Trial 168 finished with values: [0.002036667442718313, 0.000568926542940182, 0.0014059028121956993] and parameters: {'n_layers': 2, 'embedding_dim': 128, 'lr': 0.0030363640610353106, 'lambda_val': 3.9837177447581685e-05, 'batch_size': 3567, 'optimizer': 'RMSprop'}.
2026-07-01 18:39:47,594 - experiment_functions - INFO - Early stopping at epoch 500. Best Metrics: (0.0002798904450223231, 7.88328932621621e-05, 0.00017118487798887676)
2026-07-01 18:39:47,686 - optuna.study.study - INFO - Trial 169 finished with values: [0.0002798904450223231, 7.88328932621621e-05, 0.00017118487798887676] and parameters: {'n_layers': 3, 'embedding_dim': 96, 'lr': 0.0030363640610353106, 'lambda_val': 0.0006778527201004557, 'batch_size': 3425, 'optimizer': 'SGD'}.
2026-07-01 18:45:25,034 - optuna.study.study - INFO - Trial 170 finished with values: [0.002487767697827992, 0.0006677051079915658, 0.001691057414578333] and parameters: {'n_layers': 3, 'embedding_dim': 128, 'lr': 0.0008423328164015242, 'lambda_val': 0.0006778527201004557, 'batch_size': 1159, 'optimizer': 'Adam'}.
2026-07-01 18:47:05,351 - experiment_functions - INFO - Early stopping at epoch 1250. Best Metrics: (0.0019751554834059955, 0.00047299735957297275, 0.0013213222544493546)
2026-07-01 18:47:05,439 - optuna.study.study - INFO - Trial 171 finished with values: [0.0019751554834059955, 0.00047299735957297275, 0.0013213222544493546] and parameters: {'n_layers': 1, 'embedding_dim': 128, 'lr': 0.001878376227052758, 'lambda_val': 8.805105847994294e-05, 'batch_size': 4034, 'optimizer': 'RMSprop'}.
2026-07-01 18:48:23,284 - experiment_functions - INFO - Early stopping at epoch 950. Best Metrics: (0.0019666074367318334, 0.0005337841688353627, 0.0013848162820222045)
2026-07-01 18:48:23,364 - optuna.study.study - INFO - Trial 172 finished with values: [0.0019666074367318334, 0.0005337841688353627, 0.0013848162820222045] and parameters: {'n_layers': 2, 'embedding_dim': 96, 'lr': 0.001878376227052758, 'lambda_val': 0.0012592144246174213, 'batch_size': 3101, 'optimizer': 'RMSprop'}.
2026-07-01 18:49:15,078 - experiment_functions - INFO - Early stopping at epoch 550. Best Metrics: (0.0017188486286643131, 0.0004881940618885701, 0.0011357252127502733)
2026-07-01 18:49:15,184 - optuna.study.study - INFO - Trial 173 finished with values: [0.0017188486286643131, 0.0004881940618885701, 0.0011357252127502733] and parameters: {'n_layers': 4, 'embedding_dim': 128, 'lr': 0.024179138310396777, 'lambda_val': 0.0006778527201004557, 'batch_size': 529, 'optimizer': 'Adam'}.
2026-07-01 18:53:06,453 - experiment_functions - INFO - Early stopping at epoch 3100. Best Metrics: (0.0021242889360888924, 0.0005214368482039398, 0.001357888638087007)
2026-07-01 18:53:06,536 - optuna.study.study - INFO - Trial 174 finished with values: [0.0021242889360888924, 0.0005214368482039398, 0.001357888638087007] and parameters: {'n_layers': 3, 'embedding_dim': 32, 'lr': 0.0008102278066186573, 'lambda_val': 2.9125236439191383e-06, 'batch_size': 2701, 'optimizer': 'Adam'}.
2026-07-01 18:55:45,275 - experiment_functions - INFO - Early stopping at epoch 1600. Best Metrics: (0.002559233942978816, 0.0007427388256748287, 0.0016946111714490138)
2026-07-01 18:55:45,354 - optuna.study.study - INFO - Trial 175 finished with values: [0.002559233942978816, 0.0007427388256748287, 0.0016946111714490138] and parameters: {'n_layers': 3, 'embedding_dim': 256, 'lr': 0.001878376227052758, 'lambda_val': 3.747302157374259e-06, 'batch_size': 3544, 'optimizer': 'RMSprop'}.
2026-07-01 18:58:44,219 - experiment_functions - INFO - Early stopping at epoch 2100. Best Metrics: (0.0029734799402763986, 0.0008434169785156621, 0.0020339111084882026)
2026-07-01 18:58:44,307 - optuna.study.study - INFO - Trial 176 finished with values: [0.0029734799402763986, 0.0008434169785156621, 0.0020339111084882026] and parameters: {'n_layers': 3, 'embedding_dim': 128, 'lr': 0.001878376227052758, 'lambda_val': 1.1327416378479618e-05, 'batch_size': 1100, 'optimizer': 'RMSprop'}.
2026-07-01 19:02:38,124 - experiment_functions - INFO - Early stopping at epoch 3100. Best Metrics: (0.002939567349978089, 0.0007607849096746006, 0.0019006352457484044)
2026-07-01 19:02:38,206 - optuna.study.study - INFO - Trial 177 finished with values: [0.002939567349978089, 0.0007607849096746006, 0.0019006352457484044] and parameters: {'n_layers': 4, 'embedding_dim': 32, 'lr': 0.0008102278066186573, 'lambda_val': 0.0012592144246174213, 'batch_size': 2701, 'optimizer': 'RMSprop'}.
2026-07-01 19:03:44,427 - experiment_functions - INFO - Early stopping at epoch 750. Best Metrics: (0.00019054643789476574, 5.0339076420416775e-05, 9.966446907671736e-05)
2026-07-01 19:03:44,522 - optuna.study.study - INFO - Trial 178 finished with values: [0.00019054643789476574, 5.0339076420416775e-05, 9.966446907671736e-05] and parameters: {'n_layers': 3, 'embedding_dim': 128, 'lr': 1.941760337128785e-05, 'lambda_val': 3.1335017132005896e-06, 'batch_size': 1965, 'optimizer': 'RMSprop'}.
2026-07-01 19:05:05,846 - experiment_functions - INFO - Early stopping at epoch 1050. Best Metrics: (0.0019006679334408058, 0.0004919932374674695, 0.0012831527648111652)
2026-07-01 19:05:05,937 - optuna.study.study - INFO - Trial 179 finished with values: [0.0019006679334408058, 0.0004919932374674695, 0.0012831527648111652] and parameters: {'n_layers': 3, 'embedding_dim': 32, 'lr': 0.001878376227052758, 'lambda_val': 0.0012592144246174213, 'batch_size': 3082, 'optimizer': 'Adam'}.
2026-07-01 19:10:46,325 - experiment_functions - INFO - Early stopping at epoch 3900. Best Metrics: (0.0023961537613094936, 0.0006677051079915658, 0.0016404331412381223)
2026-07-01 19:10:46,418 - optuna.study.study - INFO - Trial 180 finished with values: [0.0023961537613094936, 0.0006677051079915658, 0.0016404331412381223] and parameters: {'n_layers': 4, 'embedding_dim': 128, 'lr': 0.00034173428273577447, 'lambda_val': 1.413159904245194e-06, 'batch_size': 3604, 'optimizer': 'RMSprop'}.
2026-07-01 19:12:43,281 - experiment_functions - INFO - Early stopping at epoch 1350. Best Metrics: (0.002348090002639672, 0.0006572573751495926, 0.0015334183940355344)
2026-07-01 19:12:43,358 - optuna.study.study - INFO - Trial 181 finished with values: [0.002348090002639672, 0.0006572573751495926, 0.0015334183940355344] and parameters: {'n_layers': 3, 'embedding_dim': 128, 'lr': 0.0030363640610353106, 'lambda_val': 6.5134158560038e-06, 'batch_size': 880, 'optimizer': 'Adam'}.
2026-07-01 19:17:02,157 - experiment_functions - INFO - Early stopping at epoch 3450. Best Metrics: (0.002507833994398802, 0.0006468096423076193, 0.0015774642719131224)
2026-07-01 19:17:02,246 - optuna.study.study - INFO - Trial 182 finished with values: [0.002507833994398802, 0.0006468096423076193, 0.0015774642719131224] and parameters: {'n_layers': 4, 'embedding_dim': 32, 'lr': 0.0008423328164015242, 'lambda_val': 3.1335017132005896e-06, 'batch_size': 1965, 'optimizer': 'Adam'}.
2026-07-01 19:20:24,003 - experiment_functions - INFO - Early stopping at epoch 2350. Best Metrics: (0.001826841199112322, 0.0005290351993617386, 0.001274314132305204)
2026-07-01 19:20:24,242 - optuna.study.study - INFO - Trial 183 finished with values: [0.001826841199112322, 0.0005290351993617386, 0.001274314132305204] and parameters: {'n_layers': 1, 'embedding_dim': 256, 'lr': 0.0030363640610353106, 'lambda_val': 6.5134158560038e-06, 'batch_size': 3125, 'optimizer': 'RMSprop'}.
2026-07-01 19:24:10,518 - experiment_functions - INFO - Early stopping at epoch 2700. Best Metrics: (0.002680236903437853, 0.0007778811997796477, 0.0018345756073296009)
2026-07-01 19:24:10,604 - optuna.study.study - INFO - Trial 184 finished with values: [0.002680236903437853, 0.0007778811997796477, 0.0018345756073296009] and parameters: {'n_layers': 4, 'embedding_dim': 96, 'lr': 0.0008423328164015242, 'lambda_val': 3.1335017132005896e-06, 'batch_size': 2924, 'optimizer': 'Adam'}.
2026-07-01 19:25:28,834 - experiment_functions - INFO - Early stopping at epoch 1000. Best Metrics: (0.002397454123806331, 0.0007170943905172579, 0.0017203803335088764)
2026-07-01 19:25:28,917 - optuna.study.study - INFO - Trial 185 finished with values: [0.002397454123806331, 0.0007170943905172579, 0.0017203803335088764] and parameters: {'n_layers': 4, 'embedding_dim': 32, 'lr': 0.0030363640610353106, 'lambda_val': 3.9837177447581685e-05, 'batch_size': 2701, 'optimizer': 'RMSprop'}.
2026-07-01 19:26:28,974 - experiment_functions - INFO - Early stopping at epoch 650. Best Metrics: (0.0012328941342606224, 0.00041790931367893173, 0.0008970827507225833)
2026-07-01 19:26:29,067 - optuna.study.study - INFO - Trial 186 finished with values: [0.0012328941342606224, 0.00041790931367893173, 0.0008970827507225833] and parameters: {'n_layers': 4, 'embedding_dim': 128, 'lr': 0.0030363640610353106, 'lambda_val': 0.038466085692524764, 'batch_size': 3125, 'optimizer': 'RMSprop'}.
2026-07-01 19:33:01,259 - optuna.study.study - INFO - Trial 187 finished with values: [0.002165685790552789, 0.0005850730391505043, 0.0014681969999558169] and parameters: {'n_layers': 3, 'embedding_dim': 256, 'lr': 0.0008102278066186573, 'lambda_val': 0.0006778527201004557, 'batch_size': 880, 'optimizer': 'Adam'}.
2026-07-01 19:36:45,138 - experiment_functions - INFO - Early stopping at epoch 2250. Best Metrics: (0.0021772753345153306, 0.0006287635583078472, 0.0014762957744252903)
2026-07-01 19:36:45,330 - optuna.study.study - INFO - Trial 188 finished with values: [0.0021772753345153306, 0.0006287635583078472, 0.0014762957744252903] and parameters: {'n_layers': 3, 'embedding_dim': 256, 'lr': 0.0008102278066186573, 'lambda_val': 0.0006778527201004557, 'batch_size': 2883, 'optimizer': 'Adam'}.
2026-07-01 19:40:17,329 - experiment_functions - INFO - Early stopping at epoch 2150. Best Metrics: (0.0027609922381019083, 0.0008206219250422659, 0.0018308061571303247)
2026-07-01 19:40:17,439 - optuna.study.study - INFO - Trial 189 finished with values: [0.0027609922381019083, 0.0008206219250422659, 0.0018308061571303247] and parameters: {'n_layers': 3, 'embedding_dim': 256, 'lr': 0.001878376227052758, 'lambda_val': 3.747302157374259e-06, 'batch_size': 1100, 'optimizer': 'RMSprop'}.
2026-07-01 19:46:50,315 - optuna.study.study - INFO - Trial 190 finished with values: [0.002506124847408099, 0.0006867009858860628, 0.001639819302483448] and parameters: {'n_layers': 3, 'embedding_dim': 256, 'lr': 0.0008423328164015242, 'lambda_val': 3.1335017132005896e-06, 'batch_size': 1965, 'optimizer': 'Adam'}.
2026-07-01 19:51:50,758 - optuna.study.study - INFO - Trial 191 finished with values: [0.002819279073822867, 0.0007322910928328554, 0.0019029963987400064] and parameters: {'n_layers': 4, 'embedding_dim': 32, 'lr': 0.0008102278066186573, 'lambda_val': 3.0256770800491656e-06, 'batch_size': 2003, 'optimizer': 'RMSprop'}.
2026-07-01 19:53:12,874 - experiment_functions - INFO - Early stopping at epoch 800. Best Metrics: (0.0022025234828854817, 0.0006401610850445454, 0.001439006536761934)
2026-07-01 19:53:12,990 - optuna.study.study - INFO - Trial 192 finished with values: [0.0022025234828854817, 0.0006401610850445454, 0.001439006536761934] and parameters: {'n_layers': 3, 'embedding_dim': 256, 'lr': 0.006376466713326958, 'lambda_val': 8.805105847994294e-05, 'batch_size': 1848, 'optimizer': 'Adam'}.
2026-07-01 19:55:25,369 - experiment_functions - INFO - Early stopping at epoch 1750. Best Metrics: (0.002684312402111593, 0.0007123454210436335, 0.0017328633536601414)
2026-07-01 19:55:25,475 - optuna.study.study - INFO - Trial 193 finished with values: [0.002684312402111593, 0.0007123454210436335, 0.0017328633536601414] and parameters: {'n_layers': 3, 'embedding_dim': 32, 'lr': 0.001878376227052758, 'lambda_val': 3.747302157374259e-06, 'batch_size': 1661, 'optimizer': 'RMSprop'}.
2026-07-01 20:00:22,812 - optuna.study.study - INFO - Trial 194 finished with values: [0.002452358824538708, 0.000593621184203028, 0.0015769503326625567] and parameters: {'n_layers': 3, 'embedding_dim': 32, 'lr': 0.0008102278066186573, 'lambda_val': 8.805105847994294e-05, 'batch_size': 4034, 'optimizer': 'RMSprop'}.
2026-07-01 20:01:54,037 - experiment_functions - INFO - Early stopping at epoch 1050. Best Metrics: (0.0009246759419120974, 0.0003352772448378703, 0.0006692501368630694)
2026-07-01 20:01:54,646 - optuna.study.study - INFO - Trial 195 finished with values: [0.0009246759419120974, 0.0003352772448378703, 0.0006692501368630694] and parameters: {'n_layers': 3, 'embedding_dim': 128, 'lr': 0.016005301810040378, 'lambda_val': 0.03606522558568367, 'batch_size': 3062, 'optimizer': 'RMSprop'}.
2026-07-01 20:06:51,505 - optuna.study.study - INFO - Trial 196 finished with values: [0.002064789638205321, 0.0005052903519936174, 0.0013544886119740854] and parameters: {'n_layers': 3, 'embedding_dim': 32, 'lr': 0.0008102278066186573, 'lambda_val': 0.0006778527201004557, 'batch_size': 880, 'optimizer': 'Adam'}.
2026-07-01 20:08:03,390 - experiment_functions - INFO - Early stopping at epoch 850. Best Metrics: (0.002272375453225745, 0.0006753034591493646, 0.0015967099526725355)
