2026-06-29 20:04:21,807 - optuna.study.study - INFO - Trial 298 finished with values: [0.003411183519224552, 0.0010181790551450336, 0.0023129815481040847] and parameters: {'n_layers': 1, 'embedding_dim': 128, 'lr': 0.0013135077251507194, 'lambda_val': 0.0004244982241785935, 'batch_size': 736, 'optimizer': 'Adam'}.
2026-06-29 20:05:39,087 - experiment_functions - INFO - Early stopping at epoch 950. Best Metrics: (0.0032402320653900094, 0.000983986474934939, 0.002231230437365806)
2026-06-29 20:05:39,189 - optuna.study.study - INFO - Trial 299 finished with values: [0.0032402320653900094, 0.000983986474934939, 0.002231230437365806] and parameters: {'n_layers': 1, 'embedding_dim': 128, 'lr': 0.0013135077251507194, 'lambda_val': 3.159634083184005e-05, 'batch_size': 1473, 'optimizer': 'Adam'}.
2026-06-29 20:05:39,204 - root - INFO - Selected Trial 298 based on Max ndcg: 0.0023
2026-06-29 20:05:39,204 - root - INFO - Associated Recall: 0.0034
2026-06-29 20:05:39,204 - experiment_functions - INFO - Training the best model ... for e_amazon_1c1dcs_strict
2026-06-29 20:07:14,783 - experiment_functions - INFO - Early stopping at epoch 1200. Best Metrics: (0.0029480710058757843, 0.0009345971924092473, 0.0021141484831235834)
2026-06-29 20:07:21,739 - root - INFO -   **** Training e_amazon_1c1dcs_strict_rand1
2026-06-29 20:07:21,773 - root - INFO -   **** Getting 88982/2429444 random edges
2026-06-29 20:07:21,930 - optuna.storages._rdb.storage - INFO - A new study created in RDB with name: Study_e_amazon_1c1dcs_strict_rand1
2026-06-29 20:09:21,047 - experiment_functions - INFO - Early stopping at epoch 1500. Best Metrics: (0.00133968456826902, 0.0004473529244154018, 0.0009499928322566773)
2026-06-29 20:09:21,159 - optuna.study.study - INFO - Trial 0 finished with values: [0.00133968456826902, 0.0004473529244154018, 0.0009499928322566773] and parameters: {'n_layers': 1, 'embedding_dim': 128, 'lr': 0.0130511149893422, 'lambda_val': 0.0027740064296835685, 'batch_size': 3636, 'optimizer': 'RMSprop'}.
2026-06-29 20:12:03,964 - experiment_functions - INFO - Early stopping at epoch 2050. Best Metrics: (0.0016566939703004536, 0.0004682483900993485, 0.0010950192162916767)
2026-06-29 20:12:04,111 - optuna.study.study - INFO - Trial 1 finished with values: [0.0016566939703004536, 0.0004682483900993485, 0.0010950192162916767] and parameters: {'n_layers': 2, 'embedding_dim': 96, 'lr': 0.002162643106738779, 'lambda_val': 0.007054089513088074, 'batch_size': 620, 'optimizer': 'Adam'}.
2026-06-29 20:12:45,115 - experiment_functions - INFO - Early stopping at epoch 500. Best Metrics: (0.00021002628664425335, 5.983701536766521e-05, 0.00012325734249864602)
2026-06-29 20:12:45,259 - optuna.study.study - INFO - Trial 2 finished with values: [0.00021002628664425335, 5.983701536766521e-05, 0.00012325734249864602] and parameters: {'n_layers': 2, 'embedding_dim': 64, 'lr': 0.00011992795516299757, 'lambda_val': 0.06711003411279684, 'batch_size': 3213, 'optimizer': 'SGD'}.
2026-06-29 20:13:29,031 - experiment_functions - INFO - Early stopping at epoch 500. Best Metrics: (0.00014929093989027808, 3.989134357844348e-05, 8.339472220393182e-05)
2026-06-29 20:13:29,194 - optuna.study.study - INFO - Trial 3 finished with values: [0.00014929093989027808, 3.989134357844348e-05, 8.339472220393182e-05] and parameters: {'n_layers': 3, 'embedding_dim': 96, 'lr': 0.014551707768909915, 'lambda_val': 0.06442473755191683, 'batch_size': 3396, 'optimizer': 'SGD'}.
2026-06-29 20:14:42,672 - experiment_functions - INFO - Early stopping at epoch 850. Best Metrics: (0.000258076557047795, 6.078680926239006e-05, 0.0001470674084785039)
2026-06-29 20:14:42,782 - optuna.study.study - INFO - Trial 4 finished with values: [0.000258076557047795, 6.078680926239006e-05, 0.0001470674084785039] and parameters: {'n_layers': 4, 'embedding_dim': 96, 'lr': 3.8334407047671796e-05, 'lambda_val': 0.0019420686804081744, 'batch_size': 1212, 'optimizer': 'Adam'}.
2026-06-29 20:20:54,472 - experiment_functions - INFO - Early stopping at epoch 3750. Best Metrics: (0.003084810104815171, 0.0008890070854624546, 0.0020184955824059147)
2026-06-29 20:20:54,591 - optuna.study.study - INFO - Trial 5 finished with values: [0.003084810104815171, 0.0008890070854624546, 0.0020184955824059147] and parameters: {'n_layers': 3, 'embedding_dim': 256, 'lr': 0.0013047089047836713, 'lambda_val': 2.199939619081897e-06, 'batch_size': 620, 'optimizer': 'RMSprop'}.
2026-06-29 20:21:50,469 - experiment_functions - INFO - Early stopping at epoch 650. Best Metrics: (0.0016886952594818562, 0.0005090895275725168, 0.0011603069372168766)
2026-06-29 20:21:50,580 - optuna.study.study - INFO - Trial 6 finished with values: [0.0016886952594818562, 0.0005090895275725168, 0.0011603069372168766] and parameters: {'n_layers': 3, 'embedding_dim': 96, 'lr': 0.021245875855951238, 'lambda_val': 5.263043696503393e-06, 'batch_size': 3028, 'optimizer': 'RMSprop'}.
2026-06-29 20:27:03,444 - optuna.study.study - INFO - Trial 7 finished with values: [0.0011481440036240082, 0.0002782896111543795, 0.0007243983663953548] and parameters: {'n_layers': 4, 'embedding_dim': 64, 'lr': 0.0003490110805607246, 'lambda_val': 9.11215958956445e-06, 'batch_size': 1195, 'optimizer': 'Adam'}.
2026-06-29 20:27:43,525 - experiment_functions - INFO - Early stopping at epoch 500. Best Metrics: (0.00019197037148486627, 5.223866420986646e-05, 0.0001180728155930774)
2026-06-29 20:27:44,276 - optuna.study.study - INFO - Trial 8 finished with values: [0.00019197037148486627, 5.223866420986646e-05, 0.0001180728155930774] and parameters: {'n_layers': 2, 'embedding_dim': 32, 'lr': 0.014434528671230492, 'lambda_val': 0.01605709757307348, 'batch_size': 1447, 'optimizer': 'SGD'}.
2026-06-29 20:28:27,907 - experiment_functions - INFO - Early stopping at epoch 550. Best Metrics: (0.001102370852457186, 0.0003067834279961248, 0.0007208174342826781)
2026-06-29 20:28:28,017 - optuna.study.study - INFO - Trial 9 finished with values: [0.001102370852457186, 0.0003067834279961248, 0.0007208174342826781] and parameters: {'n_layers': 2, 'embedding_dim': 32, 'lr': 0.011476202823028593, 'lambda_val': 0.0034877418541278907, 'batch_size': 594, 'optimizer': 'RMSprop'}.
2026-06-29 20:34:15,966 - optuna.study.study - INFO - Trial 10 finished with values: [0.00042188892348171014, 0.00010732671010390746, 0.00023136315253820912] and parameters: {'n_layers': 4, 'embedding_dim': 128, 'lr': 0.0001512479598847229, 'lambda_val': 4.420361838456624e-06, 'batch_size': 1257, 'optimizer': 'Adam'}.
2026-06-29 20:37:44,558 - experiment_functions - INFO - Early stopping at epoch 2800. Best Metrics: (0.00031366568635400144, 6.933495431491366e-05, 0.00016096422491762306)
2026-06-29 20:37:44,658 - optuna.study.study - INFO - Trial 11 finished with values: [0.00031366568635400144, 6.933495431491366e-05, 0.00016096422491762306] and parameters: {'n_layers': 3, 'embedding_dim': 32, 'lr': 2.1248407593341864e-05, 'lambda_val': 8.836039936622865e-05, 'batch_size': 3396, 'optimizer': 'Adam'}.
2026-06-29 20:38:31,390 - experiment_functions - INFO - Early stopping at epoch 500. Best Metrics: (0.0002587102788634832, 6.268639705183975e-05, 0.00015677933604514105)
2026-06-29 20:38:31,494 - optuna.study.study - INFO - Trial 12 finished with values: [0.0002587102788634832, 6.268639705183975e-05, 0.00015677933604514105] and parameters: {'n_layers': 4, 'embedding_dim': 128, 'lr': 0.0008813727724231659, 'lambda_val': 1.582941209280553e-06, 'batch_size': 1347, 'optimizer': 'SGD'}.
2026-06-29 20:39:23,151 - experiment_functions - INFO - Early stopping at epoch 600. Best Metrics: (0.0020051982067140492, 0.0005622779856771081, 0.0013402082476569438)
2026-06-29 20:39:23,259 - optuna.study.study - INFO - Trial 13 finished with values: [0.0020051982067140492, 0.0005622779856771081, 0.0013402082476569438] and parameters: {'n_layers': 3, 'embedding_dim': 96, 'lr': 0.005817892184311597, 'lambda_val': 0.0005613082418791808, 'batch_size': 1698, 'optimizer': 'RMSprop'}.
2026-06-29 20:40:05,669 - experiment_functions - INFO - Early stopping at epoch 500. Best Metrics: (0.0002049925292790167, 5.223866420986645e-05, 0.00012114150445174479)
2026-06-29 20:40:05,771 - optuna.study.study - INFO - Trial 14 finished with values: [0.0002049925292790167, 5.223866420986645e-05, 0.00012114150445174479] and parameters: {'n_layers': 2, 'embedding_dim': 96, 'lr': 7.681694009457745e-05, 'lambda_val': 0.07386529854807705, 'batch_size': 760, 'optimizer': 'SGD'}.
2026-06-29 20:40:57,027 - experiment_functions - INFO - Early stopping at epoch 500. Best Metrics: (0.0002273964618151263, 6.268639705183976e-05, 0.00014099144464264703)
2026-06-29 20:40:57,442 - optuna.study.study - INFO - Trial 15 finished with values: [0.0002273964618151263, 6.268639705183976e-05, 0.00014099144464264703] and parameters: {'n_layers': 3, 'embedding_dim': 256, 'lr': 2.2358086910332184e-05, 'lambda_val': 2.017370351964727e-06, 'batch_size': 1370, 'optimizer': 'SGD'}.
2026-06-29 20:41:38,543 - experiment_functions - INFO - Early stopping at epoch 500. Best Metrics: (0.0007560848077358887, 0.00018995877894496894, 0.000550839916130012)
2026-06-29 20:41:38,645 - optuna.study.study - INFO - Trial 16 finished with values: [0.0007560848077358887, 0.00018995877894496894, 0.000550839916130012] and parameters: {'n_layers': 4, 'embedding_dim': 32, 'lr': 0.0805756094721334, 'lambda_val': 0.0020972307253449636, 'batch_size': 2404, 'optimizer': 'RMSprop'}.
2026-06-29 20:42:18,924 - experiment_functions - INFO - Early stopping at epoch 500. Best Metrics: (0.00016612111114763198, 4.46403130520677e-05, 9.689131234098018e-05)
2026-06-29 20:42:19,282 - optuna.study.study - INFO - Trial 17 finished with values: [0.00016612111114763198, 4.46403130520677e-05, 9.689131234098018e-05] and parameters: {'n_layers': 3, 'embedding_dim': 32, 'lr': 1.9553689513569963e-05, 'lambda_val': 0.052526207766869525, 'batch_size': 2415, 'optimizer': 'SGD'}.
2026-06-29 20:43:03,631 - experiment_functions - INFO - Early stopping at epoch 550. Best Metrics: (0.0011247953292835042, 0.0003153315730486485, 0.0007784575315292253)
2026-06-29 20:43:03,725 - optuna.study.study - INFO - Trial 18 finished with values: [0.0011247953292835042, 0.0003153315730486485, 0.0007784575315292253] and parameters: {'n_layers': 3, 'embedding_dim': 32, 'lr': 0.03313828779830453, 'lambda_val': 3.964043067637162e-05, 'batch_size': 3704, 'optimizer': 'RMSprop'}.
2026-06-29 20:48:04,971 - optuna.study.study - INFO - Trial 19 finished with values: [0.0007524319193234521, 0.0001871093972607944, 0.0004976347356443744] and parameters: {'n_layers': 1, 'embedding_dim': 96, 'lr': 0.00019631821053048875, 'lambda_val': 0.0007016033312988068, 'batch_size': 3942, 'optimizer': 'RMSprop'}.
2026-06-29 20:50:24,339 - experiment_functions - INFO - Early stopping at epoch 1750. Best Metrics: (0.0010262773950562556, 0.00036662044336379003, 0.0007349198322180546)
2026-06-29 20:50:24,428 - optuna.study.study - INFO - Trial 20 finished with values: [0.0010262773950562556, 0.00036662044336379003, 0.0007349198322180546] and parameters: {'n_layers': 2, 'embedding_dim': 96, 'lr': 0.03546323220167286, 'lambda_val': 0.05204272963685584, 'batch_size': 3492, 'optimizer': 'Adam'}.
2026-06-29 20:51:05,193 - experiment_functions - INFO - Early stopping at epoch 500. Best Metrics: (0.00014814702333212663, 6.363619094656459e-05, 0.00011397118915562257)
2026-06-29 20:51:05,602 - optuna.study.study - INFO - Trial 21 finished with values: [0.00014814702333212663, 6.363619094656459e-05, 0.00011397118915562257] and parameters: {'n_layers': 3, 'embedding_dim': 32, 'lr': 0.0003618879891598983, 'lambda_val': 0.018267112267904173, 'batch_size': 2559, 'optimizer': 'SGD'}.
2026-06-29 20:52:03,629 - experiment_functions - INFO - Early stopping at epoch 550. Best Metrics: (0.0016684089617039534, 0.0005052903519936174, 0.001156129167103393)
2026-06-29 20:52:03,762 - optuna.study.study - INFO - Trial 22 finished with values: [0.0016684089617039534, 0.0005052903519936174, 0.001156129167103393] and parameters: {'n_layers': 3, 'embedding_dim': 256, 'lr': 0.02833621835555532, 'lambda_val': 1.554897118169841e-06, 'batch_size': 2664, 'optimizer': 'Adam'}.
2026-06-29 20:57:20,298 - experiment_functions - INFO - Early stopping at epoch 3950. Best Metrics: (0.000555707943524923, 0.00012727238189312918, 0.0002996046840152699)
2026-06-29 20:57:20,377 - optuna.study.study - INFO - Trial 23 finished with values: [0.000555707943524923, 0.00012727238189312918, 0.0002996046840152699] and parameters: {'n_layers': 2, 'embedding_dim': 128, 'lr': 0.00015494413902254658, 'lambda_val': 0.0002476989748552402, 'batch_size': 2719, 'optimizer': 'RMSprop'}.
2026-06-29 20:59:55,315 - experiment_functions - INFO - Early stopping at epoch 1750. Best Metrics: (0.001087104521951443, 0.00036852003115323977, 0.0007342196614851617)
2026-06-29 20:59:55,393 - optuna.study.study - INFO - Trial 24 finished with values: [0.001087104521951443, 0.00036852003115323977, 0.0007342196614851617] and parameters: {'n_layers': 4, 'embedding_dim': 128, 'lr': 0.09031528723133264, 'lambda_val': 0.004495593710473149, 'batch_size': 4019, 'optimizer': 'Adam'}.
2026-06-29 21:03:58,807 - experiment_functions - INFO - Early stopping at epoch 2850. Best Metrics: (0.0003457077337273975, 8.45316566305112e-05, 0.00019098143288400328)
2026-06-29 21:03:58,891 - optuna.study.study - INFO - Trial 25 finished with values: [0.0003457077337273975, 8.45316566305112e-05, 0.00019098143288400328] and parameters: {'n_layers': 1, 'embedding_dim': 256, 'lr': 8.512320311318756e-05, 'lambda_val': 3.7880051097542987e-06, 'batch_size': 1720, 'optimizer': 'Adam'}.
2026-06-29 21:05:00,254 - experiment_functions - INFO - Early stopping at epoch 550. Best Metrics: (0.0019486845720070435, 0.0005717759246243565, 0.0013074825234339993)
2026-06-29 21:05:00,375 - optuna.study.study - INFO - Trial 26 finished with values: [0.0019486845720070435, 0.0005717759246243565, 0.0013074825234339993] and parameters: {'n_layers': 4, 'embedding_dim': 256, 'lr': 0.022884196889134636, 'lambda_val': 4.633424237648058e-05, 'batch_size': 2264, 'optimizer': 'Adam'}.
2026-06-29 21:06:36,773 - experiment_functions - INFO - Early stopping at epoch 1100. Best Metrics: (0.0017366411693938804, 0.00047679653515187207, 0.0011850668546858438)
2026-06-29 21:06:36,875 - optuna.study.study - INFO - Trial 27 finished with values: [0.0017366411693938804, 0.00047679653515187207, 0.0011850668546858438] and parameters: {'n_layers': 1, 'embedding_dim': 256, 'lr': 0.003551859771094245, 'lambda_val': 0.0005400904118495423, 'batch_size': 761, 'optimizer': 'RMSprop'}.
2026-06-29 21:07:19,212 - experiment_functions - INFO - Early stopping at epoch 500. Best Metrics: (0.00019845324063560708, 6.078680926239006e-05, 0.00012243368402012252)
2026-06-29 21:07:19,316 - optuna.study.study - INFO - Trial 28 finished with values: [0.00019845324063560708, 6.078680926239006e-05, 0.00012243368402012252] and parameters: {'n_layers': 2, 'embedding_dim': 96, 'lr': 0.010554669828805114, 'lambda_val': 0.01317810312772217, 'batch_size': 1505, 'optimizer': 'SGD'}.
2026-06-29 21:09:27,892 - experiment_functions - INFO - Early stopping at epoch 1700. Best Metrics: (0.0002370787720947646, 5.698763368349067e-05, 0.00014455825525209066)
2026-06-29 21:09:27,991 - optuna.study.study - INFO - Trial 29 finished with values: [0.0002370787720947646, 5.698763368349067e-05, 0.00014455825525209066] and parameters: {'n_layers': 4, 'embedding_dim': 32, 'lr': 4.1984616338291605e-05, 'lambda_val': 0.0001412866336858831, 'batch_size': 2402, 'optimizer': 'RMSprop'}.
2026-06-29 21:14:29,564 - optuna.study.study - INFO - Trial 30 finished with values: [0.0025229580467432287, 0.0006477594362023441, 0.0016919913784446427] and parameters: {'n_layers': 2, 'embedding_dim': 64, 'lr': 0.0009496158639399897, 'lambda_val': 3.423463120625302e-05, 'batch_size': 1591, 'optimizer': 'RMSprop'}.
2026-06-29 21:19:48,219 - optuna.study.study - INFO - Trial 31 finished with values: [0.002721259053473048, 0.0007066466576752845, 0.001771609097461734] and parameters: {'n_layers': 4, 'embedding_dim': 64, 'lr': 0.0005030162275943933, 'lambda_val': 0.0024351223150280593, 'batch_size': 2642, 'optimizer': 'RMSprop'}.
2026-06-29 21:20:35,229 - experiment_functions - INFO - Early stopping at epoch 550. Best Metrics: (0.0010577196324884147, 0.0003058336341014, 0.0007091826411349841)
2026-06-29 21:20:35,376 - optuna.study.study - INFO - Trial 32 finished with values: [0.0010577196324884147, 0.0003058336341014, 0.0007091826411349841] and parameters: {'n_layers': 4, 'embedding_dim': 64, 'lr': 0.013963397837397955, 'lambda_val': 0.035511336040904305, 'batch_size': 1472, 'optimizer': 'Adam'}.
2026-06-29 21:21:24,930 - experiment_functions - INFO - Early stopping at epoch 500. Best Metrics: (0.0001911869463903349, 6.268639705183975e-05, 0.00012470284390040366)
2026-06-29 21:21:25,292 - optuna.study.study - INFO - Trial 33 finished with values: [0.0001911869463903349, 6.268639705183975e-05, 0.00012470284390040366] and parameters: {'n_layers': 2, 'embedding_dim': 256, 'lr': 3.292621532466273e-05, 'lambda_val': 0.0005133138024525424, 'batch_size': 3529, 'optimizer': 'RMSprop'}.
2026-06-29 21:22:11,906 - experiment_functions - INFO - Early stopping at epoch 500. Best Metrics: (0.00026309462332054363, 6.36361909465646e-05, 0.00015074063093035487)
2026-06-29 21:22:11,991 - optuna.study.study - INFO - Trial 34 finished with values: [0.00026309462332054363, 6.36361909465646e-05, 0.00015074063093035487] and parameters: {'n_layers': 4, 'embedding_dim': 128, 'lr': 3.8023630063846486e-05, 'lambda_val': 0.00040284199994133397, 'batch_size': 2567, 'optimizer': 'SGD'}.
2026-06-29 21:22:55,373 - experiment_functions - INFO - Early stopping at epoch 500. Best Metrics: (0.00017307850564999717, 4.8439488630967084e-05, 0.0001077221298445288)
2026-06-29 21:22:55,454 - optuna.study.study - INFO - Trial 35 finished with values: [0.00017307850564999717, 4.8439488630967084e-05, 0.0001077221298445288] and parameters: {'n_layers': 3, 'embedding_dim': 96, 'lr': 0.0377750518186694, 'lambda_val': 0.0009253941889996052, 'batch_size': 758, 'optimizer': 'SGD'}.
2026-06-29 21:23:38,992 - experiment_functions - INFO - Early stopping at epoch 550. Best Metrics: (0.0010793480746058369, 0.0002868377562069031, 0.0006770589636938611)
2026-06-29 21:23:39,076 - optuna.study.study - INFO - Trial 36 finished with values: [0.0010793480746058369, 0.0002868377562069031, 0.0006770589636938611] and parameters: {'n_layers': 1, 'embedding_dim': 32, 'lr': 0.017351300430976352, 'lambda_val': 4.446701742796177e-06, 'batch_size': 3566, 'optimizer': 'RMSprop'}.
2026-06-29 21:24:21,717 - experiment_functions - INFO - Early stopping at epoch 500. Best Metrics: (0.0002713977280001219, 6.363619094656459e-05, 0.00016103555686602553)
2026-06-29 21:24:21,788 - optuna.study.study - INFO - Trial 37 finished with values: [0.0002713977280001219, 6.363619094656459e-05, 0.00016103555686602553] and parameters: {'n_layers': 2, 'embedding_dim': 96, 'lr': 0.005084074098593243, 'lambda_val': 1.1813358915438924e-05, 'batch_size': 2346, 'optimizer': 'SGD'}.
2026-06-29 21:25:02,796 - experiment_functions - INFO - Early stopping at epoch 500. Best Metrics: (0.0002361239769363057, 5.9837015367665226e-05, 0.00011829492800681902)
2026-06-29 21:25:02,884 - optuna.study.study - INFO - Trial 38 finished with values: [0.0002361239769363057, 5.9837015367665226e-05, 0.00011829492800681902] and parameters: {'n_layers': 4, 'embedding_dim': 32, 'lr': 0.001315006182700227, 'lambda_val': 2.6073206722937477e-06, 'batch_size': 1315, 'optimizer': 'SGD'}.
2026-06-29 21:25:47,965 - experiment_functions - INFO - Early stopping at epoch 500. Best Metrics: (0.0001568495393863323, 5.223866420986647e-05, 0.00010028211273548917)
2026-06-29 21:25:48,039 - optuna.study.study - INFO - Trial 39 finished with values: [0.0001568495393863323, 5.223866420986647e-05, 0.00010028211273548917] and parameters: {'n_layers': 3, 'embedding_dim': 128, 'lr': 0.0012620598099349278, 'lambda_val': 0.029530286599906305, 'batch_size': 3997, 'optimizer': 'SGD'}.
2026-06-29 21:30:40,210 - optuna.study.study - INFO - Trial 40 finished with values: [0.0011985184093336854, 0.00026784187831240615, 0.0007400040464144279] and parameters: {'n_layers': 2, 'embedding_dim': 32, 'lr': 0.0003326962115608699, 'lambda_val': 0.0001469814413818991, 'batch_size': 2809, 'optimizer': 'RMSprop'}.
2026-06-29 21:31:22,414 - experiment_functions - INFO - Early stopping at epoch 500. Best Metrics: (0.00020438793045704596, 5.318845810459131e-05, 0.00010417416253708229)
2026-06-29 21:31:22,512 - optuna.study.study - INFO - Trial 41 finished with values: [0.00020438793045704596, 5.318845810459131e-05, 0.00010417416253708229] and parameters: {'n_layers': 1, 'embedding_dim': 128, 'lr': 0.000565102086678816, 'lambda_val': 0.00033463899318464103, 'batch_size': 2185, 'optimizer': 'SGD'}.
2026-06-29 21:38:14,350 - optuna.study.study - INFO - Trial 42 finished with values: [0.0004887769923421766, 0.0001377201147351025, 0.00035131419376262783] and parameters: {'n_layers': 4, 'embedding_dim': 256, 'lr': 0.00015958620970251398, 'lambda_val': 8.378994108262931e-05, 'batch_size': 1259, 'optimizer': 'RMSprop'}.
2026-06-29 21:39:04,010 - experiment_functions - INFO - Early stopping at epoch 550. Best Metrics: (0.0001993981989814943, 5.5088045894040994e-05, 0.0001225084280324225)
2026-06-29 21:39:04,095 - optuna.study.study - INFO - Trial 43 finished with values: [0.0001993981989814943, 5.5088045894040994e-05, 0.0001225084280324225] and parameters: {'n_layers': 1, 'embedding_dim': 256, 'lr': 0.056176719268043435, 'lambda_val': 2.4476868054829606e-06, 'batch_size': 2284, 'optimizer': 'SGD'}.
2026-06-29 21:39:43,660 - experiment_functions - INFO - Early stopping at epoch 500. Best Metrics: (0.00020862253135898328, 6.078680926239006e-05, 0.0001349347017179333)
