2026-07-06 15:55:29,709 - optuna.study.study - INFO - Trial 101 finished with values: [0.00020978215564360498, 7.313412989381305e-05, 0.00013687309680184202] and parameters: {'n_layers': 4, 'embedding_dim': 64, 'lr': 0.00010971479795698171, 'lambda_val': 0.014042324704312418, 'batch_size': 881, 'optimizer': 'RMSprop'}.
2026-07-06 15:56:19,322 - experiment_functions - INFO - Early stopping at epoch 500. Best Metrics: (0.00030643913852418733, 6.933495431491366e-05, 0.00018105853085265643)
2026-07-06 15:56:19,402 - optuna.study.study - INFO - Trial 102 finished with values: [0.00030643913852418733, 6.933495431491366e-05, 0.00018105853085265643] and parameters: {'n_layers': 1, 'embedding_dim': 256, 'lr': 0.00020156111128107868, 'lambda_val': 0.014042324704312418, 'batch_size': 2026, 'optimizer': 'Adam'}.
2026-07-06 15:57:05,531 - experiment_functions - INFO - Early stopping at epoch 500. Best Metrics: (0.00019273108251625495, 3.989134357844348e-05, 9.389330067958596e-05)
2026-07-06 15:57:05,606 - optuna.study.study - INFO - Trial 103 finished with values: [0.00019273108251625495, 3.989134357844348e-05, 9.389330067958596e-05] and parameters: {'n_layers': 4, 'embedding_dim': 64, 'lr': 0.024621994148519108, 'lambda_val': 5.734344867778707e-06, 'batch_size': 2985, 'optimizer': 'SGD'}.
2026-07-06 15:59:26,224 - experiment_functions - INFO - Early stopping at epoch 1350. Best Metrics: (0.0002202204650216678, 5.7937427578215534e-05, 0.00012684266297595566)
2026-07-06 15:59:26,326 - optuna.study.study - INFO - Trial 104 finished with values: [0.0002202204650216678, 5.7937427578215534e-05, 0.00012684266297595566] and parameters: {'n_layers': 2, 'embedding_dim': 256, 'lr': 5.954346754868981e-05, 'lambda_val': 1.5962779259926537e-06, 'batch_size': 4084, 'optimizer': 'Adam'}.
2026-07-06 16:01:57,226 - experiment_functions - INFO - Early stopping at epoch 1600. Best Metrics: (0.006971616887849088, 0.001649791995137055, 0.0041017416937530774)
2026-07-06 16:01:57,331 - optuna.study.study - INFO - Trial 105 finished with values: [0.006971616887849088, 0.001649791995137055, 0.0041017416937530774] and parameters: {'n_layers': 1, 'embedding_dim': 256, 'lr': 0.002656669860795703, 'lambda_val': 0.0431401606538425, 'batch_size': 2134, 'optimizer': 'Adam'}.
2026-07-06 16:04:14,484 - experiment_functions - INFO - Early stopping at epoch 1600. Best Metrics: (0.013585758491847568, 0.003018444997435557, 0.007978736018412506)
2026-07-06 16:04:14,583 - optuna.study.study - INFO - Trial 106 finished with values: [0.013585758491847568, 0.003018444997435557, 0.007978736018412506] and parameters: {'n_layers': 3, 'embedding_dim': 64, 'lr': 0.0027021927373699207, 'lambda_val': 0.0006130975118365463, 'batch_size': 2416, 'optimizer': 'Adam'}.
2026-07-06 16:12:33,610 - optuna.study.study - INFO - Trial 107 finished with values: [0.018359908988992132, 0.004049921167106738, 0.0107950472185673] and parameters: {'n_layers': 4, 'embedding_dim': 256, 'lr': 0.006223205691487941, 'lambda_val': 1.7965641297535496e-06, 'batch_size': 2061, 'optimizer': 'RMSprop'}.
2026-07-06 16:14:51,061 - experiment_functions - INFO - Early stopping at epoch 1450. Best Metrics: (0.00026224941112953893, 5.888722147294036e-05, 0.00014579502978703468)
2026-07-06 16:14:51,168 - optuna.study.study - INFO - Trial 108 finished with values: [0.00026224941112953893, 5.888722147294036e-05, 0.00014579502978703468] and parameters: {'n_layers': 3, 'embedding_dim': 128, 'lr': 2.9809582787292233e-05, 'lambda_val': 8.354147532190842e-06, 'batch_size': 3063, 'optimizer': 'Adam'}.
2026-07-06 16:15:57,961 - experiment_functions - INFO - Early stopping at epoch 550. Best Metrics: (0.010498966277188469, 0.002457116805653173, 0.0063143578063164065)
2026-07-06 16:15:58,067 - optuna.study.study - INFO - Trial 109 finished with values: [0.010498966277188469, 0.002457116805653173, 0.0063143578063164065] and parameters: {'n_layers': 3, 'embedding_dim': 256, 'lr': 0.01677700597951071, 'lambda_val': 1.3821671642527758e-06, 'batch_size': 1500, 'optimizer': 'Adam'}.
2026-07-06 16:21:28,643 - optuna.study.study - INFO - Trial 110 finished with values: [0.008484488131405453, 0.002148433789867599, 0.004981836003271224] and parameters: {'n_layers': 1, 'embedding_dim': 128, 'lr': 0.011688810705771883, 'lambda_val': 0.014042324704312418, 'batch_size': 881, 'optimizer': 'Adam'}.
2026-07-06 16:26:34,403 - optuna.study.study - INFO - Trial 111 finished with values: [0.00046141245380093457, 0.0001339209391562031, 0.000324636099900975] and parameters: {'n_layers': 1, 'embedding_dim': 64, 'lr': 0.0004983510224999149, 'lambda_val': 0.0038206436204871875, 'batch_size': 1183, 'optimizer': 'RMSprop'}.
2026-07-06 16:31:49,550 - experiment_functions - INFO - Early stopping at epoch 3950. Best Metrics: (0.007226101543788335, 0.0017960602549246813, 0.004525001577451062)
2026-07-06 16:31:50,024 - optuna.study.study - INFO - Trial 112 finished with values: [0.007226101543788335, 0.0017960602549246813, 0.004525001577451062] and parameters: {'n_layers': 1, 'embedding_dim': 96, 'lr': 0.019829977892525583, 'lambda_val': 1.7965641297535496e-06, 'batch_size': 3098, 'optimizer': 'RMSprop'}.
2026-07-06 16:32:31,962 - experiment_functions - INFO - Early stopping at epoch 500. Best Metrics: (0.0002183140975304087, 5.888722147294038e-05, 0.00012304302900718417)
2026-07-06 16:32:32,063 - optuna.study.study - INFO - Trial 113 finished with values: [0.0002183140975304087, 5.888722147294038e-05, 0.00012304302900718417] and parameters: {'n_layers': 1, 'embedding_dim': 64, 'lr': 0.024621994148519108, 'lambda_val': 2.465157645661239e-06, 'batch_size': 3384, 'optimizer': 'SGD'}.
2026-07-06 16:33:22,882 - experiment_functions - INFO - Early stopping at epoch 550. Best Metrics: (0.005160790875850897, 0.0012366316509317477, 0.0029631677455904523)
2026-07-06 16:33:22,984 - optuna.study.study - INFO - Trial 114 finished with values: [0.005160790875850897, 0.0012366316509317477, 0.0029631677455904523] and parameters: {'n_layers': 4, 'embedding_dim': 64, 'lr': 0.01677700597951071, 'lambda_val': 0.003235866498706212, 'batch_size': 4084, 'optimizer': 'Adam'}.
2026-07-06 16:34:03,532 - experiment_functions - INFO - Early stopping at epoch 500. Best Metrics: (0.00025856058111950963, 5.413825199931616e-05, 0.00012607431475384544)
2026-07-06 16:34:03,639 - optuna.study.study - INFO - Trial 115 finished with values: [0.00025856058111950963, 5.413825199931616e-05, 0.00012607431475384544] and parameters: {'n_layers': 1, 'embedding_dim': 32, 'lr': 0.004800543051042116, 'lambda_val': 3.765712134740546e-05, 'batch_size': 2771, 'optimizer': 'SGD'}.
2026-07-06 16:35:39,899 - experiment_functions - INFO - Early stopping at epoch 900. Best Metrics: (0.012907726160362787, 0.0028949717911213274, 0.008036872116036667)
2026-07-06 16:35:39,998 - optuna.study.study - INFO - Trial 116 finished with values: [0.012907726160362787, 0.0028949717911213274, 0.008036872116036667] and parameters: {'n_layers': 2, 'embedding_dim': 256, 'lr': 0.01677700597951071, 'lambda_val': 1.3710755672555229e-05, 'batch_size': 2026, 'optimizer': 'RMSprop'}.
2026-07-06 16:37:14,089 - experiment_functions - INFO - Early stopping at epoch 1150. Best Metrics: (0.00028254747794086106, 7.123454210436335e-05, 0.0001479198039716586)
2026-07-06 16:37:14,195 - optuna.study.study - INFO - Trial 117 finished with values: [0.00028254747794086106, 7.123454210436335e-05, 0.0001479198039716586] and parameters: {'n_layers': 2, 'embedding_dim': 64, 'lr': 0.0001277244495089132, 'lambda_val': 1.3710755672555229e-05, 'batch_size': 1500, 'optimizer': 'Adam'}.
2026-07-06 16:45:30,345 - optuna.study.study - INFO - Trial 118 finished with values: [0.003847697213048468, 0.0009887354444085635, 0.0023542423523567864] and parameters: {'n_layers': 4, 'embedding_dim': 256, 'lr': 0.0001277244495089132, 'lambda_val': 4.230259051937931e-06, 'batch_size': 3792, 'optimizer': 'Adam'}.
2026-07-06 16:46:17,908 - experiment_functions - INFO - Early stopping at epoch 550. Best Metrics: (0.006797062291288785, 0.0016792356058735255, 0.0042175141802386455)
2026-07-06 16:46:18,009 - optuna.study.study - INFO - Trial 119 finished with values: [0.006797062291288785, 0.0016792356058735255, 0.0042175141802386455] and parameters: {'n_layers': 2, 'embedding_dim': 64, 'lr': 0.06754974326511395, 'lambda_val': 9.525438162158697e-06, 'batch_size': 691, 'optimizer': 'Adam'}.
2026-07-06 16:52:55,965 - optuna.study.study - INFO - Trial 120 finished with values: [0.01265295125051444, 0.003129570883118364, 0.007624373781860772] and parameters: {'n_layers': 4, 'embedding_dim': 128, 'lr': 0.00033928390565174827, 'lambda_val': 5.734344867778707e-06, 'batch_size': 4084, 'optimizer': 'Adam'}.
2026-07-06 16:54:54,209 - experiment_functions - INFO - Early stopping at epoch 1450. Best Metrics: (0.006629417653072247, 0.00159185456755884, 0.003786891552919406)
2026-07-06 16:54:54,334 - optuna.study.study - INFO - Trial 121 finished with values: [0.006629417653072247, 0.00159185456755884, 0.003786891552919406] and parameters: {'n_layers': 4, 'embedding_dim': 32, 'lr': 0.004800543051042116, 'lambda_val': 0.001680023490875609, 'batch_size': 3112, 'optimizer': 'RMSprop'}.
2026-07-06 16:56:50,292 - experiment_functions - INFO - Early stopping at epoch 1400. Best Metrics: (0.00027892424148797263, 6.553577873601429e-05, 0.00014536928920587549)
2026-07-06 16:56:50,415 - optuna.study.study - INFO - Trial 122 finished with values: [0.00027892424148797263, 6.553577873601429e-05, 0.00014536928920587549] and parameters: {'n_layers': 1, 'embedding_dim': 128, 'lr': 0.0001585546008154308, 'lambda_val': 1.838250716065182e-06, 'batch_size': 1716, 'optimizer': 'RMSprop'}.
2026-07-06 16:58:22,519 - experiment_functions - INFO - Early stopping at epoch 1100. Best Metrics: (0.014279169009854572, 0.003141918203749786, 0.008509422978518701)
2026-07-06 16:58:22,670 - optuna.study.study - INFO - Trial 123 finished with values: [0.014279169009854572, 0.003141918203749786, 0.008509422978518701] and parameters: {'n_layers': 1, 'embedding_dim': 96, 'lr': 0.011688810705771883, 'lambda_val': 3.2526061508437436e-06, 'batch_size': 3063, 'optimizer': 'Adam'}.
2026-07-06 17:02:37,170 - experiment_functions - INFO - Early stopping at epoch 2550. Best Metrics: (0.014300455288707674, 0.0032008054252227265, 0.008260177231458589)
2026-07-06 17:02:37,279 - optuna.study.study - INFO - Trial 124 finished with values: [0.014300455288707674, 0.0032008054252227265, 0.008260177231458589] and parameters: {'n_layers': 4, 'embedding_dim': 128, 'lr': 0.0010707349549773082, 'lambda_val': 1.3821671642527758e-06, 'batch_size': 2134, 'optimizer': 'Adam'}.
2026-07-06 17:08:13,866 - optuna.study.study - INFO - Trial 125 finished with values: [0.026842304060109214, 0.005728206979085538, 0.01590145519482741] and parameters: {'n_layers': 1, 'embedding_dim': 128, 'lr': 0.002656669860795703, 'lambda_val': 1.838250716065182e-06, 'batch_size': 3792, 'optimizer': 'RMSprop'}.
2026-07-06 17:09:04,428 - experiment_functions - INFO - Early stopping at epoch 550. Best Metrics: (0.005251939812223891, 0.001285071139562715, 0.0032257968922503855)
2026-07-06 17:09:04,527 - optuna.study.study - INFO - Trial 126 finished with values: [0.005251939812223891, 0.001285071139562715, 0.0032257968922503855] and parameters: {'n_layers': 4, 'embedding_dim': 64, 'lr': 0.00938818303360569, 'lambda_val': 0.007400497069566498, 'batch_size': 906, 'optimizer': 'RMSprop'}.
2026-07-06 17:09:54,048 - experiment_functions - INFO - Early stopping at epoch 550. Best Metrics: (0.00756361137597659, 0.001858746651976521, 0.004565004111847035)
2026-07-06 17:09:54,154 - optuna.study.study - INFO - Trial 127 finished with values: [0.00756361137597659, 0.001858746651976521, 0.004565004111847035] and parameters: {'n_layers': 3, 'embedding_dim': 64, 'lr': 0.029415665414537304, 'lambda_val': 2.465157645661239e-06, 'batch_size': 1512, 'optimizer': 'Adam'}.
2026-07-06 17:13:18,260 - experiment_functions - INFO - Early stopping at epoch 2150. Best Metrics: (0.021367567610042253, 0.004576106984784302, 0.012982135044949522)
2026-07-06 17:13:18,413 - optuna.study.study - INFO - Trial 128 finished with values: [0.021367567610042253, 0.004576106984784302, 0.012982135044949522] and parameters: {'n_layers': 1, 'embedding_dim': 256, 'lr': 0.006478106002947754, 'lambda_val': 2.465157645661239e-06, 'batch_size': 3792, 'optimizer': 'Adam'}.
2026-07-06 17:14:12,589 - experiment_functions - INFO - Early stopping at epoch 550. Best Metrics: (0.0029280249303339505, 0.0007598351157798758, 0.0018654768920654654)
2026-07-06 17:14:12,693 - optuna.study.study - INFO - Trial 129 finished with values: [0.0029280249303339505, 0.0007598351157798758, 0.0018654768920654654] and parameters: {'n_layers': 1, 'embedding_dim': 256, 'lr': 0.08285521265575502, 'lambda_val': 5.734344867778707e-06, 'batch_size': 906, 'optimizer': 'Adam'}.
2026-07-06 17:18:49,775 - experiment_functions - INFO - Early stopping at epoch 3200. Best Metrics: (0.012994594460727349, 0.002801891989438292, 0.00782679388809519)
2026-07-06 17:18:49,875 - optuna.study.study - INFO - Trial 130 finished with values: [0.012994594460727349, 0.002801891989438292, 0.00782679388809519] and parameters: {'n_layers': 4, 'embedding_dim': 64, 'lr': 0.024621994148519108, 'lambda_val': 1.870375957132669e-06, 'batch_size': 906, 'optimizer': 'RMSprop'}.
2026-07-06 17:25:03,509 - optuna.study.study - INFO - Trial 131 finished with values: [0.016708255877203128, 0.0036662044336379005, 0.010082365232026488] and parameters: {'n_layers': 1, 'embedding_dim': 256, 'lr': 0.011688810705771883, 'lambda_val': 4.230259051937931e-06, 'batch_size': 4084, 'optimizer': 'Adam'}.
2026-07-06 17:30:47,889 - optuna.study.study - INFO - Trial 132 finished with values: [0.009568011418704466, 0.002197823072393291, 0.005757168204936416] and parameters: {'n_layers': 4, 'embedding_dim': 64, 'lr': 0.019829977892525583, 'lambda_val': 8.354147532190842e-06, 'batch_size': 906, 'optimizer': 'Adam'}.
2026-07-06 17:31:38,970 - experiment_functions - INFO - Early stopping at epoch 600. Best Metrics: (0.002093156885588167, 0.0006069182987291759, 0.0013465233401006949)
2026-07-06 17:31:39,118 - optuna.study.study - INFO - Trial 133 finished with values: [0.002093156885588167, 0.0006069182987291759, 0.0013465233401006949] and parameters: {'n_layers': 1, 'embedding_dim': 96, 'lr': 0.019829977892525583, 'lambda_val': 0.047397572073982076, 'batch_size': 1513, 'optimizer': 'Adam'}.
2026-07-06 17:39:58,692 - optuna.study.study - INFO - Trial 134 finished with values: [0.018842281636265064, 0.004053720342685637, 0.010872806900006554] and parameters: {'n_layers': 4, 'embedding_dim': 256, 'lr': 0.006478106002947754, 'lambda_val': 1.838250716065182e-06, 'batch_size': 3098, 'optimizer': 'RMSprop'}.
2026-07-06 17:46:11,585 - optuna.study.study - INFO - Trial 135 finished with values: [0.021975849192137055, 0.0046701365803620614, 0.012802464333304928] and parameters: {'n_layers': 1, 'embedding_dim': 256, 'lr': 0.006576207134668591, 'lambda_val': 1.9420463734703053e-05, 'batch_size': 3792, 'optimizer': 'RMSprop'}.
2026-07-06 17:53:49,902 - optuna.study.study - INFO - Trial 136 finished with values: [0.020941762851632358, 0.004464981099101495, 0.012282545445642914] and parameters: {'n_layers': 3, 'embedding_dim': 256, 'lr': 0.00938818303360569, 'lambda_val': 1.9420463734703053e-05, 'batch_size': 3098, 'optimizer': 'RMSprop'}.
2026-07-06 17:54:40,872 - experiment_functions - INFO - Early stopping at epoch 550. Best Metrics: (0.0059339572358278496, 0.0014826282696654826, 0.0036014298512439063)
2026-07-06 17:54:40,978 - optuna.study.study - INFO - Trial 137 finished with values: [0.0059339572358278496, 0.0014826282696654826, 0.0036014298512439063] and parameters: {'n_layers': 4, 'embedding_dim': 64, 'lr': 0.06754974326511395, 'lambda_val': 5.734344867778707e-06, 'batch_size': 1500, 'optimizer': 'Adam'}.
2026-07-06 17:55:38,852 - experiment_functions - INFO - Early stopping at epoch 550. Best Metrics: (0.006052057569800305, 0.0012955188724046883, 0.003834390670374251)
2026-07-06 17:55:38,957 - optuna.study.study - INFO - Trial 138 finished with values: [0.006052057569800305, 0.0012955188724046883, 0.003834390670374251] and parameters: {'n_layers': 4, 'embedding_dim': 128, 'lr': 0.0854938053347507, 'lambda_val': 1.3821671642527758e-06, 'batch_size': 651, 'optimizer': 'RMSprop'}.
2026-07-06 18:01:35,180 - optuna.study.study - INFO - Trial 139 finished with values: [0.018429393156488522, 0.004089812510685182, 0.010856165608502463] and parameters: {'n_layers': 2, 'embedding_dim': 128, 'lr': 0.006478106002947754, 'lambda_val': 1.838250716065182e-06, 'batch_size': 2101, 'optimizer': 'RMSprop'}.
2026-07-06 18:02:18,691 - experiment_functions - INFO - Early stopping at epoch 500. Best Metrics: (0.0002585636938518997, 6.838516042018881e-05, 0.00015591640260138076)
2026-07-06 18:02:18,798 - optuna.study.study - INFO - Trial 140 finished with values: [0.0002585636938518997, 6.838516042018881e-05, 0.00015591640260138076] and parameters: {'n_layers': 4, 'embedding_dim': 32, 'lr': 0.004800543051042116, 'lambda_val': 0.0001964805683644119, 'batch_size': 3112, 'optimizer': 'SGD'}.
2026-07-06 18:03:24,608 - experiment_functions - INFO - Early stopping at epoch 500. Best Metrics: (0.00023852095428539676, 6.173660315711492e-05, 0.00012017457028036947)
2026-07-06 18:03:24,711 - optuna.study.study - INFO - Trial 141 finished with values: [0.00023852095428539676, 6.173660315711492e-05, 0.00012017457028036947] and parameters: {'n_layers': 4, 'embedding_dim': 256, 'lr': 0.0001277244495089132, 'lambda_val': 0.013957479088488446, 'batch_size': 2026, 'optimizer': 'Adam'}.
2026-07-06 18:04:10,665 - experiment_functions - INFO - Early stopping at epoch 550. Best Metrics: (0.0031060478999075172, 0.000905153581672777, 0.0020410066665188468)
2026-07-06 18:04:10,785 - optuna.study.study - INFO - Trial 142 finished with values: [0.0031060478999075172, 0.000905153581672777, 0.0020410066665188468] and parameters: {'n_layers': 1, 'embedding_dim': 64, 'lr': 0.06754974326511395, 'lambda_val': 9.525438162158697e-06, 'batch_size': 691, 'optimizer': 'Adam'}.
2026-07-06 18:09:28,565 - optuna.study.study - INFO - Trial 143 finished with values: [0.005180379835577519, 0.0013610546511407026, 0.003075402942482994] and parameters: {'n_layers': 1, 'embedding_dim': 96, 'lr': 0.004800543051042116, 'lambda_val': 0.047397572073982076, 'batch_size': 1513, 'optimizer': 'RMSprop'}.
2026-07-06 18:14:54,137 - optuna.study.study - INFO - Trial 144 finished with values: [0.015130723306755946, 0.0034069107003780186, 0.008729933181179957] and parameters: {'n_layers': 2, 'embedding_dim': 64, 'lr': 0.004800543051042116, 'lambda_val': 3.765712134740546e-05, 'batch_size': 2416, 'optimizer': 'RMSprop'}.
2026-07-06 18:15:48,824 - experiment_functions - INFO - Early stopping at epoch 550. Best Metrics: (0.005324721316531039, 0.0011169576201964175, 0.0032378953568816655)
2026-07-06 18:15:48,934 - optuna.study.study - INFO - Trial 145 finished with values: [0.005324721316531039, 0.0011169576201964175, 0.0032378953568816655] and parameters: {'n_layers': 3, 'embedding_dim': 128, 'lr': 0.09187492113273477, 'lambda_val': 1.838250716065182e-06, 'batch_size': 1865, 'optimizer': 'RMSprop'}.
2026-07-06 18:16:40,969 - experiment_functions - INFO - Early stopping at epoch 550. Best Metrics: (0.007079679301409419, 0.0016858841631365996, 0.004310517085091295)
2026-07-06 18:16:41,128 - optuna.study.study - INFO - Trial 146 finished with values: [0.007079679301409419, 0.0016858841631365996, 0.004310517085091295] and parameters: {'n_layers': 2, 'embedding_dim': 128, 'lr': 0.06754974326511395, 'lambda_val': 2.465157645661239e-06, 'batch_size': 1500, 'optimizer': 'Adam'}.
2026-07-06 18:19:47,907 - experiment_functions - INFO - Early stopping at epoch 2400. Best Metrics: (0.009404834504378345, 0.0021921243090249416, 0.0051090095471506254)
2026-07-06 18:19:48,101 - optuna.study.study - INFO - Trial 147 finished with values: [0.009404834504378345, 0.0021921243090249416, 0.0051090095471506254] and parameters: {'n_layers': 2, 'embedding_dim': 32, 'lr': 0.004800543051042116, 'lambda_val': 0.003235866498706212, 'batch_size': 3112, 'optimizer': 'RMSprop'}.
2026-07-06 18:26:01,496 - optuna.study.study - INFO - Trial 148 finished with values: [0.024471472338427842, 0.005253310031723115, 0.014648696988257978] and parameters: {'n_layers': 1, 'embedding_dim': 256, 'lr': 0.004800543051042116, 'lambda_val': 2.465157645661239e-06, 'batch_size': 3112, 'optimizer': 'RMSprop'}.
2026-07-06 18:32:13,122 - optuna.study.study - INFO - Trial 149 finished with values: [0.010370236869798552, 0.002491309385863268, 0.0062018777857464] and parameters: {'n_layers': 1, 'embedding_dim': 256, 'lr': 0.01677700597951071, 'lambda_val': 1.3710755672555229e-05, 'batch_size': 2026, 'optimizer': 'Adam'}.
2026-07-06 18:33:29,582 - experiment_functions - INFO - Early stopping at epoch 850. Best Metrics: (0.008155377870058999, 0.0019185836673441866, 0.00478177829197931)
2026-07-06 18:33:29,737 - optuna.study.study - INFO - Trial 150 finished with values: [0.008155377870058999, 0.0019185836673441866, 0.00478177829197931] and parameters: {'n_layers': 4, 'embedding_dim': 64, 'lr': 0.019829977892525583, 'lambda_val': 3.1656230295964925e-05, 'batch_size': 2134, 'optimizer': 'Adam'}.
2026-07-06 18:34:34,001 - experiment_functions - INFO - Early stopping at epoch 650. Best Metrics: (0.009859638936786184, 0.0023326938054442185, 0.005905336277544815)
2026-07-06 18:34:34,103 - optuna.study.study - INFO - Trial 151 finished with values: [0.009859638936786184, 0.0023326938054442185, 0.005905336277544815] and parameters: {'n_layers': 1, 'embedding_dim': 256, 'lr': 0.019829977892525583, 'lambda_val': 4.230259051937931e-06, 'batch_size': 4084, 'optimizer': 'Adam'}.
