2026-07-08 14:47:17,003 - optuna.study.study - INFO - Trial 45 finished with values: [0.0002544786593623047, 6.36361909465646e-05, 0.000135236490216583] and parameters: {'n_layers': 2, 'embedding_dim': 96, 'lr': 0.0013255747229517984, 'lambda_val': 4.8834420443784396e-05, 'batch_size': 3073, 'optimizer': 'SGD'}.
2026-07-08 14:49:10,678 - experiment_functions - INFO - Early stopping at epoch 1500. Best Metrics: (0.001522914159936299, 0.00046634880230989886, 0.001036729985974571)
2026-07-08 14:49:10,766 - optuna.study.study - INFO - Trial 46 finished with values: [0.001522914159936299, 0.00046634880230989886, 0.001036729985974571] and parameters: {'n_layers': 2, 'embedding_dim': 32, 'lr': 0.002223268374557262, 'lambda_val': 0.09562538576419571, 'batch_size': 3179, 'optimizer': 'Adam'}.
2026-07-08 14:53:59,390 - experiment_functions - INFO - Early stopping at epoch 3850. Best Metrics: (0.0018509505746737115, 0.0005271356115722888, 0.0011584790343806466)
2026-07-08 14:53:59,483 - optuna.study.study - INFO - Trial 47 finished with values: [0.0018509505746737115, 0.0005271356115722888, 0.0011584790343806466] and parameters: {'n_layers': 3, 'embedding_dim': 32, 'lr': 0.05483637108233773, 'lambda_val': 0.0011281569069505463, 'batch_size': 3842, 'optimizer': 'RMSprop'}.
2026-07-08 14:55:02,103 - experiment_functions - INFO - Early stopping at epoch 550. Best Metrics: (0.0036022657781155346, 0.0009687897726193417, 0.00234544933741974)
2026-07-08 14:55:02,187 - optuna.study.study - INFO - Trial 48 finished with values: [0.0036022657781155346, 0.0009687897726193417, 0.00234544933741974] and parameters: {'n_layers': 4, 'embedding_dim': 256, 'lr': 0.019047571127829455, 'lambda_val': 2.620125710300901e-06, 'batch_size': 781, 'optimizer': 'Adam'}.
2026-07-08 14:59:27,131 - experiment_functions - INFO - Early stopping at epoch 2850. Best Metrics: (0.0058433849358810516, 0.0015538628117698463, 0.003703884439321227)
2026-07-08 14:59:27,221 - optuna.study.study - INFO - Trial 49 finished with values: [0.0058433849358810516, 0.0015538628117698463, 0.003703884439321227] and parameters: {'n_layers': 2, 'embedding_dim': 256, 'lr': 0.0009859128880233146, 'lambda_val': 1.0684413344508431e-05, 'batch_size': 2258, 'optimizer': 'RMSprop'}.
2026-07-08 15:00:40,760 - experiment_functions - INFO - Early stopping at epoch 700. Best Metrics: (0.000154908639760419, 5.413825199931615e-05, 0.00010018033602967675)
2026-07-08 15:00:40,851 - optuna.study.study - INFO - Trial 50 finished with values: [0.000154908639760419, 5.413825199931615e-05, 0.00010018033602967675] and parameters: {'n_layers': 3, 'embedding_dim': 256, 'lr': 2.697463836977008e-05, 'lambda_val': 0.00031126728324925375, 'batch_size': 2040, 'optimizer': 'Adam'}.
2026-07-08 15:01:29,481 - experiment_functions - INFO - Early stopping at epoch 600. Best Metrics: (0.003111286183345487, 0.0008225215128317155, 0.0019391273579576409)
2026-07-08 15:01:29,570 - optuna.study.study - INFO - Trial 51 finished with values: [0.003111286183345487, 0.0008225215128317155, 0.0019391273579576409] and parameters: {'n_layers': 3, 'embedding_dim': 32, 'lr': 0.00635566229797604, 'lambda_val': 0.0071217114816529686, 'batch_size': 2781, 'optimizer': 'Adam'}.
2026-07-08 15:06:29,252 - optuna.study.study - INFO - Trial 52 finished with values: [0.004299594286535753, 0.0011103090629333435, 0.0027869374457695443] and parameters: {'n_layers': 3, 'embedding_dim': 32, 'lr': 0.0005335486218824814, 'lambda_val': 6.892455337046496e-05, 'batch_size': 2986, 'optimizer': 'Adam'}.
2026-07-08 15:11:26,155 - optuna.study.study - INFO - Trial 53 finished with values: [0.0010878322986541714, 0.00026689208441768136, 0.0006360150902272584] and parameters: {'n_layers': 1, 'embedding_dim': 64, 'lr': 0.0005217571328666986, 'lambda_val': 0.0016232859849467467, 'batch_size': 1279, 'optimizer': 'RMSprop'}.
2026-07-08 15:12:06,514 - experiment_functions - INFO - Early stopping at epoch 500. Best Metrics: (0.0002117626710835927, 5.5088045894041e-05, 0.00011888011315188662)
2026-07-08 15:12:06,635 - optuna.study.study - INFO - Trial 54 finished with values: [0.0002117626710835927, 5.5088045894041e-05, 0.00011888011315188662] and parameters: {'n_layers': 1, 'embedding_dim': 32, 'lr': 0.01683385264949986, 'lambda_val': 0.002173353985424752, 'batch_size': 3958, 'optimizer': 'SGD'}.
2026-07-08 15:13:28,987 - experiment_functions - INFO - Early stopping at epoch 850. Best Metrics: (0.002334931456077131, 0.000685751191991338, 0.0015580067676200658)
2026-07-08 15:13:29,091 - optuna.study.study - INFO - Trial 55 finished with values: [0.002334931456077131, 0.000685751191991338, 0.0015580067676200658] and parameters: {'n_layers': 2, 'embedding_dim': 256, 'lr': 0.0026199811222762572, 'lambda_val': 0.026231052260673512, 'batch_size': 1388, 'optimizer': 'RMSprop'}.
2026-07-08 15:14:14,715 - experiment_functions - INFO - Early stopping at epoch 500. Best Metrics: (0.0002398387480723716, 6.36361909465646e-05, 0.00014965940239590906)
2026-07-08 15:14:15,141 - optuna.study.study - INFO - Trial 56 finished with values: [0.0002398387480723716, 6.36361909465646e-05, 0.00014965940239590906] and parameters: {'n_layers': 3, 'embedding_dim': 128, 'lr': 0.0004370524927230785, 'lambda_val': 0.022413281415965974, 'batch_size': 587, 'optimizer': 'SGD'}.
2026-07-08 15:15:51,936 - experiment_functions - INFO - Early stopping at epoch 1200. Best Metrics: (0.0053945149834659116, 0.001406644758087495, 0.0035317297392167264)
2026-07-08 15:15:52,010 - optuna.study.study - INFO - Trial 57 finished with values: [0.0053945149834659116, 0.001406644758087495, 0.0035317297392167264] and parameters: {'n_layers': 3, 'embedding_dim': 64, 'lr': 0.0020140299216981693, 'lambda_val': 6.625860010406062e-06, 'batch_size': 3461, 'optimizer': 'Adam'}.
2026-07-08 15:18:16,350 - experiment_functions - INFO - Early stopping at epoch 1650. Best Metrics: (0.002213679172437797, 0.0005717759246243565, 0.0013472070875404922)
2026-07-08 15:18:16,441 - optuna.study.study - INFO - Trial 58 finished with values: [0.002213679172437797, 0.0005717759246243565, 0.0013472070875404922] and parameters: {'n_layers': 1, 'embedding_dim': 256, 'lr': 0.019047571127829455, 'lambda_val': 2.620125710300901e-06, 'batch_size': 781, 'optimizer': 'Adam'}.
2026-07-08 15:18:58,229 - experiment_functions - INFO - Early stopping at epoch 500. Best Metrics: (0.00027709997157976087, 6.743536652546397e-05, 0.0001541142549575636)
2026-07-08 15:18:58,314 - optuna.study.study - INFO - Trial 59 finished with values: [0.00027709997157976087, 6.743536652546397e-05, 0.0001541142549575636] and parameters: {'n_layers': 2, 'embedding_dim': 64, 'lr': 0.0003947216765049812, 'lambda_val': 0.03786575442820556, 'batch_size': 3944, 'optimizer': 'Adam'}.
2026-07-08 15:24:04,977 - optuna.study.study - INFO - Trial 60 finished with values: [0.0008724727230153329, 0.0002175028018919895, 0.0005329143050990496] and parameters: {'n_layers': 1, 'embedding_dim': 96, 'lr': 0.0004475125719004404, 'lambda_val': 0.019409563843673885, 'batch_size': 3958, 'optimizer': 'Adam'}.
2026-07-08 15:27:34,192 - experiment_functions - INFO - Early stopping at epoch 2800. Best Metrics: (0.005206842197701573, 0.0014132933153505687, 0.003367588091227432)
2026-07-08 15:27:34,330 - optuna.study.study - INFO - Trial 61 finished with values: [0.005206842197701573, 0.0014132933153505687, 0.003367588091227432] and parameters: {'n_layers': 2, 'embedding_dim': 32, 'lr': 0.0024216232986666152, 'lambda_val': 4.325919770856533e-05, 'batch_size': 1388, 'optimizer': 'RMSprop'}.
2026-07-08 15:28:20,508 - experiment_functions - INFO - Early stopping at epoch 500. Best Metrics: (0.00025790916174550166, 5.5088045894041e-05, 0.00013700119872409112)
2026-07-08 15:28:20,604 - optuna.study.study - INFO - Trial 62 finished with values: [0.00025790916174550166, 5.5088045894041e-05, 0.00013700119872409112] and parameters: {'n_layers': 1, 'embedding_dim': 256, 'lr': 9.804718522448677e-05, 'lambda_val': 1.0515430514938291e-06, 'batch_size': 1279, 'optimizer': 'SGD'}.
2026-07-08 15:32:03,546 - experiment_functions - INFO - Early stopping at epoch 3050. Best Metrics: (0.0011681536411803238, 0.0003476245654692932, 0.000756973848598254)
2026-07-08 15:32:03,642 - optuna.study.study - INFO - Trial 63 finished with values: [0.0011681536411803238, 0.0003476245654692932, 0.000756973848598254] and parameters: {'n_layers': 1, 'embedding_dim': 32, 'lr': 0.0018422302832834167, 'lambda_val': 0.08001288108820112, 'batch_size': 2085, 'optimizer': 'RMSprop'}.
2026-07-08 15:37:16,327 - optuna.study.study - INFO - Trial 64 finished with values: [0.0041455641657568865, 0.001095112360617746, 0.002738077997535827] and parameters: {'n_layers': 3, 'embedding_dim': 64, 'lr': 0.0005079724528508135, 'lambda_val': 6.892455337046496e-05, 'batch_size': 2341, 'optimizer': 'Adam'}.
2026-07-08 15:37:56,324 - experiment_functions - INFO - Early stopping at epoch 500. Best Metrics: (0.00026365851369504153, 6.553577873601429e-05, 0.0001471704484146577)
2026-07-08 15:37:57,032 - optuna.study.study - INFO - Trial 65 finished with values: [0.00026365851369504153, 6.553577873601429e-05, 0.0001471704484146577] and parameters: {'n_layers': 1, 'embedding_dim': 32, 'lr': 0.00020538479700520375, 'lambda_val': 6.892455337046496e-05, 'batch_size': 3093, 'optimizer': 'SGD'}.
2026-07-08 15:39:04,032 - experiment_functions - INFO - Early stopping at epoch 800. Best Metrics: (0.0029282278623228627, 0.0008700112075679577, 0.0018824332747301314)
2026-07-08 15:39:04,115 - optuna.study.study - INFO - Trial 66 finished with values: [0.0029282278623228627, 0.0008700112075679577, 0.0018824332747301314] and parameters: {'n_layers': 4, 'embedding_dim': 64, 'lr': 0.0026199811222762572, 'lambda_val': 0.009907083646107878, 'batch_size': 2163, 'optimizer': 'RMSprop'}.
2026-07-08 15:44:08,638 - optuna.study.study - INFO - Trial 67 finished with values: [0.002260174850251977, 0.0005708261307296317, 0.00148305409273071] and parameters: {'n_layers': 2, 'embedding_dim': 64, 'lr': 0.00044781232291925656, 'lambda_val': 7.545018077704894e-06, 'batch_size': 2243, 'optimizer': 'RMSprop'}.
2026-07-08 15:44:49,863 - experiment_functions - INFO - Early stopping at epoch 500. Best Metrics: (0.0001674598708979013, 4.559010694679255e-05, 9.234157527638613e-05)
2026-07-08 15:44:50,716 - optuna.study.study - INFO - Trial 68 finished with values: [0.0001674598708979013, 4.559010694679255e-05, 9.234157527638613e-05] and parameters: {'n_layers': 1, 'embedding_dim': 96, 'lr': 0.00020538479700520375, 'lambda_val': 0.01207248845563283, 'batch_size': 1739, 'optimizer': 'SGD'}.
2026-07-08 15:46:15,950 - experiment_functions - INFO - Early stopping at epoch 1000. Best Metrics: (0.0023622978994241113, 0.0006867009858860628, 0.0014858070316911946)
2026-07-08 15:46:16,038 - optuna.study.study - INFO - Trial 69 finished with values: [0.0023622978994241113, 0.0006867009858860628, 0.0014858070316911946] and parameters: {'n_layers': 2, 'embedding_dim': 128, 'lr': 0.006297648769451647, 'lambda_val': 0.019409563843673885, 'batch_size': 3967, 'optimizer': 'RMSprop'}.
2026-07-08 15:48:14,436 - experiment_functions - INFO - Early stopping at epoch 1600. Best Metrics: (0.00021917328719632211, 5.508804589404101e-05, 0.00012642305481170419)
2026-07-08 15:48:14,529 - optuna.study.study - INFO - Trial 70 finished with values: [0.00021917328719632211, 5.508804589404101e-05, 0.00012642305481170419] and parameters: {'n_layers': 1, 'embedding_dim': 32, 'lr': 2.2676180158888087e-05, 'lambda_val': 0.011208072633836318, 'batch_size': 1487, 'optimizer': 'RMSprop'}.
2026-07-08 15:48:57,508 - experiment_functions - INFO - Early stopping at epoch 500. Best Metrics: (0.00023956994758124011, 5.223866420986647e-05, 0.00010646817523484665)
2026-07-08 15:48:57,592 - optuna.study.study - INFO - Trial 71 finished with values: [0.00023956994758124011, 5.223866420986647e-05, 0.00010646817523484665] and parameters: {'n_layers': 2, 'embedding_dim': 96, 'lr': 0.008407564987450959, 'lambda_val': 2.620125710300901e-06, 'batch_size': 781, 'optimizer': 'SGD'}.
2026-07-08 15:49:46,362 - experiment_functions - INFO - Early stopping at epoch 600. Best Metrics: (0.00023896633850431357, 6.173660315711492e-05, 0.00012782385254890745)
2026-07-08 15:49:46,475 - optuna.study.study - INFO - Trial 72 finished with values: [0.00023896633850431357, 6.173660315711492e-05, 0.00012782385254890745] and parameters: {'n_layers': 4, 'embedding_dim': 32, 'lr': 1.9706069050044566e-05, 'lambda_val': 9.06090753534178e-05, 'batch_size': 2277, 'optimizer': 'Adam'}.
2026-07-08 15:51:47,823 - experiment_functions - INFO - Early stopping at epoch 1600. Best Metrics: (0.0011998843315628666, 0.0003932146724160857, 0.0007995683546307892)
2026-07-08 15:51:47,946 - optuna.study.study - INFO - Trial 73 finished with values: [0.0011998843315628666, 0.0003932146724160857, 0.0007995683546307892] and parameters: {'n_layers': 2, 'embedding_dim': 32, 'lr': 0.010937760374752617, 'lambda_val': 0.09562538576419571, 'batch_size': 3093, 'optimizer': 'Adam'}.
2026-07-08 15:52:31,208 - experiment_functions - INFO - Early stopping at epoch 500. Best Metrics: (0.00019910196492005784, 5.0339076420416775e-05, 0.00010442321949298246)
2026-07-08 15:52:31,289 - optuna.study.study - INFO - Trial 74 finished with values: [0.00019910196492005784, 5.0339076420416775e-05, 0.00010442321949298246] and parameters: {'n_layers': 2, 'embedding_dim': 96, 'lr': 0.001213502192531736, 'lambda_val': 5.222245565310666e-05, 'batch_size': 3073, 'optimizer': 'SGD'}.
2026-07-08 15:54:18,107 - experiment_functions - INFO - Early stopping at epoch 1350. Best Metrics: (0.0042397504534566165, 0.0011017609178808198, 0.0027052722349250502)
2026-07-08 15:54:18,199 - optuna.study.study - INFO - Trial 75 finished with values: [0.0042397504534566165, 0.0011017609178808198, 0.0027052722349250502] and parameters: {'n_layers': 2, 'embedding_dim': 64, 'lr': 0.0026199811222762572, 'lambda_val': 4.325919770856533e-05, 'batch_size': 3297, 'optimizer': 'Adam'}.
2026-07-08 15:55:20,152 - experiment_functions - INFO - Early stopping at epoch 550. Best Metrics: (0.002923589048853012, 0.0007845297570427218, 0.0018976119178982403)
2026-07-08 15:55:20,241 - optuna.study.study - INFO - Trial 76 finished with values: [0.002923589048853012, 0.0007845297570427218, 0.0018976119178982403] and parameters: {'n_layers': 4, 'embedding_dim': 256, 'lr': 0.012128692339590411, 'lambda_val': 0.0016935759490927101, 'batch_size': 2444, 'optimizer': 'RMSprop'}.
2026-07-08 15:56:20,312 - experiment_functions - INFO - Early stopping at epoch 600. Best Metrics: (0.002934598731693605, 0.0007626844974640504, 0.0019277434612270821)
2026-07-08 15:56:20,397 - optuna.study.study - INFO - Trial 77 finished with values: [0.002934598731693605, 0.0007626844974640504, 0.0019277434612270821] and parameters: {'n_layers': 2, 'embedding_dim': 256, 'lr': 0.03313649211797304, 'lambda_val': 1.0684413344508431e-05, 'batch_size': 3179, 'optimizer': 'Adam'}.
2026-07-08 15:57:22,564 - experiment_functions - INFO - Early stopping at epoch 550. Best Metrics: (0.002217845614767382, 0.0006116672682028, 0.0014084375857562805)
2026-07-08 15:57:22,691 - optuna.study.study - INFO - Trial 78 finished with values: [0.002217845614767382, 0.0006116672682028, 0.0014084375857562805] and parameters: {'n_layers': 4, 'embedding_dim': 256, 'lr': 0.021962016808300084, 'lambda_val': 0.0016935759490927101, 'batch_size': 891, 'optimizer': 'RMSprop'}.
2026-07-08 15:58:24,589 - experiment_functions - INFO - Early stopping at epoch 750. Best Metrics: (0.0002907704590348097, 6.743536652546399e-05, 0.0001538622322222005)
2026-07-08 15:58:24,682 - optuna.study.study - INFO - Trial 79 finished with values: [0.0002907704590348097, 6.743536652546399e-05, 0.0001538622322222005] and parameters: {'n_layers': 3, 'embedding_dim': 64, 'lr': 2.697463836977008e-05, 'lambda_val': 5.412802489563213e-05, 'batch_size': 2341, 'optimizer': 'Adam'}.
2026-07-08 16:02:48,415 - experiment_functions - INFO - Early stopping at epoch 3500. Best Metrics: (0.00027756234322655766, 6.363619094656459e-05, 0.000137480748736966)
2026-07-08 16:02:48,503 - optuna.study.study - INFO - Trial 80 finished with values: [0.00027756234322655766, 6.363619094656459e-05, 0.000137480748736966] and parameters: {'n_layers': 4, 'embedding_dim': 32, 'lr': 3.9137881969792394e-05, 'lambda_val': 1.9164184765323345e-06, 'batch_size': 2191, 'optimizer': 'Adam'}.
2026-07-08 16:04:09,658 - experiment_functions - INFO - Early stopping at epoch 1050. Best Metrics: (0.00407250680287181, 0.0010343255513553561, 0.002500361381427591)
2026-07-08 16:04:09,751 - optuna.study.study - INFO - Trial 81 finished with values: [0.00407250680287181, 0.0010343255513553561, 0.002500361381427591] and parameters: {'n_layers': 2, 'embedding_dim': 32, 'lr': 0.0026199811222762572, 'lambda_val': 4.325919770856533e-05, 'batch_size': 2727, 'optimizer': 'Adam'}.
2026-07-08 16:04:55,186 - experiment_functions - INFO - Early stopping at epoch 500. Best Metrics: (0.00027299678086108235, 7.218433599908821e-05, 0.000171570269291325)
2026-07-08 16:04:55,273 - optuna.study.study - INFO - Trial 82 finished with values: [0.00027299678086108235, 7.218433599908821e-05, 0.000171570269291325] and parameters: {'n_layers': 4, 'embedding_dim': 96, 'lr': 3.9137881969792394e-05, 'lambda_val': 1.9164184765323345e-06, 'batch_size': 2444, 'optimizer': 'SGD'}.
2026-07-08 16:07:45,043 - experiment_functions - INFO - Early stopping at epoch 2150. Best Metrics: (0.0020218998744585704, 0.0006021693292555516, 0.0013372259006822194)
2026-07-08 16:07:45,140 - optuna.study.study - INFO - Trial 83 finished with values: [0.0020218998744585704, 0.0006021693292555516, 0.0013372259006822194] and parameters: {'n_layers': 3, 'embedding_dim': 64, 'lr': 0.014731915351939828, 'lambda_val': 0.0071217114816529686, 'batch_size': 2986, 'optimizer': 'RMSprop'}.
2026-07-08 16:11:11,171 - experiment_functions - INFO - Early stopping at epoch 2200. Best Metrics: (0.005099977409398488, 0.001419941872613643, 0.0033152280771970894)
2026-07-08 16:11:11,250 - optuna.study.study - INFO - Trial 84 finished with values: [0.005099977409398488, 0.001419941872613643, 0.0033152280771970894] and parameters: {'n_layers': 2, 'embedding_dim': 256, 'lr': 0.002634796822286242, 'lambda_val': 1.3798424398068006e-06, 'batch_size': 891, 'optimizer': 'RMSprop'}.
2026-07-08 16:16:25,530 - optuna.study.study - INFO - Trial 85 finished with values: [0.004224047240640449, 0.0011416522614592635, 0.0027148081388998504] and parameters: {'n_layers': 3, 'embedding_dim': 64, 'lr': 0.0005079724528508135, 'lambda_val': 6.625860010406062e-06, 'batch_size': 2341, 'optimizer': 'Adam'}.
2026-07-08 16:17:08,207 - experiment_functions - INFO - Early stopping at epoch 500. Best Metrics: (0.001130282109633627, 0.0002735406416807553, 0.0008211668100589668)
2026-07-08 16:17:08,308 - optuna.study.study - INFO - Trial 86 finished with values: [0.001130282109633627, 0.0002735406416807553, 0.0008211668100589668] and parameters: {'n_layers': 3, 'embedding_dim': 64, 'lr': 0.06676092903588395, 'lambda_val': 0.005362924099244653, 'batch_size': 2986, 'optimizer': 'RMSprop'}.
2026-07-08 16:18:04,280 - experiment_functions - INFO - Early stopping at epoch 700. Best Metrics: (0.00019277969246109784, 4.938928252569192e-05, 9.626551776559338e-05)
2026-07-08 16:18:04,368 - optuna.study.study - INFO - Trial 87 finished with values: [0.00019277969246109784, 4.938928252569192e-05, 9.626551776559338e-05] and parameters: {'n_layers': 3, 'embedding_dim': 32, 'lr': 3.9137881969792394e-05, 'lambda_val': 1.9164184765323345e-06, 'batch_size': 2444, 'optimizer': 'Adam'}.
2026-07-08 16:23:59,197 - experiment_functions - INFO - Early stopping at epoch 3800. Best Metrics: (0.004574788071971005, 0.00122523412419505, 0.002892555868829184)
2026-07-08 16:23:59,303 - optuna.study.study - INFO - Trial 88 finished with values: [0.004574788071971005, 0.00122523412419505, 0.002892555868829184] and parameters: {'n_layers': 2, 'embedding_dim': 256, 'lr': 0.0020140299216981693, 'lambda_val': 1.3798424398068006e-06, 'batch_size': 891, 'optimizer': 'Adam'}.
2026-07-08 16:25:16,446 - experiment_functions - INFO - Early stopping at epoch 1000. Best Metrics: (0.00023525162040025966, 5.603783978876583e-05, 0.00013106108235378652)
2026-07-08 16:25:16,529 - optuna.study.study - INFO - Trial 89 finished with values: [0.00023525162040025966, 5.603783978876583e-05, 0.00013106108235378652] and parameters: {'n_layers': 1, 'embedding_dim': 64, 'lr': 2.2676180158888087e-05, 'lambda_val': 6.625860010406062e-06, 'batch_size': 2341, 'optimizer': 'RMSprop'}.
2026-07-08 16:26:54,795 - experiment_functions - INFO - Early stopping at epoch 1300. Best Metrics: (0.0029480789372984925, 0.0007303915050434056, 0.0018470194108286952)
2026-07-08 16:26:54,882 - optuna.study.study - INFO - Trial 90 finished with values: [0.0029480789372984925, 0.0007303915050434056, 0.0018470194108286952] and parameters: {'n_layers': 1, 'embedding_dim': 32, 'lr': 0.0024216232986666152, 'lambda_val': 0.0011281569069505463, 'batch_size': 3093, 'optimizer': 'Adam'}.
2026-07-08 16:30:44,491 - experiment_functions - INFO - Early stopping at epoch 3000. Best Metrics: (0.00034031270514423256, 7.313412989381304e-05, 0.00018947347639435672)
2026-07-08 16:30:44,582 - optuna.study.study - INFO - Trial 91 finished with values: [0.00034031270514423256, 7.313412989381304e-05, 0.00018947347639435672] and parameters: {'n_layers': 2, 'embedding_dim': 64, 'lr': 6.440420204683438e-05, 'lambda_val': 0.00013037887369277324, 'batch_size': 3705, 'optimizer': 'Adam'}.
2026-07-08 16:33:10,120 - experiment_functions - INFO - Early stopping at epoch 1800. Best Metrics: (0.004543091300555382, 0.0011606481393537603, 0.002928808510545521)
