2026-07-02 02:11:08,857 - optuna.study.study - INFO - Trial 36 finished with values: [0.00021447959847889676, 5.888722147294038e-05, 0.00012564689233593112] and parameters: {'n_layers': 4, 'embedding_dim': 96, 'lr': 0.002187649930388769, 'lambda_val': 0.00644136210147127, 'batch_size': 943, 'optimizer': 'SGD'}.
2026-07-02 02:12:22,882 - experiment_functions - INFO - Early stopping at epoch 850. Best Metrics: (0.0024247226962083204, 0.0007113956271489086, 0.0016707786430171963)
2026-07-02 02:12:23,193 - optuna.study.study - INFO - Trial 37 finished with values: [0.0024247226962083204, 0.0007113956271489086, 0.0016707786430171963] and parameters: {'n_layers': 4, 'embedding_dim': 96, 'lr': 0.0028258902906977677, 'lambda_val': 1.0477656620736208e-06, 'batch_size': 3749, 'optimizer': 'RMSprop'}.
2026-07-02 02:15:11,515 - experiment_functions - INFO - Early stopping at epoch 1700. Best Metrics: (0.00028789644355934593, 7.313412989381304e-05, 0.00016026586543965355)
2026-07-02 02:15:11,645 - optuna.study.study - INFO - Trial 38 finished with values: [0.00028789644355934593, 7.313412989381304e-05, 0.00016026586543965355] and parameters: {'n_layers': 3, 'embedding_dim': 256, 'lr': 5.5489211823800494e-05, 'lambda_val': 0.0002170880885037146, 'batch_size': 2934, 'optimizer': 'Adam'}.
2026-07-02 02:16:16,090 - experiment_functions - INFO - Early stopping at epoch 800. Best Metrics: (0.000231008098622599, 6.458598484128944e-05, 0.0001374174453811699)
2026-07-02 02:16:16,169 - optuna.study.study - INFO - Trial 39 finished with values: [0.000231008098622599, 6.458598484128944e-05, 0.0001374174453811699] and parameters: {'n_layers': 3, 'embedding_dim': 64, 'lr': 0.06613475956745304, 'lambda_val': 0.0004976273024208063, 'batch_size': 2600, 'optimizer': 'SGD'}.
2026-07-02 02:16:59,829 - experiment_functions - INFO - Early stopping at epoch 500. Best Metrics: (0.00019093595532660394, 4.653990084151739e-05, 9.702682165324303e-05)
2026-07-02 02:16:59,935 - optuna.study.study - INFO - Trial 40 finished with values: [0.00019093595532660394, 4.653990084151739e-05, 9.702682165324303e-05] and parameters: {'n_layers': 2, 'embedding_dim': 128, 'lr': 6.250873814374013e-05, 'lambda_val': 0.000470133233677045, 'batch_size': 1650, 'optimizer': 'SGD'}.
2026-07-02 02:17:57,788 - experiment_functions - INFO - Early stopping at epoch 550. Best Metrics: (0.0017788453529944163, 0.00048534468020439565, 0.0011931295964920329)
2026-07-02 02:17:57,879 - optuna.study.study - INFO - Trial 41 finished with values: [0.0017788453529944163, 0.00048534468020439565, 0.0011931295964920329] and parameters: {'n_layers': 3, 'embedding_dim': 256, 'lr': 0.056177353679575485, 'lambda_val': 4.0508714922137996e-06, 'batch_size': 3798, 'optimizer': 'Adam'}.
2026-07-02 02:18:38,159 - experiment_functions - INFO - Early stopping at epoch 500. Best Metrics: (0.0002037563769266831, 5.128887031514162e-05, 0.00012374348256096766)
2026-07-02 02:18:38,991 - optuna.study.study - INFO - Trial 42 finished with values: [0.0002037563769266831, 5.128887031514162e-05, 0.00012374348256096766] and parameters: {'n_layers': 3, 'embedding_dim': 32, 'lr': 0.007598848449211728, 'lambda_val': 1.4622967864471067e-05, 'batch_size': 514, 'optimizer': 'SGD'}.
2026-07-02 02:19:27,105 - experiment_functions - INFO - Early stopping at epoch 600. Best Metrics: (0.001155099889030805, 0.000293486313469977, 0.0007711149387191145)
2026-07-02 02:19:27,186 - optuna.study.study - INFO - Trial 43 finished with values: [0.001155099889030805, 0.000293486313469977, 0.0007711149387191145] and parameters: {'n_layers': 1, 'embedding_dim': 64, 'lr': 0.024076413698433347, 'lambda_val': 0.00016675627852349786, 'batch_size': 1094, 'optimizer': 'Adam'}.
2026-07-02 02:20:23,597 - experiment_functions - INFO - Early stopping at epoch 600. Best Metrics: (0.002009063034136742, 0.0005651273673612827, 0.0013208253864710228)
2026-07-02 02:20:23,706 - optuna.study.study - INFO - Trial 44 finished with values: [0.002009063034136742, 0.0005651273673612827, 0.0013208253864710228] and parameters: {'n_layers': 4, 'embedding_dim': 128, 'lr': 0.01321022891213974, 'lambda_val': 0.00010877216929113007, 'batch_size': 3621, 'optimizer': 'Adam'}.
2026-07-02 02:21:04,478 - experiment_functions - INFO - Early stopping at epoch 500. Best Metrics: (0.00019229568686088673, 4.938928252569193e-05, 9.446709541660862e-05)
2026-07-02 02:21:04,612 - optuna.study.study - INFO - Trial 45 finished with values: [0.00019229568686088673, 4.938928252569193e-05, 9.446709541660862e-05] and parameters: {'n_layers': 4, 'embedding_dim': 32, 'lr': 0.00036711774874903687, 'lambda_val': 0.09570540207453783, 'batch_size': 1877, 'optimizer': 'SGD'}.
2026-07-02 02:22:49,018 - experiment_functions - INFO - Early stopping at epoch 1300. Best Metrics: (0.001305540403014099, 0.0004331060159945292, 0.0009417051288494023)
2026-07-02 02:22:49,087 - optuna.study.study - INFO - Trial 46 finished with values: [0.001305540403014099, 0.0004331060159945292, 0.0009417051288494023] and parameters: {'n_layers': 1, 'embedding_dim': 128, 'lr': 0.005014370880052961, 'lambda_val': 0.011356721163774775, 'batch_size': 3443, 'optimizer': 'Adam'}.
2026-07-02 02:23:31,392 - experiment_functions - INFO - Early stopping at epoch 500. Best Metrics: (0.00022276498369161435, 5.033907642041677e-05, 0.00011329369288641185)
2026-07-02 02:23:31,515 - optuna.study.study - INFO - Trial 47 finished with values: [0.00022276498369161435, 5.033907642041677e-05, 0.00011329369288641185] and parameters: {'n_layers': 2, 'embedding_dim': 96, 'lr': 0.03248817241566917, 'lambda_val': 2.812357061411649e-06, 'batch_size': 607, 'optimizer': 'SGD'}.
2026-07-02 02:26:50,404 - experiment_functions - INFO - Early stopping at epoch 2450. Best Metrics: (0.0012370363880515368, 0.00039796364188971, 0.0008425348707704592)
2026-07-02 02:26:50,470 - optuna.study.study - INFO - Trial 48 finished with values: [0.0012370363880515368, 0.00039796364188971, 0.0008425348707704592] and parameters: {'n_layers': 2, 'embedding_dim': 128, 'lr': 0.002399062123093389, 'lambda_val': 0.08701027942844691, 'batch_size': 1093, 'optimizer': 'RMSprop'}.
2026-07-02 02:29:31,444 - experiment_functions - INFO - Early stopping at epoch 2150. Best Metrics: (0.001289825775264619, 0.00042360807704728073, 0.0008536235145335219)
2026-07-02 02:29:31,503 - optuna.study.study - INFO - Trial 49 finished with values: [0.001289825775264619, 0.00042360807704728073, 0.0008536235145335219] and parameters: {'n_layers': 1, 'embedding_dim': 64, 'lr': 0.06668313223783916, 'lambda_val': 0.01586888242047408, 'batch_size': 3308, 'optimizer': 'RMSprop'}.
2026-07-02 02:30:15,628 - experiment_functions - INFO - Early stopping at epoch 550. Best Metrics: (0.0012313322354497325, 0.0002887373439963528, 0.0007017977210180094)
2026-07-02 02:30:16,095 - optuna.study.study - INFO - Trial 50 finished with values: [0.0012313322354497325, 0.0002887373439963528, 0.0007017977210180094] and parameters: {'n_layers': 2, 'embedding_dim': 32, 'lr': 0.045113699425930284, 'lambda_val': 1.31939091185931e-06, 'batch_size': 3363, 'optimizer': 'RMSprop'}.
2026-07-02 02:31:04,621 - experiment_functions - INFO - Early stopping at epoch 500. Best Metrics: (0.0002422447597483603, 5.7937427578215534e-05, 0.0001486074189294395)
2026-07-02 02:31:04,705 - optuna.study.study - INFO - Trial 51 finished with values: [0.0002422447597483603, 5.7937427578215534e-05, 0.0001486074189294395] and parameters: {'n_layers': 2, 'embedding_dim': 256, 'lr': 0.002399062123093389, 'lambda_val': 2.079258642930449e-06, 'batch_size': 2783, 'optimizer': 'SGD'}.
2026-07-02 02:32:59,604 - experiment_functions - INFO - Early stopping at epoch 1450. Best Metrics: (0.002686942775143867, 0.0007455882073590031, 0.001759541020957093)
2026-07-02 02:32:59,690 - optuna.study.study - INFO - Trial 52 finished with values: [0.002686942775143867, 0.0007455882073590031, 0.001759541020957093] and parameters: {'n_layers': 3, 'embedding_dim': 64, 'lr': 0.0014374939555211086, 'lambda_val': 2.188289071859108e-05, 'batch_size': 2754, 'optimizer': 'RMSprop'}.
2026-07-02 02:33:43,492 - experiment_functions - INFO - Early stopping at epoch 500. Best Metrics: (0.00025601737779567694, 5.6987633683490685e-05, 0.00014133015922567155)
2026-07-02 02:33:43,754 - optuna.study.study - INFO - Trial 53 finished with values: [0.00025601737779567694, 5.6987633683490685e-05, 0.00014133015922567155] and parameters: {'n_layers': 3, 'embedding_dim': 96, 'lr': 0.00014917037753832052, 'lambda_val': 0.0009310566593716265, 'batch_size': 3132, 'optimizer': 'SGD'}.
2026-07-02 02:34:31,626 - experiment_functions - INFO - Early stopping at epoch 550. Best Metrics: (0.0013913386414600472, 0.00038941549683718635, 0.001046627775220952)
2026-07-02 02:34:31,732 - optuna.study.study - INFO - Trial 54 finished with values: [0.0013913386414600472, 0.00038941549683718635, 0.001046627775220952] and parameters: {'n_layers': 3, 'embedding_dim': 96, 'lr': 0.09830365736003598, 'lambda_val': 1.5990539279825177e-06, 'batch_size': 1422, 'optimizer': 'RMSprop'}.
2026-07-02 02:36:12,495 - experiment_functions - INFO - Early stopping at epoch 1000. Best Metrics: (0.00027557324586524796, 6.553577873601429e-05, 0.0001455073480001142)
2026-07-02 02:36:12,574 - optuna.study.study - INFO - Trial 55 finished with values: [0.00027557324586524796, 6.553577873601429e-05, 0.0001455073480001142] and parameters: {'n_layers': 3, 'embedding_dim': 256, 'lr': 5.5489211823800494e-05, 'lambda_val': 0.00016675627852349786, 'batch_size': 1094, 'optimizer': 'Adam'}.
2026-07-02 02:41:02,722 - experiment_functions - INFO - Early stopping at epoch 3500. Best Metrics: (0.000521444675055746, 0.00013297114526147829, 0.0003228112867412288)
2026-07-02 02:41:02,800 - optuna.study.study - INFO - Trial 56 finished with values: [0.000521444675055746, 0.00013297114526147829, 0.0003228112867412288] and parameters: {'n_layers': 4, 'embedding_dim': 96, 'lr': 0.00018259669020323155, 'lambda_val': 0.0007768299501636463, 'batch_size': 1127, 'optimizer': 'Adam'}.
2026-07-02 02:41:48,908 - experiment_functions - INFO - Early stopping at epoch 550. Best Metrics: (0.0017457046742690282, 0.00048819406188857023, 0.001222786990459917)
2026-07-02 02:41:49,009 - optuna.study.study - INFO - Trial 57 finished with values: [0.0017457046742690282, 0.00048819406188857023, 0.001222786990459917] and parameters: {'n_layers': 3, 'embedding_dim': 64, 'lr': 0.023233384256700264, 'lambda_val': 0.00010191497823375508, 'batch_size': 2099, 'optimizer': 'Adam'}.
2026-07-02 02:46:35,100 - experiment_functions - INFO - Early stopping at epoch 3750. Best Metrics: (0.001585179214550777, 0.0004188591075736565, 0.0010874131712107827)
2026-07-02 02:46:35,427 - optuna.study.study - INFO - Trial 58 finished with values: [0.001585179214550777, 0.0004188591075736565, 0.0010874131712107827] and parameters: {'n_layers': 1, 'embedding_dim': 96, 'lr': 0.0030391544431764782, 'lambda_val': 4.511964630571835e-05, 'batch_size': 3798, 'optimizer': 'Adam'}.
2026-07-02 02:51:37,934 - optuna.study.study - INFO - Trial 59 finished with values: [0.0018183250779461929, 0.0004502023060995764, 0.0012204551517825243] and parameters: {'n_layers': 2, 'embedding_dim': 64, 'lr': 0.00042777516068918454, 'lambda_val': 0.0006325039773618912, 'batch_size': 3842, 'optimizer': 'RMSprop'}.
2026-07-02 02:52:20,110 - experiment_functions - INFO - Early stopping at epoch 500. Best Metrics: (0.0001914491091483793, 5.5088045894040994e-05, 0.0001243809212177401)
2026-07-02 02:52:20,219 - optuna.study.study - INFO - Trial 60 finished with values: [0.0001914491091483793, 5.5088045894040994e-05, 0.0001243809212177401] and parameters: {'n_layers': 2, 'embedding_dim': 96, 'lr': 0.03248817241566917, 'lambda_val': 2.812357061411649e-06, 'batch_size': 607, 'optimizer': 'SGD'}.
2026-07-02 02:55:46,180 - experiment_functions - INFO - Early stopping at epoch 2800. Best Metrics: (0.0010072290935357472, 0.0003371768326273199, 0.000715904702672808)
2026-07-02 02:55:46,473 - optuna.study.study - INFO - Trial 61 finished with values: [0.0010072290935357472, 0.0003371768326273199, 0.000715904702672808] and parameters: {'n_layers': 2, 'embedding_dim': 32, 'lr': 0.0029910676555346106, 'lambda_val': 0.0823868703803942, 'batch_size': 3828, 'optimizer': 'RMSprop'}.
2026-07-02 03:01:34,879 - optuna.study.study - INFO - Trial 62 finished with values: [0.0011242310892910557, 0.00026689208441768136, 0.0007449460388995828] and parameters: {'n_layers': 4, 'embedding_dim': 128, 'lr': 0.00018259669020323155, 'lambda_val': 0.0007768299501636463, 'batch_size': 3901, 'optimizer': 'Adam'}.
2026-07-02 03:07:01,570 - optuna.study.study - INFO - Trial 63 finished with values: [0.0010368805068620016, 0.00023459909199703667, 0.0006079089036790818] and parameters: {'n_layers': 2, 'embedding_dim': 128, 'lr': 0.0002889968108070523, 'lambda_val': 4.0508714922137996e-06, 'batch_size': 1928, 'optimizer': 'Adam'}.
2026-07-02 03:07:43,584 - experiment_functions - INFO - Early stopping at epoch 500. Best Metrics: (0.0002464751835935263, 6.268639705183976e-05, 0.00014147634735763406)
2026-07-02 03:07:43,678 - optuna.study.study - INFO - Trial 64 finished with values: [0.0002464751835935263, 6.268639705183976e-05, 0.00014147634735763406] and parameters: {'n_layers': 1, 'embedding_dim': 128, 'lr': 8.612406430930879e-05, 'lambda_val': 0.00016675627852349786, 'batch_size': 1094, 'optimizer': 'SGD'}.
2026-07-02 03:08:36,999 - experiment_functions - INFO - Early stopping at epoch 500. Best Metrics: (0.0007265293562293419, 0.0001975571301027677, 0.0005921229455066823)
2026-07-02 03:08:38,156 - optuna.study.study - INFO - Trial 65 finished with values: [0.0007265293562293419, 0.0001975571301027677, 0.0005921229455066823] and parameters: {'n_layers': 3, 'embedding_dim': 256, 'lr': 0.06613475956745304, 'lambda_val': 0.0132654287745143, 'batch_size': 2600, 'optimizer': 'Adam'}.
2026-07-02 03:09:36,204 - experiment_functions - INFO - Early stopping at epoch 550. Best Metrics: (0.0002695778676380556, 7.123454210436335e-05, 0.00015422633052540304)
2026-07-02 03:09:36,299 - optuna.study.study - INFO - Trial 66 finished with values: [0.0002695778676380556, 7.123454210436335e-05, 0.00015422633052540304] and parameters: {'n_layers': 3, 'embedding_dim': 256, 'lr': 1.03728568256777e-05, 'lambda_val': 0.0029530671100145302, 'batch_size': 2099, 'optimizer': 'Adam'}.
2026-07-02 03:10:22,827 - experiment_functions - INFO - Early stopping at epoch 550. Best Metrics: (0.001487282414957057, 0.0004416541610470528, 0.0010611055684744126)
2026-07-02 03:10:22,918 - optuna.study.study - INFO - Trial 67 finished with values: [0.001487282414957057, 0.0004416541610470528, 0.0010611055684744126] and parameters: {'n_layers': 3, 'embedding_dim': 64, 'lr': 0.014582350289404945, 'lambda_val': 0.0005770865766618662, 'batch_size': 2610, 'optimizer': 'RMSprop'}.
2026-07-02 03:11:12,464 - experiment_functions - INFO - Early stopping at epoch 550. Best Metrics: (0.0018160380890636528, 0.0005100393214672417, 0.00128281973099586)
2026-07-02 03:11:12,587 - optuna.study.study - INFO - Trial 68 finished with values: [0.0018160380890636528, 0.0005100393214672417, 0.00128281973099586] and parameters: {'n_layers': 4, 'embedding_dim': 96, 'lr': 0.014582350289404945, 'lambda_val': 1.5990539279825177e-06, 'batch_size': 3749, 'optimizer': 'RMSprop'}.
2026-07-02 03:11:57,752 - experiment_functions - INFO - Early stopping at epoch 500. Best Metrics: (0.00015455100988314127, 4.843948863096708e-05, 8.860113110016791e-05)
2026-07-02 03:11:57,860 - optuna.study.study - INFO - Trial 69 finished with values: [0.00015455100988314127, 4.843948863096708e-05, 8.860113110016791e-05] and parameters: {'n_layers': 3, 'embedding_dim': 128, 'lr': 0.0024426924601332993, 'lambda_val': 0.015248414860902306, 'batch_size': 2066, 'optimizer': 'SGD'}.
2026-07-02 03:16:24,363 - experiment_functions - INFO - Early stopping at epoch 3600. Best Metrics: (0.0004472700319816458, 0.00010827650399863232, 0.0002606819094070775)
2026-07-02 03:16:24,450 - optuna.study.study - INFO - Trial 70 finished with values: [0.0004472700319816458, 0.00010827650399863232, 0.0002606819094070775] and parameters: {'n_layers': 2, 'embedding_dim': 32, 'lr': 0.00014773530353946488, 'lambda_val': 1.3509843414861852e-06, 'batch_size': 2355, 'optimizer': 'Adam'}.
2026-07-02 03:21:30,005 - optuna.study.study - INFO - Trial 71 finished with values: [0.0017051778501991285, 0.00040746158083695836, 0.0010919799792962002] and parameters: {'n_layers': 1, 'embedding_dim': 96, 'lr': 0.00042777516068918454, 'lambda_val': 0.00031903142585685315, 'batch_size': 3462, 'optimizer': 'RMSprop'}.
2026-07-02 03:22:32,546 - experiment_functions - INFO - Early stopping at epoch 750. Best Metrics: (0.0014164520925350349, 0.0003599718861007162, 0.0009346664421456963)
2026-07-02 03:22:32,626 - optuna.study.study - INFO - Trial 72 finished with values: [0.0014164520925350349, 0.0003599718861007162, 0.0009346664421456963] and parameters: {'n_layers': 1, 'embedding_dim': 128, 'lr': 0.014582350289404945, 'lambda_val': 0.00010877216929113007, 'batch_size': 1280, 'optimizer': 'Adam'}.
2026-07-02 03:25:37,741 - experiment_functions - INFO - Early stopping at epoch 2150. Best Metrics: (0.0011535581693542715, 0.0004074615808369584, 0.0008620121861037555)
2026-07-02 03:25:37,850 - optuna.study.study - INFO - Trial 73 finished with values: [0.0011535581693542715, 0.0004074615808369584, 0.0008620121861037555] and parameters: {'n_layers': 1, 'embedding_dim': 256, 'lr': 0.06668313223783916, 'lambda_val': 0.01586888242047408, 'batch_size': 3308, 'optimizer': 'RMSprop'}.
2026-07-02 03:26:30,353 - experiment_functions - INFO - Early stopping at epoch 600. Best Metrics: (0.0013505876565730736, 0.0003998632296791596, 0.0009986509705767047)
2026-07-02 03:26:30,449 - optuna.study.study - INFO - Trial 74 finished with values: [0.0013505876565730736, 0.0003998632296791596, 0.0009986509705767047] and parameters: {'n_layers': 2, 'embedding_dim': 128, 'lr': 0.040943052425008536, 'lambda_val': 1.5804245804508879e-06, 'batch_size': 2305, 'optimizer': 'RMSprop'}.
2026-07-02 03:31:25,173 - experiment_functions - INFO - Early stopping at epoch 3950. Best Metrics: (0.0011265682036130297, 0.0003590220922059913, 0.0008149452762108037)
2026-07-02 03:31:25,501 - optuna.study.study - INFO - Trial 75 finished with values: [0.0011265682036130297, 0.0003590220922059913, 0.0008149452762108037] and parameters: {'n_layers': 1, 'embedding_dim': 64, 'lr': 0.002187649930388769, 'lambda_val': 0.01586888242047408, 'batch_size': 3308, 'optimizer': 'RMSprop'}.
2026-07-02 03:32:10,292 - experiment_functions - INFO - Early stopping at epoch 500. Best Metrics: (0.00022756427020524385, 5.7937427578215534e-05, 0.00013036881630223404)
2026-07-02 03:32:10,609 - optuna.study.study - INFO - Trial 76 finished with values: [0.00022756427020524385, 5.7937427578215534e-05, 0.00013036881630223404] and parameters: {'n_layers': 4, 'embedding_dim': 96, 'lr': 0.00042777516068918454, 'lambda_val': 0.00031903142585685315, 'batch_size': 1008, 'optimizer': 'SGD'}.
2026-07-02 03:34:41,614 - experiment_functions - INFO - Early stopping at epoch 1950. Best Metrics: (0.0012746830923689792, 0.00044260395494177764, 0.0008997960315948833)
2026-07-02 03:34:41,695 - optuna.study.study - INFO - Trial 77 finished with values: [0.0012746830923689792, 0.00044260395494177764, 0.0008997960315948833] and parameters: {'n_layers': 1, 'embedding_dim': 96, 'lr': 0.06668313223783916, 'lambda_val': 0.00644136210147127, 'batch_size': 3308, 'optimizer': 'RMSprop'}.
2026-07-02 03:40:04,497 - optuna.study.study - INFO - Trial 78 finished with values: [0.0006359378213743198, 0.0001519670231559752, 0.00042078440523792796] and parameters: {'n_layers': 3, 'embedding_dim': 96, 'lr': 0.0001797315454341379, 'lambda_val': 0.00032528490658824676, 'batch_size': 1928, 'optimizer': 'RMSprop'}.
2026-07-02 03:44:04,163 - experiment_functions - INFO - Early stopping at epoch 2950. Best Metrics: (0.00108138088942442, 0.0003590220922059913, 0.0007691734788780156)
2026-07-02 03:44:04,267 - optuna.study.study - INFO - Trial 79 finished with values: [0.00108138088942442, 0.0003590220922059913, 0.0007691734788780156] and parameters: {'n_layers': 2, 'embedding_dim': 128, 'lr': 0.002399062123093389, 'lambda_val': 0.08701027942844691, 'batch_size': 611, 'optimizer': 'RMSprop'}.
2026-07-02 03:44:56,388 - experiment_functions - INFO - Early stopping at epoch 650. Best Metrics: (0.0011009521733656795, 0.0002906369317858025, 0.0007280149162163416)
2026-07-02 03:44:56,484 - optuna.study.study - INFO - Trial 80 finished with values: [0.0011009521733656795, 0.0002906369317858025, 0.0007280149162163416] and parameters: {'n_layers': 1, 'embedding_dim': 64, 'lr': 0.056177353679575485, 'lambda_val': 4.0508714922137996e-06, 'batch_size': 3798, 'optimizer': 'RMSprop'}.
2026-07-02 03:45:39,076 - experiment_functions - INFO - Early stopping at epoch 500. Best Metrics: (0.0002641216884829634, 6.743536652546397e-05, 0.00013897554098312888)
2026-07-02 03:45:39,161 - optuna.study.study - INFO - Trial 81 finished with values: [0.0002641216884829634, 6.743536652546397e-05, 0.00013897554098312888] and parameters: {'n_layers': 3, 'embedding_dim': 64, 'lr': 0.000325465829822804, 'lambda_val': 0.00010877216929113007, 'batch_size': 2600, 'optimizer': 'SGD'}.
2026-07-02 03:51:29,435 - optuna.study.study - INFO - Trial 82 finished with values: [0.0011188737419225584, 0.00036946982504796466, 0.0008794254086821438] and parameters: {'n_layers': 4, 'embedding_dim': 128, 'lr': 0.0002889968108070523, 'lambda_val': 0.035063843860833145, 'batch_size': 3027, 'optimizer': 'Adam'}.
2026-07-02 03:52:10,933 - experiment_functions - INFO - Early stopping at epoch 500. Best Metrics: (0.0002350378671746242, 5.413825199931616e-05, 0.0001248597639147426)
