2026-07-09 03:25:01,677 - optuna.study.study - INFO - Trial 30 finished with values: [0.0030299899229376554, 0.0008025758410424938, 0.0020758609200813697] and parameters: {'n_layers': 3, 'embedding_dim': 128, 'lr': 0.022344778470315903, 'lambda_val': 2.3412742144575654e-05, 'batch_size': 3749, 'optimizer': 'RMSprop'}.
2026-07-09 03:27:45,420 - experiment_functions - INFO - Early stopping at epoch 2050. Best Metrics: (0.0001941002347146711, 5.603783978876584e-05, 0.00011331492305411404)
2026-07-09 03:27:45,536 - optuna.study.study - INFO - Trial 31 finished with values: [0.0001941002347146711, 5.603783978876584e-05, 0.00011331492305411404] and parameters: {'n_layers': 4, 'embedding_dim': 64, 'lr': 3.91864996277491e-05, 'lambda_val': 0.0011652940233306919, 'batch_size': 522, 'optimizer': 'RMSprop'}.
2026-07-09 03:28:31,091 - experiment_functions - INFO - Early stopping at epoch 500. Best Metrics: (0.0002504941316967312, 6.933495431491368e-05, 0.0001725724161291478)
2026-07-09 03:28:31,183 - optuna.study.study - INFO - Trial 32 finished with values: [0.0002504941316967312, 6.933495431491368e-05, 0.0001725724161291478] and parameters: {'n_layers': 1, 'embedding_dim': 256, 'lr': 0.00019882420960078224, 'lambda_val': 0.014854845100872049, 'batch_size': 3353, 'optimizer': 'SGD'}.
2026-07-09 03:29:15,435 - experiment_functions - INFO - Early stopping at epoch 500. Best Metrics: (0.00026644242393414905, 6.458598484128944e-05, 0.00013938611743078753)
2026-07-09 03:29:15,542 - optuna.study.study - INFO - Trial 33 finished with values: [0.00026644242393414905, 6.458598484128944e-05, 0.00013938611743078753] and parameters: {'n_layers': 3, 'embedding_dim': 96, 'lr': 2.031467734564216e-05, 'lambda_val': 8.677241964307935e-05, 'batch_size': 2678, 'optimizer': 'SGD'}.
2026-07-09 03:34:13,003 - optuna.study.study - INFO - Trial 34 finished with values: [0.0015090013473353907, 0.0003647208555743404, 0.0009081280476675928] and parameters: {'n_layers': 3, 'embedding_dim': 32, 'lr': 0.0003238137930013743, 'lambda_val': 0.004393949281710734, 'batch_size': 2676, 'optimizer': 'RMSprop'}.
2026-07-09 03:39:13,583 - optuna.study.study - INFO - Trial 35 finished with values: [0.005750042462918461, 0.0014835780635602074, 0.0037134797985180767] and parameters: {'n_layers': 3, 'embedding_dim': 32, 'lr': 0.0009933832570799663, 'lambda_val': 4.283705702171762e-05, 'batch_size': 1950, 'optimizer': 'Adam'}.
2026-07-09 03:41:15,884 - experiment_functions - INFO - Early stopping at epoch 1500. Best Metrics: (0.00030038897121849567, 6.743536652546399e-05, 0.00016807696695040906)
2026-07-09 03:41:15,981 - optuna.study.study - INFO - Trial 36 finished with values: [0.00030038897121849567, 6.743536652546399e-05, 0.00016807696695040906] and parameters: {'n_layers': 4, 'embedding_dim': 64, 'lr': 8.78527484752279e-05, 'lambda_val': 7.6066089751924715e-06, 'batch_size': 852, 'optimizer': 'Adam'}.
2026-07-09 03:42:02,042 - experiment_functions - INFO - Early stopping at epoch 550. Best Metrics: (0.0017358689245108993, 0.00044925251220485153, 0.0011018212310612981)
2026-07-09 03:42:02,391 - optuna.study.study - INFO - Trial 37 finished with values: [0.0017358689245108993, 0.00044925251220485153, 0.0011018212310612981] and parameters: {'n_layers': 2, 'embedding_dim': 64, 'lr': 0.0486854404732803, 'lambda_val': 0.00027451223795808247, 'batch_size': 3511, 'optimizer': 'Adam'}.
2026-07-09 03:44:19,532 - experiment_functions - INFO - Early stopping at epoch 1800. Best Metrics: (0.00019747901301442168, 5.413825199931616e-05, 0.00013775387799437795)
2026-07-09 03:44:19,621 - optuna.study.study - INFO - Trial 38 finished with values: [0.00019747901301442168, 5.413825199931616e-05, 0.00013775387799437795] and parameters: {'n_layers': 3, 'embedding_dim': 32, 'lr': 6.298882866435582e-05, 'lambda_val': 5.5763346489736074e-05, 'batch_size': 1799, 'optimizer': 'RMSprop'}.
2026-07-09 03:45:15,473 - experiment_functions - INFO - Early stopping at epoch 500. Best Metrics: (0.00019201733526243565, 4.6539900841517406e-05, 8.934698472087081e-05)
2026-07-09 03:45:15,569 - optuna.study.study - INFO - Trial 39 finished with values: [0.00019201733526243565, 4.6539900841517406e-05, 8.934698472087081e-05] and parameters: {'n_layers': 4, 'embedding_dim': 256, 'lr': 0.06406942259680014, 'lambda_val': 1.0990535065799254e-06, 'batch_size': 2326, 'optimizer': 'SGD'}.
2026-07-09 03:45:57,282 - experiment_functions - INFO - Early stopping at epoch 500. Best Metrics: (0.00018922200646323244, 5.033907642041677e-05, 0.00010562677172261297)
2026-07-09 03:45:57,848 - optuna.study.study - INFO - Trial 40 finished with values: [0.00018922200646323244, 5.033907642041677e-05, 0.00010562677172261297] and parameters: {'n_layers': 2, 'embedding_dim': 64, 'lr': 7.515418415124854e-05, 'lambda_val': 4.774158578457357e-06, 'batch_size': 2514, 'optimizer': 'SGD'}.
2026-07-09 03:47:34,473 - experiment_functions - INFO - Early stopping at epoch 1050. Best Metrics: (0.006396953259484696, 0.0017770643770301845, 0.004122928039189433)
2026-07-09 03:47:34,589 - optuna.study.study - INFO - Trial 41 finished with values: [0.006396953259484696, 0.0017770643770301845, 0.004122928039189433] and parameters: {'n_layers': 4, 'embedding_dim': 128, 'lr': 0.0012370258800213725, 'lambda_val': 4.2435261213741795e-05, 'batch_size': 3688, 'optimizer': 'RMSprop'}.
2026-07-09 03:48:14,313 - experiment_functions - INFO - Early stopping at epoch 500. Best Metrics: (0.0001811722602906182, 5.033907642041677e-05, 0.00011394366234353111)
2026-07-09 03:48:14,712 - optuna.study.study - INFO - Trial 42 finished with values: [0.0001811722602906182, 5.033907642041677e-05, 0.00011394366234353111] and parameters: {'n_layers': 1, 'embedding_dim': 32, 'lr': 2.0479813635547972e-05, 'lambda_val': 3.9016516910522124e-06, 'batch_size': 1564, 'optimizer': 'SGD'}.
2026-07-09 03:53:54,820 - optuna.study.study - INFO - Trial 43 finished with values: [0.0006532258252157139, 0.00017096290105047204, 0.0004091815067113614] and parameters: {'n_layers': 3, 'embedding_dim': 128, 'lr': 0.00025094651457722674, 'lambda_val': 8.372971273885268e-05, 'batch_size': 1232, 'optimizer': 'Adam'}.
2026-07-09 03:54:38,460 - experiment_functions - INFO - Early stopping at epoch 500. Best Metrics: (0.00017724840383948949, 4.559010694679254e-05, 0.00010020527927483162)
2026-07-09 03:54:38,546 - optuna.study.study - INFO - Trial 44 finished with values: [0.00017724840383948949, 4.559010694679254e-05, 0.00010020527927483162] and parameters: {'n_layers': 4, 'embedding_dim': 64, 'lr': 1.7895256428566285e-05, 'lambda_val': 0.00987375969885586, 'batch_size': 1698, 'optimizer': 'Adam'}.
2026-07-09 03:55:28,252 - experiment_functions - INFO - Early stopping at epoch 500. Best Metrics: (0.00022933221823040538, 6.268639705183976e-05, 0.0001466845706725529)
2026-07-09 03:55:28,349 - optuna.study.study - INFO - Trial 45 finished with values: [0.00022933221823040538, 6.268639705183976e-05, 0.0001466845706725529] and parameters: {'n_layers': 2, 'embedding_dim': 256, 'lr': 0.004747757026282931, 'lambda_val': 0.00028936387545849617, 'batch_size': 3275, 'optimizer': 'SGD'}.
2026-07-09 04:01:55,383 - experiment_functions - INFO - Early stopping at epoch 3900. Best Metrics: (0.0002941206628477342, 8.073248105161182e-05, 0.00015962459038722736)
2026-07-09 04:01:55,478 - optuna.study.study - INFO - Trial 46 finished with values: [0.0002941206628477342, 8.073248105161182e-05, 0.00015962459038722736] and parameters: {'n_layers': 3, 'embedding_dim': 256, 'lr': 0.0001245381815182955, 'lambda_val': 0.0038626657865433334, 'batch_size': 1024, 'optimizer': 'Adam'}.
2026-07-09 04:06:34,159 - experiment_functions - INFO - Early stopping at epoch 3600. Best Metrics: (0.0026505951537447916, 0.0007987766654635943, 0.0017277130574284258)
2026-07-09 04:06:34,247 - optuna.study.study - INFO - Trial 47 finished with values: [0.0026505951537447916, 0.0007987766654635943, 0.0017277130574284258] and parameters: {'n_layers': 1, 'embedding_dim': 96, 'lr': 0.0157169112767473, 'lambda_val': 0.015857575008722438, 'batch_size': 3057, 'optimizer': 'Adam'}.
2026-07-09 04:07:19,930 - experiment_functions - INFO - Early stopping at epoch 550. Best Metrics: (0.0016411003756400145, 0.0004207586953631062, 0.001140692527557411)
2026-07-09 04:07:20,016 - optuna.study.study - INFO - Trial 48 finished with values: [0.0016411003756400145, 0.0004207586953631062, 0.001140692527557411] and parameters: {'n_layers': 2, 'embedding_dim': 64, 'lr': 0.07579813949997813, 'lambda_val': 5.256381809738742e-06, 'batch_size': 3411, 'optimizer': 'Adam'}.
2026-07-09 04:08:03,017 - experiment_functions - INFO - Early stopping at epoch 500. Best Metrics: (0.00020156792123989035, 5.603783978876584e-05, 0.00011402202950896923)
2026-07-09 04:08:03,109 - optuna.study.study - INFO - Trial 49 finished with values: [0.00020156792123989035, 5.603783978876584e-05, 0.00011402202950896923] and parameters: {'n_layers': 4, 'embedding_dim': 64, 'lr': 0.00015104065867283445, 'lambda_val': 3.611266032654966e-06, 'batch_size': 1425, 'optimizer': 'SGD'}.
2026-07-09 04:08:44,105 - experiment_functions - INFO - Early stopping at epoch 500. Best Metrics: (0.000183174440888928, 5.128887031514162e-05, 0.00011127441665233556)
2026-07-09 04:08:44,273 - optuna.study.study - INFO - Trial 50 finished with values: [0.000183174440888928, 5.128887031514162e-05, 0.00011127441665233556] and parameters: {'n_layers': 1, 'embedding_dim': 64, 'lr': 0.00019882420960078224, 'lambda_val': 0.014854845100872049, 'batch_size': 3353, 'optimizer': 'SGD'}.
2026-07-09 04:09:38,338 - experiment_functions - INFO - Early stopping at epoch 500. Best Metrics: (0.0002454906363723769, 7.028474820963853e-05, 0.0001351831540612424)
2026-07-09 04:09:38,429 - optuna.study.study - INFO - Trial 51 finished with values: [0.0002454906363723769, 7.028474820963853e-05, 0.0001351831540612424] and parameters: {'n_layers': 3, 'embedding_dim': 256, 'lr': 0.0001245381815182955, 'lambda_val': 0.05993758381779579, 'batch_size': 3886, 'optimizer': 'Adam'}.
2026-07-09 04:12:09,776 - experiment_functions - INFO - Early stopping at epoch 1950. Best Metrics: (0.0003040376635958939, 7.218433599908821e-05, 0.00015600509781892128)
2026-07-09 04:12:09,863 - optuna.study.study - INFO - Trial 52 finished with values: [0.0003040376635958939, 7.218433599908821e-05, 0.00015600509781892128] and parameters: {'n_layers': 2, 'embedding_dim': 64, 'lr': 3.8385225574059946e-05, 'lambda_val': 5.567710369086332e-06, 'batch_size': 3874, 'optimizer': 'RMSprop'}.
2026-07-09 04:14:07,775 - experiment_functions - INFO - Early stopping at epoch 1500. Best Metrics: (0.00023434333623003898, 5.603783978876584e-05, 0.000139681830001515)
2026-07-09 04:14:07,944 - optuna.study.study - INFO - Trial 53 finished with values: [0.00023434333623003898, 5.603783978876584e-05, 0.000139681830001515] and parameters: {'n_layers': 3, 'embedding_dim': 64, 'lr': 2.3006900989001136e-05, 'lambda_val': 5.567710369086332e-06, 'batch_size': 1235, 'optimizer': 'RMSprop'}.
2026-07-09 04:16:20,314 - experiment_functions - INFO - Early stopping at epoch 1650. Best Metrics: (0.0017832281735350025, 0.0005423323138878864, 0.0011746616314181337)
2026-07-09 04:16:20,403 - optuna.study.study - INFO - Trial 54 finished with values: [0.0017832281735350025, 0.0005423323138878864, 0.0011746616314181337] and parameters: {'n_layers': 2, 'embedding_dim': 96, 'lr': 0.0157169112767473, 'lambda_val': 0.03562985911238626, 'batch_size': 3057, 'optimizer': 'RMSprop'}.
2026-07-09 04:17:01,288 - experiment_functions - INFO - Early stopping at epoch 500. Best Metrics: (0.0002432709833440018, 5.888722147294038e-05, 0.00012155167320161601)
2026-07-09 04:17:01,385 - optuna.study.study - INFO - Trial 55 finished with values: [0.0002432709833440018, 5.888722147294038e-05, 0.00012155167320161601] and parameters: {'n_layers': 1, 'embedding_dim': 64, 'lr': 0.0012699811686993948, 'lambda_val': 0.015857575008722438, 'batch_size': 1425, 'optimizer': 'SGD'}.
2026-07-09 04:17:51,292 - experiment_functions - INFO - Early stopping at epoch 500. Best Metrics: (0.00021216495008616172, 5.603783978876584e-05, 0.00013014141089391534)
2026-07-09 04:17:51,392 - optuna.study.study - INFO - Trial 56 finished with values: [0.00021216495008616172, 5.603783978876584e-05, 0.00013014141089391534] and parameters: {'n_layers': 2, 'embedding_dim': 256, 'lr': 0.00025094651457722674, 'lambda_val': 0.05204908485850305, 'batch_size': 1232, 'optimizer': 'RMSprop'}.
2026-07-09 04:19:18,269 - experiment_functions - INFO - Early stopping at epoch 1100. Best Metrics: (0.0019587935506366044, 0.0005024409703094429, 0.0012478467394800912)
2026-07-09 04:19:18,370 - optuna.study.study - INFO - Trial 57 finished with values: [0.0019587935506366044, 0.0005024409703094429, 0.0012478467394800912] and parameters: {'n_layers': 1, 'embedding_dim': 96, 'lr': 0.01758124022883156, 'lambda_val': 2.6297098918287958e-05, 'batch_size': 2256, 'optimizer': 'RMSprop'}.
2026-07-09 04:20:19,326 - experiment_functions - INFO - Early stopping at epoch 750. Best Metrics: (0.002689331470343632, 0.0007607849096746006, 0.001743585987842256)
2026-07-09 04:20:19,423 - optuna.study.study - INFO - Trial 58 finished with values: [0.002689331470343632, 0.0007607849096746006, 0.001743585987842256] and parameters: {'n_layers': 2, 'embedding_dim': 64, 'lr': 0.0021747513461376077, 'lambda_val': 0.010570956583988819, 'batch_size': 2698, 'optimizer': 'RMSprop'}.
2026-07-09 04:21:01,699 - experiment_functions - INFO - Early stopping at epoch 500. Best Metrics: (0.0002043071493166145, 6.268639705183976e-05, 0.00012613804344964284)
2026-07-09 04:21:01,788 - optuna.study.study - INFO - Trial 59 finished with values: [0.0002043071493166145, 6.268639705183976e-05, 0.00012613804344964284] and parameters: {'n_layers': 3, 'embedding_dim': 64, 'lr': 0.0018829727920662888, 'lambda_val': 0.05359174045352731, 'batch_size': 734, 'optimizer': 'SGD'}.
2026-07-09 04:21:50,625 - experiment_functions - INFO - Early stopping at epoch 550. Best Metrics: (0.003579506852926584, 0.0009488441008301199, 0.0022213811211051356)
2026-07-09 04:21:51,232 - optuna.study.study - INFO - Trial 60 finished with values: [0.003579506852926584, 0.0009488441008301199, 0.0022213811211051356] and parameters: {'n_layers': 3, 'embedding_dim': 96, 'lr': 0.022344778470315903, 'lambda_val': 7.6066089751924715e-06, 'batch_size': 3749, 'optimizer': 'Adam'}.
2026-07-09 04:22:40,338 - experiment_functions - INFO - Early stopping at epoch 500. Best Metrics: (0.00016447269685092343, 3.894154968371863e-05, 8.789104240933729e-05)
2026-07-09 04:22:40,433 - optuna.study.study - INFO - Trial 61 finished with values: [0.00016447269685092343, 3.894154968371863e-05, 8.789104240933729e-05] and parameters: {'n_layers': 2, 'embedding_dim': 256, 'lr': 0.004747757026282931, 'lambda_val': 9.490815963748234e-05, 'batch_size': 1319, 'optimizer': 'SGD'}.
2026-07-09 04:24:26,503 - experiment_functions - INFO - Early stopping at epoch 1350. Best Metrics: (0.0036035311144796594, 0.0010105807039872347, 0.00238315439801901)
2026-07-09 04:24:26,606 - optuna.study.study - INFO - Trial 62 finished with values: [0.0036035311144796594, 0.0010105807039872347, 0.00238315439801901] and parameters: {'n_layers': 2, 'embedding_dim': 64, 'lr': 0.005405488767134608, 'lambda_val': 2.2522964152299898e-05, 'batch_size': 1042, 'optimizer': 'Adam'}.
2026-07-09 04:29:51,561 - optuna.study.study - INFO - Trial 63 finished with values: [0.0006595372940956823, 0.00015956537431377393, 0.0004210947059987226] and parameters: {'n_layers': 2, 'embedding_dim': 128, 'lr': 0.0001924396217608583, 'lambda_val': 0.0009474065444276035, 'batch_size': 3918, 'optimizer': 'RMSprop'}.
2026-07-09 04:30:39,095 - experiment_functions - INFO - Early stopping at epoch 500. Best Metrics: (0.0001572318301155222, 4.0841137473168324e-05, 8.084473228430867e-05)
2026-07-09 04:30:39,436 - optuna.study.study - INFO - Trial 64 finished with values: [0.0001572318301155222, 4.0841137473168324e-05, 8.084473228430867e-05] and parameters: {'n_layers': 4, 'embedding_dim': 128, 'lr': 0.0027594675228998556, 'lambda_val': 2.3412742144575654e-05, 'batch_size': 3439, 'optimizer': 'SGD'}.
2026-07-09 04:35:52,420 - optuna.study.study - INFO - Trial 65 finished with values: [0.002142943144486749, 0.0006002697414661019, 0.0014926672244828948] and parameters: {'n_layers': 3, 'embedding_dim': 64, 'lr': 0.0003238137930013743, 'lambda_val': 2.2522964152299898e-05, 'batch_size': 2676, 'optimizer': 'Adam'}.
2026-07-09 04:37:25,438 - experiment_functions - INFO - Early stopping at epoch 1100. Best Metrics: (0.00028318797843499916, 7.123454210436335e-05, 0.0001497134007172502)
2026-07-09 04:37:25,523 - optuna.study.study - INFO - Trial 66 finished with values: [0.00028318797843499916, 7.123454210436335e-05, 0.0001497134007172502] and parameters: {'n_layers': 2, 'embedding_dim': 128, 'lr': 3.8385225574059946e-05, 'lambda_val': 0.015464776349687475, 'batch_size': 768, 'optimizer': 'Adam'}.
2026-07-09 04:38:07,259 - experiment_functions - INFO - Early stopping at epoch 500. Best Metrics: (0.00013812794394387943, 4.3690519157342865e-05, 7.495922545866125e-05)
2026-07-09 04:38:07,351 - optuna.study.study - INFO - Trial 67 finished with values: [0.00013812794394387943, 4.3690519157342865e-05, 7.495922545866125e-05] and parameters: {'n_layers': 2, 'embedding_dim': 64, 'lr': 0.06328387972552833, 'lambda_val': 0.00028936387545849617, 'batch_size': 1124, 'optimizer': 'SGD'}.
2026-07-09 04:39:22,006 - experiment_functions - INFO - Early stopping at epoch 850. Best Metrics: (0.00024331835544188306, 5.888722147294038e-05, 0.00013617631529919347)
2026-07-09 04:39:22,089 - optuna.study.study - INFO - Trial 68 finished with values: [0.00024331835544188306, 5.888722147294038e-05, 0.00013617631529919347] and parameters: {'n_layers': 4, 'embedding_dim': 96, 'lr': 8.78527484752279e-05, 'lambda_val': 7.6066089751924715e-06, 'batch_size': 852, 'optimizer': 'Adam'}.
2026-07-09 04:41:16,193 - experiment_functions - INFO - Early stopping at epoch 1350. Best Metrics: (0.004800566103089082, 0.0012242843303003248, 0.003087774960638724)
2026-07-09 04:41:16,279 - optuna.study.study - INFO - Trial 69 finished with values: [0.004800566103089082, 0.0012242843303003248, 0.003087774960638724] and parameters: {'n_layers': 2, 'embedding_dim': 128, 'lr': 0.0012370258800213725, 'lambda_val': 0.00042689590179151803, 'batch_size': 3688, 'optimizer': 'RMSprop'}.
2026-07-09 04:46:20,861 - optuna.study.study - INFO - Trial 70 finished with values: [0.0003793003808112613, 9.307980168303481e-05, 0.000238068888607174] and parameters: {'n_layers': 2, 'embedding_dim': 64, 'lr': 0.0001738400579646775, 'lambda_val': 2.2522964152299898e-05, 'batch_size': 2081, 'optimizer': 'RMSprop'}.
