2026-07-02 12:15:13,587 - optuna.study.study - INFO - Trial 13 finished with values: [0.0002392791625729058, 7.02847482096385e-05, 0.00013811768162094433] and parameters: {'n_layers': 2, 'embedding_dim': 64, 'lr': 1.6345983371329834e-05, 'lambda_val': 0.001436797955280799, 'batch_size': 879, 'optimizer': 'RMSprop'}.
2026-07-02 12:16:07,338 - experiment_functions - INFO - Early stopping at epoch 500. Best Metrics: (0.00023830364368944082, 6.458598484128944e-05, 0.0001402442506473586)
2026-07-02 12:16:07,956 - optuna.study.study - INFO - Trial 14 finished with values: [0.00023830364368944082, 6.458598484128944e-05, 0.0001402442506473586] and parameters: {'n_layers': 4, 'embedding_dim': 96, 'lr': 1.0031858019200187e-05, 'lambda_val': 0.013362497728505302, 'batch_size': 2816, 'optimizer': 'Adam'}.
2026-07-02 12:17:04,098 - experiment_functions - INFO - Early stopping at epoch 500. Best Metrics: (0.00019650348705731085, 5.698763368349069e-05, 0.00011785210189402036)
2026-07-02 12:17:04,202 - optuna.study.study - INFO - Trial 15 finished with values: [0.00019650348705731085, 5.698763368349069e-05, 0.00011785210189402036] and parameters: {'n_layers': 2, 'embedding_dim': 256, 'lr': 0.0016372104773050206, 'lambda_val': 0.0008444952897102547, 'batch_size': 3503, 'optimizer': 'SGD'}.
2026-07-02 12:22:41,403 - optuna.study.study - INFO - Trial 16 finished with values: [0.012333133794699505, 0.0029177668445947227, 0.0075113353872166815] and parameters: {'n_layers': 2, 'embedding_dim': 64, 'lr': 0.00026052492972575584, 'lambda_val': 2.3467434467462208e-05, 'batch_size': 3269, 'optimizer': 'RMSprop'}.
2026-07-02 12:23:50,388 - experiment_functions - INFO - Early stopping at epoch 700. Best Metrics: (0.00546367277399847, 0.0013192637197728093, 0.003232004996231923)
2026-07-02 12:23:50,682 - optuna.study.study - INFO - Trial 17 finished with values: [0.00546367277399847, 0.0013192637197728093, 0.003232004996231923] and parameters: {'n_layers': 4, 'embedding_dim': 64, 'lr': 0.001886674492516043, 'lambda_val': 0.0011961653407329168, 'batch_size': 3187, 'optimizer': 'RMSprop'}.
2026-07-02 12:24:33,568 - experiment_functions - INFO - Early stopping at epoch 500. Best Metrics: (0.00021747434113827884, 6.17366031571149e-05, 0.00014031192718883735)
2026-07-02 12:24:33,658 - optuna.study.study - INFO - Trial 18 finished with values: [0.00021747434113827884, 6.17366031571149e-05, 0.00014031192718883735] and parameters: {'n_layers': 2, 'embedding_dim': 32, 'lr': 0.0005927995424167511, 'lambda_val': 0.05122867725901079, 'batch_size': 1208, 'optimizer': 'SGD'}.
2026-07-02 12:25:38,036 - experiment_functions - INFO - Early stopping at epoch 650. Best Metrics: (0.005204687338253059, 0.0012337822692475733, 0.00334561475394559)
2026-07-02 12:25:38,815 - optuna.study.study - INFO - Trial 19 finished with values: [0.005204687338253059, 0.0012337822692475733, 0.00334561475394559] and parameters: {'n_layers': 4, 'embedding_dim': 64, 'lr': 0.03152700214098363, 'lambda_val': 5.288093815108994e-05, 'batch_size': 2440, 'optimizer': 'RMSprop'}.
2026-07-02 12:31:34,509 - optuna.study.study - INFO - Trial 20 finished with values: [0.007353258934355404, 0.0017827631403985337, 0.004752712069278948] and parameters: {'n_layers': 3, 'embedding_dim': 64, 'lr': 0.013707584571164062, 'lambda_val': 1.1641323668209177e-05, 'batch_size': 3948, 'optimizer': 'RMSprop'}.
2026-07-02 12:32:19,187 - experiment_functions - INFO - Early stopping at epoch 500. Best Metrics: (0.00026047430432269173, 6.268639705183976e-05, 0.0001678176736761238)
2026-07-02 12:32:20,228 - optuna.study.study - INFO - Trial 21 finished with values: [0.00026047430432269173, 6.268639705183976e-05, 0.0001678176736761238] and parameters: {'n_layers': 3, 'embedding_dim': 32, 'lr': 0.0001567631498201481, 'lambda_val': 0.09336421355441926, 'batch_size': 1655, 'optimizer': 'RMSprop'}.
2026-07-02 12:33:09,899 - experiment_functions - INFO - Early stopping at epoch 500. Best Metrics: (0.00020515945470514098, 5.983701536766521e-05, 0.00012467456306333561)
2026-07-02 12:33:10,264 - optuna.study.study - INFO - Trial 22 finished with values: [0.00020515945470514098, 5.983701536766521e-05, 0.00012467456306333561] and parameters: {'n_layers': 1, 'embedding_dim': 256, 'lr': 1.0108062659627751e-05, 'lambda_val': 0.0023341626005278643, 'batch_size': 3214, 'optimizer': 'SGD'}.
2026-07-02 12:38:34,385 - optuna.study.study - INFO - Trial 23 finished with values: [0.014685588001366306, 0.0035218357616397244, 0.008804948826467726] and parameters: {'n_layers': 2, 'embedding_dim': 32, 'lr': 0.00045784196880844456, 'lambda_val': 0.003381769296625175, 'batch_size': 1891, 'optimizer': 'RMSprop'}.
2026-07-02 12:43:44,648 - optuna.study.study - INFO - Trial 24 finished with values: [0.015654926125759232, 0.003800125372794104, 0.009762952829054851] and parameters: {'n_layers': 1, 'embedding_dim': 32, 'lr': 0.0007787505453018097, 'lambda_val': 0.0012545102603406476, 'batch_size': 2278, 'optimizer': 'Adam'}.
2026-07-02 12:44:34,237 - experiment_functions - INFO - Early stopping at epoch 500. Best Metrics: (0.00017970474320861389, 5.318845810459131e-05, 0.00010556021681355)
2026-07-02 12:44:34,330 - optuna.study.study - INFO - Trial 25 finished with values: [0.00017970474320861389, 5.318845810459131e-05, 0.00010556021681355] and parameters: {'n_layers': 4, 'embedding_dim': 64, 'lr': 0.053992950346095095, 'lambda_val': 1.8352075943642231e-06, 'batch_size': 1727, 'optimizer': 'SGD'}.
2026-07-02 12:45:44,065 - experiment_functions - INFO - Early stopping at epoch 500. Best Metrics: (0.0002009427605875207, 6.078680926239006e-05, 0.00012008926062695435)
2026-07-02 12:45:44,821 - optuna.study.study - INFO - Trial 26 finished with values: [0.0002009427605875207, 6.078680926239006e-05, 0.00012008926062695435] and parameters: {'n_layers': 4, 'embedding_dim': 256, 'lr': 0.0007234942285091995, 'lambda_val': 0.038729748114947636, 'batch_size': 1412, 'optimizer': 'SGD'}.
2026-07-02 12:50:59,072 - optuna.study.study - INFO - Trial 27 finished with values: [0.005822442609454125, 0.0014769295062971334, 0.0037059402527185913] and parameters: {'n_layers': 1, 'embedding_dim': 64, 'lr': 0.00035937037082201277, 'lambda_val': 0.00044379091524845374, 'batch_size': 2355, 'optimizer': 'Adam'}.
2026-07-02 12:52:02,581 - experiment_functions - INFO - Early stopping at epoch 750. Best Metrics: (0.0002109497284297719, 6.268639705183976e-05, 0.00012796342787694482)
2026-07-02 12:52:02,662 - optuna.study.study - INFO - Trial 28 finished with values: [0.0002109497284297719, 6.268639705183976e-05, 0.00012796342787694482] and parameters: {'n_layers': 1, 'embedding_dim': 96, 'lr': 5.109734257346146e-05, 'lambda_val': 2.1262063244338483e-06, 'batch_size': 3614, 'optimizer': 'RMSprop'}.
2026-07-02 12:58:25,461 - optuna.study.study - INFO - Trial 29 finished with values: [0.016721175987498678, 0.003965389510476227, 0.010628044440518306] and parameters: {'n_layers': 1, 'embedding_dim': 256, 'lr': 0.0005693523871630874, 'lambda_val': 0.005299023139585472, 'batch_size': 3332, 'optimizer': 'Adam'}.
2026-07-02 13:04:09,673 - optuna.study.study - INFO - Trial 30 finished with values: [0.00038783024306607115, 0.0001130254734722565, 0.0002546389587573065] and parameters: {'n_layers': 4, 'embedding_dim': 32, 'lr': 6.764727450313105e-05, 'lambda_val': 6.408464491015804e-05, 'batch_size': 3356, 'optimizer': 'RMSprop'}.
2026-07-02 13:09:57,482 - optuna.study.study - INFO - Trial 31 finished with values: [0.0006750110670267192, 0.0001766616644188211, 0.00044718397217575557] and parameters: {'n_layers': 2, 'embedding_dim': 96, 'lr': 0.0001737673362778378, 'lambda_val': 4.586308655153635e-06, 'batch_size': 1252, 'optimizer': 'Adam'}.
2026-07-02 13:17:03,264 - optuna.study.study - INFO - Trial 32 finished with values: [0.004519669239571704, 0.0011179074140911425, 0.0026894992287928242] and parameters: {'n_layers': 2, 'embedding_dim': 256, 'lr': 0.00020560294075841994, 'lambda_val': 0.00460683259959218, 'batch_size': 780, 'optimizer': 'RMSprop'}.
2026-07-02 13:17:59,607 - experiment_functions - INFO - Early stopping at epoch 500. Best Metrics: (0.000247838343266142, 6.078680926239006e-05, 0.00014239237249746183)
2026-07-02 13:17:59,695 - optuna.study.study - INFO - Trial 33 finished with values: [0.000247838343266142, 6.078680926239006e-05, 0.00014239237249746183] and parameters: {'n_layers': 4, 'embedding_dim': 128, 'lr': 1.0458690643817229e-05, 'lambda_val': 0.009806979837729053, 'batch_size': 3262, 'optimizer': 'SGD'}.
2026-07-02 13:18:48,783 - experiment_functions - INFO - Early stopping at epoch 500. Best Metrics: (0.0032249423794768087, 0.0006325627338867467, 0.0021919375164225533)
2026-07-02 13:18:49,826 - optuna.study.study - INFO - Trial 34 finished with values: [0.0032249423794768087, 0.0006325627338867467, 0.0021919375164225533] and parameters: {'n_layers': 2, 'embedding_dim': 128, 'lr': 0.08415655350474913, 'lambda_val': 0.0406201462474943, 'batch_size': 3678, 'optimizer': 'RMSprop'}.
2026-07-02 13:19:34,566 - experiment_functions - INFO - Early stopping at epoch 500. Best Metrics: (0.00026016070797026315, 6.553577873601429e-05, 0.0001512865605193611)
2026-07-02 13:19:34,666 - optuna.study.study - INFO - Trial 35 finished with values: [0.00026016070797026315, 6.553577873601429e-05, 0.0001512865605193611] and parameters: {'n_layers': 1, 'embedding_dim': 128, 'lr': 0.001480646322042953, 'lambda_val': 0.0007993704414203944, 'batch_size': 2883, 'optimizer': 'SGD'}.
2026-07-02 13:20:30,082 - experiment_functions - INFO - Early stopping at epoch 550. Best Metrics: (0.004297265431225869, 0.0012565773227209693, 0.0028453893739510084)
2026-07-02 13:20:30,160 - optuna.study.study - INFO - Trial 36 finished with values: [0.004297265431225869, 0.0012565773227209693, 0.0028453893739510084] and parameters: {'n_layers': 3, 'embedding_dim': 96, 'lr': 0.01575252065743786, 'lambda_val': 0.0011786577822943754, 'batch_size': 2174, 'optimizer': 'Adam'}.
2026-07-02 13:21:19,892 - experiment_functions - INFO - Early stopping at epoch 550. Best Metrics: (0.0002016063737502774, 5.413825199931615e-05, 0.00011650509120211542)
2026-07-02 13:21:20,079 - optuna.study.study - INFO - Trial 37 finished with values: [0.0002016063737502774, 5.413825199931615e-05, 0.00011650509120211542] and parameters: {'n_layers': 1, 'embedding_dim': 128, 'lr': 3.161480996601466e-05, 'lambda_val': 0.021992616267768692, 'batch_size': 3228, 'optimizer': 'Adam'}.
2026-07-02 13:26:50,714 - optuna.study.study - INFO - Trial 38 finished with values: [0.0005651153415364788, 0.00014911764147180063, 0.0003367662292727338] and parameters: {'n_layers': 3, 'embedding_dim': 32, 'lr': 8.720210273774637e-05, 'lambda_val': 7.201145951519113e-06, 'batch_size': 3479, 'optimizer': 'RMSprop'}.
2026-07-02 13:27:38,480 - experiment_functions - INFO - Early stopping at epoch 550. Best Metrics: (0.008078421305480026, 0.001904336758923314, 0.005041568341257975)
2026-07-02 13:27:38,582 - optuna.study.study - INFO - Trial 39 finished with values: [0.008078421305480026, 0.001904336758923314, 0.005041568341257975] and parameters: {'n_layers': 2, 'embedding_dim': 32, 'lr': 0.019732524959614816, 'lambda_val': 1.0200526955125864e-06, 'batch_size': 667, 'optimizer': 'RMSprop'}.
2026-07-02 13:28:37,950 - experiment_functions - INFO - Early stopping at epoch 600. Best Metrics: (0.00021932490271156258, 5.888722147294036e-05, 0.00012456015702546556)
2026-07-02 13:28:38,306 - optuna.study.study - INFO - Trial 40 finished with values: [0.00021932490271156258, 5.888722147294036e-05, 0.00012456015702546556] and parameters: {'n_layers': 3, 'embedding_dim': 96, 'lr': 1.4550365488281395e-05, 'lambda_val': 0.0007523035355748674, 'batch_size': 2659, 'optimizer': 'Adam'}.
2026-07-02 13:30:09,585 - experiment_functions - INFO - Early stopping at epoch 650. Best Metrics: (0.005203769272564249, 0.0013430085671409305, 0.003214610603012731)
2026-07-02 13:30:09,929 - optuna.study.study - INFO - Trial 41 finished with values: [0.005203769272564249, 0.0013430085671409305, 0.003214610603012731] and parameters: {'n_layers': 4, 'embedding_dim': 256, 'lr': 0.0011190330220107111, 'lambda_val': 0.0021486567738515953, 'batch_size': 3463, 'optimizer': 'RMSprop'}.
2026-07-02 13:31:13,667 - experiment_functions - INFO - Early stopping at epoch 500. Best Metrics: (0.011122751556834825, 0.0026413768212297933, 0.007877486163723201)
2026-07-02 13:31:13,786 - optuna.study.study - INFO - Trial 42 finished with values: [0.011122751556834825, 0.0026413768212297933, 0.007877486163723201] and parameters: {'n_layers': 3, 'embedding_dim': 256, 'lr': 0.05595981347829616, 'lambda_val': 0.02455984895138463, 'batch_size': 950, 'optimizer': 'RMSprop'}.
2026-07-02 13:32:10,121 - experiment_functions - INFO - Early stopping at epoch 500. Best Metrics: (0.00026234217853538243, 6.0786809262390055e-05, 0.0001487372100552401)
2026-07-02 13:32:10,195 - optuna.study.study - INFO - Trial 43 finished with values: [0.00026234217853538243, 6.0786809262390055e-05, 0.0001487372100552401] and parameters: {'n_layers': 4, 'embedding_dim': 128, 'lr': 0.002575131183249765, 'lambda_val': 0.03509986846797964, 'batch_size': 554, 'optimizer': 'SGD'}.
2026-07-02 13:33:32,373 - experiment_functions - INFO - Early stopping at epoch 900. Best Metrics: (0.0034896260852875166, 0.0009678399787246167, 0.0019524898921374492)
2026-07-02 13:33:32,515 - optuna.study.study - INFO - Trial 44 finished with values: [0.0034896260852875166, 0.0009678399787246167, 0.0019524898921374492] and parameters: {'n_layers': 2, 'embedding_dim': 96, 'lr': 0.0010410222452989183, 'lambda_val': 0.04899242968441085, 'batch_size': 2178, 'optimizer': 'Adam'}.
2026-07-02 13:39:28,882 - optuna.study.study - INFO - Trial 45 finished with values: [0.010842709574523853, 0.0024884600041790933, 0.006322581256329202] and parameters: {'n_layers': 3, 'embedding_dim': 64, 'lr': 0.0012100089708552634, 'lambda_val': 9.00355461091747e-05, 'batch_size': 1092, 'optimizer': 'RMSprop'}.
2026-07-02 13:40:16,680 - experiment_functions - INFO - Early stopping at epoch 500. Best Metrics: (0.00016834703464763524, 5.5088045894041e-05, 0.00010750084528994698)
2026-07-02 13:40:17,165 - optuna.study.study - INFO - Trial 46 finished with values: [0.00016834703464763524, 5.5088045894041e-05, 0.00010750084528994698] and parameters: {'n_layers': 3, 'embedding_dim': 64, 'lr': 0.0005160153471975092, 'lambda_val': 0.0004266548063750315, 'batch_size': 3042, 'optimizer': 'SGD'}.
2026-07-02 13:41:00,859 - experiment_functions - INFO - Early stopping at epoch 500. Best Metrics: (0.00028743458669705827, 6.0786809262390055e-05, 0.00016993707592078105)
2026-07-02 13:41:00,961 - optuna.study.study - INFO - Trial 47 finished with values: [0.00028743458669705827, 6.0786809262390055e-05, 0.00016993707592078105] and parameters: {'n_layers': 1, 'embedding_dim': 96, 'lr': 0.07594571807213893, 'lambda_val': 5.406417582883327e-05, 'batch_size': 2839, 'optimizer': 'SGD'}.
2026-07-02 13:41:48,606 - experiment_functions - INFO - Early stopping at epoch 500. Best Metrics: (0.00021311364917586833, 6.173660315711492e-05, 0.00012006095410679638)
2026-07-02 13:41:48,702 - optuna.study.study - INFO - Trial 48 finished with values: [0.00021311364917586833, 6.173660315711492e-05, 0.00012006095410679638] and parameters: {'n_layers': 3, 'embedding_dim': 64, 'lr': 0.002291707621561382, 'lambda_val': 6.955130244073184e-05, 'batch_size': 3722, 'optimizer': 'SGD'}.
2026-07-02 13:46:44,486 - experiment_functions - INFO - Early stopping at epoch 3500. Best Metrics: (0.009753029843466113, 0.0023098987519708223, 0.006187041448365141)
2026-07-02 13:46:44,620 - optuna.study.study - INFO - Trial 49 finished with values: [0.009753029843466113, 0.0023098987519708223, 0.006187041448365141] and parameters: {'n_layers': 1, 'embedding_dim': 128, 'lr': 0.01003894592310146, 'lambda_val': 1.6046175410536033e-05, 'batch_size': 541, 'optimizer': 'RMSprop'}.
2026-07-02 13:48:56,136 - experiment_functions - INFO - Early stopping at epoch 1400. Best Metrics: (0.0049082735415679046, 0.001432289193245066, 0.0029907037366777014)
2026-07-02 13:48:56,268 - optuna.study.study - INFO - Trial 50 finished with values: [0.0049082735415679046, 0.001432289193245066, 0.0029907037366777014] and parameters: {'n_layers': 2, 'embedding_dim': 128, 'lr': 0.0006781284315626388, 'lambda_val': 0.0406201462474943, 'batch_size': 2370, 'optimizer': 'Adam'}.
2026-07-02 13:49:43,553 - experiment_functions - INFO - Early stopping at epoch 500. Best Metrics: (0.00022679125200429284, 5.318845810459131e-05, 0.00011332188427516436)
2026-07-02 13:49:43,727 - optuna.study.study - INFO - Trial 51 finished with values: [0.00022679125200429284, 5.318845810459131e-05, 0.00011332188427516436] and parameters: {'n_layers': 3, 'embedding_dim': 64, 'lr': 0.007698538432634604, 'lambda_val': 2.74195258168681e-05, 'batch_size': 2544, 'optimizer': 'SGD'}.
2026-07-02 13:55:14,694 - optuna.study.study - INFO - Trial 52 finished with values: [0.0006437385963648876, 0.00018046083999772054, 0.0003951125732821402] and parameters: {'n_layers': 3, 'embedding_dim': 32, 'lr': 8.720210273774637e-05, 'lambda_val': 7.201145951519113e-06, 'batch_size': 3479, 'optimizer': 'RMSprop'}.
2026-07-02 13:56:13,592 - experiment_functions - INFO - Early stopping at epoch 550. Best Metrics: (0.002687657227054197, 0.0007949774898846951, 0.001650483653058166)
2026-07-02 13:56:13,685 - optuna.study.study - INFO - Trial 53 finished with values: [0.002687657227054197, 0.0007949774898846951, 0.001650483653058166] and parameters: {'n_layers': 4, 'embedding_dim': 96, 'lr': 0.010539985286058167, 'lambda_val': 0.009806979837729053, 'batch_size': 2053, 'optimizer': 'RMSprop'}.
2026-07-02 13:57:30,033 - experiment_functions - INFO - Early stopping at epoch 600. Best Metrics: (0.006342019281292307, 0.0013999962008244208, 0.004174046850933514)
2026-07-02 13:57:30,138 - optuna.study.study - INFO - Trial 54 finished with values: [0.006342019281292307, 0.0013999962008244208, 0.004174046850933514] and parameters: {'n_layers': 3, 'embedding_dim': 256, 'lr': 0.03152700214098363, 'lambda_val': 5.288093815108994e-05, 'batch_size': 1935, 'optimizer': 'RMSprop'}.
2026-07-02 14:02:30,232 - experiment_functions - INFO - Early stopping at epoch 3000. Best Metrics: (0.0033299050715036305, 0.0010295765818817317, 0.0021589195310200804)
2026-07-02 14:02:30,547 - optuna.study.study - INFO - Trial 55 finished with values: [0.0033299050715036305, 0.0010295765818817317, 0.0021589195310200804] and parameters: {'n_layers': 3, 'embedding_dim': 128, 'lr': 0.0036717136369980364, 'lambda_val': 0.029108126899118927, 'batch_size': 2345, 'optimizer': 'Adam'}.
2026-07-02 14:08:03,732 - experiment_functions - INFO - Early stopping at epoch 3900. Best Metrics: (0.015951169008332093, 0.0037212924795319417, 0.009482218387079917)
2026-07-02 14:08:03,813 - optuna.study.study - INFO - Trial 56 finished with values: [0.015951169008332093, 0.0037212924795319417, 0.009482218387079917] and parameters: {'n_layers': 2, 'embedding_dim': 64, 'lr': 0.0006781284315626388, 'lambda_val': 0.0004266548063750315, 'batch_size': 2370, 'optimizer': 'Adam'}.
2026-07-02 14:15:13,763 - optuna.study.study - INFO - Trial 57 finished with values: [0.00853156541513695, 0.0020800486294474097, 0.005539792385179789] and parameters: {'n_layers': 4, 'embedding_dim': 128, 'lr': 0.01003894592310146, 'lambda_val': 1.6046175410536033e-05, 'batch_size': 3187, 'optimizer': 'RMSprop'}.
2026-07-02 14:16:13,699 - experiment_functions - INFO - Early stopping at epoch 600. Best Metrics: (0.005173835531772456, 0.0012280835058792244, 0.0033824362960335457)
2026-07-02 14:16:13,788 - optuna.study.study - INFO - Trial 58 finished with values: [0.005173835531772456, 0.0012280835058792244, 0.0033824362960335457] and parameters: {'n_layers': 4, 'embedding_dim': 64, 'lr': 0.03152700214098363, 'lambda_val': 5.288093815108994e-05, 'batch_size': 2440, 'optimizer': 'RMSprop'}.
2026-07-02 14:21:14,093 - experiment_functions - INFO - Early stopping at epoch 3000. Best Metrics: (0.0035845406853725783, 0.001107459681249169, 0.0023487846154775977)
2026-07-02 14:21:14,179 - optuna.study.study - INFO - Trial 59 finished with values: [0.0035845406853725783, 0.001107459681249169, 0.0023487846154775977] and parameters: {'n_layers': 3, 'embedding_dim': 128, 'lr': 0.0036717136369980364, 'lambda_val': 0.029108126899118927, 'batch_size': 3224, 'optimizer': 'Adam'}.
2026-07-02 14:30:15,615 - optuna.study.study - INFO - Trial 60 finished with values: [0.01042359157484755, 0.0024390707216534013, 0.006709280296413706] and parameters: {'n_layers': 4, 'embedding_dim': 256, 'lr': 0.010539985286058167, 'lambda_val': 3.277688503988446e-05, 'batch_size': 2128, 'optimizer': 'RMSprop'}.
2026-07-02 14:31:15,198 - experiment_functions - INFO - Early stopping at epoch 600. Best Metrics: (0.002036448844062624, 0.0006278137644131224, 0.0012983552816184486)
2026-07-02 14:31:15,381 - optuna.study.study - INFO - Trial 61 finished with values: [0.002036448844062624, 0.0006278137644131224, 0.0012983552816184486] and parameters: {'n_layers': 3, 'embedding_dim': 96, 'lr': 0.0012100089708552634, 'lambda_val': 0.04899242968441085, 'batch_size': 1092, 'optimizer': 'RMSprop'}.
2026-07-02 14:35:16,304 - experiment_functions - INFO - Early stopping at epoch 2700. Best Metrics: (0.0033423799467526332, 0.0009906350321980128, 0.0020621688620655076)
2026-07-02 14:35:16,397 - optuna.study.study - INFO - Trial 62 finished with values: [0.0033423799467526332, 0.0009906350321980128, 0.0020621688620655076] and parameters: {'n_layers': 3, 'embedding_dim': 64, 'lr': 0.002575131183249765, 'lambda_val': 0.03509986846797964, 'batch_size': 3948, 'optimizer': 'RMSprop'}.
