2026-07-01 08:02:19,735 - optuna.study.study - INFO - Trial 215 finished with values: [0.0025253944115805776, 0.0007683832608323994, 0.0017292208318223728] and parameters: {'n_layers': 4, 'embedding_dim': 128, 'lr': 0.001557510643925403, 'lambda_val': 4.186926040366856e-06, 'batch_size': 3344, 'optimizer': 'RMSprop'}.
2026-07-01 08:03:06,240 - experiment_functions - INFO - Early stopping at epoch 550. Best Metrics: (0.0014252090762216494, 0.000403662405258059, 0.0010110307487238845)
2026-07-01 08:03:06,324 - optuna.study.study - INFO - Trial 216 finished with values: [0.0014252090762216494, 0.000403662405258059, 0.0010110307487238845] and parameters: {'n_layers': 3, 'embedding_dim': 64, 'lr': 0.031525409470095064, 'lambda_val': 4.186926040366856e-06, 'batch_size': 3342, 'optimizer': 'RMSprop'}.
2026-07-01 08:06:35,904 - experiment_functions - INFO - Early stopping at epoch 2500. Best Metrics: (0.0029933538275467133, 0.0008690614136732329, 0.002034254154438664)
2026-07-01 08:06:35,993 - optuna.study.study - INFO - Trial 217 finished with values: [0.0029933538275467133, 0.0008690614136732329, 0.002034254154438664] and parameters: {'n_layers': 4, 'embedding_dim': 96, 'lr': 0.0010455025017472735, 'lambda_val': 4.134172720235837e-06, 'batch_size': 2475, 'optimizer': 'RMSprop'}.
2026-07-01 08:07:57,661 - experiment_functions - INFO - Early stopping at epoch 900. Best Metrics: (0.0021894884932924033, 0.0006268639705183975, 0.0014897932517092239)
2026-07-01 08:07:57,723 - optuna.study.study - INFO - Trial 218 finished with values: [0.0021894884932924033, 0.0006268639705183975, 0.0014897932517092239] and parameters: {'n_layers': 4, 'embedding_dim': 128, 'lr': 0.0008921739854607602, 'lambda_val': 0.006746730955894686, 'batch_size': 3342, 'optimizer': 'RMSprop'}.
2026-07-01 08:10:14,176 - experiment_functions - INFO - Early stopping at epoch 1700. Best Metrics: (0.0028444869444174455, 0.0008101741922002926, 0.001992806015541853)
2026-07-01 08:10:14,257 - optuna.study.study - INFO - Trial 219 finished with values: [0.0028444869444174455, 0.0008101741922002926, 0.001992806015541853] and parameters: {'n_layers': 4, 'embedding_dim': 64, 'lr': 0.0011663890806018467, 'lambda_val': 4.186926040366856e-06, 'batch_size': 3342, 'optimizer': 'RMSprop'}.
2026-07-01 08:11:08,945 - experiment_functions - INFO - Early stopping at epoch 500. Best Metrics: (0.000172443848804557, 4.274072526261801e-05, 9.752395405694864e-05)
2026-07-01 08:11:09,267 - optuna.study.study - INFO - Trial 220 finished with values: [0.000172443848804557, 4.274072526261801e-05, 9.752395405694864e-05] and parameters: {'n_layers': 4, 'embedding_dim': 256, 'lr': 0.0016405237668077803, 'lambda_val': 1.6580882382113483e-05, 'batch_size': 1265, 'optimizer': 'SGD'}.
2026-07-01 08:12:47,331 - experiment_functions - INFO - Early stopping at epoch 1200. Best Metrics: (0.002535713350395847, 0.000716144596622533, 0.0016903462484761807)
2026-07-01 08:12:47,421 - optuna.study.study - INFO - Trial 221 finished with values: [0.002535713350395847, 0.000716144596622533, 0.0016903462484761807] and parameters: {'n_layers': 4, 'embedding_dim': 64, 'lr': 0.0016405237668077803, 'lambda_val': 3.186188638129305e-06, 'batch_size': 3022, 'optimizer': 'Adam'}.
2026-07-01 08:14:22,362 - experiment_functions - INFO - Early stopping at epoch 1100. Best Metrics: (0.0026588866777318434, 0.0007797807875690975, 0.0017527943498616947)
2026-07-01 08:14:22,441 - optuna.study.study - INFO - Trial 222 finished with values: [0.0026588866777318434, 0.0007797807875690975, 0.0017527943498616947] and parameters: {'n_layers': 4, 'embedding_dim': 96, 'lr': 0.0016405237668077803, 'lambda_val': 4.134172720235837e-06, 'batch_size': 3342, 'optimizer': 'RMSprop'}.
2026-07-01 08:15:52,738 - experiment_functions - INFO - Early stopping at epoch 1050. Best Metrics: (0.002465540624389258, 0.000709496039359459, 0.001665412351218242)
2026-07-01 08:15:52,822 - optuna.study.study - INFO - Trial 223 finished with values: [0.002465540624389258, 0.000709496039359459, 0.001665412351218242] and parameters: {'n_layers': 4, 'embedding_dim': 96, 'lr': 0.002835761631416988, 'lambda_val': 4.9195072317508555e-06, 'batch_size': 3009, 'optimizer': 'RMSprop'}.
2026-07-01 08:17:19,342 - experiment_functions - INFO - Early stopping at epoch 800. Best Metrics: (0.002379180408287518, 0.0007056968637805597, 0.0015961743152549867)
2026-07-01 08:17:19,432 - optuna.study.study - INFO - Trial 224 finished with values: [0.002379180408287518, 0.0007056968637805597, 0.0015961743152549867] and parameters: {'n_layers': 4, 'embedding_dim': 256, 'lr': 0.0027303142774942266, 'lambda_val': 1.9470910869906704e-05, 'batch_size': 3022, 'optimizer': 'RMSprop'}.
2026-07-01 08:20:36,764 - experiment_functions - INFO - Early stopping at epoch 2500. Best Metrics: (0.002396849956139258, 0.0006458598484128944, 0.0016243284968754667)
2026-07-01 08:20:36,855 - optuna.study.study - INFO - Trial 225 finished with values: [0.002396849956139258, 0.0006458598484128944, 0.0016243284968754667] and parameters: {'n_layers': 2, 'embedding_dim': 96, 'lr': 0.0011423999744800083, 'lambda_val': 4.9195072317508555e-06, 'batch_size': 2842, 'optimizer': 'RMSprop'}.
2026-07-01 08:23:10,552 - experiment_functions - INFO - Early stopping at epoch 1800. Best Metrics: (0.0027993748878576085, 0.0007740820242007484, 0.0018754982817990916)
2026-07-01 08:23:10,642 - optuna.study.study - INFO - Trial 226 finished with values: [0.0027993748878576085, 0.0007740820242007484, 0.0018754982817990916] and parameters: {'n_layers': 3, 'embedding_dim': 128, 'lr': 0.0016405237668077803, 'lambda_val': 4.889129207716808e-06, 'batch_size': 3022, 'optimizer': 'RMSprop'}.
2026-07-01 08:26:58,808 - experiment_functions - INFO - Early stopping at epoch 2700. Best Metrics: (0.0031825740414062214, 0.0008605132686207094, 0.0021239867666469426)
2026-07-01 08:26:58,897 - optuna.study.study - INFO - Trial 227 finished with values: [0.0031825740414062214, 0.0008605132686207094, 0.0021239867666469426] and parameters: {'n_layers': 3, 'embedding_dim': 128, 'lr': 0.0010455025017472735, 'lambda_val': 4.9195072317508555e-06, 'batch_size': 1544, 'optimizer': 'RMSprop'}.
2026-07-01 08:33:56,115 - optuna.study.study - INFO - Trial 228 finished with values: [0.0025849046373815315, 0.0007408392378853789, 0.0017403091931423506] and parameters: {'n_layers': 4, 'embedding_dim': 256, 'lr': 0.0006152603091001123, 'lambda_val': 1.9470910869906704e-05, 'batch_size': 3344, 'optimizer': 'Adam'}.
2026-07-01 08:37:34,125 - experiment_functions - INFO - Early stopping at epoch 2750. Best Metrics: (0.00309753717773591, 0.0008320194517789641, 0.0020489413943791035)
2026-07-01 08:37:34,240 - optuna.study.study - INFO - Trial 229 finished with values: [0.00309753717773591, 0.0008320194517789641, 0.0020489413943791035] and parameters: {'n_layers': 4, 'embedding_dim': 64, 'lr': 0.0010455025017472735, 'lambda_val': 1.3573657888080551e-06, 'batch_size': 1544, 'optimizer': 'RMSprop'}.
2026-07-01 08:40:30,083 - experiment_functions - INFO - Early stopping at epoch 2350. Best Metrics: (0.00300195503461734, 0.0007845297570427217, 0.001957867932561435)
2026-07-01 08:40:30,231 - optuna.study.study - INFO - Trial 230 finished with values: [0.00300195503461734, 0.0007845297570427217, 0.001957867932561435] and parameters: {'n_layers': 3, 'embedding_dim': 32, 'lr': 0.0016405237668077803, 'lambda_val': 8.626508066271745e-05, 'batch_size': 1203, 'optimizer': 'RMSprop'}.
2026-07-01 08:41:12,297 - experiment_functions - INFO - Early stopping at epoch 500. Best Metrics: (0.00024780378933082325, 5.6987633683490685e-05, 0.00012664695824530947)
2026-07-01 08:41:12,405 - optuna.study.study - INFO - Trial 231 finished with values: [0.00024780378933082325, 5.6987633683490685e-05, 0.00012664695824530947] and parameters: {'n_layers': 3, 'embedding_dim': 64, 'lr': 0.0008600071624489954, 'lambda_val': 4.134172720235837e-06, 'batch_size': 977, 'optimizer': 'SGD'}.
2026-07-01 08:42:46,721 - experiment_functions - INFO - Early stopping at epoch 1050. Best Metrics: (0.0022354958504693257, 0.0006857511919913379, 0.0014902183336159807)
2026-07-01 08:42:46,794 - optuna.study.study - INFO - Trial 232 finished with values: [0.0022354958504693257, 0.0006857511919913379, 0.0014902183336159807] and parameters: {'n_layers': 4, 'embedding_dim': 128, 'lr': 0.0008921739854607602, 'lambda_val': 0.003195386254489329, 'batch_size': 3235, 'optimizer': 'RMSprop'}.
2026-07-01 08:45:39,191 - experiment_functions - INFO - Early stopping at epoch 2350. Best Metrics: (0.002127035978298778, 0.0005062401458883422, 0.001296320505741845)
2026-07-01 08:45:39,258 - optuna.study.study - INFO - Trial 233 finished with values: [0.002127035978298778, 0.0005062401458883422, 0.001296320505741845] and parameters: {'n_layers': 1, 'embedding_dim': 32, 'lr': 0.0011423999744800083, 'lambda_val': 4.186926040366856e-06, 'batch_size': 3342, 'optimizer': 'RMSprop'}.
2026-07-01 08:50:59,263 - experiment_functions - INFO - Early stopping at epoch 3800. Best Metrics: (0.00294621746924392, 0.0008063750166213931, 0.00198446277799238)
2026-07-01 08:50:59,352 - optuna.study.study - INFO - Trial 234 finished with values: [0.00294621746924392, 0.0008063750166213931, 0.00198446277799238] and parameters: {'n_layers': 3, 'embedding_dim': 128, 'lr': 0.0008921739854607602, 'lambda_val': 4.134172720235837e-06, 'batch_size': 3011, 'optimizer': 'RMSprop'}.
2026-07-01 08:53:38,528 - experiment_functions - INFO - Early stopping at epoch 1950. Best Metrics: (0.0031047036745214074, 0.0008785593526204815, 0.002092866107744752)
2026-07-01 08:53:38,626 - optuna.study.study - INFO - Trial 235 finished with values: [0.0031047036745214074, 0.0008785593526204815, 0.002092866107744752] and parameters: {'n_layers': 3, 'embedding_dim': 96, 'lr': 0.0016405237668077803, 'lambda_val': 0.00011682518010112995, 'batch_size': 977, 'optimizer': 'RMSprop'}.
2026-07-01 08:58:48,196 - optuna.study.study - INFO - Trial 236 finished with values: [0.0026837605385172576, 0.0007826301692532721, 0.0018307544165963852] and parameters: {'n_layers': 3, 'embedding_dim': 64, 'lr': 0.0008921739854607602, 'lambda_val': 4.134172720235837e-06, 'batch_size': 2839, 'optimizer': 'RMSprop'}.
2026-07-01 08:59:38,282 - experiment_functions - INFO - Early stopping at epoch 550. Best Metrics: (0.0012463537381974875, 0.00037326900062686403, 0.0009174734937297273)
2026-07-01 08:59:38,367 - optuna.study.study - INFO - Trial 237 finished with values: [0.0012463537381974875, 0.00037326900062686403, 0.0009174734937297273] and parameters: {'n_layers': 3, 'embedding_dim': 128, 'lr': 0.09409396916953613, 'lambda_val': 0.00010017446228065922, 'batch_size': 3344, 'optimizer': 'Adam'}.
2026-07-01 09:01:18,661 - experiment_functions - INFO - Early stopping at epoch 1200. Best Metrics: (0.002497128141597114, 0.0006781528408335392, 0.0017369610586565364)
2026-07-01 09:01:18,745 - optuna.study.study - INFO - Trial 238 finished with values: [0.002497128141597114, 0.0006781528408335392, 0.0017369610586565364] and parameters: {'n_layers': 3, 'embedding_dim': 96, 'lr': 0.0010455025017472735, 'lambda_val': 0.001439719660074157, 'batch_size': 2475, 'optimizer': 'RMSprop'}.
2026-07-01 09:04:19,590 - experiment_functions - INFO - Early stopping at epoch 2150. Best Metrics: (0.0031162451659278675, 0.0009269988412514486, 0.0020558198956395035)
2026-07-01 09:04:19,676 - optuna.study.study - INFO - Trial 239 finished with values: [0.0031162451659278675, 0.0009269988412514486, 0.0020558198956395035] and parameters: {'n_layers': 4, 'embedding_dim': 96, 'lr': 0.0011423999744800083, 'lambda_val': 4.186926040366856e-06, 'batch_size': 3022, 'optimizer': 'RMSprop'}.
2026-07-01 09:06:37,668 - experiment_functions - INFO - Early stopping at epoch 1550. Best Metrics: (0.002666385146534637, 0.0007797807875690976, 0.0017478921191796807)
2026-07-01 09:06:37,757 - optuna.study.study - INFO - Trial 240 finished with values: [0.002666385146534637, 0.0007797807875690976, 0.0017478921191796807] and parameters: {'n_layers': 4, 'embedding_dim': 128, 'lr': 0.0016405237668077803, 'lambda_val': 4.134172720235837e-06, 'batch_size': 3905, 'optimizer': 'RMSprop'}.
2026-07-01 09:09:48,038 - experiment_functions - INFO - Early stopping at epoch 2150. Best Metrics: (0.002386623985091084, 0.0007123454210436336, 0.0016477041056948381)
2026-07-01 09:09:48,143 - optuna.study.study - INFO - Trial 241 finished with values: [0.002386623985091084, 0.0007123454210436336, 0.0016477041056948381] and parameters: {'n_layers': 4, 'embedding_dim': 128, 'lr': 0.0010455025017472735, 'lambda_val': 4.9195072317508555e-06, 'batch_size': 3344, 'optimizer': 'Adam'}.
2026-07-01 09:13:59,075 - experiment_functions - INFO - Early stopping at epoch 2850. Best Metrics: (0.002560842336352636, 0.0007531865585168018, 0.0017409505899189986)
2026-07-01 09:13:59,164 - optuna.study.study - INFO - Trial 242 finished with values: [0.002560842336352636, 0.0007531865585168018, 0.0017409505899189986] and parameters: {'n_layers': 4, 'embedding_dim': 128, 'lr': 0.0011423999744800083, 'lambda_val': 3.186188638129305e-06, 'batch_size': 3022, 'optimizer': 'Adam'}.
2026-07-01 09:15:36,488 - experiment_functions - INFO - Early stopping at epoch 1300. Best Metrics: (0.0021484452811074773, 0.0004758467412571472, 0.0013514725590157881)
2026-07-01 09:15:36,572 - optuna.study.study - INFO - Trial 243 finished with values: [0.0021484452811074773, 0.0004758467412571472, 0.0013514725590157881] and parameters: {'n_layers': 1, 'embedding_dim': 32, 'lr': 0.0016405237668077803, 'lambda_val': 0.0002170393924492861, 'batch_size': 2839, 'optimizer': 'RMSprop'}.
2026-07-01 09:17:23,122 - experiment_functions - INFO - Early stopping at epoch 1250. Best Metrics: (0.002996010161031458, 0.0008823585281993808, 0.002032040530084579)
2026-07-01 09:17:23,201 - optuna.study.study - INFO - Trial 244 finished with values: [0.002996010161031458, 0.0008823585281993808, 0.002032040530084579] and parameters: {'n_layers': 4, 'embedding_dim': 96, 'lr': 0.0016405237668077803, 'lambda_val': 1.9470910869906704e-05, 'batch_size': 2229, 'optimizer': 'RMSprop'}.
2026-07-01 09:20:37,423 - experiment_functions - INFO - Early stopping at epoch 1850. Best Metrics: (0.002763656623852802, 0.0008215717189369907, 0.001820635960004923)
2026-07-01 09:20:37,506 - optuna.study.study - INFO - Trial 245 finished with values: [0.002763656623852802, 0.0008215717189369907, 0.001820635960004923] and parameters: {'n_layers': 4, 'embedding_dim': 256, 'lr': 0.0006943898292817254, 'lambda_val': 0.00011682518010112995, 'batch_size': 2941, 'optimizer': 'RMSprop'}.
2026-07-01 09:26:10,603 - optuna.study.study - INFO - Trial 246 finished with values: [0.0026109885504416843, 0.0007265923294645062, 0.0017473779640317197] and parameters: {'n_layers': 4, 'embedding_dim': 96, 'lr': 0.0006152603091001123, 'lambda_val': 0.00011682518010112995, 'batch_size': 3344, 'optimizer': 'Adam'}.
2026-07-01 09:28:06,048 - experiment_functions - INFO - Early stopping at epoch 1350. Best Metrics: (0.0026471100850955715, 0.0007446384134642783, 0.0017133375980276136)
2026-07-01 09:28:06,162 - optuna.study.study - INFO - Trial 247 finished with values: [0.0026471100850955715, 0.0007446384134642783, 0.0017133375980276136] and parameters: {'n_layers': 4, 'embedding_dim': 96, 'lr': 0.0016405237668077803, 'lambda_val': 3.186188638129305e-06, 'batch_size': 2348, 'optimizer': 'Adam'}.
2026-07-01 09:33:11,742 - experiment_functions - INFO - Early stopping at epoch 3500. Best Metrics: (0.003048769635962622, 0.0008909066732519044, 0.002032474998307561)
2026-07-01 09:33:11,824 - optuna.study.study - INFO - Trial 248 finished with values: [0.003048769635962622, 0.0008909066732519044, 0.002032474998307561] and parameters: {'n_layers': 4, 'embedding_dim': 128, 'lr': 0.0008921739854607602, 'lambda_val': 4.9195072317508555e-06, 'batch_size': 1581, 'optimizer': 'RMSprop'}.
2026-07-01 09:36:35,679 - experiment_functions - INFO - Early stopping at epoch 2400. Best Metrics: (0.0029243188382913317, 0.0008291700700947895, 0.0019632016507556203)
2026-07-01 09:36:35,761 - optuna.study.study - INFO - Trial 249 finished with values: [0.0029243188382913317, 0.0008291700700947895, 0.0019632016507556203] and parameters: {'n_layers': 3, 'embedding_dim': 128, 'lr': 0.0010455025017472735, 'lambda_val': 4.9195072317508555e-06, 'batch_size': 2475, 'optimizer': 'RMSprop'}.
2026-07-01 09:39:24,733 - experiment_functions - INFO - Early stopping at epoch 2200. Best Metrics: (0.00220218226774365, 0.0005062401458883422, 0.00142207760995674)
2026-07-01 09:39:24,822 - optuna.study.study - INFO - Trial 250 finished with values: [0.00220218226774365, 0.0005062401458883422, 0.00142207760995674] and parameters: {'n_layers': 1, 'embedding_dim': 96, 'lr': 0.0011423999744800083, 'lambda_val': 1.9470910869906704e-05, 'batch_size': 2229, 'optimizer': 'RMSprop'}.
2026-07-01 09:42:02,652 - experiment_functions - INFO - Early stopping at epoch 1500. Best Metrics: (0.002890021242075274, 0.0008339190395684138, 0.0019247542110204497)
2026-07-01 09:42:02,744 - optuna.study.study - INFO - Trial 251 finished with values: [0.002890021242075274, 0.0008339190395684138, 0.0019247542110204497] and parameters: {'n_layers': 4, 'embedding_dim': 256, 'lr': 0.001557510643925403, 'lambda_val': 4.186926040366856e-06, 'batch_size': 1203, 'optimizer': 'RMSprop'}.
2026-07-01 09:47:49,423 - optuna.study.study - INFO - Trial 252 finished with values: [0.0006847807930540138, 0.00016051516820849877, 0.0004356934907606865] and parameters: {'n_layers': 4, 'embedding_dim': 128, 'lr': 0.00020312715469917754, 'lambda_val': 4.9195072317508555e-06, 'batch_size': 1203, 'optimizer': 'RMSprop'}.
2026-07-01 09:52:49,853 - experiment_functions - INFO - Early stopping at epoch 3800. Best Metrics: (0.0027286663444716134, 0.0007721824364112988, 0.0018791225328591706)
2026-07-01 09:52:49,936 - optuna.study.study - INFO - Trial 253 finished with values: [0.0027286663444716134, 0.0007721824364112988, 0.0018791225328591706] and parameters: {'n_layers': 4, 'embedding_dim': 64, 'lr': 0.0011663890806018467, 'lambda_val': 1.3573657888080551e-06, 'batch_size': 1990, 'optimizer': 'Adam'}.
2026-07-01 09:55:42,201 - experiment_functions - INFO - Early stopping at epoch 1950. Best Metrics: (0.002997724362123076, 0.0008662120319890585, 0.001968329196493771)
2026-07-01 09:55:42,276 - optuna.study.study - INFO - Trial 254 finished with values: [0.002997724362123076, 0.0008662120319890585, 0.001968329196493771] and parameters: {'n_layers': 4, 'embedding_dim': 128, 'lr': 0.0010455025017472735, 'lambda_val': 4.9195072317508555e-06, 'batch_size': 2475, 'optimizer': 'RMSprop'}.
2026-07-01 09:57:45,919 - experiment_functions - INFO - Early stopping at epoch 1500. Best Metrics: (0.0025686817941710876, 0.0007531865585168018, 0.0018151260670444156)
2026-07-01 09:57:46,011 - optuna.study.study - INFO - Trial 255 finished with values: [0.0025686817941710876, 0.0007531865585168018, 0.0018151260670444156] and parameters: {'n_layers': 3, 'embedding_dim': 96, 'lr': 0.0016405237668077803, 'lambda_val': 8.626508066271745e-05, 'batch_size': 2229, 'optimizer': 'RMSprop'}.
2026-07-01 09:59:25,672 - experiment_functions - INFO - Early stopping at epoch 1250. Best Metrics: (0.0029022874012619914, 0.0007693330547271242, 0.0019206051587147138)
2026-07-01 09:59:25,747 - optuna.study.study - INFO - Trial 256 finished with values: [0.0029022874012619914, 0.0007693330547271242, 0.0019206051587147138] and parameters: {'n_layers': 3, 'embedding_dim': 64, 'lr': 0.001557510643925403, 'lambda_val': 0.00011682518010112995, 'batch_size': 2839, 'optimizer': 'RMSprop'}.
2026-07-01 10:00:09,361 - experiment_functions - INFO - Early stopping at epoch 500. Best Metrics: (0.00025301888094954257, 6.838516042018883e-05, 0.000162415676112447)
2026-07-01 10:00:09,451 - optuna.study.study - INFO - Trial 257 finished with values: [0.00025301888094954257, 6.838516042018883e-05, 0.000162415676112447] and parameters: {'n_layers': 3, 'embedding_dim': 96, 'lr': 0.0016405237668077803, 'lambda_val': 4.134172720235837e-06, 'batch_size': 977, 'optimizer': 'SGD'}.
2026-07-01 10:00:57,236 - experiment_functions - INFO - Early stopping at epoch 550. Best Metrics: (0.0013766362463145845, 0.00040936116862640815, 0.000944848128280021)
2026-07-01 10:00:57,324 - optuna.study.study - INFO - Trial 258 finished with values: [0.0013766362463145845, 0.00040936116862640815, 0.000944848128280021] and parameters: {'n_layers': 3, 'embedding_dim': 96, 'lr': 0.03983151911623487, 'lambda_val': 0.00011682518010112995, 'batch_size': 977, 'optimizer': 'RMSprop'}.
2026-07-01 10:01:59,082 - experiment_functions - INFO - Early stopping at epoch 700. Best Metrics: (0.0024756023369349833, 0.0007237429477803318, 0.0016724243632716689)
2026-07-01 10:01:59,156 - optuna.study.study - INFO - Trial 259 finished with values: [0.0024756023369349833, 0.0007237429477803318, 0.0016724243632716689] and parameters: {'n_layers': 4, 'embedding_dim': 96, 'lr': 0.0033438902425603776, 'lambda_val': 4.9195072317508555e-06, 'batch_size': 3342, 'optimizer': 'RMSprop'}.
2026-07-01 10:05:08,341 - experiment_functions - INFO - Early stopping at epoch 2150. Best Metrics: (0.002945617846406976, 0.0008690614136732328, 0.002000473496882442)
2026-07-01 10:05:08,435 - optuna.study.study - INFO - Trial 260 finished with values: [0.002945617846406976, 0.0008690614136732328, 0.002000473496882442] and parameters: {'n_layers': 4, 'embedding_dim': 128, 'lr': 0.0010455025017472735, 'lambda_val': 4.9195072317508555e-06, 'batch_size': 2512, 'optimizer': 'RMSprop'}.
2026-07-01 10:09:30,764 - experiment_functions - INFO - Early stopping at epoch 3000. Best Metrics: (0.0032454788028890517, 0.0008994548183044281, 0.002144897574580895)
