2026-07-08 05:12:35,307 - optuna.study.study - INFO - Trial 64 finished with values: [0.0036453654003317055, 0.0012470793837737212, 0.0025631427583077135] and parameters: {'n_layers': 1, 'embedding_dim': 64, 'lr': 0.002396901451187955, 'lambda_val': 1.8566194585261947e-06, 'batch_size': 1430, 'optimizer': 'Adam'}.
2026-07-08 05:14:29,861 - experiment_functions - INFO - Early stopping at epoch 1500. Best Metrics: (0.003104087361647634, 0.0011606481393537603, 0.002194211529300278)
2026-07-08 05:14:29,952 - optuna.study.study - INFO - Trial 65 finished with values: [0.003104087361647634, 0.0011606481393537603, 0.002194211529300278] and parameters: {'n_layers': 1, 'embedding_dim': 64, 'lr': 0.0009008516306813866, 'lambda_val': 0.0002947495461502324, 'batch_size': 3809, 'optimizer': 'Adam'}.
2026-07-08 05:15:16,548 - experiment_functions - INFO - Early stopping at epoch 550. Best Metrics: (0.0008252862497861099, 0.00029728548904887637, 0.0005289744266803547)
2026-07-08 05:15:16,636 - optuna.study.study - INFO - Trial 66 finished with values: [0.0008252862497861099, 0.00029728548904887637, 0.0005289744266803547] and parameters: {'n_layers': 4, 'embedding_dim': 64, 'lr': 0.005183122195502878, 'lambda_val': 0.001209224174340326, 'batch_size': 1897, 'optimizer': 'Adam'}.
2026-07-08 05:16:15,553 - experiment_functions - INFO - Early stopping at epoch 650. Best Metrics: (0.001802115824168562, 0.0008073248105161181, 0.0013939684864833976)
2026-07-08 05:16:15,623 - optuna.study.study - INFO - Trial 67 finished with values: [0.001802115824168562, 0.0008073248105161181, 0.0013939684864833976] and parameters: {'n_layers': 1, 'embedding_dim': 256, 'lr': 0.0031808570812741697, 'lambda_val': 0.00045919787742064835, 'batch_size': 4042, 'optimizer': 'RMSprop'}.
2026-07-08 05:17:32,716 - experiment_functions - INFO - Early stopping at epoch 950. Best Metrics: (0.00021668349575735152, 4.843948863096708e-05, 0.00011317055982279812)
2026-07-08 05:17:32,801 - optuna.study.study - INFO - Trial 68 finished with values: [0.00021668349575735152, 4.843948863096708e-05, 0.00011317055982279812] and parameters: {'n_layers': 4, 'embedding_dim': 64, 'lr': 3.185125567751132e-05, 'lambda_val': 0.0013552584940860833, 'batch_size': 2229, 'optimizer': 'Adam'}.
2026-07-08 05:18:14,316 - experiment_functions - INFO - Early stopping at epoch 500. Best Metrics: (0.00071140187362257, 0.0001947077484185932, 0.0004591478182135093)
2026-07-08 05:18:14,393 - optuna.study.study - INFO - Trial 69 finished with values: [0.00071140187362257, 0.0001947077484185932, 0.0004591478182135093] and parameters: {'n_layers': 2, 'embedding_dim': 64, 'lr': 0.02604116087817698, 'lambda_val': 0.001326976050973506, 'batch_size': 2938, 'optimizer': 'RMSprop'}.
2026-07-08 05:18:57,474 - experiment_functions - INFO - Early stopping at epoch 500. Best Metrics: (0.00019917467489518503, 4.7489694736242234e-05, 0.00010558209572303233)
2026-07-08 05:18:57,555 - optuna.study.study - INFO - Trial 70 finished with values: [0.00019917467489518503, 4.7489694736242234e-05, 0.00010558209572303233] and parameters: {'n_layers': 2, 'embedding_dim': 128, 'lr': 1.65807463659292e-05, 'lambda_val': 0.0032390393902218804, 'batch_size': 3448, 'optimizer': 'SGD'}.
2026-07-08 05:20:01,813 - experiment_functions - INFO - Early stopping at epoch 800. Best Metrics: (0.0019729928424248033, 0.0006743536652546397, 0.0013069076543861405)
2026-07-08 05:20:01,886 - optuna.study.study - INFO - Trial 71 finished with values: [0.0019729928424248033, 0.0006743536652546397, 0.0013069076543861405] and parameters: {'n_layers': 2, 'embedding_dim': 64, 'lr': 0.0008107931898913872, 'lambda_val': 0.001326976050973506, 'batch_size': 2781, 'optimizer': 'RMSprop'}.
2026-07-08 05:20:52,682 - experiment_functions - INFO - Early stopping at epoch 550. Best Metrics: (0.00016455991899938044, 4.9389282525691926e-05, 8.825233995002204e-05)
2026-07-08 05:20:52,777 - optuna.study.study - INFO - Trial 72 finished with values: [0.00016455991899938044, 4.9389282525691926e-05, 8.825233995002204e-05] and parameters: {'n_layers': 4, 'embedding_dim': 128, 'lr': 2.9258248308452877e-05, 'lambda_val': 3.131472220467424e-05, 'batch_size': 4091, 'optimizer': 'Adam'}.
2026-07-08 05:23:11,049 - experiment_functions - INFO - Early stopping at epoch 1750. Best Metrics: (0.0003126111478330758, 0.00016526413768212295, 0.00025833533522229925)
2026-07-08 05:23:11,139 - optuna.study.study - INFO - Trial 73 finished with values: [0.0003126111478330758, 0.00016526413768212295, 0.00025833533522229925] and parameters: {'n_layers': 1, 'embedding_dim': 128, 'lr': 0.07600452475748604, 'lambda_val': 0.025405452939105753, 'batch_size': 2755, 'optimizer': 'Adam'}.
2026-07-08 05:23:53,780 - experiment_functions - INFO - Early stopping at epoch 500. Best Metrics: (0.0002587240178729227, 5.9837015367665226e-05, 0.0001503299401065416)
2026-07-08 05:23:53,919 - optuna.study.study - INFO - Trial 74 finished with values: [0.0002587240178729227, 5.9837015367665226e-05, 0.0001503299401065416] and parameters: {'n_layers': 4, 'embedding_dim': 64, 'lr': 0.0003487064801909266, 'lambda_val': 0.015942655831918742, 'batch_size': 2046, 'optimizer': 'SGD'}.
2026-07-08 05:24:34,488 - experiment_functions - INFO - Early stopping at epoch 500. Best Metrics: (0.0006759080692034271, 0.00017761145831354596, 0.00045429084033200444)
2026-07-08 05:24:34,579 - optuna.study.study - INFO - Trial 75 finished with values: [0.0006759080692034271, 0.00017761145831354596, 0.00045429084033200444] and parameters: {'n_layers': 3, 'embedding_dim': 32, 'lr': 0.07536807567160399, 'lambda_val': 2.4678252222513855e-06, 'batch_size': 3934, 'optimizer': 'RMSprop'}.
2026-07-08 05:25:19,756 - experiment_functions - INFO - Early stopping at epoch 500. Best Metrics: (0.0001921305999512734, 5.223866420986646e-05, 0.00010596540673679071)
2026-07-08 05:25:20,095 - optuna.study.study - INFO - Trial 76 finished with values: [0.0001921305999512734, 5.223866420986646e-05, 0.00010596540673679071] and parameters: {'n_layers': 1, 'embedding_dim': 256, 'lr': 0.00012077316457524685, 'lambda_val': 0.00045919787742064835, 'batch_size': 2481, 'optimizer': 'SGD'}.
2026-07-08 05:29:13,108 - experiment_functions - INFO - Early stopping at epoch 3150. Best Metrics: (0.002112243995785775, 0.0007132952149383583, 0.0013239667845739067)
2026-07-08 05:29:13,186 - optuna.study.study - INFO - Trial 77 finished with values: [0.002112243995785775, 0.0007132952149383583, 0.0013239667845739067] and parameters: {'n_layers': 2, 'embedding_dim': 32, 'lr': 0.0003487064801909266, 'lambda_val': 1.4993956067328433e-06, 'batch_size': 3102, 'optimizer': 'Adam'}.
2026-07-08 05:29:53,511 - experiment_functions - INFO - Early stopping at epoch 500. Best Metrics: (0.00020201054121947513, 5.793742757821554e-05, 0.00012128226500965962)
2026-07-08 05:29:54,602 - optuna.study.study - INFO - Trial 78 finished with values: [0.00020201054121947513, 5.793742757821554e-05, 0.00012128226500965962] and parameters: {'n_layers': 1, 'embedding_dim': 64, 'lr': 0.00012077316457524685, 'lambda_val': 0.0005608240770201872, 'batch_size': 3006, 'optimizer': 'SGD'}.
2026-07-08 05:30:36,836 - experiment_functions - INFO - Early stopping at epoch 500. Best Metrics: (0.0011145317473400399, 0.0003343274509431454, 0.0007508487098624575)
2026-07-08 05:30:36,914 - optuna.study.study - INFO - Trial 79 finished with values: [0.0011145317473400399, 0.0003343274509431454, 0.0007508487098624575] and parameters: {'n_layers': 3, 'embedding_dim': 64, 'lr': 0.05564512935248532, 'lambda_val': 4.0474983815594535e-05, 'batch_size': 1430, 'optimizer': 'RMSprop'}.
2026-07-08 05:31:35,339 - experiment_functions - INFO - Early stopping at epoch 750. Best Metrics: (0.0017374408180617289, 0.000599319947571377, 0.001148421845870858)
2026-07-08 05:31:35,444 - optuna.study.study - INFO - Trial 80 finished with values: [0.0017374408180617289, 0.000599319947571377, 0.001148421845870858] and parameters: {'n_layers': 2, 'embedding_dim': 32, 'lr': 0.0012595220636454926, 'lambda_val': 4.0474983815594535e-05, 'batch_size': 2380, 'optimizer': 'RMSprop'}.
2026-07-08 05:34:34,253 - experiment_functions - INFO - Early stopping at epoch 2400. Best Metrics: (0.0012495033770040668, 0.0005033907642041677, 0.0008945280356977504)
2026-07-08 05:34:34,341 - optuna.study.study - INFO - Trial 81 finished with values: [0.0012495033770040668, 0.0005033907642041677, 0.0008945280356977504] and parameters: {'n_layers': 3, 'embedding_dim': 32, 'lr': 0.005183122195502878, 'lambda_val': 4.0474983815594535e-05, 'batch_size': 892, 'optimizer': 'RMSprop'}.
2026-07-08 05:38:09,584 - experiment_functions - INFO - Early stopping at epoch 2500. Best Metrics: (0.0005086133338553826, 0.0003077332218908497, 0.0004666177139754081)
2026-07-08 05:38:09,656 - optuna.study.study - INFO - Trial 82 finished with values: [0.0005086133338553826, 0.0003077332218908497, 0.0004666177139754081] and parameters: {'n_layers': 4, 'embedding_dim': 128, 'lr': 0.005164709619332017, 'lambda_val': 0.0016575310493183691, 'batch_size': 3448, 'optimizer': 'RMSprop'}.
2026-07-08 05:39:47,649 - experiment_functions - INFO - Early stopping at epoch 1000. Best Metrics: (0.0014601884544119034, 0.0004957924130463689, 0.0009048516015696719)
2026-07-08 05:39:47,740 - optuna.study.study - INFO - Trial 83 finished with values: [0.0014601884544119034, 0.0004957924130463689, 0.0009048516015696719] and parameters: {'n_layers': 3, 'embedding_dim': 256, 'lr': 0.0002900679124230289, 'lambda_val': 0.003584385278278044, 'batch_size': 1648, 'optimizer': 'RMSprop'}.
2026-07-08 05:44:00,260 - experiment_functions - INFO - Early stopping at epoch 3150. Best Metrics: (0.0025322815033116996, 0.0008738103831468573, 0.0016786948594973057)
2026-07-08 05:44:00,336 - optuna.study.study - INFO - Trial 84 finished with values: [0.0025322815033116996, 0.0008738103831468573, 0.0016786948594973057] and parameters: {'n_layers': 3, 'embedding_dim': 96, 'lr': 0.0002900679124230289, 'lambda_val': 1.3187714692785522e-06, 'batch_size': 1278, 'optimizer': 'RMSprop'}.
2026-07-08 05:44:49,750 - experiment_functions - INFO - Early stopping at epoch 550. Best Metrics: (0.0015509518155483216, 0.00044925251220485153, 0.0009430496220816704)
2026-07-08 05:44:49,839 - optuna.study.study - INFO - Trial 85 finished with values: [0.0015509518155483216, 0.00044925251220485153, 0.0009430496220816704] and parameters: {'n_layers': 3, 'embedding_dim': 128, 'lr': 0.003457105212271444, 'lambda_val': 0.00036771093670891306, 'batch_size': 1699, 'optimizer': 'Adam'}.
2026-07-08 05:45:32,238 - experiment_functions - INFO - Early stopping at epoch 500. Best Metrics: (0.0002867234750961317, 6.36361909465646e-05, 0.00016022347560616052)
2026-07-08 05:45:32,325 - optuna.study.study - INFO - Trial 86 finished with values: [0.0002867234750961317, 6.36361909465646e-05, 0.00016022347560616052] and parameters: {'n_layers': 4, 'embedding_dim': 64, 'lr': 0.0031808570812741697, 'lambda_val': 0.00044891351853285386, 'batch_size': 3820, 'optimizer': 'SGD'}.
2026-07-08 05:46:49,425 - experiment_functions - INFO - Early stopping at epoch 1000. Best Metrics: (0.00022333503019242898, 5.31884581045913e-05, 0.0001237226808194645)
2026-07-08 05:46:49,510 - optuna.study.study - INFO - Trial 87 finished with values: [0.00022333503019242898, 5.31884581045913e-05, 0.0001237226808194645] and parameters: {'n_layers': 3, 'embedding_dim': 32, 'lr': 1.65807463659292e-05, 'lambda_val': 1.406185594688521e-06, 'batch_size': 1619, 'optimizer': 'Adam'}.
2026-07-08 05:48:02,892 - experiment_functions - INFO - Early stopping at epoch 700. Best Metrics: (0.0001793110066892738, 5.5088045894041e-05, 0.00010324972739620375)
2026-07-08 05:48:02,974 - optuna.study.study - INFO - Trial 88 finished with values: [0.0001793110066892738, 5.5088045894041e-05, 0.00010324972739620375] and parameters: {'n_layers': 4, 'embedding_dim': 256, 'lr': 1.819643739370084e-05, 'lambda_val': 7.683439861663996e-05, 'batch_size': 2426, 'optimizer': 'RMSprop'}.
2026-07-08 05:48:47,497 - experiment_functions - INFO - Early stopping at epoch 500. Best Metrics: (0.0002319664506117878, 6.743536652546399e-05, 0.00013824333394140686)
2026-07-08 05:48:47,601 - optuna.study.study - INFO - Trial 89 finished with values: [0.0002319664506117878, 6.743536652546399e-05, 0.00013824333394140686] and parameters: {'n_layers': 4, 'embedding_dim': 96, 'lr': 0.0011108364748811956, 'lambda_val': 1.3187714692785522e-06, 'batch_size': 3456, 'optimizer': 'SGD'}.
2026-07-08 05:49:33,794 - experiment_functions - INFO - Early stopping at epoch 550. Best Metrics: (0.0009152972723907567, 0.00044735292441540185, 0.0007135043165029083)
2026-07-08 05:49:33,887 - optuna.study.study - INFO - Trial 90 finished with values: [0.0009152972723907567, 0.00044735292441540185, 0.0007135043165029083] and parameters: {'n_layers': 1, 'embedding_dim': 128, 'lr': 0.005347815108040949, 'lambda_val': 0.0032390393902218804, 'batch_size': 3448, 'optimizer': 'RMSprop'}.
2026-07-08 05:50:13,761 - experiment_functions - INFO - Early stopping at epoch 500. Best Metrics: (0.00018696446602465996, 5.413825199931616e-05, 9.429079896246591e-05)
2026-07-08 05:50:14,062 - optuna.study.study - INFO - Trial 91 finished with values: [0.00018696446602465996, 5.413825199931616e-05, 9.429079896246591e-05] and parameters: {'n_layers': 1, 'embedding_dim': 32, 'lr': 0.008715727859634363, 'lambda_val': 1.684289604060617e-05, 'batch_size': 1312, 'optimizer': 'SGD'}.
2026-07-08 05:56:57,290 - optuna.study.study - INFO - Trial 92 finished with values: [0.0007795256426685768, 0.0004786961229413217, 0.0007017680826899727] and parameters: {'n_layers': 4, 'embedding_dim': 256, 'lr': 0.005183122195502878, 'lambda_val': 2.6914266686102143e-05, 'batch_size': 3218, 'optimizer': 'Adam'}.
2026-07-08 06:02:55,650 - optuna.study.study - INFO - Trial 93 finished with values: [0.0008772327333595168, 0.0006696046957810156, 0.0009233754486349538] and parameters: {'n_layers': 2, 'embedding_dim': 256, 'lr': 0.009951092064392947, 'lambda_val': 0.00045919787742064835, 'batch_size': 2863, 'optimizer': 'RMSprop'}.
2026-07-08 06:03:39,616 - experiment_functions - INFO - Early stopping at epoch 550. Best Metrics: (0.0009578590495472483, 0.000367570237258515, 0.0006897215287927147)
2026-07-08 06:03:39,709 - optuna.study.study - INFO - Trial 94 finished with values: [0.0009578590495472483, 0.000367570237258515, 0.0006897215287927147] and parameters: {'n_layers': 1, 'embedding_dim': 32, 'lr': 0.08630804498596618, 'lambda_val': 1.684289604060617e-05, 'batch_size': 1565, 'optimizer': 'Adam'}.
2026-07-08 06:06:02,211 - experiment_functions - INFO - Early stopping at epoch 1800. Best Metrics: (0.00024373996701668546, 6.648557263073913e-05, 0.00013434636415624092)
2026-07-08 06:06:02,304 - optuna.study.study - INFO - Trial 95 finished with values: [0.00024373996701668546, 6.648557263073913e-05, 0.00013434636415624092] and parameters: {'n_layers': 2, 'embedding_dim': 96, 'lr': 2.3929034824359322e-05, 'lambda_val': 0.0005735534363448313, 'batch_size': 4095, 'optimizer': 'Adam'}.
2026-07-08 06:08:02,451 - experiment_functions - INFO - Early stopping at epoch 1600. Best Metrics: (0.0014836688068869351, 0.0005489808711509603, 0.0009914818008202222)
2026-07-08 06:08:02,602 - optuna.study.study - INFO - Trial 96 finished with values: [0.0014836688068869351, 0.0005489808711509603, 0.0009914818008202222] and parameters: {'n_layers': 2, 'embedding_dim': 32, 'lr': 0.0003487064801909266, 'lambda_val': 0.015942655831918742, 'batch_size': 1930, 'optimizer': 'Adam'}.
2026-07-08 06:08:43,230 - experiment_functions - INFO - Early stopping at epoch 500. Best Metrics: (0.0007633797814188886, 0.00021560321410253976, 0.0004990483543640405)
2026-07-08 06:08:43,323 - optuna.study.study - INFO - Trial 97 finished with values: [0.0007633797814188886, 0.00021560321410253976, 0.0004990483543640405] and parameters: {'n_layers': 3, 'embedding_dim': 32, 'lr': 0.07536807567160399, 'lambda_val': 4.0474983815594535e-05, 'batch_size': 2938, 'optimizer': 'RMSprop'}.
2026-07-08 06:11:48,373 - experiment_functions - INFO - Early stopping at epoch 2300. Best Metrics: (0.0003156643518218486, 0.00013487073305092797, 0.00021152999221801499)
2026-07-08 06:11:48,459 - optuna.study.study - INFO - Trial 98 finished with values: [0.0003156643518218486, 0.00013487073305092797, 0.00021152999221801499] and parameters: {'n_layers': 2, 'embedding_dim': 128, 'lr': 0.00022294802860772605, 'lambda_val': 0.09719236337172699, 'batch_size': 2296, 'optimizer': 'RMSprop'}.
2026-07-08 06:13:36,280 - experiment_functions - INFO - Early stopping at epoch 1300. Best Metrics: (0.0021094962802355017, 0.0007284919172539559, 0.0014123865473729524)
2026-07-08 06:13:36,348 - optuna.study.study - INFO - Trial 99 finished with values: [0.0021094962802355017, 0.0007284919172539559, 0.0014123865473729524] and parameters: {'n_layers': 2, 'embedding_dim': 128, 'lr': 0.0002900679124230289, 'lambda_val': 0.003584385278278044, 'batch_size': 3934, 'optimizer': 'Adam'}.
2026-07-08 06:14:23,718 - experiment_functions - INFO - Early stopping at epoch 600. Best Metrics: (0.003158766524506936, 0.0010048819406188857, 0.002231471398569334)
2026-07-08 06:14:23,803 - optuna.study.study - INFO - Trial 100 finished with values: [0.003158766524506936, 0.0010048819406188857, 0.002231471398569334] and parameters: {'n_layers': 1, 'embedding_dim': 32, 'lr': 0.005183122195502878, 'lambda_val': 4.0474983815594535e-05, 'batch_size': 1565, 'optimizer': 'Adam'}.
2026-07-08 06:19:36,822 - optuna.study.study - INFO - Trial 101 finished with values: [0.0005700700430133316, 0.0003409760082062193, 0.0005171638456578874] and parameters: {'n_layers': 4, 'embedding_dim': 64, 'lr': 0.0031808570812741697, 'lambda_val': 1.783091837418501e-05, 'batch_size': 2296, 'optimizer': 'RMSprop'}.
2026-07-08 06:22:11,112 - experiment_functions - INFO - Early stopping at epoch 1950. Best Metrics: (0.0023663429842187976, 0.0009497938947248447, 0.0016598670915674248)
2026-07-08 06:22:11,200 - optuna.study.study - INFO - Trial 102 finished with values: [0.0023663429842187976, 0.0009497938947248447, 0.0016598670915674248] and parameters: {'n_layers': 1, 'embedding_dim': 128, 'lr': 0.0031808570812741697, 'lambda_val': 1.3187714692785522e-06, 'batch_size': 1278, 'optimizer': 'RMSprop'}.
2026-07-08 06:23:07,218 - experiment_functions - INFO - Early stopping at epoch 700. Best Metrics: (0.0032024690836724755, 0.001077066276617974, 0.0021101913563481315)
2026-07-08 06:23:07,293 - optuna.study.study - INFO - Trial 103 finished with values: [0.0032024690836724755, 0.001077066276617974, 0.0021101913563481315] and parameters: {'n_layers': 1, 'embedding_dim': 64, 'lr': 0.0031808570812741697, 'lambda_val': 0.00044891351853285386, 'batch_size': 1585, 'optimizer': 'Adam'}.
2026-07-08 06:23:56,557 - experiment_functions - INFO - Early stopping at epoch 600. Best Metrics: (0.0020019544638756963, 0.000753186558516802, 0.0013656251688106706)
2026-07-08 06:23:56,645 - optuna.study.study - INFO - Trial 104 finished with values: [0.0020019544638756963, 0.000753186558516802, 0.0013656251688106706] and parameters: {'n_layers': 2, 'embedding_dim': 64, 'lr': 0.0031808570812741697, 'lambda_val': 0.00044891351853285386, 'batch_size': 3416, 'optimizer': 'Adam'}.
2026-07-08 06:24:55,906 - experiment_functions - INFO - Early stopping at epoch 550. Best Metrics: (0.0006754982889775958, 0.00040556199304750873, 0.0006463954100397237)
2026-07-08 06:24:55,995 - optuna.study.study - INFO - Trial 105 finished with values: [0.0006754982889775958, 0.00040556199304750873, 0.0006463954100397237] and parameters: {'n_layers': 4, 'embedding_dim': 256, 'lr': 0.0458702168238454, 'lambda_val': 2.6914266686102143e-05, 'batch_size': 3218, 'optimizer': 'Adam'}.
2026-07-08 06:29:47,911 - optuna.study.study - INFO - Trial 106 finished with values: [0.0026006712113877998, 0.0008814087343046559, 0.001765831270353481] and parameters: {'n_layers': 1, 'embedding_dim': 32, 'lr': 0.00028288762235460313, 'lambda_val': 1.684289604060617e-05, 'batch_size': 3102, 'optimizer': 'Adam'}.
2026-07-08 06:32:05,360 - experiment_functions - INFO - Early stopping at epoch 1850. Best Metrics: (0.0037384094336411692, 0.0011986398951427542, 0.002487009964450575)
2026-07-08 06:32:05,442 - optuna.study.study - INFO - Trial 107 finished with values: [0.0037384094336411692, 0.0011986398951427542, 0.002487009964450575] and parameters: {'n_layers': 1, 'embedding_dim': 32, 'lr': 0.0009008516306813866, 'lambda_val': 0.0002947495461502324, 'batch_size': 1430, 'optimizer': 'Adam'}.
2026-07-08 06:34:06,278 - experiment_functions - INFO - Early stopping at epoch 1500. Best Metrics: (0.0010487553841937384, 0.0004008130235738845, 0.0007282295988908779)
2026-07-08 06:34:06,373 - optuna.study.study - INFO - Trial 108 finished with values: [0.0010487553841937384, 0.0004008130235738845, 0.0007282295988908779] and parameters: {'n_layers': 4, 'embedding_dim': 64, 'lr': 0.0003799309972702845, 'lambda_val': 2.662133030039408e-05, 'batch_size': 3809, 'optimizer': 'Adam'}.
2026-07-08 06:39:04,986 - optuna.study.study - INFO - Trial 109 finished with values: [0.002352430189555477, 0.0007028474820963851, 0.0014428496984699255] and parameters: {'n_layers': 3, 'embedding_dim': 32, 'lr': 0.00029101415218507826, 'lambda_val': 4.0474983815594535e-05, 'batch_size': 2367, 'optimizer': 'RMSprop'}.
2026-07-08 06:40:36,920 - experiment_functions - INFO - Early stopping at epoch 1200. Best Metrics: (0.0023156322329939733, 0.0006990483065174858, 0.0014616574116300236)
2026-07-08 06:40:36,999 - optuna.study.study - INFO - Trial 110 finished with values: [0.0023156322329939733, 0.0006990483065174858, 0.0014616574116300236] and parameters: {'n_layers': 2, 'embedding_dim': 32, 'lr': 0.000565645409068954, 'lambda_val': 0.00107672908847346, 'batch_size': 1930, 'optimizer': 'Adam'}.
