2026-06-30 14:44:47,188 - optuna.study.study - INFO - Trial 129 finished with values: [0.001249663167795512, 0.00035902209220599134, 0.0008122246600483069] and parameters: {'n_layers': 4, 'embedding_dim': 32, 'lr': 0.00875572898955806, 'lambda_val': 0.009549864442144507, 'batch_size': 3151, 'optimizer': 'Adam'}.
2026-06-30 14:45:44,592 - experiment_functions - INFO - Early stopping at epoch 650. Best Metrics: (0.001700194104136814, 0.0005195372604144902, 0.0011348440437947494)
2026-06-30 14:45:44,667 - optuna.study.study - INFO - Trial 130 finished with values: [0.001700194104136814, 0.0005195372604144902, 0.0011348440437947494] and parameters: {'n_layers': 4, 'embedding_dim': 96, 'lr': 0.004974098253366267, 'lambda_val': 0.006790143066606948, 'batch_size': 2089, 'optimizer': 'Adam'}.
2026-06-30 14:46:46,504 - experiment_functions - INFO - Early stopping at epoch 800. Best Metrics: (0.0009668357073126077, 0.0002545447637862584, 0.0006771253309468366)
2026-06-30 14:46:46,578 - optuna.study.study - INFO - Trial 131 finished with values: [0.0009668357073126077, 0.0002545447637862584, 0.0006771253309468366] and parameters: {'n_layers': 2, 'embedding_dim': 32, 'lr': 0.004355084919050286, 'lambda_val': 0.022516107485598704, 'batch_size': 1897, 'optimizer': 'Adam'}.
2026-06-30 14:47:31,940 - experiment_functions - INFO - Early stopping at epoch 550. Best Metrics: (0.0007156866003786476, 0.00018805919115551928, 0.0005039324141001055)
2026-06-30 14:47:32,028 - optuna.study.study - INFO - Trial 132 finished with values: [0.0007156866003786476, 0.00018805919115551928, 0.0005039324141001055] and parameters: {'n_layers': 1, 'embedding_dim': 96, 'lr': 0.06946935807188764, 'lambda_val': 0.0036553940027304025, 'batch_size': 2089, 'optimizer': 'Adam'}.
2026-06-30 14:52:28,185 - optuna.study.study - INFO - Trial 133 finished with values: [0.0014598812098468971, 0.00034572497767984344, 0.0009471125738157449] and parameters: {'n_layers': 3, 'embedding_dim': 32, 'lr': 0.0003328010863310823, 'lambda_val': 0.0013850667455754112, 'batch_size': 3549, 'optimizer': 'RMSprop'}.
2026-06-30 14:57:25,500 - optuna.study.study - INFO - Trial 134 finished with values: [0.002030729027599011, 0.0005005413825199933, 0.001341812143175994] and parameters: {'n_layers': 3, 'embedding_dim': 32, 'lr': 0.0005089814183335586, 'lambda_val': 0.0001986652205643858, 'batch_size': 3945, 'optimizer': 'Adam'}.
2026-06-30 15:02:35,607 - optuna.study.study - INFO - Trial 135 finished with values: [0.00031357440555339366, 6.553577873601429e-05, 0.00017462124137211795] and parameters: {'n_layers': 1, 'embedding_dim': 128, 'lr': 0.00010498915782583265, 'lambda_val': 1.7935776768087697e-05, 'batch_size': 1192, 'optimizer': 'Adam'}.
2026-06-30 15:05:09,165 - experiment_functions - INFO - Early stopping at epoch 2050. Best Metrics: (0.0020396524569920643, 0.0004720475656782479, 0.0012671983219905468)
2026-06-30 15:05:09,236 - optuna.study.study - INFO - Trial 136 finished with values: [0.0020396524569920643, 0.0004720475656782479, 0.0012671983219905468] and parameters: {'n_layers': 1, 'embedding_dim': 64, 'lr': 0.001568445204958937, 'lambda_val': 0.00042560409247420055, 'batch_size': 1496, 'optimizer': 'RMSprop'}.
2026-06-30 15:06:41,320 - experiment_functions - INFO - Early stopping at epoch 1050. Best Metrics: (0.0017797145131745794, 0.0004919932374674695, 0.0012275845960340913)
2026-06-30 15:06:41,423 - optuna.study.study - INFO - Trial 137 finished with values: [0.0017797145131745794, 0.0004919932374674695, 0.0012275845960340913] and parameters: {'n_layers': 1, 'embedding_dim': 256, 'lr': 0.004843365039812707, 'lambda_val': 0.0002747455114236161, 'batch_size': 784, 'optimizer': 'RMSprop'}.
2026-06-30 15:07:33,620 - experiment_functions - INFO - Early stopping at epoch 500. Best Metrics: (0.0010786600249271467, 0.0003267290997853466, 0.0008261443915657554)
2026-06-30 15:07:33,705 - optuna.study.study - INFO - Trial 138 finished with values: [0.0010786600249271467, 0.0003267290997853466, 0.0008261443915657554] and parameters: {'n_layers': 3, 'embedding_dim': 256, 'lr': 0.08476305125654222, 'lambda_val': 0.0013330885045298511, 'batch_size': 2917, 'optimizer': 'RMSprop'}.
2026-06-30 15:08:22,085 - experiment_functions - INFO - Early stopping at epoch 550. Best Metrics: (0.0009314885946112493, 0.0002830385806280037, 0.0007065248557207309)
2026-06-30 15:08:22,173 - optuna.study.study - INFO - Trial 139 finished with values: [0.0009314885946112493, 0.0002830385806280037, 0.0007065248557207309] and parameters: {'n_layers': 2, 'embedding_dim': 128, 'lr': 0.03248097605788152, 'lambda_val': 0.009549864442144507, 'batch_size': 812, 'optimizer': 'Adam'}.
2026-06-30 15:09:19,929 - experiment_functions - INFO - Early stopping at epoch 550. Best Metrics: (0.0014089858569826723, 0.0004150599319947571, 0.0010001093466173027)
2026-06-30 15:09:20,017 - optuna.study.study - INFO - Trial 140 finished with values: [0.0014089858569826723, 0.0004150599319947571, 0.0010001093466173027] and parameters: {'n_layers': 3, 'embedding_dim': 256, 'lr': 0.07122568677043598, 'lambda_val': 0.00014603107943375826, 'batch_size': 1340, 'optimizer': 'Adam'}.
2026-06-30 15:10:28,825 - experiment_functions - INFO - Early stopping at epoch 750. Best Metrics: (0.002224985760847132, 0.0006468096423076192, 0.00148127665973355)
2026-06-30 15:10:28,916 - optuna.study.study - INFO - Trial 141 finished with values: [0.002224985760847132, 0.0006468096423076192, 0.00148127665973355] and parameters: {'n_layers': 4, 'embedding_dim': 128, 'lr': 0.00476777556110791, 'lambda_val': 0.0005632302201312664, 'batch_size': 733, 'optimizer': 'Adam'}.
2026-06-30 15:11:20,800 - experiment_functions - INFO - Early stopping at epoch 600. Best Metrics: (0.0017037496137201026, 0.0004948426191516441, 0.0011297780244838604)
2026-06-30 15:11:20,898 - optuna.study.study - INFO - Trial 142 finished with values: [0.0017037496137201026, 0.0004948426191516441, 0.0011297780244838604] and parameters: {'n_layers': 3, 'embedding_dim': 96, 'lr': 0.003664683492842946, 'lambda_val': 0.009549864442144507, 'batch_size': 2156, 'optimizer': 'RMSprop'}.
2026-06-30 15:12:08,684 - experiment_functions - INFO - Early stopping at epoch 550. Best Metrics: (0.0016821440848137001, 0.0004986417947305435, 0.0011780094435070324)
2026-06-30 15:12:08,760 - optuna.study.study - INFO - Trial 143 finished with values: [0.0016821440848137001, 0.0004986417947305435, 0.0011780094435070324] and parameters: {'n_layers': 3, 'embedding_dim': 96, 'lr': 0.00875572898955806, 'lambda_val': 0.0006597683688978018, 'batch_size': 1897, 'optimizer': 'RMSprop'}.
2026-06-30 15:13:10,406 - experiment_functions - INFO - Early stopping at epoch 700. Best Metrics: (0.0023532365605812974, 0.0006648557263073913, 0.0015907269479095995)
2026-06-30 15:13:10,495 - optuna.study.study - INFO - Trial 144 finished with values: [0.0023532365605812974, 0.0006648557263073913, 0.0015907269479095995] and parameters: {'n_layers': 4, 'embedding_dim': 96, 'lr': 0.004974098253366267, 'lambda_val': 0.00042560409247420055, 'batch_size': 2368, 'optimizer': 'Adam'}.
2026-06-30 15:14:17,986 - experiment_functions - INFO - Early stopping at epoch 650. Best Metrics: (0.0019284578823934963, 0.0005575290162034838, 0.001291191916292209)
2026-06-30 15:14:18,081 - optuna.study.study - INFO - Trial 145 finished with values: [0.0019284578823934963, 0.0005575290162034838, 0.001291191916292209] and parameters: {'n_layers': 3, 'embedding_dim': 256, 'lr': 0.017656978087572574, 'lambda_val': 1.3936968571078208e-06, 'batch_size': 2917, 'optimizer': 'Adam'}.
2026-06-30 15:19:33,566 - optuna.study.study - INFO - Trial 146 finished with values: [0.002702772376556213, 0.0007455882073590031, 0.0018026020949673959] and parameters: {'n_layers': 4, 'embedding_dim': 64, 'lr': 0.000678453369086835, 'lambda_val': 6.297092163325562e-06, 'batch_size': 3994, 'optimizer': 'RMSprop'}.
2026-06-30 15:26:00,949 - optuna.study.study - INFO - Trial 147 finished with values: [0.0017990079967648259, 0.0004739471534676975, 0.0012613544849096312] and parameters: {'n_layers': 3, 'embedding_dim': 256, 'lr': 0.00044843281655524526, 'lambda_val': 0.00023859514179547838, 'batch_size': 631, 'optimizer': 'RMSprop'}.
2026-06-30 15:29:08,623 - experiment_functions - INFO - Early stopping at epoch 2300. Best Metrics: (0.0015294227208363178, 0.00048059571073077144, 0.0011051633081590737)
2026-06-30 15:29:08,702 - optuna.study.study - INFO - Trial 148 finished with values: [0.0015294227208363178, 0.00048059571073077144, 0.0011051633081590737] and parameters: {'n_layers': 3, 'embedding_dim': 96, 'lr': 0.0005089814183335586, 'lambda_val': 0.021770054012174384, 'batch_size': 3945, 'optimizer': 'Adam'}.
2026-06-30 15:30:14,632 - experiment_functions - INFO - Early stopping at epoch 600. Best Metrics: (0.001754912319468872, 0.0005033907642041677, 0.0012140491851138945)
2026-06-30 15:30:15,026 - optuna.study.study - INFO - Trial 149 finished with values: [0.001754912319468872, 0.0005033907642041677, 0.0012140491851138945] and parameters: {'n_layers': 4, 'embedding_dim': 256, 'lr': 0.004843365039812707, 'lambda_val': 0.009549864442144507, 'batch_size': 1496, 'optimizer': 'Adam'}.
2026-06-30 15:37:08,047 - optuna.study.study - INFO - Trial 150 finished with values: [0.0031286537467257493, 0.0008880572915677299, 0.002087284239932938] and parameters: {'n_layers': 4, 'embedding_dim': 256, 'lr': 0.0006387010239111333, 'lambda_val': 4.2886606921314005e-06, 'batch_size': 697, 'optimizer': 'RMSprop'}.
2026-06-30 15:38:58,682 - experiment_functions - INFO - Early stopping at epoch 1300. Best Metrics: (0.00260185460831631, 0.0007341906806223051, 0.001728989535365987)
2026-06-30 15:38:58,774 - optuna.study.study - INFO - Trial 151 finished with values: [0.00260185460831631, 0.0007341906806223051, 0.001728989535365987] and parameters: {'n_layers': 4, 'embedding_dim': 96, 'lr': 0.004974098253366267, 'lambda_val': 4.2886606921314005e-06, 'batch_size': 1094, 'optimizer': 'RMSprop'}.
2026-06-30 15:41:02,100 - experiment_functions - INFO - Early stopping at epoch 1450. Best Metrics: (0.002373510744482499, 0.0006895503675702373, 0.0016417041166458485)
2026-06-30 15:41:02,185 - optuna.study.study - INFO - Trial 152 finished with values: [0.002373510744482499, 0.0006895503675702373, 0.0016417041166458485] and parameters: {'n_layers': 4, 'embedding_dim': 96, 'lr': 0.0025247724250856145, 'lambda_val': 1.2687145973445492e-05, 'batch_size': 2368, 'optimizer': 'Adam'}.
2026-06-30 15:42:10,512 - experiment_functions - INFO - Early stopping at epoch 800. Best Metrics: (0.002278662230767409, 0.0006563075812548677, 0.001596128636680871)
2026-06-30 15:42:10,604 - optuna.study.study - INFO - Trial 153 finished with values: [0.002278662230767409, 0.0006563075812548677, 0.001596128636680871] and parameters: {'n_layers': 3, 'embedding_dim': 96, 'lr': 0.003664683492842946, 'lambda_val': 0.00020499046063986734, 'batch_size': 2156, 'optimizer': 'RMSprop'}.
2026-06-30 15:43:08,285 - experiment_functions - INFO - Early stopping at epoch 650. Best Metrics: (0.001840949480289494, 0.0005451816955720609, 0.0012964267396525094)
2026-06-30 15:43:08,352 - optuna.study.study - INFO - Trial 154 finished with values: [0.001840949480289494, 0.0005451816955720609, 0.0012964267396525094] and parameters: {'n_layers': 4, 'embedding_dim': 96, 'lr': 0.004974098253366267, 'lambda_val': 0.006790143066606948, 'batch_size': 2368, 'optimizer': 'Adam'}.
2026-06-30 15:45:07,593 - experiment_functions - INFO - Early stopping at epoch 1550. Best Metrics: (0.0030717252093306587, 0.0009250992534619988, 0.002110782011931373)
2026-06-30 15:45:07,674 - optuna.study.study - INFO - Trial 155 finished with values: [0.0030717252093306587, 0.0009250992534619988, 0.002110782011931373] and parameters: {'n_layers': 4, 'embedding_dim': 32, 'lr': 0.002537969130795011, 'lambda_val': 0.0004266264333481233, 'batch_size': 591, 'optimizer': 'RMSprop'}.
2026-06-30 15:49:10,558 - experiment_functions - INFO - Early stopping at epoch 3250. Best Metrics: (0.00036556914393885747, 9.307980168303481e-05, 0.0002214514180587449)
2026-06-30 15:49:10,643 - optuna.study.study - INFO - Trial 156 finished with values: [0.00036556914393885747, 9.307980168303481e-05, 0.0002214514180587449] and parameters: {'n_layers': 4, 'embedding_dim': 32, 'lr': 0.00010390648605287738, 'lambda_val': 0.0005632302201312664, 'batch_size': 1192, 'optimizer': 'RMSprop'}.
2026-06-30 15:50:51,450 - experiment_functions - INFO - Early stopping at epoch 1150. Best Metrics: (0.0016545143150337007, 0.0004644492145204491, 0.0011749384027814644)
2026-06-30 15:50:51,543 - optuna.study.study - INFO - Trial 157 finished with values: [0.0016545143150337007, 0.0004644492145204491, 0.0011749384027814644] and parameters: {'n_layers': 1, 'embedding_dim': 256, 'lr': 0.004974098253366267, 'lambda_val': 1.91238206401334e-05, 'batch_size': 4084, 'optimizer': 'RMSprop'}.
2026-06-30 15:52:07,227 - experiment_functions - INFO - Early stopping at epoch 950. Best Metrics: (0.0016385615149432215, 0.0003846665273635622, 0.0010936178777387145)
2026-06-30 15:52:07,304 - optuna.study.study - INFO - Trial 158 finished with values: [0.0016385615149432215, 0.0003846665273635622, 0.0010936178777387145] and parameters: {'n_layers': 1, 'embedding_dim': 96, 'lr': 0.00875572898955806, 'lambda_val': 0.00014917070644396066, 'batch_size': 1897, 'optimizer': 'Adam'}.
2026-06-30 15:54:10,347 - experiment_functions - INFO - Early stopping at epoch 1450. Best Metrics: (0.002208857894562439, 0.0006335125277814714, 0.0015002992816451452)
2026-06-30 15:54:10,439 - optuna.study.study - INFO - Trial 159 finished with values: [0.002208857894562439, 0.0006335125277814714, 0.0015002992816451452] and parameters: {'n_layers': 4, 'embedding_dim': 96, 'lr': 0.005907828997735388, 'lambda_val': 4.2886606921314005e-06, 'batch_size': 1192, 'optimizer': 'RMSprop'}.
2026-06-30 15:59:18,891 - optuna.study.study - INFO - Trial 160 finished with values: [0.0006299050481741643, 0.00014816784757707576, 0.00037538735401612753] and parameters: {'n_layers': 3, 'embedding_dim': 64, 'lr': 0.0001611359625622897, 'lambda_val': 6.297092163325562e-06, 'batch_size': 3549, 'optimizer': 'RMSprop'}.
2026-06-30 16:00:11,005 - experiment_functions - INFO - Early stopping at epoch 600. Best Metrics: (0.0020291189582732675, 0.0005869726269399541, 0.0013420892184362865)
2026-06-30 16:00:11,090 - optuna.study.study - INFO - Trial 161 finished with values: [0.0020291189582732675, 0.0005869726269399541, 0.0013420892184362865] and parameters: {'n_layers': 3, 'embedding_dim': 96, 'lr': 0.00875572898955806, 'lambda_val': 6.297092163325562e-06, 'batch_size': 2119, 'optimizer': 'RMSprop'}.
2026-06-30 16:02:43,201 - experiment_functions - INFO - Early stopping at epoch 1450. Best Metrics: (0.0023045304608979578, 0.0006781528408335391, 0.0015419572107601917)
2026-06-30 16:02:43,293 - optuna.study.study - INFO - Trial 162 finished with values: [0.0023045304608979578, 0.0006781528408335391, 0.0015419572107601917] and parameters: {'n_layers': 4, 'embedding_dim': 256, 'lr': 0.004124417799899418, 'lambda_val': 4.2886606921314005e-06, 'batch_size': 591, 'optimizer': 'RMSprop'}.
2026-06-30 16:08:16,289 - optuna.study.study - INFO - Trial 163 finished with values: [0.0025521158683520758, 0.0007199437722014323, 0.001747088336525192] and parameters: {'n_layers': 4, 'embedding_dim': 96, 'lr': 0.0006387010239111333, 'lambda_val': 0.00016218839236180774, 'batch_size': 2156, 'optimizer': 'Adam'}.
2026-06-30 16:13:17,309 - optuna.study.study - INFO - Trial 164 finished with values: [0.0018779866942863846, 0.000513838497046141, 0.0012694999339994662] and parameters: {'n_layers': 4, 'embedding_dim': 32, 'lr': 0.00044843281655524526, 'lambda_val': 4.2886606921314005e-06, 'batch_size': 4084, 'optimizer': 'Adam'}.
2026-06-30 16:14:10,985 - experiment_functions - INFO - Early stopping at epoch 600. Best Metrics: (0.002254295118299969, 0.0006477594362023442, 0.0015200447927382406)
2026-06-30 16:14:11,074 - optuna.study.study - INFO - Trial 165 finished with values: [0.002254295118299969, 0.0006477594362023442, 0.0015200447927382406] and parameters: {'n_layers': 4, 'embedding_dim': 96, 'lr': 0.004974098253366267, 'lambda_val': 0.00042560409247420055, 'batch_size': 2368, 'optimizer': 'RMSprop'}.
2026-06-30 16:15:31,196 - experiment_functions - INFO - Early stopping at epoch 1050. Best Metrics: (0.0016893808763119304, 0.00045970024504682485, 0.0011342356980308364)
2026-06-30 16:15:31,280 - optuna.study.study - INFO - Trial 166 finished with values: [0.0016893808763119304, 0.00045970024504682485, 0.0011342356980308364] and parameters: {'n_layers': 2, 'embedding_dim': 32, 'lr': 0.004124417799899418, 'lambda_val': 0.0005632302201312664, 'batch_size': 1192, 'optimizer': 'RMSprop'}.
2026-06-30 16:21:02,438 - optuna.study.study - INFO - Trial 167 finished with values: [0.0016111351708092846, 0.0004226582831525559, 0.0010474552609037017] and parameters: {'n_layers': 4, 'embedding_dim': 96, 'lr': 0.0004840601243362166, 'lambda_val': 0.0005632302201312664, 'batch_size': 733, 'optimizer': 'Adam'}.
2026-06-30 16:22:00,233 - experiment_functions - INFO - Early stopping at epoch 650. Best Metrics: (0.002221207814893281, 0.0006278137644131224, 0.0015093938468565987)
2026-06-30 16:22:00,325 - optuna.study.study - INFO - Trial 168 finished with values: [0.002221207814893281, 0.0006278137644131224, 0.0015093938468565987] and parameters: {'n_layers': 4, 'embedding_dim': 96, 'lr': 0.004974098253366267, 'lambda_val': 0.00042560409247420055, 'batch_size': 2625, 'optimizer': 'Adam'}.
2026-06-30 16:22:52,711 - experiment_functions - INFO - Early stopping at epoch 600. Best Metrics: (0.0015606347776648457, 0.00044260395494177764, 0.0010993572612007043)
2026-06-30 16:22:52,796 - optuna.study.study - INFO - Trial 169 finished with values: [0.0015606347776648457, 0.00044260395494177764, 0.0010993572612007043] and parameters: {'n_layers': 3, 'embedding_dim': 96, 'lr': 0.004843365039812707, 'lambda_val': 0.009549864442144507, 'batch_size': 3994, 'optimizer': 'Adam'}.
2026-06-30 16:24:03,591 - experiment_functions - INFO - Early stopping at epoch 650. Best Metrics: (0.0022067327031397113, 0.0006772030469388143, 0.0014693450373166723)
2026-06-30 16:24:03,682 - optuna.study.study - INFO - Trial 170 finished with values: [0.0022067327031397113, 0.0006772030469388143, 0.0014693450373166723] and parameters: {'n_layers': 4, 'embedding_dim': 256, 'lr': 0.00476777556110791, 'lambda_val': 4.679153798550112e-06, 'batch_size': 733, 'optimizer': 'RMSprop'}.
2026-06-30 16:24:48,070 - experiment_functions - INFO - Early stopping at epoch 550. Best Metrics: (0.00020078184399396, 7.02847482096385e-05, 0.0001409256757159766)
2026-06-30 16:24:48,159 - optuna.study.study - INFO - Trial 171 finished with values: [0.00020078184399396, 7.02847482096385e-05, 0.0001409256757159766] and parameters: {'n_layers': 3, 'embedding_dim': 32, 'lr': 1.0943527337077354e-05, 'lambda_val': 1.3936968571078208e-06, 'batch_size': 3346, 'optimizer': 'RMSprop'}.
2026-06-30 16:30:29,876 - experiment_functions - INFO - Early stopping at epoch 3300. Best Metrics: (0.002711590820869539, 0.0007797807875690975, 0.0017939387591695676)
2026-06-30 16:30:29,965 - optuna.study.study - INFO - Trial 172 finished with values: [0.002711590820869539, 0.0007797807875690975, 0.0017939387591695676] and parameters: {'n_layers': 4, 'embedding_dim': 256, 'lr': 0.00044843281655524526, 'lambda_val': 1.2687145973445492e-05, 'batch_size': 3994, 'optimizer': 'RMSprop'}.
2026-06-30 16:31:17,551 - experiment_functions - INFO - Early stopping at epoch 550. Best Metrics: (0.00022268093383748128, 5.793742757821554e-05, 0.00011842315296857021)
2026-06-30 16:31:17,648 - optuna.study.study - INFO - Trial 173 finished with values: [0.00022268093383748128, 5.793742757821554e-05, 0.00011842315296857021] and parameters: {'n_layers': 2, 'embedding_dim': 128, 'lr': 0.00476777556110791, 'lambda_val': 0.0005632302201312664, 'batch_size': 3459, 'optimizer': 'SGD'}.
2026-06-30 16:32:02,460 - experiment_functions - INFO - Early stopping at epoch 550. Best Metrics: (0.0014985167028156712, 0.00043025663431035463, 0.0009687329305526786)
2026-06-30 16:32:02,555 - optuna.study.study - INFO - Trial 174 finished with values: [0.0014985167028156712, 0.00043025663431035463, 0.0009687329305526786] and parameters: {'n_layers': 4, 'embedding_dim': 32, 'lr': 0.027315826986155863, 'lambda_val': 0.00020499046063986734, 'batch_size': 697, 'optimizer': 'Adam'}.
2026-06-30 16:32:47,341 - experiment_functions - INFO - Early stopping at epoch 550. Best Metrics: (0.0012305014721814254, 0.00033242786315369565, 0.0008049340672547999)
2026-06-30 16:32:47,419 - optuna.study.study - INFO - Trial 175 finished with values: [0.0012305014721814254, 0.00033242786315369565, 0.0008049340672547999] and parameters: {'n_layers': 4, 'embedding_dim': 32, 'lr': 0.049800099620978804, 'lambda_val': 0.0017980704428496026, 'batch_size': 733, 'optimizer': 'Adam'}.
2026-06-30 16:33:56,409 - experiment_functions - INFO - Early stopping at epoch 850. Best Metrics: (0.0018725451544937604, 0.0005594286039929335, 0.00132979291281447)
2026-06-30 16:33:56,501 - optuna.study.study - INFO - Trial 176 finished with values: [0.0018725451544937604, 0.0005594286039929335, 0.00132979291281447] and parameters: {'n_layers': 3, 'embedding_dim': 64, 'lr': 0.006717797853561655, 'lambda_val': 4.2886606921314005e-06, 'batch_size': 3078, 'optimizer': 'RMSprop'}.
2026-06-30 16:34:52,901 - experiment_functions - INFO - Early stopping at epoch 650. Best Metrics: (0.001623247277077163, 0.00046634880230989875, 0.001134246448747225)
