2026-06-30 08:54:53,460 - optuna.study.study - INFO - Trial 287 finished with values: [0.0023145016906252966, 0.0006373117033603707, 0.0016177618928018532] and parameters: {'n_layers': 4, 'embedding_dim': 256, 'lr': 0.0004597641336759426, 'lambda_val': 2.199939619081897e-06, 'batch_size': 620, 'optimizer': 'RMSprop'}.
2026-06-30 08:55:36,023 - experiment_functions - INFO - Early stopping at epoch 500. Best Metrics: (0.00021145478776395923, 5.223866420986646e-05, 0.00012736420306892876)
2026-06-30 08:55:36,101 - optuna.study.study - INFO - Trial 288 finished with values: [0.00021145478776395923, 5.223866420986646e-05, 0.00012736420306892876] and parameters: {'n_layers': 4, 'embedding_dim': 64, 'lr': 0.0013047089047836713, 'lambda_val': 2.199939619081897e-06, 'batch_size': 620, 'optimizer': 'SGD'}.
2026-06-30 08:59:50,257 - experiment_functions - INFO - Early stopping at epoch 3200. Best Metrics: (0.002577121269682804, 0.0007341906806223051, 0.0017398496566953946)
2026-06-30 08:59:50,353 - optuna.study.study - INFO - Trial 289 finished with values: [0.002577121269682804, 0.0007341906806223051, 0.0017398496566953946] and parameters: {'n_layers': 4, 'embedding_dim': 64, 'lr': 0.0013047089047836713, 'lambda_val': 3.9206514264817366e-05, 'batch_size': 2346, 'optimizer': 'Adam'}.
2026-06-30 09:04:54,007 - optuna.study.study - INFO - Trial 290 finished with values: [0.0019110183650168557, 0.00049009364967802, 0.0012875802501687488] and parameters: {'n_layers': 2, 'embedding_dim': 64, 'lr': 0.0005030162275943933, 'lambda_val': 3.9206514264817366e-05, 'batch_size': 3766, 'optimizer': 'RMSprop'}.
2026-06-30 09:09:43,186 - experiment_functions - INFO - Early stopping at epoch 3850. Best Metrics: (0.0031875690045581424, 0.0008671618258837834, 0.0021566036421052205)
2026-06-30 09:09:43,272 - optuna.study.study - INFO - Trial 291 finished with values: [0.0031875690045581424, 0.0008671618258837834, 0.0021566036421052205] and parameters: {'n_layers': 4, 'embedding_dim': 32, 'lr': 0.0013047089047836713, 'lambda_val': 1.4824096770292976e-06, 'batch_size': 1750, 'optimizer': 'RMSprop'}.
2026-06-30 09:13:12,295 - experiment_functions - INFO - Early stopping at epoch 2800. Best Metrics: (0.00241378573950872, 0.0005983701536766522, 0.0015648164879690965)
2026-06-30 09:13:12,392 - optuna.study.study - INFO - Trial 292 finished with values: [0.00241378573950872, 0.0005983701536766522, 0.0015648164879690965] and parameters: {'n_layers': 3, 'embedding_dim': 32, 'lr': 0.0009496158639399897, 'lambda_val': 1.4824096770292976e-06, 'batch_size': 3447, 'optimizer': 'RMSprop'}.
2026-06-30 09:14:04,987 - experiment_functions - INFO - Early stopping at epoch 650. Best Metrics: (0.0015898280563177195, 0.00043120642820507947, 0.001108593924547924)
2026-06-30 09:14:05,061 - optuna.study.study - INFO - Trial 293 finished with values: [0.0015898280563177195, 0.00043120642820507947, 0.001108593924547924] and parameters: {'n_layers': 2, 'embedding_dim': 64, 'lr': 0.023795789493724243, 'lambda_val': 2.199939619081897e-06, 'batch_size': 620, 'optimizer': 'RMSprop'}.
2026-06-30 09:19:47,312 - experiment_functions - INFO - Early stopping at epoch 3300. Best Metrics: (0.002858498351859273, 0.0008044754288319435, 0.0019087823110302284)
2026-06-30 09:19:47,405 - optuna.study.study - INFO - Trial 294 finished with values: [0.002858498351859273, 0.0008044754288319435, 0.0019087823110302284] and parameters: {'n_layers': 4, 'embedding_dim': 256, 'lr': 0.0005030162275943933, 'lambda_val': 1.4824096770292976e-06, 'batch_size': 3604, 'optimizer': 'RMSprop'}.
2026-06-30 09:24:48,080 - optuna.study.study - INFO - Trial 295 finished with values: [0.0033734130328403095, 0.0009250992534619987, 0.0023106832887840626] and parameters: {'n_layers': 4, 'embedding_dim': 32, 'lr': 0.0013047089047836713, 'lambda_val': 2.199939619081897e-06, 'batch_size': 620, 'optimizer': 'RMSprop'}.
2026-06-30 09:31:17,443 - optuna.study.study - INFO - Trial 296 finished with values: [0.0026629834678251066, 0.0007702828486218492, 0.0017826876989151415] and parameters: {'n_layers': 3, 'embedding_dim': 256, 'lr': 0.0005030162275943933, 'lambda_val': 2.199939619081897e-06, 'batch_size': 2642, 'optimizer': 'RMSprop'}.
2026-06-30 09:34:43,355 - experiment_functions - INFO - Early stopping at epoch 2700. Best Metrics: (0.002294606044399231, 0.0006040689170450013, 0.0015221388162738286)
2026-06-30 09:34:43,454 - optuna.study.study - INFO - Trial 297 finished with values: [0.002294606044399231, 0.0006040689170450013, 0.0015221388162738286] and parameters: {'n_layers': 2, 'embedding_dim': 64, 'lr': 0.0013047089047836713, 'lambda_val': 1.2474912078295595e-05, 'batch_size': 3726, 'optimizer': 'RMSprop'}.
2026-06-30 09:37:27,387 - experiment_functions - INFO - Early stopping at epoch 2050. Best Metrics: (0.003279772918000418, 0.0008956556427255285, 0.002183751618163669)
2026-06-30 09:37:27,477 - optuna.study.study - INFO - Trial 298 finished with values: [0.003279772918000418, 0.0008956556427255285, 0.002183751618163669] and parameters: {'n_layers': 4, 'embedding_dim': 64, 'lr': 0.0013047089047836713, 'lambda_val': 3.9206514264817366e-05, 'batch_size': 1750, 'optimizer': 'RMSprop'}.
2026-06-30 09:41:58,059 - experiment_functions - INFO - Early stopping at epoch 3600. Best Metrics: (0.003121221879496884, 0.0008377182151473132, 0.002086472282056777)
2026-06-30 09:41:58,150 - optuna.study.study - INFO - Trial 299 finished with values: [0.003121221879496884, 0.0008377182151473132, 0.002086472282056777] and parameters: {'n_layers': 4, 'embedding_dim': 32, 'lr': 0.0013047089047836713, 'lambda_val': 1.554897118169841e-06, 'batch_size': 1106, 'optimizer': 'RMSprop'}.
2026-06-30 09:41:58,166 - root - INFO - Selected Trial 254 based on Max ndcg: 0.0024
2026-06-30 09:41:58,166 - root - INFO - Associated Recall: 0.0037
2026-06-30 09:41:58,166 - experiment_functions - INFO - Training the best model ... for e_amazon_1c1dcs_strict_rand1
2026-06-30 09:45:01,167 - experiment_functions - INFO - Early stopping at epoch 2350. Best Metrics: (0.00329733511713023, 0.0009032539938833274, 0.0021806112266170366)
2026-06-30 09:45:08,051 - root - INFO -   **** Training e_amazon_1c1dcs_strict_rand2
2026-06-30 09:45:08,085 - root - INFO -   **** Getting 88982/2429444 random edges
2026-06-30 09:45:08,207 - optuna.storages._rdb.storage - INFO - A new study created in RDB with name: Study_e_amazon_1c1dcs_strict_rand2
2026-06-30 09:48:26,369 - experiment_functions - INFO - Early stopping at epoch 2650. Best Metrics: (0.001101246108531965, 0.0003409760082062193, 0.0008126417852990725)
2026-06-30 09:48:26,487 - optuna.study.study - INFO - Trial 0 finished with values: [0.001101246108531965, 0.0003409760082062193, 0.0008126417852990725] and parameters: {'n_layers': 1, 'embedding_dim': 64, 'lr': 0.002537969130795011, 'lambda_val': 0.008151110145395832, 'batch_size': 3549, 'optimizer': 'RMSprop'}.
2026-06-30 09:49:49,539 - experiment_functions - INFO - Early stopping at epoch 950. Best Metrics: (0.0022132776348309483, 0.0006344623216761962, 0.0014686468651512576)
2026-06-30 09:49:49,625 - optuna.study.study - INFO - Trial 1 finished with values: [0.0022132776348309483, 0.0006344623216761962, 0.0014686468651512576] and parameters: {'n_layers': 3, 'embedding_dim': 128, 'lr': 0.006066311051503263, 'lambda_val': 6.297092163325562e-06, 'batch_size': 2917, 'optimizer': 'RMSprop'}.
2026-06-30 09:50:39,921 - experiment_functions - INFO - Early stopping at epoch 600. Best Metrics: (0.00026038386114175853, 6.078680926239006e-05, 0.0001504489098624916)
2026-06-30 09:50:40,027 - optuna.study.study - INFO - Trial 2 finished with values: [0.00026038386114175853, 6.078680926239006e-05, 0.0001504489098624916] and parameters: {'n_layers': 2, 'embedding_dim': 96, 'lr': 0.00046002559598455904, 'lambda_val': 0.07767999411271777, 'batch_size': 2136, 'optimizer': 'Adam'}.
2026-06-30 09:51:30,587 - experiment_functions - INFO - Early stopping at epoch 600. Best Metrics: (0.0011064018246242848, 0.0003029842524172254, 0.0008084864097421694)
2026-06-30 09:51:30,673 - optuna.study.study - INFO - Trial 3 finished with values: [0.0011064018246242848, 0.0003029842524172254, 0.0008084864097421694] and parameters: {'n_layers': 1, 'embedding_dim': 128, 'lr': 0.03623904638161093, 'lambda_val': 1.7935776768087697e-05, 'batch_size': 2528, 'optimizer': 'Adam'}.
2026-06-30 09:54:56,180 - experiment_functions - INFO - Early stopping at epoch 2750. Best Metrics: (0.001704928162575124, 0.00044925251220485164, 0.0010420128761042093)
2026-06-30 09:54:56,253 - optuna.study.study - INFO - Trial 4 finished with values: [0.001704928162575124, 0.00044925251220485164, 0.0010420128761042093] and parameters: {'n_layers': 3, 'embedding_dim': 32, 'lr': 0.0005089814183335586, 'lambda_val': 0.021770054012174384, 'batch_size': 3945, 'optimizer': 'RMSprop'}.
2026-06-30 09:57:14,676 - experiment_functions - INFO - Early stopping at epoch 1400. Best Metrics: (0.00022704083988867388, 6.36361909465646e-05, 0.0001422763374796907)
2026-06-30 09:57:14,760 - optuna.study.study - INFO - Trial 5 finished with values: [0.00022704083988867388, 6.36361909465646e-05, 0.0001422763374796907] and parameters: {'n_layers': 3, 'embedding_dim': 256, 'lr': 2.911050874740068e-05, 'lambda_val': 1.841870655512807e-05, 'batch_size': 2800, 'optimizer': 'RMSprop'}.
2026-06-30 09:58:00,083 - experiment_functions - INFO - Early stopping at epoch 500. Best Metrics: (0.00026792043216064456, 4.9389282525691926e-05, 0.00013370615859990755)
2026-06-30 09:58:00,175 - optuna.study.study - INFO - Trial 6 finished with values: [0.00026792043216064456, 4.9389282525691926e-05, 0.00013370615859990755] and parameters: {'n_layers': 1, 'embedding_dim': 256, 'lr': 2.2254196006449766e-05, 'lambda_val': 1.0972145507055373e-06, 'batch_size': 3623, 'optimizer': 'SGD'}.
2026-06-30 09:59:31,226 - experiment_functions - INFO - Early stopping at epoch 1200. Best Metrics: (0.0023331278336368535, 0.0006012195353608267, 0.0014720530097150812)
2026-06-30 09:59:31,305 - optuna.study.study - INFO - Trial 7 finished with values: [0.0023331278336368535, 0.0006012195353608267, 0.0014720530097150812] and parameters: {'n_layers': 2, 'embedding_dim': 32, 'lr': 0.004124417799899418, 'lambda_val': 0.0001986652205643858, 'batch_size': 591, 'optimizer': 'RMSprop'}.
2026-06-30 10:04:20,559 - optuna.study.study - INFO - Trial 8 finished with values: [0.00039387319038783347, 0.00010827650399863232, 0.0002530052794991486] and parameters: {'n_layers': 1, 'embedding_dim': 32, 'lr': 0.00018251677111240367, 'lambda_val': 0.002813210192275465, 'batch_size': 1489, 'optimizer': 'Adam'}.
2026-06-30 10:05:03,218 - experiment_functions - INFO - Early stopping at epoch 500. Best Metrics: (0.00020611217661079488, 5.033907642041678e-05, 0.0001185716554395945)
2026-06-30 10:05:03,310 - optuna.study.study - INFO - Trial 9 finished with values: [0.00020611217661079488, 5.033907642041678e-05, 0.0001185716554395945] and parameters: {'n_layers': 4, 'embedding_dim': 64, 'lr': 0.0003653713684790253, 'lambda_val': 0.007454385819716265, 'batch_size': 2160, 'optimizer': 'SGD'}.
2026-06-30 10:05:46,394 - experiment_functions - INFO - Early stopping at epoch 500. Best Metrics: (0.00021508565682917049, 5.888722147294038e-05, 0.00012644149863892543)
2026-06-30 10:05:46,481 - optuna.study.study - INFO - Trial 10 finished with values: [0.00021508565682917049, 5.888722147294038e-05, 0.00012644149863892543] and parameters: {'n_layers': 4, 'embedding_dim': 64, 'lr': 0.006106814873767008, 'lambda_val': 0.0003743285447351107, 'batch_size': 3958, 'optimizer': 'SGD'}.
2026-06-30 10:09:06,177 - experiment_functions - INFO - Early stopping at epoch 2450. Best Metrics: (0.001139685132481175, 0.00038371673346883724, 0.0007906674280835068)
2026-06-30 10:09:06,285 - optuna.study.study - INFO - Trial 11 finished with values: [0.001139685132481175, 0.00038371673346883724, 0.0007906674280835068] and parameters: {'n_layers': 2, 'embedding_dim': 128, 'lr': 0.07122568677043598, 'lambda_val': 0.022516107485598704, 'batch_size': 3789, 'optimizer': 'RMSprop'}.
2026-06-30 10:14:30,134 - optuna.study.study - INFO - Trial 12 finished with values: [0.0008823070805040398, 0.00020990445073419068, 0.0005723404934436728] and parameters: {'n_layers': 2, 'embedding_dim': 128, 'lr': 0.0002322813520827753, 'lambda_val': 2.8646452994067736e-05, 'batch_size': 3139, 'optimizer': 'Adam'}.
2026-06-30 10:15:10,358 - experiment_functions - INFO - Early stopping at epoch 500. Best Metrics: (0.00027748239891795375, 6.743536652546399e-05, 0.00015923487710503052)
2026-06-30 10:15:10,446 - optuna.study.study - INFO - Trial 13 finished with values: [0.00027748239891795375, 6.743536652546399e-05, 0.00015923487710503052] and parameters: {'n_layers': 1, 'embedding_dim': 64, 'lr': 0.001568445204958937, 'lambda_val': 1.3243840463181226e-06, 'batch_size': 3288, 'optimizer': 'SGD'}.
2026-06-30 10:16:08,184 - experiment_functions - INFO - Early stopping at epoch 550. Best Metrics: (0.0017628118193088822, 0.00051953726041449, 0.0012225223674988673)
2026-06-30 10:16:08,273 - optuna.study.study - INFO - Trial 14 finished with values: [0.0017628118193088822, 0.00051953726041449, 0.0012225223674988673] and parameters: {'n_layers': 3, 'embedding_dim': 256, 'lr': 0.017656978087572574, 'lambda_val': 1.3936968571078208e-06, 'batch_size': 1340, 'optimizer': 'Adam'}.
2026-06-30 10:19:38,283 - experiment_functions - INFO - Early stopping at epoch 2500. Best Metrics: (0.0020823285399176007, 0.0006287635583078474, 0.0014697914782553125)
2026-06-30 10:19:38,369 - optuna.study.study - INFO - Trial 15 finished with values: [0.0020823285399176007, 0.0006287635583078474, 0.0014697914782553125] and parameters: {'n_layers': 4, 'embedding_dim': 96, 'lr': 0.0006387010239111333, 'lambda_val': 0.00135046939560172, 'batch_size': 3994, 'optimizer': 'Adam'}.
2026-06-30 10:20:27,390 - experiment_functions - INFO - Early stopping at epoch 600. Best Metrics: (0.00019733838782255643, 4.179093136789317e-05, 0.00012722592140152036)
2026-06-30 10:20:27,471 - optuna.study.study - INFO - Trial 16 finished with values: [0.00019733838782255643, 4.179093136789317e-05, 0.00012722592140152036] and parameters: {'n_layers': 1, 'embedding_dim': 96, 'lr': 3.076147837501434e-05, 'lambda_val': 0.019893501375709235, 'batch_size': 927, 'optimizer': 'RMSprop'}.
2026-06-30 10:21:40,250 - experiment_functions - INFO - Early stopping at epoch 950. Best Metrics: (0.0007090782487976298, 0.00024884600041790936, 0.0005139056806679897)
2026-06-30 10:21:40,352 - optuna.study.study - INFO - Trial 17 finished with values: [0.0007090782487976298, 0.00024884600041790936, 0.0005139056806679897] and parameters: {'n_layers': 2, 'embedding_dim': 32, 'lr': 0.0670799365395721, 'lambda_val': 0.01230011262540559, 'batch_size': 2323, 'optimizer': 'RMSprop'}.
2026-06-30 10:22:24,059 - experiment_functions - INFO - Early stopping at epoch 500. Best Metrics: (0.0002137354954865271, 5.6987633683490685e-05, 0.00012655372675805625)
2026-06-30 10:22:24,154 - optuna.study.study - INFO - Trial 18 finished with values: [0.0002137354954865271, 5.6987633683490685e-05, 0.00012655372675805625] and parameters: {'n_layers': 3, 'embedding_dim': 96, 'lr': 1.4122814985163985e-05, 'lambda_val': 0.003822203775543289, 'batch_size': 3331, 'optimizer': 'SGD'}.
2026-06-30 10:24:51,534 - experiment_functions - INFO - Early stopping at epoch 1750. Best Metrics: (0.0014837281036839596, 0.0004862944740991205, 0.0010818748712507268)
2026-06-30 10:24:51,614 - optuna.study.study - INFO - Trial 19 finished with values: [0.0014837281036839596, 0.0004862944740991205, 0.0010818748712507268] and parameters: {'n_layers': 4, 'embedding_dim': 96, 'lr': 0.00044843281655524526, 'lambda_val': 0.025392814672562707, 'batch_size': 3907, 'optimizer': 'RMSprop'}.
2026-06-30 10:26:16,420 - experiment_functions - INFO - Early stopping at epoch 1050. Best Metrics: (0.0003101463871801638, 6.553577873601429e-05, 0.00017801725638562176)
2026-06-30 10:26:16,492 - optuna.study.study - INFO - Trial 20 finished with values: [0.0003101463871801638, 6.553577873601429e-05, 0.00017801725638562176] and parameters: {'n_layers': 1, 'embedding_dim': 128, 'lr': 6.897801784012238e-05, 'lambda_val': 0.000172821084218635, 'batch_size': 774, 'optimizer': 'Adam'}.
2026-06-30 10:31:31,729 - optuna.study.study - INFO - Trial 21 finished with values: [0.0008069911998686832, 0.00021085424462891555, 0.0005376209630922677] and parameters: {'n_layers': 4, 'embedding_dim': 64, 'lr': 0.0002168513457058419, 'lambda_val': 0.00013116825599389072, 'batch_size': 2508, 'optimizer': 'Adam'}.
2026-06-30 10:33:44,195 - experiment_functions - INFO - Early stopping at epoch 1750. Best Metrics: (0.0012844845900595672, 0.000440704367152328, 0.0009013916978340974)
2026-06-30 10:33:44,276 - optuna.study.study - INFO - Trial 22 finished with values: [0.0012844845900595672, 0.000440704367152328, 0.0009013916978340974] and parameters: {'n_layers': 1, 'embedding_dim': 64, 'lr': 0.014447029284688736, 'lambda_val': 0.012320859739201282, 'batch_size': 3257, 'optimizer': 'RMSprop'}.
2026-06-30 10:34:44,410 - experiment_functions - INFO - Early stopping at epoch 700. Best Metrics: (0.0018618770985121026, 0.0005100393214672416, 0.001200952612460711)
2026-06-30 10:34:44,491 - optuna.study.study - INFO - Trial 23 finished with values: [0.0018618770985121026, 0.0005100393214672416, 0.001200952612460711] and parameters: {'n_layers': 2, 'embedding_dim': 128, 'lr': 0.00476777556110791, 'lambda_val': 0.0005632302201312664, 'batch_size': 1192, 'optimizer': 'RMSprop'}.
2026-06-30 10:39:35,421 - experiment_functions - INFO - Early stopping at epoch 2800. Best Metrics: (0.0001959933313802424, 5.603783978876584e-05, 0.00011294335608982472)
2026-06-30 10:39:35,521 - optuna.study.study - INFO - Trial 24 finished with values: [0.0001959933313802424, 5.603783978876584e-05, 0.00011294335608982472] and parameters: {'n_layers': 4, 'embedding_dim': 256, 'lr': 2.4188213452921303e-05, 'lambda_val': 0.0001648688782118632, 'batch_size': 971, 'optimizer': 'Adam'}.
2026-06-30 10:40:20,721 - experiment_functions - INFO - Early stopping at epoch 500. Best Metrics: (0.0002556891647448138, 5.318845810459131e-05, 0.00011948919895958277)
2026-06-30 10:40:20,815 - optuna.study.study - INFO - Trial 25 finished with values: [0.0002556891647448138, 5.318845810459131e-05, 0.00011948919895958277] and parameters: {'n_layers': 3, 'embedding_dim': 128, 'lr': 0.01947588937221773, 'lambda_val': 0.03065501981020636, 'batch_size': 2024, 'optimizer': 'SGD'}.
2026-06-30 10:41:04,185 - experiment_functions - INFO - Early stopping at epoch 500. Best Metrics: (0.00019974030045915615, 5.888722147294038e-05, 0.00012306367389967735)
2026-06-30 10:41:04,280 - optuna.study.study - INFO - Trial 26 finished with values: [0.00019974030045915615, 5.888722147294038e-05, 0.00012306367389967735] and parameters: {'n_layers': 2, 'embedding_dim': 128, 'lr': 3.342920140883699e-05, 'lambda_val': 0.0002684345402178449, 'batch_size': 3362, 'optimizer': 'SGD'}.
2026-06-30 10:46:24,760 - optuna.study.study - INFO - Trial 27 finished with values: [0.00046504876694358934, 0.00013012176357730373, 0.0002985250386697306] and parameters: {'n_layers': 3, 'embedding_dim': 96, 'lr': 0.00024029107883518302, 'lambda_val': 0.0007050758429540054, 'batch_size': 621, 'optimizer': 'RMSprop'}.
2026-06-30 10:51:15,275 - optuna.study.study - INFO - Trial 28 finished with values: [0.0013610933282058677, 0.0003466747715745684, 0.0008985444688516955] and parameters: {'n_layers': 1, 'embedding_dim': 32, 'lr': 0.00037632915832602786, 'lambda_val': 4.763779573080936e-05, 'batch_size': 3084, 'optimizer': 'Adam'}.
2026-06-30 10:51:58,900 - experiment_functions - INFO - Early stopping at epoch 500. Best Metrics: (0.0002277029747093008, 5.31884581045913e-05, 0.00012598330070118198)
2026-06-30 10:51:58,976 - optuna.study.study - INFO - Trial 29 finished with values: [0.0002277029747093008, 5.31884581045913e-05, 0.00012598330070118198] and parameters: {'n_layers': 2, 'embedding_dim': 128, 'lr': 0.0005685352957341777, 'lambda_val': 0.0010351165506398865, 'batch_size': 1699, 'optimizer': 'SGD'}.
2026-06-30 10:52:38,942 - experiment_functions - INFO - Early stopping at epoch 500. Best Metrics: (0.00043303600434949985, 0.0001272723818931292, 0.00029303793213559284)
2026-06-30 10:52:39,044 - optuna.study.study - INFO - Trial 30 finished with values: [0.00043303600434949985, 0.0001272723818931292, 0.00029303793213559284] and parameters: {'n_layers': 2, 'embedding_dim': 32, 'lr': 0.03102732505584774, 'lambda_val': 0.09224060861878416, 'batch_size': 1255, 'optimizer': 'RMSprop'}.
2026-06-30 10:54:26,027 - experiment_functions - INFO - Early stopping at epoch 1400. Best Metrics: (0.00023541136465397906, 6.458598484128943e-05, 0.00014956226902204165)
2026-06-30 10:54:26,115 - optuna.study.study - INFO - Trial 31 finished with values: [0.00023541136465397906, 6.458598484128943e-05, 0.00014956226902204165] and parameters: {'n_layers': 4, 'embedding_dim': 32, 'lr': 4.060833583196873e-05, 'lambda_val': 2.4507499034906854e-05, 'batch_size': 961, 'optimizer': 'RMSprop'}.
2026-06-30 10:55:38,349 - experiment_functions - INFO - Early stopping at epoch 850. Best Metrics: (0.002381663560684053, 0.0006211652071500485, 0.0016388875162146957)
2026-06-30 10:55:38,433 - optuna.study.study - INFO - Trial 32 finished with values: [0.002381663560684053, 0.0006211652071500485, 0.0016388875162146957] and parameters: {'n_layers': 3, 'embedding_dim': 96, 'lr': 0.003664683492842946, 'lambda_val': 0.00016218839236180774, 'batch_size': 2156, 'optimizer': 'Adam'}.
2026-06-30 10:56:38,824 - experiment_functions - INFO - Early stopping at epoch 750. Best Metrics: (0.0013922799050718093, 0.00033242786315369565, 0.0008377181831410655)
