2026-06-27 18:46:27,858 - optuna.study.study - INFO - Trial 46 finished with values: [0.00023217162739605325, 6.268639705183976e-05, 0.00015933177026806986] and parameters: {'n_layers': 2, 'embedding_dim': 64, 'lr': 0.006309663408590235, 'lambda_val': 7.684713869761801e-05, 'batch_size': 1630, 'optimizer': 'SGD'}.
2026-06-27 18:47:17,557 - experiment_functions - INFO - Early stopping at epoch 500. Best Metrics: (0.00026837482297422744, 7.598351157798758e-05, 0.00015442173777580778)
2026-06-27 18:47:17,649 - optuna.study.study - INFO - Trial 47 finished with values: [0.00026837482297422744, 7.598351157798758e-05, 0.00015442173777580778] and parameters: {'n_layers': 2, 'embedding_dim': 96, 'lr': 0.019838601711567486, 'lambda_val': 0.0006464237745129678, 'batch_size': 1928, 'optimizer': 'SGD'}.
2026-06-27 18:48:16,264 - experiment_functions - INFO - Early stopping at epoch 550. Best Metrics: (0.002837933462516251, 0.0006344623216761963, 0.0017173188998077273)
2026-06-27 18:48:16,353 - optuna.study.study - INFO - Trial 48 finished with values: [0.002837933462516251, 0.0006344623216761963, 0.0017173188998077273] and parameters: {'n_layers': 4, 'embedding_dim': 64, 'lr': 0.04523975005049768, 'lambda_val': 0.015186411277646816, 'batch_size': 4065, 'optimizer': 'Adam'}.
2026-06-27 18:51:08,035 - experiment_functions - INFO - Early stopping at epoch 1900. Best Metrics: (0.00019371598649380292, 6.743536652546399e-05, 0.00012643286082401054)
2026-06-27 18:51:08,135 - optuna.study.study - INFO - Trial 49 finished with values: [0.00019371598649380292, 6.743536652546399e-05, 0.00012643286082401054] and parameters: {'n_layers': 4, 'embedding_dim': 32, 'lr': 5.497557863922145e-05, 'lambda_val': 0.0001157126083657583, 'batch_size': 1583, 'optimizer': 'Adam'}.
2026-06-27 18:51:52,742 - experiment_functions - INFO - Early stopping at epoch 500. Best Metrics: (0.00021028395390091764, 5.603783978876584e-05, 0.00011629749447216971)
2026-06-27 18:51:52,835 - optuna.study.study - INFO - Trial 50 finished with values: [0.00021028395390091764, 5.603783978876584e-05, 0.00011629749447216971] and parameters: {'n_layers': 1, 'embedding_dim': 64, 'lr': 0.0020380855043872948, 'lambda_val': 0.012899301827092117, 'batch_size': 2974, 'optimizer': 'SGD'}.
2026-06-27 18:57:38,633 - optuna.study.study - INFO - Trial 51 finished with values: [0.006472978281227518, 0.0017457211785042643, 0.004057876899664157] and parameters: {'n_layers': 3, 'embedding_dim': 32, 'lr': 0.00038340250686706587, 'lambda_val': 0.0040264411856320995, 'batch_size': 1053, 'optimizer': 'Adam'}.
2026-06-27 18:58:27,907 - experiment_functions - INFO - Early stopping at epoch 550. Best Metrics: (0.006964845551096988, 0.0017580684991356879, 0.004421951490590577)
2026-06-27 18:58:27,985 - optuna.study.study - INFO - Trial 52 finished with values: [0.006964845551096988, 0.0017580684991356879, 0.004421951490590577] and parameters: {'n_layers': 2, 'embedding_dim': 32, 'lr': 0.019838601711567486, 'lambda_val': 0.0005255886197318135, 'batch_size': 2269, 'optimizer': 'Adam'}.
2026-06-27 18:59:37,966 - experiment_functions - INFO - Early stopping at epoch 750. Best Metrics: (0.00022079023639065922, 5.6987633683490685e-05, 0.00013562585900381025)
2026-06-27 18:59:38,409 - optuna.study.study - INFO - Trial 53 finished with values: [0.00022079023639065922, 5.6987633683490685e-05, 0.00013562585900381025] and parameters: {'n_layers': 1, 'embedding_dim': 128, 'lr': 0.00022567039350054777, 'lambda_val': 0.0006043567828314722, 'batch_size': 1844, 'optimizer': 'Adam'}.
2026-06-27 19:09:08,417 - optuna.study.study - INFO - Trial 54 finished with values: [0.01974929356116485, 0.004270273350682902, 0.011611337285648947] and parameters: {'n_layers': 3, 'embedding_dim': 256, 'lr': 0.018551923909154135, 'lambda_val': 0.00038291857999994005, 'batch_size': 1355, 'optimizer': 'RMSprop'}.
2026-06-27 19:10:01,931 - experiment_functions - INFO - Early stopping at epoch 500. Best Metrics: (0.00016887668564243566, 5.0339076420416775e-05, 9.602461994030855e-05)
2026-06-27 19:10:02,008 - optuna.study.study - INFO - Trial 55 finished with values: [0.00016887668564243566, 5.0339076420416775e-05, 9.602461994030855e-05] and parameters: {'n_layers': 4, 'embedding_dim': 64, 'lr': 0.009091499316683776, 'lambda_val': 3.731801442207796e-05, 'batch_size': 3517, 'optimizer': 'SGD'}.
2026-06-27 19:11:58,571 - experiment_functions - INFO - Early stopping at epoch 800. Best Metrics: (0.00024697472791773115, 6.933495431491367e-05, 0.0001660061122943419)
2026-06-27 19:11:58,683 - optuna.study.study - INFO - Trial 56 finished with values: [0.00024697472791773115, 6.933495431491367e-05, 0.0001660061122943419] and parameters: {'n_layers': 3, 'embedding_dim': 256, 'lr': 1.0420504254047765e-05, 'lambda_val': 0.002864767214859732, 'batch_size': 892, 'optimizer': 'Adam'}.
2026-06-27 19:12:47,172 - experiment_functions - INFO - Early stopping at epoch 500. Best Metrics: (0.0002811567894391416, 6.17366031571149e-05, 0.00015303442926114163)
2026-06-27 19:12:47,263 - optuna.study.study - INFO - Trial 57 finished with values: [0.0002811567894391416, 6.17366031571149e-05, 0.00015303442926114163] and parameters: {'n_layers': 4, 'embedding_dim': 32, 'lr': 7.907340422353707e-05, 'lambda_val': 0.0037300541282091738, 'batch_size': 4067, 'optimizer': 'Adam'}.
2026-06-27 19:19:05,326 - optuna.study.study - INFO - Trial 58 finished with values: [0.011531749277624915, 0.0026565735235453912, 0.0067521202196377484] and parameters: {'n_layers': 2, 'embedding_dim': 96, 'lr': 0.003548193425453264, 'lambda_val': 0.0024964471498600837, 'batch_size': 2974, 'optimizer': 'RMSprop'}.
2026-06-27 19:25:45,621 - optuna.study.study - INFO - Trial 59 finished with values: [0.0068363024524029205, 0.0017020306593469219, 0.004075571175024191] and parameters: {'n_layers': 4, 'embedding_dim': 64, 'lr': 0.00022510550270076726, 'lambda_val': 8.248333957774017e-06, 'batch_size': 1706, 'optimizer': 'RMSprop'}.
2026-06-27 19:26:39,128 - experiment_functions - INFO - Early stopping at epoch 500. Best Metrics: (0.0003172597387564045, 7.408392378853788e-05, 0.0001694106646610265)
2026-06-27 19:26:39,203 - optuna.study.study - INFO - Trial 60 finished with values: [0.0003172597387564045, 7.408392378853788e-05, 0.0001694106646610265] and parameters: {'n_layers': 2, 'embedding_dim': 128, 'lr': 0.0001955566655843862, 'lambda_val': 0.07174773546725781, 'batch_size': 1227, 'optimizer': 'Adam'}.
2026-06-27 19:27:24,876 - experiment_functions - INFO - Early stopping at epoch 500. Best Metrics: (0.0001924192860044428, 5.6987633683490685e-05, 0.0001043490821641287)
2026-06-27 19:27:25,234 - optuna.study.study - INFO - Trial 61 finished with values: [0.0001924192860044428, 5.6987633683490685e-05, 0.0001043490821641287] and parameters: {'n_layers': 1, 'embedding_dim': 96, 'lr': 0.0007259712952677559, 'lambda_val': 0.0006464237745129678, 'batch_size': 1928, 'optimizer': 'SGD'}.
2026-06-27 19:28:36,122 - experiment_functions - INFO - Early stopping at epoch 550. Best Metrics: (0.006957595479865572, 0.0017438215907148152, 0.004549597411271996)
2026-06-27 19:28:36,184 - optuna.study.study - INFO - Trial 62 finished with values: [0.006957595479865572, 0.0017438215907148152, 0.004549597411271996] and parameters: {'n_layers': 2, 'embedding_dim': 256, 'lr': 0.011862659119347791, 'lambda_val': 0.024824909226658653, 'batch_size': 1844, 'optimizer': 'Adam'}.
2026-06-27 19:29:20,763 - experiment_functions - INFO - Early stopping at epoch 500. Best Metrics: (0.00023645535532212158, 6.36361909465646e-05, 0.00012746801089345155)
2026-06-27 19:29:21,326 - optuna.study.study - INFO - Trial 63 finished with values: [0.00023645535532212158, 6.36361909465646e-05, 0.00012746801089345155] and parameters: {'n_layers': 2, 'embedding_dim': 32, 'lr': 0.006309663408590235, 'lambda_val': 7.684713869761801e-05, 'batch_size': 1630, 'optimizer': 'SGD'}.
2026-06-27 19:35:41,712 - optuna.study.study - INFO - Trial 64 finished with values: [0.014353593431256204, 0.00314856676101286, 0.008298086047533695] and parameters: {'n_layers': 3, 'embedding_dim': 64, 'lr': 0.001948110338269317, 'lambda_val': 1.5450706960350556e-06, 'batch_size': 3583, 'optimizer': 'RMSprop'}.
2026-06-27 19:36:34,052 - experiment_functions - INFO - Early stopping at epoch 550. Best Metrics: (0.010742212928221603, 0.00256824269133598, 0.006584733515907563)
2026-06-27 19:36:34,125 - optuna.study.study - INFO - Trial 65 finished with values: [0.010742212928221603, 0.00256824269133598, 0.006584733515907563] and parameters: {'n_layers': 2, 'embedding_dim': 64, 'lr': 0.009091499316683776, 'lambda_val': 0.0024964471498600837, 'batch_size': 1947, 'optimizer': 'RMSprop'}.
2026-06-27 19:37:38,440 - experiment_functions - INFO - Early stopping at epoch 500. Best Metrics: (0.0001893717262092491, 5.413825199931615e-05, 0.00010138359388189887)
2026-06-27 19:37:38,510 - optuna.study.study - INFO - Trial 66 finished with values: [0.0001893717262092491, 5.413825199931615e-05, 0.00010138359388189887] and parameters: {'n_layers': 2, 'embedding_dim': 256, 'lr': 1.2581763619514257e-05, 'lambda_val': 0.00040160122661175255, 'batch_size': 2468, 'optimizer': 'RMSprop'}.
2026-06-27 19:38:49,122 - experiment_functions - INFO - Early stopping at epoch 650. Best Metrics: (0.008987935781004342, 0.002043956461447866, 0.0055030234229565475)
2026-06-27 19:38:49,178 - optuna.study.study - INFO - Trial 67 finished with values: [0.008987935781004342, 0.002043956461447866, 0.0055030234229565475] and parameters: {'n_layers': 3, 'embedding_dim': 96, 'lr': 0.019921281966616786, 'lambda_val': 6.447923168817336e-05, 'batch_size': 2430, 'optimizer': 'Adam'}.
2026-06-27 19:44:01,993 - optuna.study.study - INFO - Trial 68 finished with values: [0.008865650687151462, 0.002270957202287104, 0.005499137537413891] and parameters: {'n_layers': 1, 'embedding_dim': 32, 'lr': 0.0007259712952677559, 'lambda_val': 0.0003312399156887171, 'batch_size': 1553, 'optimizer': 'RMSprop'}.
2026-06-27 19:45:24,339 - experiment_functions - INFO - Early stopping at epoch 550. Best Metrics: (0.013305141385324234, 0.0031172235624869404, 0.008387890311779644)
2026-06-27 19:45:24,411 - optuna.study.study - INFO - Trial 69 finished with values: [0.013305141385324234, 0.0031172235624869404, 0.008387890311779644] and parameters: {'n_layers': 3, 'embedding_dim': 256, 'lr': 0.016441903411988045, 'lambda_val': 0.00011460379227540933, 'batch_size': 1053, 'optimizer': 'Adam'}.
2026-06-27 19:53:33,046 - optuna.study.study - INFO - Trial 70 finished with values: [0.005775453204567831, 0.0015985031248219137, 0.0036004780107333355] and parameters: {'n_layers': 2, 'embedding_dim': 256, 'lr': 0.000242059070964804, 'lambda_val': 0.00016988289577808146, 'batch_size': 4065, 'optimizer': 'Adam'}.
2026-06-27 19:54:23,165 - experiment_functions - INFO - Early stopping at epoch 500. Best Metrics: (0.000204194080506167, 5.5088045894041e-05, 0.000122566627258589)
2026-06-27 19:54:23,264 - optuna.study.study - INFO - Trial 71 finished with values: [0.000204194080506167, 5.5088045894041e-05, 0.000122566627258589] and parameters: {'n_layers': 3, 'embedding_dim': 64, 'lr': 7.992849975602242e-05, 'lambda_val': 0.006299559698975352, 'batch_size': 3175, 'optimizer': 'SGD'}.
2026-06-27 20:00:19,749 - optuna.study.study - INFO - Trial 72 finished with values: [0.01716647188637853, 0.003794426609425755, 0.009981557532493322] and parameters: {'n_layers': 2, 'embedding_dim': 64, 'lr': 0.0021025807952068966, 'lambda_val': 4.470441871474425e-06, 'batch_size': 1437, 'optimizer': 'Adam'}.
2026-06-27 20:05:14,119 - experiment_functions - INFO - Early stopping at epoch 3500. Best Metrics: (0.020581138324027623, 0.004635944000151967, 0.012103116080325431)
2026-06-27 20:05:14,758 - optuna.study.study - INFO - Trial 73 finished with values: [0.020581138324027623, 0.004635944000151967, 0.012103116080325431] and parameters: {'n_layers': 2, 'embedding_dim': 32, 'lr': 0.001662600137131039, 'lambda_val': 0.000307769265113033, 'batch_size': 4066, 'optimizer': 'Adam'}.
2026-06-27 20:06:01,673 - experiment_functions - INFO - Early stopping at epoch 500. Best Metrics: (0.00020508528721898542, 5.698763368349069e-05, 0.0001293129445032867)
2026-06-27 20:06:04,254 - optuna.study.study - INFO - Trial 74 finished with values: [0.00020508528721898542, 5.698763368349069e-05, 0.0001293129445032867] and parameters: {'n_layers': 2, 'embedding_dim': 64, 'lr': 0.006309663408590235, 'lambda_val': 0.00048607776614686303, 'batch_size': 1630, 'optimizer': 'SGD'}.
2026-06-27 20:07:22,940 - experiment_functions - INFO - Early stopping at epoch 550. Best Metrics: (0.004993120103200405, 0.0010732671010390746, 0.0029739716431471798)
2026-06-27 20:07:23,023 - optuna.study.study - INFO - Trial 75 finished with values: [0.004993120103200405, 0.0010732671010390746, 0.0029739716431471798] and parameters: {'n_layers': 4, 'embedding_dim': 128, 'lr': 0.04523975005049768, 'lambda_val': 0.015186411277646816, 'batch_size': 1679, 'optimizer': 'Adam'}.
2026-06-27 20:08:09,916 - experiment_functions - INFO - Early stopping at epoch 500. Best Metrics: (0.00014610213590445927, 4.3690519157342865e-05, 8.478080063700481e-05)
2026-06-27 20:08:09,978 - optuna.study.study - INFO - Trial 76 finished with values: [0.00014610213590445927, 4.3690519157342865e-05, 8.478080063700481e-05] and parameters: {'n_layers': 2, 'embedding_dim': 64, 'lr': 0.018551923909154135, 'lambda_val': 0.0004685521645833903, 'batch_size': 1946, 'optimizer': 'SGD'}.
2026-06-27 20:08:56,524 - experiment_functions - INFO - Early stopping at epoch 500. Best Metrics: (0.00021650688586928916, 5.983701536766521e-05, 0.00013534122348198764)
2026-06-27 20:08:58,179 - optuna.study.study - INFO - Trial 77 finished with values: [0.00021650688586928916, 5.983701536766521e-05, 0.00013534122348198764] and parameters: {'n_layers': 2, 'embedding_dim': 64, 'lr': 0.005739501470387607, 'lambda_val': 0.01452282444948456, 'batch_size': 2292, 'optimizer': 'SGD'}.
2026-06-27 20:10:00,448 - experiment_functions - INFO - Early stopping at epoch 500. Best Metrics: (0.00018181603266553145, 5.033907642041677e-05, 0.00010147603633852358)
2026-06-27 20:10:00,535 - optuna.study.study - INFO - Trial 78 finished with values: [0.00018181603266553145, 5.033907642041677e-05, 0.00010147603633852358] and parameters: {'n_layers': 4, 'embedding_dim': 64, 'lr': 0.006309663408590235, 'lambda_val': 0.010284692058718622, 'batch_size': 1630, 'optimizer': 'SGD'}.
2026-06-27 20:10:43,978 - experiment_functions - INFO - Early stopping at epoch 500. Best Metrics: (0.00018768649781762992, 5.128887031514161e-05, 0.00010115628183976845)
2026-06-27 20:10:44,059 - optuna.study.study - INFO - Trial 79 finished with values: [0.00018768649781762992, 5.128887031514161e-05, 0.00010115628183976845] and parameters: {'n_layers': 1, 'embedding_dim': 64, 'lr': 2.083390917268887e-05, 'lambda_val': 1.0416486521122021e-05, 'batch_size': 1373, 'optimizer': 'SGD'}.
2026-06-27 20:18:05,292 - optuna.study.study - INFO - Trial 80 finished with values: [0.010454778107420312, 0.0023554888589176147, 0.006098341952089345] and parameters: {'n_layers': 3, 'embedding_dim': 128, 'lr': 0.007515611127205712, 'lambda_val': 0.0006043567828314722, 'batch_size': 3545, 'optimizer': 'Adam'}.
2026-06-27 20:18:50,484 - experiment_functions - INFO - Early stopping at epoch 500. Best Metrics: (0.0002466727813767763, 5.413825199931615e-05, 0.00012644674356264597)
2026-06-27 20:18:50,567 - optuna.study.study - INFO - Trial 81 finished with values: [0.0002466727813767763, 5.413825199931615e-05, 0.00012644674356264597] and parameters: {'n_layers': 1, 'embedding_dim': 96, 'lr': 0.00021264071356183733, 'lambda_val': 1.0606071298211097e-06, 'batch_size': 3517, 'optimizer': 'SGD'}.
2026-06-27 20:25:35,204 - optuna.study.study - INFO - Trial 82 finished with values: [0.01520553132173881, 0.003555078547955094, 0.00928723569034817] and parameters: {'n_layers': 4, 'embedding_dim': 64, 'lr': 0.0005928900750652104, 'lambda_val': 1.0416486521122021e-05, 'batch_size': 4033, 'optimizer': 'Adam'}.
2026-06-27 20:26:41,231 - experiment_functions - INFO - Early stopping at epoch 500. Best Metrics: (0.00016535181036163898, 4.843948863096708e-05, 0.00010421746179377608)
2026-06-27 20:26:41,314 - optuna.study.study - INFO - Trial 83 finished with values: [0.00016535181036163898, 4.843948863096708e-05, 0.00010421746179377608] and parameters: {'n_layers': 4, 'embedding_dim': 96, 'lr': 0.0005928900750652104, 'lambda_val': 1.0416486521122021e-05, 'batch_size': 4033, 'optimizer': 'SGD'}.
2026-06-27 20:32:28,559 - optuna.study.study - INFO - Trial 84 finished with values: [0.021453971316260673, 0.004737571946887526, 0.012475949350889219] and parameters: {'n_layers': 1, 'embedding_dim': 96, 'lr': 0.005739501470387607, 'lambda_val': 0.0006043567828314722, 'batch_size': 2292, 'optimizer': 'RMSprop'}.
2026-06-27 20:38:18,630 - optuna.study.study - INFO - Trial 85 finished with values: [0.027513819583709073, 0.00605398628497616, 0.01669285917641635] and parameters: {'n_layers': 1, 'embedding_dim': 96, 'lr': 0.001948110338269317, 'lambda_val': 6.447923168817336e-05, 'batch_size': 2430, 'optimizer': 'RMSprop'}.
2026-06-27 20:45:12,139 - optuna.study.study - INFO - Trial 86 finished with values: [0.016514868743721964, 0.003634861235111981, 0.009725688455899264] and parameters: {'n_layers': 3, 'embedding_dim': 96, 'lr': 0.001948110338269317, 'lambda_val': 6.447923168817336e-05, 'batch_size': 3568, 'optimizer': 'Adam'}.
2026-06-27 20:46:46,922 - experiment_functions - INFO - Early stopping at epoch 1050. Best Metrics: (0.0002418490336516157, 5.413825199931616e-05, 0.00012253986153512193)
2026-06-27 20:46:47,002 - optuna.study.study - INFO - Trial 87 finished with values: [0.0002418490336516157, 5.413825199931616e-05, 0.00012253986153512193] and parameters: {'n_layers': 2, 'embedding_dim': 64, 'lr': 5.3888437948279316e-05, 'lambda_val': 1.4306364770236095e-06, 'batch_size': 1519, 'optimizer': 'Adam'}.
2026-06-27 20:52:16,785 - optuna.study.study - INFO - Trial 88 finished with values: [0.0052996594153330275, 0.0013183139258780845, 0.0030499076190072666] and parameters: {'n_layers': 2, 'embedding_dim': 32, 'lr': 0.003411184837942451, 'lambda_val': 0.020808731417952392, 'batch_size': 1630, 'optimizer': 'Adam'}.
2026-06-27 20:53:06,789 - experiment_functions - INFO - Early stopping at epoch 500. Best Metrics: (0.0002607624041004579, 6.36361909465646e-05, 0.00017883018255194645)
2026-06-27 20:53:06,857 - optuna.study.study - INFO - Trial 89 finished with values: [0.0002607624041004579, 6.36361909465646e-05, 0.00017883018255194645] and parameters: {'n_layers': 3, 'embedding_dim': 64, 'lr': 7.992849975602242e-05, 'lambda_val': 0.006299559698975352, 'batch_size': 1296, 'optimizer': 'SGD'}.
2026-06-27 20:59:29,066 - optuna.study.study - INFO - Trial 90 finished with values: [0.016711781966601096, 0.0036690538153220753, 0.00993640128844436] and parameters: {'n_layers': 3, 'embedding_dim': 64, 'lr': 0.009091499316683776, 'lambda_val': 3.731801442207796e-05, 'batch_size': 2778, 'optimizer': 'RMSprop'}.
2026-06-27 21:00:16,202 - experiment_functions - INFO - Early stopping at epoch 500. Best Metrics: (0.00025836627301980636, 6.933495431491368e-05, 0.0001451875922267589)
2026-06-27 21:00:16,275 - optuna.study.study - INFO - Trial 91 finished with values: [0.00025836627301980636, 6.933495431491368e-05, 0.0001451875922267589] and parameters: {'n_layers': 2, 'embedding_dim': 64, 'lr': 0.0005928900750652104, 'lambda_val': 0.0006675505312091693, 'batch_size': 4033, 'optimizer': 'SGD'}.
2026-06-27 21:05:48,286 - optuna.study.study - INFO - Trial 92 finished with values: [0.005675342706382256, 0.001554812605664571, 0.0033195945795117684] and parameters: {'n_layers': 2, 'embedding_dim': 32, 'lr': 0.00030208896688504897, 'lambda_val': 0.0027920341523376825, 'batch_size': 4067, 'optimizer': 'RMSprop'}.
2026-06-27 21:06:38,031 - experiment_functions - INFO - Early stopping at epoch 500. Best Metrics: (0.00030004294982401814, 6.36361909465646e-05, 0.00015620242238970587)
2026-06-27 21:06:38,113 - optuna.study.study - INFO - Trial 93 finished with values: [0.00030004294982401814, 6.36361909465646e-05, 0.00015620242238970587] and parameters: {'n_layers': 2, 'embedding_dim': 96, 'lr': 0.00021264071356183733, 'lambda_val': 0.009914972359246377, 'batch_size': 1776, 'optimizer': 'SGD'}.
2026-06-27 21:07:22,404 - experiment_functions - INFO - Early stopping at epoch 500. Best Metrics: (0.00020657680554577907, 5.033907642041677e-05, 0.00012942882493076447)
2026-06-27 21:07:22,519 - optuna.study.study - INFO - Trial 94 finished with values: [0.00020657680554577907, 5.033907642041677e-05, 0.00012942882493076447] and parameters: {'n_layers': 1, 'embedding_dim': 64, 'lr': 0.018551923909154135, 'lambda_val': 0.00011460379227540933, 'batch_size': 1355, 'optimizer': 'SGD'}.
2026-06-27 21:12:56,080 - optuna.study.study - INFO - Trial 95 finished with values: [0.011832105905878052, 0.002586288775335752, 0.006815320397157567] and parameters: {'n_layers': 2, 'embedding_dim': 32, 'lr': 0.009091499316683776, 'lambda_val': 3.731801442207796e-05, 'batch_size': 2778, 'optimizer': 'Adam'}.
2026-06-27 21:13:59,717 - experiment_functions - INFO - Early stopping at epoch 550. Best Metrics: (0.00019213848086669088, 5.033907642041677e-05, 0.00010325442475228694)
2026-06-27 21:13:59,863 - optuna.study.study - INFO - Trial 96 finished with values: [0.00019213848086669088, 5.033907642041677e-05, 0.00010325442475228694] and parameters: {'n_layers': 3, 'embedding_dim': 128, 'lr': 1.4907477674101118e-05, 'lambda_val': 0.0005683508304106412, 'batch_size': 3412, 'optimizer': 'RMSprop'}.
2026-06-27 21:14:53,026 - experiment_functions - INFO - Early stopping at epoch 500. Best Metrics: (0.0002530874318288918, 5.793742757821554e-05, 0.00014084897478661723)
