2026-07-02 10:36:17,811 - optuna.study.study - INFO - Trial 270 finished with values: [0.00227831040276407, 0.0006923997492544119, 0.0015534454265955535] and parameters: {'n_layers': 4, 'embedding_dim': 96, 'lr': 0.003175598950751376, 'lambda_val': 1.0477656620736208e-06, 'batch_size': 3749, 'optimizer': 'RMSprop'}.
2026-07-02 10:37:20,058 - experiment_functions - INFO - Early stopping at epoch 700. Best Metrics: (0.0019438833261859446, 0.0005622779856771081, 0.0012659050393474844)
2026-07-02 10:37:20,142 - optuna.study.study - INFO - Trial 271 finished with values: [0.0019438833261859446, 0.0005622779856771081, 0.0012659050393474844] and parameters: {'n_layers': 3, 'embedding_dim': 128, 'lr': 0.012667180168152681, 'lambda_val': 1.0477656620736208e-06, 'batch_size': 529, 'optimizer': 'Adam'}.
2026-07-02 10:39:05,800 - experiment_functions - INFO - Early stopping at epoch 1250. Best Metrics: (0.00019008667810122183, 5.318845810459131e-05, 0.0001131548090811403)
2026-07-02 10:39:05,883 - optuna.study.study - INFO - Trial 272 finished with values: [0.00019008667810122183, 5.318845810459131e-05, 0.0001131548090811403] and parameters: {'n_layers': 4, 'embedding_dim': 96, 'lr': 2.0863387650580164e-05, 'lambda_val': 1.0477656620736208e-06, 'batch_size': 1471, 'optimizer': 'RMSprop'}.
2026-07-02 10:40:44,915 - experiment_functions - INFO - Early stopping at epoch 1100. Best Metrics: (0.0026542742765341197, 0.0007683832608323994, 0.0017742711202841008)
2026-07-02 10:40:45,003 - optuna.study.study - INFO - Trial 273 finished with values: [0.0026542742765341197, 0.0007683832608323994, 0.0017742711202841008] and parameters: {'n_layers': 4, 'embedding_dim': 128, 'lr': 0.0014374939555211086, 'lambda_val': 2.188289071859108e-05, 'batch_size': 3749, 'optimizer': 'RMSprop'}.
2026-07-02 10:45:57,370 - optuna.study.study - INFO - Trial 274 finished with values: [0.0005387318449999583, 0.0001548164048401497, 0.0003182814585534804] and parameters: {'n_layers': 4, 'embedding_dim': 64, 'lr': 0.00015552685174359876, 'lambda_val': 5.9712928804209935e-06, 'batch_size': 2302, 'optimizer': 'RMSprop'}.
2026-07-02 10:51:04,336 - experiment_functions - INFO - Early stopping at epoch 3700. Best Metrics: (0.002754901539542738, 0.0007883289326216211, 0.0018366881276644987)
2026-07-02 10:51:04,424 - optuna.study.study - INFO - Trial 275 finished with values: [0.002754901539542738, 0.0007883289326216211, 0.0018366881276644987] and parameters: {'n_layers': 4, 'embedding_dim': 96, 'lr': 0.0014374939555211086, 'lambda_val': 0.00010858880627123378, 'batch_size': 539, 'optimizer': 'Adam'}.
2026-07-02 10:55:40,166 - experiment_functions - INFO - Early stopping at epoch 3250. Best Metrics: (0.0021439722004703153, 0.0005613281917823832, 0.001432014358355934)
2026-07-02 10:55:40,260 - optuna.study.study - INFO - Trial 276 finished with values: [0.0021439722004703153, 0.0005613281917823832, 0.001432014358355934] and parameters: {'n_layers': 1, 'embedding_dim': 256, 'lr': 0.0014374939555211086, 'lambda_val': 2.188289071859108e-05, 'batch_size': 1399, 'optimizer': 'RMSprop'}.
2026-07-02 10:56:26,747 - experiment_functions - INFO - Early stopping at epoch 500. Best Metrics: (0.00017740032906777593, 5.128887031514162e-05, 0.00011032043952908452)
2026-07-02 10:56:26,891 - optuna.study.study - INFO - Trial 277 finished with values: [0.00017740032906777593, 5.128887031514162e-05, 0.00011032043952908452] and parameters: {'n_layers': 4, 'embedding_dim': 128, 'lr': 0.01321022891213974, 'lambda_val': 1.3509843414861852e-06, 'batch_size': 3470, 'optimizer': 'SGD'}.
2026-07-02 11:02:20,943 - experiment_functions - INFO - Early stopping at epoch 3900. Best Metrics: (0.0020222692702732627, 0.0005964705658872025, 0.0014072639126284086)
2026-07-02 11:02:21,015 - optuna.study.study - INFO - Trial 278 finished with values: [0.0020222692702732627, 0.0005964705658872025, 0.0014072639126284086] and parameters: {'n_layers': 2, 'embedding_dim': 256, 'lr': 0.0028258902906977677, 'lambda_val': 1.0477656620736208e-06, 'batch_size': 2223, 'optimizer': 'RMSprop'}.
2026-07-02 11:04:14,555 - experiment_functions - INFO - Early stopping at epoch 1400. Best Metrics: (0.0027522819122243617, 0.0007873791387268963, 0.0018765037937268454)
2026-07-02 11:04:14,664 - optuna.study.study - INFO - Trial 279 finished with values: [0.0027522819122243617, 0.0007873791387268963, 0.0018765037937268454] and parameters: {'n_layers': 4, 'embedding_dim': 64, 'lr': 0.0014374939555211086, 'lambda_val': 0.00010858880627123378, 'batch_size': 2754, 'optimizer': 'RMSprop'}.
2026-07-02 11:05:36,798 - experiment_functions - INFO - Early stopping at epoch 900. Best Metrics: (0.0024026246731198336, 0.0006876507797807876, 0.0016095512372018544)
2026-07-02 11:05:36,874 - optuna.study.study - INFO - Trial 280 finished with values: [0.0024026246731198336, 0.0006876507797807876, 0.0016095512372018544] and parameters: {'n_layers': 4, 'embedding_dim': 128, 'lr': 0.003175598950751376, 'lambda_val': 1.0477656620736208e-06, 'batch_size': 2754, 'optimizer': 'Adam'}.
2026-07-02 11:08:02,221 - experiment_functions - INFO - Early stopping at epoch 1850. Best Metrics: (0.002876808350638128, 0.0007655338791482248, 0.0019429049335993734)
2026-07-02 11:08:02,306 - optuna.study.study - INFO - Trial 281 finished with values: [0.002876808350638128, 0.0007655338791482248, 0.0019429049335993734] and parameters: {'n_layers': 3, 'embedding_dim': 64, 'lr': 0.0014374939555211086, 'lambda_val': 2.188289071859108e-05, 'batch_size': 2754, 'optimizer': 'RMSprop'}.
2026-07-02 11:13:19,183 - optuna.study.study - INFO - Trial 282 finished with values: [0.002302245976089823, 0.0006819520164124385, 0.0015946057999001028] and parameters: {'n_layers': 4, 'embedding_dim': 64, 'lr': 0.0005462517735220497, 'lambda_val': 2.188289071859108e-05, 'batch_size': 3871, 'optimizer': 'Adam'}.
2026-07-02 11:14:03,843 - experiment_functions - INFO - Early stopping at epoch 500. Best Metrics: (0.0002522785840174686, 6.078680926239006e-05, 0.00013800193924895084)
2026-07-02 11:14:03,917 - optuna.study.study - INFO - Trial 283 finished with values: [0.0002522785840174686, 6.078680926239006e-05, 0.00013800193924895084] and parameters: {'n_layers': 4, 'embedding_dim': 96, 'lr': 0.0028258902906977677, 'lambda_val': 2.188289071859108e-05, 'batch_size': 539, 'optimizer': 'SGD'}.
2026-07-02 11:15:14,576 - experiment_functions - INFO - Early stopping at epoch 850. Best Metrics: (0.0023527521378320683, 0.0006544079934654181, 0.0015439036320367154)
2026-07-02 11:15:14,658 - optuna.study.study - INFO - Trial 284 finished with values: [0.0023527521378320683, 0.0006544079934654181, 0.0015439036320367154] and parameters: {'n_layers': 4, 'embedding_dim': 64, 'lr': 0.0014374939555211086, 'lambda_val': 0.004754517435859413, 'batch_size': 2754, 'optimizer': 'RMSprop'}.
2026-07-02 11:16:33,265 - experiment_functions - INFO - Early stopping at epoch 950. Best Metrics: (0.002609098695876534, 0.0007493873829379024, 0.0017142660199002582)
2026-07-02 11:16:33,437 - optuna.study.study - INFO - Trial 285 finished with values: [0.002609098695876534, 0.0007493873829379024, 0.0017142660199002582] and parameters: {'n_layers': 4, 'embedding_dim': 64, 'lr': 0.0028258902906977677, 'lambda_val': 1.8310592897560325e-05, 'batch_size': 2754, 'optimizer': 'RMSprop'}.
2026-07-02 11:19:28,940 - experiment_functions - INFO - Early stopping at epoch 2150. Best Metrics: (0.002757118169601042, 0.0007740820242007485, 0.001847986856393535)
2026-07-02 11:19:29,031 - optuna.study.study - INFO - Trial 286 finished with values: [0.002757118169601042, 0.0007740820242007485, 0.001847986856393535] and parameters: {'n_layers': 3, 'embedding_dim': 96, 'lr': 0.001015627472418096, 'lambda_val': 1.2552959645049057e-05, 'batch_size': 3749, 'optimizer': 'RMSprop'}.
2026-07-02 11:21:33,800 - experiment_functions - INFO - Early stopping at epoch 1450. Best Metrics: (0.0027060065660707497, 0.0007797807875690976, 0.0018430572609885966)
2026-07-02 11:21:34,077 - optuna.study.study - INFO - Trial 287 finished with values: [0.0027060065660707497, 0.0007797807875690976, 0.0018430572609885966] and parameters: {'n_layers': 3, 'embedding_dim': 128, 'lr': 0.0014374939555211086, 'lambda_val': 2.188289071859108e-05, 'batch_size': 3749, 'optimizer': 'RMSprop'}.
2026-07-02 11:24:49,592 - experiment_functions - INFO - Early stopping at epoch 2550. Best Metrics: (0.0017975153009030863, 0.0004445035427312274, 0.0012228531967351695)
2026-07-02 11:24:49,662 - optuna.study.study - INFO - Trial 288 finished with values: [0.0017975153009030863, 0.0004445035427312274, 0.0012228531967351695] and parameters: {'n_layers': 1, 'embedding_dim': 96, 'lr': 0.0028258902906977677, 'lambda_val': 0.00010877216929113007, 'batch_size': 3749, 'optimizer': 'Adam'}.
2026-07-02 11:26:07,743 - experiment_functions - INFO - Early stopping at epoch 900. Best Metrics: (0.002142632674092399, 0.0006563075812548677, 0.0015571780131817237)
2026-07-02 11:26:07,845 - optuna.study.study - INFO - Trial 289 finished with values: [0.002142632674092399, 0.0006563075812548677, 0.0015571780131817237] and parameters: {'n_layers': 4, 'embedding_dim': 96, 'lr': 0.0028258902906977677, 'lambda_val': 0.00010877216929113007, 'batch_size': 3749, 'optimizer': 'Adam'}.
2026-07-02 11:27:33,743 - experiment_functions - INFO - Early stopping at epoch 1050. Best Metrics: (0.0013285600545099399, 0.00043215622209980437, 0.0009468611165717351)
2026-07-02 11:27:33,819 - optuna.study.study - INFO - Trial 290 finished with values: [0.0013285600545099399, 0.00043215622209980437, 0.0009468611165717351] and parameters: {'n_layers': 4, 'embedding_dim': 64, 'lr': 0.0014374939555211086, 'lambda_val': 0.06545147277265523, 'batch_size': 3191, 'optimizer': 'Adam'}.
2026-07-02 11:28:50,469 - experiment_functions - INFO - Early stopping at epoch 700. Best Metrics: (0.002368195046917109, 0.000679102634728264, 0.0015330824143651443)
2026-07-02 11:28:50,583 - optuna.study.study - INFO - Trial 291 finished with values: [0.002368195046917109, 0.000679102634728264, 0.0015330824143651443] and parameters: {'n_layers': 4, 'embedding_dim': 256, 'lr': 0.004152271479480873, 'lambda_val': 0.00011010045358496251, 'batch_size': 1840, 'optimizer': 'Adam'}.
2026-07-02 11:30:12,509 - experiment_functions - INFO - Early stopping at epoch 1000. Best Metrics: (0.002720209720904527, 0.0007816803753585473, 0.0017763773354162213)
2026-07-02 11:30:12,708 - optuna.study.study - INFO - Trial 292 finished with values: [0.002720209720904527, 0.0007816803753585473, 0.0017763773354162213] and parameters: {'n_layers': 4, 'embedding_dim': 64, 'lr': 0.0028258902906977677, 'lambda_val': 5.9712928804209935e-06, 'batch_size': 2302, 'optimizer': 'RMSprop'}.
2026-07-02 11:33:46,751 - experiment_functions - INFO - Early stopping at epoch 2700. Best Metrics: (0.00386048672684209, 0.001087514009459947, 0.0026175221554133833)
2026-07-02 11:33:46,829 - optuna.study.study - INFO - Trial 293 finished with values: [0.00386048672684209, 0.001087514009459947, 0.0026175221554133833] and parameters: {'n_layers': 4, 'embedding_dim': 64, 'lr': 0.0014374939555211086, 'lambda_val': 2.188289071859108e-05, 'batch_size': 539, 'optimizer': 'RMSprop'}.
2026-07-02 11:34:31,466 - experiment_functions - INFO - Early stopping at epoch 500. Best Metrics: (0.0002309777916093558, 6.268639705183976e-05, 0.0001568001962804233)
2026-07-02 11:34:31,569 - optuna.study.study - INFO - Trial 294 finished with values: [0.0002309777916093558, 6.268639705183976e-05, 0.0001568001962804233] and parameters: {'n_layers': 4, 'embedding_dim': 96, 'lr': 0.003175598950751376, 'lambda_val': 0.00010466207765939466, 'batch_size': 3749, 'optimizer': 'SGD'}.
2026-07-02 11:37:14,634 - experiment_functions - INFO - Early stopping at epoch 2000. Best Metrics: (0.002459615371650123, 0.0007047470698858348, 0.0017538384378158328)
2026-07-02 11:37:14,718 - optuna.study.study - INFO - Trial 295 finished with values: [0.002459615371650123, 0.0007047470698858348, 0.0017538384378158328] and parameters: {'n_layers': 3, 'embedding_dim': 96, 'lr': 0.0014374939555211086, 'lambda_val': 2.188289071859108e-05, 'batch_size': 2754, 'optimizer': 'RMSprop'}.
2026-07-02 11:38:08,308 - experiment_functions - INFO - Early stopping at epoch 600. Best Metrics: (0.002109680124933216, 0.0005850730391505043, 0.0013913826101524588)
2026-07-02 11:38:08,397 - optuna.study.study - INFO - Trial 296 finished with values: [0.002109680124933216, 0.0005850730391505043, 0.0013913826101524588] and parameters: {'n_layers': 4, 'embedding_dim': 96, 'lr': 0.01321022891213974, 'lambda_val': 0.00010877216929113007, 'batch_size': 3621, 'optimizer': 'Adam'}.
2026-07-02 11:40:42,562 - experiment_functions - INFO - Early stopping at epoch 2050. Best Metrics: (0.0026829478356968565, 0.000708546245464734, 0.0018138486304183706)
2026-07-02 11:40:43,005 - optuna.study.study - INFO - Trial 297 finished with values: [0.0026829478356968565, 0.000708546245464734, 0.0018138486304183706] and parameters: {'n_layers': 3, 'embedding_dim': 32, 'lr': 0.0014374939555211086, 'lambda_val': 2.188289071859108e-05, 'batch_size': 2508, 'optimizer': 'RMSprop'}.
2026-07-02 11:42:43,767 - experiment_functions - INFO - Early stopping at epoch 1500. Best Metrics: (0.003031322562564265, 0.00085671409304181, 0.0020681789930659697)
2026-07-02 11:42:43,851 - optuna.study.study - INFO - Trial 298 finished with values: [0.003031322562564265, 0.00085671409304181, 0.0020681789930659697] and parameters: {'n_layers': 4, 'embedding_dim': 64, 'lr': 0.0014374939555211086, 'lambda_val': 2.2254265826758908e-06, 'batch_size': 2754, 'optimizer': 'RMSprop'}.
2026-07-02 11:44:04,799 - experiment_functions - INFO - Early stopping at epoch 750. Best Metrics: (0.0024494929739810856, 0.0006980985126227608, 0.0015929566085780315)
2026-07-02 11:44:04,872 - optuna.study.study - INFO - Trial 299 finished with values: [0.0024494929739810856, 0.0006980985126227608, 0.0015929566085780315] and parameters: {'n_layers': 4, 'embedding_dim': 256, 'lr': 0.0028258902906977677, 'lambda_val': 2.188289071859108e-05, 'batch_size': 2754, 'optimizer': 'RMSprop'}.
2026-07-02 11:44:04,887 - root - INFO - Selected Trial 293 based on Max ndcg: 0.0026
2026-07-02 11:44:04,887 - root - INFO - Associated Recall: 0.0039
2026-07-02 11:44:04,887 - experiment_functions - INFO - Training the best model ... for e_amazon_1c1dcs_strict_rand5
2026-07-02 11:48:33,296 - experiment_functions - INFO - Early stopping at epoch 3400. Best Metrics: (0.003648929047195547, 0.001045723078092054, 0.0025326770769464628)
2026-07-02 11:48:40,168 - root - INFO -   ** Getting the trainable edges:
2026-07-02 11:48:40,248 - helper_functions - INFO -      Number of nodes: 19061
2026-07-02 11:48:40,248 - helper_functions - INFO -      Ratio: 0.13214597689993207
2026-07-02 11:48:40,248 - helper_functions - INFO -      Number of unique users: 4799
2026-07-02 11:48:40,248 - helper_functions - INFO -      Number of unique items: 14262
2026-07-02 11:48:40,248 - helper_functions - INFO -      Total dominant set edge: 1060523
2026-07-02 11:48:40,248 - helper_functions - INFO -      Trainable edges: 848418.4
2026-07-02 11:48:40,496 - root - INFO -   **** Getting 1060523 dominant set edges
2026-07-02 11:48:40,690 - optuna.storages._rdb.storage - INFO - A new study created in RDB with name: Study_e_amazon_1c1dcs
2026-07-02 11:50:40,796 - experiment_functions - INFO - Early stopping at epoch 1400. Best Metrics: (0.011039862458563815, 0.002680318370913512, 0.0065706599953899054)
2026-07-02 11:50:40,883 - optuna.study.study - INFO - Trial 0 finished with values: [0.011039862458563815, 0.002680318370913512, 0.0065706599953899054] and parameters: {'n_layers': 2, 'embedding_dim': 64, 'lr': 0.0006781284315626388, 'lambda_val': 0.008015948669672757, 'batch_size': 2370, 'optimizer': 'Adam'}.
2026-07-02 11:51:50,575 - experiment_functions - INFO - Early stopping at epoch 500. Best Metrics: (0.00024150508075888627, 6.173660315711492e-05, 0.00013858244942257752)
2026-07-02 11:51:50,654 - optuna.study.study - INFO - Trial 1 finished with values: [0.00024150508075888627, 6.173660315711492e-05, 0.00013858244942257752] and parameters: {'n_layers': 4, 'embedding_dim': 256, 'lr': 0.05561848162385812, 'lambda_val': 0.006272911689093162, 'batch_size': 2391, 'optimizer': 'SGD'}.
2026-07-02 11:52:43,108 - experiment_functions - INFO - Early stopping at epoch 500. Best Metrics: (0.0001856529106598429, 5.698763368349069e-05, 0.00011451165242586712)
2026-07-02 11:52:43,187 - optuna.study.study - INFO - Trial 2 finished with values: [0.0001856529106598429, 5.698763368349069e-05, 0.00011451165242586712] and parameters: {'n_layers': 3, 'embedding_dim': 128, 'lr': 7.823794535608523e-05, 'lambda_val': 2.74195258168681e-05, 'batch_size': 2544, 'optimizer': 'SGD'}.
2026-07-02 11:53:29,743 - experiment_functions - INFO - Early stopping at epoch 500. Best Metrics: (0.00027938194351147635, 7.028474820963851e-05, 0.00014716512607747733)
2026-07-02 11:53:29,892 - optuna.study.study - INFO - Trial 3 finished with values: [0.00027938194351147635, 7.028474820963851e-05, 0.00014716512607747733] and parameters: {'n_layers': 2, 'embedding_dim': 96, 'lr': 0.00011405358156112505, 'lambda_val': 1.2640189666335115e-05, 'batch_size': 1710, 'optimizer': 'SGD'}.
2026-07-02 11:54:20,040 - experiment_functions - INFO - Early stopping at epoch 500. Best Metrics: (0.0002648761057071277, 6.838516042018884e-05, 0.00014488684993142732)
2026-07-02 11:54:20,134 - optuna.study.study - INFO - Trial 4 finished with values: [0.0002648761057071277, 6.838516042018884e-05, 0.00014488684993142732] and parameters: {'n_layers': 4, 'embedding_dim': 64, 'lr': 2.379628368395934e-05, 'lambda_val': 0.020730549597540626, 'batch_size': 2054, 'optimizer': 'RMSprop'}.
2026-07-02 11:56:43,589 - experiment_functions - INFO - Early stopping at epoch 1500. Best Metrics: (0.011341906961477024, 0.002686017134281861, 0.006704841645269899)
2026-07-02 11:56:43,684 - optuna.study.study - INFO - Trial 5 finished with values: [0.011341906961477024, 0.002686017134281861, 0.006704841645269899] and parameters: {'n_layers': 3, 'embedding_dim': 96, 'lr': 0.0005152458540342933, 'lambda_val': 0.002011391227853155, 'batch_size': 1948, 'optimizer': 'RMSprop'}.
2026-07-02 12:02:01,568 - optuna.study.study - INFO - Trial 6 finished with values: [0.004776482454664883, 0.0011473510248276124, 0.002871096818435072] and parameters: {'n_layers': 2, 'embedding_dim': 32, 'lr': 0.00018037892110303518, 'lambda_val': 1.1788269361824724e-06, 'batch_size': 3709, 'optimizer': 'RMSprop'}.
2026-07-02 12:02:54,867 - experiment_functions - INFO - Early stopping at epoch 500. Best Metrics: (0.0001890560885385586, 5.5088045894041e-05, 0.00011336206460348676)
2026-07-02 12:02:54,948 - optuna.study.study - INFO - Trial 7 finished with values: [0.0001890560885385586, 5.5088045894041e-05, 0.00011336206460348676] and parameters: {'n_layers': 4, 'embedding_dim': 96, 'lr': 0.0003232594805887862, 'lambda_val': 0.04524808111507399, 'batch_size': 2747, 'optimizer': 'SGD'}.
2026-07-02 12:03:43,506 - experiment_functions - INFO - Early stopping at epoch 500. Best Metrics: (0.00019542943769078707, 5.603783978876583e-05, 0.0001391261839859846)
2026-07-02 12:03:43,614 - optuna.study.study - INFO - Trial 8 finished with values: [0.00019542943769078707, 5.603783978876583e-05, 0.0001391261839859846] and parameters: {'n_layers': 2, 'embedding_dim': 128, 'lr': 1.4212959572497028e-05, 'lambda_val': 3.340818173574891e-05, 'batch_size': 3554, 'optimizer': 'SGD'}.
2026-07-02 12:10:04,534 - experiment_functions - INFO - Early stopping at epoch 3550. Best Metrics: (0.0034901308738538445, 0.001008681116197785, 0.0021563977398042647)
2026-07-02 12:10:04,644 - optuna.study.study - INFO - Trial 9 finished with values: [0.0034901308738538445, 0.001008681116197785, 0.0021563977398042647] and parameters: {'n_layers': 4, 'embedding_dim': 128, 'lr': 0.0036717136369980364, 'lambda_val': 0.029108126899118927, 'batch_size': 2995, 'optimizer': 'Adam'}.
2026-07-02 12:10:48,442 - experiment_functions - INFO - Early stopping at epoch 500. Best Metrics: (0.00013810983068940791, 4.274072526261801e-05, 8.110005835973484e-05)
2026-07-02 12:10:48,887 - optuna.study.study - INFO - Trial 10 finished with values: [0.00013810983068940791, 4.274072526261801e-05, 8.110005835973484e-05] and parameters: {'n_layers': 1, 'embedding_dim': 96, 'lr': 0.06679656996442161, 'lambda_val': 0.0002938177450464669, 'batch_size': 3926, 'optimizer': 'SGD'}.
2026-07-02 12:11:38,651 - experiment_functions - INFO - Early stopping at epoch 500. Best Metrics: (0.00018422290386424116, 5.7937427578215534e-05, 0.00010715795991387346)
2026-07-02 12:11:39,011 - optuna.study.study - INFO - Trial 11 finished with values: [0.00018422290386424116, 5.7937427578215534e-05, 0.00010715795991387346] and parameters: {'n_layers': 3, 'embedding_dim': 96, 'lr': 0.00029105120952486704, 'lambda_val': 0.00014542128962374482, 'batch_size': 1960, 'optimizer': 'SGD'}.
2026-07-02 12:12:34,496 - experiment_functions - INFO - Early stopping at epoch 550. Best Metrics: (0.006914311483026312, 0.0017666166441882112, 0.004550236923280361)
2026-07-02 12:12:34,588 - optuna.study.study - INFO - Trial 12 finished with values: [0.006914311483026312, 0.0017666166441882112, 0.004550236923280361] and parameters: {'n_layers': 3, 'embedding_dim': 96, 'lr': 0.010539985286058167, 'lambda_val': 3.277688503988446e-05, 'batch_size': 2053, 'optimizer': 'RMSprop'}.
2026-07-02 12:15:13,496 - experiment_functions - INFO - Early stopping at epoch 1900. Best Metrics: (0.0002392791625729058, 7.02847482096385e-05, 0.00013811768162094433)
