2026-06-28 02:06:43,323 - optuna.study.study - INFO - Trial 155 finished with values: [0.017769636125017026, 0.004443135839522823, 0.010962498726665233] and parameters: {'n_layers': 1, 'embedding_dim': 96, 'lr': 0.0007259712952677559, 'lambda_val': 6.447923168817336e-05, 'batch_size': 3568, 'optimizer': 'RMSprop'}.
2026-06-28 02:13:03,338 - optuna.study.study - INFO - Trial 156 finished with values: [0.017469280520850644, 0.003774480937636533, 0.010384764486539693] and parameters: {'n_layers': 3, 'embedding_dim': 64, 'lr': 0.009091499316683776, 'lambda_val': 3.731801442207796e-05, 'batch_size': 1816, 'optimizer': 'RMSprop'}.
2026-06-28 02:18:51,241 - optuna.study.study - INFO - Trial 157 finished with values: [0.02511681389063564, 0.005410026024352716, 0.014560741022093053] and parameters: {'n_layers': 1, 'embedding_dim': 96, 'lr': 0.007515611127205712, 'lambda_val': 0.00011460379227540933, 'batch_size': 3545, 'optimizer': 'RMSprop'}.
2026-06-28 02:19:49,222 - experiment_functions - INFO - Early stopping at epoch 550. Best Metrics: (0.00022506656627798235, 6.268639705183975e-05, 0.00012715383942951003)
2026-06-28 02:19:49,325 - optuna.study.study - INFO - Trial 158 finished with values: [0.00022506656627798235, 6.268639705183975e-05, 0.00012715383942951003] and parameters: {'n_layers': 2, 'embedding_dim': 128, 'lr': 2.959682921222808e-05, 'lambda_val': 0.0006043567828314722, 'batch_size': 4066, 'optimizer': 'Adam'}.
2026-06-28 02:25:34,751 - optuna.study.study - INFO - Trial 159 finished with values: [0.009163347516738547, 0.002104743270710256, 0.005042572134018056] and parameters: {'n_layers': 3, 'embedding_dim': 32, 'lr': 0.001948110338269317, 'lambda_val': 6.447923168817336e-05, 'batch_size': 1116, 'optimizer': 'Adam'}.
2026-06-28 02:28:27,848 - experiment_functions - INFO - Early stopping at epoch 1900. Best Metrics: (0.00827658770965971, 0.001829303041240051, 0.004754540456976189)
2026-06-28 02:28:27,948 - optuna.study.study - INFO - Trial 160 finished with values: [0.00827658770965971, 0.001829303041240051, 0.004754540456976189] and parameters: {'n_layers': 4, 'embedding_dim': 32, 'lr': 0.002544878960896036, 'lambda_val': 0.0010306583376744924, 'batch_size': 2269, 'optimizer': 'Adam'}.
2026-06-28 02:34:18,701 - optuna.study.study - INFO - Trial 161 finished with values: [0.024126126650355326, 0.0051526318788822825, 0.014089901585363392] and parameters: {'n_layers': 1, 'embedding_dim': 96, 'lr': 0.005739501470387607, 'lambda_val': 6.447923168817336e-05, 'batch_size': 2430, 'optimizer': 'RMSprop'}.
2026-06-28 02:41:15,476 - optuna.study.study - INFO - Trial 162 finished with values: [0.01535944492091065, 0.0034249567843777904, 0.00907009291139119] and parameters: {'n_layers': 3, 'embedding_dim': 96, 'lr': 0.005739501470387607, 'lambda_val': 8.747132820486757e-06, 'batch_size': 4065, 'optimizer': 'RMSprop'}.
2026-06-28 02:47:06,642 - optuna.study.study - INFO - Trial 163 finished with values: [0.028049534460454034, 0.0062097524837110354, 0.01734915601021831] and parameters: {'n_layers': 1, 'embedding_dim': 96, 'lr': 0.001948110338269317, 'lambda_val': 1.5450706960350556e-06, 'batch_size': 2430, 'optimizer': 'RMSprop'}.
2026-06-28 02:48:00,990 - experiment_functions - INFO - Early stopping at epoch 500. Best Metrics: (0.00030416970395135974, 6.553577873601427e-05, 0.00017375025972707583)
2026-06-28 02:48:01,076 - optuna.study.study - INFO - Trial 164 finished with values: [0.00030416970395135974, 6.553577873601427e-05, 0.00017375025972707583] and parameters: {'n_layers': 3, 'embedding_dim': 96, 'lr': 1.157239363568431e-05, 'lambda_val': 5.1429527123207e-06, 'batch_size': 3207, 'optimizer': 'SGD'}.
2026-06-28 02:53:37,771 - optuna.study.study - INFO - Trial 165 finished with values: [0.02234718667899933, 0.0049218319624641455, 0.013287178770499458] and parameters: {'n_layers': 1, 'embedding_dim': 64, 'lr': 0.009091499316683776, 'lambda_val': 6.447923168817336e-05, 'batch_size': 3487, 'optimizer': 'RMSprop'}.
2026-06-28 02:59:42,287 - optuna.study.study - INFO - Trial 166 finished with values: [0.02380471189177253, 0.005286552818038486, 0.014031368588661278] and parameters: {'n_layers': 1, 'embedding_dim': 128, 'lr': 0.005739501470387607, 'lambda_val': 0.0006043567828314722, 'batch_size': 2563, 'optimizer': 'RMSprop'}.
2026-06-28 03:07:09,943 - optuna.study.study - INFO - Trial 167 finished with values: [0.016649895038130077, 0.0035693254563759665, 0.009818751128167701] and parameters: {'n_layers': 4, 'embedding_dim': 96, 'lr': 0.009091499316683776, 'lambda_val': 3.731801442207796e-05, 'batch_size': 2430, 'optimizer': 'RMSprop'}.
2026-06-28 03:08:10,992 - experiment_functions - INFO - Early stopping at epoch 700. Best Metrics: (0.00027749620365834986, 5.983701536766521e-05, 0.00017207515078060563)
2026-06-28 03:08:11,083 - optuna.study.study - INFO - Trial 168 finished with values: [0.00027749620365834986, 5.983701536766521e-05, 0.00017207515078060563] and parameters: {'n_layers': 1, 'embedding_dim': 64, 'lr': 6.836792219492351e-05, 'lambda_val': 0.000307769265113033, 'batch_size': 2778, 'optimizer': 'Adam'}.
2026-06-28 03:14:03,876 - optuna.study.study - INFO - Trial 169 finished with values: [0.030163171475425035, 0.006550728491917256, 0.018134914381143626] and parameters: {'n_layers': 1, 'embedding_dim': 96, 'lr': 0.001948110338269317, 'lambda_val': 6.447923168817336e-05, 'batch_size': 4065, 'optimizer': 'RMSprop'}.
2026-06-28 03:14:58,970 - experiment_functions - INFO - Early stopping at epoch 550. Best Metrics: (0.0038349557243241147, 0.0008956556427255285, 0.002569875234602593)
2026-06-28 03:14:59,034 - optuna.study.study - INFO - Trial 170 finished with values: [0.0038349557243241147, 0.0008956556427255285, 0.002569875234602593] and parameters: {'n_layers': 3, 'embedding_dim': 64, 'lr': 0.01636069874707295, 'lambda_val': 0.06080927918522847, 'batch_size': 2978, 'optimizer': 'RMSprop'}.
2026-06-28 03:20:36,368 - optuna.study.study - INFO - Trial 171 finished with values: [0.018794535954527673, 0.004088862716790457, 0.011108628568212854] and parameters: {'n_layers': 2, 'embedding_dim': 32, 'lr': 0.002544878960896036, 'lambda_val': 0.0005255886197318135, 'batch_size': 2269, 'optimizer': 'Adam'}.
2026-06-28 03:26:55,211 - optuna.study.study - INFO - Trial 172 finished with values: [0.018468181941625892, 0.004008130235738845, 0.010715973776937735] and parameters: {'n_layers': 2, 'embedding_dim': 96, 'lr': 0.005739501470387607, 'lambda_val': 6.447923168817336e-05, 'batch_size': 3238, 'optimizer': 'RMSprop'}.
2026-06-28 03:32:59,475 - optuna.study.study - INFO - Trial 173 finished with values: [0.024719296235806994, 0.0053938795281423925, 0.014466733304062472] and parameters: {'n_layers': 1, 'embedding_dim': 128, 'lr': 0.005739501470387607, 'lambda_val': 0.0006043567828314722, 'batch_size': 4066, 'optimizer': 'Adam'}.
2026-06-28 03:37:44,617 - experiment_functions - INFO - Early stopping at epoch 2550. Best Metrics: (0.013553118549746154, 0.0029804532416465627, 0.008058501598480367)
2026-06-28 03:37:44,700 - optuna.study.study - INFO - Trial 174 finished with values: [0.013553118549746154, 0.0029804532416465627, 0.008058501598480367] and parameters: {'n_layers': 4, 'embedding_dim': 96, 'lr': 0.001948110338269317, 'lambda_val': 6.447923168817336e-05, 'batch_size': 3568, 'optimizer': 'Adam'}.
2026-06-28 03:43:06,196 - optuna.study.study - INFO - Trial 175 finished with values: [0.02444023200610085, 0.005187774252987103, 0.014388662075686365] and parameters: {'n_layers': 1, 'embedding_dim': 32, 'lr': 0.005739501470387607, 'lambda_val': 4.470441871474425e-06, 'batch_size': 2292, 'optimizer': 'Adam'}.
2026-06-28 03:48:42,595 - optuna.study.study - INFO - Trial 176 finished with values: [0.00046806783713830227, 0.00011492506126170623, 0.0002787521454795818] and parameters: {'n_layers': 1, 'embedding_dim': 96, 'lr': 0.00035455417831020876, 'lambda_val': 6.447923168817336e-05, 'batch_size': 1186, 'optimizer': 'RMSprop'}.
2026-06-28 03:55:23,364 - optuna.study.study - INFO - Trial 177 finished with values: [0.014663311990720285, 0.0031371692342761627, 0.00850579435505289] and parameters: {'n_layers': 2, 'embedding_dim': 128, 'lr': 0.009091499316683776, 'lambda_val': 3.731801442207796e-05, 'batch_size': 2292, 'optimizer': 'Adam'}.
2026-06-28 04:02:47,735 - optuna.study.study - INFO - Trial 178 finished with values: [0.011446205299669259, 0.0025492468134414837, 0.006853402262157845] and parameters: {'n_layers': 3, 'embedding_dim': 128, 'lr': 0.007515611127205712, 'lambda_val': 6.447923168817336e-05, 'batch_size': 2778, 'optimizer': 'Adam'}.
2026-06-28 04:08:40,196 - optuna.study.study - INFO - Trial 179 finished with values: [0.023732607601544498, 0.005037706817620576, 0.01385498346908926] and parameters: {'n_layers': 1, 'embedding_dim': 96, 'lr': 0.005739501470387607, 'lambda_val': 6.447923168817336e-05, 'batch_size': 2430, 'optimizer': 'RMSprop'}.
2026-06-28 04:14:41,690 - optuna.study.study - INFO - Trial 180 finished with values: [0.02033399783266847, 0.0043747506791026345, 0.012026235253974648] and parameters: {'n_layers': 2, 'embedding_dim': 64, 'lr': 0.009091499316683776, 'lambda_val': 3.731801442207796e-05, 'batch_size': 2430, 'optimizer': 'RMSprop'}.
2026-06-28 04:20:34,827 - optuna.study.study - INFO - Trial 181 finished with values: [0.025011735862369457, 0.005420473757194689, 0.014806912458086186] and parameters: {'n_layers': 1, 'embedding_dim': 96, 'lr': 0.005739501470387607, 'lambda_val': 0.0006043567828314722, 'batch_size': 4066, 'optimizer': 'Adam'}.
2026-06-28 04:23:28,082 - experiment_functions - INFO - Early stopping at epoch 1950. Best Metrics: (0.00026138744405077317, 6.458598484128944e-05, 0.00013463939981673835)
2026-06-28 04:23:28,155 - optuna.study.study - INFO - Trial 182 finished with values: [0.00026138744405077317, 6.458598484128944e-05, 0.00013463939981673835] and parameters: {'n_layers': 2, 'embedding_dim': 64, 'lr': 6.767843319652223e-05, 'lambda_val': 0.0005255886197318135, 'batch_size': 2269, 'optimizer': 'Adam'}.
2026-06-28 04:24:32,846 - experiment_functions - INFO - Early stopping at epoch 550. Best Metrics: (0.010052678042737243, 0.0023222460726022454, 0.005897472999343742)
2026-06-28 04:24:32,920 - optuna.study.study - INFO - Trial 183 finished with values: [0.010052678042737243, 0.0023222460726022454, 0.005897472999343742] and parameters: {'n_layers': 4, 'embedding_dim': 96, 'lr': 0.005739501470387607, 'lambda_val': 0.0006043567828314722, 'batch_size': 2292, 'optimizer': 'RMSprop'}.
2026-06-28 04:30:57,260 - optuna.study.study - INFO - Trial 184 finished with values: [0.01923891357176875, 0.004047071785422563, 0.011373641648497388] and parameters: {'n_layers': 3, 'embedding_dim': 64, 'lr': 0.019921281966616786, 'lambda_val': 3.147388684080306e-05, 'batch_size': 2430, 'optimizer': 'RMSprop'}.
2026-06-28 04:40:28,765 - optuna.study.study - INFO - Trial 185 finished with values: [0.01984381149637302, 0.00430541572478772, 0.011920621897631364] and parameters: {'n_layers': 3, 'embedding_dim': 256, 'lr': 0.007515611127205712, 'lambda_val': 0.00011460379227540933, 'batch_size': 2778, 'optimizer': 'RMSprop'}.
2026-06-28 04:48:41,537 - optuna.study.study - INFO - Trial 186 finished with values: [0.015672907454358863, 0.00336227038732595, 0.009233653908517776] and parameters: {'n_layers': 2, 'embedding_dim': 256, 'lr': 0.005739501470387607, 'lambda_val': 8.960789240600014e-06, 'batch_size': 2269, 'optimizer': 'Adam'}.
2026-06-28 04:49:37,698 - experiment_functions - INFO - Early stopping at epoch 600. Best Metrics: (0.00023626237994888252, 6.268639705183976e-05, 0.00011470853448446272)
2026-06-28 04:49:37,772 - optuna.study.study - INFO - Trial 187 finished with values: [0.00023626237994888252, 6.268639705183976e-05, 0.00011470853448446272] and parameters: {'n_layers': 2, 'embedding_dim': 64, 'lr': 9.685054147677387e-05, 'lambda_val': 3.731801442207796e-05, 'batch_size': 2778, 'optimizer': 'RMSprop'}.
2026-06-28 04:55:58,055 - optuna.study.study - INFO - Trial 188 finished with values: [0.01471595305627433, 0.0035436810212183963, 0.008955833888822906] and parameters: {'n_layers': 3, 'embedding_dim': 64, 'lr': 0.0005928900750652104, 'lambda_val': 6.447923168817336e-05, 'batch_size': 4033, 'optimizer': 'Adam'}.
2026-06-28 05:02:16,694 - optuna.study.study - INFO - Trial 189 finished with values: [0.016838495413257677, 0.0037165435100583173, 0.00988920849430705] and parameters: {'n_layers': 2, 'embedding_dim': 96, 'lr': 0.005739501470387607, 'lambda_val': 0.000307769265113033, 'batch_size': 2915, 'optimizer': 'RMSprop'}.
2026-06-28 05:08:21,131 - optuna.study.study - INFO - Trial 190 finished with values: [0.02403630493797761, 0.005166878787303156, 0.014290427634885016] and parameters: {'n_layers': 1, 'embedding_dim': 128, 'lr': 0.005739501470387607, 'lambda_val': 0.0006043567828314722, 'batch_size': 2896, 'optimizer': 'Adam'}.
2026-06-28 05:15:11,410 - optuna.study.study - INFO - Trial 191 finished with values: [0.009383700027604256, 0.0021693292555515454, 0.0055269651521426665] and parameters: {'n_layers': 3, 'embedding_dim': 96, 'lr': 0.005739501470387607, 'lambda_val': 8.960789240600014e-06, 'batch_size': 1012, 'optimizer': 'Adam'}.
2026-06-28 05:21:16,116 - optuna.study.study - INFO - Trial 192 finished with values: [0.029238060466740136, 0.006501339209391562, 0.017728916043330434] and parameters: {'n_layers': 1, 'embedding_dim': 128, 'lr': 0.0018317416818496054, 'lambda_val': 0.000307769265113033, 'batch_size': 2292, 'optimizer': 'Adam'}.
2026-06-28 05:25:52,099 - experiment_functions - INFO - Early stopping at epoch 2450. Best Metrics: (0.011047024365174983, 0.0024400205155481265, 0.006490870204121349)
2026-06-28 05:25:52,185 - optuna.study.study - INFO - Trial 193 finished with values: [0.011047024365174983, 0.0024400205155481265, 0.006490870204121349] and parameters: {'n_layers': 4, 'embedding_dim': 96, 'lr': 0.001948110338269317, 'lambda_val': 6.447923168817336e-05, 'batch_size': 2430, 'optimizer': 'Adam'}.
2026-06-28 05:26:35,912 - experiment_functions - INFO - Early stopping at epoch 500. Best Metrics: (0.00019009747003802388, 5.793742757821554e-05, 0.00012054589850599817)
2026-06-28 05:26:36,004 - optuna.study.study - INFO - Trial 194 finished with values: [0.00019009747003802388, 5.793742757821554e-05, 0.00012054589850599817] and parameters: {'n_layers': 1, 'embedding_dim': 32, 'lr': 0.005739501470387607, 'lambda_val': 0.0003312399156887171, 'batch_size': 4066, 'optimizer': 'SGD'}.
2026-06-28 05:33:00,533 - optuna.study.study - INFO - Trial 195 finished with values: [0.01262326647845083, 0.003221700890906673, 0.007755977243104306] and parameters: {'n_layers': 3, 'embedding_dim': 64, 'lr': 0.0005553157594056153, 'lambda_val': 6.447923168817336e-05, 'batch_size': 1639, 'optimizer': 'Adam'}.
2026-06-28 05:38:36,913 - optuna.study.study - INFO - Trial 196 finished with values: [0.022027418512008044, 0.004798358756149916, 0.012836991963613808] and parameters: {'n_layers': 1, 'embedding_dim': 64, 'lr': 0.005739501470387607, 'lambda_val': 3.731801442207796e-05, 'batch_size': 2778, 'optimizer': 'RMSprop'}.
2026-06-28 05:45:21,672 - optuna.study.study - INFO - Trial 197 finished with values: [0.018308601274483794, 0.00394259445700283, 0.010683219464442922] and parameters: {'n_layers': 2, 'embedding_dim': 128, 'lr': 0.002544878960896036, 'lambda_val': 0.0003312399156887171, 'batch_size': 2269, 'optimizer': 'Adam'}.
2026-06-28 05:52:12,183 - optuna.study.study - INFO - Trial 198 finished with values: [0.013993954760391829, 0.003047888608172027, 0.00807185365369936] and parameters: {'n_layers': 3, 'embedding_dim': 96, 'lr': 0.001948110338269317, 'lambda_val': 0.00029254234783687136, 'batch_size': 3568, 'optimizer': 'RMSprop'}.
2026-06-28 05:57:48,279 - optuna.study.study - INFO - Trial 199 finished with values: [0.02724688226672372, 0.006050187109397261, 0.016767722721168967] and parameters: {'n_layers': 1, 'embedding_dim': 64, 'lr': 0.001948110338269317, 'lambda_val': 6.447923168817336e-05, 'batch_size': 2430, 'optimizer': 'RMSprop'}.
2026-06-28 05:59:03,898 - experiment_functions - INFO - Early stopping at epoch 850. Best Metrics: (0.00034824789040015176, 7.503371768326274e-05, 0.00019408522029043757)
2026-06-28 05:59:03,977 - optuna.study.study - INFO - Trial 200 finished with values: [0.00034824789040015176, 7.503371768326274e-05, 0.00019408522029043757] and parameters: {'n_layers': 1, 'embedding_dim': 96, 'lr': 0.0003819647488728877, 'lambda_val': 6.447923168817336e-05, 'batch_size': 2430, 'optimizer': 'Adam'}.
2026-06-28 06:03:51,197 - experiment_functions - INFO - Early stopping at epoch 3300. Best Metrics: (0.013994730949311963, 0.003319529662063333, 0.00833699315310004)
2026-06-28 06:03:51,265 - optuna.study.study - INFO - Trial 201 finished with values: [0.013994730949311963, 0.003319529662063333, 0.00833699315310004] and parameters: {'n_layers': 1, 'embedding_dim': 96, 'lr': 0.001948110338269317, 'lambda_val': 0.021200035914608777, 'batch_size': 2292, 'optimizer': 'Adam'}.
2026-06-28 06:09:17,638 - optuna.study.study - INFO - Trial 202 finished with values: [0.02570117435342123, 0.005823186368558023, 0.015882761959859285] and parameters: {'n_layers': 1, 'embedding_dim': 32, 'lr': 0.001948110338269317, 'lambda_val': 8.960789240600014e-06, 'batch_size': 3350, 'optimizer': 'Adam'}.
2026-06-28 06:15:08,358 - optuna.study.study - INFO - Trial 203 finished with values: [0.025087322927207535, 0.005375833444142622, 0.014880975130071595] and parameters: {'n_layers': 1, 'embedding_dim': 96, 'lr': 0.005739501470387607, 'lambda_val': 6.447923168817336e-05, 'batch_size': 2292, 'optimizer': 'Adam'}.
2026-06-28 06:20:58,807 - optuna.study.study - INFO - Trial 204 finished with values: [0.026027041299535435, 0.005564842429192866, 0.015471993605471569] and parameters: {'n_layers': 1, 'embedding_dim': 96, 'lr': 0.0053500991167468115, 'lambda_val': 8.960789240600014e-06, 'batch_size': 2430, 'optimizer': 'Adam'}.
2026-06-28 06:26:57,973 - optuna.study.study - INFO - Trial 205 finished with values: [0.01923454338657227, 0.004213285716999411, 0.011532438964966458] and parameters: {'n_layers': 2, 'embedding_dim': 64, 'lr': 0.009091499316683776, 'lambda_val': 3.731801442207796e-05, 'batch_size': 2778, 'optimizer': 'RMSprop'}.
2026-06-28 06:31:34,340 - experiment_functions - INFO - Early stopping at epoch 2650. Best Metrics: (0.016765087763566618, 0.003637710616796155, 0.009737587662567765)
2026-06-28 06:31:34,506 - optuna.study.study - INFO - Trial 206 finished with values: [0.016765087763566618, 0.003637710616796155, 0.009737587662567765] and parameters: {'n_layers': 3, 'embedding_dim': 96, 'lr': 0.001948110338269317, 'lambda_val': 6.447923168817336e-05, 'batch_size': 3568, 'optimizer': 'Adam'}.
2026-06-28 06:38:33,939 - optuna.study.study - INFO - Trial 207 finished with values: [0.03360087903471231, 0.007199437722014324, 0.02035999057431749] and parameters: {'n_layers': 1, 'embedding_dim': 256, 'lr': 0.0018317416818496054, 'lambda_val': 0.00011460379227540933, 'batch_size': 3545, 'optimizer': 'RMSprop'}.
2026-06-28 06:39:31,624 - experiment_functions - INFO - Early stopping at epoch 600. Best Metrics: (0.009131869912675589, 0.0021028436829208064, 0.0055192677044854895)
2026-06-28 06:39:31,752 - optuna.study.study - INFO - Trial 208 finished with values: [0.009131869912675589, 0.0021028436829208064, 0.0055192677044854895] and parameters: {'n_layers': 1, 'embedding_dim': 128, 'lr': 0.027423642525458636, 'lambda_val': 0.0006043567828314722, 'batch_size': 4066, 'optimizer': 'Adam'}.
2026-06-28 06:42:23,040 - experiment_functions - INFO - Early stopping at epoch 1050. Best Metrics: (0.00017821010157553196, 4.843948863096708e-05, 0.00011180061704515299)
2026-06-28 06:42:23,123 - optuna.study.study - INFO - Trial 209 finished with values: [0.00017821010157553196, 4.843948863096708e-05, 0.00011180061704515299] and parameters: {'n_layers': 4, 'embedding_dim': 256, 'lr': 1.1529636701984241e-05, 'lambda_val': 3.731801442207796e-05, 'batch_size': 3289, 'optimizer': 'RMSprop'}.
2026-06-28 06:48:28,968 - optuna.study.study - INFO - Trial 210 finished with values: [0.03309530233331807, 0.007205136485382672, 0.020232200196125115] and parameters: {'n_layers': 1, 'embedding_dim': 128, 'lr': 0.001948110338269317, 'lambda_val': 2.319444713208817e-05, 'batch_size': 3399, 'optimizer': 'Adam'}.
2026-06-28 06:54:21,048 - optuna.study.study - INFO - Trial 211 finished with values: [0.02486188445836486, 0.005313147047090781, 0.01478690045800604] and parameters: {'n_layers': 1, 'embedding_dim': 96, 'lr': 0.005739501470387607, 'lambda_val': 6.447923168817336e-05, 'batch_size': 2292, 'optimizer': 'Adam'}.
2026-06-28 07:01:08,596 - optuna.study.study - INFO - Trial 212 finished with values: [0.017393511002377404, 0.0037336398001633652, 0.010126158039673611] and parameters: {'n_layers': 2, 'embedding_dim': 128, 'lr': 0.005739501470387607, 'lambda_val': 3.731801442207796e-05, 'batch_size': 4066, 'optimizer': 'Adam'}.
2026-06-28 07:07:14,651 - optuna.study.study - INFO - Trial 213 finished with values: [0.025309384057892317, 0.005524951085614422, 0.014857778929543871] and parameters: {'n_layers': 1, 'embedding_dim': 128, 'lr': 0.005739501470387607, 'lambda_val': 0.0006043567828314722, 'batch_size': 4066, 'optimizer': 'Adam'}.
2026-06-28 07:14:08,479 - optuna.study.study - INFO - Trial 214 finished with values: [0.0168549589609672, 0.0037146439222688677, 0.009681550840339923] and parameters: {'n_layers': 3, 'embedding_dim': 96, 'lr': 0.007515611127205712, 'lambda_val': 0.00011460379227540933, 'batch_size': 3419, 'optimizer': 'RMSprop'}.
2026-06-28 07:19:43,694 - optuna.study.study - INFO - Trial 215 finished with values: [0.02247687528910911, 0.0049218319624641455, 0.01320453517084564] and parameters: {'n_layers': 1, 'embedding_dim': 64, 'lr': 0.005739501470387607, 'lambda_val': 3.731801442207796e-05, 'batch_size': 2778, 'optimizer': 'RMSprop'}.
