2026-07-05 14:24:02,717 - optuna.study.study - INFO - Trial 282 finished with values: [0.010873834492566294, 0.0024656649507056967, 0.006212501016935584] and parameters: {'n_layers': 4, 'embedding_dim': 256, 'lr': 0.0028256479959556857, 'lambda_val': 9.719335288636405e-05, 'batch_size': 1645, 'optimizer': 'Adam'}.
2026-07-05 14:30:16,871 - optuna.study.study - INFO - Trial 283 finished with values: [0.02502605986652082, 0.00528940219972266, 0.014670149684224181] and parameters: {'n_layers': 1, 'embedding_dim': 256, 'lr': 0.00314525224106882, 'lambda_val': 1.4514407124820874e-06, 'batch_size': 1645, 'optimizer': 'RMSprop'}.
2026-07-05 14:36:32,814 - optuna.study.study - INFO - Trial 284 finished with values: [0.024974262374277224, 0.0056322777957183295, 0.015259611648135692] and parameters: {'n_layers': 1, 'embedding_dim': 256, 'lr': 0.0017671653194099594, 'lambda_val': 9.719335288636405e-05, 'batch_size': 2137, 'optimizer': 'Adam'}.
2026-07-05 14:37:14,128 - experiment_functions - INFO - Early stopping at epoch 500. Best Metrics: (0.000286622362601994, 7.123454210436335e-05, 0.00013885579010378541)
2026-07-05 14:37:15,155 - optuna.study.study - INFO - Trial 285 finished with values: [0.000286622362601994, 7.123454210436335e-05, 0.00013885579010378541] and parameters: {'n_layers': 2, 'embedding_dim': 32, 'lr': 0.0017671653194099594, 'lambda_val': 4.380499543621736e-06, 'batch_size': 2137, 'optimizer': 'SGD'}.
2026-07-05 14:43:26,424 - optuna.study.study - INFO - Trial 286 finished with values: [0.023847295179297238, 0.00511274053530384, 0.01386324946737137] and parameters: {'n_layers': 1, 'embedding_dim': 256, 'lr': 0.0032934455374620674, 'lambda_val': 4.331327481478862e-06, 'batch_size': 1171, 'optimizer': 'RMSprop'}.
2026-07-05 14:44:20,553 - experiment_functions - INFO - Early stopping at epoch 500. Best Metrics: (0.00024174158103847841, 6.0786809262390055e-05, 0.0001485410748935446)
2026-07-05 14:44:20,656 - optuna.study.study - INFO - Trial 287 finished with values: [0.00024174158103847841, 6.0786809262390055e-05, 0.0001485410748935446] and parameters: {'n_layers': 2, 'embedding_dim': 256, 'lr': 0.0028256479959556857, 'lambda_val': 1.4514407124820874e-06, 'batch_size': 3907, 'optimizer': 'SGD'}.
2026-07-05 14:50:36,530 - optuna.study.study - INFO - Trial 288 finished with values: [0.028054991664762927, 0.005943810193188079, 0.016552286306007774] and parameters: {'n_layers': 1, 'embedding_dim': 256, 'lr': 0.00314525224106882, 'lambda_val': 4.4393695579434844e-05, 'batch_size': 3907, 'optimizer': 'RMSprop'}.
2026-07-05 14:52:01,041 - experiment_functions - INFO - Early stopping at epoch 1000. Best Metrics: (0.00019720560355356126, 4.3690519157342865e-05, 0.0001051862089687074)
2026-07-05 14:52:01,142 - optuna.study.study - INFO - Trial 289 finished with values: [0.00019720560355356126, 4.3690519157342865e-05, 0.0001051862089687074] and parameters: {'n_layers': 1, 'embedding_dim': 128, 'lr': 4.90478561796116e-05, 'lambda_val': 0.0001483339453277888, 'batch_size': 953, 'optimizer': 'RMSprop'}.
2026-07-05 14:58:28,710 - experiment_functions - INFO - Early stopping at epoch 3900. Best Metrics: (0.011538851102519164, 0.0025748912485990543, 0.0066427012613319075)
2026-07-05 14:58:28,820 - optuna.study.study - INFO - Trial 290 finished with values: [0.011538851102519164, 0.0025748912485990543, 0.0066427012613319075] and parameters: {'n_layers': 4, 'embedding_dim': 128, 'lr': 0.0028256479959556857, 'lambda_val': 3.959696507549483e-06, 'batch_size': 2137, 'optimizer': 'Adam'}.
2026-07-05 15:04:40,698 - optuna.study.study - INFO - Trial 291 finished with values: [0.023170928333825603, 0.004988317535094885, 0.013644433354282075] and parameters: {'n_layers': 1, 'embedding_dim': 256, 'lr': 0.004947459881909782, 'lambda_val': 2.3028734947350154e-05, 'batch_size': 2098, 'optimizer': 'RMSprop'}.
2026-07-05 15:10:09,632 - optuna.study.study - INFO - Trial 292 finished with values: [0.011121368002622482, 0.002830385806280037, 0.007000001382598052] and parameters: {'n_layers': 1, 'embedding_dim': 128, 'lr': 0.0006849856016347202, 'lambda_val': 2.3028734947350154e-05, 'batch_size': 2702, 'optimizer': 'RMSprop'}.
2026-07-05 15:15:24,650 - optuna.study.study - INFO - Trial 293 finished with values: [0.018155231934854056, 0.004326311190471667, 0.010881608988352675] and parameters: {'n_layers': 1, 'embedding_dim': 64, 'lr': 0.0009960690196132256, 'lambda_val': 7.045045135561742e-06, 'batch_size': 3907, 'optimizer': 'RMSprop'}.
2026-07-05 15:16:08,714 - experiment_functions - INFO - Early stopping at epoch 500. Best Metrics: (0.0001947480948749026, 4.179093136789318e-05, 0.00010321694230294038)
2026-07-05 15:16:08,838 - optuna.study.study - INFO - Trial 294 finished with values: [0.0001947480948749026, 4.179093136789318e-05, 0.00010321694230294038] and parameters: {'n_layers': 1, 'embedding_dim': 128, 'lr': 0.007902857667402846, 'lambda_val': 2.3364516179056054e-06, 'batch_size': 1645, 'optimizer': 'SGD'}.
2026-07-05 15:22:06,716 - optuna.study.study - INFO - Trial 295 finished with values: [0.021148621110144514, 0.0046131489466785715, 0.012260786695292257] and parameters: {'n_layers': 2, 'embedding_dim': 128, 'lr': 0.0017671653194099594, 'lambda_val': 7.045045135561742e-06, 'batch_size': 2137, 'optimizer': 'Adam'}.
2026-07-05 15:23:11,477 - experiment_functions - INFO - Early stopping at epoch 500. Best Metrics: (0.0002235855301499524, 5.9837015367665226e-05, 0.00011961494684500782)
2026-07-05 15:23:11,585 - optuna.study.study - INFO - Trial 296 finished with values: [0.0002235855301499524, 5.9837015367665226e-05, 0.00011961494684500782] and parameters: {'n_layers': 4, 'embedding_dim': 256, 'lr': 0.0032934455374620674, 'lambda_val': 4.331327481478862e-06, 'batch_size': 3931, 'optimizer': 'SGD'}.
2026-07-05 15:28:43,705 - optuna.study.study - INFO - Trial 297 finished with values: [0.020819959268523095, 0.004457382747943696, 0.012126171467574422] and parameters: {'n_layers': 1, 'embedding_dim': 128, 'lr': 0.004947459881909782, 'lambda_val': 2.3028734947350154e-05, 'batch_size': 1645, 'optimizer': 'RMSprop'}.
2026-07-05 15:35:01,443 - optuna.study.study - INFO - Trial 298 finished with values: [0.027866438772712658, 0.006071082575081207, 0.01677564601975888] and parameters: {'n_layers': 1, 'embedding_dim': 256, 'lr': 0.0017671653194099594, 'lambda_val': 0.00021475926991733194, 'batch_size': 3907, 'optimizer': 'Adam'}.
2026-07-05 15:41:19,885 - optuna.study.study - INFO - Trial 299 finished with values: [0.02638196180305515, 0.005613281917823832, 0.0158603448500352] and parameters: {'n_layers': 1, 'embedding_dim': 256, 'lr': 0.0032934455374620674, 'lambda_val': 1.4514407124820874e-06, 'batch_size': 3907, 'optimizer': 'Adam'}.
2026-07-05 15:41:19,901 - root - INFO - Selected Trial 236 based on Max ndcg: 0.0168
2026-07-05 15:41:19,901 - root - INFO - Associated Recall: 0.0284
2026-07-05 15:41:19,901 - experiment_functions - INFO - Training the best model ... for e_amazon_1c1dcs_rand3
2026-07-05 15:47:38,582 - root - INFO -   **** Training e_amazon_1c1dcs_rand4
2026-07-05 15:47:38,909 - root - INFO -   **** Getting 858585/2429444 random edges
2026-07-05 15:47:39,449 - optuna.storages._rdb.storage - INFO - A new study created in RDB with name: Study_e_amazon_1c1dcs_rand4
2026-07-05 15:48:22,415 - experiment_functions - INFO - Early stopping at epoch 500. Best Metrics: (0.00023461773598413245, 5.31884581045913e-05, 0.00013211902039715956)
2026-07-05 15:48:22,504 - optuna.study.study - INFO - Trial 0 finished with values: [0.00023461773598413245, 5.31884581045913e-05, 0.00013211902039715956] and parameters: {'n_layers': 2, 'embedding_dim': 64, 'lr': 0.0010066178517023937, 'lambda_val': 0.06448620715803395, 'batch_size': 3497, 'optimizer': 'SGD'}.
2026-07-05 15:49:10,874 - experiment_functions - INFO - Early stopping at epoch 500. Best Metrics: (0.00018866620078793038, 6.553577873601429e-05, 0.00011634689075991484)
2026-07-05 15:49:10,955 - optuna.study.study - INFO - Trial 1 finished with values: [0.00018866620078793038, 6.553577873601429e-05, 0.00011634689075991484] and parameters: {'n_layers': 1, 'embedding_dim': 256, 'lr': 0.0016456725610494573, 'lambda_val': 0.002062935328163689, 'batch_size': 2079, 'optimizer': 'SGD'}.
2026-07-05 15:49:52,273 - experiment_functions - INFO - Early stopping at epoch 500. Best Metrics: (0.00016592503290897053, 5.223866420986646e-05, 0.0001063933733760647)
2026-07-05 15:49:52,370 - optuna.study.study - INFO - Trial 2 finished with values: [0.00016592503290897053, 5.223866420986646e-05, 0.0001063933733760647] and parameters: {'n_layers': 2, 'embedding_dim': 32, 'lr': 1.440626319551017e-05, 'lambda_val': 2.02804315456496e-06, 'batch_size': 1876, 'optimizer': 'SGD'}.
2026-07-05 15:50:51,501 - experiment_functions - INFO - Early stopping at epoch 500. Best Metrics: (0.00027787455448660464, 5.698763368349069e-05, 0.00013443598362223978)
2026-07-05 15:50:51,629 - optuna.study.study - INFO - Trial 3 finished with values: [0.00027787455448660464, 5.698763368349069e-05, 0.00013443598362223978] and parameters: {'n_layers': 3, 'embedding_dim': 256, 'lr': 9.466322549119509e-05, 'lambda_val': 0.03718133598255181, 'batch_size': 1922, 'optimizer': 'SGD'}.
2026-07-05 15:51:34,419 - experiment_functions - INFO - Early stopping at epoch 500. Best Metrics: (0.00022812268059382244, 5.223866420986647e-05, 0.00011725341762737571)
2026-07-05 15:51:34,568 - optuna.study.study - INFO - Trial 4 finished with values: [0.00022812268059382244, 5.223866420986647e-05, 0.00011725341762737571] and parameters: {'n_layers': 1, 'embedding_dim': 96, 'lr': 8.394304668321729e-05, 'lambda_val': 1.2361776211188025e-05, 'batch_size': 3495, 'optimizer': 'SGD'}.
2026-07-05 15:52:21,627 - experiment_functions - INFO - Early stopping at epoch 550. Best Metrics: (0.0021931488346476377, 0.0005850730391505044, 0.0014532130781688577)
2026-07-05 15:52:21,753 - optuna.study.study - INFO - Trial 5 finished with values: [0.0021931488346476377, 0.0005850730391505044, 0.0014532130781688577] and parameters: {'n_layers': 4, 'embedding_dim': 32, 'lr': 0.01406276067877314, 'lambda_val': 0.041881312163002817, 'batch_size': 3397, 'optimizer': 'RMSprop'}.
2026-07-05 15:53:07,476 - experiment_functions - INFO - Early stopping at epoch 500. Best Metrics: (0.00018918185410831233, 5.0339076420416775e-05, 0.000117016387426775)
2026-07-05 15:53:07,611 - optuna.study.study - INFO - Trial 6 finished with values: [0.00018918185410831233, 5.0339076420416775e-05, 0.000117016387426775] and parameters: {'n_layers': 4, 'embedding_dim': 64, 'lr': 0.0019187047078664898, 'lambda_val': 0.003195162925424106, 'batch_size': 2387, 'optimizer': 'SGD'}.
2026-07-05 15:53:57,978 - experiment_functions - INFO - Early stopping at epoch 500. Best Metrics: (0.00021427410353688688, 5.69876336834907e-05, 0.0001296673446688994)
2026-07-05 15:53:58,047 - optuna.study.study - INFO - Trial 7 finished with values: [0.00021427410353688688, 5.69876336834907e-05, 0.0001296673446688994] and parameters: {'n_layers': 3, 'embedding_dim': 128, 'lr': 3.3219927300946406e-05, 'lambda_val': 0.006108186467498693, 'batch_size': 2230, 'optimizer': 'Adam'}.
2026-07-05 15:56:31,811 - experiment_functions - INFO - Early stopping at epoch 1950. Best Metrics: (0.005072971773804335, 0.001425640635981992, 0.0029667185560181583)
2026-07-05 15:56:31,951 - optuna.study.study - INFO - Trial 8 finished with values: [0.005072971773804335, 0.001425640635981992, 0.0029667185560181583] and parameters: {'n_layers': 3, 'embedding_dim': 32, 'lr': 0.0004477568083688352, 'lambda_val': 0.025389792435966986, 'batch_size': 3331, 'optimizer': 'RMSprop'}.
2026-07-05 15:57:13,895 - experiment_functions - INFO - Early stopping at epoch 500. Best Metrics: (0.00017863749764761218, 4.8439488630967084e-05, 0.00010701130690651317)
2026-07-05 15:57:13,983 - optuna.study.study - INFO - Trial 9 finished with values: [0.00017863749764761218, 4.8439488630967084e-05, 0.00010701130690651317] and parameters: {'n_layers': 1, 'embedding_dim': 64, 'lr': 7.49696931619416e-05, 'lambda_val': 3.739024363742545e-05, 'batch_size': 3382, 'optimizer': 'SGD'}.
2026-07-05 16:02:56,536 - experiment_functions - INFO - Early stopping at epoch 3700. Best Metrics: (0.00813928649149651, 0.0018511483008187223, 0.004528569620353406)
2026-07-05 16:02:56,616 - optuna.study.study - INFO - Trial 10 finished with values: [0.00813928649149651, 0.0018511483008187223, 0.004528569620353406] and parameters: {'n_layers': 4, 'embedding_dim': 96, 'lr': 0.002260615499918563, 'lambda_val': 0.002906975496505062, 'batch_size': 2615, 'optimizer': 'Adam'}.
2026-07-05 16:03:50,366 - experiment_functions - INFO - Early stopping at epoch 500. Best Metrics: (0.00019093935417891484, 5.7937427578215534e-05, 0.00011961910182793943)
2026-07-05 16:03:50,483 - optuna.study.study - INFO - Trial 11 finished with values: [0.00019093935417891484, 5.7937427578215534e-05, 0.00011961910182793943] and parameters: {'n_layers': 2, 'embedding_dim': 256, 'lr': 2.7814288402399942e-05, 'lambda_val': 0.00038841840354160716, 'batch_size': 824, 'optimizer': 'SGD'}.
2026-07-05 16:04:48,382 - experiment_functions - INFO - Early stopping at epoch 550. Best Metrics: (0.006325522167010759, 0.001478829094086583, 0.003775304493631621)
2026-07-05 16:04:48,522 - optuna.study.study - INFO - Trial 12 finished with values: [0.006325522167010759, 0.001478829094086583, 0.003775304493631621] and parameters: {'n_layers': 4, 'embedding_dim': 128, 'lr': 0.06492358916018183, 'lambda_val': 0.00023140225629595055, 'batch_size': 3839, 'optimizer': 'Adam'}.
2026-07-05 16:06:44,552 - experiment_functions - INFO - Early stopping at epoch 1250. Best Metrics: (0.00020212471978306437, 5.603783978876584e-05, 0.00010947148462388002)
2026-07-05 16:06:44,910 - optuna.study.study - INFO - Trial 13 finished with values: [0.00020212471978306437, 5.603783978876584e-05, 0.00010947148462388002] and parameters: {'n_layers': 1, 'embedding_dim': 256, 'lr': 3.72152071699729e-05, 'lambda_val': 6.848127262973081e-05, 'batch_size': 2900, 'optimizer': 'RMSprop'}.
2026-07-05 16:07:31,813 - experiment_functions - INFO - Early stopping at epoch 500. Best Metrics: (0.00025541975979608776, 5.413825199931615e-05, 0.00011949647072349479)
2026-07-05 16:07:31,883 - optuna.study.study - INFO - Trial 14 finished with values: [0.00025541975979608776, 5.413825199931615e-05, 0.00011949647072349479] and parameters: {'n_layers': 3, 'embedding_dim': 96, 'lr': 1.605998242071411e-05, 'lambda_val': 0.004458657902295997, 'batch_size': 2808, 'optimizer': 'SGD'}.
2026-07-05 16:10:40,782 - experiment_functions - INFO - Early stopping at epoch 1500. Best Metrics: (0.00024694990462797794, 5.9837015367665226e-05, 0.00012893314760765314)
2026-07-05 16:10:40,873 - optuna.study.study - INFO - Trial 15 finished with values: [0.00024694990462797794, 5.9837015367665226e-05, 0.00012893314760765314] and parameters: {'n_layers': 4, 'embedding_dim': 256, 'lr': 1.3233388040325013e-05, 'lambda_val': 2.798613238286131e-06, 'batch_size': 2654, 'optimizer': 'Adam'}.
2026-07-05 16:14:02,706 - experiment_functions - INFO - Early stopping at epoch 2550. Best Metrics: (0.0002888793076989348, 6.743536652546399e-05, 0.00015622026210125226)
2026-07-05 16:14:02,787 - optuna.study.study - INFO - Trial 16 finished with values: [0.0002888793076989348, 6.743536652546399e-05, 0.00015622026210125226] and parameters: {'n_layers': 4, 'embedding_dim': 32, 'lr': 3.142252320316741e-05, 'lambda_val': 7.042695090433518e-06, 'batch_size': 2594, 'optimizer': 'Adam'}.
2026-07-05 16:15:01,933 - experiment_functions - INFO - Early stopping at epoch 500. Best Metrics: (0.00017969002152900038, 4.9389282525691926e-05, 0.00012394006434394736)
2026-07-05 16:15:02,019 - optuna.study.study - INFO - Trial 17 finished with values: [0.00017969002152900038, 4.9389282525691926e-05, 0.00012394006434394736] and parameters: {'n_layers': 3, 'embedding_dim': 256, 'lr': 0.005764034646582444, 'lambda_val': 7.191704362125245e-06, 'batch_size': 1434, 'optimizer': 'SGD'}.
2026-07-05 16:15:44,658 - experiment_functions - INFO - Early stopping at epoch 500. Best Metrics: (0.000243183271296353, 6.553577873601429e-05, 0.0001328772627643229)
2026-07-05 16:15:44,742 - optuna.study.study - INFO - Trial 18 finished with values: [0.000243183271296353, 6.553577873601429e-05, 0.0001328772627643229] and parameters: {'n_layers': 1, 'embedding_dim': 96, 'lr': 0.0008914583956121026, 'lambda_val': 1.326632387912712e-05, 'batch_size': 3052, 'optimizer': 'SGD'}.
2026-07-05 16:16:56,474 - experiment_functions - INFO - Early stopping at epoch 550. Best Metrics: (0.0036377017136796476, 0.0009336473985145225, 0.0022788322416544267)
2026-07-05 16:16:56,572 - optuna.study.study - INFO - Trial 19 finished with values: [0.0036377017136796476, 0.0009336473985145225, 0.0022788322416544267] and parameters: {'n_layers': 4, 'embedding_dim': 256, 'lr': 0.011820592307196294, 'lambda_val': 0.009008883638359447, 'batch_size': 2404, 'optimizer': 'RMSprop'}.
2026-07-05 16:18:27,293 - experiment_functions - INFO - Early stopping at epoch 1100. Best Metrics: (0.0017867209259728861, 0.0005660771612560075, 0.0011400713327351505)
2026-07-05 16:18:27,358 - optuna.study.study - INFO - Trial 20 finished with values: [0.0017867209259728861, 0.0005660771612560075, 0.0011400713327351505] and parameters: {'n_layers': 1, 'embedding_dim': 96, 'lr': 0.05555783435290665, 'lambda_val': 3.695618130232459e-05, 'batch_size': 4060, 'optimizer': 'RMSprop'}.
2026-07-05 16:20:04,566 - experiment_functions - INFO - Early stopping at epoch 1200. Best Metrics: (0.008887695078004961, 0.0020192618201850202, 0.005311131036479396)
2026-07-05 16:20:04,648 - optuna.study.study - INFO - Trial 21 finished with values: [0.008887695078004961, 0.0020192618201850202, 0.005311131036479396] and parameters: {'n_layers': 3, 'embedding_dim': 32, 'lr': 0.014970220633329265, 'lambda_val': 1.8437185332785566e-05, 'batch_size': 3618, 'optimizer': 'Adam'}.
2026-07-05 16:25:30,660 - optuna.study.study - INFO - Trial 22 finished with values: [0.0016220473552249627, 0.0004426039549417776, 0.0010403259304472767] and parameters: {'n_layers': 1, 'embedding_dim': 128, 'lr': 0.00046943052333612564, 'lambda_val': 0.0013942602714986506, 'batch_size': 2461, 'optimizer': 'Adam'}.
2026-07-05 16:29:42,305 - experiment_functions - INFO - Early stopping at epoch 3250. Best Metrics: (0.00020165108618927578, 5.223866420986646e-05, 0.00010495076314047032)
2026-07-05 16:29:42,388 - optuna.study.study - INFO - Trial 23 finished with values: [0.00020165108618927578, 5.223866420986646e-05, 0.00010495076314047032] and parameters: {'n_layers': 3, 'embedding_dim': 32, 'lr': 4.7630526798488115e-05, 'lambda_val': 0.00019000533324029867, 'batch_size': 2346, 'optimizer': 'RMSprop'}.
2026-07-05 16:30:26,774 - experiment_functions - INFO - Early stopping at epoch 500. Best Metrics: (0.0001649086129153984, 5.793742757821552e-05, 0.00011146855724481015)
2026-07-05 16:30:26,842 - optuna.study.study - INFO - Trial 24 finished with values: [0.0001649086129153984, 5.793742757821552e-05, 0.00011146855724481015] and parameters: {'n_layers': 3, 'embedding_dim': 64, 'lr': 0.00024019407802996546, 'lambda_val': 2.6612699284810097e-06, 'batch_size': 2944, 'optimizer': 'SGD'}.
2026-07-05 16:36:39,606 - optuna.study.study - INFO - Trial 25 finished with values: [0.022519801457574824, 0.004889538970043501, 0.01322996045552728] and parameters: {'n_layers': 1, 'embedding_dim': 256, 'lr': 0.004643736874356213, 'lambda_val': 1.3028958114301324e-06, 'batch_size': 1749, 'optimizer': 'RMSprop'}.
2026-07-05 16:37:46,031 - experiment_functions - INFO - Early stopping at epoch 550. Best Metrics: (0.0038052015519804924, 0.0010096309100925101, 0.0023727909482361372)
2026-07-05 16:37:46,122 - optuna.study.study - INFO - Trial 26 finished with values: [0.0038052015519804924, 0.0010096309100925101, 0.0023727909482361372] and parameters: {'n_layers': 3, 'embedding_dim': 256, 'lr': 0.009228822744585308, 'lambda_val': 0.011720789781497609, 'batch_size': 3299, 'optimizer': 'Adam'}.
2026-07-05 16:38:27,555 - experiment_functions - INFO - Early stopping at epoch 500. Best Metrics: (0.0002751151607413556, 7.503371768326274e-05, 0.00016754675589107805)
2026-07-05 16:38:27,645 - optuna.study.study - INFO - Trial 27 finished with values: [0.0002751151607413556, 7.503371768326274e-05, 0.00016754675589107805] and parameters: {'n_layers': 1, 'embedding_dim': 64, 'lr': 0.06326306615686514, 'lambda_val': 0.00043108648218656955, 'batch_size': 1509, 'optimizer': 'SGD'}.
2026-07-05 16:44:01,122 - optuna.study.study - INFO - Trial 28 finished with values: [0.01155322564288546, 0.0028683775620690316, 0.006724201334583209] and parameters: {'n_layers': 3, 'embedding_dim': 64, 'lr': 0.000628496153565313, 'lambda_val': 1.1602258783212233e-06, 'batch_size': 1120, 'optimizer': 'Adam'}.
2026-07-05 16:44:43,243 - experiment_functions - INFO - Early stopping at epoch 500. Best Metrics: (0.00021144579074817933, 6.55357787360143e-05, 0.00013213519784395869)
2026-07-05 16:44:43,323 - optuna.study.study - INFO - Trial 29 finished with values: [0.00021144579074817933, 6.55357787360143e-05, 0.00013213519784395869] and parameters: {'n_layers': 1, 'embedding_dim': 64, 'lr': 0.00010908557577672226, 'lambda_val': 0.03158923345136703, 'batch_size': 1175, 'optimizer': 'Adam'}.
2026-07-05 16:51:12,284 - optuna.study.study - INFO - Trial 30 finished with values: [0.0013914995077837322, 0.0003713694128374143, 0.0008631707004276317] and parameters: {'n_layers': 4, 'embedding_dim': 128, 'lr': 0.00011496928666132993, 'lambda_val': 2.8481754235506968e-06, 'batch_size': 2265, 'optimizer': 'RMSprop'}.
