2026-06-27 16:46:33,261 - root - INFO - **** Training e_amazon_full
2026-06-27 16:46:33,261 - root - INFO - --- Hardware Check ---
2026-06-27 16:46:33,261 - root - INFO - PyTorch version 2.6.0+cu124
2026-06-27 16:46:33,261 - root - INFO - Is CUDA available? True
2026-06-27 16:46:33,282 - root - INFO - GPU Device Name: NVIDIA GeForce RTX 3090
2026-06-27 16:46:39,880 - helper_functions - INFO - Users: 52643, Items: 91599
2026-06-27 16:46:39,880 - helper_functions - INFO - Edge index: torch.Size([2, 2984108])
2026-06-27 16:46:39,880 - root - INFO - **** Generating the graph:
2026-06-27 16:46:43,689 - helper_functions - INFO - Number of unique users: 52643
2026-06-27 16:46:43,734 - helper_functions - INFO - Number of unique items: 91599
2026-06-27 16:46:43,734 - helper_functions - INFO - Number of nodes: 144242
2026-06-27 16:46:43,783 - helper_functions - INFO - Number of edges: 2984108
2026-06-27 16:46:47,866 - optuna.storages._rdb.storage - INFO - A new study created in RDB with name: Study_e_amazon_full
2026-06-27 16:48:44,135 - experiment_functions - INFO - Early stopping at epoch 800. Best Metrics: (0.00022851690159259415, 5.128887031514162e-05, 0.00012447431740815842)
2026-06-27 16:48:44,231 - optuna.study.study - INFO - Trial 0 finished with values: [0.00022851690159259415, 5.128887031514162e-05, 0.00012447431740815842] and parameters: {'n_layers': 3, 'embedding_dim': 256, 'lr': 1.0420504254047765e-05, 'lambda_val': 0.002864767214859732, 'batch_size': 892, 'optimizer': 'Adam'}.
2026-06-27 16:49:37,351 - experiment_functions - INFO - Early stopping at epoch 500. Best Metrics: (0.00022552997355253392, 6.078680926239006e-05, 0.00013148668464248707)
2026-06-27 16:49:38,002 - optuna.study.study - INFO - Trial 1 finished with values: [0.00022552997355253392, 6.078680926239006e-05, 0.00013148668464248707] and parameters: {'n_layers': 4, 'embedding_dim': 64, 'lr': 0.0005928900750652104, 'lambda_val': 1.0416486521122021e-05, 'batch_size': 4033, 'optimizer': 'SGD'}.
2026-06-27 16:55:43,090 - optuna.study.study - INFO - Trial 2 finished with values: [0.022337295920926772, 0.004794559580571016, 0.013201757188277548] and parameters: {'n_layers': 1, 'embedding_dim': 128, 'lr': 0.005739501470387607, 'lambda_val': 0.0006043567828314722, 'batch_size': 2292, 'optimizer': 'Adam'}.
2026-06-27 16:56:30,309 - experiment_functions - INFO - Early stopping at epoch 500. Best Metrics: (0.0002579309923059887, 5.603783978876584e-05, 0.0001332134648467998)
2026-06-27 16:56:30,415 - optuna.study.study - INFO - Trial 3 finished with values: [0.0002579309923059887, 5.603783978876584e-05, 0.0001332134648467998] and parameters: {'n_layers': 2, 'embedding_dim': 64, 'lr': 2.083390917268887e-05, 'lambda_val': 0.00017023051967133082, 'batch_size': 1373, 'optimizer': 'SGD'}.
2026-06-27 16:57:19,056 - experiment_functions - INFO - Early stopping at epoch 500. Best Metrics: (0.0002695039977739458, 6.648557263073914e-05, 0.00014797045316081707)
2026-06-27 16:57:19,144 - optuna.study.study - INFO - Trial 4 finished with values: [0.0002695039977739458, 6.648557263073914e-05, 0.00014797045316081707] and parameters: {'n_layers': 4, 'embedding_dim': 32, 'lr': 9.69241495647977e-05, 'lambda_val': 6.502857913217847e-05, 'batch_size': 524, 'optimizer': 'SGD'}.
2026-06-27 17:03:41,944 - optuna.study.study - INFO - Trial 5 finished with values: [0.015070898646907362, 0.0032568432650114925, 0.008768184271385733] and parameters: {'n_layers': 3, 'embedding_dim': 64, 'lr': 0.007515611127205712, 'lambda_val': 1.5450706960350556e-06, 'batch_size': 3583, 'optimizer': 'RMSprop'}.
2026-06-27 17:05:12,546 - experiment_functions - INFO - Early stopping at epoch 1000. Best Metrics: (0.008602400414834972, 0.002006914499553597, 0.00515607483555951)
2026-06-27 17:05:12,645 - optuna.study.study - INFO - Trial 6 finished with values: [0.008602400414834972, 0.002006914499553597, 0.00515607483555951] and parameters: {'n_layers': 3, 'embedding_dim': 32, 'lr': 0.016441903411988045, 'lambda_val': 0.00011460379227540933, 'batch_size': 1053, 'optimizer': 'Adam'}.
2026-06-27 17:05:57,188 - experiment_functions - INFO - Early stopping at epoch 500. Best Metrics: (0.0002182034599566963, 5.888722147294038e-05, 0.00011508050859104938)
2026-06-27 17:05:57,284 - optuna.study.study - INFO - Trial 7 finished with values: [0.0002182034599566963, 5.888722147294038e-05, 0.00011508050859104938] and parameters: {'n_layers': 1, 'embedding_dim': 64, 'lr': 0.018551923909154135, 'lambda_val': 0.00038291857999994005, 'batch_size': 1355, 'optimizer': 'SGD'}.
2026-06-27 17:10:48,301 - experiment_functions - INFO - Early stopping at epoch 3600. Best Metrics: (0.013043615446099159, 0.0029994491195410597, 0.007857981925947962)
2026-06-27 17:10:48,405 - optuna.study.study - INFO - Trial 8 finished with values: [0.013043615446099159, 0.0029994491195410597, 0.007857981925947962] and parameters: {'n_layers': 1, 'embedding_dim': 32, 'lr': 0.018682831918637316, 'lambda_val': 8.903407777332816e-06, 'batch_size': 2978, 'optimizer': 'RMSprop'}.
2026-06-27 17:17:23,442 - optuna.study.study - INFO - Trial 9 finished with values: [0.001204087291604126, 0.00031913074862754785, 0.0007631960686595062] and parameters: {'n_layers': 2, 'embedding_dim': 128, 'lr': 0.0001955566655843862, 'lambda_val': 0.0024964471498600837, 'batch_size': 1947, 'optimizer': 'RMSprop'}.
2026-06-27 17:23:27,144 - optuna.study.study - INFO - Trial 10 finished with values: [0.006612088543759238, 0.0017086792166099956, 0.0041105690675174575] and parameters: {'n_layers': 4, 'embedding_dim': 32, 'lr': 0.000242059070964804, 'lambda_val': 1.3394226593367904e-06, 'batch_size': 3727, 'optimizer': 'Adam'}.
2026-06-27 17:24:19,390 - experiment_functions - INFO - Early stopping at epoch 550. Best Metrics: (0.00024213725085570672, 6.17366031571149e-05, 0.00013134427597954416)
2026-06-27 17:24:19,478 - optuna.study.study - INFO - Trial 11 finished with values: [0.00024213725085570672, 6.17366031571149e-05, 0.00013134427597954416] and parameters: {'n_layers': 2, 'embedding_dim': 64, 'lr': 5.3888437948279316e-05, 'lambda_val': 0.0029318193295530402, 'batch_size': 1519, 'optimizer': 'Adam'}.
2026-06-27 17:30:20,774 - optuna.study.study - INFO - Trial 12 finished with values: [0.019796567775000603, 0.004323461808787493, 0.011692043128912664] and parameters: {'n_layers': 2, 'embedding_dim': 64, 'lr': 0.009091499316683776, 'lambda_val': 3.731801442207796e-05, 'batch_size': 2778, 'optimizer': 'RMSprop'}.
2026-06-27 17:31:24,076 - experiment_functions - INFO - Early stopping at epoch 500. Best Metrics: (0.00019188177981406247, 4.9389282525691926e-05, 0.0001028123201908065)
2026-06-27 17:31:24,153 - optuna.study.study - INFO - Trial 13 finished with values: [0.00019188177981406247, 4.9389282525691926e-05, 0.0001028123201908065] and parameters: {'n_layers': 4, 'embedding_dim': 128, 'lr': 9.59879064012746e-05, 'lambda_val': 1.704637702438046e-05, 'batch_size': 1768, 'optimizer': 'SGD'}.
2026-06-27 17:32:14,068 - experiment_functions - INFO - Early stopping at epoch 500. Best Metrics: (0.0002520663034623653, 5.698763368349069e-05, 0.00013088408307155848)
2026-06-27 17:32:14,153 - optuna.study.study - INFO - Trial 14 finished with values: [0.0002520663034623653, 5.698763368349069e-05, 0.00013088408307155848] and parameters: {'n_layers': 2, 'embedding_dim': 96, 'lr': 0.024630641752941412, 'lambda_val': 0.0006253121873271663, 'batch_size': 2468, 'optimizer': 'SGD'}.
2026-06-27 17:33:29,067 - experiment_functions - INFO - Early stopping at epoch 650. Best Metrics: (0.0001940493632348846, 4.179093136789317e-05, 0.00010284204936745189)
2026-06-27 17:33:29,140 - optuna.study.study - INFO - Trial 15 finished with values: [0.0001940493632348846, 4.179093136789317e-05, 0.00010284204936745189] and parameters: {'n_layers': 3, 'embedding_dim': 128, 'lr': 1.4907477674101118e-05, 'lambda_val': 0.0005683508304106412, 'batch_size': 3412, 'optimizer': 'RMSprop'}.
2026-06-27 17:34:16,919 - experiment_functions - INFO - Early stopping at epoch 500. Best Metrics: (0.00016962315511004345, 5.223866420986647e-05, 0.00010450435792795262)
2026-06-27 17:34:17,073 - optuna.study.study - INFO - Trial 16 finished with values: [0.00016962315511004345, 5.223866420986647e-05, 0.00010450435792795262] and parameters: {'n_layers': 1, 'embedding_dim': 128, 'lr': 0.00016577578070101892, 'lambda_val': 0.004629147498564446, 'batch_size': 2428, 'optimizer': 'RMSprop'}.
2026-06-27 17:35:04,180 - experiment_functions - INFO - Early stopping at epoch 500. Best Metrics: (0.000264897008486864, 7.028474820963851e-05, 0.00014532984860230277)
2026-06-27 17:35:04,259 - optuna.study.study - INFO - Trial 17 finished with values: [0.000264897008486864, 7.028474820963851e-05, 0.00014532984860230277] and parameters: {'n_layers': 2, 'embedding_dim': 64, 'lr': 0.0021025807952068966, 'lambda_val': 4.470441871474425e-06, 'batch_size': 3774, 'optimizer': 'SGD'}.
2026-06-27 17:36:03,269 - experiment_functions - INFO - Early stopping at epoch 550. Best Metrics: (0.007239505995133452, 0.0016080010637691622, 0.004372859810121401)
2026-06-27 17:36:03,364 - optuna.study.study - INFO - Trial 18 finished with values: [0.007239505995133452, 0.0016080010637691622, 0.004372859810121401] and parameters: {'n_layers': 4, 'embedding_dim': 64, 'lr': 0.05498173857332665, 'lambda_val': 6.26312923207909e-05, 'batch_size': 2122, 'optimizer': 'RMSprop'}.
2026-06-27 17:37:13,253 - experiment_functions - INFO - Early stopping at epoch 550. Best Metrics: (0.007154804411791849, 0.001702980453241647, 0.0043291075986803115)
2026-06-27 17:37:13,349 - optuna.study.study - INFO - Trial 19 finished with values: [0.007154804411791849, 0.001702980453241647, 0.0043291075986803115] and parameters: {'n_layers': 4, 'embedding_dim': 128, 'lr': 0.018609867636620366, 'lambda_val': 0.0037300541282091738, 'batch_size': 1385, 'optimizer': 'Adam'}.
2026-06-27 17:38:17,951 - experiment_functions - INFO - Early stopping at epoch 500. Best Metrics: (0.00020734725497265438, 6.078680926239006e-05, 0.00013803808283282423)
2026-06-27 17:38:18,125 - optuna.study.study - INFO - Trial 20 finished with values: [0.00020734725497265438, 6.078680926239006e-05, 0.00013803808283282423] and parameters: {'n_layers': 2, 'embedding_dim': 256, 'lr': 0.0001474338940314324, 'lambda_val': 0.07174773546725781, 'batch_size': 1227, 'optimizer': 'Adam'}.
2026-06-27 17:44:01,100 - optuna.study.study - INFO - Trial 21 finished with values: [0.011618277269412867, 0.0030440894325931274, 0.007198988619344395] and parameters: {'n_layers': 1, 'embedding_dim': 96, 'lr': 0.0007259712952677559, 'lambda_val': 0.0003312399156887171, 'batch_size': 1553, 'optimizer': 'RMSprop'}.
2026-06-27 17:44:46,863 - experiment_functions - INFO - Early stopping at epoch 500. Best Metrics: (0.000210330452580148, 5.5088045894041e-05, 0.00012716515258613678)
2026-06-27 17:44:46,942 - optuna.study.study - INFO - Trial 22 finished with values: [0.000210330452580148, 5.5088045894041e-05, 0.00012716515258613678] and parameters: {'n_layers': 1, 'embedding_dim': 96, 'lr': 0.010501930818024094, 'lambda_val': 0.0011608388320626004, 'batch_size': 2974, 'optimizer': 'SGD'}.
2026-06-27 17:45:37,164 - experiment_functions - INFO - Early stopping at epoch 500. Best Metrics: (0.00018799053677738843, 5.223866420986647e-05, 9.94681028005822e-05)
2026-06-27 17:45:37,258 - optuna.study.study - INFO - Trial 23 finished with values: [0.00018799053677738843, 5.223866420986647e-05, 9.94681028005822e-05] and parameters: {'n_layers': 2, 'embedding_dim': 96, 'lr': 0.002959127645246625, 'lambda_val': 4.7902135332298526e-05, 'batch_size': 1390, 'optimizer': 'SGD'}.
2026-06-27 17:55:05,167 - optuna.study.study - INFO - Trial 24 finished with values: [0.010360576020195196, 0.0027392055923864517, 0.006279213263585756] and parameters: {'n_layers': 3, 'embedding_dim': 256, 'lr': 0.00030208896688504897, 'lambda_val': 0.0035294138736914546, 'batch_size': 3520, 'optimizer': 'RMSprop'}.
2026-06-27 17:55:50,142 - experiment_functions - INFO - Early stopping at epoch 500. Best Metrics: (0.00021521874490997874, 5.508804589404098e-05, 0.00012356005495154209)
2026-06-27 17:55:50,230 - optuna.study.study - INFO - Trial 25 finished with values: [0.00021521874490997874, 5.508804589404098e-05, 0.00012356005495154209] and parameters: {'n_layers': 2, 'embedding_dim': 32, 'lr': 9.09367650976395e-05, 'lambda_val': 3.191524915587339e-05, 'batch_size': 4067, 'optimizer': 'SGD'}.
2026-06-27 17:57:54,257 - experiment_functions - INFO - Early stopping at epoch 1000. Best Metrics: (0.00025719877291658353, 6.36361909465646e-05, 0.00014737863790144595)
2026-06-27 17:57:54,337 - optuna.study.study - INFO - Trial 26 finished with values: [0.00025719877291658353, 6.36361909465646e-05, 0.00014737863790144595] and parameters: {'n_layers': 2, 'embedding_dim': 256, 'lr': 1.2581763619514257e-05, 'lambda_val': 1.9678477135193257e-05, 'batch_size': 573, 'optimizer': 'RMSprop'}.
2026-06-27 17:58:44,550 - experiment_functions - INFO - Early stopping at epoch 500. Best Metrics: (0.00019675582972152205, 5.7937427578215534e-05, 0.00012101802237438876)
2026-06-27 17:58:44,734 - optuna.study.study - INFO - Trial 27 finished with values: [0.00019675582972152205, 5.7937427578215534e-05, 0.00012101802237438876] and parameters: {'n_layers': 2, 'embedding_dim': 96, 'lr': 0.00021264071356183733, 'lambda_val': 0.009914972359246377, 'batch_size': 3517, 'optimizer': 'SGD'}.
2026-06-27 18:03:35,584 - experiment_functions - INFO - Early stopping at epoch 2400. Best Metrics: (0.00021435018046023444, 5.5088045894040994e-05, 0.00010710147653245692)
2026-06-27 18:03:35,681 - optuna.study.study - INFO - Trial 28 finished with values: [0.00021435018046023444, 5.5088045894040994e-05, 0.00010710147653245692] and parameters: {'n_layers': 4, 'embedding_dim': 128, 'lr': 3.97922243262506e-05, 'lambda_val': 1.4829208879438583e-05, 'batch_size': 2918, 'optimizer': 'Adam'}.
2026-06-27 18:04:18,357 - experiment_functions - INFO - Early stopping at epoch 500. Best Metrics: (0.0002775374551515824, 6.458598484128944e-05, 0.0001434495183422179)
2026-06-27 18:04:18,444 - optuna.study.study - INFO - Trial 29 finished with values: [0.0002775374551515824, 6.458598484128944e-05, 0.0001434495183422179] and parameters: {'n_layers': 1, 'embedding_dim': 32, 'lr': 0.003411184837942451, 'lambda_val': 1.5546281259714375e-06, 'batch_size': 3364, 'optimizer': 'SGD'}.
2026-06-27 18:05:11,294 - experiment_functions - INFO - Early stopping at epoch 500. Best Metrics: (0.00028644405579932974, 7.21843359990882e-05, 0.00014790221808471784)
2026-06-27 18:05:11,373 - optuna.study.study - INFO - Trial 30 finished with values: [0.00028644405579932974, 7.21843359990882e-05, 0.00014790221808471784] and parameters: {'n_layers': 2, 'embedding_dim': 128, 'lr': 0.0016574512373314515, 'lambda_val': 0.000307769265113033, 'batch_size': 4066, 'optimizer': 'SGD'}.
2026-06-27 18:06:01,394 - experiment_functions - INFO - Early stopping at epoch 500. Best Metrics: (0.000216120821664168, 5.8887221472940384e-05, 0.00011044754833067295)
2026-06-27 18:06:01,705 - optuna.study.study - INFO - Trial 31 finished with values: [0.000216120821664168, 5.8887221472940384e-05, 0.00011044754833067295] and parameters: {'n_layers': 3, 'embedding_dim': 64, 'lr': 7.992849975602242e-05, 'lambda_val': 0.006299559698975352, 'batch_size': 3175, 'optimizer': 'SGD'}.
2026-06-27 18:06:55,071 - experiment_functions - INFO - Early stopping at epoch 500. Best Metrics: (0.0002663071037862999, 6.933495431491367e-05, 0.00014122160657957216)
2026-06-27 18:06:55,165 - optuna.study.study - INFO - Trial 32 finished with values: [0.0002663071037862999, 6.933495431491367e-05, 0.00014122160657957216] and parameters: {'n_layers': 4, 'embedding_dim': 64, 'lr': 0.00038340250686706587, 'lambda_val': 0.044846806234312864, 'batch_size': 1570, 'optimizer': 'SGD'}.
2026-06-27 18:08:18,269 - experiment_functions - INFO - Early stopping at epoch 500. Best Metrics: (0.00021099264036944482, 5.603783978876585e-05, 0.0001308255928056267)
2026-06-27 18:08:18,378 - optuna.study.study - INFO - Trial 33 finished with values: [0.00021099264036944482, 5.603783978876585e-05, 0.0001308255928056267] and parameters: {'n_layers': 4, 'embedding_dim': 256, 'lr': 3.0423833841986916e-05, 'lambda_val': 0.010678671070411105, 'batch_size': 2978, 'optimizer': 'SGD'}.
2026-06-27 18:09:12,749 - experiment_functions - INFO - Early stopping at epoch 500. Best Metrics: (0.00019953696422214367, 5.223866420986646e-05, 0.00010334699702481442)
2026-06-27 18:09:12,856 - optuna.study.study - INFO - Trial 34 finished with values: [0.00019953696422214367, 5.223866420986646e-05, 0.00010334699702481442] and parameters: {'n_layers': 3, 'embedding_dim': 96, 'lr': 0.06092946055716549, 'lambda_val': 1.6044882912403928e-05, 'batch_size': 1706, 'optimizer': 'SGD'}.
2026-06-27 18:16:34,520 - optuna.study.study - INFO - Trial 35 finished with values: [0.01150736671973754, 0.002914917462910549, 0.007024160443747166] and parameters: {'n_layers': 3, 'embedding_dim': 128, 'lr': 0.00041390450370843926, 'lambda_val': 0.0014974387796867583, 'batch_size': 1679, 'optimizer': 'RMSprop'}.
2026-06-27 18:17:24,975 - experiment_functions - INFO - Early stopping at epoch 550. Best Metrics: (0.00017494086497239148, 4.938928252569192e-05, 0.00010935545637355204)
2026-06-27 18:17:25,067 - optuna.study.study - INFO - Trial 36 finished with values: [0.00017494086497239148, 4.938928252569192e-05, 0.00010935545637355204] and parameters: {'n_layers': 1, 'embedding_dim': 96, 'lr': 2.236000169558455e-05, 'lambda_val': 0.00914442315921884, 'batch_size': 787, 'optimizer': 'Adam'}.
2026-06-27 18:21:53,202 - experiment_functions - INFO - Early stopping at epoch 1650. Best Metrics: (0.00021382816708772427, 6.36361909465646e-05, 0.00012666413815923264)
2026-06-27 18:21:53,295 - optuna.study.study - INFO - Trial 37 finished with values: [0.00021382816708772427, 6.36361909465646e-05, 0.00012666413815923264] and parameters: {'n_layers': 4, 'embedding_dim': 256, 'lr': 3.8703578633214956e-05, 'lambda_val': 0.00015453161922279578, 'batch_size': 2911, 'optimizer': 'Adam'}.
2026-06-27 18:28:31,066 - experiment_functions - INFO - Early stopping at epoch 3850. Best Metrics: (0.014626569772136095, 0.0032046046008016266, 0.008520581191702141)
2026-06-27 18:28:31,154 - optuna.study.study - INFO - Trial 38 finished with values: [0.014626569772136095, 0.0032046046008016266, 0.008520581191702141] and parameters: {'n_layers': 3, 'embedding_dim': 96, 'lr': 0.001948110338269317, 'lambda_val': 6.447923168817336e-05, 'batch_size': 2430, 'optimizer': 'Adam'}.
2026-06-27 18:29:52,002 - experiment_functions - INFO - Early stopping at epoch 1000. Best Metrics: (0.00032201853207322666, 7.978268715688696e-05, 0.00017418059239436811)
2026-06-27 18:29:52,102 - optuna.study.study - INFO - Trial 39 finished with values: [0.00032201853207322666, 7.978268715688696e-05, 0.00017418059239436811] and parameters: {'n_layers': 1, 'embedding_dim': 32, 'lr': 2.0848143570577665e-05, 'lambda_val': 2.214240854863183e-06, 'batch_size': 1413, 'optimizer': 'RMSprop'}.
2026-06-27 18:30:36,680 - experiment_functions - INFO - Early stopping at epoch 500. Best Metrics: (0.00026482368392441533, 7.123454210436335e-05, 0.00015938012468404115)
2026-06-27 18:30:37,039 - optuna.study.study - INFO - Trial 40 finished with values: [0.00026482368392441533, 7.123454210436335e-05, 0.00015938012468404115] and parameters: {'n_layers': 2, 'embedding_dim': 32, 'lr': 3.092584462067544e-05, 'lambda_val': 0.01898585085689479, 'batch_size': 3566, 'optimizer': 'SGD'}.
2026-06-27 18:37:17,345 - optuna.study.study - INFO - Trial 41 finished with values: [0.007726592534855167, 0.0019062363467127633, 0.004757285925761107] and parameters: {'n_layers': 4, 'embedding_dim': 64, 'lr': 0.00022510550270076726, 'lambda_val': 8.248333957774017e-06, 'batch_size': 1931, 'optimizer': 'RMSprop'}.
2026-06-27 18:42:53,124 - optuna.study.study - INFO - Trial 42 finished with values: [0.017584856208429825, 0.0038694603271090173, 0.01061140678931091] and parameters: {'n_layers': 2, 'embedding_dim': 32, 'lr': 0.002544878960896036, 'lambda_val': 0.0005255886197318135, 'batch_size': 2269, 'optimizer': 'Adam'}.
2026-06-27 18:43:39,602 - experiment_functions - INFO - Early stopping at epoch 500. Best Metrics: (0.00019196358686233685, 5.128887031514162e-05, 0.00011675246365710065)
2026-06-27 18:43:39,693 - optuna.study.study - INFO - Trial 43 finished with values: [0.00019196358686233685, 5.128887031514162e-05, 0.00011675246365710065] and parameters: {'n_layers': 3, 'embedding_dim': 32, 'lr': 0.00010004140495901853, 'lambda_val': 0.042074043094936404, 'batch_size': 4091, 'optimizer': 'SGD'}.
2026-06-27 18:44:29,382 - experiment_functions - INFO - Early stopping at epoch 500. Best Metrics: (0.00023500540822469644, 6.458598484128944e-05, 0.0001452599457629824)
2026-06-27 18:44:29,473 - optuna.study.study - INFO - Trial 44 finished with values: [0.00023500540822469644, 6.458598484128944e-05, 0.0001452599457629824] and parameters: {'n_layers': 2, 'embedding_dim': 96, 'lr': 0.0010257952260245208, 'lambda_val': 0.0002748029585243995, 'batch_size': 1946, 'optimizer': 'SGD'}.
2026-06-27 18:45:40,446 - experiment_functions - INFO - Early stopping at epoch 550. Best Metrics: (0.007148760628212027, 0.001761867674714587, 0.004730716240184059)
2026-06-27 18:45:40,549 - optuna.study.study - INFO - Trial 45 finished with values: [0.007148760628212027, 0.001761867674714587, 0.004730716240184059] and parameters: {'n_layers': 2, 'embedding_dim': 256, 'lr': 0.011862659119347791, 'lambda_val': 0.024824909226658653, 'batch_size': 1844, 'optimizer': 'Adam'}.
2026-06-27 18:46:27,771 - experiment_functions - INFO - Early stopping at epoch 500. Best Metrics: (0.00023217162739605325, 6.268639705183976e-05, 0.00015933177026806986)
