2026-07-04 04:47:26,580 - optuna.study.study - INFO - Trial 88 finished with values: [0.00024017209805483035, 7.313412989381305e-05, 0.00013750471529819328] and parameters: {'n_layers': 1, 'embedding_dim': 128, 'lr': 0.07718877906777162, 'lambda_val': 0.06708304755168053, 'batch_size': 2153, 'optimizer': 'SGD'}.
2026-07-04 04:55:40,769 - optuna.study.study - INFO - Trial 89 finished with values: [0.006567814315863412, 0.0017048800410310963, 0.0039255381659058335] and parameters: {'n_layers': 4, 'embedding_dim': 256, 'lr': 0.015216834194850396, 'lambda_val': 0.005222699236026829, 'batch_size': 3506, 'optimizer': 'RMSprop'}.
2026-07-04 04:57:49,619 - experiment_functions - INFO - Early stopping at epoch 1550. Best Metrics: (0.0035650326995278468, 0.0009649905970404424, 0.0021694315483376052)
2026-07-04 04:57:49,768 - optuna.study.study - INFO - Trial 90 finished with values: [0.0035650326995278468, 0.0009649905970404424, 0.0021694315483376052] and parameters: {'n_layers': 1, 'embedding_dim': 128, 'lr': 0.01117512599566325, 'lambda_val': 0.045192697044491914, 'batch_size': 1625, 'optimizer': 'Adam'}.
2026-07-04 05:03:03,408 - optuna.study.study - INFO - Trial 91 finished with values: [0.014332276533707401, 0.0034126094637463673, 0.008573644160716544] and parameters: {'n_layers': 3, 'embedding_dim': 32, 'lr': 0.0006924103134205528, 'lambda_val': 0.000418444762312661, 'batch_size': 2982, 'optimizer': 'Adam'}.
2026-07-04 05:08:23,930 - optuna.study.study - INFO - Trial 92 finished with values: [0.015392214597452925, 0.0035303839066922484, 0.00911899257004088] and parameters: {'n_layers': 1, 'embedding_dim': 96, 'lr': 0.00917953252838311, 'lambda_val': 1.8863610642623192e-06, 'batch_size': 1047, 'optimizer': 'RMSprop'}.
2026-07-04 05:09:13,891 - experiment_functions - INFO - Early stopping at epoch 550. Best Metrics: (0.0018548748188830842, 0.0005584788100982087, 0.0012317951844702376)
2026-07-04 05:09:13,990 - optuna.study.study - INFO - Trial 93 finished with values: [0.0018548748188830842, 0.0005584788100982087, 0.0012317951844702376] and parameters: {'n_layers': 4, 'embedding_dim': 64, 'lr': 0.00236087646104434, 'lambda_val': 0.08526111004844115, 'batch_size': 1583, 'optimizer': 'RMSprop'}.
2026-07-04 05:09:54,645 - experiment_functions - INFO - Early stopping at epoch 500. Best Metrics: (0.00016711519476376316, 5.983701536766521e-05, 0.00010887453188582082)
2026-07-04 05:09:54,745 - optuna.study.study - INFO - Trial 94 finished with values: [0.00016711519476376316, 5.983701536766521e-05, 0.00010887453188582082] and parameters: {'n_layers': 1, 'embedding_dim': 32, 'lr': 0.013444539848276985, 'lambda_val': 0.005222699236026829, 'batch_size': 3506, 'optimizer': 'SGD'}.
2026-07-04 05:14:54,152 - optuna.study.study - INFO - Trial 95 finished with values: [0.008093661850625518, 0.0020828980111315845, 0.004707603652858651] and parameters: {'n_layers': 1, 'embedding_dim': 32, 'lr': 0.0013930224389611008, 'lambda_val': 0.003685586970425944, 'batch_size': 733, 'optimizer': 'Adam'}.
2026-07-04 05:20:50,263 - optuna.study.study - INFO - Trial 96 finished with values: [0.018675675554254534, 0.004241779533841157, 0.010962396683033076] and parameters: {'n_layers': 3, 'embedding_dim': 96, 'lr': 0.000825254884924141, 'lambda_val': 1.9713647311976392e-05, 'batch_size': 3310, 'optimizer': 'Adam'}.
2026-07-04 05:26:14,337 - optuna.study.study - INFO - Trial 97 finished with values: [0.0059768208174154226, 0.0015253689949281009, 0.003605394012771253] and parameters: {'n_layers': 1, 'embedding_dim': 128, 'lr': 0.0008496123911369606, 'lambda_val': 0.0030408745239375477, 'batch_size': 733, 'optimizer': 'RMSprop'}.
2026-07-04 05:27:06,215 - experiment_functions - INFO - Early stopping at epoch 550. Best Metrics: (0.008230974833364683, 0.00192713181239671, 0.005086393336925428)
2026-07-04 05:27:06,399 - optuna.study.study - INFO - Trial 98 finished with values: [0.008230974833364683, 0.00192713181239671, 0.005086393336925428] and parameters: {'n_layers': 2, 'embedding_dim': 128, 'lr': 0.039464971202713, 'lambda_val': 0.0002512734421382798, 'batch_size': 3362, 'optimizer': 'Adam'}.
2026-07-04 05:27:50,179 - experiment_functions - INFO - Early stopping at epoch 500. Best Metrics: (0.0002221649864056922, 5.7937427578215534e-05, 0.00012084771129367301)
2026-07-04 05:27:50,284 - optuna.study.study - INFO - Trial 99 finished with values: [0.0002221649864056922, 5.7937427578215534e-05, 0.00012084771129367301] and parameters: {'n_layers': 1, 'embedding_dim': 128, 'lr': 0.0021980724805079218, 'lambda_val': 1.2056212361873352e-05, 'batch_size': 830, 'optimizer': 'SGD'}.
2026-07-04 05:33:41,066 - optuna.study.study - INFO - Trial 100 finished with values: [0.010624616827858072, 0.0026451759968086925, 0.0063690090690052435] and parameters: {'n_layers': 2, 'embedding_dim': 128, 'lr': 0.015216834194850396, 'lambda_val': 0.005222699236026829, 'batch_size': 3756, 'optimizer': 'RMSprop'}.
2026-07-04 05:34:29,551 - experiment_functions - INFO - Early stopping at epoch 550. Best Metrics: (0.002552751797156109, 0.0007123454210436335, 0.001621054514540214)
2026-07-04 05:34:29,966 - optuna.study.study - INFO - Trial 101 finished with values: [0.002552751797156109, 0.0007123454210436335, 0.001621054514540214] and parameters: {'n_layers': 1, 'embedding_dim': 128, 'lr': 0.039464971202713, 'lambda_val': 1.8863610642623192e-06, 'batch_size': 3362, 'optimizer': 'RMSprop'}.
2026-07-04 05:35:21,945 - experiment_functions - INFO - Early stopping at epoch 500. Best Metrics: (0.0002221649864056922, 5.7937427578215534e-05, 0.00012084771129367301)
2026-07-04 05:35:22,060 - optuna.study.study - INFO - Trial 102 finished with values: [0.0002221649864056922, 5.7937427578215534e-05, 0.00012084771129367301] and parameters: {'n_layers': 4, 'embedding_dim': 128, 'lr': 0.002418408076717017, 'lambda_val': 0.02788180573288284, 'batch_size': 3170, 'optimizer': 'SGD'}.
2026-07-04 05:40:23,767 - optuna.study.study - INFO - Trial 103 finished with values: [0.010955206440926357, 0.0025207529965997383, 0.006534731132106838] and parameters: {'n_layers': 1, 'embedding_dim': 32, 'lr': 0.01117512599566325, 'lambda_val': 2.693600404305163e-06, 'batch_size': 733, 'optimizer': 'Adam'}.
2026-07-04 05:41:10,558 - experiment_functions - INFO - Early stopping at epoch 550. Best Metrics: (0.004882398971683972, 0.0012328324753528486, 0.003002038889163754)
2026-07-04 05:41:10,706 - optuna.study.study - INFO - Trial 104 finished with values: [0.004882398971683972, 0.0012328324753528486, 0.003002038889163754] and parameters: {'n_layers': 3, 'embedding_dim': 32, 'lr': 0.013444539848276985, 'lambda_val': 0.005222699236026829, 'batch_size': 3310, 'optimizer': 'RMSprop'}.
2026-07-04 05:47:05,594 - optuna.study.study - INFO - Trial 105 finished with values: [0.017689543176774722, 0.004136352411526698, 0.010538331630057634] and parameters: {'n_layers': 2, 'embedding_dim': 128, 'lr': 0.0008496123911369606, 'lambda_val': 0.0030408745239375477, 'batch_size': 3310, 'optimizer': 'Adam'}.
2026-07-04 05:53:59,070 - optuna.study.study - INFO - Trial 106 finished with values: [0.020249179914076175, 0.004426039549417777, 0.0119908374772231] and parameters: {'n_layers': 2, 'embedding_dim': 256, 'lr': 0.00917953252838311, 'lambda_val': 0.0002512734421382798, 'batch_size': 3723, 'optimizer': 'RMSprop'}.
2026-07-04 06:00:08,219 - optuna.study.study - INFO - Trial 107 finished with values: [0.01431015903159262, 0.0034885929753243547, 0.00861182359230884] and parameters: {'n_layers': 1, 'embedding_dim': 256, 'lr': 0.015216834194850396, 'lambda_val': 0.005222699236026829, 'batch_size': 3506, 'optimizer': 'RMSprop'}.
2026-07-04 06:05:22,290 - optuna.study.study - INFO - Trial 108 finished with values: [0.010173396328969521, 0.002503656706494691, 0.006202499633479993] and parameters: {'n_layers': 3, 'embedding_dim': 32, 'lr': 0.0006924103134205528, 'lambda_val': 0.0035495522176334305, 'batch_size': 2982, 'optimizer': 'Adam'}.
2026-07-04 06:06:35,607 - experiment_functions - INFO - Early stopping at epoch 850. Best Metrics: (0.0002098116989350385, 6.268639705183975e-05, 0.00012998916920548538)
2026-07-04 06:06:35,705 - optuna.study.study - INFO - Trial 109 finished with values: [0.0002098116989350385, 6.268639705183975e-05, 0.00012998916920548538] and parameters: {'n_layers': 2, 'embedding_dim': 96, 'lr': 3.297998487091687e-05, 'lambda_val': 1.8863610642623192e-06, 'batch_size': 2929, 'optimizer': 'RMSprop'}.
2026-07-04 06:12:48,713 - optuna.study.study - INFO - Trial 110 finished with values: [0.01656809629036418, 0.00364245958626978, 0.00991683838297296] and parameters: {'n_layers': 1, 'embedding_dim': 256, 'lr': 0.01117512599566325, 'lambda_val': 5.385694884049571e-05, 'batch_size': 3865, 'optimizer': 'Adam'}.
2026-07-04 06:18:41,204 - optuna.study.study - INFO - Trial 111 finished with values: [0.012741437720625342, 0.0028056911650171912, 0.0074758921593584245] and parameters: {'n_layers': 2, 'embedding_dim': 128, 'lr': 0.010561378130282784, 'lambda_val': 0.0002512734421382798, 'batch_size': 2838, 'optimizer': 'Adam'}.
2026-07-04 06:20:15,931 - experiment_functions - INFO - Early stopping at epoch 1100. Best Metrics: (0.017949543960507092, 0.003897954143950763, 0.010541759649842473)
2026-07-04 06:20:16,005 - optuna.study.study - INFO - Trial 112 finished with values: [0.017949543960507092, 0.003897954143950763, 0.010541759649842473] and parameters: {'n_layers': 1, 'embedding_dim': 128, 'lr': 0.008660151763754238, 'lambda_val': 2.0003344352285716e-06, 'batch_size': 4003, 'optimizer': 'Adam'}.
2026-07-04 06:25:33,031 - optuna.study.study - INFO - Trial 113 finished with values: [0.007511441097226584, 0.0018558972702923467, 0.004507629132056998] and parameters: {'n_layers': 1, 'embedding_dim': 96, 'lr': 0.002418408076717017, 'lambda_val': 0.02788180573288284, 'batch_size': 1047, 'optimizer': 'RMSprop'}.
2026-07-04 06:29:56,959 - experiment_functions - INFO - Early stopping at epoch 3350. Best Metrics: (0.0002222662832358279, 5.1288870315141624e-05, 0.00012680502074942902)
2026-07-04 06:29:58,182 - optuna.study.study - INFO - Trial 114 finished with values: [0.0002222662832358279, 5.1288870315141624e-05, 0.00012680502074942902] and parameters: {'n_layers': 2, 'embedding_dim': 64, 'lr': 5.1853579048336826e-05, 'lambda_val': 0.000418444762312661, 'batch_size': 2982, 'optimizer': 'Adam'}.
2026-07-04 06:30:52,285 - experiment_functions - INFO - Early stopping at epoch 550. Best Metrics: (0.0020412022272794004, 0.000446403130520677, 0.0012010245426550361)
2026-07-04 06:30:52,933 - optuna.study.study - INFO - Trial 115 finished with values: [0.0020412022272794004, 0.000446403130520677, 0.0012010245426550361] and parameters: {'n_layers': 4, 'embedding_dim': 96, 'lr': 0.08990770476388815, 'lambda_val': 0.04520049155677577, 'batch_size': 3485, 'optimizer': 'Adam'}.
2026-07-04 06:36:01,370 - optuna.study.study - INFO - Trial 116 finished with values: [0.009022107883641974, 0.0022586098816556807, 0.005315323331071532] and parameters: {'n_layers': 2, 'embedding_dim': 32, 'lr': 0.0013930224389611008, 'lambda_val': 0.010714233222348575, 'batch_size': 1726, 'optimizer': 'RMSprop'}.
2026-07-04 06:36:50,482 - experiment_functions - INFO - Early stopping at epoch 500. Best Metrics: (0.00015688002409292305, 5.413825199931615e-05, 0.00010036307486192763)
2026-07-04 06:36:50,570 - optuna.study.study - INFO - Trial 117 finished with values: [0.00015688002409292305, 5.413825199931615e-05, 0.00010036307486192763] and parameters: {'n_layers': 3, 'embedding_dim': 128, 'lr': 0.0006924103134205528, 'lambda_val': 0.000418444762312661, 'batch_size': 2982, 'optimizer': 'SGD'}.
2026-07-04 06:37:39,675 - experiment_functions - INFO - Early stopping at epoch 550. Best Metrics: (0.005387108971704045, 0.0014113937275611191, 0.0034815329190919257)
2026-07-04 06:37:39,747 - optuna.study.study - INFO - Trial 118 finished with values: [0.005387108971704045, 0.0014113937275611191, 0.0034815329190919257] and parameters: {'n_layers': 2, 'embedding_dim': 96, 'lr': 0.00917953252838311, 'lambda_val': 0.01888436811445225, 'batch_size': 1200, 'optimizer': 'RMSprop'}.
2026-07-04 06:40:00,058 - experiment_functions - INFO - Early stopping at epoch 1550. Best Metrics: (0.017647740471907914, 0.0038846570294246148, 0.010307774133551205)
2026-07-04 06:40:00,135 - optuna.study.study - INFO - Trial 119 finished with values: [0.017647740471907914, 0.0038846570294246148, 0.010307774133551205] and parameters: {'n_layers': 2, 'embedding_dim': 128, 'lr': 0.004214167238747189, 'lambda_val': 5.842035456079482e-06, 'batch_size': 3865, 'optimizer': 'Adam'}.
2026-07-04 06:41:00,062 - experiment_functions - INFO - Early stopping at epoch 550. Best Metrics: (0.0036349054175871007, 0.0007968770776741448, 0.002301953605896744)
2026-07-04 06:41:00,134 - optuna.study.study - INFO - Trial 120 finished with values: [0.0036349054175871007, 0.0007968770776741448, 0.002301953605896744] and parameters: {'n_layers': 2, 'embedding_dim': 256, 'lr': 0.05646473129906133, 'lambda_val': 0.02788180573288284, 'batch_size': 2082, 'optimizer': 'Adam'}.
2026-07-04 06:41:47,513 - experiment_functions - INFO - Early stopping at epoch 500. Best Metrics: (0.0002040728547020824, 5.413825199931616e-05, 0.00011288032995201131)
2026-07-04 06:41:47,604 - optuna.study.study - INFO - Trial 121 finished with values: [0.0002040728547020824, 5.413825199931616e-05, 0.00011288032995201131] and parameters: {'n_layers': 2, 'embedding_dim': 128, 'lr': 0.0003336050455732413, 'lambda_val': 0.044682006756860536, 'batch_size': 1625, 'optimizer': 'Adam'}.
2026-07-04 06:47:41,584 - optuna.study.study - INFO - Trial 122 finished with values: [0.01565097491309455, 0.0033850654407993467, 0.008992845951009746] and parameters: {'n_layers': 2, 'embedding_dim': 128, 'lr': 0.003976153551196258, 'lambda_val': 5.245398963432972e-05, 'batch_size': 1590, 'optimizer': 'Adam'}.
2026-07-04 06:48:28,762 - experiment_functions - INFO - Early stopping at epoch 550. Best Metrics: (0.0013485770948820721, 0.0004084113747316832, 0.0008971802253111636)
2026-07-04 06:48:28,834 - optuna.study.study - INFO - Trial 123 finished with values: [0.0013485770948820721, 0.0004084113747316832, 0.0008971802253111636] and parameters: {'n_layers': 4, 'embedding_dim': 32, 'lr': 0.00236087646104434, 'lambda_val': 0.04329475963657309, 'batch_size': 2383, 'optimizer': 'RMSprop'}.
2026-07-04 06:54:36,833 - optuna.study.study - INFO - Trial 124 finished with values: [0.015010750275655843, 0.0035265847311133493, 0.008936216703340816] and parameters: {'n_layers': 1, 'embedding_dim': 256, 'lr': 0.00917953252838311, 'lambda_val': 0.0016032367653458185, 'batch_size': 1047, 'optimizer': 'RMSprop'}.
2026-07-04 06:55:42,589 - experiment_functions - INFO - Early stopping at epoch 550. Best Metrics: (0.004048480614462178, 0.001022928024618658, 0.0025756658997797633)
2026-07-04 06:55:42,680 - optuna.study.study - INFO - Trial 125 finished with values: [0.004048480614462178, 0.001022928024618658, 0.0025756658997797633] and parameters: {'n_layers': 3, 'embedding_dim': 256, 'lr': 0.015216834194850396, 'lambda_val': 0.005222699236026829, 'batch_size': 2611, 'optimizer': 'RMSprop'}.
2026-07-04 07:01:30,085 - optuna.study.study - INFO - Trial 126 finished with values: [0.000467562878935421, 0.00013202135136675344, 0.0003069635450388711] and parameters: {'n_layers': 2, 'embedding_dim': 128, 'lr': 0.00026307955757801885, 'lambda_val': 0.0002512734421382798, 'batch_size': 1482, 'optimizer': 'Adam'}.
2026-07-04 07:02:24,443 - experiment_functions - INFO - Early stopping at epoch 550. Best Metrics: (0.0069184397022185404, 0.0016849343692418748, 0.004112862768129011)
2026-07-04 07:02:24,526 - optuna.study.study - INFO - Trial 127 finished with values: [0.0069184397022185404, 0.0016849343692418748, 0.004112862768129011] and parameters: {'n_layers': 4, 'embedding_dim': 96, 'lr': 0.00917953252838311, 'lambda_val': 0.0016032367653458185, 'batch_size': 1726, 'optimizer': 'RMSprop'}.
2026-07-04 07:03:13,571 - experiment_functions - INFO - Early stopping at epoch 550. Best Metrics: (0.005596703291620378, 0.0014104439336663946, 0.00345692041050256)
2026-07-04 07:03:13,667 - optuna.study.study - INFO - Trial 128 finished with values: [0.005596703291620378, 0.0014104439336663946, 0.00345692041050256] and parameters: {'n_layers': 1, 'embedding_dim': 128, 'lr': 0.039464971202713, 'lambda_val': 0.0002512734421382798, 'batch_size': 3362, 'optimizer': 'Adam'}.
2026-07-04 07:04:02,819 - experiment_functions - INFO - Early stopping at epoch 550. Best Metrics: (0.002146311797767883, 0.0005280854054670138, 0.0014033793634099098)
2026-07-04 07:04:02,906 - optuna.study.study - INFO - Trial 129 finished with values: [0.002146311797767883, 0.0005280854054670138, 0.0014033793634099098] and parameters: {'n_layers': 3, 'embedding_dim': 64, 'lr': 0.05646473129906133, 'lambda_val': 0.02788180573288284, 'batch_size': 3959, 'optimizer': 'Adam'}.
2026-07-04 07:05:10,368 - experiment_functions - INFO - Early stopping at epoch 800. Best Metrics: (0.010099220057484249, 0.002379233706285736, 0.005980998876277247)
2026-07-04 07:05:10,457 - optuna.study.study - INFO - Trial 130 finished with values: [0.010099220057484249, 0.002379233706285736, 0.005980998876277247] and parameters: {'n_layers': 1, 'embedding_dim': 96, 'lr': 0.010561378130282784, 'lambda_val': 0.003685586970425944, 'batch_size': 2709, 'optimizer': 'Adam'}.
2026-07-04 07:06:17,395 - experiment_functions - INFO - Early stopping at epoch 800. Best Metrics: (0.00018035378973632997, 5.9837015367665226e-05, 0.00012071768944503469)
2026-07-04 07:06:17,485 - optuna.study.study - INFO - Trial 131 finished with values: [0.00018035378973632997, 5.9837015367665226e-05, 0.00012071768944503469] and parameters: {'n_layers': 2, 'embedding_dim': 64, 'lr': 1.1197863953254688e-05, 'lambda_val': 1.3386054080202036e-05, 'batch_size': 4003, 'optimizer': 'Adam'}.
2026-07-04 07:07:05,819 - experiment_functions - INFO - Early stopping at epoch 550. Best Metrics: (0.001672798377283976, 0.0004910434435727447, 0.0010881289551337317)
2026-07-04 07:07:05,882 - optuna.study.study - INFO - Trial 132 finished with values: [0.001672798377283976, 0.0004910434435727447, 0.0010881289551337317] and parameters: {'n_layers': 1, 'embedding_dim': 128, 'lr': 0.039464971202713, 'lambda_val': 0.0011816546074042385, 'batch_size': 1047, 'optimizer': 'RMSprop'}.
2026-07-04 07:12:12,565 - optuna.study.study - INFO - Trial 133 finished with values: [0.010863346693567288, 0.0026698706380715387, 0.006415659381732872] and parameters: {'n_layers': 2, 'embedding_dim': 32, 'lr': 0.0006924103134205528, 'lambda_val': 2.035462829964434e-06, 'batch_size': 1583, 'optimizer': 'Adam'}.
2026-07-04 07:17:32,401 - optuna.study.study - INFO - Trial 134 finished with values: [0.012270140701901583, 0.002925365195752522, 0.007263774093114367] and parameters: {'n_layers': 2, 'embedding_dim': 64, 'lr': 0.0006924103134205528, 'lambda_val': 2.035462829964434e-06, 'batch_size': 1072, 'optimizer': 'RMSprop'}.
2026-07-04 07:22:55,553 - optuna.study.study - INFO - Trial 135 finished with values: [0.003915425493624333, 0.0009868358566191137, 0.0024610372445975554] and parameters: {'n_layers': 1, 'embedding_dim': 128, 'lr': 0.0006838274649075577, 'lambda_val': 0.0030408745239375477, 'batch_size': 834, 'optimizer': 'RMSprop'}.
2026-07-04 07:23:42,563 - experiment_functions - INFO - Early stopping at epoch 550. Best Metrics: (0.0075176978784208415, 0.0018245540717664267, 0.004514549767717046)
2026-07-04 07:23:42,654 - optuna.study.study - INFO - Trial 136 finished with values: [0.0075176978784208415, 0.0018245540717664267, 0.004514549767717046] and parameters: {'n_layers': 4, 'embedding_dim': 32, 'lr': 0.00917953252838311, 'lambda_val': 0.001352604896930111, 'batch_size': 1047, 'optimizer': 'RMSprop'}.
2026-07-04 07:29:17,066 - optuna.study.study - INFO - Trial 137 finished with values: [0.0245263280351449, 0.005543946963508919, 0.014699360866216725] and parameters: {'n_layers': 1, 'embedding_dim': 128, 'lr': 0.0013930224389611008, 'lambda_val': 5.842035456079482e-06, 'batch_size': 3865, 'optimizer': 'Adam'}.
2026-07-04 07:35:51,402 - experiment_functions - INFO - Early stopping at epoch 3500. Best Metrics: (0.0034695292028718953, 0.0009564424519879186, 0.002048115882741975)
2026-07-04 07:35:51,486 - optuna.study.study - INFO - Trial 138 finished with values: [0.0034695292028718953, 0.0009564424519879186, 0.002048115882741975] and parameters: {'n_layers': 3, 'embedding_dim': 256, 'lr': 0.002418408076717017, 'lambda_val': 0.044682006756860536, 'batch_size': 2058, 'optimizer': 'Adam'}.
2026-07-04 07:36:33,910 - experiment_functions - INFO - Early stopping at epoch 500. Best Metrics: (0.00027276546149258504, 6.553577873601427e-05, 0.00014290452523564796)
2026-07-04 07:36:34,003 - optuna.study.study - INFO - Trial 139 finished with values: [0.00027276546149258504, 6.553577873601427e-05, 0.00014290452523564796] and parameters: {'n_layers': 4, 'embedding_dim': 32, 'lr': 0.010561378130282784, 'lambda_val': 2.6608629307271085e-05, 'batch_size': 3310, 'optimizer': 'SGD'}.
2026-07-04 07:38:12,282 - experiment_functions - INFO - Early stopping at epoch 1150. Best Metrics: (0.007580994930926128, 0.0017780141709249093, 0.004487887602484305)
2026-07-04 07:38:12,364 - optuna.study.study - INFO - Trial 140 finished with values: [0.007580994930926128, 0.0017780141709249093, 0.004487887602484305] and parameters: {'n_layers': 3, 'embedding_dim': 64, 'lr': 0.019561931826512887, 'lambda_val': 0.0002512734421382798, 'batch_size': 3502, 'optimizer': 'Adam'}.
2026-07-04 07:46:31,107 - optuna.study.study - INFO - Trial 141 finished with values: [0.01808984059055691, 0.0038115228995308013, 0.011044465595551297] and parameters: {'n_layers': 4, 'embedding_dim': 256, 'lr': 0.015216834194850396, 'lambda_val': 5.842035456079482e-06, 'batch_size': 3485, 'optimizer': 'RMSprop'}.
