2026-06-30 21:21:12,606 - optuna.study.study - INFO - Trial 277 finished with values: [0.0015587722260480294, 0.00037231920673213924, 0.0010560505780589746] and parameters: {'n_layers': 2, 'embedding_dim': 64, 'lr': 0.00047890968732408677, 'lambda_val': 0.000180406326209492, 'batch_size': 2156, 'optimizer': 'Adam'}.
2026-06-30 21:23:07,654 - experiment_functions - INFO - Early stopping at epoch 1350. Best Metrics: (0.0025836187058864493, 0.0007816803753585472, 0.0017410616043846347)
2026-06-30 21:23:07,731 - optuna.study.study - INFO - Trial 278 finished with values: [0.0025836187058864493, 0.0007816803753585472, 0.0017410616043846347] and parameters: {'n_layers': 4, 'embedding_dim': 96, 'lr': 0.0025247724250856145, 'lambda_val': 4.2886606921314005e-06, 'batch_size': 2934, 'optimizer': 'RMSprop'}.
2026-06-30 21:26:59,233 - experiment_functions - INFO - Early stopping at epoch 2200. Best Metrics: (0.002404050342748328, 0.0007028474820963851, 0.0016028425885243121)
2026-06-30 21:26:59,323 - optuna.study.study - INFO - Trial 279 finished with values: [0.002404050342748328, 0.0007028474820963851, 0.0016028425885243121] and parameters: {'n_layers': 4, 'embedding_dim': 256, 'lr': 0.000769747194462119, 'lambda_val': 4.2886606921314005e-06, 'batch_size': 3994, 'optimizer': 'Adam'}.
2026-06-30 21:28:03,817 - experiment_functions - INFO - Early stopping at epoch 750. Best Metrics: (0.0018560748974313173, 0.0005518302528351349, 0.0012622759907741832)
2026-06-30 21:28:03,918 - optuna.study.study - INFO - Trial 280 finished with values: [0.0018560748974313173, 0.0005518302528351349, 0.0012622759907741832] and parameters: {'n_layers': 3, 'embedding_dim': 96, 'lr': 0.004974098253366267, 'lambda_val': 0.00020499046063986734, 'batch_size': 3487, 'optimizer': 'Adam'}.
2026-06-30 21:29:10,391 - experiment_functions - INFO - Early stopping at epoch 850. Best Metrics: (0.0021560688796218525, 0.000544231901677336, 0.0013996010122993704)
2026-06-30 21:29:10,475 - optuna.study.study - INFO - Trial 281 finished with values: [0.0021560688796218525, 0.000544231901677336, 0.0013996010122993704] and parameters: {'n_layers': 3, 'embedding_dim': 32, 'lr': 0.003664683492842946, 'lambda_val': 0.00016218839236180774, 'batch_size': 2156, 'optimizer': 'Adam'}.
2026-06-30 21:32:09,614 - experiment_functions - INFO - Early stopping at epoch 2200. Best Metrics: (0.0029679968363634317, 0.0008852079098835552, 0.0020625438179867543)
2026-06-30 21:32:09,708 - optuna.study.study - INFO - Trial 282 finished with values: [0.0029679968363634317, 0.0008852079098835552, 0.0020625438179867543] and parameters: {'n_layers': 3, 'embedding_dim': 96, 'lr': 0.002537969130795011, 'lambda_val': 6.297092163325562e-06, 'batch_size': 591, 'optimizer': 'RMSprop'}.
2026-06-30 21:37:41,106 - optuna.study.study - INFO - Trial 283 finished with values: [0.0025604268036989574, 0.0006848013980966131, 0.0018031616630373743] and parameters: {'n_layers': 4, 'embedding_dim': 96, 'lr': 0.0006387010239111333, 'lambda_val': 2.8967375826967993e-06, 'batch_size': 591, 'optimizer': 'RMSprop'}.
2026-06-30 21:38:52,046 - experiment_functions - INFO - Early stopping at epoch 650. Best Metrics: (0.002209363810543432, 0.0006582071690443175, 0.0014917377028017102)
2026-06-30 21:38:52,124 - optuna.study.study - INFO - Trial 284 finished with values: [0.002209363810543432, 0.0006582071690443175, 0.0014917377028017102] and parameters: {'n_layers': 4, 'embedding_dim': 256, 'lr': 0.002537969130795011, 'lambda_val': 0.0006597683688978018, 'batch_size': 1897, 'optimizer': 'RMSprop'}.
2026-06-30 21:43:51,464 - optuna.study.study - INFO - Trial 285 finished with values: [0.0022494985254459215, 0.0005271356115722889, 0.0014410276079948043] and parameters: {'n_layers': 4, 'embedding_dim': 32, 'lr': 0.000678453369086835, 'lambda_val': 1.2687145973445492e-05, 'batch_size': 591, 'optimizer': 'RMSprop'}.
2026-06-30 21:45:03,255 - experiment_functions - INFO - Early stopping at epoch 850. Best Metrics: (0.002466429238898285, 0.0007075964515700093, 0.0016340669393496122)
2026-06-30 21:45:03,323 - optuna.study.study - INFO - Trial 286 finished with values: [0.002466429238898285, 0.0007075964515700093, 0.0016340669393496122] and parameters: {'n_layers': 3, 'embedding_dim': 96, 'lr': 0.004124417799899418, 'lambda_val': 0.00020499046063986734, 'batch_size': 591, 'optimizer': 'RMSprop'}.
2026-06-30 21:45:53,217 - experiment_functions - INFO - Early stopping at epoch 550. Best Metrics: (0.0020699662592263955, 0.0005679767490454572, 0.0013329525496174309)
2026-06-30 21:45:53,313 - optuna.study.study - INFO - Trial 287 finished with values: [0.0020699662592263955, 0.0005679767490454572, 0.0013329525496174309] and parameters: {'n_layers': 4, 'embedding_dim': 96, 'lr': 0.02796214114762545, 'lambda_val': 8.114848395188051e-05, 'batch_size': 2368, 'optimizer': 'Adam'}.
2026-06-30 21:46:50,767 - experiment_functions - INFO - Early stopping at epoch 650. Best Metrics: (0.0022484905199523283, 0.000667705107991566, 0.0014620006223795958)
2026-06-30 21:46:50,854 - optuna.study.study - INFO - Trial 288 finished with values: [0.0022484905199523283, 0.000667705107991566, 0.0014620006223795958] and parameters: {'n_layers': 4, 'embedding_dim': 96, 'lr': 0.005907828997735388, 'lambda_val': 6.0087750676311845e-05, 'batch_size': 638, 'optimizer': 'RMSprop'}.
2026-06-30 21:52:07,255 - optuna.study.study - INFO - Trial 289 finished with values: [0.0026145016214548142, 0.0006838516042018884, 0.0017883044599055161] and parameters: {'n_layers': 4, 'embedding_dim': 64, 'lr': 0.000678453369086835, 'lambda_val': 6.297092163325562e-06, 'batch_size': 1192, 'optimizer': 'Adam'}.
2026-06-30 21:57:08,155 - optuna.study.study - INFO - Trial 290 finished with values: [0.002532073001982165, 0.0006895503675702373, 0.0017099021891304681] and parameters: {'n_layers': 4, 'embedding_dim': 32, 'lr': 0.000678453369086835, 'lambda_val': 1.2687145973445492e-05, 'batch_size': 3296, 'optimizer': 'RMSprop'}.
2026-06-30 22:02:41,935 - optuna.study.study - INFO - Trial 291 finished with values: [0.0024412596163974802, 0.0007132952149383583, 0.0017134233318445854] and parameters: {'n_layers': 4, 'embedding_dim': 96, 'lr': 0.000678453369086835, 'lambda_val': 6.297092163325562e-06, 'batch_size': 2932, 'optimizer': 'Adam'}.
2026-06-30 22:05:07,180 - experiment_functions - INFO - Early stopping at epoch 1900. Best Metrics: (0.003204479158103713, 0.0008937560549360789, 0.002159777669821678)
2026-06-30 22:05:07,249 - optuna.study.study - INFO - Trial 292 finished with values: [0.003204479158103713, 0.0008937560549360789, 0.002159777669821678] and parameters: {'n_layers': 4, 'embedding_dim': 32, 'lr': 0.002537969130795011, 'lambda_val': 0.0004266264333481233, 'batch_size': 591, 'optimizer': 'RMSprop'}.
2026-06-30 22:06:21,265 - experiment_functions - INFO - Early stopping at epoch 850. Best Metrics: (0.0022472802561256918, 0.000679102634728264, 0.0015247367625938573)
2026-06-30 22:06:21,354 - optuna.study.study - INFO - Trial 293 finished with values: [0.0022472802561256918, 0.000679102634728264, 0.0015247367625938573] and parameters: {'n_layers': 4, 'embedding_dim': 96, 'lr': 0.004124417799899418, 'lambda_val': 0.00020499046063986734, 'batch_size': 591, 'optimizer': 'RMSprop'}.
2026-06-30 22:07:51,121 - experiment_functions - INFO - Early stopping at epoch 1100. Best Metrics: (0.0024747428041397494, 0.0007208935660961572, 0.0016542515038044225)
2026-06-30 22:07:51,214 - optuna.study.study - INFO - Trial 294 finished with values: [0.0024747428041397494, 0.0007208935660961572, 0.0016542515038044225] and parameters: {'n_layers': 4, 'embedding_dim': 64, 'lr': 0.004974098253366267, 'lambda_val': 4.2886606921314005e-06, 'batch_size': 1094, 'optimizer': 'RMSprop'}.
2026-06-30 22:09:12,864 - experiment_functions - INFO - Early stopping at epoch 750. Best Metrics: (0.0024987608136720703, 0.0007408392378853789, 0.0016762778761206165)
2026-06-30 22:09:12,958 - optuna.study.study - INFO - Trial 295 finished with values: [0.0024987608136720703, 0.0007408392378853789, 0.0016762778761206165] and parameters: {'n_layers': 4, 'embedding_dim': 256, 'lr': 0.002537969130795011, 'lambda_val': 6.297092163325562e-06, 'batch_size': 3549, 'optimizer': 'RMSprop'}.
2026-06-30 22:10:33,573 - experiment_functions - INFO - Early stopping at epoch 1000. Best Metrics: (0.0021800650694286257, 0.0006439602606234447, 0.0015585468999362562)
2026-06-30 22:10:33,653 - optuna.study.study - INFO - Trial 296 finished with values: [0.0021800650694286257, 0.0006439602606234447, 0.0015585468999362562] and parameters: {'n_layers': 3, 'embedding_dim': 64, 'lr': 0.004974098253366267, 'lambda_val': 4.2886606921314005e-06, 'batch_size': 2119, 'optimizer': 'RMSprop'}.
2026-06-30 22:14:04,646 - experiment_functions - INFO - Early stopping at epoch 2400. Best Metrics: (0.0030478452188332, 0.0008852079098835554, 0.0020688326683454506)
2026-06-30 22:14:04,736 - optuna.study.study - INFO - Trial 297 finished with values: [0.0030478452188332, 0.0008852079098835554, 0.0020688326683454506] and parameters: {'n_layers': 4, 'embedding_dim': 128, 'lr': 0.000769747194462119, 'lambda_val': 0.00016218839236180774, 'batch_size': 2156, 'optimizer': 'RMSprop'}.
2026-06-30 22:16:12,217 - experiment_functions - INFO - Early stopping at epoch 1500. Best Metrics: (0.002874661791226928, 0.00085671409304181, 0.0019742403295968524)
2026-06-30 22:16:12,335 - optuna.study.study - INFO - Trial 298 finished with values: [0.002874661791226928, 0.00085671409304181, 0.0019742403295968524] and parameters: {'n_layers': 4, 'embedding_dim': 96, 'lr': 0.00125488673034125, 'lambda_val': 0.00016218839236180774, 'batch_size': 2156, 'optimizer': 'RMSprop'}.
2026-06-30 22:16:59,230 - experiment_functions - INFO - Early stopping at epoch 550. Best Metrics: (0.0013105621966775385, 0.00038846570294246156, 0.0008472443930058294)
2026-06-30 22:16:59,315 - optuna.study.study - INFO - Trial 299 finished with values: [0.0013105621966775385, 0.00038846570294246156, 0.0008472443930058294] and parameters: {'n_layers': 4, 'embedding_dim': 64, 'lr': 0.03147431946013673, 'lambda_val': 0.0004266264333481233, 'batch_size': 591, 'optimizer': 'RMSprop'}.
2026-06-30 22:16:59,332 - root - INFO - Selected Trial 236 based on Max ndcg: 0.0023
2026-06-30 22:16:59,332 - root - INFO - Associated Recall: 0.0034
2026-06-30 22:16:59,332 - experiment_functions - INFO - Training the best model ... for e_amazon_1c1dcs_strict_rand2
2026-06-30 22:23:54,968 - root - INFO -   **** Training e_amazon_1c1dcs_strict_rand3
2026-06-30 22:23:55,003 - root - INFO -   **** Getting 88982/2429444 random edges
2026-06-30 22:23:55,124 - optuna.storages._rdb.storage - INFO - A new study created in RDB with name: Study_e_amazon_1c1dcs_strict_rand3
2026-06-30 22:24:40,426 - experiment_functions - INFO - Early stopping at epoch 500. Best Metrics: (0.00024322887553104665, 4.9389282525691926e-05, 0.00011182522005067172)
2026-06-30 22:24:40,514 - optuna.study.study - INFO - Trial 0 finished with values: [0.00024322887553104665, 4.9389282525691926e-05, 0.00011182522005067172] and parameters: {'n_layers': 3, 'embedding_dim': 128, 'lr': 0.00022111787961490072, 'lambda_val': 0.00015887328132148092, 'batch_size': 2473, 'optimizer': 'SGD'}.
2026-06-30 22:27:56,360 - experiment_functions - INFO - Early stopping at epoch 2400. Best Metrics: (0.0011175900384388213, 0.0003713694128374143, 0.0007830411556738517)
2026-06-30 22:27:56,432 - optuna.study.study - INFO - Trial 1 finished with values: [0.0011175900384388213, 0.0003713694128374143, 0.0007830411556738517] and parameters: {'n_layers': 2, 'embedding_dim': 128, 'lr': 0.06928801192246781, 'lambda_val': 0.03852293779947387, 'batch_size': 3927, 'optimizer': 'RMSprop'}.
2026-06-30 22:28:41,139 - experiment_functions - INFO - Early stopping at epoch 500. Best Metrics: (0.00016767761860324857, 5.223866420986646e-05, 0.00010718888964463872)
2026-06-30 22:28:41,213 - optuna.study.study - INFO - Trial 2 finished with values: [0.00016767761860324857, 5.223866420986646e-05, 0.00010718888964463872] and parameters: {'n_layers': 4, 'embedding_dim': 96, 'lr': 1.9784517990677046e-05, 'lambda_val': 1.5483974753579455e-05, 'batch_size': 2567, 'optimizer': 'SGD'}.
2026-06-30 22:29:22,580 - experiment_functions - INFO - Early stopping at epoch 500. Best Metrics: (0.00018745538001615683, 5.318845810459131e-05, 0.00010427297169040623)
2026-06-30 22:29:22,654 - optuna.study.study - INFO - Trial 3 finished with values: [0.00018745538001615683, 5.318845810459131e-05, 0.00010427297169040623] and parameters: {'n_layers': 2, 'embedding_dim': 64, 'lr': 0.012238012666901596, 'lambda_val': 1.7677984487245155e-06, 'batch_size': 1267, 'optimizer': 'SGD'}.
2026-06-30 22:30:48,649 - experiment_functions - INFO - Early stopping at epoch 1000. Best Metrics: (0.0010436057237025373, 0.0003742187945215889, 0.0007735803692167379)
2026-06-30 22:30:48,738 - optuna.study.study - INFO - Trial 4 finished with values: [0.0010436057237025373, 0.0003742187945215889, 0.0007735803692167379] and parameters: {'n_layers': 4, 'embedding_dim': 96, 'lr': 0.02183534419427124, 'lambda_val': 0.004564716452285849, 'batch_size': 3159, 'optimizer': 'RMSprop'}.
2026-06-30 22:31:32,533 - experiment_functions - INFO - Early stopping at epoch 500. Best Metrics: (0.0001950860964571994, 6.268639705183976e-05, 0.00011781614584735324)
2026-06-30 22:31:32,612 - optuna.study.study - INFO - Trial 5 finished with values: [0.0001950860964571994, 6.268639705183976e-05, 0.00011781614584735324] and parameters: {'n_layers': 2, 'embedding_dim': 128, 'lr': 0.00011232539418061215, 'lambda_val': 0.01571503459381708, 'batch_size': 3062, 'optimizer': 'SGD'}.
2026-06-30 22:33:37,360 - experiment_functions - INFO - Early stopping at epoch 1450. Best Metrics: (0.00033450065843774736, 7.123454210436335e-05, 0.00018013579293811195)
2026-06-30 22:33:37,430 - optuna.study.study - INFO - Trial 6 finished with values: [0.00033450065843774736, 7.123454210436335e-05, 0.00018013579293811195] and parameters: {'n_layers': 3, 'embedding_dim': 128, 'lr': 2.7574907624731768e-05, 'lambda_val': 0.00022111146363119937, 'batch_size': 2935, 'optimizer': 'Adam'}.
2026-06-30 22:38:52,119 - optuna.study.study - INFO - Trial 7 finished with values: [0.0008204149417787454, 0.00022795053473396274, 0.0005602561693177539] and parameters: {'n_layers': 4, 'embedding_dim': 64, 'lr': 0.00020384857480906953, 'lambda_val': 0.0001464450995954104, 'batch_size': 3402, 'optimizer': 'RMSprop'}.
2026-06-30 22:41:05,387 - experiment_functions - INFO - Early stopping at epoch 1800. Best Metrics: (0.00030524457463527185, 8.26320688410615e-05, 0.0001726326720086867)
2026-06-30 22:41:05,481 - optuna.study.study - INFO - Trial 8 finished with values: [0.00030524457463527185, 8.26320688410615e-05, 0.0001726326720086867] and parameters: {'n_layers': 1, 'embedding_dim': 32, 'lr': 7.474179240056188e-05, 'lambda_val': 0.0017792658327555892, 'batch_size': 3981, 'optimizer': 'Adam'}.
2026-06-30 22:45:29,930 - experiment_functions - INFO - Early stopping at epoch 3400. Best Metrics: (0.0021709975526811916, 0.00055088045894041, 0.001438519432636567)
2026-06-30 22:45:30,021 - optuna.study.study - INFO - Trial 9 finished with values: [0.0021709975526811916, 0.00055088045894041, 0.001438519432636567] and parameters: {'n_layers': 1, 'embedding_dim': 128, 'lr': 0.0010455025017472735, 'lambda_val': 4.9195072317508555e-06, 'batch_size': 1544, 'optimizer': 'RMSprop'}.
2026-06-30 22:51:03,907 - optuna.study.study - INFO - Trial 10 finished with values: [0.0026200485737192243, 0.0007341906806223051, 0.0018059002160908894] and parameters: {'n_layers': 4, 'embedding_dim': 96, 'lr': 0.0006152603091001123, 'lambda_val': 1.9470910869906704e-05, 'batch_size': 3344, 'optimizer': 'Adam'}.
2026-06-30 22:51:46,451 - experiment_functions - INFO - Early stopping at epoch 500. Best Metrics: (0.00025108806089889303, 5.603783978876584e-05, 0.00013171190596616)
2026-06-30 22:51:46,542 - optuna.study.study - INFO - Trial 11 finished with values: [0.00025108806089889303, 5.603783978876584e-05, 0.00013171190596616] and parameters: {'n_layers': 2, 'embedding_dim': 96, 'lr': 0.0923018895547372, 'lambda_val': 0.02159176770792679, 'batch_size': 1473, 'optimizer': 'SGD'}.
2026-06-30 22:52:26,552 - experiment_functions - INFO - Early stopping at epoch 500. Best Metrics: (0.00022279458189614063, 5.033907642041677e-05, 0.00011579977986754514)
2026-06-30 22:52:26,646 - optuna.study.study - INFO - Trial 12 finished with values: [0.00022279458189614063, 5.033907642041677e-05, 0.00011579977986754514] and parameters: {'n_layers': 2, 'embedding_dim': 32, 'lr': 0.04206871501127293, 'lambda_val': 0.00021201372068132095, 'batch_size': 4025, 'optimizer': 'SGD'}.
2026-06-30 22:53:15,223 - experiment_functions - INFO - Early stopping at epoch 500. Best Metrics: (0.00018109120771189516, 5.888722147294038e-05, 0.00011193897888218772)
2026-06-30 22:53:15,308 - optuna.study.study - INFO - Trial 13 finished with values: [0.00018109120771189516, 5.888722147294038e-05, 0.00011193897888218772] and parameters: {'n_layers': 2, 'embedding_dim': 256, 'lr': 9.429754131927594e-05, 'lambda_val': 0.010824502265804115, 'batch_size': 2414, 'optimizer': 'SGD'}.
2026-06-30 22:53:56,474 - experiment_functions - INFO - Early stopping at epoch 500. Best Metrics: (0.0001751735917677821, 4.843948863096708e-05, 9.77964353098709e-05)
2026-06-30 22:53:56,567 - optuna.study.study - INFO - Trial 14 finished with values: [0.0001751735917677821, 4.843948863096708e-05, 9.77964353098709e-05] and parameters: {'n_layers': 2, 'embedding_dim': 64, 'lr': 6.001158715814208e-05, 'lambda_val': 0.0677794881342781, 'batch_size': 2317, 'optimizer': 'SGD'}.
2026-06-30 22:59:59,537 - optuna.study.study - INFO - Trial 15 finished with values: [0.00043197278502518416, 0.00010827650399863229, 0.0002499204002645923] and parameters: {'n_layers': 2, 'embedding_dim': 256, 'lr': 0.00011721700452597054, 'lambda_val': 0.006082431400646874, 'batch_size': 3031, 'optimizer': 'RMSprop'}.
2026-06-30 23:06:05,966 - optuna.study.study - INFO - Trial 16 finished with values: [0.0014097580443334114, 0.0003666204433637901, 0.000952525221917814] and parameters: {'n_layers': 2, 'embedding_dim': 256, 'lr': 0.0006773858234142329, 'lambda_val': 1.3573657888080551e-06, 'batch_size': 573, 'optimizer': 'Adam'}.
2026-06-30 23:11:29,705 - optuna.study.study - INFO - Trial 17 finished with values: [0.001393894324190669, 0.0003590220922059913, 0.0010009424183091635] and parameters: {'n_layers': 3, 'embedding_dim': 96, 'lr': 0.0002959388978333034, 'lambda_val': 0.002718086981783345, 'batch_size': 3295, 'optimizer': 'Adam'}.
2026-06-30 23:12:28,656 - experiment_functions - INFO - Early stopping at epoch 700. Best Metrics: (0.0023020096532778917, 0.0006743536652546397, 0.0015745009115360176)
2026-06-30 23:12:28,779 - optuna.study.study - INFO - Trial 18 finished with values: [0.0023020096532778917, 0.0006743536652546397, 0.0015745009115360176] and parameters: {'n_layers': 4, 'embedding_dim': 64, 'lr': 0.005034910940629331, 'lambda_val': 4.461595733760336e-06, 'batch_size': 2607, 'optimizer': 'RMSprop'}.
2026-06-30 23:13:35,155 - experiment_functions - INFO - Early stopping at epoch 750. Best Metrics: (0.0002485169749865199, 5.7937427578215534e-05, 0.00013078958158473507)
2026-06-30 23:13:35,249 - optuna.study.study - INFO - Trial 19 finished with values: [0.0002485169749865199, 5.7937427578215534e-05, 0.00013078958158473507] and parameters: {'n_layers': 3, 'embedding_dim': 128, 'lr': 3.2222328944697535e-05, 'lambda_val': 0.024573880374775793, 'batch_size': 2171, 'optimizer': 'Adam'}.
2026-06-30 23:16:35,238 - experiment_functions - INFO - Early stopping at epoch 2100. Best Metrics: (0.0013699597523407416, 0.0004416541610470528, 0.0009197252357906727)
2026-06-30 23:16:35,322 - optuna.study.study - INFO - Trial 20 finished with values: [0.0013699597523407416, 0.0004416541610470528, 0.0009197252357906727] and parameters: {'n_layers': 1, 'embedding_dim': 256, 'lr': 0.04868116684391351, 'lambda_val': 0.0014491207355779936, 'batch_size': 868, 'optimizer': 'RMSprop'}.
2026-06-30 23:18:23,319 - experiment_functions - INFO - Early stopping at epoch 1150. Best Metrics: (0.001938747723856814, 0.0005366335505195373, 0.0012964704708462184)
2026-06-30 23:18:23,408 - optuna.study.study - INFO - Trial 21 finished with values: [0.001938747723856814, 0.0005366335505195373, 0.0012964704708462184] and parameters: {'n_layers': 2, 'embedding_dim': 256, 'lr': 0.0038652724378170286, 'lambda_val': 2.17039496761906e-05, 'batch_size': 3660, 'optimizer': 'RMSprop'}.
2026-06-30 23:19:20,136 - experiment_functions - INFO - Early stopping at epoch 700. Best Metrics: (0.0017530781900127823, 0.0004758467412571473, 0.0011970282453469165)
2026-06-30 23:19:20,209 - optuna.study.study - INFO - Trial 22 finished with values: [0.0017530781900127823, 0.0004758467412571473, 0.0011970282453469165] and parameters: {'n_layers': 2, 'embedding_dim': 64, 'lr': 0.0038571213778042786, 'lambda_val': 0.0007914071498367372, 'batch_size': 3342, 'optimizer': 'RMSprop'}.
2026-06-30 23:20:01,391 - experiment_functions - INFO - Early stopping at epoch 500. Best Metrics: (0.00021362702959900132, 6.078680926239006e-05, 0.0001204916969609202)
2026-06-30 23:20:01,474 - optuna.study.study - INFO - Trial 23 finished with values: [0.00021362702959900132, 6.078680926239006e-05, 0.0001204916969609202] and parameters: {'n_layers': 4, 'embedding_dim': 32, 'lr': 0.0005862900856438068, 'lambda_val': 0.0009417961484636181, 'batch_size': 2776, 'optimizer': 'SGD'}.
2026-06-30 23:21:18,364 - experiment_functions - INFO - Early stopping at epoch 1000. Best Metrics: (0.00023032091246802015, 6.743536652546399e-05, 0.00015900763453044532)
